[I 2025-09-01 10:17:26,056] Trial 478 finished with values: [-0.04201676752322858, 0.042180518073539106] and parameters: {'p_sma': 7, 'p_std': 14, 'p_atr': 29, 'p_adx': 22, 'rsi_period': 7, 'ema1': 20, 'ema2': 46, 'slip_atr_k': 0.1103373353633492, 'slip_spread_k': 0.472004949240358, 'spread_hl_frac': 0.025471099198940937, 'bb_std_mult': 3.2960795350821095, 'rsi_os': 27, 'rsi_ob': 79, 'vol_spike': 0.28147517091247676, 'adx_thresh': 23.89695277459783, 'atr_min_pct': 0.0030068965033512966, 'atr_max_pct': 0.07204503729042674, 'tp_mult': 2.6713403590215803, 'tsl_mult': 0.4956222287512056, 'strategy': 'breakout', 'time_stop': 168, 'use_sma': True, 'use_atr': False, 'use_adx': True, 'use_ema': False, 'use_spike': False, 'rsi_required': False, 'edge_k': 1.0387386215397951, 'edge_cap': 0.6090124246212753, 'bull_strategy': 'mean_reversion', 'bull_bb_std_mult': 2.5694714295223537, 'bull_rsi_os': 29, 'bull_rsi_ob': 56, 'bull_adx_thresh': 12.682639692919981, 'bull_atr_min_pct': 0.029958622408906573, 'bull_atr_max_pct': 0.07477521545638172, 'bull_tp_mult': 1.8499481970885345, 'bull_tsl_mult': 0.6024589052053643, 'bull_time_stop': 149, 'bull_use_sma': True, 'bull_use_ema': False, 'bull_use_atr': False, 'bull_use_adx': False, 'bull_use_spike': False, 'bull_rsi_required': True, 'bear_strategy': 'mean_reversion', 'bear_bb_std_mult': 1.1800718940634072, 'bear_rsi_os': 49, 'bear_rsi_ob': 92, 'bear_adx_thresh': 11.165310415348772, 'bear_atr_min_pct': 0.029945298233386625, 'bear_atr_max_pct': 0.02462486200905771, 'bear_tp_mult': 1.1354037272871271, 'bear_tsl_mult': 0.9218469649439398, 'bear_time_stop': 169, 'bear_use_sma': False, 'bear_use_ema': True, 'bear_use_atr': True, 'bear_use_adx': False, 'bear_use_spike': True, 'bear_rsi_required': False, 'sideways_strategy': 'breakout', 'sideways_bb_std_mult': 3.3238492349869926, 'sideways_rsi_os': 37, 'sideways_rsi_ob': 49, 'sideways_adx_thresh': 27.489610028996708, 'sideways_atr_min_pct': 0.0024043236446860544, 'sideways_atr_max_pct': 0.025206134020824028, 'sideways_tp_mult': 1.0108796815388463, 'sideways_tsl_mult': 0.14467029340642779, 'sideways_time_stop': 186, 'sideways_use_sma': False, 'sideways_use_ema': True, 'sideways_use_atr': False, 'sideways_use_adx': False, 'sideways_use_spike': False, 'sideways_rsi_required': False}.
[I 2025-09-01 10:17:26,442] Trial 476 finished with values: [-0.04900054931352593, 0.04898519819848024] and parameters: {'p_sma': 20, 'p_std': 44, 'p_atr': 29, 'p_adx': 22, 'rsi_period': 67, 'ema1': 20, 'ema2': 53, 'slip_atr_k': 0.10944092688767824, 'slip_spread_k': 0.9066381102457568, 'spread_hl_frac': 0.02543627755613339, 'bb_std_mult': 2.4936875145683857, 'rsi_os': 30, 'rsi_ob': 79, 'vol_spike': 0.08297157764989524, 'adx_thresh': 6.401777928915645, 'atr_min_pct': 0.025049805507965057, 'atr_max_pct': 0.07383970583487712, 'tp_mult': 2.6749398514312808, 'tsl_mult': 0.7903919405672687, 'strategy': 'breakout', 'time_stop': 13, 'use_sma': True, 'use_atr': False, 'use_adx': True, 'use_ema': False, 'use_spike': False, 'rsi_required': False, 'edge_k': 1.0939214897524996, 'edge_cap': 0.7073595389330195, 'bull_strategy': 'mean_reversion', 'bull_bb_std_mult': 0.9931337301139852, 'bull_rsi_os': 11, 'bull_rsi_ob': 66, 'bull_adx_thresh': 14.526757478813536, 'bull_atr_min_pct': 0.004153897368952955, 'bull_atr_max_pct': 0.0900959375505701, 'bull_tp_mult': 1.829290944616619, 'bull_tsl_mult': 0.7544712006671115, 'bull_time_stop': 207, 'bull_use_sma': True, 'bull_use_ema': False, 'bull_use_atr': False, 'bull_use_adx': False, 'bull_use_spike': False, 'bull_rsi_required': True, 'bear_strategy': 'mean_reversion', 'bear_bb_std_mult': 3.453501067102224, 'bear_rsi_os': 17, 'bear_rsi_ob': 46, 'bear_adx_thresh': 11.025382523101648, 'bear_atr_min_pct': 0.029484011124794672, 'bear_atr_max_pct': 0.072800429932213, 'bear_tp_mult': 1.090716929843746, 'bear_tsl_mult': 0.49294267725024615, 'bear_time_stop': 77, 'bear_use_sma': False, 'bear_use_ema': True, 'bear_use_atr': True, 'bear_use_adx': False, 'bear_use_spike': True, 'bear_rsi_required': False, 'sideways_strategy': 'breakout', 'sideways_bb_std_mult': 3.1677675898480824, 'sideways_rsi_os': 50, 'sideways_rsi_ob': 75, 'sideways_adx_thresh': 28.435020241575824, 'sideways_atr_min_pct': 0.0026407493846854696, 'sideways_atr_max_pct': 0.013501969744998468, 'sideways_tp_mult': 2.5442592762822924, 'sideways_tsl_mult': 0.8205056976387687, 'sideways_time_stop': 168, 'sideways_use_sma': False, 'sideways_use_ema': True, 'sideways_use_atr': False, 'sideways_use_adx': False, 'sideways_use_spike': False, 'sideways_rsi_required': False}.
[I 2025-09-01 10:17:27,263] Trial 481 finished with values: [-1000000000.0, 1000000000.0] and parameters: {'p_sma': 38, 'p_std': 60, 'p_atr': 30, 'p_adx': 9, 'rsi_period': 24, 'ema1': 26, 'ema2': 55, 'slip_atr_k': 0.04089022545206408, 'slip_spread_k': 0.362821242243966, 'spread_hl_frac': 0.029869640125080033, 'bb_std_mult': 2.289294145982578, 'rsi_os': 53, 'rsi_ob': 45, 'vol_spike': 0.035781067551921106, 'adx_thresh': 6.350455429228127, 'atr_min_pct': 0.02824932164128379, 'atr_max_pct': 0.07494196106669572, 'tp_mult': 2.6808425600726684, 'tsl_mult': 0.06317997719247068, 'strategy': 'mean_reversion', 'time_stop': 151, 'use_sma': True, 'use_atr': False, 'use_adx': False, 'use_ema': False, 'use_spike': False, 'rsi_required': False, 'edge_k': 0.38563212056975027, 'edge_cap': 0.6143989860753206, 'bull_strategy': 'mean_reversion', 'bull_bb_std_mult': 0.7451160026187078, 'bull_rsi_os': 17, 'bull_rsi_ob': 55, 'bull_adx_thresh': 6.973961484234916, 'bull_atr_min_pct': 0.029346135451434916, 'bull_atr_max_pct': 0.09005616002127134, 'bull_tp_mult': 1.9042994687639472, 'bull_tsl_mult': 0.08511486323658733, 'bull_time_stop': 98, 'bull_use_sma': True, 'bull_use_ema': False, 'bull_use_atr': True, 'bull_use_adx': True, 'bull_use_spike': False, 'bull_rsi_required': True, 'bear_strategy': 'mean_reversion', 'bear_bb_std_mult': 0.7662663447623441, 'bear_rsi_os': 7, 'bear_rsi_ob': 47, 'bear_adx_thresh': 26.618628412165, 'bear_atr_min_pct': 0.01831030119424744, 'bear_atr_max_pct': 0.07283855494380491, 'bear_tp_mult': 1.4371514865810069, 'bear_tsl_mult': 0.5047450261026556, 'bear_time_stop': 158, 'bear_use_sma': False, 'bear_use_ema': False, 'bear_use_atr': False, 'bear_use_adx': False, 'bear_use_spike': False, 'bear_rsi_required': True, 'sideways_strategy': 'mean_reversion', 'sideways_bb_std_mult': 2.1525642823115945, 'sideways_rsi_os': 47, 'sideways_rsi_ob': 77, 'sideways_adx_thresh': 29.051913784572477, 'sideways_atr_min_pct': 0.009590265312888266, 'sideways_atr_max_pct': 0.02212293958100372, 'sideways_tp_mult': 1.2887337144326312, 'sideways_tsl_mult': 0.48537770712509026, 'sideways_time_stop': 213, 'sideways_use_sma': False, 'sideways_use_ema': False, 'sideways_use_atr': True, 'sideways_use_adx': False, 'sideways_use_spike': False, 'sideways_rsi_required': False}.
[I 2025-09-01 10:17:27,339] Trial 482 finished with values: [-1000000000.0, 1000000000.0] and parameters: {'p_sma': 16, 'p_std': 47, 'p_atr': 29, 'p_adx': 21, 'rsi_period': 24, 'ema1': 13, 'ema2': 34, 'slip_atr_k': 0.04159905852137855, 'slip_spread_k': 0.3673451072839541, 'spread_hl_frac': 0.03203603753737311, 'bb_std_mult': 3.1528620989923573, 'rsi_os': 53, 'rsi_ob': 82, 'vol_spike': 0.26379967360229406, 'adx_thresh': 8.03627077228405, 'atr_min_pct': 0.023636431483955254, 'atr_max_pct': 0.11577160660581542, 'tp_mult': 2.7213789952991343, 'tsl_mult': 0.06285076708435587, 'strategy': 'mean_reversion', 'time_stop': 149, 'use_sma': True, 'use_atr': False, 'use_adx': False, 'use_ema': False, 'use_spike': False, 'rsi_required': False, 'edge_k': 0.06842253580079227, 'edge_cap': 0.298684583057935, 'bull_strategy': 'mean_reversion', 'bull_bb_std_mult': 0.7746062550364653, 'bull_rsi_os': 19, 'bull_rsi_ob': 88, 'bull_adx_thresh': 6.959602443328121, 'bull_atr_min_pct': 0.008613203792427887, 'bull_atr_max_pct': 0.10808544905784748, 'bull_tp_mult': 2.498269460679386, 'bull_tsl_mult': 0.0880237251662325, 'bull_time_stop': 9, 'bull_use_sma': False, 'bull_use_ema': False, 'bull_use_atr': True, 'bull_use_adx': True, 'bull_use_spike': True, 'bull_rsi_required': True, 'bear_strategy': 'mean_reversion', 'bear_bb_std_mult': 2.0354673174642848, 'bear_rsi_os': 7, 'bear_rsi_ob': 45, 'bear_adx_thresh': 16.041694402697313, 'bear_atr_min_pct': 0.018242982333068994, 'bear_atr_max_pct': 0.06337872797300197, 'bear_tp_mult': 1.221508408378243, 'bear_tsl_mult': 0.07868113851800945, 'bear_time_stop': 273, 'bear_use_sma': False, 'bear_use_ema': False, 'bear_use_atr': False, 'bear_use_adx': False, 'bear_use_spike': False, 'bear_rsi_required': True, 'sideways_strategy': 'mean_reversion', 'sideways_bb_std_mult': 3.265654671244068, 'sideways_rsi_os': 6, 'sideways_rsi_ob': 51, 'sideways_adx_thresh': 11.16483015553813, 'sideways_atr_min_pct': 0.0040078013968731395, 'sideways_atr_max_pct': 0.06732702838073569, 'sideways_tp_mult': 2.144092700484607, 'sideways_tsl_mult': 0.8205165091634204, 'sideways_time_stop': 208, 'sideways_use_sma': False, 'sideways_use_ema': False, 'sideways_use_atr': True, 'sideways_use_adx': False, 'sideways_use_spike': False, 'sideways_rsi_required': False}.
[I 2025-09-01 10:18:04,860] Trial 480 finished with values: [-1000000000.0, 1000000000.0] and parameters: {'p_sma': 16, 'p_std': 17, 'p_atr': 29, 'p_adx': 25, 'rsi_period': 67, 'ema1': 29, 'ema2': 55, 'slip_atr_k': 0.1102752756672601, 'slip_spread_k': 0.8051737091134279, 'spread_hl_frac': 0.02926673355958788, 'bb_std_mult': 2.299803392125368, 'rsi_os': 29, 'rsi_ob': 63, 'vol_spike': 0.27953760833041597, 'adx_thresh': 7.981099454161475, 'atr_min_pct': 0.028085372967854842, 'atr_max_pct': 0.07247283700813945, 'tp_mult': 2.1640565977962565, 'tsl_mult': 0.4250283589482684, 'strategy': 'mean_reversion', 'time_stop': 151, 'use_sma': True, 'use_atr': False, 'use_adx': False, 'use_ema': False, 'use_spike': False, 'rsi_required': False, 'edge_k': 1.051692079959387, 'edge_cap': 0.6215542132076973, 'bull_strategy': 'mean_reversion', 'bull_bb_std_mult': 2.5753305425183877, 'bull_rsi_os': 21, 'bull_rsi_ob': 56, 'bull_adx_thresh': 7.062597805429264, 'bull_atr_min_pct': 0.004059023438159382, 'bull_atr_max_pct': 0.019796973524370286, 'bull_tp_mult': 1.4074890655981789, 'bull_tsl_mult': 0.6041597600475644, 'bull_time_stop': 9, 'bull_use_sma': True, 'bull_use_ema': False, 'bull_use_atr': False, 'bull_use_adx': False, 'bull_use_spike': False, 'bull_rsi_required': True, 'bear_strategy': 'mean_reversion', 'bear_bb_std_mult': 0.7564644364768558, 'bear_rsi_os': 7, 'bear_rsi_ob': 83, 'bear_adx_thresh': 26.593463820781054, 'bear_atr_min_pct': 0.01826130178584309, 'bear_atr_max_pct': 0.07241432769626566, 'bear_tp_mult': 1.0784710139879956, 'bear_tsl_mult': 0.5059088504767604, 'bear_time_stop': 76, 'bear_use_sma': False, 'bear_use_ema': False, 'bear_use_atr': False, 'bear_use_adx': False, 'bear_use_spike': False, 'bear_rsi_required': False, 'sideways_strategy': 'breakout', 'sideways_bb_std_mult': 3.491698580227289, 'sideways_rsi_os': 6, 'sideways_rsi_ob': 89, 'sideways_adx_thresh': 18.422920977312383, 'sideways_atr_min_pct': 0.02374164527843347, 'sideways_atr_max_pct': 0.06762142594912153, 'sideways_tp_mult': 1.2874254403079248, 'sideways_tsl_mult': 0.14835760192978653, 'sideways_time_stop': 213, 'sideways_use_sma': False, 'sideways_use_ema': False, 'sideways_use_atr': False, 'sideways_use_adx': False, 'sideways_use_spike': False, 'sideways_rsi_required': False}.
[I 2025-09-01 10:18:05,824] Trial 479 finished with values: [-0.038785591210796166, 0.039583948880514336] and parameters: {'p_sma': 16, 'p_std': 47, 'p_atr': 29, 'p_adx': 9, 'rsi_period': 75, 'ema1': 20, 'ema2': 47, 'slip_atr_k': 0.039065175237645376, 'slip_spread_k': 0.8003147452053887, 'spread_hl_frac': 0.02530008283908316, 'bb_std_mult': 2.298108422361889, 'rsi_os': 30, 'rsi_ob': 45, 'vol_spike': 0.023172551502163408, 'adx_thresh': 15.262775992768312, 'atr_min_pct': 0.0036219940997167573, 'atr_max_pct': 0.07439445816689715, 'tp_mult': 2.694180680759439, 'tsl_mult': 0.7995627442486926, 'strategy': 'breakout', 'time_stop': 15, 'use_sma': True, 'use_atr': False, 'use_adx': True, 'use_ema': False, 'use_spike': False, 'rsi_required': False, 'edge_k': 1.05623976793323, 'edge_cap': 0.6075379446541197, 'bull_strategy': 'mean_reversion', 'bull_bb_std_mult': 1.00218830560284, 'bull_rsi_os': 11, 'bull_rsi_ob': 56, 'bull_adx_thresh': 6.9412124428426845, 'bull_atr_min_pct': 0.02951628530609172, 'bull_atr_max_pct': 0.04706851833338136, 'bull_tp_mult': 2.4051801331527622, 'bull_tsl_mult': 0.09599893790125243, 'bull_time_stop': 149, 'bull_use_sma': True, 'bull_use_ema': False, 'bull_use_atr': False, 'bull_use_adx': False, 'bull_use_spike': False, 'bull_rsi_required': True, 'bear_strategy': 'mean_reversion', 'bear_bb_std_mult': 1.177590751271182, 'bear_rsi_os': 49, 'bear_rsi_ob': 47, 'bear_adx_thresh': 28.13946852197853, 'bear_atr_min_pct': 0.02541315375945393, 'bear_atr_max_pct': 0.02331981582590066, 'bear_tp_mult': 1.0909068405325448, 'bear_tsl_mult': 0.002235037165021825, 'bear_time_stop': 54, 'bear_use_sma': False, 'bear_use_ema': False, 'bear_use_atr': True, 'bear_use_adx': False, 'bear_use_spike': True, 'bear_rsi_required': False, 'sideways_strategy': 'breakout', 'sideways_bb_std_mult': 1.5538971693676338, 'sideways_rsi_os': 46, 'sideways_rsi_ob': 74, 'sideways_adx_thresh': 11.103061686962063, 'sideways_atr_min_pct': 0.0025996656397071225, 'sideways_atr_max_pct': 0.023803160197779387, 'sideways_tp_mult': 1.4692388247236967, 'sideways_tsl_mult': 0.15649576966426748, 'sideways_time_stop': 187, 'sideways_use_sma': False, 'sideways_use_ema': False, 'sideways_use_atr': False, 'sideways_use_adx': False, 'sideways_use_spike': False, 'sideways_rsi_required': False}.
[I 2025-09-01 10:18:09,541] Trial 483 finished with values: [-1000000000.0, 1000000000.0] and parameters: {'p_sma': 16, 'p_std': 47, 'p_atr': 30, 'p_adx': 25, 'rsi_period': 75, 'ema1': 29, 'ema2': 47, 'slip_atr_k': 0.043437472115736196, 'slip_spread_k': 0.7854357898304223, 'spread_hl_frac': 0.029259966186072746, 'bb_std_mult': 3.1445713065672227, 'rsi_os': 32, 'rsi_ob': 76, 'vol_spike': 0.02425701862177132, 'adx_thresh': 7.660423192461672, 'atr_min_pct': 0.023794254029199113, 'atr_max_pct': 0.11697776605711618, 'tp_mult': 2.7248364757294063, 'tsl_mult': 0.05390900919862561, 'strategy': 'breakout', 'time_stop': 252, 'use_sma': True, 'use_atr': False, 'use_adx': True, 'use_ema': False, 'use_spike': False, 'rsi_required': True, 'edge_k': 0.8748498491712707, 'edge_cap': 0.29362702422131987, 'bull_strategy': 'breakout', 'bull_bb_std_mult': 1.8423520724546727, 'bull_rsi_os': 23, 'bull_rsi_ob': 51, 'bull_adx_thresh': 25.208230586239853, 'bull_atr_min_pct': 0.029409075703390776, 'bull_atr_max_pct': 0.05233293423974135, 'bull_tp_mult': 2.379359607441961, 'bull_tsl_mult': 0.2553150321051991, 'bull_time_stop': 164, 'bull_use_sma': False, 'bull_use_ema': True, 'bull_use_atr': True, 'bull_use_adx': True, 'bull_use_spike': True, 'bull_rsi_required': True, 'bear_strategy': 'mean_reversion', 'bear_bb_std_mult': 3.514028106666497, 'bear_rsi_os': 14, 'bear_rsi_ob': 59, 'bear_adx_thresh': 8.396952765927285, 'bear_atr_min_pct': 0.02171412338953204, 'bear_atr_max_pct': 0.02050197982111339, 'bear_tp_mult': 1.2653369743793124, 'bear_tsl_mult': 0.4091305693012281, 'bear_time_stop': 130, 'bear_use_sma': True, 'bear_use_ema': False, 'bear_use_atr': True, 'bear_use_adx': True, 'bear_use_spike': True, 'bear_rsi_required': False, 'sideways_strategy': 'breakout', 'sideways_bb_std_mult': 3.4735379065518317, 'sideways_rsi_os': 48, 'sideways_rsi_ob': 86, 'sideways_adx_thresh': 32.79864822882672, 'sideways_atr_min_pct': 0.0040823452462129, 'sideways_atr_max_pct': 0.06690322247661262, 'sideways_tp_mult': 2.141190652187041, 'sideways_tsl_mult': 0.8196009716528618, 'sideways_time_stop': 17, 'sideways_use_sma': False, 'sideways_use_ema': False, 'sideways_use_atr': False, 'sideways_use_adx': False, 'sideways_use_spike': True, 'sideways_rsi_required': True}.
[I 2025-09-01 10:18:10,059] Trial 484 finished with values: [-0.029461848307635208, 0.02981049426768396] and parameters: {'p_sma': 20, 'p_std': 46, 'p_atr': 30, 'p_adx': 21, 'rsi_period': 64, 'ema1': 7, 'ema2': 47, 'slip_atr_k': 0.14199114631423101, 'slip_spread_k': 0.21480239169664256, 'spread_hl_frac': 0.02904170063165963, 'bb_std_mult': 0.7543574551460495, 'rsi_os': 49, 'rsi_ob': 76, 'vol_spike': 0.2949568141392346, 'adx_thresh': 22.75140659419495, 'atr_min_pct': 0.026804193510721715, 'atr_max_pct': 0.030428848128391285, 'tp_mult': 2.6158653503269367, 'tsl_mult': 0.424907604414806, 'strategy': 'breakout', 'time_stop': 140, 'use_sma': True, 'use_atr': True, 'use_adx': True, 'use_ema': False, 'use_spike': False, 'rsi_required': True, 'edge_k': 0.8722890017600751, 'edge_cap': 0.2695685637000704, 'bull_strategy': 'breakout', 'bull_bb_std_mult': 0.8156859421047012, 'bull_rsi_os': 21, 'bull_rsi_ob': 53, 'bull_adx_thresh': 6.094630998311092, 'bull_atr_min_pct': 0.0030650385948246626, 'bull_atr_max_pct': 0.08293170840406958, 'bull_tp_mult': 1.8027344210220928, 'bull_tsl_mult': 0.2528526064788855, 'bull_time_stop': 199, 'bull_use_sma': True, 'bull_use_ema': True, 'bull_use_atr': True, 'bull_use_adx': True, 'bull_use_spike': False, 'bull_rsi_required': True, 'bear_strategy': 'mean_reversion', 'bear_bb_std_mult': 3.52353462620712, 'bear_rsi_os': 49, 'bear_rsi_ob': 87, 'bear_adx_thresh': 33.65915181882158, 'bear_atr_min_pct': 0.027010461838571947, 'bear_atr_max_pct': 0.13858098818901485, 'bear_tp_mult': 2.4832270584818015, 'bear_tsl_mult': 0.39963712529002404, 'bear_time_stop': 54, 'bear_use_sma': True, 'bear_use_ema': True, 'bear_use_atr': True, 'bear_use_adx': True, 'bear_use_spike': True, 'bear_rsi_required': False, 'sideways_strategy': 'breakout', 'sideways_bb_std_mult': 1.5407693794231707, 'sideways_rsi_os': 48, 'sideways_rsi_ob': 50, 'sideways_adx_thresh': 27.553613114346653, 'sideways_atr_min_pct': 0.02507300624601031, 'sideways_atr_max_pct': 0.04377870544113131, 'sideways_tp_mult': 1.3157920544665445, 'sideways_tsl_mult': 0.6364536858178872, 'sideways_time_stop': 280, 'sideways_use_sma': False, 'sideways_use_ema': True, 'sideways_use_atr': False, 'sideways_use_adx': True, 'sideways_use_spike': True, 'sideways_rsi_required': True}.
[I 2025-09-01 10:18:51,249] Trial 488 finished with values: [-1000000000.0, 1000000000.0] and parameters: {'p_sma': 49, 'p_std': 41, 'p_atr': 29, 'p_adx': 18, 'rsi_period': 83, 'ema1': 24, 'ema2': 50, 'slip_atr_k': 0.18543936379250658, 'slip_spread_k': 0.1671872136433215, 'spread_hl_frac': 0.027023252228112592, 'bb_std_mult': 3.1059094155773685, 'rsi_os': 22, 'rsi_ob': 77, 'vol_spike': 0.20374029024289225, 'adx_thresh': 6.309337458202151, 'atr_min_pct': 0.029997770516513478, 'atr_max_pct': 0.08397329201408464, 'tp_mult': 1.2681187352389647, 'tsl_mult': 0.04294149547011121, 'strategy': 'breakout', 'time_stop': 291, 'use_sma': True, 'use_atr': True, 'use_adx': True, 'use_ema': True, 'use_spike': True, 'rsi_required': False, 'edge_k': 1.0050313947598626, 'edge_cap': 0.560008015394012, 'bull_strategy': 'mean_reversion', 'bull_bb_std_mult': 1.0981031566591692, 'bull_rsi_os': 13, 'bull_rsi_ob': 91, 'bull_adx_thresh': 19.97556758452557, 'bull_atr_min_pct': 0.026375900248187707, 'bull_atr_max_pct': 0.08260589398560154, 'bull_tp_mult': 1.9102483465783706, 'bull_tsl_mult': 0.054304279544675586, 'bull_time_stop': 248, 'bull_use_sma': True, 'bull_use_ema': False, 'bull_use_atr': True, 'bull_use_adx': True, 'bull_use_spike': False, 'bull_rsi_required': False, 'bear_strategy': 'breakout', 'bear_bb_std_mult': 3.4396409430566632, 'bear_rsi_os': 43, 'bear_rsi_ob': 86, 'bear_adx_thresh': 13.965673463344391, 'bear_atr_min_pct': 0.016645715421791035, 'bear_atr_max_pct': 0.08549501118917029, 'bear_tp_mult': 1.221457836328728, 'bear_tsl_mult': 0.9501617601444432, 'bear_time_stop': 150, 'bear_use_sma': False, 'bear_use_ema': True, 'bear_use_atr': True, 'bear_use_adx': False, 'bear_use_spike': True, 'bear_rsi_required': False, 'sideways_strategy': 'breakout', 'sideways_bb_std_mult': 1.4668148167668043, 'sideways_rsi_os': 33, 'sideways_rsi_ob': 48, 'sideways_adx_thresh': 26.927046995769363, 'sideways_atr_min_pct': 0.0033366665282042844, 'sideways_atr_max_pct': 0.03289947878653021, 'sideways_tp_mult': 1.2305751558695393, 'sideways_tsl_mult': 0.8905081914303586, 'sideways_time_stop': 202, 'sideways_use_sma': True, 'sideways_use_ema': True, 'sideways_use_atr': True, 'sideways_use_adx': True, 'sideways_use_spike': False, 'sideways_rsi_required': False}.
