[I 2025-09-01 10:24:36,790] Trial 523 finished with values: [-1000000000.0, 1000000000.0] and parameters: {'p_sma': 19, 'p_std': 45, 'p_atr': 27, 'p_adx': 17, 'rsi_period': 65, 'ema1': 21, 'ema2': 57, 'slip_atr_k': 0.012920306220037467, 'slip_spread_k': 0.8266388583696744, 'spread_hl_frac': 0.030486617971780327, 'bb_std_mult': 2.5794041079814307, 'rsi_os': 43, 'rsi_ob': 54, 'vol_spike': 0.08958470946824734, 'adx_thresh': 6.136943941777094, 'atr_min_pct': 0.024531854759300864, 'atr_max_pct': 0.024231122098367995, 'tp_mult': 2.6730916332064405, 'tsl_mult': 0.036102917205967686, 'strategy': 'mean_reversion', 'time_stop': 149, 'use_sma': False, 'use_atr': True, 'use_adx': True, 'use_ema': True, 'use_spike': False, 'rsi_required': True, 'edge_k': 0.9364248707081091, 'edge_cap': 0.5215342067707079, 'bull_strategy': 'breakout', 'bull_bb_std_mult': 0.7738746249695759, 'bull_rsi_os': 43, 'bull_rsi_ob': 90, 'bull_adx_thresh': 27.207969283616908, 'bull_atr_min_pct': 0.012586395184053556, 'bull_atr_max_pct': 0.08506361044298791, 'bull_tp_mult': 2.2839014243679188, 'bull_tsl_mult': 0.9997258404652163, 'bull_time_stop': 167, 'bull_use_sma': True, 'bull_use_ema': True, 'bull_use_atr': False, 'bull_use_adx': True, 'bull_use_spike': True, 'bull_rsi_required': False, 'bear_strategy': 'breakout', 'bear_bb_std_mult': 3.4507971544608314, 'bear_rsi_os': 44, 'bear_rsi_ob': 47, 'bear_adx_thresh': 19.28408480679525, 'bear_atr_min_pct': 0.018830295872507275, 'bear_atr_max_pct': 0.02724936981920697, 'bear_tp_mult': 1.2829961217255272, 'bear_tsl_mult': 0.6485704896158975, 'bear_time_stop': 138, 'bear_use_sma': True, 'bear_use_ema': True, 'bear_use_atr': True, 'bear_use_adx': True, 'bear_use_spike': False, 'bear_rsi_required': True, 'sideways_strategy': 'mean_reversion', 'sideways_bb_std_mult': 3.2724369645381572, 'sideways_rsi_os': 48, 'sideways_rsi_ob': 50, 'sideways_adx_thresh': 12.329868651551159, 'sideways_atr_min_pct': 0.01576570598812724, 'sideways_atr_max_pct': 0.04669851528691856, 'sideways_tp_mult': 1.363951877817195, 'sideways_tsl_mult': 0.2817667169389525, 'sideways_time_stop': 170, 'sideways_use_sma': True, 'sideways_use_ema': True, 'sideways_use_atr': False, 'sideways_use_adx': True, 'sideways_use_spike': True, 'sideways_rsi_required': True}.
[I 2025-09-01 10:24:36,969] Trial 522 finished with values: [-1000000000.0, 1000000000.0] and parameters: {'p_sma': 19, 'p_std': 45, 'p_atr': 27, 'p_adx': 24, 'rsi_period': 9, 'ema1': 28, 'ema2': 52, 'slip_atr_k': 0.06740819595428274, 'slip_spread_k': 0.4443035202996655, 'spread_hl_frac': 0.030873126309661755, 'bb_std_mult': 3.2609947749976573, 'rsi_os': 23, 'rsi_ob': 47, 'vol_spike': 0.2887977443310051, 'adx_thresh': 6.163030779278552, 'atr_min_pct': 0.008320495635023071, 'atr_max_pct': 0.05852484899780501, 'tp_mult': 2.668401814850808, 'tsl_mult': 0.03862710155504661, 'strategy': 'mean_reversion', 'time_stop': 30, 'use_sma': True, 'use_atr': True, 'use_adx': True, 'use_ema': False, 'use_spike': False, 'rsi_required': True, 'edge_k': 0.9200721903335609, 'edge_cap': 0.22422424368050337, 'bull_strategy': 'breakout', 'bull_bb_std_mult': 0.7892642814113817, 'bull_rsi_os': 47, 'bull_rsi_ob': 95, 'bull_adx_thresh': 27.133922777973595, 'bull_atr_min_pct': 0.0009337918355785384, 'bull_atr_max_pct': 0.08668633295808226, 'bull_tp_mult': 2.9985412192839513, 'bull_tsl_mult': 0.10398744807498132, 'bull_time_stop': 254, 'bull_use_sma': True, 'bull_use_ema': True, 'bull_use_atr': False, 'bull_use_adx': True, 'bull_use_spike': True, 'bull_rsi_required': True, 'bear_strategy': 'mean_reversion', 'bear_bb_std_mult': 1.288584395320302, 'bear_rsi_os': 50, 'bear_rsi_ob': 47, 'bear_adx_thresh': 11.743807624746342, 'bear_atr_min_pct': 0.017007272226505332, 'bear_atr_max_pct': 0.06433327000273714, 'bear_tp_mult': 1.2923505213063082, 'bear_tsl_mult': 0.65476794484459, 'bear_time_stop': 68, 'bear_use_sma': True, 'bear_use_ema': True, 'bear_use_atr': True, 'bear_use_adx': True, 'bear_use_spike': False, 'bear_rsi_required': True, 'sideways_strategy': 'mean_reversion', 'sideways_bb_std_mult': 2.884013100286876, 'sideways_rsi_os': 48, 'sideways_rsi_ob': 50, 'sideways_adx_thresh': 5.0159182159384645, 'sideways_atr_min_pct': 0.00408870985640974, 'sideways_atr_max_pct': 0.07078039987392593, 'sideways_tp_mult': 2.5901436621622485, 'sideways_tsl_mult': 0.6021490408199974, 'sideways_time_stop': 201, 'sideways_use_sma': False, 'sideways_use_ema': True, 'sideways_use_atr': False, 'sideways_use_adx': True, 'sideways_use_spike': True, 'sideways_rsi_required': True}.
[I 2025-09-01 10:24:36,991] Trial 525 finished with values: [-1000000000.0, 1000000000.0] and parameters: {'p_sma': 19, 'p_std': 8, 'p_atr': 30, 'p_adx': 17, 'rsi_period': 67, 'ema1': 21, 'ema2': 42, 'slip_atr_k': 0.04695830207898257, 'slip_spread_k': 0.44840222765411025, 'spread_hl_frac': 0.02907432221908033, 'bb_std_mult': 2.8350050295268905, 'rsi_os': 41, 'rsi_ob': 46, 'vol_spike': 0.26598239507039634, 'adx_thresh': 6.318897708541104, 'atr_min_pct': 0.024474333027735613, 'atr_max_pct': 0.07932515640900616, 'tp_mult': 1.6871299686113381, 'tsl_mult': 0.0338982560813332, 'strategy': 'mean_reversion', 'time_stop': 70, 'use_sma': True, 'use_atr': True, 'use_adx': False, 'use_ema': True, 'use_spike': False, 'rsi_required': False, 'edge_k': 0.34963139487363404, 'edge_cap': 0.21983809219028483, 'bull_strategy': 'mean_reversion', 'bull_bb_std_mult': 0.7800304660809183, 'bull_rsi_os': 43, 'bull_rsi_ob': 53, 'bull_adx_thresh': 26.990630948786354, 'bull_atr_min_pct': 0.0010254348828129933, 'bull_atr_max_pct': 0.09609101695423528, 'bull_tp_mult': 1.7245415265288853, 'bull_tsl_mult': 0.8351049631328538, 'bull_time_stop': 175, 'bull_use_sma': True, 'bull_use_ema': False, 'bull_use_atr': False, 'bull_use_adx': False, 'bull_use_spike': False, 'bull_rsi_required': False, 'bear_strategy': 'breakout', 'bear_bb_std_mult': 3.3559301865904283, 'bear_rsi_os': 41, 'bear_rsi_ob': 48, 'bear_adx_thresh': 14.185576704931721, 'bear_atr_min_pct': 0.0018169969993454306, 'bear_atr_max_pct': 0.08359632645194023, 'bear_tp_mult': 2.57052128184504, 'bear_tsl_mult': 0.4437188225283938, 'bear_time_stop': 141, 'bear_use_sma': False, 'bear_use_ema': False, 'bear_use_atr': False, 'bear_use_adx': False, 'bear_use_spike': False, 'bear_rsi_required': False, 'sideways_strategy': 'breakout', 'sideways_bb_std_mult': 3.29608062792861, 'sideways_rsi_os': 48, 'sideways_rsi_ob': 52, 'sideways_adx_thresh': 27.442697770824665, 'sideways_atr_min_pct': 0.004099111711477175, 'sideways_atr_max_pct': 0.017082524806621008, 'sideways_tp_mult': 1.4102569773140867, 'sideways_tsl_mult': 0.595357684461289, 'sideways_time_stop': 200, 'sideways_use_sma': True, 'sideways_use_ema': False, 'sideways_use_atr': False, 'sideways_use_adx': True, 'sideways_use_spike': False, 'sideways_rsi_required': False}.
[I 2025-09-01 10:24:37,952] Trial 526 finished with values: [-1000000000.0, 1000000000.0] and parameters: {'p_sma': 21, 'p_std': 41, 'p_atr': 30, 'p_adx': 24, 'rsi_period': 52, 'ema1': 22, 'ema2': 52, 'slip_atr_k': 0.032025683760019824, 'slip_spread_k': 0.963190930598274, 'spread_hl_frac': 0.00454222273544368, 'bb_std_mult': 1.0764599186712216, 'rsi_os': 36, 'rsi_ob': 50, 'vol_spike': 0.293841651070687, 'adx_thresh': 7.177986171015136, 'atr_min_pct': 0.025843207086868564, 'atr_max_pct': 0.0793026391006671, 'tp_mult': 1.680976599211082, 'tsl_mult': 0.18395302949687525, 'strategy': 'mean_reversion', 'time_stop': 33, 'use_sma': True, 'use_atr': False, 'use_adx': False, 'use_ema': False, 'use_spike': True, 'rsi_required': False, 'edge_k': 0.9083013511727625, 'edge_cap': 0.5407390880697761, 'bull_strategy': 'mean_reversion', 'bull_bb_std_mult': 0.9457796500293495, 'bull_rsi_os': 47, 'bull_rsi_ob': 51, 'bull_adx_thresh': 5.911032456083471, 'bull_atr_min_pct': 0.023011155584764006, 'bull_atr_max_pct': 0.08802439811251761, 'bull_tp_mult': 1.7175453738538404, 'bull_tsl_mult': 0.058348848185377805, 'bull_time_stop': 174, 'bull_use_sma': False, 'bull_use_ema': False, 'bull_use_atr': True, 'bull_use_adx': False, 'bull_use_spike': False, 'bull_rsi_required': True, 'bear_strategy': 'mean_reversion', 'bear_bb_std_mult': 2.769643325762462, 'bear_rsi_os': 47, 'bear_rsi_ob': 82, 'bear_adx_thresh': 17.43352579513595, 'bear_atr_min_pct': 0.01649977321759389, 'bear_atr_max_pct': 0.07920482059417909, 'bear_tp_mult': 1.1966614069283588, 'bear_tsl_mult': 0.4426970656220588, 'bear_time_stop': 147, 'bear_use_sma': False, 'bear_use_ema': False, 'bear_use_atr': False, 'bear_use_adx': False, 'bear_use_spike': True, 'bear_rsi_required': False, 'sideways_strategy': 'breakout', 'sideways_bb_std_mult': 3.048709044764215, 'sideways_rsi_os': 48, 'sideways_rsi_ob': 95, 'sideways_adx_thresh': 27.343668648967782, 'sideways_atr_min_pct': 0.018180429831700495, 'sideways_atr_max_pct': 0.017917181646849835, 'sideways_tp_mult': 1.4060007123139315, 'sideways_tsl_mult': 0.7825438126067615, 'sideways_time_stop': 265, 'sideways_use_sma': False, 'sideways_use_ema': False, 'sideways_use_atr': False, 'sideways_use_adx': False, 'sideways_use_spike': False, 'sideways_rsi_required': False}.
[I 2025-09-01 10:24:38,993] Trial 527 finished with values: [-1000000000.0, 1000000000.0] and parameters: {'p_sma': 21, 'p_std': 46, 'p_atr': 11, 'p_adx': 27, 'rsi_period': 67, 'ema1': 21, 'ema2': 46, 'slip_atr_k': 0.03184644611415045, 'slip_spread_k': 0.17745297049373493, 'spread_hl_frac': 0.02923629512691225, 'bb_std_mult': 2.1502812108654292, 'rsi_os': 41, 'rsi_ob': 50, 'vol_spike': 0.27975305920355087, 'adx_thresh': 20.538612116792866, 'atr_min_pct': 0.026241876787807213, 'atr_max_pct': 0.01932455541994671, 'tp_mult': 1.6946424841052572, 'tsl_mult': 0.4657189208462458, 'strategy': 'breakout', 'time_stop': 5, 'use_sma': True, 'use_atr': False, 'use_adx': False, 'use_ema': True, 'use_spike': True, 'rsi_required': False, 'edge_k': 0.862140218639645, 'edge_cap': 0.5401471851990661, 'bull_strategy': 'mean_reversion', 'bull_bb_std_mult': 0.9482240965015939, 'bull_rsi_os': 18, 'bull_rsi_ob': 51, 'bull_adx_thresh': 5.999538678048735, 'bull_atr_min_pct': 0.023339627547987754, 'bull_atr_max_pct': 0.09119512549048064, 'bull_tp_mult': 1.772788290745462, 'bull_tsl_mult': 0.050371828249893114, 'bull_time_stop': 157, 'bull_use_sma': False, 'bull_use_ema': False, 'bull_use_atr': True, 'bull_use_adx': False, 'bull_use_spike': False, 'bull_rsi_required': False, 'bear_strategy': 'breakout', 'bear_bb_std_mult': 3.3663545266183226, 'bear_rsi_os': 47, 'bear_rsi_ob': 45, 'bear_adx_thresh': 12.488958451436522, 'bear_atr_min_pct': 0.016438656549386258, 'bear_atr_max_pct': 0.06863710338934424, 'bear_tp_mult': 1.46004031800567, 'bear_tsl_mult': 0.11887166799872428, 'bear_time_stop': 140, 'bear_use_sma': False, 'bear_use_ema': False, 'bear_use_atr': False, 'bear_use_adx': False, 'bear_use_spike': True, 'bear_rsi_required': False, 'sideways_strategy': 'breakout', 'sideways_bb_std_mult': 3.332584225602215, 'sideways_rsi_os': 50, 'sideways_rsi_ob': 47, 'sideways_adx_thresh': 28.072735536640792, 'sideways_atr_min_pct': 0.012693674148882124, 'sideways_atr_max_pct': 0.018198942353740435, 'sideways_tp_mult': 1.4317798218370252, 'sideways_tsl_mult': 0.7795910666474578, 'sideways_time_stop': 200, 'sideways_use_sma': True, 'sideways_use_ema': False, 'sideways_use_atr': False, 'sideways_use_adx': False, 'sideways_use_spike': False, 'sideways_rsi_required': False}.
[I 2025-09-01 10:24:51,005] Trial 524 finished with values: [-1000000000.0, 1000000000.0] and parameters: {'p_sma': 31, 'p_std': 45, 'p_atr': 28, 'p_adx': 24, 'rsi_period': 52, 'ema1': 22, 'ema2': 35, 'slip_atr_k': 0.03172598810817513, 'slip_spread_k': 0.1830254125129612, 'spread_hl_frac': 0.030756814649580508, 'bb_std_mult': 3.172434386648676, 'rsi_os': 22, 'rsi_ob': 82, 'vol_spike': 0.2807323940853926, 'adx_thresh': 18.69406503234149, 'atr_min_pct': 0.008147886942549778, 'atr_max_pct': 0.057956039275405755, 'tp_mult': 2.688536026869499, 'tsl_mult': 0.8640574471012561, 'strategy': 'mean_reversion', 'time_stop': 30, 'use_sma': True, 'use_atr': False, 'use_adx': True, 'use_ema': True, 'use_spike': False, 'rsi_required': True, 'edge_k': 0.939760760059572, 'edge_cap': 0.589227821336547, 'bull_strategy': 'breakout', 'bull_bb_std_mult': 0.7816135256692619, 'bull_rsi_os': 18, 'bull_rsi_ob': 53, 'bull_adx_thresh': 5.939429435903358, 'bull_atr_min_pct': 0.02806876540378049, 'bull_atr_max_pct': 0.08756010535017329, 'bull_tp_mult': 1.7201352566540735, 'bull_tsl_mult': 0.05397966030743917, 'bull_time_stop': 172, 'bull_use_sma': True, 'bull_use_ema': True, 'bull_use_atr': True, 'bull_use_adx': True, 'bull_use_spike': True, 'bull_rsi_required': False, 'bear_strategy': 'breakout', 'bear_bb_std_mult': 2.6647093199276677, 'bear_rsi_os': 47, 'bear_rsi_ob': 48, 'bear_adx_thresh': 12.62653270453201, 'bear_atr_min_pct': 0.016515378869540912, 'bear_atr_max_pct': 0.06846522970916608, 'bear_tp_mult': 1.287927673065731, 'bear_tsl_mult': 0.45151753359589897, 'bear_time_stop': 69, 'bear_use_sma': True, 'bear_use_ema': False, 'bear_use_atr': True, 'bear_use_adx': True, 'bear_use_spike': True, 'bear_rsi_required': False, 'sideways_strategy': 'breakout', 'sideways_bb_std_mult': 3.2817611257100916, 'sideways_rsi_os': 48, 'sideways_rsi_ob': 52, 'sideways_adx_thresh': 21.953075533452854, 'sideways_atr_min_pct': 0.0047969013303996045, 'sideways_atr_max_pct': 0.11467579538430644, 'sideways_tp_mult': 1.4109231931374426, 'sideways_tsl_mult': 0.8458254239540517, 'sideways_time_stop': 263, 'sideways_use_sma': True, 'sideways_use_ema': False, 'sideways_use_atr': False, 'sideways_use_adx': False, 'sideways_use_spike': True, 'sideways_rsi_required': True}.
[I 2025-09-01 10:24:55,625] Trial 528 finished with values: [-1000000000.0, 1000000000.0] and parameters: {'p_sma': 21, 'p_std': 46, 'p_atr': 28, 'p_adx': 19, 'rsi_period': 59, 'ema1': 22, 'ema2': 49, 'slip_atr_k': 0.03616757744633637, 'slip_spread_k': 0.1787218661857826, 'spread_hl_frac': 0.026244474089279036, 'bb_std_mult': 3.154960559659088, 'rsi_os': 27, 'rsi_ob': 50, 'vol_spike': 0.2831594786711207, 'adx_thresh': 20.24962640000574, 'atr_min_pct': 0.026129730076919665, 'atr_max_pct': 0.07536322502724621, 'tp_mult': 2.735745610974457, 'tsl_mult': 0.8649877779649514, 'strategy': 'breakout', 'time_stop': 161, 'use_sma': True, 'use_atr': False, 'use_adx': True, 'use_ema': False, 'use_spike': True, 'rsi_required': False, 'edge_k': 0.8689427161346301, 'edge_cap': 0.8915955154869961, 'bull_strategy': 'mean_reversion', 'bull_bb_std_mult': 0.9413523257448219, 'bull_rsi_os': 18, 'bull_rsi_ob': 78, 'bull_adx_thresh': 5.968554504937776, 'bull_atr_min_pct': 0.022876567389955846, 'bull_atr_max_pct': 0.09219722986775275, 'bull_tp_mult': 1.877348851788597, 'bull_tsl_mult': 0.05858452551941324, 'bull_time_stop': 156, 'bull_use_sma': False, 'bull_use_ema': False, 'bull_use_atr': True, 'bull_use_adx': False, 'bull_use_spike': False, 'bull_rsi_required': True, 'bear_strategy': 'mean_reversion', 'bear_bb_std_mult': 2.6347788458988326, 'bear_rsi_os': 26, 'bear_rsi_ob': 91, 'bear_adx_thresh': 12.59344516508793, 'bear_atr_min_pct': 0.01648308679059041, 'bear_atr_max_pct': 0.06871855638384389, 'bear_tp_mult': 1.3463718654034076, 'bear_tsl_mult': 0.7828895070225038, 'bear_time_stop': 148, 'bear_use_sma': False, 'bear_use_ema': False, 'bear_use_atr': True, 'bear_use_adx': False, 'bear_use_spike': True, 'bear_rsi_required': False, 'sideways_strategy': 'breakout', 'sideways_bb_std_mult': 0.5073836898056991, 'sideways_rsi_os': 50, 'sideways_rsi_ob': 47, 'sideways_adx_thresh': 13.112631972483497, 'sideways_atr_min_pct': 0.008841272025946461, 'sideways_atr_max_pct': 0.14591424369229672, 'sideways_tp_mult': 1.9749454669797104, 'sideways_tsl_mult': 0.49951668088128404, 'sideways_time_stop': 264, 'sideways_use_sma': False, 'sideways_use_ema': False, 'sideways_use_atr': False, 'sideways_use_adx': False, 'sideways_use_spike': False, 'sideways_rsi_required': False}.
[I 2025-09-01 10:25:20,992] Trial 529 finished with values: [-0.09242988521601236, 0.09213707870096235] and parameters: {'p_sma': 31, 'p_std': 46, 'p_atr': 28, 'p_adx': 19, 'rsi_period': 59, 'ema1': 23, 'ema2': 33, 'slip_atr_k': 0.20143429772887222, 'slip_spread_k': 0.18221649858434674, 'spread_hl_frac': 0.026619811748508627, 'bb_std_mult': 3.1389024705283584, 'rsi_os': 27, 'rsi_ob': 81, 'vol_spike': 0.28012566881937895, 'adx_thresh': 5.573591739005004, 'atr_min_pct': 0.023806031788536547, 'atr_max_pct': 0.07548580257125398, 'tp_mult': 2.7185045459915274, 'tsl_mult': 0.8619183358041203, 'strategy': 'breakout', 'time_stop': 159, 'use_sma': True, 'use_atr': False, 'use_adx': True, 'use_ema': False, 'use_spike': False, 'rsi_required': False, 'edge_k': 0.7409023633732353, 'edge_cap': 0.5824128242910149, 'bull_strategy': 'mean_reversion', 'bull_bb_std_mult': 1.9444107390160343, 'bull_rsi_os': 18, 'bull_rsi_ob': 78, 'bull_adx_thresh': 5.550065327518849, 'bull_atr_min_pct': 0.028206126997500146, 'bull_atr_max_pct': 0.09173446187133202, 'bull_tp_mult': 1.7911891604902124, 'bull_tsl_mult': 0.38939372867021227, 'bull_time_stop': 148, 'bull_use_sma': True, 'bull_use_ema': False, 'bull_use_atr': True, 'bull_use_adx': True, 'bull_use_spike': False, 'bull_rsi_required': True, 'bear_strategy': 'mean_reversion', 'bear_bb_std_mult': 1.076337871915996, 'bear_rsi_os': 26, 'bear_rsi_ob': 52, 'bear_adx_thresh': 12.620932626682503, 'bear_atr_min_pct': 0.015787903549011044, 'bear_atr_max_pct': 0.06948387432042424, 'bear_tp_mult': 1.3506009038362956, 'bear_tsl_mult': 0.36994174989708667, 'bear_time_stop': 138, 'bear_use_sma': False, 'bear_use_ema': True, 'bear_use_atr': True, 'bear_use_adx': False, 'bear_use_spike': True, 'bear_rsi_required': False, 'sideways_strategy': 'breakout', 'sideways_bb_std_mult': 3.3477901872583553, 'sideways_rsi_os': 50, 'sideways_rsi_ob': 86, 'sideways_adx_thresh': 26.536610960201088, 'sideways_atr_min_pct': 0.0026137670833559557, 'sideways_atr_max_pct': 0.14539239471369286, 'sideways_tp_mult': 1.9551931264346425, 'sideways_tsl_mult': 0.8564617169481926, 'sideways_time_stop': 202, 'sideways_use_sma': False, 'sideways_use_ema': True, 'sideways_use_atr': False, 'sideways_use_adx': False, 'sideways_use_spike': False, 'sideways_rsi_required': False}.
[I 2025-09-01 10:25:29,521] Trial 530 finished with values: [-0.12103425089970932, 0.12080075114802753] and parameters: {'p_sma': 25, 'p_std': 30, 'p_atr': 12, 'p_adx': 20, 'rsi_period': 79, 'ema1': 23, 'ema2': 49, 'slip_atr_k': 0.03897028239089788, 'slip_spread_k': 0.8905745583142395, 'spread_hl_frac': 0.02647666583207776, 'bb_std_mult': 3.142525161213518, 'rsi_os': 25, 'rsi_ob': 75, 'vol_spike': 0.2750434272456633, 'adx_thresh': 5.53053344708194, 'atr_min_pct': 0.02269491077870788, 'atr_max_pct': 0.09063062410046052, 'tp_mult': 2.7156047511406354, 'tsl_mult': 0.6452037903899519, 'strategy': 'breakout', 'time_stop': 158, 'use_sma': True, 'use_atr': False, 'use_adx': True, 'use_ema': False, 'use_spike': False, 'rsi_required': False, 'edge_k': 0.7573431804948346, 'edge_cap': 0.583865745291713, 'bull_strategy': 'mean_reversion', 'bull_bb_std_mult': 1.5935666310824597, 'bull_rsi_os': 18, 'bull_rsi_ob': 78, 'bull_adx_thresh': 5.4434276480637935, 'bull_atr_min_pct': 0.028168604419684898, 'bull_atr_max_pct': 0.08759124338869191, 'bull_tp_mult': 1.8129811381796717, 'bull_tsl_mult': 0.147238205214614, 'bull_time_stop': 136, 'bull_use_sma': True, 'bull_use_ema': False, 'bull_use_atr': True, 'bull_use_adx': True, 'bull_use_spike': False, 'bull_rsi_required': True, 'bear_strategy': 'mean_reversion', 'bear_bb_std_mult': 1.3648520887070248, 'bear_rsi_os': 48, 'bear_rsi_ob': 92, 'bear_adx_thresh': 31.143265505689385, 'bear_atr_min_pct': 0.005406902635742403, 'bear_atr_max_pct': 0.1307378306331411, 'bear_tp_mult': 1.354554844008914, 'bear_tsl_mult': 0.3718127242091092, 'bear_time_stop': 86, 'bear_use_sma': False, 'bear_use_ema': True, 'bear_use_atr': True, 'bear_use_adx': False, 'bear_use_spike': True, 'bear_rsi_required': False, 'sideways_strategy': 'breakout', 'sideways_bb_std_mult': 3.3660913685873823, 'sideways_rsi_os': 51, 'sideways_rsi_ob': 92, 'sideways_adx_thresh': 21.756117371855282, 'sideways_atr_min_pct': 0.002648997933120015, 'sideways_atr_max_pct': 0.11407712537529385, 'sideways_tp_mult': 1.346528521843856, 'sideways_tsl_mult': 0.8809955587030763, 'sideways_time_stop': 214, 'sideways_use_sma': False, 'sideways_use_ema': True, 'sideways_use_atr': False, 'sideways_use_adx': False, 'sideways_use_spike': False, 'sideways_rsi_required': False}.
