[I 2025-09-01 09:27:22,479] Trial 181 finished with values: [-1000000000.0, 1000000000.0] and parameters: {'p_sma': 25, 'p_std': 23, 'p_atr': 27, 'p_adx': 13, 'rsi_period': 70, 'ema1': 19, 'ema2': 45, 'slip_atr_k': 0.23987663950317223, 'slip_spread_k': 0.9992201278680546, 'spread_hl_frac': 0.014721297220312032, 'bb_std_mult': 1.654898533315281, 'rsi_os': 35, 'rsi_ob': 86, 'vol_spike': 0.20458683725427526, 'adx_thresh': 29.14461142133137, 'atr_min_pct': 0.018752887061826474, 'atr_max_pct': 0.14018266401867743, 'tp_mult': 2.3477762703966785, 'tsl_mult': 0.5065806512549176, 'strategy': 'breakout', 'time_stop': 182, 'use_sma': True, 'use_atr': False, 'use_adx': True, 'use_ema': False, 'use_spike': False, 'rsi_required': False, 'edge_k': 0.33604873722649087, 'edge_cap': 0.10920362753361074, 'bull_strategy': 'mean_reversion', 'bull_bb_std_mult': 0.5463094355499751, 'bull_rsi_os': 42, 'bull_rsi_ob': 56, 'bull_adx_thresh': 7.067142711498823, 'bull_atr_min_pct': 0.004460204672918159, 'bull_atr_max_pct': 0.11215282321577319, 'bull_tp_mult': 1.6262366807685402, 'bull_tsl_mult': 0.43329531330569243, 'bull_time_stop': 144, 'bull_use_sma': True, 'bull_use_ema': False, 'bull_use_atr': True, 'bull_use_adx': False, 'bull_use_spike': False, 'bull_rsi_required': True, 'bear_strategy': 'mean_reversion', 'bear_bb_std_mult': 2.282917069025842, 'bear_rsi_os': 39, 'bear_rsi_ob': 70, 'bear_adx_thresh': 11.201008698926262, 'bear_atr_min_pct': 0.0174329466025882, 'bear_atr_max_pct': 0.04257118463077114, 'bear_tp_mult': 1.0429284647923498, 'bear_tsl_mult': 0.13126654300386403, 'bear_time_stop': 191, 'bear_use_sma': False, 'bear_use_ema': True, 'bear_use_atr': True, 'bear_use_adx': False, 'bear_use_spike': False, 'bear_rsi_required': False, 'sideways_strategy': 'mean_reversion', 'sideways_bb_std_mult': 1.288800991522558, 'sideways_rsi_os': 10, 'sideways_rsi_ob': 85, 'sideways_adx_thresh': 30.10473450622308, 'sideways_atr_min_pct': 0.004950986724092378, 'sideways_atr_max_pct': 0.06442472738083216, 'sideways_tp_mult': 1.6441718361209239, 'sideways_tsl_mult': 0.7991893548326214, 'sideways_time_stop': 236, 'sideways_use_sma': True, 'sideways_use_ema': True, 'sideways_use_atr': False, 'sideways_use_adx': False, 'sideways_use_spike': False, 'sideways_rsi_required': False}.
[I 2025-09-01 09:27:22,643] Trial 178 finished with values: [-0.034742764681584104, 0.03459553231728537] and parameters: {'p_sma': 46, 'p_std': 40, 'p_atr': 30, 'p_adx': 12, 'rsi_period': 67, 'ema1': 19, 'ema2': 45, 'slip_atr_k': 0.10644016814354514, 'slip_spread_k': 0.31378465709670955, 'spread_hl_frac': 0.015254868273664412, 'bb_std_mult': 1.6586630377772873, 'rsi_os': 14, 'rsi_ob': 88, 'vol_spike': 0.21163853807305738, 'adx_thresh': 5.366164959290182, 'atr_min_pct': 0.020274285030922025, 'atr_max_pct': 0.07151077553685106, 'tp_mult': 1.0700999175741663, 'tsl_mult': 0.5645600997759961, 'strategy': 'breakout', 'time_stop': 61, 'use_sma': False, 'use_atr': False, 'use_adx': True, 'use_ema': False, 'use_spike': False, 'rsi_required': False, 'edge_k': 1.429773005376875, 'edge_cap': 0.08873455483638439, 'bull_strategy': 'mean_reversion', 'bull_bb_std_mult': 0.810226157111241, 'bull_rsi_os': 6, 'bull_rsi_ob': 66, 'bull_adx_thresh': 6.175144679622051, 'bull_atr_min_pct': 0.025270230636178382, 'bull_atr_max_pct': 0.11450127095977701, 'bull_tp_mult': 2.138059858761494, 'bull_tsl_mult': 0.8041741401834357, 'bull_time_stop': 226, 'bull_use_sma': True, 'bull_use_ema': False, 'bull_use_atr': False, 'bull_use_adx': False, 'bull_use_spike': False, 'bull_rsi_required': False, 'bear_strategy': 'mean_reversion', 'bear_bb_std_mult': 2.289328333923167, 'bear_rsi_os': 5, 'bear_rsi_ob': 60, 'bear_adx_thresh': 12.195255036659573, 'bear_atr_min_pct': 0.02490500888516191, 'bear_atr_max_pct': 0.04406425083866846, 'bear_tp_mult': 2.1601365951344813, 'bear_tsl_mult': 0.6004956284880125, 'bear_time_stop': 17, 'bear_use_sma': False, 'bear_use_ema': False, 'bear_use_atr': True, 'bear_use_adx': False, 'bear_use_spike': False, 'bear_rsi_required': False, 'sideways_strategy': 'breakout', 'sideways_bb_std_mult': 1.2908480902137789, 'sideways_rsi_os': 41, 'sideways_rsi_ob': 45, 'sideways_adx_thresh': 13.076707570666752, 'sideways_atr_min_pct': 0.0031153258575704786, 'sideways_atr_max_pct': 0.04089879632149396, 'sideways_tp_mult': 1.6550627899214991, 'sideways_tsl_mult': 0.1587464250699071, 'sideways_time_stop': 221, 'sideways_use_sma': True, 'sideways_use_ema': True, 'sideways_use_atr': False, 'sideways_use_adx': False, 'sideways_use_spike': False, 'sideways_rsi_required': False}.
[I 2025-09-01 09:28:02,915] Trial 182 finished with values: [-1000000000.0, 1000000000.0] and parameters: {'p_sma': 56, 'p_std': 24, 'p_atr': 20, 'p_adx': 13, 'rsi_period': 51, 'ema1': 8, 'ema2': 47, 'slip_atr_k': 0.1593161086543872, 'slip_spread_k': 0.5012555691434205, 'spread_hl_frac': 0.021770374731813, 'bb_std_mult': 2.138497950713473, 'rsi_os': 35, 'rsi_ob': 80, 'vol_spike': 0.2130693889422157, 'adx_thresh': 32.94219359254278, 'atr_min_pct': 0.008624875657393238, 'atr_max_pct': 0.13988908936357172, 'tp_mult': 2.1617808941654846, 'tsl_mult': 0.5072973411235007, 'strategy': 'breakout', 'time_stop': 230, 'use_sma': True, 'use_atr': False, 'use_adx': True, 'use_ema': True, 'use_spike': False, 'rsi_required': True, 'edge_k': 0.3440380879942049, 'edge_cap': 0.176983652378235, 'bull_strategy': 'breakout', 'bull_bb_std_mult': 0.547225719424127, 'bull_rsi_os': 17, 'bull_rsi_ob': 57, 'bull_adx_thresh': 31.38508955668077, 'bull_atr_min_pct': 0.02766733105016288, 'bull_atr_max_pct': 0.053991849567255015, 'bull_tp_mult': 2.1786976251668078, 'bull_tsl_mult': 0.8074998740035603, 'bull_time_stop': 116, 'bull_use_sma': False, 'bull_use_ema': True, 'bull_use_atr': False, 'bull_use_adx': True, 'bull_use_spike': True, 'bull_rsi_required': True, 'bear_strategy': 'mean_reversion', 'bear_bb_std_mult': 3.403896476998942, 'bear_rsi_os': 46, 'bear_rsi_ob': 70, 'bear_adx_thresh': 11.045318058768489, 'bear_atr_min_pct': 0.017344959462195306, 'bear_atr_max_pct': 0.11671070277952474, 'bear_tp_mult': 1.0329207240873663, 'bear_tsl_mult': 0.49934586315141233, 'bear_time_stop': 191, 'bear_use_sma': True, 'bear_use_ema': True, 'bear_use_atr': True, 'bear_use_adx': False, 'bear_use_spike': False, 'bear_rsi_required': True, 'sideways_strategy': 'breakout', 'sideways_bb_std_mult': 2.8512715210663244, 'sideways_rsi_os': 45, 'sideways_rsi_ob': 84, 'sideways_adx_thresh': 30.215610804514633, 'sideways_atr_min_pct': 0.0049807195389628516, 'sideways_atr_max_pct': 0.03940528540849532, 'sideways_tp_mult': 2.8427412949597755, 'sideways_tsl_mult': 0.352400258724608, 'sideways_time_stop': 222, 'sideways_use_sma': False, 'sideways_use_ema': False, 'sideways_use_atr': False, 'sideways_use_adx': True, 'sideways_use_spike': True, 'sideways_rsi_required': True}.
[I 2025-09-01 09:28:03,544] Trial 185 finished with values: [-1000000000.0, 1000000000.0] and parameters: {'p_sma': 27, 'p_std': 27, 'p_atr': 15, 'p_adx': 25, 'rsi_period': 51, 'ema1': 9, 'ema2': 48, 'slip_atr_k': 0.2257863816542898, 'slip_spread_k': 0.5100283153369488, 'spread_hl_frac': 0.012272843991804875, 'bb_std_mult': 1.829591526262188, 'rsi_os': 11, 'rsi_ob': 80, 'vol_spike': 0.23734121692266805, 'adx_thresh': 5.087798878869874, 'atr_min_pct': 0.019345507000493898, 'atr_max_pct': 0.14164603256596817, 'tp_mult': 1.8426721029495032, 'tsl_mult': 0.042089276931921285, 'strategy': 'breakout', 'time_stop': 215, 'use_sma': True, 'use_atr': False, 'use_adx': True, 'use_ema': True, 'use_spike': False, 'rsi_required': True, 'edge_k': 0.2723760758188626, 'edge_cap': 0.0812429019830806, 'bull_strategy': 'breakout', 'bull_bb_std_mult': 0.815771799923104, 'bull_rsi_os': 17, 'bull_rsi_ob': 59, 'bull_adx_thresh': 5.112378741215807, 'bull_atr_min_pct': 0.025252989763722623, 'bull_atr_max_pct': 0.05453916962775772, 'bull_tp_mult': 2.150866523666296, 'bull_tsl_mult': 0.1446445624754712, 'bull_time_stop': 117, 'bull_use_sma': False, 'bull_use_ema': True, 'bull_use_atr': False, 'bull_use_adx': True, 'bull_use_spike': True, 'bull_rsi_required': True, 'bear_strategy': 'breakout', 'bear_bb_std_mult': 3.469093970997017, 'bear_rsi_os': 46, 'bear_rsi_ob': 85, 'bear_adx_thresh': 12.11948312620169, 'bear_atr_min_pct': 0.028617427808991028, 'bear_atr_max_pct': 0.11619186606748044, 'bear_tp_mult': 2.166895532303377, 'bear_tsl_mult': 0.46551759816408567, 'bear_time_stop': 15, 'bear_use_sma': True, 'bear_use_ema': True, 'bear_use_atr': True, 'bear_use_adx': True, 'bear_use_spike': False, 'bear_rsi_required': True, 'sideways_strategy': 'breakout', 'sideways_bb_std_mult': 1.086141070324953, 'sideways_rsi_os': 29, 'sideways_rsi_ob': 61, 'sideways_adx_thresh': 33.784671751313645, 'sideways_atr_min_pct': 0.004093387478944666, 'sideways_atr_max_pct': 0.03907001388545299, 'sideways_tp_mult': 1.7849909519809788, 'sideways_tsl_mult': 0.9978765089313287, 'sideways_time_stop': 217, 'sideways_use_sma': False, 'sideways_use_ema': False, 'sideways_use_atr': False, 'sideways_use_adx': True, 'sideways_use_spike': True, 'sideways_rsi_required': True}.
[I 2025-09-01 09:28:03,952] Trial 184 finished with values: [-0.012592061608920235, 0.014110542292302167] and parameters: {'p_sma': 18, 'p_std': 24, 'p_atr': 16, 'p_adx': 15, 'rsi_period': 64, 'ema1': 7, 'ema2': 59, 'slip_atr_k': 0.044918509082074703, 'slip_spread_k': 0.5161381819460522, 'spread_hl_frac': 0.012299244209167715, 'bb_std_mult': 1.8394033211154508, 'rsi_os': 5, 'rsi_ob': 80, 'vol_spike': 0.21101145432845853, 'adx_thresh': 5.075053500593645, 'atr_min_pct': 0.02135663324497819, 'atr_max_pct': 0.031243202751591835, 'tp_mult': 1.243196903273897, 'tsl_mult': 0.06511147080888671, 'strategy': 'mean_reversion', 'time_stop': 215, 'use_sma': True, 'use_atr': False, 'use_adx': True, 'use_ema': True, 'use_spike': True, 'rsi_required': True, 'edge_k': 1.5473529028230963, 'edge_cap': 0.07793861537491646, 'bull_strategy': 'breakout', 'bull_bb_std_mult': 0.7985698657482987, 'bull_rsi_os': 17, 'bull_rsi_ob': 76, 'bull_adx_thresh': 26.54392221125709, 'bull_atr_min_pct': 0.027913896554315157, 'bull_atr_max_pct': 0.05329097145755607, 'bull_tp_mult': 2.5773192954619244, 'bull_tsl_mult': 0.08318292135815382, 'bull_time_stop': 115, 'bull_use_sma': False, 'bull_use_ema': True, 'bull_use_atr': False, 'bull_use_adx': True, 'bull_use_spike': True, 'bull_rsi_required': True, 'bear_strategy': 'mean_reversion', 'bear_bb_std_mult': 0.9441384462713713, 'bear_rsi_os': 46, 'bear_rsi_ob': 59, 'bear_adx_thresh': 27.392458893579715, 'bear_atr_min_pct': 0.028885163946275286, 'bear_atr_max_pct': 0.11686267931353418, 'bear_tp_mult': 2.2330123203129117, 'bear_tsl_mult': 0.46161860580303427, 'bear_time_stop': 152, 'bear_use_sma': True, 'bear_use_ema': True, 'bear_use_atr': True, 'bear_use_adx': False, 'bear_use_spike': False, 'bear_rsi_required': False, 'sideways_strategy': 'breakout', 'sideways_bb_std_mult': 2.874188316013151, 'sideways_rsi_os': 44, 'sideways_rsi_ob': 61, 'sideways_adx_thresh': 30.107568045545925, 'sideways_atr_min_pct': 0.0040579884675727654, 'sideways_atr_max_pct': 0.035080514256603114, 'sideways_tp_mult': 1.7800164057053998, 'sideways_tsl_mult': 0.9384837848958572, 'sideways_time_stop': 140, 'sideways_use_sma': False, 'sideways_use_ema': False, 'sideways_use_atr': False, 'sideways_use_adx': True, 'sideways_use_spike': True, 'sideways_rsi_required': True}.
[I 2025-09-01 09:28:04,374] Trial 183 finished with values: [-0.042078086288914185, 0.041493586655847285] and parameters: {'p_sma': 25, 'p_std': 27, 'p_atr': 20, 'p_adx': 13, 'rsi_period': 30, 'ema1': 21, 'ema2': 19, 'slip_atr_k': 0.22564384906098756, 'slip_spread_k': 0.5049721925597305, 'spread_hl_frac': 0.025649069370225566, 'bb_std_mult': 1.470166180534408, 'rsi_os': 5, 'rsi_ob': 86, 'vol_spike': 0.06523131887705691, 'adx_thresh': 33.200106662148784, 'atr_min_pct': 0.01866869986483712, 'atr_max_pct': 0.14043134774295757, 'tp_mult': 1.2515671401767632, 'tsl_mult': 0.5168584531017811, 'strategy': 'breakout', 'time_stop': 221, 'use_sma': True, 'use_atr': False, 'use_adx': True, 'use_ema': True, 'use_spike': False, 'rsi_required': True, 'edge_k': 0.08790251943384897, 'edge_cap': 0.0718674741704729, 'bull_strategy': 'breakout', 'bull_bb_std_mult': 0.8048248391022237, 'bull_rsi_os': 21, 'bull_rsi_ob': 72, 'bull_adx_thresh': 31.74709383629571, 'bull_atr_min_pct': 0.004592749606300191, 'bull_atr_max_pct': 0.06794872302654302, 'bull_tp_mult': 2.1982947905803383, 'bull_tsl_mult': 0.14917695034311712, 'bull_time_stop': 114, 'bull_use_sma': False, 'bull_use_ema': True, 'bull_use_atr': False, 'bull_use_adx': True, 'bull_use_spike': True, 'bull_rsi_required': True, 'bear_strategy': 'mean_reversion', 'bear_bb_std_mult': 3.409647929349569, 'bear_rsi_os': 39, 'bear_rsi_ob': 59, 'bear_adx_thresh': 11.095002337796592, 'bear_atr_min_pct': 0.017364443663296987, 'bear_atr_max_pct': 0.13023839934153414, 'bear_tp_mult': 1.3240358256146672, 'bear_tsl_mult': 0.4684253225114535, 'bear_time_stop': 226, 'bear_use_sma': True, 'bear_use_ema': True, 'bear_use_atr': True, 'bear_use_adx': False, 'bear_use_spike': False, 'bear_rsi_required': True, 'sideways_strategy': 'breakout', 'sideways_bb_std_mult': 0.6419386342241239, 'sideways_rsi_os': 45, 'sideways_rsi_ob': 61, 'sideways_adx_thresh': 14.228087348572405, 'sideways_atr_min_pct': 0.004247730754167802, 'sideways_atr_max_pct': 0.040560448694080514, 'sideways_tp_mult': 1.7737991357622218, 'sideways_tsl_mult': 0.6423577939150693, 'sideways_time_stop': 140, 'sideways_use_sma': False, 'sideways_use_ema': False, 'sideways_use_atr': False, 'sideways_use_adx': True, 'sideways_use_spike': True, 'sideways_rsi_required': True}.
[I 2025-09-01 09:28:04,999] Trial 186 finished with values: [-1000000000.0, 1000000000.0] and parameters: {'p_sma': 60, 'p_std': 27, 'p_atr': 30, 'p_adx': 15, 'rsi_period': 35, 'ema1': 7, 'ema2': 19, 'slip_atr_k': 0.12779767016439814, 'slip_spread_k': 0.27653496446108905, 'spread_hl_frac': 0.01285576051294044, 'bb_std_mult': 1.8207867151431365, 'rsi_os': 11, 'rsi_ob': 88, 'vol_spike': 0.2377463132840938, 'adx_thresh': 33.86414151090882, 'atr_min_pct': 0.028074201783925397, 'atr_max_pct': 0.012980911856577959, 'tp_mult': 1.8461265379254859, 'tsl_mult': 0.0018421657917246127, 'strategy': 'breakout', 'time_stop': 215, 'use_sma': True, 'use_atr': True, 'use_adx': True, 'use_ema': False, 'use_spike': True, 'rsi_required': False, 'edge_k': 0.050266617013429826, 'edge_cap': 0.07321653398013354, 'bull_strategy': 'mean_reversion', 'bull_bb_std_mult': 0.8013597982623937, 'bull_rsi_os': 18, 'bull_rsi_ob': 59, 'bull_adx_thresh': 26.107328271699593, 'bull_atr_min_pct': 0.02847761787483167, 'bull_atr_max_pct': 0.06755632217976613, 'bull_tp_mult': 1.5725524724051174, 'bull_tsl_mult': 0.08815954083637262, 'bull_time_stop': 126, 'bull_use_sma': True, 'bull_use_ema': False, 'bull_use_atr': False, 'bull_use_adx': False, 'bull_use_spike': False, 'bull_rsi_required': True, 'bear_strategy': 'breakout', 'bear_bb_std_mult': 3.477952105334151, 'bear_rsi_os': 31, 'bear_rsi_ob': 64, 'bear_adx_thresh': 12.358119147978515, 'bear_atr_min_pct': 0.015377560037475289, 'bear_atr_max_pct': 0.11380868338876507, 'bear_tp_mult': 2.249033526396443, 'bear_tsl_mult': 0.6051945161593478, 'bear_time_stop': 227, 'bear_use_sma': False, 'bear_use_ema': True, 'bear_use_atr': True, 'bear_use_adx': True, 'bear_use_spike': True, 'bear_rsi_required': False, 'sideways_strategy': 'breakout', 'sideways_bb_std_mult': 2.2038996983152908, 'sideways_rsi_os': 39, 'sideways_rsi_ob': 45, 'sideways_adx_thresh': 28.6564499854916, 'sideways_atr_min_pct': 0.004056076203800958, 'sideways_atr_max_pct': 0.08369842599234567, 'sideways_tp_mult': 1.7780757315514943, 'sideways_tsl_mult': 0.9399753769865268, 'sideways_time_stop': 81, 'sideways_use_sma': False, 'sideways_use_ema': True, 'sideways_use_atr': False, 'sideways_use_adx': False, 'sideways_use_spike': False, 'sideways_rsi_required': False}.
[I 2025-09-01 09:28:45,108] Trial 190 finished with values: [-1000000000.0, 1000000000.0] and parameters: {'p_sma': 49, 'p_std': 18, 'p_atr': 10, 'p_adx': 27, 'rsi_period': 64, 'ema1': 20, 'ema2': 30, 'slip_atr_k': 0.04682933003793552, 'slip_spread_k': 0.9063179457451656, 'spread_hl_frac': 0.011326899645103819, 'bb_std_mult': 1.8686688711452615, 'rsi_os': 9, 'rsi_ob': 88, 'vol_spike': 0.1164921026501419, 'adx_thresh': 10.943917827341618, 'atr_min_pct': 0.017620046606128176, 'atr_max_pct': 0.14733402026264578, 'tp_mult': 1.0765379137743656, 'tsl_mult': 0.06636452708316498, 'strategy': 'mean_reversion', 'time_stop': 198, 'use_sma': False, 'use_atr': False, 'use_adx': False, 'use_ema': False, 'use_spike': False, 'rsi_required': False, 'edge_k': 1.517819111753532, 'edge_cap': 0.08772501851195637, 'bull_strategy': 'mean_reversion', 'bull_bb_std_mult': 0.6020359324641283, 'bull_rsi_os': 32, 'bull_rsi_ob': 62, 'bull_adx_thresh': 13.712274826876342, 'bull_atr_min_pct': 0.018254704286402582, 'bull_atr_max_pct': 0.06291552872511157, 'bull_tp_mult': 2.084236567103587, 'bull_tsl_mult': 0.8542559339548029, 'bull_time_stop': 233, 'bull_use_sma': True, 'bull_use_ema': False, 'bull_use_atr': False, 'bull_use_adx': False, 'bull_use_spike': False, 'bull_rsi_required': False, 'bear_strategy': 'mean_reversion', 'bear_bb_std_mult': 2.062443275576212, 'bear_rsi_os': 43, 'bear_rsi_ob': 56, 'bear_adx_thresh': 19.218301372328618, 'bear_atr_min_pct': 0.016002665155562142, 'bear_atr_max_pct': 0.08538888671339427, 'bear_tp_mult': 2.306116641216381, 'bear_tsl_mult': 0.29853224282696933, 'bear_time_stop': 198, 'bear_use_sma': False, 'bear_use_ema': False, 'bear_use_atr': False, 'bear_use_adx': False, 'bear_use_spike': False, 'bear_rsi_required': False, 'sideways_strategy': 'breakout', 'sideways_bb_std_mult': 3.2248805426268827, 'sideways_rsi_os': 23, 'sideways_rsi_ob': 51, 'sideways_adx_thresh': 30.987052656794933, 'sideways_atr_min_pct': 0.022215084511269002, 'sideways_atr_max_pct': 0.07635500120753094, 'sideways_tp_mult': 1.8634940001461522, 'sideways_tsl_mult': 0.8949885316000106, 'sideways_time_stop': 59, 'sideways_use_sma': False, 'sideways_use_ema': True, 'sideways_use_atr': False, 'sideways_use_adx': False, 'sideways_use_spike': False, 'sideways_rsi_required': False}.
[I 2025-09-01 09:28:45,655] Trial 187 finished with values: [-1000000000.0, 1000000000.0] and parameters: {'p_sma': 25, 'p_std': 27, 'p_atr': 8, 'p_adx': 17, 'rsi_period': 64, 'ema1': 7, 'ema2': 19, 'slip_atr_k': 0.12451808045280319, 'slip_spread_k': 0.11560588063987676, 'spread_hl_frac': 0.03931446406095479, 'bb_std_mult': 1.994490042142289, 'rsi_os': 9, 'rsi_ob': 88, 'vol_spike': 0.2283173096309089, 'adx_thresh': 15.925603064026832, 'atr_min_pct': 0.020885923369148098, 'atr_max_pct': 0.029988819827880507, 'tp_mult': 1.3702793591357674, 'tsl_mult': 0.0003422566349599483, 'strategy': 'breakout', 'time_stop': 78, 'use_sma': True, 'use_atr': True, 'use_adx': True, 'use_ema': False, 'use_spike': True, 'rsi_required': False, 'edge_k': 1.8600556348290653, 'edge_cap': 0.07159634826636976, 'bull_strategy': 'mean_reversion', 'bull_bb_std_mult': 0.6037149847216966, 'bull_rsi_os': 18, 'bull_rsi_ob': 49, 'bull_adx_thresh': 12.44089148503651, 'bull_atr_min_pct': 0.018525784377068522, 'bull_atr_max_pct': 0.06818592635579136, 'bull_tp_mult': 1.6735437772010024, 'bull_tsl_mult': 0.9992090893798538, 'bull_time_stop': 125, 'bull_use_sma': True, 'bull_use_ema': False, 'bull_use_atr': False, 'bull_use_adx': False, 'bull_use_spike': False, 'bull_rsi_required': False, 'bear_strategy': 'mean_reversion', 'bear_bb_std_mult': 2.3900143170861146, 'bear_rsi_os': 31, 'bear_rsi_ob': 68, 'bear_adx_thresh': 27.538009468835345, 'bear_atr_min_pct': 0.01555862755665065, 'bear_atr_max_pct': 0.11097406363472631, 'bear_tp_mult': 2.231724082229013, 'bear_tsl_mult': 0.098463711411796, 'bear_time_stop': 227, 'bear_use_sma': False, 'bear_use_ema': True, 'bear_use_atr': True, 'bear_use_adx': False, 'bear_use_spike': True, 'bear_rsi_required': False, 'sideways_strategy': 'breakout', 'sideways_bb_std_mult': 0.6347412920328979, 'sideways_rsi_os': 23, 'sideways_rsi_ob': 45, 'sideways_adx_thresh': 14.22432234935598, 'sideways_atr_min_pct': 0.022553076343282887, 'sideways_atr_max_pct': 0.08321551353249594, 'sideways_tp_mult': 2.966853840823551, 'sideways_tsl_mult': 0.9351660422961233, 'sideways_time_stop': 202, 'sideways_use_sma': False, 'sideways_use_ema': True, 'sideways_use_atr': False, 'sideways_use_adx': False, 'sideways_use_spike': False, 'sideways_rsi_required': False}.
