[I 2025-09-01 09:03:06,074] Trial 26 finished with values: [-0.10850147365336071, 0.10832658212669959] and parameters: {'p_sma': 14, 'p_std': 29, 'p_atr': 15, 'p_adx': 10, 'rsi_period': 24, 'ema1': 21, 'ema2': 55, 'slip_atr_k': 0.04480054592579709, 'slip_spread_k': 0.5817200030547616, 'spread_hl_frac': 0.03401706822873054, 'bb_std_mult': 2.7695561512913005, 'rsi_os': 41, 'rsi_ob': 51, 'vol_spike': 0.04493559615161198, 'adx_thresh': 17.593436307977864, 'atr_min_pct': 0.004898918712314826, 'atr_max_pct': 0.09277108420244932, 'tp_mult': 2.905779077921059, 'tsl_mult': 0.49286377251235336, 'strategy': 'mean_reversion', 'time_stop': 59, 'use_sma': False, 'use_atr': True, 'use_adx': False, 'use_ema': True, 'use_spike': False, 'rsi_required': True, 'edge_k': 0.38757367006289534, 'edge_cap': 0.4354668912234586, 'bull_strategy': 'mean_reversion', 'bull_bb_std_mult': 3.1533841976587635, 'bull_rsi_os': 26, 'bull_rsi_ob': 79, 'bull_adx_thresh': 25.096025641585868, 'bull_atr_min_pct': 0.0005620717434547911, 'bull_atr_max_pct': 0.03655604658220217, 'bull_tp_mult': 2.4888715219270376, 'bull_tsl_mult': 0.43427024188366803, 'bull_time_stop': 53, 'bull_use_sma': True, 'bull_use_ema': False, 'bull_use_atr': False, 'bull_use_adx': False, 'bull_use_spike': True, 'bull_rsi_required': False, 'bear_strategy': 'mean_reversion', 'bear_bb_std_mult': 3.5956191573942133, 'bear_rsi_os': 32, 'bear_rsi_ob': 87, 'bear_adx_thresh': 30.256147360680956, 'bear_atr_min_pct': 0.017334240055982508, 'bear_atr_max_pct': 0.03502238368017328, 'bear_tp_mult': 2.4983268631865636, 'bear_tsl_mult': 0.15349573476388095, 'bear_time_stop': 250, 'bear_use_sma': True, 'bear_use_ema': True, 'bear_use_atr': False, 'bear_use_adx': True, 'bear_use_spike': True, 'bear_rsi_required': False, 'sideways_strategy': 'mean_reversion', 'sideways_bb_std_mult': 3.598172531873239, 'sideways_rsi_os': 40, 'sideways_rsi_ob': 79, 'sideways_adx_thresh': 16.424887791610058, 'sideways_atr_min_pct': 0.02956487889699107, 'sideways_atr_max_pct': 0.06346144478856547, 'sideways_tp_mult': 2.7399881150893397, 'sideways_tsl_mult': 0.7383028437508428, 'sideways_time_stop': 163, 'sideways_use_sma': True, 'sideways_use_ema': True, 'sideways_use_atr': False, 'sideways_use_adx': True, 'sideways_use_spike': True, 'sideways_rsi_required': True}.
[I 2025-09-01 09:03:06,295] Trial 31 finished with values: [-1000000000.0, 1000000000.0] and parameters: {'p_sma': 19, 'p_std': 52, 'p_atr': 22, 'p_adx': 13, 'rsi_period': 16, 'ema1': 16, 'ema2': 53, 'slip_atr_k': 0.11154713934734835, 'slip_spread_k': 0.8727739515014907, 'spread_hl_frac': 0.028307285669276296, 'bb_std_mult': 3.075254781589009, 'rsi_os': 33, 'rsi_ob': 50, 'vol_spike': 0.160074519592139, 'adx_thresh': 9.849221019490695, 'atr_min_pct': 0.010710747427927596, 'atr_max_pct': 0.12000201980026953, 'tp_mult': 2.6648445742481965, 'tsl_mult': 0.6854135066878271, 'strategy': 'mean_reversion', 'time_stop': 31, 'use_sma': True, 'use_atr': True, 'use_adx': True, 'use_ema': False, 'use_spike': False, 'rsi_required': True, 'edge_k': 0.23720756188800524, 'edge_cap': 0.62932494146883, 'bull_strategy': 'breakout', 'bull_bb_std_mult': 2.738218261955429, 'bull_rsi_os': 37, 'bull_rsi_ob': 89, 'bull_adx_thresh': 10.77593057356639, 'bull_atr_min_pct': 0.005358682147198564, 'bull_atr_max_pct': 0.05497245858328895, 'bull_tp_mult': 2.112882597828482, 'bull_tsl_mult': 0.3939906036936257, 'bull_time_stop': 130, 'bull_use_sma': False, 'bull_use_ema': True, 'bull_use_atr': True, 'bull_use_adx': True, 'bull_use_spike': False, 'bull_rsi_required': False, 'bear_strategy': 'breakout', 'bear_bb_std_mult': 3.2613220014533826, 'bear_rsi_os': 34, 'bear_rsi_ob': 81, 'bear_adx_thresh': 23.483278787110557, 'bear_atr_min_pct': 0.02187537812181254, 'bear_atr_max_pct': 0.08394100626208717, 'bear_tp_mult': 1.374851962687492, 'bear_tsl_mult': 0.5578715712900765, 'bear_time_stop': 108, 'bear_use_sma': False, 'bear_use_ema': False, 'bear_use_atr': True, 'bear_use_adx': False, 'bear_use_spike': False, 'bear_rsi_required': True, 'sideways_strategy': 'mean_reversion', 'sideways_bb_std_mult': 3.262447347956802, 'sideways_rsi_os': 20, 'sideways_rsi_ob': 91, 'sideways_adx_thresh': 33.844331399375896, 'sideways_atr_min_pct': 0.026499317568243606, 'sideways_atr_max_pct': 0.12994225536910434, 'sideways_tp_mult': 2.263021213176544, 'sideways_tsl_mult': 0.6009392900159264, 'sideways_time_stop': 241, 'sideways_use_sma': False, 'sideways_use_ema': False, 'sideways_use_atr': True, 'sideways_use_adx': False, 'sideways_use_spike': True, 'sideways_rsi_required': True}.
[I 2025-09-01 09:03:44,789] Trial 32 finished with values: [-0.15118354555624447, 0.1510770970499178] and parameters: {'p_sma': 11, 'p_std': 21, 'p_atr': 29, 'p_adx': 9, 'rsi_period': 43, 'ema1': 25, 'ema2': 60, 'slip_atr_k': 0.13440694477192883, 'slip_spread_k': 0.1593580629794133, 'spread_hl_frac': 0.03842281684392722, 'bb_std_mult': 2.3721726470297115, 'rsi_os': 35, 'rsi_ob': 76, 'vol_spike': 0.10718534383944754, 'adx_thresh': 22.618889463426093, 'atr_min_pct': 0.0012940254876689762, 'atr_max_pct': 0.11889660464521061, 'tp_mult': 2.6840214064742396, 'tsl_mult': 0.8193970820632681, 'strategy': 'mean_reversion', 'time_stop': 126, 'use_sma': True, 'use_atr': True, 'use_adx': True, 'use_ema': False, 'use_spike': False, 'rsi_required': True, 'edge_k': 0.8832652957664813, 'edge_cap': 0.45357404033028215, 'bull_strategy': 'breakout', 'bull_bb_std_mult': 2.514097811347453, 'bull_rsi_os': 22, 'bull_rsi_ob': 80, 'bull_adx_thresh': 11.215010483627996, 'bull_atr_min_pct': 0.0005728059199178264, 'bull_atr_max_pct': 0.015117627207411402, 'bull_tp_mult': 2.6153563161758044, 'bull_tsl_mult': 0.519385770912307, 'bull_time_stop': 129, 'bull_use_sma': False, 'bull_use_ema': False, 'bull_use_atr': True, 'bull_use_adx': True, 'bull_use_spike': True, 'bull_rsi_required': False, 'bear_strategy': 'breakout', 'bear_bb_std_mult': 0.8495808216554577, 'bear_rsi_os': 5, 'bear_rsi_ob': 81, 'bear_adx_thresh': 17.73348490958149, 'bear_atr_min_pct': 0.01457336050714355, 'bear_atr_max_pct': 0.027718791398101215, 'bear_tp_mult': 1.4926055082345577, 'bear_tsl_mult': 0.2189582856031408, 'bear_time_stop': 276, 'bear_use_sma': False, 'bear_use_ema': False, 'bear_use_atr': True, 'bear_use_adx': True, 'bear_use_spike': True, 'bear_rsi_required': False, 'sideways_strategy': 'mean_reversion', 'sideways_bb_std_mult': 3.060742724525407, 'sideways_rsi_os': 33, 'sideways_rsi_ob': 67, 'sideways_adx_thresh': 31.84235514121621, 'sideways_atr_min_pct': 0.017061935688651178, 'sideways_atr_max_pct': 0.10401465078522977, 'sideways_tp_mult': 2.0831287054820242, 'sideways_tsl_mult': 0.77979117934139, 'sideways_time_stop': 260, 'sideways_use_sma': True, 'sideways_use_ema': False, 'sideways_use_atr': False, 'sideways_use_adx': False, 'sideways_use_spike': False, 'sideways_rsi_required': False}.
[I 2025-09-01 09:03:45,071] Trial 29 finished with values: [-0.04942381413953678, 0.04921403123131016] and parameters: {'p_sma': 14, 'p_std': 51, 'p_atr': 22, 'p_adx': 9, 'rsi_period': 18, 'ema1': 16, 'ema2': 54, 'slip_atr_k': 0.13116483727284184, 'slip_spread_k': 0.8524751689320128, 'spread_hl_frac': 0.03528432193593288, 'bb_std_mult': 3.543912522187454, 'rsi_os': 34, 'rsi_ob': 51, 'vol_spike': 0.05575677076983272, 'adx_thresh': 10.128973181286337, 'atr_min_pct': 0.010416818125793143, 'atr_max_pct': 0.09420527177675792, 'tp_mult': 2.7125187428336774, 'tsl_mult': 0.646631669288223, 'strategy': 'mean_reversion', 'time_stop': 132, 'use_sma': True, 'use_atr': True, 'use_adx': True, 'use_ema': False, 'use_spike': False, 'rsi_required': True, 'edge_k': 0.21558702631188442, 'edge_cap': 0.4205899044774684, 'bull_strategy': 'mean_reversion', 'bull_bb_std_mult': 3.5543030003896483, 'bull_rsi_os': 25, 'bull_rsi_ob': 79, 'bull_adx_thresh': 18.53820504492132, 'bull_atr_min_pct': 0.001435640824147395, 'bull_atr_max_pct': 0.038904413461149305, 'bull_tp_mult': 2.501055924933606, 'bull_tsl_mult': 0.41333604410244834, 'bull_time_stop': 131, 'bull_use_sma': True, 'bull_use_ema': False, 'bull_use_atr': False, 'bull_use_adx': True, 'bull_use_spike': False, 'bull_rsi_required': False, 'bear_strategy': 'mean_reversion', 'bear_bb_std_mult': 3.2895582032388373, 'bear_rsi_os': 31, 'bear_rsi_ob': 81, 'bear_adx_thresh': 23.33372147301919, 'bear_atr_min_pct': 0.01740181889426553, 'bear_atr_max_pct': 0.03462737412284754, 'bear_tp_mult': 2.5490533648720657, 'bear_tsl_mult': 0.19709155741117299, 'bear_time_stop': 247, 'bear_use_sma': False, 'bear_use_ema': True, 'bear_use_atr': True, 'bear_use_adx': False, 'bear_use_spike': False, 'bear_rsi_required': False, 'sideways_strategy': 'mean_reversion', 'sideways_bb_std_mult': 3.5051765936686237, 'sideways_rsi_os': 38, 'sideways_rsi_ob': 78, 'sideways_adx_thresh': 33.721732961583314, 'sideways_atr_min_pct': 0.029055367887296298, 'sideways_atr_max_pct': 0.10165554565072282, 'sideways_tp_mult': 2.808811449853313, 'sideways_tsl_mult': 0.6995187192579372, 'sideways_time_stop': 172, 'sideways_use_sma': False, 'sideways_use_ema': True, 'sideways_use_atr': False, 'sideways_use_adx': False, 'sideways_use_spike': True, 'sideways_rsi_required': True}.
[I 2025-09-01 09:03:45,722] Trial 30 finished with values: [-0.054842257115537696, 0.054642552886073954] and parameters: {'p_sma': 14, 'p_std': 51, 'p_atr': 22, 'p_adx': 9, 'rsi_period': 14, 'ema1': 16, 'ema2': 53, 'slip_atr_k': 0.12118533285768107, 'slip_spread_k': 0.856202406616387, 'spread_hl_frac': 0.02979089389536651, 'bb_std_mult': 3.0497814884249888, 'rsi_os': 34, 'rsi_ob': 51, 'vol_spike': 0.10557726374071875, 'adx_thresh': 10.421995553591014, 'atr_min_pct': 0.010696607429193776, 'atr_max_pct': 0.11613619277376025, 'tp_mult': 2.7284429485841306, 'tsl_mult': 0.6432088489591742, 'strategy': 'mean_reversion', 'time_stop': 37, 'use_sma': True, 'use_atr': True, 'use_adx': True, 'use_ema': False, 'use_spike': False, 'rsi_required': True, 'edge_k': 0.2764331686892624, 'edge_cap': 0.42723358235261977, 'bull_strategy': 'mean_reversion', 'bull_bb_std_mult': 2.530568381817528, 'bull_rsi_os': 5, 'bull_rsi_ob': 94, 'bull_adx_thresh': 11.107790151070596, 'bull_atr_min_pct': 0.0011516246665708857, 'bull_atr_max_pct': 0.055649883018437964, 'bull_tp_mult': 2.5503336349590113, 'bull_tsl_mult': 0.40223802201996345, 'bull_time_stop': 141, 'bull_use_sma': True, 'bull_use_ema': False, 'bull_use_atr': False, 'bull_use_adx': True, 'bull_use_spike': False, 'bull_rsi_required': False, 'bear_strategy': 'mean_reversion', 'bear_bb_std_mult': 3.2056779313826156, 'bear_rsi_os': 35, 'bear_rsi_ob': 81, 'bear_adx_thresh': 23.657253306529483, 'bear_atr_min_pct': 0.022613576734095045, 'bear_atr_max_pct': 0.08455781472052881, 'bear_tp_mult': 1.4795673921227364, 'bear_tsl_mult': 0.18492800241362706, 'bear_time_stop': 106, 'bear_use_sma': False, 'bear_use_ema': True, 'bear_use_atr': True, 'bear_use_adx': False, 'bear_use_spike': False, 'bear_rsi_required': False, 'sideways_strategy': 'mean_reversion', 'sideways_bb_std_mult': 3.197293406612203, 'sideways_rsi_os': 38, 'sideways_rsi_ob': 88, 'sideways_adx_thresh': 33.83415582617304, 'sideways_atr_min_pct': 0.026600937428499064, 'sideways_atr_max_pct': 0.1270782072595823, 'sideways_tp_mult': 2.263578099228251, 'sideways_tsl_mult': 0.5965546742961596, 'sideways_time_stop': 164, 'sideways_use_sma': False, 'sideways_use_ema': True, 'sideways_use_atr': False, 'sideways_use_adx': False, 'sideways_use_spike': True, 'sideways_rsi_required': True}.
[I 2025-09-01 09:03:46,017] Trial 28 finished with values: [-0.050139019998271084, 0.049960068249326306] and parameters: {'p_sma': 13, 'p_std': 52, 'p_atr': 20, 'p_adx': 9, 'rsi_period': 21, 'ema1': 16, 'ema2': 53, 'slip_atr_k': 0.1326272983198325, 'slip_spread_k': 0.0001542933978812555, 'spread_hl_frac': 0.03343865894659748, 'bb_std_mult': 3.5024197055250035, 'rsi_os': 37, 'rsi_ob': 51, 'vol_spike': 0.05471679751233223, 'adx_thresh': 11.626152020377887, 'atr_min_pct': 0.0010778745698353277, 'atr_max_pct': 0.09244213539777736, 'tp_mult': 2.947470084505059, 'tsl_mult': 0.629027128410077, 'strategy': 'mean_reversion', 'time_stop': 36, 'use_sma': True, 'use_atr': True, 'use_adx': True, 'use_ema': False, 'use_spike': False, 'rsi_required': True, 'edge_k': 0.24717570162396624, 'edge_cap': 0.42354641244770885, 'bull_strategy': 'mean_reversion', 'bull_bb_std_mult': 2.581613848452976, 'bull_rsi_os': 26, 'bull_rsi_ob': 79, 'bull_adx_thresh': 18.671436504808064, 'bull_atr_min_pct': 0.0008453963587701993, 'bull_atr_max_pct': 0.038619678809113794, 'bull_tp_mult': 2.571246980899826, 'bull_tsl_mult': 0.4164522773823179, 'bull_time_stop': 130, 'bull_use_sma': True, 'bull_use_ema': False, 'bull_use_atr': False, 'bull_use_adx': True, 'bull_use_spike': False, 'bull_rsi_required': False, 'bear_strategy': 'mean_reversion', 'bear_bb_std_mult': 3.2561305458519265, 'bear_rsi_os': 30, 'bear_rsi_ob': 81, 'bear_adx_thresh': 23.10083450112691, 'bear_atr_min_pct': 0.01712522646320589, 'bear_atr_max_pct': 0.033344881608337096, 'bear_tp_mult': 2.476618817260447, 'bear_tsl_mult': 0.2126165269680112, 'bear_time_stop': 245, 'bear_use_sma': False, 'bear_use_ema': True, 'bear_use_atr': True, 'bear_use_adx': False, 'bear_use_spike': False, 'bear_rsi_required': False, 'sideways_strategy': 'mean_reversion', 'sideways_bb_std_mult': 3.4854164059177095, 'sideways_rsi_os': 39, 'sideways_rsi_ob': 78, 'sideways_adx_thresh': 32.11241191021296, 'sideways_atr_min_pct': 0.029657483311776096, 'sideways_atr_max_pct': 0.10412070801155558, 'sideways_tp_mult': 2.7927841506075333, 'sideways_tsl_mult': 0.7265413516391036, 'sideways_time_stop': 174, 'sideways_use_sma': False, 'sideways_use_ema': True, 'sideways_use_atr': False, 'sideways_use_adx': False, 'sideways_use_spike': True, 'sideways_rsi_required': True}.
[I 2025-09-01 09:03:46,329] Trial 34 finished with values: [-1000000000.0, 1000000000.0] and parameters: {'p_sma': 10, 'p_std': 41, 'p_atr': 20, 'p_adx': 14, 'rsi_period': 17, 'ema1': 18, 'ema2': 57, 'slip_atr_k': 0.1302572361594772, 'slip_spread_k': 0.6813471717108665, 'spread_hl_frac': 0.030617408330582043, 'bb_std_mult': 1.8921502539709059, 'rsi_os': 51, 'rsi_ob': 88, 'vol_spike': 0.0665763429526994, 'adx_thresh': 19.169515111340736, 'atr_min_pct': 0.016496030525824986, 'atr_max_pct': 0.07162547822603772, 'tp_mult': 2.964471349447443, 'tsl_mult': 0.5700831790063888, 'strategy': 'mean_reversion', 'time_stop': 38, 'use_sma': False, 'use_atr': True, 'use_adx': False, 'use_ema': True, 'use_spike': False, 'rsi_required': True, 'edge_k': 0.194759213380509, 'edge_cap': 0.2145100767938995, 'bull_strategy': 'breakout', 'bull_bb_std_mult': 3.582996122833504, 'bull_rsi_os': 27, 'bull_rsi_ob': 94, 'bull_adx_thresh': 18.4388473765801, 'bull_atr_min_pct': 0.0021165059269406287, 'bull_atr_max_pct': 0.04864759892971516, 'bull_tp_mult': 2.6247428911448116, 'bull_tsl_mult': 0.3702024410182978, 'bull_time_stop': 75, 'bull_use_sma': False, 'bull_use_ema': True, 'bull_use_atr': True, 'bull_use_adx': True, 'bull_use_spike': True, 'bull_rsi_required': False, 'bear_strategy': 'breakout', 'bear_bb_std_mult': 3.2760182716217434, 'bear_rsi_os': 29, 'bear_rsi_ob': 91, 'bear_adx_thresh': 28.340290359655388, 'bear_atr_min_pct': 0.024030038284941498, 'bear_atr_max_pct': 0.14946803492801963, 'bear_tp_mult': 2.6589961924535515, 'bear_tsl_mult': 0.29483950253735947, 'bear_time_stop': 236, 'bear_use_sma': True, 'bear_use_ema': False, 'bear_use_atr': False, 'bear_use_adx': True, 'bear_use_spike': True, 'bear_rsi_required': True, 'sideways_strategy': 'mean_reversion', 'sideways_bb_std_mult': 3.2644028250469437, 'sideways_rsi_os': 39, 'sideways_rsi_ob': 75, 'sideways_adx_thresh': 27.4451487953512, 'sideways_atr_min_pct': 0.02685692218822552, 'sideways_atr_max_pct': 0.10863590357145131, 'sideways_tp_mult': 2.986764272531239, 'sideways_tsl_mult': 0.6156603999400604, 'sideways_time_stop': 154, 'sideways_use_sma': True, 'sideways_use_ema': False, 'sideways_use_atr': True, 'sideways_use_adx': True, 'sideways_use_spike': True, 'sideways_rsi_required': True}.
[I 2025-09-01 09:03:46,330] Trial 33 finished with values: [-1000000000.0, 1000000000.0] and parameters: {'p_sma': 9, 'p_std': 43, 'p_atr': 20, 'p_adx': 13, 'rsi_period': 18, 'ema1': 13, 'ema2': 57, 'slip_atr_k': 0.11868139531924923, 'slip_spread_k': 0.6838031405520337, 'spread_hl_frac': 0.030565311988351405, 'bb_std_mult': 1.84946474727143, 'rsi_os': 51, 'rsi_ob': 85, 'vol_spike': 0.1545644358907436, 'adx_thresh': 13.246295233479, 'atr_min_pct': 0.010119103002521106, 'atr_max_pct': 0.13487864018258097, 'tp_mult': 2.972962877935366, 'tsl_mult': 0.7562931579773227, 'strategy': 'mean_reversion', 'time_stop': 5, 'use_sma': False, 'use_atr': True, 'use_adx': False, 'use_ema': True, 'use_spike': False, 'rsi_required': True, 'edge_k': 0.1939179549977278, 'edge_cap': 0.26227876091438646, 'bull_strategy': 'breakout', 'bull_bb_std_mult': 3.3171950942410477, 'bull_rsi_os': 35, 'bull_rsi_ob': 77, 'bull_adx_thresh': 13.287748548219078, 'bull_atr_min_pct': 0.002462454123284855, 'bull_atr_max_pct': 0.08791806046721057, 'bull_tp_mult': 2.3543275458336383, 'bull_tsl_mult': 0.481582967312816, 'bull_time_stop': 258, 'bull_use_sma': False, 'bull_use_ema': True, 'bull_use_atr': True, 'bull_use_adx': True, 'bull_use_spike': True, 'bull_rsi_required': False, 'bear_strategy': 'breakout', 'bear_bb_std_mult': 3.0020146448587655, 'bear_rsi_os': 27, 'bear_rsi_ob': 91, 'bear_adx_thresh': 32.460737825913625, 'bear_atr_min_pct': 0.01623766265524529, 'bear_atr_max_pct': 0.059733446207115945, 'bear_tp_mult': 2.698113133032365, 'bear_tsl_mult': 0.08454249265761232, 'bear_time_stop': 234, 'bear_use_sma': True, 'bear_use_ema': False, 'bear_use_atr': False, 'bear_use_adx': True, 'bear_use_spike': True, 'bear_rsi_required': True, 'sideways_strategy': 'mean_reversion', 'sideways_bb_std_mult': 3.2679464249782884, 'sideways_rsi_os': 40, 'sideways_rsi_ob': 74, 'sideways_adx_thresh': 18.754506041399264, 'sideways_atr_min_pct': 0.026574566265231046, 'sideways_atr_max_pct': 0.09075830370309729, 'sideways_tp_mult': 2.857846566631557, 'sideways_tsl_mult': 0.5959872280432694, 'sideways_time_stop': 156, 'sideways_use_sma': True, 'sideways_use_ema': False, 'sideways_use_atr': True, 'sideways_use_adx': True, 'sideways_use_spike': True, 'sideways_rsi_required': True}.
[I 2025-09-01 09:03:46,337] Trial 35 finished with values: [-1000000000.0, 1000000000.0] and parameters: {'p_sma': 9, 'p_std': 60, 'p_atr': 20, 'p_adx': 14, 'rsi_period': 17, 'ema1': 12, 'ema2': 57, 'slip_atr_k': 0.06293739894723867, 'slip_spread_k': 0.679992421075104, 'spread_hl_frac': 0.03059959265102681, 'bb_std_mult': 1.8799455970964916, 'rsi_os': 50, 'rsi_ob': 45, 'vol_spike': 0.25365033218149036, 'adx_thresh': 13.422398548725688, 'atr_min_pct': 0.01701765975189578, 'atr_max_pct': 0.13085492804285292, 'tp_mult': 2.995624932995002, 'tsl_mult': 0.5906293757268232, 'strategy': 'mean_reversion', 'time_stop': 21, 'use_sma': True, 'use_atr': True, 'use_adx': False, 'use_ema': True, 'use_spike': False, 'rsi_required': False, 'edge_k': 0.0022162828573446536, 'edge_cap': 0.19668129070259172, 'bull_strategy': 'mean_reversion', 'bull_bb_std_mult': 3.2340894983769517, 'bull_rsi_os': 35, 'bull_rsi_ob': 94, 'bull_adx_thresh': 23.648693572136438, 'bull_atr_min_pct': 0.0022208248088988513, 'bull_atr_max_pct': 0.057904646148747824, 'bull_tp_mult': 2.3658896823930644, 'bull_tsl_mult': 0.3710460292922946, 'bull_time_stop': 249, 'bull_use_sma': True, 'bull_use_ema': False, 'bull_use_atr': False, 'bull_use_adx': True, 'bull_use_spike': False, 'bull_rsi_required': False, 'bear_strategy': 'mean_reversion', 'bear_bb_std_mult': 3.230865163674768, 'bear_rsi_os': 28, 'bear_rsi_ob': 91, 'bear_adx_thresh': 23.6125387912923, 'bear_atr_min_pct': 0.015342874332815238, 'bear_atr_max_pct': 0.05826201470509426, 'bear_tp_mult': 2.067466654791656, 'bear_tsl_mult': 0.08169914961617851, 'bear_time_stop': 230, 'bear_use_sma': True, 'bear_use_ema': True, 'bear_use_atr': False, 'bear_use_adx': False, 'bear_use_spike': False, 'bear_rsi_required': True, 'sideways_strategy': 'breakout', 'sideways_bb_std_mult': 3.2815867134894714, 'sideways_rsi_os': 36, 'sideways_rsi_ob': 74, 'sideways_adx_thresh': 19.493556920366117, 'sideways_atr_min_pct': 0.026867340554393167, 'sideways_atr_max_pct': 0.08845436853100269, 'sideways_tp_mult': 2.9796292982642627, 'sideways_tsl_mult': 0.6158607074786021, 'sideways_time_stop': 170, 'sideways_use_sma': False, 'sideways_use_ema': True, 'sideways_use_atr': False, 'sideways_use_adx': False, 'sideways_use_spike': False, 'sideways_rsi_required': False}.
