[I 2025-09-01 09:32:56,593] Trial 213 finished with values: [-1000000000.0, 1000000000.0] and parameters: {'p_sma': 28, 'p_std': 59, 'p_atr': 17, 'p_adx': 28, 'rsi_period': 33, 'ema1': 5, 'ema2': 17, 'slip_atr_k': 0.04067871622994156, 'slip_spread_k': 0.538416004221999, 'spread_hl_frac': 0.0021347603111322826, 'bb_std_mult': 1.7691521152167375, 'rsi_os': 24, 'rsi_ob': 71, 'vol_spike': 0.1822127564143567, 'adx_thresh': 7.065394389325274, 'atr_min_pct': 0.018880916197117965, 'atr_max_pct': 0.11480328057811781, 'tp_mult': 2.408948835657674, 'tsl_mult': 0.9225689367571129, 'strategy': 'breakout', 'time_stop': 215, 'use_sma': True, 'use_atr': False, 'use_adx': True, 'use_ema': False, 'use_spike': False, 'rsi_required': False, 'edge_k': 1.4882296079948976, 'edge_cap': 0.28518311928965623, 'bull_strategy': 'breakout', 'bull_bb_std_mult': 3.5190903289727213, 'bull_rsi_os': 19, 'bull_rsi_ob': 86, 'bull_adx_thresh': 8.35909184918545, 'bull_atr_min_pct': 0.008702417851720792, 'bull_atr_max_pct': 0.06453139657589875, 'bull_tp_mult': 2.1511075436578575, 'bull_tsl_mult': 0.2477917439356137, 'bull_time_stop': 105, 'bull_use_sma': False, 'bull_use_ema': True, 'bull_use_atr': False, 'bull_use_adx': True, 'bull_use_spike': False, 'bull_rsi_required': True, 'bear_strategy': 'mean_reversion', 'bear_bb_std_mult': 3.2577510126759126, 'bear_rsi_os': 23, 'bear_rsi_ob': 82, 'bear_adx_thresh': 28.88263408549586, 'bear_atr_min_pct': 0.020717284346689884, 'bear_atr_max_pct': 0.11531799792734154, 'bear_tp_mult': 2.808082636553678, 'bear_tsl_mult': 0.3842924927458404, 'bear_time_stop': 213, 'bear_use_sma': True, 'bear_use_ema': True, 'bear_use_atr': True, 'bear_use_adx': False, 'bear_use_spike': True, 'bear_rsi_required': False, 'sideways_strategy': 'breakout', 'sideways_bb_std_mult': 2.640378296638508, 'sideways_rsi_os': 18, 'sideways_rsi_ob': 45, 'sideways_adx_thresh': 24.654747111112147, 'sideways_atr_min_pct': 0.02993841506179032, 'sideways_atr_max_pct': 0.06383665321682497, 'sideways_tp_mult': 1.0626967521820276, 'sideways_tsl_mult': 0.11508693235312928, 'sideways_time_stop': 214, 'sideways_use_sma': True, 'sideways_use_ema': True, 'sideways_use_atr': False, 'sideways_use_adx': True, 'sideways_use_spike': True, 'sideways_rsi_required': True}.
[I 2025-09-01 09:33:35,379] Trial 217 finished with values: [-1000000000.0, 1000000000.0] and parameters: {'p_sma': 55, 'p_std': 24, 'p_atr': 11, 'p_adx': 16, 'rsi_period': 67, 'ema1': 5, 'ema2': 18, 'slip_atr_k': 0.029393407378346746, 'slip_spread_k': 0.5323365108745107, 'spread_hl_frac': 0.014113757100847873, 'bb_std_mult': 1.7591958776250138, 'rsi_os': 8, 'rsi_ob': 86, 'vol_spike': 0.08148088166608765, 'adx_thresh': 32.227726785954765, 'atr_min_pct': 0.0020995038327913454, 'atr_max_pct': 0.11507848771533222, 'tp_mult': 1.8213400273354596, 'tsl_mult': 0.6703720979834986, 'strategy': 'mean_reversion', 'time_stop': 171, 'use_sma': True, 'use_atr': False, 'use_adx': True, 'use_ema': False, 'use_spike': False, 'rsi_required': False, 'edge_k': 0.467817471359649, 'edge_cap': 0.08934946263798578, 'bull_strategy': 'mean_reversion', 'bull_bb_std_mult': 0.6612366407819232, 'bull_rsi_os': 16, 'bull_rsi_ob': 90, 'bull_adx_thresh': 29.819460886145336, 'bull_atr_min_pct': 0.029001944934359702, 'bull_atr_max_pct': 0.05602358805404295, 'bull_tp_mult': 2.8552299450247287, 'bull_tsl_mult': 0.0918873085446925, 'bull_time_stop': 105, 'bull_use_sma': True, 'bull_use_ema': False, 'bull_use_atr': False, 'bull_use_adx': True, 'bull_use_spike': False, 'bull_rsi_required': True, 'bear_strategy': 'mean_reversion', 'bear_bb_std_mult': 2.5147738908364876, 'bear_rsi_os': 37, 'bear_rsi_ob': 83, 'bear_adx_thresh': 19.871958779253532, 'bear_atr_min_pct': 0.020686736978256254, 'bear_atr_max_pct': 0.06653453289668457, 'bear_tp_mult': 1.8893141256298374, 'bear_tsl_mult': 0.4206230659429615, 'bear_time_stop': 89, 'bear_use_sma': False, 'bear_use_ema': True, 'bear_use_atr': True, 'bear_use_adx': False, 'bear_use_spike': False, 'bear_rsi_required': False, 'sideways_strategy': 'mean_reversion', 'sideways_bb_std_mult': 3.001136913358587, 'sideways_rsi_os': 40, 'sideways_rsi_ob': 81, 'sideways_adx_thresh': 21.059063510858227, 'sideways_atr_min_pct': 0.002354703413913228, 'sideways_atr_max_pct': 0.06472438517519147, 'sideways_tp_mult': 1.8606322046136463, 'sideways_tsl_mult': 0.9476831987575262, 'sideways_time_stop': 216, 'sideways_use_sma': False, 'sideways_use_ema': True, 'sideways_use_atr': False, 'sideways_use_adx': False, 'sideways_use_spike': False, 'sideways_rsi_required': False}.
[I 2025-09-01 09:33:35,795] Trial 219 finished with values: [-0.1549742857812898, 0.154809098681349] and parameters: {'p_sma': 51, 'p_std': 24, 'p_atr': 30, 'p_adx': 23, 'rsi_period': 18, 'ema1': 20, 'ema2': 14, 'slip_atr_k': 0.04983924031357788, 'slip_spread_k': 0.6147370507266025, 'spread_hl_frac': 0.04555333050109061, 'bb_std_mult': 1.8512802786187503, 'rsi_os': 23, 'rsi_ob': 87, 'vol_spike': 0.20936489310375128, 'adx_thresh': 26.360886073656307, 'atr_min_pct': 0.021219562753648794, 'atr_max_pct': 0.141739349090631, 'tp_mult': 1.0148522679504346, 'tsl_mult': 0.397299440758202, 'strategy': 'breakout', 'time_stop': 216, 'use_sma': True, 'use_atr': False, 'use_adx': False, 'use_ema': False, 'use_spike': True, 'rsi_required': False, 'edge_k': 1.4420241761357782, 'edge_cap': 0.08780320262535996, 'bull_strategy': 'mean_reversion', 'bull_bb_std_mult': 1.8696466878963112, 'bull_rsi_os': 16, 'bull_rsi_ob': 58, 'bull_adx_thresh': 6.5844922042074785, 'bull_atr_min_pct': 0.029073765833454453, 'bull_atr_max_pct': 0.05627549919702479, 'bull_tp_mult': 1.5040291352422397, 'bull_tsl_mult': 0.10410917593943067, 'bull_time_stop': 113, 'bull_use_sma': True, 'bull_use_ema': False, 'bull_use_atr': True, 'bull_use_adx': False, 'bull_use_spike': False, 'bull_rsi_required': True, 'bear_strategy': 'breakout', 'bear_bb_std_mult': 3.480151019630452, 'bear_rsi_os': 21, 'bear_rsi_ob': 54, 'bear_adx_thresh': 12.913014990239864, 'bear_atr_min_pct': 0.022562595220426935, 'bear_atr_max_pct': 0.01353094245418561, 'bear_tp_mult': 1.290701702343056, 'bear_tsl_mult': 0.4817180391278271, 'bear_time_stop': 87, 'bear_use_sma': False, 'bear_use_ema': False, 'bear_use_atr': False, 'bear_use_adx': False, 'bear_use_spike': False, 'bear_rsi_required': False, 'sideways_strategy': 'breakout', 'sideways_bb_std_mult': 0.9963632817920329, 'sideways_rsi_os': 55, 'sideways_rsi_ob': 81, 'sideways_adx_thresh': 20.999977094194357, 'sideways_atr_min_pct': 0.0021932561434879956, 'sideways_atr_max_pct': 0.020067392576920064, 'sideways_tp_mult': 1.7992248747399253, 'sideways_tsl_mult': 0.9495118733027501, 'sideways_time_stop': 213, 'sideways_use_sma': False, 'sideways_use_ema': True, 'sideways_use_atr': True, 'sideways_use_adx': False, 'sideways_use_spike': False, 'sideways_rsi_required': False}.
[I 2025-09-01 09:33:36,033] Trial 218 finished with values: [-0.07547368296703227, 0.07531470196763781] and parameters: {'p_sma': 29, 'p_std': 50, 'p_atr': 16, 'p_adx': 14, 'rsi_period': 44, 'ema1': 20, 'ema2': 14, 'slip_atr_k': 0.02894480733139513, 'slip_spread_k': 0.007500120531700627, 'spread_hl_frac': 0.04442231723912876, 'bb_std_mult': 2.305651022865316, 'rsi_os': 8, 'rsi_ob': 92, 'vol_spike': 0.07306550626386521, 'adx_thresh': 5.075757880794058, 'atr_min_pct': 0.002022053947875878, 'atr_max_pct': 0.13958179270627688, 'tp_mult': 1.0103351615407687, 'tsl_mult': 0.679600437156947, 'strategy': 'breakout', 'time_stop': 204, 'use_sma': True, 'use_atr': False, 'use_adx': False, 'use_ema': False, 'use_spike': False, 'rsi_required': False, 'edge_k': 0.473992521456176, 'edge_cap': 0.08779797393871211, 'bull_strategy': 'mean_reversion', 'bull_bb_std_mult': 0.6645058423005521, 'bull_rsi_os': 35, 'bull_rsi_ob': 58, 'bull_adx_thresh': 6.808944162242169, 'bull_atr_min_pct': 0.0020714850384594124, 'bull_atr_max_pct': 0.055606447285822355, 'bull_tp_mult': 1.9052657090761302, 'bull_tsl_mult': 0.09805462369909049, 'bull_time_stop': 104, 'bull_use_sma': True, 'bull_use_ema': False, 'bull_use_atr': True, 'bull_use_adx': False, 'bull_use_spike': False, 'bull_rsi_required': True, 'bear_strategy': 'mean_reversion', 'bear_bb_std_mult': 2.509146081877162, 'bear_rsi_os': 36, 'bear_rsi_ob': 65, 'bear_adx_thresh': 12.465108236072725, 'bear_atr_min_pct': 0.004334233402139349, 'bear_atr_max_pct': 0.0702881017977624, 'bear_tp_mult': 2.782939273233681, 'bear_tsl_mult': 0.44067527352707797, 'bear_time_stop': 216, 'bear_use_sma': False, 'bear_use_ema': False, 'bear_use_atr': False, 'bear_use_adx': True, 'bear_use_spike': False, 'bear_rsi_required': False, 'sideways_strategy': 'breakout', 'sideways_bb_std_mult': 2.59520549784289, 'sideways_rsi_os': 44, 'sideways_rsi_ob': 46, 'sideways_adx_thresh': 21.068109837575932, 'sideways_atr_min_pct': 0.004296116363308197, 'sideways_atr_max_pct': 0.06259113927867152, 'sideways_tp_mult': 2.105731070828853, 'sideways_tsl_mult': 0.040210894566667765, 'sideways_time_stop': 218, 'sideways_use_sma': False, 'sideways_use_ema': True, 'sideways_use_atr': False, 'sideways_use_adx': False, 'sideways_use_spike': False, 'sideways_rsi_required': False}.
[I 2025-09-01 09:33:36,280] Trial 220 finished with values: [-0.10115820648934892, 0.10091043241656114] and parameters: {'p_sma': 40, 'p_std': 24, 'p_atr': 15, 'p_adx': 14, 'rsi_period': 53, 'ema1': 20, 'ema2': 28, 'slip_atr_k': 0.05107728690495146, 'slip_spread_k': 0.8710359504852148, 'spread_hl_frac': 0.04210052909184326, 'bb_std_mult': 2.3479199726578246, 'rsi_os': 11, 'rsi_ob': 46, 'vol_spike': 0.15758203447787886, 'adx_thresh': 13.289349976116451, 'atr_min_pct': 0.021036519309905684, 'atr_max_pct': 0.02397158973401911, 'tp_mult': 1.7779832379204263, 'tsl_mult': 0.6569288027465076, 'strategy': 'breakout', 'time_stop': 203, 'use_sma': True, 'use_atr': False, 'use_adx': False, 'use_ema': False, 'use_spike': True, 'rsi_required': False, 'edge_k': 0.45427365658055385, 'edge_cap': 0.46213392703341993, 'bull_strategy': 'mean_reversion', 'bull_bb_std_mult': 0.6622822936381488, 'bull_rsi_os': 16, 'bull_rsi_ob': 58, 'bull_adx_thresh': 6.592594562377398, 'bull_atr_min_pct': 0.029121878255940387, 'bull_atr_max_pct': 0.05747557195977425, 'bull_tp_mult': 2.2311219778974882, 'bull_tsl_mult': 0.1031654498030775, 'bull_time_stop': 113, 'bull_use_sma': True, 'bull_use_ema': False, 'bull_use_atr': True, 'bull_use_adx': False, 'bull_use_spike': False, 'bull_rsi_required': True, 'bear_strategy': 'breakout', 'bear_bb_std_mult': 3.5007267079717956, 'bear_rsi_os': 38, 'bear_rsi_ob': 70, 'bear_adx_thresh': 30.968811680131004, 'bear_atr_min_pct': 0.01602756883006026, 'bear_atr_max_pct': 0.1207636025585939, 'bear_tp_mult': 1.8983738700646915, 'bear_tsl_mult': 0.47992929636738474, 'bear_time_stop': 205, 'bear_use_sma': False, 'bear_use_ema': False, 'bear_use_atr': False, 'bear_use_adx': False, 'bear_use_spike': False, 'bear_rsi_required': False, 'sideways_strategy': 'breakout', 'sideways_bb_std_mult': 1.2995002249820629, 'sideways_rsi_os': 40, 'sideways_rsi_ob': 46, 'sideways_adx_thresh': 7.039781522577787, 'sideways_atr_min_pct': 0.0025320356787242476, 'sideways_atr_max_pct': 0.0144628089343532, 'sideways_tp_mult': 2.465836463051246, 'sideways_tsl_mult': 0.03905264268552383, 'sideways_time_stop': 219, 'sideways_use_sma': False, 'sideways_use_ema': True, 'sideways_use_atr': True, 'sideways_use_adx': False, 'sideways_use_spike': False, 'sideways_rsi_required': False}.
[I 2025-09-01 09:34:15,633] Trial 223 finished with values: [-0.02701933110702881, 0.027002515518231785] and parameters: {'p_sma': 30, 'p_std': 25, 'p_atr': 16, 'p_adx': 15, 'rsi_period': 63, 'ema1': 21, 'ema2': 55, 'slip_atr_k': 0.0768583974258783, 'slip_spread_k': 0.2627636243576624, 'spread_hl_frac': 0.01148594889102475, 'bb_std_mult': 1.9206109382899668, 'rsi_os': 31, 'rsi_ob': 82, 'vol_spike': 0.2002373358135523, 'adx_thresh': 5.62936017177326, 'atr_min_pct': 0.010514333981792676, 'atr_max_pct': 0.1472092095520069, 'tp_mult': 1.5853424305577803, 'tsl_mult': 0.34407196075710905, 'strategy': 'breakout', 'time_stop': 197, 'use_sma': False, 'use_atr': False, 'use_adx': True, 'use_ema': True, 'use_spike': True, 'rsi_required': False, 'edge_k': 1.550795276269589, 'edge_cap': 0.06431379059168164, 'bull_strategy': 'mean_reversion', 'bull_bb_std_mult': 0.5522750776699734, 'bull_rsi_os': 14, 'bull_rsi_ob': 74, 'bull_adx_thresh': 20.154502700151742, 'bull_atr_min_pct': 0.028167117812547642, 'bull_atr_max_pct': 0.06250714921394647, 'bull_tp_mult': 2.1297655149885952, 'bull_tsl_mult': 0.6772530329286979, 'bull_time_stop': 116, 'bull_use_sma': True, 'bull_use_ema': False, 'bull_use_atr': False, 'bull_use_adx': False, 'bull_use_spike': True, 'bull_rsi_required': False, 'bear_strategy': 'mean_reversion', 'bear_bb_std_mult': 3.5312555428388785, 'bear_rsi_os': 44, 'bear_rsi_ob': 67, 'bear_adx_thresh': 33.099549479011515, 'bear_atr_min_pct': 0.027693095607410963, 'bear_atr_max_pct': 0.12325450353630012, 'bear_tp_mult': 1.7512481532420254, 'bear_tsl_mult': 0.45251535814238336, 'bear_time_stop': 221, 'bear_use_sma': False, 'bear_use_ema': True, 'bear_use_atr': True, 'bear_use_adx': False, 'bear_use_spike': False, 'bear_rsi_required': False, 'sideways_strategy': 'breakout', 'sideways_bb_std_mult': 0.6916515681540782, 'sideways_rsi_os': 51, 'sideways_rsi_ob': 47, 'sideways_adx_thresh': 34.40553804729081, 'sideways_atr_min_pct': 0.004027677730928008, 'sideways_atr_max_pct': 0.06827586984437764, 'sideways_tp_mult': 1.7579806887762879, 'sideways_tsl_mult': 0.9217362909653155, 'sideways_time_stop': 225, 'sideways_use_sma': False, 'sideways_use_ema': True, 'sideways_use_atr': True, 'sideways_use_adx': False, 'sideways_use_spike': False, 'sideways_rsi_required': False}.
[I 2025-09-01 09:34:16,086] Trial 221 finished with values: [-0.04923909124944126, 0.04961300340526899] and parameters: {'p_sma': 35, 'p_std': 15, 'p_atr': 27, 'p_adx': 23, 'rsi_period': 17, 'ema1': 11, 'ema2': 14, 'slip_atr_k': 0.05148692518777818, 'slip_spread_k': 0.8652237494073352, 'spread_hl_frac': 0.04545990917518364, 'bb_std_mult': 2.6334448939493043, 'rsi_os': 11, 'rsi_ob': 91, 'vol_spike': 0.21897374676442877, 'adx_thresh': 13.295895424807808, 'atr_min_pct': 0.021042121861490792, 'atr_max_pct': 0.1423588641554904, 'tp_mult': 1.4665343428886195, 'tsl_mult': 0.34604953436260544, 'strategy': 'breakout', 'time_stop': 194, 'use_sma': False, 'use_atr': False, 'use_adx': False, 'use_ema': False, 'use_spike': True, 'rsi_required': False, 'edge_k': 0.39665915268833385, 'edge_cap': 0.0702012716377826, 'bull_strategy': 'mean_reversion', 'bull_bb_std_mult': 1.872574728152893, 'bull_rsi_os': 15, 'bull_rsi_ob': 58, 'bull_adx_thresh': 27.664998266609995, 'bull_atr_min_pct': 0.029058622881195956, 'bull_atr_max_pct': 0.09566772341295987, 'bull_tp_mult': 1.494313681276669, 'bull_tsl_mult': 0.1071730786594988, 'bull_time_stop': 116, 'bull_use_sma': True, 'bull_use_ema': False, 'bull_use_atr': True, 'bull_use_adx': False, 'bull_use_spike': True, 'bull_rsi_required': False, 'bear_strategy': 'breakout', 'bear_bb_std_mult': 3.5069548304767753, 'bear_rsi_os': 35, 'bear_rsi_ob': 65, 'bear_adx_thresh': 33.77405571090873, 'bear_atr_min_pct': 0.004695170928535842, 'bear_atr_max_pct': 0.1219866867232879, 'bear_tp_mult': 1.746176547806379, 'bear_tsl_mult': 0.48530507681730073, 'bear_time_stop': 130, 'bear_use_sma': False, 'bear_use_ema': False, 'bear_use_atr': False, 'bear_use_adx': False, 'bear_use_spike': False, 'bear_rsi_required': False, 'sideways_strategy': 'breakout', 'sideways_bb_std_mult': 1.0453163903019964, 'sideways_rsi_os': 5, 'sideways_rsi_ob': 87, 'sideways_adx_thresh': 34.42249854841741, 'sideways_atr_min_pct': 0.02853984825683523, 'sideways_atr_max_pct': 0.022033340711524373, 'sideways_tp_mult': 1.677498901123864, 'sideways_tsl_mult': 0.029536112926929647, 'sideways_time_stop': 158, 'sideways_use_sma': False, 'sideways_use_ema': True, 'sideways_use_atr': True, 'sideways_use_adx': False, 'sideways_use_spike': False, 'sideways_rsi_required': False}.
[I 2025-09-01 09:34:16,810] Trial 222 finished with values: [-0.18435667346877027, 0.18421558105462277] and parameters: {'p_sma': 37, 'p_std': 26, 'p_atr': 13, 'p_adx': 14, 'rsi_period': 71, 'ema1': 19, 'ema2': 42, 'slip_atr_k': 0.06801034593554484, 'slip_spread_k': 0.06263218718431479, 'spread_hl_frac': 0.014313591612362927, 'bb_std_mult': 3.382124865734003, 'rsi_os': 11, 'rsi_ob': 74, 'vol_spike': 0.2403222785086111, 'adx_thresh': 17.53826335208474, 'atr_min_pct': 0.01582785998418344, 'atr_max_pct': 0.14662499388408554, 'tp_mult': 1.9650310489803609, 'tsl_mult': 0.8451234732502874, 'strategy': 'breakout', 'time_stop': 195, 'use_sma': False, 'use_atr': True, 'use_adx': True, 'use_ema': False, 'use_spike': True, 'rsi_required': False, 'edge_k': 1.5310251410808435, 'edge_cap': 0.36077004596094686, 'bull_strategy': 'mean_reversion', 'bull_bb_std_mult': 0.5463626233862435, 'bull_rsi_os': 13, 'bull_rsi_ob': 74, 'bull_adx_thresh': 27.64552900901296, 'bull_atr_min_pct': 0.0006550417851373825, 'bull_atr_max_pct': 0.07058873126860163, 'bull_tp_mult': 2.2375203160006363, 'bull_tsl_mult': 0.6723878431483115, 'bull_time_stop': 121, 'bull_use_sma': True, 'bull_use_ema': False, 'bull_use_atr': False, 'bull_use_adx': False, 'bull_use_spike': True, 'bull_rsi_required': False, 'bear_strategy': 'breakout', 'bear_bb_std_mult': 3.5071302110910914, 'bear_rsi_os': 50, 'bear_rsi_ob': 90, 'bear_adx_thresh': 11.672995681390114, 'bear_atr_min_pct': 0.013762224444669303, 'bear_atr_max_pct': 0.12174561376868467, 'bear_tp_mult': 2.244071993297651, 'bear_tsl_mult': 0.49117493173703075, 'bear_time_stop': 129, 'bear_use_sma': False, 'bear_use_ema': True, 'bear_use_atr': True, 'bear_use_adx': False, 'bear_use_spike': False, 'bear_rsi_required': False, 'sideways_strategy': 'breakout', 'sideways_bb_std_mult': 1.3118845751878512, 'sideways_rsi_os': 43, 'sideways_rsi_ob': 59, 'sideways_adx_thresh': 27.85767693334145, 'sideways_atr_min_pct': 0.004845470867598399, 'sideways_atr_max_pct': 0.12472362511010698, 'sideways_tp_mult': 2.237525727823234, 'sideways_tsl_mult': 0.5824862545935546, 'sideways_time_stop': 229, 'sideways_use_sma': False, 'sideways_use_ema': True, 'sideways_use_atr': True, 'sideways_use_adx': False, 'sideways_use_spike': False, 'sideways_rsi_required': False}.
[I 2025-09-01 09:34:17,174] Trial 224 finished with values: [-0.041771826845274695, 0.04147195155275566] and parameters: {'p_sma': 30, 'p_std': 25, 'p_atr': 16, 'p_adx': 15, 'rsi_period': 63, 'ema1': 28, 'ema2': 56, 'slip_atr_k': 0.14452347666921456, 'slip_spread_k': 0.06282131489106108, 'spread_hl_frac': 0.011692695302610684, 'bb_std_mult': 1.923171464990395, 'rsi_os': 52, 'rsi_ob': 67, 'vol_spike': 0.011977485019532996, 'adx_thresh': 17.145914790543266, 'atr_min_pct': 0.015815610412567703, 'atr_max_pct': 0.14687059679455985, 'tp_mult': 1.9657726816325833, 'tsl_mult': 0.8940576724746812, 'strategy': 'breakout', 'time_stop': 197, 'use_sma': False, 'use_atr': False, 'use_adx': True, 'use_ema': True, 'use_spike': True, 'rsi_required': False, 'edge_k': 1.5269644729850789, 'edge_cap': 0.25197766386101517, 'bull_strategy': 'mean_reversion', 'bull_bb_std_mult': 2.9679551832488356, 'bull_rsi_os': 14, 'bull_rsi_ob': 74, 'bull_adx_thresh': 7.426143507384683, 'bull_atr_min_pct': 0.0069762268654799935, 'bull_atr_max_pct': 0.06167337041047694, 'bull_tp_mult': 2.048717194024644, 'bull_tsl_mult': 0.6707780729337542, 'bull_time_stop': 119, 'bull_use_sma': True, 'bull_use_ema': False, 'bull_use_atr': False, 'bull_use_adx': False, 'bull_use_spike': True, 'bull_rsi_required': False, 'bear_strategy': 'mean_reversion', 'bear_bb_std_mult': 2.718415674086965, 'bear_rsi_os': 54, 'bear_rsi_ob': 67, 'bear_adx_thresh': 25.389226989140486, 'bear_atr_min_pct': 0.015910204329859394, 'bear_atr_max_pct': 0.12534228059860236, 'bear_tp_mult': 2.2255992727897493, 'bear_tsl_mult': 0.4482878504526346, 'bear_time_stop': 223, 'bear_use_sma': False, 'bear_use_ema': True, 'bear_use_atr': True, 'bear_use_adx': False, 'bear_use_spike': False, 'bear_rsi_required': False, 'sideways_strategy': 'breakout', 'sideways_bb_std_mult': 1.4349033085910936, 'sideways_rsi_os': 53, 'sideways_rsi_ob': 86, 'sideways_adx_thresh': 34.3326382964042, 'sideways_atr_min_pct': 0.003843267493421566, 'sideways_atr_max_pct': 0.06752651964280537, 'sideways_tp_mult': 1.7628406644526675, 'sideways_tsl_mult': 0.9287730492741929, 'sideways_time_stop': 125, 'sideways_use_sma': False, 'sideways_use_ema': True, 'sideways_use_atr': True, 'sideways_use_adx': False, 'sideways_use_spike': False, 'sideways_rsi_required': False}.
