[I 2025-09-01 10:09:29,195] Trial 432 finished with values: [-1000000000.0, 1000000000.0] and parameters: {'p_sma': 48, 'p_std': 45, 'p_atr': 23, 'p_adx': 23, 'rsi_period': 67, 'ema1': 9, 'ema2': 36, 'slip_atr_k': 0.2279676723943565, 'slip_spread_k': 0.08556518562290905, 'spread_hl_frac': 0.034689643387969045, 'bb_std_mult': 3.1754503709910034, 'rsi_os': 26, 'rsi_ob': 46, 'vol_spike': 0.276165253336617, 'adx_thresh': 7.8059841054985135, 'atr_min_pct': 0.022313609420342117, 'atr_max_pct': 0.08389430595802044, 'tp_mult': 2.964175527175052, 'tsl_mult': 0.8265616934738855, 'strategy': 'mean_reversion', 'time_stop': 170, 'use_sma': True, 'use_atr': True, 'use_adx': False, 'use_ema': False, 'use_spike': False, 'rsi_required': False, 'edge_k': 1.7199738241849134, 'edge_cap': 0.5497903640900389, 'bull_strategy': 'mean_reversion', 'bull_bb_std_mult': 0.896767077483427, 'bull_rsi_os': 48, 'bull_rsi_ob': 54, 'bull_adx_thresh': 5.375777117845337, 'bull_atr_min_pct': 0.0035379027209146256, 'bull_atr_max_pct': 0.08540610509331487, 'bull_tp_mult': 1.511739714617813, 'bull_tsl_mult': 0.7970366996663174, 'bull_time_stop': 94, 'bull_use_sma': True, 'bull_use_ema': False, 'bull_use_atr': True, 'bull_use_adx': True, 'bull_use_spike': False, 'bull_rsi_required': True, 'bear_strategy': 'mean_reversion', 'bear_bb_std_mult': 3.033733910957599, 'bear_rsi_os': 42, 'bear_rsi_ob': 48, 'bear_adx_thresh': 13.41840618629159, 'bear_atr_min_pct': 0.00726541963160097, 'bear_atr_max_pct': 0.037376246023469034, 'bear_tp_mult': 2.928889232813937, 'bear_tsl_mult': 0.8898711311635386, 'bear_time_stop': 44, 'bear_use_sma': False, 'bear_use_ema': True, 'bear_use_atr': False, 'bear_use_adx': False, 'bear_use_spike': True, 'bear_rsi_required': True, 'sideways_strategy': 'mean_reversion', 'sideways_bb_std_mult': 3.321037076639583, 'sideways_rsi_os': 49, 'sideways_rsi_ob': 85, 'sideways_adx_thresh': 16.144088449380853, 'sideways_atr_min_pct': 0.014062661255755844, 'sideways_atr_max_pct': 0.07488297387422774, 'sideways_tp_mult': 2.1165566962438263, 'sideways_tsl_mult': 0.8232039617853584, 'sideways_time_stop': 163, 'sideways_use_sma': False, 'sideways_use_ema': True, 'sideways_use_atr': True, 'sideways_use_adx': True, 'sideways_use_spike': False, 'sideways_rsi_required': False}.
[I 2025-09-01 10:10:12,450] Trial 434 finished with values: [-1000000000.0, 1000000000.0] and parameters: {'p_sma': 17, 'p_std': 45, 'p_atr': 23, 'p_adx': 23, 'rsi_period': 50, 'ema1': 21, 'ema2': 50, 'slip_atr_k': 0.145988473849389, 'slip_spread_k': 0.8609700890862206, 'spread_hl_frac': 0.007975663763802193, 'bb_std_mult': 2.2217186389144166, 'rsi_os': 26, 'rsi_ob': 77, 'vol_spike': 0.2997541401340778, 'adx_thresh': 21.984408705822922, 'atr_min_pct': 0.026370718094450386, 'atr_max_pct': 0.04038443140512063, 'tp_mult': 2.596195241375661, 'tsl_mult': 0.056155075776488775, 'strategy': 'mean_reversion', 'time_stop': 170, 'use_sma': True, 'use_atr': True, 'use_adx': False, 'use_ema': False, 'use_spike': False, 'rsi_required': False, 'edge_k': 1.0074479316746876, 'edge_cap': 0.5373646259991288, 'bull_strategy': 'mean_reversion', 'bull_bb_std_mult': 0.8947251396872662, 'bull_rsi_os': 35, 'bull_rsi_ob': 67, 'bull_adx_thresh': 9.981599951890413, 'bull_atr_min_pct': 0.028747807209179434, 'bull_atr_max_pct': 0.08550877193685745, 'bull_tp_mult': 1.8493212107122075, 'bull_tsl_mult': 0.3154506382004277, 'bull_time_stop': 153, 'bull_use_sma': True, 'bull_use_ema': False, 'bull_use_atr': True, 'bull_use_adx': True, 'bull_use_spike': False, 'bull_rsi_required': True, 'bear_strategy': 'mean_reversion', 'bear_bb_std_mult': 1.8127656859454255, 'bear_rsi_os': 43, 'bear_rsi_ob': 48, 'bear_adx_thresh': 13.422700990355251, 'bear_atr_min_pct': 0.007638853722497579, 'bear_atr_max_pct': 0.06505350034856106, 'bear_tp_mult': 1.2554888966209774, 'bear_tsl_mult': 0.47883631851464753, 'bear_time_stop': 45, 'bear_use_sma': False, 'bear_use_ema': True, 'bear_use_atr': False, 'bear_use_adx': False, 'bear_use_spike': True, 'bear_rsi_required': True, 'sideways_strategy': 'mean_reversion', 'sideways_bb_std_mult': 2.535218104828754, 'sideways_rsi_os': 50, 'sideways_rsi_ob': 50, 'sideways_adx_thresh': 16.186235988843652, 'sideways_atr_min_pct': 0.004520234821322608, 'sideways_atr_max_pct': 0.041756671846207606, 'sideways_tp_mult': 1.4248395068617552, 'sideways_tsl_mult': 0.8226384212855432, 'sideways_time_stop': 204, 'sideways_use_sma': False, 'sideways_use_ema': True, 'sideways_use_atr': True, 'sideways_use_adx': True, 'sideways_use_spike': False, 'sideways_rsi_required': False}.
[I 2025-09-01 10:10:13,236] Trial 431 finished with values: [-1000000000.0, 1000000000.0] and parameters: {'p_sma': 17, 'p_std': 45, 'p_atr': 23, 'p_adx': 23, 'rsi_period': 69, 'ema1': 8, 'ema2': 60, 'slip_atr_k': 0.008205003996192756, 'slip_spread_k': 0.8686305517175223, 'spread_hl_frac': 0.047851491240533284, 'bb_std_mult': 3.037918054798423, 'rsi_os': 26, 'rsi_ob': 52, 'vol_spike': 0.2781325491343231, 'adx_thresh': 6.618174791342728, 'atr_min_pct': 0.022353314902865233, 'atr_max_pct': 0.041945427448846814, 'tp_mult': 2.9606526169588934, 'tsl_mult': 0.017789087164684813, 'strategy': 'mean_reversion', 'time_stop': 172, 'use_sma': True, 'use_atr': True, 'use_adx': False, 'use_ema': False, 'use_spike': False, 'rsi_required': True, 'edge_k': 1.1519728066024832, 'edge_cap': 0.8678356459827699, 'bull_strategy': 'mean_reversion', 'bull_bb_std_mult': 0.8990246398923255, 'bull_rsi_os': 35, 'bull_rsi_ob': 55, 'bull_adx_thresh': 6.53331843423099, 'bull_atr_min_pct': 0.016504671001505863, 'bull_atr_max_pct': 0.08556817903348557, 'bull_tp_mult': 1.836473462839774, 'bull_tsl_mult': 0.03057592918987549, 'bull_time_stop': 152, 'bull_use_sma': True, 'bull_use_ema': False, 'bull_use_atr': True, 'bull_use_adx': True, 'bull_use_spike': False, 'bull_rsi_required': True, 'bear_strategy': 'mean_reversion', 'bear_bb_std_mult': 3.4721297231730337, 'bear_rsi_os': 10, 'bear_rsi_ob': 46, 'bear_adx_thresh': 13.731458577308658, 'bear_atr_min_pct': 0.022199550864235102, 'bear_atr_max_pct': 0.06423158539884276, 'bear_tp_mult': 2.8796281954585545, 'bear_tsl_mult': 0.13453470049999772, 'bear_time_stop': 300, 'bear_use_sma': True, 'bear_use_ema': True, 'bear_use_atr': False, 'bear_use_adx': False, 'bear_use_spike': True, 'bear_rsi_required': False, 'sideways_strategy': 'breakout', 'sideways_bb_std_mult': 3.311647278256832, 'sideways_rsi_os': 49, 'sideways_rsi_ob': 58, 'sideways_adx_thresh': 27.59751996475435, 'sideways_atr_min_pct': 0.018944701832943653, 'sideways_atr_max_pct': 0.1470484304351429, 'sideways_tp_mult': 1.416279167032895, 'sideways_tsl_mult': 0.6148638111742427, 'sideways_time_stop': 204, 'sideways_use_sma': False, 'sideways_use_ema': True, 'sideways_use_atr': False, 'sideways_use_adx': True, 'sideways_use_spike': True, 'sideways_rsi_required': True}.
[I 2025-09-01 10:10:15,393] Trial 435 finished with values: [-1000000000.0, 1000000000.0] and parameters: {'p_sma': 17, 'p_std': 45, 'p_atr': 10, 'p_adx': 26, 'rsi_period': 50, 'ema1': 28, 'ema2': 11, 'slip_atr_k': 0.00715949902247702, 'slip_spread_k': 0.20509549556856713, 'spread_hl_frac': 0.033230653615794956, 'bb_std_mult': 2.8844702880616166, 'rsi_os': 26, 'rsi_ob': 77, 'vol_spike': 0.15878378889554173, 'adx_thresh': 27.66308518200133, 'atr_min_pct': 0.026558753908399114, 'atr_max_pct': 0.07345637220012838, 'tp_mult': 2.7288502311369602, 'tsl_mult': 0.031006257210074578, 'strategy': 'breakout', 'time_stop': 136, 'use_sma': True, 'use_atr': False, 'use_adx': True, 'use_ema': False, 'use_spike': True, 'rsi_required': False, 'edge_k': 1.1344208507808973, 'edge_cap': 0.5808060377049455, 'bull_strategy': 'mean_reversion', 'bull_bb_std_mult': 0.7336472980371493, 'bull_rsi_os': 16, 'bull_rsi_ob': 88, 'bull_adx_thresh': 5.996631184833832, 'bull_atr_min_pct': 0.028900380032576858, 'bull_atr_max_pct': 0.09544321964380906, 'bull_tp_mult': 2.4440672498218996, 'bull_tsl_mult': 0.07050397225455851, 'bull_time_stop': 149, 'bull_use_sma': True, 'bull_use_ema': False, 'bull_use_atr': True, 'bull_use_adx': True, 'bull_use_spike': False, 'bull_rsi_required': True, 'bear_strategy': 'mean_reversion', 'bear_bb_std_mult': 1.2301797934661178, 'bear_rsi_os': 13, 'bear_rsi_ob': 45, 'bear_adx_thresh': 29.454947383375206, 'bear_atr_min_pct': 0.0178989423963376, 'bear_atr_max_pct': 0.0641943379274639, 'bear_tp_mult': 1.616909016124165, 'bear_tsl_mult': 0.47948793434009485, 'bear_time_stop': 299, 'bear_use_sma': False, 'bear_use_ema': True, 'bear_use_atr': True, 'bear_use_adx': False, 'bear_use_spike': True, 'bear_rsi_required': False, 'sideways_strategy': 'breakout', 'sideways_bb_std_mult': 2.9392337300965488, 'sideways_rsi_os': 9, 'sideways_rsi_ob': 50, 'sideways_adx_thresh': 27.484693315566478, 'sideways_atr_min_pct': 0.004211432169134569, 'sideways_atr_max_pct': 0.09828607478474477, 'sideways_tp_mult': 2.0130993453354042, 'sideways_tsl_mult': 0.38280967811859645, 'sideways_time_stop': 205, 'sideways_use_sma': False, 'sideways_use_ema': True, 'sideways_use_atr': False, 'sideways_use_adx': False, 'sideways_use_spike': False, 'sideways_rsi_required': False}.
[I 2025-09-01 10:10:15,893] Trial 436 finished with values: [-1000000000.0, 1000000000.0] and parameters: {'p_sma': 20, 'p_std': 45, 'p_atr': 10, 'p_adx': 21, 'rsi_period': 50, 'ema1': 23, 'ema2': 12, 'slip_atr_k': 0.03727237650558185, 'slip_spread_k': 0.8211571891294507, 'spread_hl_frac': 0.04550088737520022, 'bb_std_mult': 3.0421731440837427, 'rsi_os': 26, 'rsi_ob': 83, 'vol_spike': 0.2833673803402731, 'adx_thresh': 6.550583468844232, 'atr_min_pct': 0.02659512522572492, 'atr_max_pct': 0.09705403559964057, 'tp_mult': 2.7136928724057348, 'tsl_mult': 0.03144571667447195, 'strategy': 'breakout', 'time_stop': 91, 'use_sma': True, 'use_atr': False, 'use_adx': True, 'use_ema': False, 'use_spike': True, 'rsi_required': False, 'edge_k': 0.9599579407441209, 'edge_cap': 0.5777533020045523, 'bull_strategy': 'mean_reversion', 'bull_bb_std_mult': 0.7226855831157238, 'bull_rsi_os': 16, 'bull_rsi_ob': 54, 'bull_adx_thresh': 14.899747172388889, 'bull_atr_min_pct': 0.011158804591021714, 'bull_atr_max_pct': 0.08950983321025861, 'bull_tp_mult': 2.9643353722129593, 'bull_tsl_mult': 0.02160084801349666, 'bull_time_stop': 151, 'bull_use_sma': True, 'bull_use_ema': False, 'bull_use_atr': True, 'bull_use_adx': True, 'bull_use_spike': False, 'bull_rsi_required': True, 'bear_strategy': 'mean_reversion', 'bear_bb_std_mult': 1.68546945304188, 'bear_rsi_os': 49, 'bear_rsi_ob': 45, 'bear_adx_thresh': 17.809085685341568, 'bear_atr_min_pct': 0.017967888305833336, 'bear_atr_max_pct': 0.06439057634741197, 'bear_tp_mult': 1.6287104094833817, 'bear_tsl_mult': 0.47977843940115067, 'bear_time_stop': 134, 'bear_use_sma': False, 'bear_use_ema': True, 'bear_use_atr': True, 'bear_use_adx': False, 'bear_use_spike': True, 'bear_rsi_required': False, 'sideways_strategy': 'breakout', 'sideways_bb_std_mult': 2.502427294878553, 'sideways_rsi_os': 52, 'sideways_rsi_ob': 54, 'sideways_adx_thresh': 27.70533818810523, 'sideways_atr_min_pct': 0.018788409809641072, 'sideways_atr_max_pct': 0.057450181414467914, 'sideways_tp_mult': 1.245639677382833, 'sideways_tsl_mult': 0.8581070317737421, 'sideways_time_stop': 203, 'sideways_use_sma': False, 'sideways_use_ema': True, 'sideways_use_atr': False, 'sideways_use_adx': False, 'sideways_use_spike': False, 'sideways_rsi_required': False}.
[I 2025-09-01 10:10:59,266] Trial 439 finished with values: [-0.012894646534652887, 0.01308806838341948] and parameters: {'p_sma': 15, 'p_std': 42, 'p_atr': 11, 'p_adx': 21, 'rsi_period': 29, 'ema1': 11, 'ema2': 22, 'slip_atr_k': 0.03316522370914459, 'slip_spread_k': 0.14351679330593595, 'spread_hl_frac': 0.02913875040639381, 'bb_std_mult': 3.2220105240311576, 'rsi_os': 23, 'rsi_ob': 75, 'vol_spike': 0.2838982147545187, 'adx_thresh': 5.561917323778683, 'atr_min_pct': 0.010348352109823674, 'atr_max_pct': 0.09213998013451005, 'tp_mult': 2.7095956237057757, 'tsl_mult': 0.5597759436690347, 'strategy': 'breakout', 'time_stop': 157, 'use_sma': False, 'use_atr': False, 'use_adx': True, 'use_ema': True, 'use_spike': False, 'rsi_required': False, 'edge_k': 0.9508114633107863, 'edge_cap': 0.9208344775521065, 'bull_strategy': 'breakout', 'bull_bb_std_mult': 3.4893679547525815, 'bull_rsi_os': 28, 'bull_rsi_ob': 95, 'bull_adx_thresh': 5.013739701871416, 'bull_atr_min_pct': 0.019645486069335215, 'bull_atr_max_pct': 0.08872138948392072, 'bull_tp_mult': 1.0133603595777718, 'bull_tsl_mult': 0.00034546079931756235, 'bull_time_stop': 162, 'bull_use_sma': True, 'bull_use_ema': True, 'bull_use_atr': True, 'bull_use_adx': True, 'bull_use_spike': True, 'bull_rsi_required': False, 'bear_strategy': 'breakout', 'bear_bb_std_mult': 3.4050260046745042, 'bear_rsi_os': 49, 'bear_rsi_ob': 45, 'bear_adx_thresh': 17.92099403914116, 'bear_atr_min_pct': 0.017325408381533063, 'bear_atr_max_pct': 0.10319660005724837, 'bear_tp_mult': 2.7219718685080374, 'bear_tsl_mult': 0.4119882664415224, 'bear_time_stop': 127, 'bear_use_sma': False, 'bear_use_ema': False, 'bear_use_atr': True, 'bear_use_adx': True, 'bear_use_spike': True, 'bear_rsi_required': False, 'sideways_strategy': 'breakout', 'sideways_bb_std_mult': 2.7593675518000604, 'sideways_rsi_os': 29, 'sideways_rsi_ob': 79, 'sideways_adx_thresh': 28.627926411313485, 'sideways_atr_min_pct': 0.00356748712430761, 'sideways_atr_max_pct': 0.05748867505558454, 'sideways_tp_mult': 1.2498087865076637, 'sideways_tsl_mult': 0.8663200639705758, 'sideways_time_stop': 47, 'sideways_use_sma': True, 'sideways_use_ema': False, 'sideways_use_atr': False, 'sideways_use_adx': False, 'sideways_use_spike': False, 'sideways_rsi_required': False}.
[I 2025-09-01 10:10:59,275] Trial 440 finished with values: [-1000000000.0, 1000000000.0] and parameters: {'p_sma': 15, 'p_std': 42, 'p_atr': 28, 'p_adx': 17, 'rsi_period': 65, 'ema1': 10, 'ema2': 30, 'slip_atr_k': 0.04859743262343486, 'slip_spread_k': 0.775115265901789, 'spread_hl_frac': 0.027156615750478886, 'bb_std_mult': 3.243165051071796, 'rsi_os': 23, 'rsi_ob': 75, 'vol_spike': 0.29488194335282225, 'adx_thresh': 5.607069813521616, 'atr_min_pct': 0.02540421431946911, 'atr_max_pct': 0.0787238399571035, 'tp_mult': 2.468784880523785, 'tsl_mult': 0.6356293680166216, 'strategy': 'breakout', 'time_stop': 156, 'use_sma': False, 'use_atr': False, 'use_adx': True, 'use_ema': True, 'use_spike': False, 'rsi_required': False, 'edge_k': 0.8627861296992788, 'edge_cap': 0.6173337739148407, 'bull_strategy': 'breakout', 'bull_bb_std_mult': 0.9740589757734984, 'bull_rsi_os': 45, 'bull_rsi_ob': 95, 'bull_adx_thresh': 5.012836860619254, 'bull_atr_min_pct': 0.019710445932453087, 'bull_atr_max_pct': 0.13361665114690602, 'bull_tp_mult': 2.722051713390645, 'bull_tsl_mult': 0.07539785506477152, 'bull_time_stop': 287, 'bull_use_sma': False, 'bull_use_ema': True, 'bull_use_atr': True, 'bull_use_adx': True, 'bull_use_spike': True, 'bull_rsi_required': False, 'bear_strategy': 'breakout', 'bear_bb_std_mult': 0.6313990714101412, 'bear_rsi_os': 48, 'bear_rsi_ob': 47, 'bear_adx_thresh': 11.325496253700239, 'bear_atr_min_pct': 0.016954944082749723, 'bear_atr_max_pct': 0.07895265455816758, 'bear_tp_mult': 1.0414211418732247, 'bear_tsl_mult': 0.41267493792726123, 'bear_time_stop': 127, 'bear_use_sma': False, 'bear_use_ema': False, 'bear_use_atr': True, 'bear_use_adx': True, 'bear_use_spike': True, 'bear_rsi_required': False, 'sideways_strategy': 'breakout', 'sideways_bb_std_mult': 3.2746957235600944, 'sideways_rsi_os': 47, 'sideways_rsi_ob': 88, 'sideways_adx_thresh': 28.55965997644116, 'sideways_atr_min_pct': 0.023325074259015206, 'sideways_atr_max_pct': 0.11711088660561844, 'sideways_tp_mult': 1.28907966059544, 'sideways_tsl_mult': 0.8874451635760893, 'sideways_time_stop': 184, 'sideways_use_sma': True, 'sideways_use_ema': False, 'sideways_use_atr': False, 'sideways_use_adx': False, 'sideways_use_spike': False, 'sideways_rsi_required': False}.
[I 2025-09-01 10:10:59,716] Trial 437 finished with values: [-1000000000.0, 1000000000.0] and parameters: {'p_sma': 15, 'p_std': 42, 'p_atr': 13, 'p_adx': 18, 'rsi_period': 76, 'ema1': 7, 'ema2': 46, 'slip_atr_k': 0.09726419991107563, 'slip_spread_k': 0.20384627710856348, 'spread_hl_frac': 0.045258949830199104, 'bb_std_mult': 2.884252412184234, 'rsi_os': 25, 'rsi_ob': 52, 'vol_spike': 0.276314912576807, 'adx_thresh': 6.433769582438957, 'atr_min_pct': 0.0016847767753274782, 'atr_max_pct': 0.07362063884770415, 'tp_mult': 2.7318755179713423, 'tsl_mult': 0.03343574386333442, 'strategy': 'breakout', 'time_stop': 138, 'use_sma': False, 'use_atr': False, 'use_adx': True, 'use_ema': True, 'use_spike': True, 'rsi_required': False, 'edge_k': 0.9580898427756619, 'edge_cap': 0.920456904076641, 'bull_strategy': 'breakout', 'bull_bb_std_mult': 0.8001692362491042, 'bull_rsi_os': 45, 'bull_rsi_ob': 49, 'bull_adx_thresh': 6.03758801664152, 'bull_atr_min_pct': 0.029957552080657823, 'bull_atr_max_pct': 0.07942790814402027, 'bull_tp_mult': 1.94044695576378, 'bull_tsl_mult': 0.01721412924598141, 'bull_time_stop': 211, 'bull_use_sma': True, 'bull_use_ema': False, 'bull_use_atr': True, 'bull_use_adx': True, 'bull_use_spike': True, 'bull_rsi_required': False, 'bear_strategy': 'breakout', 'bear_bb_std_mult': 1.2321478891038096, 'bear_rsi_os': 49, 'bear_rsi_ob': 45, 'bear_adx_thresh': 11.367907247130754, 'bear_atr_min_pct': 0.017947186354823723, 'bear_atr_max_pct': 0.0787836698284528, 'bear_tp_mult': 2.8801050628625378, 'bear_tsl_mult': 0.42787511306841525, 'bear_time_stop': 135, 'bear_use_sma': False, 'bear_use_ema': True, 'bear_use_atr': True, 'bear_use_adx': False, 'bear_use_spike': True, 'bear_rsi_required': False, 'sideways_strategy': 'breakout', 'sideways_bb_std_mult': 2.206316383474209, 'sideways_rsi_os': 47, 'sideways_rsi_ob': 87, 'sideways_adx_thresh': 27.701559782231353, 'sideways_atr_min_pct': 0.008334399219434227, 'sideways_atr_max_pct': 0.11659726225289951, 'sideways_tp_mult': 1.9574206205614595, 'sideways_tsl_mult': 0.06376262413251643, 'sideways_time_stop': 130, 'sideways_use_sma': True, 'sideways_use_ema': True, 'sideways_use_atr': False, 'sideways_use_adx': False, 'sideways_use_spike': False, 'sideways_rsi_required': False}.
[I 2025-09-01 10:11:00,027] Trial 438 finished with values: [-0.03855642430688111, 0.038438558315792064] and parameters: {'p_sma': 20, 'p_std': 42, 'p_atr': 14, 'p_adx': 17, 'rsi_period': 29, 'ema1': 28, 'ema2': 45, 'slip_atr_k': 0.03764486511591218, 'slip_spread_k': 0.1423918892837587, 'spread_hl_frac': 0.0026940296090185514, 'bb_std_mult': 3.239068033138841, 'rsi_os': 25, 'rsi_ob': 75, 'vol_spike': 0.15975394095320244, 'adx_thresh': 32.75880074435119, 'atr_min_pct': 0.012068683649261443, 'atr_max_pct': 0.09312401498525383, 'tp_mult': 2.7235037801204407, 'tsl_mult': 0.03680004919490207, 'strategy': 'breakout', 'time_stop': 137, 'use_sma': False, 'use_atr': False, 'use_adx': True, 'use_ema': True, 'use_spike': True, 'rsi_required': False, 'edge_k': 0.9891055602939643, 'edge_cap': 0.5740830320396998, 'bull_strategy': 'breakout', 'bull_bb_std_mult': 0.8002236243604571, 'bull_rsi_os': 17, 'bull_rsi_ob': 52, 'bull_adx_thresh': 24.825879672376722, 'bull_atr_min_pct': 0.019495506733531075, 'bull_atr_max_pct': 0.08913762933863716, 'bull_tp_mult': 2.006642085873072, 'bull_tsl_mult': 0.06651855297767727, 'bull_time_stop': 144, 'bull_use_sma': True, 'bull_use_ema': True, 'bull_use_atr': True, 'bull_use_adx': True, 'bull_use_spike': True, 'bull_rsi_required': False, 'bear_strategy': 'breakout', 'bear_bb_std_mult': 2.107443487727867, 'bear_rsi_os': 49, 'bear_rsi_ob': 45, 'bear_adx_thresh': 11.337481527962213, 'bear_atr_min_pct': 0.01802459484336663, 'bear_atr_max_pct': 0.08190744617327327, 'bear_tp_mult': 2.667360642671616, 'bear_tsl_mult': 0.7533242715770014, 'bear_time_stop': 127, 'bear_use_sma': False, 'bear_use_ema': False, 'bear_use_atr': True, 'bear_use_adx': True, 'bear_use_spike': True, 'bear_rsi_required': False, 'sideways_strategy': 'breakout', 'sideways_bb_std_mult': 2.9388381346987424, 'sideways_rsi_os': 52, 'sideways_rsi_ob': 87, 'sideways_adx_thresh': 28.617310974956094, 'sideways_atr_min_pct': 0.003575372604383339, 'sideways_atr_max_pct': 0.018849100767174908, 'sideways_tp_mult': 1.2790351881692386, 'sideways_tsl_mult': 0.8563970102798516, 'sideways_time_stop': 184, 'sideways_use_sma': True, 'sideways_use_ema': False, 'sideways_use_atr': False, 'sideways_use_adx': False, 'sideways_use_spike': False, 'sideways_rsi_required': False}.
