[I 2025-09-01 09:07:52,096] Trial 64 finished with values: [-1000000000.0, 1000000000.0] and parameters: {'p_sma': 16, 'p_std': 56, 'p_atr': 13, 'p_adx': 9, 'rsi_period': 7, 'ema1': 29, 'ema2': 39, 'slip_atr_k': 0.03584602577137537, 'slip_spread_k': 0.7551790973099941, 'spread_hl_frac': 0.02303000888262638, 'bb_std_mult': 0.7884991425348655, 'rsi_os': 10, 'rsi_ob': 68, 'vol_spike': 0.20316274543348126, 'adx_thresh': 31.525294295618753, 'atr_min_pct': 0.004424442460855131, 'atr_max_pct': 0.14920251114276717, 'tp_mult': 1.1585164011556133, 'tsl_mult': 0.16683140468963534, 'strategy': 'mean_reversion', 'time_stop': 14, 'use_sma': False, 'use_atr': True, 'use_adx': False, 'use_ema': True, 'use_spike': False, 'rsi_required': True, 'edge_k': 1.7310791346086836, 'edge_cap': 0.8061226842696761, 'bull_strategy': 'breakout', 'bull_bb_std_mult': 1.5268041976821691, 'bull_rsi_os': 52, 'bull_rsi_ob': 48, 'bull_adx_thresh': 12.874936723124932, 'bull_atr_min_pct': 0.00917955814344527, 'bull_atr_max_pct': 0.020333935527014027, 'bull_tp_mult': 2.7158138836765957, 'bull_tsl_mult': 0.6876867919120584, 'bull_time_stop': 282, 'bull_use_sma': True, 'bull_use_ema': False, 'bull_use_atr': True, 'bull_use_adx': False, 'bull_use_spike': True, 'bull_rsi_required': False, 'bear_strategy': 'breakout', 'bear_bb_std_mult': 2.5933836842247846, 'bear_rsi_os': 16, 'bear_rsi_ob': 55, 'bear_adx_thresh': 8.198806127686659, 'bear_atr_min_pct': 0.01888625468301415, 'bear_atr_max_pct': 0.14294938473771573, 'bear_tp_mult': 2.805854675842699, 'bear_tsl_mult': 0.3392817580437655, 'bear_time_stop': 259, 'bear_use_sma': True, 'bear_use_ema': True, 'bear_use_atr': False, 'bear_use_adx': False, 'bear_use_spike': True, 'bear_rsi_required': True, 'sideways_strategy': 'mean_reversion', 'sideways_bb_std_mult': 2.942985180691546, 'sideways_rsi_os': 36, 'sideways_rsi_ob': 65, 'sideways_adx_thresh': 9.001729107444463, 'sideways_atr_min_pct': 0.0073451181425257805, 'sideways_atr_max_pct': 0.03798499821805603, 'sideways_tp_mult': 1.8820902441346026, 'sideways_tsl_mult': 0.5659109557708059, 'sideways_time_stop': 281, 'sideways_use_sma': True, 'sideways_use_ema': False, 'sideways_use_atr': True, 'sideways_use_adx': True, 'sideways_use_spike': False, 'sideways_rsi_required': False}.
[I 2025-09-01 09:07:52,372] Trial 65 finished with values: [-1000000000.0, 1000000000.0] and parameters: {'p_sma': 50, 'p_std': 58, 'p_atr': 13, 'p_adx': 9, 'rsi_period': 8, 'ema1': 29, 'ema2': 39, 'slip_atr_k': 0.037517400635551076, 'slip_spread_k': 0.8450481064684425, 'spread_hl_frac': 0.02250185245922131, 'bb_std_mult': 0.7616921218969723, 'rsi_os': 17, 'rsi_ob': 68, 'vol_spike': 0.2360423450421611, 'adx_thresh': 28.642848017782214, 'atr_min_pct': 1.92618889340683e-05, 'atr_max_pct': 0.14890226525134304, 'tp_mult': 1.1295560055278724, 'tsl_mult': 0.5356540503226747, 'strategy': 'mean_reversion', 'time_stop': 21, 'use_sma': False, 'use_atr': True, 'use_adx': False, 'use_ema': True, 'use_spike': False, 'rsi_required': True, 'edge_k': 1.48240066843954, 'edge_cap': 0.7957197636476822, 'bull_strategy': 'breakout', 'bull_bb_std_mult': 1.5683692263513915, 'bull_rsi_os': 52, 'bull_rsi_ob': 49, 'bull_adx_thresh': 12.734028675418937, 'bull_atr_min_pct': 0.02562867610977794, 'bull_atr_max_pct': 0.020061328290726252, 'bull_tp_mult': 2.677697464757417, 'bull_tsl_mult': 0.7862489695898083, 'bull_time_stop': 276, 'bull_use_sma': True, 'bull_use_ema': False, 'bull_use_atr': True, 'bull_use_adx': False, 'bull_use_spike': True, 'bull_rsi_required': False, 'bear_strategy': 'breakout', 'bear_bb_std_mult': 0.700541913496296, 'bear_rsi_os': 22, 'bear_rsi_ob': 55, 'bear_adx_thresh': 5.492907312811161, 'bear_atr_min_pct': 0.018780022985600713, 'bear_atr_max_pct': 0.13577138130124622, 'bear_tp_mult': 2.4060249072971183, 'bear_tsl_mult': 0.30737185568082476, 'bear_time_stop': 130, 'bear_use_sma': True, 'bear_use_ema': True, 'bear_use_atr': False, 'bear_use_adx': False, 'bear_use_spike': True, 'bear_rsi_required': True, 'sideways_strategy': 'mean_reversion', 'sideways_bb_std_mult': 2.942057393087305, 'sideways_rsi_os': 37, 'sideways_rsi_ob': 66, 'sideways_adx_thresh': 9.198987233172105, 'sideways_atr_min_pct': 0.013097061179705908, 'sideways_atr_max_pct': 0.040196944967210754, 'sideways_tp_mult': 1.9741339902893005, 'sideways_tsl_mult': 0.5640183359834559, 'sideways_time_stop': 268, 'sideways_use_sma': True, 'sideways_use_ema': False, 'sideways_use_atr': True, 'sideways_use_adx': True, 'sideways_use_spike': False, 'sideways_rsi_required': False}.
[I 2025-09-01 09:07:52,655] Trial 62 finished with values: [-1000000000.0, 1000000000.0] and parameters: {'p_sma': 17, 'p_std': 55, 'p_atr': 13, 'p_adx': 8, 'rsi_period': 7, 'ema1': 29, 'ema2': 38, 'slip_atr_k': 0.01255752160281251, 'slip_spread_k': 0.9439875568162197, 'spread_hl_frac': 0.02469040488554984, 'bb_std_mult': 0.7963477816617299, 'rsi_os': 10, 'rsi_ob': 68, 'vol_spike': 0.23399789883239552, 'adx_thresh': 33.688474868799005, 'atr_min_pct': 0.028433683591127003, 'atr_max_pct': 0.14878812645425743, 'tp_mult': 1.0987788528801148, 'tsl_mult': 0.07585395555589963, 'strategy': 'breakout', 'time_stop': 20, 'use_sma': False, 'use_atr': True, 'use_adx': False, 'use_ema': True, 'use_spike': False, 'rsi_required': True, 'edge_k': 1.8547327371065159, 'edge_cap': 0.9409912310598147, 'bull_strategy': 'breakout', 'bull_bb_std_mult': 1.577698884033415, 'bull_rsi_os': 54, 'bull_rsi_ob': 48, 'bull_adx_thresh': 14.638617532315529, 'bull_atr_min_pct': 0.011432986526602774, 'bull_atr_max_pct': 0.02346496548938394, 'bull_tp_mult': 2.87680913947101, 'bull_tsl_mult': 0.8093265639604423, 'bull_time_stop': 222, 'bull_use_sma': True, 'bull_use_ema': True, 'bull_use_atr': True, 'bull_use_adx': False, 'bull_use_spike': True, 'bull_rsi_required': False, 'bear_strategy': 'breakout', 'bear_bb_std_mult': 2.5386738539700375, 'bear_rsi_os': 17, 'bear_rsi_ob': 63, 'bear_adx_thresh': 9.76535091233726, 'bear_atr_min_pct': 0.017171124268567664, 'bear_atr_max_pct': 0.1375457410325996, 'bear_tp_mult': 1.1994395452095818, 'bear_tsl_mult': 0.1477845464062586, 'bear_time_stop': 122, 'bear_use_sma': True, 'bear_use_ema': False, 'bear_use_atr': False, 'bear_use_adx': False, 'bear_use_spike': True, 'bear_rsi_required': True, 'sideways_strategy': 'mean_reversion', 'sideways_bb_std_mult': 2.627721481037126, 'sideways_rsi_os': 34, 'sideways_rsi_ob': 65, 'sideways_adx_thresh': 9.567011740167128, 'sideways_atr_min_pct': 0.004707755442972427, 'sideways_atr_max_pct': 0.03710650519981088, 'sideways_tp_mult': 1.9647750211819952, 'sideways_tsl_mult': 0.376337731156263, 'sideways_time_stop': 276, 'sideways_use_sma': True, 'sideways_use_ema': False, 'sideways_use_atr': True, 'sideways_use_adx': True, 'sideways_use_spike': False, 'sideways_rsi_required': False}.
[I 2025-09-01 09:08:30,199] Trial 68 finished with values: [-0.09394493327370823, 0.09372446052910705] and parameters: {'p_sma': 22, 'p_std': 52, 'p_atr': 15, 'p_adx': 7, 'rsi_period': 13, 'ema1': 26, 'ema2': 26, 'slip_atr_k': 0.013007924703565772, 'slip_spread_k': 0.7169059137528684, 'spread_hl_frac': 0.013622981690017777, 'bb_std_mult': 1.2771963123275638, 'rsi_os': 5, 'rsi_ob': 74, 'vol_spike': 0.2747353413962246, 'adx_thresh': 25.324025110453604, 'atr_min_pct': 0.00228618698557999, 'atr_max_pct': 0.14359555673726834, 'tp_mult': 1.8857958224559048, 'tsl_mult': 0.4604352538994528, 'strategy': 'mean_reversion', 'time_stop': 28, 'use_sma': False, 'use_atr': False, 'use_adx': False, 'use_ema': True, 'use_spike': False, 'rsi_required': False, 'edge_k': 1.1604785489329918, 'edge_cap': 0.8566228117045105, 'bull_strategy': 'breakout', 'bull_bb_std_mult': 2.0110477741280013, 'bull_rsi_os': 55, 'bull_rsi_ob': 59, 'bull_adx_thresh': 16.322914271439018, 'bull_atr_min_pct': 0.0013455683855641716, 'bull_atr_max_pct': 0.03469425080616874, 'bull_tp_mult': 2.8683180998673263, 'bull_tsl_mult': 0.6127057817491153, 'bull_time_stop': 297, 'bull_use_sma': True, 'bull_use_ema': True, 'bull_use_atr': True, 'bull_use_adx': False, 'bull_use_spike': True, 'bull_rsi_required': False, 'bear_strategy': 'mean_reversion', 'bear_bb_std_mult': 3.319191868371233, 'bear_rsi_os': 17, 'bear_rsi_ob': 63, 'bear_adx_thresh': 19.76060761849719, 'bear_atr_min_pct': 0.017210893682427314, 'bear_atr_max_pct': 0.12167896164789024, 'bear_tp_mult': 1.9243668152281488, 'bear_tsl_mult': 0.7403677590234772, 'bear_time_stop': 26, 'bear_use_sma': False, 'bear_use_ema': False, 'bear_use_atr': False, 'bear_use_adx': False, 'bear_use_spike': False, 'bear_rsi_required': False, 'sideways_strategy': 'breakout', 'sideways_bb_std_mult': 2.4620867410550784, 'sideways_rsi_os': 42, 'sideways_rsi_ob': 70, 'sideways_adx_thresh': 15.751102378286937, 'sideways_atr_min_pct': 0.0036738511812695746, 'sideways_atr_max_pct': 0.030656723011621076, 'sideways_tp_mult': 1.5702904289169086, 'sideways_tsl_mult': 0.2647650459667387, 'sideways_time_stop': 221, 'sideways_use_sma': True, 'sideways_use_ema': False, 'sideways_use_atr': True, 'sideways_use_adx': False, 'sideways_use_spike': False, 'sideways_rsi_required': False}.
[I 2025-09-01 09:08:31,512] Trial 67 finished with values: [-0.07710608496733873, 0.07684717643338283] and parameters: {'p_sma': 22, 'p_std': 52, 'p_atr': 15, 'p_adx': 7, 'rsi_period': 13, 'ema1': 26, 'ema2': 32, 'slip_atr_k': 0.009716073112589596, 'slip_spread_k': 0.8675010860394111, 'spread_hl_frac': 0.014519091532184988, 'bb_std_mult': 1.321328126544412, 'rsi_os': 16, 'rsi_ob': 74, 'vol_spike': 0.24002575931889847, 'adx_thresh': 33.22122394349726, 'atr_min_pct': 0.012607481280884267, 'atr_max_pct': 0.1377766560489444, 'tp_mult': 1.5650928252456426, 'tsl_mult': 0.4456787048828137, 'strategy': 'mean_reversion', 'time_stop': 28, 'use_sma': False, 'use_atr': False, 'use_adx': False, 'use_ema': True, 'use_spike': False, 'rsi_required': False, 'edge_k': 0.9967967044034731, 'edge_cap': 0.851295165985332, 'bull_strategy': 'breakout', 'bull_bb_std_mult': 1.8024723693593696, 'bull_rsi_os': 55, 'bull_rsi_ob': 59, 'bull_adx_thresh': 16.321944645429102, 'bull_atr_min_pct': 0.0013496682990597445, 'bull_atr_max_pct': 0.033695997263345934, 'bull_tp_mult': 2.7302260119973623, 'bull_tsl_mult': 0.5989337213852141, 'bull_time_stop': 209, 'bull_use_sma': True, 'bull_use_ema': True, 'bull_use_atr': True, 'bull_use_adx': False, 'bull_use_spike': True, 'bull_rsi_required': False, 'bear_strategy': 'mean_reversion', 'bear_bb_std_mult': 3.2987390138364336, 'bear_rsi_os': 17, 'bear_rsi_ob': 64, 'bear_adx_thresh': 11.53886016473148, 'bear_atr_min_pct': 0.017197771514820617, 'bear_atr_max_pct': 0.12206994756595427, 'bear_tp_mult': 1.8984613556038898, 'bear_tsl_mult': 0.7784153975829076, 'bear_time_stop': 158, 'bear_use_sma': False, 'bear_use_ema': False, 'bear_use_atr': False, 'bear_use_adx': False, 'bear_use_spike': False, 'bear_rsi_required': False, 'sideways_strategy': 'breakout', 'sideways_bb_std_mult': 1.4588631653458828, 'sideways_rsi_os': 42, 'sideways_rsi_ob': 70, 'sideways_adx_thresh': 15.506317984224793, 'sideways_atr_min_pct': 0.0041239299956360425, 'sideways_atr_max_pct': 0.032344715023413316, 'sideways_tp_mult': 1.57625299998118, 'sideways_tsl_mult': 0.25816195679413545, 'sideways_time_stop': 238, 'sideways_use_sma': True, 'sideways_use_ema': False, 'sideways_use_atr': True, 'sideways_use_adx': False, 'sideways_use_spike': False, 'sideways_rsi_required': False}.
[I 2025-09-01 09:08:32,015] Trial 69 finished with values: [-0.02528764176877263, 0.024965476553951635] and parameters: {'p_sma': 10, 'p_std': 52, 'p_atr': 15, 'p_adx': 7, 'rsi_period': 13, 'ema1': 26, 'ema2': 41, 'slip_atr_k': 0.05789141172533864, 'slip_spread_k': 0.8637207255695956, 'spread_hl_frac': 0.014835273349766533, 'bb_std_mult': 1.3005406433049769, 'rsi_os': 5, 'rsi_ob': 73, 'vol_spike': 0.2822775025286095, 'adx_thresh': 25.081993597412882, 'atr_min_pct': 0.014497728116204308, 'atr_max_pct': 0.13649756416745693, 'tp_mult': 1.5681467393336792, 'tsl_mult': 0.08864225759209227, 'strategy': 'mean_reversion', 'time_stop': 32, 'use_sma': False, 'use_atr': False, 'use_adx': True, 'use_ema': False, 'use_spike': False, 'rsi_required': False, 'edge_k': 1.7585943737339722, 'edge_cap': 0.8560488968558029, 'bull_strategy': 'breakout', 'bull_bb_std_mult': 2.0298170713709944, 'bull_rsi_os': 52, 'bull_rsi_ob': 52, 'bull_adx_thresh': 16.90374477173172, 'bull_atr_min_pct': 0.02098924383497794, 'bull_atr_max_pct': 0.0438952324115379, 'bull_tp_mult': 2.728309532269465, 'bull_tsl_mult': 0.63040139126619, 'bull_time_stop': 299, 'bull_use_sma': True, 'bull_use_ema': True, 'bull_use_atr': True, 'bull_use_adx': False, 'bull_use_spike': True, 'bull_rsi_required': False, 'bear_strategy': 'mean_reversion', 'bear_bb_std_mult': 3.2995920735472426, 'bear_rsi_os': 24, 'bear_rsi_ob': 48, 'bear_adx_thresh': 12.292731594073455, 'bear_atr_min_pct': 0.011811307503892927, 'bear_atr_max_pct': 0.12395483831093812, 'bear_tp_mult': 1.9138539396419527, 'bear_tsl_mult': 0.7660928860088371, 'bear_time_stop': 159, 'bear_use_sma': False, 'bear_use_ema': False, 'bear_use_atr': True, 'bear_use_adx': False, 'bear_use_spike': False, 'bear_rsi_required': False, 'sideways_strategy': 'breakout', 'sideways_bb_std_mult': 2.427196825356751, 'sideways_rsi_os': 41, 'sideways_rsi_ob': 70, 'sideways_adx_thresh': 16.367321529367235, 'sideways_atr_min_pct': 0.003717424916291488, 'sideways_atr_max_pct': 0.05201973660575551, 'sideways_tp_mult': 1.5731411454357898, 'sideways_tsl_mult': 0.4884910627659478, 'sideways_time_stop': 218, 'sideways_use_sma': False, 'sideways_use_ema': False, 'sideways_use_atr': False, 'sideways_use_adx': False, 'sideways_use_spike': False, 'sideways_rsi_required': False}.
[I 2025-09-01 09:08:32,668] Trial 66 finished with values: [-0.10225468047129727, 0.10271505209331526] and parameters: {'p_sma': 48, 'p_std': 52, 'p_atr': 15, 'p_adx': 7, 'rsi_period': 13, 'ema1': 26, 'ema2': 32, 'slip_atr_k': 0.013985117667843563, 'slip_spread_k': 0.8818187082299757, 'spread_hl_frac': 0.015836258514705406, 'bb_std_mult': 1.3854722630247605, 'rsi_os': 16, 'rsi_ob': 73, 'vol_spike': 0.27323538286082294, 'adx_thresh': 30.50607592916865, 'atr_min_pct': 0.018727564220342267, 'atr_max_pct': 0.13780937014287487, 'tp_mult': 1.5574448821086841, 'tsl_mult': 0.7117862982191172, 'strategy': 'mean_reversion', 'time_stop': 9, 'use_sma': False, 'use_atr': False, 'use_adx': False, 'use_ema': True, 'use_spike': False, 'rsi_required': False, 'edge_k': 1.7843093265180126, 'edge_cap': 0.8604964565163309, 'bull_strategy': 'breakout', 'bull_bb_std_mult': 2.0152815536208077, 'bull_rsi_os': 55, 'bull_rsi_ob': 59, 'bull_adx_thresh': 16.668390425205445, 'bull_atr_min_pct': 0.0016026581977091122, 'bull_atr_max_pct': 0.03322955070258911, 'bull_tp_mult': 2.8200911071672947, 'bull_tsl_mult': 0.623771650863399, 'bull_time_stop': 237, 'bull_use_sma': True, 'bull_use_ema': True, 'bull_use_atr': True, 'bull_use_adx': False, 'bull_use_spike': True, 'bull_rsi_required': False, 'bear_strategy': 'mean_reversion', 'bear_bb_std_mult': 3.30791382292617, 'bear_rsi_os': 16, 'bear_rsi_ob': 64, 'bear_adx_thresh': 12.333180778130977, 'bear_atr_min_pct': 0.017368513113481848, 'bear_atr_max_pct': 0.12431581677993027, 'bear_tp_mult': 1.8904486635885671, 'bear_tsl_mult': 0.7678104274847345, 'bear_time_stop': 122, 'bear_use_sma': False, 'bear_use_ema': False, 'bear_use_atr': False, 'bear_use_adx': False, 'bear_use_spike': False, 'bear_rsi_required': False, 'sideways_strategy': 'breakout', 'sideways_bb_std_mult': 1.4428704692433332, 'sideways_rsi_os': 42, 'sideways_rsi_ob': 71, 'sideways_adx_thresh': 12.270957208430858, 'sideways_atr_min_pct': 0.0038258076874640875, 'sideways_atr_max_pct': 0.029706944922010155, 'sideways_tp_mult': 1.5815087254904387, 'sideways_tsl_mult': 0.4788235257554165, 'sideways_time_stop': 221, 'sideways_use_sma': True, 'sideways_use_ema': False, 'sideways_use_atr': True, 'sideways_use_adx': False, 'sideways_use_spike': False, 'sideways_rsi_required': False}.
[I 2025-09-01 09:09:13,902] Trial 72 finished with values: [-0.2534873514353557, 0.253328492686269] and parameters: {'p_sma': 7, 'p_std': 5, 'p_atr': 19, 'p_adx': 7, 'rsi_period': 10, 'ema1': 23, 'ema2': 44, 'slip_atr_k': 0.05678381300002284, 'slip_spread_k': 0.8883351702399829, 'spread_hl_frac': 0.010281996114770417, 'bb_std_mult': 2.0050919311464535, 'rsi_os': 7, 'rsi_ob': 79, 'vol_spike': 0.2868064509946006, 'adx_thresh': 23.878521936101773, 'atr_min_pct': 0.014585810554753779, 'atr_max_pct': 0.12950225861212375, 'tp_mult': 1.3340999153267141, 'tsl_mult': 0.16398710160037078, 'strategy': 'mean_reversion', 'time_stop': 8, 'use_sma': False, 'use_atr': False, 'use_adx': True, 'use_ema': False, 'use_spike': True, 'rsi_required': False, 'edge_k': 1.5477038682834394, 'edge_cap': 0.9989521295460251, 'bull_strategy': 'breakout', 'bull_bb_std_mult': 2.025685682264635, 'bull_rsi_os': 47, 'bull_rsi_ob': 52, 'bull_adx_thresh': 17.8371157444839, 'bull_atr_min_pct': 0.023318061942171193, 'bull_atr_max_pct': 0.042953817197590095, 'bull_tp_mult': 2.6247643508748104, 'bull_tsl_mult': 0.8850233444507138, 'bull_time_stop': 270, 'bull_use_sma': True, 'bull_use_ema': True, 'bull_use_atr': True, 'bull_use_adx': False, 'bull_use_spike': True, 'bull_rsi_required': True, 'bear_strategy': 'mean_reversion', 'bear_bb_std_mult': 3.071407918511566, 'bear_rsi_os': 24, 'bear_rsi_ob': 48, 'bear_adx_thresh': 11.172987447874386, 'bear_atr_min_pct': 0.012000520465328731, 'bear_atr_max_pct': 0.10582528820885397, 'bear_tp_mult': 1.7921360720346757, 'bear_tsl_mult': 0.6059998320463735, 'bear_time_stop': 142, 'bear_use_sma': False, 'bear_use_ema': False, 'bear_use_atr': True, 'bear_use_adx': False, 'bear_use_spike': False, 'bear_rsi_required': False, 'sideways_strategy': 'breakout', 'sideways_bb_std_mult': 2.131949191286542, 'sideways_rsi_os': 40, 'sideways_rsi_ob': 63, 'sideways_adx_thresh': 18.200522008121958, 'sideways_atr_min_pct': 0.0020019815940235408, 'sideways_atr_max_pct': 0.04615375522753212, 'sideways_tp_mult': 1.7696149166693913, 'sideways_tsl_mult': 0.14282783177258757, 'sideways_time_stop': 123, 'sideways_use_sma': False, 'sideways_use_ema': False, 'sideways_use_atr': False, 'sideways_use_adx': False, 'sideways_use_spike': False, 'sideways_rsi_required': False}.
[I 2025-09-01 09:09:13,878] Trial 70 finished with values: [-1000000000.0, 1000000000.0] and parameters: {'p_sma': 10, 'p_std': 60, 'p_atr': 11, 'p_adx': 10, 'rsi_period': 10, 'ema1': 27, 'ema2': 32, 'slip_atr_k': 0.05364149427131225, 'slip_spread_k': 0.8388779232888042, 'spread_hl_frac': 0.029040771760330746, 'bb_std_mult': 2.033421056457837, 'rsi_os': 17, 'rsi_ob': 73, 'vol_spike': 0.18232480019838826, 'adx_thresh': 30.57771616467995, 'atr_min_pct': 0.018857283077583505, 'atr_max_pct': 0.13785108270830623, 'tp_mult': 1.56773942991512, 'tsl_mult': 0.6984596222950433, 'strategy': 'mean_reversion', 'time_stop': 7, 'use_sma': False, 'use_atr': False, 'use_adx': True, 'use_ema': False, 'use_spike': True, 'rsi_required': True, 'edge_k': 1.0045685292264042, 'edge_cap': 0.9987228503598212, 'bull_strategy': 'breakout', 'bull_bb_std_mult': 1.7876374613846358, 'bull_rsi_os': 47, 'bull_rsi_ob': 53, 'bull_adx_thresh': 11.443764198720679, 'bull_atr_min_pct': 0.0027972521372488564, 'bull_atr_max_pct': 0.1282020931637803, 'bull_tp_mult': 2.7350379157068416, 'bull_tsl_mult': 0.6965731243548086, 'bull_time_stop': 268, 'bull_use_sma': True, 'bull_use_ema': True, 'bull_use_atr': False, 'bull_use_adx': False, 'bull_use_spike': True, 'bull_rsi_required': False, 'bear_strategy': 'breakout', 'bear_bb_std_mult': 2.383061283774864, 'bear_rsi_os': 25, 'bear_rsi_ob': 47, 'bear_adx_thresh': 11.378669450816396, 'bear_atr_min_pct': 0.014591411991902475, 'bear_atr_max_pct': 0.11486273728399722, 'bear_tp_mult': 1.7755707334801265, 'bear_tsl_mult': 0.054103025916555025, 'bear_time_stop': 179, 'bear_use_sma': False, 'bear_use_ema': False, 'bear_use_atr': True, 'bear_use_adx': False, 'bear_use_spike': False, 'bear_rsi_required': True, 'sideways_strategy': 'breakout', 'sideways_bb_std_mult': 2.8707902369453437, 'sideways_rsi_os': 41, 'sideways_rsi_ob': 63, 'sideways_adx_thresh': 11.987384213372167, 'sideways_atr_min_pct': 0.007107071872839109, 'sideways_atr_max_pct': 0.04902942321414125, 'sideways_tp_mult': 1.7112221223785475, 'sideways_tsl_mult': 0.48900023116891994, 'sideways_time_stop': 89, 'sideways_use_sma': False, 'sideways_use_ema': True, 'sideways_use_atr': False, 'sideways_use_adx': False, 'sideways_use_spike': False, 'sideways_rsi_required': False}.
