[I 2025-09-01 09:37:57,497] Trial 244 finished with values: [-1000000000.0, 1000000000.0] and parameters: {'p_sma': 15, 'p_std': 23, 'p_atr': 17, 'p_adx': 25, 'rsi_period': 77, 'ema1': 20, 'ema2': 17, 'slip_atr_k': 0.04039576827435501, 'slip_spread_k': 0.27612536389970155, 'spread_hl_frac': 0.014044534139920283, 'bb_std_mult': 1.7231482995317469, 'rsi_os': 11, 'rsi_ob': 57, 'vol_spike': 0.22314029047308168, 'adx_thresh': 6.6799493413155595, 'atr_min_pct': 0.028999663584436005, 'atr_max_pct': 0.03949008209505635, 'tp_mult': 1.7980222935139145, 'tsl_mult': 0.066428026721331, 'strategy': 'breakout', 'time_stop': 44, 'use_sma': False, 'use_atr': True, 'use_adx': True, 'use_ema': True, 'use_spike': False, 'rsi_required': True, 'edge_k': 1.9046725731763168, 'edge_cap': 0.09936761152206398, 'bull_strategy': 'breakout', 'bull_bb_std_mult': 1.2809937386360684, 'bull_rsi_os': 16, 'bull_rsi_ob': 78, 'bull_adx_thresh': 8.072691610361739, 'bull_atr_min_pct': 0.029517583562489763, 'bull_atr_max_pct': 0.036025404229518825, 'bull_tp_mult': 1.4131485956159788, 'bull_tsl_mult': 0.058283922388243425, 'bull_time_stop': 5, 'bull_use_sma': True, 'bull_use_ema': True, 'bull_use_atr': False, 'bull_use_adx': False, 'bull_use_spike': False, 'bull_rsi_required': True, 'bear_strategy': 'mean_reversion', 'bear_bb_std_mult': 3.4551572641602926, 'bear_rsi_os': 11, 'bear_rsi_ob': 67, 'bear_adx_thresh': 12.958770495763835, 'bear_atr_min_pct': 0.025848974131479272, 'bear_atr_max_pct': 0.11757409311198112, 'bear_tp_mult': 2.703704468756496, 'bear_tsl_mult': 0.42096319979620533, 'bear_time_stop': 31, 'bear_use_sma': False, 'bear_use_ema': True, 'bear_use_atr': True, 'bear_use_adx': False, 'bear_use_spike': False, 'bear_rsi_required': True, 'sideways_strategy': 'breakout', 'sideways_bb_std_mult': 1.0850994452123404, 'sideways_rsi_os': 34, 'sideways_rsi_ob': 45, 'sideways_adx_thresh': 28.2496207040384, 'sideways_atr_min_pct': 0.0038975434379802717, 'sideways_atr_max_pct': 0.07047534751383285, 'sideways_tp_mult': 1.8322894625212014, 'sideways_tsl_mult': 0.3198074859180626, 'sideways_time_stop': 282, 'sideways_use_sma': False, 'sideways_use_ema': False, 'sideways_use_atr': False, 'sideways_use_adx': False, 'sideways_use_spike': False, 'sideways_rsi_required': False}.
[I 2025-09-01 09:37:57,879] Trial 245 finished with values: [-1000000000.0, 1000000000.0] and parameters: {'p_sma': 46, 'p_std': 42, 'p_atr': 16, 'p_adx': 14, 'rsi_period': 69, 'ema1': 19, 'ema2': 17, 'slip_atr_k': 0.041371394970637305, 'slip_spread_k': 0.8316744957808065, 'spread_hl_frac': 0.022439293148507216, 'bb_std_mult': 0.8919290524912782, 'rsi_os': 42, 'rsi_ob': 65, 'vol_spike': 0.28199323868180265, 'adx_thresh': 5.672019129291332, 'atr_min_pct': 0.029246271173949175, 'atr_max_pct': 0.1458921312709058, 'tp_mult': 1.5793068239739638, 'tsl_mult': 0.7275250051876585, 'strategy': 'breakout', 'time_stop': 192, 'use_sma': True, 'use_atr': True, 'use_adx': False, 'use_ema': False, 'use_spike': False, 'rsi_required': True, 'edge_k': 1.5004014648534687, 'edge_cap': 0.7171609915074487, 'bull_strategy': 'mean_reversion', 'bull_bb_std_mult': 2.8643485649543967, 'bull_rsi_os': 38, 'bull_rsi_ob': 56, 'bull_adx_thresh': 7.05281829456131, 'bull_atr_min_pct': 0.028831782605101185, 'bull_atr_max_pct': 0.06635526513741109, 'bull_tp_mult': 2.2032347942792474, 'bull_tsl_mult': 0.05291321453614961, 'bull_time_stop': 5, 'bull_use_sma': True, 'bull_use_ema': False, 'bull_use_atr': True, 'bull_use_adx': False, 'bull_use_spike': False, 'bull_rsi_required': True, 'bear_strategy': 'breakout', 'bear_bb_std_mult': 0.6563734390211737, 'bear_rsi_os': 11, 'bear_rsi_ob': 58, 'bear_adx_thresh': 12.917623086443067, 'bear_atr_min_pct': 0.023357729748237115, 'bear_atr_max_pct': 0.03234695618827051, 'bear_tp_mult': 2.179566614163849, 'bear_tsl_mult': 0.4243244552869397, 'bear_time_stop': 170, 'bear_use_sma': False, 'bear_use_ema': False, 'bear_use_atr': False, 'bear_use_adx': False, 'bear_use_spike': False, 'bear_rsi_required': False, 'sideways_strategy': 'breakout', 'sideways_bb_std_mult': 1.0970427495631176, 'sideways_rsi_os': 28, 'sideways_rsi_ob': 45, 'sideways_adx_thresh': 33.298776476541235, 'sideways_atr_min_pct': 0.00397537246734315, 'sideways_atr_max_pct': 0.0708027861200941, 'sideways_tp_mult': 2.875332694532231, 'sideways_tsl_mult': 0.36228781451876707, 'sideways_time_stop': 220, 'sideways_use_sma': False, 'sideways_use_ema': False, 'sideways_use_atr': False, 'sideways_use_adx': False, 'sideways_use_spike': False, 'sideways_rsi_required': False}.
[I 2025-09-01 09:37:58,375] Trial 243 finished with values: [-1000000000.0, 1000000000.0] and parameters: {'p_sma': 26, 'p_std': 23, 'p_atr': 17, 'p_adx': 15, 'rsi_period': 77, 'ema1': 20, 'ema2': 33, 'slip_atr_k': 0.058627770674771706, 'slip_spread_k': 0.265784254131048, 'spread_hl_frac': 0.014153460474429542, 'bb_std_mult': 1.7220665721700266, 'rsi_os': 28, 'rsi_ob': 88, 'vol_spike': 0.21081614903700122, 'adx_thresh': 16.412274252643613, 'atr_min_pct': 0.020626481333982715, 'atr_max_pct': 0.14981873109573488, 'tp_mult': 1.8931212971633662, 'tsl_mult': 0.07437627292180671, 'strategy': 'breakout', 'time_stop': 190, 'use_sma': False, 'use_atr': True, 'use_adx': True, 'use_ema': True, 'use_spike': False, 'rsi_required': True, 'edge_k': 1.51412069345833, 'edge_cap': 0.8375668842564217, 'bull_strategy': 'breakout', 'bull_bb_std_mult': 0.6931241432488608, 'bull_rsi_os': 16, 'bull_rsi_ob': 53, 'bull_adx_thresh': 8.296025266668334, 'bull_atr_min_pct': 0.029520300142011752, 'bull_atr_max_pct': 0.13916472563054438, 'bull_tp_mult': 2.0751623570705418, 'bull_tsl_mult': 0.4140693570144246, 'bull_time_stop': 113, 'bull_use_sma': True, 'bull_use_ema': True, 'bull_use_atr': True, 'bull_use_adx': False, 'bull_use_spike': False, 'bull_rsi_required': True, 'bear_strategy': 'mean_reversion', 'bear_bb_std_mult': 3.1540363140125907, 'bear_rsi_os': 45, 'bear_rsi_ob': 46, 'bear_adx_thresh': 16.102926001353765, 'bear_atr_min_pct': 0.010335100403194214, 'bear_atr_max_pct': 0.03933879689742322, 'bear_tp_mult': 2.3234490345978394, 'bear_tsl_mult': 0.47097379707475767, 'bear_time_stop': 200, 'bear_use_sma': False, 'bear_use_ema': True, 'bear_use_atr': True, 'bear_use_adx': False, 'bear_use_spike': False, 'bear_rsi_required': True, 'sideways_strategy': 'breakout', 'sideways_bb_std_mult': 1.2291308172179847, 'sideways_rsi_os': 28, 'sideways_rsi_ob': 64, 'sideways_adx_thresh': 28.473734866157972, 'sideways_atr_min_pct': 0.0038907058138495684, 'sideways_atr_max_pct': 0.14014547001753905, 'sideways_tp_mult': 1.8956695479154009, 'sideways_tsl_mult': 0.3559959641306629, 'sideways_time_stop': 284, 'sideways_use_sma': False, 'sideways_use_ema': False, 'sideways_use_atr': False, 'sideways_use_adx': False, 'sideways_use_spike': False, 'sideways_rsi_required': False}.
[I 2025-09-01 09:37:58,681] Trial 246 finished with values: [-1000000000.0, 1000000000.0] and parameters: {'p_sma': 58, 'p_std': 32, 'p_atr': 16, 'p_adx': 14, 'rsi_period': 68, 'ema1': 19, 'ema2': 35, 'slip_atr_k': 0.040496623582747596, 'slip_spread_k': 0.7366243965091208, 'spread_hl_frac': 0.014297392279948777, 'bb_std_mult': 1.2167181736384869, 'rsi_os': 11, 'rsi_ob': 64, 'vol_spike': 0.22598829581940785, 'adx_thresh': 27.14861541237832, 'atr_min_pct': 0.020421407204771744, 'atr_max_pct': 0.14519168290716128, 'tp_mult': 1.823761613579963, 'tsl_mult': 0.0321238296081206, 'strategy': 'breakout', 'time_stop': 193, 'use_sma': True, 'use_atr': True, 'use_adx': False, 'use_ema': False, 'use_spike': False, 'rsi_required': True, 'edge_k': 1.9642729635504819, 'edge_cap': 0.4982464026040927, 'bull_strategy': 'mean_reversion', 'bull_bb_std_mult': 0.5065817096476422, 'bull_rsi_os': 51, 'bull_rsi_ob': 56, 'bull_adx_thresh': 7.186841438409993, 'bull_atr_min_pct': 0.02849671638030706, 'bull_atr_max_pct': 0.0350452215654422, 'bull_tp_mult': 1.5843763819482737, 'bull_tsl_mult': 0.05300792945248892, 'bull_time_stop': 226, 'bull_use_sma': True, 'bull_use_ema': False, 'bull_use_atr': True, 'bull_use_adx': False, 'bull_use_spike': False, 'bull_rsi_required': True, 'bear_strategy': 'breakout', 'bear_bb_std_mult': 3.199721497060377, 'bear_rsi_os': 45, 'bear_rsi_ob': 88, 'bear_adx_thresh': 12.9840910470904, 'bear_atr_min_pct': 0.009104471454296978, 'bear_atr_max_pct': 0.1372948713441703, 'bear_tp_mult': 1.1371163517603327, 'bear_tsl_mult': 0.47177873936274073, 'bear_time_stop': 200, 'bear_use_sma': False, 'bear_use_ema': False, 'bear_use_atr': False, 'bear_use_adx': False, 'bear_use_spike': False, 'bear_rsi_required': False, 'sideways_strategy': 'breakout', 'sideways_bb_std_mult': 1.098530334245882, 'sideways_rsi_os': 29, 'sideways_rsi_ob': 45, 'sideways_adx_thresh': 28.360467352335885, 'sideways_atr_min_pct': 0.0039804422282043095, 'sideways_atr_max_pct': 0.07025077447463583, 'sideways_tp_mult': 1.832290961392756, 'sideways_tsl_mult': 0.3165756317180841, 'sideways_time_stop': 147, 'sideways_use_sma': False, 'sideways_use_ema': False, 'sideways_use_atr': False, 'sideways_use_adx': False, 'sideways_use_spike': False, 'sideways_rsi_required': False}.
[I 2025-09-01 09:38:40,646] Trial 249 finished with values: [-1000000000.0, 1000000000.0] and parameters: {'p_sma': 57, 'p_std': 24, 'p_atr': 28, 'p_adx': 15, 'rsi_period': 64, 'ema1': 19, 'ema2': 15, 'slip_atr_k': 0.043319762205532145, 'slip_spread_k': 0.03369525693961567, 'spread_hl_frac': 0.026723505490793113, 'bb_std_mult': 1.5747873448904692, 'rsi_os': 36, 'rsi_ob': 48, 'vol_spike': 0.22532640362558548, 'adx_thresh': 12.361354721256639, 'atr_min_pct': 0.014987523680331896, 'atr_max_pct': 0.14463937567131213, 'tp_mult': 1.8473503633435473, 'tsl_mult': 0.5496124664407868, 'strategy': 'breakout', 'time_stop': 140, 'use_sma': True, 'use_atr': False, 'use_adx': False, 'use_ema': False, 'use_spike': False, 'rsi_required': False, 'edge_k': 0.249187997641107, 'edge_cap': 0.5262382512744681, 'bull_strategy': 'mean_reversion', 'bull_bb_std_mult': 1.442406979649721, 'bull_rsi_os': 20, 'bull_rsi_ob': 72, 'bull_adx_thresh': 15.05759785742337, 'bull_atr_min_pct': 0.028691639685069, 'bull_atr_max_pct': 0.14534381536160315, 'bull_tp_mult': 2.695138986704995, 'bull_tsl_mult': 0.9058887644205162, 'bull_time_stop': 227, 'bull_use_sma': True, 'bull_use_ema': False, 'bull_use_atr': False, 'bull_use_adx': False, 'bull_use_spike': False, 'bull_rsi_required': True, 'bear_strategy': 'breakout', 'bear_bb_std_mult': 3.4970195465664045, 'bear_rsi_os': 6, 'bear_rsi_ob': 84, 'bear_adx_thresh': 13.491297905569764, 'bear_atr_min_pct': 0.014856824585476531, 'bear_atr_max_pct': 0.11745102554763956, 'bear_tp_mult': 1.1633519489756834, 'bear_tsl_mult': 0.47042937120293576, 'bear_time_stop': 224, 'bear_use_sma': False, 'bear_use_ema': False, 'bear_use_atr': False, 'bear_use_adx': False, 'bear_use_spike': False, 'bear_rsi_required': False, 'sideways_strategy': 'breakout', 'sideways_bb_std_mult': 0.991199425632991, 'sideways_rsi_os': 25, 'sideways_rsi_ob': 48, 'sideways_adx_thresh': 23.5714271009078, 'sideways_atr_min_pct': 0.004631842888152653, 'sideways_atr_max_pct': 0.06532874749574784, 'sideways_tp_mult': 1.7936205537960415, 'sideways_tsl_mult': 0.9313421705191433, 'sideways_time_stop': 167, 'sideways_use_sma': False, 'sideways_use_ema': True, 'sideways_use_atr': False, 'sideways_use_adx': False, 'sideways_use_spike': False, 'sideways_rsi_required': False}.
[I 2025-09-01 09:38:41,739] Trial 250 finished with values: [-1000000000.0, 1000000000.0] and parameters: {'p_sma': 24, 'p_std': 55, 'p_atr': 20, 'p_adx': 15, 'rsi_period': 82, 'ema1': 8, 'ema2': 15, 'slip_atr_k': 0.18791638644151212, 'slip_spread_k': 0.9230460749400768, 'spread_hl_frac': 0.02972120051974478, 'bb_std_mult': 1.592065137474632, 'rsi_os': 36, 'rsi_ob': 62, 'vol_spike': 0.23450292485012544, 'adx_thresh': 6.029630087174922, 'atr_min_pct': 0.018678566840524245, 'atr_max_pct': 0.06495429361887066, 'tp_mult': 1.8648525609586042, 'tsl_mult': 0.5350835793929714, 'strategy': 'breakout', 'time_stop': 113, 'use_sma': True, 'use_atr': False, 'use_adx': True, 'use_ema': False, 'use_spike': False, 'rsi_required': False, 'edge_k': 1.428769390411755, 'edge_cap': 0.5247378991590946, 'bull_strategy': 'mean_reversion', 'bull_bb_std_mult': 0.7248020844150902, 'bull_rsi_os': 20, 'bull_rsi_ob': 80, 'bull_adx_thresh': 15.154651766481798, 'bull_atr_min_pct': 0.012112765372553598, 'bull_atr_max_pct': 0.05918808816373096, 'bull_tp_mult': 2.5967333652922338, 'bull_tsl_mult': 0.9673051463667135, 'bull_time_stop': 203, 'bull_use_sma': False, 'bull_use_ema': False, 'bull_use_atr': False, 'bull_use_adx': True, 'bull_use_spike': False, 'bull_rsi_required': True, 'bear_strategy': 'mean_reversion', 'bear_bb_std_mult': 3.4834883955951046, 'bear_rsi_os': 46, 'bear_rsi_ob': 78, 'bear_adx_thresh': 13.452657981528102, 'bear_atr_min_pct': 0.015937601400704136, 'bear_atr_max_pct': 0.12327708742090987, 'bear_tp_mult': 2.247309507096381, 'bear_tsl_mult': 0.403610515872453, 'bear_time_stop': 276, 'bear_use_sma': True, 'bear_use_ema': True, 'bear_use_atr': True, 'bear_use_adx': False, 'bear_use_spike': False, 'bear_rsi_required': False, 'sideways_strategy': 'breakout', 'sideways_bb_std_mult': 0.9855107467004676, 'sideways_rsi_os': 41, 'sideways_rsi_ob': 47, 'sideways_adx_thresh': 14.961206316085189, 'sideways_atr_min_pct': 0.004523972241095738, 'sideways_atr_max_pct': 0.06439695820779985, 'sideways_tp_mult': 1.7893883652343119, 'sideways_tsl_mult': 0.7247996297574139, 'sideways_time_stop': 219, 'sideways_use_sma': False, 'sideways_use_ema': True, 'sideways_use_atr': False, 'sideways_use_adx': True, 'sideways_use_spike': True, 'sideways_rsi_required': True}.
[I 2025-09-01 09:38:41,744] Trial 248 finished with values: [-0.021573048884891977, 0.02177282694958484] and parameters: {'p_sma': 26, 'p_std': 24, 'p_atr': 16, 'p_adx': 21, 'rsi_period': 14, 'ema1': 9, 'ema2': 35, 'slip_atr_k': 0.058421617188092606, 'slip_spread_k': 0.24653590388093868, 'spread_hl_frac': 0.029878420875853295, 'bb_std_mult': 1.0782618283458327, 'rsi_os': 14, 'rsi_ob': 88, 'vol_spike': 0.22304163684066813, 'adx_thresh': 12.29024757422691, 'atr_min_pct': 0.02049392878888704, 'atr_max_pct': 0.14983260354093034, 'tp_mult': 1.871493043295945, 'tsl_mult': 0.031019829884352347, 'strategy': 'breakout', 'time_stop': 5, 'use_sma': True, 'use_atr': False, 'use_adx': True, 'use_ema': False, 'use_spike': False, 'rsi_required': False, 'edge_k': 0.25044994917794905, 'edge_cap': 0.9529939247831496, 'bull_strategy': 'mean_reversion', 'bull_bb_std_mult': 1.7271790539667338, 'bull_rsi_os': 51, 'bull_rsi_ob': 54, 'bull_adx_thresh': 21.92488513107448, 'bull_atr_min_pct': 0.021294804242233303, 'bull_atr_max_pct': 0.059181312699705835, 'bull_tp_mult': 2.614444552231591, 'bull_tsl_mult': 0.4101709716399255, 'bull_time_stop': 120, 'bull_use_sma': True, 'bull_use_ema': False, 'bull_use_atr': False, 'bull_use_adx': False, 'bull_use_spike': False, 'bull_rsi_required': True, 'bear_strategy': 'mean_reversion', 'bear_bb_std_mult': 3.4862540442477874, 'bear_rsi_os': 45, 'bear_rsi_ob': 88, 'bear_adx_thresh': 34.96228974886646, 'bear_atr_min_pct': 0.015097481409126354, 'bear_atr_max_pct': 0.12402610383428858, 'bear_tp_mult': 1.1241258449248792, 'bear_tsl_mult': 0.4699773768380154, 'bear_time_stop': 250, 'bear_use_sma': False, 'bear_use_ema': True, 'bear_use_atr': True, 'bear_use_adx': False, 'bear_use_spike': False, 'bear_rsi_required': False, 'sideways_strategy': 'breakout', 'sideways_bb_std_mult': 1.1118785704479603, 'sideways_rsi_os': 40, 'sideways_rsi_ob': 48, 'sideways_adx_thresh': 23.519823205285448, 'sideways_atr_min_pct': 0.004451640941271436, 'sideways_atr_max_pct': 0.06497020064547701, 'sideways_tp_mult': 2.3276952102203574, 'sideways_tsl_mult': 0.9282968555748682, 'sideways_time_stop': 119, 'sideways_use_sma': False, 'sideways_use_ema': True, 'sideways_use_atr': False, 'sideways_use_adx': False, 'sideways_use_spike': False, 'sideways_rsi_required': False}.
[I 2025-09-01 09:38:42,083] Trial 247 finished with values: [-1000000000.0, 1000000000.0] and parameters: {'p_sma': 52, 'p_std': 24, 'p_atr': 28, 'p_adx': 21, 'rsi_period': 15, 'ema1': 19, 'ema2': 15, 'slip_atr_k': 0.057122597290639246, 'slip_spread_k': 0.9272949173606654, 'spread_hl_frac': 0.038838060278607804, 'bb_std_mult': 1.5698275615745747, 'rsi_os': 47, 'rsi_ob': 88, 'vol_spike': 0.22509066084068263, 'adx_thresh': 6.039076236648169, 'atr_min_pct': 0.020576341911502323, 'atr_max_pct': 0.14917684445873666, 'tp_mult': 1.8690694462408681, 'tsl_mult': 0.022197713531165664, 'strategy': 'breakout', 'time_stop': 207, 'use_sma': True, 'use_atr': False, 'use_adx': True, 'use_ema': False, 'use_spike': False, 'rsi_required': False, 'edge_k': 1.5120887206486942, 'edge_cap': 0.4848835014843394, 'bull_strategy': 'mean_reversion', 'bull_bb_std_mult': 0.7063951411768805, 'bull_rsi_os': 19, 'bull_rsi_ob': 53, 'bull_adx_thresh': 15.189604925633729, 'bull_atr_min_pct': 0.02867968377994087, 'bull_atr_max_pct': 0.05875102328480205, 'bull_tp_mult': 2.0764508337004592, 'bull_tsl_mult': 0.4872973051399329, 'bull_time_stop': 205, 'bull_use_sma': True, 'bull_use_ema': False, 'bull_use_atr': False, 'bull_use_adx': False, 'bull_use_spike': False, 'bull_rsi_required': True, 'bear_strategy': 'mean_reversion', 'bear_bb_std_mult': 3.1414178397648422, 'bear_rsi_os': 45, 'bear_rsi_ob': 87, 'bear_adx_thresh': 5.878769203777718, 'bear_atr_min_pct': 0.028994952949065754, 'bear_atr_max_pct': 0.12393392142334425, 'bear_tp_mult': 1.1453699229017134, 'bear_tsl_mult': 0.8623904599106673, 'bear_time_stop': 198, 'bear_use_sma': False, 'bear_use_ema': True, 'bear_use_atr': True, 'bear_use_adx': False, 'bear_use_spike': False, 'bear_rsi_required': False, 'sideways_strategy': 'breakout', 'sideways_bb_std_mult': 2.4753944295829733, 'sideways_rsi_os': 40, 'sideways_rsi_ob': 48, 'sideways_adx_thresh': 30.015650556125113, 'sideways_atr_min_pct': 0.0045732372504931175, 'sideways_atr_max_pct': 0.14104021829071509, 'sideways_tp_mult': 1.7887575913713283, 'sideways_tsl_mult': 0.9294376058866453, 'sideways_time_stop': 118, 'sideways_use_sma': False, 'sideways_use_ema': True, 'sideways_use_atr': False, 'sideways_use_adx': False, 'sideways_use_spike': False, 'sideways_rsi_required': False}.
[I 2025-09-01 09:38:42,762] Trial 253 finished with values: [-1000000000.0, 1000000000.0] and parameters: {'p_sma': 52, 'p_std': 25, 'p_atr': 15, 'p_adx': 13, 'rsi_period': 43, 'ema1': 7, 'ema2': 19, 'slip_atr_k': 0.21461184456319454, 'slip_spread_k': 0.21893347643871228, 'spread_hl_frac': 0.038636192968004975, 'bb_std_mult': 1.9427337123504582, 'rsi_os': 14, 'rsi_ob': 50, 'vol_spike': 0.21872421493891006, 'adx_thresh': 34.254953564752576, 'atr_min_pct': 0.019913798675120577, 'atr_max_pct': 0.1051939903930164, 'tp_mult': 1.7769855009886448, 'tsl_mult': 0.017411418588829768, 'strategy': 'mean_reversion', 'time_stop': 205, 'use_sma': True, 'use_atr': False, 'use_adx': True, 'use_ema': False, 'use_spike': False, 'rsi_required': False, 'edge_k': 1.6124462223351361, 'edge_cap': 0.3789228625274596, 'bull_strategy': 'mean_reversion', 'bull_bb_std_mult': 0.6125982469420151, 'bull_rsi_os': 44, 'bull_rsi_ob': 84, 'bull_adx_thresh': 5.718583421128989, 'bull_atr_min_pct': 0.02894144506773919, 'bull_atr_max_pct': 0.06380135961049214, 'bull_tp_mult': 1.813611861456889, 'bull_tsl_mult': 0.11766556410305427, 'bull_time_stop': 120, 'bull_use_sma': True, 'bull_use_ema': False, 'bull_use_atr': False, 'bull_use_adx': False, 'bull_use_spike': False, 'bull_rsi_required': True, 'bear_strategy': 'mean_reversion', 'bear_bb_std_mult': 3.3697345178156093, 'bear_rsi_os': 30, 'bear_rsi_ob': 80, 'bear_adx_thresh': 14.124042786060384, 'bear_atr_min_pct': 0.016940964503111243, 'bear_atr_max_pct': 0.11034405242835597, 'bear_tp_mult': 2.1716388528388078, 'bear_tsl_mult': 0.4461626254868014, 'bear_time_stop': 212, 'bear_use_sma': False, 'bear_use_ema': True, 'bear_use_atr': True, 'bear_use_adx': False, 'bear_use_spike': False, 'bear_rsi_required': False, 'sideways_strategy': 'mean_reversion', 'sideways_bb_std_mult': 1.1242623188188585, 'sideways_rsi_os': 9, 'sideways_rsi_ob': 60, 'sideways_adx_thresh': 30.021216266199943, 'sideways_atr_min_pct': 0.015030874124852756, 'sideways_atr_max_pct': 0.147219619481863, 'sideways_tp_mult': 2.3418302235569564, 'sideways_tsl_mult': 0.9367862205360913, 'sideways_time_stop': 212, 'sideways_use_sma': False, 'sideways_use_ema': True, 'sideways_use_atr': False, 'sideways_use_adx': False, 'sideways_use_spike': False, 'sideways_rsi_required': False}.
