[I 2025-09-01 10:12:27,146] Trial 453 finished with values: [-1000000000.0, 1000000000.0] and parameters: {'p_sma': 21, 'p_std': 43, 'p_atr': 28, 'p_adx': 24, 'rsi_period': 59, 'ema1': 12, 'ema2': 37, 'slip_atr_k': 0.09020351414908451, 'slip_spread_k': 0.15858259492356452, 'spread_hl_frac': 0.02162150040913588, 'bb_std_mult': 3.3892610112611905, 'rsi_os': 28, 'rsi_ob': 73, 'vol_spike': 0.27559245408348565, 'adx_thresh': 33.83729403325133, 'atr_min_pct': 0.023235059888029513, 'atr_max_pct': 0.022454904754857397, 'tp_mult': 2.75814870699552, 'tsl_mult': 0.04877369600325966, 'strategy': 'breakout', 'time_stop': 150, 'use_sma': True, 'use_atr': False, 'use_adx': True, 'use_ema': False, 'use_spike': True, 'rsi_required': False, 'edge_k': 1.82975787848204, 'edge_cap': 0.5438756695173241, 'bull_strategy': 'mean_reversion', 'bull_bb_std_mult': 2.4281643565709925, 'bull_rsi_os': 19, 'bull_rsi_ob': 70, 'bull_adx_thresh': 23.587031628125665, 'bull_atr_min_pct': 0.022015720320466736, 'bull_atr_max_pct': 0.1166602029079784, 'bull_tp_mult': 1.8979575185812392, 'bull_tsl_mult': 0.07946207046889761, 'bull_time_stop': 143, 'bull_use_sma': True, 'bull_use_ema': False, 'bull_use_atr': True, 'bull_use_adx': True, 'bull_use_spike': False, 'bull_rsi_required': True, 'bear_strategy': 'mean_reversion', 'bear_bb_std_mult': 2.280177547748905, 'bear_rsi_os': 44, 'bear_rsi_ob': 48, 'bear_adx_thresh': 12.195262963747854, 'bear_atr_min_pct': 0.01698472600852892, 'bear_atr_max_pct': 0.07132533813012933, 'bear_tp_mult': 1.782458799727684, 'bear_tsl_mult': 0.5531012730602332, 'bear_time_stop': 136, 'bear_use_sma': False, 'bear_use_ema': True, 'bear_use_atr': True, 'bear_use_adx': False, 'bear_use_spike': True, 'bear_rsi_required': False, 'sideways_strategy': 'breakout', 'sideways_bb_std_mult': 3.4401412390660746, 'sideways_rsi_os': 19, 'sideways_rsi_ob': 79, 'sideways_adx_thresh': 28.298387766846528, 'sideways_atr_min_pct': 0.002199241971675657, 'sideways_atr_max_pct': 0.0658008604506906, 'sideways_tp_mult': 1.2947551243209616, 'sideways_tsl_mult': 0.3507001609919259, 'sideways_time_stop': 292, 'sideways_use_sma': False, 'sideways_use_ema': True, 'sideways_use_atr': False, 'sideways_use_adx': False, 'sideways_use_spike': False, 'sideways_rsi_required': False}.
[I 2025-09-01 10:13:06,381] Trial 454 finished with values: [-1000000000.0, 1000000000.0] and parameters: {'p_sma': 12, 'p_std': 43, 'p_atr': 28, 'p_adx': 30, 'rsi_period': 18, 'ema1': 29, 'ema2': 52, 'slip_atr_k': 0.054503616209648664, 'slip_spread_k': 0.04352847088500905, 'spread_hl_frac': 0.027199606680590058, 'bb_std_mult': 3.273185857485086, 'rsi_os': 30, 'rsi_ob': 76, 'vol_spike': 0.26819008650561366, 'adx_thresh': 7.162809129129849, 'atr_min_pct': 0.023537346798586344, 'atr_max_pct': 0.07804493759037215, 'tp_mult': 2.763353197069875, 'tsl_mult': 0.7075532122315558, 'strategy': 'mean_reversion', 'time_stop': 243, 'use_sma': True, 'use_atr': False, 'use_adx': False, 'use_ema': False, 'use_spike': False, 'rsi_required': False, 'edge_k': 1.0280262955424553, 'edge_cap': 0.6711441253977628, 'bull_strategy': 'mean_reversion', 'bull_bb_std_mult': 1.56498444120495, 'bull_rsi_os': 8, 'bull_rsi_ob': 86, 'bull_adx_thresh': 20.425535205774956, 'bull_atr_min_pct': 0.007696109230754951, 'bull_atr_max_pct': 0.042257158239499056, 'bull_tp_mult': 2.3062702716582804, 'bull_tsl_mult': 0.6289224308846499, 'bull_time_stop': 70, 'bull_use_sma': True, 'bull_use_ema': False, 'bull_use_atr': True, 'bull_use_adx': True, 'bull_use_spike': False, 'bull_rsi_required': True, 'bear_strategy': 'mean_reversion', 'bear_bb_std_mult': 3.3212011048056094, 'bear_rsi_os': 5, 'bear_rsi_ob': 53, 'bear_adx_thresh': 12.82824770511398, 'bear_atr_min_pct': 0.01890600252636181, 'bear_atr_max_pct': 0.05208523569512364, 'bear_tp_mult': 1.1539101941872287, 'bear_tsl_mult': 0.23712409399834006, 'bear_time_stop': 278, 'bear_use_sma': False, 'bear_use_ema': True, 'bear_use_atr': False, 'bear_use_adx': False, 'bear_use_spike': True, 'bear_rsi_required': False, 'sideways_strategy': 'breakout', 'sideways_bb_std_mult': 3.5455042718642287, 'sideways_rsi_os': 48, 'sideways_rsi_ob': 84, 'sideways_adx_thresh': 27.10348756654371, 'sideways_atr_min_pct': 0.004595372196798186, 'sideways_atr_max_pct': 0.06288364802962493, 'sideways_tp_mult': 1.3835878805392299, 'sideways_tsl_mult': 0.01935677980063577, 'sideways_time_stop': 188, 'sideways_use_sma': False, 'sideways_use_ema': True, 'sideways_use_atr': False, 'sideways_use_adx': False, 'sideways_use_spike': False, 'sideways_rsi_required': False}.
[I 2025-09-01 10:13:06,837] Trial 451 finished with values: [-1000000000.0, 1000000000.0] and parameters: {'p_sma': 8, 'p_std': 43, 'p_atr': 28, 'p_adx': 7, 'rsi_period': 59, 'ema1': 21, 'ema2': 48, 'slip_atr_k': 0.0527356072931774, 'slip_spread_k': 0.1558231657017617, 'spread_hl_frac': 0.00426156580973314, 'bb_std_mult': 3.3866527756844964, 'rsi_os': 28, 'rsi_ob': 73, 'vol_spike': 0.25771841883955665, 'adx_thresh': 6.192360077678515, 'atr_min_pct': 0.0003806461507110375, 'atr_max_pct': 0.0723087264808231, 'tp_mult': 2.7673477115762397, 'tsl_mult': 0.049420683116401756, 'strategy': 'breakout', 'time_stop': 152, 'use_sma': True, 'use_atr': False, 'use_adx': True, 'use_ema': False, 'use_spike': True, 'rsi_required': False, 'edge_k': 1.024111514811971, 'edge_cap': 0.7840074648446248, 'bull_strategy': 'mean_reversion', 'bull_bb_std_mult': 1.648705428289283, 'bull_rsi_os': 19, 'bull_rsi_ob': 56, 'bull_adx_thresh': 19.075051699573596, 'bull_atr_min_pct': 0.028679045393170323, 'bull_atr_max_pct': 0.11265491082783124, 'bull_tp_mult': 2.3157793570452134, 'bull_tsl_mult': 0.07316849704238175, 'bull_time_stop': 245, 'bull_use_sma': True, 'bull_use_ema': False, 'bull_use_atr': True, 'bull_use_adx': True, 'bull_use_spike': False, 'bull_rsi_required': True, 'bear_strategy': 'mean_reversion', 'bear_bb_std_mult': 0.8117047588702682, 'bear_rsi_os': 5, 'bear_rsi_ob': 77, 'bear_adx_thresh': 12.352977639635942, 'bear_atr_min_pct': 0.009539285222678898, 'bear_atr_max_pct': 0.07136803659016706, 'bear_tp_mult': 2.728482922118647, 'bear_tsl_mult': 0.41799474401303327, 'bear_time_stop': 136, 'bear_use_sma': False, 'bear_use_ema': True, 'bear_use_atr': True, 'bear_use_adx': False, 'bear_use_spike': True, 'bear_rsi_required': False, 'sideways_strategy': 'breakout', 'sideways_bb_std_mult': 3.2624054570555705, 'sideways_rsi_os': 19, 'sideways_rsi_ob': 90, 'sideways_adx_thresh': 33.95156247678951, 'sideways_atr_min_pct': 0.0021153376704936807, 'sideways_atr_max_pct': 0.06587319959305615, 'sideways_tp_mult': 1.3859055518076442, 'sideways_tsl_mult': 0.3430616598310974, 'sideways_time_stop': 102, 'sideways_use_sma': False, 'sideways_use_ema': True, 'sideways_use_atr': False, 'sideways_use_adx': False, 'sideways_use_spike': False, 'sideways_rsi_required': False}.
[I 2025-09-01 10:13:07,304] Trial 452 finished with values: [-0.28353687471389677, 0.2833393269088032] and parameters: {'p_sma': 19, 'p_std': 43, 'p_atr': 28, 'p_adx': 24, 'rsi_period': 42, 'ema1': 27, 'ema2': 51, 'slip_atr_k': 0.05376240620404928, 'slip_spread_k': 0.1566236702925395, 'spread_hl_frac': 0.006504091679052203, 'bb_std_mult': 3.2744855451488597, 'rsi_os': 17, 'rsi_ob': 73, 'vol_spike': 0.2755114370245435, 'adx_thresh': 34.014672531464086, 'atr_min_pct': 0.006454448805934803, 'atr_max_pct': 0.013154450181034713, 'tp_mult': 2.750471167910281, 'tsl_mult': 0.7458296118360996, 'strategy': 'breakout', 'time_stop': 154, 'use_sma': True, 'use_atr': False, 'use_adx': True, 'use_ema': False, 'use_spike': True, 'rsi_required': False, 'edge_k': 0.5767802438257135, 'edge_cap': 0.6408651239345303, 'bull_strategy': 'mean_reversion', 'bull_bb_std_mult': 2.445898387236307, 'bull_rsi_os': 39, 'bull_rsi_ob': 56, 'bull_adx_thresh': 5.017579468161545, 'bull_atr_min_pct': 0.0017100760374945834, 'bull_atr_max_pct': 0.012421967602101264, 'bull_tp_mult': 1.8165765597266017, 'bull_tsl_mult': 0.778389421722265, 'bull_time_stop': 72, 'bull_use_sma': True, 'bull_use_ema': False, 'bull_use_atr': True, 'bull_use_adx': True, 'bull_use_spike': False, 'bull_rsi_required': True, 'bear_strategy': 'mean_reversion', 'bear_bb_std_mult': 3.486508710418232, 'bear_rsi_os': 44, 'bear_rsi_ob': 75, 'bear_adx_thresh': 12.106285843692092, 'bear_atr_min_pct': 0.01859147928459111, 'bear_atr_max_pct': 0.07106215753822195, 'bear_tp_mult': 1.2130245983139436, 'bear_tsl_mult': 0.23138431479001415, 'bear_time_stop': 136, 'bear_use_sma': False, 'bear_use_ema': True, 'bear_use_atr': True, 'bear_use_adx': False, 'bear_use_spike': True, 'bear_rsi_required': False, 'sideways_strategy': 'breakout', 'sideways_bb_std_mult': 3.5963657320114395, 'sideways_rsi_os': 54, 'sideways_rsi_ob': 91, 'sideways_adx_thresh': 34.098862912071766, 'sideways_atr_min_pct': 4.4780973083387646e-05, 'sideways_atr_max_pct': 0.06545235695470179, 'sideways_tp_mult': 1.384928366933276, 'sideways_tsl_mult': 0.3602678818683268, 'sideways_time_stop': 187, 'sideways_use_sma': False, 'sideways_use_ema': True, 'sideways_use_atr': False, 'sideways_use_adx': False, 'sideways_use_spike': False, 'sideways_rsi_required': False}.
[I 2025-09-01 10:13:07,590] Trial 450 finished with values: [-1000000000.0, 1000000000.0] and parameters: {'p_sma': 24, 'p_std': 43, 'p_atr': 29, 'p_adx': 27, 'rsi_period': 71, 'ema1': 25, 'ema2': 51, 'slip_atr_k': 0.053003495299297744, 'slip_spread_k': 0.21059265579453124, 'spread_hl_frac': 0.028358471233174955, 'bb_std_mult': 3.2721124964062414, 'rsi_os': 17, 'rsi_ob': 80, 'vol_spike': 0.2724364209856473, 'adx_thresh': 6.2341376946694815, 'atr_min_pct': 0.02319792725311261, 'atr_max_pct': 0.07812745117673736, 'tp_mult': 2.6690986531694896, 'tsl_mult': 0.747302601122708, 'strategy': 'breakout', 'time_stop': 160, 'use_sma': True, 'use_atr': True, 'use_adx': False, 'use_ema': False, 'use_spike': False, 'rsi_required': True, 'edge_k': 0.6999039015104198, 'edge_cap': 0.646383127543158, 'bull_strategy': 'mean_reversion', 'bull_bb_std_mult': 1.1708732125187777, 'bull_rsi_os': 19, 'bull_rsi_ob': 56, 'bull_adx_thresh': 5.634338821080437, 'bull_atr_min_pct': 0.029958687256240055, 'bull_atr_max_pct': 0.11214211424794528, 'bull_tp_mult': 1.8117559109932533, 'bull_tsl_mult': 0.0007116075220497536, 'bull_time_stop': 146, 'bull_use_sma': True, 'bull_use_ema': False, 'bull_use_atr': True, 'bull_use_adx': True, 'bull_use_spike': False, 'bull_rsi_required': True, 'bear_strategy': 'mean_reversion', 'bear_bb_std_mult': 3.3232181751689582, 'bear_rsi_os': 48, 'bear_rsi_ob': 47, 'bear_adx_thresh': 12.050078676937265, 'bear_atr_min_pct': 0.01705218698783083, 'bear_atr_max_pct': 0.0715378763686331, 'bear_tp_mult': 2.733369766793661, 'bear_tsl_mult': 0.40268169448929114, 'bear_time_stop': 136, 'bear_use_sma': False, 'bear_use_ema': True, 'bear_use_atr': False, 'bear_use_adx': False, 'bear_use_spike': True, 'bear_rsi_required': False, 'sideways_strategy': 'breakout', 'sideways_bb_std_mult': 3.5420985791669155, 'sideways_rsi_os': 14, 'sideways_rsi_ob': 49, 'sideways_adx_thresh': 14.051340054469115, 'sideways_atr_min_pct': 0.00010367378967404174, 'sideways_atr_max_pct': 0.0749827186288021, 'sideways_tp_mult': 2.3974117478830426, 'sideways_tsl_mult': 0.8805699583880588, 'sideways_time_stop': 65, 'sideways_use_sma': False, 'sideways_use_ema': True, 'sideways_use_atr': False, 'sideways_use_adx': True, 'sideways_use_spike': True, 'sideways_rsi_required': False}.
[I 2025-09-01 10:13:48,494] Trial 458 finished with values: [-1000000000.0, 1000000000.0] and parameters: {'p_sma': 20, 'p_std': 46, 'p_atr': 29, 'p_adx': 8, 'rsi_period': 65, 'ema1': 22, 'ema2': 47, 'slip_atr_k': 0.04921796205346017, 'slip_spread_k': 0.4302258406286368, 'spread_hl_frac': 0.03031353289739916, 'bb_std_mult': 1.4929658036361828, 'rsi_os': 22, 'rsi_ob': 77, 'vol_spike': 0.29998454680156167, 'adx_thresh': 29.817171000485224, 'atr_min_pct': 0.007669250716680582, 'atr_max_pct': 0.09953116346476672, 'tp_mult': 2.7339476292614053, 'tsl_mult': 0.01617657614410127, 'strategy': 'mean_reversion', 'time_stop': 144, 'use_sma': False, 'use_atr': False, 'use_adx': True, 'use_ema': True, 'use_spike': False, 'rsi_required': False, 'edge_k': 0.9198584312142061, 'edge_cap': 0.5995188730983446, 'bull_strategy': 'breakout', 'bull_bb_std_mult': 0.9525704115080509, 'bull_rsi_os': 17, 'bull_rsi_ob': 77, 'bull_adx_thresh': 6.58327591974888, 'bull_atr_min_pct': 0.014171105207136965, 'bull_atr_max_pct': 0.09280152968705456, 'bull_tp_mult': 1.7422481659385904, 'bull_tsl_mult': 0.8618113260074081, 'bull_time_stop': 265, 'bull_use_sma': True, 'bull_use_ema': True, 'bull_use_atr': True, 'bull_use_adx': True, 'bull_use_spike': True, 'bull_rsi_required': False, 'bear_strategy': 'breakout', 'bear_bb_std_mult': 0.5683598271361421, 'bear_rsi_os': 47, 'bear_rsi_ob': 72, 'bear_adx_thresh': 10.449706620929, 'bear_atr_min_pct': 0.01614757458257037, 'bear_atr_max_pct': 0.06810234285545687, 'bear_tp_mult': 1.9981993971990915, 'bear_tsl_mult': 0.45947638673047203, 'bear_time_stop': 180, 'bear_use_sma': False, 'bear_use_ema': False, 'bear_use_atr': True, 'bear_use_adx': True, 'bear_use_spike': True, 'bear_rsi_required': False, 'sideways_strategy': 'breakout', 'sideways_bb_std_mult': 1.9677544785707213, 'sideways_rsi_os': 50, 'sideways_rsi_ob': 72, 'sideways_adx_thresh': 28.792582413433337, 'sideways_atr_min_pct': 0.003930862881135382, 'sideways_atr_max_pct': 0.14314430813445314, 'sideways_tp_mult': 1.2535339063787805, 'sideways_tsl_mult': 0.7698576447307474, 'sideways_time_stop': 197, 'sideways_use_sma': True, 'sideways_use_ema': False, 'sideways_use_atr': False, 'sideways_use_adx': False, 'sideways_use_spike': False, 'sideways_rsi_required': False}.
[I 2025-09-01 10:13:49,617] Trial 456 finished with values: [-1000000000.0, 1000000000.0] and parameters: {'p_sma': 18, 'p_std': 46, 'p_atr': 29, 'p_adx': 23, 'rsi_period': 55, 'ema1': 27, 'ema2': 31, 'slip_atr_k': 0.0832757116048029, 'slip_spread_k': 0.2128990475629379, 'spread_hl_frac': 0.006428811181243898, 'bb_std_mult': 3.473041735039331, 'rsi_os': 35, 'rsi_ob': 80, 'vol_spike': 0.12690225626653623, 'adx_thresh': 31.086668096211465, 'atr_min_pct': 0.029154604330645116, 'atr_max_pct': 0.08199269545914968, 'tp_mult': 2.6636302890631125, 'tsl_mult': 0.01888043553868384, 'strategy': 'breakout', 'time_stop': 143, 'use_sma': False, 'use_atr': False, 'use_adx': True, 'use_ema': True, 'use_spike': False, 'rsi_required': False, 'edge_k': 0.6561479105034869, 'edge_cap': 0.6000671643077239, 'bull_strategy': 'breakout', 'bull_bb_std_mult': 2.1007177246044293, 'bull_rsi_os': 39, 'bull_rsi_ob': 55, 'bull_adx_thresh': 5.002236110455961, 'bull_atr_min_pct': 0.014323686824002986, 'bull_atr_max_pct': 0.09247103222434669, 'bull_tp_mult': 1.8133521453837484, 'bull_tsl_mult': 0.005370609840462795, 'bull_time_stop': 146, 'bull_use_sma': True, 'bull_use_ema': False, 'bull_use_atr': True, 'bull_use_adx': True, 'bull_use_spike': True, 'bull_rsi_required': False, 'bear_strategy': 'breakout', 'bear_bb_std_mult': 3.4806227525850026, 'bear_rsi_os': 30, 'bear_rsi_ob': 55, 'bear_adx_thresh': 13.715066326388856, 'bear_atr_min_pct': 0.017012753347443454, 'bear_atr_max_pct': 0.0769956606354118, 'bear_tp_mult': 1.404394184734067, 'bear_tsl_mult': 0.10777735886338252, 'bear_time_stop': 126, 'bear_use_sma': False, 'bear_use_ema': True, 'bear_use_atr': True, 'bear_use_adx': False, 'bear_use_spike': True, 'bear_rsi_required': False, 'sideways_strategy': 'breakout', 'sideways_bb_std_mult': 3.327985740010614, 'sideways_rsi_os': 54, 'sideways_rsi_ob': 65, 'sideways_adx_thresh': 7.186294348378892, 'sideways_atr_min_pct': 0.02057490405461922, 'sideways_atr_max_pct': 0.04813534061229848, 'sideways_tp_mult': 1.2628620327528484, 'sideways_tsl_mult': 0.8685539558543662, 'sideways_time_stop': 150, 'sideways_use_sma': True, 'sideways_use_ema': True, 'sideways_use_atr': False, 'sideways_use_adx': False, 'sideways_use_spike': False, 'sideways_rsi_required': False}.
[I 2025-09-01 10:13:49,940] Trial 457 finished with values: [-1000000000.0, 1000000000.0] and parameters: {'p_sma': 24, 'p_std': 46, 'p_atr': 29, 'p_adx': 11, 'rsi_period': 68, 'ema1': 16, 'ema2': 31, 'slip_atr_k': 0.04758278030409757, 'slip_spread_k': 0.19686738390818767, 'spread_hl_frac': 0.02776922353617433, 'bb_std_mult': 0.910388205260481, 'rsi_os': 36, 'rsi_ob': 80, 'vol_spike': 0.292655301366492, 'adx_thresh': 6.156559019092902, 'atr_min_pct': 0.023927313286556503, 'atr_max_pct': 0.07442744388550522, 'tp_mult': 2.6466070524803302, 'tsl_mult': 0.9004475432070367, 'strategy': 'breakout', 'time_stop': 144, 'use_sma': False, 'use_atr': False, 'use_adx': True, 'use_ema': True, 'use_spike': False, 'rsi_required': True, 'edge_k': 0.9195084418226412, 'edge_cap': 0.2466642341840678, 'bull_strategy': 'breakout', 'bull_bb_std_mult': 0.8228880726722184, 'bull_rsi_os': 17, 'bull_rsi_ob': 73, 'bull_adx_thresh': 16.848165525007605, 'bull_atr_min_pct': 0.028787095943942815, 'bull_atr_max_pct': 0.09150302813209628, 'bull_tp_mult': 1.7510774528382937, 'bull_tsl_mult': 0.011722674309782716, 'bull_time_stop': 149, 'bull_use_sma': True, 'bull_use_ema': True, 'bull_use_atr': True, 'bull_use_adx': True, 'bull_use_spike': True, 'bull_rsi_required': False, 'bear_strategy': 'breakout', 'bear_bb_std_mult': 3.3163755169725064, 'bear_rsi_os': 47, 'bear_rsi_ob': 46, 'bear_adx_thresh': 10.477619127466088, 'bear_atr_min_pct': 0.01695396032752268, 'bear_atr_max_pct': 0.06707656957891218, 'bear_tp_mult': 2.5233696043908163, 'bear_tsl_mult': 0.458753142530051, 'bear_time_stop': 179, 'bear_use_sma': False, 'bear_use_ema': False, 'bear_use_atr': True, 'bear_use_adx': True, 'bear_use_spike': True, 'bear_rsi_required': False, 'sideways_strategy': 'breakout', 'sideways_bb_std_mult': 3.292268366186086, 'sideways_rsi_os': 50, 'sideways_rsi_ob': 49, 'sideways_adx_thresh': 28.881163846053994, 'sideways_atr_min_pct': 0.020955283377587744, 'sideways_atr_max_pct': 0.08447302411281685, 'sideways_tp_mult': 1.256864963785004, 'sideways_tsl_mult': 0.8814495204057509, 'sideways_time_stop': 200, 'sideways_use_sma': True, 'sideways_use_ema': False, 'sideways_use_atr': False, 'sideways_use_adx': False, 'sideways_use_spike': True, 'sideways_rsi_required': False}.
[I 2025-09-01 10:13:50,300] Trial 455 finished with values: [-0.2590184980999567, 0.25899050843167504] and parameters: {'p_sma': 40, 'p_std': 43, 'p_atr': 28, 'p_adx': 8, 'rsi_period': 32, 'ema1': 24, 'ema2': 48, 'slip_atr_k': 0.0499154603511948, 'slip_spread_k': 0.2099952484693857, 'spread_hl_frac': 0.006760596532442795, 'bb_std_mult': 1.4935770855790569, 'rsi_os': 19, 'rsi_ob': 49, 'vol_spike': 0.2932128497994331, 'adx_thresh': 29.796078471597436, 'atr_min_pct': 0.02522513418359596, 'atr_max_pct': 0.09987089294143649, 'tp_mult': 2.736974408619659, 'tsl_mult': 0.017389283588261875, 'strategy': 'breakout', 'time_stop': 126, 'use_sma': True, 'use_atr': False, 'use_adx': True, 'use_ema': False, 'use_spike': True, 'rsi_required': False, 'edge_k': 0.576717705316977, 'edge_cap': 0.7836692306994923, 'bull_strategy': 'mean_reversion', 'bull_bb_std_mult': 0.9628938259801385, 'bull_rsi_os': 39, 'bull_rsi_ob': 55, 'bull_adx_thresh': 27.405022901515768, 'bull_atr_min_pct': 0.001567960843052458, 'bull_atr_max_pct': 0.09465147667209521, 'bull_tp_mult': 1.7490745056392034, 'bull_tsl_mult': 0.005808156545958877, 'bull_time_stop': 266, 'bull_use_sma': True, 'bull_use_ema': False, 'bull_use_atr': True, 'bull_use_adx': True, 'bull_use_spike': False, 'bull_rsi_required': True, 'bear_strategy': 'mean_reversion', 'bear_bb_std_mult': 3.4923611016178326, 'bear_rsi_os': 30, 'bear_rsi_ob': 46, 'bear_adx_thresh': 11.923054948901084, 'bear_atr_min_pct': 0.018563962457767952, 'bear_atr_max_pct': 0.07576060893869511, 'bear_tp_mult': 2.5358077958549066, 'bear_tsl_mult': 0.7981736420526052, 'bear_time_stop': 132, 'bear_use_sma': False, 'bear_use_ema': True, 'bear_use_atr': True, 'bear_use_adx': False, 'bear_use_spike': True, 'bear_rsi_required': False, 'sideways_strategy': 'breakout', 'sideways_bb_std_mult': 2.8474355649410956, 'sideways_rsi_os': 31, 'sideways_rsi_ob': 49, 'sideways_adx_thresh': 12.270099046381045, 'sideways_atr_min_pct': 0.0003071848076525996, 'sideways_atr_max_pct': 0.0963203304727138, 'sideways_tp_mult': 1.1715482070768808, 'sideways_tsl_mult': 0.8714051326134461, 'sideways_time_stop': 64, 'sideways_use_sma': False, 'sideways_use_ema': True, 'sideways_use_atr': False, 'sideways_use_adx': False, 'sideways_use_spike': False, 'sideways_rsi_required': False}.
