[I 2025-09-01 09:16:52,554] Trial 117 finished with values: [-1000000000.0, 1000000000.0] and parameters: {'p_sma': 21, 'p_std': 25, 'p_atr': 17, 'p_adx': 13, 'rsi_period': 55, 'ema1': 14, 'ema2': 13, 'slip_atr_k': 0.17643651081607736, 'slip_spread_k': 0.2830288542861527, 'spread_hl_frac': 0.009936724184551545, 'bb_std_mult': 2.1141451916619887, 'rsi_os': 21, 'rsi_ob': 87, 'vol_spike': 0.014650678473379503, 'adx_thresh': 9.095123960723383, 'atr_min_pct': 0.01817809673312264, 'atr_max_pct': 0.14642203337586854, 'tp_mult': 1.623826321896356, 'tsl_mult': 0.5146209968721652, 'strategy': 'breakout', 'time_stop': 226, 'use_sma': True, 'use_atr': False, 'use_adx': True, 'use_ema': False, 'use_spike': True, 'rsi_required': False, 'edge_k': 1.4334414513440727, 'edge_cap': 0.05170386071487444, 'bull_strategy': 'mean_reversion', 'bull_bb_std_mult': 0.6842703312202778, 'bull_rsi_os': 17, 'bull_rsi_ob': 57, 'bull_adx_thresh': 12.444164469703653, 'bull_atr_min_pct': 0.029643041665809534, 'bull_atr_max_pct': 0.09266617859286988, 'bull_tp_mult': 2.313867767942905, 'bull_tsl_mult': 0.0765927931195362, 'bull_time_stop': 106, 'bull_use_sma': True, 'bull_use_ema': False, 'bull_use_atr': False, 'bull_use_adx': False, 'bull_use_spike': False, 'bull_rsi_required': True, 'bear_strategy': 'mean_reversion', 'bear_bb_std_mult': 2.1124920450598395, 'bear_rsi_os': 46, 'bear_rsi_ob': 68, 'bear_adx_thresh': 24.4244929000715, 'bear_atr_min_pct': 0.0269603237200487, 'bear_atr_max_pct': 0.1235066777509518, 'bear_tp_mult': 2.0345524829198176, 'bear_tsl_mult': 0.531033836391049, 'bear_time_stop': 210, 'bear_use_sma': False, 'bear_use_ema': True, 'bear_use_atr': True, 'bear_use_adx': False, 'bear_use_spike': False, 'bear_rsi_required': False, 'sideways_strategy': 'breakout', 'sideways_bb_std_mult': 0.9649260421882342, 'sideways_rsi_os': 39, 'sideways_rsi_ob': 45, 'sideways_adx_thresh': 27.603174501893353, 'sideways_atr_min_pct': 0.004430931061892825, 'sideways_atr_max_pct': 0.14422165080129182, 'sideways_tp_mult': 1.9345967006059348, 'sideways_tsl_mult': 0.8922615371460566, 'sideways_time_stop': 162, 'sideways_use_sma': False, 'sideways_use_ema': True, 'sideways_use_atr': False, 'sideways_use_adx': False, 'sideways_use_spike': False, 'sideways_rsi_required': False}.
[I 2025-09-01 09:16:53,789] Trial 115 finished with values: [-1000000000.0, 1000000000.0] and parameters: {'p_sma': 23, 'p_std': 25, 'p_atr': 16, 'p_adx': 12, 'rsi_period': 42, 'ema1': 20, 'ema2': 17, 'slip_atr_k': 0.18223317023321245, 'slip_spread_k': 0.32111784375861724, 'spread_hl_frac': 0.04519936511614465, 'bb_std_mult': 1.816769938876368, 'rsi_os': 16, 'rsi_ob': 92, 'vol_spike': 0.2001623466904714, 'adx_thresh': 5.98260533079827, 'atr_min_pct': 0.020710005405429725, 'atr_max_pct': 0.14573288369693863, 'tp_mult': 1.8490677408725904, 'tsl_mult': 0.7655962653075132, 'strategy': 'breakout', 'time_stop': 232, 'use_sma': True, 'use_atr': False, 'use_adx': True, 'use_ema': False, 'use_spike': False, 'rsi_required': False, 'edge_k': 1.5183568499313627, 'edge_cap': 0.05045904154380186, 'bull_strategy': 'mean_reversion', 'bull_bb_std_mult': 0.812459730263452, 'bull_rsi_os': 18, 'bull_rsi_ob': 57, 'bull_adx_thresh': 12.074763969847197, 'bull_atr_min_pct': 0.027530104113613143, 'bull_atr_max_pct': 0.05815567333049118, 'bull_tp_mult': 1.864599592299902, 'bull_tsl_mult': 0.06974394599536297, 'bull_time_stop': 5, 'bull_use_sma': True, 'bull_use_ema': False, 'bull_use_atr': False, 'bull_use_adx': False, 'bull_use_spike': False, 'bull_rsi_required': True, 'bear_strategy': 'mean_reversion', 'bear_bb_std_mult': 2.128933283066642, 'bear_rsi_os': 43, 'bear_rsi_ob': 68, 'bear_adx_thresh': 29.135402467557306, 'bear_atr_min_pct': 0.018050394015748882, 'bear_atr_max_pct': 0.11184940217317678, 'bear_tp_mult': 2.0305712180546833, 'bear_tsl_mult': 0.9607846634624179, 'bear_time_stop': 228, 'bear_use_sma': False, 'bear_use_ema': True, 'bear_use_atr': True, 'bear_use_adx': False, 'bear_use_spike': False, 'bear_rsi_required': False, 'sideways_strategy': 'breakout', 'sideways_bb_std_mult': 1.7108425443020199, 'sideways_rsi_os': 39, 'sideways_rsi_ob': 46, 'sideways_adx_thresh': 29.56562390122525, 'sideways_atr_min_pct': 0.004592983336980628, 'sideways_atr_max_pct': 0.06831404321752972, 'sideways_tp_mult': 1.6732756083061546, 'sideways_tsl_mult': 0.8674690528557558, 'sideways_time_stop': 146, 'sideways_use_sma': False, 'sideways_use_ema': True, 'sideways_use_atr': False, 'sideways_use_adx': False, 'sideways_use_spike': True, 'sideways_rsi_required': True}.
[I 2025-09-01 09:17:34,215] Trial 120 finished with values: [-1000000000.0, 1000000000.0] and parameters: {'p_sma': 21, 'p_std': 29, 'p_atr': 24, 'p_adx': 22, 'rsi_period': 55, 'ema1': 6, 'ema2': 24, 'slip_atr_k': 0.1841407607609305, 'slip_spread_k': 0.23074800533940512, 'spread_hl_frac': 0.010858651441344295, 'bb_std_mult': 3.4656217404922534, 'rsi_os': 41, 'rsi_ob': 88, 'vol_spike': 0.0935727217888772, 'adx_thresh': 6.251114827486239, 'atr_min_pct': 0.02202550424873217, 'atr_max_pct': 0.10275703023108267, 'tp_mult': 1.8631985785036052, 'tsl_mult': 0.9434384587383746, 'strategy': 'breakout', 'time_stop': 183, 'use_sma': True, 'use_atr': False, 'use_adx': True, 'use_ema': False, 'use_spike': False, 'rsi_required': False, 'edge_k': 1.4351578029230139, 'edge_cap': 0.263395488018085, 'bull_strategy': 'mean_reversion', 'bull_bb_std_mult': 0.6984300829260998, 'bull_rsi_os': 17, 'bull_rsi_ob': 56, 'bull_adx_thresh': 9.416630856765074, 'bull_atr_min_pct': 0.028754473060378177, 'bull_atr_max_pct': 0.09243164315057742, 'bull_tp_mult': 2.0143011648914118, 'bull_tsl_mult': 0.2281702641955077, 'bull_time_stop': 103, 'bull_use_sma': True, 'bull_use_ema': False, 'bull_use_atr': False, 'bull_use_adx': False, 'bull_use_spike': False, 'bull_rsi_required': True, 'bear_strategy': 'mean_reversion', 'bear_bb_std_mult': 3.3402037487103233, 'bear_rsi_os': 44, 'bear_rsi_ob': 68, 'bear_adx_thresh': 13.288285519619881, 'bear_atr_min_pct': 0.02669460361965842, 'bear_atr_max_pct': 0.03844387416109368, 'bear_tp_mult': 2.0943422183294906, 'bear_tsl_mult': 0.3697178948086606, 'bear_time_stop': 234, 'bear_use_sma': True, 'bear_use_ema': True, 'bear_use_atr': True, 'bear_use_adx': False, 'bear_use_spike': True, 'bear_rsi_required': False, 'sideways_strategy': 'breakout', 'sideways_bb_std_mult': 1.56315335392438, 'sideways_rsi_os': 39, 'sideways_rsi_ob': 45, 'sideways_adx_thresh': 30.364270049701958, 'sideways_atr_min_pct': 0.014499494003501841, 'sideways_atr_max_pct': 0.0759082101240021, 'sideways_tp_mult': 1.7322454111262724, 'sideways_tsl_mult': 0.8667996612198372, 'sideways_time_stop': 217, 'sideways_use_sma': False, 'sideways_use_ema': True, 'sideways_use_atr': False, 'sideways_use_adx': True, 'sideways_use_spike': False, 'sideways_rsi_required': False}.
[I 2025-09-01 09:17:34,248] Trial 119 finished with values: [-1000000000.0, 1000000000.0] and parameters: {'p_sma': 20, 'p_std': 29, 'p_atr': 17, 'p_adx': 16, 'rsi_period': 54, 'ema1': 20, 'ema2': 13, 'slip_atr_k': 0.18566874035086833, 'slip_spread_k': 0.48700386268157964, 'spread_hl_frac': 0.011216923025822067, 'bb_std_mult': 2.3929888192810926, 'rsi_os': 41, 'rsi_ob': 88, 'vol_spike': 0.19726294630513594, 'adx_thresh': 9.083807392949423, 'atr_min_pct': 0.022396152946742694, 'atr_max_pct': 0.14689694658300195, 'tp_mult': 1.8372295378148669, 'tsl_mult': 0.5392401576391841, 'strategy': 'breakout', 'time_stop': 177, 'use_sma': True, 'use_atr': False, 'use_adx': True, 'use_ema': False, 'use_spike': False, 'rsi_required': False, 'edge_k': 1.6970229981875204, 'edge_cap': 0.13772075019301572, 'bull_strategy': 'mean_reversion', 'bull_bb_std_mult': 0.6542043573773473, 'bull_rsi_os': 16, 'bull_rsi_ob': 55, 'bull_adx_thresh': 12.094167875447342, 'bull_atr_min_pct': 0.028869833532942996, 'bull_atr_max_pct': 0.09317417954792075, 'bull_tp_mult': 2.0150993518948206, 'bull_tsl_mult': 0.22241691167471997, 'bull_time_stop': 102, 'bull_use_sma': True, 'bull_use_ema': False, 'bull_use_atr': False, 'bull_use_adx': False, 'bull_use_spike': False, 'bull_rsi_required': True, 'bear_strategy': 'mean_reversion', 'bear_bb_std_mult': 2.1334201786415354, 'bear_rsi_os': 42, 'bear_rsi_ob': 68, 'bear_adx_thresh': 13.366547412172098, 'bear_atr_min_pct': 0.028067330285885917, 'bear_atr_max_pct': 0.040162347757323386, 'bear_tp_mult': 2.2582388257882244, 'bear_tsl_mult': 0.37118035688620493, 'bear_time_stop': 241, 'bear_use_sma': True, 'bear_use_ema': True, 'bear_use_atr': True, 'bear_use_adx': False, 'bear_use_spike': True, 'bear_rsi_required': False, 'sideways_strategy': 'breakout', 'sideways_bb_std_mult': 1.2457911438210405, 'sideways_rsi_os': 42, 'sideways_rsi_ob': 45, 'sideways_adx_thresh': 30.281958501172923, 'sideways_atr_min_pct': 0.004324328177415546, 'sideways_atr_max_pct': 0.0774591218615409, 'sideways_tp_mult': 1.7273916794346025, 'sideways_tsl_mult': 0.866586397009847, 'sideways_time_stop': 163, 'sideways_use_sma': False, 'sideways_use_ema': True, 'sideways_use_atr': False, 'sideways_use_adx': True, 'sideways_use_spike': False, 'sideways_rsi_required': False}.
[I 2025-09-01 09:17:35,155] Trial 121 finished with values: [-1000000000.0, 1000000000.0] and parameters: {'p_sma': 27, 'p_std': 26, 'p_atr': 15, 'p_adx': 20, 'rsi_period': 40, 'ema1': 17, 'ema2': 24, 'slip_atr_k': 0.13797287142088624, 'slip_spread_k': 0.23000715471466615, 'spread_hl_frac': 0.03991918471117671, 'bb_std_mult': 2.371076849447524, 'rsi_os': 41, 'rsi_ob': 89, 'vol_spike': 0.24033032377055882, 'adx_thresh': 6.295014973661273, 'atr_min_pct': 0.021826369428106562, 'atr_max_pct': 0.14945542460360223, 'tp_mult': 1.8748683323797932, 'tsl_mult': 0.7331085321796516, 'strategy': 'breakout', 'time_stop': 177, 'use_sma': True, 'use_atr': False, 'use_adx': True, 'use_ema': False, 'use_spike': False, 'rsi_required': False, 'edge_k': 1.675600882578122, 'edge_cap': 0.13592895995348314, 'bull_strategy': 'mean_reversion', 'bull_bb_std_mult': 0.6099161065017376, 'bull_rsi_os': 12, 'bull_rsi_ob': 92, 'bull_adx_thresh': 7.1361545034932, 'bull_atr_min_pct': 0.026353253345817146, 'bull_atr_max_pct': 0.08631109757619791, 'bull_tp_mult': 2.019406091490145, 'bull_tsl_mult': 0.2186810494135158, 'bull_time_stop': 85, 'bull_use_sma': True, 'bull_use_ema': False, 'bull_use_atr': False, 'bull_use_adx': False, 'bull_use_spike': False, 'bull_rsi_required': True, 'bear_strategy': 'mean_reversion', 'bear_bb_std_mult': 3.3425091182630533, 'bear_rsi_os': 42, 'bear_rsi_ob': 71, 'bear_adx_thresh': 31.44923934468212, 'bear_atr_min_pct': 0.004301415416458593, 'bear_atr_max_pct': 0.12127912713945382, 'bear_tp_mult': 2.266221949284762, 'bear_tsl_mult': 0.5694509150590372, 'bear_time_stop': 234, 'bear_use_sma': True, 'bear_use_ema': True, 'bear_use_atr': True, 'bear_use_adx': False, 'bear_use_spike': True, 'bear_rsi_required': False, 'sideways_strategy': 'breakout', 'sideways_bb_std_mult': 1.2839033851123802, 'sideways_rsi_os': 42, 'sideways_rsi_ob': 51, 'sideways_adx_thresh': 30.166495255576937, 'sideways_atr_min_pct': 0.025704210179386754, 'sideways_atr_max_pct': 0.0776275094725762, 'sideways_tp_mult': 1.6117999595407826, 'sideways_tsl_mult': 0.9341122882115934, 'sideways_time_stop': 42, 'sideways_use_sma': False, 'sideways_use_ema': True, 'sideways_use_atr': False, 'sideways_use_adx': True, 'sideways_use_spike': False, 'sideways_rsi_required': False}.
[I 2025-09-01 09:17:35,851] Trial 122 finished with values: [-1000000000.0, 1000000000.0] and parameters: {'p_sma': 27, 'p_std': 29, 'p_atr': 24, 'p_adx': 16, 'rsi_period': 79, 'ema1': 21, 'ema2': 14, 'slip_atr_k': 0.01715764627069824, 'slip_spread_k': 0.22421478068532233, 'spread_hl_frac': 0.043474850343320326, 'bb_std_mult': 2.1899372689905947, 'rsi_os': 27, 'rsi_ob': 89, 'vol_spike': 0.240991937642683, 'adx_thresh': 6.3271551727064725, 'atr_min_pct': 0.02200131335969462, 'atr_max_pct': 0.06771555747459512, 'tp_mult': 1.8663460141369186, 'tsl_mult': 0.6157834454640401, 'strategy': 'breakout', 'time_stop': 175, 'use_sma': True, 'use_atr': False, 'use_adx': True, 'use_ema': False, 'use_spike': False, 'rsi_required': False, 'edge_k': 1.6913262349100673, 'edge_cap': 0.23665221238485146, 'bull_strategy': 'mean_reversion', 'bull_bb_std_mult': 0.9822800735298924, 'bull_rsi_os': 12, 'bull_rsi_ob': 95, 'bull_adx_thresh': 6.97693919449516, 'bull_atr_min_pct': 0.026328482133280227, 'bull_atr_max_pct': 0.0858631787090049, 'bull_tp_mult': 2.000677681229482, 'bull_tsl_mult': 0.2449047001758946, 'bull_time_stop': 95, 'bull_use_sma': True, 'bull_use_ema': False, 'bull_use_atr': False, 'bull_use_adx': False, 'bull_use_spike': False, 'bull_rsi_required': True, 'bear_strategy': 'breakout', 'bear_bb_std_mult': 1.8185834218309493, 'bear_rsi_os': 50, 'bear_rsi_ob': 70, 'bear_adx_thresh': 13.269690315426784, 'bear_atr_min_pct': 0.029103705239828956, 'bear_atr_max_pct': 0.10556732623049764, 'bear_tp_mult': 2.0897654704845894, 'bear_tsl_mult': 0.2819787087776701, 'bear_time_stop': 234, 'bear_use_sma': True, 'bear_use_ema': True, 'bear_use_atr': True, 'bear_use_adx': False, 'bear_use_spike': True, 'bear_rsi_required': True, 'sideways_strategy': 'breakout', 'sideways_bb_std_mult': 1.2474666178071825, 'sideways_rsi_os': 42, 'sideways_rsi_ob': 48, 'sideways_adx_thresh': 30.166400620251547, 'sideways_atr_min_pct': 0.006732000933365423, 'sideways_atr_max_pct': 0.13709236709386918, 'sideways_tp_mult': 1.8104534750576788, 'sideways_tsl_mult': 0.9684665194681058, 'sideways_time_stop': 181, 'sideways_use_sma': False, 'sideways_use_ema': True, 'sideways_use_atr': False, 'sideways_use_adx': True, 'sideways_use_spike': False, 'sideways_rsi_required': False}.
[I 2025-09-01 09:18:12,513] Trial 123 finished with values: [-1000000000.0, 1000000000.0] and parameters: {'p_sma': 34, 'p_std': 26, 'p_atr': 15, 'p_adx': 19, 'rsi_period': 63, 'ema1': 21, 'ema2': 11, 'slip_atr_k': 0.1466999343681758, 'slip_spread_k': 0.6017729014699601, 'spread_hl_frac': 0.014773227964906984, 'bb_std_mult': 1.9380893377663746, 'rsi_os': 13, 'rsi_ob': 90, 'vol_spike': 0.23042014591459326, 'adx_thresh': 7.7121048839501745, 'atr_min_pct': 0.019427787889573254, 'atr_max_pct': 0.1402033948859113, 'tp_mult': 1.9837799242555492, 'tsl_mult': 0.0008436678707400211, 'strategy': 'breakout', 'time_stop': 206, 'use_sma': True, 'use_atr': False, 'use_adx': True, 'use_ema': False, 'use_spike': False, 'rsi_required': False, 'edge_k': 0.1530294455445177, 'edge_cap': 0.07776699913965443, 'bull_strategy': 'mean_reversion', 'bull_bb_std_mult': 0.9552302055163081, 'bull_rsi_os': 13, 'bull_rsi_ob': 91, 'bull_adx_thresh': 5.015841339503257, 'bull_atr_min_pct': 0.02626893995985555, 'bull_atr_max_pct': 0.08559128303829461, 'bull_tp_mult': 1.6449062732669524, 'bull_tsl_mult': 0.03483470039275963, 'bull_time_stop': 83, 'bull_use_sma': True, 'bull_use_ema': False, 'bull_use_atr': False, 'bull_use_adx': False, 'bull_use_spike': False, 'bull_rsi_required': True, 'bear_strategy': 'breakout', 'bear_bb_std_mult': 3.4117798902656444, 'bear_rsi_os': 50, 'bear_rsi_ob': 78, 'bear_adx_thresh': 11.242030717075545, 'bear_atr_min_pct': 0.014055112547143719, 'bear_atr_max_pct': 0.12814458605913104, 'bear_tp_mult': 1.2440560275664738, 'bear_tsl_mult': 0.117777355067471, 'bear_time_stop': 200, 'bear_use_sma': False, 'bear_use_ema': True, 'bear_use_atr': True, 'bear_use_adx': False, 'bear_use_spike': False, 'bear_rsi_required': True, 'sideways_strategy': 'breakout', 'sideways_bb_std_mult': 1.3116524084436971, 'sideways_rsi_os': 8, 'sideways_rsi_ob': 48, 'sideways_adx_thresh': 32.704917218763, 'sideways_atr_min_pct': 0.007550753169871041, 'sideways_atr_max_pct': 0.09391435061184297, 'sideways_tp_mult': 1.7948665734646163, 'sideways_tsl_mult': 0.9318486172596983, 'sideways_time_stop': 181, 'sideways_use_sma': False, 'sideways_use_ema': True, 'sideways_use_atr': False, 'sideways_use_adx': False, 'sideways_use_spike': False, 'sideways_rsi_required': False}.
[I 2025-09-01 09:18:13,604] Trial 125 finished with values: [-1000000000.0, 1000000000.0] and parameters: {'p_sma': 34, 'p_std': 7, 'p_atr': 15, 'p_adx': 11, 'rsi_period': 62, 'ema1': 19, 'ema2': 15, 'slip_atr_k': 0.05418386020966519, 'slip_spread_k': 0.37483148420185985, 'spread_hl_frac': 0.04301255127310441, 'bb_std_mult': 1.545833019874923, 'rsi_os': 27, 'rsi_ob': 91, 'vol_spike': 0.21703807222269073, 'adx_thresh': 7.5047541481557465, 'atr_min_pct': 0.0194792633202368, 'atr_max_pct': 0.13126303238740158, 'tp_mult': 1.9844787069010934, 'tsl_mult': 0.03833829541637085, 'strategy': 'breakout', 'time_stop': 206, 'use_sma': True, 'use_atr': True, 'use_adx': True, 'use_ema': False, 'use_spike': False, 'rsi_required': False, 'edge_k': 1.6251707073070325, 'edge_cap': 0.09767598691171303, 'bull_strategy': 'mean_reversion', 'bull_bb_std_mult': 0.9288419757747626, 'bull_rsi_os': 8, 'bull_rsi_ob': 95, 'bull_adx_thresh': 24.658923513513336, 'bull_atr_min_pct': 0.02659759909280201, 'bull_atr_max_pct': 0.06393051921739729, 'bull_tp_mult': 1.6962060747324692, 'bull_tsl_mult': 0.02759860363982325, 'bull_time_stop': 127, 'bull_use_sma': True, 'bull_use_ema': False, 'bull_use_atr': False, 'bull_use_adx': False, 'bull_use_spike': False, 'bull_rsi_required': True, 'bear_strategy': 'breakout', 'bear_bb_std_mult': 3.4213652632402, 'bear_rsi_os': 46, 'bear_rsi_ob': 65, 'bear_adx_thresh': 14.065796694282202, 'bear_atr_min_pct': 0.029435288307779583, 'bear_atr_max_pct': 0.12842553297251144, 'bear_tp_mult': 1.097033883170261, 'bear_tsl_mult': 0.27793706519804473, 'bear_time_stop': 203, 'bear_use_sma': False, 'bear_use_ema': True, 'bear_use_atr': True, 'bear_use_adx': True, 'bear_use_spike': False, 'bear_rsi_required': True, 'sideways_strategy': 'mean_reversion', 'sideways_bb_std_mult': 1.8084038713718704, 'sideways_rsi_os': 8, 'sideways_rsi_ob': 48, 'sideways_adx_thresh': 26.43987357199046, 'sideways_atr_min_pct': 0.006401029150391207, 'sideways_atr_max_pct': 0.12168389722595147, 'sideways_tp_mult': 2.1244991464481657, 'sideways_tsl_mult': 0.9151682820906307, 'sideways_time_stop': 241, 'sideways_use_sma': False, 'sideways_use_ema': True, 'sideways_use_atr': False, 'sideways_use_adx': False, 'sideways_use_spike': False, 'sideways_rsi_required': False}.
[I 2025-09-01 09:18:14,307] Trial 126 finished with values: [-1000000000.0, 1000000000.0] and parameters: {'p_sma': 30, 'p_std': 33, 'p_atr': 15, 'p_adx': 19, 'rsi_period': 62, 'ema1': 19, 'ema2': 11, 'slip_atr_k': 0.04525003810261581, 'slip_spread_k': 0.3658002285657611, 'spread_hl_frac': 0.01323506123930244, 'bb_std_mult': 1.9464041143447386, 'rsi_os': 13, 'rsi_ob': 91, 'vol_spike': 0.2280068707569596, 'adx_thresh': 7.440850334256918, 'atr_min_pct': 0.021189792013015674, 'atr_max_pct': 0.13226383983744566, 'tp_mult': 2.0068764872376867, 'tsl_mult': 0.0553857107825847, 'strategy': 'breakout', 'time_stop': 206, 'use_sma': True, 'use_atr': True, 'use_adx': True, 'use_ema': False, 'use_spike': True, 'rsi_required': True, 'edge_k': 0.1471016907444318, 'edge_cap': 0.0931525856880249, 'bull_strategy': 'mean_reversion', 'bull_bb_std_mult': 0.9184345676422969, 'bull_rsi_os': 19, 'bull_rsi_ob': 53, 'bull_adx_thresh': 10.748473717514049, 'bull_atr_min_pct': 0.025682606757927464, 'bull_atr_max_pct': 0.07262822828174362, 'bull_tp_mult': 2.1424440645154204, 'bull_tsl_mult': 0.020999931999555202, 'bull_time_stop': 117, 'bull_use_sma': True, 'bull_use_ema': False, 'bull_use_atr': False, 'bull_use_adx': True, 'bull_use_spike': False, 'bull_rsi_required': True, 'bear_strategy': 'mean_reversion', 'bear_bb_std_mult': 3.4053350178741693, 'bear_rsi_os': 47, 'bear_rsi_ob': 65, 'bear_adx_thresh': 11.139275181497299, 'bear_atr_min_pct': 0.014293287072834227, 'bear_atr_max_pct': 0.12858782090464022, 'bear_tp_mult': 1.0673903801234221, 'bear_tsl_mult': 0.10996618282069964, 'bear_time_stop': 202, 'bear_use_sma': False, 'bear_use_ema': True, 'bear_use_atr': True, 'bear_use_adx': True, 'bear_use_spike': False, 'bear_rsi_required': True, 'sideways_strategy': 'mean_reversion', 'sideways_bb_std_mult': 1.518838727756735, 'sideways_rsi_os': 10, 'sideways_rsi_ob': 47, 'sideways_adx_thresh': 32.70328098523895, 'sideways_atr_min_pct': 0.00586694314975328, 'sideways_atr_max_pct': 0.0935081822230161, 'sideways_tp_mult': 1.8742725911172453, 'sideways_tsl_mult': 0.9111728277739117, 'sideways_time_stop': 226, 'sideways_use_sma': False, 'sideways_use_ema': True, 'sideways_use_atr': False, 'sideways_use_adx': False, 'sideways_use_spike': False, 'sideways_rsi_required': False}.
