[I 2025-09-01 09:42:13,346] Trial 273 finished with values: [-1000000000.0, 1000000000.0] and parameters: {'p_sma': 20, 'p_std': 28, 'p_atr': 22, 'p_adx': 27, 'rsi_period': 38, 'ema1': 19, 'ema2': 20, 'slip_atr_k': 0.20464114457838317, 'slip_spread_k': 0.9847905874616796, 'spread_hl_frac': 0.02769078599346378, 'bb_std_mult': 2.9058063427019936, 'rsi_os': 13, 'rsi_ob': 60, 'vol_spike': 0.0010283173348406005, 'adx_thresh': 5.035965478487644, 'atr_min_pct': 0.018658498701868975, 'atr_max_pct': 0.1354013154796802, 'tp_mult': 2.960280274384356, 'tsl_mult': 0.7478238332181137, 'strategy': 'breakout', 'time_stop': 219, 'use_sma': False, 'use_atr': False, 'use_adx': True, 'use_ema': False, 'use_spike': True, 'rsi_required': False, 'edge_k': 0.004322533641390236, 'edge_cap': 0.10710891672210404, 'bull_strategy': 'breakout', 'bull_bb_std_mult': 0.6752714269751047, 'bull_rsi_os': 18, 'bull_rsi_ob': 59, 'bull_adx_thresh': 6.108845858847641, 'bull_atr_min_pct': 0.025045144906777884, 'bull_atr_max_pct': 0.010168812222459161, 'bull_tp_mult': 2.844499250340633, 'bull_tsl_mult': 0.07058841427021956, 'bull_time_stop': 118, 'bull_use_sma': True, 'bull_use_ema': True, 'bull_use_atr': False, 'bull_use_adx': False, 'bull_use_spike': True, 'bull_rsi_required': False, 'bear_strategy': 'mean_reversion', 'bear_bb_std_mult': 3.432503096563536, 'bear_rsi_os': 23, 'bear_rsi_ob': 68, 'bear_adx_thresh': 20.493702228369262, 'bear_atr_min_pct': 0.021196798476740948, 'bear_atr_max_pct': 0.1201440085834718, 'bear_tp_mult': 2.159577712358352, 'bear_tsl_mult': 0.433937695968399, 'bear_time_stop': 179, 'bear_use_sma': False, 'bear_use_ema': True, 'bear_use_atr': True, 'bear_use_adx': True, 'bear_use_spike': True, 'bear_rsi_required': False, 'sideways_strategy': 'breakout', 'sideways_bb_std_mult': 1.107109782976854, 'sideways_rsi_os': 42, 'sideways_rsi_ob': 45, 'sideways_adx_thresh': 29.56328751410017, 'sideways_atr_min_pct': 0.004259293466716357, 'sideways_atr_max_pct': 0.10553071357066582, 'sideways_tp_mult': 2.268784229049028, 'sideways_tsl_mult': 0.9997745921284686, 'sideways_time_stop': 28, 'sideways_use_sma': True, 'sideways_use_ema': False, 'sideways_use_atr': True, 'sideways_use_adx': False, 'sideways_use_spike': False, 'sideways_rsi_required': False}.
[I 2025-09-01 09:42:13,712] Trial 271 finished with values: [-1000000000.0, 1000000000.0] and parameters: {'p_sma': 20, 'p_std': 49, 'p_atr': 17, 'p_adx': 13, 'rsi_period': 38, 'ema1': 20, 'ema2': 12, 'slip_atr_k': 0.017008016197223613, 'slip_spread_k': 0.25439392814742434, 'spread_hl_frac': 0.04675157075953155, 'bb_std_mult': 0.778933733241356, 'rsi_os': 13, 'rsi_ob': 88, 'vol_spike': 0.21499921730151614, 'adx_thresh': 17.851189314546165, 'atr_min_pct': 0.020683866848741406, 'atr_max_pct': 0.13429853251046694, 'tp_mult': 1.8217155980488822, 'tsl_mult': 0.867934338477701, 'strategy': 'breakout', 'time_stop': 205, 'use_sma': True, 'use_atr': False, 'use_adx': True, 'use_ema': False, 'use_spike': False, 'rsi_required': False, 'edge_k': 0.7666924259504009, 'edge_cap': 0.10607493362028324, 'bull_strategy': 'mean_reversion', 'bull_bb_std_mult': 2.7594197427217493, 'bull_rsi_os': 17, 'bull_rsi_ob': 59, 'bull_adx_thresh': 6.1216320090070075, 'bull_atr_min_pct': 0.02755295685373902, 'bull_atr_max_pct': 0.010154001197651738, 'bull_tp_mult': 2.835542412250864, 'bull_tsl_mult': 0.0756987808725042, 'bull_time_stop': 149, 'bull_use_sma': True, 'bull_use_ema': False, 'bull_use_atr': False, 'bull_use_adx': False, 'bull_use_spike': False, 'bull_rsi_required': True, 'bear_strategy': 'mean_reversion', 'bear_bb_std_mult': 2.0160268708249234, 'bear_rsi_os': 42, 'bear_rsi_ob': 67, 'bear_adx_thresh': 8.321453913462523, 'bear_atr_min_pct': 0.003117282817737821, 'bear_atr_max_pct': 0.12031237625595301, 'bear_tp_mult': 2.543233034574265, 'bear_tsl_mult': 0.8268540249220924, 'bear_time_stop': 180, 'bear_use_sma': False, 'bear_use_ema': True, 'bear_use_atr': True, 'bear_use_adx': False, 'bear_use_spike': True, 'bear_rsi_required': False, 'sideways_strategy': 'breakout', 'sideways_bb_std_mult': 1.138158560755653, 'sideways_rsi_os': 33, 'sideways_rsi_ob': 45, 'sideways_adx_thresh': 28.74891021830116, 'sideways_atr_min_pct': 0.004378524944090213, 'sideways_atr_max_pct': 0.06593687786933956, 'sideways_tp_mult': 1.3313679337508109, 'sideways_tsl_mult': 0.9990726903255662, 'sideways_time_stop': 221, 'sideways_use_sma': False, 'sideways_use_ema': True, 'sideways_use_atr': False, 'sideways_use_adx': False, 'sideways_use_spike': False, 'sideways_rsi_required': False}.
[I 2025-09-01 09:42:14,071] Trial 272 finished with values: [-1000000000.0, 1000000000.0] and parameters: {'p_sma': 43, 'p_std': 51, 'p_atr': 18, 'p_adx': 25, 'rsi_period': 65, 'ema1': 18, 'ema2': 11, 'slip_atr_k': 0.05313750047194525, 'slip_spread_k': 0.38763447054022354, 'spread_hl_frac': 0.041276514759005206, 'bb_std_mult': 2.9156511710114654, 'rsi_os': 26, 'rsi_ob': 60, 'vol_spike': 0.21669927018097238, 'adx_thresh': 15.625839106934365, 'atr_min_pct': 0.01071131215876263, 'atr_max_pct': 0.1374293838574298, 'tp_mult': 2.635877675674873, 'tsl_mult': 0.3180274162594202, 'strategy': 'breakout', 'time_stop': 136, 'use_sma': True, 'use_atr': False, 'use_adx': True, 'use_ema': False, 'use_spike': False, 'rsi_required': False, 'edge_k': 0.059387578324339274, 'edge_cap': 0.1153206446126028, 'bull_strategy': 'breakout', 'bull_bb_std_mult': 0.8600227450474655, 'bull_rsi_os': 17, 'bull_rsi_ob': 59, 'bull_adx_thresh': 6.176805520734621, 'bull_atr_min_pct': 0.02826100530107405, 'bull_atr_max_pct': 0.06177531104923017, 'bull_tp_mult': 2.1642708103363955, 'bull_tsl_mult': 0.5410793436139838, 'bull_time_stop': 117, 'bull_use_sma': True, 'bull_use_ema': True, 'bull_use_atr': False, 'bull_use_adx': False, 'bull_use_spike': False, 'bull_rsi_required': True, 'bear_strategy': 'mean_reversion', 'bear_bb_std_mult': 2.7843531697000206, 'bear_rsi_os': 47, 'bear_rsi_ob': 68, 'bear_adx_thresh': 12.40826277067958, 'bear_atr_min_pct': 0.014931867423096006, 'bear_atr_max_pct': 0.12031754000433877, 'bear_tp_mult': 1.6799803839047927, 'bear_tsl_mult': 0.4650775174785785, 'bear_time_stop': 215, 'bear_use_sma': False, 'bear_use_ema': True, 'bear_use_atr': True, 'bear_use_adx': False, 'bear_use_spike': True, 'bear_rsi_required': False, 'sideways_strategy': 'breakout', 'sideways_bb_std_mult': 1.1214958982995797, 'sideways_rsi_os': 33, 'sideways_rsi_ob': 45, 'sideways_adx_thresh': 28.840545198250545, 'sideways_atr_min_pct': 0.004265514538780716, 'sideways_atr_max_pct': 0.06813082849751184, 'sideways_tp_mult': 2.6303682579824303, 'sideways_tsl_mult': 0.18159842725161024, 'sideways_time_stop': 25, 'sideways_use_sma': False, 'sideways_use_ema': True, 'sideways_use_atr': False, 'sideways_use_adx': False, 'sideways_use_spike': False, 'sideways_rsi_required': False}.
[I 2025-09-01 09:42:14,459] Trial 270 finished with values: [-0.03449847487892366, 0.035048565297340156] and parameters: {'p_sma': 9, 'p_std': 47, 'p_atr': 15, 'p_adx': 15, 'rsi_period': 12, 'ema1': 23, 'ema2': 48, 'slip_atr_k': 0.03233228276391884, 'slip_spread_k': 0.26167498167319253, 'spread_hl_frac': 0.003993658829408608, 'bb_std_mult': 3.2061984404582686, 'rsi_os': 13, 'rsi_ob': 60, 'vol_spike': 0.027782456070418418, 'adx_thresh': 17.866076487056176, 'atr_min_pct': 0.021127439407022674, 'atr_max_pct': 0.134832290822972, 'tp_mult': 2.6509046494749517, 'tsl_mult': 0.7519489816587805, 'strategy': 'breakout', 'time_stop': 218, 'use_sma': True, 'use_atr': False, 'use_adx': True, 'use_ema': False, 'use_spike': False, 'rsi_required': False, 'edge_k': 1.5228245798126179, 'edge_cap': 0.9459382435606962, 'bull_strategy': 'mean_reversion', 'bull_bb_std_mult': 0.5031551870748004, 'bull_rsi_os': 17, 'bull_rsi_ob': 71, 'bull_adx_thresh': 6.037750664438442, 'bull_atr_min_pct': 0.00015601590049373927, 'bull_atr_max_pct': 0.12744717286457447, 'bull_tp_mult': 1.8890458456700359, 'bull_tsl_mult': 0.9487115097907014, 'bull_time_stop': 148, 'bull_use_sma': True, 'bull_use_ema': False, 'bull_use_atr': False, 'bull_use_adx': False, 'bull_use_spike': False, 'bull_rsi_required': True, 'bear_strategy': 'mean_reversion', 'bear_bb_std_mult': 2.801448649789249, 'bear_rsi_os': 40, 'bear_rsi_ob': 67, 'bear_adx_thresh': 12.525200452700416, 'bear_atr_min_pct': 0.014870802636080337, 'bear_atr_max_pct': 0.011288346378968722, 'bear_tp_mult': 2.5661522628104914, 'bear_tsl_mult': 0.41183562411784286, 'bear_time_stop': 117, 'bear_use_sma': False, 'bear_use_ema': True, 'bear_use_atr': True, 'bear_use_adx': False, 'bear_use_spike': True, 'bear_rsi_required': False, 'sideways_strategy': 'breakout', 'sideways_bb_std_mult': 3.1985178034719572, 'sideways_rsi_os': 41, 'sideways_rsi_ob': 45, 'sideways_adx_thresh': 28.968288710941444, 'sideways_atr_min_pct': 0.004724449214148104, 'sideways_atr_max_pct': 0.13548443415382572, 'sideways_tp_mult': 1.6397745823784617, 'sideways_tsl_mult': 0.8598589190005375, 'sideways_time_stop': 221, 'sideways_use_sma': True, 'sideways_use_ema': True, 'sideways_use_atr': True, 'sideways_use_adx': False, 'sideways_use_spike': False, 'sideways_rsi_required': False}.
[I 2025-09-01 09:42:15,240] Trial 277 finished with values: [-1000000000.0, 1000000000.0] and parameters: {'p_sma': 32, 'p_std': 46, 'p_atr': 14, 'p_adx': 19, 'rsi_period': 67, 'ema1': 6, 'ema2': 18, 'slip_atr_k': 0.04421970728238082, 'slip_spread_k': 0.8934444733408751, 'spread_hl_frac': 1.7942200304734562e-05, 'bb_std_mult': 2.0486541065036787, 'rsi_os': 23, 'rsi_ob': 53, 'vol_spike': 0.2251989654851575, 'adx_thresh': 21.266905234286433, 'atr_min_pct': 0.024268756027890574, 'atr_max_pct': 0.01771453914498665, 'tp_mult': 1.8763058530092234, 'tsl_mult': 0.056087073442573854, 'strategy': 'mean_reversion', 'time_stop': 211, 'use_sma': True, 'use_atr': False, 'use_adx': True, 'use_ema': False, 'use_spike': True, 'rsi_required': False, 'edge_k': 1.3625005163776642, 'edge_cap': 0.19409560585402763, 'bull_strategy': 'mean_reversion', 'bull_bb_std_mult': 0.7384428842504918, 'bull_rsi_os': 19, 'bull_rsi_ob': 69, 'bull_adx_thresh': 7.083343137598666, 'bull_atr_min_pct': 0.029023532058243137, 'bull_atr_max_pct': 0.06835646201461448, 'bull_tp_mult': 2.4675871355029515, 'bull_tsl_mult': 0.11677041571605545, 'bull_time_stop': 49, 'bull_use_sma': True, 'bull_use_ema': False, 'bull_use_atr': False, 'bull_use_adx': True, 'bull_use_spike': True, 'bull_rsi_required': False, 'bear_strategy': 'mean_reversion', 'bear_bb_std_mult': 0.9642388261105179, 'bear_rsi_os': 49, 'bear_rsi_ob': 65, 'bear_adx_thresh': 24.848281579513326, 'bear_atr_min_pct': 0.017173635933304038, 'bear_atr_max_pct': 0.06265376721787706, 'bear_tp_mult': 1.2838779581950677, 'bear_tsl_mult': 0.43772143290293447, 'bear_time_stop': 115, 'bear_use_sma': False, 'bear_use_ema': True, 'bear_use_atr': True, 'bear_use_adx': True, 'bear_use_spike': False, 'bear_rsi_required': False, 'sideways_strategy': 'mean_reversion', 'sideways_bb_std_mult': 0.96133483727223, 'sideways_rsi_os': 50, 'sideways_rsi_ob': 47, 'sideways_adx_thresh': 24.149066971641723, 'sideways_atr_min_pct': 0.003313335283552447, 'sideways_atr_max_pct': 0.0714959045915021, 'sideways_tp_mult': 1.6758394208860115, 'sideways_tsl_mult': 0.918443061790095, 'sideways_time_stop': 210, 'sideways_use_sma': True, 'sideways_use_ema': True, 'sideways_use_atr': True, 'sideways_use_adx': False, 'sideways_use_spike': False, 'sideways_rsi_required': False}.
[I 2025-09-01 09:42:52,164] Trial 275 finished with values: [-1000000000.0, 1000000000.0] and parameters: {'p_sma': 37, 'p_std': 51, 'p_atr': 15, 'p_adx': 14, 'rsi_period': 65, 'ema1': 18, 'ema2': 40, 'slip_atr_k': 0.043537359016947184, 'slip_spread_k': 0.21782571172502851, 'spread_hl_frac': 0.028973323616539187, 'bb_std_mult': 1.669347835557773, 'rsi_os': 39, 'rsi_ob': 87, 'vol_spike': 0.22290759658652487, 'adx_thresh': 20.996298688829324, 'atr_min_pct': 0.019840957499581174, 'atr_max_pct': 0.13775915019947574, 'tp_mult': 1.8662642483085565, 'tsl_mult': 0.05691484860723372, 'strategy': 'breakout', 'time_stop': 58, 'use_sma': True, 'use_atr': False, 'use_adx': True, 'use_ema': False, 'use_spike': False, 'rsi_required': False, 'edge_k': 1.5392000388791263, 'edge_cap': 0.5659031936665878, 'bull_strategy': 'mean_reversion', 'bull_bb_std_mult': 0.8679831279497601, 'bull_rsi_os': 19, 'bull_rsi_ob': 56, 'bull_adx_thresh': 18.486719068555928, 'bull_atr_min_pct': 0.007512124912842758, 'bull_atr_max_pct': 0.09575772524600407, 'bull_tp_mult': 2.053794363161132, 'bull_tsl_mult': 0.5472266809991866, 'bull_time_stop': 125, 'bull_use_sma': True, 'bull_use_ema': False, 'bull_use_atr': True, 'bull_use_adx': True, 'bull_use_spike': False, 'bull_rsi_required': True, 'bear_strategy': 'mean_reversion', 'bear_bb_std_mult': 2.1705384080653136, 'bear_rsi_os': 47, 'bear_rsi_ob': 65, 'bear_adx_thresh': 24.844490975347174, 'bear_atr_min_pct': 0.018454100117242238, 'bear_atr_max_pct': 0.1185945171222123, 'bear_tp_mult': 2.2201232250173004, 'bear_tsl_mult': 0.33583668717147186, 'bear_time_stop': 215, 'bear_use_sma': False, 'bear_use_ema': True, 'bear_use_atr': True, 'bear_use_adx': False, 'bear_use_spike': False, 'bear_rsi_required': False, 'sideways_strategy': 'mean_reversion', 'sideways_bb_std_mult': 3.2869909863634854, 'sideways_rsi_os': 49, 'sideways_rsi_ob': 87, 'sideways_adx_thresh': 29.624538561494465, 'sideways_atr_min_pct': 0.0035678830153756105, 'sideways_atr_max_pct': 0.06940432424782632, 'sideways_tp_mult': 2.8315235428671754, 'sideways_tsl_mult': 0.9246322881097161, 'sideways_time_stop': 182, 'sideways_use_sma': False, 'sideways_use_ema': True, 'sideways_use_atr': False, 'sideways_use_adx': False, 'sideways_use_spike': False, 'sideways_rsi_required': False}.
[I 2025-09-01 09:42:52,469] Trial 274 finished with values: [-0.01160021080567164, 0.012806286204304894] and parameters: {'p_sma': 22, 'p_std': 41, 'p_atr': 30, 'p_adx': 21, 'rsi_period': 65, 'ema1': 20, 'ema2': 40, 'slip_atr_k': 0.0511991013313209, 'slip_spread_k': 0.19892426038726058, 'spread_hl_frac': 0.02896078184451908, 'bb_std_mult': 3.315562181580825, 'rsi_os': 22, 'rsi_ob': 76, 'vol_spike': 0.2925585413529185, 'adx_thresh': 6.966091713424628, 'atr_min_pct': 0.02412670877535883, 'atr_max_pct': 0.1344898573926594, 'tp_mult': 2.6338997850898433, 'tsl_mult': 0.0005675343848322682, 'strategy': 'breakout', 'time_stop': 163, 'use_sma': True, 'use_atr': False, 'use_adx': True, 'use_ema': False, 'use_spike': False, 'rsi_required': False, 'edge_k': 0.9767741395193825, 'edge_cap': 0.5623482726307165, 'bull_strategy': 'mean_reversion', 'bull_bb_std_mult': 0.8653460005173206, 'bull_rsi_os': 17, 'bull_rsi_ob': 58, 'bull_adx_thresh': 7.200575777266712, 'bull_atr_min_pct': 0.028337641901469365, 'bull_atr_max_pct': 0.088657435757029, 'bull_tp_mult': 1.876521492522279, 'bull_tsl_mult': 0.07669530421314767, 'bull_time_stop': 149, 'bull_use_sma': True, 'bull_use_ema': False, 'bull_use_atr': True, 'bull_use_adx': True, 'bull_use_spike': False, 'bull_rsi_required': True, 'bear_strategy': 'mean_reversion', 'bear_bb_std_mult': 3.5998483442651126, 'bear_rsi_os': 49, 'bear_rsi_ob': 48, 'bear_adx_thresh': 13.296207505606198, 'bear_atr_min_pct': 0.01526567034554156, 'bear_atr_max_pct': 0.06272506763849628, 'bear_tp_mult': 1.289562373519801, 'bear_tsl_mult': 0.39421404441739805, 'bear_time_stop': 144, 'bear_use_sma': False, 'bear_use_ema': True, 'bear_use_atr': True, 'bear_use_adx': False, 'bear_use_spike': True, 'bear_rsi_required': False, 'sideways_strategy': 'breakout', 'sideways_bb_std_mult': 3.2445632870749255, 'sideways_rsi_os': 49, 'sideways_rsi_ob': 47, 'sideways_adx_thresh': 28.778991020397058, 'sideways_atr_min_pct': 0.003308524929401491, 'sideways_atr_max_pct': 0.06637095544356271, 'sideways_tp_mult': 1.3193531034731518, 'sideways_tsl_mult': 0.9184318216274223, 'sideways_time_stop': 185, 'sideways_use_sma': False, 'sideways_use_ema': True, 'sideways_use_atr': False, 'sideways_use_adx': False, 'sideways_use_spike': False, 'sideways_rsi_required': False}.
[I 2025-09-01 09:42:52,698] Trial 276 finished with values: [-1000000000.0, 1000000000.0] and parameters: {'p_sma': 9, 'p_std': 15, 'p_atr': 15, 'p_adx': 14, 'rsi_period': 20, 'ema1': 23, 'ema2': 18, 'slip_atr_k': 0.04389678380378574, 'slip_spread_k': 0.48365249164810814, 'spread_hl_frac': 0.003769494065553193, 'bb_std_mult': 2.039178648426855, 'rsi_os': 11, 'rsi_ob': 76, 'vol_spike': 0.0516184418070149, 'adx_thresh': 6.963286182748596, 'atr_min_pct': 0.0175968573296422, 'atr_max_pct': 0.1109379464884785, 'tp_mult': 1.8805667660872187, 'tsl_mult': 0.6967560136359413, 'strategy': 'mean_reversion', 'time_stop': 206, 'use_sma': True, 'use_atr': False, 'use_adx': True, 'use_ema': False, 'use_spike': False, 'rsi_required': True, 'edge_k': 1.1460132896778836, 'edge_cap': 0.06643814557379232, 'bull_strategy': 'mean_reversion', 'bull_bb_std_mult': 0.5111401561310839, 'bull_rsi_os': 6, 'bull_rsi_ob': 77, 'bull_adx_thresh': 24.091531128588418, 'bull_atr_min_pct': 0.01089095101665287, 'bull_atr_max_pct': 0.02331437493697313, 'bull_tp_mult': 2.480741294306683, 'bull_tsl_mult': 0.788364747333899, 'bull_time_stop': 136, 'bull_use_sma': True, 'bull_use_ema': False, 'bull_use_atr': True, 'bull_use_adx': True, 'bull_use_spike': True, 'bull_rsi_required': True, 'bear_strategy': 'mean_reversion', 'bear_bb_std_mult': 2.239467750309763, 'bear_rsi_os': 49, 'bear_rsi_ob': 65, 'bear_adx_thresh': 13.37414093587786, 'bear_atr_min_pct': 0.018347816518361357, 'bear_atr_max_pct': 0.11718405759829237, 'bear_tp_mult': 2.2249288024604197, 'bear_tsl_mult': 0.39205092414216836, 'bear_time_stop': 148, 'bear_use_sma': False, 'bear_use_ema': True, 'bear_use_atr': True, 'bear_use_adx': False, 'bear_use_spike': False, 'bear_rsi_required': True, 'sideways_strategy': 'mean_reversion', 'sideways_bb_std_mult': 3.261485445508927, 'sideways_rsi_os': 49, 'sideways_rsi_ob': 53, 'sideways_adx_thresh': 29.74138779038377, 'sideways_atr_min_pct': 0.018272101825456473, 'sideways_atr_max_pct': 0.1318321819783756, 'sideways_tp_mult': 2.4877230412989806, 'sideways_tsl_mult': 0.4689202523692513, 'sideways_time_stop': 178, 'sideways_use_sma': False, 'sideways_use_ema': True, 'sideways_use_atr': False, 'sideways_use_adx': False, 'sideways_use_spike': False, 'sideways_rsi_required': False}.
[I 2025-09-01 09:42:52,937] Trial 278 finished with values: [-1000000000.0, 1000000000.0] and parameters: {'p_sma': 25, 'p_std': 16, 'p_atr': 19, 'p_adx': 14, 'rsi_period': 54, 'ema1': 12, 'ema2': 45, 'slip_atr_k': 0.2287272392973279, 'slip_spread_k': 0.21812616344095825, 'spread_hl_frac': 0.014293544563645361, 'bb_std_mult': 0.6953248736547288, 'rsi_os': 39, 'rsi_ob': 87, 'vol_spike': 0.04955277141417398, 'adx_thresh': 31.948696369460677, 'atr_min_pct': 0.022255932875992868, 'atr_max_pct': 0.1381924104107208, 'tp_mult': 1.3472650634708745, 'tsl_mult': 0.693134569828679, 'strategy': 'breakout', 'time_stop': 165, 'use_sma': True, 'use_atr': False, 'use_adx': True, 'use_ema': False, 'use_spike': False, 'rsi_required': False, 'edge_k': 0.3771784760223321, 'edge_cap': 0.6947660678444475, 'bull_strategy': 'mean_reversion', 'bull_bb_std_mult': 0.6583978620854027, 'bull_rsi_os': 34, 'bull_rsi_ob': 56, 'bull_adx_thresh': 18.211994573834104, 'bull_atr_min_pct': 0.029247803730046894, 'bull_atr_max_pct': 0.0884114138427955, 'bull_tp_mult': 2.0314851287506106, 'bull_tsl_mult': 0.2251977864336147, 'bull_time_stop': 135, 'bull_use_sma': True, 'bull_use_ema': False, 'bull_use_atr': True, 'bull_use_adx': True, 'bull_use_spike': False, 'bull_rsi_required': True, 'bear_strategy': 'mean_reversion', 'bear_bb_std_mult': 3.5975489840223838, 'bear_rsi_os': 5, 'bear_rsi_ob': 66, 'bear_adx_thresh': 13.292575881070697, 'bear_atr_min_pct': 0.015406181299581528, 'bear_atr_max_pct': 0.012141571111834226, 'bear_tp_mult': 2.2282124487971253, 'bear_tsl_mult': 0.9421006207822709, 'bear_time_stop': 50, 'bear_use_sma': False, 'bear_use_ema': True, 'bear_use_atr': True, 'bear_use_adx': False, 'bear_use_spike': False, 'bear_rsi_required': False, 'sideways_strategy': 'breakout', 'sideways_bb_std_mult': 1.2047540921257203, 'sideways_rsi_os': 43, 'sideways_rsi_ob': 53, 'sideways_adx_thresh': 29.47371722202102, 'sideways_atr_min_pct': 0.02837531406422484, 'sideways_atr_max_pct': 0.06294880627862325, 'sideways_tp_mult': 1.5872392411144411, 'sideways_tsl_mult': 0.2845000401027151, 'sideways_time_stop': 215, 'sideways_use_sma': False, 'sideways_use_ema': True, 'sideways_use_atr': False, 'sideways_use_adx': False, 'sideways_use_spike': False, 'sideways_rsi_required': False}.
