[I 2025-09-01 10:11:40,626] Trial 441 finished with values: [-1000000000.0, 1000000000.0] and parameters: {'p_sma': 22, 'p_std': 42, 'p_atr': 29, 'p_adx': 22, 'rsi_period': 81, 'ema1': 21, 'ema2': 46, 'slip_atr_k': 0.043474103805763616, 'slip_spread_k': 0.14226746267023488, 'spread_hl_frac': 0.024845039957491887, 'bb_std_mult': 3.1783282587393904, 'rsi_os': 32, 'rsi_ob': 68, 'vol_spike': 0.28441862590051603, 'adx_thresh': 19.085530645817407, 'atr_min_pct': 0.002107394893298406, 'atr_max_pct': 0.07801012953072353, 'tp_mult': 2.708226689763704, 'tsl_mult': 0.5781563517067518, 'strategy': 'breakout', 'time_stop': 230, 'use_sma': False, 'use_atr': False, 'use_adx': True, 'use_ema': True, 'use_spike': False, 'rsi_required': False, 'edge_k': 0.9543846827691438, 'edge_cap': 0.5712690952061443, 'bull_strategy': 'breakout', 'bull_bb_std_mult': 0.8040374315719288, 'bull_rsi_os': 18, 'bull_rsi_ob': 52, 'bull_adx_thresh': 5.602044202623843, 'bull_atr_min_pct': 0.029338703133764674, 'bull_atr_max_pct': 0.07902730748555248, 'bull_tp_mult': 1.9296899489656336, 'bull_tsl_mult': 0.7400059271950311, 'bull_time_stop': 168, 'bull_use_sma': True, 'bull_use_ema': True, 'bull_use_atr': True, 'bull_use_adx': True, 'bull_use_spike': True, 'bull_rsi_required': False, 'bear_strategy': 'breakout', 'bear_bb_std_mult': 3.4154556781317114, 'bear_rsi_os': 24, 'bear_rsi_ob': 80, 'bear_adx_thresh': 12.577647280986403, 'bear_atr_min_pct': 0.016698352614289425, 'bear_atr_max_pct': 0.08656785284841635, 'bear_tp_mult': 1.3348436965407673, 'bear_tsl_mult': 0.44037565295766695, 'bear_time_stop': 159, 'bear_use_sma': False, 'bear_use_ema': False, 'bear_use_atr': True, 'bear_use_adx': True, 'bear_use_spike': True, 'bear_rsi_required': False, 'sideways_strategy': 'breakout', 'sideways_bb_std_mult': 3.3738271171040837, 'sideways_rsi_os': 29, 'sideways_rsi_ob': 48, 'sideways_adx_thresh': 26.72228596395652, 'sideways_atr_min_pct': 0.008256112497473366, 'sideways_atr_max_pct': 0.06790431867434639, 'sideways_tp_mult': 1.3272546320432033, 'sideways_tsl_mult': 0.8470622820486787, 'sideways_time_stop': 131, 'sideways_use_sma': True, 'sideways_use_ema': False, 'sideways_use_atr': False, 'sideways_use_adx': False, 'sideways_use_spike': False, 'sideways_rsi_required': False}.
[I 2025-09-01 10:11:41,536] Trial 442 finished with values: [-1000000000.0, 1000000000.0] and parameters: {'p_sma': 22, 'p_std': 42, 'p_atr': 29, 'p_adx': 22, 'rsi_period': 28, 'ema1': 21, 'ema2': 22, 'slip_atr_k': 0.0963036190625448, 'slip_spread_k': 0.18495185894296412, 'spread_hl_frac': 0.017046840734888234, 'bb_std_mult': 3.1878933103966807, 'rsi_os': 41, 'rsi_ob': 68, 'vol_spike': 0.26384244565691606, 'adx_thresh': 5.086746133543002, 'atr_min_pct': 0.0015941073555659855, 'atr_max_pct': 0.09229266732774394, 'tp_mult': 2.7019428417010123, 'tsl_mult': 0.07048287870805706, 'strategy': 'breakout', 'time_stop': 48, 'use_sma': False, 'use_atr': False, 'use_adx': True, 'use_ema': True, 'use_spike': False, 'rsi_required': False, 'edge_k': 0.9522521980608767, 'edge_cap': 0.9285581830977636, 'bull_strategy': 'breakout', 'bull_bb_std_mult': 3.4672415648147745, 'bull_rsi_os': 18, 'bull_rsi_ob': 53, 'bull_adx_thresh': 22.48907365800825, 'bull_atr_min_pct': 0.02944044962216625, 'bull_atr_max_pct': 0.07863983232255022, 'bull_tp_mult': 1.9231799559857634, 'bull_tsl_mult': 0.20933864093242344, 'bull_time_stop': 162, 'bull_use_sma': True, 'bull_use_ema': True, 'bull_use_atr': True, 'bull_use_adx': True, 'bull_use_spike': True, 'bull_rsi_required': False, 'bear_strategy': 'breakout', 'bear_bb_std_mult': 3.411015993033669, 'bear_rsi_os': 46, 'bear_rsi_ob': 83, 'bear_adx_thresh': 9.112700287726664, 'bear_atr_min_pct': 0.01638952716222622, 'bear_atr_max_pct': 0.07242618508273976, 'bear_tp_mult': 1.2348792689465882, 'bear_tsl_mult': 0.4323831435115373, 'bear_time_stop': 155, 'bear_use_sma': False, 'bear_use_ema': False, 'bear_use_atr': True, 'bear_use_adx': True, 'bear_use_spike': True, 'bear_rsi_required': False, 'sideways_strategy': 'breakout', 'sideways_bb_std_mult': 2.271112572303851, 'sideways_rsi_os': 29, 'sideways_rsi_ob': 48, 'sideways_adx_thresh': 26.126377167650315, 'sideways_atr_min_pct': 0.029429689664691325, 'sideways_atr_max_pct': 0.03155047948735649, 'sideways_tp_mult': 1.3375590391293912, 'sideways_tsl_mult': 0.8539921923449478, 'sideways_time_stop': 266, 'sideways_use_sma': True, 'sideways_use_ema': False, 'sideways_use_atr': False, 'sideways_use_adx': False, 'sideways_use_spike': False, 'sideways_rsi_required': False}.
[I 2025-09-01 10:11:41,596] Trial 443 finished with values: [-0.15936422060158417, 0.1591517638064374] and parameters: {'p_sma': 32, 'p_std': 44, 'p_atr': 29, 'p_adx': 19, 'rsi_period': 63, 'ema1': 21, 'ema2': 54, 'slip_atr_k': 0.043061402034611194, 'slip_spread_k': 0.13839593039855547, 'spread_hl_frac': 0.024624066185563703, 'bb_std_mult': 3.161552950132533, 'rsi_os': 18, 'rsi_ob': 78, 'vol_spike': 0.28564337478922514, 'adx_thresh': 32.74667716085328, 'atr_min_pct': 0.024116479396869454, 'atr_max_pct': 0.08668445455047229, 'tp_mult': 2.696765657363664, 'tsl_mult': 0.07823611456415067, 'strategy': 'breakout', 'time_stop': 118, 'use_sma': True, 'use_atr': False, 'use_adx': True, 'use_ema': False, 'use_spike': False, 'rsi_required': False, 'edge_k': 0.8271722789841577, 'edge_cap': 0.39955394732810634, 'bull_strategy': 'mean_reversion', 'bull_bb_std_mult': 3.4371700698737593, 'bull_rsi_os': 18, 'bull_rsi_ob': 52, 'bull_adx_thresh': 11.598321803744996, 'bull_atr_min_pct': 0.029441424416746447, 'bull_atr_max_pct': 0.0882906346219061, 'bull_tp_mult': 1.9998006019157586, 'bull_tsl_mult': 0.989163537221628, 'bull_time_stop': 161, 'bull_use_sma': True, 'bull_use_ema': True, 'bull_use_atr': True, 'bull_use_adx': True, 'bull_use_spike': False, 'bull_rsi_required': True, 'bear_strategy': 'mean_reversion', 'bear_bb_std_mult': 3.412323087815914, 'bear_rsi_os': 24, 'bear_rsi_ob': 80, 'bear_adx_thresh': 9.265915976259837, 'bear_atr_min_pct': 0.016255396620279333, 'bear_atr_max_pct': 0.07425873613172006, 'bear_tp_mult': 1.332313056917112, 'bear_tsl_mult': 0.7169753308257528, 'bear_time_stop': 242, 'bear_use_sma': False, 'bear_use_ema': False, 'bear_use_atr': True, 'bear_use_adx': True, 'bear_use_spike': True, 'bear_rsi_required': False, 'sideways_strategy': 'breakout', 'sideways_bb_std_mult': 3.3887333949856706, 'sideways_rsi_os': 51, 'sideways_rsi_ob': 48, 'sideways_adx_thresh': 26.21665853375081, 'sideways_atr_min_pct': 0.0017970057746615926, 'sideways_atr_max_pct': 0.0677773666613844, 'sideways_tp_mult': 1.3375244898639032, 'sideways_tsl_mult': 0.04835294174393012, 'sideways_time_stop': 191, 'sideways_use_sma': False, 'sideways_use_ema': False, 'sideways_use_atr': False, 'sideways_use_adx': False, 'sideways_use_spike': False, 'sideways_rsi_required': False}.
[I 2025-09-01 10:11:41,876] Trial 444 finished with values: [-1000000000.0, 1000000000.0] and parameters: {'p_sma': 22, 'p_std': 44, 'p_atr': 29, 'p_adx': 22, 'rsi_period': 82, 'ema1': 15, 'ema2': 54, 'slip_atr_k': 0.23647501705713575, 'slip_spread_k': 0.1893691452604311, 'spread_hl_frac': 0.043342646096070976, 'bb_std_mult': 3.152995160219147, 'rsi_os': 51, 'rsi_ob': 55, 'vol_spike': 0.17626953837845805, 'adx_thresh': 19.1389673848915, 'atr_min_pct': 0.015143403286307502, 'atr_max_pct': 0.08779237408472679, 'tp_mult': 2.7013206067127546, 'tsl_mult': 0.5797528561401878, 'strategy': 'breakout', 'time_stop': 160, 'use_sma': True, 'use_atr': False, 'use_adx': True, 'use_ema': False, 'use_spike': False, 'rsi_required': False, 'edge_k': 0.9332362310977794, 'edge_cap': 0.440673913081024, 'bull_strategy': 'mean_reversion', 'bull_bb_std_mult': 0.9480928326388747, 'bull_rsi_os': 18, 'bull_rsi_ob': 82, 'bull_adx_thresh': 6.9351511779988835, 'bull_atr_min_pct': 0.029529951639499254, 'bull_atr_max_pct': 0.0774713924408207, 'bull_tp_mult': 1.9300106568460331, 'bull_tsl_mult': 0.29151365168950893, 'bull_time_stop': 162, 'bull_use_sma': False, 'bull_use_ema': False, 'bull_use_atr': True, 'bull_use_adx': True, 'bull_use_spike': False, 'bull_rsi_required': True, 'bear_strategy': 'mean_reversion', 'bear_bb_std_mult': 3.4004015128177634, 'bear_rsi_os': 46, 'bear_rsi_ob': 57, 'bear_adx_thresh': 12.81226037483811, 'bear_atr_min_pct': 0.01623002239593311, 'bear_atr_max_pct': 0.026515406233345737, 'bear_tp_mult': 1.226957530617633, 'bear_tsl_mult': 0.4398650585149253, 'bear_time_stop': 146, 'bear_use_sma': False, 'bear_use_ema': True, 'bear_use_atr': True, 'bear_use_adx': False, 'bear_use_spike': True, 'bear_rsi_required': True, 'sideways_strategy': 'mean_reversion', 'sideways_bb_std_mult': 3.3658399132920205, 'sideways_rsi_os': 11, 'sideways_rsi_ob': 61, 'sideways_adx_thresh': 26.496879070820313, 'sideways_atr_min_pct': 0.00297585985860458, 'sideways_atr_max_pct': 0.06861400276734055, 'sideways_tp_mult': 1.3411224933633306, 'sideways_tsl_mult': 0.21205186015149324, 'sideways_time_stop': 84, 'sideways_use_sma': False, 'sideways_use_ema': True, 'sideways_use_atr': True, 'sideways_use_adx': False, 'sideways_use_spike': False, 'sideways_rsi_required': False}.
[I 2025-09-01 10:11:42,626] Trial 447 finished with values: [-1000000000.0, 1000000000.0] and parameters: {'p_sma': 35, 'p_std': 46, 'p_atr': 29, 'p_adx': 25, 'rsi_period': 64, 'ema1': 15, 'ema2': 55, 'slip_atr_k': 0.03181919093400558, 'slip_spread_k': 0.17990003693534953, 'spread_hl_frac': 0.04154529307248385, 'bb_std_mult': 3.0940578414904887, 'rsi_os': 50, 'rsi_ob': 55, 'vol_spike': 0.28551991306294894, 'adx_thresh': 20.853063597352463, 'atr_min_pct': 0.025290579292392205, 'atr_max_pct': 0.08004292528096633, 'tp_mult': 2.6662884143858663, 'tsl_mult': 0.0009824583719789497, 'strategy': 'mean_reversion', 'time_stop': 32, 'use_sma': True, 'use_atr': True, 'use_adx': False, 'use_ema': False, 'use_spike': False, 'rsi_required': True, 'edge_k': 0.48001193730957503, 'edge_cap': 0.47933922910331866, 'bull_strategy': 'mean_reversion', 'bull_bb_std_mult': 0.8545700058073301, 'bull_rsi_os': 54, 'bull_rsi_ob': 82, 'bull_adx_thresh': 6.949346185461878, 'bull_atr_min_pct': 0.02879143573505258, 'bull_atr_max_pct': 0.02799869102428408, 'bull_tp_mult': 1.8593148735285279, 'bull_tsl_mult': 0.047805676299913724, 'bull_time_stop': 155, 'bull_use_sma': False, 'bull_use_ema': False, 'bull_use_atr': True, 'bull_use_adx': True, 'bull_use_spike': False, 'bull_rsi_required': True, 'bear_strategy': 'mean_reversion', 'bear_bb_std_mult': 1.573099593199815, 'bear_rsi_os': 15, 'bear_rsi_ob': 47, 'bear_adx_thresh': 14.352891530111332, 'bear_atr_min_pct': 0.017421475649689096, 'bear_atr_max_pct': 0.0686612499665948, 'bear_tp_mult': 1.2782897283254744, 'bear_tsl_mult': 0.3239010871986393, 'bear_time_stop': 146, 'bear_use_sma': True, 'bear_use_ema': True, 'bear_use_atr': False, 'bear_use_adx': False, 'bear_use_spike': True, 'bear_rsi_required': True, 'sideways_strategy': 'mean_reversion', 'sideways_bb_std_mult': 3.3079597583410933, 'sideways_rsi_os': 11, 'sideways_rsi_ob': 50, 'sideways_adx_thresh': 8.585739726701389, 'sideways_atr_min_pct': 0.003049894817152671, 'sideways_atr_max_pct': 0.07319021386782831, 'sideways_tp_mult': 2.5099736887783077, 'sideways_tsl_mult': 0.2033340383437866, 'sideways_time_stop': 195, 'sideways_use_sma': False, 'sideways_use_ema': True, 'sideways_use_atr': True, 'sideways_use_adx': True, 'sideways_use_spike': True, 'sideways_rsi_required': True}.
[I 2025-09-01 10:12:24,627] Trial 449 finished with values: [-0.031324631729285124, 0.031013816836006045] and parameters: {'p_sma': 43, 'p_std': 46, 'p_atr': 29, 'p_adx': 21, 'rsi_period': 66, 'ema1': 5, 'ema2': 26, 'slip_atr_k': 0.19065950841815457, 'slip_spread_k': 0.22632813951086372, 'spread_hl_frac': 0.02939429126341561, 'bb_std_mult': 1.2514144658735957, 'rsi_os': 38, 'rsi_ob': 95, 'vol_spike': 0.29386399542209646, 'adx_thresh': 5.689097211247131, 'atr_min_pct': 0.024641823615976503, 'atr_max_pct': 0.0756792903909119, 'tp_mult': 2.6797822573976626, 'tsl_mult': 0.001468851467566, 'strategy': 'breakout', 'time_stop': 154, 'use_sma': True, 'use_atr': False, 'use_adx': True, 'use_ema': False, 'use_spike': False, 'rsi_required': False, 'edge_k': 0.847581349106989, 'edge_cap': 0.6114582493565415, 'bull_strategy': 'mean_reversion', 'bull_bb_std_mult': 3.153996428475564, 'bull_rsi_os': 32, 'bull_rsi_ob': 75, 'bull_adx_thresh': 13.273590773787607, 'bull_atr_min_pct': 0.029951807876866434, 'bull_atr_max_pct': 0.08258079991009422, 'bull_tp_mult': 1.021312011950613, 'bull_tsl_mult': 0.6896395483628102, 'bull_time_stop': 176, 'bull_use_sma': True, 'bull_use_ema': False, 'bull_use_atr': True, 'bull_use_adx': True, 'bull_use_spike': False, 'bull_rsi_required': True, 'bear_strategy': 'mean_reversion', 'bear_bb_std_mult': 3.512768733801107, 'bear_rsi_os': 12, 'bear_rsi_ob': 47, 'bear_adx_thresh': 32.55721871040613, 'bear_atr_min_pct': 0.017227669026438765, 'bear_atr_max_pct': 0.10329708529040357, 'bear_tp_mult': 2.7859673004391623, 'bear_tsl_mult': 0.03296934679979768, 'bear_time_stop': 69, 'bear_use_sma': True, 'bear_use_ema': True, 'bear_use_atr': True, 'bear_use_adx': False, 'bear_use_spike': True, 'bear_rsi_required': False, 'sideways_strategy': 'breakout', 'sideways_bb_std_mult': 2.771526483259322, 'sideways_rsi_os': 46, 'sideways_rsi_ob': 51, 'sideways_adx_thresh': 20.195655952120543, 'sideways_atr_min_pct': 0.003671178400641022, 'sideways_atr_max_pct': 0.1372153256805947, 'sideways_tp_mult': 1.220202444666177, 'sideways_tsl_mult': 0.265308351195765, 'sideways_time_stop': 240, 'sideways_use_sma': False, 'sideways_use_ema': True, 'sideways_use_atr': False, 'sideways_use_adx': False, 'sideways_use_spike': False, 'sideways_rsi_required': True}.
[I 2025-09-01 10:12:25,710] Trial 448 finished with values: [-1000000000.0, 1000000000.0] and parameters: {'p_sma': 52, 'p_std': 46, 'p_atr': 29, 'p_adx': 27, 'rsi_period': 36, 'ema1': 22, 'ema2': 51, 'slip_atr_k': 0.2108913703113614, 'slip_spread_k': 0.2309515468433053, 'spread_hl_frac': 0.02879308331984195, 'bb_std_mult': 2.348920753077956, 'rsi_os': 46, 'rsi_ob': 58, 'vol_spike': 0.28410804313652893, 'adx_thresh': 21.24382220472955, 'atr_min_pct': 0.024795835514722586, 'atr_max_pct': 0.025858738424415308, 'tp_mult': 2.66940439885096, 'tsl_mult': 0.3045066370638152, 'strategy': 'mean_reversion', 'time_stop': 108, 'use_sma': True, 'use_atr': True, 'use_adx': False, 'use_ema': False, 'use_spike': False, 'rsi_required': True, 'edge_k': 0.6993016491554973, 'edge_cap': 0.8238938993975456, 'bull_strategy': 'mean_reversion', 'bull_bb_std_mult': 1.4964563405876588, 'bull_rsi_os': 19, 'bull_rsi_ob': 75, 'bull_adx_thresh': 14.064781705957442, 'bull_atr_min_pct': 0.029979468506994896, 'bull_atr_max_pct': 0.08364117432375444, 'bull_tp_mult': 1.8092946351885881, 'bull_tsl_mult': 0.0461605540515783, 'bull_time_stop': 257, 'bull_use_sma': False, 'bull_use_ema': False, 'bull_use_atr': True, 'bull_use_adx': True, 'bull_use_spike': False, 'bull_rsi_required': True, 'bear_strategy': 'mean_reversion', 'bear_bb_std_mult': 2.806784232359612, 'bear_rsi_os': 27, 'bear_rsi_ob': 47, 'bear_adx_thresh': 14.27463226802067, 'bear_atr_min_pct': 0.0175135080686684, 'bear_atr_max_pct': 0.06809185340137017, 'bear_tp_mult': 1.2639179638049514, 'bear_tsl_mult': 0.4036968874639977, 'bear_time_stop': 146, 'bear_use_sma': True, 'bear_use_ema': True, 'bear_use_atr': False, 'bear_use_adx': False, 'bear_use_spike': True, 'bear_rsi_required': True, 'sideways_strategy': 'mean_reversion', 'sideways_bb_std_mult': 2.7488803352475917, 'sideways_rsi_os': 46, 'sideways_rsi_ob': 95, 'sideways_adx_thresh': 28.164078791864945, 'sideways_atr_min_pct': 0.003667078526348979, 'sideways_atr_max_pct': 0.07458436340756704, 'sideways_tp_mult': 2.8096010173097485, 'sideways_tsl_mult': 0.8842105933685678, 'sideways_time_stop': 198, 'sideways_use_sma': False, 'sideways_use_ema': True, 'sideways_use_atr': True, 'sideways_use_adx': True, 'sideways_use_spike': True, 'sideways_rsi_required': True}.
[I 2025-09-01 10:12:26,265] Trial 446 finished with values: [-1000000000.0, 1000000000.0] and parameters: {'p_sma': 24, 'p_std': 44, 'p_atr': 29, 'p_adx': 21, 'rsi_period': 63, 'ema1': 21, 'ema2': 42, 'slip_atr_k': 0.016207223065084486, 'slip_spread_k': 0.1824013266149234, 'spread_hl_frac': 0.029203285845076747, 'bb_std_mult': 3.144476465687137, 'rsi_os': 38, 'rsi_ob': 78, 'vol_spike': 0.2846225583763362, 'adx_thresh': 5.46378330848625, 'atr_min_pct': 0.004292206129161936, 'atr_max_pct': 0.0877006842465002, 'tp_mult': 2.6921502474733057, 'tsl_mult': 0.0013531863385707506, 'strategy': 'breakout', 'time_stop': 106, 'use_sma': True, 'use_atr': True, 'use_adx': True, 'use_ema': False, 'use_spike': False, 'rsi_required': True, 'edge_k': 0.856051177506903, 'edge_cap': 0.4473957061803953, 'bull_strategy': 'mean_reversion', 'bull_bb_std_mult': 1.164118871071085, 'bull_rsi_os': 28, 'bull_rsi_ob': 63, 'bull_adx_thresh': 13.322450230595447, 'bull_atr_min_pct': 0.024302313646492928, 'bull_atr_max_pct': 0.08352452390075184, 'bull_tp_mult': 1.2949383531069842, 'bull_tsl_mult': 0.04651373378841422, 'bull_time_stop': 160, 'bull_use_sma': False, 'bull_use_ema': False, 'bull_use_atr': True, 'bull_use_adx': True, 'bull_use_spike': False, 'bull_rsi_required': True, 'bear_strategy': 'mean_reversion', 'bear_bb_std_mult': 3.5000937195601582, 'bear_rsi_os': 48, 'bear_rsi_ob': 57, 'bear_adx_thresh': 32.60655131843701, 'bear_atr_min_pct': 0.02480777900943896, 'bear_atr_max_pct': 0.1047744217256905, 'bear_tp_mult': 1.273259142766637, 'bear_tsl_mult': 0.7132572748960544, 'bear_time_stop': 145, 'bear_use_sma': True, 'bear_use_ema': True, 'bear_use_atr': True, 'bear_use_adx': False, 'bear_use_spike': True, 'bear_rsi_required': True, 'sideways_strategy': 'mean_reversion', 'sideways_bb_std_mult': 2.744844412034722, 'sideways_rsi_os': 16, 'sideways_rsi_ob': 67, 'sideways_adx_thresh': 20.16924535642813, 'sideways_atr_min_pct': 0.002970161682426558, 'sideways_atr_max_pct': 0.10281336004719249, 'sideways_tp_mult': 2.9762960549757644, 'sideways_tsl_mult': 0.26222837475623645, 'sideways_time_stop': 48, 'sideways_use_sma': False, 'sideways_use_ema': True, 'sideways_use_atr': True, 'sideways_use_adx': True, 'sideways_use_spike': True, 'sideways_rsi_required': True}.
[I 2025-09-01 10:12:26,276] Trial 445 finished with values: [-1000000000.0, 1000000000.0] and parameters: {'p_sma': 32, 'p_std': 44, 'p_atr': 29, 'p_adx': 22, 'rsi_period': 63, 'ema1': 15, 'ema2': 22, 'slip_atr_k': 0.16094803847790687, 'slip_spread_k': 0.1838274846294203, 'spread_hl_frac': 0.028829355182672416, 'bb_std_mult': 3.1492250912858593, 'rsi_os': 51, 'rsi_ob': 70, 'vol_spike': 0.28480027887184994, 'adx_thresh': 5.056644721494659, 'atr_min_pct': 0.024392810487570873, 'atr_max_pct': 0.08794317253934714, 'tp_mult': 2.702385807850827, 'tsl_mult': 0.06701652163343177, 'strategy': 'breakout', 'time_stop': 160, 'use_sma': True, 'use_atr': False, 'use_adx': True, 'use_ema': False, 'use_spike': False, 'rsi_required': False, 'edge_k': 0.8436832686347685, 'edge_cap': 0.8280555683377661, 'bull_strategy': 'mean_reversion', 'bull_bb_std_mult': 1.9172578403737077, 'bull_rsi_os': 21, 'bull_rsi_ob': 82, 'bull_adx_thresh': 11.4782692898981, 'bull_atr_min_pct': 0.023255687557707717, 'bull_atr_max_pct': 0.1005306242187478, 'bull_tp_mult': 1.8652188985269273, 'bull_tsl_mult': 0.05677897706382118, 'bull_time_stop': 164, 'bull_use_sma': False, 'bull_use_ema': False, 'bull_use_atr': True, 'bull_use_adx': True, 'bull_use_spike': False, 'bull_rsi_required': True, 'bear_strategy': 'mean_reversion', 'bear_bb_std_mult': 3.421516506359677, 'bear_rsi_os': 46, 'bear_rsi_ob': 47, 'bear_adx_thresh': 25.765048031149284, 'bear_atr_min_pct': 0.024917643848537653, 'bear_atr_max_pct': 0.10349869148645251, 'bear_tp_mult': 1.22818946421024, 'bear_tsl_mult': 0.32279574778437486, 'bear_time_stop': 154, 'bear_use_sma': False, 'bear_use_ema': True, 'bear_use_atr': True, 'bear_use_adx': False, 'bear_use_spike': True, 'bear_rsi_required': True, 'sideways_strategy': 'mean_reversion', 'sideways_bb_std_mult': 3.222753226868289, 'sideways_rsi_os': 51, 'sideways_rsi_ob': 48, 'sideways_adx_thresh': 26.323821526573532, 'sideways_atr_min_pct': 0.029359634317364804, 'sideways_atr_max_pct': 0.0744098596329061, 'sideways_tp_mult': 2.601852598777657, 'sideways_tsl_mult': 0.040202520098455874, 'sideways_time_stop': 192, 'sideways_use_sma': False, 'sideways_use_ema': True, 'sideways_use_atr': True, 'sideways_use_adx': False, 'sideways_use_spike': False, 'sideways_rsi_required': False}.
