[I 2025-09-01 10:04:10,703] Trial 397 finished with values: [-0.04182884969483769, 0.04167702449101485] and parameters: {'p_sma': 22, 'p_std': 49, 'p_atr': 13, 'p_adx': 18, 'rsi_period': 65, 'ema1': 22, 'ema2': 10, 'slip_atr_k': 0.0791931982545914, 'slip_spread_k': 0.12658706675656128, 'spread_hl_frac': 0.026954183341581218, 'bb_std_mult': 1.500902513466797, 'rsi_os': 37, 'rsi_ob': 77, 'vol_spike': 0.0856888767090749, 'adx_thresh': 22.781038033686414, 'atr_min_pct': 0.027312721419204027, 'atr_max_pct': 0.08128364306622375, 'tp_mult': 2.7309525025734906, 'tsl_mult': 0.05479032238045957, 'strategy': 'breakout', 'time_stop': 113, 'use_sma': True, 'use_atr': True, 'use_adx': True, 'use_ema': False, 'use_spike': True, 'rsi_required': True, 'edge_k': 0.9847391016140201, 'edge_cap': 0.47917109708218525, 'bull_strategy': 'breakout', 'bull_bb_std_mult': 2.197148350749577, 'bull_rsi_os': 43, 'bull_rsi_ob': 55, 'bull_adx_thresh': 26.608598151756674, 'bull_atr_min_pct': 0.0299861037909637, 'bull_atr_max_pct': 0.1304178843383368, 'bull_tp_mult': 1.8441819008350542, 'bull_tsl_mult': 0.4200466559132701, 'bull_time_stop': 151, 'bull_use_sma': True, 'bull_use_ema': True, 'bull_use_atr': True, 'bull_use_adx': True, 'bull_use_spike': True, 'bull_rsi_required': True, 'bear_strategy': 'mean_reversion', 'bear_bb_std_mult': 0.7341212024386552, 'bear_rsi_os': 48, 'bear_rsi_ob': 84, 'bear_adx_thresh': 18.780583446041362, 'bear_atr_min_pct': 0.019000276346352866, 'bear_atr_max_pct': 0.06859365206540319, 'bear_tp_mult': 1.2132731285289005, 'bear_tsl_mult': 0.46600521394193845, 'bear_time_stop': 164, 'bear_use_sma': True, 'bear_use_ema': False, 'bear_use_atr': True, 'bear_use_adx': True, 'bear_use_spike': True, 'bear_rsi_required': False, 'sideways_strategy': 'breakout', 'sideways_bb_std_mult': 3.343818990344252, 'sideways_rsi_os': 49, 'sideways_rsi_ob': 55, 'sideways_adx_thresh': 13.456040777414755, 'sideways_atr_min_pct': 0.0039036487417171955, 'sideways_atr_max_pct': 0.08851330016024703, 'sideways_tp_mult': 2.4389358883016192, 'sideways_tsl_mult': 0.7520925432850558, 'sideways_time_stop': 62, 'sideways_use_sma': False, 'sideways_use_ema': True, 'sideways_use_atr': False, 'sideways_use_adx': True, 'sideways_use_spike': True, 'sideways_rsi_required': True}.
[I 2025-09-01 10:04:11,309] Trial 395 finished with values: [-1000000000.0, 1000000000.0] and parameters: {'p_sma': 22, 'p_std': 38, 'p_atr': 9, 'p_adx': 28, 'rsi_period': 65, 'ema1': 7, 'ema2': 36, 'slip_atr_k': 0.13681287549448856, 'slip_spread_k': 0.7131493575793774, 'spread_hl_frac': 0.029064303327482083, 'bb_std_mult': 3.302456280206192, 'rsi_os': 23, 'rsi_ob': 66, 'vol_spike': 0.1940094078837475, 'adx_thresh': 5.388990395165348, 'atr_min_pct': 0.027623647010278474, 'atr_max_pct': 0.07148827670103954, 'tp_mult': 2.818019373396542, 'tsl_mult': 0.020938694990205425, 'strategy': 'breakout', 'time_stop': 100, 'use_sma': True, 'use_atr': False, 'use_adx': True, 'use_ema': False, 'use_spike': True, 'rsi_required': False, 'edge_k': 1.3034987870487278, 'edge_cap': 0.8499790692353035, 'bull_strategy': 'mean_reversion', 'bull_bb_std_mult': 0.8549824674810118, 'bull_rsi_os': 30, 'bull_rsi_ob': 55, 'bull_adx_thresh': 6.297063076961585, 'bull_atr_min_pct': 0.02457188678689682, 'bull_atr_max_pct': 0.07501400715817134, 'bull_tp_mult': 1.8495147616283545, 'bull_tsl_mult': 0.059372042193985994, 'bull_time_stop': 152, 'bull_use_sma': True, 'bull_use_ema': False, 'bull_use_atr': True, 'bull_use_adx': True, 'bull_use_spike': False, 'bull_rsi_required': True, 'bear_strategy': 'mean_reversion', 'bear_bb_std_mult': 2.544099663628208, 'bear_rsi_os': 10, 'bear_rsi_ob': 95, 'bear_adx_thresh': 24.29875362304707, 'bear_atr_min_pct': 0.02726813134625871, 'bear_atr_max_pct': 0.0654954976878625, 'bear_tp_mult': 1.2929155715827834, 'bear_tsl_mult': 0.45760179509336923, 'bear_time_stop': 55, 'bear_use_sma': False, 'bear_use_ema': True, 'bear_use_atr': True, 'bear_use_adx': False, 'bear_use_spike': True, 'bear_rsi_required': False, 'sideways_strategy': 'breakout', 'sideways_bb_std_mult': 3.3312540499376797, 'sideways_rsi_os': 17, 'sideways_rsi_ob': 60, 'sideways_adx_thresh': 23.969039535434053, 'sideways_atr_min_pct': 0.008652661408764126, 'sideways_atr_max_pct': 0.07064957871500605, 'sideways_tp_mult': 2.473794482269869, 'sideways_tsl_mult': 0.5955952679986705, 'sideways_time_stop': 197, 'sideways_use_sma': False, 'sideways_use_ema': True, 'sideways_use_atr': False, 'sideways_use_adx': False, 'sideways_use_spike': False, 'sideways_rsi_required': False}.
[I 2025-09-01 10:04:12,303] Trial 398 finished with values: [-1000000000.0, 1000000000.0] and parameters: {'p_sma': 22, 'p_std': 37, 'p_atr': 21, 'p_adx': 21, 'rsi_period': 67, 'ema1': 27, 'ema2': 25, 'slip_atr_k': 0.045739974485867085, 'slip_spread_k': 0.12671638769643453, 'spread_hl_frac': 0.005235810440286613, 'bb_std_mult': 0.5578182035960995, 'rsi_os': 31, 'rsi_ob': 77, 'vol_spike': 0.16379016168321278, 'adx_thresh': 34.669838883896745, 'atr_min_pct': 0.026762729626374344, 'atr_max_pct': 0.07994290366905625, 'tp_mult': 2.81133532123192, 'tsl_mult': 0.8067237700772281, 'strategy': 'mean_reversion', 'time_stop': 168, 'use_sma': True, 'use_atr': True, 'use_adx': False, 'use_ema': False, 'use_spike': True, 'rsi_required': True, 'edge_k': 1.2065817794232507, 'edge_cap': 0.5494120772474296, 'bull_strategy': 'breakout', 'bull_bb_std_mult': 2.1994275700305335, 'bull_rsi_os': 30, 'bull_rsi_ob': 50, 'bull_adx_thresh': 26.687004351710925, 'bull_atr_min_pct': 0.029647516608082257, 'bull_atr_max_pct': 0.03838890323420304, 'bull_tp_mult': 1.8530560160533986, 'bull_tsl_mult': 0.18480594073301476, 'bull_time_stop': 149, 'bull_use_sma': True, 'bull_use_ema': True, 'bull_use_atr': True, 'bull_use_adx': True, 'bull_use_spike': True, 'bull_rsi_required': True, 'bear_strategy': 'mean_reversion', 'bear_bb_std_mult': 2.5476367176124293, 'bear_rsi_os': 49, 'bear_rsi_ob': 84, 'bear_adx_thresh': 14.131444216133593, 'bear_atr_min_pct': 0.017260122763308346, 'bear_atr_max_pct': 0.07055072445206773, 'bear_tp_mult': 1.211479637701261, 'bear_tsl_mult': 0.46534814008391023, 'bear_time_stop': 135, 'bear_use_sma': True, 'bear_use_ema': False, 'bear_use_atr': False, 'bear_use_adx': True, 'bear_use_spike': True, 'bear_rsi_required': False, 'sideways_strategy': 'breakout', 'sideways_bb_std_mult': 3.3249509635212067, 'sideways_rsi_os': 19, 'sideways_rsi_ob': 81, 'sideways_adx_thresh': 8.185834034350844, 'sideways_atr_min_pct': 0.022407105719542346, 'sideways_atr_max_pct': 0.09105288047127878, 'sideways_tp_mult': 1.3663503916901396, 'sideways_tsl_mult': 0.8051738788159094, 'sideways_time_stop': 96, 'sideways_use_sma': False, 'sideways_use_ema': True, 'sideways_use_atr': False, 'sideways_use_adx': True, 'sideways_use_spike': True, 'sideways_rsi_required': True}.
[I 2025-09-01 10:04:13,885] Trial 399 finished with values: [-1000000000.0, 1000000000.0] and parameters: {'p_sma': 22, 'p_std': 49, 'p_atr': 20, 'p_adx': 28, 'rsi_period': 67, 'ema1': 22, 'ema2': 45, 'slip_atr_k': 0.137031692009854, 'slip_spread_k': 0.5148137328346358, 'spread_hl_frac': 0.02720824415297642, 'bb_std_mult': 2.6953960211140138, 'rsi_os': 27, 'rsi_ob': 77, 'vol_spike': 0.08805727846216144, 'adx_thresh': 28.927102958496622, 'atr_min_pct': 0.025158950316561554, 'atr_max_pct': 0.08091388110445688, 'tp_mult': 2.756295244425127, 'tsl_mult': 0.03628849790274799, 'strategy': 'mean_reversion', 'time_stop': 54, 'use_sma': True, 'use_atr': True, 'use_adx': False, 'use_ema': False, 'use_spike': True, 'rsi_required': True, 'edge_k': 0.9766689813033756, 'edge_cap': 0.5511970225967949, 'bull_strategy': 'mean_reversion', 'bull_bb_std_mult': 0.8442419249466803, 'bull_rsi_os': 9, 'bull_rsi_ob': 55, 'bull_adx_thresh': 6.451327761228134, 'bull_atr_min_pct': 0.0299631103632629, 'bull_atr_max_pct': 0.0833098499420365, 'bull_tp_mult': 1.9760923993510418, 'bull_tsl_mult': 0.061770273103408664, 'bull_time_stop': 152, 'bull_use_sma': True, 'bull_use_ema': False, 'bull_use_atr': True, 'bull_use_adx': True, 'bull_use_spike': False, 'bull_rsi_required': True, 'bear_strategy': 'mean_reversion', 'bear_bb_std_mult': 1.0282804597728747, 'bear_rsi_os': 48, 'bear_rsi_ob': 79, 'bear_adx_thresh': 25.251373168853906, 'bear_atr_min_pct': 0.023766410172418928, 'bear_atr_max_pct': 0.06867248154628633, 'bear_tp_mult': 1.2066380557644378, 'bear_tsl_mult': 0.4143573059297825, 'bear_time_stop': 83, 'bear_use_sma': True, 'bear_use_ema': True, 'bear_use_atr': False, 'bear_use_adx': False, 'bear_use_spike': True, 'bear_rsi_required': False, 'sideways_strategy': 'breakout', 'sideways_bb_std_mult': 3.4970067954186312, 'sideways_rsi_os': 48, 'sideways_rsi_ob': 53, 'sideways_adx_thresh': 19.036961323344194, 'sideways_atr_min_pct': 0.012070749491872904, 'sideways_atr_max_pct': 0.08983970295541381, 'sideways_tp_mult': 2.5596421588900107, 'sideways_tsl_mult': 0.09825086943223932, 'sideways_time_stop': 197, 'sideways_use_sma': False, 'sideways_use_ema': True, 'sideways_use_atr': False, 'sideways_use_adx': True, 'sideways_use_spike': True, 'sideways_rsi_required': True}.
[I 2025-09-01 10:04:14,505] Trial 400 finished with values: [-1000000000.0, 1000000000.0] and parameters: {'p_sma': 24, 'p_std': 47, 'p_atr': 28, 'p_adx': 21, 'rsi_period': 67, 'ema1': 21, 'ema2': 48, 'slip_atr_k': 0.10758927670554819, 'slip_spread_k': 0.1632525584999388, 'spread_hl_frac': 0.005388649177274392, 'bb_std_mult': 2.669833183927647, 'rsi_os': 54, 'rsi_ob': 77, 'vol_spike': 0.25702942716372607, 'adx_thresh': 7.160431022212014, 'atr_min_pct': 0.024495268149282597, 'atr_max_pct': 0.08581493340861505, 'tp_mult': 1.605302337537367, 'tsl_mult': 0.22250875778614604, 'strategy': 'mean_reversion', 'time_stop': 147, 'use_sma': True, 'use_atr': True, 'use_adx': False, 'use_ema': False, 'use_spike': False, 'rsi_required': True, 'edge_k': 1.2228680824043998, 'edge_cap': 0.6343536995344837, 'bull_strategy': 'mean_reversion', 'bull_bb_std_mult': 1.6530206564370027, 'bull_rsi_os': 19, 'bull_rsi_ob': 69, 'bull_adx_thresh': 6.370712969387917, 'bull_atr_min_pct': 0.02998610607774118, 'bull_atr_max_pct': 0.13763886273091613, 'bull_tp_mult': 1.9528897826738416, 'bull_tsl_mult': 0.17753623195652374, 'bull_time_stop': 140, 'bull_use_sma': True, 'bull_use_ema': False, 'bull_use_atr': True, 'bull_use_adx': True, 'bull_use_spike': False, 'bull_rsi_required': True, 'bear_strategy': 'mean_reversion', 'bear_bb_std_mult': 3.4021936555931056, 'bear_rsi_os': 45, 'bear_rsi_ob': 45, 'bear_adx_thresh': 11.179423988568773, 'bear_atr_min_pct': 0.020033161043771956, 'bear_atr_max_pct': 0.07689438137977762, 'bear_tp_mult': 1.4948961483279808, 'bear_tsl_mult': 0.4189404407484946, 'bear_time_stop': 136, 'bear_use_sma': True, 'bear_use_ema': True, 'bear_use_atr': False, 'bear_use_adx': False, 'bear_use_spike': True, 'bear_rsi_required': False, 'sideways_strategy': 'breakout', 'sideways_bb_std_mult': 2.0517566954345146, 'sideways_rsi_os': 52, 'sideways_rsi_ob': 62, 'sideways_adx_thresh': 19.10282686542066, 'sideways_atr_min_pct': 0.012246187088489034, 'sideways_atr_max_pct': 0.06505067132590234, 'sideways_tp_mult': 1.3662104115865257, 'sideways_tsl_mult': 0.8598776619886456, 'sideways_time_stop': 95, 'sideways_use_sma': False, 'sideways_use_ema': False, 'sideways_use_atr': False, 'sideways_use_adx': True, 'sideways_use_spike': True, 'sideways_rsi_required': True}.
[I 2025-09-01 10:04:14,722] Trial 403 finished with values: [-1000000000.0, 1000000000.0] and parameters: {'p_sma': 14, 'p_std': 54, 'p_atr': 28, 'p_adx': 22, 'rsi_period': 43, 'ema1': 5, 'ema2': 57, 'slip_atr_k': 0.052368091436659714, 'slip_spread_k': 0.4061234087798231, 'spread_hl_frac': 0.02941479129382956, 'bb_std_mult': 2.310249462575401, 'rsi_os': 28, 'rsi_ob': 79, 'vol_spike': 0.2948685995410764, 'adx_thresh': 6.950393381989136, 'atr_min_pct': 0.024051336880332768, 'atr_max_pct': 0.02096839469888513, 'tp_mult': 1.607918906960398, 'tsl_mult': 0.8551526661166683, 'strategy': 'breakout', 'time_stop': 148, 'use_sma': False, 'use_atr': False, 'use_adx': True, 'use_ema': False, 'use_spike': False, 'rsi_required': False, 'edge_k': 0.7358219772479117, 'edge_cap': 0.6361317908772725, 'bull_strategy': 'mean_reversion', 'bull_bb_std_mult': 3.3790962930643262, 'bull_rsi_os': 19, 'bull_rsi_ob': 53, 'bull_adx_thresh': 5.603043623781664, 'bull_atr_min_pct': 0.0060094760089971465, 'bull_atr_max_pct': 0.021074148243349043, 'bull_tp_mult': 1.8049972064989352, 'bull_tsl_mult': 0.0022632957635531775, 'bull_time_stop': 63, 'bull_use_sma': False, 'bull_use_ema': False, 'bull_use_atr': True, 'bull_use_adx': True, 'bull_use_spike': False, 'bull_rsi_required': True, 'bear_strategy': 'mean_reversion', 'bear_bb_std_mult': 1.3342305038563111, 'bear_rsi_os': 26, 'bear_rsi_ob': 45, 'bear_adx_thresh': 22.14122108268105, 'bear_atr_min_pct': 0.01997652885922694, 'bear_atr_max_pct': 0.07691826290454612, 'bear_tp_mult': 1.9235002914757766, 'bear_tsl_mult': 0.41956753925001755, 'bear_time_stop': 92, 'bear_use_sma': False, 'bear_use_ema': True, 'bear_use_atr': True, 'bear_use_adx': False, 'bear_use_spike': True, 'bear_rsi_required': True, 'sideways_strategy': 'mean_reversion', 'sideways_bb_std_mult': 1.8261865593267825, 'sideways_rsi_os': 52, 'sideways_rsi_ob': 49, 'sideways_adx_thresh': 17.335832072401082, 'sideways_atr_min_pct': 0.0019161745287503175, 'sideways_atr_max_pct': 0.025680245399954692, 'sideways_tp_mult': 1.2262644078667144, 'sideways_tsl_mult': 0.855308171666086, 'sideways_time_stop': 272, 'sideways_use_sma': True, 'sideways_use_ema': False, 'sideways_use_atr': True, 'sideways_use_adx': False, 'sideways_use_spike': False, 'sideways_rsi_required': False}.
[I 2025-09-01 10:04:51,325] Trial 402 finished with values: [-1000000000.0, 1000000000.0] and parameters: {'p_sma': 24, 'p_std': 13, 'p_atr': 28, 'p_adx': 22, 'rsi_period': 70, 'ema1': 21, 'ema2': 45, 'slip_atr_k': 0.15481408636143046, 'slip_spread_k': 0.5144965931512823, 'spread_hl_frac': 0.02756330338030757, 'bb_std_mult': 2.123256385439436, 'rsi_os': 27, 'rsi_ob': 61, 'vol_spike': 0.29490571806652827, 'adx_thresh': 28.851011818030017, 'atr_min_pct': 0.024978067222481474, 'atr_max_pct': 0.0842832402461247, 'tp_mult': 1.366333052549571, 'tsl_mult': 0.04352161754557382, 'strategy': 'mean_reversion', 'time_stop': 150, 'use_sma': True, 'use_atr': False, 'use_adx': False, 'use_ema': False, 'use_spike': False, 'rsi_required': False, 'edge_k': 0.8477953189879165, 'edge_cap': 0.5950104268779908, 'bull_strategy': 'mean_reversion', 'bull_bb_std_mult': 1.1026834371949052, 'bull_rsi_os': 19, 'bull_rsi_ob': 52, 'bull_adx_thresh': 6.317944303628787, 'bull_atr_min_pct': 0.029993610769167355, 'bull_atr_max_pct': 0.02493433628897162, 'bull_tp_mult': 1.9610916869678776, 'bull_tsl_mult': 0.8193892892372188, 'bull_time_stop': 140, 'bull_use_sma': True, 'bull_use_ema': False, 'bull_use_atr': True, 'bull_use_adx': True, 'bull_use_spike': False, 'bull_rsi_required': True, 'bear_strategy': 'mean_reversion', 'bear_bb_std_mult': 1.9177107020628053, 'bear_rsi_os': 26, 'bear_rsi_ob': 45, 'bear_adx_thresh': 12.49360986777208, 'bear_atr_min_pct': 0.016360222330256878, 'bear_atr_max_pct': 0.014184255295614137, 'bear_tp_mult': 1.4981684457649456, 'bear_tsl_mult': 0.4201618620072341, 'bear_time_stop': 85, 'bear_use_sma': False, 'bear_use_ema': True, 'bear_use_atr': False, 'bear_use_adx': False, 'bear_use_spike': True, 'bear_rsi_required': True, 'sideways_strategy': 'mean_reversion', 'sideways_bb_std_mult': 3.469548415955324, 'sideways_rsi_os': 48, 'sideways_rsi_ob': 48, 'sideways_adx_thresh': 18.995753268228803, 'sideways_atr_min_pct': 0.004190937787083722, 'sideways_atr_max_pct': 0.07597197181974952, 'sideways_tp_mult': 1.2329939133770333, 'sideways_tsl_mult': 0.476083370104473, 'sideways_time_stop': 189, 'sideways_use_sma': False, 'sideways_use_ema': False, 'sideways_use_atr': True, 'sideways_use_adx': False, 'sideways_use_spike': False, 'sideways_rsi_required': False}.
[I 2025-09-01 10:04:52,722] Trial 401 finished with values: [-1000000000.0, 1000000000.0] and parameters: {'p_sma': 24, 'p_std': 44, 'p_atr': 28, 'p_adx': 21, 'rsi_period': 67, 'ema1': 21, 'ema2': 48, 'slip_atr_k': 0.15331122839607075, 'slip_spread_k': 0.519138386000306, 'spread_hl_frac': 0.027836966669341198, 'bb_std_mult': 3.2433478941687888, 'rsi_os': 31, 'rsi_ob': 61, 'vol_spike': 0.030852990540027464, 'adx_thresh': 28.924189337816777, 'atr_min_pct': 0.0249829373493242, 'atr_max_pct': 0.05113679868323712, 'tp_mult': 2.5011141794417324, 'tsl_mult': 0.4701888162357662, 'strategy': 'mean_reversion', 'time_stop': 53, 'use_sma': True, 'use_atr': True, 'use_adx': False, 'use_ema': False, 'use_spike': False, 'rsi_required': True, 'edge_k': 1.1824195495775862, 'edge_cap': 0.5550001909426542, 'bull_strategy': 'mean_reversion', 'bull_bb_std_mult': 2.907875267933882, 'bull_rsi_os': 19, 'bull_rsi_ob': 52, 'bull_adx_thresh': 6.50299729620038, 'bull_atr_min_pct': 0.028955893262866555, 'bull_atr_max_pct': 0.03867703237674707, 'bull_tp_mult': 1.9767260252994183, 'bull_tsl_mult': 0.8212574738409075, 'bull_time_stop': 139, 'bull_use_sma': True, 'bull_use_ema': False, 'bull_use_atr': True, 'bull_use_adx': True, 'bull_use_spike': False, 'bull_rsi_required': True, 'bear_strategy': 'mean_reversion', 'bear_bb_std_mult': 3.3956216529900574, 'bear_rsi_os': 45, 'bear_rsi_ob': 78, 'bear_adx_thresh': 6.985697151921379, 'bear_atr_min_pct': 0.01722085543116826, 'bear_atr_max_pct': 0.07500346901578313, 'bear_tp_mult': 1.1975018757112936, 'bear_tsl_mult': 0.22063688340955934, 'bear_time_stop': 92, 'bear_use_sma': True, 'bear_use_ema': True, 'bear_use_atr': False, 'bear_use_adx': False, 'bear_use_spike': True, 'bear_rsi_required': False, 'sideways_strategy': 'breakout', 'sideways_bb_std_mult': 2.030174977939357, 'sideways_rsi_os': 47, 'sideways_rsi_ob': 51, 'sideways_adx_thresh': 27.18621919117583, 'sideways_atr_min_pct': 0.012273551845647825, 'sideways_atr_max_pct': 0.065250440877637, 'sideways_tp_mult': 2.6821172807363887, 'sideways_tsl_mult': 0.8581746328498477, 'sideways_time_stop': 189, 'sideways_use_sma': False, 'sideways_use_ema': False, 'sideways_use_atr': False, 'sideways_use_adx': True, 'sideways_use_spike': True, 'sideways_rsi_required': True}.
[I 2025-09-01 10:04:54,898] Trial 404 finished with values: [-0.0903562145309259, 0.09083596437055565] and parameters: {'p_sma': 33, 'p_std': 44, 'p_atr': 26, 'p_adx': 22, 'rsi_period': 78, 'ema1': 25, 'ema2': 43, 'slip_atr_k': 0.053123362484288804, 'slip_spread_k': 0.18684175808150488, 'spread_hl_frac': 0.03515724993115259, 'bb_std_mult': 3.2271260535304864, 'rsi_os': 28, 'rsi_ob': 61, 'vol_spike': 0.029341492725964896, 'adx_thresh': 15.361307519725308, 'atr_min_pct': 0.024037445347522723, 'atr_max_pct': 0.03730132734442992, 'tp_mult': 1.3968446419751261, 'tsl_mult': 0.4747411550004909, 'strategy': 'breakout', 'time_stop': 156, 'use_sma': False, 'use_atr': False, 'use_adx': True, 'use_ema': False, 'use_spike': False, 'rsi_required': False, 'edge_k': 0.7418325860504249, 'edge_cap': 0.5884929538263044, 'bull_strategy': 'mean_reversion', 'bull_bb_std_mult': 0.9715085931953472, 'bull_rsi_os': 7, 'bull_rsi_ob': 71, 'bull_adx_thresh': 5.653048390699378, 'bull_atr_min_pct': 0.013497975085117821, 'bull_atr_max_pct': 0.023933557543768837, 'bull_tp_mult': 1.7899328429447865, 'bull_tsl_mult': 0.27433009471880343, 'bull_time_stop': 251, 'bull_use_sma': False, 'bull_use_ema': False, 'bull_use_atr': True, 'bull_use_adx': True, 'bull_use_spike': False, 'bull_rsi_required': True, 'bear_strategy': 'mean_reversion', 'bear_bb_std_mult': 0.8605591785533566, 'bear_rsi_os': 6, 'bear_rsi_ob': 86, 'bear_adx_thresh': 12.514878052025209, 'bear_atr_min_pct': 0.010082239752218317, 'bear_atr_max_pct': 0.07358303351766869, 'bear_tp_mult': 1.3595144194098536, 'bear_tsl_mult': 0.426514309140777, 'bear_time_stop': 94, 'bear_use_sma': False, 'bear_use_ema': True, 'bear_use_atr': True, 'bear_use_adx': False, 'bear_use_spike': True, 'bear_rsi_required': True, 'sideways_strategy': 'mean_reversion', 'sideways_bb_std_mult': 3.4660646439083433, 'sideways_rsi_os': 22, 'sideways_rsi_ob': 48, 'sideways_adx_thresh': 25.876206828931437, 'sideways_atr_min_pct': 0.0021414384829952565, 'sideways_atr_max_pct': 0.038036215145224435, 'sideways_tp_mult': 2.2560996623799148, 'sideways_tsl_mult': 0.8299917407905568, 'sideways_time_stop': 22, 'sideways_use_sma': True, 'sideways_use_ema': False, 'sideways_use_atr': True, 'sideways_use_adx': False, 'sideways_use_spike': False, 'sideways_rsi_required': False}.
