[I 2025-09-01 10:02:48,673] Trial 389 finished with values: [-0.04160208484473349, 0.04138687509968451] and parameters: {'p_sma': 20, 'p_std': 46, 'p_atr': 26, 'p_adx': 22, 'rsi_period': 62, 'ema1': 22, 'ema2': 56, 'slip_atr_k': 0.22047309561333578, 'slip_spread_k': 0.21571765565490106, 'spread_hl_frac': 0.02674664603017249, 'bb_std_mult': 2.786386439466117, 'rsi_os': 26, 'rsi_ob': 80, 'vol_spike': 0.27674847681820225, 'adx_thresh': 25.138054184533203, 'atr_min_pct': 0.02427844731000741, 'atr_max_pct': 0.07732574980891418, 'tp_mult': 1.1622359193488232, 'tsl_mult': 0.5403406147582166, 'strategy': 'breakout', 'time_stop': 253, 'use_sma': True, 'use_atr': False, 'use_adx': True, 'use_ema': False, 'use_spike': False, 'rsi_required': False, 'edge_k': 0.9029301638980036, 'edge_cap': 0.5735277139114976, 'bull_strategy': 'mean_reversion', 'bull_bb_std_mult': 1.9262284544296802, 'bull_rsi_os': 53, 'bull_rsi_ob': 56, 'bull_adx_thresh': 34.107757011658364, 'bull_atr_min_pct': 0.012548494365194235, 'bull_atr_max_pct': 0.0923746278022777, 'bull_tp_mult': 1.55151502326075, 'bull_tsl_mult': 0.03344209828299576, 'bull_time_stop': 165, 'bull_use_sma': True, 'bull_use_ema': False, 'bull_use_atr': True, 'bull_use_adx': True, 'bull_use_spike': False, 'bull_rsi_required': True, 'bear_strategy': 'mean_reversion', 'bear_bb_std_mult': 0.503140577411817, 'bear_rsi_os': 18, 'bear_rsi_ob': 47, 'bear_adx_thresh': 13.291384188855094, 'bear_atr_min_pct': 0.010640772249759022, 'bear_atr_max_pct': 0.07173128084227215, 'bear_tp_mult': 1.6597155173656524, 'bear_tsl_mult': 0.25030855321570683, 'bear_time_stop': 289, 'bear_use_sma': False, 'bear_use_ema': True, 'bear_use_atr': True, 'bear_use_adx': False, 'bear_use_spike': True, 'bear_rsi_required': True, 'sideways_strategy': 'mean_reversion', 'sideways_bb_std_mult': 3.2077558392367975, 'sideways_rsi_os': 55, 'sideways_rsi_ob': 50, 'sideways_adx_thresh': 10.478007652217649, 'sideways_atr_min_pct': 0.0018893511968164807, 'sideways_atr_max_pct': 0.06923746393093963, 'sideways_tp_mult': 1.9839219895467688, 'sideways_tsl_mult': 0.27375852183696714, 'sideways_time_stop': 11, 'sideways_use_sma': False, 'sideways_use_ema': True, 'sideways_use_atr': False, 'sideways_use_adx': False, 'sideways_use_spike': False, 'sideways_rsi_required': False}.
[I 2025-09-01 10:02:48,677] Trial 388 finished with values: [-1000000000.0, 1000000000.0] and parameters: {'p_sma': 20, 'p_std': 9, 'p_atr': 25, 'p_adx': 22, 'rsi_period': 62, 'ema1': 21, 'ema2': 27, 'slip_atr_k': 0.06712912979869361, 'slip_spread_k': 0.21292398472561702, 'spread_hl_frac': 0.02629875126619154, 'bb_std_mult': 0.8058370766167082, 'rsi_os': 55, 'rsi_ob': 80, 'vol_spike': 0.277106965745591, 'adx_thresh': 25.30215358396839, 'atr_min_pct': 0.024255529807192717, 'atr_max_pct': 0.07777829646945862, 'tp_mult': 2.7767475706542237, 'tsl_mult': 0.4429232016292207, 'strategy': 'breakout', 'time_stop': 155, 'use_sma': False, 'use_atr': False, 'use_adx': True, 'use_ema': False, 'use_spike': False, 'rsi_required': False, 'edge_k': 1.0350866624293262, 'edge_cap': 0.5739746702019665, 'bull_strategy': 'mean_reversion', 'bull_bb_std_mult': 3.5868933581932296, 'bull_rsi_os': 19, 'bull_rsi_ob': 56, 'bull_adx_thresh': 6.485717147583693, 'bull_atr_min_pct': 0.029244384096577012, 'bull_atr_max_pct': 0.14741746430115743, 'bull_tp_mult': 1.8624121464112164, 'bull_tsl_mult': 0.620766145977361, 'bull_time_stop': 163, 'bull_use_sma': False, 'bull_use_ema': False, 'bull_use_atr': True, 'bull_use_adx': True, 'bull_use_spike': False, 'bull_rsi_required': True, 'bear_strategy': 'mean_reversion', 'bear_bb_std_mult': 3.3472537970084, 'bear_rsi_os': 46, 'bear_rsi_ob': 77, 'bear_adx_thresh': 13.42179252615397, 'bear_atr_min_pct': 0.009247402829630602, 'bear_atr_max_pct': 0.07209463845469295, 'bear_tp_mult': 1.154086411677149, 'bear_tsl_mult': 0.5714043406098417, 'bear_time_stop': 130, 'bear_use_sma': False, 'bear_use_ema': True, 'bear_use_atr': True, 'bear_use_adx': False, 'bear_use_spike': True, 'bear_rsi_required': True, 'sideways_strategy': 'mean_reversion', 'sideways_bb_std_mult': 3.188592407792018, 'sideways_rsi_os': 46, 'sideways_rsi_ob': 67, 'sideways_adx_thresh': 27.335984762440287, 'sideways_atr_min_pct': 0.007624413908176354, 'sideways_atr_max_pct': 0.0684029461635967, 'sideways_tp_mult': 1.2644113302042015, 'sideways_tsl_mult': 0.8759668167178681, 'sideways_time_stop': 86, 'sideways_use_sma': True, 'sideways_use_ema': True, 'sideways_use_atr': False, 'sideways_use_adx': False, 'sideways_use_spike': False, 'sideways_rsi_required': False}.
[I 2025-09-01 10:02:49,263] Trial 390 finished with values: [-1000000000.0, 1000000000.0] and parameters: {'p_sma': 20, 'p_std': 33, 'p_atr': 23, 'p_adx': 29, 'rsi_period': 65, 'ema1': 22, 'ema2': 59, 'slip_atr_k': 0.05935622966455017, 'slip_spread_k': 0.21797338424224671, 'spread_hl_frac': 0.007098560089954388, 'bb_std_mult': 2.7867193454269934, 'rsi_os': 40, 'rsi_ob': 75, 'vol_spike': 0.29223674561955526, 'adx_thresh': 26.098420207284995, 'atr_min_pct': 0.011447401776746722, 'atr_max_pct': 0.07691750706268836, 'tp_mult': 2.446193000371699, 'tsl_mult': 0.524587431081901, 'strategy': 'breakout', 'time_stop': 156, 'use_sma': True, 'use_atr': False, 'use_adx': True, 'use_ema': False, 'use_spike': False, 'rsi_required': False, 'edge_k': 0.8962198557202101, 'edge_cap': 0.5743737849000966, 'bull_strategy': 'mean_reversion', 'bull_bb_std_mult': 1.1835960862507142, 'bull_rsi_os': 23, 'bull_rsi_ob': 56, 'bull_adx_thresh': 21.683736919546536, 'bull_atr_min_pct': 0.016962573678317532, 'bull_atr_max_pct': 0.11912810024115567, 'bull_tp_mult': 2.70152852364458, 'bull_tsl_mult': 0.03415594274080285, 'bull_time_stop': 168, 'bull_use_sma': True, 'bull_use_ema': False, 'bull_use_atr': True, 'bull_use_adx': True, 'bull_use_spike': False, 'bull_rsi_required': True, 'bear_strategy': 'mean_reversion', 'bear_bb_std_mult': 3.3638362721805652, 'bear_rsi_os': 37, 'bear_rsi_ob': 47, 'bear_adx_thresh': 10.014327163820907, 'bear_atr_min_pct': 0.01778788798917136, 'bear_atr_max_pct': 0.07253358203726133, 'bear_tp_mult': 1.1466259145438213, 'bear_tsl_mult': 0.01984970633152544, 'bear_time_stop': 127, 'bear_use_sma': False, 'bear_use_ema': True, 'bear_use_atr': True, 'bear_use_adx': False, 'bear_use_spike': True, 'bear_rsi_required': True, 'sideways_strategy': 'mean_reversion', 'sideways_bb_std_mult': 3.356199817538129, 'sideways_rsi_os': 8, 'sideways_rsi_ob': 77, 'sideways_adx_thresh': 28.2636579806322, 'sideways_atr_min_pct': 0.001486254653380533, 'sideways_atr_max_pct': 0.12595175363404337, 'sideways_tp_mult': 1.3126049671136892, 'sideways_tsl_mult': 0.8556420238937174, 'sideways_time_stop': 123, 'sideways_use_sma': False, 'sideways_use_ema': True, 'sideways_use_atr': False, 'sideways_use_adx': False, 'sideways_use_spike': False, 'sideways_rsi_required': False}.
[I 2025-09-01 10:02:49,550] Trial 387 finished with values: [-1000000000.0, 1000000000.0] and parameters: {'p_sma': 8, 'p_std': 9, 'p_atr': 8, 'p_adx': 8, 'rsi_period': 62, 'ema1': 21, 'ema2': 55, 'slip_atr_k': 0.05742846270052482, 'slip_spread_k': 0.20710310652454042, 'spread_hl_frac': 0.03758424360590037, 'bb_std_mult': 2.798658257035113, 'rsi_os': 19, 'rsi_ob': 76, 'vol_spike': 0.27210759497937537, 'adx_thresh': 6.29607461963229, 'atr_min_pct': 0.011290611351959792, 'atr_max_pct': 0.057137779461950304, 'tp_mult': 2.6867261270091927, 'tsl_mult': 0.4434099131359687, 'strategy': 'breakout', 'time_stop': 26, 'use_sma': False, 'use_atr': False, 'use_adx': True, 'use_ema': False, 'use_spike': False, 'rsi_required': False, 'edge_k': 0.9078788198602772, 'edge_cap': 0.614867995152708, 'bull_strategy': 'mean_reversion', 'bull_bb_std_mult': 3.5601685280875417, 'bull_rsi_os': 53, 'bull_rsi_ob': 67, 'bull_adx_thresh': 34.26172169580085, 'bull_atr_min_pct': 0.02940388741276822, 'bull_atr_max_pct': 0.08952837343800593, 'bull_tp_mult': 2.3569060334662613, 'bull_tsl_mult': 0.03748454617062408, 'bull_time_stop': 166, 'bull_use_sma': False, 'bull_use_ema': False, 'bull_use_atr': True, 'bull_use_adx': True, 'bull_use_spike': False, 'bull_rsi_required': True, 'bear_strategy': 'mean_reversion', 'bear_bb_std_mult': 3.335184581644604, 'bear_rsi_os': 46, 'bear_rsi_ob': 47, 'bear_adx_thresh': 30.171547348079226, 'bear_atr_min_pct': 0.0086942329446229, 'bear_atr_max_pct': 0.01990843232797767, 'bear_tp_mult': 2.8487474338471652, 'bear_tsl_mult': 0.49530557540499137, 'bear_time_stop': 288, 'bear_use_sma': False, 'bear_use_ema': True, 'bear_use_atr': True, 'bear_use_adx': False, 'bear_use_spike': True, 'bear_rsi_required': True, 'sideways_strategy': 'mean_reversion', 'sideways_bb_std_mult': 3.409228839909809, 'sideways_rsi_os': 46, 'sideways_rsi_ob': 51, 'sideways_adx_thresh': 26.557915916954435, 'sideways_atr_min_pct': 0.027833577529230887, 'sideways_atr_max_pct': 0.010260321516099236, 'sideways_tp_mult': 1.437738891863107, 'sideways_tsl_mult': 0.8761649411539718, 'sideways_time_stop': 137, 'sideways_use_sma': True, 'sideways_use_ema': True, 'sideways_use_atr': True, 'sideways_use_adx': False, 'sideways_use_spike': False, 'sideways_rsi_required': False}.
[I 2025-09-01 10:03:29,241] Trial 394 finished with values: [-0.02806126581423818, 0.02789411140456915] and parameters: {'p_sma': 16, 'p_std': 31, 'p_atr': 27, 'p_adx': 23, 'rsi_period': 84, 'ema1': 13, 'ema2': 47, 'slip_atr_k': 0.04846759488149231, 'slip_spread_k': 0.7997928129257308, 'spread_hl_frac': 0.04961803004567096, 'bb_std_mult': 1.3974867178408097, 'rsi_os': 34, 'rsi_ob': 51, 'vol_spike': 0.01707442407838336, 'adx_thresh': 27.018009934699883, 'atr_min_pct': 0.02630139711487691, 'atr_max_pct': 0.06279639353778976, 'tp_mult': 2.613136955879795, 'tsl_mult': 0.3364429662166697, 'strategy': 'mean_reversion', 'time_stop': 133, 'use_sma': True, 'use_atr': False, 'use_adx': True, 'use_ema': True, 'use_spike': False, 'rsi_required': False, 'edge_k': 0.8144779278758776, 'edge_cap': 0.6563936689342484, 'bull_strategy': 'mean_reversion', 'bull_bb_std_mult': 0.9065785635138699, 'bull_rsi_os': 40, 'bull_rsi_ob': 54, 'bull_adx_thresh': 13.730275680451093, 'bull_atr_min_pct': 0.005048092731275775, 'bull_atr_max_pct': 0.149918157003401, 'bull_tp_mult': 1.9108227915423117, 'bull_tsl_mult': 0.7178484069316182, 'bull_time_stop': 176, 'bull_use_sma': True, 'bull_use_ema': False, 'bull_use_atr': True, 'bull_use_adx': True, 'bull_use_spike': False, 'bull_rsi_required': False, 'bear_strategy': 'breakout', 'bear_bb_std_mult': 3.2387261838952726, 'bear_rsi_os': 47, 'bear_rsi_ob': 45, 'bear_adx_thresh': 13.114576285174433, 'bear_atr_min_pct': 0.028102624966055555, 'bear_atr_max_pct': 0.07864731218058872, 'bear_tp_mult': 1.86218513097039, 'bear_tsl_mult': 0.4556072040515012, 'bear_time_stop': 145, 'bear_use_sma': False, 'bear_use_ema': True, 'bear_use_atr': True, 'bear_use_adx': False, 'bear_use_spike': True, 'bear_rsi_required': False, 'sideways_strategy': 'breakout', 'sideways_bb_std_mult': 3.2830516204676305, 'sideways_rsi_os': 51, 'sideways_rsi_ob': 49, 'sideways_adx_thresh': 27.85842960408064, 'sideways_atr_min_pct': 0.003255807216190104, 'sideways_atr_max_pct': 0.013815232121434234, 'sideways_tp_mult': 1.371309685651008, 'sideways_tsl_mult': 0.8277191839014224, 'sideways_time_stop': 194, 'sideways_use_sma': False, 'sideways_use_ema': False, 'sideways_use_atr': False, 'sideways_use_adx': False, 'sideways_use_spike': False, 'sideways_rsi_required': False}.
[I 2025-09-01 10:03:30,295] Trial 393 finished with values: [-1000000000.0, 1000000000.0] and parameters: {'p_sma': 16, 'p_std': 57, 'p_atr': 9, 'p_adx': 23, 'rsi_period': 18, 'ema1': 21, 'ema2': 55, 'slip_atr_k': 0.17291495261245754, 'slip_spread_k': 0.7214401844221515, 'spread_hl_frac': 0.029403697769880294, 'bb_std_mult': 3.315215409813998, 'rsi_os': 24, 'rsi_ob': 76, 'vol_spike': 0.2845006880172813, 'adx_thresh': 26.953692432870476, 'atr_min_pct': 0.009605342518707965, 'atr_max_pct': 0.07075861944268431, 'tp_mult': 2.621966060207976, 'tsl_mult': 0.01960965337681769, 'strategy': 'breakout', 'time_stop': 12, 'use_sma': True, 'use_atr': False, 'use_adx': True, 'use_ema': True, 'use_spike': False, 'rsi_required': False, 'edge_k': 0.6305253309402785, 'edge_cap': 0.9660866510688869, 'bull_strategy': 'mean_reversion', 'bull_bb_std_mult': 3.2864672788181224, 'bull_rsi_os': 18, 'bull_rsi_ob': 77, 'bull_adx_thresh': 23.949861012207208, 'bull_atr_min_pct': 0.004864586698825205, 'bull_atr_max_pct': 0.09061081159287653, 'bull_tp_mult': 1.893775233595831, 'bull_tsl_mult': 0.5639626530779486, 'bull_time_stop': 283, 'bull_use_sma': True, 'bull_use_ema': False, 'bull_use_atr': True, 'bull_use_adx': True, 'bull_use_spike': False, 'bull_rsi_required': False, 'bear_strategy': 'breakout', 'bear_bb_std_mult': 3.4570310554447645, 'bear_rsi_os': 47, 'bear_rsi_ob': 46, 'bear_adx_thresh': 30.864889130136536, 'bear_atr_min_pct': 0.027452497829802858, 'bear_atr_max_pct': 0.06527187141740509, 'bear_tp_mult': 2.5053737260361073, 'bear_tsl_mult': 0.15647404927197323, 'bear_time_stop': 143, 'bear_use_sma': False, 'bear_use_ema': True, 'bear_use_atr': True, 'bear_use_adx': False, 'bear_use_spike': True, 'bear_rsi_required': False, 'sideways_strategy': 'breakout', 'sideways_bb_std_mult': 1.6486304031774597, 'sideways_rsi_os': 11, 'sideways_rsi_ob': 56, 'sideways_adx_thresh': 27.335003510779153, 'sideways_atr_min_pct': 0.0032920533652444624, 'sideways_atr_max_pct': 0.1344222269341156, 'sideways_tp_mult': 2.4843186563814648, 'sideways_tsl_mult': 0.8242815027351292, 'sideways_time_stop': 140, 'sideways_use_sma': False, 'sideways_use_ema': False, 'sideways_use_atr': False, 'sideways_use_adx': False, 'sideways_use_spike': False, 'sideways_rsi_required': False}.
[I 2025-09-01 10:03:30,756] Trial 392 finished with values: [-1000000000.0, 1000000000.0] and parameters: {'p_sma': 47, 'p_std': 38, 'p_atr': 9, 'p_adx': 8, 'rsi_period': 65, 'ema1': 9, 'ema2': 54, 'slip_atr_k': 0.05734447106286765, 'slip_spread_k': 0.17819348104565483, 'spread_hl_frac': 0.03260431657001808, 'bb_std_mult': 3.0798585451266502, 'rsi_os': 33, 'rsi_ob': 75, 'vol_spike': 0.05703693293723916, 'adx_thresh': 5.421363526658822, 'atr_min_pct': 0.025372578104806757, 'atr_max_pct': 0.05684439361607338, 'tp_mult': 2.687371914020561, 'tsl_mult': 0.2577214129974721, 'strategy': 'breakout', 'time_stop': 132, 'use_sma': True, 'use_atr': False, 'use_adx': True, 'use_ema': True, 'use_spike': False, 'rsi_required': False, 'edge_k': 0.7959997076051186, 'edge_cap': 0.7101325550375835, 'bull_strategy': 'mean_reversion', 'bull_bb_std_mult': 0.9219720698882616, 'bull_rsi_os': 40, 'bull_rsi_ob': 54, 'bull_adx_thresh': 28.71544238787314, 'bull_atr_min_pct': 0.028907481339404677, 'bull_atr_max_pct': 0.07531944059960939, 'bull_tp_mult': 1.9196050229702688, 'bull_tsl_mult': 0.5665663042236319, 'bull_time_stop': 172, 'bull_use_sma': True, 'bull_use_ema': False, 'bull_use_atr': True, 'bull_use_adx': True, 'bull_use_spike': False, 'bull_rsi_required': False, 'bear_strategy': 'breakout', 'bear_bb_std_mult': 3.448662011971427, 'bear_rsi_os': 47, 'bear_rsi_ob': 95, 'bear_adx_thresh': 10.150036979878648, 'bear_atr_min_pct': 0.017978522101644495, 'bear_atr_max_pct': 0.06901966938838078, 'bear_tp_mult': 1.3017902203044602, 'bear_tsl_mult': 0.44651871028046386, 'bear_time_stop': 143, 'bear_use_sma': False, 'bear_use_ema': True, 'bear_use_atr': True, 'bear_use_adx': False, 'bear_use_spike': True, 'bear_rsi_required': False, 'sideways_strategy': 'breakout', 'sideways_bb_std_mult': 2.4109365351597813, 'sideways_rsi_os': 7, 'sideways_rsi_ob': 90, 'sideways_adx_thresh': 28.179994708477317, 'sideways_atr_min_pct': 0.027825234433636097, 'sideways_atr_max_pct': 0.13483258029660078, 'sideways_tp_mult': 1.3077121922557886, 'sideways_tsl_mult': 0.8529293498167307, 'sideways_time_stop': 138, 'sideways_use_sma': False, 'sideways_use_ema': True, 'sideways_use_atr': False, 'sideways_use_adx': False, 'sideways_use_spike': False, 'sideways_rsi_required': False}.
[I 2025-09-01 10:03:31,152] Trial 391 finished with values: [-1000000000.0, 1000000000.0] and parameters: {'p_sma': 19, 'p_std': 58, 'p_atr': 22, 'p_adx': 29, 'rsi_period': 65, 'ema1': 22, 'ema2': 54, 'slip_atr_k': 0.1738770097029601, 'slip_spread_k': 0.061715378403716326, 'spread_hl_frac': 0.024658879663910557, 'bb_std_mult': 3.0781214804608856, 'rsi_os': 34, 'rsi_ob': 75, 'vol_spike': 0.19387638215740394, 'adx_thresh': 5.2484203252086035, 'atr_min_pct': 0.009742434175239557, 'atr_max_pct': 0.10767268892090937, 'tp_mult': 2.6235428128302485, 'tsl_mult': 0.02273159825837629, 'strategy': 'breakout', 'time_stop': 131, 'use_sma': True, 'use_atr': False, 'use_adx': True, 'use_ema': True, 'use_spike': False, 'rsi_required': False, 'edge_k': 0.8752975644783337, 'edge_cap': 0.9008151534901301, 'bull_strategy': 'mean_reversion', 'bull_bb_std_mult': 3.2991407973756135, 'bull_rsi_os': 18, 'bull_rsi_ob': 91, 'bull_adx_thresh': 24.277331442818806, 'bull_atr_min_pct': 0.0049184714775551384, 'bull_atr_max_pct': 0.1302922734299231, 'bull_tp_mult': 2.5999887888867526, 'bull_tsl_mult': 0.06594209830729686, 'bull_time_stop': 175, 'bull_use_sma': True, 'bull_use_ema': False, 'bull_use_atr': True, 'bull_use_adx': True, 'bull_use_spike': False, 'bull_rsi_required': False, 'bear_strategy': 'breakout', 'bear_bb_std_mult': 3.461624306638647, 'bear_rsi_os': 47, 'bear_rsi_ob': 46, 'bear_adx_thresh': 18.555200994358046, 'bear_atr_min_pct': 0.027963330458535225, 'bear_atr_max_pct': 0.06508691562429864, 'bear_tp_mult': 1.869657956054445, 'bear_tsl_mult': 0.1566309240001389, 'bear_time_stop': 174, 'bear_use_sma': False, 'bear_use_ema': True, 'bear_use_atr': True, 'bear_use_adx': False, 'bear_use_spike': True, 'bear_rsi_required': False, 'sideways_strategy': 'breakout', 'sideways_bb_std_mult': 3.087166543573333, 'sideways_rsi_os': 7, 'sideways_rsi_ob': 60, 'sideways_adx_thresh': 23.907909345448402, 'sideways_atr_min_pct': 0.003332222728586142, 'sideways_atr_max_pct': 0.07200012277100466, 'sideways_tp_mult': 2.4451073467910334, 'sideways_tsl_mult': 0.8451371764881597, 'sideways_time_stop': 137, 'sideways_use_sma': False, 'sideways_use_ema': True, 'sideways_use_atr': False, 'sideways_use_adx': False, 'sideways_use_spike': False, 'sideways_rsi_required': False}.
[I 2025-09-01 10:03:31,992] Trial 396 finished with values: [-1000000000.0, 1000000000.0] and parameters: {'p_sma': 53, 'p_std': 49, 'p_atr': 22, 'p_adx': 22, 'rsi_period': 67, 'ema1': 12, 'ema2': 25, 'slip_atr_k': 0.04547555453544096, 'slip_spread_k': 0.12995502463796535, 'spread_hl_frac': 0.026428062543254516, 'bb_std_mult': 0.5633760912406547, 'rsi_os': 26, 'rsi_ob': 58, 'vol_spike': 0.19422619679144165, 'adx_thresh': 5.078610965644533, 'atr_min_pct': 0.027308032520600867, 'atr_max_pct': 0.015220546991506462, 'tp_mult': 2.8107661144522953, 'tsl_mult': 0.05588723497345548, 'strategy': 'breakout', 'time_stop': 167, 'use_sma': True, 'use_atr': False, 'use_adx': True, 'use_ema': False, 'use_spike': True, 'rsi_required': False, 'edge_k': 0.9770033987544466, 'edge_cap': 0.905380223002997, 'bull_strategy': 'breakout', 'bull_bb_std_mult': 1.5676549680105565, 'bull_rsi_os': 18, 'bull_rsi_ob': 50, 'bull_adx_thresh': 5.5556032672143285, 'bull_atr_min_pct': 0.02995632998038473, 'bull_atr_max_pct': 0.08790980768422095, 'bull_tp_mult': 2.5897693995027407, 'bull_tsl_mult': 0.41831492500389017, 'bull_time_stop': 150, 'bull_use_sma': True, 'bull_use_ema': True, 'bull_use_atr': True, 'bull_use_adx': True, 'bull_use_spike': True, 'bull_rsi_required': True, 'bear_strategy': 'mean_reversion', 'bear_bb_std_mult': 3.4522478842577144, 'bear_rsi_os': 49, 'bear_rsi_ob': 45, 'bear_adx_thresh': 14.577803903021426, 'bear_atr_min_pct': 0.019023291438658014, 'bear_atr_max_pct': 0.09723071553653088, 'bear_tp_mult': 1.3910543045892527, 'bear_tsl_mult': 0.4608600422964988, 'bear_time_stop': 166, 'bear_use_sma': False, 'bear_use_ema': False, 'bear_use_atr': True, 'bear_use_adx': True, 'bear_use_spike': True, 'bear_rsi_required': False, 'sideways_strategy': 'breakout', 'sideways_bb_std_mult': 3.345094694630158, 'sideways_rsi_os': 28, 'sideways_rsi_ob': 81, 'sideways_adx_thresh': 23.90940587344624, 'sideways_atr_min_pct': 0.011243137181220266, 'sideways_atr_max_pct': 0.07070252386602988, 'sideways_tp_mult': 1.31282974107208, 'sideways_tsl_mult': 0.192488193133178, 'sideways_time_stop': 52, 'sideways_use_sma': False, 'sideways_use_ema': True, 'sideways_use_atr': False, 'sideways_use_adx': False, 'sideways_use_spike': False, 'sideways_rsi_required': False}.
