[I 2025-09-01 10:23:10,865] Trial 511 finished with values: [-1000000000.0, 1000000000.0] and parameters: {'p_sma': 24, 'p_std': 58, 'p_atr': 29, 'p_adx': 22, 'rsi_period': 46, 'ema1': 20, 'ema2': 60, 'slip_atr_k': 0.051950681668550186, 'slip_spread_k': 0.1560808134740189, 'spread_hl_frac': 0.022426994664380497, 'bb_std_mult': 3.155915493678915, 'rsi_os': 20, 'rsi_ob': 74, 'vol_spike': 0.1883522374047119, 'adx_thresh': 6.585498744072293, 'atr_min_pct': 0.010119164054762443, 'atr_max_pct': 0.12264521896683284, 'tp_mult': 2.207769574357431, 'tsl_mult': 0.0007723475472358188, 'strategy': 'breakout', 'time_stop': 82, 'use_sma': True, 'use_atr': False, 'use_adx': True, 'use_ema': False, 'use_spike': True, 'rsi_required': False, 'edge_k': 0.6325837157415783, 'edge_cap': 0.5611378841018324, 'bull_strategy': 'mean_reversion', 'bull_bb_std_mult': 0.6934513852987431, 'bull_rsi_os': 17, 'bull_rsi_ob': 52, 'bull_adx_thresh': 32.29088800296193, 'bull_atr_min_pct': 0.029409762855858883, 'bull_atr_max_pct': 0.07776925883921999, 'bull_tp_mult': 1.9295732653197974, 'bull_tsl_mult': 0.04558381594413399, 'bull_time_stop': 219, 'bull_use_sma': False, 'bull_use_ema': False, 'bull_use_atr': True, 'bull_use_adx': True, 'bull_use_spike': False, 'bull_rsi_required': True, 'bear_strategy': 'mean_reversion', 'bear_bb_std_mult': 3.517224446063974, 'bear_rsi_os': 32, 'bear_rsi_ob': 71, 'bear_adx_thresh': 34.99432086899296, 'bear_atr_min_pct': 0.0035109417171527556, 'bear_atr_max_pct': 0.1465091650036745, 'bear_tp_mult': 1.8936895961217595, 'bear_tsl_mult': 0.4242119973737635, 'bear_time_stop': 293, 'bear_use_sma': False, 'bear_use_ema': True, 'bear_use_atr': True, 'bear_use_adx': False, 'bear_use_spike': True, 'bear_rsi_required': False, 'sideways_strategy': 'breakout', 'sideways_bb_std_mult': 3.149125042791864, 'sideways_rsi_os': 49, 'sideways_rsi_ob': 48, 'sideways_adx_thresh': 28.536098396935305, 'sideways_atr_min_pct': 0.02573484354796094, 'sideways_atr_max_pct': 0.06529127976488437, 'sideways_tp_mult': 1.31260395961457, 'sideways_tsl_mult': 0.82260689514675, 'sideways_time_stop': 105, 'sideways_use_sma': False, 'sideways_use_ema': True, 'sideways_use_atr': False, 'sideways_use_adx': False, 'sideways_use_spike': False, 'sideways_rsi_required': False}.
[I 2025-09-01 10:23:49,221] Trial 517 finished with values: [-1000000000.0, 1000000000.0] and parameters: {'p_sma': 24, 'p_std': 47, 'p_atr': 9, 'p_adx': 28, 'rsi_period': 69, 'ema1': 9, 'ema2': 44, 'slip_atr_k': 0.1947312908242289, 'slip_spread_k': 0.5839985598280809, 'spread_hl_frac': 0.018955033556519903, 'bb_std_mult': 2.3868125221123035, 'rsi_os': 27, 'rsi_ob': 72, 'vol_spike': 0.27982549439283755, 'adx_thresh': 5.547937414119355, 'atr_min_pct': 0.025408202350303624, 'atr_max_pct': 0.10299929678106498, 'tp_mult': 2.753184889193788, 'tsl_mult': 0.28818268766561783, 'strategy': 'breakout', 'time_stop': 160, 'use_sma': True, 'use_atr': False, 'use_adx': True, 'use_ema': True, 'use_spike': False, 'rsi_required': False, 'edge_k': 0.8915446361113029, 'edge_cap': 0.6594024311656403, 'bull_strategy': 'mean_reversion', 'bull_bb_std_mult': 2.7924739023680436, 'bull_rsi_os': 41, 'bull_rsi_ob': 74, 'bull_adx_thresh': 6.6787890348714045, 'bull_atr_min_pct': 0.029942617343157674, 'bull_atr_max_pct': 0.14687451872457633, 'bull_tp_mult': 1.85306143872411, 'bull_tsl_mult': 0.28935627700804506, 'bull_time_stop': 151, 'bull_use_sma': True, 'bull_use_ema': False, 'bull_use_atr': True, 'bull_use_adx': False, 'bull_use_spike': False, 'bull_rsi_required': False, 'bear_strategy': 'breakout', 'bear_bb_std_mult': 3.5253686239871436, 'bear_rsi_os': 18, 'bear_rsi_ob': 63, 'bear_adx_thresh': 13.438693009441304, 'bear_atr_min_pct': 0.01809033631521628, 'bear_atr_max_pct': 0.07502109472527074, 'bear_tp_mult': 2.0232992735754163, 'bear_tsl_mult': 0.4884945633719166, 'bear_time_stop': 267, 'bear_use_sma': False, 'bear_use_ema': False, 'bear_use_atr': True, 'bear_use_adx': False, 'bear_use_spike': True, 'bear_rsi_required': False, 'sideways_strategy': 'breakout', 'sideways_bb_std_mult': 3.3320611972413707, 'sideways_rsi_os': 17, 'sideways_rsi_ob': 66, 'sideways_adx_thresh': 27.94681996048779, 'sideways_atr_min_pct': 0.013768970307534843, 'sideways_atr_max_pct': 0.06095534210983138, 'sideways_tp_mult': 1.4637681686897255, 'sideways_tsl_mult': 0.865234277585131, 'sideways_time_stop': 242, 'sideways_use_sma': True, 'sideways_use_ema': False, 'sideways_use_atr': True, 'sideways_use_adx': False, 'sideways_use_spike': False, 'sideways_rsi_required': False}.
[I 2025-09-01 10:23:50,613] Trial 516 finished with values: [-0.03693487772043447, 0.03666261204003941] and parameters: {'p_sma': 21, 'p_std': 46, 'p_atr': 29, 'p_adx': 21, 'rsi_period': 55, 'ema1': 9, 'ema2': 53, 'slip_atr_k': 0.08784887446439002, 'slip_spread_k': 0.2445244366691688, 'spread_hl_frac': 0.027584091225775705, 'bb_std_mult': 0.8328551762010898, 'rsi_os': 24, 'rsi_ob': 67, 'vol_spike': 0.28220097849487114, 'adx_thresh': 5.680890942076289, 'atr_min_pct': 0.014065795330988588, 'atr_max_pct': 0.08185320923794762, 'tp_mult': 2.0073646840781025, 'tsl_mult': 0.09064275859087344, 'strategy': 'breakout', 'time_stop': 146, 'use_sma': True, 'use_atr': False, 'use_adx': True, 'use_ema': True, 'use_spike': False, 'rsi_required': False, 'edge_k': 0.9048484676070686, 'edge_cap': 0.6575183056991284, 'bull_strategy': 'mean_reversion', 'bull_bb_std_mult': 3.261190447877259, 'bull_rsi_os': 19, 'bull_rsi_ob': 73, 'bull_adx_thresh': 6.825258664948651, 'bull_atr_min_pct': 0.014771879364763433, 'bull_atr_max_pct': 0.030905028099325167, 'bull_tp_mult': 1.0429271402388884, 'bull_tsl_mult': 0.9778608844189974, 'bull_time_stop': 150, 'bull_use_sma': True, 'bull_use_ema': False, 'bull_use_atr': True, 'bull_use_adx': False, 'bull_use_spike': False, 'bull_rsi_required': False, 'bear_strategy': 'breakout', 'bear_bb_std_mult': 3.4740512989939707, 'bear_rsi_os': 9, 'bear_rsi_ob': 46, 'bear_adx_thresh': 13.349280793527804, 'bear_atr_min_pct': 0.0178134517179423, 'bear_atr_max_pct': 0.07384670674389487, 'bear_tp_mult': 2.42442953527902, 'bear_tsl_mult': 0.7346300350213057, 'bear_time_stop': 265, 'bear_use_sma': False, 'bear_use_ema': False, 'bear_use_atr': True, 'bear_use_adx': False, 'bear_use_spike': True, 'bear_rsi_required': False, 'sideways_strategy': 'breakout', 'sideways_bb_std_mult': 3.4021125249582, 'sideways_rsi_os': 51, 'sideways_rsi_ob': 76, 'sideways_adx_thresh': 14.366125286646593, 'sideways_atr_min_pct': 0.0031038571915105867, 'sideways_atr_max_pct': 0.13308157522806474, 'sideways_tp_mult': 2.0212872208982695, 'sideways_tsl_mult': 0.7140840245802967, 'sideways_time_stop': 51, 'sideways_use_sma': True, 'sideways_use_ema': False, 'sideways_use_atr': True, 'sideways_use_adx': False, 'sideways_use_spike': False, 'sideways_rsi_required': False}.
[I 2025-09-01 10:23:51,870] Trial 514 finished with values: [-1000000000.0, 1000000000.0] and parameters: {'p_sma': 17, 'p_std': 44, 'p_atr': 29, 'p_adx': 22, 'rsi_period': 16, 'ema1': 16, 'ema2': 60, 'slip_atr_k': 0.10339391574031487, 'slip_spread_k': 0.5883862852499847, 'spread_hl_frac': 0.019339762624695462, 'bb_std_mult': 3.3216464597390587, 'rsi_os': 20, 'rsi_ob': 64, 'vol_spike': 0.17502522957184324, 'adx_thresh': 5.755088206884066, 'atr_min_pct': 0.025390834337225825, 'atr_max_pct': 0.07372693850585611, 'tp_mult': 2.610357326769148, 'tsl_mult': 0.057580661552826706, 'strategy': 'breakout', 'time_stop': 164, 'use_sma': True, 'use_atr': False, 'use_adx': True, 'use_ema': False, 'use_spike': False, 'rsi_required': False, 'edge_k': 0.16954293129315523, 'edge_cap': 0.5671532160026592, 'bull_strategy': 'mean_reversion', 'bull_bb_std_mult': 2.251172465855242, 'bull_rsi_os': 19, 'bull_rsi_ob': 92, 'bull_adx_thresh': 29.21207648689454, 'bull_atr_min_pct': 0.00802898337257615, 'bull_atr_max_pct': 0.013354445956290636, 'bull_tp_mult': 1.6168544502599729, 'bull_tsl_mult': 0.8036429124065985, 'bull_time_stop': 163, 'bull_use_sma': True, 'bull_use_ema': False, 'bull_use_atr': True, 'bull_use_adx': True, 'bull_use_spike': False, 'bull_rsi_required': True, 'bear_strategy': 'mean_reversion', 'bear_bb_std_mult': 1.7268663036571936, 'bear_rsi_os': 47, 'bear_rsi_ob': 45, 'bear_adx_thresh': 13.299984158206389, 'bear_atr_min_pct': 0.008430978888514865, 'bear_atr_max_pct': 0.07389250610226526, 'bear_tp_mult': 1.237729787359267, 'bear_tsl_mult': 0.41574127190837373, 'bear_time_stop': 135, 'bear_use_sma': False, 'bear_use_ema': True, 'bear_use_atr': True, 'bear_use_adx': False, 'bear_use_spike': True, 'bear_rsi_required': False, 'sideways_strategy': 'breakout', 'sideways_bb_std_mult': 3.402579000753714, 'sideways_rsi_os': 21, 'sideways_rsi_ob': 76, 'sideways_adx_thresh': 26.033908966069486, 'sideways_atr_min_pct': 0.0032632924568464575, 'sideways_atr_max_pct': 0.06103994185704272, 'sideways_tp_mult': 2.01897440632998, 'sideways_tsl_mult': 0.8634727073185331, 'sideways_time_stop': 192, 'sideways_use_sma': False, 'sideways_use_ema': True, 'sideways_use_atr': True, 'sideways_use_adx': False, 'sideways_use_spike': False, 'sideways_rsi_required': False}.
[I 2025-09-01 10:23:52,290] Trial 515 finished with values: [-1000000000.0, 1000000000.0] and parameters: {'p_sma': 24, 'p_std': 59, 'p_atr': 29, 'p_adx': 26, 'rsi_period': 69, 'ema1': 20, 'ema2': 46, 'slip_atr_k': 0.23688457628171172, 'slip_spread_k': 0.049637180023788585, 'spread_hl_frac': 0.02762561511852787, 'bb_std_mult': 3.3108470032381625, 'rsi_os': 20, 'rsi_ob': 79, 'vol_spike': 0.2879927173708287, 'adx_thresh': 25.52827902978863, 'atr_min_pct': 0.010357182043019365, 'atr_max_pct': 0.0480387737394047, 'tp_mult': 2.75480378335061, 'tsl_mult': 0.05651840966076048, 'strategy': 'breakout', 'time_stop': 239, 'use_sma': True, 'use_atr': False, 'use_adx': True, 'use_ema': False, 'use_spike': True, 'rsi_required': False, 'edge_k': 0.17326895883711746, 'edge_cap': 0.5678624198972217, 'bull_strategy': 'mean_reversion', 'bull_bb_std_mult': 0.8530679952115072, 'bull_rsi_os': 19, 'bull_rsi_ob': 87, 'bull_adx_thresh': 29.281310130876115, 'bull_atr_min_pct': 0.029995433515323706, 'bull_atr_max_pct': 0.08005162941433978, 'bull_tp_mult': 1.6038047806250033, 'bull_tsl_mult': 0.19675418340618378, 'bull_time_stop': 273, 'bull_use_sma': False, 'bull_use_ema': False, 'bull_use_atr': True, 'bull_use_adx': True, 'bull_use_spike': False, 'bull_rsi_required': True, 'bear_strategy': 'mean_reversion', 'bear_bb_std_mult': 1.7458189084847267, 'bear_rsi_os': 9, 'bear_rsi_ob': 62, 'bear_adx_thresh': 13.530033668492413, 'bear_atr_min_pct': 0.018115555683352096, 'bear_atr_max_pct': 0.07381373734138694, 'bear_tp_mult': 1.2385985139433333, 'bear_tsl_mult': 0.48988489264831303, 'bear_time_stop': 131, 'bear_use_sma': False, 'bear_use_ema': True, 'bear_use_atr': True, 'bear_use_adx': False, 'bear_use_spike': True, 'bear_rsi_required': False, 'sideways_strategy': 'breakout', 'sideways_bb_std_mult': 2.2379734853833035, 'sideways_rsi_os': 52, 'sideways_rsi_ob': 67, 'sideways_adx_thresh': 28.912286845060684, 'sideways_atr_min_pct': 0.013715156296907852, 'sideways_atr_max_pct': 0.06065167992263806, 'sideways_tp_mult': 2.40355944194379, 'sideways_tsl_mult': 0.8671063310615175, 'sideways_time_stop': 193, 'sideways_use_sma': False, 'sideways_use_ema': True, 'sideways_use_atr': True, 'sideways_use_adx': False, 'sideways_use_spike': False, 'sideways_rsi_required': False}.
[I 2025-09-01 10:24:32,856] Trial 519 finished with values: [-1000000000.0, 1000000000.0] and parameters: {'p_sma': 14, 'p_std': 43, 'p_atr': 28, 'p_adx': 12, 'rsi_period': 22, 'ema1': 21, 'ema2': 40, 'slip_atr_k': 0.05946599474099504, 'slip_spread_k': 0.20856108049508157, 'spread_hl_frac': 0.0033523042683655177, 'bb_std_mult': 3.3498211879873154, 'rsi_os': 22, 'rsi_ob': 62, 'vol_spike': 0.11768838295738948, 'adx_thresh': 21.52842727930151, 'atr_min_pct': 0.027683854846009173, 'atr_max_pct': 0.07172235040233862, 'tp_mult': 2.637850876685725, 'tsl_mult': 0.05884497718622772, 'strategy': 'breakout', 'time_stop': 178, 'use_sma': False, 'use_atr': False, 'use_adx': True, 'use_ema': False, 'use_spike': False, 'rsi_required': False, 'edge_k': 0.9659866566724729, 'edge_cap': 0.46920634051187676, 'bull_strategy': 'mean_reversion', 'bull_bb_std_mult': 0.8654707343675637, 'bull_rsi_os': 16, 'bull_rsi_ob': 56, 'bull_adx_thresh': 9.685061391413038, 'bull_atr_min_pct': 0.029994866863303205, 'bull_atr_max_pct': 0.08491570243139701, 'bull_tp_mult': 1.2590910978609382, 'bull_tsl_mult': 0.21620644081586254, 'bull_time_stop': 273, 'bull_use_sma': True, 'bull_use_ema': False, 'bull_use_atr': True, 'bull_use_adx': True, 'bull_use_spike': False, 'bull_rsi_required': True, 'bear_strategy': 'mean_reversion', 'bear_bb_std_mult': 3.218844873330442, 'bear_rsi_os': 34, 'bear_rsi_ob': 45, 'bear_adx_thresh': 15.374616316058987, 'bear_atr_min_pct': 0.01711525268075966, 'bear_atr_max_pct': 0.060376423167536275, 'bear_tp_mult': 1.010954675724022, 'bear_tsl_mult': 0.7546978090606433, 'bear_time_stop': 249, 'bear_use_sma': False, 'bear_use_ema': True, 'bear_use_atr': True, 'bear_use_adx': False, 'bear_use_spike': True, 'bear_rsi_required': True, 'sideways_strategy': 'mean_reversion', 'sideways_bb_std_mult': 1.9224628908914556, 'sideways_rsi_os': 53, 'sideways_rsi_ob': 49, 'sideways_adx_thresh': 29.13315867329098, 'sideways_atr_min_pct': 0.003632813442876664, 'sideways_atr_max_pct': 0.09331777346817863, 'sideways_tp_mult': 1.2491005013627203, 'sideways_tsl_mult': 0.8453720787353871, 'sideways_time_stop': 208, 'sideways_use_sma': False, 'sideways_use_ema': True, 'sideways_use_atr': False, 'sideways_use_adx': False, 'sideways_use_spike': False, 'sideways_rsi_required': False}.
[I 2025-09-01 10:24:33,567] Trial 518 finished with values: [-0.048062308735126846, 0.048173180770524134] and parameters: {'p_sma': 39, 'p_std': 43, 'p_atr': 29, 'p_adx': 22, 'rsi_period': 62, 'ema1': 20, 'ema2': 53, 'slip_atr_k': 0.05709483355957586, 'slip_spread_k': 0.5370619673510922, 'spread_hl_frac': 0.027605988506875064, 'bb_std_mult': 3.2678788707693776, 'rsi_os': 31, 'rsi_ob': 70, 'vol_spike': 0.28826190032522386, 'adx_thresh': 26.48601133223587, 'atr_min_pct': 0.022906192752158303, 'atr_max_pct': 0.049586771590689846, 'tp_mult': 2.635637569114792, 'tsl_mult': 0.09616535365546704, 'strategy': 'breakout', 'time_stop': 239, 'use_sma': True, 'use_atr': False, 'use_adx': True, 'use_ema': False, 'use_spike': False, 'rsi_required': False, 'edge_k': 1.7886289330148655, 'edge_cap': 0.6321347938820222, 'bull_strategy': 'mean_reversion', 'bull_bb_std_mult': 1.3182790382884997, 'bull_rsi_os': 19, 'bull_rsi_ob': 56, 'bull_adx_thresh': 7.412746263249948, 'bull_atr_min_pct': 0.010660682094549227, 'bull_atr_max_pct': 0.08058714605348036, 'bull_tp_mult': 2.4474572825228096, 'bull_tsl_mult': 0.08966196195480103, 'bull_time_stop': 289, 'bull_use_sma': True, 'bull_use_ema': False, 'bull_use_atr': True, 'bull_use_adx': True, 'bull_use_spike': False, 'bull_rsi_required': True, 'bear_strategy': 'mean_reversion', 'bear_bb_std_mult': 1.5961955266808607, 'bear_rsi_os': 49, 'bear_rsi_ob': 88, 'bear_adx_thresh': 11.47972381285387, 'bear_atr_min_pct': 0.00827678323437294, 'bear_atr_max_pct': 0.0643771483907014, 'bear_tp_mult': 2.952087433411002, 'bear_tsl_mult': 0.08989799259907194, 'bear_time_stop': 130, 'bear_use_sma': False, 'bear_use_ema': True, 'bear_use_atr': True, 'bear_use_adx': False, 'bear_use_spike': True, 'bear_rsi_required': False, 'sideways_strategy': 'breakout', 'sideways_bb_std_mult': 1.9377846911311518, 'sideways_rsi_os': 52, 'sideways_rsi_ob': 72, 'sideways_adx_thresh': 5.889206292502696, 'sideways_atr_min_pct': 0.0032018289050257365, 'sideways_atr_max_pct': 0.0706427491046289, 'sideways_tp_mult': 2.594619329258082, 'sideways_tsl_mult': 0.37682461787516913, 'sideways_time_stop': 192, 'sideways_use_sma': False, 'sideways_use_ema': True, 'sideways_use_atr': True, 'sideways_use_adx': False, 'sideways_use_spike': False, 'sideways_rsi_required': False}.
[I 2025-09-01 10:24:35,216] Trial 521 finished with values: [-1000000000.0, 1000000000.0] and parameters: {'p_sma': 10, 'p_std': 43, 'p_atr': 27, 'p_adx': 21, 'rsi_period': 33, 'ema1': 30, 'ema2': 48, 'slip_atr_k': 0.06182261600918064, 'slip_spread_k': 0.8275445273787732, 'spread_hl_frac': 0.035562890796543525, 'bb_std_mult': 3.25328171722232, 'rsi_os': 33, 'rsi_ob': 76, 'vol_spike': 0.015762462461877957, 'adx_thresh': 5.007109850670971, 'atr_min_pct': 0.023609028217576135, 'atr_max_pct': 0.07125243435985643, 'tp_mult': 2.641155426332606, 'tsl_mult': 0.029511930401436508, 'strategy': 'breakout', 'time_stop': 150, 'use_sma': False, 'use_atr': True, 'use_adx': True, 'use_ema': False, 'use_spike': False, 'rsi_required': True, 'edge_k': 0.8358930049975848, 'edge_cap': 0.6287181619319353, 'bull_strategy': 'breakout', 'bull_bb_std_mult': 3.1199565651983363, 'bull_rsi_os': 16, 'bull_rsi_ob': 90, 'bull_adx_thresh': 7.47520737090773, 'bull_atr_min_pct': 0.028888607186194255, 'bull_atr_max_pct': 0.08434976651903917, 'bull_tp_mult': 2.0136578715451483, 'bull_tsl_mult': 0.09609117490361191, 'bull_time_stop': 256, 'bull_use_sma': True, 'bull_use_ema': True, 'bull_use_atr': False, 'bull_use_adx': True, 'bull_use_spike': True, 'bull_rsi_required': True, 'bear_strategy': 'mean_reversion', 'bear_bb_std_mult': 1.595120750839909, 'bear_rsi_os': 44, 'bear_rsi_ob': 47, 'bear_adx_thresh': 11.566305778868166, 'bear_atr_min_pct': 0.01713699531771471, 'bear_atr_max_pct': 0.06099569342889638, 'bear_tp_mult': 1.2955550485816814, 'bear_tsl_mult': 0.6473035693648538, 'bear_time_stop': 33, 'bear_use_sma': True, 'bear_use_ema': True, 'bear_use_atr': True, 'bear_use_adx': True, 'bear_use_spike': False, 'bear_rsi_required': True, 'sideways_strategy': 'mean_reversion', 'sideways_bb_std_mult': 2.3072529463441427, 'sideways_rsi_os': 33, 'sideways_rsi_ob': 54, 'sideways_adx_thresh': 11.918953695735949, 'sideways_atr_min_pct': 0.014665773867724942, 'sideways_atr_max_pct': 0.05015238241393099, 'sideways_tp_mult': 1.2493525042538758, 'sideways_tsl_mult': 0.8900724570364859, 'sideways_time_stop': 170, 'sideways_use_sma': False, 'sideways_use_ema': True, 'sideways_use_atr': False, 'sideways_use_adx': True, 'sideways_use_spike': True, 'sideways_rsi_required': True}.
[I 2025-09-01 10:24:35,737] Trial 520 finished with values: [-1000000000.0, 1000000000.0] and parameters: {'p_sma': 19, 'p_std': 43, 'p_atr': 27, 'p_adx': 12, 'rsi_period': 65, 'ema1': 22, 'ema2': 58, 'slip_atr_k': 0.011543976098853034, 'slip_spread_k': 0.04803620673263603, 'spread_hl_frac': 0.03563772459854089, 'bb_std_mult': 3.2553205691648657, 'rsi_os': 22, 'rsi_ob': 85, 'vol_spike': 0.015787125114933048, 'adx_thresh': 6.065766074981661, 'atr_min_pct': 0.007997521977458923, 'atr_max_pct': 0.04447927041862479, 'tp_mult': 1.5029952764518715, 'tsl_mult': 0.0443460240414465, 'strategy': 'breakout', 'time_stop': 151, 'use_sma': False, 'use_atr': False, 'use_adx': True, 'use_ema': False, 'use_spike': False, 'rsi_required': True, 'edge_k': 1.8103224278650858, 'edge_cap': 0.5842092445277559, 'bull_strategy': 'breakout', 'bull_bb_std_mult': 0.8602368531161757, 'bull_rsi_os': 16, 'bull_rsi_ob': 48, 'bull_adx_thresh': 7.403903637147776, 'bull_atr_min_pct': 0.010558184214747624, 'bull_atr_max_pct': 0.08456609743143678, 'bull_tp_mult': 2.442046635763793, 'bull_tsl_mult': 0.0948482197198699, 'bull_time_stop': 277, 'bull_use_sma': True, 'bull_use_ema': True, 'bull_use_atr': True, 'bull_use_adx': True, 'bull_use_spike': True, 'bull_rsi_required': True, 'bear_strategy': 'mean_reversion', 'bear_bb_std_mult': 3.228060175527955, 'bear_rsi_os': 44, 'bear_rsi_ob': 74, 'bear_adx_thresh': 11.51956297977883, 'bear_atr_min_pct': 0.02837601017648609, 'bear_atr_max_pct': 0.044251891667928256, 'bear_tp_mult': 1.2931182287443894, 'bear_tsl_mult': 0.634260835387945, 'bear_time_stop': 33, 'bear_use_sma': True, 'bear_use_ema': True, 'bear_use_atr': True, 'bear_use_adx': True, 'bear_use_spike': True, 'bear_rsi_required': True, 'sideways_strategy': 'breakout', 'sideways_bb_std_mult': 2.8298010649955003, 'sideways_rsi_os': 33, 'sideways_rsi_ob': 89, 'sideways_adx_thresh': 28.688727244963893, 'sideways_atr_min_pct': 0.01936692779542253, 'sideways_atr_max_pct': 0.07143746388268514, 'sideways_tp_mult': 1.2477034714963073, 'sideways_tsl_mult': 0.8431849338397656, 'sideways_time_stop': 207, 'sideways_use_sma': False, 'sideways_use_ema': True, 'sideways_use_atr': False, 'sideways_use_adx': False, 'sideways_use_spike': True, 'sideways_rsi_required': True}.
