[I 2025-09-01 09:31:33,267] Trial 206 finished with values: [-1000000000.0, 1000000000.0] and parameters: {'p_sma': 26, 'p_std': 53, 'p_atr': 25, 'p_adx': 26, 'rsi_period': 65, 'ema1': 19, 'ema2': 18, 'slip_atr_k': 0.04591586295431125, 'slip_spread_k': 0.28620179051449984, 'spread_hl_frac': 0.013517880401720264, 'bb_std_mult': 2.7352300023777647, 'rsi_os': 10, 'rsi_ob': 94, 'vol_spike': 0.2680748700681341, 'adx_thresh': 19.03478067240099, 'atr_min_pct': 0.012681809530882483, 'atr_max_pct': 0.144567760970182, 'tp_mult': 1.8717072589180082, 'tsl_mult': 0.024594642129536784, 'strategy': 'breakout', 'time_stop': 187, 'use_sma': True, 'use_atr': True, 'use_adx': True, 'use_ema': False, 'use_spike': False, 'rsi_required': False, 'edge_k': 0.7801201099232923, 'edge_cap': 0.9267735549428118, 'bull_strategy': 'mean_reversion', 'bull_bb_std_mult': 1.3195715002627466, 'bull_rsi_os': 17, 'bull_rsi_ob': 57, 'bull_adx_thresh': 7.632713411673322, 'bull_atr_min_pct': 0.028689324017365653, 'bull_atr_max_pct': 0.13139266478803122, 'bull_tp_mult': 2.112541245037841, 'bull_tsl_mult': 0.09487850679230432, 'bull_time_stop': 77, 'bull_use_sma': True, 'bull_use_ema': False, 'bull_use_atr': False, 'bull_use_adx': False, 'bull_use_spike': False, 'bull_rsi_required': True, 'bear_strategy': 'mean_reversion', 'bear_bb_std_mult': 1.980416935274707, 'bear_rsi_os': 45, 'bear_rsi_ob': 67, 'bear_adx_thresh': 29.918497763120982, 'bear_atr_min_pct': 0.015192637367412061, 'bear_atr_max_pct': 0.11496647041175734, 'bear_tp_mult': 2.0972876481382308, 'bear_tsl_mult': 0.4019289788038254, 'bear_time_stop': 221, 'bear_use_sma': False, 'bear_use_ema': True, 'bear_use_atr': True, 'bear_use_adx': False, 'bear_use_spike': False, 'bear_rsi_required': False, 'sideways_strategy': 'breakout', 'sideways_bb_std_mult': 1.2473285246026233, 'sideways_rsi_os': 42, 'sideways_rsi_ob': 48, 'sideways_adx_thresh': 28.693193076534058, 'sideways_atr_min_pct': 0.02586465158679534, 'sideways_atr_max_pct': 0.06948352073799974, 'sideways_tp_mult': 1.8050881997743573, 'sideways_tsl_mult': 0.48650921554769155, 'sideways_time_stop': 210, 'sideways_use_sma': False, 'sideways_use_ema': True, 'sideways_use_atr': False, 'sideways_use_adx': False, 'sideways_use_spike': False, 'sideways_rsi_required': False}.
[I 2025-09-01 09:31:33,665] Trial 205 finished with values: [-1000000000.0, 1000000000.0] and parameters: {'p_sma': 27, 'p_std': 22, 'p_atr': 23, 'p_adx': 11, 'rsi_period': 65, 'ema1': 26, 'ema2': 37, 'slip_atr_k': 0.04474859387320802, 'slip_spread_k': 0.290475523124869, 'spread_hl_frac': 0.028153514382028042, 'bb_std_mult': 1.6939468669718165, 'rsi_os': 10, 'rsi_ob': 95, 'vol_spike': 0.09106544685596403, 'adx_thresh': 5.950705556000677, 'atr_min_pct': 0.01351087126838361, 'atr_max_pct': 0.05968516750339246, 'tp_mult': 2.997105084961425, 'tsl_mult': 0.7905891936088604, 'strategy': 'breakout', 'time_stop': 199, 'use_sma': True, 'use_atr': True, 'use_adx': True, 'use_ema': False, 'use_spike': False, 'rsi_required': False, 'edge_k': 0.6947182896036694, 'edge_cap': 0.11445469939212466, 'bull_strategy': 'mean_reversion', 'bull_bb_std_mult': 0.7491229956266755, 'bull_rsi_os': 17, 'bull_rsi_ob': 57, 'bull_adx_thresh': 5.831422140096143, 'bull_atr_min_pct': 0.01465375327535743, 'bull_atr_max_pct': 0.06081622760638217, 'bull_tp_mult': 1.1895937473781912, 'bull_tsl_mult': 0.7795868146930425, 'bull_time_stop': 211, 'bull_use_sma': True, 'bull_use_ema': False, 'bull_use_atr': False, 'bull_use_adx': False, 'bull_use_spike': False, 'bull_rsi_required': True, 'bear_strategy': 'mean_reversion', 'bear_bb_std_mult': 3.5460445705346797, 'bear_rsi_os': 45, 'bear_rsi_ob': 67, 'bear_adx_thresh': 13.77678733665476, 'bear_atr_min_pct': 0.005997173701823065, 'bear_atr_max_pct': 0.035855224668569316, 'bear_tp_mult': 2.1023334534436153, 'bear_tsl_mult': 0.4058528379431611, 'bear_time_stop': 265, 'bear_use_sma': False, 'bear_use_ema': True, 'bear_use_atr': True, 'bear_use_adx': False, 'bear_use_spike': False, 'bear_rsi_required': False, 'sideways_strategy': 'breakout', 'sideways_bb_std_mult': 1.891441279498832, 'sideways_rsi_os': 42, 'sideways_rsi_ob': 48, 'sideways_adx_thresh': 28.724276310132787, 'sideways_atr_min_pct': 0.01680514287149357, 'sideways_atr_max_pct': 0.06839164512656201, 'sideways_tp_mult': 2.783658636407665, 'sideways_tsl_mult': 0.5516085833319673, 'sideways_time_stop': 243, 'sideways_use_sma': False, 'sideways_use_ema': True, 'sideways_use_atr': False, 'sideways_use_adx': False, 'sideways_use_spike': False, 'sideways_rsi_required': False}.
[I 2025-09-01 09:32:14,123] Trial 211 finished with values: [-1000000000.0, 1000000000.0] and parameters: {'p_sma': 24, 'p_std': 22, 'p_atr': 17, 'p_adx': 22, 'rsi_period': 39, 'ema1': 29, 'ema2': 16, 'slip_atr_k': 0.03820857349631945, 'slip_spread_k': 0.7871299552335238, 'spread_hl_frac': 0.023656703045010295, 'bb_std_mult': 1.877800060413098, 'rsi_os': 12, 'rsi_ob': 55, 'vol_spike': 0.23758209668356514, 'adx_thresh': 14.440154919355333, 'atr_min_pct': 0.0033715268523254183, 'atr_max_pct': 0.0850697152631925, 'tp_mult': 1.9319160452552748, 'tsl_mult': 0.6012144316441893, 'strategy': 'breakout', 'time_stop': 201, 'use_sma': False, 'use_atr': False, 'use_adx': False, 'use_ema': False, 'use_spike': True, 'rsi_required': False, 'edge_k': 0.539706122264626, 'edge_cap': 0.11207475585098692, 'bull_strategy': 'breakout', 'bull_bb_std_mult': 3.175591953127385, 'bull_rsi_os': 17, 'bull_rsi_ob': 54, 'bull_adx_thresh': 6.246018982902956, 'bull_atr_min_pct': 0.020799958195319997, 'bull_atr_max_pct': 0.08989553718962436, 'bull_tp_mult': 2.1886746724919877, 'bull_tsl_mult': 0.7302962433414378, 'bull_time_stop': 11, 'bull_use_sma': False, 'bull_use_ema': True, 'bull_use_atr': True, 'bull_use_adx': False, 'bull_use_spike': True, 'bull_rsi_required': False, 'bear_strategy': 'breakout', 'bear_bb_std_mult': 3.58557777994163, 'bear_rsi_os': 49, 'bear_rsi_ob': 69, 'bear_adx_thresh': 13.301504649977003, 'bear_atr_min_pct': 0.014523648091275564, 'bear_atr_max_pct': 0.08066417086881766, 'bear_tp_mult': 1.5864625896392042, 'bear_tsl_mult': 0.4602361550123486, 'bear_time_stop': 52, 'bear_use_sma': True, 'bear_use_ema': False, 'bear_use_atr': False, 'bear_use_adx': False, 'bear_use_spike': True, 'bear_rsi_required': False, 'sideways_strategy': 'breakout', 'sideways_bb_std_mult': 0.5026277543203967, 'sideways_rsi_os': 39, 'sideways_rsi_ob': 49, 'sideways_adx_thresh': 10.26698581411283, 'sideways_atr_min_pct': 0.021133051523064446, 'sideways_atr_max_pct': 0.05996922864595672, 'sideways_tp_mult': 1.262383456508191, 'sideways_tsl_mult': 0.9268445493016394, 'sideways_time_stop': 53, 'sideways_use_sma': False, 'sideways_use_ema': True, 'sideways_use_atr': True, 'sideways_use_adx': True, 'sideways_use_spike': True, 'sideways_rsi_required': True}.
[I 2025-09-01 09:32:14,832] Trial 212 finished with values: [-1000000000.0, 1000000000.0] and parameters: {'p_sma': 30, 'p_std': 25, 'p_atr': 17, 'p_adx': 14, 'rsi_period': 79, 'ema1': 18, 'ema2': 16, 'slip_atr_k': 0.039049615315672526, 'slip_spread_k': 0.7735061996388943, 'spread_hl_frac': 0.010487010845317866, 'bb_std_mult': 3.00137893525668, 'rsi_os': 12, 'rsi_ob': 71, 'vol_spike': 0.057896444413790105, 'adx_thresh': 7.130271187289194, 'atr_min_pct': 0.018921582825197347, 'atr_max_pct': 0.14722823592191872, 'tp_mult': 2.7975947930411893, 'tsl_mult': 0.055056835258658614, 'strategy': 'breakout', 'time_stop': 84, 'use_sma': False, 'use_atr': False, 'use_adx': False, 'use_ema': False, 'use_spike': True, 'rsi_required': False, 'edge_k': 0.5519022997648713, 'edge_cap': 0.4153255870360518, 'bull_strategy': 'breakout', 'bull_bb_std_mult': 1.5117067447017059, 'bull_rsi_os': 46, 'bull_rsi_ob': 54, 'bull_adx_thresh': 6.120078037052348, 'bull_atr_min_pct': 0.017545323394019204, 'bull_atr_max_pct': 0.06435412269105399, 'bull_tp_mult': 2.171480602516893, 'bull_tsl_mult': 0.2579764420859995, 'bull_time_stop': 125, 'bull_use_sma': False, 'bull_use_ema': True, 'bull_use_atr': True, 'bull_use_adx': False, 'bull_use_spike': True, 'bull_rsi_required': False, 'bear_strategy': 'breakout', 'bear_bb_std_mult': 1.3015694646274378, 'bear_rsi_os': 49, 'bear_rsi_ob': 69, 'bear_adx_thresh': 12.10016763271687, 'bear_atr_min_pct': 0.01586659195867341, 'bear_atr_max_pct': 0.08229202654332317, 'bear_tp_mult': 1.9896871837980064, 'bear_tsl_mult': 0.3791418184467887, 'bear_time_stop': 203, 'bear_use_sma': True, 'bear_use_ema': False, 'bear_use_atr': False, 'bear_use_adx': False, 'bear_use_spike': True, 'bear_rsi_required': False, 'sideways_strategy': 'breakout', 'sideways_bb_std_mult': 0.8383455324059821, 'sideways_rsi_os': 12, 'sideways_rsi_ob': 49, 'sideways_adx_thresh': 8.657571322266591, 'sideways_atr_min_pct': 0.005183832836917139, 'sideways_atr_max_pct': 0.06109230101891196, 'sideways_tp_mult': 2.7158623113392837, 'sideways_tsl_mult': 0.5222136485270794, 'sideways_time_stop': 24, 'sideways_use_sma': True, 'sideways_use_ema': True, 'sideways_use_atr': True, 'sideways_use_adx': True, 'sideways_use_spike': True, 'sideways_rsi_required': True}.
[I 2025-09-01 09:32:15,400] Trial 210 finished with values: [-1000000000.0, 1000000000.0] and parameters: {'p_sma': 23, 'p_std': 59, 'p_atr': 17, 'p_adx': 29, 'rsi_period': 64, 'ema1': 26, 'ema2': 17, 'slip_atr_k': 0.03716011669924008, 'slip_spread_k': 0.6575587110085773, 'spread_hl_frac': 0.011009195169055897, 'bb_std_mult': 2.772350981526195, 'rsi_os': 11, 'rsi_ob': 55, 'vol_spike': 0.0990844250894779, 'adx_thresh': 7.225798686629252, 'atr_min_pct': 0.01907790216088626, 'atr_max_pct': 0.14679593750592326, 'tp_mult': 2.778669682385582, 'tsl_mult': 0.9186515847994674, 'strategy': 'breakout', 'time_stop': 240, 'use_sma': False, 'use_atr': False, 'use_adx': True, 'use_ema': False, 'use_spike': False, 'rsi_required': False, 'edge_k': 0.8286149111987349, 'edge_cap': 0.9304697054678216, 'bull_strategy': 'breakout', 'bull_bb_std_mult': 3.1516948290426603, 'bull_rsi_os': 39, 'bull_rsi_ob': 54, 'bull_adx_thresh': 6.187849285589925, 'bull_atr_min_pct': 0.00857125995171145, 'bull_atr_max_pct': 0.13113123274411104, 'bull_tp_mult': 2.2054033590235846, 'bull_tsl_mult': 0.27016480775461515, 'bull_time_stop': 77, 'bull_use_sma': False, 'bull_use_ema': True, 'bull_use_atr': False, 'bull_use_adx': False, 'bull_use_spike': True, 'bull_rsi_required': False, 'bear_strategy': 'mean_reversion', 'bear_bb_std_mult': 3.587248963134956, 'bear_rsi_os': 46, 'bear_rsi_ob': 69, 'bear_adx_thresh': 13.452637538487675, 'bear_atr_min_pct': 0.02653066159172384, 'bear_atr_max_pct': 0.1233161939859056, 'bear_tp_mult': 1.3990040598182747, 'bear_tsl_mult': 0.46153040836915965, 'bear_time_stop': 220, 'bear_use_sma': True, 'bear_use_ema': True, 'bear_use_atr': True, 'bear_use_adx': False, 'bear_use_spike': True, 'bear_rsi_required': False, 'sideways_strategy': 'breakout', 'sideways_bb_std_mult': 0.5072195554363397, 'sideways_rsi_os': 48, 'sideways_rsi_ob': 49, 'sideways_adx_thresh': 10.500237458520553, 'sideways_atr_min_pct': 0.019059877124909422, 'sideways_atr_max_pct': 0.0611728390455132, 'sideways_tp_mult': 1.9080443390166424, 'sideways_tsl_mult': 0.6054125752844456, 'sideways_time_stop': 210, 'sideways_use_sma': False, 'sideways_use_ema': True, 'sideways_use_atr': False, 'sideways_use_adx': True, 'sideways_use_spike': True, 'sideways_rsi_required': True}.
[I 2025-09-01 09:32:15,874] Trial 209 finished with values: [-1000000000.0, 1000000000.0] and parameters: {'p_sma': 26, 'p_std': 28, 'p_atr': 17, 'p_adx': 26, 'rsi_period': 33, 'ema1': 26, 'ema2': 17, 'slip_atr_k': 0.03858384718061085, 'slip_spread_k': 0.43548464473694354, 'spread_hl_frac': 0.02417105329016016, 'bb_std_mult': 2.9802531951757825, 'rsi_os': 40, 'rsi_ob': 94, 'vol_spike': 0.23331479578080394, 'adx_thresh': 20.22624307981369, 'atr_min_pct': 0.013844058962128284, 'atr_max_pct': 0.14428450139927482, 'tp_mult': 1.8704511336869807, 'tsl_mult': 0.05566475559204497, 'strategy': 'breakout', 'time_stop': 107, 'use_sma': True, 'use_atr': True, 'use_adx': True, 'use_ema': False, 'use_spike': False, 'rsi_required': False, 'edge_k': 1.3889374575726583, 'edge_cap': 0.10883938608599193, 'bull_strategy': 'mean_reversion', 'bull_bb_std_mult': 3.526387228750222, 'bull_rsi_os': 17, 'bull_rsi_ob': 56, 'bull_adx_thresh': 8.089032776268324, 'bull_atr_min_pct': 0.02843808741160659, 'bull_atr_max_pct': 0.0642405940049309, 'bull_tp_mult': 2.1849773588688692, 'bull_tsl_mult': 0.08634601916545294, 'bull_time_stop': 79, 'bull_use_sma': False, 'bull_use_ema': False, 'bull_use_atr': False, 'bull_use_adx': False, 'bull_use_spike': False, 'bull_rsi_required': True, 'bear_strategy': 'mean_reversion', 'bear_bb_std_mult': 3.597415374685593, 'bear_rsi_os': 45, 'bear_rsi_ob': 68, 'bear_adx_thresh': 13.933192655533123, 'bear_atr_min_pct': 0.015229598692727336, 'bear_atr_max_pct': 0.03674077800288965, 'bear_tp_mult': 2.871952359599601, 'bear_tsl_mult': 0.3862371227822161, 'bear_time_stop': 219, 'bear_use_sma': True, 'bear_use_ema': True, 'bear_use_atr': True, 'bear_use_adx': False, 'bear_use_spike': True, 'bear_rsi_required': False, 'sideways_strategy': 'breakout', 'sideways_bb_std_mult': 0.8579753994630674, 'sideways_rsi_os': 18, 'sideways_rsi_ob': 95, 'sideways_adx_thresh': 25.096184381764328, 'sideways_atr_min_pct': 0.021014796524153438, 'sideways_atr_max_pct': 0.07011579122504998, 'sideways_tp_mult': 2.794316713713111, 'sideways_tsl_mult': 0.9859819408225248, 'sideways_time_stop': 188, 'sideways_use_sma': False, 'sideways_use_ema': True, 'sideways_use_atr': False, 'sideways_use_adx': True, 'sideways_use_spike': True, 'sideways_rsi_required': True}.
[I 2025-09-01 09:32:54,486] Trial 215 finished with values: [-1000000000.0, 1000000000.0] and parameters: {'p_sma': 28, 'p_std': 28, 'p_atr': 16, 'p_adx': 16, 'rsi_period': 21, 'ema1': 21, 'ema2': 31, 'slip_atr_k': 0.10661526318260729, 'slip_spread_k': 0.3089674203602498, 'spread_hl_frac': 0.012879261893509299, 'bb_std_mult': 1.7771741394554472, 'rsi_os': 13, 'rsi_ob': 84, 'vol_spike': 0.1700283457000122, 'adx_thresh': 19.8281001324134, 'atr_min_pct': 0.02014773361099487, 'atr_max_pct': 0.07945537045302534, 'tp_mult': 1.8112958135649688, 'tsl_mult': 0.029568729015994735, 'strategy': 'mean_reversion', 'time_stop': 195, 'use_sma': True, 'use_atr': False, 'use_adx': True, 'use_ema': True, 'use_spike': False, 'rsi_required': True, 'edge_k': 0.9454916286819355, 'edge_cap': 0.5793517754614437, 'bull_strategy': 'mean_reversion', 'bull_bb_std_mult': 0.573477130787568, 'bull_rsi_os': 19, 'bull_rsi_ob': 56, 'bull_adx_thresh': 7.643397387717135, 'bull_atr_min_pct': 0.028294392626493206, 'bull_atr_max_pct': 0.06627586218151343, 'bull_tp_mult': 2.0142902062752936, 'bull_tsl_mult': 0.06772080094460826, 'bull_time_stop': 52, 'bull_use_sma': True, 'bull_use_ema': False, 'bull_use_atr': False, 'bull_use_adx': True, 'bull_use_spike': False, 'bull_rsi_required': True, 'bear_strategy': 'mean_reversion', 'bear_bb_std_mult': 3.3847637678258344, 'bear_rsi_os': 47, 'bear_rsi_ob': 63, 'bear_adx_thresh': 28.94316713344694, 'bear_atr_min_pct': 0.01676431876397931, 'bear_atr_max_pct': 0.11556721767222325, 'bear_tp_mult': 2.877657920404882, 'bear_tsl_mult': 0.42825666680542845, 'bear_time_stop': 211, 'bear_use_sma': False, 'bear_use_ema': True, 'bear_use_atr': True, 'bear_use_adx': True, 'bear_use_spike': False, 'bear_rsi_required': True, 'sideways_strategy': 'mean_reversion', 'sideways_bb_std_mult': 1.4771026577205197, 'sideways_rsi_os': 17, 'sideways_rsi_ob': 95, 'sideways_adx_thresh': 29.396218965125893, 'sideways_atr_min_pct': 0.004678866673625964, 'sideways_atr_max_pct': 0.11475803638416143, 'sideways_tp_mult': 1.725822690054298, 'sideways_tsl_mult': 0.9432571664206282, 'sideways_time_stop': 224, 'sideways_use_sma': True, 'sideways_use_ema': False, 'sideways_use_atr': False, 'sideways_use_adx': False, 'sideways_use_spike': False, 'sideways_rsi_required': False}.
[I 2025-09-01 09:32:55,506] Trial 214 finished with values: [-1000000000.0, 1000000000.0] and parameters: {'p_sma': 28, 'p_std': 45, 'p_atr': 16, 'p_adx': 16, 'rsi_period': 66, 'ema1': 13, 'ema2': 50, 'slip_atr_k': 0.10321133747692829, 'slip_spread_k': 0.6737843700975905, 'spread_hl_frac': 0.012972898329462548, 'bb_std_mult': 1.7758523762360336, 'rsi_os': 25, 'rsi_ob': 84, 'vol_spike': 0.1037429377360396, 'adx_thresh': 5.507809271293768, 'atr_min_pct': 0.02041378564435606, 'atr_max_pct': 0.14251913926403384, 'tp_mult': 2.4049785418218907, 'tsl_mult': 0.42331982923965183, 'strategy': 'mean_reversion', 'time_stop': 172, 'use_sma': True, 'use_atr': False, 'use_adx': True, 'use_ema': True, 'use_spike': False, 'rsi_required': True, 'edge_k': 1.4886028781219052, 'edge_cap': 0.07743472381450736, 'bull_strategy': 'mean_reversion', 'bull_bb_std_mult': 2.150850165565895, 'bull_rsi_os': 18, 'bull_rsi_ob': 56, 'bull_adx_thresh': 8.457810979451693, 'bull_atr_min_pct': 0.02997094782077301, 'bull_atr_max_pct': 0.0637419393116409, 'bull_tp_mult': 2.126756258997379, 'bull_tsl_mult': 0.06893075397950973, 'bull_time_stop': 57, 'bull_use_sma': True, 'bull_use_ema': False, 'bull_use_atr': False, 'bull_use_adx': True, 'bull_use_spike': False, 'bull_rsi_required': True, 'bear_strategy': 'mean_reversion', 'bear_bb_std_mult': 1.5532871402736568, 'bear_rsi_os': 46, 'bear_rsi_ob': 51, 'bear_adx_thresh': 19.92512237178138, 'bear_atr_min_pct': 0.01934657811954313, 'bear_atr_max_pct': 0.1416361548556097, 'bear_tp_mult': 2.19846545783823, 'bear_tsl_mult': 0.4254798307898508, 'bear_time_stop': 300, 'bear_use_sma': False, 'bear_use_ema': True, 'bear_use_atr': True, 'bear_use_adx': False, 'bear_use_spike': False, 'bear_rsi_required': True, 'sideways_strategy': 'mean_reversion', 'sideways_bb_std_mult': 1.7806056912455603, 'sideways_rsi_os': 18, 'sideways_rsi_ob': 89, 'sideways_adx_thresh': 25.267628892117713, 'sideways_atr_min_pct': 0.02738867972865293, 'sideways_atr_max_pct': 0.06465022589552755, 'sideways_tp_mult': 1.8595195457342106, 'sideways_tsl_mult': 0.6158782285469314, 'sideways_time_stop': 214, 'sideways_use_sma': False, 'sideways_use_ema': False, 'sideways_use_atr': False, 'sideways_use_adx': False, 'sideways_use_spike': False, 'sideways_rsi_required': False}.
[I 2025-09-01 09:32:55,960] Trial 216 finished with values: [-1000000000.0, 1000000000.0] and parameters: {'p_sma': 28, 'p_std': 45, 'p_atr': 16, 'p_adx': 16, 'rsi_period': 67, 'ema1': 20, 'ema2': 18, 'slip_atr_k': 0.14852389138634137, 'slip_spread_k': 0.529632988641665, 'spread_hl_frac': 0.012577458726635586, 'bb_std_mult': 1.7634880086880167, 'rsi_os': 25, 'rsi_ob': 84, 'vol_spike': 0.2560629501601009, 'adx_thresh': 21.75238458190534, 'atr_min_pct': 0.02011787925854552, 'atr_max_pct': 0.13761542699826776, 'tp_mult': 1.8086065391243158, 'tsl_mult': 0.47669159621597007, 'strategy': 'mean_reversion', 'time_stop': 205, 'use_sma': True, 'use_atr': False, 'use_adx': True, 'use_ema': True, 'use_spike': False, 'rsi_required': True, 'edge_k': 1.5350612626888658, 'edge_cap': 0.2800402182555206, 'bull_strategy': 'mean_reversion', 'bull_bb_std_mult': 3.2809848232524805, 'bull_rsi_os': 36, 'bull_rsi_ob': 58, 'bull_adx_thresh': 7.502851209882885, 'bull_atr_min_pct': 0.029977564672646864, 'bull_atr_max_pct': 0.0656127632969624, 'bull_tp_mult': 2.0146516946329145, 'bull_tsl_mult': 0.05867797201202274, 'bull_time_stop': 106, 'bull_use_sma': True, 'bull_use_ema': False, 'bull_use_atr': False, 'bull_use_adx': True, 'bull_use_spike': False, 'bull_rsi_required': True, 'bear_strategy': 'mean_reversion', 'bear_bb_std_mult': 1.5904999383471365, 'bear_rsi_os': 47, 'bear_rsi_ob': 64, 'bear_adx_thresh': 12.480493521682222, 'bear_atr_min_pct': 0.020537441172615183, 'bear_atr_max_pct': 0.11554302345370714, 'bear_tp_mult': 2.1899099785174707, 'bear_tsl_mult': 0.42846462606633756, 'bear_time_stop': 213, 'bear_use_sma': False, 'bear_use_ema': True, 'bear_use_atr': True, 'bear_use_adx': True, 'bear_use_spike': False, 'bear_rsi_required': True, 'sideways_strategy': 'mean_reversion', 'sideways_bb_std_mult': 2.6315276185137892, 'sideways_rsi_os': 44, 'sideways_rsi_ob': 46, 'sideways_adx_thresh': 29.336786202724753, 'sideways_atr_min_pct': 0.012810224901182827, 'sideways_atr_max_pct': 0.06600394140406053, 'sideways_tp_mult': 1.4785751992027913, 'sideways_tsl_mult': 0.11488792427084255, 'sideways_time_stop': 68, 'sideways_use_sma': True, 'sideways_use_ema': False, 'sideways_use_atr': False, 'sideways_use_adx': False, 'sideways_use_spike': False, 'sideways_rsi_required': False}.
