[I 2025-09-01 09:30:13,297] Trial 198 finished with values: [-0.031000278341504428, 0.03096580859357508] and parameters: {'p_sma': 28, 'p_std': 59, 'p_atr': 15, 'p_adx': 15, 'rsi_period': 66, 'ema1': 20, 'ema2': 59, 'slip_atr_k': 0.05570922707038533, 'slip_spread_k': 0.7794859162123866, 'spread_hl_frac': 0.015199966173187576, 'bb_std_mult': 0.7180168064526724, 'rsi_os': 11, 'rsi_ob': 83, 'vol_spike': 0.21621667340503264, 'adx_thresh': 18.987932699167015, 'atr_min_pct': 0.02512750163493635, 'atr_max_pct': 0.14994075411659427, 'tp_mult': 1.8074700759151043, 'tsl_mult': 0.057432222320861516, 'strategy': 'breakout', 'time_stop': 195, 'use_sma': False, 'use_atr': False, 'use_adx': True, 'use_ema': True, 'use_spike': False, 'rsi_required': True, 'edge_k': 1.4533319343079139, 'edge_cap': 0.098738194381378, 'bull_strategy': 'breakout', 'bull_bb_std_mult': 0.7169689206278788, 'bull_rsi_os': 36, 'bull_rsi_ob': 57, 'bull_adx_thresh': 7.6264826153044964, 'bull_atr_min_pct': 0.021637026766109905, 'bull_atr_max_pct': 0.061037457534513395, 'bull_tp_mult': 2.1374870780733457, 'bull_tsl_mult': 0.7838866446849408, 'bull_time_stop': 170, 'bull_use_sma': False, 'bull_use_ema': True, 'bull_use_atr': False, 'bull_use_adx': True, 'bull_use_spike': True, 'bull_rsi_required': True, 'bear_strategy': 'mean_reversion', 'bear_bb_std_mult': 3.535009182946223, 'bear_rsi_os': 49, 'bear_rsi_ob': 66, 'bear_adx_thresh': 12.826368029507044, 'bear_atr_min_pct': 0.01625650208845355, 'bear_atr_max_pct': 0.11916228621339638, 'bear_tp_mult': 2.303356237863394, 'bear_tsl_mult': 0.4121324602077492, 'bear_time_stop': 213, 'bear_use_sma': True, 'bear_use_ema': True, 'bear_use_atr': True, 'bear_use_adx': False, 'bear_use_spike': False, 'bear_rsi_required': True, 'sideways_strategy': 'breakout', 'sideways_bb_std_mult': 1.266990006148205, 'sideways_rsi_os': 41, 'sideways_rsi_ob': 58, 'sideways_adx_thresh': 30.298490817750242, 'sideways_atr_min_pct': 0.0035538893876029065, 'sideways_atr_max_pct': 0.0674744817477971, 'sideways_tp_mult': 1.1797633701116266, 'sideways_tsl_mult': 0.9729982058369071, 'sideways_time_stop': 232, 'sideways_use_sma': False, 'sideways_use_ema': False, 'sideways_use_atr': False, 'sideways_use_adx': True, 'sideways_use_spike': True, 'sideways_rsi_required': True}.
[I 2025-09-01 09:30:13,666] Trial 196 finished with values: [-1000000000.0, 1000000000.0] and parameters: {'p_sma': 15, 'p_std': 25, 'p_atr': 15, 'p_adx': 15, 'rsi_period': 62, 'ema1': 10, 'ema2': 59, 'slip_atr_k': 0.18984463055405681, 'slip_spread_k': 0.22991859095885597, 'spread_hl_frac': 0.014796385734254453, 'bb_std_mult': 0.7318172835095038, 'rsi_os': 49, 'rsi_ob': 90, 'vol_spike': 0.2151085267403867, 'adx_thresh': 21.112633243914143, 'atr_min_pct': 0.019583967780743086, 'atr_max_pct': 0.14936394318316182, 'tp_mult': 1.8571526272741838, 'tsl_mult': 0.2688878883465361, 'strategy': 'breakout', 'time_stop': 130, 'use_sma': False, 'use_atr': False, 'use_adx': True, 'use_ema': False, 'use_spike': False, 'rsi_required': False, 'edge_k': 1.4663842415800705, 'edge_cap': 0.6885364302265385, 'bull_strategy': 'breakout', 'bull_bb_std_mult': 0.6952910829278588, 'bull_rsi_os': 16, 'bull_rsi_ob': 76, 'bull_adx_thresh': 33.40455923834449, 'bull_atr_min_pct': 0.027811650671614903, 'bull_atr_max_pct': 0.11647855980261715, 'bull_tp_mult': 1.2410743879043207, 'bull_tsl_mult': 0.884764458515328, 'bull_time_stop': 91, 'bull_use_sma': False, 'bull_use_ema': True, 'bull_use_atr': False, 'bull_use_adx': True, 'bull_use_spike': True, 'bull_rsi_required': True, 'bear_strategy': 'mean_reversion', 'bear_bb_std_mult': 3.529550756222395, 'bear_rsi_os': 10, 'bear_rsi_ob': 67, 'bear_adx_thresh': 12.64685322716661, 'bear_atr_min_pct': 0.01633456652550409, 'bear_atr_max_pct': 0.028716004877887044, 'bear_tp_mult': 2.208384951402941, 'bear_tsl_mult': 0.42976411993368857, 'bear_time_stop': 213, 'bear_use_sma': True, 'bear_use_ema': True, 'bear_use_atr': True, 'bear_use_adx': False, 'bear_use_spike': False, 'bear_rsi_required': False, 'sideways_strategy': 'breakout', 'sideways_bb_std_mult': 2.344766005294944, 'sideways_rsi_os': 41, 'sideways_rsi_ob': 77, 'sideways_adx_thresh': 11.169252622691545, 'sideways_atr_min_pct': 0.0056446066461622955, 'sideways_atr_max_pct': 0.13435228379927033, 'sideways_tp_mult': 1.4020913842310838, 'sideways_tsl_mult': 0.9668806461508233, 'sideways_time_stop': 169, 'sideways_use_sma': False, 'sideways_use_ema': True, 'sideways_use_atr': False, 'sideways_use_adx': True, 'sideways_use_spike': True, 'sideways_rsi_required': True}.
[I 2025-09-01 09:30:14,553] Trial 202 finished with values: [-1000000000.0, 1000000000.0] and parameters: {'p_sma': 27, 'p_std': 43, 'p_atr': 16, 'p_adx': 12, 'rsi_period': 67, 'ema1': 22, 'ema2': 15, 'slip_atr_k': 0.05395733230777796, 'slip_spread_k': 0.25330208481616606, 'spread_hl_frac': 0.0198527296335431, 'bb_std_mult': 3.1396447876700826, 'rsi_os': 11, 'rsi_ob': 49, 'vol_spike': 0.1251817953819091, 'adx_thresh': 6.495275014663934, 'atr_min_pct': 0.018290431030202867, 'atr_max_pct': 0.1336032749504737, 'tp_mult': 1.1374982160951732, 'tsl_mult': 0.9755782605709522, 'strategy': 'mean_reversion', 'time_stop': 250, 'use_sma': True, 'use_atr': False, 'use_adx': False, 'use_ema': False, 'use_spike': False, 'rsi_required': False, 'edge_k': 1.5675343854074297, 'edge_cap': 0.057889389678854236, 'bull_strategy': 'mean_reversion', 'bull_bb_std_mult': 2.7085896308759403, 'bull_rsi_os': 15, 'bull_rsi_ob': 55, 'bull_adx_thresh': 6.82442835794377, 'bull_atr_min_pct': 0.029345903591501802, 'bull_atr_max_pct': 0.07161177118421555, 'bull_tp_mult': 1.4402701686851969, 'bull_tsl_mult': 0.34974806410181014, 'bull_time_stop': 133, 'bull_use_sma': True, 'bull_use_ema': False, 'bull_use_atr': False, 'bull_use_adx': False, 'bull_use_spike': False, 'bull_rsi_required': True, 'bear_strategy': 'mean_reversion', 'bear_bb_std_mult': 3.4279612539641233, 'bear_rsi_os': 53, 'bear_rsi_ob': 66, 'bear_adx_thresh': 11.794567126395716, 'bear_atr_min_pct': 0.0241509142531987, 'bear_atr_max_pct': 0.11854633131646054, 'bear_tp_mult': 2.51349183287026, 'bear_tsl_mult': 0.44364970328646547, 'bear_time_stop': 154, 'bear_use_sma': False, 'bear_use_ema': True, 'bear_use_atr': False, 'bear_use_adx': False, 'bear_use_spike': False, 'bear_rsi_required': False, 'sideways_strategy': 'mean_reversion', 'sideways_bb_std_mult': 2.7880052908875737, 'sideways_rsi_os': 36, 'sideways_rsi_ob': 46, 'sideways_adx_thresh': 31.47684176745981, 'sideways_atr_min_pct': 0.0036533139039279976, 'sideways_atr_max_pct': 0.06441076892764266, 'sideways_tp_mult': 1.750298105946823, 'sideways_tsl_mult': 0.9009279367013898, 'sideways_time_stop': 213, 'sideways_use_sma': False, 'sideways_use_ema': True, 'sideways_use_atr': False, 'sideways_use_adx': False, 'sideways_use_spike': False, 'sideways_rsi_required': False}.
[I 2025-09-01 09:30:52,848] Trial 201 finished with values: [-1000000000.0, 1000000000.0] and parameters: {'p_sma': 31, 'p_std': 7, 'p_atr': 16, 'p_adx': 12, 'rsi_period': 66, 'ema1': 22, 'ema2': 10, 'slip_atr_k': 0.0562229468860727, 'slip_spread_k': 0.2544503107287146, 'spread_hl_frac': 0.048060075388708365, 'bb_std_mult': 3.5040848485911518, 'rsi_os': 49, 'rsi_ob': 83, 'vol_spike': 0.22408155955261108, 'adx_thresh': 18.450962549510685, 'atr_min_pct': 0.02484387083671674, 'atr_max_pct': 0.14289022312861283, 'tp_mult': 1.7661069009976298, 'tsl_mult': 0.9580915722023499, 'strategy': 'breakout', 'time_stop': 131, 'use_sma': True, 'use_atr': False, 'use_adx': True, 'use_ema': False, 'use_spike': False, 'rsi_required': False, 'edge_k': 1.5604907704535866, 'edge_cap': 0.057924431555427605, 'bull_strategy': 'mean_reversion', 'bull_bb_std_mult': 0.6885885043414217, 'bull_rsi_os': 7, 'bull_rsi_ob': 55, 'bull_adx_thresh': 7.0227194692542865, 'bull_atr_min_pct': 0.029634580392355756, 'bull_atr_max_pct': 0.13596633575197026, 'bull_tp_mult': 1.8087251935966613, 'bull_tsl_mult': 0.033650674259411366, 'bull_time_stop': 133, 'bull_use_sma': True, 'bull_use_ema': False, 'bull_use_atr': False, 'bull_use_adx': False, 'bull_use_spike': False, 'bull_rsi_required': False, 'bear_strategy': 'mean_reversion', 'bear_bb_std_mult': 3.481248083678035, 'bear_rsi_os': 47, 'bear_rsi_ob': 79, 'bear_adx_thresh': 12.94508383063749, 'bear_atr_min_pct': 0.024051559550433206, 'bear_atr_max_pct': 0.11915300594230602, 'bear_tp_mult': 2.9600720241826717, 'bear_tsl_mult': 0.016061826698632153, 'bear_time_stop': 237, 'bear_use_sma': False, 'bear_use_ema': True, 'bear_use_atr': True, 'bear_use_adx': False, 'bear_use_spike': False, 'bear_rsi_required': False, 'sideways_strategy': 'mean_reversion', 'sideways_bb_std_mult': 1.102579959970877, 'sideways_rsi_os': 41, 'sideways_rsi_ob': 76, 'sideways_adx_thresh': 11.23418449059629, 'sideways_atr_min_pct': 0.003600016959127943, 'sideways_atr_max_pct': 0.06320181803824515, 'sideways_tp_mult': 1.7545324676514904, 'sideways_tsl_mult': 0.9113445053938375, 'sideways_time_stop': 203, 'sideways_use_sma': False, 'sideways_use_ema': True, 'sideways_use_atr': False, 'sideways_use_adx': False, 'sideways_use_spike': False, 'sideways_rsi_required': False}.
[I 2025-09-01 09:30:52,888] Trial 200 finished with values: [-1000000000.0, 1000000000.0] and parameters: {'p_sma': 46, 'p_std': 26, 'p_atr': 17, 'p_adx': 12, 'rsi_period': 41, 'ema1': 22, 'ema2': 15, 'slip_atr_k': 0.05523562718167402, 'slip_spread_k': 0.2508454796427271, 'spread_hl_frac': 0.04817169730187094, 'bb_std_mult': 1.7698120707714384, 'rsi_os': 49, 'rsi_ob': 78, 'vol_spike': 0.22420229737216626, 'adx_thresh': 6.55930290086404, 'atr_min_pct': 0.029834119738337078, 'atr_max_pct': 0.048961971922163214, 'tp_mult': 2.239142054003414, 'tsl_mult': 0.7126726454927731, 'strategy': 'breakout', 'time_stop': 207, 'use_sma': True, 'use_atr': False, 'use_adx': True, 'use_ema': False, 'use_spike': False, 'rsi_required': False, 'edge_k': 1.585840190320392, 'edge_cap': 0.05429282249067141, 'bull_strategy': 'mean_reversion', 'bull_bb_std_mult': 2.6877395568181845, 'bull_rsi_os': 7, 'bull_rsi_ob': 55, 'bull_adx_thresh': 7.188527171496515, 'bull_atr_min_pct': 0.00964201654884856, 'bull_atr_max_pct': 0.11533499137864478, 'bull_tp_mult': 2.381726952165377, 'bull_tsl_mult': 0.014844066620708363, 'bull_time_stop': 136, 'bull_use_sma': True, 'bull_use_ema': False, 'bull_use_atr': False, 'bull_use_adx': True, 'bull_use_spike': False, 'bull_rsi_required': True, 'bear_strategy': 'mean_reversion', 'bear_bb_std_mult': 0.9823807427180136, 'bear_rsi_os': 9, 'bear_rsi_ob': 66, 'bear_adx_thresh': 12.786278395039643, 'bear_atr_min_pct': 0.01623410377414683, 'bear_atr_max_pct': 0.11852423597680185, 'bear_tp_mult': 2.2043742749494646, 'bear_tsl_mult': 0.35407825946592886, 'bear_time_stop': 208, 'bear_use_sma': False, 'bear_use_ema': True, 'bear_use_atr': True, 'bear_use_adx': False, 'bear_use_spike': False, 'bear_rsi_required': False, 'sideways_strategy': 'breakout', 'sideways_bb_std_mult': 2.342277854798532, 'sideways_rsi_os': 41, 'sideways_rsi_ob': 46, 'sideways_adx_thresh': 30.487528276442045, 'sideways_atr_min_pct': 0.020041632117720934, 'sideways_atr_max_pct': 0.06641358672008042, 'sideways_tp_mult': 2.9239162578733606, 'sideways_tsl_mult': 0.900925596266409, 'sideways_time_stop': 233, 'sideways_use_sma': False, 'sideways_use_ema': True, 'sideways_use_atr': False, 'sideways_use_adx': False, 'sideways_use_spike': False, 'sideways_rsi_required': False}.
[I 2025-09-01 09:30:53,316] Trial 204 finished with values: [-1000000000.0, 1000000000.0] and parameters: {'p_sma': 31, 'p_std': 6, 'p_atr': 23, 'p_adx': 11, 'rsi_period': 65, 'ema1': 20, 'ema2': 13, 'slip_atr_k': 0.04548934288391091, 'slip_spread_k': 0.2932159432887532, 'spread_hl_frac': 0.01369631886235265, 'bb_std_mult': 1.8986377980469566, 'rsi_os': 10, 'rsi_ob': 85, 'vol_spike': 0.2244018008927227, 'adx_thresh': 6.208854931492452, 'atr_min_pct': 0.020463029709259818, 'atr_max_pct': 0.04996631014809674, 'tp_mult': 1.765562133697599, 'tsl_mult': 0.7917340246468019, 'strategy': 'breakout', 'time_stop': 209, 'use_sma': True, 'use_atr': False, 'use_adx': True, 'use_ema': False, 'use_spike': False, 'rsi_required': False, 'edge_k': 0.195956086716776, 'edge_cap': 0.8156833156175388, 'bull_strategy': 'mean_reversion', 'bull_bb_std_mult': 2.5433835360594985, 'bull_rsi_os': 17, 'bull_rsi_ob': 57, 'bull_adx_thresh': 7.0461678054577295, 'bull_atr_min_pct': 0.02950475304198632, 'bull_atr_max_pct': 0.13523433228048587, 'bull_tp_mult': 2.1322830822712833, 'bull_tsl_mult': 0.03451848020955333, 'bull_time_stop': 121, 'bull_use_sma': True, 'bull_use_ema': False, 'bull_use_atr': False, 'bull_use_adx': False, 'bull_use_spike': False, 'bull_rsi_required': False, 'bear_strategy': 'mean_reversion', 'bear_bb_std_mult': 0.6063104805257089, 'bear_rsi_os': 46, 'bear_rsi_ob': 67, 'bear_adx_thresh': 20.855122872166387, 'bear_atr_min_pct': 0.001174627347958269, 'bear_atr_max_pct': 0.11901315651184848, 'bear_tp_mult': 2.278546332511314, 'bear_tsl_mult': 0.45378956481417665, 'bear_time_stop': 237, 'bear_use_sma': False, 'bear_use_ema': True, 'bear_use_atr': True, 'bear_use_adx': False, 'bear_use_spike': False, 'bear_rsi_required': False, 'sideways_strategy': 'breakout', 'sideways_bb_std_mult': 3.5107871759683937, 'sideways_rsi_os': 41, 'sideways_rsi_ob': 48, 'sideways_adx_thresh': 30.49182732559679, 'sideways_atr_min_pct': 0.004383870392468126, 'sideways_atr_max_pct': 0.06753935144499465, 'sideways_tp_mult': 2.3823594860030677, 'sideways_tsl_mult': 0.4624311116109748, 'sideways_time_stop': 203, 'sideways_use_sma': False, 'sideways_use_ema': True, 'sideways_use_atr': False, 'sideways_use_adx': False, 'sideways_use_spike': False, 'sideways_rsi_required': False}.
[I 2025-09-01 09:30:53,717] Trial 203 finished with values: [-1000000000.0, 1000000000.0] and parameters: {'p_sma': 27, 'p_std': 6, 'p_atr': 16, 'p_adx': 30, 'rsi_period': 67, 'ema1': 22, 'ema2': 13, 'slip_atr_k': 0.045785054642831814, 'slip_spread_k': 0.3192746256440194, 'spread_hl_frac': 0.019968943771645348, 'bb_std_mult': 3.47470893394566, 'rsi_os': 10, 'rsi_ob': 78, 'vol_spike': 0.2670107516323953, 'adx_thresh': 18.756483944256335, 'atr_min_pct': 0.00542322466139241, 'atr_max_pct': 0.06066268389103112, 'tp_mult': 1.15428407660248, 'tsl_mult': 0.08728608521266011, 'strategy': 'mean_reversion', 'time_stop': 209, 'use_sma': True, 'use_atr': False, 'use_adx': False, 'use_ema': False, 'use_spike': False, 'rsi_required': False, 'edge_k': 1.576397279004996, 'edge_cap': 0.9750153799805066, 'bull_strategy': 'mean_reversion', 'bull_bb_std_mult': 1.1208577566341977, 'bull_rsi_os': 15, 'bull_rsi_ob': 55, 'bull_adx_thresh': 6.979324648125316, 'bull_atr_min_pct': 0.029440404379160207, 'bull_atr_max_pct': 0.12313602274146518, 'bull_tp_mult': 2.2672323971166914, 'bull_tsl_mult': 0.03623573451944956, 'bull_time_stop': 132, 'bull_use_sma': True, 'bull_use_ema': False, 'bull_use_atr': False, 'bull_use_adx': False, 'bull_use_spike': False, 'bull_rsi_required': True, 'bear_strategy': 'mean_reversion', 'bear_bb_std_mult': 3.4571635543687096, 'bear_rsi_os': 47, 'bear_rsi_ob': 66, 'bear_adx_thresh': 11.774449349958259, 'bear_atr_min_pct': 0.005796032374463531, 'bear_atr_max_pct': 0.11937799134757039, 'bear_tp_mult': 2.9553991105161184, 'bear_tsl_mult': 0.4431212919989025, 'bear_time_stop': 152, 'bear_use_sma': False, 'bear_use_ema': True, 'bear_use_atr': False, 'bear_use_adx': False, 'bear_use_spike': False, 'bear_rsi_required': False, 'sideways_strategy': 'mean_reversion', 'sideways_bb_std_mult': 1.1155715477458032, 'sideways_rsi_os': 36, 'sideways_rsi_ob': 46, 'sideways_adx_thresh': 28.668543440563266, 'sideways_atr_min_pct': 0.0034926758334932685, 'sideways_atr_max_pct': 0.06467279869388044, 'sideways_tp_mult': 2.9202309358750638, 'sideways_tsl_mult': 0.8999415807555929, 'sideways_time_stop': 243, 'sideways_use_sma': False, 'sideways_use_ema': True, 'sideways_use_atr': False, 'sideways_use_adx': False, 'sideways_use_spike': False, 'sideways_rsi_required': False}.
[I 2025-09-01 09:31:31,958] Trial 208 finished with values: [-1000000000.0, 1000000000.0] and parameters: {'p_sma': 5, 'p_std': 26, 'p_atr': 14, 'p_adx': 13, 'rsi_period': 69, 'ema1': 19, 'ema2': 37, 'slip_atr_k': 0.1161687947518723, 'slip_spread_k': 0.27807008809589356, 'spread_hl_frac': 0.030946664732222833, 'bb_std_mult': 1.6832908698171902, 'rsi_os': 13, 'rsi_ob': 95, 'vol_spike': 0.24208155986552435, 'adx_thresh': 5.775122668792406, 'atr_min_pct': 0.004826300606247343, 'atr_max_pct': 0.09284106035499251, 'tp_mult': 1.8236033888972438, 'tsl_mult': 0.01858615496627939, 'strategy': 'breakout', 'time_stop': 145, 'use_sma': True, 'use_atr': True, 'use_adx': True, 'use_ema': True, 'use_spike': True, 'rsi_required': True, 'edge_k': 0.6797151748453201, 'edge_cap': 0.6210524042440877, 'bull_strategy': 'mean_reversion', 'bull_bb_std_mult': 0.7622789516682618, 'bull_rsi_os': 44, 'bull_rsi_ob': 57, 'bull_adx_thresh': 5.6282221274753095, 'bull_atr_min_pct': 0.014541823503618954, 'bull_atr_max_pct': 0.06048833833654386, 'bull_tp_mult': 2.079289603657141, 'bull_tsl_mult': 0.11785783548500806, 'bull_time_stop': 118, 'bull_use_sma': True, 'bull_use_ema': False, 'bull_use_atr': True, 'bull_use_adx': False, 'bull_use_spike': False, 'bull_rsi_required': True, 'bear_strategy': 'breakout', 'bear_bb_std_mult': 1.4219030835458375, 'bear_rsi_os': 28, 'bear_rsi_ob': 65, 'bear_adx_thresh': 30.01044834798688, 'bear_atr_min_pct': 0.009588970766414632, 'bear_atr_max_pct': 0.076474770091865, 'bear_tp_mult': 2.343078680415487, 'bear_tsl_mult': 0.406999824369703, 'bear_time_stop': 139, 'bear_use_sma': False, 'bear_use_ema': False, 'bear_use_atr': True, 'bear_use_adx': True, 'bear_use_spike': False, 'bear_rsi_required': True, 'sideways_strategy': 'breakout', 'sideways_bb_std_mult': 1.904425852988373, 'sideways_rsi_os': 40, 'sideways_rsi_ob': 47, 'sideways_adx_thresh': 29.128898701448065, 'sideways_atr_min_pct': 0.025987904295955808, 'sideways_atr_max_pct': 0.07067084111032616, 'sideways_tp_mult': 1.8022033642724624, 'sideways_tsl_mult': 0.2468187748657294, 'sideways_time_stop': 7, 'sideways_use_sma': True, 'sideways_use_ema': False, 'sideways_use_atr': True, 'sideways_use_adx': False, 'sideways_use_spike': False, 'sideways_rsi_required': False}.
[I 2025-09-01 09:31:32,806] Trial 207 finished with values: [-1000000000.0, 1000000000.0] and parameters: {'p_sma': 26, 'p_std': 53, 'p_atr': 25, 'p_adx': 13, 'rsi_period': 68, 'ema1': 19, 'ema2': 37, 'slip_atr_k': 0.1982914903932697, 'slip_spread_k': 0.2769491577053471, 'spread_hl_frac': 0.012163072658135135, 'bb_std_mult': 1.6235775370170173, 'rsi_os': 40, 'rsi_ob': 93, 'vol_spike': 0.26673117886789793, 'adx_thresh': 5.033662977936647, 'atr_min_pct': 0.01208051152402414, 'atr_max_pct': 0.14466012306397202, 'tp_mult': 1.8669063721650194, 'tsl_mult': 0.08407418426176277, 'strategy': 'mean_reversion', 'time_stop': 188, 'use_sma': True, 'use_atr': True, 'use_adx': True, 'use_ema': True, 'use_spike': False, 'rsi_required': True, 'edge_k': 1.3968636318172125, 'edge_cap': 0.20832486689173357, 'bull_strategy': 'mean_reversion', 'bull_bb_std_mult': 0.7632835841012391, 'bull_rsi_os': 19, 'bull_rsi_ob': 56, 'bull_adx_thresh': 8.008753041982136, 'bull_atr_min_pct': 0.028616313257214403, 'bull_atr_max_pct': 0.06075600979459929, 'bull_tp_mult': 2.073654687646045, 'bull_tsl_mult': 0.12605617504828176, 'bull_time_stop': 118, 'bull_use_sma': True, 'bull_use_ema': False, 'bull_use_atr': False, 'bull_use_adx': False, 'bull_use_spike': False, 'bull_rsi_required': True, 'bear_strategy': 'mean_reversion', 'bear_bb_std_mult': 3.5301960433039596, 'bear_rsi_os': 45, 'bear_rsi_ob': 68, 'bear_adx_thresh': 13.913549116719338, 'bear_atr_min_pct': 0.015110585193410011, 'bear_atr_max_pct': 0.03576619088224578, 'bear_tp_mult': 2.09435919383935, 'bear_tsl_mult': 0.3990811080331945, 'bear_time_stop': 102, 'bear_use_sma': False, 'bear_use_ema': True, 'bear_use_atr': True, 'bear_use_adx': True, 'bear_use_spike': False, 'bear_rsi_required': True, 'sideways_strategy': 'breakout', 'sideways_bb_std_mult': 1.2397405842675688, 'sideways_rsi_os': 42, 'sideways_rsi_ob': 47, 'sideways_adx_thresh': 18.461210061181465, 'sideways_atr_min_pct': 0.025601934247181945, 'sideways_atr_max_pct': 0.06995751728348802, 'sideways_tp_mult': 2.653865487831255, 'sideways_tsl_mult': 0.2825152264543038, 'sideways_time_stop': 266, 'sideways_use_sma': False, 'sideways_use_ema': False, 'sideways_use_atr': False, 'sideways_use_adx': False, 'sideways_use_spike': False, 'sideways_rsi_required': False}.
