[I 2025-09-01 09:36:31,703] Trial 237 finished with values: [-1000000000.0, 1000000000.0] and parameters: {'p_sma': 13, 'p_std': 10, 'p_atr': 16, 'p_adx': 15, 'rsi_period': 68, 'ema1': 12, 'ema2': 52, 'slip_atr_k': 0.0018329336815903208, 'slip_spread_k': 0.24613691597333787, 'spread_hl_frac': 0.03172122478158419, 'bb_std_mult': 1.8155649282439785, 'rsi_os': 12, 'rsi_ob': 88, 'vol_spike': 0.21914989709992647, 'adx_thresh': 5.132024794397501, 'atr_min_pct': 0.020039641416592976, 'atr_max_pct': 0.14256100923752876, 'tp_mult': 1.743062978910412, 'tsl_mult': 0.29857789843336524, 'strategy': 'breakout', 'time_stop': 201, 'use_sma': True, 'use_atr': True, 'use_adx': False, 'use_ema': False, 'use_spike': False, 'rsi_required': False, 'edge_k': 1.493163324866463, 'edge_cap': 0.09667557045402647, 'bull_strategy': 'mean_reversion', 'bull_bb_std_mult': 0.6316691699608373, 'bull_rsi_os': 24, 'bull_rsi_ob': 68, 'bull_adx_thresh': 6.623568558369918, 'bull_atr_min_pct': 0.01285088273962498, 'bull_atr_max_pct': 0.027236751736934864, 'bull_tp_mult': 2.155891385008931, 'bull_tsl_mult': 0.7468436042521642, 'bull_time_stop': 170, 'bull_use_sma': True, 'bull_use_ema': False, 'bull_use_atr': True, 'bull_use_adx': True, 'bull_use_spike': False, 'bull_rsi_required': True, 'bear_strategy': 'breakout', 'bear_bb_std_mult': 1.073760455969052, 'bear_rsi_os': 48, 'bear_rsi_ob': 66, 'bear_adx_thresh': 12.230246003468777, 'bear_atr_min_pct': 0.01644518918540945, 'bear_atr_max_pct': 0.05503115847325858, 'bear_tp_mult': 2.203204530394349, 'bear_tsl_mult': 0.43755880564444133, 'bear_time_stop': 71, 'bear_use_sma': False, 'bear_use_ema': False, 'bear_use_atr': False, 'bear_use_adx': False, 'bear_use_spike': True, 'bear_rsi_required': False, 'sideways_strategy': 'breakout', 'sideways_bb_std_mult': 0.9860951240458031, 'sideways_rsi_os': 21, 'sideways_rsi_ob': 47, 'sideways_adx_thresh': 29.746671162295613, 'sideways_atr_min_pct': 0.00527163923177399, 'sideways_atr_max_pct': 0.028108025976821202, 'sideways_tp_mult': 1.7065640612625612, 'sideways_tsl_mult': 0.9474077316659187, 'sideways_time_stop': 37, 'sideways_use_sma': False, 'sideways_use_ema': True, 'sideways_use_atr': False, 'sideways_use_adx': False, 'sideways_use_spike': False, 'sideways_rsi_required': False}.
[I 2025-09-01 09:36:34,180] Trial 235 finished with values: [-1000000000.0, 1000000000.0] and parameters: {'p_sma': 27, 'p_std': 25, 'p_atr': 16, 'p_adx': 14, 'rsi_period': 66, 'ema1': 20, 'ema2': 16, 'slip_atr_k': 0.16890214105506615, 'slip_spread_k': 0.2977983293218245, 'spread_hl_frac': 0.031876854261555065, 'bb_std_mult': 1.834285301624554, 'rsi_os': 21, 'rsi_ob': 90, 'vol_spike': 0.2483405230957768, 'adx_thresh': 5.0810030534380655, 'atr_min_pct': 0.006144450378132906, 'atr_max_pct': 0.05351112379644342, 'tp_mult': 2.8501152296167027, 'tsl_mult': 0.6267826259415031, 'strategy': 'mean_reversion', 'time_stop': 201, 'use_sma': True, 'use_atr': False, 'use_adx': True, 'use_ema': False, 'use_spike': False, 'rsi_required': False, 'edge_k': 1.5553023632584941, 'edge_cap': 0.07392553651168621, 'bull_strategy': 'mean_reversion', 'bull_bb_std_mult': 0.6353050729996438, 'bull_rsi_os': 11, 'bull_rsi_ob': 57, 'bull_adx_thresh': 6.3929398130946495, 'bull_atr_min_pct': 0.005738718886056862, 'bull_atr_max_pct': 0.06210111577946231, 'bull_tp_mult': 2.170476489525227, 'bull_tsl_mult': 0.08144057220033542, 'bull_time_stop': 196, 'bull_use_sma': True, 'bull_use_ema': False, 'bull_use_atr': False, 'bull_use_adx': True, 'bull_use_spike': False, 'bull_rsi_required': True, 'bear_strategy': 'mean_reversion', 'bear_bb_std_mult': 3.528445992399663, 'bear_rsi_os': 48, 'bear_rsi_ob': 66, 'bear_adx_thresh': 12.480340703671077, 'bear_atr_min_pct': 0.015368223789691587, 'bear_atr_max_pct': 0.05406033383484304, 'bear_tp_mult': 2.2144655250323826, 'bear_tsl_mult': 0.44116014844376517, 'bear_time_stop': 73, 'bear_use_sma': False, 'bear_use_ema': True, 'bear_use_atr': True, 'bear_use_adx': False, 'bear_use_spike': True, 'bear_rsi_required': False, 'sideways_strategy': 'mean_reversion', 'sideways_bb_std_mult': 1.0419563505563032, 'sideways_rsi_os': 41, 'sideways_rsi_ob': 47, 'sideways_adx_thresh': 11.911149984566029, 'sideways_atr_min_pct': 0.005223913097956613, 'sideways_atr_max_pct': 0.06751108291880795, 'sideways_tp_mult': 1.7003393707799677, 'sideways_tsl_mult': 0.39390082141099847, 'sideways_time_stop': 13, 'sideways_use_sma': False, 'sideways_use_ema': True, 'sideways_use_atr': False, 'sideways_use_adx': False, 'sideways_use_spike': True, 'sideways_rsi_required': False}.
[I 2025-09-01 09:36:34,211] Trial 236 finished with values: [-1000000000.0, 0.38038987010118896] and parameters: {'p_sma': 27, 'p_std': 11, 'p_atr': 10, 'p_adx': 15, 'rsi_period': 66, 'ema1': 13, 'ema2': 46, 'slip_atr_k': 0.16486450241140266, 'slip_spread_k': 0.2935827945590483, 'spread_hl_frac': 0.013077586285515216, 'bb_std_mult': 1.8427639729075602, 'rsi_os': 12, 'rsi_ob': 90, 'vol_spike': 0.29910023957956483, 'adx_thresh': 24.063674166379688, 'atr_min_pct': 0.02364546268598205, 'atr_max_pct': 0.1429537268708625, 'tp_mult': 2.712798550736494, 'tsl_mult': 0.0012172968261625894, 'strategy': 'mean_reversion', 'time_stop': 95, 'use_sma': True, 'use_atr': False, 'use_adx': False, 'use_ema': False, 'use_spike': False, 'rsi_required': False, 'edge_k': 1.5563184679553461, 'edge_cap': 0.0788581571748443, 'bull_strategy': 'mean_reversion', 'bull_bb_std_mult': 2.389318427100162, 'bull_rsi_os': 9, 'bull_rsi_ob': 67, 'bull_adx_thresh': 6.530139564315249, 'bull_atr_min_pct': 0.013084755826044648, 'bull_atr_max_pct': 0.061795850867543536, 'bull_tp_mult': 2.7535434540899795, 'bull_tsl_mult': 0.07786291613260084, 'bull_time_stop': 192, 'bull_use_sma': True, 'bull_use_ema': False, 'bull_use_atr': True, 'bull_use_adx': True, 'bull_use_spike': False, 'bull_rsi_required': True, 'bear_strategy': 'breakout', 'bear_bb_std_mult': 3.549758747475588, 'bear_rsi_os': 46, 'bear_rsi_ob': 66, 'bear_adx_thresh': 12.16601344155567, 'bear_atr_min_pct': 0.0021719242386836046, 'bear_atr_max_pct': 0.07451393138044554, 'bear_tp_mult': 1.470183141096999, 'bear_tsl_mult': 0.436754378709437, 'bear_time_stop': 216, 'bear_use_sma': False, 'bear_use_ema': False, 'bear_use_atr': False, 'bear_use_adx': False, 'bear_use_spike': True, 'bear_rsi_required': False, 'sideways_strategy': 'breakout', 'sideways_bb_std_mult': 1.0367893282972303, 'sideways_rsi_os': 40, 'sideways_rsi_ob': 72, 'sideways_adx_thresh': 29.867650961862942, 'sideways_atr_min_pct': 0.005126934446088273, 'sideways_atr_max_pct': 0.06599441535863555, 'sideways_tp_mult': 1.6962189811342303, 'sideways_tsl_mult': 0.9581004343176894, 'sideways_time_stop': 204, 'sideways_use_sma': False, 'sideways_use_ema': True, 'sideways_use_atr': False, 'sideways_use_adx': False, 'sideways_use_spike': False, 'sideways_rsi_required': False}.
[I 2025-09-01 09:36:34,675] Trial 233 finished with values: [-1000000000.0, 1000000000.0] and parameters: {'p_sma': 27, 'p_std': 36, 'p_atr': 15, 'p_adx': 14, 'rsi_period': 66, 'ema1': 20, 'ema2': 52, 'slip_atr_k': 0.034897992278299754, 'slip_spread_k': 0.31880270346176565, 'spread_hl_frac': 0.00952990316598498, 'bb_std_mult': 1.3352544512058588, 'rsi_os': 44, 'rsi_ob': 90, 'vol_spike': 0.22957331839845802, 'adx_thresh': 5.009042648231357, 'atr_min_pct': 0.010230786619203682, 'atr_max_pct': 0.05403125316539095, 'tp_mult': 1.423030030951788, 'tsl_mult': 0.047397613916400114, 'strategy': 'mean_reversion', 'time_stop': 71, 'use_sma': True, 'use_atr': False, 'use_adx': True, 'use_ema': False, 'use_spike': False, 'rsi_required': False, 'edge_k': 1.5676400934883157, 'edge_cap': 0.07007907205603717, 'bull_strategy': 'mean_reversion', 'bull_bb_std_mult': 0.6423640468867649, 'bull_rsi_os': 33, 'bull_rsi_ob': 55, 'bull_adx_thresh': 19.499411593826988, 'bull_atr_min_pct': 0.01912109096755421, 'bull_atr_max_pct': 0.10606401251685743, 'bull_tp_mult': 2.1542201103813436, 'bull_tsl_mult': 0.5088721920932584, 'bull_time_stop': 141, 'bull_use_sma': False, 'bull_use_ema': False, 'bull_use_atr': False, 'bull_use_adx': False, 'bull_use_spike': False, 'bull_rsi_required': True, 'bear_strategy': 'mean_reversion', 'bear_bb_std_mult': 3.599554620945673, 'bear_rsi_os': 48, 'bear_rsi_ob': 68, 'bear_adx_thresh': 12.216912129191176, 'bear_atr_min_pct': 0.016517706729089535, 'bear_atr_max_pct': 0.05298990613392297, 'bear_tp_mult': 1.4871950494897566, 'bear_tsl_mult': 0.46094282715961105, 'bear_time_stop': 97, 'bear_use_sma': True, 'bear_use_ema': True, 'bear_use_atr': True, 'bear_use_adx': False, 'bear_use_spike': True, 'bear_rsi_required': False, 'sideways_strategy': 'mean_reversion', 'sideways_bb_std_mult': 1.162608606454752, 'sideways_rsi_os': 42, 'sideways_rsi_ob': 47, 'sideways_adx_thresh': 6.167010312653762, 'sideways_atr_min_pct': 0.005237335589041289, 'sideways_atr_max_pct': 0.027240305081322712, 'sideways_tp_mult': 1.7169855298276866, 'sideways_tsl_mult': 0.9607609543789055, 'sideways_time_stop': 205, 'sideways_use_sma': False, 'sideways_use_ema': True, 'sideways_use_atr': False, 'sideways_use_adx': True, 'sideways_use_spike': True, 'sideways_rsi_required': True}.
[I 2025-09-01 09:36:35,376] Trial 238 finished with values: [-1000000000.0, 1000000000.0] and parameters: {'p_sma': 27, 'p_std': 17, 'p_atr': 16, 'p_adx': 13, 'rsi_period': 66, 'ema1': 15, 'ema2': 16, 'slip_atr_k': 0.047473322877880024, 'slip_spread_k': 0.5896946873680862, 'spread_hl_frac': 0.012242966516955724, 'bb_std_mult': 1.6903905794844833, 'rsi_os': 10, 'rsi_ob': 90, 'vol_spike': 0.23461339113197838, 'adx_thresh': 29.7295561088512, 'atr_min_pct': 0.019252943482443132, 'atr_max_pct': 0.010067099050146064, 'tp_mult': 2.8422878453348615, 'tsl_mult': 0.8220300426586797, 'strategy': 'breakout', 'time_stop': 199, 'use_sma': True, 'use_atr': False, 'use_adx': True, 'use_ema': False, 'use_spike': False, 'rsi_required': False, 'edge_k': 1.555708560282009, 'edge_cap': 0.07214907651571485, 'bull_strategy': 'mean_reversion', 'bull_bb_std_mult': 2.3837582802844066, 'bull_rsi_os': 29, 'bull_rsi_ob': 57, 'bull_adx_thresh': 6.15678289971945, 'bull_atr_min_pct': 0.01929107120431429, 'bull_atr_max_pct': 0.06287991688903655, 'bull_tp_mult': 2.7571839663668096, 'bull_tsl_mult': 0.08114395600291889, 'bull_time_stop': 220, 'bull_use_sma': True, 'bull_use_ema': False, 'bull_use_atr': False, 'bull_use_adx': False, 'bull_use_spike': True, 'bull_rsi_required': False, 'bear_strategy': 'mean_reversion', 'bear_bb_std_mult': 3.5447247386196374, 'bear_rsi_os': 47, 'bear_rsi_ob': 66, 'bear_adx_thresh': 7.537958578313283, 'bear_atr_min_pct': 0.011608323920130621, 'bear_atr_max_pct': 0.12051305789968303, 'bear_tp_mult': 1.5245447482082526, 'bear_tsl_mult': 0.3872879553840278, 'bear_time_stop': 211, 'bear_use_sma': False, 'bear_use_ema': True, 'bear_use_atr': True, 'bear_use_adx': False, 'bear_use_spike': False, 'bear_rsi_required': False, 'sideways_strategy': 'breakout', 'sideways_bb_std_mult': 1.2374400515241404, 'sideways_rsi_os': 40, 'sideways_rsi_ob': 72, 'sideways_adx_thresh': 29.15844344104354, 'sideways_atr_min_pct': 0.01185467485531984, 'sideways_atr_max_pct': 0.06592448310212143, 'sideways_tp_mult': 1.7960045646508234, 'sideways_tsl_mult': 0.20988845485404461, 'sideways_time_stop': 296, 'sideways_use_sma': False, 'sideways_use_ema': True, 'sideways_use_atr': False, 'sideways_use_adx': False, 'sideways_use_spike': False, 'sideways_rsi_required': False}.
[I 2025-09-01 09:37:15,555] Trial 240 finished with values: [-1000000000.0, 1000000000.0] and parameters: {'p_sma': 29, 'p_std': 37, 'p_atr': 16, 'p_adx': 13, 'rsi_period': 24, 'ema1': 15, 'ema2': 49, 'slip_atr_k': 0.04749904257115035, 'slip_spread_k': 0.45923474015099286, 'spread_hl_frac': 0.011245488497520254, 'bb_std_mult': 1.3478896985697397, 'rsi_os': 10, 'rsi_ob': 88, 'vol_spike': 0.1410270970236721, 'adx_thresh': 29.825097772689716, 'atr_min_pct': 0.019253158273371297, 'atr_max_pct': 0.09676792697851083, 'tp_mult': 1.2387189125604519, 'tsl_mult': 0.2407117309932038, 'strategy': 'breakout', 'time_stop': 210, 'use_sma': False, 'use_atr': False, 'use_adx': True, 'use_ema': True, 'use_spike': True, 'rsi_required': False, 'edge_k': 1.4635093681140106, 'edge_cap': 0.7562340702827833, 'bull_strategy': 'mean_reversion', 'bull_bb_std_mult': 0.7100843061212567, 'bull_rsi_os': 15, 'bull_rsi_ob': 45, 'bull_adx_thresh': 23.904173933040884, 'bull_atr_min_pct': 0.019181179009721952, 'bull_atr_max_pct': 0.06028541833688179, 'bull_tp_mult': 2.13263840111127, 'bull_tsl_mult': 0.10937275945013247, 'bull_time_stop': 37, 'bull_use_sma': True, 'bull_use_ema': False, 'bull_use_atr': False, 'bull_use_adx': False, 'bull_use_spike': True, 'bull_rsi_required': False, 'bear_strategy': 'mean_reversion', 'bear_bb_std_mult': 2.9094400823057964, 'bear_rsi_os': 27, 'bear_rsi_ob': 67, 'bear_adx_thresh': 11.425687671243804, 'bear_atr_min_pct': 0.015577045965994988, 'bear_atr_max_pct': 0.12128791279512656, 'bear_tp_mult': 2.477092139422163, 'bear_tsl_mult': 0.38562644837481913, 'bear_time_stop': 97, 'bear_use_sma': False, 'bear_use_ema': True, 'bear_use_atr': True, 'bear_use_adx': True, 'bear_use_spike': False, 'bear_rsi_required': True, 'sideways_strategy': 'breakout', 'sideways_bb_std_mult': 0.9359837155060715, 'sideways_rsi_os': 42, 'sideways_rsi_ob': 46, 'sideways_adx_thresh': 29.131054354822698, 'sideways_atr_min_pct': 0.011619806497884912, 'sideways_atr_max_pct': 0.062234764641484, 'sideways_tp_mult': 1.7747491158369006, 'sideways_tsl_mult': 0.9082394839944379, 'sideways_time_stop': 209, 'sideways_use_sma': True, 'sideways_use_ema': True, 'sideways_use_atr': True, 'sideways_use_adx': False, 'sideways_use_spike': False, 'sideways_rsi_required': False}.
[I 2025-09-01 09:37:16,066] Trial 241 finished with values: [-0.015887695368505206, 0.015785340111432098] and parameters: {'p_sma': 59, 'p_std': 23, 'p_atr': 22, 'p_adx': 13, 'rsi_period': 69, 'ema1': 20, 'ema2': 17, 'slip_atr_k': 0.048421001769050814, 'slip_spread_k': 0.258346252128443, 'spread_hl_frac': 0.02271111513070813, 'bb_std_mult': 1.2050374495703433, 'rsi_os': 14, 'rsi_ob': 65, 'vol_spike': 0.23414499171916786, 'adx_thresh': 6.5634773752974365, 'atr_min_pct': 0.007488601165223817, 'atr_max_pct': 0.09621183372581518, 'tp_mult': 1.8030970252881422, 'tsl_mult': 0.015228360366034685, 'strategy': 'breakout', 'time_stop': 136, 'use_sma': False, 'use_atr': True, 'use_adx': True, 'use_ema': True, 'use_spike': True, 'rsi_required': False, 'edge_k': 1.9630353006382266, 'edge_cap': 0.3281035762982811, 'bull_strategy': 'mean_reversion', 'bull_bb_std_mult': 0.6873912361836437, 'bull_rsi_os': 16, 'bull_rsi_ob': 45, 'bull_adx_thresh': 23.87844822133967, 'bull_atr_min_pct': 0.029374671764688824, 'bull_atr_max_pct': 0.06322619974146831, 'bull_tp_mult': 2.4351152756912575, 'bull_tsl_mult': 0.9589002063903884, 'bull_time_stop': 218, 'bull_use_sma': True, 'bull_use_ema': False, 'bull_use_atr': False, 'bull_use_adx': False, 'bull_use_spike': True, 'bull_rsi_required': False, 'bear_strategy': 'mean_reversion', 'bear_bb_std_mult': 2.6292576550646185, 'bear_rsi_os': 27, 'bear_rsi_ob': 67, 'bear_adx_thresh': 10.662770191680838, 'bear_atr_min_pct': 0.01142406773904579, 'bear_atr_max_pct': 0.12020571774393737, 'bear_tp_mult': 2.655245307150758, 'bear_tsl_mult': 0.37373353710508905, 'bear_time_stop': 31, 'bear_use_sma': False, 'bear_use_ema': True, 'bear_use_atr': True, 'bear_use_adx': True, 'bear_use_spike': False, 'bear_rsi_required': True, 'sideways_strategy': 'breakout', 'sideways_bb_std_mult': 0.956804857107142, 'sideways_rsi_os': 40, 'sideways_rsi_ob': 46, 'sideways_adx_thresh': 29.168128130564327, 'sideways_atr_min_pct': 0.0039246786417118954, 'sideways_atr_max_pct': 0.03294159850729042, 'sideways_tp_mult': 1.7906032536002154, 'sideways_tsl_mult': 0.3164991436257302, 'sideways_time_stop': 210, 'sideways_use_sma': True, 'sideways_use_ema': True, 'sideways_use_atr': True, 'sideways_use_adx': False, 'sideways_use_spike': False, 'sideways_rsi_required': False}.
[I 2025-09-01 09:37:16,832] Trial 242 finished with values: [-1000000000.0, 1000000000.0] and parameters: {'p_sma': 29, 'p_std': 23, 'p_atr': 17, 'p_adx': 13, 'rsi_period': 84, 'ema1': 20, 'ema2': 39, 'slip_atr_k': 0.048719341535379344, 'slip_spread_k': 0.2624021001622714, 'spread_hl_frac': 0.011162144601420017, 'bb_std_mult': 1.9015777736878523, 'rsi_os': 10, 'rsi_ob': 57, 'vol_spike': 0.1452856905605262, 'adx_thresh': 6.402838088876141, 'atr_min_pct': 0.007898551288695576, 'atr_max_pct': 0.08965374968939921, 'tp_mult': 1.911839291526916, 'tsl_mult': 0.07274530946417938, 'strategy': 'breakout', 'time_stop': 50, 'use_sma': False, 'use_atr': True, 'use_adx': True, 'use_ema': True, 'use_spike': True, 'rsi_required': False, 'edge_k': 1.9053218656850746, 'edge_cap': 0.8395060417657738, 'bull_strategy': 'breakout', 'bull_bb_std_mult': 2.598258761333004, 'bull_rsi_os': 16, 'bull_rsi_ob': 87, 'bull_adx_thresh': 8.20051703932956, 'bull_atr_min_pct': 0.02928230303257384, 'bull_atr_max_pct': 0.13958531748886774, 'bull_tp_mult': 2.295235150972746, 'bull_tsl_mult': 0.15894770729142288, 'bull_time_stop': 113, 'bull_use_sma': True, 'bull_use_ema': True, 'bull_use_atr': False, 'bull_use_adx': False, 'bull_use_spike': True, 'bull_rsi_required': False, 'bear_strategy': 'mean_reversion', 'bear_bb_std_mult': 3.4611098815806898, 'bear_rsi_os': 33, 'bear_rsi_ob': 67, 'bear_adx_thresh': 11.402798737035837, 'bear_atr_min_pct': 0.01578023694814755, 'bear_atr_max_pct': 0.0977153243745364, 'bear_tp_mult': 2.7044038601032185, 'bear_tsl_mult': 0.5117226735938141, 'bear_time_stop': 19, 'bear_use_sma': False, 'bear_use_ema': True, 'bear_use_atr': True, 'bear_use_adx': True, 'bear_use_spike': False, 'bear_rsi_required': True, 'sideways_strategy': 'breakout', 'sideways_bb_std_mult': 3.338107921083891, 'sideways_rsi_os': 51, 'sideways_rsi_ob': 46, 'sideways_adx_thresh': 30.453595312949467, 'sideways_atr_min_pct': 0.02301057127075458, 'sideways_atr_max_pct': 0.061363490439895516, 'sideways_tp_mult': 1.8892629481932903, 'sideways_tsl_mult': 0.9033068670364004, 'sideways_time_stop': 217, 'sideways_use_sma': True, 'sideways_use_ema': True, 'sideways_use_atr': True, 'sideways_use_adx': False, 'sideways_use_spike': False, 'sideways_rsi_required': False}.
[I 2025-09-01 09:37:17,184] Trial 239 finished with values: [-1000000000.0, 1000000000.0] and parameters: {'p_sma': 11, 'p_std': 36, 'p_atr': 22, 'p_adx': 13, 'rsi_period': 77, 'ema1': 20, 'ema2': 58, 'slip_atr_k': 0.04758679783425662, 'slip_spread_k': 0.2697803398560725, 'spread_hl_frac': 0.01204027731557986, 'bb_std_mult': 1.7156744989642045, 'rsi_os': 28, 'rsi_ob': 91, 'vol_spike': 0.14392662647949878, 'adx_thresh': 6.47544664993078, 'atr_min_pct': 0.007851846030939717, 'atr_max_pct': 0.12077557057455823, 'tp_mult': 1.792233381736653, 'tsl_mult': 0.07498057966117827, 'strategy': 'breakout', 'time_stop': 210, 'use_sma': False, 'use_atr': False, 'use_adx': True, 'use_ema': True, 'use_spike': True, 'rsi_required': False, 'edge_k': 1.4636220168646317, 'edge_cap': 0.10343671103652496, 'bull_strategy': 'mean_reversion', 'bull_bb_std_mult': 2.4793345732480376, 'bull_rsi_os': 29, 'bull_rsi_ob': 87, 'bull_adx_thresh': 8.743744819612735, 'bull_atr_min_pct': 0.029600971554846076, 'bull_atr_max_pct': 0.0697365075404521, 'bull_tp_mult': 2.154673306990492, 'bull_tsl_mult': 0.16272254212269469, 'bull_time_stop': 115, 'bull_use_sma': True, 'bull_use_ema': False, 'bull_use_atr': False, 'bull_use_adx': False, 'bull_use_spike': True, 'bull_rsi_required': False, 'bear_strategy': 'mean_reversion', 'bear_bb_std_mult': 3.589718562776378, 'bear_rsi_os': 47, 'bear_rsi_ob': 67, 'bear_adx_thresh': 10.673244991968152, 'bear_atr_min_pct': 0.011636154311843967, 'bear_atr_max_pct': 0.12136880369629104, 'bear_tp_mult': 2.3151837026522992, 'bear_tsl_mult': 0.37241932590120497, 'bear_time_stop': 29, 'bear_use_sma': False, 'bear_use_ema': True, 'bear_use_atr': True, 'bear_use_adx': True, 'bear_use_spike': False, 'bear_rsi_required': True, 'sideways_strategy': 'breakout', 'sideways_bb_std_mult': 1.2217911930029681, 'sideways_rsi_os': 42, 'sideways_rsi_ob': 46, 'sideways_adx_thresh': 29.159039867927536, 'sideways_atr_min_pct': 0.011899785434251933, 'sideways_atr_max_pct': 0.032627973397200305, 'sideways_tp_mult': 1.1207371237572201, 'sideways_tsl_mult': 0.9073590763820611, 'sideways_time_stop': 210, 'sideways_use_sma': True, 'sideways_use_ema': True, 'sideways_use_atr': True, 'sideways_use_adx': False, 'sideways_use_spike': False, 'sideways_rsi_required': False}.
