[I 2025-09-01 09:38:42,795] Trial 251 finished with values: [-1000000000.0, 1000000000.0] and parameters: {'p_sma': 24, 'p_std': 27, 'p_atr': 15, 'p_adx': 15, 'rsi_period': 15, 'ema1': 9, 'ema2': 17, 'slip_atr_k': 0.05230642202257221, 'slip_spread_k': 0.11130985636250507, 'spread_hl_frac': 0.013278823968207773, 'bb_std_mult': 1.9176378403718304, 'rsi_os': 14, 'rsi_ob': 50, 'vol_spike': 0.23497070577368073, 'adx_thresh': 28.28516378822289, 'atr_min_pct': 0.019952345767357105, 'atr_max_pct': 0.14056838838755054, 'tp_mult': 2.4554057750033746, 'tsl_mult': 0.01718539023393833, 'strategy': 'mean_reversion', 'time_stop': 63, 'use_sma': True, 'use_atr': False, 'use_adx': True, 'use_ema': False, 'use_spike': False, 'rsi_required': False, 'edge_k': 1.6122725064267904, 'edge_cap': 0.1275990663973767, 'bull_strategy': 'mean_reversion', 'bull_bb_std_mult': 1.2006827226961634, 'bull_rsi_os': 46, 'bull_rsi_ob': 85, 'bull_adx_thresh': 21.99663678181326, 'bull_atr_min_pct': 0.029961501381748218, 'bull_atr_max_pct': 0.059140177237833255, 'bull_tp_mult': 2.1931428765762333, 'bull_tsl_mult': 0.9734001104457881, 'bull_time_stop': 24, 'bull_use_sma': False, 'bull_use_ema': False, 'bull_use_atr': False, 'bull_use_adx': True, 'bull_use_spike': False, 'bull_rsi_required': True, 'bear_strategy': 'mean_reversion', 'bear_bb_std_mult': 2.6675759120777847, 'bear_rsi_os': 16, 'bear_rsi_ob': 68, 'bear_adx_thresh': 14.066316918807757, 'bear_atr_min_pct': 0.0286854387009559, 'bear_atr_max_pct': 0.1244348135904656, 'bear_tp_mult': 2.2437008609523867, 'bear_tsl_mult': 0.39878226671721756, 'bear_time_stop': 273, 'bear_use_sma': True, 'bear_use_ema': True, 'bear_use_atr': True, 'bear_use_adx': False, 'bear_use_spike': False, 'bear_rsi_required': False, 'sideways_strategy': 'mean_reversion', 'sideways_bb_std_mult': 2.7377594513244095, 'sideways_rsi_os': 43, 'sideways_rsi_ob': 47, 'sideways_adx_thresh': 30.060621111525837, 'sideways_atr_min_pct': 0.008571013929156348, 'sideways_atr_max_pct': 0.0634150047680794, 'sideways_tp_mult': 1.7458372750400852, 'sideways_tsl_mult': 0.9337690404744164, 'sideways_time_stop': 135, 'sideways_use_sma': False, 'sideways_use_ema': True, 'sideways_use_atr': False, 'sideways_use_adx': True, 'sideways_use_spike': True, 'sideways_rsi_required': True}.
[I 2025-09-01 09:38:42,830] Trial 254 finished with values: [-1000000000.0, 1000000000.0] and parameters: {'p_sma': 28, 'p_std': 27, 'p_atr': 11, 'p_adx': 14, 'rsi_period': 67, 'ema1': 20, 'ema2': 60, 'slip_atr_k': 0.2170589192792886, 'slip_spread_k': 0.24378285323055537, 'spread_hl_frac': 0.012842581968468283, 'bb_std_mult': 1.8065726397462034, 'rsi_os': 9, 'rsi_ob': 45, 'vol_spike': 0.2332002445425658, 'adx_thresh': 28.448005287870785, 'atr_min_pct': 0.009099212720298296, 'atr_max_pct': 0.1415164671669608, 'tp_mult': 1.7569783966822083, 'tsl_mult': 0.014196370905212252, 'strategy': 'mean_reversion', 'time_stop': 216, 'use_sma': True, 'use_atr': False, 'use_adx': True, 'use_ema': False, 'use_spike': True, 'rsi_required': False, 'edge_k': 0.8786395688352646, 'edge_cap': 0.12333913828640636, 'bull_strategy': 'mean_reversion', 'bull_bb_std_mult': 1.3590751551972513, 'bull_rsi_os': 44, 'bull_rsi_ob': 84, 'bull_adx_thresh': 5.724417799573274, 'bull_atr_min_pct': 0.02992012164935183, 'bull_atr_max_pct': 0.06391064125162259, 'bull_tp_mult': 2.195644930269421, 'bull_tsl_mult': 0.12233735241893995, 'bull_time_stop': 20, 'bull_use_sma': True, 'bull_use_ema': False, 'bull_use_atr': False, 'bull_use_adx': False, 'bull_use_spike': False, 'bull_rsi_required': True, 'bear_strategy': 'mean_reversion', 'bear_bb_std_mult': 3.3618616612519965, 'bear_rsi_os': 14, 'bear_rsi_ob': 65, 'bear_adx_thresh': 14.03354192647451, 'bear_atr_min_pct': 0.0067150884356709725, 'bear_atr_max_pct': 0.11119604685919589, 'bear_tp_mult': 1.6395501833799233, 'bear_tsl_mult': 0.4459488875028629, 'bear_time_stop': 40, 'bear_use_sma': False, 'bear_use_ema': True, 'bear_use_atr': True, 'bear_use_adx': True, 'bear_use_spike': True, 'bear_rsi_required': False, 'sideways_strategy': 'mean_reversion', 'sideways_bb_std_mult': 1.167426690834439, 'sideways_rsi_os': 9, 'sideways_rsi_ob': 90, 'sideways_adx_thresh': 29.584287076351778, 'sideways_atr_min_pct': 0.015070814926999078, 'sideways_atr_max_pct': 0.05741870743435988, 'sideways_tp_mult': 1.7407190529664536, 'sideways_tsl_mult': 0.9431276060730369, 'sideways_time_stop': 214, 'sideways_use_sma': True, 'sideways_use_ema': True, 'sideways_use_atr': True, 'sideways_use_adx': False, 'sideways_use_spike': False, 'sideways_rsi_required': False}.
[I 2025-09-01 09:39:22,456] Trial 252 finished with values: [-1000000000.0, 1000000000.0] and parameters: {'p_sma': 28, 'p_std': 25, 'p_atr': 15, 'p_adx': 13, 'rsi_period': 49, 'ema1': 7, 'ema2': 19, 'slip_atr_k': 0.17312893842937782, 'slip_spread_k': 0.23572780077287486, 'spread_hl_frac': 0.03540014067886078, 'bb_std_mult': 1.9779843572932923, 'rsi_os': 47, 'rsi_ob': 87, 'vol_spike': 0.22033467426427894, 'adx_thresh': 5.510902833462248, 'atr_min_pct': 0.019943923141544546, 'atr_max_pct': 0.0747193935799004, 'tp_mult': 1.7539766442954154, 'tsl_mult': 0.011691321460965522, 'strategy': 'mean_reversion', 'time_stop': 33, 'use_sma': True, 'use_atr': False, 'use_adx': True, 'use_ema': False, 'use_spike': False, 'rsi_required': False, 'edge_k': 0.12965898598422854, 'edge_cap': 0.4365561252111365, 'bull_strategy': 'mean_reversion', 'bull_bb_std_mult': 1.7060359890071983, 'bull_rsi_os': 49, 'bull_rsi_ob': 54, 'bull_adx_thresh': 5.545925734822894, 'bull_atr_min_pct': 0.028865565490404445, 'bull_atr_max_pct': 0.10057533470989834, 'bull_tp_mult': 2.4231195578951805, 'bull_tsl_mult': 0.3411284874792614, 'bull_time_stop': 122, 'bull_use_sma': True, 'bull_use_ema': False, 'bull_use_atr': False, 'bull_use_adx': False, 'bull_use_spike': False, 'bull_rsi_required': True, 'bear_strategy': 'mean_reversion', 'bear_bb_std_mult': 3.370854238856011, 'bear_rsi_os': 30, 'bear_rsi_ob': 53, 'bear_adx_thresh': 14.123260849608025, 'bear_atr_min_pct': 0.015075533568613193, 'bear_atr_max_pct': 0.11933547845847224, 'bear_tp_mult': 2.18150279580853, 'bear_tsl_mult': 0.4348727892035168, 'bear_time_stop': 212, 'bear_use_sma': False, 'bear_use_ema': True, 'bear_use_atr': True, 'bear_use_adx': False, 'bear_use_spike': False, 'bear_rsi_required': False, 'sideways_strategy': 'mean_reversion', 'sideways_bb_std_mult': 2.4896106499900275, 'sideways_rsi_os': 7, 'sideways_rsi_ob': 58, 'sideways_adx_thresh': 19.517082439365414, 'sideways_atr_min_pct': 0.014850164280851298, 'sideways_atr_max_pct': 0.057333519848288536, 'sideways_tp_mult': 1.7460815019325653, 'sideways_tsl_mult': 0.9335426241469755, 'sideways_time_stop': 93, 'sideways_use_sma': False, 'sideways_use_ema': True, 'sideways_use_atr': False, 'sideways_use_adx': False, 'sideways_use_spike': False, 'sideways_rsi_required': False}.
[I 2025-09-01 09:39:25,754] Trial 255 finished with values: [-1000000000.0, 1000000000.0] and parameters: {'p_sma': 26, 'p_std': 27, 'p_atr': 29, 'p_adx': 14, 'rsi_period': 74, 'ema1': 20, 'ema2': 60, 'slip_atr_k': 0.17909038683920667, 'slip_spread_k': 0.24407405486039746, 'spread_hl_frac': 0.03417055436377396, 'bb_std_mult': 1.815501010619821, 'rsi_os': 9, 'rsi_ob': 87, 'vol_spike': 0.23256300401127636, 'adx_thresh': 28.372263972204266, 'atr_min_pct': 0.009236541527454158, 'atr_max_pct': 0.07379950163586325, 'tp_mult': 2.1779202291206246, 'tsl_mult': 0.0021925334842680423, 'strategy': 'breakout', 'time_stop': 293, 'use_sma': True, 'use_atr': False, 'use_adx': True, 'use_ema': False, 'use_spike': True, 'rsi_required': False, 'edge_k': 0.29994000403314314, 'edge_cap': 0.43332760267787956, 'bull_strategy': 'mean_reversion', 'bull_bb_std_mult': 1.7181424211195282, 'bull_rsi_os': 49, 'bull_rsi_ob': 94, 'bull_adx_thresh': 6.90356534139612, 'bull_atr_min_pct': 0.02984886609203695, 'bull_atr_max_pct': 0.044024694467486136, 'bull_tp_mult': 2.4234546556747825, 'bull_tsl_mult': 0.33672674717741935, 'bull_time_stop': 20, 'bull_use_sma': False, 'bull_use_ema': False, 'bull_use_atr': False, 'bull_use_adx': True, 'bull_use_spike': False, 'bull_rsi_required': True, 'bear_strategy': 'mean_reversion', 'bear_bb_std_mult': 1.4218219441349182, 'bear_rsi_os': 17, 'bear_rsi_ob': 65, 'bear_adx_thresh': 21.468361143991032, 'bear_atr_min_pct': 0.015020002961625208, 'bear_atr_max_pct': 0.11932704473306059, 'bear_tp_mult': 1.9581286618266267, 'bear_tsl_mult': 0.4211798277567975, 'bear_time_stop': 220, 'bear_use_sma': True, 'bear_use_ema': True, 'bear_use_atr': True, 'bear_use_adx': True, 'bear_use_spike': True, 'bear_rsi_required': False, 'sideways_strategy': 'breakout', 'sideways_bb_std_mult': 1.1426526122978566, 'sideways_rsi_os': 38, 'sideways_rsi_ob': 74, 'sideways_adx_thresh': 19.576796283891696, 'sideways_atr_min_pct': 0.024545426873844742, 'sideways_atr_max_pct': 0.1199839091922088, 'sideways_tp_mult': 1.740119911507411, 'sideways_tsl_mult': 0.688933240116077, 'sideways_time_stop': 198, 'sideways_use_sma': True, 'sideways_use_ema': True, 'sideways_use_atr': True, 'sideways_use_adx': True, 'sideways_use_spike': True, 'sideways_rsi_required': True}.
[I 2025-09-01 09:39:26,654] Trial 256 finished with values: [-1000000000.0, 1000000000.0] and parameters: {'p_sma': 26, 'p_std': 25, 'p_atr': 16, 'p_adx': 14, 'rsi_period': 60, 'ema1': 27, 'ema2': 21, 'slip_atr_k': 0.1811858632471923, 'slip_spread_k': 0.35695225569530475, 'spread_hl_frac': 0.025512129865893924, 'bb_std_mult': 1.8140058920909015, 'rsi_os': 12, 'rsi_ob': 89, 'vol_spike': 0.23062617072776373, 'adx_thresh': 5.509650967804145, 'atr_min_pct': 0.0038536014314050158, 'atr_max_pct': 0.12477346456678819, 'tp_mult': 1.8290589928317225, 'tsl_mult': 0.04339917377353396, 'strategy': 'breakout', 'time_stop': 149, 'use_sma': True, 'use_atr': False, 'use_adx': True, 'use_ema': False, 'use_spike': True, 'rsi_required': False, 'edge_k': 0.8872623151259275, 'edge_cap': 0.33620444707781705, 'bull_strategy': 'breakout', 'bull_bb_std_mult': 3.0568751111652817, 'bull_rsi_os': 17, 'bull_rsi_ob': 94, 'bull_adx_thresh': 26.989062067517263, 'bull_atr_min_pct': 0.029366159931856737, 'bull_atr_max_pct': 0.021013987254684695, 'bull_tp_mult': 2.932782057829532, 'bull_tsl_mult': 0.33592293761860204, 'bull_time_stop': 121, 'bull_use_sma': True, 'bull_use_ema': True, 'bull_use_atr': False, 'bull_use_adx': False, 'bull_use_spike': True, 'bull_rsi_required': False, 'bear_strategy': 'mean_reversion', 'bear_bb_std_mult': 1.489886084828221, 'bear_rsi_os': 46, 'bear_rsi_ob': 69, 'bear_adx_thresh': 21.59189006984573, 'bear_atr_min_pct': 0.006851734833475943, 'bear_atr_max_pct': 0.026970089185592412, 'bear_tp_mult': 2.190686979829131, 'bear_tsl_mult': 0.9030755591504736, 'bear_time_stop': 59, 'bear_use_sma': False, 'bear_use_ema': True, 'bear_use_atr': True, 'bear_use_adx': True, 'bear_use_spike': True, 'bear_rsi_required': False, 'sideways_strategy': 'breakout', 'sideways_bb_std_mult': 1.1981795533521498, 'sideways_rsi_os': 38, 'sideways_rsi_ob': 76, 'sideways_adx_thresh': 19.604689423844732, 'sideways_atr_min_pct': 0.02496432630977953, 'sideways_atr_max_pct': 0.0582107557371765, 'sideways_tp_mult': 1.7469358383143683, 'sideways_tsl_mult': 0.9491565126932051, 'sideways_time_stop': 216, 'sideways_use_sma': True, 'sideways_use_ema': True, 'sideways_use_atr': True, 'sideways_use_adx': False, 'sideways_use_spike': False, 'sideways_rsi_required': False}.
[I 2025-09-01 09:39:26,960] Trial 257 finished with values: [-1000000000.0, 1000000000.0] and parameters: {'p_sma': 41, 'p_std': 25, 'p_atr': 16, 'p_adx': 14, 'rsi_period': 74, 'ema1': 29, 'ema2': 16, 'slip_atr_k': 0.1353114626095952, 'slip_spread_k': 0.36336965124542825, 'spread_hl_frac': 0.015374966018884925, 'bb_std_mult': 2.1746841866046043, 'rsi_os': 12, 'rsi_ob': 89, 'vol_spike': 0.06845134210421118, 'adx_thresh': 5.002670236093631, 'atr_min_pct': 0.004384104822759992, 'atr_max_pct': 0.12413262745829913, 'tp_mult': 2.3049199527844966, 'tsl_mult': 0.19902184212935997, 'strategy': 'breakout', 'time_stop': 277, 'use_sma': True, 'use_atr': False, 'use_adx': True, 'use_ema': False, 'use_spike': True, 'rsi_required': False, 'edge_k': 1.4195185173098248, 'edge_cap': 0.09882389059861879, 'bull_strategy': 'breakout', 'bull_bb_std_mult': 1.7116106119277354, 'bull_rsi_os': 49, 'bull_rsi_ob': 57, 'bull_adx_thresh': 32.393439863268505, 'bull_atr_min_pct': 0.023003541090715784, 'bull_atr_max_pct': 0.06698222822491091, 'bull_tp_mult': 1.1391201441688443, 'bull_tsl_mult': 0.3407271343519786, 'bull_time_stop': 123, 'bull_use_sma': True, 'bull_use_ema': True, 'bull_use_atr': True, 'bull_use_adx': False, 'bull_use_spike': True, 'bull_rsi_required': False, 'bear_strategy': 'mean_reversion', 'bear_bb_std_mult': 3.5988916164058002, 'bear_rsi_os': 46, 'bear_rsi_ob': 69, 'bear_adx_thresh': 21.37509678457332, 'bear_atr_min_pct': 0.0005481835024770849, 'bear_atr_max_pct': 0.04893546192707081, 'bear_tp_mult': 2.212835124500554, 'bear_tsl_mult': 0.4238439931067722, 'bear_time_stop': 221, 'bear_use_sma': False, 'bear_use_ema': True, 'bear_use_atr': True, 'bear_use_adx': True, 'bear_use_spike': False, 'bear_rsi_required': False, 'sideways_strategy': 'breakout', 'sideways_bb_std_mult': 2.2162219540176573, 'sideways_rsi_os': 38, 'sideways_rsi_ob': 46, 'sideways_adx_thresh': 17.948169909626294, 'sideways_atr_min_pct': 0.01717487734408494, 'sideways_atr_max_pct': 0.06721595279099789, 'sideways_tp_mult': 2.4233579456829686, 'sideways_tsl_mult': 0.795118958087836, 'sideways_time_stop': 236, 'sideways_use_sma': False, 'sideways_use_ema': True, 'sideways_use_atr': False, 'sideways_use_adx': False, 'sideways_use_spike': False, 'sideways_rsi_required': False}.
[I 2025-09-01 09:40:07,065] Trial 260 finished with values: [-0.03603329913183806, 0.035677115246258224] and parameters: {'p_sma': 29, 'p_std': 28, 'p_atr': 18, 'p_adx': 13, 'rsi_period': 64, 'ema1': 14, 'ema2': 17, 'slip_atr_k': 0.024688868210566636, 'slip_spread_k': 0.29105452843039836, 'spread_hl_frac': 0.046926606577700404, 'bb_std_mult': 1.6612431687328086, 'rsi_os': 11, 'rsi_ob': 91, 'vol_spike': 0.10986422138051063, 'adx_thresh': 6.4142251739883065, 'atr_min_pct': 0.018497920101328322, 'atr_max_pct': 0.13548144047450927, 'tp_mult': 2.1362446122797256, 'tsl_mult': 0.36893135822299916, 'strategy': 'breakout', 'time_stop': 199, 'use_sma': False, 'use_atr': False, 'use_adx': False, 'use_ema': True, 'use_spike': False, 'rsi_required': True, 'edge_k': 1.4938439824334062, 'edge_cap': 0.6420955984618313, 'bull_strategy': 'mean_reversion', 'bull_bb_std_mult': 0.5059117265433859, 'bull_rsi_os': 55, 'bull_rsi_ob': 57, 'bull_adx_thresh': 7.684660165025072, 'bull_atr_min_pct': 0.021366686522063555, 'bull_atr_max_pct': 0.12675500193435335, 'bull_tp_mult': 2.1312430784363863, 'bull_tsl_mult': 0.3063515118360949, 'bull_time_stop': 270, 'bull_use_sma': True, 'bull_use_ema': False, 'bull_use_atr': True, 'bull_use_adx': False, 'bull_use_spike': False, 'bull_rsi_required': True, 'bear_strategy': 'breakout', 'bear_bb_std_mult': 2.170742632868101, 'bear_rsi_os': 21, 'bear_rsi_ob': 68, 'bear_adx_thresh': 11.91212605377326, 'bear_atr_min_pct': 0.01588660660018644, 'bear_atr_max_pct': 0.11551909442968034, 'bear_tp_mult': 2.6353121582152816, 'bear_tsl_mult': 0.40061982573170546, 'bear_time_stop': 146, 'bear_use_sma': False, 'bear_use_ema': False, 'bear_use_atr': False, 'bear_use_adx': False, 'bear_use_spike': False, 'bear_rsi_required': True, 'sideways_strategy': 'breakout', 'sideways_bb_std_mult': 2.890446095389611, 'sideways_rsi_os': 46, 'sideways_rsi_ob': 46, 'sideways_adx_thresh': 12.68366048218844, 'sideways_atr_min_pct': 0.0035455122407005426, 'sideways_atr_max_pct': 0.07589828632232776, 'sideways_tp_mult': 1.3782671753397262, 'sideways_tsl_mult': 0.06508903685739037, 'sideways_time_stop': 263, 'sideways_use_sma': False, 'sideways_use_ema': False, 'sideways_use_atr': False, 'sideways_use_adx': False, 'sideways_use_spike': False, 'sideways_rsi_required': False}.
[I 2025-09-01 09:40:09,058] Trial 259 finished with values: [-1000000000.0, 1000000000.0] and parameters: {'p_sma': 41, 'p_std': 24, 'p_atr': 16, 'p_adx': 30, 'rsi_period': 60, 'ema1': 21, 'ema2': 18, 'slip_atr_k': 0.11908325741402442, 'slip_spread_k': 0.2885640506966789, 'spread_hl_frac': 0.015276168331945526, 'bb_std_mult': 1.433478086109098, 'rsi_os': 12, 'rsi_ob': 89, 'vol_spike': 0.13053378236674634, 'adx_thresh': 5.04114488780497, 'atr_min_pct': 0.018452139453276638, 'atr_max_pct': 0.13576053075838412, 'tp_mult': 2.288302825418088, 'tsl_mult': 0.19752843237852985, 'strategy': 'breakout', 'time_stop': 279, 'use_sma': True, 'use_atr': False, 'use_adx': False, 'use_ema': False, 'use_spike': False, 'rsi_required': False, 'edge_k': 1.2519611432678541, 'edge_cap': 0.08909603080849632, 'bull_strategy': 'breakout', 'bull_bb_std_mult': 3.083181836611163, 'bull_rsi_os': 55, 'bull_rsi_ob': 57, 'bull_adx_thresh': 26.93922263637494, 'bull_atr_min_pct': 0.020439507254268605, 'bull_atr_max_pct': 0.06636714015157981, 'bull_tp_mult': 2.931979264806608, 'bull_tsl_mult': 0.4577077151268237, 'bull_time_stop': 182, 'bull_use_sma': True, 'bull_use_ema': True, 'bull_use_atr': True, 'bull_use_adx': False, 'bull_use_spike': True, 'bull_rsi_required': False, 'bear_strategy': 'breakout', 'bear_bb_std_mult': 1.200306719605532, 'bear_rsi_os': 46, 'bear_rsi_ob': 93, 'bear_adx_thresh': 11.833197564628318, 'bear_atr_min_pct': 0.016294419377123698, 'bear_atr_max_pct': 0.05932442220661961, 'bear_tp_mult': 2.2156092820086766, 'bear_tsl_mult': 0.3972185402639514, 'bear_time_stop': 61, 'bear_use_sma': False, 'bear_use_ema': False, 'bear_use_atr': False, 'bear_use_adx': False, 'bear_use_spike': False, 'bear_rsi_required': False, 'sideways_strategy': 'breakout', 'sideways_bb_std_mult': 2.897866591654137, 'sideways_rsi_os': 26, 'sideways_rsi_ob': 46, 'sideways_adx_thresh': 29.305948270458142, 'sideways_atr_min_pct': 0.006390527814837371, 'sideways_atr_max_pct': 0.06793804726353042, 'sideways_tp_mult': 1.8613462517348522, 'sideways_tsl_mult': 0.5045490464200832, 'sideways_time_stop': 102, 'sideways_use_sma': False, 'sideways_use_ema': True, 'sideways_use_atr': False, 'sideways_use_adx': False, 'sideways_use_spike': False, 'sideways_rsi_required': False}.
[I 2025-09-01 09:40:09,391] Trial 261 finished with values: [-1000000000.0, 1000000000.0] and parameters: {'p_sma': 29, 'p_std': 29, 'p_atr': 16, 'p_adx': 13, 'rsi_period': 64, 'ema1': 21, 'ema2': 17, 'slip_atr_k': 0.11959900073272348, 'slip_spread_k': 0.3387000467318591, 'spread_hl_frac': 0.04343578099337422, 'bb_std_mult': 1.6580920208426315, 'rsi_os': 11, 'rsi_ob': 91, 'vol_spike': 0.11161788309391388, 'adx_thresh': 25.37042160563735, 'atr_min_pct': 0.01918012031151992, 'atr_max_pct': 0.13623881378947728, 'tp_mult': 2.525993477172897, 'tsl_mult': 0.36060260274022815, 'strategy': 'breakout', 'time_stop': 225, 'use_sma': False, 'use_atr': False, 'use_adx': False, 'use_ema': True, 'use_spike': False, 'rsi_required': True, 'edge_k': 1.2609566666345227, 'edge_cap': 0.08386002979961146, 'bull_strategy': 'mean_reversion', 'bull_bb_std_mult': 2.0638353479855005, 'bull_rsi_os': 18, 'bull_rsi_ob': 56, 'bull_adx_thresh': 7.49824763401894, 'bull_atr_min_pct': 0.020360411541073858, 'bull_atr_max_pct': 0.029649175378019373, 'bull_tp_mult': 1.9550588134859441, 'bull_tsl_mult': 0.30357619542765313, 'bull_time_stop': 129, 'bull_use_sma': True, 'bull_use_ema': False, 'bull_use_atr': True, 'bull_use_adx': False, 'bull_use_spike': False, 'bull_rsi_required': True, 'bear_strategy': 'breakout', 'bear_bb_std_mult': 3.53981963898287, 'bear_rsi_os': 20, 'bear_rsi_ob': 68, 'bear_adx_thresh': 11.798196220382227, 'bear_atr_min_pct': 0.016311042052079734, 'bear_atr_max_pct': 0.11612042583781891, 'bear_tp_mult': 1.235045849420584, 'bear_tsl_mult': 0.4970385459620951, 'bear_time_stop': 206, 'bear_use_sma': False, 'bear_use_ema': False, 'bear_use_atr': False, 'bear_use_adx': False, 'bear_use_spike': False, 'bear_rsi_required': True, 'sideways_strategy': 'breakout', 'sideways_bb_std_mult': 2.1020530342845714, 'sideways_rsi_os': 44, 'sideways_rsi_ob': 70, 'sideways_adx_thresh': 30.644990168561726, 'sideways_atr_min_pct': 0.005923864450491026, 'sideways_atr_max_pct': 0.07405367646241506, 'sideways_tp_mult': 1.8527739776538215, 'sideways_tsl_mult': 0.8492115044939759, 'sideways_time_stop': 80, 'sideways_use_sma': False, 'sideways_use_ema': False, 'sideways_use_atr': False, 'sideways_use_adx': False, 'sideways_use_spike': False, 'sideways_rsi_required': False}.
