[I 2025-09-01 10:20:18,108] Trial 496 finished with values: [-1000000000.0, 1000000000.0] and parameters: {'p_sma': 13, 'p_std': 45, 'p_atr': 29, 'p_adx': 30, 'rsi_period': 68, 'ema1': 21, 'ema2': 26, 'slip_atr_k': 0.0608457381209807, 'slip_spread_k': 0.13013852218616712, 'spread_hl_frac': 0.04921458517137725, 'bb_std_mult': 3.3802342027154015, 'rsi_os': 43, 'rsi_ob': 69, 'vol_spike': 0.27048284016898766, 'adx_thresh': 28.063920858243204, 'atr_min_pct': 0.023218952278874667, 'atr_max_pct': 0.054225742212414406, 'tp_mult': 2.649327277896816, 'tsl_mult': 0.025318687851804578, 'strategy': 'mean_reversion', 'time_stop': 228, 'use_sma': True, 'use_atr': False, 'use_adx': False, 'use_ema': False, 'use_spike': False, 'rsi_required': False, 'edge_k': 1.6982196923080175, 'edge_cap': 0.5430594632978692, 'bull_strategy': 'mean_reversion', 'bull_bb_std_mult': 3.2080171804771487, 'bull_rsi_os': 15, 'bull_rsi_ob': 80, 'bull_adx_thresh': 21.648315291031963, 'bull_atr_min_pct': 0.028372958917776674, 'bull_atr_max_pct': 0.08941326804102367, 'bull_tp_mult': 1.8849871074984608, 'bull_tsl_mult': 0.06342583913042862, 'bull_time_stop': 80, 'bull_use_sma': True, 'bull_use_ema': False, 'bull_use_atr': False, 'bull_use_adx': False, 'bull_use_spike': True, 'bull_rsi_required': True, 'bear_strategy': 'mean_reversion', 'bear_bb_std_mult': 1.891149005097677, 'bear_rsi_os': 50, 'bear_rsi_ob': 76, 'bear_adx_thresh': 13.404882153926328, 'bear_atr_min_pct': 0.01732282844241871, 'bear_atr_max_pct': 0.06293689133588151, 'bear_tp_mult': 1.3781336612223942, 'bear_tsl_mult': 0.411792114841934, 'bear_time_stop': 124, 'bear_use_sma': False, 'bear_use_ema': True, 'bear_use_atr': False, 'bear_use_adx': False, 'bear_use_spike': True, 'bear_rsi_required': False, 'sideways_strategy': 'breakout', 'sideways_bb_std_mult': 3.39254265136602, 'sideways_rsi_os': 27, 'sideways_rsi_ob': 61, 'sideways_adx_thresh': 27.018201883756056, 'sideways_atr_min_pct': 0.004410395516782343, 'sideways_atr_max_pct': 0.07734665982375924, 'sideways_tp_mult': 2.99876734025486, 'sideways_tsl_mult': 0.732487768556455, 'sideways_time_stop': 248, 'sideways_use_sma': False, 'sideways_use_ema': True, 'sideways_use_atr': True, 'sideways_use_adx': False, 'sideways_use_spike': False, 'sideways_rsi_required': False}.
[I 2025-09-01 10:20:18,562] Trial 494 finished with values: [-1000000000.0, 1000000000.0] and parameters: {'p_sma': 12, 'p_std': 44, 'p_atr': 29, 'p_adx': 22, 'rsi_period': 30, 'ema1': 25, 'ema2': 45, 'slip_atr_k': 0.05137425928216022, 'slip_spread_k': 0.12971275722653747, 'spread_hl_frac': 0.024196538642169325, 'bb_std_mult': 3.5967485677345334, 'rsi_os': 46, 'rsi_ob': 78, 'vol_spike': 0.2699108380037543, 'adx_thresh': 10.809202336161517, 'atr_min_pct': 0.01210736955318522, 'atr_max_pct': 0.06943635805093587, 'tp_mult': 1.3252568892849066, 'tsl_mult': 0.021562224050401264, 'strategy': 'breakout', 'time_stop': 172, 'use_sma': True, 'use_atr': False, 'use_adx': True, 'use_ema': False, 'use_spike': False, 'rsi_required': False, 'edge_k': 1.9529761259603098, 'edge_cap': 0.42287289969680886, 'bull_strategy': 'mean_reversion', 'bull_bb_std_mult': 1.7534425762652255, 'bull_rsi_os': 33, 'bull_rsi_ob': 84, 'bull_adx_thresh': 6.408990714098022, 'bull_atr_min_pct': 0.028522124857536718, 'bull_atr_max_pct': 0.14094981844970056, 'bull_tp_mult': 1.8764379592617941, 'bull_tsl_mult': 0.7008889227682215, 'bull_time_stop': 81, 'bull_use_sma': True, 'bull_use_ema': False, 'bull_use_atr': True, 'bull_use_adx': True, 'bull_use_spike': True, 'bull_rsi_required': True, 'bear_strategy': 'mean_reversion', 'bear_bb_std_mult': 2.590398164595503, 'bear_rsi_os': 47, 'bear_rsi_ob': 45, 'bear_adx_thresh': 6.9929605747517645, 'bear_atr_min_pct': 0.01760213846970843, 'bear_atr_max_pct': 0.06307732271835298, 'bear_tp_mult': 1.202112871854117, 'bear_tsl_mult': 0.4316231307361863, 'bear_time_stop': 9, 'bear_use_sma': False, 'bear_use_ema': True, 'bear_use_atr': True, 'bear_use_adx': False, 'bear_use_spike': True, 'bear_rsi_required': False, 'sideways_strategy': 'breakout', 'sideways_bb_std_mult': 3.3709954345983304, 'sideways_rsi_os': 35, 'sideways_rsi_ob': 70, 'sideways_adx_thresh': 26.661624823809767, 'sideways_atr_min_pct': 0.0045477292825035175, 'sideways_atr_max_pct': 0.0801071864199578, 'sideways_tp_mult': 1.2656431661535092, 'sideways_tsl_mult': 0.7653291417867323, 'sideways_time_stop': 90, 'sideways_use_sma': False, 'sideways_use_ema': True, 'sideways_use_atr': False, 'sideways_use_adx': False, 'sideways_use_spike': False, 'sideways_rsi_required': False}.
[I 2025-09-01 10:20:19,742] Trial 499 finished with values: [-1000000000.0, 1000000000.0] and parameters: {'p_sma': 37, 'p_std': 41, 'p_atr': 29, 'p_adx': 23, 'rsi_period': 66, 'ema1': 21, 'ema2': 41, 'slip_atr_k': 0.031971163222554944, 'slip_spread_k': 0.18392712235852596, 'spread_hl_frac': 0.028607716502206983, 'bb_std_mult': 1.0121491867174708, 'rsi_os': 40, 'rsi_ob': 78, 'vol_spike': 0.27335645027318894, 'adx_thresh': 6.952686115597961, 'atr_min_pct': 0.025794906793621317, 'atr_max_pct': 0.015384030349700734, 'tp_mult': 2.7337979103787045, 'tsl_mult': 0.21540752725950918, 'strategy': 'breakout', 'time_stop': 280, 'use_sma': True, 'use_atr': False, 'use_adx': True, 'use_ema': True, 'use_spike': False, 'rsi_required': False, 'edge_k': 0.8304287792231372, 'edge_cap': 0.6368869792161258, 'bull_strategy': 'mean_reversion', 'bull_bb_std_mult': 2.1471914392966958, 'bull_rsi_os': 16, 'bull_rsi_ob': 57, 'bull_adx_thresh': 5.591621895640395, 'bull_atr_min_pct': 0.029969635326791946, 'bull_atr_max_pct': 0.14350065393949957, 'bull_tp_mult': 2.742221376239153, 'bull_tsl_mult': 0.04101423375434967, 'bull_time_stop': 143, 'bull_use_sma': True, 'bull_use_ema': False, 'bull_use_atr': True, 'bull_use_adx': True, 'bull_use_spike': False, 'bull_rsi_required': False, 'bear_strategy': 'breakout', 'bear_bb_std_mult': 0.8586054944661257, 'bear_rsi_os': 11, 'bear_rsi_ob': 47, 'bear_adx_thresh': 31.89112208994686, 'bear_atr_min_pct': 0.01695549698725867, 'bear_atr_max_pct': 0.0772446102268045, 'bear_tp_mult': 2.6710730475979036, 'bear_tsl_mult': 0.8561622915909373, 'bear_time_stop': 23, 'bear_use_sma': False, 'bear_use_ema': False, 'bear_use_atr': True, 'bear_use_adx': False, 'bear_use_spike': True, 'bear_rsi_required': False, 'sideways_strategy': 'breakout', 'sideways_bb_std_mult': 3.1834313746920957, 'sideways_rsi_os': 51, 'sideways_rsi_ob': 48, 'sideways_adx_thresh': 17.900587719963983, 'sideways_atr_min_pct': 0.003758358880170817, 'sideways_atr_max_pct': 0.052957672318520485, 'sideways_tp_mult': 1.2687649892783206, 'sideways_tsl_mult': 0.8844444520510429, 'sideways_time_stop': 154, 'sideways_use_sma': True, 'sideways_use_ema': False, 'sideways_use_atr': False, 'sideways_use_adx': False, 'sideways_use_spike': False, 'sideways_rsi_required': False}.
[I 2025-09-01 10:20:58,442] Trial 500 finished with values: [-1000000000.0, 1000000000.0] and parameters: {'p_sma': 55, 'p_std': 12, 'p_atr': 11, 'p_adx': 23, 'rsi_period': 66, 'ema1': 21, 'ema2': 41, 'slip_atr_k': 0.2171387710848246, 'slip_spread_k': 0.20941928407244922, 'spread_hl_frac': 0.02836398465145239, 'bb_std_mult': 3.2611708877488246, 'rsi_os': 19, 'rsi_ob': 66, 'vol_spike': 0.275992096640952, 'adx_thresh': 5.020417207283268, 'atr_min_pct': 0.025597280905195034, 'atr_max_pct': 0.08093702600140903, 'tp_mult': 2.7416719091414463, 'tsl_mult': 0.20899570166949083, 'strategy': 'breakout', 'time_stop': 91, 'use_sma': True, 'use_atr': False, 'use_adx': True, 'use_ema': True, 'use_spike': False, 'rsi_required': False, 'edge_k': 0.4514225088146254, 'edge_cap': 0.9592812102084304, 'bull_strategy': 'mean_reversion', 'bull_bb_std_mult': 0.9066490608751017, 'bull_rsi_os': 54, 'bull_rsi_ob': 72, 'bull_adx_thresh': 5.035893233476907, 'bull_atr_min_pct': 0.029399053585513632, 'bull_atr_max_pct': 0.08505702484786959, 'bull_tp_mult': 1.836459353917316, 'bull_tsl_mult': 0.045945634656111005, 'bull_time_stop': 47, 'bull_use_sma': False, 'bull_use_ema': False, 'bull_use_atr': True, 'bull_use_adx': True, 'bull_use_spike': False, 'bull_rsi_required': False, 'bear_strategy': 'breakout', 'bear_bb_std_mult': 2.8627413504894794, 'bear_rsi_os': 48, 'bear_rsi_ob': 47, 'bear_adx_thresh': 11.724869775685486, 'bear_atr_min_pct': 0.02257823194087858, 'bear_atr_max_pct': 0.07668550203305637, 'bear_tp_mult': 1.3099819895228624, 'bear_tsl_mult': 0.14310665405716855, 'bear_time_stop': 25, 'bear_use_sma': False, 'bear_use_ema': False, 'bear_use_atr': True, 'bear_use_adx': False, 'bear_use_spike': True, 'bear_rsi_required': False, 'sideways_strategy': 'breakout', 'sideways_bb_std_mult': 3.0109914756334852, 'sideways_rsi_os': 13, 'sideways_rsi_ob': 49, 'sideways_adx_thresh': 28.11530683578367, 'sideways_atr_min_pct': 0.017126224228230465, 'sideways_atr_max_pct': 0.05916854226153887, 'sideways_tp_mult': 1.5520263251659598, 'sideways_tsl_mult': 0.8829179558448117, 'sideways_time_stop': 77, 'sideways_use_sma': True, 'sideways_use_ema': False, 'sideways_use_atr': False, 'sideways_use_adx': False, 'sideways_use_spike': False, 'sideways_rsi_required': False}.
[I 2025-09-01 10:20:59,350] Trial 497 finished with values: [-1000000000.0, 1000000000.0] and parameters: {'p_sma': 22, 'p_std': 41, 'p_atr': 29, 'p_adx': 23, 'rsi_period': 66, 'ema1': 21, 'ema2': 24, 'slip_atr_k': 0.231395443089969, 'slip_spread_k': 0.9308094802519371, 'spread_hl_frac': 0.023869547685802992, 'bb_std_mult': 3.390359556891862, 'rsi_os': 18, 'rsi_ob': 78, 'vol_spike': 0.27715380306118564, 'adx_thresh': 5.040256038944886, 'atr_min_pct': 0.023172982173584555, 'atr_max_pct': 0.08058240891008364, 'tp_mult': 1.3430258870173941, 'tsl_mult': 0.3104882253601885, 'strategy': 'breakout', 'time_stop': 281, 'use_sma': True, 'use_atr': False, 'use_adx': True, 'use_ema': True, 'use_spike': False, 'rsi_required': False, 'edge_k': 1.9294845547778647, 'edge_cap': 0.4150312512813213, 'bull_strategy': 'mean_reversion', 'bull_bb_std_mult': 0.9081740027528511, 'bull_rsi_os': 15, 'bull_rsi_ob': 84, 'bull_adx_thresh': 5.482302906950262, 'bull_atr_min_pct': 0.02993927905931919, 'bull_atr_max_pct': 0.10171932814649035, 'bull_tp_mult': 1.8510508612730296, 'bull_tsl_mult': 0.06829317357015563, 'bull_time_stop': 143, 'bull_use_sma': True, 'bull_use_ema': False, 'bull_use_atr': True, 'bull_use_adx': False, 'bull_use_spike': True, 'bull_rsi_required': False, 'bear_strategy': 'breakout', 'bear_bb_std_mult': 2.4788278220577267, 'bear_rsi_os': 37, 'bear_rsi_ob': 76, 'bear_adx_thresh': 31.658118472045683, 'bear_atr_min_pct': 0.017493498998192258, 'bear_atr_max_pct': 0.07677502089288622, 'bear_tp_mult': 1.3307361946297274, 'bear_tsl_mult': 0.1718214091522272, 'bear_time_stop': 22, 'bear_use_sma': False, 'bear_use_ema': False, 'bear_use_atr': True, 'bear_use_adx': False, 'bear_use_spike': True, 'bear_rsi_required': False, 'sideways_strategy': 'breakout', 'sideways_bb_std_mult': 3.2088106502982496, 'sideways_rsi_os': 10, 'sideways_rsi_ob': 49, 'sideways_adx_thresh': 27.054994432405838, 'sideways_atr_min_pct': 0.0038580793917484986, 'sideways_atr_max_pct': 0.0772600257648325, 'sideways_tp_mult': 2.2793936993419974, 'sideways_tsl_mult': 0.8863254189775642, 'sideways_time_stop': 207, 'sideways_use_sma': True, 'sideways_use_ema': False, 'sideways_use_atr': False, 'sideways_use_adx': False, 'sideways_use_spike': False, 'sideways_rsi_required': False}.
[I 2025-09-01 10:20:59,750] Trial 498 finished with values: [-1000000000.0, 1000000000.0] and parameters: {'p_sma': 22, 'p_std': 45, 'p_atr': 29, 'p_adx': 23, 'rsi_period': 66, 'ema1': 21, 'ema2': 24, 'slip_atr_k': 0.05527458680899903, 'slip_spread_k': 0.18648146722649744, 'spread_hl_frac': 0.028243231159747834, 'bb_std_mult': 3.439097673387337, 'rsi_os': 32, 'rsi_ob': 78, 'vol_spike': 0.2761129223169625, 'adx_thresh': 27.84229900988308, 'atr_min_pct': 0.004635173714078828, 'atr_max_pct': 0.06990517453521644, 'tp_mult': 2.644221898921586, 'tsl_mult': 0.031137344610979695, 'strategy': 'breakout', 'time_stop': 279, 'use_sma': True, 'use_atr': False, 'use_adx': True, 'use_ema': True, 'use_spike': False, 'rsi_required': False, 'edge_k': 1.8766932283339322, 'edge_cap': 0.8456519418853018, 'bull_strategy': 'mean_reversion', 'bull_bb_std_mult': 1.375705048441985, 'bull_rsi_os': 15, 'bull_rsi_ob': 80, 'bull_adx_thresh': 5.006951561892926, 'bull_atr_min_pct': 0.028382111313520683, 'bull_atr_max_pct': 0.08566620566168584, 'bull_tp_mult': 1.203278408212677, 'bull_tsl_mult': 0.06357699694293135, 'bull_time_stop': 145, 'bull_use_sma': True, 'bull_use_ema': False, 'bull_use_atr': True, 'bull_use_adx': False, 'bull_use_spike': True, 'bull_rsi_required': False, 'bear_strategy': 'breakout', 'bear_bb_std_mult': 2.4822689668629394, 'bear_rsi_os': 48, 'bear_rsi_ob': 47, 'bear_adx_thresh': 7.225972636333244, 'bear_atr_min_pct': 0.022664582931569442, 'bear_atr_max_pct': 0.07627759695927301, 'bear_tp_mult': 1.3278698515288418, 'bear_tsl_mult': 0.4591126960783348, 'bear_time_stop': 146, 'bear_use_sma': False, 'bear_use_ema': False, 'bear_use_atr': True, 'bear_use_adx': False, 'bear_use_spike': True, 'bear_rsi_required': False, 'sideways_strategy': 'breakout', 'sideways_bb_std_mult': 3.2154312359267476, 'sideways_rsi_os': 8, 'sideways_rsi_ob': 70, 'sideways_adx_thresh': 26.931864251857185, 'sideways_atr_min_pct': 0.003807522701240321, 'sideways_atr_max_pct': 0.07601706470512372, 'sideways_tp_mult': 1.3166482461971944, 'sideways_tsl_mult': 0.8687844417488483, 'sideways_time_stop': 206, 'sideways_use_sma': True, 'sideways_use_ema': False, 'sideways_use_atr': False, 'sideways_use_adx': False, 'sideways_use_spike': False, 'sideways_rsi_required': False}.
[I 2025-09-01 10:21:00,517] Trial 501 finished with values: [-1000000000.0, 1000000000.0] and parameters: {'p_sma': 22, 'p_std': 31, 'p_atr': 28, 'p_adx': 23, 'rsi_period': 63, 'ema1': 13, 'ema2': 48, 'slip_atr_k': 0.1312123689464058, 'slip_spread_k': 0.21075941094028872, 'spread_hl_frac': 0.029974767372809186, 'bb_std_mult': 3.255410858004973, 'rsi_os': 19, 'rsi_ob': 77, 'vol_spike': 0.29982467932938395, 'adx_thresh': 30.664679355407955, 'atr_min_pct': 0.024162112358079156, 'atr_max_pct': 0.07985051227333699, 'tp_mult': 1.0484916936256135, 'tsl_mult': 0.07637595554522902, 'strategy': 'breakout', 'time_stop': 146, 'use_sma': True, 'use_atr': False, 'use_adx': True, 'use_ema': True, 'use_spike': False, 'rsi_required': False, 'edge_k': 0.2712536949120543, 'edge_cap': 0.9709691982731583, 'bull_strategy': 'breakout', 'bull_bb_std_mult': 3.5088677638588965, 'bull_rsi_os': 20, 'bull_rsi_ob': 57, 'bull_adx_thresh': 5.060319244223151, 'bull_atr_min_pct': 0.02942747946021749, 'bull_atr_max_pct': 0.08550840990231198, 'bull_tp_mult': 1.822458084438639, 'bull_tsl_mult': 0.06959153054674118, 'bull_time_stop': 155, 'bull_use_sma': False, 'bull_use_ema': True, 'bull_use_atr': True, 'bull_use_adx': True, 'bull_use_spike': False, 'bull_rsi_required': False, 'bear_strategy': 'breakout', 'bear_bb_std_mult': 2.4913502156174103, 'bear_rsi_os': 55, 'bear_rsi_ob': 46, 'bear_adx_thresh': 9.818606286448764, 'bear_atr_min_pct': 0.015989891634360685, 'bear_atr_max_pct': 0.09413560678076338, 'bear_tp_mult': 2.826646615522294, 'bear_tsl_mult': 0.4661086188122084, 'bear_time_stop': 147, 'bear_use_sma': False, 'bear_use_ema': False, 'bear_use_atr': True, 'bear_use_adx': False, 'bear_use_spike': True, 'bear_rsi_required': False, 'sideways_strategy': 'breakout', 'sideways_bb_std_mult': 3.2603381832644587, 'sideways_rsi_os': 10, 'sideways_rsi_ob': 80, 'sideways_adx_thresh': 27.72465187651686, 'sideways_atr_min_pct': 0.0020707716799070698, 'sideways_atr_max_pct': 0.07240761139904305, 'sideways_tp_mult': 1.2092292955570827, 'sideways_tsl_mult': 0.8589168661110596, 'sideways_time_stop': 26, 'sideways_use_sma': True, 'sideways_use_ema': True, 'sideways_use_atr': False, 'sideways_use_adx': False, 'sideways_use_spike': False, 'sideways_rsi_required': False}.
[I 2025-09-01 10:21:43,119] Trial 505 finished with values: [-0.15479129403238967, 0.15458224537556095] and parameters: {'p_sma': 51, 'p_std': 43, 'p_atr': 8, 'p_adx': 10, 'rsi_period': 35, 'ema1': 22, 'ema2': 54, 'slip_atr_k': 0.039813785082193735, 'slip_spread_k': 0.4944841801592057, 'spread_hl_frac': 0.027541959111100592, 'bb_std_mult': 0.6194953315446621, 'rsi_os': 27, 'rsi_ob': 48, 'vol_spike': 0.2578102124270931, 'adx_thresh': 5.933919722438829, 'atr_min_pct': 0.01550630686872994, 'atr_max_pct': 0.07662117153093, 'tp_mult': 1.1148223763156904, 'tsl_mult': 0.6962677545034145, 'strategy': 'breakout', 'time_stop': 153, 'use_sma': True, 'use_atr': True, 'use_adx': True, 'use_ema': False, 'use_spike': True, 'rsi_required': True, 'edge_k': 1.0058112525574585, 'edge_cap': 0.5989282529892769, 'bull_strategy': 'mean_reversion', 'bull_bb_std_mult': 1.0509696969403695, 'bull_rsi_os': 22, 'bull_rsi_ob': 70, 'bull_adx_thresh': 23.12051899636426, 'bull_atr_min_pct': 0.02994623977596653, 'bull_atr_max_pct': 0.11838795648383256, 'bull_tp_mult': 1.5369579699217881, 'bull_tsl_mult': 0.10631665923407413, 'bull_time_stop': 135, 'bull_use_sma': True, 'bull_use_ema': True, 'bull_use_atr': False, 'bull_use_adx': True, 'bull_use_spike': False, 'bull_rsi_required': True, 'bear_strategy': 'mean_reversion', 'bear_bb_std_mult': 3.4900160720594435, 'bear_rsi_os': 23, 'bear_rsi_ob': 46, 'bear_adx_thresh': 34.37993198637989, 'bear_atr_min_pct': 0.011335233319476421, 'bear_atr_max_pct': 0.05391193146503538, 'bear_tp_mult': 1.2589417335830397, 'bear_tsl_mult': 0.3847455280150463, 'bear_time_stop': 141, 'bear_use_sma': True, 'bear_use_ema': True, 'bear_use_atr': True, 'bear_use_adx': True, 'bear_use_spike': False, 'bear_rsi_required': False, 'sideways_strategy': 'breakout', 'sideways_bb_std_mult': 3.345151175948655, 'sideways_rsi_os': 45, 'sideways_rsi_ob': 52, 'sideways_adx_thresh': 7.746035155104694, 'sideways_atr_min_pct': 0.002896047270437481, 'sideways_atr_max_pct': 0.06887147423783146, 'sideways_tp_mult': 1.414781628403125, 'sideways_tsl_mult': 0.6555597033178533, 'sideways_time_stop': 182, 'sideways_use_sma': False, 'sideways_use_ema': True, 'sideways_use_atr': True, 'sideways_use_adx': True, 'sideways_use_spike': True, 'sideways_rsi_required': True}.
[I 2025-09-01 10:21:44,418] Trial 503 finished with values: [-1000000000.0, 1000000000.0] and parameters: {'p_sma': 58, 'p_std': 31, 'p_atr': 28, 'p_adx': 11, 'rsi_period': 35, 'ema1': 22, 'ema2': 37, 'slip_atr_k': 0.05490797876432982, 'slip_spread_k': 0.18297559491408344, 'spread_hl_frac': 0.008367598442408322, 'bb_std_mult': 1.2215599938758444, 'rsi_os': 55, 'rsi_ob': 77, 'vol_spike': 0.2572672224966621, 'adx_thresh': 13.51515602515316, 'atr_min_pct': 0.02413811966159567, 'atr_max_pct': 0.07616547767390006, 'tp_mult': 2.675002654913276, 'tsl_mult': 0.35377460551155826, 'strategy': 'breakout', 'time_stop': 145, 'use_sma': True, 'use_atr': True, 'use_adx': True, 'use_ema': False, 'use_spike': False, 'rsi_required': True, 'edge_k': 1.3557580519465164, 'edge_cap': 0.6011128183072453, 'bull_strategy': 'breakout', 'bull_bb_std_mult': 0.951406757474756, 'bull_rsi_os': 20, 'bull_rsi_ob': 57, 'bull_adx_thresh': 6.1275460138466435, 'bull_atr_min_pct': 0.028954797400229618, 'bull_atr_max_pct': 0.11926168122854505, 'bull_tp_mult': 2.978343304090005, 'bull_tsl_mult': 0.554747816259299, 'bull_time_stop': 61, 'bull_use_sma': True, 'bull_use_ema': True, 'bull_use_atr': False, 'bull_use_adx': True, 'bull_use_spike': False, 'bull_rsi_required': True, 'bear_strategy': 'mean_reversion', 'bear_bb_std_mult': 2.991994838245926, 'bear_rsi_os': 48, 'bear_rsi_ob': 46, 'bear_adx_thresh': 13.540361776926927, 'bear_atr_min_pct': 0.016015739954006167, 'bear_atr_max_pct': 0.09503991316665128, 'bear_tp_mult': 1.272831449919134, 'bear_tsl_mult': 0.8198634315209405, 'bear_time_stop': 39, 'bear_use_sma': True, 'bear_use_ema': True, 'bear_use_atr': True, 'bear_use_adx': True, 'bear_use_spike': False, 'bear_rsi_required': False, 'sideways_strategy': 'breakout', 'sideways_bb_std_mult': 3.453018308782578, 'sideways_rsi_os': 9, 'sideways_rsi_ob': 53, 'sideways_adx_thresh': 8.82206453234619, 'sideways_atr_min_pct': 0.002013034920176324, 'sideways_atr_max_pct': 0.10030892368805869, 'sideways_tp_mult': 1.1902012563584359, 'sideways_tsl_mult': 0.8019348331655733, 'sideways_time_stop': 12, 'sideways_use_sma': False, 'sideways_use_ema': True, 'sideways_use_atr': True, 'sideways_use_adx': True, 'sideways_use_spike': True, 'sideways_rsi_required': True}.
