[I 2025-09-01 09:01:39,317] Trial 20 finished with values: [-1000000000.0, 1000000000.0] and parameters: {'p_sma': 44, 'p_std': 54, 'p_atr': 12, 'p_adx': 13, 'rsi_period': 31, 'ema1': 27, 'ema2': 42, 'slip_atr_k': 0.2388304432968146, 'slip_spread_k': 0.9061019199294551, 'spread_hl_frac': 0.028218528809100675, 'bb_std_mult': 1.1624037766543087, 'rsi_os': 55, 'rsi_ob': 54, 'vol_spike': 0.29501191288510026, 'adx_thresh': 29.793728956206664, 'atr_min_pct': 0.0005963990230818551, 'atr_max_pct': 0.0681362637005296, 'tp_mult': 2.4674719361010418, 'tsl_mult': 0.016238683565508304, 'strategy': 'mean_reversion', 'time_stop': 159, 'use_sma': False, 'use_atr': True, 'use_adx': False, 'use_ema': True, 'use_spike': False, 'rsi_required': True, 'edge_k': 1.0988912052545454, 'edge_cap': 0.05183482110502813, 'bull_strategy': 'breakout', 'bull_bb_std_mult': 2.1194926025246716, 'bull_rsi_os': 48, 'bull_rsi_ob': 54, 'bull_adx_thresh': 16.45321934693383, 'bull_atr_min_pct': 0.019445423125269132, 'bull_atr_max_pct': 0.10187147020697832, 'bull_tp_mult': 1.9106717323660627, 'bull_tsl_mult': 0.050119503359126294, 'bull_time_stop': 12, 'bull_use_sma': False, 'bull_use_ema': True, 'bull_use_atr': True, 'bull_use_adx': True, 'bull_use_spike': True, 'bull_rsi_required': False, 'bear_strategy': 'breakout', 'bear_bb_std_mult': 2.2030858164646108, 'bear_rsi_os': 24, 'bear_rsi_ob': 93, 'bear_adx_thresh': 34.56016900722736, 'bear_atr_min_pct': 0.008802340299869166, 'bear_atr_max_pct': 0.07105284728129782, 'bear_tp_mult': 1.035152811971106, 'bear_tsl_mult': 0.014009372429004074, 'bear_time_stop': 298, 'bear_use_sma': True, 'bear_use_ema': False, 'bear_use_atr': False, 'bear_use_adx': True, 'bear_use_spike': True, 'bear_rsi_required': True, 'sideways_strategy': 'mean_reversion', 'sideways_bb_std_mult': 2.3026175969279676, 'sideways_rsi_os': 24, 'sideways_rsi_ob': 65, 'sideways_adx_thresh': 12.549440587514212, 'sideways_atr_min_pct': 0.0136208351141841, 'sideways_atr_max_pct': 0.09141520355886443, 'sideways_tp_mult': 1.1027074260077585, 'sideways_tsl_mult': 0.1592513269348222, 'sideways_time_stop': 55, 'sideways_use_sma': False, 'sideways_use_ema': False, 'sideways_use_atr': True, 'sideways_use_adx': True, 'sideways_use_spike': True, 'sideways_rsi_required': True}.
[I 2025-09-01 09:01:39,376] Trial 21 finished with values: [-1000000000.0, 1000000000.0] and parameters: {'p_sma': 45, 'p_std': 58, 'p_atr': 12, 'p_adx': 15, 'rsi_period': 35, 'ema1': 27, 'ema2': 42, 'slip_atr_k': 0.24215453514933877, 'slip_spread_k': 0.9985807385437607, 'spread_hl_frac': 0.048699721468538994, 'bb_std_mult': 1.1636080308196188, 'rsi_os': 55, 'rsi_ob': 54, 'vol_spike': 0.2953544427571181, 'adx_thresh': 29.752767106021004, 'atr_min_pct': 0.008517805679752655, 'atr_max_pct': 0.10453960291949722, 'tp_mult': 2.525039547353304, 'tsl_mult': 0.025573971845975894, 'strategy': 'mean_reversion', 'time_stop': 160, 'use_sma': False, 'use_atr': True, 'use_adx': False, 'use_ema': True, 'use_spike': False, 'rsi_required': True, 'edge_k': 1.0741166304783663, 'edge_cap': 0.056239883253540235, 'bull_strategy': 'breakout', 'bull_bb_std_mult': 2.2283194237733497, 'bull_rsi_os': 49, 'bull_rsi_ob': 69, 'bull_adx_thresh': 15.864681218054336, 'bull_atr_min_pct': 0.01971938816698133, 'bull_atr_max_pct': 0.1024041089669791, 'bull_tp_mult': 1.874006133800684, 'bull_tsl_mult': 0.004540803092487167, 'bull_time_stop': 9, 'bull_use_sma': False, 'bull_use_ema': True, 'bull_use_atr': True, 'bull_use_adx': True, 'bull_use_spike': True, 'bull_rsi_required': False, 'bear_strategy': 'breakout', 'bear_bb_std_mult': 2.1611850796619914, 'bear_rsi_os': 25, 'bear_rsi_ob': 95, 'bear_adx_thresh': 34.93482469688104, 'bear_atr_min_pct': 0.008431949597795235, 'bear_atr_max_pct': 0.07162849262292881, 'bear_tp_mult': 1.124795852419012, 'bear_tsl_mult': 0.027028888543379884, 'bear_time_stop': 299, 'bear_use_sma': True, 'bear_use_ema': False, 'bear_use_atr': False, 'bear_use_adx': True, 'bear_use_spike': True, 'bear_rsi_required': True, 'sideways_strategy': 'mean_reversion', 'sideways_bb_std_mult': 2.396338910440061, 'sideways_rsi_os': 13, 'sideways_rsi_ob': 63, 'sideways_adx_thresh': 11.345687742756457, 'sideways_atr_min_pct': 0.014230355604052121, 'sideways_atr_max_pct': 0.09449320252062904, 'sideways_tp_mult': 1.0458812339807066, 'sideways_tsl_mult': 0.18334755750937332, 'sideways_time_stop': 54, 'sideways_use_sma': False, 'sideways_use_ema': False, 'sideways_use_atr': True, 'sideways_use_adx': True, 'sideways_use_spike': True, 'sideways_rsi_required': True}.
[I 2025-09-01 09:02:24,696] Trial 19 finished with values: [-1000000000.0, 1000000000.0] and parameters: {'p_sma': 45, 'p_std': 37, 'p_atr': 12, 'p_adx': 16, 'rsi_period': 35, 'ema1': 12, 'ema2': 43, 'slip_atr_k': 0.24207223709626696, 'slip_spread_k': 0.9900067041114937, 'spread_hl_frac': 0.012813306226727609, 'bb_std_mult': 1.1014088357306417, 'rsi_os': 47, 'rsi_ob': 88, 'vol_spike': 0.11623476559655008, 'adx_thresh': 34.73168362430228, 'atr_min_pct': 0.009325710809902354, 'atr_max_pct': 0.06838417881043203, 'tp_mult': 2.4317842023078806, 'tsl_mult': 0.04976388406514204, 'strategy': 'breakout', 'time_stop': 167, 'use_sma': False, 'use_atr': True, 'use_adx': False, 'use_ema': True, 'use_spike': False, 'rsi_required': True, 'edge_k': 1.1349084153526587, 'edge_cap': 0.5740578066175228, 'bull_strategy': 'breakout', 'bull_bb_std_mult': 2.1761288277851354, 'bull_rsi_os': 50, 'bull_rsi_ob': 75, 'bull_adx_thresh': 31.8785217530734, 'bull_atr_min_pct': 0.01999935593666396, 'bull_atr_max_pct': 0.11273745586442976, 'bull_tp_mult': 1.8590664535771195, 'bull_tsl_mult': 0.5870700800724077, 'bull_time_stop': 13, 'bull_use_sma': False, 'bull_use_ema': True, 'bull_use_atr': True, 'bull_use_adx': True, 'bull_use_spike': True, 'bull_rsi_required': False, 'bear_strategy': 'breakout', 'bear_bb_std_mult': 2.2094842935220127, 'bear_rsi_os': 22, 'bear_rsi_ob': 53, 'bear_adx_thresh': 33.748419433111685, 'bear_atr_min_pct': 0.020075281361918842, 'bear_atr_max_pct': 0.06653146884218006, 'bear_tp_mult': 1.026585575131448, 'bear_tsl_mult': 0.13851216256810056, 'bear_time_stop': 299, 'bear_use_sma': True, 'bear_use_ema': False, 'bear_use_atr': False, 'bear_use_adx': True, 'bear_use_spike': True, 'bear_rsi_required': True, 'sideways_strategy': 'mean_reversion', 'sideways_bb_std_mult': 2.313827349446637, 'sideways_rsi_os': 27, 'sideways_rsi_ob': 51, 'sideways_adx_thresh': 10.468921285250193, 'sideways_atr_min_pct': 0.012357690835042012, 'sideways_atr_max_pct': 0.11605888762989638, 'sideways_tp_mult': 2.9421894237777275, 'sideways_tsl_mult': 0.183938008329187, 'sideways_time_stop': 72, 'sideways_use_sma': True, 'sideways_use_ema': False, 'sideways_use_atr': True, 'sideways_use_adx': True, 'sideways_use_spike': True, 'sideways_rsi_required': True}.
[I 2025-09-01 09:02:24,730] Trial 18 finished with values: [-1000000000.0, 1000000000.0] and parameters: {'p_sma': 46, 'p_std': 38, 'p_atr': 12, 'p_adx': 16, 'rsi_period': 38, 'ema1': 30, 'ema2': 46, 'slip_atr_k': 0.23251439285141434, 'slip_spread_k': 0.9717873581915062, 'spread_hl_frac': 0.013462543063496289, 'bb_std_mult': 1.058843101489939, 'rsi_os': 48, 'rsi_ob': 58, 'vol_spike': 0.29800329946682363, 'adx_thresh': 34.75241524867946, 'atr_min_pct': 0.007125349058808562, 'atr_max_pct': 0.03315734701136093, 'tp_mult': 2.51234107745046, 'tsl_mult': 0.05086789540689918, 'strategy': 'mean_reversion', 'time_stop': 158, 'use_sma': False, 'use_atr': True, 'use_adx': False, 'use_ema': True, 'use_spike': False, 'rsi_required': True, 'edge_k': 1.07363451960329, 'edge_cap': 0.7699412419487086, 'bull_strategy': 'breakout', 'bull_bb_std_mult': 2.1919232008203693, 'bull_rsi_os': 49, 'bull_rsi_ob': 75, 'bull_adx_thresh': 32.12811208542315, 'bull_atr_min_pct': 0.016288129646215774, 'bull_atr_max_pct': 0.05350949909804017, 'bull_tp_mult': 1.7804181456962564, 'bull_tsl_mult': 0.5858249910015337, 'bull_time_stop': 21, 'bull_use_sma': False, 'bull_use_ema': True, 'bull_use_atr': True, 'bull_use_adx': True, 'bull_use_spike': True, 'bull_rsi_required': False, 'bear_strategy': 'breakout', 'bear_bb_std_mult': 3.0237653245477096, 'bear_rsi_os': 24, 'bear_rsi_ob': 53, 'bear_adx_thresh': 34.99701819132028, 'bear_atr_min_pct': 0.019422475160813267, 'bear_atr_max_pct': 0.06920328291645672, 'bear_tp_mult': 1.8398684692368181, 'bear_tsl_mult': 0.027077187961411064, 'bear_time_stop': 212, 'bear_use_sma': True, 'bear_use_ema': False, 'bear_use_atr': False, 'bear_use_adx': True, 'bear_use_spike': True, 'bear_rsi_required': True, 'sideways_strategy': 'mean_reversion', 'sideways_bb_std_mult': 2.3012531896446866, 'sideways_rsi_os': 5, 'sideways_rsi_ob': 54, 'sideways_adx_thresh': 10.405168921043458, 'sideways_atr_min_pct': 0.013936095070852802, 'sideways_atr_max_pct': 0.11822459349088364, 'sideways_tp_mult': 1.086189589453694, 'sideways_tsl_mult': 0.2266165752104785, 'sideways_time_stop': 63, 'sideways_use_sma': True, 'sideways_use_ema': False, 'sideways_use_atr': True, 'sideways_use_adx': True, 'sideways_use_spike': True, 'sideways_rsi_required': True}.
[I 2025-09-01 09:02:25,215] Trial 22 finished with values: [-1000000000.0, 1000000000.0] and parameters: {'p_sma': 16, 'p_std': 40, 'p_atr': 12, 'p_adx': 16, 'rsi_period': 34, 'ema1': 20, 'ema2': 60, 'slip_atr_k': 0.0392682536680812, 'slip_spread_k': 0.6282785719434558, 'spread_hl_frac': 0.04770015003889868, 'bb_std_mult': 2.7470151049260374, 'rsi_os': 46, 'rsi_ob': 53, 'vol_spike': 0.1273813158593857, 'adx_thresh': 15.52821553675312, 'atr_min_pct': 0.007776810216351763, 'atr_max_pct': 0.10000830762994344, 'tp_mult': 2.49654658294085, 'tsl_mult': 0.49484509294447826, 'strategy': 'mean_reversion', 'time_stop': 51, 'use_sma': False, 'use_atr': True, 'use_adx': False, 'use_ema': True, 'use_spike': False, 'rsi_required': True, 'edge_k': 1.0972668046332963, 'edge_cap': 0.5782284644285369, 'bull_strategy': 'breakout', 'bull_bb_std_mult': 3.01534550542656, 'bull_rsi_os': 30, 'bull_rsi_ob': 68, 'bull_adx_thresh': 25.126260488208683, 'bull_atr_min_pct': 0.01324483276884151, 'bull_atr_max_pct': 0.10600265701295908, 'bull_tp_mult': 2.3082622665962136, 'bull_tsl_mult': 0.20805641583140566, 'bull_time_stop': 17, 'bull_use_sma': False, 'bull_use_ema': True, 'bull_use_atr': True, 'bull_use_adx': True, 'bull_use_spike': True, 'bull_rsi_required': False, 'bear_strategy': 'breakout', 'bear_bb_std_mult': 2.321448326557736, 'bear_rsi_os': 23, 'bear_rsi_ob': 87, 'bear_adx_thresh': 31.191836275450527, 'bear_atr_min_pct': 0.009452376935567174, 'bear_atr_max_pct': 0.05533210454918887, 'bear_tp_mult': 1.9137060504591072, 'bear_tsl_mult': 0.0028887108842937034, 'bear_time_stop': 177, 'bear_use_sma': True, 'bear_use_ema': False, 'bear_use_atr': False, 'bear_use_adx': True, 'bear_use_spike': True, 'bear_rsi_required': True, 'sideways_strategy': 'mean_reversion', 'sideways_bb_std_mult': 2.273186885907431, 'sideways_rsi_os': 12, 'sideways_rsi_ob': 76, 'sideways_adx_thresh': 11.145470964750384, 'sideways_atr_min_pct': 0.025192820953966497, 'sideways_atr_max_pct': 0.05905193736955278, 'sideways_tp_mult': 1.085399642137191, 'sideways_tsl_mult': 0.8320670255892193, 'sideways_time_stop': 56, 'sideways_use_sma': True, 'sideways_use_ema': False, 'sideways_use_atr': True, 'sideways_use_adx': True, 'sideways_use_spike': True, 'sideways_rsi_required': True}.
[I 2025-09-01 09:02:25,414] Trial 23 finished with values: [-0.0269902262005004, 0.026858948260131046] and parameters: {'p_sma': 14, 'p_std': 40, 'p_atr': 14, 'p_adx': 10, 'rsi_period': 25, 'ema1': 22, 'ema2': 60, 'slip_atr_k': 0.03951804540318553, 'slip_spread_k': 0.609922064873895, 'spread_hl_frac': 0.03360872670908274, 'bb_std_mult': 2.726270988147983, 'rsi_os': 45, 'rsi_ob': 53, 'vol_spike': 0.12408477283809866, 'adx_thresh': 16.738253992108085, 'atr_min_pct': 0.007667466015552814, 'atr_max_pct': 0.09659751253434755, 'tp_mult': 2.979953995921099, 'tsl_mult': 0.4922094406168845, 'strategy': 'mean_reversion', 'time_stop': 64, 'use_sma': False, 'use_atr': True, 'use_adx': False, 'use_ema': True, 'use_spike': False, 'rsi_required': True, 'edge_k': 0.3637247522222938, 'edge_cap': 0.5607854140302427, 'bull_strategy': 'breakout', 'bull_bb_std_mult': 3.1400167147731572, 'bull_rsi_os': 27, 'bull_rsi_ob': 77, 'bull_adx_thresh': 24.538578445267234, 'bull_atr_min_pct': 0.000488629772510147, 'bull_atr_max_pct': 0.05012289620356657, 'bull_tp_mult': 2.242789652050453, 'bull_tsl_mult': 0.4251534643224018, 'bull_time_stop': 46, 'bull_use_sma': False, 'bull_use_ema': True, 'bull_use_atr': True, 'bull_use_adx': True, 'bull_use_spike': True, 'bull_rsi_required': False, 'bear_strategy': 'breakout', 'bear_bb_std_mult': 3.5755298669955837, 'bear_rsi_os': 32, 'bear_rsi_ob': 85, 'bear_adx_thresh': 30.732761661110537, 'bear_atr_min_pct': 0.018076150363982593, 'bear_atr_max_pct': 0.052572831417265486, 'bear_tp_mult': 1.9337565097402072, 'bear_tsl_mult': 0.12545092306244382, 'bear_time_stop': 251, 'bear_use_sma': True, 'bear_use_ema': False, 'bear_use_atr': False, 'bear_use_adx': True, 'bear_use_spike': True, 'bear_rsi_required': True, 'sideways_strategy': 'mean_reversion', 'sideways_bb_std_mult': 3.332095065371383, 'sideways_rsi_os': 11, 'sideways_rsi_ob': 76, 'sideways_adx_thresh': 16.984458427305828, 'sideways_atr_min_pct': 0.026271211874165503, 'sideways_atr_max_pct': 0.10847681145513607, 'sideways_tp_mult': 2.9080243751606156, 'sideways_tsl_mult': 0.6394145825307466, 'sideways_time_stop': 171, 'sideways_use_sma': True, 'sideways_use_ema': False, 'sideways_use_atr': True, 'sideways_use_adx': True, 'sideways_use_spike': True, 'sideways_rsi_required': True}.
[I 2025-09-01 09:03:04,386] Trial 25 finished with values: [-0.13844945449412605, 0.13820060775900467] and parameters: {'p_sma': 24, 'p_std': 41, 'p_atr': 16, 'p_adx': 10, 'rsi_period': 26, 'ema1': 24, 'ema2': 56, 'slip_atr_k': 0.04667123497947319, 'slip_spread_k': 0.573143654211778, 'spread_hl_frac': 0.023302696448080768, 'bb_std_mult': 2.6916630800694223, 'rsi_os': 43, 'rsi_ob': 64, 'vol_spike': 0.12927044614885413, 'adx_thresh': 15.702570554095182, 'atr_min_pct': 0.005058844315637502, 'atr_max_pct': 0.14844042704552782, 'tp_mult': 2.328692949792139, 'tsl_mult': 0.4880250450944123, 'strategy': 'mean_reversion', 'time_stop': 57, 'use_sma': False, 'use_atr': True, 'use_adx': False, 'use_ema': True, 'use_spike': False, 'rsi_required': True, 'edge_k': 0.4916689369715037, 'edge_cap': 0.8372609233128894, 'bull_strategy': 'breakout', 'bull_bb_std_mult': 3.0795835855266436, 'bull_rsi_os': 31, 'bull_rsi_ob': 52, 'bull_adx_thresh': 25.227521605625583, 'bull_atr_min_pct': 0.012915202901913917, 'bull_atr_max_pct': 0.07060366966854571, 'bull_tp_mult': 2.1793290284400038, 'bull_tsl_mult': 0.20230663122741696, 'bull_time_stop': 56, 'bull_use_sma': False, 'bull_use_ema': True, 'bull_use_atr': True, 'bull_use_adx': False, 'bull_use_spike': True, 'bull_rsi_required': False, 'bear_strategy': 'breakout', 'bear_bb_std_mult': 3.551857053896403, 'bear_rsi_os': 40, 'bear_rsi_ob': 87, 'bear_adx_thresh': 30.429132161917195, 'bear_atr_min_pct': 0.011023955487107794, 'bear_atr_max_pct': 0.05169961416139684, 'bear_tp_mult': 1.962113230688263, 'bear_tsl_mult': 0.1282038075518847, 'bear_time_stop': 170, 'bear_use_sma': True, 'bear_use_ema': False, 'bear_use_atr': False, 'bear_use_adx': True, 'bear_use_spike': True, 'bear_rsi_required': True, 'sideways_strategy': 'mean_reversion', 'sideways_bb_std_mult': 1.6652358868392676, 'sideways_rsi_os': 11, 'sideways_rsi_ob': 50, 'sideways_adx_thresh': 14.98613773640934, 'sideways_atr_min_pct': 0.002427533990345195, 'sideways_atr_max_pct': 0.05840646464466977, 'sideways_tp_mult': 1.6381481892832481, 'sideways_tsl_mult': 0.4421308700317871, 'sideways_time_stop': 104, 'sideways_use_sma': True, 'sideways_use_ema': False, 'sideways_use_atr': True, 'sideways_use_adx': True, 'sideways_use_spike': True, 'sideways_rsi_required': True}.
[I 2025-09-01 09:03:04,669] Trial 24 finished with values: [-0.09452763713342538, 0.09439908078700275] and parameters: {'p_sma': 26, 'p_std': 28, 'p_atr': 16, 'p_adx': 11, 'rsi_period': 24, 'ema1': 21, 'ema2': 57, 'slip_atr_k': 0.05232481654116447, 'slip_spread_k': 0.6354751627220058, 'spread_hl_frac': 0.023592724637499785, 'bb_std_mult': 2.807907396677673, 'rsi_os': 43, 'rsi_ob': 66, 'vol_spike': 0.13906881623677417, 'adx_thresh': 15.985726764782683, 'atr_min_pct': 0.0036232944781619514, 'atr_max_pct': 0.03316746796716592, 'tp_mult': 2.2654205604508992, 'tsl_mult': 0.4794192158143519, 'strategy': 'mean_reversion', 'time_stop': 64, 'use_sma': False, 'use_atr': True, 'use_adx': False, 'use_ema': True, 'use_spike': False, 'rsi_required': True, 'edge_k': 0.49374905687603654, 'edge_cap': 0.8271002153869456, 'bull_strategy': 'breakout', 'bull_bb_std_mult': 3.1304941070267303, 'bull_rsi_os': 33, 'bull_rsi_ob': 67, 'bull_adx_thresh': 25.491616800188055, 'bull_atr_min_pct': 0.013400411341992609, 'bull_atr_max_pct': 0.07460435315839402, 'bull_tp_mult': 2.205439543441514, 'bull_tsl_mult': 0.20412993104403243, 'bull_time_stop': 53, 'bull_use_sma': False, 'bull_use_ema': True, 'bull_use_atr': True, 'bull_use_adx': False, 'bull_use_spike': True, 'bull_rsi_required': False, 'bear_strategy': 'breakout', 'bear_bb_std_mult': 3.596490881931289, 'bear_rsi_os': 40, 'bear_rsi_ob': 86, 'bear_adx_thresh': 31.052800981705, 'bear_atr_min_pct': 0.011200342804104292, 'bear_atr_max_pct': 0.12002859136527619, 'bear_tp_mult': 1.942113358080711, 'bear_tsl_mult': 0.8120884624577077, 'bear_time_stop': 168, 'bear_use_sma': True, 'bear_use_ema': False, 'bear_use_atr': False, 'bear_use_adx': True, 'bear_use_spike': True, 'bear_rsi_required': True, 'sideways_strategy': 'mean_reversion', 'sideways_bb_std_mult': 1.6518257199516522, 'sideways_rsi_os': 11, 'sideways_rsi_ob': 51, 'sideways_adx_thresh': 16.622430297316328, 'sideways_atr_min_pct': 0.0029327741212567676, 'sideways_atr_max_pct': 0.05706261232284386, 'sideways_tp_mult': 2.693932523349585, 'sideways_tsl_mult': 0.4170572361233227, 'sideways_time_stop': 113, 'sideways_use_sma': True, 'sideways_use_ema': False, 'sideways_use_atr': True, 'sideways_use_adx': True, 'sideways_use_spike': True, 'sideways_rsi_required': True}.
[I 2025-09-01 09:03:05,267] Trial 27 finished with values: [-1000000000.0, 1000000000.0] and parameters: {'p_sma': 13, 'p_std': 28, 'p_atr': 16, 'p_adx': 10, 'rsi_period': 23, 'ema1': 22, 'ema2': 55, 'slip_atr_k': 0.05088705248406332, 'slip_spread_k': 0.5904502682175784, 'spread_hl_frac': 0.034459859959925426, 'bb_std_mult': 3.57748515093615, 'rsi_os': 43, 'rsi_ob': 64, 'vol_spike': 0.04959986367345272, 'adx_thresh': 17.088673720311544, 'atr_min_pct': 0.005556551269176366, 'atr_max_pct': 0.09582715374375088, 'tp_mult': 2.948627622128317, 'tsl_mult': 0.49010677708683853, 'strategy': 'mean_reversion', 'time_stop': 63, 'use_sma': False, 'use_atr': True, 'use_adx': False, 'use_ema': True, 'use_spike': False, 'rsi_required': True, 'edge_k': 0.44442923003413126, 'edge_cap': 0.4320388433042414, 'bull_strategy': 'mean_reversion', 'bull_bb_std_mult': 3.360522929532685, 'bull_rsi_os': 25, 'bull_rsi_ob': 78, 'bull_adx_thresh': 18.573584103399796, 'bull_atr_min_pct': 0.006905976461288475, 'bull_atr_max_pct': 0.037641929675813104, 'bull_tp_mult': 2.457762413624844, 'bull_tsl_mult': 0.41382113759606176, 'bull_time_stop': 53, 'bull_use_sma': True, 'bull_use_ema': False, 'bull_use_atr': False, 'bull_use_adx': False, 'bull_use_spike': True, 'bull_rsi_required': False, 'bear_strategy': 'mean_reversion', 'bear_bb_std_mult': 3.477690091899893, 'bear_rsi_os': 31, 'bear_rsi_ob': 87, 'bear_adx_thresh': 29.19466554342484, 'bear_atr_min_pct': 0.018174989810891943, 'bear_atr_max_pct': 0.03704895546474485, 'bear_tp_mult': 2.4601139727062766, 'bear_tsl_mult': 0.7870500955767958, 'bear_time_stop': 251, 'bear_use_sma': True, 'bear_use_ema': True, 'bear_use_atr': False, 'bear_use_adx': True, 'bear_use_spike': True, 'bear_rsi_required': False, 'sideways_strategy': 'mean_reversion', 'sideways_bb_std_mult': 3.5436391865674666, 'sideways_rsi_os': 55, 'sideways_rsi_ob': 76, 'sideways_adx_thresh': 17.386256847222636, 'sideways_atr_min_pct': 0.02978884264612728, 'sideways_atr_max_pct': 0.10342283956484843, 'sideways_tp_mult': 2.7651171630514986, 'sideways_tsl_mult': 0.7244650359658875, 'sideways_time_stop': 170, 'sideways_use_sma': True, 'sideways_use_ema': True, 'sideways_use_atr': False, 'sideways_use_adx': True, 'sideways_use_spike': True, 'sideways_rsi_required': True}.
