[I 2025-09-01 09:56:26,349] Trial 354 finished with values: [-1000000000.0, 1000000000.0] and parameters: {'p_sma': 13, 'p_std': 46, 'p_atr': 22, 'p_adx': 23, 'rsi_period': 61, 'ema1': 13, 'ema2': 53, 'slip_atr_k': 0.05794131475575133, 'slip_spread_k': 0.20492316141004588, 'spread_hl_frac': 0.029121414873529906, 'bb_std_mult': 3.192336951282705, 'rsi_os': 32, 'rsi_ob': 76, 'vol_spike': 0.2919325303852817, 'adx_thresh': 26.621763395731513, 'atr_min_pct': 0.026661367498317295, 'atr_max_pct': 0.08375235633512365, 'tp_mult': 2.743714509292728, 'tsl_mult': 0.06066730120439712, 'strategy': 'breakout', 'time_stop': 159, 'use_sma': False, 'use_atr': False, 'use_adx': True, 'use_ema': False, 'use_spike': False, 'rsi_required': False, 'edge_k': 0.8055779722018998, 'edge_cap': 0.7362796208613962, 'bull_strategy': 'mean_reversion', 'bull_bb_std_mult': 0.9241590906107053, 'bull_rsi_os': 27, 'bull_rsi_ob': 73, 'bull_adx_thresh': 6.081831338773867, 'bull_atr_min_pct': 0.010503710067349924, 'bull_atr_max_pct': 0.10082597114474132, 'bull_tp_mult': 1.9318586850764936, 'bull_tsl_mult': 0.024707143765722143, 'bull_time_stop': 39, 'bull_use_sma': True, 'bull_use_ema': False, 'bull_use_atr': True, 'bull_use_adx': True, 'bull_use_spike': False, 'bull_rsi_required': True, 'bear_strategy': 'mean_reversion', 'bear_bb_std_mult': 1.1144216840413406, 'bear_rsi_os': 23, 'bear_rsi_ob': 47, 'bear_adx_thresh': 9.481646521348383, 'bear_atr_min_pct': 0.007392110015247271, 'bear_atr_max_pct': 0.07115984852712058, 'bear_tp_mult': 1.3041388451898055, 'bear_tsl_mult': 0.7384804461946597, 'bear_time_stop': 125, 'bear_use_sma': False, 'bear_use_ema': True, 'bear_use_atr': True, 'bear_use_adx': False, 'bear_use_spike': True, 'bear_rsi_required': False, 'sideways_strategy': 'breakout', 'sideways_bb_std_mult': 3.2997477681021707, 'sideways_rsi_os': 49, 'sideways_rsi_ob': 50, 'sideways_adx_thresh': 8.745248813203306, 'sideways_atr_min_pct': 0.012677805875141031, 'sideways_atr_max_pct': 0.08763777968044242, 'sideways_tp_mult': 1.334641730541778, 'sideways_tsl_mult': 0.8140100523276682, 'sideways_time_stop': 89, 'sideways_use_sma': False, 'sideways_use_ema': True, 'sideways_use_atr': False, 'sideways_use_adx': False, 'sideways_use_spike': False, 'sideways_rsi_required': False}.
[I 2025-09-01 09:56:27,616] Trial 353 finished with values: [-0.13723935262217257, 0.13703225268169045] and parameters: {'p_sma': 50, 'p_std': 45, 'p_atr': 23, 'p_adx': 23, 'rsi_period': 63, 'ema1': 29, 'ema2': 53, 'slip_atr_k': 0.12352507537335755, 'slip_spread_k': 0.20567564236765645, 'spread_hl_frac': 0.020633380045958966, 'bb_std_mult': 3.2020511454411227, 'rsi_os': 29, 'rsi_ob': 76, 'vol_spike': 0.17208327164140536, 'adx_thresh': 31.337735014618453, 'atr_min_pct': 0.02706573077210906, 'atr_max_pct': 0.08336040886363605, 'tp_mult': 2.7651147340776183, 'tsl_mult': 0.15561204915597865, 'strategy': 'breakout', 'time_stop': 237, 'use_sma': True, 'use_atr': False, 'use_adx': True, 'use_ema': False, 'use_spike': False, 'rsi_required': False, 'edge_k': 0.9778466430610258, 'edge_cap': 0.8773543743928626, 'bull_strategy': 'mean_reversion', 'bull_bb_std_mult': 0.9152272310356454, 'bull_rsi_os': 19, 'bull_rsi_ob': 73, 'bull_adx_thresh': 6.281789388603462, 'bull_atr_min_pct': 0.01422466970147658, 'bull_atr_max_pct': 0.08373457856196735, 'bull_tp_mult': 1.9354071112206814, 'bull_tsl_mult': 0.27969621757395113, 'bull_time_stop': 161, 'bull_use_sma': True, 'bull_use_ema': False, 'bull_use_atr': True, 'bull_use_adx': True, 'bull_use_spike': False, 'bull_rsi_required': True, 'bear_strategy': 'mean_reversion', 'bear_bb_std_mult': 3.40831030565392, 'bear_rsi_os': 48, 'bear_rsi_ob': 46, 'bear_adx_thresh': 26.482175000759245, 'bear_atr_min_pct': 0.005026523413215942, 'bear_atr_max_pct': 0.07159094877701497, 'bear_tp_mult': 1.128904534755335, 'bear_tsl_mult': 0.6271962308607755, 'bear_time_stop': 126, 'bear_use_sma': False, 'bear_use_ema': True, 'bear_use_atr': True, 'bear_use_adx': False, 'bear_use_spike': True, 'bear_rsi_required': False, 'sideways_strategy': 'breakout', 'sideways_bb_std_mult': 3.4663196280258375, 'sideways_rsi_os': 51, 'sideways_rsi_ob': 94, 'sideways_adx_thresh': 22.955334282965705, 'sideways_atr_min_pct': 0.0023642343951272523, 'sideways_atr_max_pct': 0.0705641727206643, 'sideways_tp_mult': 1.3380774241754378, 'sideways_tsl_mult': 0.8201757235916998, 'sideways_time_stop': 158, 'sideways_use_sma': False, 'sideways_use_ema': True, 'sideways_use_atr': False, 'sideways_use_adx': False, 'sideways_use_spike': False, 'sideways_rsi_required': False}.
[I 2025-09-01 09:56:28,554] Trial 351 finished with values: [-0.11849894141492734, 0.11830135431391124] and parameters: {'p_sma': 20, 'p_std': 49, 'p_atr': 19, 'p_adx': 23, 'rsi_period': 60, 'ema1': 30, 'ema2': 58, 'slip_atr_k': 0.24965409859282894, 'slip_spread_k': 0.2044301444260073, 'spread_hl_frac': 0.026628678858833042, 'bb_std_mult': 3.267529775855085, 'rsi_os': 27, 'rsi_ob': 76, 'vol_spike': 0.29163670212656767, 'adx_thresh': 29.271396438287567, 'atr_min_pct': 0.0258409370122793, 'atr_max_pct': 0.08330513527835659, 'tp_mult': 2.4728954257190288, 'tsl_mult': 0.1599747549523794, 'strategy': 'breakout', 'time_stop': 236, 'use_sma': True, 'use_atr': False, 'use_adx': True, 'use_ema': False, 'use_spike': False, 'rsi_required': False, 'edge_k': 0.7127051265587894, 'edge_cap': 0.7347852715186673, 'bull_strategy': 'mean_reversion', 'bull_bb_std_mult': 0.8996530687423234, 'bull_rsi_os': 19, 'bull_rsi_ob': 55, 'bull_adx_thresh': 5.85871730798444, 'bull_atr_min_pct': 0.010740242834732464, 'bull_atr_max_pct': 0.0845867036159344, 'bull_tp_mult': 1.9384952572183098, 'bull_tsl_mult': 0.6483166699915994, 'bull_time_stop': 150, 'bull_use_sma': True, 'bull_use_ema': False, 'bull_use_atr': True, 'bull_use_adx': True, 'bull_use_spike': False, 'bull_rsi_required': True, 'bear_strategy': 'mean_reversion', 'bear_bb_std_mult': 1.8425471200736523, 'bear_rsi_os': 16, 'bear_rsi_ob': 45, 'bear_adx_thresh': 11.983365375438247, 'bear_atr_min_pct': 0.011044996298874973, 'bear_atr_max_pct': 0.0713484068316436, 'bear_tp_mult': 1.072974713670269, 'bear_tsl_mult': 0.4442095677259497, 'bear_time_stop': 259, 'bear_use_sma': False, 'bear_use_ema': True, 'bear_use_atr': True, 'bear_use_adx': False, 'bear_use_spike': True, 'bear_rsi_required': False, 'sideways_strategy': 'breakout', 'sideways_bb_std_mult': 3.4983409160775265, 'sideways_rsi_os': 50, 'sideways_rsi_ob': 80, 'sideways_adx_thresh': 22.9104225376832, 'sideways_atr_min_pct': 0.0022961314223162973, 'sideways_atr_max_pct': 0.137642413116585, 'sideways_tp_mult': 1.3380605243640384, 'sideways_tsl_mult': 0.8183737092623427, 'sideways_time_stop': 197, 'sideways_use_sma': False, 'sideways_use_ema': True, 'sideways_use_atr': False, 'sideways_use_adx': False, 'sideways_use_spike': False, 'sideways_rsi_required': False}.
[I 2025-09-01 09:56:28,871] Trial 352 finished with values: [-0.26299823483741835, 0.2628250456795409] and parameters: {'p_sma': 50, 'p_std': 44, 'p_atr': 20, 'p_adx': 23, 'rsi_period': 60, 'ema1': 30, 'ema2': 58, 'slip_atr_k': 0.20335031213204707, 'slip_spread_k': 0.20485574646874397, 'spread_hl_frac': 0.022307001345915973, 'bb_std_mult': 3.2275611352926714, 'rsi_os': 32, 'rsi_ob': 76, 'vol_spike': 0.2904651893889665, 'adx_thresh': 19.458373227341546, 'atr_min_pct': 0.025732578804241714, 'atr_max_pct': 0.08392199407711778, 'tp_mult': 2.4901257212684476, 'tsl_mult': 0.072160476875541, 'strategy': 'breakout', 'time_stop': 145, 'use_sma': True, 'use_atr': False, 'use_adx': True, 'use_ema': False, 'use_spike': False, 'rsi_required': False, 'edge_k': 0.6642887026553341, 'edge_cap': 0.5564359403758168, 'bull_strategy': 'mean_reversion', 'bull_bb_std_mult': 1.0870232826846353, 'bull_rsi_os': 19, 'bull_rsi_ob': 55, 'bull_adx_thresh': 24.893337042454903, 'bull_atr_min_pct': 0.017849721127751038, 'bull_atr_max_pct': 0.08456420015525455, 'bull_tp_mult': 1.8299191845841876, 'bull_tsl_mult': 0.7406772366014147, 'bull_time_stop': 150, 'bull_use_sma': True, 'bull_use_ema': False, 'bull_use_atr': True, 'bull_use_adx': True, 'bull_use_spike': False, 'bull_rsi_required': True, 'bear_strategy': 'mean_reversion', 'bear_bb_std_mult': 1.9711996604052022, 'bear_rsi_os': 46, 'bear_rsi_ob': 45, 'bear_adx_thresh': 27.320788983537017, 'bear_atr_min_pct': 0.001647767709003125, 'bear_atr_max_pct': 0.0764874688109486, 'bear_tp_mult': 1.1943406667910643, 'bear_tsl_mult': 0.6346015472468292, 'bear_time_stop': 260, 'bear_use_sma': False, 'bear_use_ema': True, 'bear_use_atr': True, 'bear_use_adx': False, 'bear_use_spike': True, 'bear_rsi_required': False, 'sideways_strategy': 'breakout', 'sideways_bb_std_mult': 3.502888186643782, 'sideways_rsi_os': 50, 'sideways_rsi_ob': 51, 'sideways_adx_thresh': 20.494237005785113, 'sideways_atr_min_pct': 0.002237686639166644, 'sideways_atr_max_pct': 0.016728735587519597, 'sideways_tp_mult': 1.334185551430989, 'sideways_tsl_mult': 0.8600738665216653, 'sideways_time_stop': 158, 'sideways_use_sma': False, 'sideways_use_ema': True, 'sideways_use_atr': False, 'sideways_use_adx': False, 'sideways_use_spike': False, 'sideways_rsi_required': False}.
[I 2025-09-01 09:57:09,933] Trial 355 finished with values: [-1000000000.0, 1000000000.0] and parameters: {'p_sma': 50, 'p_std': 44, 'p_atr': 23, 'p_adx': 23, 'rsi_period': 63, 'ema1': 30, 'ema2': 58, 'slip_atr_k': 0.12454072096834846, 'slip_spread_k': 0.15531095005873619, 'spread_hl_frac': 0.021187197248763324, 'bb_std_mult': 2.976082232859757, 'rsi_os': 27, 'rsi_ob': 75, 'vol_spike': 0.27966171256593975, 'adx_thresh': 19.65108006566789, 'atr_min_pct': 0.029973684382882095, 'atr_max_pct': 0.07750915344379204, 'tp_mult': 2.6704385967654765, 'tsl_mult': 0.05923422472068163, 'strategy': 'breakout', 'time_stop': 235, 'use_sma': True, 'use_atr': False, 'use_adx': True, 'use_ema': False, 'use_spike': False, 'rsi_required': False, 'edge_k': 0.976629133442877, 'edge_cap': 0.9875245558535612, 'bull_strategy': 'mean_reversion', 'bull_bb_std_mult': 0.8131522541695075, 'bull_rsi_os': 28, 'bull_rsi_ob': 81, 'bull_adx_thresh': 6.287333826212752, 'bull_atr_min_pct': 0.011704254977436507, 'bull_atr_max_pct': 0.14264901302189187, 'bull_tp_mult': 1.9153148934477513, 'bull_tsl_mult': 0.6464069891171879, 'bull_time_stop': 59, 'bull_use_sma': True, 'bull_use_ema': False, 'bull_use_atr': True, 'bull_use_adx': True, 'bull_use_spike': True, 'bull_rsi_required': True, 'bear_strategy': 'mean_reversion', 'bear_bb_std_mult': 3.3300338128964984, 'bear_rsi_os': 35, 'bear_rsi_ob': 46, 'bear_adx_thresh': 27.23163027111858, 'bear_atr_min_pct': 0.016778301857414232, 'bear_atr_max_pct': 0.07916535694526818, 'bear_tp_mult': 1.80060021934548, 'bear_tsl_mult': 0.6421035708246831, 'bear_time_stop': 144, 'bear_use_sma': False, 'bear_use_ema': True, 'bear_use_atr': True, 'bear_use_adx': False, 'bear_use_spike': True, 'bear_rsi_required': False, 'sideways_strategy': 'breakout', 'sideways_bb_std_mult': 3.4799043211442027, 'sideways_rsi_os': 6, 'sideways_rsi_ob': 73, 'sideways_adx_thresh': 20.46321321900584, 'sideways_atr_min_pct': 0.021876756446552965, 'sideways_atr_max_pct': 0.024293338408624375, 'sideways_tp_mult': 1.2892343533345512, 'sideways_tsl_mult': 0.8590597426849589, 'sideways_time_stop': 153, 'sideways_use_sma': False, 'sideways_use_ema': False, 'sideways_use_atr': False, 'sideways_use_adx': False, 'sideways_use_spike': False, 'sideways_rsi_required': False}.
[I 2025-09-01 09:57:10,498] Trial 356 finished with values: [-0.10078278207637614, 0.10004635599119478] and parameters: {'p_sma': 38, 'p_std': 31, 'p_atr': 26, 'p_adx': 22, 'rsi_period': 60, 'ema1': 30, 'ema2': 59, 'slip_atr_k': 0.05436946243769439, 'slip_spread_k': 0.44925073383256225, 'spread_hl_frac': 0.028968307295846943, 'bb_std_mult': 0.5079258766307115, 'rsi_os': 27, 'rsi_ob': 75, 'vol_spike': 0.06292346638032148, 'adx_thresh': 6.363357408808806, 'atr_min_pct': 0.005105397983936406, 'atr_max_pct': 0.07704756837861307, 'tp_mult': 1.2870496142422363, 'tsl_mult': 0.050948897898325934, 'strategy': 'mean_reversion', 'time_stop': 257, 'use_sma': True, 'use_atr': False, 'use_adx': True, 'use_ema': False, 'use_spike': False, 'rsi_required': False, 'edge_k': 0.7563531629016876, 'edge_cap': 0.674225853995114, 'bull_strategy': 'mean_reversion', 'bull_bb_std_mult': 3.4400037166412525, 'bull_rsi_os': 18, 'bull_rsi_ob': 81, 'bull_adx_thresh': 5.016293888720498, 'bull_atr_min_pct': 0.011765427517766037, 'bull_atr_max_pct': 0.0786638407918801, 'bull_tp_mult': 1.833221514606083, 'bull_tsl_mult': 0.7618446765985013, 'bull_time_stop': 153, 'bull_use_sma': True, 'bull_use_ema': False, 'bull_use_atr': True, 'bull_use_adx': True, 'bull_use_spike': True, 'bull_rsi_required': True, 'bear_strategy': 'mean_reversion', 'bear_bb_std_mult': 1.9571317900041074, 'bear_rsi_os': 19, 'bear_rsi_ob': 46, 'bear_adx_thresh': 27.560774838842548, 'bear_atr_min_pct': 0.0019470210992583916, 'bear_atr_max_pct': 0.07945352824729109, 'bear_tp_mult': 2.910864971612934, 'bear_tsl_mult': 0.4440195950967672, 'bear_time_stop': 11, 'bear_use_sma': False, 'bear_use_ema': True, 'bear_use_atr': True, 'bear_use_adx': False, 'bear_use_spike': True, 'bear_rsi_required': False, 'sideways_strategy': 'breakout', 'sideways_bb_std_mult': 3.375711876527913, 'sideways_rsi_os': 35, 'sideways_rsi_ob': 75, 'sideways_adx_thresh': 18.65442250599226, 'sideways_atr_min_pct': 0.003261047372945552, 'sideways_atr_max_pct': 0.03032274107787459, 'sideways_tp_mult': 2.739604277198329, 'sideways_tsl_mult': 0.8629318827956693, 'sideways_time_stop': 33, 'sideways_use_sma': False, 'sideways_use_ema': False, 'sideways_use_atr': False, 'sideways_use_adx': False, 'sideways_use_spike': False, 'sideways_rsi_required': False}.
[I 2025-09-01 09:57:10,990] Trial 358 finished with values: [-1000000000.0, 1000000000.0] and parameters: {'p_sma': 38, 'p_std': 52, 'p_atr': 23, 'p_adx': 22, 'rsi_period': 63, 'ema1': 10, 'ema2': 45, 'slip_atr_k': 0.1290609227986891, 'slip_spread_k': 0.6578222565419072, 'spread_hl_frac': 0.04888851739359927, 'bb_std_mult': 2.4031895526907983, 'rsi_os': 24, 'rsi_ob': 54, 'vol_spike': 0.27951071409889544, 'adx_thresh': 13.839417748010103, 'atr_min_pct': 0.024504136342111894, 'atr_max_pct': 0.07703714406742973, 'tp_mult': 2.592207216204198, 'tsl_mult': 0.3018190133070052, 'strategy': 'mean_reversion', 'time_stop': 299, 'use_sma': False, 'use_atr': False, 'use_adx': True, 'use_ema': True, 'use_spike': False, 'rsi_required': False, 'edge_k': 0.9385680445961316, 'edge_cap': 0.9844905613991535, 'bull_strategy': 'mean_reversion', 'bull_bb_std_mult': 3.203332692164491, 'bull_rsi_os': 28, 'bull_rsi_ob': 76, 'bull_adx_thresh': 16.678657481436165, 'bull_atr_min_pct': 0.029377064438559936, 'bull_atr_max_pct': 0.07973924122555393, 'bull_tp_mult': 1.2806241933718636, 'bull_tsl_mult': 0.049500794020641836, 'bull_time_stop': 158, 'bull_use_sma': False, 'bull_use_ema': False, 'bull_use_atr': True, 'bull_use_adx': True, 'bull_use_spike': True, 'bull_rsi_required': False, 'bear_strategy': 'mean_reversion', 'bear_bb_std_mult': 3.3296924117088627, 'bear_rsi_os': 35, 'bear_rsi_ob': 47, 'bear_adx_thresh': 28.338548064260102, 'bear_atr_min_pct': 0.016700718791348875, 'bear_atr_max_pct': 0.06822973652794874, 'bear_tp_mult': 1.2963761203983817, 'bear_tsl_mult': 0.8044041621163194, 'bear_time_stop': 144, 'bear_use_sma': False, 'bear_use_ema': True, 'bear_use_atr': True, 'bear_use_adx': False, 'bear_use_spike': True, 'bear_rsi_required': False, 'sideways_strategy': 'breakout', 'sideways_bb_std_mult': 3.318563307572155, 'sideways_rsi_os': 35, 'sideways_rsi_ob': 86, 'sideways_adx_thresh': 21.596092426735293, 'sideways_atr_min_pct': 0.02188564670539721, 'sideways_atr_max_pct': 0.11979768255474962, 'sideways_tp_mult': 1.2898004733918706, 'sideways_tsl_mult': 0.8604919950395599, 'sideways_time_stop': 39, 'sideways_use_sma': True, 'sideways_use_ema': False, 'sideways_use_atr': True, 'sideways_use_adx': False, 'sideways_use_spike': False, 'sideways_rsi_required': False}.
[I 2025-09-01 09:57:11,003] Trial 357 finished with values: [-0.035674119046641306, 0.0356972932062471] and parameters: {'p_sma': 22, 'p_std': 45, 'p_atr': 27, 'p_adx': 22, 'rsi_period': 20, 'ema1': 21, 'ema2': 52, 'slip_atr_k': 0.23780950389438732, 'slip_spread_k': 0.4434592396817646, 'spread_hl_frac': 0.028655314219562744, 'bb_std_mult': 1.0975187073446508, 'rsi_os': 17, 'rsi_ob': 67, 'vol_spike': 0.13464846452199292, 'adx_thresh': 23.24241339834199, 'atr_min_pct': 0.014275002603242187, 'atr_max_pct': 0.07679977400167577, 'tp_mult': 1.2797538892088443, 'tsl_mult': 0.9661229562754983, 'strategy': 'mean_reversion', 'time_stop': 97, 'use_sma': False, 'use_atr': False, 'use_adx': True, 'use_ema': True, 'use_spike': False, 'rsi_required': False, 'edge_k': 0.8468005370413425, 'edge_cap': 0.9959785378377382, 'bull_strategy': 'mean_reversion', 'bull_bb_std_mult': 0.8237823997697814, 'bull_rsi_os': 43, 'bull_rsi_ob': 75, 'bull_adx_thresh': 5.6186470585268875, 'bull_atr_min_pct': 0.002909745550638179, 'bull_atr_max_pct': 0.07845677215604416, 'bull_tp_mult': 1.275914682149747, 'bull_tsl_mult': 0.7652538186694494, 'bull_time_stop': 154, 'bull_use_sma': False, 'bull_use_ema': False, 'bull_use_atr': True, 'bull_use_adx': True, 'bull_use_spike': True, 'bull_rsi_required': False, 'bear_strategy': 'mean_reversion', 'bear_bb_std_mult': 1.052550105129463, 'bear_rsi_os': 35, 'bear_rsi_ob': 47, 'bear_adx_thresh': 28.686087380173454, 'bear_atr_min_pct': 0.01685773818507776, 'bear_atr_max_pct': 0.06840865616471876, 'bear_tp_mult': 1.2797310012498266, 'bear_tsl_mult': 0.4651728516107395, 'bear_time_stop': 44, 'bear_use_sma': False, 'bear_use_ema': True, 'bear_use_atr': True, 'bear_use_adx': False, 'bear_use_spike': True, 'bear_rsi_required': False, 'sideways_strategy': 'breakout', 'sideways_bb_std_mult': 2.7901827189103736, 'sideways_rsi_os': 19, 'sideways_rsi_ob': 85, 'sideways_adx_thresh': 21.58552643006485, 'sideways_atr_min_pct': 0.0034642494903287203, 'sideways_atr_max_pct': 0.03021982606337973, 'sideways_tp_mult': 1.1190769705769754, 'sideways_tsl_mult': 0.8546771116141403, 'sideways_time_stop': 40, 'sideways_use_sma': True, 'sideways_use_ema': False, 'sideways_use_atr': True, 'sideways_use_adx': False, 'sideways_use_spike': False, 'sideways_rsi_required': False}.
[I 2025-09-01 09:57:53,521] Trial 359 finished with values: [-1000000000.0, 1000000000.0] and parameters: {'p_sma': 56, 'p_std': 32, 'p_atr': 27, 'p_adx': 22, 'rsi_period': 22, 'ema1': 9, 'ema2': 45, 'slip_atr_k': 0.07299425216116465, 'slip_spread_k': 0.17060592518740958, 'spread_hl_frac': 0.02906818010935815, 'bb_std_mult': 3.092953310040688, 'rsi_os': 17, 'rsi_ob': 54, 'vol_spike': 0.18735472870662342, 'adx_thresh': 23.368692476126654, 'atr_min_pct': 0.004785366312532716, 'atr_max_pct': 0.07942664628205164, 'tp_mult': 2.8203076016607174, 'tsl_mult': 0.3237080427435161, 'strategy': 'mean_reversion', 'time_stop': 159, 'use_sma': False, 'use_atr': False, 'use_adx': True, 'use_ema': True, 'use_spike': False, 'rsi_required': True, 'edge_k': 0.8245051085600827, 'edge_cap': 0.4662935725210248, 'bull_strategy': 'breakout', 'bull_bb_std_mult': 3.229680435121968, 'bull_rsi_os': 23, 'bull_rsi_ob': 95, 'bull_adx_thresh': 16.353839451477377, 'bull_atr_min_pct': 0.008202787616656961, 'bull_atr_max_pct': 0.07984803023653973, 'bull_tp_mult': 2.987853546801439, 'bull_tsl_mult': 0.05869875441148018, 'bull_time_stop': 261, 'bull_use_sma': False, 'bull_use_ema': True, 'bull_use_atr': True, 'bull_use_adx': True, 'bull_use_spike': True, 'bull_rsi_required': False, 'bear_strategy': 'mean_reversion', 'bear_bb_std_mult': 2.891359093369311, 'bear_rsi_os': 48, 'bear_rsi_ob': 47, 'bear_adx_thresh': 27.80709272391439, 'bear_atr_min_pct': 0.0039957137622011075, 'bear_atr_max_pct': 0.08450342674375082, 'bear_tp_mult': 1.3095097170799328, 'bear_tsl_mult': 0.46156588830307493, 'bear_time_stop': 169, 'bear_use_sma': True, 'bear_use_ema': False, 'bear_use_atr': True, 'bear_use_adx': False, 'bear_use_spike': True, 'bear_rsi_required': False, 'sideways_strategy': 'breakout', 'sideways_bb_std_mult': 1.8452227383654927, 'sideways_rsi_os': 49, 'sideways_rsi_ob': 88, 'sideways_adx_thresh': 21.52615073056274, 'sideways_atr_min_pct': 0.0299761909321652, 'sideways_atr_max_pct': 0.11991049178393351, 'sideways_tp_mult': 2.7398306535242907, 'sideways_tsl_mult': 0.8421397512977395, 'sideways_time_stop': 205, 'sideways_use_sma': True, 'sideways_use_ema': False, 'sideways_use_atr': True, 'sideways_use_adx': False, 'sideways_use_spike': True, 'sideways_rsi_required': True}.
