[I 2025-09-01 09:06:30,202] Trial 55 finished with values: [-1000000000.0, 1000000000.0] and parameters: {'p_sma': 13, 'p_std': 38, 'p_atr': 10, 'p_adx': 21, 'rsi_period': 56, 'ema1': 28, 'ema2': 34, 'slip_atr_k': 0.21464125356276315, 'slip_spread_k': 0.4551539638142532, 'spread_hl_frac': 0.01721731967146268, 'bb_std_mult': 1.4987399526650977, 'rsi_os': 26, 'rsi_ob': 77, 'vol_spike': 0.11962034383395978, 'adx_thresh': 11.630281565657391, 'atr_min_pct': 0.008933293758430695, 'atr_max_pct': 0.09860704144056949, 'tp_mult': 2.784898899838341, 'tsl_mult': 0.6366724979222913, 'strategy': 'mean_reversion', 'time_stop': 256, 'use_sma': False, 'use_atr': True, 'use_adx': False, 'use_ema': True, 'use_spike': False, 'rsi_required': False, 'edge_k': 0.0983832996612759, 'edge_cap': 0.7363185528070162, 'bull_strategy': 'mean_reversion', 'bull_bb_std_mult': 0.7605723880156419, 'bull_rsi_os': 11, 'bull_rsi_ob': 75, 'bull_adx_thresh': 32.95443341092087, 'bull_atr_min_pct': 0.003775668625667762, 'bull_atr_max_pct': 0.03845840564810978, 'bull_tp_mult': 1.5245421796769667, 'bull_tsl_mult': 0.5567747553548013, 'bull_time_stop': 110, 'bull_use_sma': False, 'bull_use_ema': True, 'bull_use_atr': True, 'bull_use_adx': True, 'bull_use_spike': True, 'bull_rsi_required': True, 'bear_strategy': 'breakout', 'bear_bb_std_mult': 3.162760967467742, 'bear_rsi_os': 51, 'bear_rsi_ob': 89, 'bear_adx_thresh': 28.21420653921525, 'bear_atr_min_pct': 0.027267773481860373, 'bear_atr_max_pct': 0.04730168641761781, 'bear_tp_mult': 2.1044604894997976, 'bear_tsl_mult': 0.2486561885837475, 'bear_time_stop': 151, 'bear_use_sma': False, 'bear_use_ema': False, 'bear_use_atr': False, 'bear_use_adx': True, 'bear_use_spike': True, 'bear_rsi_required': True, 'sideways_strategy': 'breakout', 'sideways_bb_std_mult': 0.9481277875911394, 'sideways_rsi_os': 25, 'sideways_rsi_ob': 82, 'sideways_adx_thresh': 26.20832942132906, 'sideways_atr_min_pct': 0.020249746892745897, 'sideways_atr_max_pct': 0.1329405083547721, 'sideways_tp_mult': 2.890293620697753, 'sideways_tsl_mult': 0.09399060880155796, 'sideways_time_stop': 176, 'sideways_use_sma': True, 'sideways_use_ema': False, 'sideways_use_atr': True, 'sideways_use_adx': True, 'sideways_use_spike': True, 'sideways_rsi_required': True}.
[I 2025-09-01 09:06:30,797] Trial 54 finished with values: [-1000000000.0, 1000000000.0] and parameters: {'p_sma': 12, 'p_std': 38, 'p_atr': 10, 'p_adx': 21, 'rsi_period': 8, 'ema1': 28, 'ema2': 16, 'slip_atr_k': 0.19265868526996754, 'slip_spread_k': 0.4521797805214486, 'spread_hl_frac': 0.03185990121407712, 'bb_std_mult': 1.3607451691024923, 'rsi_os': 23, 'rsi_ob': 71, 'vol_spike': 0.12421284300002025, 'adx_thresh': 11.99113790647936, 'atr_min_pct': 0.008252403081665572, 'atr_max_pct': 0.09803393334428626, 'tp_mult': 1.7462899199709894, 'tsl_mult': 0.6403014794576216, 'strategy': 'mean_reversion', 'time_stop': 276, 'use_sma': False, 'use_atr': True, 'use_adx': False, 'use_ema': True, 'use_spike': False, 'rsi_required': True, 'edge_k': 1.9832148348484115, 'edge_cap': 0.7365357192207378, 'bull_strategy': 'mean_reversion', 'bull_bb_std_mult': 0.7567797729170804, 'bull_rsi_os': 28, 'bull_rsi_ob': 74, 'bull_adx_thresh': 33.61878217445067, 'bull_atr_min_pct': 0.001731384030014225, 'bull_atr_max_pct': 0.037043003662405656, 'bull_tp_mult': 1.9754980887389877, 'bull_tsl_mult': 0.5601066412903878, 'bull_time_stop': 105, 'bull_use_sma': False, 'bull_use_ema': True, 'bull_use_atr': True, 'bull_use_adx': True, 'bull_use_spike': True, 'bull_rsi_required': True, 'bear_strategy': 'breakout', 'bear_bb_std_mult': 3.136040478263355, 'bear_rsi_os': 44, 'bear_rsi_ob': 89, 'bear_adx_thresh': 28.097321282849233, 'bear_atr_min_pct': 0.020701209902632488, 'bear_atr_max_pct': 0.033728130949270616, 'bear_tp_mult': 2.99741932193856, 'bear_tsl_mult': 0.25414648068050616, 'bear_time_stop': 156, 'bear_use_sma': True, 'bear_use_ema': False, 'bear_use_atr': False, 'bear_use_adx': True, 'bear_use_spike': True, 'bear_rsi_required': True, 'sideways_strategy': 'mean_reversion', 'sideways_bb_std_mult': 0.9032630944902489, 'sideways_rsi_os': 48, 'sideways_rsi_ob': 83, 'sideways_adx_thresh': 26.62348915868818, 'sideways_atr_min_pct': 0.019573640355153063, 'sideways_atr_max_pct': 0.04680875423016826, 'sideways_tp_mult': 1.4969694848379098, 'sideways_tsl_mult': 0.5624592712911191, 'sideways_time_stop': 179, 'sideways_use_sma': True, 'sideways_use_ema': False, 'sideways_use_atr': True, 'sideways_use_adx': True, 'sideways_use_spike': True, 'sideways_rsi_required': True}.
[I 2025-09-01 09:06:31,170] Trial 56 finished with values: [-0.14350073243746553, 0.1429440593051432] and parameters: {'p_sma': 12, 'p_std': 37, 'p_atr': 10, 'p_adx': 20, 'rsi_period': 27, 'ema1': 28, 'ema2': 34, 'slip_atr_k': 0.19156037207598203, 'slip_spread_k': 0.45667177733279074, 'spread_hl_frac': 0.03187090074372678, 'bb_std_mult': 1.6332373989835227, 'rsi_os': 26, 'rsi_ob': 92, 'vol_spike': 0.12175692064803167, 'adx_thresh': 11.704760773771593, 'atr_min_pct': 0.009078427963261578, 'atr_max_pct': 0.09827019151308759, 'tp_mult': 2.7815784722314807, 'tsl_mult': 0.644045288764312, 'strategy': 'mean_reversion', 'time_stop': 251, 'use_sma': False, 'use_atr': True, 'use_adx': False, 'use_ema': True, 'use_spike': False, 'rsi_required': False, 'edge_k': 0.24583374988091222, 'edge_cap': 0.7305174166016966, 'bull_strategy': 'mean_reversion', 'bull_bb_std_mult': 2.6409533380492642, 'bull_rsi_os': 28, 'bull_rsi_ob': 73, 'bull_adx_thresh': 34.892059640816704, 'bull_atr_min_pct': 0.00395501533595123, 'bull_atr_max_pct': 0.04125114128132053, 'bull_tp_mult': 1.3991972094946168, 'bull_tsl_mult': 0.6727954985185913, 'bull_time_stop': 111, 'bull_use_sma': False, 'bull_use_ema': True, 'bull_use_atr': True, 'bull_use_adx': True, 'bull_use_spike': True, 'bull_rsi_required': True, 'bear_strategy': 'breakout', 'bear_bb_std_mult': 3.164243773842993, 'bear_rsi_os': 55, 'bear_rsi_ob': 73, 'bear_adx_thresh': 28.306966141094613, 'bear_atr_min_pct': 0.002842461821850731, 'bear_atr_max_pct': 0.03029609365335552, 'bear_tp_mult': 2.0454470351611587, 'bear_tsl_mult': 0.2579283966378142, 'bear_time_stop': 147, 'bear_use_sma': False, 'bear_use_ema': False, 'bear_use_atr': False, 'bear_use_adx': True, 'bear_use_spike': True, 'bear_rsi_required': True, 'sideways_strategy': 'breakout', 'sideways_bb_std_mult': 0.8993404650409678, 'sideways_rsi_os': 25, 'sideways_rsi_ob': 82, 'sideways_adx_thresh': 12.353850198585672, 'sideways_atr_min_pct': 0.019765165270827206, 'sideways_atr_max_pct': 0.11078810292078388, 'sideways_tp_mult': 1.4483340983872193, 'sideways_tsl_mult': 0.7658218069343193, 'sideways_time_stop': 174, 'sideways_use_sma': True, 'sideways_use_ema': False, 'sideways_use_atr': True, 'sideways_use_adx': True, 'sideways_use_spike': True, 'sideways_rsi_required': True}.
[I 2025-09-01 09:06:31,604] Trial 59 finished with values: [-1000000000.0, 1000000000.0] and parameters: {'p_sma': 53, 'p_std': 55, 'p_atr': 11, 'p_adx': 17, 'rsi_period': 27, 'ema1': 21, 'ema2': 55, 'slip_atr_k': 0.11928564181614038, 'slip_spread_k': 0.7985329711868474, 'spread_hl_frac': 0.02660230644517542, 'bb_std_mult': 1.706690793057541, 'rsi_os': 53, 'rsi_ob': 91, 'vol_spike': 0.14031173616524692, 'adx_thresh': 14.954746566384504, 'atr_min_pct': 0.006928160854419353, 'atr_max_pct': 0.14142426329717606, 'tp_mult': 1.2715771792400168, 'tsl_mult': 0.9470977763398643, 'strategy': 'mean_reversion', 'time_stop': 47, 'use_sma': False, 'use_atr': True, 'use_adx': False, 'use_ema': False, 'use_spike': False, 'rsi_required': True, 'edge_k': 0.681427047813616, 'edge_cap': 0.8302205296256693, 'bull_strategy': 'breakout', 'bull_bb_std_mult': 1.676569102489574, 'bull_rsi_os': 33, 'bull_rsi_ob': 55, 'bull_adx_thresh': 13.69531420355644, 'bull_atr_min_pct': 0.018174466947642857, 'bull_atr_max_pct': 0.05291456075123442, 'bull_tp_mult': 2.7810429023006247, 'bull_tsl_mult': 0.6419843560569657, 'bull_time_stop': 231, 'bull_use_sma': True, 'bull_use_ema': True, 'bull_use_atr': True, 'bull_use_adx': False, 'bull_use_spike': True, 'bull_rsi_required': False, 'bear_strategy': 'breakout', 'bear_bb_std_mult': 3.4724513956485814, 'bear_rsi_os': 26, 'bear_rsi_ob': 50, 'bear_adx_thresh': 25.349902162283676, 'bear_atr_min_pct': 0.0031919856752686566, 'bear_atr_max_pct': 0.12524914649323665, 'bear_tp_mult': 2.0001306040553652, 'bear_tsl_mult': 0.05105937851379745, 'bear_time_stop': 290, 'bear_use_sma': True, 'bear_use_ema': False, 'bear_use_atr': False, 'bear_use_adx': False, 'bear_use_spike': True, 'bear_rsi_required': False, 'sideways_strategy': 'mean_reversion', 'sideways_bb_std_mult': 2.941103225577731, 'sideways_rsi_os': 36, 'sideways_rsi_ob': 69, 'sideways_adx_thresh': 7.127885654979407, 'sideways_atr_min_pct': 0.024641267996855776, 'sideways_atr_max_pct': 0.11867361571724139, 'sideways_tp_mult': 1.7060020073806568, 'sideways_tsl_mult': 0.3820012759810277, 'sideways_time_stop': 201, 'sideways_use_sma': False, 'sideways_use_ema': False, 'sideways_use_atr': True, 'sideways_use_adx': True, 'sideways_use_spike': False, 'sideways_rsi_required': False}.
[I 2025-09-01 09:07:08,449] Trial 58 finished with values: [-0.026898712370801103, 0.026699874503353684] and parameters: {'p_sma': 12, 'p_std': 56, 'p_atr': 13, 'p_adx': 9, 'rsi_period': 9, 'ema1': 28, 'ema2': 37, 'slip_atr_k': 0.03481800777489256, 'slip_spread_k': 0.7948471765765829, 'spread_hl_frac': 0.025716901555031105, 'bb_std_mult': 1.3516023424325048, 'rsi_os': 10, 'rsi_ob': 70, 'vol_spike': 0.19259456624568647, 'adx_thresh': 31.320777232470224, 'atr_min_pct': 0.007016330782650837, 'atr_max_pct': 0.14750781570167423, 'tp_mult': 1.1728368771611355, 'tsl_mult': 0.3601604159011896, 'strategy': 'mean_reversion', 'time_stop': 18, 'use_sma': False, 'use_atr': True, 'use_adx': False, 'use_ema': True, 'use_spike': False, 'rsi_required': True, 'edge_k': 1.9241325471915685, 'edge_cap': 0.8169001936258216, 'bull_strategy': 'breakout', 'bull_bb_std_mult': 1.6809479816301203, 'bull_rsi_os': 53, 'bull_rsi_ob': 56, 'bull_adx_thresh': 14.264173001503176, 'bull_atr_min_pct': 0.0015860938373289254, 'bull_atr_max_pct': 0.041531430071004904, 'bull_tp_mult': 2.758545791873055, 'bull_tsl_mult': 0.636815132170383, 'bull_time_stop': 221, 'bull_use_sma': True, 'bull_use_ema': True, 'bull_use_atr': True, 'bull_use_adx': False, 'bull_use_spike': True, 'bull_rsi_required': False, 'bear_strategy': 'breakout', 'bear_bb_std_mult': 3.440379964180364, 'bear_rsi_os': 26, 'bear_rsi_ob': 53, 'bear_adx_thresh': 8.831690571636404, 'bear_atr_min_pct': 0.018879835301917555, 'bear_atr_max_pct': 0.12646437771161056, 'bear_tp_mult': 1.9912755482452986, 'bear_tsl_mult': 0.15108920456683517, 'bear_time_stop': 223, 'bear_use_sma': True, 'bear_use_ema': False, 'bear_use_atr': False, 'bear_use_adx': False, 'bear_use_spike': True, 'bear_rsi_required': True, 'sideways_strategy': 'mean_reversion', 'sideways_bb_std_mult': 2.907439093734689, 'sideways_rsi_os': 36, 'sideways_rsi_ob': 70, 'sideways_adx_thresh': 6.85973914138129, 'sideways_atr_min_pct': 0.007090644248199975, 'sideways_atr_max_pct': 0.03885985370505076, 'sideways_tp_mult': 1.4949545197976848, 'sideways_tsl_mult': 0.5625072310100483, 'sideways_time_stop': 199, 'sideways_use_sma': True, 'sideways_use_ema': False, 'sideways_use_atr': True, 'sideways_use_adx': True, 'sideways_use_spike': False, 'sideways_rsi_required': False}.
[I 2025-09-01 09:07:08,837] Trial 57 finished with values: [-0.03197509582127345, 0.03173740344835838] and parameters: {'p_sma': 12, 'p_std': 34, 'p_atr': 11, 'p_adx': 21, 'rsi_period': 7, 'ema1': 28, 'ema2': 39, 'slip_atr_k': 0.19351470909341006, 'slip_spread_k': 0.4665395132178853, 'spread_hl_frac': 0.015294656349541923, 'bb_std_mult': 1.4568409591376414, 'rsi_os': 27, 'rsi_ob': 70, 'vol_spike': 0.11860996368433699, 'adx_thresh': 8.48490459190708, 'atr_min_pct': 0.007544419387414393, 'atr_max_pct': 0.0982401183175149, 'tp_mult': 1.1706530693698285, 'tsl_mult': 0.637034719980396, 'strategy': 'mean_reversion', 'time_stop': 247, 'use_sma': False, 'use_atr': True, 'use_adx': False, 'use_ema': True, 'use_spike': False, 'rsi_required': True, 'edge_k': 1.9848147508615628, 'edge_cap': 0.8137097209786809, 'bull_strategy': 'breakout', 'bull_bb_std_mult': 2.6125587460601953, 'bull_rsi_os': 24, 'bull_rsi_ob': 74, 'bull_adx_thresh': 14.678077120398264, 'bull_atr_min_pct': 0.00179184225405058, 'bull_atr_max_pct': 0.03766865846408113, 'bull_tp_mult': 1.4175734077205324, 'bull_tsl_mult': 0.5653516507862865, 'bull_time_stop': 114, 'bull_use_sma': False, 'bull_use_ema': True, 'bull_use_atr': True, 'bull_use_adx': False, 'bull_use_spike': True, 'bull_rsi_required': True, 'bear_strategy': 'breakout', 'bear_bb_std_mult': 3.18928418815682, 'bear_rsi_os': 26, 'bear_rsi_ob': 89, 'bear_adx_thresh': 29.178588504568836, 'bear_atr_min_pct': 0.01905857185712315, 'bear_atr_max_pct': 0.12630391960597326, 'bear_tp_mult': 2.029986256589698, 'bear_tsl_mult': 0.14977129104599474, 'bear_time_stop': 142, 'bear_use_sma': False, 'bear_use_ema': False, 'bear_use_atr': False, 'bear_use_adx': False, 'bear_use_spike': True, 'bear_rsi_required': True, 'sideways_strategy': 'breakout', 'sideways_bb_std_mult': 2.700284003155137, 'sideways_rsi_os': 24, 'sideways_rsi_ob': 69, 'sideways_adx_thresh': 21.065572297136644, 'sideways_atr_min_pct': 0.019923412616571497, 'sideways_atr_max_pct': 0.0431970317118373, 'sideways_tp_mult': 2.9267505216466296, 'sideways_tsl_mult': 0.09531559795425548, 'sideways_time_stop': 147, 'sideways_use_sma': True, 'sideways_use_ema': False, 'sideways_use_atr': True, 'sideways_use_adx': True, 'sideways_use_spike': True, 'sideways_rsi_required': True}.
[I 2025-09-01 09:07:10,251] Trial 61 finished with values: [-1000000000.0, 1000000000.0] and parameters: {'p_sma': 6, 'p_std': 35, 'p_atr': 21, 'p_adx': 8, 'rsi_period': 39, 'ema1': 17, 'ema2': 39, 'slip_atr_k': 0.222225286403328, 'slip_spread_k': 0.9157604293965851, 'spread_hl_frac': 0.03566757503322844, 'bb_std_mult': 2.9541303941416013, 'rsi_os': 53, 'rsi_ob': 59, 'vol_spike': 0.07273261023018424, 'adx_thresh': 31.913860740148564, 'atr_min_pct': 0.02753214486711853, 'atr_max_pct': 0.11388877733672087, 'tp_mult': 2.885170115355749, 'tsl_mult': 0.33928893521930414, 'strategy': 'breakout', 'time_stop': 124, 'use_sma': False, 'use_atr': True, 'use_adx': False, 'use_ema': True, 'use_spike': False, 'rsi_required': True, 'edge_k': 1.8744582095820357, 'edge_cap': 0.5269446362910956, 'bull_strategy': 'breakout', 'bull_bb_std_mult': 3.426782755029295, 'bull_rsi_os': 32, 'bull_rsi_ob': 70, 'bull_adx_thresh': 17.474107677203257, 'bull_atr_min_pct': 0.011812532856673117, 'bull_atr_max_pct': 0.06038206166878058, 'bull_tp_mult': 2.888783779448161, 'bull_tsl_mult': 0.43737052841023966, 'bull_time_stop': 92, 'bull_use_sma': False, 'bull_use_ema': True, 'bull_use_atr': True, 'bull_use_adx': False, 'bull_use_spike': True, 'bull_rsi_required': False, 'bear_strategy': 'mean_reversion', 'bear_bb_std_mult': 1.0123783575419811, 'bear_rsi_os': 30, 'bear_rsi_ob': 85, 'bear_adx_thresh': 9.561296177979326, 'bear_atr_min_pct': 0.029724656546080794, 'bear_atr_max_pct': 0.10887551169506804, 'bear_tp_mult': 1.2119291878861917, 'bear_tsl_mult': 0.16731569481054895, 'bear_time_stop': 220, 'bear_use_sma': True, 'bear_use_ema': False, 'bear_use_atr': False, 'bear_use_adx': False, 'bear_use_spike': False, 'bear_rsi_required': True, 'sideways_strategy': 'mean_reversion', 'sideways_bb_std_mult': 2.684949000615214, 'sideways_rsi_os': 32, 'sideways_rsi_ob': 72, 'sideways_adx_thresh': 28.707245294152457, 'sideways_atr_min_pct': 0.02804773215940512, 'sideways_atr_max_pct': 0.10151335593674549, 'sideways_tp_mult': 2.9248259100748055, 'sideways_tsl_mult': 0.9237329654816728, 'sideways_time_stop': 37, 'sideways_use_sma': True, 'sideways_use_ema': True, 'sideways_use_atr': True, 'sideways_use_adx': True, 'sideways_use_spike': True, 'sideways_rsi_required': True}.
[I 2025-09-01 09:07:10,264] Trial 60 finished with values: [-1000000000.0, 1000000000.0] and parameters: {'p_sma': 55, 'p_std': 34, 'p_atr': 13, 'p_adx': 17, 'rsi_period': 38, 'ema1': 17, 'ema2': 36, 'slip_atr_k': 0.2256233278564376, 'slip_spread_k': 0.801050451231395, 'spread_hl_frac': 0.0266795061090684, 'bb_std_mult': 2.934144259156343, 'rsi_os': 9, 'rsi_ob': 59, 'vol_spike': 0.19243142892470022, 'adx_thresh': 8.154587274549556, 'atr_min_pct': 0.007006058806421811, 'atr_max_pct': 0.05459907173843529, 'tp_mult': 1.288087728998108, 'tsl_mult': 0.9909364982684814, 'strategy': 'breakout', 'time_stop': 47, 'use_sma': False, 'use_atr': True, 'use_adx': False, 'use_ema': False, 'use_spike': False, 'rsi_required': True, 'edge_k': 0.6514222909958556, 'edge_cap': 0.5301528731267368, 'bull_strategy': 'breakout', 'bull_bb_std_mult': 1.6891862804820221, 'bull_rsi_os': 54, 'bull_rsi_ob': 57, 'bull_adx_thresh': 14.718359228665133, 'bull_atr_min_pct': 0.01799303525484372, 'bull_atr_max_pct': 0.05351019734304742, 'bull_tp_mult': 2.274530928177315, 'bull_tsl_mult': 0.8323540396567926, 'bull_time_stop': 220, 'bull_use_sma': True, 'bull_use_ema': True, 'bull_use_atr': True, 'bull_use_adx': False, 'bull_use_spike': True, 'bull_rsi_required': False, 'bear_strategy': 'breakout', 'bear_bb_std_mult': 3.4613468993771335, 'bear_rsi_os': 26, 'bear_rsi_ob': 51, 'bear_adx_thresh': 25.116961520899725, 'bear_atr_min_pct': 0.02209411835350744, 'bear_atr_max_pct': 0.13167497408389398, 'bear_tp_mult': 1.9901067409358615, 'bear_tsl_mult': 0.13572559763965364, 'bear_time_stop': 222, 'bear_use_sma': True, 'bear_use_ema': False, 'bear_use_atr': False, 'bear_use_adx': False, 'bear_use_spike': True, 'bear_rsi_required': False, 'sideways_strategy': 'mean_reversion', 'sideways_bb_std_mult': 2.689665287946399, 'sideways_rsi_os': 22, 'sideways_rsi_ob': 73, 'sideways_adx_thresh': 6.775278229163387, 'sideways_atr_min_pct': 0.02462079432798454, 'sideways_atr_max_pct': 0.11719276080660951, 'sideways_tp_mult': 2.9941975582170364, 'sideways_tsl_mult': 0.3664311026491337, 'sideways_time_stop': 201, 'sideways_use_sma': False, 'sideways_use_ema': True, 'sideways_use_atr': True, 'sideways_use_adx': True, 'sideways_use_spike': False, 'sideways_rsi_required': False}.
[I 2025-09-01 09:07:52,092] Trial 63 finished with values: [-1000000000.0, 1000000000.0] and parameters: {'p_sma': 5, 'p_std': 56, 'p_atr': 13, 'p_adx': 8, 'rsi_period': 7, 'ema1': 29, 'ema2': 38, 'slip_atr_k': 0.03474647290317964, 'slip_spread_k': 0.9230127132659169, 'spread_hl_frac': 0.023542661971203742, 'bb_std_mult': 0.9099054618440898, 'rsi_os': 8, 'rsi_ob': 68, 'vol_spike': 0.1923118561912926, 'adx_thresh': 31.620817997305096, 'atr_min_pct': 0.02872331417075754, 'atr_max_pct': 0.14860082154197746, 'tp_mult': 1.1213894914995335, 'tsl_mult': 0.3540028753272363, 'strategy': 'breakout', 'time_stop': 20, 'use_sma': False, 'use_atr': True, 'use_adx': False, 'use_ema': True, 'use_spike': False, 'rsi_required': True, 'edge_k': 1.869930636713132, 'edge_cap': 0.9370799591454744, 'bull_strategy': 'breakout', 'bull_bb_std_mult': 1.5270900687375946, 'bull_rsi_os': 54, 'bull_rsi_ob': 49, 'bull_adx_thresh': 14.671003032599769, 'bull_atr_min_pct': 0.007124884954176038, 'bull_atr_max_pct': 0.022213131496412065, 'bull_tp_mult': 2.878393782578353, 'bull_tsl_mult': 0.7989925305359915, 'bull_time_stop': 230, 'bull_use_sma': True, 'bull_use_ema': True, 'bull_use_atr': True, 'bull_use_adx': False, 'bull_use_spike': True, 'bull_rsi_required': False, 'bear_strategy': 'breakout', 'bear_bb_std_mult': 2.6537734330933302, 'bear_rsi_os': 21, 'bear_rsi_ob': 57, 'bear_adx_thresh': 8.964099677047452, 'bear_atr_min_pct': 0.01883718304237668, 'bear_atr_max_pct': 0.13626012619905936, 'bear_tp_mult': 2.371916889749242, 'bear_tsl_mult': 0.14867967421421682, 'bear_time_stop': 181, 'bear_use_sma': True, 'bear_use_ema': False, 'bear_use_atr': False, 'bear_use_adx': False, 'bear_use_spike': True, 'bear_rsi_required': True, 'sideways_strategy': 'mean_reversion', 'sideways_bb_std_mult': 2.631366902122515, 'sideways_rsi_os': 32, 'sideways_rsi_ob': 65, 'sideways_adx_thresh': 9.335347226840916, 'sideways_atr_min_pct': 0.0060033399979928185, 'sideways_atr_max_pct': 0.04093437462158728, 'sideways_tp_mult': 2.00062207148375, 'sideways_tsl_mult': 0.3763214829727295, 'sideways_time_stop': 288, 'sideways_use_sma': True, 'sideways_use_ema': False, 'sideways_use_atr': True, 'sideways_use_adx': True, 'sideways_use_spike': False, 'sideways_rsi_required': False}.
