[I 2025-09-01 10:06:21,231] Trial 414 finished with values: [-0.14545885679260606, 0.14526952653235164] and parameters: {'p_sma': 20, 'p_std': 16, 'p_atr': 27, 'p_adx': 21, 'rsi_period': 61, 'ema1': 17, 'ema2': 47, 'slip_atr_k': 0.02646028738329649, 'slip_spread_k': 0.9401119201735699, 'spread_hl_frac': 0.03935689596530656, 'bb_std_mult': 3.121833957167178, 'rsi_os': 20, 'rsi_ob': 81, 'vol_spike': 0.10435590785516308, 'adx_thresh': 10.339400683307083, 'atr_min_pct': 0.023070958674181886, 'atr_max_pct': 0.07136489854836817, 'tp_mult': 1.5534619296703451, 'tsl_mult': 0.13332631010871693, 'strategy': 'breakout', 'time_stop': 293, 'use_sma': True, 'use_atr': False, 'use_adx': True, 'use_ema': False, 'use_spike': True, 'rsi_required': False, 'edge_k': 0.12750820151597775, 'edge_cap': 0.5683796067836919, 'bull_strategy': 'mean_reversion', 'bull_bb_std_mult': 2.7379132285168026, 'bull_rsi_os': 24, 'bull_rsi_ob': 54, 'bull_adx_thresh': 12.084752754627171, 'bull_atr_min_pct': 0.01815418966184787, 'bull_atr_max_pct': 0.0811840944841309, 'bull_tp_mult': 2.788955876989995, 'bull_tsl_mult': 0.07234617241161664, 'bull_time_stop': 201, 'bull_use_sma': True, 'bull_use_ema': False, 'bull_use_atr': True, 'bull_use_adx': True, 'bull_use_spike': False, 'bull_rsi_required': True, 'bear_strategy': 'mean_reversion', 'bear_bb_std_mult': 2.339673990684664, 'bear_rsi_os': 36, 'bear_rsi_ob': 93, 'bear_adx_thresh': 26.718490774617294, 'bear_atr_min_pct': 0.01761275807160553, 'bear_atr_max_pct': 0.06695607761117897, 'bear_tp_mult': 1.436235131262496, 'bear_tsl_mult': 0.7419319016414061, 'bear_time_stop': 12, 'bear_use_sma': False, 'bear_use_ema': True, 'bear_use_atr': True, 'bear_use_adx': False, 'bear_use_spike': True, 'bear_rsi_required': True, 'sideways_strategy': 'mean_reversion', 'sideways_bb_std_mult': 3.3738654576597664, 'sideways_rsi_os': 49, 'sideways_rsi_ob': 49, 'sideways_adx_thresh': 28.241973992654046, 'sideways_atr_min_pct': 0.0009349159989299914, 'sideways_atr_max_pct': 0.12290449008413601, 'sideways_tp_mult': 2.900345883622153, 'sideways_tsl_mult': 0.8387233953396916, 'sideways_time_stop': 259, 'sideways_use_sma': False, 'sideways_use_ema': True, 'sideways_use_atr': True, 'sideways_use_adx': False, 'sideways_use_spike': False, 'sideways_rsi_required': False}.
[I 2025-09-01 10:07:11,746] Trial 415 finished with values: [-1000000000.0, 1000000000.0] and parameters: {'p_sma': 21, 'p_std': 43, 'p_atr': 22, 'p_adx': 20, 'rsi_period': 60, 'ema1': 17, 'ema2': 32, 'slip_atr_k': 0.062351315332220825, 'slip_spread_k': 0.1975431447578389, 'spread_hl_frac': 0.019320223771959688, 'bb_std_mult': 2.4253048547272282, 'rsi_os': 20, 'rsi_ob': 79, 'vol_spike': 0.2808542742546708, 'adx_thresh': 14.501674295515588, 'atr_min_pct': 0.02363020440468262, 'atr_max_pct': 0.0707188098874981, 'tp_mult': 2.4121270680340623, 'tsl_mult': 0.14165668319109814, 'strategy': 'breakout', 'time_stop': 141, 'use_sma': True, 'use_atr': False, 'use_adx': True, 'use_ema': False, 'use_spike': True, 'rsi_required': True, 'edge_k': 0.03789116366425471, 'edge_cap': 0.1863852095260327, 'bull_strategy': 'mean_reversion', 'bull_bb_std_mult': 0.9060858769925525, 'bull_rsi_os': 22, 'bull_rsi_ob': 55, 'bull_adx_thresh': 6.651481387466768, 'bull_atr_min_pct': 0.02099533901189693, 'bull_atr_max_pct': 0.09701555488630416, 'bull_tp_mult': 2.804039247624069, 'bull_tsl_mult': 0.9025275618861981, 'bull_time_stop': 26, 'bull_use_sma': True, 'bull_use_ema': False, 'bull_use_atr': True, 'bull_use_adx': True, 'bull_use_spike': False, 'bull_rsi_required': True, 'bear_strategy': 'mean_reversion', 'bear_bb_std_mult': 2.182430129382405, 'bear_rsi_os': 49, 'bear_rsi_ob': 91, 'bear_adx_thresh': 11.73620121417259, 'bear_atr_min_pct': 0.022841320511691705, 'bear_atr_max_pct': 0.08822350682193666, 'bear_tp_mult': 1.241610215652177, 'bear_tsl_mult': 0.816998433918341, 'bear_time_stop': 151, 'bear_use_sma': True, 'bear_use_ema': True, 'bear_use_atr': True, 'bear_use_adx': False, 'bear_use_spike': True, 'bear_rsi_required': True, 'sideways_strategy': 'mean_reversion', 'sideways_bb_std_mult': 2.6436630787613353, 'sideways_rsi_os': 47, 'sideways_rsi_ob': 92, 'sideways_adx_thresh': 28.316122687752284, 'sideways_atr_min_pct': 0.004482701362320629, 'sideways_atr_max_pct': 0.12204524558233447, 'sideways_tp_mult': 1.397616809220656, 'sideways_tsl_mult': 0.8450789094992494, 'sideways_time_stop': 194, 'sideways_use_sma': False, 'sideways_use_ema': True, 'sideways_use_atr': True, 'sideways_use_adx': False, 'sideways_use_spike': True, 'sideways_rsi_required': True}.
[I 2025-09-01 10:07:11,754] Trial 416 finished with values: [-1000000000.0, 1000000000.0] and parameters: {'p_sma': 21, 'p_std': 7, 'p_atr': 27, 'p_adx': 24, 'rsi_period': 69, 'ema1': 24, 'ema2': 59, 'slip_atr_k': 0.028034221458021567, 'slip_spread_k': 0.16932124426525236, 'spread_hl_frac': 0.018167553483724008, 'bb_std_mult': 2.4591984085455865, 'rsi_os': 24, 'rsi_ob': 81, 'vol_spike': 0.27990328204759257, 'adx_thresh': 10.135908402360366, 'atr_min_pct': 0.024347013292314944, 'atr_max_pct': 0.0829043076391705, 'tp_mult': 2.3918588813683748, 'tsl_mult': 0.05902434499956985, 'strategy': 'mean_reversion', 'time_stop': 142, 'use_sma': True, 'use_atr': True, 'use_adx': False, 'use_ema': False, 'use_spike': True, 'rsi_required': True, 'edge_k': 0.02827135694398797, 'edge_cap': 0.6130089241291568, 'bull_strategy': 'mean_reversion', 'bull_bb_std_mult': 0.9214565145656597, 'bull_rsi_os': 22, 'bull_rsi_ob': 55, 'bull_adx_thresh': 6.688623223623612, 'bull_atr_min_pct': 0.020957813676248032, 'bull_atr_max_pct': 0.08898437371505219, 'bull_tp_mult': 2.807231269719085, 'bull_tsl_mult': 0.015161787202929655, 'bull_time_stop': 29, 'bull_use_sma': True, 'bull_use_ema': False, 'bull_use_atr': True, 'bull_use_adx': True, 'bull_use_spike': False, 'bull_rsi_required': True, 'bear_strategy': 'mean_reversion', 'bear_bb_std_mult': 3.3987474801775637, 'bear_rsi_os': 36, 'bear_rsi_ob': 45, 'bear_adx_thresh': 11.880158224441086, 'bear_atr_min_pct': 0.01742533097582676, 'bear_atr_max_pct': 0.04306606556871046, 'bear_tp_mult': 1.2387978248663631, 'bear_tsl_mult': 0.4152270786729761, 'bear_time_stop': 136, 'bear_use_sma': True, 'bear_use_ema': True, 'bear_use_atr': False, 'bear_use_adx': False, 'bear_use_spike': True, 'bear_rsi_required': True, 'sideways_strategy': 'mean_reversion', 'sideways_bb_std_mult': 1.5553065218829414, 'sideways_rsi_os': 47, 'sideways_rsi_ob': 49, 'sideways_adx_thresh': 27.6311579794378, 'sideways_atr_min_pct': 0.02874898933475434, 'sideways_atr_max_pct': 0.07279790405275646, 'sideways_tp_mult': 2.901199353725117, 'sideways_tsl_mult': 0.8423353078409517, 'sideways_time_stop': 256, 'sideways_use_sma': False, 'sideways_use_ema': True, 'sideways_use_atr': True, 'sideways_use_adx': True, 'sideways_use_spike': True, 'sideways_rsi_required': True}.
[I 2025-09-01 10:07:14,413] Trial 417 finished with values: [-1000000000.0, 1000000000.0] and parameters: {'p_sma': 21, 'p_std': 55, 'p_atr': 27, 'p_adx': 24, 'rsi_period': 37, 'ema1': 21, 'ema2': 53, 'slip_atr_k': 0.0436998734158552, 'slip_spread_k': 0.17738638366514828, 'spread_hl_frac': 0.028822908623650122, 'bb_std_mult': 3.1749428882564867, 'rsi_os': 44, 'rsi_ob': 81, 'vol_spike': 0.12967693508575578, 'adx_thresh': 14.454673801666619, 'atr_min_pct': 0.024649550908118878, 'atr_max_pct': 0.07045602560628947, 'tp_mult': 1.5433926949818035, 'tsl_mult': 0.04268600697546937, 'strategy': 'mean_reversion', 'time_stop': 261, 'use_sma': True, 'use_atr': True, 'use_adx': False, 'use_ema': False, 'use_spike': True, 'rsi_required': True, 'edge_k': 1.0118355945794466, 'edge_cap': 0.5655304128422481, 'bull_strategy': 'mean_reversion', 'bull_bb_std_mult': 0.9419376483964284, 'bull_rsi_os': 17, 'bull_rsi_ob': 56, 'bull_adx_thresh': 17.48881149887523, 'bull_atr_min_pct': 0.01778760219520671, 'bull_atr_max_pct': 0.08548753057695747, 'bull_tp_mult': 1.6949083580992637, 'bull_tsl_mult': 0.01339286732224021, 'bull_time_stop': 147, 'bull_use_sma': True, 'bull_use_ema': False, 'bull_use_atr': True, 'bull_use_adx': True, 'bull_use_spike': False, 'bull_rsi_required': True, 'bear_strategy': 'mean_reversion', 'bear_bb_std_mult': 3.4725539007748867, 'bear_rsi_os': 36, 'bear_rsi_ob': 48, 'bear_adx_thresh': 13.816877383102081, 'bear_atr_min_pct': 0.021284879414498848, 'bear_atr_max_pct': 0.09431377947423106, 'bear_tp_mult': 1.2375791278433361, 'bear_tsl_mult': 0.2974410633600618, 'bear_time_stop': 152, 'bear_use_sma': True, 'bear_use_ema': True, 'bear_use_atr': False, 'bear_use_adx': False, 'bear_use_spike': True, 'bear_rsi_required': True, 'sideways_strategy': 'mean_reversion', 'sideways_bb_std_mult': 3.378914892964503, 'sideways_rsi_os': 48, 'sideways_rsi_ob': 78, 'sideways_adx_thresh': 6.417188034428216, 'sideways_atr_min_pct': 0.004163063461247969, 'sideways_atr_max_pct': 0.07243999766937596, 'sideways_tp_mult': 1.2684361613845458, 'sideways_tsl_mult': 0.8379893987953628, 'sideways_time_stop': 192, 'sideways_use_sma': False, 'sideways_use_ema': True, 'sideways_use_atr': True, 'sideways_use_adx': True, 'sideways_use_spike': True, 'sideways_rsi_required': True}.
[I 2025-09-01 10:07:16,241] Trial 418 finished with values: [-0.016479427459755835, 0.016091439979522545] and parameters: {'p_sma': 45, 'p_std': 45, 'p_atr': 21, 'p_adx': 20, 'rsi_period': 69, 'ema1': 21, 'ema2': 23, 'slip_atr_k': 0.042605259332518346, 'slip_spread_k': 0.16811839155564226, 'spread_hl_frac': 0.026104432456183484, 'bb_std_mult': 3.2040329583128377, 'rsi_os': 18, 'rsi_ob': 78, 'vol_spike': 0.28916063575921114, 'adx_thresh': 31.708165688740337, 'atr_min_pct': 0.024243904522407125, 'atr_max_pct': 0.07924601141748916, 'tp_mult': 1.1976328180787235, 'tsl_mult': 0.036471506692786704, 'strategy': 'mean_reversion', 'time_stop': 139, 'use_sma': False, 'use_atr': True, 'use_adx': False, 'use_ema': True, 'use_spike': True, 'rsi_required': True, 'edge_k': 1.0872055298407337, 'edge_cap': 0.6034300447987162, 'bull_strategy': 'breakout', 'bull_bb_std_mult': 0.9389461765383625, 'bull_rsi_os': 17, 'bull_rsi_ob': 80, 'bull_adx_thresh': 32.94580189269627, 'bull_atr_min_pct': 0.014647806659387004, 'bull_atr_max_pct': 0.08979641915414138, 'bull_tp_mult': 1.7943517868550478, 'bull_tsl_mult': 0.015903887998497117, 'bull_time_stop': 231, 'bull_use_sma': True, 'bull_use_ema': True, 'bull_use_atr': True, 'bull_use_adx': True, 'bull_use_spike': True, 'bull_rsi_required': False, 'bear_strategy': 'breakout', 'bear_bb_std_mult': 3.373145758640072, 'bear_rsi_os': 47, 'bear_rsi_ob': 48, 'bear_adx_thresh': 13.836267110014585, 'bear_atr_min_pct': 0.021096741201372737, 'bear_atr_max_pct': 0.04209438017978642, 'bear_tp_mult': 1.2412891666447277, 'bear_tsl_mult': 0.5110617002282076, 'bear_time_stop': 138, 'bear_use_sma': True, 'bear_use_ema': True, 'bear_use_atr': False, 'bear_use_adx': False, 'bear_use_spike': True, 'bear_rsi_required': False, 'sideways_strategy': 'breakout', 'sideways_bb_std_mult': 3.2128442526583765, 'sideways_rsi_os': 47, 'sideways_rsi_ob': 76, 'sideways_adx_thresh': 14.351711190902298, 'sideways_atr_min_pct': 0.004328260877545468, 'sideways_atr_max_pct': 0.07137889663648889, 'sideways_tp_mult': 1.2694338580769762, 'sideways_tsl_mult': 0.8169911335565456, 'sideways_time_stop': 193, 'sideways_use_sma': True, 'sideways_use_ema': True, 'sideways_use_atr': False, 'sideways_use_adx': True, 'sideways_use_spike': True, 'sideways_rsi_required': True}.
[I 2025-09-01 10:07:59,577] Trial 420 finished with values: [-0.3177668878274652, 0.3181678588521928] and parameters: {'p_sma': 34, 'p_std': 50, 'p_atr': 12, 'p_adx': 22, 'rsi_period': 13, 'ema1': 21, 'ema2': 28, 'slip_atr_k': 0.04473392158531251, 'slip_spread_k': 0.22647828202980808, 'spread_hl_frac': 0.025856794355661204, 'bb_std_mult': 3.2077406643416415, 'rsi_os': 44, 'rsi_ob': 78, 'vol_spike': 0.2893488075108286, 'adx_thresh': 31.77423642443061, 'atr_min_pct': 0.024870825669088714, 'atr_max_pct': 0.07955216659195356, 'tp_mult': 1.0451297812730052, 'tsl_mult': 0.013614264231357124, 'strategy': 'mean_reversion', 'time_stop': 261, 'use_sma': False, 'use_atr': True, 'use_adx': False, 'use_ema': True, 'use_spike': False, 'rsi_required': False, 'edge_k': 1.0811822575708006, 'edge_cap': 0.5629170519146875, 'bull_strategy': 'breakout', 'bull_bb_std_mult': 0.8576829739576386, 'bull_rsi_os': 17, 'bull_rsi_ob': 78, 'bull_adx_thresh': 6.0475961722989995, 'bull_atr_min_pct': 0.014816350540636788, 'bull_atr_max_pct': 0.1412991867475189, 'bull_tp_mult': 1.6952574700368095, 'bull_tsl_mult': 0.4652310958594725, 'bull_time_stop': 164, 'bull_use_sma': True, 'bull_use_ema': True, 'bull_use_atr': True, 'bull_use_adx': True, 'bull_use_spike': True, 'bull_rsi_required': False, 'bear_strategy': 'breakout', 'bear_bb_std_mult': 3.4518464151474166, 'bear_rsi_os': 47, 'bear_rsi_ob': 59, 'bear_adx_thresh': 19.54076865627411, 'bear_atr_min_pct': 0.0011470750790810308, 'bear_atr_max_pct': 0.14808355762549286, 'bear_tp_mult': 1.2714524094913333, 'bear_tsl_mult': 0.2862602860117207, 'bear_time_stop': 139, 'bear_use_sma': False, 'bear_use_ema': False, 'bear_use_atr': False, 'bear_use_adx': True, 'bear_use_spike': True, 'bear_rsi_required': False, 'sideways_strategy': 'breakout', 'sideways_bb_std_mult': 3.1947662553491005, 'sideways_rsi_os': 48, 'sideways_rsi_ob': 83, 'sideways_adx_thresh': 27.02766561273199, 'sideways_atr_min_pct': 0.002878110030945125, 'sideways_atr_max_pct': 0.06235862581416909, 'sideways_tp_mult': 1.2692775516359136, 'sideways_tsl_mult': 0.5573419949111555, 'sideways_time_stop': 210, 'sideways_use_sma': True, 'sideways_use_ema': False, 'sideways_use_atr': False, 'sideways_use_adx': True, 'sideways_use_spike': False, 'sideways_rsi_required': False}.
[I 2025-09-01 10:08:00,910] Trial 422 finished with values: [-1000000000.0, 1000000000.0] and parameters: {'p_sma': 23, 'p_std': 45, 'p_atr': 12, 'p_adx': 11, 'rsi_period': 65, 'ema1': 14, 'ema2': 43, 'slip_atr_k': 0.05217422793208266, 'slip_spread_k': 0.22975294981884914, 'spread_hl_frac': 0.026084902916419416, 'bb_std_mult': 3.2310687941151333, 'rsi_os': 25, 'rsi_ob': 77, 'vol_spike': 0.28863410427705477, 'adx_thresh': 5.905364362153476, 'atr_min_pct': 0.007181538896606736, 'atr_max_pct': 0.11265886666976205, 'tp_mult': 2.744972444045849, 'tsl_mult': 0.2831954914109729, 'strategy': 'breakout', 'time_stop': 164, 'use_sma': False, 'use_atr': False, 'use_adx': True, 'use_ema': True, 'use_spike': False, 'rsi_required': False, 'edge_k': 0.8848465955498682, 'edge_cap': 0.5931367397281287, 'bull_strategy': 'breakout', 'bull_bb_std_mult': 2.273636639021123, 'bull_rsi_os': 18, 'bull_rsi_ob': 80, 'bull_adx_thresh': 28.050316337039106, 'bull_atr_min_pct': 0.008864170282443346, 'bull_atr_max_pct': 0.014516847127766061, 'bull_tp_mult': 1.7883615119498941, 'bull_tsl_mult': 0.4677080845485401, 'bull_time_stop': 277, 'bull_use_sma': False, 'bull_use_ema': True, 'bull_use_atr': True, 'bull_use_adx': True, 'bull_use_spike': True, 'bull_rsi_required': False, 'bear_strategy': 'breakout', 'bear_bb_std_mult': 3.1806442740121046, 'bear_rsi_os': 47, 'bear_rsi_ob': 87, 'bear_adx_thresh': 10.793694132106866, 'bear_atr_min_pct': 0.016267517217173854, 'bear_atr_max_pct': 0.06425389753478136, 'bear_tp_mult': 1.2944248762589936, 'bear_tsl_mult': 0.9092376710290506, 'bear_time_stop': 139, 'bear_use_sma': False, 'bear_use_ema': False, 'bear_use_atr': True, 'bear_use_adx': True, 'bear_use_spike': True, 'bear_rsi_required': False, 'sideways_strategy': 'breakout', 'sideways_bb_std_mult': 2.3681602022989843, 'sideways_rsi_os': 45, 'sideways_rsi_ob': 48, 'sideways_adx_thresh': 11.62220838231406, 'sideways_atr_min_pct': 0.01637329927495803, 'sideways_atr_max_pct': 0.06322891747816994, 'sideways_tp_mult': 2.1832290549766085, 'sideways_tsl_mult': 0.8084304933747526, 'sideways_time_stop': 210, 'sideways_use_sma': True, 'sideways_use_ema': False, 'sideways_use_atr': False, 'sideways_use_adx': False, 'sideways_use_spike': False, 'sideways_rsi_required': False}.
[I 2025-09-01 10:08:01,751] Trial 419 finished with values: [-1000000000.0, 0.3858707218330417] and parameters: {'p_sma': 51, 'p_std': 45, 'p_atr': 18, 'p_adx': 22, 'rsi_period': 57, 'ema1': 21, 'ema2': 23, 'slip_atr_k': 0.04633358168497421, 'slip_spread_k': 0.9151707947435872, 'spread_hl_frac': 0.026133445723679233, 'bb_std_mult': 3.195167291866872, 'rsi_os': 6, 'rsi_ob': 78, 'vol_spike': 0.29046429196528734, 'adx_thresh': 31.68353626343252, 'atr_min_pct': 0.017089698038093536, 'atr_max_pct': 0.08009544688801243, 'tp_mult': 2.6552992890912606, 'tsl_mult': 0.03008351389269906, 'strategy': 'mean_reversion', 'time_stop': 164, 'use_sma': False, 'use_atr': True, 'use_adx': False, 'use_ema': True, 'use_spike': False, 'rsi_required': False, 'edge_k': 1.0728279801565848, 'edge_cap': 0.5078047472871584, 'bull_strategy': 'breakout', 'bull_bb_std_mult': 0.8434606115269933, 'bull_rsi_os': 37, 'bull_rsi_ob': 53, 'bull_adx_thresh': 5.545729560271409, 'bull_atr_min_pct': 0.02888327690945396, 'bull_atr_max_pct': 0.12170121294469612, 'bull_tp_mult': 1.7151589868376529, 'bull_tsl_mult': 0.055396755458574115, 'bull_time_stop': 238, 'bull_use_sma': True, 'bull_use_ema': True, 'bull_use_atr': True, 'bull_use_adx': True, 'bull_use_spike': True, 'bull_rsi_required': False, 'bear_strategy': 'breakout', 'bear_bb_std_mult': 3.4849656850025275, 'bear_rsi_os': 47, 'bear_rsi_ob': 47, 'bear_adx_thresh': 14.109532436227145, 'bear_atr_min_pct': 0.0011562902608394654, 'bear_atr_max_pct': 0.1325811999659553, 'bear_tp_mult': 1.3084187324461127, 'bear_tsl_mult': 0.2978313182894361, 'bear_time_stop': 141, 'bear_use_sma': False, 'bear_use_ema': False, 'bear_use_atr': False, 'bear_use_adx': True, 'bear_use_spike': True, 'bear_rsi_required': False, 'sideways_strategy': 'breakout', 'sideways_bb_std_mult': 3.2131327621156434, 'sideways_rsi_os': 48, 'sideways_rsi_ob': 76, 'sideways_adx_thresh': 6.397680691120037, 'sideways_atr_min_pct': 0.0038342137610266917, 'sideways_atr_max_pct': 0.062223372078645645, 'sideways_tp_mult': 1.1356119489451504, 'sideways_tsl_mult': 0.8164071257643425, 'sideways_time_stop': 209, 'sideways_use_sma': True, 'sideways_use_ema': False, 'sideways_use_atr': False, 'sideways_use_adx': True, 'sideways_use_spike': False, 'sideways_rsi_required': False}.
[I 2025-09-01 10:08:02,305] Trial 421 finished with values: [-0.2896923167112123, 0.2897155005670301] and parameters: {'p_sma': 23, 'p_std': 47, 'p_atr': 20, 'p_adx': 22, 'rsi_period': 12, 'ema1': 14, 'ema2': 58, 'slip_atr_k': 0.05054203419578047, 'slip_spread_k': 0.2187728047790864, 'spread_hl_frac': 0.02645532754497345, 'bb_std_mult': 1.1313324636520083, 'rsi_os': 26, 'rsi_ob': 78, 'vol_spike': 0.28952746522075207, 'adx_thresh': 5.875177576989979, 'atr_min_pct': 0.016040290466560005, 'atr_max_pct': 0.11260007501336886, 'tp_mult': 2.6516991977939877, 'tsl_mult': 0.7782747538265479, 'strategy': 'breakout', 'time_stop': 38, 'use_sma': False, 'use_atr': False, 'use_adx': True, 'use_ema': True, 'use_spike': False, 'rsi_required': False, 'edge_k': 1.8877615064743272, 'edge_cap': 0.5973104778682593, 'bull_strategy': 'breakout', 'bull_bb_std_mult': 0.8459540360890156, 'bull_rsi_os': 37, 'bull_rsi_ob': 53, 'bull_adx_thresh': 5.987209886273784, 'bull_atr_min_pct': 0.029428093303051978, 'bull_atr_max_pct': 0.12124340741233786, 'bull_tp_mult': 1.7879071333578356, 'bull_tsl_mult': 0.051431252381222994, 'bull_time_stop': 193, 'bull_use_sma': False, 'bull_use_ema': True, 'bull_use_atr': True, 'bull_use_adx': True, 'bull_use_spike': True, 'bull_rsi_required': False, 'bear_strategy': 'breakout', 'bear_bb_std_mult': 3.484416734686985, 'bear_rsi_os': 47, 'bear_rsi_ob': 52, 'bear_adx_thresh': 14.897095651623664, 'bear_atr_min_pct': 0.0011827431376814947, 'bear_atr_max_pct': 0.06975682422186234, 'bear_tp_mult': 1.3158211535848128, 'bear_tsl_mult': 0.5191979709552482, 'bear_time_stop': 142, 'bear_use_sma': False, 'bear_use_ema': False, 'bear_use_atr': True, 'bear_use_adx': True, 'bear_use_spike': True, 'bear_rsi_required': False, 'sideways_strategy': 'breakout', 'sideways_bb_std_mult': 0.5685550031132987, 'sideways_rsi_os': 32, 'sideways_rsi_ob': 52, 'sideways_adx_thresh': 18.134068917083177, 'sideways_atr_min_pct': 0.0034725820008444106, 'sideways_atr_max_pct': 0.07853383650844399, 'sideways_tp_mult': 1.340322114689228, 'sideways_tsl_mult': 0.7114781206889444, 'sideways_time_stop': 210, 'sideways_use_sma': True, 'sideways_use_ema': False, 'sideways_use_atr': False, 'sideways_use_adx': False, 'sideways_use_spike': False, 'sideways_rsi_required': False}.
