[I 2025-09-01 09:54:09,730] Trial 342 finished with values: [-1000000000.0, 1000000000.0] and parameters: {'p_sma': 19, 'p_std': 50, 'p_atr': 24, 'p_adx': 24, 'rsi_period': 80, 'ema1': 22, 'ema2': 55, 'slip_atr_k': 0.06541389325485569, 'slip_spread_k': 0.42443409592484943, 'spread_hl_frac': 0.028281210053787663, 'bb_std_mult': 3.097521809466489, 'rsi_os': 30, 'rsi_ob': 80, 'vol_spike': 0.27579689653393724, 'adx_thresh': 5.868911896844192, 'atr_min_pct': 0.023738078137506252, 'atr_max_pct': 0.07249939678717084, 'tp_mult': 2.353785646083111, 'tsl_mult': 0.08776627639231914, 'strategy': 'mean_reversion', 'time_stop': 136, 'use_sma': True, 'use_atr': True, 'use_adx': False, 'use_ema': True, 'use_spike': True, 'rsi_required': True, 'edge_k': 0.8112147427501757, 'edge_cap': 0.5780840498342544, 'bull_strategy': 'breakout', 'bull_bb_std_mult': 0.9055359413848835, 'bull_rsi_os': 20, 'bull_rsi_ob': 51, 'bull_adx_thresh': 5.717660247305376, 'bull_atr_min_pct': 0.006540865173262958, 'bull_atr_max_pct': 0.08736727954196928, 'bull_tp_mult': 1.8878241222727115, 'bull_tsl_mult': 0.36333218525151273, 'bull_time_stop': 154, 'bull_use_sma': False, 'bull_use_ema': True, 'bull_use_atr': True, 'bull_use_adx': True, 'bull_use_spike': False, 'bull_rsi_required': False, 'bear_strategy': 'breakout', 'bear_bb_std_mult': 1.6524580360613914, 'bear_rsi_os': 47, 'bear_rsi_ob': 46, 'bear_adx_thresh': 7.569134064000213, 'bear_atr_min_pct': 0.017045060197509274, 'bear_atr_max_pct': 0.07381476334598885, 'bear_tp_mult': 1.010063000595935, 'bear_tsl_mult': 0.2654251461068252, 'bear_time_stop': 139, 'bear_use_sma': True, 'bear_use_ema': False, 'bear_use_atr': False, 'bear_use_adx': True, 'bear_use_spike': True, 'bear_rsi_required': True, 'sideways_strategy': 'mean_reversion', 'sideways_bb_std_mult': 3.308381945026779, 'sideways_rsi_os': 52, 'sideways_rsi_ob': 52, 'sideways_adx_thresh': 27.443959635187078, 'sideways_atr_min_pct': 0.01391091396285325, 'sideways_atr_max_pct': 0.10089556595797311, 'sideways_tp_mult': 1.4572653585360233, 'sideways_tsl_mult': 0.844641642517426, 'sideways_time_stop': 142, 'sideways_use_sma': True, 'sideways_use_ema': True, 'sideways_use_atr': True, 'sideways_use_adx': True, 'sideways_use_spike': True, 'sideways_rsi_required': True}.
[I 2025-09-01 09:54:53,557] Trial 345 finished with values: [-1000000000.0, 1000000000.0] and parameters: {'p_sma': 19, 'p_std': 37, 'p_atr': 21, 'p_adx': 22, 'rsi_period': 24, 'ema1': 24, 'ema2': 44, 'slip_atr_k': 0.0813221878067206, 'slip_spread_k': 0.6871344580895344, 'spread_hl_frac': 0.023838916350100586, 'bb_std_mult': 3.0777255382047866, 'rsi_os': 30, 'rsi_ob': 81, 'vol_spike': 0.27649848209855304, 'adx_thresh': 5.979080847126238, 'atr_min_pct': 0.023104279943053245, 'atr_max_pct': 0.07879134314379013, 'tp_mult': 2.7293155446145203, 'tsl_mult': 0.4905632307595212, 'strategy': 'breakout', 'time_stop': 134, 'use_sma': True, 'use_atr': False, 'use_adx': False, 'use_ema': False, 'use_spike': True, 'rsi_required': False, 'edge_k': 0.8738818260955297, 'edge_cap': 0.6020376124111322, 'bull_strategy': 'mean_reversion', 'bull_bb_std_mult': 1.2286822176795713, 'bull_rsi_os': 20, 'bull_rsi_ob': 93, 'bull_adx_thresh': 28.432472233695588, 'bull_atr_min_pct': 0.016112197154993464, 'bull_atr_max_pct': 0.0900793598302741, 'bull_tp_mult': 1.9536860390967221, 'bull_tsl_mult': 0.04822497890581177, 'bull_time_stop': 156, 'bull_use_sma': True, 'bull_use_ema': False, 'bull_use_atr': True, 'bull_use_adx': True, 'bull_use_spike': False, 'bull_rsi_required': True, 'bear_strategy': 'breakout', 'bear_bb_std_mult': 3.4097583260796265, 'bear_rsi_os': 47, 'bear_rsi_ob': 45, 'bear_adx_thresh': 7.915984234247114, 'bear_atr_min_pct': 0.017786444984884516, 'bear_atr_max_pct': 0.06749461998649141, 'bear_tp_mult': 1.2725222008676855, 'bear_tsl_mult': 0.45178729679149715, 'bear_time_stop': 142, 'bear_use_sma': False, 'bear_use_ema': True, 'bear_use_atr': False, 'bear_use_adx': True, 'bear_use_spike': True, 'bear_rsi_required': False, 'sideways_strategy': 'breakout', 'sideways_bb_std_mult': 3.2497635041752786, 'sideways_rsi_os': 21, 'sideways_rsi_ob': 49, 'sideways_adx_thresh': 27.78736609708297, 'sideways_atr_min_pct': 0.01570521080809341, 'sideways_atr_max_pct': 0.04602313384438697, 'sideways_tp_mult': 1.3837036660137727, 'sideways_tsl_mult': 0.8643620322673953, 'sideways_time_stop': 193, 'sideways_use_sma': False, 'sideways_use_ema': True, 'sideways_use_atr': False, 'sideways_use_adx': False, 'sideways_use_spike': False, 'sideways_rsi_required': False}.
[I 2025-09-01 09:54:55,255] Trial 343 finished with values: [-1000000000.0, 1000000000.0] and parameters: {'p_sma': 15, 'p_std': 51, 'p_atr': 25, 'p_adx': 22, 'rsi_period': 82, 'ema1': 22, 'ema2': 55, 'slip_atr_k': 0.14939309632206574, 'slip_spread_k': 0.6791334906995081, 'spread_hl_frac': 0.027977051252494136, 'bb_std_mult': 3.133110783065506, 'rsi_os': 30, 'rsi_ob': 77, 'vol_spike': 0.2745775512609608, 'adx_thresh': 5.728918038530706, 'atr_min_pct': 0.022804865616335355, 'atr_max_pct': 0.07221035600407157, 'tp_mult': 2.360030467014721, 'tsl_mult': 0.24227236652851303, 'strategy': 'breakout', 'time_stop': 156, 'use_sma': True, 'use_atr': True, 'use_adx': False, 'use_ema': False, 'use_spike': True, 'rsi_required': True, 'edge_k': 0.9618617790746314, 'edge_cap': 0.5796325708498462, 'bull_strategy': 'mean_reversion', 'bull_bb_std_mult': 1.467889103916856, 'bull_rsi_os': 20, 'bull_rsi_ob': 51, 'bull_adx_thresh': 33.58258696872182, 'bull_atr_min_pct': 0.023863009427398822, 'bull_atr_max_pct': 0.0906068525870502, 'bull_tp_mult': 1.8697021339814832, 'bull_tsl_mult': 0.04517589906385304, 'bull_time_stop': 215, 'bull_use_sma': False, 'bull_use_ema': False, 'bull_use_atr': True, 'bull_use_adx': True, 'bull_use_spike': False, 'bull_rsi_required': True, 'bear_strategy': 'breakout', 'bear_bb_std_mult': 2.358298107810481, 'bear_rsi_os': 28, 'bear_rsi_ob': 46, 'bear_adx_thresh': 20.76024798955919, 'bear_atr_min_pct': 0.017002592333095055, 'bear_atr_max_pct': 0.06835198036692305, 'bear_tp_mult': 1.2505347575279868, 'bear_tsl_mult': 0.45199275455388316, 'bear_time_stop': 80, 'bear_use_sma': True, 'bear_use_ema': False, 'bear_use_atr': False, 'bear_use_adx': True, 'bear_use_spike': True, 'bear_rsi_required': True, 'sideways_strategy': 'mean_reversion', 'sideways_bb_std_mult': 3.2599773009870594, 'sideways_rsi_os': 46, 'sideways_rsi_ob': 52, 'sideways_adx_thresh': 26.792792009447087, 'sideways_atr_min_pct': 0.018755369045359384, 'sideways_atr_max_pct': 0.14371415565280973, 'sideways_tp_mult': 1.4464295625607253, 'sideways_tsl_mult': 0.8500035001096649, 'sideways_time_stop': 193, 'sideways_use_sma': True, 'sideways_use_ema': True, 'sideways_use_atr': False, 'sideways_use_adx': True, 'sideways_use_spike': True, 'sideways_rsi_required': True}.
[I 2025-09-01 09:54:55,922] Trial 346 finished with values: [-1000000000.0, 1000000000.0] and parameters: {'p_sma': 19, 'p_std': 34, 'p_atr': 22, 'p_adx': 22, 'rsi_period': 23, 'ema1': 28, 'ema2': 50, 'slip_atr_k': 0.045614822861982866, 'slip_spread_k': 0.571261198688804, 'spread_hl_frac': 0.02400586160488079, 'bb_std_mult': 3.1319248583378627, 'rsi_os': 25, 'rsi_ob': 79, 'vol_spike': 0.28530577746912, 'adx_thresh': 16.48346678561768, 'atr_min_pct': 0.02289567803851799, 'atr_max_pct': 0.07865075129061083, 'tp_mult': 2.8005671511340364, 'tsl_mult': 0.6451833700349014, 'strategy': 'breakout', 'time_stop': 158, 'use_sma': True, 'use_atr': False, 'use_adx': True, 'use_ema': False, 'use_spike': False, 'rsi_required': False, 'edge_k': 0.16658017448682383, 'edge_cap': 0.6361552368996403, 'bull_strategy': 'mean_reversion', 'bull_bb_std_mult': 1.431612455234953, 'bull_rsi_os': 20, 'bull_rsi_ob': 55, 'bull_adx_thresh': 33.57905435361901, 'bull_atr_min_pct': 0.01613069184302266, 'bull_atr_max_pct': 0.09038763043172657, 'bull_tp_mult': 1.9637990423909932, 'bull_tsl_mult': 0.845569228527463, 'bull_time_stop': 172, 'bull_use_sma': True, 'bull_use_ema': False, 'bull_use_atr': True, 'bull_use_adx': True, 'bull_use_spike': False, 'bull_rsi_required': True, 'bear_strategy': 'mean_reversion', 'bear_bb_std_mult': 3.376367822452963, 'bear_rsi_os': 27, 'bear_rsi_ob': 45, 'bear_adx_thresh': 31.36186886636129, 'bear_atr_min_pct': 0.022382892842309716, 'bear_atr_max_pct': 0.06725406193322275, 'bear_tp_mult': 1.24588523128345, 'bear_tsl_mult': 0.4456600100409398, 'bear_time_stop': 108, 'bear_use_sma': False, 'bear_use_ema': True, 'bear_use_atr': True, 'bear_use_adx': True, 'bear_use_spike': True, 'bear_rsi_required': False, 'sideways_strategy': 'breakout', 'sideways_bb_std_mult': 3.2708644840992647, 'sideways_rsi_os': 50, 'sideways_rsi_ob': 62, 'sideways_adx_thresh': 7.517145384590021, 'sideways_atr_min_pct': 0.015615557885140066, 'sideways_atr_max_pct': 0.04521663749896325, 'sideways_tp_mult': 1.3742061474538807, 'sideways_tsl_mult': 0.8577646181480798, 'sideways_time_stop': 191, 'sideways_use_sma': False, 'sideways_use_ema': True, 'sideways_use_atr': False, 'sideways_use_adx': False, 'sideways_use_spike': False, 'sideways_rsi_required': False}.
[I 2025-09-01 09:54:56,547] Trial 344 finished with values: [-0.11706688318477498, 0.11692949913989464] and parameters: {'p_sma': 19, 'p_std': 36, 'p_atr': 20, 'p_adx': 22, 'rsi_period': 50, 'ema1': 22, 'ema2': 44, 'slip_atr_k': 0.13971911555590386, 'slip_spread_k': 0.14938133724829816, 'spread_hl_frac': 0.028119794704635194, 'bb_std_mult': 3.144224216352754, 'rsi_os': 29, 'rsi_ob': 79, 'vol_spike': 0.27779314910744785, 'adx_thresh': 16.19996161964502, 'atr_min_pct': 0.024922551229772, 'atr_max_pct': 0.06969668315148103, 'tp_mult': 2.8903906718583237, 'tsl_mult': 0.4603988616089205, 'strategy': 'breakout', 'time_stop': 144, 'use_sma': True, 'use_atr': True, 'use_adx': False, 'use_ema': False, 'use_spike': True, 'rsi_required': False, 'edge_k': 0.8915684896877266, 'edge_cap': 0.6031596349831252, 'bull_strategy': 'mean_reversion', 'bull_bb_std_mult': 1.4366033024302474, 'bull_rsi_os': 38, 'bull_rsi_ob': 52, 'bull_adx_thresh': 5.920556769043713, 'bull_atr_min_pct': 0.0010489341137337998, 'bull_atr_max_pct': 0.09012773356497272, 'bull_tp_mult': 1.8825828935048163, 'bull_tsl_mult': 0.04538576015401796, 'bull_time_stop': 216, 'bull_use_sma': True, 'bull_use_ema': False, 'bull_use_atr': True, 'bull_use_adx': True, 'bull_use_spike': False, 'bull_rsi_required': True, 'bear_strategy': 'breakout', 'bear_bb_std_mult': 0.8875486712020693, 'bear_rsi_os': 47, 'bear_rsi_ob': 46, 'bear_adx_thresh': 8.0502358870254, 'bear_atr_min_pct': 0.017535477589353973, 'bear_atr_max_pct': 0.07298219611028638, 'bear_tp_mult': 1.2574363640428379, 'bear_tsl_mult': 0.8647042254141104, 'bear_time_stop': 105, 'bear_use_sma': False, 'bear_use_ema': True, 'bear_use_atr': False, 'bear_use_adx': True, 'bear_use_spike': True, 'bear_rsi_required': True, 'sideways_strategy': 'mean_reversion', 'sideways_bb_std_mult': 3.284132403953401, 'sideways_rsi_os': 16, 'sideways_rsi_ob': 49, 'sideways_adx_thresh': 27.87510789578006, 'sideways_atr_min_pct': 0.017379884457184153, 'sideways_atr_max_pct': 0.12822264459673288, 'sideways_tp_mult': 1.393960068960736, 'sideways_tsl_mult': 0.8029058397002964, 'sideways_time_stop': 71, 'sideways_use_sma': False, 'sideways_use_ema': True, 'sideways_use_atr': False, 'sideways_use_adx': False, 'sideways_use_spike': True, 'sideways_rsi_required': True}.
[I 2025-09-01 09:55:42,668] Trial 350 finished with values: [-1000000000.0, 1000000000.0] and parameters: {'p_sma': 21, 'p_std': 48, 'p_atr': 27, 'p_adx': 22, 'rsi_period': 8, 'ema1': 21, 'ema2': 49, 'slip_atr_k': 0.1851479975975106, 'slip_spread_k': 0.10949897165454114, 'spread_hl_frac': 0.026804264128585973, 'bb_std_mult': 3.2576013593379853, 'rsi_os': 25, 'rsi_ob': 47, 'vol_spike': 0.2868051990343718, 'adx_thresh': 6.683811123848767, 'atr_min_pct': 0.025531917270318293, 'atr_max_pct': 0.06777194355512944, 'tp_mult': 2.5375464946298396, 'tsl_mult': 0.0801324221207203, 'strategy': 'breakout', 'time_stop': 126, 'use_sma': True, 'use_atr': False, 'use_adx': True, 'use_ema': False, 'use_spike': False, 'rsi_required': False, 'edge_k': 0.9049654894301179, 'edge_cap': 0.5599422573276424, 'bull_strategy': 'mean_reversion', 'bull_bb_std_mult': 2.507331799878496, 'bull_rsi_os': 51, 'bull_rsi_ob': 79, 'bull_adx_thresh': 5.018787658842193, 'bull_atr_min_pct': 0.02930314929117528, 'bull_atr_max_pct': 0.08567338982932347, 'bull_tp_mult': 1.7865873417806968, 'bull_tsl_mult': 0.8988822914868356, 'bull_time_stop': 255, 'bull_use_sma': True, 'bull_use_ema': False, 'bull_use_atr': True, 'bull_use_adx': True, 'bull_use_spike': False, 'bull_rsi_required': True, 'bear_strategy': 'mean_reversion', 'bear_bb_std_mult': 3.392377991254896, 'bear_rsi_os': 46, 'bear_rsi_ob': 45, 'bear_adx_thresh': 11.520861595405707, 'bear_atr_min_pct': 0.02660335654242044, 'bear_atr_max_pct': 0.08123317707815297, 'bear_tp_mult': 1.2069217506914964, 'bear_tsl_mult': 0.49781737843831503, 'bear_time_stop': 138, 'bear_use_sma': False, 'bear_use_ema': True, 'bear_use_atr': True, 'bear_use_adx': False, 'bear_use_spike': True, 'bear_rsi_required': False, 'sideways_strategy': 'breakout', 'sideways_bb_std_mult': 3.4199074793978834, 'sideways_rsi_os': 47, 'sideways_rsi_ob': 84, 'sideways_adx_thresh': 26.627972244398848, 'sideways_atr_min_pct': 0.0165196652241705, 'sideways_atr_max_pct': 0.14943519168508201, 'sideways_tp_mult': 1.2399621454220675, 'sideways_tsl_mult': 0.8019241582011973, 'sideways_time_stop': 115, 'sideways_use_sma': False, 'sideways_use_ema': True, 'sideways_use_atr': False, 'sideways_use_adx': False, 'sideways_use_spike': False, 'sideways_rsi_required': False}.
[I 2025-09-01 09:55:42,678] Trial 347 finished with values: [-1000000000.0, 1000000000.0] and parameters: {'p_sma': 5, 'p_std': 33, 'p_atr': 25, 'p_adx': 22, 'rsi_period': 56, 'ema1': 22, 'ema2': 49, 'slip_atr_k': 0.11359211136793557, 'slip_spread_k': 0.5759860541306011, 'spread_hl_frac': 0.028602752559273283, 'bb_std_mult': 3.137032511436331, 'rsi_os': 34, 'rsi_ob': 79, 'vol_spike': 0.2856674482118656, 'adx_thresh': 15.769233292374262, 'atr_min_pct': 0.025006431307740468, 'atr_max_pct': 0.06864011226878308, 'tp_mult': 2.903183389095659, 'tsl_mult': 0.6050675238311831, 'strategy': 'breakout', 'time_stop': 128, 'use_sma': True, 'use_atr': False, 'use_adx': True, 'use_ema': False, 'use_spike': False, 'rsi_required': False, 'edge_k': 0.18041410885073217, 'edge_cap': 0.6440271994964134, 'bull_strategy': 'mean_reversion', 'bull_bb_std_mult': 0.8064359629224302, 'bull_rsi_os': 19, 'bull_rsi_ob': 47, 'bull_adx_thresh': 5.9779355975460415, 'bull_atr_min_pct': 0.005166945371272873, 'bull_atr_max_pct': 0.09002125698129942, 'bull_tp_mult': 1.775153460400308, 'bull_tsl_mult': 0.8613028367973297, 'bull_time_stop': 236, 'bull_use_sma': True, 'bull_use_ema': False, 'bull_use_atr': True, 'bull_use_adx': True, 'bull_use_spike': False, 'bull_rsi_required': True, 'bear_strategy': 'mean_reversion', 'bear_bb_std_mult': 1.3600141826141803, 'bear_rsi_os': 28, 'bear_rsi_ob': 45, 'bear_adx_thresh': 11.346595300655546, 'bear_atr_min_pct': 0.016920271486998432, 'bear_atr_max_pct': 0.0675227801387195, 'bear_tp_mult': 1.2511454041335217, 'bear_tsl_mult': 0.5612959459582028, 'bear_time_stop': 138, 'bear_use_sma': False, 'bear_use_ema': True, 'bear_use_atr': True, 'bear_use_adx': False, 'bear_use_spike': True, 'bear_rsi_required': False, 'sideways_strategy': 'breakout', 'sideways_bb_std_mult': 3.420473191864791, 'sideways_rsi_os': 46, 'sideways_rsi_ob': 49, 'sideways_adx_thresh': 7.639912677719552, 'sideways_atr_min_pct': 0.017263367539822362, 'sideways_atr_max_pct': 0.14457307717622442, 'sideways_tp_mult': 1.2434554983233568, 'sideways_tsl_mult': 0.7907063865835613, 'sideways_time_stop': 68, 'sideways_use_sma': False, 'sideways_use_ema': True, 'sideways_use_atr': False, 'sideways_use_adx': False, 'sideways_use_spike': False, 'sideways_rsi_required': False}.
[I 2025-09-01 09:55:43,363] Trial 349 finished with values: [-1000000000.0, 1000000000.0] and parameters: {'p_sma': 20, 'p_std': 36, 'p_atr': 20, 'p_adx': 22, 'rsi_period': 51, 'ema1': 21, 'ema2': 49, 'slip_atr_k': 0.24995185246108997, 'slip_spread_k': 0.8133392616836419, 'spread_hl_frac': 0.026497227516772984, 'bb_std_mult': 3.2582578495358714, 'rsi_os': 33, 'rsi_ob': 76, 'vol_spike': 0.28657786841479965, 'adx_thresh': 11.970351015247509, 'atr_min_pct': 0.025701340470538347, 'atr_max_pct': 0.06920328014109953, 'tp_mult': 2.519706314972364, 'tsl_mult': 0.07538098292813822, 'strategy': 'breakout', 'time_stop': 141, 'use_sma': True, 'use_atr': False, 'use_adx': True, 'use_ema': False, 'use_spike': False, 'rsi_required': False, 'edge_k': 0.8972478680286861, 'edge_cap': 0.5592656815743585, 'bull_strategy': 'mean_reversion', 'bull_bb_std_mult': 0.8405409701767353, 'bull_rsi_os': 38, 'bull_rsi_ob': 46, 'bull_adx_thresh': 34.790463360369955, 'bull_atr_min_pct': 0.029414539117685462, 'bull_atr_max_pct': 0.08495629284291216, 'bull_tp_mult': 1.7870383430572936, 'bull_tsl_mult': 0.40314293217877994, 'bull_time_stop': 149, 'bull_use_sma': True, 'bull_use_ema': False, 'bull_use_atr': True, 'bull_use_adx': True, 'bull_use_spike': False, 'bull_rsi_required': True, 'bear_strategy': 'mean_reversion', 'bear_bb_std_mult': 0.9102692914667951, 'bear_rsi_os': 46, 'bear_rsi_ob': 45, 'bear_adx_thresh': 25.61798539804166, 'bear_atr_min_pct': 0.017730236136911572, 'bear_atr_max_pct': 0.07637256423172718, 'bear_tp_mult': 1.1989425942505616, 'bear_tsl_mult': 0.8626463030125706, 'bear_time_stop': 260, 'bear_use_sma': False, 'bear_use_ema': True, 'bear_use_atr': True, 'bear_use_adx': False, 'bear_use_spike': True, 'bear_rsi_required': False, 'sideways_strategy': 'breakout', 'sideways_bb_std_mult': 3.4287388525194187, 'sideways_rsi_os': 47, 'sideways_rsi_ob': 56, 'sideways_adx_thresh': 13.869584698457375, 'sideways_atr_min_pct': 0.007911161733509139, 'sideways_atr_max_pct': 0.08187270618278117, 'sideways_tp_mult': 1.2523231744642156, 'sideways_tsl_mult': 0.7899982322722162, 'sideways_time_stop': 199, 'sideways_use_sma': False, 'sideways_use_ema': True, 'sideways_use_atr': False, 'sideways_use_adx': False, 'sideways_use_spike': False, 'sideways_rsi_required': False}.
[I 2025-09-01 09:55:44,300] Trial 348 finished with values: [-0.11900088210846138, 0.11876402988860464] and parameters: {'p_sma': 20, 'p_std': 49, 'p_atr': 20, 'p_adx': 22, 'rsi_period': 56, 'ema1': 21, 'ema2': 48, 'slip_atr_k': 0.11182207333668095, 'slip_spread_k': 0.5696716117857471, 'spread_hl_frac': 0.02657175381847835, 'bb_std_mult': 3.263504206132679, 'rsi_os': 29, 'rsi_ob': 79, 'vol_spike': 0.28568570705802143, 'adx_thresh': 16.458609859632077, 'atr_min_pct': 0.024837884334887976, 'atr_max_pct': 0.06815438892192248, 'tp_mult': 2.9766181090674575, 'tsl_mult': 0.6561951434455365, 'strategy': 'breakout', 'time_stop': 143, 'use_sma': True, 'use_atr': False, 'use_adx': True, 'use_ema': False, 'use_spike': False, 'rsi_required': False, 'edge_k': 0.9007307914607806, 'edge_cap': 0.4075079166242483, 'bull_strategy': 'mean_reversion', 'bull_bb_std_mult': 2.5063068697617212, 'bull_rsi_os': 19, 'bull_rsi_ob': 79, 'bull_adx_thresh': 21.401094586907668, 'bull_atr_min_pct': 0.013818870466839387, 'bull_atr_max_pct': 0.08424786654298366, 'bull_tp_mult': 1.7792047273877027, 'bull_tsl_mult': 0.39632096990135074, 'bull_time_stop': 172, 'bull_use_sma': True, 'bull_use_ema': False, 'bull_use_atr': True, 'bull_use_adx': True, 'bull_use_spike': False, 'bull_rsi_required': True, 'bear_strategy': 'mean_reversion', 'bear_bb_std_mult': 3.3837621545214245, 'bear_rsi_os': 46, 'bear_rsi_ob': 45, 'bear_adx_thresh': 11.475843323129906, 'bear_atr_min_pct': 0.017739882470026575, 'bear_atr_max_pct': 0.07596703589262552, 'bear_tp_mult': 1.2027860368865788, 'bear_tsl_mult': 0.8779453702646571, 'bear_time_stop': 110, 'bear_use_sma': False, 'bear_use_ema': True, 'bear_use_atr': True, 'bear_use_adx': False, 'bear_use_spike': True, 'bear_rsi_required': False, 'sideways_strategy': 'breakout', 'sideways_bb_std_mult': 2.026432689612037, 'sideways_rsi_os': 50, 'sideways_rsi_ob': 60, 'sideways_adx_thresh': 23.01979878345583, 'sideways_atr_min_pct': 0.002125257026370884, 'sideways_atr_max_pct': 0.016858426149280945, 'sideways_tp_mult': 1.2352715656134257, 'sideways_tsl_mult': 0.7900256823326313, 'sideways_time_stop': 198, 'sideways_use_sma': False, 'sideways_use_ema': True, 'sideways_use_atr': False, 'sideways_use_adx': False, 'sideways_use_spike': False, 'sideways_rsi_required': False}.
