[I 2025-09-01 10:32:23,850] Trial 568 finished with values: [-1000000000.0, 1000000000.0] and parameters: {'p_sma': 24, 'p_std': 15, 'p_atr': 10, 'p_adx': 9, 'rsi_period': 62, 'ema1': 18, 'ema2': 53, 'slip_atr_k': 0.1457807109918301, 'slip_spread_k': 0.21797912166752265, 'spread_hl_frac': 0.028502364860311043, 'bb_std_mult': 3.1368323728826333, 'rsi_os': 21, 'rsi_ob': 62, 'vol_spike': 0.08450784650296327, 'adx_thresh': 5.069857115167109, 'atr_min_pct': 0.003312930516692082, 'atr_max_pct': 0.09691374646707461, 'tp_mult': 1.3699063136797487, 'tsl_mult': 0.35251027900605025, 'strategy': 'mean_reversion', 'time_stop': 148, 'use_sma': True, 'use_atr': False, 'use_adx': True, 'use_ema': True, 'use_spike': False, 'rsi_required': False, 'edge_k': 0.6741494714349234, 'edge_cap': 0.6225160630058146, 'bull_strategy': 'mean_reversion', 'bull_bb_std_mult': 0.9478551553120912, 'bull_rsi_os': 19, 'bull_rsi_ob': 55, 'bull_adx_thresh': 13.907346445487788, 'bull_atr_min_pct': 0.020601649815877053, 'bull_atr_max_pct': 0.08770266625580073, 'bull_tp_mult': 1.9140984795184208, 'bull_tsl_mult': 0.10860628802785294, 'bull_time_stop': 261, 'bull_use_sma': False, 'bull_use_ema': False, 'bull_use_atr': True, 'bull_use_adx': True, 'bull_use_spike': False, 'bull_rsi_required': False, 'bear_strategy': 'breakout', 'bear_bb_std_mult': 3.412703067583626, 'bear_rsi_os': 31, 'bear_rsi_ob': 46, 'bear_adx_thresh': 13.611178078020329, 'bear_atr_min_pct': 0.017010739255796246, 'bear_atr_max_pct': 0.13381267498602173, 'bear_tp_mult': 1.4984151361207165, 'bear_tsl_mult': 0.4520034716626612, 'bear_time_stop': 273, 'bear_use_sma': False, 'bear_use_ema': True, 'bear_use_atr': True, 'bear_use_adx': False, 'bear_use_spike': True, 'bear_rsi_required': True, 'sideways_strategy': 'mean_reversion', 'sideways_bb_std_mult': 3.295620480374792, 'sideways_rsi_os': 32, 'sideways_rsi_ob': 60, 'sideways_adx_thresh': 22.767304504547813, 'sideways_atr_min_pct': 0.02500557395931302, 'sideways_atr_max_pct': 0.07074231916296228, 'sideways_tp_mult': 2.282253437874754, 'sideways_tsl_mult': 0.8990164451388994, 'sideways_time_stop': 215, 'sideways_use_sma': True, 'sideways_use_ema': True, 'sideways_use_atr': False, 'sideways_use_adx': True, 'sideways_use_spike': False, 'sideways_rsi_required': False}.
[I 2025-09-01 10:32:24,408] Trial 569 finished with values: [-1000000000.0, 1000000000.0] and parameters: {'p_sma': 20, 'p_std': 55, 'p_atr': 18, 'p_adx': 22, 'rsi_period': 62, 'ema1': 23, 'ema2': 45, 'slip_atr_k': 0.0055888075713761, 'slip_spread_k': 0.9449271270823525, 'spread_hl_frac': 0.028711516971197, 'bb_std_mult': 3.1598586090637673, 'rsi_os': 21, 'rsi_ob': 84, 'vol_spike': 0.2909992661470242, 'adx_thresh': 17.310252442234145, 'atr_min_pct': 0.02486274909445099, 'atr_max_pct': 0.0851428368568992, 'tp_mult': 2.6185810522654425, 'tsl_mult': 0.5657050849202065, 'strategy': 'mean_reversion', 'time_stop': 172, 'use_sma': True, 'use_atr': False, 'use_adx': True, 'use_ema': True, 'use_spike': False, 'rsi_required': False, 'edge_k': 0.9351020612637126, 'edge_cap': 0.913674048655361, 'bull_strategy': 'mean_reversion', 'bull_bb_std_mult': 0.916496952856581, 'bull_rsi_os': 49, 'bull_rsi_ob': 55, 'bull_adx_thresh': 13.676873061323082, 'bull_atr_min_pct': 0.028340564970040224, 'bull_atr_max_pct': 0.10268424371627471, 'bull_tp_mult': 1.9180125313461014, 'bull_tsl_mult': 0.10534171603443065, 'bull_time_stop': 261, 'bull_use_sma': False, 'bull_use_ema': False, 'bull_use_atr': True, 'bull_use_adx': True, 'bull_use_spike': False, 'bull_rsi_required': False, 'bear_strategy': 'breakout', 'bear_bb_std_mult': 3.4173760669512467, 'bear_rsi_os': 34, 'bear_rsi_ob': 46, 'bear_adx_thresh': 12.920904201595832, 'bear_atr_min_pct': 0.01711448033671362, 'bear_atr_max_pct': 0.08309599653835793, 'bear_tp_mult': 1.2564568125390245, 'bear_tsl_mult': 0.33525601548734807, 'bear_time_stop': 131, 'bear_use_sma': False, 'bear_use_ema': True, 'bear_use_atr': True, 'bear_use_adx': False, 'bear_use_spike': True, 'bear_rsi_required': True, 'sideways_strategy': 'mean_reversion', 'sideways_bb_std_mult': 0.7091778152428172, 'sideways_rsi_os': 32, 'sideways_rsi_ob': 49, 'sideways_adx_thresh': 28.987207350935748, 'sideways_atr_min_pct': 0.023887082766297113, 'sideways_atr_max_pct': 0.07024370254689444, 'sideways_tp_mult': 2.2841571512743175, 'sideways_tsl_mult': 0.8903146671335063, 'sideways_time_stop': 294, 'sideways_use_sma': True, 'sideways_use_ema': True, 'sideways_use_atr': False, 'sideways_use_adx': True, 'sideways_use_spike': False, 'sideways_rsi_required': False}.
[I 2025-09-01 10:32:24,420] Trial 570 finished with values: [-1000000000.0, 1000000000.0] and parameters: {'p_sma': 59, 'p_std': 48, 'p_atr': 10, 'p_adx': 28, 'rsi_period': 21, 'ema1': 23, 'ema2': 45, 'slip_atr_k': 0.03838643036164222, 'slip_spread_k': 0.24935128515127797, 'spread_hl_frac': 0.028744561020980733, 'bb_std_mult': 0.8639235724977341, 'rsi_os': 48, 'rsi_ob': 69, 'vol_spike': 0.2057749369197399, 'adx_thresh': 5.496478318260406, 'atr_min_pct': 0.02581942587221394, 'atr_max_pct': 0.0381038674914668, 'tp_mult': 2.7845322753406854, 'tsl_mult': 0.07057716836189909, 'strategy': 'mean_reversion', 'time_stop': 170, 'use_sma': True, 'use_atr': True, 'use_adx': True, 'use_ema': True, 'use_spike': False, 'rsi_required': False, 'edge_k': 0.3080569252750853, 'edge_cap': 0.511232723464122, 'bull_strategy': 'breakout', 'bull_bb_std_mult': 0.9494983193536793, 'bull_rsi_os': 19, 'bull_rsi_ob': 55, 'bull_adx_thresh': 7.262626364977393, 'bull_atr_min_pct': 0.028701381613553508, 'bull_atr_max_pct': 0.09794676279200477, 'bull_tp_mult': 2.0383232221147702, 'bull_tsl_mult': 0.09529350578032196, 'bull_time_stop': 137, 'bull_use_sma': False, 'bull_use_ema': False, 'bull_use_atr': True, 'bull_use_adx': True, 'bull_use_spike': True, 'bull_rsi_required': False, 'bear_strategy': 'breakout', 'bear_bb_std_mult': 3.4254018104941943, 'bear_rsi_os': 6, 'bear_rsi_ob': 46, 'bear_adx_thresh': 13.737972024768776, 'bear_atr_min_pct': 0.01145966459134607, 'bear_atr_max_pct': 0.056993360251022585, 'bear_tp_mult': 1.117147669406256, 'bear_tsl_mult': 0.9990323295645998, 'bear_time_stop': 276, 'bear_use_sma': False, 'bear_use_ema': False, 'bear_use_atr': True, 'bear_use_adx': False, 'bear_use_spike': True, 'bear_rsi_required': True, 'sideways_strategy': 'mean_reversion', 'sideways_bb_std_mult': 0.692764708809327, 'sideways_rsi_os': 13, 'sideways_rsi_ob': 62, 'sideways_adx_thresh': 25.85730131306034, 'sideways_atr_min_pct': 0.024240301964762914, 'sideways_atr_max_pct': 0.07135174960843754, 'sideways_tp_mult': 1.3094408179513082, 'sideways_tsl_mult': 0.848511411364421, 'sideways_time_stop': 293, 'sideways_use_sma': True, 'sideways_use_ema': True, 'sideways_use_atr': False, 'sideways_use_adx': True, 'sideways_use_spike': False, 'sideways_rsi_required': False}.
[I 2025-09-01 10:32:24,795] Trial 567 finished with values: [-1000000000.0, 1000000000.0] and parameters: {'p_sma': 24, 'p_std': 42, 'p_atr': 18, 'p_adx': 9, 'rsi_period': 60, 'ema1': 25, 'ema2': 45, 'slip_atr_k': 0.08285826893081388, 'slip_spread_k': 0.470573924214288, 'spread_hl_frac': 0.016397298188072944, 'bb_std_mult': 3.1547842362657548, 'rsi_os': 21, 'rsi_ob': 77, 'vol_spike': 0.2977137414158779, 'adx_thresh': 5.021052458351824, 'atr_min_pct': 0.0035071379457752624, 'atr_max_pct': 0.0972807579544907, 'tp_mult': 1.539294858091025, 'tsl_mult': 0.08418898787240958, 'strategy': 'breakout', 'time_stop': 156, 'use_sma': True, 'use_atr': False, 'use_adx': False, 'use_ema': False, 'use_spike': False, 'rsi_required': False, 'edge_k': 0.9972720857093279, 'edge_cap': 0.5160096204010305, 'bull_strategy': 'mean_reversion', 'bull_bb_std_mult': 2.969578135422346, 'bull_rsi_os': 18, 'bull_rsi_ob': 54, 'bull_adx_thresh': 5.550910354480933, 'bull_atr_min_pct': 0.013731040397718813, 'bull_atr_max_pct': 0.07962545366319809, 'bull_tp_mult': 1.914006649203061, 'bull_tsl_mult': 0.10486700609323937, 'bull_time_stop': 204, 'bull_use_sma': True, 'bull_use_ema': False, 'bull_use_atr': False, 'bull_use_adx': True, 'bull_use_spike': False, 'bull_rsi_required': True, 'bear_strategy': 'mean_reversion', 'bear_bb_std_mult': 3.4068873708718828, 'bear_rsi_os': 12, 'bear_rsi_ob': 45, 'bear_adx_thresh': 15.15491856965491, 'bear_atr_min_pct': 0.011721069166607622, 'bear_atr_max_pct': 0.06928845974393597, 'bear_tp_mult': 1.4812826674960817, 'bear_tsl_mult': 0.4451673802710926, 'bear_time_stop': 246, 'bear_use_sma': False, 'bear_use_ema': True, 'bear_use_atr': False, 'bear_use_adx': False, 'bear_use_spike': True, 'bear_rsi_required': False, 'sideways_strategy': 'breakout', 'sideways_bb_std_mult': 1.4054706040363039, 'sideways_rsi_os': 50, 'sideways_rsi_ob': 48, 'sideways_adx_thresh': 18.615219386777586, 'sideways_atr_min_pct': 0.022155129277649253, 'sideways_atr_max_pct': 0.12306599597858196, 'sideways_tp_mult': 1.2953311800900675, 'sideways_tsl_mult': 0.8403145292229152, 'sideways_time_stop': 217, 'sideways_use_sma': False, 'sideways_use_ema': True, 'sideways_use_atr': False, 'sideways_use_adx': True, 'sideways_use_spike': False, 'sideways_rsi_required': False}.
[I 2025-09-01 10:32:25,878] Trial 572 finished with values: [-1000000000.0, 1000000000.0] and parameters: {'p_sma': 35, 'p_std': 43, 'p_atr': 28, 'p_adx': 21, 'rsi_period': 66, 'ema1': 25, 'ema2': 43, 'slip_atr_k': 0.05143402694395479, 'slip_spread_k': 0.4997556609225099, 'spread_hl_frac': 0.02784374115624352, 'bb_std_mult': 2.4073206174820485, 'rsi_os': 28, 'rsi_ob': 77, 'vol_spike': 0.27890906182560293, 'adx_thresh': 28.51681085682781, 'atr_min_pct': 0.024219767620002376, 'atr_max_pct': 0.01469552826838337, 'tp_mult': 2.5920191238810064, 'tsl_mult': 0.059509443657887344, 'strategy': 'breakout', 'time_stop': 147, 'use_sma': False, 'use_atr': False, 'use_adx': True, 'use_ema': False, 'use_spike': True, 'rsi_required': False, 'edge_k': 0.8105856602318191, 'edge_cap': 0.806814630123674, 'bull_strategy': 'breakout', 'bull_bb_std_mult': 2.1250278131746207, 'bull_rsi_os': 17, 'bull_rsi_ob': 56, 'bull_adx_thresh': 7.90230154610652, 'bull_atr_min_pct': 0.013757272794798506, 'bull_atr_max_pct': 0.08447429340266797, 'bull_tp_mult': 1.8974343046964464, 'bull_tsl_mult': 0.03204139045948072, 'bull_time_stop': 49, 'bull_use_sma': True, 'bull_use_ema': False, 'bull_use_atr': True, 'bull_use_adx': True, 'bull_use_spike': True, 'bull_rsi_required': True, 'bear_strategy': 'mean_reversion', 'bear_bb_std_mult': 3.537246378212986, 'bear_rsi_os': 12, 'bear_rsi_ob': 75, 'bear_adx_thresh': 11.834670006368503, 'bear_atr_min_pct': 0.017523400055962403, 'bear_atr_max_pct': 0.07474983707220272, 'bear_tp_mult': 1.3323871160861929, 'bear_tsl_mult': 0.24437718802847547, 'bear_time_stop': 115, 'bear_use_sma': False, 'bear_use_ema': True, 'bear_use_atr': True, 'bear_use_adx': False, 'bear_use_spike': False, 'bear_rsi_required': False, 'sideways_strategy': 'breakout', 'sideways_bb_std_mult': 1.6180007973167592, 'sideways_rsi_os': 5, 'sideways_rsi_ob': 54, 'sideways_adx_thresh': 13.925345061535365, 'sideways_atr_min_pct': 0.0044383611075277715, 'sideways_atr_max_pct': 0.06245193304611444, 'sideways_tp_mult': 1.3262098520341397, 'sideways_tsl_mult': 0.8222706168318731, 'sideways_time_stop': 93, 'sideways_use_sma': False, 'sideways_use_ema': False, 'sideways_use_atr': True, 'sideways_use_adx': False, 'sideways_use_spike': False, 'sideways_rsi_required': False}.
[I 2025-09-01 10:33:05,137] Trial 573 finished with values: [-1000000000.0, 1000000000.0] and parameters: {'p_sma': 43, 'p_std': 42, 'p_atr': 28, 'p_adx': 21, 'rsi_period': 64, 'ema1': 25, 'ema2': 57, 'slip_atr_k': 0.2190670658610967, 'slip_spread_k': 0.5290981205978033, 'spread_hl_frac': 0.03441863440203634, 'bb_std_mult': 2.4096345956898273, 'rsi_os': 28, 'rsi_ob': 72, 'vol_spike': 0.2803021725339016, 'adx_thresh': 13.881737808241688, 'atr_min_pct': 0.0038444692015746334, 'atr_max_pct': 0.012275640660146081, 'tp_mult': 2.7263205910620663, 'tsl_mult': 0.2301799618244893, 'strategy': 'breakout', 'time_stop': 88, 'use_sma': False, 'use_atr': False, 'use_adx': True, 'use_ema': False, 'use_spike': True, 'rsi_required': False, 'edge_k': 1.3315753936226868, 'edge_cap': 0.596427394571491, 'bull_strategy': 'breakout', 'bull_bb_std_mult': 0.8590033516198025, 'bull_rsi_os': 14, 'bull_rsi_ob': 52, 'bull_adx_thresh': 8.108651779697638, 'bull_atr_min_pct': 0.013814646876587565, 'bull_atr_max_pct': 0.015350205452844837, 'bull_tp_mult': 2.6535651355753473, 'bull_tsl_mult': 0.029640035747265574, 'bull_time_stop': 224, 'bull_use_sma': True, 'bull_use_ema': False, 'bull_use_atr': True, 'bull_use_adx': True, 'bull_use_spike': True, 'bull_rsi_required': True, 'bear_strategy': 'mean_reversion', 'bear_bb_std_mult': 2.5626440169215057, 'bear_rsi_os': 47, 'bear_rsi_ob': 45, 'bear_adx_thresh': 12.039095454031893, 'bear_atr_min_pct': 0.018015320767528226, 'bear_atr_max_pct': 0.07481553281301265, 'bear_tp_mult': 2.6689700018853015, 'bear_tsl_mult': 0.3806238862817153, 'bear_time_stop': 161, 'bear_use_sma': False, 'bear_use_ema': True, 'bear_use_atr': True, 'bear_use_adx': False, 'bear_use_spike': False, 'bear_rsi_required': False, 'sideways_strategy': 'breakout', 'sideways_bb_std_mult': 3.310850204629621, 'sideways_rsi_os': 28, 'sideways_rsi_ob': 85, 'sideways_adx_thresh': 13.764355116973032, 'sideways_atr_min_pct': 0.016111738243828604, 'sideways_atr_max_pct': 0.062080317388685156, 'sideways_tp_mult': 2.2303650875833907, 'sideways_tsl_mult': 0.8686462579997605, 'sideways_time_stop': 208, 'sideways_use_sma': False, 'sideways_use_ema': False, 'sideways_use_atr': True, 'sideways_use_adx': False, 'sideways_use_spike': False, 'sideways_rsi_required': False}.
[I 2025-09-01 10:33:05,993] Trial 574 finished with values: [-1000000000.0, 1000000000.0] and parameters: {'p_sma': 49, 'p_std': 40, 'p_atr': 28, 'p_adx': 21, 'rsi_period': 66, 'ema1': 22, 'ema2': 55, 'slip_atr_k': 0.183862794315731, 'slip_spread_k': 0.20021024339105514, 'spread_hl_frac': 0.026183800320609563, 'bb_std_mult': 3.305641646040219, 'rsi_os': 50, 'rsi_ob': 59, 'vol_spike': 0.28122122609338934, 'adx_thresh': 6.834608390721976, 'atr_min_pct': 0.017902261879351615, 'atr_max_pct': 0.08128800824280599, 'tp_mult': 2.6756084241307594, 'tsl_mult': 0.6856271890733885, 'strategy': 'breakout', 'time_stop': 120, 'use_sma': False, 'use_atr': True, 'use_adx': True, 'use_ema': False, 'use_spike': True, 'rsi_required': False, 'edge_k': 0.5313255426746841, 'edge_cap': 0.855716443140399, 'bull_strategy': 'breakout', 'bull_bb_std_mult': 0.8400910703032538, 'bull_rsi_os': 17, 'bull_rsi_ob': 86, 'bull_adx_thresh': 6.3555585941733845, 'bull_atr_min_pct': 0.029317647411152063, 'bull_atr_max_pct': 0.08556296957421178, 'bull_tp_mult': 1.986259876818757, 'bull_tsl_mult': 0.030617874845076856, 'bull_time_stop': 227, 'bull_use_sma': True, 'bull_use_ema': False, 'bull_use_atr': True, 'bull_use_adx': True, 'bull_use_spike': True, 'bull_rsi_required': True, 'bear_strategy': 'mean_reversion', 'bear_bb_std_mult': 3.48956027172117, 'bear_rsi_os': 47, 'bear_rsi_ob': 47, 'bear_adx_thresh': 20.7476239054492, 'bear_atr_min_pct': 0.02145475941958777, 'bear_atr_max_pct': 0.06129518599724647, 'bear_tp_mult': 2.759476582186804, 'bear_tsl_mult': 0.40330037579302025, 'bear_time_stop': 115, 'bear_use_sma': False, 'bear_use_ema': False, 'bear_use_atr': True, 'bear_use_adx': False, 'bear_use_spike': False, 'bear_rsi_required': False, 'sideways_strategy': 'breakout', 'sideways_bb_std_mult': 3.2997373138580213, 'sideways_rsi_os': 45, 'sideways_rsi_ob': 55, 'sideways_adx_thresh': 28.14365775503759, 'sideways_atr_min_pct': 0.004337242382642622, 'sideways_atr_max_pct': 0.02978171197026664, 'sideways_tp_mult': 2.2155772563502687, 'sideways_tsl_mult': 0.8689816430983869, 'sideways_time_stop': 38, 'sideways_use_sma': False, 'sideways_use_ema': False, 'sideways_use_atr': True, 'sideways_use_adx': False, 'sideways_use_spike': False, 'sideways_rsi_required': False}.
[I 2025-09-01 10:33:07,395] Trial 571 finished with values: [-1000000000.0, 1000000000.0] and parameters: {'p_sma': 14, 'p_std': 42, 'p_atr': 18, 'p_adx': 7, 'rsi_period': 64, 'ema1': 15, 'ema2': 45, 'slip_atr_k': 0.2277745233114846, 'slip_spread_k': 0.4742657219327868, 'spread_hl_frac': 0.02822749024137719, 'bb_std_mult': 0.5578739785567273, 'rsi_os': 43, 'rsi_ob': 52, 'vol_spike': 0.27985454762894024, 'adx_thresh': 5.673968584543179, 'atr_min_pct': 0.026092403076318993, 'atr_max_pct': 0.08231701704978489, 'tp_mult': 2.615656546475414, 'tsl_mult': 0.919083531640724, 'strategy': 'mean_reversion', 'time_stop': 288, 'use_sma': True, 'use_atr': True, 'use_adx': True, 'use_ema': False, 'use_spike': False, 'rsi_required': False, 'edge_k': 0.9349695491158462, 'edge_cap': 0.9155558801342836, 'bull_strategy': 'breakout', 'bull_bb_std_mult': 2.203781830177993, 'bull_rsi_os': 17, 'bull_rsi_ob': 87, 'bull_adx_thresh': 7.252795811894008, 'bull_atr_min_pct': 0.028534064552936552, 'bull_atr_max_pct': 0.010172046774253207, 'bull_tp_mult': 2.0216600020119, 'bull_tsl_mult': 0.08852363107078001, 'bull_time_stop': 169, 'bull_use_sma': True, 'bull_use_ema': False, 'bull_use_atr': True, 'bull_use_adx': True, 'bull_use_spike': True, 'bull_rsi_required': True, 'bear_strategy': 'mean_reversion', 'bear_bb_std_mult': 3.5296553367068273, 'bear_rsi_os': 47, 'bear_rsi_ob': 47, 'bear_adx_thresh': 23.639253104517767, 'bear_atr_min_pct': 0.01743457847722489, 'bear_atr_max_pct': 0.05997909057509973, 'bear_tp_mult': 1.271494728389965, 'bear_tsl_mult': 0.3356070473658742, 'bear_time_stop': 109, 'bear_use_sma': False, 'bear_use_ema': False, 'bear_use_atr': True, 'bear_use_adx': False, 'bear_use_spike': False, 'bear_rsi_required': False, 'sideways_strategy': 'breakout', 'sideways_bb_std_mult': 3.462801445173304, 'sideways_rsi_os': 46, 'sideways_rsi_ob': 85, 'sideways_adx_thresh': 31.828194350649838, 'sideways_atr_min_pct': 0.024147579680471473, 'sideways_atr_max_pct': 0.029511041872320294, 'sideways_tp_mult': 1.3186208954266598, 'sideways_tsl_mult': 0.849992830660066, 'sideways_time_stop': 192, 'sideways_use_sma': False, 'sideways_use_ema': True, 'sideways_use_atr': True, 'sideways_use_adx': True, 'sideways_use_spike': False, 'sideways_rsi_required': False}.
[I 2025-09-01 10:33:08,162] Trial 575 finished with values: [-0.054911161400018504, 0.054708452124530946] and parameters: {'p_sma': 17, 'p_std': 42, 'p_atr': 28, 'p_adx': 21, 'rsi_period': 54, 'ema1': 30, 'ema2': 37, 'slip_atr_k': 0.041951961529657016, 'slip_spread_k': 0.20624859786938637, 'spread_hl_frac': 0.02592116361015945, 'bb_std_mult': 1.1066874435387697, 'rsi_os': 40, 'rsi_ob': 52, 'vol_spike': 0.28225676714785997, 'adx_thresh': 22.35490598866944, 'atr_min_pct': 0.02711176233030655, 'atr_max_pct': 0.11437162931033551, 'tp_mult': 1.0700704145994173, 'tsl_mult': 0.031818669482926984, 'strategy': 'breakout', 'time_stop': 270, 'use_sma': True, 'use_atr': True, 'use_adx': True, 'use_ema': False, 'use_spike': False, 'rsi_required': False, 'edge_k': 0.9227363424525086, 'edge_cap': 0.595066469087571, 'bull_strategy': 'mean_reversion', 'bull_bb_std_mult': 1.2040552607173405, 'bull_rsi_os': 14, 'bull_rsi_ob': 89, 'bull_adx_thresh': 6.467477348546698, 'bull_atr_min_pct': 0.01814808502926134, 'bull_atr_max_pct': 0.08573888176158666, 'bull_tp_mult': 1.9822505051626016, 'bull_tsl_mult': 0.05145245757934536, 'bull_time_stop': 223, 'bull_use_sma': True, 'bull_use_ema': False, 'bull_use_atr': True, 'bull_use_adx': False, 'bull_use_spike': False, 'bull_rsi_required': True, 'bear_strategy': 'mean_reversion', 'bear_bb_std_mult': 1.938779998222878, 'bear_rsi_os': 45, 'bear_rsi_ob': 90, 'bear_adx_thresh': 20.640565834797478, 'bear_atr_min_pct': 0.021444539395539048, 'bear_atr_max_pct': 0.06143594497520573, 'bear_tp_mult': 2.681758987152135, 'bear_tsl_mult': 0.3839629978286256, 'bear_time_stop': 158, 'bear_use_sma': False, 'bear_use_ema': False, 'bear_use_atr': True, 'bear_use_adx': False, 'bear_use_spike': False, 'bear_rsi_required': False, 'sideways_strategy': 'breakout', 'sideways_bb_std_mult': 3.294569538273658, 'sideways_rsi_os': 45, 'sideways_rsi_ob': 93, 'sideways_adx_thresh': 31.590473053553502, 'sideways_atr_min_pct': 0.0019710641944325254, 'sideways_atr_max_pct': 0.06463322452969865, 'sideways_tp_mult': 2.4386284235387308, 'sideways_tsl_mult': 0.8647510265235457, 'sideways_time_stop': 192, 'sideways_use_sma': False, 'sideways_use_ema': True, 'sideways_use_atr': True, 'sideways_use_adx': False, 'sideways_use_spike': False, 'sideways_rsi_required': False}.
