[I 2025-09-01 10:00:44,870] Trial 378 finished with values: [-0.04440172656748731, 0.04348697790354616] and parameters: {'p_sma': 21, 'p_std': 11, 'p_atr': 21, 'p_adx': 25, 'rsi_period': 46, 'ema1': 6, 'ema2': 50, 'slip_atr_k': 0.05396542088815566, 'slip_spread_k': 0.6398169999563114, 'spread_hl_frac': 0.03631531028001568, 'bb_std_mult': 3.1980803696626787, 'rsi_os': 27, 'rsi_ob': 79, 'vol_spike': 0.2814426240195466, 'adx_thresh': 5.016777326060188, 'atr_min_pct': 0.023430773150322833, 'atr_max_pct': 0.07933440000179656, 'tp_mult': 2.3066943521909344, 'tsl_mult': 0.08290796236976186, 'strategy': 'mean_reversion', 'time_stop': 161, 'use_sma': True, 'use_atr': False, 'use_adx': True, 'use_ema': True, 'use_spike': True, 'rsi_required': True, 'edge_k': 0.5766241048138654, 'edge_cap': 0.5952228540747619, 'bull_strategy': 'breakout', 'bull_bb_std_mult': 1.3424884138825375, 'bull_rsi_os': 18, 'bull_rsi_ob': 65, 'bull_adx_thresh': 5.8678508258801605, 'bull_atr_min_pct': 0.0299974137710632, 'bull_atr_max_pct': 0.08336994422269452, 'bull_tp_mult': 1.749681582207976, 'bull_tsl_mult': 0.5840410882345464, 'bull_time_stop': 154, 'bull_use_sma': True, 'bull_use_ema': True, 'bull_use_atr': True, 'bull_use_adx': True, 'bull_use_spike': True, 'bull_rsi_required': False, 'bear_strategy': 'breakout', 'bear_bb_std_mult': 3.431143793419048, 'bear_rsi_os': 47, 'bear_rsi_ob': 54, 'bear_adx_thresh': 12.598739341269884, 'bear_atr_min_pct': 0.006191649117195563, 'bear_atr_max_pct': 0.0749622207125322, 'bear_tp_mult': 1.3463298240406556, 'bear_tsl_mult': 0.08215310355409877, 'bear_time_stop': 117, 'bear_use_sma': True, 'bear_use_ema': False, 'bear_use_atr': True, 'bear_use_adx': True, 'bear_use_spike': True, 'bear_rsi_required': True, 'sideways_strategy': 'mean_reversion', 'sideways_bb_std_mult': 2.15744430589637, 'sideways_rsi_os': 53, 'sideways_rsi_ob': 52, 'sideways_adx_thresh': 27.982086942419986, 'sideways_atr_min_pct': 0.026267884859936617, 'sideways_atr_max_pct': 0.07298641355416294, 'sideways_tp_mult': 2.3634727560866664, 'sideways_tsl_mult': 0.6611795364158795, 'sideways_time_stop': 207, 'sideways_use_sma': False, 'sideways_use_ema': False, 'sideways_use_atr': False, 'sideways_use_adx': False, 'sideways_use_spike': True, 'sideways_rsi_required': True}.
[I 2025-09-01 10:01:24,349] Trial 380 finished with values: [-1000000000.0, 1000000000.0] and parameters: {'p_sma': 6, 'p_std': 44, 'p_atr': 11, 'p_adx': 22, 'rsi_period': 64, 'ema1': 27, 'ema2': 52, 'slip_atr_k': 0.002457406528216688, 'slip_spread_k': 0.6396661110619172, 'spread_hl_frac': 0.03610090476114721, 'bb_std_mult': 3.1385174550764092, 'rsi_os': 50, 'rsi_ob': 49, 'vol_spike': 0.09585977798306215, 'adx_thresh': 5.4181255073860655, 'atr_min_pct': 0.023348436536825935, 'atr_max_pct': 0.08173129482488685, 'tp_mult': 2.534595962391306, 'tsl_mult': 0.7659137924579236, 'strategy': 'breakout', 'time_stop': 149, 'use_sma': True, 'use_atr': True, 'use_adx': False, 'use_ema': False, 'use_spike': True, 'rsi_required': True, 'edge_k': 0.3198596149906995, 'edge_cap': 0.5508477885988464, 'bull_strategy': 'breakout', 'bull_bb_std_mult': 0.7643387139919351, 'bull_rsi_os': 5, 'bull_rsi_ob': 93, 'bull_adx_thresh': 12.968157281906283, 'bull_atr_min_pct': 0.023722008466927725, 'bull_atr_max_pct': 0.10370301107255331, 'bull_tp_mult': 1.8702069432842043, 'bull_tsl_mult': 0.6931703560034923, 'bull_time_stop': 146, 'bull_use_sma': True, 'bull_use_ema': True, 'bull_use_atr': True, 'bull_use_adx': True, 'bull_use_spike': True, 'bull_rsi_required': True, 'bear_strategy': 'mean_reversion', 'bear_bb_std_mult': 3.4352272672539224, 'bear_rsi_os': 12, 'bear_rsi_ob': 45, 'bear_adx_thresh': 15.016479467364404, 'bear_atr_min_pct': 0.016740889274466316, 'bear_atr_max_pct': 0.04028451148520496, 'bear_tp_mult': 1.2642127142021065, 'bear_tsl_mult': 0.18218772328834726, 'bear_time_stop': 129, 'bear_use_sma': True, 'bear_use_ema': False, 'bear_use_atr': False, 'bear_use_adx': True, 'bear_use_spike': True, 'bear_rsi_required': False, 'sideways_strategy': 'breakout', 'sideways_bb_std_mult': 3.3131284978863906, 'sideways_rsi_os': 32, 'sideways_rsi_ob': 94, 'sideways_adx_thresh': 33.620358169324014, 'sideways_atr_min_pct': 0.018371008548851393, 'sideways_atr_max_pct': 0.07442698649441554, 'sideways_tp_mult': 1.3523763646746407, 'sideways_tsl_mult': 0.4058866354315375, 'sideways_time_stop': 109, 'sideways_use_sma': False, 'sideways_use_ema': False, 'sideways_use_atr': False, 'sideways_use_adx': True, 'sideways_use_spike': True, 'sideways_rsi_required': True}.
[I 2025-09-01 10:01:25,033] Trial 379 finished with values: [-1000000000.0, 1000000000.0] and parameters: {'p_sma': 21, 'p_std': 45, 'p_atr': 24, 'p_adx': 10, 'rsi_period': 64, 'ema1': 22, 'ema2': 50, 'slip_atr_k': 0.00016157878993033892, 'slip_spread_k': 0.97522845207845, 'spread_hl_frac': 0.04105514140623412, 'bb_std_mult': 3.1567116880352417, 'rsi_os': 31, 'rsi_ob': 56, 'vol_spike': 0.28252662249997673, 'adx_thresh': 5.997348511409247, 'atr_min_pct': 0.023350744947005238, 'atr_max_pct': 0.08212875221640287, 'tp_mult': 2.9544493396053952, 'tsl_mult': 0.41350590243762175, 'strategy': 'mean_reversion', 'time_stop': 160, 'use_sma': True, 'use_atr': True, 'use_adx': False, 'use_ema': True, 'use_spike': True, 'rsi_required': True, 'edge_k': 0.8690114904288857, 'edge_cap': 0.5933776523727626, 'bull_strategy': 'breakout', 'bull_bb_std_mult': 1.0210370324336082, 'bull_rsi_os': 5, 'bull_rsi_ob': 48, 'bull_adx_thresh': 31.173448011138902, 'bull_atr_min_pct': 0.029081712946497838, 'bull_atr_max_pct': 0.08574512499195273, 'bull_tp_mult': 1.2249093784404903, 'bull_tsl_mult': 0.05795409900189842, 'bull_time_stop': 145, 'bull_use_sma': True, 'bull_use_ema': True, 'bull_use_atr': True, 'bull_use_adx': True, 'bull_use_spike': True, 'bull_rsi_required': False, 'bear_strategy': 'breakout', 'bear_bb_std_mult': 3.446196758943078, 'bear_rsi_os': 22, 'bear_rsi_ob': 54, 'bear_adx_thresh': 12.57273073419163, 'bear_atr_min_pct': 0.0165655851732138, 'bear_atr_max_pct': 0.1351230928980035, 'bear_tp_mult': 1.2665082432360584, 'bear_tsl_mult': 0.056267328798872696, 'bear_time_stop': 139, 'bear_use_sma': True, 'bear_use_ema': False, 'bear_use_atr': False, 'bear_use_adx': True, 'bear_use_spike': True, 'bear_rsi_required': False, 'sideways_strategy': 'breakout', 'sideways_bb_std_mult': 3.252259674247026, 'sideways_rsi_os': 15, 'sideways_rsi_ob': 49, 'sideways_adx_thresh': 33.48348843292782, 'sideways_atr_min_pct': 0.021311608780395633, 'sideways_atr_max_pct': 0.048733912053541766, 'sideways_tp_mult': 2.3817179642485264, 'sideways_tsl_mult': 0.1356052824918626, 'sideways_time_stop': 208, 'sideways_use_sma': False, 'sideways_use_ema': False, 'sideways_use_atr': False, 'sideways_use_adx': True, 'sideways_use_spike': True, 'sideways_rsi_required': True}.
[I 2025-09-01 10:01:26,095] Trial 382 finished with values: [-1000000000.0, 1000000000.0] and parameters: {'p_sma': 23, 'p_std': 44, 'p_atr': 24, 'p_adx': 24, 'rsi_period': 16, 'ema1': 21, 'ema2': 52, 'slip_atr_k': 0.05131851978471015, 'slip_spread_k': 0.1640452997449894, 'spread_hl_frac': 0.028479816906292733, 'bb_std_mult': 2.9412030897491626, 'rsi_os': 29, 'rsi_ob': 48, 'vol_spike': 0.2873382911999214, 'adx_thresh': 9.378771659821494, 'atr_min_pct': 0.022568571675808797, 'atr_max_pct': 0.11709589977437697, 'tp_mult': 2.7677569163973748, 'tsl_mult': 0.39880902893936876, 'strategy': 'breakout', 'time_stop': 150, 'use_sma': True, 'use_atr': True, 'use_adx': False, 'use_ema': False, 'use_spike': False, 'rsi_required': True, 'edge_k': 0.28017081595110604, 'edge_cap': 0.28851435386882096, 'bull_strategy': 'breakout', 'bull_bb_std_mult': 0.9537555046950967, 'bull_rsi_os': 20, 'bull_rsi_ob': 87, 'bull_adx_thresh': 20.66540378267358, 'bull_atr_min_pct': 0.029096507263120127, 'bull_atr_max_pct': 0.08585186665875759, 'bull_tp_mult': 2.655410350975528, 'bull_tsl_mult': 0.05761406986751935, 'bull_time_stop': 47, 'bull_use_sma': True, 'bull_use_ema': True, 'bull_use_atr': True, 'bull_use_adx': True, 'bull_use_spike': False, 'bull_rsi_required': True, 'bear_strategy': 'mean_reversion', 'bear_bb_std_mult': 2.4743189510484638, 'bear_rsi_os': 48, 'bear_rsi_ob': 45, 'bear_adx_thresh': 33.48105729619114, 'bear_atr_min_pct': 0.024473717247812086, 'bear_atr_max_pct': 0.06668638826228727, 'bear_tp_mult': 1.2433451058799414, 'bear_tsl_mult': 0.8401738485055159, 'bear_time_stop': 23, 'bear_use_sma': True, 'bear_use_ema': False, 'bear_use_atr': False, 'bear_use_adx': True, 'bear_use_spike': True, 'bear_rsi_required': False, 'sideways_strategy': 'breakout', 'sideways_bb_std_mult': 1.7412458850535044, 'sideways_rsi_os': 49, 'sideways_rsi_ob': 94, 'sideways_adx_thresh': 33.13690759096905, 'sideways_atr_min_pct': 0.02123619302446643, 'sideways_atr_max_pct': 0.02080907315100721, 'sideways_tp_mult': 2.0874566715043383, 'sideways_tsl_mult': 0.7703094438098639, 'sideways_time_stop': 202, 'sideways_use_sma': False, 'sideways_use_ema': True, 'sideways_use_atr': False, 'sideways_use_adx': True, 'sideways_use_spike': True, 'sideways_rsi_required': True}.
[I 2025-09-01 10:01:26,357] Trial 381 finished with values: [-1000000000.0, 1000000000.0] and parameters: {'p_sma': 40, 'p_std': 51, 'p_atr': 22, 'p_adx': 22, 'rsi_period': 16, 'ema1': 21, 'ema2': 52, 'slip_atr_k': 0.01160830199055951, 'slip_spread_k': 0.748849199535608, 'spread_hl_frac': 0.042380974700417365, 'bb_std_mult': 3.1661236052857826, 'rsi_os': 29, 'rsi_ob': 45, 'vol_spike': 0.09924346412863201, 'adx_thresh': 5.949794301878417, 'atr_min_pct': 0.023455777042945686, 'atr_max_pct': 0.031002860528464363, 'tp_mult': 2.5625780703992267, 'tsl_mult': 0.07020575183051575, 'strategy': 'breakout', 'time_stop': 147, 'use_sma': True, 'use_atr': True, 'use_adx': False, 'use_ema': False, 'use_spike': True, 'rsi_required': True, 'edge_k': 0.9524880606971875, 'edge_cap': 0.5448237642701584, 'bull_strategy': 'breakout', 'bull_bb_std_mult': 0.7733589871488667, 'bull_rsi_os': 20, 'bull_rsi_ob': 55, 'bull_adx_thresh': 27.5554427872884, 'bull_atr_min_pct': 0.019884941252237213, 'bull_atr_max_pct': 0.08568236575273462, 'bull_tp_mult': 1.4794285321642706, 'bull_tsl_mult': 0.2044453054436698, 'bull_time_stop': 145, 'bull_use_sma': True, 'bull_use_ema': True, 'bull_use_atr': True, 'bull_use_adx': True, 'bull_use_spike': True, 'bull_rsi_required': True, 'bear_strategy': 'breakout', 'bear_bb_std_mult': 2.9418917345009565, 'bear_rsi_os': 41, 'bear_rsi_ob': 54, 'bear_adx_thresh': 33.06260897191723, 'bear_atr_min_pct': 0.016666742445985348, 'bear_atr_max_pct': 0.07435032448214153, 'bear_tp_mult': 1.262969071280696, 'bear_tsl_mult': 0.18931219611072414, 'bear_time_stop': 281, 'bear_use_sma': True, 'bear_use_ema': False, 'bear_use_atr': False, 'bear_use_adx': True, 'bear_use_spike': True, 'bear_rsi_required': False, 'sideways_strategy': 'breakout', 'sideways_bb_std_mult': 3.2366402600802653, 'sideways_rsi_os': 5, 'sideways_rsi_ob': 57, 'sideways_adx_thresh': 9.177707429724995, 'sideways_atr_min_pct': 0.018017161772006473, 'sideways_atr_max_pct': 0.08028677518749582, 'sideways_tp_mult': 2.8686529233794578, 'sideways_tsl_mult': 0.4270556758551428, 'sideways_time_stop': 204, 'sideways_use_sma': False, 'sideways_use_ema': True, 'sideways_use_atr': False, 'sideways_use_adx': True, 'sideways_use_spike': True, 'sideways_rsi_required': True}.
[I 2025-09-01 10:02:04,887] Trial 383 finished with values: [-1000000000.0, 1000000000.0] and parameters: {'p_sma': 23, 'p_std': 51, 'p_atr': 27, 'p_adx': 24, 'rsi_period': 75, 'ema1': 21, 'ema2': 46, 'slip_atr_k': 0.0870740907923907, 'slip_spread_k': 0.974998749614604, 'spread_hl_frac': 0.028333396988459218, 'bb_std_mult': 1.1818765654488645, 'rsi_os': 47, 'rsi_ob': 78, 'vol_spike': 0.28814932369959484, 'adx_thresh': 5.850956857248387, 'atr_min_pct': 0.022523569790651038, 'atr_max_pct': 0.08686641752215299, 'tp_mult': 2.2368536900938043, 'tsl_mult': 0.40450092489718764, 'strategy': 'breakout', 'time_stop': 141, 'use_sma': True, 'use_atr': True, 'use_adx': False, 'use_ema': False, 'use_spike': False, 'rsi_required': False, 'edge_k': 1.8498894010789957, 'edge_cap': 0.38433698890271606, 'bull_strategy': 'mean_reversion', 'bull_bb_std_mult': 1.8187169725231405, 'bull_rsi_os': 50, 'bull_rsi_ob': 52, 'bull_adx_thresh': 30.409311689051098, 'bull_atr_min_pct': 0.029181178175799155, 'bull_atr_max_pct': 0.11067743231969844, 'bull_tp_mult': 1.9254748747025372, 'bull_tsl_mult': 0.05433866825926808, 'bull_time_stop': 158, 'bull_use_sma': True, 'bull_use_ema': False, 'bull_use_atr': True, 'bull_use_adx': True, 'bull_use_spike': False, 'bull_rsi_required': True, 'bear_strategy': 'mean_reversion', 'bear_bb_std_mult': 2.979123216132078, 'bear_rsi_os': 41, 'bear_rsi_ob': 45, 'bear_adx_thresh': 11.730463084693977, 'bear_atr_min_pct': 0.029905266256307482, 'bear_atr_max_pct': 0.050868983144413876, 'bear_tp_mult': 1.226868584111113, 'bear_tsl_mult': 0.839345106552108, 'bear_time_stop': 141, 'bear_use_sma': False, 'bear_use_ema': True, 'bear_use_atr': False, 'bear_use_adx': False, 'bear_use_spike': True, 'bear_rsi_required': False, 'sideways_strategy': 'breakout', 'sideways_bb_std_mult': 2.963512643964239, 'sideways_rsi_os': 5, 'sideways_rsi_ob': 49, 'sideways_adx_thresh': 28.242927362804053, 'sideways_atr_min_pct': 0.009896059287820419, 'sideways_atr_max_pct': 0.08108635378965491, 'sideways_tp_mult': 2.6102822686944114, 'sideways_tsl_mult': 0.12568646893858948, 'sideways_time_stop': 201, 'sideways_use_sma': False, 'sideways_use_ema': True, 'sideways_use_atr': True, 'sideways_use_adx': True, 'sideways_use_spike': False, 'sideways_rsi_required': False}.
[I 2025-09-01 10:02:05,796] Trial 386 finished with values: [-1000000000.0, 1000000000.0] and parameters: {'p_sma': 60, 'p_std': 47, 'p_atr': 8, 'p_adx': 23, 'rsi_period': 26, 'ema1': 28, 'ema2': 60, 'slip_atr_k': 0.01952667585375109, 'slip_spread_k': 0.16219248767179528, 'spread_hl_frac': 0.02482390842793626, 'bb_std_mult': 3.2371373019537764, 'rsi_os': 18, 'rsi_ob': 78, 'vol_spike': 0.2729140605866867, 'adx_thresh': 30.455082946042012, 'atr_min_pct': 0.0033083314610274344, 'atr_max_pct': 0.04732047840699905, 'tp_mult': 2.6980741180368053, 'tsl_mult': 0.032410426424817125, 'strategy': 'breakout', 'time_stop': 140, 'use_sma': False, 'use_atr': False, 'use_adx': True, 'use_ema': False, 'use_spike': False, 'rsi_required': False, 'edge_k': 0.9538615575817314, 'edge_cap': 0.6123142091590252, 'bull_strategy': 'mean_reversion', 'bull_bb_std_mult': 1.8035006262136717, 'bull_rsi_os': 21, 'bull_rsi_ob': 53, 'bull_adx_thresh': 5.013118784350828, 'bull_atr_min_pct': 0.02935293558611075, 'bull_atr_max_pct': 0.10850455626532113, 'bull_tp_mult': 2.3825280280893075, 'bull_tsl_mult': 0.4400841661640895, 'bull_time_stop': 186, 'bull_use_sma': False, 'bull_use_ema': False, 'bull_use_atr': True, 'bull_use_adx': True, 'bull_use_spike': False, 'bull_rsi_required': True, 'bear_strategy': 'mean_reversion', 'bear_bb_std_mult': 1.4521710962040322, 'bear_rsi_os': 48, 'bear_rsi_ob': 88, 'bear_adx_thresh': 11.869711321676053, 'bear_atr_min_pct': 0.017687569804380063, 'bear_atr_max_pct': 0.0331468447750632, 'bear_tp_mult': 1.0700093763411864, 'bear_tsl_mult': 0.4949291913871445, 'bear_time_stop': 158, 'bear_use_sma': False, 'bear_use_ema': True, 'bear_use_atr': True, 'bear_use_adx': False, 'bear_use_spike': True, 'bear_rsi_required': False, 'sideways_strategy': 'breakout', 'sideways_bb_std_mult': 3.410743036406213, 'sideways_rsi_os': 50, 'sideways_rsi_ob': 69, 'sideways_adx_thresh': 5.017810363746307, 'sideways_atr_min_pct': 0.010027796532213723, 'sideways_atr_max_pct': 0.06682658562484171, 'sideways_tp_mult': 1.4372269450616466, 'sideways_tsl_mult': 0.6964799142961422, 'sideways_time_stop': 194, 'sideways_use_sma': True, 'sideways_use_ema': True, 'sideways_use_atr': True, 'sideways_use_adx': False, 'sideways_use_spike': False, 'sideways_rsi_required': False}.
[I 2025-09-01 10:02:06,522] Trial 385 finished with values: [-0.0337572924874574, 0.0335201667609974] and parameters: {'p_sma': 60, 'p_std': 52, 'p_atr': 28, 'p_adx': 26, 'rsi_period': 10, 'ema1': 25, 'ema2': 30, 'slip_atr_k': 0.20744540409915022, 'slip_spread_k': 0.8939959106189083, 'spread_hl_frac': 0.0282442697154701, 'bb_std_mult': 0.8210432544326562, 'rsi_os': 22, 'rsi_ob': 78, 'vol_spike': 0.27035988848328857, 'adx_thresh': 6.18092869549914, 'atr_min_pct': 0.02570875919794575, 'atr_max_pct': 0.06569367398815705, 'tp_mult': 1.1103012484230779, 'tsl_mult': 0.4412676121664184, 'strategy': 'breakout', 'time_stop': 24, 'use_sma': False, 'use_atr': False, 'use_adx': True, 'use_ema': False, 'use_spike': False, 'rsi_required': False, 'edge_k': 1.0291064825585603, 'edge_cap': 0.607704287844341, 'bull_strategy': 'mean_reversion', 'bull_bb_std_mult': 3.5505493219796476, 'bull_rsi_os': 50, 'bull_rsi_ob': 53, 'bull_adx_thresh': 30.54684583465538, 'bull_atr_min_pct': 0.0292866524506083, 'bull_atr_max_pct': 0.03183577524080031, 'bull_tp_mult': 1.9506483304539575, 'bull_tsl_mult': 0.8753566373629149, 'bull_time_stop': 159, 'bull_use_sma': False, 'bull_use_ema': False, 'bull_use_atr': True, 'bull_use_adx': True, 'bull_use_spike': False, 'bull_rsi_required': True, 'bear_strategy': 'mean_reversion', 'bear_bb_std_mult': 3.350487070297005, 'bear_rsi_os': 46, 'bear_rsi_ob': 47, 'bear_adx_thresh': 11.918296045618657, 'bear_atr_min_pct': 0.01728947849595555, 'bear_atr_max_pct': 0.1392964993670499, 'bear_tp_mult': 2.8140233547281044, 'bear_tsl_mult': 0.5725852021652226, 'bear_time_stop': 156, 'bear_use_sma': False, 'bear_use_ema': True, 'bear_use_atr': True, 'bear_use_adx': False, 'bear_use_spike': True, 'bear_rsi_required': False, 'sideways_strategy': 'breakout', 'sideways_bb_std_mult': 3.425549716765584, 'sideways_rsi_os': 50, 'sideways_rsi_ob': 52, 'sideways_adx_thresh': 26.49194392463023, 'sideways_atr_min_pct': 0.003854898883098583, 'sideways_atr_max_pct': 0.06696997479303271, 'sideways_tp_mult': 1.426003039524723, 'sideways_tsl_mult': 0.875832175158209, 'sideways_time_stop': 290, 'sideways_use_sma': True, 'sideways_use_ema': True, 'sideways_use_atr': True, 'sideways_use_adx': False, 'sideways_use_spike': False, 'sideways_rsi_required': False}.
[I 2025-09-01 10:02:06,777] Trial 384 finished with values: [-0.08260547515458316, 0.08248837933760778] and parameters: {'p_sma': 60, 'p_std': 52, 'p_atr': 7, 'p_adx': 22, 'rsi_period': 62, 'ema1': 21, 'ema2': 46, 'slip_atr_k': 0.0670073590340332, 'slip_spread_k': 0.22021273941691555, 'spread_hl_frac': 0.028450097710965783, 'bb_std_mult': 1.2862696839296568, 'rsi_os': 29, 'rsi_ob': 71, 'vol_spike': 0.2754546105128691, 'adx_thresh': 6.142376535764053, 'atr_min_pct': 0.024246710707221956, 'atr_max_pct': 0.09434481610123624, 'tp_mult': 2.2174580269588655, 'tsl_mult': 0.03968331033373754, 'strategy': 'breakout', 'time_stop': 141, 'use_sma': False, 'use_atr': False, 'use_adx': True, 'use_ema': False, 'use_spike': False, 'rsi_required': False, 'edge_k': 0.9320736998478486, 'edge_cap': 0.5292580786370382, 'bull_strategy': 'mean_reversion', 'bull_bb_std_mult': 2.4328377705970565, 'bull_rsi_os': 21, 'bull_rsi_ob': 55, 'bull_adx_thresh': 30.495672037250735, 'bull_atr_min_pct': 0.012380730808966574, 'bull_atr_max_pct': 0.03000416211446922, 'bull_tp_mult': 2.3442973183343785, 'bull_tsl_mult': 0.05143578694643491, 'bull_time_stop': 159, 'bull_use_sma': False, 'bull_use_ema': False, 'bull_use_atr': True, 'bull_use_adx': True, 'bull_use_spike': False, 'bull_rsi_required': True, 'bear_strategy': 'mean_reversion', 'bear_bb_std_mult': 3.330680347748966, 'bear_rsi_os': 19, 'bear_rsi_ob': 45, 'bear_adx_thresh': 6.128604212730247, 'bear_atr_min_pct': 0.008698017984842096, 'bear_atr_max_pct': 0.06769028571746967, 'bear_tp_mult': 2.696657152875053, 'bear_tsl_mult': 0.5804913345870842, 'bear_time_stop': 290, 'bear_use_sma': False, 'bear_use_ema': True, 'bear_use_atr': True, 'bear_use_adx': False, 'bear_use_spike': True, 'bear_rsi_required': False, 'sideways_strategy': 'breakout', 'sideways_bb_std_mult': 3.4173767192587485, 'sideways_rsi_os': 49, 'sideways_rsi_ob': 49, 'sideways_adx_thresh': 26.47280614700447, 'sideways_atr_min_pct': 0.004092508230088383, 'sideways_atr_max_pct': 0.06691078375278588, 'sideways_tp_mult': 1.2621343371197309, 'sideways_tsl_mult': 0.42674914909046785, 'sideways_time_stop': 285, 'sideways_use_sma': True, 'sideways_use_ema': True, 'sideways_use_atr': True, 'sideways_use_adx': False, 'sideways_use_spike': False, 'sideways_rsi_required': False}.
