[I 2025-09-01 10:25:37,249] Trial 531 finished with values: [-1000000000.0, 1000000000.0] and parameters: {'p_sma': 6, 'p_std': 48, 'p_atr': 29, 'p_adx': 18, 'rsi_period': 63, 'ema1': 20, 'ema2': 49, 'slip_atr_k': 0.07541345411594692, 'slip_spread_k': 0.6317151084524479, 'spread_hl_frac': 0.02633994370057083, 'bb_std_mult': 1.4419174959156633, 'rsi_os': 49, 'rsi_ob': 75, 'vol_spike': 0.13059496163630785, 'adx_thresh': 5.3834177519952595, 'atr_min_pct': 0.006237688090132223, 'atr_max_pct': 0.07535941693010366, 'tp_mult': 2.7555641093963446, 'tsl_mult': 0.625395772107336, 'strategy': 'breakout', 'time_stop': 158, 'use_sma': True, 'use_atr': False, 'use_adx': True, 'use_ema': False, 'use_spike': False, 'rsi_required': False, 'edge_k': 1.044710122850033, 'edge_cap': 0.6172953847032135, 'bull_strategy': 'mean_reversion', 'bull_bb_std_mult': 1.0829740167377244, 'bull_rsi_os': 55, 'bull_rsi_ob': 55, 'bull_adx_thresh': 33.211464627402876, 'bull_atr_min_pct': 0.029378421788144354, 'bull_atr_max_pct': 0.128755109054085, 'bull_tp_mult': 1.877970443204751, 'bull_tsl_mult': 0.07816149844944169, 'bull_time_stop': 40, 'bull_use_sma': True, 'bull_use_ema': False, 'bull_use_atr': True, 'bull_use_adx': True, 'bull_use_spike': False, 'bull_rsi_required': True, 'bear_strategy': 'mean_reversion', 'bear_bb_std_mult': 1.0893252628254433, 'bear_rsi_os': 45, 'bear_rsi_ob': 89, 'bear_adx_thresh': 25.83664441515101, 'bear_atr_min_pct': 0.020239249140852487, 'bear_atr_max_pct': 0.07046632577942155, 'bear_tp_mult': 1.3500703704317076, 'bear_tsl_mult': 0.2679362694953539, 'bear_time_stop': 151, 'bear_use_sma': False, 'bear_use_ema': True, 'bear_use_atr': True, 'bear_use_adx': False, 'bear_use_spike': True, 'bear_rsi_required': False, 'sideways_strategy': 'breakout', 'sideways_bb_std_mult': 3.5358050611686664, 'sideways_rsi_os': 50, 'sideways_rsi_ob': 84, 'sideways_adx_thresh': 26.43732310715182, 'sideways_atr_min_pct': 0.0026309866161510712, 'sideways_atr_max_pct': 0.0745365521561058, 'sideways_tp_mult': 2.187821675596407, 'sideways_tsl_mult': 0.0011415519042740074, 'sideways_time_stop': 212, 'sideways_use_sma': False, 'sideways_use_ema': True, 'sideways_use_atr': False, 'sideways_use_adx': False, 'sideways_use_spike': False, 'sideways_rsi_required': False}.
[I 2025-09-01 10:25:38,295] Trial 532 finished with values: [-0.17631636254147143, 0.1761362823357222] and parameters: {'p_sma': 25, 'p_std': 14, 'p_atr': 8, 'p_adx': 18, 'rsi_period': 63, 'ema1': 24, 'ema2': 55, 'slip_atr_k': 0.20126537909075504, 'slip_spread_k': 0.0812550739788091, 'spread_hl_frac': 0.02845293886565222, 'bb_std_mult': 1.4375435644649026, 'rsi_os': 26, 'rsi_ob': 75, 'vol_spike': 0.27535672260400973, 'adx_thresh': 24.819958802490994, 'atr_min_pct': 0.022562355668894758, 'atr_max_pct': 0.09065605143864978, 'tp_mult': 2.787848952733563, 'tsl_mult': 0.15254101467763842, 'strategy': 'breakout', 'time_stop': 96, 'use_sma': True, 'use_atr': False, 'use_adx': True, 'use_ema': False, 'use_spike': False, 'rsi_required': False, 'edge_k': 0.7392329004017564, 'edge_cap': 0.618260171108983, 'bull_strategy': 'mean_reversion', 'bull_bb_std_mult': 1.082632324594649, 'bull_rsi_os': 27, 'bull_rsi_ob': 46, 'bull_adx_thresh': 5.583376339788223, 'bull_atr_min_pct': 0.002214690667703769, 'bull_atr_max_pct': 0.11016136724426716, 'bull_tp_mult': 1.3962010760514172, 'bull_tsl_mult': 0.39760318076372014, 'bull_time_stop': 148, 'bull_use_sma': True, 'bull_use_ema': False, 'bull_use_atr': True, 'bull_use_adx': True, 'bull_use_spike': False, 'bull_rsi_required': True, 'bear_strategy': 'mean_reversion', 'bear_bb_std_mult': 3.469867631007498, 'bear_rsi_os': 49, 'bear_rsi_ob': 52, 'bear_adx_thresh': 25.398328050977142, 'bear_atr_min_pct': 0.020091353056723067, 'bear_atr_max_pct': 0.07031668204155675, 'bear_tp_mult': 1.1310455493627707, 'bear_tsl_mult': 0.3993696530060045, 'bear_time_stop': 87, 'bear_use_sma': False, 'bear_use_ema': True, 'bear_use_atr': True, 'bear_use_adx': False, 'bear_use_spike': True, 'bear_rsi_required': False, 'sideways_strategy': 'breakout', 'sideways_bb_std_mult': 3.4285762259026655, 'sideways_rsi_os': 14, 'sideways_rsi_ob': 49, 'sideways_adx_thresh': 26.563218242152875, 'sideways_atr_min_pct': 0.002592097512241484, 'sideways_atr_max_pct': 0.07386734577133626, 'sideways_tp_mult': 1.3484069775607304, 'sideways_tsl_mult': 0.8848941624935446, 'sideways_time_stop': 188, 'sideways_use_sma': False, 'sideways_use_ema': True, 'sideways_use_atr': False, 'sideways_use_adx': False, 'sideways_use_spike': False, 'sideways_rsi_required': False}.
[I 2025-09-01 10:26:20,116] Trial 533 finished with values: [-0.07270305125376797, 0.07254132229691021] and parameters: {'p_sma': 25, 'p_std': 42, 'p_atr': 30, 'p_adx': 20, 'rsi_period': 63, 'ema1': 26, 'ema2': 13, 'slip_atr_k': 0.042179844080787524, 'slip_spread_k': 0.0881220581770914, 'spread_hl_frac': 0.028317263421228263, 'bb_std_mult': 3.0770129316415247, 'rsi_os': 24, 'rsi_ob': 75, 'vol_spike': 0.2942903986985137, 'adx_thresh': 16.70257375870655, 'atr_min_pct': 0.022782206644066005, 'atr_max_pct': 0.028686814112586168, 'tp_mult': 2.776459455057069, 'tsl_mult': 0.6420113618501535, 'strategy': 'breakout', 'time_stop': 143, 'use_sma': True, 'use_atr': False, 'use_adx': True, 'use_ema': False, 'use_spike': False, 'rsi_required': False, 'edge_k': 0.9766931172573011, 'edge_cap': 0.7664107186941815, 'bull_strategy': 'mean_reversion', 'bull_bb_std_mult': 1.1119951078477364, 'bull_rsi_os': 55, 'bull_rsi_ob': 46, 'bull_adx_thresh': 24.299954970383524, 'bull_atr_min_pct': 0.029320272177230294, 'bull_atr_max_pct': 0.0811477751123232, 'bull_tp_mult': 1.8273145758741476, 'bull_tsl_mult': 0.07578743534404861, 'bull_time_stop': 137, 'bull_use_sma': True, 'bull_use_ema': False, 'bull_use_atr': True, 'bull_use_adx': True, 'bull_use_spike': False, 'bull_rsi_required': True, 'bear_strategy': 'mean_reversion', 'bear_bb_std_mult': 3.526453397432363, 'bear_rsi_os': 49, 'bear_rsi_ob': 95, 'bear_adx_thresh': 16.43271216614019, 'bear_atr_min_pct': 0.017612123795007102, 'bear_atr_max_pct': 0.07110224469386262, 'bear_tp_mult': 1.7660477766547595, 'bear_tsl_mult': 0.5243190301722064, 'bear_time_stop': 114, 'bear_use_sma': False, 'bear_use_ema': True, 'bear_use_atr': True, 'bear_use_adx': False, 'bear_use_spike': True, 'bear_rsi_required': False, 'sideways_strategy': 'mean_reversion', 'sideways_bb_std_mult': 3.5393701514457723, 'sideways_rsi_os': 14, 'sideways_rsi_ob': 49, 'sideways_adx_thresh': 6.786532961385548, 'sideways_atr_min_pct': 0.001305403888229268, 'sideways_atr_max_pct': 0.07412117503449539, 'sideways_tp_mult': 1.3471597869766234, 'sideways_tsl_mult': 0.4334069736749103, 'sideways_time_stop': 213, 'sideways_use_sma': False, 'sideways_use_ema': True, 'sideways_use_atr': True, 'sideways_use_adx': False, 'sideways_use_spike': False, 'sideways_rsi_required': False}.
[I 2025-09-01 10:26:20,957] Trial 534 finished with values: [-0.028188591298780152, 0.02831723806168762] and parameters: {'p_sma': 8, 'p_std': 14, 'p_atr': 14, 'p_adx': 18, 'rsi_period': 63, 'ema1': 20, 'ema2': 44, 'slip_atr_k': 0.07521598141601721, 'slip_spread_k': 0.22056540599328908, 'spread_hl_frac': 0.04983290804645998, 'bb_std_mult': 3.084042828717884, 'rsi_os': 54, 'rsi_ob': 77, 'vol_spike': 0.29471862895915185, 'adx_thresh': 24.87748556035704, 'atr_min_pct': 0.014774913125758881, 'atr_max_pct': 0.027581384167798838, 'tp_mult': 2.5858375847695254, 'tsl_mult': 0.7170923800747788, 'strategy': 'breakout', 'time_stop': 143, 'use_sma': False, 'use_atr': False, 'use_adx': True, 'use_ema': False, 'use_spike': False, 'rsi_required': False, 'edge_k': 1.0297264114417708, 'edge_cap': 0.6217845335616432, 'bull_strategy': 'mean_reversion', 'bull_bb_std_mult': 1.6563108774920041, 'bull_rsi_os': 14, 'bull_rsi_ob': 55, 'bull_adx_thresh': 34.52648046339697, 'bull_atr_min_pct': 0.0020903052250353816, 'bull_atr_max_pct': 0.08278957900607449, 'bull_tp_mult': 1.8392064563814823, 'bull_tsl_mult': 0.636506236148664, 'bull_time_stop': 41, 'bull_use_sma': True, 'bull_use_ema': False, 'bull_use_atr': True, 'bull_use_adx': True, 'bull_use_spike': False, 'bull_rsi_required': True, 'bear_strategy': 'mean_reversion', 'bear_bb_std_mult': 2.4064620224012874, 'bear_rsi_os': 45, 'bear_rsi_ob': 46, 'bear_adx_thresh': 16.25400199978751, 'bear_atr_min_pct': 0.0173643048670867, 'bear_atr_max_pct': 0.10067727577127189, 'bear_tp_mult': 1.209497301659005, 'bear_tsl_mult': 0.47238899540061574, 'bear_time_stop': 254, 'bear_use_sma': False, 'bear_use_ema': True, 'bear_use_atr': True, 'bear_use_adx': False, 'bear_use_spike': True, 'bear_rsi_required': False, 'sideways_strategy': 'mean_reversion', 'sideways_bb_std_mult': 3.544639880325937, 'sideways_rsi_os': 16, 'sideways_rsi_ob': 49, 'sideways_adx_thresh': 17.551719223044962, 'sideways_atr_min_pct': 0.006136515187704044, 'sideways_atr_max_pct': 0.06690407091252319, 'sideways_tp_mult': 1.2907581094108698, 'sideways_tsl_mult': 0.4331834216389525, 'sideways_time_stop': 212, 'sideways_use_sma': False, 'sideways_use_ema': True, 'sideways_use_atr': True, 'sideways_use_adx': False, 'sideways_use_spike': False, 'sideways_rsi_required': False}.
[I 2025-09-01 10:26:22,722] Trial 535 finished with values: [-1000000000.0, 1000000000.0] and parameters: {'p_sma': 23, 'p_std': 42, 'p_atr': 14, 'p_adx': 21, 'rsi_period': 62, 'ema1': 21, 'ema2': 55, 'slip_atr_k': 0.21070688523605874, 'slip_spread_k': 0.21362117636118846, 'spread_hl_frac': 0.028031257036048945, 'bb_std_mult': 3.0871045589904456, 'rsi_os': 39, 'rsi_ob': 79, 'vol_spike': 0.29360287125691, 'adx_thresh': 6.9498012893517584, 'atr_min_pct': 0.01650213576339971, 'atr_max_pct': 0.08116330882335704, 'tp_mult': 2.5994985276827376, 'tsl_mult': 0.8237992714050577, 'strategy': 'breakout', 'time_stop': 144, 'use_sma': False, 'use_atr': False, 'use_adx': True, 'use_ema': False, 'use_spike': False, 'rsi_required': False, 'edge_k': 0.9936090934401888, 'edge_cap': 0.6103150128263405, 'bull_strategy': 'mean_reversion', 'bull_bb_std_mult': 1.0102875489573253, 'bull_rsi_os': 25, 'bull_rsi_ob': 57, 'bull_adx_thresh': 22.5397421021882, 'bull_atr_min_pct': 0.028853564187270506, 'bull_atr_max_pct': 0.08294915060335409, 'bull_tp_mult': 1.8390632496319645, 'bull_tsl_mult': 0.9404454407820618, 'bull_time_stop': 161, 'bull_use_sma': True, 'bull_use_ema': False, 'bull_use_atr': True, 'bull_use_adx': True, 'bull_use_spike': False, 'bull_rsi_required': True, 'bear_strategy': 'mean_reversion', 'bear_bb_std_mult': 0.5120720066117541, 'bear_rsi_os': 22, 'bear_rsi_ob': 46, 'bear_adx_thresh': 16.378396687941045, 'bear_atr_min_pct': 0.017370048823454724, 'bear_atr_max_pct': 0.0661152686973547, 'bear_tp_mult': 1.1501847026462522, 'bear_tsl_mult': 0.4325550509027425, 'bear_time_stop': 99, 'bear_use_sma': False, 'bear_use_ema': True, 'bear_use_atr': True, 'bear_use_adx': False, 'bear_use_spike': True, 'bear_rsi_required': False, 'sideways_strategy': 'mean_reversion', 'sideways_bb_std_mult': 3.4314157067955366, 'sideways_rsi_os': 49, 'sideways_rsi_ob': 49, 'sideways_adx_thresh': 10.34025027340088, 'sideways_atr_min_pct': 0.0050496250316550365, 'sideways_atr_max_pct': 0.03713644076645581, 'sideways_tp_mult': 1.3423138544672926, 'sideways_tsl_mult': 0.8161953500815509, 'sideways_time_stop': 84, 'sideways_use_sma': False, 'sideways_use_ema': True, 'sideways_use_atr': True, 'sideways_use_adx': False, 'sideways_use_spike': False, 'sideways_rsi_required': False}.
[I 2025-09-01 10:26:23,058] Trial 536 finished with values: [-1000000000.0, 1000000000.0] and parameters: {'p_sma': 59, 'p_std': 42, 'p_atr': 14, 'p_adx': 21, 'rsi_period': 61, 'ema1': 21, 'ema2': 44, 'slip_atr_k': 0.21141128649740237, 'slip_spread_k': 0.4180462373246052, 'spread_hl_frac': 0.04989179545337674, 'bb_std_mult': 3.4713405016472687, 'rsi_os': 54, 'rsi_ob': 79, 'vol_spike': 0.06065096657779971, 'adx_thresh': 7.330311468675475, 'atr_min_pct': 0.02942146354635569, 'atr_max_pct': 0.0806466359094485, 'tp_mult': 1.966720798929953, 'tsl_mult': 0.39446352099896353, 'strategy': 'breakout', 'time_stop': 167, 'use_sma': False, 'use_atr': True, 'use_adx': False, 'use_ema': False, 'use_spike': False, 'rsi_required': False, 'edge_k': 0.9819495064113724, 'edge_cap': 0.48631810484747945, 'bull_strategy': 'mean_reversion', 'bull_bb_std_mult': 2.8740612569161037, 'bull_rsi_os': 7, 'bull_rsi_ob': 69, 'bull_adx_thresh': 6.642308186810202, 'bull_atr_min_pct': 0.029410272180545493, 'bull_atr_max_pct': 0.08298346484230565, 'bull_tp_mult': 1.8534571555578163, 'bull_tsl_mult': 0.019168631795108658, 'bull_time_stop': 33, 'bull_use_sma': True, 'bull_use_ema': False, 'bull_use_atr': False, 'bull_use_adx': True, 'bull_use_spike': False, 'bull_rsi_required': True, 'bear_strategy': 'mean_reversion', 'bear_bb_std_mult': 2.131510137837269, 'bear_rsi_os': 48, 'bear_rsi_ob': 46, 'bear_adx_thresh': 13.98020598403876, 'bear_atr_min_pct': 0.010442418505120163, 'bear_atr_max_pct': 0.017807481393735808, 'bear_tp_mult': 2.7862754334964, 'bear_tsl_mult': 0.4719031190216897, 'bear_time_stop': 129, 'bear_use_sma': False, 'bear_use_ema': True, 'bear_use_atr': False, 'bear_use_adx': False, 'bear_use_spike': False, 'bear_rsi_required': False, 'sideways_strategy': 'mean_reversion', 'sideways_bb_std_mult': 2.4625423737120187, 'sideways_rsi_os': 37, 'sideways_rsi_ob': 51, 'sideways_adx_thresh': 10.176596653586328, 'sideways_atr_min_pct': 0.01014269501947175, 'sideways_atr_max_pct': 0.06701555575044561, 'sideways_tp_mult': 1.2935540812023547, 'sideways_tsl_mult': 0.6951006486171559, 'sideways_time_stop': 99, 'sideways_use_sma': False, 'sideways_use_ema': True, 'sideways_use_atr': True, 'sideways_use_adx': True, 'sideways_use_spike': False, 'sideways_rsi_required': False}.
[I 2025-09-01 10:27:09,625] Trial 538 finished with values: [-1000000000.0, 1000000000.0] and parameters: {'p_sma': 22, 'p_std': 44, 'p_atr': 29, 'p_adx': 8, 'rsi_period': 68, 'ema1': 21, 'ema2': 56, 'slip_atr_k': 0.023128264492989867, 'slip_spread_k': 0.20348488454139493, 'spread_hl_frac': 0.02975089061758411, 'bb_std_mult': 3.467924765969037, 'rsi_os': 29, 'rsi_ob': 79, 'vol_spike': 0.28700933795148764, 'adx_thresh': 34.366592062125335, 'atr_min_pct': 0.028766880500517598, 'atr_max_pct': 0.07840513876012015, 'tp_mult': 2.6771741227521546, 'tsl_mult': 0.011408204688075711, 'strategy': 'breakout', 'time_stop': 257, 'use_sma': False, 'use_atr': True, 'use_adx': False, 'use_ema': True, 'use_spike': True, 'rsi_required': False, 'edge_k': 0.8126793886359607, 'edge_cap': 0.4982542782222361, 'bull_strategy': 'breakout', 'bull_bb_std_mult': 1.0135527563987552, 'bull_rsi_os': 21, 'bull_rsi_ob': 57, 'bull_adx_thresh': 6.614757391675521, 'bull_atr_min_pct': 0.005755598115581373, 'bull_atr_max_pct': 0.03766417812597709, 'bull_tp_mult': 1.9197150308935205, 'bull_tsl_mult': 0.013859243762017304, 'bull_time_stop': 235, 'bull_use_sma': False, 'bull_use_ema': False, 'bull_use_atr': False, 'bull_use_adx': True, 'bull_use_spike': True, 'bull_rsi_required': False, 'bear_strategy': 'breakout', 'bear_bb_std_mult': 0.9227591020321497, 'bear_rsi_os': 46, 'bear_rsi_ob': 45, 'bear_adx_thresh': 21.929861317837368, 'bear_atr_min_pct': 0.009067256130459507, 'bear_atr_max_pct': 0.13607404521405625, 'bear_tp_mult': 1.1606645319987774, 'bear_tsl_mult': 0.4335021679322295, 'bear_time_stop': 134, 'bear_use_sma': False, 'bear_use_ema': True, 'bear_use_atr': False, 'bear_use_adx': False, 'bear_use_spike': False, 'bear_rsi_required': True, 'sideways_strategy': 'breakout', 'sideways_bb_std_mult': 1.3542252038052274, 'sideways_rsi_os': 34, 'sideways_rsi_ob': 64, 'sideways_adx_thresh': 27.937896712055576, 'sideways_atr_min_pct': 0.0034883889536328557, 'sideways_atr_max_pct': 0.10494319077274276, 'sideways_tp_mult': 2.767795774780653, 'sideways_tsl_mult': 0.698165402996781, 'sideways_time_stop': 184, 'sideways_use_sma': True, 'sideways_use_ema': True, 'sideways_use_atr': False, 'sideways_use_adx': True, 'sideways_use_spike': False, 'sideways_rsi_required': False}.
[I 2025-09-01 10:27:10,468] Trial 537 finished with values: [-1000000000.0, 1000000000.0] and parameters: {'p_sma': 23, 'p_std': 44, 'p_atr': 14, 'p_adx': 21, 'rsi_period': 68, 'ema1': 21, 'ema2': 30, 'slip_atr_k': 0.21036887986341293, 'slip_spread_k': 0.20537981503469507, 'spread_hl_frac': 0.047607136629173596, 'bb_std_mult': 2.6626710870523755, 'rsi_os': 15, 'rsi_ob': 77, 'vol_spike': 0.13835021405896478, 'adx_thresh': 7.252516036391086, 'atr_min_pct': 0.011473076035607295, 'atr_max_pct': 0.11071629661723809, 'tp_mult': 2.2629701426700968, 'tsl_mult': 0.7147751149211278, 'strategy': 'breakout', 'time_stop': 248, 'use_sma': False, 'use_atr': True, 'use_adx': False, 'use_ema': False, 'use_spike': False, 'rsi_required': False, 'edge_k': 1.6753666918061136, 'edge_cap': 0.5516574422041638, 'bull_strategy': 'mean_reversion', 'bull_bb_std_mult': 1.0080597453991265, 'bull_rsi_os': 9, 'bull_rsi_ob': 57, 'bull_adx_thresh': 6.5939280951476755, 'bull_atr_min_pct': 0.02888802698309093, 'bull_atr_max_pct': 0.08226917363379285, 'bull_tp_mult': 2.6973350678600583, 'bull_tsl_mult': 0.016178358874894126, 'bull_time_stop': 160, 'bull_use_sma': False, 'bull_use_ema': False, 'bull_use_atr': False, 'bull_use_adx': True, 'bull_use_spike': False, 'bull_rsi_required': True, 'bear_strategy': 'mean_reversion', 'bear_bb_std_mult': 2.3826284278238856, 'bear_rsi_os': 46, 'bear_rsi_ob': 46, 'bear_adx_thresh': 6.441138287805208, 'bear_atr_min_pct': 0.02200063818373086, 'bear_atr_max_pct': 0.06424459493162929, 'bear_tp_mult': 1.169345322128315, 'bear_tsl_mult': 0.4743666172364633, 'bear_time_stop': 127, 'bear_use_sma': False, 'bear_use_ema': True, 'bear_use_atr': False, 'bear_use_adx': False, 'bear_use_spike': False, 'bear_rsi_required': True, 'sideways_strategy': 'mean_reversion', 'sideways_bb_std_mult': 2.451405728979529, 'sideways_rsi_os': 45, 'sideways_rsi_ob': 51, 'sideways_adx_thresh': 10.242430761719094, 'sideways_atr_min_pct': 0.006065703075984943, 'sideways_atr_max_pct': 0.06596692110452587, 'sideways_tp_mult': 2.7679640039917266, 'sideways_tsl_mult': 0.10186404206466054, 'sideways_time_stop': 206, 'sideways_use_sma': False, 'sideways_use_ema': True, 'sideways_use_atr': True, 'sideways_use_adx': True, 'sideways_use_spike': False, 'sideways_rsi_required': False}.
[I 2025-09-01 10:27:11,531] Trial 540 finished with values: [-1000000000.0, 1000000000.0] and parameters: {'p_sma': 23, 'p_std': 44, 'p_atr': 29, 'p_adx': 23, 'rsi_period': 26, 'ema1': 10, 'ema2': 21, 'slip_atr_k': 0.05504692186415307, 'slip_spread_k': 0.23751734250774476, 'spread_hl_frac': 0.04595612339575039, 'bb_std_mult': 2.6683577571852806, 'rsi_os': 30, 'rsi_ob': 77, 'vol_spike': 0.15557556152891142, 'adx_thresh': 8.305791475306926, 'atr_min_pct': 0.0052442178764644, 'atr_max_pct': 0.0773737834729646, 'tp_mult': 2.2687306620182177, 'tsl_mult': 0.0015115824121654658, 'strategy': 'mean_reversion', 'time_stop': 265, 'use_sma': True, 'use_atr': True, 'use_adx': False, 'use_ema': True, 'use_spike': True, 'rsi_required': True, 'edge_k': 1.6808537289635774, 'edge_cap': 0.5561569514091811, 'bull_strategy': 'breakout', 'bull_bb_std_mult': 0.8934974294211687, 'bull_rsi_os': 52, 'bull_rsi_ob': 54, 'bull_adx_thresh': 6.221310810746657, 'bull_atr_min_pct': 0.029970439967871364, 'bull_atr_max_pct': 0.1155064519153442, 'bull_tp_mult': 1.9104952492591083, 'bull_tsl_mult': 0.0403959543243078, 'bull_time_stop': 154, 'bull_use_sma': False, 'bull_use_ema': True, 'bull_use_atr': False, 'bull_use_adx': False, 'bull_use_spike': True, 'bull_rsi_required': False, 'bear_strategy': 'breakout', 'bear_bb_std_mult': 3.3985052634165394, 'bear_rsi_os': 16, 'bear_rsi_ob': 60, 'bear_adx_thresh': 12.929639158220326, 'bear_atr_min_pct': 0.015625076154481478, 'bear_atr_max_pct': 0.10746577794194956, 'bear_tp_mult': 1.2584557166381891, 'bear_tsl_mult': 0.3992769346728794, 'bear_time_stop': 124, 'bear_use_sma': True, 'bear_use_ema': True, 'bear_use_atr': False, 'bear_use_adx': True, 'bear_use_spike': False, 'bear_rsi_required': True, 'sideways_strategy': 'breakout', 'sideways_bb_std_mult': 3.2223674917784693, 'sideways_rsi_os': 46, 'sideways_rsi_ob': 47, 'sideways_adx_thresh': 27.920166829653976, 'sideways_atr_min_pct': 0.00367498891888763, 'sideways_atr_max_pct': 0.040885914114443055, 'sideways_tp_mult': 1.5149198496453358, 'sideways_tsl_mult': 0.859003301077259, 'sideways_time_stop': 297, 'sideways_use_sma': True, 'sideways_use_ema': True, 'sideways_use_atr': False, 'sideways_use_adx': True, 'sideways_use_spike': True, 'sideways_rsi_required': True}.
