[I 2025-09-01 09:09:13,913] Trial 71 finished with values: [-0.1426525207476108, 0.14242656606702653] and parameters: {'p_sma': 10, 'p_std': 60, 'p_atr': 19, 'p_adx': 7, 'rsi_period': 19, 'ema1': 23, 'ema2': 44, 'slip_atr_k': 0.24913282555155586, 'slip_spread_k': 0.8923114758337178, 'spread_hl_frac': 0.01125039604584175, 'bb_std_mult': 2.02373253536969, 'rsi_os': 7, 'rsi_ob': 81, 'vol_spike': 0.27655581967957155, 'adx_thresh': 23.71152408661323, 'atr_min_pct': 0.014000597655062973, 'atr_max_pct': 0.13095115860449044, 'tp_mult': 1.3290624114238907, 'tsl_mult': 0.10160060234068416, 'strategy': 'mean_reversion', 'time_stop': 10, 'use_sma': False, 'use_atr': False, 'use_adx': True, 'use_ema': False, 'use_spike': True, 'rsi_required': False, 'edge_k': 1.7497390580483572, 'edge_cap': 0.6791001147076768, 'bull_strategy': 'breakout', 'bull_bb_std_mult': 2.291381449247946, 'bull_rsi_os': 47, 'bull_rsi_ob': 52, 'bull_adx_thresh': 17.746770672640178, 'bull_atr_min_pct': 0.021484842841162484, 'bull_atr_max_pct': 0.12910972914485785, 'bull_tp_mult': 2.620301935758658, 'bull_tsl_mult': 0.6855444641681941, 'bull_time_stop': 267, 'bull_use_sma': True, 'bull_use_ema': True, 'bull_use_atr': True, 'bull_use_adx': False, 'bull_use_spike': True, 'bull_rsi_required': True, 'bear_strategy': 'mean_reversion', 'bear_bb_std_mult': 2.325798968902526, 'bear_rsi_os': 24, 'bear_rsi_ob': 47, 'bear_adx_thresh': 14.803083703303232, 'bear_atr_min_pct': 0.01202218028833699, 'bear_atr_max_pct': 0.1087025380236996, 'bear_tp_mult': 1.779532282869843, 'bear_tsl_mult': 0.8672578361880366, 'bear_time_stop': 135, 'bear_use_sma': False, 'bear_use_ema': False, 'bear_use_atr': True, 'bear_use_adx': False, 'bear_use_spike': False, 'bear_rsi_required': False, 'sideways_strategy': 'breakout', 'sideways_bb_std_mult': 2.1879706500448437, 'sideways_rsi_os': 41, 'sideways_rsi_ob': 68, 'sideways_adx_thresh': 17.81238479026249, 'sideways_atr_min_pct': 0.0018940062390272383, 'sideways_atr_max_pct': 0.050591974986593125, 'sideways_tp_mult': 1.7239750127487077, 'sideways_tsl_mult': 0.1355930519764359, 'sideways_time_stop': 222, 'sideways_use_sma': False, 'sideways_use_ema': False, 'sideways_use_atr': False, 'sideways_use_adx': False, 'sideways_use_spike': False, 'sideways_rsi_required': False}.
[I 2025-09-01 09:09:15,840] Trial 73 finished with values: [-0.0707373064020812, 0.07087854601847814] and parameters: {'p_sma': 10, 'p_std': 47, 'p_atr': 19, 'p_adx': 10, 'rsi_period': 10, 'ema1': 23, 'ema2': 41, 'slip_atr_k': 0.07675347098073212, 'slip_spread_k': 0.8349075218709323, 'spread_hl_frac': 0.010253582341775902, 'bb_std_mult': 0.659649862586422, 'rsi_os': 6, 'rsi_ob': 83, 'vol_spike': 0.28511588144459765, 'adx_thresh': 26.86039109445951, 'atr_min_pct': 0.01428786363327767, 'atr_max_pct': 0.028263374324037194, 'tp_mult': 1.3717140492153441, 'tsl_mult': 0.08933531277691546, 'strategy': 'mean_reversion', 'time_stop': 67, 'use_sma': False, 'use_atr': False, 'use_adx': True, 'use_ema': False, 'use_spike': True, 'rsi_required': False, 'edge_k': 1.5659071534200155, 'edge_cap': 0.9923499082858014, 'bull_strategy': 'breakout', 'bull_bb_std_mult': 2.3519097389844896, 'bull_rsi_os': 51, 'bull_rsi_ob': 52, 'bull_adx_thresh': 18.838599565716258, 'bull_atr_min_pct': 0.02110383909427473, 'bull_atr_max_pct': 0.12205682874169584, 'bull_tp_mult': 2.6762681798641808, 'bull_tsl_mult': 0.8643459139509078, 'bull_time_stop': 264, 'bull_use_sma': True, 'bull_use_ema': True, 'bull_use_atr': False, 'bull_use_adx': False, 'bull_use_spike': True, 'bull_rsi_required': True, 'bear_strategy': 'mean_reversion', 'bear_bb_std_mult': 3.0215306650324805, 'bear_rsi_os': 23, 'bear_rsi_ob': 48, 'bear_adx_thresh': 10.758370827887681, 'bear_atr_min_pct': 0.012231175044188728, 'bear_atr_max_pct': 0.11685125084832865, 'bear_tp_mult': 1.7694929072585122, 'bear_tsl_mult': 0.8661669950853645, 'bear_time_stop': 133, 'bear_use_sma': False, 'bear_use_ema': False, 'bear_use_atr': True, 'bear_use_adx': False, 'bear_use_spike': False, 'bear_rsi_required': False, 'sideways_strategy': 'breakout', 'sideways_bb_std_mult': 2.1751331428206795, 'sideways_rsi_os': 47, 'sideways_rsi_ob': 63, 'sideways_adx_thresh': 17.881686304385312, 'sideways_atr_min_pct': 0.0022400168720040792, 'sideways_atr_max_pct': 0.06360313296142558, 'sideways_tp_mult': 2.089437903080004, 'sideways_tsl_mult': 0.12416955732788632, 'sideways_time_stop': 90, 'sideways_use_sma': False, 'sideways_use_ema': True, 'sideways_use_atr': False, 'sideways_use_adx': False, 'sideways_use_spike': False, 'sideways_rsi_required': False}.
[I 2025-09-01 09:09:56,317] Trial 77 finished with values: [-1000000000.0, 1000000000.0] and parameters: {'p_sma': 14, 'p_std': 51, 'p_atr': 8, 'p_adx': 9, 'rsi_period': 15, 'ema1': 25, 'ema2': 47, 'slip_atr_k': 0.09128521975103926, 'slip_spread_k': 0.7547424403177023, 'spread_hl_frac': 0.017609899165229974, 'bb_std_mult': 1.0417642767630537, 'rsi_os': 5, 'rsi_ob': 70, 'vol_spike': 0.2610936456428891, 'adx_thresh': 28.716691966963324, 'atr_min_pct': 0.02072035230839014, 'atr_max_pct': 0.12162698089737253, 'tp_mult': 2.36724436442186, 'tsl_mult': 0.005035390644031176, 'strategy': 'mean_reversion', 'time_stop': 53, 'use_sma': True, 'use_atr': False, 'use_adx': True, 'use_ema': False, 'use_spike': False, 'rsi_required': False, 'edge_k': 1.4117834736067116, 'edge_cap': 0.7657478135802687, 'bull_strategy': 'mean_reversion', 'bull_bb_std_mult': 2.103641611767176, 'bull_rsi_os': 50, 'bull_rsi_ob': 55, 'bull_adx_thresh': 20.460038592733085, 'bull_atr_min_pct': 0.024856942275728742, 'bull_atr_max_pct': 0.07727570395716025, 'bull_tp_mult': 1.2735210684528178, 'bull_tsl_mult': 0.5666633793736662, 'bull_time_stop': 290, 'bull_use_sma': True, 'bull_use_ema': False, 'bull_use_atr': True, 'bull_use_adx': False, 'bull_use_spike': False, 'bull_rsi_required': False, 'bear_strategy': 'mean_reversion', 'bear_bb_std_mult': 3.2315491670945002, 'bear_rsi_os': 27, 'bear_rsi_ob': 50, 'bear_adx_thresh': 19.61491248197243, 'bear_atr_min_pct': 0.007723908452200326, 'bear_atr_max_pct': 0.14939439997187215, 'bear_tp_mult': 1.5922625361170641, 'bear_tsl_mult': 0.5612133538724792, 'bear_time_stop': 166, 'bear_use_sma': False, 'bear_use_ema': True, 'bear_use_atr': True, 'bear_use_adx': False, 'bear_use_spike': False, 'bear_rsi_required': False, 'sideways_strategy': 'breakout', 'sideways_bb_std_mult': 1.765482049175367, 'sideways_rsi_os': 37, 'sideways_rsi_ob': 95, 'sideways_adx_thresh': 20.894775357944305, 'sideways_atr_min_pct': 0.006396998799980505, 'sideways_atr_max_pct': 0.053794896015476504, 'sideways_tp_mult': 2.2027591229087253, 'sideways_tsl_mult': 0.7072680930521441, 'sideways_time_stop': 235, 'sideways_use_sma': False, 'sideways_use_ema': False, 'sideways_use_atr': False, 'sideways_use_adx': False, 'sideways_use_spike': False, 'sideways_rsi_required': False}.
[I 2025-09-01 09:09:56,349] Trial 76 finished with values: [-1000000000.0, 1000000000.0] and parameters: {'p_sma': 8, 'p_std': 50, 'p_atr': 8, 'p_adx': 9, 'rsi_period': 16, 'ema1': 25, 'ema2': 47, 'slip_atr_k': 9.847706587109983e-05, 'slip_spread_k': 0.8419906701620705, 'spread_hl_frac': 0.01852642320516309, 'bb_std_mult': 1.0676932762890332, 'rsi_os': 5, 'rsi_ob': 70, 'vol_spike': 0.26311234775625886, 'adx_thresh': 28.32581182824059, 'atr_min_pct': 0.01538337970628121, 'atr_max_pct': 0.032185010107702784, 'tp_mult': 1.1915683584002634, 'tsl_mult': 0.19856483006559816, 'strategy': 'mean_reversion', 'time_stop': 70, 'use_sma': True, 'use_atr': False, 'use_adx': True, 'use_ema': False, 'use_spike': False, 'rsi_required': False, 'edge_k': 1.409191697072223, 'edge_cap': 0.7618033482592185, 'bull_strategy': 'mean_reversion', 'bull_bb_std_mult': 2.12560585625397, 'bull_rsi_os': 50, 'bull_rsi_ob': 56, 'bull_adx_thresh': 19.725316780414193, 'bull_atr_min_pct': 0.020873615086076547, 'bull_atr_max_pct': 0.07687532933608004, 'bull_tp_mult': 2.576079907088479, 'bull_tsl_mult': 0.5256840783182317, 'bull_time_stop': 291, 'bull_use_sma': True, 'bull_use_ema': False, 'bull_use_atr': False, 'bull_use_adx': False, 'bull_use_spike': False, 'bull_rsi_required': False, 'bear_strategy': 'mean_reversion', 'bear_bb_std_mult': 0.5239000690157116, 'bear_rsi_os': 13, 'bear_rsi_ob': 50, 'bear_adx_thresh': 13.146985447596695, 'bear_atr_min_pct': 0.0076022072235621425, 'bear_atr_max_pct': 0.14829017270778588, 'bear_tp_mult': 1.9847899832969527, 'bear_tsl_mult': 0.4591237523128577, 'bear_time_stop': 68, 'bear_use_sma': False, 'bear_use_ema': True, 'bear_use_atr': True, 'bear_use_adx': False, 'bear_use_spike': False, 'bear_rsi_required': False, 'sideways_strategy': 'breakout', 'sideways_bb_std_mult': 1.885101281419228, 'sideways_rsi_os': 47, 'sideways_rsi_ob': 95, 'sideways_adx_thresh': 24.076898590876265, 'sideways_atr_min_pct': 0.006197532977505088, 'sideways_atr_max_pct': 0.07730519252572748, 'sideways_tp_mult': 2.2251878508065763, 'sideways_tsl_mult': 0.41885150067524907, 'sideways_time_stop': 235, 'sideways_use_sma': False, 'sideways_use_ema': True, 'sideways_use_atr': False, 'sideways_use_adx': False, 'sideways_use_spike': False, 'sideways_rsi_required': False}.
[I 2025-09-01 09:09:57,038] Trial 74 finished with values: [-0.03408459487985549, 0.033825122122657286] and parameters: {'p_sma': 14, 'p_std': 47, 'p_atr': 8, 'p_adx': 9, 'rsi_period': 17, 'ema1': 25, 'ema2': 47, 'slip_atr_k': 0.07521076577677345, 'slip_spread_k': 0.7616102274837563, 'spread_hl_frac': 0.00862498808034164, 'bb_std_mult': 0.9850139750349511, 'rsi_os': 5, 'rsi_ob': 70, 'vol_spike': 0.24669541667767514, 'adx_thresh': 27.087385753256996, 'atr_min_pct': 0.020920369876447867, 'atr_max_pct': 0.12001894202956001, 'tp_mult': 2.02596057398757, 'tsl_mult': 0.10403384454857789, 'strategy': 'mean_reversion', 'time_stop': 44, 'use_sma': True, 'use_atr': False, 'use_adx': True, 'use_ema': False, 'use_spike': False, 'rsi_required': False, 'edge_k': 0.8053919087145396, 'edge_cap': 0.909709582791366, 'bull_strategy': 'mean_reversion', 'bull_bb_std_mult': 2.3603748290424944, 'bull_rsi_os': 49, 'bull_rsi_ob': 56, 'bull_adx_thresh': 19.48911382141643, 'bull_atr_min_pct': 0.024685127575557683, 'bull_atr_max_pct': 0.10973213234252384, 'bull_tp_mult': 2.433645138881342, 'bull_tsl_mult': 0.5230040607764104, 'bull_time_stop': 289, 'bull_use_sma': True, 'bull_use_ema': False, 'bull_use_atr': False, 'bull_use_adx': False, 'bull_use_spike': False, 'bull_rsi_required': False, 'bear_strategy': 'mean_reversion', 'bear_bb_std_mult': 1.563707512412135, 'bear_rsi_os': 28, 'bear_rsi_ob': 50, 'bear_adx_thresh': 12.9943233457467, 'bear_atr_min_pct': 0.00793779265003525, 'bear_atr_max_pct': 0.14621571331587568, 'bear_tp_mult': 1.6245092333441649, 'bear_tsl_mult': 0.8375856536155708, 'bear_time_stop': 71, 'bear_use_sma': False, 'bear_use_ema': True, 'bear_use_atr': True, 'bear_use_adx': False, 'bear_use_spike': False, 'bear_rsi_required': False, 'sideways_strategy': 'breakout', 'sideways_bb_std_mult': 2.3973602179141102, 'sideways_rsi_os': 46, 'sideways_rsi_ob': 77, 'sideways_adx_thresh': 33.12726633259885, 'sideways_atr_min_pct': 0.005672202940112383, 'sideways_atr_max_pct': 0.054578195889415135, 'sideways_tp_mult': 2.2003367706238897, 'sideways_tsl_mult': 0.3468856996597752, 'sideways_time_stop': 235, 'sideways_use_sma': False, 'sideways_use_ema': True, 'sideways_use_atr': False, 'sideways_use_adx': False, 'sideways_use_spike': False, 'sideways_rsi_required': False}.
[I 2025-09-01 09:09:57,333] Trial 75 finished with values: [-1000000000.0, 1000000000.0] and parameters: {'p_sma': 8, 'p_std': 48, 'p_atr': 8, 'p_adx': 9, 'rsi_period': 15, 'ema1': 25, 'ema2': 41, 'slip_atr_k': 0.07739783640240565, 'slip_spread_k': 0.7740135688656057, 'spread_hl_frac': 0.010327181375468765, 'bb_std_mult': 0.9923190606559489, 'rsi_os': 5, 'rsi_ob': 70, 'vol_spike': 0.032163365095428414, 'adx_thresh': 26.46528870478567, 'atr_min_pct': 0.021415967960054533, 'atr_max_pct': 0.12291133998254077, 'tp_mult': 2.387270528020893, 'tsl_mult': 0.20543981142354634, 'strategy': 'mean_reversion', 'time_stop': 68, 'use_sma': True, 'use_atr': False, 'use_adx': True, 'use_ema': False, 'use_spike': False, 'rsi_required': False, 'edge_k': 0.8253500959083849, 'edge_cap': 0.7630188581427745, 'bull_strategy': 'mean_reversion', 'bull_bb_std_mult': 2.3925601612129896, 'bull_rsi_os': 49, 'bull_rsi_ob': 57, 'bull_adx_thresh': 19.299270581356904, 'bull_atr_min_pct': 0.02471996830306623, 'bull_atr_max_pct': 0.1114225982148605, 'bull_tp_mult': 2.431980715085455, 'bull_tsl_mult': 0.5248927367004754, 'bull_time_stop': 291, 'bull_use_sma': True, 'bull_use_ema': False, 'bull_use_atr': False, 'bull_use_adx': False, 'bull_use_spike': False, 'bull_rsi_required': False, 'bear_strategy': 'mean_reversion', 'bear_bb_std_mult': 3.2008627197757917, 'bear_rsi_os': 22, 'bear_rsi_ob': 50, 'bear_adx_thresh': 15.923266594485003, 'bear_atr_min_pct': 0.007648579889693738, 'bear_atr_max_pct': 0.1472900725918274, 'bear_tp_mult': 1.431677717088748, 'bear_tsl_mult': 0.8446603491013385, 'bear_time_stop': 73, 'bear_use_sma': False, 'bear_use_ema': True, 'bear_use_atr': True, 'bear_use_adx': False, 'bear_use_spike': False, 'bear_rsi_required': False, 'sideways_strategy': 'breakout', 'sideways_bb_std_mult': 1.8840089856265552, 'sideways_rsi_os': 46, 'sideways_rsi_ob': 48, 'sideways_adx_thresh': 25.029109410497995, 'sideways_atr_min_pct': 0.0060036475168063356, 'sideways_atr_max_pct': 0.0633612428855959, 'sideways_tp_mult': 2.2443931870530776, 'sideways_tsl_mult': 0.06324576163296752, 'sideways_time_stop': 235, 'sideways_use_sma': False, 'sideways_use_ema': True, 'sideways_use_atr': False, 'sideways_use_adx': False, 'sideways_use_spike': False, 'sideways_rsi_required': False}.
[I 2025-09-01 09:10:37,441] Trial 79 finished with values: [-0.1313344074656787, 0.13108187900920545] and parameters: {'p_sma': 42, 'p_std': 54, 'p_atr': 16, 'p_adx': 25, 'rsi_period': 19, 'ema1': 22, 'ema2': 41, 'slip_atr_k': 0.16177097112494546, 'slip_spread_k': 0.9639145835298397, 'spread_hl_frac': 0.008755557024672586, 'bb_std_mult': 1.222000920862797, 'rsi_os': 11, 'rsi_ob': 66, 'vol_spike': 0.20557316951405094, 'adx_thresh': 25.75161303896004, 'atr_min_pct': 0.0177854313611792, 'atr_max_pct': 0.11956747890716317, 'tp_mult': 1.8161155996656124, 'tsl_mult': 0.2956636621000389, 'strategy': 'mean_reversion', 'time_stop': 43, 'use_sma': True, 'use_atr': False, 'use_adx': True, 'use_ema': False, 'use_spike': False, 'rsi_required': False, 'edge_k': 1.923204445003389, 'edge_cap': 0.9093358685179194, 'bull_strategy': 'breakout', 'bull_bb_std_mult': 1.92188645184254, 'bull_rsi_os': 43, 'bull_rsi_ob': 50, 'bull_adx_thresh': 18.964023702879008, 'bull_atr_min_pct': 0.014524874155966129, 'bull_atr_max_pct': 0.09784859710487873, 'bull_tp_mult': 2.923919799833402, 'bull_tsl_mult': 0.7148973611139443, 'bull_time_stop': 251, 'bull_use_sma': True, 'bull_use_ema': False, 'bull_use_atr': True, 'bull_use_adx': False, 'bull_use_spike': True, 'bull_rsi_required': False, 'bear_strategy': 'mean_reversion', 'bear_bb_std_mult': 3.530972140419989, 'bear_rsi_os': 29, 'bear_rsi_ob': 53, 'bear_adx_thresh': 5.1469871858009455, 'bear_atr_min_pct': 0.010123713261265814, 'bear_atr_max_pct': 0.08673933156396724, 'bear_tp_mult': 2.123051146887205, 'bear_tsl_mult': 0.9936639786116774, 'bear_time_stop': 98, 'bear_use_sma': False, 'bear_use_ema': False, 'bear_use_atr': True, 'bear_use_adx': False, 'bear_use_spike': False, 'bear_rsi_required': False, 'sideways_strategy': 'breakout', 'sideways_bb_std_mult': 2.409636658177912, 'sideways_rsi_os': 38, 'sideways_rsi_ob': 77, 'sideways_adx_thresh': 16.53975272715877, 'sideways_atr_min_pct': 0.0028484556195716403, 'sideways_atr_max_pct': 0.024918670410790655, 'sideways_tp_mult': 2.35310861298739, 'sideways_tsl_mult': 0.8064723849506656, 'sideways_time_stop': 213, 'sideways_use_sma': False, 'sideways_use_ema': False, 'sideways_use_atr': False, 'sideways_use_adx': False, 'sideways_use_spike': False, 'sideways_rsi_required': False}.
[I 2025-09-01 09:10:38,466] Trial 80 finished with values: [-1000000000.0, 0.38038639999565427] and parameters: {'p_sma': 43, 'p_std': 8, 'p_atr': 17, 'p_adx': 8, 'rsi_period': 62, 'ema1': 24, 'ema2': 41, 'slip_atr_k': 0.07216982400234312, 'slip_spread_k': 0.7763456171187609, 'spread_hl_frac': 0.012031152254703196, 'bb_std_mult': 1.5363499386157298, 'rsi_os': 11, 'rsi_ob': 75, 'vol_spike': 0.24522551882555543, 'adx_thresh': 21.857745644471343, 'atr_min_pct': 0.01803977260885055, 'atr_max_pct': 0.14366537187647643, 'tp_mult': 2.206834557096078, 'tsl_mult': 0.07840219614654066, 'strategy': 'mean_reversion', 'time_stop': 43, 'use_sma': False, 'use_atr': False, 'use_adx': True, 'use_ema': False, 'use_spike': False, 'rsi_required': False, 'edge_k': 0.7968709492994277, 'edge_cap': 0.9187171456744823, 'bull_strategy': 'breakout', 'bull_bb_std_mult': 1.9134581293637827, 'bull_rsi_os': 43, 'bull_rsi_ob': 46, 'bull_adx_thresh': 18.91364354526134, 'bull_atr_min_pct': 0.016713035852897844, 'bull_atr_max_pct': 0.09717369115500436, 'bull_tp_mult': 2.4492553656545994, 'bull_tsl_mult': 0.531820002910772, 'bull_time_stop': 296, 'bull_use_sma': True, 'bull_use_ema': True, 'bull_use_atr': True, 'bull_use_adx': False, 'bull_use_spike': True, 'bull_rsi_required': False, 'bear_strategy': 'mean_reversion', 'bear_bb_std_mult': 1.9826271896143004, 'bear_rsi_os': 22, 'bear_rsi_ob': 45, 'bear_adx_thresh': 12.577477404977715, 'bear_atr_min_pct': 0.01081965004958569, 'bear_atr_max_pct': 0.10462051456149524, 'bear_tp_mult': 2.1476695715059186, 'bear_tsl_mult': 0.8366978581369614, 'bear_time_stop': 97, 'bear_use_sma': False, 'bear_use_ema': False, 'bear_use_atr': True, 'bear_use_adx': False, 'bear_use_spike': False, 'bear_rsi_required': False, 'sideways_strategy': 'breakout', 'sideways_bb_std_mult': 2.3834244576550914, 'sideways_rsi_os': 44, 'sideways_rsi_ob': 54, 'sideways_adx_thresh': 31.89455974957872, 'sideways_atr_min_pct': 0.0010161453187888425, 'sideways_atr_max_pct': 0.06590500572954207, 'sideways_tp_mult': 2.337682253459849, 'sideways_tsl_mult': 0.21733928460089613, 'sideways_time_stop': 213, 'sideways_use_sma': False, 'sideways_use_ema': False, 'sideways_use_atr': False, 'sideways_use_adx': False, 'sideways_use_spike': False, 'sideways_rsi_required': False}.
[I 2025-09-01 09:10:38,882] Trial 78 finished with values: [-1000000000.0, 1000000000.0] and parameters: {'p_sma': 12, 'p_std': 54, 'p_atr': 16, 'p_adx': 25, 'rsi_period': 19, 'ema1': 22, 'ema2': 41, 'slip_atr_k': 0.15715836128903415, 'slip_spread_k': 0.9628056758884195, 'spread_hl_frac': 0.01156504964968668, 'bb_std_mult': 1.2162519484022405, 'rsi_os': 12, 'rsi_ob': 75, 'vol_spike': 0.03775501590428218, 'adx_thresh': 17.733795958392783, 'atr_min_pct': 0.02268315558996628, 'atr_max_pct': 0.14228942310172682, 'tp_mult': 2.2148068356299278, 'tsl_mult': 0.30201033583291836, 'strategy': 'mean_reversion', 'time_stop': 36, 'use_sma': True, 'use_atr': False, 'use_adx': True, 'use_ema': False, 'use_spike': False, 'rsi_required': False, 'edge_k': 0.7865504514598709, 'edge_cap': 0.9627062317225032, 'bull_strategy': 'breakout', 'bull_bb_std_mult': 2.4204389493829557, 'bull_rsi_os': 39, 'bull_rsi_ob': 50, 'bull_adx_thresh': 15.527627119102478, 'bull_atr_min_pct': 0.015002414960395859, 'bull_atr_max_pct': 0.04212187957291019, 'bull_tp_mult': 2.4020554942641756, 'bull_tsl_mult': 0.6538359429375425, 'bull_time_stop': 299, 'bull_use_sma': True, 'bull_use_ema': False, 'bull_use_atr': True, 'bull_use_adx': False, 'bull_use_spike': True, 'bull_rsi_required': False, 'bear_strategy': 'mean_reversion', 'bear_bb_std_mult': 1.6032695987974925, 'bear_rsi_os': 22, 'bear_rsi_ob': 46, 'bear_adx_thresh': 15.823980802361003, 'bear_atr_min_pct': 0.010910934160808228, 'bear_atr_max_pct': 0.08761839769174211, 'bear_tp_mult': 2.1348477547334204, 'bear_tsl_mult': 0.9989750955478783, 'bear_time_stop': 104, 'bear_use_sma': False, 'bear_use_ema': False, 'bear_use_atr': True, 'bear_use_adx': False, 'bear_use_spike': False, 'bear_rsi_required': False, 'sideways_strategy': 'breakout', 'sideways_bb_std_mult': 2.3985387987710953, 'sideways_rsi_os': 38, 'sideways_rsi_ob': 77, 'sideways_adx_thresh': 32.7989372419725, 'sideways_atr_min_pct': 0.005183520981359973, 'sideways_atr_max_pct': 0.024354201248948475, 'sideways_tp_mult': 2.2916874299009646, 'sideways_tsl_mult': 0.29631107750487573, 'sideways_time_stop': 246, 'sideways_use_sma': False, 'sideways_use_ema': False, 'sideways_use_atr': False, 'sideways_use_adx': False, 'sideways_use_spike': False, 'sideways_rsi_required': False}.
