[I 2025-09-01 09:21:05,325] Trial 144 finished with values: [-0.0808307259453559, 0.08078626743337129] and parameters: {'p_sma': 52, 'p_std': 19, 'p_atr': 16, 'p_adx': 24, 'rsi_period': 74, 'ema1': 22, 'ema2': 49, 'slip_atr_k': 0.007301283574153536, 'slip_spread_k': 0.2052393672040021, 'spread_hl_frac': 0.016558412254978387, 'bb_std_mult': 0.5808459531369374, 'rsi_os': 15, 'rsi_ob': 90, 'vol_spike': 0.22367891651318134, 'adx_thresh': 6.330874662769735, 'atr_min_pct': 0.027611478446861834, 'atr_max_pct': 0.1414470323166243, 'tp_mult': 1.7129009499362575, 'tsl_mult': 0.019112191519672056, 'strategy': 'breakout', 'time_stop': 101, 'use_sma': True, 'use_atr': False, 'use_adx': True, 'use_ema': False, 'use_spike': False, 'rsi_required': True, 'edge_k': 1.0526502777955609, 'edge_cap': 0.7049060901884964, 'bull_strategy': 'mean_reversion', 'bull_bb_std_mult': 2.62127261788926, 'bull_rsi_os': 41, 'bull_rsi_ob': 51, 'bull_adx_thresh': 28.39850956632779, 'bull_atr_min_pct': 0.029472030272515735, 'bull_atr_max_pct': 0.058732151198665976, 'bull_tp_mult': 1.81395514403567, 'bull_tsl_mult': 0.07833507703827984, 'bull_time_stop': 92, 'bull_use_sma': True, 'bull_use_ema': False, 'bull_use_atr': False, 'bull_use_adx': False, 'bull_use_spike': False, 'bull_rsi_required': True, 'bear_strategy': 'mean_reversion', 'bear_bb_std_mult': 1.1471982971755057, 'bear_rsi_os': 45, 'bear_rsi_ob': 62, 'bear_adx_thresh': 10.231228163398454, 'bear_atr_min_pct': 0.017736689476256017, 'bear_atr_max_pct': 0.10321054229713718, 'bear_tp_mult': 2.3086727456607297, 'bear_tsl_mult': 0.4118266183986904, 'bear_time_stop': 207, 'bear_use_sma': False, 'bear_use_ema': True, 'bear_use_atr': True, 'bear_use_adx': False, 'bear_use_spike': False, 'bear_rsi_required': False, 'sideways_strategy': 'breakout', 'sideways_bb_std_mult': 1.664760180873574, 'sideways_rsi_os': 40, 'sideways_rsi_ob': 93, 'sideways_adx_thresh': 29.686254503402804, 'sideways_atr_min_pct': 0.0016505727967527609, 'sideways_atr_max_pct': 0.047436115998923126, 'sideways_tp_mult': 1.606759074954304, 'sideways_tsl_mult': 0.9588173466840479, 'sideways_time_stop': 220, 'sideways_use_sma': False, 'sideways_use_ema': True, 'sideways_use_atr': False, 'sideways_use_adx': False, 'sideways_use_spike': False, 'sideways_rsi_required': False}.
[I 2025-09-01 09:21:45,693] Trial 145 finished with values: [-0.013924530834793059, 0.013794749874024792] and parameters: {'p_sma': 26, 'p_std': 23, 'p_atr': 16, 'p_adx': 28, 'rsi_period': 64, 'ema1': 22, 'ema2': 14, 'slip_atr_k': 0.058903111961607094, 'slip_spread_k': 0.20525799022131394, 'spread_hl_frac': 0.013839193296566289, 'bb_std_mult': 1.8784725453270683, 'rsi_os': 9, 'rsi_ob': 81, 'vol_spike': 0.11127390178346283, 'adx_thresh': 6.631664653650965, 'atr_min_pct': 0.027197305242581685, 'atr_max_pct': 0.0755554762147137, 'tp_mult': 1.910841441828379, 'tsl_mult': 0.0003390760223273767, 'strategy': 'breakout', 'time_stop': 185, 'use_sma': True, 'use_atr': False, 'use_adx': False, 'use_ema': False, 'use_spike': False, 'rsi_required': True, 'edge_k': 1.3221074182856003, 'edge_cap': 0.21771817251855888, 'bull_strategy': 'mean_reversion', 'bull_bb_std_mult': 2.8374813763427102, 'bull_rsi_os': 34, 'bull_rsi_ob': 61, 'bull_adx_thresh': 28.202613106415335, 'bull_atr_min_pct': 0.01581459949165652, 'bull_atr_max_pct': 0.06753524625536948, 'bull_tp_mult': 2.2525020173872727, 'bull_tsl_mult': 0.04796550456641992, 'bull_time_stop': 116, 'bull_use_sma': True, 'bull_use_ema': False, 'bull_use_atr': False, 'bull_use_adx': False, 'bull_use_spike': False, 'bull_rsi_required': True, 'bear_strategy': 'mean_reversion', 'bear_bb_std_mult': 3.505257159365221, 'bear_rsi_os': 49, 'bear_rsi_ob': 88, 'bear_adx_thresh': 12.8795792889524, 'bear_atr_min_pct': 0.01762864219001864, 'bear_atr_max_pct': 0.11601794020942573, 'bear_tp_mult': 2.316556235785239, 'bear_tsl_mult': 0.6879592464164062, 'bear_time_stop': 65, 'bear_use_sma': False, 'bear_use_ema': True, 'bear_use_atr': False, 'bear_use_adx': False, 'bear_use_spike': False, 'bear_rsi_required': False, 'sideways_strategy': 'breakout', 'sideways_bb_std_mult': 0.501477594277615, 'sideways_rsi_os': 40, 'sideways_rsi_ob': 47, 'sideways_adx_thresh': 28.258839806220227, 'sideways_atr_min_pct': 0.003930382206809203, 'sideways_atr_max_pct': 0.05829510616676397, 'sideways_tp_mult': 1.8409279688706672, 'sideways_tsl_mult': 0.0015528848868495149, 'sideways_time_stop': 98, 'sideways_use_sma': True, 'sideways_use_ema': True, 'sideways_use_atr': False, 'sideways_use_adx': False, 'sideways_use_spike': False, 'sideways_rsi_required': False}.
[I 2025-09-01 09:21:45,684] Trial 146 finished with values: [-1000000000.0, 1000000000.0] and parameters: {'p_sma': 50, 'p_std': 28, 'p_atr': 16, 'p_adx': 24, 'rsi_period': 64, 'ema1': 30, 'ema2': 14, 'slip_atr_k': 0.0060067173721726486, 'slip_spread_k': 0.034153956034759125, 'spread_hl_frac': 0.016722068707843374, 'bb_std_mult': 1.8753443350301742, 'rsi_os': 11, 'rsi_ob': 54, 'vol_spike': 0.23548064340794556, 'adx_thresh': 10.821806200829343, 'atr_min_pct': 0.0008222235759663757, 'atr_max_pct': 0.14308169174914107, 'tp_mult': 1.8889221603912354, 'tsl_mult': 0.09480276468132026, 'strategy': 'breakout', 'time_stop': 132, 'use_sma': True, 'use_atr': False, 'use_adx': False, 'use_ema': False, 'use_spike': True, 'rsi_required': True, 'edge_k': 0.9988602904613592, 'edge_cap': 0.16400218621563795, 'bull_strategy': 'mean_reversion', 'bull_bb_std_mult': 3.4676637432153976, 'bull_rsi_os': 34, 'bull_rsi_ob': 51, 'bull_adx_thresh': 27.94250901126764, 'bull_atr_min_pct': 0.029601328551847172, 'bull_atr_max_pct': 0.12509369734113573, 'bull_tp_mult': 2.2416211943891313, 'bull_tsl_mult': 0.07781152086567186, 'bull_time_stop': 214, 'bull_use_sma': True, 'bull_use_ema': False, 'bull_use_atr': False, 'bull_use_adx': False, 'bull_use_spike': False, 'bull_rsi_required': True, 'bear_strategy': 'mean_reversion', 'bear_bb_std_mult': 1.1245165710867515, 'bear_rsi_os': 7, 'bear_rsi_ob': 62, 'bear_adx_thresh': 5.903842405423228, 'bear_atr_min_pct': 0.016132458960368665, 'bear_atr_max_pct': 0.11632189154665279, 'bear_tp_mult': 2.3135008868813074, 'bear_tsl_mult': 0.6964511452098193, 'bear_time_stop': 244, 'bear_use_sma': False, 'bear_use_ema': True, 'bear_use_atr': False, 'bear_use_adx': False, 'bear_use_spike': False, 'bear_rsi_required': False, 'sideways_strategy': 'breakout', 'sideways_bb_std_mult': 0.5345328737393602, 'sideways_rsi_os': 44, 'sideways_rsi_ob': 47, 'sideways_adx_thresh': 29.529247883221025, 'sideways_atr_min_pct': 0.015944477792545216, 'sideways_atr_max_pct': 0.0652095066134736, 'sideways_tp_mult': 1.8389783286411014, 'sideways_tsl_mult': 0.1056196583556972, 'sideways_time_stop': 220, 'sideways_use_sma': True, 'sideways_use_ema': True, 'sideways_use_atr': True, 'sideways_use_adx': False, 'sideways_use_spike': False, 'sideways_rsi_required': False}.
[I 2025-09-01 09:21:46,904] Trial 147 finished with values: [-0.04283081009271206, 0.042455810628483026] and parameters: {'p_sma': 53, 'p_std': 23, 'p_atr': 16, 'p_adx': 24, 'rsi_period': 36, 'ema1': 23, 'ema2': 14, 'slip_atr_k': 0.1944156453499265, 'slip_spread_k': 0.05076336580006657, 'spread_hl_frac': 0.016499669494692542, 'bb_std_mult': 1.8718881834588168, 'rsi_os': 11, 'rsi_ob': 90, 'vol_spike': 0.23575538016777417, 'adx_thresh': 34.72586977377124, 'atr_min_pct': 0.01921114663858605, 'atr_max_pct': 0.07571149469678388, 'tp_mult': 1.920010488063966, 'tsl_mult': 0.09465220099793493, 'strategy': 'breakout', 'time_stop': 201, 'use_sma': True, 'use_atr': False, 'use_adx': False, 'use_ema': False, 'use_spike': True, 'rsi_required': False, 'edge_k': 1.113550801107681, 'edge_cap': 0.7105279292068656, 'bull_strategy': 'mean_reversion', 'bull_bb_std_mult': 2.656599484498506, 'bull_rsi_os': 34, 'bull_rsi_ob': 51, 'bull_adx_thresh': 25.72228927616886, 'bull_atr_min_pct': 0.027457335909752703, 'bull_atr_max_pct': 0.0601271642706328, 'bull_tp_mult': 2.1734655649338683, 'bull_tsl_mult': 0.07875983532091088, 'bull_time_stop': 163, 'bull_use_sma': False, 'bull_use_ema': False, 'bull_use_atr': False, 'bull_use_adx': False, 'bull_use_spike': False, 'bull_rsi_required': True, 'bear_strategy': 'mean_reversion', 'bear_bb_std_mult': 1.1587162418539516, 'bear_rsi_os': 8, 'bear_rsi_ob': 70, 'bear_adx_thresh': 30.62364951863115, 'bear_atr_min_pct': 0.017865874285685715, 'bear_atr_max_pct': 0.1156304578768678, 'bear_tp_mult': 2.3204565218062587, 'bear_tsl_mult': 0.4052381502824005, 'bear_time_stop': 195, 'bear_use_sma': False, 'bear_use_ema': True, 'bear_use_atr': False, 'bear_use_adx': False, 'bear_use_spike': False, 'bear_rsi_required': False, 'sideways_strategy': 'breakout', 'sideways_bb_std_mult': 0.8826517290445289, 'sideways_rsi_os': 44, 'sideways_rsi_ob': 47, 'sideways_adx_thresh': 29.82956124966301, 'sideways_atr_min_pct': 0.004201812565826365, 'sideways_atr_max_pct': 0.0484234777593417, 'sideways_tp_mult': 1.8287997851263744, 'sideways_tsl_mult': 0.22439468399755924, 'sideways_time_stop': 215, 'sideways_use_sma': True, 'sideways_use_ema': True, 'sideways_use_atr': True, 'sideways_use_adx': False, 'sideways_use_spike': False, 'sideways_rsi_required': True}.
[I 2025-09-01 09:21:47,224] Trial 148 finished with values: [-0.04056650950404728, 0.04032432754234074] and parameters: {'p_sma': 54, 'p_std': 24, 'p_atr': 17, 'p_adx': 24, 'rsi_period': 32, 'ema1': 6, 'ema2': 14, 'slip_atr_k': 0.046707813565859804, 'slip_spread_k': 0.2478612705055838, 'spread_hl_frac': 0.024708532427273014, 'bb_std_mult': 1.8749846095555087, 'rsi_os': 11, 'rsi_ob': 56, 'vol_spike': 0.17749665839091183, 'adx_thresh': 6.905686242874703, 'atr_min_pct': 0.01907385665490878, 'atr_max_pct': 0.1344494013629556, 'tp_mult': 2.4206726528593987, 'tsl_mult': 0.364255025949159, 'strategy': 'breakout', 'time_stop': 202, 'use_sma': True, 'use_atr': False, 'use_adx': False, 'use_ema': True, 'use_spike': True, 'rsi_required': False, 'edge_k': 0.735296482904722, 'edge_cap': 0.14728116671771516, 'bull_strategy': 'mean_reversion', 'bull_bb_std_mult': 2.9714676672561007, 'bull_rsi_os': 17, 'bull_rsi_ob': 61, 'bull_adx_thresh': 32.4112414850031, 'bull_atr_min_pct': 0.004800817458532832, 'bull_atr_max_pct': 0.1261482927836467, 'bull_tp_mult': 2.186702427808916, 'bull_tsl_mult': 0.9030384178110711, 'bull_time_stop': 117, 'bull_use_sma': False, 'bull_use_ema': False, 'bull_use_atr': False, 'bull_use_adx': False, 'bull_use_spike': False, 'bull_rsi_required': True, 'bear_strategy': 'mean_reversion', 'bear_bb_std_mult': 3.5070129977588214, 'bear_rsi_os': 6, 'bear_rsi_ob': 89, 'bear_adx_thresh': 15.047683905414916, 'bear_atr_min_pct': 0.014433966970813278, 'bear_atr_max_pct': 0.1158569135378748, 'bear_tp_mult': 2.1986697789715373, 'bear_tsl_mult': 0.35612289943404707, 'bear_time_stop': 82, 'bear_use_sma': False, 'bear_use_ema': True, 'bear_use_atr': False, 'bear_use_adx': False, 'bear_use_spike': False, 'bear_rsi_required': False, 'sideways_strategy': 'breakout', 'sideways_bb_std_mult': 1.746940056319042, 'sideways_rsi_os': 39, 'sideways_rsi_ob': 47, 'sideways_adx_thresh': 29.102984091271153, 'sideways_atr_min_pct': 0.0038819969209698477, 'sideways_atr_max_pct': 0.11310643776258461, 'sideways_tp_mult': 1.2693320660004614, 'sideways_tsl_mult': 0.2345953515543348, 'sideways_time_stop': 97, 'sideways_use_sma': True, 'sideways_use_ema': True, 'sideways_use_atr': True, 'sideways_use_adx': False, 'sideways_use_spike': True, 'sideways_rsi_required': True}.
[I 2025-09-01 09:22:27,871] Trial 151 finished with values: [-1000000000.0, 1000000000.0] and parameters: {'p_sma': 26, 'p_std': 24, 'p_atr': 22, 'p_adx': 10, 'rsi_period': 61, 'ema1': 6, 'ema2': 30, 'slip_atr_k': 0.043547680580009226, 'slip_spread_k': 0.2383568824369483, 'spread_hl_frac': 0.006720251386259379, 'bb_std_mult': 1.6754519199939124, 'rsi_os': 9, 'rsi_ob': 89, 'vol_spike': 0.21569721559403068, 'adx_thresh': 18.250875066951863, 'atr_min_pct': 0.02006366498094701, 'atr_max_pct': 0.11241006875208835, 'tp_mult': 2.471258168462407, 'tsl_mult': 0.9644782886902594, 'strategy': 'breakout', 'time_stop': 164, 'use_sma': True, 'use_atr': False, 'use_adx': True, 'use_ema': True, 'use_spike': False, 'rsi_required': False, 'edge_k': 0.8983012838673755, 'edge_cap': 0.46606455600518615, 'bull_strategy': 'mean_reversion', 'bull_bb_std_mult': 3.0873523666857183, 'bull_rsi_os': 19, 'bull_rsi_ob': 61, 'bull_adx_thresh': 6.668689031986241, 'bull_atr_min_pct': 0.028101303204602423, 'bull_atr_max_pct': 0.06262437051473844, 'bull_tp_mult': 2.167390608725901, 'bull_tsl_mult': 0.12625042238882941, 'bull_time_stop': 131, 'bull_use_sma': False, 'bull_use_ema': False, 'bull_use_atr': False, 'bull_use_adx': True, 'bull_use_spike': False, 'bull_rsi_required': True, 'bear_strategy': 'mean_reversion', 'bear_bb_std_mult': 3.5138800377858526, 'bear_rsi_os': 37, 'bear_rsi_ob': 72, 'bear_adx_thresh': 33.33408668762804, 'bear_atr_min_pct': 0.019339788101177646, 'bear_atr_max_pct': 0.12570833013405014, 'bear_tp_mult': 2.2744228190469236, 'bear_tsl_mult': 0.3132655867025602, 'bear_time_stop': 261, 'bear_use_sma': False, 'bear_use_ema': True, 'bear_use_atr': True, 'bear_use_adx': False, 'bear_use_spike': False, 'bear_rsi_required': False, 'sideways_strategy': 'breakout', 'sideways_bb_std_mult': 1.1996176308045394, 'sideways_rsi_os': 54, 'sideways_rsi_ob': 50, 'sideways_adx_thresh': 22.0236843837598, 'sideways_atr_min_pct': 0.029124534146359744, 'sideways_atr_max_pct': 0.10717042007968322, 'sideways_tp_mult': 1.6980960722315934, 'sideways_tsl_mult': 0.19280295161500305, 'sideways_time_stop': 225, 'sideways_use_sma': False, 'sideways_use_ema': True, 'sideways_use_atr': False, 'sideways_use_adx': False, 'sideways_use_spike': True, 'sideways_rsi_required': True}.
[I 2025-09-01 09:22:28,532] Trial 150 finished with values: [-1000000000.0, 1000000000.0] and parameters: {'p_sma': 44, 'p_std': 24, 'p_atr': 9, 'p_adx': 10, 'rsi_period': 61, 'ema1': 6, 'ema2': 13, 'slip_atr_k': 0.04404363012088027, 'slip_spread_k': 0.6124652685435527, 'spread_hl_frac': 0.04971307127752169, 'bb_std_mult': 2.695600867716394, 'rsi_os': 44, 'rsi_ob': 89, 'vol_spike': 0.04603931697446138, 'adx_thresh': 34.83501257611345, 'atr_min_pct': 0.01916256076834065, 'atr_max_pct': 0.14687086813318628, 'tp_mult': 2.657227456092139, 'tsl_mult': 0.38314159219992583, 'strategy': 'breakout', 'time_stop': 249, 'use_sma': True, 'use_atr': False, 'use_adx': False, 'use_ema': True, 'use_spike': True, 'rsi_required': False, 'edge_k': 0.8556001370516084, 'edge_cap': 0.07501143723863012, 'bull_strategy': 'mean_reversion', 'bull_bb_std_mult': 3.0399332767638763, 'bull_rsi_os': 17, 'bull_rsi_ob': 61, 'bull_adx_thresh': 20.74296192053985, 'bull_atr_min_pct': 0.027497257294113352, 'bull_atr_max_pct': 0.06151939478308657, 'bull_tp_mult': 2.1750259353685477, 'bull_tsl_mult': 0.9762296358277079, 'bull_time_stop': 131, 'bull_use_sma': False, 'bull_use_ema': False, 'bull_use_atr': False, 'bull_use_adx': True, 'bull_use_spike': False, 'bull_rsi_required': True, 'bear_strategy': 'mean_reversion', 'bear_bb_std_mult': 3.513734708250165, 'bear_rsi_os': 47, 'bear_rsi_ob': 89, 'bear_adx_thresh': 12.88140217450443, 'bear_atr_min_pct': 0.0008085846579342585, 'bear_atr_max_pct': 0.13928821349214165, 'bear_tp_mult': 2.2744185994338855, 'bear_tsl_mult': 0.29073420460424987, 'bear_time_stop': 67, 'bear_use_sma': False, 'bear_use_ema': True, 'bear_use_atr': False, 'bear_use_adx': False, 'bear_use_spike': False, 'bear_rsi_required': False, 'sideways_strategy': 'breakout', 'sideways_bb_std_mult': 3.360520803659816, 'sideways_rsi_os': 39, 'sideways_rsi_ob': 50, 'sideways_adx_thresh': 22.05778320720986, 'sideways_atr_min_pct': 0.029057374340498363, 'sideways_atr_max_pct': 0.027909317453078453, 'sideways_tp_mult': 1.5347421061410795, 'sideways_tsl_mult': 0.9174945775728375, 'sideways_time_stop': 97, 'sideways_use_sma': True, 'sideways_use_ema': True, 'sideways_use_atr': True, 'sideways_use_adx': False, 'sideways_use_spike': True, 'sideways_rsi_required': True}.
[I 2025-09-01 09:22:28,542] Trial 152 finished with values: [-1000000000.0, 1000000000.0] and parameters: {'p_sma': 28, 'p_std': 36, 'p_atr': 14, 'p_adx': 21, 'rsi_period': 61, 'ema1': 19, 'ema2': 16, 'slip_atr_k': 0.06507530368724038, 'slip_spread_k': 0.4027117540857733, 'spread_hl_frac': 0.04955199719893636, 'bb_std_mult': 2.676371897053281, 'rsi_os': 48, 'rsi_ob': 89, 'vol_spike': 0.2181948011550459, 'adx_thresh': 6.0709012919122545, 'atr_min_pct': 0.02643070729859936, 'atr_max_pct': 0.08214197618358826, 'tp_mult': 2.672067529179635, 'tsl_mult': 0.9123036987184501, 'strategy': 'breakout', 'time_stop': 161, 'use_sma': True, 'use_atr': False, 'use_adx': True, 'use_ema': True, 'use_spike': False, 'rsi_required': False, 'edge_k': 1.6255222842090955, 'edge_cap': 0.07347745129433562, 'bull_strategy': 'mean_reversion', 'bull_bb_std_mult': 2.8532101810855037, 'bull_rsi_os': 16, 'bull_rsi_ob': 59, 'bull_adx_thresh': 14.438762708033853, 'bull_atr_min_pct': 0.02802618842242597, 'bull_atr_max_pct': 0.0714727589159919, 'bull_tp_mult': 2.1309153387944098, 'bull_tsl_mult': 0.10715884753494376, 'bull_time_stop': 42, 'bull_use_sma': True, 'bull_use_ema': False, 'bull_use_atr': False, 'bull_use_adx': True, 'bull_use_spike': False, 'bull_rsi_required': True, 'bear_strategy': 'mean_reversion', 'bear_bb_std_mult': 3.543236344301235, 'bear_rsi_os': 36, 'bear_rsi_ob': 71, 'bear_adx_thresh': 12.940978624771265, 'bear_atr_min_pct': 0.0152028190939016, 'bear_atr_max_pct': 0.11992734268489182, 'bear_tp_mult': 2.2724197274008664, 'bear_tsl_mult': 0.5465981716514324, 'bear_time_stop': 219, 'bear_use_sma': False, 'bear_use_ema': True, 'bear_use_atr': True, 'bear_use_adx': False, 'bear_use_spike': False, 'bear_rsi_required': False, 'sideways_strategy': 'breakout', 'sideways_bb_std_mult': 1.8240404215489534, 'sideways_rsi_os': 34, 'sideways_rsi_ob': 84, 'sideways_adx_thresh': 5.1573799579734345, 'sideways_atr_min_pct': 0.020607707566398376, 'sideways_atr_max_pct': 0.0589494316198039, 'sideways_tp_mult': 1.678659410754499, 'sideways_tsl_mult': 0.9468944660344518, 'sideways_time_stop': 238, 'sideways_use_sma': False, 'sideways_use_ema': True, 'sideways_use_atr': False, 'sideways_use_adx': False, 'sideways_use_spike': True, 'sideways_rsi_required': False}.
[I 2025-09-01 09:22:28,822] Trial 149 finished with values: [-1000000000.0, 1000000000.0] and parameters: {'p_sma': 28, 'p_std': 23, 'p_atr': 22, 'p_adx': 10, 'rsi_period': 25, 'ema1': 23, 'ema2': 21, 'slip_atr_k': 0.04659063353837556, 'slip_spread_k': 0.40674657792656554, 'spread_hl_frac': 0.0065189654644571176, 'bb_std_mult': 0.8560272609652253, 'rsi_os': 9, 'rsi_ob': 89, 'vol_spike': 0.17564591543931934, 'adx_thresh': 14.8063443087816, 'atr_min_pct': 0.01915448763254514, 'atr_max_pct': 0.07506659500132185, 'tp_mult': 1.9054723922710193, 'tsl_mult': 0.2595596028885032, 'strategy': 'breakout', 'time_stop': 203, 'use_sma': True, 'use_atr': False, 'use_adx': False, 'use_ema': True, 'use_spike': True, 'rsi_required': False, 'edge_k': 0.7371543724343027, 'edge_cap': 0.07640938661167551, 'bull_strategy': 'mean_reversion', 'bull_bb_std_mult': 0.6531682458815566, 'bull_rsi_os': 36, 'bull_rsi_ob': 88, 'bull_adx_thresh': 21.263627569177117, 'bull_atr_min_pct': 0.01585923940625704, 'bull_atr_max_pct': 0.0662858085778347, 'bull_tp_mult': 2.176158433807985, 'bull_tsl_mult': 0.921896385822351, 'bull_time_stop': 163, 'bull_use_sma': False, 'bull_use_ema': False, 'bull_use_atr': False, 'bull_use_adx': True, 'bull_use_spike': False, 'bull_rsi_required': True, 'bear_strategy': 'mean_reversion', 'bear_bb_std_mult': 3.5346439634264732, 'bear_rsi_os': 11, 'bear_rsi_ob': 88, 'bear_adx_thresh': 21.31211484060507, 'bear_atr_min_pct': 0.020309975786944656, 'bear_atr_max_pct': 0.04939879759146869, 'bear_tp_mult': 2.2724007100266124, 'bear_tsl_mult': 0.5513222102505355, 'bear_time_stop': 58, 'bear_use_sma': False, 'bear_use_ema': True, 'bear_use_atr': False, 'bear_use_adx': False, 'bear_use_spike': False, 'bear_rsi_required': False, 'sideways_strategy': 'breakout', 'sideways_bb_std_mult': 2.039466509512499, 'sideways_rsi_os': 12, 'sideways_rsi_ob': 50, 'sideways_adx_thresh': 27.89847360298126, 'sideways_atr_min_pct': 0.003991697659245841, 'sideways_atr_max_pct': 0.05801493377127642, 'sideways_tp_mult': 2.5129750293291533, 'sideways_tsl_mult': 0.20004033169064833, 'sideways_time_stop': 111, 'sideways_use_sma': True, 'sideways_use_ema': True, 'sideways_use_atr': True, 'sideways_use_adx': False, 'sideways_use_spike': True, 'sideways_rsi_required': True}.
