[I 2025-09-01 09:10:38,883] Trial 81 finished with values: [-0.036690248330112474, 0.03647408945707398] and parameters: {'p_sma': 41, 'p_std': 58, 'p_atr': 25, 'p_adx': 24, 'rsi_period': 65, 'ema1': 24, 'ema2': 42, 'slip_atr_k': 0.05779226781600761, 'slip_spread_k': 0.9645767482254319, 'spread_hl_frac': 0.00824596891895812, 'bb_std_mult': 1.229765457419168, 'rsi_os': 11, 'rsi_ob': 75, 'vol_spike': 0.28716338132821057, 'adx_thresh': 19.677466629129075, 'atr_min_pct': 0.013467338802231403, 'atr_max_pct': 0.1426012602672126, 'tp_mult': 1.8027047454049498, 'tsl_mult': 0.0646884832845634, 'strategy': 'breakout', 'time_stop': 44, 'use_sma': False, 'use_atr': False, 'use_adx': True, 'use_ema': False, 'use_spike': False, 'rsi_required': False, 'edge_k': 1.9191366856135632, 'edge_cap': 0.9108707441292595, 'bull_strategy': 'breakout', 'bull_bb_std_mult': 1.893282948000154, 'bull_rsi_os': 53, 'bull_rsi_ob': 50, 'bull_adx_thresh': 15.645829872514344, 'bull_atr_min_pct': 0.017705873063863186, 'bull_atr_max_pct': 0.0443306582736899, 'bull_tp_mult': 2.7865869209276077, 'bull_tsl_mult': 0.6544454615679147, 'bull_time_stop': 300, 'bull_use_sma': True, 'bull_use_ema': True, 'bull_use_atr': True, 'bull_use_adx': False, 'bull_use_spike': True, 'bull_rsi_required': False, 'bear_strategy': 'mean_reversion', 'bear_bb_std_mult': 1.6481292540711163, 'bear_rsi_os': 8, 'bear_rsi_ob': 46, 'bear_adx_thresh': 14.638743660776314, 'bear_atr_min_pct': 0.010265806922924833, 'bear_atr_max_pct': 0.08819940674630711, 'bear_tp_mult': 1.611640174353171, 'bear_tsl_mult': 0.703707404582623, 'bear_time_stop': 86, 'bear_use_sma': False, 'bear_use_ema': False, 'bear_use_atr': True, 'bear_use_adx': False, 'bear_use_spike': False, 'bear_rsi_required': False, 'sideways_strategy': 'breakout', 'sideways_bb_std_mult': 2.4288183029052117, 'sideways_rsi_os': 44, 'sideways_rsi_ob': 55, 'sideways_adx_thresh': 31.978917150748146, 'sideways_atr_min_pct': 0.0029729447359089795, 'sideways_atr_max_pct': 0.056438494815296135, 'sideways_tp_mult': 1.0321835695500727, 'sideways_tsl_mult': 0.21749159048051325, 'sideways_time_stop': 198, 'sideways_use_sma': False, 'sideways_use_ema': False, 'sideways_use_atr': False, 'sideways_use_adx': False, 'sideways_use_spike': False, 'sideways_rsi_required': False}.
[I 2025-09-01 09:11:18,535] Trial 83 finished with values: [-1000000000.0, 1000000000.0] and parameters: {'p_sma': 11, 'p_std': 58, 'p_atr': 25, 'p_adx': 8, 'rsi_period': 65, 'ema1': 27, 'ema2': 50, 'slip_atr_k': 0.04381512765519251, 'slip_spread_k': 0.07659874353401774, 'spread_hl_frac': 0.02126592335040408, 'bb_std_mult': 1.4466800752725428, 'rsi_os': 8, 'rsi_ob': 79, 'vol_spike': 0.28669568423693503, 'adx_thresh': 19.61976346640766, 'atr_min_pct': 0.02319855167415786, 'atr_max_pct': 0.13401820826478744, 'tp_mult': 1.959833107481911, 'tsl_mult': 0.04130674687679883, 'strategy': 'breakout', 'time_stop': 286, 'use_sma': False, 'use_atr': False, 'use_adx': True, 'use_ema': False, 'use_spike': False, 'rsi_required': False, 'edge_k': 1.6282086504131208, 'edge_cap': 0.9551065650807613, 'bull_strategy': 'breakout', 'bull_bb_std_mult': 2.203873930975384, 'bull_rsi_os': 52, 'bull_rsi_ob': 54, 'bull_adx_thresh': 15.51030137645883, 'bull_atr_min_pct': 0.02254790648373142, 'bull_atr_max_pct': 0.05082655859189621, 'bull_tp_mult': 2.8064634870362215, 'bull_tsl_mult': 0.656461999892564, 'bull_time_stop': 283, 'bull_use_sma': True, 'bull_use_ema': True, 'bull_use_atr': True, 'bull_use_adx': False, 'bull_use_spike': True, 'bull_rsi_required': True, 'bear_strategy': 'mean_reversion', 'bear_bb_std_mult': 1.643615908025701, 'bear_rsi_os': 7, 'bear_rsi_ob': 52, 'bear_adx_thresh': 13.034332542957475, 'bear_atr_min_pct': 0.014076424040481393, 'bear_atr_max_pct': 0.08903775370888771, 'bear_tp_mult': 1.8422910808485566, 'bear_tsl_mult': 0.7017158293614947, 'bear_time_stop': 206, 'bear_use_sma': False, 'bear_use_ema': False, 'bear_use_atr': True, 'bear_use_adx': False, 'bear_use_spike': False, 'bear_rsi_required': False, 'sideways_strategy': 'breakout', 'sideways_bb_std_mult': 0.5135144489260355, 'sideways_rsi_os': 39, 'sideways_rsi_ob': 56, 'sideways_adx_thresh': 34.764081272851584, 'sideways_atr_min_pct': 0.004883087137347613, 'sideways_atr_max_pct': 0.05606890898716557, 'sideways_tp_mult': 1.4883523307456554, 'sideways_tsl_mult': 0.33329770923369617, 'sideways_time_stop': 300, 'sideways_use_sma': False, 'sideways_use_ema': False, 'sideways_use_atr': False, 'sideways_use_adx': False, 'sideways_use_spike': False, 'sideways_rsi_required': False}.
[I 2025-09-01 09:11:19,855] Trial 85 finished with values: [-0.054214353858037634, 0.05412781286967457] and parameters: {'p_sma': 35, 'p_std': 19, 'p_atr': 25, 'p_adx': 8, 'rsi_period': 82, 'ema1': 27, 'ema2': 36, 'slip_atr_k': 0.06048981555920088, 'slip_spread_k': 0.10028939059106456, 'spread_hl_frac': 0.021366340029969767, 'bb_std_mult': 1.1421364147022146, 'rsi_os': 7, 'rsi_ob': 79, 'vol_spike': 0.29901201988215464, 'adx_thresh': 19.658742289028957, 'atr_min_pct': 0.013203007935415872, 'atr_max_pct': 0.13467619200776632, 'tp_mult': 1.6419011461083723, 'tsl_mult': 0.043591617842328456, 'strategy': 'breakout', 'time_stop': 56, 'use_sma': False, 'use_atr': False, 'use_adx': True, 'use_ema': False, 'use_spike': False, 'rsi_required': False, 'edge_k': 1.319738615296754, 'edge_cap': 0.8122198648446272, 'bull_strategy': 'breakout', 'bull_bb_std_mult': 2.229548782219137, 'bull_rsi_os': 52, 'bull_rsi_ob': 62, 'bull_adx_thresh': 16.92019386518367, 'bull_atr_min_pct': 0.021958554527944436, 'bull_atr_max_pct': 0.050732974797980744, 'bull_tp_mult': 2.8205705704470905, 'bull_tsl_mult': 0.5897612823919056, 'bull_time_stop': 283, 'bull_use_sma': True, 'bull_use_ema': True, 'bull_use_atr': True, 'bull_use_adx': False, 'bull_use_spike': True, 'bull_rsi_required': True, 'bear_strategy': 'mean_reversion', 'bear_bb_std_mult': 3.3865507381788764, 'bear_rsi_os': 7, 'bear_rsi_ob': 52, 'bear_adx_thresh': 14.573566607864944, 'bear_atr_min_pct': 0.009245130533838564, 'bear_atr_max_pct': 0.12888337595286242, 'bear_tp_mult': 1.6166386435382418, 'bear_tsl_mult': 0.7150851664758444, 'bear_time_stop': 187, 'bear_use_sma': False, 'bear_use_ema': False, 'bear_use_atr': True, 'bear_use_adx': False, 'bear_use_spike': False, 'bear_rsi_required': False, 'sideways_strategy': 'breakout', 'sideways_bb_std_mult': 2.2600528610636452, 'sideways_rsi_os': 45, 'sideways_rsi_ob': 68, 'sideways_adx_thresh': 34.785176040909874, 'sideways_atr_min_pct': 0.0030483107271609368, 'sideways_atr_max_pct': 0.053869492668079826, 'sideways_tp_mult': 1.033027889329186, 'sideways_tsl_mult': 0.3424441792562902, 'sideways_time_stop': 196, 'sideways_use_sma': False, 'sideways_use_ema': False, 'sideways_use_atr': False, 'sideways_use_adx': False, 'sideways_use_spike': False, 'sideways_rsi_required': False}.
[I 2025-09-01 09:11:20,221] Trial 84 finished with values: [-0.034051808991881316, 0.03419310374189648] and parameters: {'p_sma': 35, 'p_std': 57, 'p_atr': 25, 'p_adx': 8, 'rsi_period': 65, 'ema1': 10, 'ema2': 36, 'slip_atr_k': 0.05935334419882757, 'slip_spread_k': 0.0978556232272737, 'spread_hl_frac': 0.015526630877170532, 'bb_std_mult': 1.4426219158286977, 'rsi_os': 7, 'rsi_ob': 79, 'vol_spike': 0.28241775705169986, 'adx_thresh': 23.23228698409892, 'atr_min_pct': 0.013253340840025822, 'atr_max_pct': 0.13243910202177053, 'tp_mult': 1.998614740106357, 'tsl_mult': 0.04075741915625092, 'strategy': 'breakout', 'time_stop': 29, 'use_sma': False, 'use_atr': False, 'use_adx': True, 'use_ema': False, 'use_spike': False, 'rsi_required': False, 'edge_k': 1.2018266512858315, 'edge_cap': 0.8109664118880355, 'bull_strategy': 'breakout', 'bull_bb_std_mult': 2.2432791493002835, 'bull_rsi_os': 52, 'bull_rsi_ob': 54, 'bull_adx_thresh': 17.193261860150784, 'bull_atr_min_pct': 0.02010543101281145, 'bull_atr_max_pct': 0.026514207054366194, 'bull_tp_mult': 2.80382073923095, 'bull_tsl_mult': 0.03440000170310992, 'bull_time_stop': 281, 'bull_use_sma': True, 'bull_use_ema': True, 'bull_use_atr': True, 'bull_use_adx': False, 'bull_use_spike': True, 'bull_rsi_required': True, 'bear_strategy': 'mean_reversion', 'bear_bb_std_mult': 3.3963247617823464, 'bear_rsi_os': 6, 'bear_rsi_ob': 52, 'bear_adx_thresh': 14.833388077089483, 'bear_atr_min_pct': 0.013799838264268218, 'bear_atr_max_pct': 0.12937666991043487, 'bear_tp_mult': 2.530136897912059, 'bear_tsl_mult': 0.7120294201512063, 'bear_time_stop': 203, 'bear_use_sma': False, 'bear_use_ema': False, 'bear_use_atr': True, 'bear_use_adx': False, 'bear_use_spike': False, 'bear_rsi_required': False, 'sideways_strategy': 'breakout', 'sideways_bb_std_mult': 0.527994268509208, 'sideways_rsi_os': 45, 'sideways_rsi_ob': 68, 'sideways_adx_thresh': 10.375170521328396, 'sideways_atr_min_pct': 0.003408645027354558, 'sideways_atr_max_pct': 0.05399540288647356, 'sideways_tp_mult': 1.4911330983769417, 'sideways_tsl_mult': 0.3379129881673767, 'sideways_time_stop': 200, 'sideways_use_sma': False, 'sideways_use_ema': False, 'sideways_use_atr': False, 'sideways_use_adx': False, 'sideways_use_spike': False, 'sideways_rsi_required': False}.
[I 2025-09-01 09:11:20,819] Trial 82 finished with values: [-0.2282019180727095, 0.22802312578356415] and parameters: {'p_sma': 12, 'p_std': 58, 'p_atr': 26, 'p_adx': 8, 'rsi_period': 82, 'ema1': 27, 'ema2': 36, 'slip_atr_k': 0.061738964832253815, 'slip_spread_k': 0.9338327880939081, 'spread_hl_frac': 0.0046865957079854585, 'bb_std_mult': 1.4691372907239795, 'rsi_os': 13, 'rsi_ob': 75, 'vol_spike': 0.24478971632226593, 'adx_thresh': 21.646630263816462, 'atr_min_pct': 0.013376997539317611, 'atr_max_pct': 0.1331610351522602, 'tp_mult': 2.1942093460021255, 'tsl_mult': 0.05367492803209705, 'strategy': 'breakout', 'time_stop': 52, 'use_sma': False, 'use_atr': False, 'use_adx': True, 'use_ema': False, 'use_spike': False, 'rsi_required': False, 'edge_k': 1.1923385369414605, 'edge_cap': 0.9660312936068928, 'bull_strategy': 'breakout', 'bull_bb_std_mult': 2.2069439414897993, 'bull_rsi_os': 52, 'bull_rsi_ob': 50, 'bull_adx_thresh': 15.141755632608852, 'bull_atr_min_pct': 0.01747817299202733, 'bull_atr_max_pct': 0.044834388463814136, 'bull_tp_mult': 2.789705732681341, 'bull_tsl_mult': 0.5912075568892724, 'bull_time_stop': 298, 'bull_use_sma': True, 'bull_use_ema': True, 'bull_use_atr': True, 'bull_use_adx': False, 'bull_use_spike': True, 'bull_rsi_required': False, 'bear_strategy': 'mean_reversion', 'bear_bb_std_mult': 1.0768292157523087, 'bear_rsi_os': 10, 'bear_rsi_ob': 45, 'bear_adx_thresh': 14.601547913850299, 'bear_atr_min_pct': 0.01116746580072795, 'bear_atr_max_pct': 0.12944694094692918, 'bear_tp_mult': 1.6264370119322717, 'bear_tsl_mult': 0.7070305983553871, 'bear_time_stop': 202, 'bear_use_sma': False, 'bear_use_ema': False, 'bear_use_atr': True, 'bear_use_adx': False, 'bear_use_spike': False, 'bear_rsi_required': False, 'sideways_strategy': 'breakout', 'sideways_bb_std_mult': 2.2680470591859434, 'sideways_rsi_os': 52, 'sideways_rsi_ob': 53, 'sideways_adx_thresh': 32.05127132158903, 'sideways_atr_min_pct': 0.0012966888929817674, 'sideways_atr_max_pct': 0.0536079786628939, 'sideways_tp_mult': 1.020719719750778, 'sideways_tsl_mult': 0.33820428984247797, 'sideways_time_stop': 196, 'sideways_use_sma': False, 'sideways_use_ema': False, 'sideways_use_atr': False, 'sideways_use_adx': False, 'sideways_use_spike': False, 'sideways_rsi_required': False}.
[I 2025-09-01 09:11:58,923] Trial 87 finished with values: [-1000000000.0, 1000000000.0] and parameters: {'p_sma': 6, 'p_std': 47, 'p_atr': 28, 'p_adx': 28, 'rsi_period': 58, 'ema1': 10, 'ema2': 43, 'slip_atr_k': 0.059894027122617294, 'slip_spread_k': 0.20955133880422, 'spread_hl_frac': 0.004703956098353439, 'bb_std_mult': 1.6137152465203934, 'rsi_os': 9, 'rsi_ob': 72, 'vol_spike': 0.2722866755303449, 'adx_thresh': 23.194792759373403, 'atr_min_pct': 0.012040803021727286, 'atr_max_pct': 0.1278969359389096, 'tp_mult': 1.516414039659013, 'tsl_mult': 0.10199456574585075, 'strategy': 'mean_reversion', 'time_stop': 25, 'use_sma': False, 'use_atr': False, 'use_adx': True, 'use_ema': False, 'use_spike': True, 'rsi_required': False, 'edge_k': 0.9231677077459908, 'edge_cap': 0.8613691498221654, 'bull_strategy': 'mean_reversion', 'bull_bb_std_mult': 1.8339907355948137, 'bull_rsi_os': 53, 'bull_rsi_ob': 51, 'bull_adx_thresh': 13.883374393676517, 'bull_atr_min_pct': 0.019338794331372408, 'bull_atr_max_pct': 0.028265296789962018, 'bull_tp_mult': 2.7520273944805145, 'bull_tsl_mult': 0.002831574824249894, 'bull_time_stop': 278, 'bull_use_sma': True, 'bull_use_ema': True, 'bull_use_atr': True, 'bull_use_adx': False, 'bull_use_spike': False, 'bull_rsi_required': False, 'bear_strategy': 'mean_reversion', 'bear_bb_std_mult': 1.1580194973304525, 'bear_rsi_os': 47, 'bear_rsi_ob': 49, 'bear_adx_thresh': 10.528481901128796, 'bear_atr_min_pct': 0.013534227643743445, 'bear_atr_max_pct': 0.14422385939503904, 'bear_tp_mult': 2.555075450167008, 'bear_tsl_mult': 0.7464745708074014, 'bear_time_stop': 161, 'bear_use_sma': False, 'bear_use_ema': True, 'bear_use_atr': True, 'bear_use_adx': False, 'bear_use_spike': False, 'bear_rsi_required': False, 'sideways_strategy': 'breakout', 'sideways_bb_std_mult': 2.4571687235276634, 'sideways_rsi_os': 53, 'sideways_rsi_ob': 91, 'sideways_adx_thresh': 10.481129764273502, 'sideways_atr_min_pct': 0.01541912674998956, 'sideways_atr_max_pct': 0.04319051709461769, 'sideways_tp_mult': 1.1455738158873696, 'sideways_tsl_mult': 0.540816107505076, 'sideways_time_stop': 42, 'sideways_use_sma': False, 'sideways_use_ema': False, 'sideways_use_atr': False, 'sideways_use_adx': False, 'sideways_use_spike': False, 'sideways_rsi_required': False}.
[I 2025-09-01 09:11:59,659] Trial 89 finished with values: [-1000000000.0, 1000000000.0] and parameters: {'p_sma': 56, 'p_std': 14, 'p_atr': 28, 'p_adx': 27, 'rsi_period': 77, 'ema1': 10, 'ema2': 43, 'slip_atr_k': 0.047697813751267346, 'slip_spread_k': 0.20459239478767172, 'spread_hl_frac': 0.015885047930123977, 'bb_std_mult': 0.9357961720429713, 'rsi_os': 28, 'rsi_ob': 66, 'vol_spike': 0.2770067293673464, 'adx_thresh': 27.395160405125964, 'atr_min_pct': 0.015193383365175535, 'atr_max_pct': 0.1274564997765017, 'tp_mult': 1.7437745726911291, 'tsl_mult': 0.11403602571450827, 'strategy': 'mean_reversion', 'time_stop': 26, 'use_sma': False, 'use_atr': False, 'use_adx': True, 'use_ema': False, 'use_spike': True, 'rsi_required': False, 'edge_k': 1.4670084531244953, 'edge_cap': 0.8748689882403292, 'bull_strategy': 'mean_reversion', 'bull_bb_std_mult': 1.8240315996792278, 'bull_rsi_os': 49, 'bull_rsi_ob': 92, 'bull_adx_thresh': 21.584381766324913, 'bull_atr_min_pct': 0.019262951852167726, 'bull_atr_max_pct': 0.026491897144642777, 'bull_tp_mult': 2.953093996177449, 'bull_tsl_mult': 0.038056664467665036, 'bull_time_stop': 278, 'bull_use_sma': True, 'bull_use_ema': True, 'bull_use_atr': True, 'bull_use_adx': False, 'bull_use_spike': False, 'bull_rsi_required': False, 'bear_strategy': 'mean_reversion', 'bear_bb_std_mult': 1.4675154513682827, 'bear_rsi_os': 39, 'bear_rsi_ob': 49, 'bear_adx_thresh': 7.1535352900659275, 'bear_atr_min_pct': 0.01343149302740912, 'bear_atr_max_pct': 0.0927869505410097, 'bear_tp_mult': 2.55503574094572, 'bear_tsl_mult': 0.7491951663825727, 'bear_time_stop': 165, 'bear_use_sma': False, 'bear_use_ema': True, 'bear_use_atr': True, 'bear_use_adx': False, 'bear_use_spike': False, 'bear_rsi_required': False, 'sideways_strategy': 'breakout', 'sideways_bb_std_mult': 2.522156871468365, 'sideways_rsi_os': 43, 'sideways_rsi_ob': 92, 'sideways_adx_thresh': 20.58306808076521, 'sideways_atr_min_pct': 0.009943633975100204, 'sideways_atr_max_pct': 0.043663288164491304, 'sideways_tp_mult': 1.852424596361658, 'sideways_tsl_mult': 0.5383571327920473, 'sideways_time_stop': 9, 'sideways_use_sma': False, 'sideways_use_ema': False, 'sideways_use_atr': False, 'sideways_use_adx': False, 'sideways_use_spike': False, 'sideways_rsi_required': False}.
[I 2025-09-01 09:12:01,121] Trial 86 finished with values: [-0.03392147862264627, 0.03398621011039689] and parameters: {'p_sma': 57, 'p_std': 17, 'p_atr': 26, 'p_adx': 28, 'rsi_period': 80, 'ema1': 27, 'ema2': 36, 'slip_atr_k': 0.055131621292121014, 'slip_spread_k': 0.7092926735333298, 'spread_hl_frac': 0.015150728248573343, 'bb_std_mult': 0.9040662403568263, 'rsi_os': 7, 'rsi_ob': 77, 'vol_spike': 0.29782018582705866, 'adx_thresh': 27.495591894218183, 'atr_min_pct': 0.013212665292164071, 'atr_max_pct': 0.04428358031350528, 'tp_mult': 1.6414487464965701, 'tsl_mult': 0.11426422931272806, 'strategy': 'breakout', 'time_stop': 55, 'use_sma': False, 'use_atr': False, 'use_adx': True, 'use_ema': False, 'use_spike': False, 'rsi_required': False, 'edge_k': 1.220481264377618, 'edge_cap': 0.8167116877793512, 'bull_strategy': 'breakout', 'bull_bb_std_mult': 1.8247714215240893, 'bull_rsi_os': 53, 'bull_rsi_ob': 62, 'bull_adx_thresh': 17.2036612490143, 'bull_atr_min_pct': 0.02010403576886602, 'bull_atr_max_pct': 0.0469648495515951, 'bull_tp_mult': 2.768210571730778, 'bull_tsl_mult': 0.011985095537560941, 'bull_time_stop': 277, 'bull_use_sma': True, 'bull_use_ema': True, 'bull_use_atr': True, 'bull_use_adx': False, 'bull_use_spike': True, 'bull_rsi_required': False, 'bear_strategy': 'mean_reversion', 'bear_bb_std_mult': 3.404744701418643, 'bear_rsi_os': 11, 'bear_rsi_ob': 48, 'bear_adx_thresh': 10.463784327637272, 'bear_atr_min_pct': 0.009628035202794536, 'bear_atr_max_pct': 0.01661018602814386, 'bear_tp_mult': 1.7125800985093629, 'bear_tsl_mult': 0.7403685917326654, 'bear_time_stop': 5, 'bear_use_sma': False, 'bear_use_ema': False, 'bear_use_atr': True, 'bear_use_adx': False, 'bear_use_spike': False, 'bear_rsi_required': False, 'sideways_strategy': 'breakout', 'sideways_bb_std_mult': 2.222331079331477, 'sideways_rsi_os': 45, 'sideways_rsi_ob': 68, 'sideways_adx_thresh': 29.00973541657143, 'sideways_atr_min_pct': 0.003432801866404096, 'sideways_atr_max_pct': 0.05023736015635243, 'sideways_tp_mult': 1.8746273305307721, 'sideways_tsl_mult': 0.6373633365713002, 'sideways_time_stop': 199, 'sideways_use_sma': False, 'sideways_use_ema': False, 'sideways_use_atr': False, 'sideways_use_adx': False, 'sideways_use_spike': False, 'sideways_rsi_required': False}.
[I 2025-09-01 09:12:01,858] Trial 88 finished with values: [-0.34158209878771684, 0.34147596246800005] and parameters: {'p_sma': 57, 'p_std': 50, 'p_atr': 21, 'p_adx': 28, 'rsi_period': 76, 'ema1': 11, 'ema2': 43, 'slip_atr_k': 0.047828659530653225, 'slip_spread_k': 0.19548120443042555, 'spread_hl_frac': 0.0056057975529509065, 'bb_std_mult': 1.6002371883464739, 'rsi_os': 9, 'rsi_ob': 72, 'vol_spike': 0.26816058599942844, 'adx_thresh': 24.521784914545012, 'atr_min_pct': 0.012049934233453229, 'atr_max_pct': 0.04646802537475181, 'tp_mult': 2.0617777756185234, 'tsl_mult': 0.11362568374335363, 'strategy': 'mean_reversion', 'time_stop': 28, 'use_sma': False, 'use_atr': False, 'use_adx': True, 'use_ema': False, 'use_spike': True, 'rsi_required': False, 'edge_k': 1.9280020453947038, 'edge_cap': 0.8700067386037389, 'bull_strategy': 'breakout', 'bull_bb_std_mult': 2.2824490615305555, 'bull_rsi_os': 53, 'bull_rsi_ob': 51, 'bull_adx_thresh': 14.180110251547163, 'bull_atr_min_pct': 0.019920245890847652, 'bull_atr_max_pct': 0.04688229941130882, 'bull_tp_mult': 2.9590397316330055, 'bull_tsl_mult': 0.7646451897161664, 'bull_time_stop': 275, 'bull_use_sma': True, 'bull_use_ema': True, 'bull_use_atr': True, 'bull_use_adx': False, 'bull_use_spike': True, 'bull_rsi_required': False, 'bear_strategy': 'mean_reversion', 'bear_bb_std_mult': 1.0449333272063348, 'bear_rsi_os': 52, 'bear_rsi_ob': 49, 'bear_adx_thresh': 10.298249375334906, 'bear_atr_min_pct': 0.009781059083299569, 'bear_atr_max_pct': 0.14218573918631636, 'bear_tp_mult': 1.701368498519812, 'bear_tsl_mult': 0.8084621139140106, 'bear_time_stop': 166, 'bear_use_sma': False, 'bear_use_ema': False, 'bear_use_atr': True, 'bear_use_adx': False, 'bear_use_spike': False, 'bear_rsi_required': False, 'sideways_strategy': 'breakout', 'sideways_bb_std_mult': 2.518660780015397, 'sideways_rsi_os': 52, 'sideways_rsi_ob': 67, 'sideways_adx_thresh': 13.06464666755795, 'sideways_atr_min_pct': 0.0013899933838179184, 'sideways_atr_max_pct': 0.043130253999992534, 'sideways_tp_mult': 1.8838449414374758, 'sideways_tsl_mult': 0.6337783802565251, 'sideways_time_stop': 77, 'sideways_use_sma': False, 'sideways_use_ema': False, 'sideways_use_atr': False, 'sideways_use_adx': False, 'sideways_use_spike': False, 'sideways_rsi_required': False}.
