[I 2025-09-01 09:14:08,265] Trial 98 finished with values: [-1000000000.0, 1000000000.0] and parameters: {'p_sma': 25, 'p_std': 46, 'p_atr': 14, 'p_adx': 10, 'rsi_period': 78, 'ema1': 20, 'ema2': 18, 'slip_atr_k': 0.03132014261491911, 'slip_spread_k': 0.8121729314643333, 'spread_hl_frac': 0.013743546727958671, 'bb_std_mult': 1.1401537340911143, 'rsi_os': 30, 'rsi_ob': 64, 'vol_spike': 0.23008474008538046, 'adx_thresh': 25.360882820456535, 'atr_min_pct': 0.025414910484718584, 'atr_max_pct': 0.040947477045515164, 'tp_mult': 2.2883064918549882, 'tsl_mult': 0.3201470728192415, 'strategy': 'breakout', 'time_stop': 111, 'use_sma': True, 'use_atr': False, 'use_adx': True, 'use_ema': False, 'use_spike': True, 'rsi_required': False, 'edge_k': 1.2193598654802003, 'edge_cap': 0.15796865649853473, 'bull_strategy': 'breakout', 'bull_bb_std_mult': 1.7464888879749434, 'bull_rsi_os': 45, 'bull_rsi_ob': 46, 'bull_adx_thresh': 22.741726459906253, 'bull_atr_min_pct': 0.022747045780075206, 'bull_atr_max_pct': 0.08501302397896213, 'bull_tp_mult': 2.9274568152640725, 'bull_tsl_mult': 0.8627046537630788, 'bull_time_stop': 258, 'bull_use_sma': True, 'bull_use_ema': True, 'bull_use_atr': True, 'bull_use_adx': False, 'bull_use_spike': False, 'bull_rsi_required': False, 'bear_strategy': 'mean_reversion', 'bear_bb_std_mult': 0.5979708511238195, 'bear_rsi_os': 41, 'bear_rsi_ob': 59, 'bear_adx_thresh': 7.397180603044455, 'bear_atr_min_pct': 0.008697313381102896, 'bear_atr_max_pct': 0.0734630794405165, 'bear_tp_mult': 1.6537787260055241, 'bear_tsl_mult': 0.8855017090104514, 'bear_time_stop': 186, 'bear_use_sma': False, 'bear_use_ema': False, 'bear_use_atr': True, 'bear_use_adx': False, 'bear_use_spike': False, 'bear_rsi_required': False, 'sideways_strategy': 'breakout', 'sideways_bb_std_mult': 1.0979895295998658, 'sideways_rsi_os': 46, 'sideways_rsi_ob': 75, 'sideways_adx_thresh': 28.018211542339586, 'sideways_atr_min_pct': 0.008304898941653639, 'sideways_atr_max_pct': 0.07956536380536798, 'sideways_tp_mult': 1.1457301228616763, 'sideways_tsl_mult': 0.4988409540050103, 'sideways_time_stop': 23, 'sideways_use_sma': False, 'sideways_use_ema': True, 'sideways_use_atr': False, 'sideways_use_adx': False, 'sideways_use_spike': False, 'sideways_rsi_required': False}.
[I 2025-09-01 09:14:08,856] Trial 100 finished with values: [-1000000000.0, 1000000000.0] and parameters: {'p_sma': 26, 'p_std': 25, 'p_atr': 17, 'p_adx': 14, 'rsi_period': 65, 'ema1': 20, 'ema2': 18, 'slip_atr_k': 0.020474645258873284, 'slip_spread_k': 0.24723124956158918, 'spread_hl_frac': 0.0014962515354704047, 'bb_std_mult': 1.7494848258585978, 'rsi_os': 14, 'rsi_ob': 90, 'vol_spike': 0.23396785623109884, 'adx_thresh': 27.88692416633863, 'atr_min_pct': 0.01965812658454065, 'atr_max_pct': 0.1451628256558833, 'tp_mult': 1.8335324289011696, 'tsl_mult': 0.011075404867348052, 'strategy': 'breakout', 'time_stop': 202, 'use_sma': True, 'use_atr': False, 'use_adx': True, 'use_ema': False, 'use_spike': True, 'rsi_required': False, 'edge_k': 1.5007511020215059, 'edge_cap': 0.07080805622169888, 'bull_strategy': 'mean_reversion', 'bull_bb_std_mult': 1.7749142544695609, 'bull_rsi_os': 17, 'bull_rsi_ob': 56, 'bull_adx_thresh': 6.542135890819138, 'bull_atr_min_pct': 0.029127152346845812, 'bull_atr_max_pct': 0.0631922136724007, 'bull_tp_mult': 2.164318759932491, 'bull_tsl_mult': 0.5790181604628327, 'bull_time_stop': 261, 'bull_use_sma': True, 'bull_use_ema': False, 'bull_use_atr': False, 'bull_use_adx': False, 'bull_use_spike': False, 'bull_rsi_required': False, 'bear_strategy': 'mean_reversion', 'bear_bb_std_mult': 3.558093311106558, 'bear_rsi_os': 41, 'bear_rsi_ob': 58, 'bear_adx_thresh': 12.627189108098621, 'bear_atr_min_pct': 0.01547202147327549, 'bear_atr_max_pct': 0.11173439846385415, 'bear_tp_mult': 2.241549471763998, 'bear_tsl_mult': 0.6303328697828089, 'bear_time_stop': 184, 'bear_use_sma': False, 'bear_use_ema': True, 'bear_use_atr': True, 'bear_use_adx': False, 'bear_use_spike': False, 'bear_rsi_required': False, 'sideways_strategy': 'breakout', 'sideways_bb_std_mult': 1.1024069175912259, 'sideways_rsi_os': 55, 'sideways_rsi_ob': 69, 'sideways_adx_thresh': 28.920138417704813, 'sideways_atr_min_pct': 0.008344570763158927, 'sideways_atr_max_pct': 0.06672406643144117, 'sideways_tp_mult': 1.4275469465829984, 'sideways_tsl_mult': 0.942102850104382, 'sideways_time_stop': 257, 'sideways_use_sma': False, 'sideways_use_ema': True, 'sideways_use_atr': False, 'sideways_use_adx': False, 'sideways_use_spike': False, 'sideways_rsi_required': False}.
[I 2025-09-01 09:14:09,140] Trial 101 finished with values: [-0.012050699890146621, 0.012334864909023269] and parameters: {'p_sma': 27, 'p_std': 25, 'p_atr': 16, 'p_adx': 14, 'rsi_period': 66, 'ema1': 20, 'ema2': 17, 'slip_atr_k': 0.04379530099274425, 'slip_spread_k': 0.2775072901044611, 'spread_hl_frac': 0.012954690888999825, 'bb_std_mult': 1.8045931429107986, 'rsi_os': 11, 'rsi_ob': 89, 'vol_spike': 0.2277129266226297, 'adx_thresh': 5.337080350501635, 'atr_min_pct': 0.01988333453730886, 'atr_max_pct': 0.14528182455630698, 'tp_mult': 1.836027950527881, 'tsl_mult': 0.023028274531706125, 'strategy': 'breakout', 'time_stop': 203, 'use_sma': True, 'use_atr': False, 'use_adx': True, 'use_ema': False, 'use_spike': False, 'rsi_required': False, 'edge_k': 1.5114828905448108, 'edge_cap': 0.07923241526718161, 'bull_strategy': 'mean_reversion', 'bull_bb_std_mult': 0.630709070259525, 'bull_rsi_os': 17, 'bull_rsi_ob': 56, 'bull_adx_thresh': 6.994831964917434, 'bull_atr_min_pct': 0.029163005588107384, 'bull_atr_max_pct': 0.06361202058642557, 'bull_tp_mult': 2.1432341583066417, 'bull_tsl_mult': 0.09068954766529497, 'bull_time_stop': 120, 'bull_use_sma': True, 'bull_use_ema': False, 'bull_use_atr': False, 'bull_use_adx': False, 'bull_use_spike': False, 'bull_rsi_required': True, 'bear_strategy': 'mean_reversion', 'bear_bb_std_mult': 3.554894070760057, 'bear_rsi_os': 46, 'bear_rsi_ob': 67, 'bear_adx_thresh': 12.733044403528543, 'bear_atr_min_pct': 0.015515602116005837, 'bear_atr_max_pct': 0.11892550903724282, 'bear_tp_mult': 2.213605684268442, 'bear_tsl_mult': 0.4327606475957494, 'bear_time_stop': 215, 'bear_use_sma': False, 'bear_use_ema': True, 'bear_use_atr': True, 'bear_use_adx': False, 'bear_use_spike': False, 'bear_rsi_required': False, 'sideways_strategy': 'breakout', 'sideways_bb_std_mult': 1.1157824685002242, 'sideways_rsi_os': 41, 'sideways_rsi_ob': 46, 'sideways_adx_thresh': 29.56883165815655, 'sideways_atr_min_pct': 0.004378153942404908, 'sideways_atr_max_pct': 0.0667724044534068, 'sideways_tp_mult': 1.7838372110336431, 'sideways_tsl_mult': 0.9322502781875568, 'sideways_time_stop': 217, 'sideways_use_sma': False, 'sideways_use_ema': True, 'sideways_use_atr': False, 'sideways_use_adx': False, 'sideways_use_spike': False, 'sideways_rsi_required': False}.
[I 2025-09-01 09:14:48,607] Trial 103 finished with values: [-1000000000.0, 1000000000.0] and parameters: {'p_sma': 32, 'p_std': 26, 'p_atr': 16, 'p_adx': 20, 'rsi_period': 65, 'ema1': 22, 'ema2': 12, 'slip_atr_k': 0.023131342830520873, 'slip_spread_k': 0.28386635846221653, 'spread_hl_frac': 0.0013915703785789407, 'bb_std_mult': 1.9060078483780347, 'rsi_os': 10, 'rsi_ob': 93, 'vol_spike': 0.2456504587527721, 'adx_thresh': 5.523098728311634, 'atr_min_pct': 0.020004745812936684, 'atr_max_pct': 0.14583050261496405, 'tp_mult': 1.8879303161842753, 'tsl_mult': 0.032046633949288035, 'strategy': 'breakout', 'time_stop': 150, 'use_sma': False, 'use_atr': False, 'use_adx': True, 'use_ema': False, 'use_spike': False, 'rsi_required': False, 'edge_k': 1.4886300973059359, 'edge_cap': 0.1013776322717826, 'bull_strategy': 'mean_reversion', 'bull_bb_std_mult': 1.6474695197300933, 'bull_rsi_os': 13, 'bull_rsi_ob': 58, 'bull_adx_thresh': 18.17006257609592, 'bull_atr_min_pct': 0.02727271306745832, 'bull_atr_max_pct': 0.0639343694587243, 'bull_tp_mult': 1.962801224703108, 'bull_tsl_mult': 0.5658052310138746, 'bull_time_stop': 243, 'bull_use_sma': True, 'bull_use_ema': False, 'bull_use_atr': False, 'bull_use_adx': False, 'bull_use_spike': True, 'bull_rsi_required': True, 'bear_strategy': 'mean_reversion', 'bear_bb_std_mult': 3.4420721457505827, 'bear_rsi_os': 46, 'bear_rsi_ob': 70, 'bear_adx_thresh': 15.135095866873645, 'bear_atr_min_pct': 0.01575584438460361, 'bear_atr_max_pct': 0.1119436226552583, 'bear_tp_mult': 2.436941999640485, 'bear_tsl_mult': 0.43650245323822345, 'bear_time_stop': 6, 'bear_use_sma': False, 'bear_use_ema': False, 'bear_use_atr': True, 'bear_use_adx': False, 'bear_use_spike': False, 'bear_rsi_required': False, 'sideways_strategy': 'breakout', 'sideways_bb_std_mult': 0.588351446551096, 'sideways_rsi_os': 5, 'sideways_rsi_ob': 69, 'sideways_adx_thresh': 33.287351724944614, 'sideways_atr_min_pct': 0.004242171425518923, 'sideways_atr_max_pct': 0.06401104684911113, 'sideways_tp_mult': 1.9346558693229559, 'sideways_tsl_mult': 0.9169514996857085, 'sideways_time_stop': 220, 'sideways_use_sma': False, 'sideways_use_ema': True, 'sideways_use_atr': False, 'sideways_use_adx': False, 'sideways_use_spike': False, 'sideways_rsi_required': False}.
[I 2025-09-01 09:14:48,944] Trial 102 finished with values: [-0.013311914159657157, 0.013344827927499192] and parameters: {'p_sma': 31, 'p_std': 27, 'p_atr': 16, 'p_adx': 15, 'rsi_period': 66, 'ema1': 14, 'ema2': 24, 'slip_atr_k': 0.01996040072728944, 'slip_spread_k': 0.15895421584296182, 'spread_hl_frac': 0.04696039350173402, 'bb_std_mult': 2.2078406685604497, 'rsi_os': 10, 'rsi_ob': 84, 'vol_spike': 0.24140689056991307, 'adx_thresh': 29.303671339077727, 'atr_min_pct': 0.019715983079890614, 'atr_max_pct': 0.1462075271121348, 'tp_mult': 1.876267106105081, 'tsl_mult': 0.030160913170543258, 'strategy': 'breakout', 'time_stop': 151, 'use_sma': False, 'use_atr': False, 'use_adx': True, 'use_ema': False, 'use_spike': False, 'rsi_required': False, 'edge_k': 1.027608012397444, 'edge_cap': 0.0846642745660611, 'bull_strategy': 'mean_reversion', 'bull_bb_std_mult': 1.8801058525172598, 'bull_rsi_os': 13, 'bull_rsi_ob': 55, 'bull_adx_thresh': 5.951742265354625, 'bull_atr_min_pct': 0.027343972967250267, 'bull_atr_max_pct': 0.0627208761780296, 'bull_tp_mult': 1.9717792793067552, 'bull_tsl_mult': 0.5743303872942036, 'bull_time_stop': 300, 'bull_use_sma': True, 'bull_use_ema': False, 'bull_use_atr': False, 'bull_use_adx': False, 'bull_use_spike': True, 'bull_rsi_required': True, 'bear_strategy': 'mean_reversion', 'bear_bb_std_mult': 3.406941824504474, 'bear_rsi_os': 54, 'bear_rsi_ob': 58, 'bear_adx_thresh': 18.531801635946206, 'bear_atr_min_pct': 0.015001621333413906, 'bear_atr_max_pct': 0.1129429456659167, 'bear_tp_mult': 2.432888289926063, 'bear_tsl_mult': 0.5804330768725509, 'bear_time_stop': 214, 'bear_use_sma': False, 'bear_use_ema': False, 'bear_use_atr': True, 'bear_use_adx': False, 'bear_use_spike': False, 'bear_rsi_required': False, 'sideways_strategy': 'breakout', 'sideways_bb_std_mult': 0.6220791681094675, 'sideways_rsi_os': 40, 'sideways_rsi_ob': 72, 'sideways_adx_thresh': 23.680469926435322, 'sideways_atr_min_pct': 0.0043904589909281476, 'sideways_atr_max_pct': 0.0643432969749721, 'sideways_tp_mult': 1.4119930132790108, 'sideways_tsl_mult': 0.9355956291783074, 'sideways_time_stop': 206, 'sideways_use_sma': False, 'sideways_use_ema': True, 'sideways_use_atr': False, 'sideways_use_adx': False, 'sideways_use_spike': False, 'sideways_rsi_required': False}.
[I 2025-09-01 09:14:49,398] Trial 104 finished with values: [-1000000000.0, 1000000000.0] and parameters: {'p_sma': 28, 'p_std': 22, 'p_atr': 16, 'p_adx': 19, 'rsi_period': 67, 'ema1': 22, 'ema2': 12, 'slip_atr_k': 0.0399846147633917, 'slip_spread_k': 0.29905693663995814, 'spread_hl_frac': 0.01661820068861511, 'bb_std_mult': 2.212581268216444, 'rsi_os': 10, 'rsi_ob': 95, 'vol_spike': 0.2454204874170049, 'adx_thresh': 29.27984799725852, 'atr_min_pct': 0.021445027422707017, 'atr_max_pct': 0.07701032963986186, 'tp_mult': 1.895913095030518, 'tsl_mult': 0.03795863826257577, 'strategy': 'breakout', 'time_stop': 152, 'use_sma': False, 'use_atr': False, 'use_adx': True, 'use_ema': False, 'use_spike': False, 'rsi_required': False, 'edge_k': 1.3536426954666825, 'edge_cap': 0.10016992584410606, 'bull_strategy': 'breakout', 'bull_bb_std_mult': 1.6362254592651402, 'bull_rsi_os': 20, 'bull_rsi_ob': 88, 'bull_adx_thresh': 17.959863922737018, 'bull_atr_min_pct': 0.0271334126904394, 'bull_atr_max_pct': 0.06062857600686425, 'bull_tp_mult': 1.9659697865259258, 'bull_tsl_mult': 0.09675975878049142, 'bull_time_stop': 27, 'bull_use_sma': True, 'bull_use_ema': True, 'bull_use_atr': False, 'bull_use_adx': False, 'bull_use_spike': True, 'bull_rsi_required': True, 'bear_strategy': 'mean_reversion', 'bear_bb_std_mult': 3.4462205379217243, 'bear_rsi_os': 53, 'bear_rsi_ob': 71, 'bear_adx_thresh': 15.334616564167034, 'bear_atr_min_pct': 0.014038109783296344, 'bear_atr_max_pct': 0.13255186329218654, 'bear_tp_mult': 2.3054771317661147, 'bear_tsl_mult': 0.42602750889215224, 'bear_time_stop': 195, 'bear_use_sma': False, 'bear_use_ema': False, 'bear_use_atr': True, 'bear_use_adx': False, 'bear_use_spike': False, 'bear_rsi_required': False, 'sideways_strategy': 'breakout', 'sideways_bb_std_mult': 0.6091055911084661, 'sideways_rsi_os': 43, 'sideways_rsi_ob': 47, 'sideways_adx_thresh': 26.97141269663516, 'sideways_atr_min_pct': 0.021807485923359845, 'sideways_atr_max_pct': 0.0666303571191271, 'sideways_tp_mult': 1.5253084322735568, 'sideways_tsl_mult': 0.8158111188441948, 'sideways_time_stop': 215, 'sideways_use_sma': False, 'sideways_use_ema': True, 'sideways_use_atr': False, 'sideways_use_adx': False, 'sideways_use_spike': False, 'sideways_rsi_required': False}.
[I 2025-09-01 09:14:49,399] Trial 105 finished with values: [-0.01731660984583594, 0.01784346073214029] and parameters: {'p_sma': 32, 'p_std': 22, 'p_atr': 18, 'p_adx': 15, 'rsi_period': 66, 'ema1': 18, 'ema2': 16, 'slip_atr_k': 0.0411856979587865, 'slip_spread_k': 0.3035269343677519, 'spread_hl_frac': 0.04910999096174441, 'bb_std_mult': 1.8208668002572816, 'rsi_os': 20, 'rsi_ob': 89, 'vol_spike': 0.21363120702119745, 'adx_thresh': 5.115063300712682, 'atr_min_pct': 0.020488041316664506, 'atr_max_pct': 0.14626357841021695, 'tp_mult': 1.7009319509308214, 'tsl_mult': 0.03513691741120163, 'strategy': 'breakout', 'time_stop': 209, 'use_sma': True, 'use_atr': False, 'use_adx': True, 'use_ema': False, 'use_spike': False, 'rsi_required': False, 'edge_k': 1.3500272868280154, 'edge_cap': 0.1049198134609407, 'bull_strategy': 'mean_reversion', 'bull_bb_std_mult': 0.6138547041391921, 'bull_rsi_os': 20, 'bull_rsi_ob': 60, 'bull_adx_thresh': 5.885536555547381, 'bull_atr_min_pct': 0.027214806734437054, 'bull_atr_max_pct': 0.08165209275975484, 'bull_tp_mult': 1.9963711398188222, 'bull_tsl_mult': 0.1633897605142871, 'bull_time_stop': 122, 'bull_use_sma': True, 'bull_use_ema': False, 'bull_use_atr': False, 'bull_use_adx': False, 'bull_use_spike': False, 'bull_rsi_required': True, 'bear_strategy': 'mean_reversion', 'bear_bb_std_mult': 3.4466545118370573, 'bear_rsi_os': 47, 'bear_rsi_ob': 70, 'bear_adx_thresh': 15.09986983971624, 'bear_atr_min_pct': 0.01620158464486402, 'bear_atr_max_pct': 0.11785553354638711, 'bear_tp_mult': 2.3161230266283437, 'bear_tsl_mult': 0.43454439941753087, 'bear_time_stop': 217, 'bear_use_sma': False, 'bear_use_ema': True, 'bear_use_atr': True, 'bear_use_adx': False, 'bear_use_spike': False, 'bear_rsi_required': False, 'sideways_strategy': 'breakout', 'sideways_bb_std_mult': 1.3521955594390103, 'sideways_rsi_os': 43, 'sideways_rsi_ob': 46, 'sideways_adx_thresh': 30.97331987495807, 'sideways_atr_min_pct': 0.004283359099981001, 'sideways_atr_max_pct': 0.08570391775023103, 'sideways_tp_mult': 1.8144992073799162, 'sideways_tsl_mult': 0.9411131723040844, 'sideways_time_stop': 217, 'sideways_use_sma': False, 'sideways_use_ema': True, 'sideways_use_atr': False, 'sideways_use_adx': False, 'sideways_use_spike': False, 'sideways_rsi_required': False}.
[I 2025-09-01 09:15:29,975] Trial 108 finished with values: [-1000000000.0, 1000000000.0] and parameters: {'p_sma': 29, 'p_std': 28, 'p_atr': 15, 'p_adx': 15, 'rsi_period': 50, 'ema1': 19, 'ema2': 15, 'slip_atr_k': 0.05255340544315994, 'slip_spread_k': 0.36182459055066973, 'spread_hl_frac': 0.012692655573855715, 'bb_std_mult': 1.6566122263084821, 'rsi_os': 19, 'rsi_ob': 89, 'vol_spike': 0.21237328113218734, 'adx_thresh': 6.807978555597797, 'atr_min_pct': 0.01955104271984484, 'atr_max_pct': 0.14006305365098495, 'tp_mult': 1.7716406968715048, 'tsl_mult': 0.8948792125484201, 'strategy': 'breakout', 'time_stop': 209, 'use_sma': True, 'use_atr': False, 'use_adx': True, 'use_ema': False, 'use_spike': False, 'rsi_required': False, 'edge_k': 1.4250302042678376, 'edge_cap': 0.08562189895541578, 'bull_strategy': 'mean_reversion', 'bull_bb_std_mult': 0.6709702712749721, 'bull_rsi_os': 20, 'bull_rsi_ob': 61, 'bull_adx_thresh': 10.033510895577471, 'bull_atr_min_pct': 0.02929232608527031, 'bull_atr_max_pct': 0.0684401124944781, 'bull_tp_mult': 2.0885803333045274, 'bull_tsl_mult': 0.09984418686990831, 'bull_time_stop': 119, 'bull_use_sma': False, 'bull_use_ema': False, 'bull_use_atr': False, 'bull_use_adx': False, 'bull_use_spike': False, 'bull_rsi_required': True, 'bear_strategy': 'mean_reversion', 'bear_bb_std_mult': 3.5938309975523803, 'bear_rsi_os': 45, 'bear_rsi_ob': 75, 'bear_adx_thresh': 27.31215256579806, 'bear_atr_min_pct': 0.01637774006348154, 'bear_atr_max_pct': 0.11931050297374383, 'bear_tp_mult': 2.36612425590681, 'bear_tsl_mult': 0.33834499369029586, 'bear_time_stop': 216, 'bear_use_sma': False, 'bear_use_ema': True, 'bear_use_atr': True, 'bear_use_adx': True, 'bear_use_spike': False, 'bear_rsi_required': False, 'sideways_strategy': 'breakout', 'sideways_bb_std_mult': 1.3547834890974275, 'sideways_rsi_os': 41, 'sideways_rsi_ob': 45, 'sideways_adx_thresh': 29.393262230375576, 'sideways_atr_min_pct': 0.005292858303970896, 'sideways_atr_max_pct': 0.08681854542191213, 'sideways_tp_mult': 1.7616029437732694, 'sideways_tsl_mult': 0.9507435889794835, 'sideways_time_stop': 247, 'sideways_use_sma': False, 'sideways_use_ema': True, 'sideways_use_atr': False, 'sideways_use_adx': False, 'sideways_use_spike': False, 'sideways_rsi_required': False}.
[I 2025-09-01 09:15:30,897] Trial 107 finished with values: [-1000000000.0, 1000000000.0] and parameters: {'p_sma': 30, 'p_std': 20, 'p_atr': 15, 'p_adx': 15, 'rsi_period': 68, 'ema1': 19, 'ema2': 16, 'slip_atr_k': 0.04221475710909419, 'slip_spread_k': 0.1754623921992618, 'spread_hl_frac': 0.0488280034791244, 'bb_std_mult': 1.9686719783412494, 'rsi_os': 24, 'rsi_ob': 95, 'vol_spike': 0.2198391403653233, 'adx_thresh': 7.057493405284124, 'atr_min_pct': 0.02169979813053417, 'atr_max_pct': 0.1460098569896777, 'tp_mult': 1.7097217881708633, 'tsl_mult': 0.02515060578190892, 'strategy': 'breakout', 'time_stop': 208, 'use_sma': True, 'use_atr': False, 'use_adx': True, 'use_ema': False, 'use_spike': False, 'rsi_required': False, 'edge_k': 1.3520242291641351, 'edge_cap': 0.08613442870971201, 'bull_strategy': 'mean_reversion', 'bull_bb_std_mult': 0.6416050147397885, 'bull_rsi_os': 20, 'bull_rsi_ob': 67, 'bull_adx_thresh': 5.948521354493925, 'bull_atr_min_pct': 0.029026560095775415, 'bull_atr_max_pct': 0.08031581557631025, 'bull_tp_mult': 2.106694338527155, 'bull_tsl_mult': 0.1182847940011277, 'bull_time_stop': 121, 'bull_use_sma': True, 'bull_use_ema': False, 'bull_use_atr': False, 'bull_use_adx': False, 'bull_use_spike': False, 'bull_rsi_required': True, 'bear_strategy': 'mean_reversion', 'bear_bb_std_mult': 3.5890435161282985, 'bear_rsi_os': 45, 'bear_rsi_ob': 74, 'bear_adx_thresh': 11.797686205149866, 'bear_atr_min_pct': 0.01645674838222896, 'bear_atr_max_pct': 0.12511956360170737, 'bear_tp_mult': 2.3440690830764703, 'bear_tsl_mult': 0.37175591276581244, 'bear_time_stop': 213, 'bear_use_sma': False, 'bear_use_ema': True, 'bear_use_atr': True, 'bear_use_adx': True, 'bear_use_spike': False, 'bear_rsi_required': False, 'sideways_strategy': 'breakout', 'sideways_bb_std_mult': 1.59272724927466, 'sideways_rsi_os': 40, 'sideways_rsi_ob': 47, 'sideways_adx_thresh': 31.014233123701562, 'sideways_atr_min_pct': 0.021844062886513076, 'sideways_atr_max_pct': 0.08308813002635626, 'sideways_tp_mult': 1.7760296855051594, 'sideways_tsl_mult': 0.9598231805072381, 'sideways_time_stop': 189, 'sideways_use_sma': False, 'sideways_use_ema': True, 'sideways_use_atr': False, 'sideways_use_adx': False, 'sideways_use_spike': False, 'sideways_rsi_required': False}.
