[I 2025-09-01 09:46:26,614] Trial 295 finished with values: [-0.029333384877065383, 0.029062224072684155] and parameters: {'p_sma': 21, 'p_std': 44, 'p_atr': 29, 'p_adx': 20, 'rsi_period': 66, 'ema1': 21, 'ema2': 38, 'slip_atr_k': 0.052146557501546745, 'slip_spread_k': 0.19794103038644, 'spread_hl_frac': 0.02721958909006262, 'bb_std_mult': 3.253221240363712, 'rsi_os': 20, 'rsi_ob': 77, 'vol_spike': 0.29841548968625287, 'adx_thresh': 7.4370534040262655, 'atr_min_pct': 0.026165749470991977, 'atr_max_pct': 0.13548738913331873, 'tp_mult': 2.448220720239127, 'tsl_mult': 0.019740566923509544, 'strategy': 'breakout', 'time_stop': 167, 'use_sma': True, 'use_atr': False, 'use_adx': True, 'use_ema': False, 'use_spike': False, 'rsi_required': False, 'edge_k': 1.0102663194533539, 'edge_cap': 0.5542804963072792, 'bull_strategy': 'mean_reversion', 'bull_bb_std_mult': 0.8767097641872815, 'bull_rsi_os': 17, 'bull_rsi_ob': 58, 'bull_adx_thresh': 6.6176904968118375, 'bull_atr_min_pct': 0.028302514426465756, 'bull_atr_max_pct': 0.08659269057738202, 'bull_tp_mult': 1.8261570706241692, 'bull_tsl_mult': 0.0663076864676457, 'bull_time_stop': 152, 'bull_use_sma': True, 'bull_use_ema': False, 'bull_use_atr': True, 'bull_use_adx': True, 'bull_use_spike': False, 'bull_rsi_required': True, 'bear_strategy': 'mean_reversion', 'bear_bb_std_mult': 3.4759956597991932, 'bear_rsi_os': 50, 'bear_rsi_ob': 47, 'bear_adx_thresh': 13.755347266141069, 'bear_atr_min_pct': 0.015812669483117495, 'bear_atr_max_pct': 0.06099758451997203, 'bear_tp_mult': 1.3160871658221192, 'bear_tsl_mult': 0.35076390347849284, 'bear_time_stop': 151, 'bear_use_sma': False, 'bear_use_ema': True, 'bear_use_atr': True, 'bear_use_adx': False, 'bear_use_spike': True, 'bear_rsi_required': False, 'sideways_strategy': 'breakout', 'sideways_bb_std_mult': 3.212535757194113, 'sideways_rsi_os': 48, 'sideways_rsi_ob': 47, 'sideways_adx_thresh': 28.877581185933458, 'sideways_atr_min_pct': 0.0028187148921283763, 'sideways_atr_max_pct': 0.0696902802001939, 'sideways_tp_mult': 1.3121228138805383, 'sideways_tsl_mult': 0.9447336730698058, 'sideways_time_stop': 182, 'sideways_use_sma': False, 'sideways_use_ema': True, 'sideways_use_atr': False, 'sideways_use_adx': False, 'sideways_use_spike': False, 'sideways_rsi_required': False}.
[I 2025-09-01 09:46:26,624] Trial 298 finished with values: [-0.04831044942075535, 0.048719713264931214] and parameters: {'p_sma': 23, 'p_std': 42, 'p_atr': 29, 'p_adx': 21, 'rsi_period': 64, 'ema1': 20, 'ema2': 42, 'slip_atr_k': 0.05093692887449292, 'slip_spread_k': 0.1551697222618465, 'spread_hl_frac': 0.031005822600157416, 'bb_std_mult': 3.4040617995285305, 'rsi_os': 24, 'rsi_ob': 78, 'vol_spike': 0.2963994410036833, 'adx_thresh': 7.281680910666251, 'atr_min_pct': 0.02274599728856822, 'atr_max_pct': 0.1349446468577717, 'tp_mult': 2.6195933170245294, 'tsl_mult': 0.02463404948545159, 'strategy': 'breakout', 'time_stop': 167, 'use_sma': True, 'use_atr': False, 'use_adx': True, 'use_ema': False, 'use_spike': False, 'rsi_required': False, 'edge_k': 0.9179802560869229, 'edge_cap': 0.5770484522438709, 'bull_strategy': 'mean_reversion', 'bull_bb_std_mult': 0.8569129728213768, 'bull_rsi_os': 18, 'bull_rsi_ob': 58, 'bull_adx_thresh': 6.804762800068646, 'bull_atr_min_pct': 0.028402451569044647, 'bull_atr_max_pct': 0.0888951176652049, 'bull_tp_mult': 1.8357959740523662, 'bull_tsl_mult': 0.08894562157700159, 'bull_time_stop': 147, 'bull_use_sma': True, 'bull_use_ema': False, 'bull_use_atr': True, 'bull_use_adx': True, 'bull_use_spike': False, 'bull_rsi_required': True, 'bear_strategy': 'mean_reversion', 'bear_bb_std_mult': 3.500564121623557, 'bear_rsi_os': 50, 'bear_rsi_ob': 46, 'bear_adx_thresh': 13.79734871322325, 'bear_atr_min_pct': 0.015587525447578543, 'bear_atr_max_pct': 0.0574719380658027, 'bear_tp_mult': 1.2664230390864903, 'bear_tsl_mult': 0.35061043190687396, 'bear_time_stop': 151, 'bear_use_sma': False, 'bear_use_ema': True, 'bear_use_atr': True, 'bear_use_adx': False, 'bear_use_spike': True, 'bear_rsi_required': False, 'sideways_strategy': 'breakout', 'sideways_bb_std_mult': 3.297015773504531, 'sideways_rsi_os': 49, 'sideways_rsi_ob': 47, 'sideways_adx_thresh': 28.573129935360683, 'sideways_atr_min_pct': 0.002509986296827461, 'sideways_atr_max_pct': 0.06724295004271548, 'sideways_tp_mult': 1.359199008609675, 'sideways_tsl_mult': 0.9329112680874002, 'sideways_time_stop': 183, 'sideways_use_sma': False, 'sideways_use_ema': True, 'sideways_use_atr': False, 'sideways_use_adx': False, 'sideways_use_spike': False, 'sideways_rsi_required': False}.
[I 2025-09-01 09:47:06,449] Trial 299 finished with values: [-0.02058461833768266, 0.02081084048941727] and parameters: {'p_sma': 23, 'p_std': 40, 'p_atr': 30, 'p_adx': 21, 'rsi_period': 64, 'ema1': 19, 'ema2': 39, 'slip_atr_k': 0.0482700485769923, 'slip_spread_k': 0.1619319163213402, 'spread_hl_frac': 0.03052457561069671, 'bb_std_mult': 3.412527362709596, 'rsi_os': 21, 'rsi_ob': 77, 'vol_spike': 0.2971619906662392, 'adx_thresh': 7.394317888304118, 'atr_min_pct': 0.02612792685106283, 'atr_max_pct': 0.1334746860462637, 'tp_mult': 2.696938409006453, 'tsl_mult': 0.00038778399016401984, 'strategy': 'breakout', 'time_stop': 168, 'use_sma': True, 'use_atr': False, 'use_adx': True, 'use_ema': False, 'use_spike': False, 'rsi_required': False, 'edge_k': 1.0292306703980667, 'edge_cap': 0.5696018502343628, 'bull_strategy': 'mean_reversion', 'bull_bb_std_mult': 0.8314591979039141, 'bull_rsi_os': 18, 'bull_rsi_ob': 58, 'bull_adx_thresh': 6.605146216236593, 'bull_atr_min_pct': 0.028566210520862115, 'bull_atr_max_pct': 0.08678278325345226, 'bull_tp_mult': 1.80738835927182, 'bull_tsl_mult': 0.08981710314344378, 'bull_time_stop': 146, 'bull_use_sma': True, 'bull_use_ema': False, 'bull_use_atr': True, 'bull_use_adx': True, 'bull_use_spike': False, 'bull_rsi_required': True, 'bear_strategy': 'mean_reversion', 'bear_bb_std_mult': 3.545943441219284, 'bear_rsi_os': 53, 'bear_rsi_ob': 45, 'bear_adx_thresh': 12.952961195199698, 'bear_atr_min_pct': 0.014619302191825398, 'bear_atr_max_pct': 0.057127060224231294, 'bear_tp_mult': 1.264870220714226, 'bear_tsl_mult': 0.39206146564148947, 'bear_time_stop': 147, 'bear_use_sma': False, 'bear_use_ema': True, 'bear_use_atr': True, 'bear_use_adx': False, 'bear_use_spike': True, 'bear_rsi_required': False, 'sideways_strategy': 'breakout', 'sideways_bb_std_mult': 3.2930075537506163, 'sideways_rsi_os': 50, 'sideways_rsi_ob': 47, 'sideways_adx_thresh': 27.23990663994354, 'sideways_atr_min_pct': 0.0031821268811415304, 'sideways_atr_max_pct': 0.0670054066366757, 'sideways_tp_mult': 1.3714468108790532, 'sideways_tsl_mult': 0.95275728637647, 'sideways_time_stop': 189, 'sideways_use_sma': False, 'sideways_use_ema': True, 'sideways_use_atr': False, 'sideways_use_adx': False, 'sideways_use_spike': False, 'sideways_rsi_required': False}.
[I 2025-09-01 09:47:06,451] Trial 301 finished with values: [-0.025798682284616237, 0.025543534202747627] and parameters: {'p_sma': 20, 'p_std': 39, 'p_atr': 30, 'p_adx': 21, 'rsi_period': 64, 'ema1': 19, 'ema2': 41, 'slip_atr_k': 0.04941147652068486, 'slip_spread_k': 0.17335159191960914, 'spread_hl_frac': 0.030551706536681225, 'bb_std_mult': 3.450240428255648, 'rsi_os': 23, 'rsi_ob': 75, 'vol_spike': 0.28763795237258877, 'adx_thresh': 6.985383753318189, 'atr_min_pct': 0.026042365237583867, 'atr_max_pct': 0.12768436419004198, 'tp_mult': 2.6767269837304393, 'tsl_mult': 5.231884974842005e-05, 'strategy': 'breakout', 'time_stop': 160, 'use_sma': True, 'use_atr': False, 'use_adx': True, 'use_ema': False, 'use_spike': False, 'rsi_required': False, 'edge_k': 1.0372592094515505, 'edge_cap': 0.5785040252053145, 'bull_strategy': 'mean_reversion', 'bull_bb_std_mult': 0.8358011504331985, 'bull_rsi_os': 19, 'bull_rsi_ob': 60, 'bull_adx_thresh': 6.706969308631254, 'bull_atr_min_pct': 0.028585145739012833, 'bull_atr_max_pct': 0.08453708560143694, 'bull_tp_mult': 1.926585569050371, 'bull_tsl_mult': 0.0935088045335841, 'bull_time_stop': 143, 'bull_use_sma': True, 'bull_use_ema': False, 'bull_use_atr': True, 'bull_use_adx': True, 'bull_use_spike': False, 'bull_rsi_required': True, 'bear_strategy': 'mean_reversion', 'bear_bb_std_mult': 3.554928212712718, 'bear_rsi_os': 53, 'bear_rsi_ob': 49, 'bear_adx_thresh': 13.003921741594134, 'bear_atr_min_pct': 0.015319927536190072, 'bear_atr_max_pct': 0.0653350512417671, 'bear_tp_mult': 1.3395272741225894, 'bear_tsl_mult': 0.38717461659627883, 'bear_time_stop': 148, 'bear_use_sma': False, 'bear_use_ema': True, 'bear_use_atr': True, 'bear_use_adx': False, 'bear_use_spike': True, 'bear_rsi_required': False, 'sideways_strategy': 'breakout', 'sideways_bb_std_mult': 3.312765621909922, 'sideways_rsi_os': 51, 'sideways_rsi_ob': 51, 'sideways_adx_thresh': 27.731771106717243, 'sideways_atr_min_pct': 0.0030084528755023837, 'sideways_atr_max_pct': 0.06719398457652234, 'sideways_tp_mult': 1.3645095209768394, 'sideways_tsl_mult': 0.8863995332189144, 'sideways_time_stop': 193, 'sideways_use_sma': False, 'sideways_use_ema': True, 'sideways_use_atr': False, 'sideways_use_adx': False, 'sideways_use_spike': False, 'sideways_rsi_required': False}.
[I 2025-09-01 09:47:07,085] Trial 300 finished with values: [-0.026482126769981185, 0.026259079124879396] and parameters: {'p_sma': 23, 'p_std': 39, 'p_atr': 30, 'p_adx': 21, 'rsi_period': 61, 'ema1': 19, 'ema2': 41, 'slip_atr_k': 0.049640000623467385, 'slip_spread_k': 0.15461522506157666, 'spread_hl_frac': 0.03118330095078911, 'bb_std_mult': 3.4178814234995603, 'rsi_os': 23, 'rsi_ob': 74, 'vol_spike': 0.2974448309556634, 'adx_thresh': 6.905444702523977, 'atr_min_pct': 0.02837546316137159, 'atr_max_pct': 0.1382152683331369, 'tp_mult': 2.6886849973444953, 'tsl_mult': 0.0016291333772834925, 'strategy': 'breakout', 'time_stop': 167, 'use_sma': True, 'use_atr': False, 'use_adx': True, 'use_ema': False, 'use_spike': False, 'rsi_required': False, 'edge_k': 1.0161841327032959, 'edge_cap': 0.5317506576436583, 'bull_strategy': 'mean_reversion', 'bull_bb_std_mult': 0.8396591156951131, 'bull_rsi_os': 18, 'bull_rsi_ob': 58, 'bull_adx_thresh': 5.054810202672019, 'bull_atr_min_pct': 0.028315087954248783, 'bull_atr_max_pct': 0.08963272017995955, 'bull_tp_mult': 1.8278502968807662, 'bull_tsl_mult': 0.09341039935575401, 'bull_time_stop': 146, 'bull_use_sma': True, 'bull_use_ema': False, 'bull_use_atr': True, 'bull_use_adx': True, 'bull_use_spike': False, 'bull_rsi_required': True, 'bear_strategy': 'mean_reversion', 'bear_bb_std_mult': 3.5943993790203934, 'bear_rsi_os': 50, 'bear_rsi_ob': 47, 'bear_adx_thresh': 13.02980163137808, 'bear_atr_min_pct': 0.01545556541964741, 'bear_atr_max_pct': 0.05894860934238791, 'bear_tp_mult': 1.252331839779047, 'bear_tsl_mult': 0.3917212184946261, 'bear_time_stop': 145, 'bear_use_sma': False, 'bear_use_ema': True, 'bear_use_atr': True, 'bear_use_adx': False, 'bear_use_spike': True, 'bear_rsi_required': False, 'sideways_strategy': 'breakout', 'sideways_bb_std_mult': 3.299603872041064, 'sideways_rsi_os': 50, 'sideways_rsi_ob': 50, 'sideways_adx_thresh': 28.614950413251076, 'sideways_atr_min_pct': 0.002914257426121272, 'sideways_atr_max_pct': 0.06723795960013362, 'sideways_tp_mult': 1.3631278018871673, 'sideways_tsl_mult': 0.8847132725791237, 'sideways_time_stop': 190, 'sideways_use_sma': False, 'sideways_use_ema': True, 'sideways_use_atr': False, 'sideways_use_adx': False, 'sideways_use_spike': False, 'sideways_rsi_required': False}.
[I 2025-09-01 09:47:07,357] Trial 302 finished with values: [-0.026726067216839344, 0.026706617086616542] and parameters: {'p_sma': 23, 'p_std': 39, 'p_atr': 30, 'p_adx': 21, 'rsi_period': 64, 'ema1': 19, 'ema2': 39, 'slip_atr_k': 0.047519932723762495, 'slip_spread_k': 0.14160623710565998, 'spread_hl_frac': 0.028560173584285562, 'bb_std_mult': 3.13157785067302, 'rsi_os': 23, 'rsi_ob': 74, 'vol_spike': 0.2916093171096455, 'adx_thresh': 7.116128813945703, 'atr_min_pct': 0.027927876752433238, 'atr_max_pct': 0.1271318330865501, 'tp_mult': 2.6671917424094875, 'tsl_mult': 0.03366691203175033, 'strategy': 'breakout', 'time_stop': 160, 'use_sma': True, 'use_atr': False, 'use_adx': True, 'use_ema': False, 'use_spike': False, 'rsi_required': False, 'edge_k': 1.0282143867632703, 'edge_cap': 0.5393488363486937, 'bull_strategy': 'mean_reversion', 'bull_bb_std_mult': 0.9149426956986443, 'bull_rsi_os': 15, 'bull_rsi_ob': 58, 'bull_adx_thresh': 5.367243231388517, 'bull_atr_min_pct': 0.028589000871468873, 'bull_atr_max_pct': 0.08487170472202346, 'bull_tp_mult': 1.8949109203632977, 'bull_tsl_mult': 0.09636598732726635, 'bull_time_stop': 144, 'bull_use_sma': True, 'bull_use_ema': False, 'bull_use_atr': True, 'bull_use_adx': True, 'bull_use_spike': False, 'bull_rsi_required': True, 'bear_strategy': 'mean_reversion', 'bear_bb_std_mult': 3.592547789667259, 'bear_rsi_os': 52, 'bear_rsi_ob': 49, 'bear_adx_thresh': 12.814375283767548, 'bear_atr_min_pct': 0.01391370102686159, 'bear_atr_max_pct': 0.06393882482228655, 'bear_tp_mult': 1.2534638818278014, 'bear_tsl_mult': 0.3933303546449668, 'bear_time_stop': 145, 'bear_use_sma': False, 'bear_use_ema': True, 'bear_use_atr': True, 'bear_use_adx': False, 'bear_use_spike': True, 'bear_rsi_required': False, 'sideways_strategy': 'breakout', 'sideways_bb_std_mult': 3.2304521633035543, 'sideways_rsi_os': 50, 'sideways_rsi_ob': 48, 'sideways_adx_thresh': 27.11519828263527, 'sideways_atr_min_pct': 0.003087433769561632, 'sideways_atr_max_pct': 0.06550904628074118, 'sideways_tp_mult': 1.3780460300021558, 'sideways_tsl_mult': 0.8751291911586769, 'sideways_time_stop': 192, 'sideways_use_sma': False, 'sideways_use_ema': True, 'sideways_use_atr': False, 'sideways_use_adx': False, 'sideways_use_spike': False, 'sideways_rsi_required': False}.
[I 2025-09-01 09:47:50,521] Trial 305 finished with values: [-0.015761146404519755, 0.0163820187116383] and parameters: {'p_sma': 23, 'p_std': 40, 'p_atr': 30, 'p_adx': 21, 'rsi_period': 61, 'ema1': 20, 'ema2': 39, 'slip_atr_k': 0.04844342217900385, 'slip_spread_k': 0.16141910559843986, 'spread_hl_frac': 0.029270164133934767, 'bb_std_mult': 3.1362247760039397, 'rsi_os': 16, 'rsi_ob': 76, 'vol_spike': 0.286486292198999, 'adx_thresh': 6.904744598779301, 'atr_min_pct': 0.026189503270328887, 'atr_max_pct': 0.1392209685372773, 'tp_mult': 2.573907950643095, 'tsl_mult': 0.03770730033982791, 'strategy': 'breakout', 'time_stop': 160, 'use_sma': True, 'use_atr': False, 'use_adx': True, 'use_ema': False, 'use_spike': False, 'rsi_required': False, 'edge_k': 1.021119881914739, 'edge_cap': 0.5184222879205196, 'bull_strategy': 'mean_reversion', 'bull_bb_std_mult': 0.8293742876358555, 'bull_rsi_os': 19, 'bull_rsi_ob': 58, 'bull_adx_thresh': 5.0400973918563015, 'bull_atr_min_pct': 0.028591475262847936, 'bull_atr_max_pct': 0.08461354283357043, 'bull_tp_mult': 1.8864243518216852, 'bull_tsl_mult': 0.09685821074220599, 'bull_time_stop': 146, 'bull_use_sma': True, 'bull_use_ema': False, 'bull_use_atr': True, 'bull_use_adx': True, 'bull_use_spike': False, 'bull_rsi_required': True, 'bear_strategy': 'mean_reversion', 'bear_bb_std_mult': 3.593177809086235, 'bear_rsi_os': 48, 'bear_rsi_ob': 45, 'bear_adx_thresh': 13.158222776823516, 'bear_atr_min_pct': 0.014024647354553724, 'bear_atr_max_pct': 0.07106630369222394, 'bear_tp_mult': 1.349891960210916, 'bear_tsl_mult': 0.40186717952079193, 'bear_time_stop': 144, 'bear_use_sma': False, 'bear_use_ema': True, 'bear_use_atr': True, 'bear_use_adx': False, 'bear_use_spike': True, 'bear_rsi_required': False, 'sideways_strategy': 'breakout', 'sideways_bb_std_mult': 3.2168034019107097, 'sideways_rsi_os': 50, 'sideways_rsi_ob': 46, 'sideways_adx_thresh': 27.260469319290852, 'sideways_atr_min_pct': 0.0033357354501378548, 'sideways_atr_max_pct': 0.06366243255509657, 'sideways_tp_mult': 1.3623752048166926, 'sideways_tsl_mult': 0.9493833991112169, 'sideways_time_stop': 191, 'sideways_use_sma': False, 'sideways_use_ema': True, 'sideways_use_atr': False, 'sideways_use_adx': False, 'sideways_use_spike': False, 'sideways_rsi_required': False}.
[I 2025-09-01 09:47:50,955] Trial 306 finished with values: [-0.012139709213801142, 0.013241138300829266] and parameters: {'p_sma': 22, 'p_std': 40, 'p_atr': 30, 'p_adx': 21, 'rsi_period': 68, 'ema1': 20, 'ema2': 39, 'slip_atr_k': 0.04840911003019634, 'slip_spread_k': 0.13805769740338697, 'spread_hl_frac': 0.029225652535160664, 'bb_std_mult': 3.358826871999235, 'rsi_os': 23, 'rsi_ob': 76, 'vol_spike': 0.28740046916774037, 'adx_thresh': 6.941297552754212, 'atr_min_pct': 0.023962945648638843, 'atr_max_pct': 0.1373093915148663, 'tp_mult': 2.6698519031690133, 'tsl_mult': 0.003423854323082334, 'strategy': 'breakout', 'time_stop': 158, 'use_sma': True, 'use_atr': False, 'use_adx': True, 'use_ema': False, 'use_spike': False, 'rsi_required': False, 'edge_k': 1.0421620453566138, 'edge_cap': 0.5358936319911101, 'bull_strategy': 'mean_reversion', 'bull_bb_std_mult': 0.8313258416488332, 'bull_rsi_os': 15, 'bull_rsi_ob': 60, 'bull_adx_thresh': 7.725991773363528, 'bull_atr_min_pct': 0.02860561292331455, 'bull_atr_max_pct': 0.08765100654833212, 'bull_tp_mult': 1.8981969145900977, 'bull_tsl_mult': 0.09664068345625346, 'bull_time_stop': 144, 'bull_use_sma': True, 'bull_use_ema': False, 'bull_use_atr': True, 'bull_use_adx': True, 'bull_use_spike': False, 'bull_rsi_required': True, 'bear_strategy': 'mean_reversion', 'bear_bb_std_mult': 3.5984222788932247, 'bear_rsi_os': 48, 'bear_rsi_ob': 49, 'bear_adx_thresh': 12.880884286943022, 'bear_atr_min_pct': 0.012577185422731925, 'bear_atr_max_pct': 0.06385617776387702, 'bear_tp_mult': 1.3549052540551723, 'bear_tsl_mult': 0.393842148957367, 'bear_time_stop': 132, 'bear_use_sma': False, 'bear_use_ema': True, 'bear_use_atr': True, 'bear_use_adx': False, 'bear_use_spike': True, 'bear_rsi_required': False, 'sideways_strategy': 'breakout', 'sideways_bb_std_mult': 3.2285090419417837, 'sideways_rsi_os': 50, 'sideways_rsi_ob': 50, 'sideways_adx_thresh': 27.232778232963074, 'sideways_atr_min_pct': 0.0033614159407677397, 'sideways_atr_max_pct': 0.05952630588773283, 'sideways_tp_mult': 1.3755509031113426, 'sideways_tsl_mult': 0.8861915574434404, 'sideways_time_stop': 192, 'sideways_use_sma': False, 'sideways_use_ema': True, 'sideways_use_atr': False, 'sideways_use_adx': False, 'sideways_use_spike': False, 'sideways_rsi_required': False}.
[I 2025-09-01 09:47:51,414] Trial 304 finished with values: [-0.014908787108646404, 0.01552999444834339] and parameters: {'p_sma': 23, 'p_std': 39, 'p_atr': 30, 'p_adx': 21, 'rsi_period': 61, 'ema1': 20, 'ema2': 39, 'slip_atr_k': 0.048080448076715354, 'slip_spread_k': 0.16399991778986472, 'spread_hl_frac': 0.030188011595559498, 'bb_std_mult': 3.327852584769568, 'rsi_os': 21, 'rsi_ob': 76, 'vol_spike': 0.29075311056971276, 'adx_thresh': 6.847010097012273, 'atr_min_pct': 0.025812224733449962, 'atr_max_pct': 0.12829215092903964, 'tp_mult': 2.8816432923735364, 'tsl_mult': 0.0036213542151790046, 'strategy': 'breakout', 'time_stop': 157, 'use_sma': True, 'use_atr': False, 'use_adx': True, 'use_ema': False, 'use_spike': False, 'rsi_required': False, 'edge_k': 1.0454808698919922, 'edge_cap': 0.5142108037471859, 'bull_strategy': 'mean_reversion', 'bull_bb_std_mult': 0.8156502608368974, 'bull_rsi_os': 15, 'bull_rsi_ob': 61, 'bull_adx_thresh': 5.0715719752824295, 'bull_atr_min_pct': 0.028714061100077553, 'bull_atr_max_pct': 0.08744061168942154, 'bull_tp_mult': 1.88759958855283, 'bull_tsl_mult': 0.0994417380090084, 'bull_time_stop': 159, 'bull_use_sma': True, 'bull_use_ema': False, 'bull_use_atr': True, 'bull_use_adx': True, 'bull_use_spike': False, 'bull_rsi_required': True, 'bear_strategy': 'mean_reversion', 'bear_bb_std_mult': 3.591501294836372, 'bear_rsi_os': 52, 'bear_rsi_ob': 50, 'bear_adx_thresh': 12.805623890840346, 'bear_atr_min_pct': 0.01396633949120896, 'bear_atr_max_pct': 0.06367430356850369, 'bear_tp_mult': 1.3358032084328098, 'bear_tsl_mult': 0.3940970276800203, 'bear_time_stop': 144, 'bear_use_sma': False, 'bear_use_ema': True, 'bear_use_atr': True, 'bear_use_adx': False, 'bear_use_spike': True, 'bear_rsi_required': False, 'sideways_strategy': 'breakout', 'sideways_bb_std_mult': 3.2496140666452478, 'sideways_rsi_os': 51, 'sideways_rsi_ob': 50, 'sideways_adx_thresh': 27.401737712406934, 'sideways_atr_min_pct': 0.0033360368344217306, 'sideways_atr_max_pct': 0.06453542683591694, 'sideways_tp_mult': 1.3774459505123844, 'sideways_tsl_mult': 0.9546633272354754, 'sideways_time_stop': 190, 'sideways_use_sma': False, 'sideways_use_ema': True, 'sideways_use_atr': False, 'sideways_use_adx': False, 'sideways_use_spike': False, 'sideways_rsi_required': False}.
