[I 2025-09-01 09:00:12,311] Trial 9 finished with values: [-0.07797319861539453, 0.07758257676104229] and parameters: {'p_sma': 53, 'p_std': 28, 'p_atr': 18, 'p_adx': 21, 'rsi_period': 68, 'ema1': 28, 'ema2': 36, 'slip_atr_k': 0.12840281539995752, 'slip_spread_k': 0.43395585076652265, 'spread_hl_frac': 0.002257524744137912, 'bb_std_mult': 0.6475201170572874, 'rsi_os': 27, 'rsi_ob': 72, 'vol_spike': 0.06380118616126045, 'adx_thresh': 20.347860984899498, 'atr_min_pct': 0.0077714868148862255, 'atr_max_pct': 0.017437578089889563, 'tp_mult': 2.434207118051079, 'tsl_mult': 0.6525751445996929, 'strategy': 'breakout', 'time_stop': 128, 'use_sma': False, 'use_atr': False, 'use_adx': False, 'use_ema': True, 'use_spike': False, 'rsi_required': True, 'edge_k': 0.31081492733955307, 'edge_cap': 0.7827360726075772, 'bull_strategy': 'breakout', 'bull_bb_std_mult': 2.1939338788445863, 'bull_rsi_os': 50, 'bull_rsi_ob': 75, 'bull_adx_thresh': 33.22611917565711, 'bull_atr_min_pct': 0.018870685748236846, 'bull_atr_max_pct': 0.04022223552869741, 'bull_tp_mult': 1.509226513728319, 'bull_tsl_mult': 0.6516177202034863, 'bull_time_stop': 115, 'bull_use_sma': False, 'bull_use_ema': True, 'bull_use_atr': True, 'bull_use_adx': True, 'bull_use_spike': True, 'bull_rsi_required': False, 'bear_strategy': 'breakout', 'bear_bb_std_mult': 2.745185786055659, 'bear_rsi_os': 43, 'bear_rsi_ob': 52, 'bear_adx_thresh': 28.528849570763036, 'bear_atr_min_pct': 0.022161149729591427, 'bear_atr_max_pct': 0.033676966617381565, 'bear_tp_mult': 1.6854614937934846, 'bear_tsl_mult': 0.28642530135199307, 'bear_time_stop': 299, 'bear_use_sma': True, 'bear_use_ema': False, 'bear_use_atr': False, 'bear_use_adx': True, 'bear_use_spike': True, 'bear_rsi_required': True, 'sideways_strategy': 'mean_reversion', 'sideways_bb_std_mult': 1.0589039672165956, 'sideways_rsi_os': 9, 'sideways_rsi_ob': 52, 'sideways_adx_thresh': 6.097061401436657, 'sideways_atr_min_pct': 0.0032328035325910787, 'sideways_atr_max_pct': 0.13499133756329168, 'sideways_tp_mult': 2.1661852591077415, 'sideways_tsl_mult': 0.3081099254812839, 'sideways_time_stop': 152, 'sideways_use_sma': True, 'sideways_use_ema': False, 'sideways_use_atr': True, 'sideways_use_adx': True, 'sideways_use_spike': True, 'sideways_rsi_required': True}.
[I 2025-09-01 09:00:53,700] Trial 10 finished with values: [-0.2344585819350754, 0.2340865570123102] and parameters: {'p_sma': 22, 'p_std': 53, 'p_atr': 25, 'p_adx': 21, 'rsi_period': 11, 'ema1': 18, 'ema2': 33, 'slip_atr_k': 0.20547705353179901, 'slip_spread_k': 0.7334505709613486, 'spread_hl_frac': 0.0063233287813141085, 'bb_std_mult': 1.5592057997144428, 'rsi_os': 36, 'rsi_ob': 73, 'vol_spike': 0.1805450215966983, 'adx_thresh': 24.910109678350025, 'atr_min_pct': 0.02103493366911682, 'atr_max_pct': 0.059098569994773885, 'tp_mult': 1.8300888744720418, 'tsl_mult': 0.380262640609381, 'strategy': 'breakout', 'time_stop': 120, 'use_sma': True, 'use_atr': False, 'use_adx': False, 'use_ema': False, 'use_spike': True, 'rsi_required': False, 'edge_k': 0.31262082177988293, 'edge_cap': 0.5190484215278669, 'bull_strategy': 'mean_reversion', 'bull_bb_std_mult': 1.69968757949514, 'bull_rsi_os': 13, 'bull_rsi_ob': 48, 'bull_adx_thresh': 21.306700569020467, 'bull_atr_min_pct': 0.003965584492817312, 'bull_atr_max_pct': 0.0809130244576391, 'bull_tp_mult': 1.102076730616612, 'bull_tsl_mult': 0.14224461770988095, 'bull_time_stop': 291, 'bull_use_sma': True, 'bull_use_ema': True, 'bull_use_atr': False, 'bull_use_adx': False, 'bull_use_spike': True, 'bull_rsi_required': True, 'bear_strategy': 'breakout', 'bear_bb_std_mult': 3.1505784497645024, 'bear_rsi_os': 54, 'bear_rsi_ob': 70, 'bear_adx_thresh': 26.649155002899295, 'bear_atr_min_pct': 0.0012774324002316993, 'bear_atr_max_pct': 0.012582676133021829, 'bear_tp_mult': 1.663822789582706, 'bear_tsl_mult': 0.4559022038364464, 'bear_time_stop': 26, 'bear_use_sma': False, 'bear_use_ema': True, 'bear_use_atr': False, 'bear_use_adx': False, 'bear_use_spike': True, 'bear_rsi_required': True, 'sideways_strategy': 'mean_reversion', 'sideways_bb_std_mult': 2.835799545552295, 'sideways_rsi_os': 49, 'sideways_rsi_ob': 84, 'sideways_adx_thresh': 27.79169190138609, 'sideways_atr_min_pct': 0.00775368774153583, 'sideways_atr_max_pct': 0.0330484252216597, 'sideways_tp_mult': 1.4057893400250177, 'sideways_tsl_mult': 0.0614393605771103, 'sideways_time_stop': 222, 'sideways_use_sma': False, 'sideways_use_ema': True, 'sideways_use_atr': False, 'sideways_use_adx': False, 'sideways_use_spike': False, 'sideways_rsi_required': True}.
[I 2025-09-01 09:00:54,509] Trial 11 finished with values: [-1000000000.0, 1000000000.0] and parameters: {'p_sma': 25, 'p_std': 27, 'p_atr': 10, 'p_adx': 11, 'rsi_period': 69, 'ema1': 8, 'ema2': 18, 'slip_atr_k': 0.15491843262720634, 'slip_spread_k': 0.38429311044235936, 'spread_hl_frac': 0.0409121672757831, 'bb_std_mult': 2.101948659810555, 'rsi_os': 29, 'rsi_ob': 79, 'vol_spike': 0.02136041076954056, 'adx_thresh': 6.24001690196582, 'atr_min_pct': 0.014439801632846984, 'atr_max_pct': 0.01981915314941062, 'tp_mult': 2.7772491770027, 'tsl_mult': 0.883736055165291, 'strategy': 'breakout', 'time_stop': 190, 'use_sma': False, 'use_atr': False, 'use_adx': True, 'use_ema': False, 'use_spike': True, 'rsi_required': False, 'edge_k': 1.9563093293095002, 'edge_cap': 0.18715290653461678, 'bull_strategy': 'breakout', 'bull_bb_std_mult': 1.4537165232213436, 'bull_rsi_os': 8, 'bull_rsi_ob': 87, 'bull_adx_thresh': 11.911040997908803, 'bull_atr_min_pct': 0.026478370959578744, 'bull_atr_max_pct': 0.06580579338485161, 'bull_tp_mult': 1.3523506200249584, 'bull_tsl_mult': 0.552540196779304, 'bull_time_stop': 126, 'bull_use_sma': False, 'bull_use_ema': True, 'bull_use_atr': False, 'bull_use_adx': True, 'bull_use_spike': False, 'bull_rsi_required': True, 'bear_strategy': 'mean_reversion', 'bear_bb_std_mult': 1.856772610173367, 'bear_rsi_os': 47, 'bear_rsi_ob': 62, 'bear_adx_thresh': 7.959637808724219, 'bear_atr_min_pct': 0.025829661208174138, 'bear_atr_max_pct': 0.13112813271694077, 'bear_tp_mult': 2.887241449449904, 'bear_tsl_mult': 0.18580031600560554, 'bear_time_stop': 147, 'bear_use_sma': False, 'bear_use_ema': False, 'bear_use_atr': True, 'bear_use_adx': False, 'bear_use_spike': True, 'bear_rsi_required': True, 'sideways_strategy': 'mean_reversion', 'sideways_bb_std_mult': 0.5350504142666482, 'sideways_rsi_os': 34, 'sideways_rsi_ob': 62, 'sideways_adx_thresh': 23.459994706618787, 'sideways_atr_min_pct': 0.008072328958980975, 'sideways_atr_max_pct': 0.01080526996589233, 'sideways_tp_mult': 1.5710629762604258, 'sideways_tsl_mult': 0.6744354911217914, 'sideways_time_stop': 119, 'sideways_use_sma': True, 'sideways_use_ema': False, 'sideways_use_atr': True, 'sideways_use_adx': False, 'sideways_use_spike': False, 'sideways_rsi_required': True}.
[I 2025-09-01 09:00:55,604] Trial 12 finished with values: [-1000000000.0, 1000000000.0] and parameters: {'p_sma': 5, 'p_std': 45, 'p_atr': 15, 'p_adx': 20, 'rsi_period': 10, 'ema1': 23, 'ema2': 25, 'slip_atr_k': 0.08587434008372649, 'slip_spread_k': 0.74647999239696, 'spread_hl_frac': 0.002957268904072319, 'bb_std_mult': 1.4065168755348398, 'rsi_os': 20, 'rsi_ob': 47, 'vol_spike': 0.19479576356934017, 'adx_thresh': 12.809765791242034, 'atr_min_pct': 0.012872839849613151, 'atr_max_pct': 0.01758399115333044, 'tp_mult': 2.749678473547264, 'tsl_mult': 0.20789383572818876, 'strategy': 'breakout', 'time_stop': 237, 'use_sma': True, 'use_atr': False, 'use_adx': True, 'use_ema': False, 'use_spike': True, 'rsi_required': False, 'edge_k': 1.8299368919989194, 'edge_cap': 0.9840917100555603, 'bull_strategy': 'mean_reversion', 'bull_bb_std_mult': 1.0121731954547857, 'bull_rsi_os': 19, 'bull_rsi_ob': 58, 'bull_adx_thresh': 6.65941102126075, 'bull_atr_min_pct': 0.010348776475271921, 'bull_atr_max_pct': 0.024318643351577462, 'bull_tp_mult': 2.7787471794278447, 'bull_tsl_mult': 0.8454262870513835, 'bull_time_stop': 261, 'bull_use_sma': True, 'bull_use_ema': True, 'bull_use_atr': True, 'bull_use_adx': False, 'bull_use_spike': False, 'bull_rsi_required': True, 'bear_strategy': 'mean_reversion', 'bear_bb_std_mult': 0.6413636754807202, 'bear_rsi_os': 19, 'bear_rsi_ob': 48, 'bear_adx_thresh': 20.802622552585902, 'bear_atr_min_pct': 0.004857692938577805, 'bear_atr_max_pct': 0.04136706922205311, 'bear_tp_mult': 2.1673648542444655, 'bear_tsl_mult': 0.7093033463266945, 'bear_time_stop': 42, 'bear_use_sma': False, 'bear_use_ema': True, 'bear_use_atr': True, 'bear_use_adx': False, 'bear_use_spike': False, 'bear_rsi_required': False, 'sideways_strategy': 'breakout', 'sideways_bb_std_mult': 0.6846405293181415, 'sideways_rsi_os': 23, 'sideways_rsi_ob': 70, 'sideways_adx_thresh': 23.984248687517844, 'sideways_atr_min_pct': 0.022884335498609396, 'sideways_atr_max_pct': 0.03720810626148986, 'sideways_tp_mult': 2.171543922472297, 'sideways_tsl_mult': 0.40662414011841586, 'sideways_time_stop': 194, 'sideways_use_sma': True, 'sideways_use_ema': True, 'sideways_use_atr': True, 'sideways_use_adx': False, 'sideways_use_spike': True, 'sideways_rsi_required': False}.
[I 2025-09-01 09:00:56,163] Trial 13 finished with values: [-1000000000.0, 1000000000.0] and parameters: {'p_sma': 58, 'p_std': 33, 'p_atr': 7, 'p_adx': 7, 'rsi_period': 80, 'ema1': 9, 'ema2': 50, 'slip_atr_k': 0.0031362714467607494, 'slip_spread_k': 0.8185582186736622, 'spread_hl_frac': 0.0010008820707244127, 'bb_std_mult': 2.485203804027183, 'rsi_os': 6, 'rsi_ob': 81, 'vol_spike': 0.048075706435534535, 'adx_thresh': 6.418810920684226, 'atr_min_pct': 0.02958668816220473, 'atr_max_pct': 0.05140611182953141, 'tp_mult': 1.0392058018137353, 'tsl_mult': 0.8924220395255269, 'strategy': 'mean_reversion', 'time_stop': 295, 'use_sma': False, 'use_atr': True, 'use_adx': False, 'use_ema': True, 'use_spike': False, 'rsi_required': False, 'edge_k': 0.8049870595139825, 'edge_cap': 0.5382365752371543, 'bull_strategy': 'mean_reversion', 'bull_bb_std_mult': 0.5528154073087455, 'bull_rsi_os': 42, 'bull_rsi_ob': 61, 'bull_adx_thresh': 19.93312916635262, 'bull_atr_min_pct': 0.003237091250136777, 'bull_atr_max_pct': 0.14658404240871317, 'bull_tp_mult': 1.3940280083493612, 'bull_tsl_mult': 0.33002263839638657, 'bull_time_stop': 105, 'bull_use_sma': False, 'bull_use_ema': True, 'bull_use_atr': True, 'bull_use_adx': True, 'bull_use_spike': True, 'bull_rsi_required': False, 'bear_strategy': 'breakout', 'bear_bb_std_mult': 0.5702419458173349, 'bear_rsi_os': 15, 'bear_rsi_ob': 46, 'bear_adx_thresh': 26.259837520830924, 'bear_atr_min_pct': 0.02984183950858237, 'bear_atr_max_pct': 0.019813915383328065, 'bear_tp_mult': 1.6491616171376413, 'bear_tsl_mult': 0.3902995736176186, 'bear_time_stop': 209, 'bear_use_sma': False, 'bear_use_ema': False, 'bear_use_atr': False, 'bear_use_adx': False, 'bear_use_spike': False, 'bear_rsi_required': False, 'sideways_strategy': 'breakout', 'sideways_bb_std_mult': 1.2344801335179907, 'sideways_rsi_os': 30, 'sideways_rsi_ob': 94, 'sideways_adx_thresh': 34.33007346923877, 'sideways_atr_min_pct': 0.005012452766573961, 'sideways_atr_max_pct': 0.13918570235225514, 'sideways_tp_mult': 1.8322008487971793, 'sideways_tsl_mult': 0.9656167985882307, 'sideways_time_stop': 281, 'sideways_use_sma': True, 'sideways_use_ema': True, 'sideways_use_atr': True, 'sideways_use_adx': False, 'sideways_use_spike': True, 'sideways_rsi_required': True}.
[I 2025-09-01 09:01:37,436] Trial 16 finished with values: [-1000000000.0, 1000000000.0] and parameters: {'p_sma': 60, 'p_std': 35, 'p_atr': 7, 'p_adx': 7, 'rsi_period': 83, 'ema1': 30, 'ema2': 48, 'slip_atr_k': 0.011481949139379485, 'slip_spread_k': 0.05397221186124884, 'spread_hl_frac': 0.02824616721571559, 'bb_std_mult': 0.5654577684101061, 'rsi_os': 8, 'rsi_ob': 60, 'vol_spike': 0.08560673136333866, 'adx_thresh': 32.22540650280294, 'atr_min_pct': 0.027222054594278115, 'atr_max_pct': 0.0407691681591911, 'tp_mult': 1.086992137217315, 'tsl_mult': 0.9942941148815125, 'strategy': 'mean_reversion', 'time_stop': 263, 'use_sma': False, 'use_atr': True, 'use_adx': False, 'use_ema': True, 'use_spike': False, 'rsi_required': False, 'edge_k': 0.6867155206523938, 'edge_cap': 0.7257111613293601, 'bull_strategy': 'breakout', 'bull_bb_std_mult': 2.3502971496188736, 'bull_rsi_os': 41, 'bull_rsi_ob': 65, 'bull_adx_thresh': 22.56205477633854, 'bull_atr_min_pct': 0.015180225536338863, 'bull_atr_max_pct': 0.14919604062293912, 'bull_tp_mult': 1.601615931628979, 'bull_tsl_mult': 0.30334793505173074, 'bull_time_stop': 98, 'bull_use_sma': False, 'bull_use_ema': True, 'bull_use_atr': True, 'bull_use_adx': True, 'bull_use_spike': True, 'bull_rsi_required': False, 'bear_strategy': 'breakout', 'bear_bb_std_mult': 2.77623862880383, 'bear_rsi_os': 40, 'bear_rsi_ob': 94, 'bear_adx_thresh': 26.563439285208258, 'bear_atr_min_pct': 0.010158720197698793, 'bear_atr_max_pct': 0.011869661574592433, 'bear_tp_mult': 1.7000723621875178, 'bear_tsl_mult': 0.327437846625548, 'bear_time_stop': 206, 'bear_use_sma': True, 'bear_use_ema': False, 'bear_use_atr': False, 'bear_use_adx': True, 'bear_use_spike': False, 'bear_rsi_required': True, 'sideways_strategy': 'breakout', 'sideways_bb_std_mult': 1.2826671907306775, 'sideways_rsi_os': 10, 'sideways_rsi_ob': 45, 'sideways_adx_thresh': 5.491374311694353, 'sideways_atr_min_pct': 0.004553441087796486, 'sideways_atr_max_pct': 0.14913098143299233, 'sideways_tp_mult': 1.7916980818384372, 'sideways_tsl_mult': 0.3219114895102013, 'sideways_time_stop': 88, 'sideways_use_sma': True, 'sideways_use_ema': False, 'sideways_use_atr': True, 'sideways_use_adx': True, 'sideways_use_spike': True, 'sideways_rsi_required': True}.
[I 2025-09-01 09:01:37,999] Trial 14 finished with values: [-1000000000.0, 1000000000.0] and parameters: {'p_sma': 58, 'p_std': 32, 'p_atr': 7, 'p_adx': 7, 'rsi_period': 84, 'ema1': 30, 'ema2': 51, 'slip_atr_k': 0.00493099969295753, 'slip_spread_k': 0.7414252060989805, 'spread_hl_frac': 0.00039639839160998604, 'bb_std_mult': 0.5524344256506968, 'rsi_os': 21, 'rsi_ob': 60, 'vol_spike': 0.012830186214940156, 'adx_thresh': 5.074604158872848, 'atr_min_pct': 0.029775425655020935, 'atr_max_pct': 0.03945731636967492, 'tp_mult': 1.014923025257354, 'tsl_mult': 0.928075087744314, 'strategy': 'mean_reversion', 'time_stop': 298, 'use_sma': False, 'use_atr': True, 'use_adx': False, 'use_ema': True, 'use_spike': False, 'rsi_required': False, 'edge_k': 0.7509619649142977, 'edge_cap': 0.6947789958225137, 'bull_strategy': 'breakout', 'bull_bb_std_mult': 0.5668763053736732, 'bull_rsi_os': 40, 'bull_rsi_ob': 61, 'bull_adx_thresh': 21.56941336157893, 'bull_atr_min_pct': 0.016302386383583174, 'bull_atr_max_pct': 0.06098265638637902, 'bull_tp_mult': 1.6385760057715373, 'bull_tsl_mult': 0.3133472741125463, 'bull_time_stop': 87, 'bull_use_sma': False, 'bull_use_ema': True, 'bull_use_atr': True, 'bull_use_adx': True, 'bull_use_spike': True, 'bull_rsi_required': False, 'bear_strategy': 'breakout', 'bear_bb_std_mult': 2.7141628997272846, 'bear_rsi_os': 5, 'bear_rsi_ob': 45, 'bear_adx_thresh': 25.41233011731645, 'bear_atr_min_pct': 0.027446226692070995, 'bear_atr_max_pct': 0.012550049309113232, 'bear_tp_mult': 1.672121363498363, 'bear_tsl_mult': 0.24234199225690103, 'bear_time_stop': 210, 'bear_use_sma': True, 'bear_use_ema': False, 'bear_use_atr': False, 'bear_use_adx': True, 'bear_use_spike': False, 'bear_rsi_required': True, 'sideways_strategy': 'breakout', 'sideways_bb_std_mult': 1.1897941318843888, 'sideways_rsi_os': 6, 'sideways_rsi_ob': 57, 'sideways_adx_thresh': 5.605071620646943, 'sideways_atr_min_pct': 0.005718187733914567, 'sideways_atr_max_pct': 0.1467575168694058, 'sideways_tp_mult': 1.7700250999631233, 'sideways_tsl_mult': 0.3270340479265827, 'sideways_time_stop': 300, 'sideways_use_sma': True, 'sideways_use_ema': False, 'sideways_use_atr': True, 'sideways_use_adx': True, 'sideways_use_spike': True, 'sideways_rsi_required': True}.
[I 2025-09-01 09:01:39,130] Trial 15 finished with values: [-1000000000.0, 1000000000.0] and parameters: {'p_sma': 59, 'p_std': 35, 'p_atr': 10, 'p_adx': 16, 'rsi_period': 37, 'ema1': 30, 'ema2': 49, 'slip_atr_k': 0.027630062005864153, 'slip_spread_k': 0.9531018329330705, 'spread_hl_frac': 2.422914924941899e-05, 'bb_std_mult': 0.540264197562194, 'rsi_os': 6, 'rsi_ob': 58, 'vol_spike': 0.09553107581524725, 'adx_thresh': 33.64878051254359, 'atr_min_pct': 0.007544777550059927, 'atr_max_pct': 0.04487986728107459, 'tp_mult': 1.2594282484672659, 'tsl_mult': 0.04146204964575828, 'strategy': 'mean_reversion', 'time_stop': 290, 'use_sma': False, 'use_atr': True, 'use_adx': False, 'use_ema': True, 'use_spike': False, 'rsi_required': False, 'edge_k': 0.7252534569432666, 'edge_cap': 0.6873802131326452, 'bull_strategy': 'breakout', 'bull_bb_std_mult': 0.5046961354037993, 'bull_rsi_os': 42, 'bull_rsi_ob': 61, 'bull_adx_thresh': 22.129066520302814, 'bull_atr_min_pct': 0.016236613919999934, 'bull_atr_max_pct': 0.1337434719966708, 'bull_tp_mult': 1.6133196860738974, 'bull_tsl_mult': 0.3050987892825439, 'bull_time_stop': 85, 'bull_use_sma': False, 'bull_use_ema': True, 'bull_use_atr': True, 'bull_use_adx': True, 'bull_use_spike': True, 'bull_rsi_required': False, 'bear_strategy': 'breakout', 'bear_bb_std_mult': 2.7689371669699727, 'bear_rsi_os': 14, 'bear_rsi_ob': 45, 'bear_adx_thresh': 26.806416128547777, 'bear_atr_min_pct': 0.028214420055435854, 'bear_atr_max_pct': 0.020333901304790507, 'bear_tp_mult': 1.698467355077203, 'bear_tsl_mult': 0.326293619534189, 'bear_time_stop': 216, 'bear_use_sma': True, 'bear_use_ema': False, 'bear_use_atr': False, 'bear_use_adx': True, 'bear_use_spike': False, 'bear_rsi_required': False, 'sideways_strategy': 'breakout', 'sideways_bb_std_mult': 1.2241996250597242, 'sideways_rsi_os': 6, 'sideways_rsi_ob': 47, 'sideways_adx_thresh': 5.332222234387094, 'sideways_atr_min_pct': 0.005731135458643942, 'sideways_atr_max_pct': 0.1171904949619885, 'sideways_tp_mult': 1.8986275441958165, 'sideways_tsl_mult': 0.3232305820773853, 'sideways_time_stop': 72, 'sideways_use_sma': True, 'sideways_use_ema': True, 'sideways_use_atr': True, 'sideways_use_adx': True, 'sideways_use_spike': True, 'sideways_rsi_required': True}.
[I 2025-09-01 09:01:39,132] Trial 17 finished with values: [-0.03735717957969231, 0.037342654807193905] and parameters: {'p_sma': 46, 'p_std': 35, 'p_atr': 12, 'p_adx': 16, 'rsi_period': 36, 'ema1': 29, 'ema2': 46, 'slip_atr_k': 0.030100228675085522, 'slip_spread_k': 0.9737259927954685, 'spread_hl_frac': 0.028179418188534606, 'bb_std_mult': 0.5167948911327793, 'rsi_os': 46, 'rsi_ob': 58, 'vol_spike': 0.10129677288983849, 'adx_thresh': 33.139372121670895, 'atr_min_pct': 0.006395891665953515, 'atr_max_pct': 0.03748923637364879, 'tp_mult': 2.4763121792473597, 'tsl_mult': 0.0009777694228606526, 'strategy': 'mean_reversion', 'time_stop': 161, 'use_sma': False, 'use_atr': True, 'use_adx': False, 'use_ema': True, 'use_spike': False, 'rsi_required': True, 'edge_k': 0.6861079441634159, 'edge_cap': 0.8016147884209345, 'bull_strategy': 'breakout', 'bull_bb_std_mult': 2.3549390834024053, 'bull_rsi_os': 46, 'bull_rsi_ob': 65, 'bull_adx_thresh': 23.40920749048845, 'bull_atr_min_pct': 0.016470887722248067, 'bull_atr_max_pct': 0.05661030567700562, 'bull_tp_mult': 1.759749038369272, 'bull_tsl_mult': 0.2696511668541768, 'bull_time_stop': 35, 'bull_use_sma': False, 'bull_use_ema': True, 'bull_use_atr': True, 'bull_use_adx': True, 'bull_use_spike': True, 'bull_rsi_required': False, 'bear_strategy': 'breakout', 'bear_bb_std_mult': 2.859612098688149, 'bear_rsi_os': 38, 'bear_rsi_ob': 93, 'bear_adx_thresh': 33.796173388131535, 'bear_atr_min_pct': 0.009845232952112707, 'bear_atr_max_pct': 0.06115072744707011, 'bear_tp_mult': 1.733043270567125, 'bear_tsl_mult': 0.03334759107658086, 'bear_time_stop': 297, 'bear_use_sma': True, 'bear_use_ema': False, 'bear_use_atr': False, 'bear_use_adx': True, 'bear_use_spike': True, 'bear_rsi_required': True, 'sideways_strategy': 'mean_reversion', 'sideways_bb_std_mult': 1.2739693532332688, 'sideways_rsi_os': 6, 'sideways_rsi_ob': 52, 'sideways_adx_thresh': 5.321262723311683, 'sideways_atr_min_pct': 0.004674088487740522, 'sideways_atr_max_pct': 0.11393130515481625, 'sideways_tp_mult': 1.0195402797446045, 'sideways_tsl_mult': 0.33417633053963125, 'sideways_time_stop': 76, 'sideways_use_sma': True, 'sideways_use_ema': False, 'sideways_use_atr': True, 'sideways_use_adx': True, 'sideways_use_spike': True, 'sideways_rsi_required': True}.
