[I 2025-09-01 09:18:14,877] Trial 124 finished with values: [-0.086847009822271, 0.08898004212329945] and parameters: {'p_sma': 27, 'p_std': 32, 'p_atr': 15, 'p_adx': 19, 'rsi_period': 63, 'ema1': 21, 'ema2': 15, 'slip_atr_k': 0.05430655649591005, 'slip_spread_k': 0.3766379400808205, 'spread_hl_frac': 0.015434152685426722, 'bb_std_mult': 1.547931549132354, 'rsi_os': 48, 'rsi_ob': 90, 'vol_spike': 0.23122140372622726, 'adx_thresh': 7.569566967016092, 'atr_min_pct': 0.021166360579792036, 'atr_max_pct': 0.06811240280294899, 'tp_mult': 2.008654413521824, 'tsl_mult': 0.6638832576577943, 'strategy': 'breakout', 'time_stop': 207, 'use_sma': True, 'use_atr': False, 'use_adx': True, 'use_ema': False, 'use_spike': False, 'rsi_required': False, 'edge_k': 1.3806697116786861, 'edge_cap': 0.08112059277842536, 'bull_strategy': 'mean_reversion', 'bull_bb_std_mult': 0.5879279423392202, 'bull_rsi_os': 12, 'bull_rsi_ob': 92, 'bull_adx_thresh': 10.656371505154723, 'bull_atr_min_pct': 0.025893327827423672, 'bull_atr_max_pct': 0.10277782544845047, 'bull_tp_mult': 1.4975303687382517, 'bull_tsl_mult': 0.027202785793518758, 'bull_time_stop': 82, 'bull_use_sma': True, 'bull_use_ema': False, 'bull_use_atr': False, 'bull_use_adx': False, 'bull_use_spike': False, 'bull_rsi_required': True, 'bear_strategy': 'breakout', 'bear_bb_std_mult': 3.409998010790701, 'bear_rsi_os': 50, 'bear_rsi_ob': 65, 'bear_adx_thresh': 10.890926426527402, 'bear_atr_min_pct': 0.004281023073155959, 'bear_atr_max_pct': 0.12728984225815668, 'bear_tp_mult': 1.0880984735243036, 'bear_tsl_mult': 0.2317095667794582, 'bear_time_stop': 203, 'bear_use_sma': False, 'bear_use_ema': True, 'bear_use_atr': True, 'bear_use_adx': False, 'bear_use_spike': False, 'bear_rsi_required': True, 'sideways_strategy': 'breakout', 'sideways_bb_std_mult': 1.137043181866959, 'sideways_rsi_os': 42, 'sideways_rsi_ob': 48, 'sideways_adx_thresh': 25.89116148490148, 'sideways_atr_min_pct': 0.025855030130863647, 'sideways_atr_max_pct': 0.0947730677413334, 'sideways_tp_mult': 2.1306685707455926, 'sideways_tsl_mult': 0.9757213031252594, 'sideways_time_stop': 45, 'sideways_use_sma': False, 'sideways_use_ema': True, 'sideways_use_atr': False, 'sideways_use_adx': False, 'sideways_use_spike': False, 'sideways_rsi_required': False}.
[I 2025-09-01 09:18:15,442] Trial 127 finished with values: [-1000000000.0, 1000000000.0] and parameters: {'p_sma': 30, 'p_std': 22, 'p_atr': 19, 'p_adx': 11, 'rsi_period': 67, 'ema1': 19, 'ema2': 16, 'slip_atr_k': 0.055015625221212644, 'slip_spread_k': 0.26242446842197503, 'spread_hl_frac': 0.013180215827631469, 'bb_std_mult': 1.5362395072740924, 'rsi_os': 34, 'rsi_ob': 91, 'vol_spike': 0.21889092527148998, 'adx_thresh': 7.323242257425557, 'atr_min_pct': 0.023128753666284536, 'atr_max_pct': 0.015947669034230158, 'tp_mult': 2.0192642844888034, 'tsl_mult': 0.06256330744755179, 'strategy': 'breakout', 'time_stop': 214, 'use_sma': True, 'use_atr': True, 'use_adx': False, 'use_ema': True, 'use_spike': True, 'rsi_required': True, 'edge_k': 1.3989423367023293, 'edge_cap': 0.10105219267047534, 'bull_strategy': 'mean_reversion', 'bull_bb_std_mult': 0.7148420194745742, 'bull_rsi_os': 7, 'bull_rsi_ob': 53, 'bull_adx_thresh': 10.550069515610362, 'bull_atr_min_pct': 0.027089934323043043, 'bull_atr_max_pct': 0.06382314103283052, 'bull_tp_mult': 1.4603025840465396, 'bull_tsl_mult': 0.023653898503516402, 'bull_time_stop': 152, 'bull_use_sma': False, 'bull_use_ema': False, 'bull_use_atr': False, 'bull_use_adx': True, 'bull_use_spike': False, 'bull_rsi_required': True, 'bear_strategy': 'mean_reversion', 'bear_bb_std_mult': 2.032432484266329, 'bear_rsi_os': 46, 'bear_rsi_ob': 57, 'bear_adx_thresh': 12.330808520079783, 'bear_atr_min_pct': 0.015704309400382935, 'bear_atr_max_pct': 0.11511827709272249, 'bear_tp_mult': 2.5077275699829347, 'bear_tsl_mult': 0.21687654834959244, 'bear_time_stop': 288, 'bear_use_sma': False, 'bear_use_ema': True, 'bear_use_atr': False, 'bear_use_adx': True, 'bear_use_spike': False, 'bear_rsi_required': False, 'sideways_strategy': 'mean_reversion', 'sideways_bb_std_mult': 0.6565974407564472, 'sideways_rsi_os': 26, 'sideways_rsi_ob': 52, 'sideways_adx_thresh': 25.604034221828993, 'sideways_atr_min_pct': 0.005710839044164052, 'sideways_atr_max_pct': 0.06176876805548042, 'sideways_tp_mult': 2.5774114020217334, 'sideways_tsl_mult': 0.8418703136126195, 'sideways_time_stop': 119, 'sideways_use_sma': True, 'sideways_use_ema': True, 'sideways_use_atr': True, 'sideways_use_adx': False, 'sideways_use_spike': True, 'sideways_rsi_required': True}.
[I 2025-09-01 09:18:54,215] Trial 128 finished with values: [-1000000000.0, 1000000000.0] and parameters: {'p_sma': 31, 'p_std': 33, 'p_atr': 19, 'p_adx': 22, 'rsi_period': 70, 'ema1': 19, 'ema2': 16, 'slip_atr_k': 0.12458905559631418, 'slip_spread_k': 0.34878345185498055, 'spread_hl_frac': 0.017767202680084443, 'bb_std_mult': 2.545717871070077, 'rsi_os': 25, 'rsi_ob': 86, 'vol_spike': 0.07788859846035469, 'adx_thresh': 6.85872934586679, 'atr_min_pct': 0.020944363463048645, 'atr_max_pct': 0.14158400435998905, 'tp_mult': 2.015920262390328, 'tsl_mult': 0.05862669447229732, 'strategy': 'breakout', 'time_stop': 215, 'use_sma': True, 'use_atr': True, 'use_adx': False, 'use_ema': True, 'use_spike': True, 'rsi_required': True, 'edge_k': 1.3897712633265236, 'edge_cap': 0.5584067210559576, 'bull_strategy': 'mean_reversion', 'bull_bb_std_mult': 0.7542082821573862, 'bull_rsi_os': 19, 'bull_rsi_ob': 53, 'bull_adx_thresh': 10.651779230402429, 'bull_atr_min_pct': 0.010307556372580528, 'bull_atr_max_pct': 0.10301178639792324, 'bull_tp_mult': 2.1619718760746105, 'bull_tsl_mult': 0.1343619553299405, 'bull_time_stop': 154, 'bull_use_sma': False, 'bull_use_ema': False, 'bull_use_atr': False, 'bull_use_adx': True, 'bull_use_spike': False, 'bull_rsi_required': True, 'bear_strategy': 'mean_reversion', 'bear_bb_std_mult': 1.9182724403843838, 'bear_rsi_os': 47, 'bear_rsi_ob': 57, 'bear_adx_thresh': 26.079215089480247, 'bear_atr_min_pct': 0.015585132453357605, 'bear_atr_max_pct': 0.04351564949670743, 'bear_tp_mult': 2.4223804788072036, 'bear_tsl_mult': 0.2265325033990826, 'bear_time_stop': 37, 'bear_use_sma': False, 'bear_use_ema': True, 'bear_use_atr': False, 'bear_use_adx': True, 'bear_use_spike': False, 'bear_rsi_required': False, 'sideways_strategy': 'mean_reversion', 'sideways_bb_std_mult': 1.1606463686523656, 'sideways_rsi_os': 25, 'sideways_rsi_ob': 47, 'sideways_adx_thresh': 8.023165278322008, 'sideways_atr_min_pct': 0.0035530053567191158, 'sideways_atr_max_pct': 0.06250742285973149, 'sideways_tp_mult': 1.8554306074863274, 'sideways_tsl_mult': 0.8262938027002003, 'sideways_time_stop': 289, 'sideways_use_sma': True, 'sideways_use_ema': True, 'sideways_use_atr': True, 'sideways_use_adx': False, 'sideways_use_spike': True, 'sideways_rsi_required': True}.
[I 2025-09-01 09:18:54,945] Trial 131 finished with values: [-1000000000.0, 1000000000.0] and parameters: {'p_sma': 24, 'p_std': 20, 'p_atr': 26, 'p_adx': 14, 'rsi_period': 71, 'ema1': 9, 'ema2': 22, 'slip_atr_k': 0.23346872192484225, 'slip_spread_k': 0.347941672479135, 'spread_hl_frac': 0.017395621489726135, 'bb_std_mult': 2.601704207107177, 'rsi_os': 37, 'rsi_ob': 86, 'vol_spike': 0.18838728169486643, 'adx_thresh': 5.726553934379369, 'atr_min_pct': 0.0026782943645678337, 'atr_max_pct': 0.1499231124493947, 'tp_mult': 2.1057818409762805, 'tsl_mult': 0.8037936092068828, 'strategy': 'breakout', 'time_stop': 241, 'use_sma': True, 'use_atr': False, 'use_adx': False, 'use_ema': True, 'use_spike': False, 'rsi_required': False, 'edge_k': 1.4570587310005396, 'edge_cap': 0.39342873975832493, 'bull_strategy': 'mean_reversion', 'bull_bb_std_mult': 0.7578790062418055, 'bull_rsi_os': 23, 'bull_rsi_ob': 66, 'bull_adx_thresh': 8.147778472724813, 'bull_atr_min_pct': 0.010027515629678647, 'bull_atr_max_pct': 0.13163779389945257, 'bull_tp_mult': 1.9155763168611457, 'bull_tsl_mult': 0.09088170630150567, 'bull_time_stop': 142, 'bull_use_sma': False, 'bull_use_ema': False, 'bull_use_atr': False, 'bull_use_adx': False, 'bull_use_spike': False, 'bull_rsi_required': True, 'bear_strategy': 'mean_reversion', 'bear_bb_std_mult': 2.23567857008807, 'bear_rsi_os': 39, 'bear_rsi_ob': 94, 'bear_adx_thresh': 16.533748255650703, 'bear_atr_min_pct': 0.006088952932581488, 'bear_atr_max_pct': 0.12025821302045978, 'bear_tp_mult': 2.3980947863282793, 'bear_tsl_mult': 0.32268235676719415, 'bear_time_stop': 255, 'bear_use_sma': False, 'bear_use_ema': True, 'bear_use_atr': False, 'bear_use_adx': False, 'bear_use_spike': False, 'bear_rsi_required': False, 'sideways_strategy': 'breakout', 'sideways_bb_std_mult': 1.3877785839247596, 'sideways_rsi_os': 32, 'sideways_rsi_ob': 46, 'sideways_adx_thresh': 28.988059813945593, 'sideways_atr_min_pct': 0.0034461629803704055, 'sideways_atr_max_pct': 0.01929661684251461, 'sideways_tp_mult': 1.6953528181497186, 'sideways_tsl_mult': 0.8172347527686048, 'sideways_time_stop': 192, 'sideways_use_sma': True, 'sideways_use_ema': True, 'sideways_use_atr': True, 'sideways_use_adx': False, 'sideways_use_spike': True, 'sideways_rsi_required': True}.
[I 2025-09-01 09:18:55,868] Trial 129 finished with values: [-1000000000.0, 1000000000.0] and parameters: {'p_sma': 29, 'p_std': 21, 'p_atr': 19, 'p_adx': 22, 'rsi_period': 70, 'ema1': 12, 'ema2': 16, 'slip_atr_k': 0.21041218064659978, 'slip_spread_k': 0.5550456863758314, 'spread_hl_frac': 0.017870767567205695, 'bb_std_mult': 1.8729741662372794, 'rsi_os': 22, 'rsi_ob': 47, 'vol_spike': 0.15096499329741897, 'adx_thresh': 5.6511469672076196, 'atr_min_pct': 0.020940100680504944, 'atr_max_pct': 0.1424752324755281, 'tp_mult': 2.5506815972271313, 'tsl_mult': 0.07178654055478798, 'strategy': 'breakout', 'time_stop': 198, 'use_sma': True, 'use_atr': False, 'use_adx': False, 'use_ema': True, 'use_spike': True, 'rsi_required': True, 'edge_k': 0.5030319639840688, 'edge_cap': 0.391802458434225, 'bull_strategy': 'mean_reversion', 'bull_bb_std_mult': 0.7224973758725166, 'bull_rsi_os': 24, 'bull_rsi_ob': 63, 'bull_adx_thresh': 8.346229363964907, 'bull_atr_min_pct': 0.010315035843357117, 'bull_atr_max_pct': 0.10364319668349548, 'bull_tp_mult': 1.439588695591044, 'bull_tsl_mult': 0.1515971169167064, 'bull_time_stop': 147, 'bull_use_sma': False, 'bull_use_ema': False, 'bull_use_atr': False, 'bull_use_adx': False, 'bull_use_spike': False, 'bull_rsi_required': True, 'bear_strategy': 'mean_reversion', 'bear_bb_std_mult': 3.2689401002227028, 'bear_rsi_os': 45, 'bear_rsi_ob': 95, 'bear_adx_thresh': 12.165968906410649, 'bear_atr_min_pct': 8.253785673673249e-05, 'bear_atr_max_pct': 0.13377622495565553, 'bear_tp_mult': 2.74210322689928, 'bear_tsl_mult': 0.23606968058567024, 'bear_time_stop': 45, 'bear_use_sma': False, 'bear_use_ema': True, 'bear_use_atr': False, 'bear_use_adx': False, 'bear_use_spike': False, 'bear_rsi_required': False, 'sideways_strategy': 'breakout', 'sideways_bb_std_mult': 1.1135265722332655, 'sideways_rsi_os': 23, 'sideways_rsi_ob': 49, 'sideways_adx_thresh': 28.819953264461404, 'sideways_atr_min_pct': 0.0033750016563896274, 'sideways_atr_max_pct': 0.06182029750851624, 'sideways_tp_mult': 2.0136953940949978, 'sideways_tsl_mult': 0.9700746099195757, 'sideways_time_stop': 128, 'sideways_use_sma': True, 'sideways_use_ema': True, 'sideways_use_atr': True, 'sideways_use_adx': False, 'sideways_use_spike': True, 'sideways_rsi_required': True}.
[I 2025-09-01 09:18:57,205] Trial 130 finished with values: [-1000000000.0, 1000000000.0] and parameters: {'p_sma': 31, 'p_std': 22, 'p_atr': 7, 'p_adx': 14, 'rsi_period': 70, 'ema1': 12, 'ema2': 22, 'slip_atr_k': 0.232829337155731, 'slip_spread_k': 0.17705973487244592, 'spread_hl_frac': 0.018147842155306737, 'bb_std_mult': 2.816210472353188, 'rsi_os': 18, 'rsi_ob': 86, 'vol_spike': 0.028585399954040053, 'adx_thresh': 5.691478684858055, 'atr_min_pct': 0.022868481573115315, 'atr_max_pct': 0.13969509730589846, 'tp_mult': 1.7524667134529321, 'tsl_mult': 0.06995933829445201, 'strategy': 'breakout', 'time_stop': 195, 'use_sma': True, 'use_atr': True, 'use_adx': False, 'use_ema': True, 'use_spike': True, 'rsi_required': True, 'edge_k': 1.4645902241371553, 'edge_cap': 0.40361500005377676, 'bull_strategy': 'mean_reversion', 'bull_bb_std_mult': 0.7097339917865595, 'bull_rsi_os': 23, 'bull_rsi_ob': 77, 'bull_adx_thresh': 8.372207808153155, 'bull_atr_min_pct': 0.012650588283307085, 'bull_atr_max_pct': 0.05369633365770086, 'bull_tp_mult': 2.057093260055355, 'bull_tsl_mult': 0.0928222987911883, 'bull_time_stop': 153, 'bull_use_sma': False, 'bull_use_ema': False, 'bull_use_atr': False, 'bull_use_adx': True, 'bull_use_spike': False, 'bull_rsi_required': True, 'bear_strategy': 'mean_reversion', 'bear_bb_std_mult': 3.5963927521260413, 'bear_rsi_os': 55, 'bear_rsi_ob': 94, 'bear_adx_thresh': 12.402087907912188, 'bear_atr_min_pct': 0.015595857701098174, 'bear_atr_max_pct': 0.13390711512099251, 'bear_tp_mult': 2.4460752028819535, 'bear_tsl_mult': 0.32594124915445905, 'bear_time_stop': 37, 'bear_use_sma': False, 'bear_use_ema': True, 'bear_use_atr': False, 'bear_use_adx': False, 'bear_use_spike': False, 'bear_rsi_required': False, 'sideways_strategy': 'breakout', 'sideways_bb_std_mult': 0.6660149092627159, 'sideways_rsi_os': 14, 'sideways_rsi_ob': 52, 'sideways_adx_thresh': 28.58334247657858, 'sideways_atr_min_pct': 0.0035263514712519494, 'sideways_atr_max_pct': 0.06193113969909197, 'sideways_tp_mult': 1.9952608358204367, 'sideways_tsl_mult': 0.05660962990842472, 'sideways_time_stop': 120, 'sideways_use_sma': True, 'sideways_use_ema': True, 'sideways_use_atr': True, 'sideways_use_adx': False, 'sideways_use_spike': True, 'sideways_rsi_required': True}.
[I 2025-09-01 09:19:39,227] Trial 132 finished with values: [-0.2041103348026655, 0.20381718256001125] and parameters: {'p_sma': 25, 'p_std': 23, 'p_atr': 7, 'p_adx': 18, 'rsi_period': 58, 'ema1': 9, 'ema2': 23, 'slip_atr_k': 0.22140690485732795, 'slip_spread_k': 0.12716657538843906, 'spread_hl_frac': 0.002920907334801128, 'bb_std_mult': 1.7359278790567736, 'rsi_os': 18, 'rsi_ob': 93, 'vol_spike': 0.031792100193562975, 'adx_thresh': 5.6815240714749455, 'atr_min_pct': 0.017127279592242212, 'atr_max_pct': 0.14944180068115773, 'tp_mult': 2.5497439026515956, 'tsl_mult': 0.11216401135054244, 'strategy': 'breakout', 'time_stop': 197, 'use_sma': True, 'use_atr': False, 'use_adx': True, 'use_ema': True, 'use_spike': False, 'rsi_required': False, 'edge_k': 0.513776872188425, 'edge_cap': 0.4798033515208083, 'bull_strategy': 'mean_reversion', 'bull_bb_std_mult': 3.2572172743248244, 'bull_rsi_os': 24, 'bull_rsi_ob': 63, 'bull_adx_thresh': 8.159008023940968, 'bull_atr_min_pct': 0.012356965234624786, 'bull_atr_max_pct': 0.017989297862101995, 'bull_tp_mult': 1.9334979755284647, 'bull_tsl_mult': 0.1520205591267012, 'bull_time_stop': 180, 'bull_use_sma': True, 'bull_use_ema': False, 'bull_use_atr': False, 'bull_use_adx': False, 'bull_use_spike': False, 'bull_rsi_required': True, 'bear_strategy': 'mean_reversion', 'bear_bb_std_mult': 2.210221170769206, 'bear_rsi_os': 48, 'bear_rsi_ob': 95, 'bear_adx_thresh': 16.468033621195524, 'bear_atr_min_pct': 0.00660995966163372, 'bear_atr_max_pct': 0.010233875793343103, 'bear_tp_mult': 2.747431193126312, 'bear_tsl_mult': 0.0032708439410693013, 'bear_time_stop': 253, 'bear_use_sma': False, 'bear_use_ema': True, 'bear_use_atr': True, 'bear_use_adx': False, 'bear_use_spike': False, 'bear_rsi_required': False, 'sideways_strategy': 'breakout', 'sideways_bb_std_mult': 1.4283503484875844, 'sideways_rsi_os': 45, 'sideways_rsi_ob': 49, 'sideways_adx_thresh': 5.873512259750974, 'sideways_atr_min_pct': 0.0028359656292447624, 'sideways_atr_max_pct': 0.01845514937886878, 'sideways_tp_mult': 1.9162876637853137, 'sideways_tsl_mult': 0.7791232557134332, 'sideways_time_stop': 223, 'sideways_use_sma': False, 'sideways_use_ema': True, 'sideways_use_atr': False, 'sideways_use_adx': False, 'sideways_use_spike': False, 'sideways_rsi_required': False}.
[I 2025-09-01 09:19:39,996] Trial 135 finished with values: [-0.02655878126695954, 0.026336802817166896] and parameters: {'p_sma': 25, 'p_std': 23, 'p_atr': 17, 'p_adx': 29, 'rsi_period': 66, 'ema1': 16, 'ema2': 18, 'slip_atr_k': 0.006954358253753415, 'slip_spread_k': 0.04293893711248831, 'spread_hl_frac': 0.007386232570499608, 'bb_std_mult': 1.7397865615269499, 'rsi_os': 15, 'rsi_ob': 93, 'vol_spike': 0.22383681109200493, 'adx_thresh': 34.9865828292903, 'atr_min_pct': 0.01843907893331483, 'atr_max_pct': 0.08733759072265199, 'tp_mult': 1.7928634743210632, 'tsl_mult': 0.026335638275373545, 'strategy': 'breakout', 'time_stop': 264, 'use_sma': True, 'use_atr': False, 'use_adx': True, 'use_ema': False, 'use_spike': False, 'rsi_required': False, 'edge_k': 1.7472838646999613, 'edge_cap': 0.6651438359042217, 'bull_strategy': 'mean_reversion', 'bull_bb_std_mult': 1.058989919534245, 'bull_rsi_os': 14, 'bull_rsi_ob': 69, 'bull_adx_thresh': 13.267449629373289, 'bull_atr_min_pct': 0.02860949145739742, 'bull_atr_max_pct': 0.1147633507839772, 'bull_tp_mult': 1.2077052956650787, 'bull_tsl_mult': 0.33024828890125146, 'bull_time_stop': 179, 'bull_use_sma': True, 'bull_use_ema': False, 'bull_use_atr': False, 'bull_use_adx': False, 'bull_use_spike': False, 'bull_rsi_required': True, 'bear_strategy': 'mean_reversion', 'bear_bb_std_mult': 3.512098542401776, 'bear_rsi_os': 48, 'bear_rsi_ob': 63, 'bear_adx_thresh': 9.47936867614804, 'bear_atr_min_pct': 0.024006365077880655, 'bear_atr_max_pct': 0.0686751788557929, 'bear_tp_mult': 2.1465783513737833, 'bear_tsl_mult': 0.5871879075716999, 'bear_time_stop': 216, 'bear_use_sma': True, 'bear_use_ema': True, 'bear_use_atr': True, 'bear_use_adx': False, 'bear_use_spike': True, 'bear_rsi_required': False, 'sideways_strategy': 'breakout', 'sideways_bb_std_mult': 1.958170820473193, 'sideways_rsi_os': 38, 'sideways_rsi_ob': 46, 'sideways_adx_thresh': 28.085392679940572, 'sideways_atr_min_pct': 0.0023845202386889447, 'sideways_atr_max_pct': 0.08571193575073696, 'sideways_tp_mult': 2.6733463756951457, 'sideways_tsl_mult': 0.9370175399956959, 'sideways_time_stop': 223, 'sideways_use_sma': False, 'sideways_use_ema': True, 'sideways_use_atr': False, 'sideways_use_adx': True, 'sideways_use_spike': False, 'sideways_rsi_required': False}.
[I 2025-09-01 09:19:40,003] Trial 133 finished with values: [-1000000000.0, 1000000000.0] and parameters: {'p_sma': 25, 'p_std': 27, 'p_atr': 17, 'p_adx': 18, 'rsi_period': 58, 'ema1': 16, 'ema2': 19, 'slip_atr_k': 0.06381671048134901, 'slip_spread_k': 0.1792703061953849, 'spread_hl_frac': 0.0077168349580776785, 'bb_std_mult': 1.6700384682448017, 'rsi_os': 55, 'rsi_ob': 93, 'vol_spike': 0.14880481855028907, 'adx_thresh': 5.615864211806297, 'atr_min_pct': 0.018451993124046127, 'atr_max_pct': 0.1388854163311385, 'tp_mult': 2.579340573269345, 'tsl_mult': 0.11030889418241387, 'strategy': 'breakout', 'time_stop': 196, 'use_sma': True, 'use_atr': False, 'use_adx': True, 'use_ema': False, 'use_spike': False, 'rsi_required': False, 'edge_k': 1.7492303659541708, 'edge_cap': 0.3367116070246894, 'bull_strategy': 'mean_reversion', 'bull_bb_std_mult': 1.0592378464956096, 'bull_rsi_os': 16, 'bull_rsi_ob': 64, 'bull_adx_thresh': 13.35660041139375, 'bull_atr_min_pct': 0.014088725352931356, 'bull_atr_max_pct': 0.055776274684958826, 'bull_tp_mult': 2.0563118505114777, 'bull_tsl_mult': 0.15690835411605775, 'bull_time_stop': 180, 'bull_use_sma': True, 'bull_use_ema': False, 'bull_use_atr': False, 'bull_use_adx': False, 'bull_use_spike': False, 'bull_rsi_required': True, 'bear_strategy': 'mean_reversion', 'bear_bb_std_mult': 3.598617733549754, 'bear_rsi_os': 44, 'bear_rsi_ob': 63, 'bear_adx_thresh': 9.67546900398257, 'bear_atr_min_pct': 0.016691821941533645, 'bear_atr_max_pct': 0.1329663071037891, 'bear_tp_mult': 1.3282511076485548, 'bear_tsl_mult': 0.5766490437444285, 'bear_time_stop': 220, 'bear_use_sma': False, 'bear_use_ema': True, 'bear_use_atr': True, 'bear_use_adx': False, 'bear_use_spike': True, 'bear_rsi_required': False, 'sideways_strategy': 'breakout', 'sideways_bb_std_mult': 1.0508132616143473, 'sideways_rsi_os': 22, 'sideways_rsi_ob': 61, 'sideways_adx_thresh': 28.03889078171918, 'sideways_atr_min_pct': 0.02789168667604329, 'sideways_atr_max_pct': 0.08568152413264647, 'sideways_tp_mult': 1.9247652570510618, 'sideways_tsl_mult': 0.9611869781113517, 'sideways_time_stop': 81, 'sideways_use_sma': False, 'sideways_use_ema': True, 'sideways_use_atr': False, 'sideways_use_adx': False, 'sideways_use_spike': False, 'sideways_rsi_required': False}.
