[I 2025-09-01 09:03:46,417] Trial 36 finished with values: [-1000000000.0, 1000000000.0] and parameters: {'p_sma': 19, 'p_std': 42, 'p_atr': 9, 'p_adx': 23, 'rsi_period': 29, 'ema1': 13, 'ema2': 58, 'slip_atr_k': 0.06721502968206555, 'slip_spread_k': 0.6741057811978374, 'spread_hl_frac': 0.03852776384033799, 'bb_std_mult': 1.7225754898725398, 'rsi_os': 50, 'rsi_ob': 45, 'vol_spike': 0.07134646990796333, 'adx_thresh': 14.041782428449295, 'atr_min_pct': 0.015649430612311884, 'atr_max_pct': 0.07246960712184436, 'tp_mult': 2.9943441472754357, 'tsl_mult': 0.7722127481510236, 'strategy': 'mean_reversion', 'time_stop': 81, 'use_sma': False, 'use_atr': True, 'use_adx': False, 'use_ema': True, 'use_spike': False, 'rsi_required': False, 'edge_k': 0.5634354954787162, 'edge_cap': 0.2361429431559447, 'bull_strategy': 'breakout', 'bull_bb_std_mult': 3.560336519690289, 'bull_rsi_os': 28, 'bull_rsi_ob': 71, 'bull_adx_thresh': 26.855587947825615, 'bull_atr_min_pct': 0.0025175614005118296, 'bull_atr_max_pct': 0.030457358103640832, 'bull_tp_mult': 2.356388610828447, 'bull_tsl_mult': 0.35957937190500516, 'bull_time_stop': 253, 'bull_use_sma': False, 'bull_use_ema': False, 'bull_use_atr': False, 'bull_use_adx': True, 'bull_use_spike': False, 'bull_rsi_required': True, 'bear_strategy': 'breakout', 'bear_bb_std_mult': 2.987280476360084, 'bear_rsi_os': 28, 'bear_rsi_ob': 91, 'bear_adx_thresh': 12.038460714676276, 'bear_atr_min_pct': 0.015717290828343264, 'bear_atr_max_pct': 0.05859201028048672, 'bear_tp_mult': 2.6561973107503025, 'bear_tsl_mult': 0.08896909993649549, 'bear_time_stop': 238, 'bear_use_sma': True, 'bear_use_ema': False, 'bear_use_atr': False, 'bear_use_adx': True, 'bear_use_spike': True, 'bear_rsi_required': True, 'sideways_strategy': 'breakout', 'sideways_bb_std_mult': 1.9772593695014606, 'sideways_rsi_os': 43, 'sideways_rsi_ob': 75, 'sideways_adx_thresh': 19.47333742142177, 'sideways_atr_min_pct': 0.021369258277581474, 'sideways_atr_max_pct': 0.08435433333766063, 'sideways_tp_mult': 2.875443236167544, 'sideways_tsl_mult': 0.5285970919366872, 'sideways_time_stop': 184, 'sideways_use_sma': True, 'sideways_use_ema': False, 'sideways_use_atr': False, 'sideways_use_adx': True, 'sideways_use_spike': False, 'sideways_rsi_required': False}.
[I 2025-09-01 09:03:46,665] Trial 37 finished with values: [-1000000000.0, 1000000000.0] and parameters: {'p_sma': 19, 'p_std': 16, 'p_atr': 9, 'p_adx': 18, 'rsi_period': 41, 'ema1': 10, 'ema2': 59, 'slip_atr_k': 0.06643652752935698, 'slip_spread_k': 0.31525754890950175, 'spread_hl_frac': 0.03887764927519847, 'bb_std_mult': 3.587231876018962, 'rsi_os': 39, 'rsi_ob': 45, 'vol_spike': 0.26247854640238255, 'adx_thresh': 13.6531812837829, 'atr_min_pct': 0.015994952098969065, 'atr_max_pct': 0.09138510086766786, 'tp_mult': 2.816298134564632, 'tsl_mult': 0.13447481725248378, 'strategy': 'mean_reversion', 'time_stop': 81, 'use_sma': True, 'use_atr': True, 'use_adx': True, 'use_ema': False, 'use_spike': False, 'rsi_required': False, 'edge_k': 0.5584716102672047, 'edge_cap': 0.6387724506794807, 'bull_strategy': 'mean_reversion', 'bull_bb_std_mult': 1.900903255813101, 'bull_rsi_os': 22, 'bull_rsi_ob': 72, 'bull_adx_thresh': 27.194001057338298, 'bull_atr_min_pct': 0.005056093452508038, 'bull_atr_max_pct': 0.029859740143342167, 'bull_tp_mult': 2.0236649871752848, 'bull_tsl_mult': 0.48843648737821294, 'bull_time_stop': 173, 'bull_use_sma': True, 'bull_use_ema': False, 'bull_use_atr': False, 'bull_use_adx': True, 'bull_use_spike': False, 'bull_rsi_required': True, 'bear_strategy': 'mean_reversion', 'bear_bb_std_mult': 3.397775420532315, 'bear_rsi_os': 50, 'bear_rsi_ob': 77, 'bear_adx_thresh': 13.867730625353357, 'bear_atr_min_pct': 0.012876992078626144, 'bear_atr_max_pct': 0.04641269816674337, 'bear_tp_mult': 2.0658037644881455, 'bear_tsl_mult': 0.08298317808820718, 'bear_time_stop': 230, 'bear_use_sma': True, 'bear_use_ema': False, 'bear_use_atr': True, 'bear_use_adx': False, 'bear_use_spike': True, 'bear_rsi_required': False, 'sideways_strategy': 'breakout', 'sideways_bb_std_mult': 2.544903341592812, 'sideways_rsi_os': 44, 'sideways_rsi_ob': 78, 'sideways_adx_thresh': 30.3595130006223, 'sideways_atr_min_pct': 0.02256548691758023, 'sideways_atr_max_pct': 0.08274621312781068, 'sideways_tp_mult': 2.629703312388401, 'sideways_tsl_mult': 0.5246262144359782, 'sideways_time_stop': 186, 'sideways_use_sma': False, 'sideways_use_ema': False, 'sideways_use_atr': False, 'sideways_use_adx': False, 'sideways_use_spike': False, 'sideways_rsi_required': False}.
[I 2025-09-01 09:03:46,702] Trial 38 finished with values: [-1000000000.0, 1000000000.0] and parameters: {'p_sma': 19, 'p_std': 49, 'p_atr': 27, 'p_adx': 23, 'rsi_period': 30, 'ema1': 5, 'ema2': 30, 'slip_atr_k': 0.06899411826404447, 'slip_spread_k': 0.5214880700226262, 'spread_hl_frac': 0.03811845629999033, 'bb_std_mult': 2.568887092617858, 'rsi_os': 14, 'rsi_ob': 46, 'vol_spike': 0.25404965804924606, 'adx_thresh': 14.038093026528147, 'atr_min_pct': 0.0171292765348735, 'atr_max_pct': 0.09077760739078063, 'tp_mult': 2.8155859533170045, 'tsl_mult': 0.13132644857689335, 'strategy': 'mean_reversion', 'time_stop': 73, 'use_sma': True, 'use_atr': True, 'use_adx': True, 'use_ema': False, 'use_spike': False, 'rsi_required': False, 'edge_k': 0.5874652318174571, 'edge_cap': 0.13481596993650452, 'bull_strategy': 'mean_reversion', 'bull_bb_std_mult': 2.7410137342399032, 'bull_rsi_os': 22, 'bull_rsi_ob': 72, 'bull_adx_thresh': 27.26582156238143, 'bull_atr_min_pct': 0.005375892947869221, 'bull_atr_max_pct': 0.028659214822874163, 'bull_tp_mult': 2.971299854614455, 'bull_tsl_mult': 0.4748892165767012, 'bull_time_stop': 165, 'bull_use_sma': True, 'bull_use_ema': False, 'bull_use_atr': False, 'bull_use_adx': True, 'bull_use_spike': False, 'bull_rsi_required': True, 'bear_strategy': 'mean_reversion', 'bear_bb_std_mult': 3.360861250820626, 'bear_rsi_os': 37, 'bear_rsi_ob': 76, 'bear_adx_thresh': 13.682018005180067, 'bear_atr_min_pct': 0.012986273593350714, 'bear_atr_max_pct': 0.09608313515581493, 'bear_tp_mult': 2.072589095647429, 'bear_tsl_mult': 0.09181941870160426, 'bear_time_stop': 277, 'bear_use_sma': True, 'bear_use_ema': False, 'bear_use_atr': True, 'bear_use_adx': False, 'bear_use_spike': True, 'bear_rsi_required': False, 'sideways_strategy': 'breakout', 'sideways_bb_std_mult': 1.9810224857961747, 'sideways_rsi_os': 44, 'sideways_rsi_ob': 80, 'sideways_adx_thresh': 20.10142810577254, 'sideways_atr_min_pct': 0.021072263560858995, 'sideways_atr_max_pct': 0.06997769413260643, 'sideways_tp_mult': 2.81210933300937, 'sideways_tsl_mult': 0.5160783057009741, 'sideways_time_stop': 191, 'sideways_use_sma': False, 'sideways_use_ema': False, 'sideways_use_atr': False, 'sideways_use_adx': False, 'sideways_use_spike': False, 'sideways_rsi_required': False}.
[I 2025-09-01 09:04:27,964] Trial 40 finished with values: [-1000000000.0, 1000000000.0] and parameters: {'p_sma': 30, 'p_std': 16, 'p_atr': 27, 'p_adx': 18, 'rsi_period': 52, 'ema1': 5, 'ema2': 29, 'slip_atr_k': 0.02964595504353153, 'slip_spread_k': 0.5085756799467809, 'spread_hl_frac': 0.020366435672120244, 'bb_std_mult': 3.595233495452396, 'rsi_os': 39, 'rsi_ob': 56, 'vol_spike': 0.17061747636390523, 'adx_thresh': 18.763344030290007, 'atr_min_pct': 0.02542693018088592, 'atr_max_pct': 0.10921651631815726, 'tp_mult': 2.871697770151947, 'tsl_mult': 0.13051646060231237, 'strategy': 'breakout', 'time_stop': 89, 'use_sma': True, 'use_atr': False, 'use_adx': True, 'use_ema': False, 'use_spike': True, 'rsi_required': True, 'edge_k': 0.5608335905581868, 'edge_cap': 0.11926180682696097, 'bull_strategy': 'mean_reversion', 'bull_bb_std_mult': 1.9189181248978433, 'bull_rsi_os': 22, 'bull_rsi_ob': 83, 'bull_adx_thresh': 5.041436193290181, 'bull_atr_min_pct': 0.005586420424118631, 'bull_atr_max_pct': 0.12067799794663812, 'bull_tp_mult': 2.0441602053623913, 'bull_tsl_mult': 0.5054283629380454, 'bull_time_stop': 167, 'bull_use_sma': False, 'bull_use_ema': True, 'bull_use_atr': True, 'bull_use_adx': False, 'bull_use_spike': False, 'bull_rsi_required': True, 'bear_strategy': 'mean_reversion', 'bear_bb_std_mult': 1.734999945451062, 'bear_rsi_os': 36, 'bear_rsi_ob': 78, 'bear_adx_thresh': 6.454378197250996, 'bear_atr_min_pct': 0.01819285613861181, 'bear_atr_max_pct': 0.09739789301119711, 'bear_tp_mult': 1.8601891972167475, 'bear_tsl_mult': 0.3980573599801543, 'bear_time_stop': 277, 'bear_use_sma': False, 'bear_use_ema': False, 'bear_use_atr': True, 'bear_use_adx': True, 'bear_use_spike': True, 'bear_rsi_required': False, 'sideways_strategy': 'breakout', 'sideways_bb_std_mult': 2.536105205409024, 'sideways_rsi_os': 21, 'sideways_rsi_ob': 80, 'sideways_adx_thresh': 29.91580710955028, 'sideways_atr_min_pct': 0.01116209744539625, 'sideways_atr_max_pct': 0.07197931598806437, 'sideways_tp_mult': 2.476179268480262, 'sideways_tsl_mult': 0.8575762513115912, 'sideways_time_stop': 226, 'sideways_use_sma': True, 'sideways_use_ema': False, 'sideways_use_atr': True, 'sideways_use_adx': True, 'sideways_use_spike': False, 'sideways_rsi_required': False}.
[I 2025-09-01 09:04:29,175] Trial 41 finished with values: [-1000000000.0, 1000000000.0] and parameters: {'p_sma': 28, 'p_std': 49, 'p_atr': 13, 'p_adx': 19, 'rsi_period': 52, 'ema1': 5, 'ema2': 10, 'slip_atr_k': 0.02281789102804374, 'slip_spread_k': 0.5435977639140628, 'spread_hl_frac': 0.04427631032189125, 'bb_std_mult': 2.107264849209919, 'rsi_os': 13, 'rsi_ob': 57, 'vol_spike': 0.16691864152715583, 'adx_thresh': 22.52144542285188, 'atr_min_pct': 0.01874683814345897, 'atr_max_pct': 0.10825267535439963, 'tp_mult': 2.5947219300645816, 'tsl_mult': 0.7195315059550795, 'strategy': 'breakout', 'time_stop': 200, 'use_sma': False, 'use_atr': False, 'use_adx': True, 'use_ema': False, 'use_spike': True, 'rsi_required': True, 'edge_k': 0.9196674036307506, 'edge_cap': 0.3745126957643865, 'bull_strategy': 'breakout', 'bull_bb_std_mult': 2.731378554484344, 'bull_rsi_os': 14, 'bull_rsi_ob': 83, 'bull_adx_thresh': 29.796251026241862, 'bull_atr_min_pct': 0.007072860429149999, 'bull_atr_max_pct': 0.04533230513718801, 'bull_tp_mult': 2.0599262749389053, 'bull_tsl_mult': 0.9968406235677862, 'bull_time_stop': 34, 'bull_use_sma': False, 'bull_use_ema': True, 'bull_use_atr': True, 'bull_use_adx': False, 'bull_use_spike': True, 'bull_rsi_required': True, 'bear_strategy': 'mean_reversion', 'bear_bb_std_mult': 1.7579808856768302, 'bear_rsi_os': 20, 'bear_rsi_ob': 74, 'bear_adx_thresh': 16.988885013121457, 'bear_atr_min_pct': 0.018039943281182597, 'bear_atr_max_pct': 0.0928256336064455, 'bear_tp_mult': 2.281177737126647, 'bear_tsl_mult': 0.4076842545387922, 'bear_time_stop': 272, 'bear_use_sma': False, 'bear_use_ema': False, 'bear_use_atr': True, 'bear_use_adx': True, 'bear_use_spike': True, 'bear_rsi_required': True, 'sideways_strategy': 'breakout', 'sideways_bb_std_mult': 2.0339734875440456, 'sideways_rsi_os': 20, 'sideways_rsi_ob': 80, 'sideways_adx_thresh': 8.354820409137638, 'sideways_atr_min_pct': 0.011044305564463397, 'sideways_atr_max_pct': 0.06988873787664376, 'sideways_tp_mult': 2.3710218753296037, 'sideways_tsl_mult': 0.845337287373336, 'sideways_time_stop': 230, 'sideways_use_sma': True, 'sideways_use_ema': False, 'sideways_use_atr': True, 'sideways_use_adx': True, 'sideways_use_spike': False, 'sideways_rsi_required': False}.
[I 2025-09-01 09:04:29,574] Trial 39 finished with values: [-1000000000.0, 1000000000.0] and parameters: {'p_sma': 19, 'p_std': 49, 'p_atr': 27, 'p_adx': 18, 'rsi_period': 30, 'ema1': 5, 'ema2': 31, 'slip_atr_k': 0.02062100950367446, 'slip_spread_k': 0.5206001053930941, 'spread_hl_frac': 0.03699512906879408, 'bb_std_mult': 3.5660718469974495, 'rsi_os': 39, 'rsi_ob': 56, 'vol_spike': 0.17032485073627177, 'adx_thresh': 22.206995821616086, 'atr_min_pct': 0.0017463170209133854, 'atr_max_pct': 0.10855522926490269, 'tp_mult': 2.865820939090892, 'tsl_mult': 0.40320257464289205, 'strategy': 'mean_reversion', 'time_stop': 84, 'use_sma': True, 'use_atr': False, 'use_adx': True, 'use_ema': False, 'use_spike': True, 'rsi_required': False, 'edge_k': 0.5847337070365903, 'edge_cap': 0.6385901811669616, 'bull_strategy': 'breakout', 'bull_bb_std_mult': 2.8920462351373315, 'bull_rsi_os': 22, 'bull_rsi_ob': 83, 'bull_adx_thresh': 27.077845471413866, 'bull_atr_min_pct': 0.005732226714545909, 'bull_atr_max_pct': 0.010194920927779433, 'bull_tp_mult': 2.985614098757084, 'bull_tsl_mult': 0.46670299372037094, 'bull_time_stop': 171, 'bull_use_sma': False, 'bull_use_ema': False, 'bull_use_atr': False, 'bull_use_adx': False, 'bull_use_spike': False, 'bull_rsi_required': True, 'bear_strategy': 'mean_reversion', 'bear_bb_std_mult': 3.401392081288596, 'bear_rsi_os': 19, 'bear_rsi_ob': 76, 'bear_adx_thresh': 11.84032123418844, 'bear_atr_min_pct': 0.013762020316099197, 'bear_atr_max_pct': 0.10016715467814213, 'bear_tp_mult': 1.8600421367163336, 'bear_tsl_mult': 0.38874797749413237, 'bear_time_stop': 277, 'bear_use_sma': False, 'bear_use_ema': False, 'bear_use_atr': True, 'bear_use_adx': True, 'bear_use_spike': True, 'bear_rsi_required': False, 'sideways_strategy': 'breakout', 'sideways_bb_std_mult': 2.0984597638786666, 'sideways_rsi_os': 45, 'sideways_rsi_ob': 80, 'sideways_adx_thresh': 30.329451835674405, 'sideways_atr_min_pct': 0.0227960231076546, 'sideways_atr_max_pct': 0.07152060890589275, 'sideways_tp_mult': 2.617435584467592, 'sideways_tsl_mult': 0.5117486059154155, 'sideways_time_stop': 187, 'sideways_use_sma': True, 'sideways_use_ema': False, 'sideways_use_atr': False, 'sideways_use_adx': True, 'sideways_use_spike': False, 'sideways_rsi_required': False}.
[I 2025-09-01 09:04:30,109] Trial 42 finished with values: [-0.1973010119544224, 0.1971005130091003] and parameters: {'p_sma': 29, 'p_std': 11, 'p_atr': 14, 'p_adx': 27, 'rsi_period': 53, 'ema1': 19, 'ema2': 10, 'slip_atr_k': 0.10054008943985811, 'slip_spread_k': 0.5321223602130994, 'spread_hl_frac': 0.01881203857022192, 'bb_std_mult': 2.153418276905644, 'rsi_os': 45, 'rsi_ob': 55, 'vol_spike': 0.17438033585973187, 'adx_thresh': 18.7094101507329, 'atr_min_pct': 0.02472526411765842, 'atr_max_pct': 0.10375573964523256, 'tp_mult': 1.484977058058941, 'tsl_mult': 0.4253704076041296, 'strategy': 'breakout', 'time_stop': 138, 'use_sma': False, 'use_atr': False, 'use_adx': False, 'use_ema': True, 'use_spike': True, 'rsi_required': True, 'edge_k': 1.2827131090250639, 'edge_cap': 0.3580441727206307, 'bull_strategy': 'breakout', 'bull_bb_std_mult': 2.8976644948600643, 'bull_rsi_os': 18, 'bull_rsi_ob': 84, 'bull_adx_thresh': 5.122244927283454, 'bull_atr_min_pct': 8.129234027737795e-05, 'bull_atr_max_pct': 0.013398467314903566, 'bull_tp_mult': 2.0736824332167796, 'bull_tsl_mult': 0.7413365092643113, 'bull_time_stop': 35, 'bull_use_sma': False, 'bull_use_ema': True, 'bull_use_atr': True, 'bull_use_adx': False, 'bull_use_spike': True, 'bull_rsi_required': True, 'bear_strategy': 'breakout', 'bear_bb_std_mult': 2.475753318806981, 'bear_rsi_os': 20, 'bear_rsi_ob': 72, 'bear_adx_thresh': 6.513963196562406, 'bear_atr_min_pct': 0.006665940752085998, 'bear_atr_max_pct': 0.10929675486659604, 'bear_tp_mult': 2.3454905736986156, 'bear_tsl_mult': 0.39002444094167105, 'bear_time_stop': 193, 'bear_use_sma': False, 'bear_use_ema': True, 'bear_use_atr': False, 'bear_use_adx': True, 'bear_use_spike': True, 'bear_rsi_required': True, 'sideways_strategy': 'mean_reversion', 'sideways_bb_std_mult': 2.9369153406340858, 'sideways_rsi_os': 19, 'sideways_rsi_ob': 68, 'sideways_adx_thresh': 14.811169635770824, 'sideways_atr_min_pct': 0.011214740429911685, 'sideways_atr_max_pct': 0.10995143014175136, 'sideways_tp_mult': 2.477426150063567, 'sideways_tsl_mult': 0.8511613014856941, 'sideways_time_stop': 213, 'sideways_use_sma': True, 'sideways_use_ema': True, 'sideways_use_atr': True, 'sideways_use_adx': True, 'sideways_use_spike': False, 'sideways_rsi_required': False}.
[I 2025-09-01 09:04:30,374] Trial 44 finished with values: [-1000000000.0, 1000000000.0] and parameters: {'p_sma': 37, 'p_std': 10, 'p_atr': 14, 'p_adx': 27, 'rsi_period': 22, 'ema1': 15, 'ema2': 53, 'slip_atr_k': 0.10208665356894901, 'slip_spread_k': 0.40980425048663843, 'spread_hl_frac': 0.03583752106826667, 'bb_std_mult': 3.098851489601293, 'rsi_os': 42, 'rsi_ob': 49, 'vol_spike': 0.10406548504714486, 'adx_thresh': 9.795320097747988, 'atr_min_pct': 0.011451660985364669, 'atr_max_pct': 0.08051960776048205, 'tp_mult': 1.398359129168098, 'tsl_mult': 0.41188200919159834, 'strategy': 'mean_reversion', 'time_stop': 142, 'use_sma': False, 'use_atr': False, 'use_adx': False, 'use_ema': True, 'use_spike': True, 'rsi_required': True, 'edge_k': 1.2448618602271475, 'edge_cap': 0.8911626717893603, 'bull_strategy': 'breakout', 'bull_bb_std_mult': 2.9357318324810895, 'bull_rsi_os': 19, 'bull_rsi_ob': 86, 'bull_adx_thresh': 23.615685297976007, 'bull_atr_min_pct': 0.0002862546846807164, 'bull_atr_max_pct': 0.014578651556780495, 'bull_tp_mult': 2.504179643386405, 'bull_tsl_mult': 0.7665925385863059, 'bull_time_stop': 187, 'bull_use_sma': False, 'bull_use_ema': True, 'bull_use_atr': True, 'bull_use_adx': True, 'bull_use_spike': True, 'bull_rsi_required': False, 'bear_strategy': 'breakout', 'bear_bb_std_mult': 1.0014191039819687, 'bear_rsi_os': 33, 'bear_rsi_ob': 83, 'bear_adx_thresh': 22.925215656642337, 'bear_atr_min_pct': 0.02264613383447104, 'bear_atr_max_pct': 0.07580137113076732, 'bear_tp_mult': 1.8021266993662761, 'bear_tsl_mult': 0.20064645843901824, 'bear_time_stop': 107, 'bear_use_sma': False, 'bear_use_ema': True, 'bear_use_atr': False, 'bear_use_adx': True, 'bear_use_spike': False, 'bear_rsi_required': True, 'sideways_strategy': 'mean_reversion', 'sideways_bb_std_mult': 3.0485690253027116, 'sideways_rsi_os': 27, 'sideways_rsi_ob': 88, 'sideways_adx_thresh': 25.75385550076959, 'sideways_atr_min_pct': 0.018674961038703287, 'sideways_atr_max_pct': 0.12345780996467232, 'sideways_tp_mult': 2.6305114655689503, 'sideways_tsl_mult': 0.6663243816283038, 'sideways_time_stop': 6, 'sideways_use_sma': True, 'sideways_use_ema': True, 'sideways_use_atr': True, 'sideways_use_adx': True, 'sideways_use_spike': True, 'sideways_rsi_required': True}.
[I 2025-09-01 09:04:30,402] Trial 46 finished with values: [-1000000000.0, 1000000000.0] and parameters: {'p_sma': 39, 'p_std': 23, 'p_atr': 30, 'p_adx': 8, 'rsi_period': 21, 'ema1': 23, 'ema2': 53, 'slip_atr_k': 0.17145354978729382, 'slip_spread_k': 0.3876986883247997, 'spread_hl_frac': 0.006755551020888467, 'bb_std_mult': 3.015932128512955, 'rsi_os': 36, 'rsi_ob': 50, 'vol_spike': 0.11042028659591221, 'adx_thresh': 10.367242611704103, 'atr_min_pct': 0.006335900060934825, 'atr_max_pct': 0.08544384934874334, 'tp_mult': 1.9161664095242352, 'tsl_mult': 0.27552640398459716, 'strategy': 'mean_reversion', 'time_stop': 37, 'use_sma': False, 'use_atr': True, 'use_adx': False, 'use_ema': True, 'use_spike': False, 'rsi_required': True, 'edge_k': 1.5357750650513262, 'edge_cap': 0.8870939251017083, 'bull_strategy': 'breakout', 'bull_bb_std_mult': 2.5303265636238272, 'bull_rsi_os': 6, 'bull_rsi_ob': 90, 'bull_adx_thresh': 23.781142432152652, 'bull_atr_min_pct': 0.0011315516311142903, 'bull_atr_max_pct': 0.048453971664665585, 'bull_tp_mult': 2.5340794749530726, 'bull_tsl_mult': 0.27820074824041185, 'bull_time_stop': 201, 'bull_use_sma': True, 'bull_use_ema': True, 'bull_use_atr': True, 'bull_use_adx': True, 'bull_use_spike': True, 'bull_rsi_required': False, 'bear_strategy': 'breakout', 'bear_bb_std_mult': 1.2485855263119285, 'bear_rsi_os': 32, 'bear_rsi_ob': 83, 'bear_adx_thresh': 23.954862127908015, 'bear_atr_min_pct': 0.02344508919100818, 'bear_atr_max_pct': 0.08310076577614285, 'bear_tp_mult': 1.5206287791387785, 'bear_tsl_mult': 0.18763994898261693, 'bear_time_stop': 115, 'bear_use_sma': True, 'bear_use_ema': True, 'bear_use_atr': False, 'bear_use_adx': False, 'bear_use_spike': False, 'bear_rsi_required': True, 'sideways_strategy': 'mean_reversion', 'sideways_bb_std_mult': 3.4696020569395283, 'sideways_rsi_os': 16, 'sideways_rsi_ob': 86, 'sideways_adx_thresh': 24.971299814786683, 'sideways_atr_min_pct': 0.016986249523864617, 'sideways_atr_max_pct': 0.12643155497003938, 'sideways_tp_mult': 2.7128808166708964, 'sideways_tsl_mult': 0.6767271644137438, 'sideways_time_stop': 133, 'sideways_use_sma': False, 'sideways_use_ema': True, 'sideways_use_atr': True, 'sideways_use_adx': True, 'sideways_use_spike': True, 'sideways_rsi_required': True}.
