[I 2025-09-01 10:08:43,279] Trial 423 finished with values: [-1000000000.0, 1000000000.0] and parameters: {'p_sma': 23, 'p_std': 44, 'p_atr': 21, 'p_adx': 22, 'rsi_period': 57, 'ema1': 22, 'ema2': 58, 'slip_atr_k': 0.05383742062389958, 'slip_spread_k': 0.10750216428598132, 'spread_hl_frac': 0.026789560084979132, 'bb_std_mult': 3.251966819487357, 'rsi_os': 25, 'rsi_ob': 79, 'vol_spike': 0.27027408314439294, 'adx_thresh': 5.964540300651507, 'atr_min_pct': 0.025300526956211294, 'atr_max_pct': 0.08961678213950815, 'tp_mult': 2.6501587619767752, 'tsl_mult': 0.03702268269208798, 'strategy': 'breakout', 'time_stop': 164, 'use_sma': False, 'use_atr': False, 'use_adx': True, 'use_ema': True, 'use_spike': False, 'rsi_required': False, 'edge_k': 0.9657492035305397, 'edge_cap': 0.599085478328887, 'bull_strategy': 'breakout', 'bull_bb_std_mult': 2.2994025556538036, 'bull_rsi_os': 37, 'bull_rsi_ob': 94, 'bull_adx_thresh': 5.06131511570967, 'bull_atr_min_pct': 0.02937870051928599, 'bull_atr_max_pct': 0.08381551042712827, 'bull_tp_mult': 1.7878024184051653, 'bull_tsl_mult': 0.9607380368976606, 'bull_time_stop': 190, 'bull_use_sma': False, 'bull_use_ema': True, 'bull_use_atr': True, 'bull_use_adx': True, 'bull_use_spike': True, 'bull_rsi_required': False, 'bear_strategy': 'breakout', 'bear_bb_std_mult': 3.3820697414537473, 'bear_rsi_os': 46, 'bear_rsi_ob': 45, 'bear_adx_thresh': 23.184774645004822, 'bear_atr_min_pct': 0.012058855439845237, 'bear_atr_max_pct': 0.13201975539400093, 'bear_tp_mult': 1.2879871289206666, 'bear_tsl_mult': 0.5007123852136856, 'bear_time_stop': 141, 'bear_use_sma': False, 'bear_use_ema': False, 'bear_use_atr': True, 'bear_use_adx': True, 'bear_use_spike': True, 'bear_rsi_required': False, 'sideways_strategy': 'breakout', 'sideways_bb_std_mult': 2.3450542785176163, 'sideways_rsi_os': 45, 'sideways_rsi_ob': 80, 'sideways_adx_thresh': 22.2191585692848, 'sideways_atr_min_pct': 0.016463815701660035, 'sideways_atr_max_pct': 0.06669167197470759, 'sideways_tp_mult': 1.130525934062485, 'sideways_tsl_mult': 0.17172110717011863, 'sideways_time_stop': 32, 'sideways_use_sma': True, 'sideways_use_ema': False, 'sideways_use_atr': False, 'sideways_use_adx': False, 'sideways_use_spike': False, 'sideways_rsi_required': False}.
[I 2025-09-01 10:08:43,291] Trial 425 finished with values: [-1000000000.0, 1000000000.0] and parameters: {'p_sma': 45, 'p_std': 44, 'p_atr': 13, 'p_adx': 22, 'rsi_period': 66, 'ema1': 22, 'ema2': 56, 'slip_atr_k': 0.13012695308211306, 'slip_spread_k': 0.6940844752348828, 'spread_hl_frac': 0.027336318583542667, 'bb_std_mult': 1.0323386015500524, 'rsi_os': 25, 'rsi_ob': 79, 'vol_spike': 0.06738234516944273, 'adx_thresh': 5.923611416627568, 'atr_min_pct': 0.01602600324569765, 'atr_max_pct': 0.12237856506220851, 'tp_mult': 2.068184253601775, 'tsl_mult': 0.1921401979565675, 'strategy': 'breakout', 'time_stop': 150, 'use_sma': True, 'use_atr': False, 'use_adx': True, 'use_ema': False, 'use_spike': False, 'rsi_required': False, 'edge_k': 0.21137157377162863, 'edge_cap': 0.6564958302055236, 'bull_strategy': 'mean_reversion', 'bull_bb_std_mult': 1.3744777522796805, 'bull_rsi_os': 41, 'bull_rsi_ob': 47, 'bull_adx_thresh': 5.859767784633323, 'bull_atr_min_pct': 0.02270707881328197, 'bull_atr_max_pct': 0.033257629818525744, 'bull_tp_mult': 1.8427853861704413, 'bull_tsl_mult': 0.9546611188102783, 'bull_time_stop': 165, 'bull_use_sma': False, 'bull_use_ema': False, 'bull_use_atr': True, 'bull_use_adx': True, 'bull_use_spike': False, 'bull_rsi_required': True, 'bear_strategy': 'mean_reversion', 'bear_bb_std_mult': 3.366484086458156, 'bear_rsi_os': 31, 'bear_rsi_ob': 45, 'bear_adx_thresh': 23.255494999188237, 'bear_atr_min_pct': 0.011333813463991985, 'bear_atr_max_pct': 0.030276241968356536, 'bear_tp_mult': 1.1687739801562487, 'bear_tsl_mult': 0.5322921053848948, 'bear_time_stop': 101, 'bear_use_sma': False, 'bear_use_ema': True, 'bear_use_atr': True, 'bear_use_adx': False, 'bear_use_spike': True, 'bear_rsi_required': False, 'sideways_strategy': 'breakout', 'sideways_bb_std_mult': 0.5947818594900744, 'sideways_rsi_os': 34, 'sideways_rsi_ob': 52, 'sideways_adx_thresh': 26.731461302458268, 'sideways_atr_min_pct': 0.01073648706119734, 'sideways_atr_max_pct': 0.11316301471634972, 'sideways_tp_mult': 1.3062505433588276, 'sideways_tsl_mult': 0.8702395226880189, 'sideways_time_stop': 199, 'sideways_use_sma': False, 'sideways_use_ema': True, 'sideways_use_atr': False, 'sideways_use_adx': False, 'sideways_use_spike': False, 'sideways_rsi_required': False}.
[I 2025-09-01 10:08:44,040] Trial 424 finished with values: [-0.05483707213053335, 0.05451208351105884] and parameters: {'p_sma': 39, 'p_std': 44, 'p_atr': 21, 'p_adx': 22, 'rsi_period': 20, 'ema1': 22, 'ema2': 57, 'slip_atr_k': 0.11645272933846967, 'slip_spread_k': 0.9991865182295703, 'spread_hl_frac': 0.028070310725530595, 'bb_std_mult': 1.1498577666628695, 'rsi_os': 25, 'rsi_ob': 79, 'vol_spike': 0.2686751228074181, 'adx_thresh': 7.069448875035478, 'atr_min_pct': 0.008724833291751503, 'atr_max_pct': 0.07808655650044692, 'tp_mult': 2.842427987760097, 'tsl_mult': 0.36732946311972264, 'strategy': 'breakout', 'time_stop': 149, 'use_sma': True, 'use_atr': False, 'use_adx': True, 'use_ema': False, 'use_spike': False, 'rsi_required': False, 'edge_k': 0.2115047871453758, 'edge_cap': 0.5817115461474993, 'bull_strategy': 'mean_reversion', 'bull_bb_std_mult': 0.9792690678098152, 'bull_rsi_os': 20, 'bull_rsi_ob': 46, 'bull_adx_thresh': 6.041656968765343, 'bull_atr_min_pct': 0.029380068875593374, 'bull_atr_max_pct': 0.10531976031881499, 'bull_tp_mult': 2.8896197026349917, 'bull_tsl_mult': 0.05732012083135869, 'bull_time_stop': 43, 'bull_use_sma': False, 'bull_use_ema': False, 'bull_use_atr': True, 'bull_use_adx': True, 'bull_use_spike': False, 'bull_rsi_required': True, 'bear_strategy': 'mean_reversion', 'bear_bb_std_mult': 3.3696458819443333, 'bear_rsi_os': 45, 'bear_rsi_ob': 72, 'bear_adx_thresh': 15.362962760038943, 'bear_atr_min_pct': 0.018597526754171142, 'bear_atr_max_pct': 0.03003594897593994, 'bear_tp_mult': 2.9904178661151057, 'bear_tsl_mult': 0.4579756824923125, 'bear_time_stop': 254, 'bear_use_sma': False, 'bear_use_ema': True, 'bear_use_atr': True, 'bear_use_adx': False, 'bear_use_spike': True, 'bear_rsi_required': False, 'sideways_strategy': 'breakout', 'sideways_bb_std_mult': 3.097991539784337, 'sideways_rsi_os': 27, 'sideways_rsi_ob': 52, 'sideways_adx_thresh': 32.4500360219517, 'sideways_atr_min_pct': 0.002528258283735217, 'sideways_atr_max_pct': 0.07845661906928955, 'sideways_tp_mult': 1.3536313782875324, 'sideways_tsl_mult': 0.8679536307810842, 'sideways_time_stop': 197, 'sideways_use_sma': False, 'sideways_use_ema': True, 'sideways_use_atr': False, 'sideways_use_adx': False, 'sideways_use_spike': False, 'sideways_rsi_required': False}.
[I 2025-09-01 10:08:44,333] Trial 426 finished with values: [-1000000000.0, 1000000000.0] and parameters: {'p_sma': 57, 'p_std': 44, 'p_atr': 24, 'p_adx': 21, 'rsi_period': 20, 'ema1': 22, 'ema2': 57, 'slip_atr_k': 0.061435426134591374, 'slip_spread_k': 0.16082028014550648, 'spread_hl_frac': 0.02815361439158654, 'bb_std_mult': 3.320771612525201, 'rsi_os': 25, 'rsi_ob': 66, 'vol_spike': 0.1694375114475381, 'adx_thresh': 8.685884824585216, 'atr_min_pct': 0.008661256481503862, 'atr_max_pct': 0.1195013469908395, 'tp_mult': 2.8948526016212974, 'tsl_mult': 0.9576461486104517, 'strategy': 'breakout', 'time_stop': 148, 'use_sma': True, 'use_atr': False, 'use_adx': True, 'use_ema': False, 'use_spike': False, 'rsi_required': False, 'edge_k': 1.9516482295850532, 'edge_cap': 0.6230491595382206, 'bull_strategy': 'mean_reversion', 'bull_bb_std_mult': 2.5497050214926285, 'bull_rsi_os': 19, 'bull_rsi_ob': 92, 'bull_adx_thresh': 32.82457380661392, 'bull_atr_min_pct': 0.029395477003383585, 'bull_atr_max_pct': 0.05030929134548095, 'bull_tp_mult': 1.452133755568147, 'bull_tsl_mult': 0.3865388898953883, 'bull_time_stop': 184, 'bull_use_sma': True, 'bull_use_ema': False, 'bull_use_atr': True, 'bull_use_adx': True, 'bull_use_spike': False, 'bull_rsi_required': True, 'bear_strategy': 'mean_reversion', 'bear_bb_std_mult': 3.375790493722881, 'bear_rsi_os': 45, 'bear_rsi_ob': 45, 'bear_adx_thresh': 20.63765889711389, 'bear_atr_min_pct': 0.026382031749183216, 'bear_atr_max_pct': 0.14355858869504518, 'bear_tp_mult': 2.9897968616332236, 'bear_tsl_mult': 0.7825582519702647, 'bear_time_stop': 113, 'bear_use_sma': False, 'bear_use_ema': True, 'bear_use_atr': True, 'bear_use_adx': False, 'bear_use_spike': True, 'bear_rsi_required': False, 'sideways_strategy': 'breakout', 'sideways_bb_std_mult': 1.7150336445757064, 'sideways_rsi_os': 21, 'sideways_rsi_ob': 59, 'sideways_adx_thresh': 9.842767343257094, 'sideways_atr_min_pct': 0.010677350559743627, 'sideways_atr_max_pct': 0.10662147636988231, 'sideways_tp_mult': 1.312344760957739, 'sideways_tsl_mult': 0.675765080398532, 'sideways_time_stop': 197, 'sideways_use_sma': False, 'sideways_use_ema': True, 'sideways_use_atr': False, 'sideways_use_adx': False, 'sideways_use_spike': False, 'sideways_rsi_required': False}.
[I 2025-09-01 10:09:25,745] Trial 430 finished with values: [-1000000000.0, 1000000000.0] and parameters: {'p_sma': 6, 'p_std': 43, 'p_atr': 19, 'p_adx': 20, 'rsi_period': 63, 'ema1': 26, 'ema2': 53, 'slip_atr_k': 0.07287542489085078, 'slip_spread_k': 0.17176448850220918, 'spread_hl_frac': 0.028830973890215182, 'bb_std_mult': 3.3081781428032047, 'rsi_os': 24, 'rsi_ob': 76, 'vol_spike': 0.29650264857175823, 'adx_thresh': 5.044487257979129, 'atr_min_pct': 0.013101999084404533, 'atr_max_pct': 0.03364642013486522, 'tp_mult': 2.2707658634638794, 'tsl_mult': 0.10142569611067781, 'strategy': 'breakout', 'time_stop': 20, 'use_sma': True, 'use_atr': False, 'use_adx': True, 'use_ema': False, 'use_spike': True, 'rsi_required': True, 'edge_k': 0.8971917367845904, 'edge_cap': 0.22393522068744992, 'bull_strategy': 'mean_reversion', 'bull_bb_std_mult': 1.0196123121389211, 'bull_rsi_os': 12, 'bull_rsi_ob': 56, 'bull_adx_thresh': 31.941018489192654, 'bull_atr_min_pct': 0.01016789131547756, 'bull_atr_max_pct': 0.09014079478418001, 'bull_tp_mult': 1.9219373864028904, 'bull_tsl_mult': 0.2362306890721344, 'bull_time_stop': 231, 'bull_use_sma': True, 'bull_use_ema': False, 'bull_use_atr': True, 'bull_use_adx': True, 'bull_use_spike': False, 'bull_rsi_required': True, 'bear_strategy': 'mean_reversion', 'bear_bb_std_mult': 3.283619172669211, 'bear_rsi_os': 39, 'bear_rsi_ob': 46, 'bear_adx_thresh': 12.312535436331371, 'bear_atr_min_pct': 0.028638760336995403, 'bear_atr_max_pct': 0.06943490141333544, 'bear_tp_mult': 1.185200549365001, 'bear_tsl_mult': 0.4330673959905798, 'bear_time_stop': 149, 'bear_use_sma': True, 'bear_use_ema': True, 'bear_use_atr': True, 'bear_use_adx': False, 'bear_use_spike': True, 'bear_rsi_required': False, 'sideways_strategy': 'breakout', 'sideways_bb_std_mult': 3.5320681360082435, 'sideways_rsi_os': 15, 'sideways_rsi_ob': 49, 'sideways_adx_thresh': 28.816012472160494, 'sideways_atr_min_pct': 0.024526603833035735, 'sideways_atr_max_pct': 0.07104251858156427, 'sideways_tp_mult': 1.1999437293250501, 'sideways_tsl_mult': 0.7876498532279783, 'sideways_time_stop': 248, 'sideways_use_sma': False, 'sideways_use_ema': True, 'sideways_use_atr': False, 'sideways_use_adx': False, 'sideways_use_spike': True, 'sideways_rsi_required': True}.
[I 2025-09-01 10:09:27,579] Trial 427 finished with values: [-0.2150661459841463, 0.21489006653950682] and parameters: {'p_sma': 58, 'p_std': 43, 'p_atr': 7, 'p_adx': 20, 'rsi_period': 25, 'ema1': 21, 'ema2': 60, 'slip_atr_k': 0.05535627543621455, 'slip_spread_k': 0.1683524345081568, 'spread_hl_frac': 0.03141447679718946, 'bb_std_mult': 3.036569965991894, 'rsi_os': 24, 'rsi_ob': 64, 'vol_spike': 0.1498842257660423, 'adx_thresh': 13.647367038074638, 'atr_min_pct': 0.024582357743884984, 'atr_max_pct': 0.0666752939636994, 'tp_mult': 2.8535431041897015, 'tsl_mult': 0.11069045849266862, 'strategy': 'breakout', 'time_stop': 146, 'use_sma': True, 'use_atr': False, 'use_adx': True, 'use_ema': False, 'use_spike': False, 'rsi_required': True, 'edge_k': 0.9057792802044824, 'edge_cap': 0.2626931251025615, 'bull_strategy': 'mean_reversion', 'bull_bb_std_mult': 1.988813523393994, 'bull_rsi_os': 20, 'bull_rsi_ob': 56, 'bull_adx_thresh': 6.700906368512223, 'bull_atr_min_pct': 0.016565427154124953, 'bull_atr_max_pct': 0.049402008836236896, 'bull_tp_mult': 1.12925773015369, 'bull_tsl_mult': 0.03713467593589065, 'bull_time_stop': 15, 'bull_use_sma': True, 'bull_use_ema': False, 'bull_use_atr': True, 'bull_use_adx': True, 'bull_use_spike': False, 'bull_rsi_required': True, 'bear_strategy': 'mean_reversion', 'bear_bb_std_mult': 3.2750529733078078, 'bear_rsi_os': 39, 'bear_rsi_ob': 74, 'bear_adx_thresh': 21.252137542739874, 'bear_atr_min_pct': 0.026347166074531386, 'bear_atr_max_pct': 0.046827440143772686, 'bear_tp_mult': 1.180945437235568, 'bear_tsl_mult': 0.45444338379744487, 'bear_time_stop': 27, 'bear_use_sma': True, 'bear_use_ema': True, 'bear_use_atr': True, 'bear_use_adx': False, 'bear_use_spike': True, 'bear_rsi_required': False, 'sideways_strategy': 'breakout', 'sideways_bb_std_mult': 3.4558077074648175, 'sideways_rsi_os': 49, 'sideways_rsi_ob': 59, 'sideways_adx_thresh': 10.778910466855898, 'sideways_atr_min_pct': 0.0025686142182038724, 'sideways_atr_max_pct': 0.07057038966573788, 'sideways_tp_mult': 1.566865036613711, 'sideways_tsl_mult': 0.6140749649264803, 'sideways_time_stop': 19, 'sideways_use_sma': False, 'sideways_use_ema': True, 'sideways_use_atr': False, 'sideways_use_adx': False, 'sideways_use_spike': True, 'sideways_rsi_required': True}.
[I 2025-09-01 10:09:27,933] Trial 429 finished with values: [-1000000000.0, 1000000000.0] and parameters: {'p_sma': 10, 'p_std': 45, 'p_atr': 23, 'p_adx': 21, 'rsi_period': 67, 'ema1': 8, 'ema2': 53, 'slip_atr_k': 0.061320484276121606, 'slip_spread_k': 0.6621428649277428, 'spread_hl_frac': 0.03140978815484281, 'bb_std_mult': 3.3315962535809507, 'rsi_os': 24, 'rsi_ob': 76, 'vol_spike': 0.11998821328664644, 'adx_thresh': 7.85835633727573, 'atr_min_pct': 0.013659454719737374, 'atr_max_pct': 0.08267854768820246, 'tp_mult': 2.7830122856128323, 'tsl_mult': 0.019209337833533936, 'strategy': 'breakout', 'time_stop': 154, 'use_sma': True, 'use_atr': False, 'use_adx': True, 'use_ema': False, 'use_spike': True, 'rsi_required': True, 'edge_k': 0.8953189679735478, 'edge_cap': 0.3248366294963334, 'bull_strategy': 'mean_reversion', 'bull_bb_std_mult': 1.9989549224916685, 'bull_rsi_os': 18, 'bull_rsi_ob': 56, 'bull_adx_thresh': 29.35168290892134, 'bull_atr_min_pct': 0.029440244932298958, 'bull_atr_max_pct': 0.1452542729076377, 'bull_tp_mult': 1.4503382816995634, 'bull_tsl_mult': 0.8420525503075172, 'bull_time_stop': 231, 'bull_use_sma': True, 'bull_use_ema': False, 'bull_use_atr': True, 'bull_use_adx': True, 'bull_use_spike': False, 'bull_rsi_required': True, 'bear_strategy': 'mean_reversion', 'bear_bb_std_mult': 3.241990006696089, 'bear_rsi_os': 42, 'bear_rsi_ob': 46, 'bear_adx_thresh': 31.444277157132795, 'bear_atr_min_pct': 0.00468593672600991, 'bear_atr_max_pct': 0.0694038874353826, 'bear_tp_mult': 1.1967029100357565, 'bear_tsl_mult': 0.9419881482853218, 'bear_time_stop': 113, 'bear_use_sma': True, 'bear_use_ema': True, 'bear_use_atr': True, 'bear_use_adx': False, 'bear_use_spike': True, 'bear_rsi_required': False, 'sideways_strategy': 'breakout', 'sideways_bb_std_mult': 3.4621940488089664, 'sideways_rsi_os': 49, 'sideways_rsi_ob': 49, 'sideways_adx_thresh': 9.631599249564665, 'sideways_atr_min_pct': 0.02458273421306901, 'sideways_atr_max_pct': 0.0708385432778779, 'sideways_tp_mult': 2.31748776002997, 'sideways_tsl_mult': 0.7401422503746244, 'sideways_time_stop': 115, 'sideways_use_sma': False, 'sideways_use_ema': True, 'sideways_use_atr': False, 'sideways_use_adx': False, 'sideways_use_spike': True, 'sideways_rsi_required': True}.
[I 2025-09-01 10:09:28,216] Trial 428 finished with values: [-0.08006322855782677, 0.0798687263956993] and parameters: {'p_sma': 13, 'p_std': 43, 'p_atr': 7, 'p_adx': 20, 'rsi_period': 9, 'ema1': 8, 'ema2': 44, 'slip_atr_k': 0.06109153556991746, 'slip_spread_k': 0.8795025346855363, 'spread_hl_frac': 0.02822632024510322, 'bb_std_mult': 3.317873369271868, 'rsi_os': 24, 'rsi_ob': 53, 'vol_spike': 0.1680884448957596, 'adx_thresh': 7.3157571305281985, 'atr_min_pct': 0.00897562084887232, 'atr_max_pct': 0.0835959127435848, 'tp_mult': 2.992854761647557, 'tsl_mult': 0.10591400366246606, 'strategy': 'breakout', 'time_stop': 145, 'use_sma': True, 'use_atr': False, 'use_adx': True, 'use_ema': False, 'use_spike': False, 'rsi_required': True, 'edge_k': 0.895476949937769, 'edge_cap': 0.867626180469317, 'bull_strategy': 'mean_reversion', 'bull_bb_std_mult': 1.0283307858933317, 'bull_rsi_os': 20, 'bull_rsi_ob': 55, 'bull_adx_thresh': 6.625623183204575, 'bull_atr_min_pct': 2.985920124352545e-05, 'bull_atr_max_pct': 0.04417393225460209, 'bull_tp_mult': 1.4482352463553192, 'bull_tsl_mult': 0.0389426207743229, 'bull_time_stop': 83, 'bull_use_sma': True, 'bull_use_ema': False, 'bull_use_atr': True, 'bull_use_adx': True, 'bull_use_spike': False, 'bull_rsi_required': True, 'bear_strategy': 'mean_reversion', 'bear_bb_std_mult': 3.2488703032064374, 'bear_rsi_os': 45, 'bear_rsi_ob': 46, 'bear_adx_thresh': 12.286413627283792, 'bear_atr_min_pct': 0.029014782278231538, 'bear_atr_max_pct': 0.046867943465452394, 'bear_tp_mult': 1.1409798881314057, 'bear_tsl_mult': 0.4476695471805123, 'bear_time_stop': 266, 'bear_use_sma': True, 'bear_use_ema': True, 'bear_use_atr': True, 'bear_use_adx': False, 'bear_use_spike': True, 'bear_rsi_required': False, 'sideways_strategy': 'breakout', 'sideways_bb_std_mult': 1.707525860400069, 'sideways_rsi_os': 49, 'sideways_rsi_ob': 58, 'sideways_adx_thresh': 9.80365972470884, 'sideways_atr_min_pct': 0.009059409467505428, 'sideways_atr_max_pct': 0.07109677766783774, 'sideways_tp_mult': 1.3702947678715263, 'sideways_tsl_mult': 0.7836844213105206, 'sideways_time_stop': 204, 'sideways_use_sma': False, 'sideways_use_ema': True, 'sideways_use_atr': False, 'sideways_use_adx': False, 'sideways_use_spike': True, 'sideways_rsi_required': True}.
[I 2025-09-01 10:09:29,197] Trial 433 finished with values: [-1000000000.0, 1000000000.0] and parameters: {'p_sma': 48, 'p_std': 43, 'p_atr': 22, 'p_adx': 23, 'rsi_period': 69, 'ema1': 13, 'ema2': 44, 'slip_atr_k': 0.0416062475909788, 'slip_spread_k': 0.4907711215490436, 'spread_hl_frac': 0.04815531361619584, 'bb_std_mult': 2.195727571495246, 'rsi_os': 26, 'rsi_ob': 47, 'vol_spike': 0.27817673740551263, 'adx_thresh': 12.272070976550282, 'atr_min_pct': 0.002737844208009717, 'atr_max_pct': 0.040162831516331224, 'tp_mult': 2.9756633038417153, 'tsl_mult': 0.05828183996341183, 'strategy': 'mean_reversion', 'time_stop': 272, 'use_sma': True, 'use_atr': True, 'use_adx': False, 'use_ema': False, 'use_spike': False, 'rsi_required': False, 'edge_k': 0.7855048036831647, 'edge_cap': 0.8770541169648056, 'bull_strategy': 'mean_reversion', 'bull_bb_std_mult': 0.887034555439042, 'bull_rsi_os': 16, 'bull_rsi_ob': 55, 'bull_adx_thresh': 20.935522858306587, 'bull_atr_min_pct': 0.02997829014048473, 'bull_atr_max_pct': 0.08536495573362425, 'bull_tp_mult': 1.837366358763762, 'bull_tsl_mult': 0.670522549196168, 'bull_time_stop': 220, 'bull_use_sma': True, 'bull_use_ema': False, 'bull_use_atr': True, 'bull_use_adx': True, 'bull_use_spike': False, 'bull_rsi_required': True, 'bear_strategy': 'mean_reversion', 'bear_bb_std_mult': 3.449400056952863, 'bear_rsi_os': 10, 'bear_rsi_ob': 48, 'bear_adx_thresh': 13.564540577507557, 'bear_atr_min_pct': 0.01638290614392208, 'bear_atr_max_pct': 0.038270882203113143, 'bear_tp_mult': 1.8250622439655102, 'bear_tsl_mult': 0.694971936937808, 'bear_time_stop': 48, 'bear_use_sma': False, 'bear_use_ema': True, 'bear_use_atr': False, 'bear_use_adx': False, 'bear_use_spike': True, 'bear_rsi_required': True, 'sideways_strategy': 'mean_reversion', 'sideways_bb_std_mult': 1.8908761547773751, 'sideways_rsi_os': 50, 'sideways_rsi_ob': 69, 'sideways_adx_thresh': 14.559121777694472, 'sideways_atr_min_pct': 0.014227145383990532, 'sideways_atr_max_pct': 0.06667370392567312, 'sideways_tp_mult': 1.380292758009356, 'sideways_tsl_mult': 0.8232860595954669, 'sideways_time_stop': 163, 'sideways_use_sma': False, 'sideways_use_ema': True, 'sideways_use_atr': True, 'sideways_use_adx': True, 'sideways_use_spike': False, 'sideways_rsi_required': False}.
