[I 2025-09-01 10:15:59,834] Trial 470 finished with values: [-1000000000.0, 1000000000.0] and parameters: {'p_sma': 53, 'p_std': 42, 'p_atr': 29, 'p_adx': 26, 'rsi_period': 62, 'ema1': 22, 'ema2': 59, 'slip_atr_k': 0.03390451658285802, 'slip_spread_k': 0.07120459336147011, 'spread_hl_frac': 0.020153206652304665, 'bb_std_mult': 3.2179932735605368, 'rsi_os': 21, 'rsi_ob': 77, 'vol_spike': 0.1815399037256614, 'adx_thresh': 5.759716948679655, 'atr_min_pct': 0.022789324393842143, 'atr_max_pct': 0.07711360111557963, 'tp_mult': 2.7551830991344946, 'tsl_mult': 0.08287193529535491, 'strategy': 'breakout', 'time_stop': 269, 'use_sma': True, 'use_atr': False, 'use_adx': True, 'use_ema': True, 'use_spike': True, 'rsi_required': False, 'edge_k': 0.315777766466559, 'edge_cap': 0.5650715054710042, 'bull_strategy': 'breakout', 'bull_bb_std_mult': 1.2588455431978969, 'bull_rsi_os': 44, 'bull_rsi_ob': 79, 'bull_adx_thresh': 6.965663227498076, 'bull_atr_min_pct': 0.006297387702699312, 'bull_atr_max_pct': 0.08678672081547299, 'bull_tp_mult': 1.9802759226334425, 'bull_tsl_mult': 0.5395638192969062, 'bull_time_stop': 138, 'bull_use_sma': True, 'bull_use_ema': True, 'bull_use_atr': True, 'bull_use_adx': True, 'bull_use_spike': True, 'bull_rsi_required': False, 'bear_strategy': 'breakout', 'bear_bb_std_mult': 3.5181858742771137, 'bear_rsi_os': 21, 'bear_rsi_ob': 45, 'bear_adx_thresh': 12.815143926577214, 'bear_atr_min_pct': 0.01963240476998518, 'bear_atr_max_pct': 0.14993255112431275, 'bear_tp_mult': 1.238605964445119, 'bear_tsl_mult': 0.4500587595429456, 'bear_time_stop': 151, 'bear_use_sma': False, 'bear_use_ema': False, 'bear_use_atr': True, 'bear_use_adx': False, 'bear_use_spike': True, 'bear_rsi_required': False, 'sideways_strategy': 'breakout', 'sideways_bb_std_mult': 2.5875807599321377, 'sideways_rsi_os': 51, 'sideways_rsi_ob': 50, 'sideways_adx_thresh': 28.736368630991628, 'sideways_atr_min_pct': 0.006552837687090663, 'sideways_atr_max_pct': 0.0724670574965506, 'sideways_tp_mult': 1.3003331921588677, 'sideways_tsl_mult': 0.3036393048920462, 'sideways_time_stop': 204, 'sideways_use_sma': True, 'sideways_use_ema': False, 'sideways_use_atr': False, 'sideways_use_adx': False, 'sideways_use_spike': False, 'sideways_rsi_required': False}.
[I 2025-09-01 10:16:00,690] Trial 467 finished with values: [-1000000000.0, 1000000000.0] and parameters: {'p_sma': 54, 'p_std': 11, 'p_atr': 28, 'p_adx': 23, 'rsi_period': 44, 'ema1': 22, 'ema2': 42, 'slip_atr_k': 0.05636815115341069, 'slip_spread_k': 0.1087733396880512, 'spread_hl_frac': 0.026907315166084703, 'bb_std_mult': 0.6766739214344664, 'rsi_os': 21, 'rsi_ob': 71, 'vol_spike': 0.06115113274425518, 'adx_thresh': 5.5745005049420016, 'atr_min_pct': 0.024302637321885017, 'atr_max_pct': 0.10782327741120303, 'tp_mult': 2.7834247549559814, 'tsl_mult': 0.2609813139223497, 'strategy': 'breakout', 'time_stop': 161, 'use_sma': True, 'use_atr': False, 'use_adx': True, 'use_ema': True, 'use_spike': True, 'rsi_required': True, 'edge_k': 0.7804324448154975, 'edge_cap': 0.4958072951869991, 'bull_strategy': 'mean_reversion', 'bull_bb_std_mult': 1.239142454921001, 'bull_rsi_os': 16, 'bull_rsi_ob': 62, 'bull_adx_thresh': 6.338009036314688, 'bull_atr_min_pct': 0.006927859593144823, 'bull_atr_max_pct': 0.0870960075823694, 'bull_tp_mult': 1.960799387886029, 'bull_tsl_mult': 0.03924168227169005, 'bull_time_stop': 88, 'bull_use_sma': False, 'bull_use_ema': False, 'bull_use_atr': True, 'bull_use_adx': True, 'bull_use_spike': False, 'bull_rsi_required': False, 'bear_strategy': 'breakout', 'bear_bb_std_mult': 3.1749894621838157, 'bear_rsi_os': 48, 'bear_rsi_ob': 51, 'bear_adx_thresh': 24.998530222707164, 'bear_atr_min_pct': 0.008074713656370129, 'bear_atr_max_pct': 0.06988988950704293, 'bear_tp_mult': 1.6705313956719698, 'bear_tsl_mult': 0.4199771566004752, 'bear_time_stop': 140, 'bear_use_sma': False, 'bear_use_ema': True, 'bear_use_atr': True, 'bear_use_adx': True, 'bear_use_spike': True, 'bear_rsi_required': True, 'sideways_strategy': 'mean_reversion', 'sideways_bb_std_mult': 3.418459841022953, 'sideways_rsi_os': 48, 'sideways_rsi_ob': 51, 'sideways_adx_thresh': 27.126377163929934, 'sideways_atr_min_pct': 0.004940227258755945, 'sideways_atr_max_pct': 0.07164360411289793, 'sideways_tp_mult': 1.0927165037519067, 'sideways_tsl_mult': 0.8371286023556972, 'sideways_time_stop': 196, 'sideways_use_sma': True, 'sideways_use_ema': True, 'sideways_use_atr': False, 'sideways_use_adx': False, 'sideways_use_spike': True, 'sideways_rsi_required': False}.
[I 2025-09-01 10:16:00,702] Trial 468 finished with values: [-0.16750462872520455, 0.16747333142902832] and parameters: {'p_sma': 19, 'p_std': 44, 'p_atr': 28, 'p_adx': 22, 'rsi_period': 44, 'ema1': 22, 'ema2': 56, 'slip_atr_k': 0.05786863322124286, 'slip_spread_k': 0.1700569370032297, 'spread_hl_frac': 0.0004143922007190659, 'bb_std_mult': 3.223340093516688, 'rsi_os': 21, 'rsi_ob': 77, 'vol_spike': 0.2893461522467051, 'adx_thresh': 5.6008320194949786, 'atr_min_pct': 0.024649137352625514, 'atr_max_pct': 0.1079574605197277, 'tp_mult': 2.7797445644331296, 'tsl_mult': 0.26336098529113905, 'strategy': 'breakout', 'time_stop': 156, 'use_sma': True, 'use_atr': False, 'use_adx': True, 'use_ema': True, 'use_spike': True, 'rsi_required': True, 'edge_k': 0.7924739284587822, 'edge_cap': 0.5898458764052895, 'bull_strategy': 'breakout', 'bull_bb_std_mult': 0.8901681360347238, 'bull_rsi_os': 9, 'bull_rsi_ob': 57, 'bull_adx_thresh': 18.152051594798653, 'bull_atr_min_pct': 0.02942057222266337, 'bull_atr_max_pct': 0.08665684580604165, 'bull_tp_mult': 1.9784093017799547, 'bull_tsl_mult': 0.6598599114152249, 'bull_time_stop': 139, 'bull_use_sma': True, 'bull_use_ema': True, 'bull_use_atr': True, 'bull_use_adx': True, 'bull_use_spike': True, 'bull_rsi_required': False, 'bear_strategy': 'breakout', 'bear_bb_std_mult': 0.9747234531081381, 'bear_rsi_os': 46, 'bear_rsi_ob': 45, 'bear_adx_thresh': 14.668495974020601, 'bear_atr_min_pct': 0.0021706573900056054, 'bear_atr_max_pct': 0.10840268244403639, 'bear_tp_mult': 1.691658439717277, 'bear_tsl_mult': 0.4358896910534934, 'bear_time_stop': 142, 'bear_use_sma': False, 'bear_use_ema': False, 'bear_use_atr': True, 'bear_use_adx': True, 'bear_use_spike': True, 'bear_rsi_required': False, 'sideways_strategy': 'breakout', 'sideways_bb_std_mult': 3.361460720492138, 'sideways_rsi_os': 48, 'sideways_rsi_ob': 50, 'sideways_adx_thresh': 27.163927898072494, 'sideways_atr_min_pct': 0.022692215765717533, 'sideways_atr_max_pct': 0.12663792328925488, 'sideways_tp_mult': 1.0860357890261545, 'sideways_tsl_mult': 0.5276364627711886, 'sideways_time_stop': 193, 'sideways_use_sma': True, 'sideways_use_ema': False, 'sideways_use_atr': False, 'sideways_use_adx': False, 'sideways_use_spike': True, 'sideways_rsi_required': False}.
[I 2025-09-01 10:16:42,238] Trial 472 finished with values: [-1000000000.0, 1000000000.0] and parameters: {'p_sma': 23, 'p_std': 10, 'p_atr': 28, 'p_adx': 23, 'rsi_period': 53, 'ema1': 21, 'ema2': 50, 'slip_atr_k': 0.16677722304801673, 'slip_spread_k': 0.19856425430897362, 'spread_hl_frac': 0.02811129760229489, 'bb_std_mult': 3.338712876329796, 'rsi_os': 39, 'rsi_ob': 59, 'vol_spike': 0.1135342598341518, 'adx_thresh': 5.460565335925323, 'atr_min_pct': 0.025779876491262708, 'atr_max_pct': 0.10473851720165314, 'tp_mult': 2.0239002135684236, 'tsl_mult': 0.00011043293528034681, 'strategy': 'breakout', 'time_stop': 150, 'use_sma': False, 'use_atr': True, 'use_adx': True, 'use_ema': False, 'use_spike': False, 'rsi_required': False, 'edge_k': 0.932901589302041, 'edge_cap': 0.37419192874949136, 'bull_strategy': 'mean_reversion', 'bull_bb_std_mult': 2.7379511316461285, 'bull_rsi_os': 48, 'bull_rsi_ob': 62, 'bull_adx_thresh': 5.47505770546444, 'bull_atr_min_pct': 0.029035526137870662, 'bull_atr_max_pct': 0.12515342865260015, 'bull_tp_mult': 1.940971982933316, 'bull_tsl_mult': 0.6544204699615914, 'bull_time_stop': 142, 'bull_use_sma': True, 'bull_use_ema': False, 'bull_use_atr': True, 'bull_use_adx': True, 'bull_use_spike': False, 'bull_rsi_required': True, 'bear_strategy': 'mean_reversion', 'bear_bb_std_mult': 3.373490354206644, 'bear_rsi_os': 19, 'bear_rsi_ob': 48, 'bear_adx_thresh': 20.229732767162314, 'bear_atr_min_pct': 0.02359721259609291, 'bear_atr_max_pct': 0.098501787868266, 'bear_tp_mult': 1.2683127572448891, 'bear_tsl_mult': 0.5906865673908723, 'bear_time_stop': 106, 'bear_use_sma': True, 'bear_use_ema': True, 'bear_use_atr': True, 'bear_use_adx': False, 'bear_use_spike': True, 'bear_rsi_required': False, 'sideways_strategy': 'breakout', 'sideways_bb_std_mult': 1.787237855779074, 'sideways_rsi_os': 47, 'sideways_rsi_ob': 68, 'sideways_adx_thresh': 22.45214094506015, 'sideways_atr_min_pct': 0.02251648709849988, 'sideways_atr_max_pct': 0.0624574343897957, 'sideways_tp_mult': 1.3508720070031779, 'sideways_tsl_mult': 0.5827601223721656, 'sideways_time_stop': 58, 'sideways_use_sma': False, 'sideways_use_ema': True, 'sideways_use_atr': False, 'sideways_use_adx': True, 'sideways_use_spike': False, 'sideways_rsi_required': True}.
[I 2025-09-01 10:16:42,845] Trial 471 finished with values: [-1000000000.0, 1000000000.0] and parameters: {'p_sma': 23, 'p_std': 42, 'p_atr': 28, 'p_adx': 23, 'rsi_period': 63, 'ema1': 21, 'ema2': 28, 'slip_atr_k': 0.16688113668730417, 'slip_spread_k': 0.19576114829121627, 'spread_hl_frac': 0.0004030146242276801, 'bb_std_mult': 2.725189289371204, 'rsi_os': 27, 'rsi_ob': 65, 'vol_spike': 0.28888159799780805, 'adx_thresh': 5.840292977268388, 'atr_min_pct': 0.022757015067966516, 'atr_max_pct': 0.07686961829263778, 'tp_mult': 2.7393551200012602, 'tsl_mult': 0.26641952792849766, 'strategy': 'breakout', 'time_stop': 157, 'use_sma': False, 'use_atr': False, 'use_adx': True, 'use_ema': True, 'use_spike': True, 'rsi_required': False, 'edge_k': 0.971524543663651, 'edge_cap': 0.5245873876258282, 'bull_strategy': 'breakout', 'bull_bb_std_mult': 0.8916999652995958, 'bull_rsi_os': 16, 'bull_rsi_ob': 62, 'bull_adx_thresh': 15.610363377369492, 'bull_atr_min_pct': 0.029087064391738405, 'bull_atr_max_pct': 0.08687393473542067, 'bull_tp_mult': 1.9712815419428404, 'bull_tsl_mult': 0.05703177623789866, 'bull_time_stop': 178, 'bull_use_sma': True, 'bull_use_ema': True, 'bull_use_atr': True, 'bull_use_adx': True, 'bull_use_spike': True, 'bull_rsi_required': False, 'bear_strategy': 'breakout', 'bear_bb_std_mult': 1.5296535475024065, 'bear_rsi_os': 20, 'bear_rsi_ob': 45, 'bear_adx_thresh': 13.212695192601837, 'bear_atr_min_pct': 0.012275502924715433, 'bear_atr_max_pct': 0.06717157640074915, 'bear_tp_mult': 1.96255425892266, 'bear_tsl_mult': 0.4661620709985529, 'bear_time_stop': 61, 'bear_use_sma': False, 'bear_use_ema': True, 'bear_use_atr': True, 'bear_use_adx': False, 'bear_use_spike': True, 'bear_rsi_required': False, 'sideways_strategy': 'breakout', 'sideways_bb_std_mult': 3.401452737401403, 'sideways_rsi_os': 51, 'sideways_rsi_ob': 50, 'sideways_adx_thresh': 5.610215845564456, 'sideways_atr_min_pct': 0.004817041891182104, 'sideways_atr_max_pct': 0.12592987099127784, 'sideways_tp_mult': 1.3520684167121484, 'sideways_tsl_mult': 0.5702608643431663, 'sideways_time_stop': 203, 'sideways_use_sma': True, 'sideways_use_ema': True, 'sideways_use_atr': False, 'sideways_use_adx': False, 'sideways_use_spike': False, 'sideways_rsi_required': False}.
[I 2025-09-01 10:16:43,410] Trial 473 finished with values: [-1000000000.0, 1000000000.0] and parameters: {'p_sma': 23, 'p_std': 42, 'p_atr': 28, 'p_adx': 29, 'rsi_period': 63, 'ema1': 21, 'ema2': 43, 'slip_atr_k': 0.12112390072598643, 'slip_spread_k': 0.19568468550117152, 'spread_hl_frac': 0.02800840580540795, 'bb_std_mult': 3.0206467957541068, 'rsi_os': 15, 'rsi_ob': 78, 'vol_spike': 0.005566424706921702, 'adx_thresh': 20.051176331043703, 'atr_min_pct': 0.0259182048280512, 'atr_max_pct': 0.07980772289795693, 'tp_mult': 2.6193399544186238, 'tsl_mult': 8.638387804295322e-05, 'strategy': 'breakout', 'time_stop': 148, 'use_sma': False, 'use_atr': True, 'use_adx': True, 'use_ema': False, 'use_spike': False, 'rsi_required': False, 'edge_k': 0.9668828613288372, 'edge_cap': 0.37527015685748255, 'bull_strategy': 'mean_reversion', 'bull_bb_std_mult': 0.9027858956128417, 'bull_rsi_os': 18, 'bull_rsi_ob': 53, 'bull_adx_thresh': 5.563392173654742, 'bull_atr_min_pct': 0.025073315737001056, 'bull_atr_max_pct': 0.0981891700257355, 'bull_tp_mult': 1.3351552973269705, 'bull_tsl_mult': 0.8821044265751494, 'bull_time_stop': 158, 'bull_use_sma': True, 'bull_use_ema': False, 'bull_use_atr': True, 'bull_use_adx': True, 'bull_use_spike': False, 'bull_rsi_required': True, 'bear_strategy': 'mean_reversion', 'bear_bb_std_mult': 3.357977124173269, 'bear_rsi_os': 38, 'bear_rsi_ob': 89, 'bear_adx_thresh': 13.494012167951674, 'bear_atr_min_pct': 0.017571959079895352, 'bear_atr_max_pct': 0.06704721905612397, 'bear_tp_mult': 1.2697843539501756, 'bear_tsl_mult': 0.5911202058472336, 'bear_time_stop': 105, 'bear_use_sma': True, 'bear_use_ema': True, 'bear_use_atr': True, 'bear_use_adx': False, 'bear_use_spike': True, 'bear_rsi_required': False, 'sideways_strategy': 'breakout', 'sideways_bb_std_mult': 0.7895145577027967, 'sideways_rsi_os': 53, 'sideways_rsi_ob': 48, 'sideways_adx_thresh': 13.451461195807813, 'sideways_atr_min_pct': 0.0040514033829055175, 'sideways_atr_max_pct': 0.0773063076079305, 'sideways_tp_mult': 1.219209526903068, 'sideways_tsl_mult': 0.8648833848073891, 'sideways_time_stop': 58, 'sideways_use_sma': False, 'sideways_use_ema': True, 'sideways_use_atr': False, 'sideways_use_adx': True, 'sideways_use_spike': False, 'sideways_rsi_required': True}.
[I 2025-09-01 10:16:43,934] Trial 474 finished with values: [-0.04846173594600145, 0.04832879780569338] and parameters: {'p_sma': 22, 'p_std': 42, 'p_atr': 28, 'p_adx': 23, 'rsi_period': 70, 'ema1': 21, 'ema2': 53, 'slip_atr_k': 0.1973398504893521, 'slip_spread_k': 0.19494588336531293, 'spread_hl_frac': 0.028123501457403936, 'bb_std_mult': 3.002991261940413, 'rsi_os': 31, 'rsi_ob': 85, 'vol_spike': 0.27199137624819747, 'adx_thresh': 5.0601126160695316, 'atr_min_pct': 0.0009147849725765888, 'atr_max_pct': 0.010111937788229372, 'tp_mult': 2.656601649303255, 'tsl_mult': 0.021951020487931454, 'strategy': 'breakout', 'time_stop': 59, 'use_sma': False, 'use_atr': True, 'use_adx': True, 'use_ema': False, 'use_spike': False, 'rsi_required': False, 'edge_k': 0.9535397623156304, 'edge_cap': 0.7171266696656363, 'bull_strategy': 'mean_reversion', 'bull_bb_std_mult': 2.716356793761334, 'bull_rsi_os': 51, 'bull_rsi_ob': 66, 'bull_adx_thresh': 5.676870091979933, 'bull_atr_min_pct': 0.02889983443779278, 'bull_atr_max_pct': 0.12421789273520539, 'bull_tp_mult': 2.8590420563139056, 'bull_tsl_mult': 0.060809151270159574, 'bull_time_stop': 36, 'bull_use_sma': True, 'bull_use_ema': False, 'bull_use_atr': True, 'bull_use_adx': True, 'bull_use_spike': False, 'bull_rsi_required': True, 'bear_strategy': 'mean_reversion', 'bear_bb_std_mult': 1.6471255279543147, 'bear_rsi_os': 47, 'bear_rsi_ob': 48, 'bear_adx_thresh': 19.950245463944608, 'bear_atr_min_pct': 0.017639930034242437, 'bear_atr_max_pct': 0.09785968872466032, 'bear_tp_mult': 1.9338376831761845, 'bear_tsl_mult': 0.4702904364462234, 'bear_time_stop': 62, 'bear_use_sma': True, 'bear_use_ema': True, 'bear_use_atr': True, 'bear_use_adx': False, 'bear_use_spike': True, 'bear_rsi_required': False, 'sideways_strategy': 'breakout', 'sideways_bb_std_mult': 0.7617793930081862, 'sideways_rsi_os': 50, 'sideways_rsi_ob': 48, 'sideways_adx_thresh': 28.44215963271533, 'sideways_atr_min_pct': 0.002828956354939832, 'sideways_atr_max_pct': 0.06211928153887214, 'sideways_tp_mult': 1.3524547084512561, 'sideways_tsl_mult': 0.8617108806552892, 'sideways_time_stop': 5, 'sideways_use_sma': False, 'sideways_use_ema': True, 'sideways_use_atr': False, 'sideways_use_adx': True, 'sideways_use_spike': False, 'sideways_rsi_required': True}.
[I 2025-09-01 10:17:24,867] Trial 475 finished with values: [-1000000000.0, 1000000000.0] and parameters: {'p_sma': 23, 'p_std': 43, 'p_atr': 29, 'p_adx': 22, 'rsi_period': 70, 'ema1': 21, 'ema2': 43, 'slip_atr_k': 0.020985325153165146, 'slip_spread_k': 0.4080178851498065, 'spread_hl_frac': 0.0340823138268264, 'bb_std_mult': 3.3023168388290496, 'rsi_os': 27, 'rsi_ob': 79, 'vol_spike': 0.003125693379952804, 'adx_thresh': 26.067615949591907, 'atr_min_pct': 0.021877330974773825, 'atr_max_pct': 0.07980742967313338, 'tp_mult': 2.72890253623715, 'tsl_mult': 0.17190990972097564, 'strategy': 'breakout', 'time_stop': 99, 'use_sma': False, 'use_atr': False, 'use_adx': True, 'use_ema': False, 'use_spike': False, 'rsi_required': False, 'edge_k': 0.9610290431266406, 'edge_cap': 0.5332783387620026, 'bull_strategy': 'mean_reversion', 'bull_bb_std_mult': 0.9261578391749651, 'bull_rsi_os': 26, 'bull_rsi_ob': 66, 'bull_adx_thresh': 12.53356843421296, 'bull_atr_min_pct': 0.02870270688074776, 'bull_atr_max_pct': 0.07506210454201301, 'bull_tp_mult': 1.8565268732420577, 'bull_tsl_mult': 0.44277701576955064, 'bull_time_stop': 157, 'bull_use_sma': True, 'bull_use_ema': False, 'bull_use_atr': True, 'bull_use_adx': True, 'bull_use_spike': False, 'bull_rsi_required': True, 'bear_strategy': 'mean_reversion', 'bear_bb_std_mult': 1.4065665751515175, 'bear_rsi_os': 47, 'bear_rsi_ob': 46, 'bear_adx_thresh': 30.565185217287517, 'bear_atr_min_pct': 0.010685555736103733, 'bear_atr_max_pct': 0.06650447124866156, 'bear_tp_mult': 1.1442792478558856, 'bear_tsl_mult': 0.47269368116584976, 'bear_time_stop': 171, 'bear_use_sma': False, 'bear_use_ema': True, 'bear_use_atr': True, 'bear_use_adx': False, 'bear_use_spike': True, 'bear_rsi_required': False, 'sideways_strategy': 'breakout', 'sideways_bb_std_mult': 0.7617320776079461, 'sideways_rsi_os': 50, 'sideways_rsi_ob': 49, 'sideways_adx_thresh': 28.303164032434026, 'sideways_atr_min_pct': 0.013053647740043388, 'sideways_atr_max_pct': 0.013117675584528643, 'sideways_tp_mult': 1.3653943293153072, 'sideways_tsl_mult': 0.40244183043328585, 'sideways_time_stop': 124, 'sideways_use_sma': False, 'sideways_use_ema': True, 'sideways_use_atr': False, 'sideways_use_adx': False, 'sideways_use_spike': False, 'sideways_rsi_required': False}.
[I 2025-09-01 10:17:25,549] Trial 477 finished with values: [-1000000000.0, 1000000000.0] and parameters: {'p_sma': 5, 'p_std': 44, 'p_atr': 29, 'p_adx': 22, 'rsi_period': 27, 'ema1': 20, 'ema2': 52, 'slip_atr_k': 0.20451206729412644, 'slip_spread_k': 0.24037021572119777, 'spread_hl_frac': 0.025550633962106387, 'bb_std_mult': 3.2937136064053325, 'rsi_os': 30, 'rsi_ob': 79, 'vol_spike': 7.532556392611522e-05, 'adx_thresh': 23.664023527329537, 'atr_min_pct': 0.010949085051529403, 'atr_max_pct': 0.08065738271534185, 'tp_mult': 2.691532081511718, 'tsl_mult': 0.031488672148042685, 'strategy': 'breakout', 'time_stop': 17, 'use_sma': True, 'use_atr': False, 'use_adx': True, 'use_ema': False, 'use_spike': False, 'rsi_required': False, 'edge_k': 1.1056051893518848, 'edge_cap': 0.7245569839732666, 'bull_strategy': 'mean_reversion', 'bull_bb_std_mult': 0.987610886709476, 'bull_rsi_os': 24, 'bull_rsi_ob': 93, 'bull_adx_thresh': 5.70140774853702, 'bull_atr_min_pct': 0.029981087056801085, 'bull_atr_max_pct': 0.046412235139327795, 'bull_tp_mult': 1.8574007426433699, 'bull_tsl_mult': 0.060876700654141025, 'bull_time_stop': 149, 'bull_use_sma': True, 'bull_use_ema': False, 'bull_use_atr': False, 'bull_use_adx': False, 'bull_use_spike': False, 'bull_rsi_required': True, 'bear_strategy': 'mean_reversion', 'bear_bb_std_mult': 1.4815980884223703, 'bear_rsi_os': 47, 'bear_rsi_ob': 46, 'bear_adx_thresh': 7.697481005388024, 'bear_atr_min_pct': 0.016698688572182922, 'bear_atr_max_pct': 0.07627460535128266, 'bear_tp_mult': 1.1441487499092686, 'bear_tsl_mult': 0.47864872121971147, 'bear_time_stop': 165, 'bear_use_sma': False, 'bear_use_ema': True, 'bear_use_atr': True, 'bear_use_adx': False, 'bear_use_spike': True, 'bear_rsi_required': False, 'sideways_strategy': 'breakout', 'sideways_bb_std_mult': 2.437183034881535, 'sideways_rsi_os': 50, 'sideways_rsi_ob': 49, 'sideways_adx_thresh': 28.324234538292288, 'sideways_atr_min_pct': 0.0025328377904997547, 'sideways_atr_max_pct': 0.013304275388989359, 'sideways_tp_mult': 1.5034827141011768, 'sideways_tsl_mult': 0.40785344407044954, 'sideways_time_stop': 185, 'sideways_use_sma': False, 'sideways_use_ema': True, 'sideways_use_atr': False, 'sideways_use_adx': False, 'sideways_use_spike': False, 'sideways_rsi_required': False}.
