[I 2025-09-01 10:27:12,289] Trial 539 finished with values: [-0.01734186544906169, 0.017088110906783208] and parameters: {'p_sma': 37, 'p_std': 44, 'p_atr': 29, 'p_adx': 23, 'rsi_period': 68, 'ema1': 12, 'ema2': 30, 'slip_atr_k': 0.054249297477727935, 'slip_spread_k': 0.20612222988839335, 'spread_hl_frac': 0.029739202096576663, 'bb_std_mult': 3.2290896236408826, 'rsi_os': 15, 'rsi_ob': 78, 'vol_spike': 0.09815639994241857, 'adx_thresh': 7.695205824056705, 'atr_min_pct': 0.005294142539963164, 'atr_max_pct': 0.07829411867222945, 'tp_mult': 1.4321867225055882, 'tsl_mult': 0.00010863038320122961, 'strategy': 'breakout', 'time_stop': 50, 'use_sma': True, 'use_atr': True, 'use_adx': False, 'use_ema': True, 'use_spike': True, 'rsi_required': True, 'edge_k': 0.9728822170877024, 'edge_cap': 0.541993228064168, 'bull_strategy': 'breakout', 'bull_bb_std_mult': 2.6401627199052253, 'bull_rsi_os': 22, 'bull_rsi_ob': 54, 'bull_adx_thresh': 6.533941938376503, 'bull_atr_min_pct': 0.009161364183997269, 'bull_atr_max_pct': 0.019949451875828902, 'bull_tp_mult': 2.6939031796350243, 'bull_tsl_mult': 0.019138180212697198, 'bull_time_stop': 190, 'bull_use_sma': False, 'bull_use_ema': True, 'bull_use_atr': False, 'bull_use_adx': False, 'bull_use_spike': True, 'bull_rsi_required': False, 'bear_strategy': 'breakout', 'bear_bb_std_mult': 3.4260267427439337, 'bear_rsi_os': 46, 'bear_rsi_ob': 45, 'bear_adx_thresh': 10.747901843303275, 'bear_atr_min_pct': 0.023208105486263148, 'bear_atr_max_pct': 0.01446637552843709, 'bear_tp_mult': 1.2588387320606678, 'bear_tsl_mult': 0.3988646391061143, 'bear_time_stop': 125, 'bear_use_sma': True, 'bear_use_ema': True, 'bear_use_atr': False, 'bear_use_adx': True, 'bear_use_spike': False, 'bear_rsi_required': True, 'sideways_strategy': 'breakout', 'sideways_bb_std_mult': 1.3990926097745253, 'sideways_rsi_os': 46, 'sideways_rsi_ob': 78, 'sideways_adx_thresh': 28.08062995349859, 'sideways_atr_min_pct': 0.00364565729484766, 'sideways_atr_max_pct': 0.06725114015038834, 'sideways_tp_mult': 1.5198617567576118, 'sideways_tsl_mult': 0.8285567279111604, 'sideways_time_stop': 194, 'sideways_use_sma': True, 'sideways_use_ema': True, 'sideways_use_atr': False, 'sideways_use_adx': True, 'sideways_use_spike': True, 'sideways_rsi_required': True}.
[I 2025-09-01 10:27:13,607] Trial 542 finished with values: [-1000000000.0, 1000000000.0] and parameters: {'p_sma': 51, 'p_std': 41, 'p_atr': 29, 'p_adx': 23, 'rsi_period': 71, 'ema1': 7, 'ema2': 47, 'slip_atr_k': 0.054934810370755684, 'slip_spread_k': 0.12416711822935553, 'spread_hl_frac': 0.024660753925889418, 'bb_std_mult': 3.1911800100182437, 'rsi_os': 52, 'rsi_ob': 78, 'vol_spike': 0.2642810661489036, 'adx_thresh': 6.506474672389886, 'atr_min_pct': 0.0024127254639700734, 'atr_max_pct': 0.06781317838472396, 'tp_mult': 1.437231511653898, 'tsl_mult': 0.0689327694068666, 'strategy': 'mean_reversion', 'time_stop': 50, 'use_sma': True, 'use_atr': False, 'use_adx': True, 'use_ema': True, 'use_spike': True, 'rsi_required': True, 'edge_k': 0.9029892958591298, 'edge_cap': 0.5962953972873295, 'bull_strategy': 'breakout', 'bull_bb_std_mult': 0.872382560396681, 'bull_rsi_os': 23, 'bull_rsi_ob': 54, 'bull_adx_thresh': 20.944610370522327, 'bull_atr_min_pct': 0.007108483681476971, 'bull_atr_max_pct': 0.09938575133338687, 'bull_tp_mult': 2.5786977431435325, 'bull_tsl_mult': 0.7372564553595219, 'bull_time_stop': 152, 'bull_use_sma': True, 'bull_use_ema': True, 'bull_use_atr': True, 'bull_use_adx': False, 'bull_use_spike': True, 'bull_rsi_required': False, 'bear_strategy': 'breakout', 'bear_bb_std_mult': 3.411677394553024, 'bear_rsi_os': 48, 'bear_rsi_ob': 49, 'bear_adx_thresh': 29.3768314176994, 'bear_atr_min_pct': 0.0025814830749047533, 'bear_atr_max_pct': 0.10793573359698416, 'bear_tp_mult': 1.252701650712998, 'bear_tsl_mult': 0.39717472565089984, 'bear_time_stop': 163, 'bear_use_sma': True, 'bear_use_ema': False, 'bear_use_atr': True, 'bear_use_adx': True, 'bear_use_spike': True, 'bear_rsi_required': False, 'sideways_strategy': 'breakout', 'sideways_bb_std_mult': 0.8501153361921647, 'sideways_rsi_os': 30, 'sideways_rsi_ob': 56, 'sideways_adx_thresh': 28.348111609381796, 'sideways_atr_min_pct': 0.003583488044896727, 'sideways_atr_max_pct': 0.06956343801906108, 'sideways_tp_mult': 2.0946837012017254, 'sideways_tsl_mult': 0.47457222691302203, 'sideways_time_stop': 195, 'sideways_use_sma': True, 'sideways_use_ema': True, 'sideways_use_atr': False, 'sideways_use_adx': False, 'sideways_use_spike': True, 'sideways_rsi_required': True}.
[I 2025-09-01 10:27:56,443] Trial 545 finished with values: [-1000000000.0, 1000000000.0] and parameters: {'p_sma': 57, 'p_std': 45, 'p_atr': 7, 'p_adx': 22, 'rsi_period': 65, 'ema1': 12, 'ema2': 43, 'slip_atr_k': 0.17871315877160326, 'slip_spread_k': 0.15744227983827766, 'spread_hl_frac': 0.027329206583521823, 'bb_std_mult': 3.222803779949878, 'rsi_os': 32, 'rsi_ob': 76, 'vol_spike': 0.19917226557511353, 'adx_thresh': 19.504037321948154, 'atr_min_pct': 0.024660701176730797, 'atr_max_pct': 0.08231799488513829, 'tp_mult': 1.5892387715832275, 'tsl_mult': 0.11474473400157142, 'strategy': 'breakout', 'time_stop': 154, 'use_sma': True, 'use_atr': False, 'use_adx': True, 'use_ema': False, 'use_spike': False, 'rsi_required': False, 'edge_k': 0.09766954647526438, 'edge_cap': 0.9967591278025272, 'bull_strategy': 'mean_reversion', 'bull_bb_std_mult': 0.8205456381179479, 'bull_rsi_os': 10, 'bull_rsi_ob': 56, 'bull_adx_thresh': 30.162806339289418, 'bull_atr_min_pct': 0.02953988997540371, 'bull_atr_max_pct': 0.08874454375152956, 'bull_tp_mult': 2.870123256279026, 'bull_tsl_mult': 0.0014805253284781161, 'bull_time_stop': 164, 'bull_use_sma': True, 'bull_use_ema': False, 'bull_use_atr': True, 'bull_use_adx': True, 'bull_use_spike': False, 'bull_rsi_required': True, 'bear_strategy': 'mean_reversion', 'bear_bb_std_mult': 3.2781891235119627, 'bear_rsi_os': 50, 'bear_rsi_ob': 45, 'bear_adx_thresh': 12.148639864240579, 'bear_atr_min_pct': 0.02354130349969828, 'bear_atr_max_pct': 0.07440979091505448, 'bear_tp_mult': 2.6338554596644808, 'bear_tsl_mult': 0.2161216060891208, 'bear_time_stop': 144, 'bear_use_sma': False, 'bear_use_ema': True, 'bear_use_atr': True, 'bear_use_adx': False, 'bear_use_spike': True, 'bear_rsi_required': False, 'sideways_strategy': 'breakout', 'sideways_bb_std_mult': 3.251686762016217, 'sideways_rsi_os': 49, 'sideways_rsi_ob': 50, 'sideways_adx_thresh': 29.38355272444455, 'sideways_atr_min_pct': 0.011632314223528941, 'sideways_atr_max_pct': 0.141668852784677, 'sideways_tp_mult': 1.5886734830492215, 'sideways_tsl_mult': 0.8312056564698969, 'sideways_time_stop': 70, 'sideways_use_sma': False, 'sideways_use_ema': False, 'sideways_use_atr': False, 'sideways_use_adx': False, 'sideways_use_spike': False, 'sideways_rsi_required': False}.
[I 2025-09-01 10:27:57,992] Trial 543 finished with values: [-1000000000.0, 1000000000.0] and parameters: {'p_sma': 37, 'p_std': 20, 'p_atr': 7, 'p_adx': 22, 'rsi_period': 18, 'ema1': 22, 'ema2': 47, 'slip_atr_k': 0.04732208422885111, 'slip_spread_k': 0.1515673439262024, 'spread_hl_frac': 0.02492576830940903, 'bb_std_mult': 1.5683019589186438, 'rsi_os': 32, 'rsi_ob': 93, 'vol_spike': 0.09581581440261014, 'adx_thresh': 14.240950129273756, 'atr_min_pct': 0.009446471319722366, 'atr_max_pct': 0.11888059600345827, 'tp_mult': 1.1443385022414985, 'tsl_mult': 0.07033303377066746, 'strategy': 'breakout', 'time_stop': 152, 'use_sma': True, 'use_atr': False, 'use_adx': True, 'use_ema': False, 'use_spike': False, 'rsi_required': True, 'edge_k': 1.1458837240254922, 'edge_cap': 0.5725796073599159, 'bull_strategy': 'mean_reversion', 'bull_bb_std_mult': 2.36680374877418, 'bull_rsi_os': 17, 'bull_rsi_ob': 54, 'bull_adx_thresh': 5.036858983824219, 'bull_atr_min_pct': 0.017246371728311217, 'bull_atr_max_pct': 0.019072829765435673, 'bull_tp_mult': 2.567044064314352, 'bull_tsl_mult': 0.7268588249864252, 'bull_time_stop': 189, 'bull_use_sma': True, 'bull_use_ema': True, 'bull_use_atr': True, 'bull_use_adx': False, 'bull_use_spike': False, 'bull_rsi_required': True, 'bear_strategy': 'mean_reversion', 'bear_bb_std_mult': 3.297860114827862, 'bear_rsi_os': 50, 'bear_rsi_ob': 86, 'bear_adx_thresh': 10.805352997669374, 'bear_atr_min_pct': 0.0072402576724694065, 'bear_atr_max_pct': 0.14488468577093944, 'bear_tp_mult': 1.213148159692372, 'bear_tsl_mult': 0.9533959267105725, 'bear_time_stop': 143, 'bear_use_sma': True, 'bear_use_ema': False, 'bear_use_atr': True, 'bear_use_adx': True, 'bear_use_spike': True, 'bear_rsi_required': False, 'sideways_strategy': 'breakout', 'sideways_bb_std_mult': 0.8434408177137844, 'sideways_rsi_os': 30, 'sideways_rsi_ob': 50, 'sideways_adx_thresh': 28.513490522991205, 'sideways_atr_min_pct': 0.01672692730932471, 'sideways_atr_max_pct': 0.06929645044908082, 'sideways_tp_mult': 2.5108832978988267, 'sideways_tsl_mult': 0.8362276083734355, 'sideways_time_stop': 196, 'sideways_use_sma': False, 'sideways_use_ema': False, 'sideways_use_atr': False, 'sideways_use_adx': False, 'sideways_use_spike': True, 'sideways_rsi_required': True}.
[I 2025-09-01 10:27:58,417] Trial 544 finished with values: [-0.14775315947358791, 0.14707488441928718] and parameters: {'p_sma': 53, 'p_std': 41, 'p_atr': 30, 'p_adx': 22, 'rsi_period': 71, 'ema1': 20, 'ema2': 54, 'slip_atr_k': 0.046197803135562474, 'slip_spread_k': 0.1612322444394735, 'spread_hl_frac': 0.04422340925986215, 'bb_std_mult': 3.2102455728098134, 'rsi_os': 33, 'rsi_ob': 78, 'vol_spike': 0.10009295207635217, 'adx_thresh': 5.009900813270091, 'atr_min_pct': 0.012860649753387746, 'atr_max_pct': 0.08262152132216238, 'tp_mult': 1.4622253681240167, 'tsl_mult': 0.11617786812719216, 'strategy': 'breakout', 'time_stop': 60, 'use_sma': True, 'use_atr': False, 'use_adx': True, 'use_ema': False, 'use_spike': False, 'rsi_required': True, 'edge_k': 0.9036875393422845, 'edge_cap': 0.9393138716899108, 'bull_strategy': 'mean_reversion', 'bull_bb_std_mult': 1.5055556511221717, 'bull_rsi_os': 23, 'bull_rsi_ob': 56, 'bull_adx_thresh': 15.137213033199473, 'bull_atr_min_pct': 0.017336914231004016, 'bull_atr_max_pct': 0.01976679098054389, 'bull_tp_mult': 1.988932738756834, 'bull_tsl_mult': 0.4266738154884644, 'bull_time_stop': 188, 'bull_use_sma': True, 'bull_use_ema': True, 'bull_use_atr': True, 'bull_use_adx': True, 'bull_use_spike': False, 'bull_rsi_required': True, 'bear_strategy': 'mean_reversion', 'bear_bb_std_mult': 3.2909472506994017, 'bear_rsi_os': 48, 'bear_rsi_ob': 45, 'bear_adx_thresh': 12.04253497545625, 'bear_atr_min_pct': 0.0025783466494247783, 'bear_atr_max_pct': 0.07913888760242264, 'bear_tp_mult': 1.222791904728426, 'bear_tsl_mult': 0.5531781338386814, 'bear_time_stop': 144, 'bear_use_sma': True, 'bear_use_ema': False, 'bear_use_atr': True, 'bear_use_adx': True, 'bear_use_spike': True, 'bear_rsi_required': False, 'sideways_strategy': 'breakout', 'sideways_bb_std_mult': 3.2644666606174972, 'sideways_rsi_os': 22, 'sideways_rsi_ob': 91, 'sideways_adx_thresh': 29.58286112944002, 'sideways_atr_min_pct': 0.004155392000809253, 'sideways_atr_max_pct': 0.056100557005994575, 'sideways_tp_mult': 1.2826915352789916, 'sideways_tsl_mult': 0.8296289321331203, 'sideways_time_stop': 195, 'sideways_use_sma': False, 'sideways_use_ema': False, 'sideways_use_atr': False, 'sideways_use_adx': False, 'sideways_use_spike': True, 'sideways_rsi_required': True}.
[I 2025-09-01 10:27:58,598] Trial 541 finished with values: [-1000000000.0, 1000000000.0] and parameters: {'p_sma': 23, 'p_std': 44, 'p_atr': 30, 'p_adx': 23, 'rsi_period': 65, 'ema1': 20, 'ema2': 10, 'slip_atr_k': 0.12563466295082504, 'slip_spread_k': 0.24368217204004144, 'spread_hl_frac': 0.04608535519510021, 'bb_std_mult': 0.9561870316047707, 'rsi_os': 32, 'rsi_ob': 77, 'vol_spike': 0.26503439281109725, 'adx_thresh': 6.660506313653942, 'atr_min_pct': 0.0271033495161684, 'atr_max_pct': 0.08313660774421457, 'tp_mult': 2.243319577622416, 'tsl_mult': 0.7733054161796818, 'strategy': 'mean_reversion', 'time_stop': 61, 'use_sma': True, 'use_atr': False, 'use_adx': True, 'use_ema': False, 'use_spike': True, 'rsi_required': True, 'edge_k': 0.8915798551171683, 'edge_cap': 0.5523867132793605, 'bull_strategy': 'mean_reversion', 'bull_bb_std_mult': 1.5144780443446146, 'bull_rsi_os': 38, 'bull_rsi_ob': 54, 'bull_adx_thresh': 26.114419651943305, 'bull_atr_min_pct': 0.017426616369789896, 'bull_atr_max_pct': 0.021827285781250046, 'bull_tp_mult': 2.9450223751091134, 'bull_tsl_mult': 0.4350051185260031, 'bull_time_stop': 157, 'bull_use_sma': False, 'bull_use_ema': True, 'bull_use_atr': True, 'bull_use_adx': False, 'bull_use_spike': False, 'bull_rsi_required': True, 'bear_strategy': 'mean_reversion', 'bear_bb_std_mult': 3.396561804663059, 'bear_rsi_os': 50, 'bear_rsi_ob': 49, 'bear_adx_thresh': 29.21716335011792, 'bear_atr_min_pct': 0.019322021982011234, 'bear_atr_max_pct': 0.1081976096284347, 'bear_tp_mult': 1.2528339224964011, 'bear_tsl_mult': 0.40822391683496845, 'bear_time_stop': 144, 'bear_use_sma': True, 'bear_use_ema': True, 'bear_use_atr': True, 'bear_use_adx': True, 'bear_use_spike': True, 'bear_rsi_required': True, 'sideways_strategy': 'breakout', 'sideways_bb_std_mult': 3.238008841629167, 'sideways_rsi_os': 30, 'sideways_rsi_ob': 51, 'sideways_adx_thresh': 29.495166979096272, 'sideways_atr_min_pct': 0.01670711250522188, 'sideways_atr_max_pct': 0.06362170302724715, 'sideways_tp_mult': 1.5994276624524724, 'sideways_tsl_mult': 0.8295132359906731, 'sideways_time_stop': 157, 'sideways_use_sma': False, 'sideways_use_ema': True, 'sideways_use_atr': False, 'sideways_use_adx': False, 'sideways_use_spike': True, 'sideways_rsi_required': True}.
[I 2025-09-01 10:28:43,548] Trial 548 finished with values: [-1000000000.0, 1000000000.0] and parameters: {'p_sma': 44, 'p_std': 6, 'p_atr': 28, 'p_adx': 22, 'rsi_period': 57, 'ema1': 26, 'ema2': 23, 'slip_atr_k': 0.1724762723755009, 'slip_spread_k': 0.19271137932505084, 'spread_hl_frac': 0.028944432180132287, 'bb_std_mult': 2.7339295783183646, 'rsi_os': 18, 'rsi_ob': 80, 'vol_spike': 0.28466478357385433, 'adx_thresh': 6.14847463775646, 'atr_min_pct': 0.02529379587640225, 'atr_max_pct': 0.07325797829506656, 'tp_mult': 2.1423373892553834, 'tsl_mult': 0.02020739178397952, 'strategy': 'breakout', 'time_stop': 174, 'use_sma': True, 'use_atr': False, 'use_adx': True, 'use_ema': False, 'use_spike': False, 'rsi_required': False, 'edge_k': 1.2753471670034924, 'edge_cap': 0.5246011153852286, 'bull_strategy': 'mean_reversion', 'bull_bb_std_mult': 0.7172581190217255, 'bull_rsi_os': 53, 'bull_rsi_ob': 76, 'bull_adx_thresh': 30.99663649948134, 'bull_atr_min_pct': 0.009116282587259623, 'bull_atr_max_pct': 0.13518008999044412, 'bull_tp_mult': 1.6774739345791947, 'bull_tsl_mult': 0.31212930697324986, 'bull_time_stop': 147, 'bull_use_sma': True, 'bull_use_ema': False, 'bull_use_atr': True, 'bull_use_adx': True, 'bull_use_spike': False, 'bull_rsi_required': True, 'bear_strategy': 'mean_reversion', 'bear_bb_std_mult': 3.530021592553855, 'bear_rsi_os': 13, 'bear_rsi_ob': 45, 'bear_adx_thresh': 8.734219651150648, 'bear_atr_min_pct': 0.017840599120479222, 'bear_atr_max_pct': 0.03582662140818259, 'bear_tp_mult': 1.4156255837918437, 'bear_tsl_mult': 0.45564807514306865, 'bear_time_stop': 185, 'bear_use_sma': False, 'bear_use_ema': True, 'bear_use_atr': True, 'bear_use_adx': False, 'bear_use_spike': True, 'bear_rsi_required': False, 'sideways_strategy': 'breakout', 'sideways_bb_std_mult': 3.337362495283495, 'sideways_rsi_os': 26, 'sideways_rsi_ob': 48, 'sideways_adx_thresh': 27.337228177963016, 'sideways_atr_min_pct': 0.007975255046612999, 'sideways_atr_max_pct': 0.11977750897883116, 'sideways_tp_mult': 1.378422343986713, 'sideways_tsl_mult': 0.8951428370740216, 'sideways_time_stop': 202, 'sideways_use_sma': False, 'sideways_use_ema': True, 'sideways_use_atr': False, 'sideways_use_adx': False, 'sideways_use_spike': False, 'sideways_rsi_required': False}.
[I 2025-09-01 10:28:43,893] Trial 549 finished with values: [-1000000000.0, 1000000000.0] and parameters: {'p_sma': 17, 'p_std': 12, 'p_atr': 28, 'p_adx': 30, 'rsi_period': 66, 'ema1': 22, 'ema2': 26, 'slip_atr_k': 0.17082606155118527, 'slip_spread_k': 0.19361658110195107, 'spread_hl_frac': 0.028781704055322477, 'bb_std_mult': 2.9438728953766105, 'rsi_os': 17, 'rsi_ob': 53, 'vol_spike': 0.2863818629498331, 'adx_thresh': 27.370102464320073, 'atr_min_pct': 0.025172528974009078, 'atr_max_pct': 0.07080174408154537, 'tp_mult': 1.0108383650960886, 'tsl_mult': 0.019801097667381307, 'strategy': 'breakout', 'time_stop': 103, 'use_sma': True, 'use_atr': False, 'use_adx': True, 'use_ema': False, 'use_spike': False, 'rsi_required': False, 'edge_k': 1.9839783954075592, 'edge_cap': 0.6945031007809526, 'bull_strategy': 'mean_reversion', 'bull_bb_std_mult': 0.6924338283328714, 'bull_rsi_os': 29, 'bull_rsi_ob': 55, 'bull_adx_thresh': 7.208481395665605, 'bull_atr_min_pct': 0.016076829042817545, 'bull_atr_max_pct': 0.09463784662371624, 'bull_tp_mult': 1.6716027370242201, 'bull_tsl_mult': 0.31076816198956114, 'bull_time_stop': 92, 'bull_use_sma': True, 'bull_use_ema': False, 'bull_use_atr': True, 'bull_use_adx': True, 'bull_use_spike': False, 'bull_rsi_required': True, 'bear_strategy': 'mean_reversion', 'bear_bb_std_mult': 3.5428331987107615, 'bear_rsi_os': 47, 'bear_rsi_ob': 84, 'bear_adx_thresh': 24.67763425808415, 'bear_atr_min_pct': 0.01228236577229233, 'bear_atr_max_pct': 0.06684033848090357, 'bear_tp_mult': 1.5883265140065264, 'bear_tsl_mult': 0.45748374795734276, 'bear_time_stop': 134, 'bear_use_sma': False, 'bear_use_ema': True, 'bear_use_atr': True, 'bear_use_adx': False, 'bear_use_spike': True, 'bear_rsi_required': False, 'sideways_strategy': 'breakout', 'sideways_bb_std_mult': 3.348812557944971, 'sideways_rsi_os': 47, 'sideways_rsi_ob': 78, 'sideways_adx_thresh': 27.3451809456366, 'sideways_atr_min_pct': 0.02326025812215612, 'sideways_atr_max_pct': 0.09015792387612834, 'sideways_tp_mult': 1.3253194050664694, 'sideways_tsl_mult': 0.8031350364201343, 'sideways_time_stop': 204, 'sideways_use_sma': False, 'sideways_use_ema': True, 'sideways_use_atr': False, 'sideways_use_adx': False, 'sideways_use_spike': False, 'sideways_rsi_required': False}.
[I 2025-09-01 10:28:44,163] Trial 546 finished with values: [-0.16216270167825098, 0.16194033665054441] and parameters: {'p_sma': 15, 'p_std': 10, 'p_atr': 30, 'p_adx': 22, 'rsi_period': 65, 'ema1': 22, 'ema2': 11, 'slip_atr_k': 0.046701612460595336, 'slip_spread_k': 0.1932506646173587, 'spread_hl_frac': 0.029321085423441546, 'bb_std_mult': 2.0324276133657126, 'rsi_os': 30, 'rsi_ob': 80, 'vol_spike': 0.2882841515967822, 'adx_thresh': 5.923055777206863, 'atr_min_pct': 0.009551033672475881, 'atr_max_pct': 0.1189646795763349, 'tp_mult': 2.328422349224156, 'tsl_mult': 0.020422573345379384, 'strategy': 'breakout', 'time_stop': 224, 'use_sma': True, 'use_atr': False, 'use_adx': True, 'use_ema': False, 'use_spike': False, 'rsi_required': False, 'edge_k': 0.4826507776323531, 'edge_cap': 0.5731169702330856, 'bull_strategy': 'mean_reversion', 'bull_bb_std_mult': 1.4324864612071275, 'bull_rsi_os': 17, 'bull_rsi_ob': 55, 'bull_adx_thresh': 26.311266725788514, 'bull_atr_min_pct': 0.01729644336041649, 'bull_atr_max_pct': 0.02181643189681559, 'bull_tp_mult': 1.8827998782956845, 'bull_tsl_mult': 0.11930404269616629, 'bull_time_stop': 142, 'bull_use_sma': True, 'bull_use_ema': False, 'bull_use_atr': True, 'bull_use_adx': True, 'bull_use_spike': False, 'bull_rsi_required': True, 'bear_strategy': 'mean_reversion', 'bear_bb_std_mult': 3.4848469891603537, 'bear_rsi_os': 13, 'bear_rsi_ob': 45, 'bear_adx_thresh': 24.678906622318042, 'bear_atr_min_pct': 0.007165733454259705, 'bear_atr_max_pct': 0.07984459638812967, 'bear_tp_mult': 2.910287655545625, 'bear_tsl_mult': 0.45342433871986043, 'bear_time_stop': 185, 'bear_use_sma': False, 'bear_use_ema': True, 'bear_use_atr': True, 'bear_use_adx': False, 'bear_use_spike': True, 'bear_rsi_required': False, 'sideways_strategy': 'breakout', 'sideways_bb_std_mult': 3.1558349894123783, 'sideways_rsi_os': 47, 'sideways_rsi_ob': 48, 'sideways_adx_thresh': 9.169517445321157, 'sideways_atr_min_pct': 0.0019091015396144645, 'sideways_atr_max_pct': 0.05619370999805705, 'sideways_tp_mult': 1.2816478028969556, 'sideways_tsl_mult': 0.8060736257667224, 'sideways_time_stop': 195, 'sideways_use_sma': False, 'sideways_use_ema': True, 'sideways_use_atr': False, 'sideways_use_adx': False, 'sideways_use_spike': False, 'sideways_rsi_required': False}.
