[I 2025-08-31 10:02:20,769] Trial 321 finished with values: [-0.07122950303053799, 0.07111627947952366] and parameters: {'p_sma': 46, 'p_std': 50, 'p_atr': 30, 'p_adx': 13, 'rsi_period': 20, 'ema1': 20, 'ema2': 41, 'slip_atr_k': 0.20880989469364997, 'slip_spread_k': 0.418932224887089, 'spread_hl_frac': 0.013462577287349396, 'bb_std_mult': 1.1372070265175955, 'rsi_os': 33, 'rsi_ob': 49, 'vol_spike': 0.06238425897898102, 'adx_thresh': 6.262713569031742, 'atr_min_pct': 0.011866372023901058, 'atr_max_pct': 0.03921520276990914, 'tp_mult': 1.8703462062071683, 'tsl_mult': 0.15022520562915131, 'strategy': 'breakout', 'time_stop': 170, 'use_sma': False, 'use_atr': False, 'use_adx': False, 'use_ema': True, 'use_spike': False, 'rsi_required': True, 'edge_k': 0.09965537768783295, 'edge_cap': 0.7655427186422032, 'bull_strategy': 'mean_reversion', 'bull_bb_std_mult': 2.0770547783646145, 'bull_rsi_os': 29, 'bull_rsi_ob': 64, 'bull_adx_thresh': 13.461597131804192, 'bull_atr_min_pct': 0.004578877905879573, 'bull_atr_max_pct': 0.10771186691683737, 'bull_tp_mult': 2.528993751391891, 'bull_tsl_mult': 0.2752953830116084, 'bull_time_stop': 249, 'bull_use_sma': True, 'bull_use_ema': False, 'bull_use_atr': False, 'bull_use_adx': False, 'bull_use_spike': True, 'bull_rsi_required': True, 'bear_strategy': 'breakout', 'bear_bb_std_mult': 2.6387139554020296, 'bear_rsi_os': 53, 'bear_rsi_ob': 77, 'bear_adx_thresh': 22.53791875152042, 'bear_atr_min_pct': 0.020168849006627146, 'bear_atr_max_pct': 0.12609914653620613, 'bear_tp_mult': 2.6583801107219376, 'bear_tsl_mult': 0.47916569412056725, 'bear_time_stop': 23, 'bear_use_sma': False, 'bear_use_ema': True, 'bear_use_atr': False, 'bear_use_adx': True, 'bear_use_spike': False, 'bear_rsi_required': True, 'sideways_strategy': 'breakout', 'sideways_bb_std_mult': 0.9617410238921413, 'sideways_rsi_os': 27, 'sideways_rsi_ob': 63, 'sideways_adx_thresh': 33.54130254971691, 'sideways_atr_min_pct': 6.336823362142392e-05, 'sideways_atr_max_pct': 0.0258543348356997, 'sideways_tp_mult': 1.3556535864080903, 'sideways_tsl_mult': 0.054983864559219955, 'sideways_time_stop': 73, 'sideways_use_sma': True, 'sideways_use_ema': True, 'sideways_use_atr': True, 'sideways_use_adx': False, 'sideways_use_spike': True, 'sideways_rsi_required': False}.
[I 2025-08-31 10:02:20,922] Trial 325 finished with values: [-0.03315330023693219, 0.0329639416909746] and parameters: {'p_sma': 46, 'p_std': 50, 'p_atr': 29, 'p_adx': 10, 'rsi_period': 22, 'ema1': 20, 'ema2': 11, 'slip_atr_k': 0.21017453873807973, 'slip_spread_k': 0.3375416960757295, 'spread_hl_frac': 0.02895235327532956, 'bb_std_mult': 1.1331012254963695, 'rsi_os': 41, 'rsi_ob': 91, 'vol_spike': 0.24918585698297518, 'adx_thresh': 19.29880349252696, 'atr_min_pct': 0.012647503217725172, 'atr_max_pct': 0.11978404954522338, 'tp_mult': 1.8656846915180543, 'tsl_mult': 0.06550348384026056, 'strategy': 'breakout', 'time_stop': 135, 'use_sma': False, 'use_atr': False, 'use_adx': False, 'use_ema': True, 'use_spike': True, 'rsi_required': True, 'edge_k': 1.8882284420266267, 'edge_cap': 0.6606315958969875, 'bull_strategy': 'mean_reversion', 'bull_bb_std_mult': 1.3196282564331703, 'bull_rsi_os': 54, 'bull_rsi_ob': 54, 'bull_adx_thresh': 21.39110423519774, 'bull_atr_min_pct': 0.029483685442681255, 'bull_atr_max_pct': 0.03283722825283277, 'bull_tp_mult': 2.2172403987261697, 'bull_tsl_mult': 0.6066048437455391, 'bull_time_stop': 231, 'bull_use_sma': False, 'bull_use_ema': False, 'bull_use_atr': False, 'bull_use_adx': False, 'bull_use_spike': False, 'bull_rsi_required': True, 'bear_strategy': 'mean_reversion', 'bear_bb_std_mult': 2.718857535160753, 'bear_rsi_os': 31, 'bear_rsi_ob': 60, 'bear_adx_thresh': 6.8157802748489065, 'bear_atr_min_pct': 0.020230275583151203, 'bear_atr_max_pct': 0.10610711471775873, 'bear_tp_mult': 2.657434727032094, 'bear_tsl_mult': 0.009207781057544218, 'bear_time_stop': 180, 'bear_use_sma': False, 'bear_use_ema': True, 'bear_use_atr': True, 'bear_use_adx': True, 'bear_use_spike': False, 'bear_rsi_required': True, 'sideways_strategy': 'breakout', 'sideways_bb_std_mult': 0.9727880391927433, 'sideways_rsi_os': 35, 'sideways_rsi_ob': 88, 'sideways_adx_thresh': 25.978472240645957, 'sideways_atr_min_pct': 0.002079160126837303, 'sideways_atr_max_pct': 0.02567188393700092, 'sideways_tp_mult': 2.839838954362942, 'sideways_tsl_mult': 0.15611983171599286, 'sideways_time_stop': 155, 'sideways_use_sma': False, 'sideways_use_ema': False, 'sideways_use_atr': False, 'sideways_use_adx': False, 'sideways_use_spike': False, 'sideways_rsi_required': False}.
[I 2025-08-31 10:02:51,592] Trial 326 finished with values: [-1000000000.0, 1000000000.0] and parameters: {'p_sma': 48, 'p_std': 7, 'p_atr': 29, 'p_adx': 19, 'rsi_period': 21, 'ema1': 29, 'ema2': 21, 'slip_atr_k': 0.15778085635617928, 'slip_spread_k': 0.842268998407233, 'spread_hl_frac': 0.016058892445123173, 'bb_std_mult': 1.1077397195283258, 'rsi_os': 23, 'rsi_ob': 83, 'vol_spike': 0.19166558895196767, 'adx_thresh': 6.19941347555476, 'atr_min_pct': 0.012535713471530686, 'atr_max_pct': 0.12095013286457848, 'tp_mult': 1.640909900823963, 'tsl_mult': 0.03628339061016256, 'strategy': 'mean_reversion', 'time_stop': 136, 'use_sma': False, 'use_atr': False, 'use_adx': False, 'use_ema': False, 'use_spike': False, 'rsi_required': True, 'edge_k': 1.8975288076541958, 'edge_cap': 0.5679514008354065, 'bull_strategy': 'mean_reversion', 'bull_bb_std_mult': 1.2867139505747351, 'bull_rsi_os': 54, 'bull_rsi_ob': 90, 'bull_adx_thresh': 30.76735308832625, 'bull_atr_min_pct': 0.014190936251886962, 'bull_atr_max_pct': 0.11999590947652956, 'bull_tp_mult': 1.4045884833702391, 'bull_tsl_mult': 0.6059927260063884, 'bull_time_stop': 134, 'bull_use_sma': False, 'bull_use_ema': False, 'bull_use_atr': False, 'bull_use_adx': False, 'bull_use_spike': False, 'bull_rsi_required': True, 'bear_strategy': 'mean_reversion', 'bear_bb_std_mult': 2.7219968073553584, 'bear_rsi_os': 27, 'bear_rsi_ob': 74, 'bear_adx_thresh': 22.12894815765484, 'bear_atr_min_pct': 0.01507210994114606, 'bear_atr_max_pct': 0.12716646856780833, 'bear_tp_mult': 2.1548492311199365, 'bear_tsl_mult': 0.49036831811880205, 'bear_time_stop': 253, 'bear_use_sma': False, 'bear_use_ema': False, 'bear_use_atr': True, 'bear_use_adx': True, 'bear_use_spike': True, 'bear_rsi_required': True, 'sideways_strategy': 'breakout', 'sideways_bb_std_mult': 1.0206167532105102, 'sideways_rsi_os': 8, 'sideways_rsi_ob': 64, 'sideways_adx_thresh': 6.242325257857921, 'sideways_atr_min_pct': 0.018665793301354747, 'sideways_atr_max_pct': 0.13138845356936638, 'sideways_tp_mult': 1.8732867270912261, 'sideways_tsl_mult': 0.08951319377898441, 'sideways_time_stop': 152, 'sideways_use_sma': False, 'sideways_use_ema': False, 'sideways_use_atr': False, 'sideways_use_adx': False, 'sideways_use_spike': False, 'sideways_rsi_required': False}.
[I 2025-08-31 10:02:52,141] Trial 327 finished with values: [-1000000000.0, 1000000000.0] and parameters: {'p_sma': 10, 'p_std': 40, 'p_atr': 29, 'p_adx': 10, 'rsi_period': 24, 'ema1': 20, 'ema2': 40, 'slip_atr_k': 0.11323387483944986, 'slip_spread_k': 0.3850056009527416, 'spread_hl_frac': 0.01385485846305626, 'bb_std_mult': 1.133053772945541, 'rsi_os': 22, 'rsi_ob': 61, 'vol_spike': 0.13627909780379682, 'adx_thresh': 7.3571267195713785, 'atr_min_pct': 0.01257672107898649, 'atr_max_pct': 0.11886705636543796, 'tp_mult': 2.8340777636482755, 'tsl_mult': 0.94899464670141, 'strategy': 'breakout', 'time_stop': 146, 'use_sma': False, 'use_atr': False, 'use_adx': False, 'use_ema': False, 'use_spike': False, 'rsi_required': True, 'edge_k': 1.8950299731381075, 'edge_cap': 0.11754614403172081, 'bull_strategy': 'mean_reversion', 'bull_bb_std_mult': 1.2959534165761315, 'bull_rsi_os': 33, 'bull_rsi_ob': 66, 'bull_adx_thresh': 5.415000356190799, 'bull_atr_min_pct': 0.00394047687611182, 'bull_atr_max_pct': 0.12112189820035177, 'bull_tp_mult': 1.410670033492449, 'bull_tsl_mult': 0.6046464843643822, 'bull_time_stop': 232, 'bull_use_sma': False, 'bull_use_ema': False, 'bull_use_atr': False, 'bull_use_adx': False, 'bull_use_spike': False, 'bull_rsi_required': True, 'bear_strategy': 'mean_reversion', 'bear_bb_std_mult': 2.7071353048000564, 'bear_rsi_os': 19, 'bear_rsi_ob': 60, 'bear_adx_thresh': 11.049981146796421, 'bear_atr_min_pct': 0.02177083141319555, 'bear_atr_max_pct': 0.09345176125111589, 'bear_tp_mult': 2.651448976606428, 'bear_tsl_mult': 0.5521768585563779, 'bear_time_stop': 252, 'bear_use_sma': False, 'bear_use_ema': True, 'bear_use_atr': True, 'bear_use_adx': True, 'bear_use_spike': False, 'bear_rsi_required': True, 'sideways_strategy': 'breakout', 'sideways_bb_std_mult': 1.0360306455728099, 'sideways_rsi_os': 44, 'sideways_rsi_ob': 57, 'sideways_adx_thresh': 32.91614020030305, 'sideways_atr_min_pct': 0.0028820406346812223, 'sideways_atr_max_pct': 0.025327161338090855, 'sideways_tp_mult': 1.511166490513929, 'sideways_tsl_mult': 0.09402016875447032, 'sideways_time_stop': 153, 'sideways_use_sma': False, 'sideways_use_ema': False, 'sideways_use_atr': False, 'sideways_use_adx': False, 'sideways_use_spike': False, 'sideways_rsi_required': False}.
[I 2025-08-31 10:02:52,342] Trial 328 finished with values: [-1000000000.0, 1000000000.0] and parameters: {'p_sma': 52, 'p_std': 15, 'p_atr': 29, 'p_adx': 16, 'rsi_period': 24, 'ema1': 19, 'ema2': 24, 'slip_atr_k': 0.19601865542542055, 'slip_spread_k': 0.09294882705004626, 'spread_hl_frac': 0.0025169858755893296, 'bb_std_mult': 0.9343532584092643, 'rsi_os': 22, 'rsi_ob': 47, 'vol_spike': 0.13384730132459455, 'adx_thresh': 7.416795697324585, 'atr_min_pct': 0.01264173791642878, 'atr_max_pct': 0.13123125596401916, 'tp_mult': 1.6386030019533482, 'tsl_mult': 0.800763640004406, 'strategy': 'breakout', 'time_stop': 145, 'use_sma': False, 'use_atr': False, 'use_adx': True, 'use_ema': False, 'use_spike': False, 'rsi_required': True, 'edge_k': 1.914451828793136, 'edge_cap': 0.2601161584924566, 'bull_strategy': 'mean_reversion', 'bull_bb_std_mult': 3.128565825613756, 'bull_rsi_os': 33, 'bull_rsi_ob': 66, 'bull_adx_thresh': 5.181273616743631, 'bull_atr_min_pct': 0.01701175678789145, 'bull_atr_max_pct': 0.03239417478911791, 'bull_tp_mult': 1.4014092821710453, 'bull_tsl_mult': 0.4998949905597492, 'bull_time_stop': 233, 'bull_use_sma': False, 'bull_use_ema': False, 'bull_use_atr': False, 'bull_use_adx': False, 'bull_use_spike': False, 'bull_rsi_required': True, 'bear_strategy': 'mean_reversion', 'bear_bb_std_mult': 2.8778170651990562, 'bear_rsi_os': 21, 'bear_rsi_ob': 57, 'bear_adx_thresh': 19.111132872208444, 'bear_atr_min_pct': 0.021496639994704497, 'bear_atr_max_pct': 0.14029623866245253, 'bear_tp_mult': 2.5219910569963537, 'bear_tsl_mult': 0.45242761871521936, 'bear_time_stop': 145, 'bear_use_sma': False, 'bear_use_ema': True, 'bear_use_atr': True, 'bear_use_adx': True, 'bear_use_spike': False, 'bear_rsi_required': True, 'sideways_strategy': 'breakout', 'sideways_bb_std_mult': 1.0432622276468706, 'sideways_rsi_os': 28, 'sideways_rsi_ob': 65, 'sideways_adx_thresh': 33.12743941180685, 'sideways_atr_min_pct': 0.0026327728169228213, 'sideways_atr_max_pct': 0.11525447637458433, 'sideways_tp_mult': 1.5137778957018404, 'sideways_tsl_mult': 0.157763863414627, 'sideways_time_stop': 154, 'sideways_use_sma': False, 'sideways_use_ema': False, 'sideways_use_atr': False, 'sideways_use_adx': False, 'sideways_use_spike': False, 'sideways_rsi_required': False}.
[I 2025-08-31 10:02:52,447] Trial 329 finished with values: [-1000000000.0, 1000000000.0] and parameters: {'p_sma': 31, 'p_std': 41, 'p_atr': 10, 'p_adx': 17, 'rsi_period': 24, 'ema1': 19, 'ema2': 13, 'slip_atr_k': 0.17143459301060754, 'slip_spread_k': 0.09739385443602239, 'spread_hl_frac': 0.006225539001210485, 'bb_std_mult': 1.123838448440466, 'rsi_os': 22, 'rsi_ob': 95, 'vol_spike': 0.1277831927896031, 'adx_thresh': 7.156898233097606, 'atr_min_pct': 0.012401332451995116, 'atr_max_pct': 0.13141549087663149, 'tp_mult': 1.635600221084891, 'tsl_mult': 0.00018027035198644553, 'strategy': 'breakout', 'time_stop': 145, 'use_sma': False, 'use_atr': False, 'use_adx': True, 'use_ema': False, 'use_spike': True, 'rsi_required': True, 'edge_k': 1.902414066191387, 'edge_cap': 0.6568832035830756, 'bull_strategy': 'mean_reversion', 'bull_bb_std_mult': 1.310665663439659, 'bull_rsi_os': 54, 'bull_rsi_ob': 66, 'bull_adx_thresh': 7.209842625089804, 'bull_atr_min_pct': 0.01849726703475845, 'bull_atr_max_pct': 0.12105343308758315, 'bull_tp_mult': 1.4522157932994544, 'bull_tsl_mult': 0.6101961538028486, 'bull_time_stop': 241, 'bull_use_sma': False, 'bull_use_ema': False, 'bull_use_atr': False, 'bull_use_adx': False, 'bull_use_spike': False, 'bull_rsi_required': False, 'bear_strategy': 'mean_reversion', 'bear_bb_std_mult': 2.716336575346234, 'bear_rsi_os': 31, 'bear_rsi_ob': 79, 'bear_adx_thresh': 6.717361380246791, 'bear_atr_min_pct': 0.01508055268938876, 'bear_atr_max_pct': 0.13904836556170178, 'bear_tp_mult': 2.6977971316323885, 'bear_tsl_mult': 0.881611277081078, 'bear_time_stop': 251, 'bear_use_sma': False, 'bear_use_ema': True, 'bear_use_atr': True, 'bear_use_adx': True, 'bear_use_spike': False, 'bear_rsi_required': True, 'sideways_strategy': 'breakout', 'sideways_bb_std_mult': 1.2208675873975372, 'sideways_rsi_os': 28, 'sideways_rsi_ob': 64, 'sideways_adx_thresh': 20.654465100944737, 'sideways_atr_min_pct': 0.01837029204627589, 'sideways_atr_max_pct': 0.11589432764014404, 'sideways_tp_mult': 1.506606177922158, 'sideways_tsl_mult': 0.15515767780938866, 'sideways_time_stop': 5, 'sideways_use_sma': False, 'sideways_use_ema': False, 'sideways_use_atr': False, 'sideways_use_adx': False, 'sideways_use_spike': False, 'sideways_rsi_required': False}.
[I 2025-08-31 10:03:24,026] Trial 330 finished with values: [-1000000000.0, 1000000000.0] and parameters: {'p_sma': 52, 'p_std': 40, 'p_atr': 29, 'p_adx': 10, 'rsi_period': 84, 'ema1': 19, 'ema2': 59, 'slip_atr_k': 0.07142560594020184, 'slip_spread_k': 0.3381220020821605, 'spread_hl_frac': 0.011303051444954616, 'bb_std_mult': 0.9612026371313288, 'rsi_os': 21, 'rsi_ob': 95, 'vol_spike': 0.24736860138532196, 'adx_thresh': 7.385270550480833, 'atr_min_pct': 0.012544304043796225, 'atr_max_pct': 0.13098979325122417, 'tp_mult': 2.838482884843936, 'tsl_mult': 0.9728021765041353, 'strategy': 'breakout', 'time_stop': 144, 'use_sma': False, 'use_atr': False, 'use_adx': True, 'use_ema': False, 'use_spike': True, 'rsi_required': True, 'edge_k': 0.5088356742712727, 'edge_cap': 0.825239310282627, 'bull_strategy': 'mean_reversion', 'bull_bb_std_mult': 2.1733133094941803, 'bull_rsi_os': 34, 'bull_rsi_ob': 50, 'bull_adx_thresh': 32.76233806051425, 'bull_atr_min_pct': 0.018929112941424946, 'bull_atr_max_pct': 0.12172331403558907, 'bull_tp_mult': 1.01052650343381, 'bull_tsl_mult': 0.6238354428655228, 'bull_time_stop': 240, 'bull_use_sma': False, 'bull_use_ema': False, 'bull_use_atr': False, 'bull_use_adx': False, 'bull_use_spike': False, 'bull_rsi_required': False, 'bear_strategy': 'mean_reversion', 'bear_bb_std_mult': 2.8619810223270363, 'bear_rsi_os': 52, 'bear_rsi_ob': 79, 'bear_adx_thresh': 11.238214345010062, 'bear_atr_min_pct': 0.02173436941898714, 'bear_atr_max_pct': 0.07069108016160452, 'bear_tp_mult': 2.713100395151021, 'bear_tsl_mult': 0.4526334651380077, 'bear_time_stop': 126, 'bear_use_sma': False, 'bear_use_ema': True, 'bear_use_atr': True, 'bear_use_adx': True, 'bear_use_spike': False, 'bear_rsi_required': True, 'sideways_strategy': 'breakout', 'sideways_bb_std_mult': 1.1930783011758126, 'sideways_rsi_os': 44, 'sideways_rsi_ob': 65, 'sideways_adx_thresh': 10.762146238381696, 'sideways_atr_min_pct': 0.028235635667592785, 'sideways_atr_max_pct': 0.03643887937415736, 'sideways_tp_mult': 2.855068228939583, 'sideways_tsl_mult': 0.12057962281570839, 'sideways_time_stop': 244, 'sideways_use_sma': False, 'sideways_use_ema': False, 'sideways_use_atr': False, 'sideways_use_adx': False, 'sideways_use_spike': False, 'sideways_rsi_required': False}.
[I 2025-08-31 10:03:25,216] Trial 331 finished with values: [-1000000000.0, 1000000000.0] and parameters: {'p_sma': 51, 'p_std': 11, 'p_atr': 29, 'p_adx': 17, 'rsi_period': 84, 'ema1': 30, 'ema2': 27, 'slip_atr_k': 0.17400845225465172, 'slip_spread_k': 0.5109000188881926, 'spread_hl_frac': 0.002323783246552153, 'bb_std_mult': 0.900117003236871, 'rsi_os': 38, 'rsi_ob': 92, 'vol_spike': 0.13235864225861982, 'adx_thresh': 11.310735328758462, 'atr_min_pct': 0.0033136024265500476, 'atr_max_pct': 0.1386700500719886, 'tp_mult': 2.5005073815671826, 'tsl_mult': 0.9741906944416789, 'strategy': 'breakout', 'time_stop': 263, 'use_sma': False, 'use_atr': False, 'use_adx': True, 'use_ema': False, 'use_spike': True, 'rsi_required': False, 'edge_k': 0.5149768036481402, 'edge_cap': 0.0755782733471221, 'bull_strategy': 'mean_reversion', 'bull_bb_std_mult': 2.2028516992452416, 'bull_rsi_os': 51, 'bull_rsi_ob': 53, 'bull_adx_thresh': 7.419873505272104, 'bull_atr_min_pct': 0.017003238437628587, 'bull_atr_max_pct': 0.03210128550308069, 'bull_tp_mult': 1.6095324016109471, 'bull_tsl_mult': 0.629419463029439, 'bull_time_stop': 244, 'bull_use_sma': True, 'bull_use_ema': True, 'bull_use_atr': False, 'bull_use_adx': False, 'bull_use_spike': False, 'bull_rsi_required': False, 'bear_strategy': 'breakout', 'bear_bb_std_mult': 2.1087294991927013, 'bear_rsi_os': 51, 'bear_rsi_ob': 79, 'bear_adx_thresh': 7.0154691053387594, 'bear_atr_min_pct': 0.013379805106528848, 'bear_atr_max_pct': 0.1396566544141491, 'bear_tp_mult': 2.552279184338125, 'bear_tsl_mult': 0.45644349416313684, 'bear_time_stop': 262, 'bear_use_sma': False, 'bear_use_ema': True, 'bear_use_atr': False, 'bear_use_adx': True, 'bear_use_spike': False, 'bear_rsi_required': True, 'sideways_strategy': 'breakout', 'sideways_bb_std_mult': 1.3168061716110118, 'sideways_rsi_os': 25, 'sideways_rsi_ob': 62, 'sideways_adx_thresh': 8.50634930596739, 'sideways_atr_min_pct': 0.0034725886400937753, 'sideways_atr_max_pct': 0.02806639533338988, 'sideways_tp_mult': 2.158859702204002, 'sideways_tsl_mult': 0.15690893766300082, 'sideways_time_stop': 244, 'sideways_use_sma': True, 'sideways_use_ema': True, 'sideways_use_atr': False, 'sideways_use_adx': False, 'sideways_use_spike': False, 'sideways_rsi_required': False}.
[I 2025-08-31 10:03:25,386] Trial 333 finished with values: [-1000000000.0, 1000000000.0] and parameters: {'p_sma': 50, 'p_std': 28, 'p_atr': 29, 'p_adx': 10, 'rsi_period': 18, 'ema1': 21, 'ema2': 11, 'slip_atr_k': 0.0715584762337502, 'slip_spread_k': 0.33632613033007963, 'spread_hl_frac': 0.01922602322978505, 'bb_std_mult': 0.9701001916258178, 'rsi_os': 21, 'rsi_ob': 72, 'vol_spike': 0.24752193001485673, 'adx_thresh': 5.434308853534045, 'atr_min_pct': 0.018414528230406606, 'atr_max_pct': 0.13853255910664608, 'tp_mult': 2.0823361872211117, 'tsl_mult': 0.507559523296867, 'strategy': 'breakout', 'time_stop': 264, 'use_sma': True, 'use_atr': True, 'use_adx': False, 'use_ema': False, 'use_spike': True, 'rsi_required': False, 'edge_k': 1.7971564711453354, 'edge_cap': 0.07749412507961698, 'bull_strategy': 'breakout', 'bull_bb_std_mult': 1.349412448637805, 'bull_rsi_os': 51, 'bull_rsi_ob': 53, 'bull_adx_thresh': 26.97761023083485, 'bull_atr_min_pct': 0.018331285293807162, 'bull_atr_max_pct': 0.023182484040610345, 'bull_tp_mult': 1.2743946229745076, 'bull_tsl_mult': 0.9827815042249375, 'bull_time_stop': 258, 'bull_use_sma': True, 'bull_use_ema': True, 'bull_use_atr': False, 'bull_use_adx': True, 'bull_use_spike': True, 'bull_rsi_required': False, 'bear_strategy': 'breakout', 'bear_bb_std_mult': 2.953249470088958, 'bear_rsi_os': 24, 'bear_rsi_ob': 86, 'bear_adx_thresh': 21.506513136353387, 'bear_atr_min_pct': 0.02302982061864567, 'bear_atr_max_pct': 0.1062757621274938, 'bear_tp_mult': 1.1114156887463817, 'bear_tsl_mult': 0.7991706009809637, 'bear_time_stop': 272, 'bear_use_sma': False, 'bear_use_ema': True, 'bear_use_atr': False, 'bear_use_adx': True, 'bear_use_spike': False, 'bear_rsi_required': False, 'sideways_strategy': 'breakout', 'sideways_bb_std_mult': 1.1366459776635838, 'sideways_rsi_os': 25, 'sideways_rsi_ob': 62, 'sideways_adx_thresh': 32.02377506143296, 'sideways_atr_min_pct': 0.02815930746054225, 'sideways_atr_max_pct': 0.034350529999478505, 'sideways_tp_mult': 1.5998707949084556, 'sideways_tsl_mult': 0.12419553464081794, 'sideways_time_stop': 253, 'sideways_use_sma': True, 'sideways_use_ema': True, 'sideways_use_atr': True, 'sideways_use_adx': True, 'sideways_use_spike': False, 'sideways_rsi_required': False}.
