[I 2025-08-31 09:23:18,855] Trial 27 finished with values: [-1000000000.0, 1000000000.0] and parameters: {'p_sma': 52, 'p_std': 13, 'p_atr': 22, 'p_adx': 27, 'rsi_period': 84, 'ema1': 14, 'ema2': 59, 'slip_atr_k': 0.09951486246262803, 'slip_spread_k': 0.3835058486993811, 'spread_hl_frac': 0.01971870209087233, 'bb_std_mult': 2.3409030823489942, 'rsi_os': 34, 'rsi_ob': 67, 'vol_spike': 0.12153994126760351, 'adx_thresh': 5.435774641392973, 'atr_min_pct': 0.019942491580147763, 'atr_max_pct': 0.12254104984223455, 'tp_mult': 1.976874539393175, 'tsl_mult': 0.8621872816196704, 'strategy': 'mean_reversion', 'time_stop': 155, 'use_sma': False, 'use_atr': True, 'use_adx': False, 'use_ema': False, 'use_spike': True, 'rsi_required': False, 'edge_k': 0.31799115006394685, 'edge_cap': 0.6803389869474854, 'bull_strategy': 'breakout', 'bull_bb_std_mult': 1.5062565521294307, 'bull_rsi_os': 29, 'bull_rsi_ob': 86, 'bull_adx_thresh': 17.99255644774329, 'bull_atr_min_pct': 0.025668582652971138, 'bull_atr_max_pct': 0.12736916257116865, 'bull_tp_mult': 1.869650928858334, 'bull_tsl_mult': 0.7482352299822536, 'bull_time_stop': 190, 'bull_use_sma': False, 'bull_use_ema': True, 'bull_use_atr': True, 'bull_use_adx': False, 'bull_use_spike': True, 'bull_rsi_required': False, 'bear_strategy': 'breakout', 'bear_bb_std_mult': 2.5488489441294386, 'bear_rsi_os': 23, 'bear_rsi_ob': 73, 'bear_adx_thresh': 16.899652115678844, 'bear_atr_min_pct': 0.00039352604376542005, 'bear_atr_max_pct': 0.01020363855059736, 'bear_tp_mult': 1.2386740329188355, 'bear_tsl_mult': 0.6214219542559722, 'bear_time_stop': 53, 'bear_use_sma': False, 'bear_use_ema': False, 'bear_use_atr': True, 'bear_use_adx': True, 'bear_use_spike': True, 'bear_rsi_required': False, 'sideways_strategy': 'mean_reversion', 'sideways_bb_std_mult': 2.127209613962148, 'sideways_rsi_os': 55, 'sideways_rsi_ob': 87, 'sideways_adx_thresh': 22.308208198987174, 'sideways_atr_min_pct': 0.01863352059007118, 'sideways_atr_max_pct': 0.07108925464062694, 'sideways_tp_mult': 2.0739706302831253, 'sideways_tsl_mult': 0.982691535066886, 'sideways_time_stop': 262, 'sideways_use_sma': False, 'sideways_use_ema': False, 'sideways_use_atr': False, 'sideways_use_adx': False, 'sideways_use_spike': True, 'sideways_rsi_required': True}.
[I 2025-08-31 09:23:20,615] Trial 28 finished with values: [-1000000000.0, 1000000000.0] and parameters: {'p_sma': 14, 'p_std': 12, 'p_atr': 22, 'p_adx': 27, 'rsi_period': 82, 'ema1': 13, 'ema2': 60, 'slip_atr_k': 0.21221867699764485, 'slip_spread_k': 0.8128884399581786, 'spread_hl_frac': 0.021396445811827564, 'bb_std_mult': 1.0951705576805635, 'rsi_os': 39, 'rsi_ob': 63, 'vol_spike': 0.12123456773054822, 'adx_thresh': 11.939628672910931, 'atr_min_pct': 0.01964454355271777, 'atr_max_pct': 0.12025965114374632, 'tp_mult': 2.1182468395856784, 'tsl_mult': 0.216852814450671, 'strategy': 'mean_reversion', 'time_stop': 43, 'use_sma': False, 'use_atr': True, 'use_adx': False, 'use_ema': False, 'use_spike': True, 'rsi_required': False, 'edge_k': 0.32378970650042926, 'edge_cap': 0.8347328267551333, 'bull_strategy': 'breakout', 'bull_bb_std_mult': 0.8867734755687331, 'bull_rsi_os': 32, 'bull_rsi_ob': 68, 'bull_adx_thresh': 17.414726843483702, 'bull_atr_min_pct': 0.02639340906362007, 'bull_atr_max_pct': 0.0853672786639233, 'bull_tp_mult': 1.542974999357805, 'bull_tsl_mult': 0.746844984787308, 'bull_time_stop': 192, 'bull_use_sma': False, 'bull_use_ema': True, 'bull_use_atr': True, 'bull_use_adx': False, 'bull_use_spike': True, 'bull_rsi_required': False, 'bear_strategy': 'mean_reversion', 'bear_bb_std_mult': 2.718304433064206, 'bear_rsi_os': 55, 'bear_rsi_ob': 83, 'bear_adx_thresh': 10.335994622693391, 'bear_atr_min_pct': 0.005532646659928614, 'bear_atr_max_pct': 0.134390421226407, 'bear_tp_mult': 2.563588179673092, 'bear_tsl_mult': 0.6433234639694677, 'bear_time_stop': 234, 'bear_use_sma': False, 'bear_use_ema': False, 'bear_use_atr': True, 'bear_use_adx': True, 'bear_use_spike': False, 'bear_rsi_required': False, 'sideways_strategy': 'mean_reversion', 'sideways_bb_std_mult': 2.0631500095413378, 'sideways_rsi_os': 54, 'sideways_rsi_ob': 47, 'sideways_adx_thresh': 23.225707761199654, 'sideways_atr_min_pct': 0.005423997534952827, 'sideways_atr_max_pct': 0.07471774798131708, 'sideways_tp_mult': 2.037928253885588, 'sideways_tsl_mult': 0.9919314893592659, 'sideways_time_stop': 251, 'sideways_use_sma': False, 'sideways_use_ema': False, 'sideways_use_atr': True, 'sideways_use_adx': False, 'sideways_use_spike': True, 'sideways_rsi_required': True}.
[I 2025-08-31 09:23:20,963] Trial 29 finished with values: [-1000000000.0, 1000000000.0] and parameters: {'p_sma': 14, 'p_std': 13, 'p_atr': 22, 'p_adx': 27, 'rsi_period': 49, 'ema1': 21, 'ema2': 60, 'slip_atr_k': 0.06980500239365706, 'slip_spread_k': 0.7103226223243022, 'spread_hl_frac': 0.021457729044919684, 'bb_std_mult': 1.7873352936689653, 'rsi_os': 39, 'rsi_ob': 59, 'vol_spike': 0.0010890734875866892, 'adx_thresh': 11.431726399074172, 'atr_min_pct': 0.013045920973254695, 'atr_max_pct': 0.13224926892993202, 'tp_mult': 2.013950332242399, 'tsl_mult': 0.20553714955550273, 'strategy': 'breakout', 'time_stop': 42, 'use_sma': False, 'use_atr': True, 'use_adx': False, 'use_ema': False, 'use_spike': True, 'rsi_required': False, 'edge_k': 1.2051986715277017, 'edge_cap': 0.8523908093098944, 'bull_strategy': 'breakout', 'bull_bb_std_mult': 0.8772484486107326, 'bull_rsi_os': 5, 'bull_rsi_ob': 88, 'bull_adx_thresh': 10.638424320746495, 'bull_atr_min_pct': 0.004200952962940882, 'bull_atr_max_pct': 0.12277794625459251, 'bull_tp_mult': 1.6886936246810718, 'bull_tsl_mult': 0.7906917245864179, 'bull_time_stop': 185, 'bull_use_sma': False, 'bull_use_ema': True, 'bull_use_atr': True, 'bull_use_adx': True, 'bull_use_spike': True, 'bull_rsi_required': False, 'bear_strategy': 'mean_reversion', 'bear_bb_std_mult': 0.8077770845032515, 'bear_rsi_os': 55, 'bear_rsi_ob': 53, 'bear_adx_thresh': 10.685068209785797, 'bear_atr_min_pct': 0.005182637481425936, 'bear_atr_max_pct': 0.011059541402771045, 'bear_tp_mult': 1.3513580143132138, 'bear_tsl_mult': 0.8421096503146418, 'bear_time_stop': 53, 'bear_use_sma': True, 'bear_use_ema': True, 'bear_use_atr': True, 'bear_use_adx': True, 'bear_use_spike': False, 'bear_rsi_required': False, 'sideways_strategy': 'mean_reversion', 'sideways_bb_std_mult': 2.1720129623686923, 'sideways_rsi_os': 54, 'sideways_rsi_ob': 68, 'sideways_adx_thresh': 12.966751907304904, 'sideways_atr_min_pct': 0.005251017596418087, 'sideways_atr_max_pct': 0.07426721820453398, 'sideways_tp_mult': 2.0775885446803564, 'sideways_tsl_mult': 0.3042968955497135, 'sideways_time_stop': 264, 'sideways_use_sma': False, 'sideways_use_ema': False, 'sideways_use_atr': True, 'sideways_use_adx': True, 'sideways_use_spike': True, 'sideways_rsi_required': True}.
[I 2025-08-31 09:23:21,323] Trial 30 finished with values: [-1000000000.0, 1000000000.0] and parameters: {'p_sma': 14, 'p_std': 48, 'p_atr': 27, 'p_adx': 27, 'rsi_period': 49, 'ema1': 5, 'ema2': 59, 'slip_atr_k': 0.16511382737568472, 'slip_spread_k': 0.635095640390531, 'spread_hl_frac': 0.02265591493924692, 'bb_std_mult': 1.8213106277537527, 'rsi_os': 39, 'rsi_ob': 61, 'vol_spike': 0.004071037040013076, 'adx_thresh': 10.36434957884769, 'atr_min_pct': 0.011768469100973348, 'atr_max_pct': 0.1224684868099688, 'tp_mult': 1.964865482022848, 'tsl_mult': 0.18551669983083946, 'strategy': 'breakout', 'time_stop': 39, 'use_sma': False, 'use_atr': True, 'use_adx': True, 'use_ema': False, 'use_spike': True, 'rsi_required': False, 'edge_k': 1.2639771611546364, 'edge_cap': 0.6727099828470818, 'bull_strategy': 'breakout', 'bull_bb_std_mult': 0.8231725075184089, 'bull_rsi_os': 48, 'bull_rsi_ob': 89, 'bull_adx_thresh': 10.642602366939157, 'bull_atr_min_pct': 0.002890274574193847, 'bull_atr_max_pct': 0.08396554253385194, 'bull_tp_mult': 1.2990065390083003, 'bull_tsl_mult': 0.740916897819117, 'bull_time_stop': 72, 'bull_use_sma': False, 'bull_use_ema': False, 'bull_use_atr': True, 'bull_use_adx': True, 'bull_use_spike': True, 'bull_rsi_required': False, 'bear_strategy': 'mean_reversion', 'bear_bb_std_mult': 1.0630903417102262, 'bear_rsi_os': 55, 'bear_rsi_ob': 84, 'bear_adx_thresh': 10.062779972741197, 'bear_atr_min_pct': 0.005665221160386844, 'bear_atr_max_pct': 0.07769216042049527, 'bear_tp_mult': 2.624514877813805, 'bear_tsl_mult': 0.8533806592746513, 'bear_time_stop': 242, 'bear_use_sma': True, 'bear_use_ema': True, 'bear_use_atr': True, 'bear_use_adx': True, 'bear_use_spike': False, 'bear_rsi_required': False, 'sideways_strategy': 'mean_reversion', 'sideways_bb_std_mult': 2.255708936695982, 'sideways_rsi_os': 42, 'sideways_rsi_ob': 65, 'sideways_adx_thresh': 17.632679842518517, 'sideways_atr_min_pct': 0.0053441884248812445, 'sideways_atr_max_pct': 0.0949508858384048, 'sideways_tp_mult': 2.826257926498325, 'sideways_tsl_mult': 0.2840130217700598, 'sideways_time_stop': 260, 'sideways_use_sma': False, 'sideways_use_ema': False, 'sideways_use_atr': True, 'sideways_use_adx': True, 'sideways_use_spike': True, 'sideways_rsi_required': True}.
[I 2025-08-31 09:23:21,696] Trial 34 finished with values: [-1000000000.0, 1000000000.0] and parameters: {'p_sma': 46, 'p_std': 28, 'p_atr': 20, 'p_adx': 13, 'rsi_period': 56, 'ema1': 27, 'ema2': 44, 'slip_atr_k': 0.03467301215240452, 'slip_spread_k': 0.1313063218567942, 'spread_hl_frac': 0.029459567003667215, 'bb_std_mult': 2.7101361879480796, 'rsi_os': 5, 'rsi_ob': 73, 'vol_spike': 0.09069983874081028, 'adx_thresh': 32.22405273328707, 'atr_min_pct': 0.01706888893329362, 'atr_max_pct': 0.012995625855687906, 'tp_mult': 1.5092652568507168, 'tsl_mult': 0.4608233834611079, 'strategy': 'breakout', 'time_stop': 270, 'use_sma': True, 'use_atr': False, 'use_adx': True, 'use_ema': False, 'use_spike': False, 'rsi_required': True, 'edge_k': 1.035134128754577, 'edge_cap': 0.23095763858163737, 'bull_strategy': 'mean_reversion', 'bull_bb_std_mult': 0.5696237070717891, 'bull_rsi_os': 13, 'bull_rsi_ob': 95, 'bull_adx_thresh': 7.172431930713838, 'bull_atr_min_pct': 0.011236705071055356, 'bull_atr_max_pct': 0.09664569529751874, 'bull_tp_mult': 2.46274324270264, 'bull_tsl_mult': 0.8611884621389265, 'bull_time_stop': 46, 'bull_use_sma': True, 'bull_use_ema': False, 'bull_use_atr': False, 'bull_use_adx': True, 'bull_use_spike': False, 'bull_rsi_required': True, 'bear_strategy': 'mean_reversion', 'bear_bb_std_mult': 2.0794159372718184, 'bear_rsi_os': 47, 'bear_rsi_ob': 62, 'bear_adx_thresh': 22.260855581336006, 'bear_atr_min_pct': 0.025543975242702594, 'bear_atr_max_pct': 0.14816669514446051, 'bear_tp_mult': 2.3505498801617044, 'bear_tsl_mult': 0.439195513149664, 'bear_time_stop': 137, 'bear_use_sma': True, 'bear_use_ema': True, 'bear_use_atr': False, 'bear_use_adx': False, 'bear_use_spike': True, 'bear_rsi_required': True, 'sideways_strategy': 'mean_reversion', 'sideways_bb_std_mult': 1.1808099744180744, 'sideways_rsi_os': 5, 'sideways_rsi_ob': 72, 'sideways_adx_thresh': 12.73581358584059, 'sideways_atr_min_pct': 0.0117473066928547, 'sideways_atr_max_pct': 0.012810061014040836, 'sideways_tp_mult': 2.7737336385920104, 'sideways_tsl_mult': 0.8583686415064784, 'sideways_time_stop': 176, 'sideways_use_sma': True, 'sideways_use_ema': True, 'sideways_use_atr': False, 'sideways_use_adx': True, 'sideways_use_spike': False, 'sideways_rsi_required': False}.
[I 2025-08-31 09:23:57,371] Trial 32 finished with values: [-1000000000.0, 1000000000.0] and parameters: {'p_sma': 55, 'p_std': 29, 'p_atr': 19, 'p_adx': 22, 'rsi_period': 73, 'ema1': 27, 'ema2': 42, 'slip_atr_k': 0.1550775455035803, 'slip_spread_k': 0.6150730623415986, 'spread_hl_frac': 0.02752839357416943, 'bb_std_mult': 1.700013705715373, 'rsi_os': 39, 'rsi_ob': 73, 'vol_spike': 0.026954736980575045, 'adx_thresh': 31.68103562807932, 'atr_min_pct': 0.012770065376778886, 'atr_max_pct': 0.1364212820073807, 'tp_mult': 1.9939980640706514, 'tsl_mult': 0.44588907635903485, 'strategy': 'breakout', 'time_stop': 120, 'use_sma': True, 'use_atr': False, 'use_adx': True, 'use_ema': False, 'use_spike': False, 'rsi_required': True, 'edge_k': 1.2098695450175097, 'edge_cap': 0.8687221502715818, 'bull_strategy': 'breakout', 'bull_bb_std_mult': 0.7777002098310284, 'bull_rsi_os': 10, 'bull_rsi_ob': 93, 'bull_adx_thresh': 10.818520615326657, 'bull_atr_min_pct': 0.004525722017994862, 'bull_atr_max_pct': 0.09374132016116489, 'bull_tp_mult': 1.3295516013387685, 'bull_tsl_mult': 0.8465036348113857, 'bull_time_stop': 80, 'bull_use_sma': False, 'bull_use_ema': False, 'bull_use_atr': False, 'bull_use_adx': True, 'bull_use_spike': False, 'bull_rsi_required': True, 'bear_strategy': 'mean_reversion', 'bear_bb_std_mult': 0.9382482570284172, 'bear_rsi_os': 45, 'bear_rsi_ob': 53, 'bear_adx_thresh': 10.869795221242722, 'bear_atr_min_pct': 0.011870699592040429, 'bear_atr_max_pct': 0.07961462767727888, 'bear_tp_mult': 2.360439359980098, 'bear_tsl_mult': 0.8524760356686625, 'bear_time_stop': 266, 'bear_use_sma': True, 'bear_use_ema': True, 'bear_use_atr': False, 'bear_use_adx': False, 'bear_use_spike': False, 'bear_rsi_required': True, 'sideways_strategy': 'mean_reversion', 'sideways_bb_std_mult': 2.34256172044578, 'sideways_rsi_os': 41, 'sideways_rsi_ob': 68, 'sideways_adx_thresh': 13.189368867340153, 'sideways_atr_min_pct': 0.012162936768781751, 'sideways_atr_max_pct': 0.012404667320876042, 'sideways_tp_mult': 2.7723008920363528, 'sideways_tsl_mult': 0.2921326281833163, 'sideways_time_stop': 111, 'sideways_use_sma': True, 'sideways_use_ema': False, 'sideways_use_atr': True, 'sideways_use_adx': True, 'sideways_use_spike': False, 'sideways_rsi_required': True}.
[I 2025-08-31 09:23:57,794] Trial 31 finished with values: [-1000000000.0, 1000000000.0] and parameters: {'p_sma': 15, 'p_std': 28, 'p_atr': 26, 'p_adx': 13, 'rsi_period': 48, 'ema1': 5, 'ema2': 53, 'slip_atr_k': 0.15765560062386194, 'slip_spread_k': 0.6343149266296253, 'spread_hl_frac': 0.02189274756049493, 'bb_std_mult': 1.7808047491328995, 'rsi_os': 40, 'rsi_ob': 60, 'vol_spike': 0.0010671912756934354, 'adx_thresh': 10.55234837887151, 'atr_min_pct': 0.012615003527363198, 'atr_max_pct': 0.03664177254309566, 'tp_mult': 1.9572617124556406, 'tsl_mult': 0.45354656726887865, 'strategy': 'breakout', 'time_stop': 44, 'use_sma': False, 'use_atr': False, 'use_adx': True, 'use_ema': False, 'use_spike': False, 'rsi_required': True, 'edge_k': 1.1614874480381028, 'edge_cap': 0.8668854746217254, 'bull_strategy': 'breakout', 'bull_bb_std_mult': 0.804140547010588, 'bull_rsi_os': 48, 'bull_rsi_ob': 90, 'bull_adx_thresh': 10.686088071114595, 'bull_atr_min_pct': 0.004419319203572903, 'bull_atr_max_pct': 0.08411122201651113, 'bull_tp_mult': 1.303324377826946, 'bull_tsl_mult': 0.858659838203184, 'bull_time_stop': 75, 'bull_use_sma': False, 'bull_use_ema': False, 'bull_use_atr': False, 'bull_use_adx': True, 'bull_use_spike': False, 'bull_rsi_required': False, 'bear_strategy': 'mean_reversion', 'bear_bb_std_mult': 0.9296897819164189, 'bear_rsi_os': 55, 'bear_rsi_ob': 85, 'bear_adx_thresh': 10.453142593917185, 'bear_atr_min_pct': 0.005071057193833432, 'bear_atr_max_pct': 0.07501330105400078, 'bear_tp_mult': 2.6380042104540813, 'bear_tsl_mult': 0.4381974158351159, 'bear_time_stop': 235, 'bear_use_sma': True, 'bear_use_ema': True, 'bear_use_atr': False, 'bear_use_adx': False, 'bear_use_spike': False, 'bear_rsi_required': False, 'sideways_strategy': 'mean_reversion', 'sideways_bb_std_mult': 2.356497602241179, 'sideways_rsi_os': 40, 'sideways_rsi_ob': 69, 'sideways_adx_thresh': 25.464908328764356, 'sideways_atr_min_pct': 0.011437666994016788, 'sideways_atr_max_pct': 0.010236584564736112, 'sideways_tp_mult': 2.7652465897649385, 'sideways_tsl_mult': 0.28182385403699634, 'sideways_time_stop': 104, 'sideways_use_sma': True, 'sideways_use_ema': False, 'sideways_use_atr': True, 'sideways_use_adx': True, 'sideways_use_spike': True, 'sideways_rsi_required': True}.
[I 2025-08-31 09:23:59,068] Trial 33 finished with values: [-1000000000.0, 1000000000.0] and parameters: {'p_sma': 44, 'p_std': 28, 'p_atr': 19, 'p_adx': 12, 'rsi_period': 69, 'ema1': 27, 'ema2': 42, 'slip_atr_k': 0.1608726912513006, 'slip_spread_k': 0.13235196708905922, 'spread_hl_frac': 0.02700671067402489, 'bb_std_mult': 3.259333353897775, 'rsi_os': 47, 'rsi_ob': 72, 'vol_spike': 0.09001047821945315, 'adx_thresh': 14.831716312799589, 'atr_min_pct': 0.004609449859498609, 'atr_max_pct': 0.03778629954645428, 'tp_mult': 1.9277425222524966, 'tsl_mult': 0.4386724653565996, 'strategy': 'breakout', 'time_stop': 119, 'use_sma': True, 'use_atr': False, 'use_adx': True, 'use_ema': False, 'use_spike': False, 'rsi_required': True, 'edge_k': 1.0667224396214214, 'edge_cap': 0.6396518233462676, 'bull_strategy': 'mean_reversion', 'bull_bb_std_mult': 0.7714599423392414, 'bull_rsi_os': 47, 'bull_rsi_ob': 93, 'bull_adx_thresh': 9.76078519584334, 'bull_atr_min_pct': 0.0106219504258027, 'bull_atr_max_pct': 0.09820951960656547, 'bull_tp_mult': 1.3092307942615533, 'bull_tsl_mult': 0.6495425635002553, 'bull_time_stop': 77, 'bull_use_sma': False, 'bull_use_ema': False, 'bull_use_atr': False, 'bull_use_adx': True, 'bull_use_spike': False, 'bull_rsi_required': True, 'bear_strategy': 'mean_reversion', 'bear_bb_std_mult': 2.157370127729657, 'bear_rsi_os': 34, 'bear_rsi_ob': 64, 'bear_adx_thresh': 30.849992696332215, 'bear_atr_min_pct': 0.02093847854304219, 'bear_atr_max_pct': 0.07529966676281603, 'bear_tp_mult': 2.4151450073359637, 'bear_tsl_mult': 0.13257886517987083, 'bear_time_stop': 267, 'bear_use_sma': True, 'bear_use_ema': True, 'bear_use_atr': False, 'bear_use_adx': False, 'bear_use_spike': False, 'bear_rsi_required': True, 'sideways_strategy': 'mean_reversion', 'sideways_bb_std_mult': 0.8561959908990868, 'sideways_rsi_os': 11, 'sideways_rsi_ob': 71, 'sideways_adx_thresh': 18.694885294895524, 'sideways_atr_min_pct': 0.011741958279993473, 'sideways_atr_max_pct': 0.013628054244621615, 'sideways_tp_mult': 2.7600144849323387, 'sideways_tsl_mult': 0.09937343027962348, 'sideways_time_stop': 174, 'sideways_use_sma': True, 'sideways_use_ema': True, 'sideways_use_atr': True, 'sideways_use_adx': True, 'sideways_use_spike': False, 'sideways_rsi_required': True}.
[I 2025-08-31 09:23:59,603] Trial 35 finished with values: [-1000000000.0, 1000000000.0] and parameters: {'p_sma': 56, 'p_std': 37, 'p_atr': 25, 'p_adx': 30, 'rsi_period': 70, 'ema1': 20, 'ema2': 40, 'slip_atr_k': 0.14940450240899447, 'slip_spread_k': 0.4352315760531765, 'spread_hl_frac': 0.032745644886503375, 'bb_std_mult': 0.7636057990214606, 'rsi_os': 48, 'rsi_ob': 89, 'vol_spike': 0.032189131606652516, 'adx_thresh': 8.486024634944753, 'atr_min_pct': 0.0047469091059389856, 'atr_max_pct': 0.03218314689574565, 'tp_mult': 2.3196541831872532, 'tsl_mult': 0.9946944454332469, 'strategy': 'breakout', 'time_stop': 133, 'use_sma': True, 'use_atr': False, 'use_adx': True, 'use_ema': True, 'use_spike': False, 'rsi_required': True, 'edge_k': 1.8203527415084118, 'edge_cap': 0.8063574789746759, 'bull_strategy': 'mean_reversion', 'bull_bb_std_mult': 2.406547379668618, 'bull_rsi_os': 10, 'bull_rsi_ob': 51, 'bull_adx_thresh': 6.581804956189142, 'bull_atr_min_pct': 0.005039774378025183, 'bull_atr_max_pct': 0.1475150915295569, 'bull_tp_mult': 1.2675493997751426, 'bull_tsl_mult': 0.40701468324507506, 'bull_time_stop': 87, 'bull_use_sma': False, 'bull_use_ema': True, 'bull_use_atr': False, 'bull_use_adx': False, 'bull_use_spike': False, 'bull_rsi_required': True, 'bear_strategy': 'breakout', 'bear_bb_std_mult': 3.1328674911073806, 'bear_rsi_os': 43, 'bear_rsi_ob': 63, 'bear_adx_thresh': 30.886092989296102, 'bear_atr_min_pct': 0.020676044521697752, 'bear_atr_max_pct': 0.13736505557756348, 'bear_tp_mult': 2.3500557245753084, 'bear_tsl_mult': 0.7644070896182014, 'bear_time_stop': 258, 'bear_use_sma': True, 'bear_use_ema': False, 'bear_use_atr': False, 'bear_use_adx': False, 'bear_use_spike': True, 'bear_rsi_required': True, 'sideways_strategy': 'breakout', 'sideways_bb_std_mult': 0.8730496248733481, 'sideways_rsi_os': 10, 'sideways_rsi_ob': 59, 'sideways_adx_thresh': 30.875808722407342, 'sideways_atr_min_pct': 0.014717544316012765, 'sideways_atr_max_pct': 0.10316252522555823, 'sideways_tp_mult': 2.3819715275774906, 'sideways_tsl_mult': 0.10896743523629371, 'sideways_time_stop': 210, 'sideways_use_sma': True, 'sideways_use_ema': True, 'sideways_use_atr': False, 'sideways_use_adx': False, 'sideways_use_spike': False, 'sideways_rsi_required': True}.
