[I 2025-08-31 10:33:23,251] Trial 576 finished with values: [-1000000000.0, 1000000000.0] and parameters: {'p_sma': 11, 'p_std': 49, 'p_atr': 29, 'p_adx': 8, 'rsi_period': 63, 'ema1': 17, 'ema2': 38, 'slip_atr_k': 0.17975467176953203, 'slip_spread_k': 0.10609721214369518, 'spread_hl_frac': 0.029822250402796586, 'bb_std_mult': 1.4792701811172297, 'rsi_os': 39, 'rsi_ob': 82, 'vol_spike': 0.2998185327209574, 'adx_thresh': 25.301126983984695, 'atr_min_pct': 0.011205187402555937, 'atr_max_pct': 0.015899488308751583, 'tp_mult': 2.8471630198052824, 'tsl_mult': 0.049599071767441626, 'strategy': 'breakout', 'time_stop': 238, 'use_sma': False, 'use_atr': False, 'use_adx': False, 'use_ema': True, 'use_spike': False, 'rsi_required': True, 'edge_k': 1.60699520997949, 'edge_cap': 0.17338393641929437, 'bull_strategy': 'mean_reversion', 'bull_bb_std_mult': 2.162935953192106, 'bull_rsi_os': 26, 'bull_rsi_ob': 63, 'bull_adx_thresh': 22.13986638524296, 'bull_atr_min_pct': 0.0059667753688009695, 'bull_atr_max_pct': 0.09460783365777391, 'bull_tp_mult': 2.2396053575287316, 'bull_tsl_mult': 0.9647331612468064, 'bull_time_stop': 63, 'bull_use_sma': True, 'bull_use_ema': False, 'bull_use_atr': False, 'bull_use_adx': False, 'bull_use_spike': True, 'bull_rsi_required': False, 'bear_strategy': 'breakout', 'bear_bb_std_mult': 3.008282815505959, 'bear_rsi_os': 26, 'bear_rsi_ob': 81, 'bear_adx_thresh': 11.823119928669945, 'bear_atr_min_pct': 0.007400072780843986, 'bear_atr_max_pct': 0.052875346339574386, 'bear_tp_mult': 1.8728179724448855, 'bear_tsl_mult': 0.45951966937528743, 'bear_time_stop': 275, 'bear_use_sma': False, 'bear_use_ema': True, 'bear_use_atr': False, 'bear_use_adx': True, 'bear_use_spike': True, 'bear_rsi_required': True, 'sideways_strategy': 'breakout', 'sideways_bb_std_mult': 1.0066549104619984, 'sideways_rsi_os': 20, 'sideways_rsi_ob': 90, 'sideways_adx_thresh': 28.695439860058332, 'sideways_atr_min_pct': 0.02167379790303631, 'sideways_atr_max_pct': 0.10983791583620632, 'sideways_tp_mult': 2.9143888646767797, 'sideways_tsl_mult': 0.1004552412284402, 'sideways_time_stop': 271, 'sideways_use_sma': True, 'sideways_use_ema': True, 'sideways_use_atr': True, 'sideways_use_adx': False, 'sideways_use_spike': True, 'sideways_rsi_required': False}.
[I 2025-08-31 10:33:56,117] Trial 579 finished with values: [-1000000000.0, 1000000000.0] and parameters: {'p_sma': 15, 'p_std': 48, 'p_atr': 30, 'p_adx': 8, 'rsi_period': 25, 'ema1': 18, 'ema2': 34, 'slip_atr_k': 0.09076774027450396, 'slip_spread_k': 0.10637613579810747, 'spread_hl_frac': 0.030214231153834297, 'bb_std_mult': 2.427906004489215, 'rsi_os': 37, 'rsi_ob': 84, 'vol_spike': 0.28021132572302443, 'adx_thresh': 23.64790276485745, 'atr_min_pct': 0.011417871932748428, 'atr_max_pct': 0.12439434632386523, 'tp_mult': 2.3460478493806867, 'tsl_mult': 0.6980558144778507, 'strategy': 'mean_reversion', 'time_stop': 239, 'use_sma': False, 'use_atr': True, 'use_adx': False, 'use_ema': True, 'use_spike': True, 'rsi_required': False, 'edge_k': 1.865048829496745, 'edge_cap': 0.17802482637946518, 'bull_strategy': 'mean_reversion', 'bull_bb_std_mult': 0.9806332623587115, 'bull_rsi_os': 40, 'bull_rsi_ob': 68, 'bull_adx_thresh': 18.429011771704385, 'bull_atr_min_pct': 0.0071119960589037315, 'bull_atr_max_pct': 0.10014118171425616, 'bull_tp_mult': 2.2898531408906564, 'bull_tsl_mult': 0.9986922957845829, 'bull_time_stop': 77, 'bull_use_sma': True, 'bull_use_ema': True, 'bull_use_atr': False, 'bull_use_adx': True, 'bull_use_spike': True, 'bull_rsi_required': True, 'bear_strategy': 'mean_reversion', 'bear_bb_std_mult': 0.9959080601682291, 'bear_rsi_os': 32, 'bear_rsi_ob': 80, 'bear_adx_thresh': 25.663246830472573, 'bear_atr_min_pct': 0.00841289159003383, 'bear_atr_max_pct': 0.1081698407171563, 'bear_tp_mult': 2.0138590881520018, 'bear_tsl_mult': 0.3828125478637682, 'bear_time_stop': 65, 'bear_use_sma': False, 'bear_use_ema': True, 'bear_use_atr': True, 'bear_use_adx': True, 'bear_use_spike': True, 'bear_rsi_required': False, 'sideways_strategy': 'mean_reversion', 'sideways_bb_std_mult': 1.0145709708412378, 'sideways_rsi_os': 18, 'sideways_rsi_ob': 92, 'sideways_adx_thresh': 29.689864537331285, 'sideways_atr_min_pct': 0.019650444049952295, 'sideways_atr_max_pct': 0.09239452170395031, 'sideways_tp_mult': 2.894769271068009, 'sideways_tsl_mult': 0.000482018572384349, 'sideways_time_stop': 237, 'sideways_use_sma': False, 'sideways_use_ema': False, 'sideways_use_atr': True, 'sideways_use_adx': True, 'sideways_use_spike': True, 'sideways_rsi_required': True}.
[I 2025-08-31 10:33:56,180] Trial 580 finished with values: [-1000000000.0, 1000000000.0] and parameters: {'p_sma': 5, 'p_std': 26, 'p_atr': 30, 'p_adx': 9, 'rsi_period': 25, 'ema1': 8, 'ema2': 40, 'slip_atr_k': 0.23148911705942504, 'slip_spread_k': 0.0906364660560557, 'spread_hl_frac': 0.004571624608764653, 'bb_std_mult': 1.1073762725443939, 'rsi_os': 37, 'rsi_ob': 84, 'vol_spike': 0.28014495534704037, 'adx_thresh': 23.611100047796832, 'atr_min_pct': 0.011391972366754708, 'atr_max_pct': 0.1221736495344853, 'tp_mult': 1.7847231550765548, 'tsl_mult': 0.5053055552892598, 'strategy': 'mean_reversion', 'time_stop': 66, 'use_sma': False, 'use_atr': True, 'use_adx': True, 'use_ema': True, 'use_spike': True, 'rsi_required': False, 'edge_k': 0.5871052947905413, 'edge_cap': 0.11104829134991497, 'bull_strategy': 'mean_reversion', 'bull_bb_std_mult': 0.9369557070602242, 'bull_rsi_os': 8, 'bull_rsi_ob': 77, 'bull_adx_thresh': 29.935742655209893, 'bull_atr_min_pct': 0.007386904590436604, 'bull_atr_max_pct': 0.07434700514406971, 'bull_tp_mult': 2.290773620185559, 'bull_tsl_mult': 0.977793711356385, 'bull_time_stop': 77, 'bull_use_sma': True, 'bull_use_ema': True, 'bull_use_atr': False, 'bull_use_adx': True, 'bull_use_spike': False, 'bull_rsi_required': True, 'bear_strategy': 'mean_reversion', 'bear_bb_std_mult': 2.2814624901441647, 'bear_rsi_os': 29, 'bear_rsi_ob': 79, 'bear_adx_thresh': 29.610280199660096, 'bear_atr_min_pct': 0.008412577196490929, 'bear_atr_max_pct': 0.11102694056002275, 'bear_tp_mult': 1.9939553183128875, 'bear_tsl_mult': 0.39796866044050794, 'bear_time_stop': 264, 'bear_use_sma': False, 'bear_use_ema': False, 'bear_use_atr': True, 'bear_use_adx': True, 'bear_use_spike': True, 'bear_rsi_required': False, 'sideways_strategy': 'mean_reversion', 'sideways_bb_std_mult': 2.0281648610565584, 'sideways_rsi_os': 24, 'sideways_rsi_ob': 95, 'sideways_adx_thresh': 23.045661782910944, 'sideways_atr_min_pct': 0.0010256344040575332, 'sideways_atr_max_pct': 0.09643319121483311, 'sideways_tp_mult': 2.867663362479477, 'sideways_tsl_mult': 0.5658994821883718, 'sideways_time_stop': 68, 'sideways_use_sma': False, 'sideways_use_ema': False, 'sideways_use_atr': False, 'sideways_use_adx': True, 'sideways_use_spike': True, 'sideways_rsi_required': True}.
[I 2025-08-31 10:33:56,593] Trial 577 finished with values: [-1000000000.0, 1000000000.0] and parameters: {'p_sma': 11, 'p_std': 49, 'p_atr': 25, 'p_adx': 8, 'rsi_period': 22, 'ema1': 18, 'ema2': 20, 'slip_atr_k': 0.19657284714250223, 'slip_spread_k': 0.10317070573086158, 'spread_hl_frac': 0.007912133034335734, 'bb_std_mult': 1.5811558612527687, 'rsi_os': 36, 'rsi_ob': 81, 'vol_spike': 0.2813178286247933, 'adx_thresh': 23.79781872426329, 'atr_min_pct': 0.011120695624502108, 'atr_max_pct': 0.015236065327821069, 'tp_mult': 1.7793449050332824, 'tsl_mult': 0.5086062317227884, 'strategy': 'breakout', 'time_stop': 131, 'use_sma': False, 'use_atr': True, 'use_adx': False, 'use_ema': True, 'use_spike': True, 'rsi_required': False, 'edge_k': 1.9575706468910898, 'edge_cap': 0.1729972265911019, 'bull_strategy': 'mean_reversion', 'bull_bb_std_mult': 2.7368075966900958, 'bull_rsi_os': 26, 'bull_rsi_ob': 77, 'bull_adx_thresh': 28.259453235396187, 'bull_atr_min_pct': 0.007161535800265759, 'bull_atr_max_pct': 0.09032122774818517, 'bull_tp_mult': 2.23120865312072, 'bull_tsl_mult': 0.9971914870584454, 'bull_time_stop': 78, 'bull_use_sma': True, 'bull_use_ema': True, 'bull_use_atr': False, 'bull_use_adx': False, 'bull_use_spike': True, 'bull_rsi_required': False, 'bear_strategy': 'breakout', 'bear_bb_std_mult': 2.9780173583517016, 'bear_rsi_os': 27, 'bear_rsi_ob': 81, 'bear_adx_thresh': 11.871271637853988, 'bear_atr_min_pct': 0.007011284710050801, 'bear_atr_max_pct': 0.10913822815293281, 'bear_tp_mult': 1.996753381653791, 'bear_tsl_mult': 0.45546337693727723, 'bear_time_stop': 265, 'bear_use_sma': False, 'bear_use_ema': True, 'bear_use_atr': False, 'bear_use_adx': True, 'bear_use_spike': True, 'bear_rsi_required': False, 'sideways_strategy': 'breakout', 'sideways_bb_std_mult': 2.0573622632769397, 'sideways_rsi_os': 24, 'sideways_rsi_ob': 90, 'sideways_adx_thresh': 29.862078152124784, 'sideways_atr_min_pct': 0.021373605216997354, 'sideways_atr_max_pct': 0.09660444411717216, 'sideways_tp_mult': 2.920130853020942, 'sideways_tsl_mult': 0.8014056299472938, 'sideways_time_stop': 235, 'sideways_use_sma': True, 'sideways_use_ema': True, 'sideways_use_atr': True, 'sideways_use_adx': False, 'sideways_use_spike': True, 'sideways_rsi_required': False}.
[I 2025-08-31 10:33:57,102] Trial 578 finished with values: [-1000000000.0, 1000000000.0] and parameters: {'p_sma': 10, 'p_std': 49, 'p_atr': 30, 'p_adx': 12, 'rsi_period': 25, 'ema1': 14, 'ema2': 38, 'slip_atr_k': 0.23175616974599333, 'slip_spread_k': 0.10055170327775015, 'spread_hl_frac': 0.006837316554618099, 'bb_std_mult': 1.6089342725777624, 'rsi_os': 37, 'rsi_ob': 84, 'vol_spike': 0.28047707523610504, 'adx_thresh': 23.768403835053746, 'atr_min_pct': 0.011257347776710053, 'atr_max_pct': 0.04492801562020518, 'tp_mult': 1.7572345339480577, 'tsl_mult': 0.09311610511201196, 'strategy': 'mean_reversion', 'time_stop': 129, 'use_sma': False, 'use_atr': True, 'use_adx': False, 'use_ema': True, 'use_spike': True, 'rsi_required': False, 'edge_k': 1.9753957451605153, 'edge_cap': 0.169547059802888, 'bull_strategy': 'mean_reversion', 'bull_bb_std_mult': 2.738999590152094, 'bull_rsi_os': 26, 'bull_rsi_ob': 68, 'bull_adx_thresh': 18.5893592637419, 'bull_atr_min_pct': 0.007191061317102368, 'bull_atr_max_pct': 0.09748929197514737, 'bull_tp_mult': 2.236710816366564, 'bull_tsl_mult': 0.9638717839872271, 'bull_time_stop': 84, 'bull_use_sma': True, 'bull_use_ema': True, 'bull_use_atr': False, 'bull_use_adx': False, 'bull_use_spike': True, 'bull_rsi_required': True, 'bear_strategy': 'mean_reversion', 'bear_bb_std_mult': 3.3639016887750524, 'bear_rsi_os': 27, 'bear_rsi_ob': 60, 'bear_adx_thresh': 22.011085578574118, 'bear_atr_min_pct': 0.007084818594757057, 'bear_atr_max_pct': 0.10940808497093912, 'bear_tp_mult': 1.9958769617818428, 'bear_tsl_mult': 0.39001892527200277, 'bear_time_stop': 65, 'bear_use_sma': False, 'bear_use_ema': True, 'bear_use_atr': False, 'bear_use_adx': True, 'bear_use_spike': True, 'bear_rsi_required': False, 'sideways_strategy': 'mean_reversion', 'sideways_bb_std_mult': 3.1847616551161098, 'sideways_rsi_os': 23, 'sideways_rsi_ob': 92, 'sideways_adx_thresh': 29.55608893612431, 'sideways_atr_min_pct': 0.0011091800769874743, 'sideways_atr_max_pct': 0.09579705064011429, 'sideways_tp_mult': 2.873434113425897, 'sideways_tsl_mult': 0.7746787619578644, 'sideways_time_stop': 67, 'sideways_use_sma': True, 'sideways_use_ema': True, 'sideways_use_atr': True, 'sideways_use_adx': False, 'sideways_use_spike': True, 'sideways_rsi_required': True}.
[I 2025-08-31 10:34:30,631] Trial 584 finished with values: [-1000000000.0, 1000000000.0] and parameters: {'p_sma': 8, 'p_std': 47, 'p_atr': 28, 'p_adx': 28, 'rsi_period': 27, 'ema1': 18, 'ema2': 51, 'slip_atr_k': 0.10801791279707729, 'slip_spread_k': 0.9688348623940548, 'spread_hl_frac': 0.02774659953680789, 'bb_std_mult': 1.1098133327795794, 'rsi_os': 43, 'rsi_ob': 68, 'vol_spike': 0.28922523600443795, 'adx_thresh': 24.493097995291393, 'atr_min_pct': 0.0008302162950494275, 'atr_max_pct': 0.12075062915962427, 'tp_mult': 2.968450221055718, 'tsl_mult': 0.46568951633976774, 'strategy': 'breakout', 'time_stop': 168, 'use_sma': True, 'use_atr': False, 'use_adx': True, 'use_ema': True, 'use_spike': False, 'rsi_required': True, 'edge_k': 1.429182803794497, 'edge_cap': 0.1393091458483091, 'bull_strategy': 'breakout', 'bull_bb_std_mult': 1.1137924229230494, 'bull_rsi_os': 50, 'bull_rsi_ob': 65, 'bull_adx_thresh': 25.9840824243278, 'bull_atr_min_pct': 0.00847122973042337, 'bull_atr_max_pct': 0.08684768129965816, 'bull_tp_mult': 2.1229507058699397, 'bull_tsl_mult': 0.9427828139453971, 'bull_time_stop': 145, 'bull_use_sma': False, 'bull_use_ema': False, 'bull_use_atr': True, 'bull_use_adx': False, 'bull_use_spike': False, 'bull_rsi_required': True, 'bear_strategy': 'breakout', 'bear_bb_std_mult': 2.4254216690588373, 'bear_rsi_os': 30, 'bear_rsi_ob': 59, 'bear_adx_thresh': 13.74068624239068, 'bear_atr_min_pct': 0.006540405544977149, 'bear_atr_max_pct': 0.04654742388308601, 'bear_tp_mult': 2.1287231176114405, 'bear_tsl_mult': 0.0326465234552612, 'bear_time_stop': 162, 'bear_use_sma': True, 'bear_use_ema': False, 'bear_use_atr': False, 'bear_use_adx': False, 'bear_use_spike': True, 'bear_rsi_required': True, 'sideways_strategy': 'breakout', 'sideways_bb_std_mult': 2.2378224535380005, 'sideways_rsi_os': 26, 'sideways_rsi_ob': 93, 'sideways_adx_thresh': 27.473814172679614, 'sideways_atr_min_pct': 0.0021243094128053884, 'sideways_atr_max_pct': 0.11303986092603234, 'sideways_tp_mult': 2.8307458907460017, 'sideways_tsl_mult': 0.33930369808594285, 'sideways_time_stop': 21, 'sideways_use_sma': True, 'sideways_use_ema': True, 'sideways_use_atr': False, 'sideways_use_adx': False, 'sideways_use_spike': True, 'sideways_rsi_required': False}.
[I 2025-08-31 10:34:31,226] Trial 581 finished with values: [-1000000000.0, 1000000000.0] and parameters: {'p_sma': 9, 'p_std': 52, 'p_atr': 28, 'p_adx': 7, 'rsi_period': 69, 'ema1': 14, 'ema2': 37, 'slip_atr_k': 0.19544709640770652, 'slip_spread_k': 0.6611325834403227, 'spread_hl_frac': 0.011268547594913421, 'bb_std_mult': 1.5977779792166706, 'rsi_os': 41, 'rsi_ob': 70, 'vol_spike': 0.28775373052568815, 'adx_thresh': 26.40406456029395, 'atr_min_pct': 0.0037177060818695783, 'atr_max_pct': 0.12734944051463792, 'tp_mult': 2.9151899698129617, 'tsl_mult': 0.12141245707034375, 'strategy': 'breakout', 'time_stop': 136, 'use_sma': False, 'use_atr': False, 'use_adx': False, 'use_ema': True, 'use_spike': False, 'rsi_required': True, 'edge_k': 1.3289940966870886, 'edge_cap': 0.13576296836471155, 'bull_strategy': 'mean_reversion', 'bull_bb_std_mult': 2.571200877892905, 'bull_rsi_os': 28, 'bull_rsi_ob': 66, 'bull_adx_thresh': 31.28885793661127, 'bull_atr_min_pct': 0.008423146315353357, 'bull_atr_max_pct': 0.09091096904897407, 'bull_tp_mult': 2.20817557398435, 'bull_tsl_mult': 0.9400675604884423, 'bull_time_stop': 23, 'bull_use_sma': False, 'bull_use_ema': False, 'bull_use_atr': False, 'bull_use_adx': False, 'bull_use_spike': False, 'bull_rsi_required': True, 'bear_strategy': 'breakout', 'bear_bb_std_mult': 1.8156697241703315, 'bear_rsi_os': 27, 'bear_rsi_ob': 79, 'bear_adx_thresh': 22.467640245214422, 'bear_atr_min_pct': 0.006390765393257947, 'bear_atr_max_pct': 0.10332546438606265, 'bear_tp_mult': 1.9354900647468019, 'bear_tsl_mult': 0.4293213016096173, 'bear_time_stop': 268, 'bear_use_sma': True, 'bear_use_ema': True, 'bear_use_atr': False, 'bear_use_adx': False, 'bear_use_spike': True, 'bear_rsi_required': True, 'sideways_strategy': 'breakout', 'sideways_bb_std_mult': 0.8929150602492794, 'sideways_rsi_os': 44, 'sideways_rsi_ob': 93, 'sideways_adx_thresh': 31.149709491529766, 'sideways_atr_min_pct': 0.012109922735908876, 'sideways_atr_max_pct': 0.09126616964865822, 'sideways_tp_mult': 2.851092901534266, 'sideways_tsl_mult': 0.06235234319452775, 'sideways_time_stop': 243, 'sideways_use_sma': True, 'sideways_use_ema': True, 'sideways_use_atr': False, 'sideways_use_adx': False, 'sideways_use_spike': True, 'sideways_rsi_required': False}.
[I 2025-08-31 10:34:31,239] Trial 583 finished with values: [-1000000000.0, 1000000000.0] and parameters: {'p_sma': 23, 'p_std': 47, 'p_atr': 28, 'p_adx': 7, 'rsi_period': 27, 'ema1': 18, 'ema2': 37, 'slip_atr_k': 0.19205083681584037, 'slip_spread_k': 0.15093831521164297, 'spread_hl_frac': 0.008732433970586474, 'bb_std_mult': 3.1048010901049796, 'rsi_os': 41, 'rsi_ob': 83, 'vol_spike': 0.28945548502328905, 'adx_thresh': 26.69008079255726, 'atr_min_pct': 0.004045370848159244, 'atr_max_pct': 0.09459555848757109, 'tp_mult': 2.9166177992089777, 'tsl_mult': 0.08745265733462221, 'strategy': 'breakout', 'time_stop': 137, 'use_sma': False, 'use_atr': False, 'use_adx': False, 'use_ema': True, 'use_spike': False, 'rsi_required': True, 'edge_k': 1.8776294424434463, 'edge_cap': 0.5203168912870392, 'bull_strategy': 'mean_reversion', 'bull_bb_std_mult': 3.3137431343956747, 'bull_rsi_os': 28, 'bull_rsi_ob': 58, 'bull_adx_thresh': 31.29071448874881, 'bull_atr_min_pct': 0.010338586974101598, 'bull_atr_max_pct': 0.0493631469835424, 'bull_tp_mult': 2.1171525299431764, 'bull_tsl_mult': 0.9494206218412815, 'bull_time_stop': 84, 'bull_use_sma': False, 'bull_use_ema': False, 'bull_use_atr': True, 'bull_use_adx': False, 'bull_use_spike': False, 'bull_rsi_required': True, 'bear_strategy': 'breakout', 'bear_bb_std_mult': 3.3534118592231277, 'bear_rsi_os': 28, 'bear_rsi_ob': 79, 'bear_adx_thresh': 22.26120316314385, 'bear_atr_min_pct': 0.006405123811573005, 'bear_atr_max_pct': 0.10412630306150983, 'bear_tp_mult': 1.918441139502795, 'bear_tsl_mult': 0.03165559403403789, 'bear_time_stop': 35, 'bear_use_sma': True, 'bear_use_ema': False, 'bear_use_atr': False, 'bear_use_adx': False, 'bear_use_spike': True, 'bear_rsi_required': True, 'sideways_strategy': 'breakout', 'sideways_bb_std_mult': 0.8739222743924838, 'sideways_rsi_os': 26, 'sideways_rsi_ob': 93, 'sideways_adx_thresh': 27.696675629899033, 'sideways_atr_min_pct': 0.012188515170918858, 'sideways_atr_max_pct': 0.1166306220604007, 'sideways_tp_mult': 2.830114707321259, 'sideways_tsl_mult': 0.0639949306357269, 'sideways_time_stop': 242, 'sideways_use_sma': True, 'sideways_use_ema': True, 'sideways_use_atr': False, 'sideways_use_adx': False, 'sideways_use_spike': True, 'sideways_rsi_required': False}.
[I 2025-08-31 10:34:31,355] Trial 582 finished with values: [-1000000000.0, 1000000000.0] and parameters: {'p_sma': 32, 'p_std': 52, 'p_atr': 28, 'p_adx': 16, 'rsi_period': 22, 'ema1': 14, 'ema2': 51, 'slip_atr_k': 0.1977301407239761, 'slip_spread_k': 0.1441507576444521, 'spread_hl_frac': 0.008841358827985037, 'bb_std_mult': 1.1465356950711603, 'rsi_os': 41, 'rsi_ob': 68, 'vol_spike': 0.2905233702471309, 'adx_thresh': 24.583824595537493, 'atr_min_pct': 0.012260443817593449, 'atr_max_pct': 0.021871927004106825, 'tp_mult': 2.998950169532933, 'tsl_mult': 0.09874511233843318, 'strategy': 'breakout', 'time_stop': 137, 'use_sma': False, 'use_atr': False, 'use_adx': False, 'use_ema': True, 'use_spike': False, 'rsi_required': True, 'edge_k': 1.4442462112529173, 'edge_cap': 0.1324198413199544, 'bull_strategy': 'mean_reversion', 'bull_bb_std_mult': 1.082038723143755, 'bull_rsi_os': 28, 'bull_rsi_ob': 66, 'bull_adx_thresh': 26.032203591551372, 'bull_atr_min_pct': 0.008521444837448716, 'bull_atr_max_pct': 0.09037017242296813, 'bull_tp_mult': 2.219364554972288, 'bull_tsl_mult': 0.9440920921653124, 'bull_time_stop': 107, 'bull_use_sma': False, 'bull_use_ema': False, 'bull_use_atr': False, 'bull_use_adx': False, 'bull_use_spike': False, 'bull_rsi_required': True, 'bear_strategy': 'breakout', 'bear_bb_std_mult': 2.8373868546800556, 'bear_rsi_os': 30, 'bear_rsi_ob': 45, 'bear_adx_thresh': 22.298488774231984, 'bear_atr_min_pct': 0.006648295825360065, 'bear_atr_max_pct': 0.11096313288036885, 'bear_tp_mult': 1.9250231288680983, 'bear_tsl_mult': 0.19541948739646753, 'bear_time_stop': 214, 'bear_use_sma': True, 'bear_use_ema': True, 'bear_use_atr': False, 'bear_use_adx': False, 'bear_use_spike': True, 'bear_rsi_required': True, 'sideways_strategy': 'breakout', 'sideways_bb_std_mult': 2.2363505431869988, 'sideways_rsi_os': 24, 'sideways_rsi_ob': 93, 'sideways_adx_thresh': 31.07122051073049, 'sideways_atr_min_pct': 0.006782665693918605, 'sideways_atr_max_pct': 0.10133572584382484, 'sideways_tp_mult': 2.841149097464868, 'sideways_tsl_mult': 0.0636363485181865, 'sideways_time_stop': 244, 'sideways_use_sma': True, 'sideways_use_ema': True, 'sideways_use_atr': False, 'sideways_use_adx': False, 'sideways_use_spike': True, 'sideways_rsi_required': False}.
