[I 2025-08-31 10:51:50,235] Trial 708 finished with values: [-1000000000.0, 1000000000.0] and parameters: {'p_sma': 35, 'p_std': 51, 'p_atr': 30, 'p_adx': 22, 'rsi_period': 22, 'ema1': 25, 'ema2': 39, 'slip_atr_k': 0.189963958055733, 'slip_spread_k': 0.09094171959299817, 'spread_hl_frac': 0.011005212120484087, 'bb_std_mult': 1.1745505238732408, 'rsi_os': 39, 'rsi_ob': 69, 'vol_spike': 0.29324211968689906, 'adx_thresh': 27.255218166477988, 'atr_min_pct': 0.029338525358846294, 'atr_max_pct': 0.1187342817276182, 'tp_mult': 2.665440142405369, 'tsl_mult': 0.07233381177365975, 'strategy': 'breakout', 'time_stop': 131, 'use_sma': False, 'use_atr': False, 'use_adx': True, 'use_ema': True, 'use_spike': False, 'rsi_required': False, 'edge_k': 0.5230818840192928, 'edge_cap': 0.10883120674581619, 'bull_strategy': 'mean_reversion', 'bull_bb_std_mult': 1.1957302207749103, 'bull_rsi_os': 29, 'bull_rsi_ob': 62, 'bull_adx_thresh': 8.30198781278402, 'bull_atr_min_pct': 0.010805782950218664, 'bull_atr_max_pct': 0.027244649311999672, 'bull_tp_mult': 2.413640560584176, 'bull_tsl_mult': 0.27518812419547023, 'bull_time_stop': 104, 'bull_use_sma': False, 'bull_use_ema': False, 'bull_use_atr': False, 'bull_use_adx': False, 'bull_use_spike': True, 'bull_rsi_required': True, 'bear_strategy': 'breakout', 'bear_bb_std_mult': 1.2798376519338432, 'bear_rsi_os': 43, 'bear_rsi_ob': 82, 'bear_adx_thresh': 34.27470378889162, 'bear_atr_min_pct': 0.01842005320233844, 'bear_atr_max_pct': 0.092289503273339, 'bear_tp_mult': 1.9578128596617923, 'bear_tsl_mult': 0.5072682736267055, 'bear_time_stop': 209, 'bear_use_sma': False, 'bear_use_ema': False, 'bear_use_atr': False, 'bear_use_adx': True, 'bear_use_spike': True, 'bear_rsi_required': True, 'sideways_strategy': 'breakout', 'sideways_bb_std_mult': 2.0332291310407746, 'sideways_rsi_os': 22, 'sideways_rsi_ob': 95, 'sideways_adx_thresh': 28.483029918606118, 'sideways_atr_min_pct': 0.0018402907470856308, 'sideways_atr_max_pct': 0.09585260101774268, 'sideways_tp_mult': 2.9200765181251875, 'sideways_tsl_mult': 0.0379947398581274, 'sideways_time_stop': 300, 'sideways_use_sma': True, 'sideways_use_ema': True, 'sideways_use_atr': True, 'sideways_use_adx': True, 'sideways_use_spike': True, 'sideways_rsi_required': False}.
[I 2025-08-31 10:52:22,945] Trial 715 finished with values: [-1000000000.0, 1000000000.0] and parameters: {'p_sma': 58, 'p_std': 49, 'p_atr': 9, 'p_adx': 9, 'rsi_period': 19, 'ema1': 18, 'ema2': 59, 'slip_atr_k': 0.17903453462677923, 'slip_spread_k': 0.07122285600928431, 'spread_hl_frac': 0.012725750149105467, 'bb_std_mult': 1.2899848538377967, 'rsi_os': 41, 'rsi_ob': 84, 'vol_spike': 0.014432781657690796, 'adx_thresh': 23.63381760304489, 'atr_min_pct': 0.012771781008157498, 'atr_max_pct': 0.11946691130412765, 'tp_mult': 2.0140574493018795, 'tsl_mult': 0.5871111652770687, 'strategy': 'breakout', 'time_stop': 279, 'use_sma': False, 'use_atr': False, 'use_adx': False, 'use_ema': True, 'use_spike': True, 'rsi_required': True, 'edge_k': 1.291190634078117, 'edge_cap': 0.7228408467537497, 'bull_strategy': 'mean_reversion', 'bull_bb_std_mult': 2.2042470769529814, 'bull_rsi_os': 27, 'bull_rsi_ob': 70, 'bull_adx_thresh': 34.26062266828444, 'bull_atr_min_pct': 0.02181056111341356, 'bull_atr_max_pct': 0.08448799376333205, 'bull_tp_mult': 2.1545120975856826, 'bull_tsl_mult': 0.9183959802465779, 'bull_time_stop': 66, 'bull_use_sma': True, 'bull_use_ema': False, 'bull_use_atr': False, 'bull_use_adx': False, 'bull_use_spike': False, 'bull_rsi_required': True, 'bear_strategy': 'breakout', 'bear_bb_std_mult': 2.974282767811365, 'bear_rsi_os': 28, 'bear_rsi_ob': 47, 'bear_adx_thresh': 20.835749352769927, 'bear_atr_min_pct': 0.006991654035120756, 'bear_atr_max_pct': 0.10603689054941914, 'bear_tp_mult': 1.4820788290939877, 'bear_tsl_mult': 0.4857540734764305, 'bear_time_stop': 227, 'bear_use_sma': False, 'bear_use_ema': True, 'bear_use_atr': True, 'bear_use_adx': True, 'bear_use_spike': True, 'bear_rsi_required': True, 'sideways_strategy': 'breakout', 'sideways_bb_std_mult': 0.8087331768482073, 'sideways_rsi_os': 8, 'sideways_rsi_ob': 93, 'sideways_adx_thresh': 29.45579269213852, 'sideways_atr_min_pct': 0.00285905056274844, 'sideways_atr_max_pct': 0.043287512885521996, 'sideways_tp_mult': 2.6509798996171448, 'sideways_tsl_mult': 0.09695948029483857, 'sideways_time_stop': 226, 'sideways_use_sma': False, 'sideways_use_ema': True, 'sideways_use_atr': False, 'sideways_use_adx': False, 'sideways_use_spike': True, 'sideways_rsi_required': False}.
[I 2025-08-31 10:52:23,065] Trial 713 finished with values: [-1000000000.0, 1000000000.0] and parameters: {'p_sma': 58, 'p_std': 44, 'p_atr': 28, 'p_adx': 9, 'rsi_period': 76, 'ema1': 18, 'ema2': 41, 'slip_atr_k': 0.18903863396726145, 'slip_spread_k': 0.06543453850391219, 'spread_hl_frac': 0.012426253248512834, 'bb_std_mult': 1.1899538192437185, 'rsi_os': 41, 'rsi_ob': 70, 'vol_spike': 0.2916285992103639, 'adx_thresh': 20.83308848868972, 'atr_min_pct': 0.023931242397512376, 'atr_max_pct': 0.03497630960128267, 'tp_mult': 1.1697248646635006, 'tsl_mult': 0.09841966792353217, 'strategy': 'breakout', 'time_stop': 281, 'use_sma': False, 'use_atr': True, 'use_adx': False, 'use_ema': True, 'use_spike': False, 'rsi_required': True, 'edge_k': 0.05350269806357233, 'edge_cap': 0.7011685895116768, 'bull_strategy': 'mean_reversion', 'bull_bb_std_mult': 1.1933677798587663, 'bull_rsi_os': 29, 'bull_rsi_ob': 65, 'bull_adx_thresh': 30.02083922307578, 'bull_atr_min_pct': 0.02380965689524356, 'bull_atr_max_pct': 0.04133874464516397, 'bull_tp_mult': 2.057268863708573, 'bull_tsl_mult': 0.9186500300685979, 'bull_time_stop': 119, 'bull_use_sma': True, 'bull_use_ema': False, 'bull_use_atr': False, 'bull_use_adx': False, 'bull_use_spike': False, 'bull_rsi_required': False, 'bear_strategy': 'breakout', 'bear_bb_std_mult': 3.282789032530638, 'bear_rsi_os': 28, 'bear_rsi_ob': 79, 'bear_adx_thresh': 20.86045765540851, 'bear_atr_min_pct': 0.007481791984502727, 'bear_atr_max_pct': 0.1056430022313662, 'bear_tp_mult': 1.9469852077272123, 'bear_tsl_mult': 0.4797326024635623, 'bear_time_stop': 134, 'bear_use_sma': False, 'bear_use_ema': True, 'bear_use_atr': False, 'bear_use_adx': True, 'bear_use_spike': True, 'bear_rsi_required': False, 'sideways_strategy': 'mean_reversion', 'sideways_bb_std_mult': 0.8058385515370017, 'sideways_rsi_os': 50, 'sideways_rsi_ob': 78, 'sideways_adx_thresh': 31.2538977370776, 'sideways_atr_min_pct': 0.0030992921681368855, 'sideways_atr_max_pct': 0.07322599060105987, 'sideways_tp_mult': 1.1876961133324326, 'sideways_tsl_mult': 0.036959823921123444, 'sideways_time_stop': 216, 'sideways_use_sma': True, 'sideways_use_ema': True, 'sideways_use_atr': False, 'sideways_use_adx': False, 'sideways_use_spike': True, 'sideways_rsi_required': True}.
[I 2025-08-31 10:52:23,417] Trial 712 finished with values: [-1000000000.0, 1000000000.0] and parameters: {'p_sma': 13, 'p_std': 51, 'p_atr': 9, 'p_adx': 22, 'rsi_period': 31, 'ema1': 18, 'ema2': 12, 'slip_atr_k': 0.18996938117927642, 'slip_spread_k': 0.15426910527347784, 'spread_hl_frac': 0.012348261593805645, 'bb_std_mult': 1.1951489513587852, 'rsi_os': 34, 'rsi_ob': 87, 'vol_spike': 0.24456976468870006, 'adx_thresh': 23.683046259335548, 'atr_min_pct': 0.010418131789863425, 'atr_max_pct': 0.11905197396106171, 'tp_mult': 1.175303712893245, 'tsl_mult': 0.9050450957987406, 'strategy': 'breakout', 'time_stop': 131, 'use_sma': True, 'use_atr': False, 'use_adx': False, 'use_ema': True, 'use_spike': False, 'rsi_required': True, 'edge_k': 1.881145091266838, 'edge_cap': 0.10820193913672332, 'bull_strategy': 'breakout', 'bull_bb_std_mult': 1.187343635313979, 'bull_rsi_os': 21, 'bull_rsi_ob': 51, 'bull_adx_thresh': 30.184336838681173, 'bull_atr_min_pct': 0.011462189884691137, 'bull_atr_max_pct': 0.08444248848272994, 'bull_tp_mult': 2.159259853574654, 'bull_tsl_mult': 0.05160726503833063, 'bull_time_stop': 53, 'bull_use_sma': False, 'bull_use_ema': False, 'bull_use_atr': False, 'bull_use_adx': False, 'bull_use_spike': False, 'bull_rsi_required': True, 'bear_strategy': 'mean_reversion', 'bear_bb_std_mult': 3.195330309210341, 'bear_rsi_os': 28, 'bear_rsi_ob': 79, 'bear_adx_thresh': 21.47863148140579, 'bear_atr_min_pct': 0.007467051965517633, 'bear_atr_max_pct': 0.11522771361553635, 'bear_tp_mult': 2.156653558801685, 'bear_tsl_mult': 0.39833204379573667, 'bear_time_stop': 259, 'bear_use_sma': False, 'bear_use_ema': True, 'bear_use_atr': False, 'bear_use_adx': True, 'bear_use_spike': True, 'bear_rsi_required': True, 'sideways_strategy': 'breakout', 'sideways_bb_std_mult': 1.0172560305305787, 'sideways_rsi_os': 22, 'sideways_rsi_ob': 95, 'sideways_adx_thresh': 31.144037185684674, 'sideways_atr_min_pct': 0.020322041479021988, 'sideways_atr_max_pct': 0.052123839556870756, 'sideways_tp_mult': 2.824207523990977, 'sideways_tsl_mult': 0.03675569708508668, 'sideways_time_stop': 240, 'sideways_use_sma': True, 'sideways_use_ema': True, 'sideways_use_atr': False, 'sideways_use_adx': False, 'sideways_use_spike': True, 'sideways_rsi_required': False}.
[I 2025-08-31 10:52:23,545] Trial 714 finished with values: [-1000000000.0, 1000000000.0] and parameters: {'p_sma': 59, 'p_std': 52, 'p_atr': 9, 'p_adx': 22, 'rsi_period': 41, 'ema1': 18, 'ema2': 39, 'slip_atr_k': 0.09445877083942894, 'slip_spread_k': 0.7989861667666646, 'spread_hl_frac': 0.006240032712135003, 'bb_std_mult': 0.7523867896633967, 'rsi_os': 49, 'rsi_ob': 69, 'vol_spike': 0.2993633457011008, 'adx_thresh': 23.726807525281018, 'atr_min_pct': 0.013152666988004734, 'atr_max_pct': 0.03551797236405166, 'tp_mult': 2.9663867987177515, 'tsl_mult': 0.249433555075472, 'strategy': 'breakout', 'time_stop': 43, 'use_sma': False, 'use_atr': False, 'use_adx': False, 'use_ema': True, 'use_spike': False, 'rsi_required': True, 'edge_k': 0.8127258277925596, 'edge_cap': 0.10578557670090122, 'bull_strategy': 'mean_reversion', 'bull_bb_std_mult': 1.1937872696205558, 'bull_rsi_os': 16, 'bull_rsi_ob': 65, 'bull_adx_thresh': 29.916357064078387, 'bull_atr_min_pct': 0.006356832635494338, 'bull_atr_max_pct': 0.08588443342460905, 'bull_tp_mult': 1.8271561321377607, 'bull_tsl_mult': 0.9179537486695777, 'bull_time_stop': 65, 'bull_use_sma': True, 'bull_use_ema': False, 'bull_use_atr': False, 'bull_use_adx': False, 'bull_use_spike': False, 'bull_rsi_required': True, 'bear_strategy': 'breakout', 'bear_bb_std_mult': 2.9585720190271005, 'bear_rsi_os': 22, 'bear_rsi_ob': 88, 'bear_adx_thresh': 20.526999771815625, 'bear_atr_min_pct': 0.00821337317189036, 'bear_atr_max_pct': 0.10633980839927114, 'bear_tp_mult': 1.464149875689253, 'bear_tsl_mult': 0.4383005201995025, 'bear_time_stop': 251, 'bear_use_sma': False, 'bear_use_ema': True, 'bear_use_atr': False, 'bear_use_adx': True, 'bear_use_spike': True, 'bear_rsi_required': True, 'sideways_strategy': 'breakout', 'sideways_bb_std_mult': 1.6757075470616047, 'sideways_rsi_os': 34, 'sideways_rsi_ob': 86, 'sideways_adx_thresh': 29.71560143711483, 'sideways_atr_min_pct': 0.0030043298811801866, 'sideways_atr_max_pct': 0.13898479541014797, 'sideways_tp_mult': 1.8369582897020262, 'sideways_tsl_mult': 0.026239346841370213, 'sideways_time_stop': 98, 'sideways_use_sma': True, 'sideways_use_ema': True, 'sideways_use_atr': False, 'sideways_use_adx': False, 'sideways_use_spike': True, 'sideways_rsi_required': False}.
[I 2025-08-31 10:52:24,418] Trial 719 finished with values: [-1000000000.0, 1000000000.0] and parameters: {'p_sma': 24, 'p_std': 46, 'p_atr': 25, 'p_adx': 10, 'rsi_period': 25, 'ema1': 7, 'ema2': 38, 'slip_atr_k': 0.19558169556330918, 'slip_spread_k': 0.1086614737550731, 'spread_hl_frac': 0.0337297142136094, 'bb_std_mult': 1.1210267718098488, 'rsi_os': 55, 'rsi_ob': 76, 'vol_spike': 0.2862082535625236, 'adx_thresh': 24.37709920390019, 'atr_min_pct': 0.02527358304295868, 'atr_max_pct': 0.12372165279593608, 'tp_mult': 1.8152182047307706, 'tsl_mult': 0.40432259601889997, 'strategy': 'mean_reversion', 'time_stop': 189, 'use_sma': False, 'use_atr': False, 'use_adx': False, 'use_ema': True, 'use_spike': True, 'rsi_required': True, 'edge_k': 1.8454538760861832, 'edge_cap': 0.07498643891113735, 'bull_strategy': 'mean_reversion', 'bull_bb_std_mult': 1.9038950002709631, 'bull_rsi_os': 46, 'bull_rsi_ob': 69, 'bull_adx_thresh': 32.44483999608998, 'bull_atr_min_pct': 0.0066520282689840615, 'bull_atr_max_pct': 0.09017269882603783, 'bull_tp_mult': 2.334761485005908, 'bull_tsl_mult': 0.3171327518267424, 'bull_time_stop': 76, 'bull_use_sma': True, 'bull_use_ema': True, 'bull_use_atr': True, 'bull_use_adx': True, 'bull_use_spike': False, 'bull_rsi_required': True, 'bear_strategy': 'breakout', 'bear_bb_std_mult': 3.109300703904328, 'bear_rsi_os': 30, 'bear_rsi_ob': 80, 'bear_adx_thresh': 15.06645011336661, 'bear_atr_min_pct': 0.009020685788816898, 'bear_atr_max_pct': 0.10183690340341575, 'bear_tp_mult': 1.4015407395530288, 'bear_tsl_mult': 0.9436988725981842, 'bear_time_stop': 104, 'bear_use_sma': True, 'bear_use_ema': True, 'bear_use_atr': True, 'bear_use_adx': False, 'bear_use_spike': True, 'bear_rsi_required': True, 'sideways_strategy': 'breakout', 'sideways_bb_std_mult': 0.9533058577267859, 'sideways_rsi_os': 47, 'sideways_rsi_ob': 93, 'sideways_adx_thresh': 30.488487249917814, 'sideways_atr_min_pct': 0.026967354335455468, 'sideways_atr_max_pct': 0.10063409339348774, 'sideways_tp_mult': 2.8568350178686086, 'sideways_tsl_mult': 0.6890168795946461, 'sideways_time_stop': 190, 'sideways_use_sma': False, 'sideways_use_ema': True, 'sideways_use_atr': False, 'sideways_use_adx': False, 'sideways_use_spike': True, 'sideways_rsi_required': False}.
[I 2025-08-31 10:52:55,171] Trial 718 finished with values: [-1000000000.0, 1000000000.0] and parameters: {'p_sma': 9, 'p_std': 46, 'p_atr': 15, 'p_adx': 28, 'rsi_period': 73, 'ema1': 29, 'ema2': 38, 'slip_atr_k': 0.20008953427375042, 'slip_spread_k': 0.3171012077895767, 'spread_hl_frac': 0.008428415461269302, 'bb_std_mult': 0.7522509723425037, 'rsi_os': 40, 'rsi_ob': 91, 'vol_spike': 0.2999038095450171, 'adx_thresh': 19.787895501887803, 'atr_min_pct': 0.0007125301693296192, 'atr_max_pct': 0.1237709205898774, 'tp_mult': 2.963398184414843, 'tsl_mult': 0.24738367309669868, 'strategy': 'mean_reversion', 'time_stop': 125, 'use_sma': False, 'use_atr': False, 'use_adx': False, 'use_ema': True, 'use_spike': True, 'rsi_required': True, 'edge_k': 1.8605152259882427, 'edge_cap': 0.1234362218490989, 'bull_strategy': 'mean_reversion', 'bull_bb_std_mult': 1.0421711158812341, 'bull_rsi_os': 26, 'bull_rsi_ob': 67, 'bull_adx_thresh': 31.06837646497652, 'bull_atr_min_pct': 0.006282100604224663, 'bull_atr_max_pct': 0.08999743587827091, 'bull_tp_mult': 2.3331801907235397, 'bull_tsl_mult': 0.3217060427313281, 'bull_time_stop': 137, 'bull_use_sma': True, 'bull_use_ema': False, 'bull_use_atr': True, 'bull_use_adx': True, 'bull_use_spike': False, 'bull_rsi_required': True, 'bear_strategy': 'breakout', 'bear_bb_std_mult': 2.080078477289512, 'bear_rsi_os': 15, 'bear_rsi_ob': 80, 'bear_adx_thresh': 23.107526123812427, 'bear_atr_min_pct': 0.005711577205225533, 'bear_atr_max_pct': 0.10193842943580539, 'bear_tp_mult': 2.0337958260874833, 'bear_tsl_mult': 0.10092736149022574, 'bear_time_stop': 81, 'bear_use_sma': True, 'bear_use_ema': True, 'bear_use_atr': True, 'bear_use_adx': False, 'bear_use_spike': True, 'bear_rsi_required': True, 'sideways_strategy': 'breakout', 'sideways_bb_std_mult': 2.691685569199551, 'sideways_rsi_os': 24, 'sideways_rsi_ob': 94, 'sideways_adx_thresh': 6.955784564098382, 'sideways_atr_min_pct': 0.0007204937016578371, 'sideways_atr_max_pct': 0.1088264096680496, 'sideways_tp_mult': 2.852622209049633, 'sideways_tsl_mult': 0.17431579966687405, 'sideways_time_stop': 101, 'sideways_use_sma': False, 'sideways_use_ema': True, 'sideways_use_atr': False, 'sideways_use_adx': False, 'sideways_use_spike': True, 'sideways_rsi_required': False}.
[I 2025-08-31 10:52:55,455] Trial 716 finished with values: [-1000000000.0, 1000000000.0] and parameters: {'p_sma': 24, 'p_std': 41, 'p_atr': 28, 'p_adx': 10, 'rsi_period': 12, 'ema1': 18, 'ema2': 27, 'slip_atr_k': 0.2417440333341782, 'slip_spread_k': 0.03087648902729051, 'spread_hl_frac': 0.03073490760880708, 'bb_std_mult': 1.1116492488113208, 'rsi_os': 29, 'rsi_ob': 76, 'vol_spike': 0.2889071213968687, 'adx_thresh': 19.85013607149287, 'atr_min_pct': 0.013369495114220111, 'atr_max_pct': 0.1077423436250542, 'tp_mult': 2.8796497512505286, 'tsl_mult': 0.6935644766999811, 'strategy': 'mean_reversion', 'time_stop': 150, 'use_sma': False, 'use_atr': False, 'use_adx': False, 'use_ema': True, 'use_spike': False, 'rsi_required': True, 'edge_k': 0.8202190883154272, 'edge_cap': 0.12076046558307285, 'bull_strategy': 'mean_reversion', 'bull_bb_std_mult': 0.703360372534146, 'bull_rsi_os': 26, 'bull_rsi_ob': 67, 'bull_adx_thresh': 29.988424481965552, 'bull_atr_min_pct': 0.014833769387612222, 'bull_atr_max_pct': 0.08613069354477003, 'bull_tp_mult': 1.8049437047986512, 'bull_tsl_mult': 0.3223248993781249, 'bull_time_stop': 118, 'bull_use_sma': True, 'bull_use_ema': False, 'bull_use_atr': False, 'bull_use_adx': False, 'bull_use_spike': False, 'bull_rsi_required': True, 'bear_strategy': 'breakout', 'bear_bb_std_mult': 3.073603349789378, 'bear_rsi_os': 46, 'bear_rsi_ob': 79, 'bear_adx_thresh': 31.488289128836172, 'bear_atr_min_pct': 0.008356681662489792, 'bear_atr_max_pct': 0.09809773407910519, 'bear_tp_mult': 1.3915154211729388, 'bear_tsl_mult': 0.42924329267357797, 'bear_time_stop': 129, 'bear_use_sma': True, 'bear_use_ema': True, 'bear_use_atr': False, 'bear_use_adx': False, 'bear_use_spike': True, 'bear_rsi_required': True, 'sideways_strategy': 'breakout', 'sideways_bb_std_mult': 2.7232127192315794, 'sideways_rsi_os': 36, 'sideways_rsi_ob': 93, 'sideways_adx_thresh': 30.490262535418978, 'sideways_atr_min_pct': 0.018545426142314712, 'sideways_atr_max_pct': 0.0725054388653625, 'sideways_tp_mult': 2.83553200684713, 'sideways_tsl_mult': 0.6831744165395406, 'sideways_time_stop': 63, 'sideways_use_sma': True, 'sideways_use_ema': True, 'sideways_use_atr': False, 'sideways_use_adx': False, 'sideways_use_spike': True, 'sideways_rsi_required': False}.
[I 2025-08-31 10:52:55,647] Trial 717 finished with values: [-1000000000.0, 1000000000.0] and parameters: {'p_sma': 32, 'p_std': 41, 'p_atr': 29, 'p_adx': 10, 'rsi_period': 73, 'ema1': 18, 'ema2': 38, 'slip_atr_k': 0.023422891368387877, 'slip_spread_k': 0.044417114695773974, 'spread_hl_frac': 0.009168430895164458, 'bb_std_mult': 1.129318402014772, 'rsi_os': 39, 'rsi_ob': 74, 'vol_spike': 0.29980432530037004, 'adx_thresh': 24.253661298593823, 'atr_min_pct': 0.0009003643607973337, 'atr_max_pct': 0.06123566223343023, 'tp_mult': 2.963633570430926, 'tsl_mult': 0.6929135236731154, 'strategy': 'mean_reversion', 'time_stop': 145, 'use_sma': False, 'use_atr': False, 'use_adx': False, 'use_ema': True, 'use_spike': False, 'rsi_required': True, 'edge_k': 1.8681026234590352, 'edge_cap': 0.9928191095680992, 'bull_strategy': 'mean_reversion', 'bull_bb_std_mult': 1.252541267694315, 'bull_rsi_os': 26, 'bull_rsi_ob': 48, 'bull_adx_thresh': 32.512271692809, 'bull_atr_min_pct': 0.006126370851603184, 'bull_atr_max_pct': 0.08655594794778063, 'bull_tp_mult': 2.3504306481667028, 'bull_tsl_mult': 0.9872903507854472, 'bull_time_stop': 53, 'bull_use_sma': True, 'bull_use_ema': False, 'bull_use_atr': True, 'bull_use_adx': True, 'bull_use_spike': False, 'bull_rsi_required': True, 'bear_strategy': 'breakout', 'bear_bb_std_mult': 3.0970484082917316, 'bear_rsi_os': 22, 'bear_rsi_ob': 93, 'bear_adx_thresh': 14.793546184913442, 'bear_atr_min_pct': 0.008328147780195016, 'bear_atr_max_pct': 0.10170338700198962, 'bear_tp_mult': 1.3933826567960785, 'bear_tsl_mult': 0.8651834188049268, 'bear_time_stop': 104, 'bear_use_sma': True, 'bear_use_ema': True, 'bear_use_atr': False, 'bear_use_adx': False, 'bear_use_spike': True, 'bear_rsi_required': True, 'sideways_strategy': 'breakout', 'sideways_bb_std_mult': 0.9360877396992466, 'sideways_rsi_os': 24, 'sideways_rsi_ob': 95, 'sideways_adx_thresh': 8.184644280231021, 'sideways_atr_min_pct': 0.01860593441883536, 'sideways_atr_max_pct': 0.07978292133217849, 'sideways_tp_mult': 2.8209267892929444, 'sideways_tsl_mult': 0.5681270699795488, 'sideways_time_stop': 242, 'sideways_use_sma': True, 'sideways_use_ema': True, 'sideways_use_atr': False, 'sideways_use_adx': False, 'sideways_use_spike': True, 'sideways_rsi_required': False}.
