[I 2025-08-31 11:06:24,032] Trial 819 finished with values: [-1000000000.0, 1000000000.0] and parameters: {'p_sma': 20, 'p_std': 51, 'p_atr': 30, 'p_adx': 9, 'rsi_period': 49, 'ema1': 13, 'ema2': 38, 'slip_atr_k': 0.18007207978142103, 'slip_spread_k': 0.1104406193291864, 'spread_hl_frac': 0.033031886857249525, 'bb_std_mult': 1.320284052559726, 'rsi_os': 41, 'rsi_ob': 86, 'vol_spike': 0.2998614574002346, 'adx_thresh': 14.079699394950811, 'atr_min_pct': 0.0121906591933003, 'atr_max_pct': 0.030783695323997155, 'tp_mult': 2.913903545403285, 'tsl_mult': 0.02682501463929297, 'strategy': 'breakout', 'time_stop': 144, 'use_sma': False, 'use_atr': False, 'use_adx': True, 'use_ema': True, 'use_spike': False, 'rsi_required': False, 'edge_k': 0.4047159344881214, 'edge_cap': 0.13592150142333664, 'bull_strategy': 'mean_reversion', 'bull_bb_std_mult': 2.537578634968222, 'bull_rsi_os': 26, 'bull_rsi_ob': 72, 'bull_adx_thresh': 34.94979552994124, 'bull_atr_min_pct': 0.005533986429190423, 'bull_atr_max_pct': 0.02834138097157763, 'bull_tp_mult': 2.236181415088304, 'bull_tsl_mult': 0.20635038534849937, 'bull_time_stop': 113, 'bull_use_sma': True, 'bull_use_ema': False, 'bull_use_atr': False, 'bull_use_adx': True, 'bull_use_spike': False, 'bull_rsi_required': True, 'bear_strategy': 'breakout', 'bear_bb_std_mult': 0.6553252459584953, 'bear_rsi_os': 31, 'bear_rsi_ob': 64, 'bear_adx_thresh': 20.77321289928496, 'bear_atr_min_pct': 0.006439897866039179, 'bear_atr_max_pct': 0.0486179506551533, 'bear_tp_mult': 2.0620139465340626, 'bear_tsl_mult': 0.9813929935780463, 'bear_time_stop': 71, 'bear_use_sma': False, 'bear_use_ema': True, 'bear_use_atr': False, 'bear_use_adx': True, 'bear_use_spike': True, 'bear_rsi_required': True, 'sideways_strategy': 'breakout', 'sideways_bb_std_mult': 1.134594942859533, 'sideways_rsi_os': 9, 'sideways_rsi_ob': 90, 'sideways_adx_thresh': 10.744267402787763, 'sideways_atr_min_pct': 0.02957487964314845, 'sideways_atr_max_pct': 0.10728834592321289, 'sideways_tp_mult': 2.9568915166619107, 'sideways_tsl_mult': 0.030418810112343576, 'sideways_time_stop': 256, 'sideways_use_sma': True, 'sideways_use_ema': True, 'sideways_use_atr': False, 'sideways_use_adx': False, 'sideways_use_spike': True, 'sideways_rsi_required': False}.
[I 2025-08-31 11:06:56,447] Trial 821 finished with values: [-1000000000.0, 1000000000.0] and parameters: {'p_sma': 10, 'p_std': 57, 'p_atr': 30, 'p_adx': 23, 'rsi_period': 78, 'ema1': 18, 'ema2': 56, 'slip_atr_k': 0.1085269783382734, 'slip_spread_k': 0.2094399851008052, 'spread_hl_frac': 0.038848829422937374, 'bb_std_mult': 2.2967734698390836, 'rsi_os': 41, 'rsi_ob': 63, 'vol_spike': 0.2025193923728338, 'adx_thresh': 24.53279881421517, 'atr_min_pct': 0.0043768128708442915, 'atr_max_pct': 0.08122000046693875, 'tp_mult': 2.82398258558921, 'tsl_mult': 0.07431807829008374, 'strategy': 'breakout', 'time_stop': 229, 'use_sma': False, 'use_atr': False, 'use_adx': True, 'use_ema': True, 'use_spike': False, 'rsi_required': True, 'edge_k': 1.0698341888215186, 'edge_cap': 0.14492572361423026, 'bull_strategy': 'mean_reversion', 'bull_bb_std_mult': 1.9627931155948328, 'bull_rsi_os': 25, 'bull_rsi_ob': 68, 'bull_adx_thresh': 9.589143644731546, 'bull_atr_min_pct': 0.024991135814144715, 'bull_atr_max_pct': 0.08330310775005412, 'bull_tp_mult': 2.7428016045773624, 'bull_tsl_mult': 0.9808948481719371, 'bull_time_stop': 87, 'bull_use_sma': True, 'bull_use_ema': False, 'bull_use_atr': False, 'bull_use_adx': False, 'bull_use_spike': False, 'bull_rsi_required': True, 'bear_strategy': 'breakout', 'bear_bb_std_mult': 3.4776075464073375, 'bear_rsi_os': 28, 'bear_rsi_ob': 80, 'bear_adx_thresh': 14.242030119503406, 'bear_atr_min_pct': 0.01908361436369458, 'bear_atr_max_pct': 0.10156072990788516, 'bear_tp_mult': 1.8622632525652765, 'bear_tsl_mult': 0.4294797233924365, 'bear_time_stop': 254, 'bear_use_sma': False, 'bear_use_ema': True, 'bear_use_atr': False, 'bear_use_adx': True, 'bear_use_spike': True, 'bear_rsi_required': True, 'sideways_strategy': 'breakout', 'sideways_bb_std_mult': 3.1427270362334054, 'sideways_rsi_os': 28, 'sideways_rsi_ob': 78, 'sideways_adx_thresh': 22.21943609515946, 'sideways_atr_min_pct': 0.0033692758853914265, 'sideways_atr_max_pct': 0.10313276684222485, 'sideways_tp_mult': 2.9559273081432704, 'sideways_tsl_mult': 0.03358142303183327, 'sideways_time_stop': 257, 'sideways_use_sma': True, 'sideways_use_ema': False, 'sideways_use_atr': False, 'sideways_use_adx': False, 'sideways_use_spike': True, 'sideways_rsi_required': False}.
[I 2025-08-31 11:06:56,775] Trial 823 finished with values: [-1000000000.0, 1000000000.0] and parameters: {'p_sma': 10, 'p_std': 45, 'p_atr': 27, 'p_adx': 8, 'rsi_period': 11, 'ema1': 18, 'ema2': 32, 'slip_atr_k': 0.17346331870989393, 'slip_spread_k': 0.05679794363500778, 'spread_hl_frac': 0.013964728934109378, 'bb_std_mult': 2.918330983052535, 'rsi_os': 40, 'rsi_ob': 63, 'vol_spike': 0.2882739274199693, 'adx_thresh': 25.187799261059883, 'atr_min_pct': 0.01591708656600939, 'atr_max_pct': 0.0818298817957684, 'tp_mult': 2.8202160686403888, 'tsl_mult': 0.07396169028902463, 'strategy': 'breakout', 'time_stop': 121, 'use_sma': False, 'use_atr': False, 'use_adx': False, 'use_ema': True, 'use_spike': False, 'rsi_required': True, 'edge_k': 1.8811610158397232, 'edge_cap': 0.20909949935231836, 'bull_strategy': 'mean_reversion', 'bull_bb_std_mult': 2.0312120232886635, 'bull_rsi_os': 26, 'bull_rsi_ob': 86, 'bull_adx_thresh': 30.01076451532243, 'bull_atr_min_pct': 0.01465648026598509, 'bull_atr_max_pct': 0.07542450707026159, 'bull_tp_mult': 1.7256447950614664, 'bull_tsl_mult': 0.9825107587992079, 'bull_time_stop': 84, 'bull_use_sma': True, 'bull_use_ema': False, 'bull_use_atr': False, 'bull_use_adx': False, 'bull_use_spike': False, 'bull_rsi_required': True, 'bear_strategy': 'breakout', 'bear_bb_std_mult': 2.261638477990466, 'bear_rsi_os': 28, 'bear_rsi_ob': 62, 'bear_adx_thresh': 14.274654110522249, 'bear_atr_min_pct': 0.005378144397340464, 'bear_atr_max_pct': 0.09926323586598379, 'bear_tp_mult': 1.9040978244501408, 'bear_tsl_mult': 0.46373446132196067, 'bear_time_stop': 95, 'bear_use_sma': False, 'bear_use_ema': False, 'bear_use_atr': False, 'bear_use_adx': False, 'bear_use_spike': True, 'bear_rsi_required': True, 'sideways_strategy': 'mean_reversion', 'sideways_bb_std_mult': 0.9349880958550272, 'sideways_rsi_os': 28, 'sideways_rsi_ob': 95, 'sideways_adx_thresh': 28.698429514625087, 'sideways_atr_min_pct': 0.006509756527449638, 'sideways_atr_max_pct': 0.09768408568684951, 'sideways_tp_mult': 1.6961367225098654, 'sideways_tsl_mult': 0.09783995792605171, 'sideways_time_stop': 232, 'sideways_use_sma': True, 'sideways_use_ema': False, 'sideways_use_atr': False, 'sideways_use_adx': False, 'sideways_use_spike': True, 'sideways_rsi_required': True}.
[I 2025-08-31 11:06:57,071] Trial 822 finished with values: [-1000000000.0, 1000000000.0] and parameters: {'p_sma': 8, 'p_std': 60, 'p_atr': 27, 'p_adx': 10, 'rsi_period': 59, 'ema1': 12, 'ema2': 38, 'slip_atr_k': 0.06384912338396759, 'slip_spread_k': 0.1653661959129134, 'spread_hl_frac': 0.011496269073807833, 'bb_std_mult': 1.2153144692154043, 'rsi_os': 41, 'rsi_ob': 83, 'vol_spike': 0.285798836538992, 'adx_thresh': 25.194760465737364, 'atr_min_pct': 0.02852131504963184, 'atr_max_pct': 0.11525212577898283, 'tp_mult': 2.9083662680991926, 'tsl_mult': 0.1461072307497338, 'strategy': 'breakout', 'time_stop': 82, 'use_sma': False, 'use_atr': False, 'use_adx': True, 'use_ema': True, 'use_spike': False, 'rsi_required': True, 'edge_k': 1.3986684731426586, 'edge_cap': 0.5036701886397198, 'bull_strategy': 'mean_reversion', 'bull_bb_std_mult': 1.3759238937146736, 'bull_rsi_os': 25, 'bull_rsi_ob': 70, 'bull_adx_thresh': 29.901403407294197, 'bull_atr_min_pct': 0.008058725751230513, 'bull_atr_max_pct': 0.07483399836184484, 'bull_tp_mult': 2.3580357354643904, 'bull_tsl_mult': 0.8222694655614922, 'bull_time_stop': 87, 'bull_use_sma': True, 'bull_use_ema': False, 'bull_use_atr': False, 'bull_use_adx': False, 'bull_use_spike': False, 'bull_rsi_required': True, 'bear_strategy': 'breakout', 'bear_bb_std_mult': 2.708515723689124, 'bear_rsi_os': 42, 'bear_rsi_ob': 80, 'bear_adx_thresh': 33.09091307128956, 'bear_atr_min_pct': 0.007245337083763953, 'bear_atr_max_pct': 0.051014461523970274, 'bear_tp_mult': 2.0622556628559834, 'bear_tsl_mult': 0.42867419013464153, 'bear_time_stop': 255, 'bear_use_sma': False, 'bear_use_ema': True, 'bear_use_atr': False, 'bear_use_adx': False, 'bear_use_spike': True, 'bear_rsi_required': True, 'sideways_strategy': 'breakout', 'sideways_bb_std_mult': 2.3742833057333157, 'sideways_rsi_os': 21, 'sideways_rsi_ob': 95, 'sideways_adx_thresh': 10.777264286542929, 'sideways_atr_min_pct': 0.0020613807478420064, 'sideways_atr_max_pct': 0.10359872571550614, 'sideways_tp_mult': 2.10459072201063, 'sideways_tsl_mult': 0.0010569472646886346, 'sideways_time_stop': 198, 'sideways_use_sma': True, 'sideways_use_ema': False, 'sideways_use_atr': False, 'sideways_use_adx': False, 'sideways_use_spike': True, 'sideways_rsi_required': False}.
[I 2025-08-31 11:06:57,405] Trial 820 finished with values: [-1000000000.0, 1000000000.0] and parameters: {'p_sma': 23, 'p_std': 57, 'p_atr': 30, 'p_adx': 9, 'rsi_period': 48, 'ema1': 22, 'ema2': 38, 'slip_atr_k': 0.06436972891920836, 'slip_spread_k': 0.16377414391888478, 'spread_hl_frac': 0.01116707630716964, 'bb_std_mult': 1.4805267110975828, 'rsi_os': 41, 'rsi_ob': 83, 'vol_spike': 0.28785633258096477, 'adx_thresh': 8.949439062773443, 'atr_min_pct': 0.012159413760409129, 'atr_max_pct': 0.11751903176170127, 'tp_mult': 1.3372229287921589, 'tsl_mult': 0.07082447132259372, 'strategy': 'breakout', 'time_stop': 119, 'use_sma': False, 'use_atr': False, 'use_adx': True, 'use_ema': True, 'use_spike': False, 'rsi_required': True, 'edge_k': 1.8726999982444992, 'edge_cap': 0.5045571476863995, 'bull_strategy': 'mean_reversion', 'bull_bb_std_mult': 2.5411495870959078, 'bull_rsi_os': 25, 'bull_rsi_ob': 68, 'bull_adx_thresh': 29.856580953612315, 'bull_atr_min_pct': 0.006664840555122797, 'bull_atr_max_pct': 0.03792018659159576, 'bull_tp_mult': 2.359342630705421, 'bull_tsl_mult': 0.8165805016688161, 'bull_time_stop': 85, 'bull_use_sma': True, 'bull_use_ema': False, 'bull_use_atr': False, 'bull_use_adx': False, 'bull_use_spike': False, 'bull_rsi_required': True, 'bear_strategy': 'breakout', 'bear_bb_std_mult': 3.159636585532431, 'bear_rsi_os': 28, 'bear_rsi_ob': 80, 'bear_adx_thresh': 14.532904888917981, 'bear_atr_min_pct': 0.00633847986575148, 'bear_atr_max_pct': 0.028217484543011283, 'bear_tp_mult': 2.1107613796613443, 'bear_tsl_mult': 0.09535915541614604, 'bear_time_stop': 254, 'bear_use_sma': False, 'bear_use_ema': True, 'bear_use_atr': False, 'bear_use_adx': True, 'bear_use_spike': True, 'bear_rsi_required': True, 'sideways_strategy': 'breakout', 'sideways_bb_std_mult': 2.8633867692022585, 'sideways_rsi_os': 21, 'sideways_rsi_ob': 68, 'sideways_adx_thresh': 29.49666917120999, 'sideways_atr_min_pct': 0.0020507702069770483, 'sideways_atr_max_pct': 0.10562708302133117, 'sideways_tp_mult': 2.1056635866394147, 'sideways_tsl_mult': 0.2162056976022076, 'sideways_time_stop': 196, 'sideways_use_sma': True, 'sideways_use_ema': True, 'sideways_use_atr': False, 'sideways_use_adx': False, 'sideways_use_spike': True, 'sideways_rsi_required': False}.
[I 2025-08-31 11:07:31,418] Trial 824 finished with values: [-1000000000.0, 1000000000.0] and parameters: {'p_sma': 9, 'p_std': 44, 'p_atr': 29, 'p_adx': 28, 'rsi_period': 34, 'ema1': 28, 'ema2': 37, 'slip_atr_k': 0.17431404520914245, 'slip_spread_k': 0.15747334501652235, 'spread_hl_frac': 0.013938858009505638, 'bb_std_mult': 1.2055222450177854, 'rsi_os': 40, 'rsi_ob': 91, 'vol_spike': 0.28793564762636314, 'adx_thresh': 24.17859690967359, 'atr_min_pct': 0.01573892317358342, 'atr_max_pct': 0.11458015288528174, 'tp_mult': 1.9787068776683403, 'tsl_mult': 0.10963953117028369, 'strategy': 'breakout', 'time_stop': 130, 'use_sma': False, 'use_atr': False, 'use_adx': False, 'use_ema': True, 'use_spike': False, 'rsi_required': True, 'edge_k': 1.8840208986813631, 'edge_cap': 0.19855838551588334, 'bull_strategy': 'mean_reversion', 'bull_bb_std_mult': 0.9481123232788001, 'bull_rsi_os': 26, 'bull_rsi_ob': 65, 'bull_adx_thresh': 28.43936250696685, 'bull_atr_min_pct': 0.008310080706419195, 'bull_atr_max_pct': 0.0753411309324273, 'bull_tp_mult': 2.0223331628818877, 'bull_tsl_mult': 0.48243685048340496, 'bull_time_stop': 79, 'bull_use_sma': True, 'bull_use_ema': False, 'bull_use_atr': False, 'bull_use_adx': False, 'bull_use_spike': False, 'bull_rsi_required': True, 'bear_strategy': 'breakout', 'bear_bb_std_mult': 2.689844998278473, 'bear_rsi_os': 11, 'bear_rsi_ob': 78, 'bear_adx_thresh': 22.400619933016138, 'bear_atr_min_pct': 0.005477986468211845, 'bear_atr_max_pct': 0.11832590002442045, 'bear_tp_mult': 2.11867878994846, 'bear_tsl_mult': 0.09010302155020555, 'bear_time_stop': 94, 'bear_use_sma': False, 'bear_use_ema': False, 'bear_use_atr': False, 'bear_use_adx': False, 'bear_use_spike': True, 'bear_rsi_required': True, 'sideways_strategy': 'mean_reversion', 'sideways_bb_std_mult': 0.9527659170678309, 'sideways_rsi_os': 21, 'sideways_rsi_ob': 95, 'sideways_adx_thresh': 31.53423667338481, 'sideways_atr_min_pct': 0.0019563985558064233, 'sideways_atr_max_pct': 0.06317037205685896, 'sideways_tp_mult': 2.806018791768171, 'sideways_tsl_mult': 0.11367477545698894, 'sideways_time_stop': 229, 'sideways_use_sma': True, 'sideways_use_ema': True, 'sideways_use_atr': False, 'sideways_use_adx': False, 'sideways_use_spike': True, 'sideways_rsi_required': True}.
[I 2025-08-31 11:07:31,524] Trial 827 finished with values: [-1000000000.0, 1000000000.0] and parameters: {'p_sma': 14, 'p_std': 44, 'p_atr': 29, 'p_adx': 22, 'rsi_period': 62, 'ema1': 19, 'ema2': 37, 'slip_atr_k': 0.19100913478733555, 'slip_spread_k': 0.02445453918066727, 'spread_hl_frac': 0.048827826801975394, 'bb_std_mult': 1.1280618732824679, 'rsi_os': 40, 'rsi_ob': 68, 'vol_spike': 0.2766277429854366, 'adx_thresh': 18.165600084748856, 'atr_min_pct': 0.02685040447834786, 'atr_max_pct': 0.12295244259299071, 'tp_mult': 2.286093681904712, 'tsl_mult': 0.3244375501858451, 'strategy': 'mean_reversion', 'time_stop': 134, 'use_sma': True, 'use_atr': True, 'use_adx': False, 'use_ema': True, 'use_spike': False, 'rsi_required': True, 'edge_k': 1.969191524977765, 'edge_cap': 0.08390959405720189, 'bull_strategy': 'breakout', 'bull_bb_std_mult': 1.1177392028174888, 'bull_rsi_os': 9, 'bull_rsi_ob': 66, 'bull_adx_thresh': 25.348764553166642, 'bull_atr_min_pct': 0.006062323001688665, 'bull_atr_max_pct': 0.08101249157036584, 'bull_tp_mult': 2.1079877959673814, 'bull_tsl_mult': 0.9997936511738046, 'bull_time_stop': 77, 'bull_use_sma': True, 'bull_use_ema': False, 'bull_use_atr': False, 'bull_use_adx': False, 'bull_use_spike': False, 'bull_rsi_required': True, 'bear_strategy': 'mean_reversion', 'bear_bb_std_mult': 2.839914346383665, 'bear_rsi_os': 9, 'bear_rsi_ob': 61, 'bear_adx_thresh': 6.718410101147343, 'bear_atr_min_pct': 0.007291610378990161, 'bear_atr_max_pct': 0.11895192878598547, 'bear_tp_mult': 2.2108766892807017, 'bear_tsl_mult': 0.8127188352312397, 'bear_time_stop': 247, 'bear_use_sma': False, 'bear_use_ema': False, 'bear_use_atr': False, 'bear_use_adx': True, 'bear_use_spike': False, 'bear_rsi_required': False, 'sideways_strategy': 'mean_reversion', 'sideways_bb_std_mult': 2.1565634990402702, 'sideways_rsi_os': 23, 'sideways_rsi_ob': 91, 'sideways_adx_thresh': 14.529142324810806, 'sideways_atr_min_pct': 0.019427458960270996, 'sideways_atr_max_pct': 0.09789983182420518, 'sideways_tp_mult': 2.80289503560406, 'sideways_tsl_mult': 0.1131878245367367, 'sideways_time_stop': 228, 'sideways_use_sma': True, 'sideways_use_ema': True, 'sideways_use_atr': False, 'sideways_use_adx': False, 'sideways_use_spike': True, 'sideways_rsi_required': True}.
[I 2025-08-31 11:07:31,842] Trial 825 finished with values: [-1000000000.0, 1000000000.0] and parameters: {'p_sma': 14, 'p_std': 50, 'p_atr': 29, 'p_adx': 10, 'rsi_period': 28, 'ema1': 9, 'ema2': 47, 'slip_atr_k': 0.13751327858164886, 'slip_spread_k': 0.0929608136481473, 'spread_hl_frac': 0.01145308283902579, 'bb_std_mult': 1.1991394622560496, 'rsi_os': 15, 'rsi_ob': 83, 'vol_spike': 0.28743517515255085, 'adx_thresh': 31.393264893319795, 'atr_min_pct': 0.010336374967515535, 'atr_max_pct': 0.046221041446527285, 'tp_mult': 2.8997391221908795, 'tsl_mult': 0.14255159188301608, 'strategy': 'breakout', 'time_stop': 104, 'use_sma': False, 'use_atr': False, 'use_adx': False, 'use_ema': True, 'use_spike': False, 'rsi_required': True, 'edge_k': 1.9668094882873697, 'edge_cap': 0.07494252029921068, 'bull_strategy': 'mean_reversion', 'bull_bb_std_mult': 1.1180562852366442, 'bull_rsi_os': 25, 'bull_rsi_ob': 69, 'bull_adx_thresh': 32.73537930274853, 'bull_atr_min_pct': 0.0082816801547931, 'bull_atr_max_pct': 0.13940300117754093, 'bull_tp_mult': 2.3765280323767684, 'bull_tsl_mult': 0.8095261938320245, 'bull_time_stop': 78, 'bull_use_sma': True, 'bull_use_ema': False, 'bull_use_atr': False, 'bull_use_adx': False, 'bull_use_spike': False, 'bull_rsi_required': True, 'bear_strategy': 'breakout', 'bear_bb_std_mult': 2.8149661684808533, 'bear_rsi_os': 42, 'bear_rsi_ob': 45, 'bear_adx_thresh': 22.046850569247788, 'bear_atr_min_pct': 0.012850735298681009, 'bear_atr_max_pct': 0.06283057328441392, 'bear_tp_mult': 2.043877629934814, 'bear_tsl_mult': 0.4044145098470531, 'bear_time_stop': 129, 'bear_use_sma': False, 'bear_use_ema': True, 'bear_use_atr': False, 'bear_use_adx': True, 'bear_use_spike': True, 'bear_rsi_required': True, 'sideways_strategy': 'breakout', 'sideways_bb_std_mult': 0.9750389301381861, 'sideways_rsi_os': 22, 'sideways_rsi_ob': 91, 'sideways_adx_thresh': 31.415580148248836, 'sideways_atr_min_pct': 0.01406440931758715, 'sideways_atr_max_pct': 0.1367581150508363, 'sideways_tp_mult': 2.099871145967354, 'sideways_tsl_mult': 0.1195188690671416, 'sideways_time_stop': 16, 'sideways_use_sma': True, 'sideways_use_ema': True, 'sideways_use_atr': False, 'sideways_use_adx': False, 'sideways_use_spike': True, 'sideways_rsi_required': False}.
[I 2025-08-31 11:07:31,998] Trial 826 finished with values: [-1000000000.0, 1000000000.0] and parameters: {'p_sma': 14, 'p_std': 50, 'p_atr': 29, 'p_adx': 29, 'rsi_period': 65, 'ema1': 28, 'ema2': 40, 'slip_atr_k': 0.19083516311001972, 'slip_spread_k': 0.250558054306256, 'spread_hl_frac': 0.04037997662205754, 'bb_std_mult': 1.131158520202035, 'rsi_os': 40, 'rsi_ob': 81, 'vol_spike': 0.2760108614363955, 'adx_thresh': 24.180892784213302, 'atr_min_pct': 0.026910698852617418, 'atr_max_pct': 0.12334784616791662, 'tp_mult': 2.283089704541757, 'tsl_mult': 0.3291283545754679, 'strategy': 'mean_reversion', 'time_stop': 132, 'use_sma': True, 'use_atr': True, 'use_adx': False, 'use_ema': True, 'use_spike': False, 'rsi_required': True, 'edge_k': 1.9658460774150877, 'edge_cap': 0.08072421986528155, 'bull_strategy': 'breakout', 'bull_bb_std_mult': 1.113523689630704, 'bull_rsi_os': 17, 'bull_rsi_ob': 66, 'bull_adx_thresh': 28.658821200828857, 'bull_atr_min_pct': 0.00651526480144375, 'bull_atr_max_pct': 0.08133945869776887, 'bull_tp_mult': 2.1378732519370205, 'bull_tsl_mult': 0.9448611855056424, 'bull_time_stop': 79, 'bull_use_sma': True, 'bull_use_ema': False, 'bull_use_atr': False, 'bull_use_adx': False, 'bull_use_spike': False, 'bull_rsi_required': True, 'bear_strategy': 'mean_reversion', 'bear_bb_std_mult': 2.824192536098527, 'bear_rsi_os': 26, 'bear_rsi_ob': 46, 'bear_adx_thresh': 21.99953130639461, 'bear_atr_min_pct': 0.01346261236290649, 'bear_atr_max_pct': 0.061670873268796444, 'bear_tp_mult': 2.1146539390367507, 'bear_tsl_mult': 0.5002132963196747, 'bear_time_stop': 259, 'bear_use_sma': False, 'bear_use_ema': True, 'bear_use_atr': False, 'bear_use_adx': True, 'bear_use_spike': False, 'bear_rsi_required': False, 'sideways_strategy': 'breakout', 'sideways_bb_std_mult': 2.850979337446957, 'sideways_rsi_os': 22, 'sideways_rsi_ob': 68, 'sideways_adx_thresh': 31.454233383294177, 'sideways_atr_min_pct': 0.014018879113153344, 'sideways_atr_max_pct': 0.09922033952153513, 'sideways_tp_mult': 2.7860532741680153, 'sideways_tsl_mult': 0.05639122286896028, 'sideways_time_stop': 229, 'sideways_use_sma': True, 'sideways_use_ema': True, 'sideways_use_atr': False, 'sideways_use_adx': False, 'sideways_use_spike': True, 'sideways_rsi_required': False}.
