[I 2025-08-31 10:43:26,985] Trial 648 finished with values: [-1000000000.0, 1000000000.0] and parameters: {'p_sma': 12, 'p_std': 39, 'p_atr': 29, 'p_adx': 30, 'rsi_period': 20, 'ema1': 9, 'ema2': 11, 'slip_atr_k': 0.18721166542426482, 'slip_spread_k': 0.09074701133185421, 'spread_hl_frac': 0.0041866315597298975, 'bb_std_mult': 2.9869023883420542, 'rsi_os': 9, 'rsi_ob': 64, 'vol_spike': 0.28353756028095106, 'adx_thresh': 24.02208460300295, 'atr_min_pct': 0.024715655365191685, 'atr_max_pct': 0.11983500980979017, 'tp_mult': 2.274609754901029, 'tsl_mult': 0.1985251642636835, 'strategy': 'breakout', 'time_stop': 137, 'use_sma': False, 'use_atr': False, 'use_adx': True, 'use_ema': True, 'use_spike': False, 'rsi_required': True, 'edge_k': 1.6440452044285014, 'edge_cap': 0.11117352988408477, 'bull_strategy': 'mean_reversion', 'bull_bb_std_mult': 2.5322216025899684, 'bull_rsi_os': 51, 'bull_rsi_ob': 64, 'bull_adx_thresh': 29.619175237714263, 'bull_atr_min_pct': 0.006330019129749431, 'bull_atr_max_pct': 0.09361973619823223, 'bull_tp_mult': 2.949464882979173, 'bull_tsl_mult': 0.9799258352260297, 'bull_time_stop': 103, 'bull_use_sma': True, 'bull_use_ema': False, 'bull_use_atr': False, 'bull_use_adx': False, 'bull_use_spike': False, 'bull_rsi_required': True, 'bear_strategy': 'breakout', 'bear_bb_std_mult': 3.07110682748033, 'bear_rsi_os': 16, 'bear_rsi_ob': 79, 'bear_adx_thresh': 31.28643525386879, 'bear_atr_min_pct': 0.005464226572093601, 'bear_atr_max_pct': 0.010369340700392887, 'bear_tp_mult': 1.8520644369777082, 'bear_tsl_mult': 0.7618432184959436, 'bear_time_stop': 141, 'bear_use_sma': False, 'bear_use_ema': False, 'bear_use_atr': False, 'bear_use_adx': False, 'bear_use_spike': True, 'bear_rsi_required': True, 'sideways_strategy': 'breakout', 'sideways_bb_std_mult': 0.7811602386480027, 'sideways_rsi_os': 21, 'sideways_rsi_ob': 53, 'sideways_adx_thresh': 29.91635515691028, 'sideways_atr_min_pct': 0.0017209954432867414, 'sideways_atr_max_pct': 0.10611445904789037, 'sideways_tp_mult': 2.8917060301960853, 'sideways_tsl_mult': 0.34901641899819424, 'sideways_time_stop': 162, 'sideways_use_sma': True, 'sideways_use_ema': True, 'sideways_use_atr': False, 'sideways_use_adx': False, 'sideways_use_spike': True, 'sideways_rsi_required': False}.
[I 2025-08-31 10:43:27,201] Trial 651 finished with values: [-1000000000.0, 1000000000.0] and parameters: {'p_sma': 19, 'p_std': 50, 'p_atr': 29, 'p_adx': 9, 'rsi_period': 55, 'ema1': 18, 'ema2': 52, 'slip_atr_k': 0.17897660855771108, 'slip_spread_k': 0.09157013084941834, 'spread_hl_frac': 0.004782672073154973, 'bb_std_mult': 1.3674794968173951, 'rsi_os': 36, 'rsi_ob': 90, 'vol_spike': 0.28318292787560995, 'adx_thresh': 23.959782487521046, 'atr_min_pct': 0.010148363914425931, 'atr_max_pct': 0.01292197849732761, 'tp_mult': 2.260004198880358, 'tsl_mult': 0.07918531032542578, 'strategy': 'breakout', 'time_stop': 146, 'use_sma': False, 'use_atr': False, 'use_adx': True, 'use_ema': True, 'use_spike': True, 'rsi_required': True, 'edge_k': 0.7751008636574177, 'edge_cap': 0.07021047677454824, 'bull_strategy': 'mean_reversion', 'bull_bb_std_mult': 1.2091092523122764, 'bull_rsi_os': 27, 'bull_rsi_ob': 64, 'bull_adx_thresh': 29.64193117936814, 'bull_atr_min_pct': 0.008296705955991938, 'bull_atr_max_pct': 0.09301567133999393, 'bull_tp_mult': 2.3316872643374364, 'bull_tsl_mult': 0.9816683753813424, 'bull_time_stop': 48, 'bull_use_sma': True, 'bull_use_ema': True, 'bull_use_atr': False, 'bull_use_adx': True, 'bull_use_spike': False, 'bull_rsi_required': True, 'bear_strategy': 'breakout', 'bear_bb_std_mult': 3.316571288011966, 'bear_rsi_os': 11, 'bear_rsi_ob': 84, 'bear_adx_thresh': 14.25543252520923, 'bear_atr_min_pct': 0.007554453037176858, 'bear_atr_max_pct': 0.10363105955930402, 'bear_tp_mult': 1.8452201621092408, 'bear_tsl_mult': 0.6383540826962105, 'bear_time_stop': 88, 'bear_use_sma': True, 'bear_use_ema': True, 'bear_use_atr': True, 'bear_use_adx': False, 'bear_use_spike': True, 'bear_rsi_required': True, 'sideways_strategy': 'breakout', 'sideways_bb_std_mult': 0.8018370594217104, 'sideways_rsi_os': 25, 'sideways_rsi_ob': 88, 'sideways_adx_thresh': 29.552670210673767, 'sideways_atr_min_pct': 0.0017083862738341508, 'sideways_atr_max_pct': 0.09433891973518946, 'sideways_tp_mult': 2.8657040475414455, 'sideways_tsl_mult': 0.09369391809856936, 'sideways_time_stop': 233, 'sideways_use_sma': False, 'sideways_use_ema': True, 'sideways_use_atr': False, 'sideways_use_adx': False, 'sideways_use_spike': True, 'sideways_rsi_required': False}.
[I 2025-08-31 10:43:27,313] Trial 649 finished with values: [-1000000000.0, 1000000000.0] and parameters: {'p_sma': 12, 'p_std': 39, 'p_atr': 29, 'p_adx': 30, 'rsi_period': 20, 'ema1': 9, 'ema2': 11, 'slip_atr_k': 0.18574591157855885, 'slip_spread_k': 0.2872423690044015, 'spread_hl_frac': 0.003440926024980605, 'bb_std_mult': 1.1368122727591383, 'rsi_os': 39, 'rsi_ob': 81, 'vol_spike': 0.2929484018552488, 'adx_thresh': 23.879741352814445, 'atr_min_pct': 0.01875833020837075, 'atr_max_pct': 0.1192048728106566, 'tp_mult': 2.0639312346495835, 'tsl_mult': 0.08878654870604875, 'strategy': 'breakout', 'time_stop': 96, 'use_sma': False, 'use_atr': False, 'use_adx': True, 'use_ema': True, 'use_spike': False, 'rsi_required': True, 'edge_k': 1.9516801898634695, 'edge_cap': 0.4708943469913834, 'bull_strategy': 'mean_reversion', 'bull_bb_std_mult': 1.2138749681328505, 'bull_rsi_os': 16, 'bull_rsi_ob': 65, 'bull_adx_thresh': 32.69501995216975, 'bull_atr_min_pct': 0.0059946009450496, 'bull_atr_max_pct': 0.09251919433321508, 'bull_tp_mult': 2.3399757445442573, 'bull_tsl_mult': 0.9792313077207131, 'bull_time_stop': 67, 'bull_use_sma': True, 'bull_use_ema': False, 'bull_use_atr': False, 'bull_use_adx': False, 'bull_use_spike': False, 'bull_rsi_required': True, 'bear_strategy': 'breakout', 'bear_bb_std_mult': 3.1371607117460014, 'bear_rsi_os': 22, 'bear_rsi_ob': 79, 'bear_adx_thresh': 20.61099877753131, 'bear_atr_min_pct': 0.025636603781122508, 'bear_atr_max_pct': 0.11744144116510272, 'bear_tp_mult': 1.0884556570839359, 'bear_tsl_mult': 0.471075640451956, 'bear_time_stop': 267, 'bear_use_sma': False, 'bear_use_ema': False, 'bear_use_atr': False, 'bear_use_adx': False, 'bear_use_spike': True, 'bear_rsi_required': True, 'sideways_strategy': 'breakout', 'sideways_bb_std_mult': 3.4579534439530413, 'sideways_rsi_os': 21, 'sideways_rsi_ob': 48, 'sideways_adx_thresh': 5.071403433674613, 'sideways_atr_min_pct': 0.0019849199742996994, 'sideways_atr_max_pct': 0.015587106282420396, 'sideways_tp_mult': 2.896936223236058, 'sideways_tsl_mult': 0.07013426227871611, 'sideways_time_stop': 186, 'sideways_use_sma': True, 'sideways_use_ema': True, 'sideways_use_atr': False, 'sideways_use_adx': False, 'sideways_use_spike': True, 'sideways_rsi_required': False}.
[I 2025-08-31 10:43:27,390] Trial 650 finished with values: [-1000000000.0, 1000000000.0] and parameters: {'p_sma': 12, 'p_std': 50, 'p_atr': 29, 'p_adx': 30, 'rsi_period': 20, 'ema1': 19, 'ema2': 38, 'slip_atr_k': 0.18329729779325582, 'slip_spread_k': 0.10141934670957242, 'spread_hl_frac': 0.019028544734033623, 'bb_std_mult': 2.238232699026956, 'rsi_os': 53, 'rsi_ob': 80, 'vol_spike': 0.2039179332450485, 'adx_thresh': 11.050868587175506, 'atr_min_pct': 0.014856595518640717, 'atr_max_pct': 0.08286119359883712, 'tp_mult': 1.443328547312783, 'tsl_mult': 0.06926772724212578, 'strategy': 'breakout', 'time_stop': 144, 'use_sma': False, 'use_atr': False, 'use_adx': True, 'use_ema': True, 'use_spike': True, 'rsi_required': True, 'edge_k': 1.6585904175045714, 'edge_cap': 0.1848191329887473, 'bull_strategy': 'mean_reversion', 'bull_bb_std_mult': 1.1942500823079485, 'bull_rsi_os': 5, 'bull_rsi_ob': 64, 'bull_adx_thresh': 21.969022314527272, 'bull_atr_min_pct': 0.008370736530974223, 'bull_atr_max_pct': 0.09260230056708603, 'bull_tp_mult': 2.2255331022616023, 'bull_tsl_mult': 0.9858072622675441, 'bull_time_stop': 278, 'bull_use_sma': True, 'bull_use_ema': False, 'bull_use_atr': False, 'bull_use_adx': False, 'bull_use_spike': False, 'bull_rsi_required': True, 'bear_strategy': 'breakout', 'bear_bb_std_mult': 0.7058563096761397, 'bear_rsi_os': 26, 'bear_rsi_ob': 84, 'bear_adx_thresh': 18.513211222591238, 'bear_atr_min_pct': 0.008289082186395255, 'bear_atr_max_pct': 0.10352406097614442, 'bear_tp_mult': 1.894714428872293, 'bear_tsl_mult': 0.051014758492537504, 'bear_time_stop': 195, 'bear_use_sma': False, 'bear_use_ema': True, 'bear_use_atr': True, 'bear_use_adx': False, 'bear_use_spike': True, 'bear_rsi_required': True, 'sideways_strategy': 'breakout', 'sideways_bb_std_mult': 0.7568166100361469, 'sideways_rsi_os': 25, 'sideways_rsi_ob': 92, 'sideways_adx_thresh': 30.18722914655328, 'sideways_atr_min_pct': 0.0016458103697612138, 'sideways_atr_max_pct': 0.01473820941667002, 'sideways_tp_mult': 2.883389723741749, 'sideways_tsl_mult': 0.34381132479144905, 'sideways_time_stop': 160, 'sideways_use_sma': False, 'sideways_use_ema': True, 'sideways_use_atr': False, 'sideways_use_adx': False, 'sideways_use_spike': True, 'sideways_rsi_required': False}.
[I 2025-08-31 10:44:01,814] Trial 654 finished with values: [-1000000000.0, 1000000000.0] and parameters: {'p_sma': 9, 'p_std': 47, 'p_atr': 30, 'p_adx': 10, 'rsi_period': 25, 'ema1': 19, 'ema2': 38, 'slip_atr_k': 0.20156160672705334, 'slip_spread_k': 0.0022417497199282987, 'spread_hl_frac': 0.03888472406025678, 'bb_std_mult': 3.151269946237951, 'rsi_os': 52, 'rsi_ob': 80, 'vol_spike': 0.2156794738529511, 'adx_thresh': 22.75995879573903, 'atr_min_pct': 0.011478535058991572, 'atr_max_pct': 0.12741955846111816, 'tp_mult': 2.311239194867767, 'tsl_mult': 0.06521373673889107, 'strategy': 'breakout', 'time_stop': 129, 'use_sma': False, 'use_atr': False, 'use_adx': False, 'use_ema': True, 'use_spike': True, 'rsi_required': True, 'edge_k': 0.8506805703543839, 'edge_cap': 0.18979278778788095, 'bull_strategy': 'mean_reversion', 'bull_bb_std_mult': 2.6671334043199617, 'bull_rsi_os': 25, 'bull_rsi_ob': 66, 'bull_adx_thresh': 21.897442941815445, 'bull_atr_min_pct': 0.007754190881250751, 'bull_atr_max_pct': 0.084828975340435, 'bull_tp_mult': 2.2214673949376684, 'bull_tsl_mult': 0.9386423041268469, 'bull_time_stop': 75, 'bull_use_sma': True, 'bull_use_ema': True, 'bull_use_atr': False, 'bull_use_adx': True, 'bull_use_spike': False, 'bull_rsi_required': True, 'bear_strategy': 'breakout', 'bear_bb_std_mult': 2.9290123718345935, 'bear_rsi_os': 47, 'bear_rsi_ob': 78, 'bear_adx_thresh': 18.548129943204774, 'bear_atr_min_pct': 0.00837018729581783, 'bear_atr_max_pct': 0.02947733166290431, 'bear_tp_mult': 2.019989976978946, 'bear_tsl_mult': 0.48111254630423245, 'bear_time_stop': 266, 'bear_use_sma': False, 'bear_use_ema': True, 'bear_use_atr': True, 'bear_use_adx': True, 'bear_use_spike': True, 'bear_rsi_required': True, 'sideways_strategy': 'breakout', 'sideways_bb_std_mult': 1.0504017124617486, 'sideways_rsi_os': 24, 'sideways_rsi_ob': 92, 'sideways_adx_thresh': 27.835817589359376, 'sideways_atr_min_pct': 0.017326431727989172, 'sideways_atr_max_pct': 0.10039378490092238, 'sideways_tp_mult': 1.1290298383167152, 'sideways_tsl_mult': 0.298459884813423, 'sideways_time_stop': 200, 'sideways_use_sma': False, 'sideways_use_ema': True, 'sideways_use_atr': False, 'sideways_use_adx': False, 'sideways_use_spike': True, 'sideways_rsi_required': False}.
[I 2025-08-31 10:44:02,047] Trial 653 finished with values: [-1000000000.0, 1000000000.0] and parameters: {'p_sma': 9, 'p_std': 46, 'p_atr': 30, 'p_adx': 10, 'rsi_period': 25, 'ema1': 26, 'ema2': 15, 'slip_atr_k': 0.20179332241692055, 'slip_spread_k': 0.14284543508316372, 'spread_hl_frac': 0.01883919111607499, 'bb_std_mult': 1.1486254817931778, 'rsi_os': 39, 'rsi_ob': 79, 'vol_spike': 0.06564604369463982, 'adx_thresh': 22.69798920552479, 'atr_min_pct': 0.011293842740353926, 'atr_max_pct': 0.11354347976123849, 'tp_mult': 1.4438867219878597, 'tsl_mult': 0.8429402511744208, 'strategy': 'breakout', 'time_stop': 124, 'use_sma': False, 'use_atr': False, 'use_adx': False, 'use_ema': True, 'use_spike': False, 'rsi_required': True, 'edge_k': 0.12999707327228083, 'edge_cap': 0.17299097726766555, 'bull_strategy': 'mean_reversion', 'bull_bb_std_mult': 2.4844648080299314, 'bull_rsi_os': 25, 'bull_rsi_ob': 65, 'bull_adx_thresh': 27.25918080832176, 'bull_atr_min_pct': 0.025988977355046065, 'bull_atr_max_pct': 0.032448291670961506, 'bull_tp_mult': 2.218712055957587, 'bull_tsl_mult': 0.9364727182532833, 'bull_time_stop': 279, 'bull_use_sma': True, 'bull_use_ema': False, 'bull_use_atr': False, 'bull_use_adx': False, 'bull_use_spike': False, 'bull_rsi_required': True, 'bear_strategy': 'breakout', 'bear_bb_std_mult': 0.6674995708694809, 'bear_rsi_os': 7, 'bear_rsi_ob': 80, 'bear_adx_thresh': 22.063003100404735, 'bear_atr_min_pct': 0.008408985390770578, 'bear_atr_max_pct': 0.11672070794213009, 'bear_tp_mult': 2.037896882386148, 'bear_tsl_mult': 0.47470054936901457, 'bear_time_stop': 264, 'bear_use_sma': False, 'bear_use_ema': True, 'bear_use_atr': False, 'bear_use_adx': True, 'bear_use_spike': True, 'bear_rsi_required': True, 'sideways_strategy': 'breakout', 'sideways_bb_std_mult': 3.3592435307551973, 'sideways_rsi_os': 16, 'sideways_rsi_ob': 92, 'sideways_adx_thresh': 30.40049525305462, 'sideways_atr_min_pct': 0.02209925093128747, 'sideways_atr_max_pct': 0.09897949951587004, 'sideways_tp_mult': 2.9498649123686684, 'sideways_tsl_mult': 0.9989766790609589, 'sideways_time_stop': 230, 'sideways_use_sma': True, 'sideways_use_ema': True, 'sideways_use_atr': False, 'sideways_use_adx': False, 'sideways_use_spike': True, 'sideways_rsi_required': False}.
[I 2025-08-31 10:44:02,128] Trial 655 finished with values: [-1000000000.0, 1000000000.0] and parameters: {'p_sma': 14, 'p_std': 47, 'p_atr': 30, 'p_adx': 10, 'rsi_period': 58, 'ema1': 25, 'ema2': 58, 'slip_atr_k': 0.025837696641704155, 'slip_spread_k': 0.058803004757471855, 'spread_hl_frac': 0.012762806309154055, 'bb_std_mult': 1.138119577492866, 'rsi_os': 39, 'rsi_ob': 83, 'vol_spike': 0.21597161326493924, 'adx_thresh': 14.818658745386125, 'atr_min_pct': 0.009410599242724428, 'atr_max_pct': 0.12657924938698412, 'tp_mult': 2.8508516953683354, 'tsl_mult': 0.0592746491632167, 'strategy': 'mean_reversion', 'time_stop': 300, 'use_sma': True, 'use_atr': False, 'use_adx': False, 'use_ema': True, 'use_spike': False, 'rsi_required': True, 'edge_k': 1.8550906720928455, 'edge_cap': 0.8106508058012906, 'bull_strategy': 'breakout', 'bull_bb_std_mult': 1.3281891075504442, 'bull_rsi_os': 25, 'bull_rsi_ob': 66, 'bull_adx_thresh': 30.311671647561376, 'bull_atr_min_pct': 0.007628166531785532, 'bull_atr_max_pct': 0.0855115823904732, 'bull_tp_mult': 2.1261507308044174, 'bull_tsl_mult': 0.944171738548066, 'bull_time_stop': 178, 'bull_use_sma': True, 'bull_use_ema': True, 'bull_use_atr': False, 'bull_use_adx': True, 'bull_use_spike': False, 'bull_rsi_required': True, 'bear_strategy': 'breakout', 'bear_bb_std_mult': 2.924258004134436, 'bear_rsi_os': 29, 'bear_rsi_ob': 78, 'bear_adx_thresh': 22.28584224305494, 'bear_atr_min_pct': 0.026754974645863627, 'bear_atr_max_pct': 0.10879048975475736, 'bear_tp_mult': 2.125929816404721, 'bear_tsl_mult': 0.7290524053799476, 'bear_time_stop': 132, 'bear_use_sma': True, 'bear_use_ema': True, 'bear_use_atr': False, 'bear_use_adx': True, 'bear_use_spike': True, 'bear_rsi_required': True, 'sideways_strategy': 'breakout', 'sideways_bb_std_mult': 2.760927913885511, 'sideways_rsi_os': 8, 'sideways_rsi_ob': 70, 'sideways_adx_thresh': 28.135884886832415, 'sideways_atr_min_pct': 0.019266886376395766, 'sideways_atr_max_pct': 0.0978220773507525, 'sideways_tp_mult': 1.1147653098961006, 'sideways_tsl_mult': 0.30945861387659457, 'sideways_time_stop': 56, 'sideways_use_sma': True, 'sideways_use_ema': True, 'sideways_use_atr': False, 'sideways_use_adx': False, 'sideways_use_spike': True, 'sideways_rsi_required': False}.
[I 2025-08-31 10:44:02,334] Trial 652 finished with values: [-1000000000.0, 1000000000.0] and parameters: {'p_sma': 9, 'p_std': 50, 'p_atr': 30, 'p_adx': 10, 'rsi_period': 66, 'ema1': 18, 'ema2': 38, 'slip_atr_k': 0.1811706311391052, 'slip_spread_k': 0.09962252969900909, 'spread_hl_frac': 0.012707170416928093, 'bb_std_mult': 2.2066258227237214, 'rsi_os': 53, 'rsi_ob': 81, 'vol_spike': 0.20625565723266434, 'adx_thresh': 22.677638907327985, 'atr_min_pct': 0.011264321620003606, 'atr_max_pct': 0.08232146754823536, 'tp_mult': 2.885921015687098, 'tsl_mult': 0.5885452451439492, 'strategy': 'breakout', 'time_stop': 146, 'use_sma': False, 'use_atr': False, 'use_adx': True, 'use_ema': True, 'use_spike': True, 'rsi_required': True, 'edge_k': 1.8639656303371799, 'edge_cap': 0.18639007855317224, 'bull_strategy': 'mean_reversion', 'bull_bb_std_mult': 1.3432935414000422, 'bull_rsi_os': 27, 'bull_rsi_ob': 86, 'bull_adx_thresh': 14.784789312083696, 'bull_atr_min_pct': 0.008050564338544303, 'bull_atr_max_pct': 0.13354761755953104, 'bull_tp_mult': 2.220506794695322, 'bull_tsl_mult': 0.9828029590937316, 'bull_time_stop': 130, 'bull_use_sma': True, 'bull_use_ema': True, 'bull_use_atr': False, 'bull_use_adx': True, 'bull_use_spike': False, 'bull_rsi_required': True, 'bear_strategy': 'breakout', 'bear_bb_std_mult': 2.9214974235220046, 'bear_rsi_os': 40, 'bear_rsi_ob': 80, 'bear_adx_thresh': 21.71865064375531, 'bear_atr_min_pct': 0.008332558556757845, 'bear_atr_max_pct': 0.0293776728986134, 'bear_tp_mult': 2.0210477071201534, 'bear_tsl_mult': 0.470342467572453, 'bear_time_stop': 90, 'bear_use_sma': True, 'bear_use_ema': True, 'bear_use_atr': True, 'bear_use_adx': False, 'bear_use_spike': True, 'bear_rsi_required': True, 'sideways_strategy': 'breakout', 'sideways_bb_std_mult': 1.0386734830748132, 'sideways_rsi_os': 5, 'sideways_rsi_ob': 92, 'sideways_adx_thresh': 30.272376216587727, 'sideways_atr_min_pct': 0.01723601595188006, 'sideways_atr_max_pct': 0.09846653439348431, 'sideways_tp_mult': 2.931745303263712, 'sideways_tsl_mult': 0.29565012454015493, 'sideways_time_stop': 31, 'sideways_use_sma': False, 'sideways_use_ema': True, 'sideways_use_atr': False, 'sideways_use_adx': False, 'sideways_use_spike': True, 'sideways_rsi_required': False}.
[I 2025-08-31 10:44:34,625] Trial 656 finished with values: [-1000000000.0, 1000000000.0] and parameters: {'p_sma': 14, 'p_std': 46, 'p_atr': 30, 'p_adx': 9, 'rsi_period': 51, 'ema1': 18, 'ema2': 32, 'slip_atr_k': 0.11265880843473103, 'slip_spread_k': 0.13844981051541083, 'spread_hl_frac': 0.012849250413430383, 'bb_std_mult': 2.510176012085096, 'rsi_os': 39, 'rsi_ob': 85, 'vol_spike': 0.2590119631570063, 'adx_thresh': 25.919169131459764, 'atr_min_pct': 0.011133491010316332, 'atr_max_pct': 0.03694290395737008, 'tp_mult': 2.846848745338592, 'tsl_mult': 0.04139646282398246, 'strategy': 'mean_reversion', 'time_stop': 125, 'use_sma': True, 'use_atr': True, 'use_adx': False, 'use_ema': True, 'use_spike': False, 'rsi_required': True, 'edge_k': 1.8550627516519813, 'edge_cap': 0.4189783284535131, 'bull_strategy': 'breakout', 'bull_bb_std_mult': 2.4766447535319482, 'bull_rsi_os': 26, 'bull_rsi_ob': 67, 'bull_adx_thresh': 28.679390096554933, 'bull_atr_min_pct': 0.00748745231973974, 'bull_atr_max_pct': 0.09035088994867199, 'bull_tp_mult': 2.1188451109258772, 'bull_tsl_mult': 0.9367281947379239, 'bull_time_stop': 142, 'bull_use_sma': True, 'bull_use_ema': False, 'bull_use_atr': False, 'bull_use_adx': False, 'bull_use_spike': False, 'bull_rsi_required': True, 'bear_strategy': 'breakout', 'bear_bb_std_mult': 1.1215981855954622, 'bear_rsi_os': 30, 'bear_rsi_ob': 80, 'bear_adx_thresh': 21.92668288619914, 'bear_atr_min_pct': 0.007208199161833587, 'bear_atr_max_pct': 0.10787557812002109, 'bear_tp_mult': 2.1254414126869525, 'bear_tsl_mult': 0.377482195961104, 'bear_time_stop': 263, 'bear_use_sma': True, 'bear_use_ema': True, 'bear_use_atr': False, 'bear_use_adx': True, 'bear_use_spike': True, 'bear_rsi_required': False, 'sideways_strategy': 'mean_reversion', 'sideways_bb_std_mult': 0.8804989000882526, 'sideways_rsi_os': 24, 'sideways_rsi_ob': 89, 'sideways_adx_thresh': 30.467251556827502, 'sideways_atr_min_pct': 0.00820020611651294, 'sideways_atr_max_pct': 0.11100598964779554, 'sideways_tp_mult': 1.2369471917408643, 'sideways_tsl_mult': 0.004508619800886016, 'sideways_time_stop': 32, 'sideways_use_sma': True, 'sideways_use_ema': False, 'sideways_use_atr': False, 'sideways_use_adx': False, 'sideways_use_spike': True, 'sideways_rsi_required': True}.
