[I 2025-08-31 10:12:06,539] Trial 414 finished with values: [-1000000000.0, 1000000000.0] and parameters: {'p_sma': 50, 'p_std': 32, 'p_atr': 21, 'p_adx': 22, 'rsi_period': 54, 'ema1': 18, 'ema2': 38, 'slip_atr_k': 0.05612802288136935, 'slip_spread_k': 0.8913603527514562, 'spread_hl_frac': 0.013381394298747929, 'bb_std_mult': 1.0608970708413774, 'rsi_os': 7, 'rsi_ob': 49, 'vol_spike': 0.0935761017966397, 'adx_thresh': 20.41033382257817, 'atr_min_pct': 0.0015027705169440957, 'atr_max_pct': 0.03260018383373429, 'tp_mult': 2.9591931864676813, 'tsl_mult': 0.052484878711131076, 'strategy': 'breakout', 'time_stop': 196, 'use_sma': True, 'use_atr': True, 'use_adx': True, 'use_ema': False, 'use_spike': True, 'rsi_required': True, 'edge_k': 1.370315179923637, 'edge_cap': 0.12284158820878496, 'bull_strategy': 'breakout', 'bull_bb_std_mult': 2.04652534929047, 'bull_rsi_os': 29, 'bull_rsi_ob': 63, 'bull_adx_thresh': 30.25663335549708, 'bull_atr_min_pct': 0.018220898051032712, 'bull_atr_max_pct': 0.14010077454657788, 'bull_tp_mult': 1.5223511654035238, 'bull_tsl_mult': 0.5354464811653905, 'bull_time_stop': 129, 'bull_use_sma': False, 'bull_use_ema': False, 'bull_use_atr': False, 'bull_use_adx': True, 'bull_use_spike': True, 'bull_rsi_required': True, 'bear_strategy': 'mean_reversion', 'bear_bb_std_mult': 2.293739932086787, 'bear_rsi_os': 54, 'bear_rsi_ob': 53, 'bear_adx_thresh': 22.792895452401833, 'bear_atr_min_pct': 0.024323502277039347, 'bear_atr_max_pct': 0.1443439391922324, 'bear_tp_mult': 2.1321062445329697, 'bear_tsl_mult': 0.5166269462860866, 'bear_time_stop': 254, 'bear_use_sma': False, 'bear_use_ema': True, 'bear_use_atr': False, 'bear_use_adx': False, 'bear_use_spike': False, 'bear_rsi_required': False, 'sideways_strategy': 'mean_reversion', 'sideways_bb_std_mult': 2.0776571472935035, 'sideways_rsi_os': 10, 'sideways_rsi_ob': 63, 'sideways_adx_thresh': 30.987054419533184, 'sideways_atr_min_pct': 0.0015743818193719233, 'sideways_atr_max_pct': 0.06536552575396933, 'sideways_tp_mult': 1.5358575345854688, 'sideways_tsl_mult': 0.021910815101039385, 'sideways_time_stop': 243, 'sideways_use_sma': True, 'sideways_use_ema': True, 'sideways_use_atr': True, 'sideways_use_adx': True, 'sideways_use_spike': False, 'sideways_rsi_required': True}.
[I 2025-08-31 10:12:10,915] Trial 415 finished with values: [-1000000000.0, 1000000000.0] and parameters: {'p_sma': 22, 'p_std': 29, 'p_atr': 8, 'p_adx': 29, 'rsi_period': 19, 'ema1': 22, 'ema2': 41, 'slip_atr_k': 0.15599996970032606, 'slip_spread_k': 0.15516838730635601, 'spread_hl_frac': 0.013394142709180034, 'bb_std_mult': 1.0554889564485674, 'rsi_os': 20, 'rsi_ob': 50, 'vol_spike': 0.09203766278888509, 'adx_thresh': 6.594106083218707, 'atr_min_pct': 0.004313074207705655, 'atr_max_pct': 0.12759272761965412, 'tp_mult': 2.9262431999659766, 'tsl_mult': 0.16710572706952526, 'strategy': 'breakout', 'time_stop': 231, 'use_sma': True, 'use_atr': True, 'use_adx': False, 'use_ema': False, 'use_spike': True, 'rsi_required': True, 'edge_k': 0.282589306251288, 'edge_cap': 0.22249914482551014, 'bull_strategy': 'breakout', 'bull_bb_std_mult': 3.160535101860961, 'bull_rsi_os': 29, 'bull_rsi_ob': 68, 'bull_adx_thresh': 14.653728795245701, 'bull_atr_min_pct': 0.018094292158914723, 'bull_atr_max_pct': 0.10508906159888845, 'bull_tp_mult': 1.3677708332397136, 'bull_tsl_mult': 0.509269157177058, 'bull_time_stop': 248, 'bull_use_sma': False, 'bull_use_ema': False, 'bull_use_atr': False, 'bull_use_adx': True, 'bull_use_spike': True, 'bull_rsi_required': True, 'bear_strategy': 'mean_reversion', 'bear_bb_std_mult': 2.8579643393606435, 'bear_rsi_os': 36, 'bear_rsi_ob': 76, 'bear_adx_thresh': 22.64897425972944, 'bear_atr_min_pct': 0.02124761299862012, 'bear_atr_max_pct': 0.14540875764510466, 'bear_tp_mult': 2.632238689382852, 'bear_tsl_mult': 0.5067418145466487, 'bear_time_stop': 131, 'bear_use_sma': False, 'bear_use_ema': True, 'bear_use_atr': False, 'bear_use_adx': False, 'bear_use_spike': False, 'bear_rsi_required': False, 'sideways_strategy': 'mean_reversion', 'sideways_bb_std_mult': 1.0362125664026411, 'sideways_rsi_os': 29, 'sideways_rsi_ob': 49, 'sideways_adx_thresh': 31.794923980590433, 'sideways_atr_min_pct': 0.005420257872036604, 'sideways_atr_max_pct': 0.030634191146191755, 'sideways_tp_mult': 1.9001358475690187, 'sideways_tsl_mult': 0.02308936308379675, 'sideways_time_stop': 242, 'sideways_use_sma': True, 'sideways_use_ema': True, 'sideways_use_atr': True, 'sideways_use_adx': True, 'sideways_use_spike': False, 'sideways_rsi_required': True}.
[I 2025-08-31 10:12:11,245] Trial 417 finished with values: [-1000000000.0, 1000000000.0] and parameters: {'p_sma': 43, 'p_std': 14, 'p_atr': 29, 'p_adx': 8, 'rsi_period': 71, 'ema1': 21, 'ema2': 41, 'slip_atr_k': 0.15298605186616285, 'slip_spread_k': 0.06402802060647078, 'spread_hl_frac': 0.013576930663970158, 'bb_std_mult': 1.0385066320607195, 'rsi_os': 27, 'rsi_ob': 47, 'vol_spike': 0.09255557318876363, 'adx_thresh': 6.859849232310301, 'atr_min_pct': 0.011019544489724701, 'atr_max_pct': 0.010273961698084005, 'tp_mult': 2.978798165869896, 'tsl_mult': 0.5662199651125681, 'strategy': 'breakout', 'time_stop': 77, 'use_sma': True, 'use_atr': True, 'use_adx': False, 'use_ema': False, 'use_spike': True, 'rsi_required': True, 'edge_k': 1.9127110283806528, 'edge_cap': 0.38758744776538234, 'bull_strategy': 'breakout', 'bull_bb_std_mult': 2.5281371515069053, 'bull_rsi_os': 30, 'bull_rsi_ob': 68, 'bull_adx_thresh': 31.009069104985368, 'bull_atr_min_pct': 0.020748251631474833, 'bull_atr_max_pct': 0.11590350508136471, 'bull_tp_mult': 1.362753643007855, 'bull_tsl_mult': 0.5469976907097296, 'bull_time_stop': 125, 'bull_use_sma': False, 'bull_use_ema': False, 'bull_use_atr': False, 'bull_use_adx': True, 'bull_use_spike': True, 'bull_rsi_required': True, 'bear_strategy': 'mean_reversion', 'bear_bb_std_mult': 3.5982320560739582, 'bear_rsi_os': 50, 'bear_rsi_ob': 79, 'bear_adx_thresh': 20.96677175706627, 'bear_atr_min_pct': 0.021196711652762348, 'bear_atr_max_pct': 0.030567936642127508, 'bear_tp_mult': 1.589630054929381, 'bear_tsl_mult': 0.5176266998662353, 'bear_time_stop': 269, 'bear_use_sma': False, 'bear_use_ema': True, 'bear_use_atr': False, 'bear_use_adx': False, 'bear_use_spike': True, 'bear_rsi_required': False, 'sideways_strategy': 'mean_reversion', 'sideways_bb_std_mult': 0.7254000796077971, 'sideways_rsi_os': 29, 'sideways_rsi_ob': 66, 'sideways_adx_thresh': 30.735547502876514, 'sideways_atr_min_pct': 0.0016630660490003545, 'sideways_atr_max_pct': 0.08598702186106556, 'sideways_tp_mult': 1.5007977827484507, 'sideways_tsl_mult': 0.05446545118774813, 'sideways_time_stop': 215, 'sideways_use_sma': True, 'sideways_use_ema': True, 'sideways_use_atr': True, 'sideways_use_adx': True, 'sideways_use_spike': False, 'sideways_rsi_required': True}.
[I 2025-08-31 10:12:31,101] Trial 416 finished with values: [-1000000000.0, 1000000000.0] and parameters: {'p_sma': 21, 'p_std': 6, 'p_atr': 8, 'p_adx': 10, 'rsi_period': 64, 'ema1': 17, 'ema2': 35, 'slip_atr_k': 0.06657799276151541, 'slip_spread_k': 0.5366206648628191, 'spread_hl_frac': 0.013069936080806616, 'bb_std_mult': 2.2487586593758513, 'rsi_os': 21, 'rsi_ob': 47, 'vol_spike': 0.1490306214713757, 'adx_thresh': 20.593499439184576, 'atr_min_pct': 0.011665892163826692, 'atr_max_pct': 0.12776140819097365, 'tp_mult': 2.973946397143703, 'tsl_mult': 0.04927199053351378, 'strategy': 'breakout', 'time_stop': 196, 'use_sma': True, 'use_atr': True, 'use_adx': True, 'use_ema': False, 'use_spike': True, 'rsi_required': True, 'edge_k': 1.9943088742708361, 'edge_cap': 0.22215900903254826, 'bull_strategy': 'breakout', 'bull_bb_std_mult': 2.5307938124246943, 'bull_rsi_os': 17, 'bull_rsi_ob': 63, 'bull_adx_thresh': 30.303443321579227, 'bull_atr_min_pct': 0.015053034882394225, 'bull_atr_max_pct': 0.11560164959795141, 'bull_tp_mult': 1.2026328493132, 'bull_tsl_mult': 0.783358247609315, 'bull_time_stop': 300, 'bull_use_sma': False, 'bull_use_ema': False, 'bull_use_atr': False, 'bull_use_adx': True, 'bull_use_spike': True, 'bull_rsi_required': True, 'bear_strategy': 'mean_reversion', 'bear_bb_std_mult': 2.848528448097045, 'bear_rsi_os': 50, 'bear_rsi_ob': 76, 'bear_adx_thresh': 22.51454480336779, 'bear_atr_min_pct': 0.021232356469143454, 'bear_atr_max_pct': 0.14504886584293938, 'bear_tp_mult': 1.3282151619355576, 'bear_tsl_mult': 0.6519275143535224, 'bear_time_stop': 255, 'bear_use_sma': False, 'bear_use_ema': True, 'bear_use_atr': False, 'bear_use_adx': False, 'bear_use_spike': False, 'bear_rsi_required': False, 'sideways_strategy': 'mean_reversion', 'sideways_bb_std_mult': 0.8831448868157249, 'sideways_rsi_os': 21, 'sideways_rsi_ob': 66, 'sideways_adx_thresh': 31.425155455891996, 'sideways_atr_min_pct': 0.001667144101106851, 'sideways_atr_max_pct': 0.08452844814323128, 'sideways_tp_mult': 1.5104131859671135, 'sideways_tsl_mult': 0.026731237958231367, 'sideways_time_stop': 214, 'sideways_use_sma': True, 'sideways_use_ema': True, 'sideways_use_atr': True, 'sideways_use_adx': True, 'sideways_use_spike': False, 'sideways_rsi_required': True}.
[I 2025-08-31 10:12:36,926] Trial 418 finished with values: [-1000000000.0, 1000000000.0] and parameters: {'p_sma': 22, 'p_std': 27, 'p_atr': 8, 'p_adx': 29, 'rsi_period': 18, 'ema1': 21, 'ema2': 30, 'slip_atr_k': 0.1542650242568285, 'slip_spread_k': 0.37868378695961313, 'spread_hl_frac': 0.011294560719190331, 'bb_std_mult': 0.897467785802757, 'rsi_os': 22, 'rsi_ob': 47, 'vol_spike': 0.12703013419824868, 'adx_thresh': 6.834690741515312, 'atr_min_pct': 0.011710312033093868, 'atr_max_pct': 0.13081956148706422, 'tp_mult': 2.7840199965562364, 'tsl_mult': 0.10429791457310111, 'strategy': 'breakout', 'time_stop': 118, 'use_sma': False, 'use_atr': True, 'use_adx': False, 'use_ema': False, 'use_spike': True, 'rsi_required': True, 'edge_k': 0.13110319236505874, 'edge_cap': 0.6823721527932425, 'bull_strategy': 'mean_reversion', 'bull_bb_std_mult': 2.654771544030475, 'bull_rsi_os': 33, 'bull_rsi_ob': 72, 'bull_adx_thresh': 33.502340670916, 'bull_atr_min_pct': 0.020970139736514883, 'bull_atr_max_pct': 0.11595907641696333, 'bull_tp_mult': 1.3862084909465633, 'bull_tsl_mult': 0.6298094167280334, 'bull_time_stop': 149, 'bull_use_sma': True, 'bull_use_ema': False, 'bull_use_atr': False, 'bull_use_adx': False, 'bull_use_spike': False, 'bull_rsi_required': True, 'bear_strategy': 'breakout', 'bear_bb_std_mult': 2.8428131951792017, 'bear_rsi_os': 55, 'bear_rsi_ob': 77, 'bear_adx_thresh': 20.924302385511854, 'bear_atr_min_pct': 0.02085751953349983, 'bear_atr_max_pct': 0.06356447133003099, 'bear_tp_mult': 1.2105583034498526, 'bear_tsl_mult': 0.4994565795585804, 'bear_time_stop': 129, 'bear_use_sma': False, 'bear_use_ema': True, 'bear_use_atr': False, 'bear_use_adx': False, 'bear_use_spike': True, 'bear_rsi_required': False, 'sideways_strategy': 'mean_reversion', 'sideways_bb_std_mult': 0.7438545136338282, 'sideways_rsi_os': 31, 'sideways_rsi_ob': 66, 'sideways_adx_thresh': 13.358908620080356, 'sideways_atr_min_pct': 0.0018798860766257128, 'sideways_atr_max_pct': 0.03037321605146909, 'sideways_tp_mult': 1.084343559635599, 'sideways_tsl_mult': 0.6672776066344878, 'sideways_time_stop': 223, 'sideways_use_sma': True, 'sideways_use_ema': True, 'sideways_use_atr': False, 'sideways_use_adx': False, 'sideways_use_spike': False, 'sideways_rsi_required': True}.
[I 2025-08-31 10:12:41,482] Trial 419 finished with values: [-1000000000.0, 1000000000.0] and parameters: {'p_sma': 44, 'p_std': 38, 'p_atr': 29, 'p_adx': 13, 'rsi_period': 71, 'ema1': 21, 'ema2': 57, 'slip_atr_k': 0.0855244771585987, 'slip_spread_k': 0.7630831277390406, 'spread_hl_frac': 0.048116218759315973, 'bb_std_mult': 0.8906197155681913, 'rsi_os': 23, 'rsi_ob': 47, 'vol_spike': 0.12871813183360759, 'adx_thresh': 32.548540716628544, 'atr_min_pct': 0.01094035316554958, 'atr_max_pct': 0.13282466894744477, 'tp_mult': 1.7613272723208717, 'tsl_mult': 9.18578355340211e-05, 'strategy': 'breakout', 'time_stop': 77, 'use_sma': False, 'use_atr': False, 'use_adx': False, 'use_ema': False, 'use_spike': False, 'rsi_required': True, 'edge_k': 1.994198082237856, 'edge_cap': 0.4256603405692294, 'bull_strategy': 'mean_reversion', 'bull_bb_std_mult': 1.2186389879249704, 'bull_rsi_os': 33, 'bull_rsi_ob': 64, 'bull_adx_thresh': 31.032662088171932, 'bull_atr_min_pct': 0.02068740242029432, 'bull_atr_max_pct': 0.1153061436493617, 'bull_tp_mult': 1.46873160189471, 'bull_tsl_mult': 0.6343946970741564, 'bull_time_stop': 96, 'bull_use_sma': True, 'bull_use_ema': False, 'bull_use_atr': False, 'bull_use_adx': False, 'bull_use_spike': False, 'bull_rsi_required': True, 'bear_strategy': 'breakout', 'bear_bb_std_mult': 2.79074978015492, 'bear_rsi_os': 55, 'bear_rsi_ob': 77, 'bear_adx_thresh': 13.22592703684375, 'bear_atr_min_pct': 0.022276037859158555, 'bear_atr_max_pct': 0.030938449124631513, 'bear_tp_mult': 1.563859902092433, 'bear_tsl_mult': 0.5543599093628082, 'bear_time_stop': 245, 'bear_use_sma': False, 'bear_use_ema': True, 'bear_use_atr': False, 'bear_use_adx': True, 'bear_use_spike': True, 'bear_rsi_required': True, 'sideways_strategy': 'breakout', 'sideways_bb_std_mult': 1.1007564249940947, 'sideways_rsi_os': 15, 'sideways_rsi_ob': 76, 'sideways_adx_thresh': 13.637062839450781, 'sideways_atr_min_pct': 0.0009952374999065662, 'sideways_atr_max_pct': 0.03711675066867076, 'sideways_tp_mult': 1.4999209134590785, 'sideways_tsl_mult': 0.05770670695115802, 'sideways_time_stop': 226, 'sideways_use_sma': True, 'sideways_use_ema': True, 'sideways_use_atr': False, 'sideways_use_adx': False, 'sideways_use_spike': True, 'sideways_rsi_required': False}.
[I 2025-08-31 10:12:43,602] Trial 420 finished with values: [-1000000000.0, 1000000000.0] and parameters: {'p_sma': 21, 'p_std': 43, 'p_atr': 30, 'p_adx': 10, 'rsi_period': 24, 'ema1': 17, 'ema2': 35, 'slip_atr_k': 0.06802211393980259, 'slip_spread_k': 0.3756142983788497, 'spread_hl_frac': 0.011283561163514795, 'bb_std_mult': 3.2454811893363678, 'rsi_os': 5, 'rsi_ob': 82, 'vol_spike': 0.12816157123078176, 'adx_thresh': 7.5017425153206005, 'atr_min_pct': 0.023954756789483656, 'atr_max_pct': 0.14648345546559385, 'tp_mult': 2.8413507000929368, 'tsl_mult': 0.0005270551111354318, 'strategy': 'breakout', 'time_stop': 58, 'use_sma': False, 'use_atr': False, 'use_adx': False, 'use_ema': False, 'use_spike': False, 'rsi_required': True, 'edge_k': 1.7202422093140814, 'edge_cap': 0.4121900853153974, 'bull_strategy': 'mean_reversion', 'bull_bb_std_mult': 1.1960923867902125, 'bull_rsi_os': 52, 'bull_rsi_ob': 64, 'bull_adx_thresh': 26.32594847028514, 'bull_atr_min_pct': 0.019160236532495465, 'bull_atr_max_pct': 0.07262107042919078, 'bull_tp_mult': 1.1896006373900672, 'bull_tsl_mult': 0.5871894424437276, 'bull_time_stop': 154, 'bull_use_sma': True, 'bull_use_ema': False, 'bull_use_atr': False, 'bull_use_adx': False, 'bull_use_spike': False, 'bull_rsi_required': True, 'bear_strategy': 'breakout', 'bear_bb_std_mult': 2.810083754216923, 'bear_rsi_os': 24, 'bear_rsi_ob': 83, 'bear_adx_thresh': 7.917324745375531, 'bear_atr_min_pct': 0.020546574611623708, 'bear_atr_max_pct': 0.062373202025388555, 'bear_tp_mult': 2.7561818009424854, 'bear_tsl_mult': 0.3927229282972255, 'bear_time_stop': 245, 'bear_use_sma': False, 'bear_use_ema': True, 'bear_use_atr': False, 'bear_use_adx': True, 'bear_use_spike': False, 'bear_rsi_required': True, 'sideways_strategy': 'breakout', 'sideways_bb_std_mult': 0.8923166349992142, 'sideways_rsi_os': 45, 'sideways_rsi_ob': 62, 'sideways_adx_thresh': 33.95498286061152, 'sideways_atr_min_pct': 0.01695273602959164, 'sideways_atr_max_pct': 0.03754515046221352, 'sideways_tp_mult': 1.0952291382143389, 'sideways_tsl_mult': 0.08056550322338671, 'sideways_time_stop': 225, 'sideways_use_sma': True, 'sideways_use_ema': True, 'sideways_use_atr': False, 'sideways_use_adx': False, 'sideways_use_spike': True, 'sideways_rsi_required': False}.
[I 2025-08-31 10:13:12,246] Trial 421 finished with values: [-1000000000.0, 1000000000.0] and parameters: {'p_sma': 16, 'p_std': 41, 'p_atr': 20, 'p_adx': 8, 'rsi_period': 24, 'ema1': 21, 'ema2': 40, 'slip_atr_k': 0.1040766135004543, 'slip_spread_k': 0.3702837719350767, 'spread_hl_frac': 0.0480085941925156, 'bb_std_mult': 3.2548128287958114, 'rsi_os': 54, 'rsi_ob': 61, 'vol_spike': 0.14027433867271474, 'adx_thresh': 7.941587888043275, 'atr_min_pct': 0.01410599398960758, 'atr_max_pct': 0.04153400145927414, 'tp_mult': 1.285739972610786, 'tsl_mult': 0.024806042919925962, 'strategy': 'breakout', 'time_stop': 155, 'use_sma': False, 'use_atr': False, 'use_adx': False, 'use_ema': True, 'use_spike': False, 'rsi_required': True, 'edge_k': 1.7150786058630192, 'edge_cap': 0.4258440665258067, 'bull_strategy': 'mean_reversion', 'bull_bb_std_mult': 1.2065335610846535, 'bull_rsi_os': 33, 'bull_rsi_ob': 64, 'bull_adx_thresh': 34.145538939519085, 'bull_atr_min_pct': 0.017289648898699186, 'bull_atr_max_pct': 0.02212825109737876, 'bull_tp_mult': 1.9049261519321377, 'bull_tsl_mult': 0.6351414342187671, 'bull_time_stop': 283, 'bull_use_sma': True, 'bull_use_ema': False, 'bull_use_atr': False, 'bull_use_adx': False, 'bull_use_spike': False, 'bull_rsi_required': True, 'bear_strategy': 'breakout', 'bear_bb_std_mult': 3.2259548039901267, 'bear_rsi_os': 6, 'bear_rsi_ob': 83, 'bear_adx_thresh': 29.48191752500015, 'bear_atr_min_pct': 0.0028645834176537453, 'bear_atr_max_pct': 0.14941930275617427, 'bear_tp_mult': 1.199257104754959, 'bear_tsl_mult': 0.3911347582600864, 'bear_time_stop': 244, 'bear_use_sma': False, 'bear_use_ema': False, 'bear_use_atr': False, 'bear_use_adx': True, 'bear_use_spike': True, 'bear_rsi_required': True, 'sideways_strategy': 'breakout', 'sideways_bb_std_mult': 1.0660154244522093, 'sideways_rsi_os': 31, 'sideways_rsi_ob': 64, 'sideways_adx_thresh': 33.91281678382464, 'sideways_atr_min_pct': 0.009681148788136909, 'sideways_atr_max_pct': 0.07913477608741668, 'sideways_tp_mult': 1.6560298338627197, 'sideways_tsl_mult': 0.7919491173436053, 'sideways_time_stop': 223, 'sideways_use_sma': True, 'sideways_use_ema': False, 'sideways_use_atr': False, 'sideways_use_adx': False, 'sideways_use_spike': True, 'sideways_rsi_required': False}.
[I 2025-08-31 10:13:14,356] Trial 422 finished with values: [-0.10464063759331987, 0.10458468572570359] and parameters: {'p_sma': 53, 'p_std': 56, 'p_atr': 30, 'p_adx': 13, 'rsi_period': 24, 'ema1': 20, 'ema2': 57, 'slip_atr_k': 0.08231556727636173, 'slip_spread_k': 0.44386201396044683, 'spread_hl_frac': 0.04855539171748965, 'bb_std_mult': 1.7989661913609507, 'rsi_os': 23, 'rsi_ob': 61, 'vol_spike': 0.04205547913551494, 'adx_thresh': 7.833678336178062, 'atr_min_pct': 0.02023660916285127, 'atr_max_pct': 0.13192724887850218, 'tp_mult': 1.5417613521933597, 'tsl_mult': 0.017615218242114563, 'strategy': 'breakout', 'time_stop': 178, 'use_sma': False, 'use_atr': False, 'use_adx': False, 'use_ema': True, 'use_spike': False, 'rsi_required': False, 'edge_k': 1.8535709676699528, 'edge_cap': 0.9749468351568089, 'bull_strategy': 'mean_reversion', 'bull_bb_std_mult': 1.2021586788593595, 'bull_rsi_os': 11, 'bull_rsi_ob': 64, 'bull_adx_thresh': 30.931205057329098, 'bull_atr_min_pct': 0.020082862645318052, 'bull_atr_max_pct': 0.0742549500471855, 'bull_tp_mult': 1.4701697917305292, 'bull_tsl_mult': 0.3860834357826255, 'bull_time_stop': 257, 'bull_use_sma': True, 'bull_use_ema': False, 'bull_use_atr': False, 'bull_use_adx': False, 'bull_use_spike': False, 'bull_rsi_required': False, 'bear_strategy': 'breakout', 'bear_bb_std_mult': 2.0339447419562355, 'bear_rsi_os': 24, 'bear_rsi_ob': 83, 'bear_adx_thresh': 8.113817146305877, 'bear_atr_min_pct': 0.025819863317993196, 'bear_atr_max_pct': 0.13831532774249497, 'bear_tp_mult': 2.613103586849805, 'bear_tsl_mult': 0.5486601446408393, 'bear_time_stop': 243, 'bear_use_sma': True, 'bear_use_ema': False, 'bear_use_atr': True, 'bear_use_adx': True, 'bear_use_spike': False, 'bear_rsi_required': True, 'sideways_strategy': 'breakout', 'sideways_bb_std_mult': 1.0815361158322057, 'sideways_rsi_os': 41, 'sideways_rsi_ob': 62, 'sideways_adx_thresh': 32.28946958884005, 'sideways_atr_min_pct': 0.0008458882507985028, 'sideways_atr_max_pct': 0.038284380698676825, 'sideways_tp_mult': 1.6608097762747063, 'sideways_tsl_mult': 0.08373104261068043, 'sideways_time_stop': 288, 'sideways_use_sma': False, 'sideways_use_ema': False, 'sideways_use_atr': False, 'sideways_use_adx': False, 'sideways_use_spike': True, 'sideways_rsi_required': False}.
