[I 2025-08-31 09:23:59,814] Trial 38 finished with values: [-1000000000.0, 1000000000.0] and parameters: {'p_sma': 35, 'p_std': 36, 'p_atr': 9, 'p_adx': 30, 'rsi_period': 60, 'ema1': 20, 'ema2': 28, 'slip_atr_k': 0.19104920840075296, 'slip_spread_k': 0.4477603184892165, 'spread_hl_frac': 0.03448282170976588, 'bb_std_mult': 0.6730514585009071, 'rsi_os': 50, 'rsi_ob': 87, 'vol_spike': 0.04716250510458214, 'adx_thresh': 8.026143127420243, 'atr_min_pct': 0.02224377899777355, 'atr_max_pct': 0.01415636851483311, 'tp_mult': 2.7105812356997236, 'tsl_mult': 0.999253551658738, 'strategy': 'mean_reversion', 'time_stop': 182, 'use_sma': False, 'use_atr': False, 'use_adx': False, 'use_ema': True, 'use_spike': False, 'rsi_required': True, 'edge_k': 0.6780035795435437, 'edge_cap': 0.7744577743447417, 'bull_strategy': 'mean_reversion', 'bull_bb_std_mult': 2.7135153894448365, 'bull_rsi_os': 16, 'bull_rsi_ob': 53, 'bull_adx_thresh': 6.229814673071308, 'bull_atr_min_pct': 0.0008329760039737719, 'bull_atr_max_pct': 0.14932971812135612, 'bull_tp_mult': 2.6134420562034606, 'bull_tsl_mult': 0.3517628400217325, 'bull_time_stop': 230, 'bull_use_sma': True, 'bull_use_ema': True, 'bull_use_atr': True, 'bull_use_adx': False, 'bull_use_spike': False, 'bull_rsi_required': True, 'bear_strategy': 'breakout', 'bear_bb_std_mult': 1.7469817395972127, 'bear_rsi_os': 11, 'bear_rsi_ob': 70, 'bear_adx_thresh': 30.99711671194609, 'bear_atr_min_pct': 0.015078031893860495, 'bear_atr_max_pct': 0.10550969471847543, 'bear_tp_mult': 2.0384282736436323, 'bear_tsl_mult': 0.7501849191025964, 'bear_time_stop': 147, 'bear_use_sma': False, 'bear_use_ema': False, 'bear_use_atr': False, 'bear_use_adx': True, 'bear_use_spike': True, 'bear_rsi_required': True, 'sideways_strategy': 'breakout', 'sideways_bb_std_mult': 1.8264698961764416, 'sideways_rsi_os': 10, 'sideways_rsi_ob': 59, 'sideways_adx_thresh': 32.151082652690214, 'sideways_atr_min_pct': 0.019130247977335736, 'sideways_atr_max_pct': 0.1047004718049959, 'sideways_tp_mult': 1.1821246995619548, 'sideways_tsl_mult': 0.9289359800267268, 'sideways_time_stop': 220, 'sideways_use_sma': True, 'sideways_use_ema': True, 'sideways_use_atr': False, 'sideways_use_adx': False, 'sideways_use_spike': False, 'sideways_rsi_required': False}.
[I 2025-08-31 09:24:34,994] Trial 37 finished with values: [-1000000000.0, 1000000000.0] and parameters: {'p_sma': 21, 'p_std': 35, 'p_atr': 9, 'p_adx': 30, 'rsi_period': 20, 'ema1': 20, 'ema2': 40, 'slip_atr_k': 0.18467361738565782, 'slip_spread_k': 0.4678605854446095, 'spread_hl_frac': 0.03358049304063434, 'bb_std_mult': 0.7059129531093906, 'rsi_os': 51, 'rsi_ob': 87, 'vol_spike': 0.04587523948607987, 'adx_thresh': 20.430343603734904, 'atr_min_pct': 0.003249448596864414, 'atr_max_pct': 0.015948157534699983, 'tp_mult': 2.3124610161564187, 'tsl_mult': 0.975614663302754, 'strategy': 'breakout', 'time_stop': 275, 'use_sma': False, 'use_atr': False, 'use_adx': False, 'use_ema': True, 'use_spike': False, 'rsi_required': True, 'edge_k': 1.4359995680698332, 'edge_cap': 0.46966578321962293, 'bull_strategy': 'mean_reversion', 'bull_bb_std_mult': 2.694019702111428, 'bull_rsi_os': 18, 'bull_rsi_ob': 52, 'bull_adx_thresh': 5.865723923404635, 'bull_atr_min_pct': 0.02032118136293286, 'bull_atr_max_pct': 0.0280079934278903, 'bull_tp_mult': 2.618857095907476, 'bull_tsl_mult': 0.36320750094608456, 'bull_time_stop': 238, 'bull_use_sma': True, 'bull_use_ema': True, 'bull_use_atr': True, 'bull_use_adx': False, 'bull_use_spike': False, 'bull_rsi_required': True, 'bear_strategy': 'breakout', 'bear_bb_std_mult': 3.1440740966425205, 'bear_rsi_os': 35, 'bear_rsi_ob': 49, 'bear_adx_thresh': 30.76105675637396, 'bear_atr_min_pct': 0.01950444592077313, 'bear_atr_max_pct': 0.1354114969474156, 'bear_tp_mult': 2.058488457966416, 'bear_tsl_mult': 0.7661055549331752, 'bear_time_stop': 163, 'bear_use_sma': False, 'bear_use_ema': False, 'bear_use_atr': False, 'bear_use_adx': True, 'bear_use_spike': True, 'bear_rsi_required': True, 'sideways_strategy': 'breakout', 'sideways_bb_std_mult': 1.725188223398352, 'sideways_rsi_os': 50, 'sideways_rsi_ob': 60, 'sideways_adx_thresh': 32.571017412809915, 'sideways_atr_min_pct': 0.019032447895437926, 'sideways_atr_max_pct': 0.10411100477765954, 'sideways_tp_mult': 2.327177681908275, 'sideways_tsl_mult': 0.8977735913164939, 'sideways_time_stop': 216, 'sideways_use_sma': True, 'sideways_use_ema': True, 'sideways_use_atr': False, 'sideways_use_adx': False, 'sideways_use_spike': False, 'sideways_rsi_required': False}.
[I 2025-08-31 09:24:35,852] Trial 40 finished with values: [-0.16543102702261026, 0.16535071509513458] and parameters: {'p_sma': 28, 'p_std': 57, 'p_atr': 28, 'p_adx': 10, 'rsi_period': 17, 'ema1': 17, 'ema2': 18, 'slip_atr_k': 0.03306933724014971, 'slip_spread_k': 0.8153347986459096, 'spread_hl_frac': 0.0014362726119994847, 'bb_std_mult': 2.5917705739672408, 'rsi_os': 28, 'rsi_ob': 53, 'vol_spike': 0.21409672600319474, 'adx_thresh': 25.25065569128123, 'atr_min_pct': 0.01526790757470847, 'atr_max_pct': 0.06482038865517176, 'tp_mult': 2.6982999548535824, 'tsl_mult': 0.10930135927782303, 'strategy': 'mean_reversion', 'time_stop': 224, 'use_sma': False, 'use_atr': True, 'use_adx': False, 'use_ema': True, 'use_spike': True, 'rsi_required': True, 'edge_k': 1.4186173873183263, 'edge_cap': 0.4770849877062539, 'bull_strategy': 'mean_reversion', 'bull_bb_std_mult': 3.58868779217714, 'bull_rsi_os': 26, 'bull_rsi_ob': 80, 'bull_adx_thresh': 32.319697932133295, 'bull_atr_min_pct': 0.02924486492545044, 'bull_atr_max_pct': 0.029907045035078017, 'bull_tp_mult': 2.0071762806564672, 'bull_tsl_mult': 0.5231919978458547, 'bull_time_stop': 254, 'bull_use_sma': True, 'bull_use_ema': True, 'bull_use_atr': True, 'bull_use_adx': False, 'bull_use_spike': False, 'bull_rsi_required': False, 'bear_strategy': 'breakout', 'bear_bb_std_mult': 1.328732179815836, 'bear_rsi_os': 51, 'bear_rsi_ob': 79, 'bear_adx_thresh': 24.532065531706998, 'bear_atr_min_pct': 0.016687750483572152, 'bear_atr_max_pct': 0.13843020453972452, 'bear_tp_mult': 2.74250085251545, 'bear_tsl_mult': 0.9917176835773918, 'bear_time_stop': 110, 'bear_use_sma': False, 'bear_use_ema': False, 'bear_use_atr': True, 'bear_use_adx': True, 'bear_use_spike': True, 'bear_rsi_required': False, 'sideways_strategy': 'breakout', 'sideways_bb_std_mult': 1.5340155839625915, 'sideways_rsi_os': 47, 'sideways_rsi_ob': 81, 'sideways_adx_thresh': 10.901960956876017, 'sideways_atr_min_pct': 0.00022768629939418257, 'sideways_atr_max_pct': 0.03706449329324596, 'sideways_tp_mult': 1.6132851654627063, 'sideways_tsl_mult': 0.48666425537909713, 'sideways_time_stop': 42, 'sideways_use_sma': False, 'sideways_use_ema': False, 'sideways_use_atr': False, 'sideways_use_adx': False, 'sideways_use_spike': True, 'sideways_rsi_required': False}.
[I 2025-08-31 09:24:36,128] Trial 39 finished with values: [-0.23752131536721866, 0.2374006958437054] and parameters: {'p_sma': 34, 'p_std': 35, 'p_atr': 9, 'p_adx': 10, 'rsi_period': 17, 'ema1': 16, 'ema2': 17, 'slip_atr_k': 0.18818090947593394, 'slip_spread_k': 0.8553734665383113, 'spread_hl_frac': 0.03594205492329122, 'bb_std_mult': 2.692221634333784, 'rsi_os': 9, 'rsi_ob': 52, 'vol_spike': 0.050074623021096165, 'adx_thresh': 25.23062180853467, 'atr_min_pct': 0.015502377847880609, 'atr_max_pct': 0.06355799001479231, 'tp_mult': 2.7681728405552066, 'tsl_mult': 0.26999386229112676, 'strategy': 'mean_reversion', 'time_stop': 180, 'use_sma': False, 'use_atr': False, 'use_adx': False, 'use_ema': True, 'use_spike': True, 'rsi_required': True, 'edge_k': 0.6864211617146385, 'edge_cap': 0.7652687696039802, 'bull_strategy': 'mean_reversion', 'bull_bb_std_mult': 3.552207845922333, 'bull_rsi_os': 16, 'bull_rsi_ob': 80, 'bull_adx_thresh': 31.628899843046526, 'bull_atr_min_pct': 0.0003419284760345191, 'bull_atr_max_pct': 0.028899669701968403, 'bull_tp_mult': 2.6544091817063213, 'bull_tsl_mult': 0.5566730670474268, 'bull_time_stop': 235, 'bull_use_sma': True, 'bull_use_ema': True, 'bull_use_atr': True, 'bull_use_adx': False, 'bull_use_spike': False, 'bull_rsi_required': False, 'bear_strategy': 'breakout', 'bear_bb_std_mult': 1.3314110036506157, 'bear_rsi_os': 26, 'bear_rsi_ob': 70, 'bear_adx_thresh': 22.934279497177403, 'bear_atr_min_pct': 0.016251302459646393, 'bear_atr_max_pct': 0.1025722478563595, 'bear_tp_mult': 2.033369628233711, 'bear_tsl_mult': 0.7178284759770056, 'bear_time_stop': 153, 'bear_use_sma': False, 'bear_use_ema': False, 'bear_use_atr': False, 'bear_use_adx': True, 'bear_use_spike': True, 'bear_rsi_required': True, 'sideways_strategy': 'breakout', 'sideways_bb_std_mult': 1.7483781436972263, 'sideways_rsi_os': 48, 'sideways_rsi_ob': 81, 'sideways_adx_thresh': 10.161920120355266, 'sideways_atr_min_pct': 5.6828339319737325e-05, 'sideways_atr_max_pct': 0.040725367911702864, 'sideways_tp_mult': 1.2296582281717638, 'sideways_tsl_mult': 0.5005409668969067, 'sideways_time_stop': 232, 'sideways_use_sma': True, 'sideways_use_ema': False, 'sideways_use_atr': False, 'sideways_use_adx': False, 'sideways_use_spike': True, 'sideways_rsi_required': False}.
[I 2025-08-31 09:24:36,285] Trial 36 finished with values: [-1000000000.0, 1000000000.0] and parameters: {'p_sma': 19, 'p_std': 35, 'p_atr': 25, 'p_adx': 11, 'rsi_period': 72, 'ema1': 17, 'ema2': 52, 'slip_atr_k': 0.03017638640162698, 'slip_spread_k': 0.44954575999122076, 'spread_hl_frac': 0.033904021879737886, 'bb_std_mult': 3.280448106147848, 'rsi_os': 47, 'rsi_ob': 88, 'vol_spike': 0.04581946865696762, 'adx_thresh': 25.440284811945233, 'atr_min_pct': 0.005020016507442403, 'atr_max_pct': 0.036792942533272664, 'tp_mult': 2.308562872585338, 'tsl_mult': 0.9996434584391941, 'strategy': 'breakout', 'time_stop': 173, 'use_sma': False, 'use_atr': False, 'use_adx': False, 'use_ema': True, 'use_spike': False, 'rsi_required': True, 'edge_k': 0.6797428857194184, 'edge_cap': 0.7367390437416719, 'bull_strategy': 'mean_reversion', 'bull_bb_std_mult': 2.699917048936992, 'bull_rsi_os': 16, 'bull_rsi_ob': 52, 'bull_adx_thresh': 31.362948120274, 'bull_atr_min_pct': 0.019549007488250336, 'bull_atr_max_pct': 0.027935926514137066, 'bull_tp_mult': 2.33701876189912, 'bull_tsl_mult': 0.603561309584685, 'bull_time_stop': 246, 'bull_use_sma': False, 'bull_use_ema': True, 'bull_use_atr': False, 'bull_use_adx': False, 'bull_use_spike': False, 'bull_rsi_required': True, 'bear_strategy': 'breakout', 'bear_bb_std_mult': 3.180966192103371, 'bear_rsi_os': 42, 'bear_rsi_ob': 65, 'bear_adx_thresh': 31.037814165747072, 'bear_atr_min_pct': 0.01771743072919494, 'bear_atr_max_pct': 0.13498943110225403, 'bear_tp_mult': 2.4329962448618785, 'bear_tsl_mult': 0.7403118436522848, 'bear_time_stop': 154, 'bear_use_sma': False, 'bear_use_ema': False, 'bear_use_atr': False, 'bear_use_adx': False, 'bear_use_spike': True, 'bear_rsi_required': True, 'sideways_strategy': 'breakout', 'sideways_bb_std_mult': 0.8843622857248741, 'sideways_rsi_os': 50, 'sideways_rsi_ob': 61, 'sideways_adx_thresh': 26.059566396100063, 'sideways_atr_min_pct': 0.013859736835254625, 'sideways_atr_max_pct': 0.11156397727504994, 'sideways_tp_mult': 1.2060320368681432, 'sideways_tsl_mult': 0.9193884559620684, 'sideways_time_stop': 220, 'sideways_use_sma': True, 'sideways_use_ema': True, 'sideways_use_atr': False, 'sideways_use_adx': False, 'sideways_use_spike': True, 'sideways_rsi_required': False}.
[I 2025-08-31 09:24:36,633] Trial 44 finished with values: [-1000000000.0, 1000000000.0] and parameters: {'p_sma': 29, 'p_std': 56, 'p_atr': 28, 'p_adx': 9, 'rsi_period': 15, 'ema1': 17, 'ema2': 17, 'slip_atr_k': 0.0564126265333741, 'slip_spread_k': 0.857654604546557, 'spread_hl_frac': 0.002618019422808017, 'bb_std_mult': 2.6153296524847733, 'rsi_os': 27, 'rsi_ob': 50, 'vol_spike': 0.2139172296843064, 'adx_thresh': 25.070250351319277, 'atr_min_pct': 0.015627487467063012, 'atr_max_pct': 0.06914792356747576, 'tp_mult': 2.705161458294842, 'tsl_mult': 0.13340338296742632, 'strategy': 'mean_reversion', 'time_stop': 228, 'use_sma': False, 'use_atr': True, 'use_adx': False, 'use_ema': True, 'use_spike': True, 'rsi_required': True, 'edge_k': 1.7346125953388998, 'edge_cap': 0.31286469899369285, 'bull_strategy': 'mean_reversion', 'bull_bb_std_mult': 3.5947471707363086, 'bull_rsi_os': 34, 'bull_rsi_ob': 80, 'bull_adx_thresh': 32.15513569670051, 'bull_atr_min_pct': 0.029381809848980565, 'bull_atr_max_pct': 0.07532219542378502, 'bull_tp_mult': 2.044967222429545, 'bull_tsl_mult': 0.5274318092319247, 'bull_time_stop': 273, 'bull_use_sma': True, 'bull_use_ema': True, 'bull_use_atr': True, 'bull_use_adx': False, 'bull_use_spike': False, 'bull_rsi_required': False, 'bear_strategy': 'breakout', 'bear_bb_std_mult': 1.3537949414275163, 'bear_rsi_os': 51, 'bear_rsi_ob': 81, 'bear_adx_thresh': 24.786051978025004, 'bear_atr_min_pct': 0.013437678323064212, 'bear_atr_max_pct': 0.10280921055648619, 'bear_tp_mult': 2.7318490716756174, 'bear_tsl_mult': 0.9851114990192787, 'bear_time_stop': 114, 'bear_use_sma': False, 'bear_use_ema': False, 'bear_use_atr': True, 'bear_use_adx': True, 'bear_use_spike': True, 'bear_rsi_required': False, 'sideways_strategy': 'breakout', 'sideways_bb_std_mult': 1.4861266986338113, 'sideways_rsi_os': 45, 'sideways_rsi_ob': 82, 'sideways_adx_thresh': 10.117437447665889, 'sideways_atr_min_pct': 0.0008155954058394961, 'sideways_atr_max_pct': 0.043106115213982, 'sideways_tp_mult': 1.5730877607803364, 'sideways_tsl_mult': 0.4916996816271456, 'sideways_time_stop': 50, 'sideways_use_sma': False, 'sideways_use_ema': False, 'sideways_use_atr': False, 'sideways_use_adx': False, 'sideways_use_spike': True, 'sideways_rsi_required': False}.
[I 2025-08-31 09:25:11,905] Trial 43 finished with values: [-0.10592939926032396, 0.10584367493477653] and parameters: {'p_sma': 28, 'p_std': 48, 'p_atr': 28, 'p_adx': 9, 'rsi_period': 15, 'ema1': 17, 'ema2': 16, 'slip_atr_k': 0.031291436982391674, 'slip_spread_k': 0.8329446559712, 'spread_hl_frac': 0.0006951924193279328, 'bb_std_mult': 2.610838062840193, 'rsi_os': 29, 'rsi_ob': 52, 'vol_spike': 0.2121257654639835, 'adx_thresh': 25.362291717513752, 'atr_min_pct': 0.014586209642461961, 'atr_max_pct': 0.06257416547215389, 'tp_mult': 2.692563181545129, 'tsl_mult': 0.09890691359677567, 'strategy': 'mean_reversion', 'time_stop': 223, 'use_sma': False, 'use_atr': True, 'use_adx': False, 'use_ema': True, 'use_spike': True, 'rsi_required': True, 'edge_k': 1.7273082785428833, 'edge_cap': 0.3136494244908472, 'bull_strategy': 'mean_reversion', 'bull_bb_std_mult': 3.5985421417245367, 'bull_rsi_os': 26, 'bull_rsi_ob': 81, 'bull_adx_thresh': 31.268448968582533, 'bull_atr_min_pct': 0.029945734927556124, 'bull_atr_max_pct': 0.02509924560759316, 'bull_tp_mult': 2.0059676609153296, 'bull_tsl_mult': 0.5563241628881415, 'bull_time_stop': 271, 'bull_use_sma': True, 'bull_use_ema': True, 'bull_use_atr': True, 'bull_use_adx': False, 'bull_use_spike': False, 'bull_rsi_required': False, 'bear_strategy': 'breakout', 'bear_bb_std_mult': 1.3685462130543833, 'bear_rsi_os': 51, 'bear_rsi_ob': 79, 'bear_adx_thresh': 24.757676423993153, 'bear_atr_min_pct': 0.016927129529942308, 'bear_atr_max_pct': 0.14101751087432138, 'bear_tp_mult': 2.7457624130754326, 'bear_tsl_mult': 0.9919760223392879, 'bear_time_stop': 108, 'bear_use_sma': False, 'bear_use_ema': False, 'bear_use_atr': True, 'bear_use_adx': True, 'bear_use_spike': True, 'bear_rsi_required': False, 'sideways_strategy': 'breakout', 'sideways_bb_std_mult': 1.4762293781047897, 'sideways_rsi_os': 50, 'sideways_rsi_ob': 80, 'sideways_adx_thresh': 10.594917301742372, 'sideways_atr_min_pct': 0.0010143859818465932, 'sideways_atr_max_pct': 0.0384962396911151, 'sideways_tp_mult': 1.5989249715205087, 'sideways_tsl_mult': 0.5118092290403232, 'sideways_time_stop': 45, 'sideways_use_sma': False, 'sideways_use_ema': False, 'sideways_use_atr': False, 'sideways_use_adx': False, 'sideways_use_spike': True, 'sideways_rsi_required': False}.
[I 2025-08-31 09:25:12,178] Trial 41 finished with values: [-1000000000.0, 1000000000.0] and parameters: {'p_sma': 27, 'p_std': 57, 'p_atr': 7, 'p_adx': 10, 'rsi_period': 33, 'ema1': 16, 'ema2': 35, 'slip_atr_k': 0.22425479808912474, 'slip_spread_k': 0.5481333358269554, 'spread_hl_frac': 0.0017083388243990562, 'bb_std_mult': 2.048084977158885, 'rsi_os': 9, 'rsi_ob': 51, 'vol_spike': 0.2126516228164001, 'adx_thresh': 25.86641429355661, 'atr_min_pct': 0.014753689036314908, 'atr_max_pct': 0.07549284487418723, 'tp_mult': 1.7940961089392664, 'tsl_mult': 0.28891114046785216, 'strategy': 'mean_reversion', 'time_stop': 166, 'use_sma': False, 'use_atr': True, 'use_adx': False, 'use_ema': True, 'use_spike': True, 'rsi_required': False, 'edge_k': 1.4331701609935645, 'edge_cap': 0.3080949451139672, 'bull_strategy': 'breakout', 'bull_bb_std_mult': 3.5262380079571236, 'bull_rsi_os': 44, 'bull_rsi_ob': 78, 'bull_adx_thresh': 32.009734018122984, 'bull_atr_min_pct': 0.02980069895560733, 'bull_atr_max_pct': 0.05104140510925094, 'bull_tp_mult': 2.045707758195908, 'bull_tsl_mult': 0.5708930559995157, 'bull_time_stop': 136, 'bull_use_sma': True, 'bull_use_ema': True, 'bull_use_atr': True, 'bull_use_adx': False, 'bull_use_spike': True, 'bull_rsi_required': False, 'bear_strategy': 'breakout', 'bear_bb_std_mult': 1.2828002312172666, 'bear_rsi_os': 52, 'bear_rsi_ob': 79, 'bear_adx_thresh': 23.915244641307144, 'bear_atr_min_pct': 0.016632954587694277, 'bear_atr_max_pct': 0.10075556441021918, 'bear_tp_mult': 2.718254444167144, 'bear_tsl_mult': 0.9664492919449121, 'bear_time_stop': 123, 'bear_use_sma': False, 'bear_use_ema': False, 'bear_use_atr': True, 'bear_use_adx': True, 'bear_use_spike': True, 'bear_rsi_required': False, 'sideways_strategy': 'breakout', 'sideways_bb_std_mult': 1.2906922480897243, 'sideways_rsi_os': 49, 'sideways_rsi_ob': 80, 'sideways_adx_thresh': 24.912830255552414, 'sideways_atr_min_pct': 0.02801784443764494, 'sideways_atr_max_pct': 0.037345271979189625, 'sideways_tp_mult': 1.6522256505405992, 'sideways_tsl_mult': 0.4914858262134343, 'sideways_time_stop': 156, 'sideways_use_sma': False, 'sideways_use_ema': False, 'sideways_use_atr': False, 'sideways_use_adx': False, 'sideways_use_spike': True, 'sideways_rsi_required': False}.
[I 2025-08-31 09:25:12,643] Trial 45 finished with values: [-1000000000.0, 1000000000.0] and parameters: {'p_sma': 28, 'p_std': 56, 'p_atr': 29, 'p_adx': 9, 'rsi_period': 25, 'ema1': 16, 'ema2': 18, 'slip_atr_k': 0.029056943854383954, 'slip_spread_k': 0.5591684092674875, 'spread_hl_frac': 0.007513062116998029, 'bb_std_mult': 2.730527822286396, 'rsi_os': 28, 'rsi_ob': 55, 'vol_spike': 0.19478510764020263, 'adx_thresh': 21.956030511327107, 'atr_min_pct': 0.014718255838956222, 'atr_max_pct': 0.05878871861980098, 'tp_mult': 2.596344298476432, 'tsl_mult': 0.2771833131890672, 'strategy': 'mean_reversion', 'time_stop': 250, 'use_sma': False, 'use_atr': True, 'use_adx': False, 'use_ema': True, 'use_spike': True, 'rsi_required': True, 'edge_k': 1.3837065656474519, 'edge_cap': 0.3954074546408246, 'bull_strategy': 'mean_reversion', 'bull_bb_std_mult': 3.2370185010069887, 'bull_rsi_os': 26, 'bull_rsi_ob': 65, 'bull_adx_thresh': 28.16244609538155, 'bull_atr_min_pct': 0.02829974466056914, 'bull_atr_max_pct': 0.025058910134713553, 'bull_tp_mult': 1.4397508277716646, 'bull_tsl_mult': 0.4355443498508195, 'bull_time_stop': 259, 'bull_use_sma': True, 'bull_use_ema': True, 'bull_use_atr': True, 'bull_use_adx': False, 'bull_use_spike': False, 'bull_rsi_required': False, 'bear_strategy': 'breakout', 'bear_bb_std_mult': 1.3904836654138109, 'bear_rsi_os': 49, 'bear_rsi_ob': 79, 'bear_adx_thresh': 21.748888567381684, 'bear_atr_min_pct': 0.01575350443483247, 'bear_atr_max_pct': 0.1426844453979601, 'bear_tp_mult': 2.826520648411323, 'bear_tsl_mult': 0.9244159441996067, 'bear_time_stop': 98, 'bear_use_sma': False, 'bear_use_ema': False, 'bear_use_atr': True, 'bear_use_adx': True, 'bear_use_spike': True, 'bear_rsi_required': False, 'sideways_strategy': 'breakout', 'sideways_bb_std_mult': 1.2307298890411449, 'sideways_rsi_os': 49, 'sideways_rsi_ob': 80, 'sideways_adx_thresh': 7.413928144717179, 'sideways_atr_min_pct': 0.0028162128940975996, 'sideways_atr_max_pct': 0.036133199262785604, 'sideways_tp_mult': 1.8406957575144507, 'sideways_tsl_mult': 0.4936048160563773, 'sideways_time_stop': 36, 'sideways_use_sma': False, 'sideways_use_ema': False, 'sideways_use_atr': False, 'sideways_use_adx': False, 'sideways_use_spike': True, 'sideways_rsi_required': False}.
