[I 2025-08-31 09:44:18,867] Trial 179 finished with values: [-0.03906890055966683, 0.03896444884283053] and parameters: {'p_sma': 53, 'p_std': 13, 'p_atr': 22, 'p_adx': 9, 'rsi_period': 38, 'ema1': 11, 'ema2': 45, 'slip_atr_k': 0.010335875478424626, 'slip_spread_k': 0.41413303105135124, 'spread_hl_frac': 0.01425875675929146, 'bb_std_mult': 2.7642689988609686, 'rsi_os': 11, 'rsi_ob': 48, 'vol_spike': 0.12305160818354381, 'adx_thresh': 6.186106452176915, 'atr_min_pct': 0.015582106488169458, 'atr_max_pct': 0.12733281088431975, 'tp_mult': 1.095050800303923, 'tsl_mult': 0.25628935456692903, 'strategy': 'breakout', 'time_stop': 214, 'use_sma': False, 'use_atr': False, 'use_adx': False, 'use_ema': False, 'use_spike': False, 'rsi_required': True, 'edge_k': 1.5849260937639558, 'edge_cap': 0.5238958887498816, 'bull_strategy': 'mean_reversion', 'bull_bb_std_mult': 1.4386071157660911, 'bull_rsi_os': 24, 'bull_rsi_ob': 87, 'bull_adx_thresh': 27.981773924284326, 'bull_atr_min_pct': 0.019757424264049226, 'bull_atr_max_pct': 0.11782989834613593, 'bull_tp_mult': 1.7503169731639563, 'bull_tsl_mult': 0.7340352539364081, 'bull_time_stop': 186, 'bull_use_sma': True, 'bull_use_ema': False, 'bull_use_atr': False, 'bull_use_adx': False, 'bull_use_spike': False, 'bull_rsi_required': True, 'bear_strategy': 'breakout', 'bear_bb_std_mult': 3.4098289742542764, 'bear_rsi_os': 46, 'bear_rsi_ob': 50, 'bear_adx_thresh': 20.91928508760626, 'bear_atr_min_pct': 0.029053352760450495, 'bear_atr_max_pct': 0.14216782957244364, 'bear_tp_mult': 2.498614732652353, 'bear_tsl_mult': 0.5071047416952282, 'bear_time_stop': 238, 'bear_use_sma': False, 'bear_use_ema': False, 'bear_use_atr': False, 'bear_use_adx': True, 'bear_use_spike': True, 'bear_rsi_required': True, 'sideways_strategy': 'breakout', 'sideways_bb_std_mult': 2.646978782582352, 'sideways_rsi_os': 41, 'sideways_rsi_ob': 76, 'sideways_adx_thresh': 14.71585254638454, 'sideways_atr_min_pct': 0.0018522910642029436, 'sideways_atr_max_pct': 0.11168617193848354, 'sideways_tp_mult': 1.9732297511165584, 'sideways_tsl_mult': 0.7761030808450029, 'sideways_time_stop': 31, 'sideways_use_sma': True, 'sideways_use_ema': True, 'sideways_use_atr': False, 'sideways_use_adx': False, 'sideways_use_spike': False, 'sideways_rsi_required': False}.
[I 2025-08-31 09:44:19,051] Trial 178 finished with values: [-1000000000.0, 1000000000.0] and parameters: {'p_sma': 54, 'p_std': 13, 'p_atr': 29, 'p_adx': 9, 'rsi_period': 21, 'ema1': 24, 'ema2': 43, 'slip_atr_k': 0.01033403026729087, 'slip_spread_k': 0.4132586482184601, 'spread_hl_frac': 0.04972829089427849, 'bb_std_mult': 2.892061832084541, 'rsi_os': 26, 'rsi_ob': 95, 'vol_spike': 0.28801074434552043, 'adx_thresh': 28.50597729347114, 'atr_min_pct': 0.020592408733960926, 'atr_max_pct': 0.0625322565453745, 'tp_mult': 2.0448878246239697, 'tsl_mult': 0.24937638298889658, 'strategy': 'breakout', 'time_stop': 106, 'use_sma': False, 'use_atr': False, 'use_adx': False, 'use_ema': True, 'use_spike': True, 'rsi_required': True, 'edge_k': 0.1819152856629922, 'edge_cap': 0.11171304502259065, 'bull_strategy': 'mean_reversion', 'bull_bb_std_mult': 1.4498489138299682, 'bull_rsi_os': 32, 'bull_rsi_ob': 61, 'bull_adx_thresh': 18.572249188011785, 'bull_atr_min_pct': 0.018133773078325147, 'bull_atr_max_pct': 0.11806313660370973, 'bull_tp_mult': 2.812334952482329, 'bull_tsl_mult': 0.5556979968097735, 'bull_time_stop': 176, 'bull_use_sma': True, 'bull_use_ema': False, 'bull_use_atr': False, 'bull_use_adx': False, 'bull_use_spike': False, 'bull_rsi_required': True, 'bear_strategy': 'breakout', 'bear_bb_std_mult': 2.749166369696859, 'bear_rsi_os': 43, 'bear_rsi_ob': 49, 'bear_adx_thresh': 19.934065622743844, 'bear_atr_min_pct': 0.022625886941603626, 'bear_atr_max_pct': 0.018678279344965, 'bear_tp_mult': 1.3571124992687429, 'bear_tsl_mult': 0.8422721469704206, 'bear_time_stop': 195, 'bear_use_sma': False, 'bear_use_ema': False, 'bear_use_atr': False, 'bear_use_adx': True, 'bear_use_spike': True, 'bear_rsi_required': True, 'sideways_strategy': 'breakout', 'sideways_bb_std_mult': 2.5037676885358713, 'sideways_rsi_os': 28, 'sideways_rsi_ob': 76, 'sideways_adx_thresh': 6.256518011098507, 'sideways_atr_min_pct': 0.0038033593576744743, 'sideways_atr_max_pct': 0.07475746661408456, 'sideways_tp_mult': 1.2663652784653143, 'sideways_tsl_mult': 0.13538366619997738, 'sideways_time_stop': 40, 'sideways_use_sma': True, 'sideways_use_ema': True, 'sideways_use_atr': False, 'sideways_use_adx': False, 'sideways_use_spike': True, 'sideways_rsi_required': False}.
[I 2025-08-31 09:44:19,458] Trial 185 finished with values: [-1000000000.0, 1000000000.0] and parameters: {'p_sma': 49, 'p_std': 15, 'p_atr': 30, 'p_adx': 10, 'rsi_period': 23, 'ema1': 20, 'ema2': 36, 'slip_atr_k': 0.18110084483965314, 'slip_spread_k': 0.5471333454565739, 'spread_hl_frac': 0.014055226885783867, 'bb_std_mult': 0.9745533929677201, 'rsi_os': 21, 'rsi_ob': 47, 'vol_spike': 0.13959133625233894, 'adx_thresh': 5.430796726389451, 'atr_min_pct': 0.009812288829179077, 'atr_max_pct': 0.1307647517444752, 'tp_mult': 2.8562752159644447, 'tsl_mult': 0.008608501079950603, 'strategy': 'mean_reversion', 'time_stop': 140, 'use_sma': False, 'use_atr': False, 'use_adx': True, 'use_ema': False, 'use_spike': False, 'rsi_required': True, 'edge_k': 1.8910800924072753, 'edge_cap': 0.13270409861999455, 'bull_strategy': 'mean_reversion', 'bull_bb_std_mult': 1.3179600339453397, 'bull_rsi_os': 33, 'bull_rsi_ob': 66, 'bull_adx_thresh': 11.13763047161988, 'bull_atr_min_pct': 0.011610250084530467, 'bull_atr_max_pct': 0.12285348105521622, 'bull_tp_mult': 1.4864689231129942, 'bull_tsl_mult': 0.6915718702652885, 'bull_time_stop': 250, 'bull_use_sma': True, 'bull_use_ema': True, 'bull_use_atr': False, 'bull_use_adx': False, 'bull_use_spike': False, 'bull_rsi_required': False, 'bear_strategy': 'breakout', 'bear_bb_std_mult': 2.9284363510372264, 'bear_rsi_os': 54, 'bear_rsi_ob': 80, 'bear_adx_thresh': 20.627781851904892, 'bear_atr_min_pct': 0.019642967574730986, 'bear_atr_max_pct': 0.13736284914530514, 'bear_tp_mult': 2.680584259888145, 'bear_tsl_mult': 0.5196466521803422, 'bear_time_stop': 247, 'bear_use_sma': False, 'bear_use_ema': True, 'bear_use_atr': True, 'bear_use_adx': False, 'bear_use_spike': False, 'bear_rsi_required': True, 'sideways_strategy': 'breakout', 'sideways_bb_std_mult': 1.0655316441288258, 'sideways_rsi_os': 25, 'sideways_rsi_ob': 61, 'sideways_adx_thresh': 32.8500143716063, 'sideways_atr_min_pct': 0.0006716917773617762, 'sideways_atr_max_pct': 0.022182905840251805, 'sideways_tp_mult': 1.5430394815800954, 'sideways_tsl_mult': 0.08601705284172408, 'sideways_time_stop': 232, 'sideways_use_sma': False, 'sideways_use_ema': False, 'sideways_use_atr': False, 'sideways_use_adx': False, 'sideways_use_spike': False, 'sideways_rsi_required': False}.
[I 2025-08-31 09:44:54,547] Trial 182 finished with values: [-0.040862020951942246, 0.040701860919987246] and parameters: {'p_sma': 49, 'p_std': 15, 'p_atr': 29, 'p_adx': 9, 'rsi_period': 37, 'ema1': 24, 'ema2': 45, 'slip_atr_k': 0.011055176925506381, 'slip_spread_k': 0.4142212915765425, 'spread_hl_frac': 0.01469822909155429, 'bb_std_mult': 0.930956606362801, 'rsi_os': 10, 'rsi_ob': 50, 'vol_spike': 0.2767901662866681, 'adx_thresh': 8.620029220747186, 'atr_min_pct': 0.015891736638538254, 'atr_max_pct': 0.12646028120975064, 'tp_mult': 2.9790453407916506, 'tsl_mult': 0.9132571338438666, 'strategy': 'breakout', 'time_stop': 178, 'use_sma': False, 'use_atr': False, 'use_adx': False, 'use_ema': True, 'use_spike': False, 'rsi_required': True, 'edge_k': 1.5794801141155907, 'edge_cap': 0.1129808965537884, 'bull_strategy': 'mean_reversion', 'bull_bb_std_mult': 1.2730288914457757, 'bull_rsi_os': 32, 'bull_rsi_ob': 74, 'bull_adx_thresh': 28.326616834065028, 'bull_atr_min_pct': 0.0025622201723524626, 'bull_atr_max_pct': 0.06343336694215945, 'bull_tp_mult': 1.7236212663373476, 'bull_tsl_mult': 0.5969624493807631, 'bull_time_stop': 177, 'bull_use_sma': True, 'bull_use_ema': False, 'bull_use_atr': False, 'bull_use_adx': False, 'bull_use_spike': False, 'bull_rsi_required': True, 'bear_strategy': 'breakout', 'bear_bb_std_mult': 3.2256329627358684, 'bear_rsi_os': 44, 'bear_rsi_ob': 79, 'bear_adx_thresh': 20.786416446384234, 'bear_atr_min_pct': 0.021690431464216026, 'bear_atr_max_pct': 0.04726286568702603, 'bear_tp_mult': 1.3475830289242057, 'bear_tsl_mult': 0.5192106549649286, 'bear_time_stop': 248, 'bear_use_sma': False, 'bear_use_ema': True, 'bear_use_atr': False, 'bear_use_adx': True, 'bear_use_spike': False, 'bear_rsi_required': True, 'sideways_strategy': 'breakout', 'sideways_bb_std_mult': 2.6185409144943614, 'sideways_rsi_os': 36, 'sideways_rsi_ob': 66, 'sideways_adx_thresh': 31.588787026881164, 'sideways_atr_min_pct': 0.001961113913713888, 'sideways_atr_max_pct': 0.03835185573091025, 'sideways_tp_mult': 1.2520847351433617, 'sideways_tsl_mult': 0.7630418480714669, 'sideways_time_stop': 233, 'sideways_use_sma': True, 'sideways_use_ema': True, 'sideways_use_atr': False, 'sideways_use_adx': False, 'sideways_use_spike': False, 'sideways_rsi_required': False}.
[I 2025-08-31 09:44:55,007] Trial 184 finished with values: [-0.01165915528491801, 0.011555035840013843] and parameters: {'p_sma': 48, 'p_std': 16, 'p_atr': 30, 'p_adx': 9, 'rsi_period': 22, 'ema1': 20, 'ema2': 36, 'slip_atr_k': 0.17112053377787215, 'slip_spread_k': 0.2299572198752941, 'spread_hl_frac': 0.014187378843091937, 'bb_std_mult': 0.9318388643139486, 'rsi_os': 22, 'rsi_ob': 47, 'vol_spike': 0.27685269190392137, 'adx_thresh': 5.05075820006726, 'atr_min_pct': 0.010672513947397528, 'atr_max_pct': 0.13241409244517505, 'tp_mult': 2.8612421279812468, 'tsl_mult': 0.006307015984527311, 'strategy': 'breakout', 'time_stop': 137, 'use_sma': False, 'use_atr': False, 'use_adx': False, 'use_ema': False, 'use_spike': False, 'rsi_required': True, 'edge_k': 1.8804976721496045, 'edge_cap': 0.14028172006441122, 'bull_strategy': 'mean_reversion', 'bull_bb_std_mult': 1.464917685473584, 'bull_rsi_os': 33, 'bull_rsi_ob': 66, 'bull_adx_thresh': 32.82296840990208, 'bull_atr_min_pct': 0.02004721759924471, 'bull_atr_max_pct': 0.12352089045069561, 'bull_tp_mult': 1.488122375930277, 'bull_tsl_mult': 0.6009525768867033, 'bull_time_stop': 253, 'bull_use_sma': True, 'bull_use_ema': False, 'bull_use_atr': False, 'bull_use_adx': False, 'bull_use_spike': False, 'bull_rsi_required': True, 'bear_strategy': 'breakout', 'bear_bb_std_mult': 3.208511147919836, 'bear_rsi_os': 44, 'bear_rsi_ob': 81, 'bear_adx_thresh': 21.676691096778676, 'bear_atr_min_pct': 0.019923389595950407, 'bear_atr_max_pct': 0.13608645653557097, 'bear_tp_mult': 2.6870413205277934, 'bear_tsl_mult': 0.5261427806133756, 'bear_time_stop': 251, 'bear_use_sma': False, 'bear_use_ema': True, 'bear_use_atr': False, 'bear_use_adx': False, 'bear_use_spike': False, 'bear_rsi_required': True, 'sideways_strategy': 'breakout', 'sideways_bb_std_mult': 1.0717309582963666, 'sideways_rsi_os': 25, 'sideways_rsi_ob': 62, 'sideways_adx_thresh': 32.88033750683138, 'sideways_atr_min_pct': 0.0018421737712030633, 'sideways_atr_max_pct': 0.01893736426435284, 'sideways_tp_mult': 1.5132345410419037, 'sideways_tsl_mult': 0.08456939070512494, 'sideways_time_stop': 225, 'sideways_use_sma': True, 'sideways_use_ema': True, 'sideways_use_atr': False, 'sideways_use_adx': False, 'sideways_use_spike': False, 'sideways_rsi_required': False}.
[I 2025-08-31 09:44:55,234] Trial 186 finished with values: [-1000000000.0, 1000000000.0] and parameters: {'p_sma': 49, 'p_std': 15, 'p_atr': 30, 'p_adx': 10, 'rsi_period': 37, 'ema1': 19, 'ema2': 39, 'slip_atr_k': 0.16326973750152635, 'slip_spread_k': 0.5126664000011143, 'spread_hl_frac': 0.013200419292073157, 'bb_std_mult': 0.9003005062474512, 'rsi_os': 34, 'rsi_ob': 46, 'vol_spike': 0.1340619808722373, 'adx_thresh': 5.010821931957427, 'atr_min_pct': 0.010844079820282685, 'atr_max_pct': 0.1349142687102789, 'tp_mult': 2.8096662723032098, 'tsl_mult': 0.00408594130170254, 'strategy': 'breakout', 'time_stop': 134, 'use_sma': False, 'use_atr': False, 'use_adx': False, 'use_ema': False, 'use_spike': False, 'rsi_required': True, 'edge_k': 1.9307923205692048, 'edge_cap': 0.16540531165901917, 'bull_strategy': 'mean_reversion', 'bull_bb_std_mult': 1.0680235918318337, 'bull_rsi_os': 33, 'bull_rsi_ob': 62, 'bull_adx_thresh': 19.315274436974505, 'bull_atr_min_pct': 0.010037209618617076, 'bull_atr_max_pct': 0.12020481168319871, 'bull_tp_mult': 1.5601811628994646, 'bull_tsl_mult': 0.6061672236847541, 'bull_time_stop': 189, 'bull_use_sma': True, 'bull_use_ema': False, 'bull_use_atr': False, 'bull_use_adx': False, 'bull_use_spike': False, 'bull_rsi_required': True, 'bear_strategy': 'breakout', 'bear_bb_std_mult': 2.8523621583135417, 'bear_rsi_os': 52, 'bear_rsi_ob': 81, 'bear_adx_thresh': 21.59291040049536, 'bear_atr_min_pct': 0.021357954519076336, 'bear_atr_max_pct': 0.13286142110914492, 'bear_tp_mult': 2.652320226604025, 'bear_tsl_mult': 0.5485094464107669, 'bear_time_stop': 257, 'bear_use_sma': False, 'bear_use_ema': True, 'bear_use_atr': False, 'bear_use_adx': True, 'bear_use_spike': False, 'bear_rsi_required': True, 'sideways_strategy': 'breakout', 'sideways_bb_std_mult': 0.6067678179562894, 'sideways_rsi_os': 24, 'sideways_rsi_ob': 64, 'sideways_adx_thresh': 31.60300696020993, 'sideways_atr_min_pct': 0.001965502329374228, 'sideways_atr_max_pct': 0.01652502331901025, 'sideways_tp_mult': 1.5290081139497267, 'sideways_tsl_mult': 0.0848405407045648, 'sideways_time_stop': 224, 'sideways_use_sma': True, 'sideways_use_ema': True, 'sideways_use_atr': False, 'sideways_use_adx': False, 'sideways_use_spike': False, 'sideways_rsi_required': False}.
[I 2025-08-31 09:44:55,246] Trial 183 finished with values: [-1000000000.0, 1000000000.0] and parameters: {'p_sma': 47, 'p_std': 15, 'p_atr': 30, 'p_adx': 10, 'rsi_period': 22, 'ema1': 20, 'ema2': 36, 'slip_atr_k': 0.1607660663691913, 'slip_spread_k': 0.4986105309422104, 'spread_hl_frac': 0.014501330480202064, 'bb_std_mult': 0.9544847396175984, 'rsi_os': 19, 'rsi_ob': 47, 'vol_spike': 0.14108510854387832, 'adx_thresh': 5.32446475367902, 'atr_min_pct': 0.01196125775750692, 'atr_max_pct': 0.13385726200012274, 'tp_mult': 2.8481844291220986, 'tsl_mult': 0.003047465671783955, 'strategy': 'breakout', 'time_stop': 138, 'use_sma': False, 'use_atr': False, 'use_adx': False, 'use_ema': False, 'use_spike': False, 'rsi_required': True, 'edge_k': 1.8682590733784996, 'edge_cap': 0.17789832387400184, 'bull_strategy': 'mean_reversion', 'bull_bb_std_mult': 1.4730724264683166, 'bull_rsi_os': 32, 'bull_rsi_ob': 66, 'bull_adx_thresh': 18.674451166314615, 'bull_atr_min_pct': 0.00935753608803834, 'bull_atr_max_pct': 0.059150804543267335, 'bull_tp_mult': 1.500899102128432, 'bull_tsl_mult': 0.6932335907644609, 'bull_time_stop': 275, 'bull_use_sma': True, 'bull_use_ema': True, 'bull_use_atr': False, 'bull_use_adx': False, 'bull_use_spike': False, 'bull_rsi_required': True, 'bear_strategy': 'breakout', 'bear_bb_std_mult': 3.2242078923462216, 'bear_rsi_os': 43, 'bear_rsi_ob': 81, 'bear_adx_thresh': 21.788996416414218, 'bear_atr_min_pct': 0.019743569322138617, 'bear_atr_max_pct': 0.13328071605259548, 'bear_tp_mult': 2.69411210451205, 'bear_tsl_mult': 0.5257215572355388, 'bear_time_stop': 254, 'bear_use_sma': False, 'bear_use_ema': True, 'bear_use_atr': False, 'bear_use_adx': False, 'bear_use_spike': False, 'bear_rsi_required': True, 'sideways_strategy': 'breakout', 'sideways_bb_std_mult': 1.0333981742911238, 'sideways_rsi_os': 24, 'sideways_rsi_ob': 60, 'sideways_adx_thresh': 33.150970182667805, 'sideways_atr_min_pct': 0.0018587929985972931, 'sideways_atr_max_pct': 0.01917599374141315, 'sideways_tp_mult': 1.515689081122761, 'sideways_tsl_mult': 0.0927754643772462, 'sideways_time_stop': 227, 'sideways_use_sma': True, 'sideways_use_ema': True, 'sideways_use_atr': False, 'sideways_use_adx': False, 'sideways_use_spike': False, 'sideways_rsi_required': False}.
[I 2025-08-31 09:45:31,567] Trial 189 finished with values: [-1000000000.0, 1000000000.0] and parameters: {'p_sma': 48, 'p_std': 16, 'p_atr': 29, 'p_adx': 9, 'rsi_period': 25, 'ema1': 18, 'ema2': 37, 'slip_atr_k': 0.17147489881424183, 'slip_spread_k': 0.47691640249661854, 'spread_hl_frac': 0.015788364525824848, 'bb_std_mult': 1.301192862709559, 'rsi_os': 10, 'rsi_ob': 48, 'vol_spike': 0.13143768719200205, 'adx_thresh': 27.07552003037615, 'atr_min_pct': 0.011116818419673298, 'atr_max_pct': 0.12790302940358808, 'tp_mult': 2.9549720018947396, 'tsl_mult': 0.024914528213411783, 'strategy': 'breakout', 'time_stop': 158, 'use_sma': False, 'use_atr': False, 'use_adx': True, 'use_ema': False, 'use_spike': False, 'rsi_required': False, 'edge_k': 1.8992129376918976, 'edge_cap': 0.697454419202713, 'bull_strategy': 'mean_reversion', 'bull_bb_std_mult': 1.2548448777271217, 'bull_rsi_os': 31, 'bull_rsi_ob': 59, 'bull_adx_thresh': 10.162092778912239, 'bull_atr_min_pct': 0.021395676358345567, 'bull_atr_max_pct': 0.12977596648130507, 'bull_tp_mult': 1.4050100387511093, 'bull_tsl_mult': 0.6325630367464459, 'bull_time_stop': 260, 'bull_use_sma': False, 'bull_use_ema': False, 'bull_use_atr': False, 'bull_use_adx': True, 'bull_use_spike': False, 'bull_rsi_required': True, 'bear_strategy': 'mean_reversion', 'bear_bb_std_mult': 3.0598603027037283, 'bear_rsi_os': 33, 'bear_rsi_ob': 84, 'bear_adx_thresh': 20.936839250598986, 'bear_atr_min_pct': 0.02038498963434268, 'bear_atr_max_pct': 0.13773173530881055, 'bear_tp_mult': 2.735172934575495, 'bear_tsl_mult': 0.5010261794012855, 'bear_time_stop': 240, 'bear_use_sma': True, 'bear_use_ema': True, 'bear_use_atr': False, 'bear_use_adx': True, 'bear_use_spike': False, 'bear_rsi_required': True, 'sideways_strategy': 'mean_reversion', 'sideways_bb_std_mult': 0.9496829361865052, 'sideways_rsi_os': 21, 'sideways_rsi_ob': 58, 'sideways_adx_thresh': 33.83111504621055, 'sideways_atr_min_pct': 0.0005642365713844524, 'sideways_atr_max_pct': 0.021070681817996886, 'sideways_tp_mult': 1.482583495190882, 'sideways_tsl_mult': 0.13517043674133838, 'sideways_time_stop': 247, 'sideways_use_sma': True, 'sideways_use_ema': True, 'sideways_use_atr': False, 'sideways_use_adx': True, 'sideways_use_spike': False, 'sideways_rsi_required': True}.
[I 2025-08-31 09:45:31,661] Trial 190 finished with values: [-1000000000.0, 1000000000.0] and parameters: {'p_sma': 48, 'p_std': 16, 'p_atr': 29, 'p_adx': 9, 'rsi_period': 59, 'ema1': 18, 'ema2': 38, 'slip_atr_k': 0.17115671720231254, 'slip_spread_k': 0.28049953955362694, 'spread_hl_frac': 0.01556616643885989, 'bb_std_mult': 1.0466642801793336, 'rsi_os': 10, 'rsi_ob': 48, 'vol_spike': 0.13063003728196385, 'adx_thresh': 26.911296947410058, 'atr_min_pct': 0.011323456229579497, 'atr_max_pct': 0.12556556942698915, 'tp_mult': 2.894319913694042, 'tsl_mult': 0.02729620326358027, 'strategy': 'breakout', 'time_stop': 148, 'use_sma': False, 'use_atr': False, 'use_adx': True, 'use_ema': False, 'use_spike': False, 'rsi_required': False, 'edge_k': 1.9045587310156105, 'edge_cap': 0.426119414209822, 'bull_strategy': 'mean_reversion', 'bull_bb_std_mult': 1.2338758309952147, 'bull_rsi_os': 31, 'bull_rsi_ob': 65, 'bull_adx_thresh': 22.95683221049637, 'bull_atr_min_pct': 0.01987614660449126, 'bull_atr_max_pct': 0.13039996152397465, 'bull_tp_mult': 1.4096718570045024, 'bull_tsl_mult': 0.2818450455894561, 'bull_time_stop': 254, 'bull_use_sma': False, 'bull_use_ema': False, 'bull_use_atr': False, 'bull_use_adx': True, 'bull_use_spike': False, 'bull_rsi_required': True, 'bear_strategy': 'mean_reversion', 'bear_bb_std_mult': 3.062770328274807, 'bear_rsi_os': 54, 'bear_rsi_ob': 81, 'bear_adx_thresh': 21.08465562521497, 'bear_atr_min_pct': 0.02017632363603647, 'bear_atr_max_pct': 0.13591939946459108, 'bear_tp_mult': 2.7077753522620895, 'bear_tsl_mult': 0.5062661807895968, 'bear_time_stop': 240, 'bear_use_sma': True, 'bear_use_ema': True, 'bear_use_atr': False, 'bear_use_adx': True, 'bear_use_spike': False, 'bear_rsi_required': True, 'sideways_strategy': 'mean_reversion', 'sideways_bb_std_mult': 0.9426324800794712, 'sideways_rsi_os': 26, 'sideways_rsi_ob': 64, 'sideways_adx_thresh': 33.62162780807624, 'sideways_atr_min_pct': 0.0005574135787779068, 'sideways_atr_max_pct': 0.015143359409434625, 'sideways_tp_mult': 1.4981772295440121, 'sideways_tsl_mult': 0.13335212063867513, 'sideways_time_stop': 260, 'sideways_use_sma': True, 'sideways_use_ema': True, 'sideways_use_atr': False, 'sideways_use_adx': True, 'sideways_use_spike': False, 'sideways_rsi_required': True}.
