[I 2025-08-31 09:59:36,987] Trial 297 finished with values: [-1000000000.0, 1000000000.0] and parameters: {'p_sma': 59, 'p_std': 47, 'p_atr': 29, 'p_adx': 9, 'rsi_period': 56, 'ema1': 20, 'ema2': 42, 'slip_atr_k': 0.1682039760617713, 'slip_spread_k': 0.4398243940622737, 'spread_hl_frac': 0.013820424969320514, 'bb_std_mult': 0.9342316599382304, 'rsi_os': 21, 'rsi_ob': 66, 'vol_spike': 0.1322754033151129, 'adx_thresh': 33.465708936634584, 'atr_min_pct': 0.011906741515248434, 'atr_max_pct': 0.13726894917581017, 'tp_mult': 2.0321205987150854, 'tsl_mult': 0.021831282203518352, 'strategy': 'breakout', 'time_stop': 247, 'use_sma': False, 'use_atr': False, 'use_adx': False, 'use_ema': False, 'use_spike': False, 'rsi_required': True, 'edge_k': 1.9997376686899488, 'edge_cap': 0.1002003326645852, 'bull_strategy': 'mean_reversion', 'bull_bb_std_mult': 1.32589399438582, 'bull_rsi_os': 32, 'bull_rsi_ob': 47, 'bull_adx_thresh': 34.201002042476375, 'bull_atr_min_pct': 0.018685670927326207, 'bull_atr_max_pct': 0.08156896999121932, 'bull_tp_mult': 1.5259045225714856, 'bull_tsl_mult': 0.6557880416520115, 'bull_time_stop': 245, 'bull_use_sma': True, 'bull_use_ema': False, 'bull_use_atr': False, 'bull_use_adx': False, 'bull_use_spike': False, 'bull_rsi_required': True, 'bear_strategy': 'breakout', 'bear_bb_std_mult': 2.860664251279146, 'bear_rsi_os': 51, 'bear_rsi_ob': 70, 'bear_adx_thresh': 29.28286381249238, 'bear_atr_min_pct': 0.028662720596519507, 'bear_atr_max_pct': 0.08487207644604203, 'bear_tp_mult': 2.5667004943956404, 'bear_tsl_mult': 0.9737217046965158, 'bear_time_stop': 104, 'bear_use_sma': False, 'bear_use_ema': True, 'bear_use_atr': False, 'bear_use_adx': True, 'bear_use_spike': False, 'bear_rsi_required': True, 'sideways_strategy': 'breakout', 'sideways_bb_std_mult': 1.2563980441093334, 'sideways_rsi_os': 24, 'sideways_rsi_ob': 65, 'sideways_adx_thresh': 12.024587352338044, 'sideways_atr_min_pct': 0.0008742838659756471, 'sideways_atr_max_pct': 0.02920032451241173, 'sideways_tp_mult': 1.8025773283218687, 'sideways_tsl_mult': 0.1375804744413839, 'sideways_time_stop': 233, 'sideways_use_sma': True, 'sideways_use_ema': True, 'sideways_use_atr': False, 'sideways_use_adx': False, 'sideways_use_spike': False, 'sideways_rsi_required': False}.
[I 2025-08-31 09:59:37,019] Trial 298 finished with values: [-0.17512733034207084, 0.17506837302449543] and parameters: {'p_sma': 59, 'p_std': 15, 'p_atr': 29, 'p_adx': 9, 'rsi_period': 29, 'ema1': 27, 'ema2': 40, 'slip_atr_k': 0.17301285556059698, 'slip_spread_k': 0.43700519510503333, 'spread_hl_frac': 0.014009636240042277, 'bb_std_mult': 0.9432389231215083, 'rsi_os': 21, 'rsi_ob': 46, 'vol_spike': 0.1581140169763592, 'adx_thresh': 30.276721196230362, 'atr_min_pct': 0.02665545148748657, 'atr_max_pct': 0.13664288195307706, 'tp_mult': 2.046013572702593, 'tsl_mult': 0.02524565221944974, 'strategy': 'breakout', 'time_stop': 246, 'use_sma': False, 'use_atr': False, 'use_adx': False, 'use_ema': False, 'use_spike': False, 'rsi_required': True, 'edge_k': 1.922439946372633, 'edge_cap': 0.7137154057554459, 'bull_strategy': 'mean_reversion', 'bull_bb_std_mult': 2.846607023896873, 'bull_rsi_os': 50, 'bull_rsi_ob': 65, 'bull_adx_thresh': 31.55334116917805, 'bull_atr_min_pct': 0.018695653682726875, 'bull_atr_max_pct': 0.13396390241663736, 'bull_tp_mult': 1.4319860541521718, 'bull_tsl_mult': 0.5337395135066397, 'bull_time_stop': 195, 'bull_use_sma': True, 'bull_use_ema': False, 'bull_use_atr': False, 'bull_use_adx': False, 'bull_use_spike': False, 'bull_rsi_required': True, 'bear_strategy': 'breakout', 'bear_bb_std_mult': 3.003349665717152, 'bear_rsi_os': 53, 'bear_rsi_ob': 45, 'bear_adx_thresh': 33.60086061596142, 'bear_atr_min_pct': 0.02251721310998298, 'bear_atr_max_pct': 0.0211158022674875, 'bear_tp_mult': 1.954843006620729, 'bear_tsl_mult': 0.974960587918447, 'bear_time_stop': 247, 'bear_use_sma': False, 'bear_use_ema': True, 'bear_use_atr': False, 'bear_use_adx': True, 'bear_use_spike': False, 'bear_rsi_required': True, 'sideways_strategy': 'breakout', 'sideways_bb_std_mult': 3.272872871979747, 'sideways_rsi_os': 47, 'sideways_rsi_ob': 65, 'sideways_adx_thresh': 33.19419752694657, 'sideways_atr_min_pct': 0.0006210494036727222, 'sideways_atr_max_pct': 0.02186353910823852, 'sideways_tp_mult': 1.5875131347663487, 'sideways_tsl_mult': 0.14012362832388425, 'sideways_time_stop': 253, 'sideways_use_sma': True, 'sideways_use_ema': True, 'sideways_use_atr': False, 'sideways_use_adx': False, 'sideways_use_spike': False, 'sideways_rsi_required': False}.
[I 2025-08-31 09:59:37,377] Trial 300 finished with values: [-0.04874870904649253, 0.0486378830054728] and parameters: {'p_sma': 35, 'p_std': 44, 'p_atr': 29, 'p_adx': 9, 'rsi_period': 17, 'ema1': 21, 'ema2': 42, 'slip_atr_k': 0.17335841354994797, 'slip_spread_k': 0.43859135532227267, 'spread_hl_frac': 0.00015611389765592815, 'bb_std_mult': 1.0896837333338987, 'rsi_os': 22, 'rsi_ob': 65, 'vol_spike': 0.07068302746336229, 'adx_thresh': 5.990239192576451, 'atr_min_pct': 0.025910317546419287, 'atr_max_pct': 0.11497404261747338, 'tp_mult': 2.762159397326126, 'tsl_mult': 0.00013205498526253144, 'strategy': 'breakout', 'time_stop': 151, 'use_sma': False, 'use_atr': False, 'use_adx': False, 'use_ema': False, 'use_spike': False, 'rsi_required': True, 'edge_k': 0.7424229438553347, 'edge_cap': 0.7195964482792547, 'bull_strategy': 'mean_reversion', 'bull_bb_std_mult': 1.3382336578708138, 'bull_rsi_os': 30, 'bull_rsi_ob': 47, 'bull_adx_thresh': 31.609580101847808, 'bull_atr_min_pct': 0.01870614531902038, 'bull_atr_max_pct': 0.0765217907305117, 'bull_tp_mult': 1.5003483550064758, 'bull_tsl_mult': 0.5323253507425173, 'bull_time_stop': 244, 'bull_use_sma': True, 'bull_use_ema': False, 'bull_use_atr': False, 'bull_use_adx': False, 'bull_use_spike': False, 'bull_rsi_required': True, 'bear_strategy': 'breakout', 'bear_bb_std_mult': 3.476350926387794, 'bear_rsi_os': 55, 'bear_rsi_ob': 80, 'bear_adx_thresh': 22.97586428500138, 'bear_atr_min_pct': 0.02857492637057546, 'bear_atr_max_pct': 0.0875539576010914, 'bear_tp_mult': 2.9999567030458403, 'bear_tsl_mult': 0.5113595451806873, 'bear_time_stop': 256, 'bear_use_sma': False, 'bear_use_ema': True, 'bear_use_atr': False, 'bear_use_adx': True, 'bear_use_spike': False, 'bear_rsi_required': True, 'sideways_strategy': 'breakout', 'sideways_bb_std_mult': 1.571856829632054, 'sideways_rsi_os': 24, 'sideways_rsi_ob': 65, 'sideways_adx_thresh': 33.29915211008889, 'sideways_atr_min_pct': 0.0006808076023255506, 'sideways_atr_max_pct': 0.03483306111057095, 'sideways_tp_mult': 1.5776694271430673, 'sideways_tsl_mult': 0.7379395880572445, 'sideways_time_stop': 125, 'sideways_use_sma': True, 'sideways_use_ema': True, 'sideways_use_atr': False, 'sideways_use_adx': False, 'sideways_use_spike': False, 'sideways_rsi_required': False}.
[I 2025-08-31 09:59:37,389] Trial 299 finished with values: [-0.04070131704418456, 0.040589142806404875] and parameters: {'p_sma': 59, 'p_std': 15, 'p_atr': 29, 'p_adx': 9, 'rsi_period': 21, 'ema1': 21, 'ema2': 32, 'slip_atr_k': 0.16841254231993993, 'slip_spread_k': 0.4377860811046509, 'spread_hl_frac': 0.0139205977873552, 'bb_std_mult': 1.6560464118938159, 'rsi_os': 26, 'rsi_ob': 88, 'vol_spike': 0.1309148529714831, 'adx_thresh': 6.994293170723129, 'atr_min_pct': 0.02549848297780069, 'atr_max_pct': 0.13817662345467002, 'tp_mult': 2.039525623099992, 'tsl_mult': 0.024685752512977444, 'strategy': 'breakout', 'time_stop': 148, 'use_sma': False, 'use_atr': False, 'use_adx': False, 'use_ema': False, 'use_spike': False, 'rsi_required': True, 'edge_k': 1.9958747211516616, 'edge_cap': 0.1060683299517272, 'bull_strategy': 'mean_reversion', 'bull_bb_std_mult': 1.303915997848051, 'bull_rsi_os': 30, 'bull_rsi_ob': 67, 'bull_adx_thresh': 31.80062829734319, 'bull_atr_min_pct': 0.0035566138323952657, 'bull_atr_max_pct': 0.10275787034090403, 'bull_tp_mult': 1.830747509635454, 'bull_tsl_mult': 0.5390829829507636, 'bull_time_stop': 245, 'bull_use_sma': True, 'bull_use_ema': False, 'bull_use_atr': False, 'bull_use_adx': False, 'bull_use_spike': False, 'bull_rsi_required': True, 'bear_strategy': 'breakout', 'bear_bb_std_mult': 2.852755019643386, 'bear_rsi_os': 38, 'bear_rsi_ob': 70, 'bear_adx_thresh': 31.14737475432561, 'bear_atr_min_pct': 0.028215238219982633, 'bear_atr_max_pct': 0.14429844098087574, 'bear_tp_mult': 1.9450660980231254, 'bear_tsl_mult': 0.5015817427725345, 'bear_time_stop': 102, 'bear_use_sma': False, 'bear_use_ema': True, 'bear_use_atr': False, 'bear_use_adx': True, 'bear_use_spike': False, 'bear_rsi_required': True, 'sideways_strategy': 'breakout', 'sideways_bb_std_mult': 1.0441624213800915, 'sideways_rsi_os': 24, 'sideways_rsi_ob': 65, 'sideways_adx_thresh': 30.95087410369077, 'sideways_atr_min_pct': 0.0008918632300535703, 'sideways_atr_max_pct': 0.029277773324417517, 'sideways_tp_mult': 1.5744200468938323, 'sideways_tsl_mult': 0.8461067877680775, 'sideways_time_stop': 120, 'sideways_use_sma': True, 'sideways_use_ema': True, 'sideways_use_atr': False, 'sideways_use_adx': False, 'sideways_use_spike': False, 'sideways_rsi_required': False}.
[I 2025-08-31 09:59:37,929] Trial 304 finished with values: [-1000000000.0, 1000000000.0] and parameters: {'p_sma': 33, 'p_std': 38, 'p_atr': 19, 'p_adx': 28, 'rsi_period': 22, 'ema1': 12, 'ema2': 30, 'slip_atr_k': 0.20236541147944692, 'slip_spread_k': 0.06470477922944884, 'spread_hl_frac': 0.01651286414435237, 'bb_std_mult': 2.4919545859975645, 'rsi_os': 23, 'rsi_ob': 48, 'vol_spike': 0.14148725105217022, 'adx_thresh': 5.924111467682617, 'atr_min_pct': 0.011956108493759493, 'atr_max_pct': 0.09109862636188688, 'tp_mult': 2.530949890206194, 'tsl_mult': 0.038166949286627505, 'strategy': 'mean_reversion', 'time_stop': 131, 'use_sma': False, 'use_atr': False, 'use_adx': False, 'use_ema': False, 'use_spike': False, 'rsi_required': False, 'edge_k': 1.85820649313693, 'edge_cap': 0.607570799358428, 'bull_strategy': 'mean_reversion', 'bull_bb_std_mult': 0.7767426167312035, 'bull_rsi_os': 35, 'bull_rsi_ob': 70, 'bull_adx_thresh': 29.640599205726506, 'bull_atr_min_pct': 0.01773442017651123, 'bull_atr_max_pct': 0.12204714911690415, 'bull_tp_mult': 1.8901977910484995, 'bull_tsl_mult': 0.6162416478983258, 'bull_time_stop': 208, 'bull_use_sma': True, 'bull_use_ema': True, 'bull_use_atr': False, 'bull_use_adx': True, 'bull_use_spike': True, 'bull_rsi_required': False, 'bear_strategy': 'breakout', 'bear_bb_std_mult': 2.7591665541603936, 'bear_rsi_os': 53, 'bear_rsi_ob': 66, 'bear_adx_thresh': 21.29843301897955, 'bear_atr_min_pct': 0.01942077763050051, 'bear_atr_max_pct': 0.1482767102412905, 'bear_tp_mult': 2.716450484682923, 'bear_tsl_mult': 0.5578845501594363, 'bear_time_stop': 265, 'bear_use_sma': True, 'bear_use_ema': True, 'bear_use_atr': True, 'bear_use_adx': False, 'bear_use_spike': False, 'bear_rsi_required': True, 'sideways_strategy': 'mean_reversion', 'sideways_bb_std_mult': 0.9893309901494118, 'sideways_rsi_os': 9, 'sideways_rsi_ob': 72, 'sideways_adx_thresh': 32.1400771681506, 'sideways_atr_min_pct': 0.0036413647391491197, 'sideways_atr_max_pct': 0.032652849379406074, 'sideways_tp_mult': 1.4863555973643685, 'sideways_tsl_mult': 0.03588016992383092, 'sideways_time_stop': 64, 'sideways_use_sma': False, 'sideways_use_ema': False, 'sideways_use_atr': True, 'sideways_use_adx': True, 'sideways_use_spike': False, 'sideways_rsi_required': True}.
[I 2025-08-31 10:00:07,928] Trial 303 finished with values: [-1000000000.0, 1000000000.0] and parameters: {'p_sma': 49, 'p_std': 13, 'p_atr': 19, 'p_adx': 10, 'rsi_period': 20, 'ema1': 12, 'ema2': 52, 'slip_atr_k': 0.15318849403585413, 'slip_spread_k': 0.7001672802039123, 'spread_hl_frac': 0.01150116485706097, 'bb_std_mult': 1.079802279891346, 'rsi_os': 23, 'rsi_ob': 69, 'vol_spike': 0.21351735492260518, 'adx_thresh': 5.838023766277116, 'atr_min_pct': 0.01744575705893646, 'atr_max_pct': 0.12951158327025544, 'tp_mult': 2.8200562426135294, 'tsl_mult': 0.4533469950876386, 'strategy': 'mean_reversion', 'time_stop': 135, 'use_sma': False, 'use_atr': False, 'use_adx': False, 'use_ema': False, 'use_spike': False, 'rsi_required': False, 'edge_k': 0.1993480950759554, 'edge_cap': 0.611562181755716, 'bull_strategy': 'mean_reversion', 'bull_bb_std_mult': 1.4673663282811125, 'bull_rsi_os': 34, 'bull_rsi_ob': 70, 'bull_adx_thresh': 32.97375580458343, 'bull_atr_min_pct': 0.017792913404939992, 'bull_atr_max_pct': 0.010787466895441078, 'bull_tp_mult': 1.8753978564045524, 'bull_tsl_mult': 0.6249016346298876, 'bull_time_stop': 251, 'bull_use_sma': True, 'bull_use_ema': True, 'bull_use_atr': False, 'bull_use_adx': True, 'bull_use_spike': True, 'bull_rsi_required': False, 'bear_strategy': 'breakout', 'bear_bb_std_mult': 2.7643998360178474, 'bear_rsi_os': 53, 'bear_rsi_ob': 77, 'bear_adx_thresh': 9.22843462651667, 'bear_atr_min_pct': 0.018560162750264533, 'bear_atr_max_pct': 0.02856671207297514, 'bear_tp_mult': 1.6317983039653807, 'bear_tsl_mult': 0.5591764590814884, 'bear_time_stop': 268, 'bear_use_sma': True, 'bear_use_ema': True, 'bear_use_atr': True, 'bear_use_adx': False, 'bear_use_spike': False, 'bear_rsi_required': True, 'sideways_strategy': 'mean_reversion', 'sideways_bb_std_mult': 0.6506045326925907, 'sideways_rsi_os': 26, 'sideways_rsi_ob': 53, 'sideways_adx_thresh': 18.925542537650365, 'sideways_atr_min_pct': 0.01155594176759156, 'sideways_atr_max_pct': 0.03236141622394446, 'sideways_tp_mult': 1.92684306629644, 'sideways_tsl_mult': 0.031426038387362853, 'sideways_time_stop': 241, 'sideways_use_sma': False, 'sideways_use_ema': False, 'sideways_use_atr': True, 'sideways_use_adx': True, 'sideways_use_spike': False, 'sideways_rsi_required': True}.
[I 2025-08-31 10:00:09,341] Trial 302 finished with values: [-0.12076731799354823, 0.1203659146815927] and parameters: {'p_sma': 42, 'p_std': 13, 'p_atr': 21, 'p_adx': 8, 'rsi_period': 16, 'ema1': 22, 'ema2': 32, 'slip_atr_k': 0.20304407151653242, 'slip_spread_k': 0.7037288372341659, 'spread_hl_frac': 0.011418410960590576, 'bb_std_mult': 1.091628282539154, 'rsi_os': 22, 'rsi_ob': 48, 'vol_spike': 0.27080116225203277, 'adx_thresh': 5.990709335183431, 'atr_min_pct': 0.02527115396975052, 'atr_max_pct': 0.09058724677646526, 'tp_mult': 2.749847751273214, 'tsl_mult': 0.0009681950499602243, 'strategy': 'breakout', 'time_stop': 150, 'use_sma': False, 'use_atr': False, 'use_adx': False, 'use_ema': False, 'use_spike': False, 'rsi_required': True, 'edge_k': 1.147682163310436, 'edge_cap': 0.6061806851815228, 'bull_strategy': 'mean_reversion', 'bull_bb_std_mult': 1.45474893011962, 'bull_rsi_os': 30, 'bull_rsi_ob': 62, 'bull_adx_thresh': 16.880119759121158, 'bull_atr_min_pct': 0.01778550004375977, 'bull_atr_max_pct': 0.12257269370349103, 'bull_tp_mult': 1.838568699311856, 'bull_tsl_mult': 0.6204240179492376, 'bull_time_stop': 251, 'bull_use_sma': True, 'bull_use_ema': True, 'bull_use_atr': False, 'bull_use_adx': True, 'bull_use_spike': True, 'bull_rsi_required': True, 'bear_strategy': 'breakout', 'bear_bb_std_mult': 3.491071680389763, 'bear_rsi_os': 55, 'bear_rsi_ob': 52, 'bear_adx_thresh': 27.377970784801537, 'bear_atr_min_pct': 0.0006728100270389243, 'bear_atr_max_pct': 0.1445220570973759, 'bear_tp_mult': 2.9246016278160125, 'bear_tsl_mult': 0.5079538871786882, 'bear_time_stop': 268, 'bear_use_sma': False, 'bear_use_ema': True, 'bear_use_atr': False, 'bear_use_adx': True, 'bear_use_spike': False, 'bear_rsi_required': True, 'sideways_strategy': 'breakout', 'sideways_bb_std_mult': 1.3774716691514293, 'sideways_rsi_os': 26, 'sideways_rsi_ob': 49, 'sideways_adx_thresh': 21.54256045768047, 'sideways_atr_min_pct': 0.0028260258732092473, 'sideways_atr_max_pct': 0.03482408523079369, 'sideways_tp_mult': 1.4857133458872267, 'sideways_tsl_mult': 0.8460165619488247, 'sideways_time_stop': 114, 'sideways_use_sma': True, 'sideways_use_ema': True, 'sideways_use_atr': True, 'sideways_use_adx': True, 'sideways_use_spike': False, 'sideways_rsi_required': False}.
[I 2025-08-31 10:00:09,826] Trial 301 finished with values: [-1000000000.0, 1000000000.0] and parameters: {'p_sma': 34, 'p_std': 38, 'p_atr': 29, 'p_adx': 9, 'rsi_period': 16, 'ema1': 21, 'ema2': 31, 'slip_atr_k': 0.18434717438842907, 'slip_spread_k': 0.9540144582975759, 'spread_hl_frac': 0.0001286622976236669, 'bb_std_mult': 1.9502136844806979, 'rsi_os': 22, 'rsi_ob': 87, 'vol_spike': 0.07071408747970925, 'adx_thresh': 31.19779114534991, 'atr_min_pct': 0.013725729723208891, 'atr_max_pct': 0.13676122135285346, 'tp_mult': 2.43532043932824, 'tsl_mult': 0.00043571377163168374, 'strategy': 'breakout', 'time_stop': 151, 'use_sma': False, 'use_atr': False, 'use_adx': False, 'use_ema': False, 'use_spike': False, 'rsi_required': True, 'edge_k': 1.9334446169942616, 'edge_cap': 0.05099834838384264, 'bull_strategy': 'mean_reversion', 'bull_bb_std_mult': 2.8301412976157607, 'bull_rsi_os': 9, 'bull_rsi_ob': 70, 'bull_adx_thresh': 15.08277194723067, 'bull_atr_min_pct': 0.01782803404211771, 'bull_atr_max_pct': 0.13368151342405366, 'bull_tp_mult': 2.1043599915417905, 'bull_tsl_mult': 0.5458347774647808, 'bull_time_stop': 196, 'bull_use_sma': True, 'bull_use_ema': True, 'bull_use_atr': False, 'bull_use_adx': False, 'bull_use_spike': False, 'bull_rsi_required': True, 'bear_strategy': 'breakout', 'bear_bb_std_mult': 3.0176463404834433, 'bear_rsi_os': 55, 'bear_rsi_ob': 80, 'bear_adx_thresh': 9.382096903921099, 'bear_atr_min_pct': 0.022369278200472867, 'bear_atr_max_pct': 0.021558041201960865, 'bear_tp_mult': 2.0385557603394218, 'bear_tsl_mult': 0.5011628067845111, 'bear_time_stop': 267, 'bear_use_sma': False, 'bear_use_ema': True, 'bear_use_atr': False, 'bear_use_adx': True, 'bear_use_spike': False, 'bear_rsi_required': True, 'sideways_strategy': 'breakout', 'sideways_bb_std_mult': 1.053387843510825, 'sideways_rsi_os': 47, 'sideways_rsi_ob': 63, 'sideways_adx_thresh': 33.254757224660366, 'sideways_atr_min_pct': 0.009028575302208252, 'sideways_atr_max_pct': 0.022068516003666036, 'sideways_tp_mult': 1.0129142954831345, 'sideways_tsl_mult': 0.10417598380881375, 'sideways_time_stop': 124, 'sideways_use_sma': True, 'sideways_use_ema': True, 'sideways_use_atr': False, 'sideways_use_adx': False, 'sideways_use_spike': False, 'sideways_rsi_required': False}.
[I 2025-08-31 10:00:10,310] Trial 305 finished with values: [-0.07483507261010203, 0.0744405027183024] and parameters: {'p_sma': 42, 'p_std': 57, 'p_atr': 29, 'p_adx': 8, 'rsi_period': 13, 'ema1': 20, 'ema2': 54, 'slip_atr_k': 0.1564922305775812, 'slip_spread_k': 0.374437260491325, 'spread_hl_frac': 0.023517216081099402, 'bb_std_mult': 1.7962757137560188, 'rsi_os': 54, 'rsi_ob': 46, 'vol_spike': 0.27099130483646, 'adx_thresh': 31.063384473590474, 'atr_min_pct': 0.017442579758627088, 'atr_max_pct': 0.1289296868204173, 'tp_mult': 2.433885369284312, 'tsl_mult': 0.7359479775756257, 'strategy': 'breakout', 'time_stop': 138, 'use_sma': False, 'use_atr': False, 'use_adx': False, 'use_ema': False, 'use_spike': False, 'rsi_required': True, 'edge_k': 0.1870018539492304, 'edge_cap': 0.1853411333187802, 'bull_strategy': 'mean_reversion', 'bull_bb_std_mult': 2.0114858897286823, 'bull_rsi_os': 34, 'bull_rsi_ob': 63, 'bull_adx_thresh': 15.0075649765512, 'bull_atr_min_pct': 0.01937672913309428, 'bull_atr_max_pct': 0.11853761301325401, 'bull_tp_mult': 1.435202624949646, 'bull_tsl_mult': 0.557617526650626, 'bull_time_stop': 252, 'bull_use_sma': True, 'bull_use_ema': True, 'bull_use_atr': False, 'bull_use_adx': False, 'bull_use_spike': False, 'bull_rsi_required': True, 'bear_strategy': 'breakout', 'bear_bb_std_mult': 1.5531513874693015, 'bear_rsi_os': 55, 'bear_rsi_ob': 84, 'bear_adx_thresh': 32.36899363502667, 'bear_atr_min_pct': 0.0005572418672315938, 'bear_atr_max_pct': 0.028145898655873518, 'bear_tp_mult': 2.77017235392651, 'bear_tsl_mult': 0.9993036041003586, 'bear_time_stop': 259, 'bear_use_sma': False, 'bear_use_ema': True, 'bear_use_atr': False, 'bear_use_adx': True, 'bear_use_spike': False, 'bear_rsi_required': True, 'sideways_strategy': 'breakout', 'sideways_bb_std_mult': 3.5692616113055955, 'sideways_rsi_os': 26, 'sideways_rsi_ob': 49, 'sideways_adx_thresh': 21.576376598354365, 'sideways_atr_min_pct': 0.009077912460818622, 'sideways_atr_max_pct': 0.025147100526153463, 'sideways_tp_mult': 1.4982071754629258, 'sideways_tsl_mult': 0.09780753563371138, 'sideways_time_stop': 241, 'sideways_use_sma': True, 'sideways_use_ema': True, 'sideways_use_atr': False, 'sideways_use_adx': False, 'sideways_use_spike': False, 'sideways_rsi_required': False}.
