[I 2025-08-31 10:26:01,413] Trial 523 finished with values: [-1000000000.0, 1000000000.0] and parameters: {'p_sma': 9, 'p_std': 47, 'p_atr': 23, 'p_adx': 22, 'rsi_period': 32, 'ema1': 17, 'ema2': 21, 'slip_atr_k': 0.19201672454953062, 'slip_spread_k': 0.0632123083475849, 'spread_hl_frac': 0.00908828673540079, 'bb_std_mult': 1.2250717357613443, 'rsi_os': 41, 'rsi_ob': 85, 'vol_spike': 0.29261526203082716, 'adx_thresh': 23.257627559292274, 'atr_min_pct': 0.010206742149415879, 'atr_max_pct': 0.12075754401210548, 'tp_mult': 2.532945671393791, 'tsl_mult': 0.6821356227818947, 'strategy': 'breakout', 'time_stop': 141, 'use_sma': False, 'use_atr': False, 'use_adx': False, 'use_ema': True, 'use_spike': False, 'rsi_required': True, 'edge_k': 1.049996854029359, 'edge_cap': 0.6414822898032165, 'bull_strategy': 'mean_reversion', 'bull_bb_std_mult': 2.293661320349256, 'bull_rsi_os': 25, 'bull_rsi_ob': 94, 'bull_adx_thresh': 16.877846533603957, 'bull_atr_min_pct': 0.0057402732816568, 'bull_atr_max_pct': 0.08985061784127954, 'bull_tp_mult': 2.189604587585649, 'bull_tsl_mult': 0.9544257413972005, 'bull_time_stop': 71, 'bull_use_sma': True, 'bull_use_ema': False, 'bull_use_atr': True, 'bull_use_adx': True, 'bull_use_spike': False, 'bull_rsi_required': True, 'bear_strategy': 'breakout', 'bear_bb_std_mult': 2.889426657181916, 'bear_rsi_os': 28, 'bear_rsi_ob': 79, 'bear_adx_thresh': 23.42496805681492, 'bear_atr_min_pct': 0.007295714119151061, 'bear_atr_max_pct': 0.10080957032302602, 'bear_tp_mult': 2.1129538491908644, 'bear_tsl_mult': 0.4238773980563683, 'bear_time_stop': 267, 'bear_use_sma': False, 'bear_use_ema': True, 'bear_use_atr': False, 'bear_use_adx': True, 'bear_use_spike': True, 'bear_rsi_required': True, 'sideways_strategy': 'breakout', 'sideways_bb_std_mult': 0.8598171037584998, 'sideways_rsi_os': 44, 'sideways_rsi_ob': 94, 'sideways_adx_thresh': 29.581819043708133, 'sideways_atr_min_pct': 0.027783802486714235, 'sideways_atr_max_pct': 0.11009902514569019, 'sideways_tp_mult': 2.868175458582167, 'sideways_tsl_mult': 0.06391712448974025, 'sideways_time_stop': 261, 'sideways_use_sma': True, 'sideways_use_ema': True, 'sideways_use_atr': False, 'sideways_use_adx': False, 'sideways_use_spike': True, 'sideways_rsi_required': False}.
[I 2025-08-31 10:26:01,681] Trial 521 finished with values: [-1000000000.0, 1000000000.0] and parameters: {'p_sma': 14, 'p_std': 46, 'p_atr': 23, 'p_adx': 9, 'rsi_period': 78, 'ema1': 16, 'ema2': 35, 'slip_atr_k': 0.19485020559272812, 'slip_spread_k': 0.05768095039837051, 'spread_hl_frac': 0.011926468641798273, 'bb_std_mult': 1.182290297176153, 'rsi_os': 41, 'rsi_ob': 81, 'vol_spike': 0.29132736360295, 'adx_thresh': 24.798863301801465, 'atr_min_pct': 0.010239968577241987, 'atr_max_pct': 0.12388059617212138, 'tp_mult': 2.5282622424063272, 'tsl_mult': 0.11279315255613787, 'strategy': 'breakout', 'time_stop': 20, 'use_sma': False, 'use_atr': False, 'use_adx': False, 'use_ema': True, 'use_spike': True, 'rsi_required': False, 'edge_k': 1.9629672036418828, 'edge_cap': 0.6225435693836806, 'bull_strategy': 'mean_reversion', 'bull_bb_std_mult': 1.2200584528153144, 'bull_rsi_os': 25, 'bull_rsi_ob': 64, 'bull_adx_thresh': 14.618592132346027, 'bull_atr_min_pct': 0.006209585119886372, 'bull_atr_max_pct': 0.08964480689891641, 'bull_tp_mult': 2.1318777507578224, 'bull_tsl_mult': 0.9656537632498479, 'bull_time_stop': 72, 'bull_use_sma': False, 'bull_use_ema': False, 'bull_use_atr': False, 'bull_use_adx': False, 'bull_use_spike': False, 'bull_rsi_required': True, 'bear_strategy': 'mean_reversion', 'bear_bb_std_mult': 2.325256398695414, 'bear_rsi_os': 27, 'bear_rsi_ob': 78, 'bear_adx_thresh': 16.824564538323035, 'bear_atr_min_pct': 0.007125379427374205, 'bear_atr_max_pct': 0.1001080206072179, 'bear_tp_mult': 2.1215286573311976, 'bear_tsl_mult': 0.4749364368980169, 'bear_time_stop': 149, 'bear_use_sma': True, 'bear_use_ema': True, 'bear_use_atr': False, 'bear_use_adx': False, 'bear_use_spike': True, 'bear_rsi_required': True, 'sideways_strategy': 'breakout', 'sideways_bb_std_mult': 0.9170960874923132, 'sideways_rsi_os': 24, 'sideways_rsi_ob': 93, 'sideways_adx_thresh': 29.386415371868594, 'sideways_atr_min_pct': 0.011538879531873929, 'sideways_atr_max_pct': 0.1069711713732119, 'sideways_tp_mult': 2.9476561710384974, 'sideways_tsl_mult': 0.046795485487529674, 'sideways_time_stop': 6, 'sideways_use_sma': True, 'sideways_use_ema': True, 'sideways_use_atr': False, 'sideways_use_adx': False, 'sideways_use_spike': True, 'sideways_rsi_required': False}.
[I 2025-08-31 10:26:01,966] Trial 522 finished with values: [-1000000000.0, 1000000000.0] and parameters: {'p_sma': 9, 'p_std': 47, 'p_atr': 29, 'p_adx': 8, 'rsi_period': 26, 'ema1': 16, 'ema2': 30, 'slip_atr_k': 0.19518342355270477, 'slip_spread_k': 0.0463436521684142, 'spread_hl_frac': 0.008537628152571385, 'bb_std_mult': 2.574839228007042, 'rsi_os': 41, 'rsi_ob': 85, 'vol_spike': 0.2933982562908939, 'adx_thresh': 22.908349291083862, 'atr_min_pct': 0.0054927914418492416, 'atr_max_pct': 0.12264826106331207, 'tp_mult': 1.5216298576452016, 'tsl_mult': 0.07412688204883522, 'strategy': 'breakout', 'time_stop': 161, 'use_sma': False, 'use_atr': False, 'use_adx': False, 'use_ema': True, 'use_spike': False, 'rsi_required': True, 'edge_k': 0.7912040985398708, 'edge_cap': 0.11001396207145936, 'bull_strategy': 'mean_reversion', 'bull_bb_std_mult': 2.293340742651582, 'bull_rsi_os': 25, 'bull_rsi_ob': 61, 'bull_adx_thresh': 16.750319952862757, 'bull_atr_min_pct': 0.007956293884367284, 'bull_atr_max_pct': 0.08857425422322708, 'bull_tp_mult': 2.190553752327113, 'bull_tsl_mult': 0.9533378928492566, 'bull_time_stop': 72, 'bull_use_sma': True, 'bull_use_ema': False, 'bull_use_atr': True, 'bull_use_adx': True, 'bull_use_spike': False, 'bull_rsi_required': True, 'bear_strategy': 'breakout', 'bear_bb_std_mult': 3.541617913022006, 'bear_rsi_os': 27, 'bear_rsi_ob': 79, 'bear_adx_thresh': 15.845187686940127, 'bear_atr_min_pct': 0.00706217510037749, 'bear_atr_max_pct': 0.10093704373375839, 'bear_tp_mult': 2.11973179784548, 'bear_tsl_mult': 0.42441263984135197, 'bear_time_stop': 94, 'bear_use_sma': False, 'bear_use_ema': True, 'bear_use_atr': False, 'bear_use_adx': True, 'bear_use_spike': True, 'bear_rsi_required': True, 'sideways_strategy': 'breakout', 'sideways_bb_std_mult': 0.9240555100980482, 'sideways_rsi_os': 24, 'sideways_rsi_ob': 94, 'sideways_adx_thresh': 29.563701855324013, 'sideways_atr_min_pct': 0.01137538387225806, 'sideways_atr_max_pct': 0.11099199087243815, 'sideways_tp_mult': 2.8692176670328653, 'sideways_tsl_mult': 0.06389706231298008, 'sideways_time_stop': 260, 'sideways_use_sma': True, 'sideways_use_ema': True, 'sideways_use_atr': False, 'sideways_use_adx': False, 'sideways_use_spike': True, 'sideways_rsi_required': False}.
[I 2025-08-31 10:26:34,170] Trial 527 finished with values: [-1000000000.0, 1000000000.0] and parameters: {'p_sma': 9, 'p_std': 49, 'p_atr': 16, 'p_adx': 8, 'rsi_period': 26, 'ema1': 18, 'ema2': 56, 'slip_atr_k': 0.18219170784701547, 'slip_spread_k': 0.11723423877221856, 'spread_hl_frac': 0.005473780490551201, 'bb_std_mult': 2.5631249984200464, 'rsi_os': 38, 'rsi_ob': 82, 'vol_spike': 0.2794600836020111, 'adx_thresh': 23.002716713706313, 'atr_min_pct': 0.023876867313546844, 'atr_max_pct': 0.11736292254113401, 'tp_mult': 2.0792371353984187, 'tsl_mult': 0.05705781182215916, 'strategy': 'mean_reversion', 'time_stop': 160, 'use_sma': False, 'use_atr': False, 'use_adx': False, 'use_ema': True, 'use_spike': False, 'rsi_required': True, 'edge_k': 0.7947195943814102, 'edge_cap': 0.1017683837594508, 'bull_strategy': 'mean_reversion', 'bull_bb_std_mult': 1.0863397728956523, 'bull_rsi_os': 26, 'bull_rsi_ob': 66, 'bull_adx_thresh': 29.74520964699852, 'bull_atr_min_pct': 0.00706058167631882, 'bull_atr_max_pct': 0.09250875077071011, 'bull_tp_mult': 2.2411624657552536, 'bull_tsl_mult': 0.9158869866935824, 'bull_time_stop': 84, 'bull_use_sma': True, 'bull_use_ema': False, 'bull_use_atr': False, 'bull_use_adx': False, 'bull_use_spike': True, 'bull_rsi_required': True, 'bear_strategy': 'breakout', 'bear_bb_std_mult': 3.5356322165063534, 'bear_rsi_os': 30, 'bear_rsi_ob': 52, 'bear_adx_thresh': 21.173359304004553, 'bear_atr_min_pct': 0.008117358116562726, 'bear_atr_max_pct': 0.10281205776021772, 'bear_tp_mult': 2.053814613283857, 'bear_tsl_mult': 0.4744844635180752, 'bear_time_stop': 277, 'bear_use_sma': False, 'bear_use_ema': True, 'bear_use_atr': False, 'bear_use_adx': True, 'bear_use_spike': True, 'bear_rsi_required': True, 'sideways_strategy': 'mean_reversion', 'sideways_bb_std_mult': 0.9119379835294639, 'sideways_rsi_os': 23, 'sideways_rsi_ob': 92, 'sideways_adx_thresh': 30.73150557660485, 'sideways_atr_min_pct': 0.0063625855604114, 'sideways_atr_max_pct': 0.10719303168877531, 'sideways_tp_mult': 2.8285541181880998, 'sideways_tsl_mult': 0.027643014634120826, 'sideways_time_stop': 238, 'sideways_use_sma': True, 'sideways_use_ema': False, 'sideways_use_atr': True, 'sideways_use_adx': True, 'sideways_use_spike': True, 'sideways_rsi_required': True}.
[I 2025-08-31 10:26:34,679] Trial 528 finished with values: [-1000000000.0, 1000000000.0] and parameters: {'p_sma': 10, 'p_std': 48, 'p_atr': 19, 'p_adx': 9, 'rsi_period': 42, 'ema1': 17, 'ema2': 38, 'slip_atr_k': 0.1832877417140516, 'slip_spread_k': 0.1298110610428976, 'spread_hl_frac': 0.011735354245062514, 'bb_std_mult': 1.3643351873642162, 'rsi_os': 38, 'rsi_ob': 83, 'vol_spike': 0.2784966530110566, 'adx_thresh': 23.721920146079544, 'atr_min_pct': 0.027108571247274456, 'atr_max_pct': 0.11822187872755033, 'tp_mult': 2.2307022465075548, 'tsl_mult': 0.05775945758408351, 'strategy': 'mean_reversion', 'time_stop': 124, 'use_sma': False, 'use_atr': True, 'use_adx': False, 'use_ema': True, 'use_spike': False, 'rsi_required': True, 'edge_k': 1.8829421919022629, 'edge_cap': 0.1307896407073777, 'bull_strategy': 'mean_reversion', 'bull_bb_std_mult': 2.7912960891110026, 'bull_rsi_os': 23, 'bull_rsi_ob': 67, 'bull_adx_thresh': 29.735720988378038, 'bull_atr_min_pct': 0.007030922617294906, 'bull_atr_max_pct': 0.07791638773570356, 'bull_tp_mult': 2.3472900333594993, 'bull_tsl_mult': 0.9980105325944127, 'bull_time_stop': 83, 'bull_use_sma': True, 'bull_use_ema': True, 'bull_use_atr': False, 'bull_use_adx': False, 'bull_use_spike': True, 'bull_rsi_required': True, 'bear_strategy': 'breakout', 'bear_bb_std_mult': 2.955338229744132, 'bear_rsi_os': 25, 'bear_rsi_ob': 66, 'bear_adx_thresh': 21.289107378221487, 'bear_atr_min_pct': 0.007928349331859168, 'bear_atr_max_pct': 0.10293621923443495, 'bear_tp_mult': 2.0623875811469095, 'bear_tsl_mult': 0.4746075216320634, 'bear_time_stop': 274, 'bear_use_sma': False, 'bear_use_ema': True, 'bear_use_atr': False, 'bear_use_adx': True, 'bear_use_spike': True, 'bear_rsi_required': False, 'sideways_strategy': 'mean_reversion', 'sideways_bb_std_mult': 0.8146337369420673, 'sideways_rsi_os': 23, 'sideways_rsi_ob': 92, 'sideways_adx_thresh': 30.816620527560787, 'sideways_atr_min_pct': 0.01823743460379396, 'sideways_atr_max_pct': 0.10572499630345666, 'sideways_tp_mult': 2.83369870055999, 'sideways_tsl_mult': 0.030158708349998842, 'sideways_time_stop': 195, 'sideways_use_sma': True, 'sideways_use_ema': False, 'sideways_use_atr': True, 'sideways_use_adx': True, 'sideways_use_spike': True, 'sideways_rsi_required': True}.
[I 2025-08-31 10:26:34,786] Trial 526 finished with values: [-1000000000.0, 1000000000.0] and parameters: {'p_sma': 7, 'p_std': 49, 'p_atr': 16, 'p_adx': 9, 'rsi_period': 36, 'ema1': 17, 'ema2': 16, 'slip_atr_k': 0.19594842842438787, 'slip_spread_k': 0.08242138935478302, 'spread_hl_frac': 0.005938068726545322, 'bb_std_mult': 2.578352939403448, 'rsi_os': 41, 'rsi_ob': 82, 'vol_spike': 0.2801525976916957, 'adx_thresh': 24.02568849669104, 'atr_min_pct': 0.011755606355587582, 'atr_max_pct': 0.12295602430510108, 'tp_mult': 1.5258323006711372, 'tsl_mult': 0.11280030243625314, 'strategy': 'mean_reversion', 'time_stop': 152, 'use_sma': False, 'use_atr': False, 'use_adx': False, 'use_ema': True, 'use_spike': False, 'rsi_required': True, 'edge_k': 1.3451461881002675, 'edge_cap': 0.2039763934315189, 'bull_strategy': 'mean_reversion', 'bull_bb_std_mult': 0.7743692045692583, 'bull_rsi_os': 26, 'bull_rsi_ob': 86, 'bull_adx_thresh': 29.76961839549581, 'bull_atr_min_pct': 0.005793536286606797, 'bull_atr_max_pct': 0.09204973644678868, 'bull_tp_mult': 2.1596715453849793, 'bull_tsl_mult': 0.9984915176686007, 'bull_time_stop': 82, 'bull_use_sma': True, 'bull_use_ema': False, 'bull_use_atr': False, 'bull_use_adx': False, 'bull_use_spike': True, 'bull_rsi_required': True, 'bear_strategy': 'breakout', 'bear_bb_std_mult': 2.9418079174143883, 'bear_rsi_os': 27, 'bear_rsi_ob': 52, 'bear_adx_thresh': 21.197088503176932, 'bear_atr_min_pct': 0.007985407876344433, 'bear_atr_max_pct': 0.10277255213190528, 'bear_tp_mult': 2.1514014579600556, 'bear_tsl_mult': 0.4761445212036814, 'bear_time_stop': 147, 'bear_use_sma': False, 'bear_use_ema': True, 'bear_use_atr': False, 'bear_use_adx': True, 'bear_use_spike': True, 'bear_rsi_required': True, 'sideways_strategy': 'mean_reversion', 'sideways_bb_std_mult': 0.9287641784464294, 'sideways_rsi_os': 24, 'sideways_rsi_ob': 92, 'sideways_adx_thresh': 28.208436425714225, 'sideways_atr_min_pct': 0.0006637067924325979, 'sideways_atr_max_pct': 0.10526511410124233, 'sideways_tp_mult': 2.9985010110982238, 'sideways_tsl_mult': 0.5771201788118752, 'sideways_time_stop': 26, 'sideways_use_sma': True, 'sideways_use_ema': False, 'sideways_use_atr': True, 'sideways_use_adx': False, 'sideways_use_spike': True, 'sideways_rsi_required': True}.
[I 2025-08-31 10:26:35,053] Trial 525 finished with values: [-1000000000.0, 1000000000.0] and parameters: {'p_sma': 9, 'p_std': 49, 'p_atr': 16, 'p_adx': 8, 'rsi_period': 26, 'ema1': 17, 'ema2': 38, 'slip_atr_k': 0.19341147984889895, 'slip_spread_k': 0.10946644612658196, 'spread_hl_frac': 0.005807610513370438, 'bb_std_mult': 1.2269937979867547, 'rsi_os': 41, 'rsi_ob': 85, 'vol_spike': 0.2897174336240816, 'adx_thresh': 23.644495227112646, 'atr_min_pct': 0.005558419206375596, 'atr_max_pct': 0.12252621657366147, 'tp_mult': 1.2297652618544057, 'tsl_mult': 0.10769715548856813, 'strategy': 'mean_reversion', 'time_stop': 224, 'use_sma': False, 'use_atr': False, 'use_adx': False, 'use_ema': True, 'use_spike': False, 'rsi_required': True, 'edge_k': 1.8862802225632946, 'edge_cap': 0.6327820689371015, 'bull_strategy': 'mean_reversion', 'bull_bb_std_mult': 3.232838723935229, 'bull_rsi_os': 25, 'bull_rsi_ob': 74, 'bull_adx_thresh': 29.700514560080144, 'bull_atr_min_pct': 0.005876067022573662, 'bull_atr_max_pct': 0.09100757160436264, 'bull_tp_mult': 2.187614356682185, 'bull_tsl_mult': 0.9939746289730979, 'bull_time_stop': 73, 'bull_use_sma': True, 'bull_use_ema': False, 'bull_use_atr': False, 'bull_use_adx': False, 'bull_use_spike': False, 'bull_rsi_required': True, 'bear_strategy': 'breakout', 'bear_bb_std_mult': 1.0781670989818433, 'bear_rsi_os': 28, 'bear_rsi_ob': 78, 'bear_adx_thresh': 21.46046305718156, 'bear_atr_min_pct': 0.008049207734667682, 'bear_atr_max_pct': 0.10044421493219106, 'bear_tp_mult': 2.1426584157033615, 'bear_tsl_mult': 0.4751779855095358, 'bear_time_stop': 267, 'bear_use_sma': False, 'bear_use_ema': True, 'bear_use_atr': False, 'bear_use_adx': True, 'bear_use_spike': True, 'bear_rsi_required': True, 'sideways_strategy': 'mean_reversion', 'sideways_bb_std_mult': 0.9366292442675551, 'sideways_rsi_os': 23, 'sideways_rsi_ob': 92, 'sideways_adx_thresh': 30.746407855602815, 'sideways_atr_min_pct': 3.2614378973218946e-05, 'sideways_atr_max_pct': 0.10636094414605919, 'sideways_tp_mult': 2.883601283606037, 'sideways_tsl_mult': 0.06260849795186108, 'sideways_time_stop': 5, 'sideways_use_sma': True, 'sideways_use_ema': True, 'sideways_use_atr': False, 'sideways_use_adx': False, 'sideways_use_spike': True, 'sideways_rsi_required': True}.
[I 2025-08-31 10:27:08,155] Trial 531 finished with values: [-1000000000.0, 1000000000.0] and parameters: {'p_sma': 12, 'p_std': 45, 'p_atr': 29, 'p_adx': 23, 'rsi_period': 23, 'ema1': 18, 'ema2': 60, 'slip_atr_k': 0.17844848709625252, 'slip_spread_k': 0.11145648329296295, 'spread_hl_frac': 0.00969342704883043, 'bb_std_mult': 1.6979573926280773, 'rsi_os': 40, 'rsi_ob': 84, 'vol_spike': 0.2864136161110602, 'adx_thresh': 25.66709685131166, 'atr_min_pct': 0.02125350376633757, 'atr_max_pct': 0.12048686950028627, 'tp_mult': 2.912986957158674, 'tsl_mult': 0.050852051248019836, 'strategy': 'breakout', 'time_stop': 148, 'use_sma': True, 'use_atr': False, 'use_adx': False, 'use_ema': True, 'use_spike': False, 'rsi_required': True, 'edge_k': 1.9156169580777151, 'edge_cap': 0.6955410595378078, 'bull_strategy': 'breakout', 'bull_bb_std_mult': 1.8358897010468258, 'bull_rsi_os': 28, 'bull_rsi_ob': 65, 'bull_adx_thresh': 11.789503100559221, 'bull_atr_min_pct': 0.005024003449816865, 'bull_atr_max_pct': 0.08309244622454086, 'bull_tp_mult': 2.283388580565078, 'bull_tsl_mult': 0.9812375122566696, 'bull_time_stop': 64, 'bull_use_sma': True, 'bull_use_ema': False, 'bull_use_atr': False, 'bull_use_adx': False, 'bull_use_spike': False, 'bull_rsi_required': False, 'bear_strategy': 'breakout', 'bear_bb_std_mult': 2.098318192564861, 'bear_rsi_os': 28, 'bear_rsi_ob': 76, 'bear_adx_thresh': 22.199788614171748, 'bear_atr_min_pct': 0.0061936945514406904, 'bear_atr_max_pct': 0.11330728318012014, 'bear_tp_mult': 2.033345691030895, 'bear_tsl_mult': 0.4085496947211339, 'bear_time_stop': 29, 'bear_use_sma': False, 'bear_use_ema': False, 'bear_use_atr': True, 'bear_use_adx': True, 'bear_use_spike': True, 'bear_rsi_required': True, 'sideways_strategy': 'breakout', 'sideways_bb_std_mult': 0.9527174422781443, 'sideways_rsi_os': 11, 'sideways_rsi_ob': 94, 'sideways_adx_thresh': 27.90675756888141, 'sideways_atr_min_pct': 0.0078108137217887804, 'sideways_atr_max_pct': 0.10136496525989869, 'sideways_tp_mult': 2.898256062088592, 'sideways_tsl_mult': 0.07808101147289287, 'sideways_time_stop': 277, 'sideways_use_sma': False, 'sideways_use_ema': True, 'sideways_use_atr': False, 'sideways_use_adx': False, 'sideways_use_spike': True, 'sideways_rsi_required': False}.
[I 2025-08-31 10:27:08,330] Trial 529 finished with values: [-1000000000.0, 1000000000.0] and parameters: {'p_sma': 10, 'p_std': 49, 'p_atr': 29, 'p_adx': 9, 'rsi_period': 67, 'ema1': 17, 'ema2': 39, 'slip_atr_k': 0.1771788161291283, 'slip_spread_k': 0.11379476300862994, 'spread_hl_frac': 0.02084639735683737, 'bb_std_mult': 1.3423395000736131, 'rsi_os': 43, 'rsi_ob': 83, 'vol_spike': 0.28579663801250227, 'adx_thresh': 23.733512823965075, 'atr_min_pct': 0.011885494821712177, 'atr_max_pct': 0.11680918637913436, 'tp_mult': 2.998263210094916, 'tsl_mult': 0.10878592026515886, 'strategy': 'mean_reversion', 'time_stop': 153, 'use_sma': False, 'use_atr': True, 'use_adx': False, 'use_ema': True, 'use_spike': False, 'rsi_required': True, 'edge_k': 1.875707308795418, 'edge_cap': 0.6806283046695855, 'bull_strategy': 'mean_reversion', 'bull_bb_std_mult': 3.3718402703973744, 'bull_rsi_os': 28, 'bull_rsi_ob': 67, 'bull_adx_thresh': 11.873366995408514, 'bull_atr_min_pct': 0.005605752964283902, 'bull_atr_max_pct': 0.07692121359470229, 'bull_tp_mult': 2.3544401479048593, 'bull_tsl_mult': 0.9975642946661772, 'bull_time_stop': 63, 'bull_use_sma': True, 'bull_use_ema': True, 'bull_use_atr': False, 'bull_use_adx': False, 'bull_use_spike': False, 'bull_rsi_required': True, 'bear_strategy': 'breakout', 'bear_bb_std_mult': 2.925914665592606, 'bear_rsi_os': 28, 'bear_rsi_ob': 66, 'bear_adx_thresh': 11.292351864004267, 'bear_atr_min_pct': 0.006283416357021558, 'bear_atr_max_pct': 0.10405579187982927, 'bear_tp_mult': 2.009056958941321, 'bear_tsl_mult': 0.4783383840733991, 'bear_time_stop': 294, 'bear_use_sma': False, 'bear_use_ema': True, 'bear_use_atr': False, 'bear_use_adx': True, 'bear_use_spike': True, 'bear_rsi_required': False, 'sideways_strategy': 'mean_reversion', 'sideways_bb_std_mult': 0.9481012432175803, 'sideways_rsi_os': 23, 'sideways_rsi_ob': 95, 'sideways_adx_thresh': 28.0406194930938, 'sideways_atr_min_pct': 0.01818132303256924, 'sideways_atr_max_pct': 0.1047547082843003, 'sideways_tp_mult': 2.993698197356478, 'sideways_tsl_mult': 0.0786100513065211, 'sideways_time_stop': 29, 'sideways_use_sma': True, 'sideways_use_ema': False, 'sideways_use_atr': False, 'sideways_use_adx': False, 'sideways_use_spike': True, 'sideways_rsi_required': True}.
