[I 2025-08-31 10:59:39,959] Trial 765 finished with values: [-1000000000.0, 1000000000.0] and parameters: {'p_sma': 11, 'p_std': 10, 'p_atr': 29, 'p_adx': 8, 'rsi_period': 19, 'ema1': 30, 'ema2': 37, 'slip_atr_k': 0.08895312875573987, 'slip_spread_k': 0.9928710093665543, 'spread_hl_frac': 0.013181350261821424, 'bb_std_mult': 1.8117050642861263, 'rsi_os': 41, 'rsi_ob': 84, 'vol_spike': 0.18607459178263186, 'adx_thresh': 24.356855577361333, 'atr_min_pct': 0.009675141532882662, 'atr_max_pct': 0.11724771744175345, 'tp_mult': 2.345138934996283, 'tsl_mult': 0.054945734292008296, 'strategy': 'breakout', 'time_stop': 23, 'use_sma': False, 'use_atr': False, 'use_adx': False, 'use_ema': True, 'use_spike': True, 'rsi_required': True, 'edge_k': 1.955890933844139, 'edge_cap': 0.13228483404118857, 'bull_strategy': 'mean_reversion', 'bull_bb_std_mult': 1.2774617402635329, 'bull_rsi_os': 36, 'bull_rsi_ob': 63, 'bull_adx_thresh': 28.35029306207708, 'bull_atr_min_pct': 0.023534013572309935, 'bull_atr_max_pct': 0.08817123409497064, 'bull_tp_mult': 2.878484602344228, 'bull_tsl_mult': 0.9993915519508805, 'bull_time_stop': 73, 'bull_use_sma': True, 'bull_use_ema': False, 'bull_use_atr': False, 'bull_use_adx': False, 'bull_use_spike': False, 'bull_rsi_required': True, 'bear_strategy': 'breakout', 'bear_bb_std_mult': 2.956806497862817, 'bear_rsi_os': 25, 'bear_rsi_ob': 78, 'bear_adx_thresh': 20.800441935319114, 'bear_atr_min_pct': 0.007037292074149096, 'bear_atr_max_pct': 0.10607370059101204, 'bear_tp_mult': 1.9794143203405161, 'bear_tsl_mult': 0.5039389762894826, 'bear_time_stop': 120, 'bear_use_sma': False, 'bear_use_ema': True, 'bear_use_atr': True, 'bear_use_adx': True, 'bear_use_spike': True, 'bear_rsi_required': True, 'sideways_strategy': 'breakout', 'sideways_bb_std_mult': 0.9279604181500396, 'sideways_rsi_os': 23, 'sideways_rsi_ob': 91, 'sideways_adx_thresh': 5.4077586219980205, 'sideways_atr_min_pct': 0.0018172551518869685, 'sideways_atr_max_pct': 0.100626382089818, 'sideways_tp_mult': 2.1191295746113346, 'sideways_tsl_mult': 0.5796803762771866, 'sideways_time_stop': 227, 'sideways_use_sma': False, 'sideways_use_ema': True, 'sideways_use_atr': False, 'sideways_use_adx': False, 'sideways_use_spike': True, 'sideways_rsi_required': False}.
[I 2025-08-31 10:59:40,297] Trial 767 finished with values: [-0.01335148884884585, 0.013231879051291875] and parameters: {'p_sma': 11, 'p_std': 26, 'p_atr': 28, 'p_adx': 27, 'rsi_period': 19, 'ema1': 5, 'ema2': 33, 'slip_atr_k': 0.18342000906861497, 'slip_spread_k': 0.004826964322732719, 'spread_hl_frac': 0.01082040388984648, 'bb_std_mult': 1.2392302530667505, 'rsi_os': 37, 'rsi_ob': 53, 'vol_spike': 0.27986029492224823, 'adx_thresh': 24.926882893326788, 'atr_min_pct': 0.011206217228690774, 'atr_max_pct': 0.09769385098827212, 'tp_mult': 2.7915149651286244, 'tsl_mult': 0.33707503301428626, 'strategy': 'breakout', 'time_stop': 133, 'use_sma': False, 'use_atr': False, 'use_adx': False, 'use_ema': True, 'use_spike': True, 'rsi_required': False, 'edge_k': 1.7991498919056395, 'edge_cap': 0.0720630337452643, 'bull_strategy': 'mean_reversion', 'bull_bb_std_mult': 3.493893356411406, 'bull_rsi_os': 28, 'bull_rsi_ob': 60, 'bull_adx_thresh': 17.08584270460896, 'bull_atr_min_pct': 0.008267302478166627, 'bull_atr_max_pct': 0.09557334580272832, 'bull_tp_mult': 2.138496194368207, 'bull_tsl_mult': 0.9643998217431843, 'bull_time_stop': 200, 'bull_use_sma': True, 'bull_use_ema': False, 'bull_use_atr': False, 'bull_use_adx': True, 'bull_use_spike': True, 'bull_rsi_required': True, 'bear_strategy': 'breakout', 'bear_bb_std_mult': 2.8414063732249075, 'bear_rsi_os': 24, 'bear_rsi_ob': 81, 'bear_adx_thresh': 21.024514501327637, 'bear_atr_min_pct': 0.006286231379192819, 'bear_atr_max_pct': 0.1064033960190696, 'bear_tp_mult': 2.0251892380670626, 'bear_tsl_mult': 0.4108089615613166, 'bear_time_stop': 5, 'bear_use_sma': False, 'bear_use_ema': True, 'bear_use_atr': True, 'bear_use_adx': True, 'bear_use_spike': True, 'bear_rsi_required': True, 'sideways_strategy': 'breakout', 'sideways_bb_std_mult': 0.5855877409110353, 'sideways_rsi_os': 23, 'sideways_rsi_ob': 73, 'sideways_adx_thresh': 17.154882557808463, 'sideways_atr_min_pct': 0.0010577964266728183, 'sideways_atr_max_pct': 0.107184963761641, 'sideways_tp_mult': 1.964191784554718, 'sideways_tsl_mult': 0.0663955635533317, 'sideways_time_stop': 228, 'sideways_use_sma': False, 'sideways_use_ema': True, 'sideways_use_atr': True, 'sideways_use_adx': False, 'sideways_use_spike': True, 'sideways_rsi_required': False}.
[I 2025-08-31 10:59:40,487] Trial 768 finished with values: [-1000000000.0, 1000000000.0] and parameters: {'p_sma': 13, 'p_std': 50, 'p_atr': 28, 'p_adx': 10, 'rsi_period': 33, 'ema1': 17, 'ema2': 33, 'slip_atr_k': 0.1836585909967367, 'slip_spread_k': 0.015781734588842966, 'spread_hl_frac': 0.010811267545234834, 'bb_std_mult': 2.3714176643770264, 'rsi_os': 12, 'rsi_ob': 83, 'vol_spike': 0.2784477149745105, 'adx_thresh': 25.001713080749255, 'atr_min_pct': 0.02837305697490483, 'atr_max_pct': 0.11466061144386377, 'tp_mult': 2.9449028639711696, 'tsl_mult': 0.3396960314924089, 'strategy': 'breakout', 'time_stop': 149, 'use_sma': False, 'use_atr': False, 'use_adx': False, 'use_ema': True, 'use_spike': True, 'rsi_required': False, 'edge_k': 0.765340353454872, 'edge_cap': 0.13644373619301098, 'bull_strategy': 'mean_reversion', 'bull_bb_std_mult': 1.2885016803420823, 'bull_rsi_os': 36, 'bull_rsi_ob': 67, 'bull_adx_thresh': 32.72860489315724, 'bull_atr_min_pct': 0.00826141973774426, 'bull_atr_max_pct': 0.025343131969641657, 'bull_tp_mult': 2.2310602678255718, 'bull_tsl_mult': 0.7276051820170798, 'bull_time_stop': 276, 'bull_use_sma': True, 'bull_use_ema': False, 'bull_use_atr': True, 'bull_use_adx': True, 'bull_use_spike': True, 'bull_rsi_required': True, 'bear_strategy': 'breakout', 'bear_bb_std_mult': 2.9581502009564513, 'bear_rsi_os': 25, 'bear_rsi_ob': 83, 'bear_adx_thresh': 20.707488687391447, 'bear_atr_min_pct': 0.023990018207610923, 'bear_atr_max_pct': 0.10296661145497116, 'bear_tp_mult': 1.9967430512389068, 'bear_tsl_mult': 0.8449589754053011, 'bear_time_stop': 195, 'bear_use_sma': False, 'bear_use_ema': True, 'bear_use_atr': True, 'bear_use_adx': True, 'bear_use_spike': True, 'bear_rsi_required': True, 'sideways_strategy': 'breakout', 'sideways_bb_std_mult': 3.576842131094858, 'sideways_rsi_os': 25, 'sideways_rsi_ob': 90, 'sideways_adx_thresh': 16.04310696525289, 'sideways_atr_min_pct': 0.0010443433427831574, 'sideways_atr_max_pct': 0.10690846002240444, 'sideways_tp_mult': 1.7272195151037302, 'sideways_tsl_mult': 0.06553609795168339, 'sideways_time_stop': 284, 'sideways_use_sma': False, 'sideways_use_ema': True, 'sideways_use_atr': True, 'sideways_use_adx': False, 'sideways_use_spike': True, 'sideways_rsi_required': False}.
[I 2025-08-31 10:59:40,573] Trial 766 finished with values: [-0.035153053333059736, 0.035031750699363054] and parameters: {'p_sma': 11, 'p_std': 50, 'p_atr': 10, 'p_adx': 10, 'rsi_period': 19, 'ema1': 18, 'ema2': 51, 'slip_atr_k': 0.24901755405208637, 'slip_spread_k': 0.6573340722342844, 'spread_hl_frac': 0.037387348507165886, 'bb_std_mult': 2.3584127871011824, 'rsi_os': 30, 'rsi_ob': 84, 'vol_spike': 0.17132114969555448, 'adx_thresh': 24.786765855111906, 'atr_min_pct': 0.004828278224034303, 'atr_max_pct': 0.09853453680962829, 'tp_mult': 2.9541116767566438, 'tsl_mult': 0.07565534354041599, 'strategy': 'breakout', 'time_stop': 150, 'use_sma': False, 'use_atr': False, 'use_adx': False, 'use_ema': True, 'use_spike': True, 'rsi_required': True, 'edge_k': 1.7832207395139348, 'edge_cap': 0.47017817398610784, 'bull_strategy': 'mean_reversion', 'bull_bb_std_mult': 1.275435115345926, 'bull_rsi_os': 27, 'bull_rsi_ob': 49, 'bull_adx_thresh': 16.374164981209347, 'bull_atr_min_pct': 0.008395952292511302, 'bull_atr_max_pct': 0.04861534543395152, 'bull_tp_mult': 2.2361176612562077, 'bull_tsl_mult': 0.7317590134591522, 'bull_time_stop': 275, 'bull_use_sma': True, 'bull_use_ema': False, 'bull_use_atr': False, 'bull_use_adx': False, 'bull_use_spike': False, 'bull_rsi_required': True, 'bear_strategy': 'breakout', 'bear_bb_std_mult': 2.151955027029108, 'bear_rsi_os': 32, 'bear_rsi_ob': 81, 'bear_adx_thresh': 22.524007915067422, 'bear_atr_min_pct': 0.005588376895333829, 'bear_atr_max_pct': 0.12949264247193928, 'bear_tp_mult': 2.0221980843422633, 'bear_tsl_mult': 0.13332519047566888, 'bear_time_stop': 270, 'bear_use_sma': False, 'bear_use_ema': True, 'bear_use_atr': True, 'bear_use_adx': True, 'bear_use_spike': True, 'bear_rsi_required': True, 'sideways_strategy': 'breakout', 'sideways_bb_std_mult': 2.4650981100107727, 'sideways_rsi_os': 23, 'sideways_rsi_ob': 90, 'sideways_adx_thresh': 16.92367719340315, 'sideways_atr_min_pct': 0.001052554959709782, 'sideways_atr_max_pct': 0.10094893916605084, 'sideways_tp_mult': 1.7257416520278468, 'sideways_tsl_mult': 0.5857528470709339, 'sideways_time_stop': 210, 'sideways_use_sma': False, 'sideways_use_ema': True, 'sideways_use_atr': False, 'sideways_use_adx': False, 'sideways_use_spike': True, 'sideways_rsi_required': False}.
[I 2025-08-31 11:00:12,397] Trial 770 finished with values: [-1000000000.0, 1000000000.0] and parameters: {'p_sma': 31, 'p_std': 50, 'p_atr': 12, 'p_adx': 12, 'rsi_period': 26, 'ema1': 11, 'ema2': 18, 'slip_atr_k': 0.18193365774189313, 'slip_spread_k': 0.6494888971386649, 'spread_hl_frac': 0.010936879148986495, 'bb_std_mult': 1.2490451720877984, 'rsi_os': 40, 'rsi_ob': 94, 'vol_spike': 0.2788555913368841, 'adx_thresh': 24.929458055886258, 'atr_min_pct': 0.011310187332204987, 'atr_max_pct': 0.12238887145866013, 'tp_mult': 2.9477897353149594, 'tsl_mult': 0.08092016350259958, 'strategy': 'breakout', 'time_stop': 200, 'use_sma': False, 'use_atr': True, 'use_adx': False, 'use_ema': True, 'use_spike': False, 'rsi_required': False, 'edge_k': 1.6854126622406047, 'edge_cap': 0.47025168211695983, 'bull_strategy': 'mean_reversion', 'bull_bb_std_mult': 1.1950927707335661, 'bull_rsi_os': 22, 'bull_rsi_ob': 66, 'bull_adx_thresh': 12.321030305451973, 'bull_atr_min_pct': 0.0077256331049657375, 'bull_atr_max_pct': 0.08316915978161854, 'bull_tp_mult': 2.218547860179378, 'bull_tsl_mult': 0.9293574847412028, 'bull_time_stop': 86, 'bull_use_sma': True, 'bull_use_ema': False, 'bull_use_atr': False, 'bull_use_adx': True, 'bull_use_spike': True, 'bull_rsi_required': True, 'bear_strategy': 'breakout', 'bear_bb_std_mult': 2.8540725006347265, 'bear_rsi_os': 29, 'bear_rsi_ob': 83, 'bear_adx_thresh': 22.43002114279037, 'bear_atr_min_pct': 0.011062475103626734, 'bear_atr_max_pct': 0.10329547214814933, 'bear_tp_mult': 1.5580949960695305, 'bear_tsl_mult': 0.4142174408391197, 'bear_time_stop': 268, 'bear_use_sma': False, 'bear_use_ema': True, 'bear_use_atr': False, 'bear_use_adx': False, 'bear_use_spike': True, 'bear_rsi_required': False, 'sideways_strategy': 'breakout', 'sideways_bb_std_mult': 0.939673176515605, 'sideways_rsi_os': 54, 'sideways_rsi_ob': 95, 'sideways_adx_thresh': 29.623861356648035, 'sideways_atr_min_pct': 0.025603827372588622, 'sideways_atr_max_pct': 0.10456311559139066, 'sideways_tp_mult': 1.8592839826463328, 'sideways_tsl_mult': 0.06963377870300971, 'sideways_time_stop': 139, 'sideways_use_sma': True, 'sideways_use_ema': False, 'sideways_use_atr': True, 'sideways_use_adx': False, 'sideways_use_spike': True, 'sideways_rsi_required': False}.
[I 2025-08-31 11:00:12,938] Trial 772 finished with values: [-1000000000.0, 1000000000.0] and parameters: {'p_sma': 22, 'p_std': 52, 'p_atr': 12, 'p_adx': 26, 'rsi_period': 62, 'ema1': 5, 'ema2': 39, 'slip_atr_k': 0.03660516649891431, 'slip_spread_k': 0.9123176939187649, 'spread_hl_frac': 0.013510316465281736, 'bb_std_mult': 2.0476890886796815, 'rsi_os': 17, 'rsi_ob': 93, 'vol_spike': 0.28502455050704734, 'adx_thresh': 23.31222406106959, 'atr_min_pct': 0.011258593380496154, 'atr_max_pct': 0.12108161634872777, 'tp_mult': 2.8972678012711226, 'tsl_mult': 0.030782474948718993, 'strategy': 'breakout', 'time_stop': 31, 'use_sma': False, 'use_atr': True, 'use_adx': False, 'use_ema': True, 'use_spike': False, 'rsi_required': False, 'edge_k': 1.7161741789434888, 'edge_cap': 0.1836765235836789, 'bull_strategy': 'mean_reversion', 'bull_bb_std_mult': 1.2034615846811965, 'bull_rsi_os': 28, 'bull_rsi_ob': 87, 'bull_adx_thresh': 10.831450848431825, 'bull_atr_min_pct': 0.010531558197548745, 'bull_atr_max_pct': 0.09559612624227357, 'bull_tp_mult': 2.1913738486115815, 'bull_tsl_mult': 0.9241299706606408, 'bull_time_stop': 81, 'bull_use_sma': True, 'bull_use_ema': True, 'bull_use_atr': False, 'bull_use_adx': True, 'bull_use_spike': True, 'bull_rsi_required': True, 'bear_strategy': 'breakout', 'bear_bb_std_mult': 1.5541612459767875, 'bear_rsi_os': 29, 'bear_rsi_ob': 77, 'bear_adx_thresh': 23.238349447948117, 'bear_atr_min_pct': 0.00450002642568585, 'bear_atr_max_pct': 0.10259557048161187, 'bear_tp_mult': 2.061748667137729, 'bear_tsl_mult': 0.42320825598491574, 'bear_time_stop': 171, 'bear_use_sma': True, 'bear_use_ema': True, 'bear_use_atr': False, 'bear_use_adx': False, 'bear_use_spike': True, 'bear_rsi_required': False, 'sideways_strategy': 'breakout', 'sideways_bb_std_mult': 1.1269452113919272, 'sideways_rsi_os': 27, 'sideways_rsi_ob': 54, 'sideways_adx_thresh': 29.599275104702134, 'sideways_atr_min_pct': 0.0005510100370930285, 'sideways_atr_max_pct': 0.1044715075413448, 'sideways_tp_mult': 2.268002354789413, 'sideways_tsl_mult': 0.12963666339142144, 'sideways_time_stop': 130, 'sideways_use_sma': True, 'sideways_use_ema': False, 'sideways_use_atr': True, 'sideways_use_adx': False, 'sideways_use_spike': True, 'sideways_rsi_required': False}.
[I 2025-08-31 11:00:13,018] Trial 769 finished with values: [-0.024489253142091494, 0.024340801665522736] and parameters: {'p_sma': 37, 'p_std': 52, 'p_atr': 12, 'p_adx': 10, 'rsi_period': 26, 'ema1': 17, 'ema2': 52, 'slip_atr_k': 0.24823117582070692, 'slip_spread_k': 0.915865747152492, 'spread_hl_frac': 0.010775796656644077, 'bb_std_mult': 1.2480736502698984, 'rsi_os': 40, 'rsi_ob': 92, 'vol_spike': 0.17023609737015444, 'adx_thresh': 23.773231323661832, 'atr_min_pct': 0.005115530707364079, 'atr_max_pct': 0.09775143279118113, 'tp_mult': 2.9378867277379648, 'tsl_mult': 0.08178734918970172, 'strategy': 'breakout', 'time_stop': 153, 'use_sma': False, 'use_atr': False, 'use_adx': False, 'use_ema': True, 'use_spike': True, 'rsi_required': False, 'edge_k': 1.783538254946199, 'edge_cap': 0.20369607143832397, 'bull_strategy': 'mean_reversion', 'bull_bb_std_mult': 1.1989476574389601, 'bull_rsi_os': 44, 'bull_rsi_ob': 61, 'bull_adx_thresh': 16.31412239793791, 'bull_atr_min_pct': 0.010418589710045261, 'bull_atr_max_pct': 0.06281656405408462, 'bull_tp_mult': 2.579276385198532, 'bull_tsl_mult': 0.8209331432390277, 'bull_time_stop': 83, 'bull_use_sma': True, 'bull_use_ema': False, 'bull_use_atr': True, 'bull_use_adx': True, 'bull_use_spike': True, 'bull_rsi_required': True, 'bear_strategy': 'breakout', 'bear_bb_std_mult': 2.843223463454916, 'bear_rsi_os': 30, 'bear_rsi_ob': 81, 'bear_adx_thresh': 32.14024057577571, 'bear_atr_min_pct': 0.023947355430089214, 'bear_atr_max_pct': 0.10239884496101302, 'bear_tp_mult': 1.798045176664737, 'bear_tsl_mult': 0.4177483748608436, 'bear_time_stop': 266, 'bear_use_sma': False, 'bear_use_ema': True, 'bear_use_atr': True, 'bear_use_adx': True, 'bear_use_spike': True, 'bear_rsi_required': True, 'sideways_strategy': 'breakout', 'sideways_bb_std_mult': 3.5987672780583617, 'sideways_rsi_os': 25, 'sideways_rsi_ob': 93, 'sideways_adx_thresh': 29.633906759836496, 'sideways_atr_min_pct': 0.0010266643749070237, 'sideways_atr_max_pct': 0.10702406064695862, 'sideways_tp_mult': 2.9744793166385564, 'sideways_tsl_mult': 0.06716113562226704, 'sideways_time_stop': 92, 'sideways_use_sma': False, 'sideways_use_ema': False, 'sideways_use_atr': True, 'sideways_use_adx': False, 'sideways_use_spike': True, 'sideways_rsi_required': False}.
[I 2025-08-31 11:00:13,314] Trial 771 finished with values: [-0.022438394497756198, 0.022337895492873804] and parameters: {'p_sma': 31, 'p_std': 50, 'p_atr': 29, 'p_adx': 13, 'rsi_period': 27, 'ema1': 24, 'ema2': 31, 'slip_atr_k': 0.18292161294159348, 'slip_spread_k': 0.06503574182508978, 'spread_hl_frac': 0.003557871989797068, 'bb_std_mult': 1.1087916190256197, 'rsi_os': 17, 'rsi_ob': 86, 'vol_spike': 0.28580745296483584, 'adx_thresh': 23.53401516133853, 'atr_min_pct': 0.011286251194643646, 'atr_max_pct': 0.12084078808221153, 'tp_mult': 2.7849075423565277, 'tsl_mult': 0.0777442638897322, 'strategy': 'breakout', 'time_stop': 196, 'use_sma': False, 'use_atr': True, 'use_adx': False, 'use_ema': True, 'use_spike': False, 'rsi_required': False, 'edge_k': 1.8458190102597385, 'edge_cap': 0.46564633098745034, 'bull_strategy': 'mean_reversion', 'bull_bb_std_mult': 1.2011906500516785, 'bull_rsi_os': 28, 'bull_rsi_ob': 60, 'bull_adx_thresh': 30.186191566769715, 'bull_atr_min_pct': 0.01526127614416354, 'bull_atr_max_pct': 0.08573318629995477, 'bull_tp_mult': 2.2000463260954244, 'bull_tsl_mult': 0.383721580719514, 'bull_time_stop': 85, 'bull_use_sma': True, 'bull_use_ema': False, 'bull_use_atr': False, 'bull_use_adx': True, 'bull_use_spike': True, 'bull_rsi_required': True, 'bear_strategy': 'breakout', 'bear_bb_std_mult': 2.831806477718603, 'bear_rsi_os': 29, 'bear_rsi_ob': 74, 'bear_adx_thresh': 22.559432263146483, 'bear_atr_min_pct': 0.01748811980382333, 'bear_atr_max_pct': 0.09634367345501427, 'bear_tp_mult': 2.083318084388465, 'bear_tsl_mult': 0.4230057912997205, 'bear_time_stop': 171, 'bear_use_sma': False, 'bear_use_ema': True, 'bear_use_atr': False, 'bear_use_adx': False, 'bear_use_spike': True, 'bear_rsi_required': False, 'sideways_strategy': 'breakout', 'sideways_bb_std_mult': 1.6459980486608188, 'sideways_rsi_os': 26, 'sideways_rsi_ob': 54, 'sideways_adx_thresh': 16.82627322988515, 'sideways_atr_min_pct': 0.0006021445547388575, 'sideways_atr_max_pct': 0.10369817467630564, 'sideways_tp_mult': 2.27819494100125, 'sideways_tsl_mult': 0.07010459410544359, 'sideways_time_stop': 84, 'sideways_use_sma': True, 'sideways_use_ema': False, 'sideways_use_atr': True, 'sideways_use_adx': False, 'sideways_use_spike': True, 'sideways_rsi_required': False}.
[I 2025-08-31 11:00:46,746] Trial 773 finished with values: [-0.029845378599126393, 0.029700563435948776] and parameters: {'p_sma': 22, 'p_std': 39, 'p_atr': 29, 'p_adx': 26, 'rsi_period': 23, 'ema1': 5, 'ema2': 29, 'slip_atr_k': 0.03814783257960257, 'slip_spread_k': 0.9181857198339554, 'spread_hl_frac': 0.0034424853065679537, 'bb_std_mult': 2.2471942322143383, 'rsi_os': 37, 'rsi_ob': 86, 'vol_spike': 0.28687741286150953, 'adx_thresh': 23.71527477085879, 'atr_min_pct': 0.011097676589630059, 'atr_max_pct': 0.12081383576948207, 'tp_mult': 2.802185836419228, 'tsl_mult': 0.032114637776296286, 'strategy': 'breakout', 'time_stop': 133, 'use_sma': False, 'use_atr': False, 'use_adx': True, 'use_ema': True, 'use_spike': False, 'rsi_required': True, 'edge_k': 1.8481433681813282, 'edge_cap': 0.3366001379112731, 'bull_strategy': 'mean_reversion', 'bull_bb_std_mult': 2.9982692839706258, 'bull_rsi_os': 28, 'bull_rsi_ob': 65, 'bull_adx_thresh': 32.00449481664562, 'bull_atr_min_pct': 0.0077012731687022395, 'bull_atr_max_pct': 0.09605224833993947, 'bull_tp_mult': 2.1451774570863313, 'bull_tsl_mult': 0.14383181579178517, 'bull_time_stop': 69, 'bull_use_sma': True, 'bull_use_ema': True, 'bull_use_atr': False, 'bull_use_adx': False, 'bull_use_spike': False, 'bull_rsi_required': False, 'bear_strategy': 'breakout', 'bear_bb_std_mult': 1.544676078113182, 'bear_rsi_os': 28, 'bear_rsi_ob': 52, 'bear_adx_thresh': 24.769873331315537, 'bear_atr_min_pct': 0.0063077821684550915, 'bear_atr_max_pct': 0.0958772167262241, 'bear_tp_mult': 1.809474463750207, 'bear_tsl_mult': 0.44091906560020516, 'bear_time_stop': 173, 'bear_use_sma': True, 'bear_use_ema': True, 'bear_use_atr': False, 'bear_use_adx': False, 'bear_use_spike': True, 'bear_rsi_required': True, 'sideways_strategy': 'breakout', 'sideways_bb_std_mult': 3.2179854372988976, 'sideways_rsi_os': 27, 'sideways_rsi_ob': 95, 'sideways_adx_thresh': 10.22204994680052, 'sideways_atr_min_pct': 0.0006086288384316384, 'sideways_atr_max_pct': 0.10470263379771677, 'sideways_tp_mult': 2.8432564903283324, 'sideways_tsl_mult': 0.937868986991296, 'sideways_time_stop': 93, 'sideways_use_sma': True, 'sideways_use_ema': False, 'sideways_use_atr': False, 'sideways_use_adx': True, 'sideways_use_spike': True, 'sideways_rsi_required': False}.
