[I 2025-08-31 09:36:35,240] Trial 126 finished with values: [-1000000000.0, 1000000000.0] and parameters: {'p_sma': 39, 'p_std': 9, 'p_atr': 23, 'p_adx': 29, 'rsi_period': 37, 'ema1': 8, 'ema2': 54, 'slip_atr_k': 0.1692074348000344, 'slip_spread_k': 0.03727257446139015, 'spread_hl_frac': 0.046724048871677734, 'bb_std_mult': 1.2760273003232392, 'rsi_os': 21, 'rsi_ob': 75, 'vol_spike': 0.09220973833227655, 'adx_thresh': 5.282397218657133, 'atr_min_pct': 0.01711360446638697, 'atr_max_pct': 0.023520533934808047, 'tp_mult': 1.0217799487628225, 'tsl_mult': 0.8403999305684864, 'strategy': 'breakout', 'time_stop': 300, 'use_sma': True, 'use_atr': True, 'use_adx': False, 'use_ema': True, 'use_spike': False, 'rsi_required': False, 'edge_k': 1.5489655146973171, 'edge_cap': 0.19012478397524943, 'bull_strategy': 'breakout', 'bull_bb_std_mult': 2.0952555477328882, 'bull_rsi_os': 31, 'bull_rsi_ob': 78, 'bull_adx_thresh': 30.150037416394294, 'bull_atr_min_pct': 0.012939811492646967, 'bull_atr_max_pct': 0.116764941883141, 'bull_tp_mult': 1.0473667859921354, 'bull_tsl_mult': 0.5927091591856666, 'bull_time_stop': 182, 'bull_use_sma': False, 'bull_use_ema': False, 'bull_use_atr': True, 'bull_use_adx': True, 'bull_use_spike': True, 'bull_rsi_required': True, 'bear_strategy': 'mean_reversion', 'bear_bb_std_mult': 2.7086483729616666, 'bear_rsi_os': 16, 'bear_rsi_ob': 80, 'bear_adx_thresh': 21.316479200963226, 'bear_atr_min_pct': 0.0278677013523084, 'bear_atr_max_pct': 0.07063861186869257, 'bear_tp_mult': 2.134863062277815, 'bear_tsl_mult': 0.027925840533937207, 'bear_time_stop': 292, 'bear_use_sma': False, 'bear_use_ema': True, 'bear_use_atr': False, 'bear_use_adx': True, 'bear_use_spike': True, 'bear_rsi_required': False, 'sideways_strategy': 'breakout', 'sideways_bb_std_mult': 1.8373474832809418, 'sideways_rsi_os': 8, 'sideways_rsi_ob': 66, 'sideways_adx_thresh': 16.260039261602355, 'sideways_atr_min_pct': 0.0025748655713929043, 'sideways_atr_max_pct': 0.022823399351781654, 'sideways_tp_mult': 1.5662864187492016, 'sideways_tsl_mult': 0.4464176459478004, 'sideways_time_stop': 24, 'sideways_use_sma': True, 'sideways_use_ema': True, 'sideways_use_atr': True, 'sideways_use_adx': True, 'sideways_use_spike': False, 'sideways_rsi_required': False}.
[I 2025-08-31 09:36:35,663] Trial 127 finished with values: [-1000000000.0, 1000000000.0] and parameters: {'p_sma': 51, 'p_std': 34, 'p_atr': 28, 'p_adx': 8, 'rsi_period': 13, 'ema1': 8, 'ema2': 53, 'slip_atr_k': 0.166616753337592, 'slip_spread_k': 0.16494833390283295, 'spread_hl_frac': 0.015220270477716777, 'bb_std_mult': 0.9759020432073962, 'rsi_os': 27, 'rsi_ob': 94, 'vol_spike': 0.1368457417114423, 'adx_thresh': 7.169253127994871, 'atr_min_pct': 0.010119710366653104, 'atr_max_pct': 0.017634904830636504, 'tp_mult': 1.1829307087880228, 'tsl_mult': 0.1564026083426449, 'strategy': 'breakout', 'time_stop': 84, 'use_sma': True, 'use_atr': False, 'use_adx': False, 'use_ema': True, 'use_spike': False, 'rsi_required': False, 'edge_k': 1.0321490325277836, 'edge_cap': 0.24765307957229743, 'bull_strategy': 'breakout', 'bull_bb_std_mult': 3.5166036667874327, 'bull_rsi_os': 34, 'bull_rsi_ob': 53, 'bull_adx_thresh': 30.92698623508154, 'bull_atr_min_pct': 0.01072755408931371, 'bull_atr_max_pct': 0.117032296527267, 'bull_tp_mult': 2.7670513916973944, 'bull_tsl_mult': 0.5895976929874681, 'bull_time_stop': 262, 'bull_use_sma': False, 'bull_use_ema': False, 'bull_use_atr': True, 'bull_use_adx': True, 'bull_use_spike': False, 'bull_rsi_required': True, 'bear_strategy': 'mean_reversion', 'bear_bb_std_mult': 2.8332845794561394, 'bear_rsi_os': 22, 'bear_rsi_ob': 78, 'bear_adx_thresh': 34.383138657177064, 'bear_atr_min_pct': 0.022351743294393583, 'bear_atr_max_pct': 0.08624554453691283, 'bear_tp_mult': 2.593034018148901, 'bear_tsl_mult': 0.2819708801405459, 'bear_time_stop': 169, 'bear_use_sma': False, 'bear_use_ema': True, 'bear_use_atr': False, 'bear_use_adx': True, 'bear_use_spike': False, 'bear_rsi_required': True, 'sideways_strategy': 'breakout', 'sideways_bb_std_mult': 2.604827171854116, 'sideways_rsi_os': 55, 'sideways_rsi_ob': 65, 'sideways_adx_thresh': 13.499398003910422, 'sideways_atr_min_pct': 0.017736465686336734, 'sideways_atr_max_pct': 0.01588043368121737, 'sideways_tp_mult': 1.765705513511241, 'sideways_tsl_mult': 0.4433145749398715, 'sideways_time_stop': 39, 'sideways_use_sma': True, 'sideways_use_ema': True, 'sideways_use_atr': False, 'sideways_use_adx': True, 'sideways_use_spike': False, 'sideways_rsi_required': False}.
[I 2025-08-31 09:36:36,223] Trial 129 finished with values: [-1000000000.0, 1000000000.0] and parameters: {'p_sma': 51, 'p_std': 11, 'p_atr': 23, 'p_adx': 20, 'rsi_period': 48, 'ema1': 9, 'ema2': 53, 'slip_atr_k': 0.15140013169212888, 'slip_spread_k': 0.18786217221011214, 'spread_hl_frac': 0.04786544384380959, 'bb_std_mult': 1.1240437004693633, 'rsi_os': 25, 'rsi_ob': 94, 'vol_spike': 0.03719426186385699, 'adx_thresh': 7.534138640565558, 'atr_min_pct': 0.017020585645970795, 'atr_max_pct': 0.12498774418114011, 'tp_mult': 1.1710067063279153, 'tsl_mult': 0.03601013270063221, 'strategy': 'breakout', 'time_stop': 86, 'use_sma': True, 'use_atr': False, 'use_adx': False, 'use_ema': True, 'use_spike': False, 'rsi_required': False, 'edge_k': 1.729465780463135, 'edge_cap': 0.19011712266190933, 'bull_strategy': 'breakout', 'bull_bb_std_mult': 1.4424247539886585, 'bull_rsi_os': 55, 'bull_rsi_ob': 95, 'bull_adx_thresh': 32.55686256089769, 'bull_atr_min_pct': 0.012233023996025678, 'bull_atr_max_pct': 0.1283338112010549, 'bull_tp_mult': 1.0632656403647598, 'bull_tsl_mult': 0.5628708765206074, 'bull_time_stop': 67, 'bull_use_sma': False, 'bull_use_ema': False, 'bull_use_atr': True, 'bull_use_adx': True, 'bull_use_spike': False, 'bull_rsi_required': True, 'bear_strategy': 'mean_reversion', 'bear_bb_std_mult': 2.8616145508203124, 'bear_rsi_os': 16, 'bear_rsi_ob': 78, 'bear_adx_thresh': 33.83066966709342, 'bear_atr_min_pct': 0.028225010081248808, 'bear_atr_max_pct': 0.08285063568260018, 'bear_tp_mult': 1.6305510650065507, 'bear_tsl_mult': 0.2981302058466603, 'bear_time_stop': 285, 'bear_use_sma': False, 'bear_use_ema': True, 'bear_use_atr': False, 'bear_use_adx': True, 'bear_use_spike': False, 'bear_rsi_required': True, 'sideways_strategy': 'breakout', 'sideways_bb_std_mult': 2.828237238607527, 'sideways_rsi_os': 12, 'sideways_rsi_ob': 68, 'sideways_adx_thresh': 16.430284259841372, 'sideways_atr_min_pct': 0.015781237197011917, 'sideways_atr_max_pct': 0.042469310486629754, 'sideways_tp_mult': 1.667716794148501, 'sideways_tsl_mult': 0.7755286080653473, 'sideways_time_stop': 22, 'sideways_use_sma': True, 'sideways_use_ema': True, 'sideways_use_atr': False, 'sideways_use_adx': True, 'sideways_use_spike': False, 'sideways_rsi_required': False}.
[I 2025-08-31 09:36:36,223] Trial 128 finished with values: [-1000000000.0, 1000000000.0] and parameters: {'p_sma': 50, 'p_std': 11, 'p_atr': 28, 'p_adx': 8, 'rsi_period': 48, 'ema1': 8, 'ema2': 53, 'slip_atr_k': 0.1517973115011805, 'slip_spread_k': 0.1857586641248466, 'spread_hl_frac': 0.04700265537433619, 'bb_std_mult': 1.839958452254473, 'rsi_os': 27, 'rsi_ob': 50, 'vol_spike': 0.054599629545612774, 'adx_thresh': 7.773489861656916, 'atr_min_pct': 0.010152011642278632, 'atr_max_pct': 0.053281077064383765, 'tp_mult': 1.1602384785238882, 'tsl_mult': 0.3457202159763042, 'strategy': 'breakout', 'time_stop': 212, 'use_sma': True, 'use_atr': False, 'use_adx': False, 'use_ema': True, 'use_spike': False, 'rsi_required': False, 'edge_k': 1.941620591703341, 'edge_cap': 0.5705872083960337, 'bull_strategy': 'breakout', 'bull_bb_std_mult': 3.483649828322461, 'bull_rsi_os': 23, 'bull_rsi_ob': 71, 'bull_adx_thresh': 32.38942296337085, 'bull_atr_min_pct': 0.02142695470185318, 'bull_atr_max_pct': 0.11743119824351525, 'bull_tp_mult': 2.5276434168722486, 'bull_tsl_mult': 0.6159986662903605, 'bull_time_stop': 266, 'bull_use_sma': False, 'bull_use_ema': False, 'bull_use_atr': True, 'bull_use_adx': True, 'bull_use_spike': False, 'bull_rsi_required': True, 'bear_strategy': 'mean_reversion', 'bear_bb_std_mult': 2.5604606875933995, 'bear_rsi_os': 52, 'bear_rsi_ob': 78, 'bear_adx_thresh': 17.522195534788025, 'bear_atr_min_pct': 0.020535639857365028, 'bear_atr_max_pct': 0.0848129163235449, 'bear_tp_mult': 1.302982053441464, 'bear_tsl_mult': 0.6562025223369898, 'bear_time_stop': 170, 'bear_use_sma': False, 'bear_use_ema': True, 'bear_use_atr': False, 'bear_use_adx': True, 'bear_use_spike': False, 'bear_rsi_required': True, 'sideways_strategy': 'breakout', 'sideways_bb_std_mult': 2.5978812078887383, 'sideways_rsi_os': 12, 'sideways_rsi_ob': 69, 'sideways_adx_thresh': 15.99642682356476, 'sideways_atr_min_pct': 0.0022628091381128694, 'sideways_atr_max_pct': 0.028834685010387592, 'sideways_tp_mult': 2.033730485207843, 'sideways_tsl_mult': 0.44860920897505074, 'sideways_time_stop': 228, 'sideways_use_sma': True, 'sideways_use_ema': True, 'sideways_use_atr': False, 'sideways_use_adx': True, 'sideways_use_spike': False, 'sideways_rsi_required': False}.
[I 2025-08-31 09:37:11,407] Trial 130 finished with values: [-1000000000.0, 1000000000.0] and parameters: {'p_sma': 41, 'p_std': 12, 'p_atr': 28, 'p_adx': 8, 'rsi_period': 12, 'ema1': 9, 'ema2': 33, 'slip_atr_k': 0.15308876005593355, 'slip_spread_k': 0.16452026468800413, 'spread_hl_frac': 0.040653388574777884, 'bb_std_mult': 1.1271458511927976, 'rsi_os': 27, 'rsi_ob': 53, 'vol_spike': 0.057985743309451415, 'adx_thresh': 7.310262408737949, 'atr_min_pct': 0.013667871852182297, 'atr_max_pct': 0.052829269280520674, 'tp_mult': 1.1947275858444832, 'tsl_mult': 0.04191555369466188, 'strategy': 'breakout', 'time_stop': 211, 'use_sma': True, 'use_atr': False, 'use_adx': False, 'use_ema': True, 'use_spike': True, 'rsi_required': True, 'edge_k': 1.743661463125629, 'edge_cap': 0.5712292571537954, 'bull_strategy': 'breakout', 'bull_bb_std_mult': 3.4791616260779237, 'bull_rsi_os': 5, 'bull_rsi_ob': 75, 'bull_adx_thresh': 32.374380716418116, 'bull_atr_min_pct': 0.009969920431673017, 'bull_atr_max_pct': 0.10453433407247432, 'bull_tp_mult': 1.37215932593962, 'bull_tsl_mult': 0.6203310162041298, 'bull_time_stop': 267, 'bull_use_sma': False, 'bull_use_ema': False, 'bull_use_atr': True, 'bull_use_adx': True, 'bull_use_spike': False, 'bull_rsi_required': True, 'bear_strategy': 'mean_reversion', 'bear_bb_std_mult': 2.564856872136421, 'bear_rsi_os': 23, 'bear_rsi_ob': 78, 'bear_adx_thresh': 17.352767650692268, 'bear_atr_min_pct': 0.0025879802212037013, 'bear_atr_max_pct': 0.14703886258917176, 'bear_tp_mult': 1.6316914443327528, 'bear_tsl_mult': 0.6414241418510732, 'bear_time_stop': 26, 'bear_use_sma': False, 'bear_use_ema': False, 'bear_use_atr': False, 'bear_use_adx': True, 'bear_use_spike': False, 'bear_rsi_required': True, 'sideways_strategy': 'breakout', 'sideways_bb_std_mult': 2.621486330143347, 'sideways_rsi_os': 15, 'sideways_rsi_ob': 68, 'sideways_adx_thresh': 13.519794879697727, 'sideways_atr_min_pct': 0.0064609386083234336, 'sideways_atr_max_pct': 0.09878873270426236, 'sideways_tp_mult': 1.66010780362022, 'sideways_tsl_mult': 0.9476374879825975, 'sideways_time_stop': 138, 'sideways_use_sma': True, 'sideways_use_ema': True, 'sideways_use_atr': False, 'sideways_use_adx': False, 'sideways_use_spike': False, 'sideways_rsi_required': False}.
[I 2025-08-31 09:37:11,667] Trial 132 finished with values: [-0.07047279952116292, 0.07042389885586026] and parameters: {'p_sma': 48, 'p_std': 27, 'p_atr': 30, 'p_adx': 7, 'rsi_period': 15, 'ema1': 23, 'ema2': 41, 'slip_atr_k': 0.02389632107470934, 'slip_spread_k': 0.37773031089261866, 'spread_hl_frac': 0.020718330400985648, 'bb_std_mult': 3.276677533118154, 'rsi_os': 29, 'rsi_ob': 61, 'vol_spike': 0.06530420555039665, 'adx_thresh': 5.786910092792766, 'atr_min_pct': 0.02851100033126199, 'atr_max_pct': 0.1180605265277, 'tp_mult': 1.2189413092158685, 'tsl_mult': 0.04230348229586525, 'strategy': 'breakout', 'time_stop': 108, 'use_sma': True, 'use_atr': True, 'use_adx': False, 'use_ema': True, 'use_spike': True, 'rsi_required': True, 'edge_k': 0.13223979631657068, 'edge_cap': 0.10623934825459243, 'bull_strategy': 'breakout', 'bull_bb_std_mult': 3.3989960566870656, 'bull_rsi_os': 18, 'bull_rsi_ob': 75, 'bull_adx_thresh': 30.96386308550229, 'bull_atr_min_pct': 0.015064428493394105, 'bull_atr_max_pct': 0.10569921545324205, 'bull_tp_mult': 2.621488718493588, 'bull_tsl_mult': 0.512577804850318, 'bull_time_stop': 244, 'bull_use_sma': True, 'bull_use_ema': False, 'bull_use_atr': True, 'bull_use_adx': False, 'bull_use_spike': False, 'bull_rsi_required': True, 'bear_strategy': 'breakout', 'bear_bb_std_mult': 3.0125983522977933, 'bear_rsi_os': 35, 'bear_rsi_ob': 77, 'bear_adx_thresh': 13.746231840243034, 'bear_atr_min_pct': 0.01091084218319524, 'bear_atr_max_pct': 0.06400440385091853, 'bear_tp_mult': 1.075759168581369, 'bear_tsl_mult': 0.4213675358345347, 'bear_time_stop': 192, 'bear_use_sma': False, 'bear_use_ema': False, 'bear_use_atr': False, 'bear_use_adx': True, 'bear_use_spike': True, 'bear_rsi_required': False, 'sideways_strategy': 'breakout', 'sideways_bb_std_mult': 2.737357037564279, 'sideways_rsi_os': 51, 'sideways_rsi_ob': 69, 'sideways_adx_thresh': 14.13017305681379, 'sideways_atr_min_pct': 0.0014479114882597261, 'sideways_atr_max_pct': 0.09877265788610011, 'sideways_tp_mult': 1.245128442938979, 'sideways_tsl_mult': 0.41569189751549096, 'sideways_time_stop': 135, 'sideways_use_sma': True, 'sideways_use_ema': True, 'sideways_use_atr': False, 'sideways_use_adx': False, 'sideways_use_spike': True, 'sideways_rsi_required': False}.
[I 2025-08-31 09:37:12,079] Trial 131 finished with values: [-0.10440478546670606, 0.10434332207823678] and parameters: {'p_sma': 41, 'p_std': 11, 'p_atr': 30, 'p_adx': 28, 'rsi_period': 31, 'ema1': 9, 'ema2': 33, 'slip_atr_k': 0.15040443976070775, 'slip_spread_k': 0.3094569779095757, 'spread_hl_frac': 0.040211680994129466, 'bb_std_mult': 2.823688452488536, 'rsi_os': 25, 'rsi_ob': 53, 'vol_spike': 0.05601696115493554, 'adx_thresh': 7.81270520476834, 'atr_min_pct': 0.014562578977790543, 'atr_max_pct': 0.053107940098823095, 'tp_mult': 1.1396446509410039, 'tsl_mult': 0.9692483329056054, 'strategy': 'breakout', 'time_stop': 70, 'use_sma': True, 'use_atr': False, 'use_adx': False, 'use_ema': True, 'use_spike': True, 'rsi_required': True, 'edge_k': 1.721742577290261, 'edge_cap': 0.3231300960069434, 'bull_strategy': 'breakout', 'bull_bb_std_mult': 3.1813760749951685, 'bull_rsi_os': 18, 'bull_rsi_ob': 75, 'bull_adx_thresh': 32.36873405203586, 'bull_atr_min_pct': 0.0036736996563513334, 'bull_atr_max_pct': 0.106878362451496, 'bull_tp_mult': 2.357587186993933, 'bull_tsl_mult': 0.6152508397960632, 'bull_time_stop': 244, 'bull_use_sma': True, 'bull_use_ema': False, 'bull_use_atr': True, 'bull_use_adx': False, 'bull_use_spike': False, 'bull_rsi_required': True, 'bear_strategy': 'breakout', 'bear_bb_std_mult': 2.5508479051499786, 'bear_rsi_os': 52, 'bear_rsi_ob': 77, 'bear_adx_thresh': 11.680646099695759, 'bear_atr_min_pct': 0.019134436490822877, 'bear_atr_max_pct': 0.08286607742505325, 'bear_tp_mult': 2.073896955605816, 'bear_tsl_mult': 0.6376716902792916, 'bear_time_stop': 26, 'bear_use_sma': False, 'bear_use_ema': False, 'bear_use_atr': False, 'bear_use_adx': True, 'bear_use_spike': False, 'bear_rsi_required': True, 'sideways_strategy': 'breakout', 'sideways_bb_std_mult': 2.933712566021356, 'sideways_rsi_os': 51, 'sideways_rsi_ob': 69, 'sideways_adx_thresh': 14.197207347085946, 'sideways_atr_min_pct': 0.0013978433252057527, 'sideways_atr_max_pct': 0.10090681749156023, 'sideways_tp_mult': 2.0290252041696193, 'sideways_tsl_mult': 0.3196112643689559, 'sideways_time_stop': 50, 'sideways_use_sma': True, 'sideways_use_ema': True, 'sideways_use_atr': False, 'sideways_use_adx': False, 'sideways_use_spike': True, 'sideways_rsi_required': False}.
[I 2025-08-31 09:37:12,314] Trial 133 finished with values: [-1000000000.0, 1000000000.0] and parameters: {'p_sma': 47, 'p_std': 5, 'p_atr': 30, 'p_adx': 28, 'rsi_period': 70, 'ema1': 23, 'ema2': 33, 'slip_atr_k': 0.025227367719472753, 'slip_spread_k': 0.30863274851703615, 'spread_hl_frac': 0.020957456943691596, 'bb_std_mult': 3.309576940474459, 'rsi_os': 23, 'rsi_ob': 61, 'vol_spike': 0.11720483284808386, 'adx_thresh': 6.927228394276419, 'atr_min_pct': 0.01449176779776185, 'atr_max_pct': 0.051178682300188814, 'tp_mult': 1.135846673464478, 'tsl_mult': 0.000746656517984827, 'strategy': 'breakout', 'time_stop': 73, 'use_sma': True, 'use_atr': True, 'use_adx': False, 'use_ema': True, 'use_spike': True, 'rsi_required': True, 'edge_k': 1.769848600261261, 'edge_cap': 0.32269948120452596, 'bull_strategy': 'breakout', 'bull_bb_std_mult': 3.3957013728583285, 'bull_rsi_os': 26, 'bull_rsi_ob': 75, 'bull_adx_thresh': 31.000601529512902, 'bull_atr_min_pct': 0.01775455692706896, 'bull_atr_max_pct': 0.10628581469931506, 'bull_tp_mult': 1.3509983156130694, 'bull_tsl_mult': 0.5272669009954127, 'bull_time_stop': 20, 'bull_use_sma': True, 'bull_use_ema': False, 'bull_use_atr': True, 'bull_use_adx': False, 'bull_use_spike': False, 'bull_rsi_required': True, 'bear_strategy': 'breakout', 'bear_bb_std_mult': 2.6358914591085534, 'bear_rsi_os': 53, 'bear_rsi_ob': 77, 'bear_adx_thresh': 16.25577669709139, 'bear_atr_min_pct': 0.021187510688436745, 'bear_atr_max_pct': 0.04996412234657049, 'bear_tp_mult': 2.8752318065376468, 'bear_tsl_mult': 0.4171310004422694, 'bear_time_stop': 147, 'bear_use_sma': False, 'bear_use_ema': False, 'bear_use_atr': False, 'bear_use_adx': True, 'bear_use_spike': True, 'bear_rsi_required': False, 'sideways_strategy': 'breakout', 'sideways_bb_std_mult': 2.952505169379186, 'sideways_rsi_os': 16, 'sideways_rsi_ob': 62, 'sideways_adx_thresh': 14.023156651071568, 'sideways_atr_min_pct': 0.0094359926925112, 'sideways_atr_max_pct': 0.0989661858701132, 'sideways_tp_mult': 1.2457675167491615, 'sideways_tsl_mult': 0.41375160188342824, 'sideways_time_stop': 177, 'sideways_use_sma': True, 'sideways_use_ema': True, 'sideways_use_atr': False, 'sideways_use_adx': False, 'sideways_use_spike': True, 'sideways_rsi_required': False}.
[I 2025-08-31 09:37:52,458] Trial 134 finished with values: [-0.10516043284308163, 0.10500553317115881] and parameters: {'p_sma': 53, 'p_std': 37, 'p_atr': 18, 'p_adx': 7, 'rsi_period': 70, 'ema1': 28, 'ema2': 46, 'slip_atr_k': 0.21490410098531082, 'slip_spread_k': 0.3732091488831743, 'spread_hl_frac': 0.021292008054073157, 'bb_std_mult': 3.3040519402807766, 'rsi_os': 28, 'rsi_ob': 53, 'vol_spike': 0.1204978484865603, 'adx_thresh': 6.035993478007661, 'atr_min_pct': 0.01467178262461929, 'atr_max_pct': 0.06510188959832908, 'tp_mult': 1.1359187818186822, 'tsl_mult': 0.10636264465998753, 'strategy': 'breakout', 'time_stop': 235, 'use_sma': True, 'use_atr': True, 'use_adx': False, 'use_ema': True, 'use_spike': True, 'rsi_required': True, 'edge_k': 1.5124074805917127, 'edge_cap': 0.28506384760110093, 'bull_strategy': 'breakout', 'bull_bb_std_mult': 1.569832954549521, 'bull_rsi_os': 53, 'bull_rsi_ob': 83, 'bull_adx_thresh': 31.05575692168026, 'bull_atr_min_pct': 0.015251221519835113, 'bull_atr_max_pct': 0.10663408228097794, 'bull_tp_mult': 1.6055849023466973, 'bull_tsl_mult': 0.5269370414721821, 'bull_time_stop': 242, 'bull_use_sma': True, 'bull_use_ema': False, 'bull_use_atr': True, 'bull_use_adx': False, 'bull_use_spike': False, 'bull_rsi_required': True, 'bear_strategy': 'breakout', 'bear_bb_std_mult': 2.6728252267137855, 'bear_rsi_os': 53, 'bear_rsi_ob': 82, 'bear_adx_thresh': 18.17394276878612, 'bear_atr_min_pct': 0.020864468128478003, 'bear_atr_max_pct': 0.06461299320328714, 'bear_tp_mult': 2.881784105254243, 'bear_tsl_mult': 0.4162853354118817, 'bear_time_stop': 224, 'bear_use_sma': False, 'bear_use_ema': False, 'bear_use_atr': False, 'bear_use_adx': True, 'bear_use_spike': True, 'bear_rsi_required': False, 'sideways_strategy': 'breakout', 'sideways_bb_std_mult': 2.9277081712970614, 'sideways_rsi_os': 50, 'sideways_rsi_ob': 63, 'sideways_adx_thresh': 14.236194619014846, 'sideways_atr_min_pct': 0.0013312067180984138, 'sideways_atr_max_pct': 0.03527326502858805, 'sideways_tp_mult': 1.6135197162672972, 'sideways_tsl_mult': 0.005377019809678474, 'sideways_time_stop': 46, 'sideways_use_sma': True, 'sideways_use_ema': True, 'sideways_use_atr': False, 'sideways_use_adx': False, 'sideways_use_spike': True, 'sideways_rsi_required': False}.
