[I 2025-08-31 09:48:43,009] Trial 215 finished with values: [-1000000000.0, 1000000000.0] and parameters: {'p_sma': 50, 'p_std': 46, 'p_atr': 30, 'p_adx': 9, 'rsi_period': 55, 'ema1': 21, 'ema2': 41, 'slip_atr_k': 0.18050898780056354, 'slip_spread_k': 0.5261616190102825, 'spread_hl_frac': 0.013523800605091885, 'bb_std_mult': 1.0324684840392504, 'rsi_os': 6, 'rsi_ob': 50, 'vol_spike': 0.004200633905364015, 'adx_thresh': 22.235311014657317, 'atr_min_pct': 0.008155564282998268, 'atr_max_pct': 0.12453216797002042, 'tp_mult': 2.7742964360159106, 'tsl_mult': 0.01892496117385649, 'strategy': 'breakout', 'time_stop': 140, 'use_sma': False, 'use_atr': False, 'use_adx': True, 'use_ema': False, 'use_spike': False, 'rsi_required': True, 'edge_k': 1.2023700201148666, 'edge_cap': 0.9016823473753043, 'bull_strategy': 'mean_reversion', 'bull_bb_std_mult': 1.2963718933374018, 'bull_rsi_os': 32, 'bull_rsi_ob': 68, 'bull_adx_thresh': 32.15388604294924, 'bull_atr_min_pct': 0.019442693376844834, 'bull_atr_max_pct': 0.14614417682224695, 'bull_tp_mult': 1.519780019256114, 'bull_tsl_mult': 0.6388994554765483, 'bull_time_stop': 249, 'bull_use_sma': True, 'bull_use_ema': False, 'bull_use_atr': False, 'bull_use_adx': False, 'bull_use_spike': False, 'bull_rsi_required': True, 'bear_strategy': 'breakout', 'bear_bb_std_mult': 2.916203754056864, 'bear_rsi_os': 55, 'bear_rsi_ob': 80, 'bear_adx_thresh': 20.452293970558195, 'bear_atr_min_pct': 0.008280130288933133, 'bear_atr_max_pct': 0.13944182831983148, 'bear_tp_mult': 1.055254934674883, 'bear_tsl_mult': 0.5836941897529464, 'bear_time_stop': 261, 'bear_use_sma': True, 'bear_use_ema': True, 'bear_use_atr': False, 'bear_use_adx': False, 'bear_use_spike': False, 'bear_rsi_required': True, 'sideways_strategy': 'mean_reversion', 'sideways_bb_std_mult': 0.9230494805839167, 'sideways_rsi_os': 25, 'sideways_rsi_ob': 46, 'sideways_adx_thresh': 33.557718447269885, 'sideways_atr_min_pct': 0.0022418415437516124, 'sideways_atr_max_pct': 0.020507490420222523, 'sideways_tp_mult': 1.5162229732266854, 'sideways_tsl_mult': 0.09070438342929846, 'sideways_time_stop': 108, 'sideways_use_sma': True, 'sideways_use_ema': True, 'sideways_use_atr': False, 'sideways_use_adx': False, 'sideways_use_spike': False, 'sideways_rsi_required': True}.
[I 2025-08-31 09:48:43,575] Trial 219 finished with values: [-1000000000.0, 1000000000.0] and parameters: {'p_sma': 20, 'p_std': 16, 'p_atr': 29, 'p_adx': 23, 'rsi_period': 39, 'ema1': 21, 'ema2': 41, 'slip_atr_k': 0.16637069206631083, 'slip_spread_k': 0.6518749402519979, 'spread_hl_frac': 0.012673209846269193, 'bb_std_mult': 1.097228368921238, 'rsi_os': 40, 'rsi_ob': 50, 'vol_spike': 0.1311495441889139, 'adx_thresh': 29.171745689059243, 'atr_min_pct': 0.00825050504192263, 'atr_max_pct': 0.13642262365948862, 'tp_mult': 2.812020308149486, 'tsl_mult': 0.47877036560766384, 'strategy': 'mean_reversion', 'time_stop': 130, 'use_sma': False, 'use_atr': False, 'use_adx': False, 'use_ema': False, 'use_spike': False, 'rsi_required': True, 'edge_k': 0.7142318023215262, 'edge_cap': 0.2405329634173501, 'bull_strategy': 'mean_reversion', 'bull_bb_std_mult': 1.3585797684469767, 'bull_rsi_os': 40, 'bull_rsi_ob': 66, 'bull_adx_thresh': 30.860298340827207, 'bull_atr_min_pct': 0.01946060173105655, 'bull_atr_max_pct': 0.049785884914312156, 'bull_tp_mult': 1.696212473337809, 'bull_tsl_mult': 0.7548167021997593, 'bull_time_stop': 29, 'bull_use_sma': True, 'bull_use_ema': True, 'bull_use_atr': False, 'bull_use_adx': False, 'bull_use_spike': True, 'bull_rsi_required': False, 'bear_strategy': 'breakout', 'bear_bb_std_mult': 2.223450245584262, 'bear_rsi_os': 15, 'bear_rsi_ob': 89, 'bear_adx_thresh': 20.12243771515294, 'bear_atr_min_pct': 0.0214205912125109, 'bear_atr_max_pct': 0.14329480868307265, 'bear_tp_mult': 1.5064929188422498, 'bear_tsl_mult': 0.47812981071522004, 'bear_time_stop': 272, 'bear_use_sma': False, 'bear_use_ema': True, 'bear_use_atr': True, 'bear_use_adx': True, 'bear_use_spike': False, 'bear_rsi_required': True, 'sideways_strategy': 'breakout', 'sideways_bb_std_mult': 1.0732584035671542, 'sideways_rsi_os': 28, 'sideways_rsi_ob': 63, 'sideways_adx_thresh': 32.84170879418326, 'sideways_atr_min_pct': 0.024047252035918863, 'sideways_atr_max_pct': 0.09717856961367344, 'sideways_tp_mult': 1.567178614207601, 'sideways_tsl_mult': 0.7596080069091131, 'sideways_time_stop': 139, 'sideways_use_sma': False, 'sideways_use_ema': False, 'sideways_use_atr': True, 'sideways_use_adx': False, 'sideways_use_spike': False, 'sideways_rsi_required': False}.
[I 2025-08-31 09:48:43,578] Trial 217 finished with values: [-1000000000.0, 1000000000.0] and parameters: {'p_sma': 51, 'p_std': 17, 'p_atr': 30, 'p_adx': 10, 'rsi_period': 39, 'ema1': 21, 'ema2': 31, 'slip_atr_k': 0.1500385344608052, 'slip_spread_k': 0.2611818000848013, 'spread_hl_frac': 0.013206085017219428, 'bb_std_mult': 1.246905985289071, 'rsi_os': 19, 'rsi_ob': 49, 'vol_spike': 0.007139903397904462, 'adx_thresh': 27.60883730430111, 'atr_min_pct': 0.027531266080270532, 'atr_max_pct': 0.13694501517207358, 'tp_mult': 1.9391980498061017, 'tsl_mult': 0.824738210615136, 'strategy': 'mean_reversion', 'time_stop': 112, 'use_sma': False, 'use_atr': False, 'use_adx': False, 'use_ema': False, 'use_spike': False, 'rsi_required': True, 'edge_k': 1.9288431728307451, 'edge_cap': 0.9060676112245771, 'bull_strategy': 'mean_reversion', 'bull_bb_std_mult': 1.3483484861954596, 'bull_rsi_os': 42, 'bull_rsi_ob': 63, 'bull_adx_thresh': 24.844232887546696, 'bull_atr_min_pct': 0.004268008276854807, 'bull_atr_max_pct': 0.11456647344076798, 'bull_tp_mult': 1.7573199063368712, 'bull_tsl_mult': 0.5992445451987274, 'bull_time_stop': 250, 'bull_use_sma': True, 'bull_use_ema': True, 'bull_use_atr': False, 'bull_use_adx': False, 'bull_use_spike': True, 'bull_rsi_required': True, 'bear_strategy': 'breakout', 'bear_bb_std_mult': 0.6954980522998946, 'bear_rsi_os': 55, 'bear_rsi_ob': 89, 'bear_adx_thresh': 7.636807528340443, 'bear_atr_min_pct': 0.021677630143698792, 'bear_atr_max_pct': 0.14274377775772062, 'bear_tp_mult': 1.0527705503758544, 'bear_tsl_mult': 0.664292508527076, 'bear_time_stop': 260, 'bear_use_sma': False, 'bear_use_ema': True, 'bear_use_atr': False, 'bear_use_adx': True, 'bear_use_spike': False, 'bear_rsi_required': True, 'sideways_strategy': 'breakout', 'sideways_bb_std_mult': 0.9177904423991892, 'sideways_rsi_os': 27, 'sideways_rsi_ob': 63, 'sideways_adx_thresh': 33.61450168992205, 'sideways_atr_min_pct': 0.026281011298641008, 'sideways_atr_max_pct': 0.03068276237131914, 'sideways_tp_mult': 1.5577990722262676, 'sideways_tsl_mult': 0.09700591328326402, 'sideways_time_stop': 283, 'sideways_use_sma': True, 'sideways_use_ema': True, 'sideways_use_atr': True, 'sideways_use_adx': False, 'sideways_use_spike': False, 'sideways_rsi_required': False}.
[I 2025-08-31 09:49:19,267] Trial 218 finished with values: [-1000000000.0, 1000000000.0] and parameters: {'p_sma': 49, 'p_std': 16, 'p_atr': 29, 'p_adx': 10, 'rsi_period': 38, 'ema1': 21, 'ema2': 31, 'slip_atr_k': 0.13744776214573126, 'slip_spread_k': 0.26474596486993796, 'spread_hl_frac': 0.014819902050265676, 'bb_std_mult': 1.2474220503805658, 'rsi_os': 21, 'rsi_ob': 93, 'vol_spike': 0.25531444209081194, 'adx_thresh': 26.242952704699935, 'atr_min_pct': 2.315392179683476e-05, 'atr_max_pct': 0.1370346566911717, 'tp_mult': 2.800329696682322, 'tsl_mult': 0.04062569069086411, 'strategy': 'mean_reversion', 'time_stop': 129, 'use_sma': False, 'use_atr': False, 'use_adx': False, 'use_ema': False, 'use_spike': False, 'rsi_required': True, 'edge_k': 1.9227381354722537, 'edge_cap': 0.9164381297818023, 'bull_strategy': 'mean_reversion', 'bull_bb_std_mult': 1.3444733887283176, 'bull_rsi_os': 36, 'bull_rsi_ob': 63, 'bull_adx_thresh': 6.074268787301108, 'bull_atr_min_pct': 0.019394897725781738, 'bull_atr_max_pct': 0.017325468805078154, 'bull_tp_mult': 1.7314103087026353, 'bull_tsl_mult': 0.5929554435716284, 'bull_time_stop': 33, 'bull_use_sma': True, 'bull_use_ema': True, 'bull_use_atr': False, 'bull_use_adx': False, 'bull_use_spike': True, 'bull_rsi_required': False, 'bear_strategy': 'breakout', 'bear_bb_std_mult': 0.750143211407468, 'bear_rsi_os': 54, 'bear_rsi_ob': 78, 'bear_adx_thresh': 7.346533584983439, 'bear_atr_min_pct': 0.017942370180127083, 'bear_atr_max_pct': 0.14243653184198404, 'bear_tp_mult': 2.679176704663214, 'bear_tsl_mult': 0.5151560187128964, 'bear_time_stop': 298, 'bear_use_sma': False, 'bear_use_ema': True, 'bear_use_atr': True, 'bear_use_adx': True, 'bear_use_spike': False, 'bear_rsi_required': True, 'sideways_strategy': 'breakout', 'sideways_bb_std_mult': 1.2900931102540996, 'sideways_rsi_os': 28, 'sideways_rsi_ob': 63, 'sideways_adx_thresh': 32.92336714270237, 'sideways_atr_min_pct': 0.002998152364345091, 'sideways_atr_max_pct': 0.01891674691614901, 'sideways_tp_mult': 1.563885733467381, 'sideways_tsl_mult': 0.09903349513750995, 'sideways_time_stop': 138, 'sideways_use_sma': False, 'sideways_use_ema': False, 'sideways_use_atr': True, 'sideways_use_adx': False, 'sideways_use_spike': False, 'sideways_rsi_required': False}.
[I 2025-08-31 09:49:19,617] Trial 220 finished with values: [-1000000000.0, 1000000000.0] and parameters: {'p_sma': 37, 'p_std': 39, 'p_atr': 29, 'p_adx': 30, 'rsi_period': 46, 'ema1': 21, 'ema2': 29, 'slip_atr_k': 0.13666702583998086, 'slip_spread_k': 0.6496376812471312, 'spread_hl_frac': 0.012546395696120812, 'bb_std_mult': 0.9412936631151438, 'rsi_os': 40, 'rsi_ob': 60, 'vol_spike': 0.25669524356000717, 'adx_thresh': 21.237526998367713, 'atr_min_pct': 0.029087387566137563, 'atr_max_pct': 0.13795659460607443, 'tp_mult': 2.1030110343004655, 'tsl_mult': 0.04160973344453129, 'strategy': 'mean_reversion', 'time_stop': 132, 'use_sma': False, 'use_atr': False, 'use_adx': False, 'use_ema': False, 'use_spike': False, 'rsi_required': False, 'edge_k': 0.4345023934712251, 'edge_cap': 0.14726988091607277, 'bull_strategy': 'mean_reversion', 'bull_bb_std_mult': 1.4207855187037812, 'bull_rsi_os': 6, 'bull_rsi_ob': 64, 'bull_adx_thresh': 6.221221288755316, 'bull_atr_min_pct': 0.004640118897971815, 'bull_atr_max_pct': 0.030738139933004935, 'bull_tp_mult': 1.6735940711260933, 'bull_tsl_mult': 0.5983182109695944, 'bull_time_stop': 206, 'bull_use_sma': False, 'bull_use_ema': True, 'bull_use_atr': False, 'bull_use_adx': True, 'bull_use_spike': True, 'bull_rsi_required': False, 'bear_strategy': 'mean_reversion', 'bear_bb_std_mult': 0.7036594750362279, 'bear_rsi_os': 52, 'bear_rsi_ob': 79, 'bear_adx_thresh': 21.424541046096905, 'bear_atr_min_pct': 0.01792364032314132, 'bear_atr_max_pct': 0.03896685199837787, 'bear_tp_mult': 2.6828717852863706, 'bear_tsl_mult': 0.07139447857576131, 'bear_time_stop': 280, 'bear_use_sma': False, 'bear_use_ema': True, 'bear_use_atr': True, 'bear_use_adx': True, 'bear_use_spike': False, 'bear_rsi_required': True, 'sideways_strategy': 'breakout', 'sideways_bb_std_mult': 1.0858248631279677, 'sideways_rsi_os': 29, 'sideways_rsi_ob': 63, 'sideways_adx_thresh': 32.90066123237729, 'sideways_atr_min_pct': 0.024187208727058172, 'sideways_atr_max_pct': 0.12005938767896934, 'sideways_tp_mult': 2.391239034014708, 'sideways_tsl_mult': 0.7563686956502949, 'sideways_time_stop': 142, 'sideways_use_sma': False, 'sideways_use_ema': False, 'sideways_use_atr': True, 'sideways_use_adx': True, 'sideways_use_spike': False, 'sideways_rsi_required': False}.
[I 2025-08-31 09:49:21,037] Trial 222 finished with values: [-1000000000.0, 1000000000.0] and parameters: {'p_sma': 49, 'p_std': 15, 'p_atr': 29, 'p_adx': 26, 'rsi_period': 30, 'ema1': 20, 'ema2': 39, 'slip_atr_k': 0.13809152636925434, 'slip_spread_k': 0.2070963983266956, 'spread_hl_frac': 0.0146206965511908, 'bb_std_mult': 0.9190397119773491, 'rsi_os': 48, 'rsi_ob': 47, 'vol_spike': 0.2535761977582923, 'adx_thresh': 6.518131343258604, 'atr_min_pct': 0.010529700828433713, 'atr_max_pct': 0.13147234567827257, 'tp_mult': 2.8717094312575773, 'tsl_mult': 0.048014582798068424, 'strategy': 'breakout', 'time_stop': 134, 'use_sma': False, 'use_atr': False, 'use_adx': False, 'use_ema': False, 'use_spike': False, 'rsi_required': False, 'edge_k': 0.4790341104932717, 'edge_cap': 0.0867449871105388, 'bull_strategy': 'mean_reversion', 'bull_bb_std_mult': 1.2063768568337778, 'bull_rsi_os': 6, 'bull_rsi_ob': 87, 'bull_adx_thresh': 29.49561288772151, 'bull_atr_min_pct': 0.014463914490187408, 'bull_atr_max_pct': 0.043042261718006056, 'bull_tp_mult': 1.3724786006656964, 'bull_tsl_mult': 0.5923994226699979, 'bull_time_stop': 269, 'bull_use_sma': False, 'bull_use_ema': False, 'bull_use_atr': False, 'bull_use_adx': True, 'bull_use_spike': False, 'bull_rsi_required': False, 'bear_strategy': 'mean_reversion', 'bear_bb_std_mult': 1.871406867625934, 'bear_rsi_os': 52, 'bear_rsi_ob': 78, 'bear_adx_thresh': 29.853754796816347, 'bear_atr_min_pct': 0.022251200215535543, 'bear_atr_max_pct': 0.13528762566337466, 'bear_tp_mult': 2.671766212187919, 'bear_tsl_mult': 0.05896183544472766, 'bear_time_stop': 246, 'bear_use_sma': False, 'bear_use_ema': True, 'bear_use_atr': True, 'bear_use_adx': True, 'bear_use_spike': False, 'bear_rsi_required': True, 'sideways_strategy': 'breakout', 'sideways_bb_std_mult': 1.2273450213351447, 'sideways_rsi_os': 41, 'sideways_rsi_ob': 66, 'sideways_adx_thresh': 7.958569167130991, 'sideways_atr_min_pct': 0.012114282001167178, 'sideways_atr_max_pct': 0.143154310639089, 'sideways_tp_mult': 2.417268511518044, 'sideways_tsl_mult': 0.9493849646382586, 'sideways_time_stop': 200, 'sideways_use_sma': False, 'sideways_use_ema': False, 'sideways_use_atr': False, 'sideways_use_adx': True, 'sideways_use_spike': False, 'sideways_rsi_required': False}.
[I 2025-08-31 09:49:21,289] Trial 221 finished with values: [-1000000000.0, 1000000000.0] and parameters: {'p_sma': 49, 'p_std': 39, 'p_atr': 29, 'p_adx': 8, 'rsi_period': 46, 'ema1': 20, 'ema2': 39, 'slip_atr_k': 0.13442945565329517, 'slip_spread_k': 0.1458316394753431, 'spread_hl_frac': 0.011439029904527678, 'bb_std_mult': 2.0022750897790402, 'rsi_os': 53, 'rsi_ob': 47, 'vol_spike': 0.03896830074082629, 'adx_thresh': 6.732064303731116, 'atr_min_pct': 0.010483754694403137, 'atr_max_pct': 0.014147970350197256, 'tp_mult': 2.868297823158925, 'tsl_mult': 0.04489097396840011, 'strategy': 'breakout', 'time_stop': 134, 'use_sma': False, 'use_atr': False, 'use_adx': False, 'use_ema': False, 'use_spike': False, 'rsi_required': False, 'edge_k': 0.46329769555470135, 'edge_cap': 0.20829033805438646, 'bull_strategy': 'mean_reversion', 'bull_bb_std_mult': 1.1851758826363132, 'bull_rsi_os': 6, 'bull_rsi_ob': 65, 'bull_adx_thresh': 30.180560440149808, 'bull_atr_min_pct': 0.02041862741480594, 'bull_atr_max_pct': 0.03007282107694073, 'bull_tp_mult': 1.3719693489117313, 'bull_tsl_mult': 0.5870187341727433, 'bull_time_stop': 76, 'bull_use_sma': False, 'bull_use_ema': False, 'bull_use_atr': False, 'bull_use_adx': True, 'bull_use_spike': False, 'bull_rsi_required': False, 'bear_strategy': 'mean_reversion', 'bear_bb_std_mult': 2.0526012248232908, 'bear_rsi_os': 52, 'bear_rsi_ob': 78, 'bear_adx_thresh': 21.420897037614782, 'bear_atr_min_pct': 0.011865522017465189, 'bear_atr_max_pct': 0.03968952394308528, 'bear_tp_mult': 2.6845929541348346, 'bear_tsl_mult': 0.5182931787745608, 'bear_time_stop': 247, 'bear_use_sma': False, 'bear_use_ema': True, 'bear_use_atr': True, 'bear_use_adx': True, 'bear_use_spike': False, 'bear_rsi_required': True, 'sideways_strategy': 'breakout', 'sideways_bb_std_mult': 1.3029532948020437, 'sideways_rsi_os': 41, 'sideways_rsi_ob': 66, 'sideways_adx_thresh': 32.74809712948212, 'sideways_atr_min_pct': 0.025372319553051564, 'sideways_atr_max_pct': 0.0635407265208174, 'sideways_tp_mult': 1.6461023543867639, 'sideways_tsl_mult': 0.14747246128948688, 'sideways_time_stop': 119, 'sideways_use_sma': False, 'sideways_use_ema': False, 'sideways_use_atr': False, 'sideways_use_adx': True, 'sideways_use_spike': False, 'sideways_rsi_required': False}.
[I 2025-08-31 09:49:58,326] Trial 223 finished with values: [-1000000000.0, 1000000000.0] and parameters: {'p_sma': 36, 'p_std': 39, 'p_atr': 10, 'p_adx': 26, 'rsi_period': 22, 'ema1': 20, 'ema2': 28, 'slip_atr_k': 0.16850246251228063, 'slip_spread_k': 0.4960236300385573, 'spread_hl_frac': 0.012713151023282531, 'bb_std_mult': 2.0006667919468746, 'rsi_os': 23, 'rsi_ob': 75, 'vol_spike': 0.18220569383350418, 'adx_thresh': 7.0090966172777485, 'atr_min_pct': 0.012085425244911109, 'atr_max_pct': 0.13209180747200008, 'tp_mult': 2.2048709358198577, 'tsl_mult': 0.037134979370935996, 'strategy': 'breakout', 'time_stop': 148, 'use_sma': False, 'use_atr': False, 'use_adx': False, 'use_ema': False, 'use_spike': False, 'rsi_required': False, 'edge_k': 0.47821378966026507, 'edge_cap': 0.14551214044902872, 'bull_strategy': 'mean_reversion', 'bull_bb_std_mult': 1.182114942083804, 'bull_rsi_os': 33, 'bull_rsi_ob': 64, 'bull_adx_thresh': 29.586883116556216, 'bull_atr_min_pct': 0.011825707571588752, 'bull_atr_max_pct': 0.042720884776101274, 'bull_tp_mult': 1.3629949444607712, 'bull_tsl_mult': 0.6093174563216589, 'bull_time_stop': 73, 'bull_use_sma': False, 'bull_use_ema': False, 'bull_use_atr': False, 'bull_use_adx': True, 'bull_use_spike': False, 'bull_rsi_required': True, 'bear_strategy': 'mean_reversion', 'bear_bb_std_mult': 1.8969651282919004, 'bear_rsi_os': 52, 'bear_rsi_ob': 68, 'bear_adx_thresh': 5.886083165240128, 'bear_atr_min_pct': 0.01137702172144879, 'bear_atr_max_pct': 0.010359203536935105, 'bear_tp_mult': 2.6028887404935426, 'bear_tsl_mult': 0.5143635694351603, 'bear_time_stop': 247, 'bear_use_sma': False, 'bear_use_ema': True, 'bear_use_atr': False, 'bear_use_adx': True, 'bear_use_spike': False, 'bear_rsi_required': True, 'sideways_strategy': 'breakout', 'sideways_bb_std_mult': 1.2256072525051604, 'sideways_rsi_os': 30, 'sideways_rsi_ob': 61, 'sideways_adx_thresh': 32.76216692613602, 'sideways_atr_min_pct': 0.02528637751676053, 'sideways_atr_max_pct': 0.06224630284502998, 'sideways_tp_mult': 1.4153554158662474, 'sideways_tsl_mult': 0.14790313138080644, 'sideways_time_stop': 200, 'sideways_use_sma': True, 'sideways_use_ema': True, 'sideways_use_atr': False, 'sideways_use_adx': True, 'sideways_use_spike': False, 'sideways_rsi_required': False}.
[I 2025-08-31 09:49:58,520] Trial 224 finished with values: [-1000000000.0, 1000000000.0] and parameters: {'p_sma': 9, 'p_std': 51, 'p_atr': 9, 'p_adx': 8, 'rsi_period': 21, 'ema1': 20, 'ema2': 39, 'slip_atr_k': 0.11790102791765057, 'slip_spread_k': 0.5813013746033091, 'spread_hl_frac': 0.010737938548585011, 'bb_std_mult': 2.0270847581276406, 'rsi_os': 23, 'rsi_ob': 75, 'vol_spike': 0.14488315093099033, 'adx_thresh': 6.582161561285768, 'atr_min_pct': 0.02154046661379709, 'atr_max_pct': 0.11930303497063025, 'tp_mult': 2.875293388634253, 'tsl_mult': 0.02105045532763122, 'strategy': 'breakout', 'time_stop': 150, 'use_sma': False, 'use_atr': False, 'use_adx': False, 'use_ema': False, 'use_spike': False, 'rsi_required': True, 'edge_k': 1.8170911246941623, 'edge_cap': 0.5532039080324436, 'bull_strategy': 'mean_reversion', 'bull_bb_std_mult': 1.1945760079250916, 'bull_rsi_os': 33, 'bull_rsi_ob': 65, 'bull_adx_thresh': 14.477026182855916, 'bull_atr_min_pct': 0.01881061505729429, 'bull_atr_max_pct': 0.11373056888093995, 'bull_tp_mult': 1.4786700819957423, 'bull_tsl_mult': 0.05990384163849638, 'bull_time_stop': 75, 'bull_use_sma': True, 'bull_use_ema': False, 'bull_use_atr': False, 'bull_use_adx': False, 'bull_use_spike': False, 'bull_rsi_required': True, 'bear_strategy': 'breakout', 'bear_bb_std_mult': 2.76086005867728, 'bear_rsi_os': 53, 'bear_rsi_ob': 67, 'bear_adx_thresh': 27.532799534409566, 'bear_atr_min_pct': 0.022171821961191125, 'bear_atr_max_pct': 0.1448749434893527, 'bear_tp_mult': 2.621975105724447, 'bear_tsl_mult': 0.10494195191608968, 'bear_time_stop': 246, 'bear_use_sma': False, 'bear_use_ema': True, 'bear_use_atr': False, 'bear_use_adx': True, 'bear_use_spike': False, 'bear_rsi_required': True, 'sideways_strategy': 'breakout', 'sideways_bb_std_mult': 1.1411234852178755, 'sideways_rsi_os': 22, 'sideways_rsi_ob': 66, 'sideways_adx_thresh': 7.903664348377744, 'sideways_atr_min_pct': 0.0015166632463469276, 'sideways_atr_max_pct': 0.14286343498431223, 'sideways_tp_mult': 2.94584698705302, 'sideways_tsl_mult': 0.9593599035789273, 'sideways_time_stop': 232, 'sideways_use_sma': True, 'sideways_use_ema': True, 'sideways_use_atr': False, 'sideways_use_adx': False, 'sideways_use_spike': False, 'sideways_rsi_required': False}.
