[I 2025-08-31 10:09:25,656] Trial 387 finished with values: [-0.04124138295172075, 0.04110325792793929] and parameters: {'p_sma': 47, 'p_std': 25, 'p_atr': 27, 'p_adx': 11, 'rsi_period': 51, 'ema1': 20, 'ema2': 12, 'slip_atr_k': 0.12122865515851514, 'slip_spread_k': 0.37236788732686743, 'spread_hl_frac': 0.010275601589075098, 'bb_std_mult': 1.2855060044901752, 'rsi_os': 23, 'rsi_ob': 75, 'vol_spike': 0.15461843701953643, 'adx_thresh': 5.631429679824172, 'atr_min_pct': 0.005961489105285161, 'atr_max_pct': 0.1302870192437928, 'tp_mult': 2.120749341462741, 'tsl_mult': 0.2177417289354845, 'strategy': 'breakout', 'time_stop': 136, 'use_sma': False, 'use_atr': False, 'use_adx': False, 'use_ema': False, 'use_spike': False, 'rsi_required': True, 'edge_k': 1.754054109938458, 'edge_cap': 0.16552411062700273, 'bull_strategy': 'mean_reversion', 'bull_bb_std_mult': 1.1650604091883834, 'bull_rsi_os': 32, 'bull_rsi_ob': 94, 'bull_adx_thresh': 30.8157144246498, 'bull_atr_min_pct': 0.017331970669266412, 'bull_atr_max_pct': 0.12264985753082411, 'bull_tp_mult': 1.05538584457752, 'bull_tsl_mult': 0.8429788049993101, 'bull_time_stop': 104, 'bull_use_sma': True, 'bull_use_ema': True, 'bull_use_atr': False, 'bull_use_adx': False, 'bull_use_spike': False, 'bull_rsi_required': True, 'bear_strategy': 'breakout', 'bear_bb_std_mult': 2.817077516190504, 'bear_rsi_os': 26, 'bear_rsi_ob': 55, 'bear_adx_thresh': 33.96392673910431, 'bear_atr_min_pct': 0.02652906058567484, 'bear_atr_max_pct': 0.1309160933369916, 'bear_tp_mult': 2.8218058389844356, 'bear_tsl_mult': 0.3136168896873728, 'bear_time_stop': 276, 'bear_use_sma': False, 'bear_use_ema': False, 'bear_use_atr': False, 'bear_use_adx': True, 'bear_use_spike': False, 'bear_rsi_required': True, 'sideways_strategy': 'breakout', 'sideways_bb_std_mult': 1.7342187167881262, 'sideways_rsi_os': 39, 'sideways_rsi_ob': 63, 'sideways_adx_thresh': 34.27434882581084, 'sideways_atr_min_pct': 0.001205669980944719, 'sideways_atr_max_pct': 0.06003538596355698, 'sideways_tp_mult': 2.8101879556083063, 'sideways_tsl_mult': 0.09495162156476633, 'sideways_time_stop': 220, 'sideways_use_sma': True, 'sideways_use_ema': True, 'sideways_use_atr': False, 'sideways_use_adx': False, 'sideways_use_spike': False, 'sideways_rsi_required': False}.
[I 2025-08-31 10:09:26,400] Trial 388 finished with values: [-1000000000.0, 1000000000.0] and parameters: {'p_sma': 50, 'p_std': 25, 'p_atr': 29, 'p_adx': 15, 'rsi_period': 17, 'ema1': 6, 'ema2': 48, 'slip_atr_k': 0.04476437108465857, 'slip_spread_k': 0.510135074754106, 'spread_hl_frac': 0.03594034648659544, 'bb_std_mult': 2.6105799584139744, 'rsi_os': 24, 'rsi_ob': 75, 'vol_spike': 0.15320795388602113, 'adx_thresh': 24.209460877064576, 'atr_min_pct': 0.012154800396556628, 'atr_max_pct': 0.055836312110540756, 'tp_mult': 2.1151697312496234, 'tsl_mult': 0.21702884863977773, 'strategy': 'breakout', 'time_stop': 138, 'use_sma': False, 'use_atr': False, 'use_adx': False, 'use_ema': False, 'use_spike': False, 'rsi_required': True, 'edge_k': 1.0127217498830408, 'edge_cap': 0.12055161211840766, 'bull_strategy': 'mean_reversion', 'bull_bb_std_mult': 1.0465690560424565, 'bull_rsi_os': 33, 'bull_rsi_ob': 95, 'bull_adx_thresh': 33.00502904386951, 'bull_atr_min_pct': 0.019302189387548244, 'bull_atr_max_pct': 0.11710745096851055, 'bull_tp_mult': 1.531754436855152, 'bull_tsl_mult': 0.13225201442579182, 'bull_time_stop': 215, 'bull_use_sma': True, 'bull_use_ema': True, 'bull_use_atr': False, 'bull_use_adx': False, 'bull_use_spike': False, 'bull_rsi_required': False, 'bear_strategy': 'breakout', 'bear_bb_std_mult': 2.7908483221736966, 'bear_rsi_os': 53, 'bear_rsi_ob': 55, 'bear_adx_thresh': 21.02664717156047, 'bear_atr_min_pct': 0.019717508799571612, 'bear_atr_max_pct': 0.050780415322212634, 'bear_tp_mult': 2.7982620095100943, 'bear_tsl_mult': 0.5338489890293576, 'bear_time_stop': 275, 'bear_use_sma': False, 'bear_use_ema': False, 'bear_use_atr': False, 'bear_use_adx': False, 'bear_use_spike': False, 'bear_rsi_required': True, 'sideways_strategy': 'breakout', 'sideways_bb_std_mult': 1.175898850587109, 'sideways_rsi_os': 26, 'sideways_rsi_ob': 70, 'sideways_adx_thresh': 25.481696324342415, 'sideways_atr_min_pct': 0.021010357103761326, 'sideways_atr_max_pct': 0.02943922721979765, 'sideways_tp_mult': 1.5044285447247743, 'sideways_tsl_mult': 0.0950595886595885, 'sideways_time_stop': 218, 'sideways_use_sma': True, 'sideways_use_ema': True, 'sideways_use_atr': False, 'sideways_use_adx': False, 'sideways_use_spike': False, 'sideways_rsi_required': False}.
[I 2025-08-31 10:09:26,485] Trial 389 finished with values: [-1000000000.0, 1000000000.0] and parameters: {'p_sma': 50, 'p_std': 59, 'p_atr': 15, 'p_adx': 10, 'rsi_period': 58, 'ema1': 6, 'ema2': 12, 'slip_atr_k': 0.20844295209269062, 'slip_spread_k': 0.6442219982515089, 'spread_hl_frac': 0.03497604108561765, 'bb_std_mult': 0.9177781381004038, 'rsi_os': 25, 'rsi_ob': 56, 'vol_spike': 0.1687552661033668, 'adx_thresh': 33.1835963053103, 'atr_min_pct': 0.01228964874719967, 'atr_max_pct': 0.11539063246932493, 'tp_mult': 2.9460885613241254, 'tsl_mult': 0.06862590158577112, 'strategy': 'breakout', 'time_stop': 134, 'use_sma': False, 'use_atr': False, 'use_adx': False, 'use_ema': False, 'use_spike': False, 'rsi_required': False, 'edge_k': 1.871359583424097, 'edge_cap': 0.7332474269910607, 'bull_strategy': 'mean_reversion', 'bull_bb_std_mult': 1.1823548768841614, 'bull_rsi_os': 29, 'bull_rsi_ob': 64, 'bull_adx_thresh': 24.85536970889754, 'bull_atr_min_pct': 0.019329285732911393, 'bull_atr_max_pct': 0.11569415144646979, 'bull_tp_mult': 1.4163509317425689, 'bull_tsl_mult': 0.5596540200652036, 'bull_time_stop': 218, 'bull_use_sma': True, 'bull_use_ema': True, 'bull_use_atr': False, 'bull_use_adx': False, 'bull_use_spike': False, 'bull_rsi_required': False, 'bear_strategy': 'breakout', 'bear_bb_std_mult': 3.0825075594693283, 'bear_rsi_os': 26, 'bear_rsi_ob': 82, 'bear_adx_thresh': 21.051469963630147, 'bear_atr_min_pct': 0.019590006650736187, 'bear_atr_max_pct': 0.04948419407438029, 'bear_tp_mult': 2.6038561970672363, 'bear_tsl_mult': 0.5299045405429869, 'bear_time_stop': 247, 'bear_use_sma': False, 'bear_use_ema': True, 'bear_use_atr': True, 'bear_use_adx': False, 'bear_use_spike': False, 'bear_rsi_required': True, 'sideways_strategy': 'breakout', 'sideways_bb_std_mult': 1.2449952654852572, 'sideways_rsi_os': 29, 'sideways_rsi_ob': 70, 'sideways_adx_thresh': 34.190779469426985, 'sideways_atr_min_pct': 0.004130266686599198, 'sideways_atr_max_pct': 0.12824805558110342, 'sideways_tp_mult': 1.9441104017574296, 'sideways_tsl_mult': 0.10109250719945306, 'sideways_time_stop': 220, 'sideways_use_sma': False, 'sideways_use_ema': True, 'sideways_use_atr': False, 'sideways_use_adx': False, 'sideways_use_spike': False, 'sideways_rsi_required': False}.
[I 2025-08-31 10:09:27,100] Trial 392 finished with values: [-1000000000.0, 1000000000.0] and parameters: {'p_sma': 30, 'p_std': 10, 'p_atr': 28, 'p_adx': 7, 'rsi_period': 14, 'ema1': 24, 'ema2': 35, 'slip_atr_k': 0.23275576223731914, 'slip_spread_k': 0.579390632083123, 'spread_hl_frac': 0.012364086073225028, 'bb_std_mult': 1.061988637614394, 'rsi_os': 20, 'rsi_ob': 47, 'vol_spike': 0.14310932305860652, 'adx_thresh': 7.267197680749049, 'atr_min_pct': 0.013498016201821745, 'atr_max_pct': 0.14300356745953802, 'tp_mult': 2.8471957176794893, 'tsl_mult': 0.030714944633922592, 'strategy': 'mean_reversion', 'time_stop': 169, 'use_sma': False, 'use_atr': True, 'use_adx': False, 'use_ema': True, 'use_spike': True, 'rsi_required': False, 'edge_k': 1.8240946864700143, 'edge_cap': 0.4628681075183174, 'bull_strategy': 'mean_reversion', 'bull_bb_std_mult': 1.2515135031034064, 'bull_rsi_os': 53, 'bull_rsi_ob': 88, 'bull_adx_thresh': 30.23270190939319, 'bull_atr_min_pct': 0.018333741202133498, 'bull_atr_max_pct': 0.0680222864733327, 'bull_tp_mult': 1.0824476589224017, 'bull_tsl_mult': 0.33080798741757167, 'bull_time_stop': 253, 'bull_use_sma': True, 'bull_use_ema': False, 'bull_use_atr': True, 'bull_use_adx': False, 'bull_use_spike': False, 'bull_rsi_required': True, 'bear_strategy': 'breakout', 'bear_bb_std_mult': 2.5273438082717927, 'bear_rsi_os': 54, 'bear_rsi_ob': 79, 'bear_adx_thresh': 28.580015967333267, 'bear_atr_min_pct': 0.022763324707319427, 'bear_atr_max_pct': 0.14659871866353882, 'bear_tp_mult': 1.0917745080613206, 'bear_tsl_mult': 0.20780735693336067, 'bear_time_stop': 122, 'bear_use_sma': False, 'bear_use_ema': True, 'bear_use_atr': True, 'bear_use_adx': True, 'bear_use_spike': True, 'bear_rsi_required': False, 'sideways_strategy': 'breakout', 'sideways_bb_std_mult': 2.884536814442626, 'sideways_rsi_os': 12, 'sideways_rsi_ob': 65, 'sideways_adx_thresh': 11.650160979843731, 'sideways_atr_min_pct': 0.0019653206112139636, 'sideways_atr_max_pct': 0.040423680362533396, 'sideways_tp_mult': 1.7458916637964152, 'sideways_tsl_mult': 0.7698003459557956, 'sideways_time_stop': 244, 'sideways_use_sma': False, 'sideways_use_ema': True, 'sideways_use_atr': False, 'sideways_use_adx': False, 'sideways_use_spike': True, 'sideways_rsi_required': False}.
[I 2025-08-31 10:09:27,107] Trial 393 finished with values: [-1000000000.0, 1000000000.0] and parameters: {'p_sma': 30, 'p_std': 17, 'p_atr': 16, 'p_adx': 7, 'rsi_period': 23, 'ema1': 21, 'ema2': 39, 'slip_atr_k': 0.19126920806412434, 'slip_spread_k': 0.4381290304077241, 'spread_hl_frac': 0.012409441003638876, 'bb_std_mult': 1.049355099980475, 'rsi_os': 45, 'rsi_ob': 47, 'vol_spike': 0.14342238740179014, 'adx_thresh': 12.64902857283952, 'atr_min_pct': 0.012967434252514448, 'atr_max_pct': 0.14276091205101718, 'tp_mult': 1.2567753230850385, 'tsl_mult': 0.6339348306074285, 'strategy': 'mean_reversion', 'time_stop': 28, 'use_sma': False, 'use_atr': True, 'use_adx': False, 'use_ema': True, 'use_spike': True, 'rsi_required': False, 'edge_k': 1.2896653410904504, 'edge_cap': 0.1374836968825365, 'bull_strategy': 'mean_reversion', 'bull_bb_std_mult': 1.8590387993220514, 'bull_rsi_os': 32, 'bull_rsi_ob': 86, 'bull_adx_thresh': 29.50088675582095, 'bull_atr_min_pct': 0.018488944673607177, 'bull_atr_max_pct': 0.1322694868869863, 'bull_tp_mult': 2.3344844684586397, 'bull_tsl_mult': 0.6059720541920205, 'bull_time_stop': 255, 'bull_use_sma': True, 'bull_use_ema': False, 'bull_use_atr': True, 'bull_use_adx': False, 'bull_use_spike': False, 'bull_rsi_required': True, 'bear_strategy': 'breakout', 'bear_bb_std_mult': 1.097194482923292, 'bear_rsi_os': 51, 'bear_rsi_ob': 79, 'bear_adx_thresh': 28.46186489694915, 'bear_atr_min_pct': 0.0116822391422859, 'bear_atr_max_pct': 0.1333334207204517, 'bear_tp_mult': 1.6938107974066092, 'bear_tsl_mult': 0.7879044416253412, 'bear_time_stop': 251, 'bear_use_sma': False, 'bear_use_ema': True, 'bear_use_atr': True, 'bear_use_adx': True, 'bear_use_spike': True, 'bear_rsi_required': False, 'sideways_strategy': 'breakout', 'sideways_bb_std_mult': 1.0701714269030551, 'sideways_rsi_os': 12, 'sideways_rsi_ob': 65, 'sideways_adx_thresh': 31.13691620370559, 'sideways_atr_min_pct': 0.002257798274472029, 'sideways_atr_max_pct': 0.12293049600502061, 'sideways_tp_mult': 1.6817422164248563, 'sideways_tsl_mult': 0.7029665837383534, 'sideways_time_stop': 245, 'sideways_use_sma': False, 'sideways_use_ema': True, 'sideways_use_atr': False, 'sideways_use_adx': False, 'sideways_use_spike': True, 'sideways_rsi_required': False}.
[I 2025-08-31 10:09:55,294] Trial 390 finished with values: [-1000000000.0, 1000000000.0] and parameters: {'p_sma': 50, 'p_std': 16, 'p_atr': 28, 'p_adx': 10, 'rsi_period': 45, 'ema1': 20, 'ema2': 16, 'slip_atr_k': 0.17032773983078278, 'slip_spread_k': 0.4420964262927453, 'spread_hl_frac': 0.03585105619796912, 'bb_std_mult': 0.9061338510353185, 'rsi_os': 17, 'rsi_ob': 56, 'vol_spike': 0.1448336021938709, 'adx_thresh': 34.94824013492742, 'atr_min_pct': 0.0035449623837934124, 'atr_max_pct': 0.11606822178800126, 'tp_mult': 2.868285254306446, 'tsl_mult': 0.0247493174666151, 'strategy': 'mean_reversion', 'time_stop': 160, 'use_sma': False, 'use_atr': False, 'use_adx': False, 'use_ema': False, 'use_spike': False, 'rsi_required': False, 'edge_k': 1.8286946983499797, 'edge_cap': 0.999476456762331, 'bull_strategy': 'mean_reversion', 'bull_bb_std_mult': 1.1428645686611774, 'bull_rsi_os': 32, 'bull_rsi_ob': 88, 'bull_adx_thresh': 6.554563682753079, 'bull_atr_min_pct': 0.02636580695631414, 'bull_atr_max_pct': 0.04205767419093448, 'bull_tp_mult': 1.4284529830665391, 'bull_tsl_mult': 0.12948127592628317, 'bull_time_stop': 253, 'bull_use_sma': True, 'bull_use_ema': False, 'bull_use_atr': True, 'bull_use_adx': False, 'bull_use_spike': False, 'bull_rsi_required': False, 'bear_strategy': 'breakout', 'bear_bb_std_mult': 3.091886439726892, 'bear_rsi_os': 53, 'bear_rsi_ob': 79, 'bear_adx_thresh': 20.955819005886763, 'bear_atr_min_pct': 0.021852876538273665, 'bear_atr_max_pct': 0.13484896964526522, 'bear_tp_mult': 2.615166203355824, 'bear_tsl_mult': 0.7998957122766309, 'bear_time_stop': 12, 'bear_use_sma': False, 'bear_use_ema': True, 'bear_use_atr': True, 'bear_use_adx': False, 'bear_use_spike': False, 'bear_rsi_required': True, 'sideways_strategy': 'breakout', 'sideways_bb_std_mult': 2.9087579430333195, 'sideways_rsi_os': 39, 'sideways_rsi_ob': 70, 'sideways_adx_thresh': 5.902497519754686, 'sideways_atr_min_pct': 0.023791193559501503, 'sideways_atr_max_pct': 0.12868054812673196, 'sideways_tp_mult': 1.4957754260757903, 'sideways_tsl_mult': 0.7042884439829465, 'sideways_time_stop': 243, 'sideways_use_sma': False, 'sideways_use_ema': True, 'sideways_use_atr': False, 'sideways_use_adx': False, 'sideways_use_spike': False, 'sideways_rsi_required': False}.
[I 2025-08-31 10:09:55,707] Trial 391 finished with values: [-1000000000.0, 1000000000.0] and parameters: {'p_sma': 30, 'p_std': 31, 'p_atr': 15, 'p_adx': 7, 'rsi_period': 18, 'ema1': 21, 'ema2': 42, 'slip_atr_k': 0.23648065152491898, 'slip_spread_k': 0.07866031082594577, 'spread_hl_frac': 0.01445264978646933, 'bb_std_mult': 1.0502916495509087, 'rsi_os': 25, 'rsi_ob': 84, 'vol_spike': 0.2301488227970845, 'adx_thresh': 25.72784198937274, 'atr_min_pct': 0.012402587728595309, 'atr_max_pct': 0.1426861020668163, 'tp_mult': 2.8849638151715498, 'tsl_mult': 0.02840203841668596, 'strategy': 'mean_reversion', 'time_stop': 32, 'use_sma': False, 'use_atr': False, 'use_adx': False, 'use_ema': True, 'use_spike': False, 'rsi_required': False, 'edge_k': 1.2917178738098558, 'edge_cap': 0.12021392345714955, 'bull_strategy': 'mean_reversion', 'bull_bb_std_mult': 1.268403190319699, 'bull_rsi_os': 32, 'bull_rsi_ob': 55, 'bull_adx_thresh': 6.0194216504750635, 'bull_atr_min_pct': 0.0245690055132022, 'bull_atr_max_pct': 0.14739600176916956, 'bull_tp_mult': 1.4234507753019716, 'bull_tsl_mult': 0.5623246864905279, 'bull_time_stop': 252, 'bull_use_sma': True, 'bull_use_ema': False, 'bull_use_atr': True, 'bull_use_adx': False, 'bull_use_spike': False, 'bull_rsi_required': False, 'bear_strategy': 'breakout', 'bear_bb_std_mult': 1.1225271626134372, 'bear_rsi_os': 51, 'bear_rsi_ob': 67, 'bear_adx_thresh': 8.867905599139878, 'bear_atr_min_pct': 0.021997745762124744, 'bear_atr_max_pct': 0.07980176475370061, 'bear_tp_mult': 1.0937178879819096, 'bear_tsl_mult': 0.7866796519952537, 'bear_time_stop': 123, 'bear_use_sma': False, 'bear_use_ema': True, 'bear_use_atr': True, 'bear_use_adx': False, 'bear_use_spike': True, 'bear_rsi_required': True, 'sideways_strategy': 'breakout', 'sideways_bb_std_mult': 1.062122340329278, 'sideways_rsi_os': 26, 'sideways_rsi_ob': 65, 'sideways_adx_thresh': 26.12646906803994, 'sideways_atr_min_pct': 0.004108335941981688, 'sideways_atr_max_pct': 0.03353248318360544, 'sideways_tp_mult': 1.9436626105456276, 'sideways_tsl_mult': 0.07144092498701737, 'sideways_time_stop': 117, 'sideways_use_sma': False, 'sideways_use_ema': True, 'sideways_use_atr': False, 'sideways_use_adx': False, 'sideways_use_spike': False, 'sideways_rsi_required': False}.
[I 2025-08-31 10:09:58,929] Trial 395 finished with values: [-1000000000.0, 1000000000.0] and parameters: {'p_sma': 48, 'p_std': 14, 'p_atr': 29, 'p_adx': 27, 'rsi_period': 19, 'ema1': 20, 'ema2': 42, 'slip_atr_k': 0.16660356572147544, 'slip_spread_k': 0.7430131884219385, 'spread_hl_frac': 0.014689453769711106, 'bb_std_mult': 3.580596595296101, 'rsi_os': 16, 'rsi_ob': 84, 'vol_spike': 0.13496808140329258, 'adx_thresh': 6.9157487790454955, 'atr_min_pct': 0.0004865141688503924, 'atr_max_pct': 0.1338004460237622, 'tp_mult': 2.8721988584296447, 'tsl_mult': 0.021474076934224585, 'strategy': 'breakout', 'time_stop': 163, 'use_sma': True, 'use_atr': False, 'use_adx': True, 'use_ema': False, 'use_spike': False, 'rsi_required': True, 'edge_k': 1.945511590807332, 'edge_cap': 0.11089690125470252, 'bull_strategy': 'breakout', 'bull_bb_std_mult': 1.380521068194527, 'bull_rsi_os': 15, 'bull_rsi_ob': 66, 'bull_adx_thresh': 31.35360240782405, 'bull_atr_min_pct': 0.02440465173772086, 'bull_atr_max_pct': 0.010073387062449812, 'bull_tp_mult': 1.6418691244197359, 'bull_tsl_mult': 0.6797073671026622, 'bull_time_stop': 201, 'bull_use_sma': False, 'bull_use_ema': False, 'bull_use_atr': False, 'bull_use_adx': True, 'bull_use_spike': True, 'bull_rsi_required': True, 'bear_strategy': 'mean_reversion', 'bear_bb_std_mult': 1.3456663839168723, 'bear_rsi_os': 53, 'bear_rsi_ob': 49, 'bear_adx_thresh': 21.68623791548703, 'bear_atr_min_pct': 0.021918820122688108, 'bear_atr_max_pct': 0.13509231618540693, 'bear_tp_mult': 2.677043544650472, 'bear_tsl_mult': 0.4418875851203975, 'bear_time_stop': 240, 'bear_use_sma': True, 'bear_use_ema': True, 'bear_use_atr': False, 'bear_use_adx': False, 'bear_use_spike': False, 'bear_rsi_required': True, 'sideways_strategy': 'breakout', 'sideways_bb_std_mult': 2.9616739334141227, 'sideways_rsi_os': 43, 'sideways_rsi_ob': 67, 'sideways_adx_thresh': 32.56097850002034, 'sideways_atr_min_pct': 0.013622408474844699, 'sideways_atr_max_pct': 0.03393544988917109, 'sideways_tp_mult': 1.512350575777634, 'sideways_tsl_mult': 0.07232644014357079, 'sideways_time_stop': 238, 'sideways_use_sma': True, 'sideways_use_ema': False, 'sideways_use_atr': True, 'sideways_use_adx': True, 'sideways_use_spike': False, 'sideways_rsi_required': False}.
[I 2025-08-31 10:09:59,254] Trial 394 finished with values: [-1000000000.0, 1000000000.0] and parameters: {'p_sma': 9, 'p_std': 16, 'p_atr': 16, 'p_adx': 9, 'rsi_period': 23, 'ema1': 21, 'ema2': 42, 'slip_atr_k': 0.19507133794640952, 'slip_spread_k': 0.8220806366681004, 'spread_hl_frac': 0.014703531231212328, 'bb_std_mult': 2.5134737221363204, 'rsi_os': 20, 'rsi_ob': 60, 'vol_spike': 0.13643575471819736, 'adx_thresh': 6.773172879511521, 'atr_min_pct': 0.012998129050252301, 'atr_max_pct': 0.13392965193412082, 'tp_mult': 1.9053663447269518, 'tsl_mult': 0.02420102894877298, 'strategy': 'mean_reversion', 'time_stop': 242, 'use_sma': True, 'use_atr': False, 'use_adx': True, 'use_ema': False, 'use_spike': False, 'rsi_required': True, 'edge_k': 1.302577152741257, 'edge_cap': 0.13896760106757947, 'bull_strategy': 'breakout', 'bull_bb_std_mult': 1.3676070071923558, 'bull_rsi_os': 10, 'bull_rsi_ob': 82, 'bull_adx_thresh': 29.265025841682412, 'bull_atr_min_pct': 0.020398886459829832, 'bull_atr_max_pct': 0.14720034484193784, 'bull_tp_mult': 1.650496709872943, 'bull_tsl_mult': 0.6783056659491971, 'bull_time_stop': 254, 'bull_use_sma': False, 'bull_use_ema': False, 'bull_use_atr': True, 'bull_use_adx': True, 'bull_use_spike': True, 'bull_rsi_required': True, 'bear_strategy': 'mean_reversion', 'bear_bb_std_mult': 1.8356649967823289, 'bear_rsi_os': 35, 'bear_rsi_ob': 91, 'bear_adx_thresh': 16.884083288284458, 'bear_atr_min_pct': 0.02200279502979511, 'bear_atr_max_pct': 0.1343035800065624, 'bear_tp_mult': 2.3594204296068315, 'bear_tsl_mult': 0.11121933711566201, 'bear_time_stop': 250, 'bear_use_sma': False, 'bear_use_ema': True, 'bear_use_atr': False, 'bear_use_adx': True, 'bear_use_spike': False, 'bear_rsi_required': True, 'sideways_strategy': 'breakout', 'sideways_bb_std_mult': 2.9600484870639647, 'sideways_rsi_os': 46, 'sideways_rsi_ob': 67, 'sideways_adx_thresh': 20.975586244892735, 'sideways_atr_min_pct': 0.02375001797701229, 'sideways_atr_max_pct': 0.03282267041109383, 'sideways_tp_mult': 1.1692413201702836, 'sideways_tsl_mult': 0.7021584782793266, 'sideways_time_stop': 236, 'sideways_use_sma': True, 'sideways_use_ema': True, 'sideways_use_atr': True, 'sideways_use_adx': True, 'sideways_use_spike': False, 'sideways_rsi_required': False}.
