[I 2025-08-31 10:01:15,275] Trial 315 finished with values: [-1000000000.0, 1000000000.0] and parameters: {'p_sma': 49, 'p_std': 55, 'p_atr': 24, 'p_adx': 9, 'rsi_period': 43, 'ema1': 22, 'ema2': 39, 'slip_atr_k': 0.1656681175758136, 'slip_spread_k': 0.19661965962977562, 'spread_hl_frac': 0.035465032467629984, 'bb_std_mult': 0.8824258414616697, 'rsi_os': 18, 'rsi_ob': 59, 'vol_spike': 0.12178315535732569, 'adx_thresh': 21.760253058342634, 'atr_min_pct': 0.009040453484615598, 'atr_max_pct': 0.14850852388703917, 'tp_mult': 2.2530117097640825, 'tsl_mult': 0.014745655716626945, 'strategy': 'breakout', 'time_stop': 299, 'use_sma': True, 'use_atr': False, 'use_adx': False, 'use_ema': False, 'use_spike': False, 'rsi_required': True, 'edge_k': 1.34664615273085, 'edge_cap': 0.12750929160198668, 'bull_strategy': 'breakout', 'bull_bb_std_mult': 3.189874145836766, 'bull_rsi_os': 16, 'bull_rsi_ob': 67, 'bull_adx_thresh': 34.98151613818472, 'bull_atr_min_pct': 0.023529009382815106, 'bull_atr_max_pct': 0.11694212594603305, 'bull_tp_mult': 1.4840014843515579, 'bull_tsl_mult': 0.5881201402807382, 'bull_time_stop': 256, 'bull_use_sma': True, 'bull_use_ema': False, 'bull_use_atr': False, 'bull_use_adx': True, 'bull_use_spike': False, 'bull_rsi_required': True, 'bear_strategy': 'breakout', 'bear_bb_std_mult': 3.1189573593211186, 'bear_rsi_os': 49, 'bear_rsi_ob': 81, 'bear_adx_thresh': 21.160318379176374, 'bear_atr_min_pct': 0.021526463491299056, 'bear_atr_max_pct': 0.14744084852520953, 'bear_tp_mult': 2.5917680898579496, 'bear_tsl_mult': 0.5313568136612589, 'bear_time_stop': 298, 'bear_use_sma': False, 'bear_use_ema': True, 'bear_use_atr': False, 'bear_use_adx': True, 'bear_use_spike': False, 'bear_rsi_required': True, 'sideways_strategy': 'breakout', 'sideways_bb_std_mult': 1.0934323404990987, 'sideways_rsi_os': 25, 'sideways_rsi_ob': 80, 'sideways_adx_thresh': 29.50580043571441, 'sideways_atr_min_pct': 0.02118591339636241, 'sideways_atr_max_pct': 0.03103207566619458, 'sideways_tp_mult': 2.025689513923656, 'sideways_tsl_mult': 0.0795651083721318, 'sideways_time_stop': 249, 'sideways_use_sma': True, 'sideways_use_ema': True, 'sideways_use_atr': False, 'sideways_use_adx': True, 'sideways_use_spike': False, 'sideways_rsi_required': False}.
[I 2025-08-31 10:01:15,885] Trial 319 finished with values: [-1000000000.0, 1000000000.0] and parameters: {'p_sma': 48, 'p_std': 14, 'p_atr': 11, 'p_adx': 9, 'rsi_period': 71, 'ema1': 21, 'ema2': 23, 'slip_atr_k': 0.12127984116884029, 'slip_spread_k': 0.41594401300868106, 'spread_hl_frac': 0.012928996332540289, 'bb_std_mult': 3.421379958545695, 'rsi_os': 20, 'rsi_ob': 45, 'vol_spike': 0.1396905521002915, 'adx_thresh': 29.441572941340773, 'atr_min_pct': 0.011549913531593143, 'atr_max_pct': 0.029968466279917075, 'tp_mult': 2.6040080135044064, 'tsl_mult': 0.016365988718026518, 'strategy': 'mean_reversion', 'time_stop': 136, 'use_sma': True, 'use_atr': True, 'use_adx': False, 'use_ema': False, 'use_spike': True, 'rsi_required': False, 'edge_k': 1.9634283123144012, 'edge_cap': 0.0914071636745023, 'bull_strategy': 'breakout', 'bull_bb_std_mult': 1.137079299324845, 'bull_rsi_os': 44, 'bull_rsi_ob': 81, 'bull_adx_thresh': 31.152347038513756, 'bull_atr_min_pct': 0.020208066858302974, 'bull_atr_max_pct': 0.05352785583769844, 'bull_tp_mult': 2.0230191768010575, 'bull_tsl_mult': 0.8313481185982323, 'bull_time_stop': 242, 'bull_use_sma': True, 'bull_use_ema': True, 'bull_use_atr': True, 'bull_use_adx': False, 'bull_use_spike': True, 'bull_rsi_required': True, 'bear_strategy': 'breakout', 'bear_bb_std_mult': 2.723584750159125, 'bear_rsi_os': 6, 'bear_rsi_ob': 80, 'bear_adx_thresh': 20.74951026490602, 'bear_atr_min_pct': 0.012134165576130958, 'bear_atr_max_pct': 0.03267189220496052, 'bear_tp_mult': 2.6319318348824607, 'bear_tsl_mult': 0.7166312297921426, 'bear_time_stop': 110, 'bear_use_sma': False, 'bear_use_ema': False, 'bear_use_atr': False, 'bear_use_adx': True, 'bear_use_spike': True, 'bear_rsi_required': False, 'sideways_strategy': 'breakout', 'sideways_bb_std_mult': 2.9889032470675265, 'sideways_rsi_os': 27, 'sideways_rsi_ob': 67, 'sideways_adx_thresh': 23.845255022249702, 'sideways_atr_min_pct': 0.0033686828584500584, 'sideways_atr_max_pct': 0.14978385669024527, 'sideways_tp_mult': 1.4395938916305195, 'sideways_tsl_mult': 0.6241344296730345, 'sideways_time_stop': 240, 'sideways_use_sma': True, 'sideways_use_ema': True, 'sideways_use_atr': True, 'sideways_use_adx': False, 'sideways_use_spike': False, 'sideways_rsi_required': False}.
[I 2025-08-31 10:01:45,658] Trial 316 finished with values: [-1000000000.0, 1000000000.0] and parameters: {'p_sma': 49, 'p_std': 55, 'p_atr': 24, 'p_adx': 27, 'rsi_period': 44, 'ema1': 21, 'ema2': 39, 'slip_atr_k': 0.16622466970491576, 'slip_spread_k': 0.6188099797073174, 'spread_hl_frac': 0.0131044249860315, 'bb_std_mult': 0.9729834509867976, 'rsi_os': 9, 'rsi_ob': 59, 'vol_spike': 0.12185108736073917, 'adx_thresh': 5.002512370808645, 'atr_min_pct': 0.0191616397148741, 'atr_max_pct': 0.04652157190111831, 'tp_mult': 2.7122501557724767, 'tsl_mult': 0.019823085100667, 'strategy': 'breakout', 'time_stop': 156, 'use_sma': True, 'use_atr': False, 'use_adx': False, 'use_ema': False, 'use_spike': False, 'rsi_required': True, 'edge_k': 1.9371588607720631, 'edge_cap': 0.1592687875527982, 'bull_strategy': 'breakout', 'bull_bb_std_mult': 1.0295184003787556, 'bull_rsi_os': 15, 'bull_rsi_ob': 67, 'bull_adx_thresh': 31.23262493229723, 'bull_atr_min_pct': 0.024008892033108103, 'bull_atr_max_pct': 0.044969336069387494, 'bull_tp_mult': 2.025377743254337, 'bull_tsl_mult': 0.17925829572170687, 'bull_time_stop': 122, 'bull_use_sma': True, 'bull_use_ema': False, 'bull_use_atr': True, 'bull_use_adx': True, 'bull_use_spike': False, 'bull_rsi_required': True, 'bear_strategy': 'breakout', 'bear_bb_std_mult': 2.7950163973731517, 'bear_rsi_os': 49, 'bear_rsi_ob': 81, 'bear_adx_thresh': 20.456458631343807, 'bear_atr_min_pct': 0.0068885056109141245, 'bear_atr_max_pct': 0.14765950836870104, 'bear_tp_mult': 2.5939537879203427, 'bear_tsl_mult': 0.5281867029236289, 'bear_time_stop': 299, 'bear_use_sma': False, 'bear_use_ema': True, 'bear_use_atr': False, 'bear_use_adx': True, 'bear_use_spike': False, 'bear_rsi_required': True, 'sideways_strategy': 'breakout', 'sideways_bb_std_mult': 1.0904037863489138, 'sideways_rsi_os': 33, 'sideways_rsi_ob': 67, 'sideways_adx_thresh': 18.174560053578464, 'sideways_atr_min_pct': 0.008116865337208606, 'sideways_atr_max_pct': 0.0316021651679596, 'sideways_tp_mult': 1.1969050375386545, 'sideways_tsl_mult': 0.9975083900693009, 'sideways_time_stop': 237, 'sideways_use_sma': True, 'sideways_use_ema': True, 'sideways_use_atr': False, 'sideways_use_adx': True, 'sideways_use_spike': False, 'sideways_rsi_required': False}.
[I 2025-08-31 10:01:45,954] Trial 317 finished with values: [-0.05737650671997485, 0.05726488854973543] and parameters: {'p_sma': 40, 'p_std': 33, 'p_atr': 30, 'p_adx': 9, 'rsi_period': 20, 'ema1': 23, 'ema2': 41, 'slip_atr_k': 0.16610935972206572, 'slip_spread_k': 0.6168891792461577, 'spread_hl_frac': 0.012519633165930627, 'bb_std_mult': 2.184205119245895, 'rsi_os': 9, 'rsi_ob': 45, 'vol_spike': 0.012192784741207219, 'adx_thresh': 26.33696912110097, 'atr_min_pct': 0.011857579817295712, 'atr_max_pct': 0.03373042354186546, 'tp_mult': 1.504023640626605, 'tsl_mult': 0.017195823373394297, 'strategy': 'breakout', 'time_stop': 156, 'use_sma': True, 'use_atr': False, 'use_adx': False, 'use_ema': False, 'use_spike': False, 'rsi_required': True, 'edge_k': 1.343207852485036, 'edge_cap': 0.2172931971924681, 'bull_strategy': 'breakout', 'bull_bb_std_mult': 2.6586206017595515, 'bull_rsi_os': 28, 'bull_rsi_ob': 64, 'bull_adx_thresh': 34.80729004250908, 'bull_atr_min_pct': 0.022459652532666838, 'bull_atr_max_pct': 0.02038827654752108, 'bull_tp_mult': 2.5438831182267334, 'bull_tsl_mult': 0.5858528481769509, 'bull_time_stop': 256, 'bull_use_sma': True, 'bull_use_ema': False, 'bull_use_atr': True, 'bull_use_adx': True, 'bull_use_spike': True, 'bull_rsi_required': True, 'bear_strategy': 'breakout', 'bear_bb_std_mult': 2.8008222347499725, 'bear_rsi_os': 53, 'bear_rsi_ob': 81, 'bear_adx_thresh': 20.527732836088827, 'bear_atr_min_pct': 0.026980694803334426, 'bear_atr_max_pct': 0.1479131148113022, 'bear_tp_mult': 1.797829998482174, 'bear_tsl_mult': 0.5296919807101489, 'bear_time_stop': 298, 'bear_use_sma': False, 'bear_use_ema': True, 'bear_use_atr': False, 'bear_use_adx': True, 'bear_use_spike': False, 'bear_rsi_required': True, 'sideways_strategy': 'breakout', 'sideways_bb_std_mult': 0.7767034028651931, 'sideways_rsi_os': 26, 'sideways_rsi_ob': 66, 'sideways_adx_thresh': 33.7321109525924, 'sideways_atr_min_pct': 0.00013070669026805167, 'sideways_atr_max_pct': 0.03104386786628125, 'sideways_tp_mult': 1.4436454481763146, 'sideways_tsl_mult': 0.11870420728082753, 'sideways_time_stop': 72, 'sideways_use_sma': True, 'sideways_use_ema': True, 'sideways_use_atr': True, 'sideways_use_adx': True, 'sideways_use_spike': False, 'sideways_rsi_required': False}.
[I 2025-08-31 10:01:46,235] Trial 318 finished with values: [-0.09175443193174537, 0.09166131326853443] and parameters: {'p_sma': 18, 'p_std': 14, 'p_atr': 11, 'p_adx': 9, 'rsi_period': 19, 'ema1': 23, 'ema2': 36, 'slip_atr_k': 0.1534256405225762, 'slip_spread_k': 0.4614350586331901, 'spread_hl_frac': 0.013158125739333509, 'bb_std_mult': 3.4114868148691597, 'rsi_os': 18, 'rsi_ob': 57, 'vol_spike': 0.14020405329897984, 'adx_thresh': 5.32994257511616, 'atr_min_pct': 0.01178474571760514, 'atr_max_pct': 0.029785197431489094, 'tp_mult': 1.4910494056054415, 'tsl_mult': 0.15700092706064567, 'strategy': 'breakout', 'time_stop': 115, 'use_sma': True, 'use_atr': False, 'use_adx': False, 'use_ema': False, 'use_spike': True, 'rsi_required': True, 'edge_k': 1.9559127868739232, 'edge_cap': 0.09498545358703811, 'bull_strategy': 'breakout', 'bull_bb_std_mult': 3.2691645561561664, 'bull_rsi_os': 33, 'bull_rsi_ob': 81, 'bull_adx_thresh': 13.514268115346422, 'bull_atr_min_pct': 0.02008354979498895, 'bull_atr_max_pct': 0.10888770144174884, 'bull_tp_mult': 2.0259650340514272, 'bull_tsl_mult': 0.5834353682877562, 'bull_time_stop': 120, 'bull_use_sma': True, 'bull_use_ema': False, 'bull_use_atr': True, 'bull_use_adx': True, 'bull_use_spike': True, 'bull_rsi_required': True, 'bear_strategy': 'breakout', 'bear_bb_std_mult': 1.1198045986200262, 'bear_rsi_os': 49, 'bear_rsi_ob': 81, 'bear_adx_thresh': 21.117890828789182, 'bear_atr_min_pct': 0.00158883509473378, 'bear_atr_max_pct': 0.03380794028223631, 'bear_tp_mult': 2.604877049702126, 'bear_tsl_mult': 0.11020599674503068, 'bear_time_stop': 230, 'bear_use_sma': False, 'bear_use_ema': True, 'bear_use_atr': False, 'bear_use_adx': True, 'bear_use_spike': False, 'bear_rsi_required': True, 'sideways_strategy': 'breakout', 'sideways_bb_std_mult': 0.79259314188651, 'sideways_rsi_os': 27, 'sideways_rsi_ob': 67, 'sideways_adx_thresh': 33.683129039451856, 'sideways_atr_min_pct': 0.002134302089216937, 'sideways_atr_max_pct': 0.1263444511464232, 'sideways_tp_mult': 2.020833003824749, 'sideways_tsl_mult': 0.8781589626397055, 'sideways_time_stop': 238, 'sideways_use_sma': True, 'sideways_use_ema': True, 'sideways_use_atr': True, 'sideways_use_adx': True, 'sideways_use_spike': False, 'sideways_rsi_required': False}.
[I 2025-08-31 10:01:47,849] Trial 320 finished with values: [-1000000000.0, 1000000000.0] and parameters: {'p_sma': 40, 'p_std': 30, 'p_atr': 30, 'p_adx': 8, 'rsi_period': 19, 'ema1': 14, 'ema2': 41, 'slip_atr_k': 0.18182779310805958, 'slip_spread_k': 0.45856127008572706, 'spread_hl_frac': 0.03392792065817312, 'bb_std_mult': 0.9817252678557443, 'rsi_os': 21, 'rsi_ob': 50, 'vol_spike': 0.14360997432527087, 'adx_thresh': 6.61760464653862, 'atr_min_pct': 0.01945732754155863, 'atr_max_pct': 0.045895792022896974, 'tp_mult': 2.785098348886274, 'tsl_mult': 0.8848043957170485, 'strategy': 'breakout', 'time_stop': 158, 'use_sma': False, 'use_atr': False, 'use_adx': False, 'use_ema': False, 'use_spike': False, 'rsi_required': True, 'edge_k': 0.6590520800755771, 'edge_cap': 0.1586783856367886, 'bull_strategy': 'mean_reversion', 'bull_bb_std_mult': 0.6081181553399064, 'bull_rsi_os': 37, 'bull_rsi_ob': 60, 'bull_adx_thresh': 29.934966718722553, 'bull_atr_min_pct': 0.022225656805407275, 'bull_atr_max_pct': 0.1245498851869929, 'bull_tp_mult': 1.101317794212901, 'bull_tsl_mult': 0.6410097370338238, 'bull_time_stop': 151, 'bull_use_sma': True, 'bull_use_ema': False, 'bull_use_atr': True, 'bull_use_adx': False, 'bull_use_spike': False, 'bull_rsi_required': True, 'bear_strategy': 'breakout', 'bear_bb_std_mult': 2.6541692827594643, 'bear_rsi_os': 53, 'bear_rsi_ob': 81, 'bear_adx_thresh': 20.446039468256906, 'bear_atr_min_pct': 0.006982306583537792, 'bear_atr_max_pct': 0.14038706791062708, 'bear_tp_mult': 2.571528889128597, 'bear_tsl_mult': 0.6042376571443054, 'bear_time_stop': 23, 'bear_use_sma': False, 'bear_use_ema': True, 'bear_use_atr': False, 'bear_use_adx': True, 'bear_use_spike': False, 'bear_rsi_required': True, 'sideways_strategy': 'breakout', 'sideways_bb_std_mult': 0.7869007027062185, 'sideways_rsi_os': 33, 'sideways_rsi_ob': 63, 'sideways_adx_thresh': 33.65148424548772, 'sideways_atr_min_pct': 0.005739033343847113, 'sideways_atr_max_pct': 0.08592256245470756, 'sideways_tp_mult': 1.5607415622252496, 'sideways_tsl_mult': 0.8708812812911804, 'sideways_time_stop': 235, 'sideways_use_sma': True, 'sideways_use_ema': True, 'sideways_use_atr': False, 'sideways_use_adx': False, 'sideways_use_spike': True, 'sideways_rsi_required': False}.
[I 2025-08-31 10:01:48,316] Trial 324 finished with values: [-1000000000.0, 1000000000.0] and parameters: {'p_sma': 44, 'p_std': 19, 'p_atr': 28, 'p_adx': 11, 'rsi_period': 40, 'ema1': 10, 'ema2': 40, 'slip_atr_k': 0.1769673161666594, 'slip_spread_k': 0.4193241375185126, 'spread_hl_frac': 0.009078233439298096, 'bb_std_mult': 1.0475133338347855, 'rsi_os': 6, 'rsi_ob': 48, 'vol_spike': 0.15291806921677364, 'adx_thresh': 25.362565630573428, 'atr_min_pct': 0.010870345915908767, 'atr_max_pct': 0.020980730574267234, 'tp_mult': 2.9560804092395543, 'tsl_mult': 0.3976644745679262, 'strategy': 'mean_reversion', 'time_stop': 140, 'use_sma': False, 'use_atr': True, 'use_adx': False, 'use_ema': True, 'use_spike': False, 'rsi_required': False, 'edge_k': 0.08250657555099306, 'edge_cap': 0.7704415398720514, 'bull_strategy': 'mean_reversion', 'bull_bb_std_mult': 1.7332677303371602, 'bull_rsi_os': 30, 'bull_rsi_ob': 55, 'bull_adx_thresh': 32.161783738178336, 'bull_atr_min_pct': 0.026832208492171453, 'bull_atr_max_pct': 0.11348943520943938, 'bull_tp_mult': 1.5722355300625235, 'bull_tsl_mult': 0.6616647588487284, 'bull_time_stop': 248, 'bull_use_sma': True, 'bull_use_ema': True, 'bull_use_atr': False, 'bull_use_adx': False, 'bull_use_spike': False, 'bull_rsi_required': True, 'bear_strategy': 'breakout', 'bear_bb_std_mult': 2.8766839952166925, 'bear_rsi_os': 54, 'bear_rsi_ob': 77, 'bear_adx_thresh': 22.740356123044982, 'bear_atr_min_pct': 0.015833076641406648, 'bear_atr_max_pct': 0.1451135375951625, 'bear_tp_mult': 2.7312153370635297, 'bear_tsl_mult': 0.6408777970878293, 'bear_time_stop': 237, 'bear_use_sma': True, 'bear_use_ema': False, 'bear_use_atr': False, 'bear_use_adx': False, 'bear_use_spike': True, 'bear_rsi_required': False, 'sideways_strategy': 'mean_reversion', 'sideways_bb_std_mult': 2.7848384003671507, 'sideways_rsi_os': 24, 'sideways_rsi_ob': 83, 'sideways_adx_thresh': 27.073332722447933, 'sideways_atr_min_pct': 0.0012744135797108148, 'sideways_atr_max_pct': 0.056332177046117815, 'sideways_tp_mult': 1.3561078743992465, 'sideways_tsl_mult': 0.05022487733492565, 'sideways_time_stop': 224, 'sideways_use_sma': True, 'sideways_use_ema': True, 'sideways_use_atr': False, 'sideways_use_adx': False, 'sideways_use_spike': True, 'sideways_rsi_required': True}.
[I 2025-08-31 10:02:19,913] Trial 322 finished with values: [-1000000000.0, 1000000000.0] and parameters: {'p_sma': 18, 'p_std': 12, 'p_atr': 28, 'p_adx': 8, 'rsi_period': 22, 'ema1': 14, 'ema2': 36, 'slip_atr_k': 0.18155747423618526, 'slip_spread_k': 0.4580053542080786, 'spread_hl_frac': 0.008736673850658027, 'bb_std_mult': 1.0273865789836008, 'rsi_os': 33, 'rsi_ob': 56, 'vol_spike': 0.14192843761225699, 'adx_thresh': 34.75210626615571, 'atr_min_pct': 0.010879397048331105, 'atr_max_pct': 0.13506188414535347, 'tp_mult': 2.932468419548556, 'tsl_mult': 0.06057266068147622, 'strategy': 'breakout', 'time_stop': 117, 'use_sma': False, 'use_atr': True, 'use_adx': False, 'use_ema': True, 'use_spike': True, 'rsi_required': True, 'edge_k': 1.774366195117241, 'edge_cap': 0.10612660749577034, 'bull_strategy': 'mean_reversion', 'bull_bb_std_mult': 1.641790709849972, 'bull_rsi_os': 30, 'bull_rsi_ob': 64, 'bull_adx_thresh': 30.102193606194714, 'bull_atr_min_pct': 0.018947816069519112, 'bull_atr_max_pct': 0.1246137654576955, 'bull_tp_mult': 1.3613855548887819, 'bull_tsl_mult': 0.6648383112024263, 'bull_time_stop': 279, 'bull_use_sma': True, 'bull_use_ema': False, 'bull_use_atr': False, 'bull_use_adx': False, 'bull_use_spike': False, 'bull_rsi_required': True, 'bear_strategy': 'breakout', 'bear_bb_std_mult': 3.3176103621735864, 'bear_rsi_os': 54, 'bear_rsi_ob': 76, 'bear_adx_thresh': 21.386398060741854, 'bear_atr_min_pct': 0.020382750858303236, 'bear_atr_max_pct': 0.07698781227014347, 'bear_tp_mult': 1.4018241433020737, 'bear_tsl_mult': 0.6433670833353264, 'bear_time_stop': 181, 'bear_use_sma': True, 'bear_use_ema': True, 'bear_use_atr': False, 'bear_use_adx': False, 'bear_use_spike': False, 'bear_rsi_required': False, 'sideways_strategy': 'mean_reversion', 'sideways_bb_std_mult': 0.9793675728458953, 'sideways_rsi_os': 15, 'sideways_rsi_ob': 64, 'sideways_adx_thresh': 31.82959968560087, 'sideways_atr_min_pct': 0.00233927942201933, 'sideways_atr_max_pct': 0.1261804915239478, 'sideways_tp_mult': 2.466006686364626, 'sideways_tsl_mult': 0.40603959634519393, 'sideways_time_stop': 221, 'sideways_use_sma': True, 'sideways_use_ema': True, 'sideways_use_atr': False, 'sideways_use_adx': False, 'sideways_use_spike': True, 'sideways_rsi_required': True}.
[I 2025-08-31 10:02:20,543] Trial 323 finished with values: [-1000000000.0, 1000000000.0] and parameters: {'p_sma': 46, 'p_std': 17, 'p_atr': 28, 'p_adx': 8, 'rsi_period': 58, 'ema1': 14, 'ema2': 60, 'slip_atr_k': 0.15795201084121213, 'slip_spread_k': 0.4246245551837179, 'spread_hl_frac': 0.015480034220161384, 'bb_std_mult': 1.052405956892026, 'rsi_os': 40, 'rsi_ob': 86, 'vol_spike': 0.06194065145047478, 'adx_thresh': 6.140609202070172, 'atr_min_pct': 0.005978714262683465, 'atr_max_pct': 0.1347843591413123, 'tp_mult': 1.8527993945663723, 'tsl_mult': 0.05873234336332857, 'strategy': 'mean_reversion', 'time_stop': 137, 'use_sma': False, 'use_atr': True, 'use_adx': False, 'use_ema': True, 'use_spike': False, 'rsi_required': False, 'edge_k': 0.9848010339580279, 'edge_cap': 0.5714390359482225, 'bull_strategy': 'mean_reversion', 'bull_bb_std_mult': 1.6502778733734131, 'bull_rsi_os': 29, 'bull_rsi_ob': 90, 'bull_adx_thresh': 21.450488716659276, 'bull_atr_min_pct': 0.014626396093024477, 'bull_atr_max_pct': 0.12421025129086881, 'bull_tp_mult': 2.219134543606304, 'bull_tsl_mult': 0.21994426261514333, 'bull_time_stop': 68, 'bull_use_sma': True, 'bull_use_ema': True, 'bull_use_atr': False, 'bull_use_adx': False, 'bull_use_spike': False, 'bull_rsi_required': True, 'bear_strategy': 'breakout', 'bear_bb_std_mult': 3.2947144042652736, 'bear_rsi_os': 54, 'bear_rsi_ob': 74, 'bear_adx_thresh': 22.091967827103723, 'bear_atr_min_pct': 0.020442204160836162, 'bear_atr_max_pct': 0.07695504056619366, 'bear_tp_mult': 2.665715762844828, 'bear_tsl_mult': 0.49253971791921075, 'bear_time_stop': 25, 'bear_use_sma': True, 'bear_use_ema': False, 'bear_use_atr': False, 'bear_use_adx': False, 'bear_use_spike': True, 'bear_rsi_required': False, 'sideways_strategy': 'mean_reversion', 'sideways_bb_std_mult': 0.966146172394204, 'sideways_rsi_os': 7, 'sideways_rsi_ob': 83, 'sideways_adx_thresh': 31.097898251562896, 'sideways_atr_min_pct': 0.0018142413093347413, 'sideways_atr_max_pct': 0.1308172631030575, 'sideways_tp_mult': 1.542630141172106, 'sideways_tsl_mult': 0.054351337219421834, 'sideways_time_stop': 225, 'sideways_use_sma': True, 'sideways_use_ema': True, 'sideways_use_atr': False, 'sideways_use_adx': False, 'sideways_use_spike': True, 'sideways_rsi_required': True}.
