[I 2025-08-31 09:25:12,785] Trial 42 finished with values: [-0.03889187748401124, 0.03874885452139073] and parameters: {'p_sma': 28, 'p_std': 55, 'p_atr': 29, 'p_adx': 10, 'rsi_period': 16, 'ema1': 17, 'ema2': 17, 'slip_atr_k': 0.02634084598924036, 'slip_spread_k': 0.8518940786166862, 'spread_hl_frac': 0.000119486375735036, 'bb_std_mult': 2.634876509871857, 'rsi_os': 27, 'rsi_ob': 51, 'vol_spike': 0.2169561619136488, 'adx_thresh': 24.651533983564253, 'atr_min_pct': 0.014851671968976613, 'atr_max_pct': 0.07422818861758866, 'tp_mult': 2.6332337071560836, 'tsl_mult': 0.11142616059847976, 'strategy': 'mean_reversion', 'time_stop': 218, 'use_sma': False, 'use_atr': True, 'use_adx': False, 'use_ema': True, 'use_spike': True, 'rsi_required': True, 'edge_k': 1.767464920535427, 'edge_cap': 0.9218835544489609, 'bull_strategy': 'mean_reversion', 'bull_bb_std_mult': 3.512623220538543, 'bull_rsi_os': 26, 'bull_rsi_ob': 80, 'bull_adx_thresh': 31.994102082331366, 'bull_atr_min_pct': 0.028253466346422233, 'bull_atr_max_pct': 0.026051448515512943, 'bull_tp_mult': 2.0803586007279518, 'bull_tsl_mult': 0.5746570391544631, 'bull_time_stop': 268, 'bull_use_sma': True, 'bull_use_ema': True, 'bull_use_atr': True, 'bull_use_adx': False, 'bull_use_spike': False, 'bull_rsi_required': False, 'bear_strategy': 'breakout', 'bear_bb_std_mult': 1.3562349104450744, 'bear_rsi_os': 51, 'bear_rsi_ob': 79, 'bear_adx_thresh': 24.573390645708955, 'bear_atr_min_pct': 0.016236426063174852, 'bear_atr_max_pct': 0.12739242290819525, 'bear_tp_mult': 2.7449863407105966, 'bear_tsl_mult': 0.9965351679213916, 'bear_time_stop': 113, 'bear_use_sma': False, 'bear_use_ema': False, 'bear_use_atr': True, 'bear_use_adx': True, 'bear_use_spike': True, 'bear_rsi_required': False, 'sideways_strategy': 'breakout', 'sideways_bb_std_mult': 1.4767317868935654, 'sideways_rsi_os': 48, 'sideways_rsi_ob': 82, 'sideways_adx_thresh': 10.473114226215419, 'sideways_atr_min_pct': 0.0017605964469232863, 'sideways_atr_max_pct': 0.03283528959625739, 'sideways_tp_mult': 1.6230539012965879, 'sideways_tsl_mult': 0.49489917976474074, 'sideways_time_stop': 44, 'sideways_use_sma': False, 'sideways_use_ema': False, 'sideways_use_atr': False, 'sideways_use_adx': False, 'sideways_use_spike': True, 'sideways_rsi_required': False}.
[I 2025-08-31 09:25:13,128] Trial 48 finished with values: [-1000000000.0, 1000000000.0] and parameters: {'p_sma': 33, 'p_std': 47, 'p_atr': 28, 'p_adx': 8, 'rsi_period': 15, 'ema1': 11, 'ema2': 16, 'slip_atr_k': 0.07271852994418979, 'slip_spread_k': 0.7692980225005814, 'spread_hl_frac': 0.004654659877087095, 'bb_std_mult': 2.5403108103994736, 'rsi_os': 19, 'rsi_ob': 49, 'vol_spike': 0.14056407501795737, 'adx_thresh': 18.21423908413869, 'atr_min_pct': 0.017275996409958146, 'atr_max_pct': 0.06353337168172057, 'tp_mult': 2.1390819561367045, 'tsl_mult': 0.07150316470534214, 'strategy': 'mean_reversion', 'time_stop': 216, 'use_sma': False, 'use_atr': True, 'use_adx': False, 'use_ema': True, 'use_spike': True, 'rsi_required': True, 'edge_k': 1.708007105632356, 'edge_cap': 0.1832651619396571, 'bull_strategy': 'mean_reversion', 'bull_bb_std_mult': 3.3853577940559196, 'bull_rsi_os': 27, 'bull_rsi_ob': 82, 'bull_adx_thresh': 22.53766773109367, 'bull_atr_min_pct': 0.028188509753925523, 'bull_atr_max_pct': 0.028418758665336233, 'bull_tp_mult': 1.9795697376570636, 'bull_tsl_mult': 0.6587924521636581, 'bull_time_stop': 284, 'bull_use_sma': True, 'bull_use_ema': True, 'bull_use_atr': True, 'bull_use_adx': False, 'bull_use_spike': False, 'bull_rsi_required': False, 'bear_strategy': 'breakout', 'bear_bb_std_mult': 1.8056516021139393, 'bear_rsi_os': 46, 'bear_rsi_ob': 88, 'bear_adx_thresh': 26.312607859817625, 'bear_atr_min_pct': 0.012213518139278935, 'bear_atr_max_pct': 0.12857087641885453, 'bear_tp_mult': 2.5102735887562235, 'bear_tsl_mult': 0.918111990971841, 'bear_time_stop': 69, 'bear_use_sma': False, 'bear_use_ema': False, 'bear_use_atr': True, 'bear_use_adx': True, 'bear_use_spike': True, 'bear_rsi_required': False, 'sideways_strategy': 'breakout', 'sideways_bb_std_mult': 1.6423640079924955, 'sideways_rsi_os': 47, 'sideways_rsi_ob': 90, 'sideways_adx_thresh': 11.06222465314601, 'sideways_atr_min_pct': 0.00018597435142974315, 'sideways_atr_max_pct': 0.02452247156130117, 'sideways_tp_mult': 1.730263751117098, 'sideways_tsl_mult': 0.6285677120969885, 'sideways_time_stop': 48, 'sideways_use_sma': False, 'sideways_use_ema': False, 'sideways_use_atr': False, 'sideways_use_adx': False, 'sideways_use_spike': True, 'sideways_rsi_required': False}.
[I 2025-08-31 09:25:13,156] Trial 49 finished with values: [-1000000000.0, 1000000000.0] and parameters: {'p_sma': 35, 'p_std': 51, 'p_atr': 28, 'p_adx': 17, 'rsi_period': 17, 'ema1': 12, 'ema2': 15, 'slip_atr_k': 0.018177820938712702, 'slip_spread_k': 0.8923909416393397, 'spread_hl_frac': 0.0001425584633435329, 'bb_std_mult': 2.537949916665675, 'rsi_os': 19, 'rsi_ob': 48, 'vol_spike': 0.22473249415674873, 'adx_thresh': 27.346273249804636, 'atr_min_pct': 0.01744476660641034, 'atr_max_pct': 0.08056969801984971, 'tp_mult': 2.187174589871079, 'tsl_mult': 0.07157110611667973, 'strategy': 'mean_reversion', 'time_stop': 217, 'use_sma': False, 'use_atr': True, 'use_adx': False, 'use_ema': True, 'use_spike': True, 'rsi_required': True, 'edge_k': 1.7446988019692997, 'edge_cap': 0.9311785071602133, 'bull_strategy': 'mean_reversion', 'bull_bb_std_mult': 3.3819825717342664, 'bull_rsi_os': 26, 'bull_rsi_ob': 81, 'bull_adx_thresh': 30.03682615112631, 'bull_atr_min_pct': 0.024771687083254702, 'bull_atr_max_pct': 0.03252824041479005, 'bull_tp_mult': 1.7476942696047146, 'bull_tsl_mult': 0.6924447721510871, 'bull_time_stop': 281, 'bull_use_sma': True, 'bull_use_ema': True, 'bull_use_atr': True, 'bull_use_adx': False, 'bull_use_spike': False, 'bull_rsi_required': False, 'bear_strategy': 'breakout', 'bear_bb_std_mult': 1.8468170148371004, 'bear_rsi_os': 47, 'bear_rsi_ob': 86, 'bear_adx_thresh': 25.966101067293373, 'bear_atr_min_pct': 0.012119902862766685, 'bear_atr_max_pct': 0.12265116603893879, 'bear_tp_mult': 2.518854106450882, 'bear_tsl_mult': 0.8838050827953964, 'bear_time_stop': 72, 'bear_use_sma': False, 'bear_use_ema': False, 'bear_use_atr': True, 'bear_use_adx': True, 'bear_use_spike': True, 'bear_rsi_required': False, 'sideways_strategy': 'breakout', 'sideways_bb_std_mult': 1.6134643953067176, 'sideways_rsi_os': 46, 'sideways_rsi_ob': 91, 'sideways_adx_thresh': 11.151362106298643, 'sideways_atr_min_pct': 0.007035498841277902, 'sideways_atr_max_pct': 0.023359639268890363, 'sideways_tp_mult': 1.5318767927813415, 'sideways_tsl_mult': 0.628313212178773, 'sideways_time_stop': 31, 'sideways_use_sma': False, 'sideways_use_ema': False, 'sideways_use_atr': False, 'sideways_use_adx': False, 'sideways_use_spike': True, 'sideways_rsi_required': False}.
[I 2025-08-31 09:25:47,232] Trial 47 finished with values: [-1000000000.0, 1000000000.0] and parameters: {'p_sma': 35, 'p_std': 48, 'p_atr': 28, 'p_adx': 9, 'rsi_period': 15, 'ema1': 22, 'ema2': 17, 'slip_atr_k': 0.02704870951369927, 'slip_spread_k': 0.769311478163737, 'spread_hl_frac': 0.006580785680917745, 'bb_std_mult': 2.8498571302915154, 'rsi_os': 28, 'rsi_ob': 56, 'vol_spike': 0.1972183021262291, 'adx_thresh': 21.92400927291635, 'atr_min_pct': 0.017558132421909806, 'atr_max_pct': 0.05965871414794681, 'tp_mult': 2.619384874702565, 'tsl_mult': 0.08063595922551897, 'strategy': 'mean_reversion', 'time_stop': 218, 'use_sma': False, 'use_atr': True, 'use_adx': False, 'use_ema': True, 'use_spike': True, 'rsi_required': True, 'edge_k': 1.7103167719942567, 'edge_cap': 0.41371467134704704, 'bull_strategy': 'mean_reversion', 'bull_bb_std_mult': 3.316668281689542, 'bull_rsi_os': 27, 'bull_rsi_ob': 64, 'bull_adx_thresh': 28.99047304569183, 'bull_atr_min_pct': 0.027702855875871776, 'bull_atr_max_pct': 0.02561324594921985, 'bull_tp_mult': 1.948920862450949, 'bull_tsl_mult': 0.42518760722061644, 'bull_time_stop': 282, 'bull_use_sma': True, 'bull_use_ema': True, 'bull_use_atr': True, 'bull_use_adx': False, 'bull_use_spike': False, 'bull_rsi_required': False, 'bear_strategy': 'breakout', 'bear_bb_std_mult': 1.3774176217583836, 'bear_rsi_os': 48, 'bear_rsi_ob': 87, 'bear_adx_thresh': 21.70975303609586, 'bear_atr_min_pct': 0.011742313937132908, 'bear_atr_max_pct': 0.14168312581634626, 'bear_tp_mult': 2.749905665316154, 'bear_tsl_mult': 0.905340919958733, 'bear_time_stop': 84, 'bear_use_sma': False, 'bear_use_ema': False, 'bear_use_atr': True, 'bear_use_adx': True, 'bear_use_spike': True, 'bear_rsi_required': False, 'sideways_strategy': 'breakout', 'sideways_bb_std_mult': 1.6746636892331217, 'sideways_rsi_os': 47, 'sideways_rsi_ob': 90, 'sideways_adx_thresh': 10.749979747487997, 'sideways_atr_min_pct': 0.003586077161799407, 'sideways_atr_max_pct': 0.03329091256238996, 'sideways_tp_mult': 1.860993620191353, 'sideways_tsl_mult': 0.6245568075563427, 'sideways_time_stop': 45, 'sideways_use_sma': False, 'sideways_use_ema': False, 'sideways_use_atr': False, 'sideways_use_adx': False, 'sideways_use_spike': True, 'sideways_rsi_required': False}.
[I 2025-08-31 09:25:48,136] Trial 46 finished with values: [-0.18508836182168986, 0.18500955313604192] and parameters: {'p_sma': 26, 'p_std': 47, 'p_atr': 28, 'p_adx': 9, 'rsi_period': 14, 'ema1': 16, 'ema2': 17, 'slip_atr_k': 0.025407724094826112, 'slip_spread_k': 0.7881144285072221, 'spread_hl_frac': 0.006459925954990873, 'bb_std_mult': 2.152589736421016, 'rsi_os': 26, 'rsi_ob': 54, 'vol_spike': 0.18766469310817063, 'adx_thresh': 21.587260556785893, 'atr_min_pct': 0.01799454345554894, 'atr_max_pct': 0.06044041466682064, 'tp_mult': 1.8270719507646354, 'tsl_mult': 0.09497387417911606, 'strategy': 'mean_reversion', 'time_stop': 215, 'use_sma': False, 'use_atr': True, 'use_adx': False, 'use_ema': True, 'use_spike': True, 'rsi_required': True, 'edge_k': 1.6802753360350833, 'edge_cap': 0.3732819418661396, 'bull_strategy': 'mean_reversion', 'bull_bb_std_mult': 3.2908035954178887, 'bull_rsi_os': 26, 'bull_rsi_ob': 81, 'bull_adx_thresh': 21.996436816240035, 'bull_atr_min_pct': 0.02811822540845862, 'bull_atr_max_pct': 0.02683681230794437, 'bull_tp_mult': 2.0184887630318156, 'bull_tsl_mult': 0.43478002068439553, 'bull_time_stop': 278, 'bull_use_sma': True, 'bull_use_ema': True, 'bull_use_atr': True, 'bull_use_adx': False, 'bull_use_spike': False, 'bull_rsi_required': False, 'bear_strategy': 'breakout', 'bear_bb_std_mult': 1.3883674614437909, 'bear_rsi_os': 50, 'bear_rsi_ob': 79, 'bear_adx_thresh': 24.227275429945195, 'bear_atr_min_pct': 0.015710814278520793, 'bear_atr_max_pct': 0.14474939342810486, 'bear_tp_mult': 2.7437121829014552, 'bear_tsl_mult': 0.9140649806824265, 'bear_time_stop': 85, 'bear_use_sma': False, 'bear_use_ema': False, 'bear_use_atr': True, 'bear_use_adx': True, 'bear_use_spike': True, 'bear_rsi_required': False, 'sideways_strategy': 'breakout', 'sideways_bb_std_mult': 1.269219962455579, 'sideways_rsi_os': 49, 'sideways_rsi_ob': 90, 'sideways_adx_thresh': 11.161683547856946, 'sideways_atr_min_pct': 4.660692987235894e-05, 'sideways_atr_max_pct': 0.03617873021003005, 'sideways_tp_mult': 1.8782730388798239, 'sideways_tsl_mult': 0.48262742580783224, 'sideways_time_stop': 41, 'sideways_use_sma': False, 'sideways_use_ema': False, 'sideways_use_atr': False, 'sideways_use_adx': False, 'sideways_use_spike': True, 'sideways_rsi_required': False}.
[I 2025-08-31 09:25:48,842] Trial 50 finished with values: [-1000000000.0, 1000000000.0] and parameters: {'p_sma': 22, 'p_std': 53, 'p_atr': 28, 'p_adx': 21, 'rsi_period': 11, 'ema1': 12, 'ema2': 15, 'slip_atr_k': 0.021463114590279907, 'slip_spread_k': 0.9127639115619939, 'spread_hl_frac': 7.944648376263669e-05, 'bb_std_mult': 2.805224278264884, 'rsi_os': 25, 'rsi_ob': 55, 'vol_spike': 0.22490231755635695, 'adx_thresh': 27.381560413123744, 'atr_min_pct': 0.0104879910777647, 'atr_max_pct': 0.0787760210092707, 'tp_mult': 2.9684406638931673, 'tsl_mult': 0.13630416726802164, 'strategy': 'mean_reversion', 'time_stop': 237, 'use_sma': False, 'use_atr': True, 'use_adx': False, 'use_ema': True, 'use_spike': True, 'rsi_required': True, 'edge_k': 1.8152841684029692, 'edge_cap': 0.9143166506065575, 'bull_strategy': 'mean_reversion', 'bull_bb_std_mult': 1.7744821765028238, 'bull_rsi_os': 20, 'bull_rsi_ob': 75, 'bull_adx_thresh': 30.496566831522955, 'bull_atr_min_pct': 0.02389035816490266, 'bull_atr_max_pct': 0.022660307558158344, 'bull_tp_mult': 1.755776590149477, 'bull_tsl_mult': 0.6887295293489224, 'bull_time_stop': 221, 'bull_use_sma': True, 'bull_use_ema': True, 'bull_use_atr': True, 'bull_use_adx': False, 'bull_use_spike': False, 'bull_rsi_required': False, 'bear_strategy': 'breakout', 'bear_bb_std_mult': 1.1170480098169453, 'bear_rsi_os': 50, 'bear_rsi_ob': 76, 'bear_adx_thresh': 25.81536031249982, 'bear_atr_min_pct': 0.014259922036592758, 'bear_atr_max_pct': 0.12490868042503094, 'bear_tp_mult': 2.7156845569033266, 'bear_tsl_mult': 0.9936944817157558, 'bear_time_stop': 92, 'bear_use_sma': False, 'bear_use_ema': False, 'bear_use_atr': True, 'bear_use_adx': True, 'bear_use_spike': True, 'bear_rsi_required': False, 'sideways_strategy': 'breakout', 'sideways_bb_std_mult': 1.0418488048091616, 'sideways_rsi_os': 51, 'sideways_rsi_ob': 90, 'sideways_adx_thresh': 14.60843111407145, 'sideways_atr_min_pct': 0.0063921955920315104, 'sideways_atr_max_pct': 0.08425636040849574, 'sideways_tp_mult': 1.914979457873687, 'sideways_tsl_mult': 0.6358787262594858, 'sideways_time_stop': 29, 'sideways_use_sma': False, 'sideways_use_ema': False, 'sideways_use_atr': False, 'sideways_use_adx': False, 'sideways_use_spike': True, 'sideways_rsi_required': False}.
[I 2025-08-31 09:25:49,008] Trial 51 finished with values: [-1000000000.0, 1000000000.0] and parameters: {'p_sma': 21, 'p_std': 53, 'p_atr': 29, 'p_adx': 21, 'rsi_period': 11, 'ema1': 19, 'ema2': 21, 'slip_atr_k': 0.04050346545206218, 'slip_spread_k': 0.95857673055856, 'spread_hl_frac': 0.0040200650608723885, 'bb_std_mult': 1.245728997560467, 'rsi_os': 25, 'rsi_ob': 55, 'vol_spike': 0.18922102405399774, 'adx_thresh': 22.317292187329148, 'atr_min_pct': 0.010830446665244617, 'atr_max_pct': 0.07672853016706006, 'tp_mult': 2.9998628031978996, 'tsl_mult': 0.14474011234129758, 'strategy': 'mean_reversion', 'time_stop': 232, 'use_sma': False, 'use_atr': True, 'use_adx': False, 'use_ema': True, 'use_spike': True, 'rsi_required': True, 'edge_k': 1.5267585853977494, 'edge_cap': 0.9309134697001334, 'bull_strategy': 'mean_reversion', 'bull_bb_std_mult': 1.878457678446782, 'bull_rsi_os': 19, 'bull_rsi_ob': 74, 'bull_adx_thresh': 28.057691322067, 'bull_atr_min_pct': 0.02456583523578845, 'bull_atr_max_pct': 0.021511703945606808, 'bull_tp_mult': 2.5170677510756163, 'bull_tsl_mult': 0.5563735111060495, 'bull_time_stop': 228, 'bull_use_sma': True, 'bull_use_ema': True, 'bull_use_atr': True, 'bull_use_adx': False, 'bull_use_spike': False, 'bull_rsi_required': False, 'bear_strategy': 'breakout', 'bear_bb_std_mult': 1.1380012855722772, 'bear_rsi_os': 50, 'bear_rsi_ob': 76, 'bear_adx_thresh': 20.771109929783403, 'bear_atr_min_pct': 0.018534961944165495, 'bear_atr_max_pct': 0.14261721567951388, 'bear_tp_mult': 2.730670851424199, 'bear_tsl_mult': 0.9972387723581982, 'bear_time_stop': 98, 'bear_use_sma': False, 'bear_use_ema': False, 'bear_use_atr': True, 'bear_use_adx': True, 'bear_use_spike': True, 'bear_rsi_required': False, 'sideways_strategy': 'breakout', 'sideways_bb_std_mult': 1.433519201993089, 'sideways_rsi_os': 52, 'sideways_rsi_ob': 82, 'sideways_adx_thresh': 8.349069170830106, 'sideways_atr_min_pct': 0.016383040858371237, 'sideways_atr_max_pct': 0.0301015258063752, 'sideways_tp_mult': 1.92827775666732, 'sideways_tsl_mult': 0.5838001553926302, 'sideways_time_stop': 52, 'sideways_use_sma': False, 'sideways_use_ema': False, 'sideways_use_atr': False, 'sideways_use_adx': False, 'sideways_use_spike': True, 'sideways_rsi_required': False}.
[I 2025-08-31 09:26:25,312] Trial 55 finished with values: [-0.0408952195115444, 0.04074690133060365] and parameters: {'p_sma': 31, 'p_std': 58, 'p_atr': 26, 'p_adx': 15, 'rsi_period': 24, 'ema1': 18, 'ema2': 19, 'slip_atr_k': 0.04881197027620025, 'slip_spread_k': 0.7916972231155672, 'spread_hl_frac': 0.00340970490961211, 'bb_std_mult': 3.1542562721475607, 'rsi_os': 31, 'rsi_ob': 52, 'vol_spike': 0.2565744106637623, 'adx_thresh': 24.094820725496195, 'atr_min_pct': 0.013941928508790682, 'atr_max_pct': 0.07043496336678925, 'tp_mult': 2.785288142083573, 'tsl_mult': 0.2405651467303236, 'strategy': 'mean_reversion', 'time_stop': 185, 'use_sma': False, 'use_atr': True, 'use_adx': False, 'use_ema': True, 'use_spike': True, 'rsi_required': True, 'edge_k': 1.647104932257881, 'edge_cap': 0.9474374432255046, 'bull_strategy': 'mean_reversion', 'bull_bb_std_mult': 3.1046143996002633, 'bull_rsi_os': 34, 'bull_rsi_ob': 77, 'bull_adx_thresh': 33.6809656982695, 'bull_atr_min_pct': 0.02741872410362421, 'bull_atr_max_pct': 0.047789819408451, 'bull_tp_mult': 2.3314106788069804, 'bull_tsl_mult': 0.4888584018030362, 'bull_time_stop': 251, 'bull_use_sma': True, 'bull_use_ema': True, 'bull_use_atr': True, 'bull_use_adx': False, 'bull_use_spike': False, 'bull_rsi_required': False, 'bear_strategy': 'breakout', 'bear_bb_std_mult': 0.7285757146496179, 'bear_rsi_os': 26, 'bear_rsi_ob': 91, 'bear_adx_thresh': 19.155244169324963, 'bear_atr_min_pct': 0.02245213946351066, 'bear_atr_max_pct': 0.10981631859315298, 'bear_tp_mult': 2.852966204949957, 'bear_tsl_mult': 0.9427750936113548, 'bear_time_stop': 126, 'bear_use_sma': False, 'bear_use_ema': False, 'bear_use_atr': True, 'bear_use_adx': True, 'bear_use_spike': True, 'bear_rsi_required': False, 'sideways_strategy': 'breakout', 'sideways_bb_std_mult': 1.8909134174285975, 'sideways_rsi_os': 43, 'sideways_rsi_ob': 83, 'sideways_adx_thresh': 9.264820996499594, 'sideways_atr_min_pct': 0.001774737740098511, 'sideways_atr_max_pct': 0.044453417375374976, 'sideways_tp_mult': 1.761401216997022, 'sideways_tsl_mult': 0.4470471567966285, 'sideways_time_stop': 23, 'sideways_use_sma': False, 'sideways_use_ema': False, 'sideways_use_atr': False, 'sideways_use_adx': False, 'sideways_use_spike': True, 'sideways_rsi_required': False}.
[I 2025-08-31 09:26:25,488] Trial 53 finished with values: [-1000000000.0, 1000000000.0] and parameters: {'p_sma': 21, 'p_std': 53, 'p_atr': 29, 'p_adx': 14, 'rsi_period': 7, 'ema1': 18, 'ema2': 21, 'slip_atr_k': 0.04083329811136545, 'slip_spread_k': 0.9614630265232126, 'spread_hl_frac': 0.0034996457697283904, 'bb_std_mult': 2.2047905731306088, 'rsi_os': 25, 'rsi_ob': 53, 'vol_spike': 0.25794634543503847, 'adx_thresh': 24.46135694962572, 'atr_min_pct': 0.011062291616083502, 'atr_max_pct': 0.08003100903045783, 'tp_mult': 2.7782144429108637, 'tsl_mult': 0.1444228687238236, 'strategy': 'mean_reversion', 'time_stop': 239, 'use_sma': False, 'use_atr': True, 'use_adx': False, 'use_ema': True, 'use_spike': True, 'rsi_required': True, 'edge_k': 1.533599212449806, 'edge_cap': 0.9214107935409621, 'bull_strategy': 'mean_reversion', 'bull_bb_std_mult': 3.128609268070762, 'bull_rsi_os': 20, 'bull_rsi_ob': 84, 'bull_adx_thresh': 30.563274827410243, 'bull_atr_min_pct': 0.02447938740097332, 'bull_atr_max_pct': 0.04730681080064938, 'bull_tp_mult': 2.4701374413211754, 'bull_tsl_mult': 0.2939383583132994, 'bull_time_stop': 251, 'bull_use_sma': True, 'bull_use_ema': True, 'bull_use_atr': True, 'bull_use_adx': False, 'bull_use_spike': False, 'bull_rsi_required': False, 'bear_strategy': 'breakout', 'bear_bb_std_mult': 1.1032591236875369, 'bear_rsi_os': 50, 'bear_rsi_ob': 91, 'bear_adx_thresh': 25.24896305475523, 'bear_atr_min_pct': 0.014306988236959164, 'bear_atr_max_pct': 0.11253374934021447, 'bear_tp_mult': 2.8203689853758886, 'bear_tsl_mult': 0.9449024481723486, 'bear_time_stop': 103, 'bear_use_sma': False, 'bear_use_ema': False, 'bear_use_atr': True, 'bear_use_adx': True, 'bear_use_spike': True, 'bear_rsi_required': False, 'sideways_strategy': 'breakout', 'sideways_bb_std_mult': 1.9449901789072044, 'sideways_rsi_os': 52, 'sideways_rsi_ob': 83, 'sideways_adx_thresh': 14.774588740599548, 'sideways_atr_min_pct': 0.010402546482679496, 'sideways_atr_max_pct': 0.04318891346733339, 'sideways_tp_mult': 2.193862217561896, 'sideways_tsl_mult': 0.4479176696475786, 'sideways_time_stop': 5, 'sideways_use_sma': False, 'sideways_use_ema': False, 'sideways_use_atr': False, 'sideways_use_adx': False, 'sideways_use_spike': True, 'sideways_rsi_required': False}.
