[I 2025-08-31 09:29:34,374] Trial 83 finished with values: [-1000000000.0, 1000000000.0] and parameters: {'p_sma': 28, 'p_std': 41, 'p_atr': 27, 'p_adx': 19, 'rsi_period': 77, 'ema1': 13, 'ema2': 16, 'slip_atr_k': 0.05242082267761328, 'slip_spread_k': 0.5180355891400987, 'spread_hl_frac': 0.010873555956742727, 'bb_std_mult': 2.620638468649622, 'rsi_os': 32, 'rsi_ob': 46, 'vol_spike': 0.021777325233887423, 'adx_thresh': 15.700223989755425, 'atr_min_pct': 0.015126949048624508, 'atr_max_pct': 0.0889202647368563, 'tp_mult': 2.084400059943216, 'tsl_mult': 0.24169838536937532, 'strategy': 'mean_reversion', 'time_stop': 287, 'use_sma': False, 'use_atr': False, 'use_adx': True, 'use_ema': True, 'use_spike': True, 'rsi_required': False, 'edge_k': 0.4266335474606915, 'edge_cap': 0.8564378655764835, 'bull_strategy': 'mean_reversion', 'bull_bb_std_mult': 0.9745542352521233, 'bull_rsi_os': 33, 'bull_rsi_ob': 56, 'bull_adx_thresh': 27.281663667559933, 'bull_atr_min_pct': 0.012351930341306367, 'bull_atr_max_pct': 0.13237105199324362, 'bull_tp_mult': 2.3434349749497363, 'bull_tsl_mult': 0.811571430340972, 'bull_time_stop': 58, 'bull_use_sma': False, 'bull_use_ema': True, 'bull_use_atr': True, 'bull_use_adx': True, 'bull_use_spike': True, 'bull_rsi_required': False, 'bear_strategy': 'mean_reversion', 'bear_bb_std_mult': 0.994098464984341, 'bear_rsi_os': 38, 'bear_rsi_ob': 72, 'bear_adx_thresh': 32.197952038426635, 'bear_atr_min_pct': 0.024426453293951225, 'bear_atr_max_pct': 0.1396148642800948, 'bear_tp_mult': 2.5901369305138755, 'bear_tsl_mult': 0.4530224308547375, 'bear_time_stop': 110, 'bear_use_sma': False, 'bear_use_ema': True, 'bear_use_atr': False, 'bear_use_adx': True, 'bear_use_spike': False, 'bear_rsi_required': True, 'sideways_strategy': 'breakout', 'sideways_bb_std_mult': 1.286068336041375, 'sideways_rsi_os': 14, 'sideways_rsi_ob': 82, 'sideways_adx_thresh': 21.65803709614743, 'sideways_atr_min_pct': 0.0008754676786954835, 'sideways_atr_max_pct': 0.11668071602262478, 'sideways_tp_mult': 1.4091137358666506, 'sideways_tsl_mult': 0.7442382498374899, 'sideways_time_stop': 60, 'sideways_use_sma': True, 'sideways_use_ema': False, 'sideways_use_atr': True, 'sideways_use_adx': False, 'sideways_use_spike': False, 'sideways_rsi_required': False}.
[I 2025-08-31 09:29:34,443] Trial 82 finished with values: [-1000000000.0, 1000000000.0] and parameters: {'p_sma': 23, 'p_std': 49, 'p_atr': 21, 'p_adx': 10, 'rsi_period': 16, 'ema1': 17, 'ema2': 19, 'slip_atr_k': 0.03517715086848952, 'slip_spread_k': 0.15381904588989442, 'spread_hl_frac': 0.010329369731273236, 'bb_std_mult': 2.606240027364819, 'rsi_os': 32, 'rsi_ob': 46, 'vol_spike': 0.01501101107166844, 'adx_thresh': 25.610203803479045, 'atr_min_pct': 0.029609172503307888, 'atr_max_pct': 0.13121961960042333, 'tp_mult': 2.0673697693556097, 'tsl_mult': 0.19322925894671877, 'strategy': 'mean_reversion', 'time_stop': 162, 'use_sma': False, 'use_atr': False, 'use_adx': True, 'use_ema': True, 'use_spike': True, 'rsi_required': False, 'edge_k': 0.4707137636902743, 'edge_cap': 0.34052509622575755, 'bull_strategy': 'mean_reversion', 'bull_bb_std_mult': 1.0037184710004985, 'bull_rsi_os': 32, 'bull_rsi_ob': 67, 'bull_adx_thresh': 22.528394308105216, 'bull_atr_min_pct': 0.02993222517658036, 'bull_atr_max_pct': 0.12964501605082368, 'bull_tp_mult': 1.7985842648571069, 'bull_tsl_mult': 0.06687210370628172, 'bull_time_stop': 264, 'bull_use_sma': True, 'bull_use_ema': True, 'bull_use_atr': False, 'bull_use_adx': False, 'bull_use_spike': False, 'bull_rsi_required': False, 'bear_strategy': 'breakout', 'bear_bb_std_mult': 3.4126072009697164, 'bear_rsi_os': 37, 'bear_rsi_ob': 54, 'bear_adx_thresh': 25.346441844112952, 'bear_atr_min_pct': 0.02511179691980764, 'bear_atr_max_pct': 0.13909496275097585, 'bear_tp_mult': 1.9431530257940914, 'bear_tsl_mult': 0.9011637939790641, 'bear_time_stop': 108, 'bear_use_sma': False, 'bear_use_ema': False, 'bear_use_atr': True, 'bear_use_adx': False, 'bear_use_spike': True, 'bear_rsi_required': True, 'sideways_strategy': 'breakout', 'sideways_bb_std_mult': 1.2514305332434232, 'sideways_rsi_os': 14, 'sideways_rsi_ob': 73, 'sideways_adx_thresh': 7.948530648339675, 'sideways_atr_min_pct': 0.000701874758136929, 'sideways_atr_max_pct': 0.016765795948599834, 'sideways_tp_mult': 1.7615873818020382, 'sideways_tsl_mult': 0.31825932836103143, 'sideways_time_stop': 63, 'sideways_use_sma': False, 'sideways_use_ema': False, 'sideways_use_atr': False, 'sideways_use_adx': True, 'sideways_use_spike': True, 'sideways_rsi_required': False}.
[I 2025-08-31 09:29:34,464] Trial 81 finished with values: [-1000000000.0, 1000000000.0] and parameters: {'p_sma': 47, 'p_std': 58, 'p_atr': 21, 'p_adx': 9, 'rsi_period': 53, 'ema1': 17, 'ema2': 32, 'slip_atr_k': 0.19993280441402866, 'slip_spread_k': 0.8603797865814625, 'spread_hl_frac': 0.03668191201345879, 'bb_std_mult': 2.5977635765449176, 'rsi_os': 32, 'rsi_ob': 46, 'vol_spike': 0.246565738822095, 'adx_thresh': 34.08191684786152, 'atr_min_pct': 0.02934635012984396, 'atr_max_pct': 0.074361367834902, 'tp_mult': 2.2331939269737497, 'tsl_mult': 0.6360541051018198, 'strategy': 'mean_reversion', 'time_stop': 266, 'use_sma': False, 'use_atr': True, 'use_adx': False, 'use_ema': False, 'use_spike': True, 'rsi_required': True, 'edge_k': 0.40854444207756546, 'edge_cap': 0.8859633207973601, 'bull_strategy': 'mean_reversion', 'bull_bb_std_mult': 1.0734023883484667, 'bull_rsi_os': 33, 'bull_rsi_ob': 73, 'bull_adx_thresh': 27.074552082933877, 'bull_atr_min_pct': 0.011344234416681984, 'bull_atr_max_pct': 0.13240288121993601, 'bull_tp_mult': 1.8054289806754844, 'bull_tsl_mult': 0.4508973417220966, 'bull_time_stop': 240, 'bull_use_sma': True, 'bull_use_ema': True, 'bull_use_atr': True, 'bull_use_adx': False, 'bull_use_spike': False, 'bull_rsi_required': False, 'bear_strategy': 'breakout', 'bear_bb_std_mult': 3.3331504095326343, 'bear_rsi_os': 52, 'bear_rsi_ob': 55, 'bear_adx_thresh': 32.77162896890616, 'bear_atr_min_pct': 0.01556796377177851, 'bear_atr_max_pct': 0.13893094590823307, 'bear_tp_mult': 2.766245359369914, 'bear_tsl_mult': 0.47954043645511807, 'bear_time_stop': 76, 'bear_use_sma': True, 'bear_use_ema': False, 'bear_use_atr': True, 'bear_use_adx': True, 'bear_use_spike': True, 'bear_rsi_required': False, 'sideways_strategy': 'mean_reversion', 'sideways_bb_std_mult': 1.2540176195302972, 'sideways_rsi_os': 37, 'sideways_rsi_ob': 82, 'sideways_adx_thresh': 13.55674008247312, 'sideways_atr_min_pct': 0.02985086274853884, 'sideways_atr_max_pct': 0.11415452629431076, 'sideways_tp_mult': 1.970658264192745, 'sideways_tsl_mult': 0.7946685356484436, 'sideways_time_stop': 59, 'sideways_use_sma': False, 'sideways_use_ema': False, 'sideways_use_atr': False, 'sideways_use_adx': False, 'sideways_use_spike': True, 'sideways_rsi_required': True}.
[I 2025-08-31 09:29:34,985] Trial 86 finished with values: [-1000000000.0, 1000000000.0] and parameters: {'p_sma': 29, 'p_std': 16, 'p_atr': 28, 'p_adx': 10, 'rsi_period': 20, 'ema1': 16, 'ema2': 48, 'slip_atr_k': 0.19857844043530476, 'slip_spread_k': 0.07547930628332922, 'spread_hl_frac': 0.04254346795529086, 'bb_std_mult': 1.3631529332916905, 'rsi_os': 13, 'rsi_ob': 50, 'vol_spike': 0.2853985175353279, 'adx_thresh': 6.617986011559815, 'atr_min_pct': 0.01889631644440586, 'atr_max_pct': 0.07446834384754084, 'tp_mult': 2.653605169039043, 'tsl_mult': 0.9076863438903694, 'strategy': 'mean_reversion', 'time_stop': 265, 'use_sma': True, 'use_atr': True, 'use_adx': False, 'use_ema': True, 'use_spike': True, 'rsi_required': True, 'edge_k': 1.329518184112216, 'edge_cap': 0.8865670013237925, 'bull_strategy': 'breakout', 'bull_bb_std_mult': 0.6549574642109315, 'bull_rsi_os': 6, 'bull_rsi_ob': 76, 'bull_adx_thresh': 30.895282749334083, 'bull_atr_min_pct': 0.01921107877861188, 'bull_atr_max_pct': 0.11942333461457144, 'bull_tp_mult': 1.8157491114163442, 'bull_tsl_mult': 0.9457126179428312, 'bull_time_stop': 246, 'bull_use_sma': True, 'bull_use_ema': True, 'bull_use_atr': True, 'bull_use_adx': False, 'bull_use_spike': False, 'bull_rsi_required': False, 'bear_strategy': 'breakout', 'bear_bb_std_mult': 1.4298359929685123, 'bear_rsi_os': 51, 'bear_rsi_ob': 78, 'bear_adx_thresh': 8.997192627817723, 'bear_atr_min_pct': 0.014758555316921402, 'bear_atr_max_pct': 0.13349620276209925, 'bear_tp_mult': 2.4544584221520607, 'bear_tsl_mult': 0.9600625687436266, 'bear_time_stop': 61, 'bear_use_sma': False, 'bear_use_ema': False, 'bear_use_atr': True, 'bear_use_adx': True, 'bear_use_spike': True, 'bear_rsi_required': False, 'sideways_strategy': 'breakout', 'sideways_bb_std_mult': 2.4603834255253694, 'sideways_rsi_os': 46, 'sideways_rsi_ob': 93, 'sideways_adx_thresh': 24.046798324065872, 'sideways_atr_min_pct': 0.003052778299471925, 'sideways_atr_max_pct': 0.03453172360913563, 'sideways_tp_mult': 2.8885808756905513, 'sideways_tsl_mult': 0.3916724642568451, 'sideways_time_stop': 32, 'sideways_use_sma': False, 'sideways_use_ema': False, 'sideways_use_atr': False, 'sideways_use_adx': False, 'sideways_use_spike': True, 'sideways_rsi_required': False}.
[I 2025-08-31 09:30:10,034] Trial 84 finished with values: [-1000000000.0, 1000000000.0] and parameters: {'p_sma': 28, 'p_std': 39, 'p_atr': 27, 'p_adx': 7, 'rsi_period': 16, 'ema1': 16, 'ema2': 16, 'slip_atr_k': 0.20330712755935498, 'slip_spread_k': 0.7844932570527946, 'spread_hl_frac': 0.010862548406471901, 'bb_std_mult': 1.5896710960146365, 'rsi_os': 12, 'rsi_ob': 51, 'vol_spike': 0.24776195461298245, 'adx_thresh': 23.910586706465075, 'atr_min_pct': 0.014939412778411524, 'atr_max_pct': 0.07379024379019561, 'tp_mult': 2.4681815446748043, 'tsl_mult': 0.04864097068441088, 'strategy': 'mean_reversion', 'time_stop': 286, 'use_sma': False, 'use_atr': False, 'use_adx': True, 'use_ema': True, 'use_spike': True, 'rsi_required': False, 'edge_k': 0.5001336981257898, 'edge_cap': 0.8801728227311891, 'bull_strategy': 'mean_reversion', 'bull_bb_std_mult': 3.1488923554261286, 'bull_rsi_os': 32, 'bull_rsi_ob': 77, 'bull_adx_thresh': 21.61242716292419, 'bull_atr_min_pct': 0.029931733493365885, 'bull_atr_max_pct': 0.1311752133824589, 'bull_tp_mult': 1.8285634136716138, 'bull_tsl_mult': 0.7928788185442585, 'bull_time_stop': 263, 'bull_use_sma': True, 'bull_use_ema': True, 'bull_use_atr': True, 'bull_use_adx': False, 'bull_use_spike': True, 'bull_rsi_required': False, 'bear_strategy': 'breakout', 'bear_bb_std_mult': 1.4256794548627656, 'bear_rsi_os': 37, 'bear_rsi_ob': 54, 'bear_adx_thresh': 25.601401037671355, 'bear_atr_min_pct': 0.014569581202834902, 'bear_atr_max_pct': 0.13815593005524945, 'bear_tp_mult': 1.9384434716143664, 'bear_tsl_mult': 0.4680015765795538, 'bear_time_stop': 226, 'bear_use_sma': False, 'bear_use_ema': True, 'bear_use_atr': False, 'bear_use_adx': True, 'bear_use_spike': True, 'bear_rsi_required': True, 'sideways_strategy': 'breakout', 'sideways_bb_std_mult': 1.256547153256911, 'sideways_rsi_os': 46, 'sideways_rsi_ob': 82, 'sideways_adx_thresh': 22.06961041180145, 'sideways_atr_min_pct': 0.029718570901942982, 'sideways_atr_max_pct': 0.03508727992775096, 'sideways_tp_mult': 2.9039215356785384, 'sideways_tsl_mult': 0.3910691563226641, 'sideways_time_stop': 59, 'sideways_use_sma': True, 'sideways_use_ema': False, 'sideways_use_atr': True, 'sideways_use_adx': False, 'sideways_use_spike': True, 'sideways_rsi_required': False}.
[I 2025-08-31 09:30:11,344] Trial 85 finished with values: [-0.01887132544029302, 0.01877416187021546] and parameters: {'p_sma': 29, 'p_std': 58, 'p_atr': 20, 'p_adx': 11, 'rsi_period': 17, 'ema1': 16, 'ema2': 55, 'slip_atr_k': 0.19720889164022415, 'slip_spread_k': 0.384505756311308, 'spread_hl_frac': 0.002834378252673302, 'bb_std_mult': 1.3107024570279602, 'rsi_os': 28, 'rsi_ob': 51, 'vol_spike': 0.2494522039719952, 'adx_thresh': 24.325497840240928, 'atr_min_pct': 0.029803964543002288, 'atr_max_pct': 0.06376374056211573, 'tp_mult': 2.4736960402176016, 'tsl_mult': 0.19967214327303426, 'strategy': 'mean_reversion', 'time_stop': 214, 'use_sma': True, 'use_atr': True, 'use_adx': False, 'use_ema': True, 'use_spike': True, 'rsi_required': True, 'edge_k': 1.3643865346136799, 'edge_cap': 0.8944698525131095, 'bull_strategy': 'breakout', 'bull_bb_std_mult': 0.6729489013979677, 'bull_rsi_os': 31, 'bull_rsi_ob': 67, 'bull_adx_thresh': 31.17041433874014, 'bull_atr_min_pct': 0.019491828892882965, 'bull_atr_max_pct': 0.11845796462815507, 'bull_tp_mult': 1.8383092488924462, 'bull_tsl_mult': 0.9415426277508516, 'bull_time_stop': 242, 'bull_use_sma': True, 'bull_use_ema': True, 'bull_use_atr': True, 'bull_use_adx': False, 'bull_use_spike': False, 'bull_rsi_required': False, 'bear_strategy': 'breakout', 'bear_bb_std_mult': 2.655125081262358, 'bear_rsi_os': 51, 'bear_rsi_ob': 60, 'bear_adx_thresh': 25.224992455330977, 'bear_atr_min_pct': 0.022358046838824613, 'bear_atr_max_pct': 0.1495017325034338, 'bear_tp_mult': 1.9503979952357318, 'bear_tsl_mult': 0.8971704894470336, 'bear_time_stop': 281, 'bear_use_sma': False, 'bear_use_ema': False, 'bear_use_atr': True, 'bear_use_adx': True, 'bear_use_spike': True, 'bear_rsi_required': False, 'sideways_strategy': 'breakout', 'sideways_bb_std_mult': 2.48224646628615, 'sideways_rsi_os': 46, 'sideways_rsi_ob': 93, 'sideways_adx_thresh': 24.19916508415858, 'sideways_atr_min_pct': 0.0029473675126828105, 'sideways_atr_max_pct': 0.03421253356747099, 'sideways_tp_mult': 2.8687254122267114, 'sideways_tsl_mult': 0.6681172621444943, 'sideways_time_stop': 54, 'sideways_use_sma': False, 'sideways_use_ema': False, 'sideways_use_atr': False, 'sideways_use_adx': False, 'sideways_use_spike': True, 'sideways_rsi_required': False}.
[I 2025-08-31 09:30:11,980] Trial 87 finished with values: [-0.015215102521053847, 0.015103878647911928] and parameters: {'p_sma': 54, 'p_std': 22, 'p_atr': 28, 'p_adx': 7, 'rsi_period': 19, 'ema1': 8, 'ema2': 44, 'slip_atr_k': 0.009417278872166993, 'slip_spread_k': 0.404797777226082, 'spread_hl_frac': 0.0304536999389864, 'bb_std_mult': 2.903410594088498, 'rsi_os': 23, 'rsi_ob': 51, 'vol_spike': 0.12326558648056496, 'adx_thresh': 6.5997451741307955, 'atr_min_pct': 0.014383076675856525, 'atr_max_pct': 0.06374529107015928, 'tp_mult': 1.0738406280223676, 'tsl_mult': 0.04578628897731811, 'strategy': 'breakout', 'time_stop': 214, 'use_sma': True, 'use_atr': True, 'use_adx': False, 'use_ema': True, 'use_spike': True, 'rsi_required': True, 'edge_k': 1.6748930557678472, 'edge_cap': 0.09508685586980598, 'bull_strategy': 'breakout', 'bull_bb_std_mult': 3.5996506540937303, 'bull_rsi_os': 26, 'bull_rsi_ob': 76, 'bull_adx_thresh': 31.078055895690543, 'bull_atr_min_pct': 0.01869490945798952, 'bull_atr_max_pct': 0.11597768353529257, 'bull_tp_mult': 2.7145748458017147, 'bull_tsl_mult': 0.5775819059800645, 'bull_time_stop': 244, 'bull_use_sma': True, 'bull_use_ema': False, 'bull_use_atr': True, 'bull_use_adx': False, 'bull_use_spike': False, 'bull_rsi_required': True, 'bear_strategy': 'breakout', 'bear_bb_std_mult': 2.7100141119935293, 'bear_rsi_os': 54, 'bear_rsi_ob': 78, 'bear_adx_thresh': 18.314619930805307, 'bear_atr_min_pct': 0.022239772346775186, 'bear_atr_max_pct': 0.14659211142537118, 'bear_tp_mult': 2.501850844148505, 'bear_tsl_mult': 0.3973825811964725, 'bear_time_stop': 61, 'bear_use_sma': False, 'bear_use_ema': False, 'bear_use_atr': False, 'bear_use_adx': True, 'bear_use_spike': True, 'bear_rsi_required': False, 'sideways_strategy': 'breakout', 'sideways_bb_std_mult': 2.4356275538639203, 'sideways_rsi_os': 53, 'sideways_rsi_ob': 66, 'sideways_adx_thresh': 15.300851903512578, 'sideways_atr_min_pct': 0.002968811125052309, 'sideways_atr_max_pct': 0.0346810642107964, 'sideways_tp_mult': 1.5907041282603724, 'sideways_tsl_mult': 0.5129054079911869, 'sideways_time_stop': 30, 'sideways_use_sma': True, 'sideways_use_ema': True, 'sideways_use_atr': False, 'sideways_use_adx': False, 'sideways_use_spike': True, 'sideways_rsi_required': False}.
[I 2025-08-31 09:30:12,191] Trial 88 finished with values: [-1000000000.0, 1000000000.0] and parameters: {'p_sma': 33, 'p_std': 39, 'p_atr': 17, 'p_adx': 11, 'rsi_period': 13, 'ema1': 18, 'ema2': 18, 'slip_atr_k': 0.02922486534993317, 'slip_spread_k': 0.3999863792350439, 'spread_hl_frac': 0.0028833693374329993, 'bb_std_mult': 2.9890102926739335, 'rsi_os': 23, 'rsi_ob': 52, 'vol_spike': 0.07388619798026154, 'adx_thresh': 20.59142410642124, 'atr_min_pct': 0.014547412501330409, 'atr_max_pct': 0.0626203291141537, 'tp_mult': 2.4844172518938534, 'tsl_mult': 0.17701904922050088, 'strategy': 'breakout', 'time_stop': 216, 'use_sma': False, 'use_atr': True, 'use_adx': False, 'use_ema': True, 'use_spike': False, 'rsi_required': True, 'edge_k': 0.7281705948989763, 'edge_cap': 0.07263655032391236, 'bull_strategy': 'mean_reversion', 'bull_bb_std_mult': 2.5011733718559643, 'bull_rsi_os': 54, 'bull_rsi_ob': 88, 'bull_adx_thresh': 32.078844605419285, 'bull_atr_min_pct': 0.027789101780295245, 'bull_atr_max_pct': 0.06717986791540297, 'bull_tp_mult': 2.1739686597719814, 'bull_tsl_mult': 0.5820111071634037, 'bull_time_stop': 16, 'bull_use_sma': False, 'bull_use_ema': False, 'bull_use_atr': True, 'bull_use_adx': True, 'bull_use_spike': True, 'bull_rsi_required': True, 'bear_strategy': 'mean_reversion', 'bear_bb_std_mult': 2.6158939221487993, 'bear_rsi_os': 54, 'bear_rsi_ob': 75, 'bear_adx_thresh': 28.43800508690208, 'bear_atr_min_pct': 0.02261001471575393, 'bear_atr_max_pct': 0.12247742306087964, 'bear_tp_mult': 2.296144103912887, 'bear_tsl_mult': 0.38394509902626306, 'bear_time_stop': 159, 'bear_use_sma': False, 'bear_use_ema': True, 'bear_use_atr': False, 'bear_use_adx': True, 'bear_use_spike': False, 'bear_rsi_required': False, 'sideways_strategy': 'breakout', 'sideways_bb_std_mult': 1.7038351565400514, 'sideways_rsi_os': 52, 'sideways_rsi_ob': 84, 'sideways_adx_thresh': 5.855260591792947, 'sideways_atr_min_pct': 0.027951699855045045, 'sideways_atr_max_pct': 0.03972466740510274, 'sideways_tp_mult': 1.5943599481338213, 'sideways_tsl_mult': 0.6719862717125089, 'sideways_time_stop': 45, 'sideways_use_sma': True, 'sideways_use_ema': True, 'sideways_use_atr': True, 'sideways_use_adx': False, 'sideways_use_spike': False, 'sideways_rsi_required': False}.
[I 2025-08-31 09:30:47,235] Trial 90 finished with values: [-1000000000.0, 1000000000.0] and parameters: {'p_sma': 52, 'p_std': 56, 'p_atr': 18, 'p_adx': 13, 'rsi_period': 45, 'ema1': 11, 'ema2': 45, 'slip_atr_k': 0.21977522762082255, 'slip_spread_k': 0.35292843716338923, 'spread_hl_frac': 0.00553339354675267, 'bb_std_mult': 0.8808722115170542, 'rsi_os': 35, 'rsi_ob': 52, 'vol_spike': 0.2635675894436249, 'adx_thresh': 20.72592857551211, 'atr_min_pct': 0.027052626200129604, 'atr_max_pct': 0.04696505434034137, 'tp_mult': 2.3475205300374515, 'tsl_mult': 0.29543161472790447, 'strategy': 'breakout', 'time_stop': 204, 'use_sma': True, 'use_atr': True, 'use_adx': False, 'use_ema': True, 'use_spike': False, 'rsi_required': True, 'edge_k': 1.1737650950415437, 'edge_cap': 0.2532018582697332, 'bull_strategy': 'breakout', 'bull_bb_std_mult': 1.6617829338957386, 'bull_rsi_os': 37, 'bull_rsi_ob': 63, 'bull_adx_thresh': 25.95624545341099, 'bull_atr_min_pct': 0.01652140086666155, 'bull_atr_max_pct': 0.11347094182822534, 'bull_tp_mult': 1.7125131896822987, 'bull_tsl_mult': 0.8888862644277574, 'bull_time_stop': 161, 'bull_use_sma': False, 'bull_use_ema': False, 'bull_use_atr': False, 'bull_use_adx': True, 'bull_use_spike': False, 'bull_rsi_required': True, 'bear_strategy': 'mean_reversion', 'bear_bb_std_mult': 2.6219503466406184, 'bear_rsi_os': 8, 'bear_rsi_ob': 60, 'bear_adx_thresh': 28.387501437376283, 'bear_atr_min_pct': 0.021852255342957278, 'bear_atr_max_pct': 0.14995071513328312, 'bear_tp_mult': 2.0897831021821553, 'bear_tsl_mult': 0.38292993423349614, 'bear_time_stop': 278, 'bear_use_sma': False, 'bear_use_ema': False, 'bear_use_atr': False, 'bear_use_adx': False, 'bear_use_spike': False, 'bear_rsi_required': False, 'sideways_strategy': 'breakout', 'sideways_bb_std_mult': 2.615687702450074, 'sideways_rsi_os': 41, 'sideways_rsi_ob': 95, 'sideways_adx_thresh': 28.204849421891875, 'sideways_atr_min_pct': 0.008057289948580303, 'sideways_atr_max_pct': 0.03957065215843245, 'sideways_tp_mult': 2.8469910777249168, 'sideways_tsl_mult': 0.8372788952899333, 'sideways_time_stop': 103, 'sideways_use_sma': True, 'sideways_use_ema': True, 'sideways_use_atr': False, 'sideways_use_adx': False, 'sideways_use_spike': False, 'sideways_rsi_required': False}.
