[I 2025-08-31 11:14:15,369] Trial 873 finished with values: [-1000000000.0, 1000000000.0] and parameters: {'p_sma': 14, 'p_std': 45, 'p_atr': 29, 'p_adx': 9, 'rsi_period': 31, 'ema1': 17, 'ema2': 31, 'slip_atr_k': 0.01284809457058346, 'slip_spread_k': 0.07327548315340121, 'spread_hl_frac': 0.011572147234743759, 'bb_std_mult': 1.0290398113320078, 'rsi_os': 37, 'rsi_ob': 73, 'vol_spike': 0.28929840392331085, 'adx_thresh': 24.707229119360402, 'atr_min_pct': 0.009443143305636798, 'atr_max_pct': 0.14449909123588434, 'tp_mult': 2.3860246521596444, 'tsl_mult': 0.07790488798961714, 'strategy': 'breakout', 'time_stop': 95, 'use_sma': False, 'use_atr': False, 'use_adx': False, 'use_ema': False, 'use_spike': True, 'rsi_required': True, 'edge_k': 1.9161270784487567, 'edge_cap': 0.5939061448581042, 'bull_strategy': 'mean_reversion', 'bull_bb_std_mult': 1.2550926366304445, 'bull_rsi_os': 26, 'bull_rsi_ob': 63, 'bull_adx_thresh': 30.20756017830652, 'bull_atr_min_pct': 0.004957576254126555, 'bull_atr_max_pct': 0.08402578483643616, 'bull_tp_mult': 1.7758415473277758, 'bull_tsl_mult': 0.03862709874847259, 'bull_time_stop': 223, 'bull_use_sma': True, 'bull_use_ema': True, 'bull_use_atr': True, 'bull_use_adx': False, 'bull_use_spike': False, 'bull_rsi_required': True, 'bear_strategy': 'breakout', 'bear_bb_std_mult': 2.4702697245973635, 'bear_rsi_os': 26, 'bear_rsi_ob': 80, 'bear_adx_thresh': 25.404130162935072, 'bear_atr_min_pct': 0.005375285511029375, 'bear_atr_max_pct': 0.08087346232767453, 'bear_tp_mult': 2.025557430743052, 'bear_tsl_mult': 0.5249227035331752, 'bear_time_stop': 245, 'bear_use_sma': True, 'bear_use_ema': True, 'bear_use_atr': True, 'bear_use_adx': True, 'bear_use_spike': True, 'bear_rsi_required': True, 'sideways_strategy': 'breakout', 'sideways_bb_std_mult': 1.292069706355491, 'sideways_rsi_os': 25, 'sideways_rsi_ob': 55, 'sideways_adx_thresh': 30.453818485732818, 'sideways_atr_min_pct': 0.0014935441603557186, 'sideways_atr_max_pct': 0.10321155941662444, 'sideways_tp_mult': 2.5652024370768, 'sideways_tsl_mult': 0.6143445271226335, 'sideways_time_stop': 299, 'sideways_use_sma': False, 'sideways_use_ema': True, 'sideways_use_atr': False, 'sideways_use_adx': True, 'sideways_use_spike': False, 'sideways_rsi_required': False}.
[I 2025-08-31 11:14:15,399] Trial 874 finished with values: [-1000000000.0, 1000000000.0] and parameters: {'p_sma': 9, 'p_std': 46, 'p_atr': 22, 'p_adx': 9, 'rsi_period': 22, 'ema1': 12, 'ema2': 39, 'slip_atr_k': 0.01034894458356525, 'slip_spread_k': 0.07395753952771944, 'spread_hl_frac': 0.046100684567022904, 'bb_std_mult': 3.5985257359293517, 'rsi_os': 44, 'rsi_ob': 58, 'vol_spike': 0.29088553558235003, 'adx_thresh': 25.00377784323445, 'atr_min_pct': 0.011359025273715056, 'atr_max_pct': 0.06292909572393163, 'tp_mult': 2.9226582151841702, 'tsl_mult': 0.10731234714462008, 'strategy': 'breakout', 'time_stop': 137, 'use_sma': False, 'use_atr': False, 'use_adx': False, 'use_ema': False, 'use_spike': True, 'rsi_required': True, 'edge_k': 1.9129879828985135, 'edge_cap': 0.0897215405645298, 'bull_strategy': 'mean_reversion', 'bull_bb_std_mult': 1.6247370081744057, 'bull_rsi_os': 27, 'bull_rsi_ob': 64, 'bull_adx_thresh': 30.365460772871618, 'bull_atr_min_pct': 0.014788484124363796, 'bull_atr_max_pct': 0.14226362009733712, 'bull_tp_mult': 2.259474871600835, 'bull_tsl_mult': 0.13676197758153757, 'bull_time_stop': 109, 'bull_use_sma': True, 'bull_use_ema': True, 'bull_use_atr': True, 'bull_use_adx': False, 'bull_use_spike': False, 'bull_rsi_required': True, 'bear_strategy': 'breakout', 'bear_bb_std_mult': 2.8169070429945524, 'bear_rsi_os': 26, 'bear_rsi_ob': 78, 'bear_adx_thresh': 19.597283688585076, 'bear_atr_min_pct': 0.005241289488013525, 'bear_atr_max_pct': 0.11375236000230182, 'bear_tp_mult': 1.4331888110386757, 'bear_tsl_mult': 0.48541894482718895, 'bear_time_stop': 255, 'bear_use_sma': True, 'bear_use_ema': True, 'bear_use_atr': True, 'bear_use_adx': True, 'bear_use_spike': True, 'bear_rsi_required': True, 'sideways_strategy': 'breakout', 'sideways_bb_std_mult': 0.92282342542364, 'sideways_rsi_os': 25, 'sideways_rsi_ob': 94, 'sideways_adx_thresh': 21.78897464828229, 'sideways_atr_min_pct': 0.0025573530047462815, 'sideways_atr_max_pct': 0.11007937710523628, 'sideways_tp_mult': 2.239487583639703, 'sideways_tsl_mult': 0.11597250015367086, 'sideways_time_stop': 226, 'sideways_use_sma': False, 'sideways_use_ema': True, 'sideways_use_atr': False, 'sideways_use_adx': True, 'sideways_use_spike': False, 'sideways_rsi_required': False}.
[I 2025-08-31 11:14:15,492] Trial 875 finished with values: [-1000000000.0, 1000000000.0] and parameters: {'p_sma': 6, 'p_std': 51, 'p_atr': 16, 'p_adx': 9, 'rsi_period': 55, 'ema1': 12, 'ema2': 54, 'slip_atr_k': 0.014835559806718454, 'slip_spread_k': 0.08363687340714866, 'spread_hl_frac': 0.002444828934894668, 'bb_std_mult': 1.0531101679811328, 'rsi_os': 44, 'rsi_ob': 81, 'vol_spike': 0.1810318066400493, 'adx_thresh': 13.11273589672388, 'atr_min_pct': 0.009446483419032179, 'atr_max_pct': 0.02328972532166984, 'tp_mult': 2.384275099450908, 'tsl_mult': 0.10697260877360384, 'strategy': 'mean_reversion', 'time_stop': 137, 'use_sma': False, 'use_atr': False, 'use_adx': False, 'use_ema': False, 'use_spike': True, 'rsi_required': True, 'edge_k': 1.8995495514768257, 'edge_cap': 0.08719727161272857, 'bull_strategy': 'mean_reversion', 'bull_bb_std_mult': 1.6672489433344637, 'bull_rsi_os': 7, 'bull_rsi_ob': 67, 'bull_adx_thresh': 31.311774600607922, 'bull_atr_min_pct': 0.014673362219896643, 'bull_atr_max_pct': 0.0830478495423869, 'bull_tp_mult': 1.7704210867430996, 'bull_tsl_mult': 0.1381889319975772, 'bull_time_stop': 74, 'bull_use_sma': True, 'bull_use_ema': True, 'bull_use_atr': True, 'bull_use_adx': False, 'bull_use_spike': True, 'bull_rsi_required': True, 'bear_strategy': 'breakout', 'bear_bb_std_mult': 3.191184846173858, 'bear_rsi_os': 26, 'bear_rsi_ob': 92, 'bear_adx_thresh': 20.637107818180468, 'bear_atr_min_pct': 0.006060046948775675, 'bear_atr_max_pct': 0.10366107466908597, 'bear_tp_mult': 2.015991205715053, 'bear_tsl_mult': 0.5097391541480366, 'bear_time_stop': 255, 'bear_use_sma': True, 'bear_use_ema': True, 'bear_use_atr': False, 'bear_use_adx': True, 'bear_use_spike': True, 'bear_rsi_required': True, 'sideways_strategy': 'breakout', 'sideways_bb_std_mult': 0.9471218712671193, 'sideways_rsi_os': 25, 'sideways_rsi_ob': 93, 'sideways_adx_thresh': 30.53204183912474, 'sideways_atr_min_pct': 0.021162098606779284, 'sideways_atr_max_pct': 0.10663790830129821, 'sideways_tp_mult': 2.9373134776390852, 'sideways_tsl_mult': 0.6917438315761398, 'sideways_time_stop': 224, 'sideways_use_sma': True, 'sideways_use_ema': True, 'sideways_use_atr': True, 'sideways_use_adx': True, 'sideways_use_spike': False, 'sideways_rsi_required': False}.
[I 2025-08-31 11:14:15,613] Trial 876 finished with values: [-1000000000.0, 1000000000.0] and parameters: {'p_sma': 6, 'p_std': 51, 'p_atr': 13, 'p_adx': 9, 'rsi_period': 54, 'ema1': 12, 'ema2': 39, 'slip_atr_k': 0.1738260500550388, 'slip_spread_k': 0.07464441902529176, 'spread_hl_frac': 0.012220188113574752, 'bb_std_mult': 3.3966874566138987, 'rsi_os': 43, 'rsi_ob': 66, 'vol_spike': 0.05330057948614106, 'adx_thresh': 23.895815229060478, 'atr_min_pct': 0.009309228456441406, 'atr_max_pct': 0.02421603878021654, 'tp_mult': 2.317178854750359, 'tsl_mult': 0.7018843462951098, 'strategy': 'mean_reversion', 'time_stop': 69, 'use_sma': False, 'use_atr': True, 'use_adx': False, 'use_ema': True, 'use_spike': False, 'rsi_required': True, 'edge_k': 1.83846203479223, 'edge_cap': 0.09446900150418591, 'bull_strategy': 'mean_reversion', 'bull_bb_std_mult': 1.32810225186982, 'bull_rsi_os': 26, 'bull_rsi_ob': 80, 'bull_adx_thresh': 30.27204396140506, 'bull_atr_min_pct': 0.008285668417768044, 'bull_atr_max_pct': 0.08281622682617559, 'bull_tp_mult': 1.7026668263585067, 'bull_tsl_mult': 0.5132824051454313, 'bull_time_stop': 283, 'bull_use_sma': True, 'bull_use_ema': False, 'bull_use_atr': False, 'bull_use_adx': False, 'bull_use_spike': False, 'bull_rsi_required': True, 'bear_strategy': 'breakout', 'bear_bb_std_mult': 3.1764528870088276, 'bear_rsi_os': 10, 'bear_rsi_ob': 86, 'bear_adx_thresh': 19.581569927903264, 'bear_atr_min_pct': 0.024834628117371402, 'bear_atr_max_pct': 0.10437440648646104, 'bear_tp_mult': 1.439209757137598, 'bear_tsl_mult': 0.12294851473854912, 'bear_time_stop': 256, 'bear_use_sma': False, 'bear_use_ema': True, 'bear_use_atr': False, 'bear_use_adx': True, 'bear_use_spike': True, 'bear_rsi_required': False, 'sideways_strategy': 'breakout', 'sideways_bb_std_mult': 2.1294308823042365, 'sideways_rsi_os': 23, 'sideways_rsi_ob': 93, 'sideways_adx_thresh': 30.4472410350347, 'sideways_atr_min_pct': 0.0026595041521798373, 'sideways_atr_max_pct': 0.10705345913034243, 'sideways_tp_mult': 2.016642527040808, 'sideways_tsl_mult': 0.5984842831747388, 'sideways_time_stop': 229, 'sideways_use_sma': True, 'sideways_use_ema': True, 'sideways_use_atr': False, 'sideways_use_adx': False, 'sideways_use_spike': True, 'sideways_rsi_required': False}.
[I 2025-08-31 11:14:16,536] Trial 877 finished with values: [-1000000000.0, 1000000000.0] and parameters: {'p_sma': 12, 'p_std': 51, 'p_atr': 29, 'p_adx': 9, 'rsi_period': 55, 'ema1': 16, 'ema2': 38, 'slip_atr_k': 0.021101898631641705, 'slip_spread_k': 0.1561009340183644, 'spread_hl_frac': 0.009583445196061422, 'bb_std_mult': 1.2186176961841326, 'rsi_os': 50, 'rsi_ob': 81, 'vol_spike': 0.29217274636763124, 'adx_thresh': 23.989699803159734, 'atr_min_pct': 0.010766196709164542, 'atr_max_pct': 0.12142772107467545, 'tp_mult': 2.755308399872795, 'tsl_mult': 0.8358043123354537, 'strategy': 'mean_reversion', 'time_stop': 127, 'use_sma': False, 'use_atr': True, 'use_adx': False, 'use_ema': True, 'use_spike': False, 'rsi_required': True, 'edge_k': 1.3665270542103936, 'edge_cap': 0.6803127929306693, 'bull_strategy': 'mean_reversion', 'bull_bb_std_mult': 3.463685004055847, 'bull_rsi_os': 45, 'bull_rsi_ob': 80, 'bull_adx_thresh': 31.10638034394968, 'bull_atr_min_pct': 0.01575060744736949, 'bull_atr_max_pct': 0.01961602577396364, 'bull_tp_mult': 2.027272702336621, 'bull_tsl_mult': 0.758218362614437, 'bull_time_stop': 5, 'bull_use_sma': True, 'bull_use_ema': False, 'bull_use_atr': False, 'bull_use_adx': False, 'bull_use_spike': False, 'bull_rsi_required': True, 'bear_strategy': 'breakout', 'bear_bb_std_mult': 3.1805018344466323, 'bear_rsi_os': 31, 'bear_rsi_ob': 87, 'bear_adx_thresh': 6.065259940049625, 'bear_atr_min_pct': 0.006047459429915981, 'bear_atr_max_pct': 0.1164528851862213, 'bear_tp_mult': 1.7837356389078702, 'bear_tsl_mult': 0.35070679599213417, 'bear_time_stop': 61, 'bear_use_sma': False, 'bear_use_ema': True, 'bear_use_atr': False, 'bear_use_adx': True, 'bear_use_spike': False, 'bear_rsi_required': False, 'sideways_strategy': 'breakout', 'sideways_bb_std_mult': 1.649210335696243, 'sideways_rsi_os': 16, 'sideways_rsi_ob': 93, 'sideways_adx_thresh': 28.3780956108211, 'sideways_atr_min_pct': 0.021376043899237085, 'sideways_atr_max_pct': 0.1060059592674635, 'sideways_tp_mult': 2.9444565900775608, 'sideways_tsl_mult': 0.09766693805150939, 'sideways_time_stop': 174, 'sideways_use_sma': True, 'sideways_use_ema': False, 'sideways_use_atr': False, 'sideways_use_adx': False, 'sideways_use_spike': True, 'sideways_rsi_required': False}.
[I 2025-08-31 11:14:47,309] Trial 878 finished with values: [-1000000000.0, 1000000000.0] and parameters: {'p_sma': 36, 'p_std': 51, 'p_atr': 29, 'p_adx': 9, 'rsi_period': 25, 'ema1': 15, 'ema2': 46, 'slip_atr_k': 0.19159236020541076, 'slip_spread_k': 0.16007699375888723, 'spread_hl_frac': 0.012488832973050347, 'bb_std_mult': 0.5054832977554904, 'rsi_os': 40, 'rsi_ob': 89, 'vol_spike': 0.16383043599134745, 'adx_thresh': 23.83207653045602, 'atr_min_pct': 0.010824212630455484, 'atr_max_pct': 0.12991744048104395, 'tp_mult': 2.0376268545539036, 'tsl_mult': 0.04403838092863758, 'strategy': 'mean_reversion', 'time_stop': 288, 'use_sma': False, 'use_atr': True, 'use_adx': False, 'use_ema': True, 'use_spike': False, 'rsi_required': True, 'edge_k': 1.836761646258767, 'edge_cap': 0.6918949999720028, 'bull_strategy': 'mean_reversion', 'bull_bb_std_mult': 1.1621594987878752, 'bull_rsi_os': 52, 'bull_rsi_ob': 70, 'bull_adx_thresh': 31.01782171010669, 'bull_atr_min_pct': 0.008088175047745255, 'bull_atr_max_pct': 0.13235412052266435, 'bull_tp_mult': 2.292465275483905, 'bull_tsl_mult': 0.5170075894133175, 'bull_time_stop': 135, 'bull_use_sma': True, 'bull_use_ema': False, 'bull_use_atr': False, 'bull_use_adx': False, 'bull_use_spike': False, 'bull_rsi_required': True, 'bear_strategy': 'breakout', 'bear_bb_std_mult': 2.757246021031202, 'bear_rsi_os': 31, 'bear_rsi_ob': 86, 'bear_adx_thresh': 21.026735127244258, 'bear_atr_min_pct': 0.024840044973514323, 'bear_atr_max_pct': 0.12178952868554443, 'bear_tp_mult': 2.077935683701424, 'bear_tsl_mult': 0.43806674815876123, 'bear_time_stop': 256, 'bear_use_sma': False, 'bear_use_ema': True, 'bear_use_atr': False, 'bear_use_adx': True, 'bear_use_spike': False, 'bear_rsi_required': False, 'sideways_strategy': 'breakout', 'sideways_bb_std_mult': 1.164293709945895, 'sideways_rsi_os': 41, 'sideways_rsi_ob': 93, 'sideways_adx_thresh': 9.92007981512098, 'sideways_atr_min_pct': 0.028814359931090487, 'sideways_atr_max_pct': 0.07215429741904414, 'sideways_tp_mult': 2.940981902648109, 'sideways_tsl_mult': 0.42445298249737295, 'sideways_time_stop': 242, 'sideways_use_sma': True, 'sideways_use_ema': False, 'sideways_use_atr': False, 'sideways_use_adx': False, 'sideways_use_spike': True, 'sideways_rsi_required': False}.
[I 2025-08-31 11:14:47,310] Trial 880 finished with values: [-1000000000.0, 1000000000.0] and parameters: {'p_sma': 12, 'p_std': 23, 'p_atr': 29, 'p_adx': 9, 'rsi_period': 26, 'ema1': 15, 'ema2': 18, 'slip_atr_k': 0.026142269017501538, 'slip_spread_k': 0.686055045769689, 'spread_hl_frac': 0.027100915091818074, 'bb_std_mult': 1.2106681236029995, 'rsi_os': 40, 'rsi_ob': 82, 'vol_spike': 0.2923302416202181, 'adx_thresh': 8.817412840292873, 'atr_min_pct': 0.010840974871685694, 'atr_max_pct': 0.12978680324573344, 'tp_mult': 2.0141025774442, 'tsl_mult': 0.5440784037904342, 'strategy': 'breakout', 'time_stop': 126, 'use_sma': True, 'use_atr': True, 'use_adx': True, 'use_ema': True, 'use_spike': False, 'rsi_required': True, 'edge_k': 1.7490122913538562, 'edge_cap': 0.06443365720878447, 'bull_strategy': 'breakout', 'bull_bb_std_mult': 1.172299831348722, 'bull_rsi_os': 22, 'bull_rsi_ob': 83, 'bull_adx_thresh': 32.34631737585028, 'bull_atr_min_pct': 0.006910085366645006, 'bull_atr_max_pct': 0.1324748262479859, 'bull_tp_mult': 2.2690273875477613, 'bull_tsl_mult': 0.7581330894023441, 'bull_time_stop': 52, 'bull_use_sma': True, 'bull_use_ema': False, 'bull_use_atr': False, 'bull_use_adx': True, 'bull_use_spike': False, 'bull_rsi_required': True, 'bear_strategy': 'breakout', 'bear_bb_std_mult': 2.217172162419054, 'bear_rsi_os': 30, 'bear_rsi_ob': 47, 'bear_adx_thresh': 20.915073882133655, 'bear_atr_min_pct': 0.007381148106227507, 'bear_atr_max_pct': 0.10811103554845956, 'bear_tp_mult': 2.061813810889035, 'bear_tsl_mult': 0.43791465201209506, 'bear_time_stop': 266, 'bear_use_sma': False, 'bear_use_ema': True, 'bear_use_atr': False, 'bear_use_adx': False, 'bear_use_spike': False, 'bear_rsi_required': False, 'sideways_strategy': 'mean_reversion', 'sideways_bb_std_mult': 2.3258180443564305, 'sideways_rsi_os': 41, 'sideways_rsi_ob': 95, 'sideways_adx_thresh': 19.371788094385018, 'sideways_atr_min_pct': 0.012119134129929352, 'sideways_atr_max_pct': 0.11103849437312395, 'sideways_tp_mult': 1.681428174540005, 'sideways_tsl_mult': 0.022800189655673597, 'sideways_time_stop': 241, 'sideways_use_sma': True, 'sideways_use_ema': False, 'sideways_use_atr': False, 'sideways_use_adx': False, 'sideways_use_spike': True, 'sideways_rsi_required': True}.
[I 2025-08-31 11:14:48,022] Trial 879 finished with values: [-1000000000.0, 1000000000.0] and parameters: {'p_sma': 12, 'p_std': 38, 'p_atr': 29, 'p_adx': 9, 'rsi_period': 26, 'ema1': 16, 'ema2': 23, 'slip_atr_k': 0.17391848739389779, 'slip_spread_k': 0.17235389890408903, 'spread_hl_frac': 0.009641097922063437, 'bb_std_mult': 3.4018600917917774, 'rsi_os': 40, 'rsi_ob': 87, 'vol_spike': 0.08745013124732198, 'adx_thresh': 23.72622617049359, 'atr_min_pct': 0.013665360631784439, 'atr_max_pct': 0.11954085907374054, 'tp_mult': 2.8805591554039007, 'tsl_mult': 0.04401234904698122, 'strategy': 'mean_reversion', 'time_stop': 68, 'use_sma': False, 'use_atr': True, 'use_adx': False, 'use_ema': True, 'use_spike': False, 'rsi_required': True, 'edge_k': 1.3790355525482259, 'edge_cap': 0.6757109758185268, 'bull_strategy': 'mean_reversion', 'bull_bb_std_mult': 2.997621600982935, 'bull_rsi_os': 25, 'bull_rsi_ob': 65, 'bull_adx_thresh': 32.45341155787095, 'bull_atr_min_pct': 0.01618194984094882, 'bull_atr_max_pct': 0.145376886411683, 'bull_tp_mult': 2.5805894322489817, 'bull_tsl_mult': 0.4381649318967928, 'bull_time_stop': 55, 'bull_use_sma': True, 'bull_use_ema': False, 'bull_use_atr': False, 'bull_use_adx': True, 'bull_use_spike': False, 'bull_rsi_required': True, 'bear_strategy': 'breakout', 'bear_bb_std_mult': 2.740258970266027, 'bear_rsi_os': 5, 'bear_rsi_ob': 79, 'bear_adx_thresh': 21.083089954704448, 'bear_atr_min_pct': 0.0025626229410738773, 'bear_atr_max_pct': 0.02377626374166361, 'bear_tp_mult': 2.071240401392338, 'bear_tsl_mult': 0.9067279522142333, 'bear_time_stop': 115, 'bear_use_sma': False, 'bear_use_ema': True, 'bear_use_atr': False, 'bear_use_adx': False, 'bear_use_spike': False, 'bear_rsi_required': False, 'sideways_strategy': 'breakout', 'sideways_bb_std_mult': 2.037775300602254, 'sideways_rsi_os': 32, 'sideways_rsi_ob': 85, 'sideways_adx_thresh': 9.776859519409594, 'sideways_atr_min_pct': 0.016674168291367825, 'sideways_atr_max_pct': 0.10648591042113421, 'sideways_tp_mult': 2.826305767522216, 'sideways_tsl_mult': 0.1780549708806331, 'sideways_time_stop': 248, 'sideways_use_sma': True, 'sideways_use_ema': False, 'sideways_use_atr': False, 'sideways_use_adx': False, 'sideways_use_spike': True, 'sideways_rsi_required': False}.
