[I 2025-08-31 10:22:05,091] Trial 496 finished with values: [-1000000000.0, 1000000000.0] and parameters: {'p_sma': 12, 'p_std': 47, 'p_atr': 17, 'p_adx': 9, 'rsi_period': 27, 'ema1': 17, 'ema2': 36, 'slip_atr_k': 0.19042222194400804, 'slip_spread_k': 0.09006860304300922, 'spread_hl_frac': 0.011224924237358854, 'bb_std_mult': 1.2334758841690738, 'rsi_os': 40, 'rsi_ob': 81, 'vol_spike': 0.28621249464031173, 'adx_thresh': 28.194946366684626, 'atr_min_pct': 0.008841335431511149, 'atr_max_pct': 0.1141119189744633, 'tp_mult': 2.934062666954474, 'tsl_mult': 0.09539576443413662, 'strategy': 'mean_reversion', 'time_stop': 37, 'use_sma': False, 'use_atr': True, 'use_adx': False, 'use_ema': True, 'use_spike': False, 'rsi_required': True, 'edge_k': 1.9027979572409865, 'edge_cap': 0.21509856716472986, 'bull_strategy': 'mean_reversion', 'bull_bb_std_mult': 1.064369185296271, 'bull_rsi_os': 25, 'bull_rsi_ob': 70, 'bull_adx_thresh': 30.256090156297418, 'bull_atr_min_pct': 0.006856676660695636, 'bull_atr_max_pct': 0.08431820142723614, 'bull_tp_mult': 2.1931730998665935, 'bull_tsl_mult': 0.9604142230757524, 'bull_time_stop': 60, 'bull_use_sma': True, 'bull_use_ema': True, 'bull_use_atr': True, 'bull_use_adx': False, 'bull_use_spike': False, 'bull_rsi_required': True, 'bear_strategy': 'breakout', 'bear_bb_std_mult': 2.9299221693613013, 'bear_rsi_os': 30, 'bear_rsi_ob': 50, 'bear_adx_thresh': 23.833208992936513, 'bear_atr_min_pct': 0.005151492569654123, 'bear_atr_max_pct': 0.09844213960134185, 'bear_tp_mult': 2.0499775516305037, 'bear_tsl_mult': 0.46250282881215127, 'bear_time_stop': 284, 'bear_use_sma': False, 'bear_use_ema': False, 'bear_use_atr': False, 'bear_use_adx': True, 'bear_use_spike': True, 'bear_rsi_required': False, 'sideways_strategy': 'mean_reversion', 'sideways_bb_std_mult': 0.8120823142743291, 'sideways_rsi_os': 21, 'sideways_rsi_ob': 95, 'sideways_adx_thresh': 30.48728142606981, 'sideways_atr_min_pct': 0.0011819072856718987, 'sideways_atr_max_pct': 0.0970781031404396, 'sideways_tp_mult': 2.8218863473657168, 'sideways_tsl_mult': 0.016273559050636044, 'sideways_time_stop': 284, 'sideways_use_sma': True, 'sideways_use_ema': True, 'sideways_use_atr': False, 'sideways_use_adx': True, 'sideways_use_spike': True, 'sideways_rsi_required': True}.
[I 2025-08-31 10:22:05,341] Trial 493 finished with values: [-1000000000.0, 1000000000.0] and parameters: {'p_sma': 9, 'p_std': 48, 'p_atr': 17, 'p_adx': 9, 'rsi_period': 25, 'ema1': 17, 'ema2': 37, 'slip_atr_k': 0.18840638468670284, 'slip_spread_k': 0.14952266851376667, 'spread_hl_frac': 0.010195192815963653, 'bb_std_mult': 1.2074674731688566, 'rsi_os': 39, 'rsi_ob': 85, 'vol_spike': 0.28923294631444463, 'adx_thresh': 21.326084434061755, 'atr_min_pct': 0.011011723449967604, 'atr_max_pct': 0.11039039503977971, 'tp_mult': 2.933854523979011, 'tsl_mult': 0.06790471134711791, 'strategy': 'mean_reversion', 'time_stop': 104, 'use_sma': False, 'use_atr': False, 'use_adx': False, 'use_ema': True, 'use_spike': False, 'rsi_required': False, 'edge_k': 1.898492453770428, 'edge_cap': 0.13858626507700278, 'bull_strategy': 'mean_reversion', 'bull_bb_std_mult': 1.1928934185951006, 'bull_rsi_os': 25, 'bull_rsi_ob': 70, 'bull_adx_thresh': 30.08409962829952, 'bull_atr_min_pct': 0.0035629543582950656, 'bull_atr_max_pct': 0.0875853456891184, 'bull_tp_mult': 2.2485791171271345, 'bull_tsl_mult': 0.9833080937216337, 'bull_time_stop': 82, 'bull_use_sma': True, 'bull_use_ema': True, 'bull_use_atr': True, 'bull_use_adx': False, 'bull_use_spike': False, 'bull_rsi_required': True, 'bear_strategy': 'breakout', 'bear_bb_std_mult': 3.031490447539752, 'bear_rsi_os': 27, 'bear_rsi_ob': 50, 'bear_adx_thresh': 21.88020703699195, 'bear_atr_min_pct': 0.008738462117312374, 'bear_atr_max_pct': 0.10379672160921315, 'bear_tp_mult': 2.091983173532897, 'bear_tsl_mult': 0.45754074213921614, 'bear_time_stop': 282, 'bear_use_sma': False, 'bear_use_ema': True, 'bear_use_atr': False, 'bear_use_adx': True, 'bear_use_spike': True, 'bear_rsi_required': True, 'sideways_strategy': 'mean_reversion', 'sideways_bb_std_mult': 1.5286588521312385, 'sideways_rsi_os': 23, 'sideways_rsi_ob': 94, 'sideways_adx_thresh': 30.360562078822767, 'sideways_atr_min_pct': 5.679573693093002e-06, 'sideways_atr_max_pct': 0.09281935615605222, 'sideways_tp_mult': 2.9604467941959514, 'sideways_tsl_mult': 0.0012440197083681964, 'sideways_time_stop': 229, 'sideways_use_sma': True, 'sideways_use_ema': True, 'sideways_use_atr': False, 'sideways_use_adx': True, 'sideways_use_spike': True, 'sideways_rsi_required': True}.
[I 2025-08-31 10:22:38,199] Trial 498 finished with values: [-1000000000.0, 1000000000.0] and parameters: {'p_sma': 9, 'p_std': 50, 'p_atr': 28, 'p_adx': 26, 'rsi_period': 24, 'ema1': 18, 'ema2': 38, 'slip_atr_k': 0.1806500872608609, 'slip_spread_k': 0.11306211555303054, 'spread_hl_frac': 0.009273448085766904, 'bb_std_mult': 1.2248412016514332, 'rsi_os': 40, 'rsi_ob': 84, 'vol_spike': 0.294945671251432, 'adx_thresh': 27.1618138015392, 'atr_min_pct': 0.009291670682565803, 'atr_max_pct': 0.11290765231236645, 'tp_mult': 2.928716132817043, 'tsl_mult': 0.12734591747330376, 'strategy': 'breakout', 'time_stop': 37, 'use_sma': False, 'use_atr': False, 'use_adx': False, 'use_ema': True, 'use_spike': True, 'rsi_required': True, 'edge_k': 1.9971663035069942, 'edge_cap': 0.5950036788988039, 'bull_strategy': 'mean_reversion', 'bull_bb_std_mult': 1.2102357053305162, 'bull_rsi_os': 27, 'bull_rsi_ob': 70, 'bull_adx_thresh': 30.365126764739568, 'bull_atr_min_pct': 0.007497870743447946, 'bull_atr_max_pct': 0.08503924808910682, 'bull_tp_mult': 2.3065021089491267, 'bull_tsl_mult': 0.9553936272393952, 'bull_time_stop': 71, 'bull_use_sma': True, 'bull_use_ema': False, 'bull_use_atr': False, 'bull_use_adx': False, 'bull_use_spike': False, 'bull_rsi_required': True, 'bear_strategy': 'breakout', 'bear_bb_std_mult': 3.000209767960239, 'bear_rsi_os': 30, 'bear_rsi_ob': 50, 'bear_adx_thresh': 22.78080979009195, 'bear_atr_min_pct': 0.006908505400608955, 'bear_atr_max_pct': 0.09919603180353954, 'bear_tp_mult': 1.9980307522715308, 'bear_tsl_mult': 0.4402337775050592, 'bear_time_stop': 265, 'bear_use_sma': True, 'bear_use_ema': True, 'bear_use_atr': False, 'bear_use_adx': False, 'bear_use_spike': True, 'bear_rsi_required': True, 'sideways_strategy': 'breakout', 'sideways_bb_std_mult': 0.8005481978304658, 'sideways_rsi_os': 21, 'sideways_rsi_ob': 92, 'sideways_adx_thresh': 29.650179905040773, 'sideways_atr_min_pct': 0.01908385368241754, 'sideways_atr_max_pct': 0.09628435311892937, 'sideways_tp_mult': 2.9215420775370147, 'sideways_tsl_mult': 0.6811082340501415, 'sideways_time_stop': 231, 'sideways_use_sma': True, 'sideways_use_ema': False, 'sideways_use_atr': False, 'sideways_use_adx': False, 'sideways_use_spike': True, 'sideways_rsi_required': False}.
[I 2025-08-31 10:22:38,974] Trial 500 finished with values: [-1000000000.0, 1000000000.0] and parameters: {'p_sma': 8, 'p_std': 50, 'p_atr': 9, 'p_adx': 10, 'rsi_period': 24, 'ema1': 18, 'ema2': 38, 'slip_atr_k': 0.18307421410296115, 'slip_spread_k': 0.12193675571392074, 'spread_hl_frac': 0.007736923164270361, 'bb_std_mult': 1.2770767631102429, 'rsi_os': 41, 'rsi_ob': 83, 'vol_spike': 0.2994525084684722, 'adx_thresh': 27.001768582155453, 'atr_min_pct': 0.01140994340615982, 'atr_max_pct': 0.11472262589579867, 'tp_mult': 2.902282063170578, 'tsl_mult': 0.09692402838189716, 'strategy': 'breakout', 'time_stop': 131, 'use_sma': False, 'use_atr': False, 'use_adx': False, 'use_ema': True, 'use_spike': True, 'rsi_required': True, 'edge_k': 1.9461260038046104, 'edge_cap': 0.1674663102715855, 'bull_strategy': 'mean_reversion', 'bull_bb_std_mult': 1.205993562253018, 'bull_rsi_os': 27, 'bull_rsi_ob': 66, 'bull_adx_thresh': 30.554393873647637, 'bull_atr_min_pct': 0.009971593869635018, 'bull_atr_max_pct': 0.08179257812733694, 'bull_tp_mult': 2.329854623749955, 'bull_tsl_mult': 0.9551200288341913, 'bull_time_stop': 70, 'bull_use_sma': True, 'bull_use_ema': False, 'bull_use_atr': False, 'bull_use_adx': True, 'bull_use_spike': False, 'bull_rsi_required': True, 'bear_strategy': 'breakout', 'bear_bb_std_mult': 3.120646076410739, 'bear_rsi_os': 25, 'bear_rsi_ob': 88, 'bear_adx_thresh': 22.742014857421434, 'bear_atr_min_pct': 0.006969485320221825, 'bear_atr_max_pct': 0.09993463744480506, 'bear_tp_mult': 2.004457494983123, 'bear_tsl_mult': 0.43609640197498734, 'bear_time_stop': 264, 'bear_use_sma': True, 'bear_use_ema': True, 'bear_use_atr': True, 'bear_use_adx': False, 'bear_use_spike': True, 'bear_rsi_required': True, 'sideways_strategy': 'breakout', 'sideways_bb_std_mult': 0.769637496772099, 'sideways_rsi_os': 7, 'sideways_rsi_ob': 92, 'sideways_adx_thresh': 29.560976877296177, 'sideways_atr_min_pct': 0.024305509759862537, 'sideways_atr_max_pct': 0.10808296227416403, 'sideways_tp_mult': 2.9172335021482936, 'sideways_tsl_mult': 0.4322576893032101, 'sideways_time_stop': 236, 'sideways_use_sma': False, 'sideways_use_ema': False, 'sideways_use_atr': False, 'sideways_use_adx': False, 'sideways_use_spike': True, 'sideways_rsi_required': False}.
[I 2025-08-31 10:22:39,198] Trial 497 finished with values: [-1000000000.0, 1000000000.0] and parameters: {'p_sma': 8, 'p_std': 47, 'p_atr': 17, 'p_adx': 9, 'rsi_period': 27, 'ema1': 17, 'ema2': 36, 'slip_atr_k': 0.18686482634410154, 'slip_spread_k': 0.113169005410543, 'spread_hl_frac': 0.007972889295794924, 'bb_std_mult': 1.2220995468789693, 'rsi_os': 40, 'rsi_ob': 81, 'vol_spike': 0.28874456158078665, 'adx_thresh': 27.302558773582817, 'atr_min_pct': 0.00908416298557857, 'atr_max_pct': 0.11430593538071243, 'tp_mult': 2.9262145526014463, 'tsl_mult': 0.09530714267920735, 'strategy': 'mean_reversion', 'time_stop': 37, 'use_sma': False, 'use_atr': False, 'use_adx': False, 'use_ema': True, 'use_spike': True, 'rsi_required': True, 'edge_k': 1.8990242515949258, 'edge_cap': 0.1312210561431547, 'bull_strategy': 'mean_reversion', 'bull_bb_std_mult': 1.036744737817066, 'bull_rsi_os': 27, 'bull_rsi_ob': 59, 'bull_adx_thresh': 30.32611629517585, 'bull_atr_min_pct': 0.0022299717543039456, 'bull_atr_max_pct': 0.08532166014558092, 'bull_tp_mult': 2.2401811678379997, 'bull_tsl_mult': 0.9578679845268464, 'bull_time_stop': 59, 'bull_use_sma': True, 'bull_use_ema': False, 'bull_use_atr': False, 'bull_use_adx': False, 'bull_use_spike': False, 'bull_rsi_required': True, 'bear_strategy': 'breakout', 'bear_bb_std_mult': 2.9243892666262705, 'bear_rsi_os': 29, 'bear_rsi_ob': 50, 'bear_adx_thresh': 22.61346313521001, 'bear_atr_min_pct': 0.00700634873967985, 'bear_atr_max_pct': 0.09853215538402305, 'bear_tp_mult': 2.050802077531014, 'bear_tsl_mult': 0.43499374821839576, 'bear_time_stop': 283, 'bear_use_sma': True, 'bear_use_ema': False, 'bear_use_atr': False, 'bear_use_adx': False, 'bear_use_spike': True, 'bear_rsi_required': True, 'sideways_strategy': 'mean_reversion', 'sideways_bb_std_mult': 0.6225637492218816, 'sideways_rsi_os': 21, 'sideways_rsi_ob': 92, 'sideways_adx_thresh': 29.33681477669058, 'sideways_atr_min_pct': 0.0010650155926948952, 'sideways_atr_max_pct': 0.09710791702983089, 'sideways_tp_mult': 2.919150577252018, 'sideways_tsl_mult': 0.011249324369901656, 'sideways_time_stop': 46, 'sideways_use_sma': True, 'sideways_use_ema': True, 'sideways_use_atr': False, 'sideways_use_adx': False, 'sideways_use_spike': True, 'sideways_rsi_required': True}.
[I 2025-08-31 10:22:39,198] Trial 499 finished with values: [-1000000000.0, 1000000000.0] and parameters: {'p_sma': 8, 'p_std': 50, 'p_atr': 28, 'p_adx': 11, 'rsi_period': 24, 'ema1': 18, 'ema2': 38, 'slip_atr_k': 0.1815282670927098, 'slip_spread_k': 0.12526656051770385, 'spread_hl_frac': 0.00898799120426704, 'bb_std_mult': 1.2019591533778, 'rsi_os': 41, 'rsi_ob': 84, 'vol_spike': 0.29699973603825397, 'adx_thresh': 27.35891746820603, 'atr_min_pct': 0.028004334321743603, 'atr_max_pct': 0.10479114601811362, 'tp_mult': 2.901600142872473, 'tsl_mult': 0.12472412826835466, 'strategy': 'breakout', 'time_stop': 105, 'use_sma': False, 'use_atr': False, 'use_adx': False, 'use_ema': True, 'use_spike': True, 'rsi_required': True, 'edge_k': 0.013514197327610389, 'edge_cap': 0.23870811436697303, 'bull_strategy': 'mean_reversion', 'bull_bb_std_mult': 1.2029502500461489, 'bull_rsi_os': 27, 'bull_rsi_ob': 50, 'bull_adx_thresh': 26.873249991570503, 'bull_atr_min_pct': 0.012277923202101696, 'bull_atr_max_pct': 0.08648423765006744, 'bull_tp_mult': 2.3175636458650852, 'bull_tsl_mult': 0.9494424696319627, 'bull_time_stop': 72, 'bull_use_sma': True, 'bull_use_ema': False, 'bull_use_atr': False, 'bull_use_adx': True, 'bull_use_spike': False, 'bull_rsi_required': True, 'bear_strategy': 'breakout', 'bear_bb_std_mult': 3.152168158704413, 'bear_rsi_os': 28, 'bear_rsi_ob': 87, 'bear_adx_thresh': 21.760154642162696, 'bear_atr_min_pct': 0.006905839239884727, 'bear_atr_max_pct': 0.1076201862728034, 'bear_tp_mult': 1.9898226498946092, 'bear_tsl_mult': 0.43313220726111945, 'bear_time_stop': 266, 'bear_use_sma': True, 'bear_use_ema': True, 'bear_use_atr': True, 'bear_use_adx': False, 'bear_use_spike': True, 'bear_rsi_required': True, 'sideways_strategy': 'breakout', 'sideways_bb_std_mult': 0.60373988499664, 'sideways_rsi_os': 24, 'sideways_rsi_ob': 93, 'sideways_adx_thresh': 29.52882536182832, 'sideways_atr_min_pct': 0.0011700724519811986, 'sideways_atr_max_pct': 0.10716013387226465, 'sideways_tp_mult': 2.9066509153398865, 'sideways_tsl_mult': 0.04122121576917879, 'sideways_time_stop': 231, 'sideways_use_sma': False, 'sideways_use_ema': False, 'sideways_use_atr': False, 'sideways_use_adx': False, 'sideways_use_spike': True, 'sideways_rsi_required': False}.
[I 2025-08-31 10:23:11,476] Trial 501 finished with values: [-1000000000.0, 1000000000.0] and parameters: {'p_sma': 10, 'p_std': 49, 'p_atr': 29, 'p_adx': 10, 'rsi_period': 27, 'ema1': 18, 'ema2': 33, 'slip_atr_k': 0.1823175469199447, 'slip_spread_k': 0.11635039575240881, 'spread_hl_frac': 0.0075713696078243235, 'bb_std_mult': 1.315874172253117, 'rsi_os': 41, 'rsi_ob': 82, 'vol_spike': 0.27992957514392847, 'adx_thresh': 26.19046361649258, 'atr_min_pct': 0.028826869710018126, 'atr_max_pct': 0.11495288683038486, 'tp_mult': 2.8956201184043735, 'tsl_mult': 0.09639189773144327, 'strategy': 'breakout', 'time_stop': 131, 'use_sma': True, 'use_atr': False, 'use_adx': False, 'use_ema': True, 'use_spike': True, 'rsi_required': True, 'edge_k': 0.11691763708533087, 'edge_cap': 0.24089610226097702, 'bull_strategy': 'breakout', 'bull_bb_std_mult': 0.9848712314555004, 'bull_rsi_os': 26, 'bull_rsi_ob': 51, 'bull_adx_thresh': 29.56758070610592, 'bull_atr_min_pct': 0.011925523132764742, 'bull_atr_max_pct': 0.08969036832040447, 'bull_tp_mult': 2.2249669876232616, 'bull_tsl_mult': 0.9302817057176371, 'bull_time_stop': 73, 'bull_use_sma': True, 'bull_use_ema': False, 'bull_use_atr': False, 'bull_use_adx': True, 'bull_use_spike': False, 'bull_rsi_required': True, 'bear_strategy': 'breakout', 'bear_bb_std_mult': 3.269893370460653, 'bear_rsi_os': 25, 'bear_rsi_ob': 88, 'bear_adx_thresh': 8.650530841752703, 'bear_atr_min_pct': 0.01005188982563222, 'bear_atr_max_pct': 0.10834093705986346, 'bear_tp_mult': 1.973862679728795, 'bear_tsl_mult': 0.43719606826251683, 'bear_time_stop': 265, 'bear_use_sma': True, 'bear_use_ema': True, 'bear_use_atr': True, 'bear_use_adx': False, 'bear_use_spike': True, 'bear_rsi_required': True, 'sideways_strategy': 'breakout', 'sideways_bb_std_mult': 1.3899229726655933, 'sideways_rsi_os': 24, 'sideways_rsi_ob': 93, 'sideways_adx_thresh': 29.189432831924137, 'sideways_atr_min_pct': 0.0010949104429886305, 'sideways_atr_max_pct': 0.10563904911005273, 'sideways_tp_mult': 2.8928222545859326, 'sideways_tsl_mult': 0.28832342515525833, 'sideways_time_stop': 55, 'sideways_use_sma': False, 'sideways_use_ema': False, 'sideways_use_atr': False, 'sideways_use_adx': False, 'sideways_use_spike': True, 'sideways_rsi_required': False}.
[I 2025-08-31 10:23:12,855] Trial 502 finished with values: [-0.016398264927261375, 0.016215539538735422] and parameters: {'p_sma': 13, 'p_std': 49, 'p_atr': 28, 'p_adx': 11, 'rsi_period': 24, 'ema1': 18, 'ema2': 36, 'slip_atr_k': 0.17962270514283782, 'slip_spread_k': 0.13812171333861, 'spread_hl_frac': 0.010926480097360886, 'bb_std_mult': 1.3260089155351504, 'rsi_os': 42, 'rsi_ob': 83, 'vol_spike': 0.2775062521266145, 'adx_thresh': 26.170330990538677, 'atr_min_pct': 0.0007311475419955107, 'atr_max_pct': 0.1119167114723558, 'tp_mult': 2.9000772626291833, 'tsl_mult': 0.0653210425247146, 'strategy': 'breakout', 'time_stop': 150, 'use_sma': True, 'use_atr': False, 'use_adx': False, 'use_ema': True, 'use_spike': False, 'rsi_required': True, 'edge_k': 0.22762997569884003, 'edge_cap': 0.4685278714744246, 'bull_strategy': 'breakout', 'bull_bb_std_mult': 0.9584363274339812, 'bull_rsi_os': 26, 'bull_rsi_ob': 50, 'bull_adx_thresh': 29.34894770765171, 'bull_atr_min_pct': 0.0022931392096812884, 'bull_atr_max_pct': 0.08646777288139154, 'bull_tp_mult': 2.1698997218369542, 'bull_tsl_mult': 0.9986718318758604, 'bull_time_stop': 61, 'bull_use_sma': False, 'bull_use_ema': False, 'bull_use_atr': False, 'bull_use_adx': False, 'bull_use_spike': False, 'bull_rsi_required': True, 'bear_strategy': 'mean_reversion', 'bear_bb_std_mult': 2.9477517039282777, 'bear_rsi_os': 28, 'bear_rsi_ob': 45, 'bear_adx_thresh': 21.598999750172798, 'bear_atr_min_pct': 0.010033068612532328, 'bear_atr_max_pct': 0.10705209557940504, 'bear_tp_mult': 1.9826316437583942, 'bear_tsl_mult': 0.4691047223180596, 'bear_time_stop': 272, 'bear_use_sma': False, 'bear_use_ema': True, 'bear_use_atr': True, 'bear_use_adx': True, 'bear_use_spike': True, 'bear_rsi_required': True, 'sideways_strategy': 'breakout', 'sideways_bb_std_mult': 0.644069590602325, 'sideways_rsi_os': 24, 'sideways_rsi_ob': 93, 'sideways_adx_thresh': 28.831378629935177, 'sideways_atr_min_pct': 0.0011214188599609864, 'sideways_atr_max_pct': 0.08403606237476266, 'sideways_tp_mult': 2.8766958305692416, 'sideways_tsl_mult': 0.033767878830014135, 'sideways_time_stop': 85, 'sideways_use_sma': False, 'sideways_use_ema': True, 'sideways_use_atr': False, 'sideways_use_adx': False, 'sideways_use_spike': True, 'sideways_rsi_required': False}.
[I 2025-08-31 10:23:13,267] Trial 503 finished with values: [-0.014333642977558125, 0.014158829745962704] and parameters: {'p_sma': 13, 'p_std': 49, 'p_atr': 11, 'p_adx': 17, 'rsi_period': 24, 'ema1': 18, 'ema2': 31, 'slip_atr_k': 0.19692545621314161, 'slip_spread_k': 0.052861851308258594, 'spread_hl_frac': 0.011369203433773345, 'bb_std_mult': 1.337697287399037, 'rsi_os': 42, 'rsi_ob': 82, 'vol_spike': 0.2799633700565248, 'adx_thresh': 26.10652682317281, 'atr_min_pct': 0.010977007295272961, 'atr_max_pct': 0.1121036820965714, 'tp_mult': 2.8954521527763015, 'tsl_mult': 0.06286751908632521, 'strategy': 'breakout', 'time_stop': 136, 'use_sma': True, 'use_atr': False, 'use_adx': True, 'use_ema': True, 'use_spike': False, 'rsi_required': True, 'edge_k': 1.9283058691083639, 'edge_cap': 0.6315513627140151, 'bull_strategy': 'breakout', 'bull_bb_std_mult': 0.965769589774689, 'bull_rsi_os': 27, 'bull_rsi_ob': 66, 'bull_adx_thresh': 29.64298995815884, 'bull_atr_min_pct': 0.011325899233220901, 'bull_atr_max_pct': 0.08920412138854528, 'bull_tp_mult': 2.158659189360158, 'bull_tsl_mult': 0.9295311678440068, 'bull_time_stop': 66, 'bull_use_sma': False, 'bull_use_ema': False, 'bull_use_atr': False, 'bull_use_adx': False, 'bull_use_spike': True, 'bull_rsi_required': False, 'bear_strategy': 'mean_reversion', 'bear_bb_std_mult': 3.2885312293123654, 'bear_rsi_os': 28, 'bear_rsi_ob': 82, 'bear_adx_thresh': 34.45156511980694, 'bear_atr_min_pct': 0.010084210062102649, 'bear_atr_max_pct': 0.10579432684263983, 'bear_tp_mult': 2.120447501230076, 'bear_tsl_mult': 0.471305835060237, 'bear_time_stop': 271, 'bear_use_sma': False, 'bear_use_ema': True, 'bear_use_atr': False, 'bear_use_adx': True, 'bear_use_spike': True, 'bear_rsi_required': True, 'sideways_strategy': 'breakout', 'sideways_bb_std_mult': 1.3529595494004072, 'sideways_rsi_os': 24, 'sideways_rsi_ob': 94, 'sideways_adx_thresh': 28.780767572520286, 'sideways_atr_min_pct': 0.0009047204312886534, 'sideways_atr_max_pct': 0.12879832807446995, 'sideways_tp_mult': 2.995816070398018, 'sideways_tsl_mult': 0.8897392373964917, 'sideways_time_stop': 59, 'sideways_use_sma': True, 'sideways_use_ema': True, 'sideways_use_atr': True, 'sideways_use_adx': False, 'sideways_use_spike': True, 'sideways_rsi_required': False}.
