[I 2025-08-31 11:12:36,345] Trial 864 finished with values: [-1000000000.0, 1000000000.0] and parameters: {'p_sma': 26, 'p_std': 40, 'p_atr': 29, 'p_adx': 27, 'rsi_period': 63, 'ema1': 5, 'ema2': 40, 'slip_atr_k': 0.19184021270690405, 'slip_spread_k': 0.11030752166533876, 'spread_hl_frac': 0.010366060110696415, 'bb_std_mult': 1.4445172919048077, 'rsi_os': 41, 'rsi_ob': 86, 'vol_spike': 0.11056978173975054, 'adx_thresh': 19.38510933022882, 'atr_min_pct': 0.012708309942216209, 'atr_max_pct': 0.12678809501840377, 'tp_mult': 1.4010223019893722, 'tsl_mult': 0.048146626445576, 'strategy': 'breakout', 'time_stop': 58, 'use_sma': False, 'use_atr': False, 'use_adx': False, 'use_ema': True, 'use_spike': False, 'rsi_required': False, 'edge_k': 1.020283791858847, 'edge_cap': 0.13239016976699738, 'bull_strategy': 'mean_reversion', 'bull_bb_std_mult': 2.7130853647384963, 'bull_rsi_os': 24, 'bull_rsi_ob': 85, 'bull_adx_thresh': 13.301279322939848, 'bull_atr_min_pct': 0.007413051388946013, 'bull_atr_max_pct': 0.08040054280606661, 'bull_tp_mult': 2.3118715966291674, 'bull_tsl_mult': 0.9808388547661577, 'bull_time_stop': 197, 'bull_use_sma': False, 'bull_use_ema': False, 'bull_use_atr': False, 'bull_use_adx': True, 'bull_use_spike': False, 'bull_rsi_required': False, 'bear_strategy': 'mean_reversion', 'bear_bb_std_mult': 2.9303871816665867, 'bear_rsi_os': 47, 'bear_rsi_ob': 52, 'bear_adx_thresh': 12.005291981769048, 'bear_atr_min_pct': 0.008105737907607205, 'bear_atr_max_pct': 0.012644865223523705, 'bear_tp_mult': 1.9821194065276146, 'bear_tsl_mult': 0.30645100221818566, 'bear_time_stop': 12, 'bear_use_sma': False, 'bear_use_ema': False, 'bear_use_atr': False, 'bear_use_adx': False, 'bear_use_spike': False, 'bear_rsi_required': True, 'sideways_strategy': 'mean_reversion', 'sideways_bb_std_mult': 0.8592047629676121, 'sideways_rsi_os': 24, 'sideways_rsi_ob': 52, 'sideways_adx_thresh': 29.905832491783965, 'sideways_atr_min_pct': 0.0006828514136314076, 'sideways_atr_max_pct': 0.09946204449374431, 'sideways_tp_mult': 2.4622793291574654, 'sideways_tsl_mult': 0.04075702391403235, 'sideways_time_stop': 235, 'sideways_use_sma': True, 'sideways_use_ema': True, 'sideways_use_atr': False, 'sideways_use_adx': False, 'sideways_use_spike': True, 'sideways_rsi_required': True}.
[I 2025-08-31 11:13:09,184] Trial 866 finished with values: [-1000000000.0, 1000000000.0] and parameters: {'p_sma': 8, 'p_std': 47, 'p_atr': 7, 'p_adx': 27, 'rsi_period': 76, 'ema1': 19, 'ema2': 36, 'slip_atr_k': 0.055272585857260026, 'slip_spread_k': 0.30735797457817654, 'spread_hl_frac': 0.037451780117127, 'bb_std_mult': 1.4158943736039595, 'rsi_os': 39, 'rsi_ob': 82, 'vol_spike': 0.28598072253866946, 'adx_thresh': 33.523160553410975, 'atr_min_pct': 0.027842755698383563, 'atr_max_pct': 0.1254358756610383, 'tp_mult': 1.4018335230798873, 'tsl_mult': 0.12598896256405312, 'strategy': 'breakout', 'time_stop': 226, 'use_sma': False, 'use_atr': False, 'use_adx': True, 'use_ema': True, 'use_spike': False, 'rsi_required': True, 'edge_k': 1.9641895462223287, 'edge_cap': 0.13828822611196157, 'bull_strategy': 'mean_reversion', 'bull_bb_std_mult': 2.1610469095720575, 'bull_rsi_os': 24, 'bull_rsi_ob': 85, 'bull_adx_thresh': 27.977688911762332, 'bull_atr_min_pct': 0.0075154596845143345, 'bull_atr_max_pct': 0.09190973973682075, 'bull_tp_mult': 2.2108803980567764, 'bull_tsl_mult': 0.8829286171267146, 'bull_time_stop': 272, 'bull_use_sma': False, 'bull_use_ema': False, 'bull_use_atr': False, 'bull_use_adx': False, 'bull_use_spike': False, 'bull_rsi_required': False, 'bear_strategy': 'mean_reversion', 'bear_bb_std_mult': 0.8758116395346598, 'bear_rsi_os': 29, 'bear_rsi_ob': 51, 'bear_adx_thresh': 28.057661783667577, 'bear_atr_min_pct': 0.007966610837921813, 'bear_atr_max_pct': 0.10981291601165866, 'bear_tp_mult': 1.8941451233341735, 'bear_tsl_mult': 0.2699942077094625, 'bear_time_stop': 263, 'bear_use_sma': False, 'bear_use_ema': True, 'bear_use_atr': False, 'bear_use_adx': False, 'bear_use_spike': False, 'bear_rsi_required': True, 'sideways_strategy': 'breakout', 'sideways_bb_std_mult': 2.4054999885691335, 'sideways_rsi_os': 22, 'sideways_rsi_ob': 94, 'sideways_adx_thresh': 30.79782751402644, 'sideways_atr_min_pct': 0.0004768508928988664, 'sideways_atr_max_pct': 0.10704773379071217, 'sideways_tp_mult': 2.9186238369985062, 'sideways_tsl_mult': 0.07016105374360676, 'sideways_time_stop': 209, 'sideways_use_sma': True, 'sideways_use_ema': False, 'sideways_use_atr': False, 'sideways_use_adx': False, 'sideways_use_spike': True, 'sideways_rsi_required': False}.
[I 2025-08-31 11:13:09,477] Trial 867 finished with values: [-1000000000.0, 1000000000.0] and parameters: {'p_sma': 8, 'p_std': 47, 'p_atr': 7, 'p_adx': 27, 'rsi_period': 82, 'ema1': 5, 'ema2': 26, 'slip_atr_k': 0.18118635711140427, 'slip_spread_k': 0.1411363132465957, 'spread_hl_frac': 0.008077907603182277, 'bb_std_mult': 1.3543964598891032, 'rsi_os': 39, 'rsi_ob': 84, 'vol_spike': 0.28682885437680844, 'adx_thresh': 19.357330728566623, 'atr_min_pct': 0.018398063650998026, 'atr_max_pct': 0.037808227288587966, 'tp_mult': 2.892779197419933, 'tsl_mult': 0.6320978205870749, 'strategy': 'breakout', 'time_stop': 122, 'use_sma': False, 'use_atr': False, 'use_adx': True, 'use_ema': True, 'use_spike': False, 'rsi_required': True, 'edge_k': 1.9712045613229352, 'edge_cap': 0.12118801057979774, 'bull_strategy': 'mean_reversion', 'bull_bb_std_mult': 1.8174574258561058, 'bull_rsi_os': 24, 'bull_rsi_ob': 84, 'bull_adx_thresh': 30.43383059635825, 'bull_atr_min_pct': 0.0075593899699347294, 'bull_atr_max_pct': 0.09171319932282729, 'bull_tp_mult': 2.2060334842325635, 'bull_tsl_mult': 0.07724226859543398, 'bull_time_stop': 74, 'bull_use_sma': False, 'bull_use_ema': False, 'bull_use_atr': False, 'bull_use_adx': False, 'bull_use_spike': False, 'bull_rsi_required': False, 'bear_strategy': 'mean_reversion', 'bear_bb_std_mult': 0.8649042372663205, 'bear_rsi_os': 31, 'bear_rsi_ob': 58, 'bear_adx_thresh': 21.667954552586533, 'bear_atr_min_pct': 0.007953931055746818, 'bear_atr_max_pct': 0.10986429085827008, 'bear_tp_mult': 1.8646449610632154, 'bear_tsl_mult': 0.49631367180773617, 'bear_time_stop': 262, 'bear_use_sma': False, 'bear_use_ema': True, 'bear_use_atr': False, 'bear_use_adx': False, 'bear_use_spike': False, 'bear_rsi_required': True, 'sideways_strategy': 'breakout', 'sideways_bb_std_mult': 2.983272793308825, 'sideways_rsi_os': 22, 'sideways_rsi_ob': 52, 'sideways_adx_thresh': 15.167662965113166, 'sideways_atr_min_pct': 0.0007319138225410356, 'sideways_atr_max_pct': 0.12623381848255444, 'sideways_tp_mult': 2.900811327505396, 'sideways_tsl_mult': 0.06790573143479296, 'sideways_time_stop': 239, 'sideways_use_sma': True, 'sideways_use_ema': False, 'sideways_use_atr': False, 'sideways_use_adx': False, 'sideways_use_spike': True, 'sideways_rsi_required': False}.
[I 2025-08-31 11:13:09,687] Trial 868 finished with values: [-1000000000.0, 1000000000.0] and parameters: {'p_sma': 19, 'p_std': 59, 'p_atr': 23, 'p_adx': 23, 'rsi_period': 74, 'ema1': 19, 'ema2': 36, 'slip_atr_k': 0.18207357419104184, 'slip_spread_k': 0.03441821388326774, 'spread_hl_frac': 0.04348264461954089, 'bb_std_mult': 1.262745151285276, 'rsi_os': 39, 'rsi_ob': 84, 'vol_spike': 0.27727507814760305, 'adx_thresh': 23.77672944725352, 'atr_min_pct': 0.011411056537305005, 'atr_max_pct': 0.12378415690477576, 'tp_mult': 2.9995530170990716, 'tsl_mult': 0.6370390817306272, 'strategy': 'breakout', 'time_stop': 145, 'use_sma': False, 'use_atr': False, 'use_adx': True, 'use_ema': True, 'use_spike': False, 'rsi_required': True, 'edge_k': 1.9649574946885362, 'edge_cap': 0.11720566112090373, 'bull_strategy': 'mean_reversion', 'bull_bb_std_mult': 1.381577058364166, 'bull_rsi_os': 50, 'bull_rsi_ob': 66, 'bull_adx_thresh': 28.051156455175747, 'bull_atr_min_pct': 0.0084710043170143, 'bull_atr_max_pct': 0.09134486410916069, 'bull_tp_mult': 2.2382303797038667, 'bull_tsl_mult': 0.8836902040529773, 'bull_time_stop': 271, 'bull_use_sma': True, 'bull_use_ema': False, 'bull_use_atr': False, 'bull_use_adx': False, 'bull_use_spike': True, 'bull_rsi_required': True, 'bear_strategy': 'breakout', 'bear_bb_std_mult': 0.501156553443667, 'bear_rsi_os': 29, 'bear_rsi_ob': 78, 'bear_adx_thresh': 21.708095307841972, 'bear_atr_min_pct': 0.013870485303150937, 'bear_atr_max_pct': 0.1098085206642391, 'bear_tp_mult': 1.8873435563336594, 'bear_tsl_mult': 0.2648376715722036, 'bear_time_stop': 24, 'bear_use_sma': False, 'bear_use_ema': True, 'bear_use_atr': False, 'bear_use_adx': True, 'bear_use_spike': True, 'bear_rsi_required': True, 'sideways_strategy': 'breakout', 'sideways_bb_std_mult': 0.7109213979915348, 'sideways_rsi_os': 29, 'sideways_rsi_ob': 90, 'sideways_adx_thresh': 16.39881252038908, 'sideways_atr_min_pct': 0.002173973267424819, 'sideways_atr_max_pct': 0.129659620558142, 'sideways_tp_mult': 1.2271668069178323, 'sideways_tsl_mult': 0.07779129186833983, 'sideways_time_stop': 209, 'sideways_use_sma': True, 'sideways_use_ema': False, 'sideways_use_atr': True, 'sideways_use_adx': False, 'sideways_use_spike': True, 'sideways_rsi_required': False}.
[I 2025-08-31 11:13:09,923] Trial 865 finished with values: [-1000000000.0, 1000000000.0] and parameters: {'p_sma': 16, 'p_std': 47, 'p_atr': 29, 'p_adx': 28, 'rsi_period': 74, 'ema1': 22, 'ema2': 22, 'slip_atr_k': 0.07637989517049454, 'slip_spread_k': 0.1914719008326785, 'spread_hl_frac': 0.008459212850188205, 'bb_std_mult': 1.41207529645418, 'rsi_os': 41, 'rsi_ob': 62, 'vol_spike': 0.2855319230170476, 'adx_thresh': 23.268706249698543, 'atr_min_pct': 0.012832290450013972, 'atr_max_pct': 0.05974903102806002, 'tp_mult': 1.9283329884403972, 'tsl_mult': 0.06860952624388747, 'strategy': 'breakout', 'time_stop': 145, 'use_sma': False, 'use_atr': False, 'use_adx': False, 'use_ema': True, 'use_spike': False, 'rsi_required': True, 'edge_k': 1.9625364363598858, 'edge_cap': 0.13328308893950802, 'bull_strategy': 'mean_reversion', 'bull_bb_std_mult': 1.1349551151386748, 'bull_rsi_os': 24, 'bull_rsi_ob': 85, 'bull_adx_thresh': 27.778802031292933, 'bull_atr_min_pct': 0.0076622499069686975, 'bull_atr_max_pct': 0.08713460138316621, 'bull_tp_mult': 1.869752732575096, 'bull_tsl_mult': 0.9833569539283324, 'bull_time_stop': 98, 'bull_use_sma': True, 'bull_use_ema': False, 'bull_use_atr': False, 'bull_use_adx': False, 'bull_use_spike': False, 'bull_rsi_required': True, 'bear_strategy': 'breakout', 'bear_bb_std_mult': 2.352800290438582, 'bear_rsi_os': 29, 'bear_rsi_ob': 51, 'bear_adx_thresh': 28.222704867082562, 'bear_atr_min_pct': 0.008108756521076682, 'bear_atr_max_pct': 0.07710152223653854, 'bear_tp_mult': 1.845858979440186, 'bear_tsl_mult': 0.17120671947827137, 'bear_time_stop': 264, 'bear_use_sma': False, 'bear_use_ema': True, 'bear_use_atr': False, 'bear_use_adx': True, 'bear_use_spike': True, 'bear_rsi_required': True, 'sideways_strategy': 'breakout', 'sideways_bb_std_mult': 3.2276363074547367, 'sideways_rsi_os': 34, 'sideways_rsi_ob': 95, 'sideways_adx_thresh': 29.087236315436755, 'sideways_atr_min_pct': 0.0008539371475929204, 'sideways_atr_max_pct': 0.10033166895626087, 'sideways_tp_mult': 2.873266250502022, 'sideways_tsl_mult': 0.38552700775079907, 'sideways_time_stop': 236, 'sideways_use_sma': True, 'sideways_use_ema': True, 'sideways_use_atr': False, 'sideways_use_adx': False, 'sideways_use_spike': True, 'sideways_rsi_required': False}.
[I 2025-08-31 11:13:42,159] Trial 870 finished with values: [-0.009869714142264119, 0.009955671161514992] and parameters: {'p_sma': 12, 'p_std': 46, 'p_atr': 21, 'p_adx': 8, 'rsi_period': 14, 'ema1': 12, 'ema2': 23, 'slip_atr_k': 0.07036830363790049, 'slip_spread_k': 0.5881692828397402, 'spread_hl_frac': 0.012083486775838436, 'bb_std_mult': 1.0309464882706605, 'rsi_os': 12, 'rsi_ob': 81, 'vol_spike': 0.27875889553447347, 'adx_thresh': 23.71927429097795, 'atr_min_pct': 0.011297977364261452, 'atr_max_pct': 0.021462179880711522, 'tp_mult': 2.9234282420363744, 'tsl_mult': 0.07361581155831681, 'strategy': 'breakout', 'time_stop': 146, 'use_sma': False, 'use_atr': False, 'use_adx': False, 'use_ema': False, 'use_spike': True, 'rsi_required': True, 'edge_k': 1.913203166950931, 'edge_cap': 0.16637690346214162, 'bull_strategy': 'mean_reversion', 'bull_bb_std_mult': 1.2717127513795279, 'bull_rsi_os': 7, 'bull_rsi_ob': 66, 'bull_adx_thresh': 30.22654722460432, 'bull_atr_min_pct': 0.006457147788360782, 'bull_atr_max_pct': 0.08424808894003599, 'bull_tp_mult': 2.8619673483060835, 'bull_tsl_mult': 0.9328384162067206, 'bull_time_stop': 101, 'bull_use_sma': True, 'bull_use_ema': True, 'bull_use_atr': False, 'bull_use_adx': False, 'bull_use_spike': True, 'bull_rsi_required': True, 'bear_strategy': 'breakout', 'bear_bb_std_mult': 2.440893565232176, 'bear_rsi_os': 26, 'bear_rsi_ob': 86, 'bear_adx_thresh': 20.94986485369195, 'bear_atr_min_pct': 0.005245767555209497, 'bear_atr_max_pct': 0.11345345261738003, 'bear_tp_mult': 2.3826451269414104, 'bear_tsl_mult': 0.5211050833289712, 'bear_time_stop': 245, 'bear_use_sma': True, 'bear_use_ema': True, 'bear_use_atr': True, 'bear_use_adx': True, 'bear_use_spike': True, 'bear_rsi_required': True, 'sideways_strategy': 'breakout', 'sideways_bb_std_mult': 0.7193633600914194, 'sideways_rsi_os': 25, 'sideways_rsi_ob': 90, 'sideways_adx_thresh': 29.101266948324454, 'sideways_atr_min_pct': 0.002117922988092268, 'sideways_atr_max_pct': 0.10211833819003284, 'sideways_tp_mult': 2.81225363215422, 'sideways_tsl_mult': 0.9426865221365445, 'sideways_time_stop': 223, 'sideways_use_sma': False, 'sideways_use_ema': True, 'sideways_use_atr': True, 'sideways_use_adx': True, 'sideways_use_spike': False, 'sideways_rsi_required': False}.
[I 2025-08-31 11:13:42,370] Trial 871 finished with values: [-0.08559538277321133, 0.08552789315302044] and parameters: {'p_sma': 44, 'p_std': 45, 'p_atr': 29, 'p_adx': 8, 'rsi_period': 18, 'ema1': 26, 'ema2': 31, 'slip_atr_k': 0.1844000030907939, 'slip_spread_k': 0.8725251795979614, 'spread_hl_frac': 0.01205845758288218, 'bb_std_mult': 2.1589289556663886, 'rsi_os': 37, 'rsi_ob': 82, 'vol_spike': 0.061871049198581926, 'adx_thresh': 10.914500917649747, 'atr_min_pct': 0.012053849575994481, 'atr_max_pct': 0.12263473168902156, 'tp_mult': 1.930065348993207, 'tsl_mult': 0.7444234935543387, 'strategy': 'breakout', 'time_stop': 146, 'use_sma': False, 'use_atr': False, 'use_adx': False, 'use_ema': False, 'use_spike': True, 'rsi_required': True, 'edge_k': 1.898825095689204, 'edge_cap': 0.16418655435007262, 'bull_strategy': 'mean_reversion', 'bull_bb_std_mult': 1.2606956774162228, 'bull_rsi_os': 26, 'bull_rsi_ob': 52, 'bull_adx_thresh': 21.809202446825076, 'bull_atr_min_pct': 0.006728630090657038, 'bull_atr_max_pct': 0.08479633425178447, 'bull_tp_mult': 2.1390137835588665, 'bull_tsl_mult': 0.9299184037112083, 'bull_time_stop': 117, 'bull_use_sma': True, 'bull_use_ema': True, 'bull_use_atr': False, 'bull_use_adx': False, 'bull_use_spike': False, 'bull_rsi_required': True, 'bear_strategy': 'breakout', 'bear_bb_std_mult': 1.680115032706928, 'bear_rsi_os': 27, 'bear_rsi_ob': 80, 'bear_adx_thresh': 22.33054871953554, 'bear_atr_min_pct': 0.004008987242901146, 'bear_atr_max_pct': 0.10394908982942279, 'bear_tp_mult': 2.391218490186546, 'bear_tsl_mult': 0.45372622980337385, 'bear_time_stop': 104, 'bear_use_sma': True, 'bear_use_ema': True, 'bear_use_atr': True, 'bear_use_adx': True, 'bear_use_spike': True, 'bear_rsi_required': True, 'sideways_strategy': 'breakout', 'sideways_bb_std_mult': 1.2794961745674753, 'sideways_rsi_os': 48, 'sideways_rsi_ob': 70, 'sideways_adx_thresh': 29.274983571329575, 'sideways_atr_min_pct': 0.0014837098026420537, 'sideways_atr_max_pct': 0.10165535593785971, 'sideways_tp_mult': 2.804539747620743, 'sideways_tsl_mult': 0.9294187988752283, 'sideways_time_stop': 300, 'sideways_use_sma': False, 'sideways_use_ema': True, 'sideways_use_atr': False, 'sideways_use_adx': True, 'sideways_use_spike': False, 'sideways_rsi_required': False}.
[I 2025-08-31 11:13:42,395] Trial 869 finished with values: [-0.009802077852820945, 0.010148097775636161] and parameters: {'p_sma': 9, 'p_std': 45, 'p_atr': 23, 'p_adx': 18, 'rsi_period': 25, 'ema1': 9, 'ema2': 38, 'slip_atr_k': 0.014174146332100485, 'slip_spread_k': 0.136676375353269, 'spread_hl_frac': 0.008601048657817375, 'bb_std_mult': 1.3568782026374056, 'rsi_os': 43, 'rsi_ob': 54, 'vol_spike': 0.2794461537766938, 'adx_thresh': 23.79769616693035, 'atr_min_pct': 0.011210057995031527, 'atr_max_pct': 0.023415871325762533, 'tp_mult': 2.8995368133582304, 'tsl_mult': 0.6313962135252856, 'strategy': 'breakout', 'time_stop': 144, 'use_sma': False, 'use_atr': False, 'use_adx': False, 'use_ema': False, 'use_spike': True, 'rsi_required': True, 'edge_k': 1.8986148528853097, 'edge_cap': 0.11266709990209754, 'bull_strategy': 'mean_reversion', 'bull_bb_std_mult': 1.268279360023124, 'bull_rsi_os': 26, 'bull_rsi_ob': 66, 'bull_adx_thresh': 30.20929663093344, 'bull_atr_min_pct': 0.008444929327071476, 'bull_atr_max_pct': 0.08443636267342049, 'bull_tp_mult': 2.2572219283346735, 'bull_tsl_mult': 0.926480107279758, 'bull_time_stop': 74, 'bull_use_sma': True, 'bull_use_ema': True, 'bull_use_atr': False, 'bull_use_adx': False, 'bull_use_spike': True, 'bull_rsi_required': True, 'bear_strategy': 'breakout', 'bear_bb_std_mult': 2.441710794965817, 'bear_rsi_os': 30, 'bear_rsi_ob': 88, 'bear_adx_thresh': 25.3048777650225, 'bear_atr_min_pct': 0.00923617261011682, 'bear_atr_max_pct': 0.10409473937355103, 'bear_tp_mult': 1.8498611487752712, 'bear_tsl_mult': 0.520909182892317, 'bear_time_stop': 26, 'bear_use_sma': True, 'bear_use_ema': True, 'bear_use_atr': True, 'bear_use_adx': True, 'bear_use_spike': True, 'bear_rsi_required': True, 'sideways_strategy': 'breakout', 'sideways_bb_std_mult': 2.9671774743429555, 'sideways_rsi_os': 52, 'sideways_rsi_ob': 70, 'sideways_adx_thresh': 15.154855529820594, 'sideways_atr_min_pct': 0.0023114000539819733, 'sideways_atr_max_pct': 0.10274848509882578, 'sideways_tp_mult': 2.877510066163146, 'sideways_tsl_mult': 0.3781740063889529, 'sideways_time_stop': 240, 'sideways_use_sma': False, 'sideways_use_ema': True, 'sideways_use_atr': True, 'sideways_use_adx': False, 'sideways_use_spike': True, 'sideways_rsi_required': False}.
[I 2025-08-31 11:13:42,552] Trial 872 finished with values: [-0.0676894456491971, 0.06754896664134975] and parameters: {'p_sma': 56, 'p_std': 48, 'p_atr': 21, 'p_adx': 8, 'rsi_period': 15, 'ema1': 17, 'ema2': 49, 'slip_atr_k': 0.06970047038359062, 'slip_spread_k': 0.8755508838141302, 'spread_hl_frac': 0.0024386977839850298, 'bb_std_mult': 1.0362788457458185, 'rsi_os': 27, 'rsi_ob': 81, 'vol_spike': 0.2789799146742327, 'adx_thresh': 25.0882509598259, 'atr_min_pct': 0.012234960269262893, 'atr_max_pct': 0.14465908119280613, 'tp_mult': 2.925076054470381, 'tsl_mult': 0.7397503495971327, 'strategy': 'breakout', 'time_stop': 155, 'use_sma': False, 'use_atr': False, 'use_adx': False, 'use_ema': False, 'use_spike': True, 'rsi_required': True, 'edge_k': 1.901650252945716, 'edge_cap': 0.5959232876294934, 'bull_strategy': 'mean_reversion', 'bull_bb_std_mult': 1.2477270900093507, 'bull_rsi_os': 27, 'bull_rsi_ob': 62, 'bull_adx_thresh': 5.768304223411327, 'bull_atr_min_pct': 0.006805158145257416, 'bull_atr_max_pct': 0.0842486278791311, 'bull_tp_mult': 1.7738954060669962, 'bull_tsl_mult': 0.933170907095659, 'bull_time_stop': 74, 'bull_use_sma': True, 'bull_use_ema': True, 'bull_use_atr': True, 'bull_use_adx': False, 'bull_use_spike': True, 'bull_rsi_required': True, 'bear_strategy': 'breakout', 'bear_bb_std_mult': 2.47918330861927, 'bear_rsi_os': 26, 'bear_rsi_ob': 92, 'bear_adx_thresh': 25.292089465677314, 'bear_atr_min_pct': 0.005311115873120942, 'bear_atr_max_pct': 0.11383331742723621, 'bear_tp_mult': 2.3957378972169945, 'bear_tsl_mult': 0.4814945852668938, 'bear_time_stop': 54, 'bear_use_sma': True, 'bear_use_ema': True, 'bear_use_atr': True, 'bear_use_adx': True, 'bear_use_spike': True, 'bear_rsi_required': True, 'sideways_strategy': 'breakout', 'sideways_bb_std_mult': 1.877942552313855, 'sideways_rsi_os': 43, 'sideways_rsi_ob': 55, 'sideways_adx_thresh': 21.883534512110508, 'sideways_atr_min_pct': 0.0015342232292717842, 'sideways_atr_max_pct': 0.10339902372079077, 'sideways_tp_mult': 2.5603334913562374, 'sideways_tsl_mult': 0.12459729371510544, 'sideways_time_stop': 222, 'sideways_use_sma': False, 'sideways_use_ema': True, 'sideways_use_atr': True, 'sideways_use_adx': True, 'sideways_use_spike': False, 'sideways_rsi_required': False}.
