[I 2025-08-31 10:31:04,306] Trial 558 finished with values: [-1000000000.0, 1000000000.0] and parameters: {'p_sma': 10, 'p_std': 49, 'p_atr': 18, 'p_adx': 9, 'rsi_period': 24, 'ema1': 30, 'ema2': 38, 'slip_atr_k': 0.18502059693309586, 'slip_spread_k': 0.12068676258218207, 'spread_hl_frac': 0.009342078113500192, 'bb_std_mult': 1.186503410308471, 'rsi_os': 41, 'rsi_ob': 83, 'vol_spike': 0.2940404164863082, 'adx_thresh': 23.09455539862614, 'atr_min_pct': 0.01127743484776592, 'atr_max_pct': 0.11495983267294634, 'tp_mult': 2.943627659577169, 'tsl_mult': 0.1316477301710276, 'strategy': 'breakout', 'time_stop': 185, 'use_sma': False, 'use_atr': False, 'use_adx': False, 'use_ema': True, 'use_spike': False, 'rsi_required': True, 'edge_k': 0.24527041345683387, 'edge_cap': 0.1239343565751926, 'bull_strategy': 'mean_reversion', 'bull_bb_std_mult': 2.496196117617014, 'bull_rsi_os': 25, 'bull_rsi_ob': 64, 'bull_adx_thresh': 30.131072938494384, 'bull_atr_min_pct': 0.009711379830800844, 'bull_atr_max_pct': 0.09201075151617763, 'bull_tp_mult': 2.298722910854985, 'bull_tsl_mult': 0.9436574870659383, 'bull_time_stop': 55, 'bull_use_sma': True, 'bull_use_ema': False, 'bull_use_atr': False, 'bull_use_adx': False, 'bull_use_spike': True, 'bull_rsi_required': False, 'bear_strategy': 'breakout', 'bear_bb_std_mult': 2.9222786724530616, 'bear_rsi_os': 26, 'bear_rsi_ob': 86, 'bear_adx_thresh': 7.412409355795916, 'bear_atr_min_pct': 0.0057949954933547675, 'bear_atr_max_pct': 0.10779204767749775, 'bear_tp_mult': 1.9456035270647507, 'bear_tsl_mult': 0.3586846062357065, 'bear_time_stop': 189, 'bear_use_sma': False, 'bear_use_ema': True, 'bear_use_atr': False, 'bear_use_adx': True, 'bear_use_spike': True, 'bear_rsi_required': True, 'sideways_strategy': 'breakout', 'sideways_bb_std_mult': 1.6979473289477007, 'sideways_rsi_os': 10, 'sideways_rsi_ob': 95, 'sideways_adx_thresh': 29.211789862942762, 'sideways_atr_min_pct': 0.024876853652509353, 'sideways_atr_max_pct': 0.010082123266107898, 'sideways_tp_mult': 2.8214518161947035, 'sideways_tsl_mult': 0.5360622337836699, 'sideways_time_stop': 220, 'sideways_use_sma': True, 'sideways_use_ema': True, 'sideways_use_atr': True, 'sideways_use_adx': False, 'sideways_use_spike': True, 'sideways_rsi_required': False}.
[I 2025-08-31 10:31:04,438] Trial 560 finished with values: [-1000000000.0, 1000000000.0] and parameters: {'p_sma': 10, 'p_std': 49, 'p_atr': 7, 'p_adx': 20, 'rsi_period': 7, 'ema1': 30, 'ema2': 38, 'slip_atr_k': 0.04674585952513381, 'slip_spread_k': 0.08927942805378238, 'spread_hl_frac': 0.022419181277816152, 'bb_std_mult': 3.5318790169603727, 'rsi_os': 41, 'rsi_ob': 81, 'vol_spike': 0.2893704038480487, 'adx_thresh': 23.151630555292815, 'atr_min_pct': 0.011383862004624587, 'atr_max_pct': 0.11576682010500804, 'tp_mult': 2.949919737476092, 'tsl_mult': 0.045622620489544796, 'strategy': 'mean_reversion', 'time_stop': 133, 'use_sma': False, 'use_atr': False, 'use_adx': False, 'use_ema': True, 'use_spike': False, 'rsi_required': True, 'edge_k': 1.8793852652028802, 'edge_cap': 0.11992253681125625, 'bull_strategy': 'mean_reversion', 'bull_bb_std_mult': 2.845441126942565, 'bull_rsi_os': 28, 'bull_rsi_ob': 64, 'bull_adx_thresh': 14.183370543861471, 'bull_atr_min_pct': 0.00719530926218392, 'bull_atr_max_pct': 0.08834122059610713, 'bull_tp_mult': 2.1457875650825438, 'bull_tsl_mult': 0.9828714733215883, 'bull_time_stop': 52, 'bull_use_sma': True, 'bull_use_ema': True, 'bull_use_atr': True, 'bull_use_adx': False, 'bull_use_spike': True, 'bull_rsi_required': False, 'bear_strategy': 'mean_reversion', 'bear_bb_std_mult': 2.9661208698975017, 'bear_rsi_os': 30, 'bear_rsi_ob': 80, 'bear_adx_thresh': 7.511732733514773, 'bear_atr_min_pct': 0.009208762934671412, 'bear_atr_max_pct': 0.11267927030154073, 'bear_tp_mult': 1.967834189698447, 'bear_tsl_mult': 0.13860214944578703, 'bear_time_stop': 189, 'bear_use_sma': False, 'bear_use_ema': True, 'bear_use_atr': False, 'bear_use_adx': True, 'bear_use_spike': True, 'bear_rsi_required': True, 'sideways_strategy': 'mean_reversion', 'sideways_bb_std_mult': 0.8426247051245525, 'sideways_rsi_os': 10, 'sideways_rsi_ob': 95, 'sideways_adx_thresh': 29.112803594282443, 'sideways_atr_min_pct': 0.017572171612350057, 'sideways_atr_max_pct': 0.09736538208782648, 'sideways_tp_mult': 2.826045438938428, 'sideways_tsl_mult': 0.04734697289424468, 'sideways_time_stop': 287, 'sideways_use_sma': True, 'sideways_use_ema': False, 'sideways_use_atr': True, 'sideways_use_adx': False, 'sideways_use_spike': True, 'sideways_rsi_required': True}.
[I 2025-08-31 10:31:04,791] Trial 557 finished with values: [-1000000000.0, 1000000000.0] and parameters: {'p_sma': 11, 'p_std': 46, 'p_atr': 28, 'p_adx': 11, 'rsi_period': 22, 'ema1': 16, 'ema2': 18, 'slip_atr_k': 0.05632024513682374, 'slip_spread_k': 0.17615760594680432, 'spread_hl_frac': 0.009230324480506636, 'bb_std_mult': 1.1485365250008044, 'rsi_os': 41, 'rsi_ob': 83, 'vol_spike': 0.2994146232657518, 'adx_thresh': 23.091938414091192, 'atr_min_pct': 0.003169838259053856, 'atr_max_pct': 0.11488547638011923, 'tp_mult': 2.9452834553755545, 'tsl_mult': 0.23852044808672157, 'strategy': 'breakout', 'time_stop': 247, 'use_sma': False, 'use_atr': False, 'use_adx': False, 'use_ema': True, 'use_spike': False, 'rsi_required': True, 'edge_k': 1.8546104173583093, 'edge_cap': 0.12619462612898552, 'bull_strategy': 'mean_reversion', 'bull_bb_std_mult': 1.921850824853191, 'bull_rsi_os': 25, 'bull_rsi_ob': 65, 'bull_adx_thresh': 13.179751838958412, 'bull_atr_min_pct': 0.0054171935112619736, 'bull_atr_max_pct': 0.09153112164887543, 'bull_tp_mult': 2.252713209332174, 'bull_tsl_mult': 0.947760879397681, 'bull_time_stop': 53, 'bull_use_sma': True, 'bull_use_ema': False, 'bull_use_atr': False, 'bull_use_adx': False, 'bull_use_spike': True, 'bull_rsi_required': True, 'bear_strategy': 'breakout', 'bear_bb_std_mult': 2.929616071265293, 'bear_rsi_os': 27, 'bear_rsi_ob': 80, 'bear_adx_thresh': 22.787017448774975, 'bear_atr_min_pct': 0.005704703904794531, 'bear_atr_max_pct': 0.10880977482231598, 'bear_tp_mult': 2.0258694424157926, 'bear_tsl_mult': 0.8450056039835732, 'bear_time_stop': 259, 'bear_use_sma': False, 'bear_use_ema': True, 'bear_use_atr': False, 'bear_use_adx': True, 'bear_use_spike': True, 'bear_rsi_required': True, 'sideways_strategy': 'breakout', 'sideways_bb_std_mult': 0.9924536386104306, 'sideways_rsi_os': 10, 'sideways_rsi_ob': 95, 'sideways_adx_thresh': 30.653356381505727, 'sideways_atr_min_pct': 0.0012254929658204784, 'sideways_atr_max_pct': 0.11504014941976545, 'sideways_tp_mult': 2.9918698976918554, 'sideways_tsl_mult': 0.05247673613980455, 'sideways_time_stop': 220, 'sideways_use_sma': True, 'sideways_use_ema': True, 'sideways_use_atr': True, 'sideways_use_adx': False, 'sideways_use_spike': True, 'sideways_rsi_required': False}.
[I 2025-08-31 10:31:38,980] Trial 561 finished with values: [-1000000000.0, 1000000000.0] and parameters: {'p_sma': 10, 'p_std': 50, 'p_atr': 18, 'p_adx': 26, 'rsi_period': 35, 'ema1': 16, 'ema2': 39, 'slip_atr_k': 0.10219640582970316, 'slip_spread_k': 0.12088788116902034, 'spread_hl_frac': 0.010502135612432635, 'bb_std_mult': 1.3543050433190342, 'rsi_os': 38, 'rsi_ob': 83, 'vol_spike': 0.29133384563746983, 'adx_thresh': 22.603275605038615, 'atr_min_pct': 0.011995313805784351, 'atr_max_pct': 0.11952501946919465, 'tp_mult': 2.941592655867542, 'tsl_mult': 0.04542203424542703, 'strategy': 'breakout', 'time_stop': 200, 'use_sma': False, 'use_atr': False, 'use_adx': True, 'use_ema': True, 'use_spike': False, 'rsi_required': True, 'edge_k': 0.26555318325113997, 'edge_cap': 0.44123174842844276, 'bull_strategy': 'mean_reversion', 'bull_bb_std_mult': 2.648341690387035, 'bull_rsi_os': 25, 'bull_rsi_ob': 65, 'bull_adx_thresh': 29.2871665938032, 'bull_atr_min_pct': 0.00789684850652622, 'bull_atr_max_pct': 0.08990974118867764, 'bull_tp_mult': 2.2988831586060376, 'bull_tsl_mult': 0.9829543939015497, 'bull_time_stop': 63, 'bull_use_sma': True, 'bull_use_ema': False, 'bull_use_atr': False, 'bull_use_adx': True, 'bull_use_spike': True, 'bull_rsi_required': False, 'bear_strategy': 'breakout', 'bear_bb_std_mult': 2.947194005075433, 'bear_rsi_os': 30, 'bear_rsi_ob': 81, 'bear_adx_thresh': 5.469967209344311, 'bear_atr_min_pct': 0.007090712788051451, 'bear_atr_max_pct': 0.11263773207891767, 'bear_tp_mult': 1.9556248667757785, 'bear_tsl_mult': 0.7680213219119076, 'bear_time_stop': 259, 'bear_use_sma': False, 'bear_use_ema': False, 'bear_use_atr': True, 'bear_use_adx': True, 'bear_use_spike': True, 'bear_rsi_required': True, 'sideways_strategy': 'breakout', 'sideways_bb_std_mult': 3.322326012252348, 'sideways_rsi_os': 23, 'sideways_rsi_ob': 95, 'sideways_adx_thresh': 29.431049529965478, 'sideways_atr_min_pct': 0.024778162593525863, 'sideways_atr_max_pct': 0.010051909058576142, 'sideways_tp_mult': 2.831032014798268, 'sideways_tsl_mult': 0.5418917858655453, 'sideways_time_stop': 15, 'sideways_use_sma': False, 'sideways_use_ema': True, 'sideways_use_atr': True, 'sideways_use_adx': True, 'sideways_use_spike': True, 'sideways_rsi_required': False}.
[I 2025-08-31 10:31:39,239] Trial 563 finished with values: [-1000000000.0, 1000000000.0] and parameters: {'p_sma': 14, 'p_std': 47, 'p_atr': 21, 'p_adx': 8, 'rsi_period': 34, 'ema1': 16, 'ema2': 59, 'slip_atr_k': 0.24796356052201596, 'slip_spread_k': 0.1661173463340238, 'spread_hl_frac': 0.0010248173485896232, 'bb_std_mult': 3.5905315427360622, 'rsi_os': 38, 'rsi_ob': 83, 'vol_spike': 0.28300232027305455, 'adx_thresh': 26.54001862392279, 'atr_min_pct': 0.012235066522332012, 'atr_max_pct': 0.025817178198356404, 'tp_mult': 1.7147275770846548, 'tsl_mult': 0.20189564700439094, 'strategy': 'breakout', 'time_stop': 285, 'use_sma': False, 'use_atr': False, 'use_adx': True, 'use_ema': True, 'use_spike': True, 'rsi_required': False, 'edge_k': 0.28731167008159275, 'edge_cap': 0.14311217474908694, 'bull_strategy': 'mean_reversion', 'bull_bb_std_mult': 1.6994451723325517, 'bull_rsi_os': 26, 'bull_rsi_ob': 69, 'bull_adx_thresh': 29.308342837519113, 'bull_atr_min_pct': 0.00794372833354144, 'bull_atr_max_pct': 0.08543344525833402, 'bull_tp_mult': 2.2415055583458, 'bull_tsl_mult': 0.9791685814313882, 'bull_time_stop': 74, 'bull_use_sma': False, 'bull_use_ema': False, 'bull_use_atr': False, 'bull_use_adx': True, 'bull_use_spike': False, 'bull_rsi_required': True, 'bear_strategy': 'breakout', 'bear_bb_std_mult': 1.6917599238869492, 'bear_rsi_os': 28, 'bear_rsi_ob': 71, 'bear_adx_thresh': 6.467086715745523, 'bear_atr_min_pct': 0.007018064338987535, 'bear_atr_max_pct': 0.09674528777753598, 'bear_tp_mult': 2.0191414809238117, 'bear_tsl_mult': 0.8404304357621974, 'bear_time_stop': 260, 'bear_use_sma': True, 'bear_use_ema': False, 'bear_use_atr': True, 'bear_use_adx': False, 'bear_use_spike': True, 'bear_rsi_required': True, 'sideways_strategy': 'breakout', 'sideways_bb_std_mult': 2.7731713629191335, 'sideways_rsi_os': 25, 'sideways_rsi_ob': 93, 'sideways_adx_thresh': 8.787235897114451, 'sideways_atr_min_pct': 0.010398873328192395, 'sideways_atr_max_pct': 0.11255189164825447, 'sideways_tp_mult': 2.879159139142274, 'sideways_tsl_mult': 0.2552355214977763, 'sideways_time_stop': 204, 'sideways_use_sma': False, 'sideways_use_ema': True, 'sideways_use_atr': False, 'sideways_use_adx': True, 'sideways_use_spike': True, 'sideways_rsi_required': False}.
[I 2025-08-31 10:31:39,347] Trial 564 finished with values: [-1000000000.0, 1000000000.0] and parameters: {'p_sma': 13, 'p_std': 51, 'p_atr': 28, 'p_adx': 13, 'rsi_period': 45, 'ema1': 18, 'ema2': 39, 'slip_atr_k': 0.19472361874102095, 'slip_spread_k': 0.208178651899236, 'spread_hl_frac': 0.0012857313470038684, 'bb_std_mult': 1.3709716388549658, 'rsi_os': 39, 'rsi_ob': 86, 'vol_spike': 0.2837111210982759, 'adx_thresh': 23.963854522400254, 'atr_min_pct': 0.012069599456378484, 'atr_max_pct': 0.0806987670928732, 'tp_mult': 1.7086895314948092, 'tsl_mult': 0.0753385520641838, 'strategy': 'breakout', 'time_stop': 151, 'use_sma': False, 'use_atr': False, 'use_adx': True, 'use_ema': True, 'use_spike': True, 'rsi_required': False, 'edge_k': 1.9359128896649065, 'edge_cap': 0.08176770639319848, 'bull_strategy': 'mean_reversion', 'bull_bb_std_mult': 1.1462057134407697, 'bull_rsi_os': 26, 'bull_rsi_ob': 66, 'bull_adx_thresh': 11.03197582431015, 'bull_atr_min_pct': 0.007837452382986658, 'bull_atr_max_pct': 0.0857677020751896, 'bull_tp_mult': 2.213136771146967, 'bull_tsl_mult': 0.9836346207062, 'bull_time_stop': 64, 'bull_use_sma': False, 'bull_use_ema': False, 'bull_use_atr': False, 'bull_use_adx': True, 'bull_use_spike': False, 'bull_rsi_required': True, 'bear_strategy': 'breakout', 'bear_bb_std_mult': 1.7129774646634452, 'bear_rsi_os': 28, 'bear_rsi_ob': 83, 'bear_adx_thresh': 23.526225229251086, 'bear_atr_min_pct': 0.00690105187191248, 'bear_atr_max_pct': 0.10499718511530891, 'bear_tp_mult': 2.1047460168981122, 'bear_tsl_mult': 0.4590463210342831, 'bear_time_stop': 259, 'bear_use_sma': True, 'bear_use_ema': False, 'bear_use_atr': True, 'bear_use_adx': False, 'bear_use_spike': True, 'bear_rsi_required': True, 'sideways_strategy': 'breakout', 'sideways_bb_std_mult': 0.7762772058387004, 'sideways_rsi_os': 23, 'sideways_rsi_ob': 93, 'sideways_adx_thresh': 29.45828950203288, 'sideways_atr_min_pct': 0.0015055662818844317, 'sideways_atr_max_pct': 0.09428674880007784, 'sideways_tp_mult': 2.8640939248111073, 'sideways_tsl_mult': 0.083766128866846, 'sideways_time_stop': 136, 'sideways_use_sma': False, 'sideways_use_ema': True, 'sideways_use_atr': False, 'sideways_use_adx': True, 'sideways_use_spike': True, 'sideways_rsi_required': False}.
[I 2025-08-31 10:31:39,489] Trial 562 finished with values: [-0.030120243734924945, 0.030141348925645847] and parameters: {'p_sma': 14, 'p_std': 47, 'p_atr': 21, 'p_adx': 26, 'rsi_period': 8, 'ema1': 18, 'ema2': 39, 'slip_atr_k': 0.24761163691282478, 'slip_spread_k': 0.1623488958041442, 'spread_hl_frac': 0.04985077106476561, 'bb_std_mult': 1.3554053880283417, 'rsi_os': 38, 'rsi_ob': 83, 'vol_spike': 0.28642511510063173, 'adx_thresh': 22.30356507288511, 'atr_min_pct': 0.01194894009243857, 'atr_max_pct': 0.11883104136610234, 'tp_mult': 2.8520368903649036, 'tsl_mult': 0.24111516299273728, 'strategy': 'breakout', 'time_stop': 133, 'use_sma': False, 'use_atr': False, 'use_adx': True, 'use_ema': True, 'use_spike': True, 'rsi_required': False, 'edge_k': 1.904205964789257, 'edge_cap': 0.5964607229715885, 'bull_strategy': 'mean_reversion', 'bull_bb_std_mult': 1.7553469478770194, 'bull_rsi_os': 28, 'bull_rsi_ob': 65, 'bull_adx_thresh': 25.068808919633952, 'bull_atr_min_pct': 0.007815604522795885, 'bull_atr_max_pct': 0.08700611214315056, 'bull_tp_mult': 2.2478444039263414, 'bull_tsl_mult': 0.9826280884272313, 'bull_time_stop': 87, 'bull_use_sma': True, 'bull_use_ema': True, 'bull_use_atr': False, 'bull_use_adx': True, 'bull_use_spike': False, 'bull_rsi_required': True, 'bear_strategy': 'breakout', 'bear_bb_std_mult': 0.6972213579394051, 'bear_rsi_os': 28, 'bear_rsi_ob': 82, 'bear_adx_thresh': 22.443358623767164, 'bear_atr_min_pct': 0.007002752474663755, 'bear_atr_max_pct': 0.09297125214931318, 'bear_tp_mult': 1.984433806455046, 'bear_tsl_mult': 0.4373531557788905, 'bear_time_stop': 259, 'bear_use_sma': False, 'bear_use_ema': False, 'bear_use_atr': True, 'bear_use_adx': True, 'bear_use_spike': True, 'bear_rsi_required': True, 'sideways_strategy': 'breakout', 'sideways_bb_std_mult': 0.8287890750669867, 'sideways_rsi_os': 23, 'sideways_rsi_ob': 93, 'sideways_adx_thresh': 29.159143517317215, 'sideways_atr_min_pct': 0.0012500314419017183, 'sideways_atr_max_pct': 0.0931563088293901, 'sideways_tp_mult': 2.8589467224926044, 'sideways_tsl_mult': 0.08530016954833428, 'sideways_time_stop': 148, 'sideways_use_sma': False, 'sideways_use_ema': True, 'sideways_use_atr': False, 'sideways_use_adx': True, 'sideways_use_spike': True, 'sideways_rsi_required': False}.
[I 2025-08-31 10:32:11,577] Trial 567 finished with values: [-1000000000.0, 1000000000.0] and parameters: {'p_sma': 7, 'p_std': 48, 'p_atr': 22, 'p_adx': 9, 'rsi_period': 27, 'ema1': 13, 'ema2': 14, 'slip_atr_k': 0.018830939129665533, 'slip_spread_k': 0.04756542785156781, 'spread_hl_frac': 0.04956076239441346, 'bb_std_mult': 1.2445197267524595, 'rsi_os': 45, 'rsi_ob': 85, 'vol_spike': 0.293825039250436, 'adx_thresh': 20.849380896362312, 'atr_min_pct': 0.009656885511359351, 'atr_max_pct': 0.11936956652921528, 'tp_mult': 2.8582497297193807, 'tsl_mult': 0.061270287199022555, 'strategy': 'mean_reversion', 'time_stop': 137, 'use_sma': False, 'use_atr': True, 'use_adx': False, 'use_ema': True, 'use_spike': False, 'rsi_required': True, 'edge_k': 1.9106742580456264, 'edge_cap': 0.09607192822531654, 'bull_strategy': 'mean_reversion', 'bull_bb_std_mult': 1.7662773591430327, 'bull_rsi_os': 27, 'bull_rsi_ob': 45, 'bull_adx_thresh': 30.279723636877552, 'bull_atr_min_pct': 0.008950072771911033, 'bull_atr_max_pct': 0.08008111753756833, 'bull_tp_mult': 2.0782752731527823, 'bull_tsl_mult': 0.9521896611511107, 'bull_time_stop': 88, 'bull_use_sma': True, 'bull_use_ema': True, 'bull_use_atr': False, 'bull_use_adx': False, 'bull_use_spike': False, 'bull_rsi_required': True, 'bear_strategy': 'mean_reversion', 'bear_bb_std_mult': 2.8417258082626833, 'bear_rsi_os': 29, 'bear_rsi_ob': 77, 'bear_adx_thresh': 22.016135710960086, 'bear_atr_min_pct': 0.008013363028417304, 'bear_atr_max_pct': 0.10501860976572513, 'bear_tp_mult': 2.1451525862043863, 'bear_tsl_mult': 0.43024905929096696, 'bear_time_stop': 84, 'bear_use_sma': False, 'bear_use_ema': True, 'bear_use_atr': False, 'bear_use_adx': True, 'bear_use_spike': True, 'bear_rsi_required': False, 'sideways_strategy': 'mean_reversion', 'sideways_bb_std_mult': 1.9420410399627503, 'sideways_rsi_os': 7, 'sideways_rsi_ob': 91, 'sideways_adx_thresh': 17.247263673652117, 'sideways_atr_min_pct': 6.123337343143893e-05, 'sideways_atr_max_pct': 0.09973211137756433, 'sideways_tp_mult': 2.792678818677771, 'sideways_tsl_mult': 0.18061801199623662, 'sideways_time_stop': 146, 'sideways_use_sma': True, 'sideways_use_ema': False, 'sideways_use_atr': False, 'sideways_use_adx': False, 'sideways_use_spike': True, 'sideways_rsi_required': True}.
[I 2025-08-31 10:32:12,001] Trial 566 finished with values: [-1000000000.0, 1000000000.0] and parameters: {'p_sma': 7, 'p_std': 48, 'p_atr': 26, 'p_adx': 10, 'rsi_period': 30, 'ema1': 17, 'ema2': 23, 'slip_atr_k': 0.07936771949653593, 'slip_spread_k': 0.10153978092079413, 'spread_hl_frac': 0.01187173328510768, 'bb_std_mult': 1.255450510571998, 'rsi_os': 44, 'rsi_ob': 85, 'vol_spike': 0.28834994029989225, 'adx_thresh': 21.945113166286355, 'atr_min_pct': 0.009942836320636738, 'atr_max_pct': 0.1225013343140673, 'tp_mult': 2.8600777643632864, 'tsl_mult': 0.06949332946832998, 'strategy': 'mean_reversion', 'time_stop': 298, 'use_sma': False, 'use_atr': True, 'use_adx': False, 'use_ema': True, 'use_spike': False, 'rsi_required': True, 'edge_k': 1.9046911352178173, 'edge_cap': 0.967565205180595, 'bull_strategy': 'mean_reversion', 'bull_bb_std_mult': 0.8429061371369191, 'bull_rsi_os': 27, 'bull_rsi_ob': 47, 'bull_adx_thresh': 6.796966293483965, 'bull_atr_min_pct': 0.00870805941244572, 'bull_atr_max_pct': 0.08002214060251986, 'bull_tp_mult': 2.0655366067184437, 'bull_tsl_mult': 0.8824220710134485, 'bull_time_stop': 99, 'bull_use_sma': True, 'bull_use_ema': True, 'bull_use_atr': False, 'bull_use_adx': False, 'bull_use_spike': False, 'bull_rsi_required': True, 'bear_strategy': 'mean_reversion', 'bear_bb_std_mult': 2.8532850722324197, 'bear_rsi_os': 29, 'bear_rsi_ob': 77, 'bear_adx_thresh': 21.773573721741005, 'bear_atr_min_pct': 0.007953474248661517, 'bear_atr_max_pct': 0.10541254533002796, 'bear_tp_mult': 2.1555800131638456, 'bear_tsl_mult': 0.6746139500103303, 'bear_time_stop': 265, 'bear_use_sma': False, 'bear_use_ema': True, 'bear_use_atr': False, 'bear_use_adx': True, 'bear_use_spike': True, 'bear_rsi_required': False, 'sideways_strategy': 'mean_reversion', 'sideways_bb_std_mult': 2.845577120279751, 'sideways_rsi_os': 24, 'sideways_rsi_ob': 93, 'sideways_adx_thresh': 26.399057464770717, 'sideways_atr_min_pct': 0.001934680226715156, 'sideways_atr_max_pct': 0.10039944257366974, 'sideways_tp_mult': 2.767061747235315, 'sideways_tsl_mult': 0.30636302211040256, 'sideways_time_stop': 234, 'sideways_use_sma': True, 'sideways_use_ema': False, 'sideways_use_atr': False, 'sideways_use_adx': False, 'sideways_use_spike': True, 'sideways_rsi_required': True}.
