[I 2025-08-31 10:49:37,149] Trial 695 finished with values: [-1000000000.0, 1000000000.0] and parameters: {'p_sma': 7, 'p_std': 47, 'p_atr': 29, 'p_adx': 9, 'rsi_period': 24, 'ema1': 10, 'ema2': 36, 'slip_atr_k': 0.192827372695047, 'slip_spread_k': 0.12992559934675285, 'spread_hl_frac': 0.047866348672299115, 'bb_std_mult': 1.6875822071792181, 'rsi_os': 36, 'rsi_ob': 83, 'vol_spike': 0.2930280632001881, 'adx_thresh': 21.901239618753785, 'atr_min_pct': 0.01653177241274283, 'atr_max_pct': 0.08541959343123547, 'tp_mult': 2.933063870075609, 'tsl_mult': 0.20792430732231582, 'strategy': 'mean_reversion', 'time_stop': 211, 'use_sma': False, 'use_atr': True, 'use_adx': False, 'use_ema': True, 'use_spike': False, 'rsi_required': True, 'edge_k': 1.9155315986645345, 'edge_cap': 0.541840264951065, 'bull_strategy': 'mean_reversion', 'bull_bb_std_mult': 0.7401870996035151, 'bull_rsi_os': 28, 'bull_rsi_ob': 47, 'bull_adx_thresh': 30.75006474661307, 'bull_atr_min_pct': 0.007044350831046385, 'bull_atr_max_pct': 0.06887252175150067, 'bull_tp_mult': 2.1156639546932077, 'bull_tsl_mult': 0.9450675673848369, 'bull_time_stop': 190, 'bull_use_sma': True, 'bull_use_ema': False, 'bull_use_atr': False, 'bull_use_adx': False, 'bull_use_spike': False, 'bull_rsi_required': False, 'bear_strategy': 'breakout', 'bear_bb_std_mult': 2.944403638354704, 'bear_rsi_os': 28, 'bear_rsi_ob': 57, 'bear_adx_thresh': 22.153312712540654, 'bear_atr_min_pct': 0.028662187515509634, 'bear_atr_max_pct': 0.10550548748000954, 'bear_tp_mult': 2.034295496820578, 'bear_tsl_mult': 0.4755222791231568, 'bear_time_stop': 266, 'bear_use_sma': True, 'bear_use_ema': False, 'bear_use_atr': False, 'bear_use_adx': True, 'bear_use_spike': True, 'bear_rsi_required': False, 'sideways_strategy': 'mean_reversion', 'sideways_bb_std_mult': 2.209207945761541, 'sideways_rsi_os': 22, 'sideways_rsi_ob': 92, 'sideways_adx_thresh': 29.32415476783858, 'sideways_atr_min_pct': 2.5387999777275053e-05, 'sideways_atr_max_pct': 0.09975999123248389, 'sideways_tp_mult': 2.8848693624947046, 'sideways_tsl_mult': 0.1068511016428792, 'sideways_time_stop': 251, 'sideways_use_sma': True, 'sideways_use_ema': False, 'sideways_use_atr': False, 'sideways_use_adx': False, 'sideways_use_spike': True, 'sideways_rsi_required': True}.
[I 2025-08-31 10:49:37,758] Trial 693 finished with values: [-0.1921421501649485, 0.19201412935310774] and parameters: {'p_sma': 27, 'p_std': 30, 'p_atr': 29, 'p_adx': 26, 'rsi_period': 22, 'ema1': 19, 'ema2': 36, 'slip_atr_k': 0.1979085141437344, 'slip_spread_k': 0.17680225198729427, 'spread_hl_frac': 0.009998669722897485, 'bb_std_mult': 1.156169023849439, 'rsi_os': 40, 'rsi_ob': 81, 'vol_spike': 0.2885157481855768, 'adx_thresh': 31.75831106264645, 'atr_min_pct': 0.02297682373048922, 'atr_max_pct': 0.041602667952009294, 'tp_mult': 2.3240795630313404, 'tsl_mult': 0.0902484186144571, 'strategy': 'mean_reversion', 'time_stop': 207, 'use_sma': False, 'use_atr': True, 'use_adx': False, 'use_ema': True, 'use_spike': False, 'rsi_required': True, 'edge_k': 1.9088427040878349, 'edge_cap': 0.5372777847653459, 'bull_strategy': 'mean_reversion', 'bull_bb_std_mult': 1.273476231760604, 'bull_rsi_os': 9, 'bull_rsi_ob': 94, 'bull_adx_thresh': 30.87730556336085, 'bull_atr_min_pct': 0.0027792065907766075, 'bull_atr_max_pct': 0.06900724611544878, 'bull_tp_mult': 2.1276447578527575, 'bull_tsl_mult': 0.014810995142677863, 'bull_time_stop': 91, 'bull_use_sma': True, 'bull_use_ema': False, 'bull_use_atr': False, 'bull_use_adx': False, 'bull_use_spike': False, 'bull_rsi_required': False, 'bear_strategy': 'breakout', 'bear_bb_std_mult': 2.8577876629519077, 'bear_rsi_os': 18, 'bear_rsi_ob': 78, 'bear_adx_thresh': 22.489544056736232, 'bear_atr_min_pct': 0.001305925967988484, 'bear_atr_max_pct': 0.1039157629772669, 'bear_tp_mult': 1.283020034569554, 'bear_tsl_mult': 0.3219988975827081, 'bear_time_stop': 218, 'bear_use_sma': True, 'bear_use_ema': True, 'bear_use_atr': False, 'bear_use_adx': True, 'bear_use_spike': True, 'bear_rsi_required': False, 'sideways_strategy': 'breakout', 'sideways_bb_std_mult': 2.1972822644756222, 'sideways_rsi_os': 49, 'sideways_rsi_ob': 92, 'sideways_adx_thresh': 16.847268486514007, 'sideways_atr_min_pct': 6.594020378086762e-06, 'sideways_atr_max_pct': 0.11892203463079973, 'sideways_tp_mult': 2.8826724717533447, 'sideways_tsl_mult': 0.019124739229794616, 'sideways_time_stop': 236, 'sideways_use_sma': True, 'sideways_use_ema': True, 'sideways_use_atr': False, 'sideways_use_adx': False, 'sideways_use_spike': True, 'sideways_rsi_required': False}.
[I 2025-08-31 10:49:37,934] Trial 692 finished with values: [-0.09859492029756056, 0.09849121259714952] and parameters: {'p_sma': 9, 'p_std': 46, 'p_atr': 29, 'p_adx': 9, 'rsi_period': 24, 'ema1': 5, 'ema2': 57, 'slip_atr_k': 0.19096079959638976, 'slip_spread_k': 0.8584057209725122, 'spread_hl_frac': 0.011057659925515174, 'bb_std_mult': 1.6854090707030167, 'rsi_os': 40, 'rsi_ob': 81, 'vol_spike': 0.2883781151780822, 'adx_thresh': 24.030970326247385, 'atr_min_pct': 0.016325065986902712, 'atr_max_pct': 0.07817742886349997, 'tp_mult': 1.691989926963617, 'tsl_mult': 0.08367637425144021, 'strategy': 'breakout', 'time_stop': 19, 'use_sma': False, 'use_atr': True, 'use_adx': True, 'use_ema': True, 'use_spike': False, 'rsi_required': True, 'edge_k': 1.9122731490860279, 'edge_cap': 0.12306623453341699, 'bull_strategy': 'mean_reversion', 'bull_bb_std_mult': 1.2981908412276881, 'bull_rsi_os': 37, 'bull_rsi_ob': 45, 'bull_adx_thresh': 30.68125218171704, 'bull_atr_min_pct': 0.007096427016591899, 'bull_atr_max_pct': 0.0684490166460909, 'bull_tp_mult': 2.107643314111047, 'bull_tsl_mult': 0.9299535885901975, 'bull_time_stop': 90, 'bull_use_sma': True, 'bull_use_ema': False, 'bull_use_atr': False, 'bull_use_adx': False, 'bull_use_spike': False, 'bull_rsi_required': False, 'bear_strategy': 'breakout', 'bear_bb_std_mult': 3.1170561934862926, 'bear_rsi_os': 29, 'bear_rsi_ob': 78, 'bear_adx_thresh': 22.258862539132167, 'bear_atr_min_pct': 0.00742232302535156, 'bear_atr_max_pct': 0.08239819305032459, 'bear_tp_mult': 2.024451030632337, 'bear_tsl_mult': 0.0731625290874483, 'bear_time_stop': 255, 'bear_use_sma': False, 'bear_use_ema': True, 'bear_use_atr': False, 'bear_use_adx': True, 'bear_use_spike': True, 'bear_rsi_required': False, 'sideways_strategy': 'breakout', 'sideways_bb_std_mult': 1.3983751125395858, 'sideways_rsi_os': 49, 'sideways_rsi_ob': 91, 'sideways_adx_thresh': 29.422937966342406, 'sideways_atr_min_pct': 0.0007687606742366534, 'sideways_atr_max_pct': 0.11894599525623825, 'sideways_tp_mult': 2.886454850013726, 'sideways_tsl_mult': 0.45421130130331, 'sideways_time_stop': 43, 'sideways_use_sma': True, 'sideways_use_ema': True, 'sideways_use_atr': False, 'sideways_use_adx': False, 'sideways_use_spike': True, 'sideways_rsi_required': False}.
[I 2025-08-31 10:50:10,785] Trial 699 finished with values: [-1000000000.0, 1000000000.0] and parameters: {'p_sma': 13, 'p_std': 25, 'p_atr': 30, 'p_adx': 7, 'rsi_period': 26, 'ema1': 18, 'ema2': 40, 'slip_atr_k': 0.1827190724599065, 'slip_spread_k': 0.1996969444763983, 'spread_hl_frac': 0.0018226261845637123, 'bb_std_mult': 1.3931180849462055, 'rsi_os': 44, 'rsi_ob': 83, 'vol_spike': 0.2993327208714833, 'adx_thresh': 16.016543651806806, 'atr_min_pct': 0.009891100006680002, 'atr_max_pct': 0.12023525276069351, 'tp_mult': 2.4466836309865325, 'tsl_mult': 0.9975494759784385, 'strategy': 'breakout', 'time_stop': 136, 'use_sma': True, 'use_atr': False, 'use_adx': False, 'use_ema': True, 'use_spike': True, 'rsi_required': False, 'edge_k': 0.9264506345570126, 'edge_cap': 0.09658489219536698, 'bull_strategy': 'breakout', 'bull_bb_std_mult': 1.1073415011324703, 'bull_rsi_os': 25, 'bull_rsi_ob': 68, 'bull_adx_thresh': 16.685597434675508, 'bull_atr_min_pct': 0.006600642941264325, 'bull_atr_max_pct': 0.0786944153331279, 'bull_tp_mult': 1.2334715396519793, 'bull_tsl_mult': 0.9997176374184148, 'bull_time_stop': 62, 'bull_use_sma': False, 'bull_use_ema': False, 'bull_use_atr': False, 'bull_use_adx': False, 'bull_use_spike': False, 'bull_rsi_required': True, 'bear_strategy': 'mean_reversion', 'bear_bb_std_mult': 0.9676390128759549, 'bear_rsi_os': 30, 'bear_rsi_ob': 80, 'bear_adx_thresh': 28.78175715079649, 'bear_atr_min_pct': 0.015536013920868608, 'bear_atr_max_pct': 0.021070746817151584, 'bear_tp_mult': 1.9005574956647953, 'bear_tsl_mult': 0.16128048115628751, 'bear_time_stop': 182, 'bear_use_sma': False, 'bear_use_ema': False, 'bear_use_atr': True, 'bear_use_adx': False, 'bear_use_spike': True, 'bear_rsi_required': True, 'sideways_strategy': 'mean_reversion', 'sideways_bb_std_mult': 1.061109340738778, 'sideways_rsi_os': 29, 'sideways_rsi_ob': 50, 'sideways_adx_thresh': 19.187547607008373, 'sideways_atr_min_pct': 0.026203266197298073, 'sideways_atr_max_pct': 0.08618181759425651, 'sideways_tp_mult': 2.834731063370725, 'sideways_tsl_mult': 0.052696564710051304, 'sideways_time_stop': 230, 'sideways_use_sma': False, 'sideways_use_ema': True, 'sideways_use_atr': False, 'sideways_use_adx': False, 'sideways_use_spike': True, 'sideways_rsi_required': True}.
[I 2025-08-31 10:50:11,156] Trial 698 finished with values: [-1000000000.0, 1000000000.0] and parameters: {'p_sma': 41, 'p_std': 21, 'p_atr': 29, 'p_adx': 9, 'rsi_period': 24, 'ema1': 18, 'ema2': 15, 'slip_atr_k': 0.18426689837151097, 'slip_spread_k': 0.1548449601513736, 'spread_hl_frac': 0.012923048817802237, 'bb_std_mult': 2.8119794492981267, 'rsi_os': 44, 'rsi_ob': 83, 'vol_spike': 0.004781907362560928, 'adx_thresh': 25.67149044952712, 'atr_min_pct': 0.012906491293884131, 'atr_max_pct': 0.07652172513894089, 'tp_mult': 1.2962857954708462, 'tsl_mult': 0.053468469449645104, 'strategy': 'breakout', 'time_stop': 17, 'use_sma': True, 'use_atr': False, 'use_adx': False, 'use_ema': True, 'use_spike': True, 'rsi_required': True, 'edge_k': 1.8615138900703492, 'edge_cap': 0.8494540194517151, 'bull_strategy': 'breakout', 'bull_bb_std_mult': 0.8232548578181091, 'bull_rsi_os': 25, 'bull_rsi_ob': 65, 'bull_adx_thresh': 29.37674177863119, 'bull_atr_min_pct': 0.0063198654801938, 'bull_atr_max_pct': 0.07925088678743446, 'bull_tp_mult': 1.6844689083583568, 'bull_tsl_mult': 0.4598197534021605, 'bull_time_stop': 22, 'bull_use_sma': False, 'bull_use_ema': False, 'bull_use_atr': False, 'bull_use_adx': False, 'bull_use_spike': False, 'bull_rsi_required': True, 'bear_strategy': 'mean_reversion', 'bear_bb_std_mult': 0.9609606685164032, 'bear_rsi_os': 49, 'bear_rsi_ob': 80, 'bear_adx_thresh': 29.063160763399207, 'bear_atr_min_pct': 0.008352998294344011, 'bear_atr_max_pct': 0.023068928982770326, 'bear_tp_mult': 1.979900595400539, 'bear_tsl_mult': 0.41632436011705376, 'bear_time_stop': 256, 'bear_use_sma': False, 'bear_use_ema': True, 'bear_use_atr': True, 'bear_use_adx': False, 'bear_use_spike': True, 'bear_rsi_required': True, 'sideways_strategy': 'mean_reversion', 'sideways_bb_std_mult': 1.0663716877646587, 'sideways_rsi_os': 37, 'sideways_rsi_ob': 93, 'sideways_adx_thresh': 18.242912871018824, 'sideways_atr_min_pct': 0.0014785121532094963, 'sideways_atr_max_pct': 0.08700065362661669, 'sideways_tp_mult': 2.8390454064753916, 'sideways_tsl_mult': 0.39226409149492475, 'sideways_time_stop': 212, 'sideways_use_sma': False, 'sideways_use_ema': True, 'sideways_use_atr': False, 'sideways_use_adx': False, 'sideways_use_spike': True, 'sideways_rsi_required': True}.
[I 2025-08-31 10:50:11,468] Trial 697 finished with values: [-0.08984397053466164, 0.0897789195001411] and parameters: {'p_sma': 41, 'p_std': 25, 'p_atr': 29, 'p_adx': 19, 'rsi_period': 24, 'ema1': 18, 'ema2': 40, 'slip_atr_k': 0.183281350187994, 'slip_spread_k': 0.11310948548962527, 'spread_hl_frac': 0.0026041456200577642, 'bb_std_mult': 1.3866584705815543, 'rsi_os': 44, 'rsi_ob': 65, 'vol_spike': 0.2738895920544535, 'adx_thresh': 25.410068934180703, 'atr_min_pct': 0.015219555782566072, 'atr_max_pct': 0.07629251977602237, 'tp_mult': 1.066534403010329, 'tsl_mult': 0.6379316372581915, 'strategy': 'breakout', 'time_stop': 135, 'use_sma': True, 'use_atr': False, 'use_adx': False, 'use_ema': True, 'use_spike': True, 'rsi_required': True, 'edge_k': 0.9096493254360076, 'edge_cap': 0.8542723952565596, 'bull_strategy': 'breakout', 'bull_bb_std_mult': 1.0963572100356591, 'bull_rsi_os': 44, 'bull_rsi_ob': 63, 'bull_adx_thresh': 29.37981156188625, 'bull_atr_min_pct': 0.0029119348118931375, 'bull_atr_max_pct': 0.07979193741417942, 'bull_tp_mult': 2.9100646334702276, 'bull_tsl_mult': 0.9435043729587645, 'bull_time_stop': 58, 'bull_use_sma': False, 'bull_use_ema': False, 'bull_use_atr': False, 'bull_use_adx': False, 'bull_use_spike': False, 'bull_rsi_required': True, 'bear_strategy': 'mean_reversion', 'bear_bb_std_mult': 2.864729479382105, 'bear_rsi_os': 18, 'bear_rsi_ob': 74, 'bear_adx_thresh': 30.362604423420144, 'bear_atr_min_pct': 0.015481776560514915, 'bear_atr_max_pct': 0.08223741797518529, 'bear_tp_mult': 1.9771527054616216, 'bear_tsl_mult': 0.07739676490948988, 'bear_time_stop': 182, 'bear_use_sma': False, 'bear_use_ema': True, 'bear_use_atr': True, 'bear_use_adx': True, 'bear_use_spike': True, 'bear_rsi_required': True, 'sideways_strategy': 'breakout', 'sideways_bb_std_mult': 2.595682228959446, 'sideways_rsi_os': 41, 'sideways_rsi_ob': 92, 'sideways_adx_thresh': 15.910400005778211, 'sideways_atr_min_pct': 0.0013400236402232434, 'sideways_atr_max_pct': 0.0864947726477229, 'sideways_tp_mult': 2.8856049206103016, 'sideways_tsl_mult': 0.020679474512913014, 'sideways_time_stop': 228, 'sideways_use_sma': False, 'sideways_use_ema': True, 'sideways_use_atr': False, 'sideways_use_adx': False, 'sideways_use_spike': True, 'sideways_rsi_required': False}.
[I 2025-08-31 10:50:11,696] Trial 696 finished with values: [-1000000000.0, 1000000000.0] and parameters: {'p_sma': 10, 'p_std': 50, 'p_atr': 29, 'p_adx': 21, 'rsi_period': 24, 'ema1': 18, 'ema2': 21, 'slip_atr_k': 0.18240208934526814, 'slip_spread_k': 0.20200865318750405, 'spread_hl_frac': 0.0018941166441829513, 'bb_std_mult': 1.6637194205441577, 'rsi_os': 44, 'rsi_ob': 65, 'vol_spike': 0.2949159497469876, 'adx_thresh': 25.629067852429785, 'atr_min_pct': 0.009838679593388739, 'atr_max_pct': 0.0758422845841123, 'tp_mult': 2.6100231533736817, 'tsl_mult': 0.048370358047415185, 'strategy': 'breakout', 'time_stop': 54, 'use_sma': False, 'use_atr': False, 'use_adx': False, 'use_ema': True, 'use_spike': True, 'rsi_required': True, 'edge_k': 1.7245103636917913, 'edge_cap': 0.09120664475213217, 'bull_strategy': 'mean_reversion', 'bull_bb_std_mult': 1.1029238697566843, 'bull_rsi_os': 25, 'bull_rsi_ob': 65, 'bull_adx_thresh': 30.638585526098517, 'bull_atr_min_pct': 0.00646050776779619, 'bull_atr_max_pct': 0.06947468420437936, 'bull_tp_mult': 2.1136342310275373, 'bull_tsl_mult': 0.9448722743830503, 'bull_time_stop': 60, 'bull_use_sma': True, 'bull_use_ema': False, 'bull_use_atr': False, 'bull_use_adx': False, 'bull_use_spike': False, 'bull_rsi_required': True, 'bear_strategy': 'breakout', 'bear_bb_std_mult': 2.9067248359497633, 'bear_rsi_os': 28, 'bear_rsi_ob': 80, 'bear_adx_thresh': 17.08977265889387, 'bear_atr_min_pct': 0.009698780211129809, 'bear_atr_max_pct': 0.08045330489545723, 'bear_tp_mult': 1.983566563306446, 'bear_tsl_mult': 0.6634810387962029, 'bear_time_stop': 182, 'bear_use_sma': False, 'bear_use_ema': False, 'bear_use_atr': True, 'bear_use_adx': True, 'bear_use_spike': True, 'bear_rsi_required': True, 'sideways_strategy': 'mean_reversion', 'sideways_bb_std_mult': 2.5798786860405563, 'sideways_rsi_os': 49, 'sideways_rsi_ob': 93, 'sideways_adx_thresh': 19.062438122583746, 'sideways_atr_min_pct': 0.0012391773940182047, 'sideways_atr_max_pct': 0.12058373035751295, 'sideways_tp_mult': 2.868402451043782, 'sideways_tsl_mult': 0.10813468518096728, 'sideways_time_stop': 79, 'sideways_use_sma': False, 'sideways_use_ema': True, 'sideways_use_atr': False, 'sideways_use_adx': False, 'sideways_use_spike': True, 'sideways_rsi_required': True}.
[I 2025-08-31 10:50:43,454] Trial 702 finished with values: [-1000000000.0, 1000000000.0] and parameters: {'p_sma': 10, 'p_std': 48, 'p_atr': 13, 'p_adx': 8, 'rsi_period': 28, 'ema1': 18, 'ema2': 49, 'slip_atr_k': 0.20459772579746188, 'slip_spread_k': 0.9303080416490923, 'spread_hl_frac': 0.008359359318875416, 'bb_std_mult': 0.5937232225845963, 'rsi_os': 37, 'rsi_ob': 61, 'vol_spike': 0.16600582938127773, 'adx_thresh': 23.125003294721203, 'atr_min_pct': 0.020084967121432498, 'atr_max_pct': 0.12199245159039702, 'tp_mult': 2.794313099506525, 'tsl_mult': 0.04363580418451854, 'strategy': 'breakout', 'time_stop': 147, 'use_sma': False, 'use_atr': False, 'use_adx': False, 'use_ema': True, 'use_spike': False, 'rsi_required': True, 'edge_k': 0.45612621228452066, 'edge_cap': 0.15337037471987927, 'bull_strategy': 'mean_reversion', 'bull_bb_std_mult': 2.6887301277623608, 'bull_rsi_os': 54, 'bull_rsi_ob': 66, 'bull_adx_thresh': 15.837741978017604, 'bull_atr_min_pct': 0.027031796818347834, 'bull_atr_max_pct': 0.14995899262819956, 'bull_tp_mult': 2.2847531945000448, 'bull_tsl_mult': 0.9555086268601726, 'bull_time_stop': 74, 'bull_use_sma': True, 'bull_use_ema': True, 'bull_use_atr': True, 'bull_use_adx': False, 'bull_use_spike': False, 'bull_rsi_required': True, 'bear_strategy': 'breakout', 'bear_bb_std_mult': 2.9055242378018376, 'bear_rsi_os': 27, 'bear_rsi_ob': 87, 'bear_adx_thresh': 32.716299209136324, 'bear_atr_min_pct': 0.0026571492641266348, 'bear_atr_max_pct': 0.11054973606290595, 'bear_tp_mult': 2.1140350037790485, 'bear_tsl_mult': 0.447468388189742, 'bear_time_stop': 266, 'bear_use_sma': False, 'bear_use_ema': True, 'bear_use_atr': False, 'bear_use_adx': True, 'bear_use_spike': True, 'bear_rsi_required': True, 'sideways_strategy': 'breakout', 'sideways_bb_std_mult': 0.9513862458122848, 'sideways_rsi_os': 25, 'sideways_rsi_ob': 77, 'sideways_adx_thresh': 29.874733319967255, 'sideways_atr_min_pct': 0.005542909091044098, 'sideways_atr_max_pct': 0.10401898265433748, 'sideways_tp_mult': 2.9617363699709696, 'sideways_tsl_mult': 0.08510112797723159, 'sideways_time_stop': 242, 'sideways_use_sma': True, 'sideways_use_ema': False, 'sideways_use_atr': False, 'sideways_use_adx': False, 'sideways_use_spike': True, 'sideways_rsi_required': False}.
[I 2025-08-31 10:50:43,746] Trial 703 finished with values: [-1000000000.0, 1000000000.0] and parameters: {'p_sma': 12, 'p_std': 48, 'p_atr': 13, 'p_adx': 8, 'rsi_period': 27, 'ema1': 17, 'ema2': 53, 'slip_atr_k': 0.05823389490485613, 'slip_spread_k': 0.8161082143586276, 'spread_hl_frac': 0.012835127096622812, 'bb_std_mult': 1.4943767982452352, 'rsi_os': 37, 'rsi_ob': 61, 'vol_spike': 0.29591073827306524, 'adx_thresh': 22.973015101275536, 'atr_min_pct': 0.02159721388613066, 'atr_max_pct': 0.12222342871888585, 'tp_mult': 2.523813222832546, 'tsl_mult': 0.2931676642687588, 'strategy': 'breakout', 'time_stop': 248, 'use_sma': False, 'use_atr': False, 'use_adx': False, 'use_ema': True, 'use_spike': False, 'rsi_required': False, 'edge_k': 0.39434363724995447, 'edge_cap': 0.139873390886223, 'bull_strategy': 'mean_reversion', 'bull_bb_std_mult': 1.6231838110271077, 'bull_rsi_os': 28, 'bull_rsi_ob': 66, 'bull_adx_thresh': 19.250151331410795, 'bull_atr_min_pct': 0.026717552371588064, 'bull_atr_max_pct': 0.08569963855211123, 'bull_tp_mult': 2.3481468948321473, 'bull_tsl_mult': 0.24790303262700725, 'bull_time_stop': 72, 'bull_use_sma': True, 'bull_use_ema': True, 'bull_use_atr': True, 'bull_use_adx': False, 'bull_use_spike': True, 'bull_rsi_required': True, 'bear_strategy': 'breakout', 'bear_bb_std_mult': 2.807225324312486, 'bear_rsi_os': 26, 'bear_rsi_ob': 76, 'bear_adx_thresh': 12.444888505509944, 'bear_atr_min_pct': 0.007978403141360273, 'bear_atr_max_pct': 0.11033868218396478, 'bear_tp_mult': 2.1190853551124893, 'bear_tsl_mult': 0.45151495875814873, 'bear_time_stop': 267, 'bear_use_sma': False, 'bear_use_ema': True, 'bear_use_atr': False, 'bear_use_adx': True, 'bear_use_spike': True, 'bear_rsi_required': True, 'sideways_strategy': 'breakout', 'sideways_bb_std_mult': 3.256160291125119, 'sideways_rsi_os': 25, 'sideways_rsi_ob': 71, 'sideways_adx_thresh': 21.436204440597525, 'sideways_atr_min_pct': 0.025315620275260596, 'sideways_atr_max_pct': 0.057873147532333455, 'sideways_tp_mult': 2.9565432992791107, 'sideways_tsl_mult': 0.15582685015582282, 'sideways_time_stop': 125, 'sideways_use_sma': True, 'sideways_use_ema': False, 'sideways_use_atr': True, 'sideways_use_adx': False, 'sideways_use_spike': True, 'sideways_rsi_required': False}.
