[I 2025-08-31 10:23:13,284] Trial 504 finished with values: [-1000000000.0, 1000000000.0] and parameters: {'p_sma': 13, 'p_std': 49, 'p_atr': 15, 'p_adx': 17, 'rsi_period': 24, 'ema1': 18, 'ema2': 35, 'slip_atr_k': 0.18553327223695837, 'slip_spread_k': 0.08181926942024373, 'spread_hl_frac': 0.011330376043778718, 'bb_std_mult': 1.3445371077784696, 'rsi_os': 38, 'rsi_ob': 83, 'vol_spike': 0.2793254051433204, 'adx_thresh': 26.14940818571269, 'atr_min_pct': 0.0006888586438235211, 'atr_max_pct': 0.1120283671807123, 'tp_mult': 2.907515663182242, 'tsl_mult': 0.063725565194615, 'strategy': 'breakout', 'time_stop': 149, 'use_sma': True, 'use_atr': False, 'use_adx': True, 'use_ema': True, 'use_spike': False, 'rsi_required': True, 'edge_k': 0.7384311848263729, 'edge_cap': 0.26566928048059685, 'bull_strategy': 'breakout', 'bull_bb_std_mult': 1.122748891744958, 'bull_rsi_os': 26, 'bull_rsi_ob': 66, 'bull_adx_thresh': 15.231691188889487, 'bull_atr_min_pct': 0.01125195026431984, 'bull_atr_max_pct': 0.0899699966967586, 'bull_tp_mult': 2.1738458705335075, 'bull_tsl_mult': 0.921848792860135, 'bull_time_stop': 63, 'bull_use_sma': False, 'bull_use_ema': False, 'bull_use_atr': False, 'bull_use_adx': False, 'bull_use_spike': True, 'bull_rsi_required': False, 'bear_strategy': 'mean_reversion', 'bear_bb_std_mult': 2.952580212802558, 'bear_rsi_os': 28, 'bear_rsi_ob': 54, 'bear_adx_thresh': 34.40841026609355, 'bear_atr_min_pct': 0.009820301659718863, 'bear_atr_max_pct': 0.10611053602092566, 'bear_tp_mult': 2.1305976711607166, 'bear_tsl_mult': 0.4699245761191535, 'bear_time_stop': 274, 'bear_use_sma': False, 'bear_use_ema': True, 'bear_use_atr': False, 'bear_use_adx': True, 'bear_use_spike': True, 'bear_rsi_required': True, 'sideways_strategy': 'breakout', 'sideways_bb_std_mult': 0.7292879634022913, 'sideways_rsi_os': 24, 'sideways_rsi_ob': 94, 'sideways_adx_thresh': 28.736191951081963, 'sideways_atr_min_pct': 0.0013495229741960764, 'sideways_atr_max_pct': 0.11276324790457996, 'sideways_tp_mult': 2.881485604691667, 'sideways_tsl_mult': 0.03390584412333297, 'sideways_time_stop': 84, 'sideways_use_sma': True, 'sideways_use_ema': True, 'sideways_use_atr': True, 'sideways_use_adx': False, 'sideways_use_spike': True, 'sideways_rsi_required': False}.
[I 2025-08-31 10:23:47,276] Trial 508 finished with values: [-1000000000.0, 1000000000.0] and parameters: {'p_sma': 12, 'p_std': 47, 'p_atr': 14, 'p_adx': 15, 'rsi_period': 26, 'ema1': 18, 'ema2': 49, 'slip_atr_k': 0.1937438997502384, 'slip_spread_k': 0.053851043536224164, 'spread_hl_frac': 0.01089507449694752, 'bb_std_mult': 1.174683701434489, 'rsi_os': 42, 'rsi_ob': 83, 'vol_spike': 0.2933172194901937, 'adx_thresh': 18.41382768717716, 'atr_min_pct': 0.010497785793476168, 'atr_max_pct': 0.11688288996537696, 'tp_mult': 2.9604733988081704, 'tsl_mult': 0.06449707393960985, 'strategy': 'breakout', 'time_stop': 137, 'use_sma': False, 'use_atr': True, 'use_adx': True, 'use_ema': True, 'use_spike': False, 'rsi_required': False, 'edge_k': 1.9994836697269478, 'edge_cap': 0.12450424386900615, 'bull_strategy': 'mean_reversion', 'bull_bb_std_mult': 1.1064559713588564, 'bull_rsi_os': 25, 'bull_rsi_ob': 65, 'bull_adx_thresh': 28.740426059862585, 'bull_atr_min_pct': 0.006059129242306772, 'bull_atr_max_pct': 0.0924130175287741, 'bull_tp_mult': 2.183710149542431, 'bull_tsl_mult': 0.9723862847405792, 'bull_time_stop': 76, 'bull_use_sma': False, 'bull_use_ema': False, 'bull_use_atr': False, 'bull_use_adx': False, 'bull_use_spike': False, 'bull_rsi_required': False, 'bear_strategy': 'mean_reversion', 'bear_bb_std_mult': 3.037607013874844, 'bear_rsi_os': 30, 'bear_rsi_ob': 45, 'bear_adx_thresh': 21.76351594456149, 'bear_atr_min_pct': 0.004150523220365307, 'bear_atr_max_pct': 0.11239555681538577, 'bear_tp_mult': 2.077583005632983, 'bear_tsl_mult': 0.45619466678023574, 'bear_time_stop': 291, 'bear_use_sma': False, 'bear_use_ema': False, 'bear_use_atr': False, 'bear_use_adx': True, 'bear_use_spike': True, 'bear_rsi_required': False, 'sideways_strategy': 'breakout', 'sideways_bb_std_mult': 0.7590031322461129, 'sideways_rsi_os': 23, 'sideways_rsi_ob': 94, 'sideways_adx_thresh': 29.937166301588498, 'sideways_atr_min_pct': 0.016167943806086507, 'sideways_atr_max_pct': 0.12699710680880352, 'sideways_tp_mult': 2.9846091702052306, 'sideways_tsl_mult': 0.9305144042643201, 'sideways_time_stop': 140, 'sideways_use_sma': True, 'sideways_use_ema': True, 'sideways_use_atr': False, 'sideways_use_adx': False, 'sideways_use_spike': True, 'sideways_rsi_required': False}.
[I 2025-08-31 10:23:47,617] Trial 505 finished with values: [-1000000000.0, 1000000000.0] and parameters: {'p_sma': 13, 'p_std': 47, 'p_atr': 11, 'p_adx': 8, 'rsi_period': 24, 'ema1': 18, 'ema2': 38, 'slip_atr_k': 0.19337302346628304, 'slip_spread_k': 0.07624407947082992, 'spread_hl_frac': 0.011072457216403805, 'bb_std_mult': 1.1678268970934813, 'rsi_os': 38, 'rsi_ob': 83, 'vol_spike': 0.28039771001228053, 'adx_thresh': 26.165903792731218, 'atr_min_pct': 0.010681246180577262, 'atr_max_pct': 0.0986507367872984, 'tp_mult': 2.988940917729477, 'tsl_mult': 0.07127454539816061, 'strategy': 'breakout', 'time_stop': 147, 'use_sma': True, 'use_atr': False, 'use_adx': True, 'use_ema': True, 'use_spike': False, 'rsi_required': False, 'edge_k': 0.7426777283875552, 'edge_cap': 0.27477484437118593, 'bull_strategy': 'breakout', 'bull_bb_std_mult': 1.1106631744315993, 'bull_rsi_os': 26, 'bull_rsi_ob': 67, 'bull_adx_thresh': 11.457614177885503, 'bull_atr_min_pct': 0.013707195868344825, 'bull_atr_max_pct': 0.09202869333178729, 'bull_tp_mult': 2.174632026162811, 'bull_tsl_mult': 0.972899184282608, 'bull_time_stop': 62, 'bull_use_sma': False, 'bull_use_ema': False, 'bull_use_atr': False, 'bull_use_adx': False, 'bull_use_spike': True, 'bull_rsi_required': False, 'bear_strategy': 'mean_reversion', 'bear_bb_std_mult': 2.971753033917527, 'bear_rsi_os': 28, 'bear_rsi_ob': 84, 'bear_adx_thresh': 21.585874084156693, 'bear_atr_min_pct': 0.007942080093190189, 'bear_atr_max_pct': 0.10567400879288204, 'bear_tp_mult': 2.1262904323008005, 'bear_tsl_mult': 0.4700713438316971, 'bear_time_stop': 275, 'bear_use_sma': False, 'bear_use_ema': True, 'bear_use_atr': False, 'bear_use_adx': True, 'bear_use_spike': True, 'bear_rsi_required': True, 'sideways_strategy': 'breakout', 'sideways_bb_std_mult': 0.820331587812343, 'sideways_rsi_os': 22, 'sideways_rsi_ob': 94, 'sideways_adx_thresh': 28.65795156187521, 'sideways_atr_min_pct': 0.001494307223778869, 'sideways_atr_max_pct': 0.08138460583356129, 'sideways_tp_mult': 2.872813467102669, 'sideways_tsl_mult': 0.06997403918955938, 'sideways_time_stop': 119, 'sideways_use_sma': True, 'sideways_use_ema': True, 'sideways_use_atr': True, 'sideways_use_adx': False, 'sideways_use_spike': True, 'sideways_rsi_required': False}.
[I 2025-08-31 10:23:47,782] Trial 507 finished with values: [-0.016612616909610023, 0.01643818698354981] and parameters: {'p_sma': 12, 'p_std': 49, 'p_atr': 11, 'p_adx': 13, 'rsi_period': 24, 'ema1': 18, 'ema2': 38, 'slip_atr_k': 0.1962545673376467, 'slip_spread_k': 0.14049151610299182, 'spread_hl_frac': 0.011158516663785605, 'bb_std_mult': 1.1655961280074034, 'rsi_os': 42, 'rsi_ob': 83, 'vol_spike': 0.281133236474841, 'adx_thresh': 21.914912593667342, 'atr_min_pct': 0.010407458391666631, 'atr_max_pct': 0.11677116584587299, 'tp_mult': 2.990346926495006, 'tsl_mult': 0.06147802710892025, 'strategy': 'breakout', 'time_stop': 150, 'use_sma': True, 'use_atr': False, 'use_adx': True, 'use_ema': True, 'use_spike': False, 'rsi_required': False, 'edge_k': 0.2267529119789805, 'edge_cap': 0.6193951432104473, 'bull_strategy': 'breakout', 'bull_bb_std_mult': 1.0808901770294717, 'bull_rsi_os': 26, 'bull_rsi_ob': 66, 'bull_adx_thresh': 6.009001792949999, 'bull_atr_min_pct': 0.008494059315516164, 'bull_atr_max_pct': 0.09227814674690062, 'bull_tp_mult': 2.1984014428019063, 'bull_tsl_mult': 0.9755165345854435, 'bull_time_stop': 64, 'bull_use_sma': False, 'bull_use_ema': False, 'bull_use_atr': False, 'bull_use_adx': False, 'bull_use_spike': True, 'bull_rsi_required': False, 'bear_strategy': 'mean_reversion', 'bear_bb_std_mult': 2.9933922416228116, 'bear_rsi_os': 28, 'bear_rsi_ob': 81, 'bear_adx_thresh': 34.305126712470205, 'bear_atr_min_pct': 0.006299163062886217, 'bear_atr_max_pct': 0.10589402404817361, 'bear_tp_mult': 2.1222283396006993, 'bear_tsl_mult': 0.47044142010172635, 'bear_time_stop': 275, 'bear_use_sma': False, 'bear_use_ema': False, 'bear_use_atr': False, 'bear_use_adx': True, 'bear_use_spike': True, 'bear_rsi_required': True, 'sideways_strategy': 'breakout', 'sideways_bb_std_mult': 0.8233976785702848, 'sideways_rsi_os': 24, 'sideways_rsi_ob': 94, 'sideways_adx_thresh': 29.939247212059396, 'sideways_atr_min_pct': 0.0005542059083122785, 'sideways_atr_max_pct': 0.12880792383173373, 'sideways_tp_mult': 2.9871260239337087, 'sideways_tsl_mult': 0.8892004352725242, 'sideways_time_stop': 217, 'sideways_use_sma': True, 'sideways_use_ema': True, 'sideways_use_atr': True, 'sideways_use_adx': False, 'sideways_use_spike': True, 'sideways_rsi_required': False}.
[I 2025-08-31 10:23:47,961] Trial 506 finished with values: [-0.011597346002047204, 0.011411992589683667] and parameters: {'p_sma': 13, 'p_std': 47, 'p_atr': 27, 'p_adx': 8, 'rsi_period': 24, 'ema1': 18, 'ema2': 38, 'slip_atr_k': 0.19522313584936318, 'slip_spread_k': 0.05407599596870129, 'spread_hl_frac': 0.010988448385719773, 'bb_std_mult': 1.2871118071968937, 'rsi_os': 38, 'rsi_ob': 83, 'vol_spike': 0.2792946495692228, 'adx_thresh': 22.32577973458732, 'atr_min_pct': 0.0008343430115695365, 'atr_max_pct': 0.12320393814414188, 'tp_mult': 2.9725113682317095, 'tsl_mult': 0.06713534684405706, 'strategy': 'breakout', 'time_stop': 146, 'use_sma': True, 'use_atr': True, 'use_adx': True, 'use_ema': True, 'use_spike': False, 'rsi_required': False, 'edge_k': 1.9337257185757386, 'edge_cap': 0.5303058640089121, 'bull_strategy': 'breakout', 'bull_bb_std_mult': 1.1195337150722575, 'bull_rsi_os': 26, 'bull_rsi_ob': 66, 'bull_adx_thresh': 30.760579010015107, 'bull_atr_min_pct': 0.013827172487469121, 'bull_atr_max_pct': 0.08077571023139894, 'bull_tp_mult': 2.187348195161872, 'bull_tsl_mult': 0.9953825918829929, 'bull_time_stop': 64, 'bull_use_sma': False, 'bull_use_ema': False, 'bull_use_atr': False, 'bull_use_adx': False, 'bull_use_spike': True, 'bull_rsi_required': False, 'bear_strategy': 'mean_reversion', 'bear_bb_std_mult': 2.946253958876994, 'bear_rsi_os': 28, 'bear_rsi_ob': 84, 'bear_adx_thresh': 21.542388093499504, 'bear_atr_min_pct': 0.006154612231520352, 'bear_atr_max_pct': 0.10619494608645388, 'bear_tp_mult': 2.1245899341294305, 'bear_tsl_mult': 0.4730731307108659, 'bear_time_stop': 273, 'bear_use_sma': False, 'bear_use_ema': True, 'bear_use_atr': False, 'bear_use_adx': True, 'bear_use_spike': True, 'bear_rsi_required': False, 'sideways_strategy': 'breakout', 'sideways_bb_std_mult': 0.864100370456833, 'sideways_rsi_os': 24, 'sideways_rsi_ob': 94, 'sideways_adx_thresh': 28.764360293192638, 'sideways_atr_min_pct': 0.0006772877514463393, 'sideways_atr_max_pct': 0.1120871265483906, 'sideways_tp_mult': 2.988219978343954, 'sideways_tsl_mult': 0.8841628493304703, 'sideways_time_stop': 128, 'sideways_use_sma': True, 'sideways_use_ema': True, 'sideways_use_atr': True, 'sideways_use_adx': False, 'sideways_use_spike': True, 'sideways_rsi_required': False}.
[I 2025-08-31 10:24:21,306] Trial 510 finished with values: [-1000000000.0, 1000000000.0] and parameters: {'p_sma': 10, 'p_std': 49, 'p_atr': 10, 'p_adx': 21, 'rsi_period': 69, 'ema1': 17, 'ema2': 58, 'slip_atr_k': 0.20104562946100113, 'slip_spread_k': 0.14147967807853729, 'spread_hl_frac': 0.009758707865638058, 'bb_std_mult': 1.414916737430574, 'rsi_os': 42, 'rsi_ob': 82, 'vol_spike': 0.2854605759422377, 'adx_thresh': 22.3327598767156, 'atr_min_pct': 0.011698627821477514, 'atr_max_pct': 0.12254264420977448, 'tp_mult': 2.876032005782848, 'tsl_mult': 0.0830185479140011, 'strategy': 'breakout', 'time_stop': 138, 'use_sma': False, 'use_atr': False, 'use_adx': False, 'use_ema': True, 'use_spike': False, 'rsi_required': True, 'edge_k': 1.9329454372050114, 'edge_cap': 0.3775596167049206, 'bull_strategy': 'mean_reversion', 'bull_bb_std_mult': 2.209923844418292, 'bull_rsi_os': 25, 'bull_rsi_ob': 66, 'bull_adx_thresh': 30.736465267267427, 'bull_atr_min_pct': 0.008565799518520108, 'bull_atr_max_pct': 0.08079100836350186, 'bull_tp_mult': 2.2893850568236167, 'bull_tsl_mult': 0.9847971624625679, 'bull_time_stop': 68, 'bull_use_sma': True, 'bull_use_ema': False, 'bull_use_atr': False, 'bull_use_adx': False, 'bull_use_spike': False, 'bull_rsi_required': True, 'bear_strategy': 'breakout', 'bear_bb_std_mult': 2.886045518729628, 'bear_rsi_os': 26, 'bear_rsi_ob': 82, 'bear_adx_thresh': 9.843274461054978, 'bear_atr_min_pct': 0.006125780474733442, 'bear_atr_max_pct': 0.10161167918692154, 'bear_tp_mult': 2.0225092386910966, 'bear_tsl_mult': 0.4691404465242944, 'bear_time_stop': 270, 'bear_use_sma': False, 'bear_use_ema': True, 'bear_use_atr': False, 'bear_use_adx': True, 'bear_use_spike': True, 'bear_rsi_required': True, 'sideways_strategy': 'breakout', 'sideways_bb_std_mult': 0.841827703871472, 'sideways_rsi_os': 24, 'sideways_rsi_ob': 91, 'sideways_adx_thresh': 29.186735746948717, 'sideways_atr_min_pct': 0.0006699033998583472, 'sideways_atr_max_pct': 0.12113551894058562, 'sideways_tp_mult': 2.7647246035629727, 'sideways_tsl_mult': 0.4760133220276484, 'sideways_time_stop': 217, 'sideways_use_sma': True, 'sideways_use_ema': True, 'sideways_use_atr': False, 'sideways_use_adx': True, 'sideways_use_spike': True, 'sideways_rsi_required': False}.
[I 2025-08-31 10:24:21,713] Trial 509 finished with values: [-1000000000.0, 1000000000.0] and parameters: {'p_sma': 11, 'p_std': 47, 'p_atr': 28, 'p_adx': 21, 'rsi_period': 24, 'ema1': 17, 'ema2': 38, 'slip_atr_k': 0.19887431307799874, 'slip_spread_k': 0.13962345539729115, 'spread_hl_frac': 0.010797278585725368, 'bb_std_mult': 1.451864672471057, 'rsi_os': 38, 'rsi_ob': 82, 'vol_spike': 0.2823354235676815, 'adx_thresh': 22.250840420499443, 'atr_min_pct': 0.011445006757606936, 'atr_max_pct': 0.1221761875110596, 'tp_mult': 2.882726578967185, 'tsl_mult': 0.058686438395080275, 'strategy': 'breakout', 'time_stop': 145, 'use_sma': False, 'use_atr': False, 'use_adx': False, 'use_ema': True, 'use_spike': False, 'rsi_required': True, 'edge_k': 0.22071574923458115, 'edge_cap': 0.5261096885346026, 'bull_strategy': 'mean_reversion', 'bull_bb_std_mult': 2.9150573994598434, 'bull_rsi_os': 26, 'bull_rsi_ob': 67, 'bull_adx_thresh': 29.71842058815261, 'bull_atr_min_pct': 0.008372901975983995, 'bull_atr_max_pct': 0.08035773248181668, 'bull_tp_mult': 2.265188952086962, 'bull_tsl_mult': 0.9969787051971712, 'bull_time_stop': 68, 'bull_use_sma': True, 'bull_use_ema': False, 'bull_use_atr': False, 'bull_use_adx': False, 'bull_use_spike': True, 'bull_rsi_required': True, 'bear_strategy': 'breakout', 'bear_bb_std_mult': 2.988941937477221, 'bear_rsi_os': 26, 'bear_rsi_ob': 84, 'bear_adx_thresh': 21.567719794504114, 'bear_atr_min_pct': 0.006268725034049581, 'bear_atr_max_pct': 0.10501537891442157, 'bear_tp_mult': 2.028188264297431, 'bear_tsl_mult': 0.46334831271827215, 'bear_time_stop': 271, 'bear_use_sma': False, 'bear_use_ema': True, 'bear_use_atr': False, 'bear_use_adx': True, 'bear_use_spike': True, 'bear_rsi_required': True, 'sideways_strategy': 'breakout', 'sideways_bb_std_mult': 0.8354746276805133, 'sideways_rsi_os': 13, 'sideways_rsi_ob': 91, 'sideways_adx_thresh': 29.005100236718626, 'sideways_atr_min_pct': 0.0007480428946765227, 'sideways_atr_max_pct': 0.08358230979545184, 'sideways_tp_mult': 2.784345938439666, 'sideways_tsl_mult': 0.06703005323222605, 'sideways_time_stop': 185, 'sideways_use_sma': True, 'sideways_use_ema': True, 'sideways_use_atr': True, 'sideways_use_adx': True, 'sideways_use_spike': True, 'sideways_rsi_required': False}.
[I 2025-08-31 10:24:21,950] Trial 511 finished with values: [-1000000000.0, 1000000000.0] and parameters: {'p_sma': 10, 'p_std': 49, 'p_atr': 28, 'p_adx': 7, 'rsi_period': 23, 'ema1': 17, 'ema2': 37, 'slip_atr_k': 0.1782643557461811, 'slip_spread_k': 0.13489830936002464, 'spread_hl_frac': 0.009707708732320207, 'bb_std_mult': 1.4188932841483635, 'rsi_os': 42, 'rsi_ob': 82, 'vol_spike': 0.2997398132143248, 'adx_thresh': 22.214250232507762, 'atr_min_pct': 0.011770254473959864, 'atr_max_pct': 0.12170750137797665, 'tp_mult': 2.8744751814945544, 'tsl_mult': 0.05741973688005073, 'strategy': 'breakout', 'time_stop': 136, 'use_sma': False, 'use_atr': False, 'use_adx': False, 'use_ema': True, 'use_spike': False, 'rsi_required': True, 'edge_k': 1.9277999495459148, 'edge_cap': 0.16015166412325446, 'bull_strategy': 'mean_reversion', 'bull_bb_std_mult': 2.923712812783161, 'bull_rsi_os': 26, 'bull_rsi_ob': 68, 'bull_adx_thresh': 29.759540542894282, 'bull_atr_min_pct': 0.007390131148791029, 'bull_atr_max_pct': 0.0810479220206332, 'bull_tp_mult': 2.274518910240256, 'bull_tsl_mult': 0.9984119861272661, 'bull_time_stop': 67, 'bull_use_sma': True, 'bull_use_ema': False, 'bull_use_atr': False, 'bull_use_adx': False, 'bull_use_spike': False, 'bull_rsi_required': True, 'bear_strategy': 'breakout', 'bear_bb_std_mult': 2.9013048502626364, 'bear_rsi_os': 26, 'bear_rsi_ob': 62, 'bear_adx_thresh': 21.49750256879894, 'bear_atr_min_pct': 0.007444962196513655, 'bear_atr_max_pct': 0.10844584937986748, 'bear_tp_mult': 2.0320932419953333, 'bear_tsl_mult': 0.46667133032563785, 'bear_time_stop': 270, 'bear_use_sma': False, 'bear_use_ema': True, 'bear_use_atr': True, 'bear_use_adx': True, 'bear_use_spike': True, 'bear_rsi_required': True, 'sideways_strategy': 'breakout', 'sideways_bb_std_mult': 0.8469887411664403, 'sideways_rsi_os': 13, 'sideways_rsi_ob': 95, 'sideways_adx_thresh': 30.05435564271621, 'sideways_atr_min_pct': 0.01407414604583749, 'sideways_atr_max_pct': 0.0835347365390129, 'sideways_tp_mult': 2.9970993408415034, 'sideways_tsl_mult': 0.06290693136346472, 'sideways_time_stop': 216, 'sideways_use_sma': False, 'sideways_use_ema': True, 'sideways_use_atr': False, 'sideways_use_adx': True, 'sideways_use_spike': True, 'sideways_rsi_required': False}.
[I 2025-08-31 10:24:22,124] Trial 512 finished with values: [-1000000000.0, 1000000000.0] and parameters: {'p_sma': 11, 'p_std': 51, 'p_atr': 29, 'p_adx': 13, 'rsi_period': 23, 'ema1': 17, 'ema2': 37, 'slip_atr_k': 0.1796111795220202, 'slip_spread_k': 0.14329146388383485, 'spread_hl_frac': 0.009336310892734633, 'bb_std_mult': 1.2854505915230352, 'rsi_os': 42, 'rsi_ob': 86, 'vol_spike': 0.29334114723191795, 'adx_thresh': 24.320327869461686, 'atr_min_pct': 0.0038032117021837633, 'atr_max_pct': 0.12072034810006824, 'tp_mult': 2.8827903040598777, 'tsl_mult': 0.14377227799127096, 'strategy': 'breakout', 'time_stop': 258, 'use_sma': False, 'use_atr': False, 'use_adx': False, 'use_ema': True, 'use_spike': False, 'rsi_required': True, 'edge_k': 1.939351704333522, 'edge_cap': 0.4613908889393349, 'bull_strategy': 'mean_reversion', 'bull_bb_std_mult': 2.9147101007616247, 'bull_rsi_os': 27, 'bull_rsi_ob': 68, 'bull_adx_thresh': 30.745882551197894, 'bull_atr_min_pct': 0.007383180091769927, 'bull_atr_max_pct': 0.0807515219969491, 'bull_tp_mult': 2.284566396188101, 'bull_tsl_mult': 0.9912919731255546, 'bull_time_stop': 67, 'bull_use_sma': True, 'bull_use_ema': False, 'bull_use_atr': False, 'bull_use_adx': False, 'bull_use_spike': False, 'bull_rsi_required': True, 'bear_strategy': 'breakout', 'bear_bb_std_mult': 3.3530052412873568, 'bear_rsi_os': 26, 'bear_rsi_ob': 73, 'bear_adx_thresh': 15.288988875270086, 'bear_atr_min_pct': 0.007572366173906264, 'bear_atr_max_pct': 0.10277867283038092, 'bear_tp_mult': 2.0275576441424783, 'bear_tsl_mult': 0.4144716056976305, 'bear_time_stop': 270, 'bear_use_sma': False, 'bear_use_ema': False, 'bear_use_atr': True, 'bear_use_adx': True, 'bear_use_spike': True, 'bear_rsi_required': True, 'sideways_strategy': 'breakout', 'sideways_bb_std_mult': 0.8793750446118439, 'sideways_rsi_os': 47, 'sideways_rsi_ob': 91, 'sideways_adx_thresh': 30.053562145149197, 'sideways_atr_min_pct': 0.01979855389704093, 'sideways_atr_max_pct': 0.10222780342678582, 'sideways_tp_mult': 2.7854824801316393, 'sideways_tsl_mult': 0.3599218017356919, 'sideways_time_stop': 187, 'sideways_use_sma': False, 'sideways_use_ema': True, 'sideways_use_atr': False, 'sideways_use_adx': True, 'sideways_use_spike': True, 'sideways_rsi_required': False}.
