[I 2025-08-31 10:08:20,893] Trial 377 finished with values: [-1000000000.0, 1000000000.0] and parameters: {'p_sma': 49, 'p_std': 47, 'p_atr': 30, 'p_adx': 25, 'rsi_period': 56, 'ema1': 11, 'ema2': 40, 'slip_atr_k': 0.15579889191334398, 'slip_spread_k': 0.32073511308574104, 'spread_hl_frac': 0.01789328315778203, 'bb_std_mult': 1.843505780582583, 'rsi_os': 39, 'rsi_ob': 54, 'vol_spike': 0.10384424130113046, 'adx_thresh': 6.660645255219354, 'atr_min_pct': 0.01151603841542351, 'atr_max_pct': 0.13587773331746442, 'tp_mult': 1.9914103300034909, 'tsl_mult': 0.0008739343713334492, 'strategy': 'breakout', 'time_stop': 146, 'use_sma': True, 'use_atr': True, 'use_adx': False, 'use_ema': True, 'use_spike': False, 'rsi_required': True, 'edge_k': 0.04625796177025576, 'edge_cap': 0.7060789782137822, 'bull_strategy': 'breakout', 'bull_bb_std_mult': 1.3315485126150202, 'bull_rsi_os': 20, 'bull_rsi_ob': 67, 'bull_adx_thresh': 31.95033028284563, 'bull_atr_min_pct': 0.0019482626517473567, 'bull_atr_max_pct': 0.09939947961666554, 'bull_tp_mult': 1.440771151716615, 'bull_tsl_mult': 0.622871525209401, 'bull_time_stop': 241, 'bull_use_sma': True, 'bull_use_ema': False, 'bull_use_atr': False, 'bull_use_adx': False, 'bull_use_spike': False, 'bull_rsi_required': True, 'bear_strategy': 'breakout', 'bear_bb_std_mult': 3.006367151902404, 'bear_rsi_os': 48, 'bear_rsi_ob': 80, 'bear_adx_thresh': 32.961450341408266, 'bear_atr_min_pct': 0.016371156120478576, 'bear_atr_max_pct': 0.14013301511975462, 'bear_tp_mult': 2.912241732047571, 'bear_tsl_mult': 0.5051028799092873, 'bear_time_stop': 268, 'bear_use_sma': False, 'bear_use_ema': True, 'bear_use_atr': False, 'bear_use_adx': True, 'bear_use_spike': True, 'bear_rsi_required': False, 'sideways_strategy': 'breakout', 'sideways_bb_std_mult': 1.0696792737605325, 'sideways_rsi_os': 20, 'sideways_rsi_ob': 62, 'sideways_adx_thresh': 31.908948960051845, 'sideways_atr_min_pct': 0.002656833956174916, 'sideways_atr_max_pct': 0.017733654566007714, 'sideways_tp_mult': 1.3832277651882205, 'sideways_tsl_mult': 0.0386084675727063, 'sideways_time_stop': 247, 'sideways_use_sma': True, 'sideways_use_ema': True, 'sideways_use_atr': False, 'sideways_use_adx': True, 'sideways_use_spike': True, 'sideways_rsi_required': False}.
[I 2025-08-31 10:08:21,803] Trial 379 finished with values: [-1000000000.0, 1000000000.0] and parameters: {'p_sma': 49, 'p_std': 37, 'p_atr': 30, 'p_adx': 12, 'rsi_period': 30, 'ema1': 19, 'ema2': 37, 'slip_atr_k': 0.17894711495138899, 'slip_spread_k': 0.40931187000721825, 'spread_hl_frac': 0.012765374191603686, 'bb_std_mult': 1.0743423494041497, 'rsi_os': 22, 'rsi_ob': 54, 'vol_spike': 0.018500113039018884, 'adx_thresh': 10.790385382801222, 'atr_min_pct': 0.012275186410539443, 'atr_max_pct': 0.1353171862237514, 'tp_mult': 1.97508251893605, 'tsl_mult': 0.00016266605295415045, 'strategy': 'breakout', 'time_stop': 144, 'use_sma': True, 'use_atr': False, 'use_adx': True, 'use_ema': False, 'use_spike': False, 'rsi_required': True, 'edge_k': 1.907080243471565, 'edge_cap': 0.09620808098651562, 'bull_strategy': 'breakout', 'bull_bb_std_mult': 1.3067306362478974, 'bull_rsi_os': 33, 'bull_rsi_ob': 67, 'bull_adx_thresh': 30.605841480902512, 'bull_atr_min_pct': 0.019815096591430468, 'bull_atr_max_pct': 0.10832114692436778, 'bull_tp_mult': 1.442727681622857, 'bull_tsl_mult': 0.6237151783310819, 'bull_time_stop': 241, 'bull_use_sma': False, 'bull_use_ema': False, 'bull_use_atr': False, 'bull_use_adx': True, 'bull_use_spike': True, 'bull_rsi_required': True, 'bear_strategy': 'mean_reversion', 'bear_bb_std_mult': 2.1730545941261235, 'bear_rsi_os': 15, 'bear_rsi_ob': 77, 'bear_adx_thresh': 21.39662750186249, 'bear_atr_min_pct': 4.588601230649976e-05, 'bear_atr_max_pct': 0.13914984584753906, 'bear_tp_mult': 1.793018700783791, 'bear_tsl_mult': 0.5535563967961922, 'bear_time_stop': 248, 'bear_use_sma': False, 'bear_use_ema': True, 'bear_use_atr': False, 'bear_use_adx': True, 'bear_use_spike': False, 'bear_rsi_required': True, 'sideways_strategy': 'breakout', 'sideways_bb_std_mult': 0.9460752384834913, 'sideways_rsi_os': 25, 'sideways_rsi_ob': 60, 'sideways_adx_thresh': 33.51048983976151, 'sideways_atr_min_pct': 0.02995894646869727, 'sideways_atr_max_pct': 0.026465631499060546, 'sideways_tp_mult': 1.384112951910822, 'sideways_tsl_mult': 0.10061972301090424, 'sideways_time_stop': 236, 'sideways_use_sma': True, 'sideways_use_ema': True, 'sideways_use_atr': True, 'sideways_use_adx': True, 'sideways_use_spike': False, 'sideways_rsi_required': False}.
[I 2025-08-31 10:08:22,321] Trial 382 finished with values: [-1000000000.0, 1000000000.0] and parameters: {'p_sma': 52, 'p_std': 11, 'p_atr': 25, 'p_adx': 12, 'rsi_period': 23, 'ema1': 28, 'ema2': 28, 'slip_atr_k': 0.17879354119777083, 'slip_spread_k': 0.25227116120387205, 'spread_hl_frac': 0.04984995613556639, 'bb_std_mult': 1.4441309997771599, 'rsi_os': 22, 'rsi_ob': 49, 'vol_spike': 0.11254424179955255, 'adx_thresh': 6.449465408509797, 'atr_min_pct': 0.013604722994118194, 'atr_max_pct': 0.12599428953192782, 'tp_mult': 2.9020189591409564, 'tsl_mult': 0.04202614460981302, 'strategy': 'mean_reversion', 'time_stop': 138, 'use_sma': False, 'use_atr': False, 'use_adx': True, 'use_ema': False, 'use_spike': True, 'rsi_required': True, 'edge_k': 1.910878618699926, 'edge_cap': 0.7889148182038779, 'bull_strategy': 'mean_reversion', 'bull_bb_std_mult': 1.982808458557051, 'bull_rsi_os': 35, 'bull_rsi_ob': 65, 'bull_adx_thresh': 7.893532955925956, 'bull_atr_min_pct': 0.016038914605707163, 'bull_atr_max_pct': 0.11353060665772297, 'bull_tp_mult': 1.483824668741693, 'bull_tsl_mult': 0.5711199970703242, 'bull_time_stop': 71, 'bull_use_sma': False, 'bull_use_ema': False, 'bull_use_atr': True, 'bull_use_adx': True, 'bull_use_spike': True, 'bull_rsi_required': True, 'bear_strategy': 'mean_reversion', 'bear_bb_std_mult': 2.8920775040126845, 'bear_rsi_os': 52, 'bear_rsi_ob': 78, 'bear_adx_thresh': 21.440600277127473, 'bear_atr_min_pct': 0.021449030675320127, 'bear_atr_max_pct': 0.06743661766965506, 'bear_tp_mult': 2.535442377417242, 'bear_tsl_mult': 0.5406694816438509, 'bear_time_stop': 149, 'bear_use_sma': True, 'bear_use_ema': True, 'bear_use_atr': True, 'bear_use_adx': True, 'bear_use_spike': False, 'bear_rsi_required': True, 'sideways_strategy': 'mean_reversion', 'sideways_bb_std_mult': 1.1381424784678151, 'sideways_rsi_os': 24, 'sideways_rsi_ob': 58, 'sideways_adx_thresh': 33.5458515414459, 'sideways_atr_min_pct': 0.0018980769612187808, 'sideways_atr_max_pct': 0.026530504364467467, 'sideways_tp_mult': 1.3092476363800165, 'sideways_tsl_mult': 0.06162992522790468, 'sideways_time_stop': 182, 'sideways_use_sma': False, 'sideways_use_ema': False, 'sideways_use_atr': True, 'sideways_use_adx': False, 'sideways_use_spike': False, 'sideways_rsi_required': True}.
[I 2025-08-31 10:08:22,388] Trial 383 finished with values: [-1000000000.0, 1000000000.0] and parameters: {'p_sma': 52, 'p_std': 44, 'p_atr': 28, 'p_adx': 22, 'rsi_period': 21, 'ema1': 19, 'ema2': 37, 'slip_atr_k': 0.1429013407132645, 'slip_spread_k': 0.5562415349133982, 'spread_hl_frac': 0.021578650695987574, 'bb_std_mult': 0.6611339580721058, 'rsi_os': 22, 'rsi_ob': 49, 'vol_spike': 0.05401748338810887, 'adx_thresh': 6.643984493930443, 'atr_min_pct': 0.012770966793580068, 'atr_max_pct': 0.14005409941779307, 'tp_mult': 1.8026467100755263, 'tsl_mult': 0.25856742062631044, 'strategy': 'mean_reversion', 'time_stop': 154, 'use_sma': False, 'use_atr': False, 'use_adx': True, 'use_ema': False, 'use_spike': True, 'rsi_required': True, 'edge_k': 1.4669444823409006, 'edge_cap': 0.12443894178208478, 'bull_strategy': 'mean_reversion', 'bull_bb_std_mult': 2.107148792603597, 'bull_rsi_os': 43, 'bull_rsi_ob': 65, 'bull_adx_thresh': 8.300209218008407, 'bull_atr_min_pct': 0.004998991668497573, 'bull_atr_max_pct': 0.12125591686428916, 'bull_tp_mult': 1.4825887822697044, 'bull_tsl_mult': 0.4546336998009619, 'bull_time_stop': 287, 'bull_use_sma': False, 'bull_use_ema': False, 'bull_use_atr': True, 'bull_use_adx': True, 'bull_use_spike': True, 'bull_rsi_required': True, 'bear_strategy': 'mean_reversion', 'bear_bb_std_mult': 3.3851096663986033, 'bear_rsi_os': 42, 'bear_rsi_ob': 73, 'bear_adx_thresh': 20.177562768650983, 'bear_atr_min_pct': 0.021622032072635345, 'bear_atr_max_pct': 0.12432021911179296, 'bear_tp_mult': 2.5035036759842164, 'bear_tsl_mult': 0.9328531105443895, 'bear_time_stop': 261, 'bear_use_sma': True, 'bear_use_ema': True, 'bear_use_atr': True, 'bear_use_adx': True, 'bear_use_spike': False, 'bear_rsi_required': True, 'sideways_strategy': 'mean_reversion', 'sideways_bb_std_mult': 2.7930262061814792, 'sideways_rsi_os': 24, 'sideways_rsi_ob': 63, 'sideways_adx_thresh': 32.93261546812206, 'sideways_atr_min_pct': 0.002062706732288271, 'sideways_atr_max_pct': 0.13404698819012628, 'sideways_tp_mult': 2.7473981045795504, 'sideways_tsl_mult': 0.066420688954056, 'sideways_time_stop': 182, 'sideways_use_sma': False, 'sideways_use_ema': False, 'sideways_use_atr': True, 'sideways_use_adx': False, 'sideways_use_spike': False, 'sideways_rsi_required': True}.
[I 2025-08-31 10:08:49,672] Trial 380 finished with values: [-0.03653994451652964, 0.03634027666463395] and parameters: {'p_sma': 52, 'p_std': 44, 'p_atr': 30, 'p_adx': 12, 'rsi_period': 30, 'ema1': 19, 'ema2': 28, 'slip_atr_k': 0.17964594732616068, 'slip_spread_k': 0.4308714889292128, 'spread_hl_frac': 0.04117135745006004, 'bb_std_mult': 1.0020449523558093, 'rsi_os': 22, 'rsi_ob': 49, 'vol_spike': 0.10597676934984959, 'adx_thresh': 31.601426140479724, 'atr_min_pct': 0.0076201882471930455, 'atr_max_pct': 0.12695736173798813, 'tp_mult': 2.896813295150905, 'tsl_mult': 0.4638007808133682, 'strategy': 'breakout', 'time_stop': 146, 'use_sma': True, 'use_atr': False, 'use_adx': True, 'use_ema': True, 'use_spike': False, 'rsi_required': True, 'edge_k': 1.9135400628381876, 'edge_cap': 0.09803904023061284, 'bull_strategy': 'breakout', 'bull_bb_std_mult': 1.3133608530946361, 'bull_rsi_os': 38, 'bull_rsi_ob': 67, 'bull_adx_thresh': 8.000993511967916, 'bull_atr_min_pct': 0.020318291003564103, 'bull_atr_max_pct': 0.10986360923971215, 'bull_tp_mult': 1.472310941444284, 'bull_tsl_mult': 0.7437825862294452, 'bull_time_stop': 5, 'bull_use_sma': False, 'bull_use_ema': False, 'bull_use_atr': False, 'bull_use_adx': True, 'bull_use_spike': True, 'bull_rsi_required': True, 'bear_strategy': 'mean_reversion', 'bear_bb_std_mult': 1.6286488823751883, 'bear_rsi_os': 55, 'bear_rsi_ob': 77, 'bear_adx_thresh': 20.03569020440259, 'bear_atr_min_pct': 0.004426462758295672, 'bear_atr_max_pct': 0.14285891317745456, 'bear_tp_mult': 2.529403872132533, 'bear_tsl_mult': 0.553683602915048, 'bear_time_stop': 83, 'bear_use_sma': True, 'bear_use_ema': True, 'bear_use_atr': False, 'bear_use_adx': True, 'bear_use_spike': False, 'bear_rsi_required': True, 'sideways_strategy': 'mean_reversion', 'sideways_bb_std_mult': 1.1474154458617156, 'sideways_rsi_os': 25, 'sideways_rsi_ob': 60, 'sideways_adx_thresh': 33.38783720290379, 'sideways_atr_min_pct': 0.001921787430437253, 'sideways_atr_max_pct': 0.02730336967374695, 'sideways_tp_mult': 1.6061971521376133, 'sideways_tsl_mult': 0.6186659806894044, 'sideways_time_stop': 234, 'sideways_use_sma': True, 'sideways_use_ema': False, 'sideways_use_atr': True, 'sideways_use_adx': False, 'sideways_use_spike': False, 'sideways_rsi_required': True}.
[I 2025-08-31 10:08:50,095] Trial 381 finished with values: [-0.024877062145835183, 0.024663839839013338] and parameters: {'p_sma': 52, 'p_std': 43, 'p_atr': 30, 'p_adx': 10, 'rsi_period': 50, 'ema1': 19, 'ema2': 37, 'slip_atr_k': 0.17750560909272792, 'slip_spread_k': 0.8208445007318435, 'spread_hl_frac': 0.01255047659462187, 'bb_std_mult': 0.6750894178022349, 'rsi_os': 22, 'rsi_ob': 49, 'vol_spike': 0.2997162984987167, 'adx_thresh': 6.764277634617186, 'atr_min_pct': 0.007586342245678773, 'atr_max_pct': 0.13514648285157818, 'tp_mult': 1.9844261487123456, 'tsl_mult': 0.23020925447344737, 'strategy': 'breakout', 'time_stop': 31, 'use_sma': False, 'use_atr': False, 'use_adx': True, 'use_ema': False, 'use_spike': True, 'rsi_required': True, 'edge_k': 0.038850105471261775, 'edge_cap': 0.1044943030684824, 'bull_strategy': 'mean_reversion', 'bull_bb_std_mult': 1.3336206443583318, 'bull_rsi_os': 29, 'bull_rsi_ob': 67, 'bull_adx_thresh': 6.308620406205536, 'bull_atr_min_pct': 0.016291772627077827, 'bull_atr_max_pct': 0.11337468903675238, 'bull_tp_mult': 1.4810304063039588, 'bull_tsl_mult': 0.563779650778393, 'bull_time_stop': 240, 'bull_use_sma': False, 'bull_use_ema': False, 'bull_use_atr': False, 'bull_use_adx': True, 'bull_use_spike': True, 'bull_rsi_required': True, 'bear_strategy': 'mean_reversion', 'bear_bb_std_mult': 2.8952694779874646, 'bear_rsi_os': 52, 'bear_rsi_ob': 73, 'bear_adx_thresh': 21.505084366754723, 'bear_atr_min_pct': 0.021600160542806796, 'bear_atr_max_pct': 0.13023519681796533, 'bear_tp_mult': 2.910254223995486, 'bear_tsl_mult': 0.5323331729780828, 'bear_time_stop': 276, 'bear_use_sma': True, 'bear_use_ema': True, 'bear_use_atr': True, 'bear_use_adx': True, 'bear_use_spike': False, 'bear_rsi_required': True, 'sideways_strategy': 'mean_reversion', 'sideways_bb_std_mult': 1.1252229305040435, 'sideways_rsi_os': 43, 'sideways_rsi_ob': 58, 'sideways_adx_thresh': 33.4991996934719, 'sideways_atr_min_pct': 0.002050017550935455, 'sideways_atr_max_pct': 0.017498349607941374, 'sideways_tp_mult': 2.114193797270434, 'sideways_tsl_mult': 0.10148480612609603, 'sideways_time_stop': 235, 'sideways_use_sma': False, 'sideways_use_ema': False, 'sideways_use_atr': True, 'sideways_use_adx': False, 'sideways_use_spike': False, 'sideways_rsi_required': True}.
[I 2025-08-31 10:08:53,302] Trial 384 finished with values: [-0.12895173728985687, 0.12883589029076203] and parameters: {'p_sma': 47, 'p_std': 15, 'p_atr': 27, 'p_adx': 8, 'rsi_period': 21, 'ema1': 20, 'ema2': 25, 'slip_atr_k': 0.1432263075818745, 'slip_spread_k': 0.3845933672276466, 'spread_hl_frac': 0.007683324527383517, 'bb_std_mult': 1.0021360814613733, 'rsi_os': 48, 'rsi_ob': 73, 'vol_spike': 0.009864702152496685, 'adx_thresh': 5.004188574542203, 'atr_min_pct': 0.00849713208348733, 'atr_max_pct': 0.13947762778575945, 'tp_mult': 2.8325024722536507, 'tsl_mult': 0.4625407584859878, 'strategy': 'breakout', 'time_stop': 153, 'use_sma': False, 'use_atr': False, 'use_adx': False, 'use_ema': False, 'use_spike': True, 'rsi_required': True, 'edge_k': 1.7804432815586306, 'edge_cap': 0.9497227584798733, 'bull_strategy': 'mean_reversion', 'bull_bb_std_mult': 1.4120144845136344, 'bull_rsi_os': 5, 'bull_rsi_ob': 65, 'bull_adx_thresh': 21.507930208859953, 'bull_atr_min_pct': 0.027215142871314723, 'bull_atr_max_pct': 0.1220040553740127, 'bull_tp_mult': 2.4116535491256554, 'bull_tsl_mult': 0.4564822614613161, 'bull_time_stop': 104, 'bull_use_sma': True, 'bull_use_ema': False, 'bull_use_atr': False, 'bull_use_adx': False, 'bull_use_spike': False, 'bull_rsi_required': True, 'bear_strategy': 'breakout', 'bear_bb_std_mult': 2.840539340393021, 'bear_rsi_os': 20, 'bear_rsi_ob': 72, 'bear_adx_thresh': 22.250215853873858, 'bear_atr_min_pct': 0.0044171199014165115, 'bear_atr_max_pct': 0.1434068136818493, 'bear_tp_mult': 1.861668335634905, 'bear_tsl_mult': 0.3059406989598891, 'bear_time_stop': 265, 'bear_use_sma': True, 'bear_use_ema': False, 'bear_use_atr': False, 'bear_use_adx': True, 'bear_use_spike': False, 'bear_rsi_required': True, 'sideways_strategy': 'mean_reversion', 'sideways_bb_std_mult': 1.739763114779845, 'sideways_rsi_os': 25, 'sideways_rsi_ob': 63, 'sideways_adx_thresh': 20.063531169318125, 'sideways_atr_min_pct': 0.0011842897549941174, 'sideways_atr_max_pct': 0.03195478020692338, 'sideways_tp_mult': 1.4715726461411158, 'sideways_tsl_mult': 0.8916376186597921, 'sideways_time_stop': 197, 'sideways_use_sma': True, 'sideways_use_ema': False, 'sideways_use_atr': False, 'sideways_use_adx': False, 'sideways_use_spike': False, 'sideways_rsi_required': True}.
[I 2025-08-31 10:08:53,716] Trial 385 finished with values: [-0.08182036176973106, 0.08167772854191278] and parameters: {'p_sma': 47, 'p_std': 25, 'p_atr': 27, 'p_adx': 15, 'rsi_period': 32, 'ema1': 20, 'ema2': 48, 'slip_atr_k': 0.11949665666752958, 'slip_spread_k': 0.37771980709001257, 'spread_hl_frac': 0.020516968157272004, 'bb_std_mult': 0.9989683128994021, 'rsi_os': 24, 'rsi_ob': 78, 'vol_spike': 0.19721945116135112, 'adx_thresh': 30.17183225342253, 'atr_min_pct': 0.008632934255230772, 'atr_max_pct': 0.0545855790282527, 'tp_mult': 2.8205537909791287, 'tsl_mult': 0.22940827890539978, 'strategy': 'breakout', 'time_stop': 65, 'use_sma': False, 'use_atr': False, 'use_adx': False, 'use_ema': False, 'use_spike': False, 'rsi_required': True, 'edge_k': 1.771639502527355, 'edge_cap': 0.37373369239856996, 'bull_strategy': 'mean_reversion', 'bull_bb_std_mult': 1.0760926007573854, 'bull_rsi_os': 5, 'bull_rsi_ob': 63, 'bull_adx_thresh': 30.854241240008424, 'bull_atr_min_pct': 0.016547154020353182, 'bull_atr_max_pct': 0.04706382284991581, 'bull_tp_mult': 2.415785133951121, 'bull_tsl_mult': 0.7402088696502723, 'bull_time_stop': 8, 'bull_use_sma': True, 'bull_use_ema': True, 'bull_use_atr': False, 'bull_use_adx': False, 'bull_use_spike': False, 'bull_rsi_required': True, 'bear_strategy': 'breakout', 'bear_bb_std_mult': 2.8223598443068054, 'bear_rsi_os': 40, 'bear_rsi_ob': 78, 'bear_adx_thresh': 19.971418137712316, 'bear_atr_min_pct': 0.00437518856114723, 'bear_atr_max_pct': 0.14390200604404224, 'bear_tp_mult': 2.797891832814238, 'bear_tsl_mult': 0.35626855750112907, 'bear_time_stop': 277, 'bear_use_sma': False, 'bear_use_ema': False, 'bear_use_atr': False, 'bear_use_adx': True, 'bear_use_spike': False, 'bear_rsi_required': True, 'sideways_strategy': 'breakout', 'sideways_bb_std_mult': 1.1233530058336858, 'sideways_rsi_os': 38, 'sideways_rsi_ob': 53, 'sideways_adx_thresh': 19.915923372943087, 'sideways_atr_min_pct': 0.0011444714262089568, 'sideways_atr_max_pct': 0.03132517891732964, 'sideways_tp_mult': 1.616554523745149, 'sideways_tsl_mult': 0.6243307229247752, 'sideways_time_stop': 227, 'sideways_use_sma': True, 'sideways_use_ema': True, 'sideways_use_atr': False, 'sideways_use_adx': False, 'sideways_use_spike': False, 'sideways_rsi_required': False}.
[I 2025-08-31 10:09:24,797] Trial 386 finished with values: [-1000000000.0, 1000000000.0] and parameters: {'p_sma': 43, 'p_std': 18, 'p_atr': 27, 'p_adx': 15, 'rsi_period': 51, 'ema1': 29, 'ema2': 48, 'slip_atr_k': 0.11626188432957316, 'slip_spread_k': 0.41433996630190467, 'spread_hl_frac': 0.010465309884420494, 'bb_std_mult': 1.3124020670682897, 'rsi_os': 23, 'rsi_ob': 74, 'vol_spike': 0.17885415527771045, 'adx_thresh': 23.478770393397575, 'atr_min_pct': 0.012136132918298185, 'atr_max_pct': 0.05021755749692729, 'tp_mult': 2.946697356749078, 'tsl_mult': 0.08011082179480322, 'strategy': 'breakout', 'time_stop': 134, 'use_sma': False, 'use_atr': False, 'use_adx': False, 'use_ema': False, 'use_spike': False, 'rsi_required': True, 'edge_k': 1.8695563324010216, 'edge_cap': 0.08590954994364215, 'bull_strategy': 'mean_reversion', 'bull_bb_std_mult': 1.5925817171634225, 'bull_rsi_os': 33, 'bull_rsi_ob': 62, 'bull_adx_thresh': 11.06082225801163, 'bull_atr_min_pct': 0.016534360470640157, 'bull_atr_max_pct': 0.12191885404626927, 'bull_tp_mult': 1.5565224223630545, 'bull_tsl_mult': 0.03173127583559471, 'bull_time_stop': 8, 'bull_use_sma': True, 'bull_use_ema': True, 'bull_use_atr': False, 'bull_use_adx': False, 'bull_use_spike': False, 'bull_rsi_required': True, 'bear_strategy': 'breakout', 'bear_bb_std_mult': 2.797335626898298, 'bear_rsi_os': 54, 'bear_rsi_ob': 82, 'bear_adx_thresh': 22.398023268473914, 'bear_atr_min_pct': 0.019881424760323216, 'bear_atr_max_pct': 0.14337361306129953, 'bear_tp_mult': 2.798149919649938, 'bear_tsl_mult': 0.30472373525645874, 'bear_time_stop': 275, 'bear_use_sma': False, 'bear_use_ema': False, 'bear_use_atr': False, 'bear_use_adx': True, 'bear_use_spike': False, 'bear_rsi_required': True, 'sideways_strategy': 'breakout', 'sideways_bb_std_mult': 1.2117769686128608, 'sideways_rsi_os': 9, 'sideways_rsi_ob': 87, 'sideways_adx_thresh': 34.15647786410397, 'sideways_atr_min_pct': 0.02159254659388525, 'sideways_atr_max_pct': 0.06008335638501055, 'sideways_tp_mult': 1.6042545722835173, 'sideways_tsl_mult': 0.0956573293364403, 'sideways_time_stop': 230, 'sideways_use_sma': True, 'sideways_use_ema': True, 'sideways_use_atr': False, 'sideways_use_adx': False, 'sideways_use_spike': False, 'sideways_rsi_required': False}.
