[I 2025-08-31 10:56:49,915] Trial 745 finished with values: [-1000000000.0, 1000000000.0] and parameters: {'p_sma': 60, 'p_std': 60, 'p_atr': 28, 'p_adx': 7, 'rsi_period': 37, 'ema1': 18, 'ema2': 47, 'slip_atr_k': 0.07330995202164212, 'slip_spread_k': 0.12447407993015185, 'spread_hl_frac': 0.008229646198207024, 'bb_std_mult': 1.0487288503083427, 'rsi_os': 38, 'rsi_ob': 84, 'vol_spike': 0.2999181603309825, 'adx_thresh': 12.33085442251495, 'atr_min_pct': 0.011282787878415013, 'atr_max_pct': 0.10542721704209448, 'tp_mult': 2.9968770975082144, 'tsl_mult': 0.7197905107540754, 'strategy': 'mean_reversion', 'time_stop': 162, 'use_sma': True, 'use_atr': False, 'use_adx': True, 'use_ema': True, 'use_spike': True, 'rsi_required': True, 'edge_k': 0.3430353924138172, 'edge_cap': 0.07109462968875502, 'bull_strategy': 'breakout', 'bull_bb_std_mult': 1.0508153129599962, 'bull_rsi_os': 26, 'bull_rsi_ob': 84, 'bull_adx_thresh': 31.0719150037531, 'bull_atr_min_pct': 0.007204254297345141, 'bull_atr_max_pct': 0.059325671127660795, 'bull_tp_mult': 1.0134258942509244, 'bull_tsl_mult': 0.9768090828751562, 'bull_time_stop': 69, 'bull_use_sma': False, 'bull_use_ema': False, 'bull_use_atr': False, 'bull_use_adx': False, 'bull_use_spike': False, 'bull_rsi_required': False, 'bear_strategy': 'mean_reversion', 'bear_bb_std_mult': 2.845297873276304, 'bear_rsi_os': 40, 'bear_rsi_ob': 56, 'bear_adx_thresh': 21.223524688750107, 'bear_atr_min_pct': 0.0009409094922189186, 'bear_atr_max_pct': 0.1083998042714897, 'bear_tp_mult': 2.1199800635849435, 'bear_tsl_mult': 0.9012192786522395, 'bear_time_stop': 272, 'bear_use_sma': False, 'bear_use_ema': True, 'bear_use_atr': True, 'bear_use_adx': True, 'bear_use_spike': True, 'bear_rsi_required': True, 'sideways_strategy': 'breakout', 'sideways_bb_std_mult': 0.9699535625602391, 'sideways_rsi_os': 22, 'sideways_rsi_ob': 95, 'sideways_adx_thresh': 28.371332204587343, 'sideways_atr_min_pct': 0.001246766318252908, 'sideways_atr_max_pct': 0.05558832639700907, 'sideways_tp_mult': 2.9605498008980025, 'sideways_tsl_mult': 0.15140129790193557, 'sideways_time_stop': 150, 'sideways_use_sma': False, 'sideways_use_ema': True, 'sideways_use_atr': False, 'sideways_use_adx': False, 'sideways_use_spike': True, 'sideways_rsi_required': False}.
[I 2025-08-31 10:56:50,112] Trial 746 finished with values: [-1000000000.0, 1000000000.0] and parameters: {'p_sma': 9, 'p_std': 47, 'p_atr': 30, 'p_adx': 7, 'rsi_period': 36, 'ema1': 18, 'ema2': 41, 'slip_atr_k': 0.17966549255745834, 'slip_spread_k': 0.12296908185816659, 'spread_hl_frac': 0.03563656216058242, 'bb_std_mult': 1.0540180642105266, 'rsi_os': 42, 'rsi_ob': 81, 'vol_spike': 0.06463452538077268, 'adx_thresh': 25.004798978437883, 'atr_min_pct': 0.022295062350603, 'atr_max_pct': 0.12880190493951194, 'tp_mult': 1.2512033277098034, 'tsl_mult': 0.7287350511123294, 'strategy': 'mean_reversion', 'time_stop': 134, 'use_sma': False, 'use_atr': False, 'use_adx': False, 'use_ema': True, 'use_spike': True, 'rsi_required': True, 'edge_k': 1.091759633741165, 'edge_cap': 0.1146119074275093, 'bull_strategy': 'mean_reversion', 'bull_bb_std_mult': 1.5813745093316118, 'bull_rsi_os': 5, 'bull_rsi_ob': 69, 'bull_adx_thresh': 25.1012175603914, 'bull_atr_min_pct': 0.007075429711106921, 'bull_atr_max_pct': 0.058709181920334, 'bull_tp_mult': 2.1607547246626946, 'bull_tsl_mult': 0.9702515700691022, 'bull_time_stop': 80, 'bull_use_sma': False, 'bull_use_ema': False, 'bull_use_atr': False, 'bull_use_adx': False, 'bull_use_spike': False, 'bull_rsi_required': True, 'bear_strategy': 'breakout', 'bear_bb_std_mult': 0.8955726026183639, 'bear_rsi_os': 31, 'bear_rsi_ob': 56, 'bear_adx_thresh': 21.26764978176245, 'bear_atr_min_pct': 0.005195694857661343, 'bear_atr_max_pct': 0.10766241357953371, 'bear_tp_mult': 2.139587161299857, 'bear_tsl_mult': 0.6720317015146244, 'bear_time_stop': 275, 'bear_use_sma': False, 'bear_use_ema': False, 'bear_use_atr': True, 'bear_use_adx': True, 'bear_use_spike': True, 'bear_rsi_required': True, 'sideways_strategy': 'breakout', 'sideways_bb_std_mult': 0.8223325571064435, 'sideways_rsi_os': 22, 'sideways_rsi_ob': 52, 'sideways_adx_thresh': 11.941105050529425, 'sideways_atr_min_pct': 0.0012169827693989253, 'sideways_atr_max_pct': 0.10301096867463844, 'sideways_tp_mult': 2.9585617831880753, 'sideways_tsl_mult': 0.6436467977236588, 'sideways_time_stop': 116, 'sideways_use_sma': False, 'sideways_use_ema': True, 'sideways_use_atr': False, 'sideways_use_adx': False, 'sideways_use_spike': True, 'sideways_rsi_required': False}.
[I 2025-08-31 10:57:23,286] Trial 751 finished with values: [-0.05189787926500322, 0.05176950411205228] and parameters: {'p_sma': 10, 'p_std': 44, 'p_atr': 30, 'p_adx': 11, 'rsi_period': 20, 'ema1': 18, 'ema2': 36, 'slip_atr_k': 0.17880155149484767, 'slip_spread_k': 0.14574180832116057, 'spread_hl_frac': 0.013392705781388105, 'bb_std_mult': 1.1701817478536667, 'rsi_os': 42, 'rsi_ob': 78, 'vol_spike': 0.02143696628414568, 'adx_thresh': 24.236341090291763, 'atr_min_pct': 0.017133948535533388, 'atr_max_pct': 0.08895915027298046, 'tp_mult': 1.0969791443395556, 'tsl_mult': 0.07857128257142182, 'strategy': 'breakout', 'time_stop': 252, 'use_sma': False, 'use_atr': False, 'use_adx': False, 'use_ema': True, 'use_spike': False, 'rsi_required': True, 'edge_k': 0.6166696025153653, 'edge_cap': 0.6623112156900945, 'bull_strategy': 'mean_reversion', 'bull_bb_std_mult': 1.950521383699789, 'bull_rsi_os': 5, 'bull_rsi_ob': 67, 'bull_adx_thresh': 29.786036043102506, 'bull_atr_min_pct': 0.00803683672900036, 'bull_atr_max_pct': 0.08538340430079452, 'bull_tp_mult': 1.9081006020332862, 'bull_tsl_mult': 0.8823304385428308, 'bull_time_stop': 216, 'bull_use_sma': True, 'bull_use_ema': False, 'bull_use_atr': True, 'bull_use_adx': True, 'bull_use_spike': False, 'bull_rsi_required': True, 'bear_strategy': 'breakout', 'bear_bb_std_mult': 2.899123464130287, 'bear_rsi_os': 31, 'bear_rsi_ob': 80, 'bear_adx_thresh': 22.229792673836116, 'bear_atr_min_pct': 0.007237960915324624, 'bear_atr_max_pct': 0.10130571878534211, 'bear_tp_mult': 2.826271974108737, 'bear_tsl_mult': 0.5051918480966974, 'bear_time_stop': 39, 'bear_use_sma': False, 'bear_use_ema': False, 'bear_use_atr': False, 'bear_use_adx': False, 'bear_use_spike': True, 'bear_rsi_required': True, 'sideways_strategy': 'breakout', 'sideways_bb_std_mult': 1.968109069000201, 'sideways_rsi_os': 33, 'sideways_rsi_ob': 49, 'sideways_adx_thresh': 29.786456467303406, 'sideways_atr_min_pct': 0.0007703933259733825, 'sideways_atr_max_pct': 0.10242176556834524, 'sideways_tp_mult': 1.3405063181490173, 'sideways_tsl_mult': 0.9834981993197968, 'sideways_time_stop': 110, 'sideways_use_sma': True, 'sideways_use_ema': True, 'sideways_use_atr': False, 'sideways_use_adx': False, 'sideways_use_spike': True, 'sideways_rsi_required': False}.
[I 2025-08-31 10:57:23,431] Trial 750 finished with values: [-0.012041851707762175, 0.011920345105958094] and parameters: {'p_sma': 10, 'p_std': 48, 'p_atr': 30, 'p_adx': 7, 'rsi_period': 21, 'ema1': 18, 'ema2': 36, 'slip_atr_k': 0.1933382434910064, 'slip_spread_k': 0.14421099646556326, 'spread_hl_frac': 0.010711154307680902, 'bb_std_mult': 2.708591711592729, 'rsi_os': 6, 'rsi_ob': 82, 'vol_spike': 0.2249869527916446, 'adx_thresh': 23.96667381820233, 'atr_min_pct': 0.01578439418879939, 'atr_max_pct': 0.12908288025712364, 'tp_mult': 2.8828609388824886, 'tsl_mult': 0.7247576562972252, 'strategy': 'mean_reversion', 'time_stop': 134, 'use_sma': False, 'use_atr': False, 'use_adx': False, 'use_ema': True, 'use_spike': False, 'rsi_required': True, 'edge_k': 0.6114200028087141, 'edge_cap': 0.06663836781389909, 'bull_strategy': 'mean_reversion', 'bull_bb_std_mult': 3.490993428786121, 'bull_rsi_os': 43, 'bull_rsi_ob': 83, 'bull_adx_thresh': 29.725043923564805, 'bull_atr_min_pct': 0.008064850146363624, 'bull_atr_max_pct': 0.08558589023730818, 'bull_tp_mult': 1.9034090755245676, 'bull_tsl_mult': 0.9790084274356486, 'bull_time_stop': 81, 'bull_use_sma': True, 'bull_use_ema': False, 'bull_use_atr': True, 'bull_use_adx': False, 'bull_use_spike': False, 'bull_rsi_required': False, 'bear_strategy': 'mean_reversion', 'bear_bb_std_mult': 2.8547081770370624, 'bear_rsi_os': 9, 'bear_rsi_ob': 77, 'bear_adx_thresh': 22.071562526171412, 'bear_atr_min_pct': 0.009492071648151138, 'bear_atr_max_pct': 0.046555128673328706, 'bear_tp_mult': 2.3964136793500623, 'bear_tsl_mult': 0.9181979582830486, 'bear_time_stop': 273, 'bear_use_sma': False, 'bear_use_ema': False, 'bear_use_atr': False, 'bear_use_adx': False, 'bear_use_spike': True, 'bear_rsi_required': True, 'sideways_strategy': 'breakout', 'sideways_bb_std_mult': 1.0237194149493993, 'sideways_rsi_os': 22, 'sideways_rsi_ob': 81, 'sideways_adx_thresh': 8.789462771065056, 'sideways_atr_min_pct': 0.0005227624915905446, 'sideways_atr_max_pct': 0.10349131527371286, 'sideways_tp_mult': 2.947030016432711, 'sideways_tsl_mult': 0.4972440942916088, 'sideways_time_stop': 131, 'sideways_use_sma': True, 'sideways_use_ema': True, 'sideways_use_atr': False, 'sideways_use_adx': False, 'sideways_use_spike': True, 'sideways_rsi_required': False}.
[I 2025-08-31 10:57:23,794] Trial 752 finished with values: [-1000000000.0, 1000000000.0] and parameters: {'p_sma': 12, 'p_std': 53, 'p_atr': 30, 'p_adx': 10, 'rsi_period': 21, 'ema1': 18, 'ema2': 36, 'slip_atr_k': 0.1931025013606704, 'slip_spread_k': 0.09644613701933472, 'spread_hl_frac': 0.00016812796891252368, 'bb_std_mult': 3.538963038275594, 'rsi_os': 39, 'rsi_ob': 82, 'vol_spike': 0.2933553152367502, 'adx_thresh': 24.08593043523456, 'atr_min_pct': 0.013633075114254862, 'atr_max_pct': 0.11088298030595839, 'tp_mult': 2.8964034418413624, 'tsl_mult': 0.4707013486825189, 'strategy': 'breakout', 'time_stop': 139, 'use_sma': False, 'use_atr': False, 'use_adx': False, 'use_ema': True, 'use_spike': False, 'rsi_required': True, 'edge_k': 0.9881990814447423, 'edge_cap': 0.6585760533610495, 'bull_strategy': 'mean_reversion', 'bull_bb_std_mult': 3.340788360642086, 'bull_rsi_os': 12, 'bull_rsi_ob': 67, 'bull_adx_thresh': 29.625735103991747, 'bull_atr_min_pct': 0.004565154369422567, 'bull_atr_max_pct': 0.08494094762274665, 'bull_tp_mult': 2.2568550452562786, 'bull_tsl_mult': 0.9424932817154372, 'bull_time_stop': 218, 'bull_use_sma': True, 'bull_use_ema': False, 'bull_use_atr': True, 'bull_use_adx': True, 'bull_use_spike': False, 'bull_rsi_required': True, 'bear_strategy': 'breakout', 'bear_bb_std_mult': 1.4036860599961405, 'bear_rsi_os': 9, 'bear_rsi_ob': 70, 'bear_adx_thresh': 25.753393211967936, 'bear_atr_min_pct': 0.009543007316914702, 'bear_atr_max_pct': 0.046451995554181225, 'bear_tp_mult': 2.1759596732621778, 'bear_tsl_mult': 0.4686911493505379, 'bear_time_stop': 248, 'bear_use_sma': False, 'bear_use_ema': True, 'bear_use_atr': False, 'bear_use_adx': False, 'bear_use_spike': True, 'bear_rsi_required': True, 'sideways_strategy': 'breakout', 'sideways_bb_std_mult': 1.0304237701496501, 'sideways_rsi_os': 55, 'sideways_rsi_ob': 93, 'sideways_adx_thresh': 29.800535582608493, 'sideways_atr_min_pct': 0.01505160608089293, 'sideways_atr_max_pct': 0.10487096381060165, 'sideways_tp_mult': 1.355390479063824, 'sideways_tsl_mult': 0.8986984081149882, 'sideways_time_stop': 109, 'sideways_use_sma': True, 'sideways_use_ema': True, 'sideways_use_atr': False, 'sideways_use_adx': False, 'sideways_use_spike': True, 'sideways_rsi_required': False}.
[I 2025-08-31 10:57:23,860] Trial 749 finished with values: [-0.023727451691847645, 0.0236303551011963] and parameters: {'p_sma': 60, 'p_std': 44, 'p_atr': 16, 'p_adx': 11, 'rsi_period': 21, 'ema1': 18, 'ema2': 36, 'slip_atr_k': 0.07216333145054972, 'slip_spread_k': 0.11972740995486264, 'spread_hl_frac': 0.00782355461356544, 'bb_std_mult': 1.0422122020847706, 'rsi_os': 38, 'rsi_ob': 82, 'vol_spike': 0.223641276058737, 'adx_thresh': 24.312123014910846, 'atr_min_pct': 0.013776058868545105, 'atr_max_pct': 0.12921928075870484, 'tp_mult': 2.696176295270292, 'tsl_mult': 0.7167314339870443, 'strategy': 'mean_reversion', 'time_stop': 133, 'use_sma': False, 'use_atr': False, 'use_adx': False, 'use_ema': True, 'use_spike': True, 'rsi_required': True, 'edge_k': 1.9620083903536827, 'edge_cap': 0.19147772255436318, 'bull_strategy': 'mean_reversion', 'bull_bb_std_mult': 2.786475399761454, 'bull_rsi_os': 29, 'bull_rsi_ob': 71, 'bull_adx_thresh': 29.748015219437583, 'bull_atr_min_pct': 0.007240227230849895, 'bull_atr_max_pct': 0.05856609798336709, 'bull_tp_mult': 1.9082172235297041, 'bull_tsl_mult': 0.9016034032526917, 'bull_time_stop': 218, 'bull_use_sma': True, 'bull_use_ema': False, 'bull_use_atr': True, 'bull_use_adx': False, 'bull_use_spike': False, 'bull_rsi_required': True, 'bear_strategy': 'breakout', 'bear_bb_std_mult': 2.8082677354922607, 'bear_rsi_os': 37, 'bear_rsi_ob': 80, 'bear_adx_thresh': 25.818840432106875, 'bear_atr_min_pct': 0.009639325284827091, 'bear_atr_max_pct': 0.033054164955146986, 'bear_tp_mult': 2.1385191387446647, 'bear_tsl_mult': 0.49047311038559455, 'bear_time_stop': 153, 'bear_use_sma': False, 'bear_use_ema': False, 'bear_use_atr': True, 'bear_use_adx': True, 'bear_use_spike': True, 'bear_rsi_required': True, 'sideways_strategy': 'breakout', 'sideways_bb_std_mult': 0.7898336808766261, 'sideways_rsi_os': 22, 'sideways_rsi_ob': 81, 'sideways_adx_thresh': 28.811132002656315, 'sideways_atr_min_pct': 0.0005737233590682615, 'sideways_atr_max_pct': 0.10438494739765132, 'sideways_tp_mult': 2.337521336575808, 'sideways_tsl_mult': 0.49574914808322695, 'sideways_time_stop': 107, 'sideways_use_sma': False, 'sideways_use_ema': True, 'sideways_use_atr': False, 'sideways_use_adx': False, 'sideways_use_spike': True, 'sideways_rsi_required': False}.
[I 2025-08-31 10:57:57,063] Trial 755 finished with values: [-1000000000.0, 1000000000.0] and parameters: {'p_sma': 11, 'p_std': 48, 'p_atr': 15, 'p_adx': 7, 'rsi_period': 25, 'ema1': 14, 'ema2': 38, 'slip_atr_k': 0.23777330324926632, 'slip_spread_k': 0.07683216123331847, 'spread_hl_frac': 0.010777869970806701, 'bb_std_mult': 1.4580054132363534, 'rsi_os': 10, 'rsi_ob': 90, 'vol_spike': 0.2844265645697389, 'adx_thresh': 23.73436704702636, 'atr_min_pct': 0.01178988175762906, 'atr_max_pct': 0.09379960767946727, 'tp_mult': 1.8844396720176515, 'tsl_mult': 0.12255593728197045, 'strategy': 'breakout', 'time_stop': 144, 'use_sma': False, 'use_atr': False, 'use_adx': False, 'use_ema': True, 'use_spike': False, 'rsi_required': True, 'edge_k': 1.4711787822256803, 'edge_cap': 0.1566815696916688, 'bull_strategy': 'mean_reversion', 'bull_bb_std_mult': 1.4174746988859532, 'bull_rsi_os': 28, 'bull_rsi_ob': 65, 'bull_adx_thresh': 22.94618101091051, 'bull_atr_min_pct': 0.01323787142785975, 'bull_atr_max_pct': 0.07988540401643203, 'bull_tp_mult': 2.0504230149023313, 'bull_tsl_mult': 0.1901958012150166, 'bull_time_stop': 87, 'bull_use_sma': True, 'bull_use_ema': False, 'bull_use_atr': False, 'bull_use_adx': False, 'bull_use_spike': True, 'bull_rsi_required': False, 'bear_strategy': 'mean_reversion', 'bear_bb_std_mult': 2.7475359534569317, 'bear_rsi_os': 17, 'bear_rsi_ob': 77, 'bear_adx_thresh': 30.879151048623818, 'bear_atr_min_pct': 0.013261815182227141, 'bear_atr_max_pct': 0.10319595735635494, 'bear_tp_mult': 2.9889072873584643, 'bear_tsl_mult': 0.7756017754030675, 'bear_time_stop': 263, 'bear_use_sma': False, 'bear_use_ema': True, 'bear_use_atr': False, 'bear_use_adx': True, 'bear_use_spike': True, 'bear_rsi_required': True, 'sideways_strategy': 'mean_reversion', 'sideways_bb_std_mult': 2.8063740322678474, 'sideways_rsi_os': 25, 'sideways_rsi_ob': 85, 'sideways_adx_thresh': 22.79605794179275, 'sideways_atr_min_pct': 0.001858193681795206, 'sideways_atr_max_pct': 0.10257514357217964, 'sideways_tp_mult': 2.9061116814036665, 'sideways_tsl_mult': 0.03133990756837263, 'sideways_time_stop': 24, 'sideways_use_sma': True, 'sideways_use_ema': False, 'sideways_use_atr': True, 'sideways_use_adx': False, 'sideways_use_spike': True, 'sideways_rsi_required': True}.
[I 2025-08-31 10:57:57,321] Trial 756 finished with values: [-1000000000.0, 1000000000.0] and parameters: {'p_sma': 28, 'p_std': 23, 'p_atr': 29, 'p_adx': 7, 'rsi_period': 25, 'ema1': 25, 'ema2': 38, 'slip_atr_k': 0.06056759612269581, 'slip_spread_k': 0.0762959913851205, 'spread_hl_frac': 0.010475436770023014, 'bb_std_mult': 1.2153513503808089, 'rsi_os': 54, 'rsi_ob': 84, 'vol_spike': 0.27204154023633387, 'adx_thresh': 23.97058157794969, 'atr_min_pct': 0.0156148199571231, 'atr_max_pct': 0.025561984563459518, 'tp_mult': 2.419498077101452, 'tsl_mult': 0.11393911624570865, 'strategy': 'breakout', 'time_stop': 145, 'use_sma': False, 'use_atr': False, 'use_adx': False, 'use_ema': True, 'use_spike': False, 'rsi_required': True, 'edge_k': 1.406091958262041, 'edge_cap': 0.15385961485835356, 'bull_strategy': 'mean_reversion', 'bull_bb_std_mult': 1.4163739567341465, 'bull_rsi_os': 23, 'bull_rsi_ob': 65, 'bull_adx_thresh': 25.869138939189895, 'bull_atr_min_pct': 0.008272024599068797, 'bull_atr_max_pct': 0.08066176873624092, 'bull_tp_mult': 2.06274056052584, 'bull_tsl_mult': 0.9842683608320459, 'bull_time_stop': 156, 'bull_use_sma': True, 'bull_use_ema': False, 'bull_use_atr': False, 'bull_use_adx': False, 'bull_use_spike': True, 'bull_rsi_required': False, 'bear_strategy': 'mean_reversion', 'bear_bb_std_mult': 2.5583648472730878, 'bear_rsi_os': 36, 'bear_rsi_ob': 78, 'bear_adx_thresh': 22.078914750879882, 'bear_atr_min_pct': 0.00814563636168093, 'bear_atr_max_pct': 0.026675006359690764, 'bear_tp_mult': 2.4024899769417427, 'bear_tsl_mult': 0.4233835594579163, 'bear_time_stop': 265, 'bear_use_sma': False, 'bear_use_ema': True, 'bear_use_atr': False, 'bear_use_adx': True, 'bear_use_spike': True, 'bear_rsi_required': True, 'sideways_strategy': 'mean_reversion', 'sideways_bb_std_mult': 0.9072977664770755, 'sideways_rsi_os': 28, 'sideways_rsi_ob': 85, 'sideways_adx_thresh': 12.438508358588283, 'sideways_atr_min_pct': 0.02448993428474438, 'sideways_atr_max_pct': 0.10238785179414275, 'sideways_tp_mult': 2.7627535855480976, 'sideways_tsl_mult': 0.035059523949301674, 'sideways_time_stop': 24, 'sideways_use_sma': True, 'sideways_use_ema': False, 'sideways_use_atr': True, 'sideways_use_adx': False, 'sideways_use_spike': True, 'sideways_rsi_required': True}.
[I 2025-08-31 10:57:57,473] Trial 754 finished with values: [-0.044790672085750716, 0.044683026582497606] and parameters: {'p_sma': 12, 'p_std': 48, 'p_atr': 29, 'p_adx': 11, 'rsi_period': 21, 'ema1': 25, 'ema2': 38, 'slip_atr_k': 0.23348405531058625, 'slip_spread_k': 0.09193457026094415, 'spread_hl_frac': 0.006887130858670591, 'bb_std_mult': 1.2432030264864236, 'rsi_os': 39, 'rsi_ob': 82, 'vol_spike': 0.09062382393008844, 'adx_thresh': 24.195397606857725, 'atr_min_pct': 0.007868246558065034, 'atr_max_pct': 0.07334848436306055, 'tp_mult': 2.694101036518303, 'tsl_mult': 0.22052493001270085, 'strategy': 'breakout', 'time_stop': 141, 'use_sma': False, 'use_atr': False, 'use_adx': False, 'use_ema': True, 'use_spike': False, 'rsi_required': True, 'edge_k': 1.9293490385281347, 'edge_cap': 0.15792568328611703, 'bull_strategy': 'mean_reversion', 'bull_bb_std_mult': 1.4144747115207343, 'bull_rsi_os': 29, 'bull_rsi_ob': 83, 'bull_adx_thresh': 8.77730017915944, 'bull_atr_min_pct': 0.029981079443037052, 'bull_atr_max_pct': 0.08136966786130923, 'bull_tp_mult': 1.712624676269661, 'bull_tsl_mult': 0.9408882949117839, 'bull_time_stop': 157, 'bull_use_sma': True, 'bull_use_ema': False, 'bull_use_atr': True, 'bull_use_adx': False, 'bull_use_spike': False, 'bull_rsi_required': True, 'bear_strategy': 'breakout', 'bear_bb_std_mult': 2.732252402520731, 'bear_rsi_os': 26, 'bear_rsi_ob': 77, 'bear_adx_thresh': 20.524099926174912, 'bear_atr_min_pct': 0.006447396595980237, 'bear_atr_max_pct': 0.03219783206888246, 'bear_tp_mult': 1.9158159823718637, 'bear_tsl_mult': 0.4713327748562683, 'bear_time_stop': 246, 'bear_use_sma': False, 'bear_use_ema': True, 'bear_use_atr': False, 'bear_use_adx': True, 'bear_use_spike': True, 'bear_rsi_required': True, 'sideways_strategy': 'breakout', 'sideways_bb_std_mult': 0.9074016542391161, 'sideways_rsi_os': 29, 'sideways_rsi_ob': 89, 'sideways_adx_thresh': 29.147812211975612, 'sideways_atr_min_pct': 0.0005028863360623231, 'sideways_atr_max_pct': 0.10537333230355567, 'sideways_tp_mult': 1.1504784655248343, 'sideways_tsl_mult': 0.03578564337953162, 'sideways_time_stop': 200, 'sideways_use_sma': True, 'sideways_use_ema': False, 'sideways_use_atr': False, 'sideways_use_adx': False, 'sideways_use_spike': True, 'sideways_rsi_required': False}.
