[I 2025-08-31 09:28:20,454] Trial 72 finished with values: [-1000000000.0, 1000000000.0] and parameters: {'p_sma': 32, 'p_std': 46, 'p_atr': 24, 'p_adx': 25, 'rsi_period': 7, 'ema1': 25, 'ema2': 13, 'slip_atr_k': 0.1768337462696385, 'slip_spread_k': 0.8239550831659262, 'spread_hl_frac': 0.013689578884484807, 'bb_std_mult': 2.827139433441619, 'rsi_os': 44, 'rsi_ob': 57, 'vol_spike': 0.21520402321009918, 'adx_thresh': 22.712405937793598, 'atr_min_pct': 0.015977003064341442, 'atr_max_pct': 0.09844505839947024, 'tp_mult': 2.5170620813277633, 'tsl_mult': 0.5360180747277116, 'strategy': 'breakout', 'time_stop': 258, 'use_sma': False, 'use_atr': True, 'use_adx': True, 'use_ema': True, 'use_spike': False, 'rsi_required': True, 'edge_k': 0.2209581483536831, 'edge_cap': 0.776927405971053, 'bull_strategy': 'mean_reversion', 'bull_bb_std_mult': 2.3797933821779207, 'bull_rsi_os': 36, 'bull_rsi_ob': 71, 'bull_adx_thresh': 15.364059543783378, 'bull_atr_min_pct': 0.027276404564230045, 'bull_atr_max_pct': 0.041763312599841486, 'bull_tp_mult': 2.3918062257165813, 'bull_tsl_mult': 0.5021288126117383, 'bull_time_stop': 178, 'bull_use_sma': False, 'bull_use_ema': False, 'bull_use_atr': True, 'bull_use_adx': False, 'bull_use_spike': False, 'bull_rsi_required': True, 'bear_strategy': 'breakout', 'bear_bb_std_mult': 2.820045957024624, 'bear_rsi_os': 41, 'bear_rsi_ob': 83, 'bear_adx_thresh': 15.998454374401057, 'bear_atr_min_pct': 0.01737224661060197, 'bear_atr_max_pct': 0.08404510570711216, 'bear_tp_mult': 2.5620636962557684, 'bear_tsl_mult': 0.28500086487876886, 'bear_time_stop': 115, 'bear_use_sma': False, 'bear_use_ema': False, 'bear_use_atr': True, 'bear_use_adx': True, 'bear_use_spike': True, 'bear_rsi_required': False, 'sideways_strategy': 'breakout', 'sideways_bb_std_mult': 2.8972991371893215, 'sideways_rsi_os': 17, 'sideways_rsi_ob': 85, 'sideways_adx_thresh': 18.391964865296742, 'sideways_atr_min_pct': 0.005461276197960149, 'sideways_atr_max_pct': 0.06032728646924326, 'sideways_tp_mult': 1.5930756618726558, 'sideways_tsl_mult': 0.20143954038820344, 'sideways_time_stop': 17, 'sideways_use_sma': False, 'sideways_use_ema': True, 'sideways_use_atr': False, 'sideways_use_adx': False, 'sideways_use_spike': False, 'sideways_rsi_required': False}.
[I 2025-08-31 09:28:56,590] Trial 76 finished with values: [-1000000000.0, 1000000000.0] and parameters: {'p_sma': 26, 'p_std': 55, 'p_atr': 17, 'p_adx': 13, 'rsi_period': 14, 'ema1': 18, 'ema2': 24, 'slip_atr_k': 0.023725876150864182, 'slip_spread_k': 0.9265813170469678, 'spread_hl_frac': 0.0029931038547667405, 'bb_std_mult': 2.310897678256905, 'rsi_os': 26, 'rsi_ob': 53, 'vol_spike': 0.1761373009615969, 'adx_thresh': 21.381835487607148, 'atr_min_pct': 0.012029255377118032, 'atr_max_pct': 0.057222989699664814, 'tp_mult': 2.6643230610538935, 'tsl_mult': 0.09834896266377766, 'strategy': 'breakout', 'time_stop': 246, 'use_sma': False, 'use_atr': False, 'use_adx': False, 'use_ema': True, 'use_spike': False, 'rsi_required': True, 'edge_k': 1.6481824701803556, 'edge_cap': 0.7145388112642003, 'bull_strategy': 'mean_reversion', 'bull_bb_std_mult': 3.3782920276255357, 'bull_rsi_os': 22, 'bull_rsi_ob': 47, 'bull_adx_thresh': 13.04056190719982, 'bull_atr_min_pct': 0.028914592304561736, 'bull_atr_max_pct': 0.13771604343850025, 'bull_tp_mult': 2.018046385371534, 'bull_tsl_mult': 0.45799675698043574, 'bull_time_stop': 271, 'bull_use_sma': True, 'bull_use_ema': True, 'bull_use_atr': True, 'bull_use_adx': False, 'bull_use_spike': False, 'bull_rsi_required': False, 'bear_strategy': 'breakout', 'bear_bb_std_mult': 1.181223205274947, 'bear_rsi_os': 45, 'bear_rsi_ob': 79, 'bear_adx_thresh': 24.42586889364549, 'bear_atr_min_pct': 0.014972651665045317, 'bear_atr_max_pct': 0.05486939899626505, 'bear_tp_mult': 1.1014950173210707, 'bear_tsl_mult': 0.9332253883005671, 'bear_time_stop': 87, 'bear_use_sma': False, 'bear_use_ema': False, 'bear_use_atr': False, 'bear_use_adx': True, 'bear_use_spike': True, 'bear_rsi_required': True, 'sideways_strategy': 'breakout', 'sideways_bb_std_mult': 1.1630430938463072, 'sideways_rsi_os': 48, 'sideways_rsi_ob': 56, 'sideways_adx_thresh': 27.48908032892671, 'sideways_atr_min_pct': 0.004845174158737989, 'sideways_atr_max_pct': 0.0373714448862138, 'sideways_tp_mult': 1.549011354057347, 'sideways_tsl_mult': 0.5881554966415543, 'sideways_time_stop': 41, 'sideways_use_sma': True, 'sideways_use_ema': False, 'sideways_use_atr': False, 'sideways_use_adx': True, 'sideways_use_spike': True, 'sideways_rsi_required': False}.
[I 2025-08-31 09:28:57,071] Trial 75 finished with values: [-1000000000.0, 1000000000.0] and parameters: {'p_sma': 26, 'p_std': 24, 'p_atr': 11, 'p_adx': 26, 'rsi_period': 13, 'ema1': 25, 'ema2': 23, 'slip_atr_k': 0.00959508906070533, 'slip_spread_k': 0.7984306339870056, 'spread_hl_frac': 0.005738331535107141, 'bb_std_mult': 2.1293519294433487, 'rsi_os': 26, 'rsi_ob': 53, 'vol_spike': 0.220572830983843, 'adx_thresh': 13.414909710480515, 'atr_min_pct': 0.018367775801544056, 'atr_max_pct': 0.019416620650228304, 'tp_mult': 1.6615631236803656, 'tsl_mult': 0.0991569279739638, 'strategy': 'breakout', 'time_stop': 147, 'use_sma': False, 'use_atr': False, 'use_adx': False, 'use_ema': True, 'use_spike': False, 'rsi_required': True, 'edge_k': 1.6443430827683254, 'edge_cap': 0.7970623130212264, 'bull_strategy': 'mean_reversion', 'bull_bb_std_mult': 3.2705872372617066, 'bull_rsi_os': 22, 'bull_rsi_ob': 91, 'bull_adx_thresh': 24.034385632399626, 'bull_atr_min_pct': 0.026856423750218798, 'bull_atr_max_pct': 0.14137688156483338, 'bull_tp_mult': 1.1983064500763247, 'bull_tsl_mult': 0.27070627866275954, 'bull_time_stop': 273, 'bull_use_sma': True, 'bull_use_ema': False, 'bull_use_atr': True, 'bull_use_adx': False, 'bull_use_spike': False, 'bull_rsi_required': True, 'bear_strategy': 'breakout', 'bear_bb_std_mult': 1.2082019859028237, 'bear_rsi_os': 45, 'bear_rsi_ob': 80, 'bear_adx_thresh': 24.36399601662149, 'bear_atr_min_pct': 0.01727212657331743, 'bear_atr_max_pct': 0.05339651938842591, 'bear_tp_mult': 2.787392385007494, 'bear_tsl_mult': 0.932993665263083, 'bear_time_stop': 89, 'bear_use_sma': False, 'bear_use_ema': False, 'bear_use_atr': False, 'bear_use_adx': True, 'bear_use_spike': True, 'bear_rsi_required': True, 'sideways_strategy': 'breakout', 'sideways_bb_std_mult': 1.1452797400849593, 'sideways_rsi_os': 8, 'sideways_rsi_ob': 47, 'sideways_adx_thresh': 11.737803456783919, 'sideways_atr_min_pct': 0.004610357028257815, 'sideways_atr_max_pct': 0.06464914405362995, 'sideways_tp_mult': 2.6449467798064092, 'sideways_tsl_mult': 0.5744509947632859, 'sideways_time_stop': 39, 'sideways_use_sma': True, 'sideways_use_ema': True, 'sideways_use_atr': False, 'sideways_use_adx': False, 'sideways_use_spike': True, 'sideways_rsi_required': False}.
[I 2025-08-31 09:28:57,228] Trial 73 finished with values: [-1000000000.0, 1000000000.0] and parameters: {'p_sma': 31, 'p_std': 55, 'p_atr': 14, 'p_adx': 28, 'rsi_period': 8, 'ema1': 25, 'ema2': 13, 'slip_atr_k': 0.17634029768018739, 'slip_spread_k': 0.9281395157929387, 'spread_hl_frac': 0.01327992251814395, 'bb_std_mult': 2.8068108141636823, 'rsi_os': 43, 'rsi_ob': 76, 'vol_spike': 0.15412303804046257, 'adx_thresh': 22.850168444708352, 'atr_min_pct': 0.021021960092178726, 'atr_max_pct': 0.0933178741192633, 'tp_mult': 2.5392065601334513, 'tsl_mult': 0.3989037444338757, 'strategy': 'breakout', 'time_stop': 66, 'use_sma': False, 'use_atr': True, 'use_adx': False, 'use_ema': True, 'use_spike': False, 'rsi_required': True, 'edge_k': 1.606078042801703, 'edge_cap': 0.9630688018135869, 'bull_strategy': 'mean_reversion', 'bull_bb_std_mult': 2.043836140480619, 'bull_rsi_os': 23, 'bull_rsi_ob': 70, 'bull_adx_thresh': 24.486464292333945, 'bull_atr_min_pct': 0.006154644392361505, 'bull_atr_max_pct': 0.14058910942966923, 'bull_tp_mult': 1.9542703826822605, 'bull_tsl_mult': 0.5125935266306191, 'bull_time_stop': 135, 'bull_use_sma': True, 'bull_use_ema': False, 'bull_use_atr': True, 'bull_use_adx': False, 'bull_use_spike': False, 'bull_rsi_required': True, 'bear_strategy': 'breakout', 'bear_bb_std_mult': 2.3030251757206384, 'bear_rsi_os': 40, 'bear_rsi_ob': 93, 'bear_adx_thresh': 21.198608529764677, 'bear_atr_min_pct': 0.017357429192425857, 'bear_atr_max_pct': 0.051489012295126965, 'bear_tp_mult': 1.1090876647263275, 'bear_tsl_mult': 0.11934981393158506, 'bear_time_stop': 125, 'bear_use_sma': False, 'bear_use_ema': False, 'bear_use_atr': True, 'bear_use_adx': True, 'bear_use_spike': True, 'bear_rsi_required': True, 'sideways_strategy': 'breakout', 'sideways_bb_std_mult': 1.124995198229498, 'sideways_rsi_os': 6, 'sideways_rsi_ob': 62, 'sideways_adx_thresh': 18.322791197984994, 'sideways_atr_min_pct': 0.005650618032898742, 'sideways_atr_max_pct': 0.06171053105637743, 'sideways_tp_mult': 2.6492147301038624, 'sideways_tsl_mult': 0.46458628518709255, 'sideways_time_stop': 20, 'sideways_use_sma': False, 'sideways_use_ema': True, 'sideways_use_atr': False, 'sideways_use_adx': False, 'sideways_use_spike': True, 'sideways_rsi_required': False}.
[I 2025-08-31 09:28:57,715] Trial 74 finished with values: [-1000000000.0, 1000000000.0] and parameters: {'p_sma': 26, 'p_std': 8, 'p_atr': 23, 'p_adx': 29, 'rsi_period': 12, 'ema1': 13, 'ema2': 13, 'slip_atr_k': 0.021080139980145962, 'slip_spread_k': 0.7992630739406789, 'spread_hl_frac': 0.005410470706663802, 'bb_std_mult': 2.2993480412285363, 'rsi_os': 27, 'rsi_ob': 78, 'vol_spike': 0.2192406738793705, 'adx_thresh': 21.48543007194983, 'atr_min_pct': 0.016602641120012772, 'atr_max_pct': 0.057779998555319456, 'tp_mult': 2.8956889558421692, 'tsl_mult': 0.09980671239253235, 'strategy': 'breakout', 'time_stop': 225, 'use_sma': False, 'use_atr': True, 'use_adx': False, 'use_ema': True, 'use_spike': False, 'rsi_required': True, 'edge_k': 1.6306982609264045, 'edge_cap': 0.5067762644464955, 'bull_strategy': 'mean_reversion', 'bull_bb_std_mult': 3.2813487402625077, 'bull_rsi_os': 23, 'bull_rsi_ob': 82, 'bull_adx_thresh': 24.092535215593593, 'bull_atr_min_pct': 0.02732353156062236, 'bull_atr_max_pct': 0.13936373308902827, 'bull_tp_mult': 2.033666163620733, 'bull_tsl_mult': 0.26229333532315346, 'bull_time_stop': 273, 'bull_use_sma': True, 'bull_use_ema': False, 'bull_use_atr': True, 'bull_use_adx': False, 'bull_use_spike': False, 'bull_rsi_required': True, 'bear_strategy': 'breakout', 'bear_bb_std_mult': 1.2096729176252368, 'bear_rsi_os': 47, 'bear_rsi_ob': 79, 'bear_adx_thresh': 23.775459307175417, 'bear_atr_min_pct': 0.01736734112909151, 'bear_atr_max_pct': 0.020680086063970433, 'bear_tp_mult': 2.5472268490217, 'bear_tsl_mult': 0.9251556454174333, 'bear_time_stop': 117, 'bear_use_sma': False, 'bear_use_ema': False, 'bear_use_atr': True, 'bear_use_adx': True, 'bear_use_spike': True, 'bear_rsi_required': False, 'sideways_strategy': 'breakout', 'sideways_bb_std_mult': 2.8430234546181365, 'sideways_rsi_os': 48, 'sideways_rsi_ob': 62, 'sideways_adx_thresh': 19.648166604246217, 'sideways_atr_min_pct': 0.004853338726408633, 'sideways_atr_max_pct': 0.08860624028327571, 'sideways_tp_mult': 2.5070689322728743, 'sideways_tsl_mult': 0.4671196392441133, 'sideways_time_stop': 39, 'sideways_use_sma': False, 'sideways_use_ema': True, 'sideways_use_atr': False, 'sideways_use_adx': False, 'sideways_use_spike': True, 'sideways_rsi_required': False}.
[I 2025-08-31 09:29:32,401] Trial 80 finished with values: [-1000000000.0, 1000000000.0] and parameters: {'p_sma': 58, 'p_std': 33, 'p_atr': 29, 'p_adx': 11, 'rsi_period': 60, 'ema1': 21, 'ema2': 37, 'slip_atr_k': 0.14325662546445714, 'slip_spread_k': 0.2911836410800878, 'spread_hl_frac': 0.024817890309618926, 'bb_std_mult': 1.9148393353696762, 'rsi_os': 17, 'rsi_ob': 58, 'vol_spike': 0.10161008837520447, 'adx_thresh': 26.2776875657901, 'atr_min_pct': 0.013097282133009728, 'atr_max_pct': 0.0693446511679902, 'tp_mult': 1.425259658140213, 'tsl_mult': 0.7490558752448192, 'strategy': 'mean_reversion', 'time_stop': 191, 'use_sma': False, 'use_atr': False, 'use_adx': False, 'use_ema': False, 'use_spike': True, 'rsi_required': True, 'edge_k': 0.9554842944808366, 'edge_cap': 0.4603588342682027, 'bull_strategy': 'mean_reversion', 'bull_bb_std_mult': 1.2888951138162437, 'bull_rsi_os': 13, 'bull_rsi_ob': 85, 'bull_adx_thresh': 8.421519529354923, 'bull_atr_min_pct': 0.028357320251625476, 'bull_atr_max_pct': 0.014905479183327327, 'bull_tp_mult': 1.5076299015566885, 'bull_tsl_mult': 0.646736349184671, 'bull_time_stop': 200, 'bull_use_sma': False, 'bull_use_ema': True, 'bull_use_atr': False, 'bull_use_adx': False, 'bull_use_spike': False, 'bull_rsi_required': False, 'bear_strategy': 'breakout', 'bear_bb_std_mult': 3.025162107325717, 'bear_rsi_os': 25, 'bear_rsi_ob': 85, 'bear_adx_thresh': 22.70038930043376, 'bear_atr_min_pct': 0.020377389493410388, 'bear_atr_max_pct': 0.02750444187487768, 'bear_tp_mult': 2.962085264294831, 'bear_tsl_mult': 0.9685671485684162, 'bear_time_stop': 141, 'bear_use_sma': True, 'bear_use_ema': False, 'bear_use_atr': False, 'bear_use_adx': False, 'bear_use_spike': False, 'bear_rsi_required': False, 'sideways_strategy': 'mean_reversion', 'sideways_bb_std_mult': 1.3963969902095004, 'sideways_rsi_os': 51, 'sideways_rsi_ob': 79, 'sideways_adx_thresh': 29.612653000077994, 'sideways_atr_min_pct': 0.023413349426987612, 'sideways_atr_max_pct': 0.047981064946771984, 'sideways_tp_mult': 1.6367550457503328, 'sideways_tsl_mult': 0.4139509312315711, 'sideways_time_stop': 115, 'sideways_use_sma': True, 'sideways_use_ema': False, 'sideways_use_atr': False, 'sideways_use_adx': True, 'sideways_use_spike': False, 'sideways_rsi_required': True}.
[I 2025-08-31 09:29:33,307] Trial 78 finished with values: [-1000000000.0, 1000000000.0] and parameters: {'p_sma': 48, 'p_std': 33, 'p_atr': 29, 'p_adx': 9, 'rsi_period': 53, 'ema1': 19, 'ema2': 31, 'slip_atr_k': 0.015586937671381917, 'slip_spread_k': 0.8684851166199001, 'spread_hl_frac': 0.0008509135851781556, 'bb_std_mult': 1.9493746282337248, 'rsi_os': 28, 'rsi_ob': 70, 'vol_spike': 0.19071246167029066, 'adx_thresh': 33.48301127579625, 'atr_min_pct': 0.02300154638427184, 'atr_max_pct': 0.026433355449555024, 'tp_mult': 2.906547865519429, 'tsl_mult': 0.40342178346609237, 'strategy': 'mean_reversion', 'time_stop': 190, 'use_sma': False, 'use_atr': True, 'use_adx': False, 'use_ema': False, 'use_spike': True, 'rsi_required': True, 'edge_k': 0.9720846813675629, 'edge_cap': 0.8886353066847342, 'bull_strategy': 'mean_reversion', 'bull_bb_std_mult': 1.2572364514889847, 'bull_rsi_os': 24, 'bull_rsi_ob': 82, 'bull_adx_thresh': 19.92850276732232, 'bull_atr_min_pct': 0.0060797653761412145, 'bull_atr_max_pct': 0.038373211668054276, 'bull_tp_mult': 1.9266023482250745, 'bull_tsl_mult': 0.6382911342575693, 'bull_time_stop': 139, 'bull_use_sma': True, 'bull_use_ema': True, 'bull_use_atr': True, 'bull_use_adx': False, 'bull_use_spike': False, 'bull_rsi_required': False, 'bear_strategy': 'breakout', 'bear_bb_std_mult': 2.250679220118898, 'bear_rsi_os': 26, 'bear_rsi_ob': 83, 'bear_adx_thresh': 23.37552602604165, 'bear_atr_min_pct': 0.015648197829697695, 'bear_atr_max_pct': 0.035692410137975, 'bear_tp_mult': 2.9988433613980616, 'bear_tsl_mult': 0.13978506007058894, 'bear_time_stop': 128, 'bear_use_sma': True, 'bear_use_ema': False, 'bear_use_atr': True, 'bear_use_adx': True, 'bear_use_spike': True, 'bear_rsi_required': False, 'sideways_strategy': 'mean_reversion', 'sideways_bb_std_mult': 0.5076373558629279, 'sideways_rsi_os': 50, 'sideways_rsi_ob': 79, 'sideways_adx_thresh': 10.6537271437931, 'sideways_atr_min_pct': 0.020327628907066533, 'sideways_atr_max_pct': 0.0886920102557079, 'sideways_tp_mult': 1.1053273007794728, 'sideways_tsl_mult': 0.8002633752089001, 'sideways_time_stop': 126, 'sideways_use_sma': False, 'sideways_use_ema': False, 'sideways_use_atr': False, 'sideways_use_adx': False, 'sideways_use_spike': True, 'sideways_rsi_required': True}.
[I 2025-08-31 09:29:33,435] Trial 79 finished with values: [-1000000000.0, 1000000000.0] and parameters: {'p_sma': 46, 'p_std': 49, 'p_atr': 23, 'p_adx': 9, 'rsi_period': 53, 'ema1': 17, 'ema2': 19, 'slip_atr_k': 0.03621066199629923, 'slip_spread_k': 0.8705742145226477, 'spread_hl_frac': 0.024391250711587098, 'bb_std_mult': 0.8299764121900906, 'rsi_os': 17, 'rsi_ob': 69, 'vol_spike': 0.09839316124225321, 'adx_thresh': 33.65593392214072, 'atr_min_pct': 0.016624375652679848, 'atr_max_pct': 0.06910689967222984, 'tp_mult': 2.237309971587621, 'tsl_mult': 0.6601529585062875, 'strategy': 'mean_reversion', 'time_stop': 164, 'use_sma': False, 'use_atr': True, 'use_adx': False, 'use_ema': False, 'use_spike': True, 'rsi_required': True, 'edge_k': 0.9148725484734945, 'edge_cap': 0.15077562549499957, 'bull_strategy': 'mean_reversion', 'bull_bb_std_mult': 1.3676415692089807, 'bull_rsi_os': 14, 'bull_rsi_ob': 81, 'bull_adx_thresh': 18.978389437888328, 'bull_atr_min_pct': 0.0024335953815425634, 'bull_atr_max_pct': 0.03759693059045595, 'bull_tp_mult': 1.6317470528800562, 'bull_tsl_mult': 0.6352866185396384, 'bull_time_stop': 216, 'bull_use_sma': True, 'bull_use_ema': True, 'bull_use_atr': False, 'bull_use_adx': False, 'bull_use_spike': False, 'bull_rsi_required': False, 'bear_strategy': 'breakout', 'bear_bb_std_mult': 3.0090128816424238, 'bear_rsi_os': 25, 'bear_rsi_ob': 84, 'bear_adx_thresh': 27.609655286342576, 'bear_atr_min_pct': 0.020523508754725937, 'bear_atr_max_pct': 0.026947241988235913, 'bear_tp_mult': 2.977628074093836, 'bear_tsl_mult': 0.9727605280970932, 'bear_time_stop': 137, 'bear_use_sma': True, 'bear_use_ema': False, 'bear_use_atr': True, 'bear_use_adx': False, 'bear_use_spike': True, 'bear_rsi_required': False, 'sideways_strategy': 'mean_reversion', 'sideways_bb_std_mult': 0.7285067638178412, 'sideways_rsi_os': 50, 'sideways_rsi_ob': 80, 'sideways_adx_thresh': 13.636129523566638, 'sideways_atr_min_pct': 0.02393521026509562, 'sideways_atr_max_pct': 0.08578015920954653, 'sideways_tp_mult': 2.4579682010967265, 'sideways_tsl_mult': 0.05587745776952918, 'sideways_time_stop': 113, 'sideways_use_sma': False, 'sideways_use_ema': False, 'sideways_use_atr': False, 'sideways_use_adx': True, 'sideways_use_spike': True, 'sideways_rsi_required': True}.
[I 2025-08-31 09:29:33,843] Trial 77 finished with values: [-0.03919730827743373, 0.03880117377217891] and parameters: {'p_sma': 31, 'p_std': 24, 'p_atr': 12, 'p_adx': 28, 'rsi_period': 12, 'ema1': 13, 'ema2': 19, 'slip_atr_k': 0.007334337371399453, 'slip_spread_k': 0.7958624885849847, 'spread_hl_frac': 0.02500372482878323, 'bb_std_mult': 1.9305095043730127, 'rsi_os': 28, 'rsi_ob': 59, 'vol_spike': 0.10942776519947647, 'adx_thresh': 26.34033534994765, 'atr_min_pct': 0.018316686207211406, 'atr_max_pct': 0.02037565199249948, 'tp_mult': 2.925534690229883, 'tsl_mult': 0.7293901960287356, 'strategy': 'mean_reversion', 'time_stop': 162, 'use_sma': False, 'use_atr': False, 'use_adx': False, 'use_ema': True, 'use_spike': True, 'rsi_required': True, 'edge_k': 1.6847635145832178, 'edge_cap': 0.8804702168092295, 'bull_strategy': 'mean_reversion', 'bull_bb_std_mult': 3.29363479771043, 'bull_rsi_os': 24, 'bull_rsi_ob': 67, 'bull_adx_thresh': 24.213250817816274, 'bull_atr_min_pct': 0.02798686377736312, 'bull_atr_max_pct': 0.03821129428194637, 'bull_tp_mult': 1.9528167988966354, 'bull_tsl_mult': 0.6358609095863711, 'bull_time_stop': 144, 'bull_use_sma': True, 'bull_use_ema': False, 'bull_use_atr': True, 'bull_use_adx': False, 'bull_use_spike': False, 'bull_rsi_required': False, 'bear_strategy': 'breakout', 'bear_bb_std_mult': 3.3343392516694044, 'bear_rsi_os': 37, 'bear_rsi_ob': 92, 'bear_adx_thresh': 23.30482695765648, 'bear_atr_min_pct': 0.001512138709776241, 'bear_atr_max_pct': 0.13879835498103835, 'bear_tp_mult': 2.7838493565389912, 'bear_tsl_mult': 0.9663404924427924, 'bear_time_stop': 77, 'bear_use_sma': False, 'bear_use_ema': False, 'bear_use_atr': True, 'bear_use_adx': True, 'bear_use_spike': True, 'bear_rsi_required': True, 'sideways_strategy': 'breakout', 'sideways_bb_std_mult': 1.2303307791809617, 'sideways_rsi_os': 51, 'sideways_rsi_ob': 47, 'sideways_adx_thresh': 11.6391997290903, 'sideways_atr_min_pct': 0.007710833970749917, 'sideways_atr_max_pct': 0.0808184012950426, 'sideways_tp_mult': 2.6589471524367125, 'sideways_tsl_mult': 0.7568571461625747, 'sideways_time_stop': 121, 'sideways_use_sma': False, 'sideways_use_ema': True, 'sideways_use_atr': False, 'sideways_use_adx': False, 'sideways_use_spike': True, 'sideways_rsi_required': False}.
