[I 2025-08-31 10:10:29,329] Trial 396 finished with values: [-1000000000.0, 1000000000.0] and parameters: {'p_sma': 10, 'p_std': 14, 'p_atr': 29, 'p_adx': 27, 'rsi_period': 18, 'ema1': 19, 'ema2': 42, 'slip_atr_k': 0.14838544323643577, 'slip_spread_k': 0.8156092066349558, 'spread_hl_frac': 0.01450694724408605, 'bb_std_mult': 3.339037947841744, 'rsi_os': 15, 'rsi_ob': 50, 'vol_spike': 0.13383274283806665, 'adx_thresh': 25.973053174515112, 'atr_min_pct': 0.010693710651318147, 'atr_max_pct': 0.13396759229564126, 'tp_mult': 2.881709246139974, 'tsl_mult': 0.046356184028664475, 'strategy': 'breakout', 'time_stop': 272, 'use_sma': True, 'use_atr': False, 'use_adx': True, 'use_ema': False, 'use_spike': False, 'rsi_required': True, 'edge_k': 1.9550570651494479, 'edge_cap': 0.8137520760287138, 'bull_strategy': 'breakout', 'bull_bb_std_mult': 2.888983035002665, 'bull_rsi_os': 31, 'bull_rsi_ob': 82, 'bull_adx_thresh': 31.50665211229818, 'bull_atr_min_pct': 0.024472933510641545, 'bull_atr_max_pct': 0.0917503519448828, 'bull_tp_mult': 1.634737252292992, 'bull_tsl_mult': 0.6771735233364284, 'bull_time_stop': 200, 'bull_use_sma': False, 'bull_use_ema': False, 'bull_use_atr': False, 'bull_use_adx': True, 'bull_use_spike': True, 'bull_rsi_required': True, 'bear_strategy': 'mean_reversion', 'bear_bb_std_mult': 2.930274532300214, 'bear_rsi_os': 54, 'bear_rsi_ob': 81, 'bear_adx_thresh': 24.381469651713303, 'bear_atr_min_pct': 0.02106601717710968, 'bear_atr_max_pct': 0.13806859441261704, 'bear_tp_mult': 2.6623632262463066, 'bear_tsl_mult': 0.4384190242925418, 'bear_time_stop': 240, 'bear_use_sma': True, 'bear_use_ema': True, 'bear_use_atr': False, 'bear_use_adx': True, 'bear_use_spike': False, 'bear_rsi_required': True, 'sideways_strategy': 'mean_reversion', 'sideways_bb_std_mult': 1.0323736864902364, 'sideways_rsi_os': 23, 'sideways_rsi_ob': 66, 'sideways_adx_thresh': 17.667168561446754, 'sideways_atr_min_pct': 0.013278765021218872, 'sideways_atr_max_pct': 0.0341244043938641, 'sideways_tp_mult': 1.450693474324513, 'sideways_tsl_mult': 0.07428238049312741, 'sideways_time_stop': 135, 'sideways_use_sma': True, 'sideways_use_ema': False, 'sideways_use_atr': True, 'sideways_use_adx': True, 'sideways_use_spike': False, 'sideways_rsi_required': True}.
[I 2025-08-31 10:10:29,627] Trial 397 finished with values: [-1000000000.0, 1000000000.0] and parameters: {'p_sma': 9, 'p_std': 49, 'p_atr': 29, 'p_adx': 9, 'rsi_period': 20, 'ema1': 19, 'ema2': 38, 'slip_atr_k': 0.16475727687993658, 'slip_spread_k': 0.4778999526518397, 'spread_hl_frac': 0.013472456267756155, 'bb_std_mult': 1.1598515491523564, 'rsi_os': 30, 'rsi_ob': 91, 'vol_spike': 0.1340927636511015, 'adx_thresh': 6.352609977063304, 'atr_min_pct': 0.010653099939295098, 'atr_max_pct': 0.13432629248262584, 'tp_mult': 2.806304578855145, 'tsl_mult': 0.8641685705979099, 'strategy': 'breakout', 'time_stop': 46, 'use_sma': True, 'use_atr': False, 'use_adx': True, 'use_ema': False, 'use_spike': False, 'rsi_required': True, 'edge_k': 1.9526153162348259, 'edge_cap': 0.8181494882999691, 'bull_strategy': 'breakout', 'bull_bb_std_mult': 3.2134061254469497, 'bull_rsi_os': 16, 'bull_rsi_ob': 91, 'bull_adx_thresh': 31.420116147055143, 'bull_atr_min_pct': 0.02031760485248521, 'bull_atr_max_pct': 0.11282370757432285, 'bull_tp_mult': 2.8742310155655906, 'bull_tsl_mult': 0.6434689077922797, 'bull_time_stop': 183, 'bull_use_sma': False, 'bull_use_ema': False, 'bull_use_atr': False, 'bull_use_adx': True, 'bull_use_spike': True, 'bull_rsi_required': True, 'bear_strategy': 'mean_reversion', 'bear_bb_std_mult': 2.9346643462385646, 'bear_rsi_os': 55, 'bear_rsi_ob': 91, 'bear_adx_thresh': 5.020888793138251, 'bear_atr_min_pct': 0.018210358231859, 'bear_atr_max_pct': 0.04582924660298908, 'bear_tp_mult': 2.3695066554931628, 'bear_tsl_mult': 0.44194468304796086, 'bear_time_stop': 99, 'bear_use_sma': True, 'bear_use_ema': True, 'bear_use_atr': False, 'bear_use_adx': True, 'bear_use_spike': False, 'bear_rsi_required': True, 'sideways_strategy': 'mean_reversion', 'sideways_bb_std_mult': 1.0063372693549322, 'sideways_rsi_os': 23, 'sideways_rsi_ob': 61, 'sideways_adx_thresh': 32.57484291805803, 'sideways_atr_min_pct': 0.013279418398907578, 'sideways_atr_max_pct': 0.03627944379489175, 'sideways_tp_mult': 2.2916995476997384, 'sideways_tsl_mult': 0.45793420266960483, 'sideways_time_stop': 133, 'sideways_use_sma': True, 'sideways_use_ema': False, 'sideways_use_atr': True, 'sideways_use_adx': True, 'sideways_use_spike': False, 'sideways_rsi_required': True}.
[I 2025-08-31 10:10:30,187] Trial 399 finished with values: [-0.051131583742396236, 0.051013576385959075] and parameters: {'p_sma': 19, 'p_std': 13, 'p_atr': 13, 'p_adx': 8, 'rsi_period': 21, 'ema1': 23, 'ema2': 38, 'slip_atr_k': 0.14951617509485776, 'slip_spread_k': 0.46735696560048395, 'spread_hl_frac': 0.005376832163881691, 'bb_std_mult': 2.045381641373548, 'rsi_os': 13, 'rsi_ob': 50, 'vol_spike': 0.13059678312929937, 'adx_thresh': 17.276375318789746, 'atr_min_pct': 0.016270813410113213, 'atr_max_pct': 0.12209132293986849, 'tp_mult': 2.799960634505438, 'tsl_mult': 0.05050827065882306, 'strategy': 'breakout', 'time_stop': 142, 'use_sma': False, 'use_atr': True, 'use_adx': False, 'use_ema': False, 'use_spike': True, 'rsi_required': True, 'edge_k': 1.873655197420454, 'edge_cap': 0.25788143452600465, 'bull_strategy': 'mean_reversion', 'bull_bb_std_mult': 1.4598998367121112, 'bull_rsi_os': 40, 'bull_rsi_ob': 57, 'bull_adx_thresh': 31.4594546779183, 'bull_atr_min_pct': 0.0008560065542955343, 'bull_atr_max_pct': 0.1125692366298371, 'bull_tp_mult': 2.220427981571587, 'bull_tsl_mult': 0.6407311213204926, 'bull_time_stop': 243, 'bull_use_sma': True, 'bull_use_ema': False, 'bull_use_atr': False, 'bull_use_adx': False, 'bull_use_spike': False, 'bull_rsi_required': True, 'bear_strategy': 'breakout', 'bear_bb_std_mult': 2.6512115383972463, 'bear_rsi_os': 55, 'bear_rsi_ob': 81, 'bear_adx_thresh': 18.97796601957639, 'bear_atr_min_pct': 0.021099223691433248, 'bear_atr_max_pct': 0.10413941357111375, 'bear_tp_mult': 2.1720068696439556, 'bear_tsl_mult': 0.47798395855004694, 'bear_time_stop': 258, 'bear_use_sma': True, 'bear_use_ema': True, 'bear_use_atr': False, 'bear_use_adx': True, 'bear_use_spike': False, 'bear_rsi_required': False, 'sideways_strategy': 'mean_reversion', 'sideways_bb_std_mult': 0.9836915475784035, 'sideways_rsi_os': 23, 'sideways_rsi_ob': 61, 'sideways_adx_thresh': 32.85239958165456, 'sideways_atr_min_pct': 0.015214424468830217, 'sideways_atr_max_pct': 0.09342363387515312, 'sideways_tp_mult': 2.2984749395846937, 'sideways_tsl_mult': 0.4561052264519481, 'sideways_time_stop': 227, 'sideways_use_sma': True, 'sideways_use_ema': False, 'sideways_use_atr': False, 'sideways_use_adx': False, 'sideways_use_spike': False, 'sideways_rsi_required': True}.
[I 2025-08-31 10:10:30,500] Trial 398 finished with values: [-1000000000.0, 1000000000.0] and parameters: {'p_sma': 15, 'p_std': 13, 'p_atr': 23, 'p_adx': 9, 'rsi_period': 22, 'ema1': 19, 'ema2': 10, 'slip_atr_k': 0.15004150037918923, 'slip_spread_k': 0.2840323162319969, 'spread_hl_frac': 0.042824192890743004, 'bb_std_mult': 0.7575440882117908, 'rsi_os': 13, 'rsi_ob': 50, 'vol_spike': 0.13024395573174696, 'adx_thresh': 6.295189646279785, 'atr_min_pct': 0.01642029850324002, 'atr_max_pct': 0.1301430745965112, 'tp_mult': 2.815168828779445, 'tsl_mult': 0.0430156875015056, 'strategy': 'breakout', 'time_stop': 142, 'use_sma': True, 'use_atr': False, 'use_adx': True, 'use_ema': False, 'use_spike': False, 'rsi_required': True, 'edge_k': 1.8895219062667454, 'edge_cap': 0.07104802188034905, 'bull_strategy': 'breakout', 'bull_bb_std_mult': 2.396172169797555, 'bull_rsi_os': 55, 'bull_rsi_ob': 91, 'bull_adx_thresh': 31.736530780362205, 'bull_atr_min_pct': 0.006638425421020347, 'bull_atr_max_pct': 0.11183489064202645, 'bull_tp_mult': 1.3339482160570644, 'bull_tsl_mult': 0.9031463131607378, 'bull_time_stop': 244, 'bull_use_sma': False, 'bull_use_ema': False, 'bull_use_atr': False, 'bull_use_adx': True, 'bull_use_spike': True, 'bull_rsi_required': True, 'bear_strategy': 'mean_reversion', 'bear_bb_std_mult': 2.936295299587758, 'bear_rsi_os': 55, 'bear_rsi_ob': 81, 'bear_adx_thresh': 18.811863418692937, 'bear_atr_min_pct': 0.009281888944827413, 'bear_atr_max_pct': 0.07223784909535265, 'bear_tp_mult': 2.3590011010386522, 'bear_tsl_mult': 0.6210766016401883, 'bear_time_stop': 99, 'bear_use_sma': False, 'bear_use_ema': True, 'bear_use_atr': False, 'bear_use_adx': True, 'bear_use_spike': False, 'bear_rsi_required': True, 'sideways_strategy': 'mean_reversion', 'sideways_bb_std_mult': 3.5127075343297323, 'sideways_rsi_os': 36, 'sideways_rsi_ob': 62, 'sideways_adx_thresh': 10.96041819609457, 'sideways_atr_min_pct': 0.015336594502502602, 'sideways_atr_max_pct': 0.02830032328780399, 'sideways_tp_mult': 2.187600978578127, 'sideways_tsl_mult': 0.05016290446239273, 'sideways_time_stop': 229, 'sideways_use_sma': True, 'sideways_use_ema': True, 'sideways_use_atr': True, 'sideways_use_adx': True, 'sideways_use_spike': False, 'sideways_rsi_required': True}.
[I 2025-08-31 10:11:03,206] Trial 400 finished with values: [-1000000000.0, 1000000000.0] and parameters: {'p_sma': 51, 'p_std': 12, 'p_atr': 19, 'p_adx': 10, 'rsi_period': 20, 'ema1': 19, 'ema2': 32, 'slip_atr_k': 0.16176134935701197, 'slip_spread_k': 0.35062404885041665, 'spread_hl_frac': 0.01584411951764227, 'bb_std_mult': 1.7146873312149822, 'rsi_os': 29, 'rsi_ob': 48, 'vol_spike': 0.12645212695902192, 'adx_thresh': 6.207023773562987, 'atr_min_pct': 0.02603507790962197, 'atr_max_pct': 0.10044964293036687, 'tp_mult': 2.8090586020382635, 'tsl_mult': 0.4992593790602666, 'strategy': 'breakout', 'time_stop': 141, 'use_sma': False, 'use_atr': True, 'use_adx': False, 'use_ema': False, 'use_spike': True, 'rsi_required': True, 'edge_k': 1.8854161543259103, 'edge_cap': 0.08648906972309484, 'bull_strategy': 'mean_reversion', 'bull_bb_std_mult': 1.736623028265644, 'bull_rsi_os': 28, 'bull_rsi_ob': 67, 'bull_adx_thresh': 30.641653902505727, 'bull_atr_min_pct': 0.021553604051134875, 'bull_atr_max_pct': 0.11257145008137683, 'bull_tp_mult': 1.3139600231368573, 'bull_tsl_mult': 0.16629386636967602, 'bull_time_stop': 244, 'bull_use_sma': True, 'bull_use_ema': False, 'bull_use_atr': False, 'bull_use_adx': False, 'bull_use_spike': False, 'bull_rsi_required': True, 'bear_strategy': 'breakout', 'bear_bb_std_mult': 2.620093964034188, 'bear_rsi_os': 31, 'bear_rsi_ob': 81, 'bear_adx_thresh': 18.92192001068481, 'bear_atr_min_pct': 0.020464459545354613, 'bear_atr_max_pct': 0.0542703625325863, 'bear_tp_mult': 1.9237387986878702, 'bear_tsl_mult': 0.8290115160491549, 'bear_time_stop': 264, 'bear_use_sma': False, 'bear_use_ema': True, 'bear_use_atr': False, 'bear_use_adx': True, 'bear_use_spike': False, 'bear_rsi_required': False, 'sideways_strategy': 'mean_reversion', 'sideways_bb_std_mult': 0.6764135263079123, 'sideways_rsi_os': 24, 'sideways_rsi_ob': 56, 'sideways_adx_thresh': 32.65882893921636, 'sideways_atr_min_pct': 0.015508113752077725, 'sideways_atr_max_pct': 0.09346934467162696, 'sideways_tp_mult': 2.2914602340863803, 'sideways_tsl_mult': 0.3479203064622009, 'sideways_time_stop': 229, 'sideways_use_sma': True, 'sideways_use_ema': True, 'sideways_use_atr': False, 'sideways_use_adx': False, 'sideways_use_spike': False, 'sideways_rsi_required': True}.
[I 2025-08-31 10:11:03,783] Trial 402 finished with values: [-1000000000.0, 1000000000.0] and parameters: {'p_sma': 35, 'p_std': 12, 'p_atr': 19, 'p_adx': 9, 'rsi_period': 22, 'ema1': 25, 'ema2': 33, 'slip_atr_k': 0.13922600370594068, 'slip_spread_k': 0.21629026241990923, 'spread_hl_frac': 0.0011837134990971346, 'bb_std_mult': 0.7304965331403537, 'rsi_os': 22, 'rsi_ob': 48, 'vol_spike': 0.2993476228565129, 'adx_thresh': 6.041841312872366, 'atr_min_pct': 0.02110264688014695, 'atr_max_pct': 0.10095339474411985, 'tp_mult': 2.9214323738971673, 'tsl_mult': 0.4218195056835381, 'strategy': 'breakout', 'time_stop': 149, 'use_sma': False, 'use_atr': False, 'use_adx': False, 'use_ema': True, 'use_spike': False, 'rsi_required': True, 'edge_k': 0.6182727476590618, 'edge_cap': 0.06987753194460788, 'bull_strategy': 'mean_reversion', 'bull_bb_std_mult': 2.2362978106395897, 'bull_rsi_os': 28, 'bull_rsi_ob': 67, 'bull_adx_thresh': 18.217390750374637, 'bull_atr_min_pct': 0.017815052004636484, 'bull_atr_max_pct': 0.11904229201221796, 'bull_tp_mult': 2.0674600537996564, 'bull_tsl_mult': 0.9044896805084321, 'bull_time_stop': 237, 'bull_use_sma': True, 'bull_use_ema': False, 'bull_use_atr': False, 'bull_use_adx': False, 'bull_use_spike': False, 'bull_rsi_required': True, 'bear_strategy': 'breakout', 'bear_bb_std_mult': 2.885803710045702, 'bear_rsi_os': 32, 'bear_rsi_ob': 78, 'bear_adx_thresh': 25.928159934496065, 'bear_atr_min_pct': 0.012494659172033996, 'bear_atr_max_pct': 0.07256836516224222, 'bear_tp_mult': 1.2779647106846674, 'bear_tsl_mult': 0.4853701400691264, 'bear_time_stop': 262, 'bear_use_sma': False, 'bear_use_ema': True, 'bear_use_atr': False, 'bear_use_adx': True, 'bear_use_spike': True, 'bear_rsi_required': True, 'sideways_strategy': 'breakout', 'sideways_bb_std_mult': 0.6499664399665743, 'sideways_rsi_os': 34, 'sideways_rsi_ob': 82, 'sideways_adx_thresh': 33.41488282575482, 'sideways_atr_min_pct': 0.022563839220202615, 'sideways_atr_max_pct': 0.02866662313102873, 'sideways_tp_mult': 1.5511211529377453, 'sideways_tsl_mult': 0.22340672520372057, 'sideways_time_stop': 143, 'sideways_use_sma': True, 'sideways_use_ema': True, 'sideways_use_atr': False, 'sideways_use_adx': False, 'sideways_use_spike': True, 'sideways_rsi_required': False}.
[I 2025-08-31 10:11:03,997] Trial 403 finished with values: [-0.05596304952228859, 0.055820094410441785] and parameters: {'p_sma': 28, 'p_std': 15, 'p_atr': 19, 'p_adx': 10, 'rsi_period': 24, 'ema1': 13, 'ema2': 39, 'slip_atr_k': 0.16026948466004345, 'slip_spread_k': 0.4011741321415428, 'spread_hl_frac': 0.01600864499021675, 'bb_std_mult': 2.662531765867679, 'rsi_os': 22, 'rsi_ob': 94, 'vol_spike': 0.24104526673792281, 'adx_thresh': 5.74593434783621, 'atr_min_pct': 0.011671914276621606, 'atr_max_pct': 0.10130154306683456, 'tp_mult': 2.5991906912759957, 'tsl_mult': 0.4985023804631567, 'strategy': 'breakout', 'time_stop': 100, 'use_sma': False, 'use_atr': True, 'use_adx': False, 'use_ema': True, 'use_spike': True, 'rsi_required': True, 'edge_k': 0.3919621197875396, 'edge_cap': 0.19315713504687787, 'bull_strategy': 'mean_reversion', 'bull_bb_std_mult': 0.8455028670822264, 'bull_rsi_os': 35, 'bull_rsi_ob': 69, 'bull_adx_thresh': 18.544690506098906, 'bull_atr_min_pct': 0.018908995351155325, 'bull_atr_max_pct': 0.08386135276530873, 'bull_tp_mult': 1.2607976291941263, 'bull_tsl_mult': 0.16470667278288198, 'bull_time_stop': 26, 'bull_use_sma': True, 'bull_use_ema': False, 'bull_use_atr': False, 'bull_use_adx': False, 'bull_use_spike': False, 'bull_rsi_required': False, 'bear_strategy': 'breakout', 'bear_bb_std_mult': 2.748121742263167, 'bear_rsi_os': 52, 'bear_rsi_ob': 78, 'bear_adx_thresh': 31.05675615226386, 'bear_atr_min_pct': 0.020252720337418737, 'bear_atr_max_pct': 0.037352466859630874, 'bear_tp_mult': 2.6265653875916977, 'bear_tsl_mult': 0.8762552048223476, 'bear_time_stop': 259, 'bear_use_sma': False, 'bear_use_ema': False, 'bear_use_atr': False, 'bear_use_adx': True, 'bear_use_spike': True, 'bear_rsi_required': False, 'sideways_strategy': 'breakout', 'sideways_bb_std_mult': 3.2612518930961243, 'sideways_rsi_os': 28, 'sideways_rsi_ob': 56, 'sideways_adx_thresh': 33.591036470910815, 'sideways_atr_min_pct': 0.000136840255257754, 'sideways_atr_max_pct': 0.14492234007218957, 'sideways_tp_mult': 1.5501632603735875, 'sideways_tsl_mult': 0.3958745775525058, 'sideways_time_stop': 235, 'sideways_use_sma': True, 'sideways_use_ema': True, 'sideways_use_atr': False, 'sideways_use_adx': False, 'sideways_use_spike': True, 'sideways_rsi_required': False}.
[I 2025-08-31 10:11:04,122] Trial 401 finished with values: [-1000000000.0, 1000000000.0] and parameters: {'p_sma': 51, 'p_std': 12, 'p_atr': 23, 'p_adx': 8, 'rsi_period': 22, 'ema1': 12, 'ema2': 32, 'slip_atr_k': 0.16127950547111491, 'slip_spread_k': 0.3488199039095756, 'spread_hl_frac': 0.015863685362386658, 'bb_std_mult': 0.962801510113515, 'rsi_os': 32, 'rsi_ob': 46, 'vol_spike': 0.25331614854595913, 'adx_thresh': 10.136178456983986, 'atr_min_pct': 0.01810171670687316, 'atr_max_pct': 0.12870158989510677, 'tp_mult': 2.68351970884852, 'tsl_mult': 0.670278775651291, 'strategy': 'breakout', 'time_stop': 149, 'use_sma': False, 'use_atr': True, 'use_adx': False, 'use_ema': False, 'use_spike': True, 'rsi_required': True, 'edge_k': 1.886226783776845, 'edge_cap': 0.07423068678288261, 'bull_strategy': 'mean_reversion', 'bull_bb_std_mult': 1.4498721263597942, 'bull_rsi_os': 55, 'bull_rsi_ob': 57, 'bull_adx_thresh': 30.371525914638248, 'bull_atr_min_pct': 0.021880121123168703, 'bull_atr_max_pct': 0.052357750875912365, 'bull_tp_mult': 1.3302547766881794, 'bull_tsl_mult': 0.47555311388171295, 'bull_time_stop': 244, 'bull_use_sma': True, 'bull_use_ema': False, 'bull_use_atr': False, 'bull_use_adx': False, 'bull_use_spike': False, 'bull_rsi_required': True, 'bear_strategy': 'breakout', 'bear_bb_std_mult': 2.6551352467649214, 'bear_rsi_os': 32, 'bear_rsi_ob': 78, 'bear_adx_thresh': 21.78610781547267, 'bear_atr_min_pct': 0.028006997110299726, 'bear_atr_max_pct': 0.014613602462434441, 'bear_tp_mult': 1.265364158271122, 'bear_tsl_mult': 0.48518191750635703, 'bear_time_stop': 259, 'bear_use_sma': False, 'bear_use_ema': True, 'bear_use_atr': False, 'bear_use_adx': True, 'bear_use_spike': False, 'bear_rsi_required': False, 'sideways_strategy': 'breakout', 'sideways_bb_std_mult': 1.4760103296859268, 'sideways_rsi_os': 36, 'sideways_rsi_ob': 85, 'sideways_adx_thresh': 32.94855304725156, 'sideways_atr_min_pct': 0.019370021207640833, 'sideways_atr_max_pct': 0.10873470135313493, 'sideways_tp_mult': 2.112227857716777, 'sideways_tsl_mult': 0.04730153913806938, 'sideways_time_stop': 144, 'sideways_use_sma': True, 'sideways_use_ema': True, 'sideways_use_atr': False, 'sideways_use_adx': False, 'sideways_use_spike': True, 'sideways_rsi_required': False}.
[I 2025-08-31 10:11:36,178] Trial 406 finished with values: [-0.10018752916764662, 0.0997375586528669] and parameters: {'p_sma': 48, 'p_std': 52, 'p_atr': 14, 'p_adx': 11, 'rsi_period': 16, 'ema1': 12, 'ema2': 51, 'slip_atr_k': 0.21490441817770076, 'slip_spread_k': 0.4505329674129021, 'spread_hl_frac': 0.02927100628552106, 'bb_std_mult': 0.9678448585595226, 'rsi_os': 41, 'rsi_ob': 46, 'vol_spike': 0.282875193195534, 'adx_thresh': 7.420625299797104, 'atr_min_pct': 0.018672085403742655, 'atr_max_pct': 0.1383581019666194, 'tp_mult': 2.7529217985260983, 'tsl_mult': 0.014876510806529155, 'strategy': 'breakout', 'time_stop': 129, 'use_sma': False, 'use_atr': False, 'use_adx': False, 'use_ema': False, 'use_spike': False, 'rsi_required': True, 'edge_k': 0.5834285476429212, 'edge_cap': 0.11005030721720084, 'bull_strategy': 'mean_reversion', 'bull_bb_std_mult': 1.2204153360338978, 'bull_rsi_os': 44, 'bull_rsi_ob': 65, 'bull_adx_thresh': 32.735968312790625, 'bull_atr_min_pct': 0.019535197095417733, 'bull_atr_max_pct': 0.051259224790504807, 'bull_tp_mult': 1.4894551713962019, 'bull_tsl_mult': 0.5759952814986913, 'bull_time_stop': 190, 'bull_use_sma': True, 'bull_use_ema': True, 'bull_use_atr': False, 'bull_use_adx': False, 'bull_use_spike': False, 'bull_rsi_required': True, 'bear_strategy': 'breakout', 'bear_bb_std_mult': 1.956116639393439, 'bear_rsi_os': 54, 'bear_rsi_ob': 57, 'bear_adx_thresh': 21.60194653095169, 'bear_atr_min_pct': 0.0011131871311383604, 'bear_atr_max_pct': 0.1476797401452682, 'bear_tp_mult': 2.5681653872930887, 'bear_tsl_mult': 0.5185925013370275, 'bear_time_stop': 109, 'bear_use_sma': False, 'bear_use_ema': False, 'bear_use_atr': False, 'bear_use_adx': False, 'bear_use_spike': False, 'bear_rsi_required': True, 'sideways_strategy': 'breakout', 'sideways_bb_std_mult': 1.1185724929875427, 'sideways_rsi_os': 26, 'sideways_rsi_ob': 64, 'sideways_adx_thresh': 29.831143233070293, 'sideways_atr_min_pct': 0.007433328968414751, 'sideways_atr_max_pct': 0.11261380198895393, 'sideways_tp_mult': 1.2669226785429526, 'sideways_tsl_mult': 0.12065147944463675, 'sideways_time_stop': 224, 'sideways_use_sma': True, 'sideways_use_ema': True, 'sideways_use_atr': False, 'sideways_use_adx': False, 'sideways_use_spike': False, 'sideways_rsi_required': False}.
