[I 2025-08-31 09:49:58,617] Trial 225 finished with values: [-0.0136856754492104, 0.01355594801337745] and parameters: {'p_sma': 15, 'p_std': 15, 'p_atr': 21, 'p_adx': 8, 'rsi_period': 21, 'ema1': 27, 'ema2': 40, 'slip_atr_k': 0.24385132186137698, 'slip_spread_k': 0.1388494413432359, 'spread_hl_frac': 0.011446298884906912, 'bb_std_mult': 1.3166793409457376, 'rsi_os': 23, 'rsi_ob': 67, 'vol_spike': 0.1459773047936726, 'adx_thresh': 6.953759361375389, 'atr_min_pct': 0.006660376460538568, 'atr_max_pct': 0.12895882524585572, 'tp_mult': 2.936533099103406, 'tsl_mult': 0.0007778001254895832, 'strategy': 'breakout', 'time_stop': 139, 'use_sma': False, 'use_atr': False, 'use_adx': False, 'use_ema': False, 'use_spike': False, 'rsi_required': True, 'edge_k': 1.8011221556153298, 'edge_cap': 0.11504884409480673, 'bull_strategy': 'mean_reversion', 'bull_bb_std_mult': 1.1461882935817074, 'bull_rsi_os': 33, 'bull_rsi_ob': 65, 'bull_adx_thresh': 21.04275836616932, 'bull_atr_min_pct': 0.018725297482183705, 'bull_atr_max_pct': 0.1129432142146461, 'bull_tp_mult': 1.4781516730111586, 'bull_tsl_mult': 0.6145549845995106, 'bull_time_stop': 239, 'bull_use_sma': True, 'bull_use_ema': False, 'bull_use_atr': False, 'bull_use_adx': False, 'bull_use_spike': False, 'bull_rsi_required': True, 'bear_strategy': 'breakout', 'bear_bb_std_mult': 2.7674085570782547, 'bear_rsi_os': 18, 'bear_rsi_ob': 68, 'bear_adx_thresh': 21.367517437047383, 'bear_atr_min_pct': 0.01176297929578719, 'bear_atr_max_pct': 0.1452649408678614, 'bear_tp_mult': 1.8098569533796878, 'bear_tsl_mult': 0.49404919094855715, 'bear_time_stop': 267, 'bear_use_sma': False, 'bear_use_ema': True, 'bear_use_atr': False, 'bear_use_adx': True, 'bear_use_spike': False, 'bear_rsi_required': True, 'sideways_strategy': 'breakout', 'sideways_bb_std_mult': 1.1224979174484957, 'sideways_rsi_os': 22, 'sideways_rsi_ob': 53, 'sideways_adx_thresh': 31.59045514245588, 'sideways_atr_min_pct': 0.001360662732146343, 'sideways_atr_max_pct': 0.10230898118674607, 'sideways_tp_mult': 1.0678753163029495, 'sideways_tsl_mult': 0.0545900743540183, 'sideways_time_stop': 230, 'sideways_use_sma': True, 'sideways_use_ema': True, 'sideways_use_atr': False, 'sideways_use_adx': False, 'sideways_use_spike': False, 'sideways_rsi_required': False}.
[I 2025-08-31 09:49:58,712] Trial 226 finished with values: [-1000000000.0, 1000000000.0] and parameters: {'p_sma': 31, 'p_std': 51, 'p_atr': 21, 'p_adx': 9, 'rsi_period': 22, 'ema1': 27, 'ema2': 40, 'slip_atr_k': 0.16833467404145686, 'slip_spread_k': 0.9397352267775647, 'spread_hl_frac': 0.015575329890900196, 'bb_std_mult': 0.5935385796474109, 'rsi_os': 45, 'rsi_ob': 58, 'vol_spike': 0.193327177474444, 'adx_thresh': 8.45046420538193, 'atr_min_pct': 0.02557040559933136, 'atr_max_pct': 0.14213877700414973, 'tp_mult': 2.6762798342154177, 'tsl_mult': 0.019235944007721568, 'strategy': 'breakout', 'time_stop': 271, 'use_sma': False, 'use_atr': False, 'use_adx': False, 'use_ema': False, 'use_spike': False, 'rsi_required': True, 'edge_k': 1.8236022193744434, 'edge_cap': 0.11261980069703169, 'bull_strategy': 'mean_reversion', 'bull_bb_std_mult': 1.0320644497443932, 'bull_rsi_os': 33, 'bull_rsi_ob': 67, 'bull_adx_thresh': 31.41739715546877, 'bull_atr_min_pct': 0.018760705574477787, 'bull_atr_max_pct': 0.11350195207539598, 'bull_tp_mult': 1.424566858829328, 'bull_tsl_mult': 0.23851467531806808, 'bull_time_stop': 239, 'bull_use_sma': True, 'bull_use_ema': False, 'bull_use_atr': False, 'bull_use_adx': False, 'bull_use_spike': False, 'bull_rsi_required': True, 'bear_strategy': 'breakout', 'bear_bb_std_mult': 2.775204088516063, 'bear_rsi_os': 34, 'bear_rsi_ob': 68, 'bear_adx_thresh': 9.96059600013415, 'bear_atr_min_pct': 0.021224763806692484, 'bear_atr_max_pct': 0.14555914409194418, 'bear_tp_mult': 1.8021848782635264, 'bear_tsl_mult': 0.49198341147391383, 'bear_time_stop': 266, 'bear_use_sma': False, 'bear_use_ema': True, 'bear_use_atr': False, 'bear_use_adx': True, 'bear_use_spike': False, 'bear_rsi_required': True, 'sideways_strategy': 'breakout', 'sideways_bb_std_mult': 0.810333818290486, 'sideways_rsi_os': 22, 'sideways_rsi_ob': 78, 'sideways_adx_thresh': 24.51260702177376, 'sideways_atr_min_pct': 0.0014267479716559704, 'sideways_atr_max_pct': 0.02469062705139507, 'sideways_tp_mult': 2.744243027384511, 'sideways_tsl_mult': 0.051405757514143335, 'sideways_time_stop': 242, 'sideways_use_sma': True, 'sideways_use_ema': True, 'sideways_use_atr': False, 'sideways_use_adx': False, 'sideways_use_spike': False, 'sideways_rsi_required': False}.
[I 2025-08-31 09:49:59,223] Trial 227 finished with values: [-1000000000.0, 1000000000.0] and parameters: {'p_sma': 15, 'p_std': 17, 'p_atr': 29, 'p_adx': 19, 'rsi_period': 35, 'ema1': 19, 'ema2': 40, 'slip_atr_k': 0.07035438331078481, 'slip_spread_k': 0.43078484985798704, 'spread_hl_frac': 0.01077970257583335, 'bb_std_mult': 1.066350089174392, 'rsi_os': 45, 'rsi_ob': 68, 'vol_spike': 0.20687245967248477, 'adx_thresh': 8.256551689266733, 'atr_min_pct': 0.029954629334150766, 'atr_max_pct': 0.024312394608911325, 'tp_mult': 1.7449458602127768, 'tsl_mult': 0.7560248613589357, 'strategy': 'breakout', 'time_stop': 269, 'use_sma': False, 'use_atr': False, 'use_adx': False, 'use_ema': False, 'use_spike': False, 'rsi_required': True, 'edge_k': 1.815856950012508, 'edge_cap': 0.5519177850491523, 'bull_strategy': 'mean_reversion', 'bull_bb_std_mult': 2.1853994886737254, 'bull_rsi_os': 32, 'bull_rsi_ob': 66, 'bull_adx_thresh': 17.404922475486913, 'bull_atr_min_pct': 0.02888783266569682, 'bull_atr_max_pct': 0.1122690054322572, 'bull_tp_mult': 1.4737273291587272, 'bull_tsl_mult': 0.30038210421923206, 'bull_time_stop': 138, 'bull_use_sma': True, 'bull_use_ema': False, 'bull_use_atr': False, 'bull_use_adx': False, 'bull_use_spike': False, 'bull_rsi_required': True, 'bear_strategy': 'breakout', 'bear_bb_std_mult': 2.753721474850481, 'bear_rsi_os': 54, 'bear_rsi_ob': 54, 'bear_adx_thresh': 20.983256901253235, 'bear_atr_min_pct': 0.028649203951599027, 'bear_atr_max_pct': 0.1458042245253713, 'bear_tp_mult': 2.592531016840767, 'bear_tsl_mult': 0.4934776854793626, 'bear_time_stop': 268, 'bear_use_sma': False, 'bear_use_ema': True, 'bear_use_atr': False, 'bear_use_adx': True, 'bear_use_spike': False, 'bear_rsi_required': True, 'sideways_strategy': 'breakout', 'sideways_bb_std_mult': 3.5027519400437708, 'sideways_rsi_os': 22, 'sideways_rsi_ob': 92, 'sideways_adx_thresh': 31.472929357391642, 'sideways_atr_min_pct': 0.0013510637189292321, 'sideways_atr_max_pct': 0.02409427012186248, 'sideways_tp_mult': 2.6163891008329823, 'sideways_tsl_mult': 0.050662008633392444, 'sideways_time_stop': 232, 'sideways_use_sma': True, 'sideways_use_ema': True, 'sideways_use_atr': False, 'sideways_use_adx': False, 'sideways_use_spike': False, 'sideways_rsi_required': False}.
[I 2025-08-31 09:50:33,692] Trial 228 finished with values: [-0.025248757742026617, 0.02507943049429438] and parameters: {'p_sma': 17, 'p_std': 12, 'p_atr': 17, 'p_adx': 9, 'rsi_period': 24, 'ema1': 19, 'ema2': 37, 'slip_atr_k': 0.07282207148697516, 'slip_spread_k': 0.2943824379166845, 'spread_hl_frac': 0.013821135869414294, 'bb_std_mult': 1.633335079347446, 'rsi_os': 22, 'rsi_ob': 58, 'vol_spike': 0.19345026599537, 'adx_thresh': 5.6553084170744645, 'atr_min_pct': 0.013283278217049149, 'atr_max_pct': 0.09800399224717, 'tp_mult': 2.9129767457460405, 'tsl_mult': 0.7547803246845486, 'strategy': 'breakout', 'time_stop': 139, 'use_sma': False, 'use_atr': False, 'use_adx': False, 'use_ema': False, 'use_spike': False, 'rsi_required': True, 'edge_k': 1.8856415873284034, 'edge_cap': 0.6762448550333444, 'bull_strategy': 'mean_reversion', 'bull_bb_std_mult': 2.1587602508901482, 'bull_rsi_os': 30, 'bull_rsi_ob': 66, 'bull_adx_thresh': 20.732747600455202, 'bull_atr_min_pct': 0.01746376320976598, 'bull_atr_max_pct': 0.12049241758454873, 'bull_tp_mult': 1.5632318363246174, 'bull_tsl_mult': 0.620692739794714, 'bull_time_stop': 96, 'bull_use_sma': True, 'bull_use_ema': False, 'bull_use_atr': False, 'bull_use_adx': False, 'bull_use_spike': False, 'bull_rsi_required': True, 'bear_strategy': 'breakout', 'bear_bb_std_mult': 0.5942793476464872, 'bear_rsi_os': 27, 'bear_rsi_ob': 65, 'bear_adx_thresh': 29.115576097465, 'bear_atr_min_pct': 0.004982110830332218, 'bear_atr_max_pct': 0.14107916137204835, 'bear_tp_mult': 2.5667148985217736, 'bear_tsl_mult': 0.4922308906031618, 'bear_time_stop': 230, 'bear_use_sma': False, 'bear_use_ema': True, 'bear_use_atr': False, 'bear_use_adx': True, 'bear_use_spike': False, 'bear_rsi_required': True, 'sideways_strategy': 'breakout', 'sideways_bb_std_mult': 0.9779034432397005, 'sideways_rsi_os': 27, 'sideways_rsi_ob': 65, 'sideways_adx_thresh': 31.229522490922154, 'sideways_atr_min_pct': 0.0012106309000203019, 'sideways_atr_max_pct': 0.13597740691063462, 'sideways_tp_mult': 1.5955396904518337, 'sideways_tsl_mult': 0.29126782647971616, 'sideways_time_stop': 159, 'sideways_use_sma': True, 'sideways_use_ema': True, 'sideways_use_atr': False, 'sideways_use_adx': False, 'sideways_use_spike': False, 'sideways_rsi_required': False}.
[I 2025-08-31 09:50:33,981] Trial 230 finished with values: [-1000000000.0, 1000000000.0] and parameters: {'p_sma': 16, 'p_std': 18, 'p_atr': 17, 'p_adx': 9, 'rsi_period': 19, 'ema1': 19, 'ema2': 37, 'slip_atr_k': 0.15730907249866877, 'slip_spread_k': 0.2995512070284218, 'spread_hl_frac': 0.013997876179267614, 'bb_std_mult': 1.8535043838288774, 'rsi_os': 21, 'rsi_ob': 69, 'vol_spike': 0.12999517687123596, 'adx_thresh': 5.0254788207857635, 'atr_min_pct': 0.012065309924448814, 'atr_max_pct': 0.12914633334819517, 'tp_mult': 1.7491663932917472, 'tsl_mult': 0.0010778622983628233, 'strategy': 'breakout', 'time_stop': 47, 'use_sma': False, 'use_atr': False, 'use_adx': False, 'use_ema': False, 'use_spike': False, 'rsi_required': True, 'edge_k': 1.8789459171425587, 'edge_cap': 0.07073081533810344, 'bull_strategy': 'mean_reversion', 'bull_bb_std_mult': 2.7001833382386637, 'bull_rsi_os': 31, 'bull_rsi_ob': 66, 'bull_adx_thresh': 20.86954615222062, 'bull_atr_min_pct': 0.02020135628666911, 'bull_atr_max_pct': 0.036163118403557716, 'bull_tp_mult': 1.4842152943478262, 'bull_tsl_mult': 0.2975288661861988, 'bull_time_stop': 254, 'bull_use_sma': True, 'bull_use_ema': False, 'bull_use_atr': False, 'bull_use_adx': False, 'bull_use_spike': False, 'bull_rsi_required': True, 'bear_strategy': 'breakout', 'bear_bb_std_mult': 0.5709147841731042, 'bear_rsi_os': 44, 'bear_rsi_ob': 65, 'bear_adx_thresh': 25.012469963143744, 'bear_atr_min_pct': 0.004896130790700202, 'bear_atr_max_pct': 0.1409106127465214, 'bear_tp_mult': 2.5823867156048226, 'bear_tsl_mult': 0.13420390917410818, 'bear_time_stop': 225, 'bear_use_sma': False, 'bear_use_ema': True, 'bear_use_atr': False, 'bear_use_adx': True, 'bear_use_spike': False, 'bear_rsi_required': True, 'sideways_strategy': 'breakout', 'sideways_bb_std_mult': 1.0468271845930497, 'sideways_rsi_os': 31, 'sideways_rsi_ob': 92, 'sideways_adx_thresh': 31.45911279079335, 'sideways_atr_min_pct': 0.020571973639587175, 'sideways_atr_max_pct': 0.05243078739666501, 'sideways_tp_mult': 1.0617034572761805, 'sideways_tsl_mult': 0.07633907764968473, 'sideways_time_stop': 185, 'sideways_use_sma': True, 'sideways_use_ema': True, 'sideways_use_atr': False, 'sideways_use_adx': False, 'sideways_use_spike': False, 'sideways_rsi_required': False}.
[I 2025-08-31 09:50:34,223] Trial 229 finished with values: [-1000000000.0, 1000000000.0] and parameters: {'p_sma': 17, 'p_std': 15, 'p_atr': 17, 'p_adx': 19, 'rsi_period': 24, 'ema1': 19, 'ema2': 37, 'slip_atr_k': 0.0924771496887832, 'slip_spread_k': 0.41989711491791903, 'spread_hl_frac': 0.013868488895081762, 'bb_std_mult': 1.1442169375618614, 'rsi_os': 21, 'rsi_ob': 48, 'vol_spike': 0.129805316524591, 'adx_thresh': 5.739113541105885, 'atr_min_pct': 0.005577007758660726, 'atr_max_pct': 0.12826392391951, 'tp_mult': 1.749015998256596, 'tsl_mult': 0.7533610235948955, 'strategy': 'breakout', 'time_stop': 139, 'use_sma': False, 'use_atr': False, 'use_adx': False, 'use_ema': False, 'use_spike': False, 'rsi_required': True, 'edge_k': 1.8830370264914862, 'edge_cap': 0.09245081275322671, 'bull_strategy': 'mean_reversion', 'bull_bb_std_mult': 1.4085738826745082, 'bull_rsi_os': 30, 'bull_rsi_ob': 66, 'bull_adx_thresh': 20.58558430227481, 'bull_atr_min_pct': 0.005904518609886972, 'bull_atr_max_pct': 0.12083605842547014, 'bull_tp_mult': 1.4812261386803094, 'bull_tsl_mult': 0.10495864784967857, 'bull_time_stop': 140, 'bull_use_sma': True, 'bull_use_ema': False, 'bull_use_atr': False, 'bull_use_adx': False, 'bull_use_spike': False, 'bull_rsi_required': True, 'bear_strategy': 'breakout', 'bear_bb_std_mult': 2.6853383810060527, 'bear_rsi_os': 44, 'bear_rsi_ob': 81, 'bear_adx_thresh': 26.248967809520096, 'bear_atr_min_pct': 0.020064464516535856, 'bear_atr_max_pct': 0.12964679518830213, 'bear_tp_mult': 1.421341777459019, 'bear_tsl_mult': 0.46428130571357173, 'bear_time_stop': 253, 'bear_use_sma': False, 'bear_use_ema': True, 'bear_use_atr': False, 'bear_use_adx': True, 'bear_use_spike': False, 'bear_rsi_required': True, 'sideways_strategy': 'breakout', 'sideways_bb_std_mult': 1.002254097596789, 'sideways_rsi_os': 19, 'sideways_rsi_ob': 53, 'sideways_adx_thresh': 33.90047771032411, 'sideways_atr_min_pct': 0.027555003442749686, 'sideways_atr_max_pct': 0.10227367119363497, 'sideways_tp_mult': 1.593054877072396, 'sideways_tsl_mult': 0.12719343630118438, 'sideways_time_stop': 295, 'sideways_use_sma': True, 'sideways_use_ema': True, 'sideways_use_atr': False, 'sideways_use_adx': False, 'sideways_use_spike': False, 'sideways_rsi_required': False}.
[I 2025-08-31 09:50:34,616] Trial 231 finished with values: [-1000000000.0, 1000000000.0] and parameters: {'p_sma': 17, 'p_std': 12, 'p_atr': 19, 'p_adx': 10, 'rsi_period': 24, 'ema1': 19, 'ema2': 34, 'slip_atr_k': 0.04530495292435194, 'slip_spread_k': 0.0864957345605995, 'spread_hl_frac': 0.01399169857784059, 'bb_std_mult': 1.8836545696146172, 'rsi_os': 21, 'rsi_ob': 81, 'vol_spike': 0.12968044658130154, 'adx_thresh': 5.050413664751919, 'atr_min_pct': 0.006480657364349347, 'atr_max_pct': 0.12836189093551287, 'tp_mult': 2.948500578523529, 'tsl_mult': 0.0007796752775141818, 'strategy': 'breakout', 'time_stop': 54, 'use_sma': False, 'use_atr': False, 'use_adx': False, 'use_ema': False, 'use_spike': False, 'rsi_required': True, 'edge_k': 1.8791528595190994, 'edge_cap': 0.650672758823291, 'bull_strategy': 'mean_reversion', 'bull_bb_std_mult': 1.4308566880615026, 'bull_rsi_os': 30, 'bull_rsi_ob': 94, 'bull_adx_thresh': 15.422048674946119, 'bull_atr_min_pct': 0.023946607267334497, 'bull_atr_max_pct': 0.1205215160044954, 'bull_tp_mult': 1.856101552494138, 'bull_tsl_mult': 0.9342872695439359, 'bull_time_stop': 233, 'bull_use_sma': True, 'bull_use_ema': False, 'bull_use_atr': False, 'bull_use_adx': False, 'bull_use_spike': False, 'bull_rsi_required': True, 'bear_strategy': 'breakout', 'bear_bb_std_mult': 2.702501681221706, 'bear_rsi_os': 22, 'bear_rsi_ob': 81, 'bear_adx_thresh': 19.876240647297397, 'bear_atr_min_pct': 0.019856172099956017, 'bear_atr_max_pct': 0.13077859267175984, 'bear_tp_mult': 2.6589511882973076, 'bear_tsl_mult': 0.8279877707865559, 'bear_time_stop': 227, 'bear_use_sma': True, 'bear_use_ema': True, 'bear_use_atr': False, 'bear_use_adx': False, 'bear_use_spike': False, 'bear_rsi_required': True, 'sideways_strategy': 'mean_reversion', 'sideways_bb_std_mult': 0.9604484203315544, 'sideways_rsi_os': 26, 'sideways_rsi_ob': 84, 'sideways_adx_thresh': 33.697757658144596, 'sideways_atr_min_pct': 0.020770835925368165, 'sideways_atr_max_pct': 0.10406347357060527, 'sideways_tp_mult': 1.5893387072377851, 'sideways_tsl_mult': 0.17030543508230858, 'sideways_time_stop': 214, 'sideways_use_sma': True, 'sideways_use_ema': True, 'sideways_use_atr': False, 'sideways_use_adx': False, 'sideways_use_spike': False, 'sideways_rsi_required': True}.
[I 2025-08-31 09:51:11,769] Trial 232 finished with values: [-1000000000.0, 1000000000.0] and parameters: {'p_sma': 17, 'p_std': 11, 'p_atr': 19, 'p_adx': 9, 'rsi_period': 19, 'ema1': 19, 'ema2': 37, 'slip_atr_k': 0.1593072343421668, 'slip_spread_k': 0.30642748976877265, 'spread_hl_frac': 0.013903108843302465, 'bb_std_mult': 1.1405160261623895, 'rsi_os': 22, 'rsi_ob': 48, 'vol_spike': 0.13081240648086442, 'adx_thresh': 5.805816031278562, 'atr_min_pct': 0.012176535559886539, 'atr_max_pct': 0.1276555534357393, 'tp_mult': 2.9506568061929195, 'tsl_mult': 0.009129567341153125, 'strategy': 'breakout', 'time_stop': 52, 'use_sma': False, 'use_atr': False, 'use_adx': False, 'use_ema': False, 'use_spike': False, 'rsi_required': True, 'edge_k': 1.768047008368274, 'edge_cap': 0.690155387990948, 'bull_strategy': 'mean_reversion', 'bull_bb_std_mult': 1.3973664281801286, 'bull_rsi_os': 30, 'bull_rsi_ob': 66, 'bull_adx_thresh': 21.04448768794871, 'bull_atr_min_pct': 0.007781616766040168, 'bull_atr_max_pct': 0.022262748875181405, 'bull_tp_mult': 1.5396429230351762, 'bull_tsl_mult': 0.38092747809550015, 'bull_time_stop': 281, 'bull_use_sma': True, 'bull_use_ema': False, 'bull_use_atr': False, 'bull_use_adx': False, 'bull_use_spike': False, 'bull_rsi_required': True, 'bear_strategy': 'breakout', 'bear_bb_std_mult': 0.5702097428643438, 'bear_rsi_os': 44, 'bear_rsi_ob': 50, 'bear_adx_thresh': 26.396138826534486, 'bear_atr_min_pct': 0.019993659965092794, 'bear_atr_max_pct': 0.1405680827186943, 'bear_tp_mult': 1.126023892799701, 'bear_tsl_mult': 0.1299208748394678, 'bear_time_stop': 222, 'bear_use_sma': True, 'bear_use_ema': True, 'bear_use_atr': False, 'bear_use_adx': False, 'bear_use_spike': False, 'bear_rsi_required': True, 'sideways_strategy': 'mean_reversion', 'sideways_bb_std_mult': 1.0485176998421204, 'sideways_rsi_os': 26, 'sideways_rsi_ob': 84, 'sideways_adx_thresh': 22.54839899244948, 'sideways_atr_min_pct': 0.017176863908655908, 'sideways_atr_max_pct': 0.04812134687341665, 'sideways_tp_mult': 1.4840672078383697, 'sideways_tsl_mult': 0.12382437153113592, 'sideways_time_stop': 298, 'sideways_use_sma': True, 'sideways_use_ema': True, 'sideways_use_atr': False, 'sideways_use_adx': False, 'sideways_use_spike': False, 'sideways_rsi_required': True}.
[I 2025-08-31 09:51:12,071] Trial 235 finished with values: [-1000000000.0, 1000000000.0] and parameters: {'p_sma': 47, 'p_std': 14, 'p_atr': 28, 'p_adx': 9, 'rsi_period': 20, 'ema1': 20, 'ema2': 24, 'slip_atr_k': 0.15929434678843302, 'slip_spread_k': 0.4883958616552188, 'spread_hl_frac': 0.012290133597663804, 'bb_std_mult': 0.7158587843498843, 'rsi_os': 22, 'rsi_ob': 65, 'vol_spike': 0.12277891604162833, 'adx_thresh': 6.146456493415731, 'atr_min_pct': 0.011649953830985701, 'atr_max_pct': 0.09682409913256962, 'tp_mult': 2.9097222045024984, 'tsl_mult': 0.0005422854955227319, 'strategy': 'mean_reversion', 'time_stop': 142, 'use_sma': False, 'use_atr': False, 'use_adx': True, 'use_ema': False, 'use_spike': False, 'rsi_required': True, 'edge_k': 1.770088842367785, 'edge_cap': 0.11472739885143837, 'bull_strategy': 'mean_reversion', 'bull_bb_std_mult': 3.055931957137285, 'bull_rsi_os': 32, 'bull_rsi_ob': 67, 'bull_adx_thresh': 26.554648110518762, 'bull_atr_min_pct': 0.008000583134781789, 'bull_atr_max_pct': 0.11610518794587203, 'bull_tp_mult': 1.5581219104895934, 'bull_tsl_mult': 0.2580111121629259, 'bull_time_stop': 181, 'bull_use_sma': True, 'bull_use_ema': True, 'bull_use_atr': False, 'bull_use_adx': False, 'bull_use_spike': True, 'bull_rsi_required': True, 'bear_strategy': 'breakout', 'bear_bb_std_mult': 2.82868937577028, 'bear_rsi_os': 18, 'bear_rsi_ob': 70, 'bear_adx_thresh': 20.701982474170894, 'bear_atr_min_pct': 0.0161384912553843, 'bear_atr_max_pct': 0.13683598193793728, 'bear_tp_mult': 2.6253544590053792, 'bear_tsl_mult': 0.5344266483162099, 'bear_time_stop': 254, 'bear_use_sma': False, 'bear_use_ema': True, 'bear_use_atr': False, 'bear_use_adx': True, 'bear_use_spike': False, 'bear_rsi_required': True, 'sideways_strategy': 'breakout', 'sideways_bb_std_mult': 1.1059075507008624, 'sideways_rsi_os': 24, 'sideways_rsi_ob': 65, 'sideways_adx_thresh': 30.0884756627919, 'sideways_atr_min_pct': 0.01712977518642143, 'sideways_atr_max_pct': 0.12455520664988001, 'sideways_tp_mult': 2.798087921403222, 'sideways_tsl_mult': 0.08256882206530947, 'sideways_time_stop': 160, 'sideways_use_sma': True, 'sideways_use_ema': True, 'sideways_use_atr': True, 'sideways_use_adx': False, 'sideways_use_spike': False, 'sideways_rsi_required': False}.
