[I 2025-08-31 10:37:18,042] Trial 603 finished with values: [-1000000000.0, 1000000000.0] and parameters: {'p_sma': 8, 'p_std': 37, 'p_atr': 29, 'p_adx': 8, 'rsi_period': 21, 'ema1': 15, 'ema2': 40, 'slip_atr_k': 0.11666779253434259, 'slip_spread_k': 0.7830834256035355, 'spread_hl_frac': 0.019893193852338023, 'bb_std_mult': 3.070415969365701, 'rsi_os': 40, 'rsi_ob': 82, 'vol_spike': 0.22624515116855337, 'adx_thresh': 25.86641201541278, 'atr_min_pct': 0.012019216171239334, 'atr_max_pct': 0.12311907078108134, 'tp_mult': 1.6169934596994424, 'tsl_mult': 0.1211251867724461, 'strategy': 'breakout', 'time_stop': 140, 'use_sma': False, 'use_atr': False, 'use_adx': False, 'use_ema': True, 'use_spike': False, 'rsi_required': True, 'edge_k': 1.8265828921820941, 'edge_cap': 0.12377088198805554, 'bull_strategy': 'mean_reversion', 'bull_bb_std_mult': 0.7461333696994925, 'bull_rsi_os': 27, 'bull_rsi_ob': 68, 'bull_adx_thresh': 30.859103554186063, 'bull_atr_min_pct': 0.007992908245607038, 'bull_atr_max_pct': 0.08880915203203436, 'bull_tp_mult': 1.0987134492197075, 'bull_tsl_mult': 0.39703736118155797, 'bull_time_stop': 80, 'bull_use_sma': True, 'bull_use_ema': False, 'bull_use_atr': False, 'bull_use_adx': False, 'bull_use_spike': False, 'bull_rsi_required': False, 'bear_strategy': 'breakout', 'bear_bb_std_mult': 3.0559641883772684, 'bear_rsi_os': 25, 'bear_rsi_ob': 67, 'bear_adx_thresh': 23.014414062956078, 'bear_atr_min_pct': 0.02498006015050711, 'bear_atr_max_pct': 0.06530554186017562, 'bear_tp_mult': 1.1349301707290795, 'bear_tsl_mult': 0.2828885663235089, 'bear_time_stop': 265, 'bear_use_sma': False, 'bear_use_ema': True, 'bear_use_atr': False, 'bear_use_adx': False, 'bear_use_spike': True, 'bear_rsi_required': True, 'sideways_strategy': 'breakout', 'sideways_bb_std_mult': 2.927185615802151, 'sideways_rsi_os': 14, 'sideways_rsi_ob': 83, 'sideways_adx_thresh': 29.835513132736374, 'sideways_atr_min_pct': 0.0006795309914499948, 'sideways_atr_max_pct': 0.09796463538023645, 'sideways_tp_mult': 2.4977695248127874, 'sideways_tsl_mult': 0.7392539670981038, 'sideways_time_stop': 192, 'sideways_use_sma': True, 'sideways_use_ema': True, 'sideways_use_atr': False, 'sideways_use_adx': False, 'sideways_use_spike': True, 'sideways_rsi_required': False}.
[I 2025-08-31 10:37:18,068] Trial 602 finished with values: [-0.014610487017303386, 0.014488045129791875] and parameters: {'p_sma': 10, 'p_std': 51, 'p_atr': 29, 'p_adx': 9, 'rsi_period': 21, 'ema1': 18, 'ema2': 40, 'slip_atr_k': 0.18983808168154698, 'slip_spread_k': 0.8743648658821299, 'spread_hl_frac': 0.0025540863269682516, 'bb_std_mult': 2.3539861998542237, 'rsi_os': 40, 'rsi_ob': 82, 'vol_spike': 0.177255009682612, 'adx_thresh': 29.941742117817856, 'atr_min_pct': 0.011951432135961304, 'atr_max_pct': 0.038461809614181254, 'tp_mult': 2.423949674742429, 'tsl_mult': 0.04464402603094529, 'strategy': 'breakout', 'time_stop': 192, 'use_sma': False, 'use_atr': False, 'use_adx': False, 'use_ema': True, 'use_spike': False, 'rsi_required': True, 'edge_k': 1.8289104711169426, 'edge_cap': 0.4872192355519567, 'bull_strategy': 'mean_reversion', 'bull_bb_std_mult': 1.027331544429519, 'bull_rsi_os': 27, 'bull_rsi_ob': 62, 'bull_adx_thresh': 30.85389029188538, 'bull_atr_min_pct': 0.007951161687714646, 'bull_atr_max_pct': 0.028861279097011514, 'bull_tp_mult': 2.44618824881736, 'bull_tsl_mult': 0.999664884527387, 'bull_time_stop': 81, 'bull_use_sma': True, 'bull_use_ema': False, 'bull_use_atr': True, 'bull_use_adx': False, 'bull_use_spike': False, 'bull_rsi_required': True, 'bear_strategy': 'breakout', 'bear_bb_std_mult': 2.5179719109151444, 'bear_rsi_os': 17, 'bear_rsi_ob': 78, 'bear_adx_thresh': 24.378590739699902, 'bear_atr_min_pct': 0.0026558094437146833, 'bear_atr_max_pct': 0.06561021676063007, 'bear_tp_mult': 1.5964467444902022, 'bear_tsl_mult': 0.43649206480153924, 'bear_time_stop': 281, 'bear_use_sma': False, 'bear_use_ema': False, 'bear_use_atr': False, 'bear_use_adx': False, 'bear_use_spike': True, 'bear_rsi_required': True, 'sideways_strategy': 'breakout', 'sideways_bb_std_mult': 2.175607318402395, 'sideways_rsi_os': 23, 'sideways_rsi_ob': 92, 'sideways_adx_thresh': 30.037109109810704, 'sideways_atr_min_pct': 0.0006075013785357999, 'sideways_atr_max_pct': 0.14382479086383776, 'sideways_tp_mult': 2.507225284161944, 'sideways_tsl_mult': 0.050304156005855666, 'sideways_time_stop': 191, 'sideways_use_sma': True, 'sideways_use_ema': True, 'sideways_use_atr': False, 'sideways_use_adx': False, 'sideways_use_spike': True, 'sideways_rsi_required': False}.
[I 2025-08-31 10:37:18,212] Trial 605 finished with values: [-0.01340800375247797, 0.01337743225061091] and parameters: {'p_sma': 10, 'p_std': 38, 'p_atr': 11, 'p_adx': 8, 'rsi_period': 26, 'ema1': 15, 'ema2': 27, 'slip_atr_k': 0.05348749418147078, 'slip_spread_k': 0.1959207364167076, 'spread_hl_frac': 0.024102846944701547, 'bb_std_mult': 1.1568149874643758, 'rsi_os': 40, 'rsi_ob': 87, 'vol_spike': 0.17796623559858366, 'adx_thresh': 33.074126442095675, 'atr_min_pct': 0.01188599535477493, 'atr_max_pct': 0.1271823188287878, 'tp_mult': 1.8492213981590608, 'tsl_mult': 0.08004086070348844, 'strategy': 'mean_reversion', 'time_stop': 140, 'use_sma': False, 'use_atr': False, 'use_adx': False, 'use_ema': True, 'use_spike': False, 'rsi_required': True, 'edge_k': 1.8163929925346527, 'edge_cap': 0.49073097231200397, 'bull_strategy': 'mean_reversion', 'bull_bb_std_mult': 1.2876149210965733, 'bull_rsi_os': 26, 'bull_rsi_ob': 88, 'bull_adx_thresh': 30.60479424306629, 'bull_atr_min_pct': 0.006809780309612876, 'bull_atr_max_pct': 0.06631201469091684, 'bull_tp_mult': 2.2079124016083265, 'bull_tsl_mult': 0.2848265252165416, 'bull_time_stop': 31, 'bull_use_sma': False, 'bull_use_ema': False, 'bull_use_atr': True, 'bull_use_adx': False, 'bull_use_spike': False, 'bull_rsi_required': False, 'bear_strategy': 'breakout', 'bear_bb_std_mult': 3.0569166359471587, 'bear_rsi_os': 18, 'bear_rsi_ob': 78, 'bear_adx_thresh': 21.791121912003337, 'bear_atr_min_pct': 0.024850749364342173, 'bear_atr_max_pct': 0.11261511463084305, 'bear_tp_mult': 2.0168305468786767, 'bear_tsl_mult': 0.9667288972030443, 'bear_time_stop': 264, 'bear_use_sma': True, 'bear_use_ema': False, 'bear_use_atr': False, 'bear_use_adx': False, 'bear_use_spike': True, 'bear_rsi_required': True, 'sideways_strategy': 'breakout', 'sideways_bb_std_mult': 0.9387740306933672, 'sideways_rsi_os': 30, 'sideways_rsi_ob': 92, 'sideways_adx_thresh': 30.36404450784198, 'sideways_atr_min_pct': 0.0016075030853152253, 'sideways_atr_max_pct': 0.09866134340752307, 'sideways_tp_mult': 2.999026804256854, 'sideways_tsl_mult': 0.04330680261345139, 'sideways_time_stop': 57, 'sideways_use_sma': True, 'sideways_use_ema': True, 'sideways_use_atr': False, 'sideways_use_adx': False, 'sideways_use_spike': True, 'sideways_rsi_required': False}.
[I 2025-08-31 10:37:19,138] Trial 606 finished with values: [-1000000000.0, 1000000000.0] and parameters: {'p_sma': 25, 'p_std': 49, 'p_atr': 11, 'p_adx': 8, 'rsi_period': 22, 'ema1': 15, 'ema2': 40, 'slip_atr_k': 0.21437619843663325, 'slip_spread_k': 0.12275408653095796, 'spread_hl_frac': 0.046843285866871226, 'bb_std_mult': 1.107917360498385, 'rsi_os': 52, 'rsi_ob': 82, 'vol_spike': 0.22535130234378686, 'adx_thresh': 30.194686246584617, 'atr_min_pct': 0.02920819985665382, 'atr_max_pct': 0.03871439125042721, 'tp_mult': 1.3555762818105026, 'tsl_mult': 0.881006543396633, 'strategy': 'mean_reversion', 'time_stop': 141, 'use_sma': False, 'use_atr': False, 'use_adx': False, 'use_ema': True, 'use_spike': False, 'rsi_required': True, 'edge_k': 0.3371045258362756, 'edge_cap': 0.14157250596672077, 'bull_strategy': 'mean_reversion', 'bull_bb_std_mult': 0.5751339226363295, 'bull_rsi_os': 25, 'bull_rsi_ob': 84, 'bull_adx_thresh': 31.28246266709175, 'bull_atr_min_pct': 0.014619173726595868, 'bull_atr_max_pct': 0.029823224397926326, 'bull_tp_mult': 2.389885819024109, 'bull_tsl_mult': 0.9180574982998426, 'bull_time_stop': 68, 'bull_use_sma': True, 'bull_use_ema': False, 'bull_use_atr': False, 'bull_use_adx': False, 'bull_use_spike': False, 'bull_rsi_required': True, 'bear_strategy': 'breakout', 'bear_bb_std_mult': 3.240879884742368, 'bear_rsi_os': 31, 'bear_rsi_ob': 89, 'bear_adx_thresh': 34.36004481890203, 'bear_atr_min_pct': 0.006950120124949975, 'bear_atr_max_pct': 0.10714414679724027, 'bear_tp_mult': 2.0214946988925635, 'bear_tsl_mult': 0.4892578527889581, 'bear_time_stop': 153, 'bear_use_sma': False, 'bear_use_ema': True, 'bear_use_atr': False, 'bear_use_adx': True, 'bear_use_spike': True, 'bear_rsi_required': True, 'sideways_strategy': 'breakout', 'sideways_bb_std_mult': 3.0019837141049535, 'sideways_rsi_os': 23, 'sideways_rsi_ob': 82, 'sideways_adx_thresh': 6.750245663397299, 'sideways_atr_min_pct': 0.010914501079701957, 'sideways_atr_max_pct': 0.0973099469521564, 'sideways_tp_mult': 2.9944167690013135, 'sideways_tsl_mult': 0.11257729102816673, 'sideways_time_stop': 194, 'sideways_use_sma': True, 'sideways_use_ema': True, 'sideways_use_atr': False, 'sideways_use_adx': False, 'sideways_use_spike': True, 'sideways_rsi_required': False}.
[I 2025-08-31 10:37:51,106] Trial 608 finished with values: [-1000000000.0, 1000000000.0] and parameters: {'p_sma': 10, 'p_std': 50, 'p_atr': 13, 'p_adx': 8, 'rsi_period': 28, 'ema1': 18, 'ema2': 10, 'slip_atr_k': 0.22586347672744408, 'slip_spread_k': 0.9960240968273341, 'spread_hl_frac': 0.0026759278950671678, 'bb_std_mult': 1.415522103019109, 'rsi_os': 40, 'rsi_ob': 86, 'vol_spike': 0.1858628957663097, 'adx_thresh': 19.709698983347373, 'atr_min_pct': 0.017446666664916104, 'atr_max_pct': 0.11254617817702214, 'tp_mult': 2.5012558729611625, 'tsl_mult': 0.88886426573489, 'strategy': 'mean_reversion', 'time_stop': 130, 'use_sma': True, 'use_atr': False, 'use_adx': False, 'use_ema': True, 'use_spike': False, 'rsi_required': True, 'edge_k': 0.9708689335370668, 'edge_cap': 0.14958310308247438, 'bull_strategy': 'breakout', 'bull_bb_std_mult': 3.096963134210082, 'bull_rsi_os': 26, 'bull_rsi_ob': 48, 'bull_adx_thresh': 29.888820903974707, 'bull_atr_min_pct': 0.006645409376367639, 'bull_atr_max_pct': 0.0780815555002582, 'bull_tp_mult': 2.4258297263630944, 'bull_tsl_mult': 0.9125674791615852, 'bull_time_stop': 70, 'bull_use_sma': False, 'bull_use_ema': False, 'bull_use_atr': True, 'bull_use_adx': False, 'bull_use_spike': False, 'bull_rsi_required': True, 'bear_strategy': 'mean_reversion', 'bear_bb_std_mult': 3.179360611101113, 'bear_rsi_os': 18, 'bear_rsi_ob': 89, 'bear_adx_thresh': 16.44416663144765, 'bear_atr_min_pct': 0.012416539796504327, 'bear_atr_max_pct': 0.09762220506714427, 'bear_tp_mult': 2.02259967068448, 'bear_tsl_mult': 0.4542178348841834, 'bear_time_stop': 165, 'bear_use_sma': False, 'bear_use_ema': True, 'bear_use_atr': False, 'bear_use_adx': True, 'bear_use_spike': True, 'bear_rsi_required': True, 'sideways_strategy': 'mean_reversion', 'sideways_bb_std_mult': 0.9295275009813764, 'sideways_rsi_os': 24, 'sideways_rsi_ob': 95, 'sideways_adx_thresh': 25.17945409234962, 'sideways_atr_min_pct': 0.0012936924597776035, 'sideways_atr_max_pct': 0.06635088988514588, 'sideways_tp_mult': 1.8343036315928234, 'sideways_tsl_mult': 0.1134594339235428, 'sideways_time_stop': 96, 'sideways_use_sma': True, 'sideways_use_ema': True, 'sideways_use_atr': False, 'sideways_use_adx': False, 'sideways_use_spike': True, 'sideways_rsi_required': True}.
[I 2025-08-31 10:37:51,280] Trial 609 finished with values: [-1000000000.0, 1000000000.0] and parameters: {'p_sma': 18, 'p_std': 50, 'p_atr': 28, 'p_adx': 9, 'rsi_period': 81, 'ema1': 18, 'ema2': 38, 'slip_atr_k': 0.18327263042956354, 'slip_spread_k': 0.11653202660722466, 'spread_hl_frac': 0.039673974759489104, 'bb_std_mult': 1.090741132935159, 'rsi_os': 41, 'rsi_ob': 84, 'vol_spike': 0.29418774231648637, 'adx_thresh': 30.174215886450234, 'atr_min_pct': 0.015898505938466465, 'atr_max_pct': 0.11246179799004964, 'tp_mult': 1.0211557193172722, 'tsl_mult': 0.07863882638773924, 'strategy': 'mean_reversion', 'time_stop': 135, 'use_sma': True, 'use_atr': False, 'use_adx': False, 'use_ema': True, 'use_spike': False, 'rsi_required': True, 'edge_k': 1.9467754005328628, 'edge_cap': 0.15323015165965354, 'bull_strategy': 'breakout', 'bull_bb_std_mult': 1.0256719719179137, 'bull_rsi_os': 26, 'bull_rsi_ob': 84, 'bull_adx_thresh': 29.815070778127755, 'bull_atr_min_pct': 0.0069509677096565485, 'bull_atr_max_pct': 0.053454770364558854, 'bull_tp_mult': 2.8986756618242273, 'bull_tsl_mult': 0.9651666537335872, 'bull_time_stop': 94, 'bull_use_sma': False, 'bull_use_ema': False, 'bull_use_atr': False, 'bull_use_adx': False, 'bull_use_spike': False, 'bull_rsi_required': True, 'bear_strategy': 'mean_reversion', 'bear_bb_std_mult': 2.5131285074278997, 'bear_rsi_os': 31, 'bear_rsi_ob': 76, 'bear_adx_thresh': 8.776322651303929, 'bear_atr_min_pct': 0.0024062838854527306, 'bear_atr_max_pct': 0.09794117662703293, 'bear_tp_mult': 1.9718643752987246, 'bear_tsl_mult': 0.9705137805397224, 'bear_time_stop': 200, 'bear_use_sma': False, 'bear_use_ema': True, 'bear_use_atr': False, 'bear_use_adx': True, 'bear_use_spike': True, 'bear_rsi_required': True, 'sideways_strategy': 'breakout', 'sideways_bb_std_mult': 3.394752757860368, 'sideways_rsi_os': 23, 'sideways_rsi_ob': 95, 'sideways_adx_thresh': 29.650597809603997, 'sideways_atr_min_pct': 0.009839826846339755, 'sideways_atr_max_pct': 0.051990293909139215, 'sideways_tp_mult': 2.1956672190770745, 'sideways_tsl_mult': 0.11019252882788341, 'sideways_time_stop': 230, 'sideways_use_sma': True, 'sideways_use_ema': True, 'sideways_use_atr': False, 'sideways_use_adx': False, 'sideways_use_spike': True, 'sideways_rsi_required': False}.
[I 2025-08-31 10:37:51,629] Trial 607 finished with values: [-1000000000.0, 1000000000.0] and parameters: {'p_sma': 17, 'p_std': 50, 'p_atr': 13, 'p_adx': 8, 'rsi_period': 23, 'ema1': 18, 'ema2': 37, 'slip_atr_k': 0.06288682615888039, 'slip_spread_k': 0.18897171599578141, 'spread_hl_frac': 0.034063862810625525, 'bb_std_mult': 1.438378588740656, 'rsi_os': 40, 'rsi_ob': 84, 'vol_spike': 0.2922123308023329, 'adx_thresh': 30.026865719977817, 'atr_min_pct': 0.00993520985788595, 'atr_max_pct': 0.11598759997936567, 'tp_mult': 1.3089105440774675, 'tsl_mult': 0.05787454031699363, 'strategy': 'mean_reversion', 'time_stop': 265, 'use_sma': True, 'use_atr': False, 'use_adx': False, 'use_ema': True, 'use_spike': False, 'rsi_required': True, 'edge_k': 0.9633739268133517, 'edge_cap': 0.1511646727201919, 'bull_strategy': 'breakout', 'bull_bb_std_mult': 1.0132247256147924, 'bull_rsi_os': 26, 'bull_rsi_ob': 65, 'bull_adx_thresh': 30.03949426486373, 'bull_atr_min_pct': 0.006738025452010375, 'bull_atr_max_pct': 0.14903788207126356, 'bull_tp_mult': 2.2124904507264644, 'bull_tsl_mult': 0.9655303328895974, 'bull_time_stop': 67, 'bull_use_sma': False, 'bull_use_ema': False, 'bull_use_atr': True, 'bull_use_adx': False, 'bull_use_spike': False, 'bull_rsi_required': True, 'bear_strategy': 'mean_reversion', 'bear_bb_std_mult': 1.2425582774082962, 'bear_rsi_os': 17, 'bear_rsi_ob': 89, 'bear_adx_thresh': 24.810257314597052, 'bear_atr_min_pct': 0.027226517660967474, 'bear_atr_max_pct': 0.0979767185135466, 'bear_tp_mult': 1.4956227155817965, 'bear_tsl_mult': 0.7809106108009483, 'bear_time_stop': 279, 'bear_use_sma': False, 'bear_use_ema': True, 'bear_use_atr': False, 'bear_use_adx': True, 'bear_use_spike': True, 'bear_rsi_required': True, 'sideways_strategy': 'mean_reversion', 'sideways_bb_std_mult': 0.942200842516322, 'sideways_rsi_os': 23, 'sideways_rsi_ob': 95, 'sideways_adx_thresh': 24.215360438692347, 'sideways_atr_min_pct': 0.010868825836901429, 'sideways_atr_max_pct': 0.05830974303055133, 'sideways_tp_mult': 2.9655151702396867, 'sideways_tsl_mult': 0.11317859126973168, 'sideways_time_stop': 280, 'sideways_use_sma': True, 'sideways_use_ema': True, 'sideways_use_atr': False, 'sideways_use_adx': False, 'sideways_use_spike': True, 'sideways_rsi_required': True}.
[I 2025-08-31 10:37:52,993] Trial 610 finished with values: [-1000000000.0, 1000000000.0] and parameters: {'p_sma': 10, 'p_std': 27, 'p_atr': 28, 'p_adx': 9, 'rsi_period': 29, 'ema1': 18, 'ema2': 22, 'slip_atr_k': 0.18069852317656482, 'slip_spread_k': 0.1850314545865614, 'spread_hl_frac': 0.03589699618397038, 'bb_std_mult': 1.4324590645198572, 'rsi_os': 40, 'rsi_ob': 86, 'vol_spike': 0.17825606355931814, 'adx_thresh': 23.406308538705588, 'atr_min_pct': 0.009947305918645134, 'atr_max_pct': 0.11994856003342688, 'tp_mult': 2.9159190441304057, 'tsl_mult': 0.07975687888607573, 'strategy': 'mean_reversion', 'time_stop': 57, 'use_sma': True, 'use_atr': False, 'use_adx': False, 'use_ema': True, 'use_spike': False, 'rsi_required': True, 'edge_k': 1.6834851162248545, 'edge_cap': 0.7635006571213783, 'bull_strategy': 'breakout', 'bull_bb_std_mult': 1.0154885354865653, 'bull_rsi_os': 15, 'bull_rsi_ob': 62, 'bull_adx_thresh': 30.10737879855518, 'bull_atr_min_pct': 0.0070507372764747256, 'bull_atr_max_pct': 0.13774478617112534, 'bull_tp_mult': 2.2121578273577613, 'bull_tsl_mult': 0.1189961739758491, 'bull_time_stop': 154, 'bull_use_sma': False, 'bull_use_ema': False, 'bull_use_atr': True, 'bull_use_adx': False, 'bull_use_spike': True, 'bull_rsi_required': True, 'bear_strategy': 'mean_reversion', 'bear_bb_std_mult': 1.2197950976350769, 'bear_rsi_os': 27, 'bear_rsi_ob': 70, 'bear_adx_thresh': 21.851421293797184, 'bear_atr_min_pct': 0.009134402843752514, 'bear_atr_max_pct': 0.10546933060401077, 'bear_tp_mult': 2.133277417276202, 'bear_tsl_mult': 0.44646457546055274, 'bear_time_stop': 279, 'bear_use_sma': False, 'bear_use_ema': True, 'bear_use_atr': False, 'bear_use_adx': True, 'bear_use_spike': True, 'bear_rsi_required': True, 'sideways_strategy': 'breakout', 'sideways_bb_std_mult': 0.9274109930495034, 'sideways_rsi_os': 24, 'sideways_rsi_ob': 95, 'sideways_adx_thresh': 24.661812517310963, 'sideways_atr_min_pct': 0.0016330126264522272, 'sideways_atr_max_pct': 0.049508737688183674, 'sideways_tp_mult': 2.793548901266036, 'sideways_tsl_mult': 0.07540853433342036, 'sideways_time_stop': 61, 'sideways_use_sma': True, 'sideways_use_ema': True, 'sideways_use_atr': True, 'sideways_use_adx': True, 'sideways_use_spike': True, 'sideways_rsi_required': False}.
[I 2025-08-31 10:38:25,655] Trial 614 finished with values: [-1000000000.0, 1000000000.0] and parameters: {'p_sma': 11, 'p_std': 57, 'p_atr': 30, 'p_adx': 9, 'rsi_period': 26, 'ema1': 19, 'ema2': 39, 'slip_atr_k': 0.17485207524954008, 'slip_spread_k': 0.06122106532356035, 'spread_hl_frac': 0.043147938918154854, 'bb_std_mult': 1.2366912786679627, 'rsi_os': 38, 'rsi_ob': 74, 'vol_spike': 0.23595027739178803, 'adx_thresh': 32.22853690835852, 'atr_min_pct': 0.011562881240781331, 'atr_max_pct': 0.06204786279904295, 'tp_mult': 2.8642427431659403, 'tsl_mult': 0.8207264431798086, 'strategy': 'breakout', 'time_stop': 192, 'use_sma': False, 'use_atr': True, 'use_adx': True, 'use_ema': True, 'use_spike': False, 'rsi_required': False, 'edge_k': 1.932367772951301, 'edge_cap': 0.10360478037903115, 'bull_strategy': 'mean_reversion', 'bull_bb_std_mult': 1.3144446535397782, 'bull_rsi_os': 10, 'bull_rsi_ob': 69, 'bull_adx_thresh': 20.37236277835017, 'bull_atr_min_pct': 0.007468127488597243, 'bull_atr_max_pct': 0.08397035742797683, 'bull_tp_mult': 2.5932831614994356, 'bull_tsl_mult': 0.8475438693963487, 'bull_time_stop': 77, 'bull_use_sma': True, 'bull_use_ema': True, 'bull_use_atr': False, 'bull_use_adx': True, 'bull_use_spike': True, 'bull_rsi_required': False, 'bear_strategy': 'breakout', 'bear_bb_std_mult': 0.8884194729646622, 'bear_rsi_os': 39, 'bear_rsi_ob': 78, 'bear_adx_thresh': 9.472397942766744, 'bear_atr_min_pct': 0.005714807890749851, 'bear_atr_max_pct': 0.06982372761879836, 'bear_tp_mult': 1.5892367335583628, 'bear_tsl_mult': 0.12502280186924847, 'bear_time_stop': 111, 'bear_use_sma': True, 'bear_use_ema': False, 'bear_use_atr': True, 'bear_use_adx': False, 'bear_use_spike': True, 'bear_rsi_required': False, 'sideways_strategy': 'breakout', 'sideways_bb_std_mult': 3.5104087722922, 'sideways_rsi_os': 8, 'sideways_rsi_ob': 93, 'sideways_adx_thresh': 16.46591052631283, 'sideways_atr_min_pct': 0.027235862864699003, 'sideways_atr_max_pct': 0.10159891956729263, 'sideways_tp_mult': 2.435211695788063, 'sideways_tsl_mult': 0.047649778161423226, 'sideways_time_stop': 176, 'sideways_use_sma': False, 'sideways_use_ema': False, 'sideways_use_atr': True, 'sideways_use_adx': True, 'sideways_use_spike': True, 'sideways_rsi_required': False}.
