[I 2025-08-31 10:52:57,367] Trial 720 finished with values: [-1000000000.0, 1000000000.0] and parameters: {'p_sma': 7, 'p_std': 49, 'p_atr': 29, 'p_adx': 23, 'rsi_period': 72, 'ema1': 6, 'ema2': 17, 'slip_atr_k': 0.21975493832722026, 'slip_spread_k': 0.31591461590402753, 'spread_hl_frac': 0.01151179637080199, 'bb_std_mult': 3.4615864116078763, 'rsi_os': 40, 'rsi_ob': 83, 'vol_spike': 0.25402025457982474, 'adx_thresh': 21.98479889293194, 'atr_min_pct': 0.019013482127253442, 'atr_max_pct': 0.12705209909308723, 'tp_mult': 2.8634193184673857, 'tsl_mult': 0.038097810110173845, 'strategy': 'mean_reversion', 'time_stop': 149, 'use_sma': False, 'use_atr': False, 'use_adx': True, 'use_ema': True, 'use_spike': False, 'rsi_required': True, 'edge_k': 1.2140841466468173, 'edge_cap': 0.12533209829102576, 'bull_strategy': 'mean_reversion', 'bull_bb_std_mult': 1.2578638062623635, 'bull_rsi_os': 18, 'bull_rsi_ob': 67, 'bull_adx_thresh': 32.06695064192017, 'bull_atr_min_pct': 0.00872956291012326, 'bull_atr_max_pct': 0.08152453022429494, 'bull_tp_mult': 2.2082567228648573, 'bull_tsl_mult': 0.9880200276270403, 'bull_time_stop': 33, 'bull_use_sma': True, 'bull_use_ema': False, 'bull_use_atr': False, 'bull_use_adx': True, 'bull_use_spike': False, 'bull_rsi_required': True, 'bear_strategy': 'breakout', 'bear_bb_std_mult': 2.783063901363748, 'bear_rsi_os': 8, 'bear_rsi_ob': 77, 'bear_adx_thresh': 19.055057218949187, 'bear_atr_min_pct': 0.005594466411026357, 'bear_atr_max_pct': 0.0994786384315124, 'bear_tp_mult': 2.0388238801585477, 'bear_tsl_mult': 0.04644545814942347, 'bear_time_stop': 63, 'bear_use_sma': True, 'bear_use_ema': True, 'bear_use_atr': False, 'bear_use_adx': False, 'bear_use_spike': True, 'bear_rsi_required': True, 'sideways_strategy': 'breakout', 'sideways_bb_std_mult': 2.877650444814464, 'sideways_rsi_os': 17, 'sideways_rsi_ob': 51, 'sideways_adx_thresh': 8.204033955233028, 'sideways_atr_min_pct': 0.0005174816729042748, 'sideways_atr_max_pct': 0.10871345526613574, 'sideways_tp_mult': 2.9057168581253525, 'sideways_tsl_mult': 0.6266427914388284, 'sideways_time_stop': 240, 'sideways_use_sma': True, 'sideways_use_ema': True, 'sideways_use_atr': False, 'sideways_use_adx': False, 'sideways_use_spike': True, 'sideways_rsi_required': False}.
[I 2025-08-31 10:53:29,536] Trial 722 finished with values: [-1000000000.0, 1000000000.0] and parameters: {'p_sma': 20, 'p_std': 55, 'p_atr': 8, 'p_adx': 7, 'rsi_period': 57, 'ema1': 13, 'ema2': 35, 'slip_atr_k': 0.18212654280309093, 'slip_spread_k': 0.8370400604048402, 'spread_hl_frac': 0.009388909450992614, 'bb_std_mult': 2.409698159132424, 'rsi_os': 36, 'rsi_ob': 83, 'vol_spike': 0.28311286793208923, 'adx_thresh': 32.44482916337476, 'atr_min_pct': 0.01218761746837412, 'atr_max_pct': 0.12662473714933375, 'tp_mult': 2.899090087964642, 'tsl_mult': 0.062127582410020254, 'strategy': 'breakout', 'time_stop': 147, 'use_sma': False, 'use_atr': True, 'use_adx': True, 'use_ema': True, 'use_spike': False, 'rsi_required': False, 'edge_k': 1.7932490868899669, 'edge_cap': 0.1717795710875439, 'bull_strategy': 'mean_reversion', 'bull_bb_std_mult': 1.2586523595015173, 'bull_rsi_os': 19, 'bull_rsi_ob': 86, 'bull_adx_thresh': 32.18522742560988, 'bull_atr_min_pct': 0.005004966466291552, 'bull_atr_max_pct': 0.08132028838672395, 'bull_tp_mult': 1.1517983891336252, 'bull_tsl_mult': 0.9802150167004735, 'bull_time_stop': 81, 'bull_use_sma': True, 'bull_use_ema': False, 'bull_use_atr': False, 'bull_use_adx': False, 'bull_use_spike': True, 'bull_rsi_required': False, 'bear_strategy': 'breakout', 'bear_bb_std_mult': 2.760615988285111, 'bear_rsi_os': 10, 'bear_rsi_ob': 77, 'bear_adx_thresh': 19.025029061651644, 'bear_atr_min_pct': 0.003755294134823648, 'bear_atr_max_pct': 0.11107944172298942, 'bear_tp_mult': 2.0870776691997697, 'bear_tsl_mult': 0.7386245944985703, 'bear_time_stop': 270, 'bear_use_sma': False, 'bear_use_ema': False, 'bear_use_atr': False, 'bear_use_adx': True, 'bear_use_spike': True, 'bear_rsi_required': False, 'sideways_strategy': 'mean_reversion', 'sideways_bb_std_mult': 1.0788633876329794, 'sideways_rsi_os': 43, 'sideways_rsi_ob': 83, 'sideways_adx_thresh': 29.930857665554306, 'sideways_atr_min_pct': 0.0008673288724607871, 'sideways_atr_max_pct': 0.10467033565021236, 'sideways_tp_mult': 2.90815822428316, 'sideways_tsl_mult': 0.8533559344413613, 'sideways_time_stop': 135, 'sideways_use_sma': True, 'sideways_use_ema': False, 'sideways_use_atr': True, 'sideways_use_adx': False, 'sideways_use_spike': True, 'sideways_rsi_required': True}.
[I 2025-08-31 10:53:30,198] Trial 724 finished with values: [-1000000000.0, 1000000000.0] and parameters: {'p_sma': 15, 'p_std': 48, 'p_atr': 30, 'p_adx': 25, 'rsi_period': 54, 'ema1': 24, 'ema2': 10, 'slip_atr_k': 0.1160028211090364, 'slip_spread_k': 0.10688191741747628, 'spread_hl_frac': 0.011048837816352767, 'bb_std_mult': 1.279214253479833, 'rsi_os': 36, 'rsi_ob': 84, 'vol_spike': 0.2843464027722084, 'adx_thresh': 24.979058917272397, 'atr_min_pct': 0.012143772773785708, 'atr_max_pct': 0.013104348719103681, 'tp_mult': 2.7417399413516805, 'tsl_mult': 0.9693849060616422, 'strategy': 'breakout', 'time_stop': 157, 'use_sma': True, 'use_atr': True, 'use_adx': True, 'use_ema': True, 'use_spike': False, 'rsi_required': False, 'edge_k': 1.923908494481953, 'edge_cap': 0.17236555721798985, 'bull_strategy': 'breakout', 'bull_bb_std_mult': 1.3202987627442473, 'bull_rsi_os': 24, 'bull_rsi_ob': 73, 'bull_adx_thresh': 30.50550164633685, 'bull_atr_min_pct': 0.005204911715176893, 'bull_atr_max_pct': 0.09436118176732139, 'bull_tp_mult': 2.49176403410817, 'bull_tsl_mult': 0.9531649294772301, 'bull_time_stop': 11, 'bull_use_sma': True, 'bull_use_ema': True, 'bull_use_atr': False, 'bull_use_adx': False, 'bull_use_spike': True, 'bull_rsi_required': False, 'bear_strategy': 'mean_reversion', 'bear_bb_std_mult': 2.8791073439114134, 'bear_rsi_os': 6, 'bear_rsi_ob': 78, 'bear_adx_thresh': 9.152957101056213, 'bear_atr_min_pct': 0.00674790921681659, 'bear_atr_max_pct': 0.08787844203286228, 'bear_tp_mult': 1.5995209454636095, 'bear_tsl_mult': 0.3534172120493045, 'bear_time_stop': 262, 'bear_use_sma': False, 'bear_use_ema': False, 'bear_use_atr': False, 'bear_use_adx': True, 'bear_use_spike': True, 'bear_rsi_required': False, 'sideways_strategy': 'mean_reversion', 'sideways_bb_std_mult': 1.0910589425677306, 'sideways_rsi_os': 45, 'sideways_rsi_ob': 83, 'sideways_adx_thresh': 30.06973086037474, 'sideways_atr_min_pct': 0.001035525477576888, 'sideways_atr_max_pct': 0.12344833242311826, 'sideways_tp_mult': 2.943985752581132, 'sideways_tsl_mult': 0.10451676257090617, 'sideways_time_stop': 252, 'sideways_use_sma': True, 'sideways_use_ema': False, 'sideways_use_atr': True, 'sideways_use_adx': True, 'sideways_use_spike': True, 'sideways_rsi_required': True}.
[I 2025-08-31 10:53:30,365] Trial 723 finished with values: [-1000000000.0, 1000000000.0] and parameters: {'p_sma': 38, 'p_std': 27, 'p_atr': 29, 'p_adx': 9, 'rsi_period': 66, 'ema1': 6, 'ema2': 35, 'slip_atr_k': 0.1817538622949457, 'slip_spread_k': 0.10722428081807893, 'spread_hl_frac': 0.029441639384897175, 'bb_std_mult': 3.429893183581272, 'rsi_os': 43, 'rsi_ob': 83, 'vol_spike': 0.2825863065940689, 'adx_thresh': 15.169501518724847, 'atr_min_pct': 0.012280598299044597, 'atr_max_pct': 0.06844206808693452, 'tp_mult': 2.7840982916975787, 'tsl_mult': 0.0382959432030266, 'strategy': 'breakout', 'time_stop': 242, 'use_sma': False, 'use_atr': True, 'use_adx': True, 'use_ema': True, 'use_spike': False, 'rsi_required': False, 'edge_k': 1.2179393483455803, 'edge_cap': 0.17808010997277843, 'bull_strategy': 'mean_reversion', 'bull_bb_std_mult': 1.3857983063208081, 'bull_rsi_os': 24, 'bull_rsi_ob': 55, 'bull_adx_thresh': 24.47748782796957, 'bull_atr_min_pct': 0.008774538319993412, 'bull_atr_max_pct': 0.08123812765298219, 'bull_tp_mult': 2.231380874351071, 'bull_tsl_mult': 0.9992677883827277, 'bull_time_stop': 82, 'bull_use_sma': True, 'bull_use_ema': True, 'bull_use_atr': False, 'bull_use_adx': False, 'bull_use_spike': True, 'bull_rsi_required': False, 'bear_strategy': 'mean_reversion', 'bear_bb_std_mult': 2.7570312093343476, 'bear_rsi_os': 33, 'bear_rsi_ob': 65, 'bear_adx_thresh': 21.901438537777683, 'bear_atr_min_pct': 0.007027573297365452, 'bear_atr_max_pct': 0.01634448556726993, 'bear_tp_mult': 2.0067754267278786, 'bear_tsl_mult': 0.4623442858783088, 'bear_time_stop': 65, 'bear_use_sma': False, 'bear_use_ema': False, 'bear_use_atr': False, 'bear_use_adx': True, 'bear_use_spike': True, 'bear_rsi_required': False, 'sideways_strategy': 'mean_reversion', 'sideways_bb_std_mult': 1.0803627022524387, 'sideways_rsi_os': 25, 'sideways_rsi_ob': 91, 'sideways_adx_thresh': 29.200543792038587, 'sideways_atr_min_pct': 0.012686375766907053, 'sideways_atr_max_pct': 0.1052540945383845, 'sideways_tp_mult': 2.9108367153126444, 'sideways_tsl_mult': 0.8101493893502683, 'sideways_time_stop': 253, 'sideways_use_sma': True, 'sideways_use_ema': False, 'sideways_use_atr': True, 'sideways_use_adx': True, 'sideways_use_spike': True, 'sideways_rsi_required': True}.
[I 2025-08-31 10:53:30,451] Trial 721 finished with values: [-1000000000.0, 1000000000.0] and parameters: {'p_sma': 11, 'p_std': 41, 'p_atr': 29, 'p_adx': 9, 'rsi_period': 54, 'ema1': 6, 'ema2': 26, 'slip_atr_k': 0.18119362411214326, 'slip_spread_k': 0.1284124602296155, 'spread_hl_frac': 0.023258828162348123, 'bb_std_mult': 3.4680727222785728, 'rsi_os': 43, 'rsi_ob': 83, 'vol_spike': 0.25400967072008934, 'adx_thresh': 22.370505301169377, 'atr_min_pct': 0.01215468364553711, 'atr_max_pct': 0.06191260109386359, 'tp_mult': 2.8650302620108534, 'tsl_mult': 0.03693190870412147, 'strategy': 'breakout', 'time_stop': 148, 'use_sma': False, 'use_atr': True, 'use_adx': True, 'use_ema': True, 'use_spike': False, 'rsi_required': False, 'edge_k': 1.210085240832559, 'edge_cap': 0.9965178247835147, 'bull_strategy': 'mean_reversion', 'bull_bb_std_mult': 1.28163883351839, 'bull_rsi_os': 24, 'bull_rsi_ob': 68, 'bull_adx_thresh': 6.58235780448738, 'bull_atr_min_pct': 0.008845548922141845, 'bull_atr_max_pct': 0.09749657582939958, 'bull_tp_mult': 2.177921009182757, 'bull_tsl_mult': 0.13180284287798477, 'bull_time_stop': 166, 'bull_use_sma': True, 'bull_use_ema': False, 'bull_use_atr': False, 'bull_use_adx': False, 'bull_use_spike': True, 'bull_rsi_required': False, 'bear_strategy': 'breakout', 'bear_bb_std_mult': 0.7681342991001774, 'bear_rsi_os': 39, 'bear_rsi_ob': 78, 'bear_adx_thresh': 21.76980530526241, 'bear_atr_min_pct': 0.006536478402822236, 'bear_atr_max_pct': 0.09825597727912568, 'bear_tp_mult': 2.0885352719730017, 'bear_tsl_mult': 0.45986483188894617, 'bear_time_stop': 159, 'bear_use_sma': False, 'bear_use_ema': False, 'bear_use_atr': False, 'bear_use_adx': True, 'bear_use_spike': True, 'bear_rsi_required': False, 'sideways_strategy': 'mean_reversion', 'sideways_bb_std_mult': 3.408040401361993, 'sideways_rsi_os': 20, 'sideways_rsi_ob': 57, 'sideways_adx_thresh': 14.685026413474594, 'sideways_atr_min_pct': 0.01868597436619909, 'sideways_atr_max_pct': 0.12412446276598081, 'sideways_tp_mult': 2.9202971136365967, 'sideways_tsl_mult': 0.11413742086368019, 'sideways_time_stop': 226, 'sideways_use_sma': True, 'sideways_use_ema': False, 'sideways_use_atr': True, 'sideways_use_adx': False, 'sideways_use_spike': True, 'sideways_rsi_required': True}.
[I 2025-08-31 10:54:02,715] Trial 728 finished with values: [-0.019938218013386688, 0.019796559272601336] and parameters: {'p_sma': 6, 'p_std': 50, 'p_atr': 21, 'p_adx': 9, 'rsi_period': 18, 'ema1': 19, 'ema2': 40, 'slip_atr_k': 0.132081752666339, 'slip_spread_k': 0.7119376938123643, 'spread_hl_frac': 0.04261903297957857, 'bb_std_mult': 3.1033132369883023, 'rsi_os': 27, 'rsi_ob': 85, 'vol_spike': 0.29344606662123107, 'adx_thresh': 11.496613672420237, 'atr_min_pct': 0.010976682265245672, 'atr_max_pct': 0.049005562339706765, 'tp_mult': 2.824297563240115, 'tsl_mult': 0.5633243156757752, 'strategy': 'breakout', 'time_stop': 76, 'use_sma': True, 'use_atr': False, 'use_adx': False, 'use_ema': True, 'use_spike': True, 'rsi_required': True, 'edge_k': 0.1584858568241837, 'edge_cap': 0.9517463236394788, 'bull_strategy': 'breakout', 'bull_bb_std_mult': 2.111219839445741, 'bull_rsi_os': 27, 'bull_rsi_ob': 63, 'bull_adx_thresh': 27.642997443799352, 'bull_atr_min_pct': 0.025935011448005058, 'bull_atr_max_pct': 0.09217855780364251, 'bull_tp_mult': 2.6707771417941437, 'bull_tsl_mult': 0.9627245427823692, 'bull_time_stop': 181, 'bull_use_sma': False, 'bull_use_ema': False, 'bull_use_atr': False, 'bull_use_adx': False, 'bull_use_spike': False, 'bull_rsi_required': True, 'bear_strategy': 'breakout', 'bear_bb_std_mult': 1.180027105394025, 'bear_rsi_os': 29, 'bear_rsi_ob': 90, 'bear_adx_thresh': 17.996913284881806, 'bear_atr_min_pct': 0.02555004801778061, 'bear_atr_max_pct': 0.10860430503034318, 'bear_tp_mult': 2.0082834455682477, 'bear_tsl_mult': 0.19709345902252456, 'bear_time_stop': 139, 'bear_use_sma': False, 'bear_use_ema': True, 'bear_use_atr': True, 'bear_use_adx': True, 'bear_use_spike': True, 'bear_rsi_required': True, 'sideways_strategy': 'breakout', 'sideways_bb_std_mult': 0.9717781088596614, 'sideways_rsi_os': 39, 'sideways_rsi_ob': 94, 'sideways_adx_thresh': 26.542696369094443, 'sideways_atr_min_pct': 0.0016417036162939384, 'sideways_atr_max_pct': 0.11255013517694121, 'sideways_tp_mult': 1.7878865784417202, 'sideways_tsl_mult': 0.2638700261855409, 'sideways_time_stop': 234, 'sideways_use_sma': False, 'sideways_use_ema': True, 'sideways_use_atr': False, 'sideways_use_adx': False, 'sideways_use_spike': True, 'sideways_rsi_required': False}.
[I 2025-08-31 10:54:03,152] Trial 725 finished with values: [-1000000000.0, 1000000000.0] and parameters: {'p_sma': 10, 'p_std': 48, 'p_atr': 29, 'p_adx': 25, 'rsi_period': 50, 'ema1': 17, 'ema2': 54, 'slip_atr_k': 0.17710138145016704, 'slip_spread_k': 0.7142700452057749, 'spread_hl_frac': 0.010725283805424096, 'bb_std_mult': 1.2914586525655858, 'rsi_os': 15, 'rsi_ob': 80, 'vol_spike': 0.29390686578434955, 'adx_thresh': 15.046079640982121, 'atr_min_pct': 0.011236355948911491, 'atr_max_pct': 0.11626817578962802, 'tp_mult': 2.741985589045665, 'tsl_mult': 0.8296218988755222, 'strategy': 'breakout', 'time_stop': 137, 'use_sma': True, 'use_atr': True, 'use_adx': False, 'use_ema': True, 'use_spike': False, 'rsi_required': False, 'edge_k': 1.1450627980578316, 'edge_cap': 0.09050684398067899, 'bull_strategy': 'breakout', 'bull_bb_std_mult': 1.381796043228108, 'bull_rsi_os': 47, 'bull_rsi_ob': 54, 'bull_adx_thresh': 27.240341373346695, 'bull_atr_min_pct': 0.007435106964788869, 'bull_atr_max_pct': 0.0934586202346901, 'bull_tp_mult': 2.668014386197805, 'bull_tsl_mult': 0.38348559037267427, 'bull_time_stop': 211, 'bull_use_sma': True, 'bull_use_ema': True, 'bull_use_atr': False, 'bull_use_adx': False, 'bull_use_spike': True, 'bull_rsi_required': False, 'bear_strategy': 'mean_reversion', 'bear_bb_std_mult': 2.8426150036593474, 'bear_rsi_os': 33, 'bear_rsi_ob': 78, 'bear_adx_thresh': 21.936722146165877, 'bear_atr_min_pct': 0.006855768655414286, 'bear_atr_max_pct': 0.08726841426155052, 'bear_tp_mult': 1.5847787920964158, 'bear_tsl_mult': 0.45625501224361065, 'bear_time_stop': 260, 'bear_use_sma': False, 'bear_use_ema': False, 'bear_use_atr': False, 'bear_use_adx': True, 'bear_use_spike': True, 'bear_rsi_required': False, 'sideways_strategy': 'mean_reversion', 'sideways_bb_std_mult': 0.5008810430430721, 'sideways_rsi_os': 6, 'sideways_rsi_ob': 92, 'sideways_adx_thresh': 24.792272864978255, 'sideways_atr_min_pct': 0.0016633873526159804, 'sideways_atr_max_pct': 0.0830163788811509, 'sideways_tp_mult': 2.9469492907397727, 'sideways_tsl_mult': 0.11773020772307935, 'sideways_time_stop': 252, 'sideways_use_sma': True, 'sideways_use_ema': False, 'sideways_use_atr': True, 'sideways_use_adx': True, 'sideways_use_spike': True, 'sideways_rsi_required': True}.
[I 2025-08-31 10:54:03,152] Trial 727 finished with values: [-0.028973884203905786, 0.028846166046552532] and parameters: {'p_sma': 11, 'p_std': 50, 'p_atr': 29, 'p_adx': 9, 'rsi_period': 25, 'ema1': 10, 'ema2': 52, 'slip_atr_k': 0.12740391324825304, 'slip_spread_k': 0.7152825862141207, 'spread_hl_frac': 0.012074858804603406, 'bb_std_mult': 1.2372824404489164, 'rsi_os': 15, 'rsi_ob': 85, 'vol_spike': 0.2934915681622162, 'adx_thresh': 21.641379959638012, 'atr_min_pct': 0.027577155030363516, 'atr_max_pct': 0.11484780865238256, 'tp_mult': 2.830149801058471, 'tsl_mult': 0.5661891315688465, 'strategy': 'breakout', 'time_stop': 138, 'use_sma': True, 'use_atr': False, 'use_adx': False, 'use_ema': True, 'use_spike': True, 'rsi_required': True, 'edge_k': 1.7560779234095978, 'edge_cap': 0.25469492811686023, 'bull_strategy': 'breakout', 'bull_bb_std_mult': 1.7324292449838072, 'bull_rsi_os': 25, 'bull_rsi_ob': 60, 'bull_adx_thresh': 7.513463292066348, 'bull_atr_min_pct': 0.00762356151942659, 'bull_atr_max_pct': 0.08832962788575738, 'bull_tp_mult': 1.8794905702404656, 'bull_tsl_mult': 0.23055929372745565, 'bull_time_stop': 76, 'bull_use_sma': False, 'bull_use_ema': False, 'bull_use_atr': False, 'bull_use_adx': False, 'bull_use_spike': False, 'bull_rsi_required': True, 'bear_strategy': 'breakout', 'bear_bb_std_mult': 2.8320704038155227, 'bear_rsi_os': 30, 'bear_rsi_ob': 81, 'bear_adx_thresh': 21.02962653158811, 'bear_atr_min_pct': 0.010381486234626952, 'bear_atr_max_pct': 0.10889525344383201, 'bear_tp_mult': 1.6314254301491733, 'bear_tsl_mult': 0.2542777173648986, 'bear_time_stop': 140, 'bear_use_sma': False, 'bear_use_ema': True, 'bear_use_atr': True, 'bear_use_adx': True, 'bear_use_spike': True, 'bear_rsi_required': True, 'sideways_strategy': 'breakout', 'sideways_bb_std_mult': 3.4165015440238324, 'sideways_rsi_os': 39, 'sideways_rsi_ob': 92, 'sideways_adx_thresh': 10.94967729022248, 'sideways_atr_min_pct': 0.0015098282802640936, 'sideways_atr_max_pct': 0.11177126794977822, 'sideways_tp_mult': 2.9493166562619653, 'sideways_tsl_mult': 0.5404349307986736, 'sideways_time_stop': 227, 'sideways_use_sma': False, 'sideways_use_ema': True, 'sideways_use_atr': False, 'sideways_use_adx': False, 'sideways_use_spike': True, 'sideways_rsi_required': False}.
[I 2025-08-31 10:54:03,461] Trial 726 finished with values: [-1000000000.0, 1000000000.0] and parameters: {'p_sma': 11, 'p_std': 50, 'p_atr': 29, 'p_adx': 9, 'rsi_period': 69, 'ema1': 16, 'ema2': 36, 'slip_atr_k': 0.18079649526286978, 'slip_spread_k': 0.7092577084482288, 'spread_hl_frac': 0.0262751965393018, 'bb_std_mult': 1.9458945496296345, 'rsi_os': 12, 'rsi_ob': 58, 'vol_spike': 0.23608760064363932, 'adx_thresh': 15.166045238149646, 'atr_min_pct': 0.01091536777495598, 'atr_max_pct': 0.0685741732928111, 'tp_mult': 2.7952456224352864, 'tsl_mult': 0.5624437655062082, 'strategy': 'breakout', 'time_stop': 137, 'use_sma': False, 'use_atr': False, 'use_adx': False, 'use_ema': True, 'use_spike': True, 'rsi_required': True, 'edge_k': 0.10277282481554639, 'edge_cap': 0.08821923246930707, 'bull_strategy': 'mean_reversion', 'bull_bb_std_mult': 1.709512757496789, 'bull_rsi_os': 25, 'bull_rsi_ob': 58, 'bull_adx_thresh': 14.1208102361918, 'bull_atr_min_pct': 0.0021892008915343295, 'bull_atr_max_pct': 0.07666581239619043, 'bull_tp_mult': 2.2324402806818107, 'bull_tsl_mult': 0.9610397179083041, 'bull_time_stop': 181, 'bull_use_sma': True, 'bull_use_ema': True, 'bull_use_atr': False, 'bull_use_adx': False, 'bull_use_spike': False, 'bull_rsi_required': True, 'bear_strategy': 'breakout', 'bear_bb_std_mult': 2.851484905852459, 'bear_rsi_os': 13, 'bear_rsi_ob': 65, 'bear_adx_thresh': 21.726963225394183, 'bear_atr_min_pct': 0.006918294814074401, 'bear_atr_max_pct': 0.017057810776555327, 'bear_tp_mult': 2.003914954974778, 'bear_tsl_mult': 0.46287916200475077, 'bear_time_stop': 276, 'bear_use_sma': False, 'bear_use_ema': True, 'bear_use_atr': True, 'bear_use_adx': True, 'bear_use_spike': True, 'bear_rsi_required': True, 'sideways_strategy': 'breakout', 'sideways_bb_std_mult': 3.417138531065694, 'sideways_rsi_os': 39, 'sideways_rsi_ob': 91, 'sideways_adx_thresh': 25.18867655096503, 'sideways_atr_min_pct': 0.023683689352199444, 'sideways_atr_max_pct': 0.09902349045200019, 'sideways_tp_mult': 2.426167368598984, 'sideways_tsl_mult': 0.5474418770268994, 'sideways_time_stop': 225, 'sideways_use_sma': False, 'sideways_use_ema': True, 'sideways_use_atr': False, 'sideways_use_adx': True, 'sideways_use_spike': True, 'sideways_rsi_required': False}.
