[I 2025-08-31 10:03:25,451] Trial 332 finished with values: [-0.07330901402407675, 0.07312691474302947] and parameters: {'p_sma': 8, 'p_std': 10, 'p_atr': 10, 'p_adx': 10, 'rsi_period': 17, 'ema1': 19, 'ema2': 58, 'slip_atr_k': 0.15197635212129706, 'slip_spread_k': 0.3384320042998366, 'spread_hl_frac': 0.04057442055407509, 'bb_std_mult': 0.9801168459802809, 'rsi_os': 21, 'rsi_ob': 49, 'vol_spike': 0.026956440724126396, 'adx_thresh': 22.507393636002124, 'atr_min_pct': 0.004295855824238295, 'atr_max_pct': 0.13672350221596624, 'tp_mult': 2.7697967924095073, 'tsl_mult': 0.000657410405257383, 'strategy': 'breakout', 'time_stop': 265, 'use_sma': False, 'use_atr': False, 'use_adx': True, 'use_ema': False, 'use_spike': True, 'rsi_required': False, 'edge_k': 1.8068006741293121, 'edge_cap': 0.07699584802171072, 'bull_strategy': 'mean_reversion', 'bull_bb_std_mult': 1.3630257948644124, 'bull_rsi_os': 51, 'bull_rsi_ob': 54, 'bull_adx_thresh': 31.957145427645955, 'bull_atr_min_pct': 0.006368877117792401, 'bull_atr_max_pct': 0.11427119883219643, 'bull_tp_mult': 1.4498228997545402, 'bull_tsl_mult': 0.00962479190649651, 'bull_time_stop': 204, 'bull_use_sma': True, 'bull_use_ema': True, 'bull_use_atr': False, 'bull_use_adx': False, 'bull_use_spike': True, 'bull_rsi_required': False, 'bear_strategy': 'breakout', 'bear_bb_std_mult': 2.972945733385414, 'bear_rsi_os': 52, 'bear_rsi_ob': 53, 'bear_adx_thresh': 6.207811974449539, 'bear_atr_min_pct': 0.02297907052045525, 'bear_atr_max_pct': 0.14558076042432966, 'bear_tp_mult': 2.695324341892716, 'bear_tsl_mult': 0.010762503441534454, 'bear_time_stop': 263, 'bear_use_sma': False, 'bear_use_ema': True, 'bear_use_atr': False, 'bear_use_adx': True, 'bear_use_spike': False, 'bear_rsi_required': True, 'sideways_strategy': 'breakout', 'sideways_bb_std_mult': 1.2151606387538487, 'sideways_rsi_os': 35, 'sideways_rsi_ob': 85, 'sideways_adx_thresh': 8.536879634445597, 'sideways_atr_min_pct': 0.0011332548164989197, 'sideways_atr_max_pct': 0.03516084940171395, 'sideways_tp_mult': 2.8558774830801075, 'sideways_tsl_mult': 0.0008597395043249967, 'sideways_time_stop': 244, 'sideways_use_sma': True, 'sideways_use_ema': True, 'sideways_use_atr': True, 'sideways_use_adx': False, 'sideways_use_spike': False, 'sideways_rsi_required': False}.
[I 2025-08-31 10:03:26,006] Trial 336 finished with values: [-1000000000.0, 1000000000.0] and parameters: {'p_sma': 29, 'p_std': 36, 'p_atr': 28, 'p_adx': 26, 'rsi_period': 22, 'ema1': 5, 'ema2': 37, 'slip_atr_k': 0.1322210498814126, 'slip_spread_k': 0.995082714562394, 'spread_hl_frac': 0.01210092261344754, 'bb_std_mult': 3.21276403693982, 'rsi_os': 23, 'rsi_ob': 50, 'vol_spike': 0.09747395927101107, 'adx_thresh': 5.589915912095184, 'atr_min_pct': 0.011369566767542099, 'atr_max_pct': 0.0818031396852056, 'tp_mult': 2.8050238281629145, 'tsl_mult': 0.3230835040843223, 'strategy': 'mean_reversion', 'time_stop': 253, 'use_sma': True, 'use_atr': False, 'use_adx': False, 'use_ema': True, 'use_spike': False, 'rsi_required': True, 'edge_k': 1.8689558461752507, 'edge_cap': 0.1825225331660012, 'bull_strategy': 'breakout', 'bull_bb_std_mult': 1.1941466557159104, 'bull_rsi_os': 31, 'bull_rsi_ob': 65, 'bull_adx_thresh': 32.078339059947446, 'bull_atr_min_pct': 0.019130990695186326, 'bull_atr_max_pct': 0.1123210342665914, 'bull_tp_mult': 1.5368130742915076, 'bull_tsl_mult': 0.0022908736652471617, 'bull_time_stop': 250, 'bull_use_sma': True, 'bull_use_ema': False, 'bull_use_atr': True, 'bull_use_adx': True, 'bull_use_spike': True, 'bull_rsi_required': True, 'bear_strategy': 'breakout', 'bear_bb_std_mult': 2.219840444366553, 'bear_rsi_os': 54, 'bear_rsi_ob': 69, 'bear_adx_thresh': 5.64206744968341, 'bear_atr_min_pct': 0.02238377876219159, 'bear_atr_max_pct': 0.04345995111293497, 'bear_tp_mult': 2.8250540222360057, 'bear_tsl_mult': 0.004749799895794937, 'bear_time_stop': 263, 'bear_use_sma': True, 'bear_use_ema': False, 'bear_use_atr': False, 'bear_use_adx': False, 'bear_use_spike': True, 'bear_rsi_required': True, 'sideways_strategy': 'mean_reversion', 'sideways_bb_std_mult': 1.6809384098207483, 'sideways_rsi_os': 23, 'sideways_rsi_ob': 94, 'sideways_adx_thresh': 27.934553915065408, 'sideways_atr_min_pct': 0.02273429256644264, 'sideways_atr_max_pct': 0.14154962689926154, 'sideways_tp_mult': 1.4607885976602122, 'sideways_tsl_mult': 0.020190097666511753, 'sideways_time_stop': 101, 'sideways_use_sma': True, 'sideways_use_ema': True, 'sideways_use_atr': True, 'sideways_use_adx': False, 'sideways_use_spike': False, 'sideways_rsi_required': True}.
[I 2025-08-31 10:03:57,172] Trial 334 finished with values: [-1000000000.0, 1000000000.0] and parameters: {'p_sma': 50, 'p_std': 28, 'p_atr': 30, 'p_adx': 26, 'rsi_period': 17, 'ema1': 20, 'ema2': 38, 'slip_atr_k': 0.1328426883146871, 'slip_spread_k': 0.4903942126517189, 'spread_hl_frac': 0.019569822809792033, 'bb_std_mult': 1.2346277742631442, 'rsi_os': 20, 'rsi_ob': 92, 'vol_spike': 0.18360930850135454, 'adx_thresh': 5.50037134681906, 'atr_min_pct': 0.013601718074716827, 'atr_max_pct': 0.08765756095262826, 'tp_mult': 2.380163388174345, 'tsl_mult': 0.0029998656269649344, 'strategy': 'mean_reversion', 'time_stop': 124, 'use_sma': True, 'use_atr': True, 'use_adx': False, 'use_ema': False, 'use_spike': False, 'rsi_required': False, 'edge_k': 0.0072247888008351024, 'edge_cap': 0.07996881004114773, 'bull_strategy': 'breakout', 'bull_bb_std_mult': 2.5266865023779808, 'bull_rsi_os': 31, 'bull_rsi_ob': 62, 'bull_adx_thresh': 31.6070216334684, 'bull_atr_min_pct': 0.029425920847703693, 'bull_atr_max_pct': 0.08014069354427678, 'bull_tp_mult': 1.559503436329723, 'bull_tsl_mult': 0.0002889132088783608, 'bull_time_stop': 257, 'bull_use_sma': True, 'bull_use_ema': True, 'bull_use_atr': True, 'bull_use_adx': True, 'bull_use_spike': True, 'bull_rsi_required': True, 'bear_strategy': 'breakout', 'bear_bb_std_mult': 1.394784360694812, 'bear_rsi_os': 51, 'bear_rsi_ob': 67, 'bear_adx_thresh': 18.7057329087518, 'bear_atr_min_pct': 0.025704023667372147, 'bear_atr_max_pct': 0.131505380110139, 'bear_tp_mult': 2.6327954700226295, 'bear_tsl_mult': 0.5123626472423819, 'bear_time_stop': 262, 'bear_use_sma': True, 'bear_use_ema': True, 'bear_use_atr': False, 'bear_use_adx': False, 'bear_use_spike': False, 'bear_rsi_required': False, 'sideways_strategy': 'mean_reversion', 'sideways_bb_std_mult': 3.3260885662670416, 'sideways_rsi_os': 25, 'sideways_rsi_ob': 62, 'sideways_adx_thresh': 28.610481531579744, 'sideways_atr_min_pct': 0.0010499497710757884, 'sideways_atr_max_pct': 0.14060055011915346, 'sideways_tp_mult': 1.5952547965170867, 'sideways_tsl_mult': 0.016338302887018416, 'sideways_time_stop': 234, 'sideways_use_sma': True, 'sideways_use_ema': True, 'sideways_use_atr': True, 'sideways_use_adx': True, 'sideways_use_spike': False, 'sideways_rsi_required': True}.
[I 2025-08-31 10:03:57,502] Trial 335 finished with values: [-1000000000.0, 1000000000.0] and parameters: {'p_sma': 48, 'p_std': 16, 'p_atr': 30, 'p_adx': 9, 'rsi_period': 17, 'ema1': 6, 'ema2': 37, 'slip_atr_k': 0.1515184880929597, 'slip_spread_k': 0.4809486546242772, 'spread_hl_frac': 0.012161655150461678, 'bb_std_mult': 1.2416571442986402, 'rsi_os': 47, 'rsi_ob': 78, 'vol_spike': 0.09682151194711339, 'adx_thresh': 22.663297822740983, 'atr_min_pct': 0.02773770236157841, 'atr_max_pct': 0.08257865116386448, 'tp_mult': 2.3779629400667908, 'tsl_mult': 0.017518892402643902, 'strategy': 'mean_reversion', 'time_stop': 122, 'use_sma': True, 'use_atr': True, 'use_adx': False, 'use_ema': True, 'use_spike': False, 'rsi_required': False, 'edge_k': 1.779982938003452, 'edge_cap': 0.971455113399446, 'bull_strategy': 'breakout', 'bull_bb_std_mult': 1.3544915330382932, 'bull_rsi_os': 21, 'bull_rsi_ob': 69, 'bull_adx_thresh': 20.35793979996885, 'bull_atr_min_pct': 0.01827723922509327, 'bull_atr_max_pct': 0.1296960535667279, 'bull_tp_mult': 1.557460612285863, 'bull_tsl_mult': 0.31222514548703795, 'bull_time_stop': 252, 'bull_use_sma': True, 'bull_use_ema': True, 'bull_use_atr': True, 'bull_use_adx': True, 'bull_use_spike': True, 'bull_rsi_required': True, 'bear_strategy': 'breakout', 'bear_bb_std_mult': 1.1971737883685782, 'bear_rsi_os': 54, 'bear_rsi_ob': 54, 'bear_adx_thresh': 28.735360563645933, 'bear_atr_min_pct': 0.023034675452083164, 'bear_atr_max_pct': 0.036804305119210366, 'bear_tp_mult': 2.212745143292983, 'bear_tsl_mult': 0.5183397865574872, 'bear_time_stop': 272, 'bear_use_sma': True, 'bear_use_ema': True, 'bear_use_atr': False, 'bear_use_adx': False, 'bear_use_spike': True, 'bear_rsi_required': False, 'sideways_strategy': 'mean_reversion', 'sideways_bb_std_mult': 1.1247713533590658, 'sideways_rsi_os': 35, 'sideways_rsi_ob': 63, 'sideways_adx_thresh': 34.81303680227346, 'sideways_atr_min_pct': 0.0010976260492135785, 'sideways_atr_max_pct': 0.0220909141047447, 'sideways_tp_mult': 1.5944605433710104, 'sideways_tsl_mult': 0.3038626655658886, 'sideways_time_stop': 97, 'sideways_use_sma': True, 'sideways_use_ema': True, 'sideways_use_atr': True, 'sideways_use_adx': True, 'sideways_use_spike': False, 'sideways_rsi_required': True}.
[I 2025-08-31 10:03:58,118] Trial 337 finished with values: [-1000000000.0, 1000000000.0] and parameters: {'p_sma': 49, 'p_std': 15, 'p_atr': 30, 'p_adx': 26, 'rsi_period': 22, 'ema1': 5, 'ema2': 37, 'slip_atr_k': 0.13683306310676654, 'slip_spread_k': 0.9919097362432002, 'spread_hl_frac': 0.0287544121194055, 'bb_std_mult': 0.7659331350105001, 'rsi_os': 23, 'rsi_ob': 70, 'vol_spike': 0.15070950171783118, 'adx_thresh': 5.577243743795227, 'atr_min_pct': 0.011393614335219642, 'atr_max_pct': 0.1438097289930998, 'tp_mult': 2.1616659604333264, 'tsl_mult': 0.023221024416144057, 'strategy': 'mean_reversion', 'time_stop': 57, 'use_sma': True, 'use_atr': True, 'use_adx': False, 'use_ema': True, 'use_spike': False, 'rsi_required': True, 'edge_k': 0.7788940754501329, 'edge_cap': 0.9296756080507829, 'bull_strategy': 'breakout', 'bull_bb_std_mult': 1.19228205879693, 'bull_rsi_os': 42, 'bull_rsi_ob': 69, 'bull_adx_thresh': 20.089658907049852, 'bull_atr_min_pct': 0.01931139412872417, 'bull_atr_max_pct': 0.1287322370863905, 'bull_tp_mult': 1.5571302254528443, 'bull_tsl_mult': 0.9571115657606326, 'bull_time_stop': 30, 'bull_use_sma': True, 'bull_use_ema': False, 'bull_use_atr': True, 'bull_use_adx': True, 'bull_use_spike': False, 'bull_rsi_required': True, 'bear_strategy': 'breakout', 'bear_bb_std_mult': 2.486283643305395, 'bear_rsi_os': 55, 'bear_rsi_ob': 69, 'bear_adx_thresh': 19.890791029738992, 'bear_atr_min_pct': 0.019543413849602776, 'bear_atr_max_pct': 0.04197573477591868, 'bear_tp_mult': 2.6291283609837137, 'bear_tsl_mult': 0.5178818843013882, 'bear_time_stop': 253, 'bear_use_sma': True, 'bear_use_ema': False, 'bear_use_atr': False, 'bear_use_adx': False, 'bear_use_spike': True, 'bear_rsi_required': False, 'sideways_strategy': 'mean_reversion', 'sideways_bb_std_mult': 0.8630359815655473, 'sideways_rsi_os': 23, 'sideways_rsi_ob': 51, 'sideways_adx_thresh': 25.938081143348438, 'sideways_atr_min_pct': 0.016236933961237272, 'sideways_atr_max_pct': 0.14185901385481497, 'sideways_tp_mult': 1.4755594428225667, 'sideways_tsl_mult': 0.034012134752494164, 'sideways_time_stop': 234, 'sideways_use_sma': True, 'sideways_use_ema': True, 'sideways_use_atr': False, 'sideways_use_adx': True, 'sideways_use_spike': True, 'sideways_rsi_required': True}.
[I 2025-08-31 10:03:58,817] Trial 338 finished with values: [-0.0777970503306975, 0.07734563759225514] and parameters: {'p_sma': 37, 'p_std': 15, 'p_atr': 20, 'p_adx': 9, 'rsi_period': 28, 'ema1': 6, 'ema2': 38, 'slip_atr_k': 0.1394732893892162, 'slip_spread_k': 0.48657672144421826, 'spread_hl_frac': 0.046304477635129536, 'bb_std_mult': 1.236502264548393, 'rsi_os': 47, 'rsi_ob': 64, 'vol_spike': 0.14654865655567553, 'adx_thresh': 19.662536989257124, 'atr_min_pct': 0.027631559809172368, 'atr_max_pct': 0.08796590123432346, 'tp_mult': 2.9085315063641994, 'tsl_mult': 0.020929058248362047, 'strategy': 'mean_reversion', 'time_stop': 132, 'use_sma': False, 'use_atr': True, 'use_adx': False, 'use_ema': False, 'use_spike': False, 'rsi_required': True, 'edge_k': 0.8041541084851263, 'edge_cap': 0.11239631364250136, 'bull_strategy': 'mean_reversion', 'bull_bb_std_mult': 1.4414725590070445, 'bull_rsi_os': 36, 'bull_rsi_ob': 94, 'bull_adx_thresh': 20.211457612547694, 'bull_atr_min_pct': 0.008232977108367713, 'bull_atr_max_pct': 0.12910134736641832, 'bull_tp_mult': 1.501924721784743, 'bull_tsl_mult': 0.5725467149447709, 'bull_time_stop': 254, 'bull_use_sma': True, 'bull_use_ema': False, 'bull_use_atr': True, 'bull_use_adx': False, 'bull_use_spike': False, 'bull_rsi_required': True, 'bear_strategy': 'breakout', 'bear_bb_std_mult': 2.7749090295482968, 'bear_rsi_os': 54, 'bear_rsi_ob': 80, 'bear_adx_thresh': 18.383616665181822, 'bear_atr_min_pct': 0.0026067015604145025, 'bear_atr_max_pct': 0.06307721989569993, 'bear_tp_mult': 2.637003843028858, 'bear_tsl_mult': 0.5175336139776212, 'bear_time_stop': 33, 'bear_use_sma': True, 'bear_use_ema': True, 'bear_use_atr': False, 'bear_use_adx': False, 'bear_use_spike': False, 'bear_rsi_required': False, 'sideways_strategy': 'mean_reversion', 'sideways_bb_std_mult': 0.8574773954578897, 'sideways_rsi_os': 11, 'sideways_rsi_ob': 88, 'sideways_adx_thresh': 32.862095641352, 'sideways_atr_min_pct': 0.016648353011770946, 'sideways_atr_max_pct': 0.02381740402485485, 'sideways_tp_mult': 1.5679139300190073, 'sideways_tsl_mult': 0.06838103315173706, 'sideways_time_stop': 234, 'sideways_use_sma': True, 'sideways_use_ema': True, 'sideways_use_atr': False, 'sideways_use_adx': True, 'sideways_use_spike': True, 'sideways_rsi_required': True}.
[I 2025-08-31 10:04:31,112] Trial 342 finished with values: [-1000000000.0, 1000000000.0] and parameters: {'p_sma': 47, 'p_std': 17, 'p_atr': 18, 'p_adx': 25, 'rsi_period': 63, 'ema1': 26, 'ema2': 34, 'slip_atr_k': 0.08565571821741103, 'slip_spread_k': 0.045822847040378756, 'spread_hl_frac': 0.014272926581177113, 'bb_std_mult': 1.0478408185430976, 'rsi_os': 24, 'rsi_ob': 85, 'vol_spike': 0.1363299786057331, 'adx_thresh': 17.10953309858955, 'atr_min_pct': 0.012269444751788768, 'atr_max_pct': 0.041441959728443785, 'tp_mult': 2.8502382768014987, 'tsl_mult': 0.5639641581684124, 'strategy': 'breakout', 'time_stop': 134, 'use_sma': False, 'use_atr': False, 'use_adx': False, 'use_ema': False, 'use_spike': False, 'rsi_required': True, 'edge_k': 1.8839231688457156, 'edge_cap': 0.14572380825177744, 'bull_strategy': 'mean_reversion', 'bull_bb_std_mult': 1.551265628164857, 'bull_rsi_os': 17, 'bull_rsi_ob': 83, 'bull_adx_thresh': 30.803762272673275, 'bull_atr_min_pct': 0.01986762740700505, 'bull_atr_max_pct': 0.071130540941527, 'bull_tp_mult': 2.918808024902063, 'bull_tsl_mult': 0.5885671236164199, 'bull_time_stop': 246, 'bull_use_sma': True, 'bull_use_ema': False, 'bull_use_atr': False, 'bull_use_adx': False, 'bull_use_spike': False, 'bull_rsi_required': True, 'bear_strategy': 'breakout', 'bear_bb_std_mult': 2.796327268685233, 'bear_rsi_os': 53, 'bear_rsi_ob': 48, 'bear_adx_thresh': 29.655945627323888, 'bear_atr_min_pct': 0.021105015051417018, 'bear_atr_max_pct': 0.1440917214603146, 'bear_tp_mult': 2.783227671850408, 'bear_tsl_mult': 0.5440120783287884, 'bear_time_stop': 169, 'bear_use_sma': False, 'bear_use_ema': True, 'bear_use_atr': False, 'bear_use_adx': True, 'bear_use_spike': False, 'bear_rsi_required': True, 'sideways_strategy': 'breakout', 'sideways_bb_std_mult': 1.0793427402368705, 'sideways_rsi_os': 26, 'sideways_rsi_ob': 66, 'sideways_adx_thresh': 32.29465331900684, 'sideways_atr_min_pct': 0.0019043608597062547, 'sideways_atr_max_pct': 0.028676536542772753, 'sideways_tp_mult': 2.6283111171537343, 'sideways_tsl_mult': 0.6872333753243925, 'sideways_time_stop': 219, 'sideways_use_sma': True, 'sideways_use_ema': True, 'sideways_use_atr': False, 'sideways_use_adx': False, 'sideways_use_spike': False, 'sideways_rsi_required': False}.
[I 2025-08-31 10:04:31,633] Trial 339 finished with values: [-1000000000.0, 1000000000.0] and parameters: {'p_sma': 36, 'p_std': 45, 'p_atr': 18, 'p_adx': 9, 'rsi_period': 62, 'ema1': 20, 'ema2': 34, 'slip_atr_k': 0.15786007814365627, 'slip_spread_k': 0.39103191396637077, 'spread_hl_frac': 0.02491993811113238, 'bb_std_mult': 1.050976519848608, 'rsi_os': 24, 'rsi_ob': 70, 'vol_spike': 0.14818935458620774, 'adx_thresh': 8.311671846672965, 'atr_min_pct': 0.0294821099680419, 'atr_max_pct': 0.13471223947431799, 'tp_mult': 2.904572182774278, 'tsl_mult': 0.19769636287315911, 'strategy': 'breakout', 'time_stop': 132, 'use_sma': False, 'use_atr': False, 'use_adx': False, 'use_ema': True, 'use_spike': False, 'rsi_required': True, 'edge_k': 0.29476310604646705, 'edge_cap': 0.9254868784998052, 'bull_strategy': 'mean_reversion', 'bull_bb_std_mult': 1.4591055206401011, 'bull_rsi_os': 36, 'bull_rsi_ob': 69, 'bull_adx_thresh': 20.045174973141883, 'bull_atr_min_pct': 0.01836925281832061, 'bull_atr_max_pct': 0.056312185355847706, 'bull_tp_mult': 2.915348291677404, 'bull_tsl_mult': 0.9591760142992237, 'bull_time_stop': 252, 'bull_use_sma': True, 'bull_use_ema': False, 'bull_use_atr': False, 'bull_use_adx': False, 'bull_use_spike': False, 'bull_rsi_required': True, 'bear_strategy': 'breakout', 'bear_bb_std_mult': 2.7863727964254497, 'bear_rsi_os': 55, 'bear_rsi_ob': 80, 'bear_adx_thresh': 30.67765062831521, 'bear_atr_min_pct': 0.011378884463732152, 'bear_atr_max_pct': 0.14400987856939215, 'bear_tp_mult': 2.2100351902709865, 'bear_tsl_mult': 0.546136313501423, 'bear_time_stop': 252, 'bear_use_sma': False, 'bear_use_ema': False, 'bear_use_atr': False, 'bear_use_adx': True, 'bear_use_spike': True, 'bear_rsi_required': True, 'sideways_strategy': 'breakout', 'sideways_bb_std_mult': 0.8495660096537325, 'sideways_rsi_os': 24, 'sideways_rsi_ob': 66, 'sideways_adx_thresh': 34.4483380921557, 'sideways_atr_min_pct': 0.015914253937099932, 'sideways_atr_max_pct': 0.0234947784363672, 'sideways_tp_mult': 1.5512031615900406, 'sideways_tsl_mult': 0.3028840556019222, 'sideways_time_stop': 228, 'sideways_use_sma': True, 'sideways_use_ema': True, 'sideways_use_atr': False, 'sideways_use_adx': False, 'sideways_use_spike': True, 'sideways_rsi_required': False}.
[I 2025-08-31 10:04:31,856] Trial 341 finished with values: [-1000000000.0, 1000000000.0] and parameters: {'p_sma': 47, 'p_std': 59, 'p_atr': 28, 'p_adx': 20, 'rsi_period': 28, 'ema1': 20, 'ema2': 40, 'slip_atr_k': 0.14320550935042392, 'slip_spread_k': 0.38940051186248925, 'spread_hl_frac': 0.04342935410681265, 'bb_std_mult': 1.0363101239952335, 'rsi_os': 24, 'rsi_ob': 85, 'vol_spike': 0.16228363716628572, 'adx_thresh': 19.696587981302265, 'atr_min_pct': 0.029603350054880663, 'atr_max_pct': 0.13565391209101746, 'tp_mult': 2.903352014751179, 'tsl_mult': 0.2904867088629626, 'strategy': 'breakout', 'time_stop': 133, 'use_sma': False, 'use_atr': False, 'use_adx': False, 'use_ema': False, 'use_spike': False, 'rsi_required': True, 'edge_k': 0.5999265536427982, 'edge_cap': 0.6352427675232193, 'bull_strategy': 'mean_reversion', 'bull_bb_std_mult': 1.460174431292954, 'bull_rsi_os': 9, 'bull_rsi_ob': 65, 'bull_adx_thresh': 30.77062842417126, 'bull_atr_min_pct': 0.02573139784657559, 'bull_atr_max_pct': 0.04931801011675245, 'bull_tp_mult': 1.4931379552667825, 'bull_tsl_mult': 0.572589999884658, 'bull_time_stop': 247, 'bull_use_sma': True, 'bull_use_ema': False, 'bull_use_atr': False, 'bull_use_adx': False, 'bull_use_spike': False, 'bull_rsi_required': True, 'bear_strategy': 'breakout', 'bear_bb_std_mult': 2.774314385471885, 'bear_rsi_os': 55, 'bear_rsi_ob': 78, 'bear_adx_thresh': 21.290594106125276, 'bear_atr_min_pct': 0.02106024331163652, 'bear_atr_max_pct': 0.14405280826774872, 'bear_tp_mult': 2.7468118013679157, 'bear_tsl_mult': 0.5450309006821982, 'bear_time_stop': 206, 'bear_use_sma': False, 'bear_use_ema': True, 'bear_use_atr': False, 'bear_use_adx': True, 'bear_use_spike': False, 'bear_rsi_required': True, 'sideways_strategy': 'breakout', 'sideways_bb_std_mult': 2.0056254591926015, 'sideways_rsi_os': 42, 'sideways_rsi_ob': 66, 'sideways_adx_thresh': 9.72051502837634, 'sideways_atr_min_pct': 0.004884616689050061, 'sideways_atr_max_pct': 0.029055867267846768, 'sideways_tp_mult': 1.5641828770874595, 'sideways_tsl_mult': 0.06318061450094277, 'sideways_time_stop': 170, 'sideways_use_sma': True, 'sideways_use_ema': True, 'sideways_use_atr': False, 'sideways_use_adx': False, 'sideways_use_spike': True, 'sideways_rsi_required': False}.
