[I 2025-08-31 10:14:58,804] Trial 442 finished with values: [-1000000000.0, 1000000000.0] and parameters: {'p_sma': 47, 'p_std': 36, 'p_atr': 30, 'p_adx': 9, 'rsi_period': 74, 'ema1': 28, 'ema2': 41, 'slip_atr_k': 0.14808602139720384, 'slip_spread_k': 0.4558471408122655, 'spread_hl_frac': 0.008373067505407405, 'bb_std_mult': 0.9426129533681639, 'rsi_os': 44, 'rsi_ob': 48, 'vol_spike': 0.13203350920201806, 'adx_thresh': 11.869004542499928, 'atr_min_pct': 0.007076267868831481, 'atr_max_pct': 0.12506894950687975, 'tp_mult': 2.252459878788998, 'tsl_mult': 0.05118960787791704, 'strategy': 'mean_reversion', 'time_stop': 144, 'use_sma': False, 'use_atr': False, 'use_adx': True, 'use_ema': True, 'use_spike': False, 'rsi_required': False, 'edge_k': 1.8087840082074094, 'edge_cap': 0.34837851982500134, 'bull_strategy': 'mean_reversion', 'bull_bb_std_mult': 2.1318799952906513, 'bull_rsi_os': 19, 'bull_rsi_ob': 60, 'bull_adx_thresh': 24.04584723171093, 'bull_atr_min_pct': 0.0013522448185958862, 'bull_atr_max_pct': 0.09914234896070559, 'bull_tp_mult': 1.4943578780508606, 'bull_tsl_mult': 0.7221543914522054, 'bull_time_stop': 271, 'bull_use_sma': False, 'bull_use_ema': True, 'bull_use_atr': True, 'bull_use_adx': False, 'bull_use_spike': True, 'bull_rsi_required': False, 'bear_strategy': 'mean_reversion', 'bear_bb_std_mult': 1.645584262656742, 'bear_rsi_os': 30, 'bear_rsi_ob': 68, 'bear_adx_thresh': 18.191067143827524, 'bear_atr_min_pct': 0.021594107616344792, 'bear_atr_max_pct': 0.0662228993419064, 'bear_tp_mult': 2.319186707899225, 'bear_tsl_mult': 0.08913511741946212, 'bear_time_stop': 115, 'bear_use_sma': True, 'bear_use_ema': False, 'bear_use_atr': True, 'bear_use_adx': True, 'bear_use_spike': False, 'bear_rsi_required': True, 'sideways_strategy': 'breakout', 'sideways_bb_std_mult': 1.806577163642897, 'sideways_rsi_os': 24, 'sideways_rsi_ob': 77, 'sideways_adx_thresh': 32.24495990763756, 'sideways_atr_min_pct': 0.0016744297745086107, 'sideways_atr_max_pct': 0.024240582339274192, 'sideways_tp_mult': 2.63074779614655, 'sideways_tsl_mult': 0.0750097552806252, 'sideways_time_stop': 278, 'sideways_use_sma': False, 'sideways_use_ema': False, 'sideways_use_atr': True, 'sideways_use_adx': False, 'sideways_use_spike': True, 'sideways_rsi_required': False}.
[I 2025-08-31 10:15:18,298] Trial 440 finished with values: [-1000000000.0, 1000000000.0] and parameters: {'p_sma': 36, 'p_std': 13, 'p_atr': 30, 'p_adx': 30, 'rsi_period': 75, 'ema1': 20, 'ema2': 40, 'slip_atr_k': 0.14880901566445778, 'slip_spread_k': 0.35095769774154384, 'spread_hl_frac': 0.0221665763732687, 'bb_std_mult': 0.8162544500978159, 'rsi_os': 25, 'rsi_ob': 69, 'vol_spike': 0.12202411457096576, 'adx_thresh': 12.171104551217216, 'atr_min_pct': 0.01114450365288349, 'atr_max_pct': 0.1250323563128674, 'tp_mult': 2.7782616805013673, 'tsl_mult': 0.0009747250644953819, 'strategy': 'mean_reversion', 'time_stop': 146, 'use_sma': False, 'use_atr': False, 'use_adx': True, 'use_ema': True, 'use_spike': False, 'rsi_required': True, 'edge_k': 1.8070714907860705, 'edge_cap': 0.12452194182979358, 'bull_strategy': 'mean_reversion', 'bull_bb_std_mult': 1.4895395284200323, 'bull_rsi_os': 27, 'bull_rsi_ob': 68, 'bull_adx_thresh': 10.721499220835794, 'bull_atr_min_pct': 0.017946458611098295, 'bull_atr_max_pct': 0.06465032060128398, 'bull_tp_mult': 1.4058116911753595, 'bull_tsl_mult': 0.552860538165961, 'bull_time_stop': 271, 'bull_use_sma': True, 'bull_use_ema': False, 'bull_use_atr': True, 'bull_use_adx': False, 'bull_use_spike': False, 'bull_rsi_required': False, 'bear_strategy': 'breakout', 'bear_bb_std_mult': 1.6204724320217425, 'bear_rsi_os': 19, 'bear_rsi_ob': 79, 'bear_adx_thresh': 21.312058258303544, 'bear_atr_min_pct': 0.01668877400028879, 'bear_atr_max_pct': 0.13879148511116143, 'bear_tp_mult': 2.2818322688677988, 'bear_tsl_mult': 0.07601256488045455, 'bear_time_stop': 155, 'bear_use_sma': True, 'bear_use_ema': False, 'bear_use_atr': False, 'bear_use_adx': True, 'bear_use_spike': False, 'bear_rsi_required': True, 'sideways_strategy': 'breakout', 'sideways_bb_std_mult': 1.3363172556039329, 'sideways_rsi_os': 24, 'sideways_rsi_ob': 46, 'sideways_adx_thresh': 32.98610292171731, 'sideways_atr_min_pct': 0.025612299038166662, 'sideways_atr_max_pct': 0.1378786667484434, 'sideways_tp_mult': 1.4967014355430175, 'sideways_tsl_mult': 0.7473869233106663, 'sideways_time_stop': 230, 'sideways_use_sma': True, 'sideways_use_ema': False, 'sideways_use_atr': False, 'sideways_use_adx': False, 'sideways_use_spike': True, 'sideways_rsi_required': False}.
[I 2025-08-31 10:15:24,718] Trial 443 finished with values: [-1000000000.0, 1000000000.0] and parameters: {'p_sma': 52, 'p_std': 11, 'p_atr': 30, 'p_adx': 9, 'rsi_period': 44, 'ema1': 28, 'ema2': 40, 'slip_atr_k': 0.14927957269379438, 'slip_spread_k': 0.40122417678238725, 'spread_hl_frac': 0.013566886561551954, 'bb_std_mult': 0.9469766429633872, 'rsi_os': 35, 'rsi_ob': 47, 'vol_spike': 0.13089867066774583, 'adx_thresh': 11.434393888919704, 'atr_min_pct': 0.011329538685481281, 'atr_max_pct': 0.1251788571978347, 'tp_mult': 1.4265824555529418, 'tsl_mult': 0.4478847147616745, 'strategy': 'breakout', 'time_stop': 92, 'use_sma': False, 'use_atr': False, 'use_adx': False, 'use_ema': True, 'use_spike': False, 'rsi_required': False, 'edge_k': 1.814388295582863, 'edge_cap': 0.3523369984351107, 'bull_strategy': 'mean_reversion', 'bull_bb_std_mult': 1.4988762404597433, 'bull_rsi_os': 27, 'bull_rsi_ob': 67, 'bull_adx_thresh': 24.42890517392002, 'bull_atr_min_pct': 0.010475688995229578, 'bull_atr_max_pct': 0.014430178585920453, 'bull_tp_mult': 1.4931307133399652, 'bull_tsl_mult': 0.8639820822671946, 'bull_time_stop': 252, 'bull_use_sma': False, 'bull_use_ema': True, 'bull_use_atr': False, 'bull_use_adx': True, 'bull_use_spike': True, 'bull_rsi_required': False, 'bear_strategy': 'mean_reversion', 'bear_bb_std_mult': 1.6344571334140328, 'bear_rsi_os': 19, 'bear_rsi_ob': 79, 'bear_adx_thresh': 11.782165932930688, 'bear_atr_min_pct': 0.021653934659428387, 'bear_atr_max_pct': 0.13781544686459019, 'bear_tp_mult': 2.6958718676919275, 'bear_tsl_mult': 0.02025774548357473, 'bear_time_stop': 60, 'bear_use_sma': True, 'bear_use_ema': False, 'bear_use_atr': True, 'bear_use_adx': True, 'bear_use_spike': False, 'bear_rsi_required': True, 'sideways_strategy': 'breakout', 'sideways_bb_std_mult': 2.7099457579412665, 'sideways_rsi_os': 17, 'sideways_rsi_ob': 57, 'sideways_adx_thresh': 34.05478576761948, 'sideways_atr_min_pct': 0.0018143981014422514, 'sideways_atr_max_pct': 0.13858358674888696, 'sideways_tp_mult': 2.4639338580020467, 'sideways_tsl_mult': 0.07580321933624456, 'sideways_time_stop': 248, 'sideways_use_sma': False, 'sideways_use_ema': False, 'sideways_use_atr': True, 'sideways_use_adx': True, 'sideways_use_spike': False, 'sideways_rsi_required': False}.
[I 2025-08-31 10:15:25,265] Trial 444 finished with values: [-1000000000.0, 1000000000.0] and parameters: {'p_sma': 6, 'p_std': 15, 'p_atr': 30, 'p_adx': 8, 'rsi_period': 28, 'ema1': 10, 'ema2': 36, 'slip_atr_k': 0.1407421273750074, 'slip_spread_k': 0.0050251502427848815, 'spread_hl_frac': 0.013936808735112426, 'bb_std_mult': 1.2375079365969195, 'rsi_os': 38, 'rsi_ob': 48, 'vol_spike': 0.0002685762783241896, 'adx_thresh': 7.235109193788272, 'atr_min_pct': 0.01090996178290973, 'atr_max_pct': 0.04816725715750348, 'tp_mult': 2.923617207976274, 'tsl_mult': 0.060264941725293134, 'strategy': 'breakout', 'time_stop': 204, 'use_sma': False, 'use_atr': False, 'use_adx': False, 'use_ema': True, 'use_spike': False, 'rsi_required': False, 'edge_k': 1.0031569051744937, 'edge_cap': 0.5727808980865763, 'bull_strategy': 'mean_reversion', 'bull_bb_std_mult': 2.3240955295104326, 'bull_rsi_os': 35, 'bull_rsi_ob': 89, 'bull_adx_thresh': 25.58851320471966, 'bull_atr_min_pct': 0.004852517398986558, 'bull_atr_max_pct': 0.11455296924454617, 'bull_tp_mult': 1.492679831923884, 'bull_tsl_mult': 0.5883638060285573, 'bull_time_stop': 253, 'bull_use_sma': False, 'bull_use_ema': False, 'bull_use_atr': False, 'bull_use_adx': True, 'bull_use_spike': True, 'bull_rsi_required': False, 'bear_strategy': 'mean_reversion', 'bear_bb_std_mult': 1.18269330568964, 'bear_rsi_os': 19, 'bear_rsi_ob': 79, 'bear_adx_thresh': 30.138403515523457, 'bear_atr_min_pct': 0.02152347206261052, 'bear_atr_max_pct': 0.09498651222874846, 'bear_tp_mult': 2.5462277562645035, 'bear_tsl_mult': 0.5503630436631427, 'bear_time_stop': 235, 'bear_use_sma': True, 'bear_use_ema': False, 'bear_use_atr': False, 'bear_use_adx': True, 'bear_use_spike': False, 'bear_rsi_required': True, 'sideways_strategy': 'breakout', 'sideways_bb_std_mult': 3.346332356098966, 'sideways_rsi_os': 11, 'sideways_rsi_ob': 72, 'sideways_adx_thresh': 34.31694276682592, 'sideways_atr_min_pct': 0.00684815413155908, 'sideways_atr_max_pct': 0.023360260715699042, 'sideways_tp_mult': 1.8771097310032987, 'sideways_tsl_mult': 0.7526334897824425, 'sideways_time_stop': 159, 'sideways_use_sma': True, 'sideways_use_ema': False, 'sideways_use_atr': True, 'sideways_use_adx': True, 'sideways_use_spike': False, 'sideways_rsi_required': False}.
[I 2025-08-31 10:15:29,998] Trial 446 finished with values: [-1000000000.0, 1000000000.0] and parameters: {'p_sma': 19, 'p_std': 10, 'p_atr': 27, 'p_adx': 24, 'rsi_period': 44, 'ema1': 21, 'ema2': 22, 'slip_atr_k': 0.1751219237786949, 'slip_spread_k': 0.39986654801413524, 'spread_hl_frac': 0.014088254823889207, 'bb_std_mult': 1.2357431049254157, 'rsi_os': 17, 'rsi_ob': 46, 'vol_spike': 0.06842363950524871, 'adx_thresh': 7.180055932694483, 'atr_min_pct': 0.019198305035014962, 'atr_max_pct': 0.018718075501346167, 'tp_mult': 1.596635805915004, 'tsl_mult': 0.3346577885330012, 'strategy': 'breakout', 'time_stop': 139, 'use_sma': False, 'use_atr': False, 'use_adx': False, 'use_ema': False, 'use_spike': False, 'rsi_required': True, 'edge_k': 1.8673777716690214, 'edge_cap': 0.5806483578847874, 'bull_strategy': 'mean_reversion', 'bull_bb_std_mult': 1.7940358340009717, 'bull_rsi_os': 34, 'bull_rsi_ob': 65, 'bull_adx_thresh': 33.113697937111375, 'bull_atr_min_pct': 0.010374898244092948, 'bull_atr_max_pct': 0.02518025384606725, 'bull_tp_mult': 1.5287980996108332, 'bull_tsl_mult': 0.5891223736676702, 'bull_time_stop': 254, 'bull_use_sma': False, 'bull_use_ema': False, 'bull_use_atr': False, 'bull_use_adx': True, 'bull_use_spike': True, 'bull_rsi_required': True, 'bear_strategy': 'mean_reversion', 'bear_bb_std_mult': 2.9086558826154905, 'bear_rsi_os': 13, 'bear_rsi_ob': 52, 'bear_adx_thresh': 13.655531917930778, 'bear_atr_min_pct': 0.008541980851515966, 'bear_atr_max_pct': 0.08483732363542598, 'bear_tp_mult': 1.6503027916990463, 'bear_tsl_mult': 0.5120288668430385, 'bear_time_stop': 237, 'bear_use_sma': False, 'bear_use_ema': True, 'bear_use_atr': False, 'bear_use_adx': True, 'bear_use_spike': False, 'bear_rsi_required': True, 'sideways_strategy': 'breakout', 'sideways_bb_std_mult': 2.685271351039635, 'sideways_rsi_os': 49, 'sideways_rsi_ob': 64, 'sideways_adx_thresh': 7.438049329345668, 'sideways_atr_min_pct': 0.0006806236392158983, 'sideways_atr_max_pct': 0.02628215507517276, 'sideways_tp_mult': 1.8740189445089293, 'sideways_tsl_mult': 0.08368138018995078, 'sideways_time_stop': 244, 'sideways_use_sma': True, 'sideways_use_ema': True, 'sideways_use_atr': True, 'sideways_use_adx': True, 'sideways_use_spike': False, 'sideways_rsi_required': False}.
[I 2025-08-31 10:15:30,461] Trial 445 finished with values: [-1000000000.0, 1000000000.0] and parameters: {'p_sma': 36, 'p_std': 15, 'p_atr': 30, 'p_adx': 30, 'rsi_period': 27, 'ema1': 10, 'ema2': 26, 'slip_atr_k': 0.17742195936705377, 'slip_spread_k': 0.39981054140857625, 'spread_hl_frac': 0.014059515650425949, 'bb_std_mult': 1.1039255119899942, 'rsi_os': 8, 'rsi_ob': 50, 'vol_spike': 0.19479404665938316, 'adx_thresh': 7.09992936733969, 'atr_min_pct': 0.011243672859972654, 'atr_max_pct': 0.13047902386725085, 'tp_mult': 2.9322301463466895, 'tsl_mult': 0.01643746126879381, 'strategy': 'breakout', 'time_stop': 203, 'use_sma': False, 'use_atr': False, 'use_adx': False, 'use_ema': False, 'use_spike': False, 'rsi_required': True, 'edge_k': 1.7499029218369166, 'edge_cap': 0.4800786332387468, 'bull_strategy': 'mean_reversion', 'bull_bb_std_mult': 1.4701138769234374, 'bull_rsi_os': 34, 'bull_rsi_ob': 89, 'bull_adx_thresh': 25.57021131267637, 'bull_atr_min_pct': 0.023666726090938495, 'bull_atr_max_pct': 0.0454254476136231, 'bull_tp_mult': 1.5201582383883476, 'bull_tsl_mult': 0.6216840644813794, 'bull_time_stop': 251, 'bull_use_sma': True, 'bull_use_ema': False, 'bull_use_atr': False, 'bull_use_adx': True, 'bull_use_spike': False, 'bull_rsi_required': True, 'bear_strategy': 'breakout', 'bear_bb_std_mult': 1.402498533937322, 'bear_rsi_os': 54, 'bear_rsi_ob': 90, 'bear_adx_thresh': 5.798050569098473, 'bear_atr_min_pct': 0.019886586760587736, 'bear_atr_max_pct': 0.1378768200017777, 'bear_tp_mult': 2.7007286784711355, 'bear_tsl_mult': 0.24143179301597323, 'bear_time_stop': 37, 'bear_use_sma': False, 'bear_use_ema': True, 'bear_use_atr': False, 'bear_use_adx': True, 'bear_use_spike': False, 'bear_rsi_required': True, 'sideways_strategy': 'breakout', 'sideways_bb_std_mult': 1.325493182687923, 'sideways_rsi_os': 17, 'sideways_rsi_ob': 90, 'sideways_adx_thresh': 34.39297796194019, 'sideways_atr_min_pct': 0.0004174028841485997, 'sideways_atr_max_pct': 0.11689553480338451, 'sideways_tp_mult': 1.8732929422185796, 'sideways_tsl_mult': 0.8209393533958604, 'sideways_time_stop': 175, 'sideways_use_sma': True, 'sideways_use_ema': True, 'sideways_use_atr': False, 'sideways_use_adx': True, 'sideways_use_spike': False, 'sideways_rsi_required': False}.
[I 2025-08-31 10:15:59,313] Trial 447 finished with values: [-1000000000.0, 1000000000.0] and parameters: {'p_sma': 6, 'p_std': 15, 'p_atr': 14, 'p_adx': 8, 'rsi_period': 23, 'ema1': 29, 'ema2': 37, 'slip_atr_k': 0.13530118766477933, 'slip_spread_k': 0.9230977977786189, 'spread_hl_frac': 0.003671077715168815, 'bb_std_mult': 1.2254214245237702, 'rsi_os': 38, 'rsi_ob': 50, 'vol_spike': 0.19397093538407714, 'adx_thresh': 7.122186840400894, 'atr_min_pct': 0.0051822991520615105, 'atr_max_pct': 0.047888084166665346, 'tp_mult': 2.919414256922644, 'tsl_mult': 0.33861770180510536, 'strategy': 'breakout', 'time_stop': 131, 'use_sma': False, 'use_atr': False, 'use_adx': False, 'use_ema': False, 'use_spike': False, 'rsi_required': True, 'edge_k': 0.2537753061357314, 'edge_cap': 0.8410056462723019, 'bull_strategy': 'mean_reversion', 'bull_bb_std_mult': 1.2611067407950116, 'bull_rsi_os': 35, 'bull_rsi_ob': 89, 'bull_adx_thresh': 30.395677620499118, 'bull_atr_min_pct': 0.019093039769929557, 'bull_atr_max_pct': 0.043909046828993784, 'bull_tp_mult': 1.1424391077228377, 'bull_tsl_mult': 0.5889509692205281, 'bull_time_stop': 257, 'bull_use_sma': True, 'bull_use_ema': False, 'bull_use_atr': False, 'bull_use_adx': True, 'bull_use_spike': False, 'bull_rsi_required': True, 'bear_strategy': 'breakout', 'bear_bb_std_mult': 1.3848296379623717, 'bear_rsi_os': 53, 'bear_rsi_ob': 48, 'bear_adx_thresh': 22.019029399641184, 'bear_atr_min_pct': 0.029450000445609144, 'bear_atr_max_pct': 0.14775484344770137, 'bear_tp_mult': 2.539442065741059, 'bear_tsl_mult': 0.5129654197374818, 'bear_time_stop': 257, 'bear_use_sma': False, 'bear_use_ema': True, 'bear_use_atr': False, 'bear_use_adx': False, 'bear_use_spike': True, 'bear_rsi_required': True, 'sideways_strategy': 'breakout', 'sideways_bb_std_mult': 0.8207277062310454, 'sideways_rsi_os': 23, 'sideways_rsi_ob': 89, 'sideways_adx_thresh': 7.156643726416762, 'sideways_atr_min_pct': 0.00040565863166025723, 'sideways_atr_max_pct': 0.026086764438765838, 'sideways_tp_mult': 1.6989111795007659, 'sideways_tsl_mult': 0.40766523407485045, 'sideways_time_stop': 242, 'sideways_use_sma': True, 'sideways_use_ema': True, 'sideways_use_atr': False, 'sideways_use_adx': True, 'sideways_use_spike': False, 'sideways_rsi_required': False}.
[I 2025-08-31 10:16:00,480] Trial 448 finished with values: [-1000000000.0, 1000000000.0] and parameters: {'p_sma': 18, 'p_std': 50, 'p_atr': 28, 'p_adx': 10, 'rsi_period': 80, 'ema1': 14, 'ema2': 14, 'slip_atr_k': 0.1552866487368091, 'slip_spread_k': 0.9216660927144729, 'spread_hl_frac': 0.010698977845700596, 'bb_std_mult': 1.0712684657564593, 'rsi_os': 22, 'rsi_ob': 46, 'vol_spike': 0.01460559323904001, 'adx_thresh': 30.68335286042633, 'atr_min_pct': 0.010075755127084803, 'atr_max_pct': 0.13063157303530146, 'tp_mult': 2.8385875356202757, 'tsl_mult': 0.31586958371524043, 'strategy': 'breakout', 'time_stop': 293, 'use_sma': False, 'use_atr': False, 'use_adx': False, 'use_ema': False, 'use_spike': False, 'rsi_required': True, 'edge_k': 1.9493486526294588, 'edge_cap': 0.10656582790780289, 'bull_strategy': 'mean_reversion', 'bull_bb_std_mult': 1.2539390926944571, 'bull_rsi_os': 34, 'bull_rsi_ob': 71, 'bull_adx_thresh': 33.015187323185316, 'bull_atr_min_pct': 0.023622929202645727, 'bull_atr_max_pct': 0.02450097115152386, 'bull_tp_mult': 1.522638810375962, 'bull_tsl_mult': 0.6204709532142804, 'bull_time_stop': 247, 'bull_use_sma': True, 'bull_use_ema': False, 'bull_use_atr': False, 'bull_use_adx': False, 'bull_use_spike': False, 'bull_rsi_required': True, 'bear_strategy': 'breakout', 'bear_bb_std_mult': 2.905258741764364, 'bear_rsi_os': 42, 'bear_rsi_ob': 49, 'bear_adx_thresh': 14.03717512348419, 'bear_atr_min_pct': 0.02533982688315252, 'bear_atr_max_pct': 0.08565214739039223, 'bear_tp_mult': 1.6578767066337072, 'bear_tsl_mult': 0.5119834923191205, 'bear_time_stop': 260, 'bear_use_sma': False, 'bear_use_ema': True, 'bear_use_atr': False, 'bear_use_adx': False, 'bear_use_spike': True, 'bear_rsi_required': True, 'sideways_strategy': 'breakout', 'sideways_bb_std_mult': 2.826567290758739, 'sideways_rsi_os': 49, 'sideways_rsi_ob': 61, 'sideways_adx_thresh': 31.415349343065305, 'sideways_atr_min_pct': 0.0029527326847570094, 'sideways_atr_max_pct': 0.026065703663288822, 'sideways_tp_mult': 1.332789569518552, 'sideways_tsl_mult': 0.9865803291227226, 'sideways_time_stop': 102, 'sideways_use_sma': True, 'sideways_use_ema': True, 'sideways_use_atr': False, 'sideways_use_adx': False, 'sideways_use_spike': False, 'sideways_rsi_required': False}.
[I 2025-08-31 10:16:02,331] Trial 450 finished with values: [-1000000000.0, 1000000000.0] and parameters: {'p_sma': 40, 'p_std': 17, 'p_atr': 17, 'p_adx': 8, 'rsi_period': 23, 'ema1': 20, 'ema2': 37, 'slip_atr_k': 0.0360273297432869, 'slip_spread_k': 0.6365327874024087, 'spread_hl_frac': 0.010591554685215642, 'bb_std_mult': 1.0751780277226146, 'rsi_os': 31, 'rsi_ob': 86, 'vol_spike': 0.05645115638850476, 'adx_thresh': 9.191100288729105, 'atr_min_pct': 0.0025371098038218624, 'atr_max_pct': 0.13182598160682676, 'tp_mult': 2.698789794712301, 'tsl_mult': 0.08705543061557552, 'strategy': 'breakout', 'time_stop': 41, 'use_sma': True, 'use_atr': False, 'use_adx': False, 'use_ema': False, 'use_spike': False, 'rsi_required': True, 'edge_k': 1.2369385428823174, 'edge_cap': 0.4471092354373162, 'bull_strategy': 'breakout', 'bull_bb_std_mult': 3.278647274694478, 'bull_rsi_os': 32, 'bull_rsi_ob': 71, 'bull_adx_thresh': 30.291990442945917, 'bull_atr_min_pct': 0.027484680563429113, 'bull_atr_max_pct': 0.11755303327028707, 'bull_tp_mult': 2.312116297641808, 'bull_tsl_mult': 0.6153231475850781, 'bull_time_stop': 241, 'bull_use_sma': True, 'bull_use_ema': False, 'bull_use_atr': False, 'bull_use_adx': False, 'bull_use_spike': False, 'bull_rsi_required': True, 'bear_strategy': 'breakout', 'bear_bb_std_mult': 2.700450186900413, 'bear_rsi_os': 53, 'bear_rsi_ob': 77, 'bear_adx_thresh': 22.107170723683016, 'bear_atr_min_pct': 0.0052578519891254005, 'bear_atr_max_pct': 0.1469168350435252, 'bear_tp_mult': 2.7616344528406085, 'bear_tsl_mult': 0.5230301437681875, 'bear_time_stop': 258, 'bear_use_sma': False, 'bear_use_ema': True, 'bear_use_atr': False, 'bear_use_adx': False, 'bear_use_spike': True, 'bear_rsi_required': True, 'sideways_strategy': 'breakout', 'sideways_bb_std_mult': 1.071794628440927, 'sideways_rsi_os': 19, 'sideways_rsi_ob': 79, 'sideways_adx_thresh': 31.356816317503867, 'sideways_atr_min_pct': 0.023079377580843094, 'sideways_atr_max_pct': 0.029746222162066585, 'sideways_tp_mult': 1.7055837670894816, 'sideways_tsl_mult': 0.3248079223451157, 'sideways_time_stop': 75, 'sideways_use_sma': True, 'sideways_use_ema': True, 'sideways_use_atr': False, 'sideways_use_adx': False, 'sideways_use_spike': False, 'sideways_rsi_required': False}.
