[I 2025-08-31 10:46:49,100] Trial 674 finished with values: [-1000000000.0, 1000000000.0] and parameters: {'p_sma': 21, 'p_std': 43, 'p_atr': 7, 'p_adx': 9, 'rsi_period': 34, 'ema1': 8, 'ema2': 34, 'slip_atr_k': 0.2246601440749592, 'slip_spread_k': 0.5677451767568189, 'spread_hl_frac': 0.01181899375150898, 'bb_std_mult': 1.9096906791519996, 'rsi_os': 40, 'rsi_ob': 84, 'vol_spike': 0.10120195533066315, 'adx_thresh': 29.550289634150715, 'atr_min_pct': 0.003149580802141092, 'atr_max_pct': 0.1498843665402977, 'tp_mult': 1.5971509482311756, 'tsl_mult': 0.4914279757790109, 'strategy': 'breakout', 'time_stop': 120, 'use_sma': False, 'use_atr': False, 'use_adx': True, 'use_ema': True, 'use_spike': False, 'rsi_required': True, 'edge_k': 1.4810963901871106, 'edge_cap': 0.5748174594425234, 'bull_strategy': 'mean_reversion', 'bull_bb_std_mult': 2.0229763205410105, 'bull_rsi_os': 27, 'bull_rsi_ob': 64, 'bull_adx_thresh': 31.87738296397443, 'bull_atr_min_pct': 0.00732353050475883, 'bull_atr_max_pct': 0.016670493150082566, 'bull_tp_mult': 2.2457525691536357, 'bull_tsl_mult': 0.9013452473611454, 'bull_time_stop': 78, 'bull_use_sma': True, 'bull_use_ema': False, 'bull_use_atr': False, 'bull_use_adx': False, 'bull_use_spike': False, 'bull_rsi_required': True, 'bear_strategy': 'breakout', 'bear_bb_std_mult': 1.653987499922371, 'bear_rsi_os': 5, 'bear_rsi_ob': 85, 'bear_adx_thresh': 26.88189359053782, 'bear_atr_min_pct': 0.005997531453496698, 'bear_atr_max_pct': 0.10304707638181426, 'bear_tp_mult': 2.4483801213859198, 'bear_tsl_mult': 0.49509319108079797, 'bear_time_stop': 294, 'bear_use_sma': False, 'bear_use_ema': True, 'bear_use_atr': False, 'bear_use_adx': True, 'bear_use_spike': True, 'bear_rsi_required': True, 'sideways_strategy': 'breakout', 'sideways_bb_std_mult': 1.801757472426638, 'sideways_rsi_os': 25, 'sideways_rsi_ob': 45, 'sideways_adx_thresh': 20.201164991454192, 'sideways_atr_min_pct': 0.0021996485091457735, 'sideways_atr_max_pct': 0.10646074455635128, 'sideways_tp_mult': 2.7181051697076573, 'sideways_tsl_mult': 0.0457066712602537, 'sideways_time_stop': 230, 'sideways_use_sma': True, 'sideways_use_ema': True, 'sideways_use_atr': False, 'sideways_use_adx': False, 'sideways_use_spike': True, 'sideways_rsi_required': False}.
[I 2025-08-31 10:47:21,577] Trial 679 finished with values: [-0.0929025987496006, 0.09275341254937386] and parameters: {'p_sma': 33, 'p_std': 49, 'p_atr': 18, 'p_adx': 8, 'rsi_period': 23, 'ema1': 18, 'ema2': 55, 'slip_atr_k': 0.24460192622252025, 'slip_spread_k': 0.09863245838417217, 'spread_hl_frac': 0.009585756663553055, 'bb_std_mult': 3.0305772399722666, 'rsi_os': 42, 'rsi_ob': 62, 'vol_spike': 0.2895888675009113, 'adx_thresh': 23.459688121459898, 'atr_min_pct': 0.02074513504399393, 'atr_max_pct': 0.05506867606453518, 'tp_mult': 2.8858399217476265, 'tsl_mult': 0.9829339608154266, 'strategy': 'mean_reversion', 'time_stop': 61, 'use_sma': True, 'use_atr': True, 'use_adx': False, 'use_ema': True, 'use_spike': False, 'rsi_required': False, 'edge_k': 1.939133397051763, 'edge_cap': 0.16262689318074108, 'bull_strategy': 'breakout', 'bull_bb_std_mult': 3.145457898326188, 'bull_rsi_os': 19, 'bull_rsi_ob': 69, 'bull_adx_thresh': 20.815119691070183, 'bull_atr_min_pct': 0.013294792620063993, 'bull_atr_max_pct': 0.08204006919563966, 'bull_tp_mult': 2.3087775135863713, 'bull_tsl_mult': 0.7919793959685164, 'bull_time_stop': 284, 'bull_use_sma': False, 'bull_use_ema': False, 'bull_use_atr': True, 'bull_use_adx': False, 'bull_use_spike': True, 'bull_rsi_required': False, 'bear_strategy': 'mean_reversion', 'bear_bb_std_mult': 2.9460498876383996, 'bear_rsi_os': 9, 'bear_rsi_ob': 72, 'bear_adx_thresh': 20.59771361193132, 'bear_atr_min_pct': 0.00687430985541111, 'bear_atr_max_pct': 0.0905213654768214, 'bear_tp_mult': 2.147376351424615, 'bear_tsl_mult': 0.179441287859832, 'bear_time_stop': 174, 'bear_use_sma': True, 'bear_use_ema': False, 'bear_use_atr': False, 'bear_use_adx': False, 'bear_use_spike': True, 'bear_rsi_required': False, 'sideways_strategy': 'mean_reversion', 'sideways_bb_std_mult': 0.9992571208445918, 'sideways_rsi_os': 22, 'sideways_rsi_ob': 69, 'sideways_adx_thresh': 31.000453301193605, 'sideways_atr_min_pct': 0.0006343116602925164, 'sideways_atr_max_pct': 0.08072776655708212, 'sideways_tp_mult': 2.918217468927836, 'sideways_tsl_mult': 0.023071545369047083, 'sideways_time_stop': 287, 'sideways_use_sma': True, 'sideways_use_ema': False, 'sideways_use_atr': True, 'sideways_use_adx': True, 'sideways_use_spike': True, 'sideways_rsi_required': True}.
[I 2025-08-31 10:47:21,804] Trial 678 finished with values: [-1000000000.0, 1000000000.0] and parameters: {'p_sma': 16, 'p_std': 56, 'p_atr': 26, 'p_adx': 8, 'rsi_period': 71, 'ema1': 19, 'ema2': 23, 'slip_atr_k': 0.1871488108299012, 'slip_spread_k': 0.5679683041023356, 'spread_hl_frac': 0.028652894182727078, 'bb_std_mult': 1.0934473532683915, 'rsi_os': 40, 'rsi_ob': 92, 'vol_spike': 0.2930864291021225, 'adx_thresh': 26.307949849347573, 'atr_min_pct': 0.003311049726534003, 'atr_max_pct': 0.09988140108558953, 'tp_mult': 2.896583289088357, 'tsl_mult': 0.49135829573513473, 'strategy': 'mean_reversion', 'time_stop': 179, 'use_sma': True, 'use_atr': False, 'use_adx': False, 'use_ema': True, 'use_spike': False, 'rsi_required': False, 'edge_k': 1.9479567795987054, 'edge_cap': 0.16917910471822067, 'bull_strategy': 'breakout', 'bull_bb_std_mult': 2.359421383197187, 'bull_rsi_os': 25, 'bull_rsi_ob': 52, 'bull_adx_thresh': 23.511021917364392, 'bull_atr_min_pct': 0.0075213727013807635, 'bull_atr_max_pct': 0.08836279325643727, 'bull_tp_mult': 2.298055997580774, 'bull_tsl_mult': 0.715758869386329, 'bull_time_stop': 77, 'bull_use_sma': False, 'bull_use_ema': False, 'bull_use_atr': False, 'bull_use_adx': False, 'bull_use_spike': False, 'bull_rsi_required': True, 'bear_strategy': 'mean_reversion', 'bear_bb_std_mult': 2.515427857957476, 'bear_rsi_os': 30, 'bear_rsi_ob': 72, 'bear_adx_thresh': 20.288609475249714, 'bear_atr_min_pct': 0.006841281968152918, 'bear_atr_max_pct': 0.06053329785530941, 'bear_tp_mult': 1.9306691733683972, 'bear_tsl_mult': 0.6115213590169013, 'bear_time_stop': 40, 'bear_use_sma': True, 'bear_use_ema': False, 'bear_use_atr': False, 'bear_use_adx': False, 'bear_use_spike': True, 'bear_rsi_required': True, 'sideways_strategy': 'mean_reversion', 'sideways_bb_std_mult': 0.9963829302233226, 'sideways_rsi_os': 22, 'sideways_rsi_ob': 59, 'sideways_adx_thresh': 19.795346396111576, 'sideways_atr_min_pct': 0.002186164173258579, 'sideways_atr_max_pct': 0.10107890436658445, 'sideways_tp_mult': 2.923355965797667, 'sideways_tsl_mult': 0.0455242962856042, 'sideways_time_stop': 293, 'sideways_use_sma': True, 'sideways_use_ema': False, 'sideways_use_atr': False, 'sideways_use_adx': False, 'sideways_use_spike': True, 'sideways_rsi_required': True}.
[I 2025-08-31 10:47:21,804] Trial 677 finished with values: [-1000000000.0, 1000000000.0] and parameters: {'p_sma': 33, 'p_std': 42, 'p_atr': 18, 'p_adx': 8, 'rsi_period': 23, 'ema1': 23, 'ema2': 31, 'slip_atr_k': 0.18617680674350745, 'slip_spread_k': 0.5580460131492915, 'spread_hl_frac': 0.011363934122909852, 'bb_std_mult': 1.090544049074187, 'rsi_os': 11, 'rsi_ob': 84, 'vol_spike': 0.10676564968503753, 'adx_thresh': 26.268733080448108, 'atr_min_pct': 0.0030796521534935273, 'atr_max_pct': 0.12140267562020733, 'tp_mult': 2.8973527115817292, 'tsl_mult': 0.07285217191284608, 'strategy': 'mean_reversion', 'time_stop': 27, 'use_sma': False, 'use_atr': False, 'use_adx': False, 'use_ema': True, 'use_spike': False, 'rsi_required': True, 'edge_k': 1.9511775025129798, 'edge_cap': 0.3067647369277823, 'bull_strategy': 'mean_reversion', 'bull_bb_std_mult': 1.1786252390285679, 'bull_rsi_os': 53, 'bull_rsi_ob': 65, 'bull_adx_thresh': 22.561946956586453, 'bull_atr_min_pct': 0.0076526374886385275, 'bull_atr_max_pct': 0.08565237462511142, 'bull_tp_mult': 2.3092587573856584, 'bull_tsl_mult': 0.4896975774751948, 'bull_time_stop': 79, 'bull_use_sma': False, 'bull_use_ema': False, 'bull_use_atr': False, 'bull_use_adx': False, 'bull_use_spike': False, 'bull_rsi_required': True, 'bear_strategy': 'mean_reversion', 'bear_bb_std_mult': 0.8446002540493245, 'bear_rsi_os': 12, 'bear_rsi_ob': 81, 'bear_adx_thresh': 21.657568799569802, 'bear_atr_min_pct': 0.006217739974832151, 'bear_atr_max_pct': 0.06736200260207918, 'bear_tp_mult': 1.9321963557777286, 'bear_tsl_mult': 0.6075621255806798, 'bear_time_stop': 262, 'bear_use_sma': True, 'bear_use_ema': False, 'bear_use_atr': False, 'bear_use_adx': True, 'bear_use_spike': True, 'bear_rsi_required': True, 'sideways_strategy': 'breakout', 'sideways_bb_std_mult': 1.000149412636207, 'sideways_rsi_os': 24, 'sideways_rsi_ob': 45, 'sideways_adx_thresh': 9.13141338476638, 'sideways_atr_min_pct': 0.002391254076048348, 'sideways_atr_max_pct': 0.10088487088767188, 'sideways_tp_mult': 2.8519401935725486, 'sideways_tsl_mult': 0.04730950819285165, 'sideways_time_stop': 20, 'sideways_use_sma': True, 'sideways_use_ema': True, 'sideways_use_atr': False, 'sideways_use_adx': False, 'sideways_use_spike': True, 'sideways_rsi_required': False}.
[I 2025-08-31 10:47:21,938] Trial 676 finished with values: [-1000000000.0, 1000000000.0] and parameters: {'p_sma': 16, 'p_std': 8, 'p_atr': 18, 'p_adx': 8, 'rsi_period': 52, 'ema1': 23, 'ema2': 35, 'slip_atr_k': 0.1864545347190804, 'slip_spread_k': 0.7243573880818251, 'spread_hl_frac': 0.03785825112676135, 'bb_std_mult': 1.1452783774971702, 'rsi_os': 46, 'rsi_ob': 72, 'vol_spike': 0.10510147093276148, 'adx_thresh': 23.58610815193914, 'atr_min_pct': 0.002217872700056401, 'atr_max_pct': 0.12185583742729625, 'tp_mult': 2.90591193794118, 'tsl_mult': 0.31936961243671524, 'strategy': 'mean_reversion', 'time_stop': 62, 'use_sma': False, 'use_atr': False, 'use_adx': False, 'use_ema': True, 'use_spike': False, 'rsi_required': True, 'edge_k': 1.9474373191089231, 'edge_cap': 0.16277065384601438, 'bull_strategy': 'mean_reversion', 'bull_bb_std_mult': 1.1419226561406448, 'bull_rsi_os': 24, 'bull_rsi_ob': 65, 'bull_adx_thresh': 31.75412681482667, 'bull_atr_min_pct': 0.00792108071907726, 'bull_atr_max_pct': 0.08666084340360727, 'bull_tp_mult': 1.7588061454165826, 'bull_tsl_mult': 0.8004552664968945, 'bull_time_stop': 78, 'bull_use_sma': False, 'bull_use_ema': False, 'bull_use_atr': False, 'bull_use_adx': False, 'bull_use_spike': False, 'bull_rsi_required': True, 'bear_strategy': 'mean_reversion', 'bear_bb_std_mult': 2.5144020264862426, 'bear_rsi_os': 12, 'bear_rsi_ob': 81, 'bear_adx_thresh': 26.903250788187485, 'bear_atr_min_pct': 0.006227261065226055, 'bear_atr_max_pct': 0.0648979451319155, 'bear_tp_mult': 2.29785123645798, 'bear_tsl_mult': 0.4595485708886562, 'bear_time_stop': 262, 'bear_use_sma': True, 'bear_use_ema': False, 'bear_use_atr': False, 'bear_use_adx': True, 'bear_use_spike': True, 'bear_rsi_required': True, 'sideways_strategy': 'breakout', 'sideways_bb_std_mult': 1.897361190525197, 'sideways_rsi_os': 24, 'sideways_rsi_ob': 69, 'sideways_adx_thresh': 31.257933191297038, 'sideways_atr_min_pct': 0.0022408376784081602, 'sideways_atr_max_pct': 0.0653676657653514, 'sideways_tp_mult': 2.8586274447338567, 'sideways_tsl_mult': 0.8878156245020696, 'sideways_time_stop': 20, 'sideways_use_sma': True, 'sideways_use_ema': True, 'sideways_use_atr': False, 'sideways_use_adx': False, 'sideways_use_spike': True, 'sideways_rsi_required': False}.
[I 2025-08-31 10:47:55,170] Trial 681 finished with values: [-1000000000.0, 1000000000.0] and parameters: {'p_sma': 11, 'p_std': 23, 'p_atr': 28, 'p_adx': 10, 'rsi_period': 75, 'ema1': 18, 'ema2': 36, 'slip_atr_k': 0.09007012170776052, 'slip_spread_k': 0.0723639229752616, 'spread_hl_frac': 0.03804349801515582, 'bb_std_mult': 2.6946559632373077, 'rsi_os': 39, 'rsi_ob': 81, 'vol_spike': 0.18931207178774145, 'adx_thresh': 33.595212187733075, 'atr_min_pct': 0.0020423999901879528, 'atr_max_pct': 0.11240656553931794, 'tp_mult': 1.1241857651183296, 'tsl_mult': 0.5379530579094627, 'strategy': 'breakout', 'time_stop': 271, 'use_sma': False, 'use_atr': True, 'use_adx': False, 'use_ema': True, 'use_spike': True, 'rsi_required': True, 'edge_k': 1.887510128833496, 'edge_cap': 0.0658357625386189, 'bull_strategy': 'mean_reversion', 'bull_bb_std_mult': 1.3036295604665709, 'bull_rsi_os': 23, 'bull_rsi_ob': 67, 'bull_adx_thresh': 30.756070032116234, 'bull_atr_min_pct': 0.008012264442187542, 'bull_atr_max_pct': 0.08787301299693702, 'bull_tp_mult': 2.1772157961530856, 'bull_tsl_mult': 0.35036774816921623, 'bull_time_stop': 46, 'bull_use_sma': True, 'bull_use_ema': False, 'bull_use_atr': False, 'bull_use_adx': False, 'bull_use_spike': False, 'bull_rsi_required': False, 'bear_strategy': 'breakout', 'bear_bb_std_mult': 3.033631267065945, 'bear_rsi_os': 44, 'bear_rsi_ob': 79, 'bear_adx_thresh': 9.709708915210307, 'bear_atr_min_pct': 0.008867354249238896, 'bear_atr_max_pct': 0.10915221977057361, 'bear_tp_mult': 2.027396223759508, 'bear_tsl_mult': 0.46810753662601295, 'bear_time_stop': 118, 'bear_use_sma': False, 'bear_use_ema': True, 'bear_use_atr': True, 'bear_use_adx': True, 'bear_use_spike': True, 'bear_rsi_required': False, 'sideways_strategy': 'breakout', 'sideways_bb_std_mult': 0.9071890025799023, 'sideways_rsi_os': 24, 'sideways_rsi_ob': 87, 'sideways_adx_thresh': 29.722548507790048, 'sideways_atr_min_pct': 0.0015725875657720129, 'sideways_atr_max_pct': 0.10833154243008455, 'sideways_tp_mult': 2.8895021797920535, 'sideways_tsl_mult': 0.22017135710916824, 'sideways_time_stop': 237, 'sideways_use_sma': False, 'sideways_use_ema': True, 'sideways_use_atr': False, 'sideways_use_adx': False, 'sideways_use_spike': True, 'sideways_rsi_required': False}.
[I 2025-08-31 10:47:55,395] Trial 682 finished with values: [-1000000000.0, 1000000000.0] and parameters: {'p_sma': 28, 'p_std': 47, 'p_atr': 28, 'p_adx': 11, 'rsi_period': 26, 'ema1': 18, 'ema2': 38, 'slip_atr_k': 0.18082811181794065, 'slip_spread_k': 0.6803188265735783, 'spread_hl_frac': 0.008728042990369864, 'bb_std_mult': 1.1835553776352539, 'rsi_os': 51, 'rsi_ob': 86, 'vol_spike': 0.07382424551560322, 'adx_thresh': 21.293012577115928, 'atr_min_pct': 0.0021157680834300308, 'atr_max_pct': 0.11194842754754628, 'tp_mult': 2.964119112674946, 'tsl_mult': 0.3742914618141025, 'strategy': 'breakout', 'time_stop': 267, 'use_sma': False, 'use_atr': True, 'use_adx': False, 'use_ema': True, 'use_spike': True, 'rsi_required': True, 'edge_k': 0.7371548825393419, 'edge_cap': 0.9181300178409955, 'bull_strategy': 'mean_reversion', 'bull_bb_std_mult': 0.5045219709188715, 'bull_rsi_os': 25, 'bull_rsi_ob': 67, 'bull_adx_thresh': 32.569066415822185, 'bull_atr_min_pct': 0.006698673946298004, 'bull_atr_max_pct': 0.0806867381479472, 'bull_tp_mult': 1.7454674649816897, 'bull_tsl_mult': 0.9363561761231172, 'bull_time_stop': 5, 'bull_use_sma': True, 'bull_use_ema': False, 'bull_use_atr': False, 'bull_use_adx': False, 'bull_use_spike': False, 'bull_rsi_required': False, 'bear_strategy': 'breakout', 'bear_bb_std_mult': 3.033918078707632, 'bear_rsi_os': 27, 'bear_rsi_ob': 79, 'bear_adx_thresh': 22.391323540996495, 'bear_atr_min_pct': 0.008937503380655895, 'bear_atr_max_pct': 0.10812347730089512, 'bear_tp_mult': 2.3160118338565043, 'bear_tsl_mult': 0.45819433370121737, 'bear_time_stop': 148, 'bear_use_sma': False, 'bear_use_ema': True, 'bear_use_atr': True, 'bear_use_adx': True, 'bear_use_spike': True, 'bear_rsi_required': False, 'sideways_strategy': 'breakout', 'sideways_bb_std_mult': 2.4072720482688754, 'sideways_rsi_os': 24, 'sideways_rsi_ob': 95, 'sideways_adx_thresh': 27.54856342710977, 'sideways_atr_min_pct': 0.0014574474540216737, 'sideways_atr_max_pct': 0.10878370658400222, 'sideways_tp_mult': 2.8748493246097966, 'sideways_tsl_mult': 0.23421184510352389, 'sideways_time_stop': 238, 'sideways_use_sma': False, 'sideways_use_ema': True, 'sideways_use_atr': False, 'sideways_use_adx': False, 'sideways_use_spike': True, 'sideways_rsi_required': False}.
[I 2025-08-31 10:47:55,523] Trial 683 finished with values: [-0.01248869900402405, 0.012774081991624286] and parameters: {'p_sma': 11, 'p_std': 33, 'p_atr': 28, 'p_adx': 9, 'rsi_period': 25, 'ema1': 18, 'ema2': 42, 'slip_atr_k': 0.03431448739907332, 'slip_spread_k': 0.07503359006315136, 'spread_hl_frac': 0.0019080314537212248, 'bb_std_mult': 1.2010275945951596, 'rsi_os': 39, 'rsi_ob': 81, 'vol_spike': 0.08796359426172447, 'adx_thresh': 24.106025456191457, 'atr_min_pct': 0.01099824907829461, 'atr_max_pct': 0.11380185789921539, 'tp_mult': 1.7399888001346129, 'tsl_mult': 0.10889261647327914, 'strategy': 'breakout', 'time_stop': 223, 'use_sma': False, 'use_atr': True, 'use_adx': False, 'use_ema': True, 'use_spike': True, 'rsi_required': True, 'edge_k': 1.8863291337053125, 'edge_cap': 0.7736421544621424, 'bull_strategy': 'mean_reversion', 'bull_bb_std_mult': 0.6952568883976584, 'bull_rsi_os': 44, 'bull_rsi_ob': 67, 'bull_adx_thresh': 15.820465364638277, 'bull_atr_min_pct': 0.006677222605765711, 'bull_atr_max_pct': 0.08135756467459054, 'bull_tp_mult': 2.2042531179812346, 'bull_tsl_mult': 0.9485104993399511, 'bull_time_stop': 159, 'bull_use_sma': True, 'bull_use_ema': False, 'bull_use_atr': True, 'bull_use_adx': False, 'bull_use_spike': True, 'bull_rsi_required': False, 'bear_strategy': 'breakout', 'bear_bb_std_mult': 3.0411663600332215, 'bear_rsi_os': 45, 'bear_rsi_ob': 79, 'bear_adx_thresh': 29.050464700004255, 'bear_atr_min_pct': 0.008727662805273671, 'bear_atr_max_pct': 0.10677821220288145, 'bear_tp_mult': 2.202512077805181, 'bear_tsl_mult': 0.4463225280308932, 'bear_time_stop': 183, 'bear_use_sma': False, 'bear_use_ema': True, 'bear_use_atr': True, 'bear_use_adx': True, 'bear_use_spike': True, 'bear_rsi_required': False, 'sideways_strategy': 'breakout', 'sideways_bb_std_mult': 0.6814680093444971, 'sideways_rsi_os': 26, 'sideways_rsi_ob': 95, 'sideways_adx_thresh': 7.5618644935301464, 'sideways_atr_min_pct': 9.243093462504588e-06, 'sideways_atr_max_pct': 0.11453225932821452, 'sideways_tp_mult': 2.9083175698040065, 'sideways_tsl_mult': 0.23304555581356373, 'sideways_time_stop': 236, 'sideways_use_sma': False, 'sideways_use_ema': True, 'sideways_use_atr': True, 'sideways_use_adx': True, 'sideways_use_spike': True, 'sideways_rsi_required': False}.
[I 2025-08-31 10:47:55,706] Trial 680 finished with values: [-1000000000.0, 1000000000.0] and parameters: {'p_sma': 8, 'p_std': 8, 'p_atr': 28, 'p_adx': 11, 'rsi_period': 26, 'ema1': 23, 'ema2': 28, 'slip_atr_k': 0.1876028285670504, 'slip_spread_k': 0.053553542531973634, 'spread_hl_frac': 0.0005594966893956721, 'bb_std_mult': 1.0877608482525156, 'rsi_os': 33, 'rsi_ob': 54, 'vol_spike': 0.29403419154496113, 'adx_thresh': 26.330188675873, 'atr_min_pct': 0.010941158886114537, 'atr_max_pct': 0.1210463554913032, 'tp_mult': 1.3901306950449301, 'tsl_mult': 0.041342325235201, 'strategy': 'breakout', 'time_stop': 128, 'use_sma': False, 'use_atr': False, 'use_adx': False, 'use_ema': True, 'use_spike': True, 'rsi_required': True, 'edge_k': 0.7315001792235791, 'edge_cap': 0.7812842512413265, 'bull_strategy': 'mean_reversion', 'bull_bb_std_mult': 1.1405077860570025, 'bull_rsi_os': 23, 'bull_rsi_ob': 67, 'bull_adx_thresh': 23.453764780703153, 'bull_atr_min_pct': 0.007831365844818932, 'bull_atr_max_pct': 0.08872432178455501, 'bull_tp_mult': 2.197890895157419, 'bull_tsl_mult': 0.4931242830185887, 'bull_time_stop': 51, 'bull_use_sma': False, 'bull_use_ema': False, 'bull_use_atr': False, 'bull_use_adx': False, 'bull_use_spike': False, 'bull_rsi_required': True, 'bear_strategy': 'mean_reversion', 'bear_bb_std_mult': 3.0392699092782998, 'bear_rsi_os': 31, 'bear_rsi_ob': 79, 'bear_adx_thresh': 21.825882919509038, 'bear_atr_min_pct': 0.02460386952814659, 'bear_atr_max_pct': 0.10826662986728633, 'bear_tp_mult': 1.328238950596175, 'bear_tsl_mult': 0.46390609096834645, 'bear_time_stop': 262, 'bear_use_sma': False, 'bear_use_ema': False, 'bear_use_atr': True, 'bear_use_adx': True, 'bear_use_spike': True, 'bear_rsi_required': True, 'sideways_strategy': 'breakout', 'sideways_bb_std_mult': 0.6732948710482962, 'sideways_rsi_os': 24, 'sideways_rsi_ob': 95, 'sideways_adx_thresh': 29.639984659908254, 'sideways_atr_min_pct': 0.0022276262042186094, 'sideways_atr_max_pct': 0.06506431267746343, 'sideways_tp_mult': 2.9034827670141663, 'sideways_tsl_mult': 0.12589521118983105, 'sideways_time_stop': 153, 'sideways_use_sma': False, 'sideways_use_ema': True, 'sideways_use_atr': False, 'sideways_use_adx': False, 'sideways_use_spike': True, 'sideways_rsi_required': False}.
