[I 2025-08-31 11:10:21,239] Trial 844 finished with values: [-1000000000.0, 1000000000.0] and parameters: {'p_sma': 5, 'p_std': 46, 'p_atr': 30, 'p_adx': 19, 'rsi_period': 21, 'ema1': 18, 'ema2': 53, 'slip_atr_k': 0.17596955540864456, 'slip_spread_k': 0.26558221614013733, 'spread_hl_frac': 0.02536842548267014, 'bb_std_mult': 1.885114953993585, 'rsi_os': 34, 'rsi_ob': 84, 'vol_spike': 0.2896707895954309, 'adx_thresh': 22.623062126522864, 'atr_min_pct': 0.017839170741592997, 'atr_max_pct': 0.1288494076121918, 'tp_mult': 2.9609180634452597, 'tsl_mult': 0.09214157351092017, 'strategy': 'breakout', 'time_stop': 139, 'use_sma': False, 'use_atr': False, 'use_adx': False, 'use_ema': True, 'use_spike': False, 'rsi_required': False, 'edge_k': 0.644589574137721, 'edge_cap': 0.9738743266028622, 'bull_strategy': 'mean_reversion', 'bull_bb_std_mult': 1.0366953091929534, 'bull_rsi_os': 47, 'bull_rsi_ob': 67, 'bull_adx_thresh': 26.63345511967198, 'bull_atr_min_pct': 0.006636767770758354, 'bull_atr_max_pct': 0.0826845447432615, 'bull_tp_mult': 2.1817729085614697, 'bull_tsl_mult': 0.709896318925825, 'bull_time_stop': 68, 'bull_use_sma': False, 'bull_use_ema': False, 'bull_use_atr': False, 'bull_use_adx': True, 'bull_use_spike': False, 'bull_rsi_required': False, 'bear_strategy': 'mean_reversion', 'bear_bb_std_mult': 1.1456959291220419, 'bear_rsi_os': 29, 'bear_rsi_ob': 81, 'bear_adx_thresh': 21.11913880323073, 'bear_atr_min_pct': 0.009507345580481065, 'bear_atr_max_pct': 0.09476453148422118, 'bear_tp_mult': 1.926251532177944, 'bear_tsl_mult': 0.7507377701870976, 'bear_time_stop': 250, 'bear_use_sma': False, 'bear_use_ema': False, 'bear_use_atr': False, 'bear_use_adx': False, 'bear_use_spike': False, 'bear_rsi_required': True, 'sideways_strategy': 'mean_reversion', 'sideways_bb_std_mult': 0.9891047050870828, 'sideways_rsi_os': 13, 'sideways_rsi_ob': 79, 'sideways_adx_thresh': 29.492396572348337, 'sideways_atr_min_pct': 0.0007780699126635339, 'sideways_atr_max_pct': 0.07899785642880584, 'sideways_tp_mult': 1.0249710433638204, 'sideways_tsl_mult': 0.017413745669649316, 'sideways_time_stop': 244, 'sideways_use_sma': True, 'sideways_use_ema': True, 'sideways_use_atr': False, 'sideways_use_adx': False, 'sideways_use_spike': True, 'sideways_rsi_required': True}.
[I 2025-08-31 11:10:21,540] Trial 846 finished with values: [-1000000000.0, 1000000000.0] and parameters: {'p_sma': 12, 'p_std': 26, 'p_atr': 20, 'p_adx': 8, 'rsi_period': 21, 'ema1': 17, 'ema2': 60, 'slip_atr_k': 0.1691959423280784, 'slip_spread_k': 0.27278237112348624, 'spread_hl_frac': 0.024113515998488412, 'bb_std_mult': 2.44780812211157, 'rsi_os': 36, 'rsi_ob': 72, 'vol_spike': 0.29488826548431063, 'adx_thresh': 24.092946575436184, 'atr_min_pct': 0.011857638830045406, 'atr_max_pct': 0.11555087549766968, 'tp_mult': 2.9591638859288985, 'tsl_mult': 0.06614668956743876, 'strategy': 'breakout', 'time_stop': 141, 'use_sma': False, 'use_atr': False, 'use_adx': False, 'use_ema': True, 'use_spike': False, 'rsi_required': False, 'edge_k': 0.3591199802483417, 'edge_cap': 0.9244926294823336, 'bull_strategy': 'mean_reversion', 'bull_bb_std_mult': 1.0664478878906807, 'bull_rsi_os': 53, 'bull_rsi_ob': 56, 'bull_adx_thresh': 29.038912145981598, 'bull_atr_min_pct': 0.006824770816379195, 'bull_atr_max_pct': 0.046638464764248905, 'bull_tp_mult': 2.1971106452444444, 'bull_tsl_mult': 0.9823440092337076, 'bull_time_stop': 68, 'bull_use_sma': False, 'bull_use_ema': False, 'bull_use_atr': False, 'bull_use_adx': False, 'bull_use_spike': False, 'bull_rsi_required': False, 'bear_strategy': 'mean_reversion', 'bear_bb_std_mult': 2.9878887288828917, 'bear_rsi_os': 30, 'bear_rsi_ob': 81, 'bear_adx_thresh': 8.15660700509243, 'bear_atr_min_pct': 0.026840281373276258, 'bear_atr_max_pct': 0.09475316786996413, 'bear_tp_mult': 2.0810806237481043, 'bear_tsl_mult': 0.5130213118890536, 'bear_time_stop': 269, 'bear_use_sma': False, 'bear_use_ema': True, 'bear_use_atr': False, 'bear_use_adx': False, 'bear_use_spike': False, 'bear_rsi_required': True, 'sideways_strategy': 'mean_reversion', 'sideways_bb_std_mult': 0.9045281532679857, 'sideways_rsi_os': 51, 'sideways_rsi_ob': 79, 'sideways_adx_thresh': 25.117030848351853, 'sideways_atr_min_pct': 0.015942238357486684, 'sideways_atr_max_pct': 0.07829841430284575, 'sideways_tp_mult': 2.9828394298640997, 'sideways_tsl_mult': 0.07378196351653381, 'sideways_time_stop': 121, 'sideways_use_sma': True, 'sideways_use_ema': True, 'sideways_use_atr': False, 'sideways_use_adx': False, 'sideways_use_spike': True, 'sideways_rsi_required': True}.
[I 2025-08-31 11:10:53,692] Trial 851 finished with values: [-1000000000.0, 1000000000.0] and parameters: {'p_sma': 10, 'p_std': 9, 'p_atr': 29, 'p_adx': 25, 'rsi_period': 25, 'ema1': 7, 'ema2': 38, 'slip_atr_k': 0.048234962981507784, 'slip_spread_k': 0.22767023442590162, 'spread_hl_frac': 0.017323042419350947, 'bb_std_mult': 1.2243126800136024, 'rsi_os': 39, 'rsi_ob': 59, 'vol_spike': 0.27943231589517287, 'adx_thresh': 23.88149241999318, 'atr_min_pct': 0.01070996448293534, 'atr_max_pct': 0.11030005361119528, 'tp_mult': 2.5659447020770543, 'tsl_mult': 0.19262500161222335, 'strategy': 'breakout', 'time_stop': 193, 'use_sma': False, 'use_atr': False, 'use_adx': False, 'use_ema': False, 'use_spike': True, 'rsi_required': True, 'edge_k': 1.555607390707092, 'edge_cap': 0.2610337303840704, 'bull_strategy': 'mean_reversion', 'bull_bb_std_mult': 1.1733647204043134, 'bull_rsi_os': 40, 'bull_rsi_ob': 75, 'bull_adx_thresh': 29.83586439380126, 'bull_atr_min_pct': 0.005233080332174945, 'bull_atr_max_pct': 0.08968898622590953, 'bull_tp_mult': 2.094645252525838, 'bull_tsl_mult': 0.263425624972372, 'bull_time_stop': 210, 'bull_use_sma': True, 'bull_use_ema': True, 'bull_use_atr': True, 'bull_use_adx': False, 'bull_use_spike': True, 'bull_rsi_required': True, 'bear_strategy': 'breakout', 'bear_bb_std_mult': 1.349344237472645, 'bear_rsi_os': 8, 'bear_rsi_ob': 71, 'bear_adx_thresh': 20.374738763426535, 'bear_atr_min_pct': 0.006012363909843483, 'bear_atr_max_pct': 0.04626220472448815, 'bear_tp_mult': 2.0298345244556737, 'bear_tsl_mult': 0.4932747459861884, 'bear_time_stop': 135, 'bear_use_sma': True, 'bear_use_ema': True, 'bear_use_atr': True, 'bear_use_adx': True, 'bear_use_spike': True, 'bear_rsi_required': True, 'sideways_strategy': 'breakout', 'sideways_bb_std_mult': 0.8289129793647123, 'sideways_rsi_os': 6, 'sideways_rsi_ob': 76, 'sideways_adx_thresh': 14.108786773799235, 'sideways_atr_min_pct': 0.0019095832554408272, 'sideways_atr_max_pct': 0.10132831050599367, 'sideways_tp_mult': 2.9974664635762696, 'sideways_tsl_mult': 0.9976692627128011, 'sideways_time_stop': 231, 'sideways_use_sma': False, 'sideways_use_ema': False, 'sideways_use_atr': True, 'sideways_use_adx': True, 'sideways_use_spike': False, 'sideways_rsi_required': False}.
[I 2025-08-31 11:10:54,571] Trial 848 finished with values: [-1000000000.0, 1000000000.0] and parameters: {'p_sma': 12, 'p_std': 8, 'p_atr': 10, 'p_adx': 26, 'rsi_period': 22, 'ema1': 17, 'ema2': 38, 'slip_atr_k': 0.17797740128056685, 'slip_spread_k': 0.14146389628787892, 'spread_hl_frac': 0.03529960930776123, 'bb_std_mult': 1.2108933765011207, 'rsi_os': 28, 'rsi_ob': 75, 'vol_spike': 0.2907357020210862, 'adx_thresh': 30.535185001425653, 'atr_min_pct': 0.010678307874384231, 'atr_max_pct': 0.043757876712418826, 'tp_mult': 2.9465899051379614, 'tsl_mult': 0.062027007126048174, 'strategy': 'breakout', 'time_stop': 143, 'use_sma': False, 'use_atr': False, 'use_adx': False, 'use_ema': True, 'use_spike': False, 'rsi_required': True, 'edge_k': 1.9468453256159508, 'edge_cap': 0.25079428706630597, 'bull_strategy': 'mean_reversion', 'bull_bb_std_mult': 1.221867156596351, 'bull_rsi_os': 27, 'bull_rsi_ob': 67, 'bull_adx_thresh': 10.762695770322244, 'bull_atr_min_pct': 0.00669145188389078, 'bull_atr_max_pct': 0.08394230319726471, 'bull_tp_mult': 1.3277952495877177, 'bull_tsl_mult': 0.944283783679333, 'bull_time_stop': 74, 'bull_use_sma': False, 'bull_use_ema': False, 'bull_use_atr': False, 'bull_use_adx': False, 'bull_use_spike': False, 'bull_rsi_required': False, 'bear_strategy': 'mean_reversion', 'bear_bb_std_mult': 2.8860995867769903, 'bear_rsi_os': 34, 'bear_rsi_ob': 81, 'bear_adx_thresh': 8.203421271698783, 'bear_atr_min_pct': 0.01144532353618014, 'bear_atr_max_pct': 0.10519548063220102, 'bear_tp_mult': 2.052452543970149, 'bear_tsl_mult': 0.9432298053112425, 'bear_time_stop': 271, 'bear_use_sma': False, 'bear_use_ema': True, 'bear_use_atr': False, 'bear_use_adx': False, 'bear_use_spike': False, 'bear_rsi_required': True, 'sideways_strategy': 'breakout', 'sideways_bb_std_mult': 0.8935628844772405, 'sideways_rsi_os': 26, 'sideways_rsi_ob': 93, 'sideways_adx_thresh': 14.006512889629189, 'sideways_atr_min_pct': 0.006952079250021368, 'sideways_atr_max_pct': 0.09690056196632395, 'sideways_tp_mult': 2.972115910181579, 'sideways_tsl_mult': 0.6307257846836813, 'sideways_time_stop': 121, 'sideways_use_sma': True, 'sideways_use_ema': True, 'sideways_use_atr': False, 'sideways_use_adx': False, 'sideways_use_spike': True, 'sideways_rsi_required': False}.
[I 2025-08-31 11:10:54,684] Trial 849 finished with values: [-1000000000.0, 1000000000.0] and parameters: {'p_sma': 13, 'p_std': 48, 'p_atr': 26, 'p_adx': 9, 'rsi_period': 44, 'ema1': 11, 'ema2': 38, 'slip_atr_k': 0.1785054961697527, 'slip_spread_k': 0.14564216325192508, 'spread_hl_frac': 0.035323740954332536, 'bb_std_mult': 2.428769690537307, 'rsi_os': 6, 'rsi_ob': 75, 'vol_spike': 0.29494266312580436, 'adx_thresh': 23.842617867130013, 'atr_min_pct': 0.00957312895424695, 'atr_max_pct': 0.10978754146114272, 'tp_mult': 1.0120923850328487, 'tsl_mult': 0.8518202808238413, 'strategy': 'breakout', 'time_stop': 144, 'use_sma': False, 'use_atr': False, 'use_adx': False, 'use_ema': True, 'use_spike': False, 'rsi_required': True, 'edge_k': 1.9362261255213957, 'edge_cap': 0.1475932202313286, 'bull_strategy': 'mean_reversion', 'bull_bb_std_mult': 1.2050898077889882, 'bull_rsi_os': 42, 'bull_rsi_ob': 69, 'bull_adx_thresh': 29.552734334614993, 'bull_atr_min_pct': 0.0018080722431495153, 'bull_atr_max_pct': 0.04595617262770055, 'bull_tp_mult': 2.644999827903585, 'bull_tsl_mult': 0.2668027854530983, 'bull_time_stop': 68, 'bull_use_sma': True, 'bull_use_ema': False, 'bull_use_atr': False, 'bull_use_adx': False, 'bull_use_spike': False, 'bull_rsi_required': True, 'bear_strategy': 'breakout', 'bear_bb_std_mult': 2.8955367145608375, 'bear_rsi_os': 40, 'bear_rsi_ob': 79, 'bear_adx_thresh': 20.308617905266033, 'bear_atr_min_pct': 0.0059956254521005, 'bear_atr_max_pct': 0.046030712504422554, 'bear_tp_mult': 2.052243983337205, 'bear_tsl_mult': 0.3790592675524476, 'bear_time_stop': 176, 'bear_use_sma': False, 'bear_use_ema': True, 'bear_use_atr': False, 'bear_use_adx': True, 'bear_use_spike': True, 'bear_rsi_required': True, 'sideways_strategy': 'breakout', 'sideways_bb_std_mult': 0.9090980635170623, 'sideways_rsi_os': 26, 'sideways_rsi_ob': 92, 'sideways_adx_thresh': 8.943963273536221, 'sideways_atr_min_pct': 0.0005439598739574833, 'sideways_atr_max_pct': 0.10235764990100867, 'sideways_tp_mult': 2.387931754651024, 'sideways_tsl_mult': 0.5073084283433628, 'sideways_time_stop': 85, 'sideways_use_sma': True, 'sideways_use_ema': True, 'sideways_use_atr': False, 'sideways_use_adx': False, 'sideways_use_spike': True, 'sideways_rsi_required': False}.
[I 2025-08-31 11:10:54,772] Trial 850 finished with values: [-1000000000.0, 1000000000.0] and parameters: {'p_sma': 12, 'p_std': 24, 'p_atr': 19, 'p_adx': 26, 'rsi_period': 71, 'ema1': 17, 'ema2': 51, 'slip_atr_k': 0.04752468611528275, 'slip_spread_k': 0.6650407363677566, 'spread_hl_frac': 0.013412348409752674, 'bb_std_mult': 1.2022467529557581, 'rsi_os': 45, 'rsi_ob': 80, 'vol_spike': 0.29338523049478393, 'adx_thresh': 23.89647572154036, 'atr_min_pct': 0.01073113996575683, 'atr_max_pct': 0.11513851730405643, 'tp_mult': 2.917138764870762, 'tsl_mult': 0.061740189259413464, 'strategy': 'breakout', 'time_stop': 114, 'use_sma': False, 'use_atr': False, 'use_adx': False, 'use_ema': True, 'use_spike': False, 'rsi_required': True, 'edge_k': 1.9276455142808027, 'edge_cap': 0.18525494757209793, 'bull_strategy': 'mean_reversion', 'bull_bb_std_mult': 1.1913016586528, 'bull_rsi_os': 12, 'bull_rsi_ob': 69, 'bull_adx_thresh': 29.80319410424238, 'bull_atr_min_pct': 0.006818778087591278, 'bull_atr_max_pct': 0.08881408225332854, 'bull_tp_mult': 2.7106609434006144, 'bull_tsl_mult': 0.9408227174935608, 'bull_time_stop': 77, 'bull_use_sma': True, 'bull_use_ema': False, 'bull_use_atr': True, 'bull_use_adx': False, 'bull_use_spike': True, 'bull_rsi_required': True, 'bear_strategy': 'breakout', 'bear_bb_std_mult': 2.7506101676098784, 'bear_rsi_os': 30, 'bear_rsi_ob': 65, 'bear_adx_thresh': 20.313063449524265, 'bear_atr_min_pct': 0.008822949432982074, 'bear_atr_max_pct': 0.045162980137979335, 'bear_tp_mult': 2.044537211787376, 'bear_tsl_mult': 0.4936997481073019, 'bear_time_stop': 270, 'bear_use_sma': False, 'bear_use_ema': True, 'bear_use_atr': False, 'bear_use_adx': True, 'bear_use_spike': True, 'bear_rsi_required': True, 'sideways_strategy': 'breakout', 'sideways_bb_std_mult': 0.8020336700596059, 'sideways_rsi_os': 26, 'sideways_rsi_ob': 92, 'sideways_adx_thresh': 13.783271234283767, 'sideways_atr_min_pct': 0.006873775560852259, 'sideways_atr_max_pct': 0.09692990506013642, 'sideways_tp_mult': 2.303457360256933, 'sideways_tsl_mult': 0.5047927560087944, 'sideways_time_stop': 84, 'sideways_use_sma': True, 'sideways_use_ema': True, 'sideways_use_atr': True, 'sideways_use_adx': False, 'sideways_use_spike': True, 'sideways_rsi_required': False}.
[I 2025-08-31 11:11:27,506] Trial 852 finished with values: [-1000000000.0, 1000000000.0] and parameters: {'p_sma': 13, 'p_std': 47, 'p_atr': 28, 'p_adx': 9, 'rsi_period': 13, 'ema1': 16, 'ema2': 19, 'slip_atr_k': 0.22278890650013433, 'slip_spread_k': 0.8263912570534213, 'spread_hl_frac': 0.013754429414428993, 'bb_std_mult': 1.092783920982803, 'rsi_os': 41, 'rsi_ob': 80, 'vol_spike': 0.29458893393133856, 'adx_thresh': 30.306197526948207, 'atr_min_pct': 0.011270022252033227, 'atr_max_pct': 0.1251291005935061, 'tp_mult': 2.9056330170930393, 'tsl_mult': 0.023967570957755167, 'strategy': 'breakout', 'time_stop': 133, 'use_sma': False, 'use_atr': False, 'use_adx': False, 'use_ema': True, 'use_spike': False, 'rsi_required': True, 'edge_k': 1.8030824233112448, 'edge_cap': 0.14652686891857372, 'bull_strategy': 'mean_reversion', 'bull_bb_std_mult': 1.1962490096849288, 'bull_rsi_os': 44, 'bull_rsi_ob': 63, 'bull_adx_thresh': 7.583270832047276, 'bull_atr_min_pct': 0.022400063293449044, 'bull_atr_max_pct': 0.06236500393869021, 'bull_tp_mult': 1.067420683366799, 'bull_tsl_mult': 0.9390566248568267, 'bull_time_stop': 52, 'bull_use_sma': True, 'bull_use_ema': False, 'bull_use_atr': False, 'bull_use_adx': False, 'bull_use_spike': False, 'bull_rsi_required': True, 'bear_strategy': 'breakout', 'bear_bb_std_mult': 1.0117371749877526, 'bear_rsi_os': 20, 'bear_rsi_ob': 65, 'bear_adx_thresh': 21.732395509240074, 'bear_atr_min_pct': 0.008690064585655147, 'bear_atr_max_pct': 0.10689721471983406, 'bear_tp_mult': 2.0622807470486935, 'bear_tsl_mult': 0.46929405061858465, 'bear_time_stop': 178, 'bear_use_sma': False, 'bear_use_ema': True, 'bear_use_atr': False, 'bear_use_adx': True, 'bear_use_spike': True, 'bear_rsi_required': True, 'sideways_strategy': 'breakout', 'sideways_bb_std_mult': 0.9261070487426262, 'sideways_rsi_os': 26, 'sideways_rsi_ob': 92, 'sideways_adx_thresh': 27.585528249496896, 'sideways_atr_min_pct': 0.007085800794947207, 'sideways_atr_max_pct': 0.09764170180039179, 'sideways_tp_mult': 2.3163648572385163, 'sideways_tsl_mult': 0.10279118842235041, 'sideways_time_stop': 102, 'sideways_use_sma': True, 'sideways_use_ema': True, 'sideways_use_atr': False, 'sideways_use_adx': False, 'sideways_use_spike': True, 'sideways_rsi_required': False}.
[I 2025-08-31 11:11:27,663] Trial 855 finished with values: [-0.026857141583880195, 0.02671694627805646] and parameters: {'p_sma': 10, 'p_std': 48, 'p_atr': 28, 'p_adx': 9, 'rsi_period': 27, 'ema1': 10, 'ema2': 28, 'slip_atr_k': 0.22239394403299023, 'slip_spread_k': 0.08883344220718198, 'spread_hl_frac': 0.04169624308133714, 'bb_std_mult': 2.847640769716864, 'rsi_os': 40, 'rsi_ob': 83, 'vol_spike': 0.299371193369698, 'adx_thresh': 25.47470622567354, 'atr_min_pct': 0.014892013203557854, 'atr_max_pct': 0.12575989600133672, 'tp_mult': 2.4387785771232102, 'tsl_mult': 0.038150077375842986, 'strategy': 'breakout', 'time_stop': 160, 'use_sma': False, 'use_atr': False, 'use_adx': True, 'use_ema': False, 'use_spike': True, 'rsi_required': True, 'edge_k': 1.895808036108377, 'edge_cap': 0.051231843386128684, 'bull_strategy': 'mean_reversion', 'bull_bb_std_mult': 1.7518547368905195, 'bull_rsi_os': 14, 'bull_rsi_ob': 64, 'bull_adx_thresh': 30.340381729897338, 'bull_atr_min_pct': 0.0040778521015744085, 'bull_atr_max_pct': 0.036064023840007, 'bull_tp_mult': 2.408268724994305, 'bull_tsl_mult': 0.9631651340788703, 'bull_time_stop': 90, 'bull_use_sma': True, 'bull_use_ema': True, 'bull_use_atr': False, 'bull_use_adx': False, 'bull_use_spike': False, 'bull_rsi_required': True, 'bear_strategy': 'breakout', 'bear_bb_std_mult': 2.8602032995110784, 'bear_rsi_os': 27, 'bear_rsi_ob': 79, 'bear_adx_thresh': 22.0297311936461, 'bear_atr_min_pct': 0.016944962396907997, 'bear_atr_max_pct': 0.10829720390733506, 'bear_tp_mult': 2.1073986473252333, 'bear_tsl_mult': 0.4607559438221053, 'bear_time_stop': 80, 'bear_use_sma': True, 'bear_use_ema': True, 'bear_use_atr': True, 'bear_use_adx': True, 'bear_use_spike': True, 'bear_rsi_required': True, 'sideways_strategy': 'breakout', 'sideways_bb_std_mult': 0.9564504810123814, 'sideways_rsi_os': 38, 'sideways_rsi_ob': 94, 'sideways_adx_thresh': 30.670628409863802, 'sideways_atr_min_pct': 0.0015023362924922335, 'sideways_atr_max_pct': 0.10076738462512433, 'sideways_tp_mult': 2.886337561684542, 'sideways_tsl_mult': 0.08883451357112036, 'sideways_time_stop': 231, 'sideways_use_sma': False, 'sideways_use_ema': False, 'sideways_use_atr': False, 'sideways_use_adx': True, 'sideways_use_spike': False, 'sideways_rsi_required': False}.
[I 2025-08-31 11:11:28,092] Trial 853 finished with values: [-1000000000.0, 1000000000.0] and parameters: {'p_sma': 13, 'p_std': 48, 'p_atr': 28, 'p_adx': 9, 'rsi_period': 71, 'ema1': 19, 'ema2': 44, 'slip_atr_k': 0.2235675267905308, 'slip_spread_k': 0.0927794787133599, 'spread_hl_frac': 0.013583061612211393, 'bb_std_mult': 1.0969170108434356, 'rsi_os': 40, 'rsi_ob': 83, 'vol_spike': 0.29989863141543055, 'adx_thresh': 22.583319232079084, 'atr_min_pct': 0.0014247601255525984, 'atr_max_pct': 0.06933256808690666, 'tp_mult': 2.449739228074707, 'tsl_mult': 0.02292961171157268, 'strategy': 'breakout', 'time_stop': 182, 'use_sma': False, 'use_atr': False, 'use_adx': False, 'use_ema': True, 'use_spike': False, 'rsi_required': True, 'edge_k': 1.796146899998489, 'edge_cap': 0.6399690887909477, 'bull_strategy': 'mean_reversion', 'bull_bb_std_mult': 1.5737594235364867, 'bull_rsi_os': 28, 'bull_rsi_ob': 77, 'bull_adx_thresh': 32.10309288014321, 'bull_atr_min_pct': 0.0018627094193816515, 'bull_atr_max_pct': 0.08840463940273913, 'bull_tp_mult': 2.234990938443613, 'bull_tsl_mult': 0.96054275631546, 'bull_time_stop': 187, 'bull_use_sma': True, 'bull_use_ema': False, 'bull_use_atr': False, 'bull_use_adx': False, 'bull_use_spike': True, 'bull_rsi_required': True, 'bear_strategy': 'breakout', 'bear_bb_std_mult': 2.7356025582138943, 'bear_rsi_os': 27, 'bear_rsi_ob': 65, 'bear_adx_thresh': 27.171104855046124, 'bear_atr_min_pct': 0.008501033227682368, 'bear_atr_max_pct': 0.08380626427277443, 'bear_tp_mult': 2.103018880552625, 'bear_tsl_mult': 0.4648012654780901, 'bear_time_stop': 177, 'bear_use_sma': False, 'bear_use_ema': True, 'bear_use_atr': False, 'bear_use_adx': True, 'bear_use_spike': True, 'bear_rsi_required': True, 'sideways_strategy': 'breakout', 'sideways_bb_std_mult': 0.8048966974993607, 'sideways_rsi_os': 25, 'sideways_rsi_ob': 92, 'sideways_adx_thresh': 12.429872879255708, 'sideways_atr_min_pct': 0.0007582232979107634, 'sideways_atr_max_pct': 0.10299657392473864, 'sideways_tp_mult': 2.8970150322345867, 'sideways_tsl_mult': 0.8120069433563868, 'sideways_time_stop': 30, 'sideways_use_sma': True, 'sideways_use_ema': True, 'sideways_use_atr': True, 'sideways_use_adx': False, 'sideways_use_spike': True, 'sideways_rsi_required': False}.
