[I 2025-08-31 09:53:45,990] Trial 251 finished with values: [-1000000000.0, 1000000000.0] and parameters: {'p_sma': 49, 'p_std': 16, 'p_atr': 29, 'p_adx': 21, 'rsi_period': 18, 'ema1': 21, 'ema2': 36, 'slip_atr_k': 0.23562749544692646, 'slip_spread_k': 0.4611765740566224, 'spread_hl_frac': 0.004623127660041075, 'bb_std_mult': 1.0557007955241862, 'rsi_os': 54, 'rsi_ob': 48, 'vol_spike': 0.13730540798158106, 'adx_thresh': 24.768987264706112, 'atr_min_pct': 0.010960539302203025, 'atr_max_pct': 0.09409818998659338, 'tp_mult': 1.602764767707088, 'tsl_mult': 0.5213342211697318, 'strategy': 'breakout', 'time_stop': 127, 'use_sma': False, 'use_atr': False, 'use_adx': False, 'use_ema': False, 'use_spike': False, 'rsi_required': False, 'edge_k': 0.8237696420240155, 'edge_cap': 0.9960263904819376, 'bull_strategy': 'mean_reversion', 'bull_bb_std_mult': 0.7225519514342125, 'bull_rsi_os': 31, 'bull_rsi_ob': 67, 'bull_adx_thresh': 32.71964696772092, 'bull_atr_min_pct': 0.01950419307185526, 'bull_atr_max_pct': 0.11732351284688422, 'bull_tp_mult': 1.502566281770645, 'bull_tsl_mult': 0.5963536931455223, 'bull_time_stop': 254, 'bull_use_sma': False, 'bull_use_ema': True, 'bull_use_atr': False, 'bull_use_adx': True, 'bull_use_spike': True, 'bull_rsi_required': True, 'bear_strategy': 'mean_reversion', 'bear_bb_std_mult': 2.7499441965619527, 'bear_rsi_os': 53, 'bear_rsi_ob': 80, 'bear_adx_thresh': 20.715885091192277, 'bear_atr_min_pct': 0.014001510388386026, 'bear_atr_max_pct': 0.14695928376285036, 'bear_tp_mult': 2.597246910960257, 'bear_tsl_mult': 0.5276555823293447, 'bear_time_stop': 119, 'bear_use_sma': True, 'bear_use_ema': True, 'bear_use_atr': False, 'bear_use_adx': False, 'bear_use_spike': False, 'bear_rsi_required': True, 'sideways_strategy': 'mean_reversion', 'sideways_bb_std_mult': 1.0967120308675056, 'sideways_rsi_os': 23, 'sideways_rsi_ob': 63, 'sideways_adx_thresh': 5.646283881156213, 'sideways_atr_min_pct': 0.0024101685833457284, 'sideways_atr_max_pct': 0.027380696093790506, 'sideways_tp_mult': 1.5582655581546223, 'sideways_tsl_mult': 0.09534006518947477, 'sideways_time_stop': 229, 'sideways_use_sma': True, 'sideways_use_ema': True, 'sideways_use_atr': True, 'sideways_use_adx': True, 'sideways_use_spike': False, 'sideways_rsi_required': True}.
[I 2025-08-31 09:53:46,422] Trial 252 finished with values: [-0.030202671760625854, 0.030186923097070457] and parameters: {'p_sma': 49, 'p_std': 16, 'p_atr': 29, 'p_adx': 9, 'rsi_period': 23, 'ema1': 20, 'ema2': 36, 'slip_atr_k': 0.22156012559993793, 'slip_spread_k': 0.46019714575461, 'spread_hl_frac': 0.013343138572289847, 'bb_std_mult': 1.0436926396173325, 'rsi_os': 48, 'rsi_ob': 57, 'vol_spike': 0.13890038691060627, 'adx_thresh': 20.297525649620304, 'atr_min_pct': 0.01097326355441073, 'atr_max_pct': 0.1356289879033039, 'tp_mult': 2.867359792241755, 'tsl_mult': 0.16703825927616084, 'strategy': 'breakout', 'time_stop': 100, 'use_sma': False, 'use_atr': False, 'use_adx': False, 'use_ema': False, 'use_spike': False, 'rsi_required': False, 'edge_k': 0.7985244061605506, 'edge_cap': 0.13759850246901548, 'bull_strategy': 'mean_reversion', 'bull_bb_std_mult': 0.8281897919560812, 'bull_rsi_os': 31, 'bull_rsi_ob': 84, 'bull_adx_thresh': 32.24424298726348, 'bull_atr_min_pct': 0.019663894394360285, 'bull_atr_max_pct': 0.05836355217116332, 'bull_tp_mult': 1.4512335591644714, 'bull_tsl_mult': 0.16733703163266533, 'bull_time_stop': 254, 'bull_use_sma': False, 'bull_use_ema': False, 'bull_use_atr': False, 'bull_use_adx': True, 'bull_use_spike': True, 'bull_rsi_required': True, 'bear_strategy': 'mean_reversion', 'bear_bb_std_mult': 2.874070568249388, 'bear_rsi_os': 53, 'bear_rsi_ob': 55, 'bear_adx_thresh': 20.66165532443123, 'bear_atr_min_pct': 0.02742721634444619, 'bear_atr_max_pct': 0.10361827464423981, 'bear_tp_mult': 1.6618312672181461, 'bear_tsl_mult': 0.8634769550438222, 'bear_time_stop': 176, 'bear_use_sma': False, 'bear_use_ema': True, 'bear_use_atr': False, 'bear_use_adx': True, 'bear_use_spike': False, 'bear_rsi_required': True, 'sideways_strategy': 'breakout', 'sideways_bb_std_mult': 1.0698591717796457, 'sideways_rsi_os': 43, 'sideways_rsi_ob': 89, 'sideways_adx_thresh': 19.023198916372863, 'sideways_atr_min_pct': 0.002598976405729347, 'sideways_atr_max_pct': 0.02733644308950835, 'sideways_tp_mult': 1.538770980815593, 'sideways_tsl_mult': 0.06425381568785694, 'sideways_time_stop': 246, 'sideways_use_sma': True, 'sideways_use_ema': True, 'sideways_use_atr': True, 'sideways_use_adx': True, 'sideways_use_spike': False, 'sideways_rsi_required': False}.
[I 2025-08-31 09:53:47,207] Trial 254 finished with values: [-1000000000.0, 1000000000.0] and parameters: {'p_sma': 49, 'p_std': 48, 'p_atr': 29, 'p_adx': 9, 'rsi_period': 17, 'ema1': 20, 'ema2': 39, 'slip_atr_k': 0.17647266214450652, 'slip_spread_k': 0.12494877063948184, 'spread_hl_frac': 0.012104557893907322, 'bb_std_mult': 1.0934543611022307, 'rsi_os': 21, 'rsi_ob': 47, 'vol_spike': 0.18719313661502368, 'adx_thresh': 23.09394301591837, 'atr_min_pct': 0.010880018095238881, 'atr_max_pct': 0.14112851829282785, 'tp_mult': 1.4588282195997844, 'tsl_mult': 0.0007114024330855517, 'strategy': 'breakout', 'time_stop': 118, 'use_sma': False, 'use_atr': False, 'use_adx': True, 'use_ema': False, 'use_spike': False, 'rsi_required': True, 'edge_k': 1.960978531708037, 'edge_cap': 0.9419389733138384, 'bull_strategy': 'mean_reversion', 'bull_bb_std_mult': 1.4883351079126201, 'bull_rsi_os': 14, 'bull_rsi_ob': 66, 'bull_adx_thresh': 8.574876816393033, 'bull_atr_min_pct': 0.024561304573189932, 'bull_atr_max_pct': 0.04648666555828617, 'bull_tp_mult': 2.4811001570878704, 'bull_tsl_mult': 0.9748148354845938, 'bull_time_stop': 6, 'bull_use_sma': True, 'bull_use_ema': False, 'bull_use_atr': False, 'bull_use_adx': False, 'bull_use_spike': False, 'bull_rsi_required': True, 'bear_strategy': 'breakout', 'bear_bb_std_mult': 1.300543944205931, 'bear_rsi_os': 53, 'bear_rsi_ob': 78, 'bear_adx_thresh': 10.73255551797104, 'bear_atr_min_pct': 0.02761607817121616, 'bear_atr_max_pct': 0.044033945424653484, 'bear_tp_mult': 2.1684452991403576, 'bear_tsl_mult': 0.720722722240974, 'bear_time_stop': 256, 'bear_use_sma': False, 'bear_use_ema': True, 'bear_use_atr': False, 'bear_use_adx': True, 'bear_use_spike': False, 'bear_rsi_required': True, 'sideways_strategy': 'breakout', 'sideways_bb_std_mult': 1.0704070623602244, 'sideways_rsi_os': 26, 'sideways_rsi_ob': 63, 'sideways_adx_thresh': 33.99890303771031, 'sideways_atr_min_pct': 0.002533990326315356, 'sideways_atr_max_pct': 0.026366754047537553, 'sideways_tp_mult': 1.5422638020236152, 'sideways_tsl_mult': 0.04765830339379134, 'sideways_time_stop': 237, 'sideways_use_sma': True, 'sideways_use_ema': True, 'sideways_use_atr': False, 'sideways_use_adx': False, 'sideways_use_spike': False, 'sideways_rsi_required': False}.
[I 2025-08-31 09:53:47,716] Trial 257 finished with values: [-1000000000.0, 1000000000.0] and parameters: {'p_sma': 30, 'p_std': 13, 'p_atr': 11, 'p_adx': 9, 'rsi_period': 54, 'ema1': 20, 'ema2': 55, 'slip_atr_k': 0.14989393873584309, 'slip_spread_k': 0.4296428994889886, 'spread_hl_frac': 0.011775392165455771, 'bb_std_mult': 0.9773800353538751, 'rsi_os': 17, 'rsi_ob': 47, 'vol_spike': 0.12367512805016437, 'adx_thresh': 5.540506905093928, 'atr_min_pct': 0.011817534975685016, 'atr_max_pct': 0.13609737242865616, 'tp_mult': 2.733758521221002, 'tsl_mult': 0.17051983377625196, 'strategy': 'mean_reversion', 'time_stop': 118, 'use_sma': False, 'use_atr': False, 'use_adx': True, 'use_ema': False, 'use_spike': False, 'rsi_required': True, 'edge_k': 1.8348017777763637, 'edge_cap': 0.42852187239312617, 'bull_strategy': 'mean_reversion', 'bull_bb_std_mult': 0.8531930147567404, 'bull_rsi_os': 15, 'bull_rsi_ob': 66, 'bull_adx_thresh': 8.516568635313186, 'bull_atr_min_pct': 0.01052652690578378, 'bull_atr_max_pct': 0.07736080007194414, 'bull_tp_mult': 1.4279670267559088, 'bull_tsl_mult': 0.7375150943203113, 'bull_time_stop': 191, 'bull_use_sma': True, 'bull_use_ema': False, 'bull_use_atr': False, 'bull_use_adx': False, 'bull_use_spike': False, 'bull_rsi_required': True, 'bear_strategy': 'breakout', 'bear_bb_std_mult': 1.342521223490623, 'bear_rsi_os': 36, 'bear_rsi_ob': 78, 'bear_adx_thresh': 32.41528074612491, 'bear_atr_min_pct': 0.01016292830579613, 'bear_atr_max_pct': 0.09150478997828118, 'bear_tp_mult': 1.6728810605562883, 'bear_tsl_mult': 0.8599886265411708, 'bear_time_stop': 291, 'bear_use_sma': False, 'bear_use_ema': True, 'bear_use_atr': True, 'bear_use_adx': True, 'bear_use_spike': False, 'bear_rsi_required': True, 'sideways_strategy': 'breakout', 'sideways_bb_std_mult': 1.7508863585502028, 'sideways_rsi_os': 7, 'sideways_rsi_ob': 89, 'sideways_adx_thresh': 29.246216763990287, 'sideways_atr_min_pct': 0.0006389971252949416, 'sideways_atr_max_pct': 0.03103191746144925, 'sideways_tp_mult': 1.6215302181715525, 'sideways_tsl_mult': 0.04850054600344017, 'sideways_time_stop': 235, 'sideways_use_sma': False, 'sideways_use_ema': False, 'sideways_use_atr': False, 'sideways_use_adx': False, 'sideways_use_spike': False, 'sideways_rsi_required': False}.
[I 2025-08-31 09:54:20,490] Trial 258 finished with values: [-1000000000.0, 1000000000.0] and parameters: {'p_sma': 42, 'p_std': 13, 'p_atr': 30, 'p_adx': 28, 'rsi_period': 22, 'ema1': 28, 'ema2': 15, 'slip_atr_k': 0.15393645355267283, 'slip_spread_k': 0.4218479412702277, 'spread_hl_frac': 0.011385750971963442, 'bb_std_mult': 0.9486352638901986, 'rsi_os': 18, 'rsi_ob': 84, 'vol_spike': 0.1279527737705508, 'adx_thresh': 25.78089243191055, 'atr_min_pct': 0.011757932737880906, 'atr_max_pct': 0.13530574328484027, 'tp_mult': 2.7286703917511717, 'tsl_mult': 0.017379297224475055, 'strategy': 'mean_reversion', 'time_stop': 157, 'use_sma': False, 'use_atr': False, 'use_adx': True, 'use_ema': False, 'use_spike': False, 'rsi_required': True, 'edge_k': 1.0639119060020863, 'edge_cap': 0.1363232643453895, 'bull_strategy': 'mean_reversion', 'bull_bb_std_mult': 0.8340751479505135, 'bull_rsi_os': 52, 'bull_rsi_ob': 70, 'bull_adx_thresh': 24.313588604473196, 'bull_atr_min_pct': 0.0159041905410526, 'bull_atr_max_pct': 0.05946690684496579, 'bull_tp_mult': 1.4316475735262006, 'bull_tsl_mult': 0.7910002389567788, 'bull_time_stop': 186, 'bull_use_sma': True, 'bull_use_ema': False, 'bull_use_atr': False, 'bull_use_adx': False, 'bull_use_spike': False, 'bull_rsi_required': True, 'bear_strategy': 'breakout', 'bear_bb_std_mult': 3.1294217120627645, 'bear_rsi_os': 55, 'bear_rsi_ob': 95, 'bear_adx_thresh': 31.47702976590888, 'bear_atr_min_pct': 0.007383777390774015, 'bear_atr_max_pct': 0.1408460153604682, 'bear_tp_mult': 1.0107775893921036, 'bear_tsl_mult': 0.8614487915677331, 'bear_time_stop': 270, 'bear_use_sma': False, 'bear_use_ema': True, 'bear_use_atr': True, 'bear_use_adx': True, 'bear_use_spike': False, 'bear_rsi_required': True, 'sideways_strategy': 'breakout', 'sideways_bb_std_mult': 2.8363835222676146, 'sideways_rsi_os': 13, 'sideways_rsi_ob': 61, 'sideways_adx_thresh': 33.33951579919831, 'sideways_atr_min_pct': 0.0009595855440568155, 'sideways_atr_max_pct': 0.03269800633202647, 'sideways_tp_mult': 1.6220245111294844, 'sideways_tsl_mult': 0.0683181694476255, 'sideways_time_stop': 243, 'sideways_use_sma': False, 'sideways_use_ema': False, 'sideways_use_atr': False, 'sideways_use_adx': False, 'sideways_use_spike': False, 'sideways_rsi_required': False}.
[I 2025-08-31 09:54:21,556] Trial 255 finished with values: [-0.021118741208211222, 0.020952435259563] and parameters: {'p_sma': 42, 'p_std': 56, 'p_atr': 29, 'p_adx': 23, 'rsi_period': 23, 'ema1': 28, 'ema2': 56, 'slip_atr_k': 0.10004351813741297, 'slip_spread_k': 0.9735118637714835, 'spread_hl_frac': 0.011089083515405287, 'bb_std_mult': 1.0832122205939287, 'rsi_os': 42, 'rsi_ob': 57, 'vol_spike': 0.13345019712936307, 'adx_thresh': 5.616493979576407, 'atr_min_pct': 0.011674998514853648, 'atr_max_pct': 0.09951540012194895, 'tp_mult': 2.875337473019265, 'tsl_mult': 0.01664730700303633, 'strategy': 'breakout', 'time_stop': 89, 'use_sma': False, 'use_atr': False, 'use_adx': True, 'use_ema': False, 'use_spike': False, 'rsi_required': False, 'edge_k': 1.965742272906844, 'edge_cap': 0.13847721433417218, 'bull_strategy': 'mean_reversion', 'bull_bb_std_mult': 1.4976670645301489, 'bull_rsi_os': 51, 'bull_rsi_ob': 65, 'bull_adx_thresh': 9.16820908438403, 'bull_atr_min_pct': 0.018201875179447973, 'bull_atr_max_pct': 0.0584063946889391, 'bull_tp_mult': 1.4526972253055037, 'bull_tsl_mult': 0.8741009569493798, 'bull_time_stop': 251, 'bull_use_sma': False, 'bull_use_ema': False, 'bull_use_atr': False, 'bull_use_adx': True, 'bull_use_spike': False, 'bull_rsi_required': True, 'bear_strategy': 'mean_reversion', 'bear_bb_std_mult': 1.33916645370033, 'bear_rsi_os': 53, 'bear_rsi_ob': 55, 'bear_adx_thresh': 23.616906058181463, 'bear_atr_min_pct': 0.02752882139009421, 'bear_atr_max_pct': 0.14064773199526626, 'bear_tp_mult': 1.648706191833483, 'bear_tsl_mult': 0.6193811386449695, 'bear_time_stop': 292, 'bear_use_sma': False, 'bear_use_ema': True, 'bear_use_atr': False, 'bear_use_adx': True, 'bear_use_spike': False, 'bear_rsi_required': True, 'sideways_strategy': 'breakout', 'sideways_bb_std_mult': 2.8535490473408904, 'sideways_rsi_os': 26, 'sideways_rsi_ob': 60, 'sideways_adx_thresh': 33.42458059118856, 'sideways_atr_min_pct': 0.0005651551686432536, 'sideways_atr_max_pct': 0.0315429804476425, 'sideways_tp_mult': 1.5393441997585242, 'sideways_tsl_mult': 0.05190045725200941, 'sideways_time_stop': 238, 'sideways_use_sma': True, 'sideways_use_ema': True, 'sideways_use_atr': False, 'sideways_use_adx': True, 'sideways_use_spike': False, 'sideways_rsi_required': False}.
[I 2025-08-31 09:54:22,007] Trial 256 finished with values: [-1000000000.0, 1000000000.0] and parameters: {'p_sma': 11, 'p_std': 13, 'p_atr': 29, 'p_adx': 9, 'rsi_period': 60, 'ema1': 20, 'ema2': 23, 'slip_atr_k': 0.1002351529203533, 'slip_spread_k': 0.5649438258547967, 'spread_hl_frac': 0.01150884031677957, 'bb_std_mult': 0.9729548570084771, 'rsi_os': 23, 'rsi_ob': 57, 'vol_spike': 0.29693012424405923, 'adx_thresh': 23.440719413969408, 'atr_min_pct': 0.0122927993610799, 'atr_max_pct': 0.10884086661118415, 'tp_mult': 2.8700521679345297, 'tsl_mult': 0.013932984930831775, 'strategy': 'breakout', 'time_stop': 157, 'use_sma': False, 'use_atr': False, 'use_adx': True, 'use_ema': False, 'use_spike': False, 'rsi_required': True, 'edge_k': 1.9603172659535422, 'edge_cap': 0.3558301938270643, 'bull_strategy': 'mean_reversion', 'bull_bb_std_mult': 1.4782767814089222, 'bull_rsi_os': 43, 'bull_rsi_ob': 66, 'bull_adx_thresh': 31.552895798807846, 'bull_atr_min_pct': 0.02046030616116278, 'bull_atr_max_pct': 0.06016219881262995, 'bull_tp_mult': 1.4086356257030543, 'bull_tsl_mult': 0.656495504347717, 'bull_time_stop': 294, 'bull_use_sma': True, 'bull_use_ema': False, 'bull_use_atr': False, 'bull_use_adx': False, 'bull_use_spike': False, 'bull_rsi_required': True, 'bear_strategy': 'breakout', 'bear_bb_std_mult': 3.3871041826968007, 'bear_rsi_os': 55, 'bear_rsi_ob': 78, 'bear_adx_thresh': 22.357386444561925, 'bear_atr_min_pct': 0.0036557945306973025, 'bear_atr_max_pct': 0.14063587589226664, 'bear_tp_mult': 1.6701772351889352, 'bear_tsl_mult': 0.4967169158461222, 'bear_time_stop': 141, 'bear_use_sma': False, 'bear_use_ema': True, 'bear_use_atr': False, 'bear_use_adx': True, 'bear_use_spike': False, 'bear_rsi_required': True, 'sideways_strategy': 'breakout', 'sideways_bb_std_mult': 1.7768026580047058, 'sideways_rsi_os': 13, 'sideways_rsi_ob': 89, 'sideways_adx_thresh': 20.77378434460372, 'sideways_atr_min_pct': 0.0003715781541251389, 'sideways_atr_max_pct': 0.025712046713156682, 'sideways_tp_mult': 1.6293164131659625, 'sideways_tsl_mult': 0.05061849565492142, 'sideways_time_stop': 239, 'sideways_use_sma': True, 'sideways_use_ema': True, 'sideways_use_atr': False, 'sideways_use_adx': False, 'sideways_use_spike': False, 'sideways_rsi_required': False}.
[I 2025-08-31 09:54:22,810] Trial 259 finished with values: [-1000000000.0, 1000000000.0] and parameters: {'p_sma': 11, 'p_std': 13, 'p_atr': 29, 'p_adx': 8, 'rsi_period': 22, 'ema1': 19, 'ema2': 15, 'slip_atr_k': 0.09799708708180233, 'slip_spread_k': 0.4104919032789664, 'spread_hl_frac': 0.007698876267608096, 'bb_std_mult': 1.009466405450407, 'rsi_os': 25, 'rsi_ob': 67, 'vol_spike': 0.13377586797302785, 'adx_thresh': 6.6689802254937005, 'atr_min_pct': 0.012500134678358903, 'atr_max_pct': 0.1310319978885567, 'tp_mult': 2.888297129858142, 'tsl_mult': 0.01783582634487755, 'strategy': 'breakout', 'time_stop': 165, 'use_sma': False, 'use_atr': False, 'use_adx': False, 'use_ema': False, 'use_spike': False, 'rsi_required': False, 'edge_k': 1.863871949534112, 'edge_cap': 0.8376817134433634, 'bull_strategy': 'mean_reversion', 'bull_bb_std_mult': 1.3193507453012623, 'bull_rsi_os': 33, 'bull_rsi_ob': 68, 'bull_adx_thresh': 24.396051620485913, 'bull_atr_min_pct': 0.01574548668845041, 'bull_atr_max_pct': 0.058645492568274116, 'bull_tp_mult': 1.4596694355653097, 'bull_tsl_mult': 0.7934357550395525, 'bull_time_stop': 300, 'bull_use_sma': False, 'bull_use_ema': False, 'bull_use_atr': False, 'bull_use_adx': True, 'bull_use_spike': False, 'bull_rsi_required': True, 'bear_strategy': 'mean_reversion', 'bear_bb_std_mult': 2.848731550071203, 'bear_rsi_os': 55, 'bear_rsi_ob': 82, 'bear_adx_thresh': 23.33697600356603, 'bear_atr_min_pct': 0.02318268433324541, 'bear_atr_max_pct': 0.14137146337766912, 'bear_tp_mult': 2.675316569902582, 'bear_tsl_mult': 0.4972913920806618, 'bear_time_stop': 270, 'bear_use_sma': False, 'bear_use_ema': True, 'bear_use_atr': False, 'bear_use_adx': True, 'bear_use_spike': False, 'bear_rsi_required': True, 'sideways_strategy': 'breakout', 'sideways_bb_std_mult': 1.5017590785323978, 'sideways_rsi_os': 25, 'sideways_rsi_ob': 66, 'sideways_adx_thresh': 33.248410020318644, 'sideways_atr_min_pct': 0.0030175135511252517, 'sideways_atr_max_pct': 0.031038390716028555, 'sideways_tp_mult': 1.8944161220378841, 'sideways_tsl_mult': 0.07185363394760237, 'sideways_time_stop': 220, 'sideways_use_sma': True, 'sideways_use_ema': True, 'sideways_use_atr': False, 'sideways_use_adx': True, 'sideways_use_spike': False, 'sideways_rsi_required': False}.
[I 2025-08-31 09:55:00,899] Trial 261 finished with values: [-1000000000.0, 1000000000.0] and parameters: {'p_sma': 27, 'p_std': 56, 'p_atr': 28, 'p_adx': 29, 'rsi_period': 22, 'ema1': 19, 'ema2': 39, 'slip_atr_k': 0.09868313860426944, 'slip_spread_k': 0.3944205638188807, 'spread_hl_frac': 0.013096619844817543, 'bb_std_mult': 1.023519646698351, 'rsi_os': 23, 'rsi_ob': 50, 'vol_spike': 0.13446155437314758, 'adx_thresh': 31.864861049067983, 'atr_min_pct': 0.012654479207374631, 'atr_max_pct': 0.13086956107439748, 'tp_mult': 2.868675880030191, 'tsl_mult': 0.2159039240436218, 'strategy': 'breakout', 'time_stop': 164, 'use_sma': False, 'use_atr': False, 'use_adx': False, 'use_ema': False, 'use_spike': False, 'rsi_required': False, 'edge_k': 1.8625941167458806, 'edge_cap': 0.08273624440230021, 'bull_strategy': 'mean_reversion', 'bull_bb_std_mult': 1.3433843571280213, 'bull_rsi_os': 43, 'bull_rsi_ob': 68, 'bull_adx_thresh': 11.17603156869264, 'bull_atr_min_pct': 0.020837342475496654, 'bull_atr_max_pct': 0.06970850349368791, 'bull_tp_mult': 1.1177849222403884, 'bull_tsl_mult': 0.5513531326900724, 'bull_time_stop': 239, 'bull_use_sma': False, 'bull_use_ema': False, 'bull_use_atr': False, 'bull_use_adx': True, 'bull_use_spike': False, 'bull_rsi_required': True, 'bear_strategy': 'mean_reversion', 'bear_bb_std_mult': 2.861163554911393, 'bear_rsi_os': 55, 'bear_rsi_ob': 52, 'bear_adx_thresh': 34.04887673299127, 'bear_atr_min_pct': 0.022987838188845453, 'bear_atr_max_pct': 0.01317672365530985, 'bear_tp_mult': 1.2057207184478425, 'bear_tsl_mult': 0.624263509203446, 'bear_time_stop': 178, 'bear_use_sma': False, 'bear_use_ema': True, 'bear_use_atr': False, 'bear_use_adx': True, 'bear_use_spike': False, 'bear_rsi_required': True, 'sideways_strategy': 'breakout', 'sideways_bb_std_mult': 1.1967792895189042, 'sideways_rsi_os': 25, 'sideways_rsi_ob': 65, 'sideways_adx_thresh': 33.11553732694546, 'sideways_atr_min_pct': 0.003082486178927057, 'sideways_atr_max_pct': 0.030189964704586965, 'sideways_tp_mult': 1.4987290982221217, 'sideways_tsl_mult': 0.07264140113510321, 'sideways_time_stop': 223, 'sideways_use_sma': True, 'sideways_use_ema': True, 'sideways_use_atr': False, 'sideways_use_adx': True, 'sideways_use_spike': False, 'sideways_rsi_required': False}.
