[I 2025-08-31 11:04:10,993] Trial 799 finished with values: [-1000000000.0, 1000000000.0] and parameters: {'p_sma': 29, 'p_std': 7, 'p_atr': 28, 'p_adx': 30, 'rsi_period': 51, 'ema1': 18, 'ema2': 37, 'slip_atr_k': 0.04463732298599486, 'slip_spread_k': 0.05026563648624138, 'spread_hl_frac': 0.01277706086457414, 'bb_std_mult': 1.170231269212547, 'rsi_os': 40, 'rsi_ob': 84, 'vol_spike': 0.2949640953963567, 'adx_thresh': 23.85070740743732, 'atr_min_pct': 0.023125785471993482, 'atr_max_pct': 0.1126175906341636, 'tp_mult': 2.53181855510051, 'tsl_mult': 0.09574720630224913, 'strategy': 'breakout', 'time_stop': 147, 'use_sma': False, 'use_atr': False, 'use_adx': True, 'use_ema': True, 'use_spike': False, 'rsi_required': True, 'edge_k': 1.518608022876173, 'edge_cap': 0.39057357711013807, 'bull_strategy': 'mean_reversion', 'bull_bb_std_mult': 1.0449155470488158, 'bull_rsi_os': 52, 'bull_rsi_ob': 67, 'bull_adx_thresh': 33.50097797452058, 'bull_atr_min_pct': 0.007006231662700824, 'bull_atr_max_pct': 0.0854577583144996, 'bull_tp_mult': 2.188912070865911, 'bull_tsl_mult': 0.9484166919043834, 'bull_time_stop': 65, 'bull_use_sma': False, 'bull_use_ema': False, 'bull_use_atr': False, 'bull_use_adx': False, 'bull_use_spike': False, 'bull_rsi_required': True, 'bear_strategy': 'breakout', 'bear_bb_std_mult': 3.0930395656445446, 'bear_rsi_os': 15, 'bear_rsi_ob': 94, 'bear_adx_thresh': 19.2851986543181, 'bear_atr_min_pct': 0.009029188133651509, 'bear_atr_max_pct': 0.1276693466026456, 'bear_tp_mult': 2.0828972730909423, 'bear_tsl_mult': 0.33920334519840517, 'bear_time_stop': 265, 'bear_use_sma': False, 'bear_use_ema': True, 'bear_use_atr': False, 'bear_use_adx': True, 'bear_use_spike': True, 'bear_rsi_required': True, 'sideways_strategy': 'breakout', 'sideways_bb_std_mult': 0.7563495254460846, 'sideways_rsi_os': 26, 'sideways_rsi_ob': 82, 'sideways_adx_thresh': 30.61778770885909, 'sideways_atr_min_pct': 0.002435743373810442, 'sideways_atr_max_pct': 0.10796074973548596, 'sideways_tp_mult': 2.9099852436177245, 'sideways_tsl_mult': 0.020003940489925008, 'sideways_time_stop': 186, 'sideways_use_sma': True, 'sideways_use_ema': True, 'sideways_use_atr': False, 'sideways_use_adx': False, 'sideways_use_spike': True, 'sideways_rsi_required': False}.
[I 2025-08-31 11:04:11,120] Trial 800 finished with values: [-1000000000.0, 1000000000.0] and parameters: {'p_sma': 11, 'p_std': 22, 'p_atr': 14, 'p_adx': 9, 'rsi_period': 75, 'ema1': 17, 'ema2': 42, 'slip_atr_k': 0.21884811142771263, 'slip_spread_k': 0.5103354454772635, 'spread_hl_frac': 0.010016444677040708, 'bb_std_mult': 1.160964432965397, 'rsi_os': 42, 'rsi_ob': 74, 'vol_spike': 0.10931231593438673, 'adx_thresh': 23.895353817836263, 'atr_min_pct': 0.023280078294791548, 'atr_max_pct': 0.07243989696269729, 'tp_mult': 2.928424480474271, 'tsl_mult': 0.8732546362381732, 'strategy': 'breakout', 'time_stop': 149, 'use_sma': False, 'use_atr': True, 'use_adx': True, 'use_ema': True, 'use_spike': False, 'rsi_required': True, 'edge_k': 0.06999563801364828, 'edge_cap': 0.40060393865269994, 'bull_strategy': 'mean_reversion', 'bull_bb_std_mult': 1.3424479403411116, 'bull_rsi_os': 11, 'bull_rsi_ob': 67, 'bull_adx_thresh': 15.41725574746959, 'bull_atr_min_pct': 0.0033882338354990927, 'bull_atr_max_pct': 0.08022722362135429, 'bull_tp_mult': 1.2840897397554953, 'bull_tsl_mult': 0.978124401995206, 'bull_time_stop': 66, 'bull_use_sma': True, 'bull_use_ema': False, 'bull_use_atr': False, 'bull_use_adx': False, 'bull_use_spike': False, 'bull_rsi_required': False, 'bear_strategy': 'breakout', 'bear_bb_std_mult': 2.8801963523824545, 'bear_rsi_os': 49, 'bear_rsi_ob': 67, 'bear_adx_thresh': 33.75915555576833, 'bear_atr_min_pct': 0.007371626216237913, 'bear_atr_max_pct': 0.07228294328400751, 'bear_tp_mult': 2.167748977081451, 'bear_tsl_mult': 0.291272083374152, 'bear_time_stop': 258, 'bear_use_sma': False, 'bear_use_ema': True, 'bear_use_atr': False, 'bear_use_adx': True, 'bear_use_spike': True, 'bear_rsi_required': False, 'sideways_strategy': 'breakout', 'sideways_bb_std_mult': 0.7405857283514274, 'sideways_rsi_os': 31, 'sideways_rsi_ob': 93, 'sideways_adx_thresh': 30.405773998745456, 'sideways_atr_min_pct': 0.0024939663413222446, 'sideways_atr_max_pct': 0.10854987490942095, 'sideways_tp_mult': 2.9027156851298903, 'sideways_tsl_mult': 0.07330414916993513, 'sideways_time_stop': 224, 'sideways_use_sma': True, 'sideways_use_ema': True, 'sideways_use_atr': False, 'sideways_use_adx': False, 'sideways_use_spike': True, 'sideways_rsi_required': False}.
[I 2025-08-31 11:04:42,712] Trial 806 finished with values: [-0.029396717712955933, 0.02940760665417541] and parameters: {'p_sma': 33, 'p_std': 43, 'p_atr': 27, 'p_adx': 8, 'rsi_period': 26, 'ema1': 19, 'ema2': 15, 'slip_atr_k': 0.20034509623409835, 'slip_spread_k': 0.09030080848234298, 'spread_hl_frac': 0.011341441298816627, 'bb_std_mult': 0.6978350363938233, 'rsi_os': 40, 'rsi_ob': 82, 'vol_spike': 0.28107828558008535, 'adx_thresh': 24.96789745913065, 'atr_min_pct': 0.010977281994109708, 'atr_max_pct': 0.12126540480271096, 'tp_mult': 2.7638828610428083, 'tsl_mult': 0.05561494414413594, 'strategy': 'breakout', 'time_stop': 258, 'use_sma': False, 'use_atr': False, 'use_adx': False, 'use_ema': False, 'use_spike': True, 'rsi_required': False, 'edge_k': 0.4874776136277904, 'edge_cap': 0.06189586963446536, 'bull_strategy': 'mean_reversion', 'bull_bb_std_mult': 1.4882344688908078, 'bull_rsi_os': 54, 'bull_rsi_ob': 75, 'bull_adx_thresh': 30.2988796296217, 'bull_atr_min_pct': 0.02407349289333411, 'bull_atr_max_pct': 0.088040779236832, 'bull_tp_mult': 2.617548125728269, 'bull_tsl_mult': 0.929418267827072, 'bull_time_stop': 80, 'bull_use_sma': True, 'bull_use_ema': True, 'bull_use_atr': True, 'bull_use_adx': True, 'bull_use_spike': True, 'bull_rsi_required': True, 'bear_strategy': 'breakout', 'bear_bb_std_mult': 2.7636144979451553, 'bear_rsi_os': 46, 'bear_rsi_ob': 79, 'bear_adx_thresh': 22.745773452604347, 'bear_atr_min_pct': 0.004131524278100969, 'bear_atr_max_pct': 0.058868620028628985, 'bear_tp_mult': 2.022927415066049, 'bear_tsl_mult': 0.4427951317253784, 'bear_time_stop': 281, 'bear_use_sma': True, 'bear_use_ema': True, 'bear_use_atr': True, 'bear_use_adx': False, 'bear_use_spike': True, 'bear_rsi_required': True, 'sideways_strategy': 'breakout', 'sideways_bb_std_mult': 2.9162580183533575, 'sideways_rsi_os': 23, 'sideways_rsi_ob': 87, 'sideways_adx_thresh': 17.496545565726134, 'sideways_atr_min_pct': 0.0009383081184190054, 'sideways_atr_max_pct': 0.1006919509344029, 'sideways_tp_mult': 2.8250502086841127, 'sideways_tsl_mult': 0.0939856434711425, 'sideways_time_stop': 38, 'sideways_use_sma': False, 'sideways_use_ema': False, 'sideways_use_atr': True, 'sideways_use_adx': True, 'sideways_use_spike': False, 'sideways_rsi_required': False}.
[I 2025-08-31 11:04:42,917] Trial 804 finished with values: [-0.019530953829480446, 0.0193603906921065] and parameters: {'p_sma': 11, 'p_std': 49, 'p_atr': 8, 'p_adx': 8, 'rsi_period': 20, 'ema1': 17, 'ema2': 38, 'slip_atr_k': 0.21605060687882238, 'slip_spread_k': 0.10019398081231431, 'spread_hl_frac': 0.009460509579011846, 'bb_std_mult': 0.7824489430930219, 'rsi_os': 50, 'rsi_ob': 82, 'vol_spike': 0.28204681186197655, 'adx_thresh': 22.902821731788478, 'atr_min_pct': 0.010872359287931987, 'atr_max_pct': 0.12104929631023431, 'tp_mult': 2.2409980588838025, 'tsl_mult': 0.1301444886899305, 'strategy': 'breakout', 'time_stop': 257, 'use_sma': False, 'use_atr': False, 'use_adx': False, 'use_ema': True, 'use_spike': False, 'rsi_required': False, 'edge_k': 1.4572678521817568, 'edge_cap': 0.12351337515413721, 'bull_strategy': 'mean_reversion', 'bull_bb_std_mult': 1.4821311915109043, 'bull_rsi_os': 26, 'bull_rsi_ob': 66, 'bull_adx_thresh': 5.068149540326557, 'bull_atr_min_pct': 0.022975836804530164, 'bull_atr_max_pct': 0.05050780528960058, 'bull_tp_mult': 2.232425270191979, 'bull_tsl_mult': 0.9827954743589031, 'bull_time_stop': 204, 'bull_use_sma': True, 'bull_use_ema': False, 'bull_use_atr': True, 'bull_use_adx': True, 'bull_use_spike': True, 'bull_rsi_required': True, 'bear_strategy': 'breakout', 'bear_bb_std_mult': 2.7993863802679595, 'bear_rsi_os': 32, 'bear_rsi_ob': 79, 'bear_adx_thresh': 22.983656894951523, 'bear_atr_min_pct': 0.01653691537426971, 'bear_atr_max_pct': 0.10298492345258517, 'bear_tp_mult': 1.439587840076891, 'bear_tsl_mult': 0.43944888015028283, 'bear_time_stop': 57, 'bear_use_sma': False, 'bear_use_ema': True, 'bear_use_atr': False, 'bear_use_adx': False, 'bear_use_spike': True, 'bear_rsi_required': True, 'sideways_strategy': 'breakout', 'sideways_bb_std_mult': 2.7678416952261773, 'sideways_rsi_os': 22, 'sideways_rsi_ob': 92, 'sideways_adx_thresh': 12.951951492293304, 'sideways_atr_min_pct': 0.0013471704215216667, 'sideways_atr_max_pct': 0.10096240661657276, 'sideways_tp_mult': 2.8386754592829164, 'sideways_tsl_mult': 0.07294971969369854, 'sideways_time_stop': 220, 'sideways_use_sma': True, 'sideways_use_ema': False, 'sideways_use_atr': True, 'sideways_use_adx': False, 'sideways_use_spike': True, 'sideways_rsi_required': False}.
[I 2025-08-31 11:04:43,049] Trial 805 finished with values: [-1000000000.0, 1000000000.0] and parameters: {'p_sma': 32, 'p_std': 49, 'p_atr': 8, 'p_adx': 8, 'rsi_period': 20, 'ema1': 17, 'ema2': 59, 'slip_atr_k': 0.07938949787529472, 'slip_spread_k': 0.807215421149329, 'spread_hl_frac': 0.03652675946159614, 'bb_std_mult': 2.1084695743217217, 'rsi_os': 29, 'rsi_ob': 82, 'vol_spike': 0.28299132621927475, 'adx_thresh': 32.02883503519609, 'atr_min_pct': 0.010998351194946125, 'atr_max_pct': 0.12144321016050441, 'tp_mult': 1.4621145528213944, 'tsl_mult': 0.056827302101154276, 'strategy': 'breakout', 'time_stop': 146, 'use_sma': False, 'use_atr': False, 'use_adx': False, 'use_ema': True, 'use_spike': False, 'rsi_required': False, 'edge_k': 0.9427454853581022, 'edge_cap': 0.12372636518149277, 'bull_strategy': 'mean_reversion', 'bull_bb_std_mult': 1.8781781642464601, 'bull_rsi_os': 26, 'bull_rsi_ob': 66, 'bull_adx_thresh': 30.323145634837214, 'bull_atr_min_pct': 0.006528464689481567, 'bull_atr_max_pct': 0.044835183853705086, 'bull_tp_mult': 1.2793099603470641, 'bull_tsl_mult': 0.6841695656333878, 'bull_time_stop': 80, 'bull_use_sma': True, 'bull_use_ema': False, 'bull_use_atr': True, 'bull_use_adx': True, 'bull_use_spike': True, 'bull_rsi_required': True, 'bear_strategy': 'breakout', 'bear_bb_std_mult': 2.7890600016243976, 'bear_rsi_os': 44, 'bear_rsi_ob': 79, 'bear_adx_thresh': 23.072091116289485, 'bear_atr_min_pct': 0.0049346263480890655, 'bear_atr_max_pct': 0.09120021825947432, 'bear_tp_mult': 1.9494942877903718, 'bear_tsl_mult': 0.6293500607729857, 'bear_time_stop': 187, 'bear_use_sma': False, 'bear_use_ema': True, 'bear_use_atr': False, 'bear_use_adx': False, 'bear_use_spike': True, 'bear_rsi_required': True, 'sideways_strategy': 'breakout', 'sideways_bb_std_mult': 2.7634416322669426, 'sideways_rsi_os': 23, 'sideways_rsi_ob': 93, 'sideways_adx_thresh': 24.42079793226785, 'sideways_atr_min_pct': 0.01248407763895272, 'sideways_atr_max_pct': 0.09944681735846762, 'sideways_tp_mult': 2.4429323222725357, 'sideways_tsl_mult': 0.06749592965015838, 'sideways_time_stop': 224, 'sideways_use_sma': True, 'sideways_use_ema': False, 'sideways_use_atr': True, 'sideways_use_adx': False, 'sideways_use_spike': True, 'sideways_rsi_required': False}.
[I 2025-08-31 11:04:43,249] Trial 803 finished with values: [-0.04619883152696658, 0.04604120266869185] and parameters: {'p_sma': 41, 'p_std': 40, 'p_atr': 14, 'p_adx': 9, 'rsi_period': 20, 'ema1': 17, 'ema2': 21, 'slip_atr_k': 0.19938227498557495, 'slip_spread_k': 0.1371521300649567, 'spread_hl_frac': 0.031669389781547194, 'bb_std_mult': 0.6814970995365772, 'rsi_os': 29, 'rsi_ob': 60, 'vol_spike': 0.28179431726021237, 'adx_thresh': 22.92587381628581, 'atr_min_pct': 0.010916810751957842, 'atr_max_pct': 0.12200385880268017, 'tp_mult': 2.53798038461168, 'tsl_mult': 0.08171012904110508, 'strategy': 'breakout', 'time_stop': 94, 'use_sma': False, 'use_atr': False, 'use_adx': True, 'use_ema': True, 'use_spike': False, 'rsi_required': True, 'edge_k': 0.9609575240515627, 'edge_cap': 0.12183541867814891, 'bull_strategy': 'mean_reversion', 'bull_bb_std_mult': 1.4677755106613342, 'bull_rsi_os': 14, 'bull_rsi_ob': 58, 'bull_adx_thresh': 30.269042319365223, 'bull_atr_min_pct': 0.023077799784517683, 'bull_atr_max_pct': 0.1354730669071024, 'bull_tp_mult': 2.18100671850773, 'bull_tsl_mult': 0.15865451867453495, 'bull_time_stop': 80, 'bull_use_sma': True, 'bull_use_ema': False, 'bull_use_atr': False, 'bull_use_adx': False, 'bull_use_spike': False, 'bull_rsi_required': False, 'bear_strategy': 'breakout', 'bear_bb_std_mult': 2.8757398599695723, 'bear_rsi_os': 29, 'bear_rsi_ob': 79, 'bear_adx_thresh': 21.41035568671487, 'bear_atr_min_pct': 0.008926716770825436, 'bear_atr_max_pct': 0.12716377872000506, 'bear_tp_mult': 2.022094159081935, 'bear_tsl_mult': 0.44816867686443695, 'bear_time_stop': 278, 'bear_use_sma': False, 'bear_use_ema': True, 'bear_use_atr': False, 'bear_use_adx': False, 'bear_use_spike': True, 'bear_rsi_required': True, 'sideways_strategy': 'breakout', 'sideways_bb_std_mult': 2.7444748516625035, 'sideways_rsi_os': 26, 'sideways_rsi_ob': 93, 'sideways_adx_thresh': 29.747095472448642, 'sideways_atr_min_pct': 0.0009946464238471144, 'sideways_atr_max_pct': 0.09983393556875471, 'sideways_tp_mult': 2.8289135774308463, 'sideways_tsl_mult': 0.07438371087449813, 'sideways_time_stop': 222, 'sideways_use_sma': True, 'sideways_use_ema': False, 'sideways_use_atr': False, 'sideways_use_adx': False, 'sideways_use_spike': True, 'sideways_rsi_required': False}.
[I 2025-08-31 11:05:15,871] Trial 810 finished with values: [-1000000000.0, 1000000000.0] and parameters: {'p_sma': 25, 'p_std': 55, 'p_atr': 26, 'p_adx': 24, 'rsi_period': 24, 'ema1': 7, 'ema2': 39, 'slip_atr_k': 0.17112839396536705, 'slip_spread_k': 0.8868260325282591, 'spread_hl_frac': 0.012221404008597244, 'bb_std_mult': 1.9269176999588005, 'rsi_os': 35, 'rsi_ob': 90, 'vol_spike': 0.29356387021737657, 'adx_thresh': 24.61269349241778, 'atr_min_pct': 0.011971825560715164, 'atr_max_pct': 0.026981551405368974, 'tp_mult': 2.9504055304569, 'tsl_mult': 0.04787686149281584, 'strategy': 'mean_reversion', 'time_stop': 42, 'use_sma': False, 'use_atr': False, 'use_adx': False, 'use_ema': False, 'use_spike': True, 'rsi_required': True, 'edge_k': 1.889787650440149, 'edge_cap': 0.8252535401674725, 'bull_strategy': 'mean_reversion', 'bull_bb_std_mult': 1.177991800444197, 'bull_rsi_os': 24, 'bull_rsi_ob': 64, 'bull_adx_thresh': 14.27947543101568, 'bull_atr_min_pct': 0.0060114636984033906, 'bull_atr_max_pct': 0.09380652443579846, 'bull_tp_mult': 2.294146276120508, 'bull_tsl_mult': 0.9994242463021915, 'bull_time_stop': 101, 'bull_use_sma': False, 'bull_use_ema': True, 'bull_use_atr': False, 'bull_use_adx': False, 'bull_use_spike': False, 'bull_rsi_required': True, 'bear_strategy': 'breakout', 'bear_bb_std_mult': 1.696343217409366, 'bear_rsi_os': 28, 'bear_rsi_ob': 77, 'bear_adx_thresh': 9.32754599963332, 'bear_atr_min_pct': 0.006338986043820424, 'bear_atr_max_pct': 0.10749342282809925, 'bear_tp_mult': 1.27986587930023, 'bear_tsl_mult': 0.05085717377452875, 'bear_time_stop': 249, 'bear_use_sma': True, 'bear_use_ema': False, 'bear_use_atr': True, 'bear_use_adx': True, 'bear_use_spike': False, 'bear_rsi_required': True, 'sideways_strategy': 'mean_reversion', 'sideways_bb_std_mult': 0.8454304985996357, 'sideways_rsi_os': 25, 'sideways_rsi_ob': 95, 'sideways_adx_thresh': 28.701409025115346, 'sideways_atr_min_pct': 0.0018282084190553453, 'sideways_atr_max_pct': 0.06917434951216873, 'sideways_tp_mult': 2.930977766450049, 'sideways_tsl_mult': 0.5279337207173577, 'sideways_time_stop': 174, 'sideways_use_sma': False, 'sideways_use_ema': True, 'sideways_use_atr': False, 'sideways_use_adx': True, 'sideways_use_spike': False, 'sideways_rsi_required': True}.
[I 2025-08-31 11:05:16,148] Trial 807 finished with values: [-1000000000.0, 1000000000.0] and parameters: {'p_sma': 36, 'p_std': 49, 'p_atr': 29, 'p_adx': 25, 'rsi_period': 81, 'ema1': 16, 'ema2': 50, 'slip_atr_k': 0.019092069674911102, 'slip_spread_k': 0.13545303814184673, 'spread_hl_frac': 0.009201995266286726, 'bb_std_mult': 1.2381761965194467, 'rsi_os': 45, 'rsi_ob': 84, 'vol_spike': 0.28372599193880643, 'adx_thresh': 22.857188265155735, 'atr_min_pct': 0.005747310733550864, 'atr_max_pct': 0.128748886682461, 'tp_mult': 2.9653785631211056, 'tsl_mult': 0.6731269112399554, 'strategy': 'mean_reversion', 'time_stop': 133, 'use_sma': False, 'use_atr': False, 'use_adx': False, 'use_ema': True, 'use_spike': False, 'rsi_required': True, 'edge_k': 1.456398921498512, 'edge_cap': 0.12289682256799603, 'bull_strategy': 'mean_reversion', 'bull_bb_std_mult': 1.1725905927375346, 'bull_rsi_os': 24, 'bull_rsi_ob': 55, 'bull_adx_thresh': 29.24645749720619, 'bull_atr_min_pct': 0.004523871815397628, 'bull_atr_max_pct': 0.0931200255514313, 'bull_tp_mult': 2.2857906001235038, 'bull_tsl_mult': 0.9992636131355905, 'bull_time_stop': 206, 'bull_use_sma': True, 'bull_use_ema': False, 'bull_use_atr': False, 'bull_use_adx': False, 'bull_use_spike': False, 'bull_rsi_required': True, 'bear_strategy': 'breakout', 'bear_bb_std_mult': 1.8140518328824318, 'bear_rsi_os': 39, 'bear_rsi_ob': 85, 'bear_adx_thresh': 21.52112922247459, 'bear_atr_min_pct': 0.01441821458214828, 'bear_atr_max_pct': 0.10264356588725199, 'bear_tp_mult': 1.6364292047613758, 'bear_tsl_mult': 0.44945688357253893, 'bear_time_stop': 186, 'bear_use_sma': False, 'bear_use_ema': True, 'bear_use_atr': False, 'bear_use_adx': False, 'bear_use_spike': False, 'bear_rsi_required': True, 'sideways_strategy': 'breakout', 'sideways_bb_std_mult': 0.8402834544092476, 'sideways_rsi_os': 19, 'sideways_rsi_ob': 92, 'sideways_adx_thresh': 29.765161760602965, 'sideways_atr_min_pct': 0.001761563724458192, 'sideways_atr_max_pct': 0.09731037080270809, 'sideways_tp_mult': 1.1753044743426786, 'sideways_tsl_mult': 0.18889921565848727, 'sideways_time_stop': 221, 'sideways_use_sma': True, 'sideways_use_ema': False, 'sideways_use_atr': False, 'sideways_use_adx': False, 'sideways_use_spike': True, 'sideways_rsi_required': False}.
[I 2025-08-31 11:05:16,301] Trial 809 finished with values: [-0.039658716808646965, 0.03923606873172211] and parameters: {'p_sma': 54, 'p_std': 46, 'p_atr': 29, 'p_adx': 14, 'rsi_period': 25, 'ema1': 29, 'ema2': 39, 'slip_atr_k': 0.20547253813551578, 'slip_spread_k': 0.13206287445931386, 'spread_hl_frac': 0.01215858785582202, 'bb_std_mult': 0.6260901726403985, 'rsi_os': 43, 'rsi_ob': 60, 'vol_spike': 0.017540412293239355, 'adx_thresh': 24.499462564666864, 'atr_min_pct': 0.013364190396812761, 'atr_max_pct': 0.1291956974362719, 'tp_mult': 2.96939218710276, 'tsl_mult': 0.07736964157657104, 'strategy': 'mean_reversion', 'time_stop': 300, 'use_sma': False, 'use_atr': False, 'use_adx': False, 'use_ema': True, 'use_spike': False, 'rsi_required': True, 'edge_k': 1.9223963953197556, 'edge_cap': 0.8339565256124871, 'bull_strategy': 'mean_reversion', 'bull_bb_std_mult': 2.627860142165108, 'bull_rsi_os': 24, 'bull_rsi_ob': 64, 'bull_adx_thresh': 14.18598798731669, 'bull_atr_min_pct': 0.004462737323511063, 'bull_atr_max_pct': 0.10160824010580603, 'bull_tp_mult': 2.3002940680813055, 'bull_tsl_mult': 0.43766822182388526, 'bull_time_stop': 58, 'bull_use_sma': True, 'bull_use_ema': False, 'bull_use_atr': False, 'bull_use_adx': False, 'bull_use_spike': False, 'bull_rsi_required': True, 'bear_strategy': 'breakout', 'bear_bb_std_mult': 2.9180916646479362, 'bear_rsi_os': 29, 'bear_rsi_ob': 84, 'bear_adx_thresh': 13.032936942008142, 'bear_atr_min_pct': 0.0016865094250837973, 'bear_atr_max_pct': 0.10769794885870901, 'bear_tp_mult': 2.0349000876874888, 'bear_tsl_mult': 0.4496430673802623, 'bear_time_stop': 289, 'bear_use_sma': False, 'bear_use_ema': False, 'bear_use_atr': False, 'bear_use_adx': True, 'bear_use_spike': False, 'bear_rsi_required': True, 'sideways_strategy': 'mean_reversion', 'sideways_bb_std_mult': 0.8588540251882527, 'sideways_rsi_os': 25, 'sideways_rsi_ob': 95, 'sideways_adx_thresh': 25.660726505768046, 'sideways_atr_min_pct': 0.023935399253861952, 'sideways_atr_max_pct': 0.06996132286904129, 'sideways_tp_mult': 1.1921418296565416, 'sideways_tsl_mult': 0.8375238932687545, 'sideways_time_stop': 230, 'sideways_use_sma': True, 'sideways_use_ema': True, 'sideways_use_atr': False, 'sideways_use_adx': False, 'sideways_use_spike': True, 'sideways_rsi_required': True}.
