[I 2025-08-31 10:35:02,543] Trial 587 finished with values: [-1000000000.0, 1000000000.0] and parameters: {'p_sma': 13, 'p_std': 35, 'p_atr': 29, 'p_adx': 10, 'rsi_period': 21, 'ema1': 6, 'ema2': 39, 'slip_atr_k': 0.17432446901076087, 'slip_spread_k': 0.22737062729077379, 'spread_hl_frac': 0.009655196592415864, 'bb_std_mult': 2.963281365628533, 'rsi_os': 42, 'rsi_ob': 88, 'vol_spike': 0.29530184945860816, 'adx_thresh': 27.891971124133427, 'atr_min_pct': 0.02809738839562314, 'atr_max_pct': 0.07672250649369503, 'tp_mult': 2.8463056939957765, 'tsl_mult': 0.9114985465779376, 'strategy': 'breakout', 'time_stop': 221, 'use_sma': False, 'use_atr': False, 'use_adx': True, 'use_ema': True, 'use_spike': False, 'rsi_required': True, 'edge_k': 1.9433571071702989, 'edge_cap': 0.1237372334518509, 'bull_strategy': 'mean_reversion', 'bull_bb_std_mult': 1.0900071509448173, 'bull_rsi_os': 44, 'bull_rsi_ob': 66, 'bull_adx_thresh': 30.52205272328087, 'bull_atr_min_pct': 0.02653689217975474, 'bull_atr_max_pct': 0.08221757380506112, 'bull_tp_mult': 2.2690672178405125, 'bull_tsl_mult': 0.979033567816448, 'bull_time_stop': 73, 'bull_use_sma': True, 'bull_use_ema': False, 'bull_use_atr': False, 'bull_use_adx': True, 'bull_use_spike': False, 'bull_rsi_required': True, 'bear_strategy': 'breakout', 'bear_bb_std_mult': 2.823757689362487, 'bear_rsi_os': 35, 'bear_rsi_ob': 56, 'bear_adx_thresh': 20.740295370935417, 'bear_atr_min_pct': 0.01466467399992913, 'bear_atr_max_pct': 0.09704076972486514, 'bear_tp_mult': 2.0430601119688125, 'bear_tsl_mult': 0.9225140336317171, 'bear_time_stop': 105, 'bear_use_sma': False, 'bear_use_ema': True, 'bear_use_atr': True, 'bear_use_adx': True, 'bear_use_spike': True, 'bear_rsi_required': True, 'sideways_strategy': 'breakout', 'sideways_bb_std_mult': 0.8693293707913348, 'sideways_rsi_os': 24, 'sideways_rsi_ob': 95, 'sideways_adx_thresh': 29.229154040758893, 'sideways_atr_min_pct': 0.0057419144314106215, 'sideways_atr_max_pct': 0.101944399932758, 'sideways_tp_mult': 2.8981130131249864, 'sideways_tsl_mult': 0.388245055870708, 'sideways_time_stop': 213, 'sideways_use_sma': False, 'sideways_use_ema': False, 'sideways_use_atr': False, 'sideways_use_adx': True, 'sideways_use_spike': True, 'sideways_rsi_required': False}.
[I 2025-08-31 10:35:03,184] Trial 588 finished with values: [-1000000000.0, 1000000000.0] and parameters: {'p_sma': 13, 'p_std': 58, 'p_atr': 19, 'p_adx': 15, 'rsi_period': 49, 'ema1': 19, 'ema2': 44, 'slip_atr_k': 0.17417864267787764, 'slip_spread_k': 0.11755408393016209, 'spread_hl_frac': 0.01012631583923817, 'bb_std_mult': 1.2069046957695801, 'rsi_os': 38, 'rsi_ob': 77, 'vol_spike': 0.2940628014594746, 'adx_thresh': 20.06545188317587, 'atr_min_pct': 0.020767716322901905, 'atr_max_pct': 0.12298426659197927, 'tp_mult': 1.1742142134835727, 'tsl_mult': 0.07280957123642515, 'strategy': 'breakout', 'time_stop': 150, 'use_sma': True, 'use_atr': False, 'use_adx': True, 'use_ema': True, 'use_spike': False, 'rsi_required': True, 'edge_k': 0.6691747968946251, 'edge_cap': 0.11277095700898224, 'bull_strategy': 'breakout', 'bull_bb_std_mult': 1.2298670460293244, 'bull_rsi_os': 45, 'bull_rsi_ob': 92, 'bull_adx_thresh': 30.325973798385633, 'bull_atr_min_pct': 0.005449491490407353, 'bull_atr_max_pct': 0.08147878167548198, 'bull_tp_mult': 1.8046934726925052, 'bull_tsl_mult': 0.9797301812677942, 'bull_time_stop': 71, 'bull_use_sma': True, 'bull_use_ema': False, 'bull_use_atr': False, 'bull_use_adx': True, 'bull_use_spike': False, 'bull_rsi_required': True, 'bear_strategy': 'breakout', 'bear_bb_std_mult': 2.9002960482754867, 'bear_rsi_os': 44, 'bear_rsi_ob': 75, 'bear_adx_thresh': 23.095880846190795, 'bear_atr_min_pct': 0.007564175689148024, 'bear_atr_max_pct': 0.11545066916340099, 'bear_tp_mult': 2.0830506954682853, 'bear_tsl_mult': 0.2512676756173362, 'bear_time_stop': 144, 'bear_use_sma': False, 'bear_use_ema': True, 'bear_use_atr': True, 'bear_use_adx': True, 'bear_use_spike': True, 'bear_rsi_required': True, 'sideways_strategy': 'breakout', 'sideways_bb_std_mult': 0.979187954997505, 'sideways_rsi_os': 32, 'sideways_rsi_ob': 54, 'sideways_adx_thresh': 29.20984105191631, 'sideways_atr_min_pct': 0.013009711526935638, 'sideways_atr_max_pct': 0.09845530537223508, 'sideways_tp_mult': 2.230922019140708, 'sideways_tsl_mult': 0.03996868162069181, 'sideways_time_stop': 207, 'sideways_use_sma': False, 'sideways_use_ema': False, 'sideways_use_atr': False, 'sideways_use_adx': True, 'sideways_use_spike': True, 'sideways_rsi_required': False}.
[I 2025-08-31 10:35:03,184] Trial 586 finished with values: [-0.07068444576826971, 0.07053662567134347] and parameters: {'p_sma': 27, 'p_std': 47, 'p_atr': 19, 'p_adx': 21, 'rsi_period': 22, 'ema1': 18, 'ema2': 40, 'slip_atr_k': 0.20656648581393616, 'slip_spread_k': 0.14958169408065364, 'spread_hl_frac': 0.009106334241801944, 'bb_std_mult': 1.8048444834063473, 'rsi_os': 42, 'rsi_ob': 83, 'vol_spike': 0.293607974432366, 'adx_thresh': 22.38084115990164, 'atr_min_pct': 0.028072265716482997, 'atr_max_pct': 0.05347781494098629, 'tp_mult': 2.842176611332206, 'tsl_mult': 0.09495801490026964, 'strategy': 'breakout', 'time_stop': 151, 'use_sma': False, 'use_atr': False, 'use_adx': False, 'use_ema': True, 'use_spike': False, 'rsi_required': True, 'edge_k': 0.8256187092573369, 'edge_cap': 0.25314041768812306, 'bull_strategy': 'mean_reversion', 'bull_bb_std_mult': 3.342394234283498, 'bull_rsi_os': 38, 'bull_rsi_ob': 92, 'bull_adx_thresh': 30.235433035926018, 'bull_atr_min_pct': 0.005573076948173295, 'bull_atr_max_pct': 0.08157377639262697, 'bull_tp_mult': 2.2717706273004197, 'bull_tsl_mult': 0.9760150157306282, 'bull_time_stop': 71, 'bull_use_sma': True, 'bull_use_ema': False, 'bull_use_atr': False, 'bull_use_adx': False, 'bull_use_spike': False, 'bull_rsi_required': True, 'bear_strategy': 'breakout', 'bear_bb_std_mult': 2.8384983511339112, 'bear_rsi_os': 28, 'bear_rsi_ob': 48, 'bear_adx_thresh': 33.3838742866134, 'bear_atr_min_pct': 0.0075149841261527486, 'bear_atr_max_pct': 0.10565751672711692, 'bear_tp_mult': 2.0344550098447596, 'bear_tsl_mult': 0.6500804454029956, 'bear_time_stop': 213, 'bear_use_sma': False, 'bear_use_ema': True, 'bear_use_atr': False, 'bear_use_adx': True, 'bear_use_spike': True, 'bear_rsi_required': True, 'sideways_strategy': 'breakout', 'sideways_bb_std_mult': 0.8515988150657756, 'sideways_rsi_os': 32, 'sideways_rsi_ob': 95, 'sideways_adx_thresh': 29.22016631589942, 'sideways_atr_min_pct': 0.0004433674124311095, 'sideways_atr_max_pct': 0.10091434757883103, 'sideways_tp_mult': 2.997585614118697, 'sideways_tsl_mult': 0.9475716542402451, 'sideways_time_stop': 208, 'sideways_use_sma': True, 'sideways_use_ema': False, 'sideways_use_atr': False, 'sideways_use_adx': False, 'sideways_use_spike': True, 'sideways_rsi_required': False}.
[I 2025-08-31 10:35:03,461] Trial 585 finished with values: [-1000000000.0, 1000000000.0] and parameters: {'p_sma': 13, 'p_std': 47, 'p_atr': 19, 'p_adx': 9, 'rsi_period': 39, 'ema1': 19, 'ema2': 25, 'slip_atr_k': 0.19140169373285285, 'slip_spread_k': 0.6570904994586975, 'spread_hl_frac': 0.008717790004970288, 'bb_std_mult': 1.1014730159371906, 'rsi_os': 41, 'rsi_ob': 83, 'vol_spike': 0.2930962804308655, 'adx_thresh': 33.691561033763016, 'atr_min_pct': 0.021159383571944933, 'atr_max_pct': 0.11657233476933547, 'tp_mult': 2.84908313358205, 'tsl_mult': 0.7839861834713189, 'strategy': 'breakout', 'time_stop': 138, 'use_sma': False, 'use_atr': False, 'use_adx': False, 'use_ema': True, 'use_spike': False, 'rsi_required': True, 'edge_k': 1.3197103090127507, 'edge_cap': 0.2570728207029227, 'bull_strategy': 'mean_reversion', 'bull_bb_std_mult': 1.0948846621888595, 'bull_rsi_os': 28, 'bull_rsi_ob': 66, 'bull_adx_thresh': 15.523538092610579, 'bull_atr_min_pct': 0.00836182938558654, 'bull_atr_max_pct': 0.08191282505803356, 'bull_tp_mult': 1.789679976476281, 'bull_tsl_mult': 0.9786285179346249, 'bull_time_stop': 70, 'bull_use_sma': False, 'bull_use_ema': False, 'bull_use_atr': False, 'bull_use_adx': False, 'bull_use_spike': False, 'bull_rsi_required': True, 'bear_strategy': 'breakout', 'bear_bb_std_mult': 1.8101714366740056, 'bear_rsi_os': 28, 'bear_rsi_ob': 48, 'bear_adx_thresh': 33.361891506413464, 'bear_atr_min_pct': 0.0060588498298098595, 'bear_atr_max_pct': 0.11872831363210525, 'bear_tp_mult': 1.9154395794296561, 'bear_tsl_mult': 0.4267644585647059, 'bear_time_stop': 33, 'bear_use_sma': True, 'bear_use_ema': True, 'bear_use_atr': False, 'bear_use_adx': False, 'bear_use_spike': True, 'bear_rsi_required': True, 'sideways_strategy': 'breakout', 'sideways_bb_std_mult': 0.88239796556953, 'sideways_rsi_os': 25, 'sideways_rsi_ob': 94, 'sideways_adx_thresh': 30.9346291903472, 'sideways_atr_min_pct': 0.012073622929012113, 'sideways_atr_max_pct': 0.11696405108485709, 'sideways_tp_mult': 2.819025944401021, 'sideways_tsl_mult': 0.06029583879169099, 'sideways_time_stop': 211, 'sideways_use_sma': True, 'sideways_use_ema': True, 'sideways_use_atr': False, 'sideways_use_adx': False, 'sideways_use_spike': True, 'sideways_rsi_required': False}.
[I 2025-08-31 10:35:36,958] Trial 592 finished with values: [-1000000000.0, 1000000000.0] and parameters: {'p_sma': 10, 'p_std': 28, 'p_atr': 26, 'p_adx': 9, 'rsi_period': 42, 'ema1': 10, 'ema2': 36, 'slip_atr_k': 0.18489182697837808, 'slip_spread_k': 0.736667962011984, 'spread_hl_frac': 0.044094399368497184, 'bb_std_mult': 1.3023815128932488, 'rsi_os': 39, 'rsi_ob': 55, 'vol_spike': 0.2857372221431734, 'adx_thresh': 22.48277385659223, 'atr_min_pct': 0.009035929121741193, 'atr_max_pct': 0.12075862298993831, 'tp_mult': 2.8815283862720946, 'tsl_mult': 0.9829913966164019, 'strategy': 'mean_reversion', 'time_stop': 123, 'use_sma': True, 'use_atr': True, 'use_adx': False, 'use_ema': True, 'use_spike': True, 'rsi_required': False, 'edge_k': 0.4279005399390733, 'edge_cap': 0.6120176785902567, 'bull_strategy': 'breakout', 'bull_bb_std_mult': 1.2939885213145812, 'bull_rsi_os': 24, 'bull_rsi_ob': 61, 'bull_adx_thresh': 10.522254718600859, 'bull_atr_min_pct': 0.006046967327397383, 'bull_atr_max_pct': 0.0872895268875762, 'bull_tp_mult': 2.17222132922101, 'bull_tsl_mult': 0.26465644404479627, 'bull_time_stop': 39, 'bull_use_sma': True, 'bull_use_ema': True, 'bull_use_atr': True, 'bull_use_adx': False, 'bull_use_spike': False, 'bull_rsi_required': False, 'bear_strategy': 'mean_reversion', 'bear_bb_std_mult': 0.8133542738210087, 'bear_rsi_os': 12, 'bear_rsi_ob': 64, 'bear_adx_thresh': 21.560383781562265, 'bear_atr_min_pct': 0.008527435177662043, 'bear_atr_max_pct': 0.1069065498807946, 'bear_tp_mult': 2.0975869730803876, 'bear_tsl_mult': 0.4724699847696442, 'bear_time_stop': 256, 'bear_use_sma': False, 'bear_use_ema': False, 'bear_use_atr': False, 'bear_use_adx': True, 'bear_use_spike': True, 'bear_rsi_required': False, 'sideways_strategy': 'mean_reversion', 'sideways_bb_std_mult': 0.765636735852364, 'sideways_rsi_os': 22, 'sideways_rsi_ob': 95, 'sideways_adx_thresh': 15.342714326109164, 'sideways_atr_min_pct': 0.01638868415197879, 'sideways_atr_max_pct': 0.1051923985332315, 'sideways_tp_mult': 1.7810329455467548, 'sideways_tsl_mult': 0.03780007133399321, 'sideways_time_stop': 232, 'sideways_use_sma': True, 'sideways_use_ema': True, 'sideways_use_atr': False, 'sideways_use_adx': False, 'sideways_use_spike': True, 'sideways_rsi_required': True}.
[I 2025-08-31 10:35:36,959] Trial 591 finished with values: [-1000000000.0, 1000000000.0] and parameters: {'p_sma': 9, 'p_std': 23, 'p_atr': 14, 'p_adx': 9, 'rsi_period': 40, 'ema1': 19, 'ema2': 32, 'slip_atr_k': 0.1855432510659242, 'slip_spread_k': 0.6983093529667108, 'spread_hl_frac': 0.01222068019714451, 'bb_std_mult': 1.3109756118373657, 'rsi_os': 10, 'rsi_ob': 81, 'vol_spike': 0.022834293629720837, 'adx_thresh': 22.791370448418935, 'atr_min_pct': 0.029966163962522607, 'atr_max_pct': 0.11829291025252558, 'tp_mult': 2.190358579297253, 'tsl_mult': 0.7804013408187174, 'strategy': 'mean_reversion', 'time_stop': 24, 'use_sma': True, 'use_atr': False, 'use_adx': False, 'use_ema': True, 'use_spike': False, 'rsi_required': True, 'edge_k': 0.4233750546783651, 'edge_cap': 0.0783184349578003, 'bull_strategy': 'breakout', 'bull_bb_std_mult': 1.2972597667918124, 'bull_rsi_os': 24, 'bull_rsi_ob': 65, 'bull_adx_thresh': 10.364912461496827, 'bull_atr_min_pct': 0.009469165030008754, 'bull_atr_max_pct': 0.07707527736281392, 'bull_tp_mult': 2.183563814720811, 'bull_tsl_mult': 0.3699419527194914, 'bull_time_stop': 39, 'bull_use_sma': True, 'bull_use_ema': False, 'bull_use_atr': True, 'bull_use_adx': False, 'bull_use_spike': False, 'bull_rsi_required': False, 'bear_strategy': 'mean_reversion', 'bear_bb_std_mult': 3.462013348412988, 'bear_rsi_os': 41, 'bear_rsi_ob': 62, 'bear_adx_thresh': 21.43977065730429, 'bear_atr_min_pct': 0.005336714553820699, 'bear_atr_max_pct': 0.05674430753179022, 'bear_tp_mult': 2.116391966757757, 'bear_tsl_mult': 0.7445250948915553, 'bear_time_stop': 255, 'bear_use_sma': False, 'bear_use_ema': False, 'bear_use_atr': False, 'bear_use_adx': True, 'bear_use_spike': True, 'bear_rsi_required': True, 'sideways_strategy': 'mean_reversion', 'sideways_bb_std_mult': 0.9378128575630249, 'sideways_rsi_os': 48, 'sideways_rsi_ob': 72, 'sideways_adx_thresh': 14.985323016835494, 'sideways_atr_min_pct': 0.014933057293920244, 'sideways_atr_max_pct': 0.10564292844237945, 'sideways_tp_mult': 2.9602227663296246, 'sideways_tsl_mult': 0.2273071487347752, 'sideways_time_stop': 156, 'sideways_use_sma': True, 'sideways_use_ema': True, 'sideways_use_atr': False, 'sideways_use_adx': False, 'sideways_use_spike': True, 'sideways_rsi_required': True}.
[I 2025-08-31 10:35:37,672] Trial 590 finished with values: [-1000000000.0, 1000000000.0] and parameters: {'p_sma': 39, 'p_std': 45, 'p_atr': 14, 'p_adx': 9, 'rsi_period': 40, 'ema1': 19, 'ema2': 25, 'slip_atr_k': 0.18515978998368463, 'slip_spread_k': 0.07345134834651576, 'spread_hl_frac': 0.012361283759914111, 'bb_std_mult': 1.1096939624157502, 'rsi_os': 10, 'rsi_ob': 81, 'vol_spike': 0.2853384030630203, 'adx_thresh': 22.584044004760557, 'atr_min_pct': 0.009331275167620142, 'atr_max_pct': 0.11793080757837286, 'tp_mult': 2.8837851171843107, 'tsl_mult': 0.9549732076644313, 'strategy': 'mean_reversion', 'time_stop': 144, 'use_sma': True, 'use_atr': False, 'use_adx': False, 'use_ema': True, 'use_spike': False, 'rsi_required': True, 'edge_k': 0.15070246414720134, 'edge_cap': 0.41171072847185275, 'bull_strategy': 'breakout', 'bull_bb_std_mult': 3.036994862782328, 'bull_rsi_os': 24, 'bull_rsi_ob': 74, 'bull_adx_thresh': 29.58654900299289, 'bull_atr_min_pct': 0.006155754697223807, 'bull_atr_max_pct': 0.0862634562798789, 'bull_tp_mult': 2.164669356737138, 'bull_tsl_mult': 0.8062589706628276, 'bull_time_stop': 207, 'bull_use_sma': True, 'bull_use_ema': False, 'bull_use_atr': True, 'bull_use_adx': False, 'bull_use_spike': False, 'bull_rsi_required': False, 'bear_strategy': 'mean_reversion', 'bear_bb_std_mult': 3.4673964163906117, 'bear_rsi_os': 29, 'bear_rsi_ob': 77, 'bear_adx_thresh': 18.42638632459609, 'bear_atr_min_pct': 0.004887843486477143, 'bear_atr_max_pct': 0.05639600781889937, 'bear_tp_mult': 2.1036771136915893, 'bear_tsl_mult': 0.46573618183474674, 'bear_time_stop': 258, 'bear_use_sma': False, 'bear_use_ema': False, 'bear_use_atr': False, 'bear_use_adx': True, 'bear_use_spike': True, 'bear_rsi_required': True, 'sideways_strategy': 'mean_reversion', 'sideways_bb_std_mult': 0.9527309363204346, 'sideways_rsi_os': 35, 'sideways_rsi_ob': 85, 'sideways_adx_thresh': 15.49255332886219, 'sideways_atr_min_pct': 0.02950457678984144, 'sideways_atr_max_pct': 0.12035768934587168, 'sideways_tp_mult': 2.9411734153131612, 'sideways_tsl_mult': 0.6906245683454025, 'sideways_time_stop': 232, 'sideways_use_sma': True, 'sideways_use_ema': True, 'sideways_use_atr': False, 'sideways_use_adx': False, 'sideways_use_spike': True, 'sideways_rsi_required': True}.
[I 2025-08-31 10:35:37,758] Trial 589 finished with values: [-1000000000.0, 1000000000.0] and parameters: {'p_sma': 10, 'p_std': 45, 'p_atr': 19, 'p_adx': 9, 'rsi_period': 49, 'ema1': 24, 'ema2': 33, 'slip_atr_k': 0.20498036649149146, 'slip_spread_k': 0.6979797464658398, 'spread_hl_frac': 0.012400075673878212, 'bb_std_mult': 1.1107026156435684, 'rsi_os': 43, 'rsi_ob': 83, 'vol_spike': 0.009437547712837002, 'adx_thresh': 10.67088668534598, 'atr_min_pct': 0.023342323012089997, 'atr_max_pct': 0.05229214997446902, 'tp_mult': 2.8740633043806496, 'tsl_mult': 0.06601694423473414, 'strategy': 'mean_reversion', 'time_stop': 121, 'use_sma': True, 'use_atr': False, 'use_adx': False, 'use_ema': True, 'use_spike': False, 'rsi_required': True, 'edge_k': 1.9966949569493702, 'edge_cap': 0.0788492647062875, 'bull_strategy': 'breakout', 'bull_bb_std_mult': 1.2220603687902247, 'bull_rsi_os': 38, 'bull_rsi_ob': 67, 'bull_adx_thresh': 15.333510051871269, 'bull_atr_min_pct': 0.0057449152986022625, 'bull_atr_max_pct': 0.08205076865282897, 'bull_tp_mult': 1.747366247159464, 'bull_tsl_mult': 0.36674674372791616, 'bull_time_stop': 184, 'bull_use_sma': True, 'bull_use_ema': False, 'bull_use_atr': False, 'bull_use_adx': False, 'bull_use_spike': False, 'bull_rsi_required': True, 'bear_strategy': 'mean_reversion', 'bear_bb_std_mult': 2.867055263063288, 'bear_rsi_os': 37, 'bear_rsi_ob': 69, 'bear_adx_thresh': 33.39885492077018, 'bear_atr_min_pct': 0.02615740579413842, 'bear_atr_max_pct': 0.05629938606440382, 'bear_tp_mult': 2.089926619590227, 'bear_tsl_mult': 0.6540883215635859, 'bear_time_stop': 255, 'bear_use_sma': False, 'bear_use_ema': True, 'bear_use_atr': False, 'bear_use_adx': True, 'bear_use_spike': True, 'bear_rsi_required': True, 'sideways_strategy': 'mean_reversion', 'sideways_bb_std_mult': 1.7768201531704226, 'sideways_rsi_os': 32, 'sideways_rsi_ob': 72, 'sideways_adx_thresh': 10.255328650069387, 'sideways_atr_min_pct': 0.012999662094883568, 'sideways_atr_max_pct': 0.10567239670701803, 'sideways_tp_mult': 1.7956751299457938, 'sideways_tsl_mult': 0.6187803520074848, 'sideways_time_stop': 90, 'sideways_use_sma': True, 'sideways_use_ema': True, 'sideways_use_atr': False, 'sideways_use_adx': False, 'sideways_use_spike': True, 'sideways_rsi_required': True}.
[I 2025-08-31 10:36:09,617] Trial 594 finished with values: [-1000000000.0, 1000000000.0] and parameters: {'p_sma': 12, 'p_std': 42, 'p_atr': 29, 'p_adx': 18, 'rsi_period': 13, 'ema1': 18, 'ema2': 49, 'slip_atr_k': 0.18010595348185732, 'slip_spread_k': 0.1275778017563776, 'spread_hl_frac': 0.011475511178288558, 'bb_std_mult': 1.195564195117933, 'rsi_os': 39, 'rsi_ob': 84, 'vol_spike': 0.08632464416140696, 'adx_thresh': 15.46685379775812, 'atr_min_pct': 0.01960493229531254, 'atr_max_pct': 0.1276238233428962, 'tp_mult': 2.0886645276134703, 'tsl_mult': 0.17700392680138005, 'strategy': 'breakout', 'time_stop': 147, 'use_sma': False, 'use_atr': False, 'use_adx': False, 'use_ema': True, 'use_spike': False, 'rsi_required': True, 'edge_k': 1.5670322311464453, 'edge_cap': 0.8296598891700098, 'bull_strategy': 'mean_reversion', 'bull_bb_std_mult': 1.2042003591117583, 'bull_rsi_os': 25, 'bull_rsi_ob': 67, 'bull_adx_thresh': 29.12093792313264, 'bull_atr_min_pct': 0.007609937268448689, 'bull_atr_max_pct': 0.08548384191564432, 'bull_tp_mult': 2.313578598174159, 'bull_tsl_mult': 0.43753495274400367, 'bull_time_stop': 186, 'bull_use_sma': True, 'bull_use_ema': False, 'bull_use_atr': False, 'bull_use_adx': True, 'bull_use_spike': True, 'bull_rsi_required': True, 'bear_strategy': 'breakout', 'bear_bb_std_mult': 1.0403239726097113, 'bear_rsi_os': 29, 'bear_rsi_ob': 77, 'bear_adx_thresh': 15.359815288534588, 'bear_atr_min_pct': 0.02861808979611881, 'bear_atr_max_pct': 0.026207458274319237, 'bear_tp_mult': 1.4305280563509453, 'bear_tsl_mult': 0.06927865579234943, 'bear_time_stop': 22, 'bear_use_sma': False, 'bear_use_ema': True, 'bear_use_atr': True, 'bear_use_adx': True, 'bear_use_spike': True, 'bear_rsi_required': True, 'sideways_strategy': 'breakout', 'sideways_bb_std_mult': 1.023614271570823, 'sideways_rsi_os': 12, 'sideways_rsi_ob': 78, 'sideways_adx_thresh': 20.64515152303973, 'sideways_atr_min_pct': 0.0012404374237231536, 'sideways_atr_max_pct': 0.09318238129670542, 'sideways_tp_mult': 2.936649639716692, 'sideways_tsl_mult': 0.019044670011572833, 'sideways_time_stop': 223, 'sideways_use_sma': False, 'sideways_use_ema': True, 'sideways_use_atr': True, 'sideways_use_adx': True, 'sideways_use_spike': True, 'sideways_rsi_required': False}.
