[I 2025-08-31 09:34:42,395] Trial 114 finished with values: [-1000000000.0, 1000000000.0] and parameters: {'p_sma': 34, 'p_std': 14, 'p_atr': 16, 'p_adx': 26, 'rsi_period': 43, 'ema1': 11, 'ema2': 30, 'slip_atr_k': 0.10184022951099957, 'slip_spread_k': 0.5323778996457277, 'spread_hl_frac': 0.03590389789728731, 'bb_std_mult': 2.944500597402027, 'rsi_os': 12, 'rsi_ob': 48, 'vol_spike': 0.1562018614536612, 'adx_thresh': 8.433117674408582, 'atr_min_pct': 0.015139497986291533, 'atr_max_pct': 0.11717048504399413, 'tp_mult': 1.314825004086154, 'tsl_mult': 0.058509999892018015, 'strategy': 'breakout', 'time_stop': 183, 'use_sma': True, 'use_atr': False, 'use_adx': False, 'use_ema': True, 'use_spike': True, 'rsi_required': True, 'edge_k': 1.820266816521458, 'edge_cap': 0.37078054900317653, 'bull_strategy': 'breakout', 'bull_bb_std_mult': 2.2365422475785204, 'bull_rsi_os': 11, 'bull_rsi_ob': 80, 'bull_adx_thresh': 31.345506983019376, 'bull_atr_min_pct': 0.0014655212334274588, 'bull_atr_max_pct': 0.061170112860272685, 'bull_tp_mult': 2.701803863470629, 'bull_tsl_mult': 0.9619882303652445, 'bull_time_stop': 256, 'bull_use_sma': True, 'bull_use_ema': False, 'bull_use_atr': True, 'bull_use_adx': False, 'bull_use_spike': False, 'bull_rsi_required': True, 'bear_strategy': 'breakout', 'bear_bb_std_mult': 2.9123598163572435, 'bear_rsi_os': 54, 'bear_rsi_ob': 76, 'bear_adx_thresh': 6.3483078028044915, 'bear_atr_min_pct': 0.008004279686481052, 'bear_atr_max_pct': 0.04070264079985115, 'bear_tp_mult': 2.5202624501508604, 'bear_tsl_mult': 0.5524201602308496, 'bear_time_stop': 40, 'bear_use_sma': False, 'bear_use_ema': False, 'bear_use_atr': False, 'bear_use_adx': True, 'bear_use_spike': False, 'bear_rsi_required': False, 'sideways_strategy': 'breakout', 'sideways_bb_std_mult': 3.576367343274101, 'sideways_rsi_os': 22, 'sideways_rsi_ob': 92, 'sideways_adx_thresh': 24.92323071417885, 'sideways_atr_min_pct': 0.01076652944624712, 'sideways_atr_max_pct': 0.0382417635121072, 'sideways_tp_mult': 1.1785965603435118, 'sideways_tsl_mult': 0.8817208423638501, 'sideways_time_stop': 17, 'sideways_use_sma': True, 'sideways_use_ema': True, 'sideways_use_atr': False, 'sideways_use_adx': False, 'sideways_use_spike': True, 'sideways_rsi_required': False}.
[I 2025-08-31 09:35:18,551] Trial 119 finished with values: [-0.11609704588591863, 0.11571932744553004] and parameters: {'p_sma': 16, 'p_std': 10, 'p_atr': 26, 'p_adx': 7, 'rsi_period': 20, 'ema1': 8, 'ema2': 57, 'slip_atr_k': 0.1515325941525407, 'slip_spread_k': 0.36798980373436774, 'spread_hl_frac': 0.02754984087461966, 'bb_std_mult': 3.4536583114193364, 'rsi_os': 26, 'rsi_ob': 49, 'vol_spike': 0.12662270931268332, 'adx_thresh': 10.063733270942512, 'atr_min_pct': 0.023521125170538545, 'atr_max_pct': 0.11616314718514971, 'tp_mult': 1.116046030394613, 'tsl_mult': 0.05413217851815183, 'strategy': 'breakout', 'time_stop': 76, 'use_sma': True, 'use_atr': True, 'use_adx': False, 'use_ema': True, 'use_spike': True, 'rsi_required': True, 'edge_k': 1.619801871525591, 'edge_cap': 0.08346003840329838, 'bull_strategy': 'breakout', 'bull_bb_std_mult': 2.281043241295196, 'bull_rsi_os': 24, 'bull_rsi_ob': 56, 'bull_adx_thresh': 29.45072818853769, 'bull_atr_min_pct': 0.019604320650036592, 'bull_atr_max_pct': 0.1118318276882992, 'bull_tp_mult': 1.0735322244992416, 'bull_tsl_mult': 0.6721986475717783, 'bull_time_stop': 66, 'bull_use_sma': True, 'bull_use_ema': False, 'bull_use_atr': True, 'bull_use_adx': False, 'bull_use_spike': False, 'bull_rsi_required': True, 'bear_strategy': 'breakout', 'bear_bb_std_mult': 2.7920220727550227, 'bear_rsi_os': 55, 'bear_rsi_ob': 76, 'bear_adx_thresh': 19.203086156931636, 'bear_atr_min_pct': 0.001494978280496096, 'bear_atr_max_pct': 0.0594388432830701, 'bear_tp_mult': 1.84730906856693, 'bear_tsl_mult': 0.0029251420570822195, 'bear_time_stop': 6, 'bear_use_sma': False, 'bear_use_ema': False, 'bear_use_atr': False, 'bear_use_adx': False, 'bear_use_spike': True, 'bear_rsi_required': False, 'sideways_strategy': 'breakout', 'sideways_bb_std_mult': 1.798521419957285, 'sideways_rsi_os': 12, 'sideways_rsi_ob': 66, 'sideways_adx_thresh': 16.127927760415538, 'sideways_atr_min_pct': 0.0221343040002861, 'sideways_atr_max_pct': 0.1275072662904192, 'sideways_tp_mult': 1.667300248230139, 'sideways_tsl_mult': 0.4956136886619134, 'sideways_time_stop': 274, 'sideways_use_sma': True, 'sideways_use_ema': True, 'sideways_use_atr': False, 'sideways_use_adx': False, 'sideways_use_spike': True, 'sideways_rsi_required': False}.
[I 2025-08-31 09:35:19,285] Trial 121 finished with values: [-0.021514430499677828, 0.021579510270132017] and parameters: {'p_sma': 57, 'p_std': 34, 'p_atr': 26, 'p_adx': 7, 'rsi_period': 47, 'ema1': 8, 'ema2': 49, 'slip_atr_k': 0.012040308324999222, 'slip_spread_k': 0.35939877079970567, 'spread_hl_frac': 0.018104960039030605, 'bb_std_mult': 3.1051997897592774, 'rsi_os': 27, 'rsi_ob': 71, 'vol_spike': 0.1640070584665651, 'adx_thresh': 6.905487250759096, 'atr_min_pct': 0.01709060107883944, 'atr_max_pct': 0.1283776804099921, 'tp_mult': 1.135392553669701, 'tsl_mult': 0.7274502123453892, 'strategy': 'breakout', 'time_stop': 82, 'use_sma': True, 'use_atr': True, 'use_adx': False, 'use_ema': True, 'use_spike': False, 'rsi_required': False, 'edge_k': 1.6167506339951832, 'edge_cap': 0.09201459037300204, 'bull_strategy': 'breakout', 'bull_bb_std_mult': 1.5936970486779802, 'bull_rsi_os': 39, 'bull_rsi_ob': 71, 'bull_adx_thresh': 29.897630520755357, 'bull_atr_min_pct': 0.019477356439506856, 'bull_atr_max_pct': 0.11169108974123604, 'bull_tp_mult': 1.4122026346337693, 'bull_tsl_mult': 0.49897984721711525, 'bull_time_stop': 210, 'bull_use_sma': True, 'bull_use_ema': False, 'bull_use_atr': True, 'bull_use_adx': False, 'bull_use_spike': True, 'bull_rsi_required': True, 'bear_strategy': 'breakout', 'bear_bb_std_mult': 2.75604174416711, 'bear_rsi_os': 9, 'bear_rsi_ob': 80, 'bear_adx_thresh': 5.1604540622760116, 'bear_atr_min_pct': 0.028167875068877794, 'bear_atr_max_pct': 0.1069618094601216, 'bear_tp_mult': 1.8318671388516692, 'bear_tsl_mult': 0.28543177980839235, 'bear_time_stop': 5, 'bear_use_sma': False, 'bear_use_ema': True, 'bear_use_atr': False, 'bear_use_adx': False, 'bear_use_spike': True, 'bear_rsi_required': False, 'sideways_strategy': 'breakout', 'sideways_bb_std_mult': 3.4473383681203886, 'sideways_rsi_os': 53, 'sideways_rsi_ob': 66, 'sideways_adx_thresh': 15.638047756399684, 'sideways_atr_min_pct': 0.002495600173141061, 'sideways_atr_max_pct': 0.08062472768307172, 'sideways_tp_mult': 1.2570427927808305, 'sideways_tsl_mult': 0.2667810698641674, 'sideways_time_stop': 28, 'sideways_use_sma': True, 'sideways_use_ema': True, 'sideways_use_atr': True, 'sideways_use_adx': True, 'sideways_use_spike': True, 'sideways_rsi_required': False}.
[I 2025-08-31 09:35:19,290] Trial 118 finished with values: [-1000000000.0, 1000000000.0] and parameters: {'p_sma': 16, 'p_std': 10, 'p_atr': 7, 'p_adx': 7, 'rsi_period': 41, 'ema1': 8, 'ema2': 49, 'slip_atr_k': 0.01162768114747479, 'slip_spread_k': 0.5295401296767633, 'spread_hl_frac': 0.03529626379981629, 'bb_std_mult': 2.645212974455958, 'rsi_os': 45, 'rsi_ob': 48, 'vol_spike': 0.1661517323075366, 'adx_thresh': 10.047892798820463, 'atr_min_pct': 0.017919997007090693, 'atr_max_pct': 0.10645089047215466, 'tp_mult': 1.1072520042309915, 'tsl_mult': 0.061858868430212086, 'strategy': 'breakout', 'time_stop': 186, 'use_sma': True, 'use_atr': True, 'use_adx': False, 'use_ema': True, 'use_spike': True, 'rsi_required': True, 'edge_k': 1.6613635295457188, 'edge_cap': 0.3648737197797003, 'bull_strategy': 'breakout', 'bull_bb_std_mult': 2.775144807448937, 'bull_rsi_os': 17, 'bull_rsi_ob': 70, 'bull_adx_thresh': 29.439077249281006, 'bull_atr_min_pct': 0.00882023483729914, 'bull_atr_max_pct': 0.11220845791416427, 'bull_tp_mult': 2.7132028798614423, 'bull_tsl_mult': 0.4961432951836092, 'bull_time_stop': 250, 'bull_use_sma': True, 'bull_use_ema': False, 'bull_use_atr': True, 'bull_use_adx': False, 'bull_use_spike': False, 'bull_rsi_required': True, 'bear_strategy': 'breakout', 'bear_bb_std_mult': 2.770584086723349, 'bear_rsi_os': 55, 'bear_rsi_ob': 76, 'bear_adx_thresh': 5.2272445731111645, 'bear_atr_min_pct': 0.023007495369440946, 'bear_atr_max_pct': 0.14293880131859535, 'bear_tp_mult': 1.8429307714068934, 'bear_tsl_mult': 0.08955294214137505, 'bear_time_stop': 12, 'bear_use_sma': False, 'bear_use_ema': False, 'bear_use_atr': False, 'bear_use_adx': True, 'bear_use_spike': True, 'bear_rsi_required': False, 'sideways_strategy': 'breakout', 'sideways_bb_std_mult': 3.4497219578913945, 'sideways_rsi_os': 22, 'sideways_rsi_ob': 66, 'sideways_adx_thresh': 18.934568185582286, 'sideways_atr_min_pct': 0.010390450610655827, 'sideways_atr_max_pct': 0.12908081197705548, 'sideways_tp_mult': 1.900437555758836, 'sideways_tsl_mult': 0.25730753424291775, 'sideways_time_stop': 10, 'sideways_use_sma': True, 'sideways_use_ema': True, 'sideways_use_atr': False, 'sideways_use_adx': False, 'sideways_use_spike': True, 'sideways_rsi_required': False}.
[I 2025-08-31 09:35:19,403] Trial 120 finished with values: [-1000000000.0, 1000000000.0] and parameters: {'p_sma': 56, 'p_std': 10, 'p_atr': 7, 'p_adx': 7, 'rsi_period': 42, 'ema1': 9, 'ema2': 49, 'slip_atr_k': 0.10345262342913443, 'slip_spread_k': 0.5330918880527956, 'spread_hl_frac': 0.017309839135369244, 'bb_std_mult': 3.081683740278435, 'rsi_os': 17, 'rsi_ob': 86, 'vol_spike': 0.11865890797394259, 'adx_thresh': 6.775987470628951, 'atr_min_pct': 0.008071856515627928, 'atr_max_pct': 0.12114124901045675, 'tp_mult': 1.1257392447538799, 'tsl_mult': 0.7118240361070416, 'strategy': 'breakout', 'time_stop': 115, 'use_sma': True, 'use_atr': True, 'use_adx': False, 'use_ema': True, 'use_spike': False, 'rsi_required': False, 'edge_k': 0.27022038129578063, 'edge_cap': 0.5382998865706692, 'bull_strategy': 'breakout', 'bull_bb_std_mult': 3.599412645809561, 'bull_rsi_os': 24, 'bull_rsi_ob': 57, 'bull_adx_thresh': 29.429249362323155, 'bull_atr_min_pct': 0.01950937460330052, 'bull_atr_max_pct': 0.11273866725822959, 'bull_tp_mult': 1.440600291234373, 'bull_tsl_mult': 0.23860252803556725, 'bull_time_stop': 210, 'bull_use_sma': True, 'bull_use_ema': False, 'bull_use_atr': True, 'bull_use_adx': False, 'bull_use_spike': False, 'bull_rsi_required': True, 'bear_strategy': 'breakout', 'bear_bb_std_mult': 2.7801441224079633, 'bear_rsi_os': 55, 'bear_rsi_ob': 76, 'bear_adx_thresh': 5.155045326694804, 'bear_atr_min_pct': 0.022120732625728057, 'bear_atr_max_pct': 0.05828467880117125, 'bear_tp_mult': 2.4387202785903033, 'bear_tsl_mult': 0.09916247575340192, 'bear_time_stop': 11, 'bear_use_sma': False, 'bear_use_ema': True, 'bear_use_atr': False, 'bear_use_adx': False, 'bear_use_spike': True, 'bear_rsi_required': False, 'sideways_strategy': 'breakout', 'sideways_bb_std_mult': 2.321937161383641, 'sideways_rsi_os': 22, 'sideways_rsi_ob': 63, 'sideways_adx_thresh': 15.889703485937211, 'sideways_atr_min_pct': 0.010299204868454443, 'sideways_atr_max_pct': 0.1259306522062937, 'sideways_tp_mult': 1.625038294306718, 'sideways_tsl_mult': 0.5034548861412058, 'sideways_time_stop': 28, 'sideways_use_sma': True, 'sideways_use_ema': True, 'sideways_use_atr': False, 'sideways_use_adx': True, 'sideways_use_spike': True, 'sideways_rsi_required': False}.
[I 2025-08-31 09:35:58,767] Trial 123 finished with values: [-1000000000.0, 1000000000.0] and parameters: {'p_sma': 58, 'p_std': 7, 'p_atr': 26, 'p_adx': 7, 'rsi_period': 21, 'ema1': 7, 'ema2': 57, 'slip_atr_k': 0.08451520864709286, 'slip_spread_k': 0.35571413554099346, 'spread_hl_frac': 0.04294493608260745, 'bb_std_mult': 3.4478085847665896, 'rsi_os': 23, 'rsi_ob': 49, 'vol_spike': 0.12721197825974212, 'adx_thresh': 6.3466356514408835, 'atr_min_pct': 0.0234151771922816, 'atr_max_pct': 0.06861043817837052, 'tp_mult': 1.0677879691258996, 'tsl_mult': 0.3790360581836673, 'strategy': 'breakout', 'time_stop': 204, 'use_sma': True, 'use_atr': True, 'use_adx': True, 'use_ema': False, 'use_spike': True, 'rsi_required': True, 'edge_k': 1.611538492316802, 'edge_cap': 0.08204981682145296, 'bull_strategy': 'breakout', 'bull_bb_std_mult': 0.5099769954158373, 'bull_rsi_os': 39, 'bull_rsi_ob': 73, 'bull_adx_thresh': 30.400120870591962, 'bull_atr_min_pct': 0.022221042880255233, 'bull_atr_max_pct': 0.12276331446245142, 'bull_tp_mult': 2.9056906253654238, 'bull_tsl_mult': 0.5990485547339227, 'bull_time_stop': 197, 'bull_use_sma': True, 'bull_use_ema': False, 'bull_use_atr': False, 'bull_use_adx': False, 'bull_use_spike': True, 'bull_rsi_required': True, 'bear_strategy': 'breakout', 'bear_bb_std_mult': 2.5865353098051034, 'bear_rsi_os': 5, 'bear_rsi_ob': 82, 'bear_adx_thresh': 19.00070753559617, 'bear_atr_min_pct': 0.0012957689188190444, 'bear_atr_max_pct': 0.14679790909676, 'bear_tp_mult': 2.2304218217963396, 'bear_tsl_mult': 0.162378065649387, 'bear_time_stop': 5, 'bear_use_sma': True, 'bear_use_ema': False, 'bear_use_atr': False, 'bear_use_adx': False, 'bear_use_spike': True, 'bear_rsi_required': False, 'sideways_strategy': 'mean_reversion', 'sideways_bb_std_mult': 2.1133248755079945, 'sideways_rsi_os': 53, 'sideways_rsi_ob': 67, 'sideways_adx_thresh': 14.773159519297653, 'sideways_atr_min_pct': 0.00354913633130708, 'sideways_atr_max_pct': 0.07825523589844685, 'sideways_tp_mult': 1.697113351605989, 'sideways_tsl_mult': 0.5376119031172041, 'sideways_time_stop': 275, 'sideways_use_sma': True, 'sideways_use_ema': True, 'sideways_use_atr': True, 'sideways_use_adx': False, 'sideways_use_spike': True, 'sideways_rsi_required': True}.
[I 2025-08-31 09:35:59,031] Trial 125 finished with values: [-1000000000.0, 1000000000.0] and parameters: {'p_sma': 57, 'p_std': 32, 'p_atr': 26, 'p_adx': 7, 'rsi_period': 21, 'ema1': 7, 'ema2': 58, 'slip_atr_k': 0.08682098919954734, 'slip_spread_k': 0.09312271054415144, 'spread_hl_frac': 0.04275333900122029, 'bb_std_mult': 2.527146800674518, 'rsi_os': 22, 'rsi_ob': 78, 'vol_spike': 0.12789568764639947, 'adx_thresh': 5.296679940215298, 'atr_min_pct': 0.024192359023400486, 'atr_max_pct': 0.1302460135656608, 'tp_mult': 1.0707155377962376, 'tsl_mult': 0.5049886079192103, 'strategy': 'breakout', 'time_stop': 139, 'use_sma': True, 'use_atr': True, 'use_adx': True, 'use_ema': False, 'use_spike': True, 'rsi_required': True, 'edge_k': 1.6088813691271606, 'edge_cap': 0.0719043512642315, 'bull_strategy': 'breakout', 'bull_bb_std_mult': 2.110608026999376, 'bull_rsi_os': 31, 'bull_rsi_ob': 78, 'bull_adx_thresh': 30.34276433692085, 'bull_atr_min_pct': 0.012963790520262156, 'bull_atr_max_pct': 0.12121158785761282, 'bull_tp_mult': 2.902625041195174, 'bull_tsl_mult': 0.8362458228926027, 'bull_time_stop': 198, 'bull_use_sma': True, 'bull_use_ema': False, 'bull_use_atr': False, 'bull_use_adx': False, 'bull_use_spike': True, 'bull_rsi_required': True, 'bear_strategy': 'breakout', 'bear_bb_std_mult': 2.707056433655295, 'bear_rsi_os': 6, 'bear_rsi_ob': 80, 'bear_adx_thresh': 18.95195098566566, 'bear_atr_min_pct': 0.024312124828017465, 'bear_atr_max_pct': 0.07140348055619374, 'bear_tp_mult': 2.234478270078665, 'bear_tsl_mult': 0.00919342418352842, 'bear_time_stop': 207, 'bear_use_sma': True, 'bear_use_ema': False, 'bear_use_atr': False, 'bear_use_adx': False, 'bear_use_spike': True, 'bear_rsi_required': False, 'sideways_strategy': 'mean_reversion', 'sideways_bb_std_mult': 1.8478515686707113, 'sideways_rsi_os': 53, 'sideways_rsi_ob': 67, 'sideways_adx_thresh': 14.899137355607381, 'sideways_atr_min_pct': 0.022377120412306262, 'sideways_atr_max_pct': 0.02179389600572225, 'sideways_tp_mult': 1.5729721730669641, 'sideways_tsl_mult': 0.5423073745399958, 'sideways_time_stop': 256, 'sideways_use_sma': True, 'sideways_use_ema': True, 'sideways_use_atr': True, 'sideways_use_adx': False, 'sideways_use_spike': True, 'sideways_rsi_required': True}.
[I 2025-08-31 09:35:59,130] Trial 124 finished with values: [-1000000000.0, 1000000000.0] and parameters: {'p_sma': 39, 'p_std': 6, 'p_atr': 26, 'p_adx': 29, 'rsi_period': 20, 'ema1': 7, 'ema2': 44, 'slip_atr_k': 0.006803682719594662, 'slip_spread_k': 0.21308641419986285, 'spread_hl_frac': 0.014791796869337662, 'bb_std_mult': 0.6266599797915076, 'rsi_os': 5, 'rsi_ob': 49, 'vol_spike': 0.12775465041407713, 'adx_thresh': 5.263942936794798, 'atr_min_pct': 0.02364150919262628, 'atr_max_pct': 0.06890181236700967, 'tp_mult': 1.0476588059776046, 'tsl_mult': 0.8126441406589514, 'strategy': 'breakout', 'time_stop': 203, 'use_sma': True, 'use_atr': True, 'use_adx': True, 'use_ema': False, 'use_spike': True, 'rsi_required': True, 'edge_k': 1.5924103455361573, 'edge_cap': 0.4079491646353428, 'bull_strategy': 'breakout', 'bull_bb_std_mult': 3.5257375268440083, 'bull_rsi_os': 29, 'bull_rsi_ob': 78, 'bull_adx_thresh': 30.341736091044126, 'bull_atr_min_pct': 0.012810612817893531, 'bull_atr_max_pct': 0.12214288881505996, 'bull_tp_mult': 1.23236100471073, 'bull_tsl_mult': 0.6644329926685719, 'bull_time_stop': 237, 'bull_use_sma': True, 'bull_use_ema': False, 'bull_use_atr': False, 'bull_use_adx': False, 'bull_use_spike': True, 'bull_rsi_required': True, 'bear_strategy': 'breakout', 'bear_bb_std_mult': 2.681333480247201, 'bear_rsi_os': 9, 'bear_rsi_ob': 80, 'bear_adx_thresh': 18.786870720768963, 'bear_atr_min_pct': 0.001048526284153221, 'bear_atr_max_pct': 0.1366439825997648, 'bear_tp_mult': 2.6969640144478957, 'bear_tsl_mult': 0.5919893945748294, 'bear_time_stop': 5, 'bear_use_sma': True, 'bear_use_ema': False, 'bear_use_atr': False, 'bear_use_adx': False, 'bear_use_spike': True, 'bear_rsi_required': False, 'sideways_strategy': 'mean_reversion', 'sideways_bb_std_mult': 2.108699310742982, 'sideways_rsi_os': 53, 'sideways_rsi_ob': 66, 'sideways_adx_thresh': 14.841956379300171, 'sideways_atr_min_pct': 0.0032793176426218745, 'sideways_atr_max_pct': 0.02715043589711648, 'sideways_tp_mult': 1.569744255848182, 'sideways_tsl_mult': 0.5469886720138692, 'sideways_time_stop': 33, 'sideways_use_sma': True, 'sideways_use_ema': True, 'sideways_use_atr': True, 'sideways_use_adx': False, 'sideways_use_spike': True, 'sideways_rsi_required': True}.
[I 2025-08-31 09:35:59,283] Trial 122 finished with values: [-1000000000.0, 1000000000.0] and parameters: {'p_sma': 57, 'p_std': 7, 'p_atr': 15, 'p_adx': 7, 'rsi_period': 20, 'ema1': 8, 'ema2': 58, 'slip_atr_k': 0.04030388258535311, 'slip_spread_k': 0.025439563514686125, 'spread_hl_frac': 0.017948026187279975, 'bb_std_mult': 3.090270770449866, 'rsi_os': 21, 'rsi_ob': 77, 'vol_spike': 0.1683322920318595, 'adx_thresh': 6.614211028302851, 'atr_min_pct': 0.020302590336613906, 'atr_max_pct': 0.06843954289267876, 'tp_mult': 1.1092612100234553, 'tsl_mult': 0.4943355742386702, 'strategy': 'breakout', 'time_stop': 117, 'use_sma': True, 'use_atr': True, 'use_adx': False, 'use_ema': True, 'use_spike': False, 'rsi_required': False, 'edge_k': 1.604893772642293, 'edge_cap': 0.07756870055131804, 'bull_strategy': 'breakout', 'bull_bb_std_mult': 3.5980110720171696, 'bull_rsi_os': 31, 'bull_rsi_ob': 56, 'bull_adx_thresh': 30.309073358702644, 'bull_atr_min_pct': 0.019926792796914575, 'bull_atr_max_pct': 0.11649313360326885, 'bull_tp_mult': 1.458642326992699, 'bull_tsl_mult': 0.4942675675149822, 'bull_time_stop': 199, 'bull_use_sma': True, 'bull_use_ema': False, 'bull_use_atr': True, 'bull_use_adx': False, 'bull_use_spike': True, 'bull_rsi_required': True, 'bear_strategy': 'breakout', 'bear_bb_std_mult': 2.7762985438249053, 'bear_rsi_os': 6, 'bear_rsi_ob': 80, 'bear_adx_thresh': 5.068443979896321, 'bear_atr_min_pct': 0.02230582707958031, 'bear_atr_max_pct': 0.13666467139485505, 'bear_tp_mult': 1.2657505837910952, 'bear_tsl_mult': 0.27812934824701696, 'bear_time_stop': 5, 'bear_use_sma': False, 'bear_use_ema': True, 'bear_use_atr': False, 'bear_use_adx': False, 'bear_use_spike': True, 'bear_rsi_required': False, 'sideways_strategy': 'mean_reversion', 'sideways_bb_std_mult': 2.32046341447935, 'sideways_rsi_os': 7, 'sideways_rsi_ob': 66, 'sideways_adx_thresh': 15.78900004474112, 'sideways_atr_min_pct': 0.0031224805448710584, 'sideways_atr_max_pct': 0.07957619712692861, 'sideways_tp_mult': 1.7653057306775857, 'sideways_tsl_mult': 0.5389687426763751, 'sideways_time_stop': 28, 'sideways_use_sma': True, 'sideways_use_ema': True, 'sideways_use_atr': True, 'sideways_use_adx': True, 'sideways_use_spike': True, 'sideways_rsi_required': True}.
