[I 2025-08-31 09:41:46,330] Trial 162 finished with values: [-0.04935289985856839, 0.0492336038144354] and parameters: {'p_sma': 54, 'p_std': 31, 'p_atr': 27, 'p_adx': 11, 'rsi_period': 19, 'ema1': 24, 'ema2': 48, 'slip_atr_k': 0.1432173687426309, 'slip_spread_k': 0.5919430786418101, 'spread_hl_frac': 0.011948584117181527, 'bb_std_mult': 2.904662541392373, 'rsi_os': 25, 'rsi_ob': 68, 'vol_spike': 0.10633781325589131, 'adx_thresh': 7.217955077636821, 'atr_min_pct': 0.01386326720166822, 'atr_max_pct': 0.0746630494915781, 'tp_mult': 1.1203239609041373, 'tsl_mult': 0.07900474216791228, 'strategy': 'breakout', 'time_stop': 227, 'use_sma': False, 'use_atr': True, 'use_adx': False, 'use_ema': True, 'use_spike': True, 'rsi_required': True, 'edge_k': 0.546593404701566, 'edge_cap': 0.1536361919514472, 'bull_strategy': 'mean_reversion', 'bull_bb_std_mult': 2.9707356081323892, 'bull_rsi_os': 25, 'bull_rsi_ob': 77, 'bull_adx_thresh': 14.028625400119862, 'bull_atr_min_pct': 0.0016300262642848732, 'bull_atr_max_pct': 0.05910115685015978, 'bull_tp_mult': 2.8359532993775445, 'bull_tsl_mult': 0.6086484584299879, 'bull_time_stop': 260, 'bull_use_sma': True, 'bull_use_ema': False, 'bull_use_atr': True, 'bull_use_adx': False, 'bull_use_spike': False, 'bull_rsi_required': False, 'bear_strategy': 'breakout', 'bear_bb_std_mult': 2.4329595420395633, 'bear_rsi_os': 43, 'bear_rsi_ob': 56, 'bear_adx_thresh': 13.137437049610135, 'bear_atr_min_pct': 0.008821860669612677, 'bear_atr_max_pct': 0.01788311473936422, 'bear_tp_mult': 2.596608010444704, 'bear_tsl_mult': 0.3016537813991106, 'bear_time_stop': 191, 'bear_use_sma': False, 'bear_use_ema': False, 'bear_use_atr': True, 'bear_use_adx': True, 'bear_use_spike': True, 'bear_rsi_required': False, 'sideways_strategy': 'breakout', 'sideways_bb_std_mult': 2.661464577717647, 'sideways_rsi_os': 20, 'sideways_rsi_ob': 48, 'sideways_adx_thresh': 17.373552632931997, 'sideways_atr_min_pct': 0.003936722012625215, 'sideways_atr_max_pct': 0.045553438009137186, 'sideways_tp_mult': 2.9359067120221294, 'sideways_tsl_mult': 0.12990726933148944, 'sideways_time_stop': 292, 'sideways_use_sma': False, 'sideways_use_ema': False, 'sideways_use_atr': False, 'sideways_use_adx': False, 'sideways_use_spike': True, 'sideways_rsi_required': False}.
[I 2025-08-31 09:41:47,090] Trial 163 finished with values: [-1000000000.0, 1000000000.0] and parameters: {'p_sma': 58, 'p_std': 31, 'p_atr': 29, 'p_adx': 30, 'rsi_period': 26, 'ema1': 23, 'ema2': 29, 'slip_atr_k': 0.008328133262616175, 'slip_spread_k': 0.6352814736417481, 'spread_hl_frac': 0.031691858707662945, 'bb_std_mult': 0.7949397489976777, 'rsi_os': 25, 'rsi_ob': 71, 'vol_spike': 0.13370319273715803, 'adx_thresh': 34.807428603347546, 'atr_min_pct': 0.019137059830489005, 'atr_max_pct': 0.07517520576420925, 'tp_mult': 1.153857601667828, 'tsl_mult': 0.14493042961658012, 'strategy': 'breakout', 'time_stop': 227, 'use_sma': False, 'use_atr': True, 'use_adx': False, 'use_ema': True, 'use_spike': False, 'rsi_required': True, 'edge_k': 1.3867069060939663, 'edge_cap': 0.05047034020238681, 'bull_strategy': 'mean_reversion', 'bull_bb_std_mult': 0.7403206244246581, 'bull_rsi_os': 25, 'bull_rsi_ob': 53, 'bull_adx_thresh': 5.67642258731737, 'bull_atr_min_pct': 0.018814481535659542, 'bull_atr_max_pct': 0.12116690568427535, 'bull_tp_mult': 2.7248527310538373, 'bull_tsl_mult': 0.6082550312697749, 'bull_time_stop': 250, 'bull_use_sma': True, 'bull_use_ema': False, 'bull_use_atr': True, 'bull_use_adx': False, 'bull_use_spike': False, 'bull_rsi_required': True, 'bear_strategy': 'breakout', 'bear_bb_std_mult': 2.286160266757181, 'bear_rsi_os': 26, 'bear_rsi_ob': 80, 'bear_adx_thresh': 31.668875412701095, 'bear_atr_min_pct': 0.025222621631916763, 'bear_atr_max_pct': 0.040651582094720765, 'bear_tp_mult': 1.221348678291871, 'bear_tsl_mult': 0.2617480085686562, 'bear_time_stop': 208, 'bear_use_sma': False, 'bear_use_ema': True, 'bear_use_atr': False, 'bear_use_adx': True, 'bear_use_spike': True, 'bear_rsi_required': False, 'sideways_strategy': 'breakout', 'sideways_bb_std_mult': 2.3923250740481135, 'sideways_rsi_os': 30, 'sideways_rsi_ob': 74, 'sideways_adx_thresh': 16.663460669028318, 'sideways_atr_min_pct': 0.002720634381119974, 'sideways_atr_max_pct': 0.0454522051347637, 'sideways_tp_mult': 2.4844388552538774, 'sideways_tsl_mult': 0.5679097845930547, 'sideways_time_stop': 211, 'sideways_use_sma': True, 'sideways_use_ema': True, 'sideways_use_atr': False, 'sideways_use_adx': False, 'sideways_use_spike': False, 'sideways_rsi_required': False}.
[I 2025-08-31 09:41:47,880] Trial 164 finished with values: [-0.05999692412856383, 0.05986495321378353] and parameters: {'p_sma': 53, 'p_std': 36, 'p_atr': 8, 'p_adx': 9, 'rsi_period': 18, 'ema1': 8, 'ema2': 46, 'slip_atr_k': 0.009106476143158819, 'slip_spread_k': 0.1076400870618251, 'spread_hl_frac': 0.022222621520830613, 'bb_std_mult': 3.0329838045182433, 'rsi_os': 8, 'rsi_ob': 71, 'vol_spike': 0.2800301757311774, 'adx_thresh': 7.691218362925625, 'atr_min_pct': 0.014653951614523425, 'atr_max_pct': 0.0757277138920323, 'tp_mult': 1.1480376484400894, 'tsl_mult': 0.11128121846623333, 'strategy': 'breakout', 'time_stop': 226, 'use_sma': True, 'use_atr': True, 'use_adx': False, 'use_ema': True, 'use_spike': True, 'rsi_required': True, 'edge_k': 1.6726971553926508, 'edge_cap': 0.11291040026662036, 'bull_strategy': 'breakout', 'bull_bb_std_mult': 3.5652979503003204, 'bull_rsi_os': 23, 'bull_rsi_ob': 76, 'bull_adx_thresh': 31.157778695367536, 'bull_atr_min_pct': 0.0189406234400618, 'bull_atr_max_pct': 0.12108992095124085, 'bull_tp_mult': 1.6039890033491795, 'bull_tsl_mult': 0.22410263322198082, 'bull_time_stop': 259, 'bull_use_sma': True, 'bull_use_ema': False, 'bull_use_atr': True, 'bull_use_adx': False, 'bull_use_spike': False, 'bull_rsi_required': True, 'bear_strategy': 'breakout', 'bear_bb_std_mult': 3.5965177864210554, 'bear_rsi_os': 10, 'bear_rsi_ob': 77, 'bear_adx_thresh': 19.29846526362011, 'bear_atr_min_pct': 0.020852284667183543, 'bear_atr_max_pct': 0.14991143133063062, 'bear_tp_mult': 2.583505137798562, 'bear_tsl_mult': 0.6864142118973675, 'bear_time_stop': 232, 'bear_use_sma': False, 'bear_use_ema': False, 'bear_use_atr': False, 'bear_use_adx': True, 'bear_use_spike': True, 'bear_rsi_required': False, 'sideways_strategy': 'breakout', 'sideways_bb_std_mult': 3.358659785526828, 'sideways_rsi_os': 36, 'sideways_rsi_ob': 63, 'sideways_adx_thresh': 14.45104972324442, 'sideways_atr_min_pct': 0.0017705567433809416, 'sideways_atr_max_pct': 0.035974646556728856, 'sideways_tp_mult': 2.394310088956081, 'sideways_tsl_mult': 0.018981010828787892, 'sideways_time_stop': 41, 'sideways_use_sma': True, 'sideways_use_ema': True, 'sideways_use_atr': False, 'sideways_use_adx': False, 'sideways_use_spike': True, 'sideways_rsi_required': False}.
[I 2025-08-31 09:41:48,169] Trial 165 finished with values: [-0.027489773335119705, 0.027461110012367836] and parameters: {'p_sma': 13, 'p_std': 24, 'p_atr': 18, 'p_adx': 16, 'rsi_period': 50, 'ema1': 23, 'ema2': 25, 'slip_atr_k': 0.009078456860388884, 'slip_spread_k': 0.3740179293161839, 'spread_hl_frac': 0.012420586738822162, 'bb_std_mult': 2.903540445870629, 'rsi_os': 6, 'rsi_ob': 53, 'vol_spike': 0.12161474848173108, 'adx_thresh': 6.08499695671878, 'atr_min_pct': 0.014667909501837453, 'atr_max_pct': 0.05820479835656539, 'tp_mult': 1.1605817539771182, 'tsl_mult': 0.10829331031180629, 'strategy': 'breakout', 'time_stop': 218, 'use_sma': True, 'use_atr': True, 'use_adx': False, 'use_ema': True, 'use_spike': False, 'rsi_required': False, 'edge_k': 1.675336761023693, 'edge_cap': 0.0518806427074889, 'bull_strategy': 'breakout', 'bull_bb_std_mult': 3.599304130124992, 'bull_rsi_os': 26, 'bull_rsi_ob': 76, 'bull_adx_thresh': 30.939696038260116, 'bull_atr_min_pct': 0.018905262677404683, 'bull_atr_max_pct': 0.10602906057224089, 'bull_tp_mult': 1.657658765456981, 'bull_tsl_mult': 0.24891989450835333, 'bull_time_stop': 28, 'bull_use_sma': False, 'bull_use_ema': False, 'bull_use_atr': True, 'bull_use_adx': True, 'bull_use_spike': True, 'bull_rsi_required': True, 'bear_strategy': 'mean_reversion', 'bear_bb_std_mult': 2.6460689744573425, 'bear_rsi_os': 50, 'bear_rsi_ob': 82, 'bear_adx_thresh': 16.269248754677015, 'bear_atr_min_pct': 0.021041539138531358, 'bear_atr_max_pct': 0.1492559488307079, 'bear_tp_mult': 1.4746842069121908, 'bear_tsl_mult': 0.41793543874027655, 'bear_time_stop': 228, 'bear_use_sma': False, 'bear_use_ema': True, 'bear_use_atr': False, 'bear_use_adx': True, 'bear_use_spike': True, 'bear_rsi_required': False, 'sideways_strategy': 'breakout', 'sideways_bb_std_mult': 2.7324070759480787, 'sideways_rsi_os': 38, 'sideways_rsi_ob': 63, 'sideways_adx_thresh': 14.49841094277282, 'sideways_atr_min_pct': 0.0009585704774073712, 'sideways_atr_max_pct': 0.03612979646873797, 'sideways_tp_mult': 2.5162750219595824, 'sideways_tsl_mult': 0.006450666470373678, 'sideways_time_stop': 133, 'sideways_use_sma': True, 'sideways_use_ema': True, 'sideways_use_atr': True, 'sideways_use_adx': True, 'sideways_use_spike': False, 'sideways_rsi_required': False}.
[I 2025-08-31 09:42:24,233] Trial 166 finished with values: [-0.026404074550649748, 0.026242803959646562] and parameters: {'p_sma': 52, 'p_std': 24, 'p_atr': 29, 'p_adx': 28, 'rsi_period': 46, 'ema1': 24, 'ema2': 45, 'slip_atr_k': 0.23346221397479422, 'slip_spread_k': 0.11559864126450864, 'spread_hl_frac': 0.040730533149529985, 'bb_std_mult': 3.043098696850195, 'rsi_os': 8, 'rsi_ob': 51, 'vol_spike': 0.13376542114082, 'adx_thresh': 17.427424343175606, 'atr_min_pct': 0.014431507967208481, 'atr_max_pct': 0.05748973159614112, 'tp_mult': 1.164831476452481, 'tsl_mult': 0.013499292058100958, 'strategy': 'breakout', 'time_stop': 145, 'use_sma': True, 'use_atr': True, 'use_adx': False, 'use_ema': True, 'use_spike': False, 'rsi_required': False, 'edge_k': 1.3969670671322714, 'edge_cap': 0.051635584058297435, 'bull_strategy': 'breakout', 'bull_bb_std_mult': 0.7162941990961535, 'bull_rsi_os': 23, 'bull_rsi_ob': 89, 'bull_adx_thresh': 21.057219701041664, 'bull_atr_min_pct': 0.00668774836216357, 'bull_atr_max_pct': 0.12042857748227095, 'bull_tp_mult': 2.733063035098082, 'bull_tsl_mult': 0.5518953252958616, 'bull_time_stop': 249, 'bull_use_sma': False, 'bull_use_ema': False, 'bull_use_atr': True, 'bull_use_adx': True, 'bull_use_spike': True, 'bull_rsi_required': True, 'bear_strategy': 'mean_reversion', 'bear_bb_std_mult': 0.5146620457388238, 'bear_rsi_os': 11, 'bear_rsi_ob': 78, 'bear_adx_thresh': 14.86135655091165, 'bear_atr_min_pct': 0.024181329746434874, 'bear_atr_max_pct': 0.017597781062996094, 'bear_tp_mult': 2.5823997357396533, 'bear_tsl_mult': 0.8313824435027701, 'bear_time_stop': 39, 'bear_use_sma': False, 'bear_use_ema': True, 'bear_use_atr': False, 'bear_use_adx': True, 'bear_use_spike': False, 'bear_rsi_required': False, 'sideways_strategy': 'breakout', 'sideways_bb_std_mult': 2.2793735545008698, 'sideways_rsi_os': 54, 'sideways_rsi_ob': 49, 'sideways_adx_thresh': 16.412112388025623, 'sideways_atr_min_pct': 0.0026894216734768507, 'sideways_atr_max_pct': 0.057341125203180535, 'sideways_tp_mult': 1.392528951192835, 'sideways_tsl_mult': 0.5207754295055933, 'sideways_time_stop': 209, 'sideways_use_sma': True, 'sideways_use_ema': True, 'sideways_use_atr': True, 'sideways_use_adx': True, 'sideways_use_spike': False, 'sideways_rsi_required': False}.
[I 2025-08-31 09:42:24,560] Trial 169 finished with values: [-1000000000.0, 1000000000.0] and parameters: {'p_sma': 52, 'p_std': 24, 'p_atr': 28, 'p_adx': 9, 'rsi_period': 46, 'ema1': 14, 'ema2': 46, 'slip_atr_k': 0.20695348148717613, 'slip_spread_k': 0.10754039346801059, 'spread_hl_frac': 0.009439120664860318, 'bb_std_mult': 3.042461956864375, 'rsi_os': 41, 'rsi_ob': 51, 'vol_spike': 0.025342571227298702, 'adx_thresh': 17.359856203008977, 'atr_min_pct': 0.013450147130504516, 'atr_max_pct': 0.06768645260918159, 'tp_mult': 1.0487358474640187, 'tsl_mult': 0.053827777226399726, 'strategy': 'breakout', 'time_stop': 278, 'use_sma': True, 'use_atr': True, 'use_adx': False, 'use_ema': True, 'use_spike': False, 'rsi_required': False, 'edge_k': 1.6772548296259693, 'edge_cap': 0.08190388330335645, 'bull_strategy': 'breakout', 'bull_bb_std_mult': 3.5964078986450216, 'bull_rsi_os': 26, 'bull_rsi_ob': 89, 'bull_adx_thresh': 30.793368461693845, 'bull_atr_min_pct': 0.006403381960995358, 'bull_atr_max_pct': 0.11104593793395573, 'bull_tp_mult': 1.1175397399993159, 'bull_tsl_mult': 0.024747264786489087, 'bull_time_stop': 234, 'bull_use_sma': False, 'bull_use_ema': False, 'bull_use_atr': True, 'bull_use_adx': True, 'bull_use_spike': True, 'bull_rsi_required': True, 'bear_strategy': 'mean_reversion', 'bear_bb_std_mult': 1.8949239432099627, 'bear_rsi_os': 50, 'bear_rsi_ob': 78, 'bear_adx_thresh': 14.900453736135733, 'bear_atr_min_pct': 0.024115652554331346, 'bear_atr_max_pct': 0.14916829701820117, 'bear_tp_mult': 1.4676594072094347, 'bear_tsl_mult': 0.6968067640987666, 'bear_time_stop': 103, 'bear_use_sma': False, 'bear_use_ema': True, 'bear_use_atr': False, 'bear_use_adx': False, 'bear_use_spike': False, 'bear_rsi_required': False, 'sideways_strategy': 'breakout', 'sideways_bb_std_mult': 2.2943167131469555, 'sideways_rsi_os': 54, 'sideways_rsi_ob': 50, 'sideways_adx_thresh': 14.821377582900785, 'sideways_atr_min_pct': 0.003309894937279311, 'sideways_atr_max_pct': 0.13891548992920438, 'sideways_tp_mult': 1.4705754076318949, 'sideways_tsl_mult': 0.5266103524827361, 'sideways_time_stop': 38, 'sideways_use_sma': True, 'sideways_use_ema': True, 'sideways_use_atr': True, 'sideways_use_adx': True, 'sideways_use_spike': False, 'sideways_rsi_required': False}.
[I 2025-08-31 09:42:24,736] Trial 168 finished with values: [-1000000000.0, 1000000000.0] and parameters: {'p_sma': 9, 'p_std': 24, 'p_atr': 12, 'p_adx': 24, 'rsi_period': 19, 'ema1': 13, 'ema2': 46, 'slip_atr_k': 0.20361365428853462, 'slip_spread_k': 0.5853170982077578, 'spread_hl_frac': 0.018645716327785555, 'bb_std_mult': 3.0306364872013063, 'rsi_os': 46, 'rsi_ob': 52, 'vol_spike': 0.1380465883797021, 'adx_thresh': 29.86151095255441, 'atr_min_pct': 0.013544110565006755, 'atr_max_pct': 0.1133048642343374, 'tp_mult': 1.0377930049608517, 'tsl_mult': 0.012823274510502074, 'strategy': 'breakout', 'time_stop': 123, 'use_sma': True, 'use_atr': True, 'use_adx': True, 'use_ema': False, 'use_spike': False, 'rsi_required': False, 'edge_k': 1.6895842845500786, 'edge_cap': 0.08275464592557279, 'bull_strategy': 'breakout', 'bull_bb_std_mult': 2.587532869047067, 'bull_rsi_os': 20, 'bull_rsi_ob': 76, 'bull_adx_thresh': 21.02170875556091, 'bull_atr_min_pct': 0.017685473981519182, 'bull_atr_max_pct': 0.0776027566576553, 'bull_tp_mult': 2.64500808096594, 'bull_tsl_mult': 0.23538241166245782, 'bull_time_stop': 146, 'bull_use_sma': False, 'bull_use_ema': False, 'bull_use_atr': False, 'bull_use_adx': True, 'bull_use_spike': True, 'bull_rsi_required': True, 'bear_strategy': 'mean_reversion', 'bear_bb_std_mult': 2.893734978039589, 'bear_rsi_os': 50, 'bear_rsi_ob': 78, 'bear_adx_thresh': 26.923288338612032, 'bear_atr_min_pct': 0.02416458124070911, 'bear_atr_max_pct': 0.1497302385475878, 'bear_tp_mult': 2.5747481445870557, 'bear_tsl_mult': 0.6998573030463474, 'bear_time_stop': 89, 'bear_use_sma': False, 'bear_use_ema': True, 'bear_use_atr': False, 'bear_use_adx': False, 'bear_use_spike': True, 'bear_rsi_required': False, 'sideways_strategy': 'breakout', 'sideways_bb_std_mult': 2.275412534710247, 'sideways_rsi_os': 37, 'sideways_rsi_ob': 66, 'sideways_adx_thresh': 14.779404258856884, 'sideways_atr_min_pct': 0.003672638985977495, 'sideways_atr_max_pct': 0.035278430417495406, 'sideways_tp_mult': 2.374897960075396, 'sideways_tsl_mult': 0.5314815810533667, 'sideways_time_stop': 130, 'sideways_use_sma': True, 'sideways_use_ema': True, 'sideways_use_atr': True, 'sideways_use_adx': True, 'sideways_use_spike': False, 'sideways_rsi_required': False}.
[I 2025-08-31 09:42:24,958] Trial 167 finished with values: [-1000000000.0, 1000000000.0] and parameters: {'p_sma': 13, 'p_std': 24, 'p_atr': 12, 'p_adx': 28, 'rsi_period': 18, 'ema1': 13, 'ema2': 46, 'slip_atr_k': 0.22985459817408838, 'slip_spread_k': 0.6957341892454482, 'spread_hl_frac': 0.025401312103734263, 'bb_std_mult': 3.0418648562662502, 'rsi_os': 8, 'rsi_ob': 51, 'vol_spike': 0.16118605776685369, 'adx_thresh': 7.281863728470916, 'atr_min_pct': 0.014128538837599878, 'atr_max_pct': 0.057317883969954554, 'tp_mult': 1.039976452991778, 'tsl_mult': 0.013462137079581528, 'strategy': 'breakout', 'time_stop': 290, 'use_sma': True, 'use_atr': True, 'use_adx': False, 'use_ema': False, 'use_spike': True, 'rsi_required': False, 'edge_k': 1.6777717485733423, 'edge_cap': 0.08195434388776851, 'bull_strategy': 'breakout', 'bull_bb_std_mult': 3.5418295670894127, 'bull_rsi_os': 20, 'bull_rsi_ob': 76, 'bull_adx_thresh': 31.227341375239153, 'bull_atr_min_pct': 0.017533953953768593, 'bull_atr_max_pct': 0.013340504852740978, 'bull_tp_mult': 2.7512836344014944, 'bull_tsl_mult': 0.21109142352669508, 'bull_time_stop': 233, 'bull_use_sma': False, 'bull_use_ema': False, 'bull_use_atr': True, 'bull_use_adx': True, 'bull_use_spike': True, 'bull_rsi_required': True, 'bear_strategy': 'mean_reversion', 'bear_bb_std_mult': 2.889372686561574, 'bear_rsi_os': 50, 'bear_rsi_ob': 78, 'bear_adx_thresh': 23.4310576061036, 'bear_atr_min_pct': 0.023391410823227647, 'bear_atr_max_pct': 0.1499089202316216, 'bear_tp_mult': 2.5737539073228177, 'bear_tsl_mult': 0.4676580569871084, 'bear_time_stop': 184, 'bear_use_sma': False, 'bear_use_ema': False, 'bear_use_atr': False, 'bear_use_adx': False, 'bear_use_spike': False, 'bear_rsi_required': False, 'sideways_strategy': 'breakout', 'sideways_bb_std_mult': 3.3045449002099607, 'sideways_rsi_os': 38, 'sideways_rsi_ob': 67, 'sideways_adx_thresh': 13.035219216238882, 'sideways_atr_min_pct': 0.0032934069566246177, 'sideways_atr_max_pct': 0.03627020316302786, 'sideways_tp_mult': 1.45272946387345, 'sideways_tsl_mult': 0.5226583332778862, 'sideways_time_stop': 133, 'sideways_use_sma': True, 'sideways_use_ema': True, 'sideways_use_atr': True, 'sideways_use_adx': True, 'sideways_use_spike': True, 'sideways_rsi_required': False}.
[I 2025-08-31 09:43:01,768] Trial 173 finished with values: [-1000000000.0, 1000000000.0] and parameters: {'p_sma': 19, 'p_std': 20, 'p_atr': 24, 'p_adx': 13, 'rsi_period': 17, 'ema1': 12, 'ema2': 26, 'slip_atr_k': 0.03098003628407918, 'slip_spread_k': 0.39661719866906087, 'spread_hl_frac': 0.012369284174034732, 'bb_std_mult': 2.5676035976241085, 'rsi_os': 14, 'rsi_ob': 86, 'vol_spike': 0.117406632091336, 'adx_thresh': 32.792314157428436, 'atr_min_pct': 0.008725103953267463, 'atr_max_pct': 0.06016831809711466, 'tp_mult': 2.7489504644014335, 'tsl_mult': 0.09288425228660455, 'strategy': 'breakout', 'time_stop': 217, 'use_sma': False, 'use_atr': True, 'use_adx': False, 'use_ema': True, 'use_spike': True, 'rsi_required': True, 'edge_k': 0.8022093640936707, 'edge_cap': 0.9826597274726089, 'bull_strategy': 'mean_reversion', 'bull_bb_std_mult': 2.964084919564048, 'bull_rsi_os': 38, 'bull_rsi_ob': 78, 'bull_adx_thresh': 31.962972957606873, 'bull_atr_min_pct': 0.018639685176357803, 'bull_atr_max_pct': 0.08571697512399029, 'bull_tp_mult': 1.9026368283696273, 'bull_tsl_mult': 0.9708651675269495, 'bull_time_stop': 259, 'bull_use_sma': True, 'bull_use_ema': False, 'bull_use_atr': True, 'bull_use_adx': False, 'bull_use_spike': False, 'bull_rsi_required': False, 'bear_strategy': 'breakout', 'bear_bb_std_mult': 2.800165670777838, 'bear_rsi_os': 35, 'bear_rsi_ob': 88, 'bear_adx_thresh': 16.485087621186388, 'bear_atr_min_pct': 0.004290094743572259, 'bear_atr_max_pct': 0.14028546416817922, 'bear_tp_mult': 2.4070385202234443, 'bear_tsl_mult': 0.5694127271605574, 'bear_time_stop': 159, 'bear_use_sma': True, 'bear_use_ema': False, 'bear_use_atr': True, 'bear_use_adx': True, 'bear_use_spike': True, 'bear_rsi_required': False, 'sideways_strategy': 'mean_reversion', 'sideways_bb_std_mult': 2.4208628833192822, 'sideways_rsi_os': 55, 'sideways_rsi_ob': 94, 'sideways_adx_thresh': 16.545072517795116, 'sideways_atr_min_pct': 0.0023769550425423954, 'sideways_atr_max_pct': 0.0415866212238731, 'sideways_tp_mult': 1.378214036453526, 'sideways_tsl_mult': 0.5797774952533279, 'sideways_time_stop': 252, 'sideways_use_sma': False, 'sideways_use_ema': False, 'sideways_use_atr': False, 'sideways_use_adx': False, 'sideways_use_spike': True, 'sideways_rsi_required': True}.
