[I 2025-08-31 09:55:01,366] Trial 263 finished with values: [-1000000000.0, 1000000000.0] and parameters: {'p_sma': 39, 'p_std': 42, 'p_atr': 28, 'p_adx': 10, 'rsi_period': 20, 'ema1': 22, 'ema2': 41, 'slip_atr_k': 0.1708308465073688, 'slip_spread_k': 0.40426833552315, 'spread_hl_frac': 0.013477018331825907, 'bb_std_mult': 1.1163990444378056, 'rsi_os': 22, 'rsi_ob': 60, 'vol_spike': 0.045044701661706765, 'adx_thresh': 6.002566655568626, 'atr_min_pct': 0.020771390722327445, 'atr_max_pct': 0.13813872569420746, 'tp_mult': 2.8019532403649454, 'tsl_mult': 0.8765649667109061, 'strategy': 'breakout', 'time_stop': 138, 'use_sma': False, 'use_atr': False, 'use_adx': False, 'use_ema': False, 'use_spike': False, 'rsi_required': False, 'edge_k': 1.904282513175593, 'edge_cap': 0.08881749286854212, 'bull_strategy': 'mean_reversion', 'bull_bb_std_mult': 1.35738023252842, 'bull_rsi_os': 29, 'bull_rsi_ob': 64, 'bull_adx_thresh': 30.438513604810826, 'bull_atr_min_pct': 0.01818178781421975, 'bull_atr_max_pct': 0.0671359022027501, 'bull_tp_mult': 2.1952125614833156, 'bull_tsl_mult': 0.5582380129678314, 'bull_time_stop': 240, 'bull_use_sma': False, 'bull_use_ema': False, 'bull_use_atr': False, 'bull_use_adx': True, 'bull_use_spike': False, 'bull_rsi_required': True, 'bear_strategy': 'mean_reversion', 'bear_bb_std_mult': 2.9539805363751306, 'bear_rsi_os': 13, 'bear_rsi_ob': 79, 'bear_adx_thresh': 21.226914381634803, 'bear_atr_min_pct': 0.02180771657629097, 'bear_atr_max_pct': 0.1443670030385421, 'bear_tp_mult': 1.2078153619145233, 'bear_tsl_mult': 0.6136659200003949, 'bear_time_stop': 174, 'bear_use_sma': False, 'bear_use_ema': True, 'bear_use_atr': False, 'bear_use_adx': True, 'bear_use_spike': False, 'bear_rsi_required': True, 'sideways_strategy': 'breakout', 'sideways_bb_std_mult': 1.185610913083572, 'sideways_rsi_os': 45, 'sideways_rsi_ob': 60, 'sideways_adx_thresh': 25.65462236169512, 'sideways_atr_min_pct': 0.0031551920112163167, 'sideways_atr_max_pct': 0.030142600567513188, 'sideways_tp_mult': 1.4920931703853186, 'sideways_tsl_mult': 0.10728298103087724, 'sideways_time_stop': 223, 'sideways_use_sma': True, 'sideways_use_ema': True, 'sideways_use_atr': False, 'sideways_use_adx': True, 'sideways_use_spike': False, 'sideways_rsi_required': False}.
[I 2025-08-31 09:55:01,621] Trial 262 finished with values: [-1000000000.0, 1000000000.0] and parameters: {'p_sma': 27, 'p_std': 15, 'p_atr': 28, 'p_adx': 8, 'rsi_period': 23, 'ema1': 19, 'ema2': 39, 'slip_atr_k': 0.07520453545800156, 'slip_spread_k': 0.3971252538365315, 'spread_hl_frac': 0.007295384247788383, 'bb_std_mult': 1.0245731552175033, 'rsi_os': 21, 'rsi_ob': 50, 'vol_spike': 0.04345495280787097, 'adx_thresh': 6.2595297735039015, 'atr_min_pct': 0.004914870326704748, 'atr_max_pct': 0.13012764850906597, 'tp_mult': 2.8928648512612836, 'tsl_mult': 0.9336235080765561, 'strategy': 'breakout', 'time_stop': 138, 'use_sma': False, 'use_atr': False, 'use_adx': False, 'use_ema': False, 'use_spike': False, 'rsi_required': False, 'edge_k': 1.8420570289180807, 'edge_cap': 0.08851872482561655, 'bull_strategy': 'mean_reversion', 'bull_bb_std_mult': 1.3239204497096049, 'bull_rsi_os': 33, 'bull_rsi_ob': 64, 'bull_adx_thresh': 30.330930671145246, 'bull_atr_min_pct': 0.0182548971247846, 'bull_atr_max_pct': 0.05180454872164391, 'bull_tp_mult': 1.538643414665994, 'bull_tsl_mult': 0.5530534261098163, 'bull_time_stop': 239, 'bull_use_sma': False, 'bull_use_ema': False, 'bull_use_atr': False, 'bull_use_adx': True, 'bull_use_spike': False, 'bull_rsi_required': True, 'bear_strategy': 'mean_reversion', 'bear_bb_std_mult': 2.885424587950324, 'bear_rsi_os': 41, 'bear_rsi_ob': 73, 'bear_adx_thresh': 21.427541949897154, 'bear_atr_min_pct': 0.022811757706218325, 'bear_atr_max_pct': 0.013545325005084388, 'bear_tp_mult': 2.719396110702707, 'bear_tsl_mult': 0.5079401946464662, 'bear_time_stop': 243, 'bear_use_sma': False, 'bear_use_ema': True, 'bear_use_atr': False, 'bear_use_adx': True, 'bear_use_spike': False, 'bear_rsi_required': True, 'sideways_strategy': 'breakout', 'sideways_bb_std_mult': 2.0446469002146124, 'sideways_rsi_os': 25, 'sideways_rsi_ob': 65, 'sideways_adx_thresh': 21.705687596367326, 'sideways_atr_min_pct': 0.0031537511766976598, 'sideways_atr_max_pct': 0.03052661454611581, 'sideways_tp_mult': 1.4887331003077542, 'sideways_tsl_mult': 0.9794225492617761, 'sideways_time_stop': 244, 'sideways_use_sma': True, 'sideways_use_ema': True, 'sideways_use_atr': False, 'sideways_use_adx': True, 'sideways_use_spike': False, 'sideways_rsi_required': False}.
[I 2025-08-31 09:55:01,890] Trial 260 finished with values: [-1000000000.0, 1000000000.0] and parameters: {'p_sma': 51, 'p_std': 42, 'p_atr': 28, 'p_adx': 29, 'rsi_period': 60, 'ema1': 19, 'ema2': 39, 'slip_atr_k': 0.16873637499251726, 'slip_spread_k': 0.41859603840398524, 'spread_hl_frac': 0.01299473803941204, 'bb_std_mult': 1.0308612007033588, 'rsi_os': 42, 'rsi_ob': 50, 'vol_spike': 0.15385421921659123, 'adx_thresh': 9.78787055569053, 'atr_min_pct': 0.024311530569537464, 'atr_max_pct': 0.10885786929919566, 'tp_mult': 2.870782523875245, 'tsl_mult': 0.058534719098239485, 'strategy': 'breakout', 'time_stop': 140, 'use_sma': False, 'use_atr': False, 'use_adx': False, 'use_ema': False, 'use_spike': False, 'rsi_required': False, 'edge_k': 1.8579868663632055, 'edge_cap': 0.36199919843265793, 'bull_strategy': 'mean_reversion', 'bull_bb_std_mult': 1.3438272581779949, 'bull_rsi_os': 11, 'bull_rsi_ob': 68, 'bull_adx_thresh': 31.772454195422448, 'bull_atr_min_pct': 0.02084111758930119, 'bull_atr_max_pct': 0.11181966795276883, 'bull_tp_mult': 1.9367789625433165, 'bull_tsl_mult': 0.9497061768838677, 'bull_time_stop': 63, 'bull_use_sma': False, 'bull_use_ema': False, 'bull_use_atr': False, 'bull_use_adx': True, 'bull_use_spike': False, 'bull_rsi_required': True, 'bear_strategy': 'mean_reversion', 'bear_bb_std_mult': 2.8723391254367683, 'bear_rsi_os': 55, 'bear_rsi_ob': 91, 'bear_adx_thresh': 23.454439150218292, 'bear_atr_min_pct': 0.022908761921832718, 'bear_atr_max_pct': 0.12212723668005313, 'bear_tp_mult': 2.716612516797759, 'bear_tsl_mult': 0.46651687890400706, 'bear_time_stop': 245, 'bear_use_sma': False, 'bear_use_ema': True, 'bear_use_atr': False, 'bear_use_adx': True, 'bear_use_spike': False, 'bear_rsi_required': True, 'sideways_strategy': 'breakout', 'sideways_bb_std_mult': 1.2022718305187186, 'sideways_rsi_os': 25, 'sideways_rsi_ob': 65, 'sideways_adx_thresh': 28.40603501878151, 'sideways_atr_min_pct': 0.0004047538378972092, 'sideways_atr_max_pct': 0.030825589329107974, 'sideways_tp_mult': 2.071804394221105, 'sideways_tsl_mult': 0.8148122545010639, 'sideways_time_stop': 238, 'sideways_use_sma': True, 'sideways_use_ema': True, 'sideways_use_atr': False, 'sideways_use_adx': True, 'sideways_use_spike': False, 'sideways_rsi_required': False}.
[I 2025-08-31 09:55:02,619] Trial 267 finished with values: [-1000000000.0, 1000000000.0] and parameters: {'p_sma': 44, 'p_std': 18, 'p_atr': 14, 'p_adx': 11, 'rsi_period': 64, 'ema1': 21, 'ema2': 38, 'slip_atr_k': 0.15985336257246377, 'slip_spread_k': 0.42650859053555173, 'spread_hl_frac': 0.015450455274801558, 'bb_std_mult': 1.0888070260556206, 'rsi_os': 21, 'rsi_ob': 45, 'vol_spike': 0.11630253704714204, 'adx_thresh': 20.20189455334442, 'atr_min_pct': 0.01840942916798785, 'atr_max_pct': 0.13485358141209972, 'tp_mult': 2.635590493155692, 'tsl_mult': 0.03276111992957074, 'strategy': 'mean_reversion', 'time_stop': 79, 'use_sma': False, 'use_atr': False, 'use_adx': False, 'use_ema': False, 'use_spike': False, 'rsi_required': True, 'edge_k': 1.392518305714194, 'edge_cap': 0.47385329525887665, 'bull_strategy': 'mean_reversion', 'bull_bb_std_mult': 1.25692439995358, 'bull_rsi_os': 32, 'bull_rsi_ob': 84, 'bull_adx_thresh': 7.792201405116696, 'bull_atr_min_pct': 0.02013386368745036, 'bull_atr_max_pct': 0.12269168057843695, 'bull_tp_mult': 1.523762731698247, 'bull_tsl_mult': 0.8770054938262101, 'bull_time_stop': 111, 'bull_use_sma': True, 'bull_use_ema': True, 'bull_use_atr': False, 'bull_use_adx': False, 'bull_use_spike': True, 'bull_rsi_required': False, 'bear_strategy': 'breakout', 'bear_bb_std_mult': 2.100498652620058, 'bear_rsi_os': 53, 'bear_rsi_ob': 81, 'bear_adx_thresh': 19.543593587852726, 'bear_atr_min_pct': 0.001982888400753023, 'bear_atr_max_pct': 0.073638150894876, 'bear_tp_mult': 2.6710976522267273, 'bear_tsl_mult': 0.5499507781402808, 'bear_time_stop': 256, 'bear_use_sma': True, 'bear_use_ema': True, 'bear_use_atr': False, 'bear_use_adx': False, 'bear_use_spike': False, 'bear_rsi_required': True, 'sideways_strategy': 'mean_reversion', 'sideways_bb_std_mult': 1.030010330930361, 'sideways_rsi_os': 24, 'sideways_rsi_ob': 62, 'sideways_adx_thresh': 9.066644318104046, 'sideways_atr_min_pct': 0.029744215561906165, 'sideways_atr_max_pct': 0.023683666913978472, 'sideways_tp_mult': 1.5769761998983807, 'sideways_tsl_mult': 0.6998680573890168, 'sideways_time_stop': 232, 'sideways_use_sma': True, 'sideways_use_ema': True, 'sideways_use_atr': True, 'sideways_use_adx': False, 'sideways_use_spike': False, 'sideways_rsi_required': True}.
[I 2025-08-31 09:55:02,634] Trial 266 finished with values: [-1000000000.0, 1000000000.0] and parameters: {'p_sma': 51, 'p_std': 34, 'p_atr': 14, 'p_adx': 11, 'rsi_period': 65, 'ema1': 17, 'ema2': 38, 'slip_atr_k': 0.16674976205411274, 'slip_spread_k': 0.4464395472900854, 'spread_hl_frac': 0.015528038289038745, 'bb_std_mult': 1.1465747801612907, 'rsi_os': 42, 'rsi_ob': 49, 'vol_spike': 0.1517919741705855, 'adx_thresh': 20.224284951568233, 'atr_min_pct': 0.024702671533259047, 'atr_max_pct': 0.1347791150855283, 'tp_mult': 2.8374507900523347, 'tsl_mult': 0.05877323496186663, 'strategy': 'mean_reversion', 'time_stop': 80, 'use_sma': False, 'use_atr': False, 'use_adx': False, 'use_ema': False, 'use_spike': False, 'rsi_required': True, 'edge_k': 0.6440385916462854, 'edge_cap': 0.483785412001337, 'bull_strategy': 'mean_reversion', 'bull_bb_std_mult': 2.5628071956947864, 'bull_rsi_os': 32, 'bull_rsi_ob': 65, 'bull_adx_thresh': 31.975791711108904, 'bull_atr_min_pct': 0.003042643204432139, 'bull_atr_max_pct': 0.11106328764161402, 'bull_tp_mult': 1.9295364541714084, 'bull_tsl_mult': 0.8825460778091431, 'bull_time_stop': 251, 'bull_use_sma': True, 'bull_use_ema': True, 'bull_use_atr': False, 'bull_use_adx': False, 'bull_use_spike': True, 'bull_rsi_required': False, 'bear_strategy': 'breakout', 'bear_bb_std_mult': 2.6746926968755442, 'bear_rsi_os': 51, 'bear_rsi_ob': 81, 'bear_adx_thresh': 14.368802544776264, 'bear_atr_min_pct': 0.02076139084293501, 'bear_atr_max_pct': 0.12244496018592886, 'bear_tp_mult': 2.6772448566259457, 'bear_tsl_mult': 0.5524097831288539, 'bear_time_stop': 255, 'bear_use_sma': True, 'bear_use_ema': True, 'bear_use_atr': False, 'bear_use_adx': False, 'bear_use_spike': False, 'bear_rsi_required': True, 'sideways_strategy': 'mean_reversion', 'sideways_bb_std_mult': 0.9984783561344823, 'sideways_rsi_os': 26, 'sideways_rsi_ob': 62, 'sideways_adx_thresh': 9.043871834693933, 'sideways_atr_min_pct': 0.023491697421541877, 'sideways_atr_max_pct': 0.023911361078757985, 'sideways_tp_mult': 1.5885826813368613, 'sideways_tsl_mult': 0.30288632409152494, 'sideways_time_stop': 233, 'sideways_use_sma': True, 'sideways_use_ema': True, 'sideways_use_atr': True, 'sideways_use_adx': False, 'sideways_use_spike': False, 'sideways_rsi_required': True}.
[I 2025-08-31 09:55:03,473] Trial 268 finished with values: [-1000000000.0, 1000000000.0] and parameters: {'p_sma': 48, 'p_std': 16, 'p_atr': 30, 'p_adx': 10, 'rsi_period': 67, 'ema1': 20, 'ema2': 34, 'slip_atr_k': 0.15334334702854077, 'slip_spread_k': 0.43951188590843815, 'spread_hl_frac': 0.014089144572878768, 'bb_std_mult': 0.9121855552981585, 'rsi_os': 19, 'rsi_ob': 49, 'vol_spike': 0.14314472587615515, 'adx_thresh': 34.30236765506839, 'atr_min_pct': 0.02312028310244907, 'atr_max_pct': 0.03607971984701583, 'tp_mult': 1.8367875516557952, 'tsl_mult': 0.30601894308319355, 'strategy': 'mean_reversion', 'time_stop': 27, 'use_sma': False, 'use_atr': False, 'use_adx': False, 'use_ema': False, 'use_spike': False, 'rsi_required': True, 'edge_k': 0.8507487469105253, 'edge_cap': 0.12660806336807812, 'bull_strategy': 'mean_reversion', 'bull_bb_std_mult': 1.931644460080055, 'bull_rsi_os': 35, 'bull_rsi_ob': 65, 'bull_adx_thresh': 19.796138248449047, 'bull_atr_min_pct': 0.0028488060705852067, 'bull_atr_max_pct': 0.11514347291921184, 'bull_tp_mult': 1.4680563383118688, 'bull_tsl_mult': 0.3606436841705573, 'bull_time_stop': 247, 'bull_use_sma': True, 'bull_use_ema': True, 'bull_use_atr': False, 'bull_use_adx': False, 'bull_use_spike': True, 'bull_rsi_required': False, 'bear_strategy': 'breakout', 'bear_bb_std_mult': 2.642976437647127, 'bear_rsi_os': 39, 'bear_rsi_ob': 79, 'bear_adx_thresh': 8.296926113996584, 'bear_atr_min_pct': 0.020658815797789887, 'bear_atr_max_pct': 0.1388172930355757, 'bear_tp_mult': 2.659958444847018, 'bear_tsl_mult': 0.7853569507003821, 'bear_time_stop': 260, 'bear_use_sma': False, 'bear_use_ema': True, 'bear_use_atr': True, 'bear_use_adx': True, 'bear_use_spike': False, 'bear_rsi_required': True, 'sideways_strategy': 'breakout', 'sideways_bb_std_mult': 1.4426051750873752, 'sideways_rsi_os': 27, 'sideways_rsi_ob': 67, 'sideways_adx_thresh': 19.241663740191225, 'sideways_atr_min_pct': 0.023435923582279465, 'sideways_atr_max_pct': 0.07650362238547406, 'sideways_tp_mult': 1.526078940450981, 'sideways_tsl_mult': 0.08611404819895074, 'sideways_time_stop': 229, 'sideways_use_sma': False, 'sideways_use_ema': False, 'sideways_use_atr': True, 'sideways_use_adx': False, 'sideways_use_spike': False, 'sideways_rsi_required': False}.
[I 2025-08-31 09:55:35,126] Trial 265 finished with values: [-1000000000.0, 1000000000.0] and parameters: {'p_sma': 8, 'p_std': 15, 'p_atr': 14, 'p_adx': 8, 'rsi_period': 25, 'ema1': 20, 'ema2': 38, 'slip_atr_k': 0.12442053711639886, 'slip_spread_k': 0.4311378460740186, 'spread_hl_frac': 0.015612876953395076, 'bb_std_mult': 1.065355823897479, 'rsi_os': 42, 'rsi_ob': 73, 'vol_spike': 0.24382977403913464, 'adx_thresh': 33.046198431200814, 'atr_min_pct': 0.004766437222923192, 'atr_max_pct': 0.13514112418606236, 'tp_mult': 2.838621276268097, 'tsl_mult': 0.9378216037388587, 'strategy': 'mean_reversion', 'time_stop': 95, 'use_sma': False, 'use_atr': False, 'use_adx': False, 'use_ema': False, 'use_spike': False, 'rsi_required': True, 'edge_k': 1.2763310163257549, 'edge_cap': 0.13310334500709095, 'bull_strategy': 'mean_reversion', 'bull_bb_std_mult': 1.897936085219438, 'bull_rsi_os': 11, 'bull_rsi_ob': 65, 'bull_adx_thresh': 31.89897798904177, 'bull_atr_min_pct': 0.013487870229849371, 'bull_atr_max_pct': 0.11078245438774696, 'bull_tp_mult': 1.939925378814617, 'bull_tsl_mult': 0.8804251181325767, 'bull_time_stop': 109, 'bull_use_sma': True, 'bull_use_ema': True, 'bull_use_atr': False, 'bull_use_adx': False, 'bull_use_spike': True, 'bull_rsi_required': False, 'bear_strategy': 'breakout', 'bear_bb_std_mult': 2.787976324414924, 'bear_rsi_os': 41, 'bear_rsi_ob': 81, 'bear_adx_thresh': 6.3462525933395995, 'bear_atr_min_pct': 0.02080461224245182, 'bear_atr_max_pct': 0.07487585889823516, 'bear_tp_mult': 1.7472670613472963, 'bear_tsl_mult': 0.5529806125722956, 'bear_time_stop': 242, 'bear_use_sma': True, 'bear_use_ema': True, 'bear_use_atr': False, 'bear_use_adx': False, 'bear_use_spike': False, 'bear_rsi_required': True, 'sideways_strategy': 'mean_reversion', 'sideways_bb_std_mult': 1.0256037240660127, 'sideways_rsi_os': 27, 'sideways_rsi_ob': 45, 'sideways_adx_thresh': 27.858469726714045, 'sideways_atr_min_pct': 0.012604342425567813, 'sideways_atr_max_pct': 0.024487316694406777, 'sideways_tp_mult': 1.583968373714697, 'sideways_tsl_mult': 0.8081518374107453, 'sideways_time_stop': 233, 'sideways_use_sma': True, 'sideways_use_ema': True, 'sideways_use_atr': True, 'sideways_use_adx': False, 'sideways_use_spike': False, 'sideways_rsi_required': True}.
[I 2025-08-31 09:55:35,374] Trial 264 finished with values: [-1000000000.0, 1000000000.0] and parameters: {'p_sma': 51, 'p_std': 42, 'p_atr': 9, 'p_adx': 8, 'rsi_period': 20, 'ema1': 17, 'ema2': 41, 'slip_atr_k': 0.1727203098246829, 'slip_spread_k': 0.4331525882856964, 'spread_hl_frac': 0.013762915362617612, 'bb_std_mult': 1.115203548690711, 'rsi_os': 21, 'rsi_ob': 45, 'vol_spike': 0.04741288717045816, 'adx_thresh': 27.794610680464466, 'atr_min_pct': 0.02074988014326569, 'atr_max_pct': 0.09948625968834068, 'tp_mult': 2.792572520183932, 'tsl_mult': 0.37850603391667126, 'strategy': 'breakout', 'time_stop': 144, 'use_sma': False, 'use_atr': False, 'use_adx': False, 'use_ema': False, 'use_spike': False, 'rsi_required': True, 'edge_k': 1.404923805622516, 'edge_cap': 0.09374487838319054, 'bull_strategy': 'mean_reversion', 'bull_bb_std_mult': 2.1358489739118474, 'bull_rsi_os': 29, 'bull_rsi_ob': 64, 'bull_adx_thresh': 30.398464988110405, 'bull_atr_min_pct': 0.017990370322662715, 'bull_atr_max_pct': 0.11070060637343893, 'bull_tp_mult': 1.5347808195778538, 'bull_tsl_mult': 0.12362456660644922, 'bull_time_stop': 110, 'bull_use_sma': True, 'bull_use_ema': True, 'bull_use_atr': False, 'bull_use_adx': False, 'bull_use_spike': True, 'bull_rsi_required': False, 'bear_strategy': 'breakout', 'bear_bb_std_mult': 2.656902190612957, 'bear_rsi_os': 54, 'bear_rsi_ob': 90, 'bear_adx_thresh': 21.341278768351575, 'bear_atr_min_pct': 0.021784411207404344, 'bear_atr_max_pct': 0.14416695740909707, 'bear_tp_mult': 2.705435083441776, 'bear_tsl_mult': 0.1587265111037512, 'bear_time_stop': 241, 'bear_use_sma': False, 'bear_use_ema': True, 'bear_use_atr': False, 'bear_use_adx': True, 'bear_use_spike': False, 'bear_rsi_required': True, 'sideways_strategy': 'breakout', 'sideways_bb_std_mult': 1.4488522976692124, 'sideways_rsi_os': 45, 'sideways_rsi_ob': 59, 'sideways_adx_thresh': 31.982724361031632, 'sideways_atr_min_pct': 0.029317430183484903, 'sideways_atr_max_pct': 0.02978107009331399, 'sideways_tp_mult': 1.4807305951108558, 'sideways_tsl_mult': 0.8106153034051449, 'sideways_time_stop': 245, 'sideways_use_sma': True, 'sideways_use_ema': True, 'sideways_use_atr': True, 'sideways_use_adx': False, 'sideways_use_spike': False, 'sideways_rsi_required': False}.
[I 2025-08-31 09:55:38,015] Trial 269 finished with values: [-1000000000.0, 1000000000.0] and parameters: {'p_sma': 6, 'p_std': 16, 'p_atr': 22, 'p_adx': 10, 'rsi_period': 25, 'ema1': 27, 'ema2': 40, 'slip_atr_k': 0.12749368169652703, 'slip_spread_k': 0.8125618477839707, 'spread_hl_frac': 0.014194202833555786, 'bb_std_mult': 0.9338524373138968, 'rsi_os': 19, 'rsi_ob': 80, 'vol_spike': 0.21924242406251293, 'adx_thresh': 18.937341289448195, 'atr_min_pct': 0.023017602189044258, 'atr_max_pct': 0.1389049323419516, 'tp_mult': 2.7872375469197723, 'tsl_mult': 0.016273571939083284, 'strategy': 'breakout', 'time_stop': 25, 'use_sma': False, 'use_atr': False, 'use_adx': False, 'use_ema': False, 'use_spike': False, 'rsi_required': True, 'edge_k': 0.8565061527563711, 'edge_cap': 0.13215262358825136, 'bull_strategy': 'mean_reversion', 'bull_bb_std_mult': 1.9101554248150157, 'bull_rsi_os': 48, 'bull_rsi_ob': 87, 'bull_adx_thresh': 31.13412242311215, 'bull_atr_min_pct': 0.002397592573597833, 'bull_atr_max_pct': 0.11612854370008317, 'bull_tp_mult': 1.575101553853864, 'bull_tsl_mult': 0.11889750427499463, 'bull_time_stop': 246, 'bull_use_sma': True, 'bull_use_ema': False, 'bull_use_atr': False, 'bull_use_adx': False, 'bull_use_spike': False, 'bull_rsi_required': True, 'bear_strategy': 'breakout', 'bear_bb_std_mult': 2.7733861965859394, 'bear_rsi_os': 54, 'bear_rsi_ob': 59, 'bear_adx_thresh': 8.314774368112007, 'bear_atr_min_pct': 0.021999056317046368, 'bear_atr_max_pct': 0.14716068282145656, 'bear_tp_mult': 1.8369257229383238, 'bear_tsl_mult': 0.5234771091796967, 'bear_time_stop': 262, 'bear_use_sma': False, 'bear_use_ema': True, 'bear_use_atr': True, 'bear_use_adx': True, 'bear_use_spike': False, 'bear_rsi_required': True, 'sideways_strategy': 'breakout', 'sideways_bb_std_mult': 3.4670161938237527, 'sideways_rsi_os': 15, 'sideways_rsi_ob': 59, 'sideways_adx_thresh': 19.698989854877112, 'sideways_atr_min_pct': 0.0009800873846061348, 'sideways_atr_max_pct': 0.026515236530593806, 'sideways_tp_mult': 1.5224650219069298, 'sideways_tsl_mult': 0.24468093938303564, 'sideways_time_stop': 228, 'sideways_use_sma': False, 'sideways_use_ema': False, 'sideways_use_atr': False, 'sideways_use_adx': False, 'sideways_use_spike': False, 'sideways_rsi_required': False}.
