[I 2025-08-31 10:48:29,224] Trial 687 finished with values: [-1000000000.0, 1000000000.0] and parameters: {'p_sma': 55, 'p_std': 33, 'p_atr': 29, 'p_adx': 28, 'rsi_period': 8, 'ema1': 27, 'ema2': 42, 'slip_atr_k': 0.06758088205648452, 'slip_spread_k': 0.1058591456058332, 'spread_hl_frac': 0.03456335898561425, 'bb_std_mult': 1.272417071754598, 'rsi_os': 38, 'rsi_ob': 83, 'vol_spike': 0.08620480907709205, 'adx_thresh': 22.465875910719983, 'atr_min_pct': 0.011596166661790435, 'atr_max_pct': 0.12554089235877408, 'tp_mult': 2.842110489769572, 'tsl_mult': 0.8046048033468591, 'strategy': 'breakout', 'time_stop': 224, 'use_sma': True, 'use_atr': False, 'use_adx': False, 'use_ema': True, 'use_spike': False, 'rsi_required': False, 'edge_k': 1.8390467974660247, 'edge_cap': 0.645374694278955, 'bull_strategy': 'breakout', 'bull_bb_std_mult': 1.2353337021327842, 'bull_rsi_os': 39, 'bull_rsi_ob': 66, 'bull_adx_thresh': 30.180026255273773, 'bull_atr_min_pct': 0.005497136428837938, 'bull_atr_max_pct': 0.08312466963188608, 'bull_tp_mult': 2.219276844331076, 'bull_tsl_mult': 0.9535363843541904, 'bull_time_stop': 300, 'bull_use_sma': True, 'bull_use_ema': True, 'bull_use_atr': True, 'bull_use_adx': True, 'bull_use_spike': True, 'bull_rsi_required': True, 'bear_strategy': 'breakout', 'bear_bb_std_mult': 2.8369353790463867, 'bear_rsi_os': 27, 'bear_rsi_ob': 51, 'bear_adx_thresh': 21.127812755893494, 'bear_atr_min_pct': 0.007863639051080255, 'bear_atr_max_pct': 0.07077950191743934, 'bear_tp_mult': 2.1915766571973765, 'bear_tsl_mult': 0.44041494424798044, 'bear_time_stop': 273, 'bear_use_sma': False, 'bear_use_ema': True, 'bear_use_atr': False, 'bear_use_adx': False, 'bear_use_spike': True, 'bear_rsi_required': True, 'sideways_strategy': 'mean_reversion', 'sideways_bb_std_mult': 0.9302004855319601, 'sideways_rsi_os': 26, 'sideways_rsi_ob': 73, 'sideways_adx_thresh': 23.729687226018097, 'sideways_atr_min_pct': 0.003742450898598728, 'sideways_atr_max_pct': 0.14987447242306376, 'sideways_tp_mult': 1.9114930963127026, 'sideways_tsl_mult': 0.9178340527756685, 'sideways_time_stop': 181, 'sideways_use_sma': True, 'sideways_use_ema': False, 'sideways_use_atr': True, 'sideways_use_adx': True, 'sideways_use_spike': True, 'sideways_rsi_required': True}.
[I 2025-08-31 10:48:29,506] Trial 686 finished with values: [-1000000000.0, 1000000000.0] and parameters: {'p_sma': 11, 'p_std': 49, 'p_atr': 29, 'p_adx': 9, 'rsi_period': 38, 'ema1': 17, 'ema2': 42, 'slip_atr_k': 0.03053882835418016, 'slip_spread_k': 0.056305123504299524, 'spread_hl_frac': 0.04001464231954083, 'bb_std_mult': 1.2525649732937707, 'rsi_os': 38, 'rsi_ob': 56, 'vol_spike': 0.28256544067987277, 'adx_thresh': 9.563038284186947, 'atr_min_pct': 0.01091420902517594, 'atr_max_pct': 0.020034802571289374, 'tp_mult': 2.8623520505525573, 'tsl_mult': 0.11007797617301628, 'strategy': 'breakout', 'time_stop': 137, 'use_sma': True, 'use_atr': False, 'use_adx': False, 'use_ema': True, 'use_spike': False, 'rsi_required': False, 'edge_k': 1.8314968031864785, 'edge_cap': 0.2788606696057413, 'bull_strategy': 'breakout', 'bull_bb_std_mult': 0.6230236850885384, 'bull_rsi_os': 28, 'bull_rsi_ob': 66, 'bull_adx_thresh': 27.901601245232264, 'bull_atr_min_pct': 0.005658208252506895, 'bull_atr_max_pct': 0.1405228260302269, 'bull_tp_mult': 2.2029988850910716, 'bull_tsl_mult': 0.42499102730675153, 'bull_time_stop': 59, 'bull_use_sma': True, 'bull_use_ema': True, 'bull_use_atr': True, 'bull_use_adx': True, 'bull_use_spike': True, 'bull_rsi_required': True, 'bear_strategy': 'breakout', 'bear_bb_std_mult': 3.532854603036281, 'bear_rsi_os': 27, 'bear_rsi_ob': 51, 'bear_adx_thresh': 21.174649488846704, 'bear_atr_min_pct': 0.004822812363570043, 'bear_atr_max_pct': 0.04516233086472804, 'bear_tp_mult': 2.083584253038051, 'bear_tsl_mult': 0.44194185767000516, 'bear_time_stop': 272, 'bear_use_sma': False, 'bear_use_ema': True, 'bear_use_atr': False, 'bear_use_adx': False, 'bear_use_spike': True, 'bear_rsi_required': True, 'sideways_strategy': 'mean_reversion', 'sideways_bb_std_mult': 0.6828496836423154, 'sideways_rsi_os': 31, 'sideways_rsi_ob': 56, 'sideways_adx_thresh': 10.566174674361022, 'sideways_atr_min_pct': 0.0038604184793429412, 'sideways_atr_max_pct': 0.088807143997665, 'sideways_tp_mult': 2.920110823204388, 'sideways_tsl_mult': 0.07465235790882736, 'sideways_time_stop': 179, 'sideways_use_sma': True, 'sideways_use_ema': False, 'sideways_use_atr': True, 'sideways_use_adx': True, 'sideways_use_spike': True, 'sideways_rsi_required': True}.
[I 2025-08-31 10:48:29,969] Trial 685 finished with values: [-1000000000.0, 1000000000.0] and parameters: {'p_sma': 8, 'p_std': 49, 'p_atr': 22, 'p_adx': 9, 'rsi_period': 20, 'ema1': 16, 'ema2': 37, 'slip_atr_k': 0.0681064680243776, 'slip_spread_k': 0.11312082353072436, 'spread_hl_frac': 0.04168651223293446, 'bb_std_mult': 1.255124320088649, 'rsi_os': 38, 'rsi_ob': 83, 'vol_spike': 0.2799571992350781, 'adx_thresh': 24.85452919934163, 'atr_min_pct': 0.010960153893125425, 'atr_max_pct': 0.12536826355583763, 'tp_mult': 1.2317154116600744, 'tsl_mult': 0.11935439208403642, 'strategy': 'breakout', 'time_stop': 130, 'use_sma': True, 'use_atr': False, 'use_adx': False, 'use_ema': True, 'use_spike': False, 'rsi_required': False, 'edge_k': 1.8293892134138812, 'edge_cap': 0.7906647394938531, 'bull_strategy': 'breakout', 'bull_bb_std_mult': 1.3540107972827855, 'bull_rsi_os': 13, 'bull_rsi_ob': 59, 'bull_adx_thresh': 30.005483011166312, 'bull_atr_min_pct': 0.005452480232532488, 'bull_atr_max_pct': 0.08301142198912172, 'bull_tp_mult': 2.1988058088945044, 'bull_tsl_mult': 0.4160500486344949, 'bull_time_stop': 124, 'bull_use_sma': True, 'bull_use_ema': True, 'bull_use_atr': True, 'bull_use_adx': True, 'bull_use_spike': True, 'bull_rsi_required': True, 'bear_strategy': 'breakout', 'bear_bb_std_mult': 2.2381114788087797, 'bear_rsi_os': 32, 'bear_rsi_ob': 66, 'bear_adx_thresh': 24.01111694602702, 'bear_atr_min_pct': 0.02465421327979157, 'bear_atr_max_pct': 0.10057217759653991, 'bear_tp_mult': 2.0796810861871666, 'bear_tsl_mult': 0.4021458730742581, 'bear_time_stop': 274, 'bear_use_sma': False, 'bear_use_ema': True, 'bear_use_atr': False, 'bear_use_adx': False, 'bear_use_spike': True, 'bear_rsi_required': True, 'sideways_strategy': 'breakout', 'sideways_bb_std_mult': 0.9380144831579459, 'sideways_rsi_os': 53, 'sideways_rsi_ob': 81, 'sideways_adx_thresh': 30.45720596363951, 'sideways_atr_min_pct': 0.003584220922707497, 'sideways_atr_max_pct': 0.11440094446789599, 'sideways_tp_mult': 2.9251425209496835, 'sideways_tsl_mult': 0.13060425738070897, 'sideways_time_stop': 222, 'sideways_use_sma': True, 'sideways_use_ema': True, 'sideways_use_atr': True, 'sideways_use_adx': True, 'sideways_use_spike': True, 'sideways_rsi_required': False}.
[I 2025-08-31 10:48:30,172] Trial 684 finished with values: [-1000000000.0, 1000000000.0] and parameters: {'p_sma': 55, 'p_std': 47, 'p_atr': 22, 'p_adx': 11, 'rsi_period': 7, 'ema1': 18, 'ema2': 38, 'slip_atr_k': 0.17679732736120943, 'slip_spread_k': 0.06023900385222184, 'spread_hl_frac': 0.040425642045004005, 'bb_std_mult': 1.2243928226781402, 'rsi_os': 38, 'rsi_ob': 85, 'vol_spike': 0.08639641544117346, 'adx_thresh': 30.6344241670743, 'atr_min_pct': 0.010967478927270367, 'atr_max_pct': 0.12450200412813534, 'tp_mult': 2.997439361386834, 'tsl_mult': 0.054964624406689755, 'strategy': 'breakout', 'time_stop': 129, 'use_sma': False, 'use_atr': False, 'use_adx': False, 'use_ema': True, 'use_spike': True, 'rsi_required': True, 'edge_k': 1.8795424060220074, 'edge_cap': 0.7777343126042631, 'bull_strategy': 'mean_reversion', 'bull_bb_std_mult': 1.210536752786299, 'bull_rsi_os': 13, 'bull_rsi_ob': 67, 'bull_adx_thresh': 29.905209357952085, 'bull_atr_min_pct': 9.03027932148328e-05, 'bull_atr_max_pct': 0.14130421252538272, 'bull_tp_mult': 2.2024537024111406, 'bull_tsl_mult': 0.41760465216025966, 'bull_time_stop': 70, 'bull_use_sma': True, 'bull_use_ema': True, 'bull_use_atr': True, 'bull_use_adx': True, 'bull_use_spike': True, 'bull_rsi_required': True, 'bear_strategy': 'breakout', 'bear_bb_std_mult': 2.9067544515204466, 'bear_rsi_os': 45, 'bear_rsi_ob': 66, 'bear_adx_thresh': 23.978972146022837, 'bear_atr_min_pct': 0.0049672999276015525, 'bear_atr_max_pct': 0.10687890870649734, 'bear_tp_mult': 2.202056054793208, 'bear_tsl_mult': 0.4458154100429605, 'bear_time_stop': 275, 'bear_use_sma': False, 'bear_use_ema': True, 'bear_use_atr': True, 'bear_use_adx': True, 'bear_use_spike': True, 'bear_rsi_required': True, 'sideways_strategy': 'breakout', 'sideways_bb_std_mult': 2.3856685039953507, 'sideways_rsi_os': 26, 'sideways_rsi_ob': 95, 'sideways_adx_thresh': 27.382423319247653, 'sideways_atr_min_pct': 0.028672250834008192, 'sideways_atr_max_pct': 0.11503838331659039, 'sideways_tp_mult': 1.0534322503553266, 'sideways_tsl_mult': 0.9242200366841009, 'sideways_time_stop': 180, 'sideways_use_sma': False, 'sideways_use_ema': True, 'sideways_use_atr': True, 'sideways_use_adx': True, 'sideways_use_spike': True, 'sideways_rsi_required': False}.
[I 2025-08-31 10:49:03,065] Trial 688 finished with values: [-0.09730124220698944, 0.09716004174275009] and parameters: {'p_sma': 11, 'p_std': 48, 'p_atr': 29, 'p_adx': 10, 'rsi_period': 20, 'ema1': 19, 'ema2': 38, 'slip_atr_k': 0.17780735262669783, 'slip_spread_k': 0.0869145314264184, 'spread_hl_frac': 0.022055883041137696, 'bb_std_mult': 1.2236310201330547, 'rsi_os': 42, 'rsi_ob': 85, 'vol_spike': 0.28134175126433775, 'adx_thresh': 24.76847660087915, 'atr_min_pct': 0.012185112619112114, 'atr_max_pct': 0.0187225653817489, 'tp_mult': 2.7795978856128443, 'tsl_mult': 0.11336834118819553, 'strategy': 'breakout', 'time_stop': 198, 'use_sma': False, 'use_atr': False, 'use_adx': True, 'use_ema': True, 'use_spike': False, 'rsi_required': True, 'edge_k': 1.5985787418080315, 'edge_cap': 0.14952789271161127, 'bull_strategy': 'mean_reversion', 'bull_bb_std_mult': 2.9516233030535948, 'bull_rsi_os': 50, 'bull_rsi_ob': 71, 'bull_adx_thresh': 9.94558066289043, 'bull_atr_min_pct': 0.023096570626599866, 'bull_atr_max_pct': 0.13453684555227668, 'bull_tp_mult': 2.778281747465199, 'bull_tsl_mult': 0.9787934138025807, 'bull_time_stop': 70, 'bull_use_sma': True, 'bull_use_ema': False, 'bull_use_atr': True, 'bull_use_adx': True, 'bull_use_spike': True, 'bull_rsi_required': True, 'bear_strategy': 'breakout', 'bear_bb_std_mult': 2.2101979455779586, 'bear_rsi_os': 25, 'bear_rsi_ob': 77, 'bear_adx_thresh': 24.23175750161373, 'bear_atr_min_pct': 0.02628063897075062, 'bear_atr_max_pct': 0.0995095226680405, 'bear_tp_mult': 2.0807300668618773, 'bear_tsl_mult': 0.48247859607853516, 'bear_time_stop': 203, 'bear_use_sma': False, 'bear_use_ema': True, 'bear_use_atr': False, 'bear_use_adx': True, 'bear_use_spike': True, 'bear_rsi_required': True, 'sideways_strategy': 'breakout', 'sideways_bb_std_mult': 3.152952647032686, 'sideways_rsi_os': 53, 'sideways_rsi_ob': 94, 'sideways_adx_thresh': 30.35973518788129, 'sideways_atr_min_pct': 0.0006369798625765197, 'sideways_atr_max_pct': 0.10363383986298477, 'sideways_tp_mult': 2.924608553255181, 'sideways_tsl_mult': 0.07298121203433543, 'sideways_time_stop': 220, 'sideways_use_sma': True, 'sideways_use_ema': True, 'sideways_use_atr': True, 'sideways_use_adx': True, 'sideways_use_spike': True, 'sideways_rsi_required': False}.
[I 2025-08-31 10:49:03,556] Trial 689 finished with values: [-1000000000.0, 1000000000.0] and parameters: {'p_sma': 9, 'p_std': 45, 'p_atr': 29, 'p_adx': 10, 'rsi_period': 20, 'ema1': 16, 'ema2': 39, 'slip_atr_k': 0.17760561664439578, 'slip_spread_k': 0.0927838056424971, 'spread_hl_frac': 0.02241571761276092, 'bb_std_mult': 3.3303998463357543, 'rsi_os': 42, 'rsi_ob': 85, 'vol_spike': 0.23194246606346192, 'adx_thresh': 24.867223232430224, 'atr_min_pct': 0.012137005307471173, 'atr_max_pct': 0.12498327628265812, 'tp_mult': 1.9709057842581372, 'tsl_mult': 0.3448289860688918, 'strategy': 'breakout', 'time_stop': 144, 'use_sma': False, 'use_atr': False, 'use_adx': True, 'use_ema': True, 'use_spike': False, 'rsi_required': True, 'edge_k': 1.9063241095765269, 'edge_cap': 0.12245082443020179, 'bull_strategy': 'mean_reversion', 'bull_bb_std_mult': 1.3671686704675603, 'bull_rsi_os': 26, 'bull_rsi_ob': 45, 'bull_adx_thresh': 12.280503158128923, 'bull_atr_min_pct': 0.024798580335603802, 'bull_atr_max_pct': 0.08359355345013865, 'bull_tp_mult': 2.7700091064070236, 'bull_tsl_mult': 0.9800232761643973, 'bull_time_stop': 160, 'bull_use_sma': True, 'bull_use_ema': False, 'bull_use_atr': False, 'bull_use_adx': False, 'bull_use_spike': False, 'bull_rsi_required': True, 'bear_strategy': 'breakout', 'bear_bb_std_mult': 2.7786965730673443, 'bear_rsi_os': 25, 'bear_rsi_ob': 77, 'bear_adx_thresh': 23.95198460790619, 'bear_atr_min_pct': 0.007779575007012568, 'bear_atr_max_pct': 0.09989247656789793, 'bear_tp_mult': 2.122471354391363, 'bear_tsl_mult': 0.4908074710598216, 'bear_time_stop': 253, 'bear_use_sma': False, 'bear_use_ema': True, 'bear_use_atr': False, 'bear_use_adx': True, 'bear_use_spike': True, 'bear_rsi_required': True, 'sideways_strategy': 'breakout', 'sideways_bb_std_mult': 3.147716366826174, 'sideways_rsi_os': 26, 'sideways_rsi_ob': 94, 'sideways_adx_thresh': 30.474790709424887, 'sideways_atr_min_pct': 0.02293487593623378, 'sideways_atr_max_pct': 0.11353046885157195, 'sideways_tp_mult': 2.933741998409541, 'sideways_tsl_mult': 0.4295972282345707, 'sideways_time_stop': 41, 'sideways_use_sma': True, 'sideways_use_ema': True, 'sideways_use_atr': False, 'sideways_use_adx': False, 'sideways_use_spike': True, 'sideways_rsi_required': False}.
[I 2025-08-31 10:49:03,745] Trial 691 finished with values: [-0.018251463870727624, 0.018424072681496238] and parameters: {'p_sma': 39, 'p_std': 48, 'p_atr': 29, 'p_adx': 10, 'rsi_period': 24, 'ema1': 19, 'ema2': 39, 'slip_atr_k': 0.19458914998779486, 'slip_spread_k': 0.8685535632715775, 'spread_hl_frac': 0.04411494115555342, 'bb_std_mult': 1.1705750963932222, 'rsi_os': 42, 'rsi_ob': 61, 'vol_spike': 0.28771603535202095, 'adx_thresh': 24.147232054912795, 'atr_min_pct': 0.012100005946185287, 'atr_max_pct': 0.07590305938117507, 'tp_mult': 1.297356378002732, 'tsl_mult': 0.20659246570847817, 'strategy': 'breakout', 'time_stop': 289, 'use_sma': False, 'use_atr': True, 'use_adx': True, 'use_ema': True, 'use_spike': False, 'rsi_required': True, 'edge_k': 1.60639267792505, 'edge_cap': 0.12241764092657487, 'bull_strategy': 'mean_reversion', 'bull_bb_std_mult': 0.8186007123800099, 'bull_rsi_os': 25, 'bull_rsi_ob': 69, 'bull_adx_thresh': 30.92090882556917, 'bull_atr_min_pct': 0.007015798481597265, 'bull_atr_max_pct': 0.07098992976796378, 'bull_tp_mult': 2.111946536253778, 'bull_tsl_mult': 0.9771214854845183, 'bull_time_stop': 188, 'bull_use_sma': True, 'bull_use_ema': False, 'bull_use_atr': False, 'bull_use_adx': False, 'bull_use_spike': False, 'bull_rsi_required': False, 'bear_strategy': 'breakout', 'bear_bb_std_mult': 1.300538039158371, 'bear_rsi_os': 41, 'bear_rsi_ob': 76, 'bear_adx_thresh': 29.306878950606837, 'bear_atr_min_pct': 0.007522889606018934, 'bear_atr_max_pct': 0.019752319503371578, 'bear_tp_mult': 2.1261986905362242, 'bear_tsl_mult': 0.4845618238237762, 'bear_time_stop': 209, 'bear_use_sma': False, 'bear_use_ema': True, 'bear_use_atr': False, 'bear_use_adx': True, 'bear_use_spike': True, 'bear_rsi_required': False, 'sideways_strategy': 'breakout', 'sideways_bb_std_mult': 2.189580524628068, 'sideways_rsi_os': 20, 'sideways_rsi_ob': 94, 'sideways_adx_thresh': 18.92704757558566, 'sideways_atr_min_pct': 1.56170139514382e-05, 'sideways_atr_max_pct': 0.10298157628414797, 'sideways_tp_mult': 2.93553250188947, 'sideways_tsl_mult': 0.43247646255369493, 'sideways_time_stop': 234, 'sideways_use_sma': True, 'sideways_use_ema': True, 'sideways_use_atr': False, 'sideways_use_adx': False, 'sideways_use_spike': True, 'sideways_rsi_required': False}.
[I 2025-08-31 10:49:03,861] Trial 690 finished with values: [-0.02497686505691743, 0.024871700382682063] and parameters: {'p_sma': 39, 'p_std': 45, 'p_atr': 14, 'p_adx': 15, 'rsi_period': 21, 'ema1': 19, 'ema2': 39, 'slip_atr_k': 0.19727438030532551, 'slip_spread_k': 0.8801153608581755, 'spread_hl_frac': 0.021736361111680553, 'bb_std_mult': 1.1783827941186817, 'rsi_os': 42, 'rsi_ob': 81, 'vol_spike': 0.2860977748731602, 'adx_thresh': 24.312167686741628, 'atr_min_pct': 0.008375156386413687, 'atr_max_pct': 0.09203450114930377, 'tp_mult': 1.7409924669243637, 'tsl_mult': 0.07882641327973133, 'strategy': 'breakout', 'time_stop': 144, 'use_sma': False, 'use_atr': True, 'use_adx': True, 'use_ema': True, 'use_spike': False, 'rsi_required': True, 'edge_k': 0.004158877453669385, 'edge_cap': 0.1247083957470783, 'bull_strategy': 'mean_reversion', 'bull_bb_std_mult': 1.2077145570111814, 'bull_rsi_os': 26, 'bull_rsi_ob': 74, 'bull_adx_thresh': 25.538093579278854, 'bull_atr_min_pct': 0.029468498232513858, 'bull_atr_max_pct': 0.09104136235299977, 'bull_tp_mult': 2.5339060971906924, 'bull_tsl_mult': 0.980965682061363, 'bull_time_stop': 147, 'bull_use_sma': True, 'bull_use_ema': False, 'bull_use_atr': False, 'bull_use_adx': False, 'bull_use_spike': False, 'bull_rsi_required': False, 'bear_strategy': 'breakout', 'bear_bb_std_mult': 2.7693906444029786, 'bear_rsi_os': 25, 'bear_rsi_ob': 78, 'bear_adx_thresh': 22.932252526192904, 'bear_atr_min_pct': 0.007074488148184433, 'bear_atr_max_pct': 0.10638470764385971, 'bear_tp_mult': 2.013484379358265, 'bear_tsl_mult': 0.4820842929018917, 'bear_time_stop': 202, 'bear_use_sma': False, 'bear_use_ema': True, 'bear_use_atr': False, 'bear_use_adx': True, 'bear_use_spike': True, 'bear_rsi_required': False, 'sideways_strategy': 'breakout', 'sideways_bb_std_mult': 1.4068799853620095, 'sideways_rsi_os': 20, 'sideways_rsi_ob': 94, 'sideways_adx_thresh': 7.581392186300606, 'sideways_atr_min_pct': 0.0004333560298894935, 'sideways_atr_max_pct': 0.13566033060237834, 'sideways_tp_mult': 1.0553848715009724, 'sideways_tsl_mult': 0.8700626792559039, 'sideways_time_stop': 234, 'sideways_use_sma': True, 'sideways_use_ema': True, 'sideways_use_atr': False, 'sideways_use_adx': False, 'sideways_use_spike': True, 'sideways_rsi_required': False}.
[I 2025-08-31 10:49:36,717] Trial 694 finished with values: [-1000000000.0, 1000000000.0] and parameters: {'p_sma': 12, 'p_std': 45, 'p_atr': 29, 'p_adx': 9, 'rsi_period': 22, 'ema1': 19, 'ema2': 24, 'slip_atr_k': 0.19229963830045596, 'slip_spread_k': 0.2631913049889466, 'spread_hl_frac': 0.04359571168253225, 'bb_std_mult': 1.1545982671753408, 'rsi_os': 43, 'rsi_ob': 81, 'vol_spike': 0.289075023215716, 'adx_thresh': 24.056732900914117, 'atr_min_pct': 0.016389090691621946, 'atr_max_pct': 0.11909614881760389, 'tp_mult': 1.681199024022947, 'tsl_mult': 0.07788965147172817, 'strategy': 'mean_reversion', 'time_stop': 290, 'use_sma': False, 'use_atr': True, 'use_adx': False, 'use_ema': True, 'use_spike': False, 'rsi_required': True, 'edge_k': 1.9176774821834324, 'edge_cap': 0.3489036764504347, 'bull_strategy': 'mean_reversion', 'bull_bb_std_mult': 1.2767628441296055, 'bull_rsi_os': 48, 'bull_rsi_ob': 69, 'bull_adx_thresh': 33.35051122829967, 'bull_atr_min_pct': 0.007226137442032642, 'bull_atr_max_pct': 0.09093781027497203, 'bull_tp_mult': 1.0591840591768147, 'bull_tsl_mult': 0.9237839600662889, 'bull_time_stop': 88, 'bull_use_sma': True, 'bull_use_ema': False, 'bull_use_atr': False, 'bull_use_adx': False, 'bull_use_spike': False, 'bull_rsi_required': False, 'bear_strategy': 'breakout', 'bear_bb_std_mult': 2.9514207790040556, 'bear_rsi_os': 41, 'bear_rsi_ob': 78, 'bear_adx_thresh': 22.330603318473944, 'bear_atr_min_pct': 0.007255351655934613, 'bear_atr_max_pct': 0.11442464574624661, 'bear_tp_mult': 2.0375843361125203, 'bear_tsl_mult': 0.9659022433734541, 'bear_time_stop': 166, 'bear_use_sma': True, 'bear_use_ema': True, 'bear_use_atr': False, 'bear_use_adx': True, 'bear_use_spike': True, 'bear_rsi_required': False, 'sideways_strategy': 'breakout', 'sideways_bb_std_mult': 1.4011977598477037, 'sideways_rsi_os': 18, 'sideways_rsi_ob': 91, 'sideways_adx_thresh': 22.591936900553545, 'sideways_atr_min_pct': 0.015305642963618825, 'sideways_atr_max_pct': 0.09784343202154101, 'sideways_tp_mult': 2.193491601547547, 'sideways_tsl_mult': 0.4853332237199735, 'sideways_time_stop': 261, 'sideways_use_sma': True, 'sideways_use_ema': False, 'sideways_use_atr': False, 'sideways_use_adx': False, 'sideways_use_spike': True, 'sideways_rsi_required': False}.
