[I 2025-08-31 10:07:16,273] Trial 372 finished with values: [-1000000000.0, 1000000000.0] and parameters: {'p_sma': 50, 'p_std': 18, 'p_atr': 26, 'p_adx': 10, 'rsi_period': 47, 'ema1': 19, 'ema2': 38, 'slip_atr_k': 0.18565664070388097, 'slip_spread_k': 0.8616280728097574, 'spread_hl_frac': 0.015569713874168188, 'bb_std_mult': 1.14193639576477, 'rsi_os': 19, 'rsi_ob': 68, 'vol_spike': 0.13119274815413462, 'adx_thresh': 8.972216599585266, 'atr_min_pct': 0.012777325087397363, 'atr_max_pct': 0.012521650415878008, 'tp_mult': 2.9413806337813906, 'tsl_mult': 0.03503426347215159, 'strategy': 'breakout', 'time_stop': 189, 'use_sma': True, 'use_atr': False, 'use_adx': False, 'use_ema': True, 'use_spike': False, 'rsi_required': False, 'edge_k': 1.2487839650435864, 'edge_cap': 0.1321423120265758, 'bull_strategy': 'breakout', 'bull_bb_std_mult': 1.2247324433922697, 'bull_rsi_os': 49, 'bull_rsi_ob': 66, 'bull_adx_thresh': 30.132482392156007, 'bull_atr_min_pct': 0.009556507741845442, 'bull_atr_max_pct': 0.11570046834101179, 'bull_tp_mult': 1.4695305412932798, 'bull_tsl_mult': 0.055733859574221056, 'bull_time_stop': 294, 'bull_use_sma': True, 'bull_use_ema': True, 'bull_use_atr': False, 'bull_use_adx': True, 'bull_use_spike': True, 'bull_rsi_required': True, 'bear_strategy': 'breakout', 'bear_bb_std_mult': 2.684521301808456, 'bear_rsi_os': 22, 'bear_rsi_ob': 85, 'bear_adx_thresh': 19.3887339047658, 'bear_atr_min_pct': 0.022356334627750902, 'bear_atr_max_pct': 0.12056336833007052, 'bear_tp_mult': 2.7187504315568867, 'bear_tsl_mult': 0.5628020002211658, 'bear_time_stop': 254, 'bear_use_sma': False, 'bear_use_ema': True, 'bear_use_atr': False, 'bear_use_adx': True, 'bear_use_spike': False, 'bear_rsi_required': True, 'sideways_strategy': 'breakout', 'sideways_bb_std_mult': 1.3068972701279489, 'sideways_rsi_os': 22, 'sideways_rsi_ob': 47, 'sideways_adx_thresh': 33.814066188363924, 'sideways_atr_min_pct': 0.024811377040851824, 'sideways_atr_max_pct': 0.02978027956027608, 'sideways_tp_mult': 1.569713095635395, 'sideways_tsl_mult': 0.7280857950740451, 'sideways_time_stop': 64, 'sideways_use_sma': True, 'sideways_use_ema': True, 'sideways_use_atr': True, 'sideways_use_adx': True, 'sideways_use_spike': False, 'sideways_rsi_required': False}.
[I 2025-08-31 10:07:16,319] Trial 371 finished with values: [-1000000000.0, 1000000000.0] and parameters: {'p_sma': 60, 'p_std': 30, 'p_atr': 15, 'p_adx': 16, 'rsi_period': 24, 'ema1': 21, 'ema2': 49, 'slip_atr_k': 0.1627015167532884, 'slip_spread_k': 0.4638913021293963, 'spread_hl_frac': 0.011671627790431927, 'bb_std_mult': 2.0925870304820315, 'rsi_os': 19, 'rsi_ob': 51, 'vol_spike': 0.28799720731830947, 'adx_thresh': 28.63227488015138, 'atr_min_pct': 0.023550707153018893, 'atr_max_pct': 0.012710168618719708, 'tp_mult': 1.350375991731933, 'tsl_mult': 0.02498353512506105, 'strategy': 'breakout', 'time_stop': 189, 'use_sma': False, 'use_atr': False, 'use_adx': False, 'use_ema': False, 'use_spike': False, 'rsi_required': False, 'edge_k': 1.840099558964931, 'edge_cap': 0.5410632550179589, 'bull_strategy': 'mean_reversion', 'bull_bb_std_mult': 1.230447817667263, 'bull_rsi_os': 30, 'bull_rsi_ob': 66, 'bull_adx_thresh': 29.862911878208628, 'bull_atr_min_pct': 0.019711172532162903, 'bull_atr_max_pct': 0.13783498556584706, 'bull_tp_mult': 1.225331843747302, 'bull_tsl_mult': 0.4024523515297636, 'bull_time_stop': 250, 'bull_use_sma': True, 'bull_use_ema': True, 'bull_use_atr': False, 'bull_use_adx': True, 'bull_use_spike': True, 'bull_rsi_required': False, 'bear_strategy': 'breakout', 'bear_bb_std_mult': 2.702692160711338, 'bear_rsi_os': 54, 'bear_rsi_ob': 59, 'bear_adx_thresh': 19.502291230898827, 'bear_atr_min_pct': 0.022253597519906944, 'bear_atr_max_pct': 0.14561991757815418, 'bear_tp_mult': 2.5952234292983904, 'bear_tsl_mult': 0.5887762326366838, 'bear_time_stop': 254, 'bear_use_sma': False, 'bear_use_ema': True, 'bear_use_atr': False, 'bear_use_adx': False, 'bear_use_spike': False, 'bear_rsi_required': True, 'sideways_strategy': 'breakout', 'sideways_bb_std_mult': 1.5666022368904575, 'sideways_rsi_os': 22, 'sideways_rsi_ob': 47, 'sideways_adx_thresh': 12.649341152618911, 'sideways_atr_min_pct': 0.024894400141599864, 'sideways_atr_max_pct': 0.11914406970515784, 'sideways_tp_mult': 1.570797528798477, 'sideways_tsl_mult': 0.08620794508751756, 'sideways_time_stop': 209, 'sideways_use_sma': True, 'sideways_use_ema': True, 'sideways_use_atr': True, 'sideways_use_adx': False, 'sideways_use_spike': False, 'sideways_rsi_required': False}.
[I 2025-08-31 10:07:43,996] Trial 369 finished with values: [-1000000000.0, 1000000000.0] and parameters: {'p_sma': 26, 'p_std': 17, 'p_atr': 26, 'p_adx': 9, 'rsi_period': 23, 'ema1': 21, 'ema2': 38, 'slip_atr_k': 0.12692677243107645, 'slip_spread_k': 0.46132930805391953, 'spread_hl_frac': 0.015433602145128367, 'bb_std_mult': 1.164349489968225, 'rsi_os': 50, 'rsi_ob': 63, 'vol_spike': 0.2873172569198028, 'adx_thresh': 5.801024878485284, 'atr_min_pct': 0.012808027688658536, 'atr_max_pct': 0.10670312946467585, 'tp_mult': 2.763055382222596, 'tsl_mult': 0.02369475009791511, 'strategy': 'breakout', 'time_stop': 129, 'use_sma': False, 'use_atr': False, 'use_adx': False, 'use_ema': False, 'use_spike': False, 'rsi_required': False, 'edge_k': 1.835879568659303, 'edge_cap': 0.13322907306631462, 'bull_strategy': 'mean_reversion', 'bull_bb_std_mult': 1.509546726095702, 'bull_rsi_os': 30, 'bull_rsi_ob': 66, 'bull_adx_thresh': 22.43416242199513, 'bull_atr_min_pct': 0.009711883939806208, 'bull_atr_max_pct': 0.11914086309166377, 'bull_tp_mult': 2.4805704943845672, 'bull_tsl_mult': 0.6576146457104218, 'bull_time_stop': 275, 'bull_use_sma': True, 'bull_use_ema': True, 'bull_use_atr': False, 'bull_use_adx': False, 'bull_use_spike': False, 'bull_rsi_required': False, 'bear_strategy': 'breakout', 'bear_bb_std_mult': 2.7269485614537086, 'bear_rsi_os': 18, 'bear_rsi_ob': 76, 'bear_adx_thresh': 19.39485807919269, 'bear_atr_min_pct': 0.010703191324107622, 'bear_atr_max_pct': 0.010031234216730009, 'bear_tp_mult': 2.7177527541165376, 'bear_tsl_mult': 0.5986517467619664, 'bear_time_stop': 254, 'bear_use_sma': False, 'bear_use_ema': False, 'bear_use_atr': False, 'bear_use_adx': False, 'bear_use_spike': False, 'bear_rsi_required': True, 'sideways_strategy': 'breakout', 'sideways_bb_std_mult': 1.3767038701816274, 'sideways_rsi_os': 23, 'sideways_rsi_ob': 64, 'sideways_adx_thresh': 12.628738115844758, 'sideways_atr_min_pct': 0.017660735861943624, 'sideways_atr_max_pct': 0.09612670591917907, 'sideways_tp_mult': 1.5446431434671264, 'sideways_tsl_mult': 0.12862583907105668, 'sideways_time_stop': 208, 'sideways_use_sma': True, 'sideways_use_ema': True, 'sideways_use_atr': False, 'sideways_use_adx': False, 'sideways_use_spike': False, 'sideways_rsi_required': False}.
[I 2025-08-31 10:07:44,331] Trial 370 finished with values: [-1000000000.0, 1000000000.0] and parameters: {'p_sma': 26, 'p_std': 12, 'p_atr': 28, 'p_adx': 9, 'rsi_period': 47, 'ema1': 26, 'ema2': 41, 'slip_atr_k': 0.1616358430684142, 'slip_spread_k': 0.8598129674097001, 'spread_hl_frac': 0.01161910522424834, 'bb_std_mult': 1.1860115899963477, 'rsi_os': 50, 'rsi_ob': 45, 'vol_spike': 0.07594653915919976, 'adx_thresh': 15.002162746973386, 'atr_min_pct': 0.0020321292055533683, 'atr_max_pct': 0.10641710282095139, 'tp_mult': 2.7631887516107825, 'tsl_mult': 0.33959656722400333, 'strategy': 'breakout', 'time_stop': 21, 'use_sma': False, 'use_atr': False, 'use_adx': False, 'use_ema': False, 'use_spike': False, 'rsi_required': False, 'edge_k': 1.425183458178476, 'edge_cap': 0.13289014353756992, 'bull_strategy': 'mean_reversion', 'bull_bb_std_mult': 1.2429385819451835, 'bull_rsi_os': 30, 'bull_rsi_ob': 66, 'bull_adx_thresh': 22.259202777387536, 'bull_atr_min_pct': 0.023069582519300618, 'bull_atr_max_pct': 0.1192267977046276, 'bull_tp_mult': 2.470377839013298, 'bull_tsl_mult': 0.5955653083072302, 'bull_time_stop': 249, 'bull_use_sma': True, 'bull_use_ema': True, 'bull_use_atr': False, 'bull_use_adx': False, 'bull_use_spike': False, 'bull_rsi_required': False, 'bear_strategy': 'breakout', 'bear_bb_std_mult': 2.7448409691777957, 'bear_rsi_os': 45, 'bear_rsi_ob': 61, 'bear_adx_thresh': 20.532112289805497, 'bear_atr_min_pct': 0.020628636312804437, 'bear_atr_max_pct': 0.12089734938181587, 'bear_tp_mult': 2.7207996101593652, 'bear_tsl_mult': 0.14148526326636712, 'bear_time_stop': 255, 'bear_use_sma': False, 'bear_use_ema': False, 'bear_use_atr': False, 'bear_use_adx': False, 'bear_use_spike': False, 'bear_rsi_required': True, 'sideways_strategy': 'breakout', 'sideways_bb_std_mult': 1.3062137327702374, 'sideways_rsi_os': 23, 'sideways_rsi_ob': 64, 'sideways_adx_thresh': 7.74605973230384, 'sideways_atr_min_pct': 0.014276576691271185, 'sideways_atr_max_pct': 0.029638310925594998, 'sideways_tp_mult': 1.5249543492821676, 'sideways_tsl_mult': 0.13916077238288455, 'sideways_time_stop': 231, 'sideways_use_sma': True, 'sideways_use_ema': True, 'sideways_use_atr': False, 'sideways_use_adx': False, 'sideways_use_spike': False, 'sideways_rsi_required': False}.
[I 2025-08-31 10:07:47,764] Trial 373 finished with values: [-1000000000.0, 1000000000.0] and parameters: {'p_sma': 5, 'p_std': 13, 'p_atr': 27, 'p_adx': 21, 'rsi_period': 74, 'ema1': 21, 'ema2': 40, 'slip_atr_k': 0.16919510186628087, 'slip_spread_k': 0.4153144067134114, 'spread_hl_frac': 0.0142006499634256, 'bb_std_mult': 0.9235886720432683, 'rsi_os': 20, 'rsi_ob': 81, 'vol_spike': 0.12545626027615986, 'adx_thresh': 5.93947865303959, 'atr_min_pct': 0.02676541190116376, 'atr_max_pct': 0.13164181295862945, 'tp_mult': 2.7756073924638813, 'tsl_mult': 0.0011958644769724971, 'strategy': 'breakout', 'time_stop': 122, 'use_sma': False, 'use_atr': True, 'use_adx': False, 'use_ema': False, 'use_spike': False, 'rsi_required': False, 'edge_k': 0.6901884160891194, 'edge_cap': 0.5399475670811469, 'bull_strategy': 'mean_reversion', 'bull_bb_std_mult': 1.507679175288005, 'bull_rsi_os': 30, 'bull_rsi_ob': 68, 'bull_adx_thresh': 33.81542834777074, 'bull_atr_min_pct': 0.019082932788761026, 'bull_atr_max_pct': 0.12660500654091933, 'bull_tp_mult': 2.1266512551900423, 'bull_tsl_mult': 0.5943915386246027, 'bull_time_stop': 233, 'bull_use_sma': True, 'bull_use_ema': False, 'bull_use_atr': False, 'bull_use_adx': False, 'bull_use_spike': False, 'bull_rsi_required': False, 'bear_strategy': 'breakout', 'bear_bb_std_mult': 2.7330365748436702, 'bear_rsi_os': 55, 'bear_rsi_ob': 75, 'bear_adx_thresh': 20.736382929027773, 'bear_atr_min_pct': 0.010458691478431231, 'bear_atr_max_pct': 0.14556006259024093, 'bear_tp_mult': 1.4847442728887539, 'bear_tsl_mult': 0.598270244170023, 'bear_time_stop': 245, 'bear_use_sma': False, 'bear_use_ema': True, 'bear_use_atr': False, 'bear_use_adx': False, 'bear_use_spike': True, 'bear_rsi_required': False, 'sideways_strategy': 'breakout', 'sideways_bb_std_mult': 1.604486188494873, 'sideways_rsi_os': 27, 'sideways_rsi_ob': 93, 'sideways_adx_thresh': 12.325032350947613, 'sideways_atr_min_pct': 0.02004164514240949, 'sideways_atr_max_pct': 0.021781954354731257, 'sideways_tp_mult': 2.50339577170016, 'sideways_tsl_mult': 0.18920025514031474, 'sideways_time_stop': 106, 'sideways_use_sma': True, 'sideways_use_ema': True, 'sideways_use_atr': False, 'sideways_use_adx': False, 'sideways_use_spike': False, 'sideways_rsi_required': False}.
[I 2025-08-31 10:07:48,325] Trial 374 finished with values: [-1000000000.0, 1000000000.0] and parameters: {'p_sma': 7, 'p_std': 14, 'p_atr': 28, 'p_adx': 9, 'rsi_period': 56, 'ema1': 20, 'ema2': 38, 'slip_atr_k': 0.15588768754976498, 'slip_spread_k': 0.7850885783986965, 'spread_hl_frac': 0.018122897177166225, 'bb_std_mult': 1.6450341227333352, 'rsi_os': 14, 'rsi_ob': 81, 'vol_spike': 0.13123379126366258, 'adx_thresh': 5.702737024922794, 'atr_min_pct': 0.011330774648110813, 'atr_max_pct': 0.13257857722255686, 'tp_mult': 2.7826539551121092, 'tsl_mult': 0.001604364082592501, 'strategy': 'breakout', 'time_stop': 120, 'use_sma': False, 'use_atr': True, 'use_adx': False, 'use_ema': False, 'use_spike': False, 'rsi_required': True, 'edge_k': 0.6972560257065386, 'edge_cap': 0.2979600440148221, 'bull_strategy': 'mean_reversion', 'bull_bb_std_mult': 1.3129925626005392, 'bull_rsi_os': 31, 'bull_rsi_ob': 68, 'bull_adx_thresh': 31.331536920035227, 'bull_atr_min_pct': 0.0018633595961460563, 'bull_atr_max_pct': 0.12502199889500798, 'bull_tp_mult': 1.5376254362566115, 'bull_tsl_mult': 0.5887197043464009, 'bull_time_stop': 228, 'bull_use_sma': True, 'bull_use_ema': False, 'bull_use_atr': False, 'bull_use_adx': False, 'bull_use_spike': False, 'bull_rsi_required': True, 'bear_strategy': 'breakout', 'bear_bb_std_mult': 1.2552148034954902, 'bear_rsi_os': 47, 'bear_rsi_ob': 84, 'bear_adx_thresh': 20.722580445313188, 'bear_atr_min_pct': 0.02925775689932223, 'bear_atr_max_pct': 0.1414011599608139, 'bear_tp_mult': 1.3913095151156734, 'bear_tsl_mult': 0.5183070540633404, 'bear_time_stop': 288, 'bear_use_sma': False, 'bear_use_ema': True, 'bear_use_atr': False, 'bear_use_adx': True, 'bear_use_spike': True, 'bear_rsi_required': False, 'sideways_strategy': 'breakout', 'sideways_bb_std_mult': 1.0635684434309185, 'sideways_rsi_os': 28, 'sideways_rsi_ob': 92, 'sideways_adx_thresh': 31.821931755694514, 'sideways_atr_min_pct': 0.02892332736844954, 'sideways_atr_max_pct': 0.021484638850339, 'sideways_tp_mult': 2.069117869451778, 'sideways_tsl_mult': 0.8306476353232537, 'sideways_time_stop': 247, 'sideways_use_sma': True, 'sideways_use_ema': True, 'sideways_use_atr': False, 'sideways_use_adx': False, 'sideways_use_spike': True, 'sideways_rsi_required': False}.
[I 2025-08-31 10:07:49,086] Trial 378 finished with values: [-1000000000.0, 1000000000.0] and parameters: {'p_sma': 46, 'p_std': 15, 'p_atr': 23, 'p_adx': 30, 'rsi_period': 36, 'ema1': 16, 'ema2': 40, 'slip_atr_k': 0.14616316322779055, 'slip_spread_k': 0.32090840075677984, 'spread_hl_frac': 0.014449375576163548, 'bb_std_mult': 2.352598683526591, 'rsi_os': 39, 'rsi_ob': 47, 'vol_spike': 0.14199102929354387, 'adx_thresh': 19.183016795840743, 'atr_min_pct': 0.011434673449590621, 'atr_max_pct': 0.13630632792854777, 'tp_mult': 2.1955209845180024, 'tsl_mult': 0.050204753291642756, 'strategy': 'mean_reversion', 'time_stop': 112, 'use_sma': True, 'use_atr': False, 'use_adx': False, 'use_ema': True, 'use_spike': False, 'rsi_required': True, 'edge_k': 0.9541945674754145, 'edge_cap': 0.17806287060038306, 'bull_strategy': 'breakout', 'bull_bb_std_mult': 1.161839932013096, 'bull_rsi_os': 19, 'bull_rsi_ob': 65, 'bull_adx_thresh': 31.87988890602933, 'bull_atr_min_pct': 0.018620341486776115, 'bull_atr_max_pct': 0.11526862907533617, 'bull_tp_mult': 1.9725864020119235, 'bull_tsl_mult': 0.2893528181277867, 'bull_time_stop': 18, 'bull_use_sma': True, 'bull_use_ema': False, 'bull_use_atr': True, 'bull_use_adx': False, 'bull_use_spike': False, 'bull_rsi_required': True, 'bear_strategy': 'breakout', 'bear_bb_std_mult': 1.7674350126875735, 'bear_rsi_os': 13, 'bear_rsi_ob': 80, 'bear_adx_thresh': 22.685640675662476, 'bear_atr_min_pct': 0.023542824070122863, 'bear_atr_max_pct': 0.059101587192891734, 'bear_tp_mult': 2.6680524590985453, 'bear_tsl_mult': 0.5019952560352487, 'bear_time_stop': 267, 'bear_use_sma': False, 'bear_use_ema': True, 'bear_use_atr': False, 'bear_use_adx': True, 'bear_use_spike': False, 'bear_rsi_required': True, 'sideways_strategy': 'breakout', 'sideways_bb_std_mult': 3.406707210790694, 'sideways_rsi_os': 26, 'sideways_rsi_ob': 62, 'sideways_adx_thresh': 29.128516718484725, 'sideways_atr_min_pct': 0.00258402338250444, 'sideways_atr_max_pct': 0.033757561591876234, 'sideways_tp_mult': 1.4681376659035577, 'sideways_tsl_mult': 0.03569157419279406, 'sideways_time_stop': 253, 'sideways_use_sma': True, 'sideways_use_ema': True, 'sideways_use_atr': False, 'sideways_use_adx': True, 'sideways_use_spike': True, 'sideways_rsi_required': False}.
[I 2025-08-31 10:08:19,796] Trial 375 finished with values: [-1000000000.0, 1000000000.0] and parameters: {'p_sma': 49, 'p_std': 14, 'p_atr': 30, 'p_adx': 24, 'rsi_period': 70, 'ema1': 30, 'ema2': 40, 'slip_atr_k': 0.1563237364852115, 'slip_spread_k': 0.4086692526142969, 'spread_hl_frac': 0.013899770607356738, 'bb_std_mult': 1.0862307051440696, 'rsi_os': 34, 'rsi_ob': 47, 'vol_spike': 0.20511538533678475, 'adx_thresh': 20.880501926821122, 'atr_min_pct': 0.011314592078668164, 'atr_max_pct': 0.1318120120329354, 'tp_mult': 2.8500881899069737, 'tsl_mult': 0.0014519507420246549, 'strategy': 'breakout', 'time_stop': 138, 'use_sma': False, 'use_atr': True, 'use_adx': False, 'use_ema': False, 'use_spike': False, 'rsi_required': True, 'edge_k': 0.6954465117490416, 'edge_cap': 0.28190991998743453, 'bull_strategy': 'mean_reversion', 'bull_bb_std_mult': 0.7836546350937095, 'bull_rsi_os': 31, 'bull_rsi_ob': 46, 'bull_adx_thresh': 31.846747664942164, 'bull_atr_min_pct': 0.023085208884797585, 'bull_atr_max_pct': 0.12498034565813815, 'bull_tp_mult': 1.535583486504892, 'bull_tsl_mult': 0.5959448532883577, 'bull_time_stop': 235, 'bull_use_sma': True, 'bull_use_ema': False, 'bull_use_atr': False, 'bull_use_adx': False, 'bull_use_spike': False, 'bull_rsi_required': True, 'bear_strategy': 'breakout', 'bear_bb_std_mult': 2.183641070979475, 'bear_rsi_os': 50, 'bear_rsi_ob': 80, 'bear_adx_thresh': 20.780352443783176, 'bear_atr_min_pct': 0.020735675447639813, 'bear_atr_max_pct': 0.14019297296707492, 'bear_tp_mult': 1.1652044244923516, 'bear_tsl_mult': 0.5019199684645308, 'bear_time_stop': 244, 'bear_use_sma': False, 'bear_use_ema': True, 'bear_use_atr': False, 'bear_use_adx': True, 'bear_use_spike': True, 'bear_rsi_required': False, 'sideways_strategy': 'breakout', 'sideways_bb_std_mult': 0.9381957471475152, 'sideways_rsi_os': 16, 'sideways_rsi_ob': 92, 'sideways_adx_thresh': 31.9969663928918, 'sideways_atr_min_pct': 0.014516246427679048, 'sideways_atr_max_pct': 0.023458463464492103, 'sideways_tp_mult': 1.3803707824821214, 'sideways_tsl_mult': 0.03836190037490129, 'sideways_time_stop': 264, 'sideways_use_sma': True, 'sideways_use_ema': True, 'sideways_use_atr': False, 'sideways_use_adx': True, 'sideways_use_spike': True, 'sideways_rsi_required': False}.
[I 2025-08-31 10:08:20,042] Trial 376 finished with values: [-1000000000.0, 1000000000.0] and parameters: {'p_sma': 46, 'p_std': 47, 'p_atr': 30, 'p_adx': 21, 'rsi_period': 8, 'ema1': 11, 'ema2': 40, 'slip_atr_k': 0.1551016948069315, 'slip_spread_k': 0.9664805430285195, 'spread_hl_frac': 0.018227366389950175, 'bb_std_mult': 1.6360352122870174, 'rsi_os': 6, 'rsi_ob': 81, 'vol_spike': 0.12568048437183246, 'adx_thresh': 32.06847405193331, 'atr_min_pct': 0.01124131338067127, 'atr_max_pct': 0.13214942416201234, 'tp_mult': 2.20583595815836, 'tsl_mult': 0.0028403071596765136, 'strategy': 'breakout', 'time_stop': 147, 'use_sma': True, 'use_atr': True, 'use_adx': False, 'use_ema': True, 'use_spike': False, 'rsi_required': True, 'edge_k': 0.6840520865033859, 'edge_cap': 0.2904384363802178, 'bull_strategy': 'breakout', 'bull_bb_std_mult': 1.3114152286146397, 'bull_rsi_os': 31, 'bull_rsi_ob': 68, 'bull_adx_thresh': 19.004824913965752, 'bull_atr_min_pct': 0.019068611708118882, 'bull_atr_max_pct': 0.12626116099045842, 'bull_tp_mult': 1.443105872262701, 'bull_tsl_mult': 0.6228930772555046, 'bull_time_stop': 228, 'bull_use_sma': True, 'bull_use_ema': False, 'bull_use_atr': False, 'bull_use_adx': False, 'bull_use_spike': False, 'bull_rsi_required': True, 'bear_strategy': 'breakout', 'bear_bb_std_mult': 2.9908220946880784, 'bear_rsi_os': 55, 'bear_rsi_ob': 77, 'bear_adx_thresh': 31.78790418331983, 'bear_atr_min_pct': 0.007776315718848247, 'bear_atr_max_pct': 0.05892878323041962, 'bear_tp_mult': 1.7836509497105046, 'bear_tsl_mult': 0.5061151934541332, 'bear_time_stop': 285, 'bear_use_sma': False, 'bear_use_ema': True, 'bear_use_atr': False, 'bear_use_adx': True, 'bear_use_spike': True, 'bear_rsi_required': False, 'sideways_strategy': 'breakout', 'sideways_bb_std_mult': 0.9298073721873215, 'sideways_rsi_os': 27, 'sideways_rsi_ob': 75, 'sideways_adx_thresh': 32.200733383792375, 'sideways_atr_min_pct': 0.0029401409538884786, 'sideways_atr_max_pct': 0.022688134952658978, 'sideways_tp_mult': 2.0617009994320172, 'sideways_tsl_mult': 0.1946354948179761, 'sideways_time_stop': 282, 'sideways_use_sma': True, 'sideways_use_ema': True, 'sideways_use_atr': False, 'sideways_use_adx': True, 'sideways_use_spike': True, 'sideways_rsi_required': False}.
