[I 2025-08-31 10:32:12,294] Trial 568 finished with values: [-1000000000.0, 1000000000.0] and parameters: {'p_sma': 12, 'p_std': 50, 'p_atr': 22, 'p_adx': 24, 'rsi_period': 30, 'ema1': 25, 'ema2': 12, 'slip_atr_k': 0.024449248612944133, 'slip_spread_k': 0.047176604480042704, 'spread_hl_frac': 0.01225652735270266, 'bb_std_mult': 0.5403575254116264, 'rsi_os': 40, 'rsi_ob': 86, 'vol_spike': 0.29409822147779147, 'adx_thresh': 21.678966251729147, 'atr_min_pct': 0.027507581680050575, 'atr_max_pct': 0.06784778005873683, 'tp_mult': 2.133735846294657, 'tsl_mult': 0.7282164096517456, 'strategy': 'mean_reversion', 'time_stop': 121, 'use_sma': False, 'use_atr': True, 'use_adx': False, 'use_ema': True, 'use_spike': False, 'rsi_required': True, 'edge_k': 1.9359986497363022, 'edge_cap': 0.2089443383480082, 'bull_strategy': 'mean_reversion', 'bull_bb_std_mult': 1.1615279589668779, 'bull_rsi_os': 27, 'bull_rsi_ob': 60, 'bull_adx_thresh': 30.148079419154072, 'bull_atr_min_pct': 0.006669537881726619, 'bull_atr_max_pct': 0.07916561422345768, 'bull_tp_mult': 2.163599266442359, 'bull_tsl_mult': 0.8969665609711271, 'bull_time_stop': 75, 'bull_use_sma': True, 'bull_use_ema': False, 'bull_use_atr': True, 'bull_use_adx': False, 'bull_use_spike': False, 'bull_rsi_required': True, 'bear_strategy': 'mean_reversion', 'bear_bb_std_mult': 1.442938538350968, 'bear_rsi_os': 24, 'bear_rsi_ob': 53, 'bear_adx_thresh': 27.037590686611928, 'bear_atr_min_pct': 0.007829264586084392, 'bear_atr_max_pct': 0.1065331679277455, 'bear_tp_mult': 2.172755529631576, 'bear_tsl_mult': 0.7149912009577251, 'bear_time_stop': 268, 'bear_use_sma': False, 'bear_use_ema': True, 'bear_use_atr': False, 'bear_use_adx': True, 'bear_use_spike': True, 'bear_rsi_required': False, 'sideways_strategy': 'mean_reversion', 'sideways_bb_std_mult': 0.9392495315690559, 'sideways_rsi_os': 49, 'sideways_rsi_ob': 94, 'sideways_adx_thresh': 28.063047878709714, 'sideways_atr_min_pct': 6.7218162934103674e-06, 'sideways_atr_max_pct': 0.09917723298807998, 'sideways_tp_mult': 2.7850967014900774, 'sideways_tsl_mult': 0.02951296688166488, 'sideways_time_stop': 233, 'sideways_use_sma': True, 'sideways_use_ema': False, 'sideways_use_atr': False, 'sideways_use_adx': False, 'sideways_use_spike': True, 'sideways_rsi_required': True}.
[I 2025-08-31 10:32:12,662] Trial 565 finished with values: [-1000000000.0, 1000000000.0] and parameters: {'p_sma': 13, 'p_std': 51, 'p_atr': 28, 'p_adx': 27, 'rsi_period': 26, 'ema1': 18, 'ema2': 56, 'slip_atr_k': 0.19259027869021117, 'slip_spread_k': 0.045724921872585575, 'spread_hl_frac': 0.04997626689472451, 'bb_std_mult': 1.2771176259350177, 'rsi_os': 44, 'rsi_ob': 85, 'vol_spike': 0.284994197514999, 'adx_thresh': 20.87434754674245, 'atr_min_pct': 0.016281742583107793, 'atr_max_pct': 0.11966455340364211, 'tp_mult': 2.139274800503103, 'tsl_mult': 0.07425662822605096, 'strategy': 'breakout', 'time_stop': 285, 'use_sma': False, 'use_atr': False, 'use_adx': True, 'use_ema': True, 'use_spike': True, 'rsi_required': False, 'edge_k': 1.91007081458434, 'edge_cap': 0.08978450348385289, 'bull_strategy': 'mean_reversion', 'bull_bb_std_mult': 1.166936141817047, 'bull_rsi_os': 22, 'bull_rsi_ob': 69, 'bull_adx_thresh': 6.943546560298865, 'bull_atr_min_pct': 0.008964239677276983, 'bull_atr_max_pct': 0.0848698624282602, 'bull_tp_mult': 2.205807536684156, 'bull_tsl_mult': 0.8894919906951517, 'bull_time_stop': 86, 'bull_use_sma': False, 'bull_use_ema': False, 'bull_use_atr': False, 'bull_use_adx': True, 'bull_use_spike': False, 'bull_rsi_required': True, 'bear_strategy': 'breakout', 'bear_bb_std_mult': 1.571927805918346, 'bear_rsi_os': 28, 'bear_rsi_ob': 83, 'bear_adx_thresh': 23.65882427806427, 'bear_atr_min_pct': 0.007872914751875414, 'bear_atr_max_pct': 0.0940652594529953, 'bear_tp_mult': 2.1057210817416205, 'bear_tsl_mult': 0.4370034932071439, 'bear_time_stop': 261, 'bear_use_sma': True, 'bear_use_ema': False, 'bear_use_atr': True, 'bear_use_adx': False, 'bear_use_spike': True, 'bear_rsi_required': True, 'sideways_strategy': 'breakout', 'sideways_bb_std_mult': 2.6395843107178867, 'sideways_rsi_os': 7, 'sideways_rsi_ob': 94, 'sideways_adx_thresh': 30.484835106544317, 'sideways_atr_min_pct': 0.0014848001663132664, 'sideways_atr_max_pct': 0.1111213444370797, 'sideways_tp_mult': 2.8790614092207227, 'sideways_tsl_mult': 0.08516358741261419, 'sideways_time_stop': 137, 'sideways_use_sma': False, 'sideways_use_ema': True, 'sideways_use_atr': False, 'sideways_use_adx': True, 'sideways_use_spike': True, 'sideways_rsi_required': False}.
[I 2025-08-31 10:32:46,732] Trial 571 finished with values: [-1000000000.0, 1000000000.0] and parameters: {'p_sma': 9, 'p_std': 45, 'p_atr': 30, 'p_adx': 17, 'rsi_period': 24, 'ema1': 29, 'ema2': 36, 'slip_atr_k': 0.18725539263812208, 'slip_spread_k': 0.07570123313703862, 'spread_hl_frac': 0.010612150672005133, 'bb_std_mult': 3.307795384995655, 'rsi_os': 40, 'rsi_ob': 80, 'vol_spike': 0.27399397138957454, 'adx_thresh': 24.225510249409027, 'atr_min_pct': 0.011217434493385128, 'atr_max_pct': 0.033511317189356744, 'tp_mult': 1.879738091238687, 'tsl_mult': 0.600558838586173, 'strategy': 'breakout', 'time_stop': 81, 'use_sma': True, 'use_atr': False, 'use_adx': False, 'use_ema': True, 'use_spike': False, 'rsi_required': True, 'edge_k': 1.01453384750993, 'edge_cap': 0.7175692079216981, 'bull_strategy': 'breakout', 'bull_bb_std_mult': 1.2201674938963964, 'bull_rsi_os': 14, 'bull_rsi_ob': 50, 'bull_adx_thresh': 31.096745876394408, 'bull_atr_min_pct': 0.006639809573070017, 'bull_atr_max_pct': 0.08403804636662099, 'bull_tp_mult': 2.3940454939289864, 'bull_tsl_mult': 0.9320269822856134, 'bull_time_stop': 67, 'bull_use_sma': False, 'bull_use_ema': False, 'bull_use_atr': False, 'bull_use_adx': False, 'bull_use_spike': False, 'bull_rsi_required': True, 'bear_strategy': 'breakout', 'bear_bb_std_mult': 1.5646916998269724, 'bear_rsi_os': 31, 'bear_rsi_ob': 75, 'bear_adx_thresh': 21.244556783571284, 'bear_atr_min_pct': 0.006347259280514774, 'bear_atr_max_pct': 0.1151336305451714, 'bear_tp_mult': 2.0794202334829004, 'bear_tsl_mult': 0.4842335974076172, 'bear_time_stop': 287, 'bear_use_sma': True, 'bear_use_ema': True, 'bear_use_atr': False, 'bear_use_adx': False, 'bear_use_spike': True, 'bear_rsi_required': True, 'sideways_strategy': 'breakout', 'sideways_bb_std_mult': 2.6329919861924673, 'sideways_rsi_os': 25, 'sideways_rsi_ob': 94, 'sideways_adx_thresh': 30.476079628566964, 'sideways_atr_min_pct': 0.013706266925477707, 'sideways_atr_max_pct': 0.10548901572139835, 'sideways_tp_mult': 2.9698845695717493, 'sideways_tsl_mult': 0.062058228154647635, 'sideways_time_stop': 244, 'sideways_use_sma': True, 'sideways_use_ema': True, 'sideways_use_atr': False, 'sideways_use_adx': False, 'sideways_use_spike': True, 'sideways_rsi_required': False}.
[I 2025-08-31 10:32:46,732] Trial 569 finished with values: [-1000000000.0, 1000000000.0] and parameters: {'p_sma': 12, 'p_std': 50, 'p_atr': 9, 'p_adx': 17, 'rsi_period': 31, 'ema1': 19, 'ema2': 24, 'slip_atr_k': 0.17577265646306656, 'slip_spread_k': 0.07266757197111035, 'spread_hl_frac': 0.012035207326564759, 'bb_std_mult': 1.2573969043030062, 'rsi_os': 44, 'rsi_ob': 86, 'vol_spike': 0.2926061484612236, 'adx_thresh': 21.6931810418606, 'atr_min_pct': 0.02642848860405239, 'atr_max_pct': 0.12338598534646024, 'tp_mult': 2.8876539196909015, 'tsl_mult': 0.7324735707363259, 'strategy': 'breakout', 'time_stop': 158, 'use_sma': True, 'use_atr': False, 'use_adx': False, 'use_ema': True, 'use_spike': False, 'rsi_required': True, 'edge_k': 1.012847958431055, 'edge_cap': 0.21366740907596493, 'bull_strategy': 'breakout', 'bull_bb_std_mult': 1.1997986389927136, 'bull_rsi_os': 24, 'bull_rsi_ob': 67, 'bull_adx_thresh': 30.982961308754206, 'bull_atr_min_pct': 0.0065410660576666, 'bull_atr_max_pct': 0.08304261883415509, 'bull_tp_mult': 2.1811707087827745, 'bull_tsl_mult': 0.8793885695179433, 'bull_time_stop': 74, 'bull_use_sma': True, 'bull_use_ema': False, 'bull_use_atr': True, 'bull_use_adx': False, 'bull_use_spike': False, 'bull_rsi_required': True, 'bear_strategy': 'breakout', 'bear_bb_std_mult': 1.432175356347951, 'bear_rsi_os': 27, 'bear_rsi_ob': 78, 'bear_adx_thresh': 21.386906643332686, 'bear_atr_min_pct': 0.007728553041348894, 'bear_atr_max_pct': 0.10831520305503067, 'bear_tp_mult': 2.0865127586042247, 'bear_tsl_mult': 0.4827489456131193, 'bear_time_stop': 286, 'bear_use_sma': False, 'bear_use_ema': True, 'bear_use_atr': False, 'bear_use_adx': True, 'bear_use_spike': True, 'bear_rsi_required': True, 'sideways_strategy': 'breakout', 'sideways_bb_std_mult': 0.9483574725013555, 'sideways_rsi_os': 42, 'sideways_rsi_ob': 94, 'sideways_adx_thresh': 30.295711976977646, 'sideways_atr_min_pct': 0.008977136639280237, 'sideways_atr_max_pct': 0.10419229760681305, 'sideways_tp_mult': 2.765669201904387, 'sideways_tsl_mult': 0.030587772521776524, 'sideways_time_stop': 105, 'sideways_use_sma': True, 'sideways_use_ema': True, 'sideways_use_atr': False, 'sideways_use_adx': False, 'sideways_use_spike': True, 'sideways_rsi_required': False}.
[I 2025-08-31 10:32:47,054] Trial 572 finished with values: [-1000000000.0, 1000000000.0] and parameters: {'p_sma': 9, 'p_std': 46, 'p_atr': 8, 'p_adx': 17, 'rsi_period': 74, 'ema1': 19, 'ema2': 31, 'slip_atr_k': 0.1746176537690121, 'slip_spread_k': 0.1299940961513838, 'spread_hl_frac': 0.010676680299379505, 'bb_std_mult': 1.1793257742560186, 'rsi_os': 40, 'rsi_ob': 82, 'vol_spike': 0.25839920824069784, 'adx_thresh': 24.18589928752349, 'atr_min_pct': 0.010404266831587603, 'atr_max_pct': 0.03305514911254929, 'tp_mult': 2.903340332824383, 'tsl_mult': 0.6698781028117282, 'strategy': 'breakout', 'time_stop': 142, 'use_sma': True, 'use_atr': False, 'use_adx': False, 'use_ema': True, 'use_spike': False, 'rsi_required': True, 'edge_k': 1.8340918150544827, 'edge_cap': 0.11219173889502049, 'bull_strategy': 'breakout', 'bull_bb_std_mult': 1.2731309509134137, 'bull_rsi_os': 24, 'bull_rsi_ob': 50, 'bull_adx_thresh': 31.130349169835338, 'bull_atr_min_pct': 0.0063206346155122335, 'bull_atr_max_pct': 0.088329069976921, 'bull_tp_mult': 2.3449836281072396, 'bull_tsl_mult': 0.9233602879946274, 'bull_time_stop': 66, 'bull_use_sma': True, 'bull_use_ema': False, 'bull_use_atr': True, 'bull_use_adx': False, 'bull_use_spike': False, 'bull_rsi_required': True, 'bear_strategy': 'breakout', 'bear_bb_std_mult': 3.0451020506495032, 'bear_rsi_os': 30, 'bear_rsi_ob': 78, 'bear_adx_thresh': 10.216002726983247, 'bear_atr_min_pct': 0.009202930798655432, 'bear_atr_max_pct': 0.10024360958108973, 'bear_tp_mult': 2.055475587936538, 'bear_tsl_mult': 0.48641294098366694, 'bear_time_stop': 272, 'bear_use_sma': False, 'bear_use_ema': True, 'bear_use_atr': False, 'bear_use_adx': True, 'bear_use_spike': True, 'bear_rsi_required': True, 'sideways_strategy': 'breakout', 'sideways_bb_std_mult': 2.4985645171181345, 'sideways_rsi_os': 25, 'sideways_rsi_ob': 94, 'sideways_adx_thresh': 30.533477678201987, 'sideways_atr_min_pct': 0.00878290073912397, 'sideways_atr_max_pct': 0.1037619182274269, 'sideways_tp_mult': 2.9582435276671832, 'sideways_tsl_mult': 0.9152360629958322, 'sideways_time_stop': 228, 'sideways_use_sma': True, 'sideways_use_ema': True, 'sideways_use_atr': False, 'sideways_use_adx': False, 'sideways_use_spike': True, 'sideways_rsi_required': False}.
[I 2025-08-31 10:32:47,167] Trial 570 finished with values: [-1000000000.0, 1000000000.0] and parameters: {'p_sma': 12, 'p_std': 50, 'p_atr': 10, 'p_adx': 17, 'rsi_period': 23, 'ema1': 19, 'ema2': 36, 'slip_atr_k': 0.18653430311849625, 'slip_spread_k': 0.06767804890471489, 'spread_hl_frac': 0.026151625384617117, 'bb_std_mult': 0.5093839364849579, 'rsi_os': 40, 'rsi_ob': 80, 'vol_spike': 0.2997888119991195, 'adx_thresh': 25.557328077274818, 'atr_min_pct': 0.02509137108180254, 'atr_max_pct': 0.03239422364534642, 'tp_mult': 2.5755717441300376, 'tsl_mult': 0.5768538779345124, 'strategy': 'breakout', 'time_stop': 143, 'use_sma': True, 'use_atr': False, 'use_adx': False, 'use_ema': True, 'use_spike': False, 'rsi_required': True, 'edge_k': 0.37494546728731015, 'edge_cap': 0.933637325612322, 'bull_strategy': 'breakout', 'bull_bb_std_mult': 1.160708278057574, 'bull_rsi_os': 22, 'bull_rsi_ob': 67, 'bull_adx_thresh': 7.7911703388378815, 'bull_atr_min_pct': 0.0065724555652031695, 'bull_atr_max_pct': 0.08474339990918878, 'bull_tp_mult': 2.1710618621566087, 'bull_tsl_mult': 0.9249057407838781, 'bull_time_stop': 74, 'bull_use_sma': False, 'bull_use_ema': False, 'bull_use_atr': True, 'bull_use_adx': False, 'bull_use_spike': False, 'bull_rsi_required': True, 'bear_strategy': 'breakout', 'bear_bb_std_mult': 1.9682871344935242, 'bear_rsi_os': 24, 'bear_rsi_ob': 95, 'bear_adx_thresh': 21.14353019554879, 'bear_atr_min_pct': 0.006376000573952141, 'bear_atr_max_pct': 0.10042825429202426, 'bear_tp_mult': 2.0628505081960484, 'bear_tsl_mult': 0.7125760200091139, 'bear_time_stop': 287, 'bear_use_sma': True, 'bear_use_ema': True, 'bear_use_atr': False, 'bear_use_adx': False, 'bear_use_spike': True, 'bear_rsi_required': True, 'sideways_strategy': 'breakout', 'sideways_bb_std_mult': 2.4333005249405724, 'sideways_rsi_os': 42, 'sideways_rsi_ob': 94, 'sideways_adx_thresh': 30.59985734220241, 'sideways_atr_min_pct': 0.0138612879647039, 'sideways_atr_max_pct': 0.10326339515705002, 'sideways_tp_mult': 2.9651883214840398, 'sideways_tsl_mult': 0.9040210550941896, 'sideways_time_stop': 43, 'sideways_use_sma': True, 'sideways_use_ema': True, 'sideways_use_atr': False, 'sideways_use_adx': False, 'sideways_use_spike': True, 'sideways_rsi_required': False}.
[I 2025-08-31 10:33:22,104] Trial 574 finished with values: [-1000000000.0, 1000000000.0] and parameters: {'p_sma': 11, 'p_std': 46, 'p_atr': 29, 'p_adx': 23, 'rsi_period': 23, 'ema1': 17, 'ema2': 37, 'slip_atr_k': 0.1843866973953692, 'slip_spread_k': 0.14103386235802706, 'spread_hl_frac': 0.010671675502973722, 'bb_std_mult': 1.1910562576125558, 'rsi_os': 39, 'rsi_ob': 82, 'vol_spike': 0.2995503421958823, 'adx_thresh': 25.55105485524525, 'atr_min_pct': 0.010316152378378698, 'atr_max_pct': 0.1257930335249231, 'tp_mult': 2.903621135644347, 'tsl_mult': 0.30348482536738053, 'strategy': 'breakout', 'time_stop': 145, 'use_sma': False, 'use_atr': False, 'use_adx': False, 'use_ema': True, 'use_spike': False, 'rsi_required': True, 'edge_k': 0.04550005498571463, 'edge_cap': 0.9373899098850289, 'bull_strategy': 'mean_reversion', 'bull_bb_std_mult': 1.2819343419206335, 'bull_rsi_os': 26, 'bull_rsi_ob': 87, 'bull_adx_thresh': 7.892514310319466, 'bull_atr_min_pct': 0.0045637437631794175, 'bull_atr_max_pct': 0.09414266026908377, 'bull_tp_mult': 2.325393953220014, 'bull_tsl_mult': 0.959442209829701, 'bull_time_stop': 60, 'bull_use_sma': True, 'bull_use_ema': False, 'bull_use_atr': False, 'bull_use_adx': False, 'bull_use_spike': False, 'bull_rsi_required': False, 'bear_strategy': 'breakout', 'bear_bb_std_mult': 3.0586231947011218, 'bear_rsi_os': 26, 'bear_rsi_ob': 94, 'bear_adx_thresh': 10.410542182858196, 'bear_atr_min_pct': 0.008899923104003074, 'bear_atr_max_pct': 0.10015011960510055, 'bear_tp_mult': 2.041458883379094, 'bear_tsl_mult': 0.872360579477905, 'bear_time_stop': 275, 'bear_use_sma': False, 'bear_use_ema': True, 'bear_use_atr': False, 'bear_use_adx': True, 'bear_use_spike': True, 'bear_rsi_required': True, 'sideways_strategy': 'breakout', 'sideways_bb_std_mult': 2.4826644019099375, 'sideways_rsi_os': 22, 'sideways_rsi_ob': 93, 'sideways_adx_thresh': 28.615620693633378, 'sideways_atr_min_pct': 0.02820571489392949, 'sideways_atr_max_pct': 0.10895357044195465, 'sideways_tp_mult': 2.9416233710878577, 'sideways_tsl_mult': 0.4649371869891021, 'sideways_time_stop': 227, 'sideways_use_sma': True, 'sideways_use_ema': True, 'sideways_use_atr': False, 'sideways_use_adx': False, 'sideways_use_spike': True, 'sideways_rsi_required': False}.
[I 2025-08-31 10:33:22,652] Trial 573 finished with values: [-1000000000.0, 1000000000.0] and parameters: {'p_sma': 11, 'p_std': 46, 'p_atr': 29, 'p_adx': 23, 'rsi_period': 74, 'ema1': 17, 'ema2': 58, 'slip_atr_k': 0.09732112869455747, 'slip_spread_k': 0.1331217851397345, 'spread_hl_frac': 0.02627510643788966, 'bb_std_mult': 2.8255907070115627, 'rsi_os': 39, 'rsi_ob': 82, 'vol_spike': 0.2994526385266459, 'adx_thresh': 25.465990285586138, 'atr_min_pct': 0.0025891968928093475, 'atr_max_pct': 0.01678918704917816, 'tp_mult': 2.9152907196042634, 'tsl_mult': 0.04707167615936355, 'strategy': 'breakout', 'time_stop': 95, 'use_sma': False, 'use_atr': False, 'use_adx': False, 'use_ema': True, 'use_spike': False, 'rsi_required': True, 'edge_k': 1.830839633805587, 'edge_cap': 0.15379639424780311, 'bull_strategy': 'mean_reversion', 'bull_bb_std_mult': 2.164073043386437, 'bull_rsi_os': 25, 'bull_rsi_ob': 52, 'bull_adx_thresh': 30.414707767878937, 'bull_atr_min_pct': 0.004364750421123, 'bull_atr_max_pct': 0.0875186734088039, 'bull_tp_mult': 2.3404690392019694, 'bull_tsl_mult': 0.9979767319953287, 'bull_time_stop': 67, 'bull_use_sma': True, 'bull_use_ema': False, 'bull_use_atr': False, 'bull_use_adx': False, 'bull_use_spike': False, 'bull_rsi_required': False, 'bear_strategy': 'breakout', 'bear_bb_std_mult': 3.0001321227883566, 'bear_rsi_os': 26, 'bear_rsi_ob': 93, 'bear_adx_thresh': 10.538853082638655, 'bear_atr_min_pct': 0.009466891433135187, 'bear_atr_max_pct': 0.10015976198394502, 'bear_tp_mult': 1.8724594756923736, 'bear_tsl_mult': 0.4592008991115562, 'bear_time_stop': 273, 'bear_use_sma': False, 'bear_use_ema': True, 'bear_use_atr': False, 'bear_use_adx': True, 'bear_use_spike': True, 'bear_rsi_required': True, 'sideways_strategy': 'breakout', 'sideways_bb_std_mult': 2.439293098067749, 'sideways_rsi_os': 20, 'sideways_rsi_ob': 91, 'sideways_adx_thresh': 28.666989459995115, 'sideways_atr_min_pct': 0.015725573007074608, 'sideways_atr_max_pct': 0.10933196830448619, 'sideways_tp_mult': 2.9111907017678536, 'sideways_tsl_mult': 0.09918218193289649, 'sideways_time_stop': 227, 'sideways_use_sma': True, 'sideways_use_ema': True, 'sideways_use_atr': False, 'sideways_use_adx': False, 'sideways_use_spike': True, 'sideways_rsi_required': False}.
[I 2025-08-31 10:33:23,066] Trial 575 finished with values: [-1000000000.0, 1000000000.0] and parameters: {'p_sma': 11, 'p_std': 49, 'p_atr': 29, 'p_adx': 10, 'rsi_period': 59, 'ema1': 17, 'ema2': 45, 'slip_atr_k': 0.1830945346372841, 'slip_spread_k': 0.10226175085622295, 'spread_hl_frac': 0.006662507754286888, 'bb_std_mult': 2.1884789302221996, 'rsi_os': 36, 'rsi_ob': 82, 'vol_spike': 0.26963567874834776, 'adx_thresh': 25.24902630106715, 'atr_min_pct': 0.0025716377719470548, 'atr_max_pct': 0.1255672629580993, 'tp_mult': 2.2516313236574796, 'tsl_mult': 0.04883087315293167, 'strategy': 'breakout', 'time_stop': 130, 'use_sma': False, 'use_atr': False, 'use_adx': False, 'use_ema': True, 'use_spike': False, 'rsi_required': True, 'edge_k': 1.9688875587093917, 'edge_cap': 0.14956702206070824, 'bull_strategy': 'mean_reversion', 'bull_bb_std_mult': 2.7605753309052736, 'bull_rsi_os': 26, 'bull_rsi_ob': 63, 'bull_adx_thresh': 28.23051582360906, 'bull_atr_min_pct': 0.007215583844270042, 'bull_atr_max_pct': 0.0934141605098848, 'bull_tp_mult': 2.2215435058089663, 'bull_tsl_mult': 0.9610157224843306, 'bull_time_stop': 62, 'bull_use_sma': True, 'bull_use_ema': False, 'bull_use_atr': False, 'bull_use_adx': False, 'bull_use_spike': True, 'bull_rsi_required': False, 'bear_strategy': 'breakout', 'bear_bb_std_mult': 2.062000145030164, 'bear_rsi_os': 26, 'bear_rsi_ob': 92, 'bear_adx_thresh': 20.571819888140276, 'bear_atr_min_pct': 0.007343689674780788, 'bear_atr_max_pct': 0.10398534071946978, 'bear_tp_mult': 1.9971522052845698, 'bear_tsl_mult': 0.45839462225036426, 'bear_time_stop': 274, 'bear_use_sma': False, 'bear_use_ema': True, 'bear_use_atr': False, 'bear_use_adx': True, 'bear_use_spike': True, 'bear_rsi_required': True, 'sideways_strategy': 'breakout', 'sideways_bb_std_mult': 3.186329880357899, 'sideways_rsi_os': 22, 'sideways_rsi_ob': 91, 'sideways_adx_thresh': 28.620059687504018, 'sideways_atr_min_pct': 0.0018642654988178494, 'sideways_atr_max_pct': 0.10870191096931978, 'sideways_tp_mult': 2.930358434030055, 'sideways_tsl_mult': 0.09833953466417851, 'sideways_time_stop': 270, 'sideways_use_sma': True, 'sideways_use_ema': True, 'sideways_use_atr': True, 'sideways_use_adx': False, 'sideways_use_spike': True, 'sideways_rsi_required': False}.
