[I 2025-08-31 11:03:03,212] Trial 793 finished with values: [-1000000000.0, 1000000000.0] and parameters: {'p_sma': 7, 'p_std': 45, 'p_atr': 16, 'p_adx': 20, 'rsi_period': 30, 'ema1': 16, 'ema2': 39, 'slip_atr_k': 0.19415664764890606, 'slip_spread_k': 0.8442537988886029, 'spread_hl_frac': 0.026990257939945174, 'bb_std_mult': 1.6089375521573395, 'rsi_os': 38, 'rsi_ob': 72, 'vol_spike': 0.24048966792339632, 'adx_thresh': 30.881033458949616, 'atr_min_pct': 0.025134498402685924, 'atr_max_pct': 0.10949630168990303, 'tp_mult': 1.2228870250560733, 'tsl_mult': 0.030833297926440694, 'strategy': 'breakout', 'time_stop': 157, 'use_sma': True, 'use_atr': False, 'use_adx': False, 'use_ema': True, 'use_spike': False, 'rsi_required': True, 'edge_k': 1.8713043811660492, 'edge_cap': 0.7050305129002679, 'bull_strategy': 'breakout', 'bull_bb_std_mult': 2.36232130858431, 'bull_rsi_os': 26, 'bull_rsi_ob': 73, 'bull_adx_thresh': 29.710368888661773, 'bull_atr_min_pct': 0.01599585638828486, 'bull_atr_max_pct': 0.018483156161044033, 'bull_tp_mult': 1.8521359405402227, 'bull_tsl_mult': 0.9402474614262811, 'bull_time_stop': 73, 'bull_use_sma': True, 'bull_use_ema': False, 'bull_use_atr': False, 'bull_use_adx': False, 'bull_use_spike': False, 'bull_rsi_required': True, 'bear_strategy': 'mean_reversion', 'bear_bb_std_mult': 2.392601851452141, 'bear_rsi_os': 13, 'bear_rsi_ob': 57, 'bear_adx_thresh': 20.96577192719255, 'bear_atr_min_pct': 0.007046983882714242, 'bear_atr_max_pct': 0.04335118575292144, 'bear_tp_mult': 2.0595568027724815, 'bear_tsl_mult': 0.47459109633884056, 'bear_time_stop': 271, 'bear_use_sma': False, 'bear_use_ema': False, 'bear_use_atr': False, 'bear_use_adx': True, 'bear_use_spike': True, 'bear_rsi_required': True, 'sideways_strategy': 'mean_reversion', 'sideways_bb_std_mult': 1.5669896511558388, 'sideways_rsi_os': 24, 'sideways_rsi_ob': 57, 'sideways_adx_thresh': 11.515632517690017, 'sideways_atr_min_pct': 0.021057800722907808, 'sideways_atr_max_pct': 0.09880208190268704, 'sideways_tp_mult': 2.8644856395664986, 'sideways_tsl_mult': 0.7989880850034897, 'sideways_time_stop': 292, 'sideways_use_sma': True, 'sideways_use_ema': True, 'sideways_use_atr': False, 'sideways_use_adx': False, 'sideways_use_spike': True, 'sideways_rsi_required': True}.
[I 2025-08-31 11:03:03,520] Trial 792 finished with values: [-1000000000.0, 1000000000.0] and parameters: {'p_sma': 7, 'p_std': 51, 'p_atr': 11, 'p_adx': 23, 'rsi_period': 24, 'ema1': 27, 'ema2': 40, 'slip_atr_k': 0.19151827880295208, 'slip_spread_k': 0.07573435385003079, 'spread_hl_frac': 0.011696612451581535, 'bb_std_mult': 1.2386202227994576, 'rsi_os': 53, 'rsi_ob': 79, 'vol_spike': 0.24422754825482168, 'adx_thresh': 24.989664075400487, 'atr_min_pct': 0.01165519211366494, 'atr_max_pct': 0.08505560303704221, 'tp_mult': 1.2061018047669492, 'tsl_mult': 0.03341517867113741, 'strategy': 'breakout', 'time_stop': 129, 'use_sma': False, 'use_atr': False, 'use_adx': False, 'use_ema': True, 'use_spike': False, 'rsi_required': True, 'edge_k': 0.5731160242523847, 'edge_cap': 0.6857834314846882, 'bull_strategy': 'mean_reversion', 'bull_bb_std_mult': 3.217497631164381, 'bull_rsi_os': 37, 'bull_rsi_ob': 51, 'bull_adx_thresh': 29.833438384292474, 'bull_atr_min_pct': 0.0059323854820920435, 'bull_atr_max_pct': 0.07389858326003036, 'bull_tp_mult': 2.2695114320575938, 'bull_tsl_mult': 0.5022548143349906, 'bull_time_stop': 167, 'bull_use_sma': True, 'bull_use_ema': False, 'bull_use_atr': True, 'bull_use_adx': False, 'bull_use_spike': False, 'bull_rsi_required': True, 'bear_strategy': 'mean_reversion', 'bear_bb_std_mult': 0.7137122461673371, 'bear_rsi_os': 28, 'bear_rsi_ob': 63, 'bear_adx_thresh': 30.026039250466965, 'bear_atr_min_pct': 0.0059698419172144485, 'bear_atr_max_pct': 0.11308394648802382, 'bear_tp_mult': 2.270876545899533, 'bear_tsl_mult': 0.4797899960442471, 'bear_time_stop': 268, 'bear_use_sma': False, 'bear_use_ema': True, 'bear_use_atr': False, 'bear_use_adx': True, 'bear_use_spike': True, 'bear_rsi_required': True, 'sideways_strategy': 'mean_reversion', 'sideways_bb_std_mult': 1.0564290635310798, 'sideways_rsi_os': 24, 'sideways_rsi_ob': 46, 'sideways_adx_thresh': 28.25725019465029, 'sideways_atr_min_pct': 0.026483481077065923, 'sideways_atr_max_pct': 0.14352367978668157, 'sideways_tp_mult': 2.8652400309052157, 'sideways_tsl_mult': 0.6636274769221872, 'sideways_time_stop': 167, 'sideways_use_sma': True, 'sideways_use_ema': True, 'sideways_use_atr': False, 'sideways_use_adx': False, 'sideways_use_spike': True, 'sideways_rsi_required': True}.
[I 2025-08-31 11:03:03,639] Trial 794 finished with values: [-1000000000.0, 1000000000.0] and parameters: {'p_sma': 7, 'p_std': 51, 'p_atr': 16, 'p_adx': 20, 'rsi_period': 56, 'ema1': 18, 'ema2': 37, 'slip_atr_k': 0.1936064670278067, 'slip_spread_k': 0.5489939416234993, 'spread_hl_frac': 0.011610794421994022, 'bb_std_mult': 1.022577541885352, 'rsi_os': 38, 'rsi_ob': 82, 'vol_spike': 0.28281960741927137, 'adx_thresh': 25.10189350123031, 'atr_min_pct': 0.012549463374377115, 'atr_max_pct': 0.08492661137853998, 'tp_mult': 1.053619052564731, 'tsl_mult': 0.044807177073815416, 'strategy': 'breakout', 'time_stop': 5, 'use_sma': True, 'use_atr': False, 'use_adx': False, 'use_ema': True, 'use_spike': False, 'rsi_required': True, 'edge_k': 1.862681535868735, 'edge_cap': 0.1804485607712708, 'bull_strategy': 'breakout', 'bull_bb_std_mult': 1.2381802385815535, 'bull_rsi_os': 26, 'bull_rsi_ob': 91, 'bull_adx_thresh': 19.001227892594414, 'bull_atr_min_pct': 0.00010500977262503826, 'bull_atr_max_pct': 0.01439817773908332, 'bull_tp_mult': 2.5076762645917645, 'bull_tsl_mult': 0.8955479488117836, 'bull_time_stop': 74, 'bull_use_sma': True, 'bull_use_ema': False, 'bull_use_atr': True, 'bull_use_adx': False, 'bull_use_spike': False, 'bull_rsi_required': True, 'bear_strategy': 'mean_reversion', 'bear_bb_std_mult': 2.9012234629715143, 'bear_rsi_os': 27, 'bear_rsi_ob': 57, 'bear_adx_thresh': 29.992384162435776, 'bear_atr_min_pct': 0.010052721921824118, 'bear_atr_max_pct': 0.11460895574450455, 'bear_tp_mult': 1.9869112242077014, 'bear_tsl_mult': 0.4775576972305563, 'bear_time_stop': 272, 'bear_use_sma': False, 'bear_use_ema': False, 'bear_use_atr': False, 'bear_use_adx': True, 'bear_use_spike': True, 'bear_rsi_required': True, 'sideways_strategy': 'mean_reversion', 'sideways_bb_std_mult': 1.5850221478909972, 'sideways_rsi_os': 48, 'sideways_rsi_ob': 94, 'sideways_adx_thresh': 11.497789352527523, 'sideways_atr_min_pct': 0.015487994079842388, 'sideways_atr_max_pct': 0.10459524219876579, 'sideways_tp_mult': 2.840914295125381, 'sideways_tsl_mult': 0.11644480148984312, 'sideways_time_stop': 293, 'sideways_use_sma': True, 'sideways_use_ema': True, 'sideways_use_atr': False, 'sideways_use_adx': False, 'sideways_use_spike': True, 'sideways_rsi_required': True}.
[I 2025-08-31 11:03:36,384] Trial 797 finished with values: [-1000000000.0, 1000000000.0] and parameters: {'p_sma': 13, 'p_std': 46, 'p_atr': 22, 'p_adx': 10, 'rsi_period': 28, 'ema1': 18, 'ema2': 43, 'slip_atr_k': 0.12426028754951905, 'slip_spread_k': 0.10926853012193394, 'spread_hl_frac': 0.01342629967318302, 'bb_std_mult': 2.7697879427333207, 'rsi_os': 14, 'rsi_ob': 84, 'vol_spike': 0.22846331736455722, 'adx_thresh': 24.16785589689224, 'atr_min_pct': 0.018774845978387578, 'atr_max_pct': 0.12316749605842772, 'tp_mult': 1.8430314801828076, 'tsl_mult': 0.5958389065433888, 'strategy': 'mean_reversion', 'time_stop': 139, 'use_sma': True, 'use_atr': False, 'use_adx': False, 'use_ema': True, 'use_spike': False, 'rsi_required': True, 'edge_k': 1.9536802543151977, 'edge_cap': 0.1737102404118916, 'bull_strategy': 'breakout', 'bull_bb_std_mult': 2.2053668292681206, 'bull_rsi_os': 16, 'bull_rsi_ob': 53, 'bull_adx_thresh': 11.7182085839949, 'bull_atr_min_pct': 0.008570433968663143, 'bull_atr_max_pct': 0.014892186582023043, 'bull_tp_mult': 2.2082526012868224, 'bull_tsl_mult': 0.09435701577507316, 'bull_time_stop': 77, 'bull_use_sma': False, 'bull_use_ema': False, 'bull_use_atr': False, 'bull_use_adx': False, 'bull_use_spike': False, 'bull_rsi_required': True, 'bear_strategy': 'breakout', 'bear_bb_std_mult': 2.967451400227124, 'bear_rsi_os': 27, 'bear_rsi_ob': 82, 'bear_adx_thresh': 22.143960779318974, 'bear_atr_min_pct': 0.006675890070974935, 'bear_atr_max_pct': 0.10505518059121749, 'bear_tp_mult': 2.9496335053310503, 'bear_tsl_mult': 0.7442349111878243, 'bear_time_stop': 243, 'bear_use_sma': False, 'bear_use_ema': False, 'bear_use_atr': False, 'bear_use_adx': True, 'bear_use_spike': True, 'bear_rsi_required': True, 'sideways_strategy': 'breakout', 'sideways_bb_std_mult': 0.9433972081917578, 'sideways_rsi_os': 25, 'sideways_rsi_ob': 59, 'sideways_adx_thresh': 29.926892914758277, 'sideways_atr_min_pct': 0.001257666741536519, 'sideways_atr_max_pct': 0.10461030529193353, 'sideways_tp_mult': 2.9444777909737287, 'sideways_tsl_mult': 0.12998159675874452, 'sideways_time_stop': 235, 'sideways_use_sma': True, 'sideways_use_ema': True, 'sideways_use_atr': False, 'sideways_use_adx': False, 'sideways_use_spike': True, 'sideways_rsi_required': False}.
[I 2025-08-31 11:03:36,923] Trial 796 finished with values: [-0.027689815044913302, 0.02754049227477904] and parameters: {'p_sma': 13, 'p_std': 27, 'p_atr': 15, 'p_adx': 10, 'rsi_period': 56, 'ema1': 18, 'ema2': 37, 'slip_atr_k': 0.1880420829396502, 'slip_spread_k': 0.037852910960537486, 'spread_hl_frac': 0.013309992016525206, 'bb_std_mult': 1.2489117379870307, 'rsi_os': 40, 'rsi_ob': 95, 'vol_spike': 0.2950658479521507, 'adx_thresh': 18.558768841056306, 'atr_min_pct': 0.012499441085131884, 'atr_max_pct': 0.11261524525047788, 'tp_mult': 2.859955892520445, 'tsl_mult': 0.3555958519332227, 'strategy': 'mean_reversion', 'time_stop': 138, 'use_sma': True, 'use_atr': False, 'use_adx': False, 'use_ema': True, 'use_spike': False, 'rsi_required': True, 'edge_k': 1.9620559651840923, 'edge_cap': 0.16937578666912878, 'bull_strategy': 'breakout', 'bull_bb_std_mult': 1.2296471741165171, 'bull_rsi_os': 37, 'bull_rsi_ob': 67, 'bull_adx_thresh': 33.60996212157974, 'bull_atr_min_pct': 0.0006499217899138907, 'bull_atr_max_pct': 0.08535498140352771, 'bull_tp_mult': 2.2905846490687516, 'bull_tsl_mult': 0.904465474575664, 'bull_time_stop': 169, 'bull_use_sma': False, 'bull_use_ema': False, 'bull_use_atr': False, 'bull_use_adx': False, 'bull_use_spike': False, 'bull_rsi_required': True, 'bear_strategy': 'mean_reversion', 'bear_bb_std_mult': 2.9737620104128575, 'bear_rsi_os': 27, 'bear_rsi_ob': 77, 'bear_adx_thresh': 22.17974253949026, 'bear_atr_min_pct': 0.010223569076662435, 'bear_atr_max_pct': 0.11470496404481145, 'bear_tp_mult': 2.0891172132737936, 'bear_tsl_mult': 0.4878245046368855, 'bear_time_stop': 241, 'bear_use_sma': False, 'bear_use_ema': True, 'bear_use_atr': False, 'bear_use_adx': True, 'bear_use_spike': True, 'bear_rsi_required': True, 'sideways_strategy': 'breakout', 'sideways_bb_std_mult': 2.0071920284891256, 'sideways_rsi_os': 18, 'sideways_rsi_ob': 95, 'sideways_adx_thresh': 28.100816074727796, 'sideways_atr_min_pct': 0.026713296751210376, 'sideways_atr_max_pct': 0.10402728309403345, 'sideways_tp_mult': 2.9425996599750452, 'sideways_tsl_mult': 0.38871730356580103, 'sideways_time_stop': 235, 'sideways_use_sma': True, 'sideways_use_ema': True, 'sideways_use_atr': False, 'sideways_use_adx': False, 'sideways_use_spike': True, 'sideways_rsi_required': False}.
[I 2025-08-31 11:03:37,062] Trial 795 finished with values: [-1000000000.0, 1000000000.0] and parameters: {'p_sma': 13, 'p_std': 29, 'p_atr': 19, 'p_adx': 10, 'rsi_period': 24, 'ema1': 18, 'ema2': 43, 'slip_atr_k': 0.18710435078276744, 'slip_spread_k': 0.8439937885528577, 'spread_hl_frac': 0.013325592472705422, 'bb_std_mult': 1.1531522815160793, 'rsi_os': 38, 'rsi_ob': 57, 'vol_spike': 0.03929567121941255, 'adx_thresh': 23.931988931154134, 'atr_min_pct': 0.025652234834183447, 'atr_max_pct': 0.07220220105332008, 'tp_mult': 1.8317920003148758, 'tsl_mult': 0.030259633694325914, 'strategy': 'breakout', 'time_stop': 158, 'use_sma': True, 'use_atr': False, 'use_adx': False, 'use_ema': True, 'use_spike': False, 'rsi_required': True, 'edge_k': 1.868252412482716, 'edge_cap': 0.17117626708555486, 'bull_strategy': 'breakout', 'bull_bb_std_mult': 2.2193940771952065, 'bull_rsi_os': 50, 'bull_rsi_ob': 77, 'bull_adx_thresh': 15.171042088705427, 'bull_atr_min_pct': 0.008600850117520762, 'bull_atr_max_pct': 0.08514911813209905, 'bull_tp_mult': 2.1972913295995884, 'bull_tsl_mult': 0.8942330858083776, 'bull_time_stop': 73, 'bull_use_sma': True, 'bull_use_ema': False, 'bull_use_atr': False, 'bull_use_adx': False, 'bull_use_spike': False, 'bull_rsi_required': True, 'bear_strategy': 'mean_reversion', 'bear_bb_std_mult': 2.982916005347694, 'bear_rsi_os': 27, 'bear_rsi_ob': 82, 'bear_adx_thresh': 11.780042055686941, 'bear_atr_min_pct': 0.007013793754147511, 'bear_atr_max_pct': 0.10578306688890783, 'bear_tp_mult': 2.083292238503822, 'bear_tsl_mult': 0.4816541351578743, 'bear_time_stop': 268, 'bear_use_sma': False, 'bear_use_ema': False, 'bear_use_atr': False, 'bear_use_adx': True, 'bear_use_spike': True, 'bear_rsi_required': True, 'sideways_strategy': 'breakout', 'sideways_bb_std_mult': 2.091211898670935, 'sideways_rsi_os': 24, 'sideways_rsi_ob': 46, 'sideways_adx_thresh': 28.382039459714022, 'sideways_atr_min_pct': 0.021816797367129416, 'sideways_atr_max_pct': 0.09942906251810003, 'sideways_tp_mult': 2.3563137655951354, 'sideways_tsl_mult': 0.24590495366591503, 'sideways_time_stop': 5, 'sideways_use_sma': True, 'sideways_use_ema': True, 'sideways_use_atr': False, 'sideways_use_adx': False, 'sideways_use_spike': True, 'sideways_rsi_required': False}.
[I 2025-08-31 11:03:37,169] Trial 798 finished with values: [-0.03218186486489072, 0.03208720866017639] and parameters: {'p_sma': 13, 'p_std': 7, 'p_atr': 29, 'p_adx': 10, 'rsi_period': 27, 'ema1': 18, 'ema2': 37, 'slip_atr_k': 0.12276679259678411, 'slip_spread_k': 0.18068383393848164, 'spread_hl_frac': 0.012795186406535907, 'bb_std_mult': 1.148937913462129, 'rsi_os': 47, 'rsi_ob': 57, 'vol_spike': 0.23057022731138022, 'adx_thresh': 23.879986694835647, 'atr_min_pct': 0.020380811888671618, 'atr_max_pct': 0.12343752512162055, 'tp_mult': 2.861642227867489, 'tsl_mult': 0.10163102581904997, 'strategy': 'mean_reversion', 'time_stop': 139, 'use_sma': False, 'use_atr': False, 'use_adx': False, 'use_ema': True, 'use_spike': False, 'rsi_required': True, 'edge_k': 1.1573914141329313, 'edge_cap': 0.38933384284188044, 'bull_strategy': 'mean_reversion', 'bull_bb_std_mult': 1.0480724617324528, 'bull_rsi_os': 11, 'bull_rsi_ob': 53, 'bull_adx_thresh': 33.26501709070378, 'bull_atr_min_pct': 0.0082934454255647, 'bull_atr_max_pct': 0.08549284797510419, 'bull_tp_mult': 2.9379787970569873, 'bull_tsl_mult': 0.9494079134856732, 'bull_time_stop': 34, 'bull_use_sma': False, 'bull_use_ema': False, 'bull_use_atr': False, 'bull_use_adx': False, 'bull_use_spike': False, 'bull_rsi_required': True, 'bear_strategy': 'breakout', 'bear_bb_std_mult': 2.4732175297943333, 'bear_rsi_os': 29, 'bear_rsi_ob': 82, 'bear_adx_thresh': 33.88376320690287, 'bear_atr_min_pct': 0.00738664138971419, 'bear_atr_max_pct': 0.024011391649424833, 'bear_tp_mult': 2.086735111403091, 'bear_tsl_mult': 0.2873167749660757, 'bear_time_stop': 223, 'bear_use_sma': False, 'bear_use_ema': True, 'bear_use_atr': False, 'bear_use_adx': True, 'bear_use_spike': True, 'bear_rsi_required': True, 'sideways_strategy': 'breakout', 'sideways_bb_std_mult': 0.9696917900954929, 'sideways_rsi_os': 26, 'sideways_rsi_ob': 95, 'sideways_adx_thresh': 30.65546937740382, 'sideways_atr_min_pct': 8.136542406949818e-06, 'sideways_atr_max_pct': 0.10895029843342575, 'sideways_tp_mult': 1.2914818255144977, 'sideways_tsl_mult': 0.16537388972793665, 'sideways_time_stop': 237, 'sideways_use_sma': True, 'sideways_use_ema': True, 'sideways_use_atr': False, 'sideways_use_adx': False, 'sideways_use_spike': True, 'sideways_rsi_required': False}.
[I 2025-08-31 11:04:10,807] Trial 802 finished with values: [-1000000000.0, 1000000000.0] and parameters: {'p_sma': 11, 'p_std': 49, 'p_atr': 28, 'p_adx': 30, 'rsi_period': 22, 'ema1': 23, 'ema2': 17, 'slip_atr_k': 0.18250242673591602, 'slip_spread_k': 0.10483551397758682, 'spread_hl_frac': 0.010274627206959284, 'bb_std_mult': 1.404837378940785, 'rsi_os': 11, 'rsi_ob': 87, 'vol_spike': 0.28905215198642253, 'adx_thresh': 33.36671595341452, 'atr_min_pct': 0.009919415697654876, 'atr_max_pct': 0.014070522358478721, 'tp_mult': 2.9257006023062213, 'tsl_mult': 0.07645314383699436, 'strategy': 'breakout', 'time_stop': 184, 'use_sma': False, 'use_atr': True, 'use_adx': True, 'use_ema': True, 'use_spike': True, 'rsi_required': True, 'edge_k': 1.6264868070954925, 'edge_cap': 0.08780981693347636, 'bull_strategy': 'mean_reversion', 'bull_bb_std_mult': 1.3311931724383332, 'bull_rsi_os': 29, 'bull_rsi_ob': 69, 'bull_adx_thresh': 31.088560441442812, 'bull_atr_min_pct': 0.006950946049903868, 'bull_atr_max_pct': 0.08138931211211092, 'bull_tp_mult': 2.3376844634319376, 'bull_tsl_mult': 0.9823751627884056, 'bull_time_stop': 66, 'bull_use_sma': True, 'bull_use_ema': True, 'bull_use_atr': False, 'bull_use_adx': False, 'bull_use_spike': False, 'bull_rsi_required': False, 'bear_strategy': 'breakout', 'bear_bb_std_mult': 0.5263900620496178, 'bear_rsi_os': 17, 'bear_rsi_ob': 72, 'bear_adx_thresh': 19.301637219710695, 'bear_atr_min_pct': 0.008528077474739486, 'bear_atr_max_pct': 0.07152130093935011, 'bear_tp_mult': 2.1650278350757515, 'bear_tsl_mult': 0.32177282209828156, 'bear_time_stop': 256, 'bear_use_sma': True, 'bear_use_ema': True, 'bear_use_atr': True, 'bear_use_adx': True, 'bear_use_spike': True, 'bear_rsi_required': False, 'sideways_strategy': 'breakout', 'sideways_bb_std_mult': 0.7754862645854577, 'sideways_rsi_os': 22, 'sideways_rsi_ob': 93, 'sideways_adx_thresh': 29.999962272169487, 'sideways_atr_min_pct': 0.002552938638317643, 'sideways_atr_max_pct': 0.059344486262072366, 'sideways_tp_mult': 2.9056130922797365, 'sideways_tsl_mult': 0.01770333866088003, 'sideways_time_stop': 267, 'sideways_use_sma': False, 'sideways_use_ema': True, 'sideways_use_atr': False, 'sideways_use_adx': False, 'sideways_use_spike': True, 'sideways_rsi_required': False}.
[I 2025-08-31 11:04:10,981] Trial 801 finished with values: [-1000000000.0, 1000000000.0] and parameters: {'p_sma': 40, 'p_std': 34, 'p_atr': 28, 'p_adx': 9, 'rsi_period': 22, 'ema1': 17, 'ema2': 21, 'slip_atr_k': 0.18172173121622048, 'slip_spread_k': 0.17268637050468427, 'spread_hl_frac': 0.031555853661765235, 'bb_std_mult': 1.3944022238951028, 'rsi_os': 42, 'rsi_ob': 74, 'vol_spike': 0.2886726467739864, 'adx_thresh': 23.947539098768907, 'atr_min_pct': 0.009932953398366588, 'atr_max_pct': 0.014446937587591274, 'tp_mult': 1.137173043269589, 'tsl_mult': 0.09367556919831951, 'strategy': 'breakout', 'time_stop': 152, 'use_sma': False, 'use_atr': True, 'use_adx': True, 'use_ema': True, 'use_spike': False, 'rsi_required': True, 'edge_k': 0.6805376429427885, 'edge_cap': 0.4186539243060472, 'bull_strategy': 'mean_reversion', 'bull_bb_std_mult': 1.294280505935616, 'bull_rsi_os': 29, 'bull_rsi_ob': 64, 'bull_adx_thresh': 31.10773055797382, 'bull_atr_min_pct': 0.0033666787694057697, 'bull_atr_max_pct': 0.0793095855977429, 'bull_tp_mult': 2.44803429618826, 'bull_tsl_mult': 0.06117920715117403, 'bull_time_stop': 65, 'bull_use_sma': True, 'bull_use_ema': False, 'bull_use_atr': False, 'bull_use_adx': False, 'bull_use_spike': False, 'bull_rsi_required': False, 'bear_strategy': 'breakout', 'bear_bb_std_mult': 2.866690179022702, 'bear_rsi_os': 49, 'bear_rsi_ob': 79, 'bear_adx_thresh': 5.002713379992651, 'bear_atr_min_pct': 0.008590922852794718, 'bear_atr_max_pct': 0.12487586981149104, 'bear_tp_mult': 1.4998808540030897, 'bear_tsl_mult': 0.39940368175062696, 'bear_time_stop': 258, 'bear_use_sma': False, 'bear_use_ema': True, 'bear_use_atr': False, 'bear_use_adx': True, 'bear_use_spike': True, 'bear_rsi_required': False, 'sideways_strategy': 'breakout', 'sideways_bb_std_mult': 0.9457208205482105, 'sideways_rsi_os': 26, 'sideways_rsi_ob': 93, 'sideways_adx_thresh': 30.829895939620908, 'sideways_atr_min_pct': 0.0042299195774789695, 'sideways_atr_max_pct': 0.10946393415695944, 'sideways_tp_mult': 1.2478443674345647, 'sideways_tsl_mult': 0.07093117093821051, 'sideways_time_stop': 188, 'sideways_use_sma': True, 'sideways_use_ema': True, 'sideways_use_atr': False, 'sideways_use_adx': False, 'sideways_use_spike': True, 'sideways_rsi_required': False}.
