[I 2025-08-31 10:16:02,454] Trial 449 finished with values: [-1000000000.0, 1000000000.0] and parameters: {'p_sma': 48, 'p_std': 51, 'p_atr': 28, 'p_adx': 22, 'rsi_period': 21, 'ema1': 20, 'ema2': 13, 'slip_atr_k': 0.1584275046251765, 'slip_spread_k': 0.5176175121398465, 'spread_hl_frac': 0.003364348452415483, 'bb_std_mult': 1.0748440084573907, 'rsi_os': 8, 'rsi_ob': 50, 'vol_spike': 0.19421686237139074, 'adx_thresh': 34.16661657611246, 'atr_min_pct': 0.013741064311312785, 'atr_max_pct': 0.13005257014640487, 'tp_mult': 2.8535879153683834, 'tsl_mult': 0.08330913082115604, 'strategy': 'breakout', 'time_stop': 294, 'use_sma': False, 'use_atr': False, 'use_adx': False, 'use_ema': False, 'use_spike': False, 'rsi_required': True, 'edge_k': 1.2422007890391566, 'edge_cap': 0.8317892120941044, 'bull_strategy': 'mean_reversion', 'bull_bb_std_mult': 1.2500954185593642, 'bull_rsi_os': 33, 'bull_rsi_ob': 54, 'bull_adx_thresh': 21.047283705783443, 'bull_atr_min_pct': 0.028330256537892923, 'bull_atr_max_pct': 0.1176722129046722, 'bull_tp_mult': 1.4494611542963418, 'bull_tsl_mult': 0.6230503542101241, 'bull_time_stop': 260, 'bull_use_sma': True, 'bull_use_ema': False, 'bull_use_atr': False, 'bull_use_adx': False, 'bull_use_spike': False, 'bull_rsi_required': True, 'bear_strategy': 'breakout', 'bear_bb_std_mult': 2.697182111093981, 'bear_rsi_os': 53, 'bear_rsi_ob': 66, 'bear_adx_thresh': 5.952963009969556, 'bear_atr_min_pct': 0.019929308801989714, 'bear_atr_max_pct': 0.14721832163931559, 'bear_tp_mult': 2.636436580495871, 'bear_tsl_mult': 0.5336307848280154, 'bear_time_stop': 257, 'bear_use_sma': False, 'bear_use_ema': True, 'bear_use_atr': False, 'bear_use_adx': False, 'bear_use_spike': True, 'bear_rsi_required': True, 'sideways_strategy': 'breakout', 'sideways_bb_std_mult': 1.0939932100628913, 'sideways_rsi_os': 23, 'sideways_rsi_ob': 89, 'sideways_adx_thresh': 31.53654092428232, 'sideways_atr_min_pct': 0.004623612589336627, 'sideways_atr_max_pct': 0.029586632702093614, 'sideways_tp_mult': 1.5653736297424843, 'sideways_tsl_mult': 0.21162857785682215, 'sideways_time_stop': 174, 'sideways_use_sma': True, 'sideways_use_ema': True, 'sideways_use_atr': False, 'sideways_use_adx': False, 'sideways_use_spike': False, 'sideways_rsi_required': False}.
[I 2025-08-31 10:16:36,347] Trial 453 finished with values: [-1000000000.0, 1000000000.0] and parameters: {'p_sma': 49, 'p_std': 19, 'p_atr': 13, 'p_adx': 21, 'rsi_period': 21, 'ema1': 18, 'ema2': 39, 'slip_atr_k': 0.12465417964638345, 'slip_spread_k': 0.27020095286479295, 'spread_hl_frac': 0.012665059236535721, 'bb_std_mult': 1.0177689537857713, 'rsi_os': 28, 'rsi_ob': 89, 'vol_spike': 0.2752581069439496, 'adx_thresh': 19.053140479502904, 'atr_min_pct': 0.007847943350465882, 'atr_max_pct': 0.13898870654522733, 'tp_mult': 2.841385727142294, 'tsl_mult': 0.8803307206108769, 'strategy': 'breakout', 'time_stop': 21, 'use_sma': False, 'use_atr': True, 'use_adx': False, 'use_ema': False, 'use_spike': True, 'rsi_required': True, 'edge_k': 0.8867951211884721, 'edge_cap': 0.15637461409621814, 'bull_strategy': 'mean_reversion', 'bull_bb_std_mult': 1.3297181345255875, 'bull_rsi_os': 30, 'bull_rsi_ob': 62, 'bull_adx_thresh': 31.72280399559445, 'bull_atr_min_pct': 0.020096854368196675, 'bull_atr_max_pct': 0.11343260511677558, 'bull_tp_mult': 1.466218149646238, 'bull_tsl_mult': 0.5289793881142875, 'bull_time_stop': 173, 'bull_use_sma': True, 'bull_use_ema': True, 'bull_use_atr': False, 'bull_use_adx': False, 'bull_use_spike': False, 'bull_rsi_required': True, 'bear_strategy': 'breakout', 'bear_bb_std_mult': 2.791491117526348, 'bear_rsi_os': 55, 'bear_rsi_ob': 57, 'bear_adx_thresh': 20.610840670369065, 'bear_atr_min_pct': 0.0227569904603356, 'bear_atr_max_pct': 0.14388293613380126, 'bear_tp_mult': 2.640096481617517, 'bear_tsl_mult': 0.9215732113240154, 'bear_time_stop': 249, 'bear_use_sma': False, 'bear_use_ema': True, 'bear_use_atr': True, 'bear_use_adx': True, 'bear_use_spike': False, 'bear_rsi_required': False, 'sideways_strategy': 'mean_reversion', 'sideways_bb_std_mult': 2.2926328230104454, 'sideways_rsi_os': 43, 'sideways_rsi_ob': 67, 'sideways_adx_thresh': 27.22324489000959, 'sideways_atr_min_pct': 0.029398442082247823, 'sideways_atr_max_pct': 0.06799598706398993, 'sideways_tp_mult': 1.5610711498124563, 'sideways_tsl_mult': 0.14323961255250822, 'sideways_time_stop': 209, 'sideways_use_sma': False, 'sideways_use_ema': True, 'sideways_use_atr': False, 'sideways_use_adx': False, 'sideways_use_spike': False, 'sideways_rsi_required': True}.
[I 2025-08-31 10:16:36,348] Trial 454 finished with values: [-1000000000.0, 1000000000.0] and parameters: {'p_sma': 50, 'p_std': 17, 'p_atr': 29, 'p_adx': 26, 'rsi_period': 21, 'ema1': 21, 'ema2': 27, 'slip_atr_k': 0.12355872157265035, 'slip_spread_k': 0.5769874044139695, 'spread_hl_frac': 0.016958965656430312, 'bb_std_mult': 0.683718780898211, 'rsi_os': 11, 'rsi_ob': 49, 'vol_spike': 0.14472170311601862, 'adx_thresh': 5.936608137830605, 'atr_min_pct': 0.012209410003764288, 'atr_max_pct': 0.13750101363245668, 'tp_mult': 2.836752674536303, 'tsl_mult': 0.61227691492083, 'strategy': 'breakout', 'time_stop': 135, 'use_sma': True, 'use_atr': True, 'use_adx': False, 'use_ema': False, 'use_spike': True, 'rsi_required': True, 'edge_k': 1.878112836789333, 'edge_cap': 0.153553056620014, 'bull_strategy': 'breakout', 'bull_bb_std_mult': 1.3586758170803355, 'bull_rsi_os': 30, 'bull_rsi_ob': 45, 'bull_adx_thresh': 29.045856468319805, 'bull_atr_min_pct': 0.008547987638824472, 'bull_atr_max_pct': 0.1090663025154387, 'bull_tp_mult': 1.8452599577783957, 'bull_tsl_mult': 0.5248546354540933, 'bull_time_stop': 240, 'bull_use_sma': True, 'bull_use_ema': True, 'bull_use_atr': False, 'bull_use_adx': False, 'bull_use_spike': False, 'bull_rsi_required': True, 'bear_strategy': 'breakout', 'bear_bb_std_mult': 2.8069107376580185, 'bear_rsi_os': 55, 'bear_rsi_ob': 82, 'bear_adx_thresh': 20.524528620808248, 'bear_atr_min_pct': 0.011864052588786537, 'bear_atr_max_pct': 0.14272176417193555, 'bear_tp_mult': 2.594586382551347, 'bear_tsl_mult': 0.9806423990316777, 'bear_time_stop': 251, 'bear_use_sma': False, 'bear_use_ema': True, 'bear_use_atr': True, 'bear_use_adx': True, 'bear_use_spike': False, 'bear_rsi_required': False, 'sideways_strategy': 'mean_reversion', 'sideways_bb_std_mult': 3.4136157616421023, 'sideways_rsi_os': 27, 'sideways_rsi_ob': 67, 'sideways_adx_thresh': 22.133506002438775, 'sideways_atr_min_pct': 0.02212720687012017, 'sideways_atr_max_pct': 0.047142050640321564, 'sideways_tp_mult': 1.9950998768311572, 'sideways_tsl_mult': 0.10566704674240213, 'sideways_time_stop': 221, 'sideways_use_sma': False, 'sideways_use_ema': True, 'sideways_use_atr': False, 'sideways_use_adx': False, 'sideways_use_spike': False, 'sideways_rsi_required': True}.
[I 2025-08-31 10:16:36,484] Trial 452 finished with values: [-1000000000.0, 1000000000.0] and parameters: {'p_sma': 49, 'p_std': 17, 'p_atr': 16, 'p_adx': 17, 'rsi_period': 21, 'ema1': 20, 'ema2': 38, 'slip_atr_k': 0.03983863101203336, 'slip_spread_k': 0.4237632425974413, 'spread_hl_frac': 0.01212432445532098, 'bb_std_mult': 1.0273164494519011, 'rsi_os': 31, 'rsi_ob': 49, 'vol_spike': 0.2691624913554779, 'adx_thresh': 5.938521849316633, 'atr_min_pct': 0.013856804224181882, 'atr_max_pct': 0.13759451614448096, 'tp_mult': 2.687814046548808, 'tsl_mult': 0.08486476174985846, 'strategy': 'breakout', 'time_stop': 134, 'use_sma': True, 'use_atr': True, 'use_adx': False, 'use_ema': False, 'use_spike': True, 'rsi_required': True, 'edge_k': 1.8657849287201356, 'edge_cap': 0.7572201238061296, 'bull_strategy': 'breakout', 'bull_bb_std_mult': 1.3990417112944573, 'bull_rsi_os': 32, 'bull_rsi_ob': 83, 'bull_adx_thresh': 13.737441584971911, 'bull_atr_min_pct': 0.027702912216567257, 'bull_atr_max_pct': 0.11005267999995193, 'bull_tp_mult': 1.0445720648571795, 'bull_tsl_mult': 0.5313881683633623, 'bull_time_stop': 240, 'bull_use_sma': True, 'bull_use_ema': True, 'bull_use_atr': False, 'bull_use_adx': False, 'bull_use_spike': False, 'bull_rsi_required': True, 'bear_strategy': 'breakout', 'bear_bb_std_mult': 2.817082456865112, 'bear_rsi_os': 55, 'bear_rsi_ob': 78, 'bear_adx_thresh': 20.539707728915864, 'bear_atr_min_pct': 0.011218193799979905, 'bear_atr_max_pct': 0.14405007039250606, 'bear_tp_mult': 1.1459659730603995, 'bear_tsl_mult': 0.5360546044423755, 'bear_time_stop': 248, 'bear_use_sma': False, 'bear_use_ema': True, 'bear_use_atr': True, 'bear_use_adx': True, 'bear_use_spike': False, 'bear_rsi_required': False, 'sideways_strategy': 'mean_reversion', 'sideways_bb_std_mult': 3.4514693616093695, 'sideways_rsi_os': 42, 'sideways_rsi_ob': 66, 'sideways_adx_thresh': 31.944622918462375, 'sideways_atr_min_pct': 0.004264277176388978, 'sideways_atr_max_pct': 0.035714441303071484, 'sideways_tp_mult': 1.5753359191928757, 'sideways_tsl_mult': 0.32883597287238, 'sideways_time_stop': 220, 'sideways_use_sma': False, 'sideways_use_ema': True, 'sideways_use_atr': False, 'sideways_use_adx': False, 'sideways_use_spike': False, 'sideways_rsi_required': True}.
[I 2025-08-31 10:16:36,606] Trial 451 finished with values: [-1000000000.0, 1000000000.0] and parameters: {'p_sma': 8, 'p_std': 20, 'p_atr': 28, 'p_adx': 10, 'rsi_period': 21, 'ema1': 25, 'ema2': 39, 'slip_atr_k': 0.154274701501063, 'slip_spread_k': 0.27391508342021287, 'spread_hl_frac': 0.039781915772561065, 'bb_std_mult': 1.07352576479276, 'rsi_os': 31, 'rsi_ob': 93, 'vol_spike': 0.2753854183946558, 'adx_thresh': 9.145841066955358, 'atr_min_pct': 0.010351850262209772, 'atr_max_pct': 0.13787338755776854, 'tp_mult': 2.7135849151731386, 'tsl_mult': 0.08555873442920708, 'strategy': 'breakout', 'time_stop': 51, 'use_sma': True, 'use_atr': True, 'use_adx': False, 'use_ema': False, 'use_spike': False, 'rsi_required': True, 'edge_k': 1.9537483728873262, 'edge_cap': 0.14912080949692216, 'bull_strategy': 'breakout', 'bull_bb_std_mult': 1.356238443883588, 'bull_rsi_os': 32, 'bull_rsi_ob': 71, 'bull_adx_thresh': 13.659008955505271, 'bull_atr_min_pct': 0.027531201965510132, 'bull_atr_max_pct': 0.11734409095906574, 'bull_tp_mult': 1.45716731865229, 'bull_tsl_mult': 0.612231265513336, 'bull_time_stop': 238, 'bull_use_sma': True, 'bull_use_ema': False, 'bull_use_atr': False, 'bull_use_adx': False, 'bull_use_spike': False, 'bull_rsi_required': True, 'bear_strategy': 'breakout', 'bear_bb_std_mult': 2.704352135815173, 'bear_rsi_os': 55, 'bear_rsi_ob': 67, 'bear_adx_thresh': 26.712565412520973, 'bear_atr_min_pct': 0.023702615606450383, 'bear_atr_max_pct': 0.1434766684739466, 'bear_tp_mult': 2.6473471039343823, 'bear_tsl_mult': 0.6287073453981444, 'bear_time_stop': 139, 'bear_use_sma': False, 'bear_use_ema': True, 'bear_use_atr': False, 'bear_use_adx': False, 'bear_use_spike': True, 'bear_rsi_required': False, 'sideways_strategy': 'mean_reversion', 'sideways_bb_std_mult': 1.099866402562239, 'sideways_rsi_os': 25, 'sideways_rsi_ob': 61, 'sideways_adx_thresh': 25.16071665039604, 'sideways_atr_min_pct': 0.00315691958228341, 'sideways_atr_max_pct': 0.03510790529562981, 'sideways_tp_mult': 1.588050361718066, 'sideways_tsl_mult': 0.32271521756269206, 'sideways_time_stop': 75, 'sideways_use_sma': True, 'sideways_use_ema': True, 'sideways_use_atr': False, 'sideways_use_adx': False, 'sideways_use_spike': False, 'sideways_rsi_required': True}.
[I 2025-08-31 10:16:37,240] Trial 457 finished with values: [-1000000000.0, 1000000000.0] and parameters: {'p_sma': 34, 'p_std': 54, 'p_atr': 29, 'p_adx': 7, 'rsi_period': 16, 'ema1': 5, 'ema2': 41, 'slip_atr_k': 0.17065714680772737, 'slip_spread_k': 0.37879394487262125, 'spread_hl_frac': 0.012722886699960646, 'bb_std_mult': 0.8931119685943015, 'rsi_os': 23, 'rsi_ob': 48, 'vol_spike': 0.11744627279469169, 'adx_thresh': 13.00126711071946, 'atr_min_pct': 0.01707614272753638, 'atr_max_pct': 0.13448865945635627, 'tp_mult': 1.9051755592926805, 'tsl_mult': 0.00043138157872010287, 'strategy': 'mean_reversion', 'time_stop': 152, 'use_sma': False, 'use_atr': False, 'use_adx': True, 'use_ema': False, 'use_spike': False, 'rsi_required': False, 'edge_k': 0.06108806659487531, 'edge_cap': 0.06675929301094999, 'bull_strategy': 'mean_reversion', 'bull_bb_std_mult': 1.4134021439390176, 'bull_rsi_os': 33, 'bull_rsi_ob': 66, 'bull_adx_thresh': 30.816164146782267, 'bull_atr_min_pct': 0.002673024770196297, 'bull_atr_max_pct': 0.12099112870313009, 'bull_tp_mult': 1.6145374042944511, 'bull_tsl_mult': 0.5700871363645966, 'bull_time_stop': 83, 'bull_use_sma': False, 'bull_use_ema': False, 'bull_use_atr': True, 'bull_use_adx': False, 'bull_use_spike': True, 'bull_rsi_required': True, 'bear_strategy': 'mean_reversion', 'bear_bb_std_mult': 2.5950393209917326, 'bear_rsi_os': 54, 'bear_rsi_ob': 78, 'bear_adx_thresh': 26.46385606527831, 'bear_atr_min_pct': 0.008045409247282243, 'bear_atr_max_pct': 0.11716733268334466, 'bear_tp_mult': 2.741333449171058, 'bear_tsl_mult': 0.5896994010425396, 'bear_time_stop': 281, 'bear_use_sma': False, 'bear_use_ema': True, 'bear_use_atr': False, 'bear_use_adx': True, 'bear_use_spike': False, 'bear_rsi_required': True, 'sideways_strategy': 'breakout', 'sideways_bb_std_mult': 1.114506664844392, 'sideways_rsi_os': 40, 'sideways_rsi_ob': 45, 'sideways_adx_thresh': 20.38843595523528, 'sideways_atr_min_pct': 0.0013323637074287393, 'sideways_atr_max_pct': 0.05219526396677238, 'sideways_tp_mult': 1.4764442152522923, 'sideways_tsl_mult': 0.046082594835954435, 'sideways_time_stop': 235, 'sideways_use_sma': True, 'sideways_use_ema': True, 'sideways_use_atr': True, 'sideways_use_adx': False, 'sideways_use_spike': True, 'sideways_rsi_required': False}.
[I 2025-08-31 10:16:37,254] Trial 458 finished with values: [-1000000000.0, 1000000000.0] and parameters: {'p_sma': 34, 'p_std': 31, 'p_atr': 29, 'p_adx': 14, 'rsi_period': 16, 'ema1': 5, 'ema2': 41, 'slip_atr_k': 0.2110538448403741, 'slip_spread_k': 0.8417713000743439, 'spread_hl_frac': 0.01324326834784874, 'bb_std_mult': 0.892368201787366, 'rsi_os': 23, 'rsi_ob': 48, 'vol_spike': 0.1830519525634126, 'adx_thresh': 6.270991742938848, 'atr_min_pct': 0.0030550950657471966, 'atr_max_pct': 0.1331814569848768, 'tp_mult': 2.4695584110881965, 'tsl_mult': 0.5838157462528472, 'strategy': 'mean_reversion', 'time_stop': 154, 'use_sma': False, 'use_atr': False, 'use_adx': True, 'use_ema': True, 'use_spike': False, 'rsi_required': False, 'edge_k': 0.31915372851911816, 'edge_cap': 0.7000605410215587, 'bull_strategy': 'mean_reversion', 'bull_bb_std_mult': 2.446083528383567, 'bull_rsi_os': 10, 'bull_rsi_ob': 73, 'bull_adx_thresh': 32.411952019141374, 'bull_atr_min_pct': 0.018773276298982653, 'bull_atr_max_pct': 0.12290549696552991, 'bull_tp_mult': 1.2683146574753033, 'bull_tsl_mult': 0.6550366849290813, 'bull_time_stop': 244, 'bull_use_sma': False, 'bull_use_ema': False, 'bull_use_atr': True, 'bull_use_adx': False, 'bull_use_spike': True, 'bull_rsi_required': True, 'bear_strategy': 'mean_reversion', 'bear_bb_std_mult': 1.8513048509898389, 'bear_rsi_os': 10, 'bear_rsi_ob': 64, 'bear_adx_thresh': 17.321494937333043, 'bear_atr_min_pct': 0.020919086985338377, 'bear_atr_max_pct': 0.13640474469921784, 'bear_tp_mult': 2.585739316074223, 'bear_tsl_mult': 0.41627906347887544, 'bear_time_stop': 283, 'bear_use_sma': False, 'bear_use_ema': True, 'bear_use_atr': False, 'bear_use_adx': True, 'bear_use_spike': False, 'bear_rsi_required': True, 'sideways_strategy': 'breakout', 'sideways_bb_std_mult': 3.1051356138814885, 'sideways_rsi_os': 25, 'sideways_rsi_ob': 54, 'sideways_adx_thresh': 33.50888767637227, 'sideways_atr_min_pct': 0.0013422124527960933, 'sideways_atr_max_pct': 0.029349837623172455, 'sideways_tp_mult': 1.4627408592522437, 'sideways_tsl_mult': 0.04262988005384557, 'sideways_time_stop': 235, 'sideways_use_sma': True, 'sideways_use_ema': True, 'sideways_use_atr': True, 'sideways_use_adx': False, 'sideways_use_spike': True, 'sideways_rsi_required': False}.
[I 2025-08-31 10:17:05,541] Trial 456 finished with values: [-1000000000.0, 1000000000.0] and parameters: {'p_sma': 47, 'p_std': 15, 'p_atr': 24, 'p_adx': 9, 'rsi_period': 19, 'ema1': 19, 'ema2': 43, 'slip_atr_k': 0.15971988160692707, 'slip_spread_k': 0.38147422800728326, 'spread_hl_frac': 0.012805690735332796, 'bb_std_mult': 1.5339951897095376, 'rsi_os': 20, 'rsi_ob': 64, 'vol_spike': 0.13577806865101927, 'adx_thresh': 14.275226927151309, 'atr_min_pct': 0.011871014596793317, 'atr_max_pct': 0.05147852073468388, 'tp_mult': 2.873733473341782, 'tsl_mult': 0.034269374443082985, 'strategy': 'breakout', 'time_stop': 52, 'use_sma': False, 'use_atr': False, 'use_adx': False, 'use_ema': False, 'use_spike': False, 'rsi_required': False, 'edge_k': 1.8584604517911125, 'edge_cap': 0.7866369257049597, 'bull_strategy': 'mean_reversion', 'bull_bb_std_mult': 1.397748368927363, 'bull_rsi_os': 46, 'bull_rsi_ob': 65, 'bull_adx_thresh': 32.28897858809853, 'bull_atr_min_pct': 0.022562807495313413, 'bull_atr_max_pct': 0.14311877338776624, 'bull_tp_mult': 2.560474609248095, 'bull_tsl_mult': 0.8313419482583806, 'bull_time_stop': 14, 'bull_use_sma': True, 'bull_use_ema': False, 'bull_use_atr': False, 'bull_use_adx': False, 'bull_use_spike': False, 'bull_rsi_required': True, 'bear_strategy': 'breakout', 'bear_bb_std_mult': 2.5953738516856313, 'bear_rsi_os': 54, 'bear_rsi_ob': 78, 'bear_adx_thresh': 19.396070730766954, 'bear_atr_min_pct': 0.010887298674151433, 'bear_atr_max_pct': 0.11779269267990208, 'bear_tp_mult': 1.8258494085858497, 'bear_tsl_mult': 0.5779616177979415, 'bear_time_stop': 137, 'bear_use_sma': False, 'bear_use_ema': True, 'bear_use_atr': False, 'bear_use_adx': True, 'bear_use_spike': False, 'bear_rsi_required': True, 'sideways_strategy': 'breakout', 'sideways_bb_std_mult': 1.1107331119338104, 'sideways_rsi_os': 25, 'sideways_rsi_ob': 81, 'sideways_adx_thresh': 17.93601128181808, 'sideways_atr_min_pct': 0.0036766243957742145, 'sideways_atr_max_pct': 0.05635705247147817, 'sideways_tp_mult': 1.4974683779588016, 'sideways_tsl_mult': 0.05507627685740829, 'sideways_time_stop': 195, 'sideways_use_sma': True, 'sideways_use_ema': True, 'sideways_use_atr': False, 'sideways_use_adx': False, 'sideways_use_spike': True, 'sideways_rsi_required': False}.
[I 2025-08-31 10:17:06,354] Trial 455 finished with values: [-0.11166151534689706, 0.11151724673402245] and parameters: {'p_sma': 47, 'p_std': 53, 'p_atr': 29, 'p_adx': 9, 'rsi_period': 17, 'ema1': 5, 'ema2': 38, 'slip_atr_k': 0.20626900124679165, 'slip_spread_k': 0.4251609603749663, 'spread_hl_frac': 0.0402521397618944, 'bb_std_mult': 0.898069174458579, 'rsi_os': 23, 'rsi_ob': 53, 'vol_spike': 0.13615804262444725, 'adx_thresh': 14.696184058023261, 'atr_min_pct': 0.029967338273143664, 'atr_max_pct': 0.13357434053050204, 'tp_mult': 1.9249756767807018, 'tsl_mult': 2.8343378694784687e-05, 'strategy': 'breakout', 'time_stop': 155, 'use_sma': False, 'use_atr': False, 'use_adx': False, 'use_ema': False, 'use_spike': False, 'rsi_required': False, 'edge_k': 1.8581191856785826, 'edge_cap': 0.7563520442757574, 'bull_strategy': 'mean_reversion', 'bull_bb_std_mult': 2.434497029173709, 'bull_rsi_os': 32, 'bull_rsi_ob': 65, 'bull_adx_thresh': 5.041541422742185, 'bull_atr_min_pct': 0.00044366059147845326, 'bull_atr_max_pct': 0.13134371681590207, 'bull_tp_mult': 1.46930977840401, 'bull_tsl_mult': 0.6488513445770743, 'bull_time_stop': 86, 'bull_use_sma': True, 'bull_use_ema': False, 'bull_use_atr': False, 'bull_use_adx': False, 'bull_use_spike': False, 'bull_rsi_required': True, 'bear_strategy': 'breakout', 'bear_bb_std_mult': 0.822495898095237, 'bear_rsi_os': 54, 'bear_rsi_ob': 77, 'bear_adx_thresh': 19.523089586580856, 'bear_atr_min_pct': 0.0019168302012523859, 'bear_atr_max_pct': 0.03496661708996806, 'bear_tp_mult': 1.9608616924734152, 'bear_tsl_mult': 0.5833219098281481, 'bear_time_stop': 51, 'bear_use_sma': False, 'bear_use_ema': True, 'bear_use_atr': False, 'bear_use_adx': True, 'bear_use_spike': False, 'bear_rsi_required': True, 'sideways_strategy': 'breakout', 'sideways_bb_std_mult': 1.2482102694919686, 'sideways_rsi_os': 25, 'sideways_rsi_ob': 64, 'sideways_adx_thresh': 32.365871004956205, 'sideways_atr_min_pct': 0.020198008423226988, 'sideways_atr_max_pct': 0.12406059842361963, 'sideways_tp_mult': 2.1643721144246015, 'sideways_tsl_mult': 0.04914351199432369, 'sideways_time_stop': 236, 'sideways_use_sma': True, 'sideways_use_ema': True, 'sideways_use_atr': False, 'sideways_use_adx': False, 'sideways_use_spike': True, 'sideways_rsi_required': False}.
