[I 2025-08-31 09:40:31,107] Trial 150 finished with values: [-1000000000.0, 1000000000.0] and parameters: {'p_sma': 57, 'p_std': 20, 'p_atr': 16, 'p_adx': 8, 'rsi_period': 84, 'ema1': 26, 'ema2': 44, 'slip_atr_k': 0.006117653322194466, 'slip_spread_k': 0.47622189372608964, 'spread_hl_frac': 0.037963442923178714, 'bb_std_mult': 3.151491918380101, 'rsi_os': 55, 'rsi_ob': 55, 'vol_spike': 0.17966559701349658, 'adx_thresh': 6.671090428904839, 'atr_min_pct': 0.003990417339555175, 'atr_max_pct': 0.10167677829741403, 'tp_mult': 1.055389950403282, 'tsl_mult': 0.7179552978715874, 'strategy': 'breakout', 'time_stop': 208, 'use_sma': True, 'use_atr': True, 'use_adx': True, 'use_ema': True, 'use_spike': False, 'rsi_required': False, 'edge_k': 0.07998459775346312, 'edge_cap': 0.09512878101696495, 'bull_strategy': 'breakout', 'bull_bb_std_mult': 1.9608353303950967, 'bull_rsi_os': 46, 'bull_rsi_ob': 79, 'bull_adx_thresh': 20.235553906354674, 'bull_atr_min_pct': 0.016938064524207076, 'bull_atr_max_pct': 0.055466183509076, 'bull_tp_mult': 2.753742036302242, 'bull_tsl_mult': 0.6477915595515878, 'bull_time_stop': 47, 'bull_use_sma': True, 'bull_use_ema': False, 'bull_use_atr': False, 'bull_use_adx': False, 'bull_use_spike': False, 'bull_rsi_required': True, 'bear_strategy': 'breakout', 'bear_bb_std_mult': 2.9557279525186777, 'bear_rsi_os': 28, 'bear_rsi_ob': 75, 'bear_adx_thresh': 22.19994385058868, 'bear_atr_min_pct': 0.011104994829983592, 'bear_atr_max_pct': 0.09812845990673952, 'bear_tp_mult': 2.429085353696335, 'bear_tsl_mult': 0.5942833363717029, 'bear_time_stop': 70, 'bear_use_sma': True, 'bear_use_ema': True, 'bear_use_atr': False, 'bear_use_adx': False, 'bear_use_spike': True, 'bear_rsi_required': False, 'sideways_strategy': 'mean_reversion', 'sideways_bb_std_mult': 2.446783874744059, 'sideways_rsi_os': 52, 'sideways_rsi_ob': 61, 'sideways_adx_thresh': 34.90118974612525, 'sideways_atr_min_pct': 0.011219357502069588, 'sideways_atr_max_pct': 0.038537022833702125, 'sideways_tp_mult': 1.8480122299172108, 'sideways_tsl_mult': 0.22622430791171477, 'sideways_time_stop': 268, 'sideways_use_sma': True, 'sideways_use_ema': True, 'sideways_use_atr': False, 'sideways_use_adx': True, 'sideways_use_spike': True, 'sideways_rsi_required': True}.
[I 2025-08-31 09:41:09,153] Trial 154 finished with values: [-1000000000.0, 1000000000.0] and parameters: {'p_sma': 51, 'p_std': 15, 'p_atr': 28, 'p_adx': 10, 'rsi_period': 84, 'ema1': 7, 'ema2': 43, 'slip_atr_k': 0.014867390098696424, 'slip_spread_k': 0.35026185369876406, 'spread_hl_frac': 0.028050601853413362, 'bb_std_mult': 2.9296633126624534, 'rsi_os': 23, 'rsi_ob': 50, 'vol_spike': 0.09484353843585129, 'adx_thresh': 6.108248985193732, 'atr_min_pct': 0.02231334729026847, 'atr_max_pct': 0.04911739879552495, 'tp_mult': 1.1493937614096545, 'tsl_mult': 0.7233807585898271, 'strategy': 'breakout', 'time_stop': 215, 'use_sma': True, 'use_atr': False, 'use_adx': False, 'use_ema': False, 'use_spike': True, 'rsi_required': True, 'edge_k': 0.6339391248182196, 'edge_cap': 0.07064037532806815, 'bull_strategy': 'breakout', 'bull_bb_std_mult': 3.5335508317854245, 'bull_rsi_os': 29, 'bull_rsi_ob': 74, 'bull_adx_thresh': 6.839870423410591, 'bull_atr_min_pct': 0.005183742791824162, 'bull_atr_max_pct': 0.11073515335932857, 'bull_tp_mult': 2.5866149281267576, 'bull_tsl_mult': 0.5850934451536607, 'bull_time_stop': 216, 'bull_use_sma': True, 'bull_use_ema': False, 'bull_use_atr': True, 'bull_use_adx': False, 'bull_use_spike': False, 'bull_rsi_required': True, 'bear_strategy': 'breakout', 'bear_bb_std_mult': 2.5326577961457466, 'bear_rsi_os': 54, 'bear_rsi_ob': 77, 'bear_adx_thresh': 10.99395781951127, 'bear_atr_min_pct': 0.012743097291997955, 'bear_atr_max_pct': 0.14703673910185486, 'bear_tp_mult': 2.4946279422073263, 'bear_tsl_mult': 0.38819371121430524, 'bear_time_stop': 72, 'bear_use_sma': True, 'bear_use_ema': False, 'bear_use_atr': False, 'bear_use_adx': True, 'bear_use_spike': False, 'bear_rsi_required': False, 'sideways_strategy': 'mean_reversion', 'sideways_bb_std_mult': 2.5431988337171676, 'sideways_rsi_os': 54, 'sideways_rsi_ob': 65, 'sideways_adx_thresh': 34.82736797858235, 'sideways_atr_min_pct': 0.014653825627997502, 'sideways_atr_max_pct': 0.03321375681960876, 'sideways_tp_mult': 2.4392583069894456, 'sideways_tsl_mult': 0.9199933599427277, 'sideways_time_stop': 23, 'sideways_use_sma': True, 'sideways_use_ema': True, 'sideways_use_atr': False, 'sideways_use_adx': False, 'sideways_use_spike': True, 'sideways_rsi_required': True}.
[I 2025-08-31 09:41:09,370] Trial 156 finished with values: [-1000000000.0, 1000000000.0] and parameters: {'p_sma': 50, 'p_std': 26, 'p_atr': 10, 'p_adx': 10, 'rsi_period': 78, 'ema1': 9, 'ema2': 42, 'slip_atr_k': 0.013427556580172329, 'slip_spread_k': 0.36006407674650603, 'spread_hl_frac': 0.023929903202241403, 'bb_std_mult': 2.816526132913694, 'rsi_os': 21, 'rsi_ob': 74, 'vol_spike': 0.03913711979636364, 'adx_thresh': 8.660737085067877, 'atr_min_pct': 0.015420037590516106, 'atr_max_pct': 0.049974098959790846, 'tp_mult': 2.281567327192708, 'tsl_mult': 0.5617319123740057, 'strategy': 'breakout', 'time_stop': 210, 'use_sma': True, 'use_atr': False, 'use_adx': False, 'use_ema': True, 'use_spike': True, 'rsi_required': True, 'edge_k': 1.559869134369086, 'edge_cap': 0.1199496332541507, 'bull_strategy': 'breakout', 'bull_bb_std_mult': 3.5274902629958893, 'bull_rsi_os': 28, 'bull_rsi_ob': 74, 'bull_adx_thresh': 32.5384568990812, 'bull_atr_min_pct': 0.005155627806742906, 'bull_atr_max_pct': 0.04818167004454881, 'bull_tp_mult': 2.6253693452760944, 'bull_tsl_mult': 0.5740198760399012, 'bull_time_stop': 237, 'bull_use_sma': True, 'bull_use_ema': False, 'bull_use_atr': True, 'bull_use_adx': False, 'bull_use_spike': False, 'bull_rsi_required': True, 'bear_strategy': 'breakout', 'bear_bb_std_mult': 2.5304465835779584, 'bear_rsi_os': 55, 'bear_rsi_ob': 75, 'bear_adx_thresh': 11.842024099089087, 'bear_atr_min_pct': 0.020296189266921713, 'bear_atr_max_pct': 0.1447542164383536, 'bear_tp_mult': 2.483218523879769, 'bear_tsl_mult': 0.518086651777645, 'bear_time_stop': 74, 'bear_use_sma': False, 'bear_use_ema': False, 'bear_use_atr': False, 'bear_use_adx': True, 'bear_use_spike': True, 'bear_rsi_required': False, 'sideways_strategy': 'breakout', 'sideways_bb_std_mult': 2.548190736795304, 'sideways_rsi_os': 51, 'sideways_rsi_ob': 71, 'sideways_adx_thresh': 15.553664496250066, 'sideways_atr_min_pct': 0.008676308824087885, 'sideways_atr_max_pct': 0.03214830867287611, 'sideways_tp_mult': 1.7377959947159989, 'sideways_tsl_mult': 0.48274676440182285, 'sideways_time_stop': 270, 'sideways_use_sma': True, 'sideways_use_ema': True, 'sideways_use_atr': False, 'sideways_use_adx': False, 'sideways_use_spike': True, 'sideways_rsi_required': False}.
[I 2025-08-31 09:41:09,601] Trial 157 finished with values: [-1000000000.0, 1000000000.0] and parameters: {'p_sma': 51, 'p_std': 26, 'p_atr': 28, 'p_adx': 10, 'rsi_period': 24, 'ema1': 9, 'ema2': 42, 'slip_atr_k': 0.013873535086511665, 'slip_spread_k': 0.42914085513298544, 'spread_hl_frac': 0.028260208261358426, 'bb_std_mult': 2.8054436690922575, 'rsi_os': 23, 'rsi_ob': 52, 'vol_spike': 0.08841856787068009, 'adx_thresh': 10.995246708848207, 'atr_min_pct': 0.0018804856312593047, 'atr_max_pct': 0.14065792057226, 'tp_mult': 2.161475182120083, 'tsl_mult': 0.03840628488453817, 'strategy': 'mean_reversion', 'time_stop': 215, 'use_sma': True, 'use_atr': False, 'use_adx': False, 'use_ema': True, 'use_spike': True, 'rsi_required': True, 'edge_k': 0.9070448624520739, 'edge_cap': 0.6413644006707488, 'bull_strategy': 'breakout', 'bull_bb_std_mult': 3.533529175489574, 'bull_rsi_os': 27, 'bull_rsi_ob': 74, 'bull_adx_thresh': 7.0951354816735535, 'bull_atr_min_pct': 0.019392167305392855, 'bull_atr_max_pct': 0.14995327572630301, 'bull_tp_mult': 2.6778321209954576, 'bull_tsl_mult': 0.5774854984336709, 'bull_time_stop': 216, 'bull_use_sma': True, 'bull_use_ema': True, 'bull_use_atr': True, 'bull_use_adx': False, 'bull_use_spike': False, 'bull_rsi_required': True, 'bear_strategy': 'breakout', 'bear_bb_std_mult': 2.5930420314707625, 'bear_rsi_os': 55, 'bear_rsi_ob': 77, 'bear_adx_thresh': 11.432559996862032, 'bear_atr_min_pct': 0.021963847074417175, 'bear_atr_max_pct': 0.13988726289599226, 'bear_tp_mult': 2.5054138747361545, 'bear_tsl_mult': 0.4335144967188781, 'bear_time_stop': 46, 'bear_use_sma': False, 'bear_use_ema': False, 'bear_use_atr': False, 'bear_use_adx': True, 'bear_use_spike': True, 'bear_rsi_required': True, 'sideways_strategy': 'breakout', 'sideways_bb_std_mult': 2.559055424491584, 'sideways_rsi_os': 51, 'sideways_rsi_ob': 65, 'sideways_adx_thresh': 15.35178397201122, 'sideways_atr_min_pct': 0.009655496977397558, 'sideways_atr_max_pct': 0.03171165701143154, 'sideways_tp_mult': 2.2859238977966223, 'sideways_tsl_mult': 0.4827276471364126, 'sideways_time_stop': 29, 'sideways_use_sma': True, 'sideways_use_ema': True, 'sideways_use_atr': False, 'sideways_use_adx': False, 'sideways_use_spike': True, 'sideways_rsi_required': False}.
[I 2025-08-31 09:41:09,840] Trial 155 finished with values: [-1000000000.0, 1000000000.0] and parameters: {'p_sma': 51, 'p_std': 29, 'p_atr': 9, 'p_adx': 25, 'rsi_period': 32, 'ema1': 7, 'ema2': 40, 'slip_atr_k': 0.01728979722543135, 'slip_spread_k': 0.42974074938821505, 'spread_hl_frac': 0.028359567095450847, 'bb_std_mult': 2.8093767793435664, 'rsi_os': 23, 'rsi_ob': 50, 'vol_spike': 0.08990201320395685, 'adx_thresh': 5.624016509153142, 'atr_min_pct': 0.0021170868605012213, 'atr_max_pct': 0.04872092604441072, 'tp_mult': 1.0892711851922543, 'tsl_mult': 0.7277923967627897, 'strategy': 'breakout', 'time_stop': 208, 'use_sma': True, 'use_atr': False, 'use_adx': False, 'use_ema': False, 'use_spike': True, 'rsi_required': True, 'edge_k': 0.6416996439585884, 'edge_cap': 0.6696887851850899, 'bull_strategy': 'breakout', 'bull_bb_std_mult': 1.9668070441160057, 'bull_rsi_os': 35, 'bull_rsi_ob': 59, 'bull_adx_thresh': 33.15627130997606, 'bull_atr_min_pct': 0.016777865664944887, 'bull_atr_max_pct': 0.12394931520005698, 'bull_tp_mult': 2.58440774397651, 'bull_tsl_mult': 0.13755263021466024, 'bull_time_stop': 81, 'bull_use_sma': True, 'bull_use_ema': False, 'bull_use_atr': True, 'bull_use_adx': False, 'bull_use_spike': False, 'bull_rsi_required': True, 'bear_strategy': 'breakout', 'bear_bb_std_mult': 2.5513408009225578, 'bear_rsi_os': 54, 'bear_rsi_ob': 75, 'bear_adx_thresh': 12.026206538700231, 'bear_atr_min_pct': 0.02224148352464163, 'bear_atr_max_pct': 0.14307438463349914, 'bear_tp_mult': 2.3490577964949337, 'bear_tsl_mult': 0.3912415934799286, 'bear_time_stop': 74, 'bear_use_sma': True, 'bear_use_ema': False, 'bear_use_atr': False, 'bear_use_adx': True, 'bear_use_spike': True, 'bear_rsi_required': False, 'sideways_strategy': 'mean_reversion', 'sideways_bb_std_mult': 2.5431666982458045, 'sideways_rsi_os': 5, 'sideways_rsi_ob': 64, 'sideways_adx_thresh': 28.9842280681926, 'sideways_atr_min_pct': 0.008721916936813024, 'sideways_atr_max_pct': 0.03337507765264749, 'sideways_tp_mult': 2.2846381660247457, 'sideways_tsl_mult': 0.4810841726028949, 'sideways_time_stop': 24, 'sideways_use_sma': True, 'sideways_use_ema': True, 'sideways_use_atr': False, 'sideways_use_adx': False, 'sideways_use_spike': True, 'sideways_rsi_required': True}.
[I 2025-08-31 09:41:10,281] Trial 158 finished with values: [-1000000000.0, 1000000000.0] and parameters: {'p_sma': 5, 'p_std': 26, 'p_atr': 11, 'p_adx': 25, 'rsi_period': 23, 'ema1': 9, 'ema2': 42, 'slip_atr_k': 0.024988252137173046, 'slip_spread_k': 0.41828629714620064, 'spread_hl_frac': 0.024245134105488862, 'bb_std_mult': 2.37941456520623, 'rsi_os': 50, 'rsi_ob': 52, 'vol_spike': 0.08901876764942014, 'adx_thresh': 11.38441637762329, 'atr_min_pct': 0.015390325907731229, 'atr_max_pct': 0.10739179668840028, 'tp_mult': 2.1624735010150786, 'tsl_mult': 0.5510418685905772, 'strategy': 'mean_reversion', 'time_stop': 63, 'use_sma': True, 'use_atr': False, 'use_adx': False, 'use_ema': True, 'use_spike': True, 'rsi_required': True, 'edge_k': 0.8802949532999277, 'edge_cap': 0.6286891660909912, 'bull_strategy': 'breakout', 'bull_bb_std_mult': 3.379201186388588, 'bull_rsi_os': 27, 'bull_rsi_ob': 64, 'bull_adx_thresh': 7.649894260605299, 'bull_atr_min_pct': 0.019372195480579633, 'bull_atr_max_pct': 0.14445092955254873, 'bull_tp_mult': 2.681846454173781, 'bull_tsl_mult': 0.5793977410172587, 'bull_time_stop': 154, 'bull_use_sma': True, 'bull_use_ema': True, 'bull_use_atr': True, 'bull_use_adx': False, 'bull_use_spike': False, 'bull_rsi_required': False, 'bear_strategy': 'breakout', 'bear_bb_std_mult': 2.579057341687878, 'bear_rsi_os': 39, 'bear_rsi_ob': 92, 'bear_adx_thresh': 11.892014967434141, 'bear_atr_min_pct': 0.020362126230332248, 'bear_atr_max_pct': 0.14424291626358168, 'bear_tp_mult': 2.3483946619984652, 'bear_tsl_mult': 0.37122331222244787, 'bear_time_stop': 45, 'bear_use_sma': False, 'bear_use_ema': False, 'bear_use_atr': True, 'bear_use_adx': True, 'bear_use_spike': True, 'bear_rsi_required': True, 'sideways_strategy': 'breakout', 'sideways_bb_std_mult': 2.3537804569941816, 'sideways_rsi_os': 10, 'sideways_rsi_ob': 69, 'sideways_adx_thresh': 15.592481327843663, 'sideways_atr_min_pct': 0.005053926815364193, 'sideways_atr_max_pct': 0.026244334848129124, 'sideways_tp_mult': 2.815201718190404, 'sideways_tsl_mult': 0.4922895398360582, 'sideways_time_stop': 170, 'sideways_use_sma': False, 'sideways_use_ema': False, 'sideways_use_atr': False, 'sideways_use_adx': False, 'sideways_use_spike': True, 'sideways_rsi_required': False}.
[I 2025-08-31 09:41:10,305] Trial 160 finished with values: [-1000000000.0, 1000000000.0] and parameters: {'p_sma': 54, 'p_std': 21, 'p_atr': 27, 'p_adx': 11, 'rsi_period': 55, 'ema1': 6, 'ema2': 48, 'slip_atr_k': 0.020184594187516836, 'slip_spread_k': 0.2671850553843934, 'spread_hl_frac': 0.03466258385938832, 'bb_std_mult': 1.74269942302448, 'rsi_os': 50, 'rsi_ob': 63, 'vol_spike': 0.10854176652998815, 'adx_thresh': 5.6312286450908, 'atr_min_pct': 0.007419650587988477, 'atr_max_pct': 0.08717808221024284, 'tp_mult': 1.1129698345554613, 'tsl_mult': 0.07676635313117568, 'strategy': 'mean_reversion', 'time_stop': 51, 'use_sma': False, 'use_atr': True, 'use_adx': False, 'use_ema': True, 'use_spike': True, 'rsi_required': True, 'edge_k': 1.1086221556094555, 'edge_cap': 0.15431968470754176, 'bull_strategy': 'mean_reversion', 'bull_bb_std_mult': 1.725023303391531, 'bull_rsi_os': 35, 'bull_rsi_ob': 77, 'bull_adx_thresh': 29.827999827156994, 'bull_atr_min_pct': 0.001673773270136741, 'bull_atr_max_pct': 0.11559533900205235, 'bull_tp_mult': 2.858135231100264, 'bull_tsl_mult': 0.5406933015617056, 'bull_time_stop': 83, 'bull_use_sma': True, 'bull_use_ema': True, 'bull_use_atr': True, 'bull_use_adx': False, 'bull_use_spike': False, 'bull_rsi_required': False, 'bear_strategy': 'breakout', 'bear_bb_std_mult': 2.4184182460176196, 'bear_rsi_os': 53, 'bear_rsi_ob': 56, 'bear_adx_thresh': 13.269657676099012, 'bear_atr_min_pct': 0.00892081593596305, 'bear_atr_max_pct': 0.1375217579812742, 'bear_tp_mult': 2.622592285749787, 'bear_tsl_mult': 0.29593467928159545, 'bear_time_stop': 35, 'bear_use_sma': False, 'bear_use_ema': False, 'bear_use_atr': True, 'bear_use_adx': True, 'bear_use_spike': True, 'bear_rsi_required': False, 'sideways_strategy': 'breakout', 'sideways_bb_std_mult': 2.654441618741793, 'sideways_rsi_os': 33, 'sideways_rsi_ob': 69, 'sideways_adx_thresh': 29.81610511238174, 'sideways_atr_min_pct': 0.0173157973553383, 'sideways_atr_max_pct': 0.02520567206568338, 'sideways_tp_mult': 2.594458379119439, 'sideways_tsl_mult': 0.607986851451387, 'sideways_time_stop': 167, 'sideways_use_sma': False, 'sideways_use_ema': False, 'sideways_use_atr': False, 'sideways_use_adx': False, 'sideways_use_spike': True, 'sideways_rsi_required': False}.
[I 2025-08-31 09:41:10,343] Trial 159 finished with values: [-1000000000.0, 1000000000.0] and parameters: {'p_sma': 5, 'p_std': 29, 'p_atr': 11, 'p_adx': 25, 'rsi_period': 24, 'ema1': 29, 'ema2': 41, 'slip_atr_k': 0.0216865583574144, 'slip_spread_k': 0.6514008507162885, 'spread_hl_frac': 0.016378828999662177, 'bb_std_mult': 1.6901565315966938, 'rsi_os': 51, 'rsi_ob': 68, 'vol_spike': 0.10801844674352215, 'adx_thresh': 7.214211046022595, 'atr_min_pct': 0.013922394439575518, 'atr_max_pct': 0.14547352661887197, 'tp_mult': 1.0911069952640968, 'tsl_mult': 0.030807952806128552, 'strategy': 'mean_reversion', 'time_stop': 250, 'use_sma': False, 'use_atr': True, 'use_adx': False, 'use_ema': True, 'use_spike': True, 'rsi_required': True, 'edge_k': 1.7712522149148744, 'edge_cap': 0.14665807666848973, 'bull_strategy': 'mean_reversion', 'bull_bb_std_mult': 0.9650553841156477, 'bull_rsi_os': 25, 'bull_rsi_ob': 77, 'bull_adx_thresh': 17.877113333531952, 'bull_atr_min_pct': 0.01958830086862972, 'bull_atr_max_pct': 0.1140001911604393, 'bull_tp_mult': 2.6895140284086403, 'bull_tsl_mult': 0.13858920076512576, 'bull_time_stop': 156, 'bull_use_sma': True, 'bull_use_ema': True, 'bull_use_atr': True, 'bull_use_adx': False, 'bull_use_spike': False, 'bull_rsi_required': False, 'bear_strategy': 'breakout', 'bear_bb_std_mult': 2.748517647823051, 'bear_rsi_os': 53, 'bear_rsi_ob': 80, 'bear_adx_thresh': 21.138332339524872, 'bear_atr_min_pct': 0.029918100016218897, 'bear_atr_max_pct': 0.07778585615334976, 'bear_tp_mult': 2.5254623767866655, 'bear_tsl_mult': 0.373908214683376, 'bear_time_stop': 81, 'bear_use_sma': False, 'bear_use_ema': False, 'bear_use_atr': True, 'bear_use_adx': True, 'bear_use_spike': True, 'bear_rsi_required': True, 'sideways_strategy': 'breakout', 'sideways_bb_std_mult': 2.380387301826556, 'sideways_rsi_os': 5, 'sideways_rsi_ob': 68, 'sideways_adx_thresh': 32.28590968483565, 'sideways_atr_min_pct': 0.0064901981363726605, 'sideways_atr_max_pct': 0.04556355148571138, 'sideways_tp_mult': 2.832458528060501, 'sideways_tsl_mult': 0.9971887878912147, 'sideways_time_stop': 29, 'sideways_use_sma': False, 'sideways_use_ema': False, 'sideways_use_atr': False, 'sideways_use_adx': False, 'sideways_use_spike': True, 'sideways_rsi_required': False}.
[I 2025-08-31 09:41:10,393] Trial 161 finished with values: [-1000000000.0, 1000000000.0] and parameters: {'p_sma': 54, 'p_std': 34, 'p_atr': 21, 'p_adx': 11, 'rsi_period': 26, 'ema1': 8, 'ema2': 48, 'slip_atr_k': 0.008515148975315105, 'slip_spread_k': 0.4066430053255875, 'spread_hl_frac': 0.03453932051580439, 'bb_std_mult': 0.7972056757648953, 'rsi_os': 52, 'rsi_ob': 72, 'vol_spike': 0.10627229560184673, 'adx_thresh': 7.817329258912908, 'atr_min_pct': 0.007295046537441015, 'atr_max_pct': 0.07385039506164642, 'tp_mult': 1.109599484894065, 'tsl_mult': 0.07412710291681955, 'strategy': 'mean_reversion', 'time_stop': 226, 'use_sma': False, 'use_atr': True, 'use_adx': False, 'use_ema': True, 'use_spike': True, 'rsi_required': True, 'edge_k': 1.0998271902795442, 'edge_cap': 0.15553457857872352, 'bull_strategy': 'mean_reversion', 'bull_bb_std_mult': 3.3798793971668815, 'bull_rsi_os': 24, 'bull_rsi_ob': 64, 'bull_adx_thresh': 29.90704739735571, 'bull_atr_min_pct': 0.019701963413553878, 'bull_atr_max_pct': 0.1024223228505757, 'bull_tp_mult': 2.8531664768222837, 'bull_tsl_mult': 0.6146491082812833, 'bull_time_stop': 259, 'bull_use_sma': True, 'bull_use_ema': True, 'bull_use_atr': True, 'bull_use_adx': False, 'bull_use_spike': False, 'bull_rsi_required': False, 'bear_strategy': 'breakout', 'bear_bb_std_mult': 0.8236162876005737, 'bear_rsi_os': 53, 'bear_rsi_ob': 56, 'bear_adx_thresh': 31.78679176647489, 'bear_atr_min_pct': 0.020880593930930023, 'bear_atr_max_pct': 0.07732558604071643, 'bear_tp_mult': 2.585593390672336, 'bear_tsl_mult': 0.2938930117830528, 'bear_time_stop': 83, 'bear_use_sma': False, 'bear_use_ema': False, 'bear_use_atr': True, 'bear_use_adx': True, 'bear_use_spike': True, 'bear_rsi_required': True, 'sideways_strategy': 'breakout', 'sideways_bb_std_mult': 0.5229869717532765, 'sideways_rsi_os': 31, 'sideways_rsi_ob': 47, 'sideways_adx_thresh': 17.40745758097351, 'sideways_atr_min_pct': 0.02544486485972737, 'sideways_atr_max_pct': 0.045534642512166455, 'sideways_tp_mult': 1.515808473581064, 'sideways_tsl_mult': 0.6121349881834095, 'sideways_time_stop': 169, 'sideways_use_sma': False, 'sideways_use_ema': False, 'sideways_use_atr': False, 'sideways_use_adx': False, 'sideways_use_spike': True, 'sideways_rsi_required': False}.
