[I 2025-08-31 11:05:16,511] Trial 808 finished with values: [-1000000000.0, 1000000000.0] and parameters: {'p_sma': 42, 'p_std': 46, 'p_atr': 20, 'p_adx': 11, 'rsi_period': 24, 'ema1': 29, 'ema2': 39, 'slip_atr_k': 0.008591020651748854, 'slip_spread_k': 0.12787661319469765, 'spread_hl_frac': 0.01986719178137722, 'bb_std_mult': 0.5933688726474169, 'rsi_os': 43, 'rsi_ob': 84, 'vol_spike': 0.2913343075350919, 'adx_thresh': 23.015129507534464, 'atr_min_pct': 0.01305788938941816, 'atr_max_pct': 0.12608961565125631, 'tp_mult': 1.4543228141435116, 'tsl_mult': 0.04713474042845602, 'strategy': 'mean_reversion', 'time_stop': 111, 'use_sma': False, 'use_atr': False, 'use_adx': False, 'use_ema': True, 'use_spike': False, 'rsi_required': True, 'edge_k': 0.32396134910468466, 'edge_cap': 0.7621996611593382, 'bull_strategy': 'mean_reversion', 'bull_bb_std_mult': 1.1698605365426562, 'bull_rsi_os': 24, 'bull_rsi_ob': 89, 'bull_adx_thresh': 8.2367668126177, 'bull_atr_min_pct': 0.006356221042970592, 'bull_atr_max_pct': 0.10167690475710588, 'bull_tp_mult': 2.1741972618186263, 'bull_tsl_mult': 0.9674045172198579, 'bull_time_stop': 57, 'bull_use_sma': True, 'bull_use_ema': False, 'bull_use_atr': False, 'bull_use_adx': False, 'bull_use_spike': False, 'bull_rsi_required': True, 'bear_strategy': 'breakout', 'bear_bb_std_mult': 2.9184581537583645, 'bear_rsi_os': 29, 'bear_rsi_ob': 84, 'bear_adx_thresh': 21.592245860381407, 'bear_atr_min_pct': 0.014467542022248507, 'bear_atr_max_pct': 0.10730654354155526, 'bear_tp_mult': 1.738849665611901, 'bear_tsl_mult': 0.06281121396216716, 'bear_time_stop': 187, 'bear_use_sma': False, 'bear_use_ema': False, 'bear_use_atr': False, 'bear_use_adx': True, 'bear_use_spike': False, 'bear_rsi_required': True, 'sideways_strategy': 'mean_reversion', 'sideways_bb_std_mult': 0.8767402599187167, 'sideways_rsi_os': 24, 'sideways_rsi_ob': 73, 'sideways_adx_thresh': 18.46731713897142, 'sideways_atr_min_pct': 0.0005928951390319244, 'sideways_atr_max_pct': 0.10450915805128733, 'sideways_tp_mult': 2.426954453085238, 'sideways_tsl_mult': 0.35890455682837774, 'sideways_time_stop': 66, 'sideways_use_sma': True, 'sideways_use_ema': True, 'sideways_use_atr': False, 'sideways_use_adx': False, 'sideways_use_spike': True, 'sideways_rsi_required': True}.
[I 2025-08-31 11:05:48,819] Trial 812 finished with values: [-1000000000.0, 1000000000.0] and parameters: {'p_sma': 54, 'p_std': 38, 'p_atr': 29, 'p_adx': 7, 'rsi_period': 22, 'ema1': 18, 'ema2': 23, 'slip_atr_k': 0.18598066929514406, 'slip_spread_k': 0.06636168086829472, 'spread_hl_frac': 0.010646562602861986, 'bb_std_mult': 2.19526347559545, 'rsi_os': 55, 'rsi_ob': 83, 'vol_spike': 0.19236609082258116, 'adx_thresh': 9.549873574634843, 'atr_min_pct': 0.01324347533983138, 'atr_max_pct': 0.1253123974969611, 'tp_mult': 2.819170486622739, 'tsl_mult': 0.48355241987818015, 'strategy': 'breakout', 'time_stop': 125, 'use_sma': True, 'use_atr': True, 'use_adx': False, 'use_ema': True, 'use_spike': False, 'rsi_required': True, 'edge_k': 1.7735502361389393, 'edge_cap': 0.6073960709445371, 'bull_strategy': 'breakout', 'bull_bb_std_mult': 2.925420033630243, 'bull_rsi_os': 46, 'bull_rsi_ob': 47, 'bull_adx_thresh': 31.51226043819821, 'bull_atr_min_pct': 0.007551745119580622, 'bull_atr_max_pct': 0.08894668860565283, 'bull_tp_mult': 2.8252123365887676, 'bull_tsl_mult': 0.9655537993308627, 'bull_time_stop': 193, 'bull_use_sma': True, 'bull_use_ema': False, 'bull_use_atr': False, 'bull_use_adx': False, 'bull_use_spike': False, 'bull_rsi_required': True, 'bear_strategy': 'mean_reversion', 'bear_bb_std_mult': 3.3945163443006607, 'bear_rsi_os': 30, 'bear_rsi_ob': 81, 'bear_adx_thresh': 12.817366689623968, 'bear_atr_min_pct': 0.007964517744370203, 'bear_atr_max_pct': 0.11043420919750563, 'bear_tp_mult': 1.7197193998684943, 'bear_tsl_mult': 0.02001436339117113, 'bear_time_stop': 266, 'bear_use_sma': False, 'bear_use_ema': False, 'bear_use_atr': False, 'bear_use_adx': True, 'bear_use_spike': True, 'bear_rsi_required': False, 'sideways_strategy': 'mean_reversion', 'sideways_bb_std_mult': 0.9393323364311845, 'sideways_rsi_os': 50, 'sideways_rsi_ob': 56, 'sideways_adx_thresh': 26.952541124481154, 'sideways_atr_min_pct': 0.01168516175137998, 'sideways_atr_max_pct': 0.10389818810162187, 'sideways_tp_mult': 2.873588859028029, 'sideways_tsl_mult': 0.959360453652828, 'sideways_time_stop': 66, 'sideways_use_sma': True, 'sideways_use_ema': True, 'sideways_use_atr': False, 'sideways_use_adx': False, 'sideways_use_spike': True, 'sideways_rsi_required': True}.
[I 2025-08-31 11:05:48,832] Trial 811 finished with values: [-1000000000.0, 1000000000.0] and parameters: {'p_sma': 35, 'p_std': 46, 'p_atr': 18, 'p_adx': 7, 'rsi_period': 25, 'ema1': 16, 'ema2': 36, 'slip_atr_k': 0.18643461975250952, 'slip_spread_k': 0.12963824058354323, 'spread_hl_frac': 0.020882321129613822, 'bb_std_mult': 0.6175865928009543, 'rsi_os': 37, 'rsi_ob': 84, 'vol_spike': 0.19495193879030936, 'adx_thresh': 24.382736528115874, 'atr_min_pct': 0.01324249428161323, 'atr_max_pct': 0.12720864761370143, 'tp_mult': 2.8905016997454815, 'tsl_mult': 0.668951069689419, 'strategy': 'mean_reversion', 'time_stop': 134, 'use_sma': True, 'use_atr': True, 'use_adx': False, 'use_ema': True, 'use_spike': False, 'rsi_required': True, 'edge_k': 1.9206394132312656, 'edge_cap': 0.7545974240656061, 'bull_strategy': 'breakout', 'bull_bb_std_mult': 1.6586799822513616, 'bull_rsi_os': 28, 'bull_rsi_ob': 65, 'bull_adx_thresh': 29.29027455813388, 'bull_atr_min_pct': 0.007638768419501486, 'bull_atr_max_pct': 0.08333359943355242, 'bull_tp_mult': 2.2582323055718936, 'bull_tsl_mult': 0.023688877857775847, 'bull_time_stop': 57, 'bull_use_sma': True, 'bull_use_ema': False, 'bull_use_atr': False, 'bull_use_adx': False, 'bull_use_spike': False, 'bull_rsi_required': True, 'bear_strategy': 'mean_reversion', 'bear_bb_std_mult': 1.8218879628070652, 'bear_rsi_os': 29, 'bear_rsi_ob': 88, 'bear_adx_thresh': 10.894787985385545, 'bear_atr_min_pct': 0.008018984304421847, 'bear_atr_max_pct': 0.10085873466458244, 'bear_tp_mult': 1.1778594971704686, 'bear_tsl_mult': 0.6502848699460397, 'bear_time_stop': 265, 'bear_use_sma': False, 'bear_use_ema': True, 'bear_use_atr': False, 'bear_use_adx': True, 'bear_use_spike': False, 'bear_rsi_required': False, 'sideways_strategy': 'breakout', 'sideways_bb_std_mult': 3.0241378045931326, 'sideways_rsi_os': 19, 'sideways_rsi_ob': 48, 'sideways_adx_thresh': 27.47376279337, 'sideways_atr_min_pct': 0.009775457774771722, 'sideways_atr_max_pct': 0.10369164251827807, 'sideways_tp_mult': 2.8881815694254427, 'sideways_tsl_mult': 0.356600628705378, 'sideways_time_stop': 232, 'sideways_use_sma': True, 'sideways_use_ema': True, 'sideways_use_atr': False, 'sideways_use_adx': False, 'sideways_use_spike': True, 'sideways_rsi_required': False}.
[I 2025-08-31 11:05:49,361] Trial 813 finished with values: [-1000000000.0, 1000000000.0] and parameters: {'p_sma': 27, 'p_std': 35, 'p_atr': 18, 'p_adx': 27, 'rsi_period': 22, 'ema1': 18, 'ema2': 33, 'slip_atr_k': 0.11566676459009853, 'slip_spread_k': 0.07017015060709925, 'spread_hl_frac': 0.023024656803968223, 'bb_std_mult': 1.0782413753352769, 'rsi_os': 39, 'rsi_ob': 85, 'vol_spike': 0.29535012913409037, 'adx_thresh': 9.610689558420598, 'atr_min_pct': 0.021384684677156127, 'atr_max_pct': 0.10653214235355818, 'tp_mult': 2.8770996017497747, 'tsl_mult': 0.9685790949378512, 'strategy': 'breakout', 'time_stop': 245, 'use_sma': True, 'use_atr': True, 'use_adx': False, 'use_ema': False, 'use_spike': False, 'rsi_required': True, 'edge_k': 1.772493399166521, 'edge_cap': 0.1048548972678397, 'bull_strategy': 'breakout', 'bull_bb_std_mult': 3.3741132241652467, 'bull_rsi_os': 39, 'bull_rsi_ob': 48, 'bull_adx_thresh': 31.581780142403836, 'bull_atr_min_pct': 0.027288603347110463, 'bull_atr_max_pct': 0.08919845533935568, 'bull_tp_mult': 2.80980167767928, 'bull_tsl_mult': 0.9658408879985162, 'bull_time_stop': 136, 'bull_use_sma': True, 'bull_use_ema': False, 'bull_use_atr': False, 'bull_use_adx': False, 'bull_use_spike': False, 'bull_rsi_required': True, 'bear_strategy': 'mean_reversion', 'bear_bb_std_mult': 1.9335764086469729, 'bear_rsi_os': 25, 'bear_rsi_ob': 89, 'bear_adx_thresh': 21.89134967223664, 'bear_atr_min_pct': 0.007780466132096984, 'bear_atr_max_pct': 0.11017278135486147, 'bear_tp_mult': 2.417694463615388, 'bear_tsl_mult': 0.6492176197528612, 'bear_time_stop': 265, 'bear_use_sma': True, 'bear_use_ema': True, 'bear_use_atr': True, 'bear_use_adx': True, 'bear_use_spike': True, 'bear_rsi_required': False, 'sideways_strategy': 'breakout', 'sideways_bb_std_mult': 1.0209020926855685, 'sideways_rsi_os': 50, 'sideways_rsi_ob': 53, 'sideways_adx_thresh': 29.18627953264341, 'sideways_atr_min_pct': 0.02510988356515419, 'sideways_atr_max_pct': 0.01617706316125457, 'sideways_tp_mult': 2.8785525372651706, 'sideways_tsl_mult': 0.8813854154113373, 'sideways_time_stop': 65, 'sideways_use_sma': False, 'sideways_use_ema': True, 'sideways_use_atr': False, 'sideways_use_adx': False, 'sideways_use_spike': True, 'sideways_rsi_required': False}.
[I 2025-08-31 11:05:49,484] Trial 814 finished with values: [-1000000000.0, 1000000000.0] and parameters: {'p_sma': 12, 'p_std': 48, 'p_atr': 7, 'p_adx': 7, 'rsi_period': 22, 'ema1': 19, 'ema2': 36, 'slip_atr_k': 0.18551786379336224, 'slip_spread_k': 0.5991859788680347, 'spread_hl_frac': 0.010835398405665537, 'bb_std_mult': 3.029414430319139, 'rsi_os': 37, 'rsi_ob': 85, 'vol_spike': 0.2949207760553842, 'adx_thresh': 34.94659136837518, 'atr_min_pct': 6.237576277134255e-05, 'atr_max_pct': 0.1251134494262278, 'tp_mult': 2.1237170628276, 'tsl_mult': 0.7981532473903664, 'strategy': 'breakout', 'time_stop': 137, 'use_sma': True, 'use_atr': True, 'use_adx': False, 'use_ema': False, 'use_spike': True, 'rsi_required': True, 'edge_k': 1.9345623154184057, 'edge_cap': 0.7987794936985648, 'bull_strategy': 'breakout', 'bull_bb_std_mult': 2.9374548799023197, 'bull_rsi_os': 28, 'bull_rsi_ob': 47, 'bull_adx_thresh': 6.968072043922039, 'bull_atr_min_pct': 0.007596264512721988, 'bull_atr_max_pct': 0.08901923479635042, 'bull_tp_mult': 2.789947664165206, 'bull_tsl_mult': 0.961774242137503, 'bull_time_stop': 71, 'bull_use_sma': False, 'bull_use_ema': True, 'bull_use_atr': False, 'bull_use_adx': False, 'bull_use_spike': False, 'bull_rsi_required': False, 'bear_strategy': 'mean_reversion', 'bear_bb_std_mult': 3.0111594106714765, 'bear_rsi_os': 24, 'bear_rsi_ob': 81, 'bear_adx_thresh': 8.728718031165407, 'bear_atr_min_pct': 0.007984078700987532, 'bear_atr_max_pct': 0.07883488333143883, 'bear_tp_mult': 2.4956737683023484, 'bear_tsl_mult': 0.6613048290002183, 'bear_time_stop': 265, 'bear_use_sma': True, 'bear_use_ema': True, 'bear_use_atr': True, 'bear_use_adx': True, 'bear_use_spike': True, 'bear_rsi_required': False, 'sideways_strategy': 'breakout', 'sideways_bb_std_mult': 0.942153237928764, 'sideways_rsi_os': 15, 'sideways_rsi_ob': 94, 'sideways_adx_thresh': 19.73859419468949, 'sideways_atr_min_pct': 0.0005221721485960965, 'sideways_atr_max_pct': 0.04572091620934995, 'sideways_tp_mult': 2.884002587507982, 'sideways_tsl_mult': 0.4501677513531734, 'sideways_time_stop': 244, 'sideways_use_sma': False, 'sideways_use_ema': True, 'sideways_use_atr': False, 'sideways_use_adx': True, 'sideways_use_spike': False, 'sideways_rsi_required': False}.
[I 2025-08-31 11:05:50,478] Trial 816 finished with values: [-1000000000.0, 1000000000.0] and parameters: {'p_sma': 12, 'p_std': 48, 'p_atr': 17, 'p_adx': 17, 'rsi_period': 23, 'ema1': 24, 'ema2': 10, 'slip_atr_k': 0.032269240964311455, 'slip_spread_k': 0.08100072897936265, 'spread_hl_frac': 0.02316610948182334, 'bb_std_mult': 1.0411249452288878, 'rsi_os': 39, 'rsi_ob': 81, 'vol_spike': 0.29498394745366596, 'adx_thresh': 23.504466666320134, 'atr_min_pct': 0.011503656520258972, 'atr_max_pct': 0.010160760129696605, 'tp_mult': 2.1259246910918694, 'tsl_mult': 0.025131671189787257, 'strategy': 'breakout', 'time_stop': 140, 'use_sma': False, 'use_atr': False, 'use_adx': False, 'use_ema': False, 'use_spike': True, 'rsi_required': False, 'edge_k': 1.8170705517730719, 'edge_cap': 0.10050389288295543, 'bull_strategy': 'mean_reversion', 'bull_bb_std_mult': 3.383399570823082, 'bull_rsi_os': 22, 'bull_rsi_ob': 88, 'bull_adx_thresh': 30.74863592372906, 'bull_atr_min_pct': 0.007085392654037421, 'bull_atr_max_pct': 0.08730362554821003, 'bull_tp_mult': 2.216168762906706, 'bull_tsl_mult': 0.11829917352334235, 'bull_time_stop': 71, 'bull_use_sma': False, 'bull_use_ema': True, 'bull_use_atr': True, 'bull_use_adx': True, 'bull_use_spike': True, 'bull_rsi_required': False, 'bear_strategy': 'breakout', 'bear_bb_std_mult': 3.009850040030276, 'bear_rsi_os': 25, 'bear_rsi_ob': 70, 'bear_adx_thresh': 20.340542510988115, 'bear_atr_min_pct': 0.012090711326162204, 'bear_atr_max_pct': 0.10497842642956999, 'bear_tp_mult': 1.9674180091603826, 'bear_tsl_mult': 0.4952657144925099, 'bear_time_stop': 111, 'bear_use_sma': True, 'bear_use_ema': True, 'bear_use_atr': True, 'bear_use_adx': True, 'bear_use_spike': True, 'bear_rsi_required': True, 'sideways_strategy': 'breakout', 'sideways_bb_std_mult': 1.026555179453384, 'sideways_rsi_os': 24, 'sideways_rsi_ob': 53, 'sideways_adx_thresh': 15.641854616050413, 'sideways_atr_min_pct': 0.000505637384563097, 'sideways_atr_max_pct': 0.054070425593579746, 'sideways_tp_mult': 1.9120806399595387, 'sideways_tsl_mult': 0.7048853650026194, 'sideways_time_stop': 149, 'sideways_use_sma': False, 'sideways_use_ema': True, 'sideways_use_atr': True, 'sideways_use_adx': True, 'sideways_use_spike': False, 'sideways_rsi_required': False}.
[I 2025-08-31 11:06:21,347] Trial 817 finished with values: [-1000000000.0, 1000000000.0] and parameters: {'p_sma': 12, 'p_std': 48, 'p_atr': 24, 'p_adx': 9, 'rsi_period': 70, 'ema1': 13, 'ema2': 38, 'slip_atr_k': 0.17964061845605156, 'slip_spread_k': 0.10343303522189758, 'spread_hl_frac': 0.004817096171538172, 'bb_std_mult': 1.3378154855355924, 'rsi_os': 7, 'rsi_ob': 86, 'vol_spike': 0.29941058038425394, 'adx_thresh': 14.275096044370647, 'atr_min_pct': 0.01157247435172216, 'atr_max_pct': 0.11853801837486286, 'tp_mult': 2.926796405308232, 'tsl_mult': 0.03047871872403083, 'strategy': 'breakout', 'time_stop': 206, 'use_sma': False, 'use_atr': False, 'use_adx': False, 'use_ema': False, 'use_spike': True, 'rsi_required': False, 'edge_k': 0.849188916935625, 'edge_cap': 0.15337297380385273, 'bull_strategy': 'mean_reversion', 'bull_bb_std_mult': 1.249704503868578, 'bull_rsi_os': 27, 'bull_rsi_ob': 93, 'bull_adx_thresh': 7.023441438502388, 'bull_atr_min_pct': 0.005242796472895895, 'bull_atr_max_pct': 0.041602067993688124, 'bull_tp_mult': 2.2218422890052367, 'bull_tsl_mult': 0.9305863512930072, 'bull_time_stop': 71, 'bull_use_sma': False, 'bull_use_ema': True, 'bull_use_atr': True, 'bull_use_adx': True, 'bull_use_spike': True, 'bull_rsi_required': False, 'bear_strategy': 'breakout', 'bear_bb_std_mult': 3.0149164956759362, 'bear_rsi_os': 31, 'bear_rsi_ob': 78, 'bear_adx_thresh': 20.75166774488439, 'bear_atr_min_pct': 0.006728026687955505, 'bear_atr_max_pct': 0.06755314013029455, 'bear_tp_mult': 1.994424958608952, 'bear_tsl_mult': 0.9798432317711332, 'bear_time_stop': 274, 'bear_use_sma': True, 'bear_use_ema': True, 'bear_use_atr': True, 'bear_use_adx': True, 'bear_use_spike': True, 'bear_rsi_required': True, 'sideways_strategy': 'breakout', 'sideways_bb_std_mult': 0.5760111642310359, 'sideways_rsi_os': 9, 'sideways_rsi_ob': 94, 'sideways_adx_thresh': 6.7091088661873215, 'sideways_atr_min_pct': 0.029526774975605644, 'sideways_atr_max_pct': 0.05348717889192188, 'sideways_tp_mult': 1.9212602730135662, 'sideways_tsl_mult': 0.4494670584578123, 'sideways_time_stop': 244, 'sideways_use_sma': False, 'sideways_use_ema': True, 'sideways_use_atr': True, 'sideways_use_adx': True, 'sideways_use_spike': False, 'sideways_rsi_required': False}.
[I 2025-08-31 11:06:21,724] Trial 815 finished with values: [-1000000000.0, 1000000000.0] and parameters: {'p_sma': 20, 'p_std': 48, 'p_atr': 17, 'p_adx': 9, 'rsi_period': 41, 'ema1': 24, 'ema2': 10, 'slip_atr_k': 0.17983516363731472, 'slip_spread_k': 0.08102059702691011, 'spread_hl_frac': 0.03334685739304752, 'bb_std_mult': 1.0772649729396846, 'rsi_os': 39, 'rsi_ob': 85, 'vol_spike': 0.29567373086243826, 'adx_thresh': 13.376980219826919, 'atr_min_pct': 0.011636633673708364, 'atr_max_pct': 0.10667054726360022, 'tp_mult': 2.8698284835449503, 'tsl_mult': 0.39851489502660664, 'strategy': 'breakout', 'time_stop': 206, 'use_sma': False, 'use_atr': False, 'use_adx': False, 'use_ema': False, 'use_spike': True, 'rsi_required': False, 'edge_k': 1.8264944513681405, 'edge_cap': 0.1016516368118788, 'bull_strategy': 'mean_reversion', 'bull_bb_std_mult': 0.7227004801858494, 'bull_rsi_os': 27, 'bull_rsi_ob': 67, 'bull_adx_thresh': 30.74489810521209, 'bull_atr_min_pct': 0.028098315851682334, 'bull_atr_max_pct': 0.04176912092444001, 'bull_tp_mult': 2.230042206399954, 'bull_tsl_mult': 0.9519099341822006, 'bull_time_stop': 71, 'bull_use_sma': False, 'bull_use_ema': True, 'bull_use_atr': True, 'bull_use_adx': True, 'bull_use_spike': True, 'bull_rsi_required': False, 'bear_strategy': 'breakout', 'bear_bb_std_mult': 1.9125346341903635, 'bear_rsi_os': 24, 'bear_rsi_ob': 60, 'bear_adx_thresh': 20.418851123437623, 'bear_atr_min_pct': 1.3692819812139226e-05, 'bear_atr_max_pct': 0.1051324073278443, 'bear_tp_mult': 1.9672933524205005, 'bear_tsl_mult': 0.2498477265853244, 'bear_time_stop': 273, 'bear_use_sma': True, 'bear_use_ema': True, 'bear_use_atr': True, 'bear_use_adx': True, 'bear_use_spike': True, 'bear_rsi_required': True, 'sideways_strategy': 'breakout', 'sideways_bb_std_mult': 1.0360359942429613, 'sideways_rsi_os': 9, 'sideways_rsi_ob': 69, 'sideways_adx_thresh': 29.166503664572765, 'sideways_atr_min_pct': 0.017161601409516537, 'sideways_atr_max_pct': 0.10671698555247525, 'sideways_tp_mult': 2.945110062760059, 'sideways_tsl_mult': 0.44872337500381704, 'sideways_time_stop': 242, 'sideways_use_sma': False, 'sideways_use_ema': True, 'sideways_use_atr': True, 'sideways_use_adx': True, 'sideways_use_spike': False, 'sideways_rsi_required': False}.
[I 2025-08-31 11:06:22,088] Trial 818 finished with values: [-1000000000.0, 1000000000.0] and parameters: {'p_sma': 12, 'p_std': 47, 'p_atr': 30, 'p_adx': 9, 'rsi_period': 49, 'ema1': 19, 'ema2': 27, 'slip_atr_k': 0.03194461456725181, 'slip_spread_k': 0.10853811634523382, 'spread_hl_frac': 0.010675306103445975, 'bb_std_mult': 1.3347990973503117, 'rsi_os': 9, 'rsi_ob': 66, 'vol_spike': 0.09263829145627162, 'adx_thresh': 23.53984669914494, 'atr_min_pct': 0.011551227840367577, 'atr_max_pct': 0.11901789464158828, 'tp_mult': 1.3498339190461808, 'tsl_mult': 0.027459026562714216, 'strategy': 'breakout', 'time_stop': 55, 'use_sma': False, 'use_atr': False, 'use_adx': True, 'use_ema': True, 'use_spike': True, 'rsi_required': False, 'edge_k': 1.8342475360669754, 'edge_cap': 0.15381130294067313, 'bull_strategy': 'mean_reversion', 'bull_bb_std_mult': 1.245571364672933, 'bull_rsi_os': 41, 'bull_rsi_ob': 68, 'bull_adx_thresh': 9.273516102306358, 'bull_atr_min_pct': 0.011069103923287298, 'bull_atr_max_pct': 0.040798960542274366, 'bull_tp_mult': 2.225124708809456, 'bull_tsl_mult': 0.93016809769901, 'bull_time_stop': 21, 'bull_use_sma': False, 'bull_use_ema': True, 'bull_use_atr': True, 'bull_use_adx': True, 'bull_use_spike': True, 'bull_rsi_required': False, 'bear_strategy': 'breakout', 'bear_bb_std_mult': 1.2551699285674038, 'bear_rsi_os': 6, 'bear_rsi_ob': 77, 'bear_adx_thresh': 26.436535382897446, 'bear_atr_min_pct': 0.012191491916323939, 'bear_atr_max_pct': 0.10471365514747914, 'bear_tp_mult': 1.9927908647925276, 'bear_tsl_mult': 0.9868118198956755, 'bear_time_stop': 273, 'bear_use_sma': False, 'bear_use_ema': True, 'bear_use_atr': False, 'bear_use_adx': True, 'bear_use_spike': True, 'bear_rsi_required': True, 'sideways_strategy': 'breakout', 'sideways_bb_std_mult': 1.052035489928697, 'sideways_rsi_os': 24, 'sideways_rsi_ob': 94, 'sideways_adx_thresh': 29.950202975098424, 'sideways_atr_min_pct': 0.003188284688723143, 'sideways_atr_max_pct': 0.10681031119308404, 'sideways_tp_mult': 2.956295434920591, 'sideways_tsl_mult': 0.2148701285471598, 'sideways_time_stop': 237, 'sideways_use_sma': True, 'sideways_use_ema': True, 'sideways_use_atr': True, 'sideways_use_adx': True, 'sideways_use_spike': False, 'sideways_rsi_required': False}.
