[I 2025-08-31 11:09:12,667] Trial 837 finished with values: [-0.03733762613651581, 0.03726705682947038] and parameters: {'p_sma': 11, 'p_std': 49, 'p_atr': 29, 'p_adx': 10, 'rsi_period': 24, 'ema1': 19, 'ema2': 39, 'slip_atr_k': 0.19840053725865142, 'slip_spread_k': 0.33315165585194484, 'spread_hl_frac': 0.0008460755875601758, 'bb_std_mult': 1.154704842147808, 'rsi_os': 39, 'rsi_ob': 84, 'vol_spike': 0.20921425010743513, 'adx_thresh': 24.69017526479381, 'atr_min_pct': 0.007533678609145458, 'atr_max_pct': 0.12017459115489676, 'tp_mult': 2.8641240678019555, 'tsl_mult': 0.46059112546867675, 'strategy': 'mean_reversion', 'time_stop': 284, 'use_sma': True, 'use_atr': True, 'use_adx': True, 'use_ema': True, 'use_spike': False, 'rsi_required': True, 'edge_k': 0.9036935145833848, 'edge_cap': 0.11318353481414412, 'bull_strategy': 'breakout', 'bull_bb_std_mult': 1.2826378883413005, 'bull_rsi_os': 29, 'bull_rsi_ob': 65, 'bull_adx_thresh': 31.795465964689757, 'bull_atr_min_pct': 0.006187222903100367, 'bull_atr_max_pct': 0.08348244987568436, 'bull_tp_mult': 2.3315346354083766, 'bull_tsl_mult': 0.18036667874457557, 'bull_time_stop': 49, 'bull_use_sma': True, 'bull_use_ema': False, 'bull_use_atr': False, 'bull_use_adx': False, 'bull_use_spike': False, 'bull_rsi_required': True, 'bear_strategy': 'mean_reversion', 'bear_bb_std_mult': 3.098125311207075, 'bear_rsi_os': 28, 'bear_rsi_ob': 79, 'bear_adx_thresh': 22.534319103160698, 'bear_atr_min_pct': 0.00690161780375147, 'bear_atr_max_pct': 0.10343832524183448, 'bear_tp_mult': 2.2975673909999204, 'bear_tsl_mult': 0.14882267007382793, 'bear_time_stop': 150, 'bear_use_sma': False, 'bear_use_ema': True, 'bear_use_atr': False, 'bear_use_adx': True, 'bear_use_spike': False, 'bear_rsi_required': False, 'sideways_strategy': 'breakout', 'sideways_bb_std_mult': 1.1368740639948272, 'sideways_rsi_os': 44, 'sideways_rsi_ob': 93, 'sideways_adx_thresh': 28.75018144041544, 'sideways_atr_min_pct': 0.0014879562908998267, 'sideways_atr_max_pct': 0.10933098381437673, 'sideways_tp_mult': 2.710741322743236, 'sideways_tsl_mult': 0.038151623678026936, 'sideways_time_stop': 237, 'sideways_use_sma': True, 'sideways_use_ema': True, 'sideways_use_atr': False, 'sideways_use_adx': False, 'sideways_use_spike': True, 'sideways_rsi_required': False}.
[I 2025-08-31 11:09:13,067] Trial 839 finished with values: [-1000000000.0, 1000000000.0] and parameters: {'p_sma': 15, 'p_std': 53, 'p_atr': 30, 'p_adx': 10, 'rsi_period': 7, 'ema1': 19, 'ema2': 39, 'slip_atr_k': 0.19668994604868775, 'slip_spread_k': 0.10310150375726673, 'spread_hl_frac': 0.012120782750352433, 'bb_std_mult': 1.140763183198918, 'rsi_os': 49, 'rsi_ob': 55, 'vol_spike': 0.2591830029580993, 'adx_thresh': 15.809199941756509, 'atr_min_pct': 0.0028044128074621918, 'atr_max_pct': 0.11924028470322477, 'tp_mult': 2.867324277837961, 'tsl_mult': 0.11677808862192805, 'strategy': 'mean_reversion', 'time_stop': 127, 'use_sma': True, 'use_atr': True, 'use_adx': True, 'use_ema': True, 'use_spike': False, 'rsi_required': True, 'edge_k': 1.670362686216213, 'edge_cap': 0.3198008590958087, 'bull_strategy': 'breakout', 'bull_bb_std_mult': 0.5137683550248195, 'bull_rsi_os': 55, 'bull_rsi_ob': 65, 'bull_adx_thresh': 30.756576658691976, 'bull_atr_min_pct': 0.009069107550272319, 'bull_atr_max_pct': 0.023925703554325946, 'bull_tp_mult': 1.6571232628801096, 'bull_tsl_mult': 0.9697233596833652, 'bull_time_stop': 161, 'bull_use_sma': True, 'bull_use_ema': False, 'bull_use_atr': False, 'bull_use_adx': False, 'bull_use_spike': False, 'bull_rsi_required': True, 'bear_strategy': 'breakout', 'bear_bb_std_mult': 2.773622236563479, 'bear_rsi_os': 28, 'bear_rsi_ob': 78, 'bear_adx_thresh': 22.55981057090098, 'bear_atr_min_pct': 0.006407345678768975, 'bear_atr_max_pct': 0.08928152466821196, 'bear_tp_mult': 2.1531002019979497, 'bear_tsl_mult': 0.8529171838442197, 'bear_time_stop': 153, 'bear_use_sma': False, 'bear_use_ema': True, 'bear_use_atr': False, 'bear_use_adx': True, 'bear_use_spike': True, 'bear_rsi_required': False, 'sideways_strategy': 'breakout', 'sideways_bb_std_mult': 1.1156094084721269, 'sideways_rsi_os': 27, 'sideways_rsi_ob': 74, 'sideways_adx_thresh': 30.10527269895206, 'sideways_atr_min_pct': 0.002763937299438065, 'sideways_atr_max_pct': 0.06075097030870709, 'sideways_tp_mult': 1.8383865787740306, 'sideways_tsl_mult': 0.7539620220547143, 'sideways_time_stop': 206, 'sideways_use_sma': True, 'sideways_use_ema': True, 'sideways_use_atr': False, 'sideways_use_adx': False, 'sideways_use_spike': True, 'sideways_rsi_required': False}.
[I 2025-08-31 11:09:13,173] Trial 838 finished with values: [-1000000000.0, 1000000000.0] and parameters: {'p_sma': 57, 'p_std': 49, 'p_atr': 11, 'p_adx': 10, 'rsi_period': 23, 'ema1': 19, 'ema2': 42, 'slip_atr_k': 0.19625848058575748, 'slip_spread_k': 0.12040705588616546, 'spread_hl_frac': 0.01276404658468793, 'bb_std_mult': 3.219217931832498, 'rsi_os': 11, 'rsi_ob': 55, 'vol_spike': 0.2596444066914595, 'adx_thresh': 24.709672071415707, 'atr_min_pct': 0.011141107750212521, 'atr_max_pct': 0.09146848063480938, 'tp_mult': 2.859575666556458, 'tsl_mult': 0.8906134151582048, 'strategy': 'mean_reversion', 'time_stop': 25, 'use_sma': True, 'use_atr': True, 'use_adx': True, 'use_ema': True, 'use_spike': False, 'rsi_required': True, 'edge_k': 1.7250490620423646, 'edge_cap': 0.318117040232201, 'bull_strategy': 'breakout', 'bull_bb_std_mult': 1.2447032768525856, 'bull_rsi_os': 29, 'bull_rsi_ob': 65, 'bull_adx_thresh': 30.71289656413494, 'bull_atr_min_pct': 0.00901077526649547, 'bull_atr_max_pct': 0.055003921491125374, 'bull_tp_mult': 2.3193252622173626, 'bull_tsl_mult': 0.9182964559081673, 'bull_time_stop': 161, 'bull_use_sma': True, 'bull_use_ema': False, 'bull_use_atr': False, 'bull_use_adx': False, 'bull_use_spike': False, 'bull_rsi_required': True, 'bear_strategy': 'breakout', 'bear_bb_std_mult': 2.8627664109324797, 'bear_rsi_os': 28, 'bear_rsi_ob': 78, 'bear_adx_thresh': 22.64999233161712, 'bear_atr_min_pct': 0.006709337003526873, 'bear_atr_max_pct': 0.10403814818461601, 'bear_tp_mult': 1.67032925308766, 'bear_tsl_mult': 0.4410577661492729, 'bear_time_stop': 44, 'bear_use_sma': False, 'bear_use_ema': True, 'bear_use_atr': False, 'bear_use_adx': True, 'bear_use_spike': True, 'bear_rsi_required': False, 'sideways_strategy': 'breakout', 'sideways_bb_std_mult': 1.0981436048693767, 'sideways_rsi_os': 24, 'sideways_rsi_ob': 81, 'sideways_adx_thresh': 30.144457590361235, 'sideways_atr_min_pct': 0.0028099602186034125, 'sideways_atr_max_pct': 0.10874215900656611, 'sideways_tp_mult': 2.720778827880255, 'sideways_tsl_mult': 0.14803084622257723, 'sideways_time_stop': 218, 'sideways_use_sma': True, 'sideways_use_ema': True, 'sideways_use_atr': False, 'sideways_use_adx': False, 'sideways_use_spike': True, 'sideways_rsi_required': False}.
[I 2025-08-31 11:09:46,273] Trial 840 finished with values: [-1000000000.0, 1000000000.0] and parameters: {'p_sma': 37, 'p_std': 49, 'p_atr': 29, 'p_adx': 12, 'rsi_period': 38, 'ema1': 25, 'ema2': 39, 'slip_atr_k': 0.19515194898325156, 'slip_spread_k': 0.056747547076854865, 'spread_hl_frac': 0.012158233290074259, 'bb_std_mult': 2.569296854616169, 'rsi_os': 32, 'rsi_ob': 55, 'vol_spike': 0.28223552848612055, 'adx_thresh': 24.735082728031912, 'atr_min_pct': 0.012678056279496714, 'atr_max_pct': 0.12726719309180345, 'tp_mult': 2.1979572765062785, 'tsl_mult': 0.8909026459544046, 'strategy': 'mean_reversion', 'time_stop': 126, 'use_sma': True, 'use_atr': True, 'use_adx': True, 'use_ema': True, 'use_spike': False, 'rsi_required': True, 'edge_k': 0.03560585557180074, 'edge_cap': 0.5724686310811475, 'bull_strategy': 'breakout', 'bull_bb_std_mult': 0.7783913251826522, 'bull_rsi_os': 55, 'bull_rsi_ob': 82, 'bull_adx_thresh': 19.737330259965173, 'bull_atr_min_pct': 0.007965891646670898, 'bull_atr_max_pct': 0.05517084822227412, 'bull_tp_mult': 2.907628723714259, 'bull_tsl_mult': 0.9692469291186289, 'bull_time_stop': 73, 'bull_use_sma': True, 'bull_use_ema': False, 'bull_use_atr': False, 'bull_use_adx': False, 'bull_use_spike': False, 'bull_rsi_required': True, 'bear_strategy': 'breakout', 'bear_bb_std_mult': 2.8669573202136047, 'bear_rsi_os': 38, 'bear_rsi_ob': 79, 'bear_adx_thresh': 18.82836265501177, 'bear_atr_min_pct': 0.007660504927288814, 'bear_atr_max_pct': 0.10640906667648724, 'bear_tp_mult': 2.1513715345844973, 'bear_tsl_mult': 0.4453401993183368, 'bear_time_stop': 46, 'bear_use_sma': False, 'bear_use_ema': True, 'bear_use_atr': False, 'bear_use_adx': True, 'bear_use_spike': True, 'bear_rsi_required': False, 'sideways_strategy': 'breakout', 'sideways_bb_std_mult': 1.1053802314816956, 'sideways_rsi_os': 24, 'sideways_rsi_ob': 89, 'sideways_adx_thresh': 28.57380760555487, 'sideways_atr_min_pct': 0.005548320701807103, 'sideways_atr_max_pct': 0.10889099674349319, 'sideways_tp_mult': 2.852663438761826, 'sideways_tsl_mult': 0.046912775694925135, 'sideways_time_stop': 225, 'sideways_use_sma': True, 'sideways_use_ema': True, 'sideways_use_atr': False, 'sideways_use_adx': False, 'sideways_use_spike': True, 'sideways_rsi_required': False}.
[I 2025-08-31 11:09:46,532] Trial 841 finished with values: [-1000000000.0, 1000000000.0] and parameters: {'p_sma': 38, 'p_std': 47, 'p_atr': 11, 'p_adx': 9, 'rsi_period': 38, 'ema1': 18, 'ema2': 14, 'slip_atr_k': 0.24243076740291178, 'slip_spread_k': 0.05745963634254829, 'spread_hl_frac': 0.026179796092303892, 'bb_std_mult': 2.5515244325399484, 'rsi_os': 40, 'rsi_ob': 88, 'vol_spike': 0.2894016963400543, 'adx_thresh': 19.069433014162684, 'atr_min_pct': 0.014350966686361275, 'atr_max_pct': 0.12898317935326256, 'tp_mult': 2.7903206699212535, 'tsl_mult': 0.5055501072473696, 'strategy': 'mean_reversion', 'time_stop': 126, 'use_sma': True, 'use_atr': True, 'use_adx': False, 'use_ema': True, 'use_spike': False, 'rsi_required': True, 'edge_k': 1.7107003623306491, 'edge_cap': 0.5679417447759072, 'bull_strategy': 'breakout', 'bull_bb_std_mult': 0.504484447870285, 'bull_rsi_os': 25, 'bull_rsi_ob': 82, 'bull_adx_thresh': 30.6519072023111, 'bull_atr_min_pct': 0.008874810000130202, 'bull_atr_max_pct': 0.05378268958250282, 'bull_tp_mult': 2.1660285951849847, 'bull_tsl_mult': 0.9149921662845093, 'bull_time_stop': 163, 'bull_use_sma': True, 'bull_use_ema': False, 'bull_use_atr': False, 'bull_use_adx': True, 'bull_use_spike': False, 'bull_rsi_required': True, 'bear_strategy': 'breakout', 'bear_bb_std_mult': 2.5805607735697604, 'bear_rsi_os': 29, 'bear_rsi_ob': 80, 'bear_adx_thresh': 21.973926213695222, 'bear_atr_min_pct': 0.0075647396972505524, 'bear_atr_max_pct': 0.08903339521930123, 'bear_tp_mult': 1.9470387876863147, 'bear_tsl_mult': 0.44478556221683757, 'bear_time_stop': 251, 'bear_use_sma': False, 'bear_use_ema': False, 'bear_use_atr': False, 'bear_use_adx': True, 'bear_use_spike': True, 'bear_rsi_required': False, 'sideways_strategy': 'breakout', 'sideways_bb_std_mult': 1.0079171339348973, 'sideways_rsi_os': 14, 'sideways_rsi_ob': 94, 'sideways_adx_thresh': 30.207654752519918, 'sideways_atr_min_pct': 0.014924850608873996, 'sideways_atr_max_pct': 0.1042560741003909, 'sideways_tp_mult': 2.840534232204891, 'sideways_tsl_mult': 0.04227122393081241, 'sideways_time_stop': 248, 'sideways_use_sma': True, 'sideways_use_ema': True, 'sideways_use_atr': False, 'sideways_use_adx': False, 'sideways_use_spike': True, 'sideways_rsi_required': False}.
[I 2025-08-31 11:09:46,677] Trial 843 finished with values: [-1000000000.0, 1000000000.0] and parameters: {'p_sma': 25, 'p_std': 46, 'p_atr': 15, 'p_adx': 9, 'rsi_period': 21, 'ema1': 18, 'ema2': 16, 'slip_atr_k': 0.1773792217806364, 'slip_spread_k': 0.06017281168060296, 'spread_hl_frac': 0.01111586079329331, 'bb_std_mult': 1.2075184845134388, 'rsi_os': 33, 'rsi_ob': 88, 'vol_spike': 0.28368893081393975, 'adx_thresh': 25.272014006172586, 'atr_min_pct': 0.012698951201761214, 'atr_max_pct': 0.018290375164589666, 'tp_mult': 2.206139069123886, 'tsl_mult': 0.08806764044986948, 'strategy': 'breakout', 'time_stop': 169, 'use_sma': False, 'use_atr': False, 'use_adx': False, 'use_ema': True, 'use_spike': False, 'rsi_required': False, 'edge_k': 1.245089493657972, 'edge_cap': 0.9716218188245179, 'bull_strategy': 'mean_reversion', 'bull_bb_std_mult': 2.291428263982099, 'bull_rsi_os': 26, 'bull_rsi_ob': 50, 'bull_adx_thresh': 26.494589106490587, 'bull_atr_min_pct': 0.007943380684286195, 'bull_atr_max_pct': 0.07806798127522746, 'bull_tp_mult': 2.1765178626600985, 'bull_tsl_mult': 0.9995367317092472, 'bull_time_stop': 73, 'bull_use_sma': True, 'bull_use_ema': False, 'bull_use_atr': False, 'bull_use_adx': True, 'bull_use_spike': False, 'bull_rsi_required': True, 'bear_strategy': 'breakout', 'bear_bb_std_mult': 2.5827247250822616, 'bear_rsi_os': 19, 'bear_rsi_ob': 73, 'bear_adx_thresh': 13.577904470374438, 'bear_atr_min_pct': 0.007701864874196643, 'bear_atr_max_pct': 0.09832063389827717, 'bear_tp_mult': 1.944350083018441, 'bear_tsl_mult': 0.7702224613304223, 'bear_time_stop': 279, 'bear_use_sma': False, 'bear_use_ema': False, 'bear_use_atr': False, 'bear_use_adx': True, 'bear_use_spike': True, 'bear_rsi_required': True, 'sideways_strategy': 'mean_reversion', 'sideways_bb_std_mult': 1.0012913903160805, 'sideways_rsi_os': 13, 'sideways_rsi_ob': 58, 'sideways_adx_thresh': 28.007236097440767, 'sideways_atr_min_pct': 0.02583828744189871, 'sideways_atr_max_pct': 0.10515270892055983, 'sideways_tp_mult': 2.840646240823826, 'sideways_tsl_mult': 0.2710404898873031, 'sideways_time_stop': 227, 'sideways_use_sma': True, 'sideways_use_ema': True, 'sideways_use_atr': False, 'sideways_use_adx': False, 'sideways_use_spike': True, 'sideways_rsi_required': True}.
[I 2025-08-31 11:09:46,888] Trial 842 finished with values: [-1000000000.0, 1000000000.0] and parameters: {'p_sma': 25, 'p_std': 36, 'p_atr': 24, 'p_adx': 12, 'rsi_period': 21, 'ema1': 18, 'ema2': 14, 'slip_atr_k': 0.24371886711977608, 'slip_spread_k': 0.05275794632064199, 'spread_hl_frac': 0.011235019340358815, 'bb_std_mult': 1.6424161752830158, 'rsi_os': 36, 'rsi_ob': 88, 'vol_spike': 0.2663881106608748, 'adx_thresh': 25.207819859164843, 'atr_min_pct': 0.012211592022712766, 'atr_max_pct': 0.09052497994623093, 'tp_mult': 1.792744747001792, 'tsl_mult': 0.09275518901140095, 'strategy': 'breakout', 'time_stop': 170, 'use_sma': False, 'use_atr': False, 'use_adx': False, 'use_ema': True, 'use_spike': False, 'rsi_required': False, 'edge_k': 0.6298363019098594, 'edge_cap': 0.5573432450584548, 'bull_strategy': 'mean_reversion', 'bull_bb_std_mult': 1.044969509995375, 'bull_rsi_os': 38, 'bull_rsi_ob': 50, 'bull_adx_thresh': 19.50599805851766, 'bull_atr_min_pct': 0.007923935089902237, 'bull_atr_max_pct': 0.07805260571026952, 'bull_tp_mult': 2.1846046886729127, 'bull_tsl_mult': 0.9762783054562558, 'bull_time_stop': 292, 'bull_use_sma': True, 'bull_use_ema': False, 'bull_use_atr': False, 'bull_use_adx': True, 'bull_use_spike': False, 'bull_rsi_required': True, 'bear_strategy': 'breakout', 'bear_bb_std_mult': 0.8022710424540525, 'bear_rsi_os': 29, 'bear_rsi_ob': 80, 'bear_adx_thresh': 18.55878656104306, 'bear_atr_min_pct': 0.0076455575804704285, 'bear_atr_max_pct': 0.09828139678911704, 'bear_tp_mult': 1.6741875641889579, 'bear_tsl_mult': 0.7526150683758814, 'bear_time_stop': 277, 'bear_use_sma': False, 'bear_use_ema': False, 'bear_use_atr': False, 'bear_use_adx': True, 'bear_use_spike': True, 'bear_rsi_required': True, 'sideways_strategy': 'mean_reversion', 'sideways_bb_std_mult': 1.7131350044775897, 'sideways_rsi_os': 24, 'sideways_rsi_ob': 60, 'sideways_adx_thresh': 29.506208995688063, 'sideways_atr_min_pct': 0.008341237657366364, 'sideways_atr_max_pct': 0.10500647515152825, 'sideways_tp_mult': 1.0222873002483253, 'sideways_tsl_mult': 0.02380351621394723, 'sideways_time_stop': 226, 'sideways_use_sma': True, 'sideways_use_ema': True, 'sideways_use_atr': False, 'sideways_use_adx': False, 'sideways_use_spike': True, 'sideways_rsi_required': True}.
[I 2025-08-31 11:10:20,721] Trial 847 finished with values: [-1000000000.0, 1000000000.0] and parameters: {'p_sma': 34, 'p_std': 51, 'p_atr': 20, 'p_adx': 8, 'rsi_period': 23, 'ema1': 26, 'ema2': 37, 'slip_atr_k': 0.16955587331040473, 'slip_spread_k': 0.07841914608087924, 'spread_hl_frac': 0.02498444782572072, 'bb_std_mult': 1.1125570763347035, 'rsi_os': 43, 'rsi_ob': 83, 'vol_spike': 0.03438901942736229, 'adx_thresh': 12.03522390522517, 'atr_min_pct': 0.011908452060298197, 'atr_max_pct': 0.03374966988924541, 'tp_mult': 2.724883598011031, 'tsl_mult': 0.16851918994448672, 'strategy': 'breakout', 'time_stop': 138, 'use_sma': False, 'use_atr': False, 'use_adx': False, 'use_ema': True, 'use_spike': False, 'rsi_required': True, 'edge_k': 1.857013827825283, 'edge_cap': 0.13352698933442908, 'bull_strategy': 'mean_reversion', 'bull_bb_std_mult': 1.4024397750792958, 'bull_rsi_os': 49, 'bull_rsi_ob': 64, 'bull_adx_thresh': 29.189132139587212, 'bull_atr_min_pct': 0.016581969329558358, 'bull_atr_max_pct': 0.12997546580558336, 'bull_tp_mult': 2.4686757943455686, 'bull_tsl_mult': 0.2900868215818245, 'bull_time_stop': 68, 'bull_use_sma': False, 'bull_use_ema': False, 'bull_use_atr': False, 'bull_use_adx': False, 'bull_use_spike': False, 'bull_rsi_required': False, 'bear_strategy': 'mean_reversion', 'bear_bb_std_mult': 2.979570780952333, 'bear_rsi_os': 32, 'bear_rsi_ob': 81, 'bear_adx_thresh': 21.08600202869401, 'bear_atr_min_pct': 0.015861677176581202, 'bear_atr_max_pct': 0.1081565938589712, 'bear_tp_mult': 1.3337381936701243, 'bear_tsl_mult': 0.46686137744344763, 'bear_time_stop': 264, 'bear_use_sma': False, 'bear_use_ema': True, 'bear_use_atr': False, 'bear_use_adx': False, 'bear_use_spike': False, 'bear_rsi_required': True, 'sideways_strategy': 'breakout', 'sideways_bb_std_mult': 3.3402616934626765, 'sideways_rsi_os': 23, 'sideways_rsi_ob': 95, 'sideways_adx_thresh': 30.8397146266381, 'sideways_atr_min_pct': 0.02228754366247704, 'sideways_atr_max_pct': 0.0790084093745613, 'sideways_tp_mult': 2.056724845325338, 'sideways_tsl_mult': 0.06977229860517807, 'sideways_time_stop': 243, 'sideways_use_sma': True, 'sideways_use_ema': False, 'sideways_use_atr': False, 'sideways_use_adx': False, 'sideways_use_spike': True, 'sideways_rsi_required': False}.
[I 2025-08-31 11:10:21,051] Trial 845 finished with values: [-1000000000.0, 1000000000.0] and parameters: {'p_sma': 43, 'p_std': 45, 'p_atr': 15, 'p_adx': 19, 'rsi_period': 22, 'ema1': 17, 'ema2': 41, 'slip_atr_k': 0.1749951435805291, 'slip_spread_k': 0.6226175724923169, 'spread_hl_frac': 0.024314674331432917, 'bb_std_mult': 1.8666794946107197, 'rsi_os': 28, 'rsi_ob': 84, 'vol_spike': 0.2674855644999139, 'adx_thresh': 24.20300867900646, 'atr_min_pct': 0.011984932291758826, 'atr_max_pct': 0.033009613519863756, 'tp_mult': 2.9636329502488468, 'tsl_mult': 0.08725172075838125, 'strategy': 'breakout', 'time_stop': 141, 'use_sma': False, 'use_atr': False, 'use_adx': False, 'use_ema': True, 'use_spike': False, 'rsi_required': False, 'edge_k': 0.6200144020613376, 'edge_cap': 0.09928614919290653, 'bull_strategy': 'mean_reversion', 'bull_bb_std_mult': 0.98540967034417, 'bull_rsi_os': 26, 'bull_rsi_ob': 67, 'bull_adx_thresh': 24.00151314383456, 'bull_atr_min_pct': 0.021364182702974716, 'bull_atr_max_pct': 0.08315506541182598, 'bull_tp_mult': 2.1792873511591626, 'bull_tsl_mult': 0.7110554233415153, 'bull_time_stop': 37, 'bull_use_sma': False, 'bull_use_ema': False, 'bull_use_atr': False, 'bull_use_adx': True, 'bull_use_spike': False, 'bull_rsi_required': False, 'bear_strategy': 'mean_reversion', 'bear_bb_std_mult': 3.25842450277737, 'bear_rsi_os': 27, 'bear_rsi_ob': 81, 'bear_adx_thresh': 21.040008116456022, 'bear_atr_min_pct': 0.028535934738178968, 'bear_atr_max_pct': 0.09858607012904114, 'bear_tp_mult': 1.3360277011872803, 'bear_tsl_mult': 0.5148210853380839, 'bear_time_stop': 283, 'bear_use_sma': False, 'bear_use_ema': False, 'bear_use_atr': False, 'bear_use_adx': False, 'bear_use_spike': False, 'bear_rsi_required': True, 'sideways_strategy': 'mean_reversion', 'sideways_bb_std_mult': 3.3342008228056708, 'sideways_rsi_os': 23, 'sideways_rsi_ob': 95, 'sideways_adx_thresh': 29.35964644609528, 'sideways_atr_min_pct': 0.01756506813960571, 'sideways_atr_max_pct': 0.01315600766177985, 'sideways_tp_mult': 2.931626315726555, 'sideways_tsl_mult': 0.5642875228910252, 'sideways_time_stop': 285, 'sideways_use_sma': True, 'sideways_use_ema': True, 'sideways_use_atr': False, 'sideways_use_adx': False, 'sideways_use_spike': True, 'sideways_rsi_required': True}.
