[I 2025-08-31 10:38:26,807] Trial 612 finished with values: [-1000000000.0, 1000000000.0] and parameters: {'p_sma': 11, 'p_std': 34, 'p_atr': 28, 'p_adx': 9, 'rsi_period': 37, 'ema1': 25, 'ema2': 37, 'slip_atr_k': 0.17913093161308744, 'slip_spread_k': 0.06029776868068024, 'spread_hl_frac': 0.042285107228393494, 'bb_std_mult': 1.2484146155117162, 'rsi_os': 30, 'rsi_ob': 76, 'vol_spike': 0.04523445864526063, 'adx_thresh': 16.380930864167954, 'atr_min_pct': 0.0017792570191238581, 'atr_max_pct': 0.11956011417805368, 'tp_mult': 2.90585760931619, 'tsl_mult': 0.8192777024292631, 'strategy': 'breakout', 'time_stop': 148, 'use_sma': False, 'use_atr': False, 'use_adx': False, 'use_ema': True, 'use_spike': False, 'rsi_required': True, 'edge_k': 0.9172218212478243, 'edge_cap': 0.1055294167273165, 'bull_strategy': 'mean_reversion', 'bull_bb_std_mult': 2.3990752545583787, 'bull_rsi_os': 15, 'bull_rsi_ob': 54, 'bull_adx_thresh': 26.74549097728036, 'bull_atr_min_pct': 0.007427063751041739, 'bull_atr_max_pct': 0.073162315764567, 'bull_tp_mult': 2.1856793359916624, 'bull_tsl_mult': 0.14532351797843424, 'bull_time_stop': 153, 'bull_use_sma': True, 'bull_use_ema': False, 'bull_use_atr': False, 'bull_use_adx': False, 'bull_use_spike': True, 'bull_rsi_required': True, 'bear_strategy': 'breakout', 'bear_bb_std_mult': 2.8153616324693487, 'bear_rsi_os': 27, 'bear_rsi_ob': 78, 'bear_adx_thresh': 24.44602232966338, 'bear_atr_min_pct': 0.003365987696431696, 'bear_atr_max_pct': 0.043410746910505005, 'bear_tp_mult': 2.0643279186550325, 'bear_tsl_mult': 0.44423346423335786, 'bear_time_stop': 58, 'bear_use_sma': False, 'bear_use_ema': False, 'bear_use_atr': True, 'bear_use_adx': True, 'bear_use_spike': True, 'bear_rsi_required': True, 'sideways_strategy': 'breakout', 'sideways_bb_std_mult': 0.9448227720310733, 'sideways_rsi_os': 17, 'sideways_rsi_ob': 47, 'sideways_adx_thresh': 28.88537372666067, 'sideways_atr_min_pct': 0.025847796396691318, 'sideways_atr_max_pct': 0.10023858329832191, 'sideways_tp_mult': 2.8963767031818626, 'sideways_tsl_mult': 0.04564963377734262, 'sideways_time_stop': 216, 'sideways_use_sma': False, 'sideways_use_ema': True, 'sideways_use_atr': True, 'sideways_use_adx': True, 'sideways_use_spike': True, 'sideways_rsi_required': False}.
[I 2025-08-31 10:38:27,046] Trial 613 finished with values: [-0.012678640131172925, 0.01262223169304326] and parameters: {'p_sma': 11, 'p_std': 39, 'p_atr': 28, 'p_adx': 9, 'rsi_period': 23, 'ema1': 13, 'ema2': 22, 'slip_atr_k': 0.1798936134418517, 'slip_spread_k': 0.06147327383830634, 'spread_hl_frac': 0.04295448894604018, 'bb_std_mult': 1.2457537580269986, 'rsi_os': 39, 'rsi_ob': 74, 'vol_spike': 0.28238370734310636, 'adx_thresh': 16.308306180801242, 'atr_min_pct': 0.011683686357859048, 'atr_max_pct': 0.11938566847805529, 'tp_mult': 2.885926359582355, 'tsl_mult': 0.0466959889141043, 'strategy': 'breakout', 'time_stop': 147, 'use_sma': False, 'use_atr': False, 'use_adx': False, 'use_ema': True, 'use_spike': False, 'rsi_required': False, 'edge_k': 1.9436231507139634, 'edge_cap': 0.5367864657869903, 'bull_strategy': 'mean_reversion', 'bull_bb_std_mult': 2.2361286354838317, 'bull_rsi_os': 52, 'bull_rsi_ob': 69, 'bull_adx_thresh': 28.73984105479854, 'bull_atr_min_pct': 0.007607016947116408, 'bull_atr_max_pct': 0.14362761044050343, 'bull_tp_mult': 2.1975114842270647, 'bull_tsl_mult': 0.14834896215574817, 'bull_time_stop': 75, 'bull_use_sma': True, 'bull_use_ema': True, 'bull_use_atr': False, 'bull_use_adx': True, 'bull_use_spike': True, 'bull_rsi_required': True, 'bear_strategy': 'breakout', 'bear_bb_std_mult': 0.90697553237304, 'bear_rsi_os': 28, 'bear_rsi_ob': 57, 'bear_adx_thresh': 5.055153406005065, 'bear_atr_min_pct': 0.00904912200667682, 'bear_atr_max_pct': 0.1083833679517387, 'bear_tp_mult': 2.0634510980809444, 'bear_tsl_mult': 0.44355728483648077, 'bear_time_stop': 293, 'bear_use_sma': True, 'bear_use_ema': False, 'bear_use_atr': True, 'bear_use_adx': False, 'bear_use_spike': True, 'bear_rsi_required': True, 'sideways_strategy': 'breakout', 'sideways_bb_std_mult': 0.8937771242059096, 'sideways_rsi_os': 30, 'sideways_rsi_ob': 77, 'sideways_adx_thresh': 28.55451460792196, 'sideways_atr_min_pct': 0.0017232312978988766, 'sideways_atr_max_pct': 0.10210211194286921, 'sideways_tp_mult': 2.7996279224352962, 'sideways_tsl_mult': 0.07624442954144872, 'sideways_time_stop': 169, 'sideways_use_sma': False, 'sideways_use_ema': True, 'sideways_use_atr': True, 'sideways_use_adx': True, 'sideways_use_spike': True, 'sideways_rsi_required': False}.
[I 2025-08-31 10:38:27,060] Trial 611 finished with values: [-1000000000.0, 1000000000.0] and parameters: {'p_sma': 16, 'p_std': 38, 'p_atr': 28, 'p_adx': 9, 'rsi_period': 36, 'ema1': 18, 'ema2': 37, 'slip_atr_k': 0.0642739581243378, 'slip_spread_k': 0.19241711802106465, 'spread_hl_frac': 0.03532678936064181, 'bb_std_mult': 2.365718702254889, 'rsi_os': 40, 'rsi_ob': 84, 'vol_spike': 0.29279505263568, 'adx_thresh': 24.28294172401478, 'atr_min_pct': 0.009964964121104432, 'atr_max_pct': 0.12615777346763465, 'tp_mult': 1.0145829036182912, 'tsl_mult': 0.07910016750851837, 'strategy': 'breakout', 'time_stop': 194, 'use_sma': False, 'use_atr': False, 'use_adx': False, 'use_ema': True, 'use_spike': False, 'rsi_required': True, 'edge_k': 1.942570355453298, 'edge_cap': 0.7594660128452032, 'bull_strategy': 'mean_reversion', 'bull_bb_std_mult': 1.0135086113211642, 'bull_rsi_os': 15, 'bull_rsi_ob': 54, 'bull_adx_thresh': 24.3002600806251, 'bull_atr_min_pct': 0.007076627729951983, 'bull_atr_max_pct': 0.13780828330204858, 'bull_tp_mult': 2.1460060483981667, 'bull_tsl_mult': 0.8548746500074786, 'bull_time_stop': 87, 'bull_use_sma': True, 'bull_use_ema': False, 'bull_use_atr': False, 'bull_use_adx': False, 'bull_use_spike': True, 'bull_rsi_required': True, 'bear_strategy': 'breakout', 'bear_bb_std_mult': 0.5845861786527711, 'bear_rsi_os': 27, 'bear_rsi_ob': 76, 'bear_adx_thresh': 8.556470904885073, 'bear_atr_min_pct': 0.0030274361886239824, 'bear_atr_max_pct': 0.10674021336378078, 'bear_tp_mult': 1.9733462289681158, 'bear_tsl_mult': 0.616978894173886, 'bear_time_stop': 114, 'bear_use_sma': False, 'bear_use_ema': False, 'bear_use_atr': False, 'bear_use_adx': True, 'bear_use_spike': True, 'bear_rsi_required': True, 'sideways_strategy': 'breakout', 'sideways_bb_std_mult': 0.9490344710853795, 'sideways_rsi_os': 30, 'sideways_rsi_ob': 92, 'sideways_adx_thresh': 16.390888337771628, 'sideways_atr_min_pct': 0.0017386743625764627, 'sideways_atr_max_pct': 0.10136777949219254, 'sideways_tp_mult': 2.794980999497287, 'sideways_tsl_mult': 0.07902883998248453, 'sideways_time_stop': 280, 'sideways_use_sma': True, 'sideways_use_ema': True, 'sideways_use_atr': True, 'sideways_use_adx': True, 'sideways_use_spike': True, 'sideways_rsi_required': False}.
[I 2025-08-31 10:39:01,516] Trial 615 finished with values: [-1000000000.0, 1000000000.0] and parameters: {'p_sma': 15, 'p_std': 46, 'p_atr': 27, 'p_adx': 14, 'rsi_period': 61, 'ema1': 29, 'ema2': 19, 'slip_atr_k': 0.23868232587365254, 'slip_spread_k': 0.6259043342168491, 'spread_hl_frac': 0.011026994977102517, 'bb_std_mult': 2.3223516583390325, 'rsi_os': 33, 'rsi_ob': 62, 'vol_spike': 0.28207516342714706, 'adx_thresh': 21.31196997880928, 'atr_min_pct': 0.0241826228910457, 'atr_max_pct': 0.12629604873292663, 'tp_mult': 2.8914226048825546, 'tsl_mult': 0.32496609853687847, 'strategy': 'breakout', 'time_stop': 147, 'use_sma': False, 'use_atr': False, 'use_adx': False, 'use_ema': True, 'use_spike': False, 'rsi_required': True, 'edge_k': 0.7141911512961546, 'edge_cap': 0.3649831917222047, 'bull_strategy': 'mean_reversion', 'bull_bb_std_mult': 2.4100865713835598, 'bull_rsi_os': 13, 'bull_rsi_ob': 55, 'bull_adx_thresh': 26.664716308778832, 'bull_atr_min_pct': 0.007483129382417116, 'bull_atr_max_pct': 0.09024640001436118, 'bull_tp_mult': 2.139587678266236, 'bull_tsl_mult': 0.978521446559555, 'bull_time_stop': 88, 'bull_use_sma': True, 'bull_use_ema': False, 'bull_use_atr': False, 'bull_use_adx': False, 'bull_use_spike': False, 'bull_rsi_required': True, 'bear_strategy': 'breakout', 'bear_bb_std_mult': 2.970517251679957, 'bear_rsi_os': 28, 'bear_rsi_ob': 81, 'bear_adx_thresh': 20.122911265744076, 'bear_atr_min_pct': 0.0073505284155504684, 'bear_atr_max_pct': 0.042092627927185995, 'bear_tp_mult': 2.0595942511169354, 'bear_tsl_mult': 0.8900547657333632, 'bear_time_stop': 57, 'bear_use_sma': False, 'bear_use_ema': False, 'bear_use_atr': False, 'bear_use_adx': True, 'bear_use_spike': True, 'bear_rsi_required': True, 'sideways_strategy': 'breakout', 'sideways_bb_std_mult': 0.8185468995781839, 'sideways_rsi_os': 26, 'sideways_rsi_ob': 92, 'sideways_adx_thresh': 28.184864073494996, 'sideways_atr_min_pct': 2.736322664266609e-05, 'sideways_atr_max_pct': 0.13066760945026598, 'sideways_tp_mult': 2.898983157658605, 'sideways_tsl_mult': 0.08136735648516541, 'sideways_time_stop': 257, 'sideways_use_sma': True, 'sideways_use_ema': True, 'sideways_use_atr': False, 'sideways_use_adx': False, 'sideways_use_spike': True, 'sideways_rsi_required': False}.
[I 2025-08-31 10:39:02,065] Trial 616 finished with values: [-0.15533376324053583, 0.15523549185467886] and parameters: {'p_sma': 37, 'p_std': 46, 'p_atr': 27, 'p_adx': 22, 'rsi_period': 10, 'ema1': 13, 'ema2': 18, 'slip_atr_k': 0.23654679395275607, 'slip_spread_k': 0.08933621531959697, 'spread_hl_frac': 0.0109865486843573, 'bb_std_mult': 1.1701932445328935, 'rsi_os': 43, 'rsi_ob': 63, 'vol_spike': 0.07159643910581912, 'adx_thresh': 21.09152067048981, 'atr_min_pct': 0.022053174503657538, 'atr_max_pct': 0.1262134224264784, 'tp_mult': 2.82657973444588, 'tsl_mult': 0.060554748063343045, 'strategy': 'breakout', 'time_stop': 143, 'use_sma': False, 'use_atr': False, 'use_adx': False, 'use_ema': True, 'use_spike': True, 'rsi_required': False, 'edge_k': 1.1670127803989592, 'edge_cap': 0.7358922846607273, 'bull_strategy': 'mean_reversion', 'bull_bb_std_mult': 1.229313092733578, 'bull_rsi_os': 27, 'bull_rsi_ob': 66, 'bull_adx_thresh': 30.791152045730684, 'bull_atr_min_pct': 0.007423855444086343, 'bull_atr_max_pct': 0.08844846531656361, 'bull_tp_mult': 2.317538568012653, 'bull_tsl_mult': 0.9473523812549705, 'bull_time_stop': 85, 'bull_use_sma': True, 'bull_use_ema': True, 'bull_use_atr': False, 'bull_use_adx': True, 'bull_use_spike': False, 'bull_rsi_required': True, 'bear_strategy': 'breakout', 'bear_bb_std_mult': 0.6141046112146287, 'bear_rsi_os': 46, 'bear_rsi_ob': 57, 'bear_adx_thresh': 22.6929164612718, 'bear_atr_min_pct': 0.007376506080956511, 'bear_atr_max_pct': 0.11294097101039613, 'bear_tp_mult': 1.807470823843944, 'bear_tsl_mult': 0.6831368939582163, 'bear_time_stop': 5, 'bear_use_sma': False, 'bear_use_ema': True, 'bear_use_atr': False, 'bear_use_adx': True, 'bear_use_spike': True, 'bear_rsi_required': True, 'sideways_strategy': 'breakout', 'sideways_bb_std_mult': 2.1104429256441892, 'sideways_rsi_os': 30, 'sideways_rsi_ob': 92, 'sideways_adx_thresh': 18.07272732137695, 'sideways_atr_min_pct': 9.055718473235334e-05, 'sideways_atr_max_pct': 0.12324062412967353, 'sideways_tp_mult': 1.1632927329474736, 'sideways_tsl_mult': 0.08163912495292275, 'sideways_time_stop': 166, 'sideways_use_sma': True, 'sideways_use_ema': True, 'sideways_use_atr': False, 'sideways_use_adx': False, 'sideways_use_spike': True, 'sideways_rsi_required': False}.
[I 2025-08-31 10:39:02,293] Trial 618 finished with values: [-1000000000.0, 1000000000.0] and parameters: {'p_sma': 13, 'p_std': 46, 'p_atr': 8, 'p_adx': 22, 'rsi_period': 23, 'ema1': 28, 'ema2': 34, 'slip_atr_k': 0.1873800930340184, 'slip_spread_k': 0.09707869464603695, 'spread_hl_frac': 0.010996400257082511, 'bb_std_mult': 1.1613206076001257, 'rsi_os': 41, 'rsi_ob': 63, 'vol_spike': 0.28354643985521233, 'adx_thresh': 32.96115744469746, 'atr_min_pct': 0.010658260283027219, 'atr_max_pct': 0.0794915013598072, 'tp_mult': 1.8707106221821426, 'tsl_mult': 0.041385747091517086, 'strategy': 'breakout', 'time_stop': 132, 'use_sma': False, 'use_atr': False, 'use_adx': True, 'use_ema': True, 'use_spike': True, 'rsi_required': False, 'edge_k': 1.8709920366876678, 'edge_cap': 0.11914304958311803, 'bull_strategy': 'mean_reversion', 'bull_bb_std_mult': 1.2614916563083063, 'bull_rsi_os': 11, 'bull_rsi_ob': 66, 'bull_adx_thresh': 30.63854412358156, 'bull_atr_min_pct': 0.0076655885832658, 'bull_atr_max_pct': 0.08913717963515655, 'bull_tp_mult': 1.878181011936164, 'bull_tsl_mult': 0.9995077726350138, 'bull_time_stop': 137, 'bull_use_sma': True, 'bull_use_ema': True, 'bull_use_atr': False, 'bull_use_adx': True, 'bull_use_spike': False, 'bull_rsi_required': True, 'bear_strategy': 'breakout', 'bear_bb_std_mult': 2.9723026388009046, 'bear_rsi_os': 28, 'bear_rsi_ob': 79, 'bear_adx_thresh': 22.621493675605358, 'bear_atr_min_pct': 0.007427491835428828, 'bear_atr_max_pct': 0.04050133447760625, 'bear_tp_mult': 2.0664495828830547, 'bear_tsl_mult': 0.8875721199013394, 'bear_time_stop': 269, 'bear_use_sma': True, 'bear_use_ema': True, 'bear_use_atr': False, 'bear_use_adx': False, 'bear_use_spike': True, 'bear_rsi_required': True, 'sideways_strategy': 'breakout', 'sideways_bb_std_mult': 0.7634284901665975, 'sideways_rsi_os': 26, 'sideways_rsi_ob': 77, 'sideways_adx_thresh': 28.08320770542427, 'sideways_atr_min_pct': 0.0050850100285297194, 'sideways_atr_max_pct': 0.13165931551570478, 'sideways_tp_mult': 2.914747157644016, 'sideways_tsl_mult': 0.0188572599792972, 'sideways_time_stop': 234, 'sideways_use_sma': True, 'sideways_use_ema': True, 'sideways_use_atr': False, 'sideways_use_adx': False, 'sideways_use_spike': True, 'sideways_rsi_required': False}.
[I 2025-08-31 10:39:02,389] Trial 617 finished with values: [-0.144014723674054, 0.14389477165176612] and parameters: {'p_sma': 15, 'p_std': 38, 'p_atr': 28, 'p_adx': 9, 'rsi_period': 10, 'ema1': 24, 'ema2': 19, 'slip_atr_k': 0.18852542190887653, 'slip_spread_k': 0.5590764840868805, 'spread_hl_frac': 0.010628112322586333, 'bb_std_mult': 1.88820714879024, 'rsi_os': 39, 'rsi_ob': 95, 'vol_spike': 0.2835947964861302, 'adx_thresh': 32.910300729251716, 'atr_min_pct': 0.0108556938152704, 'atr_max_pct': 0.12604016707694354, 'tp_mult': 2.8339770546928156, 'tsl_mult': 0.04252017018831838, 'strategy': 'breakout', 'time_stop': 116, 'use_sma': False, 'use_atr': False, 'use_adx': False, 'use_ema': True, 'use_spike': True, 'rsi_required': True, 'edge_k': 1.8691713403282402, 'edge_cap': 0.2858668432819037, 'bull_strategy': 'mean_reversion', 'bull_bb_std_mult': 1.264958885316015, 'bull_rsi_os': 11, 'bull_rsi_ob': 90, 'bull_adx_thresh': 21.379733811422863, 'bull_atr_min_pct': 0.007649958319228605, 'bull_atr_max_pct': 0.08908931206063866, 'bull_tp_mult': 2.1545245677609497, 'bull_tsl_mult': 0.9399935426176217, 'bull_time_stop': 85, 'bull_use_sma': True, 'bull_use_ema': True, 'bull_use_atr': False, 'bull_use_adx': True, 'bull_use_spike': False, 'bull_rsi_required': True, 'bear_strategy': 'breakout', 'bear_bb_std_mult': 2.1741346942310815, 'bear_rsi_os': 29, 'bear_rsi_ob': 46, 'bear_adx_thresh': 22.826485517530138, 'bear_atr_min_pct': 0.007342063988206148, 'bear_atr_max_pct': 0.11378757592323437, 'bear_tp_mult': 2.3326603502263588, 'bear_tsl_mult': 0.4903309987221883, 'bear_time_stop': 260, 'bear_use_sma': False, 'bear_use_ema': True, 'bear_use_atr': False, 'bear_use_adx': True, 'bear_use_spike': True, 'bear_rsi_required': True, 'sideways_strategy': 'breakout', 'sideways_bb_std_mult': 2.1268729078400757, 'sideways_rsi_os': 30, 'sideways_rsi_ob': 50, 'sideways_adx_thresh': 30.82716270373073, 'sideways_atr_min_pct': 5.9050582010533245e-05, 'sideways_atr_max_pct': 0.13236518958024662, 'sideways_tp_mult': 2.5582225631810096, 'sideways_tsl_mult': 0.07729086881477244, 'sideways_time_stop': 218, 'sideways_use_sma': True, 'sideways_use_ema': True, 'sideways_use_atr': False, 'sideways_use_adx': False, 'sideways_use_spike': True, 'sideways_rsi_required': False}.
[I 2025-08-31 10:39:34,657] Trial 622 finished with values: [-1000000000.0, 1000000000.0] and parameters: {'p_sma': 9, 'p_std': 60, 'p_atr': 29, 'p_adx': 9, 'rsi_period': 76, 'ema1': 18, 'ema2': 36, 'slip_atr_k': 0.0855873890123938, 'slip_spread_k': 0.13254555261269407, 'spread_hl_frac': 0.012549109773545074, 'bb_std_mult': 1.3056823810451603, 'rsi_os': 54, 'rsi_ob': 83, 'vol_spike': 0.2660991218154786, 'adx_thresh': 13.804312899345954, 'atr_min_pct': 0.025634605638163575, 'atr_max_pct': 0.11648266990859546, 'tp_mult': 1.557184304166113, 'tsl_mult': 0.632130703885099, 'strategy': 'breakout', 'time_stop': 15, 'use_sma': False, 'use_atr': True, 'use_adx': True, 'use_ema': True, 'use_spike': False, 'rsi_required': True, 'edge_k': 1.9982501629186493, 'edge_cap': 0.1286054367268974, 'bull_strategy': 'mean_reversion', 'bull_bb_std_mult': 2.986262826760208, 'bull_rsi_os': 24, 'bull_rsi_ob': 69, 'bull_adx_thresh': 31.57517379897182, 'bull_atr_min_pct': 0.0065195850325990585, 'bull_atr_max_pct': 0.14483137765221607, 'bull_tp_mult': 1.7086050673225541, 'bull_tsl_mult': 0.9744451067247464, 'bull_time_stop': 296, 'bull_use_sma': True, 'bull_use_ema': False, 'bull_use_atr': False, 'bull_use_adx': False, 'bull_use_spike': False, 'bull_rsi_required': False, 'bear_strategy': 'breakout', 'bear_bb_std_mult': 2.8943589184667506, 'bear_rsi_os': 6, 'bear_rsi_ob': 82, 'bear_adx_thresh': 21.842987757859945, 'bear_atr_min_pct': 0.010545191306174139, 'bear_atr_max_pct': 0.04895046936446025, 'bear_tp_mult': 2.010865475628777, 'bear_tsl_mult': 0.47046251307191694, 'bear_time_stop': 172, 'bear_use_sma': True, 'bear_use_ema': True, 'bear_use_atr': True, 'bear_use_adx': False, 'bear_use_spike': True, 'bear_rsi_required': False, 'sideways_strategy': 'mean_reversion', 'sideways_bb_std_mult': 1.932446977438159, 'sideways_rsi_os': 25, 'sideways_rsi_ob': 94, 'sideways_adx_thresh': 30.22322040543672, 'sideways_atr_min_pct': 0.020104822993204152, 'sideways_atr_max_pct': 0.10762148107081508, 'sideways_tp_mult': 2.8729430876824487, 'sideways_tsl_mult': 0.5116740158246743, 'sideways_time_stop': 226, 'sideways_use_sma': False, 'sideways_use_ema': False, 'sideways_use_atr': False, 'sideways_use_adx': False, 'sideways_use_spike': True, 'sideways_rsi_required': True}.
[I 2025-08-31 10:39:34,951] Trial 620 finished with values: [-1000000000.0, 1000000000.0] and parameters: {'p_sma': 12, 'p_std': 48, 'p_atr': 8, 'p_adx': 13, 'rsi_period': 23, 'ema1': 17, 'ema2': 57, 'slip_atr_k': 0.08343311620919854, 'slip_spread_k': 0.0966440520206583, 'spread_hl_frac': 0.0316936669863475, 'bb_std_mult': 1.1578383885488246, 'rsi_os': 39, 'rsi_ob': 83, 'vol_spike': 0.2627770521614032, 'adx_thresh': 23.408814618268117, 'atr_min_pct': 0.018110662996302682, 'atr_max_pct': 0.12335879983797618, 'tp_mult': 1.8222658035604398, 'tsl_mult': 0.04718440391551354, 'strategy': 'breakout', 'time_stop': 135, 'use_sma': False, 'use_atr': True, 'use_adx': True, 'use_ema': True, 'use_spike': True, 'rsi_required': True, 'edge_k': 1.0717378129802066, 'edge_cap': 0.12452624177887617, 'bull_strategy': 'mean_reversion', 'bull_bb_std_mult': 1.113335511897756, 'bull_rsi_os': 52, 'bull_rsi_ob': 65, 'bull_adx_thresh': 31.622876845273773, 'bull_atr_min_pct': 0.006529754062985952, 'bull_atr_max_pct': 0.013162163897225895, 'bull_tp_mult': 2.999976875554823, 'bull_tsl_mult': 0.9817859270515201, 'bull_time_stop': 164, 'bull_use_sma': True, 'bull_use_ema': False, 'bull_use_atr': False, 'bull_use_adx': False, 'bull_use_spike': False, 'bull_rsi_required': False, 'bear_strategy': 'breakout', 'bear_bb_std_mult': 2.888978532924275, 'bear_rsi_os': 30, 'bear_rsi_ob': 79, 'bear_adx_thresh': 21.727449504536956, 'bear_atr_min_pct': 0.010405627811485444, 'bear_atr_max_pct': 0.048985749846661555, 'bear_tp_mult': 2.0074876755439117, 'bear_tsl_mult': 0.46527316573275274, 'bear_time_stop': 270, 'bear_use_sma': True, 'bear_use_ema': True, 'bear_use_atr': True, 'bear_use_adx': False, 'bear_use_spike': True, 'bear_rsi_required': False, 'sideways_strategy': 'mean_reversion', 'sideways_bb_std_mult': 3.2980766201142524, 'sideways_rsi_os': 25, 'sideways_rsi_ob': 80, 'sideways_adx_thresh': 13.752573051244003, 'sideways_atr_min_pct': 0.004725414063075695, 'sideways_atr_max_pct': 0.11031894537691307, 'sideways_tp_mult': 2.932217238132337, 'sideways_tsl_mult': 0.028623854426312885, 'sideways_time_stop': 235, 'sideways_use_sma': False, 'sideways_use_ema': False, 'sideways_use_atr': False, 'sideways_use_adx': False, 'sideways_use_spike': True, 'sideways_rsi_required': True}.
