[I 2025-08-31 09:43:02,011] Trial 171 finished with values: [-1000000000.0, 1000000000.0] and parameters: {'p_sma': 12, 'p_std': 20, 'p_atr': 24, 'p_adx': 21, 'rsi_period': 51, 'ema1': 14, 'ema2': 26, 'slip_atr_k': 0.003261692217719189, 'slip_spread_k': 0.37104198655059323, 'spread_hl_frac': 0.011813087502581476, 'bb_std_mult': 2.545760597163745, 'rsi_os': 21, 'rsi_ob': 49, 'vol_spike': 0.11720046360672517, 'adx_thresh': 32.632610622685256, 'atr_min_pct': 0.008798058887562743, 'atr_max_pct': 0.059289652432563615, 'tp_mult': 1.1772872826829461, 'tsl_mult': 0.09109484468375101, 'strategy': 'breakout', 'time_stop': 192, 'use_sma': True, 'use_atr': True, 'use_adx': False, 'use_ema': True, 'use_spike': True, 'rsi_required': False, 'edge_k': 0.29155405596904815, 'edge_cap': 0.12303159428164051, 'bull_strategy': 'breakout', 'bull_bb_std_mult': 0.592853529474878, 'bull_rsi_os': 37, 'bull_rsi_ob': 72, 'bull_adx_thresh': 31.87429305116512, 'bull_atr_min_pct': 0.018444455660381005, 'bull_atr_max_pct': 0.08429474439288258, 'bull_tp_mult': 1.660533625244563, 'bull_tsl_mult': 0.8250697798263152, 'bull_time_stop': 251, 'bull_use_sma': False, 'bull_use_ema': False, 'bull_use_atr': True, 'bull_use_adx': True, 'bull_use_spike': True, 'bull_rsi_required': False, 'bear_strategy': 'mean_reversion', 'bear_bb_std_mult': 3.5924934877671544, 'bear_rsi_os': 10, 'bear_rsi_ob': 95, 'bear_adx_thresh': 16.190855083331464, 'bear_atr_min_pct': 0.021490212759275734, 'bear_atr_max_pct': 0.1404817192068682, 'bear_tp_mult': 2.451469082859187, 'bear_tsl_mult': 0.32388058427804023, 'bear_time_stop': 159, 'bear_use_sma': True, 'bear_use_ema': False, 'bear_use_atr': True, 'bear_use_adx': True, 'bear_use_spike': True, 'bear_rsi_required': False, 'sideways_strategy': 'mean_reversion', 'sideways_bb_std_mult': 2.416699202510361, 'sideways_rsi_os': 19, 'sideways_rsi_ob': 60, 'sideways_adx_thresh': 12.918816841204574, 'sideways_atr_min_pct': 0.0025943162638772024, 'sideways_atr_max_pct': 0.0655116145278188, 'sideways_tp_mult': 1.0219064821950212, 'sideways_tsl_mult': 0.6900228809600256, 'sideways_time_stop': 79, 'sideways_use_sma': False, 'sideways_use_ema': False, 'sideways_use_atr': True, 'sideways_use_adx': True, 'sideways_use_spike': True, 'sideways_rsi_required': True}.
[I 2025-08-31 09:43:02,254] Trial 170 finished with values: [-1000000000.0, 1000000000.0] and parameters: {'p_sma': 56, 'p_std': 24, 'p_atr': 28, 'p_adx': 8, 'rsi_period': 19, 'ema1': 14, 'ema2': 46, 'slip_atr_k': 0.14479784238907575, 'slip_spread_k': 0.7148325847044272, 'spread_hl_frac': 0.0187569770229116, 'bb_std_mult': 2.2594343451530263, 'rsi_os': 7, 'rsi_ob': 51, 'vol_spike': 0.12081642517496871, 'adx_thresh': 7.137893710030626, 'atr_min_pct': 0.01325060241529506, 'atr_max_pct': 0.05908038043999696, 'tp_mult': 2.9300218955086335, 'tsl_mult': 0.05533809289769318, 'strategy': 'breakout', 'time_stop': 126, 'use_sma': True, 'use_atr': True, 'use_adx': False, 'use_ema': True, 'use_spike': False, 'rsi_required': False, 'edge_k': 1.6613699193138831, 'edge_cap': 0.08438132491031151, 'bull_strategy': 'breakout', 'bull_bb_std_mult': 1.8579686945776925, 'bull_rsi_os': 26, 'bull_rsi_ob': 78, 'bull_adx_thresh': 31.669035689536944, 'bull_atr_min_pct': 0.01747500881279799, 'bull_atr_max_pct': 0.08265070474571849, 'bull_tp_mult': 2.646021482154811, 'bull_tsl_mult': 0.03340808645396415, 'bull_time_stop': 235, 'bull_use_sma': False, 'bull_use_ema': False, 'bull_use_atr': True, 'bull_use_adx': True, 'bull_use_spike': True, 'bull_rsi_required': True, 'bear_strategy': 'mean_reversion', 'bear_bb_std_mult': 0.5072504726700198, 'bear_rsi_os': 50, 'bear_rsi_ob': 66, 'bear_adx_thresh': 19.852609144440834, 'bear_atr_min_pct': 0.004262527071023118, 'bear_atr_max_pct': 0.14938106229533946, 'bear_tp_mult': 2.412407716940123, 'bear_tsl_mult': 0.4633004279682985, 'bear_time_stop': 88, 'bear_use_sma': True, 'bear_use_ema': True, 'bear_use_atr': False, 'bear_use_adx': False, 'bear_use_spike': False, 'bear_rsi_required': False, 'sideways_strategy': 'mean_reversion', 'sideways_bb_std_mult': 2.326831838804647, 'sideways_rsi_os': 54, 'sideways_rsi_ob': 94, 'sideways_adx_thresh': 25.639413872090184, 'sideways_atr_min_pct': 0.003344486912299712, 'sideways_atr_max_pct': 0.14030813891495622, 'sideways_tp_mult': 2.931183489793879, 'sideways_tsl_mult': 0.37230502096326246, 'sideways_time_stop': 18, 'sideways_use_sma': True, 'sideways_use_ema': True, 'sideways_use_atr': True, 'sideways_use_adx': True, 'sideways_use_spike': False, 'sideways_rsi_required': True}.
[I 2025-08-31 09:43:02,444] Trial 172 finished with values: [-1000000000.0, 1000000000.0] and parameters: {'p_sma': 56, 'p_std': 19, 'p_atr': 24, 'p_adx': 21, 'rsi_period': 18, 'ema1': 12, 'ema2': 25, 'slip_atr_k': 0.10935145795399955, 'slip_spread_k': 0.3711561114357121, 'spread_hl_frac': 0.01183935122102476, 'bb_std_mult': 2.57174696228135, 'rsi_os': 8, 'rsi_ob': 85, 'vol_spike': 0.11659335330534676, 'adx_thresh': 7.15334224070517, 'atr_min_pct': 0.014244944606875561, 'atr_max_pct': 0.059132448329808934, 'tp_mult': 2.750262942565192, 'tsl_mult': 0.08954254677938511, 'strategy': 'breakout', 'time_stop': 218, 'use_sma': True, 'use_atr': True, 'use_adx': False, 'use_ema': True, 'use_spike': True, 'rsi_required': False, 'edge_k': 0.5371006673178205, 'edge_cap': 0.7882916557011387, 'bull_strategy': 'breakout', 'bull_bb_std_mult': 0.5921055118502816, 'bull_rsi_os': 12, 'bull_rsi_ob': 72, 'bull_adx_thresh': 31.672739601736414, 'bull_atr_min_pct': 0.02066496972141145, 'bull_atr_max_pct': 0.08251884835657639, 'bull_tp_mult': 2.741031187069899, 'bull_tsl_mult': 0.8162856642013642, 'bull_time_stop': 255, 'bull_use_sma': False, 'bull_use_ema': False, 'bull_use_atr': True, 'bull_use_adx': True, 'bull_use_spike': True, 'bull_rsi_required': False, 'bear_strategy': 'mean_reversion', 'bear_bb_std_mult': 2.0936609938868913, 'bear_rsi_os': 10, 'bear_rsi_ob': 76, 'bear_adx_thresh': 16.338518404707383, 'bear_atr_min_pct': 0.02341019245836034, 'bear_atr_max_pct': 0.1404572272700569, 'bear_tp_mult': 1.9165449771561256, 'bear_tsl_mult': 0.4765977287010825, 'bear_time_stop': 188, 'bear_use_sma': True, 'bear_use_ema': False, 'bear_use_atr': True, 'bear_use_adx': True, 'bear_use_spike': True, 'bear_rsi_required': False, 'sideways_strategy': 'mean_reversion', 'sideways_bb_std_mult': 2.4169767436804346, 'sideways_rsi_os': 55, 'sideways_rsi_ob': 89, 'sideways_adx_thresh': 13.179374451835283, 'sideways_atr_min_pct': 0.0022761599970577404, 'sideways_atr_max_pct': 0.12253756125457717, 'sideways_tp_mult': 1.3867566751774034, 'sideways_tsl_mult': 0.18760929206113292, 'sideways_time_stop': 77, 'sideways_use_sma': False, 'sideways_use_ema': False, 'sideways_use_atr': True, 'sideways_use_adx': True, 'sideways_use_spike': True, 'sideways_rsi_required': True}.
[I 2025-08-31 09:43:42,082] Trial 176 finished with values: [-1000000000.0, 1000000000.0] and parameters: {'p_sma': 52, 'p_std': 32, 'p_atr': 17, 'p_adx': 8, 'rsi_period': 21, 'ema1': 15, 'ema2': 43, 'slip_atr_k': 0.1947363544654349, 'slip_spread_k': 0.37645961259797583, 'spread_hl_frac': 0.022612770074172082, 'bb_std_mult': 2.8741490326631136, 'rsi_os': 20, 'rsi_ob': 79, 'vol_spike': 0.13240089092683247, 'adx_thresh': 14.941738022991325, 'atr_min_pct': 0.014703226703097476, 'atr_max_pct': 0.0709686373517395, 'tp_mult': 1.5029504232419553, 'tsl_mult': 0.5168271794323673, 'strategy': 'mean_reversion', 'time_stop': 16, 'use_sma': True, 'use_atr': True, 'use_adx': True, 'use_ema': True, 'use_spike': True, 'rsi_required': True, 'edge_k': 1.7816391184696347, 'edge_cap': 0.49791369838176514, 'bull_strategy': 'breakout', 'bull_bb_std_mult': 3.589144955082246, 'bull_rsi_os': 23, 'bull_rsi_ob': 54, 'bull_adx_thresh': 30.551941227109467, 'bull_atr_min_pct': 0.0208199216736113, 'bull_atr_max_pct': 0.11499494125168397, 'bull_tp_mult': 2.714576017697679, 'bull_tsl_mult': 0.9222277870739553, 'bull_time_stop': 225, 'bull_use_sma': True, 'bull_use_ema': True, 'bull_use_atr': True, 'bull_use_adx': False, 'bull_use_spike': False, 'bull_rsi_required': True, 'bear_strategy': 'breakout', 'bear_bb_std_mult': 2.7188342238839946, 'bear_rsi_os': 55, 'bear_rsi_ob': 58, 'bear_adx_thresh': 17.145024479215074, 'bear_atr_min_pct': 0.022443616439009387, 'bear_atr_max_pct': 0.14564286295494733, 'bear_tp_mult': 2.5273458045568624, 'bear_tsl_mult': 0.4319084584696349, 'bear_time_stop': 63, 'bear_use_sma': False, 'bear_use_ema': False, 'bear_use_atr': False, 'bear_use_adx': True, 'bear_use_spike': True, 'bear_rsi_required': False, 'sideways_strategy': 'breakout', 'sideways_bb_std_mult': 2.482478275032691, 'sideways_rsi_os': 53, 'sideways_rsi_ob': 62, 'sideways_adx_thresh': 16.065929191221834, 'sideways_atr_min_pct': 0.004160824266660654, 'sideways_atr_max_pct': 0.058347939352822245, 'sideways_tp_mult': 2.178779142093753, 'sideways_tsl_mult': 0.5507630857034722, 'sideways_time_stop': 184, 'sideways_use_sma': True, 'sideways_use_ema': True, 'sideways_use_atr': False, 'sideways_use_adx': False, 'sideways_use_spike': True, 'sideways_rsi_required': False}.
[I 2025-08-31 09:43:42,368] Trial 177 finished with values: [-1000000000.0, 1000000000.0] and parameters: {'p_sma': 52, 'p_std': 22, 'p_atr': 28, 'p_adx': 19, 'rsi_period': 75, 'ema1': 15, 'ema2': 41, 'slip_atr_k': 0.19336443653709606, 'slip_spread_k': 0.3901806290991334, 'spread_hl_frac': 0.007663385669317086, 'bb_std_mult': 2.895539694359682, 'rsi_os': 20, 'rsi_ob': 65, 'vol_spike': 0.2888842711893378, 'adx_thresh': 5.056158625789962, 'atr_min_pct': 0.014818749143798998, 'atr_max_pct': 0.06251051743751826, 'tp_mult': 2.5731806357295124, 'tsl_mult': 0.03884425138931885, 'strategy': 'mean_reversion', 'time_stop': 221, 'use_sma': True, 'use_atr': True, 'use_adx': True, 'use_ema': True, 'use_spike': True, 'rsi_required': True, 'edge_k': 1.6349340193500896, 'edge_cap': 0.7484152082472191, 'bull_strategy': 'breakout', 'bull_bb_std_mult': 3.4463968867398225, 'bull_rsi_os': 29, 'bull_rsi_ob': 77, 'bull_adx_thresh': 14.004634169266133, 'bull_atr_min_pct': 0.018185952185070037, 'bull_atr_max_pct': 0.12058947555344497, 'bull_tp_mult': 2.69967811412297, 'bull_tsl_mult': 0.34771120117687093, 'bull_time_stop': 26, 'bull_use_sma': True, 'bull_use_ema': True, 'bull_use_atr': False, 'bull_use_adx': False, 'bull_use_spike': False, 'bull_rsi_required': True, 'bear_strategy': 'breakout', 'bear_bb_std_mult': 2.733037000315219, 'bear_rsi_os': 18, 'bear_rsi_ob': 58, 'bear_adx_thresh': 19.49276985637803, 'bear_atr_min_pct': 0.02252962914371167, 'bear_atr_max_pct': 0.14589542472421982, 'bear_tp_mult': 1.707922992985833, 'bear_tsl_mult': 0.4228637876005039, 'bear_time_stop': 50, 'bear_use_sma': False, 'bear_use_ema': False, 'bear_use_atr': False, 'bear_use_adx': True, 'bear_use_spike': True, 'bear_rsi_required': False, 'sideways_strategy': 'breakout', 'sideways_bb_std_mult': 2.499225371892585, 'sideways_rsi_os': 53, 'sideways_rsi_ob': 62, 'sideways_adx_thresh': 15.983606625070863, 'sideways_atr_min_pct': 0.004132636554450238, 'sideways_atr_max_pct': 0.02954333777663177, 'sideways_tp_mult': 1.6997109772995427, 'sideways_tsl_mult': 0.5538956177574645, 'sideways_time_stop': 39, 'sideways_use_sma': True, 'sideways_use_ema': True, 'sideways_use_atr': False, 'sideways_use_adx': False, 'sideways_use_spike': True, 'sideways_rsi_required': False}.
[I 2025-08-31 09:43:42,384] Trial 175 finished with values: [-1000000000.0, 1000000000.0] and parameters: {'p_sma': 56, 'p_std': 32, 'p_atr': 28, 'p_adx': 8, 'rsi_period': 75, 'ema1': 15, 'ema2': 43, 'slip_atr_k': 0.108271397345708, 'slip_spread_k': 0.5022771620132372, 'spread_hl_frac': 0.04966823590405522, 'bb_std_mult': 2.8988986146338025, 'rsi_os': 20, 'rsi_ob': 95, 'vol_spike': 0.29061539791332425, 'adx_thresh': 7.126580012284348, 'atr_min_pct': 0.014330596368090427, 'atr_max_pct': 0.06268708343461518, 'tp_mult': 1.645552432691139, 'tsl_mult': 0.6416345272288353, 'strategy': 'breakout', 'time_stop': 146, 'use_sma': True, 'use_atr': True, 'use_adx': False, 'use_ema': True, 'use_spike': True, 'rsi_required': True, 'edge_k': 0.5451274552734777, 'edge_cap': 0.7464548986751414, 'bull_strategy': 'breakout', 'bull_bb_std_mult': 3.5972693495871813, 'bull_rsi_os': 12, 'bull_rsi_ob': 54, 'bull_adx_thresh': 30.66209473711352, 'bull_atr_min_pct': 0.020708172263170066, 'bull_atr_max_pct': 0.11508000053131746, 'bull_tp_mult': 2.709466582710549, 'bull_tsl_mult': 0.5555857535896126, 'bull_time_stop': 238, 'bull_use_sma': True, 'bull_use_ema': False, 'bull_use_atr': True, 'bull_use_adx': False, 'bull_use_spike': False, 'bull_rsi_required': True, 'bear_strategy': 'breakout', 'bear_bb_std_mult': 2.699247031443531, 'bear_rsi_os': 55, 'bear_rsi_ob': 76, 'bear_adx_thresh': 19.432221534683343, 'bear_atr_min_pct': 0.02274333374325479, 'bear_atr_max_pct': 0.01653664819884962, 'bear_tp_mult': 1.7146956439672731, 'bear_tsl_mult': 0.432164421229001, 'bear_time_stop': 51, 'bear_use_sma': False, 'bear_use_ema': False, 'bear_use_atr': False, 'bear_use_adx': True, 'bear_use_spike': True, 'bear_rsi_required': False, 'sideways_strategy': 'breakout', 'sideways_bb_std_mult': 2.340071033289969, 'sideways_rsi_os': 53, 'sideways_rsi_ob': 63, 'sideways_adx_thresh': 6.524276875893733, 'sideways_atr_min_pct': 0.0039551785586650085, 'sideways_atr_max_pct': 0.14641847707421923, 'sideways_tp_mult': 1.7226189315315343, 'sideways_tsl_mult': 0.03727996251464011, 'sideways_time_stop': 288, 'sideways_use_sma': True, 'sideways_use_ema': True, 'sideways_use_atr': False, 'sideways_use_adx': False, 'sideways_use_spike': True, 'sideways_rsi_required': False}.
[I 2025-08-31 09:43:42,575] Trial 174 finished with values: [-1000000000.0, 1000000000.0] and parameters: {'p_sma': 56, 'p_std': 13, 'p_atr': 28, 'p_adx': 8, 'rsi_period': 19, 'ema1': 15, 'ema2': 43, 'slip_atr_k': 0.224385073296076, 'slip_spread_k': 0.37636309415640745, 'spread_hl_frac': 0.04116058706359029, 'bb_std_mult': 2.882478652564518, 'rsi_os': 20, 'rsi_ob': 79, 'vol_spike': 0.1221886235870111, 'adx_thresh': 28.252324844493952, 'atr_min_pct': 0.014977176826393967, 'atr_max_pct': 0.06306292445642543, 'tp_mult': 2.5668251144527217, 'tsl_mult': 0.24887500504707755, 'strategy': 'breakout', 'time_stop': 216, 'use_sma': True, 'use_atr': True, 'use_adx': False, 'use_ema': True, 'use_spike': True, 'rsi_required': True, 'edge_k': 0.5363314933176343, 'edge_cap': 0.7514599543884384, 'bull_strategy': 'breakout', 'bull_bb_std_mult': 1.8459376593911874, 'bull_rsi_os': 23, 'bull_rsi_ob': 78, 'bull_adx_thresh': 30.54842425208702, 'bull_atr_min_pct': 0.019991393714179077, 'bull_atr_max_pct': 0.11656125572050337, 'bull_tp_mult': 1.0112941295673168, 'bull_tsl_mult': 0.557894945383662, 'bull_time_stop': 238, 'bull_use_sma': True, 'bull_use_ema': False, 'bull_use_atr': True, 'bull_use_adx': False, 'bull_use_spike': False, 'bull_rsi_required': True, 'bear_strategy': 'breakout', 'bear_bb_std_mult': 0.5029247680542468, 'bear_rsi_os': 55, 'bear_rsi_ob': 58, 'bear_adx_thresh': 19.501746590880344, 'bear_atr_min_pct': 0.02258656488915664, 'bear_atr_max_pct': 0.14626784710926272, 'bear_tp_mult': 1.9076023473678725, 'bear_tsl_mult': 0.4286520568440276, 'bear_time_stop': 231, 'bear_use_sma': False, 'bear_use_ema': False, 'bear_use_atr': False, 'bear_use_adx': True, 'bear_use_spike': True, 'bear_rsi_required': False, 'sideways_strategy': 'breakout', 'sideways_bb_std_mult': 2.500611693948827, 'sideways_rsi_os': 53, 'sideways_rsi_ob': 76, 'sideways_adx_thresh': 16.071294596505375, 'sideways_atr_min_pct': 0.0039759805764843495, 'sideways_atr_max_pct': 0.0577503278930563, 'sideways_tp_mult': 1.9578476607057937, 'sideways_tsl_mult': 0.5075824830059792, 'sideways_time_stop': 291, 'sideways_use_sma': True, 'sideways_use_ema': True, 'sideways_use_atr': False, 'sideways_use_adx': False, 'sideways_use_spike': True, 'sideways_rsi_required': False}.
[I 2025-08-31 09:44:18,380] Trial 180 finished with values: [-0.03514804621201384, 0.03506788392979112] and parameters: {'p_sma': 49, 'p_std': 13, 'p_atr': 27, 'p_adx': 9, 'rsi_period': 37, 'ema1': 20, 'ema2': 45, 'slip_atr_k': 0.00048057730229940365, 'slip_spread_k': 0.4114696395272413, 'spread_hl_frac': 0.04111705090025062, 'bb_std_mult': 0.9451671032285143, 'rsi_os': 11, 'rsi_ob': 48, 'vol_spike': 0.12571266187714042, 'adx_thresh': 8.453340900109035, 'atr_min_pct': 0.01558697429922744, 'atr_max_pct': 0.06617016689512543, 'tp_mult': 2.868346027358066, 'tsl_mult': 0.3695201695126149, 'strategy': 'breakout', 'time_stop': 108, 'use_sma': False, 'use_atr': False, 'use_adx': False, 'use_ema': False, 'use_spike': False, 'rsi_required': True, 'edge_k': 1.2941694943485185, 'edge_cap': 0.42940280088366173, 'bull_strategy': 'mean_reversion', 'bull_bb_std_mult': 3.482086852367738, 'bull_rsi_os': 32, 'bull_rsi_ob': 85, 'bull_adx_thresh': 31.12716278536471, 'bull_atr_min_pct': 0.02013382635590149, 'bull_atr_max_pct': 0.06363787867646598, 'bull_tp_mult': 2.7763435940126553, 'bull_tsl_mult': 0.5996991041119557, 'bull_time_stop': 249, 'bull_use_sma': True, 'bull_use_ema': False, 'bull_use_atr': False, 'bull_use_adx': False, 'bull_use_spike': False, 'bull_rsi_required': True, 'bear_strategy': 'breakout', 'bear_bb_std_mult': 2.8247035570432195, 'bear_rsi_os': 37, 'bear_rsi_ob': 61, 'bear_adx_thresh': 20.3079802937189, 'bear_atr_min_pct': 0.021096501993543463, 'bear_atr_max_pct': 0.031165437425402502, 'bear_tp_mult': 1.340791390437364, 'bear_tsl_mult': 0.5250936949938313, 'bear_time_stop': 194, 'bear_use_sma': False, 'bear_use_ema': False, 'bear_use_atr': False, 'bear_use_adx': True, 'bear_use_spike': True, 'bear_rsi_required': True, 'sideways_strategy': 'breakout', 'sideways_bb_std_mult': 0.6225270614708545, 'sideways_rsi_os': 41, 'sideways_rsi_ob': 64, 'sideways_adx_thresh': 31.327321639665456, 'sideways_atr_min_pct': 0.0018357563254333435, 'sideways_atr_max_pct': 0.0720969361320812, 'sideways_tp_mult': 1.9763523375767185, 'sideways_tsl_mult': 0.5079447437590674, 'sideways_time_stop': 234, 'sideways_use_sma': True, 'sideways_use_ema': True, 'sideways_use_atr': False, 'sideways_use_adx': False, 'sideways_use_spike': False, 'sideways_rsi_required': False}.
[I 2025-08-31 09:44:18,707] Trial 181 finished with values: [-0.011021643285587746, 0.011268461827918025] and parameters: {'p_sma': 49, 'p_std': 15, 'p_atr': 29, 'p_adx': 9, 'rsi_period': 21, 'ema1': 20, 'ema2': 39, 'slip_atr_k': 0.16084872488467383, 'slip_spread_k': 0.4166970669034519, 'spread_hl_frac': 0.013603770006867466, 'bb_std_mult': 1.0289278917793911, 'rsi_os': 22, 'rsi_ob': 48, 'vol_spike': 0.13410569821132987, 'adx_thresh': 6.307257316463366, 'atr_min_pct': 0.012080466123887055, 'atr_max_pct': 0.1339652235719455, 'tp_mult': 2.8480167437273085, 'tsl_mult': 0.0002784102186551493, 'strategy': 'breakout', 'time_stop': 139, 'use_sma': False, 'use_atr': False, 'use_adx': False, 'use_ema': False, 'use_spike': False, 'rsi_required': True, 'edge_k': 1.8639532408774648, 'edge_cap': 0.11793016200909182, 'bull_strategy': 'mean_reversion', 'bull_bb_std_mult': 1.3095185603281643, 'bull_rsi_os': 32, 'bull_rsi_ob': 66, 'bull_adx_thresh': 31.19948646277763, 'bull_atr_min_pct': 0.019030116984261474, 'bull_atr_max_pct': 0.1185836444074895, 'bull_tp_mult': 1.485358192001668, 'bull_tsl_mult': 0.5972562482388528, 'bull_time_stop': 248, 'bull_use_sma': True, 'bull_use_ema': False, 'bull_use_atr': False, 'bull_use_adx': False, 'bull_use_spike': False, 'bull_rsi_required': True, 'bear_strategy': 'breakout', 'bear_bb_std_mult': 2.804962646626862, 'bear_rsi_os': 54, 'bear_rsi_ob': 79, 'bear_adx_thresh': 20.966490352467748, 'bear_atr_min_pct': 0.021444225139792533, 'bear_atr_max_pct': 0.1430162340511659, 'bear_tp_mult': 2.648101982052121, 'bear_tsl_mult': 0.5171337569720034, 'bear_time_stop': 254, 'bear_use_sma': False, 'bear_use_ema': True, 'bear_use_atr': False, 'bear_use_adx': True, 'bear_use_spike': False, 'bear_rsi_required': True, 'sideways_strategy': 'breakout', 'sideways_bb_std_mult': 1.0748718283352001, 'sideways_rsi_os': 25, 'sideways_rsi_ob': 64, 'sideways_adx_thresh': 33.009971268727924, 'sideways_atr_min_pct': 0.001864992652742794, 'sideways_atr_max_pct': 0.02935416771006239, 'sideways_tp_mult': 1.5293939661203073, 'sideways_tsl_mult': 0.08272845680216984, 'sideways_time_stop': 234, 'sideways_use_sma': True, 'sideways_use_ema': True, 'sideways_use_atr': False, 'sideways_use_adx': False, 'sideways_use_spike': False, 'sideways_rsi_required': False}.
