[I 2025-08-31 09:39:14,099] Trial 145 finished with values: [-1000000000.0, 1000000000.0] and parameters: {'p_sma': 55, 'p_std': 24, 'p_atr': 29, 'p_adx': 7, 'rsi_period': 19, 'ema1': 9, 'ema2': 46, 'slip_atr_k': 0.021181334816456985, 'slip_spread_k': 0.38807253286949206, 'spread_hl_frac': 0.03111430040901085, 'bb_std_mult': 0.5010473289033268, 'rsi_os': 22, 'rsi_ob': 89, 'vol_spike': 0.2997135127715724, 'adx_thresh': 8.026232291849048, 'atr_min_pct': 0.014744759792972918, 'atr_max_pct': 0.07704524098855675, 'tp_mult': 1.2212597286376696, 'tsl_mult': 0.4283002728833605, 'strategy': 'breakout', 'time_stop': 32, 'use_sma': True, 'use_atr': True, 'use_adx': False, 'use_ema': True, 'use_spike': True, 'rsi_required': True, 'edge_k': 1.7012227762177348, 'edge_cap': 0.14235279328144168, 'bull_strategy': 'breakout', 'bull_bb_std_mult': 2.7830588927432798, 'bull_rsi_os': 14, 'bull_rsi_ob': 73, 'bull_adx_thresh': 15.811241618845377, 'bull_atr_min_pct': 0.01820888554410572, 'bull_atr_max_pct': 0.11340662172199291, 'bull_tp_mult': 2.81148593619941, 'bull_tsl_mult': 0.8900062518144427, 'bull_time_stop': 244, 'bull_use_sma': True, 'bull_use_ema': False, 'bull_use_atr': True, 'bull_use_adx': False, 'bull_use_spike': True, 'bull_rsi_required': True, 'bear_strategy': 'breakout', 'bear_bb_std_mult': 2.730247812396636, 'bear_rsi_os': 52, 'bear_rsi_ob': 52, 'bear_adx_thresh': 17.798304740508158, 'bear_atr_min_pct': 0.021703605531248733, 'bear_atr_max_pct': 0.10444098015196271, 'bear_tp_mult': 2.5451556504354187, 'bear_tsl_mult': 0.4552758709695715, 'bear_time_stop': 56, 'bear_use_sma': False, 'bear_use_ema': False, 'bear_use_atr': False, 'bear_use_adx': True, 'bear_use_spike': True, 'bear_rsi_required': True, 'sideways_strategy': 'breakout', 'sideways_bb_std_mult': 0.7767711219602575, 'sideways_rsi_os': 55, 'sideways_rsi_ob': 72, 'sideways_adx_thresh': 14.342463814633993, 'sideways_atr_min_pct': 0.004507570959684399, 'sideways_atr_max_pct': 0.14995306175921103, 'sideways_tp_mult': 1.3497647301436386, 'sideways_tsl_mult': 0.8265275127325309, 'sideways_time_stop': 34, 'sideways_use_sma': True, 'sideways_use_ema': True, 'sideways_use_atr': True, 'sideways_use_adx': False, 'sideways_use_spike': True, 'sideways_rsi_required': False}.
[I 2025-08-31 09:39:14,315] Trial 143 finished with values: [-0.02293878039803421, 0.0229228086312575] and parameters: {'p_sma': 55, 'p_std': 15, 'p_atr': 20, 'p_adx': 7, 'rsi_period': 58, 'ema1': 7, 'ema2': 45, 'slip_atr_k': 0.02031259992764082, 'slip_spread_k': 0.4026154794680238, 'spread_hl_frac': 0.044626766168184104, 'bb_std_mult': 1.388744945362136, 'rsi_os': 7, 'rsi_ob': 89, 'vol_spike': 0.14813968786216475, 'adx_thresh': 8.10090625252575, 'atr_min_pct': 0.026566710405632573, 'atr_max_pct': 0.07138698646419753, 'tp_mult': 1.0496500224930836, 'tsl_mult': 0.6614127335055963, 'strategy': 'breakout', 'time_stop': 207, 'use_sma': True, 'use_atr': True, 'use_adx': False, 'use_ema': True, 'use_spike': True, 'rsi_required': True, 'edge_k': 1.4414997372423732, 'edge_cap': 0.1320801090294029, 'bull_strategy': 'breakout', 'bull_bb_std_mult': 3.4480089340360993, 'bull_rsi_os': 46, 'bull_rsi_ob': 74, 'bull_adx_thresh': 33.44607769357942, 'bull_atr_min_pct': 0.018153340840969687, 'bull_atr_max_pct': 0.11508566979854581, 'bull_tp_mult': 2.7508955520461, 'bull_tsl_mult': 0.09740263041630987, 'bull_time_stop': 125, 'bull_use_sma': True, 'bull_use_ema': False, 'bull_use_atr': True, 'bull_use_adx': False, 'bull_use_spike': True, 'bull_rsi_required': True, 'bear_strategy': 'breakout', 'bear_bb_std_mult': 2.735310434406859, 'bear_rsi_os': 27, 'bear_rsi_ob': 49, 'bear_adx_thresh': 14.000759871497117, 'bear_atr_min_pct': 0.011101160042866407, 'bear_atr_max_pct': 0.09044839380461941, 'bear_tp_mult': 2.4221370385039847, 'bear_tsl_mult': 0.46796360313279295, 'bear_time_stop': 231, 'bear_use_sma': False, 'bear_use_ema': False, 'bear_use_atr': False, 'bear_use_adx': True, 'bear_use_spike': True, 'bear_rsi_required': False, 'sideways_strategy': 'breakout', 'sideways_bb_std_mult': 2.7444985452205746, 'sideways_rsi_os': 39, 'sideways_rsi_ob': 60, 'sideways_adx_thresh': 17.477746638602344, 'sideways_atr_min_pct': 0.0015841354012278467, 'sideways_atr_max_pct': 0.035305724214073984, 'sideways_tp_mult': 1.3673193222835978, 'sideways_tsl_mult': 0.713843951044522, 'sideways_time_stop': 35, 'sideways_use_sma': True, 'sideways_use_ema': True, 'sideways_use_atr': True, 'sideways_use_adx': False, 'sideways_use_spike': True, 'sideways_rsi_required': False}.
[I 2025-08-31 09:39:52,199] Trial 146 finished with values: [-1000000000.0, 1000000000.0] and parameters: {'p_sma': 55, 'p_std': 43, 'p_atr': 29, 'p_adx': 15, 'rsi_period': 22, 'ema1': 21, 'ema2': 45, 'slip_atr_k': 0.0635046943254933, 'slip_spread_k': 0.3794896357741655, 'spread_hl_frac': 0.03301509458515931, 'bb_std_mult': 3.02052026542304, 'rsi_os': 24, 'rsi_ob': 83, 'vol_spike': 0.1455862767494837, 'adx_thresh': 30.764277963593102, 'atr_min_pct': 0.013546124121530315, 'atr_max_pct': 0.03930507545053677, 'tp_mult': 1.2121210363328045, 'tsl_mult': 0.46334819203416966, 'strategy': 'breakout', 'time_stop': 199, 'use_sma': True, 'use_atr': True, 'use_adx': False, 'use_ema': True, 'use_spike': True, 'rsi_required': True, 'edge_k': 1.4456423943096761, 'edge_cap': 0.1292051039729651, 'bull_strategy': 'breakout', 'bull_bb_std_mult': 1.188264308834603, 'bull_rsi_os': 8, 'bull_rsi_ob': 75, 'bull_adx_thresh': 9.618544755643319, 'bull_atr_min_pct': 0.01825816875348252, 'bull_atr_max_pct': 0.1155716496978963, 'bull_tp_mult': 2.802270864165046, 'bull_tsl_mult': 0.8983231140021048, 'bull_time_stop': 129, 'bull_use_sma': True, 'bull_use_ema': False, 'bull_use_atr': True, 'bull_use_adx': False, 'bull_use_spike': False, 'bull_rsi_required': True, 'bear_strategy': 'breakout', 'bear_bb_std_mult': 2.8327411013488164, 'bear_rsi_os': 52, 'bear_rsi_ob': 81, 'bear_adx_thresh': 17.93195322460162, 'bear_atr_min_pct': 0.013612630211548645, 'bear_atr_max_pct': 0.1074548184960172, 'bear_tp_mult': 2.557799057729979, 'bear_tsl_mult': 0.16466110275240303, 'bear_time_stop': 56, 'bear_use_sma': False, 'bear_use_ema': False, 'bear_use_atr': False, 'bear_use_adx': False, 'bear_use_spike': True, 'bear_rsi_required': True, 'sideways_strategy': 'breakout', 'sideways_bb_std_mult': 0.7934838463919076, 'sideways_rsi_os': 39, 'sideways_rsi_ob': 63, 'sideways_adx_thresh': 27.320050038471113, 'sideways_atr_min_pct': 0.008079432436333439, 'sideways_atr_max_pct': 0.09134850340262343, 'sideways_tp_mult': 1.4165609451497272, 'sideways_tsl_mult': 0.7325474801204683, 'sideways_time_stop': 35, 'sideways_use_sma': True, 'sideways_use_ema': True, 'sideways_use_atr': False, 'sideways_use_adx': False, 'sideways_use_spike': True, 'sideways_rsi_required': False}.
[I 2025-08-31 09:39:52,944] Trial 147 finished with values: [-1000000000.0, 1000000000.0] and parameters: {'p_sma': 55, 'p_std': 43, 'p_atr': 16, 'p_adx': 20, 'rsi_period': 22, 'ema1': 21, 'ema2': 42, 'slip_atr_k': 0.184612544926052, 'slip_spread_k': 0.38993082119183814, 'spread_hl_frac': 0.03312624257546845, 'bb_std_mult': 3.1414997472830333, 'rsi_os': 25, 'rsi_ob': 89, 'vol_spike': 0.15046052182209516, 'adx_thresh': 31.122374483567327, 'atr_min_pct': 0.026413549346602394, 'atr_max_pct': 0.13670779441096392, 'tp_mult': 1.2174470683256786, 'tsl_mult': 0.4336739135514871, 'strategy': 'breakout', 'time_stop': 36, 'use_sma': True, 'use_atr': True, 'use_adx': False, 'use_ema': True, 'use_spike': False, 'rsi_required': False, 'edge_k': 0.0877987570561749, 'edge_cap': 0.13125793954746479, 'bull_strategy': 'breakout', 'bull_bb_std_mult': 0.8810411585000686, 'bull_rsi_os': 8, 'bull_rsi_ob': 75, 'bull_adx_thresh': 9.657324546691738, 'bull_atr_min_pct': 0.017995275689725324, 'bull_atr_max_pct': 0.11922157312033266, 'bull_tp_mult': 2.7939780208713234, 'bull_tsl_mult': 0.092839005877483, 'bull_time_stop': 109, 'bull_use_sma': True, 'bull_use_ema': False, 'bull_use_atr': True, 'bull_use_adx': False, 'bull_use_spike': False, 'bull_rsi_required': True, 'bear_strategy': 'breakout', 'bear_bb_std_mult': 2.8510646073105024, 'bear_rsi_os': 28, 'bear_rsi_ob': 79, 'bear_adx_thresh': 13.579059705443363, 'bear_atr_min_pct': 0.01077123292811826, 'bear_atr_max_pct': 0.09038247049288164, 'bear_tp_mult': 2.555066326131987, 'bear_tsl_mult': 0.25621791388532156, 'bear_time_stop': 55, 'bear_use_sma': False, 'bear_use_ema': True, 'bear_use_atr': False, 'bear_use_adx': False, 'bear_use_spike': True, 'bear_rsi_required': True, 'sideways_strategy': 'breakout', 'sideways_bb_std_mult': 2.4665102579913154, 'sideways_rsi_os': 52, 'sideways_rsi_ob': 61, 'sideways_adx_thresh': 27.298921998142035, 'sideways_atr_min_pct': 0.011159245828306678, 'sideways_atr_max_pct': 0.029421440772820162, 'sideways_tp_mult': 1.4160020666553692, 'sideways_tsl_mult': 0.31590988284653737, 'sideways_time_stop': 33, 'sideways_use_sma': True, 'sideways_use_ema': True, 'sideways_use_atr': False, 'sideways_use_adx': True, 'sideways_use_spike': True, 'sideways_rsi_required': False}.
[I 2025-08-31 09:39:52,950] Trial 149 finished with values: [-1000000000.0, 1000000000.0] and parameters: {'p_sma': 56, 'p_std': 22, 'p_atr': 16, 'p_adx': 8, 'rsi_period': 57, 'ema1': 21, 'ema2': 45, 'slip_atr_k': 0.0659112092700675, 'slip_spread_k': 0.45112434915637484, 'spread_hl_frac': 0.03297662815045395, 'bb_std_mult': 1.415693599012462, 'rsi_os': 55, 'rsi_ob': 83, 'vol_spike': 0.1501752200065112, 'adx_thresh': 30.658637465457616, 'atr_min_pct': 0.026339273972462492, 'atr_max_pct': 0.10157168493390752, 'tp_mult': 1.0730417121014721, 'tsl_mult': 0.06982284205726864, 'strategy': 'breakout', 'time_stop': 199, 'use_sma': True, 'use_atr': True, 'use_adx': False, 'use_ema': True, 'use_spike': False, 'rsi_required': False, 'edge_k': 0.054056221352507317, 'edge_cap': 0.16571011470073665, 'bull_strategy': 'breakout', 'bull_bb_std_mult': 3.595612247165081, 'bull_rsi_os': 41, 'bull_rsi_ob': 93, 'bull_adx_thresh': 29.830249196856293, 'bull_atr_min_pct': 0.01759206868322444, 'bull_atr_max_pct': 0.11864785086991865, 'bull_tp_mult': 2.7538067996388484, 'bull_tsl_mult': 0.08355964793646814, 'bull_time_stop': 128, 'bull_use_sma': True, 'bull_use_ema': False, 'bull_use_atr': True, 'bull_use_adx': False, 'bull_use_spike': False, 'bull_rsi_required': True, 'bear_strategy': 'breakout', 'bear_bb_std_mult': 0.6331780589717828, 'bear_rsi_os': 29, 'bear_rsi_ob': 60, 'bear_adx_thresh': 13.948552221875827, 'bear_atr_min_pct': 0.02395951947662054, 'bear_atr_max_pct': 0.021181175108162448, 'bear_tp_mult': 2.4337737399161474, 'bear_tsl_mult': 0.5970174841177001, 'bear_time_stop': 57, 'bear_use_sma': True, 'bear_use_ema': True, 'bear_use_atr': False, 'bear_use_adx': False, 'bear_use_spike': True, 'bear_rsi_required': False, 'sideways_strategy': 'mean_reversion', 'sideways_bb_std_mult': 2.4445075407334182, 'sideways_rsi_os': 52, 'sideways_rsi_ob': 88, 'sideways_adx_thresh': 33.75627978446649, 'sideways_atr_min_pct': 0.02004926954357287, 'sideways_atr_max_pct': 0.09380149578922828, 'sideways_tp_mult': 1.2852345516294634, 'sideways_tsl_mult': 0.1077558766007341, 'sideways_time_stop': 122, 'sideways_use_sma': True, 'sideways_use_ema': True, 'sideways_use_atr': False, 'sideways_use_adx': True, 'sideways_use_spike': True, 'sideways_rsi_required': True}.
[I 2025-08-31 09:39:53,224] Trial 148 finished with values: [-1000000000.0, 1000000000.0] and parameters: {'p_sma': 57, 'p_std': 22, 'p_atr': 27, 'p_adx': 20, 'rsi_period': 63, 'ema1': 26, 'ema2': 45, 'slip_atr_k': 0.003705670586371791, 'slip_spread_k': 0.4477623009865499, 'spread_hl_frac': 0.029743153854489373, 'bb_std_mult': 2.088639017286387, 'rsi_os': 38, 'rsi_ob': 55, 'vol_spike': 0.14893199356083037, 'adx_thresh': 6.692411285254086, 'atr_min_pct': 0.0160339537509625, 'atr_max_pct': 0.027741360113700674, 'tp_mult': 1.0694641008220023, 'tsl_mult': 0.4605553960937145, 'strategy': 'breakout', 'time_stop': 199, 'use_sma': True, 'use_atr': True, 'use_adx': False, 'use_ema': True, 'use_spike': False, 'rsi_required': False, 'edge_k': 1.6540886304347666, 'edge_cap': 0.09499812010299262, 'bull_strategy': 'breakout', 'bull_bb_std_mult': 1.1428041181071213, 'bull_rsi_os': 22, 'bull_rsi_ob': 75, 'bull_adx_thresh': 31.64478020809044, 'bull_atr_min_pct': 0.007787970594576477, 'bull_atr_max_pct': 0.1197187274005647, 'bull_tp_mult': 2.7830376629732854, 'bull_tsl_mult': 0.08297435212973936, 'bull_time_stop': 42, 'bull_use_sma': True, 'bull_use_ema': False, 'bull_use_atr': True, 'bull_use_adx': False, 'bull_use_spike': False, 'bull_rsi_required': True, 'bear_strategy': 'breakout', 'bear_bb_std_mult': 0.6312339872230335, 'bear_rsi_os': 29, 'bear_rsi_ob': 79, 'bear_adx_thresh': 22.088136932533402, 'bear_atr_min_pct': 0.013680204358992842, 'bear_atr_max_pct': 0.14623320870699197, 'bear_tp_mult': 2.4452758286543834, 'bear_tsl_mult': 0.3368473197673115, 'bear_time_stop': 58, 'bear_use_sma': False, 'bear_use_ema': True, 'bear_use_atr': False, 'bear_use_adx': False, 'bear_use_spike': True, 'bear_rsi_required': False, 'sideways_strategy': 'breakout', 'sideways_bb_std_mult': 2.472656927053327, 'sideways_rsi_os': 52, 'sideways_rsi_ob': 67, 'sideways_adx_thresh': 23.623791752394208, 'sideways_atr_min_pct': 0.011198031381996425, 'sideways_atr_max_pct': 0.0912486600392883, 'sideways_tp_mult': 1.4865137524805503, 'sideways_tsl_mult': 0.7179586772183164, 'sideways_time_stop': 10, 'sideways_use_sma': True, 'sideways_use_ema': True, 'sideways_use_atr': False, 'sideways_use_adx': True, 'sideways_use_spike': True, 'sideways_rsi_required': False}.
[I 2025-08-31 09:40:29,244] Trial 151 finished with values: [-1000000000.0, 1000000000.0] and parameters: {'p_sma': 53, 'p_std': 18, 'p_atr': 28, 'p_adx': 9, 'rsi_period': 17, 'ema1': 26, 'ema2': 44, 'slip_atr_k': 0.0002843678692849329, 'slip_spread_k': 0.49022899261984354, 'spread_hl_frac': 0.029708944879161977, 'bb_std_mult': 2.681586726083977, 'rsi_os': 18, 'rsi_ob': 55, 'vol_spike': 0.07684724515532906, 'adx_thresh': 6.686200152880826, 'atr_min_pct': 0.012613834070725524, 'atr_max_pct': 0.034572822507307616, 'tp_mult': 1.053550430456635, 'tsl_mult': 0.6627195370215541, 'strategy': 'breakout', 'time_stop': 8, 'use_sma': True, 'use_atr': True, 'use_adx': True, 'use_ema': True, 'use_spike': True, 'rsi_required': True, 'edge_k': 0.37534083309524435, 'edge_cap': 0.09946501711140894, 'bull_strategy': 'breakout', 'bull_bb_std_mult': 3.46200545502077, 'bull_rsi_os': 47, 'bull_rsi_ob': 48, 'bull_adx_thresh': 11.588000750476628, 'bull_atr_min_pct': 0.020206236583353618, 'bull_atr_max_pct': 0.05466279886331768, 'bull_tp_mult': 1.5424133533996969, 'bull_tsl_mult': 0.7684410204393476, 'bull_time_stop': 45, 'bull_use_sma': False, 'bull_use_ema': False, 'bull_use_atr': False, 'bull_use_adx': True, 'bull_use_spike': True, 'bull_rsi_required': True, 'bear_strategy': 'mean_reversion', 'bear_bb_std_mult': 2.981206380668721, 'bear_rsi_os': 20, 'bear_rsi_ob': 79, 'bear_adx_thresh': 9.677624792765316, 'bear_atr_min_pct': 0.022737240312766506, 'bear_atr_max_pct': 0.09623201972486627, 'bear_tp_mult': 2.622915613622547, 'bear_tsl_mult': 0.34184805570414917, 'bear_time_stop': 66, 'bear_use_sma': False, 'bear_use_ema': False, 'bear_use_atr': False, 'bear_use_adx': True, 'bear_use_spike': False, 'bear_rsi_required': False, 'sideways_strategy': 'breakout', 'sideways_bb_std_mult': 2.208370281125021, 'sideways_rsi_os': 53, 'sideways_rsi_ob': 59, 'sideways_adx_thresh': 17.659156312747854, 'sideways_atr_min_pct': 0.0060350031799959285, 'sideways_atr_max_pct': 0.04161486955579303, 'sideways_tp_mult': 2.3398212517628236, 'sideways_tsl_mult': 0.2626773342261712, 'sideways_time_stop': 99, 'sideways_use_sma': True, 'sideways_use_ema': True, 'sideways_use_atr': True, 'sideways_use_adx': False, 'sideways_use_spike': False, 'sideways_rsi_required': False}.
[I 2025-08-31 09:40:30,778] Trial 152 finished with values: [-1000000000.0, 1000000000.0] and parameters: {'p_sma': 53, 'p_std': 18, 'p_atr': 14, 'p_adx': 9, 'rsi_period': 34, 'ema1': 7, 'ema2': 44, 'slip_atr_k': 0.005889385241578245, 'slip_spread_k': 0.3456544707624121, 'spread_hl_frac': 0.03817034147561086, 'bb_std_mult': 2.9471610628841303, 'rsi_os': 38, 'rsi_ob': 55, 'vol_spike': 0.07718555528887369, 'adx_thresh': 29.66712483190028, 'atr_min_pct': 0.01593709943577891, 'atr_max_pct': 0.09089476965666002, 'tp_mult': 2.0208577656896325, 'tsl_mult': 0.6766705904034487, 'strategy': 'breakout', 'time_stop': 154, 'use_sma': True, 'use_atr': True, 'use_adx': True, 'use_ema': True, 'use_spike': True, 'rsi_required': True, 'edge_k': 0.37081419505267244, 'edge_cap': 0.064311950867649, 'bull_strategy': 'breakout', 'bull_bb_std_mult': 3.4703746471102286, 'bull_rsi_os': 22, 'bull_rsi_ob': 79, 'bull_adx_thresh': 31.767204342245876, 'bull_atr_min_pct': 0.02043576553870232, 'bull_atr_max_pct': 0.05408156686756404, 'bull_tp_mult': 2.7361882350316216, 'bull_tsl_mult': 0.647882477634373, 'bull_time_stop': 43, 'bull_use_sma': False, 'bull_use_ema': False, 'bull_use_atr': False, 'bull_use_adx': True, 'bull_use_spike': True, 'bull_rsi_required': True, 'bear_strategy': 'mean_reversion', 'bear_bb_std_mult': 1.7881070591296264, 'bear_rsi_os': 20, 'bear_rsi_ob': 85, 'bear_adx_thresh': 22.53668461025781, 'bear_atr_min_pct': 0.009918905164001963, 'bear_atr_max_pct': 0.1470332418254883, 'bear_tp_mult': 2.4747117425238927, 'bear_tsl_mult': 0.7277933706757556, 'bear_time_stop': 67, 'bear_use_sma': False, 'bear_use_ema': False, 'bear_use_atr': False, 'bear_use_adx': True, 'bear_use_spike': False, 'bear_rsi_required': False, 'sideways_strategy': 'breakout', 'sideways_bb_std_mult': 2.20649382065613, 'sideways_rsi_os': 53, 'sideways_rsi_ob': 67, 'sideways_adx_thresh': 5.023757908274092, 'sideways_atr_min_pct': 0.021203910612185246, 'sideways_atr_max_pct': 0.010208889365351081, 'sideways_tp_mult': 2.7159458992954537, 'sideways_tsl_mult': 0.8597451188700219, 'sideways_time_stop': 12, 'sideways_use_sma': True, 'sideways_use_ema': True, 'sideways_use_atr': True, 'sideways_use_adx': False, 'sideways_use_spike': False, 'sideways_rsi_required': False}.
[I 2025-08-31 09:40:30,953] Trial 153 finished with values: [-1000000000.0, 1000000000.0] and parameters: {'p_sma': 53, 'p_std': 16, 'p_atr': 14, 'p_adx': 9, 'rsi_period': 17, 'ema1': 7, 'ema2': 39, 'slip_atr_k': 0.016184069528130254, 'slip_spread_k': 0.9993117149021, 'spread_hl_frac': 0.027067615667607403, 'bb_std_mult': 2.70978011582239, 'rsi_os': 18, 'rsi_ob': 81, 'vol_spike': 0.07974112533139699, 'adx_thresh': 6.517471259385938, 'atr_min_pct': 0.012602299703229177, 'atr_max_pct': 0.03274204905974681, 'tp_mult': 1.2724709050437901, 'tsl_mult': 0.8701960649147281, 'strategy': 'breakout', 'time_stop': 207, 'use_sma': True, 'use_atr': False, 'use_adx': True, 'use_ema': False, 'use_spike': True, 'rsi_required': True, 'edge_k': 0.3639096771738811, 'edge_cap': 0.06260580440656432, 'bull_strategy': 'breakout', 'bull_bb_std_mult': 2.4373036463858115, 'bull_rsi_os': 47, 'bull_rsi_ob': 79, 'bull_adx_thresh': 33.3579255568125, 'bull_atr_min_pct': 0.01685727459874994, 'bull_atr_max_pct': 0.12387090590418615, 'bull_tp_mult': 2.5727310851188827, 'bull_tsl_mult': 0.6506173492257878, 'bull_time_stop': 168, 'bull_use_sma': False, 'bull_use_ema': False, 'bull_use_atr': False, 'bull_use_adx': True, 'bull_use_spike': True, 'bull_rsi_required': True, 'bear_strategy': 'mean_reversion', 'bear_bb_std_mult': 1.7522367253030742, 'bear_rsi_os': 54, 'bear_rsi_ob': 85, 'bear_adx_thresh': 30.149926686261775, 'bear_atr_min_pct': 0.02307754383894625, 'bear_atr_max_pct': 0.14299994603113717, 'bear_tp_mult': 2.3470774633420373, 'bear_tsl_mult': 0.4003557515236396, 'bear_time_stop': 67, 'bear_use_sma': True, 'bear_use_ema': False, 'bear_use_atr': False, 'bear_use_adx': True, 'bear_use_spike': False, 'bear_rsi_required': False, 'sideways_strategy': 'mean_reversion', 'sideways_bb_std_mult': 2.2289146287612773, 'sideways_rsi_os': 54, 'sideways_rsi_ob': 65, 'sideways_adx_thresh': 28.420494684946167, 'sideways_atr_min_pct': 0.013972106989744352, 'sideways_atr_max_pct': 0.03889954478950365, 'sideways_tp_mult': 1.8514848817827163, 'sideways_tsl_mult': 0.9120260076789809, 'sideways_time_stop': 23, 'sideways_use_sma': True, 'sideways_use_ema': True, 'sideways_use_atr': True, 'sideways_use_adx': False, 'sideways_use_spike': False, 'sideways_rsi_required': True}.
