[I 2025-08-31 11:11:28,213] Trial 854 finished with values: [-0.030250798575196858, 0.03011598162428444] and parameters: {'p_sma': 10, 'p_std': 20, 'p_atr': 28, 'p_adx': 9, 'rsi_period': 67, 'ema1': 19, 'ema2': 34, 'slip_atr_k': 0.18627467524260524, 'slip_spread_k': 0.09214125725643213, 'spread_hl_frac': 0.005741662913441671, 'bb_std_mult': 1.1168073886431529, 'rsi_os': 47, 'rsi_ob': 80, 'vol_spike': 0.29947120021840257, 'adx_thresh': 25.350260322725852, 'atr_min_pct': 0.006191991518017269, 'atr_max_pct': 0.09531824402195371, 'tp_mult': 2.9023252655915557, 'tsl_mult': 0.02462237137888501, 'strategy': 'breakout', 'time_stop': 158, 'use_sma': False, 'use_atr': False, 'use_adx': False, 'use_ema': False, 'use_spike': False, 'rsi_required': True, 'edge_k': 1.808637569673043, 'edge_cap': 0.1897701485046657, 'bull_strategy': 'mean_reversion', 'bull_bb_std_mult': 1.3141691946141623, 'bull_rsi_os': 28, 'bull_rsi_ob': 76, 'bull_adx_thresh': 7.692711880413857, 'bull_atr_min_pct': 0.02918829138758881, 'bull_atr_max_pct': 0.09541316517025805, 'bull_tp_mult': 2.2427031531064077, 'bull_tsl_mult': 0.466187212243191, 'bull_time_stop': 83, 'bull_use_sma': True, 'bull_use_ema': False, 'bull_use_atr': True, 'bull_use_adx': False, 'bull_use_spike': True, 'bull_rsi_required': True, 'bear_strategy': 'breakout', 'bear_bb_std_mult': 1.0110637986915014, 'bear_rsi_os': 27, 'bear_rsi_ob': 77, 'bear_adx_thresh': 10.331713405949406, 'bear_atr_min_pct': 0.008689806402169242, 'bear_atr_max_pct': 0.10725705392555547, 'bear_tp_mult': 2.0961123590728126, 'bear_tsl_mult': 0.8712233707366794, 'bear_time_stop': 80, 'bear_use_sma': True, 'bear_use_ema': True, 'bear_use_atr': True, 'bear_use_adx': True, 'bear_use_spike': True, 'bear_rsi_required': True, 'sideways_strategy': 'breakout', 'sideways_bb_std_mult': 1.0383466755102173, 'sideways_rsi_os': 45, 'sideways_rsi_ob': 47, 'sideways_adx_thresh': 27.70138269625769, 'sideways_atr_min_pct': 0.0016086010678103791, 'sideways_atr_max_pct': 0.0657536979094725, 'sideways_tp_mult': 2.156932271163117, 'sideways_tsl_mult': 0.09437415306121424, 'sideways_time_stop': 31, 'sideways_use_sma': False, 'sideways_use_ema': True, 'sideways_use_atr': True, 'sideways_use_adx': False, 'sideways_use_spike': True, 'sideways_rsi_required': False}.
[I 2025-08-31 11:12:00,931] Trial 856 finished with values: [-1000000000.0, 1000000000.0] and parameters: {'p_sma': 10, 'p_std': 21, 'p_atr': 29, 'p_adx': 17, 'rsi_period': 27, 'ema1': 23, 'ema2': 55, 'slip_atr_k': 0.2048391364194013, 'slip_spread_k': 0.09102582497654271, 'spread_hl_frac': 0.02909074890579148, 'bb_std_mult': 1.291066150255513, 'rsi_os': 13, 'rsi_ob': 83, 'vol_spike': 0.29997289156114754, 'adx_thresh': 22.569574123086618, 'atr_min_pct': 0.0036299872911048046, 'atr_max_pct': 0.12066100618459019, 'tp_mult': 2.439452911112599, 'tsl_mult': 0.2398323357590385, 'strategy': 'mean_reversion', 'time_stop': 135, 'use_sma': True, 'use_atr': True, 'use_adx': True, 'use_ema': False, 'use_spike': True, 'rsi_required': True, 'edge_k': 1.8931627911649926, 'edge_cap': 0.09412305796857427, 'bull_strategy': 'breakout', 'bull_bb_std_mult': 1.3494705809866607, 'bull_rsi_os': 28, 'bull_rsi_ob': 74, 'bull_adx_thresh': 31.406664527212417, 'bull_atr_min_pct': 0.013516878012639785, 'bull_atr_max_pct': 0.09468924611443706, 'bull_tp_mult': 1.0105708162831983, 'bull_tsl_mult': 0.9613989550187602, 'bull_time_stop': 83, 'bull_use_sma': True, 'bull_use_ema': True, 'bull_use_atr': False, 'bull_use_adx': False, 'bull_use_spike': False, 'bull_rsi_required': True, 'bear_strategy': 'breakout', 'bear_bb_std_mult': 2.8483191455557533, 'bear_rsi_os': 45, 'bear_rsi_ob': 74, 'bear_adx_thresh': 9.836913761041707, 'bear_atr_min_pct': 0.007156770838089183, 'bear_atr_max_pct': 0.10102680468245949, 'bear_tp_mult': 2.0056770121838645, 'bear_tsl_mult': 0.4574082066668786, 'bear_time_stop': 214, 'bear_use_sma': True, 'bear_use_ema': True, 'bear_use_atr': True, 'bear_use_adx': True, 'bear_use_spike': True, 'bear_rsi_required': False, 'sideways_strategy': 'breakout', 'sideways_bb_std_mult': 1.0649130036913377, 'sideways_rsi_os': 46, 'sideways_rsi_ob': 94, 'sideways_adx_thresh': 5.007438939910962, 'sideways_atr_min_pct': 0.027205711542033904, 'sideways_atr_max_pct': 0.13332366090479011, 'sideways_tp_mult': 2.1802736769937363, 'sideways_tsl_mult': 0.8107069367731865, 'sideways_time_stop': 30, 'sideways_use_sma': False, 'sideways_use_ema': False, 'sideways_use_atr': False, 'sideways_use_adx': True, 'sideways_use_spike': False, 'sideways_rsi_required': False}.
[I 2025-08-31 11:12:01,212] Trial 859 finished with values: [-1000000000.0, 1000000000.0] and parameters: {'p_sma': 9, 'p_std': 31, 'p_atr': 30, 'p_adx': 14, 'rsi_period': 23, 'ema1': 18, 'ema2': 37, 'slip_atr_k': 0.0838890608618861, 'slip_spread_k': 0.7803792291654417, 'spread_hl_frac': 0.04484383753488824, 'bb_std_mult': 2.045125911540007, 'rsi_os': 42, 'rsi_ob': 82, 'vol_spike': 0.10133846884263695, 'adx_thresh': 24.327002274024736, 'atr_min_pct': 0.011495800815051872, 'atr_max_pct': 0.12111712173860364, 'tp_mult': 1.2795530367203107, 'tsl_mult': 0.9336235391547886, 'strategy': 'mean_reversion', 'time_stop': 47, 'use_sma': True, 'use_atr': True, 'use_adx': True, 'use_ema': True, 'use_spike': True, 'rsi_required': True, 'edge_k': 1.845680432363647, 'edge_cap': 0.104146129566139, 'bull_strategy': 'breakout', 'bull_bb_std_mult': 3.1916454899712257, 'bull_rsi_os': 25, 'bull_rsi_ob': 45, 'bull_adx_thresh': 23.117864935140354, 'bull_atr_min_pct': 0.024283752715898103, 'bull_atr_max_pct': 0.03270238299199554, 'bull_tp_mult': 2.135892842597635, 'bull_tsl_mult': 0.9999729280449944, 'bull_time_stop': 59, 'bull_use_sma': True, 'bull_use_ema': True, 'bull_use_atr': False, 'bull_use_adx': False, 'bull_use_spike': False, 'bull_rsi_required': True, 'bear_strategy': 'breakout', 'bear_bb_std_mult': 2.10132967711613, 'bear_rsi_os': 37, 'bear_rsi_ob': 49, 'bear_adx_thresh': 23.70115343468366, 'bear_atr_min_pct': 0.00727704725088549, 'bear_atr_max_pct': 0.10167217135348686, 'bear_tp_mult': 2.912752738323234, 'bear_tsl_mult': 0.42241519408583533, 'bear_time_stop': 228, 'bear_use_sma': False, 'bear_use_ema': True, 'bear_use_atr': False, 'bear_use_adx': True, 'bear_use_spike': True, 'bear_rsi_required': False, 'sideways_strategy': 'breakout', 'sideways_bb_std_mult': 1.0491620477538648, 'sideways_rsi_os': 55, 'sideways_rsi_ob': 83, 'sideways_adx_thresh': 18.008453050245578, 'sideways_atr_min_pct': 0.003974369064277707, 'sideways_atr_max_pct': 0.10561477491722512, 'sideways_tp_mult': 2.930249522681439, 'sideways_tsl_mult': 0.7840469251583968, 'sideways_time_stop': 251, 'sideways_use_sma': True, 'sideways_use_ema': False, 'sideways_use_atr': False, 'sideways_use_adx': True, 'sideways_use_spike': False, 'sideways_rsi_required': False}.
[I 2025-08-31 11:12:01,548] Trial 858 finished with values: [-1000000000.0, 1000000000.0] and parameters: {'p_sma': 11, 'p_std': 56, 'p_atr': 30, 'p_adx': 29, 'rsi_period': 24, 'ema1': 18, 'ema2': 41, 'slip_atr_k': 0.18588564268812036, 'slip_spread_k': 0.7684291480823295, 'spread_hl_frac': 0.04504802639029944, 'bb_std_mult': 1.2861221844883386, 'rsi_os': 39, 'rsi_ob': 93, 'vol_spike': 0.09867359139678453, 'adx_thresh': 24.54566513088642, 'atr_min_pct': 0.021792754309204812, 'atr_max_pct': 0.12123897809654036, 'tp_mult': 2.8049217018042993, 'tsl_mult': 0.37133859184417894, 'strategy': 'mean_reversion', 'time_stop': 216, 'use_sma': True, 'use_atr': True, 'use_adx': False, 'use_ema': False, 'use_spike': True, 'rsi_required': True, 'edge_k': 1.867126408025917, 'edge_cap': 0.7219447641446414, 'bull_strategy': 'breakout', 'bull_bb_std_mult': 3.19359151961572, 'bull_rsi_os': 26, 'bull_rsi_ob': 68, 'bull_adx_thresh': 23.12064416797556, 'bull_atr_min_pct': 0.009987136273239366, 'bull_atr_max_pct': 0.09677441327512046, 'bull_tp_mult': 1.8188500319342327, 'bull_tsl_mult': 0.9990254295134083, 'bull_time_stop': 18, 'bull_use_sma': True, 'bull_use_ema': True, 'bull_use_atr': True, 'bull_use_adx': False, 'bull_use_spike': False, 'bull_rsi_required': True, 'bear_strategy': 'breakout', 'bear_bb_std_mult': 2.6612292222319947, 'bear_rsi_os': 7, 'bear_rsi_ob': 77, 'bear_adx_thresh': 9.882530711808446, 'bear_atr_min_pct': 0.004719523934197037, 'bear_atr_max_pct': 0.019010972617604732, 'bear_tp_mult': 2.008247210879666, 'bear_tsl_mult': 0.48197281523370195, 'bear_time_stop': 228, 'bear_use_sma': True, 'bear_use_ema': True, 'bear_use_atr': True, 'bear_use_adx': True, 'bear_use_spike': True, 'bear_rsi_required': False, 'sideways_strategy': 'breakout', 'sideways_bb_std_mult': 2.652212936633385, 'sideways_rsi_os': 22, 'sideways_rsi_ob': 75, 'sideways_adx_thresh': 28.786965694208757, 'sideways_atr_min_pct': 0.002038015975658956, 'sideways_atr_max_pct': 0.10585945465317367, 'sideways_tp_mult': 2.938209244152634, 'sideways_tsl_mult': 0.06206587263851602, 'sideways_time_stop': 74, 'sideways_use_sma': False, 'sideways_use_ema': True, 'sideways_use_atr': False, 'sideways_use_adx': True, 'sideways_use_spike': False, 'sideways_rsi_required': False}.
[I 2025-08-31 11:12:01,680] Trial 857 finished with values: [-1000000000.0, 1000000000.0] and parameters: {'p_sma': 30, 'p_std': 50, 'p_atr': 30, 'p_adx': 24, 'rsi_period': 24, 'ema1': 6, 'ema2': 37, 'slip_atr_k': 0.18870770688026073, 'slip_spread_k': 0.7404135685883215, 'spread_hl_frac': 0.005852132667157624, 'bb_std_mult': 0.816000509078306, 'rsi_os': 16, 'rsi_ob': 70, 'vol_spike': 0.21749889379540477, 'adx_thresh': 22.604763463005433, 'atr_min_pct': 0.021920264699110212, 'atr_max_pct': 0.09619429932799804, 'tp_mult': 1.624242195732579, 'tsl_mult': 0.4292552142204345, 'strategy': 'mean_reversion', 'time_stop': 136, 'use_sma': True, 'use_atr': True, 'use_adx': False, 'use_ema': True, 'use_spike': False, 'rsi_required': True, 'edge_k': 1.1823751050663869, 'edge_cap': 0.6336608572785914, 'bull_strategy': 'breakout', 'bull_bb_std_mult': 2.8432646160139803, 'bull_rsi_os': 21, 'bull_rsi_ob': 68, 'bull_adx_thresh': 32.01434754575473, 'bull_atr_min_pct': 0.014015482506109503, 'bull_atr_max_pct': 0.0958642935940618, 'bull_tp_mult': 2.2443302868749586, 'bull_tsl_mult': 0.4638597748395754, 'bull_time_stop': 81, 'bull_use_sma': True, 'bull_use_ema': False, 'bull_use_atr': True, 'bull_use_adx': False, 'bull_use_spike': True, 'bull_rsi_required': True, 'bear_strategy': 'breakout', 'bear_bb_std_mult': 2.8162450518034707, 'bear_rsi_os': 28, 'bear_rsi_ob': 49, 'bear_adx_thresh': 15.709909087845926, 'bear_atr_min_pct': 0.025939883444312143, 'bear_atr_max_pct': 0.10058046761251153, 'bear_tp_mult': 1.092934241740188, 'bear_tsl_mult': 0.23670155387828473, 'bear_time_stop': 165, 'bear_use_sma': False, 'bear_use_ema': True, 'bear_use_atr': False, 'bear_use_adx': True, 'bear_use_spike': True, 'bear_rsi_required': False, 'sideways_strategy': 'breakout', 'sideways_bb_std_mult': 1.055078189563061, 'sideways_rsi_os': 36, 'sideways_rsi_ob': 49, 'sideways_adx_thresh': 17.91028504251993, 'sideways_atr_min_pct': 0.027489080343554798, 'sideways_atr_max_pct': 0.1030815068139386, 'sideways_tp_mult': 2.1834831160494885, 'sideways_tsl_mult': 0.974628089488043, 'sideways_time_stop': 219, 'sideways_use_sma': True, 'sideways_use_ema': True, 'sideways_use_atr': True, 'sideways_use_adx': False, 'sideways_use_spike': True, 'sideways_rsi_required': False}.
[I 2025-08-31 11:12:02,590] Trial 860 finished with values: [-1000000000.0, 1000000000.0] and parameters: {'p_sma': 59, 'p_std': 49, 'p_atr': 30, 'p_adx': 13, 'rsi_period': 24, 'ema1': 18, 'ema2': 12, 'slip_atr_k': 0.21247064506694427, 'slip_spread_k': 0.7318217585965623, 'spread_hl_frac': 0.018440062214658205, 'bb_std_mult': 2.9652944561686976, 'rsi_os': 54, 'rsi_ob': 85, 'vol_spike': 0.28504865786593586, 'adx_thresh': 24.462457949763586, 'atr_min_pct': 0.02161712253791923, 'atr_max_pct': 0.11839370895643216, 'tp_mult': 2.8311503546499965, 'tsl_mult': 0.4210747938432462, 'strategy': 'mean_reversion', 'time_stop': 132, 'use_sma': True, 'use_atr': True, 'use_adx': False, 'use_ema': True, 'use_spike': False, 'rsi_required': False, 'edge_k': 1.8534548776562065, 'edge_cap': 0.34593950538420526, 'bull_strategy': 'breakout', 'bull_bb_std_mult': 1.2784447252125732, 'bull_rsi_os': 10, 'bull_rsi_ob': 94, 'bull_adx_thresh': 15.804904895567278, 'bull_atr_min_pct': 0.00570824873487891, 'bull_atr_max_pct': 0.10433770080108246, 'bull_tp_mult': 1.816871230132935, 'bull_tsl_mult': 0.6741389815102092, 'bull_time_stop': 61, 'bull_use_sma': True, 'bull_use_ema': False, 'bull_use_atr': False, 'bull_use_adx': True, 'bull_use_spike': False, 'bull_rsi_required': True, 'bear_strategy': 'breakout', 'bear_bb_std_mult': 2.996105277322488, 'bear_rsi_os': 14, 'bear_rsi_ob': 54, 'bear_adx_thresh': 23.059312047443996, 'bear_atr_min_pct': 0.007092457918016955, 'bear_atr_max_pct': 0.10105895610362059, 'bear_tp_mult': 2.1952134317587717, 'bear_tsl_mult': 0.41727734068107275, 'bear_time_stop': 165, 'bear_use_sma': False, 'bear_use_ema': False, 'bear_use_atr': False, 'bear_use_adx': True, 'bear_use_spike': True, 'bear_rsi_required': False, 'sideways_strategy': 'mean_reversion', 'sideways_bb_std_mult': 0.9839483276962014, 'sideways_rsi_os': 55, 'sideways_rsi_ob': 93, 'sideways_adx_thresh': 17.921072865627796, 'sideways_atr_min_pct': 0.020614696163259692, 'sideways_atr_max_pct': 0.14669376870531553, 'sideways_tp_mult': 1.3266848027630398, 'sideways_tsl_mult': 0.8648053944845726, 'sideways_time_stop': 142, 'sideways_use_sma': True, 'sideways_use_ema': True, 'sideways_use_atr': False, 'sideways_use_adx': False, 'sideways_use_spike': True, 'sideways_rsi_required': True}.
[I 2025-08-31 11:12:34,465] Trial 863 finished with values: [-1000000000.0, 1000000000.0] and parameters: {'p_sma': 11, 'p_std': 49, 'p_atr': 25, 'p_adx': 10, 'rsi_period': 20, 'ema1': 18, 'ema2': 39, 'slip_atr_k': 0.19099290324641036, 'slip_spread_k': 0.11643170681227899, 'spread_hl_frac': 0.021531426777023785, 'bb_std_mult': 1.1599060837150765, 'rsi_os': 54, 'rsi_ob': 85, 'vol_spike': 0.04127348210931034, 'adx_thresh': 23.66307380140642, 'atr_min_pct': 0.020406068532644157, 'atr_max_pct': 0.11674710640154035, 'tp_mult': 1.0993463101196341, 'tsl_mult': 0.5856606337309899, 'strategy': 'breakout', 'time_stop': 241, 'use_sma': False, 'use_atr': False, 'use_adx': False, 'use_ema': True, 'use_spike': False, 'rsi_required': False, 'edge_k': 1.0142041942471607, 'edge_cap': 0.1651741460854436, 'bull_strategy': 'mean_reversion', 'bull_bb_std_mult': 1.2813396762978035, 'bull_rsi_os': 10, 'bull_rsi_ob': 94, 'bull_adx_thresh': 12.68970582631557, 'bull_atr_min_pct': 0.006049782443172277, 'bull_atr_max_pct': 0.08009793107380327, 'bull_tp_mult': 1.939092094047276, 'bull_tsl_mult': 0.981906197437762, 'bull_time_stop': 144, 'bull_use_sma': False, 'bull_use_ema': False, 'bull_use_atr': False, 'bull_use_adx': True, 'bull_use_spike': False, 'bull_rsi_required': False, 'bear_strategy': 'mean_reversion', 'bear_bb_std_mult': 2.924031884917962, 'bear_rsi_os': 25, 'bear_rsi_ob': 83, 'bear_adx_thresh': 32.83440293809152, 'bear_atr_min_pct': 0.006733215995741963, 'bear_atr_max_pct': 0.05517238396012908, 'bear_tp_mult': 1.5200309555543459, 'bear_tsl_mult': 0.4163302915019094, 'bear_time_stop': 10, 'bear_use_sma': False, 'bear_use_ema': False, 'bear_use_atr': False, 'bear_use_adx': False, 'bear_use_spike': False, 'bear_rsi_required': True, 'sideways_strategy': 'mean_reversion', 'sideways_bb_std_mult': 0.9737829739770516, 'sideways_rsi_os': 24, 'sideways_rsi_ob': 72, 'sideways_adx_thresh': 30.1451599549982, 'sideways_atr_min_pct': 0.012982562601236057, 'sideways_atr_max_pct': 0.11000572886707868, 'sideways_tp_mult': 2.4754140746539797, 'sideways_tsl_mult': 0.04554788859970661, 'sideways_time_stop': 142, 'sideways_use_sma': True, 'sideways_use_ema': True, 'sideways_use_atr': False, 'sideways_use_adx': False, 'sideways_use_spike': True, 'sideways_rsi_required': True}.
[I 2025-08-31 11:12:34,886] Trial 861 finished with values: [-1000000000.0, 1000000000.0] and parameters: {'p_sma': 11, 'p_std': 50, 'p_atr': 25, 'p_adx': 13, 'rsi_period': 29, 'ema1': 30, 'ema2': 12, 'slip_atr_k': 0.09351999758066282, 'slip_spread_k': 0.11266411043072275, 'spread_hl_frac': 0.010735387416032801, 'bb_std_mult': 2.95884607579352, 'rsi_os': 10, 'rsi_ob': 85, 'vol_spike': 0.2196111097765136, 'adx_thresh': 24.522569656863954, 'atr_min_pct': 0.020589305465228906, 'atr_max_pct': 0.06002202814551453, 'tp_mult': 2.8022318127556423, 'tsl_mult': 0.0423566367603489, 'strategy': 'breakout', 'time_stop': 132, 'use_sma': False, 'use_atr': False, 'use_adx': False, 'use_ema': True, 'use_spike': False, 'rsi_required': False, 'edge_k': 1.184052145338598, 'edge_cap': 0.8690293838465979, 'bull_strategy': 'mean_reversion', 'bull_bb_std_mult': 1.1206127474904914, 'bull_rsi_os': 22, 'bull_rsi_ob': 68, 'bull_adx_thresh': 31.241730672719285, 'bull_atr_min_pct': 0.0059203143701255165, 'bull_atr_max_pct': 0.08729676657019798, 'bull_tp_mult': 1.872953525518431, 'bull_tsl_mult': 0.6745062102684993, 'bull_time_stop': 18, 'bull_use_sma': True, 'bull_use_ema': False, 'bull_use_atr': True, 'bull_use_adx': True, 'bull_use_spike': False, 'bull_rsi_required': True, 'bear_strategy': 'breakout', 'bear_bb_std_mult': 2.932557620299702, 'bear_rsi_os': 15, 'bear_rsi_ob': 59, 'bear_adx_thresh': 23.00891912382412, 'bear_atr_min_pct': 0.025913363399308033, 'bear_atr_max_pct': 0.10582078560629428, 'bear_tp_mult': 2.9961544471025823, 'bear_tsl_mult': 0.22774890913309354, 'bear_time_stop': 300, 'bear_use_sma': False, 'bear_use_ema': False, 'bear_use_atr': False, 'bear_use_adx': True, 'bear_use_spike': True, 'bear_rsi_required': True, 'sideways_strategy': 'mean_reversion', 'sideways_bb_std_mult': 3.0942944507437335, 'sideways_rsi_os': 23, 'sideways_rsi_ob': 82, 'sideways_adx_thresh': 28.946468772673953, 'sideways_atr_min_pct': 0.01308874698032841, 'sideways_atr_max_pct': 0.09968172506299366, 'sideways_tp_mult': 2.8582808802512707, 'sideways_tsl_mult': 0.049420304932108035, 'sideways_time_stop': 233, 'sideways_use_sma': True, 'sideways_use_ema': True, 'sideways_use_atr': False, 'sideways_use_adx': False, 'sideways_use_spike': True, 'sideways_rsi_required': True}.
[I 2025-08-31 11:12:34,971] Trial 862 finished with values: [-1000000000.0, 1000000000.0] and parameters: {'p_sma': 16, 'p_std': 6, 'p_atr': 25, 'p_adx': 13, 'rsi_period': 80, 'ema1': 22, 'ema2': 40, 'slip_atr_k': 0.09349033654468888, 'slip_spread_k': 0.11173970536171182, 'spread_hl_frac': 0.010487894759608244, 'bb_std_mult': 1.1744172205213659, 'rsi_os': 41, 'rsi_ob': 85, 'vol_spike': 0.02375772884813293, 'adx_thresh': 23.03447621976875, 'atr_min_pct': 0.020659650334727296, 'atr_max_pct': 0.11773352575084163, 'tp_mult': 2.846269242772098, 'tsl_mult': 0.0469080736046465, 'strategy': 'breakout', 'time_stop': 251, 'use_sma': False, 'use_atr': False, 'use_adx': False, 'use_ema': True, 'use_spike': False, 'rsi_required': False, 'edge_k': 0.29207598191679995, 'edge_cap': 0.1319410342379101, 'bull_strategy': 'mean_reversion', 'bull_bb_std_mult': 1.14108544009738, 'bull_rsi_os': 27, 'bull_rsi_ob': 65, 'bull_adx_thresh': 17.008895945289932, 'bull_atr_min_pct': 0.006038718355765551, 'bull_atr_max_pct': 0.08037560748671736, 'bull_tp_mult': 2.311559023916761, 'bull_tsl_mult': 0.9764323596092683, 'bull_time_stop': 143, 'bull_use_sma': True, 'bull_use_ema': False, 'bull_use_atr': False, 'bull_use_adx': True, 'bull_use_spike': False, 'bull_rsi_required': True, 'bear_strategy': 'breakout', 'bear_bb_std_mult': 3.002478359009104, 'bear_rsi_os': 28, 'bear_rsi_ob': 79, 'bear_adx_thresh': 22.983875233328302, 'bear_atr_min_pct': 0.0067393650022196955, 'bear_atr_max_pct': 0.10446701417794114, 'bear_tp_mult': 1.9749163349140226, 'bear_tsl_mult': 0.4337309379026164, 'bear_time_stop': 161, 'bear_use_sma': False, 'bear_use_ema': False, 'bear_use_atr': False, 'bear_use_adx': True, 'bear_use_spike': True, 'bear_rsi_required': True, 'sideways_strategy': 'mean_reversion', 'sideways_bb_std_mult': 0.860203858884274, 'sideways_rsi_os': 10, 'sideways_rsi_ob': 95, 'sideways_adx_thresh': 29.709090286903844, 'sideways_atr_min_pct': 0.013384816957307663, 'sideways_atr_max_pct': 0.05685755873854637, 'sideways_tp_mult': 1.298817888159117, 'sideways_tsl_mult': 2.915648671386606e-07, 'sideways_time_stop': 155, 'sideways_use_sma': True, 'sideways_use_ema': True, 'sideways_use_atr': False, 'sideways_use_adx': False, 'sideways_use_spike': True, 'sideways_rsi_required': True}.
