[I 2025-08-31 09:37:52,480] Trial 136 finished with values: [-0.09967934021175007, 0.09954046671651418] and parameters: {'p_sma': 55, 'p_std': 36, 'p_atr': 27, 'p_adx': 16, 'rsi_period': 15, 'ema1': 23, 'ema2': 41, 'slip_atr_k': 0.13011494023420261, 'slip_spread_k': 0.44429003047285787, 'spread_hl_frac': 0.021806778633637718, 'bb_std_mult': 2.7978180778983255, 'rsi_os': 23, 'rsi_ob': 62, 'vol_spike': 0.14901345105928845, 'adx_thresh': 6.063735852784829, 'atr_min_pct': 0.014804587393962967, 'atr_max_pct': 0.0663020552727815, 'tp_mult': 1.1290322181649266, 'tsl_mult': 0.0027425065851653316, 'strategy': 'breakout', 'time_stop': 72, 'use_sma': True, 'use_atr': True, 'use_adx': False, 'use_ema': False, 'use_spike': True, 'rsi_required': True, 'edge_k': 1.5138846884727744, 'edge_cap': 0.1101498833063787, 'bull_strategy': 'breakout', 'bull_bb_std_mult': 1.5967023061503816, 'bull_rsi_os': 53, 'bull_rsi_ob': 76, 'bull_adx_thresh': 30.97248008215914, 'bull_atr_min_pct': 0.017828352816743782, 'bull_atr_max_pct': 0.10958611452423621, 'bull_tp_mult': 2.596385288438021, 'bull_tsl_mult': 0.5200952334689499, 'bull_time_stop': 245, 'bull_use_sma': True, 'bull_use_ema': False, 'bull_use_atr': True, 'bull_use_adx': False, 'bull_use_spike': False, 'bull_rsi_required': True, 'bear_strategy': 'breakout', 'bear_bb_std_mult': 2.651028701577909, 'bear_rsi_os': 55, 'bear_rsi_ob': 77, 'bear_adx_thresh': 13.35724627286989, 'bear_atr_min_pct': 0.020906118600679247, 'bear_atr_max_pct': 0.1442680158694661, 'bear_tp_mult': 2.8609752693748685, 'bear_tsl_mult': 0.41317574020503567, 'bear_time_stop': 95, 'bear_use_sma': False, 'bear_use_ema': False, 'bear_use_atr': False, 'bear_use_adx': True, 'bear_use_spike': True, 'bear_rsi_required': False, 'sideways_strategy': 'breakout', 'sideways_bb_std_mult': 2.713205579981603, 'sideways_rsi_os': 39, 'sideways_rsi_ob': 63, 'sideways_adx_thresh': 14.349476502224896, 'sideways_atr_min_pct': 0.0011554393980347626, 'sideways_atr_max_pct': 0.09169527224707671, 'sideways_tp_mult': 1.966507728371195, 'sideways_tsl_mult': 0.508280567087939, 'sideways_time_stop': 292, 'sideways_use_sma': True, 'sideways_use_ema': True, 'sideways_use_atr': False, 'sideways_use_adx': False, 'sideways_use_spike': True, 'sideways_rsi_required': False}.
[I 2025-08-31 09:37:53,343] Trial 137 finished with values: [-1000000000.0, 1000000000.0] and parameters: {'p_sma': 53, 'p_std': 28, 'p_atr': 27, 'p_adx': 7, 'rsi_period': 67, 'ema1': 28, 'ema2': 41, 'slip_atr_k': 0.21466567663900368, 'slip_spread_k': 0.44614697800302283, 'spread_hl_frac': 0.021969192685544363, 'bb_std_mult': 2.83209635398452, 'rsi_os': 47, 'rsi_ob': 45, 'vol_spike': 0.13795433957893388, 'adx_thresh': 6.015169570991836, 'atr_min_pct': 0.028559591020035774, 'atr_max_pct': 0.06458654795311124, 'tp_mult': 1.0988459026341804, 'tsl_mult': 0.6101267507553263, 'strategy': 'breakout', 'time_stop': 107, 'use_sma': True, 'use_atr': True, 'use_adx': True, 'use_ema': False, 'use_spike': True, 'rsi_required': True, 'edge_k': 1.652853288551586, 'edge_cap': 0.1117665069147391, 'bull_strategy': 'breakout', 'bull_bb_std_mult': 3.543099411879616, 'bull_rsi_os': 28, 'bull_rsi_ob': 77, 'bull_adx_thresh': 31.878961159916475, 'bull_atr_min_pct': 0.01518134361363091, 'bull_atr_max_pct': 0.12493107728434062, 'bull_tp_mult': 2.613534385353004, 'bull_tsl_mult': 0.5615970143803669, 'bull_time_stop': 245, 'bull_use_sma': True, 'bull_use_ema': False, 'bull_use_atr': False, 'bull_use_adx': False, 'bull_use_spike': False, 'bull_rsi_required': True, 'bear_strategy': 'breakout', 'bear_bb_std_mult': 2.9677728205879785, 'bear_rsi_os': 55, 'bear_rsi_ob': 82, 'bear_adx_thresh': 11.448822133319707, 'bear_atr_min_pct': 0.023260845833254287, 'bear_atr_max_pct': 0.06418303783622056, 'bear_tp_mult': 2.79062537898245, 'bear_tsl_mult': 0.059272444200988705, 'bear_time_stop': 94, 'bear_use_sma': False, 'bear_use_ema': False, 'bear_use_atr': False, 'bear_use_adx': True, 'bear_use_spike': True, 'bear_rsi_required': False, 'sideways_strategy': 'breakout', 'sideways_bb_std_mult': 0.9779689854141542, 'sideways_rsi_os': 52, 'sideways_rsi_ob': 69, 'sideways_adx_thresh': 12.976672949686648, 'sideways_atr_min_pct': 0.007366147127328902, 'sideways_atr_max_pct': 0.03487356397190595, 'sideways_tp_mult': 1.9365764864385762, 'sideways_tsl_mult': 0.503955837962114, 'sideways_time_stop': 286, 'sideways_use_sma': True, 'sideways_use_ema': True, 'sideways_use_atr': False, 'sideways_use_adx': False, 'sideways_use_spike': True, 'sideways_rsi_required': False}.
[I 2025-08-31 09:37:53,933] Trial 135 finished with values: [-0.09644726383423508, 0.09637499617345173] and parameters: {'p_sma': 53, 'p_std': 37, 'p_atr': 27, 'p_adx': 16, 'rsi_period': 15, 'ema1': 23, 'ema2': 44, 'slip_atr_k': 0.21092083097083114, 'slip_spread_k': 0.4467746720373948, 'spread_hl_frac': 0.02107541619651458, 'bb_std_mult': 3.158701406062489, 'rsi_os': 23, 'rsi_ob': 71, 'vol_spike': 0.14757813152513183, 'adx_thresh': 6.103512669064822, 'atr_min_pct': 0.014646370372855723, 'atr_max_pct': 0.0661011303035892, 'tp_mult': 1.1274750355805498, 'tsl_mult': 0.9555560198478934, 'strategy': 'breakout', 'time_stop': 236, 'use_sma': True, 'use_atr': True, 'use_adx': False, 'use_ema': True, 'use_spike': True, 'rsi_required': True, 'edge_k': 1.5036490286870217, 'edge_cap': 0.10344855757327331, 'bull_strategy': 'breakout', 'bull_bb_std_mult': 1.5682131318200494, 'bull_rsi_os': 19, 'bull_rsi_ob': 76, 'bull_adx_thresh': 30.9967782065957, 'bull_atr_min_pct': 0.0191393926585, 'bull_atr_max_pct': 0.10761234975159167, 'bull_tp_mult': 2.6149566902565975, 'bull_tsl_mult': 0.5212401454806124, 'bull_time_stop': 15, 'bull_use_sma': True, 'bull_use_ema': False, 'bull_use_atr': True, 'bull_use_adx': False, 'bull_use_spike': False, 'bull_rsi_required': True, 'bear_strategy': 'breakout', 'bear_bb_std_mult': 2.6386195249020576, 'bear_rsi_os': 53, 'bear_rsi_ob': 77, 'bear_adx_thresh': 11.712771773461599, 'bear_atr_min_pct': 0.006587310560210205, 'bear_atr_max_pct': 0.015850655150306425, 'bear_tp_mult': 2.485067160395611, 'bear_tsl_mult': 0.4041786570681038, 'bear_time_stop': 97, 'bear_use_sma': False, 'bear_use_ema': False, 'bear_use_atr': False, 'bear_use_adx': True, 'bear_use_spike': True, 'bear_rsi_required': False, 'sideways_strategy': 'breakout', 'sideways_bb_std_mult': 2.7005225147816114, 'sideways_rsi_os': 50, 'sideways_rsi_ob': 63, 'sideways_adx_thresh': 14.263610023154442, 'sideways_atr_min_pct': 0.001392915339487143, 'sideways_atr_max_pct': 0.118136472781979, 'sideways_tp_mult': 1.4235832730112652, 'sideways_tsl_mult': 0.5108370072602381, 'sideways_time_stop': 287, 'sideways_use_sma': True, 'sideways_use_ema': True, 'sideways_use_atr': False, 'sideways_use_adx': False, 'sideways_use_spike': True, 'sideways_rsi_required': False}.
[I 2025-08-31 09:38:31,783] Trial 141 finished with values: [-1000000000.0, 1000000000.0] and parameters: {'p_sma': 54, 'p_std': 30, 'p_atr': 29, 'p_adx': 18, 'rsi_period': 16, 'ema1': 10, 'ema2': 43, 'slip_atr_k': 0.01209352991516111, 'slip_spread_k': 0.41486188253708745, 'spread_hl_frac': 0.02513882620872063, 'bb_std_mult': 1.5618601737225009, 'rsi_os': 20, 'rsi_ob': 70, 'vol_spike': 0.0661442881644691, 'adx_thresh': 9.033265434580084, 'atr_min_pct': 0.024775753521019, 'atr_max_pct': 0.08033819926967736, 'tp_mult': 1.01861716415377, 'tsl_mult': 0.7747418865860513, 'strategy': 'breakout', 'time_stop': 237, 'use_sma': True, 'use_atr': True, 'use_adx': True, 'use_ema': False, 'use_spike': True, 'rsi_required': True, 'edge_k': 0.1358316658601183, 'edge_cap': 0.05383874512331011, 'bull_strategy': 'breakout', 'bull_bb_std_mult': 3.2278270102843067, 'bull_rsi_os': 53, 'bull_rsi_ob': 76, 'bull_adx_thresh': 28.785772247899676, 'bull_atr_min_pct': 0.01913326230388535, 'bull_atr_max_pct': 0.10988500228826499, 'bull_tp_mult': 2.6673366546807187, 'bull_tsl_mult': 0.17403756772338674, 'bull_time_stop': 7, 'bull_use_sma': True, 'bull_use_ema': False, 'bull_use_atr': False, 'bull_use_adx': False, 'bull_use_spike': False, 'bull_rsi_required': True, 'bear_strategy': 'breakout', 'bear_bb_std_mult': 2.6372301058073186, 'bear_rsi_os': 49, 'bear_rsi_ob': 77, 'bear_adx_thresh': 18.373522816001817, 'bear_atr_min_pct': 0.006284128544903579, 'bear_atr_max_pct': 0.01358915234723762, 'bear_tp_mult': 2.4794362810164263, 'bear_tsl_mult': 0.7741229272339315, 'bear_time_stop': 41, 'bear_use_sma': True, 'bear_use_ema': False, 'bear_use_atr': False, 'bear_use_adx': True, 'bear_use_spike': True, 'bear_rsi_required': False, 'sideways_strategy': 'mean_reversion', 'sideways_bb_std_mult': 3.0770138532679048, 'sideways_rsi_os': 28, 'sideways_rsi_ob': 64, 'sideways_adx_thresh': 15.280015981814707, 'sideways_atr_min_pct': 0.005302051350610147, 'sideways_atr_max_pct': 0.11754080684930555, 'sideways_tp_mult': 2.136918020161816, 'sideways_tsl_mult': 0.5729003997462562, 'sideways_time_stop': 69, 'sideways_use_sma': True, 'sideways_use_ema': True, 'sideways_use_atr': False, 'sideways_use_adx': False, 'sideways_use_spike': True, 'sideways_rsi_required': True}.
[I 2025-08-31 09:38:32,607] Trial 138 finished with values: [-1000000000.0, 1000000000.0] and parameters: {'p_sma': 53, 'p_std': 27, 'p_atr': 27, 'p_adx': 16, 'rsi_period': 15, 'ema1': 30, 'ema2': 44, 'slip_atr_k': 0.2129564782436036, 'slip_spread_k': 0.4307279365739902, 'spread_hl_frac': 0.043571644139665626, 'bb_std_mult': 2.8245226334600986, 'rsi_os': 24, 'rsi_ob': 45, 'vol_spike': 0.06907401994951695, 'adx_thresh': 5.956378820373982, 'atr_min_pct': 0.028260240203139657, 'atr_max_pct': 0.06489988407903802, 'tp_mult': 1.010288892201888, 'tsl_mult': 0.07772353319901015, 'strategy': 'breakout', 'time_stop': 238, 'use_sma': True, 'use_atr': True, 'use_adx': True, 'use_ema': False, 'use_spike': True, 'rsi_required': True, 'edge_k': 1.5016727095356122, 'edge_cap': 0.10618706095163094, 'bull_strategy': 'breakout', 'bull_bb_std_mult': 1.5980628640792993, 'bull_rsi_os': 18, 'bull_rsi_ob': 77, 'bull_adx_thresh': 13.568541850696027, 'bull_atr_min_pct': 0.01866309207889529, 'bull_atr_max_pct': 0.12632736081143503, 'bull_tp_mult': 2.6222295343443736, 'bull_tsl_mult': 0.5467844280373588, 'bull_time_stop': 226, 'bull_use_sma': True, 'bull_use_ema': False, 'bull_use_atr': False, 'bull_use_adx': False, 'bull_use_spike': False, 'bull_rsi_required': True, 'bear_strategy': 'breakout', 'bear_bb_std_mult': 2.6544187835212765, 'bear_rsi_os': 42, 'bear_rsi_ob': 75, 'bear_adx_thresh': 18.51531321410755, 'bear_atr_min_pct': 0.019349586253057147, 'bear_atr_max_pct': 0.029681999899576636, 'bear_tp_mult': 2.086613888561443, 'bear_tsl_mult': 0.24205264025344564, 'bear_time_stop': 263, 'bear_use_sma': False, 'bear_use_ema': False, 'bear_use_atr': False, 'bear_use_adx': True, 'bear_use_spike': True, 'bear_rsi_required': False, 'sideways_strategy': 'breakout', 'sideways_bb_std_mult': 0.9217484603058008, 'sideways_rsi_os': 50, 'sideways_rsi_ob': 69, 'sideways_adx_thresh': 26.43480261196044, 'sideways_atr_min_pct': 0.02897472716657945, 'sideways_atr_max_pct': 0.1332167019499283, 'sideways_tp_mult': 2.0729122543854466, 'sideways_tsl_mult': 0.5158017670424984, 'sideways_time_stop': 47, 'sideways_use_sma': True, 'sideways_use_ema': True, 'sideways_use_atr': False, 'sideways_use_adx': False, 'sideways_use_spike': True, 'sideways_rsi_required': False}.
[I 2025-08-31 09:38:32,905] Trial 140 finished with values: [-1000000000.0, 1000000000.0] and parameters: {'p_sma': 55, 'p_std': 37, 'p_atr': 20, 'p_adx': 18, 'rsi_period': 15, 'ema1': 10, 'ema2': 43, 'slip_atr_k': 0.12984429280507945, 'slip_spread_k': 0.40951185645643595, 'spread_hl_frac': 0.044447225753756786, 'bb_std_mult': 2.9675917947154553, 'rsi_os': 29, 'rsi_ob': 53, 'vol_spike': 0.0661544757613212, 'adx_thresh': 8.89008306242955, 'atr_min_pct': 0.00035004535644367167, 'atr_max_pct': 0.07151110530810721, 'tp_mult': 1.01594781430251, 'tsl_mult': 0.9316292310516924, 'strategy': 'breakout', 'time_stop': 95, 'use_sma': True, 'use_atr': True, 'use_adx': False, 'use_ema': False, 'use_spike': True, 'rsi_required': True, 'edge_k': 1.4953479253908886, 'edge_cap': 0.1001169344508259, 'bull_strategy': 'breakout', 'bull_bb_std_mult': 3.547966194597845, 'bull_rsi_os': 19, 'bull_rsi_ob': 76, 'bull_adx_thresh': 28.885852563018403, 'bull_atr_min_pct': 0.018937933186342012, 'bull_atr_max_pct': 0.10907106134398646, 'bull_tp_mult': 2.665271024409578, 'bull_tsl_mult': 0.3709271368229324, 'bull_time_stop': 239, 'bull_use_sma': True, 'bull_use_ema': False, 'bull_use_atr': True, 'bull_use_adx': False, 'bull_use_spike': False, 'bull_rsi_required': True, 'bear_strategy': 'breakout', 'bear_bb_std_mult': 2.6810037898400174, 'bear_rsi_os': 35, 'bear_rsi_ob': 49, 'bear_adx_thresh': 7.868448217966982, 'bear_atr_min_pct': 0.01924912520015334, 'bear_atr_max_pct': 0.14429115138444104, 'bear_tp_mult': 1.069699149551738, 'bear_tsl_mult': 0.48501613266520877, 'bear_time_stop': 272, 'bear_use_sma': True, 'bear_use_ema': False, 'bear_use_atr': False, 'bear_use_adx': True, 'bear_use_spike': True, 'bear_rsi_required': False, 'sideways_strategy': 'mean_reversion', 'sideways_bb_std_mult': 2.7165047733475323, 'sideways_rsi_os': 50, 'sideways_rsi_ob': 65, 'sideways_adx_thresh': 15.2776646588703, 'sideways_atr_min_pct': 0.0016139714100268335, 'sideways_atr_max_pct': 0.08258201480126909, 'sideways_tp_mult': 2.107398788024645, 'sideways_tsl_mult': 0.061484659475894654, 'sideways_time_stop': 68, 'sideways_use_sma': True, 'sideways_use_ema': True, 'sideways_use_atr': False, 'sideways_use_adx': False, 'sideways_use_spike': True, 'sideways_rsi_required': True}.
[I 2025-08-31 09:38:33,164] Trial 139 finished with values: [-0.10336702628594407, 0.10330319734384788] and parameters: {'p_sma': 55, 'p_std': 27, 'p_atr': 27, 'p_adx': 16, 'rsi_period': 15, 'ema1': 26, 'ema2': 44, 'slip_atr_k': 0.12863938239462203, 'slip_spread_k': 0.44428064908707304, 'spread_hl_frac': 0.038618521562786945, 'bb_std_mult': 2.957742075844041, 'rsi_os': 24, 'rsi_ob': 71, 'vol_spike': 0.14897141261052463, 'adx_thresh': 5.975783891046623, 'atr_min_pct': 0.02504538215000137, 'atr_max_pct': 0.06466595247429156, 'tp_mult': 1.021906990426677, 'tsl_mult': 0.4352382827854807, 'strategy': 'breakout', 'time_stop': 238, 'use_sma': True, 'use_atr': True, 'use_adx': True, 'use_ema': False, 'use_spike': True, 'rsi_required': True, 'edge_k': 1.710771790844011, 'edge_cap': 0.10343462169955664, 'bull_strategy': 'breakout', 'bull_bb_std_mult': 1.5801595578839, 'bull_rsi_os': 19, 'bull_rsi_ob': 76, 'bull_adx_thresh': 16.132819163113545, 'bull_atr_min_pct': 0.018880952725467536, 'bull_atr_max_pct': 0.12654606747886188, 'bull_tp_mult': 2.6186043155262477, 'bull_tsl_mult': 0.13833621994808587, 'bull_time_stop': 217, 'bull_use_sma': True, 'bull_use_ema': False, 'bull_use_atr': False, 'bull_use_adx': False, 'bull_use_spike': False, 'bull_rsi_required': True, 'bear_strategy': 'breakout', 'bear_bb_std_mult': 2.6257083243265087, 'bear_rsi_os': 28, 'bear_rsi_ob': 82, 'bear_adx_thresh': 8.589449631207463, 'bear_atr_min_pct': 0.006116094374767445, 'bear_atr_max_pct': 0.10688051125599551, 'bear_tp_mult': 2.0768706200507303, 'bear_tsl_mult': 0.26234401020176823, 'bear_time_stop': 40, 'bear_use_sma': False, 'bear_use_ema': False, 'bear_use_atr': False, 'bear_use_adx': True, 'bear_use_spike': True, 'bear_rsi_required': False, 'sideways_strategy': 'breakout', 'sideways_bb_std_mult': 2.7355557006196873, 'sideways_rsi_os': 50, 'sideways_rsi_ob': 69, 'sideways_adx_thresh': 26.356931834950284, 'sideways_atr_min_pct': 0.0011730759351246856, 'sideways_atr_max_pct': 0.03634623145801427, 'sideways_tp_mult': 2.1199074828559983, 'sideways_tsl_mult': 0.330772100239181, 'sideways_time_stop': 45, 'sideways_use_sma': True, 'sideways_use_ema': True, 'sideways_use_atr': False, 'sideways_use_adx': False, 'sideways_use_spike': True, 'sideways_rsi_required': False}.
[I 2025-08-31 09:39:12,993] Trial 144 finished with values: [-1000000000.0, 1000000000.0] and parameters: {'p_sma': 55, 'p_std': 24, 'p_atr': 13, 'p_adx': 7, 'rsi_period': 19, 'ema1': 9, 'ema2': 46, 'slip_atr_k': 0.24949953576682354, 'slip_spread_k': 0.4027370694329865, 'spread_hl_frac': 0.03955147471783117, 'bb_std_mult': 3.576389599797925, 'rsi_os': 22, 'rsi_ob': 50, 'vol_spike': 0.010759472910360196, 'adx_thresh': 8.076857224476374, 'atr_min_pct': 0.011594283063284666, 'atr_max_pct': 0.058729616872677706, 'tp_mult': 1.0782547705332939, 'tsl_mult': 0.9596507372185208, 'strategy': 'breakout', 'time_stop': 227, 'use_sma': True, 'use_atr': True, 'use_adx': False, 'use_ema': True, 'use_spike': True, 'rsi_required': True, 'edge_k': 1.712035798586098, 'edge_cap': 0.12590759721333225, 'bull_strategy': 'breakout', 'bull_bb_std_mult': 3.438073443877125, 'bull_rsi_os': 15, 'bull_rsi_ob': 73, 'bull_adx_thresh': 30.859435131845878, 'bull_atr_min_pct': 0.003361512703139287, 'bull_atr_max_pct': 0.11384285893458242, 'bull_tp_mult': 2.728436975836793, 'bull_tsl_mult': 0.5129109148826781, 'bull_time_stop': 244, 'bull_use_sma': True, 'bull_use_ema': False, 'bull_use_atr': True, 'bull_use_adx': False, 'bull_use_spike': True, 'bull_rsi_required': True, 'bear_strategy': 'breakout', 'bear_bb_std_mult': 2.735924577056792, 'bear_rsi_os': 51, 'bear_rsi_ob': 45, 'bear_adx_thresh': 9.035770621071048, 'bear_atr_min_pct': 0.021754242064513707, 'bear_atr_max_pct': 0.14021527091876945, 'bear_tp_mult': 2.4033058114012107, 'bear_tsl_mult': 0.4563668363589237, 'bear_time_stop': 250, 'bear_use_sma': False, 'bear_use_ema': False, 'bear_use_atr': False, 'bear_use_adx': True, 'bear_use_spike': True, 'bear_rsi_required': False, 'sideways_strategy': 'breakout', 'sideways_bb_std_mult': 0.6961285956661787, 'sideways_rsi_os': 55, 'sideways_rsi_ob': 72, 'sideways_adx_thresh': 14.132123177509934, 'sideways_atr_min_pct': 0.004440327649013513, 'sideways_atr_max_pct': 0.10763292998651805, 'sideways_tp_mult': 1.359930969994374, 'sideways_tsl_mult': 0.5224083598304328, 'sideways_time_stop': 40, 'sideways_use_sma': True, 'sideways_use_ema': True, 'sideways_use_atr': True, 'sideways_use_adx': False, 'sideways_use_spike': True, 'sideways_rsi_required': False}.
[I 2025-08-31 09:39:13,663] Trial 142 finished with values: [-0.07828486593715012, 0.07819527460584696] and parameters: {'p_sma': 55, 'p_std': 24, 'p_atr': 20, 'p_adx': 9, 'rsi_period': 33, 'ema1': 26, 'ema2': 44, 'slip_atr_k': 0.24828734071536773, 'slip_spread_k': 0.39130171890618076, 'spread_hl_frac': 0.04432696577442615, 'bb_std_mult': 3.1491526051071124, 'rsi_os': 24, 'rsi_ob': 72, 'vol_spike': 0.15056912612120954, 'adx_thresh': 8.033487689470416, 'atr_min_pct': 0.014844234182945204, 'atr_max_pct': 0.07727310805796242, 'tp_mult': 1.2327112494861534, 'tsl_mult': 0.07278241699675797, 'strategy': 'breakout', 'time_stop': 125, 'use_sma': True, 'use_atr': True, 'use_adx': False, 'use_ema': True, 'use_spike': True, 'rsi_required': True, 'edge_k': 1.5029997422915709, 'edge_cap': 0.1303040040888197, 'bull_strategy': 'breakout', 'bull_bb_std_mult': 2.802496340520115, 'bull_rsi_os': 18, 'bull_rsi_ob': 73, 'bull_adx_thresh': 13.789090932018677, 'bull_atr_min_pct': 0.018776219287490098, 'bull_atr_max_pct': 0.11481148554087699, 'bull_tp_mult': 2.802735098096253, 'bull_tsl_mult': 0.04620975004512434, 'bull_time_stop': 239, 'bull_use_sma': True, 'bull_use_ema': False, 'bull_use_atr': True, 'bull_use_adx': False, 'bull_use_spike': False, 'bull_rsi_required': True, 'bear_strategy': 'breakout', 'bear_bb_std_mult': 2.741227897457392, 'bear_rsi_os': 29, 'bear_rsi_ob': 75, 'bear_adx_thresh': 9.448441960441519, 'bear_atr_min_pct': 0.01900115061795449, 'bear_atr_max_pct': 0.14389175249396793, 'bear_tp_mult': 2.4150713348243076, 'bear_tsl_mult': 0.24955382221051836, 'bear_time_stop': 266, 'bear_use_sma': False, 'bear_use_ema': False, 'bear_use_atr': False, 'bear_use_adx': True, 'bear_use_spike': True, 'bear_rsi_required': False, 'sideways_strategy': 'breakout', 'sideways_bb_std_mult': 2.208045551507555, 'sideways_rsi_os': 50, 'sideways_rsi_ob': 63, 'sideways_adx_thresh': 26.63790998574711, 'sideways_atr_min_pct': 0.001678825777197428, 'sideways_atr_max_pct': 0.057877772806400635, 'sideways_tp_mult': 1.3653962608880643, 'sideways_tsl_mult': 0.06555451872876011, 'sideways_time_stop': 36, 'sideways_use_sma': True, 'sideways_use_ema': True, 'sideways_use_atr': False, 'sideways_use_adx': False, 'sideways_use_spike': True, 'sideways_rsi_required': False}.
