[I 2025-08-31 10:39:34,951] Trial 621 finished with values: [-1000000000.0, 1000000000.0] and parameters: {'p_sma': 10, 'p_std': 48, 'p_atr': 30, 'p_adx': 13, 'rsi_period': 21, 'ema1': 17, 'ema2': 35, 'slip_atr_k': 0.08431535441982874, 'slip_spread_k': 0.8650034452157499, 'spread_hl_frac': 0.03206004526261349, 'bb_std_mult': 2.761849852833138, 'rsi_os': 39, 'rsi_ob': 60, 'vol_spike': 0.1009985140681384, 'adx_thresh': 13.698213806033873, 'atr_min_pct': 0.01792108245434289, 'atr_max_pct': 0.11766227205127507, 'tp_mult': 2.9263907161333798, 'tsl_mult': 0.10502460724126594, 'strategy': 'breakout', 'time_stop': 126, 'use_sma': False, 'use_atr': True, 'use_adx': False, 'use_ema': True, 'use_spike': False, 'rsi_required': True, 'edge_k': 1.8921958137745063, 'edge_cap': 0.12934154925089997, 'bull_strategy': 'mean_reversion', 'bull_bb_std_mult': 1.121849795797628, 'bull_rsi_os': 25, 'bull_rsi_ob': 88, 'bull_adx_thresh': 31.512948807154032, 'bull_atr_min_pct': 0.006460406497907318, 'bull_atr_max_pct': 0.08540889447918504, 'bull_tp_mult': 2.3566378088498188, 'bull_tsl_mult': 0.9790742857074578, 'bull_time_stop': 62, 'bull_use_sma': True, 'bull_use_ema': False, 'bull_use_atr': False, 'bull_use_adx': False, 'bull_use_spike': False, 'bull_rsi_required': False, 'bear_strategy': 'breakout', 'bear_bb_std_mult': 2.8853316104837816, 'bear_rsi_os': 32, 'bear_rsi_ob': 71, 'bear_adx_thresh': 21.220932643043188, 'bear_atr_min_pct': 0.016074947826448294, 'bear_atr_max_pct': 0.10927831415878095, 'bear_tp_mult': 2.0151846205839403, 'bear_tsl_mult': 0.46880907505388836, 'bear_time_stop': 257, 'bear_use_sma': False, 'bear_use_ema': True, 'bear_use_atr': True, 'bear_use_adx': True, 'bear_use_spike': True, 'bear_rsi_required': False, 'sideways_strategy': 'mean_reversion', 'sideways_bb_std_mult': 1.684178064822197, 'sideways_rsi_os': 22, 'sideways_rsi_ob': 94, 'sideways_adx_thresh': 30.319264168082842, 'sideways_atr_min_pct': 0.001172169613457484, 'sideways_atr_max_pct': 0.10867672193950054, 'sideways_tp_mult': 1.932799122216706, 'sideways_tsl_mult': 0.5207780398813082, 'sideways_time_stop': 222, 'sideways_use_sma': False, 'sideways_use_ema': False, 'sideways_use_atr': False, 'sideways_use_adx': False, 'sideways_use_spike': True, 'sideways_rsi_required': True}.
[I 2025-08-31 10:39:35,021] Trial 619 finished with values: [-1000000000.0, 1000000000.0] and parameters: {'p_sma': 31, 'p_std': 22, 'p_atr': 23, 'p_adx': 9, 'rsi_period': 23, 'ema1': 13, 'ema2': 27, 'slip_atr_k': 0.1883515277485575, 'slip_spread_k': 0.10574792200346712, 'spread_hl_frac': 0.010678891334585303, 'bb_std_mult': 1.1667269919293968, 'rsi_os': 41, 'rsi_ob': 95, 'vol_spike': 0.07968929419965788, 'adx_thresh': 13.61956451434419, 'atr_min_pct': 0.022064621642001993, 'atr_max_pct': 0.12451716995163371, 'tp_mult': 1.8561741652281818, 'tsl_mult': 0.04087611389050465, 'strategy': 'breakout', 'time_stop': 134, 'use_sma': False, 'use_atr': True, 'use_adx': True, 'use_ema': True, 'use_spike': True, 'rsi_required': False, 'edge_k': 1.8666098433560798, 'edge_cap': 0.12240396299200224, 'bull_strategy': 'mean_reversion', 'bull_bb_std_mult': 1.2741512520580853, 'bull_rsi_os': 25, 'bull_rsi_ob': 66, 'bull_adx_thresh': 31.486696672569465, 'bull_atr_min_pct': 0.006506365785260804, 'bull_atr_max_pct': 0.14390519550501973, 'bull_tp_mult': 2.317428507200065, 'bull_tsl_mult': 0.9460030171676663, 'bull_time_stop': 121, 'bull_use_sma': True, 'bull_use_ema': True, 'bull_use_atr': False, 'bull_use_adx': True, 'bull_use_spike': False, 'bull_rsi_required': False, 'bear_strategy': 'breakout', 'bear_bb_std_mult': 2.8868010854027046, 'bear_rsi_os': 30, 'bear_rsi_ob': 82, 'bear_adx_thresh': 14.822550451078175, 'bear_atr_min_pct': 0.016019969557182684, 'bear_atr_max_pct': 0.11353414687899469, 'bear_tp_mult': 1.7716933951473284, 'bear_tsl_mult': 0.47285170564891726, 'bear_time_stop': 269, 'bear_use_sma': True, 'bear_use_ema': True, 'bear_use_atr': False, 'bear_use_adx': False, 'bear_use_spike': True, 'bear_rsi_required': False, 'sideways_strategy': 'mean_reversion', 'sideways_bb_std_mult': 2.154542925350943, 'sideways_rsi_os': 25, 'sideways_rsi_ob': 94, 'sideways_adx_thresh': 30.272202176348305, 'sideways_atr_min_pct': 0.0011606696211156008, 'sideways_atr_max_pct': 0.10712858939101799, 'sideways_tp_mult': 2.9300405226727557, 'sideways_tsl_mult': 0.5170882544186384, 'sideways_time_stop': 232, 'sideways_use_sma': True, 'sideways_use_ema': False, 'sideways_use_atr': False, 'sideways_use_adx': False, 'sideways_use_spike': True, 'sideways_rsi_required': True}.
[I 2025-08-31 10:40:06,693] Trial 623 finished with values: [-1000000000.0, 1000000000.0] and parameters: {'p_sma': 31, 'p_std': 48, 'p_atr': 30, 'p_adx': 9, 'rsi_period': 79, 'ema1': 27, 'ema2': 35, 'slip_atr_k': 0.19779998766673582, 'slip_spread_k': 0.5933706808125957, 'spread_hl_frac': 0.011838634947585146, 'bb_std_mult': 2.7532255213579244, 'rsi_os': 12, 'rsi_ob': 82, 'vol_spike': 0.28645487569518513, 'adx_thresh': 23.380471930092483, 'atr_min_pct': 0.011681088995725218, 'atr_max_pct': 0.12289877123242834, 'tp_mult': 2.92813819180965, 'tsl_mult': 0.10791305933013999, 'strategy': 'breakout', 'time_stop': 125, 'use_sma': False, 'use_atr': True, 'use_adx': False, 'use_ema': True, 'use_spike': False, 'rsi_required': True, 'edge_k': 1.060156429630248, 'edge_cap': 0.19364084637026635, 'bull_strategy': 'mean_reversion', 'bull_bb_std_mult': 2.0747753685697807, 'bull_rsi_os': 25, 'bull_rsi_ob': 68, 'bull_adx_thresh': 28.501570089493697, 'bull_atr_min_pct': 0.006502389988942694, 'bull_atr_max_pct': 0.08500764575294228, 'bull_tp_mult': 2.0933130072183914, 'bull_tsl_mult': 0.7797596010719888, 'bull_time_stop': 63, 'bull_use_sma': True, 'bull_use_ema': False, 'bull_use_atr': True, 'bull_use_adx': False, 'bull_use_spike': False, 'bull_rsi_required': False, 'bear_strategy': 'breakout', 'bear_bb_std_mult': 0.7692147800801232, 'bear_rsi_os': 32, 'bear_rsi_ob': 61, 'bear_adx_thresh': 21.204688013638982, 'bear_atr_min_pct': 0.008718108394747657, 'bear_atr_max_pct': 0.1229557568295151, 'bear_tp_mult': 2.1149158584410976, 'bear_tsl_mult': 0.4669955487739405, 'bear_time_stop': 293, 'bear_use_sma': False, 'bear_use_ema': True, 'bear_use_atr': False, 'bear_use_adx': True, 'bear_use_spike': True, 'bear_rsi_required': False, 'sideways_strategy': 'mean_reversion', 'sideways_bb_std_mult': 0.8973170760576772, 'sideways_rsi_os': 22, 'sideways_rsi_ob': 80, 'sideways_adx_thresh': 12.180168403423888, 'sideways_atr_min_pct': 0.0225374088436325, 'sideways_atr_max_pct': 0.10409307202210476, 'sideways_tp_mult': 2.9473452069674755, 'sideways_tsl_mult': 0.03968414551947448, 'sideways_time_stop': 234, 'sideways_use_sma': True, 'sideways_use_ema': False, 'sideways_use_atr': False, 'sideways_use_adx': False, 'sideways_use_spike': True, 'sideways_rsi_required': True}.
[I 2025-08-31 10:40:07,440] Trial 625 finished with values: [-1000000000.0, 1000000000.0] and parameters: {'p_sma': 11, 'p_std': 47, 'p_atr': 29, 'p_adx': 25, 'rsi_period': 79, 'ema1': 16, 'ema2': 30, 'slip_atr_k': 0.00026469416833771464, 'slip_spread_k': 0.0721968243423923, 'spread_hl_frac': 0.011969002552681463, 'bb_std_mult': 1.2400867452444562, 'rsi_os': 42, 'rsi_ob': 82, 'vol_spike': 0.288518292685334, 'adx_thresh': 34.92894063758048, 'atr_min_pct': 0.011758984632918402, 'atr_max_pct': 0.12055828203974073, 'tp_mult': 1.4165200710608865, 'tsl_mult': 0.07234116731468207, 'strategy': 'mean_reversion', 'time_stop': 141, 'use_sma': True, 'use_atr': False, 'use_adx': False, 'use_ema': True, 'use_spike': False, 'rsi_required': True, 'edge_k': 1.7929025520853645, 'edge_cap': 0.6555278619860774, 'bull_strategy': 'breakout', 'bull_bb_std_mult': 2.2510595002679614, 'bull_rsi_os': 27, 'bull_rsi_ob': 68, 'bull_adx_thresh': 17.506374004124186, 'bull_atr_min_pct': 0.008009239917204465, 'bull_atr_max_pct': 0.0838801458715738, 'bull_tp_mult': 2.0862144533410087, 'bull_tsl_mult': 0.9606023633065833, 'bull_time_stop': 75, 'bull_use_sma': False, 'bull_use_ema': False, 'bull_use_atr': True, 'bull_use_adx': False, 'bull_use_spike': False, 'bull_rsi_required': True, 'bear_strategy': 'mean_reversion', 'bear_bb_std_mult': 2.8257703163681227, 'bear_rsi_os': 38, 'bear_rsi_ob': 65, 'bear_adx_thresh': 26.238811785464836, 'bear_atr_min_pct': 0.005987891303003088, 'bear_atr_max_pct': 0.03426326190745008, 'bear_tp_mult': 2.1387771445398336, 'bear_tsl_mult': 0.1515345320720819, 'bear_time_stop': 122, 'bear_use_sma': False, 'bear_use_ema': True, 'bear_use_atr': False, 'bear_use_adx': True, 'bear_use_spike': True, 'bear_rsi_required': True, 'sideways_strategy': 'breakout', 'sideways_bb_std_mult': 1.0284496429830392, 'sideways_rsi_os': 37, 'sideways_rsi_ob': 93, 'sideways_adx_thresh': 29.565176385148668, 'sideways_atr_min_pct': 0.0017925975425268075, 'sideways_atr_max_pct': 0.10357239940665221, 'sideways_tp_mult': 2.856436823631288, 'sideways_tsl_mult': 0.05480959117386826, 'sideways_time_stop': 12, 'sideways_use_sma': True, 'sideways_use_ema': True, 'sideways_use_atr': False, 'sideways_use_adx': False, 'sideways_use_spike': True, 'sideways_rsi_required': False}.
[I 2025-08-31 10:40:07,806] Trial 626 finished with values: [-1000000000.0, 1000000000.0] and parameters: {'p_sma': 11, 'p_std': 53, 'p_atr': 10, 'p_adx': 10, 'rsi_period': 26, 'ema1': 16, 'ema2': 29, 'slip_atr_k': 0.19533862125406906, 'slip_spread_k': 0.5917793378254413, 'spread_hl_frac': 0.024205244387515784, 'bb_std_mult': 2.508602255529163, 'rsi_os': 42, 'rsi_ob': 87, 'vol_spike': 0.2887375209242189, 'adx_thresh': 34.44499183896404, 'atr_min_pct': 0.011552273847997696, 'atr_max_pct': 0.12034136543720093, 'tp_mult': 1.2616199304254272, 'tsl_mult': 0.5249513114615671, 'strategy': 'mean_reversion', 'time_stop': 277, 'use_sma': True, 'use_atr': False, 'use_adx': False, 'use_ema': True, 'use_spike': False, 'rsi_required': True, 'edge_k': 1.9376811079204668, 'edge_cap': 0.33906159586881623, 'bull_strategy': 'breakout', 'bull_bb_std_mult': 2.244774651034172, 'bull_rsi_os': 27, 'bull_rsi_ob': 68, 'bull_adx_thresh': 17.41756547206475, 'bull_atr_min_pct': 0.0070429049080167816, 'bull_atr_max_pct': 0.07950086383078901, 'bull_tp_mult': 2.236940809632388, 'bull_tsl_mult': 0.30896262746025627, 'bull_time_stop': 76, 'bull_use_sma': False, 'bull_use_ema': False, 'bull_use_atr': True, 'bull_use_adx': False, 'bull_use_spike': False, 'bull_rsi_required': True, 'bear_strategy': 'mean_reversion', 'bear_bb_std_mult': 1.4972438297283892, 'bear_rsi_os': 38, 'bear_rsi_ob': 86, 'bear_adx_thresh': 20.136018172541263, 'bear_atr_min_pct': 0.008720790181536363, 'bear_atr_max_pct': 0.12325442794704695, 'bear_tp_mult': 1.609282817572041, 'bear_tsl_mult': 0.42661808724561445, 'bear_time_stop': 263, 'bear_use_sma': False, 'bear_use_ema': True, 'bear_use_atr': False, 'bear_use_adx': True, 'bear_use_spike': True, 'bear_rsi_required': True, 'sideways_strategy': 'breakout', 'sideways_bb_std_mult': 1.0365828448112262, 'sideways_rsi_os': 50, 'sideways_rsi_ob': 93, 'sideways_adx_thresh': 12.150691564084497, 'sideways_atr_min_pct': 0.014429631968039423, 'sideways_atr_max_pct': 0.10282700104603064, 'sideways_tp_mult': 2.7587776508482458, 'sideways_tsl_mult': 0.9765153289017525, 'sideways_time_stop': 48, 'sideways_use_sma': True, 'sideways_use_ema': True, 'sideways_use_atr': False, 'sideways_use_adx': False, 'sideways_use_spike': True, 'sideways_rsi_required': False}.
[I 2025-08-31 10:40:07,922] Trial 624 finished with values: [-1000000000.0, 1000000000.0] and parameters: {'p_sma': 20, 'p_std': 44, 'p_atr': 10, 'p_adx': 24, 'rsi_period': 43, 'ema1': 19, 'ema2': 29, 'slip_atr_k': 0.18228324906987622, 'slip_spread_k': 0.0784344509515705, 'spread_hl_frac': 0.03696633814406339, 'bb_std_mult': 3.221803291362151, 'rsi_os': 42, 'rsi_ob': 82, 'vol_spike': 0.07888382642941308, 'adx_thresh': 24.125798179478448, 'atr_min_pct': 3.1541142674271216e-06, 'atr_max_pct': 0.05961569920373878, 'tp_mult': 2.8688322048372803, 'tsl_mult': 0.11034533587600212, 'strategy': 'mean_reversion', 'time_stop': 140, 'use_sma': True, 'use_atr': False, 'use_adx': False, 'use_ema': True, 'use_spike': False, 'rsi_required': False, 'edge_k': 1.9509024446580987, 'edge_cap': 0.5382533394225654, 'bull_strategy': 'breakout', 'bull_bb_std_mult': 1.166666194988329, 'bull_rsi_os': 25, 'bull_rsi_ob': 68, 'bull_adx_thresh': 17.564549125817393, 'bull_atr_min_pct': 0.006880027409804619, 'bull_atr_max_pct': 0.027245443240385685, 'bull_tp_mult': 1.2365717401423666, 'bull_tsl_mult': 0.7598674703847288, 'bull_time_stop': 74, 'bull_use_sma': False, 'bull_use_ema': False, 'bull_use_atr': True, 'bull_use_adx': False, 'bull_use_spike': False, 'bull_rsi_required': True, 'bear_strategy': 'mean_reversion', 'bear_bb_std_mult': 0.5032071413716666, 'bear_rsi_os': 29, 'bear_rsi_ob': 87, 'bear_adx_thresh': 20.070662725030257, 'bear_atr_min_pct': 0.0013542380954084839, 'bear_atr_max_pct': 0.03390333323931254, 'bear_tp_mult': 2.168025839082092, 'bear_tsl_mult': 0.4344924747678073, 'bear_time_stop': 28, 'bear_use_sma': False, 'bear_use_ema': True, 'bear_use_atr': False, 'bear_use_adx': True, 'bear_use_spike': True, 'bear_rsi_required': True, 'sideways_strategy': 'breakout', 'sideways_bb_std_mult': 3.0858622590593923, 'sideways_rsi_os': 24, 'sideways_rsi_ob': 91, 'sideways_adx_thresh': 12.851722252599878, 'sideways_atr_min_pct': 0.0014239903239544717, 'sideways_atr_max_pct': 0.10365232249005815, 'sideways_tp_mult': 2.8443326947798466, 'sideways_tsl_mult': 0.4424218189606944, 'sideways_time_stop': 247, 'sideways_use_sma': True, 'sideways_use_ema': True, 'sideways_use_atr': False, 'sideways_use_adx': False, 'sideways_use_spike': True, 'sideways_rsi_required': False}.
[I 2025-08-31 10:40:38,938] Trial 627 finished with values: [-1000000000.0, 1000000000.0] and parameters: {'p_sma': 11, 'p_std': 47, 'p_atr': 10, 'p_adx': 10, 'rsi_period': 26, 'ema1': 19, 'ema2': 40, 'slip_atr_k': 0.18163514681479412, 'slip_spread_k': 0.07378425007587922, 'spread_hl_frac': 0.02441681182797629, 'bb_std_mult': 0.7271390673858116, 'rsi_os': 42, 'rsi_ob': 85, 'vol_spike': 0.294461588889053, 'adx_thresh': 28.3325273753918, 'atr_min_pct': 0.011719596239991213, 'atr_max_pct': 0.12056180323499396, 'tp_mult': 2.8683022406180423, 'tsl_mult': 0.9231630461801309, 'strategy': 'mean_reversion', 'time_stop': 43, 'use_sma': True, 'use_atr': False, 'use_adx': False, 'use_ema': True, 'use_spike': False, 'rsi_required': True, 'edge_k': 1.7841084289926017, 'edge_cap': 0.4555379641152514, 'bull_strategy': 'breakout', 'bull_bb_std_mult': 2.603478200442144, 'bull_rsi_os': 22, 'bull_rsi_ob': 67, 'bull_adx_thresh': 28.989285572842302, 'bull_atr_min_pct': 0.00798830860236963, 'bull_atr_max_pct': 0.07856644244749157, 'bull_tp_mult': 2.2538450448519494, 'bull_tsl_mult': 0.9579547234884451, 'bull_time_stop': 76, 'bull_use_sma': False, 'bull_use_ema': False, 'bull_use_atr': True, 'bull_use_adx': False, 'bull_use_spike': True, 'bull_rsi_required': True, 'bear_strategy': 'mean_reversion', 'bear_bb_std_mult': 2.807512065043821, 'bear_rsi_os': 10, 'bear_rsi_ob': 74, 'bear_adx_thresh': 26.29410637723909, 'bear_atr_min_pct': 0.00598613192288938, 'bear_atr_max_pct': 0.10547810795147954, 'bear_tp_mult': 2.172457236455308, 'bear_tsl_mult': 0.43165695473791, 'bear_time_stop': 126, 'bear_use_sma': False, 'bear_use_ema': False, 'bear_use_atr': False, 'bear_use_adx': True, 'bear_use_spike': True, 'bear_rsi_required': True, 'sideways_strategy': 'breakout', 'sideways_bb_std_mult': 3.065625521375925, 'sideways_rsi_os': 21, 'sideways_rsi_ob': 91, 'sideways_adx_thresh': 29.500860570897412, 'sideways_atr_min_pct': 0.001873035715196277, 'sideways_atr_max_pct': 0.08470133551253424, 'sideways_tp_mult': 2.7537924904162976, 'sideways_tsl_mult': 0.1972716823692417, 'sideways_time_stop': 246, 'sideways_use_sma': True, 'sideways_use_ema': True, 'sideways_use_atr': True, 'sideways_use_adx': True, 'sideways_use_spike': True, 'sideways_rsi_required': False}.
[I 2025-08-31 10:40:39,922] Trial 628 finished with values: [-0.09501115994410725, 0.0948590019831388] and parameters: {'p_sma': 12, 'p_std': 44, 'p_atr': 18, 'p_adx': 10, 'rsi_period': 26, 'ema1': 19, 'ema2': 53, 'slip_atr_k': 0.1831303911938736, 'slip_spread_k': 0.15512766260695063, 'spread_hl_frac': 0.009829113921361767, 'bb_std_mult': 3.2618841045643077, 'rsi_os': 41, 'rsi_ob': 85, 'vol_spike': 0.29713900472086274, 'adx_thresh': 27.869673554035327, 'atr_min_pct': 0.0124845357297487, 'atr_max_pct': 0.058075936705811876, 'tp_mult': 1.081729820130615, 'tsl_mult': 0.9257350804940309, 'strategy': 'breakout', 'time_stop': 230, 'use_sma': False, 'use_atr': False, 'use_adx': False, 'use_ema': True, 'use_spike': False, 'rsi_required': True, 'edge_k': 1.9241524839673676, 'edge_cap': 0.16599953515061508, 'bull_strategy': 'mean_reversion', 'bull_bb_std_mult': 2.860500084551739, 'bull_rsi_os': 23, 'bull_rsi_ob': 51, 'bull_adx_thresh': 29.09780189206099, 'bull_atr_min_pct': 0.007054120502350543, 'bull_atr_max_pct': 0.07940883047961841, 'bull_tp_mult': 1.0208526037742476, 'bull_tsl_mult': 0.4672475337035934, 'bull_time_stop': 18, 'bull_use_sma': False, 'bull_use_ema': False, 'bull_use_atr': False, 'bull_use_adx': False, 'bull_use_spike': True, 'bull_rsi_required': True, 'bear_strategy': 'mean_reversion', 'bear_bb_std_mult': 2.9641579456589002, 'bear_rsi_os': 42, 'bear_rsi_ob': 78, 'bear_adx_thresh': 28.819638690783584, 'bear_atr_min_pct': 0.004684006063454765, 'bear_atr_max_pct': 0.104654621478276, 'bear_tp_mult': 1.96440022275481, 'bear_tsl_mult': 0.34434943411605606, 'bear_time_stop': 99, 'bear_use_sma': False, 'bear_use_ema': False, 'bear_use_atr': False, 'bear_use_adx': True, 'bear_use_spike': True, 'bear_rsi_required': True, 'sideways_strategy': 'breakout', 'sideways_bb_std_mult': 3.0763131381040902, 'sideways_rsi_os': 45, 'sideways_rsi_ob': 91, 'sideways_adx_thresh': 29.12124688437334, 'sideways_atr_min_pct': 0.0007568159489685194, 'sideways_atr_max_pct': 0.09117957432259116, 'sideways_tp_mult': 1.289753711638565, 'sideways_tsl_mult': 0.19384608079811783, 'sideways_time_stop': 49, 'sideways_use_sma': True, 'sideways_use_ema': True, 'sideways_use_atr': True, 'sideways_use_adx': True, 'sideways_use_spike': True, 'sideways_rsi_required': False}.
[I 2025-08-31 10:40:39,994] Trial 630 finished with values: [-0.13215109510041456, 0.13205385115633797] and parameters: {'p_sma': 27, 'p_std': 49, 'p_atr': 25, 'p_adx': 9, 'rsi_period': 72, 'ema1': 10, 'ema2': 38, 'slip_atr_k': 0.1732176989295302, 'slip_spread_k': 0.16612288339609368, 'spread_hl_frac': 0.00821646724561062, 'bb_std_mult': 2.091840911468256, 'rsi_os': 40, 'rsi_ob': 69, 'vol_spike': 0.2957756698426208, 'adx_thresh': 27.61306685069126, 'atr_min_pct': 0.012691288523427487, 'atr_max_pct': 0.04268662976844484, 'tp_mult': 2.8847855303380845, 'tsl_mult': 0.13504530154594202, 'strategy': 'breakout', 'time_stop': 153, 'use_sma': False, 'use_atr': False, 'use_adx': False, 'use_ema': True, 'use_spike': False, 'rsi_required': True, 'edge_k': 1.9117611558440044, 'edge_cap': 0.16283254058758717, 'bull_strategy': 'mean_reversion', 'bull_bb_std_mult': 1.9681070380394978, 'bull_rsi_os': 20, 'bull_rsi_ob': 70, 'bull_adx_thresh': 30.627857658950134, 'bull_atr_min_pct': 0.008017871173365654, 'bull_atr_max_pct': 0.09206520884124393, 'bull_tp_mult': 2.1967081433339115, 'bull_tsl_mult': 0.20709620117475064, 'bull_time_stop': 70, 'bull_use_sma': True, 'bull_use_ema': False, 'bull_use_atr': False, 'bull_use_adx': False, 'bull_use_spike': True, 'bull_rsi_required': True, 'bear_strategy': 'breakout', 'bear_bb_std_mult': 2.986601303500068, 'bear_rsi_os': 43, 'bear_rsi_ob': 78, 'bear_adx_thresh': 22.216363443768987, 'bear_atr_min_pct': 0.01539067016329268, 'bear_atr_max_pct': 0.10095305852784947, 'bear_tp_mult': 1.9603115626945782, 'bear_tsl_mult': 0.3350944819213213, 'bear_time_stop': 254, 'bear_use_sma': False, 'bear_use_ema': False, 'bear_use_atr': False, 'bear_use_adx': True, 'bear_use_spike': True, 'bear_rsi_required': True, 'sideways_strategy': 'breakout', 'sideways_bb_std_mult': 0.8592011431969893, 'sideways_rsi_os': 54, 'sideways_rsi_ob': 46, 'sideways_adx_thresh': 18.596562769322045, 'sideways_atr_min_pct': 0.0009199025565308564, 'sideways_atr_max_pct': 0.0902407696503533, 'sideways_tp_mult': 2.3330568841473434, 'sideways_tsl_mult': 0.1697654411242257, 'sideways_time_stop': 130, 'sideways_use_sma': True, 'sideways_use_ema': True, 'sideways_use_atr': True, 'sideways_use_adx': True, 'sideways_use_spike': True, 'sideways_rsi_required': False}.
