[I 2025-08-31 09:52:20,585] Trial 242 finished with values: [-1000000000.0, 1000000000.0] and parameters: {'p_sma': 46, 'p_std': 59, 'p_atr': 13, 'p_adx': 10, 'rsi_period': 58, 'ema1': 18, 'ema2': 51, 'slip_atr_k': 0.24429016015370814, 'slip_spread_k': 0.22537799641466605, 'spread_hl_frac': 0.014654151461269478, 'bb_std_mult': 1.0100250811453166, 'rsi_os': 20, 'rsi_ob': 63, 'vol_spike': 0.019604604320169167, 'adx_thresh': 6.9848556532730655, 'atr_min_pct': 0.013242041560732519, 'atr_max_pct': 0.1387517384819088, 'tp_mult': 2.369271070502003, 'tsl_mult': 0.03347474529148962, 'strategy': 'breakout', 'time_stop': 258, 'use_sma': False, 'use_atr': False, 'use_adx': False, 'use_ema': False, 'use_spike': False, 'rsi_required': True, 'edge_k': 0.17355699383803647, 'edge_cap': 0.5878527137976504, 'bull_strategy': 'mean_reversion', 'bull_bb_std_mult': 1.244928605148862, 'bull_rsi_os': 34, 'bull_rsi_ob': 64, 'bull_adx_thresh': 31.673551541350584, 'bull_atr_min_pct': 0.018506565916189443, 'bull_atr_max_pct': 0.12396946780541875, 'bull_tp_mult': 1.9845144303448201, 'bull_tsl_mult': 0.6204859778298671, 'bull_time_stop': 245, 'bull_use_sma': True, 'bull_use_ema': False, 'bull_use_atr': False, 'bull_use_adx': False, 'bull_use_spike': False, 'bull_rsi_required': False, 'bear_strategy': 'breakout', 'bear_bb_std_mult': 0.9373517221972605, 'bear_rsi_os': 47, 'bear_rsi_ob': 77, 'bear_adx_thresh': 21.17062695753542, 'bear_atr_min_pct': 0.01523308673396615, 'bear_atr_max_pct': 0.08109374492869892, 'bear_tp_mult': 2.5585384183891584, 'bear_tsl_mult': 0.5091228769245542, 'bear_time_stop': 196, 'bear_use_sma': False, 'bear_use_ema': True, 'bear_use_atr': False, 'bear_use_adx': True, 'bear_use_spike': False, 'bear_rsi_required': True, 'sideways_strategy': 'breakout', 'sideways_bb_std_mult': 0.9730205278494938, 'sideways_rsi_os': 25, 'sideways_rsi_ob': 64, 'sideways_adx_thresh': 32.672213646834194, 'sideways_atr_min_pct': 0.0012994313310332776, 'sideways_atr_max_pct': 0.13548517351932882, 'sideways_tp_mult': 2.882381038609191, 'sideways_tsl_mult': 0.07730505378870438, 'sideways_time_stop': 274, 'sideways_use_sma': True, 'sideways_use_ema': True, 'sideways_use_atr': False, 'sideways_use_adx': False, 'sideways_use_spike': False, 'sideways_rsi_required': False}.
[I 2025-08-31 09:52:25,189] Trial 244 finished with values: [-0.04286916809776009, 0.042816421279803736] and parameters: {'p_sma': 49, 'p_std': 15, 'p_atr': 23, 'p_adx': 9, 'rsi_period': 18, 'ema1': 25, 'ema2': 41, 'slip_atr_k': 0.24338774796584695, 'slip_spread_k': 0.22747179853717284, 'spread_hl_frac': 0.01489790775034984, 'bb_std_mult': 0.8223630974478169, 'rsi_os': 20, 'rsi_ob': 48, 'vol_spike': 0.05025824063633301, 'adx_thresh': 16.718967017419452, 'atr_min_pct': 0.011323837930275157, 'atr_max_pct': 0.1396224955966583, 'tp_mult': 1.5913951562114659, 'tsl_mult': 0.0008425422396965934, 'strategy': 'breakout', 'time_stop': 259, 'use_sma': False, 'use_atr': False, 'use_adx': False, 'use_ema': False, 'use_spike': False, 'rsi_required': True, 'edge_k': 1.838746405236067, 'edge_cap': 0.10049892826150403, 'bull_strategy': 'mean_reversion', 'bull_bb_std_mult': 1.2549402460451566, 'bull_rsi_os': 52, 'bull_rsi_ob': 65, 'bull_adx_thresh': 31.748163216077952, 'bull_atr_min_pct': 0.019025911260845286, 'bull_atr_max_pct': 0.12350041304860394, 'bull_tp_mult': 1.4635037938706, 'bull_tsl_mult': 0.6145120691734646, 'bull_time_stop': 14, 'bull_use_sma': True, 'bull_use_ema': False, 'bull_use_atr': False, 'bull_use_adx': False, 'bull_use_spike': False, 'bull_rsi_required': True, 'bear_strategy': 'breakout', 'bear_bb_std_mult': 0.9478380837050475, 'bear_rsi_os': 46, 'bear_rsi_ob': 80, 'bear_adx_thresh': 30.299347450453297, 'bear_atr_min_pct': 0.027480323958003573, 'bear_atr_max_pct': 0.08027408885704945, 'bear_tp_mult': 1.0110938481722869, 'bear_tsl_mult': 0.5106842082541543, 'bear_time_stop': 250, 'bear_use_sma': False, 'bear_use_ema': True, 'bear_use_atr': False, 'bear_use_adx': True, 'bear_use_spike': False, 'bear_rsi_required': True, 'sideways_strategy': 'breakout', 'sideways_bb_std_mult': 0.9672231194879555, 'sideways_rsi_os': 25, 'sideways_rsi_ob': 64, 'sideways_adx_thresh': 23.355637281099288, 'sideways_atr_min_pct': 0.001115859629162099, 'sideways_atr_max_pct': 0.02718524454474769, 'sideways_tp_mult': 1.9910737722644647, 'sideways_tsl_mult': 0.2104141157699403, 'sideways_time_stop': 258, 'sideways_use_sma': True, 'sideways_use_ema': True, 'sideways_use_atr': False, 'sideways_use_adx': False, 'sideways_use_spike': False, 'sideways_rsi_required': False}.
[I 2025-08-31 09:52:25,265] Trial 245 finished with values: [-0.03386746071257474, 0.033901622526677465] and parameters: {'p_sma': 34, 'p_std': 16, 'p_atr': 23, 'p_adx': 9, 'rsi_period': 18, 'ema1': 21, 'ema2': 41, 'slip_atr_k': 0.16294660998619154, 'slip_spread_k': 0.4024057217564339, 'spread_hl_frac': 0.04552544118695116, 'bb_std_mult': 0.5596792136433208, 'rsi_os': 37, 'rsi_ob': 48, 'vol_spike': 0.1505053795629266, 'adx_thresh': 6.380050494638228, 'atr_min_pct': 0.011032493424372392, 'atr_max_pct': 0.14013291531374938, 'tp_mult': 2.7278943940781644, 'tsl_mult': 0.2241139681045775, 'strategy': 'breakout', 'time_stop': 31, 'use_sma': False, 'use_atr': False, 'use_adx': False, 'use_ema': False, 'use_spike': False, 'rsi_required': True, 'edge_k': 0.18450706201795308, 'edge_cap': 0.13794800667927584, 'bull_strategy': 'mean_reversion', 'bull_bb_std_mult': 1.2299539069722858, 'bull_rsi_os': 32, 'bull_rsi_ob': 64, 'bull_adx_thresh': 31.63224258801056, 'bull_atr_min_pct': 0.01907616317358022, 'bull_atr_max_pct': 0.07706705550797859, 'bull_tp_mult': 1.465647126125543, 'bull_tsl_mult': 0.5830957392744677, 'bull_time_stop': 245, 'bull_use_sma': True, 'bull_use_ema': False, 'bull_use_atr': False, 'bull_use_adx': False, 'bull_use_spike': False, 'bull_rsi_required': True, 'bear_strategy': 'breakout', 'bear_bb_std_mult': 2.7356402875960026, 'bear_rsi_os': 30, 'bear_rsi_ob': 86, 'bear_adx_thresh': 20.197103837365102, 'bear_atr_min_pct': 0.015138944922762299, 'bear_atr_max_pct': 0.14399757967401786, 'bear_tp_mult': 1.2338496399927468, 'bear_tsl_mult': 0.4805170461572528, 'bear_time_stop': 251, 'bear_use_sma': False, 'bear_use_ema': True, 'bear_use_atr': False, 'bear_use_adx': True, 'bear_use_spike': False, 'bear_rsi_required': True, 'sideways_strategy': 'breakout', 'sideways_bb_std_mult': 1.0491578648923394, 'sideways_rsi_os': 23, 'sideways_rsi_ob': 64, 'sideways_adx_thresh': 23.5779860490326, 'sideways_atr_min_pct': 0.001088569182555763, 'sideways_atr_max_pct': 0.02558155776444984, 'sideways_tp_mult': 1.5392357887058883, 'sideways_tsl_mult': 0.25905913785623047, 'sideways_time_stop': 248, 'sideways_use_sma': True, 'sideways_use_ema': True, 'sideways_use_atr': False, 'sideways_use_adx': False, 'sideways_use_spike': False, 'sideways_rsi_required': False}.
[I 2025-08-31 09:53:04,792] Trial 246 finished with values: [-1000000000.0, 1000000000.0] and parameters: {'p_sma': 46, 'p_std': 17, 'p_atr': 23, 'p_adx': 9, 'rsi_period': 44, 'ema1': 25, 'ema2': 40, 'slip_atr_k': 0.058254449744041925, 'slip_spread_k': 0.40726243621182623, 'spread_hl_frac': 0.04576042368672023, 'bb_std_mult': 0.8856355065171074, 'rsi_os': 37, 'rsi_ob': 47, 'vol_spike': 0.02000462460480179, 'adx_thresh': 6.355019853580704, 'atr_min_pct': 0.0198626711324615, 'atr_max_pct': 0.10468685414844466, 'tp_mult': 2.282482718276491, 'tsl_mult': 0.323801935045828, 'strategy': 'breakout', 'time_stop': 258, 'use_sma': False, 'use_atr': False, 'use_adx': False, 'use_ema': False, 'use_spike': False, 'rsi_required': True, 'edge_k': 1.328947552688696, 'edge_cap': 0.6621729994547264, 'bull_strategy': 'mean_reversion', 'bull_bb_std_mult': 2.6344766597216385, 'bull_rsi_os': 32, 'bull_rsi_ob': 47, 'bull_adx_thresh': 31.359624286312663, 'bull_atr_min_pct': 0.018866931924154347, 'bull_atr_max_pct': 0.09457474783691278, 'bull_tp_mult': 2.155940491924668, 'bull_tsl_mult': 0.5752152807415105, 'bull_time_stop': 245, 'bull_use_sma': True, 'bull_use_ema': False, 'bull_use_atr': False, 'bull_use_adx': False, 'bull_use_spike': False, 'bull_rsi_required': True, 'bear_strategy': 'breakout', 'bear_bb_std_mult': 3.265027084119866, 'bear_rsi_os': 30, 'bear_rsi_ob': 80, 'bear_adx_thresh': 20.126200349815342, 'bear_atr_min_pct': 0.022332826584333512, 'bear_atr_max_pct': 0.03409237636939422, 'bear_tp_mult': 2.6418852494543144, 'bear_tsl_mult': 0.4808232500787176, 'bear_time_stop': 264, 'bear_use_sma': False, 'bear_use_ema': True, 'bear_use_atr': False, 'bear_use_adx': True, 'bear_use_spike': False, 'bear_rsi_required': True, 'sideways_strategy': 'breakout', 'sideways_bb_std_mult': 1.064330483364104, 'sideways_rsi_os': 9, 'sideways_rsi_ob': 64, 'sideways_adx_thresh': 34.86452622988771, 'sideways_atr_min_pct': 0.0017274847581499244, 'sideways_atr_max_pct': 0.029993649620426555, 'sideways_tp_mult': 2.308840314718289, 'sideways_tsl_mult': 0.2764983507596667, 'sideways_time_stop': 175, 'sideways_use_sma': True, 'sideways_use_ema': True, 'sideways_use_atr': False, 'sideways_use_adx': False, 'sideways_use_spike': False, 'sideways_rsi_required': False}.
[I 2025-08-31 09:53:06,158] Trial 247 finished with values: [-0.01437761626787648, 0.014186833170257767] and parameters: {'p_sma': 22, 'p_std': 17, 'p_atr': 22, 'p_adx': 9, 'rsi_period': 18, 'ema1': 21, 'ema2': 55, 'slip_atr_k': 0.12431277999141901, 'slip_spread_k': 0.3945894851329366, 'spread_hl_frac': 0.013063803459480232, 'bb_std_mult': 1.0939216686415754, 'rsi_os': 24, 'rsi_ob': 47, 'vol_spike': 0.15238523298465823, 'adx_thresh': 6.341157079794262, 'atr_min_pct': 0.026969040614515563, 'atr_max_pct': 0.10858321531545305, 'tp_mult': 2.865853797216699, 'tsl_mult': 0.5327253601848676, 'strategy': 'breakout', 'time_stop': 32, 'use_sma': False, 'use_atr': False, 'use_adx': False, 'use_ema': False, 'use_spike': False, 'rsi_required': True, 'edge_k': 1.904026242585222, 'edge_cap': 0.9849932288610673, 'bull_strategy': 'mean_reversion', 'bull_bb_std_mult': 0.5125735023238913, 'bull_rsi_os': 32, 'bull_rsi_ob': 85, 'bull_adx_thresh': 32.72755564212092, 'bull_atr_min_pct': 0.0193203188512597, 'bull_atr_max_pct': 0.04572600084546252, 'bull_tp_mult': 2.1987646505474294, 'bull_tsl_mult': 0.3385398824125869, 'bull_time_stop': 93, 'bull_use_sma': True, 'bull_use_ema': True, 'bull_use_atr': False, 'bull_use_adx': False, 'bull_use_spike': True, 'bull_rsi_required': True, 'bear_strategy': 'breakout', 'bear_bb_std_mult': 2.7329821389539437, 'bear_rsi_os': 30, 'bear_rsi_ob': 80, 'bear_adx_thresh': 20.13593202294044, 'bear_atr_min_pct': 0.009337768202920763, 'bear_atr_max_pct': 0.10184430307587282, 'bear_tp_mult': 2.6286472924377815, 'bear_tsl_mult': 0.5444318966186099, 'bear_time_stop': 265, 'bear_use_sma': False, 'bear_use_ema': True, 'bear_use_atr': False, 'bear_use_adx': True, 'bear_use_spike': False, 'bear_rsi_required': True, 'sideways_strategy': 'breakout', 'sideways_bb_std_mult': 1.0667216834856783, 'sideways_rsi_os': 23, 'sideways_rsi_ob': 63, 'sideways_adx_thresh': 28.141319689594816, 'sideways_atr_min_pct': 0.0018873542733558242, 'sideways_atr_max_pct': 0.028119511247261572, 'sideways_tp_mult': 1.542668540824385, 'sideways_tsl_mult': 0.27691177704652487, 'sideways_time_stop': 176, 'sideways_use_sma': True, 'sideways_use_ema': True, 'sideways_use_atr': True, 'sideways_use_adx': False, 'sideways_use_spike': False, 'sideways_rsi_required': False}.
[I 2025-08-31 09:53:06,652] Trial 249 finished with values: [-1000000000.0, 1000000000.0] and parameters: {'p_sma': 22, 'p_std': 5, 'p_atr': 23, 'p_adx': 8, 'rsi_period': 18, 'ema1': 21, 'ema2': 40, 'slip_atr_k': 0.059647064966112884, 'slip_spread_k': 0.44962771501416815, 'spread_hl_frac': 0.045235603084944204, 'bb_std_mult': 3.5172656157203654, 'rsi_os': 24, 'rsi_ob': 48, 'vol_spike': 0.052009872044888245, 'adx_thresh': 6.401684055541409, 'atr_min_pct': 0.01962855235077292, 'atr_max_pct': 0.1136940135873527, 'tp_mult': 1.5348364827669807, 'tsl_mult': 0.5762666317448881, 'strategy': 'breakout', 'time_stop': 34, 'use_sma': False, 'use_atr': False, 'use_adx': False, 'use_ema': False, 'use_spike': False, 'rsi_required': True, 'edge_k': 0.026370047275391828, 'edge_cap': 0.8614076468644432, 'bull_strategy': 'mean_reversion', 'bull_bb_std_mult': 0.5052639399711363, 'bull_rsi_os': 32, 'bull_rsi_ob': 67, 'bull_adx_thresh': 32.50520905467577, 'bull_atr_min_pct': 0.019127388233679737, 'bull_atr_max_pct': 0.11785151799217708, 'bull_tp_mult': 1.5073242562809355, 'bull_tsl_mult': 0.5850706602587242, 'bull_time_stop': 94, 'bull_use_sma': True, 'bull_use_ema': True, 'bull_use_atr': False, 'bull_use_adx': False, 'bull_use_spike': True, 'bull_rsi_required': True, 'bear_strategy': 'breakout', 'bear_bb_std_mult': 2.7225690250596744, 'bear_rsi_os': 51, 'bear_rsi_ob': 80, 'bear_adx_thresh': 20.16249636047572, 'bear_atr_min_pct': 0.02223550392456966, 'bear_atr_max_pct': 0.14499723455036898, 'bear_tp_mult': 2.6467149799154575, 'bear_tsl_mult': 0.4864427938355052, 'bear_time_stop': 262, 'bear_use_sma': True, 'bear_use_ema': True, 'bear_use_atr': False, 'bear_use_adx': False, 'bear_use_spike': False, 'bear_rsi_required': True, 'sideways_strategy': 'mean_reversion', 'sideways_bb_std_mult': 0.7174504355703601, 'sideways_rsi_os': 23, 'sideways_rsi_ob': 64, 'sideways_adx_thresh': 10.240132777825467, 'sideways_atr_min_pct': 0.0019586121443928204, 'sideways_atr_max_pct': 0.027711592445409328, 'sideways_tp_mult': 1.9921679494743958, 'sideways_tsl_mult': 0.10112683338580726, 'sideways_time_stop': 230, 'sideways_use_sma': True, 'sideways_use_ema': True, 'sideways_use_atr': True, 'sideways_use_adx': False, 'sideways_use_spike': False, 'sideways_rsi_required': True}.
[I 2025-08-31 09:53:07,041] Trial 248 finished with values: [-1000000000.0, 1000000000.0] and parameters: {'p_sma': 49, 'p_std': 17, 'p_atr': 25, 'p_adx': 21, 'rsi_period': 22, 'ema1': 21, 'ema2': 36, 'slip_atr_k': 0.16448226047460457, 'slip_spread_k': 0.45518732059116557, 'spread_hl_frac': 0.01323853970203348, 'bb_std_mult': 3.507084025539316, 'rsi_os': 24, 'rsi_ob': 48, 'vol_spike': 0.13798361249935182, 'adx_thresh': 6.350111236475679, 'atr_min_pct': 0.012185201647402798, 'atr_max_pct': 0.029877111616944403, 'tp_mult': 2.4694292101933564, 'tsl_mult': 0.0003016409883337766, 'strategy': 'breakout', 'time_stop': 34, 'use_sma': False, 'use_atr': False, 'use_adx': False, 'use_ema': False, 'use_spike': False, 'rsi_required': True, 'edge_k': 0.768069130433239, 'edge_cap': 0.11265260322649835, 'bull_strategy': 'mean_reversion', 'bull_bb_std_mult': 0.6869909740805407, 'bull_rsi_os': 31, 'bull_rsi_ob': 49, 'bull_adx_thresh': 32.44371477549779, 'bull_atr_min_pct': 0.009249388919966621, 'bull_atr_max_pct': 0.11864507748329518, 'bull_tp_mult': 1.4937221532919662, 'bull_tsl_mult': 0.5898824870750561, 'bull_time_stop': 94, 'bull_use_sma': True, 'bull_use_ema': True, 'bull_use_atr': False, 'bull_use_adx': False, 'bull_use_spike': True, 'bull_rsi_required': True, 'bear_strategy': 'breakout', 'bear_bb_std_mult': 2.720804959185131, 'bear_rsi_os': 30, 'bear_rsi_ob': 80, 'bear_adx_thresh': 20.089497061915772, 'bear_atr_min_pct': 0.009419899224617459, 'bear_atr_max_pct': 0.10215727154074884, 'bear_tp_mult': 2.6349439468545524, 'bear_tsl_mult': 0.5256426791572575, 'bear_time_stop': 120, 'bear_use_sma': False, 'bear_use_ema': True, 'bear_use_atr': False, 'bear_use_adx': False, 'bear_use_spike': False, 'bear_rsi_required': True, 'sideways_strategy': 'breakout', 'sideways_bb_std_mult': 0.6849322663357424, 'sideways_rsi_os': 23, 'sideways_rsi_ob': 48, 'sideways_adx_thresh': 34.87861167303756, 'sideways_atr_min_pct': 0.002008181818688947, 'sideways_atr_max_pct': 0.02952003946453572, 'sideways_tp_mult': 2.9991995409963472, 'sideways_tsl_mult': 0.2789796707099092, 'sideways_time_stop': 250, 'sideways_use_sma': True, 'sideways_use_ema': True, 'sideways_use_atr': True, 'sideways_use_adx': False, 'sideways_use_spike': False, 'sideways_rsi_required': False}.
[I 2025-08-31 09:53:07,785] Trial 253 finished with values: [-1000000000.0, 1000000000.0] and parameters: {'p_sma': 50, 'p_std': 44, 'p_atr': 29, 'p_adx': 9, 'rsi_period': 41, 'ema1': 20, 'ema2': 38, 'slip_atr_k': 0.22251571057955982, 'slip_spread_k': 0.7276937416869335, 'spread_hl_frac': 0.009066923474234545, 'bb_std_mult': 1.0716586328090165, 'rsi_os': 22, 'rsi_ob': 50, 'vol_spike': 0.14636507129029708, 'adx_thresh': 10.328956192859437, 'atr_min_pct': 0.027049498030388593, 'atr_max_pct': 0.03975941338730977, 'tp_mult': 1.58429060312889, 'tsl_mult': 0.5214404016345341, 'strategy': 'mean_reversion', 'time_stop': 127, 'use_sma': False, 'use_atr': False, 'use_adx': False, 'use_ema': False, 'use_spike': False, 'rsi_required': False, 'edge_k': 1.899069644007448, 'edge_cap': 0.9838542025011638, 'bull_strategy': 'mean_reversion', 'bull_bb_std_mult': 1.1315164923428251, 'bull_rsi_os': 38, 'bull_rsi_ob': 90, 'bull_adx_thresh': 30.145771910698766, 'bull_atr_min_pct': 0.019650357740918705, 'bull_atr_max_pct': 0.12108490583023024, 'bull_tp_mult': 1.440410986773044, 'bull_tsl_mult': 0.16505830993343723, 'bull_time_stop': 254, 'bull_use_sma': False, 'bull_use_ema': False, 'bull_use_atr': False, 'bull_use_adx': True, 'bull_use_spike': False, 'bull_rsi_required': True, 'bear_strategy': 'mean_reversion', 'bear_bb_std_mult': 2.8874780463463123, 'bear_rsi_os': 54, 'bear_rsi_ob': 46, 'bear_adx_thresh': 20.811449508290426, 'bear_atr_min_pct': 0.021503424801506316, 'bear_atr_max_pct': 0.05455593226345422, 'bear_tp_mult': 2.6013084346187716, 'bear_tsl_mult': 0.5420660361360412, 'bear_time_stop': 250, 'bear_use_sma': True, 'bear_use_ema': True, 'bear_use_atr': False, 'bear_use_adx': True, 'bear_use_spike': False, 'bear_rsi_required': True, 'sideways_strategy': 'mean_reversion', 'sideways_bb_std_mult': 0.8927608285920058, 'sideways_rsi_os': 43, 'sideways_rsi_ob': 54, 'sideways_adx_thresh': 23.229465967090306, 'sideways_atr_min_pct': 0.02851228625112854, 'sideways_atr_max_pct': 0.02685893667664594, 'sideways_tp_mult': 2.4816535487876323, 'sideways_tsl_mult': 0.06818278558333037, 'sideways_time_stop': 241, 'sideways_use_sma': True, 'sideways_use_ema': True, 'sideways_use_atr': False, 'sideways_use_adx': True, 'sideways_use_spike': False, 'sideways_rsi_required': True}.
[I 2025-08-31 09:53:45,131] Trial 250 finished with values: [-1000000000.0, 1000000000.0] and parameters: {'p_sma': 34, 'p_std': 16, 'p_atr': 29, 'p_adx': 21, 'rsi_period': 18, 'ema1': 21, 'ema2': 36, 'slip_atr_k': 0.16241089596457717, 'slip_spread_k': 0.4574176572333947, 'spread_hl_frac': 0.013327393958579722, 'bb_std_mult': 2.1345510845356617, 'rsi_os': 48, 'rsi_ob': 48, 'vol_spike': 0.14315186637094063, 'adx_thresh': 24.87829810933841, 'atr_min_pct': 0.011004860196623955, 'atr_max_pct': 0.09323780944212988, 'tp_mult': 1.9919785928596092, 'tsl_mult': 0.5759092038993583, 'strategy': 'breakout', 'time_stop': 129, 'use_sma': False, 'use_atr': False, 'use_adx': False, 'use_ema': False, 'use_spike': False, 'rsi_required': True, 'edge_k': 0.9939593556373626, 'edge_cap': 0.10789495143893486, 'bull_strategy': 'mean_reversion', 'bull_bb_std_mult': 1.1364195352960291, 'bull_rsi_os': 31, 'bull_rsi_ob': 85, 'bull_adx_thresh': 32.49176794459202, 'bull_atr_min_pct': 0.019745314387381658, 'bull_atr_max_pct': 0.11741502429314256, 'bull_tp_mult': 1.488862327106979, 'bull_tsl_mult': 0.33206272424109884, 'bull_time_stop': 20, 'bull_use_sma': True, 'bull_use_ema': True, 'bull_use_atr': False, 'bull_use_adx': False, 'bull_use_spike': True, 'bull_rsi_required': True, 'bear_strategy': 'breakout', 'bear_bb_std_mult': 2.7372368787736736, 'bear_rsi_os': 53, 'bear_rsi_ob': 80, 'bear_adx_thresh': 20.73419333418998, 'bear_atr_min_pct': 0.00935423056914209, 'bear_atr_max_pct': 0.09542308549518791, 'bear_tp_mult': 2.6048564703272947, 'bear_tsl_mult': 0.546459246105453, 'bear_time_stop': 250, 'bear_use_sma': True, 'bear_use_ema': True, 'bear_use_atr': False, 'bear_use_adx': False, 'bear_use_spike': False, 'bear_rsi_required': True, 'sideways_strategy': 'mean_reversion', 'sideways_bb_std_mult': 3.0331975738233905, 'sideways_rsi_os': 23, 'sideways_rsi_ob': 63, 'sideways_adx_thresh': 31.207405694847687, 'sideways_atr_min_pct': 0.0023003684484014875, 'sideways_atr_max_pct': 0.028135487966301814, 'sideways_tp_mult': 1.54266344726882, 'sideways_tsl_mult': 0.09747346680492261, 'sideways_time_stop': 228, 'sideways_use_sma': True, 'sideways_use_ema': True, 'sideways_use_atr': True, 'sideways_use_adx': False, 'sideways_use_spike': False, 'sideways_rsi_required': True}.
