[I 2025-08-31 09:51:12,573] Trial 234 finished with values: [-1000000000.0, 1000000000.0] and parameters: {'p_sma': 47, 'p_std': 14, 'p_atr': 7, 'p_adx': 18, 'rsi_period': 20, 'ema1': 20, 'ema2': 14, 'slip_atr_k': 0.0462101518773371, 'slip_spread_k': 0.485316943167356, 'spread_hl_frac': 0.011964563802911703, 'bb_std_mult': 0.7995527041285945, 'rsi_os': 22, 'rsi_ob': 82, 'vol_spike': 0.13672188654860945, 'adx_thresh': 30.02434180636593, 'atr_min_pct': 0.01171735051371767, 'atr_max_pct': 0.02116057218461282, 'tp_mult': 2.9135601478557245, 'tsl_mult': 0.6236168304131716, 'strategy': 'breakout', 'time_stop': 145, 'use_sma': False, 'use_atr': False, 'use_adx': True, 'use_ema': False, 'use_spike': False, 'rsi_required': True, 'edge_k': 1.7800744523445229, 'edge_cap': 0.6223608842046896, 'bull_strategy': 'mean_reversion', 'bull_bb_std_mult': 1.3375014434400314, 'bull_rsi_os': 34, 'bull_rsi_ob': 67, 'bull_adx_thresh': 23.734946904104007, 'bull_atr_min_pct': 0.01787098541526232, 'bull_atr_max_pct': 0.11995079920455887, 'bull_tp_mult': 1.55640774286178, 'bull_tsl_mult': 0.6290466361989394, 'bull_time_stop': 234, 'bull_use_sma': True, 'bull_use_ema': True, 'bull_use_atr': False, 'bull_use_adx': False, 'bull_use_spike': True, 'bull_rsi_required': True, 'bear_strategy': 'breakout', 'bear_bb_std_mult': 1.5616612960790173, 'bear_rsi_os': 55, 'bear_rsi_ob': 71, 'bear_adx_thresh': 21.28544110077519, 'bear_atr_min_pct': 0.021258876312264457, 'bear_atr_max_pct': 0.137329764721016, 'bear_tp_mult': 2.639783543850233, 'bear_tsl_mult': 0.8237982421161805, 'bear_time_stop': 256, 'bear_use_sma': True, 'bear_use_ema': True, 'bear_use_atr': False, 'bear_use_adx': False, 'bear_use_spike': False, 'bear_rsi_required': True, 'sideways_strategy': 'mean_reversion', 'sideways_bb_std_mult': 3.1472209740544246, 'sideways_rsi_os': 26, 'sideways_rsi_ob': 65, 'sideways_adx_thresh': 22.379355488409644, 'sideways_atr_min_pct': 0.002823684887572803, 'sideways_atr_max_pct': 0.03325761046999972, 'sideways_tp_mult': 1.2112363759798153, 'sideways_tsl_mult': 0.019891366839415947, 'sideways_time_stop': 180, 'sideways_use_sma': True, 'sideways_use_ema': True, 'sideways_use_atr': True, 'sideways_use_adx': False, 'sideways_use_spike': False, 'sideways_rsi_required': True}.
[I 2025-08-31 09:51:12,727] Trial 233 finished with values: [-1000000000.0, 1000000000.0] and parameters: {'p_sma': 25, 'p_std': 12, 'p_atr': 28, 'p_adx': 18, 'rsi_period': 24, 'ema1': 20, 'ema2': 12, 'slip_atr_k': 0.08234529566347484, 'slip_spread_k': 0.6255837430389981, 'spread_hl_frac': 0.016123568960919463, 'bb_std_mult': 1.5854810669304202, 'rsi_os': 22, 'rsi_ob': 46, 'vol_spike': 0.13520668931669105, 'adx_thresh': 5.904837615718108, 'atr_min_pct': 0.012170898301671397, 'atr_max_pct': 0.1338646169089182, 'tp_mult': 2.9583992659401743, 'tsl_mult': 0.9917567686318105, 'strategy': 'breakout', 'time_stop': 141, 'use_sma': False, 'use_atr': False, 'use_adx': True, 'use_ema': False, 'use_spike': False, 'rsi_required': True, 'edge_k': 1.7866833000645392, 'edge_cap': 0.6877962941215674, 'bull_strategy': 'mean_reversion', 'bull_bb_std_mult': 1.6679241533089169, 'bull_rsi_os': 30, 'bull_rsi_ob': 68, 'bull_adx_thresh': 26.69642233668153, 'bull_atr_min_pct': 0.01725562888221482, 'bull_atr_max_pct': 0.12137066067721694, 'bull_tp_mult': 1.5637769345460195, 'bull_tsl_mult': 0.6242744174338088, 'bull_time_stop': 231, 'bull_use_sma': True, 'bull_use_ema': False, 'bull_use_atr': False, 'bull_use_adx': False, 'bull_use_spike': False, 'bull_rsi_required': True, 'bear_strategy': 'breakout', 'bear_bb_std_mult': 1.1619918476203766, 'bear_rsi_os': 31, 'bear_rsi_ob': 79, 'bear_adx_thresh': 26.255317227936565, 'bear_atr_min_pct': 0.019825615727143402, 'bear_atr_max_pct': 0.10989055245799983, 'bear_tp_mult': 2.9384668912797847, 'bear_tsl_mult': 0.5509546533824039, 'bear_time_stop': 241, 'bear_use_sma': True, 'bear_use_ema': True, 'bear_use_atr': False, 'bear_use_adx': False, 'bear_use_spike': False, 'bear_rsi_required': True, 'sideways_strategy': 'mean_reversion', 'sideways_bb_std_mult': 1.1244743503530161, 'sideways_rsi_os': 26, 'sideways_rsi_ob': 81, 'sideways_adx_thresh': 33.72112791607133, 'sideways_atr_min_pct': 0.014712429238350425, 'sideways_atr_max_pct': 0.03340878117364896, 'sideways_tp_mult': 1.494694575235857, 'sideways_tsl_mult': 0.12552874499040534, 'sideways_time_stop': 296, 'sideways_use_sma': True, 'sideways_use_ema': True, 'sideways_use_atr': False, 'sideways_use_adx': False, 'sideways_use_spike': False, 'sideways_rsi_required': True}.
[I 2025-08-31 09:51:13,529] Trial 238 finished with values: [-1000000000.0, 1000000000.0] and parameters: {'p_sma': 50, 'p_std': 54, 'p_atr': 28, 'p_adx': 8, 'rsi_period': 27, 'ema1': 29, 'ema2': 12, 'slip_atr_k': 0.17641951787691962, 'slip_spread_k': 0.35929098187819614, 'spread_hl_frac': 0.015979156054358096, 'bb_std_mult': 1.3255224361775952, 'rsi_os': 23, 'rsi_ob': 46, 'vol_spike': 0.14378761090400688, 'adx_thresh': 17.91082299681758, 'atr_min_pct': 0.012750538781703825, 'atr_max_pct': 0.1326050507198667, 'tp_mult': 2.8434909676537203, 'tsl_mult': 0.2733986405769065, 'strategy': 'mean_reversion', 'time_stop': 282, 'use_sma': False, 'use_atr': False, 'use_adx': False, 'use_ema': False, 'use_spike': False, 'rsi_required': False, 'edge_k': 1.9259491212550075, 'edge_cap': 0.12825053126756175, 'bull_strategy': 'mean_reversion', 'bull_bb_std_mult': 2.4503426965778083, 'bull_rsi_os': 55, 'bull_rsi_ob': 69, 'bull_adx_thresh': 12.160890295369953, 'bull_atr_min_pct': 0.019717773004453775, 'bull_atr_max_pct': 0.14195256700302072, 'bull_tp_mult': 1.168842161776905, 'bull_tsl_mult': 0.5641559478604753, 'bull_time_stop': 55, 'bull_use_sma': False, 'bull_use_ema': False, 'bull_use_atr': False, 'bull_use_adx': True, 'bull_use_spike': False, 'bull_rsi_required': True, 'bear_strategy': 'mean_reversion', 'bear_bb_std_mult': 1.0700122964038217, 'bear_rsi_os': 54, 'bear_rsi_ob': 79, 'bear_adx_thresh': 22.19093968096657, 'bear_atr_min_pct': 0.020592868834876987, 'bear_atr_max_pct': 0.108993498440252, 'bear_tp_mult': 1.3128194422196828, 'bear_tsl_mult': 0.1832087414874526, 'bear_time_stop': 213, 'bear_use_sma': False, 'bear_use_ema': True, 'bear_use_atr': False, 'bear_use_adx': True, 'bear_use_spike': False, 'bear_rsi_required': True, 'sideways_strategy': 'breakout', 'sideways_bb_std_mult': 1.1452475829334468, 'sideways_rsi_os': 24, 'sideways_rsi_ob': 51, 'sideways_adx_thresh': 31.94115173242075, 'sideways_atr_min_pct': 0.02284375652963918, 'sideways_atr_max_pct': 0.014872223686590162, 'sideways_tp_mult': 1.5378017476860406, 'sideways_tsl_mult': 0.857958820519949, 'sideways_time_stop': 221, 'sideways_use_sma': True, 'sideways_use_ema': True, 'sideways_use_atr': False, 'sideways_use_adx': True, 'sideways_use_spike': False, 'sideways_rsi_required': False}.
[I 2025-08-31 09:51:13,536] Trial 236 finished with values: [-1000000000.0, 1000000000.0] and parameters: {'p_sma': 47, 'p_std': 14, 'p_atr': 28, 'p_adx': 13, 'rsi_period': 21, 'ema1': 20, 'ema2': 38, 'slip_atr_k': 0.08062733374080575, 'slip_spread_k': 0.6885215221824098, 'spread_hl_frac': 0.012803292292429675, 'bb_std_mult': 1.6163826154727232, 'rsi_os': 23, 'rsi_ob': 46, 'vol_spike': 0.23860367534247262, 'adx_thresh': 17.688862097163288, 'atr_min_pct': 0.011478039492879254, 'atr_max_pct': 0.13402545528533386, 'tp_mult': 1.6892529981002538, 'tsl_mult': 0.27565784915674946, 'strategy': 'mean_reversion', 'time_stop': 146, 'use_sma': False, 'use_atr': False, 'use_adx': True, 'use_ema': False, 'use_spike': False, 'rsi_required': True, 'edge_k': 1.9274054326141121, 'edge_cap': 0.11319840877935533, 'bull_strategy': 'mean_reversion', 'bull_bb_std_mult': 1.318082733450254, 'bull_rsi_os': 45, 'bull_rsi_ob': 51, 'bull_adx_thresh': 30.68612191787585, 'bull_atr_min_pct': 0.017519970396165895, 'bull_atr_max_pct': 0.11589619290211078, 'bull_tp_mult': 1.1826991870636423, 'bull_tsl_mult': 0.2608268070876103, 'bull_time_stop': 260, 'bull_use_sma': True, 'bull_use_ema': True, 'bull_use_atr': False, 'bull_use_adx': False, 'bull_use_spike': True, 'bull_rsi_required': True, 'bear_strategy': 'breakout', 'bear_bb_std_mult': 2.815660091543984, 'bear_rsi_os': 17, 'bear_rsi_ob': 79, 'bear_adx_thresh': 20.65965565147789, 'bear_atr_min_pct': 0.02101079145531903, 'bear_atr_max_pct': 0.11073112754416083, 'bear_tp_mult': 2.7163641737217104, 'bear_tsl_mult': 0.21473644282660526, 'bear_time_stop': 239, 'bear_use_sma': False, 'bear_use_ema': True, 'bear_use_atr': False, 'bear_use_adx': True, 'bear_use_spike': False, 'bear_rsi_required': True, 'sideways_strategy': 'breakout', 'sideways_bb_std_mult': 1.140701366745133, 'sideways_rsi_os': 24, 'sideways_rsi_ob': 65, 'sideways_adx_thresh': 33.27386408768888, 'sideways_atr_min_pct': 0.0029403589201140896, 'sideways_atr_max_pct': 0.03945569180374812, 'sideways_tp_mult': 1.524919507799719, 'sideways_tsl_mult': 0.021845759218443707, 'sideways_time_stop': 159, 'sideways_use_sma': True, 'sideways_use_ema': True, 'sideways_use_atr': True, 'sideways_use_adx': False, 'sideways_use_spike': False, 'sideways_rsi_required': False}.
[I 2025-08-31 09:51:44,168] Trial 239 finished with values: [-1000000000.0, 1000000000.0] and parameters: {'p_sma': 50, 'p_std': 54, 'p_atr': 30, 'p_adx': 27, 'rsi_period': 27, 'ema1': 21, 'ema2': 38, 'slip_atr_k': 0.18492563470038537, 'slip_spread_k': 0.3510504593424124, 'spread_hl_frac': 0.04835439740691149, 'bb_std_mult': 1.3212639227419687, 'rsi_os': 13, 'rsi_ob': 77, 'vol_spike': 0.028467191875544848, 'adx_thresh': 7.23571898100446, 'atr_min_pct': 0.012911916989194482, 'atr_max_pct': 0.1321626309343375, 'tp_mult': 2.8307702500960232, 'tsl_mult': 0.6950899476934167, 'strategy': 'mean_reversion', 'time_stop': 148, 'use_sma': False, 'use_atr': False, 'use_adx': False, 'use_ema': False, 'use_spike': False, 'rsi_required': False, 'edge_k': 0.24746564189637799, 'edge_cap': 0.1295912634669849, 'bull_strategy': 'mean_reversion', 'bull_bb_std_mult': 0.9333193871943015, 'bull_rsi_os': 32, 'bull_rsi_ob': 92, 'bull_adx_thresh': 16.299209276074524, 'bull_atr_min_pct': 0.006883661186824373, 'bull_atr_max_pct': 0.08858260518481016, 'bull_tp_mult': 1.4157953898763267, 'bull_tsl_mult': 0.5693201734306004, 'bull_time_stop': 52, 'bull_use_sma': False, 'bull_use_ema': False, 'bull_use_atr': False, 'bull_use_adx': True, 'bull_use_spike': False, 'bull_rsi_required': False, 'bear_strategy': 'mean_reversion', 'bear_bb_std_mult': 2.8147935377455346, 'bear_rsi_os': 27, 'bear_rsi_ob': 77, 'bear_adx_thresh': 21.77121273809729, 'bear_atr_min_pct': 0.02180231965459395, 'bear_atr_max_pct': 0.02644014624248947, 'bear_tp_mult': 1.301202450690068, 'bear_tsl_mult': 0.031034725156790344, 'bear_time_stop': 235, 'bear_use_sma': False, 'bear_use_ema': True, 'bear_use_atr': True, 'bear_use_adx': True, 'bear_use_spike': False, 'bear_rsi_required': True, 'sideways_strategy': 'breakout', 'sideways_bb_std_mult': 1.9117462678443857, 'sideways_rsi_os': 24, 'sideways_rsi_ob': 74, 'sideways_adx_thresh': 31.983955363431907, 'sideways_atr_min_pct': 0.0020340770700549835, 'sideways_atr_max_pct': 0.037839053369391945, 'sideways_tp_mult': 2.209443598756381, 'sideways_tsl_mult': 0.6492969999815738, 'sideways_time_stop': 84, 'sideways_use_sma': False, 'sideways_use_ema': False, 'sideways_use_atr': False, 'sideways_use_adx': True, 'sideways_use_spike': False, 'sideways_rsi_required': False}.
[I 2025-08-31 09:51:46,327] Trial 237 finished with values: [-1000000000.0, 1000000000.0] and parameters: {'p_sma': 25, 'p_std': 8, 'p_atr': 7, 'p_adx': 18, 'rsi_period': 21, 'ema1': 20, 'ema2': 20, 'slip_atr_k': 0.18635767597798492, 'slip_spread_k': 0.35121103711768803, 'spread_hl_frac': 0.01644921520313148, 'bb_std_mult': 1.583142718802093, 'rsi_os': 23, 'rsi_ob': 46, 'vol_spike': 0.22440865134484314, 'adx_thresh': 17.894791482254888, 'atr_min_pct': 0.01302132266616114, 'atr_max_pct': 0.018741343277354668, 'tp_mult': 2.8307718535782187, 'tsl_mult': 0.9927348725588121, 'strategy': 'breakout', 'time_stop': 176, 'use_sma': False, 'use_atr': False, 'use_adx': True, 'use_ema': False, 'use_spike': False, 'rsi_required': True, 'edge_k': 1.8511464177545816, 'edge_cap': 0.77427086136846, 'bull_strategy': 'mean_reversion', 'bull_bb_std_mult': 1.689788478278592, 'bull_rsi_os': 45, 'bull_rsi_ob': 69, 'bull_adx_thresh': 30.893049709629153, 'bull_atr_min_pct': 0.017452162437627212, 'bull_atr_max_pct': 0.14186179031723653, 'bull_tp_mult': 1.1681582711490255, 'bull_tsl_mult': 0.6267274345704128, 'bull_time_stop': 170, 'bull_use_sma': True, 'bull_use_ema': False, 'bull_use_atr': False, 'bull_use_adx': False, 'bull_use_spike': False, 'bull_rsi_required': True, 'bear_strategy': 'breakout', 'bear_bb_std_mult': 2.820385262332824, 'bear_rsi_os': 54, 'bear_rsi_ob': 79, 'bear_adx_thresh': 28.926950038052183, 'bear_atr_min_pct': 0.02098375120655444, 'bear_atr_max_pct': 0.023836772715278808, 'bear_tp_mult': 2.7014500851313796, 'bear_tsl_mult': 0.035629311385360074, 'bear_time_stop': 259, 'bear_use_sma': False, 'bear_use_ema': True, 'bear_use_atr': False, 'bear_use_adx': True, 'bear_use_spike': False, 'bear_rsi_required': True, 'sideways_strategy': 'breakout', 'sideways_bb_std_mult': 1.1503975351508364, 'sideways_rsi_os': 25, 'sideways_rsi_ob': 81, 'sideways_adx_thresh': 32.18072212312324, 'sideways_atr_min_pct': 0.01459384241294577, 'sideways_atr_max_pct': 0.034613640377650634, 'sideways_tp_mult': 2.204767533781572, 'sideways_tsl_mult': 0.024080078402702904, 'sideways_time_stop': 86, 'sideways_use_sma': True, 'sideways_use_ema': True, 'sideways_use_atr': False, 'sideways_use_adx': False, 'sideways_use_spike': False, 'sideways_rsi_required': False}.
[I 2025-08-31 09:51:50,190] Trial 240 finished with values: [-1000000000.0, 1000000000.0] and parameters: {'p_sma': 48, 'p_std': 15, 'p_atr': 29, 'p_adx': 17, 'rsi_period': 50, 'ema1': 30, 'ema2': 20, 'slip_atr_k': 0.14675202641666996, 'slip_spread_k': 0.7719097830521633, 'spread_hl_frac': 0.014728711243944911, 'bb_std_mult': 0.990373141623911, 'rsi_os': 20, 'rsi_ob': 49, 'vol_spike': 0.1698748797451512, 'adx_thresh': 14.44918637641394, 'atr_min_pct': 0.01316247654236211, 'atr_max_pct': 0.14600523098030632, 'tp_mult': 1.6901795479282957, 'tsl_mult': 0.022737243155380855, 'strategy': 'breakout', 'time_stop': 294, 'use_sma': False, 'use_atr': False, 'use_adx': False, 'use_ema': False, 'use_spike': False, 'rsi_required': True, 'edge_k': 0.26497873145285167, 'edge_cap': 0.586006776765936, 'bull_strategy': 'mean_reversion', 'bull_bb_std_mult': 1.2662685953885455, 'bull_rsi_os': 9, 'bull_rsi_ob': 51, 'bull_adx_thresh': 30.75245110079464, 'bull_atr_min_pct': 0.018460637141956282, 'bull_atr_max_pct': 0.11580693601808545, 'bull_tp_mult': 1.6315335974113945, 'bull_tsl_mult': 0.011550796738967417, 'bull_time_stop': 259, 'bull_use_sma': True, 'bull_use_ema': False, 'bull_use_atr': False, 'bull_use_adx': False, 'bull_use_spike': False, 'bull_rsi_required': False, 'bear_strategy': 'breakout', 'bear_bb_std_mult': 2.8234544917037523, 'bear_rsi_os': 27, 'bear_rsi_ob': 77, 'bear_adx_thresh': 21.69014418605004, 'bear_atr_min_pct': 0.026184207966278433, 'bear_atr_max_pct': 0.14778184543710418, 'bear_tp_mult': 2.7002023473753893, 'bear_tsl_mult': 0.03474510232369238, 'bear_time_stop': 198, 'bear_use_sma': False, 'bear_use_ema': True, 'bear_use_atr': True, 'bear_use_adx': True, 'bear_use_spike': False, 'bear_rsi_required': True, 'sideways_strategy': 'breakout', 'sideways_bb_std_mult': 1.6607687578931971, 'sideways_rsi_os': 27, 'sideways_rsi_ob': 62, 'sideways_adx_thresh': 33.178190067099074, 'sideways_atr_min_pct': 0.013434182532127931, 'sideways_atr_max_pct': 0.03879470484789871, 'sideways_tp_mult': 1.4404259773544852, 'sideways_tsl_mult': 0.7916926751395845, 'sideways_time_stop': 273, 'sideways_use_sma': False, 'sideways_use_ema': False, 'sideways_use_atr': False, 'sideways_use_adx': False, 'sideways_use_spike': False, 'sideways_rsi_required': False}.
[I 2025-08-31 09:51:50,663] Trial 241 finished with values: [-1000000000.0, 1000000000.0] and parameters: {'p_sma': 51, 'p_std': 15, 'p_atr': 30, 'p_adx': 10, 'rsi_period': 50, 'ema1': 18, 'ema2': 20, 'slip_atr_k': 0.24257840498309033, 'slip_spread_k': 0.8488960037243162, 'spread_hl_frac': 0.01489446504632335, 'bb_std_mult': 1.0012745711348212, 'rsi_os': 20, 'rsi_ob': 87, 'vol_spike': 0.1730774449088495, 'adx_thresh': 7.141830578482743, 'atr_min_pct': 0.01279854057954204, 'atr_max_pct': 0.14684901483714213, 'tp_mult': 2.8107057311192354, 'tsl_mult': 0.025320926508291642, 'strategy': 'breakout', 'time_stop': 135, 'use_sma': False, 'use_atr': False, 'use_adx': False, 'use_ema': False, 'use_spike': False, 'rsi_required': False, 'edge_k': 1.8452948521073604, 'edge_cap': 0.09465734796017439, 'bull_strategy': 'mean_reversion', 'bull_bb_std_mult': 2.0441198408682264, 'bull_rsi_os': 34, 'bull_rsi_ob': 65, 'bull_adx_thresh': 16.38411774223462, 'bull_atr_min_pct': 0.007019250087426461, 'bull_atr_max_pct': 0.12543329378360865, 'bull_tp_mult': 2.0692791492226053, 'bull_tsl_mult': 0.6138234659189684, 'bull_time_stop': 122, 'bull_use_sma': False, 'bull_use_ema': False, 'bull_use_atr': False, 'bull_use_adx': True, 'bull_use_spike': False, 'bull_rsi_required': False, 'bear_strategy': 'mean_reversion', 'bear_bb_std_mult': 3.500132649493304, 'bear_rsi_os': 48, 'bear_rsi_ob': 77, 'bear_adx_thresh': 21.563687336082374, 'bear_atr_min_pct': 0.02638376398797905, 'bear_atr_max_pct': 0.14264153074257635, 'bear_tp_mult': 2.55792261335307, 'bear_tsl_mult': 0.5109568309790412, 'bear_time_stop': 149, 'bear_use_sma': False, 'bear_use_ema': True, 'bear_use_atr': True, 'bear_use_adx': True, 'bear_use_spike': False, 'bear_rsi_required': True, 'sideways_strategy': 'breakout', 'sideways_bb_std_mult': 0.9739723982018197, 'sideways_rsi_os': 25, 'sideways_rsi_ob': 95, 'sideways_adx_thresh': 32.457469404061044, 'sideways_atr_min_pct': 4.073087816320632e-05, 'sideways_atr_max_pct': 0.03758142052112587, 'sideways_tp_mult': 2.8770394301284874, 'sideways_tsl_mult': 0.22204134749770021, 'sideways_time_stop': 259, 'sideways_use_sma': False, 'sideways_use_ema': False, 'sideways_use_atr': False, 'sideways_use_adx': True, 'sideways_use_spike': False, 'sideways_rsi_required': False}.
[I 2025-08-31 09:52:19,758] Trial 243 finished with values: [-1000000000.0, 1000000000.0] and parameters: {'p_sma': 49, 'p_std': 15, 'p_atr': 29, 'p_adx': 14, 'rsi_period': 51, 'ema1': 18, 'ema2': 41, 'slip_atr_k': 0.14513286871110978, 'slip_spread_k': 0.7717218241618566, 'spread_hl_frac': 0.014789970679218717, 'bb_std_mult': 0.822819910426345, 'rsi_os': 20, 'rsi_ob': 49, 'vol_spike': 0.12259684161730706, 'adx_thresh': 16.85258804476709, 'atr_min_pct': 0.011132566285014744, 'atr_max_pct': 0.14539040270394638, 'tp_mult': 1.3759998357109047, 'tsl_mult': 0.02306749278518733, 'strategy': 'breakout', 'time_stop': 135, 'use_sma': False, 'use_atr': False, 'use_adx': False, 'use_ema': False, 'use_spike': False, 'rsi_required': True, 'edge_k': 1.1375379449007093, 'edge_cap': 0.14738672507765319, 'bull_strategy': 'mean_reversion', 'bull_bb_std_mult': 1.226173497508781, 'bull_rsi_os': 34, 'bull_rsi_ob': 65, 'bull_adx_thresh': 31.77945585506593, 'bull_atr_min_pct': 0.018732431764095125, 'bull_atr_max_pct': 0.12424659367317128, 'bull_tp_mult': 1.4612144257303104, 'bull_tsl_mult': 0.5394299477326308, 'bull_time_stop': 12, 'bull_use_sma': True, 'bull_use_ema': False, 'bull_use_atr': False, 'bull_use_adx': False, 'bull_use_spike': False, 'bull_rsi_required': False, 'bear_strategy': 'breakout', 'bear_bb_std_mult': 3.017384760824089, 'bear_rsi_os': 5, 'bear_rsi_ob': 86, 'bear_adx_thresh': 30.345055866451936, 'bear_atr_min_pct': 0.021615542184892304, 'bear_atr_max_pct': 0.14311771464453485, 'bear_tp_mult': 2.5612749606113008, 'bear_tsl_mult': 0.8957936715809864, 'bear_time_stop': 251, 'bear_use_sma': False, 'bear_use_ema': True, 'bear_use_atr': True, 'bear_use_adx': True, 'bear_use_spike': False, 'bear_rsi_required': True, 'sideways_strategy': 'breakout', 'sideways_bb_std_mult': 1.6252748401826287, 'sideways_rsi_os': 27, 'sideways_rsi_ob': 64, 'sideways_adx_thresh': 32.69916087565245, 'sideways_atr_min_pct': 0.0010815181133347206, 'sideways_atr_max_pct': 0.0417670505814926, 'sideways_tp_mult': 1.4469809477398958, 'sideways_tsl_mult': 0.7849258566368433, 'sideways_time_stop': 270, 'sideways_use_sma': False, 'sideways_use_ema': False, 'sideways_use_atr': False, 'sideways_use_adx': False, 'sideways_use_spike': False, 'sideways_rsi_required': False}.
