[I 2025-08-31 10:04:32,022] Trial 340 finished with values: [-1000000000.0, 1000000000.0] and parameters: {'p_sma': 38, 'p_std': 13, 'p_atr': 13, 'p_adx': 20, 'rsi_period': 62, 'ema1': 27, 'ema2': 34, 'slip_atr_k': 0.19024424078723312, 'slip_spread_k': 0.38998704259317596, 'spread_hl_frac': 0.032251020706562175, 'bb_std_mult': 0.5023352212043579, 'rsi_os': 23, 'rsi_ob': 47, 'vol_spike': 0.1489693864567075, 'adx_thresh': 6.666983693527452, 'atr_min_pct': 0.011881240340153318, 'atr_max_pct': 0.1441155831862657, 'tp_mult': 2.9078875900790724, 'tsl_mult': 0.1927529690539369, 'strategy': 'breakout', 'time_stop': 135, 'use_sma': False, 'use_atr': False, 'use_adx': False, 'use_ema': False, 'use_spike': False, 'rsi_required': True, 'edge_k': 0.22774550475344646, 'edge_cap': 0.44076747327589316, 'bull_strategy': 'mean_reversion', 'bull_bb_std_mult': 1.2253883217999433, 'bull_rsi_os': 36, 'bull_rsi_ob': 68, 'bull_adx_thresh': 23.634685231414224, 'bull_atr_min_pct': 0.008235195958149082, 'bull_atr_max_pct': 0.06224847276626989, 'bull_tp_mult': 1.673029724457414, 'bull_tsl_mult': 0.5649904938951673, 'bull_time_stop': 96, 'bull_use_sma': True, 'bull_use_ema': False, 'bull_use_atr': False, 'bull_use_adx': False, 'bull_use_spike': False, 'bull_rsi_required': True, 'bear_strategy': 'breakout', 'bear_bb_std_mult': 2.796608877440686, 'bear_rsi_os': 55, 'bear_rsi_ob': 80, 'bear_adx_thresh': 21.135485795822557, 'bear_atr_min_pct': 0.019487051784360065, 'bear_atr_max_pct': 0.14272064033232537, 'bear_tp_mult': 2.8685411788474626, 'bear_tsl_mult': 0.5422486394020033, 'bear_time_stop': 254, 'bear_use_sma': False, 'bear_use_ema': False, 'bear_use_atr': False, 'bear_use_adx': True, 'bear_use_spike': False, 'bear_rsi_required': True, 'sideways_strategy': 'breakout', 'sideways_bb_std_mult': 3.2185573540586345, 'sideways_rsi_os': 26, 'sideways_rsi_ob': 66, 'sideways_adx_thresh': 32.65789904744474, 'sideways_atr_min_pct': 0.009828350733251154, 'sideways_atr_max_pct': 0.10234458846976338, 'sideways_tp_mult': 2.4245016303225944, 'sideways_tsl_mult': 0.6609394239064392, 'sideways_time_stop': 228, 'sideways_use_sma': True, 'sideways_use_ema': True, 'sideways_use_atr': False, 'sideways_use_adx': False, 'sideways_use_spike': True, 'sideways_rsi_required': False}.
[I 2025-08-31 10:05:04,036] Trial 343 finished with values: [-1000000000.0, 1000000000.0] and parameters: {'p_sma': 49, 'p_std': 13, 'p_atr': 28, 'p_adx': 8, 'rsi_period': 61, 'ema1': 18, 'ema2': 40, 'slip_atr_k': 0.15853838700920697, 'slip_spread_k': 0.38424552759636393, 'spread_hl_frac': 0.016433117986084492, 'bb_std_mult': 2.4349702973823195, 'rsi_os': 27, 'rsi_ob': 67, 'vol_spike': 0.1597534154786891, 'adx_thresh': 8.399968820560423, 'atr_min_pct': 0.029458044572043603, 'atr_max_pct': 0.12871463976640674, 'tp_mult': 2.717666492975418, 'tsl_mult': 0.5934274969996894, 'strategy': 'breakout', 'time_stop': 70, 'use_sma': False, 'use_atr': False, 'use_adx': False, 'use_ema': False, 'use_spike': False, 'rsi_required': True, 'edge_k': 0.3380782175457927, 'edge_cap': 0.11743728944129037, 'bull_strategy': 'mean_reversion', 'bull_bb_std_mult': 1.2789687062764594, 'bull_rsi_os': 35, 'bull_rsi_ob': 65, 'bull_adx_thresh': 29.437713390964163, 'bull_atr_min_pct': 0.01014359133005283, 'bull_atr_max_pct': 0.03996868645735877, 'bull_tp_mult': 1.458314476663978, 'bull_tsl_mult': 0.8078722350767105, 'bull_time_stop': 80, 'bull_use_sma': True, 'bull_use_ema': False, 'bull_use_atr': False, 'bull_use_adx': False, 'bull_use_spike': False, 'bull_rsi_required': True, 'bear_strategy': 'breakout', 'bear_bb_std_mult': 2.8979128125983538, 'bear_rsi_os': 40, 'bear_rsi_ob': 46, 'bear_adx_thresh': 21.164296214884306, 'bear_atr_min_pct': 0.021940329206788442, 'bear_atr_max_pct': 0.14315254381339534, 'bear_tp_mult': 2.7441655390972097, 'bear_tsl_mult': 0.7377936252743471, 'bear_time_stop': 205, 'bear_use_sma': False, 'bear_use_ema': False, 'bear_use_atr': False, 'bear_use_adx': True, 'bear_use_spike': False, 'bear_rsi_required': True, 'sideways_strategy': 'breakout', 'sideways_bb_std_mult': 2.0063396169100263, 'sideways_rsi_os': 24, 'sideways_rsi_ob': 73, 'sideways_adx_thresh': 31.70845762756686, 'sideways_atr_min_pct': 0.00480233778624559, 'sideways_atr_max_pct': 0.0284786208671201, 'sideways_tp_mult': 1.7026829971863635, 'sideways_tsl_mult': 0.4305051993874759, 'sideways_time_stop': 172, 'sideways_use_sma': True, 'sideways_use_ema': True, 'sideways_use_atr': False, 'sideways_use_adx': False, 'sideways_use_spike': False, 'sideways_rsi_required': False}.
[I 2025-08-31 10:05:04,225] Trial 346 finished with values: [-1000000000.0, 1000000000.0] and parameters: {'p_sma': 49, 'p_std': 14, 'p_atr': 29, 'p_adx': 8, 'rsi_period': 20, 'ema1': 18, 'ema2': 16, 'slip_atr_k': 0.09172666868284146, 'slip_spread_k': 0.9017589416376269, 'spread_hl_frac': 0.016450446147795627, 'bb_std_mult': 2.4530477840470444, 'rsi_os': 16, 'rsi_ob': 48, 'vol_spike': 0.12744250238035762, 'adx_thresh': 6.632680655660509, 'atr_min_pct': 0.02424929775562082, 'atr_max_pct': 0.12896657673376344, 'tp_mult': 2.717631403897738, 'tsl_mult': 0.5350904624706916, 'strategy': 'breakout', 'time_stop': 140, 'use_sma': False, 'use_atr': False, 'use_adx': False, 'use_ema': False, 'use_spike': False, 'rsi_required': True, 'edge_k': 0.8873852017015762, 'edge_cap': 0.11560189897921233, 'bull_strategy': 'mean_reversion', 'bull_bb_std_mult': 1.1266367392331231, 'bull_rsi_os': 32, 'bull_rsi_ob': 63, 'bull_adx_thresh': 29.912975362279855, 'bull_atr_min_pct': 0.01150118043910694, 'bull_atr_max_pct': 0.10142065046202083, 'bull_tp_mult': 1.3272651674252, 'bull_tsl_mult': 0.24877942620347115, 'bull_time_stop': 238, 'bull_use_sma': False, 'bull_use_ema': False, 'bull_use_atr': False, 'bull_use_adx': False, 'bull_use_spike': False, 'bull_rsi_required': True, 'bear_strategy': 'mean_reversion', 'bear_bb_std_mult': 3.183770578638599, 'bear_rsi_os': 12, 'bear_rsi_ob': 82, 'bear_adx_thresh': 15.722430453202819, 'bear_atr_min_pct': 0.022082514410535298, 'bear_atr_max_pct': 0.1009799811837614, 'bear_tp_mult': 2.5753758687057404, 'bear_tsl_mult': 0.8432505931327612, 'bear_time_stop': 241, 'bear_use_sma': False, 'bear_use_ema': True, 'bear_use_atr': True, 'bear_use_adx': True, 'bear_use_spike': False, 'bear_rsi_required': True, 'sideways_strategy': 'breakout', 'sideways_bb_std_mult': 1.0797752488073538, 'sideways_rsi_os': 13, 'sideways_rsi_ob': 45, 'sideways_adx_thresh': 31.724194694986416, 'sideways_atr_min_pct': 0.002173796821054427, 'sideways_atr_max_pct': 0.03122343500215061, 'sideways_tp_mult': 2.9730127188710056, 'sideways_tsl_mult': 0.09170464228844202, 'sideways_time_stop': 130, 'sideways_use_sma': False, 'sideways_use_ema': False, 'sideways_use_atr': False, 'sideways_use_adx': False, 'sideways_use_spike': False, 'sideways_rsi_required': False}.
[I 2025-08-31 10:05:04,441] Trial 345 finished with values: [-1000000000.0, 1000000000.0] and parameters: {'p_sma': 49, 'p_std': 13, 'p_atr': 27, 'p_adx': 23, 'rsi_period': 76, 'ema1': 18, 'ema2': 57, 'slip_atr_k': 0.07783611882630598, 'slip_spread_k': 0.45057038376449926, 'spread_hl_frac': 0.03208476118196207, 'bb_std_mult': 1.1446771526422788, 'rsi_os': 20, 'rsi_ob': 47, 'vol_spike': 0.2947342596333001, 'adx_thresh': 6.813647098779156, 'atr_min_pct': 0.011775349085586303, 'atr_max_pct': 0.12911877445600775, 'tp_mult': 2.792883891629782, 'tsl_mult': 0.6012411301920353, 'strategy': 'breakout', 'time_stop': 73, 'use_sma': False, 'use_atr': False, 'use_adx': False, 'use_ema': False, 'use_spike': False, 'rsi_required': True, 'edge_k': 0.3564511373677698, 'edge_cap': 0.11436668917558913, 'bull_strategy': 'mean_reversion', 'bull_bb_std_mult': 1.2765193757662576, 'bull_rsi_os': 46, 'bull_rsi_ob': 63, 'bull_adx_thresh': 17.36210810617493, 'bull_atr_min_pct': 0.02027937420659483, 'bull_atr_max_pct': 0.06202692316067336, 'bull_tp_mult': 1.6933004000668623, 'bull_tsl_mult': 0.07395124603039932, 'bull_time_stop': 36, 'bull_use_sma': False, 'bull_use_ema': False, 'bull_use_atr': False, 'bull_use_adx': False, 'bull_use_spike': False, 'bull_rsi_required': True, 'bear_strategy': 'mean_reversion', 'bear_bb_std_mult': 2.8908113639726465, 'bear_rsi_os': 52, 'bear_rsi_ob': 46, 'bear_adx_thresh': 26.750551002815207, 'bear_atr_min_pct': 0.022077577263990407, 'bear_atr_max_pct': 0.13737464203428165, 'bear_tp_mult': 1.8386388329720822, 'bear_tsl_mult': 0.569734247994426, 'bear_time_stop': 185, 'bear_use_sma': False, 'bear_use_ema': True, 'bear_use_atr': True, 'bear_use_adx': True, 'bear_use_spike': False, 'bear_rsi_required': True, 'sideways_strategy': 'breakout', 'sideways_bb_std_mult': 1.0790738965085356, 'sideways_rsi_os': 5, 'sideways_rsi_ob': 60, 'sideways_adx_thresh': 31.429957545579104, 'sideways_atr_min_pct': 0.006744376815540088, 'sideways_atr_max_pct': 0.03324250145961725, 'sideways_tp_mult': 2.4292533033237267, 'sideways_tsl_mult': 0.08547169595768023, 'sideways_time_stop': 89, 'sideways_use_sma': False, 'sideways_use_ema': False, 'sideways_use_atr': False, 'sideways_use_adx': False, 'sideways_use_spike': False, 'sideways_rsi_required': False}.
[I 2025-08-31 10:05:04,805] Trial 344 finished with values: [-1000000000.0, 1000000000.0] and parameters: {'p_sma': 45, 'p_std': 48, 'p_atr': 25, 'p_adx': 23, 'rsi_period': 77, 'ema1': 21, 'ema2': 40, 'slip_atr_k': 0.09258670071332713, 'slip_spread_k': 0.4430080978727469, 'spread_hl_frac': 0.01691514710253046, 'bb_std_mult': 1.7379478729123454, 'rsi_os': 12, 'rsi_ob': 47, 'vol_spike': 0.26335656241047395, 'adx_thresh': 13.49269564038545, 'atr_min_pct': 0.02019358442513926, 'atr_max_pct': 0.12899940514378866, 'tp_mult': 2.7163742361770966, 'tsl_mult': 0.04200172569591398, 'strategy': 'breakout', 'time_stop': 140, 'use_sma': False, 'use_atr': False, 'use_adx': False, 'use_ema': False, 'use_spike': False, 'rsi_required': True, 'edge_k': 0.35601303509907856, 'edge_cap': 0.11387973140074764, 'bull_strategy': 'mean_reversion', 'bull_bb_std_mult': 1.1412155058459215, 'bull_rsi_os': 47, 'bull_rsi_ob': 65, 'bull_adx_thresh': 23.61209845434158, 'bull_atr_min_pct': 0.013057721427595191, 'bull_atr_max_pct': 0.066240416568158, 'bull_tp_mult': 1.6759678338066155, 'bull_tsl_mult': 0.6388961645256346, 'bull_time_stop': 237, 'bull_use_sma': False, 'bull_use_ema': False, 'bull_use_atr': False, 'bull_use_adx': False, 'bull_use_spike': False, 'bull_rsi_required': True, 'bear_strategy': 'mean_reversion', 'bear_bb_std_mult': 2.020496567093764, 'bear_rsi_os': 42, 'bear_rsi_ob': 83, 'bear_adx_thresh': 21.128953837211466, 'bear_atr_min_pct': 0.020771529049192876, 'bear_atr_max_pct': 0.10127805915381745, 'bear_tp_mult': 2.7507612198843447, 'bear_tsl_mult': 0.5658957652980728, 'bear_time_stop': 203, 'bear_use_sma': False, 'bear_use_ema': True, 'bear_use_atr': False, 'bear_use_adx': True, 'bear_use_spike': False, 'bear_rsi_required': True, 'sideways_strategy': 'breakout', 'sideways_bb_std_mult': 0.9245891454926956, 'sideways_rsi_os': 17, 'sideways_rsi_ob': 73, 'sideways_adx_thresh': 31.112278480103335, 'sideways_atr_min_pct': 0.0022872033153852225, 'sideways_atr_max_pct': 0.10081397015440798, 'sideways_tp_mult': 1.4247384966837568, 'sideways_tsl_mult': 0.4260475736391273, 'sideways_time_stop': 89, 'sideways_use_sma': True, 'sideways_use_ema': True, 'sideways_use_atr': False, 'sideways_use_adx': False, 'sideways_use_spike': False, 'sideways_rsi_required': False}.
[I 2025-08-31 10:05:35,649] Trial 347 finished with values: [-1000000000.0, 1000000000.0] and parameters: {'p_sma': 50, 'p_std': 19, 'p_atr': 29, 'p_adx': 9, 'rsi_period': 68, 'ema1': 28, 'ema2': 42, 'slip_atr_k': 0.17579275059024665, 'slip_spread_k': 0.019674237152206953, 'spread_hl_frac': 0.013504310295178516, 'bb_std_mult': 1.9353868031826233, 'rsi_os': 12, 'rsi_ob': 48, 'vol_spike': 0.12810585866667817, 'adx_thresh': 18.514616460400916, 'atr_min_pct': 0.013245294726329338, 'atr_max_pct': 0.11193923327119881, 'tp_mult': 2.8532572081019603, 'tsl_mult': 0.5372912809119099, 'strategy': 'breakout', 'time_stop': 91, 'use_sma': False, 'use_atr': False, 'use_adx': True, 'use_ema': False, 'use_spike': True, 'rsi_required': True, 'edge_k': 0.914934951027053, 'edge_cap': 0.4048798143203638, 'bull_strategy': 'mean_reversion', 'bull_bb_std_mult': 1.7973166416026105, 'bull_rsi_os': 47, 'bull_rsi_ob': 71, 'bull_adx_thresh': 17.426389975882497, 'bull_atr_min_pct': 0.020583630684058843, 'bull_atr_max_pct': 0.11507185038192258, 'bull_tp_mult': 2.169343627893544, 'bull_tsl_mult': 0.6990460304079421, 'bull_time_stop': 35, 'bull_use_sma': False, 'bull_use_ema': False, 'bull_use_atr': False, 'bull_use_adx': False, 'bull_use_spike': False, 'bull_rsi_required': True, 'bear_strategy': 'mean_reversion', 'bear_bb_std_mult': 3.1631265336241916, 'bear_rsi_os': 11, 'bear_rsi_ob': 82, 'bear_adx_thresh': 20.420068226875273, 'bear_atr_min_pct': 0.01757316713126101, 'bear_atr_max_pct': 0.149687935750044, 'bear_tp_mult': 2.0546858410597046, 'bear_tsl_mult': 0.4819922221316475, 'bear_time_stop': 243, 'bear_use_sma': False, 'bear_use_ema': True, 'bear_use_atr': True, 'bear_use_adx': True, 'bear_use_spike': False, 'bear_rsi_required': True, 'sideways_strategy': 'breakout', 'sideways_bb_std_mult': 1.096128113335875, 'sideways_rsi_os': 14, 'sideways_rsi_ob': 78, 'sideways_adx_thresh': 33.89957464921358, 'sideways_atr_min_pct': 0.010687000651103666, 'sideways_atr_max_pct': 0.0322770154918125, 'sideways_tp_mult': 2.3665005332768447, 'sideways_tsl_mult': 0.936276787843409, 'sideways_time_stop': 238, 'sideways_use_sma': False, 'sideways_use_ema': False, 'sideways_use_atr': False, 'sideways_use_adx': False, 'sideways_use_spike': False, 'sideways_rsi_required': False}.
[I 2025-08-31 10:05:35,760] Trial 348 finished with values: [-1000000000.0, 1000000000.0] and parameters: {'p_sma': 45, 'p_std': 17, 'p_atr': 29, 'p_adx': 23, 'rsi_period': 78, 'ema1': 21, 'ema2': 42, 'slip_atr_k': 0.038995582064577886, 'slip_spread_k': 0.7256279165048012, 'spread_hl_frac': 0.038550369234124804, 'bb_std_mult': 3.2903112989539665, 'rsi_os': 19, 'rsi_ob': 46, 'vol_spike': 0.036500716661591645, 'adx_thresh': 6.23629024685024, 'atr_min_pct': 0.021397479502955247, 'atr_max_pct': 0.1401913513772438, 'tp_mult': 2.789302572462948, 'tsl_mult': 0.6493715742229298, 'strategy': 'breakout', 'time_stop': 85, 'use_sma': False, 'use_atr': False, 'use_adx': True, 'use_ema': False, 'use_spike': True, 'rsi_required': True, 'edge_k': 1.8523917954113047, 'edge_cap': 0.8503256901924621, 'bull_strategy': 'mean_reversion', 'bull_bb_std_mult': 1.3056229699313728, 'bull_rsi_os': 31, 'bull_rsi_ob': 66, 'bull_adx_thresh': 9.936163269976207, 'bull_atr_min_pct': 0.013277299596995787, 'bull_atr_max_pct': 0.11632479606244615, 'bull_tp_mult': 2.294684219947926, 'bull_tsl_mult': 0.7034133447876961, 'bull_time_stop': 211, 'bull_use_sma': False, 'bull_use_ema': False, 'bull_use_atr': False, 'bull_use_adx': False, 'bull_use_spike': False, 'bull_rsi_required': False, 'bear_strategy': 'mean_reversion', 'bear_bb_std_mult': 2.621412496199129, 'bear_rsi_os': 36, 'bear_rsi_ob': 78, 'bear_adx_thresh': 20.279555879649305, 'bear_atr_min_pct': 0.0056573949429344315, 'bear_atr_max_pct': 0.1495633948929529, 'bear_tp_mult': 2.606974413934073, 'bear_tsl_mult': 0.49244118012267507, 'bear_time_stop': 160, 'bear_use_sma': False, 'bear_use_ema': True, 'bear_use_atr': True, 'bear_use_adx': True, 'bear_use_spike': False, 'bear_rsi_required': True, 'sideways_strategy': 'breakout', 'sideways_bb_std_mult': 0.9157726628887838, 'sideways_rsi_os': 6, 'sideways_rsi_ob': 64, 'sideways_adx_thresh': 34.04713639050781, 'sideways_atr_min_pct': 0.010835343000725991, 'sideways_atr_max_pct': 0.12195477524290062, 'sideways_tp_mult': 1.431514869172921, 'sideways_tsl_mult': 0.5929625327675863, 'sideways_time_stop': 239, 'sideways_use_sma': False, 'sideways_use_ema': False, 'sideways_use_atr': False, 'sideways_use_adx': False, 'sideways_use_spike': False, 'sideways_rsi_required': False}.
[I 2025-08-31 10:05:37,011] Trial 349 finished with values: [-1000000000.0, 1000000000.0] and parameters: {'p_sma': 45, 'p_std': 16, 'p_atr': 12, 'p_adx': 11, 'rsi_period': 79, 'ema1': 22, 'ema2': 39, 'slip_atr_k': 0.17191474117320527, 'slip_spread_k': 0.7195757175748958, 'spread_hl_frac': 0.03897991462736443, 'bb_std_mult': 1.9213714530301484, 'rsi_os': 26, 'rsi_ob': 49, 'vol_spike': 0.26227059463892494, 'adx_thresh': 6.274141694683123, 'atr_min_pct': 0.013097224115538049, 'atr_max_pct': 0.13313978731173026, 'tp_mult': 1.9362141606950605, 'tsl_mult': 0.8560184034545159, 'strategy': 'breakout', 'time_stop': 86, 'use_sma': False, 'use_atr': False, 'use_adx': True, 'use_ema': False, 'use_spike': True, 'rsi_required': False, 'edge_k': 1.8562004617793977, 'edge_cap': 0.3403248125811166, 'bull_strategy': 'mean_reversion', 'bull_bb_std_mult': 2.4176084083587095, 'bull_rsi_os': 7, 'bull_rsi_ob': 66, 'bull_adx_thresh': 15.687158411188417, 'bull_atr_min_pct': 0.013345948168107923, 'bull_atr_max_pct': 0.11590947652195813, 'bull_tp_mult': 2.262235768252859, 'bull_tsl_mult': 0.633842126259458, 'bull_time_stop': 157, 'bull_use_sma': True, 'bull_use_ema': False, 'bull_use_atr': False, 'bull_use_adx': False, 'bull_use_spike': False, 'bull_rsi_required': False, 'bear_strategy': 'breakout', 'bear_bb_std_mult': 2.6808821856535756, 'bear_rsi_os': 11, 'bear_rsi_ob': 87, 'bear_adx_thresh': 13.960883915183855, 'bear_atr_min_pct': 0.020587257318421107, 'bear_atr_max_pct': 0.14763891787238642, 'bear_tp_mult': 2.9658872664997586, 'bear_tsl_mult': 0.49680457680301504, 'bear_time_stop': 161, 'bear_use_sma': False, 'bear_use_ema': True, 'bear_use_atr': False, 'bear_use_adx': True, 'bear_use_spike': False, 'bear_rsi_required': True, 'sideways_strategy': 'breakout', 'sideways_bb_std_mult': 0.5715445704217592, 'sideways_rsi_os': 18, 'sideways_rsi_ob': 64, 'sideways_adx_thresh': 34.19224858844599, 'sideways_atr_min_pct': 0.001569931732696663, 'sideways_atr_max_pct': 0.07523851411744409, 'sideways_tp_mult': 1.4143187977002372, 'sideways_tsl_mult': 0.591591916368631, 'sideways_time_stop': 257, 'sideways_use_sma': True, 'sideways_use_ema': True, 'sideways_use_atr': False, 'sideways_use_adx': False, 'sideways_use_spike': False, 'sideways_rsi_required': False}.
[I 2025-08-31 10:05:37,026] Trial 350 finished with values: [-0.06333758426137615, 0.06315997335364815] and parameters: {'p_sma': 22, 'p_std': 19, 'p_atr': 7, 'p_adx': 9, 'rsi_period': 10, 'ema1': 21, 'ema2': 26, 'slip_atr_k': 0.1746825833977234, 'slip_spread_k': 0.4157024480385646, 'spread_hl_frac': 0.039176797017650554, 'bb_std_mult': 0.8726018933536951, 'rsi_os': 41, 'rsi_ob': 49, 'vol_spike': 0.13582354140176556, 'adx_thresh': 18.251386358641643, 'atr_min_pct': 0.016786252571881728, 'atr_max_pct': 0.1334583057371789, 'tp_mult': 2.8610930506177765, 'tsl_mult': 0.06338089547605044, 'strategy': 'breakout', 'time_stop': 148, 'use_sma': False, 'use_atr': False, 'use_adx': True, 'use_ema': True, 'use_spike': True, 'rsi_required': False, 'edge_k': 1.850752067819354, 'edge_cap': 0.1519950781898697, 'bull_strategy': 'mean_reversion', 'bull_bb_std_mult': 1.3640127432478577, 'bull_rsi_os': 40, 'bull_rsi_ob': 71, 'bull_adx_thresh': 31.426252838753683, 'bull_atr_min_pct': 0.007419811069215158, 'bull_atr_max_pct': 0.09301009774559771, 'bull_tp_mult': 2.277916725874669, 'bull_tsl_mult': 0.5963190601762979, 'bull_time_stop': 228, 'bull_use_sma': True, 'bull_use_ema': True, 'bull_use_atr': False, 'bull_use_adx': False, 'bull_use_spike': False, 'bull_rsi_required': False, 'bear_strategy': 'breakout', 'bear_bb_std_mult': 2.5997503850352746, 'bear_rsi_os': 9, 'bear_rsi_ob': 87, 'bear_adx_thresh': 20.33140914300996, 'bear_atr_min_pct': 0.021255091145070338, 'bear_atr_max_pct': 0.1492236814877103, 'bear_tp_mult': 2.674453651178029, 'bear_tsl_mult': 0.4943990335927675, 'bear_time_stop': 161, 'bear_use_sma': False, 'bear_use_ema': True, 'bear_use_atr': False, 'bear_use_adx': True, 'bear_use_spike': True, 'bear_rsi_required': True, 'sideways_strategy': 'breakout', 'sideways_bb_std_mult': 1.0059084552518507, 'sideways_rsi_os': 22, 'sideways_rsi_ob': 78, 'sideways_adx_thresh': 24.542138353840556, 'sideways_atr_min_pct': 0.0016610120809044961, 'sideways_atr_max_pct': 0.07531670526321953, 'sideways_tp_mult': 2.3215797269661635, 'sideways_tsl_mult': 0.11418018482451675, 'sideways_time_stop': 55, 'sideways_use_sma': True, 'sideways_use_ema': True, 'sideways_use_atr': False, 'sideways_use_adx': False, 'sideways_use_spike': False, 'sideways_rsi_required': False}.
