[I 2025-08-31 10:44:34,643] Trial 657 finished with values: [-1000000000.0, 1000000000.0] and parameters: {'p_sma': 14, 'p_std': 26, 'p_atr': 11, 'p_adx': 25, 'rsi_period': 23, 'ema1': 11, 'ema2': 36, 'slip_atr_k': 0.19078397591578933, 'slip_spread_k': 0.2205066638377981, 'spread_hl_frac': 0.045261579839827155, 'bb_std_mult': 1.2785595086711758, 'rsi_os': 28, 'rsi_ob': 93, 'vol_spike': 0.2945232387049464, 'adx_thresh': 24.502349875513143, 'atr_min_pct': 0.0131224888359342, 'atr_max_pct': 0.12434926583287913, 'tp_mult': 1.917938369581114, 'tsl_mult': 0.038143796582509715, 'strategy': 'breakout', 'time_stop': 134, 'use_sma': False, 'use_atr': True, 'use_adx': False, 'use_ema': True, 'use_spike': False, 'rsi_required': True, 'edge_k': 1.1857915951918847, 'edge_cap': 0.9601914389339367, 'bull_strategy': 'mean_reversion', 'bull_bb_std_mult': 1.14435846611232, 'bull_rsi_os': 28, 'bull_rsi_ob': 67, 'bull_adx_thresh': 32.01351108693456, 'bull_atr_min_pct': 0.024110447008849244, 'bull_atr_max_pct': 0.08970685864043747, 'bull_tp_mult': 2.6308318888035336, 'bull_tsl_mult': 0.9989104881269658, 'bull_time_stop': 131, 'bull_use_sma': True, 'bull_use_ema': False, 'bull_use_atr': False, 'bull_use_adx': False, 'bull_use_spike': True, 'bull_rsi_required': True, 'bear_strategy': 'breakout', 'bear_bb_std_mult': 2.8788148525834774, 'bear_rsi_os': 14, 'bear_rsi_ob': 75, 'bear_adx_thresh': 29.991017731482675, 'bear_atr_min_pct': 0.007315149727304197, 'bear_atr_max_pct': 0.10738152000665428, 'bear_tp_mult': 1.0107651191002571, 'bear_tsl_mult': 0.40914015059336484, 'bear_time_stop': 262, 'bear_use_sma': False, 'bear_use_ema': True, 'bear_use_atr': False, 'bear_use_adx': True, 'bear_use_spike': True, 'bear_rsi_required': False, 'sideways_strategy': 'mean_reversion', 'sideways_bb_std_mult': 1.6221666887911148, 'sideways_rsi_os': 5, 'sideways_rsi_ob': 93, 'sideways_adx_thresh': 29.779767424758713, 'sideways_atr_min_pct': 0.0006726239067971405, 'sideways_atr_max_pct': 0.11128172275607977, 'sideways_tp_mult': 1.2317833738187975, 'sideways_tsl_mult': 0.6544823974978872, 'sideways_time_stop': 35, 'sideways_use_sma': True, 'sideways_use_ema': False, 'sideways_use_atr': True, 'sideways_use_adx': True, 'sideways_use_spike': True, 'sideways_rsi_required': True}.
[I 2025-08-31 10:44:34,890] Trial 658 finished with values: [-1000000000.0, 1000000000.0] and parameters: {'p_sma': 14, 'p_std': 21, 'p_atr': 27, 'p_adx': 20, 'rsi_period': 22, 'ema1': 11, 'ema2': 36, 'slip_atr_k': 0.016009602358287606, 'slip_spread_k': 0.10870365904911597, 'spread_hl_frac': 0.012802239782327446, 'bb_std_mult': 2.4992501982740696, 'rsi_os': 40, 'rsi_ob': 86, 'vol_spike': 0.24879562117374449, 'adx_thresh': 24.644132150001052, 'atr_min_pct': 0.012985785410937768, 'atr_max_pct': 0.045402514516494595, 'tp_mult': 1.9197782537575705, 'tsl_mult': 0.8625431272669486, 'strategy': 'breakout', 'time_stop': 134, 'use_sma': False, 'use_atr': True, 'use_adx': False, 'use_ema': True, 'use_spike': False, 'rsi_required': True, 'edge_k': 1.9180462640813423, 'edge_cap': 0.6219703557475051, 'bull_strategy': 'mean_reversion', 'bull_bb_std_mult': 1.132690250606178, 'bull_rsi_os': 28, 'bull_rsi_ob': 49, 'bull_adx_thresh': 28.855112362552614, 'bull_atr_min_pct': 0.006752688222846866, 'bull_atr_max_pct': 0.05643930519094592, 'bull_tp_mult': 2.4488590677880704, 'bull_tsl_mult': 0.17818141218703326, 'bull_time_stop': 80, 'bull_use_sma': True, 'bull_use_ema': False, 'bull_use_atr': False, 'bull_use_adx': False, 'bull_use_spike': True, 'bull_rsi_required': True, 'bear_strategy': 'breakout', 'bear_bb_std_mult': 1.7635028544295737, 'bear_rsi_os': 30, 'bear_rsi_ob': 80, 'bear_adx_thresh': 17.384958434748867, 'bear_atr_min_pct': 0.007120219452549749, 'bear_atr_max_pct': 0.037533990719162545, 'bear_tp_mult': 1.9498920838425895, 'bear_tsl_mult': 0.23948600027945915, 'bear_time_stop': 157, 'bear_use_sma': False, 'bear_use_ema': True, 'bear_use_atr': False, 'bear_use_adx': True, 'bear_use_spike': True, 'bear_rsi_required': False, 'sideways_strategy': 'mean_reversion', 'sideways_bb_std_mult': 0.8943352076389147, 'sideways_rsi_os': 5, 'sideways_rsi_ob': 55, 'sideways_adx_thresh': 29.548727875992395, 'sideways_atr_min_pct': 0.0299711419290846, 'sideways_atr_max_pct': 0.11151941186364256, 'sideways_tp_mult': 2.8064644031056276, 'sideways_tsl_mult': 0.12960055981998966, 'sideways_time_stop': 245, 'sideways_use_sma': True, 'sideways_use_ema': False, 'sideways_use_atr': True, 'sideways_use_adx': True, 'sideways_use_spike': True, 'sideways_rsi_required': True}.
[I 2025-08-31 10:44:35,160] Trial 659 finished with values: [-1000000000.0, 1000000000.0] and parameters: {'p_sma': 11, 'p_std': 48, 'p_atr': 27, 'p_adx': 20, 'rsi_period': 23, 'ema1': 30, 'ema2': 26, 'slip_atr_k': 0.19056144072084205, 'slip_spread_k': 0.2196474679202964, 'spread_hl_frac': 0.04522385403763762, 'bb_std_mult': 3.387449058093611, 'rsi_os': 7, 'rsi_ob': 85, 'vol_spike': 0.27676239561914623, 'adx_thresh': 21.62417695591191, 'atr_min_pct': 0.010373461481017454, 'atr_max_pct': 0.04710212155756785, 'tp_mult': 2.9505357583450604, 'tsl_mult': 0.8650434690225353, 'strategy': 'mean_reversion', 'time_stop': 133, 'use_sma': True, 'use_atr': True, 'use_adx': False, 'use_ema': True, 'use_spike': False, 'rsi_required': False, 'edge_k': 1.9193397201248381, 'edge_cap': 0.12449968484178031, 'bull_strategy': 'breakout', 'bull_bb_std_mult': 1.0746301464752106, 'bull_rsi_os': 52, 'bull_rsi_ob': 88, 'bull_adx_thresh': 28.575535960534634, 'bull_atr_min_pct': 0.028835901064030202, 'bull_atr_max_pct': 0.08921321439704367, 'bull_tp_mult': 2.613186771659908, 'bull_tsl_mult': 0.9998119357104083, 'bull_time_stop': 80, 'bull_use_sma': True, 'bull_use_ema': False, 'bull_use_atr': False, 'bull_use_adx': False, 'bull_use_spike': True, 'bull_rsi_required': True, 'bear_strategy': 'breakout', 'bear_bb_std_mult': 2.8702697157053625, 'bear_rsi_os': 14, 'bear_rsi_ob': 75, 'bear_adx_thresh': 16.13946047636275, 'bear_atr_min_pct': 0.016954756511393825, 'bear_atr_max_pct': 0.10723370817397596, 'bear_tp_mult': 2.1018693440105958, 'bear_tsl_mult': 0.3760968029290127, 'bear_time_stop': 250, 'bear_use_sma': False, 'bear_use_ema': True, 'bear_use_atr': False, 'bear_use_adx': True, 'bear_use_spike': True, 'bear_rsi_required': False, 'sideways_strategy': 'mean_reversion', 'sideways_bb_std_mult': 0.9074057364740473, 'sideways_rsi_os': 28, 'sideways_rsi_ob': 84, 'sideways_adx_thresh': 17.343371325279254, 'sideways_atr_min_pct': 0.00816889303574787, 'sideways_atr_max_pct': 0.11058918095637335, 'sideways_tp_mult': 2.7907168863002254, 'sideways_tsl_mult': 0.0010917396051189493, 'sideways_time_stop': 245, 'sideways_use_sma': True, 'sideways_use_ema': False, 'sideways_use_atr': True, 'sideways_use_adx': True, 'sideways_use_spike': True, 'sideways_rsi_required': True}.
[I 2025-08-31 10:45:08,449] Trial 663 finished with values: [-0.02753439747938613, 0.027401509604725555] and parameters: {'p_sma': 29, 'p_std': 31, 'p_atr': 28, 'p_adx': 14, 'rsi_period': 83, 'ema1': 28, 'ema2': 17, 'slip_atr_k': 0.17825286732832663, 'slip_spread_k': 0.9545916026929802, 'spread_hl_frac': 0.010386112534609663, 'bb_std_mult': 1.0821282449015195, 'rsi_os': 37, 'rsi_ob': 77, 'vol_spike': 0.29359850008071253, 'adx_thresh': 20.685535588252606, 'atr_min_pct': 0.01250157977339917, 'atr_max_pct': 0.12185181095532761, 'tp_mult': 2.9003634941455605, 'tsl_mult': 0.6590055003713823, 'strategy': 'breakout', 'time_stop': 152, 'use_sma': False, 'use_atr': False, 'use_adx': False, 'use_ema': True, 'use_spike': False, 'rsi_required': False, 'edge_k': 0.309085790874727, 'edge_cap': 0.15450059856663204, 'bull_strategy': 'mean_reversion', 'bull_bb_std_mult': 1.5564016271875944, 'bull_rsi_os': 24, 'bull_rsi_ob': 70, 'bull_adx_thresh': 30.041169404420955, 'bull_atr_min_pct': 0.0014688288762851505, 'bull_atr_max_pct': 0.023494277975670483, 'bull_tp_mult': 1.1903837270888928, 'bull_tsl_mult': 0.10738683663379489, 'bull_time_stop': 58, 'bull_use_sma': False, 'bull_use_ema': False, 'bull_use_atr': True, 'bull_use_adx': False, 'bull_use_spike': False, 'bull_rsi_required': False, 'bear_strategy': 'mean_reversion', 'bear_bb_std_mult': 2.783634834169495, 'bear_rsi_os': 36, 'bear_rsi_ob': 94, 'bear_adx_thresh': 19.391098102909, 'bear_atr_min_pct': 0.006297757518793172, 'bear_atr_max_pct': 0.09576024882411589, 'bear_tp_mult': 1.989849479178824, 'bear_tsl_mult': 0.2954853380167547, 'bear_time_stop': 276, 'bear_use_sma': False, 'bear_use_ema': False, 'bear_use_atr': False, 'bear_use_adx': True, 'bear_use_spike': True, 'bear_rsi_required': True, 'sideways_strategy': 'breakout', 'sideways_bb_std_mult': 0.9692703555501182, 'sideways_rsi_os': 44, 'sideways_rsi_ob': 95, 'sideways_adx_thresh': 29.12611794412378, 'sideways_atr_min_pct': 0.002874022392148014, 'sideways_atr_max_pct': 0.14136975413023217, 'sideways_tp_mult': 1.0165403911805413, 'sideways_tsl_mult': 0.08475378186007221, 'sideways_time_stop': 235, 'sideways_use_sma': True, 'sideways_use_ema': True, 'sideways_use_atr': False, 'sideways_use_adx': False, 'sideways_use_spike': True, 'sideways_rsi_required': False}.
[I 2025-08-31 10:45:08,461] Trial 662 finished with values: [-1000000000.0, 1000000000.0] and parameters: {'p_sma': 11, 'p_std': 48, 'p_atr': 22, 'p_adx': 14, 'rsi_period': 29, 'ema1': 28, 'ema2': 47, 'slip_atr_k': 0.21020993201270646, 'slip_spread_k': 0.9566894006174183, 'spread_hl_frac': 0.010364165822897543, 'bb_std_mult': 2.92069234107822, 'rsi_os': 43, 'rsi_ob': 83, 'vol_spike': 0.04926725799517641, 'adx_thresh': 25.736062924710332, 'atr_min_pct': 0.010417431668165866, 'atr_max_pct': 0.06470957990246877, 'tp_mult': 2.9429393514059887, 'tsl_mult': 0.08878755650587648, 'strategy': 'breakout', 'time_stop': 153, 'use_sma': False, 'use_atr': False, 'use_adx': False, 'use_ema': True, 'use_spike': False, 'rsi_required': False, 'edge_k': 1.7949135519485346, 'edge_cap': 0.37027488272610076, 'bull_strategy': 'mean_reversion', 'bull_bb_std_mult': 1.260312042597027, 'bull_rsi_os': 12, 'bull_rsi_ob': 66, 'bull_adx_thresh': 30.291868812147403, 'bull_atr_min_pct': 0.0015508464758547964, 'bull_atr_max_pct': 0.08357292102072794, 'bull_tp_mult': 2.289249828980709, 'bull_tsl_mult': 0.9650962615462977, 'bull_time_stop': 71, 'bull_use_sma': False, 'bull_use_ema': False, 'bull_use_atr': True, 'bull_use_adx': False, 'bull_use_spike': False, 'bull_rsi_required': False, 'bear_strategy': 'mean_reversion', 'bear_bb_std_mult': 1.8482692694034437, 'bear_rsi_os': 25, 'bear_rsi_ob': 78, 'bear_adx_thresh': 16.153214562898164, 'bear_atr_min_pct': 0.012996288173355713, 'bear_atr_max_pct': 0.08719047103954293, 'bear_tp_mult': 1.9836172829322267, 'bear_tsl_mult': 0.4955029274008435, 'bear_time_stop': 249, 'bear_use_sma': False, 'bear_use_ema': False, 'bear_use_atr': False, 'bear_use_adx': True, 'bear_use_spike': True, 'bear_rsi_required': True, 'sideways_strategy': 'breakout', 'sideways_bb_std_mult': 0.9643522904394347, 'sideways_rsi_os': 28, 'sideways_rsi_ob': 84, 'sideways_adx_thresh': 9.92291064465302, 'sideways_atr_min_pct': 0.009396856355110516, 'sideways_atr_max_pct': 0.11731354691572114, 'sideways_tp_mult': 2.8473745571451223, 'sideways_tsl_mult': 0.06201931592035844, 'sideways_time_stop': 236, 'sideways_use_sma': True, 'sideways_use_ema': True, 'sideways_use_atr': False, 'sideways_use_adx': False, 'sideways_use_spike': True, 'sideways_rsi_required': False}.
[I 2025-08-31 10:45:08,738] Trial 661 finished with values: [-1000000000.0, 1000000000.0] and parameters: {'p_sma': 11, 'p_std': 36, 'p_atr': 27, 'p_adx': 8, 'rsi_period': 22, 'ema1': 29, 'ema2': 39, 'slip_atr_k': 0.015491167661727354, 'slip_spread_k': 0.036754781374784454, 'spread_hl_frac': 0.010509270992966063, 'bb_std_mult': 3.599288823823362, 'rsi_os': 37, 'rsi_ob': 82, 'vol_spike': 0.027317099129285052, 'adx_thresh': 20.476681725230435, 'atr_min_pct': 0.007778050967284023, 'atr_max_pct': 0.12271046442650178, 'tp_mult': 2.942517441002177, 'tsl_mult': 0.09464068780055063, 'strategy': 'breakout', 'time_stop': 155, 'use_sma': False, 'use_atr': False, 'use_adx': False, 'use_ema': True, 'use_spike': False, 'rsi_required': False, 'edge_k': 0.5637884903637798, 'edge_cap': 0.6154872494604183, 'bull_strategy': 'mean_reversion', 'bull_bb_std_mult': 1.0567669553335635, 'bull_rsi_os': 26, 'bull_rsi_ob': 66, 'bull_adx_thresh': 30.313027936748643, 'bull_atr_min_pct': 0.02818713904509153, 'bull_atr_max_pct': 0.05667694284914602, 'bull_tp_mult': 2.293803937655024, 'bull_tsl_mult': 0.9672072643938396, 'bull_time_stop': 93, 'bull_use_sma': False, 'bull_use_ema': False, 'bull_use_atr': True, 'bull_use_adx': False, 'bull_use_spike': True, 'bull_rsi_required': False, 'bear_strategy': 'mean_reversion', 'bear_bb_std_mult': 3.210843635415532, 'bear_rsi_os': 26, 'bear_rsi_ob': 79, 'bear_adx_thresh': 19.441033439018653, 'bear_atr_min_pct': 0.00695909464048987, 'bear_atr_max_pct': 0.09740617208894392, 'bear_tp_mult': 1.97593104180166, 'bear_tsl_mult': 0.20674971460252223, 'bear_time_stop': 251, 'bear_use_sma': False, 'bear_use_ema': False, 'bear_use_atr': False, 'bear_use_adx': True, 'bear_use_spike': True, 'bear_rsi_required': True, 'sideways_strategy': 'breakout', 'sideways_bb_std_mult': 0.9667869207690495, 'sideways_rsi_os': 48, 'sideways_rsi_ob': 84, 'sideways_adx_thresh': 29.11103052833589, 'sideways_atr_min_pct': 0.01585190334882479, 'sideways_atr_max_pct': 0.1169119841248402, 'sideways_tp_mult': 2.7941995307169303, 'sideways_tsl_mult': 0.06450547055555597, 'sideways_time_stop': 245, 'sideways_use_sma': True, 'sideways_use_ema': True, 'sideways_use_atr': True, 'sideways_use_adx': True, 'sideways_use_spike': True, 'sideways_rsi_required': False}.
[I 2025-08-31 10:45:08,739] Trial 660 finished with values: [-1000000000.0, 1000000000.0] and parameters: {'p_sma': 37, 'p_std': 48, 'p_atr': 27, 'p_adx': 12, 'rsi_period': 28, 'ema1': 17, 'ema2': 39, 'slip_atr_k': 0.17940198265191104, 'slip_spread_k': 0.9523487410965576, 'spread_hl_frac': 0.010556567575427446, 'bb_std_mult': 1.0612022322055341, 'rsi_os': 43, 'rsi_ob': 82, 'vol_spike': 0.27873437052582895, 'adx_thresh': 12.923111401154298, 'atr_min_pct': 0.010414186036654383, 'atr_max_pct': 0.11573015650832133, 'tp_mult': 2.937384043349321, 'tsl_mult': 0.2644187380864055, 'strategy': 'breakout', 'time_stop': 154, 'use_sma': False, 'use_atr': False, 'use_adx': False, 'use_ema': True, 'use_spike': False, 'rsi_required': False, 'edge_k': 1.9119299588737366, 'edge_cap': 0.884642941706804, 'bull_strategy': 'mean_reversion', 'bull_bb_std_mult': 1.0637477338808736, 'bull_rsi_os': 26, 'bull_rsi_ob': 56, 'bull_adx_thresh': 7.310505324165469, 'bull_atr_min_pct': 0.006788865249453101, 'bull_atr_max_pct': 0.08357961991332823, 'bull_tp_mult': 2.379701389154873, 'bull_tsl_mult': 0.10899321355991948, 'bull_time_stop': 55, 'bull_use_sma': False, 'bull_use_ema': False, 'bull_use_atr': True, 'bull_use_adx': False, 'bull_use_spike': True, 'bull_rsi_required': False, 'bear_strategy': 'mean_reversion', 'bear_bb_std_mult': 2.8495469112898144, 'bear_rsi_os': 26, 'bear_rsi_ob': 76, 'bear_adx_thresh': 19.947491968873518, 'bear_atr_min_pct': 0.017049325259490527, 'bear_atr_max_pct': 0.09621619546339463, 'bear_tp_mult': 1.993627837915166, 'bear_tsl_mult': 0.4565564327842171, 'bear_time_stop': 250, 'bear_use_sma': False, 'bear_use_ema': False, 'bear_use_atr': False, 'bear_use_adx': True, 'bear_use_spike': True, 'bear_rsi_required': True, 'sideways_strategy': 'breakout', 'sideways_bb_std_mult': 0.9209565586849078, 'sideways_rsi_os': 55, 'sideways_rsi_ob': 55, 'sideways_adx_thresh': 29.14565588175124, 'sideways_atr_min_pct': 0.0028553319809373236, 'sideways_atr_max_pct': 0.14514899739283793, 'sideways_tp_mult': 2.788890288839335, 'sideways_tsl_mult': 0.06127694278212684, 'sideways_time_stop': 244, 'sideways_use_sma': True, 'sideways_use_ema': True, 'sideways_use_atr': True, 'sideways_use_adx': True, 'sideways_use_spike': True, 'sideways_rsi_required': False}.
[I 2025-08-31 10:45:41,880] Trial 664 finished with values: [-1000000000.0, 1000000000.0] and parameters: {'p_sma': 10, 'p_std': 36, 'p_atr': 24, 'p_adx': 8, 'rsi_period': 68, 'ema1': 17, 'ema2': 39, 'slip_atr_k': 0.18474346349728926, 'slip_spread_k': 0.07772028615524613, 'spread_hl_frac': 0.008862724908141547, 'bb_std_mult': 1.272902340180047, 'rsi_os': 41, 'rsi_ob': 82, 'vol_spike': 0.2687620226059329, 'adx_thresh': 19.651397819830514, 'atr_min_pct': 0.0057595057997875294, 'atr_max_pct': 0.11705471198056427, 'tp_mult': 2.8949862330933, 'tsl_mult': 0.7450542032987801, 'strategy': 'breakout', 'time_stop': 88, 'use_sma': False, 'use_atr': False, 'use_adx': False, 'use_ema': True, 'use_spike': True, 'rsi_required': True, 'edge_k': 1.8943366673980548, 'edge_cap': 0.0782980580992779, 'bull_strategy': 'mean_reversion', 'bull_bb_std_mult': 2.126799471687473, 'bull_rsi_os': 26, 'bull_rsi_ob': 57, 'bull_adx_thresh': 31.032622086693486, 'bull_atr_min_pct': 0.006995481541646114, 'bull_atr_max_pct': 0.04461032421574721, 'bull_tp_mult': 2.3674361335931478, 'bull_tsl_mult': 0.9693727665344127, 'bull_time_stop': 94, 'bull_use_sma': True, 'bull_use_ema': False, 'bull_use_atr': False, 'bull_use_adx': False, 'bull_use_spike': False, 'bull_rsi_required': True, 'bear_strategy': 'breakout', 'bear_bb_std_mult': 2.8634533638855655, 'bear_rsi_os': 31, 'bear_rsi_ob': 55, 'bear_adx_thresh': 20.839052682798755, 'bear_atr_min_pct': 5.943510581679287e-05, 'bear_atr_max_pct': 0.05237872894894963, 'bear_tp_mult': 1.4574930829066604, 'bear_tsl_mult': 0.8596691351037176, 'bear_time_stop': 52, 'bear_use_sma': False, 'bear_use_ema': True, 'bear_use_atr': True, 'bear_use_adx': True, 'bear_use_spike': True, 'bear_rsi_required': True, 'sideways_strategy': 'breakout', 'sideways_bb_std_mult': 1.0524334654876912, 'sideways_rsi_os': 11, 'sideways_rsi_ob': 94, 'sideways_adx_thresh': 28.72002278206036, 'sideways_atr_min_pct': 0.016585047446489812, 'sideways_atr_max_pct': 0.05469702455425156, 'sideways_tp_mult': 1.325012469256769, 'sideways_tsl_mult': 0.7928079564615073, 'sideways_time_stop': 110, 'sideways_use_sma': False, 'sideways_use_ema': True, 'sideways_use_atr': False, 'sideways_use_adx': False, 'sideways_use_spike': True, 'sideways_rsi_required': False}.
[I 2025-08-31 10:45:41,975] Trial 666 finished with values: [-1000000000.0, 1000000000.0] and parameters: {'p_sma': 10, 'p_std': 49, 'p_atr': 12, 'p_adx': 9, 'rsi_period': 25, 'ema1': 24, 'ema2': 20, 'slip_atr_k': 0.005198952584165181, 'slip_spread_k': 0.07516749859624824, 'spread_hl_frac': 0.011569251599585282, 'bb_std_mult': 2.4254340242011034, 'rsi_os': 41, 'rsi_ob': 84, 'vol_spike': 0.03961410434551843, 'adx_thresh': 23.231481136662918, 'atr_min_pct': 0.02622892421166583, 'atr_max_pct': 0.11738091132432137, 'tp_mult': 2.1665584922629306, 'tsl_mult': 0.7646733141056054, 'strategy': 'mean_reversion', 'time_stop': 88, 'use_sma': True, 'use_atr': False, 'use_adx': True, 'use_ema': True, 'use_spike': True, 'rsi_required': True, 'edge_k': 0.36865309468638185, 'edge_cap': 0.4433605338601945, 'bull_strategy': 'breakout', 'bull_bb_std_mult': 0.9510781990886428, 'bull_rsi_os': 42, 'bull_rsi_ob': 83, 'bull_adx_thresh': 11.231954595575553, 'bull_atr_min_pct': 0.007352090241865021, 'bull_atr_max_pct': 0.03881156357920036, 'bull_tp_mult': 2.025796061593688, 'bull_tsl_mult': 0.9074145467326349, 'bull_time_stop': 72, 'bull_use_sma': True, 'bull_use_ema': True, 'bull_use_atr': False, 'bull_use_adx': True, 'bull_use_spike': False, 'bull_rsi_required': True, 'bear_strategy': 'breakout', 'bear_bb_std_mult': 3.0198862124597587, 'bear_rsi_os': 24, 'bear_rsi_ob': 49, 'bear_adx_thresh': 34.98810859168103, 'bear_atr_min_pct': 0.006112176980047242, 'bear_atr_max_pct': 0.12716279736232713, 'bear_tp_mult': 2.041976611190184, 'bear_tsl_mult': 0.982832014998145, 'bear_time_stop': 259, 'bear_use_sma': True, 'bear_use_ema': True, 'bear_use_atr': True, 'bear_use_adx': False, 'bear_use_spike': True, 'bear_rsi_required': True, 'sideways_strategy': 'breakout', 'sideways_bb_std_mult': 2.2897154990952187, 'sideways_rsi_os': 11, 'sideways_rsi_ob': 79, 'sideways_adx_thresh': 29.86930582963488, 'sideways_atr_min_pct': 2.6792306810503527e-05, 'sideways_atr_max_pct': 0.12788840592177986, 'sideways_tp_mult': 2.9656318756706592, 'sideways_tsl_mult': 0.3745405071055923, 'sideways_time_stop': 255, 'sideways_use_sma': False, 'sideways_use_ema': True, 'sideways_use_atr': False, 'sideways_use_adx': False, 'sideways_use_spike': True, 'sideways_rsi_required': False}.
