[I 2025-08-31 10:06:42,376] Trial 359 finished with values: [-0.06313856999636625, 0.06307665329891485] and parameters: {'p_sma': 24, 'p_std': 5, 'p_atr': 27, 'p_adx': 8, 'rsi_period': 19, 'ema1': 20, 'ema2': 22, 'slip_atr_k': 0.14755685901304225, 'slip_spread_k': 0.4357721863329503, 'spread_hl_frac': 0.022937671649768822, 'bb_std_mult': 3.484729626717237, 'rsi_os': 21, 'rsi_ob': 89, 'vol_spike': 0.12412882442332239, 'adx_thresh': 27.600381520146446, 'atr_min_pct': 0.022678297760927044, 'atr_max_pct': 0.12458932657885248, 'tp_mult': 2.859222691325088, 'tsl_mult': 0.03825547015542986, 'strategy': 'breakout', 'time_stop': 291, 'use_sma': False, 'use_atr': False, 'use_adx': False, 'use_ema': False, 'use_spike': False, 'rsi_required': True, 'edge_k': 1.8057128570235716, 'edge_cap': 0.09398453723288669, 'bull_strategy': 'mean_reversion', 'bull_bb_std_mult': 2.7344830582118163, 'bull_rsi_os': 31, 'bull_rsi_ob': 64, 'bull_adx_thresh': 31.243512934441778, 'bull_atr_min_pct': 0.01941340321851386, 'bull_atr_max_pct': 0.123448630710324, 'bull_tp_mult': 1.5974933745288769, 'bull_tsl_mult': 0.9994301831691541, 'bull_time_stop': 115, 'bull_use_sma': True, 'bull_use_ema': False, 'bull_use_atr': False, 'bull_use_adx': False, 'bull_use_spike': False, 'bull_rsi_required': True, 'bear_strategy': 'breakout', 'bear_bb_std_mult': 2.8345956339660425, 'bear_rsi_os': 23, 'bear_rsi_ob': 71, 'bear_adx_thresh': 21.819902652401773, 'bear_atr_min_pct': 0.014276078695194021, 'bear_atr_max_pct': 0.14558764851315417, 'bear_tp_mult': 2.5740432805467672, 'bear_tsl_mult': 0.5215272372415793, 'bear_time_stop': 260, 'bear_use_sma': False, 'bear_use_ema': True, 'bear_use_atr': False, 'bear_use_adx': True, 'bear_use_spike': False, 'bear_rsi_required': True, 'sideways_strategy': 'breakout', 'sideways_bb_std_mult': 1.9262959988134298, 'sideways_rsi_os': 26, 'sideways_rsi_ob': 63, 'sideways_adx_thresh': 32.36682862268221, 'sideways_atr_min_pct': 0.000561349313163485, 'sideways_atr_max_pct': 0.026199943879552507, 'sideways_tp_mult': 2.5789803903546806, 'sideways_tsl_mult': 0.3656484542083971, 'sideways_time_stop': 111, 'sideways_use_sma': True, 'sideways_use_ema': True, 'sideways_use_atr': False, 'sideways_use_adx': False, 'sideways_use_spike': True, 'sideways_rsi_required': False}.
[I 2025-08-31 10:06:43,028] Trial 363 finished with values: [-1000000000.0, 1000000000.0] and parameters: {'p_sma': 33, 'p_std': 35, 'p_atr': 21, 'p_adx': 8, 'rsi_period': 19, 'ema1': 20, 'ema2': 52, 'slip_atr_k': 0.06212824488689368, 'slip_spread_k': 0.130292596876128, 'spread_hl_frac': 0.012788393140108153, 'bb_std_mult': 0.9999756155033185, 'rsi_os': 37, 'rsi_ob': 48, 'vol_spike': 0.13037963352753398, 'adx_thresh': 7.110408164886142, 'atr_min_pct': 0.012063807490278603, 'atr_max_pct': 0.1415160808802316, 'tp_mult': 2.88440020045583, 'tsl_mult': 0.12766169308234077, 'strategy': 'mean_reversion', 'time_stop': 174, 'use_sma': False, 'use_atr': False, 'use_adx': True, 'use_ema': False, 'use_spike': False, 'rsi_required': True, 'edge_k': 1.8767220788435395, 'edge_cap': 0.4917891391103897, 'bull_strategy': 'mean_reversion', 'bull_bb_std_mult': 2.591079075006178, 'bull_rsi_os': 34, 'bull_rsi_ob': 64, 'bull_adx_thresh': 32.52172435455024, 'bull_atr_min_pct': 0.018196845183939974, 'bull_atr_max_pct': 0.1226145009307114, 'bull_tp_mult': 1.6055121694378216, 'bull_tsl_mult': 0.5511067362935841, 'bull_time_stop': 115, 'bull_use_sma': False, 'bull_use_ema': False, 'bull_use_atr': True, 'bull_use_adx': False, 'bull_use_spike': False, 'bull_rsi_required': True, 'bear_strategy': 'mean_reversion', 'bear_bb_std_mult': 0.5774539619172883, 'bear_rsi_os': 7, 'bear_rsi_ob': 51, 'bear_adx_thresh': 25.012474567842098, 'bear_atr_min_pct': 0.022590907349979965, 'bear_atr_max_pct': 0.13753531637314562, 'bear_tp_mult': 2.639637426542274, 'bear_tsl_mult': 0.06020471539160838, 'bear_time_stop': 233, 'bear_use_sma': True, 'bear_use_ema': True, 'bear_use_atr': True, 'bear_use_adx': True, 'bear_use_spike': False, 'bear_rsi_required': True, 'sideways_strategy': 'mean_reversion', 'sideways_bb_std_mult': 1.8136883664074004, 'sideways_rsi_os': 25, 'sideways_rsi_ob': 65, 'sideways_adx_thresh': 33.358216507875916, 'sideways_atr_min_pct': 0.0004856222606092165, 'sideways_atr_max_pct': 0.14663428556306587, 'sideways_tp_mult': 2.908789858621441, 'sideways_tsl_mult': 0.060844474464886, 'sideways_time_stop': 239, 'sideways_use_sma': False, 'sideways_use_ema': False, 'sideways_use_atr': False, 'sideways_use_adx': False, 'sideways_use_spike': False, 'sideways_rsi_required': True}.
[I 2025-08-31 10:06:43,042] Trial 361 finished with values: [-1000000000.0, 1000000000.0] and parameters: {'p_sma': 48, 'p_std': 8, 'p_atr': 29, 'p_adx': 8, 'rsi_period': 19, 'ema1': 10, 'ema2': 36, 'slip_atr_k': 0.052423222848182405, 'slip_spread_k': 0.9361732068270413, 'spread_hl_frac': 0.01310363701868586, 'bb_std_mult': 1.006077401726163, 'rsi_os': 36, 'rsi_ob': 48, 'vol_spike': 0.2369471987386662, 'adx_thresh': 7.831981579982389, 'atr_min_pct': 0.012050943592696551, 'atr_max_pct': 0.03614558164214762, 'tp_mult': 2.7518472841767165, 'tsl_mult': 0.8339793941436466, 'strategy': 'mean_reversion', 'time_stop': 141, 'use_sma': False, 'use_atr': False, 'use_adx': True, 'use_ema': False, 'use_spike': True, 'rsi_required': True, 'edge_k': 1.781536778069032, 'edge_cap': 0.8990010152880739, 'bull_strategy': 'mean_reversion', 'bull_bb_std_mult': 2.314971367793703, 'bull_rsi_os': 34, 'bull_rsi_ob': 61, 'bull_adx_thresh': 32.40616468550878, 'bull_atr_min_pct': 0.017847430441322316, 'bull_atr_max_pct': 0.016684353669773375, 'bull_tp_mult': 1.6039372657631692, 'bull_tsl_mult': 0.5472923118256978, 'bull_time_stop': 259, 'bull_use_sma': False, 'bull_use_ema': False, 'bull_use_atr': True, 'bull_use_adx': False, 'bull_use_spike': False, 'bull_rsi_required': True, 'bear_strategy': 'mean_reversion', 'bear_bb_std_mult': 2.836960397897904, 'bear_rsi_os': 29, 'bear_rsi_ob': 51, 'bear_adx_thresh': 7.76516765468617, 'bear_atr_min_pct': 0.014326862335823186, 'bear_atr_max_pct': 0.13690221637999675, 'bear_tp_mult': 2.6418214146108716, 'bear_tsl_mult': 0.46528382324909107, 'bear_time_stop': 91, 'bear_use_sma': True, 'bear_use_ema': True, 'bear_use_atr': True, 'bear_use_adx': True, 'bear_use_spike': False, 'bear_rsi_required': True, 'sideways_strategy': 'mean_reversion', 'sideways_bb_std_mult': 1.0058423036468551, 'sideways_rsi_os': 48, 'sideways_rsi_ob': 65, 'sideways_adx_thresh': 33.187201534070816, 'sideways_atr_min_pct': 0.0008206300624000072, 'sideways_atr_max_pct': 0.10532172543427666, 'sideways_tp_mult': 1.822784991340135, 'sideways_tsl_mult': 0.041585852393163085, 'sideways_time_stop': 81, 'sideways_use_sma': False, 'sideways_use_ema': False, 'sideways_use_atr': False, 'sideways_use_adx': False, 'sideways_use_spike': False, 'sideways_rsi_required': True}.
[I 2025-08-31 10:06:43,051] Trial 362 finished with values: [-1000000000.0, 1000000000.0] and parameters: {'p_sma': 33, 'p_std': 8, 'p_atr': 29, 'p_adx': 14, 'rsi_period': 19, 'ema1': 17, 'ema2': 36, 'slip_atr_k': 0.049711690712134785, 'slip_spread_k': 0.12884437464017812, 'spread_hl_frac': 0.04494985082989812, 'bb_std_mult': 3.4952947908576073, 'rsi_os': 29, 'rsi_ob': 48, 'vol_spike': 0.22126141430382262, 'adx_thresh': 6.996058303934476, 'atr_min_pct': 0.005341502724884114, 'atr_max_pct': 0.09629167302601985, 'tp_mult': 2.562289862072607, 'tsl_mult': 0.8340205491637681, 'strategy': 'mean_reversion', 'time_stop': 140, 'use_sma': False, 'use_atr': False, 'use_adx': True, 'use_ema': False, 'use_spike': True, 'rsi_required': True, 'edge_k': 1.8934388874986483, 'edge_cap': 0.20256395516153625, 'bull_strategy': 'mean_reversion', 'bull_bb_std_mult': 2.7308819516383744, 'bull_rsi_os': 34, 'bull_rsi_ob': 64, 'bull_adx_thresh': 32.442266221177924, 'bull_atr_min_pct': 0.017874150891972952, 'bull_atr_max_pct': 0.10493001950174066, 'bull_tp_mult': 1.5947124620318245, 'bull_tsl_mult': 0.20544617628526923, 'bull_time_stop': 259, 'bull_use_sma': False, 'bull_use_ema': False, 'bull_use_atr': True, 'bull_use_adx': False, 'bull_use_spike': False, 'bull_rsi_required': True, 'bear_strategy': 'mean_reversion', 'bear_bb_std_mult': 2.9367492262487196, 'bear_rsi_os': 54, 'bear_rsi_ob': 79, 'bear_adx_thresh': 25.41242876184601, 'bear_atr_min_pct': 0.0020383291154264984, 'bear_atr_max_pct': 0.14578662082791655, 'bear_tp_mult': 2.00955862985298, 'bear_tsl_mult': 0.46842927067464235, 'bear_time_stop': 231, 'bear_use_sma': True, 'bear_use_ema': True, 'bear_use_atr': True, 'bear_use_adx': True, 'bear_use_spike': False, 'bear_rsi_required': True, 'sideways_strategy': 'mean_reversion', 'sideways_bb_std_mult': 1.011706500304649, 'sideways_rsi_os': 21, 'sideways_rsi_ob': 65, 'sideways_adx_thresh': 18.695418932055052, 'sideways_atr_min_pct': 0.026767010813910835, 'sideways_atr_max_pct': 0.03586405653532079, 'sideways_tp_mult': 2.565204723729048, 'sideways_tsl_mult': 0.06143377885340558, 'sideways_time_stop': 241, 'sideways_use_sma': False, 'sideways_use_ema': False, 'sideways_use_atr': False, 'sideways_use_adx': False, 'sideways_use_spike': False, 'sideways_rsi_required': True}.
[I 2025-08-31 10:06:43,072] Trial 364 finished with values: [-1000000000.0, 1000000000.0] and parameters: {'p_sma': 48, 'p_std': 50, 'p_atr': 30, 'p_adx': 14, 'rsi_period': 41, 'ema1': 20, 'ema2': 30, 'slip_atr_k': 0.062265206857397684, 'slip_spread_k': 0.36034560155468265, 'spread_hl_frac': 0.013261865453781743, 'bb_std_mult': 1.0097690004251219, 'rsi_os': 25, 'rsi_ob': 50, 'vol_spike': 0.22160507389059853, 'adx_thresh': 7.691987016053254, 'atr_min_pct': 0.01185206221533065, 'atr_max_pct': 0.03648162322246075, 'tp_mult': 1.7127596838354455, 'tsl_mult': 0.8979030960131671, 'strategy': 'mean_reversion', 'time_stop': 182, 'use_sma': False, 'use_atr': False, 'use_adx': True, 'use_ema': False, 'use_spike': True, 'rsi_required': True, 'edge_k': 1.1137404962609025, 'edge_cap': 0.8946227100618993, 'bull_strategy': 'mean_reversion', 'bull_bb_std_mult': 1.3102631072265012, 'bull_rsi_os': 34, 'bull_rsi_ob': 56, 'bull_adx_thresh': 29.16845728577175, 'bull_atr_min_pct': 0.018304190121676927, 'bull_atr_max_pct': 0.02864092993617979, 'bull_tp_mult': 1.4106805584708644, 'bull_tsl_mult': 0.3660832758733993, 'bull_time_stop': 168, 'bull_use_sma': False, 'bull_use_ema': False, 'bull_use_atr': True, 'bull_use_adx': False, 'bull_use_spike': False, 'bull_rsi_required': True, 'bear_strategy': 'mean_reversion', 'bear_bb_std_mult': 1.9140354467361327, 'bear_rsi_os': 30, 'bear_rsi_ob': 78, 'bear_adx_thresh': 14.568260088994592, 'bear_atr_min_pct': 0.010028621447974171, 'bear_atr_max_pct': 0.1366478452437687, 'bear_tp_mult': 2.637960894320752, 'bear_tsl_mult': 0.4726718936443563, 'bear_time_stop': 238, 'bear_use_sma': True, 'bear_use_ema': True, 'bear_use_atr': True, 'bear_use_adx': True, 'bear_use_spike': False, 'bear_rsi_required': True, 'sideways_strategy': 'mean_reversion', 'sideways_bb_std_mult': 1.008159203406685, 'sideways_rsi_os': 32, 'sideways_rsi_ob': 54, 'sideways_adx_thresh': 34.92386143806361, 'sideways_atr_min_pct': 0.026722093189611298, 'sideways_atr_max_pct': 0.10510288896160688, 'sideways_tp_mult': 1.5418574052688871, 'sideways_tsl_mult': 0.32714011816142397, 'sideways_time_stop': 240, 'sideways_use_sma': False, 'sideways_use_ema': False, 'sideways_use_atr': False, 'sideways_use_adx': False, 'sideways_use_spike': False, 'sideways_rsi_required': True}.
[I 2025-08-31 10:07:14,251] Trial 365 finished with values: [-1000000000.0, 1000000000.0] and parameters: {'p_sma': 48, 'p_std': 16, 'p_atr': 20, 'p_adx': 29, 'rsi_period': 26, 'ema1': 20, 'ema2': 36, 'slip_atr_k': 0.1517299200757539, 'slip_spread_k': 0.3626167270318824, 'spread_hl_frac': 0.013533114490162777, 'bb_std_mult': 0.942561688162384, 'rsi_os': 53, 'rsi_ob': 46, 'vol_spike': 0.21994255605002444, 'adx_thresh': 7.853490899654246, 'atr_min_pct': 0.013882185876852592, 'atr_max_pct': 0.03612944406658617, 'tp_mult': 2.8724098927348822, 'tsl_mult': 0.01926403151906112, 'strategy': 'breakout', 'time_stop': 127, 'use_sma': False, 'use_atr': False, 'use_adx': False, 'use_ema': False, 'use_spike': True, 'rsi_required': True, 'edge_k': 0.15065146277732588, 'edge_cap': 0.05169008880220499, 'bull_strategy': 'mean_reversion', 'bull_bb_std_mult': 3.0890300493930978, 'bull_rsi_os': 28, 'bull_rsi_ob': 61, 'bull_adx_thresh': 30.959622561633388, 'bull_atr_min_pct': 0.015456828930821691, 'bull_atr_max_pct': 0.02893961309758703, 'bull_tp_mult': 1.3946672885890028, 'bull_tsl_mult': 0.578417834432541, 'bull_time_stop': 259, 'bull_use_sma': True, 'bull_use_ema': False, 'bull_use_atr': False, 'bull_use_adx': False, 'bull_use_spike': False, 'bull_rsi_required': True, 'bear_strategy': 'breakout', 'bear_bb_std_mult': 3.53392123802897, 'bear_rsi_os': 5, 'bear_rsi_ob': 79, 'bear_adx_thresh': 12.915678051482757, 'bear_atr_min_pct': 0.0187718031943436, 'bear_atr_max_pct': 0.11225374657883813, 'bear_tp_mult': 1.6329653344703599, 'bear_tsl_mult': 0.46821533114998565, 'bear_time_stop': 91, 'bear_use_sma': True, 'bear_use_ema': True, 'bear_use_atr': True, 'bear_use_adx': True, 'bear_use_spike': False, 'bear_rsi_required': True, 'sideways_strategy': 'mean_reversion', 'sideways_bb_std_mult': 0.9993039825142229, 'sideways_rsi_os': 48, 'sideways_rsi_ob': 81, 'sideways_adx_thresh': 22.168040588704056, 'sideways_atr_min_pct': 0.0015398954067512634, 'sideways_atr_max_pct': 0.03619342905537673, 'sideways_tp_mult': 1.0500868366759604, 'sideways_tsl_mult': 0.08071515278272251, 'sideways_time_stop': 81, 'sideways_use_sma': False, 'sideways_use_ema': False, 'sideways_use_atr': False, 'sideways_use_adx': False, 'sideways_use_spike': False, 'sideways_rsi_required': True}.
[I 2025-08-31 10:07:14,651] Trial 366 finished with values: [-0.025384166038189826, 0.025251752930535602] and parameters: {'p_sma': 60, 'p_std': 50, 'p_atr': 30, 'p_adx': 9, 'rsi_period': 24, 'ema1': 11, 'ema2': 48, 'slip_atr_k': 0.12675312131808436, 'slip_spread_k': 0.35860513388029175, 'spread_hl_frac': 0.04486694573208687, 'bb_std_mult': 0.6329650536988662, 'rsi_os': 29, 'rsi_ob': 50, 'vol_spike': 0.284705940607867, 'adx_thresh': 5.725958952659628, 'atr_min_pct': 0.01278987599744263, 'atr_max_pct': 0.13251721612072612, 'tp_mult': 1.99315239876008, 'tsl_mult': 0.8960101814400017, 'strategy': 'breakout', 'time_stop': 191, 'use_sma': False, 'use_atr': False, 'use_adx': False, 'use_ema': False, 'use_spike': False, 'rsi_required': True, 'edge_k': 1.8969221277036947, 'edge_cap': 0.061023575768516136, 'bull_strategy': 'mean_reversion', 'bull_bb_std_mult': 3.0857279807736626, 'bull_rsi_os': 30, 'bull_rsi_ob': 66, 'bull_adx_thresh': 29.27772085465378, 'bull_atr_min_pct': 0.0018546688086061962, 'bull_atr_max_pct': 0.10579604187500635, 'bull_tp_mult': 1.391802910783115, 'bull_tsl_mult': 0.5130199380038959, 'bull_time_stop': 228, 'bull_use_sma': True, 'bull_use_ema': False, 'bull_use_atr': False, 'bull_use_adx': False, 'bull_use_spike': False, 'bull_rsi_required': True, 'bear_strategy': 'breakout', 'bear_bb_std_mult': 2.919232375256132, 'bear_rsi_os': 54, 'bear_rsi_ob': 79, 'bear_adx_thresh': 22.82033784698635, 'bear_atr_min_pct': 0.01634762740453408, 'bear_atr_max_pct': 0.14558993322089347, 'bear_tp_mult': 2.0162433157972344, 'bear_tsl_mult': 0.5051714991951727, 'bear_time_stop': 285, 'bear_use_sma': False, 'bear_use_ema': True, 'bear_use_atr': False, 'bear_use_adx': True, 'bear_use_spike': False, 'bear_rsi_required': True, 'sideways_strategy': 'breakout', 'sideways_bb_std_mult': 1.3181981742914972, 'sideways_rsi_os': 16, 'sideways_rsi_ob': 82, 'sideways_adx_thresh': 32.90441582826369, 'sideways_atr_min_pct': 0.029903423133473907, 'sideways_atr_max_pct': 0.03585215335598989, 'sideways_tp_mult': 2.7291851375136087, 'sideways_tsl_mult': 0.08782755156151616, 'sideways_time_stop': 244, 'sideways_use_sma': True, 'sideways_use_ema': True, 'sideways_use_atr': False, 'sideways_use_adx': False, 'sideways_use_spike': False, 'sideways_rsi_required': False}.
[I 2025-08-31 10:07:15,400] Trial 367 finished with values: [-1000000000.0, 1000000000.0] and parameters: {'p_sma': 26, 'p_std': 16, 'p_atr': 26, 'p_adx': 9, 'rsi_period': 25, 'ema1': 20, 'ema2': 41, 'slip_atr_k': 0.15258815709814944, 'slip_spread_k': 0.402912086714172, 'spread_hl_frac': 0.00964325256188855, 'bb_std_mult': 0.9341286306364098, 'rsi_os': 23, 'rsi_ob': 45, 'vol_spike': 0.07696038117441702, 'adx_thresh': 15.614049063197243, 'atr_min_pct': 0.002236335673873586, 'atr_max_pct': 0.10659372426540142, 'tp_mult': 1.6933792939916468, 'tsl_mult': 0.9114242170061524, 'strategy': 'breakout', 'time_stop': 127, 'use_sma': False, 'use_atr': False, 'use_adx': False, 'use_ema': False, 'use_spike': False, 'rsi_required': True, 'edge_k': 1.9743311902109675, 'edge_cap': 0.05104676361911388, 'bull_strategy': 'mean_reversion', 'bull_bb_std_mult': 2.9682462041293, 'bull_rsi_os': 12, 'bull_rsi_ob': 85, 'bull_adx_thresh': 31.210187236169798, 'bull_atr_min_pct': 0.01881293521356403, 'bull_atr_max_pct': 0.11882633874828508, 'bull_tp_mult': 1.1380416399204278, 'bull_tsl_mult': 0.6531939341047863, 'bull_time_stop': 87, 'bull_use_sma': True, 'bull_use_ema': False, 'bull_use_atr': False, 'bull_use_adx': False, 'bull_use_spike': False, 'bull_rsi_required': True, 'bear_strategy': 'breakout', 'bear_bb_std_mult': 2.400785819876204, 'bear_rsi_os': 52, 'bear_rsi_ob': 80, 'bear_adx_thresh': 14.727060360659468, 'bear_atr_min_pct': 0.020378124297202378, 'bear_atr_max_pct': 0.14155813045675408, 'bear_tp_mult': 2.7220572625029598, 'bear_tsl_mult': 0.4965487399622765, 'bear_time_stop': 39, 'bear_use_sma': False, 'bear_use_ema': False, 'bear_use_atr': False, 'bear_use_adx': True, 'bear_use_spike': False, 'bear_rsi_required': True, 'sideways_strategy': 'breakout', 'sideways_bb_std_mult': 1.391416693453702, 'sideways_rsi_os': 32, 'sideways_rsi_ob': 64, 'sideways_adx_thresh': 33.059453252166875, 'sideways_atr_min_pct': 0.017556158183343187, 'sideways_atr_max_pct': 0.04875661035849034, 'sideways_tp_mult': 1.5230311691772436, 'sideways_tsl_mult': 0.1322028965714468, 'sideways_time_stop': 232, 'sideways_use_sma': True, 'sideways_use_ema': True, 'sideways_use_atr': False, 'sideways_use_adx': False, 'sideways_use_spike': False, 'sideways_rsi_required': False}.
[I 2025-08-31 10:07:15,570] Trial 368 finished with values: [-1000000000.0, 1000000000.0] and parameters: {'p_sma': 50, 'p_std': 16, 'p_atr': 28, 'p_adx': 9, 'rsi_period': 25, 'ema1': 21, 'ema2': 41, 'slip_atr_k': 0.16223635523741692, 'slip_spread_k': 0.4615966525297766, 'spread_hl_frac': 0.011665013897553183, 'bb_std_mult': 1.540165267839317, 'rsi_os': 23, 'rsi_ob': 63, 'vol_spike': 0.14305806986401406, 'adx_thresh': 28.867101728824558, 'atr_min_pct': 0.013227088400463292, 'atr_max_pct': 0.01761895482746996, 'tp_mult': 1.3280433520636337, 'tsl_mult': 0.020186485179312163, 'strategy': 'breakout', 'time_stop': 130, 'use_sma': False, 'use_atr': False, 'use_adx': False, 'use_ema': False, 'use_spike': False, 'rsi_required': True, 'edge_k': 1.8350145810815226, 'edge_cap': 0.061505918770069536, 'bull_strategy': 'mean_reversion', 'bull_bb_std_mult': 2.9637554458170183, 'bull_rsi_os': 12, 'bull_rsi_ob': 51, 'bull_adx_thresh': 9.23549969979127, 'bull_atr_min_pct': 0.01989540451071622, 'bull_atr_max_pct': 0.11862084715041125, 'bull_tp_mult': 1.3761650788043132, 'bull_tsl_mult': 0.5163149364292414, 'bull_time_stop': 250, 'bull_use_sma': True, 'bull_use_ema': False, 'bull_use_atr': False, 'bull_use_adx': False, 'bull_use_spike': False, 'bull_rsi_required': False, 'bear_strategy': 'breakout', 'bear_bb_std_mult': 2.4023269978415587, 'bear_rsi_os': 54, 'bear_rsi_ob': 62, 'bear_adx_thresh': 22.99685494100691, 'bear_atr_min_pct': 0.018973750518493183, 'bear_atr_max_pct': 0.01885935355061307, 'bear_tp_mult': 2.5989714575275644, 'bear_tsl_mult': 0.1482664010249664, 'bear_time_stop': 174, 'bear_use_sma': False, 'bear_use_ema': False, 'bear_use_atr': False, 'bear_use_adx': False, 'bear_use_spike': False, 'bear_rsi_required': True, 'sideways_strategy': 'breakout', 'sideways_bb_std_mult': 1.1070811415063404, 'sideways_rsi_os': 24, 'sideways_rsi_ob': 64, 'sideways_adx_thresh': 32.89171788631666, 'sideways_atr_min_pct': 0.0015027184824227932, 'sideways_atr_max_pct': 0.0302513768836674, 'sideways_tp_mult': 1.2273514636511003, 'sideways_tsl_mult': 0.0793369262087489, 'sideways_time_stop': 218, 'sideways_use_sma': True, 'sideways_use_ema': True, 'sideways_use_atr': False, 'sideways_use_adx': False, 'sideways_use_spike': False, 'sideways_rsi_required': False}.
