[I 2025-08-31 10:55:42,902] Trial 737 finished with values: [-1000000000.0, 1000000000.0] and parameters: {'p_sma': 5, 'p_std': 49, 'p_atr': 14, 'p_adx': 8, 'rsi_period': 25, 'ema1': 12, 'ema2': 45, 'slip_atr_k': 0.2096384777428357, 'slip_spread_k': 0.6865677517500983, 'spread_hl_frac': 0.01170313965399068, 'bb_std_mult': 1.215512664594676, 'rsi_os': 8, 'rsi_ob': 54, 'vol_spike': 0.19824297234669488, 'adx_thresh': 29.050252330503255, 'atr_min_pct': 0.010161584155776537, 'atr_max_pct': 0.14650639371181032, 'tp_mult': 1.5524375225932707, 'tsl_mult': 0.3828407497864653, 'strategy': 'breakout', 'time_stop': 175, 'use_sma': False, 'use_atr': False, 'use_adx': False, 'use_ema': True, 'use_spike': False, 'rsi_required': True, 'edge_k': 1.350631202014095, 'edge_cap': 0.4297115900667859, 'bull_strategy': 'mean_reversion', 'bull_bb_std_mult': 1.308501097264997, 'bull_rsi_os': 53, 'bull_rsi_ob': 66, 'bull_adx_thresh': 14.905892341863748, 'bull_atr_min_pct': 0.005844961486494984, 'bull_atr_max_pct': 0.021651625886402216, 'bull_tp_mult': 2.000175056401244, 'bull_tsl_mult': 0.9985566865473765, 'bull_time_stop': 98, 'bull_use_sma': True, 'bull_use_ema': False, 'bull_use_atr': False, 'bull_use_adx': False, 'bull_use_spike': False, 'bull_rsi_required': True, 'bear_strategy': 'breakout', 'bear_bb_std_mult': 2.944026157839423, 'bear_rsi_os': 27, 'bear_rsi_ob': 79, 'bear_adx_thresh': 18.093951079561926, 'bear_atr_min_pct': 0.002333484778339589, 'bear_atr_max_pct': 0.10423153436327426, 'bear_tp_mult': 2.0593873740407087, 'bear_tsl_mult': 0.43253429961514755, 'bear_time_stop': 254, 'bear_use_sma': False, 'bear_use_ema': True, 'bear_use_atr': False, 'bear_use_adx': True, 'bear_use_spike': True, 'bear_rsi_required': True, 'sideways_strategy': 'breakout', 'sideways_bb_std_mult': 0.9008966035803067, 'sideways_rsi_os': 26, 'sideways_rsi_ob': 95, 'sideways_adx_thresh': 27.7039289227483, 'sideways_atr_min_pct': 0.004725001062726632, 'sideways_atr_max_pct': 0.12894623089450544, 'sideways_tp_mult': 1.7824009113819135, 'sideways_tsl_mult': 0.06106378770998095, 'sideways_time_stop': 246, 'sideways_use_sma': True, 'sideways_use_ema': True, 'sideways_use_atr': False, 'sideways_use_adx': False, 'sideways_use_spike': True, 'sideways_rsi_required': False}.
[I 2025-08-31 10:55:43,013] Trial 740 finished with values: [-1000000000.0, 1000000000.0] and parameters: {'p_sma': 9, 'p_std': 37, 'p_atr': 14, 'p_adx': 8, 'rsi_period': 48, 'ema1': 27, 'ema2': 56, 'slip_atr_k': 0.17547105215339162, 'slip_spread_k': 0.24479502863974167, 'spread_hl_frac': 0.011587750199877516, 'bb_std_mult': 0.5212343124134209, 'rsi_os': 8, 'rsi_ob': 71, 'vol_spike': 0.044772805909750746, 'adx_thresh': 10.24641178995331, 'atr_min_pct': 0.010339291237570223, 'atr_max_pct': 0.12522099881886986, 'tp_mult': 1.5576610455914288, 'tsl_mult': 0.9333105260212491, 'strategy': 'breakout', 'time_stop': 142, 'use_sma': True, 'use_atr': True, 'use_adx': True, 'use_ema': True, 'use_spike': False, 'rsi_required': False, 'edge_k': 1.8429484500463476, 'edge_cap': 0.1319101207202788, 'bull_strategy': 'breakout', 'bull_bb_std_mult': 1.8370802617803885, 'bull_rsi_os': 38, 'bull_rsi_ob': 66, 'bull_adx_thresh': 33.15810686412724, 'bull_atr_min_pct': 0.028690816664048664, 'bull_atr_max_pct': 0.08767686937657082, 'bull_tp_mult': 2.223958599426913, 'bull_tsl_mult': 0.9334257419746328, 'bull_time_stop': 75, 'bull_use_sma': True, 'bull_use_ema': True, 'bull_use_atr': False, 'bull_use_adx': False, 'bull_use_spike': True, 'bull_rsi_required': True, 'bear_strategy': 'breakout', 'bear_bb_std_mult': 1.9812755424040687, 'bear_rsi_os': 27, 'bear_rsi_ob': 60, 'bear_adx_thresh': 20.549538538349246, 'bear_atr_min_pct': 0.02532762924606486, 'bear_atr_max_pct': 0.10427812250232085, 'bear_tp_mult': 2.039262711466946, 'bear_tsl_mult': 0.7022555877450735, 'bear_time_stop': 268, 'bear_use_sma': True, 'bear_use_ema': True, 'bear_use_atr': False, 'bear_use_adx': True, 'bear_use_spike': True, 'bear_rsi_required': False, 'sideways_strategy': 'mean_reversion', 'sideways_bb_std_mult': 0.9035280834457232, 'sideways_rsi_os': 24, 'sideways_rsi_ob': 93, 'sideways_adx_thresh': 30.450969296482185, 'sideways_atr_min_pct': 0.013293203301986514, 'sideways_atr_max_pct': 0.11551330872098296, 'sideways_tp_mult': 2.2227424576225996, 'sideways_tsl_mult': 0.05494124843100012, 'sideways_time_stop': 219, 'sideways_use_sma': True, 'sideways_use_ema': True, 'sideways_use_atr': True, 'sideways_use_adx': True, 'sideways_use_spike': True, 'sideways_rsi_required': True}.
[I 2025-08-31 10:55:43,091] Trial 739 finished with values: [-1000000000.0, 1000000000.0] and parameters: {'p_sma': 13, 'p_std': 6, 'p_atr': 11, 'p_adx': 10, 'rsi_period': 84, 'ema1': 17, 'ema2': 14, 'slip_atr_k': 0.18631274439341694, 'slip_spread_k': 0.7487408147865254, 'spread_hl_frac': 0.02802556469814282, 'bb_std_mult': 1.5438479320737188, 'rsi_os': 40, 'rsi_ob': 73, 'vol_spike': 0.27824120834227994, 'adx_thresh': 34.18969633325675, 'atr_min_pct': 0.010259121001970729, 'atr_max_pct': 0.14676004455638875, 'tp_mult': 2.873093822915725, 'tsl_mult': 0.07281566236100495, 'strategy': 'breakout', 'time_stop': 176, 'use_sma': True, 'use_atr': False, 'use_adx': True, 'use_ema': True, 'use_spike': False, 'rsi_required': True, 'edge_k': 1.836463268580365, 'edge_cap': 0.7413849435583095, 'bull_strategy': 'breakout', 'bull_bb_std_mult': 1.22328290094414, 'bull_rsi_os': 14, 'bull_rsi_ob': 52, 'bull_adx_thresh': 30.706123893306522, 'bull_atr_min_pct': 0.007678840219455243, 'bull_atr_max_pct': 0.043250689556684555, 'bull_tp_mult': 2.716164966407062, 'bull_tsl_mult': 0.9825895256830517, 'bull_time_stop': 75, 'bull_use_sma': True, 'bull_use_ema': True, 'bull_use_atr': False, 'bull_use_adx': False, 'bull_use_spike': False, 'bull_rsi_required': True, 'bear_strategy': 'breakout', 'bear_bb_std_mult': 3.023895236514141, 'bear_rsi_os': 27, 'bear_rsi_ob': 73, 'bear_adx_thresh': 17.874352567762426, 'bear_atr_min_pct': 0.008842216489255192, 'bear_atr_max_pct': 0.10436252652679036, 'bear_tp_mult': 2.054244410447537, 'bear_tsl_mult': 0.43427133348244673, 'bear_time_stop': 266, 'bear_use_sma': True, 'bear_use_ema': True, 'bear_use_atr': False, 'bear_use_adx': True, 'bear_use_spike': True, 'bear_rsi_required': True, 'sideways_strategy': 'breakout', 'sideways_bb_std_mult': 1.7591635356640352, 'sideways_rsi_os': 26, 'sideways_rsi_ob': 93, 'sideways_adx_thresh': 30.825886171425285, 'sideways_atr_min_pct': 0.0025110652842032597, 'sideways_atr_max_pct': 0.11657467671086148, 'sideways_tp_mult': 1.902887421758002, 'sideways_tsl_mult': 0.050867473972417615, 'sideways_time_stop': 220, 'sideways_use_sma': True, 'sideways_use_ema': True, 'sideways_use_atr': False, 'sideways_use_adx': True, 'sideways_use_spike': True, 'sideways_rsi_required': False}.
[I 2025-08-31 10:56:16,369] Trial 743 finished with values: [-0.012380641018965743, 0.012250885539545047] and parameters: {'p_sma': 13, 'p_std': 60, 'p_atr': 15, 'p_adx': 18, 'rsi_period': 21, 'ema1': 15, 'ema2': 38, 'slip_atr_k': 0.2303268182424186, 'slip_spread_k': 0.00021053239313467698, 'spread_hl_frac': 0.03524366738595155, 'bb_std_mult': 1.342136875830167, 'rsi_os': 48, 'rsi_ob': 84, 'vol_spike': 0.05184739343106755, 'adx_thresh': 12.399863584414579, 'atr_min_pct': 0.012692643090103494, 'atr_max_pct': 0.07208628085733872, 'tp_mult': 2.4017292518488573, 'tsl_mult': 0.21749567836488304, 'strategy': 'mean_reversion', 'time_stop': 68, 'use_sma': True, 'use_atr': False, 'use_adx': True, 'use_ema': True, 'use_spike': False, 'rsi_required': True, 'edge_k': 1.9361078423154112, 'edge_cap': 0.8126376124743127, 'bull_strategy': 'breakout', 'bull_bb_std_mult': 1.0749758785345485, 'bull_rsi_os': 25, 'bull_rsi_ob': 68, 'bull_adx_thresh': 31.632900484155314, 'bull_atr_min_pct': 0.013561298095096182, 'bull_atr_max_pct': 0.08862093743980437, 'bull_tp_mult': 2.14355992755959, 'bull_tsl_mult': 0.8932891680113733, 'bull_time_stop': 85, 'bull_use_sma': True, 'bull_use_ema': False, 'bull_use_atr': False, 'bull_use_adx': False, 'bull_use_spike': False, 'bull_rsi_required': False, 'bear_strategy': 'mean_reversion', 'bear_bb_std_mult': 2.579486413010885, 'bear_rsi_os': 48, 'bear_rsi_ob': 81, 'bear_adx_thresh': 21.18551128066695, 'bear_atr_min_pct': 0.012812033966442185, 'bear_atr_max_pct': 0.11426094869774006, 'bear_tp_mult': 1.6715877901186516, 'bear_tsl_mult': 0.39638657711788927, 'bear_time_stop': 262, 'bear_use_sma': False, 'bear_use_ema': False, 'bear_use_atr': False, 'bear_use_adx': False, 'bear_use_spike': True, 'bear_rsi_required': True, 'sideways_strategy': 'breakout', 'sideways_bb_std_mult': 3.5951634218882806, 'sideways_rsi_os': 22, 'sideways_rsi_ob': 93, 'sideways_adx_thresh': 28.4928083974708, 'sideways_atr_min_pct': 0.0010536164600649903, 'sideways_atr_max_pct': 0.08958078353955654, 'sideways_tp_mult': 2.580485030074199, 'sideways_tsl_mult': 0.04643286806615874, 'sideways_time_stop': 231, 'sideways_use_sma': True, 'sideways_use_ema': False, 'sideways_use_atr': False, 'sideways_use_adx': False, 'sideways_use_spike': True, 'sideways_rsi_required': False}.
[I 2025-08-31 10:56:16,605] Trial 744 finished with values: [-1000000000.0, 1000000000.0] and parameters: {'p_sma': 12, 'p_std': 32, 'p_atr': 29, 'p_adx': 18, 'rsi_period': 21, 'ema1': 18, 'ema2': 16, 'slip_atr_k': 0.19585026925721336, 'slip_spread_k': 0.06801803343614313, 'spread_hl_frac': 0.005505413071136174, 'bb_std_mult': 1.3139863917886314, 'rsi_os': 48, 'rsi_ob': 66, 'vol_spike': 0.17868572024004717, 'adx_thresh': 17.324553039882318, 'atr_min_pct': 0.012618797327180508, 'atr_max_pct': 0.12435344472736587, 'tp_mult': 2.830143863368772, 'tsl_mult': 0.05929804132273905, 'strategy': 'mean_reversion', 'time_stop': 262, 'use_sma': False, 'use_atr': True, 'use_adx': False, 'use_ema': True, 'use_spike': False, 'rsi_required': False, 'edge_k': 1.9471525999782067, 'edge_cap': 0.812368494772111, 'bull_strategy': 'mean_reversion', 'bull_bb_std_mult': 3.2638240213026153, 'bull_rsi_os': 25, 'bull_rsi_ob': 68, 'bull_adx_thresh': 31.611647459255778, 'bull_atr_min_pct': 0.009906257003030569, 'bull_atr_max_pct': 0.08805877380931437, 'bull_tp_mult': 2.3157138169273837, 'bull_tsl_mult': 0.9394130686975675, 'bull_time_stop': 85, 'bull_use_sma': True, 'bull_use_ema': False, 'bull_use_atr': False, 'bull_use_adx': False, 'bull_use_spike': True, 'bull_rsi_required': False, 'bear_strategy': 'mean_reversion', 'bear_bb_std_mult': 3.4224911473566917, 'bear_rsi_os': 30, 'bear_rsi_ob': 81, 'bear_adx_thresh': 21.17702559750945, 'bear_atr_min_pct': 0.012574023980140786, 'bear_atr_max_pct': 0.11284232274392518, 'bear_tp_mult': 1.1863790400128886, 'bear_tsl_mult': 0.39126285814648876, 'bear_time_stop': 261, 'bear_use_sma': False, 'bear_use_ema': False, 'bear_use_atr': False, 'bear_use_adx': False, 'bear_use_spike': True, 'bear_rsi_required': False, 'sideways_strategy': 'mean_reversion', 'sideways_bb_std_mult': 1.0265114007845446, 'sideways_rsi_os': 23, 'sideways_rsi_ob': 92, 'sideways_adx_thresh': 9.589910204553073, 'sideways_atr_min_pct': 0.007214923957500137, 'sideways_atr_max_pct': 0.13426727527808263, 'sideways_tp_mult': 2.483058511295904, 'sideways_tsl_mult': 0.09243304256188309, 'sideways_time_stop': 227, 'sideways_use_sma': True, 'sideways_use_ema': False, 'sideways_use_atr': True, 'sideways_use_adx': False, 'sideways_use_spike': True, 'sideways_rsi_required': True}.
[I 2025-08-31 10:56:16,608] Trial 742 finished with values: [-1000000000.0, 1000000000.0] and parameters: {'p_sma': 54, 'p_std': 47, 'p_atr': 28, 'p_adx': 11, 'rsi_period': 15, 'ema1': 17, 'ema2': 30, 'slip_atr_k': 0.1869845687094352, 'slip_spread_k': 0.7528166053795491, 'spread_hl_frac': 0.03926633511124079, 'bb_std_mult': 0.5287392439777459, 'rsi_os': 40, 'rsi_ob': 84, 'vol_spike': 0.047499862397024445, 'adx_thresh': 34.03515042186252, 'atr_min_pct': 0.010724782038112907, 'atr_max_pct': 0.1247608714599743, 'tp_mult': 2.8800377018581256, 'tsl_mult': 0.3108056539569841, 'strategy': 'breakout', 'time_stop': 162, 'use_sma': True, 'use_atr': True, 'use_adx': True, 'use_ema': True, 'use_spike': False, 'rsi_required': False, 'edge_k': 1.8103293809468866, 'edge_cap': 0.8916885380399493, 'bull_strategy': 'breakout', 'bull_bb_std_mult': 1.0658778133949585, 'bull_rsi_os': 25, 'bull_rsi_ob': 68, 'bull_adx_thresh': 31.616621004479892, 'bull_atr_min_pct': 0.02247190778114402, 'bull_atr_max_pct': 0.0878051669504836, 'bull_tp_mult': 2.2300121301009095, 'bull_tsl_mult': 0.9790183097472874, 'bull_time_stop': 69, 'bull_use_sma': True, 'bull_use_ema': True, 'bull_use_atr': False, 'bull_use_adx': False, 'bull_use_spike': True, 'bull_rsi_required': False, 'bear_strategy': 'mean_reversion', 'bear_bb_std_mult': 3.020598858660465, 'bear_rsi_os': 28, 'bear_rsi_ob': 79, 'bear_adx_thresh': 27.694882677041992, 'bear_atr_min_pct': 0.02551049922968157, 'bear_atr_max_pct': 0.11180267361213313, 'bear_tp_mult': 2.0249926760832673, 'bear_tsl_mult': 0.7169720119728894, 'bear_time_stop': 270, 'bear_use_sma': True, 'bear_use_ema': True, 'bear_use_atr': False, 'bear_use_adx': True, 'bear_use_spike': True, 'bear_rsi_required': False, 'sideways_strategy': 'mean_reversion', 'sideways_bb_std_mult': 0.9661471270886268, 'sideways_rsi_os': 52, 'sideways_rsi_ob': 74, 'sideways_adx_thresh': 24.08090975109041, 'sideways_atr_min_pct': 0.013654808688998956, 'sideways_atr_max_pct': 0.11637156408551583, 'sideways_tp_mult': 2.618480376004711, 'sideways_tsl_mult': 0.1375901957541663, 'sideways_time_stop': 217, 'sideways_use_sma': True, 'sideways_use_ema': False, 'sideways_use_atr': True, 'sideways_use_adx': True, 'sideways_use_spike': True, 'sideways_rsi_required': True}.
[I 2025-08-31 10:56:17,030] Trial 741 finished with values: [-1000000000.0, 1000000000.0] and parameters: {'p_sma': 9, 'p_std': 32, 'p_atr': 28, 'p_adx': 10, 'rsi_period': 15, 'ema1': 17, 'ema2': 22, 'slip_atr_k': 0.1854044150905529, 'slip_spread_k': 0.763003059960873, 'spread_hl_frac': 0.028328543589988413, 'bb_std_mult': 1.5472203019929727, 'rsi_os': 48, 'rsi_ob': 71, 'vol_spike': 0.04926501758160687, 'adx_thresh': 28.896457745375873, 'atr_min_pct': 0.010323356290421503, 'atr_max_pct': 0.12462728716228567, 'tp_mult': 1.5383450316594862, 'tsl_mult': 0.6644552701304522, 'strategy': 'breakout', 'time_stop': 176, 'use_sma': True, 'use_atr': True, 'use_adx': True, 'use_ema': True, 'use_spike': False, 'rsi_required': False, 'edge_k': 1.825653733737715, 'edge_cap': 0.1282075711250738, 'bull_strategy': 'breakout', 'bull_bb_std_mult': 1.7988469602295005, 'bull_rsi_os': 55, 'bull_rsi_ob': 66, 'bull_adx_thresh': 31.522151100036723, 'bull_atr_min_pct': 0.005699410980625106, 'bull_atr_max_pct': 0.08777517037192721, 'bull_tp_mult': 1.9930678596947982, 'bull_tsl_mult': 0.08782066750017403, 'bull_time_stop': 69, 'bull_use_sma': True, 'bull_use_ema': False, 'bull_use_atr': False, 'bull_use_adx': False, 'bull_use_spike': True, 'bull_rsi_required': True, 'bear_strategy': 'breakout', 'bear_bb_std_mult': 3.0224848229707266, 'bear_rsi_os': 28, 'bear_rsi_ob': 79, 'bear_adx_thresh': 21.34146794135994, 'bear_atr_min_pct': 0.01644999803277385, 'bear_atr_max_pct': 0.1113362598231262, 'bear_tp_mult': 1.8273612128783312, 'bear_tsl_mult': 0.39580393362909605, 'bear_time_stop': 95, 'bear_use_sma': True, 'bear_use_ema': True, 'bear_use_atr': False, 'bear_use_adx': True, 'bear_use_spike': True, 'bear_rsi_required': False, 'sideways_strategy': 'mean_reversion', 'sideways_bb_std_mult': 3.0196423464814104, 'sideways_rsi_os': 52, 'sideways_rsi_ob': 93, 'sideways_adx_thresh': 30.214109187798815, 'sideways_atr_min_pct': 0.002518058004171232, 'sideways_atr_max_pct': 0.11557072520315999, 'sideways_tp_mult': 2.208843723103089, 'sideways_tsl_mult': 0.049502299515010895, 'sideways_time_stop': 245, 'sideways_use_sma': True, 'sideways_use_ema': True, 'sideways_use_atr': True, 'sideways_use_adx': True, 'sideways_use_spike': True, 'sideways_rsi_required': True}.
[I 2025-08-31 10:56:49,427] Trial 748 finished with values: [-0.017892937810967124, 0.01781711820276466] and parameters: {'p_sma': 10, 'p_std': 48, 'p_atr': 30, 'p_adx': 11, 'rsi_period': 19, 'ema1': 18, 'ema2': 36, 'slip_atr_k': 0.22723752637530395, 'slip_spread_k': 0.12778810612747893, 'spread_hl_frac': 0.006734892218466262, 'bb_std_mult': 2.694240795951197, 'rsi_os': 42, 'rsi_ob': 82, 'vol_spike': 0.0682538075415223, 'adx_thresh': 22.79050503197039, 'atr_min_pct': 0.017236809328738, 'atr_max_pct': 0.12896968439780185, 'tp_mult': 1.8904067778190976, 'tsl_mult': 0.7675780525529294, 'strategy': 'mean_reversion', 'time_stop': 66, 'use_sma': False, 'use_atr': False, 'use_adx': False, 'use_ema': True, 'use_spike': True, 'rsi_required': True, 'edge_k': 1.9771579380922124, 'edge_cap': 0.6621428574142105, 'bull_strategy': 'mean_reversion', 'bull_bb_std_mult': 1.0168665353097879, 'bull_rsi_os': 26, 'bull_rsi_ob': 63, 'bull_adx_thresh': 31.021677469225143, 'bull_atr_min_pct': 0.0070778925842886024, 'bull_atr_max_pct': 0.05922186283467816, 'bull_tp_mult': 2.2465380253423834, 'bull_tsl_mult': 0.9714403920474396, 'bull_time_stop': 149, 'bull_use_sma': False, 'bull_use_ema': False, 'bull_use_atr': True, 'bull_use_adx': False, 'bull_use_spike': False, 'bull_rsi_required': True, 'bear_strategy': 'breakout', 'bear_bb_std_mult': 2.149908961817111, 'bear_rsi_os': 36, 'bear_rsi_ob': 80, 'bear_adx_thresh': 30.79561935530304, 'bear_atr_min_pct': 0.009379833601070624, 'bear_atr_max_pct': 0.1085762996166689, 'bear_tp_mult': 2.125308428898682, 'bear_tsl_mult': 0.48629055699929824, 'bear_time_stop': 275, 'bear_use_sma': False, 'bear_use_ema': False, 'bear_use_atr': True, 'bear_use_adx': True, 'bear_use_spike': True, 'bear_rsi_required': True, 'sideways_strategy': 'breakout', 'sideways_bb_std_mult': 0.8383078314179679, 'sideways_rsi_os': 25, 'sideways_rsi_ob': 80, 'sideways_adx_thresh': 28.682914982987324, 'sideways_atr_min_pct': 0.0012470526612383076, 'sideways_atr_max_pct': 0.10716979039049905, 'sideways_tp_mult': 2.961576658901197, 'sideways_tsl_mult': 0.40918875770313523, 'sideways_time_stop': 231, 'sideways_use_sma': False, 'sideways_use_ema': True, 'sideways_use_atr': False, 'sideways_use_adx': False, 'sideways_use_spike': True, 'sideways_rsi_required': False}.
[I 2025-08-31 10:56:49,821] Trial 747 finished with values: [-1000000000.0, 1000000000.0] and parameters: {'p_sma': 6, 'p_std': 47, 'p_atr': 8, 'p_adx': 7, 'rsi_period': 35, 'ema1': 7, 'ema2': 58, 'slip_atr_k': 0.17092603569673046, 'slip_spread_k': 0.11930008711207052, 'spread_hl_frac': 0.008017006547872945, 'bb_std_mult': 1.351166003670905, 'rsi_os': 42, 'rsi_ob': 81, 'vol_spike': 0.2812894325295992, 'adx_thresh': 28.702558149333463, 'atr_min_pct': 0.022503129595930153, 'atr_max_pct': 0.11855163425998272, 'tp_mult': 2.9702438494620393, 'tsl_mult': 0.18683769263205463, 'strategy': 'mean_reversion', 'time_stop': 115, 'use_sma': False, 'use_atr': False, 'use_adx': False, 'use_ema': True, 'use_spike': True, 'rsi_required': True, 'edge_k': 1.9972332429919302, 'edge_cap': 0.5569185879846938, 'bull_strategy': 'mean_reversion', 'bull_bb_std_mult': 2.8050090767888247, 'bull_rsi_os': 26, 'bull_rsi_ob': 80, 'bull_adx_thresh': 30.543253928724077, 'bull_atr_min_pct': 0.007136605608848261, 'bull_atr_max_pct': 0.08339466454554025, 'bull_tp_mult': 2.1575504833238566, 'bull_tsl_mult': 0.47450395963367936, 'bull_time_stop': 149, 'bull_use_sma': False, 'bull_use_ema': False, 'bull_use_atr': False, 'bull_use_adx': False, 'bull_use_spike': False, 'bull_rsi_required': True, 'bear_strategy': 'breakout', 'bear_bb_std_mult': 2.8077129314727776, 'bear_rsi_os': 47, 'bear_rsi_ob': 85, 'bear_adx_thresh': 21.36296863267334, 'bear_atr_min_pct': 0.0009052096269442731, 'bear_atr_max_pct': 0.10874679812508536, 'bear_tp_mult': 2.1278853387779115, 'bear_tsl_mult': 0.4839418043364533, 'bear_time_stop': 258, 'bear_use_sma': False, 'bear_use_ema': False, 'bear_use_atr': True, 'bear_use_adx': True, 'bear_use_spike': True, 'bear_rsi_required': True, 'sideways_strategy': 'breakout', 'sideways_bb_std_mult': 0.816856572687731, 'sideways_rsi_os': 22, 'sideways_rsi_ob': 95, 'sideways_adx_thresh': 28.552924174575672, 'sideways_atr_min_pct': 0.02915840619285444, 'sideways_atr_max_pct': 0.08930597769920441, 'sideways_tp_mult': 2.5720055329146323, 'sideways_tsl_mult': 0.41117791250463614, 'sideways_time_stop': 52, 'sideways_use_sma': False, 'sideways_use_ema': True, 'sideways_use_atr': False, 'sideways_use_adx': False, 'sideways_use_spike': True, 'sideways_rsi_required': False}.
