[I 2025-08-31 10:27:08,446] Trial 530 finished with values: [-1000000000.0, 1000000000.0] and parameters: {'p_sma': 12, 'p_std': 49, 'p_atr': 29, 'p_adx': 10, 'rsi_period': 67, 'ema1': 17, 'ema2': 38, 'slip_atr_k': 0.1897062318762878, 'slip_spread_k': 0.10344429242234161, 'spread_hl_frac': 0.02086078140950017, 'bb_std_mult': 1.2680118140858074, 'rsi_os': 40, 'rsi_ob': 84, 'vol_spike': 0.2866489606454281, 'adx_thresh': 23.86000129637609, 'atr_min_pct': 0.006682852882184554, 'atr_max_pct': 0.12212886615113461, 'tp_mult': 1.2565903976957822, 'tsl_mult': 0.5258795143370759, 'strategy': 'breakout', 'time_stop': 228, 'use_sma': False, 'use_atr': False, 'use_adx': False, 'use_ema': True, 'use_spike': False, 'rsi_required': True, 'edge_k': 1.920518200150028, 'edge_cap': 0.7773730468824884, 'bull_strategy': 'mean_reversion', 'bull_bb_std_mult': 1.846817393939082, 'bull_rsi_os': 28, 'bull_rsi_ob': 53, 'bull_adx_thresh': 28.705307464806353, 'bull_atr_min_pct': 0.008629158802020767, 'bull_atr_max_pct': 0.07578323322769949, 'bull_tp_mult': 2.2773428356736067, 'bull_tsl_mult': 0.9810932489076806, 'bull_time_stop': 62, 'bull_use_sma': True, 'bull_use_ema': False, 'bull_use_atr': False, 'bull_use_adx': False, 'bull_use_spike': False, 'bull_rsi_required': True, 'bear_strategy': 'breakout', 'bear_bb_std_mult': 2.1328017881861143, 'bear_rsi_os': 28, 'bear_rsi_ob': 76, 'bear_adx_thresh': 22.113622187578947, 'bear_atr_min_pct': 0.006139332564880336, 'bear_atr_max_pct': 0.10640432226310027, 'bear_tp_mult': 2.0202510736416084, 'bear_tsl_mult': 0.4018066836322761, 'bear_time_stop': 111, 'bear_use_sma': False, 'bear_use_ema': True, 'bear_use_atr': True, 'bear_use_adx': True, 'bear_use_spike': True, 'bear_rsi_required': True, 'sideways_strategy': 'breakout', 'sideways_bb_std_mult': 0.9703970475992587, 'sideways_rsi_os': 33, 'sideways_rsi_ob': 95, 'sideways_adx_thresh': 28.367177098273828, 'sideways_atr_min_pct': 0.00791377878198141, 'sideways_atr_max_pct': 0.09552293575519011, 'sideways_tp_mult': 2.906205849188009, 'sideways_tsl_mult': 0.0824507187032232, 'sideways_time_stop': 230, 'sideways_use_sma': False, 'sideways_use_ema': True, 'sideways_use_atr': False, 'sideways_use_adx': False, 'sideways_use_spike': True, 'sideways_rsi_required': False}.
[I 2025-08-31 10:27:08,560] Trial 532 finished with values: [-0.03922871853677168, 0.03915799618297345] and parameters: {'p_sma': 13, 'p_std': 45, 'p_atr': 28, 'p_adx': 10, 'rsi_period': 23, 'ema1': 18, 'ema2': 39, 'slip_atr_k': 0.1889115194442048, 'slip_spread_k': 0.10382136974371409, 'spread_hl_frac': 0.009995048807685624, 'bb_std_mult': 1.6844177180056787, 'rsi_os': 43, 'rsi_ob': 84, 'vol_spike': 0.28607311591460616, 'adx_thresh': 24.490031806532137, 'atr_min_pct': 0.010903551229322206, 'atr_max_pct': 0.12041008504638939, 'tp_mult': 2.9058948833943727, 'tsl_mult': 0.051974072862356294, 'strategy': 'breakout', 'time_stop': 116, 'use_sma': True, 'use_atr': True, 'use_adx': False, 'use_ema': True, 'use_spike': False, 'rsi_required': True, 'edge_k': 0.5414342228341145, 'edge_cap': 0.6879129034211071, 'bull_strategy': 'breakout', 'bull_bb_std_mult': 0.5739383426333604, 'bull_rsi_os': 28, 'bull_rsi_ob': 80, 'bull_adx_thresh': 11.860107464019757, 'bull_atr_min_pct': 0.00822663325508105, 'bull_atr_max_pct': 0.07639211756936772, 'bull_tp_mult': 2.279086076438403, 'bull_tsl_mult': 0.9788128724361591, 'bull_time_stop': 62, 'bull_use_sma': True, 'bull_use_ema': True, 'bull_use_atr': False, 'bull_use_adx': False, 'bull_use_spike': False, 'bull_rsi_required': False, 'bear_strategy': 'breakout', 'bear_bb_std_mult': 1.7659793760375149, 'bear_rsi_os': 29, 'bear_rsi_ob': 76, 'bear_adx_thresh': 22.23511240063872, 'bear_atr_min_pct': 0.006266598209545459, 'bear_atr_max_pct': 0.11373518976857051, 'bear_tp_mult': 2.014150581268407, 'bear_tsl_mult': 0.45382477657690873, 'bear_time_stop': 217, 'bear_use_sma': False, 'bear_use_ema': False, 'bear_use_atr': True, 'bear_use_adx': True, 'bear_use_spike': True, 'bear_rsi_required': False, 'sideways_strategy': 'breakout', 'sideways_bb_std_mult': 0.8538291955154101, 'sideways_rsi_os': 40, 'sideways_rsi_ob': 95, 'sideways_adx_thresh': 30.136377448025073, 'sideways_atr_min_pct': 0.001501768671866599, 'sideways_atr_max_pct': 0.09478063397702387, 'sideways_tp_mult': 2.9074850472844824, 'sideways_tsl_mult': 0.9979451455159015, 'sideways_time_stop': 231, 'sideways_use_sma': False, 'sideways_use_ema': True, 'sideways_use_atr': False, 'sideways_use_adx': False, 'sideways_use_spike': True, 'sideways_rsi_required': False}.
[I 2025-08-31 10:27:41,153] Trial 534 finished with values: [-1000000000.0, 1000000000.0] and parameters: {'p_sma': 11, 'p_std': 48, 'p_atr': 28, 'p_adx': 10, 'rsi_period': 40, 'ema1': 18, 'ema2': 54, 'slip_atr_k': 0.18935919197317896, 'slip_spread_k': 0.08211312648945626, 'spread_hl_frac': 0.002000047748554272, 'bb_std_mult': 2.678642413538835, 'rsi_os': 40, 'rsi_ob': 81, 'vol_spike': 0.29650848634306687, 'adx_thresh': 24.620918022651278, 'atr_min_pct': 0.007280348079075099, 'atr_max_pct': 0.1256751336974664, 'tp_mult': 1.323381847834105, 'tsl_mult': 0.48293939907080846, 'strategy': 'breakout', 'time_stop': 117, 'use_sma': False, 'use_atr': False, 'use_adx': True, 'use_ema': True, 'use_spike': False, 'rsi_required': True, 'edge_k': 0.6239904136278078, 'edge_cap': 0.738157839129918, 'bull_strategy': 'mean_reversion', 'bull_bb_std_mult': 0.9539579341930196, 'bull_rsi_os': 26, 'bull_rsi_ob': 79, 'bull_adx_thresh': 28.716529469125724, 'bull_atr_min_pct': 0.00851789704767687, 'bull_atr_max_pct': 0.0864259827212428, 'bull_tp_mult': 2.239798799349654, 'bull_tsl_mult': 0.974493896065577, 'bull_time_stop': 51, 'bull_use_sma': True, 'bull_use_ema': False, 'bull_use_atr': True, 'bull_use_adx': True, 'bull_use_spike': False, 'bull_rsi_required': True, 'bear_strategy': 'breakout', 'bear_bb_std_mult': 0.8769541736386322, 'bear_rsi_os': 29, 'bear_rsi_ob': 79, 'bear_adx_thresh': 21.9911913544301, 'bear_atr_min_pct': 0.007422943064149338, 'bear_atr_max_pct': 0.09604881248864591, 'bear_tp_mult': 1.9937126940111451, 'bear_tsl_mult': 0.4480014688367171, 'bear_time_stop': 199, 'bear_use_sma': False, 'bear_use_ema': False, 'bear_use_atr': True, 'bear_use_adx': True, 'bear_use_spike': True, 'bear_rsi_required': True, 'sideways_strategy': 'breakout', 'sideways_bb_std_mult': 0.8707143157344196, 'sideways_rsi_os': 32, 'sideways_rsi_ob': 95, 'sideways_adx_thresh': 30.34265882690644, 'sideways_atr_min_pct': 0.01264156352796077, 'sideways_atr_max_pct': 0.09637226070800081, 'sideways_tp_mult': 2.9112879372496505, 'sideways_tsl_mult': 0.44394342791467745, 'sideways_time_stop': 230, 'sideways_use_sma': False, 'sideways_use_ema': True, 'sideways_use_atr': False, 'sideways_use_adx': True, 'sideways_use_spike': True, 'sideways_rsi_required': False}.
[I 2025-08-31 10:27:41,400] Trial 535 finished with values: [-1000000000.0, 1000000000.0] and parameters: {'p_sma': 11, 'p_std': 48, 'p_atr': 28, 'p_adx': 10, 'rsi_period': 25, 'ema1': 18, 'ema2': 54, 'slip_atr_k': 0.204256741074582, 'slip_spread_k': 0.08490450819864204, 'spread_hl_frac': 0.0382533502531339, 'bb_std_mult': 2.992538060861469, 'rsi_os': 39, 'rsi_ob': 81, 'vol_spike': 0.29885973335958643, 'adx_thresh': 24.57364582210652, 'atr_min_pct': 0.02565606036995438, 'atr_max_pct': 0.126303203391833, 'tp_mult': 1.5629542811375197, 'tsl_mult': 0.06965398236213198, 'strategy': 'breakout', 'time_stop': 127, 'use_sma': True, 'use_atr': False, 'use_adx': True, 'use_ema': True, 'use_spike': False, 'rsi_required': True, 'edge_k': 1.9659648141701433, 'edge_cap': 0.8063217739662683, 'bull_strategy': 'breakout', 'bull_bb_std_mult': 1.1377216940229997, 'bull_rsi_os': 26, 'bull_rsi_ob': 66, 'bull_adx_thresh': 20.66574103669018, 'bull_atr_min_pct': 0.008211540664212041, 'bull_atr_max_pct': 0.0855910144831431, 'bull_tp_mult': 2.225203766266879, 'bull_tsl_mult': 0.9130160984942738, 'bull_time_stop': 92, 'bull_use_sma': True, 'bull_use_ema': False, 'bull_use_atr': True, 'bull_use_adx': True, 'bull_use_spike': False, 'bull_rsi_required': False, 'bear_strategy': 'breakout', 'bear_bb_std_mult': 3.011579809568105, 'bear_rsi_os': 30, 'bear_rsi_ob': 68, 'bear_adx_thresh': 34.90008420242615, 'bear_atr_min_pct': 0.008408666076150154, 'bear_atr_max_pct': 0.1153033188114648, 'bear_tp_mult': 2.091830594848421, 'bear_tsl_mult': 0.4496490011978299, 'bear_time_stop': 61, 'bear_use_sma': False, 'bear_use_ema': False, 'bear_use_atr': False, 'bear_use_adx': True, 'bear_use_spike': True, 'bear_rsi_required': True, 'sideways_strategy': 'breakout', 'sideways_bb_std_mult': 0.8608453481318334, 'sideways_rsi_os': 22, 'sideways_rsi_ob': 95, 'sideways_adx_thresh': 30.377663834598813, 'sideways_atr_min_pct': 0.0013232882299697624, 'sideways_atr_max_pct': 0.09429256961049698, 'sideways_tp_mult': 2.8482187849200766, 'sideways_tsl_mult': 0.051848397272735, 'sideways_time_stop': 169, 'sideways_use_sma': True, 'sideways_use_ema': True, 'sideways_use_atr': False, 'sideways_use_adx': True, 'sideways_use_spike': True, 'sideways_rsi_required': False}.
[I 2025-08-31 10:27:41,790] Trial 533 finished with values: [-0.05590011701224662, 0.05573021582280351] and parameters: {'p_sma': 13, 'p_std': 47, 'p_atr': 13, 'p_adx': 11, 'rsi_period': 25, 'ema1': 18, 'ema2': 39, 'slip_atr_k': 0.17637154161603985, 'slip_spread_k': 0.08406002929070314, 'spread_hl_frac': 0.020677565792086613, 'bb_std_mult': 1.3016471547875779, 'rsi_os': 43, 'rsi_ob': 83, 'vol_spike': 0.29589896264487575, 'adx_thresh': 22.578340551443027, 'atr_min_pct': 0.022643962998709022, 'atr_max_pct': 0.12558968663495781, 'tp_mult': 2.9971813018651376, 'tsl_mult': 0.07187093600518715, 'strategy': 'breakout', 'time_stop': 128, 'use_sma': False, 'use_atr': True, 'use_adx': False, 'use_ema': True, 'use_spike': False, 'rsi_required': True, 'edge_k': 0.5423153330466052, 'edge_cap': 0.9089274524967424, 'bull_strategy': 'mean_reversion', 'bull_bb_std_mult': 3.004277505699218, 'bull_rsi_os': 28, 'bull_rsi_ob': 53, 'bull_adx_thresh': 26.370538957762946, 'bull_atr_min_pct': 0.008409793167488482, 'bull_atr_max_pct': 0.08651607807519522, 'bull_tp_mult': 2.2517388261428426, 'bull_tsl_mult': 0.9779939824486257, 'bull_time_stop': 60, 'bull_use_sma': True, 'bull_use_ema': True, 'bull_use_atr': False, 'bull_use_adx': False, 'bull_use_spike': False, 'bull_rsi_required': True, 'bear_strategy': 'breakout', 'bear_bb_std_mult': 2.881692318012156, 'bear_rsi_os': 29, 'bear_rsi_ob': 82, 'bear_adx_thresh': 33.83468316948067, 'bear_atr_min_pct': 0.006512731246167407, 'bear_atr_max_pct': 0.10497458452150692, 'bear_tp_mult': 2.0230455163685654, 'bear_tsl_mult': 0.4459977824407306, 'bear_time_stop': 209, 'bear_use_sma': False, 'bear_use_ema': True, 'bear_use_atr': False, 'bear_use_adx': True, 'bear_use_spike': True, 'bear_rsi_required': False, 'sideways_strategy': 'breakout', 'sideways_bb_std_mult': 0.8742857612302507, 'sideways_rsi_os': 45, 'sideways_rsi_ob': 95, 'sideways_adx_thresh': 29.87529805283702, 'sideways_atr_min_pct': 0.0015880739918414219, 'sideways_atr_max_pct': 0.09514233449042593, 'sideways_tp_mult': 2.914574184850513, 'sideways_tsl_mult': 0.6631564802223263, 'sideways_time_stop': 229, 'sideways_use_sma': True, 'sideways_use_ema': True, 'sideways_use_atr': False, 'sideways_use_adx': False, 'sideways_use_spike': True, 'sideways_rsi_required': False}.
[I 2025-08-31 10:27:41,916] Trial 536 finished with values: [-1000000000.0, 1000000000.0] and parameters: {'p_sma': 11, 'p_std': 48, 'p_atr': 28, 'p_adx': 11, 'rsi_period': 25, 'ema1': 18, 'ema2': 36, 'slip_atr_k': 0.1832179711563134, 'slip_spread_k': 0.07998732178431835, 'spread_hl_frac': 0.011731655945285385, 'bb_std_mult': 1.1417211504950397, 'rsi_os': 38, 'rsi_ob': 81, 'vol_spike': 0.2978719764919376, 'adx_thresh': 22.713755198350373, 'atr_min_pct': 0.022658190472210377, 'atr_max_pct': 0.12402155916479142, 'tp_mult': 2.9972424133579865, 'tsl_mult': 0.06699224449270974, 'strategy': 'breakout', 'time_stop': 127, 'use_sma': False, 'use_atr': False, 'use_adx': True, 'use_ema': True, 'use_spike': True, 'rsi_required': False, 'edge_k': 0.933383849481474, 'edge_cap': 0.9066579835674555, 'bull_strategy': 'mean_reversion', 'bull_bb_std_mult': 1.1758989683312655, 'bull_rsi_os': 26, 'bull_rsi_ob': 90, 'bull_adx_thresh': 27.555481732361905, 'bull_atr_min_pct': 0.007152094728857708, 'bull_atr_max_pct': 0.08525090731384667, 'bull_tp_mult': 2.2356931554853574, 'bull_tsl_mult': 0.9419775535875785, 'bull_time_stop': 90, 'bull_use_sma': False, 'bull_use_ema': False, 'bull_use_atr': True, 'bull_use_adx': True, 'bull_use_spike': False, 'bull_rsi_required': True, 'bear_strategy': 'mean_reversion', 'bear_bb_std_mult': 2.8852153667674862, 'bear_rsi_os': 30, 'bear_rsi_ob': 80, 'bear_adx_thresh': 30.013817626294305, 'bear_atr_min_pct': 0.008846568136256668, 'bear_atr_max_pct': 0.09491135632329496, 'bear_tp_mult': 2.0825392708230237, 'bear_tsl_mult': 0.4406126331664571, 'bear_time_stop': 260, 'bear_use_sma': True, 'bear_use_ema': True, 'bear_use_atr': False, 'bear_use_adx': False, 'bear_use_spike': True, 'bear_rsi_required': True, 'sideways_strategy': 'breakout', 'sideways_bb_std_mult': 3.249919983042048, 'sideways_rsi_os': 22, 'sideways_rsi_ob': 94, 'sideways_adx_thresh': 30.40732980546568, 'sideways_atr_min_pct': 1.06477047016548e-05, 'sideways_atr_max_pct': 0.11507223397357966, 'sideways_tp_mult': 2.8521475113315358, 'sideways_tsl_mult': 0.6620013193969861, 'sideways_time_stop': 179, 'sideways_use_sma': True, 'sideways_use_ema': True, 'sideways_use_atr': False, 'sideways_use_adx': True, 'sideways_use_spike': True, 'sideways_rsi_required': False}.
[I 2025-08-31 10:28:14,869] Trial 538 finished with values: [-0.013779908745503944, 0.013658090299808358] and parameters: {'p_sma': 15, 'p_std': 47, 'p_atr': 29, 'p_adx': 11, 'rsi_period': 22, 'ema1': 18, 'ema2': 36, 'slip_atr_k': 0.18443357435949992, 'slip_spread_k': 0.158233474838979, 'spread_hl_frac': 0.012007699898786401, 'bb_std_mult': 1.1311355106177583, 'rsi_os': 37, 'rsi_ob': 82, 'vol_spike': 0.29505845460240826, 'adx_thresh': 25.447972935039612, 'atr_min_pct': 0.016704902133694348, 'atr_max_pct': 0.11700080909332544, 'tp_mult': 2.954483928628737, 'tsl_mult': 0.41769436312013375, 'strategy': 'breakout', 'time_stop': 137, 'use_sma': False, 'use_atr': False, 'use_adx': False, 'use_ema': True, 'use_spike': True, 'rsi_required': False, 'edge_k': 0.9278423375190592, 'edge_cap': 0.9846654573224382, 'bull_strategy': 'mean_reversion', 'bull_bb_std_mult': 1.0850542665708056, 'bull_rsi_os': 23, 'bull_rsi_ob': 62, 'bull_adx_thresh': 30.545482828169586, 'bull_atr_min_pct': 0.0072741820309812615, 'bull_atr_max_pct': 0.079346821319443, 'bull_tp_mult': 2.3132506359638856, 'bull_tsl_mult': 0.9427978983263764, 'bull_time_stop': 78, 'bull_use_sma': False, 'bull_use_ema': False, 'bull_use_atr': False, 'bull_use_adx': False, 'bull_use_spike': True, 'bull_rsi_required': True, 'bear_strategy': 'mean_reversion', 'bear_bb_std_mult': 2.8781193929764743, 'bear_rsi_os': 25, 'bear_rsi_ob': 81, 'bear_adx_thresh': 25.48285167416073, 'bear_atr_min_pct': 0.009162732775932195, 'bear_atr_max_pct': 0.10889727338527347, 'bear_tp_mult': 2.064438770605073, 'bear_tsl_mult': 0.7081424830317047, 'bear_time_stop': 259, 'bear_use_sma': True, 'bear_use_ema': True, 'bear_use_atr': False, 'bear_use_adx': False, 'bear_use_spike': True, 'bear_rsi_required': True, 'sideways_strategy': 'breakout', 'sideways_bb_std_mult': 0.9757165643852582, 'sideways_rsi_os': 24, 'sideways_rsi_ob': 93, 'sideways_adx_thresh': 29.5284803037806, 'sideways_atr_min_pct': 0.000772753235676125, 'sideways_atr_max_pct': 0.11250086672041376, 'sideways_tp_mult': 2.800518279653239, 'sideways_tsl_mult': 0.03291970744044719, 'sideways_time_stop': 239, 'sideways_use_sma': True, 'sideways_use_ema': True, 'sideways_use_atr': True, 'sideways_use_adx': False, 'sideways_use_spike': True, 'sideways_rsi_required': False}.
[I 2025-08-31 10:28:14,982] Trial 539 finished with values: [-1000000000.0, 1000000000.0] and parameters: {'p_sma': 16, 'p_std': 50, 'p_atr': 29, 'p_adx': 8, 'rsi_period': 22, 'ema1': 18, 'ema2': 10, 'slip_atr_k': 0.18195632097810235, 'slip_spread_k': 0.12955174938930364, 'spread_hl_frac': 0.011861762286376793, 'bb_std_mult': 1.1340643261463534, 'rsi_os': 38, 'rsi_ob': 87, 'vol_spike': 0.26767848218127094, 'adx_thresh': 21.90076953747993, 'atr_min_pct': 0.011074452057652083, 'atr_max_pct': 0.11743426820760912, 'tp_mult': 2.950796331892235, 'tsl_mult': 0.9378107407356159, 'strategy': 'breakout', 'time_stop': 45, 'use_sma': False, 'use_atr': False, 'use_adx': False, 'use_ema': True, 'use_spike': True, 'rsi_required': False, 'edge_k': 1.8419240001128039, 'edge_cap': 0.18206672475712607, 'bull_strategy': 'mean_reversion', 'bull_bb_std_mult': 1.1546271048596444, 'bull_rsi_os': 23, 'bull_rsi_ob': 91, 'bull_adx_thresh': 30.455000003922716, 'bull_atr_min_pct': 0.006973157798678682, 'bull_atr_max_pct': 0.09422258594960733, 'bull_tp_mult': 2.314872581124849, 'bull_tsl_mult': 0.9442574089176226, 'bull_time_stop': 78, 'bull_use_sma': False, 'bull_use_ema': False, 'bull_use_atr': False, 'bull_use_adx': False, 'bull_use_spike': True, 'bull_rsi_required': True, 'bear_strategy': 'mean_reversion', 'bear_bb_std_mult': 2.8626473846158156, 'bear_rsi_os': 25, 'bear_rsi_ob': 80, 'bear_adx_thresh': 13.093653492189226, 'bear_atr_min_pct': 0.008519756524396212, 'bear_atr_max_pct': 0.10994843869802334, 'bear_tp_mult': 2.0612664943223002, 'bear_tsl_mult': 0.3876280526106105, 'bear_time_stop': 261, 'bear_use_sma': True, 'bear_use_ema': True, 'bear_use_atr': False, 'bear_use_adx': False, 'bear_use_spike': True, 'bear_rsi_required': True, 'sideways_strategy': 'breakout', 'sideways_bb_std_mult': 3.239474405625436, 'sideways_rsi_os': 20, 'sideways_rsi_ob': 93, 'sideways_adx_thresh': 29.404411743495892, 'sideways_atr_min_pct': 0.027081399415648993, 'sideways_atr_max_pct': 0.10017293508622484, 'sideways_tp_mult': 2.80950121006561, 'sideways_tsl_mult': 0.0398570310954435, 'sideways_time_stop': 201, 'sideways_use_sma': True, 'sideways_use_ema': True, 'sideways_use_atr': True, 'sideways_use_adx': False, 'sideways_use_spike': True, 'sideways_rsi_required': False}.
[I 2025-08-31 10:28:15,329] Trial 537 finished with values: [-1000000000.0, 1000000000.0] and parameters: {'p_sma': 15, 'p_std': 47, 'p_atr': 24, 'p_adx': 25, 'rsi_period': 25, 'ema1': 18, 'ema2': 36, 'slip_atr_k': 0.18190140620650647, 'slip_spread_k': 0.15269264001849106, 'spread_hl_frac': 0.012144334472043303, 'bb_std_mult': 3.4479396193218217, 'rsi_os': 37, 'rsi_ob': 86, 'vol_spike': 0.2954202844098, 'adx_thresh': 22.7001230793576, 'atr_min_pct': 0.015430724637178322, 'atr_max_pct': 0.11790544412062193, 'tp_mult': 1.9516748419582532, 'tsl_mult': 0.07292270135478646, 'strategy': 'breakout', 'time_stop': 127, 'use_sma': False, 'use_atr': False, 'use_adx': False, 'use_ema': True, 'use_spike': True, 'rsi_required': False, 'edge_k': 1.2114320458422663, 'edge_cap': 0.9890264384253972, 'bull_strategy': 'mean_reversion', 'bull_bb_std_mult': 3.139823893300961, 'bull_rsi_os': 23, 'bull_rsi_ob': 65, 'bull_adx_thresh': 27.454175248466164, 'bull_atr_min_pct': 0.007092205632133093, 'bull_atr_max_pct': 0.08572972503623263, 'bull_tp_mult': 2.2275071606924293, 'bull_tsl_mult': 0.9118053839100511, 'bull_time_stop': 90, 'bull_use_sma': False, 'bull_use_ema': False, 'bull_use_atr': False, 'bull_use_adx': False, 'bull_use_spike': False, 'bull_rsi_required': True, 'bear_strategy': 'mean_reversion', 'bear_bb_std_mult': 3.022873213589424, 'bear_rsi_os': 30, 'bear_rsi_ob': 61, 'bear_adx_thresh': 9.055724488683174, 'bear_atr_min_pct': 0.008929099602133679, 'bear_atr_max_pct': 0.110066065783553, 'bear_tp_mult': 2.100147858929167, 'bear_tsl_mult': 0.26084564723470194, 'bear_time_stop': 77, 'bear_use_sma': True, 'bear_use_ema': True, 'bear_use_atr': False, 'bear_use_adx': False, 'bear_use_spike': True, 'bear_rsi_required': True, 'sideways_strategy': 'breakout', 'sideways_bb_std_mult': 0.9809750425163571, 'sideways_rsi_os': 18, 'sideways_rsi_ob': 93, 'sideways_adx_thresh': 29.53008887139061, 'sideways_atr_min_pct': 0.0009427078084292078, 'sideways_atr_max_pct': 0.11424051446586889, 'sideways_tp_mult': 2.8532285304172684, 'sideways_tsl_mult': 0.04596278536353546, 'sideways_time_stop': 238, 'sideways_use_sma': True, 'sideways_use_ema': True, 'sideways_use_atr': False, 'sideways_use_adx': False, 'sideways_use_spike': True, 'sideways_rsi_required': False}.
