[I 2025-08-31 10:45:42,194] Trial 665 finished with values: [-1000000000.0, 1000000000.0] and parameters: {'p_sma': 8, 'p_std': 51, 'p_atr': 26, 'p_adx': 12, 'rsi_period': 27, 'ema1': 17, 'ema2': 39, 'slip_atr_k': 0.1303668005228968, 'slip_spread_k': 0.030591594942806805, 'spread_hl_frac': 0.009290355004504612, 'bb_std_mult': 3.5155788159638046, 'rsi_os': 41, 'rsi_ob': 82, 'vol_spike': 0.02467509238105786, 'adx_thresh': 13.001674915111613, 'atr_min_pct': 0.005211747144547946, 'atr_max_pct': 0.11724698943513412, 'tp_mult': 2.182059324744249, 'tsl_mult': 0.10457658799008138, 'strategy': 'breakout', 'time_stop': 109, 'use_sma': False, 'use_atr': False, 'use_adx': False, 'use_ema': True, 'use_spike': True, 'rsi_required': True, 'edge_k': 1.1271656661881193, 'edge_cap': 0.08778890560842922, 'bull_strategy': 'mean_reversion', 'bull_bb_std_mult': 1.7961945551129164, 'bull_rsi_os': 42, 'bull_rsi_ob': 91, 'bull_adx_thresh': 31.008460232408556, 'bull_atr_min_pct': 0.00685285716093521, 'bull_atr_max_pct': 0.08727077868548352, 'bull_tp_mult': 2.2580759004098323, 'bull_tsl_mult': 0.9691454211614917, 'bull_time_stop': 72, 'bull_use_sma': True, 'bull_use_ema': False, 'bull_use_atr': False, 'bull_use_adx': False, 'bull_use_spike': False, 'bull_rsi_required': True, 'bear_strategy': 'breakout', 'bear_bb_std_mult': 2.984429438723513, 'bear_rsi_os': 26, 'bear_rsi_ob': 55, 'bear_adx_thresh': 20.925954997038605, 'bear_atr_min_pct': 0.003987114001232471, 'bear_atr_max_pct': 0.09922873753761921, 'bear_tp_mult': 2.0395247298209234, 'bear_tsl_mult': 0.4534145499814858, 'bear_time_stop': 224, 'bear_use_sma': False, 'bear_use_ema': True, 'bear_use_atr': True, 'bear_use_adx': True, 'bear_use_spike': True, 'bear_rsi_required': True, 'sideways_strategy': 'breakout', 'sideways_bb_std_mult': 1.0115300339477866, 'sideways_rsi_os': 11, 'sideways_rsi_ob': 94, 'sideways_adx_thresh': 28.968385164593215, 'sideways_atr_min_pct': 0.0011330487505531504, 'sideways_atr_max_pct': 0.09456310573555722, 'sideways_tp_mult': 2.961491946639892, 'sideways_tsl_mult': 0.06574070762059227, 'sideways_time_stop': 172, 'sideways_use_sma': False, 'sideways_use_ema': True, 'sideways_use_atr': False, 'sideways_use_adx': False, 'sideways_use_spike': True, 'sideways_rsi_required': False}.
[I 2025-08-31 10:45:42,399] Trial 667 finished with values: [-1000000000.0, 1000000000.0] and parameters: {'p_sma': 10, 'p_std': 52, 'p_atr': 29, 'p_adx': 9, 'rsi_period': 25, 'ema1': 17, 'ema2': 38, 'slip_atr_k': 0.12111651464539394, 'slip_spread_k': 0.08097266281113878, 'spread_hl_frac': 0.007429497307696839, 'bb_std_mult': 1.3382853592477304, 'rsi_os': 41, 'rsi_ob': 78, 'vol_spike': 0.2696203197081052, 'adx_thresh': 23.27433853975425, 'atr_min_pct': 0.006271032689643231, 'atr_max_pct': 0.116947345260554, 'tp_mult': 2.814660467769831, 'tsl_mult': 0.03934596450537904, 'strategy': 'mean_reversion', 'time_stop': 88, 'use_sma': True, 'use_atr': False, 'use_adx': True, 'use_ema': True, 'use_spike': True, 'rsi_required': True, 'edge_k': 1.5521049715505337, 'edge_cap': 0.13761464224116943, 'bull_strategy': 'breakout', 'bull_bb_std_mult': 3.51891791204649, 'bull_rsi_os': 41, 'bull_rsi_ob': 62, 'bull_adx_thresh': 11.122957281109331, 'bull_atr_min_pct': 0.015587124120872547, 'bull_atr_max_pct': 0.03845889915978988, 'bull_tp_mult': 2.1765458092939785, 'bull_tsl_mult': 0.9695072153918266, 'bull_time_stop': 74, 'bull_use_sma': True, 'bull_use_ema': True, 'bull_use_atr': False, 'bull_use_adx': True, 'bull_use_spike': False, 'bull_rsi_required': True, 'bear_strategy': 'breakout', 'bear_bb_std_mult': 2.9833013217261612, 'bear_rsi_os': 29, 'bear_rsi_ob': 82, 'bear_adx_thresh': 21.204749517236035, 'bear_atr_min_pct': 0.027835550167305684, 'bear_atr_max_pct': 0.11198094373889181, 'bear_tp_mult': 2.0539169766483516, 'bear_tsl_mult': 0.42759328968034066, 'bear_time_stop': 260, 'bear_use_sma': True, 'bear_use_ema': True, 'bear_use_atr': True, 'bear_use_adx': False, 'bear_use_spike': True, 'bear_rsi_required': True, 'sideways_strategy': 'breakout', 'sideways_bb_std_mult': 2.969663952498008, 'sideways_rsi_os': 23, 'sideways_rsi_ob': 79, 'sideways_adx_thresh': 13.339506457708563, 'sideways_atr_min_pct': 0.001185761532967608, 'sideways_atr_max_pct': 0.12576931688535997, 'sideways_tp_mult': 2.9572920175797104, 'sideways_tsl_mult': 0.2746339628000872, 'sideways_time_stop': 225, 'sideways_use_sma': False, 'sideways_use_ema': True, 'sideways_use_atr': False, 'sideways_use_adx': False, 'sideways_use_spike': True, 'sideways_rsi_required': False}.
[I 2025-08-31 10:46:15,143] Trial 671 finished with values: [-1000000000.0, 1000000000.0] and parameters: {'p_sma': 5, 'p_std': 59, 'p_atr': 29, 'p_adx': 26, 'rsi_period': 24, 'ema1': 18, 'ema2': 46, 'slip_atr_k': 0.041807463122364566, 'slip_spread_k': 0.11420336851608384, 'spread_hl_frac': 0.04646782451237458, 'bb_std_mult': 1.2321265946530344, 'rsi_os': 30, 'rsi_ob': 75, 'vol_spike': 0.29320326943234903, 'adx_thresh': 24.54528798333703, 'atr_min_pct': 0.01416546597449406, 'atr_max_pct': 0.12820251354505668, 'tp_mult': 2.8711970931923885, 'tsl_mult': 0.7110400203767309, 'strategy': 'breakout', 'time_stop': 80, 'use_sma': False, 'use_atr': True, 'use_adx': False, 'use_ema': True, 'use_spike': False, 'rsi_required': True, 'edge_k': 1.2553823746505854, 'edge_cap': 0.6735338738903454, 'bull_strategy': 'mean_reversion', 'bull_bb_std_mult': 1.1770628115828177, 'bull_rsi_os': 45, 'bull_rsi_ob': 68, 'bull_adx_thresh': 5.910122877207206, 'bull_atr_min_pct': 0.006096007781077018, 'bull_atr_max_pct': 0.01157274899996151, 'bull_tp_mult': 2.1726785691006, 'bull_tsl_mult': 0.9988985356807756, 'bull_time_stop': 64, 'bull_use_sma': True, 'bull_use_ema': False, 'bull_use_atr': False, 'bull_use_adx': False, 'bull_use_spike': False, 'bull_rsi_required': True, 'bear_strategy': 'breakout', 'bear_bb_std_mult': 2.139217236437579, 'bear_rsi_os': 27, 'bear_rsi_ob': 78, 'bear_adx_thresh': 13.34685535536827, 'bear_atr_min_pct': 0.0077055029487192025, 'bear_atr_max_pct': 0.1017540750440355, 'bear_tp_mult': 1.2106234347908784, 'bear_tsl_mult': 0.6930760976740531, 'bear_time_stop': 267, 'bear_use_sma': False, 'bear_use_ema': True, 'bear_use_atr': False, 'bear_use_adx': True, 'bear_use_spike': True, 'bear_rsi_required': False, 'sideways_strategy': 'mean_reversion', 'sideways_bb_std_mult': 0.853706275919051, 'sideways_rsi_os': 25, 'sideways_rsi_ob': 93, 'sideways_adx_thresh': 30.633831957482982, 'sideways_atr_min_pct': 0.0005176873215493821, 'sideways_atr_max_pct': 0.10286252611572765, 'sideways_tp_mult': 2.999720284654526, 'sideways_tsl_mult': 0.591723046762784, 'sideways_time_stop': 214, 'sideways_use_sma': True, 'sideways_use_ema': False, 'sideways_use_atr': False, 'sideways_use_adx': False, 'sideways_use_spike': True, 'sideways_rsi_required': True}.
[I 2025-08-31 10:46:15,421] Trial 668 finished with values: [-1000000000.0, 1000000000.0] and parameters: {'p_sma': 13, 'p_std': 59, 'p_atr': 29, 'p_adx': 24, 'rsi_period': 60, 'ema1': 19, 'ema2': 41, 'slip_atr_k': 0.12018198804181895, 'slip_spread_k': 0.635864041414809, 'spread_hl_frac': 0.025262854582702242, 'bb_std_mult': 1.330668548383902, 'rsi_os': 35, 'rsi_ob': 70, 'vol_spike': 0.287130392382822, 'adx_thresh': 27.125985902628994, 'atr_min_pct': 0.012466650193883702, 'atr_max_pct': 0.12780350247469985, 'tp_mult': 2.833103082773595, 'tsl_mult': 0.03903570354323553, 'strategy': 'breakout', 'time_stop': 140, 'use_sma': False, 'use_atr': False, 'use_adx': False, 'use_ema': True, 'use_spike': False, 'rsi_required': True, 'edge_k': 1.9575077280140722, 'edge_cap': 0.13316335571120097, 'bull_strategy': 'mean_reversion', 'bull_bb_std_mult': 1.2428272841912336, 'bull_rsi_os': 27, 'bull_rsi_ob': 78, 'bull_adx_thresh': 29.322777471168028, 'bull_atr_min_pct': 0.006087933914242747, 'bull_atr_max_pct': 0.09612942535508658, 'bull_tp_mult': 2.74471803222149, 'bull_tsl_mult': 0.9654237235845483, 'bull_time_stop': 65, 'bull_use_sma': True, 'bull_use_ema': True, 'bull_use_atr': False, 'bull_use_adx': True, 'bull_use_spike': False, 'bull_rsi_required': True, 'bear_strategy': 'breakout', 'bear_bb_std_mult': 3.4019617135049236, 'bear_rsi_os': 29, 'bear_rsi_ob': 59, 'bear_adx_thresh': 22.61733891529061, 'bear_atr_min_pct': 0.0076915648470496254, 'bear_atr_max_pct': 0.11134390752464704, 'bear_tp_mult': 1.5378933788620033, 'bear_tsl_mult': 0.11768359773162396, 'bear_time_stop': 23, 'bear_use_sma': False, 'bear_use_ema': True, 'bear_use_atr': False, 'bear_use_adx': True, 'bear_use_spike': True, 'bear_rsi_required': True, 'sideways_strategy': 'breakout', 'sideways_bb_std_mult': 0.8240884986679589, 'sideways_rsi_os': 23, 'sideways_rsi_ob': 93, 'sideways_adx_thresh': 14.333441880808476, 'sideways_atr_min_pct': 0.0012001686537661729, 'sideways_atr_max_pct': 0.09486164716253939, 'sideways_tp_mult': 2.6039516410946426, 'sideways_tsl_mult': 0.09936423679535716, 'sideways_time_stop': 143, 'sideways_use_sma': True, 'sideways_use_ema': True, 'sideways_use_atr': False, 'sideways_use_adx': False, 'sideways_use_spike': True, 'sideways_rsi_required': False}.
[I 2025-08-31 10:46:15,421] Trial 670 finished with values: [-1000000000.0, 1000000000.0] and parameters: {'p_sma': 56, 'p_std': 53, 'p_atr': 29, 'p_adx': 9, 'rsi_period': 61, 'ema1': 18, 'ema2': 37, 'slip_atr_k': 0.19704432326459465, 'slip_spread_k': 0.6356056748333065, 'spread_hl_frac': 0.04690738154537613, 'bb_std_mult': 1.1601287324603164, 'rsi_os': 38, 'rsi_ob': 75, 'vol_spike': 0.2999482401391673, 'adx_thresh': 16.799050425412858, 'atr_min_pct': 0.014293840922267185, 'atr_max_pct': 0.12468716280469981, 'tp_mult': 2.815254914389337, 'tsl_mult': 0.03981618394648426, 'strategy': 'mean_reversion', 'time_stop': 141, 'use_sma': True, 'use_atr': False, 'use_adx': False, 'use_ema': True, 'use_spike': False, 'rsi_required': True, 'edge_k': 1.8194267518122227, 'edge_cap': 0.1382218674515337, 'bull_strategy': 'breakout', 'bull_bb_std_mult': 1.2447646783829278, 'bull_rsi_os': 17, 'bull_rsi_ob': 78, 'bull_adx_thresh': 29.31652523327449, 'bull_atr_min_pct': 0.00582391993077057, 'bull_atr_max_pct': 0.050912741374621186, 'bull_tp_mult': 2.163077235002675, 'bull_tsl_mult': 0.9990871930473504, 'bull_time_stop': 66, 'bull_use_sma': True, 'bull_use_ema': True, 'bull_use_atr': False, 'bull_use_adx': True, 'bull_use_spike': False, 'bull_rsi_required': True, 'bear_strategy': 'breakout', 'bear_bb_std_mult': 2.7886610891322303, 'bear_rsi_os': 29, 'bear_rsi_ob': 59, 'bear_adx_thresh': 25.496228203133935, 'bear_atr_min_pct': 0.008989567282764798, 'bear_atr_max_pct': 0.11230542594296697, 'bear_tp_mult': 1.5225407156566355, 'bear_tsl_mult': 0.4201126086383399, 'bear_time_stop': 79, 'bear_use_sma': True, 'bear_use_ema': True, 'bear_use_atr': False, 'bear_use_adx': False, 'bear_use_spike': True, 'bear_rsi_required': True, 'sideways_strategy': 'breakout', 'sideways_bb_std_mult': 0.8307111531883942, 'sideways_rsi_os': 23, 'sideways_rsi_ob': 93, 'sideways_adx_thresh': 13.161414836885132, 'sideways_atr_min_pct': 0.02414326885090203, 'sideways_atr_max_pct': 0.12205807227537632, 'sideways_tp_mult': 2.3778292468545716, 'sideways_tsl_mult': 0.6034227219480933, 'sideways_time_stop': 143, 'sideways_use_sma': True, 'sideways_use_ema': True, 'sideways_use_atr': False, 'sideways_use_adx': False, 'sideways_use_spike': True, 'sideways_rsi_required': False}.
[I 2025-08-31 10:46:15,607] Trial 669 finished with values: [-1000000000.0, 1000000000.0] and parameters: {'p_sma': 13, 'p_std': 51, 'p_atr': 23, 'p_adx': 9, 'rsi_period': 60, 'ema1': 19, 'ema2': 37, 'slip_atr_k': 0.04289260652815374, 'slip_spread_k': 0.1137950967471259, 'spread_hl_frac': 0.007326287540955247, 'bb_std_mult': 1.3325615511182944, 'rsi_os': 40, 'rsi_ob': 58, 'vol_spike': 0.199538120155184, 'adx_thresh': 24.570481147959367, 'atr_min_pct': 0.014204421312211904, 'atr_max_pct': 0.029124367080383913, 'tp_mult': 2.1055923706343167, 'tsl_mult': 0.9513728601690719, 'strategy': 'breakout', 'time_stop': 108, 'use_sma': False, 'use_atr': False, 'use_adx': False, 'use_ema': True, 'use_spike': False, 'rsi_required': True, 'edge_k': 1.8037972254679704, 'edge_cap': 0.5773772570844525, 'bull_strategy': 'mean_reversion', 'bull_bb_std_mult': 1.6569511670316004, 'bull_rsi_os': 27, 'bull_rsi_ob': 78, 'bull_adx_thresh': 31.93302800352781, 'bull_atr_min_pct': 0.006363078136754405, 'bull_atr_max_pct': 0.010917632357837465, 'bull_tp_mult': 2.2570435800635114, 'bull_tsl_mult': 0.9650308032817553, 'bull_time_stop': 65, 'bull_use_sma': True, 'bull_use_ema': True, 'bull_use_atr': False, 'bull_use_adx': True, 'bull_use_spike': False, 'bull_rsi_required': True, 'bear_strategy': 'breakout', 'bear_bb_std_mult': 1.6492956169818538, 'bear_rsi_os': 29, 'bear_rsi_ob': 46, 'bear_adx_thresh': 13.442444860767672, 'bear_atr_min_pct': 0.007782592571336974, 'bear_atr_max_pct': 0.10181372883260209, 'bear_tp_mult': 1.2220496497091224, 'bear_tsl_mult': 0.42741475622609, 'bear_time_stop': 293, 'bear_use_sma': False, 'bear_use_ema': True, 'bear_use_atr': False, 'bear_use_adx': True, 'bear_use_spike': True, 'bear_rsi_required': True, 'sideways_strategy': 'breakout', 'sideways_bb_std_mult': 0.85642978982321, 'sideways_rsi_os': 23, 'sideways_rsi_ob': 90, 'sideways_adx_thresh': 13.462154009839827, 'sideways_atr_min_pct': 0.0010187960209481722, 'sideways_atr_max_pct': 0.09426323749592447, 'sideways_tp_mult': 2.4581109776082224, 'sideways_tsl_mult': 0.09280125660174926, 'sideways_time_stop': 224, 'sideways_use_sma': True, 'sideways_use_ema': True, 'sideways_use_atr': False, 'sideways_use_adx': False, 'sideways_use_spike': True, 'sideways_rsi_required': False}.
[I 2025-08-31 10:46:48,735] Trial 672 finished with values: [-1000000000.0, 1000000000.0] and parameters: {'p_sma': 21, 'p_std': 46, 'p_atr': 29, 'p_adx': 29, 'rsi_period': 60, 'ema1': 8, 'ema2': 41, 'slip_atr_k': 0.17372104148931844, 'slip_spread_k': 0.1370671532470158, 'spread_hl_frac': 0.01190833202389807, 'bb_std_mult': 2.0218201594403586, 'rsi_os': 35, 'rsi_ob': 87, 'vol_spike': 0.09643611695481363, 'adx_thresh': 29.45390718907892, 'atr_min_pct': 0.012565756105980583, 'atr_max_pct': 0.03085213189032055, 'tp_mult': 2.0949512197607607, 'tsl_mult': 0.059744784538726024, 'strategy': 'breakout', 'time_stop': 117, 'use_sma': False, 'use_atr': False, 'use_adx': False, 'use_ema': True, 'use_spike': False, 'rsi_required': True, 'edge_k': 0.21732405171448188, 'edge_cap': 0.11388139087192359, 'bull_strategy': 'mean_reversion', 'bull_bb_std_mult': 1.3041073320543342, 'bull_rsi_os': 27, 'bull_rsi_ob': 76, 'bull_adx_thresh': 18.843444647436346, 'bull_atr_min_pct': 0.008620056186800763, 'bull_atr_max_pct': 0.016392482219151586, 'bull_tp_mult': 2.250656833526697, 'bull_tsl_mult': 0.14989696022630222, 'bull_time_stop': 85, 'bull_use_sma': True, 'bull_use_ema': False, 'bull_use_atr': False, 'bull_use_adx': False, 'bull_use_spike': False, 'bull_rsi_required': True, 'bear_strategy': 'breakout', 'bear_bb_std_mult': 1.6145914397238061, 'bear_rsi_os': 28, 'bear_rsi_ob': 46, 'bear_adx_thresh': 32.24036659557126, 'bear_atr_min_pct': 0.01476472165577393, 'bear_atr_max_pct': 0.10339070984912427, 'bear_tp_mult': 2.438161925285355, 'bear_tsl_mult': 0.5007060889101906, 'bear_time_stop': 283, 'bear_use_sma': False, 'bear_use_ema': True, 'bear_use_atr': False, 'bear_use_adx': True, 'bear_use_spike': True, 'bear_rsi_required': True, 'sideways_strategy': 'breakout', 'sideways_bb_std_mult': 3.5434458839341243, 'sideways_rsi_os': 35, 'sideways_rsi_ob': 90, 'sideways_adx_thresh': 20.613797592075297, 'sideways_atr_min_pct': 0.010076451983804295, 'sideways_atr_max_pct': 0.10626071841951677, 'sideways_tp_mult': 2.3911337208713537, 'sideways_tsl_mult': 0.0921172076306182, 'sideways_time_stop': 230, 'sideways_use_sma': True, 'sideways_use_ema': True, 'sideways_use_atr': False, 'sideways_use_adx': False, 'sideways_use_spike': True, 'sideways_rsi_required': False}.
[I 2025-08-31 10:46:48,735] Trial 675 finished with values: [-1000000000.0, 1000000000.0] and parameters: {'p_sma': 25, 'p_std': 28, 'p_atr': 7, 'p_adx': 23, 'rsi_period': 21, 'ema1': 16, 'ema2': 34, 'slip_atr_k': 0.21514419375910332, 'slip_spread_k': 0.14241933678401641, 'spread_hl_frac': 0.01201799243607652, 'bb_std_mult': 1.9914743645005508, 'rsi_os': 13, 'rsi_ob': 83, 'vol_spike': 0.17416903248609858, 'adx_thresh': 25.3847332373285, 'atr_min_pct': 0.011689699215919813, 'atr_max_pct': 0.14998448850689233, 'tp_mult': 1.5870069381850134, 'tsl_mult': 0.06772644086885724, 'strategy': 'breakout', 'time_stop': 121, 'use_sma': False, 'use_atr': True, 'use_adx': True, 'use_ema': True, 'use_spike': False, 'rsi_required': True, 'edge_k': 1.8723385992714, 'edge_cap': 0.10804589730483918, 'bull_strategy': 'mean_reversion', 'bull_bb_std_mult': 2.0094286730770348, 'bull_rsi_os': 7, 'bull_rsi_ob': 64, 'bull_adx_thresh': 31.219842368954076, 'bull_atr_min_pct': 0.00869942255137472, 'bull_atr_max_pct': 0.0785094155114211, 'bull_tp_mult': 2.209036697576086, 'bull_tsl_mult': 0.29859039659575864, 'bull_time_stop': 214, 'bull_use_sma': True, 'bull_use_ema': False, 'bull_use_atr': True, 'bull_use_adx': False, 'bull_use_spike': True, 'bull_rsi_required': False, 'bear_strategy': 'breakout', 'bear_bb_std_mult': 1.4745944171165313, 'bear_rsi_os': 28, 'bear_rsi_ob': 83, 'bear_adx_thresh': 22.609142455698937, 'bear_atr_min_pct': 0.01773659132380989, 'bear_atr_max_pct': 0.10535481378408046, 'bear_tp_mult': 2.0952145015427432, 'bear_tsl_mult': 0.9111525312734174, 'bear_time_stop': 270, 'bear_use_sma': False, 'bear_use_ema': True, 'bear_use_atr': False, 'bear_use_adx': True, 'bear_use_spike': True, 'bear_rsi_required': False, 'sideways_strategy': 'mean_reversion', 'sideways_bb_std_mult': 1.0710386333749022, 'sideways_rsi_os': 25, 'sideways_rsi_ob': 95, 'sideways_adx_thresh': 28.411455771942506, 'sideways_atr_min_pct': 0.006906528072566724, 'sideways_atr_max_pct': 0.10610817175816825, 'sideways_tp_mult': 2.72250303184677, 'sideways_tsl_mult': 0.9512934515239695, 'sideways_time_stop': 118, 'sideways_use_sma': True, 'sideways_use_ema': False, 'sideways_use_atr': True, 'sideways_use_adx': True, 'sideways_use_spike': True, 'sideways_rsi_required': True}.
[I 2025-08-31 10:46:48,880] Trial 673 finished with values: [-1000000000.0, 1000000000.0] and parameters: {'p_sma': 13, 'p_std': 43, 'p_atr': 7, 'p_adx': 9, 'rsi_period': 53, 'ema1': 8, 'ema2': 35, 'slip_atr_k': 0.172514803582774, 'slip_spread_k': 0.1428612868225248, 'spread_hl_frac': 0.011851373487228553, 'bb_std_mult': 2.15608737858311, 'rsi_os': 13, 'rsi_ob': 84, 'vol_spike': 0.2845789580694852, 'adx_thresh': 29.481772262526828, 'atr_min_pct': 0.009572699466835893, 'atr_max_pct': 0.02853953228612653, 'tp_mult': 1.5115604260854418, 'tsl_mult': 0.06252384873419267, 'strategy': 'breakout', 'time_stop': 120, 'use_sma': False, 'use_atr': False, 'use_adx': True, 'use_ema': True, 'use_spike': False, 'rsi_required': True, 'edge_k': 1.7518995307752525, 'edge_cap': 0.10605673558179524, 'bull_strategy': 'mean_reversion', 'bull_bb_std_mult': 2.8086591439887876, 'bull_rsi_os': 7, 'bull_rsi_ob': 64, 'bull_adx_thresh': 31.687142515522698, 'bull_atr_min_pct': 0.008747124164719672, 'bull_atr_max_pct': 0.08560263246116204, 'bull_tp_mult': 2.255350547987777, 'bull_tsl_mult': 0.9004537535775085, 'bull_time_stop': 84, 'bull_use_sma': True, 'bull_use_ema': False, 'bull_use_atr': False, 'bull_use_adx': False, 'bull_use_spike': False, 'bull_rsi_required': True, 'bear_strategy': 'breakout', 'bear_bb_std_mult': 1.6136335071316261, 'bear_rsi_os': 28, 'bear_rsi_ob': 81, 'bear_adx_thresh': 21.667657568974953, 'bear_atr_min_pct': 0.005818843488887579, 'bear_atr_max_pct': 0.10417063875778533, 'bear_tp_mult': 2.9670394823666806, 'bear_tsl_mult': 0.494800673635984, 'bear_time_stop': 282, 'bear_use_sma': False, 'bear_use_ema': True, 'bear_use_atr': False, 'bear_use_adx': True, 'bear_use_spike': True, 'bear_rsi_required': True, 'sideways_strategy': 'breakout', 'sideways_bb_std_mult': 1.9064770416795151, 'sideways_rsi_os': 38, 'sideways_rsi_ob': 45, 'sideways_adx_thresh': 28.209926171006124, 'sideways_atr_min_pct': 0.01025508419933377, 'sideways_atr_max_pct': 0.10615354140736442, 'sideways_tp_mult': 2.8564139746013963, 'sideways_tsl_mult': 0.9612999773822908, 'sideways_time_stop': 228, 'sideways_use_sma': True, 'sideways_use_ema': True, 'sideways_use_atr': False, 'sideways_use_adx': False, 'sideways_use_spike': True, 'sideways_rsi_required': False}.
