[I 2025-08-31 09:30:47,599] Trial 91 finished with values: [-1000000000.0, 1000000000.0] and parameters: {'p_sma': 52, 'p_std': 21, 'p_atr': 8, 'p_adx': 7, 'rsi_period': 25, 'ema1': 8, 'ema2': 46, 'slip_atr_k': 0.011323147721493385, 'slip_spread_k': 0.3738127826185169, 'spread_hl_frac': 0.030765882794942013, 'bb_std_mult': 2.979860151078855, 'rsi_os': 19, 'rsi_ob': 59, 'vol_spike': 0.12336907558698412, 'adx_thresh': 9.583372745106246, 'atr_min_pct': 0.0034731563349886356, 'atr_max_pct': 0.0554716113432198, 'tp_mult': 1.0761446947535058, 'tsl_mult': 0.060739432394411125, 'strategy': 'breakout', 'time_stop': 199, 'use_sma': True, 'use_atr': True, 'use_adx': False, 'use_ema': True, 'use_spike': False, 'rsi_required': True, 'edge_k': 0.7499584291209869, 'edge_cap': 0.08726293372209279, 'bull_strategy': 'breakout', 'bull_bb_std_mult': 2.5003934347563264, 'bull_rsi_os': 8, 'bull_rsi_ob': 69, 'bull_adx_thresh': 21.000902560950493, 'bull_atr_min_pct': 0.016657404027897036, 'bull_atr_max_pct': 0.10264043120004161, 'bull_tp_mult': 2.7099299491711464, 'bull_tsl_mult': 0.39244566823404414, 'bull_time_stop': 204, 'bull_use_sma': False, 'bull_use_ema': False, 'bull_use_atr': False, 'bull_use_adx': True, 'bull_use_spike': True, 'bull_rsi_required': True, 'bear_strategy': 'mean_reversion', 'bear_bb_std_mult': 2.68847939918302, 'bear_rsi_os': 54, 'bear_rsi_ob': 66, 'bear_adx_thresh': 17.78915182340974, 'bear_atr_min_pct': 0.02263639971190594, 'bear_atr_max_pct': 0.14994253945074962, 'bear_tp_mult': 2.1207169368387104, 'bear_tsl_mult': 0.3887385631907587, 'bear_time_stop': 44, 'bear_use_sma': False, 'bear_use_ema': True, 'bear_use_atr': False, 'bear_use_adx': False, 'bear_use_spike': False, 'bear_rsi_required': False, 'sideways_strategy': 'breakout', 'sideways_bb_std_mult': 2.6737086214021875, 'sideways_rsi_os': 55, 'sideways_rsi_ob': 65, 'sideways_adx_thresh': 17.27874337577031, 'sideways_atr_min_pct': 0.009143534954828628, 'sideways_atr_max_pct': 0.09939668153139077, 'sideways_tp_mult': 1.331875969703995, 'sideways_tsl_mult': 0.6685004476244214, 'sideways_time_stop': 14, 'sideways_use_sma': True, 'sideways_use_ema': True, 'sideways_use_atr': True, 'sideways_use_adx': True, 'sideways_use_spike': False, 'sideways_rsi_required': False}.
[I 2025-08-31 09:30:48,146] Trial 92 finished with values: [-1000000000.0, 1000000000.0] and parameters: {'p_sma': 54, 'p_std': 20, 'p_atr': 16, 'p_adx': 7, 'rsi_period': 25, 'ema1': 8, 'ema2': 45, 'slip_atr_k': 0.010688212224664137, 'slip_spread_k': 0.35234879933487023, 'spread_hl_frac': 0.03053144675649441, 'bb_std_mult': 3.1676481848485785, 'rsi_os': 19, 'rsi_ob': 59, 'vol_spike': 0.11849704802811666, 'adx_thresh': 7.475173001950657, 'atr_min_pct': 0.011866802880464145, 'atr_max_pct': 0.04788769359588869, 'tp_mult': 1.0581640095664862, 'tsl_mult': 0.05095900220338302, 'strategy': 'breakout', 'time_stop': 205, 'use_sma': True, 'use_atr': True, 'use_adx': False, 'use_ema': False, 'use_spike': False, 'rsi_required': True, 'edge_k': 1.582439329386419, 'edge_cap': 0.09952390130453236, 'bull_strategy': 'breakout', 'bull_bb_std_mult': 3.530487851313203, 'bull_rsi_os': 28, 'bull_rsi_ob': 72, 'bull_adx_thresh': 25.20043694617608, 'bull_atr_min_pct': 0.02026658563536511, 'bull_atr_max_pct': 0.1033368238397602, 'bull_tp_mult': 2.752610410066409, 'bull_tsl_mult': 0.40906236485281344, 'bull_time_stop': 224, 'bull_use_sma': False, 'bull_use_ema': False, 'bull_use_atr': False, 'bull_use_adx': True, 'bull_use_spike': False, 'bull_rsi_required': True, 'bear_strategy': 'mean_reversion', 'bear_bb_std_mult': 2.7845235913330195, 'bear_rsi_os': 55, 'bear_rsi_ob': 67, 'bear_adx_thresh': 17.999444862521806, 'bear_atr_min_pct': 0.022187403391573053, 'bear_atr_max_pct': 0.14404583904936924, 'bear_tp_mult': 2.162410962065072, 'bear_tsl_mult': 0.41197311513617024, 'bear_time_stop': 44, 'bear_use_sma': False, 'bear_use_ema': False, 'bear_use_atr': False, 'bear_use_adx': False, 'bear_use_spike': False, 'bear_rsi_required': True, 'sideways_strategy': 'mean_reversion', 'sideways_bb_std_mult': 2.699954412274143, 'sideways_rsi_os': 55, 'sideways_rsi_ob': 64, 'sideways_adx_thresh': 17.572554023150712, 'sideways_atr_min_pct': 0.008054814486370163, 'sideways_atr_max_pct': 0.05457175806753777, 'sideways_tp_mult': 1.334963973820809, 'sideways_tsl_mult': 0.518772223858638, 'sideways_time_stop': 26, 'sideways_use_sma': True, 'sideways_use_ema': True, 'sideways_use_atr': False, 'sideways_use_adx': True, 'sideways_use_spike': False, 'sideways_rsi_required': True}.
[I 2025-08-31 09:30:48,147] Trial 89 finished with values: [-1000000000.0, 1000000000.0] and parameters: {'p_sma': 52, 'p_std': 52, 'p_atr': 8, 'p_adx': 23, 'rsi_period': 9, 'ema1': 8, 'ema2': 55, 'slip_atr_k': 0.028542116591038794, 'slip_spread_k': 0.40874150934831616, 'spread_hl_frac': 0.029387786966301795, 'bb_std_mult': 0.5460243161419027, 'rsi_os': 24, 'rsi_ob': 52, 'vol_spike': 0.13935774145558832, 'adx_thresh': 20.700624478702814, 'atr_min_pct': 0.009542449253396305, 'atr_max_pct': 0.06206941583292561, 'tp_mult': 2.369442374921459, 'tsl_mult': 0.4914690116358847, 'strategy': 'breakout', 'time_stop': 175, 'use_sma': True, 'use_atr': True, 'use_adx': False, 'use_ema': True, 'use_spike': False, 'rsi_required': True, 'edge_k': 1.6903433933590062, 'edge_cap': 0.9471925924756787, 'bull_strategy': 'breakout', 'bull_bb_std_mult': 2.5120589625244882, 'bull_rsi_os': 26, 'bull_rsi_ob': 79, 'bull_adx_thresh': 29.600015734889936, 'bull_atr_min_pct': 0.0280504981753199, 'bull_atr_max_pct': 0.024130772656239363, 'bull_tp_mult': 2.069899411123172, 'bull_tsl_mult': 0.5739113326984562, 'bull_time_stop': 298, 'bull_use_sma': False, 'bull_use_ema': False, 'bull_use_atr': True, 'bull_use_adx': True, 'bull_use_spike': False, 'bull_rsi_required': True, 'bear_strategy': 'mean_reversion', 'bear_bb_std_mult': 0.8901938096826337, 'bear_rsi_os': 54, 'bear_rsi_ob': 82, 'bear_adx_thresh': 28.29036632345088, 'bear_atr_min_pct': 0.0016348412215163085, 'bear_atr_max_pct': 0.14486146863567212, 'bear_tp_mult': 2.261086953368464, 'bear_tsl_mult': 0.4102146367030964, 'bear_time_stop': 93, 'bear_use_sma': False, 'bear_use_ema': False, 'bear_use_atr': True, 'bear_use_adx': False, 'bear_use_spike': False, 'bear_rsi_required': False, 'sideways_strategy': 'breakout', 'sideways_bb_std_mult': 1.704629968219302, 'sideways_rsi_os': 54, 'sideways_rsi_ob': 77, 'sideways_adx_thresh': 11.43575979112724, 'sideways_atr_min_pct': 0.028273295260246568, 'sideways_atr_max_pct': 0.026585438948809395, 'sideways_tp_mult': 1.5919725386554906, 'sideways_tsl_mult': 0.5150424812046419, 'sideways_time_stop': 46, 'sideways_use_sma': False, 'sideways_use_ema': True, 'sideways_use_atr': False, 'sideways_use_adx': False, 'sideways_use_spike': False, 'sideways_rsi_required': False}.
[I 2025-08-31 09:31:27,940] Trial 94 finished with values: [-1000000000.0, 1000000000.0] and parameters: {'p_sma': 54, 'p_std': 22, 'p_atr': 14, 'p_adx': 7, 'rsi_period': 66, 'ema1': 10, 'ema2': 56, 'slip_atr_k': 0.005449781607557411, 'slip_spread_k': 0.3186921170981316, 'spread_hl_frac': 0.028323023033099394, 'bb_std_mult': 3.1734969897625653, 'rsi_os': 23, 'rsi_ob': 49, 'vol_spike': 0.13266940770481894, 'adx_thresh': 9.223260465107316, 'atr_min_pct': 0.012016786033216664, 'atr_max_pct': 0.05133932368882022, 'tp_mult': 1.5687827162231043, 'tsl_mult': 0.025502524605621146, 'strategy': 'breakout', 'time_stop': 172, 'use_sma': True, 'use_atr': False, 'use_adx': False, 'use_ema': False, 'use_spike': True, 'rsi_required': True, 'edge_k': 1.4727845676942977, 'edge_cap': 0.14616429632439984, 'bull_strategy': 'breakout', 'bull_bb_std_mult': 3.546833645506979, 'bull_rsi_os': 28, 'bull_rsi_ob': 72, 'bull_adx_thresh': 25.135199290810434, 'bull_atr_min_pct': 0.020388551975616776, 'bull_atr_max_pct': 0.09335698015422106, 'bull_tp_mult': 2.7877206044083205, 'bull_tsl_mult': 0.5407434306834937, 'bull_time_stop': 222, 'bull_use_sma': True, 'bull_use_ema': False, 'bull_use_atr': True, 'bull_use_adx': False, 'bull_use_spike': False, 'bull_rsi_required': True, 'bear_strategy': 'breakout', 'bear_bb_std_mult': 2.3592390482099654, 'bear_rsi_os': 54, 'bear_rsi_ob': 90, 'bear_adx_thresh': 18.33918529267176, 'bear_atr_min_pct': 0.021610252848165826, 'bear_atr_max_pct': 0.1448188113803006, 'bear_tp_mult': 2.4719831705892488, 'bear_tsl_mult': 0.35382162813354223, 'bear_time_stop': 62, 'bear_use_sma': True, 'bear_use_ema': False, 'bear_use_atr': False, 'bear_use_adx': True, 'bear_use_spike': True, 'bear_rsi_required': True, 'sideways_strategy': 'mean_reversion', 'sideways_bb_std_mult': 2.2828808025761425, 'sideways_rsi_os': 54, 'sideways_rsi_ob': 67, 'sideways_adx_thresh': 19.293955745271337, 'sideways_atr_min_pct': 0.007460934802792663, 'sideways_atr_max_pct': 0.05429241298584116, 'sideways_tp_mult': 1.449086649962998, 'sideways_tsl_mult': 0.5193805146224794, 'sideways_time_stop': 32, 'sideways_use_sma': True, 'sideways_use_ema': True, 'sideways_use_atr': False, 'sideways_use_adx': False, 'sideways_use_spike': True, 'sideways_rsi_required': True}.
[I 2025-08-31 09:31:28,939] Trial 96 finished with values: [-1000000000.0, 1000000000.0] and parameters: {'p_sma': 56, 'p_std': 25, 'p_atr': 13, 'p_adx': 7, 'rsi_period': 62, 'ema1': 6, 'ema2': 35, 'slip_atr_k': 0.0037205676941784935, 'slip_spread_k': 0.29978707900402735, 'spread_hl_frac': 0.03254335725479035, 'bb_std_mult': 3.214054607959284, 'rsi_os': 23, 'rsi_ob': 91, 'vol_spike': 0.12861624327421348, 'adx_thresh': 9.31242203198241, 'atr_min_pct': 0.013128905234515601, 'atr_max_pct': 0.06609688061883984, 'tp_mult': 1.2222636990392948, 'tsl_mult': 0.0017343258871218362, 'strategy': 'breakout', 'time_stop': 233, 'use_sma': True, 'use_atr': False, 'use_adx': True, 'use_ema': True, 'use_spike': True, 'rsi_required': False, 'edge_k': 1.487972149743479, 'edge_cap': 0.15819903050666964, 'bull_strategy': 'breakout', 'bull_bb_std_mult': 3.5998651381861224, 'bull_rsi_os': 25, 'bull_rsi_ob': 74, 'bull_adx_thresh': 23.568884578692522, 'bull_atr_min_pct': 0.01874181421610181, 'bull_atr_max_pct': 0.08868827992912118, 'bull_tp_mult': 2.6908269268369134, 'bull_tsl_mult': 0.6725216331012815, 'bull_time_stop': 235, 'bull_use_sma': True, 'bull_use_ema': False, 'bull_use_atr': True, 'bull_use_adx': False, 'bull_use_spike': False, 'bull_rsi_required': True, 'bear_strategy': 'breakout', 'bear_bb_std_mult': 2.387532109504435, 'bear_rsi_os': 51, 'bear_rsi_ob': 71, 'bear_adx_thresh': 18.68420504460484, 'bear_atr_min_pct': 0.023685448189581244, 'bear_atr_max_pct': 0.1475018319203213, 'bear_tp_mult': 2.3829232126661286, 'bear_tsl_mult': 0.340143847795779, 'bear_time_stop': 57, 'bear_use_sma': True, 'bear_use_ema': False, 'bear_use_atr': False, 'bear_use_adx': True, 'bear_use_spike': True, 'bear_rsi_required': False, 'sideways_strategy': 'breakout', 'sideways_bb_std_mult': 2.2666772751002036, 'sideways_rsi_os': 54, 'sideways_rsi_ob': 67, 'sideways_adx_thresh': 20.220248120336592, 'sideways_atr_min_pct': 0.009788661470979048, 'sideways_atr_max_pct': 0.045699070260127504, 'sideways_tp_mult': 1.5495621321456055, 'sideways_tsl_mult': 0.43443150505433165, 'sideways_time_stop': 240, 'sideways_use_sma': True, 'sideways_use_ema': True, 'sideways_use_atr': False, 'sideways_use_adx': False, 'sideways_use_spike': True, 'sideways_rsi_required': False}.
[I 2025-08-31 09:31:28,946] Trial 93 finished with values: [-1000000000.0, 1000000000.0] and parameters: {'p_sma': 54, 'p_std': 26, 'p_atr': 27, 'p_adx': 7, 'rsi_period': 18, 'ema1': 10, 'ema2': 51, 'slip_atr_k': 0.006481180949957311, 'slip_spread_k': 0.41726660464400606, 'spread_hl_frac': 0.029483121201998974, 'bb_std_mult': 2.8911155052961592, 'rsi_os': 52, 'rsi_ob': 49, 'vol_spike': 0.13417786125165806, 'adx_thresh': 16.60769542771586, 'atr_min_pct': 0.013123374794020003, 'atr_max_pct': 0.0662845347284958, 'tp_mult': 1.603524850745106, 'tsl_mult': 0.041208029113942, 'strategy': 'breakout', 'time_stop': 243, 'use_sma': True, 'use_atr': False, 'use_adx': False, 'use_ema': False, 'use_spike': True, 'rsi_required': True, 'edge_k': 1.5801361852865712, 'edge_cap': 0.14513433894273156, 'bull_strategy': 'breakout', 'bull_bb_std_mult': 3.5431428378193424, 'bull_rsi_os': 25, 'bull_rsi_ob': 72, 'bull_adx_thresh': 25.35896303449558, 'bull_atr_min_pct': 0.01831798712024589, 'bull_atr_max_pct': 0.14487176203176122, 'bull_tp_mult': 2.7811108272272547, 'bull_tsl_mult': 0.5444456069652374, 'bull_time_stop': 222, 'bull_use_sma': True, 'bull_use_ema': False, 'bull_use_atr': True, 'bull_use_adx': False, 'bull_use_spike': False, 'bull_rsi_required': True, 'bear_strategy': 'breakout', 'bear_bb_std_mult': 2.8814605414428014, 'bear_rsi_os': 55, 'bear_rsi_ob': 90, 'bear_adx_thresh': 18.20609098441104, 'bear_atr_min_pct': 0.023776003203041584, 'bear_atr_max_pct': 0.14550723433216128, 'bear_tp_mult': 2.38817746810256, 'bear_tsl_mult': 0.41427446627773135, 'bear_time_stop': 62, 'bear_use_sma': True, 'bear_use_ema': False, 'bear_use_atr': False, 'bear_use_adx': True, 'bear_use_spike': True, 'bear_rsi_required': True, 'sideways_strategy': 'mean_reversion', 'sideways_bb_std_mult': 2.2670253218349576, 'sideways_rsi_os': 54, 'sideways_rsi_ob': 57, 'sideways_adx_thresh': 20.316884373694315, 'sideways_atr_min_pct': 0.006809663077833362, 'sideways_atr_max_pct': 0.05570314863015821, 'sideways_tp_mult': 2.1306840684669734, 'sideways_tsl_mult': 0.6045409999978162, 'sideways_time_stop': 241, 'sideways_use_sma': True, 'sideways_use_ema': True, 'sideways_use_atr': False, 'sideways_use_adx': False, 'sideways_use_spike': True, 'sideways_rsi_required': True}.
[I 2025-08-31 09:31:29,167] Trial 95 finished with values: [-1000000000.0, 1000000000.0] and parameters: {'p_sma': 50, 'p_std': 26, 'p_atr': 20, 'p_adx': 7, 'rsi_period': 57, 'ema1': 6, 'ema2': 51, 'slip_atr_k': 0.005326507726472973, 'slip_spread_k': 0.28106689844929017, 'spread_hl_frac': 0.02614074649558554, 'bb_std_mult': 2.9163634197910273, 'rsi_os': 24, 'rsi_ob': 92, 'vol_spike': 0.1315184291701788, 'adx_thresh': 12.690529442443996, 'atr_min_pct': 0.013251183267823562, 'atr_max_pct': 0.05308918108363221, 'tp_mult': 1.2420084306867645, 'tsl_mult': 0.03715646073958112, 'strategy': 'breakout', 'time_stop': 25, 'use_sma': True, 'use_atr': False, 'use_adx': True, 'use_ema': True, 'use_spike': True, 'rsi_required': False, 'edge_k': 1.3668649205289416, 'edge_cap': 0.2652371017047108, 'bull_strategy': 'breakout', 'bull_bb_std_mult': 3.58611498300365, 'bull_rsi_os': 25, 'bull_rsi_ob': 61, 'bull_adx_thresh': 26.466422326994838, 'bull_atr_min_pct': 0.017971507880658384, 'bull_atr_max_pct': 0.09327243579467842, 'bull_tp_mult': 2.5579842738135667, 'bull_tsl_mult': 0.0016345211350027866, 'bull_time_stop': 214, 'bull_use_sma': True, 'bull_use_ema': False, 'bull_use_atr': True, 'bull_use_adx': False, 'bull_use_spike': False, 'bull_rsi_required': True, 'bear_strategy': 'breakout', 'bear_bb_std_mult': 2.3478893363654985, 'bear_rsi_os': 51, 'bear_rsi_ob': 71, 'bear_adx_thresh': 16.70810726805062, 'bear_atr_min_pct': 0.02368657066684387, 'bear_atr_max_pct': 0.14592050999821138, 'bear_tp_mult': 2.475937462541709, 'bear_tsl_mult': 0.3456876443207638, 'bear_time_stop': 62, 'bear_use_sma': True, 'bear_use_ema': False, 'bear_use_atr': False, 'bear_use_adx': True, 'bear_use_spike': True, 'bear_rsi_required': False, 'sideways_strategy': 'breakout', 'sideways_bb_std_mult': 2.527148525359614, 'sideways_rsi_os': 54, 'sideways_rsi_ob': 58, 'sideways_adx_thresh': 19.703715329306682, 'sideways_atr_min_pct': 0.0069841923496315895, 'sideways_atr_max_pct': 0.04652992289258912, 'sideways_tp_mult': 1.434605703122906, 'sideways_tsl_mult': 0.9664432304570114, 'sideways_time_stop': 281, 'sideways_use_sma': True, 'sideways_use_ema': True, 'sideways_use_atr': False, 'sideways_use_adx': False, 'sideways_use_spike': True, 'sideways_rsi_required': False}.
[I 2025-08-31 09:32:06,008] Trial 97 finished with values: [-1000000000.0, 1000000000.0] and parameters: {'p_sma': 59, 'p_std': 25, 'p_atr': 12, 'p_adx': 8, 'rsi_period': 20, 'ema1': 6, 'ema2': 38, 'slip_atr_k': 0.0007418109309788954, 'slip_spread_k': 0.48573562701693834, 'spread_hl_frac': 0.0320084428288403, 'bb_std_mult': 2.7480000448374047, 'rsi_os': 7, 'rsi_ob': 92, 'vol_spike': 0.11112245904358109, 'adx_thresh': 12.191922461149257, 'atr_min_pct': 0.01316675304342301, 'atr_max_pct': 0.04213472026798461, 'tp_mult': 1.2680807232589195, 'tsl_mult': 0.12223801887509686, 'strategy': 'breakout', 'time_stop': 243, 'use_sma': True, 'use_atr': True, 'use_adx': True, 'use_ema': True, 'use_spike': True, 'rsi_required': False, 'edge_k': 1.7412791406882095, 'edge_cap': 0.2709565202327402, 'bull_strategy': 'breakout', 'bull_bb_std_mult': 3.4274091554044457, 'bull_rsi_os': 25, 'bull_rsi_ob': 66, 'bull_adx_thresh': 23.09650338324588, 'bull_atr_min_pct': 0.018555931291277333, 'bull_atr_max_pct': 0.09107282718488, 'bull_tp_mult': 2.99434995950316, 'bull_tsl_mult': 0.6714549521914981, 'bull_time_stop': 234, 'bull_use_sma': True, 'bull_use_ema': False, 'bull_use_atr': True, 'bull_use_adx': False, 'bull_use_spike': False, 'bull_rsi_required': True, 'bear_strategy': 'breakout', 'bear_bb_std_mult': 2.1739668671149035, 'bear_rsi_os': 51, 'bear_rsi_ob': 94, 'bear_adx_thresh': 16.66130484819196, 'bear_atr_min_pct': 0.02352442220388855, 'bear_atr_max_pct': 0.1469341900717714, 'bear_tp_mult': 2.383128166386752, 'bear_tsl_mult': 0.5339918764346053, 'bear_time_stop': 19, 'bear_use_sma': False, 'bear_use_ema': False, 'bear_use_atr': False, 'bear_use_adx': True, 'bear_use_spike': True, 'bear_rsi_required': False, 'sideways_strategy': 'breakout', 'sideways_bb_std_mult': 2.5035565760273704, 'sideways_rsi_os': 53, 'sideways_rsi_ob': 70, 'sideways_adx_thresh': 15.394252271730707, 'sideways_atr_min_pct': 0.010635219861756725, 'sideways_atr_max_pct': 0.07680323701917648, 'sideways_tp_mult': 1.6414325642967391, 'sideways_tsl_mult': 0.43282218517718996, 'sideways_time_stop': 243, 'sideways_use_sma': True, 'sideways_use_ema': True, 'sideways_use_atr': False, 'sideways_use_adx': False, 'sideways_use_spike': True, 'sideways_rsi_required': False}.
[I 2025-08-31 09:32:06,830] Trial 98 finished with values: [-1000000000.0, 1000000000.0] and parameters: {'p_sma': 43, 'p_std': 17, 'p_atr': 28, 'p_adx': 8, 'rsi_period': 80, 'ema1': 6, 'ema2': 38, 'slip_atr_k': 0.015701348103689453, 'slip_spread_k': 0.5068909217223356, 'spread_hl_frac': 0.02575377710338443, 'bb_std_mult': 2.73594353156349, 'rsi_os': 20, 'rsi_ob': 84, 'vol_spike': 0.11287030178693018, 'adx_thresh': 11.297466837129086, 'atr_min_pct': 0.015539449790205197, 'atr_max_pct': 0.04330304186242343, 'tp_mult': 1.4503163100268066, 'tsl_mult': 0.12263251055601444, 'strategy': 'breakout', 'time_stop': 17, 'use_sma': True, 'use_atr': True, 'use_adx': True, 'use_ema': True, 'use_spike': True, 'rsi_required': True, 'edge_k': 1.7504272828644833, 'edge_cap': 0.26373116698159893, 'bull_strategy': 'breakout', 'bull_bb_std_mult': 3.4250741151303714, 'bull_rsi_os': 30, 'bull_rsi_ob': 60, 'bull_adx_thresh': 12.320244328519923, 'bull_atr_min_pct': 0.014092189534866482, 'bull_atr_max_pct': 0.07935341242075364, 'bull_tp_mult': 2.561903158976102, 'bull_tsl_mult': 0.3206310001738872, 'bull_time_stop': 255, 'bull_use_sma': True, 'bull_use_ema': False, 'bull_use_atr': True, 'bull_use_adx': False, 'bull_use_spike': False, 'bull_rsi_required': True, 'bear_strategy': 'breakout', 'bear_bb_std_mult': 2.1646330273462375, 'bear_rsi_os': 31, 'bear_rsi_ob': 94, 'bear_adx_thresh': 16.79458454427527, 'bear_atr_min_pct': 0.019893967878896857, 'bear_atr_max_pct': 0.14081438021415674, 'bear_tp_mult': 1.7683293988278788, 'bear_tsl_mult': 0.5401023625841492, 'bear_time_stop': 21, 'bear_use_sma': False, 'bear_use_ema': False, 'bear_use_atr': False, 'bear_use_adx': True, 'bear_use_spike': True, 'bear_rsi_required': False, 'sideways_strategy': 'breakout', 'sideways_bb_std_mult': 2.4271609708010726, 'sideways_rsi_os': 53, 'sideways_rsi_ob': 70, 'sideways_adx_thresh': 15.504718447655955, 'sideways_atr_min_pct': 0.017915958009480377, 'sideways_atr_max_pct': 0.023719335412616845, 'sideways_tp_mult': 1.6434244300195042, 'sideways_tsl_mult': 0.5565854319086135, 'sideways_time_stop': 151, 'sideways_use_sma': True, 'sideways_use_ema': True, 'sideways_use_atr': False, 'sideways_use_adx': False, 'sideways_use_spike': True, 'sideways_rsi_required': False}.
