[I 2025-08-31 10:54:36,002] Trial 730 finished with values: [-1000000000.0, 1000000000.0] and parameters: {'p_sma': 8, 'p_std': 46, 'p_atr': 28, 'p_adx': 17, 'rsi_period': 29, 'ema1': 16, 'ema2': 40, 'slip_atr_k': 0.08055344645152117, 'slip_spread_k': 0.13627772461824522, 'spread_hl_frac': 0.032445980421953916, 'bb_std_mult': 3.1169255951101746, 'rsi_os': 41, 'rsi_ob': 82, 'vol_spike': 0.2909211964263836, 'adx_thresh': 23.230868148812284, 'atr_min_pct': 0.011019296605859884, 'atr_max_pct': 0.05114353640510162, 'tp_mult': 2.4866270774290506, 'tsl_mult': 0.09431726199008994, 'strategy': 'breakout', 'time_stop': 102, 'use_sma': False, 'use_atr': False, 'use_adx': False, 'use_ema': True, 'use_spike': True, 'rsi_required': True, 'edge_k': 0.15818198205714495, 'edge_cap': 0.5200578937998653, 'bull_strategy': 'mean_reversion', 'bull_bb_std_mult': 1.141370599416764, 'bull_rsi_os': 27, 'bull_rsi_ob': 65, 'bull_adx_thresh': 21.192368887304028, 'bull_atr_min_pct': 0.006765019073508981, 'bull_atr_max_pct': 0.07753187257590714, 'bull_tp_mult': 2.560602226413075, 'bull_tsl_mult': 0.7680233160534278, 'bull_time_stop': 68, 'bull_use_sma': False, 'bull_use_ema': False, 'bull_use_atr': True, 'bull_use_adx': False, 'bull_use_spike': False, 'bull_rsi_required': True, 'bear_strategy': 'breakout', 'bear_bb_std_mult': 1.734204808461715, 'bear_rsi_os': 20, 'bear_rsi_ob': 76, 'bear_adx_thresh': 25.090398424333998, 'bear_atr_min_pct': 0.00768329856310381, 'bear_atr_max_pct': 0.1256893326175294, 'bear_tp_mult': 1.9951147534793627, 'bear_tsl_mult': 0.2737467724507986, 'bear_time_stop': 21, 'bear_use_sma': False, 'bear_use_ema': True, 'bear_use_atr': True, 'bear_use_adx': True, 'bear_use_spike': True, 'bear_rsi_required': True, 'sideways_strategy': 'breakout', 'sideways_bb_std_mult': 1.5046858186675918, 'sideways_rsi_os': 25, 'sideways_rsi_ob': 88, 'sideways_adx_thresh': 17.75178108101496, 'sideways_atr_min_pct': 0.006200439419048324, 'sideways_atr_max_pct': 0.0998173571076953, 'sideways_tp_mult': 2.9999662128462163, 'sideways_tsl_mult': 0.321912631302921, 'sideways_time_stop': 232, 'sideways_use_sma': False, 'sideways_use_ema': True, 'sideways_use_atr': False, 'sideways_use_adx': False, 'sideways_use_spike': True, 'sideways_rsi_required': False}.
[I 2025-08-31 10:54:36,264] Trial 731 finished with values: [-1000000000.0, 1000000000.0] and parameters: {'p_sma': 12, 'p_std': 46, 'p_atr': 28, 'p_adx': 17, 'rsi_period': 29, 'ema1': 11, 'ema2': 40, 'slip_atr_k': 0.005433250242844259, 'slip_spread_k': 0.08156820528248063, 'spread_hl_frac': 0.013200753058003688, 'bb_std_mult': 1.1277203913877705, 'rsi_os': 41, 'rsi_ob': 82, 'vol_spike': 0.03353150293789303, 'adx_thresh': 11.251375908756845, 'atr_min_pct': 0.008998226381590691, 'atr_max_pct': 0.049377395904323065, 'tp_mult': 2.9142453001886395, 'tsl_mult': 0.08954231605223581, 'strategy': 'breakout', 'time_stop': 101, 'use_sma': False, 'use_atr': False, 'use_adx': False, 'use_ema': True, 'use_spike': True, 'rsi_required': True, 'edge_k': 0.11884655884149808, 'edge_cap': 0.14194419804323163, 'bull_strategy': 'mean_reversion', 'bull_bb_std_mult': 0.5880308639726379, 'bull_rsi_os': 27, 'bull_rsi_ob': 64, 'bull_adx_thresh': 28.071670964813165, 'bull_atr_min_pct': 0.003681654415160617, 'bull_atr_max_pct': 0.08411474316434109, 'bull_tp_mult': 2.2751634066751274, 'bull_tsl_mult': 0.6988611989975482, 'bull_time_stop': 290, 'bull_use_sma': False, 'bull_use_ema': False, 'bull_use_atr': True, 'bull_use_adx': False, 'bull_use_spike': False, 'bull_rsi_required': True, 'bear_strategy': 'breakout', 'bear_bb_std_mult': 1.196043594212177, 'bear_rsi_os': 29, 'bear_rsi_ob': 45, 'bear_adx_thresh': 11.41956500664682, 'bear_atr_min_pct': 0.00804939398720104, 'bear_atr_max_pct': 0.054021167092961245, 'bear_tp_mult': 1.9981719513733498, 'bear_tsl_mult': 0.6327753512748349, 'bear_time_stop': 19, 'bear_use_sma': False, 'bear_use_ema': True, 'bear_use_atr': True, 'bear_use_adx': True, 'bear_use_spike': True, 'bear_rsi_required': True, 'sideways_strategy': 'breakout', 'sideways_bb_std_mult': 0.7273384007780404, 'sideways_rsi_os': 9, 'sideways_rsi_ob': 88, 'sideways_adx_thresh': 28.871717784239568, 'sideways_atr_min_pct': 0.006064013913419517, 'sideways_atr_max_pct': 0.10023706439300838, 'sideways_tp_mult': 1.2788207904687574, 'sideways_tsl_mult': 0.08174596683660494, 'sideways_time_stop': 169, 'sideways_use_sma': False, 'sideways_use_ema': True, 'sideways_use_atr': False, 'sideways_use_adx': False, 'sideways_use_spike': True, 'sideways_rsi_required': False}.
[I 2025-08-31 10:54:36,357] Trial 729 finished with values: [-0.025878910981437908, 0.025850002789360813] and parameters: {'p_sma': 10, 'p_std': 20, 'p_atr': 21, 'p_adx': 15, 'rsi_period': 69, 'ema1': 16, 'ema2': 40, 'slip_atr_k': 0.12973322194137094, 'slip_spread_k': 0.7114764189702559, 'spread_hl_frac': 0.042757059235163326, 'bb_std_mult': 3.1672628775886498, 'rsi_os': 41, 'rsi_ob': 80, 'vol_spike': 0.29412486873661986, 'adx_thresh': 17.606933228330426, 'atr_min_pct': 0.02759211799500496, 'atr_max_pct': 0.11630908109640324, 'tp_mult': 2.492231545800408, 'tsl_mult': 0.09761366525937833, 'strategy': 'breakout', 'time_stop': 36, 'use_sma': True, 'use_atr': False, 'use_adx': False, 'use_ema': True, 'use_spike': True, 'rsi_required': True, 'edge_k': 1.7514302025685073, 'edge_cap': 0.520013535503104, 'bull_strategy': 'breakout', 'bull_bb_std_mult': 1.1061041849319473, 'bull_rsi_os': 27, 'bull_rsi_ob': 64, 'bull_adx_thresh': 27.113326851577728, 'bull_atr_min_pct': 0.006873779739471141, 'bull_atr_max_pct': 0.0765945348659927, 'bull_tp_mult': 2.2829357785449647, 'bull_tsl_mult': 0.0005568152261538062, 'bull_time_stop': 181, 'bull_use_sma': False, 'bull_use_ema': False, 'bull_use_atr': True, 'bull_use_adx': False, 'bull_use_spike': False, 'bull_rsi_required': True, 'bear_strategy': 'breakout', 'bear_bb_std_mult': 1.7573411191370973, 'bear_rsi_os': 29, 'bear_rsi_ob': 63, 'bear_adx_thresh': 6.802120097015543, 'bear_atr_min_pct': 0.007699809526892895, 'bear_atr_max_pct': 0.038752338330694094, 'bear_tp_mult': 1.887772751182386, 'bear_tsl_mult': 0.23136110974827573, 'bear_time_stop': 28, 'bear_use_sma': False, 'bear_use_ema': True, 'bear_use_atr': True, 'bear_use_adx': True, 'bear_use_spike': True, 'bear_rsi_required': True, 'sideways_strategy': 'breakout', 'sideways_bb_std_mult': 2.284989390415771, 'sideways_rsi_os': 39, 'sideways_rsi_ob': 94, 'sideways_adx_thresh': 23.238489280841318, 'sideways_atr_min_pct': 1.5260108985070114e-05, 'sideways_atr_max_pct': 0.1465777525722171, 'sideways_tp_mult': 2.9893536613633787, 'sideways_tsl_mult': 0.07555009109552398, 'sideways_time_stop': 234, 'sideways_use_sma': False, 'sideways_use_ema': True, 'sideways_use_atr': False, 'sideways_use_adx': False, 'sideways_use_spike': True, 'sideways_rsi_required': False}.
[I 2025-08-31 10:54:36,598] Trial 732 finished with values: [-1000000000.0, 1000000000.0] and parameters: {'p_sma': 43, 'p_std': 29, 'p_atr': 21, 'p_adx': 12, 'rsi_period': 23, 'ema1': 19, 'ema2': 48, 'slip_atr_k': 0.1329695416508957, 'slip_spread_k': 0.09549394291963091, 'spread_hl_frac': 0.044258710986068775, 'bb_std_mult': 1.0563880073928615, 'rsi_os': 41, 'rsi_ob': 59, 'vol_spike': 0.26429335817008975, 'adx_thresh': 11.461864960093239, 'atr_min_pct': 0.00916315794094956, 'atr_max_pct': 0.12114198120605645, 'tp_mult': 2.919048216027486, 'tsl_mult': 0.0945622365533435, 'strategy': 'breakout', 'time_stop': 77, 'use_sma': False, 'use_atr': False, 'use_adx': False, 'use_ema': True, 'use_spike': False, 'rsi_required': True, 'edge_k': 0.16761994066323893, 'edge_cap': 0.9478911423383727, 'bull_strategy': 'mean_reversion', 'bull_bb_std_mult': 1.1441414137805253, 'bull_rsi_os': 27, 'bull_rsi_ob': 64, 'bull_adx_thresh': 19.833240758340807, 'bull_atr_min_pct': 0.006801415811347545, 'bull_atr_max_pct': 0.08328040004543198, 'bull_tp_mult': 2.2713908895572974, 'bull_tsl_mult': 0.6947225469223752, 'bull_time_stop': 42, 'bull_use_sma': False, 'bull_use_ema': False, 'bull_use_atr': True, 'bull_use_adx': True, 'bull_use_spike': False, 'bull_rsi_required': True, 'bear_strategy': 'breakout', 'bear_bb_std_mult': 1.350383558385327, 'bear_rsi_os': 24, 'bear_rsi_ob': 53, 'bear_adx_thresh': 29.391634323757955, 'bear_atr_min_pct': 0.007734412937085731, 'bear_atr_max_pct': 0.06273335273826686, 'bear_tp_mult': 2.3694558147665328, 'bear_tsl_mult': 0.19415994095044514, 'bear_time_stop': 30, 'bear_use_sma': False, 'bear_use_ema': True, 'bear_use_atr': False, 'bear_use_adx': True, 'bear_use_spike': True, 'bear_rsi_required': True, 'sideways_strategy': 'breakout', 'sideways_bb_std_mult': 1.4897856570663333, 'sideways_rsi_os': 24, 'sideways_rsi_ob': 94, 'sideways_adx_thresh': 26.17079151455116, 'sideways_atr_min_pct': 0.021627870688449114, 'sideways_atr_max_pct': 0.09535561276818103, 'sideways_tp_mult': 2.875725245209479, 'sideways_tsl_mult': 0.08592802202104041, 'sideways_time_stop': 12, 'sideways_use_sma': True, 'sideways_use_ema': True, 'sideways_use_atr': False, 'sideways_use_adx': False, 'sideways_use_spike': True, 'sideways_rsi_required': False}.
[I 2025-08-31 10:55:09,090] Trial 736 finished with values: [-1000000000.0, 1000000000.0] and parameters: {'p_sma': 26, 'p_std': 57, 'p_atr': 30, 'p_adx': 21, 'rsi_period': 20, 'ema1': 19, 'ema2': 43, 'slip_atr_k': 0.19592607850422458, 'slip_spread_k': 0.17239461396465203, 'spread_hl_frac': 0.01002089565110131, 'bb_std_mult': 2.952610348636925, 'rsi_os': 39, 'rsi_ob': 85, 'vol_spike': 0.2875285659732766, 'adx_thresh': 25.97272169761364, 'atr_min_pct': 0.011405824378767722, 'atr_max_pct': 0.12235920902068699, 'tp_mult': 2.839223209779945, 'tsl_mult': 0.7938127190622558, 'strategy': 'mean_reversion', 'time_stop': 220, 'use_sma': False, 'use_atr': False, 'use_adx': False, 'use_ema': True, 'use_spike': False, 'rsi_required': True, 'edge_k': 1.8862517482163017, 'edge_cap': 0.1526143009937555, 'bull_strategy': 'mean_reversion', 'bull_bb_std_mult': 2.1027645623533338, 'bull_rsi_os': 28, 'bull_rsi_ob': 76, 'bull_adx_thresh': 29.14842365635431, 'bull_atr_min_pct': 0.025734790558998265, 'bull_atr_max_pct': 0.0734754272063806, 'bull_tp_mult': 2.1797834232333315, 'bull_tsl_mult': 0.9613579551996182, 'bull_time_stop': 62, 'bull_use_sma': True, 'bull_use_ema': False, 'bull_use_atr': False, 'bull_use_adx': True, 'bull_use_spike': False, 'bull_rsi_required': True, 'bear_strategy': 'mean_reversion', 'bear_bb_std_mult': 2.8992179033405403, 'bear_rsi_os': 26, 'bear_rsi_ob': 71, 'bear_adx_thresh': 22.758058580909317, 'bear_atr_min_pct': 0.006183977374009327, 'bear_atr_max_pct': 0.05860613942061661, 'bear_tp_mult': 2.1161055224675174, 'bear_tsl_mult': 0.48153947738538744, 'bear_time_stop': 287, 'bear_use_sma': False, 'bear_use_ema': True, 'bear_use_atr': False, 'bear_use_adx': False, 'bear_use_spike': True, 'bear_rsi_required': True, 'sideways_strategy': 'breakout', 'sideways_bb_std_mult': 0.9818627821682652, 'sideways_rsi_os': 15, 'sideways_rsi_ob': 47, 'sideways_adx_thresh': 29.458732365474653, 'sideways_atr_min_pct': 0.008940960915857861, 'sideways_atr_max_pct': 0.09313046801635688, 'sideways_tp_mult': 2.8529550384189037, 'sideways_tsl_mult': 0.015983712695083474, 'sideways_time_stop': 238, 'sideways_use_sma': True, 'sideways_use_ema': True, 'sideways_use_atr': False, 'sideways_use_adx': False, 'sideways_use_spike': True, 'sideways_rsi_required': False}.
[I 2025-08-31 10:55:09,531] Trial 735 finished with values: [-1000000000.0, 1000000000.0] and parameters: {'p_sma': 14, 'p_std': 22, 'p_atr': 17, 'p_adx': 21, 'rsi_period': 23, 'ema1': 19, 'ema2': 37, 'slip_atr_k': 0.18590197356067778, 'slip_spread_k': 0.6798911372865571, 'spread_hl_frac': 0.020327417175454023, 'bb_std_mult': 1.2231074846378498, 'rsi_os': 39, 'rsi_ob': 85, 'vol_spike': 0.2884927460659687, 'adx_thresh': 25.987733063479954, 'atr_min_pct': 0.02597868200105065, 'atr_max_pct': 0.12114631363923621, 'tp_mult': 2.215384191623894, 'tsl_mult': 0.060854252530737174, 'strategy': 'mean_reversion', 'time_stop': 221, 'use_sma': False, 'use_atr': False, 'use_adx': False, 'use_ema': True, 'use_spike': False, 'rsi_required': True, 'edge_k': 0.685977174019986, 'edge_cap': 0.9566018835169381, 'bull_strategy': 'mean_reversion', 'bull_bb_std_mult': 1.343099611358747, 'bull_rsi_os': 10, 'bull_rsi_ob': 65, 'bull_adx_thresh': 28.88990442994847, 'bull_atr_min_pct': 0.008181969803495366, 'bull_atr_max_pct': 0.09111794425509377, 'bull_tp_mult': 2.9628494262150493, 'bull_tsl_mult': 0.9577414425210573, 'bull_time_stop': 42, 'bull_use_sma': True, 'bull_use_ema': False, 'bull_use_atr': False, 'bull_use_adx': True, 'bull_use_spike': False, 'bull_rsi_required': True, 'bear_strategy': 'mean_reversion', 'bear_bb_std_mult': 2.9238642215337323, 'bear_rsi_os': 24, 'bear_rsi_ob': 83, 'bear_adx_thresh': 22.830356253157383, 'bear_atr_min_pct': 0.006077934528404198, 'bear_atr_max_pct': 0.10795333508318647, 'bear_tp_mult': 1.2433880436434248, 'bear_tsl_mult': 0.19405078166421713, 'bear_time_stop': 286, 'bear_use_sma': False, 'bear_use_ema': True, 'bear_use_atr': False, 'bear_use_adx': False, 'bear_use_spike': True, 'bear_rsi_required': True, 'sideways_strategy': 'breakout', 'sideways_bb_std_mult': 0.9581679389530681, 'sideways_rsi_os': 12, 'sideways_rsi_ob': 95, 'sideways_adx_thresh': 27.889423309156488, 'sideways_atr_min_pct': 0.000843922375489867, 'sideways_atr_max_pct': 0.0934629954074257, 'sideways_tp_mult': 2.869018060120021, 'sideways_tsl_mult': 0.014382643448862628, 'sideways_time_stop': 11, 'sideways_use_sma': True, 'sideways_use_ema': True, 'sideways_use_atr': False, 'sideways_use_adx': False, 'sideways_use_spike': True, 'sideways_rsi_required': False}.
[I 2025-08-31 10:55:09,765] Trial 733 finished with values: [-1000000000.0, 1000000000.0] and parameters: {'p_sma': 44, 'p_std': 49, 'p_atr': 30, 'p_adx': 8, 'rsi_period': 23, 'ema1': 19, 'ema2': 39, 'slip_atr_k': 0.2078128182112343, 'slip_spread_k': 0.17043368926142022, 'spread_hl_frac': 0.01327525739053533, 'bb_std_mult': 1.1300062067683632, 'rsi_os': 27, 'rsi_ob': 85, 'vol_spike': 0.266601188183814, 'adx_thresh': 25.75932105272694, 'atr_min_pct': 0.009064670305879048, 'atr_max_pct': 0.04022510216006801, 'tp_mult': 2.928732230752591, 'tsl_mult': 0.5124659019815633, 'strategy': 'breakout', 'time_stop': 77, 'use_sma': False, 'use_atr': False, 'use_adx': False, 'use_ema': True, 'use_spike': False, 'rsi_required': True, 'edge_k': 0.23464035711999842, 'edge_cap': 0.14408132180158686, 'bull_strategy': 'mean_reversion', 'bull_bb_std_mult': 1.1526651298258814, 'bull_rsi_os': 8, 'bull_rsi_ob': 64, 'bull_adx_thresh': 29.314850647172197, 'bull_atr_min_pct': 0.025972321039443434, 'bull_atr_max_pct': 0.1036370857611551, 'bull_tp_mult': 2.2876340764311496, 'bull_tsl_mult': 0.9623734273352553, 'bull_time_stop': 61, 'bull_use_sma': True, 'bull_use_ema': False, 'bull_use_atr': True, 'bull_use_adx': True, 'bull_use_spike': False, 'bull_rsi_required': True, 'bear_strategy': 'breakout', 'bear_bb_std_mult': 2.96373466227881, 'bear_rsi_os': 29, 'bear_rsi_ob': 49, 'bear_adx_thresh': 22.740074165611905, 'bear_atr_min_pct': 0.002051355704939443, 'bear_atr_max_pct': 0.05424654346752737, 'bear_tp_mult': 2.068891830502156, 'bear_tsl_mult': 0.4778310872921278, 'bear_time_stop': 252, 'bear_use_sma': False, 'bear_use_ema': True, 'bear_use_atr': False, 'bear_use_adx': True, 'bear_use_spike': True, 'bear_rsi_required': True, 'sideways_strategy': 'breakout', 'sideways_bb_std_mult': 0.722719071926873, 'sideways_rsi_os': 12, 'sideways_rsi_ob': 94, 'sideways_adx_thresh': 29.272251383569685, 'sideways_atr_min_pct': 0.008672580244565763, 'sideways_atr_max_pct': 0.09352040842466286, 'sideways_tp_mult': 1.7869031577508405, 'sideways_tsl_mult': 0.08443546932485796, 'sideways_time_stop': 233, 'sideways_use_sma': True, 'sideways_use_ema': True, 'sideways_use_atr': False, 'sideways_use_adx': False, 'sideways_use_spike': True, 'sideways_rsi_required': False}.
[I 2025-08-31 10:55:09,856] Trial 734 finished with values: [-1000000000.0, 1000000000.0] and parameters: {'p_sma': 14, 'p_std': 20, 'p_atr': 23, 'p_adx': 29, 'rsi_period': 84, 'ema1': 19, 'ema2': 37, 'slip_atr_k': 0.18664626616006313, 'slip_spread_k': 0.520097477550149, 'spread_hl_frac': 0.010184757757026151, 'bb_std_mult': 3.2016326740112317, 'rsi_os': 39, 'rsi_ob': 80, 'vol_spike': 0.28847496078934876, 'adx_thresh': 26.16518379487583, 'atr_min_pct': 0.011476149534316634, 'atr_max_pct': 0.11935284199651784, 'tp_mult': 2.9327462705466165, 'tsl_mult': 0.0645200154523037, 'strategy': 'breakout', 'time_stop': 124, 'use_sma': False, 'use_atr': False, 'use_adx': False, 'use_ema': True, 'use_spike': False, 'rsi_required': True, 'edge_k': 1.8903153420541965, 'edge_cap': 0.9419316387529864, 'bull_strategy': 'mean_reversion', 'bull_bb_std_mult': 2.088055188383029, 'bull_rsi_os': 23, 'bull_rsi_ob': 75, 'bull_adx_thresh': 29.120662897625767, 'bull_atr_min_pct': 0.02583507654652597, 'bull_atr_max_pct': 0.0215242182401389, 'bull_tp_mult': 2.1804994377646083, 'bull_tsl_mult': 0.1711622347485391, 'bull_time_stop': 97, 'bull_use_sma': True, 'bull_use_ema': False, 'bull_use_atr': False, 'bull_use_adx': True, 'bull_use_spike': False, 'bull_rsi_required': True, 'bear_strategy': 'breakout', 'bear_bb_std_mult': 2.944607181596555, 'bear_rsi_os': 26, 'bear_rsi_ob': 90, 'bear_adx_thresh': 17.880558671941042, 'bear_atr_min_pct': 0.02729428927029602, 'bear_atr_max_pct': 0.03914571660105927, 'bear_tp_mult': 2.0604122228579227, 'bear_tsl_mult': 0.30349274851401464, 'bear_time_stop': 252, 'bear_use_sma': False, 'bear_use_ema': True, 'bear_use_atr': False, 'bear_use_adx': True, 'bear_use_spike': True, 'bear_rsi_required': True, 'sideways_strategy': 'breakout', 'sideways_bb_std_mult': 1.7410583647295934, 'sideways_rsi_os': 26, 'sideways_rsi_ob': 94, 'sideways_adx_thresh': 29.432868826670774, 'sideways_atr_min_pct': 0.004506732571406685, 'sideways_atr_max_pct': 0.09582602951634618, 'sideways_tp_mult': 2.8794634752386585, 'sideways_tsl_mult': 0.0002526905551739067, 'sideways_time_stop': 235, 'sideways_use_sma': True, 'sideways_use_ema': True, 'sideways_use_atr': False, 'sideways_use_adx': False, 'sideways_use_spike': True, 'sideways_rsi_required': False}.
[I 2025-08-31 10:55:42,730] Trial 738 finished with values: [-1000000000.0, 1000000000.0] and parameters: {'p_sma': 44, 'p_std': 49, 'p_atr': 23, 'p_adx': 29, 'rsi_period': 25, 'ema1': 17, 'ema2': 45, 'slip_atr_k': 0.1770104422537067, 'slip_spread_k': 0.23629888683018152, 'spread_hl_frac': 0.011469304572346045, 'bb_std_mult': 2.146252098021926, 'rsi_os': 40, 'rsi_ob': 89, 'vol_spike': 0.0010614659802751503, 'adx_thresh': 10.167674101960298, 'atr_min_pct': 0.024560152133045347, 'atr_max_pct': 0.040261982697458905, 'tp_mult': 1.363043248524316, 'tsl_mult': 0.38239962998576593, 'strategy': 'breakout', 'time_stop': 125, 'use_sma': False, 'use_atr': False, 'use_adx': False, 'use_ema': True, 'use_spike': False, 'rsi_required': True, 'edge_k': 0.255302445742421, 'edge_cap': 0.7380043742405975, 'bull_strategy': 'mean_reversion', 'bull_bb_std_mult': 1.2315756958692248, 'bull_rsi_os': 8, 'bull_rsi_ob': 66, 'bull_adx_thresh': 30.529061287081486, 'bull_atr_min_pct': 0.028564429373748396, 'bull_atr_max_pct': 0.052426854736935515, 'bull_tp_mult': 1.2659771713735184, 'bull_tsl_mult': 0.9990662313044687, 'bull_time_stop': 74, 'bull_use_sma': True, 'bull_use_ema': True, 'bull_use_atr': False, 'bull_use_adx': False, 'bull_use_spike': False, 'bull_rsi_required': True, 'bear_strategy': 'breakout', 'bear_bb_std_mult': 2.2978218048462558, 'bear_rsi_os': 27, 'bear_rsi_ob': 91, 'bear_adx_thresh': 20.422661032453085, 'bear_atr_min_pct': 0.027077980981165924, 'bear_atr_max_pct': 0.10473786664625628, 'bear_tp_mult': 2.0637717501128945, 'bear_tsl_mult': 0.4460614013862629, 'bear_time_stop': 46, 'bear_use_sma': True, 'bear_use_ema': True, 'bear_use_atr': False, 'bear_use_adx': True, 'bear_use_spike': True, 'bear_rsi_required': True, 'sideways_strategy': 'breakout', 'sideways_bb_std_mult': 0.8938217353622778, 'sideways_rsi_os': 43, 'sideways_rsi_ob': 59, 'sideways_adx_thresh': 30.811794521275097, 'sideways_atr_min_pct': 0.016117345254816024, 'sideways_atr_max_pct': 0.10233506408784712, 'sideways_tp_mult': 1.7857346262340967, 'sideways_tsl_mult': 0.06047400979489165, 'sideways_time_stop': 222, 'sideways_use_sma': True, 'sideways_use_ema': True, 'sideways_use_atr': False, 'sideways_use_adx': True, 'sideways_use_spike': True, 'sideways_rsi_required': False}.
