[I 2025-08-31 09:46:11,849] Trial 197 finished with values: [-1000000000.0, 1000000000.0] and parameters: {'p_sma': 49, 'p_std': 17, 'p_atr': 22, 'p_adx': 10, 'rsi_period': 20, 'ema1': 24, 'ema2': 38, 'slip_atr_k': 0.14659995839430678, 'slip_spread_k': 0.7566689942319831, 'spread_hl_frac': 0.012409153406355499, 'bb_std_mult': 0.6072447558373766, 'rsi_os': 33, 'rsi_ob': 47, 'vol_spike': 0.12724938803417926, 'adx_thresh': 5.622004238372946, 'atr_min_pct': 0.010272811091062439, 'atr_max_pct': 0.12779747970370733, 'tp_mult': 2.978269815128014, 'tsl_mult': 0.9009534199941869, 'strategy': 'breakout', 'time_stop': 152, 'use_sma': False, 'use_atr': False, 'use_adx': False, 'use_ema': False, 'use_spike': False, 'rsi_required': True, 'edge_k': 1.8459448368039175, 'edge_cap': 0.5336026953381796, 'bull_strategy': 'mean_reversion', 'bull_bb_std_mult': 1.316025622128706, 'bull_rsi_os': 32, 'bull_rsi_ob': 58, 'bull_adx_thresh': 31.48455101559237, 'bull_atr_min_pct': 0.01924297529096567, 'bull_atr_max_pct': 0.12169889943630567, 'bull_tp_mult': 1.5163771629992775, 'bull_tsl_mult': 0.5841115220370408, 'bull_time_stop': 265, 'bull_use_sma': True, 'bull_use_ema': True, 'bull_use_atr': False, 'bull_use_adx': False, 'bull_use_spike': False, 'bull_rsi_required': True, 'bear_strategy': 'breakout', 'bear_bb_std_mult': 2.9749151770158715, 'bear_rsi_os': 54, 'bear_rsi_ob': 79, 'bear_adx_thresh': 21.1027559812937, 'bear_atr_min_pct': 0.026910495664045835, 'bear_atr_max_pct': 0.06715492020369836, 'bear_tp_mult': 2.6157347375134448, 'bear_tsl_mult': 0.4901205071535862, 'bear_time_stop': 267, 'bear_use_sma': True, 'bear_use_ema': True, 'bear_use_atr': False, 'bear_use_adx': True, 'bear_use_spike': False, 'bear_rsi_required': True, 'sideways_strategy': 'mean_reversion', 'sideways_bb_std_mult': 1.1960018219875725, 'sideways_rsi_os': 20, 'sideways_rsi_ob': 49, 'sideways_adx_thresh': 34.16240467955473, 'sideways_atr_min_pct': 0.018550535632786875, 'sideways_atr_max_pct': 0.02800232250201555, 'sideways_tp_mult': 1.552250444106439, 'sideways_tsl_mult': 0.0676160909248147, 'sideways_time_stop': 215, 'sideways_use_sma': True, 'sideways_use_ema': True, 'sideways_use_atr': False, 'sideways_use_adx': False, 'sideways_use_spike': False, 'sideways_rsi_required': True}.
[I 2025-08-31 09:46:48,252] Trial 202 finished with values: [-1000000000.0, 1000000000.0] and parameters: {'p_sma': 50, 'p_std': 14, 'p_atr': 30, 'p_adx': 15, 'rsi_period': 82, 'ema1': 20, 'ema2': 37, 'slip_atr_k': 0.1670730209590379, 'slip_spread_k': 0.3293141736336759, 'spread_hl_frac': 0.011283920001227313, 'bb_std_mult': 0.7471085305693987, 'rsi_os': 22, 'rsi_ob': 49, 'vol_spike': 0.015360803209901686, 'adx_thresh': 24.182222998725628, 'atr_min_pct': 0.011375273450587284, 'atr_max_pct': 0.131045481078671, 'tp_mult': 2.7066181690103615, 'tsl_mult': 0.2942781766634334, 'strategy': 'breakout', 'time_stop': 130, 'use_sma': False, 'use_atr': False, 'use_adx': True, 'use_ema': False, 'use_spike': False, 'rsi_required': False, 'edge_k': 1.9115128176659584, 'edge_cap': 0.5960453146628408, 'bull_strategy': 'mean_reversion', 'bull_bb_std_mult': 1.3889977222187142, 'bull_rsi_os': 30, 'bull_rsi_ob': 65, 'bull_adx_thresh': 28.253892094504316, 'bull_atr_min_pct': 0.01860405578137073, 'bull_atr_max_pct': 0.1187729097426275, 'bull_tp_mult': 1.5944210428480927, 'bull_tsl_mult': 0.7903746269378037, 'bull_time_stop': 164, 'bull_use_sma': False, 'bull_use_ema': False, 'bull_use_atr': False, 'bull_use_adx': True, 'bull_use_spike': False, 'bull_rsi_required': True, 'bear_strategy': 'mean_reversion', 'bear_bb_std_mult': 0.8731271759819121, 'bear_rsi_os': 12, 'bear_rsi_ob': 46, 'bear_adx_thresh': 20.854077184368272, 'bear_atr_min_pct': 0.021488993879586013, 'bear_atr_max_pct': 0.11998938337675974, 'bear_tp_mult': 2.018355681331104, 'bear_tsl_mult': 0.5082052368963987, 'bear_time_stop': 244, 'bear_use_sma': False, 'bear_use_ema': True, 'bear_use_atr': False, 'bear_use_adx': True, 'bear_use_spike': False, 'bear_rsi_required': True, 'sideways_strategy': 'breakout', 'sideways_bb_std_mult': 0.8626417987337869, 'sideways_rsi_os': 21, 'sideways_rsi_ob': 86, 'sideways_adx_thresh': 30.730128517938233, 'sideways_atr_min_pct': 0.0023006911066174055, 'sideways_atr_max_pct': 0.11458713680126312, 'sideways_tp_mult': 1.5380841325675643, 'sideways_tsl_mult': 0.11438774284435117, 'sideways_time_stop': 192, 'sideways_use_sma': True, 'sideways_use_ema': True, 'sideways_use_atr': False, 'sideways_use_adx': True, 'sideways_use_spike': False, 'sideways_rsi_required': False}.
[I 2025-08-31 09:46:48,400] Trial 199 finished with values: [-1000000000.0, 1000000000.0] and parameters: {'p_sma': 49, 'p_std': 18, 'p_atr': 20, 'p_adx': 17, 'rsi_period': 79, 'ema1': 21, 'ema2': 37, 'slip_atr_k': 0.1407669566259817, 'slip_spread_k': 0.9098978581085988, 'spread_hl_frac': 0.012407344673806938, 'bb_std_mult': 0.7386210395650007, 'rsi_os': 31, 'rsi_ob': 49, 'vol_spike': 0.1262100598124425, 'adx_thresh': 5.778092301072821, 'atr_min_pct': 0.012576636921597883, 'atr_max_pct': 0.1295001008239343, 'tp_mult': 2.8795780100139052, 'tsl_mult': 0.04062207657382947, 'strategy': 'breakout', 'time_stop': 152, 'use_sma': False, 'use_atr': False, 'use_adx': False, 'use_ema': False, 'use_spike': False, 'rsi_required': False, 'edge_k': 1.8059386041303782, 'edge_cap': 0.47953853893783194, 'bull_strategy': 'mean_reversion', 'bull_bb_std_mult': 1.2886608334589031, 'bull_rsi_os': 30, 'bull_rsi_ob': 60, 'bull_adx_thresh': 28.111984280130933, 'bull_atr_min_pct': 0.022395608039352123, 'bull_atr_max_pct': 0.11787403100342364, 'bull_tp_mult': 1.5939635713709899, 'bull_tsl_mult': 0.39798293430795906, 'bull_time_stop': 264, 'bull_use_sma': False, 'bull_use_ema': True, 'bull_use_atr': False, 'bull_use_adx': True, 'bull_use_spike': False, 'bull_rsi_required': True, 'bear_strategy': 'mean_reversion', 'bear_bb_std_mult': 2.965651477318789, 'bear_rsi_os': 53, 'bear_rsi_ob': 61, 'bear_adx_thresh': 20.863282160861026, 'bear_atr_min_pct': 0.021877411703102735, 'bear_atr_max_pct': 0.057153692579199056, 'bear_tp_mult': 1.9853624626356496, 'bear_tsl_mult': 0.5178981425987694, 'bear_time_stop': 262, 'bear_use_sma': False, 'bear_use_ema': True, 'bear_use_atr': False, 'bear_use_adx': True, 'bear_use_spike': False, 'bear_rsi_required': True, 'sideways_strategy': 'breakout', 'sideways_bb_std_mult': 1.1688488304471787, 'sideways_rsi_os': 20, 'sideways_rsi_ob': 63, 'sideways_adx_thresh': 34.22433915227023, 'sideways_atr_min_pct': 0.018382072405624506, 'sideways_atr_max_pct': 0.02787927945250319, 'sideways_tp_mult': 1.545437385502251, 'sideways_tsl_mult': 0.06821544208686914, 'sideways_time_stop': 192, 'sideways_use_sma': True, 'sideways_use_ema': True, 'sideways_use_atr': False, 'sideways_use_adx': True, 'sideways_use_spike': False, 'sideways_rsi_required': False}.
[I 2025-08-31 09:46:48,745] Trial 200 finished with values: [-1000000000.0, 1000000000.0] and parameters: {'p_sma': 50, 'p_std': 18, 'p_atr': 8, 'p_adx': 22, 'rsi_period': 82, 'ema1': 20, 'ema2': 38, 'slip_atr_k': 0.17426819090161755, 'slip_spread_k': 0.32906729883632224, 'spread_hl_frac': 0.01241686020856872, 'bb_std_mult': 1.382459502795882, 'rsi_os': 22, 'rsi_ob': 49, 'vol_spike': 0.12428367028053644, 'adx_thresh': 5.687167159812507, 'atr_min_pct': 0.012550426837273681, 'atr_max_pct': 0.12994404097762924, 'tp_mult': 2.9909257589578715, 'tsl_mult': 0.9109674504546394, 'strategy': 'breakout', 'time_stop': 151, 'use_sma': False, 'use_atr': False, 'use_adx': False, 'use_ema': False, 'use_spike': False, 'rsi_required': False, 'edge_k': 1.907535468465337, 'edge_cap': 0.454158528934992, 'bull_strategy': 'mean_reversion', 'bull_bb_std_mult': 1.4143654927690976, 'bull_rsi_os': 32, 'bull_rsi_ob': 67, 'bull_adx_thresh': 34.66375965018952, 'bull_atr_min_pct': 0.022790002954468917, 'bull_atr_max_pct': 0.11822367932873984, 'bull_tp_mult': 1.5985368916590164, 'bull_tsl_mult': 0.7265319284530607, 'bull_time_stop': 260, 'bull_use_sma': False, 'bull_use_ema': True, 'bull_use_atr': False, 'bull_use_adx': True, 'bull_use_spike': False, 'bull_rsi_required': True, 'bear_strategy': 'mean_reversion', 'bear_bb_std_mult': 2.7662439390981195, 'bear_rsi_os': 12, 'bear_rsi_ob': 80, 'bear_adx_thresh': 21.01417930941626, 'bear_atr_min_pct': 0.007102089003758281, 'bear_atr_max_pct': 0.09999911049874903, 'bear_tp_mult': 2.80109653025187, 'bear_tsl_mult': 0.4927574701823626, 'bear_time_stop': 244, 'bear_use_sma': True, 'bear_use_ema': True, 'bear_use_atr': False, 'bear_use_adx': True, 'bear_use_spike': False, 'bear_rsi_required': True, 'sideways_strategy': 'mean_reversion', 'sideways_bb_std_mult': 0.8621254348723966, 'sideways_rsi_os': 21, 'sideways_rsi_ob': 86, 'sideways_adx_thresh': 30.511141650479924, 'sideways_atr_min_pct': 0.0026141951601845576, 'sideways_atr_max_pct': 0.08217740650927509, 'sideways_tp_mult': 1.5621416345504084, 'sideways_tsl_mult': 0.1076075085936502, 'sideways_time_stop': 234, 'sideways_use_sma': True, 'sideways_use_ema': True, 'sideways_use_atr': False, 'sideways_use_adx': True, 'sideways_use_spike': False, 'sideways_rsi_required': True}.
[I 2025-08-31 09:46:48,836] Trial 201 finished with values: [-1000000000.0, 1000000000.0] and parameters: {'p_sma': 50, 'p_std': 16, 'p_atr': 18, 'p_adx': 14, 'rsi_period': 78, 'ema1': 20, 'ema2': 37, 'slip_atr_k': 0.16402671461794524, 'slip_spread_k': 0.9061900823017944, 'spread_hl_frac': 0.011608141181839272, 'bb_std_mult': 1.3943918903138468, 'rsi_os': 22, 'rsi_ob': 49, 'vol_spike': 0.12618882538922385, 'adx_thresh': 6.860677167800408, 'atr_min_pct': 0.012487697138374936, 'atr_max_pct': 0.13126837934543292, 'tp_mult': 2.7226612879976315, 'tsl_mult': 0.40786370450027387, 'strategy': 'breakout', 'time_stop': 157, 'use_sma': False, 'use_atr': False, 'use_adx': True, 'use_ema': False, 'use_spike': False, 'rsi_required': False, 'edge_k': 1.797285723988835, 'edge_cap': 0.16296330461328795, 'bull_strategy': 'mean_reversion', 'bull_bb_std_mult': 1.4085704772011394, 'bull_rsi_os': 35, 'bull_rsi_ob': 67, 'bull_adx_thresh': 22.119809346176737, 'bull_atr_min_pct': 0.02635519241667506, 'bull_atr_max_pct': 0.11821059985504039, 'bull_tp_mult': 1.5974493535985574, 'bull_tsl_mult': 0.4109189778447946, 'bull_time_stop': 255, 'bull_use_sma': False, 'bull_use_ema': False, 'bull_use_atr': False, 'bull_use_adx': True, 'bull_use_spike': False, 'bull_rsi_required': True, 'bear_strategy': 'mean_reversion', 'bear_bb_std_mult': 2.780143361840141, 'bear_rsi_os': 51, 'bear_rsi_ob': 61, 'bear_adx_thresh': 20.71267561926806, 'bear_atr_min_pct': 0.021935345520905328, 'bear_atr_max_pct': 0.11866688382835827, 'bear_tp_mult': 1.1701614698585414, 'bear_tsl_mult': 0.5034132213505603, 'bear_time_stop': 242, 'bear_use_sma': False, 'bear_use_ema': True, 'bear_use_atr': False, 'bear_use_adx': True, 'bear_use_spike': False, 'bear_rsi_required': True, 'sideways_strategy': 'breakout', 'sideways_bb_std_mult': 1.024653551693494, 'sideways_rsi_os': 21, 'sideways_rsi_ob': 86, 'sideways_adx_thresh': 30.800280924577955, 'sideways_atr_min_pct': 0.0025870562082715137, 'sideways_atr_max_pct': 0.10656356243335531, 'sideways_tp_mult': 2.5460591980087575, 'sideways_tsl_mult': 0.11547414100102249, 'sideways_time_stop': 238, 'sideways_use_sma': True, 'sideways_use_ema': True, 'sideways_use_atr': False, 'sideways_use_adx': True, 'sideways_use_spike': False, 'sideways_rsi_required': False}.
[I 2025-08-31 09:47:25,875] Trial 204 finished with values: [-1000000000.0, 1000000000.0] and parameters: {'p_sma': 47, 'p_std': 16, 'p_atr': 8, 'p_adx': 24, 'rsi_period': 62, 'ema1': 20, 'ema2': 40, 'slip_atr_k': 0.17314562239938583, 'slip_spread_k': 0.11440565476454062, 'spread_hl_frac': 0.016188208062435323, 'bb_std_mult': 1.4179495975695262, 'rsi_os': 22, 'rsi_ob': 45, 'vol_spike': 0.15693151922085197, 'adx_thresh': 7.680352417692376, 'atr_min_pct': 0.012733405546155943, 'atr_max_pct': 0.1427649547717339, 'tp_mult': 2.8403201588825806, 'tsl_mult': 0.7888004362826905, 'strategy': 'breakout', 'time_stop': 132, 'use_sma': False, 'use_atr': False, 'use_adx': False, 'use_ema': False, 'use_spike': False, 'rsi_required': True, 'edge_k': 1.8844759403388724, 'edge_cap': 0.13004093874965514, 'bull_strategy': 'mean_reversion', 'bull_bb_std_mult': 1.4519606924665567, 'bull_rsi_os': 33, 'bull_rsi_ob': 67, 'bull_adx_thresh': 21.778757577614627, 'bull_atr_min_pct': 0.008534237521186313, 'bull_atr_max_pct': 0.11897736770344666, 'bull_tp_mult': 1.4411796006950424, 'bull_tsl_mult': 0.18894477790604985, 'bull_time_stop': 242, 'bull_use_sma': True, 'bull_use_ema': False, 'bull_use_atr': False, 'bull_use_adx': False, 'bull_use_spike': False, 'bull_rsi_required': True, 'bear_strategy': 'breakout', 'bear_bb_std_mult': 2.824632336547739, 'bear_rsi_os': 54, 'bear_rsi_ob': 53, 'bear_adx_thresh': 22.12036748100428, 'bear_atr_min_pct': 0.020479205120702136, 'bear_atr_max_pct': 0.14184109937929315, 'bear_tp_mult': 2.6767859514343395, 'bear_tsl_mult': 0.49746413328111916, 'bear_time_stop': 250, 'bear_use_sma': False, 'bear_use_ema': True, 'bear_use_atr': False, 'bear_use_adx': True, 'bear_use_spike': False, 'bear_rsi_required': True, 'sideways_strategy': 'breakout', 'sideways_bb_std_mult': 1.0794318204158788, 'sideways_rsi_os': 17, 'sideways_rsi_ob': 65, 'sideways_adx_thresh': 33.28678843355099, 'sideways_atr_min_pct': 0.0007834489107509648, 'sideways_atr_max_pct': 0.1106668635066503, 'sideways_tp_mult': 2.5416268997321527, 'sideways_tsl_mult': 0.11756645177697293, 'sideways_time_stop': 236, 'sideways_use_sma': True, 'sideways_use_ema': True, 'sideways_use_atr': False, 'sideways_use_adx': False, 'sideways_use_spike': False, 'sideways_rsi_required': False}.
[I 2025-08-31 09:47:26,108] Trial 203 finished with values: [-1000000000.0, 1000000000.0] and parameters: {'p_sma': 49, 'p_std': 16, 'p_atr': 18, 'p_adx': 22, 'rsi_period': 68, 'ema1': 20, 'ema2': 39, 'slip_atr_k': 0.17335077607330368, 'slip_spread_k': 0.04758758137648167, 'spread_hl_frac': 0.009860172842680832, 'bb_std_mult': 1.4144458408139968, 'rsi_os': 43, 'rsi_ob': 48, 'vol_spike': 0.27714691912903033, 'adx_thresh': 13.185857811887654, 'atr_min_pct': 0.01297686806943226, 'atr_max_pct': 0.1439940602850122, 'tp_mult': 2.8331925187945495, 'tsl_mult': 0.043901903661663105, 'strategy': 'breakout', 'time_stop': 153, 'use_sma': False, 'use_atr': False, 'use_adx': False, 'use_ema': False, 'use_spike': False, 'rsi_required': False, 'edge_k': 1.8024923961149266, 'edge_cap': 0.15731607879597082, 'bull_strategy': 'mean_reversion', 'bull_bb_std_mult': 1.503972290679734, 'bull_rsi_os': 35, 'bull_rsi_ob': 67, 'bull_adx_thresh': 30.179978319661515, 'bull_atr_min_pct': 0.01983839424189739, 'bull_atr_max_pct': 0.11801688829758397, 'bull_tp_mult': 1.4386237843690595, 'bull_tsl_mult': 0.41575277865159654, 'bull_time_stop': 256, 'bull_use_sma': False, 'bull_use_ema': True, 'bull_use_atr': False, 'bull_use_adx': True, 'bull_use_spike': False, 'bull_rsi_required': True, 'bear_strategy': 'mean_reversion', 'bear_bb_std_mult': 2.825421861934679, 'bear_rsi_os': 53, 'bear_rsi_ob': 61, 'bear_adx_thresh': 21.907540670882657, 'bear_atr_min_pct': 0.022003151201758487, 'bear_atr_max_pct': 0.0452556948354448, 'bear_tp_mult': 2.7570168761209155, 'bear_tsl_mult': 0.616995095769904, 'bear_time_stop': 252, 'bear_use_sma': False, 'bear_use_ema': True, 'bear_use_atr': False, 'bear_use_adx': True, 'bear_use_spike': False, 'bear_rsi_required': True, 'sideways_strategy': 'breakout', 'sideways_bb_std_mult': 1.0262329327242836, 'sideways_rsi_os': 31, 'sideways_rsi_ob': 91, 'sideways_adx_thresh': 32.45863446480317, 'sideways_atr_min_pct': 0.028996285443653874, 'sideways_atr_max_pct': 0.07180690384582945, 'sideways_tp_mult': 1.4634592102067172, 'sideways_tsl_mult': 0.0700009304930496, 'sideways_time_stop': 236, 'sideways_use_sma': True, 'sideways_use_ema': True, 'sideways_use_atr': False, 'sideways_use_adx': True, 'sideways_use_spike': False, 'sideways_rsi_required': False}.
[I 2025-08-31 09:47:26,108] Trial 206 finished with values: [-1000000000.0, 1000000000.0] and parameters: {'p_sma': 48, 'p_std': 14, 'p_atr': 13, 'p_adx': 9, 'rsi_period': 62, 'ema1': 21, 'ema2': 39, 'slip_atr_k': 0.15541562350921492, 'slip_spread_k': 0.4756750919490228, 'spread_hl_frac': 0.009930572670248747, 'bb_std_mult': 1.4961845356603487, 'rsi_os': 43, 'rsi_ob': 47, 'vol_spike': 0.23049895416273075, 'adx_thresh': 7.78113015792257, 'atr_min_pct': 0.011501087517872809, 'atr_max_pct': 0.13608819101336062, 'tp_mult': 2.8429587363759903, 'tsl_mult': 0.7968401640591247, 'strategy': 'breakout', 'time_stop': 134, 'use_sma': False, 'use_atr': False, 'use_adx': False, 'use_ema': False, 'use_spike': False, 'rsi_required': True, 'edge_k': 1.8844847376016078, 'edge_cap': 0.12284152440260408, 'bull_strategy': 'mean_reversion', 'bull_bb_std_mult': 1.507584108444362, 'bull_rsi_os': 32, 'bull_rsi_ob': 65, 'bull_adx_thresh': 32.139912230506816, 'bull_atr_min_pct': 0.018571801591503782, 'bull_atr_max_pct': 0.039880725703450054, 'bull_tp_mult': 1.4431807710326119, 'bull_tsl_mult': 0.5737831035089601, 'bull_time_stop': 243, 'bull_use_sma': True, 'bull_use_ema': False, 'bull_use_atr': False, 'bull_use_adx': False, 'bull_use_spike': False, 'bull_rsi_required': True, 'bear_strategy': 'breakout', 'bear_bb_std_mult': 2.864957627888358, 'bear_rsi_os': 53, 'bear_rsi_ob': 78, 'bear_adx_thresh': 21.941983242915324, 'bear_atr_min_pct': 0.020720424046035482, 'bear_atr_max_pct': 0.07300126033366244, 'bear_tp_mult': 2.7486121333686215, 'bear_tsl_mult': 0.7839232746533062, 'bear_time_stop': 252, 'bear_use_sma': False, 'bear_use_ema': True, 'bear_use_atr': False, 'bear_use_adx': True, 'bear_use_spike': False, 'bear_rsi_required': True, 'sideways_strategy': 'breakout', 'sideways_bb_std_mult': 1.010596660468128, 'sideways_rsi_os': 18, 'sideways_rsi_ob': 66, 'sideways_adx_thresh': 33.21080165581245, 'sideways_atr_min_pct': 0.0008141586987871741, 'sideways_atr_max_pct': 0.11104199889365321, 'sideways_tp_mult': 1.4406156978121232, 'sideways_tsl_mult': 0.07628423103127671, 'sideways_time_stop': 245, 'sideways_use_sma': True, 'sideways_use_ema': True, 'sideways_use_atr': False, 'sideways_use_adx': False, 'sideways_use_spike': False, 'sideways_rsi_required': False}.
[I 2025-08-31 09:47:26,283] Trial 205 finished with values: [-1000000000.0, 1000000000.0] and parameters: {'p_sma': 48, 'p_std': 14, 'p_atr': 18, 'p_adx': 24, 'rsi_period': 72, 'ema1': 19, 'ema2': 40, 'slip_atr_k': 0.16279521267773084, 'slip_spread_k': 0.029573789331361733, 'spread_hl_frac': 0.01668482285923316, 'bb_std_mult': 1.4975790914681915, 'rsi_os': 22, 'rsi_ob': 45, 'vol_spike': 0.2789510265606945, 'adx_thresh': 7.6066717468006715, 'atr_min_pct': 0.011533047112375574, 'atr_max_pct': 0.1329915503612352, 'tp_mult': 2.84524309063696, 'tsl_mult': 0.3431984802641067, 'strategy': 'breakout', 'time_stop': 160, 'use_sma': False, 'use_atr': False, 'use_adx': False, 'use_ema': False, 'use_spike': False, 'rsi_required': True, 'edge_k': 1.8667146600849327, 'edge_cap': 0.12942728590991073, 'bull_strategy': 'mean_reversion', 'bull_bb_std_mult': 1.1879763259102132, 'bull_rsi_os': 33, 'bull_rsi_ob': 66, 'bull_adx_thresh': 22.129881504194458, 'bull_atr_min_pct': 0.026139349326863306, 'bull_atr_max_pct': 0.13728745981374932, 'bull_tp_mult': 1.4488992101422757, 'bull_tsl_mult': 0.4453479209030558, 'bull_time_stop': 242, 'bull_use_sma': True, 'bull_use_ema': False, 'bull_use_atr': False, 'bull_use_adx': False, 'bull_use_spike': False, 'bull_rsi_required': True, 'bear_strategy': 'breakout', 'bear_bb_std_mult': 2.829583056320539, 'bear_rsi_os': 41, 'bear_rsi_ob': 63, 'bear_adx_thresh': 22.272297312678834, 'bear_atr_min_pct': 0.02078407420001147, 'bear_atr_max_pct': 0.061269502631888836, 'bear_tp_mult': 2.7468209218719126, 'bear_tsl_mult': 0.5286852515858433, 'bear_time_stop': 252, 'bear_use_sma': False, 'bear_use_ema': True, 'bear_use_atr': False, 'bear_use_adx': True, 'bear_use_spike': False, 'bear_rsi_required': True, 'sideways_strategy': 'breakout', 'sideways_bb_std_mult': 1.0200362015423612, 'sideways_rsi_os': 33, 'sideways_rsi_ob': 65, 'sideways_adx_thresh': 32.314239431704635, 'sideways_atr_min_pct': 0.00070717827999834, 'sideways_atr_max_pct': 0.10986992812486265, 'sideways_tp_mult': 1.4706562565254973, 'sideways_tsl_mult': 0.014129446547713892, 'sideways_time_stop': 263, 'sideways_use_sma': True, 'sideways_use_ema': True, 'sideways_use_atr': False, 'sideways_use_adx': False, 'sideways_use_spike': False, 'sideways_rsi_required': False}.
