[I 2025-08-31 10:40:40,176] Trial 629 finished with values: [-1000000000.0, 1000000000.0] and parameters: {'p_sma': 23, 'p_std': 49, 'p_atr': 30, 'p_adx': 15, 'rsi_period': 43, 'ema1': 19, 'ema2': 55, 'slip_atr_k': 0.17331281851176, 'slip_spread_k': 0.1600622603460428, 'spread_hl_frac': 0.01266628254956288, 'bb_std_mult': 3.2608949797633486, 'rsi_os': 40, 'rsi_ob': 67, 'vol_spike': 0.2963787083885118, 'adx_thresh': 28.386202251057718, 'atr_min_pct': 0.012643831750896818, 'atr_max_pct': 0.05683906802170414, 'tp_mult': 2.8705073173577778, 'tsl_mult': 0.1321812197533532, 'strategy': 'breakout', 'time_stop': 149, 'use_sma': False, 'use_atr': False, 'use_adx': False, 'use_ema': True, 'use_spike': False, 'rsi_required': False, 'edge_k': 1.8335328354313263, 'edge_cap': 0.9829035454711902, 'bull_strategy': 'mean_reversion', 'bull_bb_std_mult': 1.1673087618195745, 'bull_rsi_os': 22, 'bull_rsi_ob': 65, 'bull_adx_thresh': 30.813225327562886, 'bull_atr_min_pct': 0.007903008278051753, 'bull_atr_max_pct': 0.048054565401177696, 'bull_tp_mult': 2.198800861890769, 'bull_tsl_mult': 0.7466873769445522, 'bull_time_stop': 72, 'bull_use_sma': True, 'bull_use_ema': False, 'bull_use_atr': False, 'bull_use_adx': False, 'bull_use_spike': True, 'bull_rsi_required': True, 'bear_strategy': 'breakout', 'bear_bb_std_mult': 3.003851677287983, 'bear_rsi_os': 29, 'bear_rsi_ob': 91, 'bear_adx_thresh': 22.148282660265895, 'bear_atr_min_pct': 0.006769605226852618, 'bear_atr_max_pct': 0.10101802477869323, 'bear_tp_mult': 2.238901804931795, 'bear_tsl_mult': 0.49536956038834895, 'bear_time_stop': 99, 'bear_use_sma': False, 'bear_use_ema': False, 'bear_use_atr': False, 'bear_use_adx': True, 'bear_use_spike': True, 'bear_rsi_required': True, 'sideways_strategy': 'breakout', 'sideways_bb_std_mult': 0.8743351637738958, 'sideways_rsi_os': 40, 'sideways_rsi_ob': 71, 'sideways_adx_thresh': 29.06166661584526, 'sideways_atr_min_pct': 0.006135754873053489, 'sideways_atr_max_pct': 0.09099082398511196, 'sideways_tp_mult': 2.687982994479888, 'sideways_tsl_mult': 0.8357632772255712, 'sideways_time_stop': 87, 'sideways_use_sma': True, 'sideways_use_ema': True, 'sideways_use_atr': True, 'sideways_use_adx': True, 'sideways_use_spike': True, 'sideways_rsi_required': False}.
[I 2025-08-31 10:41:13,236] Trial 631 finished with values: [-1000000000.0, 1000000000.0] and parameters: {'p_sma': 14, 'p_std': 51, 'p_atr': 25, 'p_adx': 28, 'rsi_period': 21, 'ema1': 17, 'ema2': 38, 'slip_atr_k': 0.17500096400366066, 'slip_spread_k': 0.16430197957462267, 'spread_hl_frac': 0.008017574975775524, 'bb_std_mult': 2.07970512776833, 'rsi_os': 40, 'rsi_ob': 67, 'vol_spike': 0.167355958064226, 'adx_thresh': 24.286578885898166, 'atr_min_pct': 0.0048550793614930594, 'atr_max_pct': 0.020890498019508263, 'tp_mult': 2.5782299868581964, 'tsl_mult': 0.13647196704861264, 'strategy': 'breakout', 'time_stop': 293, 'use_sma': False, 'use_atr': False, 'use_adx': False, 'use_ema': True, 'use_spike': False, 'rsi_required': True, 'edge_k': 1.8347464579585286, 'edge_cap': 0.15807293056506863, 'bull_strategy': 'mean_reversion', 'bull_bb_std_mult': 3.38916906740618, 'bull_rsi_os': 47, 'bull_rsi_ob': 63, 'bull_adx_thresh': 30.56034125983859, 'bull_atr_min_pct': 0.025247134224099257, 'bull_atr_max_pct': 0.0865661098053479, 'bull_tp_mult': 2.198011121510429, 'bull_tsl_mult': 0.9327039390570523, 'bull_time_stop': 14, 'bull_use_sma': True, 'bull_use_ema': False, 'bull_use_atr': False, 'bull_use_adx': False, 'bull_use_spike': True, 'bull_rsi_required': True, 'bear_strategy': 'breakout', 'bear_bb_std_mult': 1.9932716672690287, 'bear_rsi_os': 20, 'bear_rsi_ob': 91, 'bear_adx_thresh': 27.482229189217406, 'bear_atr_min_pct': 0.02942686240152997, 'bear_atr_max_pct': 0.10078521831863914, 'bear_tp_mult': 2.239207812996735, 'bear_tsl_mult': 0.4923213831677839, 'bear_time_stop': 13, 'bear_use_sma': False, 'bear_use_ema': False, 'bear_use_atr': True, 'bear_use_adx': True, 'bear_use_spike': True, 'bear_rsi_required': True, 'sideways_strategy': 'breakout', 'sideways_bb_std_mult': 0.8198031701732684, 'sideways_rsi_os': 46, 'sideways_rsi_ob': 94, 'sideways_adx_thresh': 21.30992325331312, 'sideways_atr_min_pct': 0.0025579339346015364, 'sideways_atr_max_pct': 0.11949590018476824, 'sideways_tp_mult': 2.884873889693143, 'sideways_tsl_mult': 0.0536139062121158, 'sideways_time_stop': 227, 'sideways_use_sma': False, 'sideways_use_ema': True, 'sideways_use_atr': True, 'sideways_use_adx': True, 'sideways_use_spike': True, 'sideways_rsi_required': False}.
[I 2025-08-31 10:41:13,349] Trial 634 finished with values: [-1000000000.0, 1000000000.0] and parameters: {'p_sma': 58, 'p_std': 51, 'p_atr': 20, 'p_adx': 27, 'rsi_period': 12, 'ema1': 17, 'ema2': 39, 'slip_atr_k': 0.07571574526715531, 'slip_spread_k': 0.11500354595846962, 'spread_hl_frac': 0.009437344085987193, 'bb_std_mult': 1.0855783856163994, 'rsi_os': 38, 'rsi_ob': 83, 'vol_spike': 0.01629899994357259, 'adx_thresh': 22.051752237592574, 'atr_min_pct': 0.010815294817700572, 'atr_max_pct': 0.07345738857550316, 'tp_mult': 2.3800071358381203, 'tsl_mult': 0.4753033977666595, 'strategy': 'breakout', 'time_stop': 71, 'use_sma': False, 'use_atr': False, 'use_adx': True, 'use_ema': True, 'use_spike': False, 'rsi_required': True, 'edge_k': 0.19663675055081997, 'edge_cap': 0.08327285816927882, 'bull_strategy': 'mean_reversion', 'bull_bb_std_mult': 1.3047685602521304, 'bull_rsi_os': 27, 'bull_rsi_ob': 72, 'bull_adx_thresh': 29.73074473480718, 'bull_atr_min_pct': 0.0061436689856315, 'bull_atr_max_pct': 0.07022256441740765, 'bull_tp_mult': 2.2901603383456295, 'bull_tsl_mult': 0.9978546138772205, 'bull_time_stop': 97, 'bull_use_sma': True, 'bull_use_ema': True, 'bull_use_atr': False, 'bull_use_adx': True, 'bull_use_spike': False, 'bull_rsi_required': True, 'bear_strategy': 'breakout', 'bear_bb_std_mult': 2.047886001221935, 'bear_rsi_os': 26, 'bear_rsi_ob': 79, 'bear_adx_thresh': 20.606644313273183, 'bear_atr_min_pct': 0.02930611372257437, 'bear_atr_max_pct': 0.10821109079215277, 'bear_tp_mult': 2.062258154879045, 'bear_tsl_mult': 0.4504179111466873, 'bear_time_stop': 13, 'bear_use_sma': True, 'bear_use_ema': True, 'bear_use_atr': True, 'bear_use_adx': False, 'bear_use_spike': True, 'bear_rsi_required': True, 'sideways_strategy': 'breakout', 'sideways_bb_std_mult': 0.9653661136694983, 'sideways_rsi_os': 23, 'sideways_rsi_ob': 75, 'sideways_adx_thresh': 30.948146715714316, 'sideways_atr_min_pct': 0.0023079208990317004, 'sideways_atr_max_pct': 0.114515701134936, 'sideways_tp_mult': 2.1455898960960784, 'sideways_tsl_mult': 0.06252529635601055, 'sideways_time_stop': 240, 'sideways_use_sma': False, 'sideways_use_ema': True, 'sideways_use_atr': False, 'sideways_use_adx': False, 'sideways_use_spike': True, 'sideways_rsi_required': False}.
[I 2025-08-31 10:41:13,571] Trial 632 finished with values: [-1000000000.0, 1000000000.0] and parameters: {'p_sma': 13, 'p_std': 49, 'p_atr': 24, 'p_adx': 27, 'rsi_period': 21, 'ema1': 17, 'ema2': 38, 'slip_atr_k': 0.09566184227917471, 'slip_spread_k': 0.1390298688400956, 'spread_hl_frac': 0.012713485983296396, 'bb_std_mult': 1.74114953697134, 'rsi_os': 40, 'rsi_ob': 66, 'vol_spike': 0.006836566355388346, 'adx_thresh': 22.154326900467513, 'atr_min_pct': 0.011155856273810084, 'atr_max_pct': 0.024158386288099243, 'tp_mult': 2.567901192236655, 'tsl_mult': 0.13863152395133144, 'strategy': 'breakout', 'time_stop': 151, 'use_sma': False, 'use_atr': False, 'use_adx': False, 'use_ema': True, 'use_spike': False, 'rsi_required': True, 'edge_k': 0.48400679527144397, 'edge_cap': 0.9764956593837433, 'bull_strategy': 'mean_reversion', 'bull_bb_std_mult': 0.8786921783271677, 'bull_rsi_os': 21, 'bull_rsi_ob': 63, 'bull_adx_thresh': 30.744321473737937, 'bull_atr_min_pct': 0.007555136032464303, 'bull_atr_max_pct': 0.09151578567824935, 'bull_tp_mult': 2.204631394427386, 'bull_tsl_mult': 0.20819360216989036, 'bull_time_stop': 69, 'bull_use_sma': True, 'bull_use_ema': True, 'bull_use_atr': False, 'bull_use_adx': True, 'bull_use_spike': False, 'bull_rsi_required': True, 'bear_strategy': 'breakout', 'bear_bb_std_mult': 2.994064145323626, 'bear_rsi_os': 28, 'bear_rsi_ob': 79, 'bear_adx_thresh': 21.94164151103707, 'bear_atr_min_pct': 0.006965936913028209, 'bear_atr_max_pct': 0.10054313290932228, 'bear_tp_mult': 2.0475057777959638, 'bear_tsl_mult': 0.4937103062482353, 'bear_time_stop': 13, 'bear_use_sma': False, 'bear_use_ema': True, 'bear_use_atr': True, 'bear_use_adx': True, 'bear_use_spike': True, 'bear_rsi_required': True, 'sideways_strategy': 'breakout', 'sideways_bb_std_mult': 0.8699114687791528, 'sideways_rsi_os': 52, 'sideways_rsi_ob': 86, 'sideways_adx_thresh': 30.997500211055534, 'sideways_atr_min_pct': 0.02093030670128775, 'sideways_atr_max_pct': 0.046422745877143824, 'sideways_tp_mult': 2.997717627108323, 'sideways_tsl_mult': 0.825097025889982, 'sideways_time_stop': 87, 'sideways_use_sma': False, 'sideways_use_ema': True, 'sideways_use_atr': False, 'sideways_use_adx': False, 'sideways_use_spike': True, 'sideways_rsi_required': False}.
[I 2025-08-31 10:41:13,642] Trial 633 finished with values: [-1000000000.0, 1000000000.0] and parameters: {'p_sma': 23, 'p_std': 54, 'p_atr': 20, 'p_adx': 8, 'rsi_period': 32, 'ema1': 17, 'ema2': 44, 'slip_atr_k': 0.17388351874031555, 'slip_spread_k': 0.9027376939087524, 'spread_hl_frac': 0.009878577570622302, 'bb_std_mult': 1.2968321917456898, 'rsi_os': 32, 'rsi_ob': 83, 'vol_spike': 0.2779151323526871, 'adx_thresh': 21.96490451996094, 'atr_min_pct': 0.010925358554770432, 'atr_max_pct': 0.02457551059039078, 'tp_mult': 2.9622681533787527, 'tsl_mult': 0.08519416191034075, 'strategy': 'breakout', 'time_stop': 118, 'use_sma': False, 'use_atr': False, 'use_adx': True, 'use_ema': True, 'use_spike': False, 'rsi_required': False, 'edge_k': 1.8362683800838342, 'edge_cap': 0.7115400261877836, 'bull_strategy': 'mean_reversion', 'bull_bb_std_mult': 1.3125455018663563, 'bull_rsi_os': 26, 'bull_rsi_ob': 65, 'bull_adx_thresh': 30.48304101289392, 'bull_atr_min_pct': 0.02527886341815107, 'bull_atr_max_pct': 0.08669569210707928, 'bull_tp_mult': 2.2863777800319247, 'bull_tsl_mult': 0.9996934994707327, 'bull_time_stop': 33, 'bull_use_sma': True, 'bull_use_ema': True, 'bull_use_atr': False, 'bull_use_adx': True, 'bull_use_spike': False, 'bull_rsi_required': True, 'bear_strategy': 'breakout', 'bear_bb_std_mult': 2.43397795238084, 'bear_rsi_os': 20, 'bear_rsi_ob': 68, 'bear_adx_thresh': 23.838782268680184, 'bear_atr_min_pct': 0.008101569866547576, 'bear_atr_max_pct': 0.11044302540444381, 'bear_tp_mult': 2.086002561147453, 'bear_tsl_mult': 0.4893386777608635, 'bear_time_stop': 185, 'bear_use_sma': True, 'bear_use_ema': True, 'bear_use_atr': True, 'bear_use_adx': False, 'bear_use_spike': True, 'bear_rsi_required': True, 'sideways_strategy': 'breakout', 'sideways_bb_std_mult': 0.9949637115210198, 'sideways_rsi_os': 19, 'sideways_rsi_ob': 73, 'sideways_adx_thresh': 31.043439310128992, 'sideways_atr_min_pct': 0.020787703186792475, 'sideways_atr_max_pct': 0.1148726009762321, 'sideways_tp_mult': 2.9917321656019493, 'sideways_tsl_mult': 0.8266162638580707, 'sideways_time_stop': 228, 'sideways_use_sma': False, 'sideways_use_ema': True, 'sideways_use_atr': False, 'sideways_use_adx': False, 'sideways_use_spike': True, 'sideways_rsi_required': False}.
[I 2025-08-31 10:41:45,809] Trial 638 finished with values: [-1000000000.0, 1000000000.0] and parameters: {'p_sma': 9, 'p_std': 41, 'p_atr': 29, 'p_adx': 9, 'rsi_period': 24, 'ema1': 18, 'ema2': 60, 'slip_atr_k': 0.19258224484419295, 'slip_spread_k': 0.5375016550193422, 'spread_hl_frac': 0.011715562250631759, 'bb_std_mult': 1.2375583715884464, 'rsi_os': 16, 'rsi_ob': 88, 'vol_spike': 0.28780322822754606, 'adx_thresh': 26.62194751514652, 'atr_min_pct': 0.007169637711192918, 'atr_max_pct': 0.0905096381924597, 'tp_mult': 2.224520394180741, 'tsl_mult': 0.6104455125204223, 'strategy': 'breakout', 'time_stop': 131, 'use_sma': False, 'use_atr': True, 'use_adx': False, 'use_ema': True, 'use_spike': True, 'rsi_required': True, 'edge_k': 1.7081980627852933, 'edge_cap': 0.10197664716066429, 'bull_strategy': 'mean_reversion', 'bull_bb_std_mult': 1.2069714870621937, 'bull_rsi_os': 28, 'bull_rsi_ob': 75, 'bull_adx_thresh': 31.92709880419005, 'bull_atr_min_pct': 0.0072004704580819695, 'bull_atr_max_pct': 0.0834367905963964, 'bull_tp_mult': 2.4906271176741273, 'bull_tsl_mult': 0.07250808082117571, 'bull_time_stop': 290, 'bull_use_sma': True, 'bull_use_ema': False, 'bull_use_atr': False, 'bull_use_adx': False, 'bull_use_spike': False, 'bull_rsi_required': False, 'bear_strategy': 'breakout', 'bear_bb_std_mult': 2.9331798240983296, 'bear_rsi_os': 34, 'bear_rsi_ob': 63, 'bear_adx_thresh': 21.16994593545436, 'bear_atr_min_pct': 0.014035346859959712, 'bear_atr_max_pct': 0.09340823692236838, 'bear_tp_mult': 1.3641852403798822, 'bear_tsl_mult': 0.45429957288820744, 'bear_time_stop': 281, 'bear_use_sma': False, 'bear_use_ema': True, 'bear_use_atr': False, 'bear_use_adx': True, 'bear_use_spike': True, 'bear_rsi_required': False, 'sideways_strategy': 'mean_reversion', 'sideways_bb_std_mult': 2.8175339266786477, 'sideways_rsi_os': 24, 'sideways_rsi_ob': 93, 'sideways_adx_thresh': 30.008824985633183, 'sideways_atr_min_pct': 0.0015025054267768405, 'sideways_atr_max_pct': 0.07648624637723488, 'sideways_tp_mult': 1.7348611005172336, 'sideways_tsl_mult': 0.1411684265506809, 'sideways_time_stop': 216, 'sideways_use_sma': True, 'sideways_use_ema': False, 'sideways_use_atr': False, 'sideways_use_adx': False, 'sideways_use_spike': True, 'sideways_rsi_required': True}.
[I 2025-08-31 10:41:45,860] Trial 637 finished with values: [-1000000000.0, 1000000000.0] and parameters: {'p_sma': 6, 'p_std': 47, 'p_atr': 29, 'p_adx': 8, 'rsi_period': 24, 'ema1': 18, 'ema2': 36, 'slip_atr_k': 0.1937039307183633, 'slip_spread_k': 0.09362538255694136, 'spread_hl_frac': 0.04873720607530249, 'bb_std_mult': 1.3128461140186236, 'rsi_os': 39, 'rsi_ob': 81, 'vol_spike': 0.27838462613748133, 'adx_thresh': 18.933322493949788, 'atr_min_pct': 0.010946645828295302, 'atr_max_pct': 0.11700879275568829, 'tp_mult': 1.1956247821388863, 'tsl_mult': 0.06483431632537065, 'strategy': 'breakout', 'time_stop': 171, 'use_sma': False, 'use_atr': True, 'use_adx': True, 'use_ema': True, 'use_spike': True, 'rsi_required': False, 'edge_k': 1.890209315283277, 'edge_cap': 0.09518714302231514, 'bull_strategy': 'mean_reversion', 'bull_bb_std_mult': 1.220549713704331, 'bull_rsi_os': 43, 'bull_rsi_ob': 80, 'bull_adx_thresh': 30.061138283254273, 'bull_atr_min_pct': 0.022081824276084884, 'bull_atr_max_pct': 0.07562684234120602, 'bull_tp_mult': 2.251211199393513, 'bull_tsl_mult': 0.9789317349147982, 'bull_time_stop': 60, 'bull_use_sma': True, 'bull_use_ema': False, 'bull_use_atr': False, 'bull_use_adx': False, 'bull_use_spike': False, 'bull_rsi_required': True, 'bear_strategy': 'breakout', 'bear_bb_std_mult': 2.4489170502655635, 'bear_rsi_os': 48, 'bear_rsi_ob': 80, 'bear_adx_thresh': 6.133731772743811, 'bear_atr_min_pct': 0.0077764522849685415, 'bear_atr_max_pct': 0.02183504851574801, 'bear_tp_mult': 2.0841588482692575, 'bear_tsl_mult': 0.09492451171429889, 'bear_time_stop': 262, 'bear_use_sma': True, 'bear_use_ema': True, 'bear_use_atr': False, 'bear_use_adx': False, 'bear_use_spike': True, 'bear_rsi_required': False, 'sideways_strategy': 'mean_reversion', 'sideways_bb_std_mult': 0.9860075330636371, 'sideways_rsi_os': 24, 'sideways_rsi_ob': 93, 'sideways_adx_thresh': 28.456315067855773, 'sideways_atr_min_pct': 0.025258120425581995, 'sideways_atr_max_pct': 0.07643268482198448, 'sideways_tp_mult': 2.969653677995784, 'sideways_tsl_mult': 0.6307132099891788, 'sideways_time_stop': 227, 'sideways_use_sma': True, 'sideways_use_ema': False, 'sideways_use_atr': False, 'sideways_use_adx': False, 'sideways_use_spike': True, 'sideways_rsi_required': True}.
[I 2025-08-31 10:41:46,646] Trial 636 finished with values: [-1000000000.0, 1000000000.0] and parameters: {'p_sma': 7, 'p_std': 54, 'p_atr': 29, 'p_adx': 8, 'rsi_period': 24, 'ema1': 18, 'ema2': 60, 'slip_atr_k': 0.19287696014882919, 'slip_spread_k': 0.8348123922219157, 'spread_hl_frac': 0.02157021029340787, 'bb_std_mult': 1.7458264348798829, 'rsi_os': 6, 'rsi_ob': 60, 'vol_spike': 0.29973136054012206, 'adx_thresh': 26.70062702553952, 'atr_min_pct': 0.026943806534512074, 'atr_max_pct': 0.12826610247899625, 'tp_mult': 2.9757649470225904, 'tsl_mult': 0.6143608385050537, 'strategy': 'breakout', 'time_stop': 5, 'use_sma': False, 'use_atr': False, 'use_adx': False, 'use_ema': True, 'use_spike': True, 'rsi_required': True, 'edge_k': 1.8909891014330868, 'edge_cap': 0.5898185635930936, 'bull_strategy': 'mean_reversion', 'bull_bb_std_mult': 1.1951157273372037, 'bull_rsi_os': 26, 'bull_rsi_ob': 66, 'bull_adx_thresh': 34.97851213872659, 'bull_atr_min_pct': 0.0006004700795400712, 'bull_atr_max_pct': 0.07568427043142183, 'bull_tp_mult': 2.2467655208943533, 'bull_tsl_mult': 0.07802837342759417, 'bull_time_stop': 60, 'bull_use_sma': True, 'bull_use_ema': True, 'bull_use_atr': False, 'bull_use_adx': True, 'bull_use_spike': False, 'bull_rsi_required': True, 'bear_strategy': 'breakout', 'bear_bb_std_mult': 2.919252880364267, 'bear_rsi_os': 35, 'bear_rsi_ob': 81, 'bear_adx_thresh': 21.232911718336226, 'bear_atr_min_pct': 0.007989555698945024, 'bear_atr_max_pct': 0.10897289172770475, 'bear_tp_mult': 2.0775617361567003, 'bear_tsl_mult': 0.4122066148961939, 'bear_time_stop': 264, 'bear_use_sma': True, 'bear_use_ema': True, 'bear_use_atr': False, 'bear_use_adx': True, 'bear_use_spike': True, 'bear_rsi_required': True, 'sideways_strategy': 'breakout', 'sideways_bb_std_mult': 0.9753316718452804, 'sideways_rsi_os': 34, 'sideways_rsi_ob': 93, 'sideways_adx_thresh': 8.335536155174594, 'sideways_atr_min_pct': 0.017879864124702473, 'sideways_atr_max_pct': 0.07539052475414203, 'sideways_tp_mult': 2.8160050098815073, 'sideways_tsl_mult': 0.7595683008253831, 'sideways_time_stop': 230, 'sideways_use_sma': True, 'sideways_use_ema': True, 'sideways_use_atr': False, 'sideways_use_adx': False, 'sideways_use_spike': True, 'sideways_rsi_required': False}.
[I 2025-08-31 10:41:47,048] Trial 635 finished with values: [-1000000000.0, 1000000000.0] and parameters: {'p_sma': 60, 'p_std': 47, 'p_atr': 20, 'p_adx': 27, 'rsi_period': 32, 'ema1': 18, 'ema2': 39, 'slip_atr_k': 0.07677654061516082, 'slip_spread_k': 0.9073149873785725, 'spread_hl_frac': 0.009604189545602689, 'bb_std_mult': 1.0921515732646985, 'rsi_os': 49, 'rsi_ob': 83, 'vol_spike': 0.05602366965432064, 'adx_thresh': 18.803149527366333, 'atr_min_pct': 0.0011962791986613874, 'atr_max_pct': 0.09580399517255657, 'tp_mult': 2.3749241636316554, 'tsl_mult': 0.2957645817600618, 'strategy': 'breakout', 'time_stop': 72, 'use_sma': False, 'use_atr': False, 'use_adx': True, 'use_ema': True, 'use_spike': True, 'rsi_required': True, 'edge_k': 1.9588066793835905, 'edge_cap': 0.09120205648459825, 'bull_strategy': 'mean_reversion', 'bull_bb_std_mult': 1.3120447873442411, 'bull_rsi_os': 28, 'bull_rsi_ob': 72, 'bull_adx_thresh': 13.02658713944389, 'bull_atr_min_pct': 0.0008596179757943533, 'bull_atr_max_pct': 0.07586286206563857, 'bull_tp_mult': 2.287100851460667, 'bull_tsl_mult': 0.048908872850465135, 'bull_time_stop': 28, 'bull_use_sma': True, 'bull_use_ema': True, 'bull_use_atr': False, 'bull_use_adx': True, 'bull_use_spike': False, 'bull_rsi_required': True, 'bear_strategy': 'breakout', 'bear_bb_std_mult': 2.27075745877431, 'bear_rsi_os': 34, 'bear_rsi_ob': 68, 'bear_adx_thresh': 6.446358213510221, 'bear_atr_min_pct': 0.014022222244194794, 'bear_atr_max_pct': 0.11053311621357219, 'bear_tp_mult': 2.06668950758273, 'bear_tsl_mult': 0.8276136120586751, 'bear_time_stop': 281, 'bear_use_sma': True, 'bear_use_ema': True, 'bear_use_atr': True, 'bear_use_adx': False, 'bear_use_spike': True, 'bear_rsi_required': True, 'sideways_strategy': 'breakout', 'sideways_bb_std_mult': 0.9590677435555762, 'sideways_rsi_os': 19, 'sideways_rsi_ob': 76, 'sideways_adx_thresh': 31.095202434942795, 'sideways_atr_min_pct': 0.0023761421094596205, 'sideways_atr_max_pct': 0.07578707796985248, 'sideways_tp_mult': 2.142075363522189, 'sideways_tsl_mult': 0.0969513713468755, 'sideways_time_stop': 239, 'sideways_use_sma': False, 'sideways_use_ema': True, 'sideways_use_atr': False, 'sideways_use_adx': False, 'sideways_use_spike': True, 'sideways_rsi_required': False}.
