[I 2025-08-31 09:45:31,688] Trial 188 finished with values: [-1000000000.0, 1000000000.0] and parameters: {'p_sma': 48, 'p_std': 15, 'p_atr': 30, 'p_adx': 10, 'rsi_period': 25, 'ema1': 19, 'ema2': 39, 'slip_atr_k': 0.17015651454375677, 'slip_spread_k': 0.2854534890241811, 'spread_hl_frac': 0.013161439271868434, 'bb_std_mult': 1.2000082071939604, 'rsi_os': 11, 'rsi_ob': 48, 'vol_spike': 0.13251437070850633, 'adx_thresh': 6.455386497615745, 'atr_min_pct': 0.010795421898844672, 'atr_max_pct': 0.13397444435611694, 'tp_mult': 2.8132162216380827, 'tsl_mult': 0.0017355223799982878, 'strategy': 'breakout', 'time_stop': 137, 'use_sma': False, 'use_atr': False, 'use_adx': False, 'use_ema': False, 'use_spike': False, 'rsi_required': True, 'edge_k': 1.8682509665788112, 'edge_cap': 0.17348328890874457, 'bull_strategy': 'mean_reversion', 'bull_bb_std_mult': 1.2425135742723277, 'bull_rsi_os': 31, 'bull_rsi_ob': 63, 'bull_adx_thresh': 32.7582507936158, 'bull_atr_min_pct': 0.0199641057405344, 'bull_atr_max_pct': 0.13057158814707637, 'bull_tp_mult': 1.4100730423959373, 'bull_tsl_mult': 0.5980908710132117, 'bull_time_stop': 256, 'bull_use_sma': True, 'bull_use_ema': False, 'bull_use_atr': False, 'bull_use_adx': False, 'bull_use_spike': False, 'bull_rsi_required': True, 'bear_strategy': 'breakout', 'bear_bb_std_mult': 2.8715140565862325, 'bear_rsi_os': 46, 'bear_rsi_ob': 83, 'bear_adx_thresh': 21.699728648483198, 'bear_atr_min_pct': 0.02002041113953094, 'bear_atr_max_pct': 0.13429521563797653, 'bear_tp_mult': 2.6589597454499065, 'bear_tsl_mult': 0.543246385030789, 'bear_time_stop': 255, 'bear_use_sma': False, 'bear_use_ema': True, 'bear_use_atr': False, 'bear_use_adx': True, 'bear_use_spike': False, 'bear_rsi_required': True, 'sideways_strategy': 'breakout', 'sideways_bb_std_mult': 1.016522330502215, 'sideways_rsi_os': 26, 'sideways_rsi_ob': 64, 'sideways_adx_thresh': 31.623626083085504, 'sideways_atr_min_pct': 0.0019065161947396526, 'sideways_atr_max_pct': 0.017676706897500238, 'sideways_tp_mult': 1.5063443882828056, 'sideways_tsl_mult': 0.0828706424400616, 'sideways_time_stop': 225, 'sideways_use_sma': True, 'sideways_use_ema': True, 'sideways_use_atr': False, 'sideways_use_adx': False, 'sideways_use_spike': False, 'sideways_rsi_required': False}.
[I 2025-08-31 09:45:31,802] Trial 187 finished with values: [-1000000000.0, 1000000000.0] and parameters: {'p_sma': 48, 'p_std': 15, 'p_atr': 30, 'p_adx': 9, 'rsi_period': 25, 'ema1': 20, 'ema2': 36, 'slip_atr_k': 0.15881620332735363, 'slip_spread_k': 0.5090160902939013, 'spread_hl_frac': 0.013285987609460757, 'bb_std_mult': 1.1827678540387598, 'rsi_os': 11, 'rsi_ob': 48, 'vol_spike': 0.13443559800987062, 'adx_thresh': 6.326901332700356, 'atr_min_pct': 0.01074559701004293, 'atr_max_pct': 0.13447235551493117, 'tp_mult': 2.827083862905584, 'tsl_mult': 0.02302518688335729, 'strategy': 'breakout', 'time_stop': 135, 'use_sma': False, 'use_atr': False, 'use_adx': False, 'use_ema': False, 'use_spike': False, 'rsi_required': True, 'edge_k': 1.8691343038449721, 'edge_cap': 0.17780740710896806, 'bull_strategy': 'mean_reversion', 'bull_bb_std_mult': 1.2266768192246051, 'bull_rsi_os': 33, 'bull_rsi_ob': 62, 'bull_adx_thresh': 32.73783099119351, 'bull_atr_min_pct': 0.010045260367201202, 'bull_atr_max_pct': 0.12782048246803981, 'bull_tp_mult': 1.3986788134458388, 'bull_tsl_mult': 0.5995146589418647, 'bull_time_stop': 275, 'bull_use_sma': True, 'bull_use_ema': False, 'bull_use_atr': False, 'bull_use_adx': False, 'bull_use_spike': False, 'bull_rsi_required': True, 'bear_strategy': 'breakout', 'bear_bb_std_mult': 2.8122923652999674, 'bear_rsi_os': 37, 'bear_rsi_ob': 81, 'bear_adx_thresh': 21.642576357625423, 'bear_atr_min_pct': 0.018288390498195382, 'bear_atr_max_pct': 0.024567771725198917, 'bear_tp_mult': 2.651538279802465, 'bear_tsl_mult': 0.5374456967258179, 'bear_time_stop': 259, 'bear_use_sma': False, 'bear_use_ema': True, 'bear_use_atr': False, 'bear_use_adx': True, 'bear_use_spike': False, 'bear_rsi_required': True, 'sideways_strategy': 'breakout', 'sideways_bb_std_mult': 0.958370544311922, 'sideways_rsi_os': 24, 'sideways_rsi_ob': 64, 'sideways_adx_thresh': 31.48821916780867, 'sideways_atr_min_pct': 0.0018284629099290458, 'sideways_atr_max_pct': 0.02031165751140057, 'sideways_tp_mult': 1.3235469161805617, 'sideways_tsl_mult': 0.08915381740282174, 'sideways_time_stop': 225, 'sideways_use_sma': True, 'sideways_use_ema': True, 'sideways_use_atr': False, 'sideways_use_adx': False, 'sideways_use_spike': False, 'sideways_rsi_required': False}.
[I 2025-08-31 09:45:32,320] Trial 192 finished with values: [-1000000000.0, 1000000000.0] and parameters: {'p_sma': 47, 'p_std': 13, 'p_atr': 29, 'p_adx': 9, 'rsi_period': 23, 'ema1': 22, 'ema2': 36, 'slip_atr_k': 0.15786157426735262, 'slip_spread_k': 0.23482602036959233, 'spread_hl_frac': 0.01079912637487972, 'bb_std_mult': 1.18275785796969, 'rsi_os': 35, 'rsi_ob': 46, 'vol_spike': 0.26060978156012105, 'adx_thresh': 6.549231071727735, 'atr_min_pct': 0.009389878035123578, 'atr_max_pct': 0.1401614336546242, 'tp_mult': 2.7848207631353286, 'tsl_mult': 0.00023643574559366342, 'strategy': 'mean_reversion', 'time_stop': 145, 'use_sma': False, 'use_atr': False, 'use_adx': False, 'use_ema': False, 'use_spike': False, 'rsi_required': True, 'edge_k': 1.9515676794751533, 'edge_cap': 0.1412522742727841, 'bull_strategy': 'mean_reversion', 'bull_bb_std_mult': 1.370599664725836, 'bull_rsi_os': 33, 'bull_rsi_ob': 69, 'bull_adx_thresh': 29.24498604705147, 'bull_atr_min_pct': 0.0020502412831714806, 'bull_atr_max_pct': 0.12701578386321877, 'bull_tp_mult': 1.555477451837106, 'bull_tsl_mult': 0.6175570836579762, 'bull_time_stop': 113, 'bull_use_sma': True, 'bull_use_ema': False, 'bull_use_atr': False, 'bull_use_adx': False, 'bull_use_spike': True, 'bull_rsi_required': False, 'bear_strategy': 'breakout', 'bear_bb_std_mult': 3.4321346146948493, 'bear_rsi_os': 7, 'bear_rsi_ob': 79, 'bear_adx_thresh': 22.58509540598413, 'bear_atr_min_pct': 0.021609395096654292, 'bear_atr_max_pct': 0.1388841972815292, 'bear_tp_mult': 2.646774769814523, 'bear_tsl_mult': 0.5669252643306714, 'bear_time_stop': 284, 'bear_use_sma': False, 'bear_use_ema': True, 'bear_use_atr': True, 'bear_use_adx': False, 'bear_use_spike': False, 'bear_rsi_required': True, 'sideways_strategy': 'breakout', 'sideways_bb_std_mult': 1.1046366167702695, 'sideways_rsi_os': 23, 'sideways_rsi_ob': 65, 'sideways_adx_thresh': 32.366895799055726, 'sideways_atr_min_pct': 0.0027689632224190295, 'sideways_atr_max_pct': 0.02526277472281571, 'sideways_tp_mult': 1.579466501149051, 'sideways_tsl_mult': 0.032463204850994215, 'sideways_time_stop': 205, 'sideways_use_sma': False, 'sideways_use_ema': False, 'sideways_use_atr': True, 'sideways_use_adx': False, 'sideways_use_spike': False, 'sideways_rsi_required': False}.
[I 2025-08-31 09:45:32,367] Trial 191 finished with values: [-1000000000.0, 1000000000.0] and parameters: {'p_sma': 47, 'p_std': 13, 'p_atr': 30, 'p_adx': 10, 'rsi_period': 65, 'ema1': 22, 'ema2': 39, 'slip_atr_k': 0.15778503466600827, 'slip_spread_k': 0.599589614317918, 'spread_hl_frac': 0.013624322586488245, 'bb_std_mult': 1.1795790974319726, 'rsi_os': 11, 'rsi_ob': 46, 'vol_spike': 0.1424317098213481, 'adx_thresh': 6.328964772430361, 'atr_min_pct': 0.012067374512238615, 'atr_max_pct': 0.13839744933646597, 'tp_mult': 2.800249038026663, 'tsl_mult': 0.0015699025279918846, 'strategy': 'mean_reversion', 'time_stop': 145, 'use_sma': False, 'use_atr': False, 'use_adx': False, 'use_ema': False, 'use_spike': False, 'rsi_required': True, 'edge_k': 1.9576840730028204, 'edge_cap': 0.14592428651382136, 'bull_strategy': 'mean_reversion', 'bull_bb_std_mult': 1.3674443353048749, 'bull_rsi_os': 34, 'bull_rsi_ob': 69, 'bull_adx_thresh': 12.906892359089838, 'bull_atr_min_pct': 0.02010399670042117, 'bull_atr_max_pct': 0.1272412135440794, 'bull_tp_mult': 1.4666548672556121, 'bull_tsl_mult': 0.6009876628665514, 'bull_time_stop': 248, 'bull_use_sma': True, 'bull_use_ema': False, 'bull_use_atr': False, 'bull_use_adx': False, 'bull_use_spike': True, 'bull_rsi_required': False, 'bear_strategy': 'breakout', 'bear_bb_std_mult': 2.830483376624899, 'bear_rsi_os': 37, 'bear_rsi_ob': 83, 'bear_adx_thresh': 22.9559545018532, 'bear_atr_min_pct': 0.02090367289739081, 'bear_atr_max_pct': 0.030534401183101835, 'bear_tp_mult': 2.643939218392012, 'bear_tsl_mult': 0.5387036676503902, 'bear_time_stop': 275, 'bear_use_sma': False, 'bear_use_ema': True, 'bear_use_atr': True, 'bear_use_adx': False, 'bear_use_spike': False, 'bear_rsi_required': True, 'sideways_strategy': 'breakout', 'sideways_bb_std_mult': 1.1045866432078837, 'sideways_rsi_os': 26, 'sideways_rsi_ob': 62, 'sideways_adx_thresh': 31.93780220883272, 'sideways_atr_min_pct': 0.001839668630899874, 'sideways_atr_max_pct': 0.024006408752393973, 'sideways_tp_mult': 1.6039664050164746, 'sideways_tsl_mult': 0.033079633521317764, 'sideways_time_stop': 209, 'sideways_use_sma': False, 'sideways_use_ema': False, 'sideways_use_atr': True, 'sideways_use_adx': False, 'sideways_use_spike': False, 'sideways_rsi_required': False}.
[I 2025-08-31 09:45:32,386] Trial 194 finished with values: [-1000000000.0, 1000000000.0] and parameters: {'p_sma': 45, 'p_std': 13, 'p_atr': 29, 'p_adx': 9, 'rsi_period': 22, 'ema1': 22, 'ema2': 40, 'slip_atr_k': 0.1575256895134891, 'slip_spread_k': 0.9765057892715479, 'spread_hl_frac': 0.014210077140077554, 'bb_std_mult': 0.6760353588350126, 'rsi_os': 36, 'rsi_ob': 46, 'vol_spike': 0.14042375093667767, 'adx_thresh': 19.86647726082731, 'atr_min_pct': 0.012001885716488863, 'atr_max_pct': 0.13997589355699291, 'tp_mult': 2.877914445316836, 'tsl_mult': 0.02126306510172789, 'strategy': 'mean_reversion', 'time_stop': 144, 'use_sma': False, 'use_atr': False, 'use_adx': False, 'use_ema': False, 'use_spike': False, 'rsi_required': True, 'edge_k': 1.9492967031501358, 'edge_cap': 0.12135299470791219, 'bull_strategy': 'mean_reversion', 'bull_bb_std_mult': 1.3190042889827494, 'bull_rsi_os': 34, 'bull_rsi_ob': 57, 'bull_adx_thresh': 13.03110541766603, 'bull_atr_min_pct': 0.007027477198618173, 'bull_atr_max_pct': 0.06468584662262228, 'bull_tp_mult': 1.5492320376597906, 'bull_tsl_mult': 0.6329227099031146, 'bull_time_stop': 293, 'bull_use_sma': True, 'bull_use_ema': False, 'bull_use_atr': False, 'bull_use_adx': False, 'bull_use_spike': True, 'bull_rsi_required': False, 'bear_strategy': 'breakout', 'bear_bb_std_mult': 1.604141315249463, 'bear_rsi_os': 8, 'bear_rsi_ob': 79, 'bear_adx_thresh': 22.95395416500376, 'bear_atr_min_pct': 0.021352639950501948, 'bear_atr_max_pct': 0.04842712969397016, 'bear_tp_mult': 2.773957980907132, 'bear_tsl_mult': 0.5624254293804075, 'bear_time_stop': 273, 'bear_use_sma': False, 'bear_use_ema': True, 'bear_use_atr': True, 'bear_use_adx': False, 'bear_use_spike': False, 'bear_rsi_required': True, 'sideways_strategy': 'breakout', 'sideways_bb_std_mult': 1.0967584883948946, 'sideways_rsi_os': 27, 'sideways_rsi_ob': 62, 'sideways_adx_thresh': 32.64365998236756, 'sideways_atr_min_pct': 0.022865549089763137, 'sideways_atr_max_pct': 0.01332145004251424, 'sideways_tp_mult': 1.615132683859396, 'sideways_tsl_mult': 0.03701786911675168, 'sideways_time_stop': 204, 'sideways_use_sma': False, 'sideways_use_ema': False, 'sideways_use_atr': True, 'sideways_use_adx': False, 'sideways_use_spike': False, 'sideways_rsi_required': False}.
[I 2025-08-31 09:45:32,432] Trial 193 finished with values: [-1000000000.0, 1000000000.0] and parameters: {'p_sma': 46, 'p_std': 13, 'p_atr': 29, 'p_adx': 9, 'rsi_period': 21, 'ema1': 22, 'ema2': 40, 'slip_atr_k': 0.14495113102616242, 'slip_spread_k': 0.2402812474204411, 'spread_hl_frac': 0.014149129452578596, 'bb_std_mult': 1.0593961479786735, 'rsi_os': 33, 'rsi_ob': 46, 'vol_spike': 0.28016794842724657, 'adx_thresh': 31.60029065459183, 'atr_min_pct': 0.00930441566404137, 'atr_max_pct': 0.13951025810778325, 'tp_mult': 2.7825745823886843, 'tsl_mult': 0.01815538599665441, 'strategy': 'mean_reversion', 'time_stop': 144, 'use_sma': False, 'use_atr': False, 'use_adx': False, 'use_ema': False, 'use_spike': False, 'rsi_required': True, 'edge_k': 1.9567786595069652, 'edge_cap': 0.13767576287982838, 'bull_strategy': 'mean_reversion', 'bull_bb_std_mult': 1.354095564568666, 'bull_rsi_os': 34, 'bull_rsi_ob': 58, 'bull_adx_thresh': 31.353255854874078, 'bull_atr_min_pct': 0.019076391583574458, 'bull_atr_max_pct': 0.06386485113610521, 'bull_tp_mult': 1.541534286281324, 'bull_tsl_mult': 0.6292101909307413, 'bull_time_stop': 248, 'bull_use_sma': True, 'bull_use_ema': False, 'bull_use_atr': False, 'bull_use_adx': False, 'bull_use_spike': True, 'bull_rsi_required': False, 'bear_strategy': 'breakout', 'bear_bb_std_mult': 2.9169690762303953, 'bear_rsi_os': 8, 'bear_rsi_ob': 79, 'bear_adx_thresh': 22.789974900314117, 'bear_atr_min_pct': 0.020812071729560157, 'bear_atr_max_pct': 0.03174789531148864, 'bear_tp_mult': 2.6272907494213085, 'bear_tsl_mult': 0.560510672121211, 'bear_time_stop': 267, 'bear_use_sma': False, 'bear_use_ema': True, 'bear_use_atr': True, 'bear_use_adx': False, 'bear_use_spike': False, 'bear_rsi_required': True, 'sideways_strategy': 'breakout', 'sideways_bb_std_mult': 1.0846629057832353, 'sideways_rsi_os': 27, 'sideways_rsi_ob': 62, 'sideways_adx_thresh': 34.256799025231714, 'sideways_atr_min_pct': 0.019555781993597608, 'sideways_atr_max_pct': 0.024086804628170665, 'sideways_tp_mult': 1.6028801010565306, 'sideways_tsl_mult': 0.04642952906013784, 'sideways_time_stop': 206, 'sideways_use_sma': False, 'sideways_use_ema': False, 'sideways_use_atr': True, 'sideways_use_adx': False, 'sideways_use_spike': False, 'sideways_rsi_required': False}.
[I 2025-08-31 09:46:11,258] Trial 198 finished with values: [-1000000000.0, 1000000000.0] and parameters: {'p_sma': 50, 'p_std': 17, 'p_atr': 22, 'p_adx': 27, 'rsi_period': 28, 'ema1': 24, 'ema2': 38, 'slip_atr_k': 0.1806202598269741, 'slip_spread_k': 0.3135284052587971, 'spread_hl_frac': 0.015331636578385977, 'bb_std_mult': 0.8693065452247994, 'rsi_os': 16, 'rsi_ob': 47, 'vol_spike': 0.19957353233530195, 'adx_thresh': 16.540568633473725, 'atr_min_pct': 0.010317793565110703, 'atr_max_pct': 0.12740985135468347, 'tp_mult': 2.922210310134606, 'tsl_mult': 0.36842476913369426, 'strategy': 'breakout', 'time_stop': 126, 'use_sma': False, 'use_atr': False, 'use_adx': True, 'use_ema': False, 'use_spike': False, 'rsi_required': True, 'edge_k': 1.837635013295676, 'edge_cap': 0.11737368427434292, 'bull_strategy': 'mean_reversion', 'bull_bb_std_mult': 1.1533453129825892, 'bull_rsi_os': 32, 'bull_rsi_ob': 67, 'bull_adx_thresh': 8.837933212654812, 'bull_atr_min_pct': 0.019126324138811154, 'bull_atr_max_pct': 0.12225194304814127, 'bull_tp_mult': 1.501013930777378, 'bull_tsl_mult': 0.5871228759650955, 'bull_time_stop': 101, 'bull_use_sma': True, 'bull_use_ema': True, 'bull_use_atr': False, 'bull_use_adx': False, 'bull_use_spike': False, 'bull_rsi_required': True, 'bear_strategy': 'breakout', 'bear_bb_std_mult': 1.0218391867397136, 'bear_rsi_os': 24, 'bear_rsi_ob': 64, 'bear_adx_thresh': 20.36781408649814, 'bear_atr_min_pct': 0.002336377309970215, 'bear_atr_max_pct': 0.14220907392918414, 'bear_tp_mult': 2.709530832004613, 'bear_tsl_mult': 0.48549175418574725, 'bear_time_stop': 247, 'bear_use_sma': True, 'bear_use_ema': True, 'bear_use_atr': False, 'bear_use_adx': True, 'bear_use_spike': False, 'bear_rsi_required': True, 'sideways_strategy': 'mean_reversion', 'sideways_bb_std_mult': 1.1867139993799234, 'sideways_rsi_os': 29, 'sideways_rsi_ob': 65, 'sideways_adx_thresh': 33.25943607402761, 'sideways_atr_min_pct': 0.0012411678459597307, 'sideways_atr_max_pct': 0.02863376222980038, 'sideways_tp_mult': 1.4502758758980343, 'sideways_tsl_mult': 0.11157294222302347, 'sideways_time_stop': 215, 'sideways_use_sma': True, 'sideways_use_ema': True, 'sideways_use_atr': False, 'sideways_use_adx': False, 'sideways_use_spike': False, 'sideways_rsi_required': True}.
[I 2025-08-31 09:46:11,688] Trial 196 finished with values: [-0.012601057869558674, 0.012488188937178249] and parameters: {'p_sma': 50, 'p_std': 17, 'p_atr': 29, 'p_adx': 9, 'rsi_period': 21, 'ema1': 24, 'ema2': 37, 'slip_atr_k': 0.14678502528875084, 'slip_spread_k': 0.048142872120999325, 'spread_hl_frac': 0.014582892087093291, 'bb_std_mult': 0.696779281364769, 'rsi_os': 33, 'rsi_ob': 47, 'vol_spike': 0.2770597741456362, 'adx_thresh': 19.862553813126436, 'atr_min_pct': 0.011754929936639107, 'atr_max_pct': 0.12833216888968565, 'tp_mult': 2.871934264316857, 'tsl_mult': 0.027349075778872828, 'strategy': 'breakout', 'time_stop': 128, 'use_sma': False, 'use_atr': False, 'use_adx': False, 'use_ema': False, 'use_spike': False, 'rsi_required': True, 'edge_k': 1.8438518844376124, 'edge_cap': 0.47097647567773565, 'bull_strategy': 'mean_reversion', 'bull_bb_std_mult': 1.3501465056389432, 'bull_rsi_os': 35, 'bull_rsi_ob': 57, 'bull_adx_thresh': 34.66669363436283, 'bull_atr_min_pct': 0.018659301592259522, 'bull_atr_max_pct': 0.12157033181620366, 'bull_tp_mult': 1.5774394163125598, 'bull_tsl_mult': 0.6329943447647782, 'bull_time_stop': 58, 'bull_use_sma': True, 'bull_use_ema': True, 'bull_use_atr': False, 'bull_use_adx': False, 'bull_use_spike': False, 'bull_rsi_required': True, 'bear_strategy': 'breakout', 'bear_bb_std_mult': 2.9508119167972064, 'bear_rsi_os': 54, 'bear_rsi_ob': 79, 'bear_adx_thresh': 20.370056095746662, 'bear_atr_min_pct': 0.02184622326510516, 'bear_atr_max_pct': 0.07428412628075065, 'bear_tp_mult': 2.773878598607476, 'bear_tsl_mult': 0.48372621745014543, 'bear_time_stop': 266, 'bear_use_sma': False, 'bear_use_ema': True, 'bear_use_atr': False, 'bear_use_adx': True, 'bear_use_spike': False, 'bear_rsi_required': True, 'sideways_strategy': 'breakout', 'sideways_bb_std_mult': 1.2034653831015043, 'sideways_rsi_os': 20, 'sideways_rsi_ob': 63, 'sideways_adx_thresh': 34.16916520526579, 'sideways_atr_min_pct': 0.0009195357165095439, 'sideways_atr_max_pct': 0.012522196372933572, 'sideways_tp_mult': 2.674743810238036, 'sideways_tsl_mult': 0.056329426428861365, 'sideways_time_stop': 216, 'sideways_use_sma': True, 'sideways_use_ema': True, 'sideways_use_atr': False, 'sideways_use_adx': False, 'sideways_use_spike': False, 'sideways_rsi_required': False}.
[I 2025-08-31 09:46:11,697] Trial 195 finished with values: [-1000000000.0, 1000000000.0] and parameters: {'p_sma': 45, 'p_std': 12, 'p_atr': 29, 'p_adx': 10, 'rsi_period': 21, 'ema1': 24, 'ema2': 39, 'slip_atr_k': 0.14527175274816, 'slip_spread_k': 0.60024856321502, 'spread_hl_frac': 0.01432412370925061, 'bb_std_mult': 0.661251726352821, 'rsi_os': 15, 'rsi_ob': 47, 'vol_spike': 0.14127528557275024, 'adx_thresh': 5.867836463768871, 'atr_min_pct': 0.011861237685583226, 'atr_max_pct': 0.13763534131881205, 'tp_mult': 2.878952760346909, 'tsl_mult': 0.027926897495457015, 'strategy': 'breakout', 'time_stop': 126, 'use_sma': False, 'use_atr': False, 'use_adx': False, 'use_ema': False, 'use_spike': False, 'rsi_required': True, 'edge_k': 1.8421594326726667, 'edge_cap': 0.8460015428534424, 'bull_strategy': 'mean_reversion', 'bull_bb_std_mult': 1.3157573743770066, 'bull_rsi_os': 34, 'bull_rsi_ob': 57, 'bull_adx_thresh': 29.991462563987675, 'bull_atr_min_pct': 0.019236307624538845, 'bull_atr_max_pct': 0.1219703280002076, 'bull_tp_mult': 1.466592917143353, 'bull_tsl_mult': 0.6650102430192913, 'bull_time_stop': 249, 'bull_use_sma': True, 'bull_use_ema': False, 'bull_use_atr': False, 'bull_use_adx': False, 'bull_use_spike': False, 'bull_rsi_required': True, 'bear_strategy': 'breakout', 'bear_bb_std_mult': 2.9484240466412244, 'bear_rsi_os': 24, 'bear_rsi_ob': 79, 'bear_adx_thresh': 20.183553243486323, 'bear_atr_min_pct': 0.0290731742940633, 'bear_atr_max_pct': 0.14236198699487157, 'bear_tp_mult': 2.7030259064750704, 'bear_tsl_mult': 0.5230189211045835, 'bear_time_stop': 265, 'bear_use_sma': False, 'bear_use_ema': True, 'bear_use_atr': False, 'bear_use_adx': True, 'bear_use_spike': False, 'bear_rsi_required': True, 'sideways_strategy': 'breakout', 'sideways_bb_std_mult': 1.174856144978135, 'sideways_rsi_os': 29, 'sideways_rsi_ob': 62, 'sideways_adx_thresh': 32.96193223248094, 'sideways_atr_min_pct': 0.019431524128619766, 'sideways_atr_max_pct': 0.027947014348906153, 'sideways_tp_mult': 1.6125329815364897, 'sideways_tsl_mult': 0.05012222023038229, 'sideways_time_stop': 180, 'sideways_use_sma': True, 'sideways_use_ema': True, 'sideways_use_atr': False, 'sideways_use_adx': False, 'sideways_use_spike': False, 'sideways_rsi_required': False}.
