[I 2025-08-31 09:55:39,868] Trial 270 finished with values: [-1000000000.0, 1000000000.0] and parameters: {'p_sma': 47, 'p_std': 14, 'p_atr': 9, 'p_adx': 23, 'rsi_period': 25, 'ema1': 16, 'ema2': 40, 'slip_atr_k': 0.19098777635397396, 'slip_spread_k': 0.38374473902211076, 'spread_hl_frac': 0.04717894666015186, 'bb_std_mult': 1.0868186227441192, 'rsi_os': 49, 'rsi_ob': 79, 'vol_spike': 0.12521339928790343, 'adx_thresh': 5.517043831243447, 'atr_min_pct': 0.011400982130375653, 'atr_max_pct': 0.09856160006513667, 'tp_mult': 2.7928365444604126, 'tsl_mult': 0.38200410081877106, 'strategy': 'breakout', 'time_stop': 6, 'use_sma': False, 'use_atr': False, 'use_adx': True, 'use_ema': False, 'use_spike': False, 'rsi_required': True, 'edge_k': 1.2897767445452244, 'edge_cap': 0.800830915409194, 'bull_strategy': 'mean_reversion', 'bull_bb_std_mult': 1.4179145941938522, 'bull_rsi_os': 39, 'bull_rsi_ob': 95, 'bull_adx_thresh': 9.298499875439566, 'bull_atr_min_pct': 0.005744756276810906, 'bull_atr_max_pct': 0.09859486433084735, 'bull_tp_mult': 2.3358303833134957, 'bull_tsl_mult': 0.6089004671882687, 'bull_time_stop': 247, 'bull_use_sma': True, 'bull_use_ema': False, 'bull_use_atr': False, 'bull_use_adx': False, 'bull_use_spike': False, 'bull_rsi_required': True, 'bear_strategy': 'breakout', 'bear_bb_std_mult': 2.7778693903111864, 'bear_rsi_os': 25, 'bear_rsi_ob': 59, 'bear_adx_thresh': 22.459263234945684, 'bear_atr_min_pct': 0.021910071323496306, 'bear_atr_max_pct': 0.14642546175578147, 'bear_tp_mult': 2.820280730203941, 'bear_tsl_mult': 0.523369791699016, 'bear_time_stop': 251, 'bear_use_sma': False, 'bear_use_ema': True, 'bear_use_atr': False, 'bear_use_adx': True, 'bear_use_spike': False, 'bear_rsi_required': True, 'sideways_strategy': 'breakout', 'sideways_bb_std_mult': 1.0927255233498019, 'sideways_rsi_os': 28, 'sideways_rsi_ob': 58, 'sideways_adx_thresh': 24.193416095567713, 'sideways_atr_min_pct': 0.012558389232318248, 'sideways_atr_max_pct': 0.027123035389873634, 'sideways_tp_mult': 2.5869372041838465, 'sideways_tsl_mult': 0.08739419708957002, 'sideways_time_stop': 248, 'sideways_use_sma': True, 'sideways_use_ema': True, 'sideways_use_atr': False, 'sideways_use_adx': False, 'sideways_use_spike': False, 'sideways_rsi_required': False}.
[I 2025-08-31 09:55:40,272] Trial 271 finished with values: [-1000000000.0, 1000000000.0] and parameters: {'p_sma': 14, 'p_std': 14, 'p_atr': 22, 'p_adx': 20, 'rsi_period': 69, 'ema1': 20, 'ema2': 41, 'slip_atr_k': 0.17797989098330091, 'slip_spread_k': 0.8103047332297673, 'spread_hl_frac': 0.03972633999693208, 'bb_std_mult': 0.9417998845436539, 'rsi_os': 49, 'rsi_ob': 64, 'vol_spike': 0.12522112467961333, 'adx_thresh': 7.003665332653407, 'atr_min_pct': 0.011369347037275124, 'atr_max_pct': 0.010830643737553755, 'tp_mult': 2.8181766846753584, 'tsl_mult': 0.0001996816054760108, 'strategy': 'breakout', 'time_stop': 149, 'use_sma': False, 'use_atr': False, 'use_adx': True, 'use_ema': False, 'use_spike': False, 'rsi_required': True, 'edge_k': 0.5904480106246757, 'edge_cap': 0.7992801185753121, 'bull_strategy': 'mean_reversion', 'bull_bb_std_mult': 1.7956836788581936, 'bull_rsi_os': 29, 'bull_rsi_ob': 89, 'bull_adx_thresh': 31.081090290632147, 'bull_atr_min_pct': 2.869360660669e-05, 'bull_atr_max_pct': 0.013877537380530103, 'bull_tp_mult': 1.5740090155229962, 'bull_tsl_mult': 0.6801092135175185, 'bull_time_stop': 159, 'bull_use_sma': True, 'bull_use_ema': False, 'bull_use_atr': False, 'bull_use_adx': False, 'bull_use_spike': False, 'bull_rsi_required': True, 'bear_strategy': 'breakout', 'bear_bb_std_mult': 2.347870185548546, 'bear_rsi_os': 25, 'bear_rsi_ob': 55, 'bear_adx_thresh': 22.389249475261497, 'bear_atr_min_pct': 0.021955391735708898, 'bear_atr_max_pct': 0.14648291649536682, 'bear_tp_mult': 1.9787181765851019, 'bear_tsl_mult': 0.5817424265816112, 'bear_time_stop': 251, 'bear_use_sma': False, 'bear_use_ema': True, 'bear_use_atr': True, 'bear_use_adx': True, 'bear_use_spike': False, 'bear_rsi_required': True, 'sideways_strategy': 'breakout', 'sideways_bb_std_mult': 3.4505733707132875, 'sideways_rsi_os': 24, 'sideways_rsi_ob': 87, 'sideways_adx_thresh': 33.90895567049511, 'sideways_atr_min_pct': 0.0012545972925465153, 'sideways_atr_max_pct': 0.027125371244527748, 'sideways_tp_mult': 2.1479700850478185, 'sideways_tsl_mult': 0.11357659815680113, 'sideways_time_stop': 247, 'sideways_use_sma': False, 'sideways_use_ema': False, 'sideways_use_atr': False, 'sideways_use_adx': False, 'sideways_use_spike': False, 'sideways_rsi_required': False}.
[I 2025-08-31 09:56:12,541] Trial 272 finished with values: [-1000000000.0, 1000000000.0] and parameters: {'p_sma': 6, 'p_std': 49, 'p_atr': 22, 'p_adx': 10, 'rsi_period': 24, 'ema1': 16, 'ema2': 40, 'slip_atr_k': 0.08856458757216827, 'slip_spread_k': 0.3787787363829956, 'spread_hl_frac': 0.04738496684203508, 'bb_std_mult': 0.9717543152345836, 'rsi_os': 46, 'rsi_ob': 80, 'vol_spike': 0.1278691048631858, 'adx_thresh': 5.365379382144118, 'atr_min_pct': 0.011543587069424759, 'atr_max_pct': 0.13968997034934016, 'tp_mult': 2.9128297289889957, 'tsl_mult': 0.6706399854274548, 'strategy': 'breakout', 'time_stop': 7, 'use_sma': False, 'use_atr': False, 'use_adx': True, 'use_ema': False, 'use_spike': False, 'rsi_required': True, 'edge_k': 1.8093948189017397, 'edge_cap': 0.06702790110827644, 'bull_strategy': 'mean_reversion', 'bull_bb_std_mult': 1.3947957481303423, 'bull_rsi_os': 48, 'bull_rsi_ob': 87, 'bull_adx_thresh': 31.182646361243737, 'bull_atr_min_pct': 0.01906808279637308, 'bull_atr_max_pct': 0.025804369247154083, 'bull_tp_mult': 1.5836625192154021, 'bull_tsl_mult': 0.1936273211969023, 'bull_time_stop': 247, 'bull_use_sma': True, 'bull_use_ema': False, 'bull_use_atr': False, 'bull_use_adx': False, 'bull_use_spike': False, 'bull_rsi_required': True, 'bear_strategy': 'breakout', 'bear_bb_std_mult': 1.2366981944631408, 'bear_rsi_os': 53, 'bear_rsi_ob': 65, 'bear_adx_thresh': 22.28094348479148, 'bear_atr_min_pct': 0.02137483897202117, 'bear_atr_max_pct': 0.14659893120898432, 'bear_tp_mult': 2.7840196750133708, 'bear_tsl_mult': 0.5198603303815036, 'bear_time_stop': 250, 'bear_use_sma': False, 'bear_use_ema': True, 'bear_use_atr': True, 'bear_use_adx': True, 'bear_use_spike': False, 'bear_rsi_required': True, 'sideways_strategy': 'breakout', 'sideways_bb_std_mult': 3.1889682509708184, 'sideways_rsi_os': 24, 'sideways_rsi_ob': 87, 'sideways_adx_thresh': 20.037771609201176, 'sideways_atr_min_pct': 0.01789282507222348, 'sideways_atr_max_pct': 0.13039365410622814, 'sideways_tp_mult': 1.4164883661878436, 'sideways_tsl_mult': 0.20433253158032028, 'sideways_time_stop': 238, 'sideways_use_sma': False, 'sideways_use_ema': False, 'sideways_use_atr': False, 'sideways_use_adx': False, 'sideways_use_spike': False, 'sideways_rsi_required': False}.
[I 2025-08-31 09:56:13,208] Trial 273 finished with values: [-1000000000.0, 1000000000.0] and parameters: {'p_sma': 13, 'p_std': 14, 'p_atr': 30, 'p_adx': 23, 'rsi_period': 21, 'ema1': 16, 'ema2': 59, 'slip_atr_k': 0.17879912537484435, 'slip_spread_k': 0.3832492041785869, 'spread_hl_frac': 0.04195877878411808, 'bb_std_mult': 2.360811730171483, 'rsi_os': 13, 'rsi_ob': 47, 'vol_spike': 0.12809980564604984, 'adx_thresh': 7.38593437769818, 'atr_min_pct': 0.011339183488873552, 'atr_max_pct': 0.13236322892217278, 'tp_mult': 1.3414253469918804, 'tsl_mult': 0.002333001584661775, 'strategy': 'breakout', 'time_stop': 90, 'use_sma': False, 'use_atr': False, 'use_adx': True, 'use_ema': False, 'use_spike': False, 'rsi_required': True, 'edge_k': 1.8045348600553486, 'edge_cap': 0.19445642628221865, 'bull_strategy': 'mean_reversion', 'bull_bb_std_mult': 1.4158395415830625, 'bull_rsi_os': 39, 'bull_rsi_ob': 67, 'bull_adx_thresh': 29.674630362416725, 'bull_atr_min_pct': 0.010884448799741656, 'bull_atr_max_pct': 0.013966260256312896, 'bull_tp_mult': 1.3795925269431324, 'bull_tsl_mult': 0.6093534017434955, 'bull_time_stop': 255, 'bull_use_sma': True, 'bull_use_ema': False, 'bull_use_atr': False, 'bull_use_adx': False, 'bull_use_spike': False, 'bull_rsi_required': True, 'bear_strategy': 'breakout', 'bear_bb_std_mult': 2.944482375239871, 'bear_rsi_os': 52, 'bear_rsi_ob': 55, 'bear_adx_thresh': 20.32678005165779, 'bear_atr_min_pct': 0.021607301696655944, 'bear_atr_max_pct': 0.13575089321528366, 'bear_tp_mult': 1.4409935938474212, 'bear_tsl_mult': 0.5800333681469644, 'bear_time_stop': 250, 'bear_use_sma': False, 'bear_use_ema': True, 'bear_use_atr': False, 'bear_use_adx': True, 'bear_use_spike': False, 'bear_rsi_required': True, 'sideways_strategy': 'breakout', 'sideways_bb_std_mult': 1.1060544197506528, 'sideways_rsi_os': 24, 'sideways_rsi_ob': 79, 'sideways_adx_thresh': 33.71521571172861, 'sideways_atr_min_pct': 0.0017591150597661826, 'sideways_atr_max_pct': 0.034265671988832874, 'sideways_tp_mult': 1.4014392538979112, 'sideways_tsl_mult': 0.11498432782098857, 'sideways_time_stop': 240, 'sideways_use_sma': True, 'sideways_use_ema': True, 'sideways_use_atr': False, 'sideways_use_adx': False, 'sideways_use_spike': False, 'sideways_rsi_required': False}.
[I 2025-08-31 09:56:13,556] Trial 274 finished with values: [-1000000000.0, 1000000000.0] and parameters: {'p_sma': 14, 'p_std': 17, 'p_atr': 21, 'p_adx': 20, 'rsi_period': 23, 'ema1': 30, 'ema2': 25, 'slip_atr_k': 0.19800792570621834, 'slip_spread_k': 0.39325211844072333, 'spread_hl_frac': 0.043949364684329355, 'bb_std_mult': 3.3702889260263014, 'rsi_os': 46, 'rsi_ob': 93, 'vol_spike': 0.13940034416986832, 'adx_thresh': 10.781461148333916, 'atr_min_pct': 0.0038330920791408672, 'atr_max_pct': 0.13265287790419558, 'tp_mult': 2.926536866795048, 'tsl_mult': 0.4161464743889368, 'strategy': 'breakout', 'time_stop': 151, 'use_sma': False, 'use_atr': False, 'use_adx': True, 'use_ema': False, 'use_spike': False, 'rsi_required': True, 'edge_k': 0.31966713298106175, 'edge_cap': 0.4092894188405213, 'bull_strategy': 'mean_reversion', 'bull_bb_std_mult': 1.27386069358424, 'bull_rsi_os': 33, 'bull_rsi_ob': 67, 'bull_adx_thresh': 31.117077124304934, 'bull_atr_min_pct': 1.9957800886864774e-05, 'bull_atr_max_pct': 0.02655684569610465, 'bull_tp_mult': 2.2695751232386483, 'bull_tsl_mult': 0.6796872877173901, 'bull_time_stop': 253, 'bull_use_sma': True, 'bull_use_ema': False, 'bull_use_atr': False, 'bull_use_adx': False, 'bull_use_spike': False, 'bull_rsi_required': True, 'bear_strategy': 'breakout', 'bear_bb_std_mult': 2.3542119464101376, 'bear_rsi_os': 33, 'bear_rsi_ob': 78, 'bear_adx_thresh': 28.026942468776433, 'bear_atr_min_pct': 0.019087555360798654, 'bear_atr_max_pct': 0.047436190356075575, 'bear_tp_mult': 1.45226330305367, 'bear_tsl_mult': 0.5744251655089698, 'bear_time_stop': 263, 'bear_use_sma': False, 'bear_use_ema': True, 'bear_use_atr': False, 'bear_use_adx': True, 'bear_use_spike': False, 'bear_rsi_required': True, 'sideways_strategy': 'breakout', 'sideways_bb_std_mult': 0.9536976792225846, 'sideways_rsi_os': 24, 'sideways_rsi_ob': 64, 'sideways_adx_thresh': 33.60580300328864, 'sideways_atr_min_pct': 0.0164660896329849, 'sideways_atr_max_pct': 0.03355343142717489, 'sideways_tp_mult': 1.405687238705907, 'sideways_tsl_mult': 0.351299569777168, 'sideways_time_stop': 240, 'sideways_use_sma': True, 'sideways_use_ema': True, 'sideways_use_atr': False, 'sideways_use_adx': False, 'sideways_use_spike': False, 'sideways_rsi_required': False}.
[I 2025-08-31 09:56:14,450] Trial 275 finished with values: [-0.028190846932565905, 0.028129825932111226] and parameters: {'p_sma': 48, 'p_std': 9, 'p_atr': 25, 'p_adx': 10, 'rsi_period': 11, 'ema1': 21, 'ema2': 25, 'slip_atr_k': 0.08952101107664268, 'slip_spread_k': 0.40465725463324514, 'spread_hl_frac': 0.012846841387521518, 'bb_std_mult': 1.1852967309734472, 'rsi_os': 23, 'rsi_ob': 47, 'vol_spike': 0.1396529131669987, 'adx_thresh': 7.50111890265076, 'atr_min_pct': 0.02199578363226975, 'atr_max_pct': 0.08650565783569916, 'tp_mult': 2.915442860978319, 'tsl_mult': 0.7750302641445092, 'strategy': 'breakout', 'time_stop': 90, 'use_sma': False, 'use_atr': False, 'use_adx': False, 'use_ema': False, 'use_spike': False, 'rsi_required': True, 'edge_k': 0.31823602763548475, 'edge_cap': 0.17204281231522042, 'bull_strategy': 'mean_reversion', 'bull_bb_std_mult': 1.228919404639885, 'bull_rsi_os': 31, 'bull_rsi_ob': 67, 'bull_adx_thresh': 23.27810703303907, 'bull_atr_min_pct': 0.0191800358270193, 'bull_atr_max_pct': 0.11896619506381231, 'bull_tp_mult': 1.2817532690506794, 'bull_tsl_mult': 0.5745382961341576, 'bull_time_stop': 254, 'bull_use_sma': True, 'bull_use_ema': False, 'bull_use_atr': False, 'bull_use_adx': False, 'bull_use_spike': False, 'bull_rsi_required': True, 'bear_strategy': 'breakout', 'bear_bb_std_mult': 2.9296101144282995, 'bear_rsi_os': 33, 'bear_rsi_ob': 78, 'bear_adx_thresh': 27.872232651751865, 'bear_atr_min_pct': 0.013268072980700518, 'bear_atr_max_pct': 0.13591416136061768, 'bear_tp_mult': 1.5314683401117666, 'bear_tsl_mult': 0.4734233487094733, 'bear_time_stop': 278, 'bear_use_sma': False, 'bear_use_ema': True, 'bear_use_atr': False, 'bear_use_adx': True, 'bear_use_spike': False, 'bear_rsi_required': True, 'sideways_strategy': 'breakout', 'sideways_bb_std_mult': 0.5312079696106367, 'sideways_rsi_os': 26, 'sideways_rsi_ob': 64, 'sideways_adx_thresh': 32.80843202963139, 'sideways_atr_min_pct': 0.0020367349297635705, 'sideways_atr_max_pct': 0.03343912145803179, 'sideways_tp_mult': 1.010584540436274, 'sideways_tsl_mult': 0.18044416588741302, 'sideways_time_stop': 239, 'sideways_use_sma': True, 'sideways_use_ema': True, 'sideways_use_atr': False, 'sideways_use_adx': False, 'sideways_use_spike': False, 'sideways_rsi_required': False}.
[I 2025-08-31 09:56:47,856] Trial 278 finished with values: [-1000000000.0, 1000000000.0] and parameters: {'p_sma': 48, 'p_std': 9, 'p_atr': 25, 'p_adx': 8, 'rsi_period': 76, 'ema1': 28, 'ema2': 37, 'slip_atr_k': 0.14116608235537975, 'slip_spread_k': 0.976126975003833, 'spread_hl_frac': 0.005817282809310785, 'bb_std_mult': 2.2265896834975605, 'rsi_os': 22, 'rsi_ob': 85, 'vol_spike': 0.1341140938382821, 'adx_thresh': 21.122672413312877, 'atr_min_pct': 0.006589468971115524, 'atr_max_pct': 0.08548774734174895, 'tp_mult': 2.3228166978706732, 'tsl_mult': 0.48183331413789204, 'strategy': 'breakout', 'time_stop': 134, 'use_sma': False, 'use_atr': False, 'use_adx': False, 'use_ema': False, 'use_spike': False, 'rsi_required': False, 'edge_k': 1.913920488701393, 'edge_cap': 0.16729187299970988, 'bull_strategy': 'mean_reversion', 'bull_bb_std_mult': 2.340426618620214, 'bull_rsi_os': 31, 'bull_rsi_ob': 66, 'bull_adx_thresh': 30.021704906056726, 'bull_atr_min_pct': 0.019174461060840753, 'bull_atr_max_pct': 0.11988946232442721, 'bull_tp_mult': 1.464703405379857, 'bull_tsl_mult': 0.9145335006735514, 'bull_time_stop': 266, 'bull_use_sma': False, 'bull_use_ema': False, 'bull_use_atr': False, 'bull_use_adx': True, 'bull_use_spike': False, 'bull_rsi_required': True, 'bear_strategy': 'mean_reversion', 'bear_bb_std_mult': 2.0210909084697306, 'bear_rsi_os': 53, 'bear_rsi_ob': 86, 'bear_adx_thresh': 19.826407729026155, 'bear_atr_min_pct': 0.021145428502583805, 'bear_atr_max_pct': 0.14284275321021658, 'bear_tp_mult': 1.4939743880485343, 'bear_tsl_mult': 0.4803609343757632, 'bear_time_stop': 203, 'bear_use_sma': True, 'bear_use_ema': True, 'bear_use_atr': False, 'bear_use_adx': False, 'bear_use_spike': False, 'bear_rsi_required': True, 'sideways_strategy': 'mean_reversion', 'sideways_bb_std_mult': 1.9709735373830222, 'sideways_rsi_os': 26, 'sideways_rsi_ob': 64, 'sideways_adx_thresh': 32.565809367700716, 'sideways_atr_min_pct': 0.019791950068300385, 'sideways_atr_max_pct': 0.08267608925291162, 'sideways_tp_mult': 2.341342540453059, 'sideways_tsl_mult': 0.04278812712539045, 'sideways_time_stop': 219, 'sideways_use_sma': True, 'sideways_use_ema': True, 'sideways_use_atr': False, 'sideways_use_adx': True, 'sideways_use_spike': False, 'sideways_rsi_required': True}.
[I 2025-08-31 09:56:48,251] Trial 276 finished with values: [-1000000000.0, 1000000000.0] and parameters: {'p_sma': 50, 'p_std': 17, 'p_atr': 15, 'p_adx': 9, 'rsi_period': 20, 'ema1': 21, 'ema2': 56, 'slip_atr_k': 0.14188869266529142, 'slip_spread_k': 0.40148121060991654, 'spread_hl_frac': 0.04211702031288163, 'bb_std_mult': 2.4095133261438546, 'rsi_os': 23, 'rsi_ob': 47, 'vol_spike': 0.13950191575947352, 'adx_thresh': 16.271988368944292, 'atr_min_pct': 0.00679208970364514, 'atr_max_pct': 0.13082430245743262, 'tp_mult': 2.7543892809962727, 'tsl_mult': 0.6526792304568251, 'strategy': 'breakout', 'time_stop': 101, 'use_sma': False, 'use_atr': False, 'use_adx': False, 'use_ema': False, 'use_spike': False, 'rsi_required': True, 'edge_k': 1.9143563863700028, 'edge_cap': 0.16522176223598273, 'bull_strategy': 'mean_reversion', 'bull_bb_std_mult': 1.2800752620308937, 'bull_rsi_os': 33, 'bull_rsi_ob': 67, 'bull_adx_thresh': 33.17180323009417, 'bull_atr_min_pct': 0.010874830321377166, 'bull_atr_max_pct': 0.12071945881389867, 'bull_tp_mult': 1.466200275571455, 'bull_tsl_mult': 0.6416005561393184, 'bull_time_stop': 255, 'bull_use_sma': True, 'bull_use_ema': False, 'bull_use_atr': False, 'bull_use_adx': False, 'bull_use_spike': False, 'bull_rsi_required': True, 'bear_strategy': 'breakout', 'bear_bb_std_mult': 0.8362119259813938, 'bear_rsi_os': 21, 'bear_rsi_ob': 78, 'bear_adx_thresh': 28.00736586485691, 'bear_atr_min_pct': 0.014502248755713444, 'bear_atr_max_pct': 0.06105422800494087, 'bear_tp_mult': 2.6245929863633615, 'bear_tsl_mult': 0.4706167802851126, 'bear_time_stop': 264, 'bear_use_sma': True, 'bear_use_ema': True, 'bear_use_atr': False, 'bear_use_adx': False, 'bear_use_spike': False, 'bear_rsi_required': True, 'sideways_strategy': 'mean_reversion', 'sideways_bb_std_mult': 0.9175764701800895, 'sideways_rsi_os': 11, 'sideways_rsi_ob': 64, 'sideways_adx_thresh': 32.60300712717207, 'sideways_atr_min_pct': 0.001815934193561209, 'sideways_atr_max_pct': 0.03334738951201382, 'sideways_tp_mult': 1.4500498168190685, 'sideways_tsl_mult': 0.3899403517721166, 'sideways_time_stop': 218, 'sideways_use_sma': True, 'sideways_use_ema': True, 'sideways_use_atr': False, 'sideways_use_adx': False, 'sideways_use_spike': False, 'sideways_rsi_required': True}.
[I 2025-08-31 09:56:48,389] Trial 279 finished with values: [-1000000000.0, 1000000000.0] and parameters: {'p_sma': 48, 'p_std': 18, 'p_atr': 25, 'p_adx': 15, 'rsi_period': 21, 'ema1': 21, 'ema2': 56, 'slip_atr_k': 0.05297750765499887, 'slip_spread_k': 0.418401563014949, 'spread_hl_frac': 0.017722922377091645, 'bb_std_mult': 1.1604040148707662, 'rsi_os': 39, 'rsi_ob': 47, 'vol_spike': 0.13455516090865458, 'adx_thresh': 15.394591343505958, 'atr_min_pct': 0.006947074468750151, 'atr_max_pct': 0.136710780785132, 'tp_mult': 2.327984458920763, 'tsl_mult': 0.47892498637652736, 'strategy': 'breakout', 'time_stop': 133, 'use_sma': False, 'use_atr': False, 'use_adx': False, 'use_ema': False, 'use_spike': False, 'rsi_required': False, 'edge_k': 0.6968190217258342, 'edge_cap': 0.16121828107366598, 'bull_strategy': 'mean_reversion', 'bull_bb_std_mult': 1.297693459460724, 'bull_rsi_os': 31, 'bull_rsi_ob': 63, 'bull_adx_thresh': 17.973584561084717, 'bull_atr_min_pct': 0.019878112439923535, 'bull_atr_max_pct': 0.11966193958506025, 'bull_tp_mult': 1.639372440438658, 'bull_tsl_mult': 0.909821052083011, 'bull_time_stop': 149, 'bull_use_sma': False, 'bull_use_ema': False, 'bull_use_atr': False, 'bull_use_adx': False, 'bull_use_spike': False, 'bull_rsi_required': True, 'bear_strategy': 'mean_reversion', 'bear_bb_std_mult': 0.8166492111679062, 'bear_rsi_os': 16, 'bear_rsi_ob': 63, 'bear_adx_thresh': 15.172641885222882, 'bear_atr_min_pct': 0.013030974727166406, 'bear_atr_max_pct': 0.14277426632437798, 'bear_tp_mult': 2.6140076616439845, 'bear_tsl_mult': 0.4792766834795593, 'bear_time_stop': 132, 'bear_use_sma': True, 'bear_use_ema': True, 'bear_use_atr': False, 'bear_use_adx': False, 'bear_use_spike': False, 'bear_rsi_required': True, 'sideways_strategy': 'mean_reversion', 'sideways_bb_std_mult': 0.8457951843664222, 'sideways_rsi_os': 26, 'sideways_rsi_ob': 64, 'sideways_adx_thresh': 32.9674044013585, 'sideways_atr_min_pct': 0.0023485081048714466, 'sideways_atr_max_pct': 0.08420314206484285, 'sideways_tp_mult': 1.5362970711903052, 'sideways_tsl_mult': 0.9077636013991419, 'sideways_time_stop': 222, 'sideways_use_sma': True, 'sideways_use_ema': True, 'sideways_use_atr': False, 'sideways_use_adx': True, 'sideways_use_spike': False, 'sideways_rsi_required': True}.
