[I 2025-08-31 10:18:12,653] Trial 468 finished with values: [-1000000000.0, 1000000000.0] and parameters: {'p_sma': 50, 'p_std': 13, 'p_atr': 26, 'p_adx': 10, 'rsi_period': 9, 'ema1': 22, 'ema2': 19, 'slip_atr_k': 0.1688962030985506, 'slip_spread_k': 0.4222507107002508, 'spread_hl_frac': 0.01636469132278321, 'bb_std_mult': 1.124476447342712, 'rsi_os': 26, 'rsi_ob': 51, 'vol_spike': 0.20400058884207012, 'adx_thresh': 31.539890487758495, 'atr_min_pct': 0.013376143550070881, 'atr_max_pct': 0.07508731675176637, 'tp_mult': 2.8116416443738825, 'tsl_mult': 0.02139274227306406, 'strategy': 'mean_reversion', 'time_stop': 144, 'use_sma': True, 'use_atr': True, 'use_adx': True, 'use_ema': False, 'use_spike': False, 'rsi_required': True, 'edge_k': 1.9256793419766232, 'edge_cap': 0.10748610732238739, 'bull_strategy': 'breakout', 'bull_bb_std_mult': 2.6891487110578103, 'bull_rsi_os': 29, 'bull_rsi_ob': 63, 'bull_adx_thresh': 16.13782600413384, 'bull_atr_min_pct': 0.01634391671012178, 'bull_atr_max_pct': 0.11428501720048752, 'bull_tp_mult': 2.8262047718259176, 'bull_tsl_mult': 0.06587942744782871, 'bull_time_stop': 221, 'bull_use_sma': False, 'bull_use_ema': True, 'bull_use_atr': True, 'bull_use_adx': False, 'bull_use_spike': True, 'bull_rsi_required': True, 'bear_strategy': 'mean_reversion', 'bear_bb_std_mult': 2.8283041017055592, 'bear_rsi_os': 54, 'bear_rsi_ob': 81, 'bear_adx_thresh': 23.978262361062853, 'bear_atr_min_pct': 0.02137108581436238, 'bear_atr_max_pct': 0.14056533948487596, 'bear_tp_mult': 2.71635959133151, 'bear_tsl_mult': 0.34267275822950494, 'bear_time_stop': 222, 'bear_use_sma': False, 'bear_use_ema': True, 'bear_use_atr': False, 'bear_use_adx': False, 'bear_use_spike': True, 'bear_rsi_required': False, 'sideways_strategy': 'mean_reversion', 'sideways_bb_std_mult': 2.5782962600359633, 'sideways_rsi_os': 38, 'sideways_rsi_ob': 63, 'sideways_adx_thresh': 5.733082096491827, 'sideways_atr_min_pct': 0.002490054415653205, 'sideways_atr_max_pct': 0.06293243474769449, 'sideways_tp_mult': 1.6270280685421574, 'sideways_tsl_mult': 0.9648509757188839, 'sideways_time_stop': 218, 'sideways_use_sma': True, 'sideways_use_ema': True, 'sideways_use_atr': True, 'sideways_use_adx': False, 'sideways_use_spike': False, 'sideways_rsi_required': True}.
[I 2025-08-31 10:18:44,888] Trial 471 finished with values: [-1000000000.0, 1000000000.0] and parameters: {'p_sma': 48, 'p_std': 7, 'p_atr': 20, 'p_adx': 10, 'rsi_period': 19, 'ema1': 18, 'ema2': 47, 'slip_atr_k': 0.1674675780217952, 'slip_spread_k': 0.4079650683816379, 'spread_hl_frac': 0.011884041415750833, 'bb_std_mult': 2.4729683895500565, 'rsi_os': 43, 'rsi_ob': 91, 'vol_spike': 0.23048448199576466, 'adx_thresh': 8.374863998932707, 'atr_min_pct': 0.025178160418360587, 'atr_max_pct': 0.08948075749239562, 'tp_mult': 2.801487187698445, 'tsl_mult': 0.2573177363274529, 'strategy': 'breakout', 'time_stop': 139, 'use_sma': False, 'use_atr': False, 'use_adx': False, 'use_ema': True, 'use_spike': False, 'rsi_required': True, 'edge_k': 1.931709999311907, 'edge_cap': 0.663814295509209, 'bull_strategy': 'mean_reversion', 'bull_bb_std_mult': 1.1075827982542767, 'bull_rsi_os': 33, 'bull_rsi_ob': 69, 'bull_adx_thresh': 17.86227660018401, 'bull_atr_min_pct': 0.018646134234801433, 'bull_atr_max_pct': 0.08578438538249751, 'bull_tp_mult': 1.5754884012127286, 'bull_tsl_mult': 0.5982125163893859, 'bull_time_stop': 261, 'bull_use_sma': True, 'bull_use_ema': False, 'bull_use_atr': False, 'bull_use_adx': False, 'bull_use_spike': False, 'bull_rsi_required': True, 'bear_strategy': 'breakout', 'bear_bb_std_mult': 2.8982297902520138, 'bear_rsi_os': 5, 'bear_rsi_ob': 82, 'bear_adx_thresh': 30.675629374959186, 'bear_atr_min_pct': 0.009720722487076006, 'bear_atr_max_pct': 0.14106349484077882, 'bear_tp_mult': 2.6314920925335037, 'bear_tsl_mult': 0.7382866145006483, 'bear_time_stop': 264, 'bear_use_sma': False, 'bear_use_ema': True, 'bear_use_atr': False, 'bear_use_adx': True, 'bear_use_spike': True, 'bear_rsi_required': True, 'sideways_strategy': 'breakout', 'sideways_bb_std_mult': 0.9167114174399967, 'sideways_rsi_os': 24, 'sideways_rsi_ob': 65, 'sideways_adx_thresh': 5.617524465387977, 'sideways_atr_min_pct': 0.010263125496264144, 'sideways_atr_max_pct': 0.030483954221028363, 'sideways_tp_mult': 1.5225408264208355, 'sideways_tsl_mult': 0.07264922013457997, 'sideways_time_stop': 229, 'sideways_use_sma': True, 'sideways_use_ema': True, 'sideways_use_atr': False, 'sideways_use_adx': False, 'sideways_use_spike': False, 'sideways_rsi_required': False}.
[I 2025-08-31 10:18:45,651] Trial 469 finished with values: [-1000000000.0, 1000000000.0] and parameters: {'p_sma': 51, 'p_std': 48, 'p_atr': 18, 'p_adx': 8, 'rsi_period': 12, 'ema1': 22, 'ema2': 47, 'slip_atr_k': 0.22015419344657858, 'slip_spread_k': 0.4129753122456233, 'spread_hl_frac': 0.016282218218484933, 'bb_std_mult': 1.1756636262342786, 'rsi_os': 18, 'rsi_ob': 92, 'vol_spike': 0.04987013639824768, 'adx_thresh': 6.655179977444448, 'atr_min_pct': 0.01347501063848552, 'atr_max_pct': 0.14450519246316418, 'tp_mult': 2.810357676031301, 'tsl_mult': 0.05831577741159654, 'strategy': 'mean_reversion', 'time_stop': 129, 'use_sma': True, 'use_atr': True, 'use_adx': True, 'use_ema': False, 'use_spike': False, 'rsi_required': True, 'edge_k': 1.9231751929930971, 'edge_cap': 0.12006290510248158, 'bull_strategy': 'breakout', 'bull_bb_std_mult': 1.2611618459642309, 'bull_rsi_os': 29, 'bull_rsi_ob': 66, 'bull_adx_thresh': 30.137297833108875, 'bull_atr_min_pct': 0.00712869430513521, 'bull_atr_max_pct': 0.11384897427515323, 'bull_tp_mult': 2.250934925481165, 'bull_tsl_mult': 0.33637015716647173, 'bull_time_stop': 223, 'bull_use_sma': False, 'bull_use_ema': False, 'bull_use_atr': True, 'bull_use_adx': False, 'bull_use_spike': True, 'bull_rsi_required': True, 'bear_strategy': 'mean_reversion', 'bear_bb_std_mult': 0.7528895064748611, 'bear_rsi_os': 21, 'bear_rsi_ob': 71, 'bear_adx_thresh': 21.096616299026216, 'bear_atr_min_pct': 0.02152169808576686, 'bear_atr_max_pct': 0.022966924202605682, 'bear_tp_mult': 2.730089038768299, 'bear_tsl_mult': 0.4980343455882518, 'bear_time_stop': 186, 'bear_use_sma': False, 'bear_use_ema': True, 'bear_use_atr': False, 'bear_use_adx': False, 'bear_use_spike': True, 'bear_rsi_required': False, 'sideways_strategy': 'mean_reversion', 'sideways_bb_std_mult': 1.206094655305788, 'sideways_rsi_os': 38, 'sideways_rsi_ob': 94, 'sideways_adx_thresh': 32.701930074254506, 'sideways_atr_min_pct': 0.02637537717978962, 'sideways_atr_max_pct': 0.10276461142250554, 'sideways_tp_mult': 1.5126354496520773, 'sideways_tsl_mult': 0.9699079554661265, 'sideways_time_stop': 93, 'sideways_use_sma': True, 'sideways_use_ema': True, 'sideways_use_atr': True, 'sideways_use_adx': False, 'sideways_use_spike': False, 'sideways_rsi_required': True}.
[I 2025-08-31 10:18:45,754] Trial 470 finished with values: [-0.10160907472707481, 0.10153690495472693] and parameters: {'p_sma': 50, 'p_std': 40, 'p_atr': 22, 'p_adx': 9, 'rsi_period': 19, 'ema1': 8, 'ema2': 47, 'slip_atr_k': 0.18299685897200563, 'slip_spread_k': 0.4094989815999907, 'spread_hl_frac': 0.01135913261838159, 'bb_std_mult': 1.1797121252250828, 'rsi_os': 25, 'rsi_ob': 73, 'vol_spike': 0.12806044759672483, 'adx_thresh': 6.336400978292305, 'atr_min_pct': 0.026305861178415664, 'atr_max_pct': 0.08913034095015487, 'tp_mult': 2.8107664571918693, 'tsl_mult': 0.055642018616637735, 'strategy': 'breakout', 'time_stop': 130, 'use_sma': True, 'use_atr': False, 'use_adx': True, 'use_ema': True, 'use_spike': False, 'rsi_required': True, 'edge_k': 1.9151613621484105, 'edge_cap': 0.10973513563909743, 'bull_strategy': 'breakout', 'bull_bb_std_mult': 1.1014270947856382, 'bull_rsi_os': 29, 'bull_rsi_ob': 66, 'bull_adx_thresh': 30.621266166807256, 'bull_atr_min_pct': 0.006045932473693828, 'bull_atr_max_pct': 0.04022846661907662, 'bull_tp_mult': 1.5381444877879946, 'bull_tsl_mult': 0.3314732953691642, 'bull_time_stop': 169, 'bull_use_sma': False, 'bull_use_ema': False, 'bull_use_atr': False, 'bull_use_adx': False, 'bull_use_spike': True, 'bull_rsi_required': True, 'bear_strategy': 'mean_reversion', 'bear_bb_std_mult': 2.9067244346811876, 'bear_rsi_os': 54, 'bear_rsi_ob': 79, 'bear_adx_thresh': 12.388289163021415, 'bear_atr_min_pct': 0.02109887238846893, 'bear_atr_max_pct': 0.14160089940923995, 'bear_tp_mult': 2.0452786547231465, 'bear_tsl_mult': 0.5005227431340444, 'bear_time_stop': 242, 'bear_use_sma': False, 'bear_use_ema': True, 'bear_use_atr': False, 'bear_use_adx': True, 'bear_use_spike': True, 'bear_rsi_required': True, 'sideways_strategy': 'breakout', 'sideways_bb_std_mult': 0.888558197724262, 'sideways_rsi_os': 37, 'sideways_rsi_ob': 63, 'sideways_adx_thresh': 33.097897720452, 'sideways_atr_min_pct': 0.0010369118368549566, 'sideways_atr_max_pct': 0.10253839624311001, 'sideways_tp_mult': 1.619662063393271, 'sideways_tsl_mult': 0.06950267540456175, 'sideways_time_stop': 232, 'sideways_use_sma': True, 'sideways_use_ema': True, 'sideways_use_atr': True, 'sideways_use_adx': False, 'sideways_use_spike': False, 'sideways_rsi_required': False}.
[I 2025-08-31 10:18:45,756] Trial 472 finished with values: [-0.008741672470239381, 0.008564060395231362] and parameters: {'p_sma': 11, 'p_std': 48, 'p_atr': 29, 'p_adx': 9, 'rsi_period': 23, 'ema1': 18, 'ema2': 38, 'slip_atr_k': 0.18411134279877, 'slip_spread_k': 0.10602993882035072, 'spread_hl_frac': 0.011320356979711909, 'bb_std_mult': 1.1712839973388067, 'rsi_os': 40, 'rsi_ob': 83, 'vol_spike': 0.29239014657588114, 'adx_thresh': 24.085946306280434, 'atr_min_pct': 0.011509958733292, 'atr_max_pct': 0.12228717230673933, 'tp_mult': 2.8967835162966153, 'tsl_mult': 0.056281799187325565, 'strategy': 'breakout', 'time_stop': 138, 'use_sma': False, 'use_atr': False, 'use_adx': False, 'use_ema': True, 'use_spike': False, 'rsi_required': True, 'edge_k': 1.9010037734287004, 'edge_cap': 0.12857233187550618, 'bull_strategy': 'mean_reversion', 'bull_bb_std_mult': 1.2206373690738856, 'bull_rsi_os': 26, 'bull_rsi_ob': 66, 'bull_adx_thresh': 30.636294787631986, 'bull_atr_min_pct': 0.007159299370312016, 'bull_atr_max_pct': 0.08584199649351326, 'bull_tp_mult': 2.2313230570581437, 'bull_tsl_mult': 0.978215650109969, 'bull_time_stop': 72, 'bull_use_sma': True, 'bull_use_ema': False, 'bull_use_atr': False, 'bull_use_adx': False, 'bull_use_spike': False, 'bull_rsi_required': True, 'bear_strategy': 'breakout', 'bear_bb_std_mult': 2.899184321256498, 'bear_rsi_os': 28, 'bear_rsi_ob': 79, 'bear_adx_thresh': 21.52007779862434, 'bear_atr_min_pct': 0.007327903132000976, 'bear_atr_max_pct': 0.10532752114602074, 'bear_tp_mult': 2.043372433044482, 'bear_tsl_mult': 0.46707021513350294, 'bear_time_stop': 263, 'bear_use_sma': False, 'bear_use_ema': True, 'bear_use_atr': False, 'bear_use_adx': True, 'bear_use_spike': True, 'bear_rsi_required': True, 'sideways_strategy': 'breakout', 'sideways_bb_std_mult': 0.9571616971691039, 'sideways_rsi_os': 24, 'sideways_rsi_ob': 94, 'sideways_adx_thresh': 29.74729943842392, 'sideways_atr_min_pct': 0.00117663596330612, 'sideways_atr_max_pct': 0.1032619498709842, 'sideways_tp_mult': 2.904392290650332, 'sideways_tsl_mult': 0.06509402378054306, 'sideways_time_stop': 232, 'sideways_use_sma': True, 'sideways_use_ema': True, 'sideways_use_atr': False, 'sideways_use_adx': False, 'sideways_use_spike': True, 'sideways_rsi_required': False}.
[I 2025-08-31 10:19:19,407] Trial 476 finished with values: [-1000000000.0, 1000000000.0] and parameters: {'p_sma': 11, 'p_std': 46, 'p_atr': 29, 'p_adx': 9, 'rsi_period': 27, 'ema1': 17, 'ema2': 36, 'slip_atr_k': 0.18595047774428194, 'slip_spread_k': 0.11090409893340247, 'spread_hl_frac': 0.009533335198727424, 'bb_std_mult': 1.263854345699809, 'rsi_os': 40, 'rsi_ob': 83, 'vol_spike': 0.2925650614067462, 'adx_thresh': 24.28397361158541, 'atr_min_pct': 0.009598297807230644, 'atr_max_pct': 0.12002520705408634, 'tp_mult': 2.906838631147147, 'tsl_mult': 0.0855968388962226, 'strategy': 'breakout', 'time_stop': 68, 'use_sma': False, 'use_atr': False, 'use_adx': False, 'use_ema': True, 'use_spike': False, 'rsi_required': False, 'edge_k': 1.9852414293892782, 'edge_cap': 0.16636591771511183, 'bull_strategy': 'mean_reversion', 'bull_bb_std_mult': 1.0970155297854933, 'bull_rsi_os': 25, 'bull_rsi_ob': 65, 'bull_adx_thresh': 29.0382996373032, 'bull_atr_min_pct': 0.006496510940155889, 'bull_atr_max_pct': 0.08882225509702579, 'bull_tp_mult': 2.088196311071328, 'bull_tsl_mult': 0.9834136212367884, 'bull_time_stop': 73, 'bull_use_sma': True, 'bull_use_ema': False, 'bull_use_atr': False, 'bull_use_adx': False, 'bull_use_spike': False, 'bull_rsi_required': True, 'bear_strategy': 'breakout', 'bear_bb_std_mult': 3.0255668592981837, 'bear_rsi_os': 28, 'bear_rsi_ob': 74, 'bear_adx_thresh': 22.889380060460073, 'bear_atr_min_pct': 0.007189835262722143, 'bear_atr_max_pct': 0.10461829332182127, 'bear_tp_mult': 2.0770151618872523, 'bear_tsl_mult': 0.42553754583415315, 'bear_time_stop': 273, 'bear_use_sma': False, 'bear_use_ema': True, 'bear_use_atr': True, 'bear_use_adx': True, 'bear_use_spike': True, 'bear_rsi_required': True, 'sideways_strategy': 'breakout', 'sideways_bb_std_mult': 0.6313233726270749, 'sideways_rsi_os': 21, 'sideways_rsi_ob': 93, 'sideways_adx_thresh': 29.339792709388377, 'sideways_atr_min_pct': 0.0007178326780032315, 'sideways_atr_max_pct': 0.09082743985813915, 'sideways_tp_mult': 2.911277531217549, 'sideways_tsl_mult': 0.031661837098448324, 'sideways_time_stop': 223, 'sideways_use_sma': False, 'sideways_use_ema': True, 'sideways_use_atr': False, 'sideways_use_adx': False, 'sideways_use_spike': True, 'sideways_rsi_required': False}.
[I 2025-08-31 10:19:20,228] Trial 475 finished with values: [-1000000000.0, 1000000000.0] and parameters: {'p_sma': 52, 'p_std': 16, 'p_atr': 30, 'p_adx': 9, 'rsi_period': 23, 'ema1': 19, 'ema2': 37, 'slip_atr_k': 0.1517791161972531, 'slip_spread_k': 0.4461352422065053, 'spread_hl_frac': 0.027311448709208708, 'bb_std_mult': 2.28578347433538, 'rsi_os': 22, 'rsi_ob': 47, 'vol_spike': 0.13989720688879295, 'adx_thresh': 7.3573828880886385, 'atr_min_pct': 0.011537696425314924, 'atr_max_pct': 0.13214131622825, 'tp_mult': 2.9083972869390733, 'tsl_mult': 0.0019408203324036862, 'strategy': 'breakout', 'time_stop': 120, 'use_sma': False, 'use_atr': False, 'use_adx': False, 'use_ema': False, 'use_spike': False, 'rsi_required': False, 'edge_k': 0.6447122095006648, 'edge_cap': 0.1381069307320091, 'bull_strategy': 'mean_reversion', 'bull_bb_std_mult': 0.9925208917808986, 'bull_rsi_os': 31, 'bull_rsi_ob': 56, 'bull_adx_thresh': 31.8044267314689, 'bull_atr_min_pct': 0.02054237738875124, 'bull_atr_max_pct': 0.10311151533588539, 'bull_tp_mult': 1.4380270355885354, 'bull_tsl_mult': 0.42010746172168756, 'bull_time_stop': 193, 'bull_use_sma': True, 'bull_use_ema': False, 'bull_use_atr': False, 'bull_use_adx': False, 'bull_use_spike': False, 'bull_rsi_required': True, 'bear_strategy': 'breakout', 'bear_bb_std_mult': 2.762551447061425, 'bear_rsi_os': 51, 'bear_rsi_ob': 47, 'bear_adx_thresh': 32.915173011942336, 'bear_atr_min_pct': 0.02080726790956613, 'bear_atr_max_pct': 0.13261493825434661, 'bear_tp_mult': 2.614382726788414, 'bear_tsl_mult': 0.469823689947225, 'bear_time_stop': 255, 'bear_use_sma': False, 'bear_use_ema': True, 'bear_use_atr': False, 'bear_use_adx': True, 'bear_use_spike': False, 'bear_rsi_required': True, 'sideways_strategy': 'breakout', 'sideways_bb_std_mult': 0.9775091635598756, 'sideways_rsi_os': 46, 'sideways_rsi_ob': 66, 'sideways_adx_thresh': 11.715240920381694, 'sideways_atr_min_pct': 0.021394447763684692, 'sideways_atr_max_pct': 0.13377808677121972, 'sideways_tp_mult': 2.34986412682342, 'sideways_tsl_mult': 0.5525093237290349, 'sideways_time_stop': 108, 'sideways_use_sma': True, 'sideways_use_ema': True, 'sideways_use_atr': False, 'sideways_use_adx': False, 'sideways_use_spike': True, 'sideways_rsi_required': False}.
[I 2025-08-31 10:19:20,396] Trial 474 finished with values: [-1000000000.0, 1000000000.0] and parameters: {'p_sma': 13, 'p_std': 16, 'p_atr': 28, 'p_adx': 9, 'rsi_period': 23, 'ema1': 19, 'ema2': 38, 'slip_atr_k': 0.17613200074172444, 'slip_spread_k': 0.39885576817195, 'spread_hl_frac': 0.01122602477280617, 'bb_std_mult': 2.3032709704973233, 'rsi_os': 21, 'rsi_ob': 83, 'vol_spike': 0.12984025098623964, 'adx_thresh': 7.494037539520301, 'atr_min_pct': 0.02330895708302188, 'atr_max_pct': 0.03960058480774729, 'tp_mult': 2.899633010387643, 'tsl_mult': 0.18357712462497033, 'strategy': 'breakout', 'time_stop': 120, 'use_sma': False, 'use_atr': False, 'use_adx': False, 'use_ema': True, 'use_spike': False, 'rsi_required': True, 'edge_k': 1.5354518887385107, 'edge_cap': 0.7269823777864655, 'bull_strategy': 'mean_reversion', 'bull_bb_std_mult': 1.182838102026086, 'bull_rsi_os': 53, 'bull_rsi_ob': 56, 'bull_adx_thresh': 7.1425525231329825, 'bull_atr_min_pct': 0.006128700431325133, 'bull_atr_max_pct': 0.11905016864379048, 'bull_tp_mult': 1.433719552955603, 'bull_tsl_mult': 0.7657869580536569, 'bull_time_stop': 256, 'bull_use_sma': True, 'bull_use_ema': False, 'bull_use_atr': False, 'bull_use_adx': False, 'bull_use_spike': False, 'bull_rsi_required': True, 'bear_strategy': 'breakout', 'bear_bb_std_mult': 0.5716303743476248, 'bear_rsi_os': 51, 'bear_rsi_ob': 79, 'bear_adx_thresh': 21.637677864057785, 'bear_atr_min_pct': 0.02097906913805947, 'bear_atr_max_pct': 0.1248240300094492, 'bear_tp_mult': 1.0433226139720844, 'bear_tsl_mult': 0.454982254181897, 'bear_time_stop': 105, 'bear_use_sma': False, 'bear_use_ema': True, 'bear_use_atr': False, 'bear_use_adx': True, 'bear_use_spike': False, 'bear_rsi_required': True, 'sideways_strategy': 'breakout', 'sideways_bb_std_mult': 2.1665090100121316, 'sideways_rsi_os': 9, 'sideways_rsi_ob': 66, 'sideways_adx_thresh': 33.248674042864, 'sideways_atr_min_pct': 0.0011666014362017932, 'sideways_atr_max_pct': 0.03526965654221912, 'sideways_tp_mult': 1.5483587347214458, 'sideways_tsl_mult': 0.2334700427131094, 'sideways_time_stop': 237, 'sideways_use_sma': True, 'sideways_use_ema': True, 'sideways_use_atr': False, 'sideways_use_adx': False, 'sideways_use_spike': True, 'sideways_rsi_required': False}.
[I 2025-08-31 10:19:20,561] Trial 473 finished with values: [-1000000000.0, 1000000000.0] and parameters: {'p_sma': 14, 'p_std': 33, 'p_atr': 21, 'p_adx': 9, 'rsi_period': 60, 'ema1': 21, 'ema2': 38, 'slip_atr_k': 0.22000456117308959, 'slip_spread_k': 0.39568222881685533, 'spread_hl_frac': 0.011438194327005876, 'bb_std_mult': 1.1775059691886947, 'rsi_os': 21, 'rsi_ob': 46, 'vol_spike': 0.1260722274949616, 'adx_thresh': 16.834695575635127, 'atr_min_pct': 0.011615175042115714, 'atr_max_pct': 0.12178455019547318, 'tp_mult': 2.7442079348212145, 'tsl_mult': 0.00012111069340294903, 'strategy': 'breakout', 'time_stop': 132, 'use_sma': False, 'use_atr': False, 'use_adx': False, 'use_ema': False, 'use_spike': False, 'rsi_required': True, 'edge_k': 1.4188665783378227, 'edge_cap': 0.1280661174043105, 'bull_strategy': 'mean_reversion', 'bull_bb_std_mult': 1.2020283834918255, 'bull_rsi_os': 7, 'bull_rsi_ob': 66, 'bull_adx_thresh': 30.06400198559343, 'bull_atr_min_pct': 0.020446820309262346, 'bull_atr_max_pct': 0.04084813505453695, 'bull_tp_mult': 1.4375760598808294, 'bull_tsl_mult': 0.3359501361382606, 'bull_time_stop': 248, 'bull_use_sma': True, 'bull_use_ema': False, 'bull_use_atr': False, 'bull_use_adx': False, 'bull_use_spike': False, 'bull_rsi_required': True, 'bear_strategy': 'breakout', 'bear_bb_std_mult': 2.6673269416238834, 'bear_rsi_os': 40, 'bear_rsi_ob': 56, 'bear_adx_thresh': 32.764306368627174, 'bear_atr_min_pct': 0.021035246249195998, 'bear_atr_max_pct': 0.14599290372737272, 'bear_tp_mult': 1.0284038339004349, 'bear_tsl_mult': 0.45173172254172067, 'bear_time_stop': 255, 'bear_use_sma': False, 'bear_use_ema': True, 'bear_use_atr': False, 'bear_use_adx': True, 'bear_use_spike': False, 'bear_rsi_required': True, 'sideways_strategy': 'breakout', 'sideways_bb_std_mult': 0.9639454218013382, 'sideways_rsi_os': 9, 'sideways_rsi_ob': 63, 'sideways_adx_thresh': 11.449577664995651, 'sideways_atr_min_pct': 0.0008517659057773123, 'sideways_atr_max_pct': 0.0969527667977616, 'sideways_tp_mult': 1.0442495650780999, 'sideways_tsl_mult': 0.8371228489629219, 'sideways_time_stop': 16, 'sideways_use_sma': True, 'sideways_use_ema': True, 'sideways_use_atr': False, 'sideways_use_adx': False, 'sideways_use_spike': True, 'sideways_rsi_required': False}.
