[I 2025-08-31 11:00:46,862] Trial 776 finished with values: [-1000000000.0, 1000000000.0] and parameters: {'p_sma': 13, 'p_std': 5, 'p_atr': 25, 'p_adx': 27, 'rsi_period': 23, 'ema1': 19, 'ema2': 28, 'slip_atr_k': 0.18772177061805836, 'slip_spread_k': 0.6157414647218763, 'spread_hl_frac': 0.012451444189538027, 'bb_std_mult': 1.3745022240371334, 'rsi_os': 38, 'rsi_ob': 80, 'vol_spike': 0.2998108160352724, 'adx_thresh': 23.90549307568968, 'atr_min_pct': 0.018082478418956258, 'atr_max_pct': 0.1268480509808738, 'tp_mult': 2.845880447436603, 'tsl_mult': 0.5274539818327884, 'strategy': 'breakout', 'time_stop': 133, 'use_sma': True, 'use_atr': False, 'use_adx': True, 'use_ema': True, 'use_spike': False, 'rsi_required': True, 'edge_k': 0.28772386226044544, 'edge_cap': 0.0712899125705452, 'bull_strategy': 'breakout', 'bull_bb_std_mult': 1.1162709629600043, 'bull_rsi_os': 51, 'bull_rsi_ob': 92, 'bull_adx_thresh': 31.959001479359166, 'bull_atr_min_pct': 0.0012502573362854312, 'bull_atr_max_pct': 0.089153138115041, 'bull_tp_mult': 2.146267255956558, 'bull_tsl_mult': 0.04420381232073173, 'bull_time_stop': 67, 'bull_use_sma': True, 'bull_use_ema': True, 'bull_use_atr': False, 'bull_use_adx': False, 'bull_use_spike': False, 'bull_rsi_required': False, 'bear_strategy': 'mean_reversion', 'bear_bb_std_mult': 0.8246314740424241, 'bear_rsi_os': 5, 'bear_rsi_ob': 92, 'bear_adx_thresh': 20.891669219806918, 'bear_atr_min_pct': 0.008149814499197383, 'bear_atr_max_pct': 0.11627509134796801, 'bear_tp_mult': 2.0378589051525973, 'bear_tsl_mult': 0.46234262758723316, 'bear_time_stop': 255, 'bear_use_sma': True, 'bear_use_ema': True, 'bear_use_atr': False, 'bear_use_adx': True, 'bear_use_spike': True, 'bear_rsi_required': True, 'sideways_strategy': 'mean_reversion', 'sideways_bb_std_mult': 2.6472171937330327, 'sideways_rsi_os': 23, 'sideways_rsi_ob': 95, 'sideways_adx_thresh': 27.1610892990672, 'sideways_atr_min_pct': 0.017884966662360093, 'sideways_atr_max_pct': 0.09962751427745203, 'sideways_tp_mult': 2.88373467681309, 'sideways_tsl_mult': 0.36769071375328694, 'sideways_time_stop': 225, 'sideways_use_sma': True, 'sideways_use_ema': True, 'sideways_use_atr': False, 'sideways_use_adx': True, 'sideways_use_spike': True, 'sideways_rsi_required': True}.
[I 2025-08-31 11:00:47,012] Trial 775 finished with values: [-1000000000.0, 1000000000.0] and parameters: {'p_sma': 14, 'p_std': 5, 'p_atr': 29, 'p_adx': 15, 'rsi_period': 23, 'ema1': 19, 'ema2': 41, 'slip_atr_k': 0.11123203756878727, 'slip_spread_k': 0.06237643891737213, 'spread_hl_frac': 0.03464905011480508, 'bb_std_mult': 3.385761473794376, 'rsi_os': 5, 'rsi_ob': 80, 'vol_spike': 0.010522303820787088, 'adx_thresh': 23.541703712726957, 'atr_min_pct': 0.001367555426015599, 'atr_max_pct': 0.127780426084699, 'tp_mult': 2.798065451341841, 'tsl_mult': 0.6257847580186299, 'strategy': 'breakout', 'time_stop': 136, 'use_sma': True, 'use_atr': False, 'use_adx': True, 'use_ema': True, 'use_spike': False, 'rsi_required': True, 'edge_k': 1.8395550677046217, 'edge_cap': 0.08292583336945503, 'bull_strategy': 'breakout', 'bull_bb_std_mult': 1.0961683778435303, 'bull_rsi_os': 23, 'bull_rsi_ob': 59, 'bull_adx_thresh': 32.074785833315715, 'bull_atr_min_pct': 0.005419058053676115, 'bull_atr_max_pct': 0.08666577140422688, 'bull_tp_mult': 2.1417741674452255, 'bull_tsl_mult': 0.9548448725315803, 'bull_time_stop': 69, 'bull_use_sma': True, 'bull_use_ema': False, 'bull_use_atr': False, 'bull_use_adx': False, 'bull_use_spike': False, 'bull_rsi_required': False, 'bear_strategy': 'mean_reversion', 'bear_bb_std_mult': 3.152652033921808, 'bear_rsi_os': 28, 'bear_rsi_ob': 78, 'bear_adx_thresh': 20.215635896899986, 'bear_atr_min_pct': 0.017674519286187733, 'bear_atr_max_pct': 0.09773030443384417, 'bear_tp_mult': 2.091334243444813, 'bear_tsl_mult': 0.8798459264819423, 'bear_time_stop': 145, 'bear_use_sma': False, 'bear_use_ema': True, 'bear_use_atr': False, 'bear_use_adx': True, 'bear_use_spike': True, 'bear_rsi_required': True, 'sideways_strategy': 'mean_reversion', 'sideways_bb_std_mult': 0.9883191989749291, 'sideways_rsi_os': 21, 'sideways_rsi_ob': 95, 'sideways_adx_thresh': 30.328237849075908, 'sideways_atr_min_pct': 0.016600321385642804, 'sideways_atr_max_pct': 0.0985806085274446, 'sideways_tp_mult': 2.885323555749686, 'sideways_tsl_mult': 0.6132918983875484, 'sideways_time_stop': 223, 'sideways_use_sma': True, 'sideways_use_ema': True, 'sideways_use_atr': False, 'sideways_use_adx': True, 'sideways_use_spike': True, 'sideways_rsi_required': True}.
[I 2025-08-31 11:00:47,084] Trial 774 finished with values: [-1000000000.0, 1000000000.0] and parameters: {'p_sma': 19, 'p_std': 46, 'p_atr': 29, 'p_adx': 10, 'rsi_period': 23, 'ema1': 9, 'ema2': 41, 'slip_atr_k': 0.1901589434432793, 'slip_spread_k': 0.14966162518676251, 'spread_hl_frac': 0.0037762202985107997, 'bb_std_mult': 3.3281661496234225, 'rsi_os': 37, 'rsi_ob': 81, 'vol_spike': 0.29989451700571823, 'adx_thresh': 23.71432391488172, 'atr_min_pct': 0.011617654780734673, 'atr_max_pct': 0.1262934790826309, 'tp_mult': 1.4995714652197312, 'tsl_mult': 0.5336422190877508, 'strategy': 'breakout', 'time_stop': 136, 'use_sma': True, 'use_atr': False, 'use_adx': True, 'use_ema': True, 'use_spike': False, 'rsi_required': True, 'edge_k': 1.8447556308447106, 'edge_cap': 0.08997339734754516, 'bull_strategy': 'breakout', 'bull_bb_std_mult': 1.1072045884787167, 'bull_rsi_os': 23, 'bull_rsi_ob': 68, 'bull_adx_thresh': 32.1668807153873, 'bull_atr_min_pct': 0.01537626277865416, 'bull_atr_max_pct': 0.08666620911588536, 'bull_tp_mult': 2.1505163599929036, 'bull_tsl_mult': 0.9594268999384973, 'bull_time_stop': 68, 'bull_use_sma': True, 'bull_use_ema': False, 'bull_use_atr': False, 'bull_use_adx': False, 'bull_use_spike': False, 'bull_rsi_required': False, 'bear_strategy': 'mean_reversion', 'bear_bb_std_mult': 2.0515502117132094, 'bear_rsi_os': 11, 'bear_rsi_ob': 81, 'bear_adx_thresh': 32.16674305011297, 'bear_atr_min_pct': 0.006352128418924949, 'bear_atr_max_pct': 0.09680603418554373, 'bear_tp_mult': 2.094788401980293, 'bear_tsl_mult': 0.4436257946855285, 'bear_time_stop': 256, 'bear_use_sma': False, 'bear_use_ema': True, 'bear_use_atr': False, 'bear_use_adx': True, 'bear_use_spike': True, 'bear_rsi_required': True, 'sideways_strategy': 'breakout', 'sideways_bb_std_mult': 0.9991968279303787, 'sideways_rsi_os': 25, 'sideways_rsi_ob': 93, 'sideways_adx_thresh': 30.263173065457295, 'sideways_atr_min_pct': 0.002492977762999722, 'sideways_atr_max_pct': 0.09872666843890915, 'sideways_tp_mult': 2.6757673920443437, 'sideways_tsl_mult': 0.054575430034580194, 'sideways_time_stop': 223, 'sideways_use_sma': True, 'sideways_use_ema': True, 'sideways_use_atr': False, 'sideways_use_adx': True, 'sideways_use_spike': True, 'sideways_rsi_required': False}.
[I 2025-08-31 11:00:47,919] Trial 778 finished with values: [-1000000000.0, 1000000000.0] and parameters: {'p_sma': 9, 'p_std': 46, 'p_atr': 28, 'p_adx': 8, 'rsi_period': 39, 'ema1': 10, 'ema2': 38, 'slip_atr_k': 0.000632516781759504, 'slip_spread_k': 0.15501037983431432, 'spread_hl_frac': 0.018675360328426184, 'bb_std_mult': 1.1948128086315009, 'rsi_os': 51, 'rsi_ob': 68, 'vol_spike': 0.2909127374468539, 'adx_thresh': 24.667305774719395, 'atr_min_pct': 0.007181570552579871, 'atr_max_pct': 0.12418270442351911, 'tp_mult': 2.8995028402780183, 'tsl_mult': 0.1550511766515157, 'strategy': 'mean_reversion', 'time_stop': 122, 'use_sma': True, 'use_atr': False, 'use_adx': False, 'use_ema': True, 'use_spike': False, 'rsi_required': True, 'edge_k': 1.5623364495518492, 'edge_cap': 0.2249378234029788, 'bull_strategy': 'breakout', 'bull_bb_std_mult': 0.9074905601723571, 'bull_rsi_os': 25, 'bull_rsi_ob': 46, 'bull_adx_thresh': 30.456008491443026, 'bull_atr_min_pct': 0.005479333559540416, 'bull_atr_max_pct': 0.08318126979138019, 'bull_tp_mult': 2.2764902885950438, 'bull_tsl_mult': 0.2226960410388863, 'bull_time_stop': 59, 'bull_use_sma': False, 'bull_use_ema': False, 'bull_use_atr': False, 'bull_use_adx': False, 'bull_use_spike': False, 'bull_rsi_required': True, 'bear_strategy': 'mean_reversion', 'bear_bb_std_mult': 2.0187576671621943, 'bear_rsi_os': 21, 'bear_rsi_ob': 78, 'bear_adx_thresh': 20.1003141101092, 'bear_atr_min_pct': 0.008689216145861557, 'bear_atr_max_pct': 0.010321527544954703, 'bear_tp_mult': 2.468274205004673, 'bear_tsl_mult': 0.37442852830744383, 'bear_time_stop': 147, 'bear_use_sma': False, 'bear_use_ema': False, 'bear_use_atr': False, 'bear_use_adx': True, 'bear_use_spike': True, 'bear_rsi_required': True, 'sideways_strategy': 'mean_reversion', 'sideways_bb_std_mult': 0.9982347141058151, 'sideways_rsi_os': 21, 'sideways_rsi_ob': 77, 'sideways_adx_thresh': 30.215215036273424, 'sideways_atr_min_pct': 0.010489093019683968, 'sideways_atr_max_pct': 0.10359333165722284, 'sideways_tp_mult': 2.9014250321938206, 'sideways_tsl_mult': 0.7326423681756825, 'sideways_time_stop': 241, 'sideways_use_sma': True, 'sideways_use_ema': True, 'sideways_use_atr': False, 'sideways_use_adx': False, 'sideways_use_spike': True, 'sideways_rsi_required': True}.
[I 2025-08-31 11:00:47,946] Trial 779 finished with values: [-1000000000.0, 1000000000.0] and parameters: {'p_sma': 8, 'p_std': 26, 'p_atr': 17, 'p_adx': 16, 'rsi_period': 17, 'ema1': 18, 'ema2': 38, 'slip_atr_k': 0.0966565970081798, 'slip_spread_k': 0.15092197641666716, 'spread_hl_frac': 0.02996973849419407, 'bb_std_mult': 1.1913433535666318, 'rsi_os': 51, 'rsi_ob': 83, 'vol_spike': 0.2600268424500512, 'adx_thresh': 24.575528220193323, 'atr_min_pct': 0.02645000790239746, 'atr_max_pct': 0.017128408699864803, 'tp_mult': 2.0262179512742913, 'tsl_mult': 0.03648515518854627, 'strategy': 'mean_reversion', 'time_stop': 168, 'use_sma': False, 'use_atr': False, 'use_adx': False, 'use_ema': True, 'use_spike': False, 'rsi_required': True, 'edge_k': 1.907629091649066, 'edge_cap': 0.13877602353712296, 'bull_strategy': 'mean_reversion', 'bull_bb_std_mult': 1.3211639332797769, 'bull_rsi_os': 25, 'bull_rsi_ob': 68, 'bull_adx_thresh': 17.041978889416, 'bull_atr_min_pct': 0.006712158348078804, 'bull_atr_max_pct': 0.07849222435518959, 'bull_tp_mult': 1.6711773301254955, 'bull_tsl_mult': 0.9607779926297744, 'bull_time_stop': 142, 'bull_use_sma': False, 'bull_use_ema': False, 'bull_use_atr': True, 'bull_use_adx': False, 'bull_use_spike': False, 'bull_rsi_required': True, 'bear_strategy': 'breakout', 'bear_bb_std_mult': 3.0438694463483698, 'bear_rsi_os': 7, 'bear_rsi_ob': 86, 'bear_adx_thresh': 7.400927193373644, 'bear_atr_min_pct': 0.00859462338496294, 'bear_atr_max_pct': 0.07498194080820465, 'bear_tp_mult': 2.1937028188843173, 'bear_tsl_mult': 0.9633433889444478, 'bear_time_stop': 235, 'bear_use_sma': False, 'bear_use_ema': False, 'bear_use_atr': False, 'bear_use_adx': True, 'bear_use_spike': True, 'bear_rsi_required': True, 'sideways_strategy': 'breakout', 'sideways_bb_std_mult': 0.8822318775663147, 'sideways_rsi_os': 24, 'sideways_rsi_ob': 77, 'sideways_adx_thresh': 28.008880975124463, 'sideways_atr_min_pct': 0.0024337134996785578, 'sideways_atr_max_pct': 0.1027282478907059, 'sideways_tp_mult': 2.028539480587504, 'sideways_tsl_mult': 0.047086852446766136, 'sideways_time_stop': 241, 'sideways_use_sma': True, 'sideways_use_ema': True, 'sideways_use_atr': False, 'sideways_use_adx': False, 'sideways_use_spike': True, 'sideways_rsi_required': False}.
[I 2025-08-31 11:01:14,805] Trial 780 finished with values: [-1000000000.0, 1000000000.0] and parameters: {'p_sma': 11, 'p_std': 49, 'p_atr': 28, 'p_adx': 16, 'rsi_period': 45, 'ema1': 18, 'ema2': 38, 'slip_atr_k': 0.17802765078156996, 'slip_spread_k': 0.14012560504541008, 'spread_hl_frac': 0.030126414391149672, 'bb_std_mult': 1.1800811198954115, 'rsi_os': 40, 'rsi_ob': 83, 'vol_spike': 0.2937119864707989, 'adx_thresh': 24.524057806417808, 'atr_min_pct': 0.0037685174973162896, 'atr_max_pct': 0.12372205432608323, 'tp_mult': 2.8939454773456643, 'tsl_mult': 0.4230437176339036, 'strategy': 'mean_reversion', 'time_stop': 233, 'use_sma': False, 'use_atr': False, 'use_adx': False, 'use_ema': True, 'use_spike': False, 'rsi_required': True, 'edge_k': 1.8881154239565408, 'edge_cap': 0.23094269093203684, 'bull_strategy': 'mean_reversion', 'bull_bb_std_mult': 2.6884650117737166, 'bull_rsi_os': 25, 'bull_rsi_ob': 66, 'bull_adx_thresh': 30.51965391365298, 'bull_atr_min_pct': 0.012706460445584137, 'bull_atr_max_pct': 0.08221908716461163, 'bull_tp_mult': 2.314310444310234, 'bull_tsl_mult': 0.9994174179459904, 'bull_time_stop': 285, 'bull_use_sma': False, 'bull_use_ema': False, 'bull_use_atr': True, 'bull_use_adx': False, 'bull_use_spike': False, 'bull_rsi_required': True, 'bear_strategy': 'breakout', 'bear_bb_std_mult': 2.3324006893107314, 'bear_rsi_os': 45, 'bear_rsi_ob': 78, 'bear_adx_thresh': 15.587388342506562, 'bear_atr_min_pct': 0.0263786504722148, 'bear_atr_max_pct': 0.1063231283158174, 'bear_tp_mult': 1.9698099483633782, 'bear_tsl_mult': 0.8220711047113181, 'bear_time_stop': 163, 'bear_use_sma': False, 'bear_use_ema': False, 'bear_use_atr': False, 'bear_use_adx': True, 'bear_use_spike': True, 'bear_rsi_required': True, 'sideways_strategy': 'breakout', 'sideways_bb_std_mult': 1.8408865854638858, 'sideways_rsi_os': 16, 'sideways_rsi_ob': 94, 'sideways_adx_thresh': 7.350080397064115, 'sideways_atr_min_pct': 0.0034812136891550285, 'sideways_atr_max_pct': 0.1081443148301155, 'sideways_tp_mult': 2.9227945001027162, 'sideways_tsl_mult': 0.7328319962013187, 'sideways_time_stop': 157, 'sideways_use_sma': True, 'sideways_use_ema': True, 'sideways_use_atr': False, 'sideways_use_adx': False, 'sideways_use_spike': True, 'sideways_rsi_required': False}.
[I 2025-08-31 11:01:15,577] Trial 777 finished with values: [-1000000000.0, 1000000000.0] and parameters: {'p_sma': 15, 'p_std': 49, 'p_atr': 28, 'p_adx': 18, 'rsi_period': 17, 'ema1': 10, 'ema2': 41, 'slip_atr_k': 0.19034552888600478, 'slip_spread_k': 0.13532648665467129, 'spread_hl_frac': 0.0302653500015743, 'bb_std_mult': 3.2928985408981166, 'rsi_os': 39, 'rsi_ob': 83, 'vol_spike': 0.28904421376054823, 'adx_thresh': 24.503421443718548, 'atr_min_pct': 0.01222818315510353, 'atr_max_pct': 0.12588660742434662, 'tp_mult': 2.895229071183019, 'tsl_mult': 0.9486647491037509, 'strategy': 'mean_reversion', 'time_stop': 121, 'use_sma': True, 'use_atr': False, 'use_adx': False, 'use_ema': True, 'use_spike': False, 'rsi_required': True, 'edge_k': 1.9071984985795782, 'edge_cap': 0.23781050073853138, 'bull_strategy': 'breakout', 'bull_bb_std_mult': 1.1313999057943627, 'bull_rsi_os': 25, 'bull_rsi_ob': 68, 'bull_adx_thresh': 30.686076709146135, 'bull_atr_min_pct': 0.006479418026273394, 'bull_atr_max_pct': 0.08276564384013074, 'bull_tp_mult': 1.1822977915491166, 'bull_tsl_mult': 0.9591274715230139, 'bull_time_stop': 295, 'bull_use_sma': False, 'bull_use_ema': False, 'bull_use_atr': False, 'bull_use_adx': False, 'bull_use_spike': False, 'bull_rsi_required': True, 'bear_strategy': 'mean_reversion', 'bear_bb_std_mult': 3.056490527839119, 'bear_rsi_os': 21, 'bear_rsi_ob': 78, 'bear_adx_thresh': 20.034191177692577, 'bear_atr_min_pct': 0.003119415559684825, 'bear_atr_max_pct': 0.12210090334160592, 'bear_tp_mult': 1.1231511786300314, 'bear_tsl_mult': 0.35993554980031056, 'bear_time_stop': 231, 'bear_use_sma': False, 'bear_use_ema': False, 'bear_use_atr': False, 'bear_use_adx': True, 'bear_use_spike': True, 'bear_rsi_required': True, 'sideways_strategy': 'mean_reversion', 'sideways_bb_std_mult': 0.9954001859657398, 'sideways_rsi_os': 35, 'sideways_rsi_ob': 93, 'sideways_adx_thresh': 21.973033962471703, 'sideways_atr_min_pct': 0.007710311673930452, 'sideways_atr_max_pct': 0.09836378221583766, 'sideways_tp_mult': 2.6728507929650682, 'sideways_tsl_mult': 0.28505387387304715, 'sideways_time_stop': 240, 'sideways_use_sma': True, 'sideways_use_ema': True, 'sideways_use_atr': False, 'sideways_use_adx': False, 'sideways_use_spike': True, 'sideways_rsi_required': True}.
[I 2025-08-31 11:01:21,048] Trial 781 finished with values: [-1000000000.0, 1000000000.0] and parameters: {'p_sma': 12, 'p_std': 30, 'p_atr': 30, 'p_adx': 16, 'rsi_period': 17, 'ema1': 29, 'ema2': 25, 'slip_atr_k': 0.09910515942608747, 'slip_spread_k': 0.09533156725085451, 'spread_hl_frac': 0.04591760949287518, 'bb_std_mult': 1.168061984153173, 'rsi_os': 39, 'rsi_ob': 83, 'vol_spike': 0.08221529007284668, 'adx_thresh': 24.426971421110977, 'atr_min_pct': 0.010698997926910852, 'atr_max_pct': 0.10320068627981988, 'tp_mult': 2.618237007633935, 'tsl_mult': 0.6477174212655702, 'strategy': 'mean_reversion', 'time_stop': 144, 'use_sma': False, 'use_atr': False, 'use_adx': False, 'use_ema': True, 'use_spike': False, 'rsi_required': True, 'edge_k': 1.9085834575223117, 'edge_cap': 0.6334840622776341, 'bull_strategy': 'mean_reversion', 'bull_bb_std_mult': 1.350978487203369, 'bull_rsi_os': 20, 'bull_rsi_ob': 66, 'bull_adx_thresh': 26.301368260733355, 'bull_atr_min_pct': 0.00920366867540945, 'bull_atr_max_pct': 0.07819434269088164, 'bull_tp_mult': 1.1944065129402524, 'bull_tsl_mult': 0.9998089139349882, 'bull_time_stop': 48, 'bull_use_sma': False, 'bull_use_ema': False, 'bull_use_atr': True, 'bull_use_adx': False, 'bull_use_spike': False, 'bull_rsi_required': True, 'bear_strategy': 'breakout', 'bear_bb_std_mult': 3.5879247854711354, 'bear_rsi_os': 26, 'bear_rsi_ob': 48, 'bear_adx_thresh': 21.480694640302023, 'bear_atr_min_pct': 0.003126494903939129, 'bear_atr_max_pct': 0.0747643562245062, 'bear_tp_mult': 1.9204881558341034, 'bear_tsl_mult': 0.21603475183714144, 'bear_time_stop': 262, 'bear_use_sma': False, 'bear_use_ema': True, 'bear_use_atr': False, 'bear_use_adx': True, 'bear_use_spike': True, 'bear_rsi_required': False, 'sideways_strategy': 'breakout', 'sideways_bb_std_mult': 1.8231763537986283, 'sideways_rsi_os': 35, 'sideways_rsi_ob': 94, 'sideways_adx_thresh': 15.117670384604708, 'sideways_atr_min_pct': 0.003023232339719961, 'sideways_atr_max_pct': 0.10660642341265235, 'sideways_tp_mult': 1.9787241331853527, 'sideways_tsl_mult': 0.771532545487308, 'sideways_time_stop': 237, 'sideways_use_sma': True, 'sideways_use_ema': True, 'sideways_use_atr': False, 'sideways_use_adx': False, 'sideways_use_spike': True, 'sideways_rsi_required': False}.
[I 2025-08-31 11:01:21,415] Trial 782 finished with values: [-1000000000.0, 1000000000.0] and parameters: {'p_sma': 12, 'p_std': 49, 'p_atr': 28, 'p_adx': 7, 'rsi_period': 22, 'ema1': 18, 'ema2': 35, 'slip_atr_k': 0.05600653308148233, 'slip_spread_k': 0.27613672634375674, 'spread_hl_frac': 0.010247226736438369, 'bb_std_mult': 1.1091394256599652, 'rsi_os': 39, 'rsi_ob': 83, 'vol_spike': 0.2905681843889979, 'adx_thresh': 23.108821815234556, 'atr_min_pct': 0.023894069442433878, 'atr_max_pct': 0.11700529032886173, 'tp_mult': 2.6457627699559794, 'tsl_mult': 0.060288547700764646, 'strategy': 'breakout', 'time_stop': 48, 'use_sma': False, 'use_atr': True, 'use_adx': False, 'use_ema': True, 'use_spike': False, 'rsi_required': True, 'edge_k': 1.304056375733988, 'edge_cap': 0.917360053912113, 'bull_strategy': 'mean_reversion', 'bull_bb_std_mult': 1.5324284586035812, 'bull_rsi_os': 20, 'bull_rsi_ob': 66, 'bull_adx_thresh': 29.676851994932903, 'bull_atr_min_pct': 0.00944929161739345, 'bull_atr_max_pct': 0.09347453196718702, 'bull_tp_mult': 1.7745902566615033, 'bull_tsl_mult': 0.8616988242544288, 'bull_time_stop': 76, 'bull_use_sma': True, 'bull_use_ema': False, 'bull_use_atr': False, 'bull_use_adx': False, 'bull_use_spike': False, 'bull_rsi_required': True, 'bear_strategy': 'breakout', 'bear_bb_std_mult': 1.032942057163051, 'bear_rsi_os': 27, 'bear_rsi_ob': 48, 'bear_adx_thresh': 21.594717508603047, 'bear_atr_min_pct': 0.0031257413149699768, 'bear_atr_max_pct': 0.10652647389431213, 'bear_tp_mult': 1.8807797682712288, 'bear_tsl_mult': 0.4664941275937379, 'bear_time_stop': 261, 'bear_use_sma': False, 'bear_use_ema': True, 'bear_use_atr': False, 'bear_use_adx': True, 'bear_use_spike': True, 'bear_rsi_required': False, 'sideways_strategy': 'breakout', 'sideways_bb_std_mult': 0.7692824995755938, 'sideways_rsi_os': 17, 'sideways_rsi_ob': 94, 'sideways_adx_thresh': 20.91580358216552, 'sideways_atr_min_pct': 0.0076375128854820305, 'sideways_atr_max_pct': 0.10709197935025634, 'sideways_tp_mult': 2.8133593456473185, 'sideways_tsl_mult': 0.08543549075288986, 'sideways_time_stop': 229, 'sideways_use_sma': True, 'sideways_use_ema': True, 'sideways_use_atr': False, 'sideways_use_adx': False, 'sideways_use_spike': True, 'sideways_rsi_required': False}.
