[I 2025-08-31 10:14:22,601] Trial 430 finished with values: [-1000000000.0, 1000000000.0] and parameters: {'p_sma': 50, 'p_std': 16, 'p_atr': 28, 'p_adx': 10, 'rsi_period': 38, 'ema1': 16, 'ema2': 43, 'slip_atr_k': 0.19946434953311368, 'slip_spread_k': 0.6124882920075626, 'spread_hl_frac': 0.015208213359620155, 'bb_std_mult': 2.145245146408115, 'rsi_os': 24, 'rsi_ob': 49, 'vol_spike': 0.1381688603000174, 'adx_thresh': 6.329407775697421, 'atr_min_pct': 0.009343022264047708, 'atr_max_pct': 0.14089464588350573, 'tp_mult': 2.86856906328765, 'tsl_mult': 0.9986115068017749, 'strategy': 'breakout', 'time_stop': 133, 'use_sma': False, 'use_atr': False, 'use_adx': False, 'use_ema': False, 'use_spike': False, 'rsi_required': True, 'edge_k': 1.907942344238487, 'edge_cap': 0.1737954629042791, 'bull_strategy': 'mean_reversion', 'bull_bb_std_mult': 1.2986068453430086, 'bull_rsi_os': 34, 'bull_rsi_ob': 93, 'bull_adx_thresh': 28.520119470479273, 'bull_atr_min_pct': 0.019664941419991297, 'bull_atr_max_pct': 0.12556957530185772, 'bull_tp_mult': 2.160505420624807, 'bull_tsl_mult': 0.6112595835730095, 'bull_time_stop': 43, 'bull_use_sma': True, 'bull_use_ema': False, 'bull_use_atr': False, 'bull_use_adx': False, 'bull_use_spike': False, 'bull_rsi_required': True, 'bear_strategy': 'breakout', 'bear_bb_std_mult': 2.103943909238306, 'bear_rsi_os': 15, 'bear_rsi_ob': 75, 'bear_adx_thresh': 19.81384738100894, 'bear_atr_min_pct': 0.022338110727979706, 'bear_atr_max_pct': 0.12908528616018888, 'bear_tp_mult': 2.4479188383396115, 'bear_tsl_mult': 0.5323971407232694, 'bear_time_stop': 179, 'bear_use_sma': False, 'bear_use_ema': True, 'bear_use_atr': False, 'bear_use_adx': True, 'bear_use_spike': False, 'bear_rsi_required': True, 'sideways_strategy': 'breakout', 'sideways_bb_std_mult': 1.1503488351792015, 'sideways_rsi_os': 22, 'sideways_rsi_ob': 68, 'sideways_adx_thresh': 19.47768260061263, 'sideways_atr_min_pct': 0.002228759086074476, 'sideways_atr_max_pct': 0.01856985885913412, 'sideways_tp_mult': 2.3872369761061605, 'sideways_tsl_mult': 0.09692600513415389, 'sideways_time_stop': 239, 'sideways_use_sma': True, 'sideways_use_ema': True, 'sideways_use_atr': False, 'sideways_use_adx': False, 'sideways_use_spike': False, 'sideways_rsi_required': False}.
[I 2025-08-31 10:14:22,988] Trial 433 finished with values: [-1000000000.0, 1000000000.0] and parameters: {'p_sma': 50, 'p_std': 14, 'p_atr': 29, 'p_adx': 16, 'rsi_period': 33, 'ema1': 24, 'ema2': 53, 'slip_atr_k': 0.028256098705029126, 'slip_spread_k': 0.47425158558990016, 'spread_hl_frac': 0.015187696791594475, 'bb_std_mult': 1.382240280678947, 'rsi_os': 24, 'rsi_ob': 49, 'vol_spike': 0.13482940691646506, 'adx_thresh': 6.523002668503892, 'atr_min_pct': 0.021792988450154333, 'atr_max_pct': 0.07117961864769284, 'tp_mult': 1.8281959741053637, 'tsl_mult': 0.035604811580775435, 'strategy': 'breakout', 'time_stop': 150, 'use_sma': True, 'use_atr': True, 'use_adx': False, 'use_ema': False, 'use_spike': True, 'rsi_required': True, 'edge_k': 1.9160492623631729, 'edge_cap': 0.08545041396592251, 'bull_strategy': 'breakout', 'bull_bb_std_mult': 0.5065246133949795, 'bull_rsi_os': 8, 'bull_rsi_ob': 65, 'bull_adx_thresh': 31.906367963768965, 'bull_atr_min_pct': 0.025961016136411528, 'bull_atr_max_pct': 0.12474868563645426, 'bull_tp_mult': 1.5018720157300958, 'bull_tsl_mult': 0.0858458187275139, 'bull_time_stop': 141, 'bull_use_sma': False, 'bull_use_ema': False, 'bull_use_atr': False, 'bull_use_adx': True, 'bull_use_spike': True, 'bull_rsi_required': True, 'bear_strategy': 'mean_reversion', 'bear_bb_std_mult': 2.947464352822476, 'bear_rsi_os': 8, 'bear_rsi_ob': 85, 'bear_adx_thresh': 10.779787110228149, 'bear_atr_min_pct': 0.026967513317646817, 'bear_atr_max_pct': 0.016983938491351838, 'bear_tp_mult': 2.87925998252643, 'bear_tsl_mult': 0.2776060015879626, 'bear_time_stop': 253, 'bear_use_sma': False, 'bear_use_ema': True, 'bear_use_atr': False, 'bear_use_adx': False, 'bear_use_spike': True, 'bear_rsi_required': False, 'sideways_strategy': 'mean_reversion', 'sideways_bb_std_mult': 1.0104900445177147, 'sideways_rsi_os': 22, 'sideways_rsi_ob': 63, 'sideways_adx_thresh': 33.480737275969, 'sideways_atr_min_pct': 0.0035575391093303353, 'sideways_atr_max_pct': 0.02797640666186928, 'sideways_tp_mult': 2.3945346782189443, 'sideways_tsl_mult': 0.05839010979108836, 'sideways_time_stop': 239, 'sideways_use_sma': True, 'sideways_use_ema': True, 'sideways_use_atr': True, 'sideways_use_adx': True, 'sideways_use_spike': False, 'sideways_rsi_required': True}.
[I 2025-08-31 10:14:56,608] Trial 435 finished with values: [-1000000000.0, 1000000000.0] and parameters: {'p_sma': 50, 'p_std': 45, 'p_atr': 29, 'p_adx': 20, 'rsi_period': 18, 'ema1': 20, 'ema2': 38, 'slip_atr_k': 0.15958756171281688, 'slip_spread_k': 0.02922328773248617, 'spread_hl_frac': 0.013535315152364417, 'bb_std_mult': 2.1407331172097024, 'rsi_os': 21, 'rsi_ob': 58, 'vol_spike': 0.15631796300992973, 'adx_thresh': 5.075987810304917, 'atr_min_pct': 0.012965656177949548, 'atr_max_pct': 0.07159890492241487, 'tp_mult': 1.8351903640432696, 'tsl_mult': 0.034718601003236454, 'strategy': 'breakout', 'time_stop': 112, 'use_sma': True, 'use_atr': True, 'use_adx': False, 'use_ema': False, 'use_spike': True, 'rsi_required': True, 'edge_k': 0.7512897775550668, 'edge_cap': 0.17356429070177753, 'bull_strategy': 'breakout', 'bull_bb_std_mult': 1.354984952213338, 'bull_rsi_os': 30, 'bull_rsi_ob': 65, 'bull_adx_thresh': 23.08729723504061, 'bull_atr_min_pct': 0.01968140491994905, 'bull_atr_max_pct': 0.10805804656911278, 'bull_tp_mult': 1.565856117954625, 'bull_tsl_mult': 0.10237483438823475, 'bull_time_stop': 244, 'bull_use_sma': True, 'bull_use_ema': False, 'bull_use_atr': False, 'bull_use_adx': False, 'bull_use_spike': False, 'bull_rsi_required': True, 'bear_strategy': 'breakout', 'bear_bb_std_mult': 2.7384581042077123, 'bear_rsi_os': 7, 'bear_rsi_ob': 75, 'bear_adx_thresh': 27.537499143018675, 'bear_atr_min_pct': 0.020771105385472576, 'bear_atr_max_pct': 0.017757768648106395, 'bear_tp_mult': 2.6626774907457125, 'bear_tsl_mult': 0.514161137347813, 'bear_time_stop': 268, 'bear_use_sma': False, 'bear_use_ema': True, 'bear_use_atr': False, 'bear_use_adx': True, 'bear_use_spike': False, 'bear_rsi_required': False, 'sideways_strategy': 'mean_reversion', 'sideways_bb_std_mult': 1.6657157902442823, 'sideways_rsi_os': 6, 'sideways_rsi_ob': 52, 'sideways_adx_thresh': 19.530509413630945, 'sideways_atr_min_pct': 0.02063126742397761, 'sideways_atr_max_pct': 0.02822603320419273, 'sideways_tp_mult': 1.536155016736822, 'sideways_tsl_mult': 0.5721354966299832, 'sideways_time_stop': 127, 'sideways_use_sma': True, 'sideways_use_ema': True, 'sideways_use_atr': False, 'sideways_use_adx': False, 'sideways_use_spike': False, 'sideways_rsi_required': True}.
[I 2025-08-31 10:14:57,128] Trial 436 finished with values: [-1000000000.0, 1000000000.0] and parameters: {'p_sma': 49, 'p_std': 14, 'p_atr': 29, 'p_adx': 20, 'rsi_period': 59, 'ema1': 7, 'ema2': 52, 'slip_atr_k': 0.11265992727854902, 'slip_spread_k': 0.24359790064831044, 'spread_hl_frac': 0.0459715847169133, 'bb_std_mult': 3.380779283091572, 'rsi_os': 21, 'rsi_ob': 67, 'vol_spike': 0.14586974383094925, 'adx_thresh': 5.07609486791789, 'atr_min_pct': 0.012972198433593977, 'atr_max_pct': 0.13497973172309696, 'tp_mult': 2.8147879459159513, 'tsl_mult': 0.03558462110548527, 'strategy': 'breakout', 'time_stop': 113, 'use_sma': True, 'use_atr': True, 'use_adx': False, 'use_ema': False, 'use_spike': True, 'rsi_required': True, 'edge_k': 1.8777772966459694, 'edge_cap': 0.08755390372559271, 'bull_strategy': 'breakout', 'bull_bb_std_mult': 1.1402775531489138, 'bull_rsi_os': 42, 'bull_rsi_ob': 86, 'bull_adx_thresh': 12.809021199382713, 'bull_atr_min_pct': 0.018388096548953757, 'bull_atr_max_pct': 0.11784623255486519, 'bull_tp_mult': 1.5671356899165338, 'bull_tsl_mult': 0.6547660437475022, 'bull_time_stop': 241, 'bull_use_sma': True, 'bull_use_ema': False, 'bull_use_atr': False, 'bull_use_adx': False, 'bull_use_spike': False, 'bull_rsi_required': True, 'bear_strategy': 'breakout', 'bear_bb_std_mult': 3.430094143830681, 'bear_rsi_os': 48, 'bear_rsi_ob': 72, 'bear_adx_thresh': 10.419797329770159, 'bear_atr_min_pct': 0.020498689388007585, 'bear_atr_max_pct': 0.019367047863042823, 'bear_tp_mult': 2.6569954240119036, 'bear_tsl_mult': 0.8535196143156979, 'bear_time_stop': 269, 'bear_use_sma': False, 'bear_use_ema': True, 'bear_use_atr': False, 'bear_use_adx': False, 'bear_use_spike': True, 'bear_rsi_required': False, 'sideways_strategy': 'mean_reversion', 'sideways_bb_std_mult': 3.598575642834643, 'sideways_rsi_os': 28, 'sideways_rsi_ob': 63, 'sideways_adx_thresh': 33.730958429720154, 'sideways_atr_min_pct': 0.02741898436484726, 'sideways_atr_max_pct': 0.03213838966740125, 'sideways_tp_mult': 1.5305731769141127, 'sideways_tsl_mult': 0.6434281634647125, 'sideways_time_stop': 237, 'sideways_use_sma': True, 'sideways_use_ema': True, 'sideways_use_atr': False, 'sideways_use_adx': False, 'sideways_use_spike': False, 'sideways_rsi_required': True}.
[I 2025-08-31 10:14:57,342] Trial 434 finished with values: [-1000000000.0, 1000000000.0] and parameters: {'p_sma': 38, 'p_std': 14, 'p_atr': 29, 'p_adx': 19, 'rsi_period': 35, 'ema1': 23, 'ema2': 53, 'slip_atr_k': 0.11085146687047877, 'slip_spread_k': 0.42469741960114193, 'spread_hl_frac': 0.015494752877520926, 'bb_std_mult': 2.389952171937247, 'rsi_os': 22, 'rsi_ob': 76, 'vol_spike': 0.08182310899575784, 'adx_thresh': 6.364711973920335, 'atr_min_pct': 0.013024043232726336, 'atr_max_pct': 0.07182755603126566, 'tp_mult': 2.7869954253617064, 'tsl_mult': 0.1359832405066217, 'strategy': 'breakout', 'time_stop': 111, 'use_sma': True, 'use_atr': True, 'use_adx': False, 'use_ema': False, 'use_spike': True, 'rsi_required': True, 'edge_k': 1.9032859728837916, 'edge_cap': 0.17433837115773893, 'bull_strategy': 'breakout', 'bull_bb_std_mult': 1.3519668331256305, 'bull_rsi_os': 42, 'bull_rsi_ob': 93, 'bull_adx_thresh': 12.700420448283001, 'bull_atr_min_pct': 0.019766677779139406, 'bull_atr_max_pct': 0.12689120627408026, 'bull_tp_mult': 2.521238749469439, 'bull_tsl_mult': 0.6089632634439862, 'bull_time_stop': 43, 'bull_use_sma': True, 'bull_use_ema': False, 'bull_use_atr': False, 'bull_use_adx': False, 'bull_use_spike': False, 'bull_rsi_required': True, 'bear_strategy': 'breakout', 'bear_bb_std_mult': 3.4543396491559624, 'bear_rsi_os': 17, 'bear_rsi_ob': 75, 'bear_adx_thresh': 21.25827046385047, 'bear_atr_min_pct': 0.0204388673460341, 'bear_atr_max_pct': 0.14989106153116583, 'bear_tp_mult': 2.8627440962031647, 'bear_tsl_mult': 0.48790306054849164, 'bear_time_stop': 269, 'bear_use_sma': False, 'bear_use_ema': True, 'bear_use_atr': False, 'bear_use_adx': False, 'bear_use_spike': True, 'bear_rsi_required': False, 'sideways_strategy': 'mean_reversion', 'sideways_bb_std_mult': 0.9996054568319052, 'sideways_rsi_os': 28, 'sideways_rsi_ob': 63, 'sideways_adx_thresh': 19.225401088530308, 'sideways_atr_min_pct': 0.018335604500412547, 'sideways_atr_max_pct': 0.032414110385836914, 'sideways_tp_mult': 2.7329506887995874, 'sideways_tsl_mult': 0.05523584778070037, 'sideways_time_stop': 300, 'sideways_use_sma': True, 'sideways_use_ema': True, 'sideways_use_atr': False, 'sideways_use_adx': False, 'sideways_use_spike': False, 'sideways_rsi_required': True}.
[I 2025-08-31 10:14:57,416] Trial 437 finished with values: [-1000000000.0, 1000000000.0] and parameters: {'p_sma': 28, 'p_std': 13, 'p_atr': 18, 'p_adx': 20, 'rsi_period': 18, 'ema1': 23, 'ema2': 38, 'slip_atr_k': 0.15847157351403993, 'slip_spread_k': 0.04164474170120447, 'spread_hl_frac': 0.009364496728738639, 'bb_std_mult': 2.3521792699892528, 'rsi_os': 21, 'rsi_ob': 51, 'vol_spike': 0.15746703454352529, 'adx_thresh': 5.24151056588067, 'atr_min_pct': 0.012700437935693839, 'atr_max_pct': 0.13500697622299723, 'tp_mult': 2.7577132242792444, 'tsl_mult': 0.019422379587661014, 'strategy': 'breakout', 'time_stop': 113, 'use_sma': False, 'use_atr': True, 'use_adx': False, 'use_ema': False, 'use_spike': True, 'rsi_required': True, 'edge_k': 0.5670255340285015, 'edge_cap': 0.12475819228884735, 'bull_strategy': 'mean_reversion', 'bull_bb_std_mult': 0.6373181895538576, 'bull_rsi_os': 31, 'bull_rsi_ob': 58, 'bull_adx_thresh': 30.60061810911861, 'bull_atr_min_pct': 0.018313185668382654, 'bull_atr_max_pct': 0.12861186610497058, 'bull_tp_mult': 1.5680697824823033, 'bull_tsl_mult': 0.5568399460461017, 'bull_time_stop': 265, 'bull_use_sma': True, 'bull_use_ema': False, 'bull_use_atr': False, 'bull_use_adx': False, 'bull_use_spike': False, 'bull_rsi_required': True, 'bear_strategy': 'breakout', 'bear_bb_std_mult': 2.7461251533348774, 'bear_rsi_os': 27, 'bear_rsi_ob': 72, 'bear_adx_thresh': 21.120754959587227, 'bear_atr_min_pct': 0.02078103942269345, 'bear_atr_max_pct': 0.04228772591373519, 'bear_tp_mult': 1.5280027259697488, 'bear_tsl_mult': 0.8916492183459361, 'bear_time_stop': 155, 'bear_use_sma': False, 'bear_use_ema': True, 'bear_use_atr': False, 'bear_use_adx': True, 'bear_use_spike': False, 'bear_rsi_required': False, 'sideways_strategy': 'mean_reversion', 'sideways_bb_std_mult': 3.597805168172627, 'sideways_rsi_os': 6, 'sideways_rsi_ob': 86, 'sideways_adx_thresh': 33.12131854347709, 'sideways_atr_min_pct': 0.0254110445673418, 'sideways_atr_max_pct': 0.03228728630984767, 'sideways_tp_mult': 1.138976227899566, 'sideways_tsl_mult': 0.6409583423505961, 'sideways_time_stop': 229, 'sideways_use_sma': True, 'sideways_use_ema': True, 'sideways_use_atr': False, 'sideways_use_adx': False, 'sideways_use_spike': False, 'sideways_rsi_required': True}.
[I 2025-08-31 10:14:58,073] Trial 439 finished with values: [-1000000000.0, 1000000000.0] and parameters: {'p_sma': 38, 'p_std': 60, 'p_atr': 30, 'p_adx': 25, 'rsi_period': 40, 'ema1': 26, 'ema2': 40, 'slip_atr_k': 0.16463433573774308, 'slip_spread_k': 0.30593113837412317, 'spread_hl_frac': 0.04449590509825373, 'bb_std_mult': 3.1040781901613794, 'rsi_os': 53, 'rsi_ob': 45, 'vol_spike': 0.2117190895065334, 'adx_thresh': 21.96001521750591, 'atr_min_pct': 0.011994993193189054, 'atr_max_pct': 0.09716819111321123, 'tp_mult': 2.777691348662354, 'tsl_mult': 0.013098165100562132, 'strategy': 'mean_reversion', 'time_stop': 123, 'use_sma': False, 'use_atr': False, 'use_adx': True, 'use_ema': False, 'use_spike': False, 'rsi_required': True, 'edge_k': 0.9415669615030203, 'edge_cap': 0.13156158778552918, 'bull_strategy': 'mean_reversion', 'bull_bb_std_mult': 1.0787731199770827, 'bull_rsi_os': 31, 'bull_rsi_ob': 84, 'bull_adx_thresh': 19.425902458992148, 'bull_atr_min_pct': 0.029292367986721114, 'bull_atr_max_pct': 0.12815270305080265, 'bull_tp_mult': 1.4061623535216747, 'bull_tsl_mult': 0.5585679653098294, 'bull_time_stop': 229, 'bull_use_sma': True, 'bull_use_ema': False, 'bull_use_atr': True, 'bull_use_adx': False, 'bull_use_spike': False, 'bull_rsi_required': True, 'bear_strategy': 'breakout', 'bear_bb_std_mult': 1.293913074515979, 'bear_rsi_os': 52, 'bear_rsi_ob': 81, 'bear_adx_thresh': 21.180283330107788, 'bear_atr_min_pct': 0.01918847731530918, 'bear_atr_max_pct': 0.14200381792720995, 'bear_tp_mult': 1.4406079432305068, 'bear_tsl_mult': 0.4885438130100734, 'bear_time_stop': 263, 'bear_use_sma': False, 'bear_use_ema': True, 'bear_use_atr': False, 'bear_use_adx': True, 'bear_use_spike': False, 'bear_rsi_required': True, 'sideways_strategy': 'breakout', 'sideways_bb_std_mult': 0.9652436311357084, 'sideways_rsi_os': 26, 'sideways_rsi_ob': 91, 'sideways_adx_thresh': 32.73774743719334, 'sideways_atr_min_pct': 0.0011748947699150357, 'sideways_atr_max_pct': 0.032479073426839124, 'sideways_tp_mult': 1.7666775396411218, 'sideways_tsl_mult': 0.8616319409194371, 'sideways_time_stop': 230, 'sideways_use_sma': True, 'sideways_use_ema': True, 'sideways_use_atr': False, 'sideways_use_adx': False, 'sideways_use_spike': True, 'sideways_rsi_required': False}.
[I 2025-08-31 10:14:58,081] Trial 438 finished with values: [-1000000000.0, 1000000000.0] and parameters: {'p_sma': 48, 'p_std': 13, 'p_atr': 10, 'p_adx': 9, 'rsi_period': 22, 'ema1': 15, 'ema2': 52, 'slip_atr_k': 0.16837380051671536, 'slip_spread_k': 0.4224996151069716, 'spread_hl_frac': 0.045966626376718174, 'bb_std_mult': 0.8230387555601331, 'rsi_os': 23, 'rsi_ob': 45, 'vol_spike': 0.1237551150368191, 'adx_thresh': 23.087234522562067, 'atr_min_pct': 0.012539125456731082, 'atr_max_pct': 0.13475821767031876, 'tp_mult': 2.814059051182828, 'tsl_mult': 0.020526543290074684, 'strategy': 'mean_reversion', 'time_stop': 123, 'use_sma': False, 'use_atr': False, 'use_adx': True, 'use_ema': False, 'use_spike': False, 'rsi_required': True, 'edge_k': 1.8097629469349528, 'edge_cap': 0.11617173186333787, 'bull_strategy': 'mean_reversion', 'bull_bb_std_mult': 1.136907749505295, 'bull_rsi_os': 31, 'bull_rsi_ob': 68, 'bull_adx_thresh': 31.29608897954845, 'bull_atr_min_pct': 0.018299596732621135, 'bull_atr_max_pct': 0.13624068090255315, 'bull_tp_mult': 1.4108605091991795, 'bull_tsl_mult': 0.721025253165875, 'bull_time_stop': 230, 'bull_use_sma': True, 'bull_use_ema': False, 'bull_use_atr': True, 'bull_use_adx': False, 'bull_use_spike': False, 'bull_rsi_required': True, 'bear_strategy': 'breakout', 'bear_bb_std_mult': 2.77566993789288, 'bear_rsi_os': 51, 'bear_rsi_ob': 81, 'bear_adx_thresh': 21.24912246131494, 'bear_atr_min_pct': 0.012951078572056404, 'bear_atr_max_pct': 0.06926530096798555, 'bear_tp_mult': 2.272924373962678, 'bear_tsl_mult': 0.4869146752118946, 'bear_time_stop': 79, 'bear_use_sma': False, 'bear_use_ema': True, 'bear_use_atr': False, 'bear_use_adx': True, 'bear_use_spike': False, 'bear_rsi_required': True, 'sideways_strategy': 'breakout', 'sideways_bb_std_mult': 0.9384105040878415, 'sideways_rsi_os': 14, 'sideways_rsi_ob': 62, 'sideways_adx_thresh': 32.97645110553758, 'sideways_atr_min_pct': 0.0013453773472572954, 'sideways_atr_max_pct': 0.032565590617766614, 'sideways_tp_mult': 1.5293674856709218, 'sideways_tsl_mult': 0.6390868974664228, 'sideways_time_stop': 231, 'sideways_use_sma': True, 'sideways_use_ema': True, 'sideways_use_atr': False, 'sideways_use_adx': False, 'sideways_use_spike': True, 'sideways_rsi_required': False}.
[I 2025-08-31 10:14:58,101] Trial 441 finished with values: [-1000000000.0, 1000000000.0] and parameters: {'p_sma': 58, 'p_std': 15, 'p_atr': 10, 'p_adx': 9, 'rsi_period': 14, 'ema1': 20, 'ema2': 40, 'slip_atr_k': 0.16573635175101345, 'slip_spread_k': 0.34959495772402754, 'spread_hl_frac': 0.03143223625456689, 'bb_std_mult': 0.9555802677149171, 'rsi_os': 34, 'rsi_ob': 48, 'vol_spike': 0.13130352720002164, 'adx_thresh': 11.681899943594253, 'atr_min_pct': 0.011750659658941079, 'atr_max_pct': 0.028247911110464957, 'tp_mult': 2.150490895311171, 'tsl_mult': 7.255158239948242e-05, 'strategy': 'mean_reversion', 'time_stop': 94, 'use_sma': False, 'use_atr': False, 'use_adx': True, 'use_ema': True, 'use_spike': False, 'rsi_required': False, 'edge_k': 1.8127690413177664, 'edge_cap': 0.35840650835185683, 'bull_strategy': 'mean_reversion', 'bull_bb_std_mult': 1.9292315364436272, 'bull_rsi_os': 31, 'bull_rsi_ob': 67, 'bull_adx_thresh': 31.344918357917493, 'bull_atr_min_pct': 0.01917785903436245, 'bull_atr_max_pct': 0.01587548462849439, 'bull_tp_mult': 1.411746544328807, 'bull_tsl_mult': 0.5892053262015031, 'bull_time_stop': 229, 'bull_use_sma': True, 'bull_use_ema': True, 'bull_use_atr': True, 'bull_use_adx': False, 'bull_use_spike': False, 'bull_rsi_required': False, 'bear_strategy': 'breakout', 'bear_bb_std_mult': 2.88368276960746, 'bear_rsi_os': 52, 'bear_rsi_ob': 80, 'bear_adx_thresh': 23.240102248870834, 'bear_atr_min_pct': 0.02172135624672592, 'bear_atr_max_pct': 0.142964348243564, 'bear_tp_mult': 2.2668307680346107, 'bear_tsl_mult': 0.09712497895149164, 'bear_time_stop': 229, 'bear_use_sma': True, 'bear_use_ema': False, 'bear_use_atr': True, 'bear_use_adx': True, 'bear_use_spike': False, 'bear_rsi_required': True, 'sideways_strategy': 'breakout', 'sideways_bb_std_mult': 1.9647833330489373, 'sideways_rsi_os': 26, 'sideways_rsi_ob': 57, 'sideways_adx_thresh': 8.186786871585545, 'sideways_atr_min_pct': 0.012669695524869289, 'sideways_atr_max_pct': 0.13770494115015947, 'sideways_tp_mult': 2.641212117870442, 'sideways_tsl_mult': 0.0755425135155423, 'sideways_time_stop': 249, 'sideways_use_sma': False, 'sideways_use_ema': False, 'sideways_use_atr': False, 'sideways_use_adx': False, 'sideways_use_spike': True, 'sideways_rsi_required': False}.
