[I 2025-08-31 10:36:10,318] Trial 593 finished with values: [-1000000000.0, 1000000000.0] and parameters: {'p_sma': 12, 'p_std': 30, 'p_atr': 29, 'p_adx': 10, 'rsi_period': 24, 'ema1': 18, 'ema2': 38, 'slip_atr_k': 0.17884626432638684, 'slip_spread_k': 0.08088249035287635, 'spread_hl_frac': 0.011310110972303514, 'bb_std_mult': 1.1830516407236178, 'rsi_os': 15, 'rsi_ob': 81, 'vol_spike': 0.27212048973946157, 'adx_thresh': 15.494284901711964, 'atr_min_pct': 0.023419769736981098, 'atr_max_pct': 0.08413485185880001, 'tp_mult': 2.0172377675931745, 'tsl_mult': 0.1729576755367886, 'strategy': 'breakout', 'time_stop': 50, 'use_sma': False, 'use_atr': False, 'use_adx': False, 'use_ema': True, 'use_spike': False, 'rsi_required': True, 'edge_k': 1.856740207677842, 'edge_cap': 0.09626821580440348, 'bull_strategy': 'mean_reversion', 'bull_bb_std_mult': 3.1973596950028824, 'bull_rsi_os': 20, 'bull_rsi_ob': 57, 'bull_adx_thresh': 29.409912644535282, 'bull_atr_min_pct': 0.003967191627652782, 'bull_atr_max_pct': 0.03580900177396584, 'bull_tp_mult': 2.2977594754201287, 'bull_tsl_mult': 0.44136896206465165, 'bull_time_stop': 205, 'bull_use_sma': True, 'bull_use_ema': False, 'bull_use_atr': False, 'bull_use_adx': True, 'bull_use_spike': True, 'bull_rsi_required': True, 'bear_strategy': 'breakout', 'bear_bb_std_mult': 1.0462177000150876, 'bear_rsi_os': 29, 'bear_rsi_ob': 77, 'bear_adx_thresh': 12.917399399162594, 'bear_atr_min_pct': 0.008111116338136692, 'bear_atr_max_pct': 0.02666398247711666, 'bear_tp_mult': 2.040075940370168, 'bear_tsl_mult': 0.48318183924709973, 'bear_time_stop': 74, 'bear_use_sma': False, 'bear_use_ema': True, 'bear_use_atr': True, 'bear_use_adx': True, 'bear_use_spike': True, 'bear_rsi_required': True, 'sideways_strategy': 'breakout', 'sideways_bb_std_mult': 2.342283747068382, 'sideways_rsi_os': 23, 'sideways_rsi_ob': 87, 'sideways_adx_thresh': 9.287863120718804, 'sideways_atr_min_pct': 0.024193270398929788, 'sideways_atr_max_pct': 0.0929254442682613, 'sideways_tp_mult': 2.6678533066799694, 'sideways_tsl_mult': 0.5884891982119309, 'sideways_time_stop': 226, 'sideways_use_sma': False, 'sideways_use_ema': True, 'sideways_use_atr': True, 'sideways_use_adx': True, 'sideways_use_spike': True, 'sideways_rsi_required': False}.
[I 2025-08-31 10:36:10,737] Trial 595 finished with values: [-0.010586944817104649, 0.011095309323857149] and parameters: {'p_sma': 41, 'p_std': 48, 'p_atr': 29, 'p_adx': 11, 'rsi_period': 13, 'ema1': 18, 'ema2': 22, 'slip_atr_k': 0.03067580639135571, 'slip_spread_k': 0.5618167216223017, 'spread_hl_frac': 0.01107835317327302, 'bb_std_mult': 1.1907946373494362, 'rsi_os': 34, 'rsi_ob': 84, 'vol_spike': 0.008623363758321345, 'adx_thresh': 30.361058936286895, 'atr_min_pct': 0.01213283177427033, 'atr_max_pct': 0.12444727257131391, 'tp_mult': 2.0923981080455594, 'tsl_mult': 0.5556944841705147, 'strategy': 'breakout', 'time_stop': 86, 'use_sma': False, 'use_atr': False, 'use_adx': True, 'use_ema': True, 'use_spike': False, 'rsi_required': True, 'edge_k': 1.837393550080132, 'edge_cap': 0.3390528237875218, 'bull_strategy': 'mean_reversion', 'bull_bb_std_mult': 3.196573932615274, 'bull_rsi_os': 25, 'bull_rsi_ob': 95, 'bull_adx_thresh': 29.16618310504313, 'bull_atr_min_pct': 0.0037630036666361434, 'bull_atr_max_pct': 0.01929205957381786, 'bull_tp_mult': 2.300177544466982, 'bull_tsl_mult': 0.9989660476273885, 'bull_time_stop': 57, 'bull_use_sma': True, 'bull_use_ema': False, 'bull_use_atr': False, 'bull_use_adx': True, 'bull_use_spike': True, 'bull_rsi_required': True, 'bear_strategy': 'breakout', 'bear_bb_std_mult': 3.195644722188197, 'bear_rsi_os': 14, 'bear_rsi_ob': 46, 'bear_adx_thresh': 14.952460199230487, 'bear_atr_min_pct': 0.007962175010378183, 'bear_atr_max_pct': 0.10304127302313035, 'bear_tp_mult': 2.05023040530178, 'bear_tsl_mult': 0.4890704688497899, 'bear_time_stop': 134, 'bear_use_sma': False, 'bear_use_ema': True, 'bear_use_atr': True, 'bear_use_adx': True, 'bear_use_spike': True, 'bear_rsi_required': True, 'sideways_strategy': 'breakout', 'sideways_bb_std_mult': 1.0418475607931517, 'sideways_rsi_os': 12, 'sideways_rsi_ob': 52, 'sideways_adx_thresh': 21.877802656950433, 'sideways_atr_min_pct': 0.0011936172636872796, 'sideways_atr_max_pct': 0.11258621282802588, 'sideways_tp_mult': 2.8846751702274687, 'sideways_tsl_mult': 0.01526362617822808, 'sideways_time_stop': 227, 'sideways_use_sma': False, 'sideways_use_ema': True, 'sideways_use_atr': True, 'sideways_use_adx': True, 'sideways_use_spike': True, 'sideways_rsi_required': False}.
[I 2025-08-31 10:36:10,812] Trial 596 finished with values: [-0.04647711227404083, 0.046423063501216645] and parameters: {'p_sma': 12, 'p_std': 48, 'p_atr': 30, 'p_adx': 10, 'rsi_period': 24, 'ema1': 17, 'ema2': 38, 'slip_atr_k': 0.0719773429473112, 'slip_spread_k': 0.018316837255161547, 'spread_hl_frac': 0.011243587197792265, 'bb_std_mult': 2.660391493700902, 'rsi_os': 14, 'rsi_ob': 94, 'vol_spike': 0.27411901484949314, 'adx_thresh': 24.95471962728522, 'atr_min_pct': 0.01959443713137319, 'atr_max_pct': 0.12375862591337745, 'tp_mult': 2.9520539868217663, 'tsl_mult': 0.17157279281751164, 'strategy': 'breakout', 'time_stop': 157, 'use_sma': False, 'use_atr': True, 'use_adx': True, 'use_ema': True, 'use_spike': True, 'rsi_required': False, 'edge_k': 1.8599796457279978, 'edge_cap': 0.8300877399628834, 'bull_strategy': 'mean_reversion', 'bull_bb_std_mult': 1.1907747696875488, 'bull_rsi_os': 6, 'bull_rsi_ob': 64, 'bull_adx_thresh': 5.644144041242514, 'bull_atr_min_pct': 0.007502307830935463, 'bull_atr_max_pct': 0.03691875162266138, 'bull_tp_mult': 2.2676218374276536, 'bull_tsl_mult': 0.1890999802108197, 'bull_time_stop': 47, 'bull_use_sma': True, 'bull_use_ema': True, 'bull_use_atr': False, 'bull_use_adx': True, 'bull_use_spike': True, 'bull_rsi_required': True, 'bear_strategy': 'breakout', 'bear_bb_std_mult': 3.5994808267171905, 'bear_rsi_os': 14, 'bear_rsi_ob': 80, 'bear_adx_thresh': 15.62171192382349, 'bear_atr_min_pct': 0.008113853415018947, 'bear_atr_max_pct': 0.10316752663234711, 'bear_tp_mult': 1.404672155270736, 'bear_tsl_mult': 0.4852316093421386, 'bear_time_stop': 135, 'bear_use_sma': False, 'bear_use_ema': True, 'bear_use_atr': True, 'bear_use_adx': True, 'bear_use_spike': True, 'bear_rsi_required': False, 'sideways_strategy': 'breakout', 'sideways_bb_std_mult': 2.3478341365787623, 'sideways_rsi_os': 41, 'sideways_rsi_ob': 52, 'sideways_adx_thresh': 21.903662029580005, 'sideways_atr_min_pct': 0.0012408984122314626, 'sideways_atr_max_pct': 0.11184050986528501, 'sideways_tp_mult': 2.596865000762125, 'sideways_tsl_mult': 0.08117618134143056, 'sideways_time_stop': 225, 'sideways_use_sma': False, 'sideways_use_ema': True, 'sideways_use_atr': True, 'sideways_use_adx': True, 'sideways_use_spike': True, 'sideways_rsi_required': False}.
[I 2025-08-31 10:36:11,536] Trial 597 finished with values: [-1000000000.0, 1000000000.0] and parameters: {'p_sma': 29, 'p_std': 55, 'p_atr': 29, 'p_adx': 10, 'rsi_period': 24, 'ema1': 17, 'ema2': 39, 'slip_atr_k': 0.03531299904504853, 'slip_spread_k': 0.08620544012306397, 'spread_hl_frac': 0.038182361654402856, 'bb_std_mult': 1.2472160759459676, 'rsi_os': 14, 'rsi_ob': 85, 'vol_spike': 0.2722187308350418, 'adx_thresh': 24.797049626030496, 'atr_min_pct': 0.010618011611145624, 'atr_max_pct': 0.010006977213687082, 'tp_mult': 2.9478045764249274, 'tsl_mult': 0.15479250455300986, 'strategy': 'breakout', 'time_stop': 157, 'use_sma': False, 'use_atr': True, 'use_adx': True, 'use_ema': True, 'use_spike': True, 'rsi_required': False, 'edge_k': 1.2644959107152502, 'edge_cap': 0.32527712220978366, 'bull_strategy': 'mean_reversion', 'bull_bb_std_mult': 3.1807697507751724, 'bull_rsi_os': 23, 'bull_rsi_ob': 64, 'bull_adx_thresh': 31.70364578043799, 'bull_atr_min_pct': 0.015380003701326892, 'bull_atr_max_pct': 0.01913262877634378, 'bull_tp_mult': 2.243480246360636, 'bull_tsl_mult': 0.9983733859259714, 'bull_time_stop': 66, 'bull_use_sma': True, 'bull_use_ema': True, 'bull_use_atr': False, 'bull_use_adx': False, 'bull_use_spike': False, 'bull_rsi_required': True, 'bear_strategy': 'breakout', 'bear_bb_std_mult': 2.942456781572147, 'bear_rsi_os': 23, 'bear_rsi_ob': 82, 'bear_adx_thresh': 20.728611514598846, 'bear_atr_min_pct': 0.00796863960662152, 'bear_atr_max_pct': 0.10214254205535736, 'bear_tp_mult': 1.9651726963118028, 'bear_tsl_mult': 0.17551427509169704, 'bear_time_stop': 73, 'bear_use_sma': False, 'bear_use_ema': True, 'bear_use_atr': False, 'bear_use_adx': True, 'bear_use_spike': True, 'bear_rsi_required': False, 'sideways_strategy': 'breakout', 'sideways_bb_std_mult': 1.009739770957759, 'sideways_rsi_os': 39, 'sideways_rsi_ob': 94, 'sideways_adx_thresh': 26.948623754503714, 'sideways_atr_min_pct': 0.0020889082196386844, 'sideways_atr_max_pct': 0.11267137921376344, 'sideways_tp_mult': 2.910345197674256, 'sideways_tsl_mult': 0.08139142363143453, 'sideways_time_stop': 125, 'sideways_use_sma': True, 'sideways_use_ema': False, 'sideways_use_atr': False, 'sideways_use_adx': False, 'sideways_use_spike': True, 'sideways_rsi_required': False}.
[I 2025-08-31 10:36:42,320] Trial 598 finished with values: [-1000000000.0, 1000000000.0] and parameters: {'p_sma': 14, 'p_std': 5, 'p_atr': 30, 'p_adx': 11, 'rsi_period': 53, 'ema1': 12, 'ema2': 16, 'slip_atr_k': 0.02924571593154668, 'slip_spread_k': 0.020711673427703636, 'spread_hl_frac': 0.010172172599278585, 'bb_std_mult': 1.9740793016682394, 'rsi_os': 34, 'rsi_ob': 85, 'vol_spike': 0.0625294274321256, 'adx_thresh': 24.875101529899005, 'atr_min_pct': 0.006216245606138045, 'atr_max_pct': 0.02930724839504903, 'tp_mult': 2.956939168021761, 'tsl_mult': 0.05497755456273914, 'strategy': 'breakout', 'time_stop': 261, 'use_sma': False, 'use_atr': True, 'use_adx': True, 'use_ema': True, 'use_spike': True, 'rsi_required': False, 'edge_k': 1.8971004667075766, 'edge_cap': 0.8928233892068898, 'bull_strategy': 'mean_reversion', 'bull_bb_std_mult': 1.1474047325475314, 'bull_rsi_os': 18, 'bull_rsi_ob': 95, 'bull_adx_thresh': 8.415723497031568, 'bull_atr_min_pct': 0.00915066102163663, 'bull_atr_max_pct': 0.060716623785133504, 'bull_tp_mult': 2.653977664086924, 'bull_tsl_mult': 0.9593176482201852, 'bull_time_stop': 57, 'bull_use_sma': True, 'bull_use_ema': True, 'bull_use_atr': False, 'bull_use_adx': False, 'bull_use_spike': False, 'bull_rsi_required': True, 'bear_strategy': 'breakout', 'bear_bb_std_mult': 2.933340591762028, 'bear_rsi_os': 23, 'bear_rsi_ob': 80, 'bear_adx_thresh': 20.74075879500914, 'bear_atr_min_pct': 0.017219997797004727, 'bear_atr_max_pct': 0.10327182759883503, 'bear_tp_mult': 2.1830306041107077, 'bear_tsl_mult': 0.40819310126816255, 'bear_time_stop': 205, 'bear_use_sma': False, 'bear_use_ema': True, 'bear_use_atr': False, 'bear_use_adx': True, 'bear_use_spike': True, 'bear_rsi_required': False, 'sideways_strategy': 'breakout', 'sideways_bb_std_mult': 1.0218871285627957, 'sideways_rsi_os': 25, 'sideways_rsi_ob': 94, 'sideways_adx_thresh': 26.680271949019126, 'sideways_atr_min_pct': 0.0022800380912980298, 'sideways_atr_max_pct': 0.08804322975457297, 'sideways_tp_mult': 2.8841944351042152, 'sideways_tsl_mult': 0.8583128602891008, 'sideways_time_stop': 238, 'sideways_use_sma': True, 'sideways_use_ema': False, 'sideways_use_atr': False, 'sideways_use_adx': False, 'sideways_use_spike': True, 'sideways_rsi_required': False}.
[I 2025-08-31 10:36:42,637] Trial 600 finished with values: [-0.020215336545851503, 0.020164914178333562] and parameters: {'p_sma': 16, 'p_std': 37, 'p_atr': 29, 'p_adx': 9, 'rsi_period': 23, 'ema1': 28, 'ema2': 19, 'slip_atr_k': 0.21428587292789664, 'slip_spread_k': 0.19572480102963286, 'spread_hl_frac': 0.02447024736371035, 'bb_std_mult': 3.05320595370664, 'rsi_os': 40, 'rsi_ob': 62, 'vol_spike': 0.23538051221735273, 'adx_thresh': 25.9524250473721, 'atr_min_pct': 0.012011792116253278, 'atr_max_pct': 0.12171523572485846, 'tp_mult': 2.9096518113997485, 'tsl_mult': 0.5528166143168805, 'strategy': 'breakout', 'time_stop': 189, 'use_sma': False, 'use_atr': True, 'use_adx': False, 'use_ema': True, 'use_spike': False, 'rsi_required': False, 'edge_k': 1.9155038703016865, 'edge_cap': 0.3186397043504286, 'bull_strategy': 'mean_reversion', 'bull_bb_std_mult': 3.441321706775807, 'bull_rsi_os': 15, 'bull_rsi_ob': 95, 'bull_adx_thresh': 31.486060649197814, 'bull_atr_min_pct': 0.00915101228243389, 'bull_atr_max_pct': 0.066626402591182, 'bull_tp_mult': 2.219519049415373, 'bull_tsl_mult': 0.2971016866281868, 'bull_time_stop': 58, 'bull_use_sma': True, 'bull_use_ema': True, 'bull_use_atr': False, 'bull_use_adx': False, 'bull_use_spike': False, 'bull_rsi_required': True, 'bear_strategy': 'breakout', 'bear_bb_std_mult': 3.213496998245328, 'bear_rsi_os': 27, 'bear_rsi_ob': 87, 'bear_adx_thresh': 16.291054457206307, 'bear_atr_min_pct': 0.024966312323994787, 'bear_atr_max_pct': 0.11167063687018819, 'bear_tp_mult': 1.973511447251907, 'bear_tsl_mult': 0.1757170629302922, 'bear_time_stop': 281, 'bear_use_sma': False, 'bear_use_ema': True, 'bear_use_atr': False, 'bear_use_adx': False, 'bear_use_spike': True, 'bear_rsi_required': False, 'sideways_strategy': 'breakout', 'sideways_bb_std_mult': 2.951146766545464, 'sideways_rsi_os': 45, 'sideways_rsi_ob': 94, 'sideways_adx_thresh': 30.07535770917856, 'sideways_atr_min_pct': 0.002358187473066934, 'sideways_atr_max_pct': 0.08575970844644593, 'sideways_tp_mult': 2.891781445878184, 'sideways_tsl_mult': 0.8568915655297171, 'sideways_time_stop': 248, 'sideways_use_sma': True, 'sideways_use_ema': False, 'sideways_use_atr': False, 'sideways_use_adx': False, 'sideways_use_spike': True, 'sideways_rsi_required': False}.
[I 2025-08-31 10:36:42,742] Trial 599 finished with values: [-1000000000.0, 1000000000.0] and parameters: {'p_sma': 8, 'p_std': 48, 'p_atr': 29, 'p_adx': 9, 'rsi_period': 23, 'ema1': 18, 'ema2': 39, 'slip_atr_k': 0.1885483291973123, 'slip_spread_k': 0.11664834623421094, 'spread_hl_frac': 0.019680253265200946, 'bb_std_mult': 2.629779433305001, 'rsi_os': 38, 'rsi_ob': 89, 'vol_spike': 0.27604133249744117, 'adx_thresh': 25.968043378234196, 'atr_min_pct': 0.010573715363876399, 'atr_max_pct': 0.12359178506164724, 'tp_mult': 2.967493946141063, 'tsl_mult': 0.04950321355609016, 'strategy': 'breakout', 'time_stop': 87, 'use_sma': False, 'use_atr': True, 'use_adx': True, 'use_ema': True, 'use_spike': True, 'rsi_required': False, 'edge_k': 1.9036912592964566, 'edge_cap': 0.3150024297181344, 'bull_strategy': 'mean_reversion', 'bull_bb_std_mult': 1.1517921644299034, 'bull_rsi_os': 27, 'bull_rsi_ob': 95, 'bull_adx_thresh': 12.371596233566693, 'bull_atr_min_pct': 0.009243275269134037, 'bull_atr_max_pct': 0.019250859954792636, 'bull_tp_mult': 2.2646235973484528, 'bull_tsl_mult': 0.9998603774209313, 'bull_time_stop': 56, 'bull_use_sma': True, 'bull_use_ema': True, 'bull_use_atr': False, 'bull_use_adx': False, 'bull_use_spike': False, 'bull_rsi_required': True, 'bear_strategy': 'breakout', 'bear_bb_std_mult': 1.3263132713343402, 'bear_rsi_os': 8, 'bear_rsi_ob': 80, 'bear_adx_thresh': 20.80049343737307, 'bear_atr_min_pct': 0.0074666447666161635, 'bear_atr_max_pct': 0.10269097028198994, 'bear_tp_mult': 2.9936955786053194, 'bear_tsl_mult': 0.41330177724753475, 'bear_time_stop': 266, 'bear_use_sma': False, 'bear_use_ema': True, 'bear_use_atr': False, 'bear_use_adx': True, 'bear_use_spike': True, 'bear_rsi_required': False, 'sideways_strategy': 'breakout', 'sideways_bb_std_mult': 1.0235740409980927, 'sideways_rsi_os': 16, 'sideways_rsi_ob': 52, 'sideways_adx_thresh': 26.84508014085295, 'sideways_atr_min_pct': 0.0008709103219525942, 'sideways_atr_max_pct': 0.11293713639018536, 'sideways_tp_mult': 2.862741557025762, 'sideways_tsl_mult': 0.04812738447634944, 'sideways_time_stop': 292, 'sideways_use_sma': True, 'sideways_use_ema': True, 'sideways_use_atr': False, 'sideways_use_adx': False, 'sideways_use_spike': True, 'sideways_rsi_required': False}.
[I 2025-08-31 10:36:44,195] Trial 601 finished with values: [-0.024338921791639434, 0.02436623904765916] and parameters: {'p_sma': 8, 'p_std': 5, 'p_atr': 29, 'p_adx': 9, 'rsi_period': 21, 'ema1': 26, 'ema2': 46, 'slip_atr_k': 0.18950640936461513, 'slip_spread_k': 0.8878424754568048, 'spread_hl_frac': 0.00992166530062756, 'bb_std_mult': 1.1814576235556427, 'rsi_os': 47, 'rsi_ob': 80, 'vol_spike': 0.2157171472945655, 'adx_thresh': 26.029356366596893, 'atr_min_pct': 0.012382656351848882, 'atr_max_pct': 0.12165538097893655, 'tp_mult': 2.420448718211987, 'tsl_mult': 0.2679017829876197, 'strategy': 'breakout', 'time_stop': 127, 'use_sma': False, 'use_atr': False, 'use_adx': False, 'use_ema': True, 'use_spike': False, 'rsi_required': True, 'edge_k': 1.8959746117133351, 'edge_cap': 0.792646573400527, 'bull_strategy': 'mean_reversion', 'bull_bb_std_mult': 1.2505483915618552, 'bull_rsi_os': 48, 'bull_rsi_ob': 73, 'bull_adx_thresh': 23.4848475004034, 'bull_atr_min_pct': 0.008098856384881167, 'bull_atr_max_pct': 0.061318308611455104, 'bull_tp_mult': 1.098531614930269, 'bull_tsl_mult': 0.3988249529003096, 'bull_time_stop': 58, 'bull_use_sma': True, 'bull_use_ema': False, 'bull_use_atr': False, 'bull_use_adx': False, 'bull_use_spike': False, 'bull_rsi_required': True, 'bear_strategy': 'breakout', 'bear_bb_std_mult': 2.9070189745412365, 'bear_rsi_os': 25, 'bear_rsi_ob': 79, 'bear_adx_thresh': 30.656181708539357, 'bear_atr_min_pct': 0.0004707348397334707, 'bear_atr_max_pct': 0.06094904063134907, 'bear_tp_mult': 2.0482290585654046, 'bear_tsl_mult': 0.43869891008674977, 'bear_time_stop': 264, 'bear_use_sma': False, 'bear_use_ema': True, 'bear_use_atr': False, 'bear_use_adx': False, 'bear_use_spike': True, 'bear_rsi_required': True, 'sideways_strategy': 'breakout', 'sideways_bb_std_mult': 0.817311736621117, 'sideways_rsi_os': 14, 'sideways_rsi_ob': 55, 'sideways_adx_thresh': 30.030622303531487, 'sideways_atr_min_pct': 0.00036273462072641046, 'sideways_atr_max_pct': 0.08849610551072294, 'sideways_tp_mult': 2.033482650679947, 'sideways_tsl_mult': 0.7405665313820184, 'sideways_time_stop': 239, 'sideways_use_sma': True, 'sideways_use_ema': True, 'sideways_use_atr': False, 'sideways_use_adx': False, 'sideways_use_spike': True, 'sideways_rsi_required': False}.
[I 2025-08-31 10:37:17,655] Trial 604 finished with values: [-1000000000.0, 1000000000.0] and parameters: {'p_sma': 41, 'p_std': 51, 'p_atr': 29, 'p_adx': 19, 'rsi_period': 70, 'ema1': 15, 'ema2': 36, 'slip_atr_k': 0.04057493752908478, 'slip_spread_k': 0.772616006463485, 'spread_hl_frac': 0.02346162770606584, 'bb_std_mult': 3.4380388901105805, 'rsi_os': 47, 'rsi_ob': 80, 'vol_spike': 0.2877508718646349, 'adx_thresh': 27.033596437653085, 'atr_min_pct': 0.01198912702231411, 'atr_max_pct': 0.12154048342674917, 'tp_mult': 2.913157934950946, 'tsl_mult': 0.5479414213887266, 'strategy': 'breakout', 'time_stop': 109, 'use_sma': False, 'use_atr': False, 'use_adx': False, 'use_ema': True, 'use_spike': False, 'rsi_required': True, 'edge_k': 1.823441067484251, 'edge_cap': 0.4892739495145895, 'bull_strategy': 'mean_reversion', 'bull_bb_std_mult': 0.7882150826328389, 'bull_rsi_os': 17, 'bull_rsi_ob': 81, 'bull_adx_thresh': 30.823538444763614, 'bull_atr_min_pct': 0.006720915947275273, 'bull_atr_max_pct': 0.06724939147311061, 'bull_tp_mult': 1.0898434722166748, 'bull_tsl_mult': 0.2846159790573275, 'bull_time_stop': 80, 'bull_use_sma': False, 'bull_use_ema': False, 'bull_use_atr': True, 'bull_use_adx': False, 'bull_use_spike': False, 'bull_rsi_required': False, 'bear_strategy': 'breakout', 'bear_bb_std_mult': 3.0611758941745166, 'bear_rsi_os': 25, 'bear_rsi_ob': 78, 'bear_adx_thresh': 32.430278537642046, 'bear_atr_min_pct': 0.0006648375319145104, 'bear_atr_max_pct': 0.11131625053443261, 'bear_tp_mult': 1.3072836938156285, 'bear_tsl_mult': 0.3160100693071626, 'bear_time_stop': 221, 'bear_use_sma': True, 'bear_use_ema': False, 'bear_use_atr': False, 'bear_use_adx': False, 'bear_use_spike': True, 'bear_rsi_required': True, 'sideways_strategy': 'breakout', 'sideways_bb_std_mult': 2.8975235289609316, 'sideways_rsi_os': 21, 'sideways_rsi_ob': 92, 'sideways_adx_thresh': 30.168951516940286, 'sideways_atr_min_pct': 0.0005105338334811753, 'sideways_atr_max_pct': 0.14389005623005036, 'sideways_tp_mult': 2.502563208586876, 'sideways_tsl_mult': 0.020354060337061754, 'sideways_time_stop': 249, 'sideways_use_sma': True, 'sideways_use_ema': True, 'sideways_use_atr': False, 'sideways_use_adx': False, 'sideways_use_spike': True, 'sideways_rsi_required': False}.
