[I 2025-08-31 10:00:42,762] Trial 306 finished with values: [-1000000000.0, 1000000000.0] and parameters: {'p_sma': 42, 'p_std': 35, 'p_atr': 29, 'p_adx': 12, 'rsi_period': 53, 'ema1': 20, 'ema2': 37, 'slip_atr_k': 0.13239240203933028, 'slip_spread_k': 0.9233091711849013, 'spread_hl_frac': 0.012084161356983758, 'bb_std_mult': 1.2007093341629136, 'rsi_os': 20, 'rsi_ob': 49, 'vol_spike': 0.13764567435464728, 'adx_thresh': 7.013228586358148, 'atr_min_pct': 0.0076484107638636915, 'atr_max_pct': 0.13450991064979498, 'tp_mult': 2.452698384870458, 'tsl_mult': 0.0019445843651135948, 'strategy': 'breakout', 'time_stop': 146, 'use_sma': False, 'use_atr': False, 'use_adx': False, 'use_ema': False, 'use_spike': False, 'rsi_required': True, 'edge_k': 1.164637050240094, 'edge_cap': 0.31064487515362527, 'bull_strategy': 'mean_reversion', 'bull_bb_std_mult': 1.3844201910997316, 'bull_rsi_os': 33, 'bull_rsi_ob': 85, 'bull_adx_thresh': 12.85981419258832, 'bull_atr_min_pct': 0.019486774686745933, 'bull_atr_max_pct': 0.08557604911915076, 'bull_tp_mult': 2.0958332846823087, 'bull_tsl_mult': 0.5617134167907334, 'bull_time_stop': 237, 'bull_use_sma': False, 'bull_use_ema': False, 'bull_use_atr': False, 'bull_use_adx': False, 'bull_use_spike': False, 'bull_rsi_required': True, 'bear_strategy': 'mean_reversion', 'bear_bb_std_mult': 1.541631100588058, 'bear_rsi_os': 55, 'bear_rsi_ob': 78, 'bear_adx_thresh': 32.416395687213864, 'bear_atr_min_pct': 0.022463487603795615, 'bear_atr_max_pct': 0.14170451141808285, 'bear_tp_mult': 2.6332113954896887, 'bear_tsl_mult': 0.5358819295724918, 'bear_time_stop': 256, 'bear_use_sma': False, 'bear_use_ema': True, 'bear_use_atr': False, 'bear_use_adx': True, 'bear_use_spike': False, 'bear_rsi_required': True, 'sideways_strategy': 'breakout', 'sideways_bb_std_mult': 1.0605480622097951, 'sideways_rsi_os': 25, 'sideways_rsi_ob': 63, 'sideways_adx_thresh': 10.233723947010816, 'sideways_atr_min_pct': 0.02594731736178518, 'sideways_atr_max_pct': 0.06027598967815517, 'sideways_tp_mult': 1.5051788071961234, 'sideways_tsl_mult': 0.10058561835193276, 'sideways_time_stop': 215, 'sideways_use_sma': True, 'sideways_use_ema': True, 'sideways_use_atr': False, 'sideways_use_adx': False, 'sideways_use_spike': False, 'sideways_rsi_required': False}.
[I 2025-08-31 10:00:42,951] Trial 307 finished with values: [-1000000000.0, 1000000000.0] and parameters: {'p_sma': 51, 'p_std': 57, 'p_atr': 12, 'p_adx': 8, 'rsi_period': 13, 'ema1': 20, 'ema2': 37, 'slip_atr_k': 0.06606556531314356, 'slip_spread_k': 0.36929613397563604, 'spread_hl_frac': 0.030724713064163973, 'bb_std_mult': 1.1832818352198484, 'rsi_os': 44, 'rsi_ob': 46, 'vol_spike': 0.0002402413224289468, 'adx_thresh': 14.195148774061675, 'atr_min_pct': 0.0016479687963557154, 'atr_max_pct': 0.10415337887902668, 'tp_mult': 1.2907120933967524, 'tsl_mult': 0.04681628920668377, 'strategy': 'breakout', 'time_stop': 143, 'use_sma': False, 'use_atr': False, 'use_adx': False, 'use_ema': False, 'use_spike': False, 'rsi_required': True, 'edge_k': 1.8328266497864503, 'edge_cap': 0.5076339437123202, 'bull_strategy': 'mean_reversion', 'bull_bb_std_mult': 1.3812428740637415, 'bull_rsi_os': 7, 'bull_rsi_ob': 92, 'bull_adx_thresh': 6.695793143870791, 'bull_atr_min_pct': 0.019611549225350525, 'bull_atr_max_pct': 0.037272699663477196, 'bull_tp_mult': 2.3697289907774186, 'bull_tsl_mult': 0.5601705704401673, 'bull_time_stop': 237, 'bull_use_sma': False, 'bull_use_ema': False, 'bull_use_atr': False, 'bull_use_adx': False, 'bull_use_spike': False, 'bull_rsi_required': True, 'bear_strategy': 'mean_reversion', 'bear_bb_std_mult': 2.593271606390618, 'bear_rsi_os': 36, 'bear_rsi_ob': 78, 'bear_adx_thresh': 24.634529889566643, 'bear_atr_min_pct': 0.02216920958153059, 'bear_atr_max_pct': 0.14209067227450622, 'bear_tp_mult': 2.7592268897326964, 'bear_tsl_mult': 0.08626379430818149, 'bear_time_stop': 258, 'bear_use_sma': False, 'bear_use_ema': True, 'bear_use_atr': False, 'bear_use_adx': True, 'bear_use_spike': False, 'bear_rsi_required': True, 'sideways_strategy': 'breakout', 'sideways_bb_std_mult': 3.557866735194936, 'sideways_rsi_os': 25, 'sideways_rsi_ob': 91, 'sideways_adx_thresh': 26.695335309691075, 'sideways_atr_min_pct': 0.015235957940932581, 'sideways_atr_max_pct': 0.026088340731831826, 'sideways_tp_mult': 2.0856713689555013, 'sideways_tsl_mult': 0.10378918364869755, 'sideways_time_stop': 224, 'sideways_use_sma': True, 'sideways_use_ema': True, 'sideways_use_atr': False, 'sideways_use_adx': False, 'sideways_use_spike': False, 'sideways_rsi_required': False}.
[I 2025-08-31 10:00:43,110] Trial 308 finished with values: [-1000000000.0, 1000000000.0] and parameters: {'p_sma': 50, 'p_std': 16, 'p_atr': 16, 'p_adx': 12, 'rsi_period': 26, 'ema1': 13, 'ema2': 54, 'slip_atr_k': 0.14779488315643818, 'slip_spread_k': 0.36430682616343896, 'spread_hl_frac': 0.026417828335039664, 'bb_std_mult': 2.0915961151799993, 'rsi_os': 14, 'rsi_ob': 49, 'vol_spike': 0.17611856553837701, 'adx_thresh': 32.273325731202476, 'atr_min_pct': 0.012989030969587876, 'atr_max_pct': 0.10363116515053891, 'tp_mult': 2.8851205174312606, 'tsl_mult': 0.18173736034702398, 'strategy': 'breakout', 'time_stop': 143, 'use_sma': False, 'use_atr': False, 'use_adx': False, 'use_ema': False, 'use_spike': False, 'rsi_required': True, 'edge_k': 1.8267133065667556, 'edge_cap': 0.8766914565651356, 'bull_strategy': 'mean_reversion', 'bull_bb_std_mult': 2.473621418217453, 'bull_rsi_os': 32, 'bull_rsi_ob': 65, 'bull_adx_thresh': 27.606275053700614, 'bull_atr_min_pct': 0.019483956386534846, 'bull_atr_max_pct': 0.03717602681434945, 'bull_tp_mult': 1.4287934023722848, 'bull_tsl_mult': 0.7155631887287295, 'bull_time_stop': 262, 'bull_use_sma': False, 'bull_use_ema': False, 'bull_use_atr': False, 'bull_use_adx': False, 'bull_use_spike': False, 'bull_rsi_required': True, 'bear_strategy': 'mean_reversion', 'bear_bb_std_mult': 1.57898013928661, 'bear_rsi_os': 33, 'bear_rsi_ob': 50, 'bear_adx_thresh': 10.214581883565213, 'bear_atr_min_pct': 0.020777936698820963, 'bear_atr_max_pct': 0.1428873882213214, 'bear_tp_mult': 2.2551014895686965, 'bear_tsl_mult': 0.08015419518806471, 'bear_time_stop': 258, 'bear_use_sma': False, 'bear_use_ema': True, 'bear_use_atr': False, 'bear_use_adx': True, 'bear_use_spike': False, 'bear_rsi_required': True, 'sideways_strategy': 'breakout', 'sideways_bb_std_mult': 2.881277551397598, 'sideways_rsi_os': 23, 'sideways_rsi_ob': 55, 'sideways_adx_thresh': 32.4062647629843, 'sideways_atr_min_pct': 0.025931355999406457, 'sideways_atr_max_pct': 0.10704303065901617, 'sideways_tp_mult': 1.0795212794984146, 'sideways_tsl_mult': 0.07275146856154599, 'sideways_time_stop': 213, 'sideways_use_sma': True, 'sideways_use_ema': True, 'sideways_use_atr': False, 'sideways_use_adx': False, 'sideways_use_spike': False, 'sideways_rsi_required': False}.
[I 2025-08-31 10:00:43,320] Trial 309 finished with values: [-1000000000.0, 1000000000.0] and parameters: {'p_sma': 50, 'p_std': 16, 'p_atr': 17, 'p_adx': 15, 'rsi_period': 53, 'ema1': 20, 'ema2': 38, 'slip_atr_k': 0.14597105232135404, 'slip_spread_k': 0.749366266984181, 'spread_hl_frac': 0.02685982322264768, 'bb_std_mult': 0.5496257709012917, 'rsi_os': 25, 'rsi_ob': 82, 'vol_spike': 0.08550210203975296, 'adx_thresh': 6.895589528511536, 'atr_min_pct': 0.013143131343131553, 'atr_max_pct': 0.13258936526538637, 'tp_mult': 2.8811794392115355, 'tsl_mult': 0.04641395761859868, 'strategy': 'breakout', 'time_stop': 287, 'use_sma': False, 'use_atr': False, 'use_adx': False, 'use_ema': False, 'use_spike': False, 'rsi_required': True, 'edge_k': 1.8351461424789728, 'edge_cap': 0.31140024038881686, 'bull_strategy': 'mean_reversion', 'bull_bb_std_mult': 1.3764433702453678, 'bull_rsi_os': 32, 'bull_rsi_ob': 65, 'bull_adx_thresh': 12.397427984429383, 'bull_atr_min_pct': 0.008876972021093586, 'bull_atr_max_pct': 0.09602360139853265, 'bull_tp_mult': 1.4937790011254974, 'bull_tsl_mult': 0.5842293729591387, 'bull_time_stop': 269, 'bull_use_sma': False, 'bull_use_ema': False, 'bull_use_atr': False, 'bull_use_adx': False, 'bull_use_spike': False, 'bull_rsi_required': True, 'bear_strategy': 'mean_reversion', 'bear_bb_std_mult': 1.0175521023264076, 'bear_rsi_os': 33, 'bear_rsi_ob': 78, 'bear_adx_thresh': 20.075668017630413, 'bear_atr_min_pct': 0.021045593825363616, 'bear_atr_max_pct': 0.05718036107569406, 'bear_tp_mult': 2.5387409955210862, 'bear_tsl_mult': 0.9111435573774418, 'bear_time_stop': 256, 'bear_use_sma': False, 'bear_use_ema': True, 'bear_use_atr': False, 'bear_use_adx': True, 'bear_use_spike': False, 'bear_rsi_required': True, 'sideways_strategy': 'breakout', 'sideways_bb_std_mult': 0.9921401516384659, 'sideways_rsi_os': 23, 'sideways_rsi_ob': 55, 'sideways_adx_thresh': 7.258331999318978, 'sideways_atr_min_pct': 0.0015553166750055926, 'sideways_atr_max_pct': 0.08006528265003274, 'sideways_tp_mult': 1.302240437973828, 'sideways_tsl_mult': 0.07544831183523797, 'sideways_time_stop': 214, 'sideways_use_sma': True, 'sideways_use_ema': True, 'sideways_use_atr': False, 'sideways_use_adx': False, 'sideways_use_spike': False, 'sideways_rsi_required': False}.
[I 2025-08-31 10:00:43,854] Trial 313 finished with values: [-1000000000.0, 1000000000.0] and parameters: {'p_sma': 47, 'p_std': 17, 'p_atr': 13, 'p_adx': 14, 'rsi_period': 23, 'ema1': 19, 'ema2': 40, 'slip_atr_k': 0.16097407827784183, 'slip_spread_k': 0.40024352056306517, 'spread_hl_frac': 0.01469778505280064, 'bb_std_mult': 1.020306921867805, 'rsi_os': 24, 'rsi_ob': 47, 'vol_spike': 0.13065784003983358, 'adx_thresh': 12.556837095095903, 'atr_min_pct': 0.010691116567228105, 'atr_max_pct': 0.140689637102669, 'tp_mult': 1.790549657985088, 'tsl_mult': 0.6913395975818248, 'strategy': 'mean_reversion', 'time_stop': 128, 'use_sma': False, 'use_atr': False, 'use_adx': True, 'use_ema': False, 'use_spike': False, 'rsi_required': False, 'edge_k': 1.8888203360417395, 'edge_cap': 0.07622900233318661, 'bull_strategy': 'mean_reversion', 'bull_bb_std_mult': 0.9375478844039429, 'bull_rsi_os': 31, 'bull_rsi_ob': 68, 'bull_adx_thresh': 32.28153752372296, 'bull_atr_min_pct': 0.020862219480264715, 'bull_atr_max_pct': 0.14954753790395428, 'bull_tp_mult': 1.5407385551931119, 'bull_tsl_mult': 0.6029244920448279, 'bull_time_stop': 48, 'bull_use_sma': True, 'bull_use_ema': False, 'bull_use_atr': False, 'bull_use_adx': False, 'bull_use_spike': True, 'bull_rsi_required': False, 'bear_strategy': 'breakout', 'bear_bb_std_mult': 0.6389785337214968, 'bear_rsi_os': 51, 'bear_rsi_ob': 94, 'bear_adx_thresh': 34.49509667613884, 'bear_atr_min_pct': 0.00763023699518541, 'bear_atr_max_pct': 0.0504047629021834, 'bear_tp_mult': 2.6874530954206817, 'bear_tsl_mult': 0.1894986265458266, 'bear_time_stop': 290, 'bear_use_sma': True, 'bear_use_ema': True, 'bear_use_atr': True, 'bear_use_adx': False, 'bear_use_spike': False, 'bear_rsi_required': True, 'sideways_strategy': 'mean_reversion', 'sideways_bb_std_mult': 2.132528765634462, 'sideways_rsi_os': 18, 'sideways_rsi_ob': 77, 'sideways_adx_thresh': 25.027111611702722, 'sideways_atr_min_pct': 0.002639442402823005, 'sideways_atr_max_pct': 0.028060451770854394, 'sideways_tp_mult': 2.5201702430738426, 'sideways_tsl_mult': 0.04453187837749689, 'sideways_time_stop': 230, 'sideways_use_sma': False, 'sideways_use_ema': False, 'sideways_use_atr': True, 'sideways_use_adx': False, 'sideways_use_spike': False, 'sideways_rsi_required': True}.
[I 2025-08-31 10:00:43,861] Trial 312 finished with values: [-1000000000.0, 1000000000.0] and parameters: {'p_sma': 47, 'p_std': 14, 'p_atr': 28, 'p_adx': 10, 'rsi_period': 31, 'ema1': 18, 'ema2': 38, 'slip_atr_k': 0.16080031455050717, 'slip_spread_k': 0.39912827995121936, 'spread_hl_frac': 0.014931893893354278, 'bb_std_mult': 2.296904823456064, 'rsi_os': 25, 'rsi_ob': 47, 'vol_spike': 0.13085935739552584, 'adx_thresh': 8.131066288549093, 'atr_min_pct': 0.028885777009610224, 'atr_max_pct': 0.1419703640313624, 'tp_mult': 2.8138528422666624, 'tsl_mult': 0.030660881989384676, 'strategy': 'mean_reversion', 'time_stop': 129, 'use_sma': False, 'use_atr': False, 'use_adx': True, 'use_ema': False, 'use_spike': False, 'rsi_required': False, 'edge_k': 1.8747310575710363, 'edge_cap': 0.13678163302937524, 'bull_strategy': 'mean_reversion', 'bull_bb_std_mult': 1.2387635958890795, 'bull_rsi_os': 32, 'bull_rsi_ob': 68, 'bull_adx_thresh': 19.324149348142875, 'bull_atr_min_pct': 0.005481194060915169, 'bull_atr_max_pct': 0.11717893653037424, 'bull_tp_mult': 1.531644501576987, 'bull_tsl_mult': 0.7694700339864975, 'bull_time_stop': 164, 'bull_use_sma': True, 'bull_use_ema': False, 'bull_use_atr': False, 'bull_use_adx': False, 'bull_use_spike': False, 'bull_rsi_required': False, 'bear_strategy': 'breakout', 'bear_bb_std_mult': 2.8322576461798152, 'bear_rsi_os': 9, 'bear_rsi_ob': 92, 'bear_adx_thresh': 19.36105976748399, 'bear_atr_min_pct': 0.02367661985236561, 'bear_atr_max_pct': 0.13623750778423258, 'bear_tp_mult': 1.7493003421167657, 'bear_tsl_mult': 0.18757981694733594, 'bear_time_stop': 245, 'bear_use_sma': True, 'bear_use_ema': True, 'bear_use_atr': True, 'bear_use_adx': False, 'bear_use_spike': False, 'bear_rsi_required': True, 'sideways_strategy': 'mean_reversion', 'sideways_bb_std_mult': 2.1177754722448148, 'sideways_rsi_os': 10, 'sideways_rsi_ob': 61, 'sideways_adx_thresh': 5.113830983286668, 'sideways_atr_min_pct': 0.013271068029115072, 'sideways_atr_max_pct': 0.09376506501771302, 'sideways_tp_mult': 2.264441437618822, 'sideways_tsl_mult': 0.12584887892149454, 'sideways_time_stop': 230, 'sideways_use_sma': False, 'sideways_use_ema': False, 'sideways_use_atr': False, 'sideways_use_adx': False, 'sideways_use_spike': False, 'sideways_rsi_required': True}.
[I 2025-08-31 10:01:10,958] Trial 311 finished with values: [-0.04436789187681711, 0.04419391971753213] and parameters: {'p_sma': 49, 'p_std': 16, 'p_atr': 16, 'p_adx': 24, 'rsi_period': 23, 'ema1': 13, 'ema2': 39, 'slip_atr_k': 0.14796353026091003, 'slip_spread_k': 0.19754729795278414, 'spread_hl_frac': 0.02662443403102462, 'bb_std_mult': 3.5799765305322633, 'rsi_os': 24, 'rsi_ob': 51, 'vol_spike': 0.08489179555326641, 'adx_thresh': 23.974720578593754, 'atr_min_pct': 0.002490169281195536, 'atr_max_pct': 0.13184681681171792, 'tp_mult': 2.8710296274349045, 'tsl_mult': 0.6884757372276767, 'strategy': 'breakout', 'time_stop': 300, 'use_sma': False, 'use_atr': False, 'use_adx': True, 'use_ema': False, 'use_spike': False, 'rsi_required': True, 'edge_k': 1.8449202232966808, 'edge_cap': 0.13112269130839777, 'bull_strategy': 'mean_reversion', 'bull_bb_std_mult': 1.2417680659851456, 'bull_rsi_os': 32, 'bull_rsi_ob': 67, 'bull_adx_thresh': 30.28589648031764, 'bull_atr_min_pct': 0.0010291561997775242, 'bull_atr_max_pct': 0.11781497842564957, 'bull_tp_mult': 1.4774510069933933, 'bull_tsl_mult': 0.34305153617736817, 'bull_time_stop': 270, 'bull_use_sma': True, 'bull_use_ema': False, 'bull_use_atr': False, 'bull_use_adx': False, 'bull_use_spike': False, 'bull_rsi_required': False, 'bear_strategy': 'breakout', 'bear_bb_std_mult': 1.0307761941376574, 'bear_rsi_os': 33, 'bear_rsi_ob': 94, 'bear_adx_thresh': 10.242145520262833, 'bear_atr_min_pct': 0.0210449267755988, 'bear_atr_max_pct': 0.05647274640673075, 'bear_tp_mult': 2.272570543540089, 'bear_tsl_mult': 0.19004550640180923, 'bear_time_stop': 245, 'bear_use_sma': True, 'bear_use_ema': True, 'bear_use_atr': True, 'bear_use_adx': False, 'bear_use_spike': False, 'bear_rsi_required': True, 'sideways_strategy': 'mean_reversion', 'sideways_bb_std_mult': 1.1880667653549948, 'sideways_rsi_os': 23, 'sideways_rsi_ob': 79, 'sideways_adx_thresh': 32.48777538351128, 'sideways_atr_min_pct': 0.0014427279659004991, 'sideways_atr_max_pct': 0.02828711398288838, 'sideways_tp_mult': 1.6143952992720259, 'sideways_tsl_mult': 0.07537738190206013, 'sideways_time_stop': 231, 'sideways_use_sma': False, 'sideways_use_ema': False, 'sideways_use_atr': False, 'sideways_use_adx': False, 'sideways_use_spike': False, 'sideways_rsi_required': True}.
[I 2025-08-31 10:01:12,495] Trial 310 finished with values: [-1000000000.0, 1000000000.0] and parameters: {'p_sma': 51, 'p_std': 9, 'p_atr': 24, 'p_adx': 24, 'rsi_period': 26, 'ema1': 25, 'ema2': 38, 'slip_atr_k': 0.23555029078385573, 'slip_spread_k': 0.39774658862361406, 'spread_hl_frac': 0.015070398765187674, 'bb_std_mult': 0.8683658217235601, 'rsi_os': 44, 'rsi_ob': 59, 'vol_spike': 0.12571486217334926, 'adx_thresh': 14.439960276526795, 'atr_min_pct': 0.013024225387891565, 'atr_max_pct': 0.1029979886878509, 'tp_mult': 2.869656127833438, 'tsl_mult': 0.04497579763612254, 'strategy': 'breakout', 'time_stop': 128, 'use_sma': False, 'use_atr': False, 'use_adx': True, 'use_ema': False, 'use_spike': False, 'rsi_required': True, 'edge_k': 1.8434606631685313, 'edge_cap': 0.13025927512015087, 'bull_strategy': 'mean_reversion', 'bull_bb_std_mult': 1.0133970197370994, 'bull_rsi_os': 5, 'bull_rsi_ob': 92, 'bull_adx_thresh': 11.627011697069925, 'bull_atr_min_pct': 0.009110979956242592, 'bull_atr_max_pct': 0.09622677890292497, 'bull_tp_mult': 2.3730750474622995, 'bull_tsl_mult': 0.7652325830065417, 'bull_time_stop': 262, 'bull_use_sma': False, 'bull_use_ema': False, 'bull_use_atr': False, 'bull_use_adx': False, 'bull_use_spike': False, 'bull_rsi_required': False, 'bear_strategy': 'mean_reversion', 'bear_bb_std_mult': 1.0043187359389854, 'bear_rsi_os': 33, 'bear_rsi_ob': 94, 'bear_adx_thresh': 20.10151926528133, 'bear_atr_min_pct': 0.023683135809682128, 'bear_atr_max_pct': 0.13656805640012226, 'bear_tp_mult': 2.6888579854845385, 'bear_tsl_mult': 0.9102748620440315, 'bear_time_stop': 246, 'bear_use_sma': False, 'bear_use_ema': True, 'bear_use_atr': False, 'bear_use_adx': True, 'bear_use_spike': False, 'bear_rsi_required': True, 'sideways_strategy': 'breakout', 'sideways_bb_std_mult': 2.1056948340144004, 'sideways_rsi_os': 25, 'sideways_rsi_ob': 61, 'sideways_adx_thresh': 6.9026562501566495, 'sideways_atr_min_pct': 0.00798745232487091, 'sideways_atr_max_pct': 0.08010957976712896, 'sideways_tp_mult': 1.638276702882056, 'sideways_tsl_mult': 0.0748958821889278, 'sideways_time_stop': 230, 'sideways_use_sma': True, 'sideways_use_ema': True, 'sideways_use_atr': False, 'sideways_use_adx': False, 'sideways_use_spike': False, 'sideways_rsi_required': False}.
[I 2025-08-31 10:01:14,925] Trial 314 finished with values: [-1000000000.0, 1000000000.0] and parameters: {'p_sma': 24, 'p_std': 33, 'p_atr': 8, 'p_adx': 10, 'rsi_period': 20, 'ema1': 25, 'ema2': 39, 'slip_atr_k': 0.16637980250809414, 'slip_spread_k': 0.14340414127797896, 'spread_hl_frac': 0.0489521099966529, 'bb_std_mult': 2.180349563880087, 'rsi_os': 9, 'rsi_ob': 51, 'vol_spike': 0.22687389552394177, 'adx_thresh': 21.626859424052377, 'atr_min_pct': 0.012207126118113431, 'atr_max_pct': 0.1488458390467217, 'tp_mult': 2.8177846949499155, 'tsl_mult': 0.024994250071970356, 'strategy': 'breakout', 'time_stop': 275, 'use_sma': False, 'use_atr': False, 'use_adx': True, 'use_ema': False, 'use_spike': False, 'rsi_required': True, 'edge_k': 1.0679420553929806, 'edge_cap': 0.1364068966753445, 'bull_strategy': 'mean_reversion', 'bull_bb_std_mult': 1.2335666301605468, 'bull_rsi_os': 34, 'bull_rsi_ob': 67, 'bull_adx_thresh': 11.599808923794022, 'bull_atr_min_pct': 0.02051323396486912, 'bull_atr_max_pct': 0.1170811368950628, 'bull_tp_mult': 1.4893428483717364, 'bull_tsl_mult': 0.38603402867325914, 'bull_time_stop': 23, 'bull_use_sma': True, 'bull_use_ema': False, 'bull_use_atr': False, 'bull_use_adx': True, 'bull_use_spike': False, 'bull_rsi_required': False, 'bear_strategy': 'breakout', 'bear_bb_std_mult': 2.824078118206534, 'bear_rsi_os': 52, 'bear_rsi_ob': 92, 'bear_adx_thresh': 19.62923802329694, 'bear_atr_min_pct': 0.006127410963166024, 'bear_atr_max_pct': 0.1341523526475778, 'bear_tp_mult': 1.7360367964422179, 'bear_tsl_mult': 0.1584479818197994, 'bear_time_stop': 246, 'bear_use_sma': False, 'bear_use_ema': True, 'bear_use_atr': True, 'bear_use_adx': True, 'bear_use_spike': False, 'bear_rsi_required': True, 'sideways_strategy': 'breakout', 'sideways_bb_std_mult': 1.176594807546265, 'sideways_rsi_os': 40, 'sideways_rsi_ob': 61, 'sideways_adx_thresh': 32.74978044335899, 'sideways_atr_min_pct': 0.01396020123170935, 'sideways_atr_max_pct': 0.03128317251988531, 'sideways_tp_mult': 1.5462243348408116, 'sideways_tsl_mult': 0.717408336444016, 'sideways_time_stop': 248, 'sideways_use_sma': False, 'sideways_use_ema': False, 'sideways_use_atr': False, 'sideways_use_adx': True, 'sideways_use_spike': False, 'sideways_rsi_required': False}.
