[I 2025-08-31 10:29:56,443] Trial 549 finished with values: [-1000000000.0, 1000000000.0] and parameters: {'p_sma': 13, 'p_std': 48, 'p_atr': 20, 'p_adx': 8, 'rsi_period': 65, 'ema1': 18, 'ema2': 50, 'slip_atr_k': 0.18900080180073464, 'slip_spread_k': 0.10264657700426687, 'spread_hl_frac': 0.009743736727244823, 'bb_std_mult': 1.2650526388450913, 'rsi_os': 40, 'rsi_ob': 84, 'vol_spike': 0.2743615397703241, 'adx_thresh': 23.394725499154433, 'atr_min_pct': 0.01180997398265383, 'atr_max_pct': 0.12546614446345986, 'tp_mult': 2.631999292020128, 'tsl_mult': 0.4447858646028614, 'strategy': 'mean_reversion', 'time_stop': 29, 'use_sma': False, 'use_atr': True, 'use_adx': True, 'use_ema': True, 'use_spike': False, 'rsi_required': True, 'edge_k': 1.8518803702231452, 'edge_cap': 0.09341098784351226, 'bull_strategy': 'mean_reversion', 'bull_bb_std_mult': 1.2699949537927813, 'bull_rsi_os': 27, 'bull_rsi_ob': 68, 'bull_adx_thresh': 34.53302320017296, 'bull_atr_min_pct': 0.004902630166917583, 'bull_atr_max_pct': 0.0890278105348453, 'bull_tp_mult': 2.209144465838493, 'bull_tsl_mult': 0.9979474232529826, 'bull_time_stop': 72, 'bull_use_sma': True, 'bull_use_ema': True, 'bull_use_atr': True, 'bull_use_adx': True, 'bull_use_spike': False, 'bull_rsi_required': True, 'bear_strategy': 'breakout', 'bear_bb_std_mult': 3.273106166666341, 'bear_rsi_os': 29, 'bear_rsi_ob': 90, 'bear_adx_thresh': 17.63890304439149, 'bear_atr_min_pct': 0.006670240005412857, 'bear_atr_max_pct': 0.09875351362856867, 'bear_tp_mult': 2.149266328765533, 'bear_tsl_mult': 0.4788550031059793, 'bear_time_stop': 264, 'bear_use_sma': False, 'bear_use_ema': False, 'bear_use_atr': True, 'bear_use_adx': True, 'bear_use_spike': True, 'bear_rsi_required': False, 'sideways_strategy': 'mean_reversion', 'sideways_bb_std_mult': 0.9107952835830587, 'sideways_rsi_os': 25, 'sideways_rsi_ob': 94, 'sideways_adx_thresh': 30.143565071921465, 'sideways_atr_min_pct': 0.001788000172635919, 'sideways_atr_max_pct': 0.08834724230394593, 'sideways_tp_mult': 2.8916783433919138, 'sideways_tsl_mult': 0.016814229293241667, 'sideways_time_stop': 52, 'sideways_use_sma': False, 'sideways_use_ema': True, 'sideways_use_atr': False, 'sideways_use_adx': True, 'sideways_use_spike': True, 'sideways_rsi_required': True}.
[I 2025-08-31 10:29:56,444] Trial 552 finished with values: [-1000000000.0, 1000000000.0] and parameters: {'p_sma': 8, 'p_std': 44, 'p_atr': 30, 'p_adx': 19, 'rsi_period': 55, 'ema1': 18, 'ema2': 27, 'slip_atr_k': 0.17671020643796057, 'slip_spread_k': 0.11348598699999463, 'spread_hl_frac': 0.03294055014322274, 'bb_std_mult': 1.3201982057611081, 'rsi_os': 39, 'rsi_ob': 83, 'vol_spike': 0.28384358201923643, 'adx_thresh': 24.18598078598129, 'atr_min_pct': 0.010824371977624194, 'atr_max_pct': 0.12006996200704587, 'tp_mult': 1.6599107306638359, 'tsl_mult': 0.2822631074987011, 'strategy': 'mean_reversion', 'time_stop': 59, 'use_sma': False, 'use_atr': True, 'use_adx': False, 'use_ema': True, 'use_spike': False, 'rsi_required': True, 'edge_k': 0.0899647405630698, 'edge_cap': 0.09874382818204747, 'bull_strategy': 'mean_reversion', 'bull_bb_std_mult': 1.2507784409542306, 'bull_rsi_os': 27, 'bull_rsi_ob': 66, 'bull_adx_thresh': 30.2726932135289, 'bull_atr_min_pct': 0.004981405358884035, 'bull_atr_max_pct': 0.08297747164674912, 'bull_tp_mult': 2.1058585724403103, 'bull_tsl_mult': 0.9304090879661054, 'bull_time_stop': 81, 'bull_use_sma': True, 'bull_use_ema': False, 'bull_use_atr': False, 'bull_use_adx': False, 'bull_use_spike': False, 'bull_rsi_required': True, 'bear_strategy': 'breakout', 'bear_bb_std_mult': 1.3028829761008809, 'bear_rsi_os': 29, 'bear_rsi_ob': 78, 'bear_adx_thresh': 31.08231132578682, 'bear_atr_min_pct': 0.006583194822249019, 'bear_atr_max_pct': 0.10326740452533645, 'bear_tp_mult': 2.0532217365844474, 'bear_tsl_mult': 0.45647972136055276, 'bear_time_stop': 171, 'bear_use_sma': False, 'bear_use_ema': True, 'bear_use_atr': False, 'bear_use_adx': True, 'bear_use_spike': True, 'bear_rsi_required': False, 'sideways_strategy': 'mean_reversion', 'sideways_bb_std_mult': 0.907379251935987, 'sideways_rsi_os': 51, 'sideways_rsi_ob': 93, 'sideways_adx_thresh': 29.929413793702096, 'sideways_atr_min_pct': 0.0017340473885322162, 'sideways_atr_max_pct': 0.09804450527742181, 'sideways_tp_mult': 2.8523522560161436, 'sideways_tsl_mult': 0.027571920956636686, 'sideways_time_stop': 121, 'sideways_use_sma': True, 'sideways_use_ema': True, 'sideways_use_atr': False, 'sideways_use_adx': False, 'sideways_use_spike': True, 'sideways_rsi_required': True}.
[I 2025-08-31 10:29:56,811] Trial 551 finished with values: [-1000000000.0, 1000000000.0] and parameters: {'p_sma': 13, 'p_std': 52, 'p_atr': 30, 'p_adx': 8, 'rsi_period': 65, 'ema1': 18, 'ema2': 50, 'slip_atr_k': 0.1895210875018398, 'slip_spread_k': 0.09417461031234681, 'spread_hl_frac': 0.03299151641757962, 'bb_std_mult': 3.350727408044042, 'rsi_os': 39, 'rsi_ob': 84, 'vol_spike': 0.2839923311568384, 'adx_thresh': 24.826090872373882, 'atr_min_pct': 0.008384462454547, 'atr_max_pct': 0.12311490401782789, 'tp_mult': 2.3969135649108084, 'tsl_mult': 0.8598921210603699, 'strategy': 'breakout', 'time_stop': 13, 'use_sma': False, 'use_atr': True, 'use_adx': False, 'use_ema': True, 'use_spike': False, 'rsi_required': True, 'edge_k': 1.9944904519997584, 'edge_cap': 0.39543721070864335, 'bull_strategy': 'mean_reversion', 'bull_bb_std_mult': 1.268821119929897, 'bull_rsi_os': 27, 'bull_rsi_ob': 66, 'bull_adx_thresh': 9.419851253506323, 'bull_atr_min_pct': 0.006311789515110369, 'bull_atr_max_pct': 0.08307753952410755, 'bull_tp_mult': 2.274694138942056, 'bull_tsl_mult': 0.9952330892080188, 'bull_time_stop': 81, 'bull_use_sma': True, 'bull_use_ema': False, 'bull_use_atr': False, 'bull_use_adx': False, 'bull_use_spike': False, 'bull_rsi_required': True, 'bear_strategy': 'breakout', 'bear_bb_std_mult': 2.8501893274204724, 'bear_rsi_os': 29, 'bear_rsi_ob': 78, 'bear_adx_thresh': 21.638492011361567, 'bear_atr_min_pct': 0.0067753911750045095, 'bear_atr_max_pct': 0.10203392736338082, 'bear_tp_mult': 2.057285780802664, 'bear_tsl_mult': 0.4809768262766122, 'bear_time_stop': 119, 'bear_use_sma': False, 'bear_use_ema': True, 'bear_use_atr': False, 'bear_use_adx': True, 'bear_use_spike': True, 'bear_rsi_required': False, 'sideways_strategy': 'breakout', 'sideways_bb_std_mult': 0.9150816791838957, 'sideways_rsi_os': 51, 'sideways_rsi_ob': 92, 'sideways_adx_thresh': 29.909553428581173, 'sideways_atr_min_pct': 0.01880335237132073, 'sideways_atr_max_pct': 0.10672993845334922, 'sideways_tp_mult': 2.73932261386149, 'sideways_tsl_mult': 0.8191040953864155, 'sideways_time_stop': 78, 'sideways_use_sma': True, 'sideways_use_ema': True, 'sideways_use_atr': False, 'sideways_use_adx': False, 'sideways_use_spike': True, 'sideways_rsi_required': False}.
[I 2025-08-31 10:29:56,909] Trial 550 finished with values: [-1000000000.0, 1000000000.0] and parameters: {'p_sma': 8, 'p_std': 44, 'p_atr': 30, 'p_adx': 30, 'rsi_period': 22, 'ema1': 18, 'ema2': 35, 'slip_atr_k': 0.1907370794701081, 'slip_spread_k': 0.10229371221947459, 'spread_hl_frac': 0.03319866146189048, 'bb_std_mult': 1.8982944741544545, 'rsi_os': 39, 'rsi_ob': 84, 'vol_spike': 0.2829135864286751, 'adx_thresh': 24.82761643906649, 'atr_min_pct': 0.008178040397701253, 'atr_max_pct': 0.1262470919378068, 'tp_mult': 1.666347742074714, 'tsl_mult': 0.05392022946988953, 'strategy': 'breakout', 'time_stop': 147, 'use_sma': False, 'use_atr': True, 'use_adx': False, 'use_ema': True, 'use_spike': False, 'rsi_required': True, 'edge_k': 0.08661811448268031, 'edge_cap': 0.39278658698179747, 'bull_strategy': 'mean_reversion', 'bull_bb_std_mult': 1.2505015696322959, 'bull_rsi_os': 27, 'bull_rsi_ob': 67, 'bull_adx_thresh': 22.747020014810847, 'bull_atr_min_pct': 0.004972858635318567, 'bull_atr_max_pct': 0.08237366475603679, 'bull_tp_mult': 2.1041550722762747, 'bull_tsl_mult': 0.9214559265804182, 'bull_time_stop': 80, 'bull_use_sma': True, 'bull_use_ema': False, 'bull_use_atr': False, 'bull_use_adx': False, 'bull_use_spike': False, 'bull_rsi_required': True, 'bear_strategy': 'breakout', 'bear_bb_std_mult': 2.21030136272647, 'bear_rsi_os': 29, 'bear_rsi_ob': 78, 'bear_adx_thresh': 21.67302431078702, 'bear_atr_min_pct': 0.006541224987034274, 'bear_atr_max_pct': 0.10245930855223338, 'bear_tp_mult': 2.067445206640962, 'bear_tsl_mult': 0.9989104110403314, 'bear_time_stop': 53, 'bear_use_sma': False, 'bear_use_ema': True, 'bear_use_atr': False, 'bear_use_adx': True, 'bear_use_spike': True, 'bear_rsi_required': False, 'sideways_strategy': 'breakout', 'sideways_bb_std_mult': 0.924720602051177, 'sideways_rsi_os': 51, 'sideways_rsi_ob': 92, 'sideways_adx_thresh': 29.933522285743372, 'sideways_atr_min_pct': 0.0017028682482745244, 'sideways_atr_max_pct': 0.10809090523696109, 'sideways_tp_mult': 2.7327300835331076, 'sideways_tsl_mult': 0.0916880297906258, 'sideways_time_stop': 233, 'sideways_use_sma': True, 'sideways_use_ema': True, 'sideways_use_atr': False, 'sideways_use_adx': False, 'sideways_use_spike': True, 'sideways_rsi_required': False}.
[I 2025-08-31 10:30:29,759] Trial 556 finished with values: [-1000000000.0, 1000000000.0] and parameters: {'p_sma': 9, 'p_std': 47, 'p_atr': 11, 'p_adx': 10, 'rsi_period': 84, 'ema1': 7, 'ema2': 39, 'slip_atr_k': 0.17975595502720831, 'slip_spread_k': 0.019699372755998118, 'spread_hl_frac': 0.03485652316697549, 'bb_std_mult': 1.1231617080176504, 'rsi_os': 42, 'rsi_ob': 79, 'vol_spike': 0.29521664358904054, 'adx_thresh': 23.783181507255936, 'atr_min_pct': 0.01070643919838944, 'atr_max_pct': 0.12074560712566952, 'tp_mult': 2.038064337161713, 'tsl_mult': 0.4148868402509245, 'strategy': 'breakout', 'time_stop': 143, 'use_sma': True, 'use_atr': False, 'use_adx': False, 'use_ema': True, 'use_spike': True, 'rsi_required': False, 'edge_k': 1.510808341248691, 'edge_cap': 0.15989892435306713, 'bull_strategy': 'breakout', 'bull_bb_std_mult': 1.1727669775482805, 'bull_rsi_os': 24, 'bull_rsi_ob': 75, 'bull_adx_thresh': 19.551612600119693, 'bull_atr_min_pct': 0.005994690261898897, 'bull_atr_max_pct': 0.09668143258151243, 'bull_tp_mult': 2.3512810356496976, 'bull_tsl_mult': 0.9652118654811108, 'bull_time_stop': 65, 'bull_use_sma': False, 'bull_use_ema': False, 'bull_use_atr': False, 'bull_use_adx': False, 'bull_use_spike': False, 'bull_rsi_required': True, 'bear_strategy': 'mean_reversion', 'bear_bb_std_mult': 2.371931281529552, 'bear_rsi_os': 26, 'bear_rsi_ob': 47, 'bear_adx_thresh': 20.87605927518751, 'bear_atr_min_pct': 0.00866071865067196, 'bear_atr_max_pct': 0.10754163260783847, 'bear_tp_mult': 2.09954625840103, 'bear_tsl_mult': 0.22224786713752714, 'bear_time_stop': 271, 'bear_use_sma': True, 'bear_use_ema': True, 'bear_use_atr': False, 'bear_use_adx': False, 'bear_use_spike': True, 'bear_rsi_required': True, 'sideways_strategy': 'breakout', 'sideways_bb_std_mult': 3.5141780329346624, 'sideways_rsi_os': 36, 'sideways_rsi_ob': 90, 'sideways_adx_thresh': 28.506709154240912, 'sideways_atr_min_pct': 0.000786360734815033, 'sideways_atr_max_pct': 0.10384110220603604, 'sideways_tp_mult': 2.921985185716949, 'sideways_tsl_mult': 0.27717292072740884, 'sideways_time_stop': 112, 'sideways_use_sma': True, 'sideways_use_ema': True, 'sideways_use_atr': False, 'sideways_use_adx': False, 'sideways_use_spike': True, 'sideways_rsi_required': False}.
[I 2025-08-31 10:30:30,279] Trial 553 finished with values: [-0.06853946738297878, 0.06840491037782305] and parameters: {'p_sma': 11, 'p_std': 46, 'p_atr': 15, 'p_adx': 10, 'rsi_period': 22, 'ema1': 7, 'ema2': 35, 'slip_atr_k': 0.058521646270792, 'slip_spread_k': 0.1774309805269494, 'spread_hl_frac': 0.007708892669429004, 'bb_std_mult': 1.1334696377593307, 'rsi_os': 42, 'rsi_ob': 84, 'vol_spike': 0.2994095171091689, 'adx_thresh': 24.71128496448834, 'atr_min_pct': 0.010937179527188735, 'atr_max_pct': 0.12230320985465556, 'tp_mult': 1.6035355622426595, 'tsl_mult': 0.8450650019103121, 'strategy': 'breakout', 'time_stop': 246, 'use_sma': True, 'use_atr': False, 'use_adx': False, 'use_ema': True, 'use_spike': False, 'rsi_required': True, 'edge_k': 1.508115923128212, 'edge_cap': 0.5624271126895732, 'bull_strategy': 'breakout', 'bull_bb_std_mult': 2.3683248830021535, 'bull_rsi_os': 21, 'bull_rsi_ob': 67, 'bull_adx_thresh': 22.763730036402194, 'bull_atr_min_pct': 0.005267338994237406, 'bull_atr_max_pct': 0.08435366431515506, 'bull_tp_mult': 2.2537728671170383, 'bull_tsl_mult': 0.9642577242757985, 'bull_time_stop': 80, 'bull_use_sma': True, 'bull_use_ema': False, 'bull_use_atr': False, 'bull_use_adx': False, 'bull_use_spike': False, 'bull_rsi_required': True, 'bear_strategy': 'breakout', 'bear_bb_std_mult': 2.8724736102003887, 'bear_rsi_os': 27, 'bear_rsi_ob': 79, 'bear_adx_thresh': 20.91129183296993, 'bear_atr_min_pct': 0.008474481971142037, 'bear_atr_max_pct': 0.10231424645479655, 'bear_tp_mult': 2.037660614511971, 'bear_tsl_mult': 0.22541312075596803, 'bear_time_stop': 268, 'bear_use_sma': False, 'bear_use_ema': True, 'bear_use_atr': False, 'bear_use_adx': True, 'bear_use_spike': True, 'bear_rsi_required': True, 'sideways_strategy': 'breakout', 'sideways_bb_std_mult': 0.9824114019223181, 'sideways_rsi_os': 36, 'sideways_rsi_ob': 92, 'sideways_adx_thresh': 29.942198495405094, 'sideways_atr_min_pct': 0.0006672650470146545, 'sideways_atr_max_pct': 0.10779976690915358, 'sideways_tp_mult': 2.9272380827564244, 'sideways_tsl_mult': 0.8474140693391184, 'sideways_time_stop': 81, 'sideways_use_sma': True, 'sideways_use_ema': True, 'sideways_use_atr': False, 'sideways_use_adx': False, 'sideways_use_spike': True, 'sideways_rsi_required': False}.
[I 2025-08-31 10:30:30,438] Trial 555 finished with values: [-0.09080873590023786, 0.0907170185602911] and parameters: {'p_sma': 11, 'p_std': 45, 'p_atr': 15, 'p_adx': 15, 'rsi_period': 22, 'ema1': 26, 'ema2': 35, 'slip_atr_k': 0.1810655166221271, 'slip_spread_k': 0.12404565903304393, 'spread_hl_frac': 0.04228929707592531, 'bb_std_mult': 2.2292255138993764, 'rsi_os': 42, 'rsi_ob': 79, 'vol_spike': 0.2997833769791598, 'adx_thresh': 24.211473547084736, 'atr_min_pct': 0.028802841028864427, 'atr_max_pct': 0.1266665894542343, 'tp_mult': 2.4775492160542005, 'tsl_mult': 0.09468283921137391, 'strategy': 'breakout', 'time_stop': 148, 'use_sma': True, 'use_atr': False, 'use_adx': False, 'use_ema': True, 'use_spike': True, 'rsi_required': False, 'edge_k': 1.512215208051268, 'edge_cap': 0.5556036373076403, 'bull_strategy': 'breakout', 'bull_bb_std_mult': 1.1897826346161267, 'bull_rsi_os': 24, 'bull_rsi_ob': 85, 'bull_adx_thresh': 19.516207710891802, 'bull_atr_min_pct': 0.0057376435458323626, 'bull_atr_max_pct': 0.09235551878420663, 'bull_tp_mult': 2.265059569039955, 'bull_tsl_mult': 0.9648541273167662, 'bull_time_stop': 75, 'bull_use_sma': False, 'bull_use_ema': False, 'bull_use_atr': False, 'bull_use_adx': False, 'bull_use_spike': False, 'bull_rsi_required': True, 'bear_strategy': 'breakout', 'bear_bb_std_mult': 2.914838323915099, 'bear_rsi_os': 26, 'bear_rsi_ob': 79, 'bear_adx_thresh': 20.976535043545113, 'bear_atr_min_pct': 0.008369592316505817, 'bear_atr_max_pct': 0.10336205175705734, 'bear_tp_mult': 2.036086201279776, 'bear_tsl_mult': 0.4611098812917836, 'bear_time_stop': 271, 'bear_use_sma': True, 'bear_use_ema': True, 'bear_use_atr': False, 'bear_use_adx': False, 'bear_use_spike': True, 'bear_rsi_required': True, 'sideways_strategy': 'breakout', 'sideways_bb_std_mult': 0.9943667407211014, 'sideways_rsi_os': 55, 'sideways_rsi_ob': 92, 'sideways_adx_thresh': 28.30814518201045, 'sideways_atr_min_pct': 0.0006689740295689976, 'sideways_atr_max_pct': 0.10486323008124385, 'sideways_tp_mult': 2.9253461338383357, 'sideways_tsl_mult': 0.7234456791660382, 'sideways_time_stop': 37, 'sideways_use_sma': True, 'sideways_use_ema': True, 'sideways_use_atr': False, 'sideways_use_adx': False, 'sideways_use_spike': True, 'sideways_rsi_required': False}.
[I 2025-08-31 10:30:30,439] Trial 554 finished with values: [-1000000000.0, 1000000000.0] and parameters: {'p_sma': 11, 'p_std': 47, 'p_atr': 15, 'p_adx': 30, 'rsi_period': 83, 'ema1': 7, 'ema2': 38, 'slip_atr_k': 0.1798330439024153, 'slip_spread_k': 0.12297010875026637, 'spread_hl_frac': 0.02487462336431186, 'bb_std_mult': 1.1240330852286902, 'rsi_os': 42, 'rsi_ob': 84, 'vol_spike': 0.2933458396803754, 'adx_thresh': 25.01404694771535, 'atr_min_pct': 0.010655508478764043, 'atr_max_pct': 0.12613494688649257, 'tp_mult': 1.4283121050104723, 'tsl_mult': 0.0953612681995197, 'strategy': 'breakout', 'time_stop': 141, 'use_sma': True, 'use_atr': False, 'use_adx': False, 'use_ema': True, 'use_spike': False, 'rsi_required': True, 'edge_k': 1.9824590533310862, 'edge_cap': 0.16049211876102473, 'bull_strategy': 'breakout', 'bull_bb_std_mult': 2.0748151539423203, 'bull_rsi_os': 25, 'bull_rsi_ob': 67, 'bull_adx_thresh': 23.827864172458835, 'bull_atr_min_pct': 0.006179456098064592, 'bull_atr_max_pct': 0.08361415000133965, 'bull_tp_mult': 2.2741731413150967, 'bull_tsl_mult': 0.9631589966436876, 'bull_time_stop': 81, 'bull_use_sma': True, 'bull_use_ema': False, 'bull_use_atr': False, 'bull_use_adx': False, 'bull_use_spike': False, 'bull_rsi_required': True, 'bear_strategy': 'breakout', 'bear_bb_std_mult': 2.872821088520138, 'bear_rsi_os': 27, 'bear_rsi_ob': 79, 'bear_adx_thresh': 24.191320740991877, 'bear_atr_min_pct': 0.005672637245805286, 'bear_atr_max_pct': 0.10174903123501212, 'bear_tp_mult': 2.099306883945635, 'bear_tsl_mult': 0.9017125488072245, 'bear_time_stop': 300, 'bear_use_sma': False, 'bear_use_ema': True, 'bear_use_atr': False, 'bear_use_adx': True, 'bear_use_spike': True, 'bear_rsi_required': True, 'sideways_strategy': 'breakout', 'sideways_bb_std_mult': 0.9921990791357909, 'sideways_rsi_os': 30, 'sideways_rsi_ob': 92, 'sideways_adx_thresh': 29.80814013051209, 'sideways_atr_min_pct': 0.0006830480102840033, 'sideways_atr_max_pct': 0.10782949436451517, 'sideways_tp_mult': 2.7135771208619976, 'sideways_tsl_mult': 0.936870211716968, 'sideways_time_stop': 219, 'sideways_use_sma': True, 'sideways_use_ema': True, 'sideways_use_atr': False, 'sideways_use_adx': False, 'sideways_use_spike': True, 'sideways_rsi_required': False}.
[I 2025-08-31 10:31:04,200] Trial 559 finished with values: [-1000000000.0, 1000000000.0] and parameters: {'p_sma': 9, 'p_std': 49, 'p_atr': 7, 'p_adx': 20, 'rsi_period': 24, 'ema1': 19, 'ema2': 38, 'slip_atr_k': 0.04627300034103855, 'slip_spread_k': 0.08865572733672056, 'spread_hl_frac': 0.022845827701751156, 'bb_std_mult': 1.186748217422763, 'rsi_os': 41, 'rsi_ob': 81, 'vol_spike': 0.28911698263019997, 'adx_thresh': 23.081001806321478, 'atr_min_pct': 0.004679963336123274, 'atr_max_pct': 0.11512138331672689, 'tp_mult': 2.9549471902358513, 'tsl_mult': 0.049739394945768706, 'strategy': 'mean_reversion', 'time_stop': 133, 'use_sma': False, 'use_atr': False, 'use_adx': False, 'use_ema': True, 'use_spike': False, 'rsi_required': True, 'edge_k': 1.864115944527285, 'edge_cap': 0.29920976107111497, 'bull_strategy': 'mean_reversion', 'bull_bb_std_mult': 1.9147793188972306, 'bull_rsi_os': 28, 'bull_rsi_ob': 64, 'bull_adx_thresh': 14.387897440728569, 'bull_atr_min_pct': 0.009763486766103854, 'bull_atr_max_pct': 0.08756148029009117, 'bull_tp_mult': 2.139738684072683, 'bull_tsl_mult': 0.9339320001633842, 'bull_time_stop': 52, 'bull_use_sma': True, 'bull_use_ema': True, 'bull_use_atr': True, 'bull_use_adx': False, 'bull_use_spike': True, 'bull_rsi_required': False, 'bear_strategy': 'mean_reversion', 'bear_bb_std_mult': 2.962556226390051, 'bear_rsi_os': 32, 'bear_rsi_ob': 80, 'bear_adx_thresh': 22.74864550974361, 'bear_atr_min_pct': 0.007705367146688595, 'bear_atr_max_pct': 0.10893562102138618, 'bear_tp_mult': 1.9451951854335496, 'bear_tsl_mult': 0.3606315373208242, 'bear_time_stop': 127, 'bear_use_sma': False, 'bear_use_ema': True, 'bear_use_atr': False, 'bear_use_adx': True, 'bear_use_spike': True, 'bear_rsi_required': True, 'sideways_strategy': 'mean_reversion', 'sideways_bb_std_mult': 0.8379251395370473, 'sideways_rsi_os': 22, 'sideways_rsi_ob': 95, 'sideways_adx_thresh': 30.69621185305667, 'sideways_atr_min_pct': 0.020667792429722665, 'sideways_atr_max_pct': 0.1154271408751958, 'sideways_tp_mult': 2.9936221606074898, 'sideways_tsl_mult': 0.05466918942294226, 'sideways_time_stop': 225, 'sideways_use_sma': True, 'sideways_use_ema': False, 'sideways_use_atr': True, 'sideways_use_adx': False, 'sideways_use_spike': True, 'sideways_rsi_required': True}.
