[I 2025-08-31 10:05:37,639] Trial 353 finished with values: [-1000000000.0, 1000000000.0] and parameters: {'p_sma': 15, 'p_std': 15, 'p_atr': 9, 'p_adx': 18, 'rsi_period': 21, 'ema1': 20, 'ema2': 39, 'slip_atr_k': 0.031984238231452966, 'slip_spread_k': 0.4070843095869991, 'spread_hl_frac': 0.037163443743129215, 'bb_std_mult': 0.8623529019302498, 'rsi_os': 22, 'rsi_ob': 48, 'vol_spike': 0.13701339892677586, 'adx_thresh': 33.90221369436491, 'atr_min_pct': 0.009734532139171347, 'atr_max_pct': 0.02620598550379471, 'tp_mult': 1.5516954943233172, 'tsl_mult': 0.7117974661775546, 'strategy': 'mean_reversion', 'time_stop': 281, 'use_sma': True, 'use_atr': True, 'use_adx': False, 'use_ema': True, 'use_spike': False, 'rsi_required': False, 'edge_k': 1.9385012596107987, 'edge_cap': 0.1488704191451872, 'bull_strategy': 'breakout', 'bull_bb_std_mult': 0.6584296601267379, 'bull_rsi_os': 33, 'bull_rsi_ob': 88, 'bull_adx_thresh': 14.371026993414837, 'bull_atr_min_pct': 0.01732387902087843, 'bull_atr_max_pct': 0.08844761920114592, 'bull_tp_mult': 1.5060522020662979, 'bull_tsl_mult': 0.15347758927813487, 'bull_time_stop': 263, 'bull_use_sma': True, 'bull_use_ema': True, 'bull_use_atr': True, 'bull_use_adx': True, 'bull_use_spike': True, 'bull_rsi_required': True, 'bear_strategy': 'breakout', 'bear_bb_std_mult': 2.8574570061292923, 'bear_rsi_os': 53, 'bear_rsi_ob': 76, 'bear_adx_thresh': 34.92230116557331, 'bear_atr_min_pct': 0.004990022635928577, 'bear_atr_max_pct': 0.024710554064194527, 'bear_tp_mult': 2.684951712730786, 'bear_tsl_mult': 0.6946572968531672, 'bear_time_stop': 248, 'bear_use_sma': True, 'bear_use_ema': True, 'bear_use_atr': False, 'bear_use_adx': False, 'bear_use_spike': True, 'bear_rsi_required': False, 'sideways_strategy': 'mean_reversion', 'sideways_bb_std_mult': 3.058400416891764, 'sideways_rsi_os': 40, 'sideways_rsi_ob': 95, 'sideways_adx_thresh': 33.351408865218175, 'sideways_atr_min_pct': 0.0029864257957999013, 'sideways_atr_max_pct': 0.05428687556699062, 'sideways_tp_mult': 2.2312817977292974, 'sideways_tsl_mult': 0.9730769779411712, 'sideways_time_stop': 224, 'sideways_use_sma': True, 'sideways_use_ema': True, 'sideways_use_atr': True, 'sideways_use_adx': True, 'sideways_use_spike': False, 'sideways_rsi_required': True}.
[I 2025-08-31 10:05:37,673] Trial 354 finished with values: [-1000000000.0, 1000000000.0] and parameters: {'p_sma': 48, 'p_std': 21, 'p_atr': 30, 'p_adx': 10, 'rsi_period': 21, 'ema1': 20, 'ema2': 55, 'slip_atr_k': 0.03323948398265522, 'slip_spread_k': 0.365775897767349, 'spread_hl_frac': 0.014885257696371598, 'bb_std_mult': 0.8326344278786907, 'rsi_os': 31, 'rsi_ob': 50, 'vol_spike': 0.14073570569471536, 'adx_thresh': 5.040800660416728, 'atr_min_pct': 0.009718143087025732, 'atr_max_pct': 0.1359703652433082, 'tp_mult': 2.2785584272621513, 'tsl_mult': 0.35928586035713717, 'strategy': 'mean_reversion', 'time_stop': 162, 'use_sma': True, 'use_atr': True, 'use_adx': False, 'use_ema': True, 'use_spike': False, 'rsi_required': True, 'edge_k': 1.9382905446754861, 'edge_cap': 0.14760368425003598, 'bull_strategy': 'breakout', 'bull_bb_std_mult': 1.2380531886476296, 'bull_rsi_os': 33, 'bull_rsi_ob': 67, 'bull_adx_thresh': 33.19203837432604, 'bull_atr_min_pct': 0.028121369149546386, 'bull_atr_max_pct': 0.1196744820762019, 'bull_tp_mult': 1.5012120694301603, 'bull_tsl_mult': 0.09853347977397142, 'bull_time_stop': 265, 'bull_use_sma': True, 'bull_use_ema': True, 'bull_use_atr': True, 'bull_use_adx': True, 'bull_use_spike': True, 'bull_rsi_required': True, 'bear_strategy': 'breakout', 'bear_bb_std_mult': 1.4588613962740247, 'bear_rsi_os': 53, 'bear_rsi_ob': 77, 'bear_adx_thresh': 23.734076208561852, 'bear_atr_min_pct': 0.008704086412184522, 'bear_atr_max_pct': 0.1333267867219873, 'bear_tp_mult': 2.314239648743275, 'bear_tsl_mult': 0.7085537290083588, 'bear_time_stop': 248, 'bear_use_sma': True, 'bear_use_ema': False, 'bear_use_atr': False, 'bear_use_adx': False, 'bear_use_spike': True, 'bear_rsi_required': False, 'sideways_strategy': 'mean_reversion', 'sideways_bb_std_mult': 1.2387035999427303, 'sideways_rsi_os': 27, 'sideways_rsi_ob': 71, 'sideways_adx_thresh': 32.905648510470705, 'sideways_atr_min_pct': 0.012067276176097812, 'sideways_atr_max_pct': 0.054679725156164566, 'sideways_tp_mult': 1.636979807740042, 'sideways_tsl_mult': 0.23915851013768485, 'sideways_time_stop': 163, 'sideways_use_sma': True, 'sideways_use_ema': True, 'sideways_use_atr': True, 'sideways_use_adx': True, 'sideways_use_spike': False, 'sideways_rsi_required': True}.
[I 2025-08-31 10:06:06,005] Trial 352 finished with values: [-1000000000.0, 1000000000.0] and parameters: {'p_sma': 51, 'p_std': 15, 'p_atr': 9, 'p_adx': 9, 'rsi_period': 21, 'ema1': 22, 'ema2': 39, 'slip_atr_k': 0.16211740210555123, 'slip_spread_k': 0.6681788329692763, 'spread_hl_frac': 0.004574934000479973, 'bb_std_mult': 0.8260844381843737, 'rsi_os': 55, 'rsi_ob': 76, 'vol_spike': 0.13627306976724743, 'adx_thresh': 6.124319921154396, 'atr_min_pct': 0.01019543547263288, 'atr_max_pct': 0.023826141932567824, 'tp_mult': 2.647998247760625, 'tsl_mult': 0.7742437401561418, 'strategy': 'breakout', 'time_stop': 282, 'use_sma': True, 'use_atr': True, 'use_adx': False, 'use_ema': True, 'use_spike': False, 'rsi_required': False, 'edge_k': 1.9374556172040296, 'edge_cap': 0.6761823317620885, 'bull_strategy': 'breakout', 'bull_bb_std_mult': 1.3599727095753646, 'bull_rsi_os': 7, 'bull_rsi_ob': 84, 'bull_adx_thresh': 31.570682475219208, 'bull_atr_min_pct': 0.021199842987908016, 'bull_atr_max_pct': 0.11983328610566205, 'bull_tp_mult': 1.5155621258630059, 'bull_tsl_mult': 0.5970976700205094, 'bull_time_stop': 242, 'bull_use_sma': True, 'bull_use_ema': True, 'bull_use_atr': False, 'bull_use_adx': True, 'bull_use_spike': True, 'bull_rsi_required': False, 'bear_strategy': 'breakout', 'bear_bb_std_mult': 3.047674025833304, 'bear_rsi_os': 9, 'bear_rsi_ob': 89, 'bear_adx_thresh': 19.699606313401254, 'bear_atr_min_pct': 0.02131199598399269, 'bear_atr_max_pct': 0.0961612071743366, 'bear_tp_mult': 2.681893469899822, 'bear_tsl_mult': 0.2701880964517065, 'bear_time_stop': 16, 'bear_use_sma': False, 'bear_use_ema': True, 'bear_use_atr': False, 'bear_use_adx': False, 'bear_use_spike': True, 'bear_rsi_required': False, 'sideways_strategy': 'breakout', 'sideways_bb_std_mult': 3.050341921462455, 'sideways_rsi_os': 30, 'sideways_rsi_ob': 95, 'sideways_adx_thresh': 24.568474139682127, 'sideways_atr_min_pct': 0.011976087362665734, 'sideways_atr_max_pct': 0.0263464993190227, 'sideways_tp_mult': 1.6426170106976457, 'sideways_tsl_mult': 0.11160023663518073, 'sideways_time_stop': 226, 'sideways_use_sma': True, 'sideways_use_ema': True, 'sideways_use_atr': True, 'sideways_use_adx': True, 'sideways_use_spike': False, 'sideways_rsi_required': False}.
[I 2025-08-31 10:06:06,187] Trial 351 finished with values: [-1000000000.0, 1000000000.0] and parameters: {'p_sma': 13, 'p_std': 21, 'p_atr': 7, 'p_adx': 28, 'rsi_period': 22, 'ema1': 22, 'ema2': 39, 'slip_atr_k': 0.16783302901633748, 'slip_spread_k': 0.6758159408337017, 'spread_hl_frac': 0.01474093214913671, 'bb_std_mult': 0.8445537116111772, 'rsi_os': 22, 'rsi_ob': 49, 'vol_spike': 0.13801116506907385, 'adx_thresh': 9.609218877700423, 'atr_min_pct': 0.01034261800325307, 'atr_max_pct': 0.13333468518244984, 'tp_mult': 2.956758278251297, 'tsl_mult': 0.06884438088093589, 'strategy': 'breakout', 'time_stop': 282, 'use_sma': True, 'use_atr': True, 'use_adx': False, 'use_ema': True, 'use_spike': False, 'rsi_required': False, 'edge_k': 1.7404398650440482, 'edge_cap': 0.15141566050268968, 'bull_strategy': 'breakout', 'bull_bb_std_mult': 0.5491425198241704, 'bull_rsi_os': 33, 'bull_rsi_ob': 67, 'bull_adx_thresh': 15.671591288064585, 'bull_atr_min_pct': 0.018782214944336673, 'bull_atr_max_pct': 0.08734798613509483, 'bull_tp_mult': 1.5147831054599246, 'bull_tsl_mult': 0.4375628215486268, 'bull_time_stop': 264, 'bull_use_sma': True, 'bull_use_ema': True, 'bull_use_atr': False, 'bull_use_adx': True, 'bull_use_spike': True, 'bull_rsi_required': False, 'bear_strategy': 'breakout', 'bear_bb_std_mult': 2.3127655970794994, 'bear_rsi_os': 53, 'bear_rsi_ob': 89, 'bear_adx_thresh': 21.883196276993665, 'bear_atr_min_pct': 0.021260112781119254, 'bear_atr_max_pct': 0.08987947787029427, 'bear_tp_mult': 2.6816847484605706, 'bear_tsl_mult': 0.3338070258648905, 'bear_time_stop': 220, 'bear_use_sma': False, 'bear_use_ema': True, 'bear_use_atr': False, 'bear_use_adx': False, 'bear_use_spike': True, 'bear_rsi_required': False, 'sideways_strategy': 'breakout', 'sideways_bb_std_mult': 0.5891804905915687, 'sideways_rsi_os': 30, 'sideways_rsi_ob': 90, 'sideways_adx_thresh': 30.530075764041385, 'sideways_atr_min_pct': 0.003009877195679504, 'sideways_atr_max_pct': 0.13717984567677066, 'sideways_tp_mult': 2.240196792326661, 'sideways_tsl_mult': 0.2591958859809833, 'sideways_time_stop': 224, 'sideways_use_sma': True, 'sideways_use_ema': True, 'sideways_use_atr': True, 'sideways_use_adx': True, 'sideways_use_spike': False, 'sideways_rsi_required': False}.
[I 2025-08-31 10:06:09,632] Trial 355 finished with values: [-1000000000.0, 1000000000.0] and parameters: {'p_sma': 51, 'p_std': 14, 'p_atr': 29, 'p_adx': 10, 'rsi_period': 22, 'ema1': 19, 'ema2': 38, 'slip_atr_k': 0.22714096623215507, 'slip_spread_k': 0.6762953693097696, 'spread_hl_frac': 0.004196800404595746, 'bb_std_mult': 1.0787560895083936, 'rsi_os': 55, 'rsi_ob': 46, 'vol_spike': 0.11902657987317121, 'adx_thresh': 26.95442232640832, 'atr_min_pct': 0.010998134526017278, 'atr_max_pct': 0.07864025101660065, 'tp_mult': 2.8261965726552742, 'tsl_mult': 0.001972765447573784, 'strategy': 'breakout', 'time_stop': 153, 'use_sma': True, 'use_atr': True, 'use_adx': False, 'use_ema': False, 'use_spike': False, 'rsi_required': True, 'edge_k': 0.4274698309486863, 'edge_cap': 0.7447805303170179, 'bull_strategy': 'breakout', 'bull_bb_std_mult': 1.399878940373193, 'bull_rsi_os': 32, 'bull_rsi_ob': 48, 'bull_adx_thresh': 30.46860751247909, 'bull_atr_min_pct': 0.021075852378443727, 'bull_atr_max_pct': 0.07534025106215299, 'bull_tp_mult': 1.452909581496111, 'bull_tsl_mult': 0.614764781151359, 'bull_time_stop': 57, 'bull_use_sma': True, 'bull_use_ema': False, 'bull_use_atr': False, 'bull_use_adx': True, 'bull_use_spike': True, 'bull_rsi_required': True, 'bear_strategy': 'breakout', 'bear_bb_std_mult': 0.9041553714143677, 'bear_rsi_os': 53, 'bear_rsi_ob': 78, 'bear_adx_thresh': 23.641157435793954, 'bear_atr_min_pct': 0.02159376237286838, 'bear_atr_max_pct': 0.1412127449463063, 'bear_tp_mult': 1.5489015228973204, 'bear_tsl_mult': 0.24269968892438104, 'bear_time_stop': 214, 'bear_use_sma': False, 'bear_use_ema': False, 'bear_use_atr': False, 'bear_use_adx': True, 'bear_use_spike': False, 'bear_rsi_required': False, 'sideways_strategy': 'breakout', 'sideways_bb_std_mult': 1.1541441100441632, 'sideways_rsi_os': 46, 'sideways_rsi_ob': 68, 'sideways_adx_thresh': 30.2620046057283, 'sideways_atr_min_pct': 0.011692727822259536, 'sideways_atr_max_pct': 0.0634110189454515, 'sideways_tp_mult': 1.6534613072645576, 'sideways_tsl_mult': 0.10575451639604665, 'sideways_time_stop': 249, 'sideways_use_sma': True, 'sideways_use_ema': True, 'sideways_use_atr': True, 'sideways_use_adx': True, 'sideways_use_spike': False, 'sideways_rsi_required': False}.
[I 2025-08-31 10:06:09,956] Trial 356 finished with values: [-1000000000.0, 1000000000.0] and parameters: {'p_sma': 51, 'p_std': 17, 'p_atr': 8, 'p_adx': 19, 'rsi_period': 66, 'ema1': 19, 'ema2': 39, 'slip_atr_k': 0.22774541962783446, 'slip_spread_k': 0.4370264583784661, 'spread_hl_frac': 0.030223974246870886, 'bb_std_mult': 2.2702203722824805, 'rsi_os': 21, 'rsi_ob': 62, 'vol_spike': 0.11890652165262396, 'adx_thresh': 11.82988788096969, 'atr_min_pct': 0.010316239401302947, 'atr_max_pct': 0.12408858921491332, 'tp_mult': 2.655731412826987, 'tsl_mult': 0.03785332378524828, 'strategy': 'breakout', 'time_stop': 47, 'use_sma': False, 'use_atr': False, 'use_adx': False, 'use_ema': False, 'use_spike': False, 'rsi_required': True, 'edge_k': 1.7326415940853017, 'edge_cap': 0.09719997559022099, 'bull_strategy': 'mean_reversion', 'bull_bb_std_mult': 1.400567545902639, 'bull_rsi_os': 32, 'bull_rsi_ob': 59, 'bull_adx_thresh': 26.114731836930282, 'bull_atr_min_pct': 0.019023622376662937, 'bull_atr_max_pct': 0.11169043487248478, 'bull_tp_mult': 1.357251239909453, 'bull_tsl_mult': 0.9371199900378393, 'bull_time_stop': 245, 'bull_use_sma': True, 'bull_use_ema': False, 'bull_use_atr': False, 'bull_use_adx': False, 'bull_use_spike': False, 'bull_rsi_required': True, 'bear_strategy': 'breakout', 'bear_bb_std_mult': 2.7388594303637177, 'bear_rsi_os': 38, 'bear_rsi_ob': 79, 'bear_adx_thresh': 21.72947902718748, 'bear_atr_min_pct': 0.024488663046020168, 'bear_atr_max_pct': 0.08235447377355452, 'bear_tp_mult': 2.565374198400064, 'bear_tsl_mult': 0.5255102993060453, 'bear_time_stop': 259, 'bear_use_sma': False, 'bear_use_ema': True, 'bear_use_atr': False, 'bear_use_adx': True, 'bear_use_spike': False, 'bear_rsi_required': True, 'sideways_strategy': 'breakout', 'sideways_bb_std_mult': 3.1304700409986372, 'sideways_rsi_os': 24, 'sideways_rsi_ob': 63, 'sideways_adx_thresh': 22.918920053161166, 'sideways_atr_min_pct': 0.0035764907753296255, 'sideways_atr_max_pct': 0.02687313985321246, 'sideways_tp_mult': 1.5217724834813382, 'sideways_tsl_mult': 0.1114604134590197, 'sideways_time_stop': 232, 'sideways_use_sma': True, 'sideways_use_ema': True, 'sideways_use_atr': False, 'sideways_use_adx': False, 'sideways_use_spike': True, 'sideways_rsi_required': False}.
[I 2025-08-31 10:06:41,531] Trial 357 finished with values: [-1000000000.0, 1000000000.0] and parameters: {'p_sma': 12, 'p_std': 14, 'p_atr': 28, 'p_adx': 28, 'rsi_period': 66, 'ema1': 15, 'ema2': 18, 'slip_atr_k': 0.10742271692225348, 'slip_spread_k': 0.43141715677689524, 'spread_hl_frac': 0.030203488573764627, 'bb_std_mult': 1.077615589098178, 'rsi_os': 21, 'rsi_ob': 88, 'vol_spike': 0.11986282956894456, 'adx_thresh': 26.759256819933324, 'atr_min_pct': 0.022656232938162345, 'atr_max_pct': 0.13853638579127794, 'tp_mult': 2.8108271774653324, 'tsl_mult': 0.43132844258954434, 'strategy': 'breakout', 'time_stop': 106, 'use_sma': False, 'use_atr': False, 'use_adx': False, 'use_ema': False, 'use_spike': False, 'rsi_required': True, 'edge_k': 1.8110040975978516, 'edge_cap': 0.17162926128930123, 'bull_strategy': 'mean_reversion', 'bull_bb_std_mult': 1.4115410824569692, 'bull_rsi_os': 32, 'bull_rsi_ob': 59, 'bull_adx_thresh': 30.570947649539587, 'bull_atr_min_pct': 0.029975935377234843, 'bull_atr_max_pct': 0.11204083492287015, 'bull_tp_mult': 1.7821263597164372, 'bull_tsl_mult': 0.615278938024401, 'bull_time_stop': 60, 'bull_use_sma': True, 'bull_use_ema': False, 'bull_use_atr': False, 'bull_use_adx': False, 'bull_use_spike': False, 'bull_rsi_required': True, 'bear_strategy': 'breakout', 'bear_bb_std_mult': 0.8807995494241334, 'bear_rsi_os': 17, 'bear_rsi_ob': 65, 'bear_adx_thresh': 12.305130156362225, 'bear_atr_min_pct': 0.003633361882070708, 'bear_atr_max_pct': 0.14114577831450606, 'bear_tp_mult': 2.6161813704773937, 'bear_tsl_mult': 0.22595688729252583, 'bear_time_stop': 259, 'bear_use_sma': False, 'bear_use_ema': True, 'bear_use_atr': False, 'bear_use_adx': True, 'bear_use_spike': False, 'bear_rsi_required': True, 'sideways_strategy': 'breakout', 'sideways_bb_std_mult': 1.1778961575691027, 'sideways_rsi_os': 25, 'sideways_rsi_ob': 90, 'sideways_adx_thresh': 32.45639842668562, 'sideways_atr_min_pct': 0.0035600301029627447, 'sideways_atr_max_pct': 0.08881948291938929, 'sideways_tp_mult': 1.482717885368527, 'sideways_tsl_mult': 0.2709113995284691, 'sideways_time_stop': 190, 'sideways_use_sma': True, 'sideways_use_ema': True, 'sideways_use_atr': False, 'sideways_use_adx': False, 'sideways_use_spike': True, 'sideways_rsi_required': False}.
[I 2025-08-31 10:06:41,691] Trial 358 finished with values: [-1000000000.0, 1000000000.0] and parameters: {'p_sma': 47, 'p_std': 12, 'p_atr': 17, 'p_adx': 13, 'rsi_period': 81, 'ema1': 15, 'ema2': 14, 'slip_atr_k': 0.24961452915799365, 'slip_spread_k': 0.17227702121689664, 'spread_hl_frac': 0.010917603239697376, 'bb_std_mult': 1.1001669043010218, 'rsi_os': 21, 'rsi_ob': 51, 'vol_spike': 0.2103193564863537, 'adx_thresh': 27.576962966215625, 'atr_min_pct': 0.011083486320833953, 'atr_max_pct': 0.13803348490659412, 'tp_mult': 2.8227174371562973, 'tsl_mult': 0.0001630301836269391, 'strategy': 'breakout', 'time_stop': 151, 'use_sma': False, 'use_atr': False, 'use_adx': False, 'use_ema': False, 'use_spike': False, 'rsi_required': True, 'edge_k': 1.0422269820568615, 'edge_cap': 0.1014268756531609, 'bull_strategy': 'mean_reversion', 'bull_bb_std_mult': 0.9077675420942215, 'bull_rsi_os': 32, 'bull_rsi_ob': 68, 'bull_adx_thresh': 25.322805011772875, 'bull_atr_min_pct': 0.019661779388936682, 'bull_atr_max_pct': 0.144609644667225, 'bull_tp_mult': 1.445539514832459, 'bull_tsl_mult': 0.9304734890100783, 'bull_time_stop': 57, 'bull_use_sma': True, 'bull_use_ema': False, 'bull_use_atr': False, 'bull_use_adx': False, 'bull_use_spike': False, 'bull_rsi_required': True, 'bear_strategy': 'breakout', 'bear_bb_std_mult': 0.7768447426274694, 'bear_rsi_os': 38, 'bear_rsi_ob': 65, 'bear_adx_thresh': 21.944921092330755, 'bear_atr_min_pct': 0.019950192060718464, 'bear_atr_max_pct': 0.08240785186802169, 'bear_tp_mult': 2.5380905668690845, 'bear_tsl_mult': 0.528489617833341, 'bear_time_stop': 116, 'bear_use_sma': False, 'bear_use_ema': False, 'bear_use_atr': False, 'bear_use_adx': True, 'bear_use_spike': False, 'bear_rsi_required': True, 'sideways_strategy': 'breakout', 'sideways_bb_std_mult': 1.1469368427793558, 'sideways_rsi_os': 26, 'sideways_rsi_ob': 68, 'sideways_adx_thresh': 32.41810527855473, 'sideways_atr_min_pct': 0.0023510024127235477, 'sideways_atr_max_pct': 0.0898901065228727, 'sideways_tp_mult': 1.4833064101652707, 'sideways_tsl_mult': 0.08725460367702526, 'sideways_time_stop': 189, 'sideways_use_sma': True, 'sideways_use_ema': True, 'sideways_use_atr': False, 'sideways_use_adx': False, 'sideways_use_spike': True, 'sideways_rsi_required': False}.
[I 2025-08-31 10:06:41,989] Trial 360 finished with values: [-0.021793960973918947, 0.02181258122606287] and parameters: {'p_sma': 47, 'p_std': 12, 'p_atr': 15, 'p_adx': 29, 'rsi_period': 19, 'ema1': 17, 'ema2': 14, 'slip_atr_k': 0.05227536481942409, 'slip_spread_k': 0.1318467903124509, 'spread_hl_frac': 0.01297341698953292, 'bb_std_mult': 3.4839998095493865, 'rsi_os': 50, 'rsi_ob': 81, 'vol_spike': 0.1298977255132123, 'adx_thresh': 28.969236474597263, 'atr_min_pct': 0.012179084836011479, 'atr_max_pct': 0.13952786969535008, 'tp_mult': 2.759121928397063, 'tsl_mult': 0.4389468642875753, 'strategy': 'breakout', 'time_stop': 180, 'use_sma': False, 'use_atr': False, 'use_adx': False, 'use_ema': False, 'use_spike': False, 'rsi_required': True, 'edge_k': 1.8124147195014153, 'edge_cap': 0.05619564488787917, 'bull_strategy': 'mean_reversion', 'bull_bb_std_mult': 1.2317777559086205, 'bull_rsi_os': 34, 'bull_rsi_ob': 64, 'bull_adx_thresh': 9.312163373445602, 'bull_atr_min_pct': 0.029946154619434007, 'bull_atr_max_pct': 0.10506131598535048, 'bull_tp_mult': 1.620634826339554, 'bull_tsl_mult': 0.36550749602276617, 'bull_time_stop': 117, 'bull_use_sma': True, 'bull_use_ema': False, 'bull_use_atr': True, 'bull_use_adx': False, 'bull_use_spike': False, 'bull_rsi_required': True, 'bear_strategy': 'breakout', 'bear_bb_std_mult': 2.841511371938966, 'bear_rsi_os': 54, 'bear_rsi_ob': 64, 'bear_adx_thresh': 12.24645859028471, 'bear_atr_min_pct': 0.01876239392687423, 'bear_atr_max_pct': 0.12029662503128645, 'bear_tp_mult': 2.619462720365165, 'bear_tsl_mult': 0.5930468002009143, 'bear_time_stop': 234, 'bear_use_sma': True, 'bear_use_ema': True, 'bear_use_atr': True, 'bear_use_adx': True, 'bear_use_spike': False, 'bear_rsi_required': True, 'sideways_strategy': 'mean_reversion', 'sideways_bb_std_mult': 1.0241837035619277, 'sideways_rsi_os': 25, 'sideways_rsi_ob': 82, 'sideways_adx_thresh': 7.686728917097211, 'sideways_atr_min_pct': 0.0007319695383019651, 'sideways_atr_max_pct': 0.0965802813297726, 'sideways_tp_mult': 1.8369211943687511, 'sideways_tsl_mult': 0.06016205256334606, 'sideways_time_stop': 241, 'sideways_use_sma': False, 'sideways_use_ema': False, 'sideways_use_atr': False, 'sideways_use_adx': False, 'sideways_use_spike': True, 'sideways_rsi_required': True}.
