[I 2025-08-31 09:47:26,785] Trial 208 finished with values: [-1000000000.0, 1000000000.0] and parameters: {'p_sma': 23, 'p_std': 41, 'p_atr': 29, 'p_adx': 12, 'rsi_period': 23, 'ema1': 19, 'ema2': 11, 'slip_atr_k': 0.1632749161289737, 'slip_spread_k': 0.4646394104081335, 'spread_hl_frac': 0.017518858915947944, 'bb_std_mult': 1.335211052026795, 'rsi_os': 19, 'rsi_ob': 48, 'vol_spike': 0.13572608207476497, 'adx_thresh': 11.904775288067878, 'atr_min_pct': 0.0010156902150999826, 'atr_max_pct': 0.13507548696263652, 'tp_mult': 2.909622299241212, 'tsl_mult': 0.594877272452727, 'strategy': 'mean_reversion', 'time_stop': 168, 'use_sma': False, 'use_atr': False, 'use_adx': False, 'use_ema': False, 'use_spike': False, 'rsi_required': True, 'edge_k': 1.3128211980811793, 'edge_cap': 0.5177308036379267, 'bull_strategy': 'mean_reversion', 'bull_bb_std_mult': 1.103696918092947, 'bull_rsi_os': 31, 'bull_rsi_ob': 64, 'bull_adx_thresh': 31.245327109244908, 'bull_atr_min_pct': 0.001113788183113553, 'bull_atr_max_pct': 0.13456452150721027, 'bull_tp_mult': 1.504595746745403, 'bull_tsl_mult': 0.9999699914568214, 'bull_time_stop': 60, 'bull_use_sma': True, 'bull_use_ema': False, 'bull_use_atr': False, 'bull_use_adx': False, 'bull_use_spike': True, 'bull_rsi_required': False, 'bear_strategy': 'breakout', 'bear_bb_std_mult': 3.342147034241985, 'bear_rsi_os': 39, 'bear_rsi_ob': 82, 'bear_adx_thresh': 33.16955494595629, 'bear_atr_min_pct': 0.009860110308131961, 'bear_atr_max_pct': 0.12628750306482453, 'bear_tp_mult': 2.6269141165615637, 'bear_tsl_mult': 0.5391764594203348, 'bear_time_stop': 235, 'bear_use_sma': False, 'bear_use_ema': True, 'bear_use_atr': True, 'bear_use_adx': True, 'bear_use_spike': False, 'bear_rsi_required': True, 'sideways_strategy': 'breakout', 'sideways_bb_std_mult': 1.1430678426316352, 'sideways_rsi_os': 35, 'sideways_rsi_ob': 64, 'sideways_adx_thresh': 32.278478388136485, 'sideways_atr_min_pct': 0.0015978749004239773, 'sideways_atr_max_pct': 0.01179200056485798, 'sideways_tp_mult': 1.5067996550282432, 'sideways_tsl_mult': 0.0006267865857671473, 'sideways_time_stop': 266, 'sideways_use_sma': False, 'sideways_use_ema': False, 'sideways_use_atr': True, 'sideways_use_adx': False, 'sideways_use_spike': False, 'sideways_rsi_required': False}.
[I 2025-08-31 09:47:26,793] Trial 209 finished with values: [-1000000000.0, 1000000000.0] and parameters: {'p_sma': 44, 'p_std': 14, 'p_atr': 29, 'p_adx': 12, 'rsi_period': 23, 'ema1': 21, 'ema2': 22, 'slip_atr_k': 0.18801223660501976, 'slip_spread_k': 0.45815532781076, 'spread_hl_frac': 0.017181470605779573, 'bb_std_mult': 0.9285868292818815, 'rsi_os': 21, 'rsi_ob': 48, 'vol_spike': 0.14476980096467865, 'adx_thresh': 6.814920180776092, 'atr_min_pct': 0.022466291640313957, 'atr_max_pct': 0.13339433409462126, 'tp_mult': 2.9414820836570836, 'tsl_mult': 0.023076120223887307, 'strategy': 'mean_reversion', 'time_stop': 122, 'use_sma': False, 'use_atr': False, 'use_adx': False, 'use_ema': False, 'use_spike': False, 'rsi_required': True, 'edge_k': 1.8502040189013778, 'edge_cap': 0.7193329168544389, 'bull_strategy': 'mean_reversion', 'bull_bb_std_mult': 1.1885865541062655, 'bull_rsi_os': 31, 'bull_rsi_ob': 65, 'bull_adx_thresh': 5.2048844073647444, 'bull_atr_min_pct': 0.0029238907331542528, 'bull_atr_max_pct': 0.12397603152162395, 'bull_tp_mult': 1.335393660638469, 'bull_tsl_mult': 0.6176619531233308, 'bull_time_stop': 145, 'bull_use_sma': True, 'bull_use_ema': False, 'bull_use_atr': False, 'bull_use_adx': False, 'bull_use_spike': True, 'bull_rsi_required': False, 'bear_strategy': 'breakout', 'bear_bb_std_mult': 1.690943081222802, 'bear_rsi_os': 52, 'bear_rsi_ob': 48, 'bear_adx_thresh': 33.263443100676305, 'bear_atr_min_pct': 0.005663101944319109, 'bear_atr_max_pct': 0.11294569746134198, 'bear_tp_mult': 2.6022538204135164, 'bear_tsl_mult': 0.5320201537299318, 'bear_time_stop': 235, 'bear_use_sma': False, 'bear_use_ema': True, 'bear_use_atr': True, 'bear_use_adx': True, 'bear_use_spike': False, 'bear_rsi_required': True, 'sideways_strategy': 'breakout', 'sideways_bb_std_mult': 1.2299335941113798, 'sideways_rsi_os': 23, 'sideways_rsi_ob': 64, 'sideways_adx_thresh': 31.9627617733096, 'sideways_atr_min_pct': 0.021636492093515473, 'sideways_atr_max_pct': 0.011254251354276823, 'sideways_tp_mult': 2.6781497958877725, 'sideways_tsl_mult': 0.15200839848956726, 'sideways_time_stop': 152, 'sideways_use_sma': False, 'sideways_use_ema': False, 'sideways_use_atr': True, 'sideways_use_adx': False, 'sideways_use_spike': False, 'sideways_rsi_required': False}.
[I 2025-08-31 09:48:00,090] Trial 210 finished with values: [-0.04163262852397742, 0.041429785229597615] and parameters: {'p_sma': 23, 'p_std': 12, 'p_atr': 29, 'p_adx': 9, 'rsi_period': 23, 'ema1': 19, 'ema2': 22, 'slip_atr_k': 0.18848154990679952, 'slip_spread_k': 0.0054996756125058055, 'spread_hl_frac': 0.015524801013146086, 'bb_std_mult': 1.0051139677971666, 'rsi_os': 19, 'rsi_ob': 90, 'vol_spike': 0.13667433125499556, 'adx_thresh': 6.651059021704725, 'atr_min_pct': 7.721195312138628e-05, 'atr_max_pct': 0.12389806664170386, 'tp_mult': 2.919035528049516, 'tsl_mult': 0.021160055828642103, 'strategy': 'mean_reversion', 'time_stop': 139, 'use_sma': False, 'use_atr': False, 'use_adx': True, 'use_ema': False, 'use_spike': False, 'rsi_required': True, 'edge_k': 1.1959649776212795, 'edge_cap': 0.09636380093553007, 'bull_strategy': 'mean_reversion', 'bull_bb_std_mult': 1.0804065728829986, 'bull_rsi_os': 31, 'bull_rsi_ob': 64, 'bull_adx_thresh': 33.487323576435514, 'bull_atr_min_pct': 0.02501108733045599, 'bull_atr_max_pct': 0.09027720977825393, 'bull_tp_mult': 1.3344247241331821, 'bull_tsl_mult': 0.871376725988632, 'bull_time_stop': 142, 'bull_use_sma': True, 'bull_use_ema': False, 'bull_use_atr': False, 'bull_use_adx': False, 'bull_use_spike': True, 'bull_rsi_required': False, 'bear_strategy': 'breakout', 'bear_bb_std_mult': 2.914281926260831, 'bear_rsi_os': 52, 'bear_rsi_ob': 82, 'bear_adx_thresh': 20.247057538841503, 'bear_atr_min_pct': 0.012562043003888359, 'bear_atr_max_pct': 0.05318299802619995, 'bear_tp_mult': 2.600975961151065, 'bear_tsl_mult': 0.5861882543346268, 'bear_time_stop': 232, 'bear_use_sma': True, 'bear_use_ema': True, 'bear_use_atr': True, 'bear_use_adx': False, 'bear_use_spike': False, 'bear_rsi_required': True, 'sideways_strategy': 'mean_reversion', 'sideways_bb_std_mult': 1.2296268904671557, 'sideways_rsi_os': 29, 'sideways_rsi_ob': 46, 'sideways_adx_thresh': 32.05642365681516, 'sideways_atr_min_pct': 0.002211083579033232, 'sideways_atr_max_pct': 0.01924720448676484, 'sideways_tp_mult': 1.1519391120818496, 'sideways_tsl_mult': 0.09466582742212391, 'sideways_time_stop': 146, 'sideways_use_sma': False, 'sideways_use_ema': False, 'sideways_use_atr': True, 'sideways_use_adx': False, 'sideways_use_spike': False, 'sideways_rsi_required': True}.
[I 2025-08-31 09:48:01,291] Trial 207 finished with values: [-1000000000.0, 1000000000.0] and parameters: {'p_sma': 48, 'p_std': 14, 'p_atr': 29, 'p_adx': 9, 'rsi_period': 72, 'ema1': 19, 'ema2': 39, 'slip_atr_k': 0.1636808255668568, 'slip_spread_k': 0.000824309947082158, 'spread_hl_frac': 0.015372004993646491, 'bb_std_mult': 1.4968040102340638, 'rsi_os': 21, 'rsi_ob': 48, 'vol_spike': 0.1364358313985749, 'adx_thresh': 12.038316738344243, 'atr_min_pct': 0.011245480025134362, 'atr_max_pct': 0.13339850664117925, 'tp_mult': 2.916272262281395, 'tsl_mult': 0.001463889250588119, 'strategy': 'breakout', 'time_stop': 120, 'use_sma': False, 'use_atr': False, 'use_adx': False, 'use_ema': False, 'use_spike': False, 'rsi_required': True, 'edge_k': 1.84643235323249, 'edge_cap': 0.09890741595686259, 'bull_strategy': 'mean_reversion', 'bull_bb_std_mult': 1.0984462499084255, 'bull_rsi_os': 31, 'bull_rsi_ob': 65, 'bull_adx_thresh': 31.246429274158658, 'bull_atr_min_pct': 0.01835596366594179, 'bull_atr_max_pct': 0.12406066823317825, 'bull_tp_mult': 1.3240663581546117, 'bull_tsl_mult': 0.5735904573751169, 'bull_time_stop': 242, 'bull_use_sma': True, 'bull_use_ema': False, 'bull_use_atr': False, 'bull_use_adx': False, 'bull_use_spike': False, 'bull_rsi_required': True, 'bear_strategy': 'breakout', 'bear_bb_std_mult': 1.2828856496289531, 'bear_rsi_os': 53, 'bear_rsi_ob': 51, 'bear_adx_thresh': 21.42153239607836, 'bear_atr_min_pct': 0.021082917186351594, 'bear_atr_max_pct': 0.08881858610715493, 'bear_tp_mult': 2.7446724674663496, 'bear_tsl_mult': 0.5346467746715701, 'bear_time_stop': 254, 'bear_use_sma': False, 'bear_use_ema': True, 'bear_use_atr': False, 'bear_use_adx': True, 'bear_use_spike': False, 'bear_rsi_required': True, 'sideways_strategy': 'breakout', 'sideways_bb_std_mult': 1.0025392886553661, 'sideways_rsi_os': 23, 'sideways_rsi_ob': 64, 'sideways_adx_thresh': 32.205066579856755, 'sideways_atr_min_pct': 0.001561293743455606, 'sideways_atr_max_pct': 0.08719511004442225, 'sideways_tp_mult': 1.4755660658576608, 'sideways_tsl_mult': 0.07810769972060343, 'sideways_time_stop': 147, 'sideways_use_sma': True, 'sideways_use_ema': True, 'sideways_use_atr': False, 'sideways_use_adx': False, 'sideways_use_spike': False, 'sideways_rsi_required': False}.
[I 2025-08-31 09:48:04,017] Trial 211 finished with values: [-0.03228366175419306, 0.03216273726655338] and parameters: {'p_sma': 46, 'p_std': 12, 'p_atr': 29, 'p_adx': 9, 'rsi_period': 20, 'ema1': 21, 'ema2': 23, 'slip_atr_k': 0.18064972493739284, 'slip_spread_k': 0.07333443380026206, 'spread_hl_frac': 0.014981461215876252, 'bb_std_mult': 0.9061111910430641, 'rsi_os': 21, 'rsi_ob': 93, 'vol_spike': 0.20602382855482337, 'adx_thresh': 22.36726512256195, 'atr_min_pct': 0.008155493022488119, 'atr_max_pct': 0.12321537544693381, 'tp_mult': 2.78766632855844, 'tsl_mult': 0.026409750130768503, 'strategy': 'breakout', 'time_stop': 120, 'use_sma': False, 'use_atr': False, 'use_adx': True, 'use_ema': False, 'use_spike': False, 'rsi_required': True, 'edge_k': 1.8386997400873817, 'edge_cap': 0.39752638864244627, 'bull_strategy': 'mean_reversion', 'bull_bb_std_mult': 1.2653904695977853, 'bull_rsi_os': 43, 'bull_rsi_ob': 66, 'bull_adx_thresh': 33.565550939041, 'bull_atr_min_pct': 0.002767767423364381, 'bull_atr_max_pct': 0.07198745159840562, 'bull_tp_mult': 1.3370725509849126, 'bull_tsl_mult': 0.615403594745568, 'bull_time_stop': 97, 'bull_use_sma': True, 'bull_use_ema': False, 'bull_use_atr': False, 'bull_use_adx': False, 'bull_use_spike': False, 'bull_rsi_required': True, 'bear_strategy': 'breakout', 'bear_bb_std_mult': 0.7435417390093984, 'bear_rsi_os': 55, 'bear_rsi_ob': 80, 'bear_adx_thresh': 20.13406247906053, 'bear_atr_min_pct': 0.008157572469480377, 'bear_atr_max_pct': 0.11204951754838138, 'bear_tp_mult': 2.5915985776605206, 'bear_tsl_mult': 0.11394288687415266, 'bear_time_stop': 257, 'bear_use_sma': True, 'bear_use_ema': True, 'bear_use_atr': False, 'bear_use_adx': False, 'bear_use_spike': False, 'bear_rsi_required': True, 'sideways_strategy': 'mean_reversion', 'sideways_bb_std_mult': 1.2176557622943798, 'sideways_rsi_os': 23, 'sideways_rsi_ob': 63, 'sideways_adx_thresh': 34.46612577241941, 'sideways_atr_min_pct': 0.0016218346612290996, 'sideways_atr_max_pct': 0.0961125406693893, 'sideways_tp_mult': 1.1016671207336883, 'sideways_tsl_mult': 0.1476518423605785, 'sideways_time_stop': 151, 'sideways_use_sma': True, 'sideways_use_ema': True, 'sideways_use_atr': False, 'sideways_use_adx': False, 'sideways_use_spike': False, 'sideways_rsi_required': True}.
[I 2025-08-31 09:48:04,213] Trial 212 finished with values: [-1000000000.0, 1000000000.0] and parameters: {'p_sma': 46, 'p_std': 46, 'p_atr': 15, 'p_adx': 9, 'rsi_period': 20, 'ema1': 19, 'ema2': 38, 'slip_atr_k': 0.18034248462860195, 'slip_spread_k': 0.532804570797021, 'spread_hl_frac': 0.014557722937674426, 'bb_std_mult': 1.0262276026998682, 'rsi_os': 24, 'rsi_ob': 91, 'vol_spike': 0.2666279170504561, 'adx_thresh': 6.157782328567141, 'atr_min_pct': 0.002787909956276242, 'atr_max_pct': 0.12510510959229265, 'tp_mult': 2.7708393963349516, 'tsl_mult': 0.8510370195711909, 'strategy': 'breakout', 'time_stop': 142, 'use_sma': False, 'use_atr': False, 'use_adx': True, 'use_ema': False, 'use_spike': False, 'rsi_required': True, 'edge_k': 1.998392319732371, 'edge_cap': 0.1042018239649236, 'bull_strategy': 'mean_reversion', 'bull_bb_std_mult': 1.2685710357839957, 'bull_rsi_os': 30, 'bull_rsi_ob': 68, 'bull_adx_thresh': 33.58072023740651, 'bull_atr_min_pct': 0.02169894160829507, 'bull_atr_max_pct': 0.07277255878413214, 'bull_tp_mult': 1.246808860420253, 'bull_tsl_mult': 0.8497123877972318, 'bull_time_stop': 126, 'bull_use_sma': True, 'bull_use_ema': False, 'bull_use_atr': False, 'bull_use_adx': False, 'bull_use_spike': False, 'bull_rsi_required': True, 'bear_strategy': 'breakout', 'bear_bb_std_mult': 2.8911553308937745, 'bear_rsi_os': 54, 'bear_rsi_ob': 80, 'bear_adx_thresh': 20.250477892827885, 'bear_atr_min_pct': 0.012646919594043807, 'bear_atr_max_pct': 0.13920994132696154, 'bear_tp_mult': 1.5954064163874913, 'bear_tsl_mult': 0.7456158084587716, 'bear_time_stop': 261, 'bear_use_sma': True, 'bear_use_ema': True, 'bear_use_atr': False, 'bear_use_adx': False, 'bear_use_spike': False, 'bear_rsi_required': True, 'sideways_strategy': 'mean_reversion', 'sideways_bb_std_mult': 3.378117958110586, 'sideways_rsi_os': 23, 'sideways_rsi_ob': 46, 'sideways_adx_thresh': 34.4209099659058, 'sideways_atr_min_pct': 0.015599838302888067, 'sideways_atr_max_pct': 0.021380241329686737, 'sideways_tp_mult': 1.1653159846548704, 'sideways_tsl_mult': 0.0994004730759625, 'sideways_time_stop': 254, 'sideways_use_sma': True, 'sideways_use_ema': True, 'sideways_use_atr': False, 'sideways_use_adx': False, 'sideways_use_spike': False, 'sideways_rsi_required': True}.
[I 2025-08-31 09:48:42,135] Trial 214 finished with values: [-1000000000.0, 1000000000.0] and parameters: {'p_sma': 50, 'p_std': 15, 'p_atr': 15, 'p_adx': 9, 'rsi_period': 20, 'ema1': 20, 'ema2': 40, 'slip_atr_k': 0.15448184959990474, 'slip_spread_k': 0.5437117319612391, 'spread_hl_frac': 0.013361811712529106, 'bb_std_mult': 0.8568177873636379, 'rsi_os': 24, 'rsi_ob': 88, 'vol_spike': 0.13952470976013148, 'adx_thresh': 15.225589825017586, 'atr_min_pct': 0.009703336449845595, 'atr_max_pct': 0.12410243917097141, 'tp_mult': 2.75650996486786, 'tsl_mult': 0.19986652682662093, 'strategy': 'breakout', 'time_stop': 140, 'use_sma': False, 'use_atr': False, 'use_adx': True, 'use_ema': False, 'use_spike': False, 'rsi_required': True, 'edge_k': 1.2100207762366635, 'edge_cap': 0.10593561927473914, 'bull_strategy': 'mean_reversion', 'bull_bb_std_mult': 1.2679936483486343, 'bull_rsi_os': 50, 'bull_rsi_ob': 68, 'bull_adx_thresh': 32.09364143879858, 'bull_atr_min_pct': 0.025173771612145526, 'bull_atr_max_pct': 0.09084608770382122, 'bull_tp_mult': 1.519177746858154, 'bull_tsl_mult': 0.8614617629002401, 'bull_time_stop': 249, 'bull_use_sma': True, 'bull_use_ema': False, 'bull_use_atr': False, 'bull_use_adx': False, 'bull_use_spike': False, 'bull_rsi_required': True, 'bear_strategy': 'breakout', 'bear_bb_std_mult': 2.9045985246732933, 'bear_rsi_os': 21, 'bear_rsi_ob': 80, 'bear_adx_thresh': 20.298910051649916, 'bear_atr_min_pct': 3.0910888346646556e-05, 'bear_atr_max_pct': 0.1385592862403981, 'bear_tp_mult': 1.5797110102061611, 'bear_tsl_mult': 0.5818766902005895, 'bear_time_stop': 259, 'bear_use_sma': True, 'bear_use_ema': True, 'bear_use_atr': False, 'bear_use_adx': False, 'bear_use_spike': False, 'bear_rsi_required': True, 'sideways_strategy': 'mean_reversion', 'sideways_bb_std_mult': 3.3830244372789466, 'sideways_rsi_os': 25, 'sideways_rsi_ob': 56, 'sideways_adx_thresh': 34.44068473430422, 'sideways_atr_min_pct': 0.0021436707910478955, 'sideways_atr_max_pct': 0.13240586384412287, 'sideways_tp_mult': 1.113766229482815, 'sideways_tsl_mult': 0.060009503212374846, 'sideways_time_stop': 251, 'sideways_use_sma': True, 'sideways_use_ema': True, 'sideways_use_atr': False, 'sideways_use_adx': False, 'sideways_use_spike': False, 'sideways_rsi_required': True}.
[I 2025-08-31 09:48:42,189] Trial 216 finished with values: [-0.12420806602555678, 0.12405279829248334] and parameters: {'p_sma': 51, 'p_std': 12, 'p_atr': 30, 'p_adx': 9, 'rsi_period': 9, 'ema1': 20, 'ema2': 60, 'slip_atr_k': 0.1507557191936647, 'slip_spread_k': 0.34400626161098574, 'spread_hl_frac': 0.013459021444932455, 'bb_std_mult': 0.8558517098196398, 'rsi_os': 5, 'rsi_ob': 49, 'vol_spike': 0.0036594930083909127, 'adx_thresh': 22.297055106763697, 'atr_min_pct': 0.00413513772893969, 'atr_max_pct': 0.1365560070431163, 'tp_mult': 2.8798195205610715, 'tsl_mult': 0.020605573270402577, 'strategy': 'breakout', 'time_stop': 138, 'use_sma': False, 'use_atr': False, 'use_adx': True, 'use_ema': False, 'use_spike': False, 'rsi_required': True, 'edge_k': 0.9548570745030183, 'edge_cap': 0.8146786655237807, 'bull_strategy': 'mean_reversion', 'bull_bb_std_mult': 1.2785726647450848, 'bull_rsi_os': 49, 'bull_rsi_ob': 66, 'bull_adx_thresh': 25.897845249561207, 'bull_atr_min_pct': 0.0005784903364036559, 'bull_atr_max_pct': 0.14663200155721823, 'bull_tp_mult': 1.5117255462815278, 'bull_tsl_mult': 0.6467828842475415, 'bull_time_stop': 251, 'bull_use_sma': True, 'bull_use_ema': False, 'bull_use_atr': False, 'bull_use_adx': False, 'bull_use_spike': False, 'bull_rsi_required': True, 'bear_strategy': 'breakout', 'bear_bb_std_mult': 3.1778217888797045, 'bear_rsi_os': 55, 'bear_rsi_ob': 93, 'bear_adx_thresh': 34.87045379342548, 'bear_atr_min_pct': 0.003131828317148578, 'bear_atr_max_pct': 0.06793717675934548, 'bear_tp_mult': 1.0593078322592704, 'bear_tsl_mult': 0.5699112408531137, 'bear_time_stop': 258, 'bear_use_sma': True, 'bear_use_ema': True, 'bear_use_atr': False, 'bear_use_adx': False, 'bear_use_spike': False, 'bear_rsi_required': True, 'sideways_strategy': 'mean_reversion', 'sideways_bb_std_mult': 1.1407937357162068, 'sideways_rsi_os': 25, 'sideways_rsi_ob': 56, 'sideways_adx_thresh': 33.43593706601134, 'sideways_atr_min_pct': 0.00222576127969255, 'sideways_atr_max_pct': 0.031059964869763146, 'sideways_tp_mult': 1.508258093209188, 'sideways_tsl_mult': 0.05781642376202856, 'sideways_time_stop': 279, 'sideways_use_sma': True, 'sideways_use_ema': True, 'sideways_use_atr': False, 'sideways_use_adx': False, 'sideways_use_spike': False, 'sideways_rsi_required': True}.
[I 2025-08-31 09:48:42,458] Trial 213 finished with values: [-0.09294904104124035, 0.09257120444356925] and parameters: {'p_sma': 48, 'p_std': 46, 'p_atr': 30, 'p_adx': 11, 'rsi_period': 9, 'ema1': 19, 'ema2': 38, 'slip_atr_k': 0.15373789332927615, 'slip_spread_k': 0.06107037444224084, 'spread_hl_frac': 0.01503955687916814, 'bb_std_mult': 1.2459453140591628, 'rsi_os': 5, 'rsi_ob': 90, 'vol_spike': 0.13795696521129275, 'adx_thresh': 34.05122369317843, 'atr_min_pct': 0.0029304580393050353, 'atr_max_pct': 0.12340810411206488, 'tp_mult': 2.7727703386337743, 'tsl_mult': 0.00010903140171741372, 'strategy': 'breakout', 'time_stop': 142, 'use_sma': False, 'use_atr': False, 'use_adx': True, 'use_ema': False, 'use_spike': False, 'rsi_required': True, 'edge_k': 1.0370755164895376, 'edge_cap': 0.3931635438916274, 'bull_strategy': 'mean_reversion', 'bull_bb_std_mult': 1.2689945044661228, 'bull_rsi_os': 36, 'bull_rsi_ob': 63, 'bull_adx_thresh': 30.655629342513148, 'bull_atr_min_pct': 0.01808675636305933, 'bull_atr_max_pct': 0.07344270771170326, 'bull_tp_mult': 1.2934421684555621, 'bull_tsl_mult': 0.854437671145255, 'bull_time_stop': 248, 'bull_use_sma': True, 'bull_use_ema': False, 'bull_use_atr': False, 'bull_use_adx': False, 'bull_use_spike': False, 'bull_rsi_required': True, 'bear_strategy': 'breakout', 'bear_bb_std_mult': 2.8990413421999515, 'bear_rsi_os': 54, 'bear_rsi_ob': 93, 'bear_adx_thresh': 7.128885072039264, 'bear_atr_min_pct': 0.0008177372858097689, 'bear_atr_max_pct': 0.05241989418467409, 'bear_tp_mult': 1.5828542223268858, 'bear_tsl_mult': 0.5514878188183913, 'bear_time_stop': 257, 'bear_use_sma': True, 'bear_use_ema': True, 'bear_use_atr': False, 'bear_use_adx': False, 'bear_use_spike': False, 'bear_rsi_required': True, 'sideways_strategy': 'mean_reversion', 'sideways_bb_std_mult': 1.3621224201876085, 'sideways_rsi_os': 25, 'sideways_rsi_ob': 57, 'sideways_adx_thresh': 34.25568620090366, 'sideways_atr_min_pct': 0.01591485908417861, 'sideways_atr_max_pct': 0.019033856048628867, 'sideways_tp_mult': 1.5128710625671054, 'sideways_tsl_mult': 0.09956945728583735, 'sideways_time_stop': 108, 'sideways_use_sma': True, 'sideways_use_ema': True, 'sideways_use_atr': False, 'sideways_use_adx': False, 'sideways_use_spike': False, 'sideways_rsi_required': True}.
