[I 2025-08-31 10:57:57,706] Trial 753 finished with values: [-0.1511186125473425, 0.1510526764737388] and parameters: {'p_sma': 39, 'p_std': 48, 'p_atr': 29, 'p_adx': 14, 'rsi_period': 9, 'ema1': 14, 'ema2': 38, 'slip_atr_k': 0.2271136678505174, 'slip_spread_k': 0.0892716625684536, 'spread_hl_frac': 0.04875063270063027, 'bb_std_mult': 3.536434741868492, 'rsi_os': 39, 'rsi_ob': 82, 'vol_spike': 0.29471260413652656, 'adx_thresh': 24.1635890740175, 'atr_min_pct': 0.013673707232005316, 'atr_max_pct': 0.0929505694019911, 'tp_mult': 2.4064180519914395, 'tsl_mult': 0.11590528765196681, 'strategy': 'breakout', 'time_stop': 142, 'use_sma': False, 'use_atr': False, 'use_adx': False, 'use_ema': True, 'use_spike': False, 'rsi_required': True, 'edge_k': 1.890074585451681, 'edge_cap': 0.15961846354946757, 'bull_strategy': 'mean_reversion', 'bull_bb_std_mult': 1.3260317255069554, 'bull_rsi_os': 49, 'bull_rsi_ob': 71, 'bull_adx_thresh': 30.32113609734584, 'bull_atr_min_pct': 0.02777597320961969, 'bull_atr_max_pct': 0.09111862515911348, 'bull_tp_mult': 2.2443455429700534, 'bull_tsl_mult': 0.9450289197676784, 'bull_time_stop': 64, 'bull_use_sma': True, 'bull_use_ema': False, 'bull_use_atr': True, 'bull_use_adx': False, 'bull_use_spike': False, 'bull_rsi_required': True, 'bear_strategy': 'breakout', 'bear_bb_std_mult': 1.427935429001479, 'bear_rsi_os': 30, 'bear_rsi_ob': 80, 'bear_adx_thresh': 14.110527560728489, 'bear_atr_min_pct': 0.02810242468971702, 'bear_atr_max_pct': 0.031400788260931164, 'bear_tp_mult': 2.2386495946119975, 'bear_tsl_mult': 0.4658861842859971, 'bear_time_stop': 247, 'bear_use_sma': False, 'bear_use_ema': True, 'bear_use_atr': False, 'bear_use_adx': True, 'bear_use_spike': True, 'bear_rsi_required': True, 'sideways_strategy': 'breakout', 'sideways_bb_std_mult': 1.0485347743751754, 'sideways_rsi_os': 29, 'sideways_rsi_ob': 70, 'sideways_adx_thresh': 28.958430402636644, 'sideways_atr_min_pct': 1.178595977615552e-05, 'sideways_atr_max_pct': 0.10501068929303586, 'sideways_tp_mult': 2.8078155396044937, 'sideways_tsl_mult': 0.03246260107959864, 'sideways_time_stop': 240, 'sideways_use_sma': True, 'sideways_use_ema': False, 'sideways_use_atr': False, 'sideways_use_adx': False, 'sideways_use_spike': True, 'sideways_rsi_required': False}.
[I 2025-08-31 10:58:32,321] Trial 759 finished with values: [-0.018816812658149273, 0.018852090395912575] and parameters: {'p_sma': 10, 'p_std': 45, 'p_atr': 19, 'p_adx': 20, 'rsi_period': 9, 'ema1': 17, 'ema2': 20, 'slip_atr_k': 0.02110883120198502, 'slip_spread_k': 0.1434204283237498, 'spread_hl_frac': 0.012271481833174364, 'bb_std_mult': 2.8811548999785677, 'rsi_os': 40, 'rsi_ob': 86, 'vol_spike': 0.2936547624531179, 'adx_thresh': 23.44796639758942, 'atr_min_pct': 0.011682249817664052, 'atr_max_pct': 0.043979970241853635, 'tp_mult': 2.1490239352417397, 'tsl_mult': 0.03496264229533674, 'strategy': 'breakout', 'time_stop': 127, 'use_sma': False, 'use_atr': True, 'use_adx': True, 'use_ema': True, 'use_spike': False, 'rsi_required': False, 'edge_k': 1.871605827071202, 'edge_cap': 0.5945997494021618, 'bull_strategy': 'mean_reversion', 'bull_bb_std_mult': 0.9810058831491916, 'bull_rsi_os': 25, 'bull_rsi_ob': 57, 'bull_adx_thresh': 10.149599055023897, 'bull_atr_min_pct': 0.024644268438646012, 'bull_atr_max_pct': 0.05429388746662878, 'bull_tp_mult': 2.2021957462025745, 'bull_tsl_mult': 0.9988465313701806, 'bull_time_stop': 26, 'bull_use_sma': True, 'bull_use_ema': True, 'bull_use_atr': False, 'bull_use_adx': True, 'bull_use_spike': False, 'bull_rsi_required': True, 'bear_strategy': 'breakout', 'bear_bb_std_mult': 2.9189353371652635, 'bear_rsi_os': 28, 'bear_rsi_ob': 81, 'bear_adx_thresh': 19.933363590924955, 'bear_atr_min_pct': 0.018755542268707973, 'bear_atr_max_pct': 0.1149690340537271, 'bear_tp_mult': 2.094213590248747, 'bear_tsl_mult': 0.027058053688850114, 'bear_time_stop': 258, 'bear_use_sma': True, 'bear_use_ema': True, 'bear_use_atr': False, 'bear_use_adx': False, 'bear_use_spike': True, 'bear_rsi_required': False, 'sideways_strategy': 'breakout', 'sideways_bb_std_mult': 1.07033620610758, 'sideways_rsi_os': 24, 'sideways_rsi_ob': 92, 'sideways_adx_thresh': 31.480099613067093, 'sideways_atr_min_pct': 0.0012421183688687606, 'sideways_atr_max_pct': 0.104371338423979, 'sideways_tp_mult': 1.086844098179788, 'sideways_tsl_mult': 0.4667429122783692, 'sideways_time_stop': 230, 'sideways_use_sma': True, 'sideways_use_ema': True, 'sideways_use_atr': False, 'sideways_use_adx': True, 'sideways_use_spike': True, 'sideways_rsi_required': False}.
[I 2025-08-31 10:58:32,606] Trial 758 finished with values: [-1000000000.0, 1000000000.0] and parameters: {'p_sma': 13, 'p_std': 35, 'p_atr': 29, 'p_adx': 11, 'rsi_period': 22, 'ema1': 15, 'ema2': 39, 'slip_atr_k': 0.1708801929452859, 'slip_spread_k': 0.04779886527086272, 'spread_hl_frac': 0.009548436495730117, 'bb_std_mult': 1.133742845158718, 'rsi_os': 6, 'rsi_ob': 83, 'vol_spike': 0.29456348193999216, 'adx_thresh': 23.785275346178857, 'atr_min_pct': 0.012891582355410599, 'atr_max_pct': 0.07972500418620196, 'tp_mult': 1.9541758580351125, 'tsl_mult': 0.22343677555876168, 'strategy': 'breakout', 'time_stop': 128, 'use_sma': False, 'use_atr': False, 'use_adx': True, 'use_ema': True, 'use_spike': False, 'rsi_required': True, 'edge_k': 1.8876582584150638, 'edge_cap': 0.10299594692334786, 'bull_strategy': 'mean_reversion', 'bull_bb_std_mult': 2.323154223040439, 'bull_rsi_os': 43, 'bull_rsi_ob': 79, 'bull_adx_thresh': 30.418576245785225, 'bull_atr_min_pct': 0.006580354097676773, 'bull_atr_max_pct': 0.09061809044683256, 'bull_tp_mult': 2.3734535665922682, 'bull_tsl_mult': 0.9505883733521627, 'bull_time_stop': 64, 'bull_use_sma': True, 'bull_use_ema': True, 'bull_use_atr': False, 'bull_use_adx': False, 'bull_use_spike': False, 'bull_rsi_required': True, 'bear_strategy': 'breakout', 'bear_bb_std_mult': 2.9042384554860825, 'bear_rsi_os': 28, 'bear_rsi_ob': 76, 'bear_adx_thresh': 7.83381088040548, 'bear_atr_min_pct': 0.027999128271400636, 'bear_atr_max_pct': 0.05041777812903165, 'bear_tp_mult': 2.241059557922227, 'bear_tsl_mult': 0.9266039216501759, 'bear_time_stop': 51, 'bear_use_sma': True, 'bear_use_ema': True, 'bear_use_atr': False, 'bear_use_adx': False, 'bear_use_spike': True, 'bear_rsi_required': True, 'sideways_strategy': 'breakout', 'sideways_bb_std_mult': 1.0722138516528894, 'sideways_rsi_os': 31, 'sideways_rsi_ob': 92, 'sideways_adx_thresh': 8.8303983872961, 'sideways_atr_min_pct': 0.022531301193893443, 'sideways_atr_max_pct': 0.10537713268113283, 'sideways_tp_mult': 2.815304334959142, 'sideways_tsl_mult': 0.0732154249052112, 'sideways_time_stop': 240, 'sideways_use_sma': True, 'sideways_use_ema': True, 'sideways_use_atr': False, 'sideways_use_adx': True, 'sideways_use_spike': True, 'sideways_rsi_required': False}.
[I 2025-08-31 10:58:32,607] Trial 760 finished with values: [-1000000000.0, 1000000000.0] and parameters: {'p_sma': 10, 'p_std': 45, 'p_atr': 28, 'p_adx': 19, 'rsi_period': 42, 'ema1': 15, 'ema2': 39, 'slip_atr_k': 0.17128428173506158, 'slip_spread_k': 0.04716429833022537, 'spread_hl_frac': 0.00945329100110243, 'bb_std_mult': 1.1258864631490262, 'rsi_os': 41, 'rsi_ob': 88, 'vol_spike': 0.29996533704157685, 'adx_thresh': 24.733947628139177, 'atr_min_pct': 0.012657824381241843, 'atr_max_pct': 0.11904156111078669, 'tp_mult': 1.750588733131281, 'tsl_mult': 0.03592319976942586, 'strategy': 'breakout', 'time_stop': 155, 'use_sma': False, 'use_atr': True, 'use_adx': True, 'use_ema': True, 'use_spike': False, 'rsi_required': False, 'edge_k': 1.8844623846129056, 'edge_cap': 0.10073640645974488, 'bull_strategy': 'mean_reversion', 'bull_bb_std_mult': 1.2376307807103266, 'bull_rsi_os': 41, 'bull_rsi_ob': 94, 'bull_adx_thresh': 9.977910178063935, 'bull_atr_min_pct': 0.007730475596171442, 'bull_atr_max_pct': 0.09896322263120247, 'bull_tp_mult': 2.187883631674642, 'bull_tsl_mult': 0.9795247248442992, 'bull_time_stop': 79, 'bull_use_sma': True, 'bull_use_ema': True, 'bull_use_atr': False, 'bull_use_adx': True, 'bull_use_spike': False, 'bull_rsi_required': True, 'bear_strategy': 'breakout', 'bear_bb_std_mult': 2.9020670467199516, 'bear_rsi_os': 48, 'bear_rsi_ob': 67, 'bear_adx_thresh': 23.274731036105358, 'bear_atr_min_pct': 0.014690561093771363, 'bear_atr_max_pct': 0.06919250017992488, 'bear_tp_mult': 1.6735302948393183, 'bear_tsl_mult': 0.4462642556070562, 'bear_time_stop': 259, 'bear_use_sma': True, 'bear_use_ema': True, 'bear_use_atr': False, 'bear_use_adx': False, 'bear_use_spike': True, 'bear_rsi_required': False, 'sideways_strategy': 'breakout', 'sideways_bb_std_mult': 0.995048746002417, 'sideways_rsi_os': 24, 'sideways_rsi_ob': 56, 'sideways_adx_thresh': 30.772783152502477, 'sideways_atr_min_pct': 0.027480296824748462, 'sideways_atr_max_pct': 0.10166163561617163, 'sideways_tp_mult': 2.9222802650531055, 'sideways_tsl_mult': 0.2075232841640131, 'sideways_time_stop': 264, 'sideways_use_sma': True, 'sideways_use_ema': True, 'sideways_use_atr': False, 'sideways_use_adx': True, 'sideways_use_spike': True, 'sideways_rsi_required': False}.
[I 2025-08-31 10:58:32,833] Trial 757 finished with values: [-0.013477285207928458, 0.01328777686511947] and parameters: {'p_sma': 13, 'p_std': 35, 'p_atr': 29, 'p_adx': 26, 'rsi_period': 24, 'ema1': 26, 'ema2': 39, 'slip_atr_k': 0.2498968302069301, 'slip_spread_k': 0.05449141186830803, 'spread_hl_frac': 0.04842021139425524, 'bb_std_mult': 2.7032567277694723, 'rsi_os': 40, 'rsi_ob': 86, 'vol_spike': 0.1865122934655833, 'adx_thresh': 23.91240871019049, 'atr_min_pct': 0.02858715600232777, 'atr_max_pct': 0.12144191713033942, 'tp_mult': 1.7590986464794622, 'tsl_mult': 0.21790699423373872, 'strategy': 'breakout', 'time_stop': 155, 'use_sma': False, 'use_atr': False, 'use_adx': False, 'use_ema': True, 'use_spike': False, 'rsi_required': True, 'edge_k': 1.5436977574219588, 'edge_cap': 0.099796034830235, 'bull_strategy': 'mean_reversion', 'bull_bb_std_mult': 3.510130580350534, 'bull_rsi_os': 49, 'bull_rsi_ob': 85, 'bull_adx_thresh': 30.51357442531591, 'bull_atr_min_pct': 0.006526163985155608, 'bull_atr_max_pct': 0.09035755010966381, 'bull_tp_mult': 2.3061035947709776, 'bull_tsl_mult': 0.9826145350973726, 'bull_time_stop': 65, 'bull_use_sma': True, 'bull_use_ema': True, 'bull_use_atr': False, 'bull_use_adx': False, 'bull_use_spike': False, 'bull_rsi_required': True, 'bear_strategy': 'breakout', 'bear_bb_std_mult': 2.549551070796109, 'bear_rsi_os': 21, 'bear_rsi_ob': 81, 'bear_adx_thresh': 7.600907788643175, 'bear_atr_min_pct': 0.014681741325114751, 'bear_atr_max_pct': 0.10556609214820477, 'bear_tp_mult': 2.2411995740199764, 'bear_tsl_mult': 0.42159655883073305, 'bear_time_stop': 258, 'bear_use_sma': True, 'bear_use_ema': True, 'bear_use_atr': False, 'bear_use_adx': True, 'bear_use_spike': True, 'bear_rsi_required': True, 'sideways_strategy': 'breakout', 'sideways_bb_std_mult': 0.9100502417389918, 'sideways_rsi_os': 24, 'sideways_rsi_ob': 71, 'sideways_adx_thresh': 9.032144353376918, 'sideways_atr_min_pct': 0.0005653455303112522, 'sideways_atr_max_pct': 0.10509658456757416, 'sideways_tp_mult': 2.8199202153535046, 'sideways_tsl_mult': 0.21090701045017962, 'sideways_time_stop': 240, 'sideways_use_sma': True, 'sideways_use_ema': True, 'sideways_use_atr': False, 'sideways_use_adx': False, 'sideways_use_spike': True, 'sideways_rsi_required': False}.
[I 2025-08-31 10:59:06,547] Trial 764 finished with values: [-1000000000.0, 1000000000.0] and parameters: {'p_sma': 8, 'p_std': 47, 'p_atr': 30, 'p_adx': 8, 'rsi_period': 79, 'ema1': 26, 'ema2': 34, 'slip_atr_k': 0.20242554664362197, 'slip_spread_k': 0.10529610171818693, 'spread_hl_frac': 0.011933267819757665, 'bb_std_mult': 2.4682037087986455, 'rsi_os': 38, 'rsi_ob': 64, 'vol_spike': 0.16035807431368493, 'adx_thresh': 23.404840044031253, 'atr_min_pct': 0.019790122221221187, 'atr_max_pct': 0.12217415380295783, 'tp_mult': 2.8873431485734304, 'tsl_mult': 0.7706354477136461, 'strategy': 'mean_reversion', 'time_stop': 136, 'use_sma': True, 'use_atr': False, 'use_adx': False, 'use_ema': True, 'use_spike': False, 'rsi_required': True, 'edge_k': 1.9292329719657062, 'edge_cap': 0.2905135416243365, 'bull_strategy': 'breakout', 'bull_bb_std_mult': 1.1612416248024082, 'bull_rsi_os': 26, 'bull_rsi_ob': 66, 'bull_adx_thresh': 20.404034714948924, 'bull_atr_min_pct': 0.006128442449343912, 'bull_atr_max_pct': 0.08476795295922648, 'bull_tp_mult': 2.291790865935526, 'bull_tsl_mult': 0.45212465071018115, 'bull_time_stop': 55, 'bull_use_sma': False, 'bull_use_ema': False, 'bull_use_atr': False, 'bull_use_adx': False, 'bull_use_spike': True, 'bull_rsi_required': True, 'bear_strategy': 'mean_reversion', 'bear_bb_std_mult': 3.516339188614536, 'bear_rsi_os': 35, 'bear_rsi_ob': 79, 'bear_adx_thresh': 21.850670524642208, 'bear_atr_min_pct': 0.008713038716280562, 'bear_atr_max_pct': 0.09948356270320502, 'bear_tp_mult': 1.0525986819266036, 'bear_tsl_mult': 0.45300890345853134, 'bear_time_stop': 278, 'bear_use_sma': False, 'bear_use_ema': False, 'bear_use_atr': False, 'bear_use_adx': True, 'bear_use_spike': True, 'bear_rsi_required': True, 'sideways_strategy': 'mean_reversion', 'sideways_bb_std_mult': 0.8353588385002397, 'sideways_rsi_os': 46, 'sideways_rsi_ob': 71, 'sideways_adx_thresh': 13.991855370078873, 'sideways_atr_min_pct': 0.019448236083348273, 'sideways_atr_max_pct': 0.10720862889456306, 'sideways_tp_mult': 2.861354747132748, 'sideways_tsl_mult': 0.10131783109779771, 'sideways_time_stop': 73, 'sideways_use_sma': True, 'sideways_use_ema': True, 'sideways_use_atr': True, 'sideways_use_adx': False, 'sideways_use_spike': True, 'sideways_rsi_required': True}.
[I 2025-08-31 10:59:06,690] Trial 763 finished with values: [-1000000000.0, 1000000000.0] and parameters: {'p_sma': 17, 'p_std': 10, 'p_atr': 24, 'p_adx': 8, 'rsi_period': 24, 'ema1': 30, 'ema2': 37, 'slip_atr_k': 0.088821839028262, 'slip_spread_k': 0.995747852347465, 'spread_hl_frac': 0.011967258420461733, 'bb_std_mult': 2.544357496039471, 'rsi_os': 41, 'rsi_ob': 56, 'vol_spike': 0.18655496720586068, 'adx_thresh': 24.41861515213453, 'atr_min_pct': 0.009576094414271848, 'atr_max_pct': 0.06496294862210414, 'tp_mult': 2.861511274693083, 'tsl_mult': 0.05613989429390021, 'strategy': 'mean_reversion', 'time_stop': 12, 'use_sma': True, 'use_atr': False, 'use_adx': False, 'use_ema': True, 'use_spike': False, 'rsi_required': True, 'edge_k': 0.8686535570735273, 'edge_cap': 0.11904327920828328, 'bull_strategy': 'breakout', 'bull_bb_std_mult': 3.128034949887452, 'bull_rsi_os': 39, 'bull_rsi_ob': 63, 'bull_adx_thresh': 18.361192261118617, 'bull_atr_min_pct': 0.006707033561227298, 'bull_atr_max_pct': 0.1324924427295424, 'bull_tp_mult': 2.312779724551619, 'bull_tsl_mult': 0.2597733441864356, 'bull_time_stop': 74, 'bull_use_sma': False, 'bull_use_ema': False, 'bull_use_atr': False, 'bull_use_adx': False, 'bull_use_spike': False, 'bull_rsi_required': False, 'bear_strategy': 'mean_reversion', 'bear_bb_std_mult': 2.981410322068247, 'bear_rsi_os': 41, 'bear_rsi_ob': 79, 'bear_adx_thresh': 21.885412403615582, 'bear_atr_min_pct': 0.00725041408542904, 'bear_atr_max_pct': 0.10538607007919079, 'bear_tp_mult': 1.9522390624460075, 'bear_tsl_mult': 0.5118428872730654, 'bear_time_stop': 123, 'bear_use_sma': False, 'bear_use_ema': False, 'bear_use_atr': False, 'bear_use_adx': True, 'bear_use_spike': True, 'bear_rsi_required': True, 'sideways_strategy': 'mean_reversion', 'sideways_bb_std_mult': 3.3351846106505842, 'sideways_rsi_os': 20, 'sideways_rsi_ob': 71, 'sideways_adx_thresh': 30.048572673130366, 'sideways_atr_min_pct': 0.001840950267066526, 'sideways_atr_max_pct': 0.10106882475519148, 'sideways_tp_mult': 2.164414269884411, 'sideways_tsl_mult': 0.09982552721674345, 'sideways_time_stop': 57, 'sideways_use_sma': True, 'sideways_use_ema': True, 'sideways_use_atr': False, 'sideways_use_adx': False, 'sideways_use_spike': True, 'sideways_rsi_required': True}.
[I 2025-08-31 10:59:06,911] Trial 762 finished with values: [-1000000000.0, 1000000000.0] and parameters: {'p_sma': 17, 'p_std': 47, 'p_atr': 20, 'p_adx': 8, 'rsi_period': 82, 'ema1': 18, 'ema2': 37, 'slip_atr_k': 0.011873844961782384, 'slip_spread_k': 0.11036670733060999, 'spread_hl_frac': 0.01196868265376935, 'bb_std_mult': 1.2925821797837151, 'rsi_os': 31, 'rsi_ob': 84, 'vol_spike': 0.07294864011147517, 'adx_thresh': 23.544418829534486, 'atr_min_pct': 0.021072055364471178, 'atr_max_pct': 0.05450579374950673, 'tp_mult': 2.3494170528616865, 'tsl_mult': 0.05387006212067593, 'strategy': 'mean_reversion', 'time_stop': 66, 'use_sma': True, 'use_atr': False, 'use_adx': False, 'use_ema': True, 'use_spike': False, 'rsi_required': True, 'edge_k': 1.9445489438885057, 'edge_cap': 0.2937394775074914, 'bull_strategy': 'breakout', 'bull_bb_std_mult': 2.566850869352577, 'bull_rsi_os': 26, 'bull_rsi_ob': 49, 'bull_adx_thresh': 31.055127199743307, 'bull_atr_min_pct': 0.005999622663435864, 'bull_atr_max_pct': 0.1368652754383999, 'bull_tp_mult': 2.324777015018876, 'bull_tsl_mult': 0.3530130673830627, 'bull_time_stop': 54, 'bull_use_sma': False, 'bull_use_ema': False, 'bull_use_atr': False, 'bull_use_adx': False, 'bull_use_spike': False, 'bull_rsi_required': False, 'bear_strategy': 'mean_reversion', 'bear_bb_std_mult': 0.6147133459465128, 'bear_rsi_os': 35, 'bear_rsi_ob': 79, 'bear_adx_thresh': 21.865143817581163, 'bear_atr_min_pct': 0.007344400461668263, 'bear_atr_max_pct': 0.09975519027066518, 'bear_tp_mult': 1.0395490154219265, 'bear_tsl_mult': 0.49193089982702587, 'bear_time_stop': 116, 'bear_use_sma': False, 'bear_use_ema': False, 'bear_use_atr': False, 'bear_use_adx': True, 'bear_use_spike': True, 'bear_rsi_required': True, 'sideways_strategy': 'mean_reversion', 'sideways_bb_std_mult': 2.465076750638681, 'sideways_rsi_os': 20, 'sideways_rsi_ob': 71, 'sideways_adx_thresh': 5.415095696332882, 'sideways_atr_min_pct': 0.0020275912801923242, 'sideways_atr_max_pct': 0.10092899056996925, 'sideways_tp_mult': 2.8812316101811897, 'sideways_tsl_mult': 0.107188171568473, 'sideways_time_stop': 258, 'sideways_use_sma': True, 'sideways_use_ema': True, 'sideways_use_atr': False, 'sideways_use_adx': False, 'sideways_use_spike': True, 'sideways_rsi_required': True}.
[I 2025-08-31 10:59:07,057] Trial 761 finished with values: [-1000000000.0, 1000000000.0] and parameters: {'p_sma': 11, 'p_std': 10, 'p_atr': 10, 'p_adx': 19, 'rsi_period': 43, 'ema1': 26, 'ema2': 24, 'slip_atr_k': 0.17213165547471604, 'slip_spread_k': 0.10689043293895359, 'spread_hl_frac': 0.009567428735405614, 'bb_std_mult': 1.8031622751313652, 'rsi_os': 30, 'rsi_ob': 64, 'vol_spike': 0.07158154245087615, 'adx_thresh': 24.483405793637015, 'atr_min_pct': 0.01294294891725172, 'atr_max_pct': 0.0648551127445243, 'tp_mult': 1.765934960942949, 'tsl_mult': 0.05264978600590883, 'strategy': 'breakout', 'time_stop': 128, 'use_sma': False, 'use_atr': False, 'use_adx': False, 'use_ema': True, 'use_spike': False, 'rsi_required': True, 'edge_k': 1.9160938059668122, 'edge_cap': 0.10539500167860097, 'bull_strategy': 'mean_reversion', 'bull_bb_std_mult': 3.4857529623372727, 'bull_rsi_os': 43, 'bull_rsi_ob': 79, 'bull_adx_thresh': 5.4601545636433, 'bull_atr_min_pct': 0.006303755842944883, 'bull_atr_max_pct': 0.14580462951020207, 'bull_tp_mult': 2.131398289238591, 'bull_tsl_mult': 0.9674643107665577, 'bull_time_stop': 198, 'bull_use_sma': True, 'bull_use_ema': True, 'bull_use_atr': False, 'bull_use_adx': False, 'bull_use_spike': False, 'bull_rsi_required': True, 'bear_strategy': 'breakout', 'bear_bb_std_mult': 2.1710975914553132, 'bear_rsi_os': 48, 'bear_rsi_ob': 79, 'bear_adx_thresh': 10.01842541914336, 'bear_atr_min_pct': 0.007246775275599224, 'bear_atr_max_pct': 0.10617596579451885, 'bear_tp_mult': 1.3067207951900206, 'bear_tsl_mult': 0.9233361643566191, 'bear_time_stop': 277, 'bear_use_sma': True, 'bear_use_ema': True, 'bear_use_atr': False, 'bear_use_adx': True, 'bear_use_spike': True, 'bear_rsi_required': True, 'sideways_strategy': 'breakout', 'sideways_bb_std_mult': 3.507916338347613, 'sideways_rsi_os': 24, 'sideways_rsi_ob': 73, 'sideways_adx_thresh': 30.761877970653675, 'sideways_atr_min_pct': 0.0018522252484712686, 'sideways_atr_max_pct': 0.10158675501286356, 'sideways_tp_mult': 2.921679225980121, 'sideways_tsl_mult': 0.10439914619615687, 'sideways_time_stop': 57, 'sideways_use_sma': True, 'sideways_use_ema': True, 'sideways_use_atr': False, 'sideways_use_adx': True, 'sideways_use_spike': True, 'sideways_rsi_required': False}.
