[I 2025-08-31 11:08:05,481] Trial 828 finished with values: [-0.019293678743170672, 0.019173928496510787] and parameters: {'p_sma': 11, 'p_std': 33, 'p_atr': 28, 'p_adx': 18, 'rsi_period': 26, 'ema1': 8, 'ema2': 48, 'slip_atr_k': 0.1892939888026205, 'slip_spread_k': 0.09161972587370651, 'spread_hl_frac': 0.009309855553457235, 'bb_std_mult': 1.7427256344476865, 'rsi_os': 42, 'rsi_ob': 81, 'vol_spike': 0.15847401280947762, 'adx_thresh': 23.396489451789527, 'atr_min_pct': 0.010004028116554861, 'atr_max_pct': 0.12365550746856187, 'tp_mult': 2.9971377325714603, 'tsl_mult': 0.9149959447096278, 'strategy': 'breakout', 'time_stop': 140, 'use_sma': False, 'use_atr': False, 'use_adx': False, 'use_ema': True, 'use_spike': False, 'rsi_required': True, 'edge_k': 0.2132321175694818, 'edge_cap': 0.4489695158111062, 'bull_strategy': 'mean_reversion', 'bull_bb_std_mult': 2.4157016400967035, 'bull_rsi_os': 28, 'bull_rsi_ob': 63, 'bull_adx_thresh': 32.73759219070172, 'bull_atr_min_pct': 0.0072277946343647925, 'bull_atr_max_pct': 0.08602119068903318, 'bull_tp_mult': 1.1304988751037677, 'bull_tsl_mult': 0.9522590357265021, 'bull_time_stop': 12, 'bull_use_sma': True, 'bull_use_ema': False, 'bull_use_atr': False, 'bull_use_adx': False, 'bull_use_spike': False, 'bull_rsi_required': True, 'bear_strategy': 'breakout', 'bear_bb_std_mult': 2.9461618857712852, 'bear_rsi_os': 26, 'bear_rsi_ob': 77, 'bear_adx_thresh': 19.76792827333458, 'bear_atr_min_pct': 0.010870120682610708, 'bear_atr_max_pct': 0.13081530321115545, 'bear_tp_mult': 1.2432475195771124, 'bear_tsl_mult': 0.4070532357978286, 'bear_time_stop': 260, 'bear_use_sma': False, 'bear_use_ema': True, 'bear_use_atr': False, 'bear_use_adx': True, 'bear_use_spike': True, 'bear_rsi_required': True, 'sideways_strategy': 'breakout', 'sideways_bb_std_mult': 1.3157483312653708, 'sideways_rsi_os': 33, 'sideways_rsi_ob': 92, 'sideways_adx_thresh': 30.86751786293705, 'sideways_atr_min_pct': 0.0011938459860648173, 'sideways_atr_max_pct': 0.13980505834702905, 'sideways_tp_mult': 2.9034431378304206, 'sideways_tsl_mult': 0.31911526770032794, 'sideways_time_stop': 161, 'sideways_use_sma': True, 'sideways_use_ema': True, 'sideways_use_atr': False, 'sideways_use_adx': False, 'sideways_use_spike': True, 'sideways_rsi_required': False}.
[I 2025-08-31 11:08:06,064] Trial 829 finished with values: [-1000000000.0, 1000000000.0] and parameters: {'p_sma': 11, 'p_std': 50, 'p_atr': 28, 'p_adx': 21, 'rsi_period': 26, 'ema1': 17, 'ema2': 25, 'slip_atr_k': 0.18805163005688272, 'slip_spread_k': 0.9380724178062507, 'spread_hl_frac': 0.01239442330794954, 'bb_std_mult': 1.2823194266494338, 'rsi_os': 42, 'rsi_ob': 52, 'vol_spike': 0.17632321454914804, 'adx_thresh': 23.42991237241308, 'atr_min_pct': 0.010214560742319316, 'atr_max_pct': 0.12389739729864559, 'tp_mult': 2.85508227831034, 'tsl_mult': 0.04578857922366427, 'strategy': 'breakout', 'time_stop': 150, 'use_sma': False, 'use_atr': False, 'use_adx': False, 'use_ema': True, 'use_spike': False, 'rsi_required': True, 'edge_k': 1.9997586832831886, 'edge_cap': 0.13163979637133327, 'bull_strategy': 'mean_reversion', 'bull_bb_std_mult': 0.6634416838800703, 'bull_rsi_os': 17, 'bull_rsi_ob': 90, 'bull_adx_thresh': 20.810921277444407, 'bull_atr_min_pct': 0.007268255230083912, 'bull_atr_max_pct': 0.06484703681153399, 'bull_tp_mult': 2.1730153076014895, 'bull_tsl_mult': 0.34592838295178696, 'bull_time_stop': 61, 'bull_use_sma': True, 'bull_use_ema': False, 'bull_use_atr': False, 'bull_use_adx': False, 'bull_use_spike': False, 'bull_rsi_required': True, 'bear_strategy': 'breakout', 'bear_bb_std_mult': 2.939340043398876, 'bear_rsi_os': 26, 'bear_rsi_ob': 50, 'bear_adx_thresh': 23.713767116014594, 'bear_atr_min_pct': 0.007318201667356179, 'bear_atr_max_pct': 0.04070445153654652, 'bear_tp_mult': 2.049879126548681, 'bear_tsl_mult': 0.4670087406876949, 'bear_time_stop': 259, 'bear_use_sma': False, 'bear_use_ema': True, 'bear_use_atr': False, 'bear_use_adx': True, 'bear_use_spike': True, 'bear_rsi_required': True, 'sideways_strategy': 'breakout', 'sideways_bb_std_mult': 0.677397956430251, 'sideways_rsi_os': 25, 'sideways_rsi_ob': 92, 'sideways_adx_thresh': 23.813248803867037, 'sideways_atr_min_pct': 0.0011201373665965413, 'sideways_atr_max_pct': 0.14022846847244885, 'sideways_tp_mult': 2.914540465088123, 'sideways_tsl_mult': 0.057715921123951054, 'sideways_time_stop': 45, 'sideways_use_sma': True, 'sideways_use_ema': True, 'sideways_use_atr': False, 'sideways_use_adx': False, 'sideways_use_spike': True, 'sideways_rsi_required': False}.
[I 2025-08-31 11:08:06,222] Trial 830 finished with values: [-1000000000.0, 1000000000.0] and parameters: {'p_sma': 29, 'p_std': 42, 'p_atr': 13, 'p_adx': 21, 'rsi_period': 52, 'ema1': 27, 'ema2': 40, 'slip_atr_k': 0.18877675376021322, 'slip_spread_k': 0.11934610668723122, 'spread_hl_frac': 0.008858195089500205, 'bb_std_mult': 2.7037917648887904, 'rsi_os': 42, 'rsi_ob': 81, 'vol_spike': 0.27584830473199506, 'adx_thresh': 23.300387207585082, 'atr_min_pct': 0.012506645720790322, 'atr_max_pct': 0.12357484963212116, 'tp_mult': 2.7602157414584974, 'tsl_mult': 0.04865265593541658, 'strategy': 'mean_reversion', 'time_stop': 151, 'use_sma': True, 'use_atr': True, 'use_adx': False, 'use_ema': True, 'use_spike': False, 'rsi_required': True, 'edge_k': 1.912802040688114, 'edge_cap': 0.12999897499543797, 'bull_strategy': 'breakout', 'bull_bb_std_mult': 0.8597809268721661, 'bull_rsi_os': 27, 'bull_rsi_ob': 61, 'bull_adx_thresh': 20.24700930554233, 'bull_atr_min_pct': 0.0071220406190656066, 'bull_atr_max_pct': 0.08611423402204783, 'bull_tp_mult': 1.2379617783894654, 'bull_tsl_mult': 0.9521652455294722, 'bull_time_stop': 63, 'bull_use_sma': True, 'bull_use_ema': False, 'bull_use_atr': False, 'bull_use_adx': False, 'bull_use_spike': False, 'bull_rsi_required': True, 'bear_strategy': 'mean_reversion', 'bear_bb_std_mult': 2.9357409382856785, 'bear_rsi_os': 26, 'bear_rsi_ob': 93, 'bear_adx_thresh': 19.845473896431933, 'bear_atr_min_pct': 0.01818823547481708, 'bear_atr_max_pct': 0.11088308485219407, 'bear_tp_mult': 2.004833682393942, 'bear_tsl_mult': 0.4916352338033028, 'bear_time_stop': 259, 'bear_use_sma': False, 'bear_use_ema': True, 'bear_use_atr': False, 'bear_use_adx': True, 'bear_use_spike': False, 'bear_rsi_required': False, 'sideways_strategy': 'breakout', 'sideways_bb_std_mult': 3.489347890948267, 'sideways_rsi_os': 25, 'sideways_rsi_ob': 93, 'sideways_adx_thresh': 30.332485172717895, 'sideways_atr_min_pct': 0.001058915187032757, 'sideways_atr_max_pct': 0.10086675575729324, 'sideways_tp_mult': 2.9151807659821243, 'sideways_tsl_mult': 0.05801707199360373, 'sideways_time_stop': 236, 'sideways_use_sma': True, 'sideways_use_ema': True, 'sideways_use_atr': False, 'sideways_use_adx': False, 'sideways_use_spike': True, 'sideways_rsi_required': False}.
[I 2025-08-31 11:08:06,512] Trial 831 finished with values: [-1000000000.0, 1000000000.0] and parameters: {'p_sma': 18, 'p_std': 42, 'p_atr': 28, 'p_adx': 8, 'rsi_period': 26, 'ema1': 17, 'ema2': 36, 'slip_atr_k': 0.23083436648295946, 'slip_spread_k': 0.5311810519895658, 'spread_hl_frac': 0.009147322890756869, 'bb_std_mult': 1.2747274752002395, 'rsi_os': 18, 'rsi_ob': 78, 'vol_spike': 0.29157994139209603, 'adx_thresh': 23.321210810665114, 'atr_min_pct': 0.010564623892669416, 'atr_max_pct': 0.05255920807458386, 'tp_mult': 1.720775374002816, 'tsl_mult': 0.6110828737579894, 'strategy': 'breakout', 'time_stop': 151, 'use_sma': False, 'use_atr': False, 'use_adx': False, 'use_ema': True, 'use_spike': False, 'rsi_required': True, 'edge_k': 0.7870849330252205, 'edge_cap': 0.4405810591979884, 'bull_strategy': 'mean_reversion', 'bull_bb_std_mult': 1.2200165896555661, 'bull_rsi_os': 6, 'bull_rsi_ob': 90, 'bull_adx_thresh': 24.67592910495601, 'bull_atr_min_pct': 0.007479842938544246, 'bull_atr_max_pct': 0.08573451026059803, 'bull_tp_mult': 2.273298251393838, 'bull_tsl_mult': 0.23737895424742356, 'bull_time_stop': 65, 'bull_use_sma': True, 'bull_use_ema': False, 'bull_use_atr': True, 'bull_use_adx': False, 'bull_use_spike': True, 'bull_rsi_required': True, 'bear_strategy': 'breakout', 'bear_bb_std_mult': 2.941480628561074, 'bear_rsi_os': 27, 'bear_rsi_ob': 53, 'bear_adx_thresh': 21.266101083709902, 'bear_atr_min_pct': 0.008327088508610627, 'bear_atr_max_pct': 0.1121297883179019, 'bear_tp_mult': 1.5561782839744236, 'bear_tsl_mult': 0.46949055424242153, 'bear_time_stop': 34, 'bear_use_sma': False, 'bear_use_ema': True, 'bear_use_atr': False, 'bear_use_adx': True, 'bear_use_spike': True, 'bear_rsi_required': True, 'sideways_strategy': 'breakout', 'sideways_bb_std_mult': 1.4737795719477753, 'sideways_rsi_os': 25, 'sideways_rsi_ob': 94, 'sideways_adx_thresh': 22.993702356940936, 'sideways_atr_min_pct': 0.010932015320105168, 'sideways_atr_max_pct': 0.04899706209007704, 'sideways_tp_mult': 2.6074832095609985, 'sideways_tsl_mult': 0.4871047767267739, 'sideways_time_stop': 131, 'sideways_use_sma': True, 'sideways_use_ema': True, 'sideways_use_atr': True, 'sideways_use_adx': False, 'sideways_use_spike': True, 'sideways_rsi_required': False}.
[I 2025-08-31 11:08:38,518] Trial 835 finished with values: [-1000000000.0, 1000000000.0] and parameters: {'p_sma': 10, 'p_std': 47, 'p_atr': 29, 'p_adx': 11, 'rsi_period': 19, 'ema1': 18, 'ema2': 57, 'slip_atr_k': 0.1698168840169484, 'slip_spread_k': 0.973539845756395, 'spread_hl_frac': 0.010187525700198012, 'bb_std_mult': 1.9905248351342575, 'rsi_os': 52, 'rsi_ob': 79, 'vol_spike': 0.2493026200402028, 'adx_thresh': 32.597015322825726, 'atr_min_pct': 0.01935979573173159, 'atr_max_pct': 0.10206490667250329, 'tp_mult': 2.935110263908086, 'tsl_mult': 0.8169893030347906, 'strategy': 'breakout', 'time_stop': 12, 'use_sma': False, 'use_atr': False, 'use_adx': False, 'use_ema': False, 'use_spike': True, 'rsi_required': False, 'edge_k': 1.1108616576297385, 'edge_cap': 0.15967519807002567, 'bull_strategy': 'mean_reversion', 'bull_bb_std_mult': 1.3269014111906257, 'bull_rsi_os': 23, 'bull_rsi_ob': 67, 'bull_adx_thresh': 18.07161491198116, 'bull_atr_min_pct': 0.026571398437586297, 'bull_atr_max_pct': 0.14740501562265584, 'bull_tp_mult': 2.2632233807296513, 'bull_tsl_mult': 0.9806311667747845, 'bull_time_stop': 94, 'bull_use_sma': False, 'bull_use_ema': True, 'bull_use_atr': True, 'bull_use_adx': True, 'bull_use_spike': True, 'bull_rsi_required': False, 'bear_strategy': 'breakout', 'bear_bb_std_mult': 1.4821795273943543, 'bear_rsi_os': 30, 'bear_rsi_ob': 76, 'bear_adx_thresh': 34.89441903521295, 'bear_atr_min_pct': 0.01517041594099413, 'bear_atr_max_pct': 0.1077612437378259, 'bear_tp_mult': 1.1438051593034002, 'bear_tsl_mult': 0.6020591952926929, 'bear_time_stop': 270, 'bear_use_sma': True, 'bear_use_ema': False, 'bear_use_atr': True, 'bear_use_adx': False, 'bear_use_spike': True, 'bear_rsi_required': True, 'sideways_strategy': 'mean_reversion', 'sideways_bb_std_mult': 0.8910179657653119, 'sideways_rsi_os': 42, 'sideways_rsi_ob': 86, 'sideways_adx_thresh': 9.415613039155936, 'sideways_atr_min_pct': 1.1336524569548201e-05, 'sideways_atr_max_pct': 0.04333177358291183, 'sideways_tp_mult': 2.862570861428368, 'sideways_tsl_mult': 0.08707355020378856, 'sideways_time_stop': 117, 'sideways_use_sma': False, 'sideways_use_ema': False, 'sideways_use_atr': True, 'sideways_use_adx': True, 'sideways_use_spike': False, 'sideways_rsi_required': True}.
[I 2025-08-31 11:08:38,844] Trial 834 finished with values: [-1000000000.0, 1000000000.0] and parameters: {'p_sma': 9, 'p_std': 47, 'p_atr': 9, 'p_adx': 15, 'rsi_period': 19, 'ema1': 14, 'ema2': 36, 'slip_atr_k': 0.18331030729926243, 'slip_spread_k': 0.5384861574853071, 'spread_hl_frac': 0.010027440991601824, 'bb_std_mult': 1.0320363158580632, 'rsi_os': 38, 'rsi_ob': 82, 'vol_spike': 0.29310694833512435, 'adx_thresh': 32.85059788305745, 'atr_min_pct': 0.024420690671866103, 'atr_max_pct': 0.05236605705886807, 'tp_mult': 1.708676052336978, 'tsl_mult': 0.09595307475363998, 'strategy': 'breakout', 'time_stop': 12, 'use_sma': False, 'use_atr': False, 'use_adx': False, 'use_ema': False, 'use_spike': True, 'rsi_required': False, 'edge_k': 1.8662084254094264, 'edge_cap': 0.15925265946548187, 'bull_strategy': 'mean_reversion', 'bull_bb_std_mult': 3.0894393458882243, 'bull_rsi_os': 23, 'bull_rsi_ob': 66, 'bull_adx_thresh': 31.059635492090276, 'bull_atr_min_pct': 0.012384212454090961, 'bull_atr_max_pct': 0.09184829773216738, 'bull_tp_mult': 2.267030838953697, 'bull_tsl_mult': 0.3736493884507365, 'bull_time_stop': 175, 'bull_use_sma': False, 'bull_use_ema': True, 'bull_use_atr': True, 'bull_use_adx': True, 'bull_use_spike': True, 'bull_rsi_required': False, 'bear_strategy': 'breakout', 'bear_bb_std_mult': 0.9143385374427764, 'bear_rsi_os': 30, 'bear_rsi_ob': 76, 'bear_adx_thresh': 21.1688631817587, 'bear_atr_min_pct': 0.008338788834224661, 'bear_atr_max_pct': 0.10214757884300892, 'bear_tp_mult': 2.8247712472530986, 'bear_tsl_mult': 0.6075535733706254, 'bear_time_stop': 198, 'bear_use_sma': True, 'bear_use_ema': False, 'bear_use_atr': True, 'bear_use_adx': False, 'bear_use_spike': True, 'bear_rsi_required': True, 'sideways_strategy': 'mean_reversion', 'sideways_bb_std_mult': 2.2490913370945895, 'sideways_rsi_os': 47, 'sideways_rsi_ob': 94, 'sideways_adx_thresh': 29.554324591943804, 'sideways_atr_min_pct': 5.9572013093221526e-05, 'sideways_atr_max_pct': 0.040328692261367434, 'sideways_tp_mult': 1.1061678377676034, 'sideways_tsl_mult': 0.08451439565931411, 'sideways_time_stop': 133, 'sideways_use_sma': False, 'sideways_use_ema': False, 'sideways_use_atr': True, 'sideways_use_adx': True, 'sideways_use_spike': False, 'sideways_rsi_required': True}.
[I 2025-08-31 11:08:39,102] Trial 833 finished with values: [-1000000000.0, 1000000000.0] and parameters: {'p_sma': 8, 'p_std': 28, 'p_atr': 28, 'p_adx': 8, 'rsi_period': 19, 'ema1': 18, 'ema2': 36, 'slip_atr_k': 0.1826640643817419, 'slip_spread_k': 0.5284002996674385, 'spread_hl_frac': 0.009959940817965682, 'bb_std_mult': 1.0389816349656664, 'rsi_os': 38, 'rsi_ob': 82, 'vol_spike': 0.29976584953647023, 'adx_thresh': 17.23438923356896, 'atr_min_pct': 0.007602235333928493, 'atr_max_pct': 0.12006164883648328, 'tp_mult': 1.6866680316815952, 'tsl_mult': 0.46281954623891647, 'strategy': 'breakout', 'time_stop': 34, 'use_sma': False, 'use_atr': False, 'use_adx': False, 'use_ema': False, 'use_spike': True, 'rsi_required': True, 'edge_k': 1.9182191381449194, 'edge_cap': 0.11372390440873119, 'bull_strategy': 'mean_reversion', 'bull_bb_std_mult': 1.3073230579904331, 'bull_rsi_os': 27, 'bull_rsi_ob': 66, 'bull_adx_thresh': 31.610342991048967, 'bull_atr_min_pct': 0.01205543205101613, 'bull_atr_max_pct': 0.08621066793265982, 'bull_tp_mult': 2.288153892564024, 'bull_tsl_mult': 0.39352353482062546, 'bull_time_stop': 176, 'bull_use_sma': False, 'bull_use_ema': True, 'bull_use_atr': True, 'bull_use_adx': False, 'bull_use_spike': True, 'bull_rsi_required': False, 'bear_strategy': 'mean_reversion', 'bear_bb_std_mult': 3.085471572120462, 'bear_rsi_os': 27, 'bear_rsi_ob': 68, 'bear_adx_thresh': 24.615173065300173, 'bear_atr_min_pct': 0.017957046559678672, 'bear_atr_max_pct': 0.11165300981140842, 'bear_tp_mult': 2.284652250934524, 'bear_tsl_mult': 0.4803345691762096, 'bear_time_stop': 286, 'bear_use_sma': True, 'bear_use_ema': True, 'bear_use_atr': True, 'bear_use_adx': False, 'bear_use_spike': False, 'bear_rsi_required': True, 'sideways_strategy': 'breakout', 'sideways_bb_std_mult': 1.9277126336931905, 'sideways_rsi_os': 23, 'sideways_rsi_ob': 93, 'sideways_adx_thresh': 7.7803495300534085, 'sideways_atr_min_pct': 0.0012687951044514062, 'sideways_atr_max_pct': 0.10223469282089018, 'sideways_tp_mult': 1.1200042345361458, 'sideways_tsl_mult': 0.09111100135961023, 'sideways_time_stop': 237, 'sideways_use_sma': False, 'sideways_use_ema': False, 'sideways_use_atr': True, 'sideways_use_adx': True, 'sideways_use_spike': False, 'sideways_rsi_required': False}.
[I 2025-08-31 11:08:39,389] Trial 832 finished with values: [-0.04472316597199222, 0.04456955878577594] and parameters: {'p_sma': 11, 'p_std': 28, 'p_atr': 29, 'p_adx': 11, 'rsi_period': 32, 'ema1': 27, 'ema2': 30, 'slip_atr_k': 0.18318766593047006, 'slip_spread_k': 0.12192496581714718, 'spread_hl_frac': 0.012610191908651779, 'bb_std_mult': 1.2597768878616267, 'rsi_os': 38, 'rsi_ob': 79, 'vol_spike': 0.07757989986010877, 'adx_thresh': 23.324444451422835, 'atr_min_pct': 0.007793332018698257, 'atr_max_pct': 0.05281639864963728, 'tp_mult': 1.7067983457642635, 'tsl_mult': 0.0530112157217097, 'strategy': 'breakout', 'time_stop': 147, 'use_sma': False, 'use_atr': False, 'use_adx': False, 'use_ema': False, 'use_spike': True, 'rsi_required': True, 'edge_k': 1.326864304922816, 'edge_cap': 0.9013985279078731, 'bull_strategy': 'mean_reversion', 'bull_bb_std_mult': 1.2156075875777743, 'bull_rsi_os': 19, 'bull_rsi_ob': 61, 'bull_adx_thresh': 24.757322432489897, 'bull_atr_min_pct': 0.007297868564483597, 'bull_atr_max_pct': 0.0910408390782882, 'bull_tp_mult': 2.2710407772652212, 'bull_tsl_mult': 0.3724597993145966, 'bull_time_stop': 62, 'bull_use_sma': True, 'bull_use_ema': True, 'bull_use_atr': True, 'bull_use_adx': False, 'bull_use_spike': True, 'bull_rsi_required': True, 'bear_strategy': 'breakout', 'bear_bb_std_mult': 3.0632985802580244, 'bear_rsi_os': 16, 'bear_rsi_ob': 76, 'bear_adx_thresh': 21.50680014981103, 'bear_atr_min_pct': 0.015080598539654468, 'bear_atr_max_pct': 0.11210005099818351, 'bear_tp_mult': 2.0117207194496034, 'bear_tsl_mult': 0.14614001591020825, 'bear_time_stop': 37, 'bear_use_sma': True, 'bear_use_ema': True, 'bear_use_atr': True, 'bear_use_adx': True, 'bear_use_spike': True, 'bear_rsi_required': True, 'sideways_strategy': 'breakout', 'sideways_bb_std_mult': 1.4500996332006508, 'sideways_rsi_os': 40, 'sideways_rsi_ob': 94, 'sideways_adx_thresh': 26.264626014944163, 'sideways_atr_min_pct': 0.0011909488960167862, 'sideways_atr_max_pct': 0.04212108410390181, 'sideways_tp_mult': 2.713505555843727, 'sideways_tsl_mult': 0.1432994746226322, 'sideways_time_stop': 238, 'sideways_use_sma': False, 'sideways_use_ema': True, 'sideways_use_atr': True, 'sideways_use_adx': True, 'sideways_use_spike': False, 'sideways_rsi_required': False}.
[I 2025-08-31 11:09:11,957] Trial 836 finished with values: [-1000000000.0, 1000000000.0] and parameters: {'p_sma': 8, 'p_std': 52, 'p_atr': 22, 'p_adx': 10, 'rsi_period': 24, 'ema1': 15, 'ema2': 34, 'slip_atr_k': 0.18303998447083786, 'slip_spread_k': 0.12284107436184274, 'spread_hl_frac': 0.00755292009863295, 'bb_std_mult': 1.0077357476462772, 'rsi_os': 38, 'rsi_ob': 82, 'vol_spike': 0.0062409471365043045, 'adx_thresh': 12.66421066367434, 'atr_min_pct': 0.011220873439458077, 'atr_max_pct': 0.08764185761815572, 'tp_mult': 2.862779554340145, 'tsl_mult': 0.302574510772323, 'strategy': 'breakout', 'time_stop': 265, 'use_sma': False, 'use_atr': False, 'use_adx': True, 'use_ema': False, 'use_spike': True, 'rsi_required': True, 'edge_k': 0.721173016222904, 'edge_cap': 0.1149966069567262, 'bull_strategy': 'mean_reversion', 'bull_bb_std_mult': 3.286357541189393, 'bull_rsi_os': 29, 'bull_rsi_ob': 66, 'bull_adx_thresh': 30.99668548979073, 'bull_atr_min_pct': 0.006055689825116528, 'bull_atr_max_pct': 0.09857719983522703, 'bull_tp_mult': 2.5446249548040196, 'bull_tsl_mult': 0.398289225950986, 'bull_time_stop': 28, 'bull_use_sma': True, 'bull_use_ema': True, 'bull_use_atr': False, 'bull_use_adx': False, 'bull_use_spike': False, 'bull_rsi_required': True, 'bear_strategy': 'breakout', 'bear_bb_std_mult': 3.081941473800625, 'bear_rsi_os': 33, 'bear_rsi_ob': 78, 'bear_adx_thresh': 31.641611304711493, 'bear_atr_min_pct': 0.006795715070877574, 'bear_atr_max_pct': 0.10276398857591654, 'bear_tp_mult': 2.300537443582272, 'bear_tsl_mult': 0.7238912406462389, 'bear_time_stop': 239, 'bear_use_sma': True, 'bear_use_ema': True, 'bear_use_atr': True, 'bear_use_adx': True, 'bear_use_spike': True, 'bear_rsi_required': True, 'sideways_strategy': 'breakout', 'sideways_bb_std_mult': 2.531113801533748, 'sideways_rsi_os': 27, 'sideways_rsi_ob': 51, 'sideways_adx_thresh': 26.14371048068871, 'sideways_atr_min_pct': 0.02449926822593846, 'sideways_atr_max_pct': 0.14992407427996687, 'sideways_tp_mult': 1.8274323489965543, 'sideways_tsl_mult': 0.9053133337043391, 'sideways_time_stop': 216, 'sideways_use_sma': False, 'sideways_use_ema': False, 'sideways_use_atr': False, 'sideways_use_adx': True, 'sideways_use_spike': False, 'sideways_rsi_required': False}.
