[I 2025-08-31 09:20:10,979] Trial 12 finished with values: [-1000000000.0, 1000000000.0] and parameters: {'p_sma': 30, 'p_std': 52, 'p_atr': 15, 'p_adx': 20, 'rsi_period': 19, 'ema1': 7, 'ema2': 47, 'slip_atr_k': 0.04863203657306639, 'slip_spread_k': 0.7318512802853994, 'spread_hl_frac': 0.01859415668593109, 'bb_std_mult': 3.5210549632970873, 'rsi_os': 12, 'rsi_ob': 53, 'vol_spike': 0.19728382939165026, 'adx_thresh': 27.48596739354582, 'atr_min_pct': 0.027466526117718743, 'atr_max_pct': 0.02303402820135751, 'tp_mult': 1.6311699974779617, 'tsl_mult': 0.7927899215898624, 'strategy': 'mean_reversion', 'time_stop': 224, 'use_sma': True, 'use_atr': True, 'use_adx': True, 'use_ema': True, 'use_spike': True, 'rsi_required': False, 'edge_k': 0.04612785307250067, 'edge_cap': 0.3891289028644762, 'bull_strategy': 'breakout', 'bull_bb_std_mult': 0.5559820766750607, 'bull_rsi_os': 7, 'bull_rsi_ob': 66, 'bull_adx_thresh': 29.131208814909588, 'bull_atr_min_pct': 0.012961447853671013, 'bull_atr_max_pct': 0.13619091795630203, 'bull_tp_mult': 2.7429128114629604, 'bull_tsl_mult': 0.34574953574287204, 'bull_time_stop': 213, 'bull_use_sma': True, 'bull_use_ema': True, 'bull_use_atr': True, 'bull_use_adx': True, 'bull_use_spike': True, 'bull_rsi_required': True, 'bear_strategy': 'breakout', 'bear_bb_std_mult': 1.9557245466269875, 'bear_rsi_os': 8, 'bear_rsi_ob': 67, 'bear_adx_thresh': 19.983400517691507, 'bear_atr_min_pct': 0.029234773233047334, 'bear_atr_max_pct': 0.027131975944575164, 'bear_tp_mult': 1.130823293805064, 'bear_tsl_mult': 0.3060170061063966, 'bear_time_stop': 101, 'bear_use_sma': False, 'bear_use_ema': True, 'bear_use_atr': True, 'bear_use_adx': False, 'bear_use_spike': False, 'bear_rsi_required': True, 'sideways_strategy': 'breakout', 'sideways_bb_std_mult': 1.7398387887990323, 'sideways_rsi_os': 12, 'sideways_rsi_ob': 65, 'sideways_adx_thresh': 8.338854558330937, 'sideways_atr_min_pct': 0.0023369771562718397, 'sideways_atr_max_pct': 0.09429720353358689, 'sideways_tp_mult': 2.6231061339371076, 'sideways_tsl_mult': 0.8400449173307281, 'sideways_time_stop': 134, 'sideways_use_sma': False, 'sideways_use_ema': False, 'sideways_use_atr': True, 'sideways_use_adx': False, 'sideways_use_spike': True, 'sideways_rsi_required': True}.
[I 2025-08-31 09:20:11,202] Trial 8 finished with values: [-1000000000.0, 1000000000.0] and parameters: {'p_sma': 49, 'p_std': 38, 'p_atr': 7, 'p_adx': 10, 'rsi_period': 32, 'ema1': 18, 'ema2': 50, 'slip_atr_k': 0.06366653268188682, 'slip_spread_k': 0.43726016005588897, 'spread_hl_frac': 0.006879968187961405, 'bb_std_mult': 2.4850263175477147, 'rsi_os': 8, 'rsi_ob': 83, 'vol_spike': 0.23298078378850962, 'adx_thresh': 14.531446904015446, 'atr_min_pct': 0.021109401286476606, 'atr_max_pct': 0.12707293271823755, 'tp_mult': 1.7512886318106273, 'tsl_mult': 0.06858196557781193, 'strategy': 'breakout', 'time_stop': 236, 'use_sma': False, 'use_atr': False, 'use_adx': False, 'use_ema': True, 'use_spike': True, 'rsi_required': True, 'edge_k': 0.49031066685621605, 'edge_cap': 0.41982145206533966, 'bull_strategy': 'mean_reversion', 'bull_bb_std_mult': 3.488520225070694, 'bull_rsi_os': 29, 'bull_rsi_ob': 62, 'bull_adx_thresh': 21.80495125401274, 'bull_atr_min_pct': 0.0009471989779401235, 'bull_atr_max_pct': 0.0362369511332112, 'bull_tp_mult': 2.74250845206253, 'bull_tsl_mult': 0.47809252833947236, 'bull_time_stop': 128, 'bull_use_sma': False, 'bull_use_ema': True, 'bull_use_atr': True, 'bull_use_adx': True, 'bull_use_spike': False, 'bull_rsi_required': False, 'bear_strategy': 'breakout', 'bear_bb_std_mult': 1.2196860112127212, 'bear_rsi_os': 19, 'bear_rsi_ob': 69, 'bear_adx_thresh': 14.314615386791335, 'bear_atr_min_pct': 0.014033018797666968, 'bear_atr_max_pct': 0.09410116041423604, 'bear_tp_mult': 2.596936888668876, 'bear_tsl_mult': 0.5311516397002599, 'bear_time_stop': 121, 'bear_use_sma': True, 'bear_use_ema': True, 'bear_use_atr': False, 'bear_use_adx': False, 'bear_use_spike': False, 'bear_rsi_required': True, 'sideways_strategy': 'breakout', 'sideways_bb_std_mult': 1.1301909086102169, 'sideways_rsi_os': 21, 'sideways_rsi_ob': 60, 'sideways_adx_thresh': 16.690945486862976, 'sideways_atr_min_pct': 0.0006502620053270258, 'sideways_atr_max_pct': 0.036909607444761634, 'sideways_tp_mult': 2.3247790400120523, 'sideways_tsl_mult': 0.15389293564650852, 'sideways_time_stop': 218, 'sideways_use_sma': False, 'sideways_use_ema': False, 'sideways_use_atr': True, 'sideways_use_adx': False, 'sideways_use_spike': False, 'sideways_rsi_required': False}.
[I 2025-08-31 09:20:42,794] Trial 9 finished with values: [-1000000000.0, 1000000000.0] and parameters: {'p_sma': 18, 'p_std': 50, 'p_atr': 10, 'p_adx': 29, 'rsi_period': 55, 'ema1': 14, 'ema2': 54, 'slip_atr_k': 0.19212139041525647, 'slip_spread_k': 0.70969414454918, 'spread_hl_frac': 0.015556286609301001, 'bb_std_mult': 3.074917328104105, 'rsi_os': 44, 'rsi_ob': 69, 'vol_spike': 0.10926574466494446, 'adx_thresh': 10.622487921698148, 'atr_min_pct': 0.017900874572819806, 'atr_max_pct': 0.07359769064166055, 'tp_mult': 1.0326287810009158, 'tsl_mult': 0.8030851003190452, 'strategy': 'mean_reversion', 'time_stop': 59, 'use_sma': False, 'use_atr': True, 'use_adx': False, 'use_ema': False, 'use_spike': True, 'rsi_required': False, 'edge_k': 1.6054957035664783, 'edge_cap': 0.3391561515902703, 'bull_strategy': 'breakout', 'bull_bb_std_mult': 1.9383157980152317, 'bull_rsi_os': 52, 'bull_rsi_ob': 78, 'bull_adx_thresh': 30.304760266331783, 'bull_atr_min_pct': 0.01403939042662184, 'bull_atr_max_pct': 0.10534210512975173, 'bull_tp_mult': 2.8082879861662664, 'bull_tsl_mult': 0.29129346805599676, 'bull_time_stop': 57, 'bull_use_sma': False, 'bull_use_ema': False, 'bull_use_atr': True, 'bull_use_adx': False, 'bull_use_spike': True, 'bull_rsi_required': True, 'bear_strategy': 'breakout', 'bear_bb_std_mult': 2.8812180738164987, 'bear_rsi_os': 48, 'bear_rsi_ob': 77, 'bear_adx_thresh': 14.799211909804077, 'bear_atr_min_pct': 0.019668681693584524, 'bear_atr_max_pct': 0.09172693478336105, 'bear_tp_mult': 1.503193657334794, 'bear_tsl_mult': 0.7029819218964036, 'bear_time_stop': 86, 'bear_use_sma': False, 'bear_use_ema': False, 'bear_use_atr': True, 'bear_use_adx': True, 'bear_use_spike': True, 'bear_rsi_required': True, 'sideways_strategy': 'mean_reversion', 'sideways_bb_std_mult': 1.5480507561052688, 'sideways_rsi_os': 5, 'sideways_rsi_ob': 84, 'sideways_adx_thresh': 9.823864378960396, 'sideways_atr_min_pct': 0.016352761171810098, 'sideways_atr_max_pct': 0.02151369716735799, 'sideways_tp_mult': 1.763252238280099, 'sideways_tsl_mult': 0.23394133378963167, 'sideways_time_stop': 134, 'sideways_use_sma': False, 'sideways_use_ema': False, 'sideways_use_atr': False, 'sideways_use_adx': True, 'sideways_use_spike': False, 'sideways_rsi_required': False}.
[I 2025-08-31 09:20:45,047] Trial 11 finished with values: [-1000000000.0, 1000000000.0] and parameters: {'p_sma': 60, 'p_std': 7, 'p_atr': 24, 'p_adx': 15, 'rsi_period': 14, 'ema1': 6, 'ema2': 37, 'slip_atr_k': 0.09871862459424838, 'slip_spread_k': 0.5184841109635844, 'spread_hl_frac': 0.004841089583112368, 'bb_std_mult': 0.5229143211090891, 'rsi_os': 21, 'rsi_ob': 84, 'vol_spike': 0.21316755845445925, 'adx_thresh': 20.554617204634113, 'atr_min_pct': 0.0022079872164301605, 'atr_max_pct': 0.14613402253710275, 'tp_mult': 2.254407393824907, 'tsl_mult': 0.9378182990293369, 'strategy': 'mean_reversion', 'time_stop': 149, 'use_sma': False, 'use_atr': False, 'use_adx': True, 'use_ema': True, 'use_spike': True, 'rsi_required': True, 'edge_k': 1.536938821062984, 'edge_cap': 0.30827292840000037, 'bull_strategy': 'breakout', 'bull_bb_std_mult': 1.767441586895097, 'bull_rsi_os': 31, 'bull_rsi_ob': 84, 'bull_adx_thresh': 15.97499319458265, 'bull_atr_min_pct': 0.017981312759361247, 'bull_atr_max_pct': 0.13523479338152097, 'bull_tp_mult': 1.6154356336699436, 'bull_tsl_mult': 0.5858792094096932, 'bull_time_stop': 256, 'bull_use_sma': True, 'bull_use_ema': False, 'bull_use_atr': True, 'bull_use_adx': False, 'bull_use_spike': False, 'bull_rsi_required': True, 'bear_strategy': 'mean_reversion', 'bear_bb_std_mult': 3.288708707823402, 'bear_rsi_os': 40, 'bear_rsi_ob': 78, 'bear_adx_thresh': 14.053143227996882, 'bear_atr_min_pct': 0.017948822867898662, 'bear_atr_max_pct': 0.09204047012668555, 'bear_tp_mult': 1.4960304528470536, 'bear_tsl_mult': 0.4948478894584264, 'bear_time_stop': 166, 'bear_use_sma': True, 'bear_use_ema': False, 'bear_use_atr': True, 'bear_use_adx': True, 'bear_use_spike': True, 'bear_rsi_required': False, 'sideways_strategy': 'mean_reversion', 'sideways_bb_std_mult': 0.6000091664114584, 'sideways_rsi_os': 20, 'sideways_rsi_ob': 66, 'sideways_adx_thresh': 29.67311932121672, 'sideways_atr_min_pct': 0.0021857824599185905, 'sideways_atr_max_pct': 0.09289763171204736, 'sideways_tp_mult': 2.6085701218693447, 'sideways_tsl_mult': 0.3740498654310289, 'sideways_time_stop': 14, 'sideways_use_sma': False, 'sideways_use_ema': True, 'sideways_use_atr': False, 'sideways_use_adx': True, 'sideways_use_spike': True, 'sideways_rsi_required': True}.
[I 2025-08-31 09:20:47,471] Trial 13 finished with values: [-1000000000.0, 1000000000.0] and parameters: {'p_sma': 59, 'p_std': 18, 'p_atr': 21, 'p_adx': 16, 'rsi_period': 39, 'ema1': 28, 'ema2': 10, 'slip_atr_k': 0.010928397154375213, 'slip_spread_k': 0.0016729820069964485, 'spread_hl_frac': 0.001212325315696046, 'bb_std_mult': 3.594436782246368, 'rsi_os': 43, 'rsi_ob': 79, 'vol_spike': 0.06549133426043552, 'adx_thresh': 34.79786332862093, 'atr_min_pct': 0.0052799135456443255, 'atr_max_pct': 0.11137714069463803, 'tp_mult': 1.0458272936142892, 'tsl_mult': 0.3614545292361768, 'strategy': 'mean_reversion', 'time_stop': 83, 'use_sma': False, 'use_atr': False, 'use_adx': True, 'use_ema': False, 'use_spike': True, 'rsi_required': False, 'edge_k': 1.957453825222651, 'edge_cap': 0.05140278897082251, 'bull_strategy': 'breakout', 'bull_bb_std_mult': 2.607128256042495, 'bull_rsi_os': 55, 'bull_rsi_ob': 88, 'bull_adx_thresh': 14.656959028115626, 'bull_atr_min_pct': 0.02191050351838828, 'bull_atr_max_pct': 0.055249224839867855, 'bull_tp_mult': 1.0652759687365871, 'bull_tsl_mult': 0.6427887874618969, 'bull_time_stop': 9, 'bull_use_sma': False, 'bull_use_ema': False, 'bull_use_atr': False, 'bull_use_adx': False, 'bull_use_spike': False, 'bull_rsi_required': False, 'bear_strategy': 'mean_reversion', 'bear_bb_std_mult': 0.5202597543573044, 'bear_rsi_os': 13, 'bear_rsi_ob': 95, 'bear_adx_thresh': 32.948303164963086, 'bear_atr_min_pct': 0.023653942902455562, 'bear_atr_max_pct': 0.11011348219005808, 'bear_tp_mult': 1.751098783416721, 'bear_tsl_mult': 0.5162514395459933, 'bear_time_stop': 182, 'bear_use_sma': True, 'bear_use_ema': False, 'bear_use_atr': True, 'bear_use_adx': True, 'bear_use_spike': False, 'bear_rsi_required': False, 'sideways_strategy': 'mean_reversion', 'sideways_bb_std_mult': 2.7714257074894375, 'sideways_rsi_os': 32, 'sideways_rsi_ob': 95, 'sideways_adx_thresh': 15.932071554256169, 'sideways_atr_min_pct': 0.029641296372805177, 'sideways_atr_max_pct': 0.14884353331981987, 'sideways_tp_mult': 1.0291621022158088, 'sideways_tsl_mult': 0.6110495235581367, 'sideways_time_stop': 23, 'sideways_use_sma': False, 'sideways_use_ema': True, 'sideways_use_atr': False, 'sideways_use_adx': True, 'sideways_use_spike': False, 'sideways_rsi_required': False}.
[I 2025-08-31 09:20:48,180] Trial 14 finished with values: [-1000000000.0, 1000000000.0] and parameters: {'p_sma': 9, 'p_std': 5, 'p_atr': 30, 'p_adx': 14, 'rsi_period': 7, 'ema1': 30, 'ema2': 13, 'slip_atr_k': 0.011625517315996453, 'slip_spread_k': 0.06552988426941309, 'spread_hl_frac': 0.04940556998950749, 'bb_std_mult': 3.4048172639663985, 'rsi_os': 23, 'rsi_ob': 76, 'vol_spike': 0.0821753055315098, 'adx_thresh': 34.80103330259048, 'atr_min_pct': 0.00035820858220311086, 'atr_max_pct': 0.10476564785053363, 'tp_mult': 1.1810699474738617, 'tsl_mult': 0.6810478226107044, 'strategy': 'breakout', 'time_stop': 92, 'use_sma': True, 'use_atr': True, 'use_adx': True, 'use_ema': False, 'use_spike': False, 'rsi_required': False, 'edge_k': 1.9781543421084082, 'edge_cap': 0.10879647225963912, 'bull_strategy': 'breakout', 'bull_bb_std_mult': 1.209386588031654, 'bull_rsi_os': 55, 'bull_rsi_ob': 84, 'bull_adx_thresh': 13.58873992095534, 'bull_atr_min_pct': 0.02155897936679467, 'bull_atr_max_pct': 0.0632922974608868, 'bull_tp_mult': 1.0215069770310528, 'bull_tsl_mult': 0.033246685396896625, 'bull_time_stop': 5, 'bull_use_sma': False, 'bull_use_ema': False, 'bull_use_atr': False, 'bull_use_adx': False, 'bull_use_spike': True, 'bull_rsi_required': False, 'bear_strategy': 'mean_reversion', 'bear_bb_std_mult': 3.563339338267619, 'bear_rsi_os': 5, 'bear_rsi_ob': 89, 'bear_adx_thresh': 34.79102084381627, 'bear_atr_min_pct': 0.028230268521014547, 'bear_atr_max_pct': 0.059765885455308254, 'bear_tp_mult': 1.6155105869999202, 'bear_tsl_mult': 0.03634855777490781, 'bear_time_stop': 23, 'bear_use_sma': True, 'bear_use_ema': True, 'bear_use_atr': True, 'bear_use_adx': False, 'bear_use_spike': False, 'bear_rsi_required': False, 'sideways_strategy': 'mean_reversion', 'sideways_bb_std_mult': 2.6693197622251503, 'sideways_rsi_os': 34, 'sideways_rsi_ob': 93, 'sideways_adx_thresh': 33.170721665509284, 'sideways_atr_min_pct': 0.009044486947892161, 'sideways_atr_max_pct': 0.14795744113147818, 'sideways_tp_mult': 1.0386789121914801, 'sideways_tsl_mult': 0.558703040528901, 'sideways_time_stop': 12, 'sideways_use_sma': False, 'sideways_use_ema': True, 'sideways_use_atr': False, 'sideways_use_adx': True, 'sideways_use_spike': True, 'sideways_rsi_required': True}.
[I 2025-08-31 09:21:24,125] Trial 15 finished with values: [-1000000000.0, 1000000000.0] and parameters: {'p_sma': 60, 'p_std': 6, 'p_atr': 30, 'p_adx': 16, 'rsi_period': 39, 'ema1': 30, 'ema2': 12, 'slip_atr_k': 0.008101712733957628, 'slip_spread_k': 0.003786151359254475, 'spread_hl_frac': 0.04502849411717188, 'bb_std_mult': 1.481187755309494, 'rsi_os': 24, 'rsi_ob': 45, 'vol_spike': 0.07269908818232933, 'adx_thresh': 17.054450566321453, 'atr_min_pct': 0.00475482563746933, 'atr_max_pct': 0.1033876340553745, 'tp_mult': 2.858587290632849, 'tsl_mult': 0.3471367025013167, 'strategy': 'breakout', 'time_stop': 106, 'use_sma': True, 'use_atr': False, 'use_adx': True, 'use_ema': False, 'use_spike': False, 'rsi_required': False, 'edge_k': 1.8902376639892078, 'edge_cap': 0.05886628471613192, 'bull_strategy': 'breakout', 'bull_bb_std_mult': 1.124109881234729, 'bull_rsi_os': 38, 'bull_rsi_ob': 45, 'bull_adx_thresh': 13.991003329421861, 'bull_atr_min_pct': 0.023035328303216515, 'bull_atr_max_pct': 0.0625783906840417, 'bull_tp_mult': 1.0282668553792589, 'bull_tsl_mult': 0.03517922478548596, 'bull_time_stop': 10, 'bull_use_sma': False, 'bull_use_ema': False, 'bull_use_atr': False, 'bull_use_adx': False, 'bull_use_spike': False, 'bull_rsi_required': False, 'bear_strategy': 'mean_reversion', 'bear_bb_std_mult': 3.563999558239069, 'bear_rsi_os': 7, 'bear_rsi_ob': 89, 'bear_adx_thresh': 34.805608088517005, 'bear_atr_min_pct': 0.029831192223878082, 'bear_atr_max_pct': 0.06077283392135428, 'bear_tp_mult': 1.0270785677782646, 'bear_tsl_mult': 0.03210625606583978, 'bear_time_stop': 12, 'bear_use_sma': True, 'bear_use_ema': True, 'bear_use_atr': True, 'bear_use_adx': False, 'bear_use_spike': False, 'bear_rsi_required': False, 'sideways_strategy': 'mean_reversion', 'sideways_bb_std_mult': 2.5817848302351787, 'sideways_rsi_os': 35, 'sideways_rsi_ob': 93, 'sideways_adx_thresh': 34.78105148831088, 'sideways_atr_min_pct': 0.009219051753343876, 'sideways_atr_max_pct': 0.14326826351022237, 'sideways_tp_mult': 1.0208709880013154, 'sideways_tsl_mult': 0.5470903910330556, 'sideways_time_stop': 12, 'sideways_use_sma': False, 'sideways_use_ema': True, 'sideways_use_atr': True, 'sideways_use_adx': True, 'sideways_use_spike': True, 'sideways_rsi_required': True}.
[I 2025-08-31 09:21:26,790] Trial 16 finished with values: [-1000000000.0, 1000000000.0] and parameters: {'p_sma': 6, 'p_std': 19, 'p_atr': 18, 'p_adx': 16, 'rsi_period': 40, 'ema1': 30, 'ema2': 13, 'slip_atr_k': 0.0058281872234036275, 'slip_spread_k': 0.02658887165097429, 'spread_hl_frac': 0.04928986180312233, 'bb_std_mult': 1.4671084744850993, 'rsi_os': 55, 'rsi_ob': 76, 'vol_spike': 0.05858434777010808, 'adx_thresh': 34.5786136769019, 'atr_min_pct': 0.008069067479341385, 'atr_max_pct': 0.10091789548297203, 'tp_mult': 2.8467986241044874, 'tsl_mult': 0.3598743585852879, 'strategy': 'breakout', 'time_stop': 112, 'use_sma': True, 'use_atr': True, 'use_adx': True, 'use_ema': False, 'use_spike': False, 'rsi_required': False, 'edge_k': 0.114525966005944, 'edge_cap': 0.12506489531925208, 'bull_strategy': 'breakout', 'bull_bb_std_mult': 1.069864033319559, 'bull_rsi_os': 39, 'bull_rsi_ob': 45, 'bull_adx_thresh': 14.274718590884198, 'bull_atr_min_pct': 0.023057008433076717, 'bull_atr_max_pct': 0.06405947589629223, 'bull_tp_mult': 1.1032135045315656, 'bull_tsl_mult': 0.040783511688749274, 'bull_time_stop': 24, 'bull_use_sma': False, 'bull_use_ema': False, 'bull_use_atr': False, 'bull_use_adx': True, 'bull_use_spike': True, 'bull_rsi_required': False, 'bear_strategy': 'mean_reversion', 'bear_bb_std_mult': 3.583984119869715, 'bear_rsi_os': 6, 'bear_rsi_ob': 95, 'bear_adx_thresh': 33.85037622303162, 'bear_atr_min_pct': 0.027674031875009754, 'bear_atr_max_pct': 0.05579002613962642, 'bear_tp_mult': 1.0104737013016454, 'bear_tsl_mult': 0.08047221317015268, 'bear_time_stop': 6, 'bear_use_sma': True, 'bear_use_ema': True, 'bear_use_atr': False, 'bear_use_adx': False, 'bear_use_spike': False, 'bear_rsi_required': False, 'sideways_strategy': 'mean_reversion', 'sideways_bb_std_mult': 2.581205315014264, 'sideways_rsi_os': 37, 'sideways_rsi_ob': 95, 'sideways_adx_thresh': 34.75261608840452, 'sideways_atr_min_pct': 0.008809809232786313, 'sideways_atr_max_pct': 0.14960135310576117, 'sideways_tp_mult': 1.0320250986262156, 'sideways_tsl_mult': 0.02425755676621033, 'sideways_time_stop': 187, 'sideways_use_sma': True, 'sideways_use_ema': True, 'sideways_use_atr': True, 'sideways_use_adx': True, 'sideways_use_spike': True, 'sideways_rsi_required': True}.
[I 2025-08-31 09:21:27,839] Trial 17 finished with values: [-1000000000.0, 1000000000.0] and parameters: {'p_sma': 5, 'p_std': 23, 'p_atr': 30, 'p_adx': 24, 'rsi_period': 10, 'ema1': 24, 'ema2': 11, 'slip_atr_k': 0.23821554034877418, 'slip_spread_k': 0.0662142886558793, 'spread_hl_frac': 0.04993266891487443, 'bb_std_mult': 1.4596395973673306, 'rsi_os': 55, 'rsi_ob': 45, 'vol_spike': 0.296716819165202, 'adx_thresh': 18.053580815858616, 'atr_min_pct': 0.008039724604981844, 'atr_max_pct': 0.09730857068576072, 'tp_mult': 2.9366352308145043, 'tsl_mult': 0.6006499304077321, 'strategy': 'breakout', 'time_stop': 9, 'use_sma': True, 'use_atr': True, 'use_adx': True, 'use_ema': False, 'use_spike': False, 'rsi_required': False, 'edge_k': 0.007512679819033141, 'edge_cap': 0.9994906495770303, 'bull_strategy': 'breakout', 'bull_bb_std_mult': 1.1699071145204993, 'bull_rsi_os': 40, 'bull_rsi_ob': 48, 'bull_adx_thresh': 12.492387634263839, 'bull_atr_min_pct': 0.0070542965018118645, 'bull_atr_max_pct': 0.06551223604322645, 'bull_tp_mult': 1.1106444234153354, 'bull_tsl_mult': 0.10924836363369278, 'bull_time_stop': 167, 'bull_use_sma': False, 'bull_use_ema': False, 'bull_use_atr': False, 'bull_use_adx': True, 'bull_use_spike': True, 'bull_rsi_required': False, 'bear_strategy': 'mean_reversion', 'bear_bb_std_mult': 3.451799324307256, 'bear_rsi_os': 5, 'bear_rsi_ob': 45, 'bear_adx_thresh': 28.74014317895724, 'bear_atr_min_pct': 0.028818496974047262, 'bear_atr_max_pct': 0.06297145611237788, 'bear_tp_mult': 1.022315249802531, 'bear_tsl_mult': 0.05795738272949125, 'bear_time_stop': 18, 'bear_use_sma': True, 'bear_use_ema': True, 'bear_use_atr': False, 'bear_use_adx': False, 'bear_use_spike': False, 'bear_rsi_required': True, 'sideways_strategy': 'mean_reversion', 'sideways_bb_std_mult': 2.4965105228475357, 'sideways_rsi_os': 36, 'sideways_rsi_ob': 75, 'sideways_adx_thresh': 5.579346709595443, 'sideways_atr_min_pct': 0.007758215380014653, 'sideways_atr_max_pct': 0.14675904237011422, 'sideways_tp_mult': 1.069580852597641, 'sideways_tsl_mult': 0.0001518496275677017, 'sideways_time_stop': 293, 'sideways_use_sma': True, 'sideways_use_ema': True, 'sideways_use_atr': True, 'sideways_use_adx': True, 'sideways_use_spike': True, 'sideways_rsi_required': True}.
