[I 2025-08-31 10:24:55,265] Trial 515 finished with values: [-1000000000.0, 1000000000.0] and parameters: {'p_sma': 12, 'p_std': 51, 'p_atr': 12, 'p_adx': 24, 'rsi_period': 28, 'ema1': 18, 'ema2': 36, 'slip_atr_k': 0.17837480071883371, 'slip_spread_k': 0.1080850142103309, 'spread_hl_frac': 0.01118375944939351, 'bb_std_mult': 1.173122565491446, 'rsi_os': 40, 'rsi_ob': 84, 'vol_spike': 0.29308855406544465, 'adx_thresh': 23.281423159968757, 'atr_min_pct': 0.011043885162000285, 'atr_max_pct': 0.11949568347880765, 'tp_mult': 1.7958616176808728, 'tsl_mult': 0.059863898282922275, 'strategy': 'mean_reversion', 'time_stop': 258, 'use_sma': False, 'use_atr': True, 'use_adx': False, 'use_ema': True, 'use_spike': False, 'rsi_required': True, 'edge_k': 1.8874400742741264, 'edge_cap': 0.1271073168955388, 'bull_strategy': 'mean_reversion', 'bull_bb_std_mult': 2.0196071710640275, 'bull_rsi_os': 27, 'bull_rsi_ob': 63, 'bull_adx_thresh': 30.68943097088192, 'bull_atr_min_pct': 0.007793125040876095, 'bull_atr_max_pct': 0.08775348999700627, 'bull_tp_mult': 2.226891943284005, 'bull_tsl_mult': 0.9366815565424299, 'bull_time_stop': 78, 'bull_use_sma': True, 'bull_use_ema': True, 'bull_use_atr': True, 'bull_use_adx': True, 'bull_use_spike': False, 'bull_rsi_required': True, 'bear_strategy': 'breakout', 'bear_bb_std_mult': 3.0421195539968355, 'bear_rsi_os': 29, 'bear_rsi_ob': 95, 'bear_adx_thresh': 22.296288031316248, 'bear_atr_min_pct': 0.008076311248514854, 'bear_atr_max_pct': 0.11115933755151987, 'bear_tp_mult': 2.080704629778181, 'bear_tsl_mult': 0.4488895150541614, 'bear_time_stop': 264, 'bear_use_sma': False, 'bear_use_ema': False, 'bear_use_atr': True, 'bear_use_adx': True, 'bear_use_spike': True, 'bear_rsi_required': False, 'sideways_strategy': 'mean_reversion', 'sideways_bb_std_mult': 0.899944911346581, 'sideways_rsi_os': 47, 'sideways_rsi_ob': 95, 'sideways_adx_thresh': 30.131893832103845, 'sideways_atr_min_pct': 0.007284568526882087, 'sideways_atr_max_pct': 0.10225872444108149, 'sideways_tp_mult': 2.8407217907655187, 'sideways_tsl_mult': 0.3603778357383455, 'sideways_time_stop': 225, 'sideways_use_sma': False, 'sideways_use_ema': False, 'sideways_use_atr': False, 'sideways_use_adx': False, 'sideways_use_spike': True, 'sideways_rsi_required': True}.
[I 2025-08-31 10:24:55,433] Trial 514 finished with values: [-1000000000.0, 1000000000.0] and parameters: {'p_sma': 10, 'p_std': 51, 'p_atr': 29, 'p_adx': 7, 'rsi_period': 23, 'ema1': 16, 'ema2': 23, 'slip_atr_k': 0.17911447435126437, 'slip_spread_k': 0.09914754465805882, 'spread_hl_frac': 0.01124608000657427, 'bb_std_mult': 1.272117466337845, 'rsi_os': 40, 'rsi_ob': 84, 'vol_spike': 0.2992905470357171, 'adx_thresh': 24.21305657986434, 'atr_min_pct': 0.024471310505679675, 'atr_max_pct': 0.12322362186636135, 'tp_mult': 1.473915952576343, 'tsl_mult': 0.05531791099729427, 'strategy': 'mean_reversion', 'time_stop': 5, 'use_sma': False, 'use_atr': True, 'use_adx': False, 'use_ema': True, 'use_spike': False, 'rsi_required': True, 'edge_k': 1.8953013064242343, 'edge_cap': 0.4705344643430506, 'bull_strategy': 'mean_reversion', 'bull_bb_std_mult': 1.1621536557897596, 'bull_rsi_os': 27, 'bull_rsi_ob': 69, 'bull_adx_thresh': 24.79603025094702, 'bull_atr_min_pct': 0.00751060102593294, 'bull_atr_max_pct': 0.08331724765714453, 'bull_tp_mult': 2.245502478715559, 'bull_tsl_mult': 0.9422294545237034, 'bull_time_stop': 77, 'bull_use_sma': True, 'bull_use_ema': True, 'bull_use_atr': False, 'bull_use_adx': False, 'bull_use_spike': False, 'bull_rsi_required': True, 'bear_strategy': 'breakout', 'bear_bb_std_mult': 3.081956722154632, 'bear_rsi_os': 28, 'bear_rsi_ob': 73, 'bear_adx_thresh': 29.057940430601928, 'bear_atr_min_pct': 0.007508347912092967, 'bear_atr_max_pct': 0.11152508618156456, 'bear_tp_mult': 2.067112514917304, 'bear_tsl_mult': 0.4114558266106841, 'bear_time_stop': 263, 'bear_use_sma': False, 'bear_use_ema': False, 'bear_use_atr': True, 'bear_use_adx': True, 'bear_use_spike': True, 'bear_rsi_required': False, 'sideways_strategy': 'mean_reversion', 'sideways_bb_std_mult': 0.8970112305568885, 'sideways_rsi_os': 47, 'sideways_rsi_ob': 95, 'sideways_adx_thresh': 30.09983845424531, 'sideways_atr_min_pct': 0.01686493658504858, 'sideways_atr_max_pct': 0.1033975092402982, 'sideways_tp_mult': 2.978324926566808, 'sideways_tsl_mult': 0.06066425568440126, 'sideways_time_stop': 164, 'sideways_use_sma': False, 'sideways_use_ema': False, 'sideways_use_atr': False, 'sideways_use_adx': False, 'sideways_use_spike': True, 'sideways_rsi_required': True}.
[I 2025-08-31 10:24:55,522] Trial 516 finished with values: [-1000000000.0, 1000000000.0] and parameters: {'p_sma': 12, 'p_std': 45, 'p_atr': 12, 'p_adx': 29, 'rsi_period': 54, 'ema1': 18, 'ema2': 36, 'slip_atr_k': 0.18708541018701688, 'slip_spread_k': 0.10183277953176187, 'spread_hl_frac': 0.011297375800023716, 'bb_std_mult': 1.2535954728642826, 'rsi_os': 40, 'rsi_ob': 84, 'vol_spike': 0.2909887887602033, 'adx_thresh': 23.180233282357776, 'atr_min_pct': 0.01070547163634464, 'atr_max_pct': 0.11866314623173246, 'tp_mult': 1.4888369711305591, 'tsl_mult': 0.08892239142849083, 'strategy': 'mean_reversion', 'time_stop': 131, 'use_sma': True, 'use_atr': True, 'use_adx': True, 'use_ema': True, 'use_spike': False, 'rsi_required': True, 'edge_k': 1.879274329890789, 'edge_cap': 0.11726040621999653, 'bull_strategy': 'breakout', 'bull_bb_std_mult': 1.9929822131388364, 'bull_rsi_os': 27, 'bull_rsi_ob': 65, 'bull_adx_thresh': 10.23974350613318, 'bull_atr_min_pct': 0.006511426208454081, 'bull_atr_max_pct': 0.08747066617813679, 'bull_tp_mult': 2.2196045582564157, 'bull_tsl_mult': 0.930843077619267, 'bull_time_stop': 77, 'bull_use_sma': True, 'bull_use_ema': True, 'bull_use_atr': True, 'bull_use_adx': True, 'bull_use_spike': False, 'bull_rsi_required': False, 'bear_strategy': 'breakout', 'bear_bb_std_mult': 0.9603039751957068, 'bear_rsi_os': 29, 'bear_rsi_ob': 80, 'bear_adx_thresh': 25.973768214951033, 'bear_atr_min_pct': 0.008080397913382114, 'bear_atr_max_pct': 0.11072195398812805, 'bear_tp_mult': 1.9597801530392502, 'bear_tsl_mult': 0.4497378738347554, 'bear_time_stop': 263, 'bear_use_sma': False, 'bear_use_ema': False, 'bear_use_atr': False, 'bear_use_adx': True, 'bear_use_spike': True, 'bear_rsi_required': False, 'sideways_strategy': 'mean_reversion', 'sideways_bb_std_mult': 0.8885316353663284, 'sideways_rsi_os': 22, 'sideways_rsi_ob': 93, 'sideways_adx_thresh': 30.731462531860885, 'sideways_atr_min_pct': 0.0014195605756292368, 'sideways_atr_max_pct': 0.10410010027281567, 'sideways_tp_mult': 2.833749626623106, 'sideways_tsl_mult': 0.8964228019153153, 'sideways_time_stop': 224, 'sideways_use_sma': True, 'sideways_use_ema': False, 'sideways_use_atr': False, 'sideways_use_adx': False, 'sideways_use_spike': True, 'sideways_rsi_required': True}.
[I 2025-08-31 10:24:55,751] Trial 513 finished with values: [-1000000000.0, 1000000000.0] and parameters: {'p_sma': 11, 'p_std': 51, 'p_atr': 12, 'p_adx': 7, 'rsi_period': 57, 'ema1': 18, 'ema2': 37, 'slip_atr_k': 0.17946302697628355, 'slip_spread_k': 0.09677863864260318, 'spread_hl_frac': 0.01086692042478136, 'bb_std_mult': 1.288815533123691, 'rsi_os': 39, 'rsi_ob': 86, 'vol_spike': 0.2999259021983158, 'adx_thresh': 24.133095705083907, 'atr_min_pct': 0.011357124354718147, 'atr_max_pct': 0.12313216689393619, 'tp_mult': 1.4748993769222487, 'tsl_mult': 0.14542000055809118, 'strategy': 'breakout', 'time_stop': 132, 'use_sma': False, 'use_atr': True, 'use_adx': False, 'use_ema': True, 'use_spike': False, 'rsi_required': True, 'edge_k': 1.4817139137974569, 'edge_cap': 0.15890671985395743, 'bull_strategy': 'mean_reversion', 'bull_bb_std_mult': 1.169128013298199, 'bull_rsi_os': 27, 'bull_rsi_ob': 69, 'bull_adx_thresh': 30.688592748528123, 'bull_atr_min_pct': 0.00767166511104987, 'bull_atr_max_pct': 0.08245550332494776, 'bull_tp_mult': 2.225965482371422, 'bull_tsl_mult': 0.9326631894317768, 'bull_time_stop': 77, 'bull_use_sma': True, 'bull_use_ema': True, 'bull_use_atr': False, 'bull_use_adx': False, 'bull_use_spike': False, 'bull_rsi_required': True, 'bear_strategy': 'breakout', 'bear_bb_std_mult': 2.981957400469092, 'bear_rsi_os': 29, 'bear_rsi_ob': 70, 'bear_adx_thresh': 21.426483818786142, 'bear_atr_min_pct': 0.0077052523532990524, 'bear_atr_max_pct': 0.10820612641559364, 'bear_tp_mult': 2.062547318230261, 'bear_tsl_mult': 0.44886438767393727, 'bear_time_stop': 262, 'bear_use_sma': False, 'bear_use_ema': False, 'bear_use_atr': True, 'bear_use_adx': True, 'bear_use_spike': True, 'bear_rsi_required': False, 'sideways_strategy': 'breakout', 'sideways_bb_std_mult': 0.8647518401281007, 'sideways_rsi_os': 13, 'sideways_rsi_ob': 95, 'sideways_adx_thresh': 30.060625932246335, 'sideways_atr_min_pct': 0.017024946678689302, 'sideways_atr_max_pct': 0.10336634157483963, 'sideways_tp_mult': 2.792122102894055, 'sideways_tsl_mult': 0.880170984832874, 'sideways_time_stop': 225, 'sideways_use_sma': False, 'sideways_use_ema': True, 'sideways_use_atr': False, 'sideways_use_adx': False, 'sideways_use_spike': True, 'sideways_rsi_required': False}.
[I 2025-08-31 10:25:28,799] Trial 520 finished with values: [-1000000000.0, 1000000000.0] and parameters: {'p_sma': 14, 'p_std': 48, 'p_atr': 30, 'p_adx': 16, 'rsi_period': 82, 'ema1': 18, 'ema2': 39, 'slip_atr_k': 0.18524122136275165, 'slip_spread_k': 0.16477667938249302, 'spread_hl_frac': 0.010170168262712614, 'bb_std_mult': 1.1553033818426997, 'rsi_os': 43, 'rsi_ob': 83, 'vol_spike': 0.272852857209134, 'adx_thresh': 25.255104183423814, 'atr_min_pct': 0.00010026879575663998, 'atr_max_pct': 0.12474269745622127, 'tp_mult': 2.1816834560369713, 'tsl_mult': 0.08522836224401019, 'strategy': 'breakout', 'time_stop': 173, 'use_sma': True, 'use_atr': False, 'use_adx': True, 'use_ema': True, 'use_spike': True, 'rsi_required': False, 'edge_k': 0.9820293312353504, 'edge_cap': 0.9438618346545142, 'bull_strategy': 'breakout', 'bull_bb_std_mult': 1.2213039010657651, 'bull_rsi_os': 24, 'bull_rsi_ob': 58, 'bull_adx_thresh': 6.3493063717482165, 'bull_atr_min_pct': 0.006756953149293728, 'bull_atr_max_pct': 0.08539695601619607, 'bull_tp_mult': 2.140201384457245, 'bull_tsl_mult': 0.9688162289464031, 'bull_time_stop': 58, 'bull_use_sma': False, 'bull_use_ema': False, 'bull_use_atr': False, 'bull_use_adx': False, 'bull_use_spike': True, 'bull_rsi_required': False, 'bear_strategy': 'mean_reversion', 'bear_bb_std_mult': 1.2376211450958592, 'bear_rsi_os': 31, 'bear_rsi_ob': 81, 'bear_adx_thresh': 24.61576417435511, 'bear_atr_min_pct': 0.006600894610111776, 'bear_atr_max_pct': 0.10545746705593688, 'bear_tp_mult': 1.9633698643661, 'bear_tsl_mult': 0.47024049919291366, 'bear_time_stop': 7, 'bear_use_sma': True, 'bear_use_ema': True, 'bear_use_atr': False, 'bear_use_adx': False, 'bear_use_spike': True, 'bear_rsi_required': True, 'sideways_strategy': 'breakout', 'sideways_bb_std_mult': 0.9357013896930865, 'sideways_rsi_os': 5, 'sideways_rsi_ob': 93, 'sideways_adx_thresh': 28.940793935064942, 'sideways_atr_min_pct': 0.0001327983187636016, 'sideways_atr_max_pct': 0.09951390274759173, 'sideways_tp_mult': 2.9416046492731667, 'sideways_tsl_mult': 0.03774802142682556, 'sideways_time_stop': 235, 'sideways_use_sma': True, 'sideways_use_ema': True, 'sideways_use_atr': True, 'sideways_use_adx': False, 'sideways_use_spike': True, 'sideways_rsi_required': False}.
[I 2025-08-31 10:25:28,987] Trial 518 finished with values: [-1000000000.0, 1000000000.0] and parameters: {'p_sma': 14, 'p_std': 46, 'p_atr': 22, 'p_adx': 29, 'rsi_period': 77, 'ema1': 18, 'ema2': 15, 'slip_atr_k': 0.18763873725233596, 'slip_spread_k': 0.16063860332832902, 'spread_hl_frac': 0.01161139386950229, 'bb_std_mult': 1.1645208216501717, 'rsi_os': 39, 'rsi_ob': 80, 'vol_spike': 0.28777487607446295, 'adx_thresh': 25.304897619866367, 'atr_min_pct': 0.00991959306564753, 'atr_max_pct': 0.11813820897645447, 'tp_mult': 2.2938399291309945, 'tsl_mult': 0.08585591035008153, 'strategy': 'breakout', 'time_stop': 174, 'use_sma': True, 'use_atr': False, 'use_adx': True, 'use_ema': True, 'use_spike': True, 'rsi_required': False, 'edge_k': 1.9604819353388392, 'edge_cap': 0.143642629130467, 'bull_strategy': 'breakout', 'bull_bb_std_mult': 1.2319765305925232, 'bull_rsi_os': 24, 'bull_rsi_ob': 48, 'bull_adx_thresh': 8.753548951888185, 'bull_atr_min_pct': 0.006360998143303727, 'bull_atr_max_pct': 0.08408050233213678, 'bull_tp_mult': 2.135158184559456, 'bull_tsl_mult': 0.9685417096428159, 'bull_time_stop': 57, 'bull_use_sma': False, 'bull_use_ema': False, 'bull_use_atr': False, 'bull_use_adx': False, 'bull_use_spike': False, 'bull_rsi_required': False, 'bear_strategy': 'mean_reversion', 'bear_bb_std_mult': 1.8991424724513664, 'bear_rsi_os': 31, 'bear_rsi_ob': 81, 'bear_adx_thresh': 16.835671535490675, 'bear_atr_min_pct': 0.006640618910652693, 'bear_atr_max_pct': 0.10733020865763518, 'bear_tp_mult': 1.9637232358547945, 'bear_tsl_mult': 0.4454546658904806, 'bear_time_stop': 10, 'bear_use_sma': True, 'bear_use_ema': True, 'bear_use_atr': False, 'bear_use_adx': False, 'bear_use_spike': True, 'bear_rsi_required': True, 'sideways_strategy': 'breakout', 'sideways_bb_std_mult': 0.9014183965841216, 'sideways_rsi_os': 5, 'sideways_rsi_ob': 93, 'sideways_adx_thresh': 28.859445826759355, 'sideways_atr_min_pct': 0.0015499880704787025, 'sideways_atr_max_pct': 0.09991478077017953, 'sideways_tp_mult': 2.946863621067284, 'sideways_tsl_mult': 0.042755844088099626, 'sideways_time_stop': 128, 'sideways_use_sma': True, 'sideways_use_ema': True, 'sideways_use_atr': False, 'sideways_use_adx': False, 'sideways_use_spike': True, 'sideways_rsi_required': False}.
[I 2025-08-31 10:25:29,067] Trial 519 finished with values: [-1000000000.0, 1000000000.0] and parameters: {'p_sma': 14, 'p_std': 46, 'p_atr': 30, 'p_adx': 9, 'rsi_period': 57, 'ema1': 18, 'ema2': 38, 'slip_atr_k': 0.18568440662889632, 'slip_spread_k': 0.08506378176605668, 'spread_hl_frac': 0.01067885111234456, 'bb_std_mult': 1.145466074906571, 'rsi_os': 39, 'rsi_ob': 80, 'vol_spike': 0.2743375859494602, 'adx_thresh': 25.162052644162912, 'atr_min_pct': 0.0176078235300535, 'atr_max_pct': 0.12493427693054433, 'tp_mult': 2.9404241552101493, 'tsl_mult': 0.061026319003332004, 'strategy': 'breakout', 'time_stop': 179, 'use_sma': False, 'use_atr': False, 'use_adx': True, 'use_ema': True, 'use_spike': True, 'rsi_required': False, 'edge_k': 1.573555755206316, 'edge_cap': 0.15056390096852448, 'bull_strategy': 'mean_reversion', 'bull_bb_std_mult': 1.2257352476905823, 'bull_rsi_os': 24, 'bull_rsi_ob': 78, 'bull_adx_thresh': 30.65138290671461, 'bull_atr_min_pct': 0.006944776637030525, 'bull_atr_max_pct': 0.08439458228914133, 'bull_tp_mult': 2.1170339916755214, 'bull_tsl_mult': 0.9676090640061422, 'bull_time_stop': 86, 'bull_use_sma': False, 'bull_use_ema': False, 'bull_use_atr': False, 'bull_use_adx': False, 'bull_use_spike': True, 'bull_rsi_required': True, 'bear_strategy': 'mean_reversion', 'bear_bb_std_mult': 3.195326741521389, 'bear_rsi_os': 31, 'bear_rsi_ob': 78, 'bear_adx_thresh': 22.09472630445273, 'bear_atr_min_pct': 0.006722221423554562, 'bear_atr_max_pct': 0.10635430189098445, 'bear_tp_mult': 1.9676360856134978, 'bear_tsl_mult': 0.47513623082147843, 'bear_time_stop': 261, 'bear_use_sma': True, 'bear_use_ema': True, 'bear_use_atr': False, 'bear_use_adx': False, 'bear_use_spike': True, 'bear_rsi_required': True, 'sideways_strategy': 'breakout', 'sideways_bb_std_mult': 0.9165326964205586, 'sideways_rsi_os': 19, 'sideways_rsi_ob': 93, 'sideways_adx_thresh': 28.963221843380666, 'sideways_atr_min_pct': 0.0007778311628644139, 'sideways_atr_max_pct': 0.09854689558083712, 'sideways_tp_mult': 2.9305733899788464, 'sideways_tsl_mult': 0.7760572322738347, 'sideways_time_stop': 61, 'sideways_use_sma': True, 'sideways_use_ema': True, 'sideways_use_atr': True, 'sideways_use_adx': False, 'sideways_use_spike': True, 'sideways_rsi_required': False}.
[I 2025-08-31 10:25:29,224] Trial 517 finished with values: [-1000000000.0, 1000000000.0] and parameters: {'p_sma': 12, 'p_std': 46, 'p_atr': 30, 'p_adx': 29, 'rsi_period': 77, 'ema1': 18, 'ema2': 31, 'slip_atr_k': 0.18605949097041374, 'slip_spread_k': 0.054016096215506314, 'spread_hl_frac': 0.010450240252901293, 'bb_std_mult': 1.155463874653498, 'rsi_os': 39, 'rsi_ob': 80, 'vol_spike': 0.2851623786394505, 'adx_thresh': 25.31465134333605, 'atr_min_pct': 0.01023701729182, 'atr_max_pct': 0.12429348768048896, 'tp_mult': 2.297589685281786, 'tsl_mult': 0.08674547986457616, 'strategy': 'breakout', 'time_stop': 132, 'use_sma': True, 'use_atr': False, 'use_adx': True, 'use_ema': True, 'use_spike': True, 'rsi_required': False, 'edge_k': 0.43718503369877104, 'edge_cap': 0.11620453201842132, 'bull_strategy': 'breakout', 'bull_bb_std_mult': 1.24331954912158, 'bull_rsi_os': 24, 'bull_rsi_ob': 83, 'bull_adx_thresh': 18.96642469540294, 'bull_atr_min_pct': 0.006370870373589983, 'bull_atr_max_pct': 0.08588743028464468, 'bull_tp_mult': 2.194863357983725, 'bull_tsl_mult': 0.9714960003776326, 'bull_time_stop': 56, 'bull_use_sma': False, 'bull_use_ema': False, 'bull_use_atr': False, 'bull_use_adx': False, 'bull_use_spike': False, 'bull_rsi_required': False, 'bear_strategy': 'mean_reversion', 'bear_bb_std_mult': 1.8966948055046071, 'bear_rsi_os': 31, 'bear_rsi_ob': 80, 'bear_adx_thresh': 22.283736543357286, 'bear_atr_min_pct': 0.00697221444509937, 'bear_atr_max_pct': 0.1079188482046097, 'bear_tp_mult': 1.9646829369185592, 'bear_tsl_mult': 0.4349199666943928, 'bear_time_stop': 261, 'bear_use_sma': True, 'bear_use_ema': True, 'bear_use_atr': False, 'bear_use_adx': False, 'bear_use_spike': True, 'bear_rsi_required': True, 'sideways_strategy': 'breakout', 'sideways_bb_std_mult': 0.9208969384485572, 'sideways_rsi_os': 22, 'sideways_rsi_ob': 93, 'sideways_adx_thresh': 29.05087842387699, 'sideways_atr_min_pct': 0.00927589394886675, 'sideways_atr_max_pct': 0.09907320631299771, 'sideways_tp_mult': 2.9426918338281003, 'sideways_tsl_mult': 0.8778732103470955, 'sideways_time_stop': 234, 'sideways_use_sma': True, 'sideways_use_ema': True, 'sideways_use_atr': False, 'sideways_use_adx': False, 'sideways_use_spike': True, 'sideways_rsi_required': False}.
[I 2025-08-31 10:26:00,821] Trial 524 finished with values: [-1000000000.0, 1000000000.0] and parameters: {'p_sma': 11, 'p_std': 48, 'p_atr': 20, 'p_adx': 22, 'rsi_period': 33, 'ema1': 16, 'ema2': 21, 'slip_atr_k': 0.19393139168735749, 'slip_spread_k': 0.08348051242577859, 'spread_hl_frac': 0.008627801563647314, 'bb_std_mult': 1.2157308737652932, 'rsi_os': 41, 'rsi_ob': 83, 'vol_spike': 0.29272433874819376, 'adx_thresh': 24.59237706128372, 'atr_min_pct': 0.011334218405892485, 'atr_max_pct': 0.12002919691959388, 'tp_mult': 2.9493162969041418, 'tsl_mult': 0.5509983701888748, 'strategy': 'breakout', 'time_stop': 141, 'use_sma': False, 'use_atr': False, 'use_adx': False, 'use_ema': True, 'use_spike': False, 'rsi_required': True, 'edge_k': 1.6357521341703407, 'edge_cap': 0.49564005263452104, 'bull_strategy': 'mean_reversion', 'bull_bb_std_mult': 2.2953539423521145, 'bull_rsi_os': 28, 'bull_rsi_ob': 64, 'bull_adx_thresh': 21.834702246345103, 'bull_atr_min_pct': 0.008069372924016306, 'bull_atr_max_pct': 0.08819291580960897, 'bull_tp_mult': 2.3140150251287395, 'bull_tsl_mult': 0.9573169881116427, 'bull_time_stop': 71, 'bull_use_sma': True, 'bull_use_ema': False, 'bull_use_atr': True, 'bull_use_adx': True, 'bull_use_spike': False, 'bull_rsi_required': True, 'bear_strategy': 'breakout', 'bear_bb_std_mult': 2.8853680201797967, 'bear_rsi_os': 27, 'bear_rsi_ob': 79, 'bear_adx_thresh': 23.229209581452793, 'bear_atr_min_pct': 0.007269064012078038, 'bear_atr_max_pct': 0.09695683166324949, 'bear_tp_mult': 2.1027884612476413, 'bear_tsl_mult': 0.36824565917350943, 'bear_time_stop': 95, 'bear_use_sma': False, 'bear_use_ema': True, 'bear_use_atr': False, 'bear_use_adx': True, 'bear_use_spike': True, 'bear_rsi_required': True, 'sideways_strategy': 'breakout', 'sideways_bb_std_mult': 0.8534673864538193, 'sideways_rsi_os': 24, 'sideways_rsi_ob': 94, 'sideways_adx_thresh': 29.71396150340953, 'sideways_atr_min_pct': 0.005335605688338862, 'sideways_atr_max_pct': 0.11054887430870002, 'sideways_tp_mult': 2.884161255262301, 'sideways_tsl_mult': 0.24410390591529818, 'sideways_time_stop': 218, 'sideways_use_sma': True, 'sideways_use_ema': True, 'sideways_use_atr': False, 'sideways_use_adx': False, 'sideways_use_spike': True, 'sideways_rsi_required': False}.
