[I 2025-08-31 09:21:28,076] Trial 18 finished with values: [-1000000000.0, 1000000000.0] and parameters: {'p_sma': 8, 'p_std': 21, 'p_atr': 17, 'p_adx': 24, 'rsi_period': 45, 'ema1': 24, 'ema2': 17, 'slip_atr_k': 0.24694518913365998, 'slip_spread_k': 0.19156556219050064, 'spread_hl_frac': 0.049683057667985406, 'bb_std_mult': 1.5165081887738672, 'rsi_os': 55, 'rsi_ob': 46, 'vol_spike': 0.29412245380940055, 'adx_thresh': 17.10282451453256, 'atr_min_pct': 0.008781657101466863, 'atr_max_pct': 0.04877000711097633, 'tp_mult': 2.878559037841769, 'tsl_mult': 0.3905425735569634, 'strategy': 'breakout', 'time_stop': 294, 'use_sma': True, 'use_atr': True, 'use_adx': True, 'use_ema': False, 'use_spike': False, 'rsi_required': True, 'edge_k': 0.09140971305328627, 'edge_cap': 0.20378985007462797, 'bull_strategy': 'mean_reversion', 'bull_bb_std_mult': 2.996394971808767, 'bull_rsi_os': 39, 'bull_rsi_ob': 49, 'bull_adx_thresh': 34.3564557464767, 'bull_atr_min_pct': 0.007322079110418549, 'bull_atr_max_pct': 0.015078618625645954, 'bull_tp_mult': 1.3781042291280126, 'bull_tsl_mult': 0.9915423168446845, 'bull_time_stop': 153, 'bull_use_sma': False, 'bull_use_ema': False, 'bull_use_atr': False, 'bull_use_adx': True, 'bull_use_spike': True, 'bull_rsi_required': False, 'bear_strategy': 'mean_reversion', 'bear_bb_std_mult': 1.5716403920514035, 'bear_rsi_os': 29, 'bear_rsi_ob': 57, 'bear_adx_thresh': 27.701075195512118, 'bear_atr_min_pct': 0.009757060271203075, 'bear_atr_max_pct': 0.11760153586414596, 'bear_tp_mult': 1.0241018691802983, 'bear_tsl_mult': 0.008339568472157888, 'bear_time_stop': 299, 'bear_use_sma': True, 'bear_use_ema': True, 'bear_use_atr': False, 'bear_use_adx': False, 'bear_use_spike': False, 'bear_rsi_required': True, 'sideways_strategy': 'mean_reversion', 'sideways_bb_std_mult': 3.496376208240286, 'sideways_rsi_os': 38, 'sideways_rsi_ob': 73, 'sideways_adx_thresh': 5.643710623617778, 'sideways_atr_min_pct': 0.008462319517228638, 'sideways_atr_max_pct': 0.12079141655288192, 'sideways_tp_mult': 2.9116704688604873, 'sideways_tsl_mult': 0.01962875571399869, 'sideways_time_stop': 297, 'sideways_use_sma': True, 'sideways_use_ema': True, 'sideways_use_atr': True, 'sideways_use_adx': True, 'sideways_use_spike': True, 'sideways_rsi_required': True}.
[I 2025-08-31 09:22:00,932] Trial 19 finished with values: [-1000000000.0, 1000000000.0] and parameters: {'p_sma': 5, 'p_std': 25, 'p_atr': 16, 'p_adx': 24, 'rsi_period': 64, 'ema1': 24, 'ema2': 32, 'slip_atr_k': 0.23216264185599234, 'slip_spread_k': 0.21282655061088235, 'spread_hl_frac': 0.011658882809858356, 'bb_std_mult': 1.613703693416089, 'rsi_os': 54, 'rsi_ob': 45, 'vol_spike': 0.2831558989287789, 'adx_thresh': 29.298076916786975, 'atr_min_pct': 0.008978053199704898, 'atr_max_pct': 0.052438902469430976, 'tp_mult': 2.513022732247906, 'tsl_mult': 0.625729741680675, 'strategy': 'breakout', 'time_stop': 295, 'use_sma': True, 'use_atr': True, 'use_adx': True, 'use_ema': True, 'use_spike': False, 'rsi_required': True, 'edge_k': 0.05870082817061273, 'edge_cap': 0.9955206113639639, 'bull_strategy': 'mean_reversion', 'bull_bb_std_mult': 2.9258921478731668, 'bull_rsi_os': 36, 'bull_rsi_ob': 58, 'bull_adx_thresh': 24.627820246864953, 'bull_atr_min_pct': 0.008247577417766081, 'bull_atr_max_pct': 0.016718759468588, 'bull_tp_mult': 2.9808099550941005, 'bull_tsl_mult': 0.9848474459977014, 'bull_time_stop': 159, 'bull_use_sma': True, 'bull_use_ema': False, 'bull_use_atr': False, 'bull_use_adx': True, 'bull_use_spike': True, 'bull_rsi_required': False, 'bear_strategy': 'mean_reversion', 'bear_bb_std_mult': 1.5818531988760522, 'bear_rsi_os': 28, 'bear_rsi_ob': 60, 'bear_adx_thresh': 27.846039850043724, 'bear_atr_min_pct': 0.008893233062399369, 'bear_atr_max_pct': 0.11801566418924396, 'bear_tp_mult': 2.9949959597454225, 'bear_tsl_mult': 0.18029925270610586, 'bear_time_stop': 297, 'bear_use_sma': True, 'bear_use_ema': True, 'bear_use_atr': False, 'bear_use_adx': False, 'bear_use_spike': False, 'bear_rsi_required': True, 'sideways_strategy': 'breakout', 'sideways_bb_std_mult': 3.5309987738237254, 'sideways_rsi_os': 17, 'sideways_rsi_ob': 77, 'sideways_adx_thresh': 6.299154713428123, 'sideways_atr_min_pct': 0.021255553297797342, 'sideways_atr_max_pct': 0.1259782600964094, 'sideways_tp_mult': 2.9676582450776507, 'sideways_tsl_mult': 0.7223220345172353, 'sideways_time_stop': 184, 'sideways_use_sma': True, 'sideways_use_ema': True, 'sideways_use_atr': True, 'sideways_use_adx': True, 'sideways_use_spike': False, 'sideways_rsi_required': False}.
[I 2025-08-31 09:22:06,490] Trial 21 finished with values: [-1000000000.0, 1000000000.0] and parameters: {'p_sma': 38, 'p_std': 43, 'p_atr': 15, 'p_adx': 7, 'rsi_period': 26, 'ema1': 9, 'ema2': 20, 'slip_atr_k': 0.12666145958817987, 'slip_spread_k': 0.2355379345588502, 'spread_hl_frac': 0.009956130264980627, 'bb_std_mult': 2.9400068844112752, 'rsi_os': 15, 'rsi_ob': 95, 'vol_spike': 0.26204979069670914, 'adx_thresh': 29.50305246081553, 'atr_min_pct': 0.024129164211342834, 'atr_max_pct': 0.051701709440835616, 'tp_mult': 2.443491310160988, 'tsl_mult': 0.003884241929381471, 'strategy': 'mean_reversion', 'time_stop': 298, 'use_sma': True, 'use_atr': False, 'use_adx': True, 'use_ema': True, 'use_spike': False, 'rsi_required': True, 'edge_k': 0.8932492604770671, 'edge_cap': 0.23580566164316774, 'bull_strategy': 'mean_reversion', 'bull_bb_std_mult': 2.181898505623802, 'bull_rsi_os': 22, 'bull_rsi_ob': 58, 'bull_adx_thresh': 26.71606154291281, 'bull_atr_min_pct': 0.009316811950178212, 'bull_atr_max_pct': 0.011572859793424026, 'bull_tp_mult': 2.2434141638482332, 'bull_tsl_mult': 0.9874128486026446, 'bull_time_stop': 117, 'bull_use_sma': True, 'bull_use_ema': False, 'bull_use_atr': False, 'bull_use_adx': True, 'bull_use_spike': False, 'bull_rsi_required': True, 'bear_strategy': 'breakout', 'bear_bb_std_mult': 1.6305084718677942, 'bear_rsi_os': 31, 'bear_rsi_ob': 58, 'bear_adx_thresh': 7.320424999053005, 'bear_atr_min_pct': 0.009222527781805195, 'bear_atr_max_pct': 0.11861850515682079, 'bear_tp_mult': 2.971468417920875, 'bear_tsl_mult': 0.3084842041906183, 'bear_time_stop': 285, 'bear_use_sma': False, 'bear_use_ema': False, 'bear_use_atr': False, 'bear_use_adx': False, 'bear_use_spike': False, 'bear_rsi_required': True, 'sideways_strategy': 'breakout', 'sideways_bb_std_mult': 3.427910181784459, 'sideways_rsi_os': 17, 'sideways_rsi_ob': 54, 'sideways_adx_thresh': 26.563781104817984, 'sideways_atr_min_pct': 0.021185783880048572, 'sideways_atr_max_pct': 0.12338436274086327, 'sideways_tp_mult': 1.4058635500422694, 'sideways_tsl_mult': 0.6955944908762203, 'sideways_time_stop': 91, 'sideways_use_sma': True, 'sideways_use_ema': True, 'sideways_use_atr': True, 'sideways_use_adx': False, 'sideways_use_spike': False, 'sideways_rsi_required': False}.
[I 2025-08-31 09:22:06,711] Trial 20 finished with values: [-1000000000.0, 1000000000.0] and parameters: {'p_sma': 39, 'p_std': 19, 'p_atr': 15, 'p_adx': 24, 'rsi_period': 66, 'ema1': 10, 'ema2': 30, 'slip_atr_k': 0.2458026591543237, 'slip_spread_k': 0.21504307536363526, 'spread_hl_frac': 0.01167645347610053, 'bb_std_mult': 2.9409986920806928, 'rsi_os': 15, 'rsi_ob': 46, 'vol_spike': 0.29214382301179354, 'adx_thresh': 28.867425452041132, 'atr_min_pct': 0.010464760231251742, 'atr_max_pct': 0.0468901784803782, 'tp_mult': 2.5015126931648144, 'tsl_mult': 0.5783877808403447, 'strategy': 'breakout', 'time_stop': 5, 'use_sma': True, 'use_atr': True, 'use_adx': True, 'use_ema': True, 'use_spike': False, 'rsi_required': True, 'edge_k': 0.8350829202287688, 'edge_cap': 0.9897230188623842, 'bull_strategy': 'mean_reversion', 'bull_bb_std_mult': 2.9767728679164582, 'bull_rsi_os': 22, 'bull_rsi_ob': 59, 'bull_adx_thresh': 25.964430680419436, 'bull_atr_min_pct': 0.0075282718644563975, 'bull_atr_max_pct': 0.016265011937770746, 'bull_tp_mult': 2.97340208245089, 'bull_tsl_mult': 0.9918200458421667, 'bull_time_stop': 300, 'bull_use_sma': True, 'bull_use_ema': False, 'bull_use_atr': False, 'bull_use_adx': True, 'bull_use_spike': True, 'bull_rsi_required': True, 'bear_strategy': 'breakout', 'bear_bb_std_mult': 2.411021497536951, 'bear_rsi_os': 31, 'bear_rsi_ob': 45, 'bear_adx_thresh': 27.829277046658973, 'bear_atr_min_pct': 0.009508023435509032, 'bear_atr_max_pct': 0.1252572235161682, 'bear_tp_mult': 2.9353033233126298, 'bear_tsl_mult': 0.22164918899277491, 'bear_time_stop': 293, 'bear_use_sma': False, 'bear_use_ema': True, 'bear_use_atr': False, 'bear_use_adx': False, 'bear_use_spike': False, 'bear_rsi_required': True, 'sideways_strategy': 'breakout', 'sideways_bb_std_mult': 3.41435315296593, 'sideways_rsi_os': 20, 'sideways_rsi_ob': 77, 'sideways_adx_thresh': 5.051550773051682, 'sideways_atr_min_pct': 0.02323071341743238, 'sideways_atr_max_pct': 0.12248688363186905, 'sideways_tp_mult': 2.995877497609899, 'sideways_tsl_mult': 0.7010650483766322, 'sideways_time_stop': 294, 'sideways_use_sma': True, 'sideways_use_ema': True, 'sideways_use_atr': True, 'sideways_use_adx': False, 'sideways_use_spike': False, 'sideways_rsi_required': False}.
[I 2025-08-31 09:22:06,947] Trial 22 finished with values: [-1000000000.0, 1000000000.0] and parameters: {'p_sma': 25, 'p_std': 44, 'p_atr': 13, 'p_adx': 7, 'rsi_period': 64, 'ema1': 9, 'ema2': 33, 'slip_atr_k': 0.13201411878295685, 'slip_spread_k': 0.27514801562131164, 'spread_hl_frac': 0.01268699739235206, 'bb_std_mult': 1.0179625452487546, 'rsi_os': 14, 'rsi_ob': 94, 'vol_spike': 0.16883578639296098, 'adx_thresh': 29.09907318672567, 'atr_min_pct': 0.024275012629509395, 'atr_max_pct': 0.052160751805206, 'tp_mult': 2.526722291230412, 'tsl_mult': 0.6873640491355872, 'strategy': 'mean_reversion', 'time_stop': 198, 'use_sma': True, 'use_atr': False, 'use_adx': False, 'use_ema': True, 'use_spike': True, 'rsi_required': True, 'edge_k': 0.8502186980882122, 'edge_cap': 0.564340988745157, 'bull_strategy': 'mean_reversion', 'bull_bb_std_mult': 2.1973589498311554, 'bull_rsi_os': 23, 'bull_rsi_ob': 58, 'bull_adx_thresh': 25.53362176950512, 'bull_atr_min_pct': 0.008621969416188903, 'bull_atr_max_pct': 0.04556140479528168, 'bull_tp_mult': 2.1876721580978287, 'bull_tsl_mult': 0.2216699556643904, 'bull_time_stop': 106, 'bull_use_sma': True, 'bull_use_ema': True, 'bull_use_atr': True, 'bull_use_adx': True, 'bull_use_spike': False, 'bull_rsi_required': True, 'bear_strategy': 'breakout', 'bear_bb_std_mult': 0.5550845148464245, 'bear_rsi_os': 15, 'bear_rsi_ob': 59, 'bear_adx_thresh': 5.555290131544165, 'bear_atr_min_pct': 0.023900301080113165, 'bear_atr_max_pct': 0.041437276916159095, 'bear_tp_mult': 2.8625267949188427, 'bear_tsl_mult': 0.2311937933224809, 'bear_time_stop': 196, 'bear_use_sma': False, 'bear_use_ema': False, 'bear_use_atr': False, 'bear_use_adx': True, 'bear_use_spike': True, 'bear_rsi_required': True, 'sideways_strategy': 'breakout', 'sideways_bb_std_mult': 3.0777492313880135, 'sideways_rsi_os': 24, 'sideways_rsi_ob': 54, 'sideways_adx_thresh': 27.63637428271357, 'sideways_atr_min_pct': 0.02196884121798404, 'sideways_atr_max_pct': 0.050880700472593396, 'sideways_tp_mult': 1.445046395900285, 'sideways_tsl_mult': 0.7073458287147149, 'sideways_time_stop': 82, 'sideways_use_sma': True, 'sideways_use_ema': True, 'sideways_use_atr': False, 'sideways_use_adx': False, 'sideways_use_spike': False, 'sideways_rsi_required': False}.
[I 2025-08-31 09:22:38,052] Trial 23 finished with values: [-1000000000.0, 1000000000.0] and parameters: {'p_sma': 38, 'p_std': 44, 'p_atr': 12, 'p_adx': 7, 'rsi_period': 26, 'ema1': 9, 'ema2': 22, 'slip_atr_k': 0.1348061333395781, 'slip_spread_k': 0.9987896489491073, 'spread_hl_frac': 0.039801763280305165, 'bb_std_mult': 2.9222564986432205, 'rsi_os': 16, 'rsi_ob': 94, 'vol_spike': 0.163527387407251, 'adx_thresh': 23.346063208281898, 'atr_min_pct': 0.025003213985851196, 'atr_max_pct': 0.09102512641164537, 'tp_mult': 1.3860757371279924, 'tsl_mult': 0.008050138034503718, 'strategy': 'mean_reversion', 'time_stop': 200, 'use_sma': True, 'use_atr': False, 'use_adx': False, 'use_ema': True, 'use_spike': True, 'rsi_required': True, 'edge_k': 0.8483852514107066, 'edge_cap': 0.5570025520622581, 'bull_strategy': 'mean_reversion', 'bull_bb_std_mult': 2.1547201446328326, 'bull_rsi_os': 21, 'bull_rsi_ob': 73, 'bull_adx_thresh': 26.460198122949127, 'bull_atr_min_pct': 0.017548907009634997, 'bull_atr_max_pct': 0.041000240803249814, 'bull_tp_mult': 2.1646767303209726, 'bull_tsl_mult': 0.189536178005764, 'bull_time_stop': 299, 'bull_use_sma': True, 'bull_use_ema': True, 'bull_use_atr': True, 'bull_use_adx': False, 'bull_use_spike': False, 'bull_rsi_required': True, 'bear_strategy': 'breakout', 'bear_bb_std_mult': 0.532832804049407, 'bear_rsi_os': 15, 'bear_rsi_ob': 83, 'bear_adx_thresh': 5.937040707675923, 'bear_atr_min_pct': 0.023181244919644194, 'bear_atr_max_pct': 0.04343010123518228, 'bear_tp_mult': 1.8132962383091962, 'bear_tsl_mult': 0.3516199944942929, 'bear_time_stop': 199, 'bear_use_sma': False, 'bear_use_ema': False, 'bear_use_atr': True, 'bear_use_adx': True, 'bear_use_spike': True, 'bear_rsi_required': True, 'sideways_strategy': 'breakout', 'sideways_bb_std_mult': 3.1304971823982584, 'sideways_rsi_os': 27, 'sideways_rsi_ob': 54, 'sideways_adx_thresh': 28.978962157640062, 'sideways_atr_min_pct': 0.0263377605987732, 'sideways_atr_max_pct': 0.049938260114801236, 'sideways_tp_mult': 1.3973011697496076, 'sideways_tsl_mult': 0.3879007201535975, 'sideways_time_stop': 68, 'sideways_use_sma': False, 'sideways_use_ema': True, 'sideways_use_atr': False, 'sideways_use_adx': False, 'sideways_use_spike': False, 'sideways_rsi_required': False}.
[I 2025-08-31 09:22:41,997] Trial 24 finished with values: [-1000000000.0, 1000000000.0] and parameters: {'p_sma': 24, 'p_std': 60, 'p_atr': 10, 'p_adx': 20, 'rsi_period': 77, 'ema1': 15, 'ema2': 23, 'slip_atr_k': 0.08807386940116729, 'slip_spread_k': 0.3360171678080678, 'spread_hl_frac': 0.038924813635553, 'bb_std_mult': 2.383041063086405, 'rsi_os': 33, 'rsi_ob': 65, 'vol_spike': 0.16052148553148524, 'adx_thresh': 5.437764558798952, 'atr_min_pct': 0.02991167859032881, 'atr_max_pct': 0.09003501523073597, 'tp_mult': 1.2944323663911952, 'tsl_mult': 0.785478067864144, 'strategy': 'mean_reversion', 'time_stop': 205, 'use_sma': True, 'use_atr': True, 'use_adx': False, 'use_ema': True, 'use_spike': True, 'rsi_required': False, 'edge_k': 0.8385420440212419, 'edge_cap': 0.5467215012690936, 'bull_strategy': 'mean_reversion', 'bull_bb_std_mult': 1.522073475724405, 'bull_rsi_os': 24, 'bull_rsi_ob': 72, 'bull_adx_thresh': 33.50887162614549, 'bull_atr_min_pct': 0.017476606686945666, 'bull_atr_max_pct': 0.04039087798521926, 'bull_tp_mult': 1.8708242839015328, 'bull_tsl_mult': 0.1937584807945103, 'bull_time_stop': 299, 'bull_use_sma': True, 'bull_use_ema': True, 'bull_use_atr': True, 'bull_use_adx': False, 'bull_use_spike': True, 'bull_rsi_required': True, 'bear_strategy': 'breakout', 'bear_bb_std_mult': 2.4144602943645967, 'bear_rsi_os': 22, 'bear_rsi_ob': 74, 'bear_adx_thresh': 17.432771173216757, 'bear_atr_min_pct': 8.71053368632236e-05, 'bear_atr_max_pct': 0.033850479262231746, 'bear_tp_mult': 1.8749269467818954, 'bear_tsl_mult': 0.3912832012073267, 'bear_time_stop': 202, 'bear_use_sma': False, 'bear_use_ema': False, 'bear_use_atr': True, 'bear_use_adx': True, 'bear_use_spike': True, 'bear_rsi_required': False, 'sideways_strategy': 'breakout', 'sideways_bb_std_mult': 2.168320753284901, 'sideways_rsi_os': 27, 'sideways_rsi_ob': 85, 'sideways_adx_thresh': 20.69998851281768, 'sideways_atr_min_pct': 0.02546520316981163, 'sideways_atr_max_pct': 0.06262004994227514, 'sideways_tp_mult': 1.377400535593679, 'sideways_tsl_mult': 0.4018091531735335, 'sideways_time_stop': 72, 'sideways_use_sma': False, 'sideways_use_ema': False, 'sideways_use_atr': False, 'sideways_use_adx': False, 'sideways_use_spike': False, 'sideways_rsi_required': False}.
[I 2025-08-31 09:22:42,981] Trial 25 finished with values: [-1000000000.0, 1000000000.0] and parameters: {'p_sma': 24, 'p_std': 59, 'p_atr': 12, 'p_adx': 18, 'rsi_period': 83, 'ema1': 14, 'ema2': 25, 'slip_atr_k': 0.20867607754700412, 'slip_spread_k': 0.36778310137271664, 'spread_hl_frac': 0.04037633346994918, 'bb_std_mult': 2.316010210483699, 'rsi_os': 36, 'rsi_ob': 66, 'vol_spike': 0.24846899673724315, 'adx_thresh': 5.181607927685963, 'atr_min_pct': 0.019695155647432565, 'atr_max_pct': 0.0857051448446808, 'tp_mult': 1.3544606676622997, 'tsl_mult': 0.8340610430630476, 'strategy': 'mean_reversion', 'time_stop': 195, 'use_sma': False, 'use_atr': False, 'use_adx': False, 'use_ema': True, 'use_spike': True, 'rsi_required': False, 'edge_k': 0.3386687130685526, 'edge_cap': 0.5553916876259526, 'bull_strategy': 'mean_reversion', 'bull_bb_std_mult': 1.5361819931008254, 'bull_rsi_os': 29, 'bull_rsi_ob': 69, 'bull_adx_thresh': 34.89906632893861, 'bull_atr_min_pct': 0.02643994375698196, 'bull_atr_max_pct': 0.038115858219165424, 'bull_tp_mult': 1.8889237397311767, 'bull_tsl_mult': 0.2082592568065617, 'bull_time_stop': 206, 'bull_use_sma': True, 'bull_use_ema': True, 'bull_use_atr': True, 'bull_use_adx': False, 'bull_use_spike': False, 'bull_rsi_required': True, 'bear_strategy': 'breakout', 'bear_bb_std_mult': 2.501734561825404, 'bear_rsi_os': 21, 'bear_rsi_ob': 74, 'bear_adx_thresh': 23.22193772714694, 'bear_atr_min_pct': 0.00023653039778925508, 'bear_atr_max_pct': 0.04721340391154195, 'bear_tp_mult': 1.884250344068846, 'bear_tsl_mult': 0.6016428493541989, 'bear_time_stop': 205, 'bear_use_sma': False, 'bear_use_ema': False, 'bear_use_atr': True, 'bear_use_adx': True, 'bear_use_spike': True, 'bear_rsi_required': False, 'sideways_strategy': 'breakout', 'sideways_bb_std_mult': 3.1124751421629524, 'sideways_rsi_os': 27, 'sideways_rsi_ob': 45, 'sideways_adx_thresh': 22.733555958269484, 'sideways_atr_min_pct': 0.026069560219407876, 'sideways_atr_max_pct': 0.05987365664787697, 'sideways_tp_mult': 1.3806151251361705, 'sideways_tsl_mult': 0.4183934626371003, 'sideways_time_stop': 68, 'sideways_use_sma': False, 'sideways_use_ema': False, 'sideways_use_atr': False, 'sideways_use_adx': False, 'sideways_use_spike': True, 'sideways_rsi_required': False}.
[I 2025-08-31 09:22:43,083] Trial 26 finished with values: [-1000000000.0, 1000000000.0] and parameters: {'p_sma': 51, 'p_std': 12, 'p_atr': 22, 'p_adx': 18, 'rsi_period': 80, 'ema1': 14, 'ema2': 24, 'slip_atr_k': 0.09095628899939442, 'slip_spread_k': 0.8355537346689001, 'spread_hl_frac': 0.04181766232426451, 'bb_std_mult': 2.2212742143759305, 'rsi_os': 31, 'rsi_ob': 66, 'vol_spike': 0.24105608913231746, 'adx_thresh': 23.530015338903596, 'atr_min_pct': 0.019820061109137047, 'atr_max_pct': 0.08811745852144427, 'tp_mult': 1.3111373004866784, 'tsl_mult': 0.8314125588688125, 'strategy': 'mean_reversion', 'time_stop': 141, 'use_sma': False, 'use_atr': True, 'use_adx': False, 'use_ema': True, 'use_spike': True, 'rsi_required': False, 'edge_k': 0.32659422582563047, 'edge_cap': 0.49014483569742523, 'bull_strategy': 'breakout', 'bull_bb_std_mult': 1.5442077053661958, 'bull_rsi_os': 32, 'bull_rsi_ob': 71, 'bull_adx_thresh': 17.8767531756637, 'bull_atr_min_pct': 0.017265306845352053, 'bull_atr_max_pct': 0.12234145079113734, 'bull_tp_mult': 1.8660430403027568, 'bull_tsl_mult': 0.7620809505099125, 'bull_time_stop': 192, 'bull_use_sma': True, 'bull_use_ema': True, 'bull_use_atr': True, 'bull_use_adx': False, 'bull_use_spike': True, 'bull_rsi_required': False, 'bear_strategy': 'breakout', 'bear_bb_std_mult': 2.484720981605571, 'bear_rsi_os': 23, 'bear_rsi_ob': 74, 'bear_adx_thresh': 17.614657683104955, 'bear_atr_min_pct': 0.00010813285577941298, 'bear_atr_max_pct': 0.011488613102473233, 'bear_tp_mult': 1.877515690215097, 'bear_tsl_mult': 0.6241308939937147, 'bear_time_stop': 53, 'bear_use_sma': False, 'bear_use_ema': False, 'bear_use_atr': True, 'bear_use_adx': True, 'bear_use_spike': True, 'bear_rsi_required': False, 'sideways_strategy': 'breakout', 'sideways_bb_std_mult': 2.0959373581424874, 'sideways_rsi_os': 53, 'sideways_rsi_ob': 86, 'sideways_adx_thresh': 21.104762999545756, 'sideways_atr_min_pct': 0.02579225710297253, 'sideways_atr_max_pct': 0.07280569579306079, 'sideways_tp_mult': 1.9845865041612938, 'sideways_tsl_mult': 0.428949151330474, 'sideways_time_stop': 64, 'sideways_use_sma': False, 'sideways_use_ema': False, 'sideways_use_atr': False, 'sideways_use_adx': False, 'sideways_use_spike': True, 'sideways_rsi_required': False}.
