[I 2025-08-31 10:19:52,409] Trial 479 finished with values: [-1000000000.0, 1000000000.0] and parameters: {'p_sma': 10, 'p_std': 49, 'p_atr': 14, 'p_adx': 8, 'rsi_period': 26, 'ema1': 17, 'ema2': 35, 'slip_atr_k': 0.18743158166113688, 'slip_spread_k': 0.09908839598118246, 'spread_hl_frac': 0.009780570701478584, 'bb_std_mult': 1.3398381080066881, 'rsi_os': 42, 'rsi_ob': 83, 'vol_spike': 0.2957469364220079, 'adx_thresh': 23.718830752081235, 'atr_min_pct': 0.01066913753387266, 'atr_max_pct': 0.12133420147443157, 'tp_mult': 2.921470169417107, 'tsl_mult': 0.09739722424062447, 'strategy': 'breakout', 'time_stop': 183, 'use_sma': False, 'use_atr': False, 'use_adx': False, 'use_ema': True, 'use_spike': False, 'rsi_required': True, 'edge_k': 1.9680756814807472, 'edge_cap': 0.18953618519379867, 'bull_strategy': 'mean_reversion', 'bull_bb_std_mult': 1.0563044512714637, 'bull_rsi_os': 26, 'bull_rsi_ob': 81, 'bull_adx_thresh': 29.005346813897432, 'bull_atr_min_pct': 0.008742115124679276, 'bull_atr_max_pct': 0.09057777005761246, 'bull_tp_mult': 2.46708829257297, 'bull_tsl_mult': 0.9695579375824732, 'bull_time_stop': 64, 'bull_use_sma': True, 'bull_use_ema': False, 'bull_use_atr': False, 'bull_use_adx': True, 'bull_use_spike': False, 'bull_rsi_required': False, 'bear_strategy': 'breakout', 'bear_bb_std_mult': 2.98532581157668, 'bear_rsi_os': 29, 'bear_rsi_ob': 56, 'bear_adx_thresh': 22.33228533432428, 'bear_atr_min_pct': 0.007618616973614537, 'bear_atr_max_pct': 0.10619578613289421, 'bear_tp_mult': 2.217073876263556, 'bear_tsl_mult': 0.40888727709414985, 'bear_time_stop': 275, 'bear_use_sma': True, 'bear_use_ema': True, 'bear_use_atr': False, 'bear_use_adx': True, 'bear_use_spike': True, 'bear_rsi_required': True, 'sideways_strategy': 'breakout', 'sideways_bb_std_mult': 0.5023589342369879, 'sideways_rsi_os': 22, 'sideways_rsi_ob': 94, 'sideways_adx_thresh': 29.995471026177942, 'sideways_atr_min_pct': 0.00025441938285686826, 'sideways_atr_max_pct': 0.08711129023709903, 'sideways_tp_mult': 2.888795970171119, 'sideways_tsl_mult': 0.03983814139134509, 'sideways_time_stop': 217, 'sideways_use_sma': True, 'sideways_use_ema': False, 'sideways_use_atr': False, 'sideways_use_adx': True, 'sideways_use_spike': True, 'sideways_rsi_required': False}.
[I 2025-08-31 10:19:52,844] Trial 480 finished with values: [-1000000000.0, 1000000000.0] and parameters: {'p_sma': 10, 'p_std': 47, 'p_atr': 29, 'p_adx': 11, 'rsi_period': 26, 'ema1': 17, 'ema2': 36, 'slip_atr_k': 0.18730707598571134, 'slip_spread_k': 0.09483388179973552, 'spread_hl_frac': 0.008790220559580661, 'bb_std_mult': 1.3282853613535197, 'rsi_os': 36, 'rsi_ob': 82, 'vol_spike': 0.29392547797422824, 'adx_thresh': 23.609434784295757, 'atr_min_pct': 0.009751066985560795, 'atr_max_pct': 0.11696574287026841, 'tp_mult': 2.9727261527307034, 'tsl_mult': 0.10367105418780861, 'strategy': 'breakout', 'time_stop': 125, 'use_sma': False, 'use_atr': False, 'use_adx': False, 'use_ema': True, 'use_spike': False, 'rsi_required': True, 'edge_k': 1.9738077232518738, 'edge_cap': 0.19242110194397416, 'bull_strategy': 'mean_reversion', 'bull_bb_std_mult': 1.0595890520607751, 'bull_rsi_os': 26, 'bull_rsi_ob': 68, 'bull_adx_thresh': 28.77476860785536, 'bull_atr_min_pct': 0.009346991111909824, 'bull_atr_max_pct': 0.0906815126389752, 'bull_tp_mult': 2.2226230451565145, 'bull_tsl_mult': 0.9694635420225766, 'bull_time_stop': 66, 'bull_use_sma': True, 'bull_use_ema': False, 'bull_use_atr': False, 'bull_use_adx': True, 'bull_use_spike': False, 'bull_rsi_required': False, 'bear_strategy': 'breakout', 'bear_bb_std_mult': 2.9988153010700076, 'bear_rsi_os': 29, 'bear_rsi_ob': 78, 'bear_adx_thresh': 22.41238087662512, 'bear_atr_min_pct': 0.007477159108937425, 'bear_atr_max_pct': 0.10679715139641825, 'bear_tp_mult': 2.190390052353735, 'bear_tsl_mult': 0.3951689373267437, 'bear_time_stop': 274, 'bear_use_sma': True, 'bear_use_ema': False, 'bear_use_atr': True, 'bear_use_adx': True, 'bear_use_spike': True, 'bear_rsi_required': True, 'sideways_strategy': 'breakout', 'sideways_bb_std_mult': 0.5376926238220101, 'sideways_rsi_os': 22, 'sideways_rsi_ob': 94, 'sideways_adx_thresh': 29.93749072603664, 'sideways_atr_min_pct': 0.00023647359663647814, 'sideways_atr_max_pct': 0.10564593807188186, 'sideways_tp_mult': 2.8977211730677666, 'sideways_tsl_mult': 0.02333105599814317, 'sideways_time_stop': 211, 'sideways_use_sma': False, 'sideways_use_ema': False, 'sideways_use_atr': False, 'sideways_use_adx': True, 'sideways_use_spike': True, 'sideways_rsi_required': False}.
[I 2025-08-31 10:19:53,521] Trial 478 finished with values: [-1000000000.0, 1000000000.0] and parameters: {'p_sma': 10, 'p_std': 49, 'p_atr': 29, 'p_adx': 24, 'rsi_period': 26, 'ema1': 17, 'ema2': 36, 'slip_atr_k': 0.18834826127613968, 'slip_spread_k': 0.10063027206079736, 'spread_hl_frac': 0.009481101167508168, 'bb_std_mult': 1.294251488327836, 'rsi_os': 41, 'rsi_ob': 83, 'vol_spike': 0.2941958002965584, 'adx_thresh': 23.562662136046338, 'atr_min_pct': 0.01130831066354622, 'atr_max_pct': 0.1210737959514707, 'tp_mult': 2.9981634232648022, 'tsl_mult': 0.10818493323907513, 'strategy': 'breakout', 'time_stop': 124, 'use_sma': False, 'use_atr': False, 'use_adx': False, 'use_ema': True, 'use_spike': False, 'rsi_required': True, 'edge_k': 1.9734650516560657, 'edge_cap': 0.18713962053577052, 'bull_strategy': 'mean_reversion', 'bull_bb_std_mult': 1.137935299696084, 'bull_rsi_os': 26, 'bull_rsi_ob': 80, 'bull_adx_thresh': 29.422069378232617, 'bull_atr_min_pct': 0.009182139121490834, 'bull_atr_max_pct': 0.08995284228955817, 'bull_tp_mult': 2.1446734705957207, 'bull_tsl_mult': 0.962971863220575, 'bull_time_stop': 64, 'bull_use_sma': True, 'bull_use_ema': False, 'bull_use_atr': False, 'bull_use_adx': True, 'bull_use_spike': False, 'bull_rsi_required': True, 'bear_strategy': 'breakout', 'bear_bb_std_mult': 3.002773825213086, 'bear_rsi_os': 29, 'bear_rsi_ob': 77, 'bear_adx_thresh': 22.406302696063396, 'bear_atr_min_pct': 0.007583032349382652, 'bear_atr_max_pct': 0.10643273935840632, 'bear_tp_mult': 2.2279640407625507, 'bear_tsl_mult': 0.4537198399161412, 'bear_time_stop': 274, 'bear_use_sma': False, 'bear_use_ema': True, 'bear_use_atr': False, 'bear_use_adx': True, 'bear_use_spike': True, 'bear_rsi_required': True, 'sideways_strategy': 'breakout', 'sideways_bb_std_mult': 0.5463252921585204, 'sideways_rsi_os': 22, 'sideways_rsi_ob': 94, 'sideways_adx_thresh': 29.641173137050167, 'sideways_atr_min_pct': 0.00023851973062840887, 'sideways_atr_max_pct': 0.08701927225810041, 'sideways_tp_mult': 2.9219239545302402, 'sideways_tsl_mult': 0.00831930613444621, 'sideways_time_stop': 214, 'sideways_use_sma': True, 'sideways_use_ema': True, 'sideways_use_atr': False, 'sideways_use_adx': True, 'sideways_use_spike': True, 'sideways_rsi_required': False}.
[I 2025-08-31 10:19:53,532] Trial 477 finished with values: [-1000000000.0, 1000000000.0] and parameters: {'p_sma': 10, 'p_std': 49, 'p_atr': 29, 'p_adx': 25, 'rsi_period': 26, 'ema1': 17, 'ema2': 36, 'slip_atr_k': 0.18625749882494383, 'slip_spread_k': 0.10100974314840623, 'spread_hl_frac': 0.009852674760737593, 'bb_std_mult': 1.323738914325793, 'rsi_os': 42, 'rsi_ob': 83, 'vol_spike': 0.2925672915239806, 'adx_thresh': 23.800892000416386, 'atr_min_pct': 0.010397812539479126, 'atr_max_pct': 0.12126304622532749, 'tp_mult': 2.998346394731788, 'tsl_mult': 0.10749344171015938, 'strategy': 'breakout', 'time_stop': 123, 'use_sma': False, 'use_atr': False, 'use_adx': False, 'use_ema': True, 'use_spike': False, 'rsi_required': True, 'edge_k': 1.9732948462443956, 'edge_cap': 0.19107080825967782, 'bull_strategy': 'mean_reversion', 'bull_bb_std_mult': 1.147944435665993, 'bull_rsi_os': 25, 'bull_rsi_ob': 68, 'bull_adx_thresh': 29.016098100991094, 'bull_atr_min_pct': 0.009178753787680035, 'bull_atr_max_pct': 0.08478403784873996, 'bull_tp_mult': 2.1339479531512513, 'bull_tsl_mult': 0.9680757159295845, 'bull_time_stop': 68, 'bull_use_sma': True, 'bull_use_ema': False, 'bull_use_atr': False, 'bull_use_adx': True, 'bull_use_spike': False, 'bull_rsi_required': True, 'bear_strategy': 'breakout', 'bear_bb_std_mult': 2.983665521062242, 'bear_rsi_os': 29, 'bear_rsi_ob': 77, 'bear_adx_thresh': 22.95825578799502, 'bear_atr_min_pct': 0.007506997081716557, 'bear_atr_max_pct': 0.10711447977316299, 'bear_tp_mult': 2.206724606887904, 'bear_tsl_mult': 0.4039663835710787, 'bear_time_stop': 278, 'bear_use_sma': False, 'bear_use_ema': True, 'bear_use_atr': False, 'bear_use_adx': True, 'bear_use_spike': True, 'bear_rsi_required': True, 'sideways_strategy': 'breakout', 'sideways_bb_std_mult': 0.5666729148117007, 'sideways_rsi_os': 22, 'sideways_rsi_ob': 95, 'sideways_adx_thresh': 29.775501681110537, 'sideways_atr_min_pct': 0.0001552802398457878, 'sideways_atr_max_pct': 0.10953275893737717, 'sideways_tp_mult': 2.8948251634039766, 'sideways_tsl_mult': 0.008651738322977609, 'sideways_time_stop': 211, 'sideways_use_sma': True, 'sideways_use_ema': True, 'sideways_use_atr': False, 'sideways_use_adx': False, 'sideways_use_spike': True, 'sideways_rsi_required': False}.
[I 2025-08-31 10:20:25,858] Trial 484 finished with values: [-1000000000.0, 1000000000.0] and parameters: {'p_sma': 12, 'p_std': 46, 'p_atr': 29, 'p_adx': 10, 'rsi_period': 28, 'ema1': 18, 'ema2': 37, 'slip_atr_k': 0.19776552552256582, 'slip_spread_k': 0.12723103500594754, 'spread_hl_frac': 0.010029064670474756, 'bb_std_mult': 1.2610117104040846, 'rsi_os': 40, 'rsi_ob': 84, 'vol_spike': 0.28444085542447894, 'adx_thresh': 22.748603111202414, 'atr_min_pct': 0.010047642421455413, 'atr_max_pct': 0.1192954914674782, 'tp_mult': 2.9709353055338625, 'tsl_mult': 0.10068680683635384, 'strategy': 'mean_reversion', 'time_stop': 287, 'use_sma': False, 'use_atr': True, 'use_adx': False, 'use_ema': True, 'use_spike': True, 'rsi_required': False, 'edge_k': 1.9404596060340473, 'edge_cap': 0.17118408748177333, 'bull_strategy': 'mean_reversion', 'bull_bb_std_mult': 1.0863108860591504, 'bull_rsi_os': 24, 'bull_rsi_ob': 64, 'bull_adx_thresh': 29.603961980274985, 'bull_atr_min_pct': 0.004180658896657098, 'bull_atr_max_pct': 0.08111670294579436, 'bull_tp_mult': 1.9805577246091772, 'bull_tsl_mult': 0.9925714530829389, 'bull_time_stop': 76, 'bull_use_sma': True, 'bull_use_ema': True, 'bull_use_atr': True, 'bull_use_adx': False, 'bull_use_spike': False, 'bull_rsi_required': True, 'bear_strategy': 'breakout', 'bear_bb_std_mult': 3.087976977273958, 'bear_rsi_os': 27, 'bear_rsi_ob': 79, 'bear_adx_thresh': 23.426855089932047, 'bear_atr_min_pct': 0.005901806154903137, 'bear_atr_max_pct': 0.10152673746686136, 'bear_tp_mult': 1.7439672437154643, 'bear_tsl_mult': 0.4225136457519656, 'bear_time_stop': 271, 'bear_use_sma': False, 'bear_use_ema': False, 'bear_use_atr': True, 'bear_use_adx': False, 'bear_use_spike': True, 'bear_rsi_required': False, 'sideways_strategy': 'mean_reversion', 'sideways_bb_std_mult': 0.7782668215139836, 'sideways_rsi_os': 23, 'sideways_rsi_ob': 93, 'sideways_adx_thresh': 28.841487406337396, 'sideways_atr_min_pct': 0.0006116782320674742, 'sideways_atr_max_pct': 0.12043850757676183, 'sideways_tp_mult': 2.9909999898158786, 'sideways_tsl_mult': 0.029432524616422887, 'sideways_time_stop': 221, 'sideways_use_sma': False, 'sideways_use_ema': True, 'sideways_use_atr': False, 'sideways_use_adx': False, 'sideways_use_spike': True, 'sideways_rsi_required': True}.
[I 2025-08-31 10:20:26,492] Trial 481 finished with values: [-1000000000.0, 1000000000.0] and parameters: {'p_sma': 12, 'p_std': 46, 'p_atr': 29, 'p_adx': 27, 'rsi_period': 27, 'ema1': 17, 'ema2': 36, 'slip_atr_k': 0.19594618444876363, 'slip_spread_k': 0.12069678847785659, 'spread_hl_frac': 0.00844673156816142, 'bb_std_mult': 1.2858349032969694, 'rsi_os': 39, 'rsi_ob': 82, 'vol_spike': 0.28484093009185024, 'adx_thresh': 22.889819006191875, 'atr_min_pct': 0.010868090387688004, 'atr_max_pct': 0.11829281479630066, 'tp_mult': 2.98732576348278, 'tsl_mult': 0.1132456081523433, 'strategy': 'breakout', 'time_stop': 127, 'use_sma': False, 'use_atr': False, 'use_adx': False, 'use_ema': True, 'use_spike': False, 'rsi_required': True, 'edge_k': 1.9761717135132826, 'edge_cap': 0.17934656987987685, 'bull_strategy': 'mean_reversion', 'bull_bb_std_mult': 1.1661185535037053, 'bull_rsi_os': 24, 'bull_rsi_ob': 68, 'bull_adx_thresh': 29.13120249600516, 'bull_atr_min_pct': 0.004342091207021693, 'bull_atr_max_pct': 0.08418245589587381, 'bull_tp_mult': 1.9149305488597743, 'bull_tsl_mult': 0.9468733814950971, 'bull_time_stop': 70, 'bull_use_sma': True, 'bull_use_ema': False, 'bull_use_atr': False, 'bull_use_adx': True, 'bull_use_spike': False, 'bull_rsi_required': True, 'bear_strategy': 'breakout', 'bear_bb_std_mult': 2.960997115743647, 'bear_rsi_os': 28, 'bear_rsi_ob': 77, 'bear_adx_thresh': 23.075604358857063, 'bear_atr_min_pct': 0.006119988804139791, 'bear_atr_max_pct': 0.10266258034756669, 'bear_tp_mult': 2.178146915588149, 'bear_tsl_mult': 0.44300467921838615, 'bear_time_stop': 280, 'bear_use_sma': False, 'bear_use_ema': False, 'bear_use_atr': True, 'bear_use_adx': True, 'bear_use_spike': True, 'bear_rsi_required': True, 'sideways_strategy': 'breakout', 'sideways_bb_std_mult': 0.7258065277401178, 'sideways_rsi_os': 21, 'sideways_rsi_ob': 95, 'sideways_adx_thresh': 29.725233171772878, 'sideways_atr_min_pct': 0.0003367197815636434, 'sideways_atr_max_pct': 0.11806613526851352, 'sideways_tp_mult': 2.924326720429035, 'sideways_tsl_mult': 0.021737009043507012, 'sideways_time_stop': 212, 'sideways_use_sma': False, 'sideways_use_ema': True, 'sideways_use_atr': False, 'sideways_use_adx': True, 'sideways_use_spike': True, 'sideways_rsi_required': False}.
[I 2025-08-31 10:20:26,505] Trial 483 finished with values: [-1000000000.0, 1000000000.0] and parameters: {'p_sma': 12, 'p_std': 46, 'p_atr': 29, 'p_adx': 7, 'rsi_period': 24, 'ema1': 18, 'ema2': 37, 'slip_atr_k': 0.19309309048109938, 'slip_spread_k': 0.13161998387894472, 'spread_hl_frac': 0.008871518045670237, 'bb_std_mult': 1.2736116310589616, 'rsi_os': 40, 'rsi_ob': 84, 'vol_spike': 0.2842858558103753, 'adx_thresh': 25.54406300741857, 'atr_min_pct': 0.01047123683750827, 'atr_max_pct': 0.1178072052600945, 'tp_mult': 2.9669810716657783, 'tsl_mult': 0.07754946636411013, 'strategy': 'mean_reversion', 'time_stop': 62, 'use_sma': False, 'use_atr': True, 'use_adx': False, 'use_ema': True, 'use_spike': True, 'rsi_required': False, 'edge_k': 1.959523333230889, 'edge_cap': 0.16470082077637116, 'bull_strategy': 'mean_reversion', 'bull_bb_std_mult': 1.1164814979499647, 'bull_rsi_os': 24, 'bull_rsi_ob': 64, 'bull_adx_thresh': 29.85099189289474, 'bull_atr_min_pct': 0.007847726932562653, 'bull_atr_max_pct': 0.0834399625018638, 'bull_tp_mult': 1.9531904112152736, 'bull_tsl_mult': 0.9988395752516831, 'bull_time_stop': 76, 'bull_use_sma': True, 'bull_use_ema': True, 'bull_use_atr': True, 'bull_use_adx': False, 'bull_use_spike': False, 'bull_rsi_required': True, 'bear_strategy': 'breakout', 'bear_bb_std_mult': 3.1192372123940544, 'bear_rsi_os': 27, 'bear_rsi_ob': 79, 'bear_adx_thresh': 23.305736149820046, 'bear_atr_min_pct': 0.005795951901141491, 'bear_atr_max_pct': 0.10110101651403754, 'bear_tp_mult': 2.4077643507485154, 'bear_tsl_mult': 0.42949423436121426, 'bear_time_stop': 268, 'bear_use_sma': False, 'bear_use_ema': False, 'bear_use_atr': True, 'bear_use_adx': False, 'bear_use_spike': True, 'bear_rsi_required': False, 'sideways_strategy': 'mean_reversion', 'sideways_bb_std_mult': 0.7126126357803813, 'sideways_rsi_os': 20, 'sideways_rsi_ob': 93, 'sideways_adx_thresh': 29.12480160427942, 'sideways_atr_min_pct': 0.000693291699067325, 'sideways_atr_max_pct': 0.11817423898832194, 'sideways_tp_mult': 2.851658151849406, 'sideways_tsl_mult': 0.03460094675190212, 'sideways_time_stop': 222, 'sideways_use_sma': False, 'sideways_use_ema': True, 'sideways_use_atr': False, 'sideways_use_adx': False, 'sideways_use_spike': True, 'sideways_rsi_required': True}.
[I 2025-08-31 10:20:26,622] Trial 482 finished with values: [-1000000000.0, 1000000000.0] and parameters: {'p_sma': 11, 'p_std': 45, 'p_atr': 29, 'p_adx': 27, 'rsi_period': 25, 'ema1': 18, 'ema2': 35, 'slip_atr_k': 0.19572404572679464, 'slip_spread_k': 0.11850756988714026, 'spread_hl_frac': 0.010026075242550996, 'bb_std_mult': 1.2965316753837284, 'rsi_os': 41, 'rsi_ob': 84, 'vol_spike': 0.28464587671133706, 'adx_thresh': 24.29333136774256, 'atr_min_pct': 0.010467908730311866, 'atr_max_pct': 0.11821939882106758, 'tp_mult': 2.9674564528989156, 'tsl_mult': 0.12194911162551125, 'strategy': 'breakout', 'time_stop': 137, 'use_sma': False, 'use_atr': True, 'use_adx': False, 'use_ema': True, 'use_spike': True, 'rsi_required': True, 'edge_k': 1.9940868425720737, 'edge_cap': 0.1528929645970185, 'bull_strategy': 'mean_reversion', 'bull_bb_std_mult': 1.13491919806486, 'bull_rsi_os': 24, 'bull_rsi_ob': 64, 'bull_adx_thresh': 29.534138986206735, 'bull_atr_min_pct': 0.007355615957279271, 'bull_atr_max_pct': 0.08575330552455553, 'bull_tp_mult': 1.998502629852449, 'bull_tsl_mult': 0.9506475941948854, 'bull_time_stop': 76, 'bull_use_sma': True, 'bull_use_ema': False, 'bull_use_atr': False, 'bull_use_adx': False, 'bull_use_spike': False, 'bull_rsi_required': True, 'bear_strategy': 'breakout', 'bear_bb_std_mult': 3.0839798089438255, 'bear_rsi_os': 28, 'bear_rsi_ob': 77, 'bear_adx_thresh': 23.28346918559616, 'bear_atr_min_pct': 0.009091294263125972, 'bear_atr_max_pct': 0.10200114738735504, 'bear_tp_mult': 1.931329054533497, 'bear_tsl_mult': 0.4275092216817657, 'bear_time_stop': 266, 'bear_use_sma': False, 'bear_use_ema': True, 'bear_use_atr': False, 'bear_use_adx': False, 'bear_use_spike': True, 'bear_rsi_required': False, 'sideways_strategy': 'breakout', 'sideways_bb_std_mult': 0.6938526556888, 'sideways_rsi_os': 22, 'sideways_rsi_ob': 95, 'sideways_adx_thresh': 29.328669092576906, 'sideways_atr_min_pct': 0.0008937695765970468, 'sideways_atr_max_pct': 0.11019536750118424, 'sideways_tp_mult': 2.9325256420904986, 'sideways_tsl_mult': 0.0318310005989875, 'sideways_time_stop': 204, 'sideways_use_sma': True, 'sideways_use_ema': True, 'sideways_use_atr': False, 'sideways_use_adx': False, 'sideways_use_spike': True, 'sideways_rsi_required': False}.
[I 2025-08-31 10:20:57,594] Trial 488 finished with values: [-0.009601755394653244, 0.009922104335507425] and parameters: {'p_sma': 11, 'p_std': 50, 'p_atr': 28, 'p_adx': 8, 'rsi_period': 25, 'ema1': 18, 'ema2': 33, 'slip_atr_k': 0.18350722243706782, 'slip_spread_k': 0.0739464419207903, 'spread_hl_frac': 0.010700555250161541, 'bb_std_mult': 1.2391054069889373, 'rsi_os': 34, 'rsi_ob': 85, 'vol_spike': 0.2899187805564464, 'adx_thresh': 25.01837213163375, 'atr_min_pct': 0.009972513746474667, 'atr_max_pct': 0.12287708659155495, 'tp_mult': 2.9351529070922915, 'tsl_mult': 0.07410569590636992, 'strategy': 'breakout', 'time_stop': 242, 'use_sma': True, 'use_atr': False, 'use_adx': True, 'use_ema': True, 'use_spike': False, 'rsi_required': True, 'edge_k': 1.9429362842265614, 'edge_cap': 0.14171439771306032, 'bull_strategy': 'breakout', 'bull_bb_std_mult': 1.1901751392467583, 'bull_rsi_os': 23, 'bull_rsi_ob': 65, 'bull_adx_thresh': 30.135035760548387, 'bull_atr_min_pct': 0.0036747289837706144, 'bull_atr_max_pct': 0.08772986962790681, 'bull_tp_mult': 2.3136818527510776, 'bull_tsl_mult': 0.9818522949511482, 'bull_time_stop': 55, 'bull_use_sma': False, 'bull_use_ema': False, 'bull_use_atr': False, 'bull_use_adx': False, 'bull_use_spike': True, 'bull_rsi_required': False, 'bear_strategy': 'mean_reversion', 'bear_bb_std_mult': 3.045124938034018, 'bear_rsi_os': 26, 'bear_rsi_ob': 81, 'bear_adx_thresh': 22.267180917958434, 'bear_atr_min_pct': 0.00827930729950928, 'bear_atr_max_pct': 0.10965455012565015, 'bear_tp_mult': 1.981678160512655, 'bear_tsl_mult': 0.43620927952160155, 'bear_time_stop': 271, 'bear_use_sma': True, 'bear_use_ema': True, 'bear_use_atr': False, 'bear_use_adx': True, 'bear_use_spike': True, 'bear_rsi_required': True, 'sideways_strategy': 'breakout', 'sideways_bb_std_mult': 1.515243571974313, 'sideways_rsi_os': 23, 'sideways_rsi_ob': 92, 'sideways_adx_thresh': 28.16001343853905, 'sideways_atr_min_pct': 0.0001584775226931175, 'sideways_atr_max_pct': 0.10040550352786069, 'sideways_tp_mult': 2.871787223179971, 'sideways_tsl_mult': 0.05509183829641292, 'sideways_time_stop': 226, 'sideways_use_sma': True, 'sideways_use_ema': False, 'sideways_use_atr': True, 'sideways_use_adx': False, 'sideways_use_spike': True, 'sideways_rsi_required': False}.
