[I 2025-08-31 10:20:58,082] Trial 487 finished with values: [-0.009326851929455149, 0.00951544909779382] and parameters: {'p_sma': 11, 'p_std': 43, 'p_atr': 28, 'p_adx': 8, 'rsi_period': 25, 'ema1': 18, 'ema2': 34, 'slip_atr_k': 0.18284041469446918, 'slip_spread_k': 0.15018331139226276, 'spread_hl_frac': 0.01043205869107569, 'bb_std_mult': 1.2322105400952237, 'rsi_os': 37, 'rsi_ob': 85, 'vol_spike': 0.29833803441523876, 'adx_thresh': 25.37889423054789, 'atr_min_pct': 0.010658164050278253, 'atr_max_pct': 0.12276668824317175, 'tp_mult': 2.9614418850117135, 'tsl_mult': 0.07220245053273752, 'strategy': 'breakout', 'time_stop': 12, 'use_sma': True, 'use_atr': False, 'use_adx': True, 'use_ema': True, 'use_spike': False, 'rsi_required': True, 'edge_k': 1.9453724232390366, 'edge_cap': 0.146637801202877, 'bull_strategy': 'breakout', 'bull_bb_std_mult': 1.0029235656052409, 'bull_rsi_os': 27, 'bull_rsi_ob': 50, 'bull_adx_thresh': 30.044017702891573, 'bull_atr_min_pct': 0.005607883208230852, 'bull_atr_max_pct': 0.08741734086449454, 'bull_tp_mult': 2.3329692007075407, 'bull_tsl_mult': 0.9792068053680958, 'bull_time_stop': 88, 'bull_use_sma': False, 'bull_use_ema': False, 'bull_use_atr': False, 'bull_use_adx': False, 'bull_use_spike': True, 'bull_rsi_required': False, 'bear_strategy': 'mean_reversion', 'bear_bb_std_mult': 2.9631846702860867, 'bear_rsi_os': 26, 'bear_rsi_ob': 54, 'bear_adx_thresh': 22.276307887718033, 'bear_atr_min_pct': 0.008335638473420899, 'bear_atr_max_pct': 0.10986313740104821, 'bear_tp_mult': 2.1111989266711673, 'bear_tsl_mult': 0.4385395030588437, 'bear_time_stop': 273, 'bear_use_sma': True, 'bear_use_ema': True, 'bear_use_atr': False, 'bear_use_adx': True, 'bear_use_spike': True, 'bear_rsi_required': True, 'sideways_strategy': 'breakout', 'sideways_bb_std_mult': 1.502478400559947, 'sideways_rsi_os': 23, 'sideways_rsi_ob': 92, 'sideways_adx_thresh': 28.29894491539492, 'sideways_atr_min_pct': 0.00014304294943031574, 'sideways_atr_max_pct': 0.12633410351724342, 'sideways_tp_mult': 2.86567394773653, 'sideways_tsl_mult': 0.05245951703470714, 'sideways_time_stop': 226, 'sideways_use_sma': True, 'sideways_use_ema': False, 'sideways_use_atr': True, 'sideways_use_adx': False, 'sideways_use_spike': True, 'sideways_rsi_required': False}.
[I 2025-08-31 10:20:58,557] Trial 486 finished with values: [-1000000000.0, 1000000000.0] and parameters: {'p_sma': 11, 'p_std': 43, 'p_atr': 28, 'p_adx': 8, 'rsi_period': 25, 'ema1': 18, 'ema2': 34, 'slip_atr_k': 0.1817851411803913, 'slip_spread_k': 0.0704286100191224, 'spread_hl_frac': 0.01063697892210413, 'bb_std_mult': 1.2171733473742914, 'rsi_os': 37, 'rsi_ob': 82, 'vol_spike': 0.299744568425241, 'adx_thresh': 24.916127738236952, 'atr_min_pct': 0.010693963802358897, 'atr_max_pct': 0.12339109129628771, 'tp_mult': 2.9301242806306482, 'tsl_mult': 0.0727603462832296, 'strategy': 'breakout', 'time_stop': 83, 'use_sma': True, 'use_atr': False, 'use_adx': True, 'use_ema': True, 'use_spike': False, 'rsi_required': True, 'edge_k': 1.9349513839423926, 'edge_cap': 0.1492011715029779, 'bull_strategy': 'breakout', 'bull_bb_std_mult': 1.0030183035193099, 'bull_rsi_os': 27, 'bull_rsi_ob': 62, 'bull_adx_thresh': 29.921811086556893, 'bull_atr_min_pct': 0.0050401812934626495, 'bull_atr_max_pct': 0.07841033383418669, 'bull_tp_mult': 2.2024725151442164, 'bull_tsl_mult': 0.9784349163561633, 'bull_time_stop': 54, 'bull_use_sma': False, 'bull_use_ema': False, 'bull_use_atr': False, 'bull_use_adx': False, 'bull_use_spike': True, 'bull_rsi_required': False, 'bear_strategy': 'mean_reversion', 'bear_bb_std_mult': 2.96246517582481, 'bear_rsi_os': 26, 'bear_rsi_ob': 80, 'bear_adx_thresh': 22.351820165544613, 'bear_atr_min_pct': 0.006645711650654933, 'bear_atr_max_pct': 0.10970374721141492, 'bear_tp_mult': 2.0242186400899107, 'bear_tsl_mult': 0.4380101804700371, 'bear_time_stop': 271, 'bear_use_sma': True, 'bear_use_ema': True, 'bear_use_atr': False, 'bear_use_adx': True, 'bear_use_spike': True, 'bear_rsi_required': True, 'sideways_strategy': 'breakout', 'sideways_bb_std_mult': 1.436151207268059, 'sideways_rsi_os': 23, 'sideways_rsi_ob': 92, 'sideways_adx_thresh': 28.117639738670626, 'sideways_atr_min_pct': 0.0005833477633271372, 'sideways_atr_max_pct': 0.09953940276788317, 'sideways_tp_mult': 2.867036393067938, 'sideways_tsl_mult': 0.05083614057196557, 'sideways_time_stop': 227, 'sideways_use_sma': True, 'sideways_use_ema': False, 'sideways_use_atr': True, 'sideways_use_adx': False, 'sideways_use_spike': True, 'sideways_rsi_required': False}.
[I 2025-08-31 10:20:58,728] Trial 485 finished with values: [-1000000000.0, 1000000000.0] and parameters: {'p_sma': 11, 'p_std': 43, 'p_atr': 29, 'p_adx': 8, 'rsi_period': 25, 'ema1': 18, 'ema2': 35, 'slip_atr_k': 0.1830488350020797, 'slip_spread_k': 0.06908447756528824, 'spread_hl_frac': 0.008708554996286165, 'bb_std_mult': 1.261436185414395, 'rsi_os': 35, 'rsi_ob': 82, 'vol_spike': 0.2996373262284588, 'adx_thresh': 25.320794089930725, 'atr_min_pct': 0.010525142609682497, 'atr_max_pct': 0.11517474227930738, 'tp_mult': 2.9579724513526675, 'tsl_mult': 0.07831553380464858, 'strategy': 'breakout', 'time_stop': 139, 'use_sma': True, 'use_atr': False, 'use_adx': True, 'use_ema': True, 'use_spike': False, 'rsi_required': True, 'edge_k': 1.9512379051382922, 'edge_cap': 0.15718253874639027, 'bull_strategy': 'breakout', 'bull_bb_std_mult': 1.137298536814024, 'bull_rsi_os': 23, 'bull_rsi_ob': 65, 'bull_adx_thresh': 29.379113235804557, 'bull_atr_min_pct': 0.005376319685696084, 'bull_atr_max_pct': 0.0870016064757473, 'bull_tp_mult': 1.9247984633941133, 'bull_tsl_mult': 0.9430994408962404, 'bull_time_stop': 91, 'bull_use_sma': False, 'bull_use_ema': False, 'bull_use_atr': False, 'bull_use_adx': False, 'bull_use_spike': True, 'bull_rsi_required': True, 'bear_strategy': 'mean_reversion', 'bear_bb_std_mult': 2.9498322601265206, 'bear_rsi_os': 28, 'bear_rsi_ob': 81, 'bear_adx_thresh': 22.095906029183357, 'bear_atr_min_pct': 0.009238348376078238, 'bear_atr_max_pct': 0.10978991303697168, 'bear_tp_mult': 1.9285435479184838, 'bear_tsl_mult': 0.41989223695979633, 'bear_time_stop': 269, 'bear_use_sma': False, 'bear_use_ema': True, 'bear_use_atr': False, 'bear_use_adx': True, 'bear_use_spike': True, 'bear_rsi_required': True, 'sideways_strategy': 'breakout', 'sideways_bb_std_mult': 0.6879412675888918, 'sideways_rsi_os': 20, 'sideways_rsi_ob': 93, 'sideways_adx_thresh': 27.8659009585512, 'sideways_atr_min_pct': 0.00010606928298462909, 'sideways_atr_max_pct': 0.11776290313445177, 'sideways_tp_mult': 2.855896429049206, 'sideways_tsl_mult': 0.0440548056207039, 'sideways_time_stop': 223, 'sideways_use_sma': True, 'sideways_use_ema': True, 'sideways_use_atr': True, 'sideways_use_adx': False, 'sideways_use_spike': True, 'sideways_rsi_required': False}.
[I 2025-08-31 10:21:30,320] Trial 489 finished with values: [-1000000000.0, 1000000000.0] and parameters: {'p_sma': 11, 'p_std': 48, 'p_atr': 13, 'p_adx': 8, 'rsi_period': 29, 'ema1': 18, 'ema2': 34, 'slip_atr_k': 0.18381418392546045, 'slip_spread_k': 0.06704990761566891, 'spread_hl_frac': 0.010240410008861636, 'bb_std_mult': 1.2114872669911698, 'rsi_os': 37, 'rsi_ob': 85, 'vol_spike': 0.2901638003907147, 'adx_thresh': 24.71004541013264, 'atr_min_pct': 0.009896526871698804, 'atr_max_pct': 0.11362062513873109, 'tp_mult': 2.9313223505791655, 'tsl_mult': 0.07858014167111625, 'strategy': 'breakout', 'time_stop': 10, 'use_sma': True, 'use_atr': False, 'use_adx': True, 'use_ema': True, 'use_spike': False, 'rsi_required': True, 'edge_k': 1.9345450147751615, 'edge_cap': 0.14027618203753978, 'bull_strategy': 'breakout', 'bull_bb_std_mult': 1.1511012049530582, 'bull_rsi_os': 27, 'bull_rsi_ob': 92, 'bull_adx_thresh': 28.377128696703924, 'bull_atr_min_pct': 0.005497863819032021, 'bull_atr_max_pct': 0.08728364735619981, 'bull_tp_mult': 2.2697269550867123, 'bull_tsl_mult': 0.931538104381948, 'bull_time_stop': 88, 'bull_use_sma': False, 'bull_use_ema': False, 'bull_use_atr': False, 'bull_use_adx': False, 'bull_use_spike': True, 'bull_rsi_required': False, 'bear_strategy': 'mean_reversion', 'bear_bb_std_mult': 2.9798762234087874, 'bear_rsi_os': 26, 'bear_rsi_ob': 90, 'bear_adx_thresh': 22.095172164039024, 'bear_atr_min_pct': 0.008316011118182738, 'bear_atr_max_pct': 0.10981232794539818, 'bear_tp_mult': 1.9970221383036015, 'bear_tsl_mult': 0.4478241554404613, 'bear_time_stop': 272, 'bear_use_sma': True, 'bear_use_ema': True, 'bear_use_atr': False, 'bear_use_adx': True, 'bear_use_spike': True, 'bear_rsi_required': True, 'sideways_strategy': 'breakout', 'sideways_bb_std_mult': 0.6355828357784038, 'sideways_rsi_os': 23, 'sideways_rsi_ob': 93, 'sideways_adx_thresh': 28.389401582742607, 'sideways_atr_min_pct': 0.0006345659912782731, 'sideways_atr_max_pct': 0.12454382719630161, 'sideways_tp_mult': 2.874631537767321, 'sideways_tsl_mult': 0.04787748648787812, 'sideways_time_stop': 225, 'sideways_use_sma': True, 'sideways_use_ema': False, 'sideways_use_atr': True, 'sideways_use_adx': False, 'sideways_use_spike': True, 'sideways_rsi_required': False}.
[I 2025-08-31 10:21:30,603] Trial 491 finished with values: [-1000000000.0, 1000000000.0] and parameters: {'p_sma': 11, 'p_std': 48, 'p_atr': 30, 'p_adx': 10, 'rsi_period': 29, 'ema1': 18, 'ema2': 37, 'slip_atr_k': 0.1834829845585876, 'slip_spread_k': 0.14400993133916798, 'spread_hl_frac': 0.010152966181199173, 'bb_std_mult': 1.2099417844553213, 'rsi_os': 39, 'rsi_ob': 85, 'vol_spike': 0.2915365357989287, 'adx_thresh': 26.550397995643863, 'atr_min_pct': 0.010094301107556823, 'atr_max_pct': 0.1093383016634656, 'tp_mult': 2.950998869048357, 'tsl_mult': 0.07171420838971412, 'strategy': 'breakout', 'time_stop': 140, 'use_sma': True, 'use_atr': False, 'use_adx': True, 'use_ema': True, 'use_spike': False, 'rsi_required': False, 'edge_k': 1.953565250002521, 'edge_cap': 0.14096876720993545, 'bull_strategy': 'breakout', 'bull_bb_std_mult': 1.153497428178706, 'bull_rsi_os': 26, 'bull_rsi_ob': 65, 'bull_adx_thresh': 27.84305083482726, 'bull_atr_min_pct': 0.010957488805232403, 'bull_atr_max_pct': 0.0879283547128767, 'bull_tp_mult': 2.264022013926355, 'bull_tsl_mult': 0.9827721303434981, 'bull_time_stop': 90, 'bull_use_sma': True, 'bull_use_ema': False, 'bull_use_atr': False, 'bull_use_adx': False, 'bull_use_spike': True, 'bull_rsi_required': False, 'bear_strategy': 'breakout', 'bear_bb_std_mult': 3.0434387073163003, 'bear_rsi_os': 27, 'bear_rsi_ob': 92, 'bear_adx_thresh': 22.100346975009536, 'bear_atr_min_pct': 0.008590704728237501, 'bear_atr_max_pct': 0.10966752243747854, 'bear_tp_mult': 2.096766232224311, 'bear_tsl_mult': 0.44959691780705435, 'bear_time_stop': 270, 'bear_use_sma': False, 'bear_use_ema': True, 'bear_use_atr': False, 'bear_use_adx': True, 'bear_use_spike': True, 'bear_rsi_required': True, 'sideways_strategy': 'breakout', 'sideways_bb_std_mult': 1.5208089529983084, 'sideways_rsi_os': 23, 'sideways_rsi_ob': 94, 'sideways_adx_thresh': 28.536330528736663, 'sideways_atr_min_pct': 0.0002317936396452517, 'sideways_atr_max_pct': 0.11396805286763455, 'sideways_tp_mult': 2.9622420479758573, 'sideways_tsl_mult': 0.05382436785902979, 'sideways_time_stop': 226, 'sideways_use_sma': True, 'sideways_use_ema': True, 'sideways_use_atr': True, 'sideways_use_adx': False, 'sideways_use_spike': True, 'sideways_rsi_required': False}.
[I 2025-08-31 10:21:30,811] Trial 490 finished with values: [-0.010626248768021429, 0.010811830852664635] and parameters: {'p_sma': 12, 'p_std': 48, 'p_atr': 28, 'p_adx': 8, 'rsi_period': 25, 'ema1': 18, 'ema2': 34, 'slip_atr_k': 0.18974728980737732, 'slip_spread_k': 0.07919846737171449, 'spread_hl_frac': 0.0103406157821158, 'bb_std_mult': 1.2187694470375134, 'rsi_os': 38, 'rsi_ob': 82, 'vol_spike': 0.29968269603787107, 'adx_thresh': 26.49099394881989, 'atr_min_pct': 0.00984141450005689, 'atr_max_pct': 0.10955188670133044, 'tp_mult': 2.950088842080753, 'tsl_mult': 0.06939430302613818, 'strategy': 'breakout', 'time_stop': 6, 'use_sma': True, 'use_atr': False, 'use_adx': True, 'use_ema': True, 'use_spike': False, 'rsi_required': True, 'edge_k': 1.9250824842570888, 'edge_cap': 0.24788967997414224, 'bull_strategy': 'breakout', 'bull_bb_std_mult': 1.1661091961530752, 'bull_rsi_os': 27, 'bull_rsi_ob': 51, 'bull_adx_thresh': 28.108212141727932, 'bull_atr_min_pct': 0.005163826052142311, 'bull_atr_max_pct': 0.0870301366506176, 'bull_tp_mult': 2.2531029524432866, 'bull_tsl_mult': 0.9829771980811775, 'bull_time_stop': 84, 'bull_use_sma': False, 'bull_use_ema': False, 'bull_use_atr': False, 'bull_use_adx': False, 'bull_use_spike': True, 'bull_rsi_required': False, 'bear_strategy': 'mean_reversion', 'bear_bb_std_mult': 2.968425665634922, 'bear_rsi_os': 26, 'bear_rsi_ob': 50, 'bear_adx_thresh': 21.6889615310216, 'bear_atr_min_pct': 0.008724738067329721, 'bear_atr_max_pct': 0.10899441284571158, 'bear_tp_mult': 2.017732622923811, 'bear_tsl_mult': 0.44519194844454596, 'bear_time_stop': 269, 'bear_use_sma': True, 'bear_use_ema': True, 'bear_use_atr': False, 'bear_use_adx': True, 'bear_use_spike': True, 'bear_rsi_required': True, 'sideways_strategy': 'breakout', 'sideways_bb_std_mult': 1.4044288107981941, 'sideways_rsi_os': 23, 'sideways_rsi_ob': 93, 'sideways_adx_thresh': 27.982178393457993, 'sideways_atr_min_pct': 0.00017082988046575147, 'sideways_atr_max_pct': 0.09741327061246298, 'sideways_tp_mult': 2.873051715037414, 'sideways_tsl_mult': 0.05639172272752959, 'sideways_time_stop': 225, 'sideways_use_sma': True, 'sideways_use_ema': False, 'sideways_use_atr': True, 'sideways_use_adx': False, 'sideways_use_spike': True, 'sideways_rsi_required': False}.
[I 2025-08-31 10:21:31,217] Trial 492 finished with values: [-1000000000.0, 1000000000.0] and parameters: {'p_sma': 9, 'p_std': 48, 'p_atr': 30, 'p_adx': 23, 'rsi_period': 30, 'ema1': 18, 'ema2': 37, 'slip_atr_k': 0.1906977328535358, 'slip_spread_k': 0.15021281474457154, 'spread_hl_frac': 0.010414678045424453, 'bb_std_mult': 1.3604552583229301, 'rsi_os': 39, 'rsi_ob': 85, 'vol_spike': 0.29052401141810613, 'adx_thresh': 21.491092753885745, 'atr_min_pct': 0.009873628679869009, 'atr_max_pct': 0.1094869832793195, 'tp_mult': 2.9669921190577586, 'tsl_mult': 0.07796280597433505, 'strategy': 'breakout', 'time_stop': 270, 'use_sma': False, 'use_atr': False, 'use_adx': False, 'use_ema': True, 'use_spike': False, 'rsi_required': False, 'edge_k': 1.927575297465593, 'edge_cap': 0.15690354688637692, 'bull_strategy': 'mean_reversion', 'bull_bb_std_mult': 1.1786887133786779, 'bull_rsi_os': 26, 'bull_rsi_ob': 87, 'bull_adx_thresh': 28.011153536020778, 'bull_atr_min_pct': 0.003229284958089383, 'bull_atr_max_pct': 0.08745654157260818, 'bull_tp_mult': 2.2763744788625626, 'bull_tsl_mult': 0.9834089815550314, 'bull_time_stop': 81, 'bull_use_sma': True, 'bull_use_ema': True, 'bull_use_atr': True, 'bull_use_adx': False, 'bull_use_spike': False, 'bull_rsi_required': False, 'bear_strategy': 'breakout', 'bear_bb_std_mult': 3.0168272511762337, 'bear_rsi_os': 27, 'bear_rsi_ob': 93, 'bear_adx_thresh': 22.476102613972852, 'bear_atr_min_pct': 0.008455981648011656, 'bear_atr_max_pct': 0.10407079867642016, 'bear_tp_mult': 2.0974383975902793, 'bear_tsl_mult': 0.44946735097078455, 'bear_time_stop': 271, 'bear_use_sma': False, 'bear_use_ema': True, 'bear_use_atr': False, 'bear_use_adx': True, 'bear_use_spike': True, 'bear_rsi_required': True, 'sideways_strategy': 'breakout', 'sideways_bb_std_mult': 1.5370338705280058, 'sideways_rsi_os': 23, 'sideways_rsi_ob': 94, 'sideways_adx_thresh': 30.43586301984101, 'sideways_atr_min_pct': 0.00011073633252218986, 'sideways_atr_max_pct': 0.09160086954442323, 'sideways_tp_mult': 2.955045683377825, 'sideways_tsl_mult': 0.05637257487408773, 'sideways_time_stop': 271, 'sideways_use_sma': True, 'sideways_use_ema': True, 'sideways_use_atr': False, 'sideways_use_adx': False, 'sideways_use_spike': True, 'sideways_rsi_required': False}.
[I 2025-08-31 10:22:04,559] Trial 494 finished with values: [-1000000000.0, 1000000000.0] and parameters: {'p_sma': 13, 'p_std': 48, 'p_atr': 30, 'p_adx': 18, 'rsi_period': 25, 'ema1': 17, 'ema2': 37, 'slip_atr_k': 0.19086567204516355, 'slip_spread_k': 0.08983395140440481, 'spread_hl_frac': 0.01034074964857909, 'bb_std_mult': 1.2210065283454403, 'rsi_os': 39, 'rsi_ob': 80, 'vol_spike': 0.2799431589417219, 'adx_thresh': 21.24678939986409, 'atr_min_pct': 0.010984489431487516, 'atr_max_pct': 0.10788088339934161, 'tp_mult': 2.946515514835612, 'tsl_mult': 0.07319949632916756, 'strategy': 'mean_reversion', 'time_stop': 243, 'use_sma': False, 'use_atr': True, 'use_adx': False, 'use_ema': True, 'use_spike': False, 'rsi_required': True, 'edge_k': 1.9089865970593176, 'edge_cap': 0.14029143031738517, 'bull_strategy': 'mean_reversion', 'bull_bb_std_mult': 1.1929161230337193, 'bull_rsi_os': 25, 'bull_rsi_ob': 73, 'bull_adx_thresh': 30.091687979773486, 'bull_atr_min_pct': 0.008225592658320156, 'bull_atr_max_pct': 0.08291034061951805, 'bull_tp_mult': 2.197196096765161, 'bull_tsl_mult': 0.9990410008420139, 'bull_time_stop': 82, 'bull_use_sma': True, 'bull_use_ema': True, 'bull_use_atr': True, 'bull_use_adx': False, 'bull_use_spike': False, 'bull_rsi_required': True, 'bear_strategy': 'breakout', 'bear_bb_std_mult': 2.9245157437860607, 'bear_rsi_os': 27, 'bear_rsi_ob': 76, 'bear_adx_thresh': 24.03797664964159, 'bear_atr_min_pct': 0.0053553724078762655, 'bear_atr_max_pct': 0.10355185519151537, 'bear_tp_mult': 2.038253380261495, 'bear_tsl_mult': 0.459979710693122, 'bear_time_stop': 265, 'bear_use_sma': False, 'bear_use_ema': True, 'bear_use_atr': False, 'bear_use_adx': True, 'bear_use_spike': True, 'bear_rsi_required': False, 'sideways_strategy': 'mean_reversion', 'sideways_bb_std_mult': 1.6180971881924355, 'sideways_rsi_os': 23, 'sideways_rsi_ob': 95, 'sideways_adx_thresh': 30.35618397897649, 'sideways_atr_min_pct': 0.0012405721195366264, 'sideways_atr_max_pct': 0.10012689823820398, 'sideways_tp_mult': 2.8151194987469763, 'sideways_tsl_mult': 0.06304654344797812, 'sideways_time_stop': 293, 'sideways_use_sma': True, 'sideways_use_ema': True, 'sideways_use_atr': False, 'sideways_use_adx': True, 'sideways_use_spike': True, 'sideways_rsi_required': True}.
[I 2025-08-31 10:22:04,740] Trial 495 finished with values: [-1000000000.0, 1000000000.0] and parameters: {'p_sma': 13, 'p_std': 48, 'p_atr': 17, 'p_adx': 12, 'rsi_period': 25, 'ema1': 17, 'ema2': 37, 'slip_atr_k': 0.18963376081294603, 'slip_spread_k': 0.08575878537273438, 'spread_hl_frac': 0.010821174583849055, 'bb_std_mult': 1.3857042325263644, 'rsi_os': 40, 'rsi_ob': 81, 'vol_spike': 0.2882587116472523, 'adx_thresh': 21.397999885440935, 'atr_min_pct': 0.011080886962287506, 'atr_max_pct': 0.1093768066772259, 'tp_mult': 2.9392649746361625, 'tsl_mult': 0.0700960956714175, 'strategy': 'mean_reversion', 'time_stop': 269, 'use_sma': False, 'use_atr': True, 'use_adx': False, 'use_ema': True, 'use_spike': False, 'rsi_required': True, 'edge_k': 1.9056810741155965, 'edge_cap': 0.5514429737928024, 'bull_strategy': 'mean_reversion', 'bull_bb_std_mult': 1.0440414948148493, 'bull_rsi_os': 25, 'bull_rsi_ob': 60, 'bull_adx_thresh': 30.16289293070447, 'bull_atr_min_pct': 0.006779963028751051, 'bull_atr_max_pct': 0.08147233616685648, 'bull_tp_mult': 2.235933451653256, 'bull_tsl_mult': 0.9820785123665895, 'bull_time_stop': 81, 'bull_use_sma': True, 'bull_use_ema': True, 'bull_use_atr': True, 'bull_use_adx': False, 'bull_use_spike': False, 'bull_rsi_required': True, 'bear_strategy': 'breakout', 'bear_bb_std_mult': 2.9276235816703795, 'bear_rsi_os': 29, 'bear_rsi_ob': 78, 'bear_adx_thresh': 21.727888242454565, 'bear_atr_min_pct': 0.005298445603038576, 'bear_atr_max_pct': 0.10396250997397055, 'bear_tp_mult': 2.0556909708231785, 'bear_tsl_mult': 0.46168242888268074, 'bear_time_stop': 279, 'bear_use_sma': False, 'bear_use_ema': False, 'bear_use_atr': False, 'bear_use_adx': True, 'bear_use_spike': True, 'bear_rsi_required': False, 'sideways_strategy': 'mean_reversion', 'sideways_bb_std_mult': 1.6040119727695132, 'sideways_rsi_os': 23, 'sideways_rsi_ob': 95, 'sideways_adx_thresh': 30.41994492417358, 'sideways_atr_min_pct': 0.000817905435738531, 'sideways_atr_max_pct': 0.09209652402676316, 'sideways_tp_mult': 2.810147198268389, 'sideways_tsl_mult': 0.004522320377817343, 'sideways_time_stop': 231, 'sideways_use_sma': True, 'sideways_use_ema': True, 'sideways_use_atr': False, 'sideways_use_adx': False, 'sideways_use_spike': True, 'sideways_rsi_required': True}.
