[I 2025-08-31 10:11:36,359] Trial 407 finished with values: [-1000000000.0, 1000000000.0] and parameters: {'p_sma': 48, 'p_std': 22, 'p_atr': 30, 'p_adx': 11, 'rsi_period': 16, 'ema1': 20, 'ema2': 24, 'slip_atr_k': 0.17167067406156267, 'slip_spread_k': 0.423208725267887, 'spread_hl_frac': 0.028804766826867174, 'bb_std_mult': 1.1233896013008755, 'rsi_os': 26, 'rsi_ob': 52, 'vol_spike': 0.12239893462870968, 'adx_thresh': 7.2565337349628045, 'atr_min_pct': 0.013792610739499151, 'atr_max_pct': 0.11111072563205063, 'tp_mult': 2.735260740975127, 'tsl_mult': 0.017825647176366862, 'strategy': 'breakout', 'time_stop': 126, 'use_sma': False, 'use_atr': False, 'use_adx': False, 'use_ema': False, 'use_spike': False, 'rsi_required': False, 'edge_k': 1.8055373769374787, 'edge_cap': 0.8639695264341349, 'bull_strategy': 'mean_reversion', 'bull_bb_std_mult': 3.325738733998241, 'bull_rsi_os': 21, 'bull_rsi_ob': 50, 'bull_adx_thresh': 27.26739219307173, 'bull_atr_min_pct': 0.019643934459209565, 'bull_atr_max_pct': 0.11694095719718321, 'bull_tp_mult': 2.95242860394484, 'bull_tsl_mult': 0.8088521632727702, 'bull_time_stop': 136, 'bull_use_sma': True, 'bull_use_ema': True, 'bull_use_atr': False, 'bull_use_adx': False, 'bull_use_spike': False, 'bull_rsi_required': False, 'bear_strategy': 'breakout', 'bear_bb_std_mult': 1.5034129678564798, 'bear_rsi_os': 28, 'bear_rsi_ob': 95, 'bear_adx_thresh': 19.9080689534623, 'bear_atr_min_pct': 0.02311979248709152, 'bear_atr_max_pct': 0.14696052696678777, 'bear_tp_mult': 2.5760481380730833, 'bear_tsl_mult': 0.5647783935460824, 'bear_time_stop': 30, 'bear_use_sma': False, 'bear_use_ema': False, 'bear_use_atr': True, 'bear_use_adx': False, 'bear_use_spike': False, 'bear_rsi_required': True, 'sideways_strategy': 'breakout', 'sideways_bb_std_mult': 2.2390995499061566, 'sideways_rsi_os': 26, 'sideways_rsi_ob': 64, 'sideways_adx_thresh': 34.831088562587716, 'sideways_atr_min_pct': 0.0030130089181175223, 'sideways_atr_max_pct': 0.11299890252626413, 'sideways_tp_mult': 1.2698429782070635, 'sideways_tsl_mult': 0.12076663570255819, 'sideways_time_stop': 239, 'sideways_use_sma': False, 'sideways_use_ema': True, 'sideways_use_atr': False, 'sideways_use_adx': False, 'sideways_use_spike': False, 'sideways_rsi_required': False}.
[I 2025-08-31 10:11:36,563] Trial 405 finished with values: [-1000000000.0, 1000000000.0] and parameters: {'p_sma': 48, 'p_std': 15, 'p_atr': 17, 'p_adx': 8, 'rsi_period': 42, 'ema1': 12, 'ema2': 24, 'slip_atr_k': 0.1736632679897863, 'slip_spread_k': 0.39136958056431387, 'spread_hl_frac': 0.023784187048370507, 'bb_std_mult': 0.9833414691949586, 'rsi_os': 23, 'rsi_ob': 46, 'vol_spike': 0.11950265586792971, 'adx_thresh': 8.177712226448923, 'atr_min_pct': 0.011611179434895523, 'atr_max_pct': 0.09249473136080495, 'tp_mult': 2.5015411295572187, 'tsl_mult': 0.40040662057883336, 'strategy': 'breakout', 'time_stop': 100, 'use_sma': False, 'use_atr': False, 'use_adx': False, 'use_ema': False, 'use_spike': False, 'rsi_required': True, 'edge_k': 0.3934899292092141, 'edge_cap': 0.16200861683765666, 'bull_strategy': 'mean_reversion', 'bull_bb_std_mult': 0.980476812149264, 'bull_rsi_os': 35, 'bull_rsi_ob': 65, 'bull_adx_thresh': 32.751912261428224, 'bull_atr_min_pct': 0.019315694048335372, 'bull_atr_max_pct': 0.07831286434995254, 'bull_tp_mult': 1.4829954270558077, 'bull_tsl_mult': 0.5749499505304346, 'bull_time_stop': 269, 'bull_use_sma': True, 'bull_use_ema': True, 'bull_use_atr': False, 'bull_use_adx': False, 'bull_use_spike': False, 'bull_rsi_required': False, 'bear_strategy': 'breakout', 'bear_bb_std_mult': 1.4937172101554583, 'bear_rsi_os': 52, 'bear_rsi_ob': 79, 'bear_adx_thresh': 21.689058280837365, 'bear_atr_min_pct': 0.02325101453316002, 'bear_atr_max_pct': 0.03866004341490652, 'bear_tp_mult': 2.5709699781193653, 'bear_tsl_mult': 0.5248362188385127, 'bear_time_stop': 142, 'bear_use_sma': False, 'bear_use_ema': False, 'bear_use_atr': False, 'bear_use_adx': True, 'bear_use_spike': False, 'bear_rsi_required': True, 'sideways_strategy': 'breakout', 'sideways_bb_std_mult': 1.1192466925278681, 'sideways_rsi_os': 27, 'sideways_rsi_ob': 84, 'sideways_adx_thresh': 6.621740544344529, 'sideways_atr_min_pct': 0.003270915849119686, 'sideways_atr_max_pct': 0.10842891369009192, 'sideways_tp_mult': 2.11976285668273, 'sideways_tsl_mult': 0.12120479664130362, 'sideways_time_stop': 254, 'sideways_use_sma': True, 'sideways_use_ema': True, 'sideways_use_atr': False, 'sideways_use_adx': False, 'sideways_use_spike': True, 'sideways_rsi_required': False}.
[I 2025-08-31 10:11:36,816] Trial 404 finished with values: [-0.0391412324524284, 0.03904256670713634] and parameters: {'p_sma': 48, 'p_std': 53, 'p_atr': 30, 'p_adx': 11, 'rsi_period': 26, 'ema1': 13, 'ema2': 39, 'slip_atr_k': 0.1718330929205198, 'slip_spread_k': 0.39682509538144384, 'spread_hl_frac': 0.02891286269756364, 'bb_std_mult': 0.9479114555430764, 'rsi_os': 43, 'rsi_ob': 46, 'vol_spike': 0.25253505818151933, 'adx_thresh': 10.187767936179387, 'atr_min_pct': 0.017895044156100142, 'atr_max_pct': 0.1380933020626381, 'tp_mult': 2.607828573875628, 'tsl_mult': 0.017523777350096383, 'strategy': 'breakout', 'time_stop': 126, 'use_sma': False, 'use_atr': False, 'use_adx': False, 'use_ema': True, 'use_spike': False, 'rsi_required': True, 'edge_k': 1.5410776395670416, 'edge_cap': 0.62807350870347, 'bull_strategy': 'mean_reversion', 'bull_bb_std_mult': 1.278284823638072, 'bull_rsi_os': 45, 'bull_rsi_ob': 66, 'bull_adx_thresh': 32.28170694621887, 'bull_atr_min_pct': 0.011245903317698603, 'bull_atr_max_pct': 0.08297806860724384, 'bull_tp_mult': 2.9469822613992234, 'bull_tsl_mult': 0.5795118921404505, 'bull_time_stop': 48, 'bull_use_sma': True, 'bull_use_ema': True, 'bull_use_atr': False, 'bull_use_adx': False, 'bull_use_spike': False, 'bull_rsi_required': False, 'bear_strategy': 'breakout', 'bear_bb_std_mult': 2.741978223084937, 'bear_rsi_os': 52, 'bear_rsi_ob': 64, 'bear_adx_thresh': 21.553454015025196, 'bear_atr_min_pct': 0.027866481585383716, 'bear_atr_max_pct': 0.09173359724686007, 'bear_tp_mult': 1.2655869927640113, 'bear_tsl_mult': 0.5756244678182281, 'bear_time_stop': 260, 'bear_use_sma': False, 'bear_use_ema': False, 'bear_use_atr': False, 'bear_use_adx': True, 'bear_use_spike': True, 'bear_rsi_required': True, 'sideways_strategy': 'breakout', 'sideways_bb_std_mult': 2.1886157204792895, 'sideways_rsi_os': 27, 'sideways_rsi_ob': 84, 'sideways_adx_thresh': 5.0309969457570585, 'sideways_atr_min_pct': 0.0001575659078403807, 'sideways_atr_max_pct': 0.04322657092217931, 'sideways_tp_mult': 1.5477168089052349, 'sideways_tsl_mult': 0.12021925548562445, 'sideways_time_stop': 254, 'sideways_use_sma': True, 'sideways_use_ema': True, 'sideways_use_atr': False, 'sideways_use_adx': False, 'sideways_use_spike': True, 'sideways_rsi_required': False}.
[I 2025-08-31 10:11:37,516] Trial 409 finished with values: [-1000000000.0, 1000000000.0] and parameters: {'p_sma': 32, 'p_std': 17, 'p_atr': 11, 'p_adx': 18, 'rsi_period': 82, 'ema1': 20, 'ema2': 60, 'slip_atr_k': 0.09669317902062531, 'slip_spread_k': 0.3948768513754112, 'spread_hl_frac': 0.024070684315022458, 'bb_std_mult': 1.1849581078220932, 'rsi_os': 18, 'rsi_ob': 48, 'vol_spike': 0.13710511154366564, 'adx_thresh': 5.4467746775410895, 'atr_min_pct': 0.028400183235381616, 'atr_max_pct': 0.09328823329694814, 'tp_mult': 1.3921746464614326, 'tsl_mult': 0.30224163512398716, 'strategy': 'mean_reversion', 'time_stop': 10, 'use_sma': False, 'use_atr': False, 'use_adx': False, 'use_ema': False, 'use_spike': False, 'rsi_required': True, 'edge_k': 1.8350773403351888, 'edge_cap': 0.14394511894514417, 'bull_strategy': 'mean_reversion', 'bull_bb_std_mult': 1.3598429794062628, 'bull_rsi_os': 14, 'bull_rsi_ob': 66, 'bull_adx_thresh': 12.162074907543541, 'bull_atr_min_pct': 0.01861922369179502, 'bull_atr_max_pct': 0.11996670494881406, 'bull_tp_mult': 1.577987901529028, 'bull_tsl_mult': 0.6032471375370958, 'bull_time_stop': 51, 'bull_use_sma': True, 'bull_use_ema': False, 'bull_use_atr': True, 'bull_use_adx': False, 'bull_use_spike': False, 'bull_rsi_required': True, 'bear_strategy': 'breakout', 'bear_bb_std_mult': 0.9498522171095998, 'bear_rsi_os': 53, 'bear_rsi_ob': 47, 'bear_adx_thresh': 15.300800821019612, 'bear_atr_min_pct': 0.022618577008491614, 'bear_atr_max_pct': 0.14060002481651496, 'bear_tp_mult': 2.7036226354182236, 'bear_tsl_mult': 0.5383009719932296, 'bear_time_stop': 250, 'bear_use_sma': False, 'bear_use_ema': True, 'bear_use_atr': False, 'bear_use_adx': True, 'bear_use_spike': False, 'bear_rsi_required': True, 'sideways_strategy': 'breakout', 'sideways_bb_std_mult': 1.2435098714413138, 'sideways_rsi_os': 27, 'sideways_rsi_ob': 51, 'sideways_adx_thresh': 9.639896345084862, 'sideways_atr_min_pct': 0.0025496490440114336, 'sideways_atr_max_pct': 0.050395334337461496, 'sideways_tp_mult': 1.4492880578292548, 'sideways_tsl_mult': 0.08278257681536448, 'sideways_time_stop': 201, 'sideways_use_sma': True, 'sideways_use_ema': True, 'sideways_use_atr': False, 'sideways_use_adx': False, 'sideways_use_spike': False, 'sideways_rsi_required': False}.
[I 2025-08-31 10:11:37,590] Trial 411 finished with values: [-1000000000.0, 1000000000.0] and parameters: {'p_sma': 49, 'p_std': 17, 'p_atr': 11, 'p_adx': 9, 'rsi_period': 11, 'ema1': 20, 'ema2': 37, 'slip_atr_k': 0.18690948473700794, 'slip_spread_k': 0.423811957313101, 'spread_hl_frac': 0.02765706746153086, 'bb_std_mult': 0.597149406714905, 'rsi_os': 36, 'rsi_ob': 48, 'vol_spike': 0.1407134849524012, 'adx_thresh': 5.646101588175538, 'atr_min_pct': 0.01247841469773383, 'atr_max_pct': 0.13081872317373336, 'tp_mult': 2.852789457815122, 'tsl_mult': 0.0023468910761474393, 'strategy': 'mean_reversion', 'time_stop': 251, 'use_sma': False, 'use_atr': False, 'use_adx': False, 'use_ema': False, 'use_spike': False, 'rsi_required': False, 'edge_k': 0.8387042842597537, 'edge_cap': 0.14348783952815922, 'bull_strategy': 'mean_reversion', 'bull_bb_std_mult': 1.366686415171759, 'bull_rsi_os': 33, 'bull_rsi_ob': 52, 'bull_adx_thresh': 30.941247108168838, 'bull_atr_min_pct': 0.017578285203806724, 'bull_atr_max_pct': 0.03473984884712961, 'bull_tp_mult': 1.5633873670775167, 'bull_tsl_mult': 0.6096642695188875, 'bull_time_stop': 238, 'bull_use_sma': True, 'bull_use_ema': False, 'bull_use_atr': True, 'bull_use_adx': False, 'bull_use_spike': False, 'bull_rsi_required': True, 'bear_strategy': 'breakout', 'bear_bb_std_mult': 0.6468963607934253, 'bear_rsi_os': 53, 'bear_rsi_ob': 80, 'bear_adx_thresh': 20.59001476148168, 'bear_atr_min_pct': 0.01367349598877935, 'bear_atr_max_pct': 0.14118043542939077, 'bear_tp_mult': 2.6978240994030145, 'bear_tsl_mult': 0.37425623731295016, 'bear_time_stop': 191, 'bear_use_sma': True, 'bear_use_ema': True, 'bear_use_atr': True, 'bear_use_adx': True, 'bear_use_spike': False, 'bear_rsi_required': True, 'sideways_strategy': 'breakout', 'sideways_bb_std_mult': 1.1896416733585449, 'sideways_rsi_os': 25, 'sideways_rsi_ob': 88, 'sideways_adx_thresh': 27.634063729950455, 'sideways_atr_min_pct': 0.002494745260077279, 'sideways_atr_max_pct': 0.013578873698907173, 'sideways_tp_mult': 2.9567030176106317, 'sideways_tsl_mult': 0.14423780422930246, 'sideways_time_stop': 234, 'sideways_use_sma': False, 'sideways_use_ema': False, 'sideways_use_atr': False, 'sideways_use_adx': False, 'sideways_use_spike': False, 'sideways_rsi_required': False}.
[I 2025-08-31 10:11:37,594] Trial 410 finished with values: [-1000000000.0, 1000000000.0] and parameters: {'p_sma': 49, 'p_std': 34, 'p_atr': 28, 'p_adx': 18, 'rsi_period': 26, 'ema1': 20, 'ema2': 20, 'slip_atr_k': 0.13606443784283984, 'slip_spread_k': 0.49771530434239286, 'spread_hl_frac': 0.03332290359440322, 'bb_std_mult': 1.1867564116724427, 'rsi_os': 21, 'rsi_ob': 48, 'vol_spike': 0.030384949807933284, 'adx_thresh': 28.140518871727302, 'atr_min_pct': 0.012663387410843885, 'atr_max_pct': 0.13700460569970643, 'tp_mult': 1.4661359742981497, 'tsl_mult': 0.8060547128717737, 'strategy': 'mean_reversion', 'time_stop': 252, 'use_sma': False, 'use_atr': False, 'use_adx': False, 'use_ema': True, 'use_spike': False, 'rsi_required': True, 'edge_k': 0.4542468022091798, 'edge_cap': 0.14759725766394308, 'bull_strategy': 'mean_reversion', 'bull_bb_std_mult': 1.3542651033349598, 'bull_rsi_os': 31, 'bull_rsi_ob': 52, 'bull_adx_thresh': 32.157759355196276, 'bull_atr_min_pct': 0.004060919045192122, 'bull_atr_max_pct': 0.056850159258259536, 'bull_tp_mult': 1.8012017021635127, 'bull_tsl_mult': 0.4220718118039687, 'bull_time_stop': 261, 'bull_use_sma': True, 'bull_use_ema': False, 'bull_use_atr': True, 'bull_use_adx': False, 'bull_use_spike': False, 'bull_rsi_required': True, 'bear_strategy': 'breakout', 'bear_bb_std_mult': 0.7250722348324774, 'bear_rsi_os': 53, 'bear_rsi_ob': 80, 'bear_adx_thresh': 17.770241108089113, 'bear_atr_min_pct': 0.013733859648871308, 'bear_atr_max_pct': 0.14001809960599898, 'bear_tp_mult': 2.6827963114876217, 'bear_tsl_mult': 0.949691206606164, 'bear_time_stop': 193, 'bear_use_sma': True, 'bear_use_ema': True, 'bear_use_atr': False, 'bear_use_adx': True, 'bear_use_spike': True, 'bear_rsi_required': True, 'sideways_strategy': 'breakout', 'sideways_bb_std_mult': 1.255745670669604, 'sideways_rsi_os': 25, 'sideways_rsi_ob': 80, 'sideways_adx_thresh': 9.755972371934073, 'sideways_atr_min_pct': 0.0023771035422324865, 'sideways_atr_max_pct': 0.025372035898635313, 'sideways_tp_mult': 1.4616159754456972, 'sideways_tsl_mult': 0.2910917834811536, 'sideways_time_stop': 235, 'sideways_use_sma': True, 'sideways_use_ema': False, 'sideways_use_atr': False, 'sideways_use_adx': False, 'sideways_use_spike': False, 'sideways_rsi_required': False}.
[I 2025-08-31 10:11:38,998] Trial 412 finished with values: [-1000000000.0, 1000000000.0] and parameters: {'p_sma': 49, 'p_std': 16, 'p_atr': 28, 'p_adx': 9, 'rsi_period': 20, 'ema1': 18, 'ema2': 37, 'slip_atr_k': 0.2222909829648723, 'slip_spread_k': 0.4984119774556531, 'spread_hl_frac': 0.025452745980066586, 'bb_std_mult': 1.1045821823551434, 'rsi_os': 24, 'rsi_ob': 49, 'vol_spike': 0.18872562206949006, 'adx_thresh': 13.691438574158127, 'atr_min_pct': 0.0014681326473864331, 'atr_max_pct': 0.13684731268432773, 'tp_mult': 2.3037903887868207, 'tsl_mult': 0.7988026643670514, 'strategy': 'mean_reversion', 'time_stop': 252, 'use_sma': False, 'use_atr': False, 'use_adx': True, 'use_ema': False, 'use_spike': False, 'rsi_required': False, 'edge_k': 0.851369962181495, 'edge_cap': 0.1275744805096769, 'bull_strategy': 'mean_reversion', 'bull_bb_std_mult': 2.8084207445056455, 'bull_rsi_os': 50, 'bull_rsi_ob': 49, 'bull_adx_thresh': 29.91936043499504, 'bull_atr_min_pct': 0.013976380063663838, 'bull_atr_max_pct': 0.055748496091660105, 'bull_tp_mult': 1.5247602482244949, 'bull_tsl_mult': 0.6113125446328128, 'bull_time_stop': 248, 'bull_use_sma': True, 'bull_use_ema': False, 'bull_use_atr': True, 'bull_use_adx': False, 'bull_use_spike': False, 'bull_rsi_required': True, 'bear_strategy': 'breakout', 'bear_bb_std_mult': 0.6549629992352681, 'bear_rsi_os': 54, 'bear_rsi_ob': 80, 'bear_adx_thresh': 20.469057966470633, 'bear_atr_min_pct': 0.024311653854180746, 'bear_atr_max_pct': 0.14168100365042277, 'bear_tp_mult': 2.1293288615759, 'bear_tsl_mult': 0.046816416178506626, 'bear_time_stop': 225, 'bear_use_sma': True, 'bear_use_ema': True, 'bear_use_atr': True, 'bear_use_adx': True, 'bear_use_spike': False, 'bear_rsi_required': True, 'sideways_strategy': 'breakout', 'sideways_bb_std_mult': 3.1734571241830962, 'sideways_rsi_os': 24, 'sideways_rsi_ob': 63, 'sideways_adx_thresh': 23.611370445330866, 'sideways_atr_min_pct': 0.0014995365138931937, 'sideways_atr_max_pct': 0.025415250321643428, 'sideways_tp_mult': 2.9535136640808206, 'sideways_tsl_mult': 0.9526899522691172, 'sideways_time_stop': 233, 'sideways_use_sma': False, 'sideways_use_ema': False, 'sideways_use_atr': False, 'sideways_use_adx': False, 'sideways_use_spike': False, 'sideways_rsi_required': False}.
[I 2025-08-31 10:11:56,110] Trial 408 finished with values: [-1000000000.0, 1000000000.0] and parameters: {'p_sma': 49, 'p_std': 20, 'p_atr': 21, 'p_adx': 9, 'rsi_period': 49, 'ema1': 20, 'ema2': 59, 'slip_atr_k': 0.1736862462187146, 'slip_spread_k': 0.4295053600901871, 'spread_hl_frac': 0.02567579554245746, 'bb_std_mult': 0.5913610457964873, 'rsi_os': 20, 'rsi_ob': 52, 'vol_spike': 0.12167332209875367, 'adx_thresh': 8.722849750670935, 'atr_min_pct': 0.024771011675782127, 'atr_max_pct': 0.11108088536609455, 'tp_mult': 2.847809702619584, 'tsl_mult': 0.787082410471347, 'strategy': 'mean_reversion', 'time_stop': 127, 'use_sma': False, 'use_atr': False, 'use_adx': False, 'use_ema': False, 'use_spike': False, 'rsi_required': False, 'edge_k': 1.8073509957320069, 'edge_cap': 0.15521989168386363, 'bull_strategy': 'mean_reversion', 'bull_bb_std_mult': 0.723503174222826, 'bull_rsi_os': 34, 'bull_rsi_ob': 48, 'bull_adx_thresh': 32.17664228841744, 'bull_atr_min_pct': 0.01867361752460649, 'bull_atr_max_pct': 0.07947256433523846, 'bull_tp_mult': 1.555632165961605, 'bull_tsl_mult': 0.6021614649126198, 'bull_time_stop': 132, 'bull_use_sma': True, 'bull_use_ema': True, 'bull_use_atr': True, 'bull_use_adx': False, 'bull_use_spike': False, 'bull_rsi_required': False, 'bear_strategy': 'breakout', 'bear_bb_std_mult': 2.7611597903376297, 'bear_rsi_os': 53, 'bear_rsi_ob': 45, 'bear_adx_thresh': 19.91281983088762, 'bear_atr_min_pct': 0.023246457787041732, 'bear_atr_max_pct': 0.13996332715686632, 'bear_tp_mult': 2.6639445887659567, 'bear_tsl_mult': 0.5384339635775837, 'bear_time_stop': 248, 'bear_use_sma': False, 'bear_use_ema': True, 'bear_use_atr': True, 'bear_use_adx': True, 'bear_use_spike': False, 'bear_rsi_required': True, 'sideways_strategy': 'breakout', 'sideways_bb_std_mult': 2.062540999723176, 'sideways_rsi_os': 19, 'sideways_rsi_ob': 63, 'sideways_adx_thresh': 34.798262425052314, 'sideways_atr_min_pct': 0.0032192989981812657, 'sideways_atr_max_pct': 0.013055245696627929, 'sideways_tp_mult': 1.579108676433155, 'sideways_tsl_mult': 0.13723191970905285, 'sideways_time_stop': 255, 'sideways_use_sma': False, 'sideways_use_ema': True, 'sideways_use_atr': False, 'sideways_use_adx': False, 'sideways_use_spike': False, 'sideways_rsi_required': False}.
[I 2025-08-31 10:12:06,104] Trial 413 finished with values: [-1000000000.0, 1000000000.0] and parameters: {'p_sma': 41, 'p_std': 6, 'p_atr': 29, 'p_adx': 9, 'rsi_period': 64, 'ema1': 22, 'ema2': 15, 'slip_atr_k': 0.16651928837711977, 'slip_spread_k': 0.4897479055885898, 'spread_hl_frac': 0.03395897153714224, 'bb_std_mult': 2.731101556128834, 'rsi_os': 21, 'rsi_ob': 51, 'vol_spike': 0.14953439652010667, 'adx_thresh': 20.410843117389536, 'atr_min_pct': 0.004620194883295356, 'atr_max_pct': 0.135718540887861, 'tp_mult': 2.9148220400427367, 'tsl_mult': 0.06832705187007238, 'strategy': 'breakout', 'time_stop': 131, 'use_sma': True, 'use_atr': False, 'use_adx': True, 'use_ema': True, 'use_spike': False, 'rsi_required': True, 'edge_k': 1.3778402482539334, 'edge_cap': 0.12438275317158351, 'bull_strategy': 'breakout', 'bull_bb_std_mult': 1.2765547880539458, 'bull_rsi_os': 31, 'bull_rsi_ob': 80, 'bull_adx_thresh': 16.550204422561315, 'bull_atr_min_pct': 0.014879274697122543, 'bull_atr_max_pct': 0.14072736299243793, 'bull_tp_mult': 1.521707978098404, 'bull_tsl_mult': 0.5036063412705201, 'bull_time_stop': 248, 'bull_use_sma': False, 'bull_use_ema': False, 'bull_use_atr': False, 'bull_use_adx': True, 'bull_use_spike': True, 'bull_rsi_required': True, 'bear_strategy': 'mean_reversion', 'bear_bb_std_mult': 2.8636796829894244, 'bear_rsi_os': 54, 'bear_rsi_ob': 76, 'bear_adx_thresh': 22.72707596904784, 'bear_atr_min_pct': 0.02136234168237312, 'bear_atr_max_pct': 0.14477668543016886, 'bear_tp_mult': 2.6580156893196563, 'bear_tsl_mult': 0.7298132249629492, 'bear_time_stop': 236, 'bear_use_sma': False, 'bear_use_ema': True, 'bear_use_atr': False, 'bear_use_adx': True, 'bear_use_spike': False, 'bear_rsi_required': True, 'sideways_strategy': 'breakout', 'sideways_bb_std_mult': 0.9689312500068167, 'sideways_rsi_os': 24, 'sideways_rsi_ob': 49, 'sideways_adx_thresh': 31.759734657551014, 'sideways_atr_min_pct': 0.005855474482696734, 'sideways_atr_max_pct': 0.02472470122489108, 'sideways_tp_mult': 1.5819967473433292, 'sideways_tsl_mult': 0.022047083773212038, 'sideways_time_stop': 59, 'sideways_use_sma': True, 'sideways_use_ema': True, 'sideways_use_atr': True, 'sideways_use_adx': True, 'sideways_use_spike': False, 'sideways_rsi_required': False}.
