[I 2025-08-31 10:28:15,572] Trial 540 finished with values: [-1000000000.0, 1000000000.0] and parameters: {'p_sma': 7, 'p_std': 50, 'p_atr': 24, 'p_adx': 25, 'rsi_period': 23, 'ema1': 17, 'ema2': 26, 'slip_atr_k': 0.18354374329792952, 'slip_spread_k': 0.16028844252808122, 'spread_hl_frac': 0.011972162254237565, 'bb_std_mult': 1.1379123147146535, 'rsi_os': 42, 'rsi_ob': 82, 'vol_spike': 0.26505340460205873, 'adx_thresh': 25.452400950596093, 'atr_min_pct': 0.019375618853809153, 'atr_max_pct': 0.1172595780115219, 'tp_mult': 2.947147440537828, 'tsl_mult': 0.08817696904273821, 'strategy': 'breakout', 'time_stop': 138, 'use_sma': False, 'use_atr': False, 'use_adx': False, 'use_ema': True, 'use_spike': True, 'rsi_required': False, 'edge_k': 0.1683222307049218, 'edge_cap': 0.13327667210512745, 'bull_strategy': 'mean_reversion', 'bull_bb_std_mult': 1.0777582848489822, 'bull_rsi_os': 23, 'bull_rsi_ob': 72, 'bull_adx_thresh': 17.742589659306486, 'bull_atr_min_pct': 0.006670678360803392, 'bull_atr_max_pct': 0.0949694861970382, 'bull_tp_mult': 2.311907142104706, 'bull_tsl_mult': 0.9484060186531807, 'bull_time_stop': 77, 'bull_use_sma': False, 'bull_use_ema': False, 'bull_use_atr': False, 'bull_use_adx': False, 'bull_use_spike': True, 'bull_rsi_required': True, 'bear_strategy': 'mean_reversion', 'bear_bb_std_mult': 2.988586230324816, 'bear_rsi_os': 25, 'bear_rsi_ob': 85, 'bear_adx_thresh': 20.925534201258976, 'bear_atr_min_pct': 0.007113372388089012, 'bear_atr_max_pct': 0.10962209586613583, 'bear_tp_mult': 2.066876567993092, 'bear_tsl_mult': 0.2866985419678255, 'bear_time_stop': 278, 'bear_use_sma': True, 'bear_use_ema': True, 'bear_use_atr': False, 'bear_use_adx': False, 'bear_use_spike': True, 'bear_rsi_required': True, 'sideways_strategy': 'breakout', 'sideways_bb_std_mult': 0.9653864825800083, 'sideways_rsi_os': 24, 'sideways_rsi_ob': 93, 'sideways_adx_thresh': 29.317188121341786, 'sideways_atr_min_pct': 0.014827842584020237, 'sideways_atr_max_pct': 0.101526587428155, 'sideways_tp_mult': 2.783303644130625, 'sideways_tsl_mult': 0.2060789237201951, 'sideways_time_stop': 238, 'sideways_use_sma': True, 'sideways_use_ema': True, 'sideways_use_atr': True, 'sideways_use_adx': False, 'sideways_use_spike': True, 'sideways_rsi_required': False}.
[I 2025-08-31 10:28:48,456] Trial 544 finished with values: [-1000000000.0, 1000000000.0] and parameters: {'p_sma': 10, 'p_std': 52, 'p_atr': 27, 'p_adx': 11, 'rsi_period': 47, 'ema1': 16, 'ema2': 33, 'slip_atr_k': 0.17604848106599805, 'slip_spread_k': 0.13270171480193405, 'spread_hl_frac': 0.0313823303498811, 'bb_std_mult': 1.2181816483719008, 'rsi_os': 39, 'rsi_ob': 83, 'vol_spike': 0.29021027848614006, 'adx_thresh': 25.872546038974217, 'atr_min_pct': 0.018846245384583283, 'atr_max_pct': 0.12072365035648563, 'tp_mult': 2.8658793754516947, 'tsl_mult': 0.3940657217819033, 'strategy': 'mean_reversion', 'time_stop': 145, 'use_sma': True, 'use_atr': True, 'use_adx': False, 'use_ema': True, 'use_spike': False, 'rsi_required': True, 'edge_k': 0.8834564022446425, 'edge_cap': 0.16501197690238756, 'bull_strategy': 'breakout', 'bull_bb_std_mult': 1.0150308263836403, 'bull_rsi_os': 27, 'bull_rsi_ob': 46, 'bull_adx_thresh': 30.941857374623464, 'bull_atr_min_pct': 0.008964209457305819, 'bull_atr_max_pct': 0.08179930443505719, 'bull_tp_mult': 2.1624733160341223, 'bull_tsl_mult': 0.9631282909165193, 'bull_time_stop': 68, 'bull_use_sma': True, 'bull_use_ema': True, 'bull_use_atr': False, 'bull_use_adx': False, 'bull_use_spike': False, 'bull_rsi_required': False, 'bear_strategy': 'breakout', 'bear_bb_std_mult': 2.938228756491407, 'bear_rsi_os': 27, 'bear_rsi_ob': 58, 'bear_adx_thresh': 22.847782573284732, 'bear_atr_min_pct': 0.007388906071036674, 'bear_atr_max_pct': 0.10493708743744756, 'bear_tp_mult': 1.9199602234861066, 'bear_tsl_mult': 0.05447370984529637, 'bear_time_stop': 267, 'bear_use_sma': False, 'bear_use_ema': True, 'bear_use_atr': False, 'bear_use_adx': True, 'bear_use_spike': True, 'bear_rsi_required': False, 'sideways_strategy': 'mean_reversion', 'sideways_bb_std_mult': 0.7992103414699893, 'sideways_rsi_os': 15, 'sideways_rsi_ob': 91, 'sideways_adx_thresh': 28.78770896190376, 'sideways_atr_min_pct': 0.02233606029653741, 'sideways_atr_max_pct': 0.10902576801778759, 'sideways_tp_mult': 2.9604800447316406, 'sideways_tsl_mult': 0.41408137339128165, 'sideways_time_stop': 220, 'sideways_use_sma': True, 'sideways_use_ema': False, 'sideways_use_atr': False, 'sideways_use_adx': False, 'sideways_use_spike': True, 'sideways_rsi_required': True}.
[I 2025-08-31 10:28:48,786] Trial 541 finished with values: [-1000000000.0, 1000000000.0] and parameters: {'p_sma': 15, 'p_std': 50, 'p_atr': 27, 'p_adx': 18, 'rsi_period': 47, 'ema1': 17, 'ema2': 13, 'slip_atr_k': 0.18463009686307816, 'slip_spread_k': 0.14069072716308387, 'spread_hl_frac': 0.011786725552828151, 'bb_std_mult': 1.768709115331536, 'rsi_os': 37, 'rsi_ob': 87, 'vol_spike': 0.2900390825588486, 'adx_thresh': 25.62407506020843, 'atr_min_pct': 0.015401665932818621, 'atr_max_pct': 0.11713554943877473, 'tp_mult': 2.8678047787388365, 'tsl_mult': 0.38930026370791826, 'strategy': 'breakout', 'time_stop': 141, 'use_sma': False, 'use_atr': False, 'use_adx': False, 'use_ema': True, 'use_spike': True, 'rsi_required': False, 'edge_k': 1.2118561463582331, 'edge_cap': 0.18123086777220293, 'bull_strategy': 'mean_reversion', 'bull_bb_std_mult': 1.038008102023592, 'bull_rsi_os': 23, 'bull_rsi_ob': 65, 'bull_adx_thresh': 5.668766665655646, 'bull_atr_min_pct': 0.0066556181582883515, 'bull_atr_max_pct': 0.08238383764627849, 'bull_tp_mult': 2.319151919068744, 'bull_tsl_mult': 0.9446191934908308, 'bull_time_stop': 77, 'bull_use_sma': False, 'bull_use_ema': False, 'bull_use_atr': False, 'bull_use_adx': False, 'bull_use_spike': True, 'bull_rsi_required': True, 'bear_strategy': 'mean_reversion', 'bear_bb_std_mult': 3.1388542875463585, 'bear_rsi_os': 25, 'bear_rsi_ob': 74, 'bear_adx_thresh': 25.28692267496931, 'bear_atr_min_pct': 0.00719095761554084, 'bear_atr_max_pct': 0.11059941320366037, 'bear_tp_mult': 2.070878426048157, 'bear_tsl_mult': 0.7009922072190701, 'bear_time_stop': 278, 'bear_use_sma': True, 'bear_use_ema': True, 'bear_use_atr': False, 'bear_use_adx': False, 'bear_use_spike': True, 'bear_rsi_required': True, 'sideways_strategy': 'breakout', 'sideways_bb_std_mult': 2.3656062542515315, 'sideways_rsi_os': 15, 'sideways_rsi_ob': 93, 'sideways_adx_thresh': 29.329363537185085, 'sideways_atr_min_pct': 0.023127446698942265, 'sideways_atr_max_pct': 0.10070773997521552, 'sideways_tp_mult': 2.9449544585411984, 'sideways_tsl_mult': 0.4042184259940589, 'sideways_time_stop': 239, 'sideways_use_sma': True, 'sideways_use_ema': False, 'sideways_use_atr': True, 'sideways_use_adx': False, 'sideways_use_spike': True, 'sideways_rsi_required': False}.
[I 2025-08-31 10:28:48,971] Trial 542 finished with values: [-1000000000.0, 1000000000.0] and parameters: {'p_sma': 10, 'p_std': 47, 'p_atr': 27, 'p_adx': 7, 'rsi_period': 61, 'ema1': 17, 'ema2': 37, 'slip_atr_k': 0.18599752771116998, 'slip_spread_k': 0.15150048423931403, 'spread_hl_frac': 0.010984731076951054, 'bb_std_mult': 2.086633394903021, 'rsi_os': 37, 'rsi_ob': 82, 'vol_spike': 0.2897836118200403, 'adx_thresh': 26.135433328780298, 'atr_min_pct': 0.018482874181658594, 'atr_max_pct': 0.11875299594315127, 'tp_mult': 1.945780514968725, 'tsl_mult': 0.9723166549162869, 'strategy': 'breakout', 'time_stop': 73, 'use_sma': False, 'use_atr': False, 'use_adx': False, 'use_ema': True, 'use_spike': False, 'rsi_required': True, 'edge_k': 1.9235840355185814, 'edge_cap': 0.1369609375363722, 'bull_strategy': 'mean_reversion', 'bull_bb_std_mult': 1.0761971672009965, 'bull_rsi_os': 25, 'bull_rsi_ob': 62, 'bull_adx_thresh': 30.873706110059526, 'bull_atr_min_pct': 0.009611298733014098, 'bull_atr_max_pct': 0.07976771744975455, 'bull_tp_mult': 2.1613582881241427, 'bull_tsl_mult': 0.8971999280709216, 'bull_time_stop': 67, 'bull_use_sma': True, 'bull_use_ema': False, 'bull_use_atr': False, 'bull_use_adx': False, 'bull_use_spike': True, 'bull_rsi_required': True, 'bear_strategy': 'breakout', 'bear_bb_std_mult': 3.010752865843908, 'bear_rsi_os': 27, 'bear_rsi_ob': 63, 'bear_adx_thresh': 14.43221720885791, 'bear_atr_min_pct': 0.007488858640990829, 'bear_atr_max_pct': 0.10560272405210912, 'bear_tp_mult': 1.994226403587944, 'bear_tsl_mult': 0.3278414922208527, 'bear_time_stop': 277, 'bear_use_sma': False, 'bear_use_ema': True, 'bear_use_atr': False, 'bear_use_adx': True, 'bear_use_spike': True, 'bear_rsi_required': True, 'sideways_strategy': 'breakout', 'sideways_bb_std_mult': 0.9840330377795702, 'sideways_rsi_os': 24, 'sideways_rsi_ob': 94, 'sideways_adx_thresh': 28.87076116577276, 'sideways_atr_min_pct': 0.023434588529351735, 'sideways_atr_max_pct': 0.11175291502374503, 'sideways_tp_mult': 2.955614223080404, 'sideways_tsl_mult': 0.49266903657845323, 'sideways_time_stop': 240, 'sideways_use_sma': True, 'sideways_use_ema': False, 'sideways_use_atr': True, 'sideways_use_adx': False, 'sideways_use_spike': True, 'sideways_rsi_required': False}.
[I 2025-08-31 10:28:49,109] Trial 543 finished with values: [-1000000000.0, 1000000000.0] and parameters: {'p_sma': 10, 'p_std': 50, 'p_atr': 27, 'p_adx': 7, 'rsi_period': 47, 'ema1': 17, 'ema2': 17, 'slip_atr_k': 0.17622080448221752, 'slip_spread_k': 0.13717363597608398, 'spread_hl_frac': 0.04720161238608744, 'bb_std_mult': 1.2031796765598306, 'rsi_os': 42, 'rsi_ob': 82, 'vol_spike': 0.2898572465075672, 'adx_thresh': 25.9599766289285, 'atr_min_pct': 0.011418934294951057, 'atr_max_pct': 0.12201000708398826, 'tp_mult': 2.872921862203205, 'tsl_mult': 0.8170638816623428, 'strategy': 'breakout', 'time_stop': 136, 'use_sma': True, 'use_atr': False, 'use_adx': False, 'use_ema': True, 'use_spike': False, 'rsi_required': True, 'edge_k': 0.8772308935303756, 'edge_cap': 0.1356024311446099, 'bull_strategy': 'breakout', 'bull_bb_std_mult': 1.096534615567826, 'bull_rsi_os': 25, 'bull_rsi_ob': 55, 'bull_adx_thresh': 30.87275959697451, 'bull_atr_min_pct': 0.008971235584071379, 'bull_atr_max_pct': 0.07972615173721204, 'bull_tp_mult': 2.1733176393045635, 'bull_tsl_mult': 0.9540205286292648, 'bull_time_stop': 68, 'bull_use_sma': True, 'bull_use_ema': False, 'bull_use_atr': False, 'bull_use_adx': False, 'bull_use_spike': True, 'bull_rsi_required': False, 'bear_strategy': 'breakout', 'bear_bb_std_mult': 3.1016094317447944, 'bear_rsi_os': 26, 'bear_rsi_ob': 81, 'bear_adx_thresh': 28.075021450345528, 'bear_atr_min_pct': 0.007227921172513328, 'bear_atr_max_pct': 0.10518588277853899, 'bear_tp_mult': 1.9187607371232478, 'bear_tsl_mult': 0.4189459194764974, 'bear_time_stop': 268, 'bear_use_sma': False, 'bear_use_ema': True, 'bear_use_atr': False, 'bear_use_adx': True, 'bear_use_spike': True, 'bear_rsi_required': True, 'sideways_strategy': 'breakout', 'sideways_bb_std_mult': 0.7980485875248937, 'sideways_rsi_os': 24, 'sideways_rsi_ob': 91, 'sideways_adx_thresh': 28.640550584804615, 'sideways_atr_min_pct': 0.023466765135683017, 'sideways_atr_max_pct': 0.10210558810449949, 'sideways_tp_mult': 2.9569225608188945, 'sideways_tsl_mult': 0.4168622524615561, 'sideways_time_stop': 300, 'sideways_use_sma': True, 'sideways_use_ema': False, 'sideways_use_atr': True, 'sideways_use_adx': False, 'sideways_use_spike': True, 'sideways_rsi_required': False}.
[I 2025-08-31 10:29:21,666] Trial 545 finished with values: [-1000000000.0, 1000000000.0] and parameters: {'p_sma': 12, 'p_std': 46, 'p_atr': 27, 'p_adx': 12, 'rsi_period': 28, 'ema1': 15, 'ema2': 37, 'slip_atr_k': 0.19896980126703112, 'slip_spread_k': 0.03687866876088389, 'spread_hl_frac': 0.01088428764125885, 'bb_std_mult': 2.7465455533464116, 'rsi_os': 44, 'rsi_ob': 82, 'vol_spike': 0.28061684147398375, 'adx_thresh': 21.862210570285512, 'atr_min_pct': 0.0095003747374757, 'atr_max_pct': 0.12060407362507597, 'tp_mult': 2.8955634997151627, 'tsl_mult': 0.3658879874045735, 'strategy': 'breakout', 'time_stop': 277, 'use_sma': False, 'use_atr': False, 'use_adx': False, 'use_ema': True, 'use_spike': False, 'rsi_required': True, 'edge_k': 0.4703698512613992, 'edge_cap': 0.14329584338588824, 'bull_strategy': 'mean_reversion', 'bull_bb_std_mult': 0.655079658664911, 'bull_rsi_os': 26, 'bull_rsi_ob': 63, 'bull_adx_thresh': 30.76426263023889, 'bull_atr_min_pct': 0.00782983304147519, 'bull_atr_max_pct': 0.08910234459529325, 'bull_tp_mult': 2.1887940980459986, 'bull_tsl_mult': 0.9642101195058254, 'bull_time_stop': 73, 'bull_use_sma': True, 'bull_use_ema': False, 'bull_use_atr': False, 'bull_use_adx': False, 'bull_use_spike': False, 'bull_rsi_required': True, 'bear_strategy': 'breakout', 'bear_bb_std_mult': 3.1321938351772514, 'bear_rsi_os': 28, 'bear_rsi_ob': 54, 'bear_adx_thresh': 28.203027415387208, 'bear_atr_min_pct': 0.007842823086563696, 'bear_atr_max_pct': 0.10644751089816286, 'bear_tp_mult': 2.0008948880327595, 'bear_tsl_mult': 0.9504471563568877, 'bear_time_stop': 44, 'bear_use_sma': False, 'bear_use_ema': True, 'bear_use_atr': False, 'bear_use_adx': True, 'bear_use_spike': True, 'bear_rsi_required': True, 'sideways_strategy': 'breakout', 'sideways_bb_std_mult': 1.8382261427883397, 'sideways_rsi_os': 21, 'sideways_rsi_ob': 94, 'sideways_adx_thresh': 27.59629398148915, 'sideways_atr_min_pct': 0.0006456435500065784, 'sideways_atr_max_pct': 0.11132554513347306, 'sideways_tp_mult': 2.9494414143186107, 'sideways_tsl_mult': 0.07202864208712491, 'sideways_time_stop': 251, 'sideways_use_sma': True, 'sideways_use_ema': False, 'sideways_use_atr': False, 'sideways_use_adx': False, 'sideways_use_spike': True, 'sideways_rsi_required': False}.
[I 2025-08-31 10:29:22,619] Trial 548 finished with values: [-1000000000.0, 1000000000.0] and parameters: {'p_sma': 12, 'p_std': 48, 'p_atr': 26, 'p_adx': 14, 'rsi_period': 72, 'ema1': 15, 'ema2': 37, 'slip_atr_k': 0.2012130459093707, 'slip_spread_k': 0.06874852850729166, 'spread_hl_frac': 0.009796698660396019, 'bb_std_mult': 1.2681114237050073, 'rsi_os': 40, 'rsi_ob': 85, 'vol_spike': 0.276315803733892, 'adx_thresh': 23.169191556082062, 'atr_min_pct': 0.01685455488178695, 'atr_max_pct': 0.12504830391388486, 'tp_mult': 2.907363395462931, 'tsl_mult': 0.6270328765642132, 'strategy': 'mean_reversion', 'time_stop': 213, 'use_sma': False, 'use_atr': True, 'use_adx': True, 'use_ema': True, 'use_spike': False, 'rsi_required': True, 'edge_k': 1.1064206850786291, 'edge_cap': 0.11381126156402643, 'bull_strategy': 'mean_reversion', 'bull_bb_std_mult': 0.643201722547259, 'bull_rsi_os': 26, 'bull_rsi_ob': 68, 'bull_adx_thresh': 29.256810965215013, 'bull_atr_min_pct': 0.0074896331789718875, 'bull_atr_max_pct': 0.08965154467499539, 'bull_tp_mult': 2.2094764652117354, 'bull_tsl_mult': 0.9776642119668586, 'bull_time_stop': 72, 'bull_use_sma': True, 'bull_use_ema': True, 'bull_use_atr': True, 'bull_use_adx': True, 'bull_use_spike': False, 'bull_rsi_required': True, 'bear_strategy': 'breakout', 'bear_bb_std_mult': 1.1455283934010734, 'bear_rsi_os': 28, 'bear_rsi_ob': 77, 'bear_adx_thresh': 17.74718934534149, 'bear_atr_min_pct': 0.005798428383881011, 'bear_atr_max_pct': 0.10722988458734156, 'bear_tp_mult': 2.153550338198772, 'bear_tsl_mult': 0.9545625144362337, 'bear_time_stop': 260, 'bear_use_sma': False, 'bear_use_ema': False, 'bear_use_atr': True, 'bear_use_adx': True, 'bear_use_spike': True, 'bear_rsi_required': False, 'sideways_strategy': 'mean_reversion', 'sideways_bb_std_mult': 1.8588198218110863, 'sideways_rsi_os': 21, 'sideways_rsi_ob': 94, 'sideways_adx_thresh': 30.82456005931914, 'sideways_atr_min_pct': 0.0008560707098383814, 'sideways_atr_max_pct': 0.08936666935330996, 'sideways_tp_mult': 2.884290432374685, 'sideways_tsl_mult': 0.07314011393447128, 'sideways_time_stop': 251, 'sideways_use_sma': False, 'sideways_use_ema': True, 'sideways_use_atr': False, 'sideways_use_adx': True, 'sideways_use_spike': True, 'sideways_rsi_required': True}.
[I 2025-08-31 10:29:22,625] Trial 547 finished with values: [-1000000000.0, 1000000000.0] and parameters: {'p_sma': 12, 'p_std': 48, 'p_atr': 30, 'p_adx': 11, 'rsi_period': 80, 'ema1': 18, 'ema2': 29, 'slip_atr_k': 0.201232648264326, 'slip_spread_k': 0.06018203998142705, 'spread_hl_frac': 0.03667173693921201, 'bb_std_mult': 1.2119036626124666, 'rsi_os': 40, 'rsi_ob': 85, 'vol_spike': 0.27945180404924774, 'adx_thresh': 22.07049914482959, 'atr_min_pct': 0.011631510681619692, 'atr_max_pct': 0.12437151031898502, 'tp_mult': 2.889767692255379, 'tsl_mult': 0.4369368649279366, 'strategy': 'breakout', 'time_stop': 209, 'use_sma': True, 'use_atr': False, 'use_adx': True, 'use_ema': True, 'use_spike': False, 'rsi_required': True, 'edge_k': 1.109586899161121, 'edge_cap': 0.855406986601078, 'bull_strategy': 'breakout', 'bull_bb_std_mult': 1.2352023687331641, 'bull_rsi_os': 26, 'bull_rsi_ob': 82, 'bull_adx_thresh': 34.680555778079224, 'bull_atr_min_pct': 0.00784072947917425, 'bull_atr_max_pct': 0.08721935616586522, 'bull_tp_mult': 2.197869418809667, 'bull_tsl_mult': 0.9779184151428703, 'bull_time_stop': 70, 'bull_use_sma': True, 'bull_use_ema': True, 'bull_use_atr': True, 'bull_use_adx': True, 'bull_use_spike': False, 'bull_rsi_required': False, 'bear_strategy': 'breakout', 'bear_bb_std_mult': 3.096426723991638, 'bear_rsi_os': 28, 'bear_rsi_ob': 81, 'bear_adx_thresh': 28.13718661088643, 'bear_atr_min_pct': 0.007756216265574305, 'bear_atr_max_pct': 0.09886703902293119, 'bear_tp_mult': 1.9897222348558488, 'bear_tsl_mult': 0.4228224985444472, 'bear_time_stop': 47, 'bear_use_sma': False, 'bear_use_ema': False, 'bear_use_atr': True, 'bear_use_adx': True, 'bear_use_spike': True, 'bear_rsi_required': True, 'sideways_strategy': 'breakout', 'sideways_bb_std_mult': 3.0193757751550687, 'sideways_rsi_os': 25, 'sideways_rsi_ob': 94, 'sideways_adx_thresh': 27.27105898920529, 'sideways_atr_min_pct': 0.02612963823601082, 'sideways_atr_max_pct': 0.10310258770221438, 'sideways_tp_mult': 2.8072545175176273, 'sideways_tsl_mult': 0.06817735058597517, 'sideways_time_stop': 224, 'sideways_use_sma': False, 'sideways_use_ema': True, 'sideways_use_atr': False, 'sideways_use_adx': True, 'sideways_use_spike': True, 'sideways_rsi_required': False}.
[I 2025-08-31 10:29:22,903] Trial 546 finished with values: [-1000000000.0, 1000000000.0] and parameters: {'p_sma': 12, 'p_std': 48, 'p_atr': 27, 'p_adx': 8, 'rsi_period': 28, 'ema1': 17, 'ema2': 37, 'slip_atr_k': 0.189363119496333, 'slip_spread_k': 0.0640884719619487, 'spread_hl_frac': 0.01089961889365381, 'bb_std_mult': 2.0512461996941003, 'rsi_os': 40, 'rsi_ob': 82, 'vol_spike': 0.2763338439390468, 'adx_thresh': 26.51947812132842, 'atr_min_pct': 0.011887401923126456, 'atr_max_pct': 0.12305993293767341, 'tp_mult': 2.629041082156724, 'tsl_mult': 0.359654463079361, 'strategy': 'breakout', 'time_stop': 136, 'use_sma': False, 'use_atr': False, 'use_adx': True, 'use_ema': True, 'use_spike': False, 'rsi_required': True, 'edge_k': 1.9347814824348681, 'edge_cap': 0.8513873577102411, 'bull_strategy': 'mean_reversion', 'bull_bb_std_mult': 0.6853188741013734, 'bull_rsi_os': 25, 'bull_rsi_ob': 49, 'bull_adx_thresh': 9.6409197540449, 'bull_atr_min_pct': 0.007533489833932189, 'bull_atr_max_pct': 0.07890387816918477, 'bull_tp_mult': 2.203379172215271, 'bull_tsl_mult': 0.9996881886467913, 'bull_time_stop': 69, 'bull_use_sma': True, 'bull_use_ema': False, 'bull_use_atr': True, 'bull_use_adx': True, 'bull_use_spike': False, 'bull_rsi_required': False, 'bear_strategy': 'breakout', 'bear_bb_std_mult': 1.17068501783191, 'bear_rsi_os': 28, 'bear_rsi_ob': 77, 'bear_adx_thresh': 21.653539334272544, 'bear_atr_min_pct': 0.00788082064279517, 'bear_atr_max_pct': 0.09855303417747441, 'bear_tp_mult': 1.99014910501151, 'bear_tsl_mult': 0.4833613262699743, 'bear_time_stop': 43, 'bear_use_sma': False, 'bear_use_ema': False, 'bear_use_atr': True, 'bear_use_adx': True, 'bear_use_spike': True, 'bear_rsi_required': True, 'sideways_strategy': 'breakout', 'sideways_bb_std_mult': 1.8625650669616136, 'sideways_rsi_os': 24, 'sideways_rsi_ob': 94, 'sideways_adx_thresh': 30.88261249252701, 'sideways_atr_min_pct': 0.018928907827752556, 'sideways_atr_max_pct': 0.08971487473572173, 'sideways_tp_mult': 2.8834114540708473, 'sideways_tsl_mult': 0.49719023576735466, 'sideways_time_stop': 253, 'sideways_use_sma': False, 'sideways_use_ema': True, 'sideways_use_atr': False, 'sideways_use_adx': True, 'sideways_use_spike': True, 'sideways_rsi_required': False}.
