[I 2025-08-31 10:13:15,707] Trial 423 finished with values: [-1000000000.0, 1000000000.0] and parameters: {'p_sma': 53, 'p_std': 56, 'p_atr': 12, 'p_adx': 8, 'rsi_period': 68, 'ema1': 19, 'ema2': 21, 'slip_atr_k': 0.1812789552127129, 'slip_spread_k': 0.44179888317864313, 'spread_hl_frac': 0.017074434884289724, 'bb_std_mult': 1.985031441072569, 'rsi_os': 5, 'rsi_ob': 65, 'vol_spike': 0.17295596628172905, 'adx_thresh': 7.94130915810511, 'atr_min_pct': 0.019959301079323085, 'atr_max_pct': 0.14667754797555876, 'tp_mult': 1.294758854403295, 'tsl_mult': 0.7531945558099555, 'strategy': 'breakout', 'time_stop': 145, 'use_sma': False, 'use_atr': False, 'use_adx': False, 'use_ema': True, 'use_spike': False, 'rsi_required': False, 'edge_k': 1.852441284494063, 'edge_cap': 0.09161874847419432, 'bull_strategy': 'mean_reversion', 'bull_bb_std_mult': 1.4326889338912627, 'bull_rsi_os': 39, 'bull_rsi_ob': 66, 'bull_adx_thresh': 31.568877325562823, 'bull_atr_min_pct': 0.02009169965532979, 'bull_atr_max_pct': 0.02045305807359058, 'bull_tp_mult': 1.4539588029409385, 'bull_tsl_mult': 0.23517023329094572, 'bull_time_stop': 79, 'bull_use_sma': True, 'bull_use_ema': True, 'bull_use_atr': False, 'bull_use_adx': False, 'bull_use_spike': False, 'bull_rsi_required': False, 'bear_strategy': 'breakout', 'bear_bb_std_mult': 2.681349158381199, 'bear_rsi_os': 45, 'bear_rsi_ob': 88, 'bear_adx_thresh': 8.011373971692839, 'bear_atr_min_pct': 0.006527778113948883, 'bear_atr_max_pct': 0.11340468932358239, 'bear_tp_mult': 2.074603040205483, 'bear_tsl_mult': 0.16683623668795056, 'bear_time_stop': 198, 'bear_use_sma': True, 'bear_use_ema': False, 'bear_use_atr': True, 'bear_use_adx': True, 'bear_use_spike': False, 'bear_rsi_required': True, 'sideways_strategy': 'breakout', 'sideways_bb_std_mult': 1.8844728453604833, 'sideways_rsi_os': 25, 'sideways_rsi_ob': 64, 'sideways_adx_thresh': 16.937675990900647, 'sideways_atr_min_pct': 0.009680076933373336, 'sideways_atr_max_pct': 0.0780950591718914, 'sideways_tp_mult': 1.6489278292263492, 'sideways_tsl_mult': 0.798320847607054, 'sideways_time_stop': 165, 'sideways_use_sma': False, 'sideways_use_ema': False, 'sideways_use_atr': False, 'sideways_use_adx': False, 'sideways_use_spike': True, 'sideways_rsi_required': False}.
[I 2025-08-31 10:13:15,817] Trial 424 finished with values: [-1000000000.0, 1000000000.0] and parameters: {'p_sma': 47, 'p_std': 15, 'p_atr': 12, 'p_adx': 8, 'rsi_period': 20, 'ema1': 19, 'ema2': 39, 'slip_atr_k': 0.18407722581320912, 'slip_spread_k': 0.44713452527983605, 'spread_hl_frac': 0.006959702345826969, 'bb_std_mult': 1.9935666891661297, 'rsi_os': 46, 'rsi_ob': 65, 'vol_spike': 0.11337967323369658, 'adx_thresh': 5.616921831176005, 'atr_min_pct': 0.0203939047466914, 'atr_max_pct': 0.04326795831631272, 'tp_mult': 2.3505961742221237, 'tsl_mult': 0.7608510615989954, 'strategy': 'breakout', 'time_stop': 156, 'use_sma': False, 'use_atr': False, 'use_adx': False, 'use_ema': True, 'use_spike': False, 'rsi_required': False, 'edge_k': 1.8533853418367163, 'edge_cap': 0.5024491767234041, 'bull_strategy': 'mean_reversion', 'bull_bb_std_mult': 1.424853611840702, 'bull_rsi_os': 32, 'bull_rsi_ob': 66, 'bull_adx_thresh': 34.07321105033883, 'bull_atr_min_pct': 0.017362777369203136, 'bull_atr_max_pct': 0.12158134001818674, 'bull_tp_mult': 1.463032153234987, 'bull_tsl_mult': 0.5649957141400286, 'bull_time_stop': 280, 'bull_use_sma': True, 'bull_use_ema': True, 'bull_use_atr': False, 'bull_use_adx': False, 'bull_use_spike': False, 'bull_rsi_required': False, 'bear_strategy': 'breakout', 'bear_bb_std_mult': 2.471356814300763, 'bear_rsi_os': 43, 'bear_rsi_ob': 78, 'bear_adx_thresh': 16.169948851432903, 'bear_atr_min_pct': 0.02179493322110844, 'bear_atr_max_pct': 0.11326988703797651, 'bear_tp_mult': 2.61097363662893, 'bear_tsl_mult': 0.4858503242759993, 'bear_time_stop': 211, 'bear_use_sma': True, 'bear_use_ema': False, 'bear_use_atr': True, 'bear_use_adx': True, 'bear_use_spike': False, 'bear_rsi_required': True, 'sideways_strategy': 'breakout', 'sideways_bb_std_mult': 1.0444774107782917, 'sideways_rsi_os': 24, 'sideways_rsi_ob': 64, 'sideways_adx_thresh': 32.33455336844998, 'sideways_atr_min_pct': 0.006286883621329734, 'sideways_atr_max_pct': 0.0775331926713069, 'sideways_tp_mult': 1.6260460897985891, 'sideways_tsl_mult': 0.16806329483747412, 'sideways_time_stop': 68, 'sideways_use_sma': False, 'sideways_use_ema': False, 'sideways_use_atr': False, 'sideways_use_adx': False, 'sideways_use_spike': False, 'sideways_rsi_required': False}.
[I 2025-08-31 10:13:16,554] Trial 427 finished with values: [-1000000000.0, 1000000000.0] and parameters: {'p_sma': 24, 'p_std': 18, 'p_atr': 22, 'p_adx': 9, 'rsi_period': 20, 'ema1': 20, 'ema2': 17, 'slip_atr_k': 0.24075185804933216, 'slip_spread_k': 0.41259359476901725, 'spread_hl_frac': 0.012237746413430638, 'bb_std_mult': 1.0107350369061467, 'rsi_os': 51, 'rsi_ob': 79, 'vol_spike': 0.11291550676138198, 'adx_thresh': 5.907940266370581, 'atr_min_pct': 0.013245588501928189, 'atr_max_pct': 0.07813915516188914, 'tp_mult': 2.8346246281903915, 'tsl_mult': 0.2784840252111179, 'strategy': 'mean_reversion', 'time_stop': 136, 'use_sma': False, 'use_atr': False, 'use_adx': True, 'use_ema': False, 'use_spike': False, 'rsi_required': True, 'edge_k': 1.1816620339764303, 'edge_cap': 0.10229337755319322, 'bull_strategy': 'mean_reversion', 'bull_bb_std_mult': 1.5475467616549226, 'bull_rsi_os': 22, 'bull_rsi_ob': 67, 'bull_adx_thresh': 29.764040804062574, 'bull_atr_min_pct': 0.005616667075455037, 'bull_atr_max_pct': 0.12163539512563236, 'bull_tp_mult': 1.9828781133670321, 'bull_tsl_mult': 0.5862797169903201, 'bull_time_stop': 237, 'bull_use_sma': True, 'bull_use_ema': True, 'bull_use_atr': True, 'bull_use_adx': False, 'bull_use_spike': False, 'bull_rsi_required': True, 'bear_strategy': 'breakout', 'bear_bb_std_mult': 2.5655501563847016, 'bear_rsi_os': 34, 'bear_rsi_ob': 79, 'bear_adx_thresh': 9.601965804877826, 'bear_atr_min_pct': 0.017481518995765794, 'bear_atr_max_pct': 0.14224020372838697, 'bear_tp_mult': 2.951267628971822, 'bear_tsl_mult': 0.12468043683114088, 'bear_time_stop': 168, 'bear_use_sma': False, 'bear_use_ema': True, 'bear_use_atr': False, 'bear_use_adx': True, 'bear_use_spike': False, 'bear_rsi_required': True, 'sideways_strategy': 'breakout', 'sideways_bb_std_mult': 0.9638259873238966, 'sideways_rsi_os': 8, 'sideways_rsi_ob': 65, 'sideways_adx_thresh': 33.2633947479479, 'sideways_atr_min_pct': 0.0084522677204818, 'sideways_atr_max_pct': 0.09892354366254016, 'sideways_tp_mult': 1.5928947375223061, 'sideways_tsl_mult': 0.10488829580609352, 'sideways_time_stop': 68, 'sideways_use_sma': True, 'sideways_use_ema': True, 'sideways_use_atr': False, 'sideways_use_adx': False, 'sideways_use_spike': False, 'sideways_rsi_required': False}.
[I 2025-08-31 10:13:46,611] Trial 426 finished with values: [-1000000000.0, 1000000000.0] and parameters: {'p_sma': 46, 'p_std': 18, 'p_atr': 28, 'p_adx': 17, 'rsi_period': 20, 'ema1': 19, 'ema2': 39, 'slip_atr_k': 0.24186189598853977, 'slip_spread_k': 0.9462390300069345, 'spread_hl_frac': 0.006788345540179146, 'bb_std_mult': 1.0096489701821063, 'rsi_os': 19, 'rsi_ob': 87, 'vol_spike': 0.17263533005259635, 'adx_thresh': 25.034422216489197, 'atr_min_pct': 0.012049293378865115, 'atr_max_pct': 0.08432676940142197, 'tp_mult': 2.351235933028082, 'tsl_mult': 0.9218745900690926, 'strategy': 'breakout', 'time_stop': 141, 'use_sma': False, 'use_atr': False, 'use_adx': False, 'use_ema': False, 'use_spike': False, 'rsi_required': False, 'edge_k': 1.7755806505648586, 'edge_cap': 0.5126047384700491, 'bull_strategy': 'mean_reversion', 'bull_bb_std_mult': 1.417668992695968, 'bull_rsi_os': 32, 'bull_rsi_ob': 66, 'bull_adx_thresh': 29.633673772692422, 'bull_atr_min_pct': 0.01894693332977398, 'bull_atr_max_pct': 0.12091765733595275, 'bull_tp_mult': 1.4395921956830564, 'bull_tsl_mult': 0.23046656218124661, 'bull_time_stop': 161, 'bull_use_sma': True, 'bull_use_ema': True, 'bull_use_atr': False, 'bull_use_adx': False, 'bull_use_spike': False, 'bull_rsi_required': False, 'bear_strategy': 'breakout', 'bear_bb_std_mult': 2.6611901453495257, 'bear_rsi_os': 45, 'bear_rsi_ob': 62, 'bear_adx_thresh': 20.364113093514387, 'bear_atr_min_pct': 0.021685738105801176, 'bear_atr_max_pct': 0.09810418034318152, 'bear_tp_mult': 1.9987269721924348, 'bear_tsl_mult': 0.1695617456707461, 'bear_time_stop': 167, 'bear_use_sma': True, 'bear_use_ema': True, 'bear_use_atr': True, 'bear_use_adx': True, 'bear_use_spike': False, 'bear_rsi_required': True, 'sideways_strategy': 'breakout', 'sideways_bb_std_mult': 1.1766360273677956, 'sideways_rsi_os': 24, 'sideways_rsi_ob': 65, 'sideways_adx_thresh': 33.07543091711419, 'sideways_atr_min_pct': 0.008560214430756215, 'sideways_atr_max_pct': 0.02925910891002533, 'sideways_tp_mult': 2.677551523339449, 'sideways_tsl_mult': 0.9190220358500854, 'sideways_time_stop': 248, 'sideways_use_sma': False, 'sideways_use_ema': True, 'sideways_use_atr': False, 'sideways_use_adx': False, 'sideways_use_spike': False, 'sideways_rsi_required': False}.
[I 2025-08-31 10:13:47,092] Trial 425 finished with values: [-0.1141996863769209, 0.11409858276838254] and parameters: {'p_sma': 53, 'p_std': 58, 'p_atr': 24, 'p_adx': 9, 'rsi_period': 7, 'ema1': 19, 'ema2': 39, 'slip_atr_k': 0.07633866916783705, 'slip_spread_k': 0.1794091879031473, 'spread_hl_frac': 0.012166364379743992, 'bb_std_mult': 0.9996463842714989, 'rsi_os': 51, 'rsi_ob': 90, 'vol_spike': 0.038911326449116504, 'adx_thresh': 6.090756716012662, 'atr_min_pct': 0.02037573818278891, 'atr_max_pct': 0.1408087375143566, 'tp_mult': 2.5479579652212894, 'tsl_mult': 0.7446133660601093, 'strategy': 'breakout', 'time_stop': 141, 'use_sma': False, 'use_atr': False, 'use_adx': False, 'use_ema': True, 'use_spike': False, 'rsi_required': False, 'edge_k': 1.8370028471091473, 'edge_cap': 0.10390367147282575, 'bull_strategy': 'mean_reversion', 'bull_bb_std_mult': 1.3060117809073901, 'bull_rsi_os': 32, 'bull_rsi_ob': 66, 'bull_adx_thresh': 28.00132976589217, 'bull_atr_min_pct': 0.003447716793196101, 'bull_atr_max_pct': 0.12142880518330267, 'bull_tp_mult': 1.7218050681498116, 'bull_tsl_mult': 0.22069127649058407, 'bull_time_stop': 258, 'bull_use_sma': True, 'bull_use_ema': True, 'bull_use_atr': False, 'bull_use_adx': False, 'bull_use_spike': False, 'bull_rsi_required': False, 'bear_strategy': 'breakout', 'bear_bb_std_mult': 2.470468244491567, 'bear_rsi_os': 22, 'bear_rsi_ob': 78, 'bear_adx_thresh': 33.48865376817497, 'bear_atr_min_pct': 0.006625434388146485, 'bear_atr_max_pct': 0.13780395842928594, 'bear_tp_mult': 2.6069492325909827, 'bear_tsl_mult': 0.5345003874721934, 'bear_time_stop': 179, 'bear_use_sma': True, 'bear_use_ema': False, 'bear_use_atr': True, 'bear_use_adx': True, 'bear_use_spike': False, 'bear_rsi_required': True, 'sideways_strategy': 'breakout', 'sideways_bb_std_mult': 1.5308121582080587, 'sideways_rsi_os': 25, 'sideways_rsi_ob': 65, 'sideways_adx_thresh': 32.48610237548786, 'sideways_atr_min_pct': 0.0006312373568864809, 'sideways_atr_max_pct': 0.019207235429712092, 'sideways_tp_mult': 1.4217854229103906, 'sideways_tsl_mult': 0.10402979789768833, 'sideways_time_stop': 10, 'sideways_use_sma': False, 'sideways_use_ema': False, 'sideways_use_atr': False, 'sideways_use_adx': False, 'sideways_use_spike': False, 'sideways_rsi_required': False}.
[I 2025-08-31 10:13:47,577] Trial 428 finished with values: [-1000000000.0, 1000000000.0] and parameters: {'p_sma': 51, 'p_std': 18, 'p_atr': 28, 'p_adx': 9, 'rsi_period': 20, 'ema1': 27, 'ema2': 18, 'slip_atr_k': 0.1655624983174098, 'slip_spread_k': 0.5995447900794171, 'spread_hl_frac': 0.012210350297592001, 'bb_std_mult': 1.4827583452613384, 'rsi_os': 19, 'rsi_ob': 72, 'vol_spike': 0.16386685723923694, 'adx_thresh': 29.530771799788646, 'atr_min_pct': 0.009178796622527591, 'atr_max_pct': 0.1397881922843015, 'tp_mult': 2.889664772801889, 'tsl_mult': 0.377584324018148, 'strategy': 'mean_reversion', 'time_stop': 136, 'use_sma': False, 'use_atr': False, 'use_adx': True, 'use_ema': False, 'use_spike': False, 'rsi_required': True, 'edge_k': 1.78199534304658, 'edge_cap': 0.10604759875525893, 'bull_strategy': 'mean_reversion', 'bull_bb_std_mult': 1.5764537297677497, 'bull_rsi_os': 22, 'bull_rsi_ob': 46, 'bull_adx_thresh': 29.566319811693923, 'bull_atr_min_pct': 0.007641827472329318, 'bull_atr_max_pct': 0.11950655778363664, 'bull_tp_mult': 2.1807578086377273, 'bull_tsl_mult': 0.30737225105013644, 'bull_time_stop': 236, 'bull_use_sma': True, 'bull_use_ema': False, 'bull_use_atr': True, 'bull_use_adx': False, 'bull_use_spike': False, 'bull_rsi_required': True, 'bear_strategy': 'breakout', 'bear_bb_std_mult': 0.5016560799815986, 'bear_rsi_os': 39, 'bear_rsi_ob': 79, 'bear_adx_thresh': 20.186783987497524, 'bear_atr_min_pct': 0.022488624021225378, 'bear_atr_max_pct': 0.10804689098927041, 'bear_tp_mult': 2.4858822220178607, 'bear_tsl_mult': 0.6819753432688135, 'bear_time_stop': 179, 'bear_use_sma': False, 'bear_use_ema': True, 'bear_use_atr': False, 'bear_use_adx': True, 'bear_use_spike': False, 'bear_rsi_required': True, 'sideways_strategy': 'breakout', 'sideways_bb_std_mult': 1.1622856124247418, 'sideways_rsi_os': 25, 'sideways_rsi_ob': 75, 'sideways_adx_thresh': 18.518389929987634, 'sideways_atr_min_pct': 0.002317319024915471, 'sideways_atr_max_pct': 0.019478721327001618, 'sideways_tp_mult': 1.580822247549667, 'sideways_tsl_mult': 0.1022062002833555, 'sideways_time_stop': 50, 'sideways_use_sma': True, 'sideways_use_ema': True, 'sideways_use_atr': False, 'sideways_use_adx': False, 'sideways_use_spike': False, 'sideways_rsi_required': False}.
[I 2025-08-31 10:13:48,541] Trial 429 finished with values: [-1000000000.0, 1000000000.0] and parameters: {'p_sma': 46, 'p_std': 23, 'p_atr': 28, 'p_adx': 10, 'rsi_period': 22, 'ema1': 27, 'ema2': 55, 'slip_atr_k': 0.1441834315248166, 'slip_spread_k': 0.186772045661875, 'spread_hl_frac': 0.03743302025460981, 'bb_std_mult': 1.1371874467112217, 'rsi_os': 19, 'rsi_ob': 71, 'vol_spike': 0.024965123626208424, 'adx_thresh': 24.815032464636516, 'atr_min_pct': 0.012174269428976025, 'atr_max_pct': 0.08664395066526737, 'tp_mult': 2.8821365681872706, 'tsl_mult': 0.7099371458162526, 'strategy': 'breakout', 'time_stop': 141, 'use_sma': False, 'use_atr': False, 'use_adx': False, 'use_ema': False, 'use_spike': False, 'rsi_required': True, 'edge_k': 1.0757531999775902, 'edge_cap': 0.3272054720506469, 'bull_strategy': 'mean_reversion', 'bull_bb_std_mult': 1.3000532114316505, 'bull_rsi_os': 48, 'bull_rsi_ob': 69, 'bull_adx_thresh': 9.829467104332021, 'bull_atr_min_pct': 0.018897478431489517, 'bull_atr_max_pct': 0.11940205741536446, 'bull_tp_mult': 1.4127361743574969, 'bull_tsl_mult': 0.19592323906303388, 'bull_time_stop': 161, 'bull_use_sma': True, 'bull_use_ema': False, 'bull_use_atr': False, 'bull_use_adx': False, 'bull_use_spike': False, 'bull_rsi_required': True, 'bear_strategy': 'breakout', 'bear_bb_std_mult': 1.7318815163532282, 'bear_rsi_os': 15, 'bear_rsi_ob': 93, 'bear_adx_thresh': 20.434816933948298, 'bear_atr_min_pct': 0.022415271498841233, 'bear_atr_max_pct': 0.1286312628334723, 'bear_tp_mult': 1.371384995690259, 'bear_tsl_mult': 0.4625019300962708, 'bear_time_stop': 45, 'bear_use_sma': False, 'bear_use_ema': True, 'bear_use_atr': False, 'bear_use_adx': True, 'bear_use_spike': False, 'bear_rsi_required': True, 'sideways_strategy': 'breakout', 'sideways_bb_std_mult': 1.1894017058776116, 'sideways_rsi_os': 26, 'sideways_rsi_ob': 65, 'sideways_adx_thresh': 28.447229640543213, 'sideways_atr_min_pct': 0.0026857012462563265, 'sideways_atr_max_pct': 0.01901258085161954, 'sideways_tp_mult': 1.440834471629851, 'sideways_tsl_mult': 0.3764487370805219, 'sideways_time_stop': 266, 'sideways_use_sma': True, 'sideways_use_ema': True, 'sideways_use_atr': False, 'sideways_use_adx': False, 'sideways_use_spike': False, 'sideways_rsi_required': False}.
[I 2025-08-31 10:14:21,995] Trial 431 finished with values: [-1000000000.0, 1000000000.0] and parameters: {'p_sma': 51, 'p_std': 16, 'p_atr': 29, 'p_adx': 10, 'rsi_period': 22, 'ema1': 16, 'ema2': 37, 'slip_atr_k': 0.20085994608755364, 'slip_spread_k': 0.4732158522752553, 'spread_hl_frac': 0.014146434838895851, 'bb_std_mult': 1.1408786942267302, 'rsi_os': 24, 'rsi_ob': 71, 'vol_spike': 0.138952917641423, 'adx_thresh': 29.24918520490297, 'atr_min_pct': 0.027096673476705777, 'atr_max_pct': 0.11900839994024315, 'tp_mult': 2.883598556261414, 'tsl_mult': 0.9533070503209536, 'strategy': 'mean_reversion', 'time_stop': 133, 'use_sma': False, 'use_atr': False, 'use_adx': True, 'use_ema': False, 'use_spike': False, 'rsi_required': True, 'edge_k': 1.9243955493082319, 'edge_cap': 0.649049908572363, 'bull_strategy': 'mean_reversion', 'bull_bb_std_mult': 1.2840586141353327, 'bull_rsi_os': 37, 'bull_rsi_ob': 69, 'bull_adx_thresh': 9.163866697893376, 'bull_atr_min_pct': 0.012667851438076532, 'bull_atr_max_pct': 0.12385179570510912, 'bull_tp_mult': 1.5044002278473971, 'bull_tsl_mult': 0.2727475244270715, 'bull_time_stop': 65, 'bull_use_sma': False, 'bull_use_ema': False, 'bull_use_atr': True, 'bull_use_adx': True, 'bull_use_spike': True, 'bull_rsi_required': True, 'bear_strategy': 'mean_reversion', 'bear_bb_std_mult': 2.9746025764212565, 'bear_rsi_os': 55, 'bear_rsi_ob': 80, 'bear_adx_thresh': 19.638643276664876, 'bear_atr_min_pct': 0.015707823243590845, 'bear_atr_max_pct': 0.024998182349366786, 'bear_tp_mult': 2.4786520900850846, 'bear_tsl_mult': 0.5705998665322465, 'bear_time_stop': 253, 'bear_use_sma': False, 'bear_use_ema': True, 'bear_use_atr': False, 'bear_use_adx': True, 'bear_use_spike': False, 'bear_rsi_required': True, 'sideways_strategy': 'breakout', 'sideways_bb_std_mult': 1.128152751743012, 'sideways_rsi_os': 22, 'sideways_rsi_ob': 59, 'sideways_adx_thresh': 28.869322970825813, 'sideways_atr_min_pct': 0.0022339786550010926, 'sideways_atr_max_pct': 0.07068801832844145, 'sideways_tp_mult': 1.4708900066421837, 'sideways_tsl_mult': 0.0005380684860354923, 'sideways_time_stop': 231, 'sideways_use_sma': True, 'sideways_use_ema': True, 'sideways_use_atr': True, 'sideways_use_adx': True, 'sideways_use_spike': False, 'sideways_rsi_required': False}.
[I 2025-08-31 10:14:22,464] Trial 432 finished with values: [-1000000000.0, 1000000000.0] and parameters: {'p_sma': 12, 'p_std': 16, 'p_atr': 29, 'p_adx': 16, 'rsi_period': 38, 'ema1': 30, 'ema2': 55, 'slip_atr_k': 0.12849477560174685, 'slip_spread_k': 0.4067690868484681, 'spread_hl_frac': 0.015101978386261004, 'bb_std_mult': 1.142020038927878, 'rsi_os': 22, 'rsi_ob': 49, 'vol_spike': 0.14038442492023623, 'adx_thresh': 15.945025064234628, 'atr_min_pct': 0.021749894605132554, 'atr_max_pct': 0.022439533020054546, 'tp_mult': 2.0676114143754565, 'tsl_mult': 0.7108613010152149, 'strategy': 'breakout', 'time_stop': 149, 'use_sma': True, 'use_atr': False, 'use_adx': False, 'use_ema': False, 'use_spike': False, 'rsi_required': True, 'edge_k': 1.0965163331079621, 'edge_cap': 0.3307420385250564, 'bull_strategy': 'breakout', 'bull_bb_std_mult': 0.5280039282083806, 'bull_rsi_os': 37, 'bull_rsi_ob': 67, 'bull_adx_thresh': 32.10586526899334, 'bull_atr_min_pct': 0.025392139779627367, 'bull_atr_max_pct': 0.11889179963810888, 'bull_tp_mult': 2.518012075057537, 'bull_tsl_mult': 0.3549575204234679, 'bull_time_stop': 250, 'bull_use_sma': False, 'bull_use_ema': False, 'bull_use_atr': False, 'bull_use_adx': True, 'bull_use_spike': True, 'bull_rsi_required': True, 'bear_strategy': 'mean_reversion', 'bear_bb_std_mult': 2.9642070401376666, 'bear_rsi_os': 54, 'bear_rsi_ob': 60, 'bear_adx_thresh': 22.067715738724985, 'bear_atr_min_pct': 0.02022758894799616, 'bear_atr_max_pct': 0.14707740471242203, 'bear_tp_mult': 2.729489332333621, 'bear_tsl_mult': 0.46778969698032247, 'bear_time_stop': 252, 'bear_use_sma': False, 'bear_use_ema': True, 'bear_use_atr': False, 'bear_use_adx': False, 'bear_use_spike': True, 'bear_rsi_required': True, 'sideways_strategy': 'breakout', 'sideways_bb_std_mult': 1.006799637323272, 'sideways_rsi_os': 26, 'sideways_rsi_ob': 68, 'sideways_adx_thresh': 22.675624215910315, 'sideways_atr_min_pct': 0.0027616398672872288, 'sideways_atr_max_pct': 0.027402877594202506, 'sideways_tp_mult': 2.5321963691509306, 'sideways_tsl_mult': 0.3794254480970926, 'sideways_time_stop': 262, 'sideways_use_sma': True, 'sideways_use_ema': True, 'sideways_use_atr': True, 'sideways_use_adx': True, 'sideways_use_spike': False, 'sideways_rsi_required': False}.
