[I 2025-08-31 10:50:44,236] Trial 701 finished with values: [-1000000000.0, 1000000000.0] and parameters: {'p_sma': 12, 'p_std': 50, 'p_atr': 13, 'p_adx': 8, 'rsi_period': 27, 'ema1': 17, 'ema2': 38, 'slip_atr_k': 0.03518762028989665, 'slip_spread_k': 0.6107664022540439, 'spread_hl_frac': 0.010060505886775518, 'bb_std_mult': 1.057642170486465, 'rsi_os': 16, 'rsi_ob': 79, 'vol_spike': 0.1643739682784539, 'adx_thresh': 22.900005974258086, 'atr_min_pct': 0.006588272358720677, 'atr_max_pct': 0.11378033193682818, 'tp_mult': 2.922692441471127, 'tsl_mult': 0.2828229105600642, 'strategy': 'breakout', 'time_stop': 52, 'use_sma': False, 'use_atr': False, 'use_adx': False, 'use_ema': True, 'use_spike': False, 'rsi_required': True, 'edge_k': 0.4528343769082669, 'edge_cap': 0.1525673367441285, 'bull_strategy': 'mean_reversion', 'bull_bb_std_mult': 2.608904439948767, 'bull_rsi_os': 24, 'bull_rsi_ob': 66, 'bull_adx_thresh': 31.36904686603378, 'bull_atr_min_pct': 0.008114403840679303, 'bull_atr_max_pct': 0.09555594678666013, 'bull_tp_mult': 2.2812652257049257, 'bull_tsl_mult': 0.9503536560749177, 'bull_time_stop': 73, 'bull_use_sma': True, 'bull_use_ema': True, 'bull_use_atr': False, 'bull_use_adx': False, 'bull_use_spike': False, 'bull_rsi_required': True, 'bear_strategy': 'breakout', 'bear_bb_std_mult': 2.3827374373091237, 'bear_rsi_os': 27, 'bear_rsi_ob': 69, 'bear_adx_thresh': 12.54138938701293, 'bear_atr_min_pct': 0.029824818573752607, 'bear_atr_max_pct': 0.07782027155699717, 'bear_tp_mult': 1.1233389962357776, 'bear_tsl_mult': 0.9984753719293613, 'bear_time_stop': 266, 'bear_use_sma': False, 'bear_use_ema': True, 'bear_use_atr': False, 'bear_use_adx': True, 'bear_use_spike': True, 'bear_rsi_required': True, 'sideways_strategy': 'breakout', 'sideways_bb_std_mult': 3.277758685886773, 'sideways_rsi_os': 41, 'sideways_rsi_ob': 76, 'sideways_adx_thresh': 5.947760018867747, 'sideways_atr_min_pct': 0.014327304349321585, 'sideways_atr_max_pct': 0.10323139717789392, 'sideways_tp_mult': 2.9523832874953606, 'sideways_tsl_mult': 0.08480554466536606, 'sideways_time_stop': 276, 'sideways_use_sma': True, 'sideways_use_ema': True, 'sideways_use_atr': False, 'sideways_use_adx': False, 'sideways_use_spike': True, 'sideways_rsi_required': False}.
[I 2025-08-31 10:50:44,419] Trial 700 finished with values: [-1000000000.0, 1000000000.0] and parameters: {'p_sma': 10, 'p_std': 48, 'p_atr': 24, 'p_adx': 8, 'rsi_period': 27, 'ema1': 17, 'ema2': 37, 'slip_atr_k': 0.18343574033196408, 'slip_spread_k': 0.11375636626702844, 'spread_hl_frac': 0.03657329600685415, 'bb_std_mult': 2.816819858152062, 'rsi_os': 46, 'rsi_ob': 94, 'vol_spike': 0.2754676321205958, 'adx_thresh': 25.45425788205982, 'atr_min_pct': 0.004341975762000324, 'atr_max_pct': 0.12222443518616903, 'tp_mult': 2.9264530938460376, 'tsl_mult': 0.05025876126329132, 'strategy': 'breakout', 'time_stop': 137, 'use_sma': False, 'use_atr': False, 'use_adx': False, 'use_ema': True, 'use_spike': True, 'rsi_required': True, 'edge_k': 0.45348757707550547, 'edge_cap': 0.8538132020738272, 'bull_strategy': 'mean_reversion', 'bull_bb_std_mult': 0.8959030023972665, 'bull_rsi_os': 24, 'bull_rsi_ob': 81, 'bull_adx_thresh': 29.510643539155257, 'bull_atr_min_pct': 0.012518735796253892, 'bull_atr_max_pct': 0.1493879738001816, 'bull_tp_mult': 2.846583829041841, 'bull_tsl_mult': 0.9558764346715373, 'bull_time_stop': 69, 'bull_use_sma': True, 'bull_use_ema': True, 'bull_use_atr': False, 'bull_use_adx': False, 'bull_use_spike': False, 'bull_rsi_required': True, 'bear_strategy': 'breakout', 'bear_bb_std_mult': 2.886950350644843, 'bear_rsi_os': 27, 'bear_rsi_ob': 69, 'bear_adx_thresh': 5.631264834412844, 'bear_atr_min_pct': 0.029964143631711633, 'bear_atr_max_pct': 0.10244301139704168, 'bear_tp_mult': 2.8935713247685713, 'bear_tsl_mult': 0.41572998195688166, 'bear_time_stop': 267, 'bear_use_sma': False, 'bear_use_ema': True, 'bear_use_atr': True, 'bear_use_adx': True, 'bear_use_spike': True, 'bear_rsi_required': True, 'sideways_strategy': 'breakout', 'sideways_bb_std_mult': 2.5532708709905765, 'sideways_rsi_os': 25, 'sideways_rsi_ob': 93, 'sideways_adx_thresh': 21.509989725915386, 'sideways_atr_min_pct': 0.0012908936709234672, 'sideways_atr_max_pct': 0.0919778688655056, 'sideways_tp_mult': 2.9636451234063115, 'sideways_tsl_mult': 0.08419435564979032, 'sideways_time_stop': 78, 'sideways_use_sma': False, 'sideways_use_ema': True, 'sideways_use_atr': False, 'sideways_use_adx': False, 'sideways_use_spike': True, 'sideways_rsi_required': False}.
[I 2025-08-31 10:51:16,935] Trial 705 finished with values: [-1000000000.0, 1000000000.0] and parameters: {'p_sma': 11, 'p_std': 49, 'p_atr': 11, 'p_adx': 13, 'rsi_period': 81, 'ema1': 17, 'ema2': 33, 'slip_atr_k': 0.17200106665320986, 'slip_spread_k': 0.12796209712975756, 'spread_hl_frac': 0.009646437021280036, 'bb_std_mult': 1.054951384370622, 'rsi_os': 17, 'rsi_ob': 84, 'vol_spike': 0.27659030017255326, 'adx_thresh': 22.303798788018533, 'atr_min_pct': 0.006646368125005924, 'atr_max_pct': 0.12850772391548634, 'tp_mult': 2.92206435940749, 'tsl_mult': 0.447042233357604, 'strategy': 'mean_reversion', 'time_stop': 140, 'use_sma': False, 'use_atr': False, 'use_adx': True, 'use_ema': True, 'use_spike': False, 'rsi_required': True, 'edge_k': 1.7929737194903683, 'edge_cap': 0.3809914426218231, 'bull_strategy': 'mean_reversion', 'bull_bb_std_mult': 3.422695384945518, 'bull_rsi_os': 26, 'bull_rsi_ob': 87, 'bull_adx_thresh': 31.420450812514787, 'bull_atr_min_pct': 0.00801396371716521, 'bull_atr_max_pct': 0.0718993461264953, 'bull_tp_mult': 1.961822646203568, 'bull_tsl_mult': 0.983091442595897, 'bull_time_stop': 81, 'bull_use_sma': True, 'bull_use_ema': False, 'bull_use_atr': False, 'bull_use_adx': True, 'bull_use_spike': False, 'bull_rsi_required': True, 'bear_strategy': 'breakout', 'bear_bb_std_mult': 1.5208252507882158, 'bear_rsi_os': 37, 'bear_rsi_ob': 61, 'bear_adx_thresh': 8.189781827484907, 'bear_atr_min_pct': 0.00646927677467865, 'bear_atr_max_pct': 0.10466186187153195, 'bear_tp_mult': 2.0579287527528827, 'bear_tsl_mult': 0.1430452646383369, 'bear_time_stop': 256, 'bear_use_sma': True, 'bear_use_ema': True, 'bear_use_atr': False, 'bear_use_adx': False, 'bear_use_spike': True, 'bear_rsi_required': True, 'sideways_strategy': 'breakout', 'sideways_bb_std_mult': 0.8888000008104242, 'sideways_rsi_os': 23, 'sideways_rsi_ob': 94, 'sideways_adx_thresh': 6.202963209871843, 'sideways_atr_min_pct': 0.014476618742245508, 'sideways_atr_max_pct': 0.09165898352965977, 'sideways_tp_mult': 2.91889819649237, 'sideways_tsl_mult': 0.06998693711549821, 'sideways_time_stop': 205, 'sideways_use_sma': True, 'sideways_use_ema': True, 'sideways_use_atr': False, 'sideways_use_adx': True, 'sideways_use_spike': True, 'sideways_rsi_required': False}.
[I 2025-08-31 10:51:17,694] Trial 707 finished with values: [-1000000000.0, 1000000000.0] and parameters: {'p_sma': 30, 'p_std': 47, 'p_atr': 30, 'p_adx': 10, 'rsi_period': 22, 'ema1': 14, 'ema2': 44, 'slip_atr_k': 0.1762833632333722, 'slip_spread_k': 0.08737782464783439, 'spread_hl_frac': 0.01097629243229836, 'bb_std_mult': 2.2974613583994947, 'rsi_os': 5, 'rsi_ob': 82, 'vol_spike': 0.2838551535310992, 'adx_thresh': 27.25221786629497, 'atr_min_pct': 0.011556730472226337, 'atr_max_pct': 0.11863719511896571, 'tp_mult': 2.8656081191817218, 'tsl_mult': 0.44750315203740904, 'strategy': 'mean_reversion', 'time_stop': 141, 'use_sma': False, 'use_atr': False, 'use_adx': True, 'use_ema': True, 'use_spike': False, 'rsi_required': False, 'edge_k': 0.5317910265759104, 'edge_cap': 0.050961134897324886, 'bull_strategy': 'mean_reversion', 'bull_bb_std_mult': 1.1699864150234425, 'bull_rsi_os': 26, 'bull_rsi_ob': 68, 'bull_adx_thresh': 13.229510329728456, 'bull_atr_min_pct': 0.0158542588966908, 'bull_atr_max_pct': 0.0640486170037062, 'bull_tp_mult': 2.442853186675525, 'bull_tsl_mult': 0.9696080193275924, 'bull_time_stop': 107, 'bull_use_sma': True, 'bull_use_ema': False, 'bull_use_atr': False, 'bull_use_adx': True, 'bull_use_spike': True, 'bull_rsi_required': True, 'bear_strategy': 'breakout', 'bear_bb_std_mult': 2.9977004605442166, 'bear_rsi_os': 29, 'bear_rsi_ob': 62, 'bear_adx_thresh': 19.789934143753168, 'bear_atr_min_pct': 0.0067108138903954895, 'bear_atr_max_pct': 0.11969137224167219, 'bear_tp_mult': 1.7662594676076617, 'bear_tsl_mult': 0.4686275024055622, 'bear_time_stop': 208, 'bear_use_sma': True, 'bear_use_ema': False, 'bear_use_atr': False, 'bear_use_adx': False, 'bear_use_spike': True, 'bear_rsi_required': True, 'sideways_strategy': 'breakout', 'sideways_bb_std_mult': 0.8725059173731697, 'sideways_rsi_os': 23, 'sideways_rsi_ob': 95, 'sideways_adx_thresh': 28.87171971512702, 'sideways_atr_min_pct': 0.011315189833565754, 'sideways_atr_max_pct': 0.09678603704382333, 'sideways_tp_mult': 2.31700495200519, 'sideways_tsl_mult': 0.04013306686190373, 'sideways_time_stop': 223, 'sideways_use_sma': True, 'sideways_use_ema': True, 'sideways_use_atr': True, 'sideways_use_adx': True, 'sideways_use_spike': True, 'sideways_rsi_required': False}.
[I 2025-08-31 10:51:17,831] Trial 704 finished with values: [-1000000000.0, 1000000000.0] and parameters: {'p_sma': 12, 'p_std': 34, 'p_atr': 12, 'p_adx': 8, 'rsi_period': 64, 'ema1': 17, 'ema2': 37, 'slip_atr_k': 0.17335969618949645, 'slip_spread_k': 0.08764094553555576, 'spread_hl_frac': 0.010048302655323246, 'bb_std_mult': 1.0569443463314407, 'rsi_os': 50, 'rsi_ob': 79, 'vol_spike': 0.276719714239387, 'adx_thresh': 27.42442293201978, 'atr_min_pct': 0.011675095833400852, 'atr_max_pct': 0.11461517117549477, 'tp_mult': 2.9618723833706495, 'tsl_mult': 0.0686947577820395, 'strategy': 'breakout', 'time_stop': 167, 'use_sma': False, 'use_atr': False, 'use_adx': False, 'use_ema': True, 'use_spike': False, 'rsi_required': False, 'edge_k': 1.039125055740985, 'edge_cap': 0.1417873646320909, 'bull_strategy': 'mean_reversion', 'bull_bb_std_mult': 3.046200004204663, 'bull_rsi_os': 28, 'bull_rsi_ob': 62, 'bull_adx_thresh': 31.212201864955205, 'bull_atr_min_pct': 0.008261604077950424, 'bull_atr_max_pct': 0.047031029900928716, 'bull_tp_mult': 2.2489999243011414, 'bull_tsl_mult': 0.9732895187613404, 'bull_time_stop': 70, 'bull_use_sma': True, 'bull_use_ema': True, 'bull_use_atr': False, 'bull_use_adx': False, 'bull_use_spike': True, 'bull_rsi_required': True, 'bear_strategy': 'breakout', 'bear_bb_std_mult': 2.8304443485347233, 'bear_rsi_os': 26, 'bear_rsi_ob': 76, 'bear_adx_thresh': 19.946136684027024, 'bear_atr_min_pct': 0.029998184434544314, 'bear_atr_max_pct': 0.07370021608871068, 'bear_tp_mult': 1.753752313950022, 'bear_tsl_mult': 0.5055462980645394, 'bear_time_stop': 259, 'bear_use_sma': False, 'bear_use_ema': True, 'bear_use_atr': False, 'bear_use_adx': True, 'bear_use_spike': True, 'bear_rsi_required': True, 'sideways_strategy': 'breakout', 'sideways_bb_std_mult': 1.5854995308996336, 'sideways_rsi_os': 23, 'sideways_rsi_ob': 53, 'sideways_adx_thresh': 6.012145291274598, 'sideways_atr_min_pct': 0.011602020566601388, 'sideways_atr_max_pct': 0.10190492875848482, 'sideways_tp_mult': 2.5445761891714005, 'sideways_tsl_mult': 0.07308266269914436, 'sideways_time_stop': 124, 'sideways_use_sma': True, 'sideways_use_ema': True, 'sideways_use_atr': True, 'sideways_use_adx': True, 'sideways_use_spike': True, 'sideways_rsi_required': False}.
[I 2025-08-31 10:51:17,944] Trial 706 finished with values: [-1000000000.0, 1000000000.0] and parameters: {'p_sma': 11, 'p_std': 47, 'p_atr': 30, 'p_adx': 10, 'rsi_period': 22, 'ema1': 26, 'ema2': 37, 'slip_atr_k': 0.1716430165068699, 'slip_spread_k': 0.12993284938031943, 'spread_hl_frac': 0.01114134339599374, 'bb_std_mult': 0.6857660891856909, 'rsi_os': 39, 'rsi_ob': 82, 'vol_spike': 0.1820830506972012, 'adx_thresh': 26.90015852375979, 'atr_min_pct': 0.029258570751573502, 'atr_max_pct': 0.12830171336967522, 'tp_mult': 2.8512988799018886, 'tsl_mult': 0.4445789137345561, 'strategy': 'mean_reversion', 'time_stop': 142, 'use_sma': False, 'use_atr': False, 'use_adx': True, 'use_ema': True, 'use_spike': False, 'rsi_required': False, 'edge_k': 0.5256077677608187, 'edge_cap': 0.40271452855185885, 'bull_strategy': 'mean_reversion', 'bull_bb_std_mult': 3.0433493395152156, 'bull_rsi_os': 27, 'bull_rsi_ob': 82, 'bull_adx_thresh': 13.409410403571083, 'bull_atr_min_pct': 0.007356038324295772, 'bull_atr_max_pct': 0.03007189564825089, 'bull_tp_mult': 2.247972464851521, 'bull_tsl_mult': 0.9769136480939381, 'bull_time_stop': 107, 'bull_use_sma': True, 'bull_use_ema': False, 'bull_use_atr': False, 'bull_use_adx': True, 'bull_use_spike': True, 'bull_rsi_required': True, 'bear_strategy': 'breakout', 'bear_bb_std_mult': 1.0780968525177683, 'bear_rsi_os': 31, 'bear_rsi_ob': 82, 'bear_adx_thresh': 20.19930028811258, 'bear_atr_min_pct': 0.012234763661935209, 'bear_atr_max_pct': 0.11963661812335985, 'bear_tp_mult': 2.8869786079440196, 'bear_tsl_mult': 0.5022455069370224, 'bear_time_stop': 109, 'bear_use_sma': True, 'bear_use_ema': False, 'bear_use_atr': False, 'bear_use_adx': False, 'bear_use_spike': True, 'bear_rsi_required': True, 'sideways_strategy': 'breakout', 'sideways_bb_std_mult': 0.8653159708358351, 'sideways_rsi_os': 23, 'sideways_rsi_ob': 94, 'sideways_adx_thresh': 28.709671410211648, 'sideways_atr_min_pct': 0.0019209867099109989, 'sideways_atr_max_pct': 0.09796721622973328, 'sideways_tp_mult': 1.957087576780415, 'sideways_tsl_mult': 0.06368102484785697, 'sideways_time_stop': 206, 'sideways_use_sma': True, 'sideways_use_ema': True, 'sideways_use_atr': True, 'sideways_use_adx': True, 'sideways_use_spike': True, 'sideways_rsi_required': False}.
[I 2025-08-31 10:51:49,118] Trial 710 finished with values: [-1000000000.0, 1000000000.0] and parameters: {'p_sma': 18, 'p_std': 47, 'p_atr': 16, 'p_adx': 24, 'rsi_period': 21, 'ema1': 19, 'ema2': 39, 'slip_atr_k': 0.10893916989370744, 'slip_spread_k': 0.5353178189650684, 'spread_hl_frac': 0.01779153187393586, 'bb_std_mult': 1.858003575582348, 'rsi_os': 32, 'rsi_ob': 82, 'vol_spike': 0.21060886689698682, 'adx_thresh': 14.522712801545387, 'atr_min_pct': 0.02930755512815749, 'atr_max_pct': 0.12459498334207822, 'tp_mult': 1.3264979362573008, 'tsl_mult': 0.15603120505225404, 'strategy': 'breakout', 'time_stop': 231, 'use_sma': True, 'use_atr': True, 'use_adx': False, 'use_ema': True, 'use_spike': False, 'rsi_required': True, 'edge_k': 1.9666151916012526, 'edge_cap': 0.20476367112069088, 'bull_strategy': 'breakout', 'bull_bb_std_mult': 0.9665325795225017, 'bull_rsi_os': 22, 'bull_rsi_ob': 89, 'bull_adx_thresh': 24.039601939770044, 'bull_atr_min_pct': 0.007274048181597241, 'bull_atr_max_pct': 0.08826916119888452, 'bull_tp_mult': 1.3009614542095118, 'bull_tsl_mult': 0.8344705946719996, 'bull_time_stop': 203, 'bull_use_sma': False, 'bull_use_ema': False, 'bull_use_atr': True, 'bull_use_adx': False, 'bull_use_spike': False, 'bull_rsi_required': False, 'bear_strategy': 'mean_reversion', 'bear_bb_std_mult': 0.5570799167897746, 'bear_rsi_os': 31, 'bear_rsi_ob': 95, 'bear_adx_thresh': 34.16014007302295, 'bear_atr_min_pct': 0.01124352928733154, 'bear_atr_max_pct': 0.0936631952075892, 'bear_tp_mult': 2.0662898349853602, 'bear_tsl_mult': 0.7901937023836829, 'bear_time_stop': 192, 'bear_use_sma': False, 'bear_use_ema': False, 'bear_use_atr': False, 'bear_use_adx': True, 'bear_use_spike': True, 'bear_rsi_required': False, 'sideways_strategy': 'mean_reversion', 'sideways_bb_std_mult': 2.0673071036110517, 'sideways_rsi_os': 27, 'sideways_rsi_ob': 75, 'sideways_adx_thresh': 30.012661882021114, 'sideways_atr_min_pct': 0.0018884433962062085, 'sideways_atr_max_pct': 0.04733779022659098, 'sideways_tp_mult': 2.9116401675391024, 'sideways_tsl_mult': 0.05541013395533257, 'sideways_time_stop': 233, 'sideways_use_sma': True, 'sideways_use_ema': False, 'sideways_use_atr': False, 'sideways_use_adx': False, 'sideways_use_spike': True, 'sideways_rsi_required': True}.
[I 2025-08-31 10:51:49,662] Trial 709 finished with values: [-1000000000.0, 1000000000.0] and parameters: {'p_sma': 35, 'p_std': 58, 'p_atr': 17, 'p_adx': 16, 'rsi_period': 64, 'ema1': 30, 'ema2': 37, 'slip_atr_k': 0.189662219115933, 'slip_spread_k': 0.977549610151231, 'spread_hl_frac': 0.017668633372336488, 'bb_std_mult': 2.6117089709570593, 'rsi_os': 34, 'rsi_ob': 86, 'vol_spike': 0.21003351451178884, 'adx_thresh': 10.737676655082126, 'atr_min_pct': 0.01170986281880691, 'atr_max_pct': 0.08724675458638004, 'tp_mult': 1.6310193811669134, 'tsl_mult': 0.03617163479673516, 'strategy': 'breakout', 'time_stop': 132, 'use_sma': True, 'use_atr': False, 'use_adx': False, 'use_ema': True, 'use_spike': False, 'rsi_required': True, 'edge_k': 1.9589128807761254, 'edge_cap': 0.4911495776921761, 'bull_strategy': 'breakout', 'bull_bb_std_mult': 1.3508146272175616, 'bull_rsi_os': 21, 'bull_rsi_ob': 62, 'bull_adx_thresh': 30.358543310801167, 'bull_atr_min_pct': 0.00724312298674359, 'bull_atr_max_pct': 0.03401094048956069, 'bull_tp_mult': 2.26329824791313, 'bull_tsl_mult': 0.7376633133559607, 'bull_time_stop': 173, 'bull_use_sma': False, 'bull_use_ema': False, 'bull_use_atr': False, 'bull_use_adx': False, 'bull_use_spike': False, 'bull_rsi_required': True, 'bear_strategy': 'mean_reversion', 'bear_bb_std_mult': 1.8780971728172169, 'bear_rsi_os': 43, 'bear_rsi_ob': 82, 'bear_adx_thresh': 21.438533910790166, 'bear_atr_min_pct': 0.013545616827094662, 'bear_atr_max_pct': 0.09545294797556973, 'bear_tp_mult': 2.1536682018576214, 'bear_tsl_mult': 0.5027666038247957, 'bear_time_stop': 300, 'bear_use_sma': False, 'bear_use_ema': True, 'bear_use_atr': False, 'bear_use_adx': True, 'bear_use_spike': True, 'bear_rsi_required': True, 'sideways_strategy': 'breakout', 'sideways_bb_std_mult': 1.0160497241490727, 'sideways_rsi_os': 14, 'sideways_rsi_ob': 94, 'sideways_adx_thresh': 28.311594037839928, 'sideways_atr_min_pct': 0.02023422032571244, 'sideways_atr_max_pct': 0.10968743391043348, 'sideways_tp_mult': 2.037462083421221, 'sideways_tsl_mult': 0.06023879649424481, 'sideways_time_stop': 233, 'sideways_use_sma': True, 'sideways_use_ema': False, 'sideways_use_atr': False, 'sideways_use_adx': False, 'sideways_use_spike': True, 'sideways_rsi_required': False}.
[I 2025-08-31 10:51:49,865] Trial 711 finished with values: [-1000000000.0, 1000000000.0] and parameters: {'p_sma': 13, 'p_std': 51, 'p_atr': 28, 'p_adx': 24, 'rsi_period': 77, 'ema1': 19, 'ema2': 12, 'slip_atr_k': 0.19038126037943348, 'slip_spread_k': 0.15371745293770395, 'spread_hl_frac': 0.01284591476339795, 'bb_std_mult': 1.1941327449815342, 'rsi_os': 32, 'rsi_ob': 87, 'vol_spike': 0.05835941265203039, 'adx_thresh': 21.052842532159325, 'atr_min_pct': 0.010432675963195946, 'atr_max_pct': 0.10202155342929518, 'tp_mult': 2.8259765220791513, 'tsl_mult': 0.8964912686507578, 'strategy': 'breakout', 'time_stop': 131, 'use_sma': True, 'use_atr': True, 'use_adx': False, 'use_ema': True, 'use_spike': False, 'rsi_required': True, 'edge_k': 1.9722075218837416, 'edge_cap': 0.489719007142474, 'bull_strategy': 'breakout', 'bull_bb_std_mult': 2.864046983693134, 'bull_rsi_os': 6, 'bull_rsi_ob': 90, 'bull_adx_thresh': 18.04746062073666, 'bull_atr_min_pct': 0.011523975592415173, 'bull_atr_max_pct': 0.03485330283129253, 'bull_tp_mult': 2.4079352182463265, 'bull_tsl_mult': 0.8658000349882464, 'bull_time_stop': 84, 'bull_use_sma': False, 'bull_use_ema': False, 'bull_use_atr': True, 'bull_use_adx': False, 'bull_use_spike': False, 'bull_rsi_required': False, 'bear_strategy': 'mean_reversion', 'bear_bb_std_mult': 1.877907134131867, 'bear_rsi_os': 29, 'bear_rsi_ob': 95, 'bear_adx_thresh': 21.440524468628144, 'bear_atr_min_pct': 0.007489589152319326, 'bear_atr_max_pct': 0.09332402391429304, 'bear_tp_mult': 1.9456854816015423, 'bear_tsl_mult': 0.8013477338402974, 'bear_time_stop': 279, 'bear_use_sma': False, 'bear_use_ema': True, 'bear_use_atr': False, 'bear_use_adx': True, 'bear_use_spike': True, 'bear_rsi_required': False, 'sideways_strategy': 'mean_reversion', 'sideways_bb_std_mult': 1.0228646445554967, 'sideways_rsi_os': 27, 'sideways_rsi_ob': 48, 'sideways_adx_thresh': 31.08834764136156, 'sideways_atr_min_pct': 0.01999669462530042, 'sideways_atr_max_pct': 0.04980556347639083, 'sideways_tp_mult': 1.7471977289249916, 'sideways_tsl_mult': 0.781460525619849, 'sideways_time_stop': 216, 'sideways_use_sma': True, 'sideways_use_ema': False, 'sideways_use_atr': False, 'sideways_use_adx': False, 'sideways_use_spike': True, 'sideways_rsi_required': True}.
