[I 2025-08-31 09:57:58,926] Trial 285 finished with values: [-1000000000.0, 1000000000.0] and parameters: {'p_sma': 21, 'p_std': 52, 'p_atr': 30, 'p_adx': 30, 'rsi_period': 7, 'ema1': 19, 'ema2': 39, 'slip_atr_k': 0.15640494574473657, 'slip_spread_k': 0.3691153190563684, 'spread_hl_frac': 0.012545663572226109, 'bb_std_mult': 1.0035310370658088, 'rsi_os': 52, 'rsi_ob': 49, 'vol_spike': 0.19976357244253906, 'adx_thresh': 5.665115020502085, 'atr_min_pct': 0.012297542603840469, 'atr_max_pct': 0.015345277088524886, 'tp_mult': 2.99837046146595, 'tsl_mult': 0.6244389983743166, 'strategy': 'breakout', 'time_stop': 41, 'use_sma': False, 'use_atr': False, 'use_adx': False, 'use_ema': False, 'use_spike': False, 'rsi_required': True, 'edge_k': 1.7385652787948966, 'edge_cap': 0.14341432467256976, 'bull_strategy': 'mean_reversion', 'bull_bb_std_mult': 1.1854768778060272, 'bull_rsi_os': 13, 'bull_rsi_ob': 66, 'bull_adx_thresh': 25.656489731377278, 'bull_atr_min_pct': 0.012482586392308485, 'bull_atr_max_pct': 0.01840523200749942, 'bull_tp_mult': 2.4346495038078246, 'bull_tsl_mult': 0.5745549238385077, 'bull_time_stop': 223, 'bull_use_sma': False, 'bull_use_ema': False, 'bull_use_atr': False, 'bull_use_adx': True, 'bull_use_spike': False, 'bull_rsi_required': True, 'bear_strategy': 'mean_reversion', 'bear_bb_std_mult': 1.705141678277482, 'bear_rsi_os': 54, 'bear_rsi_ob': 83, 'bear_adx_thresh': 21.787175684745378, 'bear_atr_min_pct': 0.029999744032279035, 'bear_atr_max_pct': 0.11476877472010052, 'bear_tp_mult': 2.1085554809127554, 'bear_tsl_mult': 0.7647119421504216, 'bear_time_stop': 277, 'bear_use_sma': False, 'bear_use_ema': True, 'bear_use_atr': False, 'bear_use_adx': True, 'bear_use_spike': False, 'bear_rsi_required': True, 'sideways_strategy': 'breakout', 'sideways_bb_std_mult': 1.145888103847015, 'sideways_rsi_os': 37, 'sideways_rsi_ob': 62, 'sideways_adx_thresh': 34.182689672781216, 'sideways_atr_min_pct': 0.024802673168853415, 'sideways_atr_max_pct': 0.1203790249918106, 'sideways_tp_mult': 2.767586519792311, 'sideways_tsl_mult': 0.18006432108797554, 'sideways_time_stop': 227, 'sideways_use_sma': True, 'sideways_use_ema': True, 'sideways_use_atr': False, 'sideways_use_adx': False, 'sideways_use_spike': False, 'sideways_rsi_required': False}.
[I 2025-08-31 09:58:32,282] Trial 292 finished with values: [-0.0212633182578138, 0.02133036849858526] and parameters: {'p_sma': 36, 'p_std': 35, 'p_atr': 28, 'p_adx': 14, 'rsi_period': 23, 'ema1': 13, 'ema2': 32, 'slip_atr_k': 0.16755675318874252, 'slip_spread_k': 0.9483218005079463, 'spread_hl_frac': 0.016480543514729044, 'bb_std_mult': 1.1047679672199142, 'rsi_os': 7, 'rsi_ob': 88, 'vol_spike': 0.12032605999249417, 'adx_thresh': 5.011793966047456, 'atr_min_pct': 0.017564558518400775, 'atr_max_pct': 0.1288934623602065, 'tp_mult': 2.043334792312635, 'tsl_mult': 0.016144688791712103, 'strategy': 'breakout', 'time_stop': 146, 'use_sma': False, 'use_atr': False, 'use_adx': True, 'use_ema': False, 'use_spike': False, 'rsi_required': True, 'edge_k': 1.8721078140526755, 'edge_cap': 0.4503344599626759, 'bull_strategy': 'mean_reversion', 'bull_bb_std_mult': 3.0831889308065277, 'bull_rsi_os': 31, 'bull_rsi_ob': 63, 'bull_adx_thresh': 15.50105654733498, 'bull_atr_min_pct': 0.017711842027123233, 'bull_atr_max_pct': 0.08181946876841537, 'bull_tp_mult': 1.516967357518128, 'bull_tsl_mult': 0.6177677590591105, 'bull_time_stop': 237, 'bull_use_sma': True, 'bull_use_ema': False, 'bull_use_atr': False, 'bull_use_adx': False, 'bull_use_spike': False, 'bull_rsi_required': True, 'bear_strategy': 'breakout', 'bear_bb_std_mult': 2.9351945791290244, 'bear_rsi_os': 23, 'bear_rsi_ob': 92, 'bear_adx_thresh': 20.333402455431397, 'bear_atr_min_pct': 0.008535847047038855, 'bear_atr_max_pct': 0.14067629299125975, 'bear_tp_mult': 2.6457778287398015, 'bear_tsl_mult': 0.535839160437232, 'bear_time_stop': 259, 'bear_use_sma': False, 'bear_use_ema': True, 'bear_use_atr': False, 'bear_use_adx': True, 'bear_use_spike': False, 'bear_rsi_required': True, 'sideways_strategy': 'breakout', 'sideways_bb_std_mult': 1.2387348241088314, 'sideways_rsi_os': 40, 'sideways_rsi_ob': 67, 'sideways_adx_thresh': 31.96421732534136, 'sideways_atr_min_pct': 0.002565911122135979, 'sideways_atr_max_pct': 0.02185605598021459, 'sideways_tp_mult': 1.5232139895297934, 'sideways_tsl_mult': 0.734101204334139, 'sideways_time_stop': 96, 'sideways_use_sma': True, 'sideways_use_ema': True, 'sideways_use_atr': False, 'sideways_use_adx': False, 'sideways_use_spike': False, 'sideways_rsi_required': False}.
[I 2025-08-31 09:58:32,381] Trial 291 finished with values: [-1000000000.0, 1000000000.0] and parameters: {'p_sma': 47, 'p_std': 60, 'p_atr': 28, 'p_adx': 22, 'rsi_period': 23, 'ema1': 20, 'ema2': 38, 'slip_atr_k': 0.2175039406665974, 'slip_spread_k': 0.47253308137634453, 'spread_hl_frac': 0.0168445537088923, 'bb_std_mult': 0.8748918469581665, 'rsi_os': 37, 'rsi_ob': 48, 'vol_spike': 0.11920866629820911, 'adx_thresh': 9.191368658219215, 'atr_min_pct': 0.02816791369098844, 'atr_max_pct': 0.12960493421561095, 'tp_mult': 1.9638163627863061, 'tsl_mult': 0.056002497976375534, 'strategy': 'breakout', 'time_stop': 144, 'use_sma': False, 'use_atr': False, 'use_adx': True, 'use_ema': False, 'use_spike': False, 'rsi_required': True, 'edge_k': 0.4034322905866172, 'edge_cap': 0.45371962235889607, 'bull_strategy': 'mean_reversion', 'bull_bb_std_mult': 1.399508705591115, 'bull_rsi_os': 31, 'bull_rsi_ob': 93, 'bull_adx_thresh': 32.33276060961241, 'bull_atr_min_pct': 0.02162675055354132, 'bull_atr_max_pct': 0.12299538823884891, 'bull_tp_mult': 1.22089015022277, 'bull_tsl_mult': 0.6260869937213458, 'bull_time_stop': 262, 'bull_use_sma': True, 'bull_use_ema': False, 'bull_use_atr': False, 'bull_use_adx': False, 'bull_use_spike': False, 'bull_rsi_required': True, 'bear_strategy': 'breakout', 'bear_bb_std_mult': 2.9357536297191658, 'bear_rsi_os': 11, 'bear_rsi_ob': 79, 'bear_adx_thresh': 19.01955734320812, 'bear_atr_min_pct': 0.008421643297385116, 'bear_atr_max_pct': 0.1420082038018076, 'bear_tp_mult': 2.660042757775195, 'bear_tsl_mult': 0.5364325147036757, 'bear_time_stop': 258, 'bear_use_sma': False, 'bear_use_ema': True, 'bear_use_atr': False, 'bear_use_adx': True, 'bear_use_spike': False, 'bear_rsi_required': True, 'sideways_strategy': 'breakout', 'sideways_bb_std_mult': 1.8730773373593608, 'sideways_rsi_os': 22, 'sideways_rsi_ob': 67, 'sideways_adx_thresh': 32.17630906509565, 'sideways_atr_min_pct': 0.0025786392530209156, 'sideways_atr_max_pct': 0.03221099818668157, 'sideways_tp_mult': 1.5228522713820314, 'sideways_tsl_mult': 0.05933763848801549, 'sideways_time_stop': 92, 'sideways_use_sma': True, 'sideways_use_ema': True, 'sideways_use_atr': False, 'sideways_use_adx': False, 'sideways_use_spike': False, 'sideways_rsi_required': False}.
[I 2025-08-31 09:58:32,572] Trial 289 finished with values: [-1000000000.0, 1000000000.0] and parameters: {'p_sma': 45, 'p_std': 6, 'p_atr': 28, 'p_adx': 22, 'rsi_period': 73, 'ema1': 19, 'ema2': 42, 'slip_atr_k': 0.2182463209221721, 'slip_spread_k': 0.667536302582397, 'spread_hl_frac': 0.012533495804685515, 'bb_std_mult': 1.115992208422171, 'rsi_os': 52, 'rsi_ob': 74, 'vol_spike': 0.11503953547252882, 'adx_thresh': 7.766203628111572, 'atr_min_pct': 0.022086024511293337, 'atr_max_pct': 0.13322295243970156, 'tp_mult': 1.4082074148974049, 'tsl_mult': 0.057184575438711055, 'strategy': 'breakout', 'time_stop': 40, 'use_sma': False, 'use_atr': False, 'use_adx': True, 'use_ema': False, 'use_spike': False, 'rsi_required': False, 'edge_k': 1.798713158605331, 'edge_cap': 0.23573521335455389, 'bull_strategy': 'mean_reversion', 'bull_bb_std_mult': 3.02024815046767, 'bull_rsi_os': 37, 'bull_rsi_ob': 52, 'bull_adx_thresh': 28.98299831413433, 'bull_atr_min_pct': 0.025055557240058784, 'bull_atr_max_pct': 0.13930360133116743, 'bull_tp_mult': 1.5226041102101069, 'bull_tsl_mult': 0.6066500177500046, 'bull_time_stop': 286, 'bull_use_sma': False, 'bull_use_ema': False, 'bull_use_atr': False, 'bull_use_adx': False, 'bull_use_spike': False, 'bull_rsi_required': True, 'bear_strategy': 'mean_reversion', 'bear_bb_std_mult': 2.7026666639392456, 'bear_rsi_os': 7, 'bear_rsi_ob': 79, 'bear_adx_thresh': 21.98265738657333, 'bear_atr_min_pct': 0.02121535911108318, 'bear_atr_max_pct': 0.13938471480760214, 'bear_tp_mult': 2.6619082766997044, 'bear_tsl_mult': 0.6692602671645489, 'bear_time_stop': 239, 'bear_use_sma': False, 'bear_use_ema': True, 'bear_use_atr': False, 'bear_use_adx': True, 'bear_use_spike': False, 'bear_rsi_required': True, 'sideways_strategy': 'breakout', 'sideways_bb_std_mult': 1.1325097802798032, 'sideways_rsi_os': 22, 'sideways_rsi_ob': 63, 'sideways_adx_thresh': 11.410441531091244, 'sideways_atr_min_pct': 0.027760779834898195, 'sideways_atr_max_pct': 0.1365096497795534, 'sideways_tp_mult': 1.5367342132332642, 'sideways_tsl_mult': 0.06469175612933113, 'sideways_time_stop': 242, 'sideways_use_sma': True, 'sideways_use_ema': True, 'sideways_use_atr': False, 'sideways_use_adx': True, 'sideways_use_spike': False, 'sideways_rsi_required': False}.
[I 2025-08-31 09:58:32,734] Trial 290 finished with values: [-1000000000.0, 1000000000.0] and parameters: {'p_sma': 20, 'p_std': 16, 'p_atr': 28, 'p_adx': 9, 'rsi_period': 19, 'ema1': 18, 'ema2': 28, 'slip_atr_k': 0.10500483419219056, 'slip_spread_k': 0.4748113256394515, 'spread_hl_frac': 0.01271542751113598, 'bb_std_mult': 1.1395699909906147, 'rsi_os': 29, 'rsi_ob': 48, 'vol_spike': 0.12028771795221443, 'adx_thresh': 7.652197117280149, 'atr_min_pct': 0.012332294544983687, 'atr_max_pct': 0.08104787410099985, 'tp_mult': 1.4202471951858449, 'tsl_mult': 0.018631841123112045, 'strategy': 'breakout', 'time_stop': 138, 'use_sma': False, 'use_atr': False, 'use_adx': True, 'use_ema': False, 'use_spike': False, 'rsi_required': True, 'edge_k': 1.4492482532666087, 'edge_cap': 0.5247252078918472, 'bull_strategy': 'mean_reversion', 'bull_bb_std_mult': 3.037947132561558, 'bull_rsi_os': 31, 'bull_rsi_ob': 66, 'bull_adx_thresh': 28.692360732134457, 'bull_atr_min_pct': 0.019163829138606273, 'bull_atr_max_pct': 0.11706674219463382, 'bull_tp_mult': 1.771046140585769, 'bull_tsl_mult': 0.5944844675052032, 'bull_time_stop': 86, 'bull_use_sma': True, 'bull_use_ema': False, 'bull_use_atr': False, 'bull_use_adx': False, 'bull_use_spike': False, 'bull_rsi_required': True, 'bear_strategy': 'breakout', 'bear_bb_std_mult': 2.9225214972718234, 'bear_rsi_os': 52, 'bear_rsi_ob': 79, 'bear_adx_thresh': 23.957116863667796, 'bear_atr_min_pct': 0.021228718688430973, 'bear_atr_max_pct': 0.1391046156825747, 'bear_tp_mult': 2.641633186260206, 'bear_tsl_mult': 0.6694582454288797, 'bear_time_stop': 277, 'bear_use_sma': False, 'bear_use_ema': True, 'bear_use_atr': False, 'bear_use_adx': True, 'bear_use_spike': False, 'bear_rsi_required': True, 'sideways_strategy': 'breakout', 'sideways_bb_std_mult': 1.104602969293682, 'sideways_rsi_os': 28, 'sideways_rsi_ob': 93, 'sideways_adx_thresh': 33.5354824889625, 'sideways_atr_min_pct': 0.027413436610846748, 'sideways_atr_max_pct': 0.1464132712830306, 'sideways_tp_mult': 1.52368915554186, 'sideways_tsl_mult': 0.05939389621800523, 'sideways_time_stop': 99, 'sideways_use_sma': True, 'sideways_use_ema': True, 'sideways_use_atr': False, 'sideways_use_adx': False, 'sideways_use_spike': False, 'sideways_rsi_required': False}.
[I 2025-08-31 09:59:04,924] Trial 296 finished with values: [-1000000000.0, 1000000000.0] and parameters: {'p_sma': 38, 'p_std': 14, 'p_atr': 29, 'p_adx': 14, 'rsi_period': 21, 'ema1': 11, 'ema2': 39, 'slip_atr_k': 0.2277678843352416, 'slip_spread_k': 0.3928538243317405, 'spread_hl_frac': 0.01416315419195991, 'bb_std_mult': 1.069743017007977, 'rsi_os': 7, 'rsi_ob': 50, 'vol_spike': 0.23412708089360618, 'adx_thresh': 5.031058601018312, 'atr_min_pct': 0.010655925311790944, 'atr_max_pct': 0.044733961395116796, 'tp_mult': 2.899635230740028, 'tsl_mult': 0.230887446683462, 'strategy': 'breakout', 'time_stop': 131, 'use_sma': False, 'use_atr': False, 'use_adx': False, 'use_ema': False, 'use_spike': False, 'rsi_required': True, 'edge_k': 1.8728128619779716, 'edge_cap': 0.38602096427546645, 'bull_strategy': 'mean_reversion', 'bull_bb_std_mult': 1.0871733588066896, 'bull_rsi_os': 32, 'bull_rsi_ob': 68, 'bull_adx_thresh': 31.216395085750133, 'bull_atr_min_pct': 0.028759991770404038, 'bull_atr_max_pct': 0.1177212929668434, 'bull_tp_mult': 1.5127063773317402, 'bull_tsl_mult': 0.047290088475373526, 'bull_time_stop': 235, 'bull_use_sma': True, 'bull_use_ema': True, 'bull_use_atr': False, 'bull_use_adx': False, 'bull_use_spike': False, 'bull_rsi_required': True, 'bear_strategy': 'breakout', 'bear_bb_std_mult': 1.9546404687573078, 'bear_rsi_os': 23, 'bear_rsi_ob': 72, 'bear_adx_thresh': 20.455445782343542, 'bear_atr_min_pct': 0.0030175616686455176, 'bear_atr_max_pct': 0.13503698146498364, 'bear_tp_mult': 1.1556567052093598, 'bear_tsl_mult': 0.9408559103871857, 'bear_time_stop': 218, 'bear_use_sma': True, 'bear_use_ema': True, 'bear_use_atr': False, 'bear_use_adx': False, 'bear_use_spike': False, 'bear_rsi_required': True, 'sideways_strategy': 'mean_reversion', 'sideways_bb_std_mult': 3.09414142041097, 'sideways_rsi_os': 25, 'sideways_rsi_ob': 51, 'sideways_adx_thresh': 30.19050759814833, 'sideways_atr_min_pct': 0.0017103658444117072, 'sideways_atr_max_pct': 0.02437977714059377, 'sideways_tp_mult': 1.1216230955506947, 'sideways_tsl_mult': 0.11094570004239804, 'sideways_time_stop': 248, 'sideways_use_sma': True, 'sideways_use_ema': True, 'sideways_use_atr': False, 'sideways_use_adx': False, 'sideways_use_spike': False, 'sideways_rsi_required': True}.
[I 2025-08-31 09:59:05,142] Trial 295 finished with values: [-0.011566821623965162, 0.011693321792788997] and parameters: {'p_sma': 23, 'p_std': 16, 'p_atr': 29, 'p_adx': 9, 'rsi_period': 29, 'ema1': 11, 'ema2': 28, 'slip_atr_k': 0.13247952726262285, 'slip_spread_k': 0.19750013419192136, 'spread_hl_frac': 0.013714837713558995, 'bb_std_mult': 1.0823782012510168, 'rsi_os': 7, 'rsi_ob': 87, 'vol_spike': 0.23329594717612467, 'adx_thresh': 5.007131673906023, 'atr_min_pct': 0.012009446944939405, 'atr_max_pct': 0.04566214877569655, 'tp_mult': 2.52978584453659, 'tsl_mult': 8.037714118215781e-05, 'strategy': 'breakout', 'time_stop': 131, 'use_sma': False, 'use_atr': False, 'use_adx': False, 'use_ema': False, 'use_spike': False, 'rsi_required': True, 'edge_k': 1.9826388062546592, 'edge_cap': 0.5178819854427377, 'bull_strategy': 'mean_reversion', 'bull_bb_std_mult': 2.8370841235221063, 'bull_rsi_os': 9, 'bull_rsi_ob': 64, 'bull_adx_thresh': 31.387557053814454, 'bull_atr_min_pct': 0.019323223154332943, 'bull_atr_max_pct': 0.11716658330549162, 'bull_tp_mult': 1.5152432004602017, 'bull_tsl_mult': 0.5352588523789192, 'bull_time_stop': 237, 'bull_use_sma': True, 'bull_use_ema': True, 'bull_use_atr': False, 'bull_use_adx': False, 'bull_use_spike': False, 'bull_rsi_required': True, 'bear_strategy': 'breakout', 'bear_bb_std_mult': 2.997483953663177, 'bear_rsi_os': 23, 'bear_rsi_ob': 69, 'bear_adx_thresh': 29.47516402886119, 'bear_atr_min_pct': 0.022395560934159536, 'bear_atr_max_pct': 0.13640919971991436, 'bear_tp_mult': 1.1548465612899355, 'bear_tsl_mult': 0.5019339040985155, 'bear_time_stop': 246, 'bear_use_sma': False, 'bear_use_ema': True, 'bear_use_atr': False, 'bear_use_adx': False, 'bear_use_spike': False, 'bear_rsi_required': True, 'sideways_strategy': 'breakout', 'sideways_bb_std_mult': 1.2239133813371825, 'sideways_rsi_os': 25, 'sideways_rsi_ob': 65, 'sideways_adx_thresh': 30.401197826164644, 'sideways_atr_min_pct': 0.0008224651411634079, 'sideways_atr_max_pct': 0.02274455594267412, 'sideways_tp_mult': 1.1239490413791096, 'sideways_tsl_mult': 0.14209128575899876, 'sideways_time_stop': 247, 'sideways_use_sma': True, 'sideways_use_ema': True, 'sideways_use_atr': False, 'sideways_use_adx': False, 'sideways_use_spike': False, 'sideways_rsi_required': False}.
[I 2025-08-31 09:59:05,382] Trial 293 finished with values: [-0.03335576691520781, 0.03324181379345759] and parameters: {'p_sma': 34, 'p_std': 15, 'p_atr': 29, 'p_adx': 9, 'rsi_period': 21, 'ema1': 27, 'ema2': 28, 'slip_atr_k': 0.16819276532691763, 'slip_spread_k': 0.9466540531584254, 'spread_hl_frac': 0.013692788943201683, 'bb_std_mult': 1.1130146388419218, 'rsi_os': 26, 'rsi_ob': 66, 'vol_spike': 0.1312252633395427, 'adx_thresh': 31.133473821916056, 'atr_min_pct': 0.001650957631277124, 'atr_max_pct': 0.13587515681345055, 'tp_mult': 2.886765454971456, 'tsl_mult': 0.02304129964169775, 'strategy': 'breakout', 'time_stop': 135, 'use_sma': False, 'use_atr': False, 'use_adx': False, 'use_ema': False, 'use_spike': False, 'rsi_required': True, 'edge_k': 1.8656941979237922, 'edge_cap': 0.3096320237038658, 'bull_strategy': 'mean_reversion', 'bull_bb_std_mult': 1.0417841151758056, 'bull_rsi_os': 32, 'bull_rsi_ob': 47, 'bull_adx_thresh': 31.626292633764265, 'bull_atr_min_pct': 0.028725421435429135, 'bull_atr_max_pct': 0.08031755390890905, 'bull_tp_mult': 1.50832895885221, 'bull_tsl_mult': 0.5353026841961985, 'bull_time_stop': 238, 'bull_use_sma': True, 'bull_use_ema': False, 'bull_use_atr': False, 'bull_use_adx': False, 'bull_use_spike': False, 'bull_rsi_required': True, 'bear_strategy': 'breakout', 'bear_bb_std_mult': 2.8541160015815916, 'bear_rsi_os': 23, 'bear_rsi_ob': 69, 'bear_adx_thresh': 27.227804012682654, 'bear_atr_min_pct': 0.022534399319612947, 'bear_atr_max_pct': 0.13430260570644556, 'bear_tp_mult': 2.027600117537528, 'bear_tsl_mult': 0.6601177563509705, 'bear_time_stop': 246, 'bear_use_sma': False, 'bear_use_ema': True, 'bear_use_atr': False, 'bear_use_adx': True, 'bear_use_spike': False, 'bear_rsi_required': True, 'sideways_strategy': 'breakout', 'sideways_bb_std_mult': 1.0680343726364634, 'sideways_rsi_os': 25, 'sideways_rsi_ob': 51, 'sideways_adx_thresh': 11.427295620605264, 'sideways_atr_min_pct': 0.0009177599371299873, 'sideways_atr_max_pct': 0.02379402467812665, 'sideways_tp_mult': 1.5809961750962571, 'sideways_tsl_mult': 0.7219179079786673, 'sideways_time_stop': 102, 'sideways_use_sma': True, 'sideways_use_ema': True, 'sideways_use_atr': False, 'sideways_use_adx': False, 'sideways_use_spike': False, 'sideways_rsi_required': False}.
[I 2025-08-31 09:59:05,481] Trial 294 finished with values: [-0.03734149320715152, 0.03722976568686402] and parameters: {'p_sma': 59, 'p_std': 15, 'p_atr': 29, 'p_adx': 9, 'rsi_period': 21, 'ema1': 27, 'ema2': 28, 'slip_atr_k': 0.1681816968261672, 'slip_spread_k': 0.7111726251288905, 'spread_hl_frac': 8.191822141843247e-05, 'bb_std_mult': 1.1101879563473132, 'rsi_os': 21, 'rsi_ob': 66, 'vol_spike': 0.1326085650090211, 'adx_thresh': 5.036217338026656, 'atr_min_pct': 0.010607089025655565, 'atr_max_pct': 0.13659808718798605, 'tp_mult': 2.4363177837871546, 'tsl_mult': 0.7325495511888752, 'strategy': 'breakout', 'time_stop': 136, 'use_sma': False, 'use_atr': False, 'use_adx': False, 'use_ema': False, 'use_spike': False, 'rsi_required': True, 'edge_k': 0.1989221977845117, 'edge_cap': 0.10220945270956039, 'bull_strategy': 'mean_reversion', 'bull_bb_std_mult': 3.063805015435035, 'bull_rsi_os': 9, 'bull_rsi_ob': 70, 'bull_adx_thresh': 17.146244676160507, 'bull_atr_min_pct': 0.028752587473559823, 'bull_atr_max_pct': 0.1173567329361618, 'bull_tp_mult': 1.510144154883324, 'bull_tsl_mult': 0.5344766018629913, 'bull_time_stop': 245, 'bull_use_sma': True, 'bull_use_ema': False, 'bull_use_atr': False, 'bull_use_adx': False, 'bull_use_spike': False, 'bull_rsi_required': True, 'bear_strategy': 'breakout', 'bear_bb_std_mult': 2.859831840671702, 'bear_rsi_os': 52, 'bear_rsi_ob': 69, 'bear_adx_thresh': 27.187770968911632, 'bear_atr_min_pct': 0.005990829689124762, 'bear_atr_max_pct': 0.08663988345948845, 'bear_tp_mult': 2.647177377989711, 'bear_tsl_mult': 0.504567719087738, 'bear_time_stop': 289, 'bear_use_sma': False, 'bear_use_ema': True, 'bear_use_atr': False, 'bear_use_adx': True, 'bear_use_spike': False, 'bear_rsi_required': True, 'sideways_strategy': 'breakout', 'sideways_bb_std_mult': 1.0701204447034351, 'sideways_rsi_os': 25, 'sideways_rsi_ob': 65, 'sideways_adx_thresh': 26.83616787128657, 'sideways_atr_min_pct': 0.0008953341083562228, 'sideways_atr_max_pct': 0.02318473305236189, 'sideways_tp_mult': 1.8160456827491525, 'sideways_tsl_mult': 0.7346953659667965, 'sideways_time_stop': 97, 'sideways_use_sma': True, 'sideways_use_ema': True, 'sideways_use_atr': False, 'sideways_use_adx': False, 'sideways_use_spike': False, 'sideways_rsi_required': False}.
