[I 2025-08-31 10:41:47,915] Trial 640 finished with values: [-1000000000.0, 1000000000.0] and parameters: {'p_sma': 10, 'p_std': 45, 'p_atr': 21, 'p_adx': 16, 'rsi_period': 56, 'ema1': 8, 'ema2': 40, 'slip_atr_k': 0.10344049871828802, 'slip_spread_k': 0.04293320414552025, 'spread_hl_frac': 0.041172707982440764, 'bb_std_mult': 1.0984151580197818, 'rsi_os': 55, 'rsi_ob': 59, 'vol_spike': 0.2995290109565732, 'adx_thresh': 12.345602981986554, 'atr_min_pct': 0.016817788396423648, 'atr_max_pct': 0.12419500286397248, 'tp_mult': 2.9910674237002453, 'tsl_mult': 0.42265405344624585, 'strategy': 'mean_reversion', 'time_stop': 162, 'use_sma': True, 'use_atr': False, 'use_adx': False, 'use_ema': True, 'use_spike': False, 'rsi_required': True, 'edge_k': 1.3716870157818146, 'edge_cap': 0.14446725120762463, 'bull_strategy': 'breakout', 'bull_bb_std_mult': 1.0997109062438466, 'bull_rsi_os': 40, 'bull_rsi_ob': 67, 'bull_adx_thresh': 16.36062496523816, 'bull_atr_min_pct': 0.02285727510645652, 'bull_atr_max_pct': 0.08261714232170925, 'bull_tp_mult': 2.800110342019591, 'bull_tsl_mult': 0.919840952617397, 'bull_time_stop': 113, 'bull_use_sma': True, 'bull_use_ema': False, 'bull_use_atr': False, 'bull_use_adx': False, 'bull_use_spike': False, 'bull_rsi_required': True, 'bear_strategy': 'breakout', 'bear_bb_std_mult': 2.340622274080483, 'bear_rsi_os': 27, 'bear_rsi_ob': 81, 'bear_adx_thresh': 21.417773147372746, 'bear_atr_min_pct': 0.006672882660209644, 'bear_atr_max_pct': 0.08352378346595107, 'bear_tp_mult': 1.9978405747822552, 'bear_tsl_mult': 0.9334826187032119, 'bear_time_stop': 258, 'bear_use_sma': False, 'bear_use_ema': True, 'bear_use_atr': False, 'bear_use_adx': True, 'bear_use_spike': True, 'bear_rsi_required': True, 'sideways_strategy': 'breakout', 'sideways_bb_std_mult': 1.7432721750219422, 'sideways_rsi_os': 26, 'sideways_rsi_ob': 95, 'sideways_adx_thresh': 29.633568661016497, 'sideways_atr_min_pct': 0.0005255393187474333, 'sideways_atr_max_pct': 0.09474246948528646, 'sideways_tp_mult': 2.256649796668671, 'sideways_tsl_mult': 0.7573035893554398, 'sideways_time_stop': 238, 'sideways_use_sma': True, 'sideways_use_ema': True, 'sideways_use_atr': False, 'sideways_use_adx': False, 'sideways_use_spike': True, 'sideways_rsi_required': False}.
[I 2025-08-31 10:42:18,025] Trial 639 finished with values: [-1000000000.0, 1000000000.0] and parameters: {'p_sma': 10, 'p_std': 32, 'p_atr': 30, 'p_adx': 9, 'rsi_period': 14, 'ema1': 23, 'ema2': 40, 'slip_atr_k': 0.10373081681084668, 'slip_spread_k': 0.12160062170470434, 'spread_hl_frac': 0.011546558692133977, 'bb_std_mult': 2.855721834246917, 'rsi_os': 28, 'rsi_ob': 73, 'vol_spike': 0.29953104806841296, 'adx_thresh': 23.000378059372316, 'atr_min_pct': 0.02713923151945887, 'atr_max_pct': 0.0958173049911061, 'tp_mult': 2.6628395554732083, 'tsl_mult': 0.4105553809269189, 'strategy': 'mean_reversion', 'time_stop': 161, 'use_sma': True, 'use_atr': False, 'use_adx': False, 'use_ema': True, 'use_spike': False, 'rsi_required': True, 'edge_k': 1.3818447854368168, 'edge_cap': 0.13935716643676047, 'bull_strategy': 'breakout', 'bull_bb_std_mult': 3.4456110666109705, 'bull_rsi_os': 26, 'bull_rsi_ob': 67, 'bull_adx_thresh': 24.9541743572019, 'bull_atr_min_pct': 0.012880188923247863, 'bull_atr_max_pct': 0.06531059048522544, 'bull_tp_mult': 1.8472268187393825, 'bull_tsl_mult': 0.9201655398703799, 'bull_time_stop': 82, 'bull_use_sma': True, 'bull_use_ema': False, 'bull_use_atr': False, 'bull_use_adx': False, 'bull_use_spike': False, 'bull_rsi_required': True, 'bear_strategy': 'breakout', 'bear_bb_std_mult': 0.9367764014827158, 'bear_rsi_os': 27, 'bear_rsi_ob': 81, 'bear_adx_thresh': 21.41270645472347, 'bear_atr_min_pct': 0.0066760430777467236, 'bear_atr_max_pct': 0.07981185666330777, 'bear_tp_mult': 1.695815899994879, 'bear_tsl_mult': 0.8277514403150048, 'bear_time_stop': 256, 'bear_use_sma': False, 'bear_use_ema': True, 'bear_use_atr': False, 'bear_use_adx': True, 'bear_use_spike': True, 'bear_rsi_required': True, 'sideways_strategy': 'breakout', 'sideways_bb_std_mult': 1.4724538592591483, 'sideways_rsi_os': 33, 'sideways_rsi_ob': 95, 'sideways_adx_thresh': 25.804862915307822, 'sideways_atr_min_pct': 0.007506771685860464, 'sideways_atr_max_pct': 0.0690848783660452, 'sideways_tp_mult': 2.8298642294865184, 'sideways_tsl_mult': 0.4732461037412244, 'sideways_time_stop': 240, 'sideways_use_sma': True, 'sideways_use_ema': True, 'sideways_use_atr': False, 'sideways_use_adx': False, 'sideways_use_spike': True, 'sideways_rsi_required': False}.
[I 2025-08-31 10:42:18,426] Trial 641 finished with values: [-1000000000.0, 1000000000.0] and parameters: {'p_sma': 10, 'p_std': 7, 'p_atr': 21, 'p_adx': 9, 'rsi_period': 63, 'ema1': 6, 'ema2': 40, 'slip_atr_k': 0.17892191506482075, 'slip_spread_k': 0.12130843141323709, 'spread_hl_frac': 0.011644947542402667, 'bb_std_mult': 1.5211113780735719, 'rsi_os': 38, 'rsi_ob': 84, 'vol_spike': 0.03340932566510256, 'adx_thresh': 9.899426032774274, 'atr_min_pct': 0.012234489757437253, 'atr_max_pct': 0.05016454910311016, 'tp_mult': 2.9974070698448236, 'tsl_mult': 0.042104842767259544, 'strategy': 'mean_reversion', 'time_stop': 140, 'use_sma': True, 'use_atr': False, 'use_adx': False, 'use_ema': True, 'use_spike': False, 'rsi_required': True, 'edge_k': 1.911549764788638, 'edge_cap': 0.13834921909242284, 'bull_strategy': 'breakout', 'bull_bb_std_mult': 1.157862067211136, 'bull_rsi_os': 55, 'bull_rsi_ob': 59, 'bull_adx_thresh': 13.86013142180543, 'bull_atr_min_pct': 0.026916697293918258, 'bull_atr_max_pct': 0.0813460334523621, 'bull_tp_mult': 2.0480893317603828, 'bull_tsl_mult': 0.8230800966100591, 'bull_time_stop': 112, 'bull_use_sma': True, 'bull_use_ema': False, 'bull_use_atr': False, 'bull_use_adx': False, 'bull_use_spike': False, 'bull_rsi_required': False, 'bear_strategy': 'breakout', 'bear_bb_std_mult': 1.3747941008132343, 'bear_rsi_os': 27, 'bear_rsi_ob': 58, 'bear_adx_thresh': 5.017968034206451, 'bear_atr_min_pct': 0.00653058052948188, 'bear_atr_max_pct': 0.013906327297595222, 'bear_tp_mult': 1.7151863141176311, 'bear_tsl_mult': 0.7998798486821391, 'bear_time_stop': 254, 'bear_use_sma': False, 'bear_use_ema': True, 'bear_use_atr': False, 'bear_use_adx': True, 'bear_use_spike': True, 'bear_rsi_required': True, 'sideways_strategy': 'breakout', 'sideways_bb_std_mult': 1.9812952017615255, 'sideways_rsi_os': 26, 'sideways_rsi_ob': 95, 'sideways_adx_thresh': 6.29424329867712, 'sideways_atr_min_pct': 0.026591368712279295, 'sideways_atr_max_pct': 0.044134789011513756, 'sideways_tp_mult': 1.9987219192156387, 'sideways_tsl_mult': 0.6777138266476872, 'sideways_time_stop': 103, 'sideways_use_sma': True, 'sideways_use_ema': True, 'sideways_use_atr': False, 'sideways_use_adx': False, 'sideways_use_spike': True, 'sideways_rsi_required': False}.
[I 2025-08-31 10:42:18,681] Trial 642 finished with values: [-0.03176969933670448, 0.03162977020819482] and parameters: {'p_sma': 40, 'p_std': 45, 'p_atr': 28, 'p_adx': 16, 'rsi_period': 22, 'ema1': 6, 'ema2': 40, 'slip_atr_k': 0.10393301378648148, 'slip_spread_k': 0.12485402071705423, 'spread_hl_frac': 0.030936186393654815, 'bb_std_mult': 0.6277383705283421, 'rsi_os': 38, 'rsi_ob': 84, 'vol_spike': 0.2898915938618266, 'adx_thresh': 25.184035924657405, 'atr_min_pct': 0.012067796899820427, 'atr_max_pct': 0.12356842240154452, 'tp_mult': 2.4606502520269693, 'tsl_mult': 0.35452929029543384, 'strategy': 'mean_reversion', 'time_stop': 216, 'use_sma': True, 'use_atr': False, 'use_adx': False, 'use_ema': True, 'use_spike': False, 'rsi_required': True, 'edge_k': 0.6489113470205956, 'edge_cap': 0.14628002174937477, 'bull_strategy': 'breakout', 'bull_bb_std_mult': 1.1052606162155816, 'bull_rsi_os': 40, 'bull_rsi_ob': 46, 'bull_adx_thresh': 19.908769726127613, 'bull_atr_min_pct': 0.014155153740527495, 'bull_atr_max_pct': 0.08130466050407098, 'bull_tp_mult': 2.1543465090620595, 'bull_tsl_mult': 0.6991138558220693, 'bull_time_stop': 171, 'bull_use_sma': False, 'bull_use_ema': False, 'bull_use_atr': True, 'bull_use_adx': False, 'bull_use_spike': False, 'bull_rsi_required': False, 'bear_strategy': 'breakout', 'bear_bb_std_mult': 2.8214290406935922, 'bear_rsi_os': 28, 'bear_rsi_ob': 54, 'bear_adx_thresh': 23.385764003322862, 'bear_atr_min_pct': 0.006625888042734263, 'bear_atr_max_pct': 0.0145216556153092, 'bear_tp_mult': 2.388652310963994, 'bear_tsl_mult': 0.0074078474681812945, 'bear_time_stop': 257, 'bear_use_sma': False, 'bear_use_ema': True, 'bear_use_atr': False, 'bear_use_adx': True, 'bear_use_spike': True, 'bear_rsi_required': True, 'sideways_strategy': 'breakout', 'sideways_bb_std_mult': 2.6855684276478984, 'sideways_rsi_os': 26, 'sideways_rsi_ob': 58, 'sideways_adx_thresh': 25.658327119613034, 'sideways_atr_min_pct': 0.0007741637451527072, 'sideways_atr_max_pct': 0.0688576929019581, 'sideways_tp_mult': 2.2628791510585495, 'sideways_tsl_mult': 0.7126351898030746, 'sideways_time_stop': 266, 'sideways_use_sma': True, 'sideways_use_ema': True, 'sideways_use_atr': False, 'sideways_use_adx': False, 'sideways_use_spike': True, 'sideways_rsi_required': False}.
[I 2025-08-31 10:42:20,360] Trial 643 finished with values: [-1000000000.0, 1000000000.0] and parameters: {'p_sma': 43, 'p_std': 29, 'p_atr': 16, 'p_adx': 18, 'rsi_period': 14, 'ema1': 5, 'ema2': 22, 'slip_atr_k': 0.0498323389630633, 'slip_spread_k': 0.12300097941085578, 'spread_hl_frac': 0.011669486430510728, 'bb_std_mult': 1.203196627429322, 'rsi_os': 45, 'rsi_ob': 84, 'vol_spike': 0.28996909148080974, 'adx_thresh': 25.17307497820388, 'atr_min_pct': 0.012014399389203796, 'atr_max_pct': 0.06954518883033424, 'tp_mult': 2.923495832202527, 'tsl_mult': 0.04796544038381593, 'strategy': 'breakout', 'time_stop': 203, 'use_sma': False, 'use_atr': False, 'use_adx': False, 'use_ema': True, 'use_spike': False, 'rsi_required': True, 'edge_k': 0.6012358113641079, 'edge_cap': 0.2293636868395325, 'bull_strategy': 'mean_reversion', 'bull_bb_std_mult': 3.24391415469911, 'bull_rsi_os': 24, 'bull_rsi_ob': 82, 'bull_adx_thresh': 8.977432841206358, 'bull_atr_min_pct': 0.014038596174719014, 'bull_atr_max_pct': 0.09848343046118141, 'bull_tp_mult': 2.874041651557504, 'bull_tsl_mult': 0.2506593965321198, 'bull_time_stop': 80, 'bull_use_sma': False, 'bull_use_ema': False, 'bull_use_atr': True, 'bull_use_adx': False, 'bull_use_spike': False, 'bull_rsi_required': False, 'bear_strategy': 'mean_reversion', 'bear_bb_std_mult': 1.9358164041877817, 'bear_rsi_os': 28, 'bear_rsi_ob': 51, 'bear_adx_thresh': 11.047784405235362, 'bear_atr_min_pct': 0.0094134283105122, 'bear_atr_max_pct': 0.10480555066249683, 'bear_tp_mult': 2.921752960519752, 'bear_tsl_mult': 0.0009132316327665202, 'bear_time_stop': 254, 'bear_use_sma': False, 'bear_use_ema': True, 'bear_use_atr': False, 'bear_use_adx': True, 'bear_use_spike': True, 'bear_rsi_required': True, 'sideways_strategy': 'breakout', 'sideways_bb_std_mult': 1.0458265263630462, 'sideways_rsi_os': 23, 'sideways_rsi_ob': 94, 'sideways_adx_thresh': 23.429109725361716, 'sideways_atr_min_pct': 0.029194769600616156, 'sideways_atr_max_pct': 0.09794545234692079, 'sideways_tp_mult': 2.085726060536512, 'sideways_tsl_mult': 0.5578840113601953, 'sideways_time_stop': 221, 'sideways_use_sma': True, 'sideways_use_ema': True, 'sideways_use_atr': False, 'sideways_use_adx': False, 'sideways_use_spike': True, 'sideways_rsi_required': False}.
[I 2025-08-31 10:42:52,349] Trial 645 finished with values: [-0.07911223175715643, 0.07908906575781074] and parameters: {'p_sma': 42, 'p_std': 49, 'p_atr': 28, 'p_adx': 21, 'rsi_period': 22, 'ema1': 18, 'ema2': 37, 'slip_atr_k': 0.051029263200149305, 'slip_spread_k': 0.7416989220120345, 'spread_hl_frac': 0.027604957341938244, 'bb_std_mult': 1.200592676679425, 'rsi_os': 41, 'rsi_ob': 72, 'vol_spike': 0.2890657116509222, 'adx_thresh': 25.164284240477578, 'atr_min_pct': 0.011888755355998015, 'atr_max_pct': 0.10397932037507242, 'tp_mult': 2.8364734809097976, 'tsl_mult': 0.6850229692967271, 'strategy': 'breakout', 'time_stop': 255, 'use_sma': False, 'use_atr': True, 'use_adx': False, 'use_ema': True, 'use_spike': False, 'rsi_required': False, 'edge_k': 1.9955812242832514, 'edge_cap': 0.11402665833912697, 'bull_strategy': 'mean_reversion', 'bull_bb_std_mult': 1.262958537335554, 'bull_rsi_os': 9, 'bull_rsi_ob': 93, 'bull_adx_thresh': 33.77172088992296, 'bull_atr_min_pct': 0.007038842990733649, 'bull_atr_max_pct': 0.10110454335109899, 'bull_tp_mult': 2.159346774615088, 'bull_tsl_mult': 0.9568508351324545, 'bull_time_stop': 65, 'bull_use_sma': False, 'bull_use_ema': False, 'bull_use_atr': True, 'bull_use_adx': False, 'bull_use_spike': True, 'bull_rsi_required': False, 'bear_strategy': 'mean_reversion', 'bear_bb_std_mult': 2.803531881643902, 'bear_rsi_os': 28, 'bear_rsi_ob': 77, 'bear_adx_thresh': 23.33065182357554, 'bear_atr_min_pct': 0.011799790041649435, 'bear_atr_max_pct': 0.07445809506519513, 'bear_tp_mult': 2.934184973561099, 'bear_tsl_mult': 0.44362464111222333, 'bear_time_stop': 273, 'bear_use_sma': False, 'bear_use_ema': True, 'bear_use_atr': False, 'bear_use_adx': True, 'bear_use_spike': True, 'bear_rsi_required': False, 'sideways_strategy': 'mean_reversion', 'sideways_bb_std_mult': 0.9134903447462948, 'sideways_rsi_os': 23, 'sideways_rsi_ob': 58, 'sideways_adx_thresh': 28.73066518026816, 'sideways_atr_min_pct': 0.001114615213459482, 'sideways_atr_max_pct': 0.06228254202538629, 'sideways_tp_mult': 2.078484754596993, 'sideways_tsl_mult': 0.7098460884461293, 'sideways_time_stop': 221, 'sideways_use_sma': True, 'sideways_use_ema': False, 'sideways_use_atr': True, 'sideways_use_adx': True, 'sideways_use_spike': True, 'sideways_rsi_required': True}.
[I 2025-08-31 10:42:52,377] Trial 646 finished with values: [-1000000000.0, 1000000000.0] and parameters: {'p_sma': 35, 'p_std': 48, 'p_atr': 9, 'p_adx': 18, 'rsi_period': 45, 'ema1': 12, 'ema2': 13, 'slip_atr_k': 0.05234204421443356, 'slip_spread_k': 0.7572307222691353, 'spread_hl_frac': 0.010655866741361476, 'bb_std_mult': 1.216343674612625, 'rsi_os': 41, 'rsi_ob': 82, 'vol_spike': 0.28191475041415837, 'adx_thresh': 18.031108028674513, 'atr_min_pct': 0.01047499888989319, 'atr_max_pct': 0.06667628227977962, 'tp_mult': 2.8232668652792734, 'tsl_mult': 0.05973560821959371, 'strategy': 'breakout', 'time_stop': 186, 'use_sma': False, 'use_atr': True, 'use_adx': False, 'use_ema': True, 'use_spike': False, 'rsi_required': False, 'edge_k': 1.9951453599799027, 'edge_cap': 0.23047098539031918, 'bull_strategy': 'mean_reversion', 'bull_bb_std_mult': 1.867394457354175, 'bull_rsi_os': 23, 'bull_rsi_ob': 93, 'bull_adx_thresh': 31.308776134881537, 'bull_atr_min_pct': 0.007059313106839167, 'bull_atr_max_pct': 0.0871373906601733, 'bull_tp_mult': 2.6882165473891995, 'bull_tsl_mult': 0.9589584195177839, 'bull_time_stop': 198, 'bull_use_sma': False, 'bull_use_ema': False, 'bull_use_atr': True, 'bull_use_adx': False, 'bull_use_spike': True, 'bull_rsi_required': True, 'bear_strategy': 'mean_reversion', 'bear_bb_std_mult': 2.8656811041159376, 'bear_rsi_os': 30, 'bear_rsi_ob': 77, 'bear_adx_thresh': 10.994897140194247, 'bear_atr_min_pct': 0.011699334389330754, 'bear_atr_max_pct': 0.106553863680321, 'bear_tp_mult': 2.8472817850737964, 'bear_tsl_mult': 0.44120530789609375, 'bear_time_stop': 272, 'bear_use_sma': False, 'bear_use_ema': False, 'bear_use_atr': False, 'bear_use_adx': True, 'bear_use_spike': True, 'bear_rsi_required': False, 'sideways_strategy': 'mean_reversion', 'sideways_bb_std_mult': 2.5411363976120414, 'sideways_rsi_os': 22, 'sideways_rsi_ob': 94, 'sideways_adx_thresh': 11.135136601789402, 'sideways_atr_min_pct': 0.028137657122585435, 'sideways_atr_max_pct': 0.06182145575148276, 'sideways_tp_mult': 2.0670041383755886, 'sideways_tsl_mult': 0.032278820068068134, 'sideways_time_stop': 219, 'sideways_use_sma': True, 'sideways_use_ema': False, 'sideways_use_atr': True, 'sideways_use_adx': True, 'sideways_use_spike': True, 'sideways_rsi_required': True}.
[I 2025-08-31 10:42:52,620] Trial 647 finished with values: [-1000000000.0, 1000000000.0] and parameters: {'p_sma': 12, 'p_std': 48, 'p_atr': 28, 'p_adx': 10, 'rsi_period': 27, 'ema1': 9, 'ema2': 37, 'slip_atr_k': 0.1858286391169732, 'slip_spread_k': 0.25088724157753406, 'spread_hl_frac': 0.027032111928082764, 'bb_std_mult': 1.8210685679300744, 'rsi_os': 9, 'rsi_ob': 55, 'vol_spike': 0.24011036748543457, 'adx_thresh': 17.861611655402513, 'atr_min_pct': 0.008822366839331037, 'atr_max_pct': 0.1192698984218826, 'tp_mult': 2.9103684890758856, 'tsl_mult': 0.08876121201120507, 'strategy': 'breakout', 'time_stop': 98, 'use_sma': False, 'use_atr': True, 'use_adx': False, 'use_ema': True, 'use_spike': False, 'rsi_required': False, 'edge_k': 1.9984532946923341, 'edge_cap': 0.11123055802496154, 'bull_strategy': 'mean_reversion', 'bull_bb_std_mult': 1.2734369291007264, 'bull_rsi_os': 49, 'bull_rsi_ob': 61, 'bull_adx_thresh': 31.183828431540537, 'bull_atr_min_pct': 0.005975657737260415, 'bull_atr_max_pct': 0.0872807410710309, 'bull_tp_mult': 2.2544548637347743, 'bull_tsl_mult': 0.9574247636095699, 'bull_time_stop': 65, 'bull_use_sma': True, 'bull_use_ema': False, 'bull_use_atr': False, 'bull_use_adx': False, 'bull_use_spike': True, 'bull_rsi_required': True, 'bear_strategy': 'mean_reversion', 'bear_bb_std_mult': 3.075040180179396, 'bear_rsi_os': 16, 'bear_rsi_ob': 77, 'bear_adx_thresh': 20.62754009169599, 'bear_atr_min_pct': 0.0054863487200778275, 'bear_atr_max_pct': 0.10522527264276961, 'bear_tp_mult': 1.1686488909111836, 'bear_tsl_mult': 0.7592048346169789, 'bear_time_stop': 270, 'bear_use_sma': False, 'bear_use_ema': False, 'bear_use_atr': False, 'bear_use_adx': True, 'bear_use_spike': True, 'bear_rsi_required': False, 'sideways_strategy': 'mean_reversion', 'sideways_bb_std_mult': 0.8949370940880852, 'sideways_rsi_os': 21, 'sideways_rsi_ob': 94, 'sideways_adx_thresh': 28.91625590364196, 'sideways_atr_min_pct': 0.02796118395457574, 'sideways_atr_max_pct': 0.10706614394182408, 'sideways_tp_mult': 2.905276342289314, 'sideways_tsl_mult': 0.03240817259929444, 'sideways_time_stop': 249, 'sideways_use_sma': True, 'sideways_use_ema': False, 'sideways_use_atr': True, 'sideways_use_adx': True, 'sideways_use_spike': True, 'sideways_rsi_required': True}.
[I 2025-08-31 10:42:52,781] Trial 644 finished with values: [-1000000000.0, 1000000000.0] and parameters: {'p_sma': 12, 'p_std': 49, 'p_atr': 28, 'p_adx': 19, 'rsi_period': 45, 'ema1': 12, 'ema2': 37, 'slip_atr_k': 0.05071507875050428, 'slip_spread_k': 0.29508654175654686, 'spread_hl_frac': 0.010527730117255484, 'bb_std_mult': 1.206700707385647, 'rsi_os': 45, 'rsi_ob': 55, 'vol_spike': 0.28760564925528875, 'adx_thresh': 23.6921506723777, 'atr_min_pct': 0.011795773223098337, 'atr_max_pct': 0.12228769717003128, 'tp_mult': 2.9204214804921325, 'tsl_mult': 0.56267094909011, 'strategy': 'breakout', 'time_stop': 139, 'use_sma': False, 'use_atr': False, 'use_adx': False, 'use_ema': True, 'use_spike': False, 'rsi_required': False, 'edge_k': 0.6463060563866536, 'edge_cap': 0.508040370692345, 'bull_strategy': 'mean_reversion', 'bull_bb_std_mult': 3.2914933921896283, 'bull_rsi_os': 24, 'bull_rsi_ob': 85, 'bull_adx_thresh': 31.125697768060697, 'bull_atr_min_pct': 0.014165448072822925, 'bull_atr_max_pct': 0.10169083636318414, 'bull_tp_mult': 1.1523871715127088, 'bull_tsl_mult': 0.9545241591012805, 'bull_time_stop': 194, 'bull_use_sma': False, 'bull_use_ema': False, 'bull_use_atr': True, 'bull_use_adx': False, 'bull_use_spike': False, 'bull_rsi_required': False, 'bear_strategy': 'mean_reversion', 'bear_bb_std_mult': 2.8124670394226214, 'bear_rsi_os': 28, 'bear_rsi_ob': 53, 'bear_adx_thresh': 23.24655415504702, 'bear_atr_min_pct': 0.00962778254960706, 'bear_atr_max_pct': 0.013177771650258241, 'bear_tp_mult': 1.0803538451878185, 'bear_tsl_mult': 0.26533176574460615, 'bear_time_stop': 272, 'bear_use_sma': False, 'bear_use_ema': True, 'bear_use_atr': False, 'bear_use_adx': True, 'bear_use_spike': True, 'bear_rsi_required': True, 'sideways_strategy': 'breakout', 'sideways_bb_std_mult': 0.7479797328200555, 'sideways_rsi_os': 21, 'sideways_rsi_ob': 94, 'sideways_adx_thresh': 22.357335050471455, 'sideways_atr_min_pct': 0.027901917041172883, 'sideways_atr_max_pct': 0.08596337536956046, 'sideways_tp_mult': 1.993186289187103, 'sideways_tsl_mult': 0.03758504447357752, 'sideways_time_stop': 72, 'sideways_use_sma': True, 'sideways_use_ema': True, 'sideways_use_atr': False, 'sideways_use_adx': False, 'sideways_use_spike': True, 'sideways_rsi_required': False}.
