[I 2025-08-31 09:56:48,672] Trial 277 finished with values: [-1000000000.0, 1000000000.0] and parameters: {'p_sma': 48, 'p_std': 18, 'p_atr': 12, 'p_adx': 8, 'rsi_period': 80, 'ema1': 22, 'ema2': 37, 'slip_atr_k': 0.14119152930202836, 'slip_spread_k': 0.41320254487806385, 'spread_hl_frac': 0.01816515726357311, 'bb_std_mult': 1.1890697129662666, 'rsi_os': 22, 'rsi_ob': 93, 'vol_spike': 0.03235943338299341, 'adx_thresh': 16.055943436589878, 'atr_min_pct': 0.0009158017713043615, 'atr_max_pct': 0.1263200398637504, 'tp_mult': 2.921995069916603, 'tsl_mult': 0.033974355083416945, 'strategy': 'breakout', 'time_stop': 101, 'use_sma': False, 'use_atr': False, 'use_adx': False, 'use_ema': False, 'use_spike': False, 'rsi_required': True, 'edge_k': 1.9568220390743354, 'edge_cap': 0.27826954638634416, 'bull_strategy': 'mean_reversion', 'bull_bb_std_mult': 2.367671355949229, 'bull_rsi_os': 33, 'bull_rsi_ob': 45, 'bull_adx_thresh': 18.20954582991556, 'bull_atr_min_pct': 0.01649361786897923, 'bull_atr_max_pct': 0.11931409048809234, 'bull_tp_mult': 1.470653082738679, 'bull_tsl_mult': 0.6464966363077068, 'bull_time_stop': 175, 'bull_use_sma': True, 'bull_use_ema': False, 'bull_use_atr': False, 'bull_use_adx': False, 'bull_use_spike': False, 'bull_rsi_required': True, 'bear_strategy': 'breakout', 'bear_bb_std_mult': 2.8022222310012537, 'bear_rsi_os': 46, 'bear_rsi_ob': 88, 'bear_adx_thresh': 19.748836185436748, 'bear_atr_min_pct': 0.016956038852613424, 'bear_atr_max_pct': 0.13796535552147837, 'bear_tp_mult': 1.5212367820625177, 'bear_tsl_mult': 0.48313531823033606, 'bear_time_stop': 16, 'bear_use_sma': True, 'bear_use_ema': True, 'bear_use_atr': False, 'bear_use_adx': False, 'bear_use_spike': False, 'bear_rsi_required': True, 'sideways_strategy': 'mean_reversion', 'sideways_bb_std_mult': 0.9121688406224864, 'sideways_rsi_os': 26, 'sideways_rsi_ob': 64, 'sideways_adx_thresh': 32.67965431923267, 'sideways_atr_min_pct': 0.002229121111858028, 'sideways_atr_max_pct': 0.06773494642057352, 'sideways_tp_mult': 1.460559744577352, 'sideways_tsl_mult': 0.3391004577114227, 'sideways_time_stop': 221, 'sideways_use_sma': True, 'sideways_use_ema': True, 'sideways_use_atr': False, 'sideways_use_adx': False, 'sideways_use_spike': False, 'sideways_rsi_required': True}.
[I 2025-08-31 09:56:49,357] Trial 280 finished with values: [-1000000000.0, 1000000000.0] and parameters: {'p_sma': 50, 'p_std': 18, 'p_atr': 15, 'p_adx': 16, 'rsi_period': 11, 'ema1': 21, 'ema2': 51, 'slip_atr_k': 0.14954306895521186, 'slip_spread_k': 0.40706637839906223, 'spread_hl_frac': 0.012660916879313353, 'bb_std_mult': 1.2038256698657197, 'rsi_os': 23, 'rsi_ob': 47, 'vol_spike': 0.06039668282617407, 'adx_thresh': 6.400202992690843, 'atr_min_pct': 0.009953216803085528, 'atr_max_pct': 0.12674212532584328, 'tp_mult': 2.8580550479394526, 'tsl_mult': 0.03685622560692434, 'strategy': 'mean_reversion', 'time_stop': 66, 'use_sma': False, 'use_atr': False, 'use_adx': False, 'use_ema': False, 'use_spike': False, 'rsi_required': True, 'edge_k': 1.9007208091652061, 'edge_cap': 0.15010815561178048, 'bull_strategy': 'mean_reversion', 'bull_bb_std_mult': 2.913159581947034, 'bull_rsi_os': 33, 'bull_rsi_ob': 61, 'bull_adx_thresh': 10.450860805721685, 'bull_atr_min_pct': 0.019773874708673565, 'bull_atr_max_pct': 0.12023275649696191, 'bull_tp_mult': 1.636314417163391, 'bull_tsl_mult': 0.6384928300421349, 'bull_time_stop': 176, 'bull_use_sma': True, 'bull_use_ema': False, 'bull_use_atr': False, 'bull_use_adx': False, 'bull_use_spike': False, 'bull_rsi_required': True, 'bear_strategy': 'breakout', 'bear_bb_std_mult': 1.8105267806673577, 'bear_rsi_os': 16, 'bear_rsi_ob': 63, 'bear_adx_thresh': 25.5419812944673, 'bear_atr_min_pct': 0.016943424982580765, 'bear_atr_max_pct': 0.14003719924435565, 'bear_tp_mult': 1.3424165586758363, 'bear_tsl_mult': 0.4631095293305767, 'bear_time_stop': 137, 'bear_use_sma': True, 'bear_use_ema': True, 'bear_use_atr': False, 'bear_use_adx': False, 'bear_use_spike': False, 'bear_rsi_required': True, 'sideways_strategy': 'mean_reversion', 'sideways_bb_std_mult': 0.8922843593242922, 'sideways_rsi_os': 42, 'sideways_rsi_ob': 66, 'sideways_adx_thresh': 32.671829862017674, 'sideways_atr_min_pct': 0.026630960725310095, 'sideways_atr_max_pct': 0.06674884823645723, 'sideways_tp_mult': 1.4578164093351698, 'sideways_tsl_mult': 0.3765068258709725, 'sideways_time_stop': 229, 'sideways_use_sma': True, 'sideways_use_ema': True, 'sideways_use_atr': False, 'sideways_use_adx': False, 'sideways_use_spike': False, 'sideways_rsi_required': True}.
[I 2025-08-31 09:57:21,900] Trial 283 finished with values: [-1000000000.0, 1000000000.0] and parameters: {'p_sma': 50, 'p_std': 12, 'p_atr': 29, 'p_adx': 17, 'rsi_period': 35, 'ema1': 20, 'ema2': 35, 'slip_atr_k': 0.1488559942990116, 'slip_spread_k': 0.4363351596154533, 'spread_hl_frac': 0.010409095289722899, 'bb_std_mult': 1.7531562369929135, 'rsi_os': 24, 'rsi_ob': 77, 'vol_spike': 0.16438175949486455, 'adx_thresh': 6.632827089793613, 'atr_min_pct': 0.013385770669024862, 'atr_max_pct': 0.12182167966703406, 'tp_mult': 2.123844062328997, 'tsl_mult': 0.35134183456625445, 'strategy': 'mean_reversion', 'time_stop': 142, 'use_sma': False, 'use_atr': False, 'use_adx': False, 'use_ema': False, 'use_spike': False, 'rsi_required': True, 'edge_k': 0.9289469959056239, 'edge_cap': 0.11837499833051277, 'bull_strategy': 'mean_reversion', 'bull_bb_std_mult': 2.2592678711023355, 'bull_rsi_os': 54, 'bull_rsi_ob': 82, 'bull_adx_thresh': 22.916337556979176, 'bull_atr_min_pct': 0.02767489405299532, 'bull_atr_max_pct': 0.11322578379200628, 'bull_tp_mult': 2.9995097800968282, 'bull_tsl_mult': 0.4311559642484896, 'bull_time_stop': 242, 'bull_use_sma': True, 'bull_use_ema': True, 'bull_use_atr': False, 'bull_use_adx': True, 'bull_use_spike': True, 'bull_rsi_required': False, 'bear_strategy': 'breakout', 'bear_bb_std_mult': 2.257209393272601, 'bear_rsi_os': 19, 'bear_rsi_ob': 48, 'bear_adx_thresh': 20.838656607592597, 'bear_atr_min_pct': 0.005185674972507978, 'bear_atr_max_pct': 0.0987774370372895, 'bear_tp_mult': 1.357990584582648, 'bear_tsl_mult': 0.4493440096978739, 'bear_time_stop': 165, 'bear_use_sma': False, 'bear_use_ema': True, 'bear_use_atr': True, 'bear_use_adx': True, 'bear_use_spike': False, 'bear_rsi_required': True, 'sideways_strategy': 'breakout', 'sideways_bb_std_mult': 1.0587050266949833, 'sideways_rsi_os': 16, 'sideways_rsi_ob': 66, 'sideways_adx_thresh': 31.488510181647886, 'sideways_atr_min_pct': 0.022109953596194328, 'sideways_atr_max_pct': 0.0731939392902102, 'sideways_tp_mult': 2.7008932972636583, 'sideways_tsl_mult': 0.08276034672074999, 'sideways_time_stop': 234, 'sideways_use_sma': False, 'sideways_use_ema': False, 'sideways_use_atr': True, 'sideways_use_adx': False, 'sideways_use_spike': False, 'sideways_rsi_required': False}.
[I 2025-08-31 09:57:22,551] Trial 281 finished with values: [-1000000000.0, 1000000000.0] and parameters: {'p_sma': 48, 'p_std': 19, 'p_atr': 20, 'p_adx': 30, 'rsi_period': 48, 'ema1': 20, 'ema2': 50, 'slip_atr_k': 0.15633587782494435, 'slip_spread_k': 0.4197639890630308, 'spread_hl_frac': 0.036463226406962465, 'bb_std_mult': 1.044264169410729, 'rsi_os': 24, 'rsi_ob': 90, 'vol_spike': 0.20278950589828273, 'adx_thresh': 6.663177566016072, 'atr_min_pct': 0.010282801601658991, 'atr_max_pct': 0.015684721574367372, 'tp_mult': 1.9017037593228105, 'tsl_mult': 0.03577343088931016, 'strategy': 'mean_reversion', 'time_stop': 61, 'use_sma': False, 'use_atr': False, 'use_adx': False, 'use_ema': False, 'use_spike': False, 'rsi_required': True, 'edge_k': 1.8807434805483727, 'edge_cap': 0.3300313910666601, 'bull_strategy': 'mean_reversion', 'bull_bb_std_mult': 1.2237735675007038, 'bull_rsi_os': 41, 'bull_rsi_ob': 45, 'bull_adx_thresh': 10.496617730942134, 'bull_atr_min_pct': 0.02013332672280302, 'bull_atr_max_pct': 0.11465805211565452, 'bull_tp_mult': 2.9880379619925415, 'bull_tsl_mult': 0.5836745510566465, 'bull_time_stop': 230, 'bull_use_sma': True, 'bull_use_ema': False, 'bull_use_atr': False, 'bull_use_adx': False, 'bull_use_spike': False, 'bull_rsi_required': True, 'bear_strategy': 'breakout', 'bear_bb_std_mult': 1.8040282153149443, 'bear_rsi_os': 16, 'bear_rsi_ob': 63, 'bear_adx_thresh': 12.635045426884405, 'bear_atr_min_pct': 0.029932529884203706, 'bear_atr_max_pct': 0.1168405198300504, 'bear_tp_mult': 2.11210462850044, 'bear_tsl_mult': 0.22913362020824485, 'bear_time_stop': 135, 'bear_use_sma': False, 'bear_use_ema': True, 'bear_use_atr': False, 'bear_use_adx': True, 'bear_use_spike': False, 'bear_rsi_required': True, 'sideways_strategy': 'breakout', 'sideways_bb_std_mult': 1.0267931969073296, 'sideways_rsi_os': 27, 'sideways_rsi_ob': 71, 'sideways_adx_thresh': 33.117175371556065, 'sideways_atr_min_pct': 0.002565401613031748, 'sideways_atr_max_pct': 0.11370895661124342, 'sideways_tp_mult': 2.6986813954817195, 'sideways_tsl_mult': 0.9035727112291476, 'sideways_time_stop': 226, 'sideways_use_sma': True, 'sideways_use_ema': True, 'sideways_use_atr': False, 'sideways_use_adx': False, 'sideways_use_spike': False, 'sideways_rsi_required': False}.
[I 2025-08-31 09:57:22,817] Trial 282 finished with values: [-1000000000.0, 1000000000.0] and parameters: {'p_sma': 52, 'p_std': 53, 'p_atr': 10, 'p_adx': 13, 'rsi_period': 34, 'ema1': 20, 'ema2': 50, 'slip_atr_k': 0.03976409051072535, 'slip_spread_k': 0.17192923235061575, 'spread_hl_frac': 0.010305595494355287, 'bb_std_mult': 1.0225309281317059, 'rsi_os': 35, 'rsi_ob': 62, 'vol_spike': 0.14668209904686466, 'adx_thresh': 6.40600069554276, 'atr_min_pct': 0.0009698567200108615, 'atr_max_pct': 0.12679090817708874, 'tp_mult': 2.9930234884443516, 'tsl_mult': 0.8171318038449085, 'strategy': 'mean_reversion', 'time_stop': 15, 'use_sma': False, 'use_atr': False, 'use_adx': False, 'use_ema': False, 'use_spike': False, 'rsi_required': True, 'edge_k': 1.7537270019022004, 'edge_cap': 0.11770313434500423, 'bull_strategy': 'mean_reversion', 'bull_bb_std_mult': 1.527785623385367, 'bull_rsi_os': 41, 'bull_rsi_ob': 55, 'bull_adx_thresh': 23.02824833959839, 'bull_atr_min_pct': 0.016886941282978827, 'bull_atr_max_pct': 0.11423645188957404, 'bull_tp_mult': 2.978918302623448, 'bull_tsl_mult': 0.5748995608682043, 'bull_time_stop': 39, 'bull_use_sma': True, 'bull_use_ema': False, 'bull_use_atr': False, 'bull_use_adx': True, 'bull_use_spike': False, 'bull_rsi_required': False, 'bear_strategy': 'breakout', 'bear_bb_std_mult': 2.7960779272789513, 'bear_rsi_os': 54, 'bear_rsi_ob': 82, 'bear_adx_thresh': 21.006336552480377, 'bear_atr_min_pct': 0.020129462088759823, 'bear_atr_max_pct': 0.11679563343037948, 'bear_tp_mult': 1.8886751855143664, 'bear_tsl_mult': 0.5021857518475314, 'bear_time_stop': 256, 'bear_use_sma': False, 'bear_use_ema': True, 'bear_use_atr': False, 'bear_use_adx': True, 'bear_use_spike': False, 'bear_rsi_required': True, 'sideways_strategy': 'breakout', 'sideways_bb_std_mult': 0.5324474509740988, 'sideways_rsi_os': 6, 'sideways_rsi_ob': 61, 'sideways_adx_thresh': 31.676744879826565, 'sideways_atr_min_pct': 0.01906771520343844, 'sideways_atr_max_pct': 0.09589269593267832, 'sideways_tp_mult': 2.7807612885762, 'sideways_tsl_mult': 0.6756438246321355, 'sideways_time_stop': 227, 'sideways_use_sma': True, 'sideways_use_ema': True, 'sideways_use_atr': False, 'sideways_use_adx': False, 'sideways_use_spike': False, 'sideways_rsi_required': False}.
[I 2025-08-31 09:57:23,494] Trial 284 finished with values: [-1000000000.0, 1000000000.0] and parameters: {'p_sma': 52, 'p_std': 52, 'p_atr': 29, 'p_adx': 10, 'rsi_period': 48, 'ema1': 29, 'ema2': 35, 'slip_atr_k': 0.1152596637231817, 'slip_spread_k': 0.4429552427979151, 'spread_hl_frac': 0.010460991017390309, 'bb_std_mult': 1.0486927124149303, 'rsi_os': 32, 'rsi_ob': 77, 'vol_spike': 0.14736086478176963, 'adx_thresh': 13.035534448987205, 'atr_min_pct': 0.013366997809749719, 'atr_max_pct': 0.14212593205037324, 'tp_mult': 2.843849304616633, 'tsl_mult': 0.7694670719276422, 'strategy': 'mean_reversion', 'time_stop': 14, 'use_sma': False, 'use_atr': False, 'use_adx': False, 'use_ema': False, 'use_spike': False, 'rsi_required': True, 'edge_k': 1.7509375327311367, 'edge_cap': 0.11852235280462982, 'bull_strategy': 'mean_reversion', 'bull_bb_std_mult': 1.2010122773529583, 'bull_rsi_os': 13, 'bull_rsi_ob': 49, 'bull_adx_thresh': 30.659121039573062, 'bull_atr_min_pct': 0.0180463882831479, 'bull_atr_max_pct': 0.11457211210205011, 'bull_tp_mult': 1.3968820777195552, 'bull_tsl_mult': 0.5771843484356567, 'bull_time_stop': 224, 'bull_use_sma': True, 'bull_use_ema': True, 'bull_use_atr': False, 'bull_use_adx': True, 'bull_use_spike': True, 'bull_rsi_required': False, 'bear_strategy': 'breakout', 'bear_bb_std_mult': 1.4377988898175773, 'bear_rsi_os': 14, 'bear_rsi_ob': 79, 'bear_adx_thresh': 20.784156549775993, 'bear_atr_min_pct': 0.024984594518108364, 'bear_atr_max_pct': 0.14408341233569408, 'bear_tp_mult': 1.8888058012683233, 'bear_tsl_mult': 0.7601659463692807, 'bear_time_stop': 154, 'bear_use_sma': False, 'bear_use_ema': True, 'bear_use_atr': True, 'bear_use_adx': True, 'bear_use_spike': False, 'bear_rsi_required': True, 'sideways_strategy': 'breakout', 'sideways_bb_std_mult': 0.5215843373358313, 'sideways_rsi_os': 27, 'sideways_rsi_ob': 76, 'sideways_adx_thresh': 34.336183976653025, 'sideways_atr_min_pct': 0.02181947909250464, 'sideways_atr_max_pct': 0.07083445484456609, 'sideways_tp_mult': 1.5595854451146842, 'sideways_tsl_mult': 0.08766964945810617, 'sideways_time_stop': 235, 'sideways_use_sma': False, 'sideways_use_ema': False, 'sideways_use_atr': True, 'sideways_use_adx': False, 'sideways_use_spike': False, 'sideways_rsi_required': False}.
[I 2025-08-31 09:57:58,213] Trial 286 finished with values: [-1000000000.0, 1000000000.0] and parameters: {'p_sma': 29, 'p_std': 15, 'p_atr': 30, 'p_adx': 27, 'rsi_period': 33, 'ema1': 19, 'ema2': 17, 'slip_atr_k': 0.16220878544172118, 'slip_spread_k': 0.8790025313100018, 'spread_hl_frac': 0.020106611685061015, 'bb_std_mult': 0.9875011284590074, 'rsi_os': 35, 'rsi_ob': 58, 'vol_spike': 0.14564857758886807, 'adx_thresh': 28.76434165473431, 'atr_min_pct': 0.01242119703527191, 'atr_max_pct': 0.026260738582065755, 'tp_mult': 2.2247001719001442, 'tsl_mult': 0.6109298282000157, 'strategy': 'breakout', 'time_stop': 17, 'use_sma': False, 'use_atr': False, 'use_adx': False, 'use_ema': False, 'use_spike': False, 'rsi_required': False, 'edge_k': 1.2274025550102625, 'edge_cap': 0.06956855994372349, 'bull_strategy': 'mean_reversion', 'bull_bb_std_mult': 1.5225179147040613, 'bull_rsi_os': 17, 'bull_rsi_ob': 66, 'bull_adx_thresh': 30.553523878696012, 'bull_atr_min_pct': 0.012070671450465637, 'bull_atr_max_pct': 0.12699234517804436, 'bull_tp_mult': 1.2913384782448312, 'bull_tsl_mult': 0.5712009405001771, 'bull_time_stop': 101, 'bull_use_sma': False, 'bull_use_ema': False, 'bull_use_atr': False, 'bull_use_adx': True, 'bull_use_spike': True, 'bull_rsi_required': False, 'bear_strategy': 'mean_reversion', 'bear_bb_std_mult': 1.6691547798598272, 'bear_rsi_os': 14, 'bear_rsi_ob': 57, 'bear_adx_thresh': 21.464211941139553, 'bear_atr_min_pct': 0.020418388504312764, 'bear_atr_max_pct': 0.10407783033854023, 'bear_tp_mult': 1.2591913014352754, 'bear_tsl_mult': 0.7618371954731032, 'bear_time_stop': 281, 'bear_use_sma': False, 'bear_use_ema': True, 'bear_use_atr': True, 'bear_use_adx': True, 'bear_use_spike': False, 'bear_rsi_required': True, 'sideways_strategy': 'breakout', 'sideways_bb_std_mult': 1.2746372862178408, 'sideways_rsi_os': 38, 'sideways_rsi_ob': 74, 'sideways_adx_thresh': 34.37605436760065, 'sideways_atr_min_pct': 0.007293707636579331, 'sideways_atr_max_pct': 0.02927316029500383, 'sideways_tp_mult': 1.6625839388500971, 'sideways_tsl_mult': 0.6421638150375811, 'sideways_time_stop': 236, 'sideways_use_sma': False, 'sideways_use_ema': False, 'sideways_use_atr': True, 'sideways_use_adx': True, 'sideways_use_spike': False, 'sideways_rsi_required': False}.
[I 2025-08-31 09:57:58,602] Trial 287 finished with values: [-1000000000.0, 1000000000.0] and parameters: {'p_sma': 46, 'p_std': 11, 'p_atr': 30, 'p_adx': 10, 'rsi_period': 73, 'ema1': 19, 'ema2': 10, 'slip_atr_k': 0.16263663253085134, 'slip_spread_k': 0.4621202154225443, 'spread_hl_frac': 0.0034255752608915377, 'bb_std_mult': 0.9033619899219527, 'rsi_os': 16, 'rsi_ob': 49, 'vol_spike': 0.11218781092046587, 'adx_thresh': 5.816821694667177, 'atr_min_pct': 0.02198060788398169, 'atr_max_pct': 0.1331080984574445, 'tp_mult': 2.845209703553538, 'tsl_mult': 0.8467232411143815, 'strategy': 'breakout', 'time_stop': 124, 'use_sma': False, 'use_atr': False, 'use_adx': False, 'use_ema': False, 'use_spike': False, 'rsi_required': False, 'edge_k': 1.8104079335757683, 'edge_cap': 0.23564913541153082, 'bull_strategy': 'mean_reversion', 'bull_bb_std_mult': 1.1686260328658091, 'bull_rsi_os': 46, 'bull_rsi_ob': 69, 'bull_adx_thresh': 30.67605711689545, 'bull_atr_min_pct': 0.018420238058043256, 'bull_atr_max_pct': 0.12633937096702177, 'bull_tp_mult': 1.393562440054553, 'bull_tsl_mult': 0.46002058099451015, 'bull_time_stop': 222, 'bull_use_sma': False, 'bull_use_ema': True, 'bull_use_atr': False, 'bull_use_adx': False, 'bull_use_spike': True, 'bull_rsi_required': True, 'bear_strategy': 'mean_reversion', 'bear_bb_std_mult': 2.703822023362115, 'bear_rsi_os': 54, 'bear_rsi_ob': 76, 'bear_adx_thresh': 21.80708944248398, 'bear_atr_min_pct': 0.025135872117733812, 'bear_atr_max_pct': 0.0682514899778963, 'bear_tp_mult': 2.732812419616577, 'bear_tsl_mult': 0.7562667107365056, 'bear_time_stop': 154, 'bear_use_sma': False, 'bear_use_ema': True, 'bear_use_atr': True, 'bear_use_adx': True, 'bear_use_spike': False, 'bear_rsi_required': True, 'sideways_strategy': 'breakout', 'sideways_bb_std_mult': 1.1575543240424284, 'sideways_rsi_os': 34, 'sideways_rsi_ob': 74, 'sideways_adx_thresh': 34.41459433212074, 'sideways_atr_min_pct': 0.0015484559764709636, 'sideways_atr_max_pct': 0.07038440270185092, 'sideways_tp_mult': 1.6695449285533488, 'sideways_tsl_mult': 0.9301541496367512, 'sideways_time_stop': 237, 'sideways_use_sma': False, 'sideways_use_ema': False, 'sideways_use_atr': True, 'sideways_use_adx': True, 'sideways_use_spike': False, 'sideways_rsi_required': False}.
[I 2025-08-31 09:57:58,836] Trial 288 finished with values: [-1000000000.0, 1000000000.0] and parameters: {'p_sma': 20, 'p_std': 16, 'p_atr': 30, 'p_adx': 25, 'rsi_period': 19, 'ema1': 5, 'ema2': 18, 'slip_atr_k': 0.1625612772457054, 'slip_spread_k': 0.8813766381492367, 'spread_hl_frac': 0.0015888419164986622, 'bb_std_mult': 0.9847047906899087, 'rsi_os': 51, 'rsi_ob': 74, 'vol_spike': 0.11269940859045643, 'adx_thresh': 7.604931439814774, 'atr_min_pct': 0.012621862379627272, 'atr_max_pct': 0.1343306568155459, 'tp_mult': 2.678308140879952, 'tsl_mult': 0.5440793022191636, 'strategy': 'breakout', 'time_stop': 123, 'use_sma': False, 'use_atr': False, 'use_adx': True, 'use_ema': False, 'use_spike': False, 'rsi_required': False, 'edge_k': 1.8080766923088047, 'edge_cap': 0.14508440210758444, 'bull_strategy': 'mean_reversion', 'bull_bb_std_mult': 2.7480970608881607, 'bull_rsi_os': 35, 'bull_rsi_ob': 66, 'bull_adx_thresh': 28.803136331508227, 'bull_atr_min_pct': 0.012168010984321818, 'bull_atr_max_pct': 0.12653469351027063, 'bull_tp_mult': 2.4360385694792552, 'bull_tsl_mult': 0.599811428504008, 'bull_time_stop': 131, 'bull_use_sma': False, 'bull_use_ema': False, 'bull_use_atr': False, 'bull_use_adx': False, 'bull_use_spike': False, 'bull_rsi_required': True, 'bear_strategy': 'mean_reversion', 'bear_bb_std_mult': 1.7072955492147086, 'bear_rsi_os': 54, 'bear_rsi_ob': 76, 'bear_adx_thresh': 21.806272950959556, 'bear_atr_min_pct': 0.02033698406212948, 'bear_atr_max_pct': 0.1383149834430448, 'bear_tp_mult': 1.2498573977924738, 'bear_tsl_mult': 0.5338395418288666, 'bear_time_stop': 239, 'bear_use_sma': False, 'bear_use_ema': True, 'bear_use_atr': False, 'bear_use_adx': True, 'bear_use_spike': False, 'bear_rsi_required': True, 'sideways_strategy': 'breakout', 'sideways_bb_std_mult': 1.1344072580542575, 'sideways_rsi_os': 37, 'sideways_rsi_ob': 62, 'sideways_adx_thresh': 33.92671007333867, 'sideways_atr_min_pct': 0.010155080912215987, 'sideways_atr_max_pct': 0.08957915345499895, 'sideways_tp_mult': 2.654115885815555, 'sideways_tsl_mult': 0.17062044486056455, 'sideways_time_stop': 244, 'sideways_use_sma': True, 'sideways_use_ema': True, 'sideways_use_atr': False, 'sideways_use_adx': True, 'sideways_use_spike': False, 'sideways_rsi_required': False}.
