[I 2025-08-31 11:01:53,531] Trial 783 finished with values: [-1000000000.0, 1000000000.0] and parameters: {'p_sma': 15, 'p_std': 31, 'p_atr': 30, 'p_adx': 9, 'rsi_period': 58, 'ema1': 17, 'ema2': 35, 'slip_atr_k': 0.1987252094502672, 'slip_spread_k': 0.0946095647702949, 'spread_hl_frac': 0.010280593191947728, 'bb_std_mult': 1.1023180497082397, 'rsi_os': 39, 'rsi_ob': 53, 'vol_spike': 0.2796377986877543, 'adx_thresh': 23.294444087114933, 'atr_min_pct': 0.012412985794997231, 'atr_max_pct': 0.11622427548030771, 'tp_mult': 2.841409653685007, 'tsl_mult': 0.06093073880136948, 'strategy': 'breakout', 'time_stop': 274, 'use_sma': False, 'use_atr': True, 'use_adx': False, 'use_ema': True, 'use_spike': False, 'rsi_required': True, 'edge_k': 1.9978712995327972, 'edge_cap': 0.11625657817341101, 'bull_strategy': 'mean_reversion', 'bull_bb_std_mult': 2.4626670344891703, 'bull_rsi_os': 27, 'bull_rsi_ob': 56, 'bull_adx_thresh': 31.385593001536733, 'bull_atr_min_pct': 0.00952932270971688, 'bull_atr_max_pct': 0.1431036065852736, 'bull_tp_mult': 1.1146219480044197, 'bull_tsl_mult': 0.28317461171986225, 'bull_time_stop': 77, 'bull_use_sma': True, 'bull_use_ema': False, 'bull_use_atr': False, 'bull_use_adx': False, 'bull_use_spike': False, 'bull_rsi_required': True, 'bear_strategy': 'breakout', 'bear_bb_std_mult': 2.798738801891122, 'bear_rsi_os': 26, 'bear_rsi_ob': 48, 'bear_adx_thresh': 21.51207279059106, 'bear_atr_min_pct': 0.00787624291530932, 'bear_atr_max_pct': 0.10952030915101077, 'bear_tp_mult': 2.0191980127505693, 'bear_tsl_mult': 0.465416706072543, 'bear_time_stop': 262, 'bear_use_sma': True, 'bear_use_ema': True, 'bear_use_atr': False, 'bear_use_adx': True, 'bear_use_spike': True, 'bear_rsi_required': False, 'sideways_strategy': 'breakout', 'sideways_bb_std_mult': 1.3578942627289554, 'sideways_rsi_os': 35, 'sideways_rsi_ob': 93, 'sideways_adx_thresh': 31.477564458647848, 'sideways_atr_min_pct': 0.0014896016550561121, 'sideways_atr_max_pct': 0.10655505149762758, 'sideways_tp_mult': 2.5236486629081414, 'sideways_tsl_mult': 0.014488309577933789, 'sideways_time_stop': 231, 'sideways_use_sma': True, 'sideways_use_ema': True, 'sideways_use_atr': False, 'sideways_use_adx': False, 'sideways_use_spike': True, 'sideways_rsi_required': False}.
[I 2025-08-31 11:01:53,713] Trial 784 finished with values: [-1000000000.0, 1000000000.0] and parameters: {'p_sma': 12, 'p_std': 47, 'p_atr': 30, 'p_adx': 13, 'rsi_period': 67, 'ema1': 17, 'ema2': 35, 'slip_atr_k': 0.028333338837909477, 'slip_spread_k': 0.08784100461404933, 'spread_hl_frac': 0.025481017511927304, 'bb_std_mult': 1.0816554319606588, 'rsi_os': 40, 'rsi_ob': 53, 'vol_spike': 0.27200835659295497, 'adx_thresh': 23.235891575191133, 'atr_min_pct': 0.010568607936174711, 'atr_max_pct': 0.1164354390410725, 'tp_mult': 2.6098199142050076, 'tsl_mult': 0.061210663232011936, 'strategy': 'breakout', 'time_stop': 142, 'use_sma': False, 'use_atr': True, 'use_adx': False, 'use_ema': True, 'use_spike': True, 'rsi_required': True, 'edge_k': 1.9343251419975374, 'edge_cap': 0.11026569382741574, 'bull_strategy': 'mean_reversion', 'bull_bb_std_mult': 1.2470575014619, 'bull_rsi_os': 27, 'bull_rsi_ob': 65, 'bull_adx_thresh': 34.136893372595964, 'bull_atr_min_pct': 0.007489541265892946, 'bull_atr_max_pct': 0.0312128289940532, 'bull_tp_mult': 2.9993404809505293, 'bull_tsl_mult': 0.9805081330250408, 'bull_time_stop': 47, 'bull_use_sma': True, 'bull_use_ema': True, 'bull_use_atr': False, 'bull_use_adx': False, 'bull_use_spike': False, 'bull_rsi_required': True, 'bear_strategy': 'breakout', 'bear_bb_std_mult': 1.1049739105452836, 'bear_rsi_os': 26, 'bear_rsi_ob': 54, 'bear_adx_thresh': 16.897225795631726, 'bear_atr_min_pct': 0.006671209228915016, 'bear_atr_max_pct': 0.03642091982928393, 'bear_tp_mult': 1.9352226342249632, 'bear_tsl_mult': 0.11342682258520648, 'bear_time_stop': 217, 'bear_use_sma': True, 'bear_use_ema': True, 'bear_use_atr': True, 'bear_use_adx': True, 'bear_use_spike': True, 'bear_rsi_required': False, 'sideways_strategy': 'breakout', 'sideways_bb_std_mult': 2.3056539261214075, 'sideways_rsi_os': 7, 'sideways_rsi_ob': 50, 'sideways_adx_thresh': 20.961789566856208, 'sideways_atr_min_pct': 0.0015497758953653042, 'sideways_atr_max_pct': 0.10626002994590975, 'sideways_tp_mult': 1.956106898459357, 'sideways_tsl_mult': 0.08647350077226743, 'sideways_time_stop': 274, 'sideways_use_sma': False, 'sideways_use_ema': True, 'sideways_use_atr': False, 'sideways_use_adx': False, 'sideways_use_spike': True, 'sideways_rsi_required': False}.
[I 2025-08-31 11:01:55,255] Trial 785 finished with values: [-0.05153579926295693, 0.051370416784366074] and parameters: {'p_sma': 56, 'p_std': 24, 'p_atr': 30, 'p_adx': 12, 'rsi_period': 46, 'ema1': 13, 'ema2': 35, 'slip_atr_k': 0.18530513121216333, 'slip_spread_k': 0.29695524740462714, 'spread_hl_frac': 0.04761734841097217, 'bb_std_mult': 1.0989234228369213, 'rsi_os': 41, 'rsi_ob': 67, 'vol_spike': 0.09856055626182356, 'adx_thresh': 23.057036896206984, 'atr_min_pct': 0.01501612905514352, 'atr_max_pct': 0.11788786991145914, 'tp_mult': 2.839059726239794, 'tsl_mult': 0.06565132315659361, 'strategy': 'breakout', 'time_stop': 142, 'use_sma': False, 'use_atr': True, 'use_adx': False, 'use_ema': True, 'use_spike': True, 'rsi_required': True, 'edge_k': 1.2764318875362117, 'edge_cap': 0.36440141362915524, 'bull_strategy': 'mean_reversion', 'bull_bb_std_mult': 1.273866066475897, 'bull_rsi_os': 27, 'bull_rsi_ob': 65, 'bull_adx_thresh': 22.356795218208184, 'bull_atr_min_pct': 0.007781107220856567, 'bull_atr_max_pct': 0.0918304305860316, 'bull_tp_mult': 2.3854448953845226, 'bull_tsl_mult': 0.8612386995418375, 'bull_time_stop': 128, 'bull_use_sma': True, 'bull_use_ema': True, 'bull_use_atr': False, 'bull_use_adx': True, 'bull_use_spike': False, 'bull_rsi_required': True, 'bear_strategy': 'breakout', 'bear_bb_std_mult': 2.766877701143527, 'bear_rsi_os': 23, 'bear_rsi_ob': 80, 'bear_adx_thresh': 28.448477624896782, 'bear_atr_min_pct': 0.007836664766897674, 'bear_atr_max_pct': 0.11040454117425272, 'bear_tp_mult': 1.3543747923265692, 'bear_tsl_mult': 0.45861847114432286, 'bear_time_stop': 262, 'bear_use_sma': True, 'bear_use_ema': True, 'bear_use_atr': True, 'bear_use_adx': False, 'bear_use_spike': True, 'bear_rsi_required': False, 'sideways_strategy': 'breakout', 'sideways_bb_std_mult': 0.6143815043600449, 'sideways_rsi_os': 42, 'sideways_rsi_ob': 50, 'sideways_adx_thresh': 20.169798073529368, 'sideways_atr_min_pct': 0.001649980045974742, 'sideways_atr_max_pct': 0.10197002246333797, 'sideways_tp_mult': 2.530000832068989, 'sideways_tsl_mult': 0.08810532314439287, 'sideways_time_stop': 230, 'sideways_use_sma': False, 'sideways_use_ema': True, 'sideways_use_atr': False, 'sideways_use_adx': False, 'sideways_use_spike': True, 'sideways_rsi_required': False}.
[I 2025-08-31 11:01:55,657] Trial 786 finished with values: [-1000000000.0, 1000000000.0] and parameters: {'p_sma': 9, 'p_std': 54, 'p_atr': 30, 'p_adx': 28, 'rsi_period': 21, 'ema1': 17, 'ema2': 54, 'slip_atr_k': 0.18348518948087172, 'slip_spread_k': 0.0009166077464440314, 'spread_hl_frac': 0.04760363561115197, 'bb_std_mult': 1.3119653565773226, 'rsi_os': 41, 'rsi_ob': 81, 'vol_spike': 0.2725476954983388, 'adx_thresh': 24.015630603774284, 'atr_min_pct': 0.010607403392876484, 'atr_max_pct': 0.05808040444563632, 'tp_mult': 2.999416829769455, 'tsl_mult': 0.9991445801423133, 'strategy': 'breakout', 'time_stop': 274, 'use_sma': False, 'use_atr': True, 'use_adx': False, 'use_ema': True, 'use_spike': True, 'rsi_required': False, 'edge_k': 1.9950565407440886, 'edge_cap': 0.36258069092962597, 'bull_strategy': 'mean_reversion', 'bull_bb_std_mult': 3.5665050611058415, 'bull_rsi_os': 27, 'bull_rsi_ob': 85, 'bull_adx_thresh': 31.193973030819198, 'bull_atr_min_pct': 0.00757772176114666, 'bull_atr_max_pct': 0.1067269523722667, 'bull_tp_mult': 2.0857691357758283, 'bull_tsl_mult': 0.9766004679627255, 'bull_time_stop': 91, 'bull_use_sma': True, 'bull_use_ema': True, 'bull_use_atr': False, 'bull_use_adx': True, 'bull_use_spike': True, 'bull_rsi_required': True, 'bear_strategy': 'breakout', 'bear_bb_std_mult': 2.611305481520312, 'bear_rsi_os': 30, 'bear_rsi_ob': 75, 'bear_adx_thresh': 17.095848368393952, 'bear_atr_min_pct': 0.007951985254751371, 'bear_atr_max_pct': 0.10934582358420684, 'bear_tp_mult': 2.0233437270758654, 'bear_tsl_mult': 0.5083839738624302, 'bear_time_stop': 252, 'bear_use_sma': True, 'bear_use_ema': True, 'bear_use_atr': True, 'bear_use_adx': False, 'bear_use_spike': True, 'bear_rsi_required': True, 'sideways_strategy': 'breakout', 'sideways_bb_std_mult': 0.8739804459114702, 'sideways_rsi_os': 13, 'sideways_rsi_ob': 92, 'sideways_adx_thresh': 29.233548943959107, 'sideways_atr_min_pct': 0.005123394742951931, 'sideways_atr_max_pct': 0.012233225169488951, 'sideways_tp_mult': 2.9972638517121384, 'sideways_tsl_mult': 0.3377134761167706, 'sideways_time_stop': 213, 'sideways_use_sma': False, 'sideways_use_ema': True, 'sideways_use_atr': True, 'sideways_use_adx': False, 'sideways_use_spike': True, 'sideways_rsi_required': False}.
[I 2025-08-31 11:02:28,648] Trial 789 finished with values: [-1000000000.0, 1000000000.0] and parameters: {'p_sma': 9, 'p_std': 48, 'p_atr': 25, 'p_adx': 8, 'rsi_period': 25, 'ema1': 19, 'ema2': 13, 'slip_atr_k': 0.17699505094155585, 'slip_spread_k': 0.11770154854196602, 'spread_hl_frac': 0.00864591503547307, 'bb_std_mult': 1.3201255209171339, 'rsi_os': 43, 'rsi_ob': 77, 'vol_spike': 0.029354890805782324, 'adx_thresh': 16.591741979457087, 'atr_min_pct': 0.011784478293776272, 'atr_max_pct': 0.057633341342497105, 'tp_mult': 1.6412150731393875, 'tsl_mult': 0.10312096484096336, 'strategy': 'breakout', 'time_stop': 213, 'use_sma': False, 'use_atr': False, 'use_adx': True, 'use_ema': True, 'use_spike': False, 'rsi_required': False, 'edge_k': 1.8116006523892825, 'edge_cap': 0.2735461530036344, 'bull_strategy': 'mean_reversion', 'bull_bb_std_mult': 3.5546855944689084, 'bull_rsi_os': 24, 'bull_rsi_ob': 67, 'bull_adx_thresh': 28.675736080840142, 'bull_atr_min_pct': 0.021844915987423313, 'bull_atr_max_pct': 0.10664933264716248, 'bull_tp_mult': 2.079996327770777, 'bull_tsl_mult': 0.7858684622688734, 'bull_time_stop': 92, 'bull_use_sma': True, 'bull_use_ema': False, 'bull_use_atr': False, 'bull_use_adx': True, 'bull_use_spike': True, 'bull_rsi_required': False, 'bear_strategy': 'breakout', 'bear_bb_std_mult': 3.320319058683312, 'bear_rsi_os': 30, 'bear_rsi_ob': 75, 'bear_adx_thresh': 5.895092311352105, 'bear_atr_min_pct': 0.006777142262900349, 'bear_atr_max_pct': 0.06487241436300756, 'bear_tp_mult': 2.3488443642138925, 'bear_tsl_mult': 0.5154261300948727, 'bear_time_stop': 76, 'bear_use_sma': False, 'bear_use_ema': True, 'bear_use_atr': False, 'bear_use_adx': False, 'bear_use_spike': True, 'bear_rsi_required': True, 'sideways_strategy': 'breakout', 'sideways_bb_std_mult': 0.8715672769826355, 'sideways_rsi_os': 37, 'sideways_rsi_ob': 92, 'sideways_adx_thresh': 29.208373490767404, 'sideways_atr_min_pct': 0.022978504270068686, 'sideways_atr_max_pct': 0.10145903044959989, 'sideways_tp_mult': 2.9690860759329603, 'sideways_tsl_mult': 0.046712252395201326, 'sideways_time_stop': 213, 'sideways_use_sma': True, 'sideways_use_ema': False, 'sideways_use_atr': True, 'sideways_use_adx': True, 'sideways_use_spike': True, 'sideways_rsi_required': False}.
[I 2025-08-31 11:02:28,948] Trial 788 finished with values: [-1000000000.0, 1000000000.0] and parameters: {'p_sma': 9, 'p_std': 48, 'p_atr': 23, 'p_adx': 9, 'rsi_period': 21, 'ema1': 12, 'ema2': 46, 'slip_atr_k': 0.17595194570618686, 'slip_spread_k': 0.11644073255479276, 'spread_hl_frac': 0.047515997207504684, 'bb_std_mult': 2.6358425385620374, 'rsi_os': 41, 'rsi_ob': 77, 'vol_spike': 0.21946911457863552, 'adx_thresh': 16.387673974544185, 'atr_min_pct': 0.0299900967420832, 'atr_max_pct': 0.11898164873502162, 'tp_mult': 1.396488546532408, 'tsl_mult': 0.8440013862794429, 'strategy': 'breakout', 'time_stop': 294, 'use_sma': False, 'use_atr': False, 'use_adx': True, 'use_ema': True, 'use_spike': True, 'rsi_required': False, 'edge_k': 1.0218422559115183, 'edge_cap': 0.1438269993591879, 'bull_strategy': 'mean_reversion', 'bull_bb_std_mult': 0.5650299421440559, 'bull_rsi_os': 24, 'bull_rsi_ob': 70, 'bull_adx_thresh': 21.52948228846681, 'bull_atr_min_pct': 0.013655173548132801, 'bull_atr_max_pct': 0.08905683879673192, 'bull_tp_mult': 2.2458221692577145, 'bull_tsl_mult': 0.7746988195606279, 'bull_time_stop': 128, 'bull_use_sma': True, 'bull_use_ema': True, 'bull_use_atr': False, 'bull_use_adx': True, 'bull_use_spike': True, 'bull_rsi_required': False, 'bear_strategy': 'breakout', 'bear_bb_std_mult': 3.3083239198576733, 'bear_rsi_os': 23, 'bear_rsi_ob': 75, 'bear_adx_thresh': 23.385144457939045, 'bear_atr_min_pct': 0.00788787107445352, 'bear_atr_max_pct': 0.08556035316585069, 'bear_tp_mult': 2.3431006162200876, 'bear_tsl_mult': 0.5175472165654522, 'bear_time_stop': 5, 'bear_use_sma': False, 'bear_use_ema': True, 'bear_use_atr': True, 'bear_use_adx': False, 'bear_use_spike': True, 'bear_rsi_required': True, 'sideways_strategy': 'breakout', 'sideways_bb_std_mult': 0.9103246633786369, 'sideways_rsi_os': 23, 'sideways_rsi_ob': 75, 'sideways_adx_thresh': 29.22454569823979, 'sideways_atr_min_pct': 0.023228261405594197, 'sideways_atr_max_pct': 0.10144108882818527, 'sideways_tp_mult': 2.75570923308893, 'sideways_tsl_mult': 0.04943568221561137, 'sideways_time_stop': 215, 'sideways_use_sma': False, 'sideways_use_ema': False, 'sideways_use_atr': True, 'sideways_use_adx': True, 'sideways_use_spike': True, 'sideways_rsi_required': False}.
[I 2025-08-31 11:02:29,041] Trial 790 finished with values: [-1000000000.0, 1000000000.0] and parameters: {'p_sma': 10, 'p_std': 48, 'p_atr': 29, 'p_adx': 8, 'rsi_period': 12, 'ema1': 19, 'ema2': 40, 'slip_atr_k': 0.17797814555605557, 'slip_spread_k': 0.5801820780390421, 'spread_hl_frac': 0.041503997415565756, 'bb_std_mult': 2.6296316909920074, 'rsi_os': 33, 'rsi_ob': 85, 'vol_spike': 0.05855297661277026, 'adx_thresh': 16.442916227519067, 'atr_min_pct': 0.011818734811926185, 'atr_max_pct': 0.03759943369891338, 'tp_mult': 2.0646973468020042, 'tsl_mult': 0.745219168645149, 'strategy': 'breakout', 'time_stop': 129, 'use_sma': False, 'use_atr': False, 'use_adx': True, 'use_ema': True, 'use_spike': False, 'rsi_required': False, 'edge_k': 1.8086079207693577, 'edge_cap': 0.1420152924787375, 'bull_strategy': 'mean_reversion', 'bull_bb_std_mult': 1.1519535034141488, 'bull_rsi_os': 45, 'bull_rsi_ob': 81, 'bull_adx_thresh': 12.609030344281674, 'bull_atr_min_pct': 0.029287504917723493, 'bull_atr_max_pct': 0.08958730167343444, 'bull_tp_mult': 2.2623609182232696, 'bull_tsl_mult': 0.9227502591446373, 'bull_time_stop': 61, 'bull_use_sma': True, 'bull_use_ema': False, 'bull_use_atr': True, 'bull_use_adx': False, 'bull_use_spike': True, 'bull_rsi_required': False, 'bear_strategy': 'breakout', 'bear_bb_std_mult': 2.69393930501768, 'bear_rsi_os': 28, 'bear_rsi_ob': 80, 'bear_adx_thresh': 27.545851418870875, 'bear_atr_min_pct': 0.00572475716925539, 'bear_atr_max_pct': 0.10013520488760107, 'bear_tp_mult': 2.859732762516526, 'bear_tsl_mult': 0.6901966167378943, 'bear_time_stop': 85, 'bear_use_sma': False, 'bear_use_ema': True, 'bear_use_atr': False, 'bear_use_adx': True, 'bear_use_spike': True, 'bear_rsi_required': True, 'sideways_strategy': 'mean_reversion', 'sideways_bb_std_mult': 1.0550509551678362, 'sideways_rsi_os': 37, 'sideways_rsi_ob': 91, 'sideways_adx_thresh': 31.42682754053334, 'sideways_atr_min_pct': 0.00048746462671710004, 'sideways_atr_max_pct': 0.10255273558735939, 'sideways_tp_mult': 2.7760335211396834, 'sideways_tsl_mult': 0.049201325767025586, 'sideways_time_stop': 248, 'sideways_use_sma': True, 'sideways_use_ema': False, 'sideways_use_atr': True, 'sideways_use_adx': True, 'sideways_use_spike': True, 'sideways_rsi_required': True}.
[I 2025-08-31 11:02:29,188] Trial 787 finished with values: [-1000000000.0, 1000000000.0] and parameters: {'p_sma': 10, 'p_std': 47, 'p_atr': 29, 'p_adx': 9, 'rsi_period': 46, 'ema1': 19, 'ema2': 39, 'slip_atr_k': 0.1765661428286028, 'slip_spread_k': 0.7841498014171165, 'spread_hl_frac': 0.008787746465147774, 'bb_std_mult': 1.2726601271445135, 'rsi_os': 41, 'rsi_ob': 81, 'vol_spike': 0.2723584533431571, 'adx_thresh': 25.131764942354003, 'atr_min_pct': 0.0085454594674591, 'atr_max_pct': 0.022553358642662023, 'tp_mult': 1.2177278937013227, 'tsl_mult': 0.2685890071841132, 'strategy': 'breakout', 'time_stop': 115, 'use_sma': False, 'use_atr': False, 'use_adx': False, 'use_ema': True, 'use_spike': True, 'rsi_required': False, 'edge_k': 1.9287023639057919, 'edge_cap': 0.13904163095107752, 'bull_strategy': 'mean_reversion', 'bull_bb_std_mult': 3.539382129761097, 'bull_rsi_os': 48, 'bull_rsi_ob': 65, 'bull_adx_thresh': 22.406331511503968, 'bull_atr_min_pct': 0.021954785558668442, 'bull_atr_max_pct': 0.010026867570545037, 'bull_tp_mult': 1.0544983401091887, 'bull_tsl_mult': 0.9803972787983338, 'bull_time_stop': 124, 'bull_use_sma': True, 'bull_use_ema': True, 'bull_use_atr': False, 'bull_use_adx': True, 'bull_use_spike': True, 'bull_rsi_required': True, 'bear_strategy': 'breakout', 'bear_bb_std_mult': 0.7303894143824505, 'bear_rsi_os': 13, 'bear_rsi_ob': 80, 'bear_adx_thresh': 20.898385434277774, 'bear_atr_min_pct': 0.028977452382132812, 'bear_atr_max_pct': 0.036574864184718586, 'bear_tp_mult': 2.0451216506194005, 'bear_tsl_mult': 0.5071494936555091, 'bear_time_stop': 252, 'bear_use_sma': True, 'bear_use_ema': True, 'bear_use_atr': True, 'bear_use_adx': False, 'bear_use_spike': True, 'bear_rsi_required': True, 'sideways_strategy': 'breakout', 'sideways_bb_std_mult': 1.108443825101932, 'sideways_rsi_os': 7, 'sideways_rsi_ob': 91, 'sideways_adx_thresh': 29.01612978631741, 'sideways_atr_min_pct': 0.009287979504438442, 'sideways_atr_max_pct': 0.10180911489053183, 'sideways_tp_mult': 2.999382598840782, 'sideways_tsl_mult': 0.050861555183626304, 'sideways_time_stop': 274, 'sideways_use_sma': False, 'sideways_use_ema': True, 'sideways_use_atr': True, 'sideways_use_adx': True, 'sideways_use_spike': True, 'sideways_rsi_required': False}.
[I 2025-08-31 11:03:02,567] Trial 791 finished with values: [-1000000000.0, 1000000000.0] and parameters: {'p_sma': 10, 'p_std': 47, 'p_atr': 29, 'p_adx': 9, 'rsi_period': 30, 'ema1': 19, 'ema2': 40, 'slip_atr_k': 0.19376293341228604, 'slip_spread_k': 0.07560598721648461, 'spread_hl_frac': 0.011424059425777486, 'bb_std_mult': 1.0341859222467764, 'rsi_os': 46, 'rsi_ob': 85, 'vol_spike': 0.055064521673119274, 'adx_thresh': 25.082451189568516, 'atr_min_pct': 0.008606741962442929, 'atr_max_pct': 0.12022604635447608, 'tp_mult': 1.2024971585415418, 'tsl_mult': 0.2733175728934285, 'strategy': 'breakout', 'time_stop': 129, 'use_sma': False, 'use_atr': False, 'use_adx': False, 'use_ema': True, 'use_spike': False, 'rsi_required': True, 'edge_k': 0.5803129096546087, 'edge_cap': 0.8743857676161857, 'bull_strategy': 'mean_reversion', 'bull_bb_std_mult': 1.1593910396046747, 'bull_rsi_os': 18, 'bull_rsi_ob': 64, 'bull_adx_thresh': 6.173286153816349, 'bull_atr_min_pct': 0.0023234933564776263, 'bull_atr_max_pct': 0.09090246549288604, 'bull_tp_mult': 1.9448172494386264, 'bull_tsl_mult': 0.752339812973215, 'bull_time_stop': 61, 'bull_use_sma': True, 'bull_use_ema': False, 'bull_use_atr': True, 'bull_use_adx': False, 'bull_use_spike': False, 'bull_rsi_required': True, 'bear_strategy': 'breakout', 'bear_bb_std_mult': 2.8797827795767765, 'bear_rsi_os': 19, 'bear_rsi_ob': 58, 'bear_adx_thresh': 20.89420518312606, 'bear_atr_min_pct': 0.005816921691368401, 'bear_atr_max_pct': 0.1001181474707777, 'bear_tp_mult': 1.9903099880991435, 'bear_tsl_mult': 0.6891419361325023, 'bear_time_stop': 88, 'bear_use_sma': False, 'bear_use_ema': True, 'bear_use_atr': False, 'bear_use_adx': True, 'bear_use_spike': True, 'bear_rsi_required': True, 'sideways_strategy': 'mean_reversion', 'sideways_bb_std_mult': 1.1130153895512769, 'sideways_rsi_os': 23, 'sideways_rsi_ob': 94, 'sideways_adx_thresh': 31.19648453222064, 'sideways_atr_min_pct': 0.02850101802978236, 'sideways_atr_max_pct': 0.14273710215601879, 'sideways_tp_mult': 2.766203451217304, 'sideways_tsl_mult': 0.6596368232373117, 'sideways_time_stop': 247, 'sideways_use_sma': True, 'sideways_use_ema': False, 'sideways_use_atr': False, 'sideways_use_adx': True, 'sideways_use_spike': True, 'sideways_rsi_required': True}.
