[I 2025-08-31 09:33:26,713] Trial 109 finished with values: [-1000000000.0, 1000000000.0] and parameters: {'p_sma': 45, 'p_std': 30, 'p_atr': 30, 'p_adx': 9, 'rsi_period': 23, 'ema1': 9, 'ema2': 47, 'slip_atr_k': 0.13733639950147652, 'slip_spread_k': 0.46302699846626366, 'spread_hl_frac': 0.028309539498239892, 'bb_std_mult': 2.8733816437026745, 'rsi_os': 24, 'rsi_ob': 51, 'vol_spike': 0.10071188961554894, 'adx_thresh': 18.539196547666517, 'atr_min_pct': 0.01645518429410428, 'atr_max_pct': 0.0621312677135757, 'tp_mult': 1.7206637335447406, 'tsl_mult': 0.5852744574951602, 'strategy': 'breakout', 'time_stop': 229, 'use_sma': True, 'use_atr': True, 'use_adx': False, 'use_ema': False, 'use_spike': False, 'rsi_required': False, 'edge_k': 1.258489708503868, 'edge_cap': 0.17414571615716934, 'bull_strategy': 'breakout', 'bull_bb_std_mult': 1.9965451730218098, 'bull_rsi_os': 21, 'bull_rsi_ob': 50, 'bull_adx_thresh': 15.049314152083479, 'bull_atr_min_pct': 0.023278056868936938, 'bull_atr_max_pct': 0.06948640948981584, 'bull_tp_mult': 1.15854957355521, 'bull_tsl_mult': 0.5852993186149447, 'bull_time_stop': 91, 'bull_use_sma': False, 'bull_use_ema': False, 'bull_use_atr': True, 'bull_use_adx': True, 'bull_use_spike': False, 'bull_rsi_required': True, 'bear_strategy': 'mean_reversion', 'bear_bb_std_mult': 2.4750098208676787, 'bear_rsi_os': 52, 'bear_rsi_ob': 69, 'bear_adx_thresh': 20.527168849871163, 'bear_atr_min_pct': 0.02561353476652204, 'bear_atr_max_pct': 0.14979593552601705, 'bear_tp_mult': 1.5619279968949442, 'bear_tsl_mult': 0.43846346166359684, 'bear_time_stop': 68, 'bear_use_sma': False, 'bear_use_ema': False, 'bear_use_atr': False, 'bear_use_adx': False, 'bear_use_spike': True, 'bear_rsi_required': True, 'sideways_strategy': 'mean_reversion', 'sideways_bb_std_mult': 2.9816587752117156, 'sideways_rsi_os': 26, 'sideways_rsi_ob': 53, 'sideways_adx_thresh': 20.96816535196089, 'sideways_atr_min_pct': 0.027140750002020465, 'sideways_atr_max_pct': 0.032091292276285065, 'sideways_tp_mult': 2.2457302402548662, 'sideways_tsl_mult': 0.6004094626389636, 'sideways_time_stop': 195, 'sideways_use_sma': True, 'sideways_use_ema': True, 'sideways_use_atr': False, 'sideways_use_adx': False, 'sideways_use_spike': False, 'sideways_rsi_required': True}.
[I 2025-08-31 09:33:26,812] Trial 106 finished with values: [-1000000000.0, 1000000000.0] and parameters: {'p_sma': 45, 'p_std': 20, 'p_atr': 28, 'p_adx': 22, 'rsi_period': 18, 'ema1': 12, 'ema2': 35, 'slip_atr_k': 0.23150946752054108, 'slip_spread_k': 0.46395754575902065, 'spread_hl_frac': 0.022990389597177713, 'bb_std_mult': 2.8696917868670746, 'rsi_os': 25, 'rsi_ob': 51, 'vol_spike': 0.10068339465739494, 'adx_thresh': 14.042137578730049, 'atr_min_pct': 0.0064009621546619894, 'atr_max_pct': 0.060274867735060876, 'tp_mult': 1.0151968559373798, 'tsl_mult': 0.0794305890090097, 'strategy': 'breakout', 'time_stop': 221, 'use_sma': True, 'use_atr': True, 'use_adx': False, 'use_ema': True, 'use_spike': True, 'rsi_required': True, 'edge_k': 4.735213189654974e-05, 'edge_cap': 0.34999163887505774, 'bull_strategy': 'breakout', 'bull_bb_std_mult': 3.330605170687261, 'bull_rsi_os': 43, 'bull_rsi_ob': 46, 'bull_adx_thresh': 33.92651998529669, 'bull_atr_min_pct': 0.02349053321063152, 'bull_atr_max_pct': 0.11973454155688015, 'bull_tp_mult': 2.65899160667557, 'bull_tsl_mult': 0.6259968685138527, 'bull_time_stop': 147, 'bull_use_sma': True, 'bull_use_ema': False, 'bull_use_atr': True, 'bull_use_adx': False, 'bull_use_spike': False, 'bull_rsi_required': True, 'bear_strategy': 'breakout', 'bear_bb_std_mult': 2.475793480073092, 'bear_rsi_os': 13, 'bear_rsi_ob': 87, 'bear_adx_thresh': 20.47464132694923, 'bear_atr_min_pct': 0.02595736998162144, 'bear_atr_max_pct': 0.14974666103684597, 'bear_tp_mult': 1.1685475630346325, 'bear_tsl_mult': 0.194906026313643, 'bear_time_stop': 76, 'bear_use_sma': False, 'bear_use_ema': False, 'bear_use_atr': False, 'bear_use_adx': True, 'bear_use_spike': True, 'bear_rsi_required': True, 'sideways_strategy': 'breakout', 'sideways_bb_std_mult': 3.2005090117577533, 'sideways_rsi_os': 30, 'sideways_rsi_ob': 52, 'sideways_adx_thresh': 30.807488619372577, 'sideways_atr_min_pct': 0.026996978813046517, 'sideways_atr_max_pct': 0.03264593588749898, 'sideways_tp_mult': 2.565974477411812, 'sideways_tsl_mult': 0.4699245305479, 'sideways_time_stop': 206, 'sideways_use_sma': True, 'sideways_use_ema': True, 'sideways_use_atr': False, 'sideways_use_adx': False, 'sideways_use_spike': True, 'sideways_rsi_required': False}.
[I 2025-08-31 09:34:02,931] Trial 113 finished with values: [-1000000000.0, 1000000000.0] and parameters: {'p_sma': 12, 'p_std': 27, 'p_atr': 29, 'p_adx': 19, 'rsi_period': 16, 'ema1': 7, 'ema2': 53, 'slip_atr_k': 0.12241377421858844, 'slip_spread_k': 0.3337462467755052, 'spread_hl_frac': 0.020152848228060377, 'bb_std_mult': 3.233826681967063, 'rsi_os': 37, 'rsi_ob': 47, 'vol_spike': 0.12514197854655498, 'adx_thresh': 32.70325823591816, 'atr_min_pct': 0.011296306719303718, 'atr_max_pct': 0.05660626638857632, 'tp_mult': 1.8166938773831038, 'tsl_mult': 0.0235350964435303, 'strategy': 'breakout', 'time_stop': 196, 'use_sma': True, 'use_atr': False, 'use_adx': False, 'use_ema': True, 'use_spike': True, 'rsi_required': True, 'edge_k': 1.5696068885568522, 'edge_cap': 0.29420506397870216, 'bull_strategy': 'breakout', 'bull_bb_std_mult': 3.0497802519928428, 'bull_rsi_os': 49, 'bull_rsi_ob': 91, 'bull_adx_thresh': 27.507774123837056, 'bull_atr_min_pct': 0.01707263999963683, 'bull_atr_max_pct': 0.09959331571105996, 'bull_tp_mult': 2.4008118157035936, 'bull_tsl_mult': 0.5265007244570311, 'bull_time_stop': 231, 'bull_use_sma': False, 'bull_use_ema': False, 'bull_use_atr': True, 'bull_use_adx': True, 'bull_use_spike': False, 'bull_rsi_required': True, 'bear_strategy': 'mean_reversion', 'bear_bb_std_mult': 3.0757539560993825, 'bear_rsi_os': 53, 'bear_rsi_ob': 73, 'bear_adx_thresh': 14.937433522612945, 'bear_atr_min_pct': 0.029306670593473062, 'bear_atr_max_pct': 0.04526245459913438, 'bear_tp_mult': 2.60312341166689, 'bear_tsl_mult': 0.4792782012565233, 'bear_time_stop': 51, 'bear_use_sma': True, 'bear_use_ema': False, 'bear_use_atr': False, 'bear_use_adx': True, 'bear_use_spike': False, 'bear_rsi_required': False, 'sideways_strategy': 'breakout', 'sideways_bb_std_mult': 2.027879202220986, 'sideways_rsi_os': 48, 'sideways_rsi_ob': 64, 'sideways_adx_thresh': 18.21319278300522, 'sideways_atr_min_pct': 0.020336230677585814, 'sideways_atr_max_pct': 0.05042638291339551, 'sideways_tp_mult': 1.5347646012648977, 'sideways_tsl_mult': 0.19225733680731666, 'sideways_time_stop': 54, 'sideways_use_sma': True, 'sideways_use_ema': True, 'sideways_use_atr': False, 'sideways_use_adx': False, 'sideways_use_spike': False, 'sideways_rsi_required': False}.
[I 2025-08-31 09:34:03,509] Trial 110 finished with values: [-1000000000.0, 1000000000.0] and parameters: {'p_sma': 60, 'p_std': 29, 'p_atr': 29, 'p_adx': 9, 'rsi_period': 18, 'ema1': 11, 'ema2': 47, 'slip_atr_k': 0.12046749558621542, 'slip_spread_k': 0.46812801519505903, 'spread_hl_frac': 0.01928785420360994, 'bb_std_mult': 3.358875840829205, 'rsi_os': 49, 'rsi_ob': 47, 'vol_spike': 0.10335106586709888, 'adx_thresh': 18.59921033836095, 'atr_min_pct': 0.005730410722597541, 'atr_max_pct': 0.060575783804591776, 'tp_mult': 1.3217355056467404, 'tsl_mult': 0.02128649718658504, 'strategy': 'breakout', 'time_stop': 231, 'use_sma': True, 'use_atr': False, 'use_adx': False, 'use_ema': False, 'use_spike': True, 'rsi_required': True, 'edge_k': 1.2576663093539986, 'edge_cap': 0.17840122587825613, 'bull_strategy': 'breakout', 'bull_bb_std_mult': 3.4797129083040037, 'bull_rsi_os': 21, 'bull_rsi_ob': 46, 'bull_adx_thresh': 17.173326561607148, 'bull_atr_min_pct': 0.01725142905061659, 'bull_atr_max_pct': 0.06758622660877982, 'bull_tp_mult': 2.8252304344182533, 'bull_tsl_mult': 0.571796443615389, 'bull_time_stop': 93, 'bull_use_sma': False, 'bull_use_ema': False, 'bull_use_atr': True, 'bull_use_adx': True, 'bull_use_spike': False, 'bull_rsi_required': True, 'bear_strategy': 'mean_reversion', 'bear_bb_std_mult': 3.0968654117084857, 'bear_rsi_os': 12, 'bear_rsi_ob': 74, 'bear_adx_thresh': 14.613277170262927, 'bear_atr_min_pct': 0.006683415229669596, 'bear_atr_max_pct': 0.09406030851740821, 'bear_tp_mult': 2.1889438908826078, 'bear_tsl_mult': 0.4423763166939372, 'bear_time_stop': 189, 'bear_use_sma': True, 'bear_use_ema': False, 'bear_use_atr': False, 'bear_use_adx': True, 'bear_use_spike': False, 'bear_rsi_required': True, 'sideways_strategy': 'mean_reversion', 'sideways_bb_std_mult': 3.2163851045110103, 'sideways_rsi_os': 49, 'sideways_rsi_ob': 73, 'sideways_adx_thresh': 25.067921105720927, 'sideways_atr_min_pct': 0.00853619679620328, 'sideways_atr_max_pct': 0.026299486888768084, 'sideways_tp_mult': 2.224886609747924, 'sideways_tsl_mult': 0.648620863301893, 'sideways_time_stop': 53, 'sideways_use_sma': True, 'sideways_use_ema': True, 'sideways_use_atr': False, 'sideways_use_adx': False, 'sideways_use_spike': False, 'sideways_rsi_required': True}.
[I 2025-08-31 09:34:03,841] Trial 111 finished with values: [-0.19328738256883315, 0.19320904889316587] and parameters: {'p_sma': 60, 'p_std': 21, 'p_atr': 29, 'p_adx': 15, 'rsi_period': 24, 'ema1': 7, 'ema2': 47, 'slip_atr_k': 5.125153885952513e-05, 'slip_spread_k': 0.3232561747361356, 'spread_hl_frac': 0.03888560649453725, 'bb_std_mult': 2.680210565713507, 'rsi_os': 53, 'rsi_ob': 73, 'vol_spike': 0.10520486766266336, 'adx_thresh': 18.537922124626625, 'atr_min_pct': 0.0057889273841712895, 'atr_max_pct': 0.05515436171020731, 'tp_mult': 1.8142911815325182, 'tsl_mult': 0.021493386670197314, 'strategy': 'breakout', 'time_stop': 195, 'use_sma': True, 'use_atr': False, 'use_adx': False, 'use_ema': True, 'use_spike': False, 'rsi_required': False, 'edge_k': 1.8195508290917197, 'edge_cap': 0.29933552040160144, 'bull_strategy': 'breakout', 'bull_bb_std_mult': 2.3259415287643153, 'bull_rsi_os': 29, 'bull_rsi_ob': 45, 'bull_adx_thresh': 16.85991061225623, 'bull_atr_min_pct': 0.014560424067809828, 'bull_atr_max_pct': 0.0966909850936187, 'bull_tp_mult': 2.4496925013002233, 'bull_tsl_mult': 0.5673904845455986, 'bull_time_stop': 229, 'bull_use_sma': False, 'bull_use_ema': False, 'bull_use_atr': True, 'bull_use_adx': True, 'bull_use_spike': False, 'bull_rsi_required': True, 'bear_strategy': 'mean_reversion', 'bear_bb_std_mult': 2.4518542761611966, 'bear_rsi_os': 53, 'bear_rsi_ob': 74, 'bear_adx_thresh': 20.430762036858624, 'bear_atr_min_pct': 0.008083283718319097, 'bear_atr_max_pct': 0.09280925112071703, 'bear_tp_mult': 2.5212618936513747, 'bear_tsl_mult': 0.5681746046403572, 'bear_time_stop': 49, 'bear_use_sma': True, 'bear_use_ema': False, 'bear_use_atr': False, 'bear_use_adx': True, 'bear_use_spike': False, 'bear_rsi_required': False, 'sideways_strategy': 'breakout', 'sideways_bb_std_mult': 2.5614672316951954, 'sideways_rsi_os': 49, 'sideways_rsi_ob': 64, 'sideways_adx_thresh': 21.278613646604796, 'sideways_atr_min_pct': 6.99312189733829e-05, 'sideways_atr_max_pct': 0.05108798245237175, 'sideways_tp_mult': 1.5355897292828313, 'sideways_tsl_mult': 0.8894354102880581, 'sideways_time_stop': 300, 'sideways_use_sma': True, 'sideways_use_ema': True, 'sideways_use_atr': False, 'sideways_use_adx': False, 'sideways_use_spike': False, 'sideways_rsi_required': False}.
[I 2025-08-31 09:34:03,976] Trial 112 finished with values: [-0.14038335123715007, 0.14029660413897765] and parameters: {'p_sma': 10, 'p_std': 14, 'p_atr': 19, 'p_adx': 29, 'rsi_period': 43, 'ema1': 8, 'ema2': 53, 'slip_atr_k': 0.010194147283016002, 'slip_spread_k': 0.333335527683687, 'spread_hl_frac': 0.019608505651901496, 'bb_std_mult': 3.2347522018909105, 'rsi_os': 28, 'rsi_ob': 47, 'vol_spike': 0.12510916073248027, 'adx_thresh': 5.00799054807133, 'atr_min_pct': 0.017976396972223793, 'atr_max_pct': 0.05566984468402236, 'tp_mult': 1.460425425208455, 'tsl_mult': 0.02459331455350122, 'strategy': 'breakout', 'time_stop': 86, 'use_sma': True, 'use_atr': False, 'use_adx': False, 'use_ema': True, 'use_spike': True, 'rsi_required': True, 'edge_k': 1.8264367223604625, 'edge_cap': 0.28876396192254, 'bull_strategy': 'breakout', 'bull_bb_std_mult': 2.2777833013835944, 'bull_rsi_os': 49, 'bull_rsi_ob': 91, 'bull_adx_thresh': 27.389420556914192, 'bull_atr_min_pct': 0.021053031379093704, 'bull_atr_max_pct': 0.10052725074174555, 'bull_tp_mult': 2.398138765868227, 'bull_tsl_mult': 0.4771523037768162, 'bull_time_stop': 230, 'bull_use_sma': False, 'bull_use_ema': False, 'bull_use_atr': True, 'bull_use_adx': True, 'bull_use_spike': False, 'bull_rsi_required': True, 'bear_strategy': 'mean_reversion', 'bear_bb_std_mult': 3.0192550011291717, 'bear_rsi_os': 53, 'bear_rsi_ob': 73, 'bear_adx_thresh': 17.551988067912323, 'bear_atr_min_pct': 0.003626844053336487, 'bear_atr_max_pct': 0.03637788164376157, 'bear_tp_mult': 2.5121327727256597, 'bear_tsl_mult': 0.35936261178234796, 'bear_time_stop': 8, 'bear_use_sma': True, 'bear_use_ema': False, 'bear_use_atr': False, 'bear_use_adx': True, 'bear_use_spike': False, 'bear_rsi_required': False, 'sideways_strategy': 'breakout', 'sideways_bb_std_mult': 3.5668548176922634, 'sideways_rsi_os': 49, 'sideways_rsi_ob': 63, 'sideways_adx_thresh': 17.98735234126899, 'sideways_atr_min_pct': 6.312574420793554e-06, 'sideways_atr_max_pct': 0.05042097554523359, 'sideways_tp_mult': 1.573474740829143, 'sideways_tsl_mult': 0.8780030984990769, 'sideways_time_stop': 53, 'sideways_use_sma': True, 'sideways_use_ema': True, 'sideways_use_atr': False, 'sideways_use_adx': False, 'sideways_use_spike': False, 'sideways_rsi_required': False}.
[I 2025-08-31 09:34:41,145] Trial 117 finished with values: [-1000000000.0, 1000000000.0] and parameters: {'p_sma': 19, 'p_std': 14, 'p_atr': 11, 'p_adx': 25, 'rsi_period': 51, 'ema1': 8, 'ema2': 40, 'slip_atr_k': 0.0942419904122247, 'slip_spread_k': 0.6028635643496153, 'spread_hl_frac': 0.04160424086224719, 'bb_std_mult': 1.6774584031919475, 'rsi_os': 22, 'rsi_ob': 66, 'vol_spike': 0.1548575469417891, 'adx_thresh': 7.451577005680363, 'atr_min_pct': 0.0031092125143859645, 'atr_max_pct': 0.07137710445095924, 'tp_mult': 1.1940971083623335, 'tsl_mult': 0.0014080046625990564, 'strategy': 'breakout', 'time_stop': 52, 'use_sma': True, 'use_atr': True, 'use_adx': True, 'use_ema': True, 'use_spike': True, 'rsi_required': True, 'edge_k': 0.7913985213379153, 'edge_cap': 0.1308960333980993, 'bull_strategy': 'breakout', 'bull_bb_std_mult': 2.635029439493889, 'bull_rsi_os': 10, 'bull_rsi_ob': 77, 'bull_adx_thresh': 31.75599409530243, 'bull_atr_min_pct': 0.02114746871890974, 'bull_atr_max_pct': 0.13537793594028394, 'bull_tp_mult': 2.310035519919394, 'bull_tsl_mult': 0.4785598263531985, 'bull_time_stop': 256, 'bull_use_sma': True, 'bull_use_ema': False, 'bull_use_atr': False, 'bull_use_adx': False, 'bull_use_spike': False, 'bull_rsi_required': True, 'bear_strategy': 'breakout', 'bear_bb_std_mult': 2.9160925978110286, 'bear_rsi_os': 54, 'bear_rsi_ob': 78, 'bear_adx_thresh': 6.729076667427382, 'bear_atr_min_pct': 0.004499242785081023, 'bear_atr_max_pct': 0.03640516180993128, 'bear_tp_mult': 1.7007449479661276, 'bear_tsl_mult': 0.36820001419769377, 'bear_time_stop': 216, 'bear_use_sma': False, 'bear_use_ema': False, 'bear_use_atr': False, 'bear_use_adx': True, 'bear_use_spike': True, 'bear_rsi_required': False, 'sideways_strategy': 'breakout', 'sideways_bb_std_mult': 2.771794921078807, 'sideways_rsi_os': 19, 'sideways_rsi_ob': 68, 'sideways_adx_thresh': 14.065167661931465, 'sideways_atr_min_pct': 0.024499628434870697, 'sideways_atr_max_pct': 0.0366125786201359, 'sideways_tp_mult': 2.993889915324221, 'sideways_tsl_mult': 0.5301265440921261, 'sideways_time_stop': 17, 'sideways_use_sma': True, 'sideways_use_ema': True, 'sideways_use_atr': False, 'sideways_use_adx': False, 'sideways_use_spike': True, 'sideways_rsi_required': False}.
[I 2025-08-31 09:34:41,972] Trial 115 finished with values: [-1000000000.0, 1000000000.0] and parameters: {'p_sma': 36, 'p_std': 14, 'p_atr': 19, 'p_adx': 26, 'rsi_period': 39, 'ema1': 11, 'ema2': 50, 'slip_atr_k': 0.01056383737035552, 'slip_spread_k': 0.424246206214369, 'spread_hl_frac': 0.048464740075020885, 'bb_std_mult': 2.9348087361816138, 'rsi_os': 10, 'rsi_ob': 67, 'vol_spike': 0.15902476799151774, 'adx_thresh': 8.372007452536957, 'atr_min_pct': 0.015290601760543315, 'atr_max_pct': 0.06487482261546944, 'tp_mult': 1.553479292937908, 'tsl_mult': 0.05732776640712827, 'strategy': 'breakout', 'time_stop': 186, 'use_sma': True, 'use_atr': True, 'use_adx': True, 'use_ema': True, 'use_spike': True, 'rsi_required': True, 'edge_k': 1.8152359695266844, 'edge_cap': 0.4440903771947006, 'bull_strategy': 'breakout', 'bull_bb_std_mult': 0.6863881424821494, 'bull_rsi_os': 16, 'bull_rsi_ob': 80, 'bull_adx_thresh': 31.474813511266703, 'bull_atr_min_pct': 0.00012999666483019812, 'bull_atr_max_pct': 0.05173803430315453, 'bull_tp_mult': 2.70889879465555, 'bull_tsl_mult': 0.549226883734831, 'bull_time_stop': 251, 'bull_use_sma': True, 'bull_use_ema': False, 'bull_use_atr': False, 'bull_use_adx': False, 'bull_use_spike': False, 'bull_rsi_required': True, 'bear_strategy': 'breakout', 'bear_bb_std_mult': 3.340322427300821, 'bear_rsi_os': 54, 'bear_rsi_ob': 64, 'bear_adx_thresh': 17.19465082717148, 'bear_atr_min_pct': 0.023004035216801083, 'bear_atr_max_pct': 0.14259742625018657, 'bear_tp_mult': 1.46976080812471, 'bear_tsl_mult': 0.36141413440250353, 'bear_time_stop': 66, 'bear_use_sma': False, 'bear_use_ema': False, 'bear_use_atr': False, 'bear_use_adx': True, 'bear_use_spike': True, 'bear_rsi_required': False, 'sideways_strategy': 'breakout', 'sideways_bb_std_mult': 2.2057218609017912, 'sideways_rsi_os': 55, 'sideways_rsi_ob': 61, 'sideways_adx_thresh': 22.820838662228063, 'sideways_atr_min_pct': 0.024709464282589653, 'sideways_atr_max_pct': 0.0414382838950057, 'sideways_tp_mult': 1.077961366675984, 'sideways_tsl_mult': 0.0626630327510323, 'sideways_time_stop': 18, 'sideways_use_sma': True, 'sideways_use_ema': True, 'sideways_use_atr': False, 'sideways_use_adx': False, 'sideways_use_spike': True, 'sideways_rsi_required': False}.
[I 2025-08-31 09:34:42,233] Trial 116 finished with values: [-0.042253503201779674, 0.042124748542068206] and parameters: {'p_sma': 39, 'p_std': 14, 'p_atr': 7, 'p_adx': 26, 'rsi_period': 37, 'ema1': 13, 'ema2': 29, 'slip_atr_k': 0.10004722460251002, 'slip_spread_k': 0.351414271391307, 'spread_hl_frac': 0.04789762992974477, 'bb_std_mult': 2.658912282237723, 'rsi_os': 22, 'rsi_ob': 49, 'vol_spike': 0.15122856582347202, 'adx_thresh': 7.46325217320993, 'atr_min_pct': 0.010138234052414038, 'atr_max_pct': 0.06556145105280461, 'tp_mult': 1.4620238881180678, 'tsl_mult': 0.005895355976552379, 'strategy': 'breakout', 'time_stop': 110, 'use_sma': True, 'use_atr': True, 'use_adx': True, 'use_ema': True, 'use_spike': False, 'rsi_required': False, 'edge_k': 1.6197123192135368, 'edge_cap': 0.4303385826595958, 'bull_strategy': 'breakout', 'bull_bb_std_mult': 2.267645787816592, 'bull_rsi_os': 10, 'bull_rsi_ob': 57, 'bull_adx_thresh': 15.910265537362593, 'bull_atr_min_pct': 0.02141808160129901, 'bull_atr_max_pct': 0.13623184907495814, 'bull_tp_mult': 2.716524005726958, 'bull_tsl_mult': 0.469600208060801, 'bull_time_stop': 256, 'bull_use_sma': True, 'bull_use_ema': False, 'bull_use_atr': False, 'bull_use_adx': False, 'bull_use_spike': False, 'bull_rsi_required': True, 'bear_strategy': 'breakout', 'bear_bb_std_mult': 2.9332979351124475, 'bear_rsi_os': 54, 'bear_rsi_ob': 78, 'bear_adx_thresh': 5.155054058932896, 'bear_atr_min_pct': 0.003995707800179821, 'bear_atr_max_pct': 0.03934851905976281, 'bear_tp_mult': 2.529982261163253, 'bear_tsl_mult': 0.5711180786005157, 'bear_time_stop': 210, 'bear_use_sma': False, 'bear_use_ema': False, 'bear_use_atr': False, 'bear_use_adx': True, 'bear_use_spike': True, 'bear_rsi_required': False, 'sideways_strategy': 'breakout', 'sideways_bb_std_mult': 2.587770177105159, 'sideways_rsi_os': 21, 'sideways_rsi_ob': 63, 'sideways_adx_thresh': 13.891210503165535, 'sideways_atr_min_pct': 0.02434414334319325, 'sideways_atr_max_pct': 0.03699295494092673, 'sideways_tp_mult': 1.618954032838834, 'sideways_tsl_mult': 0.2555630847452686, 'sideways_time_stop': 17, 'sideways_use_sma': True, 'sideways_use_ema': True, 'sideways_use_atr': False, 'sideways_use_adx': False, 'sideways_use_spike': True, 'sideways_rsi_required': False}.
