[I 2025-08-31 09:32:07,035] Trial 99 finished with values: [-1000000000.0, 1000000000.0] and parameters: {'p_sma': 43, 'p_std': 17, 'p_atr': 25, 'p_adx': 8, 'rsi_period': 81, 'ema1': 6, 'ema2': 38, 'slip_atr_k': 0.01585331233997534, 'slip_spread_k': 0.25158669074037815, 'spread_hl_frac': 0.026165382349507424, 'bb_std_mult': 2.781384293862722, 'rsi_os': 20, 'rsi_ob': 64, 'vol_spike': 0.11091026398931585, 'adx_thresh': 12.590130582414993, 'atr_min_pct': 0.013815295982708104, 'atr_max_pct': 0.04278979513113694, 'tp_mult': 1.262261070875207, 'tsl_mult': 0.12118713606139422, 'strategy': 'breakout', 'time_stop': 24, 'use_sma': True, 'use_atr': True, 'use_adx': True, 'use_ema': True, 'use_spike': True, 'rsi_required': True, 'edge_k': 0.6058811825947126, 'edge_cap': 0.1999639916743718, 'bull_strategy': 'breakout', 'bull_bb_std_mult': 3.427090346492134, 'bull_rsi_os': 30, 'bull_rsi_ob': 68, 'bull_adx_thresh': 11.82452831877165, 'bull_atr_min_pct': 0.013844399195514098, 'bull_atr_max_pct': 0.1251121489401488, 'bull_tp_mult': 2.94909189030864, 'bull_tsl_mult': 0.3162174265856065, 'bull_time_stop': 241, 'bull_use_sma': True, 'bull_use_ema': False, 'bull_use_atr': True, 'bull_use_adx': False, 'bull_use_spike': False, 'bull_rsi_required': True, 'bear_strategy': 'breakout', 'bear_bb_std_mult': 2.159425220352217, 'bear_rsi_os': 32, 'bear_rsi_ob': 68, 'bear_adx_thresh': 16.68841109368923, 'bear_atr_min_pct': 0.020007734996607705, 'bear_atr_max_pct': 0.01616270932672803, 'bear_tp_mult': 1.7731560621223943, 'bear_tsl_mult': 0.5074420652423569, 'bear_time_stop': 17, 'bear_use_sma': False, 'bear_use_ema': False, 'bear_use_atr': False, 'bear_use_adx': True, 'bear_use_spike': True, 'bear_rsi_required': False, 'sideways_strategy': 'breakout', 'sideways_bb_std_mult': 2.503734011100697, 'sideways_rsi_os': 53, 'sideways_rsi_ob': 71, 'sideways_adx_thresh': 33.88069188853632, 'sideways_atr_min_pct': 0.014005388910160763, 'sideways_atr_max_pct': 0.1092058391721987, 'sideways_tp_mult': 2.7040735844166597, 'sideways_tsl_mult': 0.15879883823318597, 'sideways_time_stop': 158, 'sideways_use_sma': True, 'sideways_use_ema': True, 'sideways_use_atr': False, 'sideways_use_adx': False, 'sideways_use_spike': True, 'sideways_rsi_required': False}.
[I 2025-08-31 09:32:07,337] Trial 100 finished with values: [-1000000000.0, 1000000000.0] and parameters: {'p_sma': 58, 'p_std': 17, 'p_atr': 28, 'p_adx': 8, 'rsi_period': 21, 'ema1': 5, 'ema2': 37, 'slip_atr_k': 0.019370951056556996, 'slip_spread_k': 0.48381012116310756, 'spread_hl_frac': 0.03187125630693714, 'bb_std_mult': 2.7385999138047756, 'rsi_os': 22, 'rsi_ob': 56, 'vol_spike': 0.11138792472313996, 'adx_thresh': 5.800244516439637, 'atr_min_pct': 0.01417681217890606, 'atr_max_pct': 0.04402171530636795, 'tp_mult': 1.4034222751261387, 'tsl_mult': 0.12212636417695517, 'strategy': 'breakout', 'time_stop': 210, 'use_sma': True, 'use_atr': True, 'use_adx': False, 'use_ema': True, 'use_spike': True, 'rsi_required': True, 'edge_k': 0.5799280955248383, 'edge_cap': 0.21514302033451155, 'bull_strategy': 'breakout', 'bull_bb_std_mult': 3.424062422112126, 'bull_rsi_os': 30, 'bull_rsi_ob': 68, 'bull_adx_thresh': 28.497069499320407, 'bull_atr_min_pct': 0.013626665217704411, 'bull_atr_max_pct': 0.12550704683652755, 'bull_tp_mult': 2.593152485929118, 'bull_tsl_mult': 0.3222425358352955, 'bull_time_stop': 120, 'bull_use_sma': True, 'bull_use_ema': False, 'bull_use_atr': True, 'bull_use_adx': False, 'bull_use_spike': False, 'bull_rsi_required': True, 'bear_strategy': 'breakout', 'bear_bb_std_mult': 2.1763554916139665, 'bear_rsi_os': 32, 'bear_rsi_ob': 51, 'bear_adx_thresh': 19.667896260982236, 'bear_atr_min_pct': 0.024749739108104764, 'bear_atr_max_pct': 0.06606036600332367, 'bear_tp_mult': 2.279376794605746, 'bear_tsl_mult': 0.501293001922961, 'bear_time_stop': 28, 'bear_use_sma': False, 'bear_use_ema': True, 'bear_use_atr': False, 'bear_use_adx': True, 'bear_use_spike': True, 'bear_rsi_required': False, 'sideways_strategy': 'breakout', 'sideways_bb_std_mult': 2.3610237742656457, 'sideways_rsi_os': 52, 'sideways_rsi_ob': 70, 'sideways_adx_thresh': 15.101102478336871, 'sideways_atr_min_pct': 0.015269169464019343, 'sideways_atr_max_pct': 0.06808991930573732, 'sideways_tp_mult': 1.723015714343446, 'sideways_tsl_mult': 0.5670829660635409, 'sideways_time_stop': 161, 'sideways_use_sma': True, 'sideways_use_ema': True, 'sideways_use_atr': False, 'sideways_use_adx': True, 'sideways_use_spike': True, 'sideways_rsi_required': False}.
[I 2025-08-31 09:32:44,567] Trial 104 finished with values: [-1000000000.0, 1000000000.0] and parameters: {'p_sma': 7, 'p_std': 23, 'p_atr': 29, 'p_adx': 17, 'rsi_period': 31, 'ema1': 9, 'ema2': 43, 'slip_atr_k': 0.02392730327447452, 'slip_spread_k': 0.565628713250038, 'spread_hl_frac': 0.03675467624626892, 'bb_std_mult': 3.0080013287452587, 'rsi_os': 26, 'rsi_ob': 54, 'vol_spike': 0.08180865064302298, 'adx_thresh': 17.8108714147926, 'atr_min_pct': 0.0012173220825702595, 'atr_max_pct': 0.14938837978499842, 'tp_mult': 1.6872890850468187, 'tsl_mult': 0.07255169305786188, 'strategy': 'breakout', 'time_stop': 131, 'use_sma': True, 'use_atr': True, 'use_adx': False, 'use_ema': True, 'use_spike': True, 'rsi_required': True, 'edge_k': 1.6964619494092028, 'edge_cap': 0.3802635167725302, 'bull_strategy': 'breakout', 'bull_bb_std_mult': 3.497383529730201, 'bull_rsi_os': 27, 'bull_rsi_ob': 76, 'bull_adx_thresh': 18.688738602198377, 'bull_atr_min_pct': 0.020809016640052337, 'bull_atr_max_pct': 0.11118199439360571, 'bull_tp_mult': 2.8552075348779584, 'bull_tsl_mult': 0.7245582339931464, 'bull_time_stop': 245, 'bull_use_sma': True, 'bull_use_ema': False, 'bull_use_atr': False, 'bull_use_adx': False, 'bull_use_spike': True, 'bull_rsi_required': True, 'bear_strategy': 'breakout', 'bear_bb_std_mult': 1.9549537024687251, 'bear_rsi_os': 49, 'bear_rsi_ob': 62, 'bear_adx_thresh': 13.79785164381834, 'bear_atr_min_pct': 0.02282030437914268, 'bear_atr_max_pct': 0.13199139544907063, 'bear_tp_mult': 1.985626740199033, 'bear_tsl_mult': 0.2542963159727674, 'bear_time_stop': 49, 'bear_use_sma': False, 'bear_use_ema': False, 'bear_use_atr': False, 'bear_use_adx': True, 'bear_use_spike': True, 'bear_rsi_required': False, 'sideways_strategy': 'breakout', 'sideways_bb_std_mult': 2.7610898961055237, 'sideways_rsi_os': 51, 'sideways_rsi_ob': 48, 'sideways_adx_thresh': 16.86038773602065, 'sideways_atr_min_pct': 0.0061314023576687065, 'sideways_atr_max_pct': 0.040006156128736765, 'sideways_tp_mult': 1.8206438203511974, 'sideways_tsl_mult': 0.49762686508442894, 'sideways_time_stop': 11, 'sideways_use_sma': True, 'sideways_use_ema': True, 'sideways_use_atr': True, 'sideways_use_adx': False, 'sideways_use_spike': True, 'sideways_rsi_required': False}.
[I 2025-08-31 09:32:45,276] Trial 102 finished with values: [-1000000000.0, 1000000000.0] and parameters: {'p_sma': 7, 'p_std': 23, 'p_atr': 25, 'p_adx': 8, 'rsi_period': 27, 'ema1': 5, 'ema2': 42, 'slip_atr_k': 0.019502618237922875, 'slip_spread_k': 0.24791763771357578, 'spread_hl_frac': 0.0377956099473265, 'bb_std_mult': 3.0003024793784334, 'rsi_os': 15, 'rsi_ob': 56, 'vol_spike': 0.08300632227926659, 'adx_thresh': 5.99165884820936, 'atr_min_pct': 0.014232848375788336, 'atr_max_pct': 0.14065562462498118, 'tp_mult': 1.1112223305899849, 'tsl_mult': 0.5534670971437705, 'strategy': 'breakout', 'time_stop': 130, 'use_sma': True, 'use_atr': True, 'use_adx': False, 'use_ema': True, 'use_spike': True, 'rsi_required': True, 'edge_k': 1.1213683729667983, 'edge_cap': 0.20564455642297158, 'bull_strategy': 'breakout', 'bull_bb_std_mult': 3.352385427166126, 'bull_rsi_os': 27, 'bull_rsi_ob': 68, 'bull_adx_thresh': 7.821028008795077, 'bull_atr_min_pct': 0.01605002348192938, 'bull_atr_max_pct': 0.10820011628480555, 'bull_tp_mult': 2.937377568378234, 'bull_tsl_mult': 0.7143966624755121, 'bull_time_stop': 242, 'bull_use_sma': True, 'bull_use_ema': False, 'bull_use_atr': False, 'bull_use_adx': False, 'bull_use_spike': True, 'bull_rsi_required': True, 'bear_strategy': 'breakout', 'bear_bb_std_mult': 3.2325273522950164, 'bear_rsi_os': 49, 'bear_rsi_ob': 47, 'bear_adx_thresh': 19.751898980963798, 'bear_atr_min_pct': 0.024620222746172295, 'bear_atr_max_pct': 0.13417955827403516, 'bear_tp_mult': 2.309844636844857, 'bear_tsl_mult': 0.5059747949300584, 'bear_time_stop': 35, 'bear_use_sma': False, 'bear_use_ema': True, 'bear_use_atr': False, 'bear_use_adx': True, 'bear_use_spike': True, 'bear_rsi_required': False, 'sideways_strategy': 'breakout', 'sideways_bb_std_mult': 2.010578470169058, 'sideways_rsi_os': 51, 'sideways_rsi_ob': 55, 'sideways_adx_thresh': 16.73993500638506, 'sideways_atr_min_pct': 0.012703900152978703, 'sideways_atr_max_pct': 0.14452200748964178, 'sideways_tp_mult': 1.1398401111577738, 'sideways_tsl_mult': 0.16096690592351465, 'sideways_time_stop': 165, 'sideways_use_sma': True, 'sideways_use_ema': True, 'sideways_use_atr': True, 'sideways_use_adx': True, 'sideways_use_spike': True, 'sideways_rsi_required': False}.
[I 2025-08-31 09:32:45,589] Trial 101 finished with values: [-1000000000.0, 1000000000.0] and parameters: {'p_sma': 42, 'p_std': 17, 'p_atr': 28, 'p_adx': 8, 'rsi_period': 27, 'ema1': 5, 'ema2': 43, 'slip_atr_k': 0.016666349108129665, 'slip_spread_k': 0.5658331983336625, 'spread_hl_frac': 0.0373293567008964, 'bb_std_mult': 2.7640672609545502, 'rsi_os': 20, 'rsi_ob': 54, 'vol_spike': 0.11525609998904295, 'adx_thresh': 13.865332769539446, 'atr_min_pct': 0.01571983271664945, 'atr_max_pct': 0.14988888722393273, 'tp_mult': 1.3574443960651092, 'tsl_mult': 0.7548233330266461, 'strategy': 'breakout', 'time_stop': 222, 'use_sma': True, 'use_atr': True, 'use_adx': False, 'use_ema': True, 'use_spike': True, 'rsi_required': True, 'edge_k': 1.774110661128603, 'edge_cap': 0.22318468097534683, 'bull_strategy': 'breakout', 'bull_bb_std_mult': 3.348217021970151, 'bull_rsi_os': 45, 'bull_rsi_ob': 70, 'bull_adx_thresh': 28.49750569054221, 'bull_atr_min_pct': 0.013820733011609767, 'bull_atr_max_pct': 0.0794835841290809, 'bull_tp_mult': 2.8685069042862072, 'bull_tsl_mult': 0.31775282716742653, 'bull_time_stop': 68, 'bull_use_sma': True, 'bull_use_ema': False, 'bull_use_atr': True, 'bull_use_adx': False, 'bull_use_spike': True, 'bull_rsi_required': True, 'bear_strategy': 'breakout', 'bear_bb_std_mult': 2.0266095642507045, 'bear_rsi_os': 32, 'bear_rsi_ob': 87, 'bear_adx_thresh': 19.706761634483023, 'bear_atr_min_pct': 0.01980380655345487, 'bear_atr_max_pct': 0.14122980506357263, 'bear_tp_mult': 2.3080642432574607, 'bear_tsl_mult': 0.20510672030892282, 'bear_time_stop': 32, 'bear_use_sma': False, 'bear_use_ema': True, 'bear_use_atr': False, 'bear_use_adx': True, 'bear_use_spike': True, 'bear_rsi_required': False, 'sideways_strategy': 'breakout', 'sideways_bb_std_mult': 2.409151445927317, 'sideways_rsi_os': 52, 'sideways_rsi_ob': 50, 'sideways_adx_thresh': 16.854630436051124, 'sideways_atr_min_pct': 0.012969004873265598, 'sideways_atr_max_pct': 0.06923048443554256, 'sideways_tp_mult': 1.719161390135708, 'sideways_tsl_mult': 0.56200573829787, 'sideways_time_stop': 145, 'sideways_use_sma': True, 'sideways_use_ema': True, 'sideways_use_atr': True, 'sideways_use_adx': True, 'sideways_use_spike': True, 'sideways_rsi_required': False}.
[I 2025-08-31 09:32:45,798] Trial 103 finished with values: [-1000000000.0, 1000000000.0] and parameters: {'p_sma': 7, 'p_std': 23, 'p_atr': 27, 'p_adx': 17, 'rsi_period': 22, 'ema1': 5, 'ema2': 35, 'slip_atr_k': 0.2400080899060199, 'slip_spread_k': 0.5674685635958381, 'spread_hl_frac': 0.037059525207351264, 'bb_std_mult': 3.024574272059318, 'rsi_os': 18, 'rsi_ob': 54, 'vol_spike': 0.1425490139395077, 'adx_thresh': 13.79736392874294, 'atr_min_pct': 0.014196308070182587, 'atr_max_pct': 0.03171296503427261, 'tp_mult': 1.885815213505247, 'tsl_mult': 0.08295890608124976, 'strategy': 'breakout', 'time_stop': 221, 'use_sma': True, 'use_atr': True, 'use_adx': False, 'use_ema': True, 'use_spike': True, 'rsi_required': True, 'edge_k': 1.8696599928730901, 'edge_cap': 0.12192651590096443, 'bull_strategy': 'breakout', 'bull_bb_std_mult': 3.3351553595051326, 'bull_rsi_os': 27, 'bull_rsi_ob': 76, 'bull_adx_thresh': 8.83439982273445, 'bull_atr_min_pct': 0.015976379296163152, 'bull_atr_max_pct': 0.10792054047831771, 'bull_tp_mult': 2.651523913334529, 'bull_tsl_mult': 0.15484339980237743, 'bull_time_stop': 117, 'bull_use_sma': True, 'bull_use_ema': False, 'bull_use_atr': False, 'bull_use_adx': False, 'bull_use_spike': True, 'bull_rsi_required': True, 'bear_strategy': 'breakout', 'bear_bb_std_mult': 1.9605777108964157, 'bear_rsi_os': 14, 'bear_rsi_ob': 62, 'bear_adx_thresh': 19.698411966893598, 'bear_atr_min_pct': 0.021306032752106404, 'bear_atr_max_pct': 0.13293349538781424, 'bear_tp_mult': 2.2967419456800164, 'bear_tsl_mult': 0.2215954722320523, 'bear_time_stop': 250, 'bear_use_sma': False, 'bear_use_ema': True, 'bear_use_atr': False, 'bear_use_adx': True, 'bear_use_spike': True, 'bear_rsi_required': False, 'sideways_strategy': 'breakout', 'sideways_bb_std_mult': 2.382113803969672, 'sideways_rsi_os': 51, 'sideways_rsi_ob': 55, 'sideways_adx_thresh': 17.043864856908264, 'sideways_atr_min_pct': 0.013361790868879357, 'sideways_atr_max_pct': 0.06791902797261622, 'sideways_tp_mult': 1.8135531995922276, 'sideways_tsl_mult': 0.13278981942627144, 'sideways_time_stop': 25, 'sideways_use_sma': True, 'sideways_use_ema': True, 'sideways_use_atr': True, 'sideways_use_adx': True, 'sideways_use_spike': True, 'sideways_rsi_required': False}.
[I 2025-08-31 09:32:46,165] Trial 105 finished with values: [-1000000000.0, 1000000000.0] and parameters: {'p_sma': 46, 'p_std': 19, 'p_atr': 27, 'p_adx': 23, 'rsi_period': 75, 'ema1': 12, 'ema2': 41, 'slip_atr_k': 0.23880106268808277, 'slip_spread_k': 0.39053876664028125, 'spread_hl_frac': 0.0347103257819634, 'bb_std_mult': 1.1074296651626452, 'rsi_os': 15, 'rsi_ob': 51, 'vol_spike': 0.1434547352000348, 'adx_thresh': 13.843266503298855, 'atr_min_pct': 0.01247865443683985, 'atr_max_pct': 0.010261216358817049, 'tp_mult': 1.879140683221002, 'tsl_mult': 0.09473985419936592, 'strategy': 'breakout', 'time_stop': 220, 'use_sma': True, 'use_atr': True, 'use_adx': False, 'use_ema': True, 'use_spike': True, 'rsi_required': True, 'edge_k': 0.14303808803960893, 'edge_cap': 0.11008498199353411, 'bull_strategy': 'breakout', 'bull_bb_std_mult': 1.8339443439520757, 'bull_rsi_os': 44, 'bull_rsi_ob': 74, 'bull_adx_thresh': 34.01343911066477, 'bull_atr_min_pct': 0.016219736706477535, 'bull_atr_max_pct': 0.11791325205923822, 'bull_tp_mult': 2.9283695584432348, 'bull_tsl_mult': 0.631397989888222, 'bull_time_stop': 53, 'bull_use_sma': True, 'bull_use_ema': False, 'bull_use_atr': True, 'bull_use_adx': False, 'bull_use_spike': True, 'bull_rsi_required': True, 'bear_strategy': 'breakout', 'bear_bb_std_mult': 3.5251899138922687, 'bear_rsi_os': 28, 'bear_rsi_ob': 47, 'bear_adx_thresh': 15.698665001602256, 'bear_atr_min_pct': 0.02106488874377079, 'bear_atr_max_pct': 0.14173928767817368, 'bear_tp_mult': 2.307517395000989, 'bear_tsl_mult': 0.31842664259665565, 'bear_time_stop': 76, 'bear_use_sma': False, 'bear_use_ema': True, 'bear_use_atr': False, 'bear_use_adx': True, 'bear_use_spike': True, 'bear_rsi_required': False, 'sideways_strategy': 'breakout', 'sideways_bb_std_mult': 2.154055130436196, 'sideways_rsi_os': 35, 'sideways_rsi_ob': 45, 'sideways_adx_thresh': 12.528525270622616, 'sideways_atr_min_pct': 0.012208072140134479, 'sideways_atr_max_pct': 0.14027961050370122, 'sideways_tp_mult': 1.4720666254898926, 'sideways_tsl_mult': 0.4739186782866083, 'sideways_time_stop': 35, 'sideways_use_sma': True, 'sideways_use_ema': True, 'sideways_use_atr': True, 'sideways_use_adx': True, 'sideways_use_spike': True, 'sideways_rsi_required': False}.
[I 2025-08-31 09:33:26,114] Trial 108 finished with values: [-1000000000.0, 1000000000.0] and parameters: {'p_sma': 49, 'p_std': 19, 'p_atr': 10, 'p_adx': 23, 'rsi_period': 73, 'ema1': 10, 'ema2': 58, 'slip_atr_k': 0.13501956743900212, 'slip_spread_k': 0.4335097817285368, 'spread_hl_frac': 0.02346299346124445, 'bb_std_mult': 2.885042389199289, 'rsi_os': 41, 'rsi_ob': 51, 'vol_spike': 0.09777765787313009, 'adx_thresh': 16.042713153018, 'atr_min_pct': 0.012506446334395287, 'atr_max_pct': 0.06182542311251756, 'tp_mult': 1.7705201231427872, 'tsl_mult': 0.886586687467606, 'strategy': 'breakout', 'time_stop': 212, 'use_sma': True, 'use_atr': True, 'use_adx': False, 'use_ema': False, 'use_spike': False, 'rsi_required': False, 'edge_k': 1.6884740372850806, 'edge_cap': 0.34268321052043715, 'bull_strategy': 'breakout', 'bull_bb_std_mult': 1.7591250902346567, 'bull_rsi_os': 23, 'bull_rsi_ob': 50, 'bull_adx_thresh': 34.125621974405824, 'bull_atr_min_pct': 0.02351015524908447, 'bull_atr_max_pct': 0.11482317516421207, 'bull_tp_mult': 2.510404566283907, 'bull_tsl_mult': 0.07135922385124027, 'bull_time_stop': 101, 'bull_use_sma': True, 'bull_use_ema': False, 'bull_use_atr': True, 'bull_use_adx': False, 'bull_use_spike': False, 'bull_rsi_required': True, 'bear_strategy': 'breakout', 'bear_bb_std_mult': 2.525207811150911, 'bear_rsi_os': 52, 'bear_rsi_ob': 69, 'bear_adx_thresh': 15.698334022271869, 'bear_atr_min_pct': 0.02595534666067996, 'bear_atr_max_pct': 0.13562228993892908, 'bear_tp_mult': 1.3965021094818793, 'bear_tsl_mult': 0.3180066373433117, 'bear_time_stop': 80, 'bear_use_sma': False, 'bear_use_ema': False, 'bear_use_atr': False, 'bear_use_adx': False, 'bear_use_spike': True, 'bear_rsi_required': True, 'sideways_strategy': 'mean_reversion', 'sideways_bb_std_mult': 3.019769900403417, 'sideways_rsi_os': 34, 'sideways_rsi_ob': 52, 'sideways_adx_thresh': 12.454427597058825, 'sideways_atr_min_pct': 0.026973684914962617, 'sideways_atr_max_pct': 0.03275584002021651, 'sideways_tp_mult': 1.487330484756347, 'sideways_tsl_mult': 0.47371689639309483, 'sideways_time_stop': 189, 'sideways_use_sma': True, 'sideways_use_ema': True, 'sideways_use_atr': False, 'sideways_use_adx': False, 'sideways_use_spike': True, 'sideways_rsi_required': True}.
[I 2025-08-31 09:33:26,465] Trial 107 finished with values: [-1000000000.0, 1000000000.0] and parameters: {'p_sma': 49, 'p_std': 31, 'p_atr': 27, 'p_adx': 22, 'rsi_period': 18, 'ema1': 10, 'ema2': 34, 'slip_atr_k': 0.13966602124114552, 'slip_spread_k': 0.3936927087591065, 'spread_hl_frac': 0.03373062335424696, 'bb_std_mult': 2.877806563029214, 'rsi_os': 24, 'rsi_ob': 51, 'vol_spike': 0.14528515448023221, 'adx_thresh': 15.787870570470867, 'atr_min_pct': 0.016401826169430377, 'atr_max_pct': 0.0605096781526918, 'tp_mult': 1.9032398408165214, 'tsl_mult': 0.09141458172396805, 'strategy': 'breakout', 'time_stop': 219, 'use_sma': True, 'use_atr': True, 'use_adx': False, 'use_ema': False, 'use_spike': True, 'rsi_required': True, 'edge_k': 1.6766055067182968, 'edge_cap': 0.05316468304290469, 'bull_strategy': 'breakout', 'bull_bb_std_mult': 3.4974495138367256, 'bull_rsi_os': 21, 'bull_rsi_ob': 74, 'bull_adx_thresh': 14.84880582755045, 'bull_atr_min_pct': 0.022896386330398512, 'bull_atr_max_pct': 0.07067609918591491, 'bull_tp_mult': 2.8227220475265167, 'bull_tsl_mult': 0.6289535626782113, 'bull_time_stop': 89, 'bull_use_sma': True, 'bull_use_ema': False, 'bull_use_atr': True, 'bull_use_adx': False, 'bull_use_spike': False, 'bull_rsi_required': True, 'bear_strategy': 'breakout', 'bear_bb_std_mult': 3.5063377811239156, 'bear_rsi_os': 14, 'bear_rsi_ob': 58, 'bear_adx_thresh': 15.685212049531618, 'bear_atr_min_pct': 0.021370705813663324, 'bear_atr_max_pct': 0.14901974254537356, 'bear_tp_mult': 1.549593121907724, 'bear_tsl_mult': 0.3222479193999522, 'bear_time_stop': 80, 'bear_use_sma': False, 'bear_use_ema': False, 'bear_use_atr': False, 'bear_use_adx': False, 'bear_use_spike': True, 'bear_rsi_required': True, 'sideways_strategy': 'mean_reversion', 'sideways_bb_std_mult': 3.2837245761914273, 'sideways_rsi_os': 25, 'sideways_rsi_ob': 52, 'sideways_adx_thresh': 31.251699366493256, 'sideways_atr_min_pct': 0.004462160287300777, 'sideways_atr_max_pct': 0.03143879353028388, 'sideways_tp_mult': 2.2647795369389603, 'sideways_tsl_mult': 0.4723383349808067, 'sideways_time_stop': 198, 'sideways_use_sma': True, 'sideways_use_ema': True, 'sideways_use_atr': False, 'sideways_use_adx': False, 'sideways_use_spike': True, 'sideways_rsi_required': True}.
