[I 2025-08-31 10:17:08,788] Trial 459 finished with values: [-0.09824798243488753, 0.09827054295580498] and parameters: {'p_sma': 51, 'p_std': 16, 'p_atr': 29, 'p_adx': 14, 'rsi_period': 25, 'ema1': 9, 'ema2': 43, 'slip_atr_k': 0.1618481243162906, 'slip_spread_k': 0.45516564555801303, 'spread_hl_frac': 0.04115363445230357, 'bb_std_mult': 1.5488661431279853, 'rsi_os': 20, 'rsi_ob': 53, 'vol_spike': 0.13588307828257884, 'adx_thresh': 6.865813711424169, 'atr_min_pct': 0.006133168382806283, 'atr_max_pct': 0.13130901688287358, 'tp_mult': 1.663565334427594, 'tsl_mult': 0.037486504218189456, 'strategy': 'breakout', 'time_stop': 165, 'use_sma': False, 'use_atr': False, 'use_adx': False, 'use_ema': True, 'use_spike': False, 'rsi_required': False, 'edge_k': 1.4539833137820257, 'edge_cap': 0.09440963680393286, 'bull_strategy': 'mean_reversion', 'bull_bb_std_mult': 2.596582099470143, 'bull_rsi_os': 46, 'bull_rsi_ob': 79, 'bull_adx_thresh': 32.1035508820849, 'bull_atr_min_pct': 0.017641176441817653, 'bull_atr_max_pct': 0.12362600326282581, 'bull_tp_mult': 2.561586698502756, 'bull_tsl_mult': 0.6551854535797096, 'bull_time_stop': 245, 'bull_use_sma': True, 'bull_use_ema': False, 'bull_use_atr': False, 'bull_use_adx': False, 'bull_use_spike': False, 'bull_rsi_required': False, 'bear_strategy': 'breakout', 'bear_bb_std_mult': 2.868776326413467, 'bear_rsi_os': 52, 'bear_rsi_ob': 64, 'bear_adx_thresh': 7.136957438526165, 'bear_atr_min_pct': 0.0018352892791321535, 'bear_atr_max_pct': 0.13644046725361464, 'bear_tp_mult': 2.585415599556095, 'bear_tsl_mult': 0.5637324121487141, 'bear_time_stop': 264, 'bear_use_sma': True, 'bear_use_ema': False, 'bear_use_atr': False, 'bear_use_adx': True, 'bear_use_spike': False, 'bear_rsi_required': True, 'sideways_strategy': 'breakout', 'sideways_bb_std_mult': 3.114472532247704, 'sideways_rsi_os': 25, 'sideways_rsi_ob': 64, 'sideways_adx_thresh': 10.577077532386147, 'sideways_atr_min_pct': 0.011086591994145432, 'sideways_atr_max_pct': 0.04158225883141475, 'sideways_tp_mult': 1.475751276228518, 'sideways_tsl_mult': 0.11773147955523769, 'sideways_time_stop': 149, 'sideways_use_sma': True, 'sideways_use_ema': False, 'sideways_use_atr': False, 'sideways_use_adx': False, 'sideways_use_spike': False, 'sideways_rsi_required': False}.
[I 2025-08-31 10:17:09,076] Trial 460 finished with values: [-0.02034734748054745, 0.020368258752374604] and parameters: {'p_sma': 57, 'p_std': 16, 'p_atr': 26, 'p_adx': 9, 'rsi_period': 18, 'ema1': 8, 'ema2': 50, 'slip_atr_k': 0.19191667690028053, 'slip_spread_k': 0.43859479700174564, 'spread_hl_frac': 0.016109234994596596, 'bb_std_mult': 0.9664223563880203, 'rsi_os': 20, 'rsi_ob': 83, 'vol_spike': 0.13567032616093946, 'adx_thresh': 14.607714220550072, 'atr_min_pct': 0.011941135105043922, 'atr_max_pct': 0.12725428241605446, 'tp_mult': 2.997030229646428, 'tsl_mult': 0.028313919625307975, 'strategy': 'breakout', 'time_stop': 239, 'use_sma': False, 'use_atr': False, 'use_adx': False, 'use_ema': False, 'use_spike': False, 'rsi_required': True, 'edge_k': 0.00037990316599678664, 'edge_cap': 0.10080278615708846, 'bull_strategy': 'mean_reversion', 'bull_bb_std_mult': 2.90264678450381, 'bull_rsi_os': 24, 'bull_rsi_ob': 67, 'bull_adx_thresh': 31.224217627881288, 'bull_atr_min_pct': 0.01181135845777272, 'bull_atr_max_pct': 0.13078434555002463, 'bull_tp_mult': 2.8270666474038832, 'bull_tsl_mult': 0.8400712145248419, 'bull_time_stop': 15, 'bull_use_sma': True, 'bull_use_ema': False, 'bull_use_atr': False, 'bull_use_adx': False, 'bull_use_spike': False, 'bull_rsi_required': False, 'bear_strategy': 'breakout', 'bear_bb_std_mult': 3.006798072183684, 'bear_rsi_os': 52, 'bear_rsi_ob': 80, 'bear_adx_thresh': 19.568958348795746, 'bear_atr_min_pct': 0.022257836962290462, 'bear_atr_max_pct': 0.1407029813407359, 'bear_tp_mult': 1.7098554758367865, 'bear_tsl_mult': 0.552815499935183, 'bear_time_stop': 71, 'bear_use_sma': True, 'bear_use_ema': False, 'bear_use_atr': False, 'bear_use_adx': True, 'bear_use_spike': False, 'bear_rsi_required': True, 'sideways_strategy': 'breakout', 'sideways_bb_std_mult': 1.2266194124961318, 'sideways_rsi_os': 27, 'sideways_rsi_ob': 64, 'sideways_adx_thresh': 32.423956310024664, 'sideways_atr_min_pct': 0.0021528560852621618, 'sideways_atr_max_pct': 0.03976535202418636, 'sideways_tp_mult': 2.8234819781483758, 'sideways_tsl_mult': 0.242624426120011, 'sideways_time_stop': 193, 'sideways_use_sma': True, 'sideways_use_ema': False, 'sideways_use_atr': False, 'sideways_use_adx': False, 'sideways_use_spike': False, 'sideways_rsi_required': False}.
[I 2025-08-31 10:17:39,208] Trial 461 finished with values: [-0.022654679571405212, 0.022757132986675935] and parameters: {'p_sma': 51, 'p_std': 48, 'p_atr': 9, 'p_adx': 9, 'rsi_period': 25, 'ema1': 9, 'ema2': 49, 'slip_atr_k': 0.1914392593806247, 'slip_spread_k': 0.7929394475605884, 'spread_hl_frac': 0.014368344888705434, 'bb_std_mult': 0.9705588171995078, 'rsi_os': 20, 'rsi_ob': 79, 'vol_spike': 0.1459147091973797, 'adx_thresh': 6.653977774400179, 'atr_min_pct': 0.028729081782628445, 'atr_max_pct': 0.12739488916532163, 'tp_mult': 2.8100635690945177, 'tsl_mult': 0.035130108468550525, 'strategy': 'breakout', 'time_stop': 237, 'use_sma': False, 'use_atr': False, 'use_adx': False, 'use_ema': False, 'use_spike': False, 'rsi_required': True, 'edge_k': 1.418201741825233, 'edge_cap': 0.20476162863110647, 'bull_strategy': 'mean_reversion', 'bull_bb_std_mult': 1.686755616085748, 'bull_rsi_os': 29, 'bull_rsi_ob': 79, 'bull_adx_thresh': 5.045356206889764, 'bull_atr_min_pct': 0.017892997607105065, 'bull_atr_max_pct': 0.09545509744462047, 'bull_tp_mult': 1.4480184967244383, 'bull_tsl_mult': 0.5749533285827212, 'bull_time_stop': 248, 'bull_use_sma': True, 'bull_use_ema': False, 'bull_use_atr': False, 'bull_use_adx': True, 'bull_use_spike': False, 'bull_rsi_required': False, 'bear_strategy': 'breakout', 'bear_bb_std_mult': 3.0395969410211983, 'bear_rsi_os': 52, 'bear_rsi_ob': 80, 'bear_adx_thresh': 7.1131127170544595, 'bear_atr_min_pct': 0.02210003270489734, 'bear_atr_max_pct': 0.14003512310209967, 'bear_tp_mult': 2.695832947568605, 'bear_tsl_mult': 0.5608078164832244, 'bear_time_stop': 85, 'bear_use_sma': True, 'bear_use_ema': False, 'bear_use_atr': False, 'bear_use_adx': True, 'bear_use_spike': False, 'bear_rsi_required': True, 'sideways_strategy': 'breakout', 'sideways_bb_std_mult': 1.271120705112311, 'sideways_rsi_os': 27, 'sideways_rsi_ob': 64, 'sideways_adx_thresh': 32.53072519226555, 'sideways_atr_min_pct': 0.0020911178974860455, 'sideways_atr_max_pct': 0.07267422388283515, 'sideways_tp_mult': 1.4088340673979811, 'sideways_tsl_mult': 0.25437937101949315, 'sideways_time_stop': 114, 'sideways_use_sma': True, 'sideways_use_ema': False, 'sideways_use_atr': False, 'sideways_use_adx': True, 'sideways_use_spike': False, 'sideways_rsi_required': False}.
[I 2025-08-31 10:17:39,934] Trial 462 finished with values: [-0.04250287764941696, 0.042332667325967306] and parameters: {'p_sma': 45, 'p_std': 9, 'p_atr': 9, 'p_adx': 28, 'rsi_period': 25, 'ema1': 9, 'ema2': 50, 'slip_atr_k': 0.19185036318218562, 'slip_spread_k': 0.45615347243336085, 'spread_hl_frac': 0.014399792764939594, 'bb_std_mult': 1.8644815155228107, 'rsi_os': 49, 'rsi_ob': 47, 'vol_spike': 0.14554089115612834, 'adx_thresh': 17.66843966356602, 'atr_min_pct': 0.012569208959395787, 'atr_max_pct': 0.12785112833726675, 'tp_mult': 2.4159898906301325, 'tsl_mult': 0.6474617501094719, 'strategy': 'breakout', 'time_stop': 166, 'use_sma': False, 'use_atr': False, 'use_adx': False, 'use_ema': True, 'use_spike': False, 'rsi_required': True, 'edge_k': 1.1587920218714691, 'edge_cap': 0.8722255024761555, 'bull_strategy': 'mean_reversion', 'bull_bb_std_mult': 0.9017713192172379, 'bull_rsi_os': 18, 'bull_rsi_ob': 67, 'bull_adx_thresh': 31.518539055395443, 'bull_atr_min_pct': 0.017707162242530994, 'bull_atr_max_pct': 0.06995291045423516, 'bull_tp_mult': 2.3741872216875106, 'bull_tsl_mult': 0.48287820028115225, 'bull_time_stop': 290, 'bull_use_sma': True, 'bull_use_ema': False, 'bull_use_atr': False, 'bull_use_adx': True, 'bull_use_spike': False, 'bull_rsi_required': False, 'bear_strategy': 'breakout', 'bear_bb_std_mult': 3.0436645139168466, 'bear_rsi_os': 51, 'bear_rsi_ob': 80, 'bear_adx_thresh': 31.617139538715175, 'bear_atr_min_pct': 0.022103338215984557, 'bear_atr_max_pct': 0.07652939928092214, 'bear_tp_mult': 2.676799296805046, 'bear_tsl_mult': 0.5497158003881235, 'bear_time_stop': 18, 'bear_use_sma': True, 'bear_use_ema': False, 'bear_use_atr': False, 'bear_use_adx': True, 'bear_use_spike': False, 'bear_rsi_required': True, 'sideways_strategy': 'breakout', 'sideways_bb_std_mult': 1.4366786548601582, 'sideways_rsi_os': 34, 'sideways_rsi_ob': 65, 'sideways_adx_thresh': 24.104456133640106, 'sideways_atr_min_pct': 0.0020779187581541434, 'sideways_atr_max_pct': 0.02288594562887086, 'sideways_tp_mult': 1.203956014182785, 'sideways_tsl_mult': 0.11716593701093142, 'sideways_time_stop': 226, 'sideways_use_sma': True, 'sideways_use_ema': False, 'sideways_use_atr': False, 'sideways_use_adx': True, 'sideways_use_spike': False, 'sideways_rsi_required': False}.
[I 2025-08-31 10:17:40,017] Trial 463 finished with values: [-1000000000.0, 1000000000.0] and parameters: {'p_sma': 25, 'p_std': 14, 'p_atr': 28, 'p_adx': 28, 'rsi_period': 52, 'ema1': 21, 'ema2': 11, 'slip_atr_k': 0.18977719559671496, 'slip_spread_k': 0.7964761532760998, 'spread_hl_frac': 0.01479614561239313, 'bb_std_mult': 0.9738048986341986, 'rsi_os': 48, 'rsi_ob': 78, 'vol_spike': 0.12529402311114046, 'adx_thresh': 5.52694527176355, 'atr_min_pct': 0.012404885967611027, 'atr_max_pct': 0.12743521998483787, 'tp_mult': 1.3762865966534426, 'tsl_mult': 0.6517473041189237, 'strategy': 'breakout', 'time_stop': 235, 'use_sma': False, 'use_atr': False, 'use_adx': False, 'use_ema': False, 'use_spike': True, 'rsi_required': True, 'edge_k': 0.5027090161038323, 'edge_cap': 0.8746715420574405, 'bull_strategy': 'mean_reversion', 'bull_bb_std_mult': 1.627766928478118, 'bull_rsi_os': 13, 'bull_rsi_ob': 67, 'bull_adx_thresh': 31.243541347711027, 'bull_atr_min_pct': 0.0193963541497539, 'bull_atr_max_pct': 0.09435296087960189, 'bull_tp_mult': 1.3667370082029462, 'bull_tsl_mult': 0.5716751502071168, 'bull_time_stop': 211, 'bull_use_sma': True, 'bull_use_ema': False, 'bull_use_atr': False, 'bull_use_adx': True, 'bull_use_spike': False, 'bull_rsi_required': False, 'bear_strategy': 'breakout', 'bear_bb_std_mult': 3.039055211550617, 'bear_rsi_os': 53, 'bear_rsi_ob': 80, 'bear_adx_thresh': 21.761471106438208, 'bear_atr_min_pct': 0.0035005926485275653, 'bear_atr_max_pct': 0.07880935436493001, 'bear_tp_mult': 1.709202120191037, 'bear_tsl_mult': 0.8127121928067875, 'bear_time_stop': 69, 'bear_use_sma': True, 'bear_use_ema': False, 'bear_use_atr': True, 'bear_use_adx': True, 'bear_use_spike': False, 'bear_rsi_required': True, 'sideways_strategy': 'breakout', 'sideways_bb_std_mult': 1.0365942056115696, 'sideways_rsi_os': 27, 'sideways_rsi_ob': 74, 'sideways_adx_thresh': 33.70417114410398, 'sideways_atr_min_pct': 0.002119344951593442, 'sideways_atr_max_pct': 0.07246723150176006, 'sideways_tp_mult': 1.3995369471663408, 'sideways_tsl_mult': 0.09558691762427653, 'sideways_time_stop': 244, 'sideways_use_sma': False, 'sideways_use_ema': False, 'sideways_use_atr': False, 'sideways_use_adx': True, 'sideways_use_spike': False, 'sideways_rsi_required': False}.
[I 2025-08-31 10:17:40,139] Trial 464 finished with values: [-1000000000.0, 1000000000.0] and parameters: {'p_sma': 57, 'p_std': 9, 'p_atr': 7, 'p_adx': 19, 'rsi_period': 52, 'ema1': 11, 'ema2': 29, 'slip_atr_k': 0.1454252356774751, 'slip_spread_k': 0.42964907030838323, 'spread_hl_frac': 0.01917630065180272, 'bb_std_mult': 0.9750619272940617, 'rsi_os': 22, 'rsi_ob': 57, 'vol_spike': 0.14720046615996152, 'adx_thresh': 5.565139662987738, 'atr_min_pct': 0.012602577574658312, 'atr_max_pct': 0.1497660436386482, 'tp_mult': 1.998094454935026, 'tsl_mult': 0.019835624414237807, 'strategy': 'breakout', 'time_stop': 235, 'use_sma': False, 'use_atr': False, 'use_adx': False, 'use_ema': False, 'use_spike': True, 'rsi_required': True, 'edge_k': 0.5115877766416885, 'edge_cap': 0.19938762291696543, 'bull_strategy': 'mean_reversion', 'bull_bb_std_mult': 0.903893669408645, 'bull_rsi_os': 24, 'bull_rsi_ob': 67, 'bull_adx_thresh': 31.24478091761828, 'bull_atr_min_pct': 0.011778304204187386, 'bull_atr_max_pct': 0.09658758339251752, 'bull_tp_mult': 2.3801174243082097, 'bull_tsl_mult': 0.5825164724384917, 'bull_time_stop': 265, 'bull_use_sma': True, 'bull_use_ema': True, 'bull_use_atr': False, 'bull_use_adx': True, 'bull_use_spike': False, 'bull_rsi_required': False, 'bear_strategy': 'breakout', 'bear_bb_std_mult': 2.775249716499174, 'bear_rsi_os': 53, 'bear_rsi_ob': 80, 'bear_adx_thresh': 31.891498016909246, 'bear_atr_min_pct': 0.02239532161626353, 'bear_atr_max_pct': 0.07543907654981681, 'bear_tp_mult': 1.8818339647213829, 'bear_tsl_mult': 0.8121542420139947, 'bear_time_stop': 70, 'bear_use_sma': True, 'bear_use_ema': False, 'bear_use_atr': True, 'bear_use_adx': True, 'bear_use_spike': False, 'bear_rsi_required': True, 'sideways_strategy': 'breakout', 'sideways_bb_std_mult': 1.0342925714150173, 'sideways_rsi_os': 27, 'sideways_rsi_ob': 74, 'sideways_adx_thresh': 33.712422512172324, 'sideways_atr_min_pct': 0.028733728737716853, 'sideways_atr_max_pct': 0.14865593722140086, 'sideways_tp_mult': 1.2046723436599849, 'sideways_tsl_mult': 0.08978916633049443, 'sideways_time_stop': 241, 'sideways_use_sma': False, 'sideways_use_ema': False, 'sideways_use_atr': False, 'sideways_use_adx': True, 'sideways_use_spike': False, 'sideways_rsi_required': False}.
[I 2025-08-31 10:18:11,018] Trial 465 finished with values: [-0.08473473722861413, 0.08458261059398456] and parameters: {'p_sma': 45, 'p_std': 14, 'p_atr': 7, 'p_adx': 10, 'rsi_period': 10, 'ema1': 19, 'ema2': 39, 'slip_atr_k': 0.19149971179890213, 'slip_spread_k': 0.43058962427815983, 'spread_hl_frac': 0.014772819494169103, 'bb_std_mult': 1.015264684202663, 'rsi_os': 26, 'rsi_ob': 78, 'vol_spike': 0.14438313920616977, 'adx_thresh': 5.945577524797877, 'atr_min_pct': 0.012257781752245473, 'atr_max_pct': 0.13639174384438343, 'tp_mult': 1.3744600640154832, 'tsl_mult': 0.020262959294856796, 'strategy': 'mean_reversion', 'time_stop': 143, 'use_sma': False, 'use_atr': False, 'use_adx': False, 'use_ema': False, 'use_spike': True, 'rsi_required': True, 'edge_k': 1.1447213511414582, 'edge_cap': 0.8741932730733057, 'bull_strategy': 'mean_reversion', 'bull_bb_std_mult': 1.6269268334601603, 'bull_rsi_os': 41, 'bull_rsi_ob': 67, 'bull_adx_thresh': 31.188503665383287, 'bull_atr_min_pct': 0.021283353847713335, 'bull_atr_max_pct': 0.09359099604949699, 'bull_tp_mult': 2.84245605536696, 'bull_tsl_mult': 0.03186097517098163, 'bull_time_stop': 179, 'bull_use_sma': True, 'bull_use_ema': True, 'bull_use_atr': True, 'bull_use_adx': True, 'bull_use_spike': False, 'bull_rsi_required': False, 'bear_strategy': 'breakout', 'bear_bb_std_mult': 3.0587732271870847, 'bear_rsi_os': 34, 'bear_rsi_ob': 80, 'bear_adx_thresh': 31.923130583160077, 'bear_atr_min_pct': 0.018229817970436244, 'bear_atr_max_pct': 0.08890989324512376, 'bear_tp_mult': 2.691326953158109, 'bear_tsl_mult': 0.4994120067953139, 'bear_time_stop': 17, 'bear_use_sma': True, 'bear_use_ema': False, 'bear_use_atr': True, 'bear_use_adx': True, 'bear_use_spike': False, 'bear_rsi_required': True, 'sideways_strategy': 'breakout', 'sideways_bb_std_mult': 2.5764602904339293, 'sideways_rsi_os': 34, 'sideways_rsi_ob': 48, 'sideways_adx_thresh': 21.24861767899582, 'sideways_atr_min_pct': 0.001880007540893167, 'sideways_atr_max_pct': 0.02234233000331739, 'sideways_tp_mult': 1.4045164611963332, 'sideways_tsl_mult': 0.09096687694075306, 'sideways_time_stop': 242, 'sideways_use_sma': False, 'sideways_use_ema': False, 'sideways_use_atr': False, 'sideways_use_adx': True, 'sideways_use_spike': False, 'sideways_rsi_required': False}.
[I 2025-08-31 10:18:12,209] Trial 466 finished with values: [-1000000000.0, 1000000000.0] and parameters: {'p_sma': 57, 'p_std': 11, 'p_atr': 25, 'p_adx': 8, 'rsi_period': 49, 'ema1': 22, 'ema2': 19, 'slip_atr_k': 0.1441298192022913, 'slip_spread_k': 0.43346943629438656, 'spread_hl_frac': 0.043453131484698024, 'bb_std_mult': 3.173603138265312, 'rsi_os': 22, 'rsi_ob': 80, 'vol_spike': 0.03355815101251093, 'adx_thresh': 31.28291234905683, 'atr_min_pct': 0.014266368856618705, 'atr_max_pct': 0.1358534447215579, 'tp_mult': 1.7315896784906966, 'tsl_mult': 0.03172296327232416, 'strategy': 'mean_reversion', 'time_stop': 144, 'use_sma': True, 'use_atr': True, 'use_adx': True, 'use_ema': False, 'use_spike': True, 'rsi_required': True, 'edge_k': 1.7599649791971448, 'edge_cap': 0.9560784627235146, 'bull_strategy': 'breakout', 'bull_bb_std_mult': 1.299809981084763, 'bull_rsi_os': 49, 'bull_rsi_ob': 63, 'bull_adx_thresh': 30.072030208816173, 'bull_atr_min_pct': 0.016843932736737795, 'bull_atr_max_pct': 0.11386298072430755, 'bull_tp_mult': 2.048900776927177, 'bull_tsl_mult': 0.02890769036871621, 'bull_time_stop': 221, 'bull_use_sma': False, 'bull_use_ema': True, 'bull_use_atr': True, 'bull_use_adx': False, 'bull_use_spike': True, 'bull_rsi_required': True, 'bear_strategy': 'mean_reversion', 'bear_bb_std_mult': 1.9938168622296626, 'bear_rsi_os': 47, 'bear_rsi_ob': 58, 'bear_adx_thresh': 25.004832807644448, 'bear_atr_min_pct': 0.022593680590088247, 'bear_atr_max_pct': 0.09016808367594575, 'bear_tp_mult': 2.726693832718306, 'bear_tsl_mult': 0.20766097148036916, 'bear_time_stop': 86, 'bear_use_sma': False, 'bear_use_ema': True, 'bear_use_atr': False, 'bear_use_adx': False, 'bear_use_spike': False, 'bear_rsi_required': False, 'sideways_strategy': 'mean_reversion', 'sideways_bb_std_mult': 1.200946375076965, 'sideways_rsi_os': 21, 'sideways_rsi_ob': 62, 'sideways_adx_thresh': 32.48807041574177, 'sideways_atr_min_pct': 0.028718793860737453, 'sideways_atr_max_pct': 0.08221175225909287, 'sideways_tp_mult': 2.839780039753969, 'sideways_tsl_mult': 0.6038437249561867, 'sideways_time_stop': 93, 'sideways_use_sma': True, 'sideways_use_ema': True, 'sideways_use_atr': True, 'sideways_use_adx': False, 'sideways_use_spike': False, 'sideways_rsi_required': True}.
[I 2025-08-31 10:18:12,431] Trial 467 finished with values: [-1000000000.0, 1000000000.0] and parameters: {'p_sma': 50, 'p_std': 40, 'p_atr': 25, 'p_adx': 19, 'rsi_period': 23, 'ema1': 11, 'ema2': 39, 'slip_atr_k': 0.14451119603498905, 'slip_spread_k': 0.42579280897294297, 'spread_hl_frac': 0.016244337154370063, 'bb_std_mult': 3.1816824556804697, 'rsi_os': 26, 'rsi_ob': 57, 'vol_spike': 0.24365105993328973, 'adx_thresh': 6.71504058064132, 'atr_min_pct': 0.013393333275244916, 'atr_max_pct': 0.13452139902104895, 'tp_mult': 1.20164837705346, 'tsl_mult': 0.020282200659053756, 'strategy': 'mean_reversion', 'time_stop': 275, 'use_sma': True, 'use_atr': True, 'use_adx': True, 'use_ema': False, 'use_spike': True, 'rsi_required': True, 'edge_k': 1.7594029185320452, 'edge_cap': 0.9185333493786038, 'bull_strategy': 'breakout', 'bull_bb_std_mult': 1.7125321729910055, 'bull_rsi_os': 29, 'bull_rsi_ob': 95, 'bull_adx_thresh': 16.012478908213335, 'bull_atr_min_pct': 0.016775237423191383, 'bull_atr_max_pct': 0.11512426718679872, 'bull_tp_mult': 1.5457432443301933, 'bull_tsl_mult': 0.026949473026250836, 'bull_time_stop': 234, 'bull_use_sma': False, 'bull_use_ema': True, 'bull_use_atr': True, 'bull_use_adx': False, 'bull_use_spike': True, 'bull_rsi_required': True, 'bear_strategy': 'mean_reversion', 'bear_bb_std_mult': 2.242837498892189, 'bear_rsi_os': 21, 'bear_rsi_ob': 59, 'bear_adx_thresh': 12.37584276826617, 'bear_atr_min_pct': 0.018059076871715124, 'bear_atr_max_pct': 0.012201482773862377, 'bear_tp_mult': 1.892570511662305, 'bear_tsl_mult': 0.49995794628146273, 'bear_time_stop': 243, 'bear_use_sma': False, 'bear_use_ema': True, 'bear_use_atr': False, 'bear_use_adx': False, 'bear_use_spike': False, 'bear_rsi_required': False, 'sideways_strategy': 'mean_reversion', 'sideways_bb_std_mult': 1.1981056042869327, 'sideways_rsi_os': 27, 'sideways_rsi_ob': 50, 'sideways_adx_thresh': 32.88828547609605, 'sideways_atr_min_pct': 0.0028489208397724864, 'sideways_atr_max_pct': 0.1480074808671739, 'sideways_tp_mult': 1.629680327602439, 'sideways_tsl_mult': 0.6044400249856798, 'sideways_time_stop': 114, 'sideways_use_sma': True, 'sideways_use_ema': True, 'sideways_use_atr': True, 'sideways_use_adx': False, 'sideways_use_spike': False, 'sideways_rsi_required': True}.
