[I 2025-08-31 13:32:04,663] Trial 747 finished with values: [-1000000000.0, 1000000000.0] and parameters: {'p_sma': 28, 'p_std': 22, 'p_atr': 25, 'p_adx': 24, 'rsi_period': 45, 'ema1': 29, 'ema2': 19, 'slip_atr_k': 0.02836731313887994, 'slip_spread_k': 0.41461017421892254, 'spread_hl_frac': 0.018749209523441897, 'bb_std_mult': 2.175725211497112, 'rsi_os': 39, 'rsi_ob': 92, 'vol_spike': 0.10368310544175013, 'adx_thresh': 9.439675037529796, 'atr_min_pct': 0.0248515450067396, 'atr_max_pct': 0.06507235824266422, 'tp_mult': 2.586575069224229, 'tsl_mult': 0.8255696300198341, 'strategy': 'breakout', 'time_stop': 142, 'use_sma': False, 'use_atr': False, 'use_adx': True, 'use_ema': True, 'use_spike': True, 'rsi_required': False, 'edge_k': 0.6033802109133821, 'edge_cap': 0.3233252456177414, 'bull_strategy': 'mean_reversion', 'bull_bb_std_mult': 2.37352346817451, 'bull_rsi_os': 21, 'bull_rsi_ob': 82, 'bull_adx_thresh': 28.51600189064154, 'bull_atr_min_pct': 0.00850286871340927, 'bull_atr_max_pct': 0.13586067214159722, 'bull_tp_mult': 2.4598583221755193, 'bull_tsl_mult': 0.07973279582427895, 'bull_time_stop': 178, 'bull_use_sma': True, 'bull_use_ema': True, 'bull_use_atr': True, 'bull_use_adx': True, 'bull_use_spike': True, 'bull_rsi_required': True, 'bear_strategy': 'mean_reversion', 'bear_bb_std_mult': 2.4078192739441677, 'bear_rsi_os': 47, 'bear_rsi_ob': 73, 'bear_adx_thresh': 9.04246524384182, 'bear_atr_min_pct': 0.0133519928398563, 'bear_atr_max_pct': 0.11449224426863269, 'bear_tp_mult': 1.2639740012302008, 'bear_tsl_mult': 0.3141883615346237, 'bear_time_stop': 130, 'bear_use_sma': False, 'bear_use_ema': False, 'bear_use_atr': False, 'bear_use_adx': False, 'bear_use_spike': True, 'bear_rsi_required': False, 'sideways_strategy': 'breakout', 'sideways_bb_std_mult': 2.7170421965170988, 'sideways_rsi_os': 31, 'sideways_rsi_ob': 72, 'sideways_adx_thresh': 31.875316838117215, 'sideways_atr_min_pct': 0.022671103749298198, 'sideways_atr_max_pct': 0.1447029210804035, 'sideways_tp_mult': 2.43039218220735, 'sideways_tsl_mult': 0.8562404087134546, 'sideways_time_stop': 73, 'sideways_use_sma': False, 'sideways_use_ema': False, 'sideways_use_atr': True, 'sideways_use_adx': True, 'sideways_use_spike': False, 'sideways_rsi_required': True}.
[I 2025-08-31 13:32:04,818] Trial 746 finished with values: [-0.04899590752484806, 0.04926897431196019] and parameters: {'p_sma': 22, 'p_std': 23, 'p_atr': 15, 'p_adx': 24, 'rsi_period': 45, 'ema1': 29, 'ema2': 19, 'slip_atr_k': 0.0421964103783667, 'slip_spread_k': 0.40276929358020724, 'spread_hl_frac': 0.04133649191729005, 'bb_std_mult': 0.8506149756386081, 'rsi_os': 39, 'rsi_ob': 92, 'vol_spike': 0.021442254853522403, 'adx_thresh': 9.224414162769078, 'atr_min_pct': 0.02493683273337207, 'atr_max_pct': 0.05056805746847717, 'tp_mult': 1.3192783104382009, 'tsl_mult': 0.9342850057974985, 'strategy': 'breakout', 'time_stop': 180, 'use_sma': False, 'use_atr': False, 'use_adx': True, 'use_ema': True, 'use_spike': True, 'rsi_required': False, 'edge_k': 0.0016323050600196565, 'edge_cap': 0.5795500315042841, 'bull_strategy': 'mean_reversion', 'bull_bb_std_mult': 1.2339745172902945, 'bull_rsi_os': 6, 'bull_rsi_ob': 82, 'bull_adx_thresh': 16.649027863214627, 'bull_atr_min_pct': 0.008512425834028621, 'bull_atr_max_pct': 0.1375021761166532, 'bull_tp_mult': 2.3538721375817655, 'bull_tsl_mult': 0.2769889384533665, 'bull_time_stop': 177, 'bull_use_sma': True, 'bull_use_ema': True, 'bull_use_atr': True, 'bull_use_adx': True, 'bull_use_spike': True, 'bull_rsi_required': True, 'bear_strategy': 'mean_reversion', 'bear_bb_std_mult': 3.400429792139553, 'bear_rsi_os': 27, 'bear_rsi_ob': 50, 'bear_adx_thresh': 20.05689147819316, 'bear_atr_min_pct': 0.0006984670539748265, 'bear_atr_max_pct': 0.12502722612797823, 'bear_tp_mult': 1.2825146221995176, 'bear_tsl_mult': 0.47250958497952567, 'bear_time_stop': 130, 'bear_use_sma': False, 'bear_use_ema': True, 'bear_use_atr': False, 'bear_use_adx': False, 'bear_use_spike': True, 'bear_rsi_required': True, 'sideways_strategy': 'breakout', 'sideways_bb_std_mult': 2.736284297702699, 'sideways_rsi_os': 25, 'sideways_rsi_ob': 63, 'sideways_adx_thresh': 7.4631718970758385, 'sideways_atr_min_pct': 0.0032357698720592134, 'sideways_atr_max_pct': 0.1444047447522036, 'sideways_tp_mult': 2.441697882520616, 'sideways_tsl_mult': 0.8666388727871954, 'sideways_time_stop': 45, 'sideways_use_sma': False, 'sideways_use_ema': False, 'sideways_use_atr': True, 'sideways_use_adx': True, 'sideways_use_spike': False, 'sideways_rsi_required': False}.
[I 2025-08-31 13:32:37,854] Trial 752 finished with values: [-1000000000.0, 1000000000.0] and parameters: {'p_sma': 19, 'p_std': 22, 'p_atr': 15, 'p_adx': 27, 'rsi_period': 48, 'ema1': 8, 'ema2': 21, 'slip_atr_k': 0.1353072663048948, 'slip_spread_k': 0.38215651948706353, 'spread_hl_frac': 0.021288251433122705, 'bb_std_mult': 1.9031530223704676, 'rsi_os': 40, 'rsi_ob': 46, 'vol_spike': 0.1319383831042636, 'adx_thresh': 8.220859243660081, 'atr_min_pct': 0.019209293503144688, 'atr_max_pct': 0.047245217148382854, 'tp_mult': 2.5539945285938512, 'tsl_mult': 0.4073327929127941, 'strategy': 'breakout', 'time_stop': 164, 'use_sma': True, 'use_atr': False, 'use_adx': True, 'use_ema': True, 'use_spike': True, 'rsi_required': False, 'edge_k': 0.5030821631372473, 'edge_cap': 0.6564231094899654, 'bull_strategy': 'mean_reversion', 'bull_bb_std_mult': 0.6743736677332965, 'bull_rsi_os': 29, 'bull_rsi_ob': 86, 'bull_adx_thresh': 17.923867602855637, 'bull_atr_min_pct': 0.021345858413421678, 'bull_atr_max_pct': 0.03637751809335444, 'bull_tp_mult': 2.5269296023676513, 'bull_tsl_mult': 0.054158015924086644, 'bull_time_stop': 164, 'bull_use_sma': False, 'bull_use_ema': False, 'bull_use_atr': True, 'bull_use_adx': True, 'bull_use_spike': True, 'bull_rsi_required': True, 'bear_strategy': 'breakout', 'bear_bb_std_mult': 1.750743181269248, 'bear_rsi_os': 7, 'bear_rsi_ob': 46, 'bear_adx_thresh': 19.257740679775722, 'bear_atr_min_pct': 0.020503573264151833, 'bear_atr_max_pct': 0.1332584578836941, 'bear_tp_mult': 1.1536836006042963, 'bear_tsl_mult': 0.7265856089347542, 'bear_time_stop': 202, 'bear_use_sma': False, 'bear_use_ema': True, 'bear_use_atr': False, 'bear_use_adx': False, 'bear_use_spike': True, 'bear_rsi_required': True, 'sideways_strategy': 'mean_reversion', 'sideways_bb_std_mult': 2.1942520701663883, 'sideways_rsi_os': 27, 'sideways_rsi_ob': 65, 'sideways_adx_thresh': 5.6169133810523615, 'sideways_atr_min_pct': 0.012218175384717974, 'sideways_atr_max_pct': 0.08260918862546587, 'sideways_tp_mult': 1.7340338477626709, 'sideways_tsl_mult': 0.8858118948086701, 'sideways_time_stop': 39, 'sideways_use_sma': False, 'sideways_use_ema': False, 'sideways_use_atr': True, 'sideways_use_adx': True, 'sideways_use_spike': False, 'sideways_rsi_required': True}.
[I 2025-08-31 13:32:37,902] Trial 750 finished with values: [-1000000000.0, 1000000000.0] and parameters: {'p_sma': 25, 'p_std': 22, 'p_atr': 30, 'p_adx': 7, 'rsi_period': 47, 'ema1': 29, 'ema2': 19, 'slip_atr_k': 0.13821139960670126, 'slip_spread_k': 0.3868849827336855, 'spread_hl_frac': 0.017714162857534743, 'bb_std_mult': 2.1941716061726027, 'rsi_os': 43, 'rsi_ob': 92, 'vol_spike': 0.13291711475272264, 'adx_thresh': 8.23406256394719, 'atr_min_pct': 0.024870925883626216, 'atr_max_pct': 0.04628619411749692, 'tp_mult': 2.5955186876534055, 'tsl_mult': 0.39926436542815735, 'strategy': 'breakout', 'time_stop': 63, 'use_sma': False, 'use_atr': False, 'use_adx': True, 'use_ema': True, 'use_spike': True, 'rsi_required': False, 'edge_k': 0.6307523997419223, 'edge_cap': 0.664242928192157, 'bull_strategy': 'mean_reversion', 'bull_bb_std_mult': 1.2332526756093616, 'bull_rsi_os': 5, 'bull_rsi_ob': 85, 'bull_adx_thresh': 20.279096198040463, 'bull_atr_min_pct': 0.0213653933451482, 'bull_atr_max_pct': 0.030677253442964528, 'bull_tp_mult': 1.6583941418267005, 'bull_tsl_mult': 0.0773871943720365, 'bull_time_stop': 145, 'bull_use_sma': False, 'bull_use_ema': True, 'bull_use_atr': True, 'bull_use_adx': True, 'bull_use_spike': True, 'bull_rsi_required': True, 'bear_strategy': 'mean_reversion', 'bear_bb_std_mult': 3.405011156960228, 'bear_rsi_os': 30, 'bear_rsi_ob': 71, 'bear_adx_thresh': 19.5889202734997, 'bear_atr_min_pct': 0.007332229100348187, 'bear_atr_max_pct': 0.027943411564323367, 'bear_tp_mult': 1.0138942727551015, 'bear_tsl_mult': 0.7257233747298671, 'bear_time_stop': 204, 'bear_use_sma': False, 'bear_use_ema': False, 'bear_use_atr': False, 'bear_use_adx': False, 'bear_use_spike': True, 'bear_rsi_required': False, 'sideways_strategy': 'mean_reversion', 'sideways_bb_std_mult': 1.0209050264071213, 'sideways_rsi_os': 31, 'sideways_rsi_ob': 94, 'sideways_adx_thresh': 5.6075304764195355, 'sideways_atr_min_pct': 0.012220901485398384, 'sideways_atr_max_pct': 0.14771296778195475, 'sideways_tp_mult': 2.4326107474492638, 'sideways_tsl_mult': 0.49218684127673096, 'sideways_time_stop': 20, 'sideways_use_sma': False, 'sideways_use_ema': False, 'sideways_use_atr': True, 'sideways_use_adx': True, 'sideways_use_spike': False, 'sideways_rsi_required': True}.
[I 2025-08-31 13:32:38,173] Trial 751 finished with values: [-1000000000.0, 1000000000.0] and parameters: {'p_sma': 30, 'p_std': 23, 'p_atr': 15, 'p_adx': 7, 'rsi_period': 48, 'ema1': 15, 'ema2': 21, 'slip_atr_k': 0.12446694489241084, 'slip_spread_k': 0.38561450506604655, 'spread_hl_frac': 0.041070137428849775, 'bb_std_mult': 2.4335580992240837, 'rsi_os': 40, 'rsi_ob': 83, 'vol_spike': 0.023707236305441175, 'adx_thresh': 10.948243295445796, 'atr_min_pct': 0.022492191426559963, 'atr_max_pct': 0.04581075226236603, 'tp_mult': 1.8049718377161492, 'tsl_mult': 0.6057790384460804, 'strategy': 'breakout', 'time_stop': 118, 'use_sma': False, 'use_atr': False, 'use_adx': True, 'use_ema': True, 'use_spike': True, 'rsi_required': False, 'edge_k': 0.48665087469158386, 'edge_cap': 0.5407763147047406, 'bull_strategy': 'mean_reversion', 'bull_bb_std_mult': 3.481678282841269, 'bull_rsi_os': 28, 'bull_rsi_ob': 61, 'bull_adx_thresh': 33.52900143027864, 'bull_atr_min_pct': 0.021442042633693655, 'bull_atr_max_pct': 0.035643408338496343, 'bull_tp_mult': 2.1131760906135826, 'bull_tsl_mult': 0.2407534892065886, 'bull_time_stop': 144, 'bull_use_sma': False, 'bull_use_ema': True, 'bull_use_atr': True, 'bull_use_adx': True, 'bull_use_spike': True, 'bull_rsi_required': True, 'bear_strategy': 'breakout', 'bear_bb_std_mult': 3.397128142044722, 'bear_rsi_os': 26, 'bear_rsi_ob': 46, 'bear_adx_thresh': 18.913088024931287, 'bear_atr_min_pct': 0.02066663662225896, 'bear_atr_max_pct': 0.12430213324757965, 'bear_tp_mult': 1.1310029724433743, 'bear_tsl_mult': 0.5909957070423958, 'bear_time_stop': 28, 'bear_use_sma': False, 'bear_use_ema': True, 'bear_use_atr': False, 'bear_use_adx': False, 'bear_use_spike': True, 'bear_rsi_required': True, 'sideways_strategy': 'mean_reversion', 'sideways_bb_std_mult': 2.635840228243461, 'sideways_rsi_os': 27, 'sideways_rsi_ob': 65, 'sideways_adx_thresh': 24.527000242005276, 'sideways_atr_min_pct': 0.0037307275611878758, 'sideways_atr_max_pct': 0.14998078124576195, 'sideways_tp_mult': 1.7229622504248148, 'sideways_tsl_mult': 0.8878149679681648, 'sideways_time_stop': 19, 'sideways_use_sma': False, 'sideways_use_ema': False, 'sideways_use_atr': True, 'sideways_use_adx': True, 'sideways_use_spike': False, 'sideways_rsi_required': True}.
[I 2025-08-31 13:32:38,243] Trial 749 finished with values: [-1000000000.0, 1000000000.0] and parameters: {'p_sma': 28, 'p_std': 22, 'p_atr': 15, 'p_adx': 7, 'rsi_period': 47, 'ema1': 15, 'ema2': 19, 'slip_atr_k': 0.11199704044016752, 'slip_spread_k': 0.38522925745749453, 'spread_hl_frac': 0.038929454880301, 'bb_std_mult': 2.9472022298995153, 'rsi_os': 40, 'rsi_ob': 46, 'vol_spike': 0.10296919007902094, 'adx_thresh': 8.14710808812777, 'atr_min_pct': 0.018854204864439113, 'atr_max_pct': 0.04655749954248724, 'tp_mult': 2.5986825978464307, 'tsl_mult': 0.3941407520731435, 'strategy': 'breakout', 'time_stop': 108, 'use_sma': False, 'use_atr': False, 'use_adx': True, 'use_ema': True, 'use_spike': True, 'rsi_required': False, 'edge_k': 1.8106344352711679, 'edge_cap': 0.6661084849516402, 'bull_strategy': 'mean_reversion', 'bull_bb_std_mult': 1.524083904339067, 'bull_rsi_os': 5, 'bull_rsi_ob': 85, 'bull_adx_thresh': 17.90324876742168, 'bull_atr_min_pct': 0.022371911587358448, 'bull_atr_max_pct': 0.12696022838199839, 'bull_tp_mult': 2.529833245403666, 'bull_tsl_mult': 0.019626904771234965, 'bull_time_stop': 204, 'bull_use_sma': False, 'bull_use_ema': True, 'bull_use_atr': True, 'bull_use_adx': True, 'bull_use_spike': True, 'bull_rsi_required': True, 'bear_strategy': 'mean_reversion', 'bear_bb_std_mult': 3.4072107093146826, 'bear_rsi_os': 30, 'bear_rsi_ob': 71, 'bear_adx_thresh': 18.84581539821661, 'bear_atr_min_pct': 0.00692491118356108, 'bear_atr_max_pct': 0.12424745500212853, 'bear_tp_mult': 1.0101424844694558, 'bear_tsl_mult': 0.3060640174441897, 'bear_time_stop': 200, 'bear_use_sma': False, 'bear_use_ema': False, 'bear_use_atr': False, 'bear_use_adx': False, 'bear_use_spike': True, 'bear_rsi_required': False, 'sideways_strategy': 'mean_reversion', 'sideways_bb_std_mult': 2.1964067041770536, 'sideways_rsi_os': 31, 'sideways_rsi_ob': 77, 'sideways_adx_thresh': 25.4162635471706, 'sideways_atr_min_pct': 0.003860743089955176, 'sideways_atr_max_pct': 0.14999631153833592, 'sideways_tp_mult': 2.436520197166333, 'sideways_tsl_mult': 0.8553659613625056, 'sideways_time_stop': 39, 'sideways_use_sma': False, 'sideways_use_ema': False, 'sideways_use_atr': True, 'sideways_use_adx': True, 'sideways_use_spike': False, 'sideways_rsi_required': True}.
[I 2025-08-31 13:33:12,287] Trial 755 finished with values: [-1000000000.0, 1000000000.0] and parameters: {'p_sma': 5, 'p_std': 20, 'p_atr': 19, 'p_adx': 26, 'rsi_period': 49, 'ema1': 12, 'ema2': 18, 'slip_atr_k': 0.10148842559657145, 'slip_spread_k': 0.4196617240272769, 'spread_hl_frac': 0.01967718773918441, 'bb_std_mult': 3.5958763190263845, 'rsi_os': 26, 'rsi_ob': 84, 'vol_spike': 0.006862009445882887, 'adx_thresh': 6.055077464069358, 'atr_min_pct': 0.02368359967590633, 'atr_max_pct': 0.053473399128119506, 'tp_mult': 1.6238643154534742, 'tsl_mult': 0.6566210545901949, 'strategy': 'mean_reversion', 'time_stop': 105, 'use_sma': False, 'use_atr': False, 'use_adx': True, 'use_ema': False, 'use_spike': True, 'rsi_required': False, 'edge_k': 1.2584675909595502, 'edge_cap': 0.15318255703734324, 'bull_strategy': 'mean_reversion', 'bull_bb_std_mult': 2.7570315251066093, 'bull_rsi_os': 42, 'bull_rsi_ob': 90, 'bull_adx_thresh': 19.189208109583156, 'bull_atr_min_pct': 0.02075257557869936, 'bull_atr_max_pct': 0.1261773831721633, 'bull_tp_mult': 2.0709031646226963, 'bull_tsl_mult': 0.4846717880704889, 'bull_time_stop': 197, 'bull_use_sma': True, 'bull_use_ema': True, 'bull_use_atr': True, 'bull_use_adx': False, 'bull_use_spike': True, 'bull_rsi_required': True, 'bear_strategy': 'breakout', 'bear_bb_std_mult': 3.2649527138323235, 'bear_rsi_os': 42, 'bear_rsi_ob': 69, 'bear_adx_thresh': 25.148877075676236, 'bear_atr_min_pct': 0.02509316710996021, 'bear_atr_max_pct': 0.1289543153203211, 'bear_tp_mult': 1.1739033049329484, 'bear_tsl_mult': 0.6762608391228903, 'bear_time_stop': 122, 'bear_use_sma': False, 'bear_use_ema': True, 'bear_use_atr': False, 'bear_use_adx': False, 'bear_use_spike': False, 'bear_rsi_required': True, 'sideways_strategy': 'breakout', 'sideways_bb_std_mult': 1.1404185079427893, 'sideways_rsi_os': 29, 'sideways_rsi_ob': 68, 'sideways_adx_thresh': 25.44964751773553, 'sideways_atr_min_pct': 0.003776816681996573, 'sideways_atr_max_pct': 0.03630668863043638, 'sideways_tp_mult': 1.6895255410532808, 'sideways_tsl_mult': 0.7969291375219294, 'sideways_time_stop': 61, 'sideways_use_sma': False, 'sideways_use_ema': True, 'sideways_use_atr': True, 'sideways_use_adx': True, 'sideways_use_spike': True, 'sideways_rsi_required': True}.
[I 2025-08-31 13:33:12,300] Trial 754 finished with values: [-1000000000.0, 1000000000.0] and parameters: {'p_sma': 7, 'p_std': 49, 'p_atr': 14, 'p_adx': 12, 'rsi_period': 50, 'ema1': 13, 'ema2': 18, 'slip_atr_k': 0.125442615269713, 'slip_spread_k': 0.506399979745295, 'spread_hl_frac': 0.005490222059852546, 'bb_std_mult': 2.935675106992555, 'rsi_os': 38, 'rsi_ob': 88, 'vol_spike': 0.009045392699850672, 'adx_thresh': 6.106570945793942, 'atr_min_pct': 0.02360954412254758, 'atr_max_pct': 0.14993685712958882, 'tp_mult': 2.518888881500889, 'tsl_mult': 0.619222045062386, 'strategy': 'breakout', 'time_stop': 117, 'use_sma': False, 'use_atr': False, 'use_adx': True, 'use_ema': False, 'use_spike': True, 'rsi_required': False, 'edge_k': 1.251672668783765, 'edge_cap': 0.13739237364194795, 'bull_strategy': 'mean_reversion', 'bull_bb_std_mult': 1.3633173073198437, 'bull_rsi_os': 7, 'bull_rsi_ob': 92, 'bull_adx_thresh': 19.152299198868914, 'bull_atr_min_pct': 0.027770222919573706, 'bull_atr_max_pct': 0.07673350649763243, 'bull_tp_mult': 1.5564476202188775, 'bull_tsl_mult': 0.23892976275389616, 'bull_time_stop': 199, 'bull_use_sma': True, 'bull_use_ema': True, 'bull_use_atr': True, 'bull_use_adx': True, 'bull_use_spike': True, 'bull_rsi_required': True, 'bear_strategy': 'breakout', 'bear_bb_std_mult': 2.6792730855007614, 'bear_rsi_os': 28, 'bear_rsi_ob': 64, 'bear_adx_thresh': 16.180404201173186, 'bear_atr_min_pct': 0.001984526883982003, 'bear_atr_max_pct': 0.0682013077299613, 'bear_tp_mult': 1.188423075992883, 'bear_tsl_mult': 0.590109924753032, 'bear_time_stop': 186, 'bear_use_sma': False, 'bear_use_ema': True, 'bear_use_atr': False, 'bear_use_adx': False, 'bear_use_spike': True, 'bear_rsi_required': True, 'sideways_strategy': 'breakout', 'sideways_bb_std_mult': 2.6583114099068115, 'sideways_rsi_os': 29, 'sideways_rsi_ob': 77, 'sideways_adx_thresh': 15.487160527639688, 'sideways_atr_min_pct': 0.0039531571845407235, 'sideways_atr_max_pct': 0.1475561339956574, 'sideways_tp_mult': 1.8323119225149755, 'sideways_tsl_mult': 0.8494461781286169, 'sideways_time_stop': 92, 'sideways_use_sma': False, 'sideways_use_ema': True, 'sideways_use_atr': True, 'sideways_use_adx': True, 'sideways_use_spike': False, 'sideways_rsi_required': True}.
[I 2025-08-31 13:33:12,554] Trial 753 finished with values: [-0.09845122699030107, 0.09786306782083892] and parameters: {'p_sma': 41, 'p_std': 20, 'p_atr': 14, 'p_adx': 14, 'rsi_period': 53, 'ema1': 17, 'ema2': 52, 'slip_atr_k': 0.04537527634454325, 'slip_spread_k': 0.24600960232058167, 'spread_hl_frac': 0.00925305338453022, 'bb_std_mult': 2.412247549093038, 'rsi_os': 55, 'rsi_ob': 83, 'vol_spike': 0.010568426741473841, 'adx_thresh': 6.317870671890149, 'atr_min_pct': 0.0225164592939463, 'atr_max_pct': 0.04026514155230207, 'tp_mult': 1.8107979535182488, 'tsl_mult': 0.8422426332665064, 'strategy': 'breakout', 'time_stop': 168, 'use_sma': False, 'use_atr': False, 'use_adx': True, 'use_ema': False, 'use_spike': True, 'rsi_required': False, 'edge_k': 1.236701024961309, 'edge_cap': 0.5240547808927027, 'bull_strategy': 'mean_reversion', 'bull_bb_std_mult': 2.7550687776257714, 'bull_rsi_os': 7, 'bull_rsi_ob': 92, 'bull_adx_thresh': 33.55972127707805, 'bull_atr_min_pct': 0.022393253021471368, 'bull_atr_max_pct': 0.125114911747766, 'bull_tp_mult': 2.07697805969196, 'bull_tsl_mult': 0.2443675440455753, 'bull_time_stop': 201, 'bull_use_sma': True, 'bull_use_ema': True, 'bull_use_atr': True, 'bull_use_adx': True, 'bull_use_spike': True, 'bull_rsi_required': True, 'bear_strategy': 'breakout', 'bear_bb_std_mult': 2.139878349067838, 'bear_rsi_os': 42, 'bear_rsi_ob': 69, 'bear_adx_thresh': 18.69825307637193, 'bear_atr_min_pct': 0.0019168663862002458, 'bear_atr_max_pct': 0.12863947600678824, 'bear_tp_mult': 1.4225768561557552, 'bear_tsl_mult': 0.3806904419323459, 'bear_time_stop': 121, 'bear_use_sma': False, 'bear_use_ema': True, 'bear_use_atr': False, 'bear_use_adx': False, 'bear_use_spike': True, 'bear_rsi_required': True, 'sideways_strategy': 'breakout', 'sideways_bb_std_mult': 1.3483372176206385, 'sideways_rsi_os': 30, 'sideways_rsi_ob': 66, 'sideways_adx_thresh': 15.656380804203712, 'sideways_atr_min_pct': 0.003674131406447093, 'sideways_atr_max_pct': 0.04413695820298701, 'sideways_tp_mult': 1.8213167075059113, 'sideways_tsl_mult': 0.5735949247071473, 'sideways_time_stop': 80, 'sideways_use_sma': False, 'sideways_use_ema': True, 'sideways_use_atr': True, 'sideways_use_adx': True, 'sideways_use_spike': False, 'sideways_rsi_required': True}.
