[I 2025-08-31 13:17:25,469] Trial 640 finished with values: [-0.006197994303060894, 0.007944028874040705] and parameters: {'p_sma': 30, 'p_std': 22, 'p_atr': 15, 'p_adx': 14, 'rsi_period': 49, 'ema1': 9, 'ema2': 19, 'slip_atr_k': 0.04354581488008889, 'slip_spread_k': 0.40764027781947854, 'spread_hl_frac': 0.01789828014905805, 'bb_std_mult': 2.317097481668966, 'rsi_os': 39, 'rsi_ob': 90, 'vol_spike': 0.019204952627408345, 'adx_thresh': 7.235297635317842, 'atr_min_pct': 0.026336479842493956, 'atr_max_pct': 0.04876187428329129, 'tp_mult': 2.5418677368384293, 'tsl_mult': 0.7698240169254515, 'strategy': 'breakout', 'time_stop': 173, 'use_sma': False, 'use_atr': False, 'use_adx': True, 'use_ema': True, 'use_spike': True, 'rsi_required': False, 'edge_k': 0.5900234360215906, 'edge_cap': 0.6777688344181163, 'bull_strategy': 'mean_reversion', 'bull_bb_std_mult': 2.797490212609513, 'bull_rsi_os': 5, 'bull_rsi_ob': 85, 'bull_adx_thresh': 18.360208679821575, 'bull_atr_min_pct': 0.02133707595943178, 'bull_atr_max_pct': 0.1427496624197331, 'bull_tp_mult': 2.2772468634545646, 'bull_tsl_mult': 0.25607244764393844, 'bull_time_stop': 177, 'bull_use_sma': True, 'bull_use_ema': True, 'bull_use_atr': True, 'bull_use_adx': True, 'bull_use_spike': True, 'bull_rsi_required': True, 'bear_strategy': 'breakout', 'bear_bb_std_mult': 3.580264132232087, 'bear_rsi_os': 29, 'bear_rsi_ob': 71, 'bear_adx_thresh': 19.20754052046799, 'bear_atr_min_pct': 0.00121925292557141, 'bear_atr_max_pct': 0.12688136581710596, 'bear_tp_mult': 1.1144823667963104, 'bear_tsl_mult': 0.7051576560018646, 'bear_time_stop': 196, 'bear_use_sma': False, 'bear_use_ema': True, 'bear_use_atr': False, 'bear_use_adx': False, 'bear_use_spike': True, 'bear_rsi_required': True, 'sideways_strategy': 'breakout', 'sideways_bb_std_mult': 2.716646818894511, 'sideways_rsi_os': 30, 'sideways_rsi_ob': 66, 'sideways_adx_thresh': 24.766003322284718, 'sideways_atr_min_pct': 0.0032006102557514413, 'sideways_atr_max_pct': 0.14999759735360751, 'sideways_tp_mult': 1.704270323195325, 'sideways_tsl_mult': 0.867656070037613, 'sideways_time_stop': 45, 'sideways_use_sma': False, 'sideways_use_ema': False, 'sideways_use_atr': True, 'sideways_use_adx': True, 'sideways_use_spike': False, 'sideways_rsi_required': True}.
[I 2025-08-31 13:17:25,758] Trial 638 finished with values: [-1000000000.0, 1000000000.0] and parameters: {'p_sma': 7, 'p_std': 26, 'p_atr': 17, 'p_adx': 15, 'rsi_period': 58, 'ema1': 21, 'ema2': 25, 'slip_atr_k': 0.04435391373829469, 'slip_spread_k': 0.5156894948872316, 'spread_hl_frac': 0.0381200385468312, 'bb_std_mult': 2.3214558699366368, 'rsi_os': 14, 'rsi_ob': 77, 'vol_spike': 0.0057274244673425935, 'adx_thresh': 20.689308867525646, 'atr_min_pct': 0.02328392528934765, 'atr_max_pct': 0.12801665443976692, 'tp_mult': 2.7247473113381337, 'tsl_mult': 0.661057725514208, 'strategy': 'breakout', 'time_stop': 160, 'use_sma': False, 'use_atr': False, 'use_adx': True, 'use_ema': True, 'use_spike': True, 'rsi_required': False, 'edge_k': 0.9279179999730242, 'edge_cap': 0.7833195702150181, 'bull_strategy': 'breakout', 'bull_bb_std_mult': 2.8296686804092657, 'bull_rsi_os': 16, 'bull_rsi_ob': 56, 'bull_adx_thresh': 17.027955274500044, 'bull_atr_min_pct': 0.016683345158962904, 'bull_atr_max_pct': 0.1475033691437224, 'bull_tp_mult': 1.716032733834504, 'bull_tsl_mult': 0.26611916901646643, 'bull_time_stop': 294, 'bull_use_sma': True, 'bull_use_ema': True, 'bull_use_atr': False, 'bull_use_adx': False, 'bull_use_spike': False, 'bull_rsi_required': False, 'bear_strategy': 'breakout', 'bear_bb_std_mult': 1.319164928472203, 'bear_rsi_os': 32, 'bear_rsi_ob': 73, 'bear_adx_thresh': 15.610863038615912, 'bear_atr_min_pct': 0.0018101230907915022, 'bear_atr_max_pct': 0.04944309057800034, 'bear_tp_mult': 1.3624638487858824, 'bear_tsl_mult': 0.809430740917344, 'bear_time_stop': 201, 'bear_use_sma': True, 'bear_use_ema': True, 'bear_use_atr': False, 'bear_use_adx': False, 'bear_use_spike': True, 'bear_rsi_required': True, 'sideways_strategy': 'breakout', 'sideways_bb_std_mult': 2.7049400774688195, 'sideways_rsi_os': 32, 'sideways_rsi_ob': 66, 'sideways_adx_thresh': 26.255909564499515, 'sideways_atr_min_pct': 0.01619741727419315, 'sideways_atr_max_pct': 0.1209407680229294, 'sideways_tp_mult': 1.525431201635895, 'sideways_tsl_mult': 0.8666275349957645, 'sideways_time_stop': 134, 'sideways_use_sma': True, 'sideways_use_ema': False, 'sideways_use_atr': True, 'sideways_use_adx': True, 'sideways_use_spike': True, 'sideways_rsi_required': True}.
[I 2025-08-31 13:17:26,286] Trial 639 finished with values: [-0.09919847463142106, 0.09946802543146395] and parameters: {'p_sma': 51, 'p_std': 26, 'p_atr': 15, 'p_adx': 15, 'rsi_period': 51, 'ema1': 20, 'ema2': 16, 'slip_atr_k': 0.05439672325227791, 'slip_spread_k': 0.24100808869585383, 'spread_hl_frac': 0.017824518699448448, 'bb_std_mult': 1.9556960088798299, 'rsi_os': 40, 'rsi_ob': 77, 'vol_spike': 0.02390582497084004, 'adx_thresh': 20.14527089715138, 'atr_min_pct': 0.002828628664859891, 'atr_max_pct': 0.1281414438281741, 'tp_mult': 2.7253041582191737, 'tsl_mult': 0.92896263231558, 'strategy': 'breakout', 'time_stop': 168, 'use_sma': False, 'use_atr': True, 'use_adx': True, 'use_ema': True, 'use_spike': True, 'rsi_required': True, 'edge_k': 0.5534484055781232, 'edge_cap': 0.6805684658686924, 'bull_strategy': 'breakout', 'bull_bb_std_mult': 2.7907637731399637, 'bull_rsi_os': 6, 'bull_rsi_ob': 50, 'bull_adx_thresh': 17.062497306911542, 'bull_atr_min_pct': 0.021229562469491838, 'bull_atr_max_pct': 0.14726677299125396, 'bull_tp_mult': 1.1662787360274727, 'bull_tsl_mult': 0.9462701285177562, 'bull_time_stop': 294, 'bull_use_sma': True, 'bull_use_ema': True, 'bull_use_atr': False, 'bull_use_adx': False, 'bull_use_spike': False, 'bull_rsi_required': False, 'bear_strategy': 'breakout', 'bear_bb_std_mult': 2.042896201983682, 'bear_rsi_os': 39, 'bear_rsi_ob': 71, 'bear_adx_thresh': 15.50569434213625, 'bear_atr_min_pct': 0.0016926870200938923, 'bear_atr_max_pct': 0.14295288001186968, 'bear_tp_mult': 1.122248233455006, 'bear_tsl_mult': 0.9164537303794437, 'bear_time_stop': 206, 'bear_use_sma': True, 'bear_use_ema': True, 'bear_use_atr': False, 'bear_use_adx': False, 'bear_use_spike': True, 'bear_rsi_required': True, 'sideways_strategy': 'breakout', 'sideways_bb_std_mult': 2.7091464296104557, 'sideways_rsi_os': 33, 'sideways_rsi_ob': 66, 'sideways_adx_thresh': 26.09459966988314, 'sideways_atr_min_pct': 0.024776177375616132, 'sideways_atr_max_pct': 0.12825264277969542, 'sideways_tp_mult': 1.5812996868642797, 'sideways_tsl_mult': 0.8688156476469628, 'sideways_time_stop': 214, 'sideways_use_sma': True, 'sideways_use_ema': False, 'sideways_use_atr': True, 'sideways_use_adx': True, 'sideways_use_spike': True, 'sideways_rsi_required': True}.
[I 2025-08-31 13:17:59,717] Trial 642 finished with values: [-1000000000.0, 1000000000.0] and parameters: {'p_sma': 30, 'p_std': 26, 'p_atr': 14, 'p_adx': 14, 'rsi_period': 50, 'ema1': 10, 'ema2': 16, 'slip_atr_k': 0.05509334502129075, 'slip_spread_k': 0.8673729729840423, 'spread_hl_frac': 0.018168138718454935, 'bb_std_mult': 2.5436898130637946, 'rsi_os': 40, 'rsi_ob': 76, 'vol_spike': 0.019976411330163542, 'adx_thresh': 20.042748767815752, 'atr_min_pct': 0.0019304082898970673, 'atr_max_pct': 0.055262835457826294, 'tp_mult': 1.7597854081416495, 'tsl_mult': 0.41855902879818563, 'strategy': 'mean_reversion', 'time_stop': 174, 'use_sma': True, 'use_atr': True, 'use_adx': True, 'use_ema': True, 'use_spike': True, 'rsi_required': True, 'edge_k': 1.7521792071422593, 'edge_cap': 0.6964200798088198, 'bull_strategy': 'breakout', 'bull_bb_std_mult': 2.734556881839402, 'bull_rsi_os': 55, 'bull_rsi_ob': 68, 'bull_adx_thresh': 18.621915895548838, 'bull_atr_min_pct': 0.021230883105917992, 'bull_atr_max_pct': 0.14742673179019736, 'bull_tp_mult': 1.2427311942085864, 'bull_tsl_mult': 0.21852885634739053, 'bull_time_stop': 133, 'bull_use_sma': True, 'bull_use_ema': True, 'bull_use_atr': False, 'bull_use_adx': True, 'bull_use_spike': False, 'bull_rsi_required': False, 'bear_strategy': 'breakout', 'bear_bb_std_mult': 0.6969492479542805, 'bear_rsi_os': 30, 'bear_rsi_ob': 71, 'bear_adx_thresh': 15.482132709021698, 'bear_atr_min_pct': 0.006745537122259263, 'bear_atr_max_pct': 0.12813605655240484, 'bear_tp_mult': 2.246164242467756, 'bear_tsl_mult': 0.5068188344137963, 'bear_time_stop': 212, 'bear_use_sma': True, 'bear_use_ema': True, 'bear_use_atr': False, 'bear_use_adx': False, 'bear_use_spike': False, 'bear_rsi_required': True, 'sideways_strategy': 'breakout', 'sideways_bb_std_mult': 2.606536261089044, 'sideways_rsi_os': 32, 'sideways_rsi_ob': 63, 'sideways_adx_thresh': 26.194090166754876, 'sideways_atr_min_pct': 0.004041562820341886, 'sideways_atr_max_pct': 0.12851373021964294, 'sideways_tp_mult': 1.588998801238809, 'sideways_tsl_mult': 0.06944888382465103, 'sideways_time_stop': 44, 'sideways_use_sma': True, 'sideways_use_ema': False, 'sideways_use_atr': True, 'sideways_use_adx': True, 'sideways_use_spike': False, 'sideways_rsi_required': True}.
[I 2025-08-31 13:17:59,948] Trial 643 finished with values: [-1000000000.0, 1000000000.0] and parameters: {'p_sma': 30, 'p_std': 19, 'p_atr': 15, 'p_adx': 13, 'rsi_period': 45, 'ema1': 10, 'ema2': 20, 'slip_atr_k': 0.03751275686760604, 'slip_spread_k': 0.3863442379899977, 'spread_hl_frac': 0.020611677355232068, 'bb_std_mult': 2.5228590020944197, 'rsi_os': 40, 'rsi_ob': 90, 'vol_spike': 0.017187366167234278, 'adx_thresh': 7.50378857054339, 'atr_min_pct': 0.025545865187898358, 'atr_max_pct': 0.04758847248453274, 'tp_mult': 2.473099302067206, 'tsl_mult': 0.7753333358055952, 'strategy': 'breakout', 'time_stop': 159, 'use_sma': False, 'use_atr': False, 'use_adx': True, 'use_ema': True, 'use_spike': True, 'rsi_required': False, 'edge_k': 0.5249523662139484, 'edge_cap': 0.6617149681176323, 'bull_strategy': 'mean_reversion', 'bull_bb_std_mult': 2.867437793665001, 'bull_rsi_os': 5, 'bull_rsi_ob': 85, 'bull_adx_thresh': 18.595025934528877, 'bull_atr_min_pct': 0.022316495715468152, 'bull_atr_max_pct': 0.13353371710996645, 'bull_tp_mult': 2.2904648005539188, 'bull_tsl_mult': 0.2840242603243127, 'bull_time_stop': 179, 'bull_use_sma': True, 'bull_use_ema': True, 'bull_use_atr': True, 'bull_use_adx': True, 'bull_use_spike': True, 'bull_rsi_required': True, 'bear_strategy': 'breakout', 'bear_bb_std_mult': 3.5169453190238174, 'bear_rsi_os': 30, 'bear_rsi_ob': 71, 'bear_adx_thresh': 18.928991912581722, 'bear_atr_min_pct': 1.1642091914309356e-05, 'bear_atr_max_pct': 0.12317918599295602, 'bear_tp_mult': 1.1309013013470965, 'bear_tsl_mult': 0.6703625897588495, 'bear_time_stop': 189, 'bear_use_sma': False, 'bear_use_ema': True, 'bear_use_atr': False, 'bear_use_adx': False, 'bear_use_spike': True, 'bear_rsi_required': True, 'sideways_strategy': 'breakout', 'sideways_bb_std_mult': 2.8588573880984005, 'sideways_rsi_os': 27, 'sideways_rsi_ob': 63, 'sideways_adx_thresh': 24.002949280438823, 'sideways_atr_min_pct': 0.005197088675905771, 'sideways_atr_max_pct': 0.14978927967451472, 'sideways_tp_mult': 1.7572937602911414, 'sideways_tsl_mult': 0.8355711355875503, 'sideways_time_stop': 43, 'sideways_use_sma': False, 'sideways_use_ema': False, 'sideways_use_atr': True, 'sideways_use_adx': True, 'sideways_use_spike': False, 'sideways_rsi_required': True}.
[I 2025-08-31 13:18:00,102] Trial 645 finished with values: [-1000000000.0, 1000000000.0] and parameters: {'p_sma': 30, 'p_std': 20, 'p_atr': 15, 'p_adx': 13, 'rsi_period': 45, 'ema1': 10, 'ema2': 20, 'slip_atr_k': 0.039049494353673414, 'slip_spread_k': 0.37329221251766237, 'spread_hl_frac': 0.01935211398865159, 'bb_std_mult': 2.508989620433561, 'rsi_os': 41, 'rsi_ob': 91, 'vol_spike': 0.004419415527683657, 'adx_thresh': 7.774138816824657, 'atr_min_pct': 0.02598762648319839, 'atr_max_pct': 0.04882849688955892, 'tp_mult': 2.465504058039424, 'tsl_mult': 0.789476105201275, 'strategy': 'breakout', 'time_stop': 157, 'use_sma': False, 'use_atr': False, 'use_adx': True, 'use_ema': True, 'use_spike': True, 'rsi_required': False, 'edge_k': 0.5162457463116112, 'edge_cap': 0.6589781762943228, 'bull_strategy': 'mean_reversion', 'bull_bb_std_mult': 2.8352071796211558, 'bull_rsi_os': 5, 'bull_rsi_ob': 85, 'bull_adx_thresh': 19.083184730550876, 'bull_atr_min_pct': 0.023040206654609673, 'bull_atr_max_pct': 0.13207732914383913, 'bull_tp_mult': 2.289236149934663, 'bull_tsl_mult': 0.28963845174433245, 'bull_time_stop': 177, 'bull_use_sma': True, 'bull_use_ema': True, 'bull_use_atr': True, 'bull_use_adx': True, 'bull_use_spike': True, 'bull_rsi_required': True, 'bear_strategy': 'breakout', 'bear_bb_std_mult': 3.5522165392385605, 'bear_rsi_os': 30, 'bear_rsi_ob': 70, 'bear_adx_thresh': 20.721414588828587, 'bear_atr_min_pct': 0.00024664592882660925, 'bear_atr_max_pct': 0.12398209321933426, 'bear_tp_mult': 1.0604476747573395, 'bear_tsl_mult': 0.6592497508665732, 'bear_time_stop': 187, 'bear_use_sma': False, 'bear_use_ema': True, 'bear_use_atr': False, 'bear_use_adx': False, 'bear_use_spike': True, 'bear_rsi_required': True, 'sideways_strategy': 'breakout', 'sideways_bb_std_mult': 2.923672790677459, 'sideways_rsi_os': 28, 'sideways_rsi_ob': 63, 'sideways_adx_thresh': 23.991323114690953, 'sideways_atr_min_pct': 0.004192978397477775, 'sideways_atr_max_pct': 0.1497799709756792, 'sideways_tp_mult': 1.7712218406326368, 'sideways_tsl_mult': 0.8103309498913337, 'sideways_time_stop': 43, 'sideways_use_sma': False, 'sideways_use_ema': False, 'sideways_use_atr': True, 'sideways_use_adx': True, 'sideways_use_spike': False, 'sideways_rsi_required': True}.
[I 2025-08-31 13:18:00,271] Trial 644 finished with values: [-1000000000.0, 1000000000.0] and parameters: {'p_sma': 30, 'p_std': 20, 'p_atr': 15, 'p_adx': 13, 'rsi_period': 44, 'ema1': 10, 'ema2': 20, 'slip_atr_k': 0.03826645369031435, 'slip_spread_k': 0.37072822381384957, 'spread_hl_frac': 0.020479205466409724, 'bb_std_mult': 2.503979097244317, 'rsi_os': 40, 'rsi_ob': 90, 'vol_spike': 0.0024528427858156662, 'adx_thresh': 7.1215485135179, 'atr_min_pct': 0.026376856839792018, 'atr_max_pct': 0.04707691996295303, 'tp_mult': 2.485013103747494, 'tsl_mult': 0.7658938902735942, 'strategy': 'breakout', 'time_stop': 160, 'use_sma': False, 'use_atr': False, 'use_adx': True, 'use_ema': True, 'use_spike': True, 'rsi_required': False, 'edge_k': 0.5285039344470465, 'edge_cap': 0.6600390580515902, 'bull_strategy': 'mean_reversion', 'bull_bb_std_mult': 2.929041403123605, 'bull_rsi_os': 5, 'bull_rsi_ob': 85, 'bull_adx_thresh': 18.698077317470887, 'bull_atr_min_pct': 0.022276717976126927, 'bull_atr_max_pct': 0.13409120467256203, 'bull_tp_mult': 2.1927239049565057, 'bull_tsl_mult': 0.28597496973309644, 'bull_time_stop': 175, 'bull_use_sma': True, 'bull_use_ema': True, 'bull_use_atr': True, 'bull_use_adx': True, 'bull_use_spike': True, 'bull_rsi_required': True, 'bear_strategy': 'breakout', 'bear_bb_std_mult': 3.559082264643384, 'bear_rsi_os': 30, 'bear_rsi_ob': 71, 'bear_adx_thresh': 19.797923451804998, 'bear_atr_min_pct': 5.45711646820473e-05, 'bear_atr_max_pct': 0.12335059384677748, 'bear_tp_mult': 1.1184494245996075, 'bear_tsl_mult': 0.670961174919596, 'bear_time_stop': 193, 'bear_use_sma': False, 'bear_use_ema': True, 'bear_use_atr': False, 'bear_use_adx': False, 'bear_use_spike': True, 'bear_rsi_required': True, 'sideways_strategy': 'breakout', 'sideways_bb_std_mult': 2.8792744753040465, 'sideways_rsi_os': 27, 'sideways_rsi_ob': 64, 'sideways_adx_thresh': 24.006565377827954, 'sideways_atr_min_pct': 0.005173607188922844, 'sideways_atr_max_pct': 0.14821897870965897, 'sideways_tp_mult': 1.7851129549036875, 'sideways_tsl_mult': 0.8023174410238928, 'sideways_time_stop': 45, 'sideways_use_sma': False, 'sideways_use_ema': False, 'sideways_use_atr': True, 'sideways_use_adx': True, 'sideways_use_spike': False, 'sideways_rsi_required': True}.
[I 2025-08-31 13:18:34,289] Trial 648 finished with values: [-1000000000.0, 1000000000.0] and parameters: {'p_sma': 36, 'p_std': 19, 'p_atr': 16, 'p_adx': 13, 'rsi_period': 47, 'ema1': 8, 'ema2': 20, 'slip_atr_k': 0.043909026096302005, 'slip_spread_k': 0.3560114770918558, 'spread_hl_frac': 0.020146525034768586, 'bb_std_mult': 2.3602019009996664, 'rsi_os': 38, 'rsi_ob': 93, 'vol_spike': 0.012274353333694865, 'adx_thresh': 6.463261795505407, 'atr_min_pct': 0.024783968250699093, 'atr_max_pct': 0.05261902519795924, 'tp_mult': 2.505200285615272, 'tsl_mult': 0.7607472216337793, 'strategy': 'breakout', 'time_stop': 155, 'use_sma': False, 'use_atr': False, 'use_adx': True, 'use_ema': True, 'use_spike': True, 'rsi_required': False, 'edge_k': 0.5058285939902657, 'edge_cap': 0.6573904555111717, 'bull_strategy': 'mean_reversion', 'bull_bb_std_mult': 2.9536429640383086, 'bull_rsi_os': 5, 'bull_rsi_ob': 84, 'bull_adx_thresh': 19.358084001146384, 'bull_atr_min_pct': 0.022033237053478854, 'bull_atr_max_pct': 0.13544517546534904, 'bull_tp_mult': 2.1595990441247275, 'bull_tsl_mult': 0.2875027357231665, 'bull_time_stop': 184, 'bull_use_sma': True, 'bull_use_ema': True, 'bull_use_atr': True, 'bull_use_adx': True, 'bull_use_spike': True, 'bull_rsi_required': True, 'bear_strategy': 'breakout', 'bear_bb_std_mult': 3.564762830574648, 'bear_rsi_os': 28, 'bear_rsi_ob': 69, 'bear_adx_thresh': 20.06650927138925, 'bear_atr_min_pct': 0.00012517170664856202, 'bear_atr_max_pct': 0.11819218886492633, 'bear_tp_mult': 1.2220324060710588, 'bear_tsl_mult': 0.682868698365491, 'bear_time_stop': 185, 'bear_use_sma': False, 'bear_use_ema': True, 'bear_use_atr': False, 'bear_use_adx': False, 'bear_use_spike': True, 'bear_rsi_required': True, 'sideways_strategy': 'breakout', 'sideways_bb_std_mult': 2.848438539312282, 'sideways_rsi_os': 27, 'sideways_rsi_ob': 65, 'sideways_adx_thresh': 23.549879545175095, 'sideways_atr_min_pct': 0.004359459023508156, 'sideways_atr_max_pct': 0.14603879017607982, 'sideways_tp_mult': 1.8022685656922401, 'sideways_tsl_mult': 0.8370272346938794, 'sideways_time_stop': 53, 'sideways_use_sma': False, 'sideways_use_ema': False, 'sideways_use_atr': True, 'sideways_use_adx': True, 'sideways_use_spike': False, 'sideways_rsi_required': True}.
[I 2025-08-31 13:18:34,333] Trial 649 finished with values: [-1000000000.0, 1000000000.0] and parameters: {'p_sma': 26, 'p_std': 19, 'p_atr': 16, 'p_adx': 13, 'rsi_period': 46, 'ema1': 8, 'ema2': 21, 'slip_atr_k': 0.03977450649826999, 'slip_spread_k': 0.3451897200647503, 'spread_hl_frac': 0.021043906794454774, 'bb_std_mult': 2.428195992641816, 'rsi_os': 38, 'rsi_ob': 93, 'vol_spike': 0.01017180571406094, 'adx_thresh': 6.457306177194015, 'atr_min_pct': 0.02407860700867484, 'atr_max_pct': 0.05068313646645631, 'tp_mult': 2.504965382718274, 'tsl_mult': 0.8077115651073059, 'strategy': 'breakout', 'time_stop': 153, 'use_sma': False, 'use_atr': False, 'use_adx': True, 'use_ema': True, 'use_spike': True, 'rsi_required': False, 'edge_k': 0.4910952530941892, 'edge_cap': 0.6386382200985778, 'bull_strategy': 'mean_reversion', 'bull_bb_std_mult': 2.941649621486902, 'bull_rsi_os': 5, 'bull_rsi_ob': 84, 'bull_adx_thresh': 18.97473347673879, 'bull_atr_min_pct': 0.021897870451337856, 'bull_atr_max_pct': 0.13568573180084045, 'bull_tp_mult': 2.2190640708902025, 'bull_tsl_mult': 0.30563644959154557, 'bull_time_stop': 160, 'bull_use_sma': True, 'bull_use_ema': True, 'bull_use_atr': True, 'bull_use_adx': True, 'bull_use_spike': True, 'bull_rsi_required': True, 'bear_strategy': 'breakout', 'bear_bb_std_mult': 3.4528223860623126, 'bear_rsi_os': 28, 'bear_rsi_ob': 68, 'bear_adx_thresh': 17.054548998127128, 'bear_atr_min_pct': 0.0007405057084257497, 'bear_atr_max_pct': 0.11858475805974412, 'bear_tp_mult': 1.2282798662804495, 'bear_tsl_mult': 0.646824369825338, 'bear_time_stop': 190, 'bear_use_sma': False, 'bear_use_ema': True, 'bear_use_atr': False, 'bear_use_adx': False, 'bear_use_spike': True, 'bear_rsi_required': True, 'sideways_strategy': 'breakout', 'sideways_bb_std_mult': 2.816439392377491, 'sideways_rsi_os': 28, 'sideways_rsi_ob': 65, 'sideways_adx_thresh': 24.498306204919224, 'sideways_atr_min_pct': 0.003916928182267302, 'sideways_atr_max_pct': 0.14673010959614355, 'sideways_tp_mult': 1.7372020682733602, 'sideways_tsl_mult': 0.8332095582084635, 'sideways_time_stop': 53, 'sideways_use_sma': False, 'sideways_use_ema': False, 'sideways_use_atr': True, 'sideways_use_adx': True, 'sideways_use_spike': False, 'sideways_rsi_required': True}.
