[I 2025-08-31 12:21:40,779] Trial 223 finished with values: [-0.07788623405781636, 0.07774100454361926] and parameters: {'p_sma': 32, 'p_std': 17, 'p_atr': 9, 'p_adx': 16, 'rsi_period': 74, 'ema1': 5, 'ema2': 36, 'slip_atr_k': 0.1012863860961399, 'slip_spread_k': 0.13330370283819937, 'spread_hl_frac': 0.029110972770672316, 'bb_std_mult': 1.1267337278216165, 'rsi_os': 19, 'rsi_ob': 61, 'vol_spike': 0.24545387775993005, 'adx_thresh': 29.147100999368263, 'atr_min_pct': 0.02738951625291133, 'atr_max_pct': 0.07483196252878492, 'tp_mult': 1.1261812298030112, 'tsl_mult': 0.4377328377891506, 'strategy': 'mean_reversion', 'time_stop': 232, 'use_sma': False, 'use_atr': False, 'use_adx': False, 'use_ema': False, 'use_spike': True, 'rsi_required': True, 'edge_k': 1.121017528760332, 'edge_cap': 0.28253124992701967, 'bull_strategy': 'mean_reversion', 'bull_bb_std_mult': 2.567426935093886, 'bull_rsi_os': 14, 'bull_rsi_ob': 81, 'bull_adx_thresh': 9.25876315829564, 'bull_atr_min_pct': 0.011372172346359663, 'bull_atr_max_pct': 0.10072509417401389, 'bull_tp_mult': 2.809283512349248, 'bull_tsl_mult': 0.34147089990244084, 'bull_time_stop': 90, 'bull_use_sma': True, 'bull_use_ema': True, 'bull_use_atr': False, 'bull_use_adx': True, 'bull_use_spike': False, 'bull_rsi_required': True, 'bear_strategy': 'breakout', 'bear_bb_std_mult': 1.720269898193303, 'bear_rsi_os': 53, 'bear_rsi_ob': 57, 'bear_adx_thresh': 27.336463688156638, 'bear_atr_min_pct': 0.02900351911665103, 'bear_atr_max_pct': 0.09752517691965093, 'bear_tp_mult': 1.5985687071599026, 'bear_tsl_mult': 0.26491639251521787, 'bear_time_stop': 29, 'bear_use_sma': True, 'bear_use_ema': False, 'bear_use_atr': True, 'bear_use_adx': True, 'bear_use_spike': False, 'bear_rsi_required': False, 'sideways_strategy': 'breakout', 'sideways_bb_std_mult': 2.100880187179114, 'sideways_rsi_os': 46, 'sideways_rsi_ob': 46, 'sideways_adx_thresh': 14.496326595316068, 'sideways_atr_min_pct': 0.002261740674862277, 'sideways_atr_max_pct': 0.06966636054438163, 'sideways_tp_mult': 2.9513345564231654, 'sideways_tsl_mult': 0.4240713714218682, 'sideways_time_stop': 185, 'sideways_use_sma': True, 'sideways_use_ema': True, 'sideways_use_atr': False, 'sideways_use_adx': False, 'sideways_use_spike': False, 'sideways_rsi_required': True}.
[I 2025-08-31 12:21:41,247] Trial 224 finished with values: [-1000000000.0, 1000000000.0] and parameters: {'p_sma': 32, 'p_std': 33, 'p_atr': 9, 'p_adx': 16, 'rsi_period': 74, 'ema1': 21, 'ema2': 36, 'slip_atr_k': 0.08578171902844864, 'slip_spread_k': 0.13169366589873815, 'spread_hl_frac': 0.0159865725959058, 'bb_std_mult': 1.1059633798906108, 'rsi_os': 45, 'rsi_ob': 69, 'vol_spike': 0.12971502374376218, 'adx_thresh': 31.031967847275617, 'atr_min_pct': 0.006430344672598455, 'atr_max_pct': 0.07515889269320478, 'tp_mult': 1.1205823838806204, 'tsl_mult': 0.38784335633578576, 'strategy': 'mean_reversion', 'time_stop': 97, 'use_sma': False, 'use_atr': False, 'use_adx': False, 'use_ema': False, 'use_spike': True, 'rsi_required': True, 'edge_k': 1.1152083022365318, 'edge_cap': 0.28003698411525807, 'bull_strategy': 'mean_reversion', 'bull_bb_std_mult': 3.1190216626473317, 'bull_rsi_os': 40, 'bull_rsi_ob': 81, 'bull_adx_thresh': 9.293155082963146, 'bull_atr_min_pct': 0.00250017338572398, 'bull_atr_max_pct': 0.027305073892019624, 'bull_tp_mult': 2.743488237183723, 'bull_tsl_mult': 0.3225835385318463, 'bull_time_stop': 153, 'bull_use_sma': True, 'bull_use_ema': True, 'bull_use_atr': False, 'bull_use_adx': True, 'bull_use_spike': False, 'bull_rsi_required': True, 'bear_strategy': 'breakout', 'bear_bb_std_mult': 3.5390371334684483, 'bear_rsi_os': 25, 'bear_rsi_ob': 69, 'bear_adx_thresh': 33.31740708235865, 'bear_atr_min_pct': 0.028974969865071497, 'bear_atr_max_pct': 0.09943734017424523, 'bear_tp_mult': 2.165393057840032, 'bear_tsl_mult': 0.2596187956907079, 'bear_time_stop': 26, 'bear_use_sma': True, 'bear_use_ema': False, 'bear_use_atr': True, 'bear_use_adx': True, 'bear_use_spike': False, 'bear_rsi_required': False, 'sideways_strategy': 'breakout', 'sideways_bb_std_mult': 0.8768260891367041, 'sideways_rsi_os': 36, 'sideways_rsi_ob': 46, 'sideways_adx_thresh': 14.68140840977946, 'sideways_atr_min_pct': 0.009189709815195516, 'sideways_atr_max_pct': 0.03656740989052101, 'sideways_tp_mult': 2.934226740662445, 'sideways_tsl_mult': 0.420449125651143, 'sideways_time_stop': 185, 'sideways_use_sma': True, 'sideways_use_ema': True, 'sideways_use_atr': False, 'sideways_use_adx': False, 'sideways_use_spike': False, 'sideways_rsi_required': True}.
[I 2025-08-31 12:21:41,606] Trial 222 finished with values: [-0.05954474638604457, 0.05940908385370323] and parameters: {'p_sma': 32, 'p_std': 17, 'p_atr': 14, 'p_adx': 18, 'rsi_period': 74, 'ema1': 5, 'ema2': 36, 'slip_atr_k': 0.10029296838451286, 'slip_spread_k': 0.12751868302896419, 'spread_hl_frac': 0.029126490199405705, 'bb_std_mult': 2.912615931471402, 'rsi_os': 44, 'rsi_ob': 89, 'vol_spike': 0.2864282968731636, 'adx_thresh': 32.7801573368852, 'atr_min_pct': 0.02303404002105988, 'atr_max_pct': 0.0762901242116444, 'tp_mult': 2.188875303415071, 'tsl_mult': 0.3808355538110485, 'strategy': 'mean_reversion', 'time_stop': 183, 'use_sma': False, 'use_atr': False, 'use_adx': False, 'use_ema': False, 'use_spike': True, 'rsi_required': True, 'edge_k': 0.7359604872488505, 'edge_cap': 0.2739073186616999, 'bull_strategy': 'breakout', 'bull_bb_std_mult': 3.3128339549616093, 'bull_rsi_os': 14, 'bull_rsi_ob': 54, 'bull_adx_thresh': 9.366908366092435, 'bull_atr_min_pct': 0.024670021339458906, 'bull_atr_max_pct': 0.02730486545645875, 'bull_tp_mult': 1.9259187428975089, 'bull_tsl_mult': 0.28191083494156216, 'bull_time_stop': 92, 'bull_use_sma': True, 'bull_use_ema': True, 'bull_use_atr': True, 'bull_use_adx': True, 'bull_use_spike': False, 'bull_rsi_required': True, 'bear_strategy': 'breakout', 'bear_bb_std_mult': 2.6829906946905413, 'bear_rsi_os': 25, 'bear_rsi_ob': 75, 'bear_adx_thresh': 31.701420019792398, 'bear_atr_min_pct': 0.019199630102991666, 'bear_atr_max_pct': 0.10519362116286511, 'bear_tp_mult': 1.9203893392572724, 'bear_tsl_mult': 0.25265883007256357, 'bear_time_stop': 170, 'bear_use_sma': False, 'bear_use_ema': False, 'bear_use_atr': False, 'bear_use_adx': False, 'bear_use_spike': False, 'bear_rsi_required': False, 'sideways_strategy': 'breakout', 'sideways_bb_std_mult': 0.8871895393583287, 'sideways_rsi_os': 46, 'sideways_rsi_ob': 67, 'sideways_adx_thresh': 14.544791856539947, 'sideways_atr_min_pct': 0.0022773671430086585, 'sideways_atr_max_pct': 0.06942400034880579, 'sideways_tp_mult': 2.8691150537756567, 'sideways_tsl_mult': 0.3673897850590811, 'sideways_time_stop': 203, 'sideways_use_sma': True, 'sideways_use_ema': True, 'sideways_use_atr': True, 'sideways_use_adx': False, 'sideways_use_spike': False, 'sideways_rsi_required': True}.
[I 2025-08-31 12:21:45,381] Trial 228 finished with values: [-0.028152507793723802, 0.028345413587117202] and parameters: {'p_sma': 32, 'p_std': 12, 'p_atr': 22, 'p_adx': 29, 'rsi_period': 29, 'ema1': 14, 'ema2': 35, 'slip_atr_k': 0.005599703727972763, 'slip_spread_k': 0.6053257571727306, 'spread_hl_frac': 0.011071472136221781, 'bb_std_mult': 2.5786786850318753, 'rsi_os': 43, 'rsi_ob': 61, 'vol_spike': 0.07976672953486812, 'adx_thresh': 24.579010875268594, 'atr_min_pct': 0.013984395446352433, 'atr_max_pct': 0.08034823006203995, 'tp_mult': 1.4052761665940983, 'tsl_mult': 0.4795013968183796, 'strategy': 'breakout', 'time_stop': 192, 'use_sma': True, 'use_atr': False, 'use_adx': True, 'use_ema': True, 'use_spike': True, 'rsi_required': True, 'edge_k': 1.687197569419799, 'edge_cap': 0.25585415065120876, 'bull_strategy': 'mean_reversion', 'bull_bb_std_mult': 3.1873707790913253, 'bull_rsi_os': 13, 'bull_rsi_ob': 79, 'bull_adx_thresh': 9.41165901781634, 'bull_atr_min_pct': 0.0007815382430127592, 'bull_atr_max_pct': 0.12052654070329893, 'bull_tp_mult': 2.7456626907500055, 'bull_tsl_mult': 0.30263766350434385, 'bull_time_stop': 80, 'bull_use_sma': False, 'bull_use_ema': True, 'bull_use_atr': False, 'bull_use_adx': True, 'bull_use_spike': False, 'bull_rsi_required': True, 'bear_strategy': 'mean_reversion', 'bear_bb_std_mult': 0.7369026067630213, 'bear_rsi_os': 9, 'bear_rsi_ob': 47, 'bear_adx_thresh': 24.95095559697463, 'bear_atr_min_pct': 0.028808965295845933, 'bear_atr_max_pct': 0.104041214556515, 'bear_tp_mult': 2.545430194152231, 'bear_tsl_mult': 0.7529621102612205, 'bear_time_stop': 135, 'bear_use_sma': True, 'bear_use_ema': False, 'bear_use_atr': True, 'bear_use_adx': True, 'bear_use_spike': True, 'bear_rsi_required': False, 'sideways_strategy': 'breakout', 'sideways_bb_std_mult': 1.877019358978734, 'sideways_rsi_os': 33, 'sideways_rsi_ob': 55, 'sideways_adx_thresh': 8.306290892927152, 'sideways_atr_min_pct': 0.0022824426239016864, 'sideways_atr_max_pct': 0.06958485576789873, 'sideways_tp_mult': 1.4028389616308061, 'sideways_tsl_mult': 0.4692531057764325, 'sideways_time_stop': 184, 'sideways_use_sma': False, 'sideways_use_ema': True, 'sideways_use_atr': False, 'sideways_use_adx': False, 'sideways_use_spike': False, 'sideways_rsi_required': True}.
[I 2025-08-31 12:22:17,216] Trial 231 finished with values: [-1000000000.0, 1000000000.0] and parameters: {'p_sma': 33, 'p_std': 40, 'p_atr': 8, 'p_adx': 29, 'rsi_period': 72, 'ema1': 27, 'ema2': 38, 'slip_atr_k': 0.09121058062245867, 'slip_spread_k': 0.6095584275227717, 'spread_hl_frac': 0.02691204251880399, 'bb_std_mult': 2.0540497790978343, 'rsi_os': 31, 'rsi_ob': 60, 'vol_spike': 0.26371420180158095, 'adx_thresh': 8.61961085404706, 'atr_min_pct': 0.013979919276507331, 'atr_max_pct': 0.08056964510395555, 'tp_mult': 2.625408529231421, 'tsl_mult': 0.4764815179634218, 'strategy': 'breakout', 'time_stop': 240, 'use_sma': True, 'use_atr': False, 'use_adx': True, 'use_ema': True, 'use_spike': True, 'rsi_required': False, 'edge_k': 1.2733152368712455, 'edge_cap': 0.2612865659399398, 'bull_strategy': 'mean_reversion', 'bull_bb_std_mult': 3.201907786841172, 'bull_rsi_os': 9, 'bull_rsi_ob': 92, 'bull_adx_thresh': 25.92813996899755, 'bull_atr_min_pct': 0.0036304872204882595, 'bull_atr_max_pct': 0.09520939651630275, 'bull_tp_mult': 2.7039595873707887, 'bull_tsl_mult': 0.5046778433539865, 'bull_time_stop': 81, 'bull_use_sma': False, 'bull_use_ema': False, 'bull_use_atr': False, 'bull_use_adx': False, 'bull_use_spike': True, 'bull_rsi_required': False, 'bear_strategy': 'mean_reversion', 'bear_bb_std_mult': 0.707824299604292, 'bear_rsi_os': 27, 'bear_rsi_ob': 60, 'bear_adx_thresh': 34.688367302155356, 'bear_atr_min_pct': 0.016069611349058186, 'bear_atr_max_pct': 0.13050540967631502, 'bear_tp_mult': 2.945503053873244, 'bear_tsl_mult': 0.9600873095342914, 'bear_time_stop': 135, 'bear_use_sma': False, 'bear_use_ema': False, 'bear_use_atr': False, 'bear_use_adx': False, 'bear_use_spike': True, 'bear_rsi_required': True, 'sideways_strategy': 'mean_reversion', 'sideways_bb_std_mult': 2.398802495864802, 'sideways_rsi_os': 39, 'sideways_rsi_ob': 55, 'sideways_adx_thresh': 11.107532968225847, 'sideways_atr_min_pct': 0.026125309019007642, 'sideways_atr_max_pct': 0.11673398786883137, 'sideways_tp_mult': 2.4226674898372758, 'sideways_tsl_mult': 0.7669464992629613, 'sideways_time_stop': 133, 'sideways_use_sma': False, 'sideways_use_ema': False, 'sideways_use_atr': True, 'sideways_use_adx': True, 'sideways_use_spike': True, 'sideways_rsi_required': False}.
[I 2025-08-31 12:22:17,512] Trial 230 finished with values: [-1000000000.0, 1000000000.0] and parameters: {'p_sma': 34, 'p_std': 12, 'p_atr': 22, 'p_adx': 13, 'rsi_period': 61, 'ema1': 6, 'ema2': 38, 'slip_atr_k': 0.07551776465997775, 'slip_spread_k': 0.15860594728686567, 'spread_hl_frac': 0.010964985293526061, 'bb_std_mult': 0.9136981213800494, 'rsi_os': 41, 'rsi_ob': 66, 'vol_spike': 0.26329477254670497, 'adx_thresh': 8.776640045200631, 'atr_min_pct': 0.02819520477183145, 'atr_max_pct': 0.07887825587820639, 'tp_mult': 2.1833008909609757, 'tsl_mult': 0.46227766836592105, 'strategy': 'breakout', 'time_stop': 85, 'use_sma': True, 'use_atr': False, 'use_adx': True, 'use_ema': True, 'use_spike': True, 'rsi_required': False, 'edge_k': 1.1968213341121434, 'edge_cap': 0.26013617387222815, 'bull_strategy': 'breakout', 'bull_bb_std_mult': 3.214200589136817, 'bull_rsi_os': 16, 'bull_rsi_ob': 92, 'bull_adx_thresh': 7.87735610874361, 'bull_atr_min_pct': 0.00729414065547813, 'bull_atr_max_pct': 0.10979022062484092, 'bull_tp_mult': 2.6741644834952463, 'bull_tsl_mult': 0.7714024261204993, 'bull_time_stop': 235, 'bull_use_sma': False, 'bull_use_ema': False, 'bull_use_atr': True, 'bull_use_adx': False, 'bull_use_spike': False, 'bull_rsi_required': True, 'bear_strategy': 'mean_reversion', 'bear_bb_std_mult': 0.7323733911509294, 'bear_rsi_os': 9, 'bear_rsi_ob': 46, 'bear_adx_thresh': 31.72176039100761, 'bear_atr_min_pct': 0.02848858274950478, 'bear_atr_max_pct': 0.13529210108982662, 'bear_tp_mult': 1.7783792020897882, 'bear_tsl_mult': 0.34420418365689076, 'bear_time_stop': 247, 'bear_use_sma': False, 'bear_use_ema': False, 'bear_use_atr': False, 'bear_use_adx': False, 'bear_use_spike': True, 'bear_rsi_required': True, 'sideways_strategy': 'mean_reversion', 'sideways_bb_std_mult': 1.8935184811029955, 'sideways_rsi_os': 39, 'sideways_rsi_ob': 55, 'sideways_adx_thresh': 30.57977491928334, 'sideways_atr_min_pct': 0.016204936994306487, 'sideways_atr_max_pct': 0.1183660979364306, 'sideways_tp_mult': 2.42459652610161, 'sideways_tsl_mult': 0.36237538926169305, 'sideways_time_stop': 283, 'sideways_use_sma': False, 'sideways_use_ema': False, 'sideways_use_atr': True, 'sideways_use_adx': False, 'sideways_use_spike': True, 'sideways_rsi_required': False}.
[I 2025-08-31 12:22:17,598] Trial 229 finished with values: [-1000000000.0, 1000000000.0] and parameters: {'p_sma': 44, 'p_std': 12, 'p_atr': 24, 'p_adx': 21, 'rsi_period': 75, 'ema1': 6, 'ema2': 29, 'slip_atr_k': 0.08315557515231574, 'slip_spread_k': 0.9002868474480221, 'spread_hl_frac': 0.026899537317658522, 'bb_std_mult': 0.8771998982946326, 'rsi_os': 44, 'rsi_ob': 60, 'vol_spike': 0.26260770760186875, 'adx_thresh': 24.28378843407419, 'atr_min_pct': 0.0065753332971151945, 'atr_max_pct': 0.08041152985192002, 'tp_mult': 2.661613234369456, 'tsl_mult': 0.47292217485005617, 'strategy': 'breakout', 'time_stop': 86, 'use_sma': True, 'use_atr': False, 'use_adx': True, 'use_ema': True, 'use_spike': True, 'rsi_required': False, 'edge_k': 1.4082906478187343, 'edge_cap': 0.2639838850951433, 'bull_strategy': 'mean_reversion', 'bull_bb_std_mult': 3.2117900404955435, 'bull_rsi_os': 41, 'bull_rsi_ob': 89, 'bull_adx_thresh': 22.765736591072468, 'bull_atr_min_pct': 0.02211729808046566, 'bull_atr_max_pct': 0.09403459682154199, 'bull_tp_mult': 2.677682620019088, 'bull_tsl_mult': 0.25099819087137293, 'bull_time_stop': 81, 'bull_use_sma': False, 'bull_use_ema': False, 'bull_use_atr': True, 'bull_use_adx': False, 'bull_use_spike': False, 'bull_rsi_required': True, 'bear_strategy': 'mean_reversion', 'bear_bb_std_mult': 0.7284683771012885, 'bear_rsi_os': 10, 'bear_rsi_ob': 60, 'bear_adx_thresh': 33.23201716035787, 'bear_atr_min_pct': 0.02998135402993955, 'bear_atr_max_pct': 0.10510997165304306, 'bear_tp_mult': 1.0894918962811526, 'bear_tsl_mult': 0.309829152035713, 'bear_time_stop': 151, 'bear_use_sma': False, 'bear_use_ema': False, 'bear_use_atr': False, 'bear_use_adx': False, 'bear_use_spike': True, 'bear_rsi_required': False, 'sideways_strategy': 'mean_reversion', 'sideways_bb_std_mult': 3.4487015227303432, 'sideways_rsi_os': 39, 'sideways_rsi_ob': 76, 'sideways_adx_thresh': 7.330628014599631, 'sideways_atr_min_pct': 0.0016363731298947093, 'sideways_atr_max_pct': 0.07218742723321347, 'sideways_tp_mult': 1.4068295828727098, 'sideways_tsl_mult': 0.37703583715874417, 'sideways_time_stop': 286, 'sideways_use_sma': False, 'sideways_use_ema': True, 'sideways_use_atr': True, 'sideways_use_adx': False, 'sideways_use_spike': True, 'sideways_rsi_required': False}.
[I 2025-08-31 12:22:18,235] Trial 232 finished with values: [-0.08277044244320952, 0.08260312193165145] and parameters: {'p_sma': 34, 'p_std': 48, 'p_atr': 11, 'p_adx': 29, 'rsi_period': 60, 'ema1': 27, 'ema2': 38, 'slip_atr_k': 0.07408692494906428, 'slip_spread_k': 0.17343978788417358, 'spread_hl_frac': 0.026788524011430975, 'bb_std_mult': 0.8863633627111587, 'rsi_os': 31, 'rsi_ob': 60, 'vol_spike': 0.26256262100534844, 'adx_thresh': 23.388016215781374, 'atr_min_pct': 0.028645606305044317, 'atr_max_pct': 0.08049001402352726, 'tp_mult': 2.6562531151881545, 'tsl_mult': 0.47739589818083816, 'strategy': 'breakout', 'time_stop': 134, 'use_sma': True, 'use_atr': False, 'use_adx': True, 'use_ema': True, 'use_spike': True, 'rsi_required': False, 'edge_k': 1.408210436261863, 'edge_cap': 0.2586335392457863, 'bull_strategy': 'mean_reversion', 'bull_bb_std_mult': 3.1983693803164095, 'bull_rsi_os': 16, 'bull_rsi_ob': 92, 'bull_adx_thresh': 28.546648367081502, 'bull_atr_min_pct': 0.02202938047457071, 'bull_atr_max_pct': 0.04029376111915434, 'bull_tp_mult': 2.686423079742031, 'bull_tsl_mult': 0.30550267316365587, 'bull_time_stop': 81, 'bull_use_sma': False, 'bull_use_ema': False, 'bull_use_atr': False, 'bull_use_adx': False, 'bull_use_spike': False, 'bull_rsi_required': False, 'bear_strategy': 'mean_reversion', 'bear_bb_std_mult': 1.6070067283233764, 'bear_rsi_os': 23, 'bear_rsi_ob': 60, 'bear_adx_thresh': 34.62641865410709, 'bear_atr_min_pct': 0.02959625635243721, 'bear_atr_max_pct': 0.09390864081248909, 'bear_tp_mult': 1.7923282040803914, 'bear_tsl_mult': 0.9611345848115804, 'bear_time_stop': 151, 'bear_use_sma': False, 'bear_use_ema': False, 'bear_use_atr': False, 'bear_use_adx': False, 'bear_use_spike': True, 'bear_rsi_required': True, 'sideways_strategy': 'mean_reversion', 'sideways_bb_std_mult': 2.399631244839909, 'sideways_rsi_os': 34, 'sideways_rsi_ob': 56, 'sideways_adx_thresh': 5.0938561926945365, 'sideways_atr_min_pct': 0.0015450164533003146, 'sideways_atr_max_pct': 0.11807088827799664, 'sideways_tp_mult': 1.3595923027283447, 'sideways_tsl_mult': 0.7674968808610256, 'sideways_time_stop': 50, 'sideways_use_sma': False, 'sideways_use_ema': False, 'sideways_use_atr': True, 'sideways_use_adx': False, 'sideways_use_spike': True, 'sideways_rsi_required': False}.
[I 2025-08-31 12:22:51,371] Trial 233 finished with values: [-1000000000.0, 1000000000.0] and parameters: {'p_sma': 22, 'p_std': 12, 'p_atr': 11, 'p_adx': 14, 'rsi_period': 77, 'ema1': 15, 'ema2': 29, 'slip_atr_k': 0.04535151965973726, 'slip_spread_k': 0.15698447763906342, 'spread_hl_frac': 0.019125905235479065, 'bb_std_mult': 0.8890909768586303, 'rsi_os': 41, 'rsi_ob': 65, 'vol_spike': 0.25314769476571447, 'adx_thresh': 24.659604637736642, 'atr_min_pct': 0.019834603800933003, 'atr_max_pct': 0.042960889142405034, 'tp_mult': 2.671718591540066, 'tsl_mult': 0.4676796381063688, 'strategy': 'breakout', 'time_stop': 86, 'use_sma': True, 'use_atr': False, 'use_adx': True, 'use_ema': True, 'use_spike': True, 'rsi_required': False, 'edge_k': 1.193265364286979, 'edge_cap': 0.13050068378130336, 'bull_strategy': 'mean_reversion', 'bull_bb_std_mult': 3.21766551223263, 'bull_rsi_os': 11, 'bull_rsi_ob': 77, 'bull_adx_thresh': 7.992807998354561, 'bull_atr_min_pct': 0.004821979915386675, 'bull_atr_max_pct': 0.10782262791125652, 'bull_tp_mult': 1.8679587109282412, 'bull_tsl_mult': 0.2499176146598888, 'bull_time_stop': 81, 'bull_use_sma': False, 'bull_use_ema': False, 'bull_use_atr': True, 'bull_use_adx': True, 'bull_use_spike': False, 'bull_rsi_required': True, 'bear_strategy': 'mean_reversion', 'bear_bb_std_mult': 1.6654862438011833, 'bear_rsi_os': 46, 'bear_rsi_ob': 46, 'bear_adx_thresh': 16.38928080736755, 'bear_atr_min_pct': 0.029988881165322254, 'bear_atr_max_pct': 0.09286549203009643, 'bear_tp_mult': 1.4595809200527479, 'bear_tsl_mult': 0.07487550493787296, 'bear_time_stop': 148, 'bear_use_sma': False, 'bear_use_ema': False, 'bear_use_atr': False, 'bear_use_adx': False, 'bear_use_spike': True, 'bear_rsi_required': False, 'sideways_strategy': 'breakout', 'sideways_bb_std_mult': 3.4451838672405914, 'sideways_rsi_os': 33, 'sideways_rsi_ob': 47, 'sideways_adx_thresh': 7.359914549356507, 'sideways_atr_min_pct': 0.0013673551945848042, 'sideways_atr_max_pct': 0.06783026266953543, 'sideways_tp_mult': 1.4063293442103015, 'sideways_tsl_mult': 0.46559628997320707, 'sideways_time_stop': 50, 'sideways_use_sma': False, 'sideways_use_ema': True, 'sideways_use_atr': True, 'sideways_use_adx': False, 'sideways_use_spike': False, 'sideways_rsi_required': True}.
