[I 2025-08-31 12:55:38,283] Trial 486 finished with values: [-1000000000.0, 1000000000.0] and parameters: {'p_sma': 53, 'p_std': 8, 'p_atr': 25, 'p_adx': 10, 'rsi_period': 23, 'ema1': 20, 'ema2': 13, 'slip_atr_k': 0.22659760782792332, 'slip_spread_k': 0.4423698059498788, 'spread_hl_frac': 0.01613749284869586, 'bb_std_mult': 0.5277206872306321, 'rsi_os': 21, 'rsi_ob': 88, 'vol_spike': 0.02240889226671142, 'adx_thresh': 19.88096891391884, 'atr_min_pct': 0.0006423123666611383, 'atr_max_pct': 0.12057787021575365, 'tp_mult': 2.7130513267920837, 'tsl_mult': 0.04881703351095598, 'strategy': 'breakout', 'time_stop': 181, 'use_sma': True, 'use_atr': True, 'use_adx': False, 'use_ema': True, 'use_spike': False, 'rsi_required': True, 'edge_k': 0.6580663069522371, 'edge_cap': 0.1460491711352192, 'bull_strategy': 'breakout', 'bull_bb_std_mult': 2.2638703582996373, 'bull_rsi_os': 8, 'bull_rsi_ob': 51, 'bull_adx_thresh': 30.547492362476525, 'bull_atr_min_pct': 0.01951657240490822, 'bull_atr_max_pct': 0.14974144107716003, 'bull_tp_mult': 1.2324250119030977, 'bull_tsl_mult': 0.7577025839183735, 'bull_time_stop': 192, 'bull_use_sma': True, 'bull_use_ema': True, 'bull_use_atr': False, 'bull_use_adx': True, 'bull_use_spike': True, 'bull_rsi_required': False, 'bear_strategy': 'breakout', 'bear_bb_std_mult': 2.026827299057706, 'bear_rsi_os': 28, 'bear_rsi_ob': 70, 'bear_adx_thresh': 12.708489114888522, 'bear_atr_min_pct': 0.009383862785531012, 'bear_atr_max_pct': 0.1270106748379216, 'bear_tp_mult': 2.8483405963058566, 'bear_tsl_mult': 0.7597085711675846, 'bear_time_stop': 153, 'bear_use_sma': True, 'bear_use_ema': True, 'bear_use_atr': True, 'bear_use_adx': True, 'bear_use_spike': True, 'bear_rsi_required': True, 'sideways_strategy': 'breakout', 'sideways_bb_std_mult': 2.588543030667928, 'sideways_rsi_os': 10, 'sideways_rsi_ob': 68, 'sideways_adx_thresh': 25.892564677847073, 'sideways_atr_min_pct': 0.002551294458815521, 'sideways_atr_max_pct': 0.11651166280144196, 'sideways_tp_mult': 2.19356251440574, 'sideways_tsl_mult': 0.8038770447552217, 'sideways_time_stop': 288, 'sideways_use_sma': True, 'sideways_use_ema': False, 'sideways_use_atr': False, 'sideways_use_adx': True, 'sideways_use_spike': False, 'sideways_rsi_required': True}.
[I 2025-08-31 12:55:38,750] Trial 485 finished with values: [-1000000000.0, 1000000000.0] and parameters: {'p_sma': 53, 'p_std': 8, 'p_atr': 13, 'p_adx': 15, 'rsi_period': 64, 'ema1': 20, 'ema2': 14, 'slip_atr_k': 0.058588359616974735, 'slip_spread_k': 0.4059312529814266, 'spread_hl_frac': 0.020001637450693513, 'bb_std_mult': 2.3113419356895224, 'rsi_os': 19, 'rsi_ob': 76, 'vol_spike': 0.020510082494138368, 'adx_thresh': 15.213617182838046, 'atr_min_pct': 2.7274068246029796e-05, 'atr_max_pct': 0.12004244915245316, 'tp_mult': 2.798815611647977, 'tsl_mult': 0.6247676268817233, 'strategy': 'breakout', 'time_stop': 179, 'use_sma': False, 'use_atr': True, 'use_adx': True, 'use_ema': True, 'use_spike': False, 'rsi_required': True, 'edge_k': 0.766847754396147, 'edge_cap': 0.18158963413564033, 'bull_strategy': 'breakout', 'bull_bb_std_mult': 2.7699640747471532, 'bull_rsi_os': 8, 'bull_rsi_ob': 50, 'bull_adx_thresh': 11.80942361276506, 'bull_atr_min_pct': 0.01951460083835817, 'bull_atr_max_pct': 0.1397847261620564, 'bull_tp_mult': 1.301014437794813, 'bull_tsl_mult': 0.23691709546055703, 'bull_time_stop': 275, 'bull_use_sma': True, 'bull_use_ema': True, 'bull_use_atr': True, 'bull_use_adx': True, 'bull_use_spike': False, 'bull_rsi_required': True, 'bear_strategy': 'breakout', 'bear_bb_std_mult': 3.071413880416412, 'bear_rsi_os': 28, 'bear_rsi_ob': 70, 'bear_adx_thresh': 12.60468354388448, 'bear_atr_min_pct': 0.0171887749119746, 'bear_atr_max_pct': 0.07324262823827399, 'bear_tp_mult': 1.0981315441901933, 'bear_tsl_mult': 0.7655325635616967, 'bear_time_stop': 200, 'bear_use_sma': True, 'bear_use_ema': True, 'bear_use_atr': True, 'bear_use_adx': True, 'bear_use_spike': True, 'bear_rsi_required': True, 'sideways_strategy': 'breakout', 'sideways_bb_std_mult': 2.563900716928746, 'sideways_rsi_os': 33, 'sideways_rsi_ob': 69, 'sideways_adx_thresh': 25.86976841200449, 'sideways_atr_min_pct': 0.0045521465594363705, 'sideways_atr_max_pct': 0.03233021201885007, 'sideways_tp_mult': 2.304558284361126, 'sideways_tsl_mult': 0.797467519030772, 'sideways_time_stop': 184, 'sideways_use_sma': True, 'sideways_use_ema': False, 'sideways_use_atr': False, 'sideways_use_adx': False, 'sideways_use_spike': False, 'sideways_rsi_required': True}.
[I 2025-08-31 12:55:38,959] Trial 488 finished with values: [-1000000000.0, 1000000000.0] and parameters: {'p_sma': 56, 'p_std': 23, 'p_atr': 28, 'p_adx': 16, 'rsi_period': 54, 'ema1': 13, 'ema2': 13, 'slip_atr_k': 0.060300024629697996, 'slip_spread_k': 0.8690829651179153, 'spread_hl_frac': 0.04060144427515918, 'bb_std_mult': 2.1341871721259746, 'rsi_os': 21, 'rsi_ob': 88, 'vol_spike': 0.007208664981937844, 'adx_thresh': 19.3064901021614, 'atr_min_pct': 6.028696942994745e-05, 'atr_max_pct': 0.011927454835715931, 'tp_mult': 2.715810263689324, 'tsl_mult': 0.61855527737818, 'strategy': 'breakout', 'time_stop': 156, 'use_sma': True, 'use_atr': True, 'use_adx': False, 'use_ema': True, 'use_spike': False, 'rsi_required': True, 'edge_k': 0.8065526205076367, 'edge_cap': 0.9596443865817761, 'bull_strategy': 'mean_reversion', 'bull_bb_std_mult': 2.60111874875441, 'bull_rsi_os': 8, 'bull_rsi_ob': 50, 'bull_adx_thresh': 22.162078671149818, 'bull_atr_min_pct': 0.020081488017136554, 'bull_atr_max_pct': 0.14971658132252944, 'bull_tp_mult': 1.3583848838739898, 'bull_tsl_mult': 0.21418500796864035, 'bull_time_stop': 191, 'bull_use_sma': True, 'bull_use_ema': True, 'bull_use_atr': False, 'bull_use_adx': False, 'bull_use_spike': True, 'bull_rsi_required': False, 'bear_strategy': 'breakout', 'bear_bb_std_mult': 3.091916764939341, 'bear_rsi_os': 9, 'bear_rsi_ob': 71, 'bear_adx_thresh': 6.195628386431778, 'bear_atr_min_pct': 0.0012685191291205073, 'bear_atr_max_pct': 0.03257157689011414, 'bear_tp_mult': 2.1735652669859786, 'bear_tsl_mult': 0.7603196114015409, 'bear_time_stop': 175, 'bear_use_sma': True, 'bear_use_ema': True, 'bear_use_atr': True, 'bear_use_adx': True, 'bear_use_spike': True, 'bear_rsi_required': True, 'sideways_strategy': 'breakout', 'sideways_bb_std_mult': 0.5365151406567414, 'sideways_rsi_os': 31, 'sideways_rsi_ob': 68, 'sideways_adx_thresh': 27.489336421055707, 'sideways_atr_min_pct': 0.019957746650904395, 'sideways_atr_max_pct': 0.0417394019931019, 'sideways_tp_mult': 1.5169261644820837, 'sideways_tsl_mult': 0.7914873428545744, 'sideways_time_stop': 185, 'sideways_use_sma': True, 'sideways_use_ema': False, 'sideways_use_atr': False, 'sideways_use_adx': True, 'sideways_use_spike': True, 'sideways_rsi_required': True}.
[I 2025-08-31 12:55:39,924] Trial 489 finished with values: [-1000000000.0, 1000000000.0] and parameters: {'p_sma': 60, 'p_std': 8, 'p_atr': 26, 'p_adx': 30, 'rsi_period': 23, 'ema1': 13, 'ema2': 14, 'slip_atr_k': 0.2496736038923268, 'slip_spread_k': 0.4399015764890047, 'spread_hl_frac': 0.017751431890563232, 'bb_std_mult': 2.3843052967635527, 'rsi_os': 39, 'rsi_ob': 51, 'vol_spike': 0.026888070316613985, 'adx_thresh': 21.125724476926017, 'atr_min_pct': 9.612185052181033e-05, 'atr_max_pct': 0.05068755199206224, 'tp_mult': 1.3955776101846928, 'tsl_mult': 0.6072964377232648, 'strategy': 'breakout', 'time_stop': 154, 'use_sma': True, 'use_atr': True, 'use_adx': False, 'use_ema': True, 'use_spike': False, 'rsi_required': True, 'edge_k': 0.6597303192446822, 'edge_cap': 0.4195360526209755, 'bull_strategy': 'breakout', 'bull_bb_std_mult': 2.011067309506597, 'bull_rsi_os': 8, 'bull_rsi_ob': 61, 'bull_adx_thresh': 13.702301578559954, 'bull_atr_min_pct': 0.013201300938091659, 'bull_atr_max_pct': 0.14999177654828874, 'bull_tp_mult': 1.352606296352235, 'bull_tsl_mult': 0.18181468775028933, 'bull_time_stop': 163, 'bull_use_sma': True, 'bull_use_ema': True, 'bull_use_atr': False, 'bull_use_adx': True, 'bull_use_spike': True, 'bull_rsi_required': False, 'bear_strategy': 'breakout', 'bear_bb_std_mult': 3.105873326727894, 'bear_rsi_os': 32, 'bear_rsi_ob': 71, 'bear_adx_thresh': 14.808278085920932, 'bear_atr_min_pct': 0.017168896149513394, 'bear_atr_max_pct': 0.12664553128997685, 'bear_tp_mult': 1.5508754308244863, 'bear_tsl_mult': 0.7312851133205378, 'bear_time_stop': 205, 'bear_use_sma': True, 'bear_use_ema': True, 'bear_use_atr': True, 'bear_use_adx': True, 'bear_use_spike': True, 'bear_rsi_required': True, 'sideways_strategy': 'breakout', 'sideways_bb_std_mult': 0.5035622766748376, 'sideways_rsi_os': 16, 'sideways_rsi_ob': 68, 'sideways_adx_thresh': 27.687155733411437, 'sideways_atr_min_pct': 0.0021050073642324067, 'sideways_atr_max_pct': 0.05507910872202061, 'sideways_tp_mult': 1.5129578249518802, 'sideways_tsl_mult': 0.893049622344896, 'sideways_time_stop': 202, 'sideways_use_sma': True, 'sideways_use_ema': False, 'sideways_use_atr': False, 'sideways_use_adx': False, 'sideways_use_spike': False, 'sideways_rsi_required': True}.
[I 2025-08-31 12:56:12,519] Trial 493 finished with values: [-0.013616837411366212, 0.013796690038312735] and parameters: {'p_sma': 15, 'p_std': 49, 'p_atr': 12, 'p_adx': 16, 'rsi_period': 43, 'ema1': 18, 'ema2': 18, 'slip_atr_k': 0.15625677938913884, 'slip_spread_k': 0.05312915801661655, 'spread_hl_frac': 0.006176049851850406, 'bb_std_mult': 2.522824418865964, 'rsi_os': 40, 'rsi_ob': 69, 'vol_spike': 0.21566570549892802, 'adx_thresh': 19.85295641525118, 'atr_min_pct': 0.005142145167290368, 'atr_max_pct': 0.05743007577794019, 'tp_mult': 2.659494774088603, 'tsl_mult': 0.030331006231923367, 'strategy': 'breakout', 'time_stop': 188, 'use_sma': False, 'use_atr': True, 'use_adx': False, 'use_ema': True, 'use_spike': False, 'rsi_required': True, 'edge_k': 1.8278236814677058, 'edge_cap': 0.7308875970767594, 'bull_strategy': 'breakout', 'bull_bb_std_mult': 2.698068815154552, 'bull_rsi_os': 7, 'bull_rsi_ob': 95, 'bull_adx_thresh': 28.01584842088862, 'bull_atr_min_pct': 0.016177172445847474, 'bull_atr_max_pct': 0.14710242129466358, 'bull_tp_mult': 1.1893866993823394, 'bull_tsl_mult': 0.1933292962156982, 'bull_time_stop': 294, 'bull_use_sma': True, 'bull_use_ema': True, 'bull_use_atr': False, 'bull_use_adx': True, 'bull_use_spike': False, 'bull_rsi_required': False, 'bear_strategy': 'mean_reversion', 'bear_bb_std_mult': 2.987511834216673, 'bear_rsi_os': 27, 'bear_rsi_ob': 56, 'bear_adx_thresh': 10.161512024493225, 'bear_atr_min_pct': 0.012636394089504076, 'bear_atr_max_pct': 0.05414297643405144, 'bear_tp_mult': 1.8914688712164347, 'bear_tsl_mult': 0.9736978107687628, 'bear_time_stop': 215, 'bear_use_sma': True, 'bear_use_ema': True, 'bear_use_atr': False, 'bear_use_adx': False, 'bear_use_spike': True, 'bear_rsi_required': False, 'sideways_strategy': 'breakout', 'sideways_bb_std_mult': 2.727176798623607, 'sideways_rsi_os': 32, 'sideways_rsi_ob': 66, 'sideways_adx_thresh': 17.957144729564998, 'sideways_atr_min_pct': 0.002369783213450449, 'sideways_atr_max_pct': 0.130122664499065, 'sideways_tp_mult': 1.567201222787935, 'sideways_tsl_mult': 0.31318022417747593, 'sideways_time_stop': 209, 'sideways_use_sma': True, 'sideways_use_ema': False, 'sideways_use_atr': True, 'sideways_use_adx': False, 'sideways_use_spike': False, 'sideways_rsi_required': True}.
[I 2025-08-31 12:56:12,896] Trial 492 finished with values: [-1000000000.0, 1000000000.0] and parameters: {'p_sma': 48, 'p_std': 6, 'p_atr': 24, 'p_adx': 16, 'rsi_period': 49, 'ema1': 18, 'ema2': 16, 'slip_atr_k': 0.15761534888510265, 'slip_spread_k': 0.37456301659769164, 'spread_hl_frac': 0.01770731166507595, 'bb_std_mult': 2.36612368532827, 'rsi_os': 39, 'rsi_ob': 82, 'vol_spike': 0.16673153394319437, 'adx_thresh': 20.930231410200168, 'atr_min_pct': 0.0018689660392773085, 'atr_max_pct': 0.056352994664953984, 'tp_mult': 2.191234533977367, 'tsl_mult': 0.02996283012180436, 'strategy': 'breakout', 'time_stop': 120, 'use_sma': False, 'use_atr': True, 'use_adx': False, 'use_ema': True, 'use_spike': False, 'rsi_required': True, 'edge_k': 0.7065936338905254, 'edge_cap': 0.6270032490255906, 'bull_strategy': 'breakout', 'bull_bb_std_mult': 2.3854491247311542, 'bull_rsi_os': 7, 'bull_rsi_ob': 52, 'bull_adx_thresh': 33.87989084700208, 'bull_atr_min_pct': 0.01827775689257914, 'bull_atr_max_pct': 0.147403704750488, 'bull_tp_mult': 1.179278228529048, 'bull_tsl_mult': 0.18985162267142863, 'bull_time_stop': 293, 'bull_use_sma': True, 'bull_use_ema': True, 'bull_use_atr': False, 'bull_use_adx': True, 'bull_use_spike': False, 'bull_rsi_required': False, 'bear_strategy': 'breakout', 'bear_bb_std_mult': 2.9819982025132754, 'bear_rsi_os': 27, 'bear_rsi_ob': 92, 'bear_adx_thresh': 14.408634990568645, 'bear_atr_min_pct': 0.0042299321826076, 'bear_atr_max_pct': 0.10903846743077196, 'bear_tp_mult': 1.5615774148855999, 'bear_tsl_mult': 0.6754047611206817, 'bear_time_stop': 203, 'bear_use_sma': True, 'bear_use_ema': True, 'bear_use_atr': True, 'bear_use_adx': True, 'bear_use_spike': True, 'bear_rsi_required': False, 'sideways_strategy': 'breakout', 'sideways_bb_std_mult': 2.736986436617647, 'sideways_rsi_os': 32, 'sideways_rsi_ob': 67, 'sideways_adx_thresh': 20.262969151141853, 'sideways_atr_min_pct': 0.02999644076298312, 'sideways_atr_max_pct': 0.05548517317130057, 'sideways_tp_mult': 1.5686041969454607, 'sideways_tsl_mult': 0.31574476012771324, 'sideways_time_stop': 37, 'sideways_use_sma': True, 'sideways_use_ema': False, 'sideways_use_atr': False, 'sideways_use_adx': False, 'sideways_use_spike': False, 'sideways_rsi_required': True}.
[I 2025-08-31 12:56:13,051] Trial 490 finished with values: [-0.07601195668974892, 0.07572439296686305] and parameters: {'p_sma': 44, 'p_std': 6, 'p_atr': 28, 'p_adx': 16, 'rsi_period': 12, 'ema1': 18, 'ema2': 16, 'slip_atr_k': 0.24966371778833446, 'slip_spread_k': 0.8626510451341732, 'spread_hl_frac': 0.017572369623374964, 'bb_std_mult': 2.3713991778811425, 'rsi_os': 39, 'rsi_ob': 76, 'vol_spike': 0.010407730114401553, 'adx_thresh': 26.774504757976462, 'atr_min_pct': 6.472220942116674e-05, 'atr_max_pct': 0.09373180712373594, 'tp_mult': 2.7556016215653982, 'tsl_mult': 0.03257463389899297, 'strategy': 'breakout', 'time_stop': 257, 'use_sma': False, 'use_atr': True, 'use_adx': False, 'use_ema': True, 'use_spike': False, 'rsi_required': True, 'edge_k': 0.7095289874511144, 'edge_cap': 0.4242334198251501, 'bull_strategy': 'breakout', 'bull_bb_std_mult': 2.692258114779408, 'bull_rsi_os': 25, 'bull_rsi_ob': 50, 'bull_adx_thresh': 24.266586103018813, 'bull_atr_min_pct': 0.0184601629122574, 'bull_atr_max_pct': 0.14719021672153215, 'bull_tp_mult': 1.347180190341944, 'bull_tsl_mult': 0.17886298142672774, 'bull_time_stop': 294, 'bull_use_sma': True, 'bull_use_ema': True, 'bull_use_atr': False, 'bull_use_adx': True, 'bull_use_spike': False, 'bull_rsi_required': False, 'bear_strategy': 'breakout', 'bear_bb_std_mult': 3.073641980665656, 'bear_rsi_os': 32, 'bear_rsi_ob': 46, 'bear_adx_thresh': 28.371879222123383, 'bear_atr_min_pct': 0.017557065766226454, 'bear_atr_max_pct': 0.10933563590920466, 'bear_tp_mult': 2.8979498058520843, 'bear_tsl_mult': 0.6800325195878993, 'bear_time_stop': 205, 'bear_use_sma': True, 'bear_use_ema': True, 'bear_use_atr': True, 'bear_use_adx': True, 'bear_use_spike': True, 'bear_rsi_required': True, 'sideways_strategy': 'breakout', 'sideways_bb_std_mult': 1.5964962824061513, 'sideways_rsi_os': 32, 'sideways_rsi_ob': 68, 'sideways_adx_thresh': 27.591613064259192, 'sideways_atr_min_pct': 0.001952822396194873, 'sideways_atr_max_pct': 0.13039117565150274, 'sideways_tp_mult': 2.3504317107386847, 'sideways_tsl_mult': 0.3190453555750512, 'sideways_time_stop': 205, 'sideways_use_sma': True, 'sideways_use_ema': False, 'sideways_use_atr': False, 'sideways_use_adx': False, 'sideways_use_spike': False, 'sideways_rsi_required': True}.
[I 2025-08-31 12:56:13,244] Trial 491 finished with values: [-0.06797262414251182, 0.06783526852086455] and parameters: {'p_sma': 55, 'p_std': 23, 'p_atr': 12, 'p_adx': 16, 'rsi_period': 53, 'ema1': 18, 'ema2': 18, 'slip_atr_k': 0.05902866238016093, 'slip_spread_k': 0.8554975649936074, 'spread_hl_frac': 0.018047226809818077, 'bb_std_mult': 3.4423280209761167, 'rsi_os': 24, 'rsi_ob': 77, 'vol_spike': 0.0103784224265763, 'adx_thresh': 9.213190236627703, 'atr_min_pct': 0.02996939744702746, 'atr_max_pct': 0.1231376827215735, 'tp_mult': 2.6680861015929644, 'tsl_mult': 0.0003742079934821313, 'strategy': 'breakout', 'time_stop': 176, 'use_sma': False, 'use_atr': True, 'use_adx': False, 'use_ema': True, 'use_spike': False, 'rsi_required': True, 'edge_k': 1.8115307276974122, 'edge_cap': 0.42521406154066455, 'bull_strategy': 'mean_reversion', 'bull_bb_std_mult': 2.7000372290803214, 'bull_rsi_os': 7, 'bull_rsi_ob': 61, 'bull_adx_thresh': 24.044155424187885, 'bull_atr_min_pct': 0.012908549382004222, 'bull_atr_max_pct': 0.14726113866130844, 'bull_tp_mult': 1.3532010263608056, 'bull_tsl_mult': 0.5799512358218771, 'bull_time_stop': 163, 'bull_use_sma': True, 'bull_use_ema': True, 'bull_use_atr': False, 'bull_use_adx': False, 'bull_use_spike': False, 'bull_rsi_required': False, 'bear_strategy': 'breakout', 'bear_bb_std_mult': 3.0816430275439917, 'bear_rsi_os': 9, 'bear_rsi_ob': 88, 'bear_adx_thresh': 14.780028629684267, 'bear_atr_min_pct': 0.00310696166462417, 'bear_atr_max_pct': 0.05495678001769254, 'bear_tp_mult': 1.5689226860549412, 'bear_tsl_mult': 0.6845065987844619, 'bear_time_stop': 217, 'bear_use_sma': True, 'bear_use_ema': True, 'bear_use_atr': True, 'bear_use_adx': True, 'bear_use_spike': True, 'bear_rsi_required': True, 'sideways_strategy': 'breakout', 'sideways_bb_std_mult': 2.7287001653636085, 'sideways_rsi_os': 50, 'sideways_rsi_ob': 68, 'sideways_adx_thresh': 27.52492547341881, 'sideways_atr_min_pct': 0.0023396175807027107, 'sideways_atr_max_pct': 0.13075016053337354, 'sideways_tp_mult': 1.5698052196667776, 'sideways_tsl_mult': 0.8877222765197965, 'sideways_time_stop': 203, 'sideways_use_sma': True, 'sideways_use_ema': False, 'sideways_use_atr': False, 'sideways_use_adx': False, 'sideways_use_spike': True, 'sideways_rsi_required': True}.
[I 2025-08-31 12:56:46,011] Trial 494 finished with values: [-1000000000.0, 1000000000.0] and parameters: {'p_sma': 48, 'p_std': 25, 'p_atr': 14, 'p_adx': 20, 'rsi_period': 33, 'ema1': 30, 'ema2': 16, 'slip_atr_k': 0.06331248279101347, 'slip_spread_k': 0.3794927477352982, 'spread_hl_frac': 0.0093903850769374, 'bb_std_mult': 2.327646240027955, 'rsi_os': 23, 'rsi_ob': 69, 'vol_spike': 0.037795598151712476, 'adx_thresh': 8.991842381986693, 'atr_min_pct': 0.010571227615358135, 'atr_max_pct': 0.09245573659990108, 'tp_mult': 1.7276027257941537, 'tsl_mult': 0.0009480892597494885, 'strategy': 'breakout', 'time_stop': 118, 'use_sma': False, 'use_atr': True, 'use_adx': False, 'use_ema': True, 'use_spike': False, 'rsi_required': True, 'edge_k': 0.7048734886448206, 'edge_cap': 0.7433173491868491, 'bull_strategy': 'breakout', 'bull_bb_std_mult': 2.7125479609052316, 'bull_rsi_os': 7, 'bull_rsi_ob': 69, 'bull_adx_thresh': 15.847119211574572, 'bull_atr_min_pct': 0.020661674913770342, 'bull_atr_max_pct': 0.14711738897429905, 'bull_tp_mult': 1.1713021878477925, 'bull_tsl_mult': 0.19331108672697678, 'bull_time_stop': 229, 'bull_use_sma': True, 'bull_use_ema': True, 'bull_use_atr': False, 'bull_use_adx': True, 'bull_use_spike': False, 'bull_rsi_required': False, 'bear_strategy': 'mean_reversion', 'bear_bb_std_mult': 3.0057181455285438, 'bear_rsi_os': 27, 'bear_rsi_ob': 87, 'bear_adx_thresh': 13.700630996432388, 'bear_atr_min_pct': 0.024178303386521667, 'bear_atr_max_pct': 0.05492024569788956, 'bear_tp_mult': 2.8808523047116394, 'bear_tsl_mult': 0.6942057360731996, 'bear_time_stop': 11, 'bear_use_sma': True, 'bear_use_ema': True, 'bear_use_atr': True, 'bear_use_adx': True, 'bear_use_spike': True, 'bear_rsi_required': False, 'sideways_strategy': 'breakout', 'sideways_bb_std_mult': 2.7202871631716374, 'sideways_rsi_os': 50, 'sideways_rsi_ob': 66, 'sideways_adx_thresh': 26.511684968329337, 'sideways_atr_min_pct': 0.029969054713798873, 'sideways_atr_max_pct': 0.1308417775221257, 'sideways_tp_mult': 1.681228816971825, 'sideways_tsl_mult': 0.874299469155869, 'sideways_time_stop': 206, 'sideways_use_sma': True, 'sideways_use_ema': False, 'sideways_use_atr': False, 'sideways_use_adx': False, 'sideways_use_spike': False, 'sideways_rsi_required': True}.
