[I 2025-08-31 13:30:56,063] Trial 740 finished with values: [-1000000000.0, 1000000000.0] and parameters: {'p_sma': 32, 'p_std': 23, 'p_atr': 9, 'p_adx': 14, 'rsi_period': 51, 'ema1': 10, 'ema2': 24, 'slip_atr_k': 0.00013113686313306894, 'slip_spread_k': 0.4403914328713133, 'spread_hl_frac': 0.01987853035691204, 'bb_std_mult': 2.379664256415722, 'rsi_os': 27, 'rsi_ob': 85, 'vol_spike': 0.0005848544918337743, 'adx_thresh': 10.245823459334378, 'atr_min_pct': 0.02293143654408157, 'atr_max_pct': 0.054238185157650116, 'tp_mult': 2.304508012765851, 'tsl_mult': 0.7731166430067542, 'strategy': 'mean_reversion', 'time_stop': 170, 'use_sma': False, 'use_atr': False, 'use_adx': True, 'use_ema': True, 'use_spike': True, 'rsi_required': False, 'edge_k': 1.4913944132678063, 'edge_cap': 0.4116234221922218, 'bull_strategy': 'mean_reversion', 'bull_bb_std_mult': 2.767451373798941, 'bull_rsi_os': 44, 'bull_rsi_ob': 85, 'bull_adx_thresh': 19.806617908478227, 'bull_atr_min_pct': 0.020770624854652163, 'bull_atr_max_pct': 0.04141911648135049, 'bull_tp_mult': 2.4158001329952734, 'bull_tsl_mult': 0.709005581827698, 'bull_time_stop': 158, 'bull_use_sma': False, 'bull_use_ema': True, 'bull_use_atr': True, 'bull_use_adx': False, 'bull_use_spike': True, 'bull_rsi_required': True, 'bear_strategy': 'breakout', 'bear_bb_std_mult': 1.0208038428434143, 'bear_rsi_os': 27, 'bear_rsi_ob': 70, 'bear_adx_thresh': 18.402578337638914, 'bear_atr_min_pct': 0.0020547027516237527, 'bear_atr_max_pct': 0.03357913607482848, 'bear_tp_mult': 1.5899650090761863, 'bear_tsl_mult': 0.9733115538406507, 'bear_time_stop': 194, 'bear_use_sma': False, 'bear_use_ema': True, 'bear_use_atr': False, 'bear_use_adx': False, 'bear_use_spike': False, 'bear_rsi_required': True, 'sideways_strategy': 'mean_reversion', 'sideways_bb_std_mult': 2.8554101224262203, 'sideways_rsi_os': 42, 'sideways_rsi_ob': 65, 'sideways_adx_thresh': 18.053061591391728, 'sideways_atr_min_pct': 0.004820510334590418, 'sideways_atr_max_pct': 0.13897853368674154, 'sideways_tp_mult': 1.7723692583309776, 'sideways_tsl_mult': 0.22358990625362202, 'sideways_time_stop': 33, 'sideways_use_sma': False, 'sideways_use_ema': False, 'sideways_use_atr': True, 'sideways_use_adx': True, 'sideways_use_spike': True, 'sideways_rsi_required': True}.
[I 2025-08-31 13:30:56,683] Trial 737 finished with values: [-0.13787790504246045, 0.13719746721409296] and parameters: {'p_sma': 44, 'p_std': 19, 'p_atr': 16, 'p_adx': 11, 'rsi_period': 15, 'ema1': 16, 'ema2': 33, 'slip_atr_k': 0.24727652997078126, 'slip_spread_k': 0.3479910055539104, 'spread_hl_frac': 0.02006887195365817, 'bb_std_mult': 2.371084227465513, 'rsi_os': 16, 'rsi_ob': 94, 'vol_spike': 0.17364467491129573, 'adx_thresh': 5.074855933401592, 'atr_min_pct': 0.026518176935509084, 'atr_max_pct': 0.06082350068024288, 'tp_mult': 2.5512383973501542, 'tsl_mult': 0.7654139319316353, 'strategy': 'breakout', 'time_stop': 165, 'use_sma': False, 'use_atr': False, 'use_adx': True, 'use_ema': False, 'use_spike': True, 'rsi_required': False, 'edge_k': 0.5315770254598948, 'edge_cap': 0.7043560342624299, 'bull_strategy': 'mean_reversion', 'bull_bb_std_mult': 2.8767210685332705, 'bull_rsi_os': 5, 'bull_rsi_ob': 88, 'bull_adx_thresh': 24.893798943908696, 'bull_atr_min_pct': 0.02319819833268562, 'bull_atr_max_pct': 0.018866024866789073, 'bull_tp_mult': 2.1554687950083125, 'bull_tsl_mult': 0.30950274833475555, 'bull_time_stop': 126, 'bull_use_sma': True, 'bull_use_ema': False, 'bull_use_atr': True, 'bull_use_adx': False, 'bull_use_spike': True, 'bull_rsi_required': True, 'bear_strategy': 'breakout', 'bear_bb_std_mult': 2.303465702690096, 'bear_rsi_os': 37, 'bear_rsi_ob': 85, 'bear_adx_thresh': 30.314689850544912, 'bear_atr_min_pct': 0.001926016257594157, 'bear_atr_max_pct': 0.07212151935471989, 'bear_tp_mult': 1.091238687320029, 'bear_tsl_mult': 0.697570504328728, 'bear_time_stop': 72, 'bear_use_sma': False, 'bear_use_ema': True, 'bear_use_atr': False, 'bear_use_adx': False, 'bear_use_spike': True, 'bear_rsi_required': True, 'sideways_strategy': 'breakout', 'sideways_bb_std_mult': 2.6644117871611823, 'sideways_rsi_os': 28, 'sideways_rsi_ob': 67, 'sideways_adx_thresh': 24.08464533174494, 'sideways_atr_min_pct': 0.00452024306355562, 'sideways_atr_max_pct': 0.14011711272685562, 'sideways_tp_mult': 2.6911750137121304, 'sideways_tsl_mult': 0.8260793734117232, 'sideways_time_stop': 33, 'sideways_use_sma': False, 'sideways_use_ema': True, 'sideways_use_atr': True, 'sideways_use_adx': True, 'sideways_use_spike': True, 'sideways_rsi_required': True}.
[I 2025-08-31 13:30:56,929] Trial 738 finished with values: [-1000000000.0, 1000000000.0] and parameters: {'p_sma': 43, 'p_std': 47, 'p_atr': 9, 'p_adx': 22, 'rsi_period': 51, 'ema1': 9, 'ema2': 24, 'slip_atr_k': 0.16198897588837852, 'slip_spread_k': 0.4542729542059808, 'spread_hl_frac': 0.0234590945121131, 'bb_std_mult': 2.2914493285026456, 'rsi_os': 37, 'rsi_ob': 94, 'vol_spike': 0.17463387397316055, 'adx_thresh': 7.621210631132875, 'atr_min_pct': 0.02777882039217563, 'atr_max_pct': 0.04960176391984913, 'tp_mult': 1.9039658455083663, 'tsl_mult': 0.7763160789461868, 'strategy': 'breakout', 'time_stop': 149, 'use_sma': False, 'use_atr': False, 'use_adx': True, 'use_ema': False, 'use_spike': True, 'rsi_required': False, 'edge_k': 1.4812079447022228, 'edge_cap': 0.6984098854008834, 'bull_strategy': 'mean_reversion', 'bull_bb_std_mult': 2.837969063677959, 'bull_rsi_os': 25, 'bull_rsi_ob': 86, 'bull_adx_thresh': 24.88828165657427, 'bull_atr_min_pct': 0.01173220161686748, 'bull_atr_max_pct': 0.14001727412670945, 'bull_tp_mult': 2.591404704315964, 'bull_tsl_mult': 0.301505177340957, 'bull_time_stop': 195, 'bull_use_sma': False, 'bull_use_ema': True, 'bull_use_atr': True, 'bull_use_adx': False, 'bull_use_spike': True, 'bull_rsi_required': True, 'bear_strategy': 'breakout', 'bear_bb_std_mult': 2.5100079747826154, 'bear_rsi_os': 37, 'bear_rsi_ob': 70, 'bear_adx_thresh': 8.104974026555238, 'bear_atr_min_pct': 0.016516752189393087, 'bear_atr_max_pct': 0.13394363671314885, 'bear_tp_mult': 1.123993610346987, 'bear_tsl_mult': 0.7017843413533671, 'bear_time_stop': 192, 'bear_use_sma': False, 'bear_use_ema': True, 'bear_use_atr': False, 'bear_use_adx': False, 'bear_use_spike': True, 'bear_rsi_required': True, 'sideways_strategy': 'mean_reversion', 'sideways_bb_std_mult': 2.8428113040879808, 'sideways_rsi_os': 24, 'sideways_rsi_ob': 50, 'sideways_adx_thresh': 16.69531415826876, 'sideways_atr_min_pct': 0.0046888509570527535, 'sideways_atr_max_pct': 0.13911760012649724, 'sideways_tp_mult': 2.08110488465034, 'sideways_tsl_mult': 0.819186333279293, 'sideways_time_stop': 55, 'sideways_use_sma': False, 'sideways_use_ema': True, 'sideways_use_atr': True, 'sideways_use_adx': True, 'sideways_use_spike': True, 'sideways_rsi_required': True}.
[I 2025-08-31 13:31:31,116] Trial 744 finished with values: [-1000000000.0, 1000000000.0] and parameters: {'p_sma': 13, 'p_std': 21, 'p_atr': 18, 'p_adx': 13, 'rsi_period': 84, 'ema1': 13, 'ema2': 21, 'slip_atr_k': 0.04898186773961829, 'slip_spread_k': 0.5380581840733584, 'spread_hl_frac': 0.04404966593552177, 'bb_std_mult': 1.258788795747252, 'rsi_os': 11, 'rsi_ob': 70, 'vol_spike': 0.017610458288036, 'adx_thresh': 6.524192773960307, 'atr_min_pct': 0.027239413782784952, 'atr_max_pct': 0.03989325109165138, 'tp_mult': 2.4973004047288923, 'tsl_mult': 0.5876195383406437, 'strategy': 'mean_reversion', 'time_stop': 175, 'use_sma': False, 'use_atr': False, 'use_adx': True, 'use_ema': True, 'use_spike': True, 'rsi_required': False, 'edge_k': 0.30330083975426514, 'edge_cap': 0.10751378453893329, 'bull_strategy': 'mean_reversion', 'bull_bb_std_mult': 2.4749318886886176, 'bull_rsi_os': 7, 'bull_rsi_ob': 87, 'bull_adx_thresh': 17.920644642724763, 'bull_atr_min_pct': 0.021415198726571653, 'bull_atr_max_pct': 0.05056503653833582, 'bull_tp_mult': 1.5975689061533709, 'bull_tsl_mult': 0.4413383549854416, 'bull_time_stop': 184, 'bull_use_sma': True, 'bull_use_ema': True, 'bull_use_atr': True, 'bull_use_adx': True, 'bull_use_spike': True, 'bull_rsi_required': True, 'bear_strategy': 'mean_reversion', 'bear_bb_std_mult': 2.822502514573155, 'bear_rsi_os': 30, 'bear_rsi_ob': 72, 'bear_adx_thresh': 28.71576965368775, 'bear_atr_min_pct': 0.0011616581396424392, 'bear_atr_max_pct': 0.12861830158120358, 'bear_tp_mult': 1.4376375411395133, 'bear_tsl_mult': 0.6388141242952885, 'bear_time_stop': 187, 'bear_use_sma': False, 'bear_use_ema': False, 'bear_use_atr': False, 'bear_use_adx': False, 'bear_use_spike': False, 'bear_rsi_required': False, 'sideways_strategy': 'breakout', 'sideways_bb_std_mult': 2.709374847644961, 'sideways_rsi_os': 31, 'sideways_rsi_ob': 64, 'sideways_adx_thresh': 24.8923834816676, 'sideways_atr_min_pct': 0.0027018105170672426, 'sideways_atr_max_pct': 0.14754829992456175, 'sideways_tp_mult': 2.997750468590915, 'sideways_tsl_mult': 0.8827313930229208, 'sideways_time_stop': 66, 'sideways_use_sma': False, 'sideways_use_ema': False, 'sideways_use_atr': True, 'sideways_use_adx': True, 'sideways_use_spike': False, 'sideways_rsi_required': False}.
[I 2025-08-31 13:31:31,382] Trial 741 finished with values: [-1000000000.0, 1000000000.0] and parameters: {'p_sma': 43, 'p_std': 21, 'p_atr': 16, 'p_adx': 14, 'rsi_period': 51, 'ema1': 23, 'ema2': 24, 'slip_atr_k': 0.24732517327950448, 'slip_spread_k': 0.4350567694300414, 'spread_hl_frac': 0.016324851312262557, 'bb_std_mult': 1.2507088392069976, 'rsi_os': 39, 'rsi_ob': 87, 'vol_spike': 0.0035705177317398307, 'adx_thresh': 9.93014154895059, 'atr_min_pct': 0.02670453194756976, 'atr_max_pct': 0.05460032729415469, 'tp_mult': 1.9194388159962197, 'tsl_mult': 0.5817250631139955, 'strategy': 'mean_reversion', 'time_stop': 173, 'use_sma': False, 'use_atr': False, 'use_adx': True, 'use_ema': True, 'use_spike': True, 'rsi_required': False, 'edge_k': 0.5673415458301334, 'edge_cap': 0.48052262432176784, 'bull_strategy': 'mean_reversion', 'bull_bb_std_mult': 2.765472779821049, 'bull_rsi_os': 5, 'bull_rsi_ob': 85, 'bull_adx_thresh': 24.83395010328252, 'bull_atr_min_pct': 0.010950109444843233, 'bull_atr_max_pct': 0.13369482386492873, 'bull_tp_mult': 2.405871454239605, 'bull_tsl_mult': 0.3619686193353838, 'bull_time_stop': 185, 'bull_use_sma': True, 'bull_use_ema': True, 'bull_use_atr': True, 'bull_use_adx': True, 'bull_use_spike': True, 'bull_rsi_required': True, 'bear_strategy': 'breakout', 'bear_bb_std_mult': 1.0875529053606134, 'bear_rsi_os': 18, 'bear_rsi_ob': 71, 'bear_adx_thresh': 22.425230290701368, 'bear_atr_min_pct': 0.01939729382206231, 'bear_atr_max_pct': 0.12075816194937446, 'bear_tp_mult': 1.0851768231457042, 'bear_tsl_mult': 0.6994651373499977, 'bear_time_stop': 194, 'bear_use_sma': False, 'bear_use_ema': True, 'bear_use_atr': False, 'bear_use_adx': False, 'bear_use_spike': False, 'bear_rsi_required': True, 'sideways_strategy': 'breakout', 'sideways_bb_std_mult': 0.7471124239116766, 'sideways_rsi_os': 28, 'sideways_rsi_ob': 87, 'sideways_adx_thresh': 33.495056270305845, 'sideways_atr_min_pct': 0.004517163589457665, 'sideways_atr_max_pct': 0.14058448455569533, 'sideways_tp_mult': 1.7687894349852518, 'sideways_tsl_mult': 0.8784105479272875, 'sideways_time_stop': 34, 'sideways_use_sma': False, 'sideways_use_ema': False, 'sideways_use_atr': True, 'sideways_use_adx': True, 'sideways_use_spike': False, 'sideways_rsi_required': True}.
[I 2025-08-31 13:31:31,605] Trial 742 finished with values: [-1000000000.0, 1000000000.0] and parameters: {'p_sma': 43, 'p_std': 14, 'p_atr': 16, 'p_adx': 13, 'rsi_period': 61, 'ema1': 9, 'ema2': 43, 'slip_atr_k': 0.050538400316638823, 'slip_spread_k': 0.5475681781739958, 'spread_hl_frac': 0.015789091071567694, 'bb_std_mult': 2.2861056140371914, 'rsi_os': 37, 'rsi_ob': 69, 'vol_spike': 0.01652260221626789, 'adx_thresh': 6.434130059249372, 'atr_min_pct': 0.026330816775912536, 'atr_max_pct': 0.05079616065796908, 'tp_mult': 2.4885410950690448, 'tsl_mult': 0.8986816123997201, 'strategy': 'breakout', 'time_stop': 176, 'use_sma': False, 'use_atr': False, 'use_adx': True, 'use_ema': True, 'use_spike': True, 'rsi_required': False, 'edge_k': 0.3262768100900173, 'edge_cap': 0.6919726332434748, 'bull_strategy': 'mean_reversion', 'bull_bb_std_mult': 2.687134520759088, 'bull_rsi_os': 17, 'bull_rsi_ob': 82, 'bull_adx_thresh': 24.918209977779387, 'bull_atr_min_pct': 0.0261214910858327, 'bull_atr_max_pct': 0.13177332025325839, 'bull_tp_mult': 2.203635917541503, 'bull_tsl_mult': 0.361482373337196, 'bull_time_stop': 195, 'bull_use_sma': True, 'bull_use_ema': True, 'bull_use_atr': True, 'bull_use_adx': True, 'bull_use_spike': True, 'bull_rsi_required': True, 'bear_strategy': 'breakout', 'bear_bb_std_mult': 1.484498938800383, 'bear_rsi_os': 18, 'bear_rsi_ob': 70, 'bear_adx_thresh': 6.484931419644937, 'bear_atr_min_pct': 0.019288112365609535, 'bear_atr_max_pct': 0.03890401240568681, 'bear_tp_mult': 1.072549875788002, 'bear_tsl_mult': 0.696883691549352, 'bear_time_stop': 194, 'bear_use_sma': False, 'bear_use_ema': True, 'bear_use_atr': False, 'bear_use_adx': False, 'bear_use_spike': True, 'bear_rsi_required': True, 'sideways_strategy': 'breakout', 'sideways_bb_std_mult': 2.7352399584315865, 'sideways_rsi_os': 25, 'sideways_rsi_ob': 50, 'sideways_adx_thresh': 16.719404947562367, 'sideways_atr_min_pct': 0.02174698441947598, 'sideways_atr_max_pct': 0.1398551574674211, 'sideways_tp_mult': 2.9043852831590105, 'sideways_tsl_mult': 0.9268847240634719, 'sideways_time_stop': 61, 'sideways_use_sma': False, 'sideways_use_ema': False, 'sideways_use_atr': True, 'sideways_use_adx': True, 'sideways_use_spike': False, 'sideways_rsi_required': False}.
[I 2025-08-31 13:31:31,863] Trial 743 finished with values: [-1000000000.0, 1000000000.0] and parameters: {'p_sma': 33, 'p_std': 21, 'p_atr': 18, 'p_adx': 13, 'rsi_period': 11, 'ema1': 27, 'ema2': 19, 'slip_atr_k': 0.14931995805664894, 'slip_spread_k': 0.5475863697469915, 'spread_hl_frac': 0.01658331988847683, 'bb_std_mult': 0.8642076621268753, 'rsi_os': 35, 'rsi_ob': 87, 'vol_spike': 0.017849474012999217, 'adx_thresh': 7.623162610115696, 'atr_min_pct': 0.02693352707910423, 'atr_max_pct': 0.0670400791142953, 'tp_mult': 1.520365299442691, 'tsl_mult': 0.8970276443338818, 'strategy': 'mean_reversion', 'time_stop': 174, 'use_sma': False, 'use_atr': False, 'use_adx': True, 'use_ema': True, 'use_spike': True, 'rsi_required': False, 'edge_k': 0.3214887930184511, 'edge_cap': 0.10262553161187554, 'bull_strategy': 'mean_reversion', 'bull_bb_std_mult': 2.6918645705967355, 'bull_rsi_os': 7, 'bull_rsi_ob': 82, 'bull_adx_thresh': 28.521760671867575, 'bull_atr_min_pct': 0.02614016037109251, 'bull_atr_max_pct': 0.13241299397907375, 'bull_tp_mult': 2.063810668017664, 'bull_tsl_mult': 0.3680907353751395, 'bull_time_stop': 179, 'bull_use_sma': True, 'bull_use_ema': True, 'bull_use_atr': True, 'bull_use_adx': True, 'bull_use_spike': True, 'bull_rsi_required': True, 'bear_strategy': 'mean_reversion', 'bear_bb_std_mult': 2.4083424749721773, 'bear_rsi_os': 28, 'bear_rsi_ob': 95, 'bear_adx_thresh': 28.894521061135187, 'bear_atr_min_pct': 0.0012774629042879696, 'bear_atr_max_pct': 0.015872502340458353, 'bear_tp_mult': 1.0683002109995687, 'bear_tsl_mult': 0.4837737185586189, 'bear_time_stop': 91, 'bear_use_sma': False, 'bear_use_ema': False, 'bear_use_atr': False, 'bear_use_adx': False, 'bear_use_spike': False, 'bear_rsi_required': False, 'sideways_strategy': 'breakout', 'sideways_bb_std_mult': 2.723892808842771, 'sideways_rsi_os': 26, 'sideways_rsi_ob': 50, 'sideways_adx_thresh': 33.664123426754415, 'sideways_atr_min_pct': 0.02626641949179765, 'sideways_atr_max_pct': 0.14972789119858315, 'sideways_tp_mult': 1.6618210352996183, 'sideways_tsl_mult': 0.14302145232180885, 'sideways_time_stop': 45, 'sideways_use_sma': False, 'sideways_use_ema': False, 'sideways_use_atr': True, 'sideways_use_adx': True, 'sideways_use_spike': False, 'sideways_rsi_required': False}.
[I 2025-08-31 13:32:04,325] Trial 748 finished with values: [-1000000000.0, 1000000000.0] and parameters: {'p_sma': 22, 'p_std': 43, 'p_atr': 7, 'p_adx': 14, 'rsi_period': 45, 'ema1': 14, 'ema2': 57, 'slip_atr_k': 0.17137902997785165, 'slip_spread_k': 0.4071932232492762, 'spread_hl_frac': 0.01914445536629765, 'bb_std_mult': 1.747500299776485, 'rsi_os': 39, 'rsi_ob': 85, 'vol_spike': 0.1569678116149434, 'adx_thresh': 8.864765161971361, 'atr_min_pct': 0.020206319923150615, 'atr_max_pct': 0.03623782255676352, 'tp_mult': 2.455592233846593, 'tsl_mult': 0.7511710124429998, 'strategy': 'breakout', 'time_stop': 139, 'use_sma': True, 'use_atr': False, 'use_adx': True, 'use_ema': True, 'use_spike': True, 'rsi_required': False, 'edge_k': 0.5851598236242541, 'edge_cap': 0.32623715200828285, 'bull_strategy': 'mean_reversion', 'bull_bb_std_mult': 2.9380946129630505, 'bull_rsi_os': 6, 'bull_rsi_ob': 89, 'bull_adx_thresh': 19.596295362786055, 'bull_atr_min_pct': 0.022090922435058405, 'bull_atr_max_pct': 0.1369507853512986, 'bull_tp_mult': 2.351934878957583, 'bull_tsl_mult': 0.2771910880476804, 'bull_time_stop': 177, 'bull_use_sma': True, 'bull_use_ema': True, 'bull_use_atr': True, 'bull_use_adx': True, 'bull_use_spike': True, 'bull_rsi_required': True, 'bear_strategy': 'breakout', 'bear_bb_std_mult': 3.599201660960485, 'bear_rsi_os': 32, 'bear_rsi_ob': 73, 'bear_adx_thresh': 10.310963772320624, 'bear_atr_min_pct': 0.0005592573675701359, 'bear_atr_max_pct': 0.11472346521017357, 'bear_tp_mult': 1.2712403036725437, 'bear_tsl_mult': 0.4167130334302902, 'bear_time_stop': 211, 'bear_use_sma': False, 'bear_use_ema': True, 'bear_use_atr': False, 'bear_use_adx': False, 'bear_use_spike': True, 'bear_rsi_required': True, 'sideways_strategy': 'breakout', 'sideways_bb_std_mult': 2.947230777862721, 'sideways_rsi_os': 43, 'sideways_rsi_ob': 91, 'sideways_adx_thresh': 18.951757196148357, 'sideways_atr_min_pct': 0.015559812760095146, 'sideways_atr_max_pct': 0.14502067409654126, 'sideways_tp_mult': 1.7077316445307553, 'sideways_tsl_mult': 0.863411093845171, 'sideways_time_stop': 72, 'sideways_use_sma': False, 'sideways_use_ema': False, 'sideways_use_atr': True, 'sideways_use_adx': True, 'sideways_use_spike': False, 'sideways_rsi_required': True}.
[I 2025-08-31 13:32:04,454] Trial 745 finished with values: [-1000000000.0, 1000000000.0] and parameters: {'p_sma': 23, 'p_std': 55, 'p_atr': 19, 'p_adx': 14, 'rsi_period': 45, 'ema1': 27, 'ema2': 44, 'slip_atr_k': 0.030493730988238543, 'slip_spread_k': 0.40707072037914, 'spread_hl_frac': 0.016460152143060628, 'bb_std_mult': 0.879340310405871, 'rsi_os': 39, 'rsi_ob': 87, 'vol_spike': 0.02099086255773997, 'adx_thresh': 9.71432952388944, 'atr_min_pct': 0.023170200453050453, 'atr_max_pct': 0.06684987751495985, 'tp_mult': 1.5267562678309368, 'tsl_mult': 0.931371002846709, 'strategy': 'breakout', 'time_stop': 141, 'use_sma': False, 'use_atr': False, 'use_adx': True, 'use_ema': True, 'use_spike': True, 'rsi_required': False, 'edge_k': 0.5816620504399003, 'edge_cap': 0.19239497908582437, 'bull_strategy': 'mean_reversion', 'bull_bb_std_mult': 2.6889622171214675, 'bull_rsi_os': 5, 'bull_rsi_ob': 82, 'bull_adx_thresh': 16.629535541562493, 'bull_atr_min_pct': 0.010577827855015754, 'bull_atr_max_pct': 0.10008555541762172, 'bull_tp_mult': 2.1922898639317268, 'bull_tsl_mult': 0.26236565616859, 'bull_time_stop': 177, 'bull_use_sma': True, 'bull_use_ema': True, 'bull_use_atr': True, 'bull_use_adx': True, 'bull_use_spike': True, 'bull_rsi_required': True, 'bear_strategy': 'breakout', 'bear_bb_std_mult': 2.4027722934061386, 'bear_rsi_os': 47, 'bear_rsi_ob': 88, 'bear_adx_thresh': 9.26717060139788, 'bear_atr_min_pct': 0.023338342860791852, 'bear_atr_max_pct': 0.12136884639650564, 'bear_tp_mult': 1.3454980194544468, 'bear_tsl_mult': 0.47752552309458746, 'bear_time_stop': 144, 'bear_use_sma': False, 'bear_use_ema': True, 'bear_use_atr': False, 'bear_use_adx': False, 'bear_use_spike': True, 'bear_rsi_required': True, 'sideways_strategy': 'breakout', 'sideways_bb_std_mult': 2.7280043777167418, 'sideways_rsi_os': 26, 'sideways_rsi_ob': 45, 'sideways_adx_thresh': 33.46143528956753, 'sideways_atr_min_pct': 0.0030459127437935667, 'sideways_atr_max_pct': 0.14475257347354448, 'sideways_tp_mult': 1.6622021836279515, 'sideways_tsl_mult': 0.9237608521070877, 'sideways_time_stop': 46, 'sideways_use_sma': False, 'sideways_use_ema': False, 'sideways_use_atr': True, 'sideways_use_adx': True, 'sideways_use_spike': False, 'sideways_rsi_required': False}.
