[I 2025-08-31 13:13:23,195] Trial 612 finished with values: [-1000000000.0, 1000000000.0] and parameters: {'p_sma': 49, 'p_std': 13, 'p_atr': 13, 'p_adx': 29, 'rsi_period': 52, 'ema1': 20, 'ema2': 50, 'slip_atr_k': 0.07862478842071068, 'slip_spread_k': 0.47993584320180566, 'spread_hl_frac': 0.015374480455976315, 'bb_std_mult': 2.3675326113401414, 'rsi_os': 7, 'rsi_ob': 79, 'vol_spike': 0.02966884626395523, 'adx_thresh': 19.82339466447474, 'atr_min_pct': 0.0033713109000826475, 'atr_max_pct': 0.0630644964774853, 'tp_mult': 2.2361228583131636, 'tsl_mult': 0.8975303893539401, 'strategy': 'breakout', 'time_stop': 229, 'use_sma': False, 'use_atr': True, 'use_adx': False, 'use_ema': True, 'use_spike': False, 'rsi_required': True, 'edge_k': 0.21727328179130045, 'edge_cap': 0.9780193779388844, 'bull_strategy': 'breakout', 'bull_bb_std_mult': 2.4140295604037676, 'bull_rsi_os': 6, 'bull_rsi_ob': 93, 'bull_adx_thresh': 19.77585153018241, 'bull_atr_min_pct': 0.019083276814586686, 'bull_atr_max_pct': 0.015662353380631072, 'bull_tp_mult': 1.2519836181504227, 'bull_tsl_mult': 0.23424587937523703, 'bull_time_stop': 276, 'bull_use_sma': False, 'bull_use_ema': True, 'bull_use_atr': False, 'bull_use_adx': True, 'bull_use_spike': False, 'bull_rsi_required': False, 'bear_strategy': 'breakout', 'bear_bb_std_mult': 0.5967013493771702, 'bear_rsi_os': 20, 'bear_rsi_ob': 72, 'bear_adx_thresh': 13.343723775857303, 'bear_atr_min_pct': 0.0024104115081287837, 'bear_atr_max_pct': 0.12278074045721821, 'bear_tp_mult': 2.8118650922679356, 'bear_tsl_mult': 0.7975649760158146, 'bear_time_stop': 208, 'bear_use_sma': False, 'bear_use_ema': True, 'bear_use_atr': True, 'bear_use_adx': True, 'bear_use_spike': False, 'bear_rsi_required': True, 'sideways_strategy': 'breakout', 'sideways_bb_std_mult': 0.9630090113083405, 'sideways_rsi_os': 44, 'sideways_rsi_ob': 65, 'sideways_adx_thresh': 27.880709883228764, 'sideways_atr_min_pct': 0.026960727082898532, 'sideways_atr_max_pct': 0.12462511496307765, 'sideways_tp_mult': 2.6633098918288876, 'sideways_tsl_mult': 0.503879519482822, 'sideways_time_stop': 141, 'sideways_use_sma': True, 'sideways_use_ema': False, 'sideways_use_atr': False, 'sideways_use_adx': True, 'sideways_use_spike': False, 'sideways_rsi_required': True}.
[I 2025-08-31 13:13:23,724] Trial 610 finished with values: [-0.1242409939218655, 0.12359312445433218] and parameters: {'p_sma': 56, 'p_std': 59, 'p_atr': 13, 'p_adx': 12, 'rsi_period': 18, 'ema1': 20, 'ema2': 40, 'slip_atr_k': 0.12148000926464621, 'slip_spread_k': 0.3623786487441137, 'spread_hl_frac': 0.044778280157293744, 'bb_std_mult': 2.6057847736682307, 'rsi_os': 17, 'rsi_ob': 79, 'vol_spike': 0.02763921619872707, 'adx_thresh': 5.694886003617171, 'atr_min_pct': 0.0006409334219499409, 'atr_max_pct': 0.06122733269156747, 'tp_mult': 2.419186644567343, 'tsl_mult': 0.9949352417707489, 'strategy': 'breakout', 'time_stop': 176, 'use_sma': False, 'use_atr': True, 'use_adx': True, 'use_ema': True, 'use_spike': False, 'rsi_required': True, 'edge_k': 0.5789760394001935, 'edge_cap': 0.7373068264382046, 'bull_strategy': 'mean_reversion', 'bull_bb_std_mult': 0.8222344091165332, 'bull_rsi_os': 6, 'bull_rsi_ob': 53, 'bull_adx_thresh': 5.089251258417017, 'bull_atr_min_pct': 0.02457093900108029, 'bull_atr_max_pct': 0.1130523767490631, 'bull_tp_mult': 1.1496897728445077, 'bull_tsl_mult': 0.14361921117842552, 'bull_time_stop': 294, 'bull_use_sma': False, 'bull_use_ema': True, 'bull_use_atr': False, 'bull_use_adx': True, 'bull_use_spike': True, 'bull_rsi_required': True, 'bear_strategy': 'breakout', 'bear_bb_std_mult': 3.07340749753774, 'bear_rsi_os': 41, 'bear_rsi_ob': 55, 'bear_adx_thresh': 29.469127146657783, 'bear_atr_min_pct': 0.0015662189781613322, 'bear_atr_max_pct': 0.1498427400337676, 'bear_tp_mult': 2.804189351700536, 'bear_tsl_mult': 0.5752320968375433, 'bear_time_stop': 208, 'bear_use_sma': False, 'bear_use_ema': True, 'bear_use_atr': False, 'bear_use_adx': False, 'bear_use_spike': True, 'bear_rsi_required': True, 'sideways_strategy': 'mean_reversion', 'sideways_bb_std_mult': 3.227707607901822, 'sideways_rsi_os': 45, 'sideways_rsi_ob': 68, 'sideways_adx_thresh': 22.75302377829072, 'sideways_atr_min_pct': 0.02711567573136176, 'sideways_atr_max_pct': 0.12542361450005113, 'sideways_tp_mult': 1.9244373628908438, 'sideways_tsl_mult': 0.8802096865584002, 'sideways_time_stop': 194, 'sideways_use_sma': False, 'sideways_use_ema': True, 'sideways_use_atr': True, 'sideways_use_adx': False, 'sideways_use_spike': False, 'sideways_rsi_required': True}.
[I 2025-08-31 13:13:56,524] Trial 614 finished with values: [-0.012761521103034967, 0.014897784640409084] and parameters: {'p_sma': 42, 'p_std': 25, 'p_atr': 13, 'p_adx': 17, 'rsi_period': 51, 'ema1': 27, 'ema2': 15, 'slip_atr_k': 0.11685727694978952, 'slip_spread_k': 0.7891005680161819, 'spread_hl_frac': 5.440548475340798e-05, 'bb_std_mult': 2.1389046072643665, 'rsi_os': 40, 'rsi_ob': 70, 'vol_spike': 0.028598707997879603, 'adx_thresh': 19.863104308678846, 'atr_min_pct': 0.0034112850541108976, 'atr_max_pct': 0.06341572276374643, 'tp_mult': 2.6717574489138407, 'tsl_mult': 0.0346876216319162, 'strategy': 'breakout', 'time_stop': 163, 'use_sma': False, 'use_atr': True, 'use_adx': False, 'use_ema': True, 'use_spike': False, 'rsi_required': True, 'edge_k': 0.561934283332611, 'edge_cap': 0.7668131330033302, 'bull_strategy': 'breakout', 'bull_bb_std_mult': 2.3998180013272385, 'bull_rsi_os': 39, 'bull_rsi_ob': 51, 'bull_adx_thresh': 17.221432644275673, 'bull_atr_min_pct': 0.019107423858110154, 'bull_atr_max_pct': 0.14510467757147777, 'bull_tp_mult': 1.243067440769043, 'bull_tsl_mult': 0.23524645557780355, 'bull_time_stop': 280, 'bull_use_sma': False, 'bull_use_ema': True, 'bull_use_atr': False, 'bull_use_adx': True, 'bull_use_spike': False, 'bull_rsi_required': False, 'bear_strategy': 'breakout', 'bear_bb_std_mult': 2.6881972429907193, 'bear_rsi_os': 16, 'bear_rsi_ob': 72, 'bear_adx_thresh': 13.46614994366274, 'bear_atr_min_pct': 0.001461269148947878, 'bear_atr_max_pct': 0.12513901259498553, 'bear_tp_mult': 1.6553543052166897, 'bear_tsl_mult': 0.7504610067824393, 'bear_time_stop': 210, 'bear_use_sma': False, 'bear_use_ema': True, 'bear_use_atr': True, 'bear_use_adx': True, 'bear_use_spike': True, 'bear_rsi_required': True, 'sideways_strategy': 'breakout', 'sideways_bb_std_mult': 2.7785121507565123, 'sideways_rsi_os': 32, 'sideways_rsi_ob': 66, 'sideways_adx_thresh': 24.518401648957422, 'sideways_atr_min_pct': 0.0019729722686634837, 'sideways_atr_max_pct': 0.07596665077340367, 'sideways_tp_mult': 2.506882398310246, 'sideways_tsl_mult': 0.5083671541581706, 'sideways_time_stop': 25, 'sideways_use_sma': True, 'sideways_use_ema': False, 'sideways_use_atr': False, 'sideways_use_adx': False, 'sideways_use_spike': False, 'sideways_rsi_required': True}.
[I 2025-08-31 13:13:56,785] Trial 617 finished with values: [-1000000000.0, 1000000000.0] and parameters: {'p_sma': 5, 'p_std': 25, 'p_atr': 11, 'p_adx': 17, 'rsi_period': 50, 'ema1': 25, 'ema2': 12, 'slip_atr_k': 0.23172732203522795, 'slip_spread_k': 0.9649968523252325, 'spread_hl_frac': 0.04199334509795749, 'bb_std_mult': 1.465712511127537, 'rsi_os': 36, 'rsi_ob': 86, 'vol_spike': 0.007023368524268693, 'adx_thresh': 20.491539543443498, 'atr_min_pct': 0.0024877889651975025, 'atr_max_pct': 0.09450862085956202, 'tp_mult': 2.8869742555517295, 'tsl_mult': 0.03707549810896052, 'strategy': 'breakout', 'time_stop': 137, 'use_sma': False, 'use_atr': True, 'use_adx': False, 'use_ema': True, 'use_spike': False, 'rsi_required': True, 'edge_k': 0.7389221888747873, 'edge_cap': 0.6826144670594179, 'bull_strategy': 'breakout', 'bull_bb_std_mult': 2.551006562668003, 'bull_rsi_os': 33, 'bull_rsi_ob': 51, 'bull_adx_thresh': 26.476528317894584, 'bull_atr_min_pct': 0.01873720607531757, 'bull_atr_max_pct': 0.14510986746273175, 'bull_tp_mult': 1.8313320689346106, 'bull_tsl_mult': 0.20809241407000603, 'bull_time_stop': 249, 'bull_use_sma': True, 'bull_use_ema': True, 'bull_use_atr': False, 'bull_use_adx': False, 'bull_use_spike': False, 'bull_rsi_required': False, 'bear_strategy': 'mean_reversion', 'bear_bb_std_mult': 1.2077043809131307, 'bear_rsi_os': 30, 'bear_rsi_ob': 84, 'bear_adx_thresh': 14.51846180773475, 'bear_atr_min_pct': 0.02277724760091392, 'bear_atr_max_pct': 0.07752746151593043, 'bear_tp_mult': 2.8954635113407687, 'bear_tsl_mult': 0.8612392562818026, 'bear_time_stop': 36, 'bear_use_sma': True, 'bear_use_ema': False, 'bear_use_atr': True, 'bear_use_adx': True, 'bear_use_spike': True, 'bear_rsi_required': False, 'sideways_strategy': 'breakout', 'sideways_bb_std_mult': 2.7881985616984, 'sideways_rsi_os': 28, 'sideways_rsi_ob': 61, 'sideways_adx_thresh': 24.626584310181478, 'sideways_atr_min_pct': 0.0020594855249804547, 'sideways_atr_max_pct': 0.0393125366386337, 'sideways_tp_mult': 1.075068361507594, 'sideways_tsl_mult': 0.8496650438471514, 'sideways_time_stop': 25, 'sideways_use_sma': True, 'sideways_use_ema': False, 'sideways_use_atr': False, 'sideways_use_adx': False, 'sideways_use_spike': False, 'sideways_rsi_required': False}.
[I 2025-08-31 13:13:56,798] Trial 615 finished with values: [-1000000000.0, 1000000000.0] and parameters: {'p_sma': 47, 'p_std': 25, 'p_atr': 7, 'p_adx': 17, 'rsi_period': 51, 'ema1': 27, 'ema2': 12, 'slip_atr_k': 0.2299283280359405, 'slip_spread_k': 0.19739274314830346, 'spread_hl_frac': 0.04257470631865051, 'bb_std_mult': 0.5817573970117924, 'rsi_os': 10, 'rsi_ob': 76, 'vol_spike': 0.11477690503180137, 'adx_thresh': 19.706481207027256, 'atr_min_pct': 0.003351259120202156, 'atr_max_pct': 0.12320397537430469, 'tp_mult': 2.7569381494988656, 'tsl_mult': 0.04454144145828148, 'strategy': 'breakout', 'time_stop': 164, 'use_sma': False, 'use_atr': True, 'use_adx': False, 'use_ema': True, 'use_spike': False, 'rsi_required': True, 'edge_k': 0.21901382470539088, 'edge_cap': 0.7611222255391392, 'bull_strategy': 'breakout', 'bull_bb_std_mult': 1.81710165563512, 'bull_rsi_os': 39, 'bull_rsi_ob': 51, 'bull_adx_thresh': 32.92542890415729, 'bull_atr_min_pct': 0.01918184423303547, 'bull_atr_max_pct': 0.14220426423884777, 'bull_tp_mult': 1.2388204461105705, 'bull_tsl_mult': 0.23244039409333458, 'bull_time_stop': 141, 'bull_use_sma': True, 'bull_use_ema': True, 'bull_use_atr': False, 'bull_use_adx': True, 'bull_use_spike': False, 'bull_rsi_required': False, 'bear_strategy': 'mean_reversion', 'bear_bb_std_mult': 1.2188947107516577, 'bear_rsi_os': 14, 'bear_rsi_ob': 72, 'bear_adx_thresh': 16.187771060831075, 'bear_atr_min_pct': 0.0013473993429894235, 'bear_atr_max_pct': 0.1494998513930654, 'bear_tp_mult': 1.177387432014903, 'bear_tsl_mult': 0.6379234533692228, 'bear_time_stop': 208, 'bear_use_sma': True, 'bear_use_ema': False, 'bear_use_atr': True, 'bear_use_adx': True, 'bear_use_spike': True, 'bear_rsi_required': False, 'sideways_strategy': 'breakout', 'sideways_bb_std_mult': 2.2128193665859417, 'sideways_rsi_os': 28, 'sideways_rsi_ob': 89, 'sideways_adx_thresh': 26.00353446768574, 'sideways_atr_min_pct': 0.0055515603892926525, 'sideways_atr_max_pct': 0.12717455175504846, 'sideways_tp_mult': 1.6072473413778974, 'sideways_tsl_mult': 0.5374916592338893, 'sideways_time_stop': 141, 'sideways_use_sma': True, 'sideways_use_ema': False, 'sideways_use_atr': False, 'sideways_use_adx': False, 'sideways_use_spike': False, 'sideways_rsi_required': True}.
[I 2025-08-31 13:13:57,036] Trial 616 finished with values: [-0.0261682326267888, 0.02615611629772899] and parameters: {'p_sma': 52, 'p_std': 25, 'p_atr': 11, 'p_adx': 17, 'rsi_period': 50, 'ema1': 21, 'ema2': 12, 'slip_atr_k': 0.0476842950698016, 'slip_spread_k': 0.5769517330101518, 'spread_hl_frac': 0.04250953866899754, 'bb_std_mult': 3.144796065074741, 'rsi_os': 10, 'rsi_ob': 76, 'vol_spike': 0.21032489211553873, 'adx_thresh': 29.7416727152249, 'atr_min_pct': 0.01309138724667373, 'atr_max_pct': 0.09635091544090617, 'tp_mult': 2.7645493811690596, 'tsl_mult': 0.03522214708451078, 'strategy': 'breakout', 'time_stop': 137, 'use_sma': False, 'use_atr': True, 'use_adx': False, 'use_ema': True, 'use_spike': False, 'rsi_required': True, 'edge_k': 0.7486941777337329, 'edge_cap': 0.7661034965283433, 'bull_strategy': 'breakout', 'bull_bb_std_mult': 2.8411169499468323, 'bull_rsi_os': 39, 'bull_rsi_ob': 63, 'bull_adx_thresh': 21.336127402917388, 'bull_atr_min_pct': 0.017644425382798055, 'bull_atr_max_pct': 0.14165741565945816, 'bull_tp_mult': 1.3452682016939645, 'bull_tsl_mult': 0.789058807918787, 'bull_time_stop': 143, 'bull_use_sma': True, 'bull_use_ema': True, 'bull_use_atr': False, 'bull_use_adx': False, 'bull_use_spike': False, 'bull_rsi_required': False, 'bear_strategy': 'mean_reversion', 'bear_bb_std_mult': 3.1453006479446763, 'bear_rsi_os': 30, 'bear_rsi_ob': 68, 'bear_adx_thresh': 16.0215790432364, 'bear_atr_min_pct': 0.0014745354562028996, 'bear_atr_max_pct': 0.01687377361123346, 'bear_tp_mult': 1.176669765891916, 'bear_tsl_mult': 0.7142849744561882, 'bear_time_stop': 36, 'bear_use_sma': True, 'bear_use_ema': False, 'bear_use_atr': True, 'bear_use_adx': True, 'bear_use_spike': True, 'bear_rsi_required': False, 'sideways_strategy': 'breakout', 'sideways_bb_std_mult': 2.796526247076563, 'sideways_rsi_os': 33, 'sideways_rsi_ob': 93, 'sideways_adx_thresh': 26.01120294998605, 'sideways_atr_min_pct': 0.0020494783381486683, 'sideways_atr_max_pct': 0.07587782509981927, 'sideways_tp_mult': 1.222939800536925, 'sideways_tsl_mult': 0.532356410468755, 'sideways_time_stop': 203, 'sideways_use_sma': True, 'sideways_use_ema': False, 'sideways_use_atr': False, 'sideways_use_adx': False, 'sideways_use_spike': False, 'sideways_rsi_required': True}.
[I 2025-08-31 13:14:30,453] Trial 618 finished with values: [-1000000000.0, 1000000000.0] and parameters: {'p_sma': 52, 'p_std': 25, 'p_atr': 11, 'p_adx': 17, 'rsi_period': 50, 'ema1': 11, 'ema2': 16, 'slip_atr_k': 0.05215083098115439, 'slip_spread_k': 0.4607054501687142, 'spread_hl_frac': 0.041149930776439525, 'bb_std_mult': 0.5794375139429255, 'rsi_os': 55, 'rsi_ob': 94, 'vol_spike': 0.12931404762814533, 'adx_thresh': 29.653888789532097, 'atr_min_pct': 0.0201788100058584, 'atr_max_pct': 0.09514959372041523, 'tp_mult': 2.7575880247280478, 'tsl_mult': 0.036374156525689996, 'strategy': 'breakout', 'time_stop': 164, 'use_sma': False, 'use_atr': True, 'use_adx': False, 'use_ema': True, 'use_spike': False, 'rsi_required': True, 'edge_k': 0.7434661404629598, 'edge_cap': 0.7566415465984501, 'bull_strategy': 'breakout', 'bull_bb_std_mult': 2.56705740743006, 'bull_rsi_os': 47, 'bull_rsi_ob': 49, 'bull_adx_thresh': 17.624849152357058, 'bull_atr_min_pct': 0.019545908269390747, 'bull_atr_max_pct': 0.14498533802619007, 'bull_tp_mult': 1.5425314941751975, 'bull_tsl_mult': 0.20925848305198752, 'bull_time_stop': 128, 'bull_use_sma': True, 'bull_use_ema': True, 'bull_use_atr': False, 'bull_use_adx': False, 'bull_use_spike': False, 'bull_rsi_required': False, 'bear_strategy': 'mean_reversion', 'bear_bb_std_mult': 3.144536653417191, 'bear_rsi_os': 10, 'bear_rsi_ob': 71, 'bear_adx_thresh': 23.132477855157923, 'bear_atr_min_pct': 0.0004926599727600697, 'bear_atr_max_pct': 0.13747139623155644, 'bear_tp_mult': 1.1725384716425435, 'bear_tsl_mult': 0.7109148964324093, 'bear_time_stop': 190, 'bear_use_sma': True, 'bear_use_ema': False, 'bear_use_atr': True, 'bear_use_adx': True, 'bear_use_spike': True, 'bear_rsi_required': False, 'sideways_strategy': 'breakout', 'sideways_bb_std_mult': 2.765412655777583, 'sideways_rsi_os': 28, 'sideways_rsi_ob': 86, 'sideways_adx_thresh': 25.903599836575488, 'sideways_atr_min_pct': 0.002762883577056675, 'sideways_atr_max_pct': 0.13529295231881996, 'sideways_tp_mult': 1.1706962064166007, 'sideways_tsl_mult': 0.8478538775369805, 'sideways_time_stop': 244, 'sideways_use_sma': True, 'sideways_use_ema': False, 'sideways_use_atr': False, 'sideways_use_adx': False, 'sideways_use_spike': False, 'sideways_rsi_required': False}.
[I 2025-08-31 13:14:31,129] Trial 621 finished with values: [-0.13958967688957968, 0.1390076382144356] and parameters: {'p_sma': 45, 'p_std': 27, 'p_atr': 12, 'p_adx': 30, 'rsi_period': 41, 'ema1': 11, 'ema2': 15, 'slip_atr_k': 0.06097138580499145, 'slip_spread_k': 0.459123412369681, 'spread_hl_frac': 0.0056764648008956475, 'bb_std_mult': 2.2562623380261897, 'rsi_os': 39, 'rsi_ob': 49, 'vol_spike': 0.27452915417694, 'adx_thresh': 13.228102139455114, 'atr_min_pct': 0.021459049863884617, 'atr_max_pct': 0.03802565366034403, 'tp_mult': 2.673205314309961, 'tsl_mult': 0.10082055982542197, 'strategy': 'breakout', 'time_stop': 191, 'use_sma': False, 'use_atr': False, 'use_adx': False, 'use_ema': True, 'use_spike': False, 'rsi_required': False, 'edge_k': 0.39057978730437737, 'edge_cap': 0.9527502532866486, 'bull_strategy': 'breakout', 'bull_bb_std_mult': 2.7352515274563793, 'bull_rsi_os': 7, 'bull_rsi_ob': 49, 'bull_adx_thresh': 17.437758230270596, 'bull_atr_min_pct': 0.018188559810034276, 'bull_atr_max_pct': 0.14987251685867528, 'bull_tp_mult': 1.6474616542390659, 'bull_tsl_mult': 0.1946069228759231, 'bull_time_stop': 283, 'bull_use_sma': True, 'bull_use_ema': True, 'bull_use_atr': False, 'bull_use_adx': True, 'bull_use_spike': False, 'bull_rsi_required': False, 'bear_strategy': 'breakout', 'bear_bb_std_mult': 2.6800489582810125, 'bear_rsi_os': 46, 'bear_rsi_ob': 73, 'bear_adx_thresh': 14.787833681002603, 'bear_atr_min_pct': 0.0005380827054464051, 'bear_atr_max_pct': 0.13779886308337763, 'bear_tp_mult': 1.0118437845406667, 'bear_tsl_mult': 0.7438819500808349, 'bear_time_stop': 199, 'bear_use_sma': True, 'bear_use_ema': True, 'bear_use_atr': True, 'bear_use_adx': True, 'bear_use_spike': True, 'bear_rsi_required': True, 'sideways_strategy': 'breakout', 'sideways_bb_std_mult': 2.5740860505379857, 'sideways_rsi_os': 31, 'sideways_rsi_ob': 86, 'sideways_adx_thresh': 26.954185596474233, 'sideways_atr_min_pct': 0.002888121979269683, 'sideways_atr_max_pct': 0.10586622906152138, 'sideways_tp_mult': 1.6495189342012266, 'sideways_tsl_mult': 0.9138708367643, 'sideways_time_stop': 245, 'sideways_use_sma': True, 'sideways_use_ema': False, 'sideways_use_atr': False, 'sideways_use_adx': False, 'sideways_use_spike': True, 'sideways_rsi_required': False}.
[I 2025-08-31 13:14:32,062] Trial 620 finished with values: [-0.18254110879052043, 0.18190661478946474] and parameters: {'p_sma': 52, 'p_std': 43, 'p_atr': 9, 'p_adx': 27, 'rsi_period': 26, 'ema1': 26, 'ema2': 16, 'slip_atr_k': 0.11609962656261635, 'slip_spread_k': 0.7825014818055249, 'spread_hl_frac': 0.023961568423771583, 'bb_std_mult': 3.384378715269495, 'rsi_os': 38, 'rsi_ob': 89, 'vol_spike': 0.2754991600313641, 'adx_thresh': 21.699415477878652, 'atr_min_pct': 0.002307229691846979, 'atr_max_pct': 0.010179047624109622, 'tp_mult': 2.661314946596767, 'tsl_mult': 0.029194622962528418, 'strategy': 'breakout', 'time_stop': 194, 'use_sma': False, 'use_atr': False, 'use_adx': False, 'use_ema': True, 'use_spike': False, 'rsi_required': False, 'edge_k': 0.6315848648906806, 'edge_cap': 0.7961498754158338, 'bull_strategy': 'breakout', 'bull_bb_std_mult': 2.8458401542330494, 'bull_rsi_os': 7, 'bull_rsi_ob': 49, 'bull_adx_thresh': 17.68530520333223, 'bull_atr_min_pct': 0.017716662955113295, 'bull_atr_max_pct': 0.011727048661375666, 'bull_tp_mult': 1.3484006184000519, 'bull_tsl_mult': 0.19778406772983637, 'bull_time_stop': 283, 'bull_use_sma': True, 'bull_use_ema': True, 'bull_use_atr': False, 'bull_use_adx': False, 'bull_use_spike': False, 'bull_rsi_required': False, 'bear_strategy': 'breakout', 'bear_bb_std_mult': 3.14831633681566, 'bear_rsi_os': 50, 'bear_rsi_ob': 74, 'bear_adx_thresh': 11.437058208863053, 'bear_atr_min_pct': 0.0006762950240638548, 'bear_atr_max_pct': 0.13794706797091083, 'bear_tp_mult': 2.9104710668136344, 'bear_tsl_mult': 0.5286657996676918, 'bear_time_stop': 96, 'bear_use_sma': True, 'bear_use_ema': True, 'bear_use_atr': True, 'bear_use_adx': True, 'bear_use_spike': True, 'bear_rsi_required': True, 'sideways_strategy': 'breakout', 'sideways_bb_std_mult': 2.5802638198013295, 'sideways_rsi_os': 32, 'sideways_rsi_ob': 66, 'sideways_adx_thresh': 26.724166638953015, 'sideways_atr_min_pct': 0.029470736803438344, 'sideways_atr_max_pct': 0.07669031916565713, 'sideways_tp_mult': 1.2316687814225928, 'sideways_tsl_mult': 0.7905298032642035, 'sideways_time_stop': 10, 'sideways_use_sma': True, 'sideways_use_ema': False, 'sideways_use_atr': False, 'sideways_use_adx': False, 'sideways_use_spike': True, 'sideways_rsi_required': True}.
