[I 2025-08-31 12:43:18,102] Trial 396 finished with values: [-1000000000.0, 1000000000.0] and parameters: {'p_sma': 52, 'p_std': 24, 'p_atr': 13, 'p_adx': 16, 'rsi_period': 46, 'ema1': 19, 'ema2': 15, 'slip_atr_k': 0.06496676709445996, 'slip_spread_k': 0.43892708741338804, 'spread_hl_frac': 0.017596851770312057, 'bb_std_mult': 2.201537039537577, 'rsi_os': 37, 'rsi_ob': 82, 'vol_spike': 0.03604807670791396, 'adx_thresh': 18.235535193523692, 'atr_min_pct': 0.014894801115885271, 'atr_max_pct': 0.1236054427692164, 'tp_mult': 2.7118397038438635, 'tsl_mult': 0.03522788260619443, 'strategy': 'breakout', 'time_stop': 169, 'use_sma': False, 'use_atr': True, 'use_adx': False, 'use_ema': True, 'use_spike': False, 'rsi_required': True, 'edge_k': 0.4179497036569313, 'edge_cap': 0.7469867001126347, 'bull_strategy': 'breakout', 'bull_bb_std_mult': 2.7551387816276636, 'bull_rsi_os': 5, 'bull_rsi_ob': 58, 'bull_adx_thresh': 22.15304494413222, 'bull_atr_min_pct': 0.017602490760457366, 'bull_atr_max_pct': 0.14986966267627852, 'bull_tp_mult': 1.1156216503848713, 'bull_tsl_mult': 0.4043930305314904, 'bull_time_stop': 287, 'bull_use_sma': True, 'bull_use_ema': True, 'bull_use_atr': False, 'bull_use_adx': True, 'bull_use_spike': True, 'bull_rsi_required': False, 'bear_strategy': 'breakout', 'bear_bb_std_mult': 3.109694194425248, 'bear_rsi_os': 27, 'bear_rsi_ob': 70, 'bear_adx_thresh': 13.571228169653164, 'bear_atr_min_pct': 0.007502664778168882, 'bear_atr_max_pct': 0.13858075466280434, 'bear_tp_mult': 2.9748348033722807, 'bear_tsl_mult': 0.6767392241133849, 'bear_time_stop': 170, 'bear_use_sma': True, 'bear_use_ema': True, 'bear_use_atr': True, 'bear_use_adx': True, 'bear_use_spike': False, 'bear_rsi_required': True, 'sideways_strategy': 'breakout', 'sideways_bb_std_mult': 2.392657220518071, 'sideways_rsi_os': 31, 'sideways_rsi_ob': 62, 'sideways_adx_thresh': 27.350908765747988, 'sideways_atr_min_pct': 0.0035672849986077013, 'sideways_atr_max_pct': 0.1326172161101216, 'sideways_tp_mult': 1.6250566255310654, 'sideways_tsl_mult': 0.8952969672978447, 'sideways_time_stop': 253, 'sideways_use_sma': True, 'sideways_use_ema': False, 'sideways_use_atr': False, 'sideways_use_adx': True, 'sideways_use_spike': False, 'sideways_rsi_required': True}.
[I 2025-08-31 12:43:18,224] Trial 397 finished with values: [-0.010432492836915608, 0.010758498318422216] and parameters: {'p_sma': 52, 'p_std': 24, 'p_atr': 8, 'p_adx': 17, 'rsi_period': 47, 'ema1': 19, 'ema2': 15, 'slip_atr_k': 0.06297180381472349, 'slip_spread_k': 0.24858831340976922, 'spread_hl_frac': 0.018189567857795845, 'bb_std_mult': 2.2120698567580717, 'rsi_os': 37, 'rsi_ob': 78, 'vol_spike': 0.033714211851592235, 'adx_thresh': 19.99471083818971, 'atr_min_pct': 0.0015845336094682371, 'atr_max_pct': 0.12378187352861045, 'tp_mult': 2.712161971939928, 'tsl_mult': 0.10546843505345956, 'strategy': 'breakout', 'time_stop': 165, 'use_sma': False, 'use_atr': True, 'use_adx': False, 'use_ema': True, 'use_spike': False, 'rsi_required': True, 'edge_k': 0.639085847527948, 'edge_cap': 0.7525930423211821, 'bull_strategy': 'breakout', 'bull_bb_std_mult': 2.7439823226873172, 'bull_rsi_os': 7, 'bull_rsi_ob': 50, 'bull_adx_thresh': 20.356759851041296, 'bull_atr_min_pct': 0.017805007735527345, 'bull_atr_max_pct': 0.14867572468670545, 'bull_tp_mult': 1.1796121877697099, 'bull_tsl_mult': 0.1561976285814068, 'bull_time_stop': 287, 'bull_use_sma': True, 'bull_use_ema': True, 'bull_use_atr': False, 'bull_use_adx': True, 'bull_use_spike': True, 'bull_rsi_required': False, 'bear_strategy': 'breakout', 'bear_bb_std_mult': 3.110920804099601, 'bear_rsi_os': 27, 'bear_rsi_ob': 70, 'bear_adx_thresh': 13.088142086285337, 'bear_atr_min_pct': 0.0021194221275172617, 'bear_atr_max_pct': 0.13926060186918746, 'bear_tp_mult': 2.997103160468112, 'bear_tsl_mult': 0.6858538459137472, 'bear_time_stop': 170, 'bear_use_sma': True, 'bear_use_ema': True, 'bear_use_atr': True, 'bear_use_adx': True, 'bear_use_spike': False, 'bear_rsi_required': True, 'sideways_strategy': 'breakout', 'sideways_bb_std_mult': 2.6743488094270456, 'sideways_rsi_os': 31, 'sideways_rsi_ob': 65, 'sideways_adx_thresh': 27.427821327756295, 'sideways_atr_min_pct': 0.0036834798347500433, 'sideways_atr_max_pct': 0.12844331472284026, 'sideways_tp_mult': 1.5712989171953053, 'sideways_tsl_mult': 0.8936900221888996, 'sideways_time_stop': 282, 'sideways_use_sma': True, 'sideways_use_ema': False, 'sideways_use_atr': False, 'sideways_use_adx': True, 'sideways_use_spike': False, 'sideways_rsi_required': True}.
[I 2025-08-31 12:43:18,398] Trial 398 finished with values: [-0.11579033221580104, 0.11519367947434576] and parameters: {'p_sma': 52, 'p_std': 24, 'p_atr': 13, 'p_adx': 18, 'rsi_period': 47, 'ema1': 17, 'ema2': 16, 'slip_atr_k': 0.06311340960470249, 'slip_spread_k': 0.25067100530217573, 'spread_hl_frac': 0.01829784722583414, 'bb_std_mult': 2.2180854538461947, 'rsi_os': 37, 'rsi_ob': 78, 'vol_spike': 0.03846514754616881, 'adx_thresh': 20.004379961183897, 'atr_min_pct': 5.716119245235984e-05, 'atr_max_pct': 0.12240500518271687, 'tp_mult': 2.6950811812658397, 'tsl_mult': 0.1410543203150731, 'strategy': 'breakout', 'time_stop': 181, 'use_sma': False, 'use_atr': True, 'use_adx': False, 'use_ema': True, 'use_spike': False, 'rsi_required': True, 'edge_k': 0.9187841112091685, 'edge_cap': 0.7178136452340095, 'bull_strategy': 'breakout', 'bull_bb_std_mult': 2.7393976712156336, 'bull_rsi_os': 7, 'bull_rsi_ob': 50, 'bull_adx_thresh': 15.860802109998225, 'bull_atr_min_pct': 0.01930267561653288, 'bull_atr_max_pct': 0.1487448185447402, 'bull_tp_mult': 1.2388268031524283, 'bull_tsl_mult': 0.17290363419807445, 'bull_time_stop': 288, 'bull_use_sma': True, 'bull_use_ema': True, 'bull_use_atr': False, 'bull_use_adx': True, 'bull_use_spike': False, 'bull_rsi_required': False, 'bear_strategy': 'breakout', 'bear_bb_std_mult': 3.122654344930053, 'bear_rsi_os': 52, 'bear_rsi_ob': 70, 'bear_adx_thresh': 15.056332231449142, 'bear_atr_min_pct': 0.002168454229052393, 'bear_atr_max_pct': 0.1385862782927074, 'bear_tp_mult': 2.930400044875627, 'bear_tsl_mult': 0.6585474473085008, 'bear_time_stop': 212, 'bear_use_sma': True, 'bear_use_ema': True, 'bear_use_atr': True, 'bear_use_adx': True, 'bear_use_spike': True, 'bear_rsi_required': True, 'sideways_strategy': 'breakout', 'sideways_bb_std_mult': 2.383089440878506, 'sideways_rsi_os': 31, 'sideways_rsi_ob': 66, 'sideways_adx_thresh': 26.920373315908847, 'sideways_atr_min_pct': 0.0035312031645737844, 'sideways_atr_max_pct': 0.12859749727573605, 'sideways_tp_mult': 1.6758504736517257, 'sideways_tsl_mult': 0.8874837096101539, 'sideways_time_stop': 257, 'sideways_use_sma': True, 'sideways_use_ema': False, 'sideways_use_atr': False, 'sideways_use_adx': False, 'sideways_use_spike': False, 'sideways_rsi_required': True}.
[I 2025-08-31 12:43:51,942] Trial 399 finished with values: [-1000000000.0, 1000000000.0] and parameters: {'p_sma': 54, 'p_std': 25, 'p_atr': 25, 'p_adx': 16, 'rsi_period': 47, 'ema1': 20, 'ema2': 16, 'slip_atr_k': 0.05362633525653995, 'slip_spread_k': 0.47612125317093257, 'spread_hl_frac': 0.018569105168170758, 'bb_std_mult': 2.307996993774614, 'rsi_os': 38, 'rsi_ob': 78, 'vol_spike': 0.024648455113416852, 'adx_thresh': 19.68727148616356, 'atr_min_pct': 0.0013380293555702895, 'atr_max_pct': 0.12423018465271651, 'tp_mult': 2.813581464095135, 'tsl_mult': 0.7193359886475468, 'strategy': 'breakout', 'time_stop': 181, 'use_sma': False, 'use_atr': True, 'use_adx': False, 'use_ema': True, 'use_spike': False, 'rsi_required': True, 'edge_k': 0.6265671115137765, 'edge_cap': 0.42588280305347725, 'bull_strategy': 'breakout', 'bull_bb_std_mult': 2.7444455604661133, 'bull_rsi_os': 6, 'bull_rsi_ob': 50, 'bull_adx_thresh': 17.22375372982623, 'bull_atr_min_pct': 0.019329201438930944, 'bull_atr_max_pct': 0.14989910253539035, 'bull_tp_mult': 1.2354573216443667, 'bull_tsl_mult': 0.15837563482366693, 'bull_time_stop': 285, 'bull_use_sma': True, 'bull_use_ema': True, 'bull_use_atr': False, 'bull_use_adx': True, 'bull_use_spike': False, 'bull_rsi_required': False, 'bear_strategy': 'breakout', 'bear_bb_std_mult': 3.227313972730511, 'bear_rsi_os': 30, 'bear_rsi_ob': 70, 'bear_adx_thresh': 12.02785205956126, 'bear_atr_min_pct': 0.002282554316818406, 'bear_atr_max_pct': 0.1262410641991567, 'bear_tp_mult': 2.9350358501474068, 'bear_tsl_mult': 0.7148650272666912, 'bear_time_stop': 194, 'bear_use_sma': True, 'bear_use_ema': True, 'bear_use_atr': True, 'bear_use_adx': True, 'bear_use_spike': True, 'bear_rsi_required': True, 'sideways_strategy': 'breakout', 'sideways_bb_std_mult': 2.6578306465101305, 'sideways_rsi_os': 30, 'sideways_rsi_ob': 66, 'sideways_adx_thresh': 25.07338998649685, 'sideways_atr_min_pct': 0.004974183878873449, 'sideways_atr_max_pct': 0.1329696448053036, 'sideways_tp_mult': 1.679808904409378, 'sideways_tsl_mult': 0.8885069041113064, 'sideways_time_stop': 54, 'sideways_use_sma': True, 'sideways_use_ema': False, 'sideways_use_atr': False, 'sideways_use_adx': False, 'sideways_use_spike': False, 'sideways_rsi_required': True}.
[I 2025-08-31 12:43:52,735] Trial 400 finished with values: [-1000000000.0, 1000000000.0] and parameters: {'p_sma': 17, 'p_std': 25, 'p_atr': 13, 'p_adx': 25, 'rsi_period': 52, 'ema1': 20, 'ema2': 16, 'slip_atr_k': 0.07086445700912501, 'slip_spread_k': 0.3936611047064802, 'spread_hl_frac': 0.015819545723064102, 'bb_std_mult': 2.2789246206182163, 'rsi_os': 38, 'rsi_ob': 78, 'vol_spike': 0.02597554478886277, 'adx_thresh': 20.236720815952978, 'atr_min_pct': 0.006759747844725468, 'atr_max_pct': 0.12456566567906376, 'tp_mult': 2.690849667899365, 'tsl_mult': 0.07821967417689238, 'strategy': 'breakout', 'time_stop': 182, 'use_sma': False, 'use_atr': True, 'use_adx': False, 'use_ema': True, 'use_spike': False, 'rsi_required': True, 'edge_k': 0.6357315669364427, 'edge_cap': 0.9122610248613083, 'bull_strategy': 'breakout', 'bull_bb_std_mult': 2.6470974856900598, 'bull_rsi_os': 7, 'bull_rsi_ob': 50, 'bull_adx_thresh': 15.264398813092125, 'bull_atr_min_pct': 0.019399712945049732, 'bull_atr_max_pct': 0.14795601184508198, 'bull_tp_mult': 1.2339625867415005, 'bull_tsl_mult': 0.1782701680415265, 'bull_time_stop': 285, 'bull_use_sma': True, 'bull_use_ema': True, 'bull_use_atr': False, 'bull_use_adx': True, 'bull_use_spike': False, 'bull_rsi_required': False, 'bear_strategy': 'breakout', 'bear_bb_std_mult': 3.2348880231473665, 'bear_rsi_os': 30, 'bear_rsi_ob': 70, 'bear_adx_thresh': 12.029521918355064, 'bear_atr_min_pct': 0.00200967450468975, 'bear_atr_max_pct': 0.14724453690326364, 'bear_tp_mult': 2.918983861221679, 'bear_tsl_mult': 0.8120823855005632, 'bear_time_stop': 210, 'bear_use_sma': True, 'bear_use_ema': True, 'bear_use_atr': True, 'bear_use_adx': True, 'bear_use_spike': True, 'bear_rsi_required': True, 'sideways_strategy': 'breakout', 'sideways_bb_std_mult': 2.46981135945662, 'sideways_rsi_os': 31, 'sideways_rsi_ob': 67, 'sideways_adx_thresh': 26.88101924384349, 'sideways_atr_min_pct': 0.0035880465364678403, 'sideways_atr_max_pct': 0.12786246998331652, 'sideways_tp_mult': 1.7084267172325809, 'sideways_tsl_mult': 0.8283156099353555, 'sideways_time_stop': 285, 'sideways_use_sma': True, 'sideways_use_ema': False, 'sideways_use_atr': False, 'sideways_use_adx': False, 'sideways_use_spike': False, 'sideways_rsi_required': True}.
[I 2025-08-31 12:43:53,222] Trial 401 finished with values: [-0.013517669932173515, 0.013935431875820853] and parameters: {'p_sma': 54, 'p_std': 23, 'p_atr': 13, 'p_adx': 15, 'rsi_period': 52, 'ema1': 20, 'ema2': 16, 'slip_atr_k': 0.06187546722063275, 'slip_spread_k': 0.46579767016039875, 'spread_hl_frac': 0.015279951478916096, 'bb_std_mult': 2.2838722045109665, 'rsi_os': 38, 'rsi_ob': 78, 'vol_spike': 0.025631589089224423, 'adx_thresh': 20.07704480072417, 'atr_min_pct': 0.0012821338586356398, 'atr_max_pct': 0.12480250754574294, 'tp_mult': 2.8177072111311694, 'tsl_mult': 0.0006618338699062483, 'strategy': 'breakout', 'time_stop': 181, 'use_sma': False, 'use_atr': True, 'use_adx': False, 'use_ema': True, 'use_spike': False, 'rsi_required': True, 'edge_k': 0.6612572655955863, 'edge_cap': 0.6408981370268145, 'bull_strategy': 'breakout', 'bull_bb_std_mult': 2.6497151430344594, 'bull_rsi_os': 7, 'bull_rsi_ob': 49, 'bull_adx_thresh': 19.861930123379544, 'bull_atr_min_pct': 0.018958783627929188, 'bull_atr_max_pct': 0.1479475021614105, 'bull_tp_mult': 1.227440569612953, 'bull_tsl_mult': 0.1715109640887182, 'bull_time_stop': 287, 'bull_use_sma': True, 'bull_use_ema': True, 'bull_use_atr': False, 'bull_use_adx': True, 'bull_use_spike': False, 'bull_rsi_required': False, 'bear_strategy': 'breakout', 'bear_bb_std_mult': 3.2169273302093426, 'bear_rsi_os': 30, 'bear_rsi_ob': 70, 'bear_adx_thresh': 12.765772509297486, 'bear_atr_min_pct': 0.0021778791725949286, 'bear_atr_max_pct': 0.11581803828781735, 'bear_tp_mult': 2.9253000199988453, 'bear_tsl_mult': 0.7705990771576259, 'bear_time_stop': 209, 'bear_use_sma': True, 'bear_use_ema': True, 'bear_use_atr': True, 'bear_use_adx': True, 'bear_use_spike': True, 'bear_rsi_required': True, 'sideways_strategy': 'breakout', 'sideways_bb_std_mult': 2.97201008524602, 'sideways_rsi_os': 31, 'sideways_rsi_ob': 67, 'sideways_adx_thresh': 26.929536270420346, 'sideways_atr_min_pct': 0.0034340214865782297, 'sideways_atr_max_pct': 0.12979260886878385, 'sideways_tp_mult': 1.704831233014915, 'sideways_tsl_mult': 0.8243363529435571, 'sideways_time_stop': 57, 'sideways_use_sma': True, 'sideways_use_ema': False, 'sideways_use_atr': False, 'sideways_use_adx': False, 'sideways_use_spike': False, 'sideways_rsi_required': True}.
[I 2025-08-31 12:43:53,497] Trial 402 finished with values: [-1000000000.0, 1000000000.0] and parameters: {'p_sma': 54, 'p_std': 25, 'p_atr': 29, 'p_adx': 14, 'rsi_period': 54, 'ema1': 20, 'ema2': 16, 'slip_atr_k': 0.07219989307853279, 'slip_spread_k': 0.3998469661389018, 'spread_hl_frac': 0.01598131444117381, 'bb_std_mult': 2.2776238646113414, 'rsi_os': 38, 'rsi_ob': 78, 'vol_spike': 0.02700669310866733, 'adx_thresh': 20.257478676308104, 'atr_min_pct': 0.0015080195625004754, 'atr_max_pct': 0.12509210776499263, 'tp_mult': 2.8398599169810748, 'tsl_mult': 0.7201647933278983, 'strategy': 'breakout', 'time_stop': 175, 'use_sma': False, 'use_atr': True, 'use_adx': False, 'use_ema': True, 'use_spike': False, 'rsi_required': True, 'edge_k': 0.6539191682182077, 'edge_cap': 0.9068410998012062, 'bull_strategy': 'breakout', 'bull_bb_std_mult': 2.6304901055992786, 'bull_rsi_os': 6, 'bull_rsi_ob': 49, 'bull_adx_thresh': 12.701628864743196, 'bull_atr_min_pct': 0.019524176203544148, 'bull_atr_max_pct': 0.14680123826874714, 'bull_tp_mult': 1.3360156125442528, 'bull_tsl_mult': 0.18355035381180035, 'bull_time_stop': 299, 'bull_use_sma': True, 'bull_use_ema': True, 'bull_use_atr': False, 'bull_use_adx': True, 'bull_use_spike': False, 'bull_rsi_required': False, 'bear_strategy': 'breakout', 'bear_bb_std_mult': 3.217448557514615, 'bear_rsi_os': 29, 'bear_rsi_ob': 66, 'bear_adx_thresh': 12.384696895744273, 'bear_atr_min_pct': 0.002346025347434985, 'bear_atr_max_pct': 0.11606186082923889, 'bear_tp_mult': 2.9039619551601765, 'bear_tsl_mult': 0.7158246031907157, 'bear_time_stop': 193, 'bear_use_sma': True, 'bear_use_ema': True, 'bear_use_atr': True, 'bear_use_adx': True, 'bear_use_spike': True, 'bear_rsi_required': True, 'sideways_strategy': 'breakout', 'sideways_bb_std_mult': 3.1682173415652373, 'sideways_rsi_os': 30, 'sideways_rsi_ob': 68, 'sideways_adx_thresh': 26.026622951686612, 'sideways_atr_min_pct': 0.0028935576392431325, 'sideways_atr_max_pct': 0.12756157882282682, 'sideways_tp_mult': 1.6969598919550475, 'sideways_tsl_mult': 0.8278134725182478, 'sideways_time_stop': 68, 'sideways_use_sma': True, 'sideways_use_ema': False, 'sideways_use_atr': False, 'sideways_use_adx': False, 'sideways_use_spike': False, 'sideways_rsi_required': True}.
[I 2025-08-31 12:44:25,629] Trial 404 finished with values: [-1000000000.0, 1000000000.0] and parameters: {'p_sma': 54, 'p_std': 22, 'p_atr': 26, 'p_adx': 15, 'rsi_period': 49, 'ema1': 21, 'ema2': 13, 'slip_atr_k': 0.05912634600734875, 'slip_spread_k': 0.2821104683867453, 'spread_hl_frac': 0.019613097438717413, 'bb_std_mult': 2.412142325358739, 'rsi_os': 37, 'rsi_ob': 79, 'vol_spike': 0.01928189718823305, 'adx_thresh': 20.136498022329253, 'atr_min_pct': 0.001701052776243894, 'atr_max_pct': 0.12590240612571263, 'tp_mult': 2.764070473135928, 'tsl_mult': 0.10286843094694986, 'strategy': 'breakout', 'time_stop': 167, 'use_sma': False, 'use_atr': True, 'use_adx': False, 'use_ema': True, 'use_spike': False, 'rsi_required': True, 'edge_k': 0.6648944891025906, 'edge_cap': 0.9993462007602238, 'bull_strategy': 'breakout', 'bull_bb_std_mult': 2.6867069271657145, 'bull_rsi_os': 6, 'bull_rsi_ob': 49, 'bull_adx_thresh': 20.52925084807598, 'bull_atr_min_pct': 0.0187984392505788, 'bull_atr_max_pct': 0.14536050477643941, 'bull_tp_mult': 1.3522290970284725, 'bull_tsl_mult': 0.19178581961746138, 'bull_time_stop': 300, 'bull_use_sma': True, 'bull_use_ema': True, 'bull_use_atr': False, 'bull_use_adx': False, 'bull_use_spike': False, 'bull_rsi_required': False, 'bear_strategy': 'breakout', 'bear_bb_std_mult': 3.008972696407289, 'bear_rsi_os': 28, 'bear_rsi_ob': 66, 'bear_adx_thresh': 12.947840404624548, 'bear_atr_min_pct': 0.0014166197103635224, 'bear_atr_max_pct': 0.11728879650450852, 'bear_tp_mult': 2.922312753196273, 'bear_tsl_mult': 0.7743129066435561, 'bear_time_stop': 204, 'bear_use_sma': True, 'bear_use_ema': True, 'bear_use_atr': True, 'bear_use_adx': True, 'bear_use_spike': True, 'bear_rsi_required': True, 'sideways_strategy': 'mean_reversion', 'sideways_bb_std_mult': 3.178398396076036, 'sideways_rsi_os': 29, 'sideways_rsi_ob': 69, 'sideways_adx_thresh': 26.04418288674869, 'sideways_atr_min_pct': 0.002965407331673428, 'sideways_atr_max_pct': 0.12687821650071474, 'sideways_tp_mult': 1.6130060724957864, 'sideways_tsl_mult': 0.8595166954486939, 'sideways_time_stop': 70, 'sideways_use_sma': True, 'sideways_use_ema': False, 'sideways_use_atr': False, 'sideways_use_adx': False, 'sideways_use_spike': False, 'sideways_rsi_required': True}.
[I 2025-08-31 12:44:26,405] Trial 405 finished with values: [-1000000000.0, 1000000000.0] and parameters: {'p_sma': 12, 'p_std': 23, 'p_atr': 26, 'p_adx': 13, 'rsi_period': 51, 'ema1': 21, 'ema2': 13, 'slip_atr_k': 0.06074521612547769, 'slip_spread_k': 0.2749005273667462, 'spread_hl_frac': 0.01695080549163143, 'bb_std_mult': 2.3958006873698654, 'rsi_os': 38, 'rsi_ob': 79, 'vol_spike': 0.01959462303999583, 'adx_thresh': 20.238807969886157, 'atr_min_pct': 0.0016765553085889362, 'atr_max_pct': 0.1260589332309675, 'tp_mult': 2.7764234387191364, 'tsl_mult': 0.01665078491222149, 'strategy': 'breakout', 'time_stop': 168, 'use_sma': False, 'use_atr': True, 'use_adx': False, 'use_ema': True, 'use_spike': False, 'rsi_required': True, 'edge_k': 0.6636039556382896, 'edge_cap': 0.6480438641588534, 'bull_strategy': 'breakout', 'bull_bb_std_mult': 2.701822622908724, 'bull_rsi_os': 6, 'bull_rsi_ob': 49, 'bull_adx_thresh': 13.028548998262618, 'bull_atr_min_pct': 0.018714969072590647, 'bull_atr_max_pct': 0.1449369460663553, 'bull_tp_mult': 1.3369555598078142, 'bull_tsl_mult': 0.19153695519965563, 'bull_time_stop': 299, 'bull_use_sma': True, 'bull_use_ema': True, 'bull_use_atr': False, 'bull_use_adx': False, 'bull_use_spike': False, 'bull_rsi_required': False, 'bear_strategy': 'breakout', 'bear_bb_std_mult': 3.0008244218194666, 'bear_rsi_os': 28, 'bear_rsi_ob': 69, 'bear_adx_thresh': 12.913330540669683, 'bear_atr_min_pct': 0.0013757353830057095, 'bear_atr_max_pct': 0.13033328946915518, 'bear_tp_mult': 2.923543294783027, 'bear_tsl_mult': 0.7674472222479614, 'bear_time_stop': 202, 'bear_use_sma': True, 'bear_use_ema': True, 'bear_use_atr': True, 'bear_use_adx': True, 'bear_use_spike': True, 'bear_rsi_required': True, 'sideways_strategy': 'mean_reversion', 'sideways_bb_std_mult': 2.757961757573084, 'sideways_rsi_os': 28, 'sideways_rsi_ob': 67, 'sideways_adx_thresh': 26.165449112056724, 'sideways_atr_min_pct': 0.0025014683204771866, 'sideways_atr_max_pct': 0.12677048445000583, 'sideways_tp_mult': 1.6185072551492776, 'sideways_tsl_mult': 0.8560825453162216, 'sideways_time_stop': 204, 'sideways_use_sma': True, 'sideways_use_ema': False, 'sideways_use_atr': False, 'sideways_use_adx': False, 'sideways_use_spike': False, 'sideways_rsi_required': True}.
