[I 2025-08-31 11:59:38,065] Trial 45 finished with values: [-1000000000.0, 1000000000.0] and parameters: {'p_sma': 49, 'p_std': 12, 'p_atr': 22, 'p_adx': 10, 'rsi_period': 56, 'ema1': 11, 'ema2': 22, 'slip_atr_k': 0.028987981218816766, 'slip_spread_k': 0.3688975915644932, 'spread_hl_frac': 0.04672363625370608, 'bb_std_mult': 2.5470964067060082, 'rsi_os': 32, 'rsi_ob': 56, 'vol_spike': 0.2099801341920237, 'adx_thresh': 29.152585094711135, 'atr_min_pct': 0.01705644057261647, 'atr_max_pct': 0.09754726612137554, 'tp_mult': 2.350036667151236, 'tsl_mult': 0.5380227844584606, 'strategy': 'mean_reversion', 'time_stop': 298, 'use_sma': False, 'use_atr': False, 'use_adx': True, 'use_ema': True, 'use_spike': True, 'rsi_required': False, 'edge_k': 1.4035767593678037, 'edge_cap': 0.13050882566918715, 'bull_strategy': 'breakout', 'bull_bb_std_mult': 1.1557097452609737, 'bull_rsi_os': 43, 'bull_rsi_ob': 49, 'bull_adx_thresh': 29.551846178274108, 'bull_atr_min_pct': 0.02441794853659139, 'bull_atr_max_pct': 0.03964920620771838, 'bull_tp_mult': 1.8214627265112526, 'bull_tsl_mult': 0.7918740265398992, 'bull_time_stop': 273, 'bull_use_sma': True, 'bull_use_ema': True, 'bull_use_atr': True, 'bull_use_adx': False, 'bull_use_spike': True, 'bull_rsi_required': True, 'bear_strategy': 'breakout', 'bear_bb_std_mult': 2.315851875733565, 'bear_rsi_os': 24, 'bear_rsi_ob': 67, 'bear_adx_thresh': 11.145376512966035, 'bear_atr_min_pct': 0.01678259888320298, 'bear_atr_max_pct': 0.049885107139922974, 'bear_tp_mult': 1.4561567463316214, 'bear_tsl_mult': 0.7040183709079593, 'bear_time_stop': 224, 'bear_use_sma': True, 'bear_use_ema': True, 'bear_use_atr': True, 'bear_use_adx': True, 'bear_use_spike': True, 'bear_rsi_required': True, 'sideways_strategy': 'breakout', 'sideways_bb_std_mult': 2.9386054446488536, 'sideways_rsi_os': 40, 'sideways_rsi_ob': 54, 'sideways_adx_thresh': 20.565602260619254, 'sideways_atr_min_pct': 0.00520683832959602, 'sideways_atr_max_pct': 0.10748193931415075, 'sideways_tp_mult': 2.1332168045967803, 'sideways_tsl_mult': 0.8724042657429621, 'sideways_time_stop': 290, 'sideways_use_sma': True, 'sideways_use_ema': False, 'sideways_use_atr': False, 'sideways_use_adx': False, 'sideways_use_spike': True, 'sideways_rsi_required': False}.
[I 2025-08-31 11:59:38,279] Trial 46 finished with values: [-1000000000.0, 1000000000.0] and parameters: {'p_sma': 51, 'p_std': 11, 'p_atr': 22, 'p_adx': 10, 'rsi_period': 58, 'ema1': 11, 'ema2': 21, 'slip_atr_k': 0.13846994063962187, 'slip_spread_k': 0.35541500730767706, 'spread_hl_frac': 0.0030750664526646007, 'bb_std_mult': 2.6048333971836923, 'rsi_os': 45, 'rsi_ob': 64, 'vol_spike': 0.0852028652635634, 'adx_thresh': 29.408080553774266, 'atr_min_pct': 0.017111575315405463, 'atr_max_pct': 0.02295656753690658, 'tp_mult': 2.422336218344655, 'tsl_mult': 0.5085309433296121, 'strategy': 'mean_reversion', 'time_stop': 296, 'use_sma': False, 'use_atr': False, 'use_adx': True, 'use_ema': True, 'use_spike': True, 'rsi_required': False, 'edge_k': 1.2424695202031342, 'edge_cap': 0.30176174679516854, 'bull_strategy': 'breakout', 'bull_bb_std_mult': 0.7315816518112973, 'bull_rsi_os': 50, 'bull_rsi_ob': 71, 'bull_adx_thresh': 34.5471147181808, 'bull_atr_min_pct': 0.024088549721823293, 'bull_atr_max_pct': 0.07005528015454414, 'bull_tp_mult': 1.8152774277748072, 'bull_tsl_mult': 0.8410762917861393, 'bull_time_stop': 274, 'bull_use_sma': True, 'bull_use_ema': True, 'bull_use_atr': True, 'bull_use_adx': True, 'bull_use_spike': True, 'bull_rsi_required': True, 'bear_strategy': 'breakout', 'bear_bb_std_mult': 2.251336279463953, 'bear_rsi_os': 38, 'bear_rsi_ob': 80, 'bear_adx_thresh': 32.857827377609865, 'bear_atr_min_pct': 0.017175752212664673, 'bear_atr_max_pct': 0.09353988871941733, 'bear_tp_mult': 1.0102742102318363, 'bear_tsl_mult': 0.7238992965603538, 'bear_time_stop': 230, 'bear_use_sma': True, 'bear_use_ema': False, 'bear_use_atr': True, 'bear_use_adx': True, 'bear_use_spike': False, 'bear_rsi_required': True, 'sideways_strategy': 'breakout', 'sideways_bb_std_mult': 2.600213475682047, 'sideways_rsi_os': 48, 'sideways_rsi_ob': 80, 'sideways_adx_thresh': 23.996637092151126, 'sideways_atr_min_pct': 0.010671906241860664, 'sideways_atr_max_pct': 0.08630122512775891, 'sideways_tp_mult': 1.596089065140299, 'sideways_tsl_mult': 0.81216052615949, 'sideways_time_stop': 146, 'sideways_use_sma': True, 'sideways_use_ema': False, 'sideways_use_atr': False, 'sideways_use_adx': True, 'sideways_use_spike': True, 'sideways_rsi_required': False}.
[I 2025-08-31 12:00:07,224] Trial 50 finished with values: [-1000000000.0, 1000000000.0] and parameters: {'p_sma': 54, 'p_std': 16, 'p_atr': 12, 'p_adx': 8, 'rsi_period': 20, 'ema1': 13, 'ema2': 39, 'slip_atr_k': 0.04766215514864071, 'slip_spread_k': 0.8951750202325364, 'spread_hl_frac': 0.028559196472544516, 'bb_std_mult': 1.6165912048492361, 'rsi_os': 20, 'rsi_ob': 85, 'vol_spike': 0.1132056958429294, 'adx_thresh': 20.03212845351206, 'atr_min_pct': 0.00446197919163943, 'atr_max_pct': 0.042928890126216465, 'tp_mult': 1.5254461211622408, 'tsl_mult': 0.45345748047658396, 'strategy': 'breakout', 'time_stop': 166, 'use_sma': False, 'use_atr': False, 'use_adx': True, 'use_ema': True, 'use_spike': True, 'rsi_required': False, 'edge_k': 1.1619859260459282, 'edge_cap': 0.8411591617580247, 'bull_strategy': 'breakout', 'bull_bb_std_mult': 2.1858297987445328, 'bull_rsi_os': 16, 'bull_rsi_ob': 75, 'bull_adx_thresh': 9.959108082182386, 'bull_atr_min_pct': 0.017694680705033394, 'bull_atr_max_pct': 0.12030493179930675, 'bull_tp_mult': 2.0627535410374733, 'bull_tsl_mult': 0.6721816425305656, 'bull_time_stop': 238, 'bull_use_sma': False, 'bull_use_ema': True, 'bull_use_atr': True, 'bull_use_adx': True, 'bull_use_spike': True, 'bull_rsi_required': True, 'bear_strategy': 'breakout', 'bear_bb_std_mult': 2.4663195020190893, 'bear_rsi_os': 15, 'bear_rsi_ob': 84, 'bear_adx_thresh': 25.454819197954684, 'bear_atr_min_pct': 0.0024218701655216914, 'bear_atr_max_pct': 0.09592246635250115, 'bear_tp_mult': 2.3150029294889403, 'bear_tsl_mult': 0.5395705716501935, 'bear_time_stop': 136, 'bear_use_sma': True, 'bear_use_ema': False, 'bear_use_atr': True, 'bear_use_adx': True, 'bear_use_spike': False, 'bear_rsi_required': True, 'sideways_strategy': 'breakout', 'sideways_bb_std_mult': 3.5522779435380842, 'sideways_rsi_os': 51, 'sideways_rsi_ob': 86, 'sideways_adx_thresh': 31.690428283363165, 'sideways_atr_min_pct': 0.008802768800045617, 'sideways_atr_max_pct': 0.09568853041255414, 'sideways_tp_mult': 2.3184555246645226, 'sideways_tsl_mult': 0.33236004652952733, 'sideways_time_stop': 252, 'sideways_use_sma': True, 'sideways_use_ema': False, 'sideways_use_atr': True, 'sideways_use_adx': True, 'sideways_use_spike': True, 'sideways_rsi_required': False}.
[I 2025-08-31 12:00:07,672] Trial 49 finished with values: [-0.08111528285734548, 0.08095951337889208] and parameters: {'p_sma': 53, 'p_std': 18, 'p_atr': 12, 'p_adx': 8, 'rsi_period': 17, 'ema1': 13, 'ema2': 10, 'slip_atr_k': 0.13812412174575697, 'slip_spread_k': 0.8814130076755013, 'spread_hl_frac': 0.003931674268096224, 'bb_std_mult': 1.681448819692235, 'rsi_os': 45, 'rsi_ob': 61, 'vol_spike': 0.08258597953812812, 'adx_thresh': 22.260509483628184, 'atr_min_pct': 0.013547635237750459, 'atr_max_pct': 0.023019887853478596, 'tp_mult': 1.5272352369448492, 'tsl_mult': 0.452468334795203, 'strategy': 'breakout', 'time_stop': 162, 'use_sma': False, 'use_atr': False, 'use_adx': True, 'use_ema': True, 'use_spike': True, 'rsi_required': False, 'edge_k': 1.2506832777123045, 'edge_cap': 0.3274698634116004, 'bull_strategy': 'breakout', 'bull_bb_std_mult': 2.061276094176889, 'bull_rsi_os': 16, 'bull_rsi_ob': 71, 'bull_adx_thresh': 20.444004234285302, 'bull_atr_min_pct': 0.017683017623799004, 'bull_atr_max_pct': 0.14691526486109052, 'bull_tp_mult': 1.5131001645448787, 'bull_tsl_mult': 0.8591438841963752, 'bull_time_stop': 200, 'bull_use_sma': True, 'bull_use_ema': True, 'bull_use_atr': True, 'bull_use_adx': True, 'bull_use_spike': True, 'bull_rsi_required': True, 'bear_strategy': 'breakout', 'bear_bb_std_mult': 2.122908677930656, 'bear_rsi_os': 39, 'bear_rsi_ob': 80, 'bear_adx_thresh': 25.288041674832503, 'bear_atr_min_pct': 0.017934696847704622, 'bear_atr_max_pct': 0.09361076377243434, 'bear_tp_mult': 2.3290086831424595, 'bear_tsl_mult': 0.5084929107804755, 'bear_time_stop': 185, 'bear_use_sma': True, 'bear_use_ema': False, 'bear_use_atr': True, 'bear_use_adx': True, 'bear_use_spike': False, 'bear_rsi_required': True, 'sideways_strategy': 'breakout', 'sideways_bb_std_mult': 3.476909231063664, 'sideways_rsi_os': 47, 'sideways_rsi_ob': 86, 'sideways_adx_thresh': 31.13941573851839, 'sideways_atr_min_pct': 0.0024078388924495104, 'sideways_atr_max_pct': 0.14897029271096485, 'sideways_tp_mult': 1.5982528544733619, 'sideways_tsl_mult': 0.37402501306619684, 'sideways_time_stop': 247, 'sideways_use_sma': True, 'sideways_use_ema': False, 'sideways_use_atr': True, 'sideways_use_adx': True, 'sideways_use_spike': True, 'sideways_rsi_required': False}.
[I 2025-08-31 12:00:07,771] Trial 48 finished with values: [-0.062284962866591354, 0.06211258973022478] and parameters: {'p_sma': 49, 'p_std': 17, 'p_atr': 12, 'p_adx': 10, 'rsi_period': 46, 'ema1': 11, 'ema2': 41, 'slip_atr_k': 0.1326395884795332, 'slip_spread_k': 0.879322561035769, 'spread_hl_frac': 0.0031360562278726772, 'bb_std_mult': 2.6354824584977385, 'rsi_os': 46, 'rsi_ob': 95, 'vol_spike': 0.27154682411748665, 'adx_thresh': 22.13514642756609, 'atr_min_pct': 0.012347666089593843, 'atr_max_pct': 0.04346978554463818, 'tp_mult': 2.1776748563739123, 'tsl_mult': 0.45230598873024647, 'strategy': 'breakout', 'time_stop': 157, 'use_sma': False, 'use_atr': False, 'use_adx': True, 'use_ema': True, 'use_spike': True, 'rsi_required': False, 'edge_k': 1.2325887391864976, 'edge_cap': 0.05139018421326358, 'bull_strategy': 'breakout', 'bull_bb_std_mult': 2.2272654163897796, 'bull_rsi_os': 50, 'bull_rsi_ob': 71, 'bull_adx_thresh': 10.462750192340023, 'bull_atr_min_pct': 0.02429155628354526, 'bull_atr_max_pct': 0.07235348822199317, 'bull_tp_mult': 1.84248048959937, 'bull_tsl_mult': 0.87490980212319, 'bull_time_stop': 201, 'bull_use_sma': True, 'bull_use_ema': True, 'bull_use_atr': True, 'bull_use_adx': True, 'bull_use_spike': True, 'bull_rsi_required': True, 'bear_strategy': 'breakout', 'bear_bb_std_mult': 2.240939489742094, 'bear_rsi_os': 38, 'bear_rsi_ob': 79, 'bear_adx_thresh': 25.43110679511439, 'bear_atr_min_pct': 0.01768675095447447, 'bear_atr_max_pct': 0.03772559656148965, 'bear_tp_mult': 1.4596855823333676, 'bear_tsl_mult': 0.5151291199128247, 'bear_time_stop': 231, 'bear_use_sma': True, 'bear_use_ema': False, 'bear_use_atr': True, 'bear_use_adx': True, 'bear_use_spike': False, 'bear_rsi_required': True, 'sideways_strategy': 'breakout', 'sideways_bb_std_mult': 1.8355987013598165, 'sideways_rsi_os': 48, 'sideways_rsi_ob': 82, 'sideways_adx_thresh': 31.596268531659312, 'sideways_atr_min_pct': 0.0028567275587455584, 'sideways_atr_max_pct': 0.09570639139556658, 'sideways_tp_mult': 2.1978881175953715, 'sideways_tsl_mult': 0.3953322948150456, 'sideways_time_stop': 155, 'sideways_use_sma': True, 'sideways_use_ema': False, 'sideways_use_atr': False, 'sideways_use_adx': True, 'sideways_use_spike': True, 'sideways_rsi_required': False}.
[I 2025-08-31 12:00:07,869] Trial 47 finished with values: [-0.05853897709323397, 0.05832422895267514] and parameters: {'p_sma': 49, 'p_std': 17, 'p_atr': 22, 'p_adx': 10, 'rsi_period': 20, 'ema1': 12, 'ema2': 10, 'slip_atr_k': 0.1385849029411667, 'slip_spread_k': 0.876287362449514, 'spread_hl_frac': 0.0029490183118700535, 'bb_std_mult': 2.612082014341747, 'rsi_os': 45, 'rsi_ob': 63, 'vol_spike': 0.046111781033430846, 'adx_thresh': 29.943468842531313, 'atr_min_pct': 0.005396414231261592, 'atr_max_pct': 0.09619621105462202, 'tp_mult': 2.4678795461443515, 'tsl_mult': 0.08632617894950499, 'strategy': 'mean_reversion', 'time_stop': 190, 'use_sma': False, 'use_atr': False, 'use_adx': True, 'use_ema': True, 'use_spike': True, 'rsi_required': False, 'edge_k': 1.16082546216755, 'edge_cap': 0.33813343599686985, 'bull_strategy': 'breakout', 'bull_bb_std_mult': 0.7323584013731724, 'bull_rsi_os': 17, 'bull_rsi_ob': 71, 'bull_adx_thresh': 21.379875615477626, 'bull_atr_min_pct': 0.023588222432704618, 'bull_atr_max_pct': 0.06958887985558934, 'bull_tp_mult': 1.8336393676163203, 'bull_tsl_mult': 0.8911607600835796, 'bull_time_stop': 202, 'bull_use_sma': True, 'bull_use_ema': True, 'bull_use_atr': True, 'bull_use_adx': True, 'bull_use_spike': True, 'bull_rsi_required': True, 'bear_strategy': 'breakout', 'bear_bb_std_mult': 2.265890382519266, 'bear_rsi_os': 38, 'bear_rsi_ob': 81, 'bear_adx_thresh': 18.10849184426871, 'bear_atr_min_pct': 0.018049282080114998, 'bear_atr_max_pct': 0.10923903316720018, 'bear_tp_mult': 1.4607119796449468, 'bear_tsl_mult': 0.7098574425566035, 'bear_time_stop': 227, 'bear_use_sma': True, 'bear_use_ema': False, 'bear_use_atr': True, 'bear_use_adx': True, 'bear_use_spike': False, 'bear_rsi_required': True, 'sideways_strategy': 'breakout', 'sideways_bb_std_mult': 2.571236118732795, 'sideways_rsi_os': 47, 'sideways_rsi_ob': 81, 'sideways_adx_thresh': 24.000113171319832, 'sideways_atr_min_pct': 0.002629780703081129, 'sideways_atr_max_pct': 0.14766985637738755, 'sideways_tp_mult': 2.1647989705566055, 'sideways_tsl_mult': 0.8564248184076528, 'sideways_time_stop': 293, 'sideways_use_sma': True, 'sideways_use_ema': False, 'sideways_use_atr': False, 'sideways_use_adx': True, 'sideways_use_spike': True, 'sideways_rsi_required': False}.
[I 2025-08-31 12:00:08,140] Trial 53 finished with values: [-1000000000.0, 1000000000.0] and parameters: {'p_sma': 58, 'p_std': 52, 'p_atr': 30, 'p_adx': 28, 'rsi_period': 48, 'ema1': 7, 'ema2': 44, 'slip_atr_k': 0.22197057871807913, 'slip_spread_k': 0.9835250529294788, 'spread_hl_frac': 0.01354751857376831, 'bb_std_mult': 3.032177976100754, 'rsi_os': 8, 'rsi_ob': 48, 'vol_spike': 0.057935037094414346, 'adx_thresh': 26.6386165713323, 'atr_min_pct': 0.020841553110840502, 'atr_max_pct': 0.06418974738185247, 'tp_mult': 1.8140343326580435, 'tsl_mult': 0.7417591524393975, 'strategy': 'mean_reversion', 'time_stop': 183, 'use_sma': True, 'use_atr': False, 'use_adx': True, 'use_ema': False, 'use_spike': True, 'rsi_required': True, 'edge_k': 0.29422277261052676, 'edge_cap': 0.6171619849204778, 'bull_strategy': 'mean_reversion', 'bull_bb_std_mult': 1.8077826979124807, 'bull_rsi_os': 11, 'bull_rsi_ob': 68, 'bull_adx_thresh': 31.742389708459307, 'bull_atr_min_pct': 0.026596436266227826, 'bull_atr_max_pct': 0.09202477364009784, 'bull_tp_mult': 1.587053945125989, 'bull_tsl_mult': 0.6058551011934427, 'bull_time_stop': 167, 'bull_use_sma': False, 'bull_use_ema': False, 'bull_use_atr': False, 'bull_use_adx': False, 'bull_use_spike': True, 'bull_rsi_required': True, 'bear_strategy': 'breakout', 'bear_bb_std_mult': 1.522303528801276, 'bear_rsi_os': 9, 'bear_rsi_ob': 76, 'bear_adx_thresh': 17.721118240109856, 'bear_atr_min_pct': 0.01237980936940268, 'bear_atr_max_pct': 0.1087139434352749, 'bear_tp_mult': 1.7598477122562675, 'bear_tsl_mult': 0.09585265571976076, 'bear_time_stop': 142, 'bear_use_sma': True, 'bear_use_ema': True, 'bear_use_atr': False, 'bear_use_adx': False, 'bear_use_spike': True, 'bear_rsi_required': True, 'sideways_strategy': 'breakout', 'sideways_bb_std_mult': 2.040543572533333, 'sideways_rsi_os': 52, 'sideways_rsi_ob': 82, 'sideways_adx_thresh': 23.031747198341115, 'sideways_atr_min_pct': 0.013360677644205166, 'sideways_atr_max_pct': 0.07607831946489539, 'sideways_tp_mult': 1.7988048763518205, 'sideways_tsl_mult': 0.6580041655517957, 'sideways_time_stop': 230, 'sideways_use_sma': False, 'sideways_use_ema': True, 'sideways_use_atr': False, 'sideways_use_adx': True, 'sideways_use_spike': True, 'sideways_rsi_required': False}.
[I 2025-08-31 12:00:37,115] Trial 51 finished with values: [-0.031646999908480744, 0.03178649436579574] and parameters: {'p_sma': 48, 'p_std': 49, 'p_atr': 28, 'p_adx': 29, 'rsi_period': 45, 'ema1': 14, 'ema2': 10, 'slip_atr_k': 0.0781116093297678, 'slip_spread_k': 0.7817950651566521, 'spread_hl_frac': 0.013460194115129167, 'bb_std_mult': 2.0012741604975433, 'rsi_os': 44, 'rsi_ob': 61, 'vol_spike': 0.05698363205837077, 'adx_thresh': 23.199035842172623, 'atr_min_pct': 0.012752140919288056, 'atr_max_pct': 0.11613414119003149, 'tp_mult': 1.778952801781727, 'tsl_mult': 0.06258379423758043, 'strategy': 'breakout', 'time_stop': 157, 'use_sma': True, 'use_atr': False, 'use_adx': True, 'use_ema': True, 'use_spike': True, 'rsi_required': True, 'edge_k': 0.018410573383174533, 'edge_cap': 0.6174420325890365, 'bull_strategy': 'mean_reversion', 'bull_bb_std_mult': 1.826857082678123, 'bull_rsi_os': 22, 'bull_rsi_ob': 73, 'bull_adx_thresh': 31.484062781491218, 'bull_atr_min_pct': 0.026598357831435535, 'bull_atr_max_pct': 0.07458633355914634, 'bull_tp_mult': 1.5538623822894602, 'bull_tsl_mult': 0.5916713382340965, 'bull_time_stop': 200, 'bull_use_sma': True, 'bull_use_ema': False, 'bull_use_atr': False, 'bull_use_adx': True, 'bull_use_spike': True, 'bull_rsi_required': True, 'bear_strategy': 'breakout', 'bear_bb_std_mult': 3.308979173727913, 'bear_rsi_os': 10, 'bear_rsi_ob': 77, 'bear_adx_thresh': 16.420306109840446, 'bear_atr_min_pct': 0.012511748701110761, 'bear_atr_max_pct': 0.10729960650312222, 'bear_tp_mult': 2.5193569438451933, 'bear_tsl_mult': 0.11762205936909209, 'bear_time_stop': 137, 'bear_use_sma': True, 'bear_use_ema': False, 'bear_use_atr': False, 'bear_use_adx': True, 'bear_use_spike': False, 'bear_rsi_required': True, 'sideways_strategy': 'breakout', 'sideways_bb_std_mult': 1.888196650197954, 'sideways_rsi_os': 47, 'sideways_rsi_ob': 82, 'sideways_adx_thresh': 19.201141024400165, 'sideways_atr_min_pct': 0.0024302880808435815, 'sideways_atr_max_pct': 0.02154176905301213, 'sideways_tp_mult': 1.7933432543974832, 'sideways_tsl_mult': 0.38927823490825797, 'sideways_time_stop': 172, 'sideways_use_sma': True, 'sideways_use_ema': False, 'sideways_use_atr': False, 'sideways_use_adx': True, 'sideways_use_spike': True, 'sideways_rsi_required': False}.
[I 2025-08-31 12:00:38,248] Trial 54 finished with values: [-1000000000.0, 1000000000.0] and parameters: {'p_sma': 58, 'p_std': 53, 'p_atr': 8, 'p_adx': 28, 'rsi_period': 58, 'ema1': 13, 'ema2': 44, 'slip_atr_k': 0.22657148175468056, 'slip_spread_k': 0.789034690491357, 'spread_hl_frac': 0.011759744050286229, 'bb_std_mult': 3.013387348765759, 'rsi_os': 10, 'rsi_ob': 55, 'vol_spike': 0.12190094082826818, 'adx_thresh': 26.43960033849038, 'atr_min_pct': 0.020321596772398653, 'atr_max_pct': 0.11325147894301513, 'tp_mult': 1.184295116651821, 'tsl_mult': 0.7764816248792159, 'strategy': 'mean_reversion', 'time_stop': 266, 'use_sma': True, 'use_atr': False, 'use_adx': True, 'use_ema': False, 'use_spike': True, 'rsi_required': True, 'edge_k': 0.31504478959961646, 'edge_cap': 0.4025817879403809, 'bull_strategy': 'mean_reversion', 'bull_bb_std_mult': 1.8217715139308417, 'bull_rsi_os': 22, 'bull_rsi_ob': 77, 'bull_adx_thresh': 31.181920557832495, 'bull_atr_min_pct': 0.0273514811601321, 'bull_atr_max_pct': 0.048652821136796344, 'bull_tp_mult': 1.6175230241390837, 'bull_tsl_mult': 0.9509263278148625, 'bull_time_stop': 280, 'bull_use_sma': False, 'bull_use_ema': False, 'bull_use_atr': False, 'bull_use_adx': False, 'bull_use_spike': True, 'bull_rsi_required': True, 'bear_strategy': 'breakout', 'bear_bb_std_mult': 3.2644132342536984, 'bear_rsi_os': 29, 'bear_rsi_ob': 64, 'bear_adx_thresh': 8.081514425167365, 'bear_atr_min_pct': 0.020258764321900165, 'bear_atr_max_pct': 0.1369734836379977, 'bear_tp_mult': 1.9628484970910867, 'bear_tsl_mult': 0.12296981382892419, 'bear_time_stop': 140, 'bear_use_sma': True, 'bear_use_ema': True, 'bear_use_atr': False, 'bear_use_adx': False, 'bear_use_spike': False, 'bear_rsi_required': True, 'sideways_strategy': 'breakout', 'sideways_bb_std_mult': 0.6910363607197458, 'sideways_rsi_os': 43, 'sideways_rsi_ob': 84, 'sideways_adx_thresh': 19.011394383139372, 'sideways_atr_min_pct': 0.013823014456905437, 'sideways_atr_max_pct': 0.07376482471768052, 'sideways_tp_mult': 1.4188239146690713, 'sideways_tsl_mult': 0.3371874940385628, 'sideways_time_stop': 202, 'sideways_use_sma': False, 'sideways_use_ema': True, 'sideways_use_atr': False, 'sideways_use_adx': True, 'sideways_use_spike': True, 'sideways_rsi_required': False}.
