[I 2025-08-31 12:33:54,053] Trial 323 finished with values: [-1000000000.0, 1000000000.0] and parameters: {'p_sma': 58, 'p_std': 7, 'p_atr': 11, 'p_adx': 18, 'rsi_period': 79, 'ema1': 9, 'ema2': 19, 'slip_atr_k': 0.028076596904870826, 'slip_spread_k': 0.5075345193944115, 'spread_hl_frac': 0.029933374696942905, 'bb_std_mult': 1.858852868894019, 'rsi_os': 9, 'rsi_ob': 73, 'vol_spike': 0.09956681842712195, 'adx_thresh': 22.096717593260514, 'atr_min_pct': 1.7314190830109138e-05, 'atr_max_pct': 0.13689223746340376, 'tp_mult': 1.4369147414827426, 'tsl_mult': 0.01659030507549977, 'strategy': 'breakout', 'time_stop': 204, 'use_sma': False, 'use_atr': True, 'use_adx': False, 'use_ema': False, 'use_spike': False, 'rsi_required': True, 'edge_k': 0.04009561705461007, 'edge_cap': 0.929475573835451, 'bull_strategy': 'breakout', 'bull_bb_std_mult': 2.8608956448417064, 'bull_rsi_os': 11, 'bull_rsi_ob': 77, 'bull_adx_thresh': 8.83845026216462, 'bull_atr_min_pct': 0.019678609327021722, 'bull_atr_max_pct': 0.0751888579096641, 'bull_tp_mult': 1.7478387580816086, 'bull_tsl_mult': 0.2286177822136642, 'bull_time_stop': 92, 'bull_use_sma': True, 'bull_use_ema': True, 'bull_use_atr': False, 'bull_use_adx': True, 'bull_use_spike': True, 'bull_rsi_required': False, 'bear_strategy': 'breakout', 'bear_bb_std_mult': 3.069688830055391, 'bear_rsi_os': 32, 'bear_rsi_ob': 45, 'bear_adx_thresh': 32.54662397979143, 'bear_atr_min_pct': 0.027520216315353365, 'bear_atr_max_pct': 0.07924929948477791, 'bear_tp_mult': 2.9228991088530587, 'bear_tsl_mult': 0.8631721151590896, 'bear_time_stop': 67, 'bear_use_sma': True, 'bear_use_ema': True, 'bear_use_atr': True, 'bear_use_adx': True, 'bear_use_spike': False, 'bear_rsi_required': True, 'sideways_strategy': 'breakout', 'sideways_bb_std_mult': 3.4221545047574167, 'sideways_rsi_os': 33, 'sideways_rsi_ob': 81, 'sideways_adx_thresh': 12.681526721382111, 'sideways_atr_min_pct': 0.016606684169664536, 'sideways_atr_max_pct': 0.10734466514081882, 'sideways_tp_mult': 1.2029134685037772, 'sideways_tsl_mult': 0.8932879843870196, 'sideways_time_stop': 207, 'sideways_use_sma': True, 'sideways_use_ema': False, 'sideways_use_atr': False, 'sideways_use_adx': True, 'sideways_use_spike': False, 'sideways_rsi_required': True}.
[I 2025-08-31 12:34:25,887] Trial 326 finished with values: [-1000000000.0, 1000000000.0] and parameters: {'p_sma': 58, 'p_std': 7, 'p_atr': 12, 'p_adx': 21, 'rsi_period': 11, 'ema1': 12, 'ema2': 11, 'slip_atr_k': 0.0184770947286466, 'slip_spread_k': 0.6278414937179747, 'spread_hl_frac': 0.02856015832650297, 'bb_std_mult': 1.316423184871725, 'rsi_os': 24, 'rsi_ob': 73, 'vol_spike': 0.07831638500519345, 'adx_thresh': 22.25613403775342, 'atr_min_pct': 0.015300053186272458, 'atr_max_pct': 0.12907033427896675, 'tp_mult': 2.767884623852452, 'tsl_mult': 0.002672287933093485, 'strategy': 'mean_reversion', 'time_stop': 205, 'use_sma': False, 'use_atr': True, 'use_adx': False, 'use_ema': False, 'use_spike': False, 'rsi_required': True, 'edge_k': 0.05776776119174454, 'edge_cap': 0.9335013224799054, 'bull_strategy': 'breakout', 'bull_bb_std_mult': 2.801289586235512, 'bull_rsi_os': 22, 'bull_rsi_ob': 49, 'bull_adx_thresh': 8.998937502834877, 'bull_atr_min_pct': 0.019769370071951682, 'bull_atr_max_pct': 0.09225920806432333, 'bull_tp_mult': 2.1876292253753284, 'bull_tsl_mult': 0.8558690312805508, 'bull_time_stop': 217, 'bull_use_sma': True, 'bull_use_ema': True, 'bull_use_atr': True, 'bull_use_adx': True, 'bull_use_spike': False, 'bull_rsi_required': False, 'bear_strategy': 'breakout', 'bear_bb_std_mult': 3.0464163290715645, 'bear_rsi_os': 17, 'bear_rsi_ob': 69, 'bear_adx_thresh': 32.67978004793258, 'bear_atr_min_pct': 0.0276753657240709, 'bear_atr_max_pct': 0.08612788060734103, 'bear_tp_mult': 2.7484836046965477, 'bear_tsl_mult': 0.7784951493030984, 'bear_time_stop': 229, 'bear_use_sma': True, 'bear_use_ema': True, 'bear_use_atr': True, 'bear_use_adx': True, 'bear_use_spike': True, 'bear_rsi_required': True, 'sideways_strategy': 'breakout', 'sideways_bb_std_mult': 0.5145133912865989, 'sideways_rsi_os': 43, 'sideways_rsi_ob': 82, 'sideways_adx_thresh': 11.707813637250679, 'sideways_atr_min_pct': 0.022655777099361674, 'sideways_atr_max_pct': 0.10761266381492968, 'sideways_tp_mult': 1.3721176205805234, 'sideways_tsl_mult': 0.6872624734871142, 'sideways_time_stop': 215, 'sideways_use_sma': True, 'sideways_use_ema': False, 'sideways_use_atr': False, 'sideways_use_adx': False, 'sideways_use_spike': False, 'sideways_rsi_required': True}.
[I 2025-08-31 12:34:26,054] Trial 327 finished with values: [-1000000000.0, 1000000000.0] and parameters: {'p_sma': 14, 'p_std': 32, 'p_atr': 12, 'p_adx': 20, 'rsi_period': 27, 'ema1': 9, 'ema2': 22, 'slip_atr_k': 0.1773154523828262, 'slip_spread_k': 0.638431907045911, 'spread_hl_frac': 0.030013595001742114, 'bb_std_mult': 3.0955384311684195, 'rsi_os': 18, 'rsi_ob': 73, 'vol_spike': 0.07954706685460744, 'adx_thresh': 23.332954170071933, 'atr_min_pct': 0.0006616481246134549, 'atr_max_pct': 0.03756881846028865, 'tp_mult': 2.646790905457374, 'tsl_mult': 0.8550002767958538, 'strategy': 'mean_reversion', 'time_stop': 204, 'use_sma': False, 'use_atr': True, 'use_adx': False, 'use_ema': False, 'use_spike': False, 'rsi_required': True, 'edge_k': 0.7152515926308289, 'edge_cap': 0.5681072433549701, 'bull_strategy': 'breakout', 'bull_bb_std_mult': 2.792486046573576, 'bull_rsi_os': 54, 'bull_rsi_ob': 54, 'bull_adx_thresh': 25.089518387346875, 'bull_atr_min_pct': 0.01954231135962502, 'bull_atr_max_pct': 0.07814842101478023, 'bull_tp_mult': 2.65786127891583, 'bull_tsl_mult': 0.21781500817610505, 'bull_time_stop': 77, 'bull_use_sma': True, 'bull_use_ema': True, 'bull_use_atr': True, 'bull_use_adx': True, 'bull_use_spike': False, 'bull_rsi_required': False, 'bear_strategy': 'breakout', 'bear_bb_std_mult': 3.2368468254845597, 'bear_rsi_os': 28, 'bear_rsi_ob': 85, 'bear_adx_thresh': 27.96646379035113, 'bear_atr_min_pct': 0.021663919923539582, 'bear_atr_max_pct': 0.07455636673749325, 'bear_tp_mult': 2.4907147527528712, 'bear_tsl_mult': 0.8722685979538898, 'bear_time_stop': 230, 'bear_use_sma': True, 'bear_use_ema': True, 'bear_use_atr': True, 'bear_use_adx': True, 'bear_use_spike': True, 'bear_rsi_required': True, 'sideways_strategy': 'breakout', 'sideways_bb_std_mult': 3.5373531058903884, 'sideways_rsi_os': 33, 'sideways_rsi_ob': 82, 'sideways_adx_thresh': 11.67641793792616, 'sideways_atr_min_pct': 0.018029062615984297, 'sideways_atr_max_pct': 0.045517842168266445, 'sideways_tp_mult': 2.989940125441551, 'sideways_tsl_mult': 0.6892724808232271, 'sideways_time_stop': 217, 'sideways_use_sma': True, 'sideways_use_ema': False, 'sideways_use_atr': False, 'sideways_use_adx': False, 'sideways_use_spike': False, 'sideways_rsi_required': True}.
[I 2025-08-31 12:34:26,054] Trial 328 finished with values: [-1000000000.0, 1000000000.0] and parameters: {'p_sma': 14, 'p_std': 32, 'p_atr': 12, 'p_adx': 21, 'rsi_period': 27, 'ema1': 16, 'ema2': 11, 'slip_atr_k': 0.1778778852778773, 'slip_spread_k': 0.7801522742106156, 'spread_hl_frac': 0.02719248660974896, 'bb_std_mult': 1.8964817579748352, 'rsi_os': 40, 'rsi_ob': 74, 'vol_spike': 0.08162097050315147, 'adx_thresh': 11.680212213476537, 'atr_min_pct': 0.017700121917103576, 'atr_max_pct': 0.03837867839123614, 'tp_mult': 1.5636860612508792, 'tsl_mult': 0.678663679074895, 'strategy': 'mean_reversion', 'time_stop': 203, 'use_sma': False, 'use_atr': True, 'use_adx': False, 'use_ema': False, 'use_spike': False, 'rsi_required': True, 'edge_k': 0.7165183323950547, 'edge_cap': 0.6099761697174015, 'bull_strategy': 'breakout', 'bull_bb_std_mult': 2.790059744507469, 'bull_rsi_os': 53, 'bull_rsi_ob': 81, 'bull_adx_thresh': 6.764195924016608, 'bull_atr_min_pct': 0.00847489918365836, 'bull_atr_max_pct': 0.10622379699761504, 'bull_tp_mult': 2.666582913675167, 'bull_tsl_mult': 0.21224791097395246, 'bull_time_stop': 104, 'bull_use_sma': True, 'bull_use_ema': True, 'bull_use_atr': True, 'bull_use_adx': True, 'bull_use_spike': False, 'bull_rsi_required': False, 'bear_strategy': 'breakout', 'bear_bb_std_mult': 0.5121399052925548, 'bear_rsi_os': 28, 'bear_rsi_ob': 69, 'bear_adx_thresh': 30.62409031264503, 'bear_atr_min_pct': 0.018562155649261284, 'bear_atr_max_pct': 0.1004652158256796, 'bear_tp_mult': 2.764081370345858, 'bear_tsl_mult': 0.19174304825027128, 'bear_time_stop': 229, 'bear_use_sma': True, 'bear_use_ema': True, 'bear_use_atr': True, 'bear_use_adx': True, 'bear_use_spike': True, 'bear_rsi_required': True, 'sideways_strategy': 'breakout', 'sideways_bb_std_mult': 1.0875639427699721, 'sideways_rsi_os': 34, 'sideways_rsi_ob': 83, 'sideways_adx_thresh': 11.77045256239191, 'sideways_atr_min_pct': 0.012950547689646888, 'sideways_atr_max_pct': 0.13846132094559893, 'sideways_tp_mult': 1.490842195944268, 'sideways_tsl_mult': 0.9926309905136035, 'sideways_time_stop': 217, 'sideways_use_sma': True, 'sideways_use_ema': False, 'sideways_use_atr': False, 'sideways_use_adx': False, 'sideways_use_spike': False, 'sideways_rsi_required': True}.
[I 2025-08-31 12:34:26,226] Trial 325 finished with values: [-0.3494988587320773, 0.34940697430368084] and parameters: {'p_sma': 52, 'p_std': 7, 'p_atr': 12, 'p_adx': 21, 'rsi_period': 9, 'ema1': 9, 'ema2': 11, 'slip_atr_k': 0.03880379080017149, 'slip_spread_k': 0.6196276942765379, 'spread_hl_frac': 0.027355358498830303, 'bb_std_mult': 3.2184151917220203, 'rsi_os': 40, 'rsi_ob': 73, 'vol_spike': 0.08066215108907804, 'adx_thresh': 22.34763050517742, 'atr_min_pct': 0.02253527795817678, 'atr_max_pct': 0.1358255424800858, 'tp_mult': 2.770030980323088, 'tsl_mult': 0.6010696344768723, 'strategy': 'mean_reversion', 'time_stop': 203, 'use_sma': False, 'use_atr': True, 'use_adx': False, 'use_ema': False, 'use_spike': False, 'rsi_required': True, 'edge_k': 0.7531486023549814, 'edge_cap': 0.09163424180973867, 'bull_strategy': 'breakout', 'bull_bb_std_mult': 2.7797827941201354, 'bull_rsi_os': 10, 'bull_rsi_ob': 82, 'bull_adx_thresh': 13.25549364088669, 'bull_atr_min_pct': 0.01969825472998964, 'bull_atr_max_pct': 0.0943504870714315, 'bull_tp_mult': 1.2416865092824723, 'bull_tsl_mult': 0.9997006806426564, 'bull_time_stop': 300, 'bull_use_sma': True, 'bull_use_ema': True, 'bull_use_atr': True, 'bull_use_adx': True, 'bull_use_spike': False, 'bull_rsi_required': False, 'bear_strategy': 'breakout', 'bear_bb_std_mult': 3.232455318749535, 'bear_rsi_os': 32, 'bear_rsi_ob': 90, 'bear_adx_thresh': 32.56479460015448, 'bear_atr_min_pct': 0.014267547710968463, 'bear_atr_max_pct': 0.0791680103245021, 'bear_tp_mult': 2.752111948412486, 'bear_tsl_mult': 0.1274088929752854, 'bear_time_stop': 231, 'bear_use_sma': True, 'bear_use_ema': True, 'bear_use_atr': True, 'bear_use_adx': True, 'bear_use_spike': True, 'bear_rsi_required': True, 'sideways_strategy': 'breakout', 'sideways_bb_std_mult': 3.54281176977591, 'sideways_rsi_os': 43, 'sideways_rsi_ob': 82, 'sideways_adx_thresh': 11.902688937182859, 'sideways_atr_min_pct': 0.0006250815932761398, 'sideways_atr_max_pct': 0.026056445521972962, 'sideways_tp_mult': 1.4354957796607035, 'sideways_tsl_mult': 0.5466707425510067, 'sideways_time_stop': 216, 'sideways_use_sma': True, 'sideways_use_ema': False, 'sideways_use_atr': False, 'sideways_use_adx': False, 'sideways_use_spike': False, 'sideways_rsi_required': True}.
[I 2025-08-31 12:34:57,372] Trial 330 finished with values: [-0.052577720646379, 0.05231823477535415] and parameters: {'p_sma': 56, 'p_std': 43, 'p_atr': 24, 'p_adx': 23, 'rsi_period': 34, 'ema1': 25, 'ema2': 16, 'slip_atr_k': 0.2363485655470396, 'slip_spread_k': 0.6710409145312851, 'spread_hl_frac': 0.027658879994966298, 'bb_std_mult': 1.9643615563179941, 'rsi_os': 30, 'rsi_ob': 77, 'vol_spike': 0.09269637260813057, 'adx_thresh': 18.00558820478411, 'atr_min_pct': 0.010198346053349999, 'atr_max_pct': 0.05133404099881306, 'tp_mult': 2.623035399864711, 'tsl_mult': 0.03443466602185792, 'strategy': 'mean_reversion', 'time_stop': 191, 'use_sma': False, 'use_atr': True, 'use_adx': False, 'use_ema': False, 'use_spike': False, 'rsi_required': True, 'edge_k': 1.7477560044163971, 'edge_cap': 0.9787633986962371, 'bull_strategy': 'breakout', 'bull_bb_std_mult': 3.059544919202956, 'bull_rsi_os': 8, 'bull_rsi_ob': 80, 'bull_adx_thresh': 10.214466109848901, 'bull_atr_min_pct': 0.0015613172601823926, 'bull_atr_max_pct': 0.11088067080115892, 'bull_tp_mult': 1.440698751390084, 'bull_tsl_mult': 0.2704512647877684, 'bull_time_stop': 164, 'bull_use_sma': True, 'bull_use_ema': True, 'bull_use_atr': False, 'bull_use_adx': True, 'bull_use_spike': False, 'bull_rsi_required': False, 'bear_strategy': 'breakout', 'bear_bb_std_mult': 1.304921152808074, 'bear_rsi_os': 30, 'bear_rsi_ob': 90, 'bear_adx_thresh': 32.907796437664445, 'bear_atr_min_pct': 0.004309594837858805, 'bear_atr_max_pct': 0.09719202029695029, 'bear_tp_mult': 2.250090799963521, 'bear_tsl_mult': 0.4410326087876244, 'bear_time_stop': 184, 'bear_use_sma': True, 'bear_use_ema': True, 'bear_use_atr': True, 'bear_use_adx': True, 'bear_use_spike': True, 'bear_rsi_required': True, 'sideways_strategy': 'breakout', 'sideways_bb_std_mult': 1.1682700822226657, 'sideways_rsi_os': 28, 'sideways_rsi_ob': 80, 'sideways_adx_thresh': 13.55601617055488, 'sideways_atr_min_pct': 0.02786337420115726, 'sideways_atr_max_pct': 0.13571584809777687, 'sideways_tp_mult': 1.5118786084555986, 'sideways_tsl_mult': 0.792527387724954, 'sideways_time_stop': 189, 'sideways_use_sma': True, 'sideways_use_ema': False, 'sideways_use_atr': False, 'sideways_use_adx': False, 'sideways_use_spike': False, 'sideways_rsi_required': True}.
[I 2025-08-31 12:34:57,408] Trial 331 finished with values: [-1000000000.0, 1000000000.0] and parameters: {'p_sma': 56, 'p_std': 31, 'p_atr': 24, 'p_adx': 23, 'rsi_period': 82, 'ema1': 25, 'ema2': 15, 'slip_atr_k': 0.15348585868958947, 'slip_spread_k': 0.4594105046104308, 'spread_hl_frac': 0.03228800267134456, 'bb_std_mult': 1.9846613905136319, 'rsi_os': 39, 'rsi_ob': 93, 'vol_spike': 0.091345145879783, 'adx_thresh': 18.89483622019859, 'atr_min_pct': 0.022139205644450877, 'atr_max_pct': 0.13464514464588828, 'tp_mult': 2.874846817553639, 'tsl_mult': 0.7165856520069891, 'strategy': 'mean_reversion', 'time_stop': 196, 'use_sma': False, 'use_atr': True, 'use_adx': False, 'use_ema': False, 'use_spike': False, 'rsi_required': True, 'edge_k': 0.7660055494053795, 'edge_cap': 0.9730420396596904, 'bull_strategy': 'breakout', 'bull_bb_std_mult': 3.064610031759143, 'bull_rsi_os': 9, 'bull_rsi_ob': 80, 'bull_adx_thresh': 10.041096733511562, 'bull_atr_min_pct': 0.020634674991445612, 'bull_atr_max_pct': 0.08164953426726133, 'bull_tp_mult': 2.9227218726849804, 'bull_tsl_mult': 0.5923292149321963, 'bull_time_stop': 81, 'bull_use_sma': True, 'bull_use_ema': True, 'bull_use_atr': False, 'bull_use_adx': True, 'bull_use_spike': False, 'bull_rsi_required': False, 'bear_strategy': 'breakout', 'bear_bb_std_mult': 2.732549403306616, 'bear_rsi_os': 40, 'bear_rsi_ob': 72, 'bear_adx_thresh': 7.881249662057838, 'bear_atr_min_pct': 0.028301676672210018, 'bear_atr_max_pct': 0.034001714753956906, 'bear_tp_mult': 2.8738812032968126, 'bear_tsl_mult': 0.10758643392827441, 'bear_time_stop': 240, 'bear_use_sma': True, 'bear_use_ema': True, 'bear_use_atr': True, 'bear_use_adx': True, 'bear_use_spike': True, 'bear_rsi_required': True, 'sideways_strategy': 'breakout', 'sideways_bb_std_mult': 3.5459081872978557, 'sideways_rsi_os': 24, 'sideways_rsi_ob': 80, 'sideways_adx_thresh': 20.59837511165463, 'sideways_atr_min_pct': 0.02773015455615123, 'sideways_atr_max_pct': 0.1307058765736153, 'sideways_tp_mult': 1.432270736508976, 'sideways_tsl_mult': 0.7891643192249809, 'sideways_time_stop': 278, 'sideways_use_sma': True, 'sideways_use_ema': False, 'sideways_use_atr': False, 'sideways_use_adx': False, 'sideways_use_spike': False, 'sideways_rsi_required': True}.
[I 2025-08-31 12:34:57,702] Trial 329 finished with values: [-0.2122300826393021, 0.21195700568452908] and parameters: {'p_sma': 56, 'p_std': 40, 'p_atr': 12, 'p_adx': 17, 'rsi_period': 27, 'ema1': 5, 'ema2': 22, 'slip_atr_k': 0.24450768034726117, 'slip_spread_k': 0.4637441788192045, 'spread_hl_frac': 0.021123191060829598, 'bb_std_mult': 3.073730783751013, 'rsi_os': 34, 'rsi_ob': 94, 'vol_spike': 0.07985406919937217, 'adx_thresh': 23.45240619764629, 'atr_min_pct': 0.017224343645147397, 'atr_max_pct': 0.03712231784617749, 'tp_mult': 2.64404012362493, 'tsl_mult': 0.6960326796624676, 'strategy': 'mean_reversion', 'time_stop': 242, 'use_sma': False, 'use_atr': True, 'use_adx': False, 'use_ema': False, 'use_spike': False, 'rsi_required': True, 'edge_k': 0.7277202081474508, 'edge_cap': 0.6125275584038187, 'bull_strategy': 'breakout', 'bull_bb_std_mult': 0.8035830469159364, 'bull_rsi_os': 53, 'bull_rsi_ob': 81, 'bull_adx_thresh': 7.116468259301255, 'bull_atr_min_pct': 0.01264965928327345, 'bull_atr_max_pct': 0.0804569228126492, 'bull_tp_mult': 1.5858841757417443, 'bull_tsl_mult': 0.9972868233403012, 'bull_time_stop': 257, 'bull_use_sma': True, 'bull_use_ema': True, 'bull_use_atr': False, 'bull_use_adx': True, 'bull_use_spike': False, 'bull_rsi_required': False, 'bear_strategy': 'breakout', 'bear_bb_std_mult': 3.246345637026584, 'bear_rsi_os': 28, 'bear_rsi_ob': 52, 'bear_adx_thresh': 7.889747382048206, 'bear_atr_min_pct': 0.0018050409661678115, 'bear_atr_max_pct': 0.03636462018911269, 'bear_tp_mult': 1.134416811600233, 'bear_tsl_mult': 0.10842883686294688, 'bear_time_stop': 182, 'bear_use_sma': True, 'bear_use_ema': True, 'bear_use_atr': True, 'bear_use_adx': True, 'bear_use_spike': True, 'bear_rsi_required': True, 'sideways_strategy': 'breakout', 'sideways_bb_std_mult': 3.5426303785658275, 'sideways_rsi_os': 36, 'sideways_rsi_ob': 83, 'sideways_adx_thresh': 20.850934307878052, 'sideways_atr_min_pct': 0.0005744335046575131, 'sideways_atr_max_pct': 0.13967338046523384, 'sideways_tp_mult': 1.4993110414000297, 'sideways_tsl_mult': 0.5869949383362607, 'sideways_time_stop': 274, 'sideways_use_sma': True, 'sideways_use_ema': False, 'sideways_use_atr': False, 'sideways_use_adx': False, 'sideways_use_spike': False, 'sideways_rsi_required': True}.
[I 2025-08-31 12:34:57,848] Trial 332 finished with values: [-1000000000.0, 1000000000.0] and parameters: {'p_sma': 54, 'p_std': 9, 'p_atr': 24, 'p_adx': 17, 'rsi_period': 58, 'ema1': 5, 'ema2': 54, 'slip_atr_k': 0.2437954628563786, 'slip_spread_k': 0.4397447284401672, 'spread_hl_frac': 0.046128141180113116, 'bb_std_mult': 2.0191302449253254, 'rsi_os': 42, 'rsi_ob': 77, 'vol_spike': 0.09109626058225458, 'adx_thresh': 32.481775034240684, 'atr_min_pct': 0.00997141562440196, 'atr_max_pct': 0.04915389371877006, 'tp_mult': 2.0906999473639645, 'tsl_mult': 0.6350816838593365, 'strategy': 'mean_reversion', 'time_stop': 263, 'use_sma': False, 'use_atr': True, 'use_adx': False, 'use_ema': False, 'use_spike': False, 'rsi_required': True, 'edge_k': 1.8529869389683697, 'edge_cap': 0.7096544433868514, 'bull_strategy': 'breakout', 'bull_bb_std_mult': 3.0129985594194215, 'bull_rsi_os': 8, 'bull_rsi_ob': 80, 'bull_adx_thresh': 9.42843851314126, 'bull_atr_min_pct': 0.01799239564618988, 'bull_atr_max_pct': 0.08140367429285837, 'bull_tp_mult': 1.4550191425506065, 'bull_tsl_mult': 0.26757738084170535, 'bull_time_stop': 87, 'bull_use_sma': True, 'bull_use_ema': True, 'bull_use_atr': False, 'bull_use_adx': True, 'bull_use_spike': False, 'bull_rsi_required': False, 'bear_strategy': 'breakout', 'bear_bb_std_mult': 2.8388272887674475, 'bear_rsi_os': 35, 'bear_rsi_ob': 83, 'bear_adx_thresh': 33.065748750796665, 'bear_atr_min_pct': 0.02653003401688198, 'bear_atr_max_pct': 0.061969848764888424, 'bear_tp_mult': 2.2463857314475044, 'bear_tsl_mult': 0.1648878227342682, 'bear_time_stop': 240, 'bear_use_sma': True, 'bear_use_ema': True, 'bear_use_atr': True, 'bear_use_adx': True, 'bear_use_spike': True, 'bear_rsi_required': True, 'sideways_strategy': 'breakout', 'sideways_bb_std_mult': 3.5020998988792487, 'sideways_rsi_os': 24, 'sideways_rsi_ob': 83, 'sideways_adx_thresh': 27.218782631524736, 'sideways_atr_min_pct': 0.027512699015625468, 'sideways_atr_max_pct': 0.12964245562324409, 'sideways_tp_mult': 1.9148306862905675, 'sideways_tsl_mult': 0.5868477065648606, 'sideways_time_stop': 138, 'sideways_use_sma': True, 'sideways_use_ema': False, 'sideways_use_atr': False, 'sideways_use_adx': False, 'sideways_use_spike': True, 'sideways_rsi_required': False}.
