[I 2025-08-31 12:28:23,060] Trial 277 finished with values: [-0.05868715071507591, 0.058454063717862666] and parameters: {'p_sma': 57, 'p_std': 29, 'p_atr': 19, 'p_adx': 15, 'rsi_period': 55, 'ema1': 5, 'ema2': 22, 'slip_atr_k': 0.060178114681145325, 'slip_spread_k': 0.5895373319152702, 'spread_hl_frac': 0.039688801765979886, 'bb_std_mult': 1.9800697332920296, 'rsi_os': 10, 'rsi_ob': 77, 'vol_spike': 0.11804466747893813, 'adx_thresh': 12.940167685790207, 'atr_min_pct': 0.0016308958577082784, 'atr_max_pct': 0.12172888470663537, 'tp_mult': 1.8311569873791842, 'tsl_mult': 0.12072559371286579, 'strategy': 'mean_reversion', 'time_stop': 206, 'use_sma': False, 'use_atr': True, 'use_adx': False, 'use_ema': False, 'use_spike': False, 'rsi_required': True, 'edge_k': 0.5702125774987432, 'edge_cap': 0.7180375687634654, 'bull_strategy': 'breakout', 'bull_bb_std_mult': 2.83872383737139, 'bull_rsi_os': 9, 'bull_rsi_ob': 81, 'bull_adx_thresh': 15.927292395050326, 'bull_atr_min_pct': 0.021934145517563876, 'bull_atr_max_pct': 0.09119358625907256, 'bull_tp_mult': 2.049194613681791, 'bull_tsl_mult': 0.25040624108784076, 'bull_time_stop': 198, 'bull_use_sma': True, 'bull_use_ema': True, 'bull_use_atr': False, 'bull_use_adx': True, 'bull_use_spike': False, 'bull_rsi_required': False, 'bear_strategy': 'breakout', 'bear_bb_std_mult': 2.657992898614822, 'bear_rsi_os': 32, 'bear_rsi_ob': 73, 'bear_adx_thresh': 7.14260207199133, 'bear_atr_min_pct': 0.0037139833006680136, 'bear_atr_max_pct': 0.0973751753616838, 'bear_tp_mult': 2.8766019439173083, 'bear_tsl_mult': 0.11886695686214938, 'bear_time_stop': 231, 'bear_use_sma': True, 'bear_use_ema': True, 'bear_use_atr': True, 'bear_use_adx': True, 'bear_use_spike': False, 'bear_rsi_required': True, 'sideways_strategy': 'breakout', 'sideways_bb_std_mult': 3.591136587665975, 'sideways_rsi_os': 36, 'sideways_rsi_ob': 86, 'sideways_adx_thresh': 19.44074232950806, 'sideways_atr_min_pct': 5.6717677540406015e-05, 'sideways_atr_max_pct': 0.1304455241171816, 'sideways_tp_mult': 1.8025045945284668, 'sideways_tsl_mult': 0.6959696994100226, 'sideways_time_stop': 208, 'sideways_use_sma': True, 'sideways_use_ema': False, 'sideways_use_atr': False, 'sideways_use_adx': False, 'sideways_use_spike': False, 'sideways_rsi_required': True}.
[I 2025-08-31 12:28:55,954] Trial 280 finished with values: [-1000000000.0, 1000000000.0] and parameters: {'p_sma': 56, 'p_std': 29, 'p_atr': 13, 'p_adx': 15, 'rsi_period': 79, 'ema1': 21, 'ema2': 21, 'slip_atr_k': 0.03977535512704856, 'slip_spread_k': 0.6993634314714856, 'spread_hl_frac': 0.04421549607545344, 'bb_std_mult': 2.3222597727663805, 'rsi_os': 20, 'rsi_ob': 71, 'vol_spike': 0.04882567972452047, 'adx_thresh': 22.677670966453878, 'atr_min_pct': 0.0014685252067915785, 'atr_max_pct': 0.14140943657794083, 'tp_mult': 1.834470505191912, 'tsl_mult': 0.12463048173572899, 'strategy': 'mean_reversion', 'time_stop': 198, 'use_sma': False, 'use_atr': True, 'use_adx': False, 'use_ema': False, 'use_spike': False, 'rsi_required': True, 'edge_k': 0.8342086923420823, 'edge_cap': 0.7206639772621624, 'bull_strategy': 'breakout', 'bull_bb_std_mult': 2.930332472386599, 'bull_rsi_os': 43, 'bull_rsi_ob': 82, 'bull_adx_thresh': 8.919387707027495, 'bull_atr_min_pct': 0.021159672211531252, 'bull_atr_max_pct': 0.10844075553980405, 'bull_tp_mult': 2.0421479324217797, 'bull_tsl_mult': 0.1662444268929071, 'bull_time_stop': 9, 'bull_use_sma': True, 'bull_use_ema': True, 'bull_use_atr': True, 'bull_use_adx': True, 'bull_use_spike': False, 'bull_rsi_required': False, 'bear_strategy': 'breakout', 'bear_bb_std_mult': 2.6521111304567144, 'bear_rsi_os': 31, 'bear_rsi_ob': 73, 'bear_adx_thresh': 12.059900424253005, 'bear_atr_min_pct': 0.02656609914029887, 'bear_atr_max_pct': 0.030712276857861764, 'bear_tp_mult': 2.8701841897382048, 'bear_tsl_mult': 0.11111570797292675, 'bear_time_stop': 126, 'bear_use_sma': True, 'bear_use_ema': True, 'bear_use_atr': True, 'bear_use_adx': True, 'bear_use_spike': False, 'bear_rsi_required': True, 'sideways_strategy': 'mean_reversion', 'sideways_bb_std_mult': 3.561556586555851, 'sideways_rsi_os': 36, 'sideways_rsi_ob': 77, 'sideways_adx_thresh': 17.62282080191112, 'sideways_atr_min_pct': 0.0001132168820456304, 'sideways_atr_max_pct': 0.14028590106639433, 'sideways_tp_mult': 1.4294634992621142, 'sideways_tsl_mult': 0.7047316576097309, 'sideways_time_stop': 220, 'sideways_use_sma': True, 'sideways_use_ema': False, 'sideways_use_atr': False, 'sideways_use_adx': False, 'sideways_use_spike': False, 'sideways_rsi_required': True}.
[I 2025-08-31 12:28:56,589] Trial 282 finished with values: [-0.053567975198707596, 0.05416153796600655] and parameters: {'p_sma': 45, 'p_std': 30, 'p_atr': 12, 'p_adx': 15, 'rsi_period': 24, 'ema1': 5, 'ema2': 19, 'slip_atr_k': 0.030521269449551656, 'slip_spread_k': 0.7039722786588927, 'spread_hl_frac': 0.03988299158799195, 'bb_std_mult': 1.7512511455476454, 'rsi_os': 50, 'rsi_ob': 77, 'vol_spike': 0.03724106400757379, 'adx_thresh': 12.980213241085497, 'atr_min_pct': 0.0018939828020701373, 'atr_max_pct': 0.11407780668304354, 'tp_mult': 1.6426870401792484, 'tsl_mult': 0.11805253423970058, 'strategy': 'breakout', 'time_stop': 197, 'use_sma': False, 'use_atr': True, 'use_adx': False, 'use_ema': False, 'use_spike': False, 'rsi_required': True, 'edge_k': 0.46997916839750464, 'edge_cap': 0.8333502994198403, 'bull_strategy': 'breakout', 'bull_bb_std_mult': 2.899749337097179, 'bull_rsi_os': 7, 'bull_rsi_ob': 79, 'bull_adx_thresh': 16.011331849583527, 'bull_atr_min_pct': 0.019927392794780105, 'bull_atr_max_pct': 0.06792693469849284, 'bull_tp_mult': 2.7549305613561956, 'bull_tsl_mult': 0.43998092460284044, 'bull_time_stop': 79, 'bull_use_sma': True, 'bull_use_ema': True, 'bull_use_atr': True, 'bull_use_adx': False, 'bull_use_spike': False, 'bull_rsi_required': False, 'bear_strategy': 'breakout', 'bear_bb_std_mult': 2.841064833737418, 'bear_rsi_os': 32, 'bear_rsi_ob': 69, 'bear_adx_thresh': 33.01276606351513, 'bear_atr_min_pct': 0.0028056708012846373, 'bear_atr_max_pct': 0.09605379540005153, 'bear_tp_mult': 2.866128378941473, 'bear_tsl_mult': 0.6350256745746669, 'bear_time_stop': 238, 'bear_use_sma': True, 'bear_use_ema': True, 'bear_use_atr': True, 'bear_use_adx': True, 'bear_use_spike': True, 'bear_rsi_required': True, 'sideways_strategy': 'breakout', 'sideways_bb_std_mult': 3.539802388741354, 'sideways_rsi_os': 26, 'sideways_rsi_ob': 87, 'sideways_adx_thresh': 32.59372389805567, 'sideways_atr_min_pct': 0.0216094039701413, 'sideways_atr_max_pct': 0.14256786504942084, 'sideways_tp_mult': 1.424883445251084, 'sideways_tsl_mult': 0.6996559981602728, 'sideways_time_stop': 198, 'sideways_use_sma': True, 'sideways_use_ema': False, 'sideways_use_atr': False, 'sideways_use_adx': False, 'sideways_use_spike': True, 'sideways_rsi_required': False}.
[I 2025-08-31 12:28:57,000] Trial 283 finished with values: [-1000000000.0, 1000000000.0] and parameters: {'p_sma': 42, 'p_std': 32, 'p_atr': 12, 'p_adx': 28, 'rsi_period': 25, 'ema1': 5, 'ema2': 21, 'slip_atr_k': 0.031941354867277935, 'slip_spread_k': 0.6964036639744219, 'spread_hl_frac': 0.0030606423950449504, 'bb_std_mult': 1.7439740130648655, 'rsi_os': 54, 'rsi_ob': 72, 'vol_spike': 0.16288933269981803, 'adx_thresh': 22.686207559494292, 'atr_min_pct': 0.0020331056611815612, 'atr_max_pct': 0.11192339733675404, 'tp_mult': 2.599944120841183, 'tsl_mult': 0.07989013450672788, 'strategy': 'breakout', 'time_stop': 231, 'use_sma': False, 'use_atr': True, 'use_adx': False, 'use_ema': False, 'use_spike': False, 'rsi_required': True, 'edge_k': 0.8472042525666946, 'edge_cap': 0.5535060119289635, 'bull_strategy': 'breakout', 'bull_bb_std_mult': 2.932441625978954, 'bull_rsi_os': 43, 'bull_rsi_ob': 82, 'bull_adx_thresh': 8.650828395883305, 'bull_atr_min_pct': 0.019768119781235396, 'bull_atr_max_pct': 0.06704057483366216, 'bull_tp_mult': 2.158248273617589, 'bull_tsl_mult': 0.42874112053163577, 'bull_time_stop': 28, 'bull_use_sma': True, 'bull_use_ema': True, 'bull_use_atr': True, 'bull_use_adx': False, 'bull_use_spike': False, 'bull_rsi_required': False, 'bear_strategy': 'breakout', 'bear_bb_std_mult': 2.8558078977440284, 'bear_rsi_os': 28, 'bear_rsi_ob': 69, 'bear_adx_thresh': 30.200201499613158, 'bear_atr_min_pct': 0.022495049109861453, 'bear_atr_max_pct': 0.0959290122929635, 'bear_tp_mult': 2.8622425330512464, 'bear_tsl_mult': 0.7695747182037511, 'bear_time_stop': 237, 'bear_use_sma': True, 'bear_use_ema': True, 'bear_use_atr': True, 'bear_use_adx': True, 'bear_use_spike': True, 'bear_rsi_required': True, 'sideways_strategy': 'mean_reversion', 'sideways_bb_std_mult': 3.540788747365696, 'sideways_rsi_os': 26, 'sideways_rsi_ob': 72, 'sideways_adx_thresh': 24.90620234600579, 'sideways_atr_min_pct': 0.02560525087929682, 'sideways_atr_max_pct': 0.14115680138535924, 'sideways_tp_mult': 1.4368368031422918, 'sideways_tsl_mult': 0.6803316314625915, 'sideways_time_stop': 270, 'sideways_use_sma': True, 'sideways_use_ema': False, 'sideways_use_atr': False, 'sideways_use_adx': False, 'sideways_use_spike': True, 'sideways_rsi_required': False}.
[I 2025-08-31 12:28:57,228] Trial 281 finished with values: [-0.06895122299027301, 0.06873577261154666] and parameters: {'p_sma': 44, 'p_std': 32, 'p_atr': 12, 'p_adx': 20, 'rsi_period': 25, 'ema1': 5, 'ema2': 21, 'slip_atr_k': 0.03069237831556947, 'slip_spread_k': 0.7077833864802499, 'spread_hl_frac': 0.03954407084299092, 'bb_std_mult': 1.9012449098206183, 'rsi_os': 54, 'rsi_ob': 78, 'vol_spike': 0.04399965798317315, 'adx_thresh': 12.886097849017954, 'atr_min_pct': 0.0020120381214877576, 'atr_max_pct': 0.11480362931495333, 'tp_mult': 1.644887744103038, 'tsl_mult': 0.0609912028278919, 'strategy': 'breakout', 'time_stop': 198, 'use_sma': False, 'use_atr': True, 'use_adx': False, 'use_ema': False, 'use_spike': False, 'rsi_required': True, 'edge_k': 0.6432340091425968, 'edge_cap': 0.7205548855115813, 'bull_strategy': 'breakout', 'bull_bb_std_mult': 2.922772170660224, 'bull_rsi_os': 11, 'bull_rsi_ob': 66, 'bull_adx_thresh': 16.0922867956117, 'bull_atr_min_pct': 0.0199166042434183, 'bull_atr_max_pct': 0.07086789624232646, 'bull_tp_mult': 2.740866689473504, 'bull_tsl_mult': 0.0468818048719114, 'bull_time_stop': 259, 'bull_use_sma': True, 'bull_use_ema': True, 'bull_use_atr': True, 'bull_use_adx': False, 'bull_use_spike': False, 'bull_rsi_required': False, 'bear_strategy': 'breakout', 'bear_bb_std_mult': 3.1533823360307647, 'bear_rsi_os': 32, 'bear_rsi_ob': 71, 'bear_adx_thresh': 33.4185532351273, 'bear_atr_min_pct': 0.0027654540086452448, 'bear_atr_max_pct': 0.030292319514092086, 'bear_tp_mult': 2.875226463892181, 'bear_tsl_mult': 0.15605997226181048, 'bear_time_stop': 94, 'bear_use_sma': True, 'bear_use_ema': True, 'bear_use_atr': True, 'bear_use_adx': True, 'bear_use_spike': True, 'bear_rsi_required': True, 'sideways_strategy': 'breakout', 'sideways_bb_std_mult': 3.538106783173487, 'sideways_rsi_os': 26, 'sideways_rsi_ob': 72, 'sideways_adx_thresh': 5.624376021913037, 'sideways_atr_min_pct': 0.0005731428701717955, 'sideways_atr_max_pct': 0.1422132438211885, 'sideways_tp_mult': 2.3379957215776015, 'sideways_tsl_mult': 0.7059957365598002, 'sideways_time_stop': 220, 'sideways_use_sma': True, 'sideways_use_ema': False, 'sideways_use_atr': False, 'sideways_use_adx': False, 'sideways_use_spike': True, 'sideways_rsi_required': False}.
[I 2025-08-31 12:29:29,838] Trial 287 finished with values: [-1000000000.0, 1000000000.0] and parameters: {'p_sma': 59, 'p_std': 31, 'p_atr': 12, 'p_adx': 11, 'rsi_period': 81, 'ema1': 24, 'ema2': 25, 'slip_atr_k': 0.018187973417758456, 'slip_spread_k': 0.6621153523779632, 'spread_hl_frac': 0.03375364289887394, 'bb_std_mult': 2.0911422410093423, 'rsi_os': 38, 'rsi_ob': 75, 'vol_spike': 0.07858767805476952, 'adx_thresh': 21.70937112969492, 'atr_min_pct': 0.00319194020460784, 'atr_max_pct': 0.10330099048065886, 'tp_mult': 1.2788908976648052, 'tsl_mult': 0.02281122378828251, 'strategy': 'mean_reversion', 'time_stop': 213, 'use_sma': False, 'use_atr': True, 'use_adx': False, 'use_ema': False, 'use_spike': False, 'rsi_required': True, 'edge_k': 0.3642412297143687, 'edge_cap': 0.5852852278064896, 'bull_strategy': 'breakout', 'bull_bb_std_mult': 3.02029833694937, 'bull_rsi_os': 28, 'bull_rsi_ob': 59, 'bull_adx_thresh': 6.024364044822924, 'bull_atr_min_pct': 0.020799328889894858, 'bull_atr_max_pct': 0.09739494287867398, 'bull_tp_mult': 1.4980918190500048, 'bull_tsl_mult': 0.5655089177949272, 'bull_time_stop': 170, 'bull_use_sma': True, 'bull_use_ema': True, 'bull_use_atr': False, 'bull_use_adx': True, 'bull_use_spike': False, 'bull_rsi_required': False, 'bear_strategy': 'breakout', 'bear_bb_std_mult': 2.985740436339796, 'bear_rsi_os': 28, 'bear_rsi_ob': 71, 'bear_adx_thresh': 23.90318084553222, 'bear_atr_min_pct': 0.01118458900386061, 'bear_atr_max_pct': 0.0904209858346051, 'bear_tp_mult': 2.736438524705388, 'bear_tsl_mult': 0.5769483800716577, 'bear_time_stop': 40, 'bear_use_sma': True, 'bear_use_ema': True, 'bear_use_atr': True, 'bear_use_adx': True, 'bear_use_spike': True, 'bear_rsi_required': True, 'sideways_strategy': 'breakout', 'sideways_bb_std_mult': 3.4909219255114046, 'sideways_rsi_os': 35, 'sideways_rsi_ob': 91, 'sideways_adx_thresh': 34.49138561822871, 'sideways_atr_min_pct': 0.02077925293487092, 'sideways_atr_max_pct': 0.1337730461174807, 'sideways_tp_mult': 2.5221749059637752, 'sideways_tsl_mult': 0.598990742904896, 'sideways_time_stop': 196, 'sideways_use_sma': True, 'sideways_use_ema': False, 'sideways_use_atr': False, 'sideways_use_adx': False, 'sideways_use_spike': False, 'sideways_rsi_required': True}.
[I 2025-08-31 12:29:30,050] Trial 286 finished with values: [-0.1304800937278875, 0.1302625327447732] and parameters: {'p_sma': 60, 'p_std': 31, 'p_atr': 13, 'p_adx': 22, 'rsi_period': 84, 'ema1': 13, 'ema2': 24, 'slip_atr_k': 0.0003566838398269684, 'slip_spread_k': 0.6687659887681697, 'spread_hl_frac': 0.030713819048874724, 'bb_std_mult': 2.6281606305717444, 'rsi_os': 38, 'rsi_ob': 75, 'vol_spike': 0.08019889807052377, 'adx_thresh': 5.846530755786063, 'atr_min_pct': 0.0032563220190722, 'atr_max_pct': 0.12506785953503113, 'tp_mult': 2.6628263541262354, 'tsl_mult': 0.06718727304900146, 'strategy': 'mean_reversion', 'time_stop': 205, 'use_sma': False, 'use_atr': True, 'use_adx': False, 'use_ema': False, 'use_spike': False, 'rsi_required': True, 'edge_k': 0.6648087236631669, 'edge_cap': 0.8586316667818191, 'bull_strategy': 'breakout', 'bull_bb_std_mult': 3.0177592268810827, 'bull_rsi_os': 11, 'bull_rsi_ob': 58, 'bull_adx_thresh': 10.560100316570663, 'bull_atr_min_pct': 0.00983906266042659, 'bull_atr_max_pct': 0.09594860855980958, 'bull_tp_mult': 2.691589563379173, 'bull_tsl_mult': 0.22559765054187386, 'bull_time_stop': 106, 'bull_use_sma': True, 'bull_use_ema': True, 'bull_use_atr': False, 'bull_use_adx': True, 'bull_use_spike': False, 'bull_rsi_required': False, 'bear_strategy': 'breakout', 'bear_bb_std_mult': 3.028847261316794, 'bear_rsi_os': 28, 'bear_rsi_ob': 71, 'bear_adx_thresh': 33.200145127806486, 'bear_atr_min_pct': 0.027305164678037914, 'bear_atr_max_pct': 0.08770424119124473, 'bear_tp_mult': 2.913871620064, 'bear_tsl_mult': 0.14162553333826927, 'bear_time_stop': 241, 'bear_use_sma': True, 'bear_use_ema': True, 'bear_use_atr': True, 'bear_use_adx': True, 'bear_use_spike': True, 'bear_rsi_required': True, 'sideways_strategy': 'breakout', 'sideways_bb_std_mult': 3.4939004202994863, 'sideways_rsi_os': 53, 'sideways_rsi_ob': 92, 'sideways_adx_thresh': 14.067052164395738, 'sideways_atr_min_pct': 0.0016156260302334718, 'sideways_atr_max_pct': 0.1142414682707587, 'sideways_tp_mult': 1.600663195948237, 'sideways_tsl_mult': 0.646451130721649, 'sideways_time_stop': 246, 'sideways_use_sma': True, 'sideways_use_ema': False, 'sideways_use_atr': False, 'sideways_use_adx': False, 'sideways_use_spike': False, 'sideways_rsi_required': True}.
[I 2025-08-31 12:29:30,170] Trial 285 finished with values: [-1000000000.0, 1000000000.0] and parameters: {'p_sma': 42, 'p_std': 32, 'p_atr': 12, 'p_adx': 28, 'rsi_period': 83, 'ema1': 5, 'ema2': 20, 'slip_atr_k': 0.0007929949465533825, 'slip_spread_k': 0.6669615448787801, 'spread_hl_frac': 0.030388647480181198, 'bb_std_mult': 2.1883643343500854, 'rsi_os': 38, 'rsi_ob': 72, 'vol_spike': 0.08291941861936916, 'adx_thresh': 6.897087727206388, 'atr_min_pct': 0.0028391738048119198, 'atr_max_pct': 0.11793364810050677, 'tp_mult': 2.5930803595824234, 'tsl_mult': 0.058680211464626715, 'strategy': 'breakout', 'time_stop': 231, 'use_sma': False, 'use_atr': True, 'use_adx': False, 'use_ema': False, 'use_spike': False, 'rsi_required': True, 'edge_k': 0.7675807570861293, 'edge_cap': 0.5833437199931406, 'bull_strategy': 'breakout', 'bull_bb_std_mult': 2.9939917667376927, 'bull_rsi_os': 11, 'bull_rsi_ob': 79, 'bull_adx_thresh': 10.230018253557777, 'bull_atr_min_pct': 0.020879317832315458, 'bull_atr_max_pct': 0.06246992385891012, 'bull_tp_mult': 2.474696547570727, 'bull_tsl_mult': 0.05177482838066472, 'bull_time_stop': 29, 'bull_use_sma': True, 'bull_use_ema': True, 'bull_use_atr': False, 'bull_use_adx': True, 'bull_use_spike': False, 'bull_rsi_required': False, 'bear_strategy': 'breakout', 'bear_bb_std_mult': 3.150330116527951, 'bear_rsi_os': 28, 'bear_rsi_ob': 75, 'bear_adx_thresh': 24.08353415865743, 'bear_atr_min_pct': 0.00673825934705748, 'bear_atr_max_pct': 0.05808387027705715, 'bear_tp_mult': 2.911114547296832, 'bear_tsl_mult': 0.1484645450699167, 'bear_time_stop': 238, 'bear_use_sma': True, 'bear_use_ema': True, 'bear_use_atr': True, 'bear_use_adx': True, 'bear_use_spike': True, 'bear_rsi_required': True, 'sideways_strategy': 'breakout', 'sideways_bb_std_mult': 3.513718288237329, 'sideways_rsi_os': 35, 'sideways_rsi_ob': 94, 'sideways_adx_thresh': 25.101222742812546, 'sideways_atr_min_pct': 0.0015290921913277181, 'sideways_atr_max_pct': 0.13776016803368366, 'sideways_tp_mult': 2.5172896432634855, 'sideways_tsl_mult': 0.5862107859296048, 'sideways_time_stop': 248, 'sideways_use_sma': True, 'sideways_use_ema': False, 'sideways_use_atr': False, 'sideways_use_adx': False, 'sideways_use_spike': False, 'sideways_rsi_required': True}.
[I 2025-08-31 12:29:30,434] Trial 284 finished with values: [-1000000000.0, 1000000000.0] and parameters: {'p_sma': 43, 'p_std': 31, 'p_atr': 17, 'p_adx': 28, 'rsi_period': 25, 'ema1': 24, 'ema2': 11, 'slip_atr_k': 0.03149886149924673, 'slip_spread_k': 0.6611051779056211, 'spread_hl_frac': 0.0337121114045171, 'bb_std_mult': 2.2510357843678444, 'rsi_os': 29, 'rsi_ob': 72, 'vol_spike': 0.10772582391860885, 'adx_thresh': 5.811604962412437, 'atr_min_pct': 0.0029894067128319836, 'atr_max_pct': 0.10329647814360732, 'tp_mult': 1.6657481220279489, 'tsl_mult': 0.08688832627951831, 'strategy': 'breakout', 'time_stop': 228, 'use_sma': False, 'use_atr': True, 'use_adx': False, 'use_ema': False, 'use_spike': False, 'rsi_required': True, 'edge_k': 0.7696482777594693, 'edge_cap': 0.835192038872323, 'bull_strategy': 'breakout', 'bull_bb_std_mult': 3.0096968469013685, 'bull_rsi_os': 6, 'bull_rsi_ob': 79, 'bull_adx_thresh': 10.603942160523033, 'bull_atr_min_pct': 0.0202239629032681, 'bull_atr_max_pct': 0.07163454736775612, 'bull_tp_mult': 2.7565577191998596, 'bull_tsl_mult': 0.23103428733749745, 'bull_time_stop': 79, 'bull_use_sma': True, 'bull_use_ema': True, 'bull_use_atr': True, 'bull_use_adx': False, 'bull_use_spike': False, 'bull_rsi_required': False, 'bear_strategy': 'breakout', 'bear_bb_std_mult': 3.0027535274888364, 'bear_rsi_os': 28, 'bear_rsi_ob': 71, 'bear_adx_thresh': 24.481445561171686, 'bear_atr_min_pct': 0.011376695711185436, 'bear_atr_max_pct': 0.09625862815713938, 'bear_tp_mult': 2.9003607147144383, 'bear_tsl_mult': 0.14030345922227275, 'bear_time_stop': 237, 'bear_use_sma': True, 'bear_use_ema': True, 'bear_use_atr': True, 'bear_use_adx': True, 'bear_use_spike': True, 'bear_rsi_required': True, 'sideways_strategy': 'breakout', 'sideways_bb_std_mult': 3.5183439351147516, 'sideways_rsi_os': 26, 'sideways_rsi_ob': 80, 'sideways_adx_thresh': 29.19562110751307, 'sideways_atr_min_pct': 0.020801607498184063, 'sideways_atr_max_pct': 0.14285617637551082, 'sideways_tp_mult': 1.6063121401608889, 'sideways_tsl_mult': 0.6760598839554223, 'sideways_time_stop': 73, 'sideways_use_sma': True, 'sideways_use_ema': False, 'sideways_use_atr': False, 'sideways_use_adx': False, 'sideways_use_spike': True, 'sideways_rsi_required': False}.
