[I 2025-08-31 13:41:49,687] Trial 819 finished with values: [-0.010963355731085755, 0.011144657456381931] and parameters: {'p_sma': 15, 'p_std': 21, 'p_atr': 19, 'p_adx': 9, 'rsi_period': 17, 'ema1': 17, 'ema2': 17, 'slip_atr_k': 0.041460135081577976, 'slip_spread_k': 0.45130399760007456, 'spread_hl_frac': 0.02119461672109615, 'bb_std_mult': 1.4896656620392674, 'rsi_os': 31, 'rsi_ob': 63, 'vol_spike': 0.17953442272371703, 'adx_thresh': 10.070716403777913, 'atr_min_pct': 0.012900960015099607, 'atr_max_pct': 0.08770528439141566, 'tp_mult': 1.130575669948422, 'tsl_mult': 0.44247544004054074, 'strategy': 'mean_reversion', 'time_stop': 98, 'use_sma': True, 'use_atr': False, 'use_adx': True, 'use_ema': True, 'use_spike': True, 'rsi_required': False, 'edge_k': 1.360532158525093, 'edge_cap': 0.8920316531438623, 'bull_strategy': 'mean_reversion', 'bull_bb_std_mult': 3.2605146363429123, 'bull_rsi_os': 6, 'bull_rsi_ob': 86, 'bull_adx_thresh': 18.995939876135957, 'bull_atr_min_pct': 0.02254979256706448, 'bull_atr_max_pct': 0.01014012796226893, 'bull_tp_mult': 2.38786953928212, 'bull_tsl_mult': 0.34252298083426036, 'bull_time_stop': 204, 'bull_use_sma': True, 'bull_use_ema': True, 'bull_use_atr': True, 'bull_use_adx': True, 'bull_use_spike': True, 'bull_rsi_required': True, 'bear_strategy': 'breakout', 'bear_bb_std_mult': 2.791618645965025, 'bear_rsi_os': 22, 'bear_rsi_ob': 47, 'bear_adx_thresh': 17.267430623724398, 'bear_atr_min_pct': 0.016624486799834512, 'bear_atr_max_pct': 0.12335276596637511, 'bear_tp_mult': 1.0125352530411877, 'bear_tsl_mult': 0.6454960262203941, 'bear_time_stop': 260, 'bear_use_sma': False, 'bear_use_ema': True, 'bear_use_atr': False, 'bear_use_adx': False, 'bear_use_spike': True, 'bear_rsi_required': True, 'sideways_strategy': 'breakout', 'sideways_bb_std_mult': 2.0047584674699945, 'sideways_rsi_os': 23, 'sideways_rsi_ob': 67, 'sideways_adx_thresh': 22.99627917512282, 'sideways_atr_min_pct': 0.002224617903640015, 'sideways_atr_max_pct': 0.07480478889901916, 'sideways_tp_mult': 1.7546342364629552, 'sideways_tsl_mult': 0.4637027842474318, 'sideways_time_stop': 42, 'sideways_use_sma': False, 'sideways_use_ema': False, 'sideways_use_atr': True, 'sideways_use_adx': True, 'sideways_use_spike': False, 'sideways_rsi_required': True}.
[I 2025-08-31 13:41:49,816] Trial 818 finished with values: [-1000000000.0, 1000000000.0] and parameters: {'p_sma': 33, 'p_std': 21, 'p_atr': 14, 'p_adx': 9, 'rsi_period': 50, 'ema1': 13, 'ema2': 40, 'slip_atr_k': 0.14927204830645452, 'slip_spread_k': 0.4509496587473997, 'spread_hl_frac': 0.0335534470722909, 'bb_std_mult': 2.5023408088673103, 'rsi_os': 40, 'rsi_ob': 93, 'vol_spike': 0.14458931044232376, 'adx_thresh': 13.885201605792, 'atr_min_pct': 0.029470018055699553, 'atr_max_pct': 0.14380382417628468, 'tp_mult': 1.4857191548650173, 'tsl_mult': 0.29772166476363404, 'strategy': 'mean_reversion', 'time_stop': 161, 'use_sma': True, 'use_atr': False, 'use_adx': True, 'use_ema': True, 'use_spike': True, 'rsi_required': False, 'edge_k': 1.1051330760293343, 'edge_cap': 0.6775589128426905, 'bull_strategy': 'mean_reversion', 'bull_bb_std_mult': 0.6003878376939775, 'bull_rsi_os': 42, 'bull_rsi_ob': 85, 'bull_adx_thresh': 26.143654026802267, 'bull_atr_min_pct': 0.022383907195025116, 'bull_atr_max_pct': 0.09697728129458957, 'bull_tp_mult': 2.092624844547347, 'bull_tsl_mult': 0.04333028731789779, 'bull_time_stop': 168, 'bull_use_sma': True, 'bull_use_ema': True, 'bull_use_atr': True, 'bull_use_adx': True, 'bull_use_spike': True, 'bull_rsi_required': True, 'bear_strategy': 'breakout', 'bear_bb_std_mult': 1.435992368372522, 'bear_rsi_os': 22, 'bear_rsi_ob': 68, 'bear_adx_thresh': 17.34379975579734, 'bear_atr_min_pct': 0.01985192053360895, 'bear_atr_max_pct': 0.12368967253391579, 'bear_tp_mult': 1.0455523713643302, 'bear_tsl_mult': 0.24162032321057153, 'bear_time_stop': 260, 'bear_use_sma': False, 'bear_use_ema': True, 'bear_use_atr': False, 'bear_use_adx': False, 'bear_use_spike': True, 'bear_rsi_required': True, 'sideways_strategy': 'breakout', 'sideways_bb_std_mult': 1.8022125279135102, 'sideways_rsi_os': 12, 'sideways_rsi_ob': 92, 'sideways_adx_thresh': 24.0163422224375, 'sideways_atr_min_pct': 0.01577419757960902, 'sideways_atr_max_pct': 0.053359305749716424, 'sideways_tp_mult': 1.7516426903055784, 'sideways_tsl_mult': 0.4836639942748396, 'sideways_time_stop': 43, 'sideways_use_sma': False, 'sideways_use_ema': False, 'sideways_use_atr': True, 'sideways_use_adx': True, 'sideways_use_spike': False, 'sideways_rsi_required': True}.
[I 2025-08-31 13:41:50,727] Trial 822 finished with values: [-1000000000.0, 1000000000.0] and parameters: {'p_sma': 41, 'p_std': 21, 'p_atr': 15, 'p_adx': 20, 'rsi_period': 48, 'ema1': 27, 'ema2': 17, 'slip_atr_k': 0.04185846204309445, 'slip_spread_k': 0.4220288945272567, 'spread_hl_frac': 0.03368469871459052, 'bb_std_mult': 2.695203397734379, 'rsi_os': 31, 'rsi_ob': 90, 'vol_spike': 0.14548151525057892, 'adx_thresh': 8.255521994582308, 'atr_min_pct': 0.02776371279197768, 'atr_max_pct': 0.021146433753485655, 'tp_mult': 1.144107895924303, 'tsl_mult': 0.6812332164463394, 'strategy': 'breakout', 'time_stop': 171, 'use_sma': False, 'use_atr': False, 'use_adx': True, 'use_ema': True, 'use_spike': True, 'rsi_required': False, 'edge_k': 1.0992567919634824, 'edge_cap': 0.6973801698115356, 'bull_strategy': 'mean_reversion', 'bull_bb_std_mult': 3.2761092322594507, 'bull_rsi_os': 9, 'bull_rsi_ob': 85, 'bull_adx_thresh': 19.39441485140939, 'bull_atr_min_pct': 0.022097881987830643, 'bull_atr_max_pct': 0.09651670039170995, 'bull_tp_mult': 2.1098739632341412, 'bull_tsl_mult': 0.22767844643136745, 'bull_time_stop': 166, 'bull_use_sma': False, 'bull_use_ema': True, 'bull_use_atr': True, 'bull_use_adx': True, 'bull_use_spike': True, 'bull_rsi_required': True, 'bear_strategy': 'mean_reversion', 'bear_bb_std_mult': 3.341351767093861, 'bear_rsi_os': 7, 'bear_rsi_ob': 74, 'bear_adx_thresh': 25.821646004386423, 'bear_atr_min_pct': 0.00105577013627072, 'bear_atr_max_pct': 0.01584865508108063, 'bear_tp_mult': 1.2585384496843637, 'bear_tsl_mult': 0.7093464318355069, 'bear_time_stop': 73, 'bear_use_sma': False, 'bear_use_ema': True, 'bear_use_atr': False, 'bear_use_adx': False, 'bear_use_spike': False, 'bear_rsi_required': True, 'sideways_strategy': 'breakout', 'sideways_bb_std_mult': 2.8219608909663823, 'sideways_rsi_os': 12, 'sideways_rsi_ob': 79, 'sideways_adx_thresh': 19.485661631350975, 'sideways_atr_min_pct': 0.015459237897407007, 'sideways_atr_max_pct': 0.14998943420522642, 'sideways_tp_mult': 1.9924690330286623, 'sideways_tsl_mult': 0.2769940081746327, 'sideways_time_stop': 9, 'sideways_use_sma': False, 'sideways_use_ema': False, 'sideways_use_atr': True, 'sideways_use_adx': True, 'sideways_use_spike': True, 'sideways_rsi_required': True}.
[I 2025-08-31 13:41:50,758] Trial 823 finished with values: [-1000000000.0, 1000000000.0] and parameters: {'p_sma': 35, 'p_std': 7, 'p_atr': 19, 'p_adx': 14, 'rsi_period': 52, 'ema1': 15, 'ema2': 21, 'slip_atr_k': 0.04063043267352477, 'slip_spread_k': 0.8847503432018393, 'spread_hl_frac': 0.018361804698971012, 'bb_std_mult': 1.7473715045803573, 'rsi_os': 38, 'rsi_ob': 50, 'vol_spike': 0.17842170961032955, 'adx_thresh': 5.629175905087863, 'atr_min_pct': 0.026276081188642938, 'atr_max_pct': 0.04514543399578338, 'tp_mult': 2.4210629233295977, 'tsl_mult': 0.6294250648566482, 'strategy': 'mean_reversion', 'time_stop': 174, 'use_sma': False, 'use_atr': False, 'use_adx': True, 'use_ema': True, 'use_spike': True, 'rsi_required': False, 'edge_k': 0.5457465299731059, 'edge_cap': 0.6910431263553335, 'bull_strategy': 'mean_reversion', 'bull_bb_std_mult': 2.957275892431358, 'bull_rsi_os': 17, 'bull_rsi_ob': 85, 'bull_adx_thresh': 19.746019526582522, 'bull_atr_min_pct': 0.023313535086485843, 'bull_atr_max_pct': 0.09000942974270491, 'bull_tp_mult': 2.2410907650474305, 'bull_tsl_mult': 0.7790160610559504, 'bull_time_stop': 217, 'bull_use_sma': False, 'bull_use_ema': True, 'bull_use_atr': True, 'bull_use_adx': True, 'bull_use_spike': True, 'bull_rsi_required': True, 'bear_strategy': 'mean_reversion', 'bear_bb_std_mult': 1.4086535116498609, 'bear_rsi_os': 36, 'bear_rsi_ob': 69, 'bear_adx_thresh': 19.004041080156043, 'bear_atr_min_pct': 0.005058610023316298, 'bear_atr_max_pct': 0.05829526980479151, 'bear_tp_mult': 1.4054754390711242, 'bear_tsl_mult': 0.8833690821320623, 'bear_time_stop': 206, 'bear_use_sma': False, 'bear_use_ema': True, 'bear_use_atr': False, 'bear_use_adx': False, 'bear_use_spike': True, 'bear_rsi_required': True, 'sideways_strategy': 'breakout', 'sideways_bb_std_mult': 1.9824352409714718, 'sideways_rsi_os': 31, 'sideways_rsi_ob': 79, 'sideways_adx_thresh': 25.03985351367589, 'sideways_atr_min_pct': 0.0042403426452215145, 'sideways_atr_max_pct': 0.07329815261570116, 'sideways_tp_mult': 1.9828350403016481, 'sideways_tsl_mult': 0.8174323117482878, 'sideways_time_stop': 46, 'sideways_use_sma': False, 'sideways_use_ema': False, 'sideways_use_atr': True, 'sideways_use_adx': True, 'sideways_use_spike': True, 'sideways_rsi_required': True}.
[I 2025-08-31 13:42:18,280] Trial 824 finished with values: [-1000000000.0, 1000000000.0] and parameters: {'p_sma': 27, 'p_std': 21, 'p_atr': 15, 'p_adx': 20, 'rsi_period': 52, 'ema1': 9, 'ema2': 21, 'slip_atr_k': 0.04012788764887623, 'slip_spread_k': 0.8052773102183828, 'spread_hl_frac': 0.018328050470722, 'bb_std_mult': 2.2543622361421196, 'rsi_os': 36, 'rsi_ob': 89, 'vol_spike': 0.030230797359170256, 'adx_thresh': 8.07821345247376, 'atr_min_pct': 0.026000344037755956, 'atr_max_pct': 0.10929932547024057, 'tp_mult': 1.7056902938513026, 'tsl_mult': 0.6203926905292863, 'strategy': 'breakout', 'time_stop': 173, 'use_sma': False, 'use_atr': False, 'use_adx': True, 'use_ema': True, 'use_spike': True, 'rsi_required': False, 'edge_k': 1.8865521344199094, 'edge_cap': 0.5200521436860018, 'bull_strategy': 'mean_reversion', 'bull_bb_std_mult': 2.959268816756643, 'bull_rsi_os': 19, 'bull_rsi_ob': 85, 'bull_adx_thresh': 18.10898053787259, 'bull_atr_min_pct': 0.023505442885882463, 'bull_atr_max_pct': 0.14414836622921998, 'bull_tp_mult': 2.2380383827134462, 'bull_tsl_mult': 0.7758307392376698, 'bull_time_stop': 207, 'bull_use_sma': False, 'bull_use_ema': True, 'bull_use_atr': True, 'bull_use_adx': True, 'bull_use_spike': True, 'bull_rsi_required': True, 'bear_strategy': 'mean_reversion', 'bear_bb_std_mult': 2.520499774051659, 'bear_rsi_os': 8, 'bear_rsi_ob': 75, 'bear_adx_thresh': 19.25807326092846, 'bear_atr_min_pct': 0.004837880528771767, 'bear_atr_max_pct': 0.047600093144309186, 'bear_tp_mult': 1.265268997425255, 'bear_tsl_mult': 0.6593306298014573, 'bear_time_stop': 74, 'bear_use_sma': False, 'bear_use_ema': True, 'bear_use_atr': False, 'bear_use_adx': False, 'bear_use_spike': False, 'bear_rsi_required': True, 'sideways_strategy': 'breakout', 'sideways_bb_std_mult': 2.8226334577479437, 'sideways_rsi_os': 31, 'sideways_rsi_ob': 69, 'sideways_adx_thresh': 22.64976782583069, 'sideways_atr_min_pct': 0.004088450351261645, 'sideways_atr_max_pct': 0.14765667903957844, 'sideways_tp_mult': 1.639819800451678, 'sideways_tsl_mult': 0.291724319788218, 'sideways_time_stop': 50, 'sideways_use_sma': False, 'sideways_use_ema': False, 'sideways_use_atr': True, 'sideways_use_adx': True, 'sideways_use_spike': True, 'sideways_rsi_required': False}.
[I 2025-08-31 13:42:18,680] Trial 821 finished with values: [-1000000000.0, 1000000000.0] and parameters: {'p_sma': 15, 'p_std': 21, 'p_atr': 15, 'p_adx': 14, 'rsi_period': 48, 'ema1': 15, 'ema2': 17, 'slip_atr_k': 0.040856408474918046, 'slip_spread_k': 0.423742746934234, 'spread_hl_frac': 0.0037844020973802975, 'bb_std_mult': 2.2370372011741937, 'rsi_os': 38, 'rsi_ob': 50, 'vol_spike': 0.030475137008586135, 'adx_thresh': 26.172933475521116, 'atr_min_pct': 0.013784946557222854, 'atr_max_pct': 0.10556795472345469, 'tp_mult': 2.439345007493196, 'tsl_mult': 0.5829997629388619, 'strategy': 'breakout', 'time_stop': 101, 'use_sma': False, 'use_atr': False, 'use_adx': True, 'use_ema': True, 'use_spike': True, 'rsi_required': False, 'edge_k': 0.8853383508014966, 'edge_cap': 0.6898597974988969, 'bull_strategy': 'mean_reversion', 'bull_bb_std_mult': 2.9633200202386782, 'bull_rsi_os': 6, 'bull_rsi_ob': 85, 'bull_adx_thresh': 19.475532485207353, 'bull_atr_min_pct': 0.022015092986285803, 'bull_atr_max_pct': 0.09751039729013192, 'bull_tp_mult': 2.2190163324314125, 'bull_tsl_mult': 0.2310824752702869, 'bull_time_stop': 207, 'bull_use_sma': False, 'bull_use_ema': True, 'bull_use_atr': True, 'bull_use_adx': True, 'bull_use_spike': True, 'bull_rsi_required': True, 'bear_strategy': 'mean_reversion', 'bear_bb_std_mult': 2.526145559852576, 'bear_rsi_os': 7, 'bear_rsi_ob': 69, 'bear_adx_thresh': 25.926022501277956, 'bear_atr_min_pct': 0.006647982654603639, 'bear_atr_max_pct': 0.03853245520210239, 'bear_tp_mult': 1.0106750518983878, 'bear_tsl_mult': 0.7150160578865439, 'bear_time_stop': 47, 'bear_use_sma': False, 'bear_use_ema': True, 'bear_use_atr': False, 'bear_use_adx': False, 'bear_use_spike': False, 'bear_rsi_required': True, 'sideways_strategy': 'breakout', 'sideways_bb_std_mult': 0.7297018386315297, 'sideways_rsi_os': 12, 'sideways_rsi_ob': 67, 'sideways_adx_thresh': 24.821464288394584, 'sideways_atr_min_pct': 0.002665436237588544, 'sideways_atr_max_pct': 0.0740951377880449, 'sideways_tp_mult': 1.08462821943578, 'sideways_tsl_mult': 0.35283561663274476, 'sideways_time_stop': 5, 'sideways_use_sma': False, 'sideways_use_ema': False, 'sideways_use_atr': True, 'sideways_use_adx': True, 'sideways_use_spike': True, 'sideways_rsi_required': True}.
[I 2025-08-31 13:42:23,551] Trial 826 finished with values: [-0.08433518723076772, 0.08373258703998601] and parameters: {'p_sma': 30, 'p_std': 18, 'p_atr': 15, 'p_adx': 14, 'rsi_period': 59, 'ema1': 16, 'ema2': 45, 'slip_atr_k': 0.04706601152315844, 'slip_spread_k': 0.4850225361179201, 'spread_hl_frac': 0.019020930383883243, 'bb_std_mult': 2.2158166676266045, 'rsi_os': 7, 'rsi_ob': 95, 'vol_spike': 0.02717202587991071, 'adx_thresh': 9.151083129750607, 'atr_min_pct': 0.025209283951476622, 'atr_max_pct': 0.10944438597562445, 'tp_mult': 1.6496142191893042, 'tsl_mult': 0.9717576032570122, 'strategy': 'breakout', 'time_stop': 99, 'use_sma': False, 'use_atr': False, 'use_adx': True, 'use_ema': False, 'use_spike': True, 'rsi_required': False, 'edge_k': 0.8951137448454713, 'edge_cap': 0.710793564941242, 'bull_strategy': 'mean_reversion', 'bull_bb_std_mult': 2.8624152859316383, 'bull_rsi_os': 6, 'bull_rsi_ob': 85, 'bull_adx_thresh': 17.910150050601505, 'bull_atr_min_pct': 0.021159498350827532, 'bull_atr_max_pct': 0.01434910799377094, 'bull_tp_mult': 2.2834737364917115, 'bull_tsl_mult': 0.29451744296968707, 'bull_time_stop': 181, 'bull_use_sma': True, 'bull_use_ema': True, 'bull_use_atr': True, 'bull_use_adx': True, 'bull_use_spike': True, 'bull_rsi_required': True, 'bear_strategy': 'breakout', 'bear_bb_std_mult': 3.2507936364934467, 'bear_rsi_os': 41, 'bear_rsi_ob': 71, 'bear_adx_thresh': 19.612719170104103, 'bear_atr_min_pct': 0.002401788937075764, 'bear_atr_max_pct': 0.04782273463520279, 'bear_tp_mult': 1.3119951539493446, 'bear_tsl_mult': 0.6270863787392347, 'bear_time_stop': 48, 'bear_use_sma': False, 'bear_use_ema': True, 'bear_use_atr': False, 'bear_use_adx': False, 'bear_use_spike': True, 'bear_rsi_required': True, 'sideways_strategy': 'mean_reversion', 'sideways_bb_std_mult': 2.617571051943691, 'sideways_rsi_os': 29, 'sideways_rsi_ob': 76, 'sideways_adx_thresh': 24.690261933755405, 'sideways_atr_min_pct': 0.002684560425079388, 'sideways_atr_max_pct': 0.09472943499946096, 'sideways_tp_mult': 1.100897871911795, 'sideways_tsl_mult': 0.1320986970429882, 'sideways_time_stop': 48, 'sideways_use_sma': False, 'sideways_use_ema': True, 'sideways_use_atr': True, 'sideways_use_adx': True, 'sideways_use_spike': False, 'sideways_rsi_required': False}.
[I 2025-08-31 13:42:23,640] Trial 825 finished with values: [-1000000000.0, 1000000000.0] and parameters: {'p_sma': 13, 'p_std': 38, 'p_atr': 16, 'p_adx': 14, 'rsi_period': 52, 'ema1': 15, 'ema2': 51, 'slip_atr_k': 0.09850502085145436, 'slip_spread_k': 0.881854494342648, 'spread_hl_frac': 0.018238528029020554, 'bb_std_mult': 1.5528162693393084, 'rsi_os': 35, 'rsi_ob': 50, 'vol_spike': 0.23193668172840787, 'adx_thresh': 25.720621059801204, 'atr_min_pct': 0.0139945867187604, 'atr_max_pct': 0.04402957412341601, 'tp_mult': 2.423306983307936, 'tsl_mult': 0.8264302614580012, 'strategy': 'breakout', 'time_stop': 176, 'use_sma': False, 'use_atr': False, 'use_adx': True, 'use_ema': False, 'use_spike': True, 'rsi_required': False, 'edge_k': 0.89069536914755, 'edge_cap': 0.7101079781953737, 'bull_strategy': 'mean_reversion', 'bull_bb_std_mult': 1.7444443568270573, 'bull_rsi_os': 6, 'bull_rsi_ob': 85, 'bull_adx_thresh': 27.36092507930259, 'bull_atr_min_pct': 0.021066158773122342, 'bull_atr_max_pct': 0.027012207568100598, 'bull_tp_mult': 2.2545156517177003, 'bull_tsl_mult': 0.2987402494009725, 'bull_time_stop': 207, 'bull_use_sma': True, 'bull_use_ema': True, 'bull_use_atr': True, 'bull_use_adx': True, 'bull_use_spike': True, 'bull_rsi_required': True, 'bear_strategy': 'breakout', 'bear_bb_std_mult': 3.2378896153358334, 'bear_rsi_os': 31, 'bear_rsi_ob': 69, 'bear_adx_thresh': 19.13312834544319, 'bear_atr_min_pct': 0.006719524594963236, 'bear_atr_max_pct': 0.12977363872217668, 'bear_tp_mult': 1.4018962483570074, 'bear_tsl_mult': 0.28408682118961814, 'bear_time_stop': 5, 'bear_use_sma': False, 'bear_use_ema': True, 'bear_use_atr': False, 'bear_use_adx': False, 'bear_use_spike': True, 'bear_rsi_required': True, 'sideways_strategy': 'mean_reversion', 'sideways_bb_std_mult': 1.9601017134316483, 'sideways_rsi_os': 31, 'sideways_rsi_ob': 67, 'sideways_adx_thresh': 24.979302798759655, 'sideways_atr_min_pct': 0.0040368983810197025, 'sideways_atr_max_pct': 0.032847442699696604, 'sideways_tp_mult': 2.850437952718934, 'sideways_tsl_mult': 0.34651424465316083, 'sideways_time_stop': 48, 'sideways_use_sma': False, 'sideways_use_ema': True, 'sideways_use_atr': True, 'sideways_use_adx': True, 'sideways_use_spike': False, 'sideways_rsi_required': False}.
[I 2025-08-31 13:42:55,757] Trial 827 finished with values: [-1000000000.0, 1000000000.0] and parameters: {'p_sma': 15, 'p_std': 19, 'p_atr': 16, 'p_adx': 14, 'rsi_period': 46, 'ema1': 11, 'ema2': 42, 'slip_atr_k': 0.1307389456180676, 'slip_spread_k': 0.4749363482709614, 'spread_hl_frac': 0.019993257113828978, 'bb_std_mult': 3.543702782553952, 'rsi_os': 7, 'rsi_ob': 95, 'vol_spike': 0.03802729823739652, 'adx_thresh': 33.51942257662447, 'atr_min_pct': 0.015098404109490213, 'atr_max_pct': 0.05606695653523803, 'tp_mult': 2.5309618067994464, 'tsl_mult': 0.18169342084125928, 'strategy': 'breakout', 'time_stop': 12, 'use_sma': False, 'use_atr': False, 'use_adx': True, 'use_ema': False, 'use_spike': True, 'rsi_required': False, 'edge_k': 1.5207338127792174, 'edge_cap': 0.6914781231454625, 'bull_strategy': 'mean_reversion', 'bull_bb_std_mult': 2.6403467884544027, 'bull_rsi_os': 6, 'bull_rsi_ob': 86, 'bull_adx_thresh': 18.783483391917326, 'bull_atr_min_pct': 0.021101977867453246, 'bull_atr_max_pct': 0.07275738054117627, 'bull_tp_mult': 2.276022984206844, 'bull_tsl_mult': 0.3451019525310184, 'bull_time_stop': 181, 'bull_use_sma': True, 'bull_use_ema': False, 'bull_use_atr': True, 'bull_use_adx': False, 'bull_use_spike': True, 'bull_rsi_required': True, 'bear_strategy': 'breakout', 'bear_bb_std_mult': 3.274295526207947, 'bear_rsi_os': 31, 'bear_rsi_ob': 71, 'bear_adx_thresh': 19.751674113143196, 'bear_atr_min_pct': 0.018665597340074468, 'bear_atr_max_pct': 0.03842292335275935, 'bear_tp_mult': 1.194728019471136, 'bear_tsl_mult': 0.6106344358229128, 'bear_time_stop': 63, 'bear_use_sma': False, 'bear_use_ema': True, 'bear_use_atr': False, 'bear_use_adx': False, 'bear_use_spike': True, 'bear_rsi_required': True, 'sideways_strategy': 'mean_reversion', 'sideways_bb_std_mult': 0.8488392942240739, 'sideways_rsi_os': 23, 'sideways_rsi_ob': 76, 'sideways_adx_thresh': 9.969491482877684, 'sideways_atr_min_pct': 0.002754098832510073, 'sideways_atr_max_pct': 0.01292993848791904, 'sideways_tp_mult': 1.79789456465922, 'sideways_tsl_mult': 0.3538013966145773, 'sideways_time_stop': 45, 'sideways_use_sma': False, 'sideways_use_ema': True, 'sideways_use_atr': True, 'sideways_use_adx': True, 'sideways_use_spike': False, 'sideways_rsi_required': True}.
