[I 2025-08-31 12:39:24,733] Trial 370 finished with values: [-1000000000.0, 1000000000.0] and parameters: {'p_sma': 51, 'p_std': 33, 'p_atr': 25, 'p_adx': 16, 'rsi_period': 76, 'ema1': 19, 'ema2': 18, 'slip_atr_k': 0.01163032529633443, 'slip_spread_k': 0.7163430497342063, 'spread_hl_frac': 0.02710256499619439, 'bb_std_mult': 2.7704444582428436, 'rsi_os': 42, 'rsi_ob': 85, 'vol_spike': 0.09972577311821318, 'adx_thresh': 23.136722835225655, 'atr_min_pct': 0.003154386309280638, 'atr_max_pct': 0.13174278135264156, 'tp_mult': 2.558958355853948, 'tsl_mult': 0.1692514132080139, 'strategy': 'mean_reversion', 'time_stop': 209, 'use_sma': False, 'use_atr': True, 'use_adx': False, 'use_ema': False, 'use_spike': False, 'rsi_required': True, 'edge_k': 0.7739159268755385, 'edge_cap': 0.46398787986672746, 'bull_strategy': 'breakout', 'bull_bb_std_mult': 3.0683085352995207, 'bull_rsi_os': 8, 'bull_rsi_ob': 83, 'bull_adx_thresh': 27.00606706224479, 'bull_atr_min_pct': 0.022823199021743783, 'bull_atr_max_pct': 0.05273040342905591, 'bull_tp_mult': 2.813342130862084, 'bull_tsl_mult': 0.2650251287208, 'bull_time_stop': 79, 'bull_use_sma': True, 'bull_use_ema': True, 'bull_use_atr': False, 'bull_use_adx': False, 'bull_use_spike': False, 'bull_rsi_required': False, 'bear_strategy': 'breakout', 'bear_bb_std_mult': 3.279879856676966, 'bear_rsi_os': 33, 'bear_rsi_ob': 93, 'bear_adx_thresh': 8.958911991542003, 'bear_atr_min_pct': 0.02705750303415673, 'bear_atr_max_pct': 0.07141458703763352, 'bear_tp_mult': 2.7357626546526097, 'bear_tsl_mult': 0.12766260166051063, 'bear_time_stop': 58, 'bear_use_sma': True, 'bear_use_ema': True, 'bear_use_atr': True, 'bear_use_adx': True, 'bear_use_spike': True, 'bear_rsi_required': True, 'sideways_strategy': 'mean_reversion', 'sideways_bb_std_mult': 2.3263389495917184, 'sideways_rsi_os': 29, 'sideways_rsi_ob': 85, 'sideways_adx_thresh': 12.688433572245376, 'sideways_atr_min_pct': 0.000891872523724043, 'sideways_atr_max_pct': 0.1400724262218913, 'sideways_tp_mult': 1.2605262045580012, 'sideways_tsl_mult': 0.6070404977518132, 'sideways_time_stop': 237, 'sideways_use_sma': True, 'sideways_use_ema': False, 'sideways_use_atr': False, 'sideways_use_adx': False, 'sideways_use_spike': True, 'sideways_rsi_required': False}.
[I 2025-08-31 12:39:24,842] Trial 369 finished with values: [-1000000000.0, 1000000000.0] and parameters: {'p_sma': 53, 'p_std': 33, 'p_atr': 12, 'p_adx': 17, 'rsi_period': 79, 'ema1': 11, 'ema2': 16, 'slip_atr_k': 0.009568742497613362, 'slip_spread_k': 0.3557706208620346, 'spread_hl_frac': 0.02705443552945963, 'bb_std_mult': 2.5237323412687047, 'rsi_os': 16, 'rsi_ob': 80, 'vol_spike': 0.06470115153781882, 'adx_thresh': 8.39914992710714, 'atr_min_pct': 0.00371914706329317, 'atr_max_pct': 0.14159525141928414, 'tp_mult': 2.681053555531287, 'tsl_mult': 0.17342647155926044, 'strategy': 'mean_reversion', 'time_stop': 162, 'use_sma': False, 'use_atr': True, 'use_adx': False, 'use_ema': True, 'use_spike': False, 'rsi_required': True, 'edge_k': 0.7746804982460507, 'edge_cap': 0.13961336611614816, 'bull_strategy': 'breakout', 'bull_bb_std_mult': 1.0511733725471972, 'bull_rsi_os': 18, 'bull_rsi_ob': 83, 'bull_adx_thresh': 14.253920739136401, 'bull_atr_min_pct': 0.013624648770050433, 'bull_atr_max_pct': 0.13654596188040063, 'bull_tp_mult': 2.821559904679411, 'bull_tsl_mult': 0.026079750717059036, 'bull_time_stop': 213, 'bull_use_sma': True, 'bull_use_ema': True, 'bull_use_atr': False, 'bull_use_adx': True, 'bull_use_spike': False, 'bull_rsi_required': False, 'bear_strategy': 'breakout', 'bear_bb_std_mult': 3.5571570433730653, 'bear_rsi_os': 44, 'bear_rsi_ob': 92, 'bear_adx_thresh': 16.51638180071445, 'bear_atr_min_pct': 0.027177896857551367, 'bear_atr_max_pct': 0.10042066964312961, 'bear_tp_mult': 2.186054261084182, 'bear_tsl_mult': 0.15970119227367904, 'bear_time_stop': 57, 'bear_use_sma': True, 'bear_use_ema': True, 'bear_use_atr': True, 'bear_use_adx': True, 'bear_use_spike': True, 'bear_rsi_required': True, 'sideways_strategy': 'breakout', 'sideways_bb_std_mult': 2.3160803110585646, 'sideways_rsi_os': 12, 'sideways_rsi_ob': 85, 'sideways_adx_thresh': 12.74111479491205, 'sideways_atr_min_pct': 0.02982588542500833, 'sideways_atr_max_pct': 0.01607690142110163, 'sideways_tp_mult': 1.2591799976717635, 'sideways_tsl_mult': 0.6645712897933665, 'sideways_time_stop': 206, 'sideways_use_sma': True, 'sideways_use_ema': False, 'sideways_use_atr': False, 'sideways_use_adx': False, 'sideways_use_spike': True, 'sideways_rsi_required': False}.
[I 2025-08-31 12:39:55,796] Trial 371 finished with values: [-1000000000.0, 1000000000.0] and parameters: {'p_sma': 53, 'p_std': 33, 'p_atr': 10, 'p_adx': 14, 'rsi_period': 42, 'ema1': 19, 'ema2': 16, 'slip_atr_k': 0.06743710435749212, 'slip_spread_k': 0.6437148892383393, 'spread_hl_frac': 0.02694108174607743, 'bb_std_mult': 2.624328376067639, 'rsi_os': 17, 'rsi_ob': 72, 'vol_spike': 0.21126016695067842, 'adx_thresh': 23.161155977856552, 'atr_min_pct': 0.0029238013648231415, 'atr_max_pct': 0.02142227927062923, 'tp_mult': 2.561690834427398, 'tsl_mult': 0.8109436154830033, 'strategy': 'mean_reversion', 'time_stop': 205, 'use_sma': False, 'use_atr': True, 'use_adx': False, 'use_ema': False, 'use_spike': False, 'rsi_required': True, 'edge_k': 0.7757497941521205, 'edge_cap': 0.07984182050664801, 'bull_strategy': 'breakout', 'bull_bb_std_mult': 1.0424336705566883, 'bull_rsi_os': 8, 'bull_rsi_ob': 81, 'bull_adx_thresh': 18.4885175640409, 'bull_atr_min_pct': 0.023154230596663748, 'bull_atr_max_pct': 0.12074694805323039, 'bull_tp_mult': 2.816984049102425, 'bull_tsl_mult': 0.27360226361927914, 'bull_time_stop': 146, 'bull_use_sma': True, 'bull_use_ema': True, 'bull_use_atr': False, 'bull_use_adx': False, 'bull_use_spike': False, 'bull_rsi_required': False, 'bear_strategy': 'breakout', 'bear_bb_std_mult': 2.550047897114122, 'bear_rsi_os': 44, 'bear_rsi_ob': 93, 'bear_adx_thresh': 9.614701385129816, 'bear_atr_min_pct': 0.02711992359711453, 'bear_atr_max_pct': 0.013869872958437668, 'bear_tp_mult': 2.6482903514139977, 'bear_tsl_mult': 0.4154934968082956, 'bear_time_stop': 248, 'bear_use_sma': True, 'bear_use_ema': True, 'bear_use_atr': True, 'bear_use_adx': True, 'bear_use_spike': True, 'bear_rsi_required': True, 'sideways_strategy': 'mean_reversion', 'sideways_bb_std_mult': 1.2402692342977157, 'sideways_rsi_os': 36, 'sideways_rsi_ob': 84, 'sideways_adx_thresh': 10.650684550518317, 'sideways_atr_min_pct': 0.014819717113880151, 'sideways_atr_max_pct': 0.03553271588370011, 'sideways_tp_mult': 1.3798070948677563, 'sideways_tsl_mult': 0.6099855615986792, 'sideways_time_stop': 192, 'sideways_use_sma': True, 'sideways_use_ema': False, 'sideways_use_atr': False, 'sideways_use_adx': False, 'sideways_use_spike': True, 'sideways_rsi_required': False}.
[I 2025-08-31 12:39:58,609] Trial 374 finished with values: [-1000000000.0, 1000000000.0] and parameters: {'p_sma': 51, 'p_std': 29, 'p_atr': 10, 'p_adx': 14, 'rsi_period': 53, 'ema1': 5, 'ema2': 16, 'slip_atr_k': 0.06844664388120336, 'slip_spread_k': 0.9393519488249142, 'spread_hl_frac': 0.028441301453254283, 'bb_std_mult': 1.2596536951531003, 'rsi_os': 27, 'rsi_ob': 56, 'vol_spike': 0.0695646239441544, 'adx_thresh': 15.758951122637402, 'atr_min_pct': 0.001923215655531484, 'atr_max_pct': 0.046829480253675816, 'tp_mult': 2.57124798642692, 'tsl_mult': 0.8092395545431891, 'strategy': 'mean_reversion', 'time_stop': 204, 'use_sma': False, 'use_atr': True, 'use_adx': False, 'use_ema': False, 'use_spike': False, 'rsi_required': True, 'edge_k': 0.10434793501646267, 'edge_cap': 0.7954813686182146, 'bull_strategy': 'breakout', 'bull_bb_std_mult': 2.9181334196215576, 'bull_rsi_os': 11, 'bull_rsi_ob': 81, 'bull_adx_thresh': 9.159947152503968, 'bull_atr_min_pct': 0.020683983323734806, 'bull_atr_max_pct': 0.06578248503519399, 'bull_tp_mult': 2.444509008406987, 'bull_tsl_mult': 0.748588357244693, 'bull_time_stop': 222, 'bull_use_sma': True, 'bull_use_ema': True, 'bull_use_atr': False, 'bull_use_adx': False, 'bull_use_spike': True, 'bull_rsi_required': False, 'bear_strategy': 'breakout', 'bear_bb_std_mult': 2.559625024159461, 'bear_rsi_os': 50, 'bear_rsi_ob': 74, 'bear_adx_thresh': 11.593177040888396, 'bear_atr_min_pct': 0.025738253984008145, 'bear_atr_max_pct': 0.09006240199451156, 'bear_tp_mult': 2.7755373061456656, 'bear_tsl_mult': 0.2135322650712015, 'bear_time_stop': 23, 'bear_use_sma': True, 'bear_use_ema': True, 'bear_use_atr': True, 'bear_use_adx': True, 'bear_use_spike': False, 'bear_rsi_required': True, 'sideways_strategy': 'mean_reversion', 'sideways_bb_std_mult': 3.4133245577834446, 'sideways_rsi_os': 36, 'sideways_rsi_ob': 80, 'sideways_adx_thresh': 10.705212165661038, 'sideways_atr_min_pct': 0.0013863877296614083, 'sideways_atr_max_pct': 0.12286964974894621, 'sideways_tp_mult': 1.842795399153384, 'sideways_tsl_mult': 0.6910339884655798, 'sideways_time_stop': 5, 'sideways_use_sma': True, 'sideways_use_ema': False, 'sideways_use_atr': False, 'sideways_use_adx': True, 'sideways_use_spike': False, 'sideways_rsi_required': True}.
[I 2025-08-31 12:39:58,763] Trial 373 finished with values: [-0.01578341846824327, 0.01634422432452614] and parameters: {'p_sma': 51, 'p_std': 28, 'p_atr': 15, 'p_adx': 14, 'rsi_period': 79, 'ema1': 5, 'ema2': 16, 'slip_atr_k': 0.07036871478580095, 'slip_spread_k': 0.8873485804115444, 'spread_hl_frac': 0.0499640594016283, 'bb_std_mult': 3.257743958031389, 'rsi_os': 40, 'rsi_ob': 77, 'vol_spike': 0.2851168263170495, 'adx_thresh': 15.888948088156644, 'atr_min_pct': 0.0019597932058008733, 'atr_max_pct': 0.05729982537499956, 'tp_mult': 2.6748143536555395, 'tsl_mult': 0.7224438406191751, 'strategy': 'mean_reversion', 'time_stop': 202, 'use_sma': False, 'use_atr': True, 'use_adx': False, 'use_ema': True, 'use_spike': False, 'rsi_required': True, 'edge_k': 0.12206119834319162, 'edge_cap': 0.8003818948531971, 'bull_strategy': 'breakout', 'bull_bb_std_mult': 1.0449588180263545, 'bull_rsi_os': 11, 'bull_rsi_ob': 69, 'bull_adx_thresh': 9.142190810496253, 'bull_atr_min_pct': 0.021373927049552245, 'bull_atr_max_pct': 0.06523444965320821, 'bull_tp_mult': 2.430537940220932, 'bull_tsl_mult': 0.27887048596683406, 'bull_time_stop': 188, 'bull_use_sma': True, 'bull_use_ema': True, 'bull_use_atr': False, 'bull_use_adx': True, 'bull_use_spike': True, 'bull_rsi_required': False, 'bear_strategy': 'breakout', 'bear_bb_std_mult': 2.7031267358965816, 'bear_rsi_os': 29, 'bear_rsi_ob': 72, 'bear_adx_thresh': 30.232943012996188, 'bear_atr_min_pct': 0.027889817063593548, 'bear_atr_max_pct': 0.059025859058596974, 'bear_tp_mult': 2.191831008835881, 'bear_tsl_mult': 0.20558005144365676, 'bear_time_stop': 262, 'bear_use_sma': True, 'bear_use_ema': True, 'bear_use_atr': True, 'bear_use_adx': True, 'bear_use_spike': False, 'bear_rsi_required': True, 'sideways_strategy': 'breakout', 'sideways_bb_std_mult': 2.832825441961346, 'sideways_rsi_os': 36, 'sideways_rsi_ob': 82, 'sideways_adx_thresh': 10.771998691263907, 'sideways_atr_min_pct': 0.00140188760027332, 'sideways_atr_max_pct': 0.12371606759123059, 'sideways_tp_mult': 1.8441074500372252, 'sideways_tsl_mult': 0.12645828056730746, 'sideways_time_stop': 211, 'sideways_use_sma': True, 'sideways_use_ema': False, 'sideways_use_atr': False, 'sideways_use_adx': True, 'sideways_use_spike': False, 'sideways_rsi_required': False}.
[I 2025-08-31 12:39:59,170] Trial 372 finished with values: [-1000000000.0, 1000000000.0] and parameters: {'p_sma': 51, 'p_std': 29, 'p_atr': 11, 'p_adx': 16, 'rsi_period': 76, 'ema1': 21, 'ema2': 16, 'slip_atr_k': 0.012652728607260851, 'slip_spread_k': 0.7167945388726729, 'spread_hl_frac': 0.034764357392786896, 'bb_std_mult': 2.77202159206567, 'rsi_os': 40, 'rsi_ob': 72, 'vol_spike': 0.14009331200805036, 'adx_thresh': 23.147960694016625, 'atr_min_pct': 0.0037429990341122966, 'atr_max_pct': 0.10753080666329148, 'tp_mult': 1.2101821192378175, 'tsl_mult': 0.8127862795268026, 'strategy': 'mean_reversion', 'time_stop': 207, 'use_sma': False, 'use_atr': True, 'use_adx': False, 'use_ema': False, 'use_spike': False, 'rsi_required': True, 'edge_k': 0.7632411420911724, 'edge_cap': 0.7972869553356188, 'bull_strategy': 'breakout', 'bull_bb_std_mult': 3.0660402972240224, 'bull_rsi_os': 11, 'bull_rsi_ob': 79, 'bull_adx_thresh': 18.65313035127463, 'bull_atr_min_pct': 0.022396936822274793, 'bull_atr_max_pct': 0.13965324097259518, 'bull_tp_mult': 1.0797418748693612, 'bull_tsl_mult': 0.9244845946050342, 'bull_time_stop': 222, 'bull_use_sma': True, 'bull_use_ema': True, 'bull_use_atr': False, 'bull_use_adx': False, 'bull_use_spike': True, 'bull_rsi_required': False, 'bear_strategy': 'breakout', 'bear_bb_std_mult': 0.6506230878866861, 'bear_rsi_os': 28, 'bear_rsi_ob': 74, 'bear_adx_thresh': 32.92549174158066, 'bear_atr_min_pct': 0.02557257806348375, 'bear_atr_max_pct': 0.0503385578693235, 'bear_tp_mult': 2.762793770467809, 'bear_tsl_mult': 0.12624591697972629, 'bear_time_stop': 263, 'bear_use_sma': True, 'bear_use_ema': True, 'bear_use_atr': True, 'bear_use_adx': True, 'bear_use_spike': False, 'bear_rsi_required': True, 'sideways_strategy': 'mean_reversion', 'sideways_bb_std_mult': 3.4280804343125784, 'sideways_rsi_os': 36, 'sideways_rsi_ob': 58, 'sideways_adx_thresh': 12.6904535257132, 'sideways_atr_min_pct': 0.028900041009037807, 'sideways_atr_max_pct': 0.03360805434728386, 'sideways_tp_mult': 1.4955281492163242, 'sideways_tsl_mult': 0.570309969723787, 'sideways_time_stop': 236, 'sideways_use_sma': True, 'sideways_use_ema': False, 'sideways_use_atr': False, 'sideways_use_adx': True, 'sideways_use_spike': True, 'sideways_rsi_required': False}.
[I 2025-08-31 12:40:30,502] Trial 377 finished with values: [-1000000000.0, 1000000000.0] and parameters: {'p_sma': 51, 'p_std': 24, 'p_atr': 15, 'p_adx': 15, 'rsi_period': 77, 'ema1': 27, 'ema2': 17, 'slip_atr_k': 0.05501984922155037, 'slip_spread_k': 0.8843974664709553, 'spread_hl_frac': 0.021964719077392055, 'bb_std_mult': 3.283378295888252, 'rsi_os': 48, 'rsi_ob': 76, 'vol_spike': 0.28756011394853415, 'adx_thresh': 21.049640906016126, 'atr_min_pct': 0.0018818007478964946, 'atr_max_pct': 0.13308086206900385, 'tp_mult': 1.7915825040566347, 'tsl_mult': 0.9994304819164641, 'strategy': 'mean_reversion', 'time_stop': 279, 'use_sma': False, 'use_atr': True, 'use_adx': False, 'use_ema': False, 'use_spike': False, 'rsi_required': True, 'edge_k': 0.8290644661147925, 'edge_cap': 0.7266411970276628, 'bull_strategy': 'breakout', 'bull_bb_std_mult': 3.040887164644436, 'bull_rsi_os': 32, 'bull_rsi_ob': 79, 'bull_adx_thresh': 19.481429157943182, 'bull_atr_min_pct': 0.02137912287353127, 'bull_atr_max_pct': 0.11076806825075407, 'bull_tp_mult': 2.7000816981150435, 'bull_tsl_mult': 0.45659909950945277, 'bull_time_stop': 91, 'bull_use_sma': True, 'bull_use_ema': True, 'bull_use_atr': False, 'bull_use_adx': True, 'bull_use_spike': True, 'bull_rsi_required': False, 'bear_strategy': 'breakout', 'bear_bb_std_mult': 2.791115781611072, 'bear_rsi_os': 29, 'bear_rsi_ob': 72, 'bear_adx_thresh': 33.9572317001546, 'bear_atr_min_pct': 0.027881252709603305, 'bear_atr_max_pct': 0.14969644154740952, 'bear_tp_mult': 1.0965189588542095, 'bear_tsl_mult': 0.7895297592877345, 'bear_time_stop': 210, 'bear_use_sma': True, 'bear_use_ema': True, 'bear_use_atr': True, 'bear_use_adx': True, 'bear_use_spike': False, 'bear_rsi_required': True, 'sideways_strategy': 'breakout', 'sideways_bb_std_mult': 3.5293728501464026, 'sideways_rsi_os': 32, 'sideways_rsi_ob': 82, 'sideways_adx_thresh': 11.73807020553423, 'sideways_atr_min_pct': 0.0006778416050464814, 'sideways_atr_max_pct': 0.13200691530238412, 'sideways_tp_mult': 2.1366499080211985, 'sideways_tsl_mult': 0.5684557979179954, 'sideways_time_stop': 223, 'sideways_use_sma': True, 'sideways_use_ema': False, 'sideways_use_atr': False, 'sideways_use_adx': True, 'sideways_use_spike': False, 'sideways_rsi_required': True}.
[I 2025-08-31 12:40:31,068] Trial 376 finished with values: [-1000000000.0, 1000000000.0] and parameters: {'p_sma': 51, 'p_std': 28, 'p_atr': 14, 'p_adx': 16, 'rsi_period': 77, 'ema1': 5, 'ema2': 17, 'slip_atr_k': 0.04480718028268376, 'slip_spread_k': 0.8204370200557378, 'spread_hl_frac': 0.0024813813169292445, 'bb_std_mult': 3.152214197860147, 'rsi_os': 8, 'rsi_ob': 77, 'vol_spike': 0.20564690289287785, 'adx_thresh': 21.089838024704353, 'atr_min_pct': 0.0013794407678010439, 'atr_max_pct': 0.108378158025351, 'tp_mult': 1.4947939989276955, 'tsl_mult': 0.5878884971210585, 'strategy': 'mean_reversion', 'time_stop': 215, 'use_sma': False, 'use_atr': True, 'use_adx': False, 'use_ema': False, 'use_spike': False, 'rsi_required': True, 'edge_k': 1.5892859688200018, 'edge_cap': 0.37173723120151886, 'bull_strategy': 'breakout', 'bull_bb_std_mult': 2.8810686274839274, 'bull_rsi_os': 11, 'bull_rsi_ob': 79, 'bull_adx_thresh': 15.370642434317087, 'bull_atr_min_pct': 0.021511034243036513, 'bull_atr_max_pct': 0.06290510618874759, 'bull_tp_mult': 2.688378180723021, 'bull_tsl_mult': 0.2147169237148361, 'bull_time_stop': 92, 'bull_use_sma': True, 'bull_use_ema': True, 'bull_use_atr': False, 'bull_use_adx': True, 'bull_use_spike': True, 'bull_rsi_required': False, 'bear_strategy': 'breakout', 'bear_bb_std_mult': 2.7853718391803266, 'bear_rsi_os': 6, 'bear_rsi_ob': 72, 'bear_adx_thresh': 30.44224728879515, 'bear_atr_min_pct': 0.018176732001241414, 'bear_atr_max_pct': 0.08327726460503622, 'bear_tp_mult': 2.9005391847027555, 'bear_tsl_mult': 0.10747932407327081, 'bear_time_stop': 300, 'bear_use_sma': True, 'bear_use_ema': True, 'bear_use_atr': True, 'bear_use_adx': True, 'bear_use_spike': False, 'bear_rsi_required': True, 'sideways_strategy': 'breakout', 'sideways_bb_std_mult': 2.616364873711203, 'sideways_rsi_os': 34, 'sideways_rsi_ob': 82, 'sideways_adx_thresh': 6.098838481283568, 'sideways_atr_min_pct': 7.840387350091516e-06, 'sideways_atr_max_pct': 0.14298640556357584, 'sideways_tp_mult': 2.1495205310290975, 'sideways_tsl_mult': 0.5737538594329922, 'sideways_time_stop': 77, 'sideways_use_sma': True, 'sideways_use_ema': False, 'sideways_use_atr': False, 'sideways_use_adx': True, 'sideways_use_spike': False, 'sideways_rsi_required': True}.
[I 2025-08-31 12:40:31,237] Trial 378 finished with values: [-1000000000.0, 1000000000.0] and parameters: {'p_sma': 52, 'p_std': 24, 'p_atr': 12, 'p_adx': 15, 'rsi_period': 77, 'ema1': 24, 'ema2': 17, 'slip_atr_k': 0.04551834395018213, 'slip_spread_k': 0.6802707315569927, 'spread_hl_frac': 0.0020250132410735526, 'bb_std_mult': 3.158100834923073, 'rsi_os': 48, 'rsi_ob': 51, 'vol_spike': 0.20542530099876818, 'adx_thresh': 21.134919718283275, 'atr_min_pct': 2.4172741948370836e-05, 'atr_max_pct': 0.12409432219225633, 'tp_mult': 2.6903402589908962, 'tsl_mult': 0.016173597814293037, 'strategy': 'breakout', 'time_stop': 220, 'use_sma': False, 'use_atr': True, 'use_adx': False, 'use_ema': True, 'use_spike': False, 'rsi_required': True, 'edge_k': 0.6169866048051582, 'edge_cap': 0.7304345101372809, 'bull_strategy': 'breakout', 'bull_bb_std_mult': 2.7609718827664027, 'bull_rsi_os': 6, 'bull_rsi_ob': 78, 'bull_adx_thresh': 10.218521309686336, 'bull_atr_min_pct': 0.02133805067326338, 'bull_atr_max_pct': 0.06383543725650864, 'bull_tp_mult': 2.7492652292024866, 'bull_tsl_mult': 0.08095164133174537, 'bull_time_stop': 287, 'bull_use_sma': True, 'bull_use_ema': True, 'bull_use_atr': False, 'bull_use_adx': True, 'bull_use_spike': False, 'bull_rsi_required': False, 'bear_strategy': 'breakout', 'bear_bb_std_mult': 2.7927740219666415, 'bear_rsi_os': 29, 'bear_rsi_ob': 78, 'bear_adx_thresh': 30.004497212773863, 'bear_atr_min_pct': 0.028261850920421452, 'bear_atr_max_pct': 0.13716007359167376, 'bear_tp_mult': 2.1286735462655377, 'bear_tsl_mult': 0.1415247532823384, 'bear_time_stop': 241, 'bear_use_sma': True, 'bear_use_ema': True, 'bear_use_atr': True, 'bear_use_adx': True, 'bear_use_spike': True, 'bear_rsi_required': True, 'sideways_strategy': 'breakout', 'sideways_bb_std_mult': 3.5305742983860977, 'sideways_rsi_os': 32, 'sideways_rsi_ob': 67, 'sideways_adx_thresh': 11.848222340229531, 'sideways_atr_min_pct': 0.0005289744503379332, 'sideways_atr_max_pct': 0.13138001765299448, 'sideways_tp_mult': 1.5912390781299621, 'sideways_tsl_mult': 0.6833320234020132, 'sideways_time_stop': 212, 'sideways_use_sma': True, 'sideways_use_ema': False, 'sideways_use_atr': False, 'sideways_use_adx': False, 'sideways_use_spike': False, 'sideways_rsi_required': True}.
