[I 2025-08-31 13:37:08,109] Trial 784 finished with values: [-1000000000.0, 1000000000.0] and parameters: {'p_sma': 46, 'p_std': 23, 'p_atr': 15, 'p_adx': 22, 'rsi_period': 54, 'ema1': 25, 'ema2': 23, 'slip_atr_k': 0.0507547639856538, 'slip_spread_k': 0.7712694725869592, 'spread_hl_frac': 0.019880234569628782, 'bb_std_mult': 2.822200154038806, 'rsi_os': 38, 'rsi_ob': 85, 'vol_spike': 0.1629794416250363, 'adx_thresh': 27.748011597677436, 'atr_min_pct': 0.02833851526956197, 'atr_max_pct': 0.04524765569904318, 'tp_mult': 2.404228227994886, 'tsl_mult': 0.7013964663890556, 'strategy': 'mean_reversion', 'time_stop': 271, 'use_sma': True, 'use_atr': False, 'use_adx': True, 'use_ema': True, 'use_spike': True, 'rsi_required': False, 'edge_k': 0.6397569756088635, 'edge_cap': 0.7012604946034743, 'bull_strategy': 'mean_reversion', 'bull_bb_std_mult': 2.531084920388281, 'bull_rsi_os': 26, 'bull_rsi_ob': 84, 'bull_adx_thresh': 11.029602007554782, 'bull_atr_min_pct': 0.014934816205491008, 'bull_atr_max_pct': 0.14304325275872112, 'bull_tp_mult': 2.4148567123026274, 'bull_tsl_mult': 0.31625456313723305, 'bull_time_stop': 171, 'bull_use_sma': True, 'bull_use_ema': True, 'bull_use_atr': True, 'bull_use_adx': True, 'bull_use_spike': True, 'bull_rsi_required': True, 'bear_strategy': 'breakout', 'bear_bb_std_mult': 3.4966134803961495, 'bear_rsi_os': 53, 'bear_rsi_ob': 65, 'bear_adx_thresh': 20.27092995513562, 'bear_atr_min_pct': 0.013884011951023723, 'bear_atr_max_pct': 0.12861264233330416, 'bear_tp_mult': 1.878791492936657, 'bear_tsl_mult': 0.7316063473103523, 'bear_time_stop': 16, 'bear_use_sma': False, 'bear_use_ema': True, 'bear_use_atr': False, 'bear_use_adx': False, 'bear_use_spike': True, 'bear_rsi_required': True, 'sideways_strategy': 'breakout', 'sideways_bb_std_mult': 2.8356750295389483, 'sideways_rsi_os': 21, 'sideways_rsi_ob': 66, 'sideways_adx_thresh': 24.91649874876231, 'sideways_atr_min_pct': 0.0025676546606340457, 'sideways_atr_max_pct': 0.14995622858089971, 'sideways_tp_mult': 2.7210983785670173, 'sideways_tsl_mult': 0.8541282038564649, 'sideways_time_stop': 75, 'sideways_use_sma': False, 'sideways_use_ema': False, 'sideways_use_atr': True, 'sideways_use_adx': True, 'sideways_use_spike': False, 'sideways_rsi_required': True}.
[I 2025-08-31 13:37:08,358] Trial 783 finished with values: [-0.045220924206116786, 0.04454884924512577] and parameters: {'p_sma': 30, 'p_std': 23, 'p_atr': 14, 'p_adx': 30, 'rsi_period': 46, 'ema1': 16, 'ema2': 19, 'slip_atr_k': 0.10922761047570559, 'slip_spread_k': 0.18430537101878602, 'spread_hl_frac': 0.020412541148979283, 'bb_std_mult': 2.4421367651821755, 'rsi_os': 20, 'rsi_ob': 85, 'vol_spike': 0.034404799369578756, 'adx_thresh': 15.333266682807732, 'atr_min_pct': 0.025061287461964805, 'atr_max_pct': 0.054694567152688535, 'tp_mult': 1.197899080544075, 'tsl_mult': 0.8720558303170227, 'strategy': 'breakout', 'time_stop': 164, 'use_sma': False, 'use_atr': False, 'use_adx': True, 'use_ema': False, 'use_spike': True, 'rsi_required': False, 'edge_k': 0.574419548954777, 'edge_cap': 0.9059656466232402, 'bull_strategy': 'mean_reversion', 'bull_bb_std_mult': 2.188506549083805, 'bull_rsi_os': 23, 'bull_rsi_ob': 84, 'bull_adx_thresh': 18.593493171303212, 'bull_atr_min_pct': 0.0033004950209191575, 'bull_atr_max_pct': 0.1434902132660642, 'bull_tp_mult': 2.3204173605631007, 'bull_tsl_mult': 0.31234928913170873, 'bull_time_stop': 173, 'bull_use_sma': True, 'bull_use_ema': True, 'bull_use_atr': True, 'bull_use_adx': True, 'bull_use_spike': True, 'bull_rsi_required': True, 'bear_strategy': 'breakout', 'bear_bb_std_mult': 3.4587333282788855, 'bear_rsi_os': 32, 'bear_rsi_ob': 69, 'bear_adx_thresh': 22.443691340502607, 'bear_atr_min_pct': 0.0011860545611150945, 'bear_atr_max_pct': 0.12794331299004308, 'bear_tp_mult': 1.075756775522156, 'bear_tsl_mult': 0.859772234568018, 'bear_time_stop': 14, 'bear_use_sma': False, 'bear_use_ema': False, 'bear_use_atr': False, 'bear_use_adx': False, 'bear_use_spike': True, 'bear_rsi_required': False, 'sideways_strategy': 'breakout', 'sideways_bb_std_mult': 2.6287152909704345, 'sideways_rsi_os': 44, 'sideways_rsi_ob': 67, 'sideways_adx_thresh': 24.378752403648473, 'sideways_atr_min_pct': 0.021143472031418694, 'sideways_atr_max_pct': 0.14636540099792983, 'sideways_tp_mult': 1.7285994731799088, 'sideways_tsl_mult': 0.8522460728584031, 'sideways_time_stop': 108, 'sideways_use_sma': False, 'sideways_use_ema': False, 'sideways_use_atr': True, 'sideways_use_adx': True, 'sideways_use_spike': False, 'sideways_rsi_required': True}.
[I 2025-08-31 13:37:08,883] Trial 785 finished with values: [-1000000000.0, 1000000000.0] and parameters: {'p_sma': 42, 'p_std': 23, 'p_atr': 14, 'p_adx': 30, 'rsi_period': 46, 'ema1': 17, 'ema2': 23, 'slip_atr_k': 0.23503354600927978, 'slip_spread_k': 0.7689599872101511, 'spread_hl_frac': 0.02017863651513313, 'bb_std_mult': 2.477310012633745, 'rsi_os': 5, 'rsi_ob': 84, 'vol_spike': 0.03407337101615153, 'adx_thresh': 15.449177660068507, 'atr_min_pct': 0.027333209238252963, 'atr_max_pct': 0.044699822510708614, 'tp_mult': 2.023958953054283, 'tsl_mult': 0.7017978382167283, 'strategy': 'mean_reversion', 'time_stop': 126, 'use_sma': True, 'use_atr': False, 'use_adx': True, 'use_ema': True, 'use_spike': True, 'rsi_required': False, 'edge_k': 1.0723324435844976, 'edge_cap': 0.6996308560404589, 'bull_strategy': 'mean_reversion', 'bull_bb_std_mult': 0.7911912056523027, 'bull_rsi_os': 6, 'bull_rsi_ob': 84, 'bull_adx_thresh': 16.58286510765598, 'bull_atr_min_pct': 0.02177773813157144, 'bull_atr_max_pct': 0.1419164034494379, 'bull_tp_mult': 2.4419967257091035, 'bull_tsl_mult': 0.3158963883905477, 'bull_time_stop': 172, 'bull_use_sma': True, 'bull_use_ema': True, 'bull_use_atr': True, 'bull_use_adx': True, 'bull_use_spike': True, 'bull_rsi_required': True, 'bear_strategy': 'breakout', 'bear_bb_std_mult': 3.5249964363434785, 'bear_rsi_os': 39, 'bear_rsi_ob': 65, 'bear_adx_thresh': 34.97944885722939, 'bear_atr_min_pct': 0.013794719550086716, 'bear_atr_max_pct': 0.1285372432025562, 'bear_tp_mult': 2.393178339297448, 'bear_tsl_mult': 0.500051105052244, 'bear_time_stop': 192, 'bear_use_sma': False, 'bear_use_ema': True, 'bear_use_atr': False, 'bear_use_adx': False, 'bear_use_spike': True, 'bear_rsi_required': True, 'sideways_strategy': 'breakout', 'sideways_bb_std_mult': 1.6632138693426932, 'sideways_rsi_os': 30, 'sideways_rsi_ob': 91, 'sideways_adx_thresh': 7.900194213115141, 'sideways_atr_min_pct': 0.002376391215098884, 'sideways_atr_max_pct': 0.1465216910566497, 'sideways_tp_mult': 2.380312575147891, 'sideways_tsl_mult': 0.8526606653711268, 'sideways_time_stop': 55, 'sideways_use_sma': False, 'sideways_use_ema': False, 'sideways_use_atr': True, 'sideways_use_adx': True, 'sideways_use_spike': False, 'sideways_rsi_required': True}.
[I 2025-08-31 13:37:08,983] Trial 786 finished with values: [-1000000000.0, 1000000000.0] and parameters: {'p_sma': 42, 'p_std': 39, 'p_atr': 14, 'p_adx': 22, 'rsi_period': 51, 'ema1': 30, 'ema2': 21, 'slip_atr_k': 0.15787953118545434, 'slip_spread_k': 0.4945470498834133, 'spread_hl_frac': 0.020335924065233966, 'bb_std_mult': 2.4270635706706294, 'rsi_os': 5, 'rsi_ob': 85, 'vol_spike': 0.12396954127461118, 'adx_thresh': 7.801161464828129, 'atr_min_pct': 0.028611889415092098, 'atr_max_pct': 0.04638847152429726, 'tp_mult': 1.04042641833753, 'tsl_mult': 0.2513060467222138, 'strategy': 'mean_reversion', 'time_stop': 153, 'use_sma': True, 'use_atr': False, 'use_adx': True, 'use_ema': False, 'use_spike': True, 'rsi_required': False, 'edge_k': 0.9472491868143221, 'edge_cap': 0.6626150194969855, 'bull_strategy': 'mean_reversion', 'bull_bb_std_mult': 1.4117355920834964, 'bull_rsi_os': 23, 'bull_rsi_ob': 83, 'bull_adx_thresh': 11.228019148376188, 'bull_atr_min_pct': 0.022049347042896784, 'bull_atr_max_pct': 0.14229394385894237, 'bull_tp_mult': 2.208332937259161, 'bull_tsl_mult': 0.9464837769764514, 'bull_time_stop': 171, 'bull_use_sma': True, 'bull_use_ema': True, 'bull_use_atr': True, 'bull_use_adx': True, 'bull_use_spike': True, 'bull_rsi_required': True, 'bear_strategy': 'breakout', 'bear_bb_std_mult': 3.5115385509400103, 'bear_rsi_os': 39, 'bear_rsi_ob': 70, 'bear_adx_thresh': 22.213124819597677, 'bear_atr_min_pct': 0.009372984533942032, 'bear_atr_max_pct': 0.13191384443247958, 'bear_tp_mult': 1.1111647594640996, 'bear_tsl_mult': 0.732786704237833, 'bear_time_stop': 33, 'bear_use_sma': False, 'bear_use_ema': True, 'bear_use_atr': False, 'bear_use_adx': False, 'bear_use_spike': True, 'bear_rsi_required': True, 'sideways_strategy': 'mean_reversion', 'sideways_bb_std_mult': 2.7761162621474056, 'sideways_rsi_os': 54, 'sideways_rsi_ob': 94, 'sideways_adx_thresh': 23.56330223846896, 'sideways_atr_min_pct': 0.02314833104529, 'sideways_atr_max_pct': 0.14987949966348849, 'sideways_tp_mult': 1.720076185280685, 'sideways_tsl_mult': 0.8506149495812683, 'sideways_time_stop': 77, 'sideways_use_sma': False, 'sideways_use_ema': True, 'sideways_use_atr': True, 'sideways_use_adx': True, 'sideways_use_spike': False, 'sideways_rsi_required': True}.
[I 2025-08-31 13:37:43,210] Trial 787 finished with values: [-1000000000.0, 1000000000.0] and parameters: {'p_sma': 19, 'p_std': 20, 'p_atr': 16, 'p_adx': 20, 'rsi_period': 46, 'ema1': 16, 'ema2': 21, 'slip_atr_k': 0.1738610283933903, 'slip_spread_k': 0.7271334856250625, 'spread_hl_frac': 0.0359827282330433, 'bb_std_mult': 3.0110600834547943, 'rsi_os': 51, 'rsi_ob': 87, 'vol_spike': 0.03455856755245287, 'adx_thresh': 7.862581414686803, 'atr_min_pct': 0.02749804366057838, 'atr_max_pct': 0.04817286819578688, 'tp_mult': 1.7358947014077557, 'tsl_mult': 0.7524553743866538, 'strategy': 'breakout', 'time_stop': 87, 'use_sma': False, 'use_atr': False, 'use_adx': True, 'use_ema': False, 'use_spike': True, 'rsi_required': False, 'edge_k': 0.993580369231977, 'edge_cap': 0.4558251835798023, 'bull_strategy': 'mean_reversion', 'bull_bb_std_mult': 1.9207316529604401, 'bull_rsi_os': 48, 'bull_rsi_ob': 86, 'bull_adx_thresh': 32.840477331832915, 'bull_atr_min_pct': 0.0239090784947878, 'bull_atr_max_pct': 0.13964379290009188, 'bull_tp_mult': 2.314986614532811, 'bull_tsl_mult': 0.6868721172434383, 'bull_time_stop': 54, 'bull_use_sma': False, 'bull_use_ema': True, 'bull_use_atr': True, 'bull_use_adx': False, 'bull_use_spike': True, 'bull_rsi_required': True, 'bear_strategy': 'mean_reversion', 'bear_bb_std_mult': 3.378671100330174, 'bear_rsi_os': 28, 'bear_rsi_ob': 70, 'bear_adx_thresh': 22.487038089988456, 'bear_atr_min_pct': 0.02378283775432765, 'bear_atr_max_pct': 0.13210848129108194, 'bear_tp_mult': 1.1115275767471278, 'bear_tsl_mult': 0.6452109432902331, 'bear_time_stop': 192, 'bear_use_sma': False, 'bear_use_ema': True, 'bear_use_atr': False, 'bear_use_adx': False, 'bear_use_spike': False, 'bear_rsi_required': True, 'sideways_strategy': 'mean_reversion', 'sideways_bb_std_mult': 2.758571925557719, 'sideways_rsi_os': 55, 'sideways_rsi_ob': 66, 'sideways_adx_thresh': 23.527462075762436, 'sideways_atr_min_pct': 0.0035663209225395443, 'sideways_atr_max_pct': 0.14572196654878444, 'sideways_tp_mult': 1.7248215713239463, 'sideways_tsl_mult': 0.16197372075974314, 'sideways_time_stop': 57, 'sideways_use_sma': False, 'sideways_use_ema': True, 'sideways_use_atr': True, 'sideways_use_adx': True, 'sideways_use_spike': True, 'sideways_rsi_required': True}.
[I 2025-08-31 13:37:44,566] Trial 790 finished with values: [-1000000000.0, 1000000000.0] and parameters: {'p_sma': 24, 'p_std': 19, 'p_atr': 16, 'p_adx': 13, 'rsi_period': 14, 'ema1': 11, 'ema2': 20, 'slip_atr_k': 0.21603932372357676, 'slip_spread_k': 0.5190852867719717, 'spread_hl_frac': 0.03608256039655821, 'bb_std_mult': 2.3077414749841063, 'rsi_os': 36, 'rsi_ob': 82, 'vol_spike': 0.012905607059101334, 'adx_thresh': 8.677426524005877, 'atr_min_pct': 0.027371510656886446, 'atr_max_pct': 0.05238440993555817, 'tp_mult': 2.5768261225608504, 'tsl_mult': 0.7547447025167557, 'strategy': 'breakout', 'time_stop': 176, 'use_sma': False, 'use_atr': False, 'use_adx': True, 'use_ema': True, 'use_spike': True, 'rsi_required': False, 'edge_k': 0.5003432420601092, 'edge_cap': 0.6805573016126147, 'bull_strategy': 'mean_reversion', 'bull_bb_std_mult': 1.9119708547781973, 'bull_rsi_os': 43, 'bull_rsi_ob': 86, 'bull_adx_thresh': 17.761093054060577, 'bull_atr_min_pct': 0.024118264898313528, 'bull_atr_max_pct': 0.13865538384382198, 'bull_tp_mult': 2.120741248610456, 'bull_tsl_mult': 0.6114699557373261, 'bull_time_stop': 200, 'bull_use_sma': False, 'bull_use_ema': True, 'bull_use_atr': True, 'bull_use_adx': False, 'bull_use_spike': True, 'bull_rsi_required': True, 'bear_strategy': 'mean_reversion', 'bear_bb_std_mult': 3.371071145836667, 'bear_rsi_os': 28, 'bear_rsi_ob': 73, 'bear_adx_thresh': 10.662454084642366, 'bear_atr_min_pct': 0.02126924579991673, 'bear_atr_max_pct': 0.12194134739392441, 'bear_tp_mult': 1.2998932248722617, 'bear_tsl_mult': 0.6571585666481723, 'bear_time_stop': 174, 'bear_use_sma': False, 'bear_use_ema': True, 'bear_use_atr': False, 'bear_use_adx': False, 'bear_use_spike': False, 'bear_rsi_required': True, 'sideways_strategy': 'mean_reversion', 'sideways_bb_std_mult': 2.7103195076715423, 'sideways_rsi_os': 32, 'sideways_rsi_ob': 62, 'sideways_adx_thresh': 25.554337394624408, 'sideways_atr_min_pct': 0.003388511061924664, 'sideways_atr_max_pct': 0.14477944468247675, 'sideways_tp_mult': 2.793817230074865, 'sideways_tsl_mult': 0.881587108194856, 'sideways_time_stop': 36, 'sideways_use_sma': False, 'sideways_use_ema': True, 'sideways_use_atr': True, 'sideways_use_adx': True, 'sideways_use_spike': True, 'sideways_rsi_required': True}.
[I 2025-08-31 13:37:45,266] Trial 788 finished with values: [-1000000000.0, 1000000000.0] and parameters: {'p_sma': 42, 'p_std': 10, 'p_atr': 14, 'p_adx': 13, 'rsi_period': 52, 'ema1': 14, 'ema2': 21, 'slip_atr_k': 0.08355270512135334, 'slip_spread_k': 0.4255762263362734, 'spread_hl_frac': 0.037721189020242414, 'bb_std_mult': 1.3390779199841254, 'rsi_os': 41, 'rsi_ob': 82, 'vol_spike': 0.023695032608931396, 'adx_thresh': 7.692478375636829, 'atr_min_pct': 0.027477418200498878, 'atr_max_pct': 0.04752422581749806, 'tp_mult': 1.9986339798544803, 'tsl_mult': 0.6708045828694977, 'strategy': 'mean_reversion', 'time_stop': 85, 'use_sma': False, 'use_atr': False, 'use_adx': True, 'use_ema': True, 'use_spike': True, 'rsi_required': False, 'edge_k': 0.9676596015880422, 'edge_cap': 0.6610283155571389, 'bull_strategy': 'mean_reversion', 'bull_bb_std_mult': 2.8970560491105157, 'bull_rsi_os': 6, 'bull_rsi_ob': 60, 'bull_adx_thresh': 16.598551175550067, 'bull_atr_min_pct': 0.028432177448938667, 'bull_atr_max_pct': 0.13877643310665969, 'bull_tp_mult': 2.433358082199625, 'bull_tsl_mult': 0.9571253491253637, 'bull_time_stop': 202, 'bull_use_sma': False, 'bull_use_ema': True, 'bull_use_atr': True, 'bull_use_adx': False, 'bull_use_spike': True, 'bull_rsi_required': True, 'bear_strategy': 'mean_reversion', 'bear_bb_std_mult': 3.38098101491795, 'bear_rsi_os': 28, 'bear_rsi_ob': 91, 'bear_adx_thresh': 10.722113654439193, 'bear_atr_min_pct': 0.0015437445985250135, 'bear_atr_max_pct': 0.13081550086085494, 'bear_tp_mult': 1.2952259907482961, 'bear_tsl_mult': 0.05784754283514465, 'bear_time_stop': 192, 'bear_use_sma': False, 'bear_use_ema': True, 'bear_use_atr': False, 'bear_use_adx': False, 'bear_use_spike': False, 'bear_rsi_required': True, 'sideways_strategy': 'mean_reversion', 'sideways_bb_std_mult': 1.6307898293985568, 'sideways_rsi_os': 39, 'sideways_rsi_ob': 62, 'sideways_adx_thresh': 23.428210395956185, 'sideways_atr_min_pct': 0.003613698133323948, 'sideways_atr_max_pct': 0.14685585942762452, 'sideways_tp_mult': 2.2456465151057707, 'sideways_tsl_mult': 0.7108683157075661, 'sideways_time_stop': 57, 'sideways_use_sma': False, 'sideways_use_ema': True, 'sideways_use_atr': True, 'sideways_use_adx': True, 'sideways_use_spike': True, 'sideways_rsi_required': True}.
[I 2025-08-31 13:37:45,538] Trial 789 finished with values: [-1000000000.0, 1000000000.0] and parameters: {'p_sma': 19, 'p_std': 19, 'p_atr': 25, 'p_adx': 13, 'rsi_period': 14, 'ema1': 14, 'ema2': 43, 'slip_atr_k': 0.1162498407067422, 'slip_spread_k': 0.4452980831569661, 'spread_hl_frac': 0.011280908305998268, 'bb_std_mult': 1.317418039999665, 'rsi_os': 25, 'rsi_ob': 82, 'vol_spike': 0.11344082289771204, 'adx_thresh': 7.8938860478110975, 'atr_min_pct': 0.028975988028358164, 'atr_max_pct': 0.04817463686455391, 'tp_mult': 1.047182628046928, 'tsl_mult': 0.749096813344746, 'strategy': 'breakout', 'time_stop': 158, 'use_sma': False, 'use_atr': False, 'use_adx': True, 'use_ema': True, 'use_spike': True, 'rsi_required': False, 'edge_k': 0.9257723341671582, 'edge_cap': 0.21492143620899007, 'bull_strategy': 'mean_reversion', 'bull_bb_std_mult': 2.9116535330958686, 'bull_rsi_os': 5, 'bull_rsi_ob': 81, 'bull_adx_thresh': 29.128036114660638, 'bull_atr_min_pct': 0.029957797611837686, 'bull_atr_max_pct': 0.13890410947131543, 'bull_tp_mult': 2.1255915896102886, 'bull_tsl_mult': 0.6612930569189223, 'bull_time_stop': 187, 'bull_use_sma': False, 'bull_use_ema': True, 'bull_use_atr': True, 'bull_use_adx': False, 'bull_use_spike': True, 'bull_rsi_required': True, 'bear_strategy': 'mean_reversion', 'bear_bb_std_mult': 3.361499932353854, 'bear_rsi_os': 35, 'bear_rsi_ob': 70, 'bear_adx_thresh': 21.08838999943505, 'bear_atr_min_pct': 0.009432149781895442, 'bear_atr_max_pct': 0.13068573051490173, 'bear_tp_mult': 1.1237127360234047, 'bear_tsl_mult': 0.05839595005850273, 'bear_time_stop': 34, 'bear_use_sma': False, 'bear_use_ema': True, 'bear_use_atr': False, 'bear_use_adx': False, 'bear_use_spike': False, 'bear_rsi_required': True, 'sideways_strategy': 'mean_reversion', 'sideways_bb_std_mult': 3.048556686662981, 'sideways_rsi_os': 31, 'sideways_rsi_ob': 61, 'sideways_adx_thresh': 23.445401226654322, 'sideways_atr_min_pct': 0.013019096889688346, 'sideways_atr_max_pct': 0.14995750996695084, 'sideways_tp_mult': 2.2684323856434596, 'sideways_tsl_mult': 0.15735955131684332, 'sideways_time_stop': 300, 'sideways_use_sma': False, 'sideways_use_ema': True, 'sideways_use_atr': True, 'sideways_use_adx': True, 'sideways_use_spike': True, 'sideways_rsi_required': True}.
[I 2025-08-31 13:37:46,709] Trial 792 finished with values: [-1000000000.0, 1000000000.0] and parameters: {'p_sma': 6, 'p_std': 44, 'p_atr': 22, 'p_adx': 13, 'rsi_period': 52, 'ema1': 15, 'ema2': 57, 'slip_atr_k': 0.04510892746877117, 'slip_spread_k': 0.4277216199737276, 'spread_hl_frac': 0.017687078249563715, 'bb_std_mult': 1.381371811854578, 'rsi_os': 39, 'rsi_ob': 89, 'vol_spike': 0.021789500159992172, 'adx_thresh': 6.115014572492206, 'atr_min_pct': 0.02646557625477252, 'atr_max_pct': 0.023267679677639416, 'tp_mult': 2.4569565487936433, 'tsl_mult': 0.6741797481345069, 'strategy': 'breakout', 'time_stop': 169, 'use_sma': False, 'use_atr': False, 'use_adx': True, 'use_ema': True, 'use_spike': True, 'rsi_required': False, 'edge_k': 0.6472753996473843, 'edge_cap': 0.34640438689961284, 'bull_strategy': 'mean_reversion', 'bull_bb_std_mult': 2.9418924954741135, 'bull_rsi_os': 44, 'bull_rsi_ob': 90, 'bull_adx_thresh': 31.44283108650119, 'bull_atr_min_pct': 0.02056489394786136, 'bull_atr_max_pct': 0.04764692290411632, 'bull_tp_mult': 2.2269377173736022, 'bull_tsl_mult': 0.43394402884389327, 'bull_time_stop': 108, 'bull_use_sma': True, 'bull_use_ema': True, 'bull_use_atr': True, 'bull_use_adx': True, 'bull_use_spike': True, 'bull_rsi_required': True, 'bear_strategy': 'breakout', 'bear_bb_std_mult': 3.5979653948641572, 'bear_rsi_os': 44, 'bear_rsi_ob': 75, 'bear_adx_thresh': 21.16946171934418, 'bear_atr_min_pct': 0.0014616341836911476, 'bear_atr_max_pct': 0.12308864209913971, 'bear_tp_mult': 1.4889565179170696, 'bear_tsl_mult': 0.33017015217750545, 'bear_time_stop': 181, 'bear_use_sma': False, 'bear_use_ema': True, 'bear_use_atr': False, 'bear_use_adx': False, 'bear_use_spike': True, 'bear_rsi_required': True, 'sideways_strategy': 'breakout', 'sideways_bb_std_mult': 2.701988961642998, 'sideways_rsi_os': 31, 'sideways_rsi_ob': 63, 'sideways_adx_thresh': 25.159495590166866, 'sideways_atr_min_pct': 0.008145407009464438, 'sideways_atr_max_pct': 0.14998009484570862, 'sideways_tp_mult': 1.6452476913120437, 'sideways_tsl_mult': 0.8960490990819697, 'sideways_time_stop': 120, 'sideways_use_sma': False, 'sideways_use_ema': False, 'sideways_use_atr': True, 'sideways_use_adx': True, 'sideways_use_spike': False, 'sideways_rsi_required': True}.
