[I 2025-08-31 12:32:48,455] Trial 318 finished with values: [-1000000000.0, 1000000000.0] and parameters: {'p_sma': 49, 'p_std': 59, 'p_atr': 13, 'p_adx': 20, 'rsi_period': 77, 'ema1': 6, 'ema2': 14, 'slip_atr_k': 0.021017175391922424, 'slip_spread_k': 0.7499615642305998, 'spread_hl_frac': 0.02907367335724064, 'bb_std_mult': 1.9582676295116654, 'rsi_os': 39, 'rsi_ob': 46, 'vol_spike': 0.210084277441911, 'adx_thresh': 20.597837398076607, 'atr_min_pct': 0.003506522505295614, 'atr_max_pct': 0.1287480228609947, 'tp_mult': 2.590355241580606, 'tsl_mult': 0.04738786639520477, 'strategy': 'mean_reversion', 'time_stop': 199, 'use_sma': False, 'use_atr': True, 'use_adx': False, 'use_ema': False, 'use_spike': False, 'rsi_required': True, 'edge_k': 0.1157022228552661, 'edge_cap': 0.642226522989717, 'bull_strategy': 'breakout', 'bull_bb_std_mult': 1.825987037704643, 'bull_rsi_os': 10, 'bull_rsi_ob': 95, 'bull_adx_thresh': 9.167267291848784, 'bull_atr_min_pct': 0.02048034523953604, 'bull_atr_max_pct': 0.08345155744503492, 'bull_tp_mult': 2.752077631088424, 'bull_tsl_mult': 0.2822898000517611, 'bull_time_stop': 196, 'bull_use_sma': True, 'bull_use_ema': True, 'bull_use_atr': False, 'bull_use_adx': False, 'bull_use_spike': False, 'bull_rsi_required': False, 'bear_strategy': 'breakout', 'bear_bb_std_mult': 2.969414270373833, 'bear_rsi_os': 54, 'bear_rsi_ob': 72, 'bear_adx_thresh': 6.60615374225676, 'bear_atr_min_pct': 0.026279512138223084, 'bear_atr_max_pct': 0.14729148462507585, 'bear_tp_mult': 1.1688989899302853, 'bear_tsl_mult': 0.07854435991220804, 'bear_time_stop': 242, 'bear_use_sma': True, 'bear_use_ema': True, 'bear_use_atr': True, 'bear_use_adx': True, 'bear_use_spike': True, 'bear_rsi_required': True, 'sideways_strategy': 'mean_reversion', 'sideways_bb_std_mult': 1.503937310258304, 'sideways_rsi_os': 35, 'sideways_rsi_ob': 80, 'sideways_adx_thresh': 11.572040582159742, 'sideways_atr_min_pct': 0.005611169696255788, 'sideways_atr_max_pct': 0.1192651150469431, 'sideways_tp_mult': 2.1586118990845375, 'sideways_tsl_mult': 0.6485227275515698, 'sideways_time_stop': 202, 'sideways_use_sma': True, 'sideways_use_ema': False, 'sideways_use_atr': False, 'sideways_use_adx': False, 'sideways_use_spike': True, 'sideways_rsi_required': True}.
[I 2025-08-31 12:32:48,457] Trial 315 finished with values: [-1000000000.0, 1000000000.0] and parameters: {'p_sma': 55, 'p_std': 28, 'p_atr': 7, 'p_adx': 11, 'rsi_period': 76, 'ema1': 6, 'ema2': 13, 'slip_atr_k': 0.033645322319499224, 'slip_spread_k': 0.6546856649188892, 'spread_hl_frac': 0.035454122299758896, 'bb_std_mult': 1.794144874518949, 'rsi_os': 36, 'rsi_ob': 46, 'vol_spike': 0.07429831561386059, 'adx_thresh': 16.455747074711276, 'atr_min_pct': 0.02153149731934923, 'atr_max_pct': 0.1285194062080611, 'tp_mult': 1.2303562090164952, 'tsl_mult': 0.04743959452616784, 'strategy': 'mean_reversion', 'time_stop': 38, 'use_sma': False, 'use_atr': True, 'use_adx': False, 'use_ema': False, 'use_spike': False, 'rsi_required': True, 'edge_k': 0.6425522240501674, 'edge_cap': 0.8707305362454955, 'bull_strategy': 'breakout', 'bull_bb_std_mult': 2.9453727032807193, 'bull_rsi_os': 9, 'bull_rsi_ob': 82, 'bull_adx_thresh': 33.317553227729846, 'bull_atr_min_pct': 0.021975949163573965, 'bull_atr_max_pct': 0.09791484908300002, 'bull_tp_mult': 2.8029036527690674, 'bull_tsl_mult': 0.2559777856881631, 'bull_time_stop': 119, 'bull_use_sma': True, 'bull_use_ema': True, 'bull_use_atr': False, 'bull_use_adx': False, 'bull_use_spike': False, 'bull_rsi_required': False, 'bear_strategy': 'breakout', 'bear_bb_std_mult': 2.0982270404057837, 'bear_rsi_os': 12, 'bear_rsi_ob': 71, 'bear_adx_thresh': 31.862039124199853, 'bear_atr_min_pct': 0.020715918729477697, 'bear_atr_max_pct': 0.09467541865814513, 'bear_tp_mult': 2.850231051460413, 'bear_tsl_mult': 0.1600806980914551, 'bear_time_stop': 175, 'bear_use_sma': True, 'bear_use_ema': True, 'bear_use_atr': True, 'bear_use_adx': True, 'bear_use_spike': True, 'bear_rsi_required': True, 'sideways_strategy': 'mean_reversion', 'sideways_bb_std_mult': 3.598541925387045, 'sideways_rsi_os': 37, 'sideways_rsi_ob': 84, 'sideways_adx_thresh': 11.201065861974723, 'sideways_atr_min_pct': 0.0017025115090164473, 'sideways_atr_max_pct': 0.13369774330049763, 'sideways_tp_mult': 2.0688088253009265, 'sideways_tsl_mult': 0.8457469883693078, 'sideways_time_stop': 80, 'sideways_use_sma': True, 'sideways_use_ema': False, 'sideways_use_atr': False, 'sideways_use_adx': False, 'sideways_use_spike': True, 'sideways_rsi_required': False}.
[I 2025-08-31 12:33:17,324] Trial 316 finished with values: [-1000000000.0, 1000000000.0] and parameters: {'p_sma': 55, 'p_std': 28, 'p_atr': 18, 'p_adx': 11, 'rsi_period': 77, 'ema1': 6, 'ema2': 13, 'slip_atr_k': 0.0335169003860654, 'slip_spread_k': 0.657647263505262, 'spread_hl_frac': 0.0472395066056121, 'bb_std_mult': 1.5346998209879723, 'rsi_os': 26, 'rsi_ob': 73, 'vol_spike': 0.08688878319248479, 'adx_thresh': 31.812315518914215, 'atr_min_pct': 0.0014120729158413282, 'atr_max_pct': 0.13298915464563094, 'tp_mult': 2.588249001176152, 'tsl_mult': 0.0008053904176295538, 'strategy': 'mean_reversion', 'time_stop': 37, 'use_sma': False, 'use_atr': True, 'use_adx': False, 'use_ema': False, 'use_spike': False, 'rsi_required': True, 'edge_k': 0.6409477417134485, 'edge_cap': 0.7283082785598151, 'bull_strategy': 'breakout', 'bull_bb_std_mult': 2.950758036389534, 'bull_rsi_os': 27, 'bull_rsi_ob': 80, 'bull_adx_thresh': 33.50983461512951, 'bull_atr_min_pct': 0.013614858997444426, 'bull_atr_max_pct': 0.09895763506065675, 'bull_tp_mult': 1.1411739901544948, 'bull_tsl_mult': 0.28515015215344686, 'bull_time_stop': 85, 'bull_use_sma': True, 'bull_use_ema': True, 'bull_use_atr': False, 'bull_use_adx': False, 'bull_use_spike': False, 'bull_rsi_required': False, 'bear_strategy': 'breakout', 'bear_bb_std_mult': 2.0788352158826093, 'bear_rsi_os': 54, 'bear_rsi_ob': 73, 'bear_adx_thresh': 19.670269846464034, 'bear_atr_min_pct': 0.02641811135223762, 'bear_atr_max_pct': 0.14480047017322112, 'bear_tp_mult': 2.807657102493289, 'bear_tsl_mult': 0.9172562494219463, 'bear_time_stop': 172, 'bear_use_sma': True, 'bear_use_ema': True, 'bear_use_atr': True, 'bear_use_adx': True, 'bear_use_spike': True, 'bear_rsi_required': True, 'sideways_strategy': 'mean_reversion', 'sideways_bb_std_mult': 3.4803079058857094, 'sideways_rsi_os': 37, 'sideways_rsi_ob': 84, 'sideways_adx_thresh': 11.057849435000792, 'sideways_atr_min_pct': 0.0015375605795333257, 'sideways_atr_max_pct': 0.12539911134687062, 'sideways_tp_mult': 2.8383338557348177, 'sideways_tsl_mult': 0.11668035055770892, 'sideways_time_stop': 200, 'sideways_use_sma': True, 'sideways_use_ema': False, 'sideways_use_atr': False, 'sideways_use_adx': False, 'sideways_use_spike': True, 'sideways_rsi_required': False}.
[I 2025-08-31 12:33:17,700] Trial 317 finished with values: [-1000000000.0, 1000000000.0] and parameters: {'p_sma': 49, 'p_std': 35, 'p_atr': 21, 'p_adx': 17, 'rsi_period': 77, 'ema1': 6, 'ema2': 13, 'slip_atr_k': 0.022599831968531124, 'slip_spread_k': 0.6581975734763702, 'spread_hl_frac': 0.004448746520752521, 'bb_std_mult': 1.5364554566977664, 'rsi_os': 40, 'rsi_ob': 76, 'vol_spike': 0.08543928207311989, 'adx_thresh': 31.468846743804967, 'atr_min_pct': 0.0013117535715177306, 'atr_max_pct': 0.13258033651799914, 'tp_mult': 2.607003551502717, 'tsl_mult': 0.04801067132470178, 'strategy': 'mean_reversion', 'time_stop': 35, 'use_sma': False, 'use_atr': True, 'use_adx': False, 'use_ema': False, 'use_spike': False, 'rsi_required': True, 'edge_k': 0.8033048294884201, 'edge_cap': 0.6393471855621389, 'bull_strategy': 'breakout', 'bull_bb_std_mult': 2.0131053111272634, 'bull_rsi_os': 10, 'bull_rsi_ob': 78, 'bull_adx_thresh': 8.188232870519947, 'bull_atr_min_pct': 0.020309123566590797, 'bull_atr_max_pct': 0.08274342381549094, 'bull_tp_mult': 2.744699312698542, 'bull_tsl_mult': 0.09020228630734362, 'bull_time_stop': 195, 'bull_use_sma': True, 'bull_use_ema': True, 'bull_use_atr': False, 'bull_use_adx': False, 'bull_use_spike': False, 'bull_rsi_required': False, 'bear_strategy': 'breakout', 'bear_bb_std_mult': 0.8328181864469955, 'bear_rsi_os': 11, 'bear_rsi_ob': 73, 'bear_adx_thresh': 18.6680959021287, 'bear_atr_min_pct': 0.020663240582608083, 'bear_atr_max_pct': 0.11698942966782658, 'bear_tp_mult': 2.7973305783573474, 'bear_tsl_mult': 0.7375436145292563, 'bear_time_stop': 258, 'bear_use_sma': True, 'bear_use_ema': True, 'bear_use_atr': True, 'bear_use_adx': True, 'bear_use_spike': True, 'bear_rsi_required': True, 'sideways_strategy': 'mean_reversion', 'sideways_bb_std_mult': 1.4454502840513546, 'sideways_rsi_os': 37, 'sideways_rsi_ob': 84, 'sideways_adx_thresh': 10.978668905160573, 'sideways_atr_min_pct': 0.00533170802491837, 'sideways_atr_max_pct': 0.12468321445540687, 'sideways_tp_mult': 2.8425350490808405, 'sideways_tsl_mult': 0.9196653425663128, 'sideways_time_stop': 202, 'sideways_use_sma': True, 'sideways_use_ema': False, 'sideways_use_atr': False, 'sideways_use_adx': False, 'sideways_use_spike': True, 'sideways_rsi_required': False}.
[I 2025-08-31 12:33:20,439] Trial 320 finished with values: [-1000000000.0, 1000000000.0] and parameters: {'p_sma': 48, 'p_std': 50, 'p_atr': 18, 'p_adx': 11, 'rsi_period': 78, 'ema1': 5, 'ema2': 20, 'slip_atr_k': 0.028490402506858945, 'slip_spread_k': 0.7003056107025893, 'spread_hl_frac': 0.041588383432508445, 'bb_std_mult': 1.5302764227541599, 'rsi_os': 49, 'rsi_ob': 81, 'vol_spike': 0.086600002586983, 'adx_thresh': 34.94399958165936, 'atr_min_pct': 0.01286452950979505, 'atr_max_pct': 0.13272958435501603, 'tp_mult': 1.9559140092994842, 'tsl_mult': 0.7632459202850208, 'strategy': 'breakout', 'time_stop': 23, 'use_sma': False, 'use_atr': True, 'use_adx': False, 'use_ema': True, 'use_spike': False, 'rsi_required': True, 'edge_k': 0.6821793702985145, 'edge_cap': 0.6936195696422542, 'bull_strategy': 'breakout', 'bull_bb_std_mult': 2.8678412757395497, 'bull_rsi_os': 42, 'bull_rsi_ob': 73, 'bull_adx_thresh': 8.06069611044246, 'bull_atr_min_pct': 0.011899847885071077, 'bull_atr_max_pct': 0.10497809828016869, 'bull_tp_mult': 2.7312057584745855, 'bull_tsl_mult': 0.13049228056188605, 'bull_time_stop': 129, 'bull_use_sma': True, 'bull_use_ema': True, 'bull_use_atr': False, 'bull_use_adx': True, 'bull_use_spike': True, 'bull_rsi_required': False, 'bear_strategy': 'breakout', 'bear_bb_std_mult': 2.201434520321761, 'bear_rsi_os': 36, 'bear_rsi_ob': 73, 'bear_adx_thresh': 10.809135955549392, 'bear_atr_min_pct': 0.02716010945022786, 'bear_atr_max_pct': 0.11536805531652317, 'bear_tp_mult': 2.787010755284394, 'bear_tsl_mult': 0.9390751316586831, 'bear_time_stop': 247, 'bear_use_sma': True, 'bear_use_ema': True, 'bear_use_atr': True, 'bear_use_adx': True, 'bear_use_spike': False, 'bear_rsi_required': True, 'sideways_strategy': 'breakout', 'sideways_bb_std_mult': 1.4123417008028438, 'sideways_rsi_os': 32, 'sideways_rsi_ob': 80, 'sideways_adx_thresh': 11.005021675661308, 'sideways_atr_min_pct': 0.0009339183711502991, 'sideways_atr_max_pct': 0.12358279584996196, 'sideways_tp_mult': 1.353243118675552, 'sideways_tsl_mult': 0.9586528166615131, 'sideways_time_stop': 201, 'sideways_use_sma': True, 'sideways_use_ema': False, 'sideways_use_atr': False, 'sideways_use_adx': True, 'sideways_use_spike': False, 'sideways_rsi_required': True}.
[I 2025-08-31 12:33:20,550] Trial 319 finished with values: [-1000000000.0, 1000000000.0] and parameters: {'p_sma': 55, 'p_std': 24, 'p_atr': 23, 'p_adx': 11, 'rsi_period': 77, 'ema1': 21, 'ema2': 19, 'slip_atr_k': 0.027912383073029297, 'slip_spread_k': 0.6979591560820118, 'spread_hl_frac': 0.01228078057831695, 'bb_std_mult': 1.5309773598895895, 'rsi_os': 49, 'rsi_ob': 76, 'vol_spike': 0.08647425847033291, 'adx_thresh': 28.52088370962511, 'atr_min_pct': 0.0010734414698566805, 'atr_max_pct': 0.1321772542783992, 'tp_mult': 1.7704263831728062, 'tsl_mult': 0.740272516916154, 'strategy': 'mean_reversion', 'time_stop': 36, 'use_sma': False, 'use_atr': True, 'use_adx': False, 'use_ema': False, 'use_spike': False, 'rsi_required': True, 'edge_k': 1.9018564109570164, 'edge_cap': 0.6818776171876115, 'bull_strategy': 'breakout', 'bull_bb_std_mult': 2.872305384814936, 'bull_rsi_os': 5, 'bull_rsi_ob': 73, 'bull_adx_thresh': 8.350840016112276, 'bull_atr_min_pct': 0.022131845553107724, 'bull_atr_max_pct': 0.07604184653409331, 'bull_tp_mult': 1.1479880970269933, 'bull_tsl_mult': 0.25352015287066787, 'bull_time_stop': 85, 'bull_use_sma': True, 'bull_use_ema': True, 'bull_use_atr': False, 'bull_use_adx': True, 'bull_use_spike': True, 'bull_rsi_required': False, 'bear_strategy': 'breakout', 'bear_bb_std_mult': 0.8236487382466617, 'bear_rsi_os': 52, 'bear_rsi_ob': 73, 'bear_adx_thresh': 19.70731015492102, 'bear_atr_min_pct': 0.026975555402893807, 'bear_atr_max_pct': 0.02610837746816276, 'bear_tp_mult': 2.355978230817614, 'bear_tsl_mult': 0.15301880366386847, 'bear_time_stop': 67, 'bear_use_sma': True, 'bear_use_ema': True, 'bear_use_atr': True, 'bear_use_adx': True, 'bear_use_spike': True, 'bear_rsi_required': True, 'sideways_strategy': 'breakout', 'sideways_bb_std_mult': 1.4279094260661864, 'sideways_rsi_os': 32, 'sideways_rsi_ob': 84, 'sideways_adx_thresh': 11.090405877299666, 'sideways_atr_min_pct': 0.0008185255819035725, 'sideways_atr_max_pct': 0.1278152107374758, 'sideways_tp_mult': 1.8691892941390693, 'sideways_tsl_mult': 0.21240579735190102, 'sideways_time_stop': 201, 'sideways_use_sma': True, 'sideways_use_ema': False, 'sideways_use_atr': False, 'sideways_use_adx': False, 'sideways_use_spike': False, 'sideways_rsi_required': True}.
[I 2025-08-31 12:33:53,136] Trial 321 finished with values: [-1000000000.0, 1000000000.0] and parameters: {'p_sma': 5, 'p_std': 46, 'p_atr': 14, 'p_adx': 18, 'rsi_period': 42, 'ema1': 23, 'ema2': 19, 'slip_atr_k': 0.027690717807312144, 'slip_spread_k': 0.509493812233558, 'spread_hl_frac': 0.018837992519273934, 'bb_std_mult': 2.062152172136642, 'rsi_os': 9, 'rsi_ob': 81, 'vol_spike': 0.08478158037397537, 'adx_thresh': 28.299001458045822, 'atr_min_pct': 0.012888477364689286, 'atr_max_pct': 0.13258978678086109, 'tp_mult': 1.4302816052534113, 'tsl_mult': 0.7563889134689101, 'strategy': 'breakout', 'time_stop': 161, 'use_sma': False, 'use_atr': True, 'use_adx': False, 'use_ema': True, 'use_spike': False, 'rsi_required': True, 'edge_k': 0.28616837428248765, 'edge_cap': 0.1509098644847361, 'bull_strategy': 'breakout', 'bull_bb_std_mult': 1.96105405856465, 'bull_rsi_os': 7, 'bull_rsi_ob': 78, 'bull_adx_thresh': 8.255952174834077, 'bull_atr_min_pct': 0.004183881496456985, 'bull_atr_max_pct': 0.1032250036338454, 'bull_tp_mult': 2.7374243309211734, 'bull_tsl_mult': 0.23019718648279802, 'bull_time_stop': 131, 'bull_use_sma': True, 'bull_use_ema': True, 'bull_use_atr': False, 'bull_use_adx': True, 'bull_use_spike': True, 'bull_rsi_required': False, 'bear_strategy': 'breakout', 'bear_bb_std_mult': 0.8065463066745138, 'bear_rsi_os': 33, 'bear_rsi_ob': 78, 'bear_adx_thresh': 33.63023619769058, 'bear_atr_min_pct': 0.02715185004486103, 'bear_atr_max_pct': 0.025816402252452825, 'bear_tp_mult': 2.8909338198563126, 'bear_tsl_mult': 0.9760753485102767, 'bear_time_stop': 258, 'bear_use_sma': True, 'bear_use_ema': True, 'bear_use_atr': True, 'bear_use_adx': True, 'bear_use_spike': False, 'bear_rsi_required': True, 'sideways_strategy': 'breakout', 'sideways_bb_std_mult': 3.4886802840985047, 'sideways_rsi_os': 55, 'sideways_rsi_ob': 81, 'sideways_adx_thresh': 10.83266283881563, 'sideways_atr_min_pct': 0.009777435182332107, 'sideways_atr_max_pct': 0.08331483163943726, 'sideways_tp_mult': 1.4347080541799944, 'sideways_tsl_mult': 0.21504267219933287, 'sideways_time_stop': 204, 'sideways_use_sma': True, 'sideways_use_ema': False, 'sideways_use_atr': False, 'sideways_use_adx': True, 'sideways_use_spike': False, 'sideways_rsi_required': True}.
[I 2025-08-31 12:33:53,143] Trial 322 finished with values: [-1000000000.0, 1000000000.0] and parameters: {'p_sma': 9, 'p_std': 25, 'p_atr': 11, 'p_adx': 18, 'rsi_period': 75, 'ema1': 23, 'ema2': 20, 'slip_atr_k': 0.028656534952956683, 'slip_spread_k': 0.6984264510737486, 'spread_hl_frac': 0.04111991126564387, 'bb_std_mult': 2.084421298879696, 'rsi_os': 49, 'rsi_ob': 71, 'vol_spike': 0.09812032178123614, 'adx_thresh': 21.64743268164302, 'atr_min_pct': 0.0006007351847615774, 'atr_max_pct': 0.023390594145789083, 'tp_mult': 2.6989069927424536, 'tsl_mult': 0.03578679541298149, 'strategy': 'breakout', 'time_stop': 212, 'use_sma': False, 'use_atr': True, 'use_adx': False, 'use_ema': True, 'use_spike': False, 'rsi_required': True, 'edge_k': 1.4950592242967005, 'edge_cap': 0.7842806244467369, 'bull_strategy': 'breakout', 'bull_bb_std_mult': 2.8441923635525095, 'bull_rsi_os': 11, 'bull_rsi_ob': 77, 'bull_adx_thresh': 27.578979275915813, 'bull_atr_min_pct': 0.00928691589355935, 'bull_atr_max_pct': 0.08994298946995752, 'bull_tp_mult': 1.760633670153845, 'bull_tsl_mult': 0.14783793035492848, 'bull_time_stop': 95, 'bull_use_sma': True, 'bull_use_ema': True, 'bull_use_atr': False, 'bull_use_adx': True, 'bull_use_spike': True, 'bull_rsi_required': False, 'bear_strategy': 'breakout', 'bear_bb_std_mult': 2.210023871874447, 'bear_rsi_os': 42, 'bear_rsi_ob': 92, 'bear_adx_thresh': 26.896400017931406, 'bear_atr_min_pct': 0.02548782671172173, 'bear_atr_max_pct': 0.042952215191409675, 'bear_tp_mult': 2.920867194851471, 'bear_tsl_mult': 0.06156054883333492, 'bear_time_stop': 247, 'bear_use_sma': True, 'bear_use_ema': True, 'bear_use_atr': True, 'bear_use_adx': True, 'bear_use_spike': False, 'bear_rsi_required': True, 'sideways_strategy': 'breakout', 'sideways_bb_std_mult': 3.4150201283928627, 'sideways_rsi_os': 35, 'sideways_rsi_ob': 80, 'sideways_adx_thresh': 12.564180580295519, 'sideways_atr_min_pct': 0.025154518806621, 'sideways_atr_max_pct': 0.1289317530860274, 'sideways_tp_mult': 1.1876235886279023, 'sideways_tsl_mult': 0.9498953819006577, 'sideways_time_stop': 262, 'sideways_use_sma': True, 'sideways_use_ema': False, 'sideways_use_atr': False, 'sideways_use_adx': True, 'sideways_use_spike': False, 'sideways_rsi_required': True}.
[I 2025-08-31 12:33:53,959] Trial 324 finished with values: [-1000000000.0, 1000000000.0] and parameters: {'p_sma': 52, 'p_std': 45, 'p_atr': 11, 'p_adx': 18, 'rsi_period': 11, 'ema1': 23, 'ema2': 17, 'slip_atr_k': 0.020540310883133996, 'slip_spread_k': 0.6054764760214583, 'spread_hl_frac': 0.017858800808205684, 'bb_std_mult': 2.127343857348381, 'rsi_os': 23, 'rsi_ob': 71, 'vol_spike': 0.09782461478150654, 'adx_thresh': 21.64932978925935, 'atr_min_pct': 6.996324426862717e-05, 'atr_max_pct': 0.1358777170799342, 'tp_mult': 2.7061549745071454, 'tsl_mult': 0.1560147748935154, 'strategy': 'breakout', 'time_stop': 212, 'use_sma': False, 'use_atr': True, 'use_adx': False, 'use_ema': True, 'use_spike': False, 'rsi_required': True, 'edge_k': 1.4791601998695025, 'edge_cap': 0.7823722122962651, 'bull_strategy': 'breakout', 'bull_bb_std_mult': 2.8824493160726026, 'bull_rsi_os': 22, 'bull_rsi_ob': 49, 'bull_adx_thresh': 27.509387353914043, 'bull_atr_min_pct': 0.0231494907155967, 'bull_atr_max_pct': 0.09079534299798622, 'bull_tp_mult': 1.749352271704924, 'bull_tsl_mult': 0.5478850308062938, 'bull_time_stop': 95, 'bull_use_sma': True, 'bull_use_ema': True, 'bull_use_atr': False, 'bull_use_adx': True, 'bull_use_spike': False, 'bull_rsi_required': False, 'bear_strategy': 'breakout', 'bear_bb_std_mult': 3.362942566231923, 'bear_rsi_os': 33, 'bear_rsi_ob': 81, 'bear_adx_thresh': 33.54954779638554, 'bear_atr_min_pct': 0.025695459498557408, 'bear_atr_max_pct': 0.08020456122406122, 'bear_tp_mult': 2.9295283713740305, 'bear_tsl_mult': 0.133095717187984, 'bear_time_stop': 196, 'bear_use_sma': True, 'bear_use_ema': True, 'bear_use_atr': True, 'bear_use_adx': True, 'bear_use_spike': False, 'bear_rsi_required': True, 'sideways_strategy': 'breakout', 'sideways_bb_std_mult': 3.413987066876979, 'sideways_rsi_os': 16, 'sideways_rsi_ob': 81, 'sideways_adx_thresh': 12.637696183428233, 'sideways_atr_min_pct': 0.025020592769982336, 'sideways_atr_max_pct': 0.025522104376019934, 'sideways_tp_mult': 2.456629049305728, 'sideways_tsl_mult': 0.8934077238322904, 'sideways_time_stop': 265, 'sideways_use_sma': True, 'sideways_use_ema': False, 'sideways_use_atr': False, 'sideways_use_adx': True, 'sideways_use_spike': False, 'sideways_rsi_required': True}.
