[I 2025-08-31 12:57:53,280] Trial 502 finished with values: [-0.16783879985644212, 0.16718702318770065] and parameters: {'p_sma': 15, 'p_std': 22, 'p_atr': 11, 'p_adx': 29, 'rsi_period': 49, 'ema1': 11, 'ema2': 14, 'slip_atr_k': 0.1713646066949407, 'slip_spread_k': 0.4982196385327904, 'spread_hl_frac': 0.011805548549693427, 'bb_std_mult': 2.3051055063327315, 'rsi_os': 29, 'rsi_ob': 52, 'vol_spike': 0.026734223750125175, 'adx_thresh': 18.817807356223618, 'atr_min_pct': 0.0008335247589613807, 'atr_max_pct': 0.08801498243344881, 'tp_mult': 1.908655438358295, 'tsl_mult': 0.021198944012838724, 'strategy': 'breakout', 'time_stop': 280, 'use_sma': True, 'use_atr': True, 'use_adx': True, 'use_ema': True, 'use_spike': False, 'rsi_required': True, 'edge_k': 0.13471258172091827, 'edge_cap': 0.753901988970763, 'bull_strategy': 'mean_reversion', 'bull_bb_std_mult': 2.746280150019569, 'bull_rsi_os': 28, 'bull_rsi_ob': 51, 'bull_adx_thresh': 18.954460308514744, 'bull_atr_min_pct': 0.002368261767447883, 'bull_atr_max_pct': 0.1459862124811708, 'bull_tp_mult': 1.6863071521644821, 'bull_tsl_mult': 0.24783096717280234, 'bull_time_stop': 295, 'bull_use_sma': True, 'bull_use_ema': False, 'bull_use_atr': True, 'bull_use_adx': True, 'bull_use_spike': True, 'bull_rsi_required': True, 'bear_strategy': 'breakout', 'bear_bb_std_mult': 3.268776228042534, 'bear_rsi_os': 48, 'bear_rsi_ob': 72, 'bear_adx_thresh': 10.114629987611927, 'bear_atr_min_pct': 0.0014036829430528366, 'bear_atr_max_pct': 0.14024626834335596, 'bear_tp_mult': 1.8878367444810251, 'bear_tsl_mult': 0.7817754241568375, 'bear_time_stop': 195, 'bear_use_sma': True, 'bear_use_ema': False, 'bear_use_atr': True, 'bear_use_adx': True, 'bear_use_spike': False, 'bear_rsi_required': False, 'sideways_strategy': 'breakout', 'sideways_bb_std_mult': 2.5567002240709513, 'sideways_rsi_os': 33, 'sideways_rsi_ob': 72, 'sideways_adx_thresh': 18.017404633287313, 'sideways_atr_min_pct': 0.028302527265522785, 'sideways_atr_max_pct': 0.13487351266574976, 'sideways_tp_mult': 2.869062874046689, 'sideways_tsl_mult': 0.8503328893536661, 'sideways_time_stop': 193, 'sideways_use_sma': False, 'sideways_use_ema': True, 'sideways_use_atr': False, 'sideways_use_adx': True, 'sideways_use_spike': False, 'sideways_rsi_required': True}.
[I 2025-08-31 12:57:53,413] Trial 503 finished with values: [-0.06772968999619278, 0.06751950193161599] and parameters: {'p_sma': 50, 'p_std': 23, 'p_atr': 10, 'p_adx': 29, 'rsi_period': 49, 'ema1': 19, 'ema2': 46, 'slip_atr_k': 0.046545831895019596, 'slip_spread_k': 0.3925522084800164, 'spread_hl_frac': 0.006652789903718117, 'bb_std_mult': 2.302535262879855, 'rsi_os': 54, 'rsi_ob': 95, 'vol_spike': 0.014996581240976394, 'adx_thresh': 19.33127443613252, 'atr_min_pct': 0.024832751767752764, 'atr_max_pct': 0.1292849021093433, 'tp_mult': 1.8812436495647968, 'tsl_mult': 0.225141790206989, 'strategy': 'breakout', 'time_stop': 162, 'use_sma': True, 'use_atr': True, 'use_adx': True, 'use_ema': True, 'use_spike': False, 'rsi_required': True, 'edge_k': 0.6712511516134207, 'edge_cap': 0.7530514832741091, 'bull_strategy': 'mean_reversion', 'bull_bb_std_mult': 1.350379279061582, 'bull_rsi_os': 40, 'bull_rsi_ob': 51, 'bull_adx_thresh': 13.25345725606391, 'bull_atr_min_pct': 0.002247449051891599, 'bull_atr_max_pct': 0.14984829995985469, 'bull_tp_mult': 1.6698067307399675, 'bull_tsl_mult': 0.2471583776930568, 'bull_time_stop': 179, 'bull_use_sma': True, 'bull_use_ema': False, 'bull_use_atr': True, 'bull_use_adx': True, 'bull_use_spike': True, 'bull_rsi_required': True, 'bear_strategy': 'breakout', 'bear_bb_std_mult': 3.2598303788910714, 'bear_rsi_os': 48, 'bear_rsi_ob': 79, 'bear_adx_thresh': 8.542197851184584, 'bear_atr_min_pct': 0.010923441954270707, 'bear_atr_max_pct': 0.1396229876472537, 'bear_tp_mult': 2.914577642281261, 'bear_tsl_mult': 0.7782394274676762, 'bear_time_stop': 116, 'bear_use_sma': True, 'bear_use_ema': True, 'bear_use_atr': True, 'bear_use_adx': True, 'bear_use_spike': True, 'bear_rsi_required': False, 'sideways_strategy': 'breakout', 'sideways_bb_std_mult': 2.513170829821452, 'sideways_rsi_os': 31, 'sideways_rsi_ob': 65, 'sideways_adx_thresh': 17.85378549309355, 'sideways_atr_min_pct': 0.0034638528067714096, 'sideways_atr_max_pct': 0.08369430577261766, 'sideways_tp_mult': 1.6078723861414208, 'sideways_tsl_mult': 0.8497426404044288, 'sideways_time_stop': 210, 'sideways_use_sma': False, 'sideways_use_ema': True, 'sideways_use_atr': False, 'sideways_use_adx': False, 'sideways_use_spike': False, 'sideways_rsi_required': True}.
[I 2025-08-31 12:58:25,248] Trial 509 finished with values: [-1000000000.0, 1000000000.0] and parameters: {'p_sma': 53, 'p_std': 54, 'p_atr': 18, 'p_adx': 15, 'rsi_period': 53, 'ema1': 16, 'ema2': 40, 'slip_atr_k': 0.12387234574276304, 'slip_spread_k': 0.05349393049672069, 'spread_hl_frac': 0.017148869716183422, 'bb_std_mult': 2.2247081446843646, 'rsi_os': 40, 'rsi_ob': 49, 'vol_spike': 0.15519605036957707, 'adx_thresh': 20.930481874759984, 'atr_min_pct': 0.0031417133820715376, 'atr_max_pct': 0.027353695117154665, 'tp_mult': 2.759292652096698, 'tsl_mult': 0.040094559280565045, 'strategy': 'breakout', 'time_stop': 177, 'use_sma': False, 'use_atr': False, 'use_adx': False, 'use_ema': True, 'use_spike': False, 'rsi_required': False, 'edge_k': 1.6422186362744309, 'edge_cap': 0.7223397863326211, 'bull_strategy': 'breakout', 'bull_bb_std_mult': 3.598625031207285, 'bull_rsi_os': 49, 'bull_rsi_ob': 67, 'bull_adx_thresh': 19.55938735981777, 'bull_atr_min_pct': 0.020647021814082935, 'bull_atr_max_pct': 0.14235120252680114, 'bull_tp_mult': 1.2444812421761018, 'bull_tsl_mult': 0.4854320394904912, 'bull_time_stop': 48, 'bull_use_sma': True, 'bull_use_ema': True, 'bull_use_atr': False, 'bull_use_adx': True, 'bull_use_spike': False, 'bull_rsi_required': False, 'bear_strategy': 'breakout', 'bear_bb_std_mult': 1.1413439869309592, 'bear_rsi_os': 28, 'bear_rsi_ob': 71, 'bear_adx_thresh': 5.066372269555055, 'bear_atr_min_pct': 0.0057255920351479105, 'bear_atr_max_pct': 0.12914063193341538, 'bear_tp_mult': 1.8072430127866523, 'bear_tsl_mult': 0.7140576857584581, 'bear_time_stop': 166, 'bear_use_sma': True, 'bear_use_ema': True, 'bear_use_atr': True, 'bear_use_adx': True, 'bear_use_spike': True, 'bear_rsi_required': True, 'sideways_strategy': 'mean_reversion', 'sideways_bb_std_mult': 1.496437638091189, 'sideways_rsi_os': 29, 'sideways_rsi_ob': 94, 'sideways_adx_thresh': 25.274129305754133, 'sideways_atr_min_pct': 0.008826829813163115, 'sideways_atr_max_pct': 0.01842013343862369, 'sideways_tp_mult': 1.9032364131329504, 'sideways_tsl_mult': 0.8914408485518663, 'sideways_time_stop': 217, 'sideways_use_sma': True, 'sideways_use_ema': False, 'sideways_use_atr': False, 'sideways_use_adx': False, 'sideways_use_spike': False, 'sideways_rsi_required': True}.
[I 2025-08-31 12:58:25,897] Trial 507 finished with values: [-0.041049685828251525, 0.041347329305080484] and parameters: {'p_sma': 25, 'p_std': 23, 'p_atr': 11, 'p_adx': 15, 'rsi_period': 52, 'ema1': 19, 'ema2': 14, 'slip_atr_k': 0.05970103916917955, 'slip_spread_k': 0.054753136255646095, 'spread_hl_frac': 0.0172946760077875, 'bb_std_mult': 2.815836203051752, 'rsi_os': 54, 'rsi_ob': 95, 'vol_spike': 0.013851466918112593, 'adx_thresh': 18.748695352061553, 'atr_min_pct': 0.012058886846486415, 'atr_max_pct': 0.12787188650131256, 'tp_mult': 1.931305418111141, 'tsl_mult': 0.31516695034612685, 'strategy': 'breakout', 'time_stop': 165, 'use_sma': False, 'use_atr': True, 'use_adx': False, 'use_ema': True, 'use_spike': False, 'rsi_required': True, 'edge_k': 0.6746731617849989, 'edge_cap': 0.7163095475462008, 'bull_strategy': 'breakout', 'bull_bb_std_mult': 1.787977077263297, 'bull_rsi_os': 28, 'bull_rsi_ob': 66, 'bull_adx_thresh': 18.948539290701454, 'bull_atr_min_pct': 0.001889911413968614, 'bull_atr_max_pct': 0.1499564538352149, 'bull_tp_mult': 1.225711975008195, 'bull_tsl_mult': 0.7393522172492051, 'bull_time_stop': 131, 'bull_use_sma': True, 'bull_use_ema': True, 'bull_use_atr': False, 'bull_use_adx': True, 'bull_use_spike': False, 'bull_rsi_required': False, 'bear_strategy': 'breakout', 'bear_bb_std_mult': 1.1451852517142989, 'bear_rsi_os': 28, 'bear_rsi_ob': 71, 'bear_adx_thresh': 13.306295917150928, 'bear_atr_min_pct': 0.01357603402269069, 'bear_atr_max_pct': 0.12965154727610395, 'bear_tp_mult': 2.9236482961781687, 'bear_tsl_mult': 0.977386194332179, 'bear_time_stop': 196, 'bear_use_sma': True, 'bear_use_ema': True, 'bear_use_atr': True, 'bear_use_adx': True, 'bear_use_spike': True, 'bear_rsi_required': True, 'sideways_strategy': 'breakout', 'sideways_bb_std_mult': 2.5023933065699437, 'sideways_rsi_os': 30, 'sideways_rsi_ob': 62, 'sideways_adx_thresh': 29.439089622553947, 'sideways_atr_min_pct': 0.0016287643103808855, 'sideways_atr_max_pct': 0.13776427205036587, 'sideways_tp_mult': 1.7599404478087501, 'sideways_tsl_mult': 0.544563628814916, 'sideways_time_stop': 143, 'sideways_use_sma': True, 'sideways_use_ema': False, 'sideways_use_atr': False, 'sideways_use_adx': False, 'sideways_use_spike': False, 'sideways_rsi_required': True}.
[I 2025-08-31 12:58:25,924] Trial 506 finished with values: [-1000000000.0, 1000000000.0] and parameters: {'p_sma': 38, 'p_std': 23, 'p_atr': 11, 'p_adx': 21, 'rsi_period': 53, 'ema1': 23, 'ema2': 14, 'slip_atr_k': 0.06050520261477809, 'slip_spread_k': 0.7979512816212406, 'spread_hl_frac': 0.03429804268509472, 'bb_std_mult': 2.6397834003723326, 'rsi_os': 34, 'rsi_ob': 94, 'vol_spike': 0.016900162089438363, 'adx_thresh': 21.180954675367342, 'atr_min_pct': 0.0019326933055697983, 'atr_max_pct': 0.1105804238109136, 'tp_mult': 2.7667605776916178, 'tsl_mult': 0.2319833968629591, 'strategy': 'breakout', 'time_stop': 181, 'use_sma': True, 'use_atr': True, 'use_adx': True, 'use_ema': True, 'use_spike': False, 'rsi_required': True, 'edge_k': 0.6716788388191173, 'edge_cap': 0.7183753269591985, 'bull_strategy': 'breakout', 'bull_bb_std_mult': 2.835229586421938, 'bull_rsi_os': 54, 'bull_rsi_ob': 52, 'bull_adx_thresh': 13.158213193162338, 'bull_atr_min_pct': 0.020846997538858644, 'bull_atr_max_pct': 0.03761840682445518, 'bull_tp_mult': 1.2108547303625945, 'bull_tsl_mult': 0.7208823222635438, 'bull_time_stop': 238, 'bull_use_sma': True, 'bull_use_ema': True, 'bull_use_atr': False, 'bull_use_adx': True, 'bull_use_spike': False, 'bull_rsi_required': False, 'bear_strategy': 'breakout', 'bear_bb_std_mult': 3.0207917408317355, 'bear_rsi_os': 54, 'bear_rsi_ob': 71, 'bear_adx_thresh': 8.617518116780598, 'bear_atr_min_pct': 0.010928681783006882, 'bear_atr_max_pct': 0.11723386573426939, 'bear_tp_mult': 2.9288682918176407, 'bear_tsl_mult': 0.02308047225471388, 'bear_time_stop': 162, 'bear_use_sma': True, 'bear_use_ema': True, 'bear_use_atr': True, 'bear_use_adx': True, 'bear_use_spike': True, 'bear_rsi_required': False, 'sideways_strategy': 'breakout', 'sideways_bb_std_mult': 0.7956813113469872, 'sideways_rsi_os': 33, 'sideways_rsi_ob': 60, 'sideways_adx_thresh': 21.076628867317005, 'sideways_atr_min_pct': 0.008756886352062888, 'sideways_atr_max_pct': 0.13743008210601737, 'sideways_tp_mult': 1.0554459263600977, 'sideways_tsl_mult': 0.8395798123949686, 'sideways_time_stop': 210, 'sideways_use_sma': True, 'sideways_use_ema': False, 'sideways_use_atr': False, 'sideways_use_adx': False, 'sideways_use_spike': False, 'sideways_rsi_required': True}.
[I 2025-08-31 12:58:26,118] Trial 508 finished with values: [-0.04078046489421372, 0.04078939500641695] and parameters: {'p_sma': 54, 'p_std': 23, 'p_atr': 30, 'p_adx': 15, 'rsi_period': 53, 'ema1': 19, 'ema2': 58, 'slip_atr_k': 0.06748808244271626, 'slip_spread_k': 0.061764917100421424, 'spread_hl_frac': 0.042557810365912975, 'bb_std_mult': 2.2378637270424813, 'rsi_os': 53, 'rsi_ob': 80, 'vol_spike': 0.015488555585683262, 'adx_thresh': 21.11498062028582, 'atr_min_pct': 0.001897516368140768, 'atr_max_pct': 0.14818766148159004, 'tp_mult': 2.760452860331888, 'tsl_mult': 0.23015234286243275, 'strategy': 'breakout', 'time_stop': 178, 'use_sma': False, 'use_atr': False, 'use_adx': False, 'use_ema': True, 'use_spike': False, 'rsi_required': True, 'edge_k': 1.399926108540214, 'edge_cap': 0.7358818293632347, 'bull_strategy': 'breakout', 'bull_bb_std_mult': 2.6321638314187474, 'bull_rsi_os': 6, 'bull_rsi_ob': 46, 'bull_adx_thresh': 12.81469996915008, 'bull_atr_min_pct': 0.012139858705357977, 'bull_atr_max_pct': 0.1426056012968152, 'bull_tp_mult': 1.209302205318176, 'bull_tsl_mult': 0.731965130814575, 'bull_time_stop': 155, 'bull_use_sma': True, 'bull_use_ema': True, 'bull_use_atr': False, 'bull_use_adx': True, 'bull_use_spike': False, 'bull_rsi_required': False, 'bear_strategy': 'breakout', 'bear_bb_std_mult': 1.1510623911291795, 'bear_rsi_os': 54, 'bear_rsi_ob': 56, 'bear_adx_thresh': 21.32130864569459, 'bear_atr_min_pct': 0.01103221367334607, 'bear_atr_max_pct': 0.1292852439629844, 'bear_tp_mult': 2.9263639046212147, 'bear_tsl_mult': 0.46688789396412206, 'bear_time_stop': 33, 'bear_use_sma': True, 'bear_use_ema': True, 'bear_use_atr': True, 'bear_use_adx': True, 'bear_use_spike': True, 'bear_rsi_required': True, 'sideways_strategy': 'mean_reversion', 'sideways_bb_std_mult': 0.7891197007917221, 'sideways_rsi_os': 29, 'sideways_rsi_ob': 62, 'sideways_adx_thresh': 33.22223608583777, 'sideways_atr_min_pct': 0.001719470731314543, 'sideways_atr_max_pct': 0.12333422522949149, 'sideways_tp_mult': 1.7137698769853427, 'sideways_tsl_mult': 0.2707975891823767, 'sideways_time_stop': 269, 'sideways_use_sma': True, 'sideways_use_ema': False, 'sideways_use_atr': False, 'sideways_use_adx': False, 'sideways_use_spike': False, 'sideways_rsi_required': True}.
[I 2025-08-31 12:58:57,451] Trial 511 finished with values: [-0.14822632846822403, 0.14798079482715087] and parameters: {'p_sma': 52, 'p_std': 24, 'p_atr': 11, 'p_adx': 14, 'rsi_period': 16, 'ema1': 20, 'ema2': 12, 'slip_atr_k': 0.14291344990809765, 'slip_spread_k': 0.44407896254247703, 'spread_hl_frac': 0.034218278197734556, 'bb_std_mult': 2.236661716937581, 'rsi_os': 38, 'rsi_ob': 81, 'vol_spike': 0.13032482963857184, 'adx_thresh': 21.24277995869916, 'atr_min_pct': 0.001858673080262845, 'atr_max_pct': 0.10275930422762922, 'tp_mult': 2.711651215438518, 'tsl_mult': 0.7615587650301816, 'strategy': 'breakout', 'time_stop': 169, 'use_sma': False, 'use_atr': True, 'use_adx': False, 'use_ema': True, 'use_spike': False, 'rsi_required': True, 'edge_k': 0.6272154859492635, 'edge_cap': 0.7247620623054563, 'bull_strategy': 'breakout', 'bull_bb_std_mult': 0.945914109940029, 'bull_rsi_os': 54, 'bull_rsi_ob': 72, 'bull_adx_thresh': 20.380912209055968, 'bull_atr_min_pct': 0.0191247025815564, 'bull_atr_max_pct': 0.13355702741927608, 'bull_tp_mult': 2.0746154851950247, 'bull_tsl_mult': 0.18956579855659045, 'bull_time_stop': 122, 'bull_use_sma': True, 'bull_use_ema': True, 'bull_use_atr': False, 'bull_use_adx': False, 'bull_use_spike': False, 'bull_rsi_required': False, 'bear_strategy': 'breakout', 'bear_bb_std_mult': 3.041485560727751, 'bear_rsi_os': 54, 'bear_rsi_ob': 56, 'bear_adx_thresh': 14.248673072236663, 'bear_atr_min_pct': 0.003799431453661706, 'bear_atr_max_pct': 0.14731222406861166, 'bear_tp_mult': 1.013912382212435, 'bear_tsl_mult': 0.7966659049507849, 'bear_time_stop': 191, 'bear_use_sma': True, 'bear_use_ema': True, 'bear_use_atr': True, 'bear_use_adx': True, 'bear_use_spike': True, 'bear_rsi_required': True, 'sideways_strategy': 'breakout', 'sideways_bb_std_mult': 0.6345507274268372, 'sideways_rsi_os': 44, 'sideways_rsi_ob': 66, 'sideways_adx_thresh': 33.55429107461521, 'sideways_atr_min_pct': 0.0021218705104510903, 'sideways_atr_max_pct': 0.12279482286200682, 'sideways_tp_mult': 1.7256346069756576, 'sideways_tsl_mult': 0.5185544247657399, 'sideways_time_stop': 300, 'sideways_use_sma': True, 'sideways_use_ema': False, 'sideways_use_atr': False, 'sideways_use_adx': False, 'sideways_use_spike': True, 'sideways_rsi_required': False}.
[I 2025-08-31 12:58:58,380] Trial 510 finished with values: [-0.01953065266475351, 0.020249986303137166] and parameters: {'p_sma': 38, 'p_std': 24, 'p_atr': 11, 'p_adx': 24, 'rsi_period': 47, 'ema1': 26, 'ema2': 58, 'slip_atr_k': 0.06040176313917518, 'slip_spread_k': 0.44467750549683466, 'spread_hl_frac': 0.03921687786043871, 'bb_std_mult': 2.2374942852547424, 'rsi_os': 35, 'rsi_ob': 80, 'vol_spike': 0.04514415948007151, 'adx_thresh': 21.261188864981857, 'atr_min_pct': 0.002029830554220615, 'atr_max_pct': 0.12715315975599562, 'tp_mult': 2.7305186469788723, 'tsl_mult': 0.06932488881723851, 'strategy': 'breakout', 'time_stop': 273, 'use_sma': False, 'use_atr': True, 'use_adx': False, 'use_ema': True, 'use_spike': False, 'rsi_required': True, 'edge_k': 1.387183615475933, 'edge_cap': 0.7062171162196037, 'bull_strategy': 'breakout', 'bull_bb_std_mult': 0.94564138031624, 'bull_rsi_os': 17, 'bull_rsi_ob': 72, 'bull_adx_thresh': 14.675211050435381, 'bull_atr_min_pct': 0.01915102254616847, 'bull_atr_max_pct': 0.03134712567598901, 'bull_tp_mult': 1.2002439381097338, 'bull_tsl_mult': 0.200830703733542, 'bull_time_stop': 266, 'bull_use_sma': True, 'bull_use_ema': True, 'bull_use_atr': False, 'bull_use_adx': False, 'bull_use_spike': False, 'bull_rsi_required': False, 'bear_strategy': 'breakout', 'bear_bb_std_mult': 3.036277241437797, 'bear_rsi_os': 31, 'bear_rsi_ob': 71, 'bear_adx_thresh': 13.118453015511863, 'bear_atr_min_pct': 0.00392342952302289, 'bear_atr_max_pct': 0.11647197275077027, 'bear_tp_mult': 1.351282213936286, 'bear_tsl_mult': 0.9715357523010786, 'bear_time_stop': 33, 'bear_use_sma': True, 'bear_use_ema': True, 'bear_use_atr': True, 'bear_use_adx': True, 'bear_use_spike': True, 'bear_rsi_required': True, 'sideways_strategy': 'breakout', 'sideways_bb_std_mult': 2.684094967036153, 'sideways_rsi_os': 29, 'sideways_rsi_ob': 67, 'sideways_adx_thresh': 26.397846858038655, 'sideways_atr_min_pct': 0.0017463020619829664, 'sideways_atr_max_pct': 0.12379354207593672, 'sideways_tp_mult': 1.531398779403209, 'sideways_tsl_mult': 0.8344141685761423, 'sideways_time_stop': 300, 'sideways_use_sma': True, 'sideways_use_ema': False, 'sideways_use_atr': False, 'sideways_use_adx': False, 'sideways_use_spike': True, 'sideways_rsi_required': True}.
[I 2025-08-31 12:58:58,503] Trial 512 finished with values: [-1000000000.0, 1000000000.0] and parameters: {'p_sma': 52, 'p_std': 24, 'p_atr': 9, 'p_adx': 14, 'rsi_period': 47, 'ema1': 29, 'ema2': 16, 'slip_atr_k': 0.06725148518488411, 'slip_spread_k': 0.7629287892870511, 'spread_hl_frac': 0.018306902706944163, 'bb_std_mult': 2.0808845745806557, 'rsi_os': 39, 'rsi_ob': 81, 'vol_spike': 0.042486579133709096, 'adx_thresh': 19.635835985233097, 'atr_min_pct': 0.006605773763058216, 'atr_max_pct': 0.12116011515538155, 'tp_mult': 2.713418528223489, 'tsl_mult': 0.7699433522677783, 'strategy': 'breakout', 'time_stop': 244, 'use_sma': False, 'use_atr': False, 'use_adx': False, 'use_ema': True, 'use_spike': False, 'rsi_required': False, 'edge_k': 1.4102568284904025, 'edge_cap': 0.7360314006586043, 'bull_strategy': 'breakout', 'bull_bb_std_mult': 3.462564454191575, 'bull_rsi_os': 6, 'bull_rsi_ob': 48, 'bull_adx_thresh': 16.40146498199767, 'bull_atr_min_pct': 0.01928665766019717, 'bull_atr_max_pct': 0.013416522818422025, 'bull_tp_mult': 2.341889974454033, 'bull_tsl_mult': 0.4314439335461502, 'bull_time_stop': 25, 'bull_use_sma': False, 'bull_use_ema': True, 'bull_use_atr': False, 'bull_use_adx': False, 'bull_use_spike': False, 'bull_rsi_required': False, 'bear_strategy': 'breakout', 'bear_bb_std_mult': 1.8820143228124198, 'bear_rsi_os': 31, 'bear_rsi_ob': 72, 'bear_adx_thresh': 14.224270097830228, 'bear_atr_min_pct': 0.003678341534168146, 'bear_atr_max_pct': 0.0766041823338781, 'bear_tp_mult': 2.387390289060116, 'bear_tsl_mult': 0.7973495944855307, 'bear_time_stop': 203, 'bear_use_sma': False, 'bear_use_ema': True, 'bear_use_atr': True, 'bear_use_adx': True, 'bear_use_spike': True, 'bear_rsi_required': True, 'sideways_strategy': 'mean_reversion', 'sideways_bb_std_mult': 2.8544220343762197, 'sideways_rsi_os': 43, 'sideways_rsi_ob': 67, 'sideways_adx_thresh': 21.892139763868496, 'sideways_atr_min_pct': 0.015438942727890368, 'sideways_atr_max_pct': 0.1233017459238961, 'sideways_tp_mult': 1.5551823165081817, 'sideways_tsl_mult': 0.17188481803746408, 'sideways_time_stop': 267, 'sideways_use_sma': True, 'sideways_use_ema': False, 'sideways_use_atr': False, 'sideways_use_adx': False, 'sideways_use_spike': True, 'sideways_rsi_required': False}.
