[I 2025-08-31 13:28:10,719] Trial 722 finished with values: [-1000000000.0, 1000000000.0] and parameters: {'p_sma': 37, 'p_std': 22, 'p_atr': 19, 'p_adx': 7, 'rsi_period': 27, 'ema1': 9, 'ema2': 20, 'slip_atr_k': 0.22297521825321204, 'slip_spread_k': 0.4410649342041294, 'spread_hl_frac': 0.03293185547282433, 'bb_std_mult': 2.4867651282498096, 'rsi_os': 51, 'rsi_ob': 86, 'vol_spike': 0.011852049897473828, 'adx_thresh': 11.875641879752935, 'atr_min_pct': 0.023688028222806704, 'atr_max_pct': 0.05450830345008549, 'tp_mult': 2.5267673718728303, 'tsl_mult': 0.5104878911680651, 'strategy': 'mean_reversion', 'time_stop': 57, 'use_sma': False, 'use_atr': False, 'use_adx': True, 'use_ema': True, 'use_spike': True, 'rsi_required': False, 'edge_k': 0.5719096531440357, 'edge_cap': 0.6475646313119418, 'bull_strategy': 'mean_reversion', 'bull_bb_std_mult': 2.8638500539216603, 'bull_rsi_os': 7, 'bull_rsi_ob': 86, 'bull_adx_thresh': 17.51869619196055, 'bull_atr_min_pct': 0.021087478599967707, 'bull_atr_max_pct': 0.1062070788844077, 'bull_tp_mult': 1.7869659145248384, 'bull_tsl_mult': 0.9744808062893915, 'bull_time_stop': 137, 'bull_use_sma': True, 'bull_use_ema': False, 'bull_use_atr': True, 'bull_use_adx': False, 'bull_use_spike': True, 'bull_rsi_required': True, 'bear_strategy': 'breakout', 'bear_bb_std_mult': 3.5999102098444866, 'bear_rsi_os': 26, 'bear_rsi_ob': 69, 'bear_adx_thresh': 27.566566362419884, 'bear_atr_min_pct': 0.002004888751970332, 'bear_atr_max_pct': 0.13027956188160947, 'bear_tp_mult': 1.05508739276078, 'bear_tsl_mult': 0.5575785082219251, 'bear_time_stop': 136, 'bear_use_sma': False, 'bear_use_ema': True, 'bear_use_atr': False, 'bear_use_adx': False, 'bear_use_spike': False, 'bear_rsi_required': True, 'sideways_strategy': 'breakout', 'sideways_bb_std_mult': 1.5590490885365187, 'sideways_rsi_os': 29, 'sideways_rsi_ob': 64, 'sideways_adx_thresh': 21.982490848177772, 'sideways_atr_min_pct': 0.009961216661352176, 'sideways_atr_max_pct': 0.14973178792847122, 'sideways_tp_mult': 1.8876025953105546, 'sideways_tsl_mult': 0.7564890022623993, 'sideways_time_stop': 49, 'sideways_use_sma': False, 'sideways_use_ema': False, 'sideways_use_atr': True, 'sideways_use_adx': True, 'sideways_use_spike': True, 'sideways_rsi_required': False}.
[I 2025-08-31 13:28:40,828] Trial 723 finished with values: [-1000000000.0, 1000000000.0] and parameters: {'p_sma': 42, 'p_std': 22, 'p_atr': 16, 'p_adx': 14, 'rsi_period': 23, 'ema1': 11, 'ema2': 23, 'slip_atr_k': 0.2213238706564137, 'slip_spread_k': 0.4369333626678045, 'spread_hl_frac': 0.010594283220009135, 'bb_std_mult': 2.458873932803468, 'rsi_os': 39, 'rsi_ob': 84, 'vol_spike': 0.28762871216699504, 'adx_thresh': 6.067397491499908, 'atr_min_pct': 0.024301591402331367, 'atr_max_pct': 0.05509389936493286, 'tp_mult': 2.541061690300711, 'tsl_mult': 0.5006799152448134, 'strategy': 'mean_reversion', 'time_stop': 72, 'use_sma': False, 'use_atr': False, 'use_adx': True, 'use_ema': True, 'use_spike': True, 'rsi_required': False, 'edge_k': 0.5024084801216425, 'edge_cap': 0.6456981049772039, 'bull_strategy': 'mean_reversion', 'bull_bb_std_mult': 3.5465075232473393, 'bull_rsi_os': 27, 'bull_rsi_ob': 85, 'bull_adx_thresh': 20.126014128811118, 'bull_atr_min_pct': 0.004465460504188605, 'bull_atr_max_pct': 0.13559301881838848, 'bull_tp_mult': 2.881453439455046, 'bull_tsl_mult': 0.9749939211113936, 'bull_time_stop': 138, 'bull_use_sma': False, 'bull_use_ema': True, 'bull_use_atr': True, 'bull_use_adx': False, 'bull_use_spike': True, 'bull_rsi_required': True, 'bear_strategy': 'breakout', 'bear_bb_std_mult': 3.547823722092665, 'bear_rsi_os': 32, 'bear_rsi_ob': 71, 'bear_adx_thresh': 26.82542441652498, 'bear_atr_min_pct': 0.011359167208079286, 'bear_atr_max_pct': 0.08534497262953504, 'bear_tp_mult': 1.0497101090517835, 'bear_tsl_mult': 0.05312821350323582, 'bear_time_stop': 214, 'bear_use_sma': False, 'bear_use_ema': True, 'bear_use_atr': False, 'bear_use_adx': False, 'bear_use_spike': False, 'bear_rsi_required': True, 'sideways_strategy': 'mean_reversion', 'sideways_bb_std_mult': 1.5748740508289316, 'sideways_rsi_os': 31, 'sideways_rsi_ob': 66, 'sideways_adx_thresh': 25.398473039208884, 'sideways_atr_min_pct': 0.0132698492282785, 'sideways_atr_max_pct': 0.14992920392723935, 'sideways_tp_mult': 1.7126321063232817, 'sideways_tsl_mult': 0.8619867588029444, 'sideways_time_stop': 48, 'sideways_use_sma': False, 'sideways_use_ema': False, 'sideways_use_atr': True, 'sideways_use_adx': True, 'sideways_use_spike': True, 'sideways_rsi_required': True}.
[I 2025-08-31 13:28:41,270] Trial 720 finished with values: [-0.06434508263355332, 0.06367092953603319] and parameters: {'p_sma': 37, 'p_std': 11, 'p_atr': 19, 'p_adx': 21, 'rsi_period': 28, 'ema1': 10, 'ema2': 20, 'slip_atr_k': 0.1825732355803323, 'slip_spread_k': 0.47844723462373906, 'spread_hl_frac': 0.0031266283142657517, 'bb_std_mult': 2.1883097442510313, 'rsi_os': 39, 'rsi_ob': 85, 'vol_spike': 0.011877344703871064, 'adx_thresh': 6.359377880224955, 'atr_min_pct': 0.024176721175850957, 'atr_max_pct': 0.05761473225458495, 'tp_mult': 2.524505216316142, 'tsl_mult': 0.8577574235761488, 'strategy': 'mean_reversion', 'time_stop': 171, 'use_sma': False, 'use_atr': False, 'use_adx': True, 'use_ema': True, 'use_spike': True, 'rsi_required': False, 'edge_k': 0.5852587439181702, 'edge_cap': 0.4329122582847911, 'bull_strategy': 'mean_reversion', 'bull_bb_std_mult': 2.7201607862024657, 'bull_rsi_os': 7, 'bull_rsi_ob': 87, 'bull_adx_thresh': 29.638407586293173, 'bull_atr_min_pct': 0.013314862402124969, 'bull_atr_max_pct': 0.10968824028275469, 'bull_tp_mult': 2.2521735446960305, 'bull_tsl_mult': 0.6272547277430739, 'bull_time_stop': 142, 'bull_use_sma': True, 'bull_use_ema': True, 'bull_use_atr': True, 'bull_use_adx': True, 'bull_use_spike': True, 'bull_rsi_required': True, 'bear_strategy': 'breakout', 'bear_bb_std_mult': 3.304573749669508, 'bear_rsi_os': 31, 'bear_rsi_ob': 71, 'bear_adx_thresh': 22.23450935175861, 'bear_atr_min_pct': 0.0018779814846983213, 'bear_atr_max_pct': 0.03550812239116014, 'bear_tp_mult': 1.2768795262129675, 'bear_tsl_mult': 0.45125881641557114, 'bear_time_stop': 217, 'bear_use_sma': False, 'bear_use_ema': True, 'bear_use_atr': False, 'bear_use_adx': False, 'bear_use_spike': False, 'bear_rsi_required': True, 'sideways_strategy': 'breakout', 'sideways_bb_std_mult': 1.4189425368559068, 'sideways_rsi_os': 29, 'sideways_rsi_ob': 64, 'sideways_adx_thresh': 25.40748466399534, 'sideways_atr_min_pct': 0.0037067983806234146, 'sideways_atr_max_pct': 0.1497749103422482, 'sideways_tp_mult': 1.7125422694012011, 'sideways_tsl_mult': 0.3714046726822642, 'sideways_time_stop': 35, 'sideways_use_sma': False, 'sideways_use_ema': False, 'sideways_use_atr': True, 'sideways_use_adx': True, 'sideways_use_spike': False, 'sideways_rsi_required': True}.
[I 2025-08-31 13:28:41,378] Trial 721 finished with values: [-1000000000.0, 1000000000.0] and parameters: {'p_sma': 37, 'p_std': 22, 'p_atr': 8, 'p_adx': 21, 'rsi_period': 28, 'ema1': 15, 'ema2': 20, 'slip_atr_k': 0.12986298569619448, 'slip_spread_k': 0.31719197706013436, 'spread_hl_frac': 0.032810272112995024, 'bb_std_mult': 2.5284671651490287, 'rsi_os': 44, 'rsi_ob': 86, 'vol_spike': 0.011553913388877669, 'adx_thresh': 11.712043194165494, 'atr_min_pct': 0.021771574794778117, 'atr_max_pct': 0.05880243837186335, 'tp_mult': 2.5227127142422847, 'tsl_mult': 0.782490401016407, 'strategy': 'mean_reversion', 'time_stop': 82, 'use_sma': False, 'use_atr': False, 'use_adx': True, 'use_ema': True, 'use_spike': True, 'rsi_required': False, 'edge_k': 0.5770279034023297, 'edge_cap': 0.6196975069372589, 'bull_strategy': 'mean_reversion', 'bull_bb_std_mult': 2.3138015073161977, 'bull_rsi_os': 50, 'bull_rsi_ob': 86, 'bull_adx_thresh': 17.456778642133685, 'bull_atr_min_pct': 0.013869453361676358, 'bull_atr_max_pct': 0.13458253483593283, 'bull_tp_mult': 1.7782835203929757, 'bull_tsl_mult': 0.3288078722004588, 'bull_time_stop': 199, 'bull_use_sma': True, 'bull_use_ema': False, 'bull_use_atr': True, 'bull_use_adx': False, 'bull_use_spike': True, 'bull_rsi_required': True, 'bear_strategy': 'breakout', 'bear_bb_std_mult': 3.592965811332702, 'bear_rsi_os': 55, 'bear_rsi_ob': 69, 'bear_adx_thresh': 27.50138803900803, 'bear_atr_min_pct': 0.021545478910989846, 'bear_atr_max_pct': 0.1243569559592771, 'bear_tp_mult': 1.0406874159193973, 'bear_tsl_mult': 0.721143010969451, 'bear_time_stop': 217, 'bear_use_sma': False, 'bear_use_ema': True, 'bear_use_atr': False, 'bear_use_adx': False, 'bear_use_spike': False, 'bear_rsi_required': True, 'sideways_strategy': 'breakout', 'sideways_bb_std_mult': 0.9392399433814713, 'sideways_rsi_os': 29, 'sideways_rsi_ob': 64, 'sideways_adx_thresh': 25.484014997531666, 'sideways_atr_min_pct': 0.009750695223542194, 'sideways_atr_max_pct': 0.1477673959084187, 'sideways_tp_mult': 1.7357669935228874, 'sideways_tsl_mult': 0.7689781502655988, 'sideways_time_stop': 50, 'sideways_use_sma': False, 'sideways_use_ema': False, 'sideways_use_atr': True, 'sideways_use_adx': True, 'sideways_use_spike': True, 'sideways_rsi_required': True}.
[I 2025-08-31 13:28:42,553] Trial 724 finished with values: [-1000000000.0, 1000000000.0] and parameters: {'p_sma': 22, 'p_std': 57, 'p_atr': 8, 'p_adx': 18, 'rsi_period': 23, 'ema1': 25, 'ema2': 23, 'slip_atr_k': 0.047839548875791935, 'slip_spread_k': 0.4849789614499579, 'spread_hl_frac': 0.010710176534744374, 'bb_std_mult': 2.448484615428073, 'rsi_os': 39, 'rsi_ob': 66, 'vol_spike': 0.011360485797454483, 'adx_thresh': 5.988338909439603, 'atr_min_pct': 0.02185899784371821, 'atr_max_pct': 0.056378616260172, 'tp_mult': 2.5252646057745363, 'tsl_mult': 0.8506166397182102, 'strategy': 'mean_reversion', 'time_stop': 157, 'use_sma': False, 'use_atr': False, 'use_adx': True, 'use_ema': True, 'use_spike': True, 'rsi_required': False, 'edge_k': 0.514562649386954, 'edge_cap': 0.6760615075445213, 'bull_strategy': 'mean_reversion', 'bull_bb_std_mult': 2.29429613832801, 'bull_rsi_os': 6, 'bull_rsi_ob': 85, 'bull_adx_thresh': 19.739936068870296, 'bull_atr_min_pct': 0.022470191925046075, 'bull_atr_max_pct': 0.1367769311765978, 'bull_tp_mult': 2.2297815738637548, 'bull_tsl_mult': 0.25781232657770475, 'bull_time_stop': 210, 'bull_use_sma': False, 'bull_use_ema': True, 'bull_use_atr': True, 'bull_use_adx': True, 'bull_use_spike': True, 'bull_rsi_required': True, 'bear_strategy': 'breakout', 'bear_bb_std_mult': 3.2780541052723575, 'bear_rsi_os': 31, 'bear_rsi_ob': 71, 'bear_adx_thresh': 25.07035746014922, 'bear_atr_min_pct': 0.024343774439581203, 'bear_atr_max_pct': 0.1065264112826717, 'bear_tp_mult': 1.3764623742173692, 'bear_tsl_mult': 0.7168684617807958, 'bear_time_stop': 216, 'bear_use_sma': False, 'bear_use_ema': True, 'bear_use_atr': False, 'bear_use_adx': False, 'bear_use_spike': False, 'bear_rsi_required': True, 'sideways_strategy': 'mean_reversion', 'sideways_bb_std_mult': 1.4632464334980733, 'sideways_rsi_os': 40, 'sideways_rsi_ob': 66, 'sideways_adx_thresh': 25.378882706252764, 'sideways_atr_min_pct': 0.004271741587541807, 'sideways_atr_max_pct': 0.1499224080005136, 'sideways_tp_mult': 1.7670465214905868, 'sideways_tsl_mult': 0.8712034734661449, 'sideways_time_stop': 19, 'sideways_use_sma': False, 'sideways_use_ema': False, 'sideways_use_atr': True, 'sideways_use_adx': True, 'sideways_use_spike': True, 'sideways_rsi_required': True}.
[I 2025-08-31 13:29:14,992] Trial 726 finished with values: [-1000000000.0, 1000000000.0] and parameters: {'p_sma': 26, 'p_std': 23, 'p_atr': 21, 'p_adx': 14, 'rsi_period': 52, 'ema1': 7, 'ema2': 19, 'slip_atr_k': 0.049409502173816, 'slip_spread_k': 0.4104681431658221, 'spread_hl_frac': 0.024761893936085164, 'bb_std_mult': 2.6417397806558514, 'rsi_os': 37, 'rsi_ob': 66, 'vol_spike': 0.01985989071201214, 'adx_thresh': 8.483481084827204, 'atr_min_pct': 0.018073004438581085, 'atr_max_pct': 0.034987553419556186, 'tp_mult': 2.5815317913303772, 'tsl_mult': 0.5594126333178137, 'strategy': 'breakout', 'time_stop': 157, 'use_sma': False, 'use_atr': False, 'use_adx': True, 'use_ema': True, 'use_spike': True, 'rsi_required': False, 'edge_k': 0.6210202032252456, 'edge_cap': 0.6796266090686994, 'bull_strategy': 'mean_reversion', 'bull_bb_std_mult': 2.793166497527036, 'bull_rsi_os': 6, 'bull_rsi_ob': 82, 'bull_adx_thresh': 18.788584029806852, 'bull_atr_min_pct': 0.02132509550158427, 'bull_atr_max_pct': 0.12557037245937056, 'bull_tp_mult': 2.2781002313570142, 'bull_tsl_mult': 0.5656166048851294, 'bull_time_stop': 210, 'bull_use_sma': False, 'bull_use_ema': True, 'bull_use_atr': True, 'bull_use_adx': True, 'bull_use_spike': True, 'bull_rsi_required': True, 'bear_strategy': 'breakout', 'bear_bb_std_mult': 3.3532813794472602, 'bear_rsi_os': 11, 'bear_rsi_ob': 57, 'bear_adx_thresh': 17.53125774175308, 'bear_atr_min_pct': 0.02448581839540274, 'bear_atr_max_pct': 0.11842186638256112, 'bear_tp_mult': 1.3803885433464653, 'bear_tsl_mult': 0.34033183448746995, 'bear_time_stop': 45, 'bear_use_sma': False, 'bear_use_ema': True, 'bear_use_atr': False, 'bear_use_adx': False, 'bear_use_spike': True, 'bear_rsi_required': True, 'sideways_strategy': 'mean_reversion', 'sideways_bb_std_mult': 2.6664697103984465, 'sideways_rsi_os': 31, 'sideways_rsi_ob': 66, 'sideways_adx_thresh': 23.360973807103896, 'sideways_atr_min_pct': 0.0028202848059537228, 'sideways_atr_max_pct': 0.1427931666866729, 'sideways_tp_mult': 1.7920145529877394, 'sideways_tsl_mult': 0.32858015222596176, 'sideways_time_stop': 23, 'sideways_use_sma': False, 'sideways_use_ema': False, 'sideways_use_atr': True, 'sideways_use_adx': True, 'sideways_use_spike': False, 'sideways_rsi_required': True}.
[I 2025-08-31 13:29:15,722] Trial 727 finished with values: [-1000000000.0, 1000000000.0] and parameters: {'p_sma': 9, 'p_std': 42, 'p_atr': 17, 'p_adx': 14, 'rsi_period': 37, 'ema1': 7, 'ema2': 19, 'slip_atr_k': 0.04742239178613749, 'slip_spread_k': 0.7511327528795713, 'spread_hl_frac': 0.01835668106669058, 'bb_std_mult': 2.239892749839673, 'rsi_os': 47, 'rsi_ob': 89, 'vol_spike': 0.020150917482964107, 'adx_thresh': 8.254850010616673, 'atr_min_pct': 0.027204282460807847, 'atr_max_pct': 0.04350379285961855, 'tp_mult': 2.396690420974121, 'tsl_mult': 0.6908954590119192, 'strategy': 'breakout', 'time_stop': 159, 'use_sma': False, 'use_atr': False, 'use_adx': True, 'use_ema': True, 'use_spike': True, 'rsi_required': False, 'edge_k': 0.619066880924088, 'edge_cap': 0.6765965977236341, 'bull_strategy': 'mean_reversion', 'bull_bb_std_mult': 2.7979442562573005, 'bull_rsi_os': 6, 'bull_rsi_ob': 82, 'bull_adx_thresh': 19.02845852824064, 'bull_atr_min_pct': 0.00653410448086379, 'bull_atr_max_pct': 0.11862427417006469, 'bull_tp_mult': 2.275167400109886, 'bull_tsl_mult': 0.4681246988611667, 'bull_time_stop': 210, 'bull_use_sma': False, 'bull_use_ema': True, 'bull_use_atr': True, 'bull_use_adx': True, 'bull_use_spike': True, 'bull_rsi_required': True, 'bear_strategy': 'breakout', 'bear_bb_std_mult': 3.277218964595455, 'bear_rsi_os': 11, 'bear_rsi_ob': 58, 'bear_adx_thresh': 16.01568090397611, 'bear_atr_min_pct': 0.01832948308801826, 'bear_atr_max_pct': 0.13261495999089284, 'bear_tp_mult': 1.3975033464773725, 'bear_tsl_mult': 0.0025701984677330425, 'bear_time_stop': 195, 'bear_use_sma': False, 'bear_use_ema': True, 'bear_use_atr': False, 'bear_use_adx': False, 'bear_use_spike': True, 'bear_rsi_required': True, 'sideways_strategy': 'mean_reversion', 'sideways_bb_std_mult': 2.7669062305632437, 'sideways_rsi_os': 55, 'sideways_rsi_ob': 65, 'sideways_adx_thresh': 23.18208281894346, 'sideways_atr_min_pct': 0.0029327232238229033, 'sideways_atr_max_pct': 0.14187270610099548, 'sideways_tp_mult': 2.852059857435747, 'sideways_tsl_mult': 0.8738310445128963, 'sideways_time_stop': 85, 'sideways_use_sma': False, 'sideways_use_ema': False, 'sideways_use_atr': True, 'sideways_use_adx': True, 'sideways_use_spike': False, 'sideways_rsi_required': True}.
[I 2025-08-31 13:29:15,869] Trial 725 finished with values: [-0.031221368115645243, 0.03108957183813222] and parameters: {'p_sma': 20, 'p_std': 57, 'p_atr': 8, 'p_adx': 14, 'rsi_period': 37, 'ema1': 17, 'ema2': 20, 'slip_atr_k': 0.048610128895910085, 'slip_spread_k': 0.417432115442752, 'spread_hl_frac': 0.018244592790554973, 'bb_std_mult': 2.234206978815327, 'rsi_os': 47, 'rsi_ob': 87, 'vol_spike': 0.010509542809493518, 'adx_thresh': 8.382810920764888, 'atr_min_pct': 0.018013671528921686, 'atr_max_pct': 0.028878606578801785, 'tp_mult': 2.5123389816587225, 'tsl_mult': 0.8671380632613765, 'strategy': 'breakout', 'time_stop': 158, 'use_sma': False, 'use_atr': False, 'use_adx': True, 'use_ema': True, 'use_spike': True, 'rsi_required': False, 'edge_k': 0.6342753961631022, 'edge_cap': 0.6777715289952717, 'bull_strategy': 'mean_reversion', 'bull_bb_std_mult': 2.7192424637815478, 'bull_rsi_os': 6, 'bull_rsi_ob': 84, 'bull_adx_thresh': 18.916104145522777, 'bull_atr_min_pct': 0.02970843064128591, 'bull_atr_max_pct': 0.12443456734107186, 'bull_tp_mult': 2.236511908545667, 'bull_tsl_mult': 0.8178451204930371, 'bull_time_stop': 211, 'bull_use_sma': True, 'bull_use_ema': True, 'bull_use_atr': True, 'bull_use_adx': True, 'bull_use_spike': True, 'bull_rsi_required': True, 'bear_strategy': 'breakout', 'bear_bb_std_mult': 3.305393366284539, 'bear_rsi_os': 31, 'bear_rsi_ob': 69, 'bear_adx_thresh': 23.353982573752333, 'bear_atr_min_pct': 0.009748820445028616, 'bear_atr_max_pct': 0.10739052348761376, 'bear_tp_mult': 1.3717596108756758, 'bear_tsl_mult': 0.7150077084905879, 'bear_time_stop': 180, 'bear_use_sma': False, 'bear_use_ema': True, 'bear_use_atr': False, 'bear_use_adx': False, 'bear_use_spike': True, 'bear_rsi_required': True, 'sideways_strategy': 'breakout', 'sideways_bb_std_mult': 0.9604847197972044, 'sideways_rsi_os': 40, 'sideways_rsi_ob': 65, 'sideways_adx_thresh': 25.513977591941757, 'sideways_atr_min_pct': 0.0029259155847405245, 'sideways_atr_max_pct': 0.14221621115765884, 'sideways_tp_mult': 1.7096944496422728, 'sideways_tsl_mult': 0.365296517431217, 'sideways_time_stop': 86, 'sideways_use_sma': False, 'sideways_use_ema': False, 'sideways_use_atr': True, 'sideways_use_adx': True, 'sideways_use_spike': False, 'sideways_rsi_required': True}.
[I 2025-08-31 13:29:15,988] Trial 728 finished with values: [-1000000000.0, 1000000000.0] and parameters: {'p_sma': 28, 'p_std': 23, 'p_atr': 21, 'p_adx': 26, 'rsi_period': 52, 'ema1': 7, 'ema2': 19, 'slip_atr_k': 0.03808824086498451, 'slip_spread_k': 0.9687474995847809, 'spread_hl_frac': 0.01863701446780478, 'bb_std_mult': 2.6314256271160383, 'rsi_os': 22, 'rsi_ob': 89, 'vol_spike': 0.020270859689005355, 'adx_thresh': 8.453831328354264, 'atr_min_pct': 0.01827392729468205, 'atr_max_pct': 0.043674496013285755, 'tp_mult': 2.592249470854734, 'tsl_mult': 0.6953497892382773, 'strategy': 'breakout', 'time_stop': 184, 'use_sma': False, 'use_atr': False, 'use_adx': True, 'use_ema': True, 'use_spike': True, 'rsi_required': False, 'edge_k': 0.6278133240928886, 'edge_cap': 0.675415608962637, 'bull_strategy': 'mean_reversion', 'bull_bb_std_mult': 2.7894426279118596, 'bull_rsi_os': 32, 'bull_rsi_ob': 84, 'bull_adx_thresh': 18.813048448387203, 'bull_atr_min_pct': 0.027218593004439046, 'bull_atr_max_pct': 0.1197957779277473, 'bull_tp_mult': 2.0016086689187635, 'bull_tsl_mult': 0.579309094185699, 'bull_time_stop': 171, 'bull_use_sma': True, 'bull_use_ema': True, 'bull_use_atr': True, 'bull_use_adx': True, 'bull_use_spike': True, 'bull_rsi_required': True, 'bear_strategy': 'breakout', 'bear_bb_std_mult': 3.453543764504632, 'bear_rsi_os': 29, 'bear_rsi_ob': 74, 'bear_adx_thresh': 17.442795558595357, 'bear_atr_min_pct': 0.0002311423122937481, 'bear_atr_max_pct': 0.11814960925782285, 'bear_tp_mult': 1.0165135005549413, 'bear_tsl_mult': 0.6598641027302627, 'bear_time_stop': 177, 'bear_use_sma': False, 'bear_use_ema': True, 'bear_use_atr': False, 'bear_use_adx': False, 'bear_use_spike': True, 'bear_rsi_required': True, 'sideways_strategy': 'breakout', 'sideways_bb_std_mult': 3.205802557989915, 'sideways_rsi_os': 31, 'sideways_rsi_ob': 73, 'sideways_adx_thresh': 32.59480653347011, 'sideways_atr_min_pct': 0.011302308829553685, 'sideways_atr_max_pct': 0.14684383363748457, 'sideways_tp_mult': 1.1062771149559891, 'sideways_tsl_mult': 0.9020663092333673, 'sideways_time_stop': 41, 'sideways_use_sma': False, 'sideways_use_ema': False, 'sideways_use_atr': True, 'sideways_use_adx': True, 'sideways_use_spike': False, 'sideways_rsi_required': True}.
