[I 2025-08-31 12:54:31,869] Trial 477 finished with values: [-1000000000.0, 1000000000.0] and parameters: {'p_sma': 52, 'p_std': 26, 'p_atr': 12, 'p_adx': 14, 'rsi_period': 50, 'ema1': 21, 'ema2': 54, 'slip_atr_k': 0.07524617505764603, 'slip_spread_k': 0.03057663296233093, 'spread_hl_frac': 0.014883851021441569, 'bb_std_mult': 0.6594967186081166, 'rsi_os': 40, 'rsi_ob': 56, 'vol_spike': 0.19596201297206195, 'adx_thresh': 6.948017100985323, 'atr_min_pct': 0.0008056117409378036, 'atr_max_pct': 0.1261444605488191, 'tp_mult': 2.6323804519557266, 'tsl_mult': 0.013086428324061261, 'strategy': 'breakout', 'time_stop': 190, 'use_sma': False, 'use_atr': True, 'use_adx': False, 'use_ema': True, 'use_spike': True, 'rsi_required': True, 'edge_k': 1.5150803924730099, 'edge_cap': 0.34908538262832844, 'bull_strategy': 'breakout', 'bull_bb_std_mult': 1.2795033186231564, 'bull_rsi_os': 52, 'bull_rsi_ob': 52, 'bull_adx_thresh': 31.859440033794293, 'bull_atr_min_pct': 0.0188885219985565, 'bull_atr_max_pct': 0.1438430074700622, 'bull_tp_mult': 1.2572427761013478, 'bull_tsl_mult': 0.16008681550484571, 'bull_time_stop': 290, 'bull_use_sma': True, 'bull_use_ema': True, 'bull_use_atr': False, 'bull_use_adx': True, 'bull_use_spike': False, 'bull_rsi_required': False, 'bear_strategy': 'breakout', 'bear_bb_std_mult': 3.2264575607473103, 'bear_rsi_os': 18, 'bear_rsi_ob': 54, 'bear_adx_thresh': 18.987206019641352, 'bear_atr_min_pct': 0.01998316242270076, 'bear_atr_max_pct': 0.06942563093326568, 'bear_tp_mult': 2.2916745737695203, 'bear_tsl_mult': 0.8289779471349463, 'bear_time_stop': 190, 'bear_use_sma': True, 'bear_use_ema': False, 'bear_use_atr': False, 'bear_use_adx': False, 'bear_use_spike': True, 'bear_rsi_required': False, 'sideways_strategy': 'breakout', 'sideways_bb_std_mult': 2.6943031458582065, 'sideways_rsi_os': 32, 'sideways_rsi_ob': 64, 'sideways_adx_thresh': 26.659459318433914, 'sideways_atr_min_pct': 0.0031347248055008624, 'sideways_atr_max_pct': 0.13410821765265926, 'sideways_tp_mult': 1.8138281279378685, 'sideways_tsl_mult': 0.8662338480377348, 'sideways_time_stop': 103, 'sideways_use_sma': True, 'sideways_use_ema': False, 'sideways_use_atr': True, 'sideways_use_adx': False, 'sideways_use_spike': False, 'sideways_rsi_required': True}.
[I 2025-08-31 12:54:32,418] Trial 478 finished with values: [-0.08808972638694124, 0.08860667368033281] and parameters: {'p_sma': 52, 'p_std': 21, 'p_atr': 12, 'p_adx': 14, 'rsi_period': 50, 'ema1': 26, 'ema2': 54, 'slip_atr_k': 0.0754342144591755, 'slip_spread_k': 0.024107896386042826, 'spread_hl_frac': 0.014932303872983728, 'bb_std_mult': 2.2346428572051855, 'rsi_os': 27, 'rsi_ob': 76, 'vol_spike': 0.04904447676642918, 'adx_thresh': 20.311241109812787, 'atr_min_pct': 0.0013938537230393623, 'atr_max_pct': 0.12650808945678801, 'tp_mult': 2.7394355455903914, 'tsl_mult': 0.014230882705081847, 'strategy': 'breakout', 'time_stop': 288, 'use_sma': False, 'use_atr': True, 'use_adx': False, 'use_ema': True, 'use_spike': True, 'rsi_required': True, 'edge_k': 0.5792474152539804, 'edge_cap': 0.8850532297256786, 'bull_strategy': 'breakout', 'bull_bb_std_mult': 1.2337975684176918, 'bull_rsi_os': 6, 'bull_rsi_ob': 52, 'bull_adx_thresh': 15.03113350893027, 'bull_atr_min_pct': 0.01896073518492288, 'bull_atr_max_pct': 0.14439204397827232, 'bull_tp_mult': 1.2655043778018855, 'bull_tsl_mult': 0.6254559497718521, 'bull_time_stop': 139, 'bull_use_sma': True, 'bull_use_ema': True, 'bull_use_atr': False, 'bull_use_adx': True, 'bull_use_spike': False, 'bull_rsi_required': False, 'bear_strategy': 'breakout', 'bear_bb_std_mult': 0.9184544697306067, 'bear_rsi_os': 43, 'bear_rsi_ob': 89, 'bear_adx_thresh': 13.594385926474759, 'bear_atr_min_pct': 0.0028212246510345646, 'bear_atr_max_pct': 0.06892669205457508, 'bear_tp_mult': 2.956266560774618, 'bear_tsl_mult': 0.4984350945230498, 'bear_time_stop': 189, 'bear_use_sma': True, 'bear_use_ema': False, 'bear_use_atr': False, 'bear_use_adx': False, 'bear_use_spike': True, 'bear_rsi_required': False, 'sideways_strategy': 'breakout', 'sideways_bb_std_mult': 2.6315797967888295, 'sideways_rsi_os': 48, 'sideways_rsi_ob': 64, 'sideways_adx_thresh': 24.78163658426787, 'sideways_atr_min_pct': 0.014829402994037425, 'sideways_atr_max_pct': 0.12264282537821258, 'sideways_tp_mult': 2.2526605300190234, 'sideways_tsl_mult': 0.861713610248564, 'sideways_time_stop': 192, 'sideways_use_sma': True, 'sideways_use_ema': False, 'sideways_use_atr': True, 'sideways_use_adx': False, 'sideways_use_spike': False, 'sideways_rsi_required': True}.
[I 2025-08-31 12:54:32,752] Trial 480 finished with values: [-0.08173330785433264, 0.08202145329534039] and parameters: {'p_sma': 52, 'p_std': 10, 'p_atr': 23, 'p_adx': 8, 'rsi_period': 8, 'ema1': 19, 'ema2': 15, 'slip_atr_k': 0.045832846352296695, 'slip_spread_k': 0.9085448900092135, 'spread_hl_frac': 0.017807654431346808, 'bb_std_mult': 2.2654306259015016, 'rsi_os': 40, 'rsi_ob': 80, 'vol_spike': 0.049500093875106385, 'adx_thresh': 10.23245655858042, 'atr_min_pct': 0.0011380501557086914, 'atr_max_pct': 0.12898470761594716, 'tp_mult': 2.74715325314914, 'tsl_mult': 0.9239077030488658, 'strategy': 'breakout', 'time_stop': 170, 'use_sma': False, 'use_atr': False, 'use_adx': False, 'use_ema': True, 'use_spike': False, 'rsi_required': False, 'edge_k': 0.5684382940621694, 'edge_cap': 0.7433516796885565, 'bull_strategy': 'breakout', 'bull_bb_std_mult': 0.997096543900994, 'bull_rsi_os': 6, 'bull_rsi_ob': 51, 'bull_adx_thresh': 12.924489093752072, 'bull_atr_min_pct': 0.00972221578838236, 'bull_atr_max_pct': 0.1445207314482547, 'bull_tp_mult': 1.2625693239843017, 'bull_tsl_mult': 0.15874437538652017, 'bull_time_stop': 290, 'bull_use_sma': False, 'bull_use_ema': False, 'bull_use_atr': False, 'bull_use_adx': True, 'bull_use_spike': False, 'bull_rsi_required': False, 'bear_strategy': 'breakout', 'bear_bb_std_mult': 3.2269677631116567, 'bear_rsi_os': 30, 'bear_rsi_ob': 72, 'bear_adx_thresh': 13.040546676913683, 'bear_atr_min_pct': 0.00256239665480135, 'bear_atr_max_pct': 0.12217705792664922, 'bear_tp_mult': 2.9542302025986005, 'bear_tsl_mult': 0.8274326911350629, 'bear_time_stop': 191, 'bear_use_sma': False, 'bear_use_ema': False, 'bear_use_atr': True, 'bear_use_adx': False, 'bear_use_spike': False, 'bear_rsi_required': True, 'sideways_strategy': 'mean_reversion', 'sideways_bb_std_mult': 2.6571800851684, 'sideways_rsi_os': 29, 'sideways_rsi_ob': 66, 'sideways_adx_thresh': 32.55762658394355, 'sideways_atr_min_pct': 0.005448355175967295, 'sideways_atr_max_pct': 0.03733299090442866, 'sideways_tp_mult': 2.808252703743466, 'sideways_tsl_mult': 0.9218647547419438, 'sideways_time_stop': 194, 'sideways_use_sma': False, 'sideways_use_ema': True, 'sideways_use_atr': True, 'sideways_use_adx': False, 'sideways_use_spike': False, 'sideways_rsi_required': False}.
[I 2025-08-31 12:54:32,840] Trial 479 finished with values: [-1000000000.0, 1000000000.0] and parameters: {'p_sma': 12, 'p_std': 38, 'p_atr': 22, 'p_adx': 14, 'rsi_period': 51, 'ema1': 28, 'ema2': 15, 'slip_atr_k': 0.06865617081526942, 'slip_spread_k': 0.3611823451753915, 'spread_hl_frac': 0.04727467941761698, 'bb_std_mult': 2.250442188619, 'rsi_os': 27, 'rsi_ob': 78, 'vol_spike': 0.1488534204888934, 'adx_thresh': 7.022922129679715, 'atr_min_pct': 0.0012689401631444952, 'atr_max_pct': 0.12636411148948237, 'tp_mult': 1.1900519612788445, 'tsl_mult': 0.012446868135561017, 'strategy': 'breakout', 'time_stop': 20, 'use_sma': False, 'use_atr': True, 'use_adx': False, 'use_ema': True, 'use_spike': True, 'rsi_required': True, 'edge_k': 0.8542059362221345, 'edge_cap': 0.8806668692353264, 'bull_strategy': 'breakout', 'bull_bb_std_mult': 1.2720143022037826, 'bull_rsi_os': 6, 'bull_rsi_ob': 49, 'bull_adx_thresh': 14.979516730473081, 'bull_atr_min_pct': 0.018919125388986126, 'bull_atr_max_pct': 0.14466499305377786, 'bull_tp_mult': 1.2667373324891207, 'bull_tsl_mult': 0.38255030633438775, 'bull_time_stop': 289, 'bull_use_sma': True, 'bull_use_ema': False, 'bull_use_atr': False, 'bull_use_adx': True, 'bull_use_spike': False, 'bull_rsi_required': False, 'bear_strategy': 'breakout', 'bear_bb_std_mult': 3.2387962728813156, 'bear_rsi_os': 18, 'bear_rsi_ob': 68, 'bear_adx_thresh': 13.24900760742902, 'bear_atr_min_pct': 0.0026423056754901024, 'bear_atr_max_pct': 0.12090895461025979, 'bear_tp_mult': 2.961807638067243, 'bear_tsl_mult': 0.37333397849406225, 'bear_time_stop': 193, 'bear_use_sma': True, 'bear_use_ema': False, 'bear_use_atr': False, 'bear_use_adx': False, 'bear_use_spike': False, 'bear_rsi_required': True, 'sideways_strategy': 'breakout', 'sideways_bb_std_mult': 2.6877008781573215, 'sideways_rsi_os': 48, 'sideways_rsi_ob': 64, 'sideways_adx_thresh': 5.404200296140388, 'sideways_atr_min_pct': 0.0031708551217435746, 'sideways_atr_max_pct': 0.03675502856795877, 'sideways_tp_mult': 2.2488643251748006, 'sideways_tsl_mult': 0.9151528782688301, 'sideways_time_stop': 48, 'sideways_use_sma': True, 'sideways_use_ema': True, 'sideways_use_atr': True, 'sideways_use_adx': False, 'sideways_use_spike': False, 'sideways_rsi_required': True}.
[I 2025-08-31 12:55:05,559] Trial 484 finished with values: [-0.06519827901922004, 0.06487315424884885] and parameters: {'p_sma': 51, 'p_std': 55, 'p_atr': 16, 'p_adx': 15, 'rsi_period': 51, 'ema1': 20, 'ema2': 17, 'slip_atr_k': 0.05043187551204101, 'slip_spread_k': 0.4118052115008069, 'spread_hl_frac': 0.01727676560513844, 'bb_std_mult': 2.4254236175430255, 'rsi_os': 7, 'rsi_ob': 79, 'vol_spike': 0.03865102531302365, 'adx_thresh': 29.917154623816664, 'atr_min_pct': 0.002515081098326887, 'atr_max_pct': 0.12211764240788595, 'tp_mult': 2.6826849707727827, 'tsl_mult': 0.9574089270254109, 'strategy': 'breakout', 'time_stop': 45, 'use_sma': False, 'use_atr': False, 'use_adx': True, 'use_ema': True, 'use_spike': False, 'rsi_required': False, 'edge_k': 0.7288044357586686, 'edge_cap': 0.6831950086883892, 'bull_strategy': 'breakout', 'bull_bb_std_mult': 2.818059323609914, 'bull_rsi_os': 5, 'bull_rsi_ob': 49, 'bull_adx_thresh': 20.088824570480096, 'bull_atr_min_pct': 0.004665090990068382, 'bull_atr_max_pct': 0.13687341486032192, 'bull_tp_mult': 1.3134383013472368, 'bull_tsl_mult': 0.2302789416891762, 'bull_time_stop': 278, 'bull_use_sma': False, 'bull_use_ema': True, 'bull_use_atr': True, 'bull_use_adx': True, 'bull_use_spike': False, 'bull_rsi_required': True, 'bear_strategy': 'mean_reversion', 'bear_bb_std_mult': 2.8877438771611805, 'bear_rsi_os': 31, 'bear_rsi_ob': 73, 'bear_adx_thresh': 27.621663465019978, 'bear_atr_min_pct': 0.015335581263979787, 'bear_atr_max_pct': 0.14460059491013902, 'bear_tp_mult': 2.906729309055346, 'bear_tsl_mult': 0.7339564049839233, 'bear_time_stop': 125, 'bear_use_sma': False, 'bear_use_ema': True, 'bear_use_atr': True, 'bear_use_adx': True, 'bear_use_spike': True, 'bear_rsi_required': True, 'sideways_strategy': 'mean_reversion', 'sideways_bb_std_mult': 0.8928897884392162, 'sideways_rsi_os': 52, 'sideways_rsi_ob': 54, 'sideways_adx_thresh': 30.113096175354105, 'sideways_atr_min_pct': 0.0018241678799393343, 'sideways_atr_max_pct': 0.04734076124690074, 'sideways_tp_mult': 1.6346517462354133, 'sideways_tsl_mult': 0.9827879379012854, 'sideways_time_stop': 213, 'sideways_use_sma': False, 'sideways_use_ema': False, 'sideways_use_atr': False, 'sideways_use_adx': False, 'sideways_use_spike': False, 'sideways_rsi_required': False}.
[I 2025-08-31 12:55:06,212] Trial 482 finished with values: [-1000000000.0, 1000000000.0] and parameters: {'p_sma': 51, 'p_std': 38, 'p_atr': 13, 'p_adx': 15, 'rsi_period': 51, 'ema1': 19, 'ema2': 15, 'slip_atr_k': 0.05011169258349081, 'slip_spread_k': 0.404492185011892, 'spread_hl_frac': 0.04703849276675824, 'bb_std_mult': 2.2856152937305048, 'rsi_os': 12, 'rsi_ob': 80, 'vol_spike': 0.01973810143960951, 'adx_thresh': 5.801684915587776, 'atr_min_pct': 0.0027575701738456393, 'atr_max_pct': 0.129166791718093, 'tp_mult': 2.310896132045587, 'tsl_mult': 0.915452579855538, 'strategy': 'breakout', 'time_stop': 166, 'use_sma': False, 'use_atr': False, 'use_adx': True, 'use_ema': True, 'use_spike': False, 'rsi_required': False, 'edge_k': 0.8581548794359402, 'edge_cap': 0.6821840483806935, 'bull_strategy': 'breakout', 'bull_bb_std_mult': 2.8237883323089177, 'bull_rsi_os': 5, 'bull_rsi_ob': 49, 'bull_adx_thresh': 11.581486388821721, 'bull_atr_min_pct': 0.019917955456449764, 'bull_atr_max_pct': 0.13771237997254612, 'bull_tp_mult': 1.2970590075351618, 'bull_tsl_mult': 0.037383026500659056, 'bull_time_stop': 276, 'bull_use_sma': False, 'bull_use_ema': False, 'bull_use_atr': True, 'bull_use_adx': True, 'bull_use_spike': False, 'bull_rsi_required': True, 'bear_strategy': 'mean_reversion', 'bear_bb_std_mult': 2.954773708992219, 'bear_rsi_os': 30, 'bear_rsi_ob': 72, 'bear_adx_thresh': 27.483147132019567, 'bear_atr_min_pct': 0.002357743558529574, 'bear_atr_max_pct': 0.12200856226639242, 'bear_tp_mult': 2.9158151878083998, 'bear_tsl_mult': 0.37435650468356363, 'bear_time_stop': 199, 'bear_use_sma': False, 'bear_use_ema': True, 'bear_use_atr': True, 'bear_use_adx': True, 'bear_use_spike': False, 'bear_rsi_required': True, 'sideways_strategy': 'mean_reversion', 'sideways_bb_std_mult': 0.9054297494366781, 'sideways_rsi_os': 28, 'sideways_rsi_ob': 70, 'sideways_adx_thresh': 28.535092374345794, 'sideways_atr_min_pct': 0.003990444226169775, 'sideways_atr_max_pct': 0.10714316417429573, 'sideways_tp_mult': 2.0896497620754566, 'sideways_tsl_mult': 0.8356943330613895, 'sideways_time_stop': 213, 'sideways_use_sma': False, 'sideways_use_ema': True, 'sideways_use_atr': False, 'sideways_use_adx': False, 'sideways_use_spike': False, 'sideways_rsi_required': False}.
[I 2025-08-31 12:55:06,320] Trial 481 finished with values: [-1000000000.0, 1000000000.0] and parameters: {'p_sma': 21, 'p_std': 21, 'p_atr': 8, 'p_adx': 21, 'rsi_period': 51, 'ema1': 19, 'ema2': 15, 'slip_atr_k': 0.0518692992890332, 'slip_spread_k': 0.4114506652544376, 'spread_hl_frac': 0.0475295316858931, 'bb_std_mult': 2.2515138039292615, 'rsi_os': 36, 'rsi_ob': 67, 'vol_spike': 0.17704304525212225, 'adx_thresh': 20.030474898631258, 'atr_min_pct': 0.001116351886950053, 'atr_max_pct': 0.12909176981736034, 'tp_mult': 2.3436191866907436, 'tsl_mult': 0.11917995360601956, 'strategy': 'breakout', 'time_stop': 165, 'use_sma': False, 'use_atr': False, 'use_adx': True, 'use_ema': True, 'use_spike': False, 'rsi_required': False, 'edge_k': 0.5752897069021566, 'edge_cap': 0.68186375027973, 'bull_strategy': 'breakout', 'bull_bb_std_mult': 2.840451554491055, 'bull_rsi_os': 6, 'bull_rsi_ob': 51, 'bull_adx_thresh': 20.898117451519468, 'bull_atr_min_pct': 0.019594690066145795, 'bull_atr_max_pct': 0.13991258979725418, 'bull_tp_mult': 1.2793570530203, 'bull_tsl_mult': 0.2358107808397162, 'bull_time_stop': 277, 'bull_use_sma': False, 'bull_use_ema': False, 'bull_use_atr': True, 'bull_use_adx': True, 'bull_use_spike': False, 'bull_rsi_required': True, 'bear_strategy': 'breakout', 'bear_bb_std_mult': 2.9102268903313653, 'bear_rsi_os': 30, 'bear_rsi_ob': 73, 'bear_adx_thresh': 13.001128577374791, 'bear_atr_min_pct': 0.0024352564557168156, 'bear_atr_max_pct': 0.07368413496860157, 'bear_tp_mult': 2.9608151128716105, 'bear_tsl_mult': 0.3801321500512109, 'bear_time_stop': 195, 'bear_use_sma': False, 'bear_use_ema': False, 'bear_use_atr': True, 'bear_use_adx': True, 'bear_use_spike': False, 'bear_rsi_required': True, 'sideways_strategy': 'mean_reversion', 'sideways_bb_std_mult': 2.57137090600933, 'sideways_rsi_os': 28, 'sideways_rsi_ob': 66, 'sideways_adx_thresh': 30.232597671864934, 'sideways_atr_min_pct': 0.0043103453489065635, 'sideways_atr_max_pct': 0.11533469031718376, 'sideways_tp_mult': 2.252702293135379, 'sideways_tsl_mult': 0.9168349954129915, 'sideways_time_stop': 49, 'sideways_use_sma': False, 'sideways_use_ema': True, 'sideways_use_atr': False, 'sideways_use_adx': False, 'sideways_use_spike': False, 'sideways_rsi_required': False}.
[I 2025-08-31 12:55:06,527] Trial 483 finished with values: [-1000000000.0, 1000000000.0] and parameters: {'p_sma': 51, 'p_std': 23, 'p_atr': 13, 'p_adx': 15, 'rsi_period': 51, 'ema1': 20, 'ema2': 17, 'slip_atr_k': 0.06761636632005719, 'slip_spread_k': 0.4077795821216066, 'spread_hl_frac': 0.01977484187447616, 'bb_std_mult': 2.45190667037381, 'rsi_os': 36, 'rsi_ob': 78, 'vol_spike': 0.019664770097741525, 'adx_thresh': 30.074249176443374, 'atr_min_pct': 0.0022916192382724143, 'atr_max_pct': 0.12108778991649459, 'tp_mult': 1.1943701628014605, 'tsl_mult': 0.9575890346649998, 'strategy': 'breakout', 'time_stop': 42, 'use_sma': False, 'use_atr': True, 'use_adx': True, 'use_ema': True, 'use_spike': False, 'rsi_required': True, 'edge_k': 0.7538255382423865, 'edge_cap': 0.6488362144926411, 'bull_strategy': 'breakout', 'bull_bb_std_mult': 2.823797144715867, 'bull_rsi_os': 5, 'bull_rsi_ob': 49, 'bull_adx_thresh': 21.022715722246556, 'bull_atr_min_pct': 0.01955946310139169, 'bull_atr_max_pct': 0.13652696871762504, 'bull_tp_mult': 1.2920666546350188, 'bull_tsl_mult': 0.23602124783533956, 'bull_time_stop': 34, 'bull_use_sma': True, 'bull_use_ema': False, 'bull_use_atr': True, 'bull_use_adx': True, 'bull_use_spike': False, 'bull_rsi_required': True, 'bear_strategy': 'mean_reversion', 'bear_bb_std_mult': 1.3763597035550958, 'bear_rsi_os': 28, 'bear_rsi_ob': 70, 'bear_adx_thresh': 12.620147749951048, 'bear_atr_min_pct': 0.014864416103391825, 'bear_atr_max_pct': 0.14487973659490277, 'bear_tp_mult': 2.6024555335617996, 'bear_tsl_mult': 0.6307277538868403, 'bear_time_stop': 198, 'bear_use_sma': True, 'bear_use_ema': True, 'bear_use_atr': True, 'bear_use_adx': True, 'bear_use_spike': False, 'bear_rsi_required': True, 'sideways_strategy': 'breakout', 'sideways_bb_std_mult': 0.901682615313685, 'sideways_rsi_os': 28, 'sideways_rsi_ob': 70, 'sideways_adx_thresh': 28.74310190251504, 'sideways_atr_min_pct': 0.022009034788697746, 'sideways_atr_max_pct': 0.03337598414072136, 'sideways_tp_mult': 1.6210091178369967, 'sideways_tsl_mult': 0.834747423351254, 'sideways_time_stop': 48, 'sideways_use_sma': False, 'sideways_use_ema': True, 'sideways_use_atr': False, 'sideways_use_adx': False, 'sideways_use_spike': False, 'sideways_rsi_required': True}.
[I 2025-08-31 12:55:07,351] Trial 487 finished with values: [-1000000000.0, 1000000000.0] and parameters: {'p_sma': 56, 'p_std': 43, 'p_atr': 13, 'p_adx': 10, 'rsi_period': 20, 'ema1': 20, 'ema2': 13, 'slip_atr_k': 0.22860914298247972, 'slip_spread_k': 0.45999122108202567, 'spread_hl_frac': 0.016222743021064266, 'bb_std_mult': 2.1329060428655726, 'rsi_os': 39, 'rsi_ob': 78, 'vol_spike': 0.2819313836325009, 'adx_thresh': 19.405247467811503, 'atr_min_pct': 0.016367086864874376, 'atr_max_pct': 0.010611717666046752, 'tp_mult': 2.805053683273831, 'tsl_mult': 0.0517201491931734, 'strategy': 'breakout', 'time_stop': 300, 'use_sma': True, 'use_atr': True, 'use_adx': False, 'use_ema': True, 'use_spike': False, 'rsi_required': True, 'edge_k': 0.7506633054816586, 'edge_cap': 0.6498520076436489, 'bull_strategy': 'mean_reversion', 'bull_bb_std_mult': 2.569111527692152, 'bull_rsi_os': 8, 'bull_rsi_ob': 47, 'bull_adx_thresh': 19.68768331685987, 'bull_atr_min_pct': 0.014656883012683579, 'bull_atr_max_pct': 0.14994200854350584, 'bull_tp_mult': 1.2454048944156355, 'bull_tsl_mult': 0.21336249288264444, 'bull_time_stop': 282, 'bull_use_sma': True, 'bull_use_ema': True, 'bull_use_atr': False, 'bull_use_adx': False, 'bull_use_spike': True, 'bull_rsi_required': False, 'bear_strategy': 'breakout', 'bear_bb_std_mult': 0.7718918195262263, 'bear_rsi_os': 20, 'bear_rsi_ob': 70, 'bear_adx_thresh': 6.19725646383981, 'bear_atr_min_pct': 0.016349919796042157, 'bear_atr_max_pct': 0.03303365363358373, 'bear_tp_mult': 2.850958289891809, 'bear_tsl_mult': 0.7627028996976024, 'bear_time_stop': 155, 'bear_use_sma': True, 'bear_use_ema': True, 'bear_use_atr': True, 'bear_use_adx': True, 'bear_use_spike': True, 'bear_rsi_required': True, 'sideways_strategy': 'breakout', 'sideways_bb_std_mult': 2.4210458997801863, 'sideways_rsi_os': 10, 'sideways_rsi_ob': 59, 'sideways_adx_thresh': 25.86415779517063, 'sideways_atr_min_pct': 0.020083939569400373, 'sideways_atr_max_pct': 0.033615892183583955, 'sideways_tp_mult': 2.006712098052641, 'sideways_tsl_mult': 0.7965293459015347, 'sideways_time_stop': 186, 'sideways_use_sma': True, 'sideways_use_ema': False, 'sideways_use_atr': False, 'sideways_use_adx': True, 'sideways_use_spike': True, 'sideways_rsi_required': True}.
