[I 2025-08-31 13:23:40,342] Trial 684 finished with values: [-0.02717548397547831, 0.026932475901210784] and parameters: {'p_sma': 27, 'p_std': 22, 'p_atr': 19, 'p_adx': 14, 'rsi_period': 7, 'ema1': 8, 'ema2': 20, 'slip_atr_k': 0.0385194808720961, 'slip_spread_k': 0.5640666487803815, 'spread_hl_frac': 0.02206997439918433, 'bb_std_mult': 2.3374789389628066, 'rsi_os': 39, 'rsi_ob': 90, 'vol_spike': 0.021500921841068648, 'adx_thresh': 9.70978465159731, 'atr_min_pct': 0.02755960173793698, 'atr_max_pct': 0.04884459782977243, 'tp_mult': 2.561922259283198, 'tsl_mult': 0.780684853579633, 'strategy': 'breakout', 'time_stop': 176, 'use_sma': False, 'use_atr': False, 'use_adx': True, 'use_ema': False, 'use_spike': True, 'rsi_required': False, 'edge_k': 0.6041217423154486, 'edge_cap': 0.6822131390808245, 'bull_strategy': 'mean_reversion', 'bull_bb_std_mult': 0.8981166471387345, 'bull_rsi_os': 33, 'bull_rsi_ob': 85, 'bull_adx_thresh': 18.333893876754814, 'bull_atr_min_pct': 0.021060161432623174, 'bull_atr_max_pct': 0.12792049198338004, 'bull_tp_mult': 2.447899461981889, 'bull_tsl_mult': 0.2856817507214294, 'bull_time_stop': 145, 'bull_use_sma': True, 'bull_use_ema': False, 'bull_use_atr': True, 'bull_use_adx': True, 'bull_use_spike': True, 'bull_rsi_required': True, 'bear_strategy': 'breakout', 'bear_bb_std_mult': 3.46636317899092, 'bear_rsi_os': 31, 'bear_rsi_ob': 68, 'bear_adx_thresh': 18.53229710231791, 'bear_atr_min_pct': 0.008942174708374329, 'bear_atr_max_pct': 0.1260470030649828, 'bear_tp_mult': 1.2005709089647665, 'bear_tsl_mult': 0.7109987301009479, 'bear_time_stop': 204, 'bear_use_sma': False, 'bear_use_ema': True, 'bear_use_atr': False, 'bear_use_adx': False, 'bear_use_spike': True, 'bear_rsi_required': True, 'sideways_strategy': 'breakout', 'sideways_bb_std_mult': 3.149507484405343, 'sideways_rsi_os': 46, 'sideways_rsi_ob': 66, 'sideways_adx_thresh': 22.6527242165495, 'sideways_atr_min_pct': 0.0030886313750346584, 'sideways_atr_max_pct': 0.14794487685976865, 'sideways_tp_mult': 1.7879495028466228, 'sideways_tsl_mult': 0.8173270137064594, 'sideways_time_stop': 57, 'sideways_use_sma': False, 'sideways_use_ema': True, 'sideways_use_atr': True, 'sideways_use_adx': True, 'sideways_use_spike': False, 'sideways_rsi_required': False}.
[I 2025-08-31 13:23:40,430] Trial 683 finished with values: [-0.05122891956800957, 0.05089335463166323] and parameters: {'p_sma': 19, 'p_std': 18, 'p_atr': 17, 'p_adx': 14, 'rsi_period': 33, 'ema1': 15, 'ema2': 20, 'slip_atr_k': 0.03962110702960325, 'slip_spread_k': 0.3788248404858437, 'spread_hl_frac': 0.004381653147373751, 'bb_std_mult': 1.5095317242416786, 'rsi_os': 29, 'rsi_ob': 90, 'vol_spike': 0.06270822152700663, 'adx_thresh': 9.630732823984813, 'atr_min_pct': 0.02561221471480576, 'atr_max_pct': 0.04877509692352832, 'tp_mult': 2.543416220713058, 'tsl_mult': 0.7893315520719879, 'strategy': 'breakout', 'time_stop': 170, 'use_sma': False, 'use_atr': False, 'use_adx': True, 'use_ema': False, 'use_spike': True, 'rsi_required': False, 'edge_k': 0.5893681363330432, 'edge_cap': 0.6854628437781797, 'bull_strategy': 'mean_reversion', 'bull_bb_std_mult': 0.8940343354422822, 'bull_rsi_os': 36, 'bull_rsi_ob': 85, 'bull_adx_thresh': 17.969287700698388, 'bull_atr_min_pct': 0.021163861027047995, 'bull_atr_max_pct': 0.12692592411952322, 'bull_tp_mult': 2.4373326391526904, 'bull_tsl_mult': 0.2812246653921997, 'bull_time_stop': 147, 'bull_use_sma': True, 'bull_use_ema': False, 'bull_use_atr': True, 'bull_use_adx': True, 'bull_use_spike': True, 'bull_rsi_required': True, 'bear_strategy': 'breakout', 'bear_bb_std_mult': 3.499363001480854, 'bear_rsi_os': 31, 'bear_rsi_ob': 68, 'bear_adx_thresh': 20.63224812685813, 'bear_atr_min_pct': 0.0006880561622282911, 'bear_atr_max_pct': 0.1270364844322523, 'bear_tp_mult': 1.1947263548619014, 'bear_tsl_mult': 0.6847694967285446, 'bear_time_stop': 285, 'bear_use_sma': False, 'bear_use_ema': True, 'bear_use_atr': False, 'bear_use_adx': False, 'bear_use_spike': True, 'bear_rsi_required': True, 'sideways_strategy': 'breakout', 'sideways_bb_std_mult': 3.0795202373129804, 'sideways_rsi_os': 54, 'sideways_rsi_ob': 76, 'sideways_adx_thresh': 22.5231028794966, 'sideways_atr_min_pct': 0.0031869709141439115, 'sideways_atr_max_pct': 0.1467036418694279, 'sideways_tp_mult': 1.7778701219628783, 'sideways_tsl_mult': 0.17087195305974162, 'sideways_time_stop': 55, 'sideways_use_sma': False, 'sideways_use_ema': True, 'sideways_use_atr': True, 'sideways_use_adx': True, 'sideways_use_spike': False, 'sideways_rsi_required': False}.
[I 2025-08-31 13:24:13,251] Trial 686 finished with values: [-1000000000.0, 1000000000.0] and parameters: {'p_sma': 11, 'p_std': 22, 'p_atr': 19, 'p_adx': 14, 'rsi_period': 25, 'ema1': 11, 'ema2': 21, 'slip_atr_k': 0.03573391492847284, 'slip_spread_k': 0.22748568324244733, 'spread_hl_frac': 0.03925386508277781, 'bb_std_mult': 2.3315457910122674, 'rsi_os': 39, 'rsi_ob': 89, 'vol_spike': 0.020756431899167267, 'adx_thresh': 9.751495074055814, 'atr_min_pct': 0.019420222604264053, 'atr_max_pct': 0.042186546718485714, 'tp_mult': 2.555266910952537, 'tsl_mult': 0.8345002590896577, 'strategy': 'mean_reversion', 'time_stop': 172, 'use_sma': False, 'use_atr': False, 'use_adx': True, 'use_ema': True, 'use_spike': True, 'rsi_required': False, 'edge_k': 0.49147860631551743, 'edge_cap': 0.6888239781257872, 'bull_strategy': 'mean_reversion', 'bull_bb_std_mult': 2.748536521995911, 'bull_rsi_os': 6, 'bull_rsi_ob': 85, 'bull_adx_thresh': 18.28206862073572, 'bull_atr_min_pct': 0.021285260457655646, 'bull_atr_max_pct': 0.12929815767203712, 'bull_tp_mult': 2.0855752089626165, 'bull_tsl_mult': 0.24784847312943598, 'bull_time_stop': 148, 'bull_use_sma': True, 'bull_use_ema': True, 'bull_use_atr': True, 'bull_use_adx': False, 'bull_use_spike': True, 'bull_rsi_required': True, 'bear_strategy': 'breakout', 'bear_bb_std_mult': 3.522113202511272, 'bear_rsi_os': 28, 'bear_rsi_ob': 63, 'bear_adx_thresh': 19.20522379259431, 'bear_atr_min_pct': 0.009097870467676933, 'bear_atr_max_pct': 0.010069033455613552, 'bear_tp_mult': 1.4598545162341008, 'bear_tsl_mult': 0.7127902717531366, 'bear_time_stop': 300, 'bear_use_sma': False, 'bear_use_ema': True, 'bear_use_atr': False, 'bear_use_adx': False, 'bear_use_spike': False, 'bear_rsi_required': True, 'sideways_strategy': 'breakout', 'sideways_bb_std_mult': 2.6960178132292816, 'sideways_rsi_os': 30, 'sideways_rsi_ob': 66, 'sideways_adx_thresh': 22.39660897139889, 'sideways_atr_min_pct': 0.0032154859691430615, 'sideways_atr_max_pct': 0.14738352821104436, 'sideways_tp_mult': 1.8002619556488766, 'sideways_tsl_mult': 0.8167126315626555, 'sideways_time_stop': 17, 'sideways_use_sma': False, 'sideways_use_ema': False, 'sideways_use_atr': True, 'sideways_use_adx': True, 'sideways_use_spike': True, 'sideways_rsi_required': True}.
[I 2025-08-31 13:24:13,632] Trial 687 finished with values: [-0.021884165410342216, 0.021638409749421453] and parameters: {'p_sma': 34, 'p_std': 22, 'p_atr': 19, 'p_adx': 14, 'rsi_period': 50, 'ema1': 8, 'ema2': 23, 'slip_atr_k': 0.040392153294370584, 'slip_spread_k': 0.7362179290403195, 'spread_hl_frac': 0.0218308173729361, 'bb_std_mult': 2.218463602177183, 'rsi_os': 40, 'rsi_ob': 89, 'vol_spike': 0.22113003665124314, 'adx_thresh': 9.937206028492584, 'atr_min_pct': 0.02571244320356097, 'atr_max_pct': 0.0601946856931012, 'tp_mult': 2.5508719705841982, 'tsl_mult': 0.8426691842482832, 'strategy': 'mean_reversion', 'time_stop': 173, 'use_sma': False, 'use_atr': False, 'use_adx': True, 'use_ema': True, 'use_spike': True, 'rsi_required': False, 'edge_k': 0.4844376980445637, 'edge_cap': 0.6910556204302611, 'bull_strategy': 'mean_reversion', 'bull_bb_std_mult': 2.739022153670967, 'bull_rsi_os': 46, 'bull_rsi_ob': 85, 'bull_adx_thresh': 17.581668426509452, 'bull_atr_min_pct': 0.021111116566207268, 'bull_atr_max_pct': 0.12751540438040754, 'bull_tp_mult': 2.0823927280343546, 'bull_tsl_mult': 0.28245702657015836, 'bull_time_stop': 170, 'bull_use_sma': True, 'bull_use_ema': False, 'bull_use_atr': True, 'bull_use_adx': False, 'bull_use_spike': True, 'bull_rsi_required': True, 'bear_strategy': 'breakout', 'bear_bb_std_mult': 3.3308274172194476, 'bear_rsi_os': 6, 'bear_rsi_ob': 86, 'bear_adx_thresh': 20.632534383753573, 'bear_atr_min_pct': 0.0016605713976059265, 'bear_atr_max_pct': 0.08296669284811613, 'bear_tp_mult': 1.382407425391642, 'bear_tsl_mult': 0.6659219060068349, 'bear_time_stop': 183, 'bear_use_sma': False, 'bear_use_ema': True, 'bear_use_atr': False, 'bear_use_adx': False, 'bear_use_spike': False, 'bear_rsi_required': True, 'sideways_strategy': 'breakout', 'sideways_bb_std_mult': 2.708394254244949, 'sideways_rsi_os': 48, 'sideways_rsi_ob': 66, 'sideways_adx_thresh': 23.854487253883043, 'sideways_atr_min_pct': 0.0031241705655597773, 'sideways_atr_max_pct': 0.14467232935915184, 'sideways_tp_mult': 1.7559447278661182, 'sideways_tsl_mult': 0.9093411646613805, 'sideways_time_stop': 16, 'sideways_use_sma': False, 'sideways_use_ema': False, 'sideways_use_atr': True, 'sideways_use_adx': True, 'sideways_use_spike': True, 'sideways_rsi_required': True}.
[I 2025-08-31 13:24:13,669] Trial 689 finished with values: [-1000000000.0, 1000000000.0] and parameters: {'p_sma': 11, 'p_std': 22, 'p_atr': 18, 'p_adx': 13, 'rsi_period': 49, 'ema1': 11, 'ema2': 23, 'slip_atr_k': 0.033173944098978725, 'slip_spread_k': 0.40829023209122806, 'spread_hl_frac': 0.021045373666619155, 'bb_std_mult': 2.7189667180957287, 'rsi_os': 40, 'rsi_ob': 95, 'vol_spike': 0.0069597695017135, 'adx_thresh': 5.697813766880472, 'atr_min_pct': 0.02489451500755444, 'atr_max_pct': 0.04584790903626566, 'tp_mult': 2.563624901459544, 'tsl_mult': 0.7637509523262316, 'strategy': 'mean_reversion', 'time_stop': 176, 'use_sma': False, 'use_atr': False, 'use_adx': True, 'use_ema': True, 'use_spike': True, 'rsi_required': False, 'edge_k': 0.5462699022479416, 'edge_cap': 0.6679054490614456, 'bull_strategy': 'mean_reversion', 'bull_bb_std_mult': 2.832764027426975, 'bull_rsi_os': 46, 'bull_rsi_ob': 88, 'bull_adx_thresh': 19.331364894330775, 'bull_atr_min_pct': 0.02247711211240943, 'bull_atr_max_pct': 0.12945820415453915, 'bull_tp_mult': 2.0769883987204194, 'bull_tsl_mult': 0.3434858221221666, 'bull_time_stop': 171, 'bull_use_sma': True, 'bull_use_ema': True, 'bull_use_atr': True, 'bull_use_adx': False, 'bull_use_spike': True, 'bull_rsi_required': True, 'bear_strategy': 'breakout', 'bear_bb_std_mult': 3.3091089464100403, 'bear_rsi_os': 6, 'bear_rsi_ob': 73, 'bear_adx_thresh': 16.33782544043541, 'bear_atr_min_pct': 0.001305504795919826, 'bear_atr_max_pct': 0.12404944284131737, 'bear_tp_mult': 1.0587523354867712, 'bear_tsl_mult': 0.6643070787189416, 'bear_time_stop': 183, 'bear_use_sma': False, 'bear_use_ema': True, 'bear_use_atr': False, 'bear_use_adx': False, 'bear_use_spike': False, 'bear_rsi_required': True, 'sideways_strategy': 'breakout', 'sideways_bb_std_mult': 2.6940918698099146, 'sideways_rsi_os': 30, 'sideways_rsi_ob': 60, 'sideways_adx_thresh': 25.148597224959257, 'sideways_atr_min_pct': 0.02246063456465834, 'sideways_atr_max_pct': 0.1399917530331706, 'sideways_tp_mult': 1.6801269743098983, 'sideways_tsl_mult': 0.909190461214077, 'sideways_time_stop': 64, 'sideways_use_sma': False, 'sideways_use_ema': False, 'sideways_use_atr': True, 'sideways_use_adx': True, 'sideways_use_spike': True, 'sideways_rsi_required': True}.
[I 2025-08-31 13:24:13,902] Trial 688 finished with values: [-0.07584229436677103, 0.0757297975050279] and parameters: {'p_sma': 11, 'p_std': 21, 'p_atr': 15, 'p_adx': 14, 'rsi_period': 25, 'ema1': 16, 'ema2': 21, 'slip_atr_k': 0.04221753733380124, 'slip_spread_k': 0.3765840182312938, 'spread_hl_frac': 0.004258874987910884, 'bb_std_mult': 1.5061545318397869, 'rsi_os': 21, 'rsi_ob': 85, 'vol_spike': 0.0617010819737219, 'adx_thresh': 5.52156278411066, 'atr_min_pct': 0.025423435047237642, 'atr_max_pct': 0.04169664648260357, 'tp_mult': 2.5347160343015416, 'tsl_mult': 0.8328273588644904, 'strategy': 'mean_reversion', 'time_stop': 173, 'use_sma': False, 'use_atr': False, 'use_adx': True, 'use_ema': True, 'use_spike': True, 'rsi_required': False, 'edge_k': 0.5043383918485657, 'edge_cap': 0.667665802994165, 'bull_strategy': 'mean_reversion', 'bull_bb_std_mult': 1.5541399944636802, 'bull_rsi_os': 46, 'bull_rsi_ob': 87, 'bull_adx_thresh': 17.68502650203327, 'bull_atr_min_pct': 0.021881486356112596, 'bull_atr_max_pct': 0.1263693394869929, 'bull_tp_mult': 2.0875485894676715, 'bull_tsl_mult': 0.2480613198986962, 'bull_time_stop': 169, 'bull_use_sma': True, 'bull_use_ema': True, 'bull_use_atr': True, 'bull_use_adx': False, 'bull_use_spike': True, 'bull_rsi_required': True, 'bear_strategy': 'breakout', 'bear_bb_std_mult': 3.329666116047569, 'bear_rsi_os': 45, 'bear_rsi_ob': 71, 'bear_adx_thresh': 16.471824878974978, 'bear_atr_min_pct': 0.0016368701732964424, 'bear_atr_max_pct': 0.12443719041177201, 'bear_tp_mult': 1.4000619708186686, 'bear_tsl_mult': 0.6832891463289313, 'bear_time_stop': 189, 'bear_use_sma': False, 'bear_use_ema': True, 'bear_use_atr': False, 'bear_use_adx': False, 'bear_use_spike': False, 'bear_rsi_required': True, 'sideways_strategy': 'breakout', 'sideways_bb_std_mult': 2.70103297282466, 'sideways_rsi_os': 30, 'sideways_rsi_ob': 58, 'sideways_adx_thresh': 25.066467834347712, 'sideways_atr_min_pct': 0.003248640090509804, 'sideways_atr_max_pct': 0.14490743929289587, 'sideways_tp_mult': 1.7489374164888507, 'sideways_tsl_mult': 0.9321525795209751, 'sideways_time_stop': 13, 'sideways_use_sma': False, 'sideways_use_ema': False, 'sideways_use_atr': True, 'sideways_use_adx': True, 'sideways_use_spike': True, 'sideways_rsi_required': True}.
[I 2025-08-31 13:24:46,652] Trial 690 finished with values: [-0.10687565680781064, 0.10633662173120935] and parameters: {'p_sma': 38, 'p_std': 22, 'p_atr': 14, 'p_adx': 13, 'rsi_period': 46, 'ema1': 16, 'ema2': 18, 'slip_atr_k': 0.04227724198982359, 'slip_spread_k': 0.4294146623514177, 'spread_hl_frac': 0.01831975974599362, 'bb_std_mult': 2.748708536835162, 'rsi_os': 49, 'rsi_ob': 93, 'vol_spike': 0.2202558564124421, 'adx_thresh': 8.818838978251678, 'atr_min_pct': 0.024547176862783942, 'atr_max_pct': 0.06018723126875331, 'tp_mult': 2.427005031081525, 'tsl_mult': 0.7637107635501099, 'strategy': 'mean_reversion', 'time_stop': 182, 'use_sma': False, 'use_atr': False, 'use_adx': True, 'use_ema': True, 'use_spike': True, 'rsi_required': False, 'edge_k': 0.5259621047561649, 'edge_cap': 0.6664951818441038, 'bull_strategy': 'mean_reversion', 'bull_bb_std_mult': 2.2558392857503247, 'bull_rsi_os': 6, 'bull_rsi_ob': 87, 'bull_adx_thresh': 19.197276223962746, 'bull_atr_min_pct': 0.02224911710614473, 'bull_atr_max_pct': 0.13763426651058946, 'bull_tp_mult': 2.3609899868482644, 'bull_tsl_mult': 0.24992822972133763, 'bull_time_stop': 169, 'bull_use_sma': True, 'bull_use_ema': True, 'bull_use_atr': True, 'bull_use_adx': False, 'bull_use_spike': True, 'bull_rsi_required': True, 'bear_strategy': 'breakout', 'bear_bb_std_mult': 3.307781498579875, 'bear_rsi_os': 45, 'bear_rsi_ob': 73, 'bear_adx_thresh': 22.786095883894156, 'bear_atr_min_pct': 0.0016577395206151756, 'bear_atr_max_pct': 0.04230982797382745, 'bear_tp_mult': 1.4041883924875518, 'bear_tsl_mult': 0.6694265737854287, 'bear_time_stop': 183, 'bear_use_sma': False, 'bear_use_ema': True, 'bear_use_atr': False, 'bear_use_adx': False, 'bear_use_spike': False, 'bear_rsi_required': True, 'sideways_strategy': 'breakout', 'sideways_bb_std_mult': 0.8180154826990922, 'sideways_rsi_os': 30, 'sideways_rsi_ob': 57, 'sideways_adx_thresh': 23.7373365975986, 'sideways_atr_min_pct': 0.004040077566495897, 'sideways_atr_max_pct': 0.1406093076256451, 'sideways_tp_mult': 1.7397083378809457, 'sideways_tsl_mult': 0.9123781205608006, 'sideways_time_stop': 63, 'sideways_use_sma': False, 'sideways_use_ema': False, 'sideways_use_atr': True, 'sideways_use_adx': True, 'sideways_use_spike': True, 'sideways_rsi_required': True}.
[I 2025-08-31 13:24:46,809] Trial 692 finished with values: [-0.09221312574747009, 0.09161492478580799] and parameters: {'p_sma': 38, 'p_std': 21, 'p_atr': 15, 'p_adx': 13, 'rsi_period': 46, 'ema1': 12, 'ema2': 18, 'slip_atr_k': 0.047484099327309015, 'slip_spread_k': 0.5026933090591792, 'spread_hl_frac': 0.01665642360262659, 'bb_std_mult': 1.6650210635463956, 'rsi_os': 38, 'rsi_ob': 93, 'vol_spike': 0.014647558296647444, 'adx_thresh': 8.46346425114223, 'atr_min_pct': 0.023955319359553216, 'atr_max_pct': 0.034293535092344535, 'tp_mult': 2.434191219876113, 'tsl_mult': 0.5623843677942207, 'strategy': 'breakout', 'time_stop': 235, 'use_sma': False, 'use_atr': False, 'use_adx': True, 'use_ema': True, 'use_spike': True, 'rsi_required': False, 'edge_k': 0.5098887672053268, 'edge_cap': 0.6167062080541623, 'bull_strategy': 'mean_reversion', 'bull_bb_std_mult': 0.5554816677860985, 'bull_rsi_os': 6, 'bull_rsi_ob': 87, 'bull_adx_thresh': 17.719055224952896, 'bull_atr_min_pct': 0.02201015652772351, 'bull_atr_max_pct': 0.13746750996096704, 'bull_tp_mult': 2.5451037490575783, 'bull_tsl_mult': 0.25506801798842105, 'bull_time_stop': 161, 'bull_use_sma': False, 'bull_use_ema': True, 'bull_use_atr': True, 'bull_use_adx': True, 'bull_use_spike': True, 'bull_rsi_required': True, 'bear_strategy': 'breakout', 'bear_bb_std_mult': 3.3768894147678177, 'bear_rsi_os': 40, 'bear_rsi_ob': 71, 'bear_adx_thresh': 22.886964321061633, 'bear_atr_min_pct': 0.00015788718465357108, 'bear_atr_max_pct': 0.041921084609056115, 'bear_tp_mult': 1.0916542037409704, 'bear_tsl_mult': 0.678436620189935, 'bear_time_stop': 58, 'bear_use_sma': False, 'bear_use_ema': True, 'bear_use_atr': False, 'bear_use_adx': False, 'bear_use_spike': True, 'bear_rsi_required': True, 'sideways_strategy': 'mean_reversion', 'sideways_bb_std_mult': 0.7793380056375674, 'sideways_rsi_os': 29, 'sideways_rsi_ob': 92, 'sideways_adx_thresh': 25.09377415435847, 'sideways_atr_min_pct': 0.004234212061367137, 'sideways_atr_max_pct': 0.14997813910346264, 'sideways_tp_mult': 1.7127254530689642, 'sideways_tsl_mult': 0.8754241011039458, 'sideways_time_stop': 43, 'sideways_use_sma': False, 'sideways_use_ema': False, 'sideways_use_atr': True, 'sideways_use_adx': True, 'sideways_use_spike': False, 'sideways_rsi_required': True}.
[I 2025-08-31 13:24:47,189] Trial 691 finished with values: [-1000000000.0, 1000000000.0] and parameters: {'p_sma': 29, 'p_std': 21, 'p_atr': 14, 'p_adx': 13, 'rsi_period': 46, 'ema1': 12, 'ema2': 18, 'slip_atr_k': 0.046662467870509566, 'slip_spread_k': 0.8169638452287813, 'spread_hl_frac': 0.018534533523853154, 'bb_std_mult': 2.239616659464905, 'rsi_os': 49, 'rsi_ob': 93, 'vol_spike': 0.006229565355302502, 'adx_thresh': 5.020115665791845, 'atr_min_pct': 0.023949040208458165, 'atr_max_pct': 0.04583326591371101, 'tp_mult': 2.5182540605794115, 'tsl_mult': 0.6293001742554514, 'strategy': 'breakout', 'time_stop': 32, 'use_sma': False, 'use_atr': False, 'use_adx': True, 'use_ema': True, 'use_spike': True, 'rsi_required': False, 'edge_k': 0.5177968723126721, 'edge_cap': 0.6090625093443572, 'bull_strategy': 'mean_reversion', 'bull_bb_std_mult': 2.821576981170589, 'bull_rsi_os': 23, 'bull_rsi_ob': 88, 'bull_adx_thresh': 33.42992257974135, 'bull_atr_min_pct': 0.022130658059993175, 'bull_atr_max_pct': 0.13637919786163977, 'bull_tp_mult': 2.519663919856807, 'bull_tsl_mult': 0.24557827197756257, 'bull_time_stop': 165, 'bull_use_sma': True, 'bull_use_ema': True, 'bull_use_atr': True, 'bull_use_adx': True, 'bull_use_spike': True, 'bull_rsi_required': True, 'bear_strategy': 'breakout', 'bear_bb_std_mult': 3.3240991790883783, 'bear_rsi_os': 33, 'bear_rsi_ob': 73, 'bear_adx_thresh': 16.32144968316643, 'bear_atr_min_pct': 0.01590145920033316, 'bear_atr_max_pct': 0.12458421791201672, 'bear_tp_mult': 1.0760882825846072, 'bear_tsl_mult': 0.6777858371022419, 'bear_time_stop': 199, 'bear_use_sma': False, 'bear_use_ema': True, 'bear_use_atr': False, 'bear_use_adx': False, 'bear_use_spike': True, 'bear_rsi_required': True, 'sideways_strategy': 'breakout', 'sideways_bb_std_mult': 2.797308334920967, 'sideways_rsi_os': 30, 'sideways_rsi_ob': 60, 'sideways_adx_thresh': 25.214779756994986, 'sideways_atr_min_pct': 0.004027641080234463, 'sideways_atr_max_pct': 0.13966921638107704, 'sideways_tp_mult': 1.6848612857021332, 'sideways_tsl_mult': 0.9357941101056717, 'sideways_time_stop': 62, 'sideways_use_sma': False, 'sideways_use_ema': False, 'sideways_use_atr': True, 'sideways_use_adx': True, 'sideways_use_spike': False, 'sideways_rsi_required': True}.
