[I 2025-08-31 12:20:38,446] Trial 213 finished with values: [-1000000000.0, 1000000000.0] and parameters: {'p_sma': 12, 'p_std': 16, 'p_atr': 19, 'p_adx': 14, 'rsi_period': 22, 'ema1': 16, 'ema2': 33, 'slip_atr_k': 0.12178468119757055, 'slip_spread_k': 0.3757101968111583, 'spread_hl_frac': 0.022391090915452293, 'bb_std_mult': 0.9765731415476333, 'rsi_os': 43, 'rsi_ob': 63, 'vol_spike': 0.0559194110056164, 'adx_thresh': 22.63613448756134, 'atr_min_pct': 0.020858886238772356, 'atr_max_pct': 0.06817585972073506, 'tp_mult': 1.463234782120216, 'tsl_mult': 0.2799330352612926, 'strategy': 'mean_reversion', 'time_stop': 59, 'use_sma': True, 'use_atr': True, 'use_adx': True, 'use_ema': True, 'use_spike': True, 'rsi_required': False, 'edge_k': 0.9778614170562538, 'edge_cap': 0.3479910678958013, 'bull_strategy': 'mean_reversion', 'bull_bb_std_mult': 3.046137951158857, 'bull_rsi_os': 23, 'bull_rsi_ob': 48, 'bull_adx_thresh': 7.272522277391907, 'bull_atr_min_pct': 0.02560619408532429, 'bull_atr_max_pct': 0.04890121582778323, 'bull_tp_mult': 1.7354822960823122, 'bull_tsl_mult': 0.10516468506106269, 'bull_time_stop': 85, 'bull_use_sma': False, 'bull_use_ema': False, 'bull_use_atr': False, 'bull_use_adx': False, 'bull_use_spike': False, 'bull_rsi_required': True, 'bear_strategy': 'mean_reversion', 'bear_bb_std_mult': 2.849782306661913, 'bear_rsi_os': 23, 'bear_rsi_ob': 89, 'bear_adx_thresh': 33.86366788880394, 'bear_atr_min_pct': 0.0022603623390065955, 'bear_atr_max_pct': 0.08986145930399654, 'bear_tp_mult': 2.8864274326043757, 'bear_tsl_mult': 0.3805578710340839, 'bear_time_stop': 270, 'bear_use_sma': False, 'bear_use_ema': True, 'bear_use_atr': False, 'bear_use_adx': False, 'bear_use_spike': True, 'bear_rsi_required': True, 'sideways_strategy': 'mean_reversion', 'sideways_bb_std_mult': 2.648202483066895, 'sideways_rsi_os': 37, 'sideways_rsi_ob': 49, 'sideways_adx_thresh': 9.206733723951839, 'sideways_atr_min_pct': 0.008440180240969803, 'sideways_atr_max_pct': 0.014265349708040762, 'sideways_tp_mult': 1.254342258946432, 'sideways_tsl_mult': 0.09338161973859738, 'sideways_time_stop': 34, 'sideways_use_sma': False, 'sideways_use_ema': True, 'sideways_use_atr': True, 'sideways_use_adx': False, 'sideways_use_spike': True, 'sideways_rsi_required': False}.
[I 2025-08-31 12:20:38,642] Trial 217 finished with values: [-1000000000.0, 1000000000.0] and parameters: {'p_sma': 11, 'p_std': 24, 'p_atr': 8, 'p_adx': 13, 'rsi_period': 53, 'ema1': 6, 'ema2': 38, 'slip_atr_k': 0.08997187024135497, 'slip_spread_k': 0.811279278682828, 'spread_hl_frac': 0.005946310607985658, 'bb_std_mult': 0.9833107476078531, 'rsi_os': 27, 'rsi_ob': 93, 'vol_spike': 0.0020217203715592325, 'adx_thresh': 22.581575852228703, 'atr_min_pct': 0.029037703792642464, 'atr_max_pct': 0.08339562106767658, 'tp_mult': 1.292102834529912, 'tsl_mult': 0.4991033492063316, 'strategy': 'breakout', 'time_stop': 98, 'use_sma': True, 'use_atr': True, 'use_adx': True, 'use_ema': False, 'use_spike': False, 'rsi_required': False, 'edge_k': 1.1673333414855327, 'edge_cap': 0.33877237785978653, 'bull_strategy': 'mean_reversion', 'bull_bb_std_mult': 3.078282910459863, 'bull_rsi_os': 23, 'bull_rsi_ob': 52, 'bull_adx_thresh': 24.271074959217565, 'bull_atr_min_pct': 0.023848698109189746, 'bull_atr_max_pct': 0.016762330476525727, 'bull_tp_mult': 1.0147725584426697, 'bull_tsl_mult': 0.5533521321779321, 'bull_time_stop': 248, 'bull_use_sma': False, 'bull_use_ema': False, 'bull_use_atr': False, 'bull_use_adx': True, 'bull_use_spike': False, 'bull_rsi_required': True, 'bear_strategy': 'mean_reversion', 'bear_bb_std_mult': 2.837014586307502, 'bear_rsi_os': 14, 'bear_rsi_ob': 90, 'bear_adx_thresh': 33.83750983774752, 'bear_atr_min_pct': 0.008447733231550545, 'bear_atr_max_pct': 0.14671286573059533, 'bear_tp_mult': 1.7307656539353402, 'bear_tsl_mult': 0.7170132960407648, 'bear_time_stop': 258, 'bear_use_sma': False, 'bear_use_ema': True, 'bear_use_atr': False, 'bear_use_adx': False, 'bear_use_spike': True, 'bear_rsi_required': False, 'sideways_strategy': 'breakout', 'sideways_bb_std_mult': 1.9937616801112195, 'sideways_rsi_os': 15, 'sideways_rsi_ob': 89, 'sideways_adx_thresh': 15.460052852318679, 'sideways_atr_min_pct': 0.010209685071624962, 'sideways_atr_max_pct': 0.0737093707440829, 'sideways_tp_mult': 1.4592287757401443, 'sideways_tsl_mult': 0.6389288431675345, 'sideways_time_stop': 179, 'sideways_use_sma': False, 'sideways_use_ema': False, 'sideways_use_atr': True, 'sideways_use_adx': False, 'sideways_use_spike': False, 'sideways_rsi_required': True}.
[I 2025-08-31 12:21:11,032] Trial 218 finished with values: [-1000000000.0, 1000000000.0] and parameters: {'p_sma': 11, 'p_std': 14, 'p_atr': 17, 'p_adx': 14, 'rsi_period': 71, 'ema1': 22, 'ema2': 24, 'slip_atr_k': 0.1325020910904827, 'slip_spread_k': 0.1474357174895889, 'spread_hl_frac': 0.03437671823753298, 'bb_std_mult': 0.9882536460842857, 'rsi_os': 27, 'rsi_ob': 60, 'vol_spike': 0.002533183496810809, 'adx_thresh': 23.65534146965958, 'atr_min_pct': 0.02824138392219046, 'atr_max_pct': 0.08445886342828761, 'tp_mult': 2.2403652273326067, 'tsl_mult': 0.10108123832581795, 'strategy': 'mean_reversion', 'time_stop': 276, 'use_sma': True, 'use_atr': False, 'use_adx': True, 'use_ema': False, 'use_spike': False, 'rsi_required': False, 'edge_k': 1.9995645364951031, 'edge_cap': 0.8257405097431847, 'bull_strategy': 'breakout', 'bull_bb_std_mult': 1.0930539400978252, 'bull_rsi_os': 31, 'bull_rsi_ob': 80, 'bull_adx_thresh': 8.714322622350366, 'bull_atr_min_pct': 0.028879748687632788, 'bull_atr_max_pct': 0.048888155933967836, 'bull_tp_mult': 2.022749022500089, 'bull_tsl_mult': 0.26309481564669096, 'bull_time_stop': 248, 'bull_use_sma': False, 'bull_use_ema': False, 'bull_use_atr': False, 'bull_use_adx': True, 'bull_use_spike': False, 'bull_rsi_required': True, 'bear_strategy': 'mean_reversion', 'bear_bb_std_mult': 1.618450870076996, 'bear_rsi_os': 25, 'bear_rsi_ob': 79, 'bear_adx_thresh': 23.828450819256712, 'bear_atr_min_pct': 0.026925773520244414, 'bear_atr_max_pct': 0.10130821591066017, 'bear_tp_mult': 1.716936956137565, 'bear_tsl_mult': 0.15617960032989306, 'bear_time_stop': 268, 'bear_use_sma': False, 'bear_use_ema': False, 'bear_use_atr': False, 'bear_use_adx': False, 'bear_use_spike': True, 'bear_rsi_required': False, 'sideways_strategy': 'breakout', 'sideways_bb_std_mult': 2.0274158341310953, 'sideways_rsi_os': 15, 'sideways_rsi_ob': 49, 'sideways_adx_thresh': 9.35066199205958, 'sideways_atr_min_pct': 0.003255487303509809, 'sideways_atr_max_pct': 0.020051558007744136, 'sideways_tp_mult': 1.4553276769775578, 'sideways_tsl_mult': 0.4528294464561466, 'sideways_time_stop': 186, 'sideways_use_sma': False, 'sideways_use_ema': True, 'sideways_use_atr': True, 'sideways_use_adx': False, 'sideways_use_spike': False, 'sideways_rsi_required': True}.
[I 2025-08-31 12:21:11,595] Trial 220 finished with values: [-1000000000.0, 1000000000.0] and parameters: {'p_sma': 30, 'p_std': 36, 'p_atr': 14, 'p_adx': 18, 'rsi_period': 53, 'ema1': 7, 'ema2': 60, 'slip_atr_k': 0.13250530147832712, 'slip_spread_k': 0.8083149587644215, 'spread_hl_frac': 0.017684914169814006, 'bb_std_mult': 2.8562981251502095, 'rsi_os': 13, 'rsi_ob': 95, 'vol_spike': 0.2779633689585991, 'adx_thresh': 23.7862633306309, 'atr_min_pct': 0.02905172725230909, 'atr_max_pct': 0.0618287133884204, 'tp_mult': 2.471068549638179, 'tsl_mult': 0.4974399777021821, 'strategy': 'mean_reversion', 'time_stop': 12, 'use_sma': True, 'use_atr': False, 'use_adx': True, 'use_ema': False, 'use_spike': False, 'rsi_required': True, 'edge_k': 1.1657388842468999, 'edge_cap': 0.43856293759254383, 'bull_strategy': 'breakout', 'bull_bb_std_mult': 1.1063976865444451, 'bull_rsi_os': 20, 'bull_rsi_ob': 78, 'bull_adx_thresh': 8.369877334667972, 'bull_atr_min_pct': 0.024054201422145028, 'bull_atr_max_pct': 0.06454915273756742, 'bull_tp_mult': 2.7009679034475975, 'bull_tsl_mult': 0.2817939148858735, 'bull_time_stop': 251, 'bull_use_sma': False, 'bull_use_ema': True, 'bull_use_atr': True, 'bull_use_adx': True, 'bull_use_spike': False, 'bull_rsi_required': True, 'bear_strategy': 'mean_reversion', 'bear_bb_std_mult': 1.623907787468227, 'bear_rsi_os': 14, 'bear_rsi_ob': 61, 'bear_adx_thresh': 34.38028399864685, 'bear_atr_min_pct': 0.02710774779307417, 'bear_atr_max_pct': 0.1014716694943673, 'bear_tp_mult': 1.7197509366317214, 'bear_tsl_mult': 0.14050235320050275, 'bear_time_stop': 58, 'bear_use_sma': False, 'bear_use_ema': False, 'bear_use_atr': False, 'bear_use_adx': False, 'bear_use_spike': True, 'bear_rsi_required': False, 'sideways_strategy': 'breakout', 'sideways_bb_std_mult': 2.021806677632823, 'sideways_rsi_os': 12, 'sideways_rsi_ob': 47, 'sideways_adx_thresh': 33.64179532421924, 'sideways_atr_min_pct': 0.0033035650884726737, 'sideways_atr_max_pct': 0.02154590169126521, 'sideways_tp_mult': 1.460759853733416, 'sideways_tsl_mult': 0.4528496997141856, 'sideways_time_stop': 204, 'sideways_use_sma': False, 'sideways_use_ema': True, 'sideways_use_atr': True, 'sideways_use_adx': False, 'sideways_use_spike': False, 'sideways_rsi_required': True}.
[I 2025-08-31 12:21:11,620] Trial 221 finished with values: [-0.03633245970072052, 0.03606039195487037] and parameters: {'p_sma': 30, 'p_std': 17, 'p_atr': 9, 'p_adx': 28, 'rsi_period': 66, 'ema1': 7, 'ema2': 35, 'slip_atr_k': 0.1010399245994413, 'slip_spread_k': 0.1459569343131179, 'spread_hl_frac': 0.018711598941609477, 'bb_std_mult': 1.12914429726705, 'rsi_os': 20, 'rsi_ob': 60, 'vol_spike': 0.2789626586666012, 'adx_thresh': 28.816949357089484, 'atr_min_pct': 0.023014494502655934, 'atr_max_pct': 0.07170925719444346, 'tp_mult': 2.4876709350593984, 'tsl_mult': 0.3890158917043096, 'strategy': 'mean_reversion', 'time_stop': 234, 'use_sma': False, 'use_atr': False, 'use_adx': False, 'use_ema': False, 'use_spike': False, 'rsi_required': True, 'edge_k': 0.7504682886109394, 'edge_cap': 0.27522126353108006, 'bull_strategy': 'breakout', 'bull_bb_std_mult': 2.915057064678369, 'bull_rsi_os': 31, 'bull_rsi_ob': 80, 'bull_adx_thresh': 8.621673052564205, 'bull_atr_min_pct': 0.02912870090930782, 'bull_atr_max_pct': 0.028238576222299226, 'bull_tp_mult': 2.681681158983824, 'bull_tsl_mult': 0.283395758456287, 'bull_time_stop': 94, 'bull_use_sma': True, 'bull_use_ema': True, 'bull_use_atr': True, 'bull_use_adx': True, 'bull_use_spike': False, 'bull_rsi_required': True, 'bear_strategy': 'breakout', 'bear_bb_std_mult': 1.6125868513102073, 'bear_rsi_os': 25, 'bear_rsi_ob': 57, 'bear_adx_thresh': 24.864743521727178, 'bear_atr_min_pct': 0.027036129187113123, 'bear_atr_max_pct': 0.10203896401583976, 'bear_tp_mult': 1.4495285624006062, 'bear_tsl_mult': 0.14898066938417243, 'bear_time_stop': 28, 'bear_use_sma': False, 'bear_use_ema': False, 'bear_use_atr': False, 'bear_use_adx': False, 'bear_use_spike': True, 'bear_rsi_required': False, 'sideways_strategy': 'breakout', 'sideways_bb_std_mult': 1.6628043027418826, 'sideways_rsi_os': 46, 'sideways_rsi_ob': 46, 'sideways_adx_thresh': 14.356334666742683, 'sideways_atr_min_pct': 0.003291726176098179, 'sideways_atr_max_pct': 0.020862706962170047, 'sideways_tp_mult': 2.572801938530581, 'sideways_tsl_mult': 0.4530523345318519, 'sideways_time_stop': 204, 'sideways_use_sma': True, 'sideways_use_ema': True, 'sideways_use_atr': True, 'sideways_use_adx': False, 'sideways_use_spike': False, 'sideways_rsi_required': True}.
[I 2025-08-31 12:21:11,806] Trial 219 finished with values: [-1000000000.0, 1000000000.0] and parameters: {'p_sma': 58, 'p_std': 17, 'p_atr': 14, 'p_adx': 28, 'rsi_period': 74, 'ema1': 7, 'ema2': 38, 'slip_atr_k': 0.10091133033723335, 'slip_spread_k': 0.14641874408072864, 'spread_hl_frac': 0.04986774279647805, 'bb_std_mult': 2.1330504511207558, 'rsi_os': 19, 'rsi_ob': 95, 'vol_spike': 0.005064269914777875, 'adx_thresh': 28.703543105754616, 'atr_min_pct': 0.02318184822712054, 'atr_max_pct': 0.07119578490000537, 'tp_mult': 2.0867846879166603, 'tsl_mult': 0.6244937405361413, 'strategy': 'mean_reversion', 'time_stop': 97, 'use_sma': True, 'use_atr': False, 'use_adx': True, 'use_ema': False, 'use_spike': False, 'rsi_required': True, 'edge_k': 1.1712315661807917, 'edge_cap': 0.4417994487216856, 'bull_strategy': 'breakout', 'bull_bb_std_mult': 3.106404863727956, 'bull_rsi_os': 39, 'bull_rsi_ob': 54, 'bull_adx_thresh': 8.767832038255603, 'bull_atr_min_pct': 0.02370388783466853, 'bull_atr_max_pct': 0.029103229762253612, 'bull_tp_mult': 1.012734540811162, 'bull_tsl_mult': 0.6038022357908165, 'bull_time_stop': 155, 'bull_use_sma': False, 'bull_use_ema': True, 'bull_use_atr': False, 'bull_use_adx': True, 'bull_use_spike': False, 'bull_rsi_required': True, 'bear_strategy': 'mean_reversion', 'bear_bb_std_mult': 3.5181399052967226, 'bear_rsi_os': 25, 'bear_rsi_ob': 69, 'bear_adx_thresh': 7.531621172832915, 'bear_atr_min_pct': 0.008363261428330639, 'bear_atr_max_pct': 0.10185131229834352, 'bear_tp_mult': 1.592669038940617, 'bear_tsl_mult': 0.14577286918878946, 'bear_time_stop': 30, 'bear_use_sma': False, 'bear_use_ema': False, 'bear_use_atr': False, 'bear_use_adx': False, 'bear_use_spike': True, 'bear_rsi_required': False, 'sideways_strategy': 'breakout', 'sideways_bb_std_mult': 2.0116688424632243, 'sideways_rsi_os': 46, 'sideways_rsi_ob': 49, 'sideways_adx_thresh': 17.28168557325973, 'sideways_atr_min_pct': 0.018388868843625224, 'sideways_atr_max_pct': 0.07304731264439301, 'sideways_tp_mult': 2.5642406855384365, 'sideways_tsl_mult': 0.45505028351774507, 'sideways_time_stop': 199, 'sideways_use_sma': False, 'sideways_use_ema': True, 'sideways_use_atr': True, 'sideways_use_adx': False, 'sideways_use_spike': False, 'sideways_rsi_required': True}.
[I 2025-08-31 12:21:12,302] Trial 225 finished with values: [-1000000000.0, 1000000000.0] and parameters: {'p_sma': 32, 'p_std': 33, 'p_atr': 9, 'p_adx': 17, 'rsi_period': 74, 'ema1': 5, 'ema2': 36, 'slip_atr_k': 0.08205622729973067, 'slip_spread_k': 0.47576299583936466, 'spread_hl_frac': 0.029215025970058307, 'bb_std_mult': 3.161785992593031, 'rsi_os': 45, 'rsi_ob': 61, 'vol_spike': 0.2436095129307464, 'adx_thresh': 30.894139656542826, 'atr_min_pct': 0.02393904794801821, 'atr_max_pct': 0.014054044299878846, 'tp_mult': 1.5817421089190666, 'tsl_mult': 0.5319376181386599, 'strategy': 'mean_reversion', 'time_stop': 85, 'use_sma': False, 'use_atr': False, 'use_adx': False, 'use_ema': False, 'use_spike': True, 'rsi_required': False, 'edge_k': 1.8330449032048506, 'edge_cap': 0.2779864551915626, 'bull_strategy': 'mean_reversion', 'bull_bb_std_mult': 2.277154943618638, 'bull_rsi_os': 14, 'bull_rsi_ob': 68, 'bull_adx_thresh': 9.361225466159311, 'bull_atr_min_pct': 0.00274068299387957, 'bull_atr_max_pct': 0.025444363242102044, 'bull_tp_mult': 1.2270836804484242, 'bull_tsl_mult': 0.3431649935981645, 'bull_time_stop': 94, 'bull_use_sma': True, 'bull_use_ema': False, 'bull_use_atr': True, 'bull_use_adx': False, 'bull_use_spike': False, 'bull_rsi_required': True, 'bear_strategy': 'breakout', 'bear_bb_std_mult': 1.7338283419011633, 'bear_rsi_os': 21, 'bear_rsi_ob': 75, 'bear_adx_thresh': 12.481876579465522, 'bear_atr_min_pct': 0.018964379326512668, 'bear_atr_max_pct': 0.08336401867288035, 'bear_tp_mult': 1.9270125607678805, 'bear_tsl_mult': 0.21753564038719442, 'bear_time_stop': 250, 'bear_use_sma': True, 'bear_use_ema': False, 'bear_use_atr': True, 'bear_use_adx': True, 'bear_use_spike': False, 'bear_rsi_required': False, 'sideways_strategy': 'breakout', 'sideways_bb_std_mult': 1.6612851063932657, 'sideways_rsi_os': 55, 'sideways_rsi_ob': 46, 'sideways_adx_thresh': 9.860435859128657, 'sideways_atr_min_pct': 0.009106442029498984, 'sideways_atr_max_pct': 0.10924121999471889, 'sideways_tp_mult': 1.4077501843874194, 'sideways_tsl_mult': 0.42182602133519825, 'sideways_time_stop': 98, 'sideways_use_sma': True, 'sideways_use_ema': True, 'sideways_use_atr': False, 'sideways_use_adx': False, 'sideways_use_spike': False, 'sideways_rsi_required': True}.
[I 2025-08-31 12:21:12,907] Trial 226 finished with values: [-1000000000.0, 1000000000.0] and parameters: {'p_sma': 34, 'p_std': 45, 'p_atr': 13, 'p_adx': 15, 'rsi_period': 69, 'ema1': 5, 'ema2': 36, 'slip_atr_k': 0.0877734692027338, 'slip_spread_k': 0.16895696769671445, 'spread_hl_frac': 0.02581644752048625, 'bb_std_mult': 1.1193476524058912, 'rsi_os': 53, 'rsi_ob': 90, 'vol_spike': 0.25575500657159617, 'adx_thresh': 5.222668779007888, 'atr_min_pct': 0.02753411086572764, 'atr_max_pct': 0.07606821345162092, 'tp_mult': 2.526035790150224, 'tsl_mult': 0.38442904920261134, 'strategy': 'mean_reversion', 'time_stop': 183, 'use_sma': False, 'use_atr': False, 'use_adx': False, 'use_ema': False, 'use_spike': True, 'rsi_required': False, 'edge_k': 0.7523225505660243, 'edge_cap': 0.7083420157507017, 'bull_strategy': 'mean_reversion', 'bull_bb_std_mult': 3.299924064717488, 'bull_rsi_os': 12, 'bull_rsi_ob': 73, 'bull_adx_thresh': 10.286712271738352, 'bull_atr_min_pct': 0.026682131452480547, 'bull_atr_max_pct': 0.06961444100057605, 'bull_tp_mult': 2.811168718800783, 'bull_tsl_mult': 0.2822634279469584, 'bull_time_stop': 165, 'bull_use_sma': True, 'bull_use_ema': False, 'bull_use_atr': False, 'bull_use_adx': True, 'bull_use_spike': False, 'bull_rsi_required': True, 'bear_strategy': 'breakout', 'bear_bb_std_mult': 2.701617279047657, 'bear_rsi_os': 53, 'bear_rsi_ob': 59, 'bear_adx_thresh': 33.29941542066661, 'bear_atr_min_pct': 0.02892402317696553, 'bear_atr_max_pct': 0.0980979778416054, 'bear_tp_mult': 1.4302810159547832, 'bear_tsl_mult': 0.49089835827764233, 'bear_time_stop': 230, 'bear_use_sma': False, 'bear_use_ema': False, 'bear_use_atr': False, 'bear_use_adx': False, 'bear_use_spike': True, 'bear_rsi_required': True, 'sideways_strategy': 'mean_reversion', 'sideways_bb_std_mult': 2.0971685009296803, 'sideways_rsi_os': 20, 'sideways_rsi_ob': 45, 'sideways_adx_thresh': 7.969375854150485, 'sideways_atr_min_pct': 0.0023635408221838426, 'sideways_atr_max_pct': 0.06863298139810554, 'sideways_tp_mult': 1.3331498095526013, 'sideways_tsl_mult': 0.04338094485943078, 'sideways_time_stop': 186, 'sideways_use_sma': True, 'sideways_use_ema': True, 'sideways_use_atr': True, 'sideways_use_adx': False, 'sideways_use_spike': True, 'sideways_rsi_required': False}.
[I 2025-08-31 12:21:13,146] Trial 227 finished with values: [-1000000000.0, 1000000000.0] and parameters: {'p_sma': 6, 'p_std': 18, 'p_atr': 9, 'p_adx': 16, 'rsi_period': 66, 'ema1': 6, 'ema2': 39, 'slip_atr_k': 0.14440638787064852, 'slip_spread_k': 0.12584809711569184, 'spread_hl_frac': 0.02665237089760031, 'bb_std_mult': 1.9229824242454785, 'rsi_os': 33, 'rsi_ob': 48, 'vol_spike': 0.2662028220056858, 'adx_thresh': 33.16298614280619, 'atr_min_pct': 0.008180451101874108, 'atr_max_pct': 0.12221801282257655, 'tp_mult': 2.58563571613755, 'tsl_mult': 0.4397038868286435, 'strategy': 'mean_reversion', 'time_stop': 96, 'use_sma': True, 'use_atr': False, 'use_adx': True, 'use_ema': False, 'use_spike': True, 'rsi_required': False, 'edge_k': 1.139653785354861, 'edge_cap': 0.321554364997102, 'bull_strategy': 'mean_reversion', 'bull_bb_std_mult': 2.727076708990345, 'bull_rsi_os': 52, 'bull_rsi_ob': 81, 'bull_adx_thresh': 27.548138208719696, 'bull_atr_min_pct': 0.024541204311296264, 'bull_atr_max_pct': 0.03311199015005289, 'bull_tp_mult': 2.885276328745968, 'bull_tsl_mult': 0.3195550829998678, 'bull_time_stop': 69, 'bull_use_sma': False, 'bull_use_ema': False, 'bull_use_atr': False, 'bull_use_adx': True, 'bull_use_spike': True, 'bull_rsi_required': False, 'bear_strategy': 'mean_reversion', 'bear_bb_std_mult': 2.1301135856254207, 'bear_rsi_os': 24, 'bear_rsi_ob': 57, 'bear_adx_thresh': 27.375728845696614, 'bear_atr_min_pct': 0.0293564596728888, 'bear_atr_max_pct': 0.11759283346850594, 'bear_tp_mult': 1.8867924369582958, 'bear_tsl_mult': 0.26285657127796414, 'bear_time_stop': 285, 'bear_use_sma': False, 'bear_use_ema': False, 'bear_use_atr': False, 'bear_use_adx': False, 'bear_use_spike': False, 'bear_rsi_required': False, 'sideways_strategy': 'breakout', 'sideways_bb_std_mult': 2.10890065386432, 'sideways_rsi_os': 36, 'sideways_rsi_ob': 67, 'sideways_adx_thresh': 9.879152950597616, 'sideways_atr_min_pct': 0.0016457052888857405, 'sideways_atr_max_pct': 0.03873179398208063, 'sideways_tp_mult': 2.934460469441895, 'sideways_tsl_mult': 0.4310653702312785, 'sideways_time_stop': 151, 'sideways_use_sma': False, 'sideways_use_ema': True, 'sideways_use_atr': True, 'sideways_use_adx': True, 'sideways_use_spike': False, 'sideways_rsi_required': True}.
