[I 2025-08-31 12:12:03,380] Trial 153 finished with values: [-0.22572463870769965, 0.2256248837943154] and parameters: {'p_sma': 33, 'p_std': 15, 'p_atr': 23, 'p_adx': 13, 'rsi_period': 71, 'ema1': 30, 'ema2': 43, 'slip_atr_k': 0.17542351821853502, 'slip_spread_k': 0.8312895196125092, 'spread_hl_frac': 0.024181525122298517, 'bb_std_mult': 1.5282347243392436, 'rsi_os': 42, 'rsi_ob': 87, 'vol_spike': 0.029292565788967967, 'adx_thresh': 12.24711837609155, 'atr_min_pct': 0.02719575021945862, 'atr_max_pct': 0.07018689260109975, 'tp_mult': 2.6590882771693547, 'tsl_mult': 0.998338219302324, 'strategy': 'mean_reversion', 'time_stop': 100, 'use_sma': True, 'use_atr': False, 'use_adx': True, 'use_ema': False, 'use_spike': True, 'rsi_required': False, 'edge_k': 0.23384051477739876, 'edge_cap': 0.30515026400305695, 'bull_strategy': 'mean_reversion', 'bull_bb_std_mult': 3.1095713225526627, 'bull_rsi_os': 8, 'bull_rsi_ob': 84, 'bull_adx_thresh': 7.989557808780247, 'bull_atr_min_pct': 0.025486589084940302, 'bull_atr_max_pct': 0.035320506233247506, 'bull_tp_mult': 2.3895427286861666, 'bull_tsl_mult': 0.45060985996962016, 'bull_time_stop': 172, 'bull_use_sma': False, 'bull_use_ema': False, 'bull_use_atr': False, 'bull_use_adx': True, 'bull_use_spike': False, 'bull_rsi_required': True, 'bear_strategy': 'mean_reversion', 'bear_bb_std_mult': 3.165816382027862, 'bear_rsi_os': 20, 'bear_rsi_ob': 59, 'bear_adx_thresh': 34.080425331236356, 'bear_atr_min_pct': 0.004191284259190867, 'bear_atr_max_pct': 0.1099265006755682, 'bear_tp_mult': 1.8155964206638964, 'bear_tsl_mult': 0.2484570799277902, 'bear_time_stop': 233, 'bear_use_sma': False, 'bear_use_ema': False, 'bear_use_atr': False, 'bear_use_adx': False, 'bear_use_spike': True, 'bear_rsi_required': False, 'sideways_strategy': 'breakout', 'sideways_bb_std_mult': 1.8410217891433949, 'sideways_rsi_os': 48, 'sideways_rsi_ob': 48, 'sideways_adx_thresh': 20.3618351553024, 'sideways_atr_min_pct': 0.0009268293545509024, 'sideways_atr_max_pct': 0.06656368385757888, 'sideways_tp_mult': 1.31904478749752, 'sideways_tsl_mult': 0.4823226570829461, 'sideways_time_stop': 194, 'sideways_use_sma': False, 'sideways_use_ema': True, 'sideways_use_atr': True, 'sideways_use_adx': False, 'sideways_use_spike': False, 'sideways_rsi_required': True}.
[I 2025-08-31 12:12:38,358] Trial 154 finished with values: [-1000000000.0, 1000000000.0] and parameters: {'p_sma': 38, 'p_std': 15, 'p_atr': 20, 'p_adx': 13, 'rsi_period': 77, 'ema1': 5, 'ema2': 42, 'slip_atr_k': 0.099409760230327, 'slip_spread_k': 0.022939286220704666, 'spread_hl_frac': 0.023836973546695436, 'bb_std_mult': 2.5252761854397416, 'rsi_os': 42, 'rsi_ob': 62, 'vol_spike': 0.24249161528664737, 'adx_thresh': 11.400123731857983, 'atr_min_pct': 0.01348108492720744, 'atr_max_pct': 0.08116832724443278, 'tp_mult': 1.8898990863275316, 'tsl_mult': 0.45923156345759014, 'strategy': 'mean_reversion', 'time_stop': 111, 'use_sma': True, 'use_atr': True, 'use_adx': False, 'use_ema': False, 'use_spike': True, 'rsi_required': False, 'edge_k': 0.8697530125980573, 'edge_cap': 0.7247515278898797, 'bull_strategy': 'mean_reversion', 'bull_bb_std_mult': 3.1143135423322605, 'bull_rsi_os': 52, 'bull_rsi_ob': 84, 'bull_adx_thresh': 7.831218725966691, 'bull_atr_min_pct': 0.027626297851150772, 'bull_atr_max_pct': 0.06980660993455948, 'bull_tp_mult': 2.310828133093804, 'bull_tsl_mult': 0.28219815510618224, 'bull_time_stop': 92, 'bull_use_sma': True, 'bull_use_ema': False, 'bull_use_atr': False, 'bull_use_adx': True, 'bull_use_spike': False, 'bull_rsi_required': True, 'bear_strategy': 'mean_reversion', 'bear_bb_std_mult': 1.464540478200228, 'bear_rsi_os': 48, 'bear_rsi_ob': 89, 'bear_adx_thresh': 17.054557548828136, 'bear_atr_min_pct': 0.02465242898208328, 'bear_atr_max_pct': 0.10309515076390892, 'bear_tp_mult': 2.577228400463161, 'bear_tsl_mult': 0.2487709803419773, 'bear_time_stop': 298, 'bear_use_sma': False, 'bear_use_ema': False, 'bear_use_atr': False, 'bear_use_adx': False, 'bear_use_spike': True, 'bear_rsi_required': False, 'sideways_strategy': 'breakout', 'sideways_bb_std_mult': 1.9939208970383917, 'sideways_rsi_os': 8, 'sideways_rsi_ob': 94, 'sideways_adx_thresh': 10.884556997211286, 'sideways_atr_min_pct': 0.001258800714372843, 'sideways_atr_max_pct': 0.030515734018506775, 'sideways_tp_mult': 1.5235795932773257, 'sideways_tsl_mult': 0.024062493785028394, 'sideways_time_stop': 8, 'sideways_use_sma': True, 'sideways_use_ema': True, 'sideways_use_atr': True, 'sideways_use_adx': False, 'sideways_use_spike': False, 'sideways_rsi_required': True}.
[I 2025-08-31 12:12:39,053] Trial 157 finished with values: [-1000000000.0, 1000000000.0] and parameters: {'p_sma': 17, 'p_std': 15, 'p_atr': 19, 'p_adx': 15, 'rsi_period': 77, 'ema1': 5, 'ema2': 57, 'slip_atr_k': 0.19938187999151158, 'slip_spread_k': 0.3541485391504446, 'spread_hl_frac': 0.028921892448675768, 'bb_std_mult': 0.9504599826710989, 'rsi_os': 44, 'rsi_ob': 62, 'vol_spike': 0.29246869762570893, 'adx_thresh': 22.487441763705622, 'atr_min_pct': 0.013453870091463082, 'atr_max_pct': 0.07962575817168424, 'tp_mult': 1.051480264540628, 'tsl_mult': 0.5078187210320988, 'strategy': 'breakout', 'time_stop': 270, 'use_sma': True, 'use_atr': True, 'use_adx': False, 'use_ema': False, 'use_spike': True, 'rsi_required': False, 'edge_k': 1.144390046297048, 'edge_cap': 0.7558028792108433, 'bull_strategy': 'mean_reversion', 'bull_bb_std_mult': 2.23383339380576, 'bull_rsi_os': 51, 'bull_rsi_ob': 84, 'bull_adx_thresh': 9.587449365247387, 'bull_atr_min_pct': 0.02753044226662553, 'bull_atr_max_pct': 0.0569671562408767, 'bull_tp_mult': 2.653749809049658, 'bull_tsl_mult': 0.6332277413160925, 'bull_time_stop': 43, 'bull_use_sma': True, 'bull_use_ema': False, 'bull_use_atr': False, 'bull_use_adx': True, 'bull_use_spike': False, 'bull_rsi_required': False, 'bear_strategy': 'mean_reversion', 'bear_bb_std_mult': 2.9588757236177607, 'bear_rsi_os': 48, 'bear_rsi_ob': 64, 'bear_adx_thresh': 32.936121543915, 'bear_atr_min_pct': 0.009354176941959468, 'bear_atr_max_pct': 0.1035110464722788, 'bear_tp_mult': 2.431425073386357, 'bear_tsl_mult': 0.08425956874506817, 'bear_time_stop': 79, 'bear_use_sma': False, 'bear_use_ema': False, 'bear_use_atr': False, 'bear_use_adx': False, 'bear_use_spike': True, 'bear_rsi_required': False, 'sideways_strategy': 'breakout', 'sideways_bb_std_mult': 1.3430892498923073, 'sideways_rsi_os': 40, 'sideways_rsi_ob': 64, 'sideways_adx_thresh': 10.753000545680143, 'sideways_atr_min_pct': 0.013319078228671392, 'sideways_atr_max_pct': 0.13948863196697883, 'sideways_tp_mult': 1.4380554308897402, 'sideways_tsl_mult': 0.4381260265423217, 'sideways_time_stop': 137, 'sideways_use_sma': True, 'sideways_use_ema': True, 'sideways_use_atr': True, 'sideways_use_adx': False, 'sideways_use_spike': False, 'sideways_rsi_required': True}.
[I 2025-08-31 12:12:39,059] Trial 156 finished with values: [-1000000000.0, 1000000000.0] and parameters: {'p_sma': 35, 'p_std': 15, 'p_atr': 12, 'p_adx': 13, 'rsi_period': 77, 'ema1': 22, 'ema2': 57, 'slip_atr_k': 0.08754476742427311, 'slip_spread_k': 0.14315737793059077, 'spread_hl_frac': 0.028660143615587403, 'bb_std_mult': 0.9460648522359376, 'rsi_os': 44, 'rsi_ob': 62, 'vol_spike': 0.09045153885235221, 'adx_thresh': 22.36297050594413, 'atr_min_pct': 0.02831768294608033, 'atr_max_pct': 0.0798163251245937, 'tp_mult': 1.8922665950458406, 'tsl_mult': 0.5103583401699251, 'strategy': 'mean_reversion', 'time_stop': 110, 'use_sma': True, 'use_atr': True, 'use_adx': False, 'use_ema': False, 'use_spike': True, 'rsi_required': False, 'edge_k': 1.1267737160530427, 'edge_cap': 0.7198915227162288, 'bull_strategy': 'mean_reversion', 'bull_bb_std_mult': 3.161866785465574, 'bull_rsi_os': 14, 'bull_rsi_ob': 84, 'bull_adx_thresh': 7.828181529139588, 'bull_atr_min_pct': 0.02771945655781651, 'bull_atr_max_pct': 0.05791361968820079, 'bull_tp_mult': 2.9003954940284573, 'bull_tsl_mult': 0.28982232907349437, 'bull_time_stop': 95, 'bull_use_sma': True, 'bull_use_ema': False, 'bull_use_atr': False, 'bull_use_adx': True, 'bull_use_spike': False, 'bull_rsi_required': False, 'bear_strategy': 'mean_reversion', 'bear_bb_std_mult': 1.4680987388798035, 'bear_rsi_os': 5, 'bear_rsi_ob': 50, 'bear_adx_thresh': 14.45504584626278, 'bear_atr_min_pct': 0.027870736980229942, 'bear_atr_max_pct': 0.10986973737337764, 'bear_tp_mult': 2.5580733076853113, 'bear_tsl_mult': 0.15157977706350126, 'bear_time_stop': 243, 'bear_use_sma': False, 'bear_use_ema': False, 'bear_use_atr': False, 'bear_use_adx': False, 'bear_use_spike': True, 'bear_rsi_required': False, 'sideways_strategy': 'breakout', 'sideways_bb_std_mult': 1.985646303809878, 'sideways_rsi_os': 11, 'sideways_rsi_ob': 48, 'sideways_adx_thresh': 11.00274508618914, 'sideways_atr_min_pct': 0.023053285079089825, 'sideways_atr_max_pct': 0.06715220030920062, 'sideways_tp_mult': 1.7429829337302536, 'sideways_tsl_mult': 0.43432184748850966, 'sideways_time_stop': 169, 'sideways_use_sma': True, 'sideways_use_ema': True, 'sideways_use_atr': True, 'sideways_use_adx': False, 'sideways_use_spike': False, 'sideways_rsi_required': True}.
[I 2025-08-31 12:12:39,214] Trial 155 finished with values: [-1000000000.0, 1000000000.0] and parameters: {'p_sma': 17, 'p_std': 47, 'p_atr': 12, 'p_adx': 13, 'rsi_period': 14, 'ema1': 22, 'ema2': 58, 'slip_atr_k': 0.08626566678336334, 'slip_spread_k': 0.14344405696722506, 'spread_hl_frac': 0.028598978612068615, 'bb_std_mult': 0.9161496632696183, 'rsi_os': 44, 'rsi_ob': 63, 'vol_spike': 0.09154418997410872, 'adx_thresh': 24.13979691327362, 'atr_min_pct': 0.028071643550950966, 'atr_max_pct': 0.10504193784962364, 'tp_mult': 2.5438009877516223, 'tsl_mult': 0.9886899880036848, 'strategy': 'mean_reversion', 'time_stop': 111, 'use_sma': True, 'use_atr': True, 'use_adx': False, 'use_ema': False, 'use_spike': True, 'rsi_required': False, 'edge_k': 1.2956675479362887, 'edge_cap': 0.31848743002359947, 'bull_strategy': 'mean_reversion', 'bull_bb_std_mult': 3.1240469236752966, 'bull_rsi_os': 29, 'bull_rsi_ob': 84, 'bull_adx_thresh': 16.730511905109, 'bull_atr_min_pct': 0.020577400637001534, 'bull_atr_max_pct': 0.05630611748862539, 'bull_tp_mult': 2.757494779502726, 'bull_tsl_mult': 0.023866650127987166, 'bull_time_stop': 96, 'bull_use_sma': True, 'bull_use_ema': False, 'bull_use_atr': False, 'bull_use_adx': True, 'bull_use_spike': False, 'bull_rsi_required': False, 'bear_strategy': 'mean_reversion', 'bear_bb_std_mult': 2.927348112885492, 'bear_rsi_os': 48, 'bear_rsi_ob': 49, 'bear_adx_thresh': 34.49725043558038, 'bear_atr_min_pct': 0.003889578844797535, 'bear_atr_max_pct': 0.10921862233579396, 'bear_tp_mult': 1.8530014596166753, 'bear_tsl_mult': 0.42075479539371735, 'bear_time_stop': 243, 'bear_use_sma': False, 'bear_use_ema': False, 'bear_use_atr': False, 'bear_use_adx': False, 'bear_use_spike': True, 'bear_rsi_required': False, 'sideways_strategy': 'breakout', 'sideways_bb_std_mult': 3.5960028748310293, 'sideways_rsi_os': 9, 'sideways_rsi_ob': 48, 'sideways_adx_thresh': 10.56456942135342, 'sideways_atr_min_pct': 0.021085835034877324, 'sideways_atr_max_pct': 0.1387596183730308, 'sideways_tp_mult': 1.7420753831992422, 'sideways_tsl_mult': 0.1628811540025999, 'sideways_time_stop': 169, 'sideways_use_sma': True, 'sideways_use_ema': True, 'sideways_use_atr': True, 'sideways_use_adx': False, 'sideways_use_spike': False, 'sideways_rsi_required': True}.
[I 2025-08-31 12:12:39,603] Trial 161 finished with values: [-1000000000.0, 1000000000.0] and parameters: {'p_sma': 34, 'p_std': 17, 'p_atr': 24, 'p_adx': 17, 'rsi_period': 74, 'ema1': 7, 'ema2': 34, 'slip_atr_k': 0.09561980917869055, 'slip_spread_k': 0.8586363675900837, 'spread_hl_frac': 0.026879082101480947, 'bb_std_mult': 1.0953968386066038, 'rsi_os': 15, 'rsi_ob': 59, 'vol_spike': 0.26628631071879455, 'adx_thresh': 25.10903678834689, 'atr_min_pct': 0.02935444348195485, 'atr_max_pct': 0.02632502596271303, 'tp_mult': 2.702420717148839, 'tsl_mult': 0.8807228338435311, 'strategy': 'breakout', 'time_stop': 54, 'use_sma': True, 'use_atr': False, 'use_adx': True, 'use_ema': False, 'use_spike': False, 'rsi_required': False, 'edge_k': 1.0257202479439094, 'edge_cap': 0.2184243017808964, 'bull_strategy': 'mean_reversion', 'bull_bb_std_mult': 0.6368969289709803, 'bull_rsi_os': 9, 'bull_rsi_ob': 87, 'bull_adx_thresh': 20.92103684174648, 'bull_atr_min_pct': 0.02639566924711764, 'bull_atr_max_pct': 0.03141483690013332, 'bull_tp_mult': 2.70196588278171, 'bull_tsl_mult': 0.7547056738216458, 'bull_time_stop': 79, 'bull_use_sma': False, 'bull_use_ema': False, 'bull_use_atr': False, 'bull_use_adx': True, 'bull_use_spike': True, 'bull_rsi_required': True, 'bear_strategy': 'mean_reversion', 'bear_bb_std_mult': 1.125382868466564, 'bear_rsi_os': 8, 'bear_rsi_ob': 58, 'bear_adx_thresh': 26.193245416421505, 'bear_atr_min_pct': 0.001822039993141896, 'bear_atr_max_pct': 0.11472680498986818, 'bear_tp_mult': 1.3067143772439076, 'bear_tsl_mult': 0.04161372907206351, 'bear_time_stop': 258, 'bear_use_sma': False, 'bear_use_ema': False, 'bear_use_atr': False, 'bear_use_adx': False, 'bear_use_spike': False, 'bear_rsi_required': False, 'sideways_strategy': 'mean_reversion', 'sideways_bb_std_mult': 2.1370649697110338, 'sideways_rsi_os': 27, 'sideways_rsi_ob': 50, 'sideways_adx_thresh': 17.889344490743877, 'sideways_atr_min_pct': 0.002470277452109581, 'sideways_atr_max_pct': 0.07060298813674071, 'sideways_tp_mult': 1.4648669416667737, 'sideways_tsl_mult': 0.4023836167429271, 'sideways_time_stop': 178, 'sideways_use_sma': False, 'sideways_use_ema': False, 'sideways_use_atr': True, 'sideways_use_adx': True, 'sideways_use_spike': False, 'sideways_rsi_required': True}.
[I 2025-08-31 12:12:39,618] Trial 158 finished with values: [-1000000000.0, 1000000000.0] and parameters: {'p_sma': 45, 'p_std': 17, 'p_atr': 12, 'p_adx': 15, 'rsi_period': 74, 'ema1': 7, 'ema2': 34, 'slip_atr_k': 0.08661829617197052, 'slip_spread_k': 0.2861910065929391, 'spread_hl_frac': 0.028498860303048986, 'bb_std_mult': 0.932869910508196, 'rsi_os': 44, 'rsi_ob': 64, 'vol_spike': 0.1307349878897902, 'adx_thresh': 24.134400703101704, 'atr_min_pct': 0.028352357280605835, 'atr_max_pct': 0.026570862938484693, 'tp_mult': 2.5325511235091924, 'tsl_mult': 0.5103733441839712, 'strategy': 'breakout', 'time_stop': 269, 'use_sma': True, 'use_atr': True, 'use_adx': False, 'use_ema': False, 'use_spike': False, 'rsi_required': False, 'edge_k': 1.1344062804933706, 'edge_cap': 0.3137661371568005, 'bull_strategy': 'mean_reversion', 'bull_bb_std_mult': 3.423989350233093, 'bull_rsi_os': 42, 'bull_rsi_ob': 51, 'bull_adx_thresh': 9.378393558812135, 'bull_atr_min_pct': 0.0129935906299584, 'bull_atr_max_pct': 0.03020314203148342, 'bull_tp_mult': 2.652585725991019, 'bull_tsl_mult': 0.25904115854498044, 'bull_time_stop': 82, 'bull_use_sma': True, 'bull_use_ema': False, 'bull_use_atr': False, 'bull_use_adx': True, 'bull_use_spike': False, 'bull_rsi_required': False, 'bear_strategy': 'mean_reversion', 'bear_bb_std_mult': 2.9080300711131657, 'bear_rsi_os': 25, 'bear_rsi_ob': 69, 'bear_adx_thresh': 32.917594764166616, 'bear_atr_min_pct': 0.00919407481353542, 'bear_atr_max_pct': 0.11438646564464752, 'bear_tp_mult': 1.3089156172517904, 'bear_tsl_mult': 0.04509855487463646, 'bear_time_stop': 5, 'bear_use_sma': False, 'bear_use_ema': False, 'bear_use_atr': False, 'bear_use_adx': False, 'bear_use_spike': True, 'bear_rsi_required': False, 'sideways_strategy': 'mean_reversion', 'sideways_bb_std_mult': 1.3801806999093522, 'sideways_rsi_os': 27, 'sideways_rsi_ob': 50, 'sideways_adx_thresh': 14.935327427065198, 'sideways_atr_min_pct': 0.022827745958654402, 'sideways_atr_max_pct': 0.06922286222392224, 'sideways_tp_mult': 1.7281076025774003, 'sideways_tsl_mult': 0.4186551702895835, 'sideways_time_stop': 168, 'sideways_use_sma': True, 'sideways_use_ema': True, 'sideways_use_atr': True, 'sideways_use_adx': False, 'sideways_use_spike': False, 'sideways_rsi_required': True}.
[I 2025-08-31 12:13:13,813] Trial 159 finished with values: [-1000000000.0, 1000000000.0] and parameters: {'p_sma': 33, 'p_std': 18, 'p_atr': 24, 'p_adx': 27, 'rsi_period': 74, 'ema1': 20, 'ema2': 48, 'slip_atr_k': 0.09392730547793335, 'slip_spread_k': 0.11975276278943331, 'spread_hl_frac': 0.030424170605405202, 'bb_std_mult': 0.8450609755218195, 'rsi_os': 16, 'rsi_ob': 45, 'vol_spike': 0.26516364223129124, 'adx_thresh': 20.748780636140175, 'atr_min_pct': 0.029028341099012225, 'atr_max_pct': 0.06546463242692196, 'tp_mult': 1.365280810056055, 'tsl_mult': 0.8848446391016183, 'strategy': 'breakout', 'time_stop': 234, 'use_sma': True, 'use_atr': False, 'use_adx': True, 'use_ema': False, 'use_spike': False, 'rsi_required': False, 'edge_k': 0.8171658179128256, 'edge_cap': 0.22015934002450596, 'bull_strategy': 'mean_reversion', 'bull_bb_std_mult': 0.6314882110168483, 'bull_rsi_os': 41, 'bull_rsi_ob': 87, 'bull_adx_thresh': 10.62093460785655, 'bull_atr_min_pct': 0.01305368138043032, 'bull_atr_max_pct': 0.031187481452284383, 'bull_tp_mult': 2.076586112429189, 'bull_tsl_mult': 0.25974468202430506, 'bull_time_stop': 80, 'bull_use_sma': False, 'bull_use_ema': False, 'bull_use_atr': False, 'bull_use_adx': True, 'bull_use_spike': True, 'bull_rsi_required': True, 'bear_strategy': 'mean_reversion', 'bear_bb_std_mult': 1.5602235110522715, 'bear_rsi_os': 26, 'bear_rsi_ob': 58, 'bear_adx_thresh': 19.746976485854997, 'bear_atr_min_pct': 0.0016916611683957493, 'bear_atr_max_pct': 0.08203295366147684, 'bear_tp_mult': 1.745547009903626, 'bear_tsl_mult': 0.1160309141916545, 'bear_time_stop': 267, 'bear_use_sma': False, 'bear_use_ema': False, 'bear_use_atr': False, 'bear_use_adx': False, 'bear_use_spike': False, 'bear_rsi_required': False, 'sideways_strategy': 'mean_reversion', 'sideways_bb_std_mult': 2.3189786541548307, 'sideways_rsi_os': 27, 'sideways_rsi_ob': 50, 'sideways_adx_thresh': 21.273905065164183, 'sideways_atr_min_pct': 0.009507398076493662, 'sideways_atr_max_pct': 0.07201028424349742, 'sideways_tp_mult': 1.4777689795220295, 'sideways_tsl_mult': 0.40634845560138744, 'sideways_time_stop': 210, 'sideways_use_sma': False, 'sideways_use_ema': False, 'sideways_use_atr': True, 'sideways_use_adx': True, 'sideways_use_spike': False, 'sideways_rsi_required': True}.
[I 2025-08-31 12:13:14,516] Trial 160 finished with values: [-0.0700341569103452, 0.06996011442564701] and parameters: {'p_sma': 45, 'p_std': 18, 'p_atr': 10, 'p_adx': 21, 'rsi_period': 74, 'ema1': 7, 'ema2': 34, 'slip_atr_k': 0.24947929895398713, 'slip_spread_k': 0.04759564014989873, 'spread_hl_frac': 0.02711732748432314, 'bb_std_mult': 0.8592175130271651, 'rsi_os': 47, 'rsi_ob': 64, 'vol_spike': 0.16878841952193024, 'adx_thresh': 25.29981885008589, 'atr_min_pct': 0.014771296881846726, 'atr_max_pct': 0.06624997891516174, 'tp_mult': 2.7074335466121973, 'tsl_mult': 0.8761953204370829, 'strategy': 'breakout', 'time_stop': 43, 'use_sma': True, 'use_atr': False, 'use_adx': True, 'use_ema': False, 'use_spike': False, 'rsi_required': False, 'edge_k': 1.0669727734010688, 'edge_cap': 0.22431478017987463, 'bull_strategy': 'mean_reversion', 'bull_bb_std_mult': 0.8919013686473647, 'bull_rsi_os': 12, 'bull_rsi_ob': 87, 'bull_adx_thresh': 21.05817442892781, 'bull_atr_min_pct': 0.017296454930867768, 'bull_atr_max_pct': 0.03041692532630831, 'bull_tp_mult': 1.985775123044699, 'bull_tsl_mult': 0.26146103253871383, 'bull_time_stop': 81, 'bull_use_sma': False, 'bull_use_ema': False, 'bull_use_atr': False, 'bull_use_adx': True, 'bull_use_spike': True, 'bull_rsi_required': True, 'bear_strategy': 'mean_reversion', 'bear_bb_std_mult': 2.6229163594431135, 'bear_rsi_os': 25, 'bear_rsi_ob': 58, 'bear_adx_thresh': 32.23121643557269, 'bear_atr_min_pct': 0.0061734975531063056, 'bear_atr_max_pct': 0.11260565628187588, 'bear_tp_mult': 1.3121702929601513, 'bear_tsl_mult': 0.9502744306899487, 'bear_time_stop': 122, 'bear_use_sma': False, 'bear_use_ema': False, 'bear_use_atr': False, 'bear_use_adx': False, 'bear_use_spike': False, 'bear_rsi_required': False, 'sideways_strategy': 'mean_reversion', 'sideways_bb_std_mult': 2.087724788844929, 'sideways_rsi_os': 52, 'sideways_rsi_ob': 50, 'sideways_adx_thresh': 28.66329267164744, 'sideways_atr_min_pct': 0.0023019377756467057, 'sideways_atr_max_pct': 0.07040251095131497, 'sideways_tp_mult': 1.4706096482122915, 'sideways_tsl_mult': 0.2506726103455891, 'sideways_time_stop': 178, 'sideways_use_sma': False, 'sideways_use_ema': False, 'sideways_use_atr': True, 'sideways_use_adx': True, 'sideways_use_spike': False, 'sideways_rsi_required': True}.
