[I 2025-08-31 12:38:49,025] Trial 362 finished with values: [-0.18139988085037106, 0.18120897355973978] and parameters: {'p_sma': 10, 'p_std': 35, 'p_atr': 14, 'p_adx': 17, 'rsi_period': 18, 'ema1': 6, 'ema2': 20, 'slip_atr_k': 0.030098075661444693, 'slip_spread_k': 0.7977030738207624, 'spread_hl_frac': 0.038099879508204496, 'bb_std_mult': 2.5750512002040233, 'rsi_os': 40, 'rsi_ob': 69, 'vol_spike': 0.08999620518777211, 'adx_thresh': 6.593148517770759, 'atr_min_pct': 0.018249917620111963, 'atr_max_pct': 0.13785933621096558, 'tp_mult': 1.601564407094111, 'tsl_mult': 0.3524160873070866, 'strategy': 'mean_reversion', 'time_stop': 13, 'use_sma': False, 'use_atr': True, 'use_adx': False, 'use_ema': False, 'use_spike': False, 'rsi_required': True, 'edge_k': 0.7391055276198908, 'edge_cap': 0.5506994560694443, 'bull_strategy': 'breakout', 'bull_bb_std_mult': 0.8766275625104132, 'bull_rsi_os': 20, 'bull_rsi_ob': 80, 'bull_adx_thresh': 10.87252659716145, 'bull_atr_min_pct': 0.011785338180082948, 'bull_atr_max_pct': 0.08458475607585456, 'bull_tp_mult': 2.7375426639184925, 'bull_tsl_mult': 0.8171916888497317, 'bull_time_stop': 265, 'bull_use_sma': True, 'bull_use_ema': True, 'bull_use_atr': False, 'bull_use_adx': True, 'bull_use_spike': False, 'bull_rsi_required': False, 'bear_strategy': 'breakout', 'bear_bb_std_mult': 3.4029380277594514, 'bear_rsi_os': 28, 'bear_rsi_ob': 70, 'bear_adx_thresh': 33.02431104224259, 'bear_atr_min_pct': 0.00877843652541919, 'bear_atr_max_pct': 0.0990438355645564, 'bear_tp_mult': 2.861570760318764, 'bear_tsl_mult': 0.5542227546684406, 'bear_time_stop': 97, 'bear_use_sma': True, 'bear_use_ema': True, 'bear_use_atr': True, 'bear_use_adx': True, 'bear_use_spike': True, 'bear_rsi_required': True, 'sideways_strategy': 'breakout', 'sideways_bb_std_mult': 3.479641165256841, 'sideways_rsi_os': 35, 'sideways_rsi_ob': 84, 'sideways_adx_thresh': 12.801553484817049, 'sideways_atr_min_pct': 4.5308376876886775e-05, 'sideways_atr_max_pct': 0.11819957368063332, 'sideways_tp_mult': 1.7532680588296956, 'sideways_tsl_mult': 0.15423545152640655, 'sideways_time_stop': 32, 'sideways_use_sma': True, 'sideways_use_ema': False, 'sideways_use_atr': False, 'sideways_use_adx': False, 'sideways_use_spike': False, 'sideways_rsi_required': True}.
[I 2025-08-31 12:38:49,277] Trial 363 finished with values: [-0.022604512184476344, 0.022700422694405954] and parameters: {'p_sma': 53, 'p_std': 60, 'p_atr': 12, 'p_adx': 17, 'rsi_period': 53, 'ema1': 6, 'ema2': 18, 'slip_atr_k': 0.03033478700931811, 'slip_spread_k': 0.7102281302863802, 'spread_hl_frac': 0.031737934226134995, 'bb_std_mult': 2.5883493048980073, 'rsi_os': 40, 'rsi_ob': 71, 'vol_spike': 0.008386053124475962, 'adx_thresh': 16.908277160049924, 'atr_min_pct': 0.02376109168672022, 'atr_max_pct': 0.13765997019376536, 'tp_mult': 2.650826009436966, 'tsl_mult': 0.07605107354939505, 'strategy': 'mean_reversion', 'time_stop': 64, 'use_sma': False, 'use_atr': True, 'use_adx': False, 'use_ema': False, 'use_spike': False, 'rsi_required': True, 'edge_k': 1.712054855947387, 'edge_cap': 0.3740084401168996, 'bull_strategy': 'breakout', 'bull_bb_std_mult': 3.0496418857143306, 'bull_rsi_os': 48, 'bull_rsi_ob': 80, 'bull_adx_thresh': 11.03136923099596, 'bull_atr_min_pct': 0.009320368472717628, 'bull_atr_max_pct': 0.07956761274515839, 'bull_tp_mult': 2.7238918196481396, 'bull_tsl_mult': 0.07149992184215281, 'bull_time_stop': 87, 'bull_use_sma': True, 'bull_use_ema': True, 'bull_use_atr': True, 'bull_use_adx': True, 'bull_use_spike': False, 'bull_rsi_required': False, 'bear_strategy': 'breakout', 'bear_bb_std_mult': 2.1634192994159647, 'bear_rsi_os': 55, 'bear_rsi_ob': 71, 'bear_adx_thresh': 32.974712727308436, 'bear_atr_min_pct': 0.028307092931331337, 'bear_atr_max_pct': 0.09858899081088794, 'bear_tp_mult': 2.8401810655653517, 'bear_tsl_mult': 0.5608360763095107, 'bear_time_stop': 84, 'bear_use_sma': True, 'bear_use_ema': True, 'bear_use_atr': True, 'bear_use_adx': True, 'bear_use_spike': True, 'bear_rsi_required': True, 'sideways_strategy': 'breakout', 'sideways_bb_std_mult': 3.4743485567951593, 'sideways_rsi_os': 33, 'sideways_rsi_ob': 84, 'sideways_adx_thresh': 12.741139374627078, 'sideways_atr_min_pct': 0.0010814157232936438, 'sideways_atr_max_pct': 0.034988697865389363, 'sideways_tp_mult': 1.423615240550961, 'sideways_tsl_mult': 0.6323758961655436, 'sideways_time_stop': 206, 'sideways_use_sma': True, 'sideways_use_ema': False, 'sideways_use_atr': False, 'sideways_use_adx': False, 'sideways_use_spike': False, 'sideways_rsi_required': True}.
[I 2025-08-31 12:38:49,709] Trial 360 finished with values: [-0.24460800744601363, 0.24445349773327482] and parameters: {'p_sma': 46, 'p_std': 28, 'p_atr': 12, 'p_adx': 29, 'rsi_period': 18, 'ema1': 6, 'ema2': 52, 'slip_atr_k': 0.23060016400632627, 'slip_spread_k': 0.6950522727993368, 'spread_hl_frac': 0.029195931853738217, 'bb_std_mult': 2.5877658399422216, 'rsi_os': 41, 'rsi_ob': 71, 'vol_spike': 0.2254942685406185, 'adx_thresh': 27.675261694757673, 'atr_min_pct': 0.009318812887442938, 'atr_max_pct': 0.13206672946120232, 'tp_mult': 2.0306331710301224, 'tsl_mult': 0.0833132787550167, 'strategy': 'mean_reversion', 'time_stop': 191, 'use_sma': False, 'use_atr': True, 'use_adx': False, 'use_ema': False, 'use_spike': False, 'rsi_required': True, 'edge_k': 0.20964360508687918, 'edge_cap': 0.5578288995236034, 'bull_strategy': 'breakout', 'bull_bb_std_mult': 2.4566700851969174, 'bull_rsi_os': 44, 'bull_rsi_ob': 80, 'bull_adx_thresh': 8.313188030092418, 'bull_atr_min_pct': 0.005634586078835253, 'bull_atr_max_pct': 0.08513440279065868, 'bull_tp_mult': 2.608746211370628, 'bull_tsl_mult': 0.9762955334941422, 'bull_time_stop': 72, 'bull_use_sma': True, 'bull_use_ema': True, 'bull_use_atr': True, 'bull_use_adx': True, 'bull_use_spike': False, 'bull_rsi_required': False, 'bear_strategy': 'breakout', 'bear_bb_std_mult': 3.4203326882764578, 'bear_rsi_os': 55, 'bear_rsi_ob': 71, 'bear_adx_thresh': 12.645361393778362, 'bear_atr_min_pct': 0.028339814634509693, 'bear_atr_max_pct': 0.09876876914703422, 'bear_tp_mult': 1.2782994571384982, 'bear_tsl_mult': 0.5370193201206207, 'bear_time_stop': 243, 'bear_use_sma': True, 'bear_use_ema': True, 'bear_use_atr': True, 'bear_use_adx': True, 'bear_use_spike': True, 'bear_rsi_required': True, 'sideways_strategy': 'breakout', 'sideways_bb_std_mult': 0.9941386672234986, 'sideways_rsi_os': 37, 'sideways_rsi_ob': 83, 'sideways_adx_thresh': 11.41793989474781, 'sideways_atr_min_pct': 0.0009325714925426574, 'sideways_atr_max_pct': 0.11948776704041218, 'sideways_tp_mult': 1.5403428388595177, 'sideways_tsl_mult': 0.6484234889209679, 'sideways_time_stop': 29, 'sideways_use_sma': True, 'sideways_use_ema': False, 'sideways_use_atr': False, 'sideways_use_adx': False, 'sideways_use_spike': False, 'sideways_rsi_required': True}.
[I 2025-08-31 12:38:49,835] Trial 361 finished with values: [-1000000000.0, 1000000000.0] and parameters: {'p_sma': 10, 'p_std': 23, 'p_atr': 23, 'p_adx': 13, 'rsi_period': 30, 'ema1': 6, 'ema2': 32, 'slip_atr_k': 0.030393044141551417, 'slip_spread_k': 0.6938261343543431, 'spread_hl_frac': 0.029398919339931624, 'bb_std_mult': 2.0343128828341963, 'rsi_os': 41, 'rsi_ob': 87, 'vol_spike': 0.0867594098469076, 'adx_thresh': 23.857392868659584, 'atr_min_pct': 0.001354835619717014, 'atr_max_pct': 0.13683736290378984, 'tp_mult': 2.039881007880747, 'tsl_mult': 0.2720420569524714, 'strategy': 'mean_reversion', 'time_stop': 13, 'use_sma': False, 'use_atr': True, 'use_adx': False, 'use_ema': False, 'use_spike': False, 'rsi_required': True, 'edge_k': 1.5403724474658333, 'edge_cap': 0.623146425563833, 'bull_strategy': 'breakout', 'bull_bb_std_mult': 0.5796607827493547, 'bull_rsi_os': 20, 'bull_rsi_ob': 79, 'bull_adx_thresh': 11.073481542217213, 'bull_atr_min_pct': 0.009430001927474313, 'bull_atr_max_pct': 0.0753444326506281, 'bull_tp_mult': 2.608396205145443, 'bull_tsl_mult': 0.2942910565764169, 'bull_time_stop': 90, 'bull_use_sma': True, 'bull_use_ema': True, 'bull_use_atr': True, 'bull_use_adx': True, 'bull_use_spike': False, 'bull_rsi_required': False, 'bear_strategy': 'breakout', 'bear_bb_std_mult': 3.340472499788498, 'bear_rsi_os': 34, 'bear_rsi_ob': 70, 'bear_adx_thresh': 24.714013769891793, 'bear_atr_min_pct': 0.010407445059637931, 'bear_atr_max_pct': 0.04606906647164743, 'bear_tp_mult': 2.845694950202644, 'bear_tsl_mult': 0.07095521018711265, 'bear_time_stop': 85, 'bear_use_sma': True, 'bear_use_ema': True, 'bear_use_atr': True, 'bear_use_adx': True, 'bear_use_spike': True, 'bear_rsi_required': True, 'sideways_strategy': 'breakout', 'sideways_bb_std_mult': 1.0240385319781924, 'sideways_rsi_os': 37, 'sideways_rsi_ob': 83, 'sideways_adx_thresh': 33.16895728985506, 'sideways_atr_min_pct': 0.012366255851564579, 'sideways_atr_max_pct': 0.09089672141390355, 'sideways_tp_mult': 2.209852023523551, 'sideways_tsl_mult': 0.15359870923713725, 'sideways_time_stop': 29, 'sideways_use_sma': True, 'sideways_use_ema': False, 'sideways_use_atr': False, 'sideways_use_adx': False, 'sideways_use_spike': False, 'sideways_rsi_required': True}.
[I 2025-08-31 12:38:50,512] Trial 366 finished with values: [-1000000000.0, 1000000000.0] and parameters: {'p_sma': 52, 'p_std': 23, 'p_atr': 13, 'p_adx': 13, 'rsi_period': 82, 'ema1': 5, 'ema2': 31, 'slip_atr_k': 0.05095587705638567, 'slip_spread_k': 0.6134030053259676, 'spread_hl_frac': 0.003776756228361426, 'bb_std_mult': 2.69188448756953, 'rsi_os': 55, 'rsi_ob': 73, 'vol_spike': 0.08620209028685955, 'adx_thresh': 23.810092056321547, 'atr_min_pct': 0.001403277542140943, 'atr_max_pct': 0.12617588188408685, 'tp_mult': 2.6451496161218606, 'tsl_mult': 0.0017223713159611569, 'strategy': 'mean_reversion', 'time_stop': 217, 'use_sma': False, 'use_atr': True, 'use_adx': False, 'use_ema': True, 'use_spike': False, 'rsi_required': True, 'edge_k': 0.7000295179170242, 'edge_cap': 0.40962314095354696, 'bull_strategy': 'breakout', 'bull_bb_std_mult': 2.825699385322336, 'bull_rsi_os': 48, 'bull_rsi_ob': 76, 'bull_adx_thresh': 7.668919722613002, 'bull_atr_min_pct': 0.018850215010443816, 'bull_atr_max_pct': 0.13088839749314168, 'bull_tp_mult': 1.403661271089149, 'bull_tsl_mult': 0.22953853049617085, 'bull_time_stop': 87, 'bull_use_sma': True, 'bull_use_ema': True, 'bull_use_atr': False, 'bull_use_adx': True, 'bull_use_spike': False, 'bull_rsi_required': False, 'bear_strategy': 'breakout', 'bear_bb_std_mult': 2.1630304625543397, 'bear_rsi_os': 30, 'bear_rsi_ob': 88, 'bear_adx_thresh': 26.320357201964022, 'bear_atr_min_pct': 0.009761235516182729, 'bear_atr_max_pct': 0.12934067068973265, 'bear_tp_mult': 2.821071317569924, 'bear_tsl_mult': 0.07149023457079073, 'bear_time_stop': 227, 'bear_use_sma': True, 'bear_use_ema': True, 'bear_use_atr': True, 'bear_use_adx': True, 'bear_use_spike': True, 'bear_rsi_required': True, 'sideways_strategy': 'breakout', 'sideways_bb_std_mult': 2.551486965871665, 'sideways_rsi_os': 18, 'sideways_rsi_ob': 56, 'sideways_adx_thresh': 12.230504489086494, 'sideways_atr_min_pct': 0.023165629113921553, 'sideways_atr_max_pct': 0.02292970371106231, 'sideways_tp_mult': 1.4161706187192626, 'sideways_tsl_mult': 0.755147274918513, 'sideways_time_stop': 205, 'sideways_use_sma': True, 'sideways_use_ema': False, 'sideways_use_atr': False, 'sideways_use_adx': False, 'sideways_use_spike': False, 'sideways_rsi_required': True}.
[I 2025-08-31 12:38:50,518] Trial 364 finished with values: [-1000000000.0, 1000000000.0] and parameters: {'p_sma': 55, 'p_std': 51, 'p_atr': 13, 'p_adx': 12, 'rsi_period': 36, 'ema1': 6, 'ema2': 59, 'slip_atr_k': 0.026536936795612497, 'slip_spread_k': 0.6239522117838547, 'spread_hl_frac': 0.003857816994421323, 'bb_std_mult': 2.026205217468431, 'rsi_os': 55, 'rsi_ob': 73, 'vol_spike': 0.08741700500081835, 'adx_thresh': 16.84808685811777, 'atr_min_pct': 0.009034088776496125, 'atr_max_pct': 0.026145062256436785, 'tp_mult': 2.645958365523005, 'tsl_mult': 0.07703299204221352, 'strategy': 'mean_reversion', 'time_stop': 65, 'use_sma': False, 'use_atr': True, 'use_adx': False, 'use_ema': False, 'use_spike': False, 'rsi_required': True, 'edge_k': 1.6926345500644762, 'edge_cap': 0.6218032963519882, 'bull_strategy': 'breakout', 'bull_bb_std_mult': 2.816566050208442, 'bull_rsi_os': 34, 'bull_rsi_ob': 53, 'bull_adx_thresh': 8.226485327155341, 'bull_atr_min_pct': 0.01871268707861144, 'bull_atr_max_pct': 0.12901050065041395, 'bull_tp_mult': 2.70462332120524, 'bull_tsl_mult': 0.9748917319711431, 'bull_time_stop': 87, 'bull_use_sma': True, 'bull_use_ema': True, 'bull_use_atr': True, 'bull_use_adx': True, 'bull_use_spike': False, 'bull_rsi_required': False, 'bear_strategy': 'breakout', 'bear_bb_std_mult': 3.0351733043446307, 'bear_rsi_os': 55, 'bear_rsi_ob': 88, 'bear_adx_thresh': 26.20633993051323, 'bear_atr_min_pct': 0.010263051567755012, 'bear_atr_max_pct': 0.12849040338962278, 'bear_tp_mult': 1.0242479189440568, 'bear_tsl_mult': 0.6433708061441467, 'bear_time_stop': 227, 'bear_use_sma': True, 'bear_use_ema': True, 'bear_use_atr': True, 'bear_use_adx': True, 'bear_use_spike': True, 'bear_rsi_required': True, 'sideways_strategy': 'breakout', 'sideways_bb_std_mult': 2.9429888077090522, 'sideways_rsi_os': 34, 'sideways_rsi_ob': 53, 'sideways_adx_thresh': 12.264478736096695, 'sideways_atr_min_pct': 0.012477359211129125, 'sideways_atr_max_pct': 0.09725433037938461, 'sideways_tp_mult': 1.412638546505162, 'sideways_tsl_mult': 0.6272254962605891, 'sideways_time_stop': 24, 'sideways_use_sma': True, 'sideways_use_ema': False, 'sideways_use_atr': False, 'sideways_use_adx': False, 'sideways_use_spike': False, 'sideways_rsi_required': True}.
[I 2025-08-31 12:38:50,526] Trial 367 finished with values: [-1000000000.0, 1000000000.0] and parameters: {'p_sma': 53, 'p_std': 51, 'p_atr': 13, 'p_adx': 17, 'rsi_period': 81, 'ema1': 5, 'ema2': 15, 'slip_atr_k': 0.05267542678446309, 'slip_spread_k': 0.6178343263310068, 'spread_hl_frac': 0.03175773595329616, 'bb_std_mult': 2.480250984725281, 'rsi_os': 55, 'rsi_ob': 73, 'vol_spike': 0.010066550810468256, 'adx_thresh': 5.208440919826526, 'atr_min_pct': 0.023885775055954832, 'atr_max_pct': 0.12784332888211142, 'tp_mult': 2.643743380821995, 'tsl_mult': 0.8667174737750881, 'strategy': 'mean_reversion', 'time_stop': 67, 'use_sma': False, 'use_atr': True, 'use_adx': False, 'use_ema': True, 'use_spike': False, 'rsi_required': True, 'edge_k': 0.6686533610392165, 'edge_cap': 0.8709440690350625, 'bull_strategy': 'breakout', 'bull_bb_std_mult': 2.841422342349554, 'bull_rsi_os': 48, 'bull_rsi_ob': 76, 'bull_adx_thresh': 21.306229270105312, 'bull_atr_min_pct': 0.021412283579895434, 'bull_atr_max_pct': 0.056380281972871836, 'bull_tp_mult': 2.725141822456863, 'bull_tsl_mult': 0.02232727938755913, 'bull_time_stop': 169, 'bull_use_sma': True, 'bull_use_ema': True, 'bull_use_atr': False, 'bull_use_adx': True, 'bull_use_spike': False, 'bull_rsi_required': False, 'bear_strategy': 'breakout', 'bear_bb_std_mult': 3.0660187197832203, 'bear_rsi_os': 30, 'bear_rsi_ob': 72, 'bear_adx_thresh': 26.184524582470445, 'bear_atr_min_pct': 0.021347289443522224, 'bear_atr_max_pct': 0.14041168283937494, 'bear_tp_mult': 2.815063781806479, 'bear_tsl_mult': 0.1564375799874294, 'bear_time_stop': 226, 'bear_use_sma': True, 'bear_use_ema': True, 'bear_use_atr': True, 'bear_use_adx': True, 'bear_use_spike': True, 'bear_rsi_required': True, 'sideways_strategy': 'breakout', 'sideways_bb_std_mult': 3.598532397118697, 'sideways_rsi_os': 41, 'sideways_rsi_ob': 95, 'sideways_adx_thresh': 12.004186713890801, 'sideways_atr_min_pct': 0.0025079864570383362, 'sideways_atr_max_pct': 0.1341099812565317, 'sideways_tp_mult': 1.440315100655932, 'sideways_tsl_mult': 0.07255776031492661, 'sideways_time_stop': 205, 'sideways_use_sma': True, 'sideways_use_ema': False, 'sideways_use_atr': False, 'sideways_use_adx': False, 'sideways_use_spike': False, 'sideways_rsi_required': True}.
[I 2025-08-31 12:39:19,286] Trial 365 finished with values: [-0.019274006951026768, 0.019063765168323348] and parameters: {'p_sma': 53, 'p_std': 60, 'p_atr': 13, 'p_adx': 13, 'rsi_period': 81, 'ema1': 6, 'ema2': 15, 'slip_atr_k': 0.05656378962236379, 'slip_spread_k': 0.7008085931285245, 'spread_hl_frac': 0.03200149577299685, 'bb_std_mult': 2.6053254691824543, 'rsi_os': 41, 'rsi_ob': 71, 'vol_spike': 0.10073623553217509, 'adx_thresh': 27.7397454459536, 'atr_min_pct': 0.001291829926621337, 'atr_max_pct': 0.12449644495897709, 'tp_mult': 2.2935390172374523, 'tsl_mult': 0.0009141434164040285, 'strategy': 'mean_reversion', 'time_stop': 190, 'use_sma': False, 'use_atr': True, 'use_adx': False, 'use_ema': True, 'use_spike': False, 'rsi_required': True, 'edge_k': 1.7250361277418325, 'edge_cap': 0.887839819429307, 'bull_strategy': 'breakout', 'bull_bb_std_mult': 2.827121606578414, 'bull_rsi_os': 34, 'bull_rsi_ob': 79, 'bull_adx_thresh': 18.648023193196543, 'bull_atr_min_pct': 0.019027115899556062, 'bull_atr_max_pct': 0.1297026145459307, 'bull_tp_mult': 2.7091730347210117, 'bull_tsl_mult': 0.07353960067062248, 'bull_time_stop': 86, 'bull_use_sma': True, 'bull_use_ema': True, 'bull_use_atr': False, 'bull_use_adx': True, 'bull_use_spike': False, 'bull_rsi_required': False, 'bear_strategy': 'breakout', 'bear_bb_std_mult': 3.0394480653331524, 'bear_rsi_os': 30, 'bear_rsi_ob': 72, 'bear_adx_thresh': 14.701746189293228, 'bear_atr_min_pct': 0.010417865693144679, 'bear_atr_max_pct': 0.04533668603762427, 'bear_tp_mult': 2.8310340483491423, 'bear_tsl_mult': 0.12776669341896466, 'bear_time_stop': 227, 'bear_use_sma': True, 'bear_use_ema': True, 'bear_use_atr': True, 'bear_use_adx': True, 'bear_use_spike': True, 'bear_rsi_required': True, 'sideways_strategy': 'breakout', 'sideways_bb_std_mult': 3.59967741046975, 'sideways_rsi_os': 37, 'sideways_rsi_ob': 83, 'sideways_adx_thresh': 12.247336098283363, 'sideways_atr_min_pct': 0.0009608002295452625, 'sideways_atr_max_pct': 0.14122655534287148, 'sideways_tp_mult': 2.129833479206271, 'sideways_tsl_mult': 0.06711356509900873, 'sideways_time_stop': 207, 'sideways_use_sma': True, 'sideways_use_ema': False, 'sideways_use_atr': False, 'sideways_use_adx': False, 'sideways_use_spike': False, 'sideways_rsi_required': True}.
[I 2025-08-31 12:39:24,211] Trial 368 finished with values: [-1000000000.0, 1000000000.0] and parameters: {'p_sma': 53, 'p_std': 33, 'p_atr': 20, 'p_adx': 17, 'rsi_period': 74, 'ema1': 16, 'ema2': 15, 'slip_atr_k': 0.06608369866960322, 'slip_spread_k': 0.35478929707792406, 'spread_hl_frac': 0.031597047031498605, 'bb_std_mult': 2.4400292351992845, 'rsi_os': 42, 'rsi_ob': 80, 'vol_spike': 0.10376726277067434, 'adx_thresh': 8.59141024038547, 'atr_min_pct': 0.0030422562436590713, 'atr_max_pct': 0.1284556865546084, 'tp_mult': 1.0660692962491671, 'tsl_mult': 0.028839473255421064, 'strategy': 'mean_reversion', 'time_stop': 162, 'use_sma': False, 'use_atr': True, 'use_adx': False, 'use_ema': False, 'use_spike': False, 'rsi_required': True, 'edge_k': 1.714960057808524, 'edge_cap': 0.8820003554183646, 'bull_strategy': 'breakout', 'bull_bb_std_mult': 2.9652500562082436, 'bull_rsi_os': 7, 'bull_rsi_ob': 80, 'bull_adx_thresh': 26.99284835539138, 'bull_atr_min_pct': 0.013206459470908585, 'bull_atr_max_pct': 0.11962415114698886, 'bull_tp_mult': 2.815960294999826, 'bull_tsl_mult': 0.5687339745771504, 'bull_time_stop': 83, 'bull_use_sma': True, 'bull_use_ema': True, 'bull_use_atr': False, 'bull_use_adx': True, 'bull_use_spike': False, 'bull_rsi_required': False, 'bear_strategy': 'breakout', 'bear_bb_std_mult': 3.029704039884018, 'bear_rsi_os': 40, 'bear_rsi_ob': 72, 'bear_adx_thresh': 16.653611941808535, 'bear_atr_min_pct': 0.0273405013228407, 'bear_atr_max_pct': 0.09170663071733709, 'bear_tp_mult': 2.716972275295357, 'bear_tsl_mult': 0.15858617325407343, 'bear_time_stop': 60, 'bear_use_sma': True, 'bear_use_ema': True, 'bear_use_atr': True, 'bear_use_adx': True, 'bear_use_spike': True, 'bear_rsi_required': True, 'sideways_strategy': 'breakout', 'sideways_bb_std_mult': 2.895776706830503, 'sideways_rsi_os': 12, 'sideways_rsi_ob': 85, 'sideways_adx_thresh': 29.309629951698394, 'sideways_atr_min_pct': 0.016353822262572433, 'sideways_atr_max_pct': 0.1333912396486565, 'sideways_tp_mult': 1.3911232693331221, 'sideways_tsl_mult': 0.07148393375415485, 'sideways_time_stop': 21, 'sideways_use_sma': True, 'sideways_use_ema': False, 'sideways_use_atr': False, 'sideways_use_adx': False, 'sideways_use_spike': False, 'sideways_rsi_required': True}.
