[I 2025-08-31 12:48:22,618] Trial 434 finished with values: [-1000000000.0, 1000000000.0] and parameters: {'p_sma': 26, 'p_std': 23, 'p_atr': 12, 'p_adx': 14, 'rsi_period': 50, 'ema1': 21, 'ema2': 41, 'slip_atr_k': 0.2109208053792656, 'slip_spread_k': 0.3887330765810736, 'spread_hl_frac': 0.01970444890323681, 'bb_std_mult': 2.200140110015113, 'rsi_os': 30, 'rsi_ob': 78, 'vol_spike': 0.0408237519092943, 'adx_thresh': 19.389374293713136, 'atr_min_pct': 0.00569469684007355, 'atr_max_pct': 0.12689512619443777, 'tp_mult': 1.5321682123714895, 'tsl_mult': 0.24903910450607353, 'strategy': 'breakout', 'time_stop': 182, 'use_sma': False, 'use_atr': True, 'use_adx': False, 'use_ema': True, 'use_spike': False, 'rsi_required': True, 'edge_k': 0.9961588526566764, 'edge_cap': 0.7890649885960578, 'bull_strategy': 'mean_reversion', 'bull_bb_std_mult': 2.386572180947209, 'bull_rsi_os': 7, 'bull_rsi_ob': 50, 'bull_adx_thresh': 14.076299247939446, 'bull_atr_min_pct': 0.010861672313537466, 'bull_atr_max_pct': 0.14454479134740408, 'bull_tp_mult': 1.509726550794971, 'bull_tsl_mult': 0.2160740350834197, 'bull_time_stop': 285, 'bull_use_sma': False, 'bull_use_ema': False, 'bull_use_atr': False, 'bull_use_adx': True, 'bull_use_spike': False, 'bull_rsi_required': False, 'bear_strategy': 'mean_reversion', 'bear_bb_std_mult': 2.970668879053567, 'bear_rsi_os': 29, 'bear_rsi_ob': 49, 'bear_adx_thresh': 11.302922710643974, 'bear_atr_min_pct': 0.0034737625796537296, 'bear_atr_max_pct': 0.13217368517995703, 'bear_tp_mult': 2.9056565601233517, 'bear_tsl_mult': 0.7619598828486817, 'bear_time_stop': 199, 'bear_use_sma': True, 'bear_use_ema': True, 'bear_use_atr': True, 'bear_use_adx': True, 'bear_use_spike': True, 'bear_rsi_required': True, 'sideways_strategy': 'breakout', 'sideways_bb_std_mult': 2.498966466008886, 'sideways_rsi_os': 28, 'sideways_rsi_ob': 67, 'sideways_adx_thresh': 27.578816959807664, 'sideways_atr_min_pct': 0.02368369074565714, 'sideways_atr_max_pct': 0.12587094422777145, 'sideways_tp_mult': 1.5492704705059288, 'sideways_tsl_mult': 0.8609001815842535, 'sideways_time_stop': 293, 'sideways_use_sma': True, 'sideways_use_ema': False, 'sideways_use_atr': False, 'sideways_use_adx': False, 'sideways_use_spike': True, 'sideways_rsi_required': True}.
[I 2025-08-31 12:48:22,720] Trial 432 finished with values: [-1000000000.0, 1000000000.0] and parameters: {'p_sma': 51, 'p_std': 25, 'p_atr': 12, 'p_adx': 14, 'rsi_period': 46, 'ema1': 20, 'ema2': 15, 'slip_atr_k': 0.1879907904005258, 'slip_spread_k': 0.4288002279025633, 'spread_hl_frac': 0.016664278643413286, 'bb_std_mult': 2.2407479102531282, 'rsi_os': 25, 'rsi_ob': 79, 'vol_spike': 0.021192243116298318, 'adx_thresh': 19.376230194387794, 'atr_min_pct': 0.0011552074499139758, 'atr_max_pct': 0.11612791806770212, 'tp_mult': 2.8297896163916505, 'tsl_mult': 0.25039095338873785, 'strategy': 'breakout', 'time_stop': 186, 'use_sma': False, 'use_atr': True, 'use_adx': False, 'use_ema': True, 'use_spike': False, 'rsi_required': True, 'edge_k': 0.6692929897636852, 'edge_cap': 0.8032953764842096, 'bull_strategy': 'mean_reversion', 'bull_bb_std_mult': 2.5527170224877684, 'bull_rsi_os': 7, 'bull_rsi_ob': 49, 'bull_adx_thresh': 18.532898237729878, 'bull_atr_min_pct': 0.0022843790848516617, 'bull_atr_max_pct': 0.1445533286931365, 'bull_tp_mult': 1.4955516806610678, 'bull_tsl_mult': 0.21451329203869016, 'bull_time_stop': 287, 'bull_use_sma': False, 'bull_use_ema': True, 'bull_use_atr': False, 'bull_use_adx': True, 'bull_use_spike': False, 'bull_rsi_required': True, 'bear_strategy': 'breakout', 'bear_bb_std_mult': 2.9963615611460175, 'bear_rsi_os': 29, 'bear_rsi_ob': 70, 'bear_adx_thresh': 13.909067316100247, 'bear_atr_min_pct': 0.0016821729019988955, 'bear_atr_max_pct': 0.1319502407585775, 'bear_tp_mult': 2.903148508199995, 'bear_tsl_mult': 0.7588291178767004, 'bear_time_stop': 201, 'bear_use_sma': True, 'bear_use_ema': True, 'bear_use_atr': True, 'bear_use_adx': True, 'bear_use_spike': True, 'bear_rsi_required': True, 'sideways_strategy': 'breakout', 'sideways_bb_std_mult': 2.5147846242372704, 'sideways_rsi_os': 28, 'sideways_rsi_ob': 67, 'sideways_adx_thresh': 27.30924671337473, 'sideways_atr_min_pct': 0.014080626131231535, 'sideways_atr_max_pct': 0.1265739533386162, 'sideways_tp_mult': 1.5498031535855255, 'sideways_tsl_mult': 0.8751279129634357, 'sideways_time_stop': 208, 'sideways_use_sma': True, 'sideways_use_ema': False, 'sideways_use_atr': False, 'sideways_use_adx': False, 'sideways_use_spike': True, 'sideways_rsi_required': True}.
[I 2025-08-31 12:48:22,977] Trial 431 finished with values: [-1000000000.0, 1000000000.0] and parameters: {'p_sma': 49, 'p_std': 23, 'p_atr': 20, 'p_adx': 15, 'rsi_period': 53, 'ema1': 20, 'ema2': 12, 'slip_atr_k': 0.0494193156686798, 'slip_spread_k': 0.4323217145683164, 'spread_hl_frac': 0.016205807905755272, 'bb_std_mult': 2.2420897100277624, 'rsi_os': 39, 'rsi_ob': 79, 'vol_spike': 0.032802068132410864, 'adx_thresh': 19.857384316841593, 'atr_min_pct': 0.008106123277280892, 'atr_max_pct': 0.12815258939781848, 'tp_mult': 2.8041301100349165, 'tsl_mult': 0.06970296565798147, 'strategy': 'breakout', 'time_stop': 185, 'use_sma': True, 'use_atr': True, 'use_adx': False, 'use_ema': True, 'use_spike': False, 'rsi_required': True, 'edge_k': 1.7699039247718504, 'edge_cap': 0.7999381063049664, 'bull_strategy': 'mean_reversion', 'bull_bb_std_mult': 2.041090738660872, 'bull_rsi_os': 5, 'bull_rsi_ob': 49, 'bull_adx_thresh': 16.858396720828377, 'bull_atr_min_pct': 0.019370835477024062, 'bull_atr_max_pct': 0.144255660712927, 'bull_tp_mult': 1.1420131989018079, 'bull_tsl_mult': 0.22239057928070463, 'bull_time_stop': 286, 'bull_use_sma': True, 'bull_use_ema': True, 'bull_use_atr': False, 'bull_use_adx': True, 'bull_use_spike': False, 'bull_rsi_required': True, 'bear_strategy': 'breakout', 'bear_bb_std_mult': 3.118924397641383, 'bear_rsi_os': 27, 'bear_rsi_ob': 71, 'bear_adx_thresh': 13.290736190621164, 'bear_atr_min_pct': 0.0016622026335291896, 'bear_atr_max_pct': 0.13681634599008166, 'bear_tp_mult': 2.9460662706279086, 'bear_tsl_mult': 0.7863169155007307, 'bear_time_stop': 208, 'bear_use_sma': True, 'bear_use_ema': True, 'bear_use_atr': True, 'bear_use_adx': True, 'bear_use_spike': True, 'bear_rsi_required': True, 'sideways_strategy': 'mean_reversion', 'sideways_bb_std_mult': 2.5647598627001247, 'sideways_rsi_os': 27, 'sideways_rsi_ob': 68, 'sideways_adx_thresh': 28.169282852585475, 'sideways_atr_min_pct': 0.009479492279253264, 'sideways_atr_max_pct': 0.12843061936412975, 'sideways_tp_mult': 1.6141277119655681, 'sideways_tsl_mult': 0.8758474962467684, 'sideways_time_stop': 212, 'sideways_use_sma': True, 'sideways_use_ema': True, 'sideways_use_atr': False, 'sideways_use_adx': False, 'sideways_use_spike': True, 'sideways_rsi_required': False}.
[I 2025-08-31 12:48:55,776] Trial 436 finished with values: [-1000000000.0, 1000000000.0] and parameters: {'p_sma': 39, 'p_std': 23, 'p_atr': 11, 'p_adx': 16, 'rsi_period': 48, 'ema1': 19, 'ema2': 16, 'slip_atr_k': 0.11796539539445272, 'slip_spread_k': 0.4158007912242715, 'spread_hl_frac': 0.017697801491329126, 'bb_std_mult': 2.3301312878853717, 'rsi_os': 38, 'rsi_ob': 77, 'vol_spike': 0.027126669352055356, 'adx_thresh': 20.523516503936804, 'atr_min_pct': 0.022588191450420923, 'atr_max_pct': 0.11100529431050919, 'tp_mult': 1.093699933998424, 'tsl_mult': 0.037790378366462166, 'strategy': 'breakout', 'time_stop': 177, 'use_sma': True, 'use_atr': True, 'use_adx': True, 'use_ema': True, 'use_spike': False, 'rsi_required': True, 'edge_k': 0.7293177440551226, 'edge_cap': 0.8644275268451898, 'bull_strategy': 'breakout', 'bull_bb_std_mult': 2.6595789781678896, 'bull_rsi_os': 7, 'bull_rsi_ob': 52, 'bull_adx_thresh': 18.111737730046062, 'bull_atr_min_pct': 0.008115635291230563, 'bull_atr_max_pct': 0.14680489171229105, 'bull_tp_mult': 1.6160146946603422, 'bull_tsl_mult': 0.19646185320636408, 'bull_time_stop': 295, 'bull_use_sma': True, 'bull_use_ema': True, 'bull_use_atr': True, 'bull_use_adx': False, 'bull_use_spike': True, 'bull_rsi_required': False, 'bear_strategy': 'mean_reversion', 'bear_bb_std_mult': 3.252774748451996, 'bear_rsi_os': 31, 'bear_rsi_ob': 72, 'bear_adx_thresh': 13.144187984730443, 'bear_atr_min_pct': 0.002743917248588216, 'bear_atr_max_pct': 0.12652951944256202, 'bear_tp_mult': 1.1383264070136299, 'bear_tsl_mult': 0.7088049930639049, 'bear_time_stop': 192, 'bear_use_sma': True, 'bear_use_ema': True, 'bear_use_atr': True, 'bear_use_adx': True, 'bear_use_spike': False, 'bear_rsi_required': True, 'sideways_strategy': 'breakout', 'sideways_bb_std_mult': 2.71853527867733, 'sideways_rsi_os': 30, 'sideways_rsi_ob': 65, 'sideways_adx_thresh': 26.113812596499628, 'sideways_atr_min_pct': 0.002313941254260924, 'sideways_atr_max_pct': 0.13233116252478674, 'sideways_tp_mult': 1.6254494032981786, 'sideways_tsl_mult': 0.9287071824282132, 'sideways_time_stop': 147, 'sideways_use_sma': False, 'sideways_use_ema': False, 'sideways_use_atr': False, 'sideways_use_adx': True, 'sideways_use_spike': False, 'sideways_rsi_required': True}.
[I 2025-08-31 12:48:56,152] Trial 438 finished with values: [-0.037093016373819565, 0.03676995833248541] and parameters: {'p_sma': 39, 'p_std': 22, 'p_atr': 21, 'p_adx': 16, 'rsi_period': 48, 'ema1': 21, 'ema2': 14, 'slip_atr_k': 0.17009591473243807, 'slip_spread_k': 0.4072949339937362, 'spread_hl_frac': 0.018207206617788484, 'bb_std_mult': 2.2959180945292794, 'rsi_os': 39, 'rsi_ob': 77, 'vol_spike': 0.024519460755881687, 'adx_thresh': 20.651007965633912, 'atr_min_pct': 0.01574790627792776, 'atr_max_pct': 0.11973209742722263, 'tp_mult': 2.1618323782186777, 'tsl_mult': 0.039889404385542976, 'strategy': 'breakout', 'time_stop': 171, 'use_sma': False, 'use_atr': True, 'use_adx': True, 'use_ema': True, 'use_spike': False, 'rsi_required': True, 'edge_k': 0.6865219059621858, 'edge_cap': 0.4928352962848016, 'bull_strategy': 'breakout', 'bull_bb_std_mult': 2.681272834188933, 'bull_rsi_os': 7, 'bull_rsi_ob': 51, 'bull_adx_thresh': 18.013086647273298, 'bull_atr_min_pct': 0.02047946629857426, 'bull_atr_max_pct': 0.14685839080485966, 'bull_tp_mult': 1.4440157477607205, 'bull_tsl_mult': 0.1974603606910168, 'bull_time_stop': 300, 'bull_use_sma': True, 'bull_use_ema': False, 'bull_use_atr': True, 'bull_use_adx': False, 'bull_use_spike': True, 'bull_rsi_required': False, 'bear_strategy': 'mean_reversion', 'bear_bb_std_mult': 3.249335985842985, 'bear_rsi_os': 20, 'bear_rsi_ob': 45, 'bear_adx_thresh': 12.769474099633896, 'bear_atr_min_pct': 0.0026075219537143885, 'bear_atr_max_pct': 0.1227439930022519, 'bear_tp_mult': 2.877423423681043, 'bear_tsl_mult': 0.714572152740861, 'bear_time_stop': 188, 'bear_use_sma': True, 'bear_use_ema': True, 'bear_use_atr': True, 'bear_use_adx': True, 'bear_use_spike': False, 'bear_rsi_required': True, 'sideways_strategy': 'breakout', 'sideways_bb_std_mult': 2.7320167271436575, 'sideways_rsi_os': 32, 'sideways_rsi_ob': 69, 'sideways_adx_thresh': 26.23184099928591, 'sideways_atr_min_pct': 0.0021813281165781176, 'sideways_atr_max_pct': 0.13138087518351968, 'sideways_tp_mult': 1.6405948928911294, 'sideways_tsl_mult': 0.9242388734139904, 'sideways_time_stop': 201, 'sideways_use_sma': False, 'sideways_use_ema': False, 'sideways_use_atr': False, 'sideways_use_adx': True, 'sideways_use_spike': False, 'sideways_rsi_required': True}.
[I 2025-08-31 12:48:56,500] Trial 435 finished with values: [-1000000000.0, 1000000000.0] and parameters: {'p_sma': 51, 'p_std': 25, 'p_atr': 19, 'p_adx': 16, 'rsi_period': 46, 'ema1': 21, 'ema2': 14, 'slip_atr_k': 0.2120951664106866, 'slip_spread_k': 0.4089948760973335, 'spread_hl_frac': 0.019321070856729263, 'bb_std_mult': 2.219923466966889, 'rsi_os': 51, 'rsi_ob': 78, 'vol_spike': 0.023203514294257262, 'adx_thresh': 18.982674625052816, 'atr_min_pct': 0.017836961106125346, 'atr_max_pct': 0.12713785430052346, 'tp_mult': 1.0902386496534993, 'tsl_mult': 0.04242213280100255, 'strategy': 'breakout', 'time_stop': 178, 'use_sma': False, 'use_atr': True, 'use_adx': False, 'use_ema': True, 'use_spike': False, 'rsi_required': True, 'edge_k': 0.6482722616159472, 'edge_cap': 0.8564819552538043, 'bull_strategy': 'mean_reversion', 'bull_bb_std_mult': 2.541471021049658, 'bull_rsi_os': 7, 'bull_rsi_ob': 52, 'bull_adx_thresh': 18.18532324461814, 'bull_atr_min_pct': 0.010778817834627568, 'bull_atr_max_pct': 0.14662141253087954, 'bull_tp_mult': 1.507561564886527, 'bull_tsl_mult': 0.2025678180744545, 'bull_time_stop': 288, 'bull_use_sma': False, 'bull_use_ema': False, 'bull_use_atr': False, 'bull_use_adx': False, 'bull_use_spike': False, 'bull_rsi_required': False, 'bear_strategy': 'mean_reversion', 'bear_bb_std_mult': 3.035934577527382, 'bear_rsi_os': 30, 'bear_rsi_ob': 82, 'bear_adx_thresh': 13.780174785349363, 'bear_atr_min_pct': 0.001579623310736766, 'bear_atr_max_pct': 0.13212130673845668, 'bear_tp_mult': 2.8946683479988766, 'bear_tsl_mult': 0.7438912713881323, 'bear_time_stop': 201, 'bear_use_sma': True, 'bear_use_ema': True, 'bear_use_atr': True, 'bear_use_adx': True, 'bear_use_spike': True, 'bear_rsi_required': True, 'sideways_strategy': 'breakout', 'sideways_bb_std_mult': 2.7138910008799746, 'sideways_rsi_os': 32, 'sideways_rsi_ob': 67, 'sideways_adx_thresh': 25.928091809417413, 'sideways_atr_min_pct': 0.01382209706739533, 'sideways_atr_max_pct': 0.10397472768775454, 'sideways_tp_mult': 1.5429010675292332, 'sideways_tsl_mult': 0.8571878053441547, 'sideways_time_stop': 214, 'sideways_use_sma': False, 'sideways_use_ema': False, 'sideways_use_atr': False, 'sideways_use_adx': False, 'sideways_use_spike': True, 'sideways_rsi_required': True}.
[I 2025-08-31 12:48:56,663] Trial 437 finished with values: [-1000000000.0, 1000000000.0] and parameters: {'p_sma': 53, 'p_std': 43, 'p_atr': 11, 'p_adx': 24, 'rsi_period': 48, 'ema1': 19, 'ema2': 14, 'slip_atr_k': 0.11603280888218352, 'slip_spread_k': 0.4102968179851737, 'spread_hl_frac': 0.01789238833514675, 'bb_std_mult': 2.331758298085519, 'rsi_os': 39, 'rsi_ob': 78, 'vol_spike': 0.029579735338114647, 'adx_thresh': 20.690913677003596, 'atr_min_pct': 0.021782489635662258, 'atr_max_pct': 0.10181069828097475, 'tp_mult': 2.7903462702253155, 'tsl_mult': 0.04011306923930316, 'strategy': 'breakout', 'time_stop': 176, 'use_sma': True, 'use_atr': True, 'use_adx': True, 'use_ema': True, 'use_spike': False, 'rsi_required': True, 'edge_k': 0.7378589395628101, 'edge_cap': 0.4011030488728103, 'bull_strategy': 'breakout', 'bull_bb_std_mult': 2.644198255502283, 'bull_rsi_os': 7, 'bull_rsi_ob': 52, 'bull_adx_thresh': 14.700739856735323, 'bull_atr_min_pct': 0.00845295536003688, 'bull_atr_max_pct': 0.14683701699749294, 'bull_tp_mult': 1.3606311574702044, 'bull_tsl_mult': 0.19557579926872848, 'bull_time_stop': 300, 'bull_use_sma': True, 'bull_use_ema': True, 'bull_use_atr': True, 'bull_use_adx': False, 'bull_use_spike': True, 'bull_rsi_required': False, 'bear_strategy': 'mean_reversion', 'bear_bb_std_mult': 3.2468454528375337, 'bear_rsi_os': 31, 'bear_rsi_ob': 72, 'bear_adx_thresh': 13.13693246857099, 'bear_atr_min_pct': 0.0027671396161824255, 'bear_atr_max_pct': 0.12359035566805451, 'bear_tp_mult': 1.1602106097865286, 'bear_tsl_mult': 0.705484423261665, 'bear_time_stop': 193, 'bear_use_sma': True, 'bear_use_ema': True, 'bear_use_atr': True, 'bear_use_adx': True, 'bear_use_spike': False, 'bear_rsi_required': True, 'sideways_strategy': 'breakout', 'sideways_bb_std_mult': 2.7265537679320313, 'sideways_rsi_os': 30, 'sideways_rsi_ob': 65, 'sideways_adx_thresh': 25.819104314809003, 'sideways_atr_min_pct': 0.0021623796707003415, 'sideways_atr_max_pct': 0.019120397221696436, 'sideways_tp_mult': 1.6707612533663903, 'sideways_tsl_mult': 0.940111069386485, 'sideways_time_stop': 213, 'sideways_use_sma': False, 'sideways_use_ema': False, 'sideways_use_atr': False, 'sideways_use_adx': True, 'sideways_use_spike': False, 'sideways_rsi_required': True}.
[I 2025-08-31 12:49:28,704] Trial 440 finished with values: [-1000000000.0, 1000000000.0] and parameters: {'p_sma': 8, 'p_std': 25, 'p_atr': 13, 'p_adx': 24, 'rsi_period': 44, 'ema1': 20, 'ema2': 44, 'slip_atr_k': 0.06900734528913458, 'slip_spread_k': 0.46306966856837134, 'spread_hl_frac': 0.019027548363337397, 'bb_std_mult': 2.3418341514663905, 'rsi_os': 28, 'rsi_ob': 80, 'vol_spike': 0.017461684588325307, 'adx_thresh': 18.937323971015587, 'atr_min_pct': 0.0018661042902701646, 'atr_max_pct': 0.1222355026288604, 'tp_mult': 2.7355165696301706, 'tsl_mult': 0.026085610178870483, 'strategy': 'breakout', 'time_stop': 168, 'use_sma': False, 'use_atr': True, 'use_adx': False, 'use_ema': True, 'use_spike': False, 'rsi_required': False, 'edge_k': 1.4672862645411409, 'edge_cap': 0.06391946540478066, 'bull_strategy': 'breakout', 'bull_bb_std_mult': 0.5109559002138031, 'bull_rsi_os': 6, 'bull_rsi_ob': 51, 'bull_adx_thresh': 20.11844194280586, 'bull_atr_min_pct': 0.020510695936163722, 'bull_atr_max_pct': 0.14100714068439535, 'bull_tp_mult': 1.3646318091086704, 'bull_tsl_mult': 0.477796119871221, 'bull_time_stop': 291, 'bull_use_sma': True, 'bull_use_ema': True, 'bull_use_atr': False, 'bull_use_adx': True, 'bull_use_spike': False, 'bull_rsi_required': False, 'bear_strategy': 'breakout', 'bear_bb_std_mult': 3.0423956838814967, 'bear_rsi_os': 30, 'bear_rsi_ob': 72, 'bear_adx_thresh': 14.02038929470066, 'bear_atr_min_pct': 0.0002664323369351695, 'bear_atr_max_pct': 0.14641051924338153, 'bear_tp_mult': 2.9962009112307055, 'bear_tsl_mult': 0.7368755347051842, 'bear_time_stop': 214, 'bear_use_sma': True, 'bear_use_ema': True, 'bear_use_atr': True, 'bear_use_adx': True, 'bear_use_spike': True, 'bear_rsi_required': False, 'sideways_strategy': 'breakout', 'sideways_bb_std_mult': 2.6647090111550145, 'sideways_rsi_os': 31, 'sideways_rsi_ob': 67, 'sideways_adx_thresh': 24.81753511523062, 'sideways_atr_min_pct': 0.026984850619771277, 'sideways_atr_max_pct': 0.12040972538404021, 'sideways_tp_mult': 1.5810096456897487, 'sideways_tsl_mult': 0.9062809266811026, 'sideways_time_stop': 216, 'sideways_use_sma': True, 'sideways_use_ema': False, 'sideways_use_atr': False, 'sideways_use_adx': False, 'sideways_use_spike': False, 'sideways_rsi_required': True}.
[I 2025-08-31 12:49:28,867] Trial 439 finished with values: [-0.10809502726097397, 0.10825050212644681] and parameters: {'p_sma': 9, 'p_std': 25, 'p_atr': 13, 'p_adx': 15, 'rsi_period': 49, 'ema1': 21, 'ema2': 14, 'slip_atr_k': 0.07096199278318108, 'slip_spread_k': 0.4114762131584007, 'spread_hl_frac': 0.018638444011541605, 'bb_std_mult': 2.3345592426058217, 'rsi_os': 39, 'rsi_ob': 78, 'vol_spike': 0.020364542492212732, 'adx_thresh': 18.918482314852003, 'atr_min_pct': 0.015678276457816664, 'atr_max_pct': 0.12120808846633999, 'tp_mult': 1.931371722908592, 'tsl_mult': 0.03723652871663341, 'strategy': 'breakout', 'time_stop': 168, 'use_sma': False, 'use_atr': True, 'use_adx': False, 'use_ema': True, 'use_spike': False, 'rsi_required': True, 'edge_k': 1.4341428670076384, 'edge_cap': 0.5684182226655146, 'bull_strategy': 'breakout', 'bull_bb_std_mult': 0.7778470375526745, 'bull_rsi_os': 7, 'bull_rsi_ob': 47, 'bull_adx_thresh': 20.232242663009597, 'bull_atr_min_pct': 0.020323269545184437, 'bull_atr_max_pct': 0.14703532095913, 'bull_tp_mult': 1.4346747766967005, 'bull_tsl_mult': 0.1746872401919052, 'bull_time_stop': 300, 'bull_use_sma': True, 'bull_use_ema': False, 'bull_use_atr': False, 'bull_use_adx': False, 'bull_use_spike': False, 'bull_rsi_required': False, 'bear_strategy': 'breakout', 'bear_bb_std_mult': 3.0582455946131706, 'bear_rsi_os': 49, 'bear_rsi_ob': 72, 'bear_adx_thresh': 14.010921955947035, 'bear_atr_min_pct': 0.00018849861257671163, 'bear_atr_max_pct': 0.1455611558605261, 'bear_tp_mult': 2.8798176953515044, 'bear_tsl_mult': 0.7395345528258295, 'bear_time_stop': 194, 'bear_use_sma': True, 'bear_use_ema': True, 'bear_use_atr': True, 'bear_use_adx': True, 'bear_use_spike': True, 'bear_rsi_required': True, 'sideways_strategy': 'breakout', 'sideways_bb_std_mult': 2.671602484384015, 'sideways_rsi_os': 32, 'sideways_rsi_ob': 69, 'sideways_adx_thresh': 26.08224910631909, 'sideways_atr_min_pct': 0.004625175347221231, 'sideways_atr_max_pct': 0.102822206432845, 'sideways_tp_mult': 1.6701820222153865, 'sideways_tsl_mult': 0.9051968393847525, 'sideways_time_stop': 188, 'sideways_use_sma': False, 'sideways_use_ema': False, 'sideways_use_atr': False, 'sideways_use_adx': False, 'sideways_use_spike': False, 'sideways_rsi_required': True}.
