[I 2025-08-31 12:30:02,262] Trial 290 finished with values: [-1000000000.0, 1000000000.0] and parameters: {'p_sma': 52, 'p_std': 27, 'p_atr': 26, 'p_adx': 9, 'rsi_period': 32, 'ema1': 5, 'ema2': 14, 'slip_atr_k': 0.013480284352967671, 'slip_spread_k': 0.6441515328402166, 'spread_hl_frac': 0.008447230393714932, 'bb_std_mult': 2.2758140215764877, 'rsi_os': 42, 'rsi_ob': 73, 'vol_spike': 0.106485349643545, 'adx_thresh': 18.699249391649868, 'atr_min_pct': 0.0010628800569292918, 'atr_max_pct': 0.14987595566973005, 'tp_mult': 1.1841668056210803, 'tsl_mult': 0.0015975431583917787, 'strategy': 'mean_reversion', 'time_stop': 225, 'use_sma': False, 'use_atr': True, 'use_adx': False, 'use_ema': True, 'use_spike': False, 'rsi_required': True, 'edge_k': 0.9512758228366074, 'edge_cap': 0.6836753502497032, 'bull_strategy': 'breakout', 'bull_bb_std_mult': 1.4606417634553406, 'bull_rsi_os': 51, 'bull_rsi_ob': 79, 'bull_adx_thresh': 20.606310943409213, 'bull_atr_min_pct': 0.021842954572445134, 'bull_atr_max_pct': 0.08369070996724007, 'bull_tp_mult': 1.2883138527132751, 'bull_tsl_mult': 0.810353482304725, 'bull_time_stop': 84, 'bull_use_sma': True, 'bull_use_ema': True, 'bull_use_atr': False, 'bull_use_adx': True, 'bull_use_spike': True, 'bull_rsi_required': False, 'bear_strategy': 'breakout', 'bear_bb_std_mult': 3.4811864371717074, 'bear_rsi_os': 30, 'bear_rsi_ob': 86, 'bear_adx_thresh': 9.66157096953629, 'bear_atr_min_pct': 0.012121800449626918, 'bear_atr_max_pct': 0.07107547991522861, 'bear_tp_mult': 2.824267671732202, 'bear_tsl_mult': 0.10273550974473125, 'bear_time_stop': 244, 'bear_use_sma': True, 'bear_use_ema': True, 'bear_use_atr': True, 'bear_use_adx': True, 'bear_use_spike': True, 'bear_rsi_required': True, 'sideways_strategy': 'mean_reversion', 'sideways_bb_std_mult': 3.3994911516130046, 'sideways_rsi_os': 34, 'sideways_rsi_ob': 84, 'sideways_adx_thresh': 31.414514222775093, 'sideways_atr_min_pct': 0.00099087730434857, 'sideways_atr_max_pct': 0.1239184100366416, 'sideways_tp_mult': 1.4781966392596597, 'sideways_tsl_mult': 0.6715928443725145, 'sideways_time_stop': 197, 'sideways_use_sma': True, 'sideways_use_ema': False, 'sideways_use_atr': False, 'sideways_use_adx': True, 'sideways_use_spike': False, 'sideways_rsi_required': True}.
[I 2025-08-31 12:30:02,580] Trial 288 finished with values: [-0.23740049778376016, 0.2372664008332282] and parameters: {'p_sma': 50, 'p_std': 30, 'p_atr': 13, 'p_adx': 22, 'rsi_period': 84, 'ema1': 13, 'ema2': 11, 'slip_atr_k': 0.0006298057771982023, 'slip_spread_k': 0.6746293950293518, 'spread_hl_frac': 0.013658324849882875, 'bb_std_mult': 2.1927628390220892, 'rsi_os': 40, 'rsi_ob': 73, 'vol_spike': 0.1043823439556969, 'adx_thresh': 20.96876562240172, 'atr_min_pct': 0.0009438906263460216, 'atr_max_pct': 0.12631147748587523, 'tp_mult': 2.663662621670224, 'tsl_mult': 0.0015912462330009963, 'strategy': 'mean_reversion', 'time_stop': 207, 'use_sma': False, 'use_atr': True, 'use_adx': False, 'use_ema': True, 'use_spike': False, 'rsi_required': True, 'edge_k': 0.9067064231575868, 'edge_cap': 0.8573251074258601, 'bull_strategy': 'breakout', 'bull_bb_std_mult': 2.9928129965004975, 'bull_rsi_os': 11, 'bull_rsi_ob': 79, 'bull_adx_thresh': 9.044406957117687, 'bull_atr_min_pct': 0.00010433895946723552, 'bull_atr_max_pct': 0.06248892061245927, 'bull_tp_mult': 2.503772667422683, 'bull_tsl_mult': 0.8789688620425677, 'bull_time_stop': 108, 'bull_use_sma': True, 'bull_use_ema': True, 'bull_use_atr': False, 'bull_use_adx': True, 'bull_use_spike': True, 'bull_rsi_required': False, 'bear_strategy': 'breakout', 'bear_bb_std_mult': 3.287983449482181, 'bear_rsi_os': 30, 'bear_rsi_ob': 68, 'bear_adx_thresh': 25.528011907627658, 'bear_atr_min_pct': 0.027109764934921964, 'bear_atr_max_pct': 0.0880693030164409, 'bear_tp_mult': 2.787549970378124, 'bear_tsl_mult': 0.14528161364297992, 'bear_time_stop': 242, 'bear_use_sma': True, 'bear_use_ema': True, 'bear_use_atr': True, 'bear_use_adx': True, 'bear_use_spike': True, 'bear_rsi_required': True, 'sideways_strategy': 'breakout', 'sideways_bb_std_mult': 3.394367897030347, 'sideways_rsi_os': 53, 'sideways_rsi_ob': 80, 'sideways_adx_thresh': 14.231721051383964, 'sideways_atr_min_pct': 0.0011172436287061021, 'sideways_atr_max_pct': 0.13689380676854435, 'sideways_tp_mult': 1.494419277439087, 'sideways_tsl_mult': 0.6438782351597516, 'sideways_time_stop': 22, 'sideways_use_sma': True, 'sideways_use_ema': False, 'sideways_use_atr': False, 'sideways_use_adx': True, 'sideways_use_spike': False, 'sideways_rsi_required': True}.
[I 2025-08-31 12:30:02,581] Trial 289 finished with values: [-1000000000.0, 1000000000.0] and parameters: {'p_sma': 41, 'p_std': 28, 'p_atr': 23, 'p_adx': 9, 'rsi_period': 77, 'ema1': 26, 'ema2': 20, 'slip_atr_k': 0.005031311672721462, 'slip_spread_k': 0.6746990159290209, 'spread_hl_frac': 0.029854747789888714, 'bb_std_mult': 2.253448964197461, 'rsi_os': 41, 'rsi_ob': 72, 'vol_spike': 0.10824845332437077, 'adx_thresh': 26.850738809875086, 'atr_min_pct': 0.0010434363322981248, 'atr_max_pct': 0.1368660881833382, 'tp_mult': 2.574665470033525, 'tsl_mult': 0.002760420534132545, 'strategy': 'mean_reversion', 'time_stop': 219, 'use_sma': False, 'use_atr': True, 'use_adx': False, 'use_ema': True, 'use_spike': False, 'rsi_required': True, 'edge_k': 0.7680108267290662, 'edge_cap': 0.6799899867586556, 'bull_strategy': 'breakout', 'bull_bb_std_mult': 2.75995310178315, 'bull_rsi_os': 6, 'bull_rsi_ob': 79, 'bull_adx_thresh': 6.684697376929142, 'bull_atr_min_pct': 0.021719350903010075, 'bull_atr_max_pct': 0.11973550654307491, 'bull_tp_mult': 2.5258042049086464, 'bull_tsl_mult': 0.8797934005869679, 'bull_time_stop': 83, 'bull_use_sma': True, 'bull_use_ema': True, 'bull_use_atr': False, 'bull_use_adx': True, 'bull_use_spike': True, 'bull_rsi_required': False, 'bear_strategy': 'breakout', 'bear_bb_std_mult': 3.2856131750549555, 'bear_rsi_os': 29, 'bear_rsi_ob': 74, 'bear_adx_thresh': 25.485133501055607, 'bear_atr_min_pct': 0.02657780103911424, 'bear_atr_max_pct': 0.05683980203677052, 'bear_tp_mult': 2.7982989990491256, 'bear_tsl_mult': 0.15744951088156361, 'bear_time_stop': 161, 'bear_use_sma': True, 'bear_use_ema': True, 'bear_use_atr': True, 'bear_use_adx': True, 'bear_use_spike': True, 'bear_rsi_required': True, 'sideways_strategy': 'breakout', 'sideways_bb_std_mult': 3.402134705170659, 'sideways_rsi_os': 34, 'sideways_rsi_ob': 93, 'sideways_adx_thresh': 12.048362180004585, 'sideways_atr_min_pct': 0.001262032150503108, 'sideways_atr_max_pct': 0.13735962155157422, 'sideways_tp_mult': 1.6757217480069095, 'sideways_tsl_mult': 0.6656339041920691, 'sideways_time_stop': 233, 'sideways_use_sma': True, 'sideways_use_ema': False, 'sideways_use_atr': False, 'sideways_use_adx': True, 'sideways_use_spike': False, 'sideways_rsi_required': True}.
[I 2025-08-31 12:30:02,581] Trial 291 finished with values: [-1000000000.0, 1000000000.0] and parameters: {'p_sma': 50, 'p_std': 28, 'p_atr': 20, 'p_adx': 25, 'rsi_period': 76, 'ema1': 29, 'ema2': 53, 'slip_atr_k': 0.014983724365094167, 'slip_spread_k': 0.6365619851898042, 'spread_hl_frac': 0.04234736935454521, 'bb_std_mult': 2.51474425437, 'rsi_os': 42, 'rsi_ob': 73, 'vol_spike': 0.09632386977404345, 'adx_thresh': 26.910574841061447, 'atr_min_pct': 0.0009573242603924554, 'atr_max_pct': 0.13790694413272667, 'tp_mult': 2.6588739236726817, 'tsl_mult': 0.001364995575117517, 'strategy': 'mean_reversion', 'time_stop': 225, 'use_sma': False, 'use_atr': True, 'use_adx': False, 'use_ema': True, 'use_spike': False, 'rsi_required': True, 'edge_k': 0.6919112934108553, 'edge_cap': 0.4820718661306545, 'bull_strategy': 'breakout', 'bull_bb_std_mult': 2.7659285084187832, 'bull_rsi_os': 53, 'bull_rsi_ob': 81, 'bull_adx_thresh': 25.777597318856966, 'bull_atr_min_pct': 0.02178032862634902, 'bull_atr_max_pct': 0.08634524615323366, 'bull_tp_mult': 1.1902931699361508, 'bull_tsl_mult': 0.7057637105287389, 'bull_time_stop': 85, 'bull_use_sma': True, 'bull_use_ema': True, 'bull_use_atr': False, 'bull_use_adx': True, 'bull_use_spike': True, 'bull_rsi_required': False, 'bear_strategy': 'breakout', 'bear_bb_std_mult': 3.52614184570619, 'bear_rsi_os': 31, 'bear_rsi_ob': 74, 'bear_adx_thresh': 16.893023244150477, 'bear_atr_min_pct': 0.02660203149341615, 'bear_atr_max_pct': 0.09243277467918631, 'bear_tp_mult': 2.7940930027091215, 'bear_tsl_mult': 0.9978339719086396, 'bear_time_stop': 62, 'bear_use_sma': True, 'bear_use_ema': True, 'bear_use_atr': True, 'bear_use_adx': True, 'bear_use_spike': True, 'bear_rsi_required': True, 'sideways_strategy': 'mean_reversion', 'sideways_bb_std_mult': 3.599252879933815, 'sideways_rsi_os': 34, 'sideways_rsi_ob': 82, 'sideways_adx_thresh': 12.146132419269765, 'sideways_atr_min_pct': 0.0007992517873754375, 'sideways_atr_max_pct': 0.11942249670418492, 'sideways_tp_mult': 2.7846189469782834, 'sideways_tsl_mult': 0.6253908684469183, 'sideways_time_stop': 233, 'sideways_use_sma': True, 'sideways_use_ema': False, 'sideways_use_atr': False, 'sideways_use_adx': True, 'sideways_use_spike': False, 'sideways_rsi_required': True}.
[I 2025-08-31 12:30:34,122] Trial 294 finished with values: [-1000000000.0, 1000000000.0] and parameters: {'p_sma': 48, 'p_std': 30, 'p_atr': 30, 'p_adx': 16, 'rsi_period': 16, 'ema1': 12, 'ema2': 18, 'slip_atr_k': 0.0394964874740196, 'slip_spread_k': 0.6075689422519903, 'spread_hl_frac': 0.0373308587819594, 'bb_std_mult': 1.5722800544912023, 'rsi_os': 15, 'rsi_ob': 83, 'vol_spike': 0.09182384254072005, 'adx_thresh': 21.77241571214441, 'atr_min_pct': 0.002447666962193063, 'atr_max_pct': 0.010043171302230314, 'tp_mult': 2.9794445166195063, 'tsl_mult': 0.2144275904637159, 'strategy': 'mean_reversion', 'time_stop': 50, 'use_sma': False, 'use_atr': True, 'use_adx': False, 'use_ema': False, 'use_spike': False, 'rsi_required': True, 'edge_k': 0.6211855810918641, 'edge_cap': 0.6544428142752017, 'bull_strategy': 'breakout', 'bull_bb_std_mult': 1.3494951830780686, 'bull_rsi_os': 21, 'bull_rsi_ob': 72, 'bull_adx_thresh': 7.612376794133066, 'bull_atr_min_pct': 0.0063144996402645145, 'bull_atr_max_pct': 0.11423094751882039, 'bull_tp_mult': 2.6203810891258525, 'bull_tsl_mult': 0.2619029336996936, 'bull_time_stop': 179, 'bull_use_sma': True, 'bull_use_ema': True, 'bull_use_atr': False, 'bull_use_adx': True, 'bull_use_spike': False, 'bull_rsi_required': False, 'bear_strategy': 'breakout', 'bear_bb_std_mult': 0.6312039532725526, 'bear_rsi_os': 43, 'bear_rsi_ob': 72, 'bear_adx_thresh': 22.108094515054436, 'bear_atr_min_pct': 0.012972512682463078, 'bear_atr_max_pct': 0.015128394032022735, 'bear_tp_mult': 2.832895702713258, 'bear_tsl_mult': 0.8014653872401314, 'bear_time_stop': 244, 'bear_use_sma': True, 'bear_use_ema': True, 'bear_use_atr': True, 'bear_use_adx': True, 'bear_use_spike': False, 'bear_rsi_required': True, 'sideways_strategy': 'breakout', 'sideways_bb_std_mult': 3.5979664658868664, 'sideways_rsi_os': 30, 'sideways_rsi_ob': 89, 'sideways_adx_thresh': 18.387535369497066, 'sideways_atr_min_pct': 0.02003152527364385, 'sideways_atr_max_pct': 0.10531316823069449, 'sideways_tp_mult': 2.6863365708517963, 'sideways_tsl_mult': 0.5653365581914879, 'sideways_time_stop': 197, 'sideways_use_sma': True, 'sideways_use_ema': False, 'sideways_use_atr': False, 'sideways_use_adx': False, 'sideways_use_spike': False, 'sideways_rsi_required': True}.
[I 2025-08-31 12:30:34,153] Trial 295 finished with values: [-1000000000.0, 1000000000.0] and parameters: {'p_sma': 45, 'p_std': 25, 'p_atr': 18, 'p_adx': 16, 'rsi_period': 78, 'ema1': 22, 'ema2': 18, 'slip_atr_k': 0.053075073454961416, 'slip_spread_k': 0.61093215617585, 'spread_hl_frac': 0.03711760714032181, 'bb_std_mult': 1.5713403939547492, 'rsi_os': 15, 'rsi_ob': 79, 'vol_spike': 0.14888231481887226, 'adx_thresh': 14.148231410465698, 'atr_min_pct': 0.0023219366045416456, 'atr_max_pct': 0.13192016427893888, 'tp_mult': 1.3841636227347252, 'tsl_mult': 0.02891842779159922, 'strategy': 'mean_reversion', 'time_stop': 214, 'use_sma': False, 'use_atr': True, 'use_adx': False, 'use_ema': False, 'use_spike': False, 'rsi_required': True, 'edge_k': 0.7109336972118919, 'edge_cap': 0.6579859873629157, 'bull_strategy': 'breakout', 'bull_bb_std_mult': 2.867647090952142, 'bull_rsi_os': 30, 'bull_rsi_ob': 70, 'bull_adx_thresh': 7.685386036771257, 'bull_atr_min_pct': 0.022671014140571724, 'bull_atr_max_pct': 0.14222729137512286, 'bull_tp_mult': 2.643463864302188, 'bull_tsl_mult': 0.27199593804557576, 'bull_time_stop': 283, 'bull_use_sma': True, 'bull_use_ema': True, 'bull_use_atr': False, 'bull_use_adx': True, 'bull_use_spike': False, 'bull_rsi_required': False, 'bear_strategy': 'breakout', 'bear_bb_std_mult': 2.453802597887961, 'bear_rsi_os': 36, 'bear_rsi_ob': 70, 'bear_adx_thresh': 28.58931232406693, 'bear_atr_min_pct': 0.027891239363452332, 'bear_atr_max_pct': 0.13767792062407985, 'bear_tp_mult': 2.7516803612903296, 'bear_tsl_mult': 0.6637028959388032, 'bear_time_stop': 9, 'bear_use_sma': True, 'bear_use_ema': True, 'bear_use_atr': True, 'bear_use_adx': True, 'bear_use_spike': False, 'bear_rsi_required': True, 'sideways_strategy': 'breakout', 'sideways_bb_std_mult': 3.59561405310451, 'sideways_rsi_os': 31, 'sideways_rsi_ob': 89, 'sideways_adx_thresh': 18.22062510640775, 'sideways_atr_min_pct': 0.0004883578802544009, 'sideways_atr_max_pct': 0.12544748585788457, 'sideways_tp_mult': 1.3945284102450448, 'sideways_tsl_mult': 0.14305061801392116, 'sideways_time_stop': 11, 'sideways_use_sma': True, 'sideways_use_ema': False, 'sideways_use_atr': False, 'sideways_use_adx': False, 'sideways_use_spike': False, 'sideways_rsi_required': True}.
[I 2025-08-31 12:30:34,432] Trial 293 finished with values: [-0.1742314485071773, 0.17404432530705774] and parameters: {'p_sma': 48, 'p_std': 27, 'p_atr': 30, 'p_adx': 16, 'rsi_period': 16, 'ema1': 19, 'ema2': 18, 'slip_atr_k': 0.0406628352153504, 'slip_spread_k': 0.6196585058677964, 'spread_hl_frac': 0.0008696621437634007, 'bb_std_mult': 1.829869489898454, 'rsi_os': 6, 'rsi_ob': 83, 'vol_spike': 0.09007153549505588, 'adx_thresh': 21.86934759623679, 'atr_min_pct': 0.002476685329407579, 'atr_max_pct': 0.13107074105777894, 'tp_mult': 2.980802597375546, 'tsl_mult': 0.0289969332213503, 'strategy': 'mean_reversion', 'time_stop': 201, 'use_sma': False, 'use_atr': True, 'use_adx': False, 'use_ema': False, 'use_spike': False, 'rsi_required': True, 'edge_k': 0.8284575260027258, 'edge_cap': 0.7527329337614872, 'bull_strategy': 'breakout', 'bull_bb_std_mult': 1.2789751430308443, 'bull_rsi_os': 31, 'bull_rsi_ob': 70, 'bull_adx_thresh': 7.680873251350366, 'bull_atr_min_pct': 0.005976112501645389, 'bull_atr_max_pct': 0.122755885690279, 'bull_tp_mult': 1.841748109710569, 'bull_tsl_mult': 0.2699191425011058, 'bull_time_stop': 291, 'bull_use_sma': True, 'bull_use_ema': True, 'bull_use_atr': False, 'bull_use_adx': True, 'bull_use_spike': False, 'bull_rsi_required': False, 'bear_strategy': 'breakout', 'bear_bb_std_mult': 2.236092868936631, 'bear_rsi_os': 51, 'bear_rsi_ob': 72, 'bear_adx_thresh': 31.751414100697254, 'bear_atr_min_pct': 0.027959166434674963, 'bear_atr_max_pct': 0.09376206335320374, 'bear_tp_mult': 2.8335399372430707, 'bear_tsl_mult': 0.5481741092080581, 'bear_time_stop': 244, 'bear_use_sma': True, 'bear_use_ema': True, 'bear_use_atr': True, 'bear_use_adx': True, 'bear_use_spike': False, 'bear_rsi_required': True, 'sideways_strategy': 'breakout', 'sideways_bb_std_mult': 3.5952495572113614, 'sideways_rsi_os': 30, 'sideways_rsi_ob': 90, 'sideways_adx_thresh': 15.971460974744137, 'sideways_atr_min_pct': 0.00046314913165429363, 'sideways_atr_max_pct': 0.14806508462740883, 'sideways_tp_mult': 1.4092617056949865, 'sideways_tsl_mult': 0.6140883035794849, 'sideways_time_stop': 118, 'sideways_use_sma': True, 'sideways_use_ema': False, 'sideways_use_atr': False, 'sideways_use_adx': False, 'sideways_use_spike': False, 'sideways_rsi_required': True}.
[I 2025-08-31 12:30:34,647] Trial 292 finished with values: [-0.017677436127674806, 0.017890351378442155] and parameters: {'p_sma': 50, 'p_std': 28, 'p_atr': 18, 'p_adx': 25, 'rsi_period': 16, 'ema1': 29, 'ema2': 23, 'slip_atr_k': 0.005353125386817328, 'slip_spread_k': 0.6844310181451178, 'spread_hl_frac': 0.011718322617368751, 'bb_std_mult': 1.8327116090855917, 'rsi_os': 40, 'rsi_ob': 73, 'vol_spike': 0.0940043303969673, 'adx_thresh': 20.841889721965476, 'atr_min_pct': 0.0008925334412910563, 'atr_max_pct': 0.13125114557078657, 'tp_mult': 2.6456586700350133, 'tsl_mult': 0.026211347508538013, 'strategy': 'mean_reversion', 'time_stop': 215, 'use_sma': False, 'use_atr': True, 'use_adx': False, 'use_ema': True, 'use_spike': False, 'rsi_required': True, 'edge_k': 0.7036659298529475, 'edge_cap': 0.9459155403461821, 'bull_strategy': 'breakout', 'bull_bb_std_mult': 2.8671222835450654, 'bull_rsi_os': 21, 'bull_rsi_ob': 50, 'bull_adx_thresh': 33.488979947688804, 'bull_atr_min_pct': 0.0017036556935358296, 'bull_atr_max_pct': 0.12170494363196138, 'bull_tp_mult': 2.5352328315513923, 'bull_tsl_mult': 0.2691150272091789, 'bull_time_stop': 139, 'bull_use_sma': True, 'bull_use_ema': True, 'bull_use_atr': False, 'bull_use_adx': True, 'bull_use_spike': True, 'bull_rsi_required': False, 'bear_strategy': 'breakout', 'bear_bb_std_mult': 2.3505913697926943, 'bear_rsi_os': 36, 'bear_rsi_ob': 74, 'bear_adx_thresh': 31.879729317542953, 'bear_atr_min_pct': 0.027853332549355996, 'bear_atr_max_pct': 0.08119946441047315, 'bear_tp_mult': 2.7835102861327132, 'bear_tsl_mult': 0.17976070882018336, 'bear_time_stop': 142, 'bear_use_sma': True, 'bear_use_ema': True, 'bear_use_atr': True, 'bear_use_adx': True, 'bear_use_spike': True, 'bear_rsi_required': True, 'sideways_strategy': 'breakout', 'sideways_bb_std_mult': 3.593182184564105, 'sideways_rsi_os': 11, 'sideways_rsi_ob': 89, 'sideways_adx_thresh': 11.656572071472082, 'sideways_atr_min_pct': 0.0005878102030442555, 'sideways_atr_max_pct': 0.11761484718797116, 'sideways_tp_mult': 2.6468044294390842, 'sideways_tsl_mult': 0.6284667291416055, 'sideways_time_stop': 18, 'sideways_use_sma': True, 'sideways_use_ema': False, 'sideways_use_atr': False, 'sideways_use_adx': True, 'sideways_use_spike': False, 'sideways_rsi_required': True}.
[I 2025-08-31 12:30:35,199] Trial 296 finished with values: [-1000000000.0, 1000000000.0] and parameters: {'p_sma': 54, 'p_std': 29, 'p_atr': 12, 'p_adx': 27, 'rsi_period': 38, 'ema1': 18, 'ema2': 12, 'slip_atr_k': 0.1687486068562601, 'slip_spread_k': 0.6912218691569529, 'spread_hl_frac': 0.01131947160533637, 'bb_std_mult': 2.389683853131451, 'rsi_os': 6, 'rsi_ob': 50, 'vol_spike': 0.12417757808580698, 'adx_thresh': 19.488579329241183, 'atr_min_pct': 0.0016271738255750068, 'atr_max_pct': 0.14340698083229933, 'tp_mult': 2.733527338759089, 'tsl_mult': 0.04645442913515993, 'strategy': 'mean_reversion', 'time_stop': 201, 'use_sma': False, 'use_atr': True, 'use_adx': False, 'use_ema': False, 'use_spike': False, 'rsi_required': True, 'edge_k': 0.5268700333275191, 'edge_cap': 0.7491572736960233, 'bull_strategy': 'breakout', 'bull_bb_std_mult': 0.5801750810531028, 'bull_rsi_os': 19, 'bull_rsi_ob': 82, 'bull_adx_thresh': 29.590012433009804, 'bull_atr_min_pct': 0.018968344847914057, 'bull_atr_max_pct': 0.09997829928244456, 'bull_tp_mult': 1.8629981967029527, 'bull_tsl_mult': 0.23191179255063388, 'bull_time_stop': 91, 'bull_use_sma': True, 'bull_use_ema': True, 'bull_use_atr': False, 'bull_use_adx': False, 'bull_use_spike': False, 'bull_rsi_required': False, 'bear_strategy': 'breakout', 'bear_bb_std_mult': 3.1770444396969615, 'bear_rsi_os': 31, 'bear_rsi_ob': 72, 'bear_adx_thresh': 32.22345739003835, 'bear_atr_min_pct': 0.01654904068427509, 'bear_atr_max_pct': 0.01886526189484388, 'bear_tp_mult': 2.948448694120125, 'bear_tsl_mult': 0.5201247083744333, 'bear_time_stop': 248, 'bear_use_sma': True, 'bear_use_ema': True, 'bear_use_atr': True, 'bear_use_adx': True, 'bear_use_spike': True, 'bear_rsi_required': True, 'sideways_strategy': 'mean_reversion', 'sideways_bb_std_mult': 3.451443639475288, 'sideways_rsi_os': 37, 'sideways_rsi_ob': 74, 'sideways_adx_thresh': 23.056000799770004, 'sideways_atr_min_pct': 0.007936019030393912, 'sideways_atr_max_pct': 0.14893826656982248, 'sideways_tp_mult': 1.4123707609061986, 'sideways_tsl_mult': 0.6158159749150233, 'sideways_time_stop': 108, 'sideways_use_sma': True, 'sideways_use_ema': False, 'sideways_use_atr': False, 'sideways_use_adx': False, 'sideways_use_spike': True, 'sideways_rsi_required': False}.
