[I 2025-08-31 13:18:34,692] Trial 647 finished with values: [-1000000000.0, 1000000000.0] and parameters: {'p_sma': 26, 'p_std': 19, 'p_atr': 16, 'p_adx': 13, 'rsi_period': 43, 'ema1': 9, 'ema2': 20, 'slip_atr_k': 0.03997761211422246, 'slip_spread_k': 0.3532430164063022, 'spread_hl_frac': 0.019993472727832088, 'bb_std_mult': 2.470585801064905, 'rsi_os': 38, 'rsi_ob': 93, 'vol_spike': 0.010148764048204407, 'adx_thresh': 8.845966793115823, 'atr_min_pct': 0.0262617129880968, 'atr_max_pct': 0.05121412568106396, 'tp_mult': 2.5050245796568835, 'tsl_mult': 0.8107503443071054, 'strategy': 'breakout', 'time_stop': 162, 'use_sma': False, 'use_atr': False, 'use_adx': True, 'use_ema': True, 'use_spike': True, 'rsi_required': False, 'edge_k': 0.5065672508602139, 'edge_cap': 0.6629335124980172, 'bull_strategy': 'mean_reversion', 'bull_bb_std_mult': 2.940291982067348, 'bull_rsi_os': 5, 'bull_rsi_ob': 84, 'bull_adx_thresh': 18.91342702347679, 'bull_atr_min_pct': 0.022071090863101654, 'bull_atr_max_pct': 0.1310257976039385, 'bull_tp_mult': 2.208914152442798, 'bull_tsl_mult': 0.28690887638400375, 'bull_time_stop': 172, 'bull_use_sma': True, 'bull_use_ema': True, 'bull_use_atr': True, 'bull_use_adx': True, 'bull_use_spike': True, 'bull_rsi_required': True, 'bear_strategy': 'breakout', 'bear_bb_std_mult': 3.5893692603229534, 'bear_rsi_os': 28, 'bear_rsi_ob': 70, 'bear_adx_thresh': 17.708849919830364, 'bear_atr_min_pct': 0.0003568595478276078, 'bear_atr_max_pct': 0.12028786198764944, 'bear_tp_mult': 1.24558710106178, 'bear_tsl_mult': 0.6567174746317286, 'bear_time_stop': 184, 'bear_use_sma': False, 'bear_use_ema': True, 'bear_use_atr': False, 'bear_use_adx': False, 'bear_use_spike': True, 'bear_rsi_required': True, 'sideways_strategy': 'breakout', 'sideways_bb_std_mult': 2.8418146155313115, 'sideways_rsi_os': 28, 'sideways_rsi_ob': 64, 'sideways_adx_thresh': 23.667699761253807, 'sideways_atr_min_pct': 0.004281207311385484, 'sideways_atr_max_pct': 0.14794917448291378, 'sideways_tp_mult': 1.7773031859088646, 'sideways_tsl_mult': 0.813771854972809, 'sideways_time_stop': 51, 'sideways_use_sma': False, 'sideways_use_ema': False, 'sideways_use_atr': True, 'sideways_use_adx': True, 'sideways_use_spike': False, 'sideways_rsi_required': True}.
[I 2025-08-31 13:18:34,971] Trial 646 finished with values: [-1000000000.0, 1000000000.0] and parameters: {'p_sma': 26, 'p_std': 19, 'p_atr': 16, 'p_adx': 13, 'rsi_period': 45, 'ema1': 9, 'ema2': 20, 'slip_atr_k': 0.03897633320691922, 'slip_spread_k': 0.3568424274266838, 'spread_hl_frac': 0.020699645397703116, 'bb_std_mult': 2.455494593555417, 'rsi_os': 38, 'rsi_ob': 91, 'vol_spike': 0.004749790620760032, 'adx_thresh': 7.674274028996022, 'atr_min_pct': 0.02586108680749107, 'atr_max_pct': 0.04981348825424462, 'tp_mult': 2.487730342965099, 'tsl_mult': 0.7910080546753708, 'strategy': 'breakout', 'time_stop': 160, 'use_sma': False, 'use_atr': False, 'use_adx': True, 'use_ema': True, 'use_spike': True, 'rsi_required': False, 'edge_k': 0.5438444336119723, 'edge_cap': 0.6580411139925372, 'bull_strategy': 'mean_reversion', 'bull_bb_std_mult': 2.903105919373463, 'bull_rsi_os': 5, 'bull_rsi_ob': 85, 'bull_adx_thresh': 18.919776108168588, 'bull_atr_min_pct': 0.022311715589232225, 'bull_atr_max_pct': 0.13054750785030445, 'bull_tp_mult': 2.2751302241563094, 'bull_tsl_mult': 0.29244851048435716, 'bull_time_stop': 176, 'bull_use_sma': True, 'bull_use_ema': True, 'bull_use_atr': True, 'bull_use_adx': True, 'bull_use_spike': True, 'bull_rsi_required': True, 'bear_strategy': 'breakout', 'bear_bb_std_mult': 3.585089399943057, 'bear_rsi_os': 29, 'bear_rsi_ob': 70, 'bear_adx_thresh': 20.45409656669429, 'bear_atr_min_pct': 0.0003184109136300584, 'bear_atr_max_pct': 0.12345154188980817, 'bear_tp_mult': 1.216602117781016, 'bear_tsl_mult': 0.6491670452345862, 'bear_time_stop': 185, 'bear_use_sma': False, 'bear_use_ema': True, 'bear_use_atr': False, 'bear_use_adx': False, 'bear_use_spike': True, 'bear_rsi_required': True, 'sideways_strategy': 'breakout', 'sideways_bb_std_mult': 2.840373048783313, 'sideways_rsi_os': 28, 'sideways_rsi_ob': 64, 'sideways_adx_thresh': 23.85376507908949, 'sideways_atr_min_pct': 0.0047990284258068484, 'sideways_atr_max_pct': 0.14857393305972097, 'sideways_tp_mult': 1.767961606739686, 'sideways_tsl_mult': 0.8284557800590576, 'sideways_time_stop': 54, 'sideways_use_sma': False, 'sideways_use_ema': False, 'sideways_use_atr': True, 'sideways_use_adx': True, 'sideways_use_spike': False, 'sideways_rsi_required': True}.
[I 2025-08-31 13:19:09,239] Trial 652 finished with values: [-1000000000.0, 1000000000.0] and parameters: {'p_sma': 27, 'p_std': 21, 'p_atr': 17, 'p_adx': 12, 'rsi_period': 47, 'ema1': 11, 'ema2': 21, 'slip_atr_k': 0.04191857287336773, 'slip_spread_k': 0.31346574983300435, 'spread_hl_frac': 0.01946446765904816, 'bb_std_mult': 2.3374676105029977, 'rsi_os': 37, 'rsi_ob': 87, 'vol_spike': 0.00493281121926672, 'adx_thresh': 7.952165912147251, 'atr_min_pct': 0.029477828108478873, 'atr_max_pct': 0.04520496091364971, 'tp_mult': 2.51092472820185, 'tsl_mult': 0.8745341039493539, 'strategy': 'breakout', 'time_stop': 174, 'use_sma': False, 'use_atr': False, 'use_adx': True, 'use_ema': True, 'use_spike': True, 'rsi_required': False, 'edge_k': 0.5398669074625508, 'edge_cap': 0.6669881543777809, 'bull_strategy': 'mean_reversion', 'bull_bb_std_mult': 2.857921778851328, 'bull_rsi_os': 5, 'bull_rsi_ob': 86, 'bull_adx_thresh': 18.5786501177344, 'bull_atr_min_pct': 0.022731775675703864, 'bull_atr_max_pct': 0.1269320284309327, 'bull_tp_mult': 2.3730971891590635, 'bull_tsl_mult': 0.2741713967913859, 'bull_time_stop': 193, 'bull_use_sma': True, 'bull_use_ema': False, 'bull_use_atr': True, 'bull_use_adx': True, 'bull_use_spike': True, 'bull_rsi_required': True, 'bear_strategy': 'breakout', 'bear_bb_std_mult': 3.3917783005215325, 'bear_rsi_os': 29, 'bear_rsi_ob': 73, 'bear_adx_thresh': 19.03273964873259, 'bear_atr_min_pct': 0.000768099867611572, 'bear_atr_max_pct': 0.12597899351275121, 'bear_tp_mult': 1.3099416471927743, 'bear_tsl_mult': 0.6875682407814346, 'bear_time_stop': 195, 'bear_use_sma': False, 'bear_use_ema': True, 'bear_use_atr': False, 'bear_use_adx': False, 'bear_use_spike': True, 'bear_rsi_required': True, 'sideways_strategy': 'breakout', 'sideways_bb_std_mult': 2.791377113877985, 'sideways_rsi_os': 29, 'sideways_rsi_ob': 64, 'sideways_adx_thresh': 24.470350662439305, 'sideways_atr_min_pct': 0.004671413225741416, 'sideways_atr_max_pct': 0.14609142527051514, 'sideways_tp_mult': 1.7458152666665148, 'sideways_tsl_mult': 0.7225778527094395, 'sideways_time_stop': 30, 'sideways_use_sma': False, 'sideways_use_ema': False, 'sideways_use_atr': True, 'sideways_use_adx': True, 'sideways_use_spike': False, 'sideways_rsi_required': True}.
[I 2025-08-31 13:19:09,386] Trial 651 finished with values: [-1000000000.0, 1000000000.0] and parameters: {'p_sma': 20, 'p_std': 21, 'p_atr': 17, 'p_adx': 13, 'rsi_period': 43, 'ema1': 9, 'ema2': 21, 'slip_atr_k': 0.040962520529014695, 'slip_spread_k': 0.36178143323256295, 'spread_hl_frac': 0.020162441599504963, 'bb_std_mult': 2.460733045332014, 'rsi_os': 35, 'rsi_ob': 88, 'vol_spike': 0.006128581860131516, 'adx_thresh': 8.410389002612217, 'atr_min_pct': 0.0294403535321271, 'atr_max_pct': 0.04297047027155552, 'tp_mult': 2.527325883101965, 'tsl_mult': 0.7359181038773646, 'strategy': 'breakout', 'time_stop': 167, 'use_sma': False, 'use_atr': False, 'use_adx': True, 'use_ema': True, 'use_spike': True, 'rsi_required': False, 'edge_k': 0.5499861717833492, 'edge_cap': 0.6671376095327424, 'bull_strategy': 'mean_reversion', 'bull_bb_std_mult': 2.9363019885240407, 'bull_rsi_os': 5, 'bull_rsi_ob': 86, 'bull_adx_thresh': 18.846630243440465, 'bull_atr_min_pct': 0.021811566907601075, 'bull_atr_max_pct': 0.12796469187529552, 'bull_tp_mult': 2.0478792051020394, 'bull_tsl_mult': 0.3152420643208869, 'bull_time_stop': 195, 'bull_use_sma': True, 'bull_use_ema': True, 'bull_use_atr': True, 'bull_use_adx': True, 'bull_use_spike': True, 'bull_rsi_required': True, 'bear_strategy': 'breakout', 'bear_bb_std_mult': 3.4304906214699744, 'bear_rsi_os': 29, 'bear_rsi_ob': 73, 'bear_adx_thresh': 17.79002113621429, 'bear_atr_min_pct': 0.0006295899240580968, 'bear_atr_max_pct': 0.12014963393480965, 'bear_tp_mult': 1.0740520845380273, 'bear_tsl_mult': 0.6839253854017494, 'bear_time_stop': 187, 'bear_use_sma': False, 'bear_use_ema': True, 'bear_use_atr': False, 'bear_use_adx': False, 'bear_use_spike': True, 'bear_rsi_required': True, 'sideways_strategy': 'breakout', 'sideways_bb_std_mult': 2.7951137748927617, 'sideways_rsi_os': 29, 'sideways_rsi_ob': 64, 'sideways_adx_thresh': 23.4828374462423, 'sideways_atr_min_pct': 0.004852236839706211, 'sideways_atr_max_pct': 0.14456670867968513, 'sideways_tp_mult': 1.7715123164315076, 'sideways_tsl_mult': 0.15698920231832902, 'sideways_time_stop': 31, 'sideways_use_sma': False, 'sideways_use_ema': False, 'sideways_use_atr': True, 'sideways_use_adx': True, 'sideways_use_spike': False, 'sideways_rsi_required': True}.
[I 2025-08-31 13:19:09,537] Trial 650 finished with values: [-1000000000.0, 1000000000.0] and parameters: {'p_sma': 21, 'p_std': 21, 'p_atr': 16, 'p_adx': 13, 'rsi_period': 43, 'ema1': 11, 'ema2': 20, 'slip_atr_k': 0.039835386768432915, 'slip_spread_k': 0.39434968031873324, 'spread_hl_frac': 0.02000671357792325, 'bb_std_mult': 2.3974648460211196, 'rsi_os': 35, 'rsi_ob': 88, 'vol_spike': 0.009891571784047594, 'adx_thresh': 9.095645571214824, 'atr_min_pct': 0.0293656309862608, 'atr_max_pct': 0.04352553282510791, 'tp_mult': 2.5271258051877608, 'tsl_mult': 0.68457547754, 'strategy': 'breakout', 'time_stop': 167, 'use_sma': False, 'use_atr': False, 'use_adx': True, 'use_ema': True, 'use_spike': True, 'rsi_required': False, 'edge_k': 0.5412707629421093, 'edge_cap': 0.6726141095294772, 'bull_strategy': 'mean_reversion', 'bull_bb_std_mult': 2.904539741289935, 'bull_rsi_os': 5, 'bull_rsi_ob': 86, 'bull_adx_thresh': 18.507349991801092, 'bull_atr_min_pct': 0.02206800856610138, 'bull_atr_max_pct': 0.1270074646860019, 'bull_tp_mult': 2.361740559017116, 'bull_tsl_mult': 0.2995470652978879, 'bull_time_stop': 194, 'bull_use_sma': True, 'bull_use_ema': True, 'bull_use_atr': True, 'bull_use_adx': True, 'bull_use_spike': True, 'bull_rsi_required': True, 'bear_strategy': 'breakout', 'bear_bb_std_mult': 3.590789312084448, 'bear_rsi_os': 29, 'bear_rsi_ob': 73, 'bear_adx_thresh': 17.77759805891579, 'bear_atr_min_pct': 0.0006705362942771065, 'bear_atr_max_pct': 0.12534545270020872, 'bear_tp_mult': 1.2754612220070407, 'bear_tsl_mult': 0.6810358935543728, 'bear_time_stop': 196, 'bear_use_sma': False, 'bear_use_ema': True, 'bear_use_atr': False, 'bear_use_adx': False, 'bear_use_spike': True, 'bear_rsi_required': True, 'sideways_strategy': 'breakout', 'sideways_bb_std_mult': 2.7998468419956133, 'sideways_rsi_os': 29, 'sideways_rsi_ob': 64, 'sideways_adx_thresh': 24.04974049372773, 'sideways_atr_min_pct': 0.004651123038710353, 'sideways_atr_max_pct': 0.1499147529600625, 'sideways_tp_mult': 1.752904073404889, 'sideways_tsl_mult': 0.8592848170138317, 'sideways_time_stop': 31, 'sideways_use_sma': False, 'sideways_use_ema': False, 'sideways_use_atr': True, 'sideways_use_adx': True, 'sideways_use_spike': False, 'sideways_rsi_required': True}.
[I 2025-08-31 13:19:09,846] Trial 653 finished with values: [-1000000000.0, 1000000000.0] and parameters: {'p_sma': 20, 'p_std': 21, 'p_atr': 15, 'p_adx': 12, 'rsi_period': 47, 'ema1': 15, 'ema2': 21, 'slip_atr_k': 0.04200882050294833, 'slip_spread_k': 0.3959808296277521, 'spread_hl_frac': 0.019029310526041204, 'bb_std_mult': 2.3772170626502205, 'rsi_os': 39, 'rsi_ob': 88, 'vol_spike': 0.010462676421538466, 'adx_thresh': 8.320568781146589, 'atr_min_pct': 0.025141895521221366, 'atr_max_pct': 0.04380736591084598, 'tp_mult': 2.4424852092456657, 'tsl_mult': 0.8313420668552198, 'strategy': 'breakout', 'time_stop': 168, 'use_sma': False, 'use_atr': False, 'use_adx': True, 'use_ema': False, 'use_spike': True, 'rsi_required': False, 'edge_k': 0.5571081126308728, 'edge_cap': 0.6348960061714677, 'bull_strategy': 'mean_reversion', 'bull_bb_std_mult': 2.8896143653319353, 'bull_rsi_os': 5, 'bull_rsi_ob': 86, 'bull_adx_thresh': 18.56607645820657, 'bull_atr_min_pct': 0.022739868903276277, 'bull_atr_max_pct': 0.1281045721613197, 'bull_tp_mult': 2.3826770027443813, 'bull_tsl_mult': 0.2707707867919736, 'bull_time_stop': 191, 'bull_use_sma': True, 'bull_use_ema': False, 'bull_use_atr': True, 'bull_use_adx': True, 'bull_use_spike': True, 'bull_rsi_required': True, 'bear_strategy': 'breakout', 'bear_bb_std_mult': 3.463378168498017, 'bear_rsi_os': 29, 'bear_rsi_ob': 56, 'bear_adx_thresh': 19.078712573901317, 'bear_atr_min_pct': 0.0008611317912543205, 'bear_atr_max_pct': 0.1260234808293273, 'bear_tp_mult': 1.0606744931011352, 'bear_tsl_mult': 0.6866326647677542, 'bear_time_stop': 195, 'bear_use_sma': False, 'bear_use_ema': True, 'bear_use_atr': False, 'bear_use_adx': False, 'bear_use_spike': True, 'bear_rsi_required': True, 'sideways_strategy': 'breakout', 'sideways_bb_std_mult': 2.781897040783452, 'sideways_rsi_os': 29, 'sideways_rsi_ob': 64, 'sideways_adx_thresh': 24.40886167813621, 'sideways_atr_min_pct': 0.004279038798692, 'sideways_atr_max_pct': 0.143913675186725, 'sideways_tp_mult': 1.7385815630223709, 'sideways_tsl_mult': 0.8540548776035084, 'sideways_time_stop': 30, 'sideways_use_sma': False, 'sideways_use_ema': True, 'sideways_use_atr': True, 'sideways_use_adx': True, 'sideways_use_spike': False, 'sideways_rsi_required': True}.
[I 2025-08-31 13:19:43,588] Trial 657 finished with values: [-1000000000.0, 1000000000.0] and parameters: {'p_sma': 40, 'p_std': 20, 'p_atr': 17, 'p_adx': 13, 'rsi_period': 48, 'ema1': 14, 'ema2': 19, 'slip_atr_k': 0.03834816940085619, 'slip_spread_k': 0.39545646547823227, 'spread_hl_frac': 0.021462271469961342, 'bb_std_mult': 2.344594137471314, 'rsi_os': 12, 'rsi_ob': 95, 'vol_spike': 0.01155950429963272, 'adx_thresh': 5.328169927767915, 'atr_min_pct': 0.027185523608023364, 'atr_max_pct': 0.057404600310848805, 'tp_mult': 2.531056312810766, 'tsl_mult': 0.7102001780183991, 'strategy': 'mean_reversion', 'time_stop': 58, 'use_sma': True, 'use_atr': False, 'use_adx': True, 'use_ema': False, 'use_spike': True, 'rsi_required': False, 'edge_k': 0.567891447909135, 'edge_cap': 0.6800456571304014, 'bull_strategy': 'mean_reversion', 'bull_bb_std_mult': 2.862054009881972, 'bull_rsi_os': 5, 'bull_rsi_ob': 88, 'bull_adx_thresh': 19.505022168069775, 'bull_atr_min_pct': 0.021635780403284594, 'bull_atr_max_pct': 0.13458499358882126, 'bull_tp_mult': 2.478564778359108, 'bull_tsl_mult': 0.32716474830596326, 'bull_time_stop': 152, 'bull_use_sma': False, 'bull_use_ema': True, 'bull_use_atr': True, 'bull_use_adx': True, 'bull_use_spike': True, 'bull_rsi_required': True, 'bear_strategy': 'breakout', 'bear_bb_std_mult': 3.5055131465710767, 'bear_rsi_os': 27, 'bear_rsi_ob': 72, 'bear_adx_thresh': 22.63784313650404, 'bear_atr_min_pct': 0.0008865097883221178, 'bear_atr_max_pct': 0.12105900832881603, 'bear_tp_mult': 1.0117070865518645, 'bear_tsl_mult': 0.6920912816867592, 'bear_time_stop': 190, 'bear_use_sma': False, 'bear_use_ema': True, 'bear_use_atr': False, 'bear_use_adx': False, 'bear_use_spike': False, 'bear_rsi_required': True, 'sideways_strategy': 'mean_reversion', 'sideways_bb_std_mult': 2.768306273042389, 'sideways_rsi_os': 29, 'sideways_rsi_ob': 65, 'sideways_adx_thresh': 23.4032311591391, 'sideways_atr_min_pct': 0.003942065275582305, 'sideways_atr_max_pct': 0.14302616110955904, 'sideways_tp_mult': 1.7259709733715276, 'sideways_tsl_mult': 0.874722787711433, 'sideways_time_stop': 59, 'sideways_use_sma': False, 'sideways_use_ema': True, 'sideways_use_atr': True, 'sideways_use_adx': True, 'sideways_use_spike': False, 'sideways_rsi_required': True}.
[I 2025-08-31 13:19:44,273] Trial 656 finished with values: [-1000000000.0, 1000000000.0] and parameters: {'p_sma': 39, 'p_std': 20, 'p_atr': 17, 'p_adx': 12, 'rsi_period': 47, 'ema1': 14, 'ema2': 19, 'slip_atr_k': 0.03520028200656095, 'slip_spread_k': 0.40318723916423194, 'spread_hl_frac': 0.019031267076574338, 'bb_std_mult': 2.3799644443199455, 'rsi_os': 42, 'rsi_ob': 94, 'vol_spike': 0.011811735182884774, 'adx_thresh': 7.186202229195511, 'atr_min_pct': 0.025235591602224234, 'atr_max_pct': 0.05527938389590247, 'tp_mult': 2.450383445752683, 'tsl_mult': 0.6171816090697861, 'strategy': 'mean_reversion', 'time_stop': 170, 'use_sma': True, 'use_atr': False, 'use_adx': True, 'use_ema': False, 'use_spike': True, 'rsi_required': False, 'edge_k': 0.5695044612455571, 'edge_cap': 0.6340440346205971, 'bull_strategy': 'mean_reversion', 'bull_bb_std_mult': 2.870561291570525, 'bull_rsi_os': 5, 'bull_rsi_ob': 87, 'bull_adx_thresh': 18.358457101890203, 'bull_atr_min_pct': 0.022814551143536137, 'bull_atr_max_pct': 0.13542682876300025, 'bull_tp_mult': 2.4997936350061387, 'bull_tsl_mult': 0.27103559931688964, 'bull_time_stop': 153, 'bull_use_sma': False, 'bull_use_ema': False, 'bull_use_atr': True, 'bull_use_adx': True, 'bull_use_spike': True, 'bull_rsi_required': True, 'bear_strategy': 'breakout', 'bear_bb_std_mult': 3.479513806991071, 'bear_rsi_os': 27, 'bear_rsi_ob': 75, 'bear_adx_thresh': 24.159291967631603, 'bear_atr_min_pct': 0.001030324515853319, 'bear_atr_max_pct': 0.12159294738375379, 'bear_tp_mult': 1.044109422143058, 'bear_tsl_mult': 0.6866029331787961, 'bear_time_stop': 76, 'bear_use_sma': False, 'bear_use_ema': True, 'bear_use_atr': False, 'bear_use_adx': False, 'bear_use_spike': False, 'bear_rsi_required': True, 'sideways_strategy': 'mean_reversion', 'sideways_bb_std_mult': 2.754772031693058, 'sideways_rsi_os': 29, 'sideways_rsi_ob': 65, 'sideways_adx_thresh': 24.44277892851619, 'sideways_atr_min_pct': 0.0038928897839290754, 'sideways_atr_max_pct': 0.14379361397873, 'sideways_tp_mult': 1.716407422673228, 'sideways_tsl_mult': 0.855656921163541, 'sideways_time_stop': 39, 'sideways_use_sma': False, 'sideways_use_ema': True, 'sideways_use_atr': True, 'sideways_use_adx': True, 'sideways_use_spike': False, 'sideways_rsi_required': True}.
[I 2025-08-31 13:19:44,446] Trial 655 finished with values: [-1000000000.0, 1000000000.0] and parameters: {'p_sma': 36, 'p_std': 21, 'p_atr': 17, 'p_adx': 12, 'rsi_period': 47, 'ema1': 11, 'ema2': 19, 'slip_atr_k': 0.03699539510222186, 'slip_spread_k': 0.3961427074941596, 'spread_hl_frac': 0.01910066859337693, 'bb_std_mult': 2.373415363447064, 'rsi_os': 12, 'rsi_ob': 95, 'vol_spike': 0.00996727064951544, 'adx_thresh': 7.1407218162815465, 'atr_min_pct': 0.026807220142434144, 'atr_max_pct': 0.054364098945323354, 'tp_mult': 2.4521384602513483, 'tsl_mult': 0.6816251705267199, 'strategy': 'mean_reversion', 'time_stop': 173, 'use_sma': False, 'use_atr': False, 'use_adx': True, 'use_ema': False, 'use_spike': True, 'rsi_required': False, 'edge_k': 0.5639203527511475, 'edge_cap': 0.6775464654145233, 'bull_strategy': 'mean_reversion', 'bull_bb_std_mult': 2.882250271139877, 'bull_rsi_os': 5, 'bull_rsi_ob': 88, 'bull_adx_thresh': 18.037731067114965, 'bull_atr_min_pct': 0.021838736869449173, 'bull_atr_max_pct': 0.1346358673184754, 'bull_tp_mult': 2.124809621022479, 'bull_tsl_mult': 0.26728914005067717, 'bull_time_stop': 151, 'bull_use_sma': False, 'bull_use_ema': True, 'bull_use_atr': True, 'bull_use_adx': True, 'bull_use_spike': True, 'bull_rsi_required': True, 'bear_strategy': 'breakout', 'bear_bb_std_mult': 3.495567295606226, 'bear_rsi_os': 31, 'bear_rsi_ob': 72, 'bear_adx_thresh': 19.664958889055924, 'bear_atr_min_pct': 0.0010014615456500758, 'bear_atr_max_pct': 0.12511045813853883, 'bear_tp_mult': 1.0516255807144665, 'bear_tsl_mult': 0.688276607319637, 'bear_time_stop': 173, 'bear_use_sma': False, 'bear_use_ema': True, 'bear_use_atr': False, 'bear_use_adx': False, 'bear_use_spike': False, 'bear_rsi_required': True, 'sideways_strategy': 'mean_reversion', 'sideways_bb_std_mult': 2.7988212901391862, 'sideways_rsi_os': 29, 'sideways_rsi_ob': 65, 'sideways_adx_thresh': 24.377926821276944, 'sideways_atr_min_pct': 0.004076802227672989, 'sideways_atr_max_pct': 0.1435940965945776, 'sideways_tp_mult': 1.7228881582192035, 'sideways_tsl_mult': 0.8530762262214664, 'sideways_time_stop': 62, 'sideways_use_sma': False, 'sideways_use_ema': True, 'sideways_use_atr': True, 'sideways_use_adx': True, 'sideways_use_spike': False, 'sideways_rsi_required': True}.
