[I 2025-08-31 12:37:08,630] Trial 351 finished with values: [-1000000000.0, 1000000000.0] and parameters: {'p_sma': 27, 'p_std': 48, 'p_atr': 12, 'p_adx': 22, 'rsi_period': 77, 'ema1': 22, 'ema2': 47, 'slip_atr_k': 0.0179292334516822, 'slip_spread_k': 0.6613294583511538, 'spread_hl_frac': 0.030450520156358234, 'bb_std_mult': 0.7103705302888705, 'rsi_os': 22, 'rsi_ob': 54, 'vol_spike': 0.015522873816080335, 'adx_thresh': 19.798881731678357, 'atr_min_pct': 0.02033396462524656, 'atr_max_pct': 0.03269504649206277, 'tp_mult': 2.7157387858705904, 'tsl_mult': 0.04715598822492197, 'strategy': 'mean_reversion', 'time_stop': 199, 'use_sma': False, 'use_atr': True, 'use_adx': False, 'use_ema': False, 'use_spike': False, 'rsi_required': True, 'edge_k': 0.802472498966075, 'edge_cap': 0.7090822179396246, 'bull_strategy': 'breakout', 'bull_bb_std_mult': 2.913669417818611, 'bull_rsi_os': 10, 'bull_rsi_ob': 81, 'bull_adx_thresh': 28.64353581255941, 'bull_atr_min_pct': 0.021848797377776386, 'bull_atr_max_pct': 0.09864477585900323, 'bull_tp_mult': 2.7832830018477184, 'bull_tsl_mult': 0.2825820331965599, 'bull_time_stop': 111, 'bull_use_sma': True, 'bull_use_ema': True, 'bull_use_atr': False, 'bull_use_adx': False, 'bull_use_spike': False, 'bull_rsi_required': False, 'bear_strategy': 'breakout', 'bear_bb_std_mult': 0.9675117391866801, 'bear_rsi_os': 32, 'bear_rsi_ob': 95, 'bear_adx_thresh': 34.026219148607275, 'bear_atr_min_pct': 0.02262680117242885, 'bear_atr_max_pct': 0.021480962292300364, 'bear_tp_mult': 1.196837914654938, 'bear_tsl_mult': 0.1741220293970382, 'bear_time_stop': 236, 'bear_use_sma': True, 'bear_use_ema': True, 'bear_use_atr': True, 'bear_use_adx': True, 'bear_use_spike': True, 'bear_rsi_required': True, 'sideways_strategy': 'mean_reversion', 'sideways_bb_std_mult': 2.4850969336113553, 'sideways_rsi_os': 34, 'sideways_rsi_ob': 81, 'sideways_adx_thresh': 10.615346915334833, 'sideways_atr_min_pct': 0.0009732345216188184, 'sideways_atr_max_pct': 0.131316710231352, 'sideways_tp_mult': 1.1531997082430196, 'sideways_tsl_mult': 0.32835016260483546, 'sideways_time_stop': 116, 'sideways_use_sma': True, 'sideways_use_ema': False, 'sideways_use_atr': False, 'sideways_use_adx': False, 'sideways_use_spike': True, 'sideways_rsi_required': False}.
[I 2025-08-31 12:37:41,395] Trial 352 finished with values: [-1000000000.0, 1000000000.0] and parameters: {'p_sma': 49, 'p_std': 31, 'p_atr': 19, 'p_adx': 24, 'rsi_period': 80, 'ema1': 5, 'ema2': 47, 'slip_atr_k': 0.02418135367072042, 'slip_spread_k': 0.665482667121572, 'spread_hl_frac': 0.015451868164189787, 'bb_std_mult': 2.315751288972724, 'rsi_os': 38, 'rsi_ob': 76, 'vol_spike': 0.09580425475967408, 'adx_thresh': 21.492052076291102, 'atr_min_pct': 0.013823924323811692, 'atr_max_pct': 0.14005840342898065, 'tp_mult': 1.1491858026042228, 'tsl_mult': 0.04179426876221909, 'strategy': 'mean_reversion', 'time_stop': 208, 'use_sma': False, 'use_atr': True, 'use_adx': False, 'use_ema': False, 'use_spike': False, 'rsi_required': True, 'edge_k': 0.8403979890789354, 'edge_cap': 0.5845025472759598, 'bull_strategy': 'breakout', 'bull_bb_std_mult': 2.895196451307131, 'bull_rsi_os': 10, 'bull_rsi_ob': 78, 'bull_adx_thresh': 30.132169979731895, 'bull_atr_min_pct': 0.02300200027706097, 'bull_atr_max_pct': 0.1448207705629858, 'bull_tp_mult': 2.9951940336411385, 'bull_tsl_mult': 0.1731238634879445, 'bull_time_stop': 82, 'bull_use_sma': True, 'bull_use_ema': True, 'bull_use_atr': False, 'bull_use_adx': False, 'bull_use_spike': False, 'bull_rsi_required': False, 'bear_strategy': 'breakout', 'bear_bb_std_mult': 3.1247186433811485, 'bear_rsi_os': 27, 'bear_rsi_ob': 76, 'bear_adx_thresh': 21.884500569928324, 'bear_atr_min_pct': 0.027549228105010714, 'bear_atr_max_pct': 0.1038613658993429, 'bear_tp_mult': 2.5842102184019122, 'bear_tsl_mult': 0.9000265222574082, 'bear_time_stop': 233, 'bear_use_sma': True, 'bear_use_ema': True, 'bear_use_atr': True, 'bear_use_adx': True, 'bear_use_spike': True, 'bear_rsi_required': True, 'sideways_strategy': 'mean_reversion', 'sideways_bb_std_mult': 3.549209601624693, 'sideways_rsi_os': 8, 'sideways_rsi_ob': 81, 'sideways_adx_thresh': 12.443630050466165, 'sideways_atr_min_pct': 0.0020240385330840185, 'sideways_atr_max_pct': 0.10276989064129954, 'sideways_tp_mult': 2.0024447220141224, 'sideways_tsl_mult': 0.6171596806869455, 'sideways_time_stop': 148, 'sideways_use_sma': True, 'sideways_use_ema': False, 'sideways_use_atr': False, 'sideways_use_adx': False, 'sideways_use_spike': True, 'sideways_rsi_required': False}.
[I 2025-08-31 12:37:41,426] Trial 353 finished with values: [-1000000000.0, 1000000000.0] and parameters: {'p_sma': 23, 'p_std': 28, 'p_atr': 12, 'p_adx': 17, 'rsi_period': 47, 'ema1': 15, 'ema2': 10, 'slip_atr_k': 0.023859643952231682, 'slip_spread_k': 0.6652976911908481, 'spread_hl_frac': 0.03048623103011186, 'bb_std_mult': 1.5921671914291136, 'rsi_os': 38, 'rsi_ob': 74, 'vol_spike': 0.1830900557088362, 'adx_thresh': 21.53211548653319, 'atr_min_pct': 0.004512281640536176, 'atr_max_pct': 0.09560735761158336, 'tp_mult': 1.1491569448800116, 'tsl_mult': 0.04335129346407349, 'strategy': 'breakout', 'time_stop': 247, 'use_sma': False, 'use_atr': True, 'use_adx': False, 'use_ema': False, 'use_spike': False, 'rsi_required': True, 'edge_k': 0.7892512734639208, 'edge_cap': 0.7762754927346616, 'bull_strategy': 'breakout', 'bull_bb_std_mult': 1.133334930517503, 'bull_rsi_os': 10, 'bull_rsi_ob': 66, 'bull_adx_thresh': 28.687148565126837, 'bull_atr_min_pct': 0.021912170974371047, 'bull_atr_max_pct': 0.10358005863477661, 'bull_tp_mult': 2.2222687117744426, 'bull_tsl_mult': 0.2179566770240119, 'bull_time_stop': 23, 'bull_use_sma': True, 'bull_use_ema': True, 'bull_use_atr': False, 'bull_use_adx': False, 'bull_use_spike': True, 'bull_rsi_required': False, 'bear_strategy': 'breakout', 'bear_bb_std_mult': 2.5086886254699894, 'bear_rsi_os': 27, 'bear_rsi_ob': 74, 'bear_adx_thresh': 33.982565153379205, 'bear_atr_min_pct': 0.005646364529442567, 'bear_atr_max_pct': 0.10343289200603584, 'bear_tp_mult': 2.7833791110529402, 'bear_tsl_mult': 0.817364816439173, 'bear_time_stop': 234, 'bear_use_sma': True, 'bear_use_ema': True, 'bear_use_atr': True, 'bear_use_adx': True, 'bear_use_spike': False, 'bear_rsi_required': True, 'sideways_strategy': 'mean_reversion', 'sideways_bb_std_mult': 3.5989384202259282, 'sideways_rsi_os': 33, 'sideways_rsi_ob': 81, 'sideways_adx_thresh': 10.58239706664954, 'sideways_atr_min_pct': 0.0018314595985213684, 'sideways_atr_max_pct': 0.1316924816200509, 'sideways_tp_mult': 2.6773549662719685, 'sideways_tsl_mult': 0.6237916417073015, 'sideways_time_stop': 87, 'sideways_use_sma': True, 'sideways_use_ema': False, 'sideways_use_atr': False, 'sideways_use_adx': True, 'sideways_use_spike': True, 'sideways_rsi_required': False}.
[I 2025-08-31 12:37:41,531] Trial 354 finished with values: [-1000000000.0, 1000000000.0] and parameters: {'p_sma': 26, 'p_std': 31, 'p_atr': 19, 'p_adx': 18, 'rsi_period': 76, 'ema1': 5, 'ema2': 17, 'slip_atr_k': 0.023917012960018785, 'slip_spread_k': 0.666194591024198, 'spread_hl_frac': 0.030540107158783362, 'bb_std_mult': 1.598962919352645, 'rsi_os': 36, 'rsi_ob': 76, 'vol_spike': 0.1824258735226153, 'adx_thresh': 21.513549665896214, 'atr_min_pct': 0.0021726541857190907, 'atr_max_pct': 0.127593713156039, 'tp_mult': 2.3550901900695766, 'tsl_mult': 0.017397629548830167, 'strategy': 'breakout', 'time_stop': 237, 'use_sma': False, 'use_atr': True, 'use_adx': False, 'use_ema': False, 'use_spike': False, 'rsi_required': True, 'edge_k': 1.9320048668721812, 'edge_cap': 0.7641715109038562, 'bull_strategy': 'breakout', 'bull_bb_std_mult': 2.924255919386217, 'bull_rsi_os': 10, 'bull_rsi_ob': 78, 'bull_adx_thresh': 9.828391994606974, 'bull_atr_min_pct': 0.021443139887490158, 'bull_atr_max_pct': 0.06728006887069193, 'bull_tp_mult': 2.663253588494784, 'bull_tsl_mult': 0.27156769330017233, 'bull_time_stop': 82, 'bull_use_sma': True, 'bull_use_ema': True, 'bull_use_atr': False, 'bull_use_adx': False, 'bull_use_spike': True, 'bull_rsi_required': False, 'bear_strategy': 'breakout', 'bear_bb_std_mult': 0.9897547465065164, 'bear_rsi_os': 32, 'bear_rsi_ob': 86, 'bear_adx_thresh': 21.797236746814768, 'bear_atr_min_pct': 0.02253012941077007, 'bear_atr_max_pct': 0.10465000081213925, 'bear_tp_mult': 2.2917528880125713, 'bear_tsl_mult': 0.11448629688124487, 'bear_time_stop': 236, 'bear_use_sma': True, 'bear_use_ema': True, 'bear_use_atr': True, 'bear_use_adx': True, 'bear_use_spike': False, 'bear_rsi_required': True, 'sideways_strategy': 'mean_reversion', 'sideways_bb_std_mult': 3.5460450854640357, 'sideways_rsi_os': 45, 'sideways_rsi_ob': 81, 'sideways_adx_thresh': 24.29233200207725, 'sideways_atr_min_pct': 0.001161935889511687, 'sideways_atr_max_pct': 0.13645747725528162, 'sideways_tp_mult': 2.6515748428933503, 'sideways_tsl_mult': 0.2519552333303151, 'sideways_time_stop': 199, 'sideways_use_sma': True, 'sideways_use_ema': False, 'sideways_use_atr': False, 'sideways_use_adx': True, 'sideways_use_spike': True, 'sideways_rsi_required': False}.
[I 2025-08-31 12:37:41,689] Trial 355 finished with values: [-1000000000.0, 1000000000.0] and parameters: {'p_sma': 23, 'p_std': 31, 'p_atr': 11, 'p_adx': 12, 'rsi_period': 80, 'ema1': 5, 'ema2': 17, 'slip_atr_k': 0.023259147874081586, 'slip_spread_k': 0.3183792753319348, 'spread_hl_frac': 0.015564325650806565, 'bb_std_mult': 3.483339673211611, 'rsi_os': 20, 'rsi_ob': 76, 'vol_spike': 0.09673200456324724, 'adx_thresh': 33.54461963407872, 'atr_min_pct': 0.005049586339478612, 'atr_max_pct': 0.08985764278611907, 'tp_mult': 2.512751260438249, 'tsl_mult': 0.015264266212787151, 'strategy': 'breakout', 'time_stop': 47, 'use_sma': False, 'use_atr': True, 'use_adx': False, 'use_ema': False, 'use_spike': False, 'rsi_required': True, 'edge_k': 0.6015584885424562, 'edge_cap': 0.7650367728131657, 'bull_strategy': 'breakout', 'bull_bb_std_mult': 3.0065347858487073, 'bull_rsi_os': 10, 'bull_rsi_ob': 47, 'bull_adx_thresh': 6.057356308438867, 'bull_atr_min_pct': 0.016806361160771822, 'bull_atr_max_pct': 0.11350151187425465, 'bull_tp_mult': 2.665348670451979, 'bull_tsl_mult': 0.17750547790415916, 'bull_time_stop': 42, 'bull_use_sma': True, 'bull_use_ema': True, 'bull_use_atr': False, 'bull_use_adx': False, 'bull_use_spike': True, 'bull_rsi_required': False, 'bear_strategy': 'breakout', 'bear_bb_std_mult': 1.2516378258061303, 'bear_rsi_os': 13, 'bear_rsi_ob': 73, 'bear_adx_thresh': 32.2092841017552, 'bear_atr_min_pct': 0.026414748612768643, 'bear_atr_max_pct': 0.10470240942579415, 'bear_tp_mult': 2.7774909639662324, 'bear_tsl_mult': 0.8128349410373934, 'bear_time_stop': 190, 'bear_use_sma': True, 'bear_use_ema': True, 'bear_use_atr': True, 'bear_use_adx': True, 'bear_use_spike': False, 'bear_rsi_required': True, 'sideways_strategy': 'mean_reversion', 'sideways_bb_std_mult': 3.597876893460196, 'sideways_rsi_os': 9, 'sideways_rsi_ob': 63, 'sideways_adx_thresh': 24.001028935558875, 'sideways_atr_min_pct': 0.001694213136365241, 'sideways_atr_max_pct': 0.1272510414551637, 'sideways_tp_mult': 2.6809697795791068, 'sideways_tsl_mult': 0.2564964507373598, 'sideways_time_stop': 198, 'sideways_use_sma': True, 'sideways_use_ema': False, 'sideways_use_atr': False, 'sideways_use_adx': True, 'sideways_use_spike': True, 'sideways_rsi_required': False}.
[I 2025-08-31 12:38:15,711] Trial 356 finished with values: [-1000000000.0, 1000000000.0] and parameters: {'p_sma': 59, 'p_std': 30, 'p_atr': 22, 'p_adx': 20, 'rsi_period': 67, 'ema1': 5, 'ema2': 21, 'slip_atr_k': 0.040217234218364054, 'slip_spread_k': 0.6369020030590138, 'spread_hl_frac': 0.010435871408066264, 'bb_std_mult': 1.79277855195716, 'rsi_os': 11, 'rsi_ob': 74, 'vol_spike': 0.07715813322261318, 'adx_thresh': 22.54019910552801, 'atr_min_pct': 0.0021978557263472435, 'atr_max_pct': 0.013887772126215489, 'tp_mult': 2.5263059975247577, 'tsl_mult': 0.019938028525578123, 'strategy': 'breakout', 'time_stop': 138, 'use_sma': False, 'use_atr': True, 'use_adx': False, 'use_ema': False, 'use_spike': False, 'rsi_required': True, 'edge_k': 0.6449800377918428, 'edge_cap': 0.7381588422182441, 'bull_strategy': 'breakout', 'bull_bb_std_mult': 2.995007735127002, 'bull_rsi_os': 41, 'bull_rsi_ob': 83, 'bull_adx_thresh': 9.910110410767146, 'bull_atr_min_pct': 0.02077390057466478, 'bull_atr_max_pct': 0.1149907495297989, 'bull_tp_mult': 2.6545220603238824, 'bull_tsl_mult': 0.7118123398455103, 'bull_time_stop': 5, 'bull_use_sma': True, 'bull_use_ema': True, 'bull_use_atr': False, 'bull_use_adx': True, 'bull_use_spike': True, 'bull_rsi_required': False, 'bear_strategy': 'breakout', 'bear_bb_std_mult': 1.2675960199594238, 'bear_rsi_os': 31, 'bear_rsi_ob': 47, 'bear_adx_thresh': 32.412198591275214, 'bear_atr_min_pct': 0.026223759702854593, 'bear_atr_max_pct': 0.09376439504559782, 'bear_tp_mult': 2.931499451276643, 'bear_tsl_mult': 0.10991910827994725, 'bear_time_stop': 255, 'bear_use_sma': True, 'bear_use_ema': True, 'bear_use_atr': True, 'bear_use_adx': True, 'bear_use_spike': False, 'bear_rsi_required': True, 'sideways_strategy': 'breakout', 'sideways_bb_std_mult': 3.43275412994779, 'sideways_rsi_os': 50, 'sideways_rsi_ob': 79, 'sideways_adx_thresh': 23.97452085078128, 'sideways_atr_min_pct': 0.006918904438103432, 'sideways_atr_max_pct': 0.1369519011767553, 'sideways_tp_mult': 1.3755603096483706, 'sideways_tsl_mult': 0.7147056316326924, 'sideways_time_stop': 197, 'sideways_use_sma': True, 'sideways_use_ema': False, 'sideways_use_atr': False, 'sideways_use_adx': True, 'sideways_use_spike': False, 'sideways_rsi_required': True}.
[I 2025-08-31 12:38:16,255] Trial 358 finished with values: [-1000000000.0, 1000000000.0] and parameters: {'p_sma': 20, 'p_std': 29, 'p_atr': 11, 'p_adx': 26, 'rsi_period': 74, 'ema1': 27, 'ema2': 24, 'slip_atr_k': 0.04054564058828078, 'slip_spread_k': 0.6377318069299609, 'spread_hl_frac': 0.02909386336305794, 'bb_std_mult': 1.7922613596826507, 'rsi_os': 20, 'rsi_ob': 74, 'vol_spike': 0.0765782374272662, 'adx_thresh': 22.229390523791924, 'atr_min_pct': 0.015949752868080657, 'atr_max_pct': 0.13129514799986214, 'tp_mult': 2.507466347609848, 'tsl_mult': 0.20717473722061014, 'strategy': 'mean_reversion', 'time_stop': 152, 'use_sma': False, 'use_atr': True, 'use_adx': False, 'use_ema': False, 'use_spike': False, 'rsi_required': True, 'edge_k': 0.6490232578227094, 'edge_cap': 0.7515061541331671, 'bull_strategy': 'breakout', 'bull_bb_std_mult': 2.449055330493004, 'bull_rsi_os': 27, 'bull_rsi_ob': 47, 'bull_adx_thresh': 6.276531288748467, 'bull_atr_min_pct': 0.020817832033910327, 'bull_atr_max_pct': 0.05927813887580147, 'bull_tp_mult': 2.126524927248321, 'bull_tsl_mult': 0.2671546143575221, 'bull_time_stop': 73, 'bull_use_sma': True, 'bull_use_ema': True, 'bull_use_atr': False, 'bull_use_adx': True, 'bull_use_spike': False, 'bull_rsi_required': False, 'bear_strategy': 'breakout', 'bear_bb_std_mult': 3.1888762358938845, 'bear_rsi_os': 19, 'bear_rsi_ob': 73, 'bear_adx_thresh': 12.359500753681235, 'bear_atr_min_pct': 0.019226454446105823, 'bear_atr_max_pct': 0.09371101356469094, 'bear_tp_mult': 2.9442823727231415, 'bear_tsl_mult': 0.14025710252087314, 'bear_time_stop': 244, 'bear_use_sma': True, 'bear_use_ema': True, 'bear_use_atr': True, 'bear_use_adx': True, 'bear_use_spike': True, 'bear_rsi_required': True, 'sideways_strategy': 'breakout', 'sideways_bb_std_mult': 0.6767215621364491, 'sideways_rsi_os': 22, 'sideways_rsi_ob': 79, 'sideways_adx_thresh': 11.44759246400361, 'sideways_atr_min_pct': 0.0005790655133313064, 'sideways_atr_max_pct': 0.12768262230838462, 'sideways_tp_mult': 1.537611566882341, 'sideways_tsl_mult': 0.6473931634444061, 'sideways_time_stop': 211, 'sideways_use_sma': True, 'sideways_use_ema': False, 'sideways_use_atr': False, 'sideways_use_adx': False, 'sideways_use_spike': False, 'sideways_rsi_required': True}.
[I 2025-08-31 12:38:16,488] Trial 359 finished with values: [-1000000000.0, 1000000000.0] and parameters: {'p_sma': 20, 'p_std': 25, 'p_atr': 22, 'p_adx': 29, 'rsi_period': 76, 'ema1': 30, 'ema2': 23, 'slip_atr_k': 0.039093635888271465, 'slip_spread_k': 0.5555420890627558, 'spread_hl_frac': 0.01395106828604048, 'bb_std_mult': 0.5320217669140088, 'rsi_os': 41, 'rsi_ob': 74, 'vol_spike': 0.07824633384984632, 'adx_thresh': 13.626398320125809, 'atr_min_pct': 0.006155813526048718, 'atr_max_pct': 0.017589708766396928, 'tp_mult': 2.025938838742174, 'tsl_mult': 0.20403008220968966, 'strategy': 'mean_reversion', 'time_stop': 151, 'use_sma': False, 'use_atr': True, 'use_adx': False, 'use_ema': False, 'use_spike': False, 'rsi_required': True, 'edge_k': 1.8086534898051592, 'edge_cap': 0.6949790903353803, 'bull_strategy': 'breakout', 'bull_bb_std_mult': 2.4534206446019935, 'bull_rsi_os': 24, 'bull_rsi_ob': 74, 'bull_adx_thresh': 9.391489330148318, 'bull_atr_min_pct': 0.0056370568447679775, 'bull_atr_max_pct': 0.05890535827830995, 'bull_tp_mult': 2.6266786596291456, 'bull_tsl_mult': 0.2975990007045569, 'bull_time_stop': 89, 'bull_use_sma': True, 'bull_use_ema': True, 'bull_use_atr': True, 'bull_use_adx': True, 'bull_use_spike': False, 'bull_rsi_required': False, 'bear_strategy': 'breakout', 'bear_bb_std_mult': 3.1693591156450336, 'bear_rsi_os': 47, 'bear_rsi_ob': 47, 'bear_adx_thresh': 12.66460546955776, 'bear_atr_min_pct': 0.027000508012091317, 'bear_atr_max_pct': 0.09310721432382091, 'bear_tp_mult': 2.4104674611077455, 'bear_tsl_mult': 0.039212980284137, 'bear_time_stop': 255, 'bear_use_sma': True, 'bear_use_ema': True, 'bear_use_atr': True, 'bear_use_adx': True, 'bear_use_spike': True, 'bear_rsi_required': True, 'sideways_strategy': 'breakout', 'sideways_bb_std_mult': 1.7506523157654676, 'sideways_rsi_os': 6, 'sideways_rsi_ob': 83, 'sideways_adx_thresh': 11.569972383125878, 'sideways_atr_min_pct': 0.0006820306693057098, 'sideways_atr_max_pct': 0.12556559387852373, 'sideways_tp_mult': 2.782962549767729, 'sideways_tsl_mult': 0.6949667350929221, 'sideways_time_stop': 188, 'sideways_use_sma': True, 'sideways_use_ema': False, 'sideways_use_atr': False, 'sideways_use_adx': False, 'sideways_use_spike': False, 'sideways_rsi_required': True}.
[I 2025-08-31 12:38:16,618] Trial 357 finished with values: [-1000000000.0, 1000000000.0] and parameters: {'p_sma': 20, 'p_std': 26, 'p_atr': 11, 'p_adx': 26, 'rsi_period': 30, 'ema1': 5, 'ema2': 21, 'slip_atr_k': 0.039379668804411266, 'slip_spread_k': 0.48521623533601704, 'spread_hl_frac': 0.038176475363933496, 'bb_std_mult': 1.6249988755769256, 'rsi_os': 32, 'rsi_ob': 74, 'vol_spike': 0.22569445983043396, 'adx_thresh': 21.99610009729031, 'atr_min_pct': 0.0022722277878198752, 'atr_max_pct': 0.014030271560199856, 'tp_mult': 1.6956846231898324, 'tsl_mult': 0.09393083579881467, 'strategy': 'breakout', 'time_stop': 237, 'use_sma': False, 'use_atr': True, 'use_adx': False, 'use_ema': False, 'use_spike': False, 'rsi_required': True, 'edge_k': 1.5340800422479148, 'edge_cap': 0.7503676757383668, 'bull_strategy': 'breakout', 'bull_bb_std_mult': 0.5753485155822677, 'bull_rsi_os': 24, 'bull_rsi_ob': 47, 'bull_adx_thresh': 9.436122831571197, 'bull_atr_min_pct': 0.01160807613946974, 'bull_atr_max_pct': 0.06904627693886704, 'bull_tp_mult': 2.664146248357996, 'bull_tsl_mult': 0.719810081827724, 'bull_time_stop': 73, 'bull_use_sma': True, 'bull_use_ema': True, 'bull_use_atr': False, 'bull_use_adx': True, 'bull_use_spike': True, 'bull_rsi_required': False, 'bear_strategy': 'breakout', 'bear_bb_std_mult': 3.3837124538562082, 'bear_rsi_os': 31, 'bear_rsi_ob': 73, 'bear_adx_thresh': 32.28548895181721, 'bear_atr_min_pct': 0.02638495574488535, 'bear_atr_max_pct': 0.09284296909684976, 'bear_tp_mult': 2.0257422829347327, 'bear_tsl_mult': 0.5396367112210061, 'bear_time_stop': 243, 'bear_use_sma': True, 'bear_use_ema': True, 'bear_use_atr': True, 'bear_use_adx': True, 'bear_use_spike': False, 'bear_rsi_required': True, 'sideways_strategy': 'breakout', 'sideways_bb_std_mult': 1.7479986263251683, 'sideways_rsi_os': 35, 'sideways_rsi_ob': 79, 'sideways_adx_thresh': 13.523543163737905, 'sideways_atr_min_pct': 0.006841361957122828, 'sideways_atr_max_pct': 0.13602052972423787, 'sideways_tp_mult': 1.5218444570890197, 'sideways_tsl_mult': 0.7107303853944791, 'sideways_time_stop': 198, 'sideways_use_sma': True, 'sideways_use_ema': False, 'sideways_use_atr': False, 'sideways_use_adx': True, 'sideways_use_spike': False, 'sideways_rsi_required': True}.
