[I 2025-08-31 13:34:20,840] Trial 765 finished with values: [-1000000000.0, 1000000000.0] and parameters: {'p_sma': 47, 'p_std': 17, 'p_atr': 16, 'p_adx': 14, 'rsi_period': 47, 'ema1': 24, 'ema2': 20, 'slip_atr_k': 0.1935666117027574, 'slip_spread_k': 0.06457933448442565, 'spread_hl_frac': 0.01662802401949969, 'bb_std_mult': 2.494483413917038, 'rsi_os': 38, 'rsi_ob': 59, 'vol_spike': 0.05129782920416087, 'adx_thresh': 7.379924556798881, 'atr_min_pct': 0.026774836696114156, 'atr_max_pct': 0.05303040012844971, 'tp_mult': 2.487216062479292, 'tsl_mult': 0.4864218147976321, 'strategy': 'mean_reversion', 'time_stop': 162, 'use_sma': False, 'use_atr': False, 'use_adx': True, 'use_ema': True, 'use_spike': True, 'rsi_required': False, 'edge_k': 0.5675890816669458, 'edge_cap': 0.9516793540489096, 'bull_strategy': 'mean_reversion', 'bull_bb_std_mult': 2.0319458705412785, 'bull_rsi_os': 8, 'bull_rsi_ob': 84, 'bull_adx_thresh': 17.193962898879295, 'bull_atr_min_pct': 0.02069233472855405, 'bull_atr_max_pct': 0.14146341976104745, 'bull_tp_mult': 2.239511353043264, 'bull_tsl_mult': 0.7981892765682961, 'bull_time_stop': 163, 'bull_use_sma': True, 'bull_use_ema': True, 'bull_use_atr': True, 'bull_use_adx': True, 'bull_use_spike': True, 'bull_rsi_required': True, 'bear_strategy': 'breakout', 'bear_bb_std_mult': 1.9747504092695238, 'bear_rsi_os': 31, 'bear_rsi_ob': 87, 'bear_adx_thresh': 26.588403925147873, 'bear_atr_min_pct': 0.005533367591542937, 'bear_atr_max_pct': 0.12602499299063363, 'bear_tp_mult': 1.0588224792757268, 'bear_tsl_mult': 0.7182715417192678, 'bear_time_stop': 186, 'bear_use_sma': False, 'bear_use_ema': False, 'bear_use_atr': False, 'bear_use_adx': False, 'bear_use_spike': True, 'bear_rsi_required': False, 'sideways_strategy': 'breakout', 'sideways_bb_std_mult': 3.1277028580270922, 'sideways_rsi_os': 49, 'sideways_rsi_ob': 64, 'sideways_adx_thresh': 20.66101269695761, 'sideways_atr_min_pct': 0.010653370577202895, 'sideways_atr_max_pct': 0.14945377358677678, 'sideways_tp_mult': 1.7511254558881595, 'sideways_tsl_mult': 0.8403582608730448, 'sideways_time_stop': 63, 'sideways_use_sma': False, 'sideways_use_ema': False, 'sideways_use_atr': True, 'sideways_use_adx': True, 'sideways_use_spike': False, 'sideways_rsi_required': False}.
[I 2025-08-31 13:34:53,854] Trial 767 finished with values: [-1000000000.0, 1000000000.0] and parameters: {'p_sma': 14, 'p_std': 23, 'p_atr': 26, 'p_adx': 29, 'rsi_period': 59, 'ema1': 8, 'ema2': 18, 'slip_atr_k': 0.19264154472664718, 'slip_spread_k': 0.36360482065103994, 'spread_hl_frac': 0.015285352461788542, 'bb_std_mult': 1.5963313966148864, 'rsi_os': 42, 'rsi_ob': 93, 'vol_spike': 0.05206360278787048, 'adx_thresh': 10.69922239941012, 'atr_min_pct': 0.027074599296356573, 'atr_max_pct': 0.04862402873474994, 'tp_mult': 2.471334689479467, 'tsl_mult': 0.9750587482467065, 'strategy': 'mean_reversion', 'time_stop': 44, 'use_sma': False, 'use_atr': False, 'use_adx': True, 'use_ema': False, 'use_spike': True, 'rsi_required': False, 'edge_k': 1.9092375056253765, 'edge_cap': 0.39226428074331327, 'bull_strategy': 'mean_reversion', 'bull_bb_std_mult': 2.7667217287047845, 'bull_rsi_os': 8, 'bull_rsi_ob': 74, 'bull_adx_thresh': 17.387121215968573, 'bull_atr_min_pct': 0.005728931106758284, 'bull_atr_max_pct': 0.14239038636200657, 'bull_tp_mult': 2.315602010672448, 'bull_tsl_mult': 0.3324078580505616, 'bull_time_stop': 166, 'bull_use_sma': True, 'bull_use_ema': True, 'bull_use_atr': True, 'bull_use_adx': True, 'bull_use_spike': True, 'bull_rsi_required': True, 'bear_strategy': 'breakout', 'bear_bb_std_mult': 1.9668986159684065, 'bear_rsi_os': 29, 'bear_rsi_ob': 76, 'bear_adx_thresh': 17.05050127696852, 'bear_atr_min_pct': 0.0018917089802348306, 'bear_atr_max_pct': 0.1270222328042806, 'bear_tp_mult': 1.243388346375068, 'bear_tsl_mult': 0.026755473099232374, 'bear_time_stop': 100, 'bear_use_sma': False, 'bear_use_ema': True, 'bear_use_atr': False, 'bear_use_adx': False, 'bear_use_spike': True, 'bear_rsi_required': True, 'sideways_strategy': 'mean_reversion', 'sideways_bb_std_mult': 2.63320361254901, 'sideways_rsi_os': 30, 'sideways_rsi_ob': 64, 'sideways_adx_thresh': 22.86841363059297, 'sideways_atr_min_pct': 0.003172170187422873, 'sideways_atr_max_pct': 0.14760511536282714, 'sideways_tp_mult': 1.6507650984212137, 'sideways_tsl_mult': 0.9069673158652801, 'sideways_time_stop': 38, 'sideways_use_sma': False, 'sideways_use_ema': True, 'sideways_use_atr': True, 'sideways_use_adx': True, 'sideways_use_spike': False, 'sideways_rsi_required': True}.
[I 2025-08-31 13:34:54,250] Trial 766 finished with values: [-1000000000.0, 1000000000.0] and parameters: {'p_sma': 12, 'p_std': 36, 'p_atr': 17, 'p_adx': 14, 'rsi_period': 47, 'ema1': 8, 'ema2': 22, 'slip_atr_k': 0.030963339450145178, 'slip_spread_k': 0.3655230274612737, 'spread_hl_frac': 0.014678227953063151, 'bb_std_mult': 1.5992224553214192, 'rsi_os': 42, 'rsi_ob': 93, 'vol_spike': 0.014404232576237748, 'adx_thresh': 7.055037789698183, 'atr_min_pct': 0.027347978197900726, 'atr_max_pct': 0.05093884625729546, 'tp_mult': 2.4770828143154406, 'tsl_mult': 0.4861945971161807, 'strategy': 'mean_reversion', 'time_stop': 164, 'use_sma': False, 'use_atr': False, 'use_adx': True, 'use_ema': True, 'use_spike': True, 'rsi_required': False, 'edge_k': 0.5416519151186306, 'edge_cap': 0.9466142630514678, 'bull_strategy': 'mean_reversion', 'bull_bb_std_mult': 2.9154833386339996, 'bull_rsi_os': 8, 'bull_rsi_ob': 63, 'bull_adx_thresh': 5.844370916280983, 'bull_atr_min_pct': 0.02156810779953183, 'bull_atr_max_pct': 0.14165903950618153, 'bull_tp_mult': 2.2355344045395382, 'bull_tsl_mult': 0.2679110842791038, 'bull_time_stop': 165, 'bull_use_sma': True, 'bull_use_ema': True, 'bull_use_atr': True, 'bull_use_adx': True, 'bull_use_spike': True, 'bull_rsi_required': True, 'bear_strategy': 'breakout', 'bear_bb_std_mult': 3.3713538233870324, 'bear_rsi_os': 29, 'bear_rsi_ob': 72, 'bear_adx_thresh': 26.382331771329117, 'bear_atr_min_pct': 0.002114354304826628, 'bear_atr_max_pct': 0.12617572546978187, 'bear_tp_mult': 1.3432962700574005, 'bear_tsl_mult': 0.022251838784879463, 'bear_time_stop': 199, 'bear_use_sma': False, 'bear_use_ema': False, 'bear_use_atr': False, 'bear_use_adx': False, 'bear_use_spike': True, 'bear_rsi_required': False, 'sideways_strategy': 'mean_reversion', 'sideways_bb_std_mult': 1.2558162022212074, 'sideways_rsi_os': 30, 'sideways_rsi_ob': 53, 'sideways_adx_thresh': 21.338963293082053, 'sideways_atr_min_pct': 0.0031319822709075574, 'sideways_atr_max_pct': 0.1478244373214341, 'sideways_tp_mult': 2.115621398940859, 'sideways_tsl_mult': 0.8305543993467226, 'sideways_time_stop': 60, 'sideways_use_sma': False, 'sideways_use_ema': True, 'sideways_use_atr': True, 'sideways_use_adx': True, 'sideways_use_spike': False, 'sideways_rsi_required': False}.
[I 2025-08-31 13:34:54,366] Trial 768 finished with values: [-1000000000.0, 1000000000.0] and parameters: {'p_sma': 14, 'p_std': 58, 'p_atr': 20, 'p_adx': 19, 'rsi_period': 35, 'ema1': 9, 'ema2': 21, 'slip_atr_k': 0.03354951134249083, 'slip_spread_k': 0.8178247870880458, 'spread_hl_frac': 0.015431584758496807, 'bb_std_mult': 2.381766500472527, 'rsi_os': 42, 'rsi_ob': 53, 'vol_spike': 0.05582529126707718, 'adx_thresh': 10.345559386961849, 'atr_min_pct': 0.027058591108517136, 'atr_max_pct': 0.050424410608799985, 'tp_mult': 2.334943177554003, 'tsl_mult': 0.4894054645227885, 'strategy': 'mean_reversion', 'time_stop': 170, 'use_sma': False, 'use_atr': False, 'use_adx': True, 'use_ema': False, 'use_spike': True, 'rsi_required': False, 'edge_k': 0.5240481528882075, 'edge_cap': 0.6021466905135403, 'bull_strategy': 'mean_reversion', 'bull_bb_std_mult': 3.014385633973824, 'bull_rsi_os': 18, 'bull_rsi_ob': 63, 'bull_adx_thresh': 20.021217924582807, 'bull_atr_min_pct': 0.0011324810216396392, 'bull_atr_max_pct': 0.14191546148306144, 'bull_tp_mult': 2.329857921508574, 'bull_tsl_mult': 0.23681809111059224, 'bull_time_stop': 171, 'bull_use_sma': False, 'bull_use_ema': True, 'bull_use_atr': True, 'bull_use_adx': False, 'bull_use_spike': True, 'bull_rsi_required': True, 'bear_strategy': 'mean_reversion', 'bear_bb_std_mult': 3.298663139993697, 'bear_rsi_os': 33, 'bear_rsi_ob': 73, 'bear_adx_thresh': 16.968963250781854, 'bear_atr_min_pct': 0.0019151314897742112, 'bear_atr_max_pct': 0.12578766277100514, 'bear_tp_mult': 1.23054903219594, 'bear_tsl_mult': 0.5457728563248432, 'bear_time_stop': 269, 'bear_use_sma': False, 'bear_use_ema': False, 'bear_use_atr': False, 'bear_use_adx': False, 'bear_use_spike': False, 'bear_rsi_required': False, 'sideways_strategy': 'mean_reversion', 'sideways_bb_std_mult': 1.2596366150767708, 'sideways_rsi_os': 30, 'sideways_rsi_ob': 53, 'sideways_adx_thresh': 23.090295684292194, 'sideways_atr_min_pct': 0.0031381067501482984, 'sideways_atr_max_pct': 0.14762565586674586, 'sideways_tp_mult': 1.6578638144400264, 'sideways_tsl_mult': 0.8347576941191578, 'sideways_time_stop': 39, 'sideways_use_sma': False, 'sideways_use_ema': True, 'sideways_use_atr': True, 'sideways_use_adx': True, 'sideways_use_spike': True, 'sideways_rsi_required': True}.
[I 2025-08-31 13:34:54,736] Trial 769 finished with values: [-1000000000.0, 1000000000.0] and parameters: {'p_sma': 14, 'p_std': 23, 'p_atr': 29, 'p_adx': 14, 'rsi_period': 50, 'ema1': 10, 'ema2': 27, 'slip_atr_k': 0.031220340900835523, 'slip_spread_k': 0.3614995934578818, 'spread_hl_frac': 0.01511480784029159, 'bb_std_mult': 2.112623399444124, 'rsi_os': 42, 'rsi_ob': 86, 'vol_spike': 0.013727209516076873, 'adx_thresh': 8.057827779062395, 'atr_min_pct': 0.028077173817563233, 'atr_max_pct': 0.048732880027186544, 'tp_mult': 2.439124192430607, 'tsl_mult': 0.980924609218379, 'strategy': 'mean_reversion', 'time_stop': 18, 'use_sma': False, 'use_atr': False, 'use_adx': True, 'use_ema': False, 'use_spike': True, 'rsi_required': False, 'edge_k': 0.5376671461487867, 'edge_cap': 0.6427749140861309, 'bull_strategy': 'mean_reversion', 'bull_bb_std_mult': 2.7430377973236135, 'bull_rsi_os': 55, 'bull_rsi_ob': 90, 'bull_adx_thresh': 20.01911979297877, 'bull_atr_min_pct': 0.025306156929895903, 'bull_atr_max_pct': 0.14207061781663852, 'bull_tp_mult': 2.370275337582631, 'bull_tsl_mult': 0.32654033153426143, 'bull_time_stop': 170, 'bull_use_sma': False, 'bull_use_ema': True, 'bull_use_atr': True, 'bull_use_adx': False, 'bull_use_spike': True, 'bull_rsi_required': True, 'bear_strategy': 'mean_reversion', 'bear_bb_std_mult': 3.27648118604212, 'bear_rsi_os': 29, 'bear_rsi_ob': 89, 'bear_adx_thresh': 22.775224224151362, 'bear_atr_min_pct': 0.002146661703473264, 'bear_atr_max_pct': 0.12510704248595297, 'bear_tp_mult': 1.341360679141721, 'bear_tsl_mult': 0.6489868136518944, 'bear_time_stop': 194, 'bear_use_sma': False, 'bear_use_ema': True, 'bear_use_atr': False, 'bear_use_adx': False, 'bear_use_spike': False, 'bear_rsi_required': True, 'sideways_strategy': 'mean_reversion', 'sideways_bb_std_mult': 1.9459048661756593, 'sideways_rsi_os': 30, 'sideways_rsi_ob': 63, 'sideways_adx_thresh': 23.814878387991726, 'sideways_atr_min_pct': 0.003085394176570388, 'sideways_atr_max_pct': 0.1471014387856797, 'sideways_tp_mult': 1.6685076891405863, 'sideways_tsl_mult': 0.8687323900174124, 'sideways_time_stop': 43, 'sideways_use_sma': False, 'sideways_use_ema': True, 'sideways_use_atr': True, 'sideways_use_adx': True, 'sideways_use_spike': True, 'sideways_rsi_required': True}.
[I 2025-08-31 13:34:55,649] Trial 771 finished with values: [-1000000000.0, 1000000000.0] and parameters: {'p_sma': 27, 'p_std': 51, 'p_atr': 18, 'p_adx': 19, 'rsi_period': 50, 'ema1': 10, 'ema2': 17, 'slip_atr_k': 0.038921757497658166, 'slip_spread_k': 0.43438374588139606, 'spread_hl_frac': 0.018919794638499892, 'bb_std_mult': 2.3858412869192858, 'rsi_os': 40, 'rsi_ob': 86, 'vol_spike': 0.29215469907170377, 'adx_thresh': 12.796690536105864, 'atr_min_pct': 0.027970850218924634, 'atr_max_pct': 0.018622093368905364, 'tp_mult': 1.4688271064930132, 'tsl_mult': 0.5619880747680578, 'strategy': 'breakout', 'time_stop': 173, 'use_sma': False, 'use_atr': False, 'use_adx': True, 'use_ema': False, 'use_spike': True, 'rsi_required': False, 'edge_k': 0.5231992868097658, 'edge_cap': 0.639127634505912, 'bull_strategy': 'mean_reversion', 'bull_bb_std_mult': 1.7002910672265776, 'bull_rsi_os': 47, 'bull_rsi_ob': 86, 'bull_adx_thresh': 19.880304220411297, 'bull_atr_min_pct': 0.014192381463422603, 'bull_atr_max_pct': 0.14235722591110883, 'bull_tp_mult': 2.1674270555797293, 'bull_tsl_mult': 0.22883843846752547, 'bull_time_stop': 192, 'bull_use_sma': False, 'bull_use_ema': True, 'bull_use_atr': True, 'bull_use_adx': False, 'bull_use_spike': True, 'bull_rsi_required': True, 'bear_strategy': 'mean_reversion', 'bear_bb_std_mult': 3.2831525370592094, 'bear_rsi_os': 27, 'bear_rsi_ob': 82, 'bear_adx_thresh': 18.30943220479434, 'bear_atr_min_pct': 0.017320173538627588, 'bear_atr_max_pct': 0.13049851433307114, 'bear_tp_mult': 1.6285982383869275, 'bear_tsl_mult': 0.547853023461502, 'bear_time_stop': 194, 'bear_use_sma': False, 'bear_use_ema': True, 'bear_use_atr': False, 'bear_use_adx': False, 'bear_use_spike': False, 'bear_rsi_required': True, 'sideways_strategy': 'breakout', 'sideways_bb_std_mult': 2.7021877848895426, 'sideways_rsi_os': 31, 'sideways_rsi_ob': 93, 'sideways_adx_thresh': 17.617336980617484, 'sideways_atr_min_pct': 0.0032042113470607514, 'sideways_atr_max_pct': 0.14737776473522932, 'sideways_tp_mult': 1.6891056867314864, 'sideways_tsl_mult': 0.870884525519949, 'sideways_time_stop': 46, 'sideways_use_sma': False, 'sideways_use_ema': False, 'sideways_use_atr': True, 'sideways_use_adx': True, 'sideways_use_spike': True, 'sideways_rsi_required': True}.
[I 2025-08-31 13:35:26,320] Trial 773 finished with values: [-1000000000.0, 1000000000.0] and parameters: {'p_sma': 10, 'p_std': 21, 'p_atr': 22, 'p_adx': 13, 'rsi_period': 68, 'ema1': 9, 'ema2': 17, 'slip_atr_k': 0.039094700486746244, 'slip_spread_k': 0.31098603121444, 'spread_hl_frac': 0.018826100750099894, 'bb_std_mult': 2.343092106912259, 'rsi_os': 29, 'rsi_ob': 82, 'vol_spike': 0.20103070027260442, 'adx_thresh': 12.519221072426323, 'atr_min_pct': 0.025088551936907153, 'atr_max_pct': 0.03724791558033938, 'tp_mult': 2.5999629360557144, 'tsl_mult': 0.5685084965664974, 'strategy': 'breakout', 'time_stop': 255, 'use_sma': True, 'use_atr': False, 'use_adx': True, 'use_ema': True, 'use_spike': True, 'rsi_required': False, 'edge_k': 0.5919689018156871, 'edge_cap': 0.6735674846400301, 'bull_strategy': 'mean_reversion', 'bull_bb_std_mult': 1.8268095383728158, 'bull_rsi_os': 39, 'bull_rsi_ob': 85, 'bull_adx_thresh': 23.786293341184333, 'bull_atr_min_pct': 0.004767901017730133, 'bull_atr_max_pct': 0.14032874222924688, 'bull_tp_mult': 2.173811229667493, 'bull_tsl_mult': 0.2303736008575336, 'bull_time_stop': 192, 'bull_use_sma': True, 'bull_use_ema': True, 'bull_use_atr': True, 'bull_use_adx': True, 'bull_use_spike': True, 'bull_rsi_required': True, 'bear_strategy': 'breakout', 'bear_bb_std_mult': 0.752492403204895, 'bear_rsi_os': 13, 'bear_rsi_ob': 71, 'bear_adx_thresh': 21.608177600157298, 'bear_atr_min_pct': 0.010665182766433232, 'bear_atr_max_pct': 0.13013541538415416, 'bear_tp_mult': 1.1048621598334254, 'bear_tsl_mult': 0.4388385908123076, 'bear_time_stop': 148, 'bear_use_sma': False, 'bear_use_ema': True, 'bear_use_atr': False, 'bear_use_adx': False, 'bear_use_spike': True, 'bear_rsi_required': True, 'sideways_strategy': 'breakout', 'sideways_bb_std_mult': 2.69656944806062, 'sideways_rsi_os': 32, 'sideways_rsi_ob': 55, 'sideways_adx_thresh': 13.917721152295574, 'sideways_atr_min_pct': 0.025303161391432204, 'sideways_atr_max_pct': 0.1497413945408126, 'sideways_tp_mult': 1.6988983379287506, 'sideways_tsl_mult': 0.7349886955125776, 'sideways_time_stop': 50, 'sideways_use_sma': False, 'sideways_use_ema': False, 'sideways_use_atr': True, 'sideways_use_adx': True, 'sideways_use_spike': False, 'sideways_rsi_required': True}.
[I 2025-08-31 13:35:26,836] Trial 772 finished with values: [-1000000000.0, 1000000000.0] and parameters: {'p_sma': 26, 'p_std': 51, 'p_atr': 29, 'p_adx': 13, 'rsi_period': 63, 'ema1': 10, 'ema2': 49, 'slip_atr_k': 0.038094685544192, 'slip_spread_k': 0.32408786057606986, 'spread_hl_frac': 0.04329612923035553, 'bb_std_mult': 3.433746712080592, 'rsi_os': 29, 'rsi_ob': 95, 'vol_spike': 0.20002904555314507, 'adx_thresh': 8.760540444028168, 'atr_min_pct': 0.025348953261173594, 'atr_max_pct': 0.038174554628738894, 'tp_mult': 2.6053921167949223, 'tsl_mult': 0.673591609567537, 'strategy': 'breakout', 'time_stop': 173, 'use_sma': False, 'use_atr': False, 'use_adx': True, 'use_ema': True, 'use_spike': True, 'rsi_required': False, 'edge_k': 1.7335070084738549, 'edge_cap': 0.6498859191900923, 'bull_strategy': 'mean_reversion', 'bull_bb_std_mult': 2.741349418420331, 'bull_rsi_os': 5, 'bull_rsi_ob': 75, 'bull_adx_thresh': 29.907686687176362, 'bull_atr_min_pct': 0.021233193705249995, 'bull_atr_max_pct': 0.13931595189526674, 'bull_tp_mult': 2.1648476627072695, 'bull_tsl_mult': 0.29464829140836923, 'bull_time_stop': 192, 'bull_use_sma': False, 'bull_use_ema': True, 'bull_use_atr': True, 'bull_use_adx': False, 'bull_use_spike': True, 'bull_rsi_required': True, 'bear_strategy': 'mean_reversion', 'bear_bb_std_mult': 1.254573739590818, 'bear_rsi_os': 12, 'bear_rsi_ob': 71, 'bear_adx_thresh': 15.956649286819543, 'bear_atr_min_pct': 0.010287168307148067, 'bear_atr_max_pct': 0.12982286856011716, 'bear_tp_mult': 1.6397399784839024, 'bear_tsl_mult': 0.4434775284155089, 'bear_time_stop': 53, 'bear_use_sma': False, 'bear_use_ema': True, 'bear_use_atr': False, 'bear_use_adx': False, 'bear_use_spike': False, 'bear_rsi_required': True, 'sideways_strategy': 'breakout', 'sideways_bb_std_mult': 2.7697026174461867, 'sideways_rsi_os': 32, 'sideways_rsi_ob': 55, 'sideways_adx_thresh': 25.5608986744412, 'sideways_atr_min_pct': 0.025593124772591083, 'sideways_atr_max_pct': 0.14714990037862696, 'sideways_tp_mult': 1.6978591546261113, 'sideways_tsl_mult': 0.8672458642320657, 'sideways_time_stop': 48, 'sideways_use_sma': False, 'sideways_use_ema': False, 'sideways_use_atr': True, 'sideways_use_adx': True, 'sideways_use_spike': True, 'sideways_rsi_required': True}.
[I 2025-08-31 13:35:27,457] Trial 770 finished with values: [-1000000000.0, 1000000000.0] and parameters: {'p_sma': 38, 'p_std': 36, 'p_atr': 28, 'p_adx': 14, 'rsi_period': 56, 'ema1': 10, 'ema2': 32, 'slip_atr_k': 0.03399859227970275, 'slip_spread_k': 0.4316408893481419, 'spread_hl_frac': 0.019045665596717776, 'bb_std_mult': 2.402969422704536, 'rsi_os': 39, 'rsi_ob': 91, 'vol_spike': 0.01699895835825979, 'adx_thresh': 6.70963942330887, 'atr_min_pct': 0.0281022099089317, 'atr_max_pct': 0.05588912928765312, 'tp_mult': 2.598715555763553, 'tsl_mult': 0.5632479925307701, 'strategy': 'breakout', 'time_stop': 172, 'use_sma': False, 'use_atr': False, 'use_adx': True, 'use_ema': True, 'use_spike': True, 'rsi_required': False, 'edge_k': 0.5423300381632651, 'edge_cap': 0.6423824041130541, 'bull_strategy': 'mean_reversion', 'bull_bb_std_mult': 2.9800389951557587, 'bull_rsi_os': 39, 'bull_rsi_ob': 86, 'bull_adx_thresh': 5.954174787047322, 'bull_atr_min_pct': 0.02142114524165624, 'bull_atr_max_pct': 0.13978916359156088, 'bull_tp_mult': 2.1671272610250814, 'bull_tsl_mult': 0.2280675839469957, 'bull_time_stop': 192, 'bull_use_sma': False, 'bull_use_ema': True, 'bull_use_atr': True, 'bull_use_adx': False, 'bull_use_spike': True, 'bull_rsi_required': True, 'bear_strategy': 'mean_reversion', 'bear_bb_std_mult': 3.2850013331288097, 'bear_rsi_os': 28, 'bear_rsi_ob': 71, 'bear_adx_thresh': 18.076437543055498, 'bear_atr_min_pct': 0.0021984669589522783, 'bear_atr_max_pct': 0.12477692886329272, 'bear_tp_mult': 1.1839985708695262, 'bear_tsl_mult': 0.5470878010569177, 'bear_time_stop': 197, 'bear_use_sma': False, 'bear_use_ema': True, 'bear_use_atr': False, 'bear_use_adx': False, 'bear_use_spike': False, 'bear_rsi_required': True, 'sideways_strategy': 'mean_reversion', 'sideways_bb_std_mult': 2.696678336484466, 'sideways_rsi_os': 31, 'sideways_rsi_ob': 53, 'sideways_adx_thresh': 24.01059832027716, 'sideways_atr_min_pct': 0.003107074648551345, 'sideways_atr_max_pct': 0.14771013726717724, 'sideways_tp_mult': 1.6705038691316954, 'sideways_tsl_mult': 0.8234991437238177, 'sideways_time_stop': 45, 'sideways_use_sma': False, 'sideways_use_ema': True, 'sideways_use_atr': True, 'sideways_use_adx': True, 'sideways_use_spike': True, 'sideways_rsi_required': True}.
