[I 2025-08-31 13:29:47,605] Trial 732 finished with values: [-0.03621220363749311, 0.03609629165784193] and parameters: {'p_sma': 16, 'p_std': 8, 'p_atr': 17, 'p_adx': 30, 'rsi_period': 49, 'ema1': 12, 'ema2': 18, 'slip_atr_k': 0.0331268277053262, 'slip_spread_k': 0.39144104789543094, 'spread_hl_frac': 0.017397907964982248, 'bb_std_mult': 2.344495524632936, 'rsi_os': 41, 'rsi_ob': 90, 'vol_spike': 0.2810325805131765, 'adx_thresh': 6.949158158309479, 'atr_min_pct': 0.02105597269424816, 'atr_max_pct': 0.03143592521359308, 'tp_mult': 2.1675519498243476, 'tsl_mult': 0.649996348563143, 'strategy': 'breakout', 'time_stop': 165, 'use_sma': True, 'use_atr': False, 'use_adx': True, 'use_ema': True, 'use_spike': True, 'rsi_required': False, 'edge_k': 0.46012285444321005, 'edge_cap': 0.35424194681175125, 'bull_strategy': 'mean_reversion', 'bull_bb_std_mult': 2.1962681430929907, 'bull_rsi_os': 40, 'bull_rsi_ob': 59, 'bull_adx_thresh': 18.23453427000864, 'bull_atr_min_pct': 0.015850842443258455, 'bull_atr_max_pct': 0.11473967768292653, 'bull_tp_mult': 2.3268047181243445, 'bull_tsl_mult': 0.2709019009802455, 'bull_time_stop': 237, 'bull_use_sma': True, 'bull_use_ema': True, 'bull_use_atr': True, 'bull_use_adx': False, 'bull_use_spike': True, 'bull_rsi_required': True, 'bear_strategy': 'mean_reversion', 'bear_bb_std_mult': 0.8087382330196575, 'bear_rsi_os': 28, 'bear_rsi_ob': 54, 'bear_adx_thresh': 24.422136084628498, 'bear_atr_min_pct': 6.078241839088845e-05, 'bear_atr_max_pct': 0.08044725171487008, 'bear_tp_mult': 1.1528707657057111, 'bear_tsl_mult': 0.6955870951769606, 'bear_time_stop': 263, 'bear_use_sma': False, 'bear_use_ema': False, 'bear_use_atr': False, 'bear_use_adx': False, 'bear_use_spike': True, 'bear_rsi_required': False, 'sideways_strategy': 'breakout', 'sideways_bb_std_mult': 2.7613553165255906, 'sideways_rsi_os': 27, 'sideways_rsi_ob': 74, 'sideways_adx_thresh': 24.67931902684597, 'sideways_atr_min_pct': 0.028664537244158392, 'sideways_atr_max_pct': 0.14720822000490938, 'sideways_tp_mult': 1.6643371940138167, 'sideways_tsl_mult': 0.8065290417854917, 'sideways_time_stop': 65, 'sideways_use_sma': False, 'sideways_use_ema': False, 'sideways_use_atr': True, 'sideways_use_adx': True, 'sideways_use_spike': False, 'sideways_rsi_required': False}.
[I 2025-08-31 13:29:48,406] Trial 730 finished with values: [-1000000000.0, 1000000000.0] and parameters: {'p_sma': 20, 'p_std': 60, 'p_atr': 18, 'p_adx': 10, 'rsi_period': 49, 'ema1': 24, 'ema2': 20, 'slip_atr_k': 0.03761179802016515, 'slip_spread_k': 0.38964339239322354, 'spread_hl_frac': 0.01694271796336334, 'bb_std_mult': 1.8126357939107909, 'rsi_os': 41, 'rsi_ob': 90, 'vol_spike': 0.027638211809527857, 'adx_thresh': 6.955411607649503, 'atr_min_pct': 0.02094461919976008, 'atr_max_pct': 0.0299774585833759, 'tp_mult': 2.4872169037813467, 'tsl_mult': 0.7265269260773499, 'strategy': 'breakout', 'time_stop': 185, 'use_sma': True, 'use_atr': False, 'use_adx': True, 'use_ema': True, 'use_spike': True, 'rsi_required': False, 'edge_k': 1.8576336256080093, 'edge_cap': 0.6235947320979711, 'bull_strategy': 'mean_reversion', 'bull_bb_std_mult': 2.9557201967910323, 'bull_rsi_os': 32, 'bull_rsi_ob': 84, 'bull_adx_thresh': 18.44019605046786, 'bull_atr_min_pct': 0.021883106978919886, 'bull_atr_max_pct': 0.03914275447446515, 'bull_tp_mult': 2.3198537509133343, 'bull_tsl_mult': 0.416698625003529, 'bull_time_stop': 167, 'bull_use_sma': True, 'bull_use_ema': True, 'bull_use_atr': True, 'bull_use_adx': True, 'bull_use_spike': True, 'bull_rsi_required': True, 'bear_strategy': 'breakout', 'bear_bb_std_mult': 3.4624631918792215, 'bear_rsi_os': 29, 'bear_rsi_ob': 55, 'bear_adx_thresh': 23.2104993575201, 'bear_atr_min_pct': 0.0005829030704987876, 'bear_atr_max_pct': 0.13037154915054358, 'bear_tp_mult': 1.1508140471571984, 'bear_tsl_mult': 0.6572718676108819, 'bear_time_stop': 181, 'bear_use_sma': False, 'bear_use_ema': True, 'bear_use_atr': False, 'bear_use_adx': False, 'bear_use_spike': True, 'bear_rsi_required': True, 'sideways_strategy': 'breakout', 'sideways_bb_std_mult': 3.2044990397102397, 'sideways_rsi_os': 30, 'sideways_rsi_ob': 74, 'sideways_adx_thresh': 24.73348688653758, 'sideways_atr_min_pct': 0.00271163511194813, 'sideways_atr_max_pct': 0.14698260876241007, 'sideways_tp_mult': 1.1406366461481885, 'sideways_tsl_mult': 0.9051412316189975, 'sideways_time_stop': 39, 'sideways_use_sma': False, 'sideways_use_ema': False, 'sideways_use_atr': True, 'sideways_use_adx': True, 'sideways_use_spike': False, 'sideways_rsi_required': False}.
[I 2025-08-31 13:29:48,815] Trial 729 finished with values: [-1000000000.0, 1000000000.0] and parameters: {'p_sma': 8, 'p_std': 8, 'p_atr': 17, 'p_adx': 20, 'rsi_period': 49, 'ema1': 11, 'ema2': 20, 'slip_atr_k': 0.037704587584529235, 'slip_spread_k': 0.7453957347961858, 'spread_hl_frac': 0.018446277590869416, 'bb_std_mult': 1.4316616170166854, 'rsi_os': 41, 'rsi_ob': 90, 'vol_spike': 0.11743138295617461, 'adx_thresh': 7.2347688386762945, 'atr_min_pct': 0.02958396006981167, 'atr_max_pct': 0.04382879516795768, 'tp_mult': 2.417362648426119, 'tsl_mult': 0.6943197481692921, 'strategy': 'breakout', 'time_stop': 183, 'use_sma': True, 'use_atr': False, 'use_adx': True, 'use_ema': True, 'use_spike': True, 'rsi_required': False, 'edge_k': 1.397409034183088, 'edge_cap': 0.6496557806715985, 'bull_strategy': 'mean_reversion', 'bull_bb_std_mult': 0.7651365431091794, 'bull_rsi_os': 6, 'bull_rsi_ob': 84, 'bull_adx_thresh': 18.592279086385552, 'bull_atr_min_pct': 0.0068287179454511494, 'bull_atr_max_pct': 0.12252142292459547, 'bull_tp_mult': 2.297397406654352, 'bull_tsl_mult': 0.8489485444222677, 'bull_time_stop': 170, 'bull_use_sma': True, 'bull_use_ema': True, 'bull_use_atr': True, 'bull_use_adx': True, 'bull_use_spike': True, 'bull_rsi_required': True, 'bear_strategy': 'breakout', 'bear_bb_std_mult': 3.4639975227551316, 'bear_rsi_os': 29, 'bear_rsi_ob': 75, 'bear_adx_thresh': 16.729716515112507, 'bear_atr_min_pct': 5.5541986292647694e-05, 'bear_atr_max_pct': 0.13094755421874546, 'bear_tp_mult': 1.2235550390667707, 'bear_tsl_mult': 0.28417797808663003, 'bear_time_stop': 176, 'bear_use_sma': False, 'bear_use_ema': True, 'bear_use_atr': False, 'bear_use_adx': False, 'bear_use_spike': True, 'bear_rsi_required': True, 'sideways_strategy': 'breakout', 'sideways_bb_std_mult': 2.764251860295493, 'sideways_rsi_os': 30, 'sideways_rsi_ob': 55, 'sideways_adx_thresh': 23.646485104378023, 'sideways_atr_min_pct': 0.011068471732829082, 'sideways_atr_max_pct': 0.14233881562173428, 'sideways_tp_mult': 1.7148887043532113, 'sideways_tsl_mult': 0.950765014973891, 'sideways_time_stop': 43, 'sideways_use_sma': False, 'sideways_use_ema': False, 'sideways_use_atr': True, 'sideways_use_adx': True, 'sideways_use_spike': False, 'sideways_rsi_required': True}.
[I 2025-08-31 13:29:48,902] Trial 731 finished with values: [-1000000000.0, 1000000000.0] and parameters: {'p_sma': 16, 'p_std': 9, 'p_atr': 17, 'p_adx': 12, 'rsi_period': 49, 'ema1': 12, 'ema2': 19, 'slip_atr_k': 0.035842136754587695, 'slip_spread_k': 0.38964447289263426, 'spread_hl_frac': 0.01731559644787615, 'bb_std_mult': 1.8264033466032754, 'rsi_os': 41, 'rsi_ob': 90, 'vol_spike': 0.1905951346809474, 'adx_thresh': 6.9060092314305495, 'atr_min_pct': 0.025489388994680427, 'atr_max_pct': 0.030903578646972865, 'tp_mult': 2.178525140713011, 'tsl_mult': 0.7246664651212996, 'strategy': 'breakout', 'time_stop': 185, 'use_sma': True, 'use_atr': False, 'use_adx': True, 'use_ema': True, 'use_spike': True, 'rsi_required': False, 'edge_k': 1.4137207594759857, 'edge_cap': 0.7015474305159118, 'bull_strategy': 'mean_reversion', 'bull_bb_std_mult': 2.974861721242519, 'bull_rsi_os': 22, 'bull_rsi_ob': 84, 'bull_adx_thresh': 26.86381422968831, 'bull_atr_min_pct': 0.01567297406733177, 'bull_atr_max_pct': 0.1150326158559106, 'bull_tp_mult': 1.988095911823457, 'bull_tsl_mult': 0.2639481221941548, 'bull_time_stop': 173, 'bull_use_sma': True, 'bull_use_ema': True, 'bull_use_atr': True, 'bull_use_adx': True, 'bull_use_spike': True, 'bull_rsi_required': True, 'bear_strategy': 'mean_reversion', 'bear_bb_std_mult': 3.4707986532612356, 'bear_rsi_os': 29, 'bear_rsi_ob': 74, 'bear_adx_thresh': 21.153165737440197, 'bear_atr_min_pct': 0.00011646122714474507, 'bear_atr_max_pct': 0.08087842295734173, 'bear_tp_mult': 1.2338113097173975, 'bear_tsl_mult': 0.9321393985907056, 'bear_time_stop': 202, 'bear_use_sma': False, 'bear_use_ema': False, 'bear_use_atr': False, 'bear_use_adx': False, 'bear_use_spike': True, 'bear_rsi_required': False, 'sideways_strategy': 'breakout', 'sideways_bb_std_mult': 2.7699400555432403, 'sideways_rsi_os': 30, 'sideways_rsi_ob': 67, 'sideways_adx_thresh': 23.626986184078348, 'sideways_atr_min_pct': 0.007628937268270243, 'sideways_atr_max_pct': 0.14656604120905226, 'sideways_tp_mult': 1.6711833288174138, 'sideways_tsl_mult': 0.9080337002368006, 'sideways_time_stop': 13, 'sideways_use_sma': False, 'sideways_use_ema': False, 'sideways_use_atr': True, 'sideways_use_adx': True, 'sideways_use_spike': False, 'sideways_rsi_required': False}.
[I 2025-08-31 13:30:20,972] Trial 733 finished with values: [-0.02406427496445418, 0.02345876500296637] and parameters: {'p_sma': 18, 'p_std': 21, 'p_atr': 14, 'p_adx': 28, 'rsi_period': 31, 'ema1': 11, 'ema2': 20, 'slip_atr_k': 0.03675209977684899, 'slip_spread_k': 0.285949346159699, 'spread_hl_frac': 4.199417451118334e-05, 'bb_std_mult': 3.181327517089831, 'rsi_os': 42, 'rsi_ob': 95, 'vol_spike': 0.02905843346386406, 'adx_thresh': 5.6569988237478155, 'atr_min_pct': 0.025817657276635913, 'atr_max_pct': 0.05181292467719703, 'tp_mult': 2.4869820753850376, 'tsl_mult': 0.974340871325607, 'strategy': 'breakout', 'time_stop': 250, 'use_sma': True, 'use_atr': False, 'use_adx': True, 'use_ema': True, 'use_spike': True, 'rsi_required': False, 'edge_k': 0.5414058904374492, 'edge_cap': 0.6330602246748782, 'bull_strategy': 'mean_reversion', 'bull_bb_std_mult': 2.8695208377623214, 'bull_rsi_os': 48, 'bull_rsi_ob': 90, 'bull_adx_thresh': 18.25048627930297, 'bull_atr_min_pct': 0.021819692458681456, 'bull_atr_max_pct': 0.07376442347235529, 'bull_tp_mult': 2.4786205441279487, 'bull_tsl_mult': 0.7774363590183139, 'bull_time_stop': 165, 'bull_use_sma': True, 'bull_use_ema': False, 'bull_use_atr': True, 'bull_use_adx': True, 'bull_use_spike': True, 'bull_rsi_required': True, 'bear_strategy': 'breakout', 'bear_bb_std_mult': 1.871111127813025, 'bear_rsi_os': 29, 'bear_rsi_ob': 68, 'bear_adx_thresh': 16.658669567412886, 'bear_atr_min_pct': 0.0009599231908924027, 'bear_atr_max_pct': 0.1256171748569011, 'bear_tp_mult': 1.2160205417332892, 'bear_tsl_mult': 0.663529819763287, 'bear_time_stop': 161, 'bear_use_sma': False, 'bear_use_ema': True, 'bear_use_atr': False, 'bear_use_adx': False, 'bear_use_spike': True, 'bear_rsi_required': True, 'sideways_strategy': 'breakout', 'sideways_bb_std_mult': 1.7821204425023804, 'sideways_rsi_os': 30, 'sideways_rsi_ob': 67, 'sideways_adx_thresh': 30.387393854208696, 'sideways_atr_min_pct': 0.003578166670464634, 'sideways_atr_max_pct': 0.14737940508063702, 'sideways_tp_mult': 1.7376659441389455, 'sideways_tsl_mult': 0.8419254016209967, 'sideways_time_stop': 27, 'sideways_use_sma': False, 'sideways_use_ema': False, 'sideways_use_atr': True, 'sideways_use_adx': True, 'sideways_use_spike': False, 'sideways_rsi_required': True}.
[I 2025-08-31 13:30:22,458] Trial 734 finished with values: [-0.04035899580971092, 0.03973522688102142] and parameters: {'p_sma': 17, 'p_std': 18, 'p_atr': 15, 'p_adx': 8, 'rsi_period': 46, 'ema1': 16, 'ema2': 22, 'slip_atr_k': 0.04198330306096308, 'slip_spread_k': 0.4150764394353483, 'spread_hl_frac': 0.01273554108333429, 'bb_std_mult': 3.1730726942035834, 'rsi_os': 53, 'rsi_ob': 93, 'vol_spike': 0.1933902118992863, 'adx_thresh': 5.683020054362741, 'atr_min_pct': 0.029517736184346794, 'atr_max_pct': 0.04646948351485968, 'tp_mult': 2.558830143643691, 'tsl_mult': 0.6614804035353518, 'strategy': 'breakout', 'time_stop': 167, 'use_sma': False, 'use_atr': False, 'use_adx': True, 'use_ema': False, 'use_spike': True, 'rsi_required': False, 'edge_k': 1.3729347955485505, 'edge_cap': 0.6507914656607596, 'bull_strategy': 'mean_reversion', 'bull_bb_std_mult': 2.8845226698084945, 'bull_rsi_os': 7, 'bull_rsi_ob': 88, 'bull_adx_thresh': 17.333287528914575, 'bull_atr_min_pct': 0.023092119824257365, 'bull_atr_max_pct': 0.020004851494173206, 'bull_tp_mult': 2.567375045385318, 'bull_tsl_mult': 0.24206478246553115, 'bull_time_stop': 125, 'bull_use_sma': True, 'bull_use_ema': False, 'bull_use_atr': True, 'bull_use_adx': True, 'bull_use_spike': True, 'bull_rsi_required': True, 'bear_strategy': 'breakout', 'bear_bb_std_mult': 3.5323501507007027, 'bear_rsi_os': 34, 'bear_rsi_ob': 68, 'bear_adx_thresh': 20.491814789160053, 'bear_atr_min_pct': 0.001736537964440111, 'bear_atr_max_pct': 0.07468403807228619, 'bear_tp_mult': 1.220749932643838, 'bear_tsl_mult': 0.9312518501248546, 'bear_time_stop': 203, 'bear_use_sma': False, 'bear_use_ema': True, 'bear_use_atr': False, 'bear_use_adx': False, 'bear_use_spike': True, 'bear_rsi_required': True, 'sideways_strategy': 'breakout', 'sideways_bb_std_mult': 2.674250424106204, 'sideways_rsi_os': 18, 'sideways_rsi_ob': 67, 'sideways_adx_thresh': 31.042349131031465, 'sideways_atr_min_pct': 0.0034902568011293974, 'sideways_atr_max_pct': 0.14252500970047136, 'sideways_tp_mult': 1.8169858760818351, 'sideways_tsl_mult': 0.5559120811784354, 'sideways_time_stop': 11, 'sideways_use_sma': False, 'sideways_use_ema': True, 'sideways_use_atr': True, 'sideways_use_adx': True, 'sideways_use_spike': False, 'sideways_rsi_required': True}.
[I 2025-08-31 13:30:22,748] Trial 735 finished with values: [-1000000000.0, 1000000000.0] and parameters: {'p_sma': 17, 'p_std': 19, 'p_atr': 14, 'p_adx': 8, 'rsi_period': 47, 'ema1': 30, 'ema2': 22, 'slip_atr_k': 0.1646046419182226, 'slip_spread_k': 0.45415125181396837, 'spread_hl_frac': 0.047838498482455714, 'bb_std_mult': 2.109136873569449, 'rsi_os': 9, 'rsi_ob': 95, 'vol_spike': 0.2678331900173771, 'adx_thresh': 11.070988732135648, 'atr_min_pct': 0.02532586595056211, 'atr_max_pct': 0.06125215203339516, 'tp_mult': 2.5546011070250394, 'tsl_mult': 0.44281084613268296, 'strategy': 'breakout', 'time_stop': 249, 'use_sma': False, 'use_atr': False, 'use_adx': True, 'use_ema': False, 'use_spike': True, 'rsi_required': False, 'edge_k': 0.5358793925532105, 'edge_cap': 0.7048967461261714, 'bull_strategy': 'mean_reversion', 'bull_bb_std_mult': 2.8510093587645837, 'bull_rsi_os': 35, 'bull_rsi_ob': 88, 'bull_adx_thresh': 17.29811322520721, 'bull_atr_min_pct': 0.01195788197139692, 'bull_atr_max_pct': 0.020813695084370157, 'bull_tp_mult': 2.600920236756153, 'bull_tsl_mult': 0.6463719040649164, 'bull_time_stop': 127, 'bull_use_sma': True, 'bull_use_ema': False, 'bull_use_atr': True, 'bull_use_adx': True, 'bull_use_spike': True, 'bull_rsi_required': True, 'bear_strategy': 'mean_reversion', 'bear_bb_std_mult': 2.304632936373955, 'bear_rsi_os': 30, 'bear_rsi_ob': 68, 'bear_adx_thresh': 21.272709452498543, 'bear_atr_min_pct': 0.0018010233491240523, 'bear_atr_max_pct': 0.11557913755323285, 'bear_tp_mult': 1.187890093564156, 'bear_tsl_mult': 0.6791061662813386, 'bear_time_stop': 6, 'bear_use_sma': False, 'bear_use_ema': False, 'bear_use_atr': False, 'bear_use_adx': False, 'bear_use_spike': True, 'bear_rsi_required': False, 'sideways_strategy': 'breakout', 'sideways_bb_std_mult': 2.669435789416117, 'sideways_rsi_os': 17, 'sideways_rsi_ob': 67, 'sideways_adx_thresh': 23.85763537678027, 'sideways_atr_min_pct': 0.004087308484891717, 'sideways_atr_max_pct': 0.010144817671743009, 'sideways_tp_mult': 2.3594575296396405, 'sideways_tsl_mult': 0.8454587597842737, 'sideways_time_stop': 27, 'sideways_use_sma': False, 'sideways_use_ema': True, 'sideways_use_atr': True, 'sideways_use_adx': True, 'sideways_use_spike': False, 'sideways_rsi_required': True}.
[I 2025-08-31 13:30:23,042] Trial 736 finished with values: [-0.04949860083286439, 0.04919265445761198] and parameters: {'p_sma': 18, 'p_std': 18, 'p_atr': 14, 'p_adx': 11, 'rsi_period': 17, 'ema1': 16, 'ema2': 18, 'slip_atr_k': 0.04343819439010649, 'slip_spread_k': 0.35622710451497713, 'spread_hl_frac': 0.0009352186631325678, 'bb_std_mult': 3.1784264512030393, 'rsi_os': 19, 'rsi_ob': 94, 'vol_spike': 0.027708419215176652, 'adx_thresh': 5.586494890799855, 'atr_min_pct': 0.015880664420087974, 'atr_max_pct': 0.04758032677665764, 'tp_mult': 1.9640452535069037, 'tsl_mult': 0.7993234145903428, 'strategy': 'breakout', 'time_stop': 193, 'use_sma': False, 'use_atr': False, 'use_adx': True, 'use_ema': False, 'use_spike': True, 'rsi_required': False, 'edge_k': 0.5461984668450849, 'edge_cap': 0.6533720370610077, 'bull_strategy': 'mean_reversion', 'bull_bb_std_mult': 2.8622566419633206, 'bull_rsi_os': 34, 'bull_rsi_ob': 86, 'bull_adx_thresh': 6.471578618785237, 'bull_atr_min_pct': 0.023097693251756323, 'bull_atr_max_pct': 0.14126851868518595, 'bull_tp_mult': 2.5777602393101433, 'bull_tsl_mult': 0.2391998578021451, 'bull_time_stop': 131, 'bull_use_sma': True, 'bull_use_ema': False, 'bull_use_atr': True, 'bull_use_adx': False, 'bull_use_spike': True, 'bull_rsi_required': True, 'bear_strategy': 'breakout', 'bear_bb_std_mult': 2.500879405193765, 'bear_rsi_os': 28, 'bear_rsi_ob': 93, 'bear_adx_thresh': 30.203800739376256, 'bear_atr_min_pct': 0.0011349909784415222, 'bear_atr_max_pct': 0.07102229098921162, 'bear_tp_mult': 1.3140784846698177, 'bear_tsl_mult': 0.8760381153404899, 'bear_time_stop': 294, 'bear_use_sma': False, 'bear_use_ema': True, 'bear_use_atr': False, 'bear_use_adx': False, 'bear_use_spike': True, 'bear_rsi_required': True, 'sideways_strategy': 'breakout', 'sideways_bb_std_mult': 2.6563172635089702, 'sideways_rsi_os': 23, 'sideways_rsi_ob': 66, 'sideways_adx_thresh': 30.356419218145845, 'sideways_atr_min_pct': 0.024917089091916353, 'sideways_atr_max_pct': 0.1447112355616986, 'sideways_tp_mult': 1.962001954415243, 'sideways_tsl_mult': 0.843116932874076, 'sideways_time_stop': 53, 'sideways_use_sma': False, 'sideways_use_ema': True, 'sideways_use_atr': True, 'sideways_use_adx': True, 'sideways_use_spike': True, 'sideways_rsi_required': True}.
[I 2025-08-31 13:30:55,905] Trial 739 finished with values: [-0.09351992786857921, 0.09289338132966314] and parameters: {'p_sma': 39, 'p_std': 23, 'p_atr': 9, 'p_adx': 14, 'rsi_period': 51, 'ema1': 10, 'ema2': 18, 'slip_atr_k': 0.044304140406059095, 'slip_spread_k': 0.345501820283977, 'spread_hl_frac': 0.022928320921027943, 'bb_std_mult': 3.0638898885816612, 'rsi_os': 30, 'rsi_ob': 82, 'vol_spike': 0.22805266359804766, 'adx_thresh': 7.767115486394697, 'atr_min_pct': 0.027783956528201197, 'atr_max_pct': 0.04050705396420703, 'tp_mult': 2.5919366436109654, 'tsl_mult': 0.7679172578957837, 'strategy': 'breakout', 'time_stop': 150, 'use_sma': False, 'use_atr': False, 'use_adx': True, 'use_ema': True, 'use_spike': True, 'rsi_required': False, 'edge_k': 1.6161448940150778, 'edge_cap': 0.24272097190882824, 'bull_strategy': 'mean_reversion', 'bull_bb_std_mult': 1.622839726471995, 'bull_rsi_os': 5, 'bull_rsi_ob': 94, 'bull_adx_thresh': 30.91149962069786, 'bull_atr_min_pct': 0.020849881420522735, 'bull_atr_max_pct': 0.13947492956449462, 'bull_tp_mult': 1.868708779361121, 'bull_tsl_mult': 0.30225127954074255, 'bull_time_stop': 155, 'bull_use_sma': False, 'bull_use_ema': True, 'bull_use_atr': True, 'bull_use_adx': False, 'bull_use_spike': True, 'bull_rsi_required': True, 'bear_strategy': 'breakout', 'bear_bb_std_mult': 3.381229962029101, 'bear_rsi_os': 38, 'bear_rsi_ob': 93, 'bear_adx_thresh': 7.9890380034090445, 'bear_atr_min_pct': 0.001141221202067404, 'bear_atr_max_pct': 0.12682753733039728, 'bear_tp_mult': 1.573350657197646, 'bear_tsl_mult': 0.7227693226874002, 'bear_time_stop': 65, 'bear_use_sma': False, 'bear_use_ema': True, 'bear_use_atr': False, 'bear_use_adx': False, 'bear_use_spike': True, 'bear_rsi_required': True, 'sideways_strategy': 'mean_reversion', 'sideways_bb_std_mult': 2.8244478491262157, 'sideways_rsi_os': 50, 'sideways_rsi_ob': 57, 'sideways_adx_thresh': 23.011209269422345, 'sideways_atr_min_pct': 0.020356622414836347, 'sideways_atr_max_pct': 0.14479653504741638, 'sideways_tp_mult': 2.636902255411326, 'sideways_tsl_mult': 0.8198601197342231, 'sideways_time_stop': 54, 'sideways_use_sma': False, 'sideways_use_ema': False, 'sideways_use_atr': True, 'sideways_use_adx': True, 'sideways_use_spike': True, 'sideways_rsi_required': True}.
