[I 2025-08-31 12:44:26,577] Trial 403 finished with values: [-1000000000.0, 1000000000.0] and parameters: {'p_sma': 18, 'p_std': 23, 'p_atr': 12, 'p_adx': 14, 'rsi_period': 52, 'ema1': 20, 'ema2': 14, 'slip_atr_k': 0.0713743116655022, 'slip_spread_k': 0.39869996588396117, 'spread_hl_frac': 0.015879749927525603, 'bb_std_mult': 2.278013966476813, 'rsi_os': 38, 'rsi_ob': 79, 'vol_spike': 0.02827903280506344, 'adx_thresh': 20.27605859498443, 'atr_min_pct': 0.0016827267114891617, 'atr_max_pct': 0.1246101443262532, 'tp_mult': 2.7630167435962703, 'tsl_mult': 0.08489463522174255, 'strategy': 'breakout', 'time_stop': 173, 'use_sma': False, 'use_atr': True, 'use_adx': False, 'use_ema': True, 'use_spike': False, 'rsi_required': True, 'edge_k': 0.6555384775669224, 'edge_cap': 0.16964109074226275, 'bull_strategy': 'breakout', 'bull_bb_std_mult': 2.546218373330451, 'bull_rsi_os': 7, 'bull_rsi_ob': 49, 'bull_adx_thresh': 20.523241029220383, 'bull_atr_min_pct': 0.019602382651976377, 'bull_atr_max_pct': 0.14680133873165008, 'bull_tp_mult': 1.1969244639615244, 'bull_tsl_mult': 0.18177266078260557, 'bull_time_stop': 297, 'bull_use_sma': True, 'bull_use_ema': True, 'bull_use_atr': False, 'bull_use_adx': True, 'bull_use_spike': False, 'bull_rsi_required': False, 'bear_strategy': 'breakout', 'bear_bb_std_mult': 2.982375543383272, 'bear_rsi_os': 28, 'bear_rsi_ob': 69, 'bear_adx_thresh': 12.842606154985925, 'bear_atr_min_pct': 0.001619316179322059, 'bear_atr_max_pct': 0.14713639308564175, 'bear_tp_mult': 2.916796529797581, 'bear_tsl_mult': 0.7975565653486176, 'bear_time_stop': 204, 'bear_use_sma': True, 'bear_use_ema': True, 'bear_use_atr': True, 'bear_use_adx': True, 'bear_use_spike': True, 'bear_rsi_required': True, 'sideways_strategy': 'mean_reversion', 'sideways_bb_std_mult': 3.17310450268357, 'sideways_rsi_os': 31, 'sideways_rsi_ob': 67, 'sideways_adx_thresh': 26.308189261974842, 'sideways_atr_min_pct': 0.002653803908816717, 'sideways_atr_max_pct': 0.12711263249206337, 'sideways_tp_mult': 1.6171683767261373, 'sideways_tsl_mult': 0.8429911513419569, 'sideways_time_stop': 203, 'sideways_use_sma': True, 'sideways_use_ema': False, 'sideways_use_atr': False, 'sideways_use_adx': False, 'sideways_use_spike': False, 'sideways_rsi_required': True}.
[I 2025-08-31 12:44:26,694] Trial 406 finished with values: [-0.03843320175330922, 0.03824262617668513] and parameters: {'p_sma': 53, 'p_std': 23, 'p_atr': 11, 'p_adx': 13, 'rsi_period': 49, 'ema1': 21, 'ema2': 13, 'slip_atr_k': 0.06469533587158974, 'slip_spread_k': 0.30504765799690503, 'spread_hl_frac': 0.017037781885125742, 'bb_std_mult': 2.386590679765845, 'rsi_os': 38, 'rsi_ob': 79, 'vol_spike': 0.03404122519419921, 'adx_thresh': 18.509821182577802, 'atr_min_pct': 0.018688812377802212, 'atr_max_pct': 0.12026104448171776, 'tp_mult': 2.7583427313151345, 'tsl_mult': 0.09786543214900245, 'strategy': 'breakout', 'time_stop': 174, 'use_sma': False, 'use_atr': True, 'use_adx': False, 'use_ema': True, 'use_spike': False, 'rsi_required': True, 'edge_k': 0.6618716702169108, 'edge_cap': 0.17058895377688238, 'bull_strategy': 'breakout', 'bull_bb_std_mult': 2.6908079853654803, 'bull_rsi_os': 5, 'bull_rsi_ob': 51, 'bull_adx_thresh': 20.7278423972616, 'bull_atr_min_pct': 0.017880507460242737, 'bull_atr_max_pct': 0.1455617695767516, 'bull_tp_mult': 1.3089656775203975, 'bull_tsl_mult': 0.1915527837526994, 'bull_time_stop': 292, 'bull_use_sma': True, 'bull_use_ema': True, 'bull_use_atr': False, 'bull_use_adx': False, 'bull_use_spike': True, 'bull_rsi_required': False, 'bear_strategy': 'breakout', 'bear_bb_std_mult': 3.00260414414002, 'bear_rsi_os': 30, 'bear_rsi_ob': 69, 'bear_adx_thresh': 12.996173795153524, 'bear_atr_min_pct': 0.0013720582220510806, 'bear_atr_max_pct': 0.13032847180129092, 'bear_tp_mult': 2.9295345119356457, 'bear_tsl_mult': 0.7702671897399601, 'bear_time_stop': 201, 'bear_use_sma': True, 'bear_use_ema': True, 'bear_use_atr': True, 'bear_use_adx': True, 'bear_use_spike': True, 'bear_rsi_required': True, 'sideways_strategy': 'mean_reversion', 'sideways_bb_std_mult': 2.8695955026564306, 'sideways_rsi_os': 31, 'sideways_rsi_ob': 67, 'sideways_adx_thresh': 26.272829447758443, 'sideways_atr_min_pct': 0.002529682852197776, 'sideways_atr_max_pct': 0.0848812751111559, 'sideways_tp_mult': 1.6280556630780632, 'sideways_tsl_mult': 0.8587493375698391, 'sideways_time_stop': 204, 'sideways_use_sma': True, 'sideways_use_ema': False, 'sideways_use_atr': False, 'sideways_use_adx': False, 'sideways_use_spike': False, 'sideways_rsi_required': True}.
[I 2025-08-31 12:45:00,580] Trial 410 finished with values: [-1000000000.0, 1000000000.0] and parameters: {'p_sma': 51, 'p_std': 20, 'p_atr': 18, 'p_adx': 17, 'rsi_period': 50, 'ema1': 19, 'ema2': 15, 'slip_atr_k': 0.05228641272885821, 'slip_spread_k': 0.5489384452213295, 'spread_hl_frac': 0.01748047739545359, 'bb_std_mult': 2.138272963471724, 'rsi_os': 38, 'rsi_ob': 78, 'vol_spike': 0.007436774194258259, 'adx_thresh': 19.49554635382665, 'atr_min_pct': 0.01663800704336099, 'atr_max_pct': 0.12029872520028537, 'tp_mult': 2.698686674286571, 'tsl_mult': 0.0008885728477990122, 'strategy': 'breakout', 'time_stop': 165, 'use_sma': False, 'use_atr': True, 'use_adx': False, 'use_ema': True, 'use_spike': False, 'rsi_required': True, 'edge_k': 0.3623837922660219, 'edge_cap': 0.10812596174517392, 'bull_strategy': 'breakout', 'bull_bb_std_mult': 2.7649347830541045, 'bull_rsi_os': 5, 'bull_rsi_ob': 51, 'bull_adx_thresh': 23.407227799192963, 'bull_atr_min_pct': 0.01964107873276508, 'bull_atr_max_pct': 0.14996128653496124, 'bull_tp_mult': 1.1682772328273, 'bull_tsl_mult': 0.17477502393945618, 'bull_time_stop': 278, 'bull_use_sma': True, 'bull_use_ema': True, 'bull_use_atr': True, 'bull_use_adx': True, 'bull_use_spike': True, 'bull_rsi_required': False, 'bear_strategy': 'breakout', 'bear_bb_std_mult': 3.141151703204104, 'bear_rsi_os': 30, 'bear_rsi_ob': 71, 'bear_adx_thresh': 13.934692571154418, 'bear_atr_min_pct': 0.0040909491335543325, 'bear_atr_max_pct': 0.12531179231651177, 'bear_tp_mult': 2.905586877113395, 'bear_tsl_mult': 0.7395807054353182, 'bear_time_stop': 192, 'bear_use_sma': True, 'bear_use_ema': True, 'bear_use_atr': True, 'bear_use_adx': True, 'bear_use_spike': False, 'bear_rsi_required': True, 'sideways_strategy': 'breakout', 'sideways_bb_std_mult': 2.279952697526964, 'sideways_rsi_os': 30, 'sideways_rsi_ob': 65, 'sideways_adx_thresh': 26.968408286130877, 'sideways_atr_min_pct': 0.00351574596715392, 'sideways_atr_max_pct': 0.13068753480448594, 'sideways_tp_mult': 1.5690582560979804, 'sideways_tsl_mult': 0.8749527146421788, 'sideways_time_stop': 196, 'sideways_use_sma': True, 'sideways_use_ema': False, 'sideways_use_atr': False, 'sideways_use_adx': True, 'sideways_use_spike': True, 'sideways_rsi_required': False}.
[I 2025-08-31 12:45:01,105] Trial 407 finished with values: [-1000000000.0, 1000000000.0] and parameters: {'p_sma': 13, 'p_std': 22, 'p_atr': 11, 'p_adx': 13, 'rsi_period': 51, 'ema1': 19, 'ema2': 14, 'slip_atr_k': 0.051469758442374586, 'slip_spread_k': 0.5718973974472521, 'spread_hl_frac': 0.016930954650034923, 'bb_std_mult': 2.16983969959192, 'rsi_os': 39, 'rsi_ob': 79, 'vol_spike': 0.018519201742855974, 'adx_thresh': 20.400287329340816, 'atr_min_pct': 0.0010003214835052007, 'atr_max_pct': 0.12497995241251283, 'tp_mult': 2.731694602244257, 'tsl_mult': 0.9362847792532272, 'strategy': 'breakout', 'time_stop': 173, 'use_sma': False, 'use_atr': True, 'use_adx': False, 'use_ema': True, 'use_spike': False, 'rsi_required': True, 'edge_k': 0.14546410266628973, 'edge_cap': 0.8276101605093197, 'bull_strategy': 'breakout', 'bull_bb_std_mult': 2.7760886403380507, 'bull_rsi_os': 5, 'bull_rsi_ob': 51, 'bull_adx_thresh': 24.130551719719723, 'bull_atr_min_pct': 0.018052936105423963, 'bull_atr_max_pct': 0.1443424209378213, 'bull_tp_mult': 1.1872240524864008, 'bull_tsl_mult': 0.1974067289864263, 'bull_time_stop': 292, 'bull_use_sma': True, 'bull_use_ema': True, 'bull_use_atr': False, 'bull_use_adx': True, 'bull_use_spike': True, 'bull_rsi_required': False, 'bear_strategy': 'breakout', 'bear_bb_std_mult': 3.131524500895888, 'bear_rsi_os': 28, 'bear_rsi_ob': 71, 'bear_adx_thresh': 13.78271864082632, 'bear_atr_min_pct': 0.003984304491153103, 'bear_atr_max_pct': 0.1300913892940131, 'bear_tp_mult': 2.9101852150437377, 'bear_tsl_mult': 0.7899202588692626, 'bear_time_stop': 200, 'bear_use_sma': True, 'bear_use_ema': True, 'bear_use_atr': True, 'bear_use_adx': True, 'bear_use_spike': False, 'bear_rsi_required': True, 'sideways_strategy': 'breakout', 'sideways_bb_std_mult': 2.8470438281673665, 'sideways_rsi_os': 31, 'sideways_rsi_ob': 67, 'sideways_adx_thresh': 27.789004077337633, 'sideways_atr_min_pct': 0.0025113184030146783, 'sideways_atr_max_pct': 0.13039221081896327, 'sideways_tp_mult': 1.6388548045764157, 'sideways_tsl_mult': 0.8703471354408043, 'sideways_time_stop': 203, 'sideways_use_sma': True, 'sideways_use_ema': False, 'sideways_use_atr': False, 'sideways_use_adx': True, 'sideways_use_spike': False, 'sideways_rsi_required': True}.
[I 2025-08-31 12:45:01,692] Trial 409 finished with values: [-0.00742879135156016, 0.010536131082950874] and parameters: {'p_sma': 53, 'p_std': 20, 'p_atr': 11, 'p_adx': 12, 'rsi_period': 51, 'ema1': 19, 'ema2': 15, 'slip_atr_k': 0.05032285509048363, 'slip_spread_k': 0.3012013462207991, 'spread_hl_frac': 0.01737454132878168, 'bb_std_mult': 2.208317076199237, 'rsi_os': 38, 'rsi_ob': 78, 'vol_spike': 0.03460827283040429, 'adx_thresh': 19.410051666572755, 'atr_min_pct': 3.140013263627003e-05, 'atr_max_pct': 0.11930802511080185, 'tp_mult': 2.688882245529632, 'tsl_mult': 0.055707165168167566, 'strategy': 'breakout', 'time_stop': 173, 'use_sma': False, 'use_atr': True, 'use_adx': False, 'use_ema': True, 'use_spike': False, 'rsi_required': True, 'edge_k': 1.3800693551312084, 'edge_cap': 0.8312001552664434, 'bull_strategy': 'breakout', 'bull_bb_std_mult': 2.7701574135231244, 'bull_rsi_os': 5, 'bull_rsi_ob': 51, 'bull_adx_thresh': 23.684174281159997, 'bull_atr_min_pct': 0.01773423074302645, 'bull_atr_max_pct': 0.1499635390631647, 'bull_tp_mult': 1.481748791485612, 'bull_tsl_mult': 0.16498626154214513, 'bull_time_stop': 292, 'bull_use_sma': True, 'bull_use_ema': True, 'bull_use_atr': True, 'bull_use_adx': True, 'bull_use_spike': True, 'bull_rsi_required': False, 'bear_strategy': 'breakout', 'bear_bb_std_mult': 3.0804916638513955, 'bear_rsi_os': 30, 'bear_rsi_ob': 71, 'bear_adx_thresh': 13.960898557944367, 'bear_atr_min_pct': 0.004037380077169573, 'bear_atr_max_pct': 0.1355189417687244, 'bear_tp_mult': 2.989501402571556, 'bear_tsl_mult': 0.7354245814988181, 'bear_time_stop': 197, 'bear_use_sma': True, 'bear_use_ema': True, 'bear_use_atr': True, 'bear_use_adx': True, 'bear_use_spike': False, 'bear_rsi_required': True, 'sideways_strategy': 'breakout', 'sideways_bb_std_mult': 2.855045167092366, 'sideways_rsi_os': 31, 'sideways_rsi_ob': 65, 'sideways_adx_thresh': 27.730300434650893, 'sideways_atr_min_pct': 0.0024113777524462626, 'sideways_atr_max_pct': 0.13048152709331792, 'sideways_tp_mult': 1.5734845968142486, 'sideways_tsl_mult': 0.871789161170496, 'sideways_time_stop': 134, 'sideways_use_sma': True, 'sideways_use_ema': False, 'sideways_use_atr': False, 'sideways_use_adx': True, 'sideways_use_spike': True, 'sideways_rsi_required': False}.
[I 2025-08-31 12:45:01,693] Trial 408 finished with values: [-0.008873209520224745, 0.010694578624899162] and parameters: {'p_sma': 53, 'p_std': 23, 'p_atr': 21, 'p_adx': 17, 'rsi_period': 49, 'ema1': 19, 'ema2': 15, 'slip_atr_k': 0.06417458875282503, 'slip_spread_k': 0.5528697776006726, 'spread_hl_frac': 0.017398608417106828, 'bb_std_mult': 2.151755409222542, 'rsi_os': 38, 'rsi_ob': 78, 'vol_spike': 0.03286248427203565, 'adx_thresh': 18.81708069669534, 'atr_min_pct': 0.011256393299186611, 'atr_max_pct': 0.11989225499837133, 'tp_mult': 2.685693064233105, 'tsl_mult': 0.0007395108520716169, 'strategy': 'breakout', 'time_stop': 176, 'use_sma': False, 'use_atr': True, 'use_adx': False, 'use_ema': True, 'use_spike': False, 'rsi_required': True, 'edge_k': 1.9828691803191876, 'edge_cap': 0.17476682553177042, 'bull_strategy': 'breakout', 'bull_bb_std_mult': 2.5367451420149236, 'bull_rsi_os': 5, 'bull_rsi_ob': 51, 'bull_adx_thresh': 23.361446272384704, 'bull_atr_min_pct': 0.017657189975547334, 'bull_atr_max_pct': 0.1474809578223927, 'bull_tp_mult': 1.4872155187039147, 'bull_tsl_mult': 0.20881201737076036, 'bull_time_stop': 292, 'bull_use_sma': True, 'bull_use_ema': True, 'bull_use_atr': True, 'bull_use_adx': True, 'bull_use_spike': True, 'bull_rsi_required': False, 'bear_strategy': 'breakout', 'bear_bb_std_mult': 3.1536284341450616, 'bear_rsi_os': 30, 'bear_rsi_ob': 71, 'bear_adx_thresh': 13.908684418947608, 'bear_atr_min_pct': 0.0030229759674423396, 'bear_atr_max_pct': 0.13626248196917953, 'bear_tp_mult': 2.9073593745654764, 'bear_tsl_mult': 0.7969120291437529, 'bear_time_stop': 199, 'bear_use_sma': True, 'bear_use_ema': True, 'bear_use_atr': True, 'bear_use_adx': True, 'bear_use_spike': False, 'bear_rsi_required': True, 'sideways_strategy': 'breakout', 'sideways_bb_std_mult': 2.9602696007811486, 'sideways_rsi_os': 31, 'sideways_rsi_ob': 67, 'sideways_adx_thresh': 28.06329052493978, 'sideways_atr_min_pct': 0.0023847539954422125, 'sideways_atr_max_pct': 0.13107759459274942, 'sideways_tp_mult': 1.5811306366276916, 'sideways_tsl_mult': 0.87520650881825, 'sideways_time_stop': 199, 'sideways_use_sma': True, 'sideways_use_ema': False, 'sideways_use_atr': False, 'sideways_use_adx': True, 'sideways_use_spike': True, 'sideways_rsi_required': True}.
[I 2025-08-31 12:45:33,901] Trial 411 finished with values: [-1000000000.0, 1000000000.0] and parameters: {'p_sma': 24, 'p_std': 60, 'p_atr': 21, 'p_adx': 17, 'rsi_period': 51, 'ema1': 19, 'ema2': 15, 'slip_atr_k': 0.058340268525565064, 'slip_spread_k': 0.4907108105760619, 'spread_hl_frac': 0.015124938788166361, 'bb_std_mult': 2.193634324023224, 'rsi_os': 39, 'rsi_ob': 78, 'vol_spike': 0.034513665268734686, 'adx_thresh': 19.57925942858444, 'atr_min_pct': 0.0008897685474507243, 'atr_max_pct': 0.12216582186884675, 'tp_mult': 2.6814241315600085, 'tsl_mult': 0.048150134814916354, 'strategy': 'breakout', 'time_stop': 179, 'use_sma': False, 'use_atr': True, 'use_adx': False, 'use_ema': True, 'use_spike': False, 'rsi_required': True, 'edge_k': 0.7086238927253484, 'edge_cap': 0.6388203352951308, 'bull_strategy': 'mean_reversion', 'bull_bb_std_mult': 2.757403641177775, 'bull_rsi_os': 7, 'bull_rsi_ob': 51, 'bull_adx_thresh': 24.93362753407412, 'bull_atr_min_pct': 0.019964927937506396, 'bull_atr_max_pct': 0.14162303933130155, 'bull_tp_mult': 1.3874612888512812, 'bull_tsl_mult': 0.2039404283402421, 'bull_time_stop': 289, 'bull_use_sma': False, 'bull_use_ema': True, 'bull_use_atr': False, 'bull_use_adx': True, 'bull_use_spike': False, 'bull_rsi_required': False, 'bear_strategy': 'breakout', 'bear_bb_std_mult': 3.0794757765746126, 'bear_rsi_os': 29, 'bear_rsi_ob': 50, 'bear_adx_thresh': 13.479982463703807, 'bear_atr_min_pct': 0.002936731318745899, 'bear_atr_max_pct': 0.13543670463415003, 'bear_tp_mult': 2.979716417853873, 'bear_tsl_mult': 0.8227707796243491, 'bear_time_stop': 196, 'bear_use_sma': True, 'bear_use_ema': True, 'bear_use_atr': True, 'bear_use_adx': True, 'bear_use_spike': False, 'bear_rsi_required': True, 'sideways_strategy': 'breakout', 'sideways_bb_std_mult': 2.613808749944672, 'sideways_rsi_os': 31, 'sideways_rsi_ob': 66, 'sideways_adx_thresh': 27.52937644418798, 'sideways_atr_min_pct': 0.004201956383230681, 'sideways_atr_max_pct': 0.04606515973545382, 'sideways_tp_mult': 1.555261175350187, 'sideways_tsl_mult': 0.9006628989367074, 'sideways_time_stop': 132, 'sideways_use_sma': False, 'sideways_use_ema': False, 'sideways_use_atr': False, 'sideways_use_adx': True, 'sideways_use_spike': False, 'sideways_rsi_required': True}.
[I 2025-08-31 12:45:35,424] Trial 414 finished with values: [-1000000000.0, 1000000000.0] and parameters: {'p_sma': 50, 'p_std': 26, 'p_atr': 12, 'p_adx': 15, 'rsi_period': 54, 'ema1': 20, 'ema2': 15, 'slip_atr_k': 0.05020366578111029, 'slip_spread_k': 0.3674719447820931, 'spread_hl_frac': 0.015152600741957315, 'bb_std_mult': 2.3165459036212903, 'rsi_os': 38, 'rsi_ob': 78, 'vol_spike': 0.04333712858841217, 'adx_thresh': 17.51298180779839, 'atr_min_pct': 0.011199765137982065, 'atr_max_pct': 0.1218103208125113, 'tp_mult': 2.6711791316815416, 'tsl_mult': 0.037065725417011516, 'strategy': 'breakout', 'time_stop': 180, 'use_sma': False, 'use_atr': True, 'use_adx': False, 'use_ema': True, 'use_spike': False, 'rsi_required': True, 'edge_k': 1.3848033282446, 'edge_cap': 0.19734280959707912, 'bull_strategy': 'breakout', 'bull_bb_std_mult': 2.762251337481736, 'bull_rsi_os': 7, 'bull_rsi_ob': 48, 'bull_adx_thresh': 21.832839718295364, 'bull_atr_min_pct': 0.018918113229825582, 'bull_atr_max_pct': 0.1479614290754221, 'bull_tp_mult': 1.1094210546649266, 'bull_tsl_mult': 0.21941523370960703, 'bull_time_stop': 282, 'bull_use_sma': True, 'bull_use_ema': True, 'bull_use_atr': True, 'bull_use_adx': True, 'bull_use_spike': False, 'bull_rsi_required': False, 'bear_strategy': 'breakout', 'bear_bb_std_mult': 3.0988216182426056, 'bear_rsi_os': 29, 'bear_rsi_ob': 86, 'bear_adx_thresh': 15.675049704365838, 'bear_atr_min_pct': 0.002858385279831084, 'bear_atr_max_pct': 0.13575468930402296, 'bear_tp_mult': 2.970955886003555, 'bear_tsl_mult': 0.7433164913073245, 'bear_time_stop': 196, 'bear_use_sma': True, 'bear_use_ema': True, 'bear_use_atr': True, 'bear_use_adx': True, 'bear_use_spike': True, 'bear_rsi_required': True, 'sideways_strategy': 'breakout', 'sideways_bb_std_mult': 3.0570668323494226, 'sideways_rsi_os': 29, 'sideways_rsi_ob': 66, 'sideways_adx_thresh': 25.440430985915544, 'sideways_atr_min_pct': 0.0041139917504658, 'sideways_atr_max_pct': 0.13354422285998396, 'sideways_tp_mult': 1.552528613071002, 'sideways_tsl_mult': 0.8898624099990033, 'sideways_time_stop': 221, 'sideways_use_sma': False, 'sideways_use_ema': False, 'sideways_use_atr': False, 'sideways_use_adx': False, 'sideways_use_spike': True, 'sideways_rsi_required': False}.
[I 2025-08-31 12:45:35,458] Trial 412 finished with values: [-1000000000.0, 1000000000.0] and parameters: {'p_sma': 50, 'p_std': 60, 'p_atr': 13, 'p_adx': 17, 'rsi_period': 54, 'ema1': 20, 'ema2': 15, 'slip_atr_k': 0.059446907099245765, 'slip_spread_k': 0.4486609776097067, 'spread_hl_frac': 0.015039641672197799, 'bb_std_mult': 2.2375093087935407, 'rsi_os': 38, 'rsi_ob': 78, 'vol_spike': 0.032727261388208286, 'adx_thresh': 19.086716490293366, 'atr_min_pct': 0.020584169941537243, 'atr_max_pct': 0.11840729174349106, 'tp_mult': 2.67728469556033, 'tsl_mult': 0.0579177032945824, 'strategy': 'breakout', 'time_stop': 183, 'use_sma': False, 'use_atr': True, 'use_adx': True, 'use_ema': True, 'use_spike': False, 'rsi_required': True, 'edge_k': 0.6961946208057287, 'edge_cap': 0.6700324746475425, 'bull_strategy': 'mean_reversion', 'bull_bb_std_mult': 2.7452987139751226, 'bull_rsi_os': 7, 'bull_rsi_ob': 48, 'bull_adx_thresh': 24.702756255390028, 'bull_atr_min_pct': 0.01896527947345798, 'bull_atr_max_pct': 0.14771615587427198, 'bull_tp_mult': 1.4140529363346954, 'bull_tsl_mult': 0.20319397552718926, 'bull_time_stop': 283, 'bull_use_sma': False, 'bull_use_ema': True, 'bull_use_atr': True, 'bull_use_adx': True, 'bull_use_spike': False, 'bull_rsi_required': False, 'bear_strategy': 'mean_reversion', 'bear_bb_std_mult': 3.0566485515707726, 'bear_rsi_os': 29, 'bear_rsi_ob': 87, 'bear_adx_thresh': 13.538978190329118, 'bear_atr_min_pct': 0.0029648208475748865, 'bear_atr_max_pct': 0.13372868056594384, 'bear_tp_mult': 2.998379116949682, 'bear_tsl_mult': 0.8485553275843362, 'bear_time_stop': 195, 'bear_use_sma': True, 'bear_use_ema': True, 'bear_use_atr': True, 'bear_use_adx': True, 'bear_use_spike': True, 'bear_rsi_required': True, 'sideways_strategy': 'breakout', 'sideways_bb_std_mult': 2.9922019183456268, 'sideways_rsi_os': 29, 'sideways_rsi_ob': 68, 'sideways_adx_thresh': 27.9705203365373, 'sideways_atr_min_pct': 0.0038268665947815287, 'sideways_atr_max_pct': 0.1343731164552224, 'sideways_tp_mult': 1.5692997184616257, 'sideways_tsl_mult': 0.9046743213703881, 'sideways_time_stop': 221, 'sideways_use_sma': False, 'sideways_use_ema': False, 'sideways_use_atr': False, 'sideways_use_adx': False, 'sideways_use_spike': True, 'sideways_rsi_required': False}.
