[I 2025-08-31 12:58:58,677] Trial 513 finished with values: [-0.025442968544285738, 0.025098854031087157] and parameters: {'p_sma': 52, 'p_std': 24, 'p_atr': 23, 'p_adx': 14, 'rsi_period': 42, 'ema1': 25, 'ema2': 17, 'slip_atr_k': 0.05522172999844918, 'slip_spread_k': 0.44626071292465747, 'spread_hl_frac': 0.045010641471799825, 'bb_std_mult': 2.106111598650649, 'rsi_os': 35, 'rsi_ob': 90, 'vol_spike': 0.03420128642569401, 'adx_thresh': 19.540774280680413, 'atr_min_pct': 0.001290405487183645, 'atr_max_pct': 0.035601214365491844, 'tp_mult': 2.654435941034823, 'tsl_mult': 0.7501007938999302, 'strategy': 'breakout', 'time_stop': 273, 'use_sma': False, 'use_atr': True, 'use_adx': False, 'use_ema': True, 'use_spike': True, 'rsi_required': False, 'edge_k': 1.0123459977994467, 'edge_cap': 0.7616178845359893, 'bull_strategy': 'breakout', 'bull_bb_std_mult': 2.3069084793067365, 'bull_rsi_os': 7, 'bull_rsi_ob': 72, 'bull_adx_thresh': 16.362288655948173, 'bull_atr_min_pct': 0.019193217424864767, 'bull_atr_max_pct': 0.0183068439324066, 'bull_tp_mult': 1.2833755758434209, 'bull_tsl_mult': 0.19387390460819534, 'bull_time_stop': 125, 'bull_use_sma': False, 'bull_use_ema': True, 'bull_use_atr': False, 'bull_use_adx': False, 'bull_use_spike': False, 'bull_rsi_required': False, 'bear_strategy': 'mean_reversion', 'bear_bb_std_mult': 2.140957003634028, 'bear_rsi_os': 31, 'bear_rsi_ob': 91, 'bear_adx_thresh': 14.174760834874526, 'bear_atr_min_pct': 0.019316021583850807, 'bear_atr_max_pct': 0.1425562813942739, 'bear_tp_mult': 1.3466473114963264, 'bear_tsl_mult': 0.5657836793215055, 'bear_time_stop': 188, 'bear_use_sma': False, 'bear_use_ema': True, 'bear_use_atr': False, 'bear_use_adx': False, 'bear_use_spike': True, 'bear_rsi_required': True, 'sideways_strategy': 'breakout', 'sideways_bb_std_mult': 0.6437906806922964, 'sideways_rsi_os': 43, 'sideways_rsi_ob': 67, 'sideways_adx_thresh': 26.354158711489088, 'sideways_atr_min_pct': 0.0029912039995166964, 'sideways_atr_max_pct': 0.093763213482596, 'sideways_tp_mult': 1.2196322981834462, 'sideways_tsl_mult': 0.17510887664277142, 'sideways_time_stop': 200, 'sideways_use_sma': True, 'sideways_use_ema': False, 'sideways_use_atr': True, 'sideways_use_adx': False, 'sideways_use_spike': True, 'sideways_rsi_required': False}.
[I 2025-08-31 12:59:31,558] Trial 517 finished with values: [-1000000000.0, 1000000000.0] and parameters: {'p_sma': 24, 'p_std': 46, 'p_atr': 16, 'p_adx': 24, 'rsi_period': 50, 'ema1': 8, 'ema2': 27, 'slip_atr_k': 0.05013859977670294, 'slip_spread_k': 0.4207312373616843, 'spread_hl_frac': 0.014512653185861542, 'bb_std_mult': 3.3114659555827366, 'rsi_os': 40, 'rsi_ob': 78, 'vol_spike': 0.02298032569818535, 'adx_thresh': 10.899327097961947, 'atr_min_pct': 0.022143382666396767, 'atr_max_pct': 0.04058711500292683, 'tp_mult': 2.2336957316422135, 'tsl_mult': 0.10517338478436106, 'strategy': 'breakout', 'time_stop': 188, 'use_sma': False, 'use_atr': True, 'use_adx': False, 'use_ema': True, 'use_spike': False, 'rsi_required': True, 'edge_k': 1.7297267784002572, 'edge_cap': 0.7529379622943119, 'bull_strategy': 'breakout', 'bull_bb_std_mult': 2.148497523551628, 'bull_rsi_os': 7, 'bull_rsi_ob': 90, 'bull_adx_thresh': 18.318437664962172, 'bull_atr_min_pct': 0.019960677497111647, 'bull_atr_max_pct': 0.14998229999442061, 'bull_tp_mult': 2.175199207164742, 'bull_tsl_mult': 0.22373259968441653, 'bull_time_stop': 273, 'bull_use_sma': True, 'bull_use_ema': True, 'bull_use_atr': False, 'bull_use_adx': True, 'bull_use_spike': False, 'bull_rsi_required': False, 'bear_strategy': 'breakout', 'bear_bb_std_mult': 3.1081597098524076, 'bear_rsi_os': 29, 'bear_rsi_ob': 95, 'bear_adx_thresh': 15.249924602539199, 'bear_atr_min_pct': 0.0024548545624536256, 'bear_atr_max_pct': 0.1340175735400541, 'bear_tp_mult': 2.6484367205707597, 'bear_tsl_mult': 0.7477966581553815, 'bear_time_stop': 140, 'bear_use_sma': True, 'bear_use_ema': True, 'bear_use_atr': True, 'bear_use_adx': True, 'bear_use_spike': True, 'bear_rsi_required': True, 'sideways_strategy': 'breakout', 'sideways_bb_std_mult': 1.235715553719373, 'sideways_rsi_os': 32, 'sideways_rsi_ob': 69, 'sideways_adx_thresh': 26.988622866527464, 'sideways_atr_min_pct': 0.003985891635933443, 'sideways_atr_max_pct': 0.13229413646347768, 'sideways_tp_mult': 1.5302244230140483, 'sideways_tsl_mult': 0.9073836810112669, 'sideways_time_stop': 251, 'sideways_use_sma': True, 'sideways_use_ema': False, 'sideways_use_atr': False, 'sideways_use_adx': False, 'sideways_use_spike': False, 'sideways_rsi_required': True}.
[I 2025-08-31 12:59:31,969] Trial 514 finished with values: [-1000000000.0, 1000000000.0] and parameters: {'p_sma': 55, 'p_std': 42, 'p_atr': 13, 'p_adx': 16, 'rsi_period': 59, 'ema1': 20, 'ema2': 17, 'slip_atr_k': 0.05543924004131827, 'slip_spread_k': 0.00015707985162699556, 'spread_hl_frac': 0.02299141028891276, 'bb_std_mult': 2.727621709477367, 'rsi_os': 40, 'rsi_ob': 78, 'vol_spike': 0.044111760653249274, 'adx_thresh': 19.612165575296594, 'atr_min_pct': 0.0012213898347034383, 'atr_max_pct': 0.03526102439924998, 'tp_mult': 2.6377645910454457, 'tsl_mult': 0.10779998967162491, 'strategy': 'breakout', 'time_stop': 187, 'use_sma': False, 'use_atr': True, 'use_adx': False, 'use_ema': True, 'use_spike': True, 'rsi_required': False, 'edge_k': 1.7199728892930506, 'edge_cap': 0.7043935911763365, 'bull_strategy': 'breakout', 'bull_bb_std_mult': 2.1561186474017306, 'bull_rsi_os': 23, 'bull_rsi_ob': 49, 'bull_adx_thresh': 33.117318235334835, 'bull_atr_min_pct': 0.02003935364778263, 'bull_atr_max_pct': 0.14789267518425406, 'bull_tp_mult': 1.2819447911024493, 'bull_tsl_mult': 0.09339196938324895, 'bull_time_stop': 300, 'bull_use_sma': False, 'bull_use_ema': True, 'bull_use_atr': False, 'bull_use_adx': False, 'bull_use_spike': False, 'bull_rsi_required': False, 'bear_strategy': 'mean_reversion', 'bear_bb_std_mult': 2.1350593568892604, 'bear_rsi_os': 31, 'bear_rsi_ob': 83, 'bear_adx_thresh': 13.098647541141398, 'bear_atr_min_pct': 0.008536714556820868, 'bear_atr_max_pct': 0.1442395974477318, 'bear_tp_mult': 2.840894517535113, 'bear_tsl_mult': 0.8133524741818547, 'bear_time_stop': 203, 'bear_use_sma': False, 'bear_use_ema': True, 'bear_use_atr': False, 'bear_use_adx': False, 'bear_use_spike': True, 'bear_rsi_required': True, 'sideways_strategy': 'breakout', 'sideways_bb_std_mult': 2.689933921700193, 'sideways_rsi_os': 32, 'sideways_rsi_ob': 67, 'sideways_adx_thresh': 26.173196362021393, 'sideways_atr_min_pct': 0.0039039481324637743, 'sideways_atr_max_pct': 0.13258108504323363, 'sideways_tp_mult': 1.5509050398594681, 'sideways_tsl_mult': 0.9070453423381697, 'sideways_time_stop': 201, 'sideways_use_sma': True, 'sideways_use_ema': False, 'sideways_use_atr': True, 'sideways_use_adx': False, 'sideways_use_spike': True, 'sideways_rsi_required': False}.
[I 2025-08-31 12:59:32,075] Trial 516 finished with values: [-1000000000.0, 1000000000.0] and parameters: {'p_sma': 29, 'p_std': 42, 'p_atr': 13, 'p_adx': 16, 'rsi_period': 42, 'ema1': 25, 'ema2': 17, 'slip_atr_k': 0.23467867436875972, 'slip_spread_k': 0.42193447932417566, 'spread_hl_frac': 0.014778064695335377, 'bb_std_mult': 2.7266854502745854, 'rsi_os': 35, 'rsi_ob': 89, 'vol_spike': 0.03330727454048259, 'adx_thresh': 19.85374504361574, 'atr_min_pct': 0.021935532865982415, 'atr_max_pct': 0.12527513440602653, 'tp_mult': 2.651713256572747, 'tsl_mult': 0.06885648248371858, 'strategy': 'breakout', 'time_stop': 187, 'use_sma': False, 'use_atr': True, 'use_adx': False, 'use_ema': True, 'use_spike': True, 'rsi_required': True, 'edge_k': 0.7274116032604179, 'edge_cap': 0.7567906739329616, 'bull_strategy': 'breakout', 'bull_bb_std_mult': 2.771196058685751, 'bull_rsi_os': 7, 'bull_rsi_ob': 49, 'bull_adx_thresh': 17.465719074417894, 'bull_atr_min_pct': 0.018580173138223646, 'bull_atr_max_pct': 0.018427876569029125, 'bull_tp_mult': 1.289324976185425, 'bull_tsl_mult': 0.6708262631356124, 'bull_time_stop': 291, 'bull_use_sma': True, 'bull_use_ema': True, 'bull_use_atr': False, 'bull_use_adx': True, 'bull_use_spike': False, 'bull_rsi_required': False, 'bear_strategy': 'mean_reversion', 'bear_bb_std_mult': 3.096358067758899, 'bear_rsi_os': 29, 'bear_rsi_ob': 69, 'bear_adx_thresh': 15.20559674584372, 'bear_atr_min_pct': 0.008436834861890686, 'bear_atr_max_pct': 0.023643669483958712, 'bear_tp_mult': 1.284579546884517, 'bear_tsl_mult': 0.8157160485606885, 'bear_time_stop': 188, 'bear_use_sma': True, 'bear_use_ema': True, 'bear_use_atr': False, 'bear_use_adx': False, 'bear_use_spike': True, 'bear_rsi_required': True, 'sideways_strategy': 'breakout', 'sideways_bb_std_mult': 2.7121756492858644, 'sideways_rsi_os': 32, 'sideways_rsi_ob': 69, 'sideways_adx_thresh': 26.340250222615452, 'sideways_atr_min_pct': 0.003838428762528775, 'sideways_atr_max_pct': 0.04476722252430898, 'sideways_tp_mult': 1.1828488790259555, 'sideways_tsl_mult': 0.9077324645324274, 'sideways_time_stop': 250, 'sideways_use_sma': True, 'sideways_use_ema': False, 'sideways_use_atr': True, 'sideways_use_adx': False, 'sideways_use_spike': False, 'sideways_rsi_required': True}.
[I 2025-08-31 12:59:32,277] Trial 515 finished with values: [-1000000000.0, 1000000000.0] and parameters: {'p_sma': 11, 'p_std': 52, 'p_atr': 13, 'p_adx': 16, 'rsi_period': 47, 'ema1': 29, 'ema2': 16, 'slip_atr_k': 0.2347002469064682, 'slip_spread_k': 0.42049377512857244, 'spread_hl_frac': 0.014723758160166626, 'bb_std_mult': 0.6856980293043617, 'rsi_os': 40, 'rsi_ob': 78, 'vol_spike': 0.04569843113919776, 'adx_thresh': 19.621965839553805, 'atr_min_pct': 0.0012386044984366794, 'atr_max_pct': 0.11979507262553565, 'tp_mult': 2.662124422676022, 'tsl_mult': 0.05179557969833494, 'strategy': 'breakout', 'time_stop': 243, 'use_sma': False, 'use_atr': True, 'use_adx': False, 'use_ema': True, 'use_spike': True, 'rsi_required': False, 'edge_k': 0.7360580016573988, 'edge_cap': 0.756865191965667, 'bull_strategy': 'breakout', 'bull_bb_std_mult': 1.6610417628160588, 'bull_rsi_os': 7, 'bull_rsi_ob': 48, 'bull_adx_thresh': 16.313433235150647, 'bull_atr_min_pct': 0.01971349958072688, 'bull_atr_max_pct': 0.014544548144493727, 'bull_tp_mult': 2.1934288210025445, 'bull_tsl_mult': 0.9585863019672873, 'bull_time_stop': 26, 'bull_use_sma': False, 'bull_use_ema': True, 'bull_use_atr': False, 'bull_use_adx': False, 'bull_use_spike': False, 'bull_rsi_required': False, 'bear_strategy': 'mean_reversion', 'bear_bb_std_mult': 3.08295301429334, 'bear_rsi_os': 31, 'bear_rsi_ob': 65, 'bear_adx_thresh': 15.291567158649848, 'bear_atr_min_pct': 0.0023670552072682385, 'bear_atr_max_pct': 0.12495936261635245, 'bear_tp_mult': 1.9607264571032912, 'bear_tsl_mult': 0.7513757248783455, 'bear_time_stop': 203, 'bear_use_sma': False, 'bear_use_ema': True, 'bear_use_atr': False, 'bear_use_adx': False, 'bear_use_spike': True, 'bear_rsi_required': True, 'sideways_strategy': 'breakout', 'sideways_bb_std_mult': 2.6875133993297893, 'sideways_rsi_os': 18, 'sideways_rsi_ob': 69, 'sideways_adx_thresh': 26.04549838550222, 'sideways_atr_min_pct': 0.003090322805353353, 'sideways_atr_max_pct': 0.1278746454419513, 'sideways_tp_mult': 1.521488007180365, 'sideways_tsl_mult': 0.9989179673754613, 'sideways_time_stop': 200, 'sideways_use_sma': True, 'sideways_use_ema': False, 'sideways_use_atr': True, 'sideways_use_adx': False, 'sideways_use_spike': True, 'sideways_rsi_required': True}.
[I 2025-08-31 13:00:05,575] Trial 518 finished with values: [-1000000000.0, 1000000000.0] and parameters: {'p_sma': 55, 'p_std': 21, 'p_atr': 13, 'p_adx': 8, 'rsi_period': 68, 'ema1': 24, 'ema2': 15, 'slip_atr_k': 0.0572035076785336, 'slip_spread_k': 0.9211532771045099, 'spread_hl_frac': 0.01956235198744831, 'bb_std_mult': 3.2032930766835843, 'rsi_os': 10, 'rsi_ob': 77, 'vol_spike': 0.2891499984104838, 'adx_thresh': 20.497306219908168, 'atr_min_pct': 0.014561734507596909, 'atr_max_pct': 0.12655660214170142, 'tp_mult': 1.4446424682563022, 'tsl_mult': 0.05126378111320547, 'strategy': 'breakout', 'time_stop': 173, 'use_sma': False, 'use_atr': True, 'use_adx': False, 'use_ema': True, 'use_spike': False, 'rsi_required': True, 'edge_k': 1.5610591650439254, 'edge_cap': 0.7184237768247588, 'bull_strategy': 'breakout', 'bull_bb_std_mult': 1.5393723122732692, 'bull_rsi_os': 6, 'bull_rsi_ob': 49, 'bull_adx_thresh': 16.994819181772616, 'bull_atr_min_pct': 0.020113043598284613, 'bull_atr_max_pct': 0.14733722486600934, 'bull_tp_mult': 1.3184520217356448, 'bull_tsl_mult': 0.17233366409510983, 'bull_time_stop': 291, 'bull_use_sma': True, 'bull_use_ema': True, 'bull_use_atr': False, 'bull_use_adx': True, 'bull_use_spike': True, 'bull_rsi_required': True, 'bear_strategy': 'mean_reversion', 'bear_bb_std_mult': 2.9780722619921836, 'bear_rsi_os': 26, 'bear_rsi_ob': 65, 'bear_adx_thresh': 12.1746836897501, 'bear_atr_min_pct': 0.002861893346682047, 'bear_atr_max_pct': 0.12372131925367667, 'bear_tp_mult': 1.9790946510976328, 'bear_tsl_mult': 0.7170279942012441, 'bear_time_stop': 98, 'bear_use_sma': True, 'bear_use_ema': False, 'bear_use_atr': False, 'bear_use_adx': False, 'bear_use_spike': False, 'bear_rsi_required': True, 'sideways_strategy': 'breakout', 'sideways_bb_std_mult': 2.6672085746215384, 'sideways_rsi_os': 22, 'sideways_rsi_ob': 57, 'sideways_adx_thresh': 26.13003225030583, 'sideways_atr_min_pct': 0.0023915701072749662, 'sideways_atr_max_pct': 0.08900938411241352, 'sideways_tp_mult': 1.6360446743937829, 'sideways_tsl_mult': 0.8222154352928764, 'sideways_time_stop': 283, 'sideways_use_sma': True, 'sideways_use_ema': False, 'sideways_use_atr': True, 'sideways_use_adx': True, 'sideways_use_spike': False, 'sideways_rsi_required': True}.
[I 2025-08-31 13:00:05,940] Trial 520 finished with values: [-0.14585411099340762, 0.14533073263569046] and parameters: {'p_sma': 49, 'p_std': 26, 'p_atr': 14, 'p_adx': 27, 'rsi_period': 47, 'ema1': 20, 'ema2': 16, 'slip_atr_k': 0.24140588810676672, 'slip_spread_k': 0.979619401833709, 'spread_hl_frac': 0.0011096573059042637, 'bb_std_mult': 0.5923521393934024, 'rsi_os': 33, 'rsi_ob': 65, 'vol_spike': 0.02426160391123676, 'adx_thresh': 15.990351625422267, 'atr_min_pct': 0.0008339469983434118, 'atr_max_pct': 0.1293701662355032, 'tp_mult': 2.06110120648945, 'tsl_mult': 0.0464752795311061, 'strategy': 'breakout', 'time_stop': 172, 'use_sma': False, 'use_atr': True, 'use_adx': False, 'use_ema': True, 'use_spike': False, 'rsi_required': True, 'edge_k': 0.8190422139101667, 'edge_cap': 0.7397039496680222, 'bull_strategy': 'mean_reversion', 'bull_bb_std_mult': 2.475820196829474, 'bull_rsi_os': 5, 'bull_rsi_ob': 50, 'bull_adx_thresh': 15.501634275984646, 'bull_atr_min_pct': 0.028653525198522586, 'bull_atr_max_pct': 0.1470239680960676, 'bull_tp_mult': 2.482249280234124, 'bull_tsl_mult': 0.9569331328937072, 'bull_time_stop': 172, 'bull_use_sma': True, 'bull_use_ema': False, 'bull_use_atr': True, 'bull_use_adx': True, 'bull_use_spike': True, 'bull_rsi_required': True, 'bear_strategy': 'breakout', 'bear_bb_std_mult': 0.9585902994116318, 'bear_rsi_os': 51, 'bear_rsi_ob': 66, 'bear_adx_thresh': 12.065295608618133, 'bear_atr_min_pct': 0.00277829988872223, 'bear_atr_max_pct': 0.04057247192720723, 'bear_tp_mult': 2.998634951715802, 'bear_tsl_mult': 0.6505824870734814, 'bear_time_stop': 180, 'bear_use_sma': True, 'bear_use_ema': False, 'bear_use_atr': True, 'bear_use_adx': True, 'bear_use_spike': False, 'bear_rsi_required': True, 'sideways_strategy': 'mean_reversion', 'sideways_bb_std_mult': 2.364437803360498, 'sideways_rsi_os': 30, 'sideways_rsi_ob': 87, 'sideways_adx_thresh': 28.08591954724769, 'sideways_atr_min_pct': 0.005123248482992942, 'sideways_atr_max_pct': 0.12828777520821058, 'sideways_tp_mult': 2.9262763017235103, 'sideways_tsl_mult': 0.8724273431131842, 'sideways_time_stop': 121, 'sideways_use_sma': False, 'sideways_use_ema': True, 'sideways_use_atr': False, 'sideways_use_adx': True, 'sideways_use_spike': False, 'sideways_rsi_required': True}.
[I 2025-08-31 13:00:06,043] Trial 519 finished with values: [-0.06528296214358198, 0.06514258906515942] and parameters: {'p_sma': 49, 'p_std': 52, 'p_atr': 13, 'p_adx': 16, 'rsi_period': 56, 'ema1': 22, 'ema2': 15, 'slip_atr_k': 0.06183069562858636, 'slip_spread_k': 0.42212340538225157, 'spread_hl_frac': 0.019424926312876335, 'bb_std_mult': 3.109922159003758, 'rsi_os': 38, 'rsi_ob': 76, 'vol_spike': 0.29041956439813366, 'adx_thresh': 25.88715215406456, 'atr_min_pct': 0.019660858361732605, 'atr_max_pct': 0.12690710864685276, 'tp_mult': 2.0828411041594435, 'tsl_mult': 0.06943780912205894, 'strategy': 'breakout', 'time_stop': 172, 'use_sma': False, 'use_atr': True, 'use_adx': False, 'use_ema': True, 'use_spike': False, 'rsi_required': True, 'edge_k': 0.2774647566697369, 'edge_cap': 0.7009529576470405, 'bull_strategy': 'breakout', 'bull_bb_std_mult': 2.781982935229077, 'bull_rsi_os': 17, 'bull_rsi_ob': 49, 'bull_adx_thresh': 17.343958771596522, 'bull_atr_min_pct': 0.005454894720389531, 'bull_atr_max_pct': 0.14709063902283948, 'bull_tp_mult': 1.1708911842832648, 'bull_tsl_mult': 0.16725853724308293, 'bull_time_stop': 266, 'bull_use_sma': True, 'bull_use_ema': False, 'bull_use_atr': False, 'bull_use_adx': True, 'bull_use_spike': True, 'bull_rsi_required': True, 'bear_strategy': 'breakout', 'bear_bb_std_mult': 3.0059577379836555, 'bear_rsi_os': 51, 'bear_rsi_ob': 69, 'bear_adx_thresh': 12.040865177363528, 'bear_atr_min_pct': 0.0030608786152234767, 'bear_atr_max_pct': 0.1244607052216608, 'bear_tp_mult': 2.96740051792283, 'bear_tsl_mult': 0.7118761731170075, 'bear_time_stop': 24, 'bear_use_sma': True, 'bear_use_ema': False, 'bear_use_atr': True, 'bear_use_adx': True, 'bear_use_spike': False, 'bear_rsi_required': True, 'sideways_strategy': 'breakout', 'sideways_bb_std_mult': 2.6027650642383473, 'sideways_rsi_os': 8, 'sideways_rsi_ob': 69, 'sideways_adx_thresh': 28.238032891762497, 'sideways_atr_min_pct': 0.0024498742556183853, 'sideways_atr_max_pct': 0.04486339585752764, 'sideways_tp_mult': 2.6336534678223087, 'sideways_tsl_mult': 0.8749421188244962, 'sideways_time_stop': 282, 'sideways_use_sma': True, 'sideways_use_ema': False, 'sideways_use_atr': False, 'sideways_use_adx': True, 'sideways_use_spike': False, 'sideways_rsi_required': True}.
[I 2025-08-31 13:00:06,236] Trial 521 finished with values: [-0.09481690061242465, 0.09450105050368669] and parameters: {'p_sma': 49, 'p_std': 26, 'p_atr': 8, 'p_adx': 15, 'rsi_period': 9, 'ema1': 20, 'ema2': 15, 'slip_atr_k': 0.06240418210126627, 'slip_spread_k': 0.3844061790416481, 'spread_hl_frac': 0.020766305583022036, 'bb_std_mult': 2.453283534591177, 'rsi_os': 38, 'rsi_ob': 76, 'vol_spike': 0.006592114538339411, 'adx_thresh': 18.041846306973554, 'atr_min_pct': 0.014668106157121188, 'atr_max_pct': 0.09621751611306309, 'tp_mult': 1.052679544061419, 'tsl_mult': 0.03452778119967411, 'strategy': 'breakout', 'time_stop': 174, 'use_sma': False, 'use_atr': False, 'use_adx': False, 'use_ema': True, 'use_spike': False, 'rsi_required': True, 'edge_k': 0.8216815826165988, 'edge_cap': 0.7099491585168776, 'bull_strategy': 'mean_reversion', 'bull_bb_std_mult': 2.496692272982004, 'bull_rsi_os': 37, 'bull_rsi_ob': 50, 'bull_adx_thresh': 17.326346422563542, 'bull_atr_min_pct': 0.020664558799104414, 'bull_atr_max_pct': 0.14719366632173797, 'bull_tp_mult': 1.1699387628925415, 'bull_tsl_mult': 0.8831476482116106, 'bull_time_stop': 282, 'bull_use_sma': True, 'bull_use_ema': False, 'bull_use_atr': True, 'bull_use_adx': True, 'bull_use_spike': True, 'bull_rsi_required': True, 'bear_strategy': 'breakout', 'bear_bb_std_mult': 3.0066259368457047, 'bear_rsi_os': 46, 'bear_rsi_ob': 85, 'bear_adx_thresh': 12.16998325458999, 'bear_atr_min_pct': 0.0030030092412046167, 'bear_atr_max_pct': 0.04134965090599259, 'bear_tp_mult': 2.274611336315691, 'bear_tsl_mult': 0.35304058656981596, 'bear_time_stop': 294, 'bear_use_sma': True, 'bear_use_ema': False, 'bear_use_atr': True, 'bear_use_adx': True, 'bear_use_spike': False, 'bear_rsi_required': True, 'sideways_strategy': 'mean_reversion', 'sideways_bb_std_mult': 2.589759356948149, 'sideways_rsi_os': 40, 'sideways_rsi_ob': 66, 'sideways_adx_thresh': 27.194833222381348, 'sideways_atr_min_pct': 0.0023319866942326044, 'sideways_atr_max_pct': 0.07895226659465387, 'sideways_tp_mult': 1.618357599125197, 'sideways_tsl_mult': 0.8686934063217394, 'sideways_time_stop': 283, 'sideways_use_sma': False, 'sideways_use_ema': True, 'sideways_use_atr': False, 'sideways_use_adx': True, 'sideways_use_spike': False, 'sideways_rsi_required': True}.
