[I 2025-08-31 12:25:06,808] Trial 253 finished with values: [-1000000000.0, 1000000000.0] and parameters: {'p_sma': 34, 'p_std': 18, 'p_atr': 13, 'p_adx': 16, 'rsi_period': 79, 'ema1': 23, 'ema2': 19, 'slip_atr_k': 0.04240014456906825, 'slip_spread_k': 0.15482638126567777, 'spread_hl_frac': 0.032121030279111326, 'bb_std_mult': 1.0732401751814784, 'rsi_os': 40, 'rsi_ob': 73, 'vol_spike': 0.07956524566495492, 'adx_thresh': 21.3436869995484, 'atr_min_pct': 0.007412791447723513, 'atr_max_pct': 0.06613617923543387, 'tp_mult': 2.6920987244566987, 'tsl_mult': 0.03855680479364282, 'strategy': 'mean_reversion', 'time_stop': 200, 'use_sma': False, 'use_atr': False, 'use_adx': False, 'use_ema': True, 'use_spike': True, 'rsi_required': True, 'edge_k': 0.8004476687814395, 'edge_cap': 0.817762548798131, 'bull_strategy': 'breakout', 'bull_bb_std_mult': 2.8710166526009737, 'bull_rsi_os': 10, 'bull_rsi_ob': 78, 'bull_adx_thresh': 8.619331779008593, 'bull_atr_min_pct': 0.02128410766784174, 'bull_atr_max_pct': 0.1047082344363987, 'bull_tp_mult': 1.7860693539894301, 'bull_tsl_mult': 0.21371379977945287, 'bull_time_stop': 100, 'bull_use_sma': True, 'bull_use_ema': True, 'bull_use_atr': True, 'bull_use_adx': True, 'bull_use_spike': False, 'bull_rsi_required': False, 'bear_strategy': 'breakout', 'bear_bb_std_mult': 2.046184242896908, 'bear_rsi_os': 26, 'bear_rsi_ob': 76, 'bear_adx_thresh': 31.870529108981174, 'bear_atr_min_pct': 0.02661088443227642, 'bear_atr_max_pct': 0.04812444472118625, 'bear_tp_mult': 2.8276570691430685, 'bear_tsl_mult': 0.09890574213867717, 'bear_time_stop': 223, 'bear_use_sma': False, 'bear_use_ema': False, 'bear_use_atr': False, 'bear_use_adx': False, 'bear_use_spike': True, 'bear_rsi_required': True, 'sideways_strategy': 'mean_reversion', 'sideways_bb_std_mult': 3.4073413862048554, 'sideways_rsi_os': 32, 'sideways_rsi_ob': 81, 'sideways_adx_thresh': 13.45435407748418, 'sideways_atr_min_pct': 0.0005193862465211426, 'sideways_atr_max_pct': 0.13831590498612176, 'sideways_tp_mult': 1.2843154035879358, 'sideways_tsl_mult': 0.6797529219948824, 'sideways_time_stop': 207, 'sideways_use_sma': True, 'sideways_use_ema': False, 'sideways_use_atr': True, 'sideways_use_adx': False, 'sideways_use_spike': False, 'sideways_rsi_required': True}.
[I 2025-08-31 12:25:06,914] Trial 254 finished with values: [-1000000000.0, 1000000000.0] and parameters: {'p_sma': 54, 'p_std': 21, 'p_atr': 12, 'p_adx': 16, 'rsi_period': 79, 'ema1': 30, 'ema2': 18, 'slip_atr_k': 0.04406953128587338, 'slip_spread_k': 0.7254141950154673, 'spread_hl_frac': 0.02919576620812146, 'bb_std_mult': 1.0572515073489896, 'rsi_os': 40, 'rsi_ob': 72, 'vol_spike': 0.09362403426454391, 'adx_thresh': 19.98325862424402, 'atr_min_pct': 0.007590611599877516, 'atr_max_pct': 0.06531752235861343, 'tp_mult': 2.6975302730017483, 'tsl_mult': 0.06353641825171555, 'strategy': 'breakout', 'time_stop': 199, 'use_sma': False, 'use_atr': False, 'use_adx': False, 'use_ema': True, 'use_spike': True, 'rsi_required': True, 'edge_k': 0.8015266621053848, 'edge_cap': 0.8895553953668062, 'bull_strategy': 'breakout', 'bull_bb_std_mult': 2.7015396503953037, 'bull_rsi_os': 7, 'bull_rsi_ob': 78, 'bull_adx_thresh': 8.077877288290829, 'bull_atr_min_pct': 0.019359991816783783, 'bull_atr_max_pct': 0.12628430487828401, 'bull_tp_mult': 1.7980594248608337, 'bull_tsl_mult': 0.2196692324964678, 'bull_time_stop': 103, 'bull_use_sma': True, 'bull_use_ema': True, 'bull_use_atr': False, 'bull_use_adx': True, 'bull_use_spike': True, 'bull_rsi_required': False, 'bear_strategy': 'breakout', 'bear_bb_std_mult': 2.0163612151158, 'bear_rsi_os': 26, 'bear_rsi_ob': 77, 'bear_adx_thresh': 32.68885011698959, 'bear_atr_min_pct': 0.0268175331322552, 'bear_atr_max_pct': 0.14033037904102552, 'bear_tp_mult': 2.689035127825141, 'bear_tsl_mult': 0.09657289161644761, 'bear_time_stop': 223, 'bear_use_sma': False, 'bear_use_ema': False, 'bear_use_atr': False, 'bear_use_adx': False, 'bear_use_spike': False, 'bear_rsi_required': True, 'sideways_strategy': 'breakout', 'sideways_bb_std_mult': 3.032342396825771, 'sideways_rsi_os': 32, 'sideways_rsi_ob': 81, 'sideways_adx_thresh': 13.651728954732368, 'sideways_atr_min_pct': 0.0006708424922652906, 'sideways_atr_max_pct': 0.1450254168136937, 'sideways_tp_mult': 2.2217252146573228, 'sideways_tsl_mult': 0.6844006472771563, 'sideways_time_stop': 197, 'sideways_use_sma': True, 'sideways_use_ema': False, 'sideways_use_atr': True, 'sideways_use_adx': True, 'sideways_use_spike': False, 'sideways_rsi_required': True}.
[I 2025-08-31 12:25:07,031] Trial 252 finished with values: [-1000000000.0, 1000000000.0] and parameters: {'p_sma': 16, 'p_std': 18, 'p_atr': 13, 'p_adx': 16, 'rsi_period': 78, 'ema1': 7, 'ema2': 19, 'slip_atr_k': 0.029885233449702654, 'slip_spread_k': 0.15180172710050632, 'spread_hl_frac': 0.029594295091183272, 'bb_std_mult': 1.7639453447686981, 'rsi_os': 41, 'rsi_ob': 72, 'vol_spike': 0.10795970545837547, 'adx_thresh': 21.1260967309298, 'atr_min_pct': 0.007431243413515671, 'atr_max_pct': 0.06653977543006177, 'tp_mult': 2.694691779569119, 'tsl_mult': 0.047959510184108656, 'strategy': 'breakout', 'time_stop': 191, 'use_sma': False, 'use_atr': False, 'use_adx': False, 'use_ema': True, 'use_spike': True, 'rsi_required': True, 'edge_k': 0.7778316621340576, 'edge_cap': 0.8949998574381081, 'bull_strategy': 'breakout', 'bull_bb_std_mult': 2.9019008700393503, 'bull_rsi_os': 8, 'bull_rsi_ob': 78, 'bull_adx_thresh': 16.839198214096317, 'bull_atr_min_pct': 0.021378551244830242, 'bull_atr_max_pct': 0.12672356220256742, 'bull_tp_mult': 2.677358369063815, 'bull_tsl_mult': 0.730999974123109, 'bull_time_stop': 92, 'bull_use_sma': True, 'bull_use_ema': True, 'bull_use_atr': True, 'bull_use_adx': True, 'bull_use_spike': False, 'bull_rsi_required': False, 'bear_strategy': 'breakout', 'bear_bb_std_mult': 3.007074284027126, 'bear_rsi_os': 27, 'bear_rsi_ob': 76, 'bear_adx_thresh': 32.100744041102516, 'bear_atr_min_pct': 0.026762785773489076, 'bear_atr_max_pct': 0.04928964699705789, 'bear_tp_mult': 2.6839473917119996, 'bear_tsl_mult': 0.1311664181763445, 'bear_time_stop': 222, 'bear_use_sma': False, 'bear_use_ema': False, 'bear_use_atr': False, 'bear_use_adx': False, 'bear_use_spike': True, 'bear_rsi_required': True, 'sideways_strategy': 'mean_reversion', 'sideways_bb_std_mult': 3.0167134585983413, 'sideways_rsi_os': 32, 'sideways_rsi_ob': 81, 'sideways_adx_thresh': 11.433121954517457, 'sideways_atr_min_pct': 0.000418609525457049, 'sideways_atr_max_pct': 0.1436508259759389, 'sideways_tp_mult': 1.303694428368919, 'sideways_tsl_mult': 0.6798063807054829, 'sideways_time_stop': 208, 'sideways_use_sma': True, 'sideways_use_ema': False, 'sideways_use_atr': True, 'sideways_use_adx': False, 'sideways_use_spike': False, 'sideways_rsi_required': True}.
[I 2025-08-31 12:25:37,537] Trial 255 finished with values: [-1000000000.0, 1000000000.0] and parameters: {'p_sma': 25, 'p_std': 38, 'p_atr': 12, 'p_adx': 16, 'rsi_period': 75, 'ema1': 30, 'ema2': 19, 'slip_atr_k': 0.04262078646558223, 'slip_spread_k': 0.9463473055071653, 'spread_hl_frac': 0.029082967363369093, 'bb_std_mult': 1.7875850115061485, 'rsi_os': 41, 'rsi_ob': 73, 'vol_spike': 0.11054897144382327, 'adx_thresh': 21.62657103147353, 'atr_min_pct': 0.00742286726357401, 'atr_max_pct': 0.06360746327799076, 'tp_mult': 2.694103741028831, 'tsl_mult': 0.06889115049616105, 'strategy': 'mean_reversion', 'time_stop': 186, 'use_sma': False, 'use_atr': False, 'use_adx': False, 'use_ema': True, 'use_spike': True, 'rsi_required': True, 'edge_k': 0.7966429950133939, 'edge_cap': 0.8213241539647326, 'bull_strategy': 'breakout', 'bull_bb_std_mult': 2.8885954358194863, 'bull_rsi_os': 11, 'bull_rsi_ob': 78, 'bull_adx_thresh': 16.816355844034216, 'bull_atr_min_pct': 0.02105004856213769, 'bull_atr_max_pct': 0.10508722718491315, 'bull_tp_mult': 2.713635766642828, 'bull_tsl_mult': 0.22060880039122702, 'bull_time_stop': 104, 'bull_use_sma': True, 'bull_use_ema': True, 'bull_use_atr': False, 'bull_use_adx': True, 'bull_use_spike': True, 'bull_rsi_required': False, 'bear_strategy': 'breakout', 'bear_bb_std_mult': 2.996760098163759, 'bear_rsi_os': 26, 'bear_rsi_ob': 71, 'bear_adx_thresh': 19.09379138936896, 'bear_atr_min_pct': 0.026866175467228776, 'bear_atr_max_pct': 0.09643469321527097, 'bear_tp_mult': 2.8446197204403845, 'bear_tsl_mult': 0.13598125143579226, 'bear_time_stop': 223, 'bear_use_sma': True, 'bear_use_ema': False, 'bear_use_atr': True, 'bear_use_adx': True, 'bear_use_spike': False, 'bear_rsi_required': True, 'sideways_strategy': 'breakout', 'sideways_bb_std_mult': 3.023036817256295, 'sideways_rsi_os': 32, 'sideways_rsi_ob': 81, 'sideways_adx_thresh': 11.197681600162332, 'sideways_atr_min_pct': 0.0008532899394708411, 'sideways_atr_max_pct': 0.1448991060105689, 'sideways_tp_mult': 2.1877694568263557, 'sideways_tsl_mult': 0.673628128134053, 'sideways_time_stop': 200, 'sideways_use_sma': True, 'sideways_use_ema': False, 'sideways_use_atr': False, 'sideways_use_adx': True, 'sideways_use_spike': False, 'sideways_rsi_required': True}.
[I 2025-08-31 12:25:37,764] Trial 256 finished with values: [-1000000000.0, 1000000000.0] and parameters: {'p_sma': 32, 'p_std': 52, 'p_atr': 12, 'p_adx': 15, 'rsi_period': 78, 'ema1': 7, 'ema2': 18, 'slip_atr_k': 0.02899667111762249, 'slip_spread_k': 0.7274622759766625, 'spread_hl_frac': 0.029679875901720373, 'bb_std_mult': 2.766825357509238, 'rsi_os': 41, 'rsi_ob': 74, 'vol_spike': 0.03399381499932492, 'adx_thresh': 21.949659381619263, 'atr_min_pct': 0.01081919267036124, 'atr_max_pct': 0.09360460308271959, 'tp_mult': 2.6354731443818533, 'tsl_mult': 0.06303248342950118, 'strategy': 'mean_reversion', 'time_stop': 187, 'use_sma': False, 'use_atr': True, 'use_adx': False, 'use_ema': False, 'use_spike': False, 'rsi_required': True, 'edge_k': 0.7117936966274295, 'edge_cap': 0.8917204658545121, 'bull_strategy': 'breakout', 'bull_bb_std_mult': 2.7396433234165216, 'bull_rsi_os': 7, 'bull_rsi_ob': 78, 'bull_adx_thresh': 8.264148317880586, 'bull_atr_min_pct': 0.01938152506445294, 'bull_atr_max_pct': 0.11251518239816424, 'bull_tp_mult': 2.697816993266648, 'bull_tsl_mult': 0.3080573835851283, 'bull_time_stop': 204, 'bull_use_sma': True, 'bull_use_ema': True, 'bull_use_atr': False, 'bull_use_adx': True, 'bull_use_spike': True, 'bull_rsi_required': False, 'bear_strategy': 'breakout', 'bear_bb_std_mult': 2.163492448703685, 'bear_rsi_os': 30, 'bear_rsi_ob': 70, 'bear_adx_thresh': 22.862818242535024, 'bear_atr_min_pct': 0.027320331969477217, 'bear_atr_max_pct': 0.14225655319848046, 'bear_tp_mult': 2.6775149849054043, 'bear_tsl_mult': 0.13436420801996551, 'bear_time_stop': 222, 'bear_use_sma': True, 'bear_use_ema': True, 'bear_use_atr': True, 'bear_use_adx': True, 'bear_use_spike': False, 'bear_rsi_required': True, 'sideways_strategy': 'breakout', 'sideways_bb_std_mult': 3.007933623727942, 'sideways_rsi_os': 35, 'sideways_rsi_ob': 82, 'sideways_adx_thresh': 11.375677333976652, 'sideways_atr_min_pct': 0.000732336429098916, 'sideways_atr_max_pct': 0.14617186968558837, 'sideways_tp_mult': 1.4239421690915635, 'sideways_tsl_mult': 0.7015670457930004, 'sideways_time_stop': 200, 'sideways_use_sma': True, 'sideways_use_ema': False, 'sideways_use_atr': False, 'sideways_use_adx': True, 'sideways_use_spike': False, 'sideways_rsi_required': True}.
[I 2025-08-31 12:25:38,069] Trial 257 finished with values: [-0.011181044913093907, 0.011881190577182368] and parameters: {'p_sma': 52, 'p_std': 29, 'p_atr': 12, 'p_adx': 15, 'rsi_period': 77, 'ema1': 5, 'ema2': 16, 'slip_atr_k': 0.029428172258361925, 'slip_spread_k': 0.6583978555167496, 'spread_hl_frac': 0.028906732601769985, 'bb_std_mult': 1.775683938401903, 'rsi_os': 41, 'rsi_ob': 74, 'vol_spike': 0.08531247639650351, 'adx_thresh': 22.058273326301965, 'atr_min_pct': 0.0016516901181206738, 'atr_max_pct': 0.1336296030832973, 'tp_mult': 2.617739044491234, 'tsl_mult': 0.014194749241490112, 'strategy': 'mean_reversion', 'time_stop': 207, 'use_sma': False, 'use_atr': True, 'use_adx': False, 'use_ema': False, 'use_spike': False, 'rsi_required': True, 'edge_k': 0.7188226014081226, 'edge_cap': 0.7431878697921878, 'bull_strategy': 'breakout', 'bull_bb_std_mult': 2.905964774336257, 'bull_rsi_os': 10, 'bull_rsi_ob': 80, 'bull_adx_thresh': 8.766317021204888, 'bull_atr_min_pct': 0.021160129322153547, 'bull_atr_max_pct': 0.090017558065991, 'bull_tp_mult': 2.705510516562043, 'bull_tsl_mult': 0.2610144618049057, 'bull_time_stop': 87, 'bull_use_sma': True, 'bull_use_ema': True, 'bull_use_atr': False, 'bull_use_adx': True, 'bull_use_spike': False, 'bull_rsi_required': False, 'bear_strategy': 'breakout', 'bear_bb_std_mult': 3.007717319500051, 'bear_rsi_os': 29, 'bear_rsi_ob': 72, 'bear_adx_thresh': 32.85815302376534, 'bear_atr_min_pct': 0.027404319751849128, 'bear_atr_max_pct': 0.09654327621140453, 'bear_tp_mult': 2.839158144072178, 'bear_tsl_mult': 0.13753762303951755, 'bear_time_stop': 240, 'bear_use_sma': True, 'bear_use_ema': True, 'bear_use_atr': True, 'bear_use_adx': True, 'bear_use_spike': True, 'bear_rsi_required': True, 'sideways_strategy': 'breakout', 'sideways_bb_std_mult': 3.590345653334434, 'sideways_rsi_os': 35, 'sideways_rsi_ob': 82, 'sideways_adx_thresh': 11.87297096294167, 'sideways_atr_min_pct': 0.0009306096891399633, 'sideways_atr_max_pct': 0.13167044448593884, 'sideways_tp_mult': 1.4202485771285152, 'sideways_tsl_mult': 0.6475843240284156, 'sideways_time_stop': 200, 'sideways_use_sma': True, 'sideways_use_ema': False, 'sideways_use_atr': False, 'sideways_use_adx': False, 'sideways_use_spike': False, 'sideways_rsi_required': True}.
[I 2025-08-31 12:25:38,247] Trial 258 finished with values: [-0.19457731848001625, 0.1943797682560339] and parameters: {'p_sma': 25, 'p_std': 29, 'p_atr': 12, 'p_adx': 15, 'rsi_period': 19, 'ema1': 6, 'ema2': 15, 'slip_atr_k': 0.04871998378809375, 'slip_spread_k': 0.13420214466068855, 'spread_hl_frac': 0.028659946721725556, 'bb_std_mult': 1.138776281273135, 'rsi_os': 41, 'rsi_ob': 74, 'vol_spike': 0.0850902006040567, 'adx_thresh': 21.94746103713385, 'atr_min_pct': 0.011768218223796641, 'atr_max_pct': 0.05931809712775522, 'tp_mult': 2.632296529552761, 'tsl_mult': 0.01987774771430472, 'strategy': 'mean_reversion', 'time_stop': 187, 'use_sma': False, 'use_atr': True, 'use_adx': False, 'use_ema': False, 'use_spike': False, 'rsi_required': True, 'edge_k': 0.7023394386130756, 'edge_cap': 0.7438491010728078, 'bull_strategy': 'breakout', 'bull_bb_std_mult': 2.7376547046881443, 'bull_rsi_os': 10, 'bull_rsi_ob': 80, 'bull_adx_thresh': 8.629107234165893, 'bull_atr_min_pct': 0.020713574277903362, 'bull_atr_max_pct': 0.11864977864776816, 'bull_tp_mult': 1.424219704278836, 'bull_tsl_mult': 0.3131046408987133, 'bull_time_stop': 84, 'bull_use_sma': True, 'bull_use_ema': True, 'bull_use_atr': False, 'bull_use_adx': True, 'bull_use_spike': True, 'bull_rsi_required': False, 'bear_strategy': 'breakout', 'bear_bb_std_mult': 3.248584270048912, 'bear_rsi_os': 25, 'bear_rsi_ob': 71, 'bear_adx_thresh': 32.82799853143906, 'bear_atr_min_pct': 0.027224298237691836, 'bear_atr_max_pct': 0.10175892407592453, 'bear_tp_mult': 2.8335658464243023, 'bear_tsl_mult': 0.13862691152918438, 'bear_time_stop': 240, 'bear_use_sma': True, 'bear_use_ema': True, 'bear_use_atr': True, 'bear_use_adx': True, 'bear_use_spike': False, 'bear_rsi_required': True, 'sideways_strategy': 'breakout', 'sideways_bb_std_mult': 3.5992383443015026, 'sideways_rsi_os': 35, 'sideways_rsi_ob': 85, 'sideways_adx_thresh': 11.998273827787322, 'sideways_atr_min_pct': 0.0007682007675957302, 'sideways_atr_max_pct': 0.1309502413664817, 'sideways_tp_mult': 1.3928492197864826, 'sideways_tsl_mult': 0.6494856242386314, 'sideways_time_stop': 192, 'sideways_use_sma': True, 'sideways_use_ema': False, 'sideways_use_atr': False, 'sideways_use_adx': True, 'sideways_use_spike': False, 'sideways_rsi_required': True}.
[I 2025-08-31 12:26:10,237] Trial 260 finished with values: [-0.27154897490522556, 0.27139833544265574] and parameters: {'p_sma': 48, 'p_std': 20, 'p_atr': 12, 'p_adx': 15, 'rsi_period': 75, 'ema1': 5, 'ema2': 16, 'slip_atr_k': 0.049124161153516976, 'slip_spread_k': 0.995628687587609, 'spread_hl_frac': 0.046537101592811346, 'bb_std_mult': 1.1286685049601175, 'rsi_os': 38, 'rsi_ob': 77, 'vol_spike': 0.10283060380848359, 'adx_thresh': 21.960639788214923, 'atr_min_pct': 0.011742395246431706, 'atr_max_pct': 0.05907295228751121, 'tp_mult': 2.6304298612566344, 'tsl_mult': 0.0005419314855784743, 'strategy': 'mean_reversion', 'time_stop': 178, 'use_sma': False, 'use_atr': True, 'use_adx': False, 'use_ema': False, 'use_spike': False, 'rsi_required': True, 'edge_k': 0.6429497490150446, 'edge_cap': 0.744178976222952, 'bull_strategy': 'breakout', 'bull_bb_std_mult': 2.8332279373290397, 'bull_rsi_os': 10, 'bull_rsi_ob': 80, 'bull_adx_thresh': 8.941818853150922, 'bull_atr_min_pct': 0.021742987423220346, 'bull_atr_max_pct': 0.09672846255875252, 'bull_tp_mult': 2.7368060117394766, 'bull_tsl_mult': 0.2758472504889314, 'bull_time_stop': 87, 'bull_use_sma': True, 'bull_use_ema': True, 'bull_use_atr': False, 'bull_use_adx': True, 'bull_use_spike': False, 'bull_rsi_required': False, 'bear_strategy': 'breakout', 'bear_bb_std_mult': 3.23304713265831, 'bear_rsi_os': 25, 'bear_rsi_ob': 71, 'bear_adx_thresh': 33.006971386500865, 'bear_atr_min_pct': 0.025581838702496012, 'bear_atr_max_pct': 0.10054237202518818, 'bear_tp_mult': 2.899830713455297, 'bear_tsl_mult': 0.08616949874943146, 'bear_time_stop': 238, 'bear_use_sma': False, 'bear_use_ema': True, 'bear_use_atr': False, 'bear_use_adx': False, 'bear_use_spike': True, 'bear_rsi_required': True, 'sideways_strategy': 'breakout', 'sideways_bb_std_mult': 2.793614840931, 'sideways_rsi_os': 49, 'sideways_rsi_ob': 85, 'sideways_adx_thresh': 6.442877631774381, 'sideways_atr_min_pct': 0.0008568854371484302, 'sideways_atr_max_pct': 0.13089816746701227, 'sideways_tp_mult': 1.3900476791401741, 'sideways_tsl_mult': 0.6405717477290561, 'sideways_time_stop': 190, 'sideways_use_sma': True, 'sideways_use_ema': False, 'sideways_use_atr': True, 'sideways_use_adx': False, 'sideways_use_spike': False, 'sideways_rsi_required': True}.
[I 2025-08-31 12:26:10,459] Trial 259 finished with values: [-0.20600012765783648, 0.20580121001160084] and parameters: {'p_sma': 36, 'p_std': 20, 'p_atr': 12, 'p_adx': 15, 'rsi_period': 19, 'ema1': 14, 'ema2': 14, 'slip_atr_k': 0.04866149810921094, 'slip_spread_k': 0.9988061408669773, 'spread_hl_frac': 0.03112888056477015, 'bb_std_mult': 1.506054452998646, 'rsi_os': 41, 'rsi_ob': 74, 'vol_spike': 0.09878941906292164, 'adx_thresh': 21.960553936899597, 'atr_min_pct': 0.01083426122782446, 'atr_max_pct': 0.1093960409857979, 'tp_mult': 2.6323376244208943, 'tsl_mult': 0.001335069125939519, 'strategy': 'mean_reversion', 'time_stop': 179, 'use_sma': False, 'use_atr': True, 'use_adx': False, 'use_ema': False, 'use_spike': False, 'rsi_required': True, 'edge_k': 0.6992084048533409, 'edge_cap': 0.746494981421225, 'bull_strategy': 'breakout', 'bull_bb_std_mult': 2.735422573019238, 'bull_rsi_os': 10, 'bull_rsi_ob': 75, 'bull_adx_thresh': 8.45972578212514, 'bull_atr_min_pct': 0.019591763018479074, 'bull_atr_max_pct': 0.1304089652747902, 'bull_tp_mult': 2.3548491798862305, 'bull_tsl_mult': 0.26494351388719894, 'bull_time_stop': 87, 'bull_use_sma': True, 'bull_use_ema': True, 'bull_use_atr': False, 'bull_use_adx': True, 'bull_use_spike': False, 'bull_rsi_required': False, 'bear_strategy': 'breakout', 'bear_bb_std_mult': 3.210897196865914, 'bear_rsi_os': 30, 'bear_rsi_ob': 70, 'bear_adx_thresh': 32.9411118614118, 'bear_atr_min_pct': 0.027486698523562142, 'bear_atr_max_pct': 0.1018457280454626, 'bear_tp_mult': 2.6172775715824703, 'bear_tsl_mult': 0.08557850150548671, 'bear_time_stop': 239, 'bear_use_sma': True, 'bear_use_ema': True, 'bear_use_atr': True, 'bear_use_adx': True, 'bear_use_spike': True, 'bear_rsi_required': True, 'sideways_strategy': 'breakout', 'sideways_bb_std_mult': 2.883782159007728, 'sideways_rsi_os': 35, 'sideways_rsi_ob': 85, 'sideways_adx_thresh': 11.896535280155064, 'sideways_atr_min_pct': 0.0007762014836008076, 'sideways_atr_max_pct': 0.13186381788267756, 'sideways_tp_mult': 1.4103009325180746, 'sideways_tsl_mult': 0.6478890858965023, 'sideways_time_stop': 193, 'sideways_use_sma': True, 'sideways_use_ema': False, 'sideways_use_atr': False, 'sideways_use_adx': False, 'sideways_use_spike': False, 'sideways_rsi_required': True}.
