[I 2025-08-31 12:40:31,364] Trial 375 finished with values: [-0.05984249460627378, 0.05960860577738377] and parameters: {'p_sma': 51, 'p_std': 28, 'p_atr': 14, 'p_adx': 13, 'rsi_period': 53, 'ema1': 5, 'ema2': 16, 'slip_atr_k': 0.04562634619716169, 'slip_spread_k': 0.6815008342447588, 'spread_hl_frac': 0.002290269529417542, 'bb_std_mult': 1.2559036750793973, 'rsi_os': 47, 'rsi_ob': 76, 'vol_spike': 0.09258516966120564, 'adx_thresh': 21.137692260374212, 'atr_min_pct': 0.01219312969019394, 'atr_max_pct': 0.12475840377372784, 'tp_mult': 2.425925400180704, 'tsl_mult': 0.016788426995383843, 'strategy': 'mean_reversion', 'time_stop': 201, 'use_sma': False, 'use_atr': True, 'use_adx': False, 'use_ema': False, 'use_spike': False, 'rsi_required': True, 'edge_k': 0.8287886894355173, 'edge_cap': 0.7925938551854232, 'bull_strategy': 'breakout', 'bull_bb_std_mult': 2.9098642736358133, 'bull_rsi_os': 11, 'bull_rsi_ob': 79, 'bull_adx_thresh': 10.216022249502076, 'bull_atr_min_pct': 0.007423855481998394, 'bull_atr_max_pct': 0.06276784579353871, 'bull_tp_mult': 2.6932787661829862, 'bull_tsl_mult': 0.06631212808316711, 'bull_time_stop': 290, 'bull_use_sma': True, 'bull_use_ema': True, 'bull_use_atr': False, 'bull_use_adx': True, 'bull_use_spike': True, 'bull_rsi_required': False, 'bear_strategy': 'breakout', 'bear_bb_std_mult': 2.7180615663150296, 'bear_rsi_os': 29, 'bear_rsi_ob': 74, 'bear_adx_thresh': 33.89232461447558, 'bear_atr_min_pct': 0.025502191191490345, 'bear_atr_max_pct': 0.059732736136906356, 'bear_tp_mult': 1.9807429163849173, 'bear_tsl_mult': 0.7492410988017744, 'bear_time_stop': 261, 'bear_use_sma': True, 'bear_use_ema': True, 'bear_use_atr': True, 'bear_use_adx': True, 'bear_use_spike': False, 'bear_rsi_required': True, 'sideways_strategy': 'breakout', 'sideways_bb_std_mult': 0.7470031834222786, 'sideways_rsi_os': 36, 'sideways_rsi_ob': 80, 'sideways_adx_thresh': 18.79473710670715, 'sideways_atr_min_pct': 1.9479027603520253e-05, 'sideways_atr_max_pct': 0.1420926396685591, 'sideways_tp_mult': 1.4695498371710514, 'sideways_tsl_mult': 0.6872291086002911, 'sideways_time_stop': 75, 'sideways_use_sma': True, 'sideways_use_ema': False, 'sideways_use_atr': False, 'sideways_use_adx': True, 'sideways_use_spike': False, 'sideways_rsi_required': True}.
[I 2025-08-31 12:41:02,808] Trial 381 finished with values: [-1000000000.0, 1000000000.0] and parameters: {'p_sma': 52, 'p_std': 34, 'p_atr': 12, 'p_adx': 15, 'rsi_period': 50, 'ema1': 20, 'ema2': 15, 'slip_atr_k': 0.009520518397667831, 'slip_spread_k': 0.6486897970914307, 'spread_hl_frac': 0.01724199545932482, 'bb_std_mult': 2.1881764179942778, 'rsi_os': 39, 'rsi_ob': 75, 'vol_spike': 0.027206189420696983, 'adx_thresh': 20.078306204833464, 'atr_min_pct': 0.025111492117533576, 'atr_max_pct': 0.09740557249559352, 'tp_mult': 2.419406137008567, 'tsl_mult': 0.00030409936562251876, 'strategy': 'mean_reversion', 'time_stop': 188, 'use_sma': False, 'use_atr': True, 'use_adx': False, 'use_ema': False, 'use_spike': False, 'rsi_required': True, 'edge_k': 0.7013204700407392, 'edge_cap': 0.7082694994630613, 'bull_strategy': 'breakout', 'bull_bb_std_mult': 2.600481907645158, 'bull_rsi_os': 12, 'bull_rsi_ob': 69, 'bull_adx_thresh': 8.990251064963774, 'bull_atr_min_pct': 0.02001282789890162, 'bull_atr_max_pct': 0.11719369069974453, 'bull_tp_mult': 1.2100568491285841, 'bull_tsl_mult': 0.2307532070921646, 'bull_time_stop': 100, 'bull_use_sma': True, 'bull_use_ema': True, 'bull_use_atr': True, 'bull_use_adx': True, 'bull_use_spike': False, 'bull_rsi_required': False, 'bear_strategy': 'breakout', 'bear_bb_std_mult': 3.0854780498057672, 'bear_rsi_os': 29, 'bear_rsi_ob': 71, 'bear_adx_thresh': 31.846453716925396, 'bear_atr_min_pct': 0.02667587484044338, 'bear_atr_max_pct': 0.10163009986895231, 'bear_tp_mult': 2.8593062180563735, 'bear_tsl_mult': 0.9440211251217823, 'bear_time_stop': 197, 'bear_use_sma': True, 'bear_use_ema': True, 'bear_use_atr': True, 'bear_use_adx': True, 'bear_use_spike': True, 'bear_rsi_required': True, 'sideways_strategy': 'breakout', 'sideways_bb_std_mult': 3.4799383902742935, 'sideways_rsi_os': 38, 'sideways_rsi_ob': 80, 'sideways_adx_thresh': 13.309011902762627, 'sideways_atr_min_pct': 0.02439673837767546, 'sideways_atr_max_pct': 0.1303352422250864, 'sideways_tp_mult': 1.0397084785319421, 'sideways_tsl_mult': 0.6331751944803707, 'sideways_time_stop': 42, 'sideways_use_sma': True, 'sideways_use_ema': False, 'sideways_use_atr': False, 'sideways_use_adx': False, 'sideways_use_spike': False, 'sideways_rsi_required': True}.
[I 2025-08-31 12:41:03,020] Trial 379 finished with values: [-0.0060467229491115715, 0.009586352012998933] and parameters: {'p_sma': 52, 'p_std': 24, 'p_atr': 12, 'p_adx': 15, 'rsi_period': 50, 'ema1': 20, 'ema2': 15, 'slip_atr_k': 0.058256074213438105, 'slip_spread_k': 0.413834509796968, 'spread_hl_frac': 0.017236478073885685, 'bb_std_mult': 2.301550225010823, 'rsi_os': 39, 'rsi_ob': 78, 'vol_spike': 0.024791945084578826, 'adx_thresh': 20.217373922909648, 'atr_min_pct': 0.0012665068705432275, 'atr_max_pct': 0.12448417807399659, 'tp_mult': 2.6766396764287874, 'tsl_mult': 0.017194043948547972, 'strategy': 'breakout', 'time_stop': 175, 'use_sma': False, 'use_atr': True, 'use_adx': False, 'use_ema': True, 'use_spike': False, 'rsi_required': True, 'edge_k': 0.6958992804661047, 'edge_cap': 0.7353419727584731, 'bull_strategy': 'breakout', 'bull_bb_std_mult': 2.756986564940199, 'bull_rsi_os': 6, 'bull_rsi_ob': 50, 'bull_adx_thresh': 17.58075261042337, 'bull_atr_min_pct': 0.0198348890586688, 'bull_atr_max_pct': 0.14972912765316465, 'bull_tp_mult': 1.2696009870798064, 'bull_tsl_mult': 0.21619641159494052, 'bull_time_stop': 289, 'bull_use_sma': True, 'bull_use_ema': True, 'bull_use_atr': False, 'bull_use_adx': True, 'bull_use_spike': False, 'bull_rsi_required': False, 'bear_strategy': 'breakout', 'bear_bb_std_mult': 3.108860397759833, 'bear_rsi_os': 29, 'bear_rsi_ob': 71, 'bear_adx_thresh': 13.538994149658787, 'bear_atr_min_pct': 0.002221568097573467, 'bear_atr_max_pct': 0.1348919879836983, 'bear_tp_mult': 2.912470665609162, 'bear_tsl_mult': 0.7527947190403106, 'bear_time_stop': 198, 'bear_use_sma': True, 'bear_use_ema': True, 'bear_use_atr': True, 'bear_use_adx': True, 'bear_use_spike': True, 'bear_rsi_required': True, 'sideways_strategy': 'breakout', 'sideways_bb_std_mult': 2.629868139198451, 'sideways_rsi_os': 31, 'sideways_rsi_ob': 67, 'sideways_adx_thresh': 26.522131435824193, 'sideways_atr_min_pct': 0.002428792612111749, 'sideways_atr_max_pct': 0.12932333447862923, 'sideways_tp_mult': 1.592220062999353, 'sideways_tsl_mult': 0.8708208773622941, 'sideways_time_stop': 202, 'sideways_use_sma': True, 'sideways_use_ema': False, 'sideways_use_atr': False, 'sideways_use_adx': False, 'sideways_use_spike': False, 'sideways_rsi_required': True}.
[I 2025-08-31 12:41:03,217] Trial 382 finished with values: [-0.04375370398939471, 0.04363385387271147] and parameters: {'p_sma': 54, 'p_std': 37, 'p_atr': 12, 'p_adx': 15, 'rsi_period': 21, 'ema1': 12, 'ema2': 15, 'slip_atr_k': 0.0051898302727010175, 'slip_spread_k': 0.4140752186017387, 'spread_hl_frac': 4.636455441687712e-05, 'bb_std_mult': 2.366720605265879, 'rsi_os': 39, 'rsi_ob': 82, 'vol_spike': 0.16406329427810618, 'adx_thresh': 11.103298641825658, 'atr_min_pct': 0.024970016156718535, 'atr_max_pct': 0.13537990984793286, 'tp_mult': 2.311039960729299, 'tsl_mult': 0.6137004216987765, 'strategy': 'breakout', 'time_stop': 189, 'use_sma': False, 'use_atr': True, 'use_adx': False, 'use_ema': True, 'use_spike': False, 'rsi_required': True, 'edge_k': 0.6822768652442959, 'edge_cap': 0.7452614789994603, 'bull_strategy': 'breakout', 'bull_bb_std_mult': 2.982338061934519, 'bull_rsi_os': 12, 'bull_rsi_ob': 91, 'bull_adx_thresh': 7.944186451622721, 'bull_atr_min_pct': 0.01993738680608015, 'bull_atr_max_pct': 0.12552713661926831, 'bull_tp_mult': 1.2136533024225487, 'bull_tsl_mult': 0.23976702681272827, 'bull_time_stop': 102, 'bull_use_sma': True, 'bull_use_ema': True, 'bull_use_atr': True, 'bull_use_adx': True, 'bull_use_spike': False, 'bull_rsi_required': False, 'bear_strategy': 'breakout', 'bear_bb_std_mult': 3.1127757468293833, 'bear_rsi_os': 29, 'bear_rsi_ob': 71, 'bear_adx_thresh': 32.91637175661691, 'bear_atr_min_pct': 0.011569092507030393, 'bear_atr_max_pct': 0.0963585551708017, 'bear_tp_mult': 2.8424982398383483, 'bear_tsl_mult': 0.9443386702358495, 'bear_time_stop': 248, 'bear_use_sma': True, 'bear_use_ema': True, 'bear_use_atr': True, 'bear_use_adx': True, 'bear_use_spike': True, 'bear_rsi_required': True, 'sideways_strategy': 'breakout', 'sideways_bb_std_mult': 3.4972370681323817, 'sideways_rsi_os': 38, 'sideways_rsi_ob': 83, 'sideways_adx_thresh': 23.318221149567478, 'sideways_atr_min_pct': 0.0025010995120792546, 'sideways_atr_max_pct': 0.12906025860038922, 'sideways_tp_mult': 1.6244195531083914, 'sideways_tsl_mult': 0.6371588858013522, 'sideways_time_stop': 42, 'sideways_use_sma': True, 'sideways_use_ema': False, 'sideways_use_atr': False, 'sideways_use_adx': False, 'sideways_use_spike': False, 'sideways_rsi_required': True}.
[I 2025-08-31 12:41:03,335] Trial 380 finished with values: [-0.0573824218155623, 0.05747333366938365] and parameters: {'p_sma': 52, 'p_std': 22, 'p_atr': 12, 'p_adx': 15, 'rsi_period': 56, 'ema1': 13, 'ema2': 15, 'slip_atr_k': 0.06267609257498671, 'slip_spread_k': 0.6809282081439273, 'spread_hl_frac': 0.012736190583256472, 'bb_std_mult': 2.3547458903216634, 'rsi_os': 39, 'rsi_ob': 52, 'vol_spike': 0.09325652686011578, 'adx_thresh': 21.80960723096553, 'atr_min_pct': 0.00014504378054284138, 'atr_max_pct': 0.05628240091923697, 'tp_mult': 2.691812484069508, 'tsl_mult': 0.01622678051758012, 'strategy': 'breakout', 'time_stop': 174, 'use_sma': False, 'use_atr': True, 'use_adx': False, 'use_ema': True, 'use_spike': False, 'rsi_required': True, 'edge_k': 0.6984821470832592, 'edge_cap': 0.7289430941093059, 'bull_strategy': 'breakout', 'bull_bb_std_mult': 2.5917071051076266, 'bull_rsi_os': 12, 'bull_rsi_ob': 77, 'bull_adx_thresh': 9.08748376151376, 'bull_atr_min_pct': 0.019941355565517942, 'bull_atr_max_pct': 0.11578814490266467, 'bull_tp_mult': 1.276600641898317, 'bull_tsl_mult': 0.23620607637520621, 'bull_time_stop': 293, 'bull_use_sma': True, 'bull_use_ema': True, 'bull_use_atr': False, 'bull_use_adx': True, 'bull_use_spike': False, 'bull_rsi_required': False, 'bear_strategy': 'breakout', 'bear_bb_std_mult': 3.1062881847367425, 'bear_rsi_os': 29, 'bear_rsi_ob': 83, 'bear_adx_thresh': 29.950909729284334, 'bear_atr_min_pct': 0.02801973449846691, 'bear_atr_max_pct': 0.09614979281032258, 'bear_tp_mult': 2.8508596351262483, 'bear_tsl_mult': 0.1353245883044907, 'bear_time_stop': 5, 'bear_use_sma': True, 'bear_use_ema': True, 'bear_use_atr': True, 'bear_use_adx': True, 'bear_use_spike': True, 'bear_rsi_required': True, 'sideways_strategy': 'breakout', 'sideways_bb_std_mult': 2.820962278944905, 'sideways_rsi_os': 38, 'sideways_rsi_ob': 80, 'sideways_adx_thresh': 13.294760753057618, 'sideways_atr_min_pct': 0.0012363751231290895, 'sideways_atr_max_pct': 0.12938214649018873, 'sideways_tp_mult': 2.9024759230025334, 'sideways_tsl_mult': 0.6298061644950628, 'sideways_time_stop': 44, 'sideways_use_sma': True, 'sideways_use_ema': False, 'sideways_use_atr': False, 'sideways_use_adx': False, 'sideways_use_spike': False, 'sideways_rsi_required': True}.
[I 2025-08-31 12:41:36,571] Trial 385 finished with values: [-0.04328739189203046, 0.042635668884570536] and parameters: {'p_sma': 53, 'p_std': 24, 'p_atr': 12, 'p_adx': 15, 'rsi_period': 49, 'ema1': 17, 'ema2': 14, 'slip_atr_k': 0.060700903423110505, 'slip_spread_k': 0.28845132972538634, 'spread_hl_frac': 0.019329516245437633, 'bb_std_mult': 2.309219488586771, 'rsi_os': 35, 'rsi_ob': 84, 'vol_spike': 0.029785490319774677, 'adx_thresh': 19.331765879047268, 'atr_min_pct': 0.0003972905200006994, 'atr_max_pct': 0.11940944275001475, 'tp_mult': 2.741326313595471, 'tsl_mult': 0.229072214434908, 'strategy': 'breakout', 'time_stop': 173, 'use_sma': False, 'use_atr': True, 'use_adx': False, 'use_ema': True, 'use_spike': False, 'rsi_required': True, 'edge_k': 0.4755093963096481, 'edge_cap': 0.7212808915590594, 'bull_strategy': 'breakout', 'bull_bb_std_mult': 2.671230022992277, 'bull_rsi_os': 5, 'bull_rsi_ob': 50, 'bull_adx_thresh': 16.398271606638314, 'bull_atr_min_pct': 0.019103514327997187, 'bull_atr_max_pct': 0.1496938593238405, 'bull_tp_mult': 1.3267614134331687, 'bull_tsl_mult': 0.1326239743719071, 'bull_time_stop': 294, 'bull_use_sma': True, 'bull_use_ema': True, 'bull_use_atr': False, 'bull_use_adx': True, 'bull_use_spike': False, 'bull_rsi_required': False, 'bear_strategy': 'breakout', 'bear_bb_std_mult': 3.1397485283252893, 'bear_rsi_os': 35, 'bear_rsi_ob': 68, 'bear_adx_thresh': 13.21386841683999, 'bear_atr_min_pct': 0.0024668695673024602, 'bear_atr_max_pct': 0.13234799687193827, 'bear_tp_mult': 2.9562968422444125, 'bear_tsl_mult': 0.7305688965632787, 'bear_time_stop': 206, 'bear_use_sma': True, 'bear_use_ema': True, 'bear_use_atr': True, 'bear_use_adx': True, 'bear_use_spike': True, 'bear_rsi_required': True, 'sideways_strategy': 'breakout', 'sideways_bb_std_mult': 2.7957627274466894, 'sideways_rsi_os': 30, 'sideways_rsi_ob': 68, 'sideways_adx_thresh': 26.812811189399877, 'sideways_atr_min_pct': 0.004222199164558836, 'sideways_atr_max_pct': 0.1266043691585937, 'sideways_tp_mult': 1.6439546648236396, 'sideways_tsl_mult': 0.8673048468350799, 'sideways_time_stop': 220, 'sideways_use_sma': True, 'sideways_use_ema': False, 'sideways_use_atr': False, 'sideways_use_adx': False, 'sideways_use_spike': False, 'sideways_rsi_required': True}.
[I 2025-08-31 12:41:37,177] Trial 383 finished with values: [-1000000000.0, 1000000000.0] and parameters: {'p_sma': 53, 'p_std': 36, 'p_atr': 12, 'p_adx': 15, 'rsi_period': 79, 'ema1': 6, 'ema2': 15, 'slip_atr_k': 0.05743488253142311, 'slip_spread_k': 0.4181673388862607, 'spread_hl_frac': 0.012651810849463124, 'bb_std_mult': 2.3415271572035734, 'rsi_os': 43, 'rsi_ob': 71, 'vol_spike': 0.08316816472326682, 'adx_thresh': 9.711776064981233, 'atr_min_pct': 0.0012649705822826126, 'atr_max_pct': 0.13679260394657217, 'tp_mult': 1.9700057699845095, 'tsl_mult': 0.0525210122761575, 'strategy': 'breakout', 'time_stop': 134, 'use_sma': False, 'use_atr': True, 'use_adx': False, 'use_ema': True, 'use_spike': False, 'rsi_required': True, 'edge_k': 0.25259754923713795, 'edge_cap': 0.7486611622665036, 'bull_strategy': 'breakout', 'bull_bb_std_mult': 2.985849187600041, 'bull_rsi_os': 9, 'bull_rsi_ob': 82, 'bull_adx_thresh': 20.795662854975447, 'bull_atr_min_pct': 0.015156783801067409, 'bull_atr_max_pct': 0.12543172822529902, 'bull_tp_mult': 2.7352117713710595, 'bull_tsl_mult': 0.261434867434685, 'bull_time_stop': 153, 'bull_use_sma': True, 'bull_use_ema': True, 'bull_use_atr': False, 'bull_use_adx': True, 'bull_use_spike': False, 'bull_rsi_required': False, 'bear_strategy': 'breakout', 'bear_bb_std_mult': 2.9543244229170575, 'bear_rsi_os': 28, 'bear_rsi_ob': 84, 'bear_adx_thresh': 20.265195950749636, 'bear_atr_min_pct': 0.02779673634698796, 'bear_atr_max_pct': 0.09644312279109961, 'bear_tp_mult': 2.816702306571935, 'bear_tsl_mult': 0.1371985161404748, 'bear_time_stop': 240, 'bear_use_sma': True, 'bear_use_ema': True, 'bear_use_atr': True, 'bear_use_adx': True, 'bear_use_spike': True, 'bear_rsi_required': True, 'sideways_strategy': 'breakout', 'sideways_bb_std_mult': 3.35437132446322, 'sideways_rsi_os': 15, 'sideways_rsi_ob': 82, 'sideways_adx_thresh': 32.018281718315095, 'sideways_atr_min_pct': 0.002499793326207403, 'sideways_atr_max_pct': 0.12804953918293707, 'sideways_tp_mult': 2.370050979238303, 'sideways_tsl_mult': 0.03268358884449146, 'sideways_time_stop': 201, 'sideways_use_sma': True, 'sideways_use_ema': False, 'sideways_use_atr': False, 'sideways_use_adx': False, 'sideways_use_spike': False, 'sideways_rsi_required': True}.
[I 2025-08-31 12:41:37,213] Trial 384 finished with values: [-0.0631638952087673, 0.0625228312781848] and parameters: {'p_sma': 54, 'p_std': 22, 'p_atr': 12, 'p_adx': 15, 'rsi_period': 50, 'ema1': 21, 'ema2': 14, 'slip_atr_k': 0.061671319059547994, 'slip_spread_k': 0.4230198215308682, 'spread_hl_frac': 0.01686343384372061, 'bb_std_mult': 2.35991994057265, 'rsi_os': 35, 'rsi_ob': 82, 'vol_spike': 0.031295895607667684, 'adx_thresh': 19.434308950264555, 'atr_min_pct': 0.0005954830287043208, 'atr_max_pct': 0.11981593866303392, 'tp_mult': 2.7587841117060625, 'tsl_mult': 0.0660089042022012, 'strategy': 'breakout', 'time_stop': 170, 'use_sma': False, 'use_atr': True, 'use_adx': False, 'use_ema': True, 'use_spike': False, 'rsi_required': True, 'edge_k': 0.5418277629624397, 'edge_cap': 0.7265337837830496, 'bull_strategy': 'breakout', 'bull_bb_std_mult': 2.6513019415505377, 'bull_rsi_os': 6, 'bull_rsi_ob': 51, 'bull_adx_thresh': 17.89454747796257, 'bull_atr_min_pct': 0.019133544277179546, 'bull_atr_max_pct': 0.1499121386049667, 'bull_tp_mult': 1.3482866556398823, 'bull_tsl_mult': 0.11430258805315631, 'bull_time_stop': 296, 'bull_use_sma': True, 'bull_use_ema': True, 'bull_use_atr': False, 'bull_use_adx': True, 'bull_use_spike': False, 'bull_rsi_required': False, 'bear_strategy': 'breakout', 'bear_bb_std_mult': 3.121523821040872, 'bear_rsi_os': 35, 'bear_rsi_ob': 69, 'bear_adx_thresh': 13.627595217543064, 'bear_atr_min_pct': 0.0005675300344878315, 'bear_atr_max_pct': 0.1351174102348432, 'bear_tp_mult': 2.9569412168902818, 'bear_tsl_mult': 0.7242399053907026, 'bear_time_stop': 205, 'bear_use_sma': True, 'bear_use_ema': True, 'bear_use_atr': True, 'bear_use_adx': True, 'bear_use_spike': True, 'bear_rsi_required': True, 'sideways_strategy': 'breakout', 'sideways_bb_std_mult': 2.8240122621675456, 'sideways_rsi_os': 30, 'sideways_rsi_ob': 68, 'sideways_adx_thresh': 26.74737206591264, 'sideways_atr_min_pct': 0.004175384190970329, 'sideways_atr_max_pct': 0.12750758330577525, 'sideways_tp_mult': 1.6243821884378997, 'sideways_tsl_mult': 0.8748532842061997, 'sideways_time_stop': 218, 'sideways_use_sma': True, 'sideways_use_ema': False, 'sideways_use_atr': False, 'sideways_use_adx': False, 'sideways_use_spike': False, 'sideways_rsi_required': True}.
[I 2025-08-31 12:41:37,385] Trial 386 finished with values: [-1000000000.0, 1000000000.0] and parameters: {'p_sma': 53, 'p_std': 22, 'p_atr': 13, 'p_adx': 15, 'rsi_period': 49, 'ema1': 22, 'ema2': 14, 'slip_atr_k': 0.061653747161757616, 'slip_spread_k': 0.3322714889576197, 'spread_hl_frac': 0.0190315766276682, 'bb_std_mult': 2.3249602332357364, 'rsi_os': 35, 'rsi_ob': 84, 'vol_spike': 0.03252364490712932, 'adx_thresh': 19.142427571293293, 'atr_min_pct': 0.0004877916440970978, 'atr_max_pct': 0.11358232852014868, 'tp_mult': 2.751472036881556, 'tsl_mult': 0.06044003404979825, 'strategy': 'breakout', 'time_stop': 174, 'use_sma': False, 'use_atr': True, 'use_adx': False, 'use_ema': True, 'use_spike': False, 'rsi_required': True, 'edge_k': 0.56971974067523, 'edge_cap': 0.6927662169021099, 'bull_strategy': 'breakout', 'bull_bb_std_mult': 2.6727581193517103, 'bull_rsi_os': 5, 'bull_rsi_ob': 55, 'bull_adx_thresh': 17.828066678298793, 'bull_atr_min_pct': 0.018570694920552046, 'bull_atr_max_pct': 0.14935427490574163, 'bull_tp_mult': 1.310571117864707, 'bull_tsl_mult': 0.1149731815608399, 'bull_time_stop': 269, 'bull_use_sma': True, 'bull_use_ema': True, 'bull_use_atr': False, 'bull_use_adx': True, 'bull_use_spike': False, 'bull_rsi_required': False, 'bear_strategy': 'breakout', 'bear_bb_std_mult': 3.1539610687492243, 'bear_rsi_os': 14, 'bear_rsi_ob': 71, 'bear_adx_thresh': 13.79852109078676, 'bear_atr_min_pct': 0.003288998205233354, 'bear_atr_max_pct': 0.13295113853090978, 'bear_tp_mult': 2.960275697853232, 'bear_tsl_mult': 0.7312350572561734, 'bear_time_stop': 190, 'bear_use_sma': True, 'bear_use_ema': True, 'bear_use_atr': True, 'bear_use_adx': True, 'bear_use_spike': True, 'bear_rsi_required': True, 'sideways_strategy': 'breakout', 'sideways_bb_std_mult': 2.4642205982503063, 'sideways_rsi_os': 30, 'sideways_rsi_ob': 68, 'sideways_adx_thresh': 26.603507410722557, 'sideways_atr_min_pct': 0.004039765904377793, 'sideways_atr_max_pct': 0.1258662407835969, 'sideways_tp_mult': 1.631977001110819, 'sideways_tsl_mult': 0.8712200531491004, 'sideways_time_stop': 207, 'sideways_use_sma': True, 'sideways_use_ema': False, 'sideways_use_atr': False, 'sideways_use_adx': False, 'sideways_use_spike': True, 'sideways_rsi_required': False}.
