[I 2025-08-31 12:15:53,881] Trial 179 finished with values: [-1000000000.0, 1000000000.0] and parameters: {'p_sma': 38, 'p_std': 35, 'p_atr': 18, 'p_adx': 24, 'rsi_period': 73, 'ema1': 16, 'ema2': 46, 'slip_atr_k': 0.16411365803584863, 'slip_spread_k': 0.13003965129238498, 'spread_hl_frac': 0.03013997682987559, 'bb_std_mult': 0.7605940885256645, 'rsi_os': 42, 'rsi_ob': 63, 'vol_spike': 0.247969810148656, 'adx_thresh': 6.262592452265899, 'atr_min_pct': 0.011252455801820872, 'atr_max_pct': 0.09069759124635116, 'tp_mult': 1.0208274072380772, 'tsl_mult': 0.5521276407167742, 'strategy': 'breakout', 'time_stop': 97, 'use_sma': True, 'use_atr': False, 'use_adx': True, 'use_ema': False, 'use_spike': False, 'rsi_required': False, 'edge_k': 0.5714438683406313, 'edge_cap': 0.6249899211601075, 'bull_strategy': 'mean_reversion', 'bull_bb_std_mult': 1.778758754498059, 'bull_rsi_os': 11, 'bull_rsi_ob': 83, 'bull_adx_thresh': 25.313493752439463, 'bull_atr_min_pct': 0.01589866314271985, 'bull_atr_max_pct': 0.01315818326635887, 'bull_tp_mult': 1.2482847864114532, 'bull_tsl_mult': 0.30645191824823786, 'bull_time_stop': 59, 'bull_use_sma': False, 'bull_use_ema': False, 'bull_use_atr': False, 'bull_use_adx': True, 'bull_use_spike': False, 'bull_rsi_required': True, 'bear_strategy': 'breakout', 'bear_bb_std_mult': 0.8987357237542422, 'bear_rsi_os': 21, 'bear_rsi_ob': 62, 'bear_adx_thresh': 33.155263414551364, 'bear_atr_min_pct': 0.029388059984267405, 'bear_atr_max_pct': 0.12841618516279432, 'bear_tp_mult': 2.8230781147054014, 'bear_tsl_mult': 0.2688286469321145, 'bear_time_stop': 223, 'bear_use_sma': True, 'bear_use_ema': False, 'bear_use_atr': True, 'bear_use_adx': True, 'bear_use_spike': True, 'bear_rsi_required': False, 'sideways_strategy': 'mean_reversion', 'sideways_bb_std_mult': 1.9190246124523467, 'sideways_rsi_os': 33, 'sideways_rsi_ob': 71, 'sideways_adx_thresh': 9.727316980386352, 'sideways_atr_min_pct': 0.0014556106025133755, 'sideways_atr_max_pct': 0.0720774691010876, 'sideways_tp_mult': 1.34757645153246, 'sideways_tsl_mult': 0.39293523983248346, 'sideways_time_stop': 231, 'sideways_use_sma': False, 'sideways_use_ema': True, 'sideways_use_atr': False, 'sideways_use_adx': False, 'sideways_use_spike': False, 'sideways_rsi_required': True}.
[I 2025-08-31 12:15:54,471] Trial 181 finished with values: [-0.03876496691053466, 0.03857632793513577] and parameters: {'p_sma': 33, 'p_std': 35, 'p_atr': 27, 'p_adx': 13, 'rsi_period': 73, 'ema1': 7, 'ema2': 51, 'slip_atr_k': 0.16416030619554223, 'slip_spread_k': 0.12442612578152049, 'spread_hl_frac': 0.04335964815080486, 'bb_std_mult': 1.0008434612272625, 'rsi_os': 21, 'rsi_ob': 62, 'vol_spike': 0.08008395814489538, 'adx_thresh': 14.747475425054725, 'atr_min_pct': 0.02578381543080822, 'atr_max_pct': 0.08481481676288952, 'tp_mult': 1.255348095587974, 'tsl_mult': 0.6799162921858353, 'strategy': 'breakout', 'time_stop': 126, 'use_sma': True, 'use_atr': False, 'use_adx': True, 'use_ema': False, 'use_spike': True, 'rsi_required': False, 'edge_k': 1.6683614418836985, 'edge_cap': 0.25899259599572627, 'bull_strategy': 'mean_reversion', 'bull_bb_std_mult': 0.7122270580543595, 'bull_rsi_os': 10, 'bull_rsi_ob': 83, 'bull_adx_thresh': 25.493041815741268, 'bull_atr_min_pct': 0.0018011196510789654, 'bull_atr_max_pct': 0.12763717581343406, 'bull_tp_mult': 2.9475556586114573, 'bull_tsl_mult': 0.23665093654271746, 'bull_time_stop': 40, 'bull_use_sma': False, 'bull_use_ema': False, 'bull_use_atr': True, 'bull_use_adx': True, 'bull_use_spike': False, 'bull_rsi_required': True, 'bear_strategy': 'mean_reversion', 'bear_bb_std_mult': 1.52223886666294, 'bear_rsi_os': 23, 'bear_rsi_ob': 59, 'bear_adx_thresh': 33.393592745511434, 'bear_atr_min_pct': 0.028681841219752535, 'bear_atr_max_pct': 0.12815678361641475, 'bear_tp_mult': 2.83948434235452, 'bear_tsl_mult': 0.3334868186628713, 'bear_time_stop': 15, 'bear_use_sma': False, 'bear_use_ema': False, 'bear_use_atr': True, 'bear_use_adx': False, 'bear_use_spike': True, 'bear_rsi_required': False, 'sideways_strategy': 'breakout', 'sideways_bb_std_mult': 2.140487654208041, 'sideways_rsi_os': 35, 'sideways_rsi_ob': 45, 'sideways_adx_thresh': 30.058063528733996, 'sideways_atr_min_pct': 0.0013271971159815133, 'sideways_atr_max_pct': 0.14522304141720138, 'sideways_tp_mult': 1.4311880349828197, 'sideways_tsl_mult': 0.6654573662734287, 'sideways_time_stop': 188, 'sideways_use_sma': False, 'sideways_use_ema': True, 'sideways_use_atr': True, 'sideways_use_adx': False, 'sideways_use_spike': False, 'sideways_rsi_required': True}.
[I 2025-08-31 12:16:27,545] Trial 184 finished with values: [-1000000000.0, 1000000000.0] and parameters: {'p_sma': 33, 'p_std': 38, 'p_atr': 11, 'p_adx': 13, 'rsi_period': 50, 'ema1': 6, 'ema2': 38, 'slip_atr_k': 0.08348593547826907, 'slip_spread_k': 0.9590962228395845, 'spread_hl_frac': 0.04364731515992035, 'bb_std_mult': 1.0098125578533699, 'rsi_os': 43, 'rsi_ob': 60, 'vol_spike': 0.15869388976365942, 'adx_thresh': 23.18433641376998, 'atr_min_pct': 0.02931864748916979, 'atr_max_pct': 0.10682970080718855, 'tp_mult': 2.5072563429972257, 'tsl_mult': 0.6822691196296718, 'strategy': 'mean_reversion', 'time_stop': 106, 'use_sma': True, 'use_atr': False, 'use_adx': False, 'use_ema': False, 'use_spike': True, 'rsi_required': False, 'edge_k': 1.1174528575879734, 'edge_cap': 0.31417994888605844, 'bull_strategy': 'mean_reversion', 'bull_bb_std_mult': 3.2448446451327793, 'bull_rsi_os': 14, 'bull_rsi_ob': 95, 'bull_adx_thresh': 9.309861758105914, 'bull_atr_min_pct': 0.004020485891972389, 'bull_atr_max_pct': 0.06867173990671878, 'bull_tp_mult': 2.2086767221209627, 'bull_tsl_mult': 0.6421452926973695, 'bull_time_stop': 38, 'bull_use_sma': True, 'bull_use_ema': False, 'bull_use_atr': True, 'bull_use_adx': True, 'bull_use_spike': False, 'bull_rsi_required': True, 'bear_strategy': 'mean_reversion', 'bear_bb_std_mult': 3.4095042350013545, 'bear_rsi_os': 23, 'bear_rsi_ob': 64, 'bear_adx_thresh': 23.404569950628943, 'bear_atr_min_pct': 0.0074930742843656774, 'bear_atr_max_pct': 0.013164773799641025, 'bear_tp_mult': 1.4107597351150307, 'bear_tsl_mult': 0.4681434991242111, 'bear_time_stop': 179, 'bear_use_sma': False, 'bear_use_ema': False, 'bear_use_atr': False, 'bear_use_adx': False, 'bear_use_spike': True, 'bear_rsi_required': False, 'sideways_strategy': 'breakout', 'sideways_bb_std_mult': 2.145914670190857, 'sideways_rsi_os': 37, 'sideways_rsi_ob': 65, 'sideways_adx_thresh': 10.324127664730435, 'sideways_atr_min_pct': 0.019439776990893148, 'sideways_atr_max_pct': 0.06358274790173492, 'sideways_tp_mult': 1.2819463992244111, 'sideways_tsl_mult': 0.42554853232836665, 'sideways_time_stop': 187, 'sideways_use_sma': True, 'sideways_use_ema': False, 'sideways_use_atr': True, 'sideways_use_adx': False, 'sideways_use_spike': False, 'sideways_rsi_required': True}.
[I 2025-08-31 12:16:28,033] Trial 183 finished with values: [-0.08151317802167013, 0.08122962106050628] and parameters: {'p_sma': 34, 'p_std': 17, 'p_atr': 11, 'p_adx': 13, 'rsi_period': 70, 'ema1': 19, 'ema2': 38, 'slip_atr_k': 0.15014414282489683, 'slip_spread_k': 0.9817826210446039, 'spread_hl_frac': 0.02599668975920084, 'bb_std_mult': 1.0107104270536222, 'rsi_os': 43, 'rsi_ob': 60, 'vol_spike': 0.27145291706608804, 'adx_thresh': 23.26085669058274, 'atr_min_pct': 0.007077509034302442, 'atr_max_pct': 0.07496614982780742, 'tp_mult': 2.5063278790911263, 'tsl_mult': 0.7853284045047659, 'strategy': 'mean_reversion', 'time_stop': 106, 'use_sma': True, 'use_atr': False, 'use_adx': False, 'use_ema': False, 'use_spike': True, 'rsi_required': False, 'edge_k': 1.165253584071017, 'edge_cap': 0.2611455882791384, 'bull_strategy': 'mean_reversion', 'bull_bb_std_mult': 3.240462625002323, 'bull_rsi_os': 13, 'bull_rsi_ob': 86, 'bull_adx_thresh': 9.171275669063169, 'bull_atr_min_pct': 0.0018216063869211426, 'bull_atr_max_pct': 0.10942378030690214, 'bull_tp_mult': 1.0608473428786378, 'bull_tsl_mult': 0.6453783297967172, 'bull_time_stop': 37, 'bull_use_sma': True, 'bull_use_ema': False, 'bull_use_atr': True, 'bull_use_adx': True, 'bull_use_spike': False, 'bull_rsi_required': True, 'bear_strategy': 'mean_reversion', 'bear_bb_std_mult': 3.4135321872244972, 'bear_rsi_os': 23, 'bear_rsi_ob': 64, 'bear_adx_thresh': 13.284166951880103, 'bear_atr_min_pct': 0.012177274791752249, 'bear_atr_max_pct': 0.09710982109303201, 'bear_tp_mult': 1.4038306240737963, 'bear_tsl_mult': 0.3323807071801207, 'bear_time_stop': 277, 'bear_use_sma': False, 'bear_use_ema': False, 'bear_use_atr': False, 'bear_use_adx': False, 'bear_use_spike': True, 'bear_rsi_required': False, 'sideways_strategy': 'breakout', 'sideways_bb_std_mult': 2.135254434508463, 'sideways_rsi_os': 14, 'sideways_rsi_ob': 65, 'sideways_adx_thresh': 8.581054825126714, 'sideways_atr_min_pct': 0.019033495995557925, 'sideways_atr_max_pct': 0.06309758816746655, 'sideways_tp_mult': 2.813475736983846, 'sideways_tsl_mult': 0.6645687944460102, 'sideways_time_stop': 188, 'sideways_use_sma': True, 'sideways_use_ema': False, 'sideways_use_atr': True, 'sideways_use_adx': False, 'sideways_use_spike': False, 'sideways_rsi_required': True}.
[I 2025-08-31 12:16:28,046] Trial 182 finished with values: [-1000000000.0, 1000000000.0] and parameters: {'p_sma': 33, 'p_std': 23, 'p_atr': 11, 'p_adx': 13, 'rsi_period': 70, 'ema1': 7, 'ema2': 46, 'slip_atr_k': 0.08314907653179403, 'slip_spread_k': 0.6769169577740963, 'spread_hl_frac': 0.02994526368724072, 'bb_std_mult': 1.6254298041280788, 'rsi_os': 38, 'rsi_ob': 53, 'vol_spike': 0.08142820977344517, 'adx_thresh': 6.3480956482577735, 'atr_min_pct': 0.004675276228396476, 'atr_max_pct': 0.08452385029209569, 'tp_mult': 2.5127682904822066, 'tsl_mult': 0.5493799187579809, 'strategy': 'breakout', 'time_stop': 127, 'use_sma': True, 'use_atr': False, 'use_adx': False, 'use_ema': False, 'use_spike': True, 'rsi_required': False, 'edge_k': 1.178718412331798, 'edge_cap': 0.15763794184736585, 'bull_strategy': 'mean_reversion', 'bull_bb_std_mult': 1.7473980012074477, 'bull_rsi_os': 12, 'bull_rsi_ob': 83, 'bull_adx_thresh': 25.16540377391359, 'bull_atr_min_pct': 0.0069789517455901215, 'bull_atr_max_pct': 0.026259862764428103, 'bull_tp_mult': 2.9457714452553687, 'bull_tsl_mult': 0.7379903391846587, 'bull_time_stop': 224, 'bull_use_sma': True, 'bull_use_ema': False, 'bull_use_atr': True, 'bull_use_adx': True, 'bull_use_spike': False, 'bull_rsi_required': True, 'bear_strategy': 'mean_reversion', 'bear_bb_std_mult': 3.4450970470941717, 'bear_rsi_os': 51, 'bear_rsi_ob': 64, 'bear_adx_thresh': 17.38774877012545, 'bear_atr_min_pct': 0.011767964579860337, 'bear_atr_max_pct': 0.011075066043603518, 'bear_tp_mult': 1.9507654645472312, 'bear_tsl_mult': 0.4729191018376002, 'bear_time_stop': 279, 'bear_use_sma': False, 'bear_use_ema': False, 'bear_use_atr': True, 'bear_use_adx': False, 'bear_use_spike': True, 'bear_rsi_required': False, 'sideways_strategy': 'mean_reversion', 'sideways_bb_std_mult': 2.1147409822043195, 'sideways_rsi_os': 35, 'sideways_rsi_ob': 45, 'sideways_adx_thresh': 8.617379391564372, 'sideways_atr_min_pct': 0.01953425903665553, 'sideways_atr_max_pct': 0.07966378637619284, 'sideways_tp_mult': 2.82348035293692, 'sideways_tsl_mult': 0.3547866994954152, 'sideways_time_stop': 178, 'sideways_use_sma': True, 'sideways_use_ema': False, 'sideways_use_atr': True, 'sideways_use_adx': False, 'sideways_use_spike': False, 'sideways_rsi_required': True}.
[I 2025-08-31 12:16:28,213] Trial 185 finished with values: [-1000000000.0, 1000000000.0] and parameters: {'p_sma': 33, 'p_std': 19, 'p_atr': 27, 'p_adx': 15, 'rsi_period': 73, 'ema1': 19, 'ema2': 38, 'slip_atr_k': 0.148673762563392, 'slip_spread_k': 0.1601557445373482, 'spread_hl_frac': 0.04341543440915906, 'bb_std_mult': 1.0005390705017345, 'rsi_os': 41, 'rsi_ob': 60, 'vol_spike': 0.1536287314093055, 'adx_thresh': 14.529665571710646, 'atr_min_pct': 0.028720085629987405, 'atr_max_pct': 0.10659830939398256, 'tp_mult': 2.5211751677347105, 'tsl_mult': 0.8106355056103793, 'strategy': 'mean_reversion', 'time_stop': 102, 'use_sma': True, 'use_atr': False, 'use_adx': False, 'use_ema': False, 'use_spike': True, 'rsi_required': False, 'edge_k': 1.1772150619650656, 'edge_cap': 0.26024425893163017, 'bull_strategy': 'mean_reversion', 'bull_bb_std_mult': 0.7541920914292681, 'bull_rsi_os': 12, 'bull_rsi_ob': 83, 'bull_adx_thresh': 9.585425475544405, 'bull_atr_min_pct': 0.008686275449008908, 'bull_atr_max_pct': 0.12852501299447738, 'bull_tp_mult': 2.209239603272468, 'bull_tsl_mult': 0.23390080013390152, 'bull_time_stop': 110, 'bull_use_sma': True, 'bull_use_ema': False, 'bull_use_atr': True, 'bull_use_adx': True, 'bull_use_spike': False, 'bull_rsi_required': True, 'bear_strategy': 'mean_reversion', 'bear_bb_std_mult': 1.5326550302373232, 'bear_rsi_os': 23, 'bear_rsi_ob': 59, 'bear_adx_thresh': 13.13708621980251, 'bear_atr_min_pct': 0.028592739229261196, 'bear_atr_max_pct': 0.09619207226456554, 'bear_tp_mult': 2.19812313866681, 'bear_tsl_mult': 0.19689383471852853, 'bear_time_stop': 181, 'bear_use_sma': False, 'bear_use_ema': False, 'bear_use_atr': False, 'bear_use_adx': False, 'bear_use_spike': True, 'bear_rsi_required': False, 'sideways_strategy': 'breakout', 'sideways_bb_std_mult': 3.3625264973231372, 'sideways_rsi_os': 37, 'sideways_rsi_ob': 45, 'sideways_adx_thresh': 8.797060304546415, 'sideways_atr_min_pct': 0.002457393599889267, 'sideways_atr_max_pct': 0.12175649991091442, 'sideways_tp_mult': 1.2726330303341014, 'sideways_tsl_mult': 0.6670079768701833, 'sideways_time_stop': 187, 'sideways_use_sma': True, 'sideways_use_ema': True, 'sideways_use_atr': True, 'sideways_use_adx': False, 'sideways_use_spike': False, 'sideways_rsi_required': True}.
[I 2025-08-31 12:16:28,698] Trial 188 finished with values: [-1000000000.0, 1000000000.0] and parameters: {'p_sma': 32, 'p_std': 14, 'p_atr': 10, 'p_adx': 15, 'rsi_period': 10, 'ema1': 6, 'ema2': 36, 'slip_atr_k': 0.08903737553501538, 'slip_spread_k': 0.1502724341630321, 'spread_hl_frac': 0.02618506595470727, 'bb_std_mult': 1.0793548198685905, 'rsi_os': 41, 'rsi_ob': 47, 'vol_spike': 0.10493059375540689, 'adx_thresh': 8.104728046141686, 'atr_min_pct': 0.027240093948073942, 'atr_max_pct': 0.11173889411740417, 'tp_mult': 1.2484248175604786, 'tsl_mult': 0.4745922448715852, 'strategy': 'mean_reversion', 'time_stop': 299, 'use_sma': True, 'use_atr': False, 'use_adx': True, 'use_ema': False, 'use_spike': True, 'rsi_required': True, 'edge_k': 1.7942290150895535, 'edge_cap': 0.811982090382581, 'bull_strategy': 'mean_reversion', 'bull_bb_std_mult': 0.7024781461014427, 'bull_rsi_os': 10, 'bull_rsi_ob': 46, 'bull_adx_thresh': 8.36292978210764, 'bull_atr_min_pct': 0.009913397436051814, 'bull_atr_max_pct': 0.051066926347394875, 'bull_tp_mult': 2.7955693176709557, 'bull_tsl_mult': 0.2438817288533031, 'bull_time_stop': 260, 'bull_use_sma': False, 'bull_use_ema': True, 'bull_use_atr': False, 'bull_use_adx': True, 'bull_use_spike': False, 'bull_rsi_required': True, 'bear_strategy': 'mean_reversion', 'bear_bb_std_mult': 1.527209598304884, 'bear_rsi_os': 26, 'bear_rsi_ob': 59, 'bear_adx_thresh': 15.816331725627595, 'bear_atr_min_pct': 0.028466291280063116, 'bear_atr_max_pct': 0.10346425395385919, 'bear_tp_mult': 1.5246864232610946, 'bear_tsl_mult': 0.18687857970058097, 'bear_time_stop': 21, 'bear_use_sma': False, 'bear_use_ema': False, 'bear_use_atr': False, 'bear_use_adx': False, 'bear_use_spike': True, 'bear_rsi_required': False, 'sideways_strategy': 'breakout', 'sideways_bb_std_mult': 3.330808174715132, 'sideways_rsi_os': 31, 'sideways_rsi_ob': 49, 'sideways_adx_thresh': 29.874644369065194, 'sideways_atr_min_pct': 0.0027439386797665027, 'sideways_atr_max_pct': 0.11365546862126678, 'sideways_tp_mult': 1.406569560251749, 'sideways_tsl_mult': 0.9115544072354, 'sideways_time_stop': 195, 'sideways_use_sma': False, 'sideways_use_ema': True, 'sideways_use_atr': True, 'sideways_use_adx': False, 'sideways_use_spike': False, 'sideways_rsi_required': True}.
[I 2025-08-31 12:17:06,597] Trial 190 finished with values: [-1000000000.0, 1000000000.0] and parameters: {'p_sma': 31, 'p_std': 42, 'p_atr': 12, 'p_adx': 16, 'rsi_period': 16, 'ema1': 25, 'ema2': 51, 'slip_atr_k': 0.1119073458910134, 'slip_spread_k': 0.10839095292271787, 'spread_hl_frac': 0.02661300084454885, 'bb_std_mult': 1.8706397682006086, 'rsi_os': 6, 'rsi_ob': 83, 'vol_spike': 0.2576352547750713, 'adx_thresh': 12.882747454296759, 'atr_min_pct': 0.021984963386345407, 'atr_max_pct': 0.08077624949034923, 'tp_mult': 2.6494485299550137, 'tsl_mult': 0.44178929686886254, 'strategy': 'breakout', 'time_stop': 77, 'use_sma': True, 'use_atr': True, 'use_adx': True, 'use_ema': False, 'use_spike': False, 'rsi_required': False, 'edge_k': 0.45026645487460604, 'edge_cap': 0.2379360809954778, 'bull_strategy': 'breakout', 'bull_bb_std_mult': 3.3318295515982133, 'bull_rsi_os': 33, 'bull_rsi_ob': 85, 'bull_adx_thresh': 11.795442420131188, 'bull_atr_min_pct': 0.02630953847091938, 'bull_atr_max_pct': 0.047657072138187186, 'bull_tp_mult': 1.803478736446774, 'bull_tsl_mult': 0.3371683860259946, 'bull_time_stop': 88, 'bull_use_sma': False, 'bull_use_ema': False, 'bull_use_atr': False, 'bull_use_adx': True, 'bull_use_spike': False, 'bull_rsi_required': True, 'bear_strategy': 'breakout', 'bear_bb_std_mult': 0.5584064427289148, 'bear_rsi_os': 24, 'bear_rsi_ob': 61, 'bear_adx_thresh': 33.43535367852019, 'bear_atr_min_pct': 0.029977401740447728, 'bear_atr_max_pct': 0.09195628942592918, 'bear_tp_mult': 1.7528358555273398, 'bear_tsl_mult': 0.7730758111798783, 'bear_time_stop': 95, 'bear_use_sma': False, 'bear_use_ema': True, 'bear_use_atr': False, 'bear_use_adx': False, 'bear_use_spike': True, 'bear_rsi_required': False, 'sideways_strategy': 'breakout', 'sideways_bb_std_mult': 2.0756974135394897, 'sideways_rsi_os': 35, 'sideways_rsi_ob': 47, 'sideways_adx_thresh': 13.511715438664938, 'sideways_atr_min_pct': 0.004490519191210842, 'sideways_atr_max_pct': 0.048776431045472565, 'sideways_tp_mult': 1.433203393466662, 'sideways_tsl_mult': 0.4515451304233501, 'sideways_time_stop': 180, 'sideways_use_sma': False, 'sideways_use_ema': True, 'sideways_use_atr': True, 'sideways_use_adx': False, 'sideways_use_spike': False, 'sideways_rsi_required': True}.
[I 2025-08-31 12:17:06,855] Trial 187 finished with values: [-1000000000.0, 1000000000.0] and parameters: {'p_sma': 32, 'p_std': 14, 'p_atr': 26, 'p_adx': 15, 'rsi_period': 73, 'ema1': 27, 'ema2': 36, 'slip_atr_k': 0.19517545304417527, 'slip_spread_k': 0.15295066467523633, 'spread_hl_frac': 0.026579830980686826, 'bb_std_mult': 1.0937422335570257, 'rsi_os': 21, 'rsi_ob': 76, 'vol_spike': 0.25547581323281876, 'adx_thresh': 7.273244859578476, 'atr_min_pct': 0.028595955562022525, 'atr_max_pct': 0.08099561243037913, 'tp_mult': 2.624327801425776, 'tsl_mult': 0.31707987136391047, 'strategy': 'mean_reversion', 'time_stop': 299, 'use_sma': True, 'use_atr': False, 'use_adx': True, 'use_ema': False, 'use_spike': True, 'rsi_required': True, 'edge_k': 1.0791596997508226, 'edge_cap': 0.19897164626517166, 'bull_strategy': 'mean_reversion', 'bull_bb_std_mult': 3.3403728379073554, 'bull_rsi_os': 32, 'bull_rsi_ob': 63, 'bull_adx_thresh': 8.680850716617078, 'bull_atr_min_pct': 0.026746706786689556, 'bull_atr_max_pct': 0.06544803455164239, 'bull_tp_mult': 2.7775897638996017, 'bull_tsl_mult': 0.5314017145265801, 'bull_time_stop': 108, 'bull_use_sma': False, 'bull_use_ema': True, 'bull_use_atr': False, 'bull_use_adx': True, 'bull_use_spike': False, 'bull_rsi_required': True, 'bear_strategy': 'mean_reversion', 'bear_bb_std_mult': 2.3182587821852776, 'bear_rsi_os': 26, 'bear_rsi_ob': 59, 'bear_adx_thresh': 33.59772813412425, 'bear_atr_min_pct': 0.029989136168719056, 'bear_atr_max_pct': 0.10329475715688717, 'bear_tp_mult': 1.5273484073700643, 'bear_tsl_mult': 0.19294944567840994, 'bear_time_stop': 283, 'bear_use_sma': False, 'bear_use_ema': False, 'bear_use_atr': False, 'bear_use_adx': False, 'bear_use_spike': True, 'bear_rsi_required': False, 'sideways_strategy': 'breakout', 'sideways_bb_std_mult': 0.6345763340222592, 'sideways_rsi_os': 39, 'sideways_rsi_ob': 49, 'sideways_adx_thresh': 32.31826368328179, 'sideways_atr_min_pct': 0.002749174691253773, 'sideways_atr_max_pct': 0.12218089879310304, 'sideways_tp_mult': 1.4330218332281928, 'sideways_tsl_mult': 0.4449022858200891, 'sideways_time_stop': 195, 'sideways_use_sma': False, 'sideways_use_ema': True, 'sideways_use_atr': True, 'sideways_use_adx': False, 'sideways_use_spike': False, 'sideways_rsi_required': True}.
