[I 2025-08-31 12:07:19,697] Trial 110 finished with values: [-1000000000.0, 1000000000.0] and parameters: {'p_sma': 35, 'p_std': 29, 'p_atr': 13, 'p_adx': 13, 'rsi_period': 79, 'ema1': 5, 'ema2': 42, 'slip_atr_k': 0.12839317425816793, 'slip_spread_k': 0.16077394722093596, 'spread_hl_frac': 0.02497476430091542, 'bb_std_mult': 0.9356324283687654, 'rsi_os': 47, 'rsi_ob': 79, 'vol_spike': 0.2462170630669113, 'adx_thresh': 22.98803948309253, 'atr_min_pct': 0.029330896582473336, 'atr_max_pct': 0.10192650624321423, 'tp_mult': 2.4819596737507585, 'tsl_mult': 0.6042159064908327, 'strategy': 'breakout', 'time_stop': 120, 'use_sma': True, 'use_atr': False, 'use_adx': True, 'use_ema': False, 'use_spike': True, 'rsi_required': False, 'edge_k': 1.1636028626312134, 'edge_cap': 0.2312504043106553, 'bull_strategy': 'mean_reversion', 'bull_bb_std_mult': 3.2388961280124935, 'bull_rsi_os': 12, 'bull_rsi_ob': 87, 'bull_adx_thresh': 10.431941728700915, 'bull_atr_min_pct': 0.02583360764453659, 'bull_atr_max_pct': 0.03721336444120367, 'bull_tp_mult': 2.5407679542857164, 'bull_tsl_mult': 0.30317519175901003, 'bull_time_stop': 76, 'bull_use_sma': True, 'bull_use_ema': False, 'bull_use_atr': False, 'bull_use_adx': True, 'bull_use_spike': False, 'bull_rsi_required': False, 'bear_strategy': 'mean_reversion', 'bear_bb_std_mult': 1.5540722182839257, 'bear_rsi_os': 24, 'bear_rsi_ob': 59, 'bear_adx_thresh': 31.307620704666178, 'bear_atr_min_pct': 0.02591344208328584, 'bear_atr_max_pct': 0.11028008452223116, 'bear_tp_mult': 1.4969516955621, 'bear_tsl_mult': 0.2680851621917467, 'bear_time_stop': 245, 'bear_use_sma': False, 'bear_use_ema': False, 'bear_use_atr': False, 'bear_use_adx': False, 'bear_use_spike': True, 'bear_rsi_required': False, 'sideways_strategy': 'breakout', 'sideways_bb_std_mult': 1.9753533676703043, 'sideways_rsi_os': 32, 'sideways_rsi_ob': 45, 'sideways_adx_thresh': 11.13570950167964, 'sideways_atr_min_pct': 0.0010860797587743734, 'sideways_atr_max_pct': 0.06577248339558729, 'sideways_tp_mult': 1.2928192773553429, 'sideways_tsl_mult': 0.47811993133732367, 'sideways_time_stop': 120, 'sideways_use_sma': True, 'sideways_use_ema': True, 'sideways_use_atr': True, 'sideways_use_adx': False, 'sideways_use_spike': False, 'sideways_rsi_required': True}.
[I 2025-08-31 12:07:19,801] Trial 111 finished with values: [-1000000000.0, 1000000000.0] and parameters: {'p_sma': 26, 'p_std': 15, 'p_atr': 13, 'p_adx': 13, 'rsi_period': 80, 'ema1': 5, 'ema2': 35, 'slip_atr_k': 0.1274851744039958, 'slip_spread_k': 0.141107693812431, 'spread_hl_frac': 0.023537063832008133, 'bb_std_mult': 0.9536336592601591, 'rsi_os': 47, 'rsi_ob': 66, 'vol_spike': 0.23993643832786904, 'adx_thresh': 23.098897328358355, 'atr_min_pct': 0.02909185466390952, 'atr_max_pct': 0.07178658008913581, 'tp_mult': 2.611739521578212, 'tsl_mult': 0.5984473660020613, 'strategy': 'breakout', 'time_stop': 102, 'use_sma': True, 'use_atr': False, 'use_adx': True, 'use_ema': False, 'use_spike': True, 'rsi_required': False, 'edge_k': 1.004879311929677, 'edge_cap': 0.23315184449974224, 'bull_strategy': 'mean_reversion', 'bull_bb_std_mult': 3.22247362130727, 'bull_rsi_os': 12, 'bull_rsi_ob': 87, 'bull_adx_thresh': 10.242351473194173, 'bull_atr_min_pct': 0.02592807515353767, 'bull_atr_max_pct': 0.0364117366225363, 'bull_tp_mult': 2.7307461469623457, 'bull_tsl_mult': 0.2893015267417133, 'bull_time_stop': 78, 'bull_use_sma': True, 'bull_use_ema': False, 'bull_use_atr': False, 'bull_use_adx': True, 'bull_use_spike': False, 'bull_rsi_required': False, 'bear_strategy': 'mean_reversion', 'bear_bb_std_mult': 1.5542182725770401, 'bear_rsi_os': 23, 'bear_rsi_ob': 59, 'bear_adx_thresh': 30.653448245888566, 'bear_atr_min_pct': 0.02357086508504782, 'bear_atr_max_pct': 0.10076680469132296, 'bear_tp_mult': 1.4277723209590312, 'bear_tsl_mult': 0.2631964021553443, 'bear_time_stop': 260, 'bear_use_sma': False, 'bear_use_ema': False, 'bear_use_atr': False, 'bear_use_adx': False, 'bear_use_spike': True, 'bear_rsi_required': False, 'sideways_strategy': 'breakout', 'sideways_bb_std_mult': 2.0032288096360205, 'sideways_rsi_os': 35, 'sideways_rsi_ob': 46, 'sideways_adx_thresh': 11.221925524458815, 'sideways_atr_min_pct': 0.01530391650828955, 'sideways_atr_max_pct': 0.05759748078817471, 'sideways_tp_mult': 1.27956118483731, 'sideways_tsl_mult': 0.4757554994809047, 'sideways_time_stop': 117, 'sideways_use_sma': True, 'sideways_use_ema': True, 'sideways_use_atr': True, 'sideways_use_adx': False, 'sideways_use_spike': False, 'sideways_rsi_required': True}.
[I 2025-08-31 12:07:19,969] Trial 108 finished with values: [-0.03555873943063326, 0.03546301962679837] and parameters: {'p_sma': 40, 'p_std': 25, 'p_atr': 12, 'p_adx': 14, 'rsi_period': 71, 'ema1': 5, 'ema2': 35, 'slip_atr_k': 0.09117018698448576, 'slip_spread_k': 0.169158663162625, 'spread_hl_frac': 0.027852928104493545, 'bb_std_mult': 0.9973608285830213, 'rsi_os': 43, 'rsi_ob': 61, 'vol_spike': 0.2739037529841217, 'adx_thresh': 17.21164665506586, 'atr_min_pct': 0.029336141230121314, 'atr_max_pct': 0.07651844185520548, 'tp_mult': 2.630533814527737, 'tsl_mult': 0.5473639740863996, 'strategy': 'mean_reversion', 'time_stop': 101, 'use_sma': True, 'use_atr': False, 'use_adx': True, 'use_ema': False, 'use_spike': True, 'rsi_required': False, 'edge_k': 0.4646305530899656, 'edge_cap': 0.27790093119894665, 'bull_strategy': 'mean_reversion', 'bull_bb_std_mult': 3.3170019399918242, 'bull_rsi_os': 13, 'bull_rsi_ob': 80, 'bull_adx_thresh': 10.240729261821159, 'bull_atr_min_pct': 0.0035923450599833484, 'bull_atr_max_pct': 0.02036129548891257, 'bull_tp_mult': 2.73819782935918, 'bull_tsl_mult': 0.3023600788574292, 'bull_time_stop': 77, 'bull_use_sma': True, 'bull_use_ema': False, 'bull_use_atr': False, 'bull_use_adx': True, 'bull_use_spike': False, 'bull_rsi_required': False, 'bear_strategy': 'mean_reversion', 'bear_bb_std_mult': 1.5707087932939348, 'bear_rsi_os': 24, 'bear_rsi_ob': 60, 'bear_adx_thresh': 33.83846575057261, 'bear_atr_min_pct': 0.028718322182831414, 'bear_atr_max_pct': 0.09760991000884207, 'bear_tp_mult': 1.5073239750188776, 'bear_tsl_mult': 0.6720587077723666, 'bear_time_stop': 248, 'bear_use_sma': False, 'bear_use_ema': False, 'bear_use_atr': False, 'bear_use_adx': False, 'bear_use_spike': True, 'bear_rsi_required': False, 'sideways_strategy': 'breakout', 'sideways_bb_std_mult': 2.0650473582145272, 'sideways_rsi_os': 36, 'sideways_rsi_ob': 47, 'sideways_adx_thresh': 6.205714419447544, 'sideways_atr_min_pct': 0.0023853786055040285, 'sideways_atr_max_pct': 0.07110048899560002, 'sideways_tp_mult': 1.3802648225029, 'sideways_tsl_mult': 0.4762841859357953, 'sideways_time_stop': 174, 'sideways_use_sma': True, 'sideways_use_ema': True, 'sideways_use_atr': True, 'sideways_use_adx': False, 'sideways_use_spike': False, 'sideways_rsi_required': True}.
[I 2025-08-31 12:07:19,982] Trial 109 finished with values: [-1000000000.0, 1000000000.0] and parameters: {'p_sma': 27, 'p_std': 29, 'p_atr': 13, 'p_adx': 13, 'rsi_period': 79, 'ema1': 5, 'ema2': 35, 'slip_atr_k': 0.12342138315638948, 'slip_spread_k': 0.0032834107919341438, 'spread_hl_frac': 0.0244809643995048, 'bb_std_mult': 0.9294965952350711, 'rsi_os': 44, 'rsi_ob': 61, 'vol_spike': 0.24225098421938554, 'adx_thresh': 23.111401437435475, 'atr_min_pct': 0.029513755335206802, 'atr_max_pct': 0.0723307238527271, 'tp_mult': 2.5484072559150817, 'tsl_mult': 0.47047496771385716, 'strategy': 'breakout', 'time_stop': 96, 'use_sma': True, 'use_atr': False, 'use_adx': True, 'use_ema': False, 'use_spike': True, 'rsi_required': False, 'edge_k': 1.0082481651238062, 'edge_cap': 0.22839163503098772, 'bull_strategy': 'mean_reversion', 'bull_bb_std_mult': 3.2410067585165967, 'bull_rsi_os': 13, 'bull_rsi_ob': 87, 'bull_adx_thresh': 10.3471186250014, 'bull_atr_min_pct': 0.02605176473282102, 'bull_atr_max_pct': 0.013751413614580162, 'bull_tp_mult': 2.9326128256208173, 'bull_tsl_mult': 0.28672036885513064, 'bull_time_stop': 81, 'bull_use_sma': True, 'bull_use_ema': False, 'bull_use_atr': False, 'bull_use_adx': True, 'bull_use_spike': False, 'bull_rsi_required': False, 'bear_strategy': 'mean_reversion', 'bear_bb_std_mult': 1.5715729202922755, 'bear_rsi_os': 24, 'bear_rsi_ob': 59, 'bear_adx_thresh': 30.878121094349538, 'bear_atr_min_pct': 0.023205317518843572, 'bear_atr_max_pct': 0.11212936322558369, 'bear_tp_mult': 1.5020895010049014, 'bear_tsl_mult': 0.25415912907708715, 'bear_time_stop': 245, 'bear_use_sma': False, 'bear_use_ema': False, 'bear_use_atr': False, 'bear_use_adx': False, 'bear_use_spike': True, 'bear_rsi_required': False, 'sideways_strategy': 'breakout', 'sideways_bb_std_mult': 1.7875827655030747, 'sideways_rsi_os': 33, 'sideways_rsi_ob': 45, 'sideways_adx_thresh': 11.185319000794617, 'sideways_atr_min_pct': 0.0008542086204435626, 'sideways_atr_max_pct': 0.06440740103630023, 'sideways_tp_mult': 1.2946161817268167, 'sideways_tsl_mult': 0.029471803547591713, 'sideways_time_stop': 183, 'sideways_use_sma': True, 'sideways_use_ema': True, 'sideways_use_atr': True, 'sideways_use_adx': False, 'sideways_use_spike': False, 'sideways_rsi_required': True}.
[I 2025-08-31 12:07:50,389] Trial 113 finished with values: [-1000000000.0, 1000000000.0] and parameters: {'p_sma': 31, 'p_std': 36, 'p_atr': 10, 'p_adx': 14, 'rsi_period': 72, 'ema1': 5, 'ema2': 34, 'slip_atr_k': 0.14819408045268012, 'slip_spread_k': 0.13264097079088077, 'spread_hl_frac': 0.021637660284740044, 'bb_std_mult': 0.7678086541280941, 'rsi_os': 44, 'rsi_ob': 67, 'vol_spike': 0.08828639783240663, 'adx_thresh': 21.603431723646278, 'atr_min_pct': 0.02655242580687521, 'atr_max_pct': 0.08528984988563153, 'tp_mult': 2.54059096090507, 'tsl_mult': 0.46494768938819775, 'strategy': 'mean_reversion', 'time_stop': 52, 'use_sma': True, 'use_atr': False, 'use_adx': True, 'use_ema': False, 'use_spike': True, 'rsi_required': False, 'edge_k': 0.9397936909814778, 'edge_cap': 0.14873046526932687, 'bull_strategy': 'mean_reversion', 'bull_bb_std_mult': 3.3548973824426627, 'bull_rsi_os': 5, 'bull_rsi_ob': 89, 'bull_adx_thresh': 8.306607791813711, 'bull_atr_min_pct': 0.026593972660238017, 'bull_atr_max_pct': 0.029821513076186145, 'bull_tp_mult': 2.930425709065935, 'bull_tsl_mult': 0.24783086048571823, 'bull_time_stop': 103, 'bull_use_sma': False, 'bull_use_ema': False, 'bull_use_atr': True, 'bull_use_adx': True, 'bull_use_spike': False, 'bull_rsi_required': True, 'bear_strategy': 'mean_reversion', 'bear_bb_std_mult': 1.1703303671419176, 'bear_rsi_os': 50, 'bear_rsi_ob': 57, 'bear_adx_thresh': 32.67958404841637, 'bear_atr_min_pct': 0.026346072220454573, 'bear_atr_max_pct': 0.11258387041241827, 'bear_tp_mult': 1.7955977425943204, 'bear_tsl_mult': 0.1331614878365202, 'bear_time_stop': 260, 'bear_use_sma': False, 'bear_use_ema': False, 'bear_use_atr': False, 'bear_use_adx': False, 'bear_use_spike': True, 'bear_rsi_required': False, 'sideways_strategy': 'breakout', 'sideways_bb_std_mult': 1.8114214481923816, 'sideways_rsi_os': 5, 'sideways_rsi_ob': 48, 'sideways_adx_thresh': 6.379180650222511, 'sideways_atr_min_pct': 0.00246693092991115, 'sideways_atr_max_pct': 0.06216912691907666, 'sideways_tp_mult': 1.139275690535011, 'sideways_tsl_mult': 0.4146431163136843, 'sideways_time_stop': 163, 'sideways_use_sma': False, 'sideways_use_ema': True, 'sideways_use_atr': True, 'sideways_use_adx': False, 'sideways_use_spike': False, 'sideways_rsi_required': True}.
[I 2025-08-31 12:07:50,572] Trial 114 finished with values: [-1000000000.0, 1000000000.0] and parameters: {'p_sma': 30, 'p_std': 42, 'p_atr': 16, 'p_adx': 14, 'rsi_period': 72, 'ema1': 5, 'ema2': 34, 'slip_atr_k': 0.10838945608268019, 'slip_spread_k': 0.12315806048734514, 'spread_hl_frac': 0.02570016614574588, 'bb_std_mult': 1.1257979112742285, 'rsi_os': 44, 'rsi_ob': 65, 'vol_spike': 0.2674656649199715, 'adx_thresh': 23.795624241126767, 'atr_min_pct': 0.02836567174879393, 'atr_max_pct': 0.07689555894592348, 'tp_mult': 2.5341708646859007, 'tsl_mult': 0.46895027749486384, 'strategy': 'mean_reversion', 'time_stop': 97, 'use_sma': True, 'use_atr': False, 'use_adx': True, 'use_ema': False, 'use_spike': True, 'rsi_required': False, 'edge_k': 0.9217249482807806, 'edge_cap': 0.2627173541137968, 'bull_strategy': 'mean_reversion', 'bull_bb_std_mult': 3.3642561965778808, 'bull_rsi_os': 6, 'bull_rsi_ob': 89, 'bull_adx_thresh': 9.686504078075068, 'bull_atr_min_pct': 0.028893654285389255, 'bull_atr_max_pct': 0.02805735232371559, 'bull_tp_mult': 2.7701852959892497, 'bull_tsl_mult': 0.2403844275172261, 'bull_time_stop': 101, 'bull_use_sma': False, 'bull_use_ema': False, 'bull_use_atr': True, 'bull_use_adx': True, 'bull_use_spike': False, 'bull_rsi_required': True, 'bear_strategy': 'mean_reversion', 'bear_bb_std_mult': 1.6934909149919575, 'bear_rsi_os': 24, 'bear_rsi_ob': 61, 'bear_adx_thresh': 33.06806493943168, 'bear_atr_min_pct': 0.02673229637127134, 'bear_atr_max_pct': 0.10530697363120645, 'bear_tp_mult': 1.7940189953944974, 'bear_tsl_mult': 0.15917445251102152, 'bear_time_stop': 259, 'bear_use_sma': False, 'bear_use_ema': False, 'bear_use_atr': False, 'bear_use_adx': False, 'bear_use_spike': True, 'bear_rsi_required': False, 'sideways_strategy': 'breakout', 'sideways_bb_std_mult': 1.7839739998791524, 'sideways_rsi_os': 7, 'sideways_rsi_ob': 48, 'sideways_adx_thresh': 7.507678129935181, 'sideways_atr_min_pct': 0.014341842238572433, 'sideways_atr_max_pct': 0.06504880773313886, 'sideways_tp_mult': 1.3916448609402046, 'sideways_tsl_mult': 0.5976413345665674, 'sideways_time_stop': 17, 'sideways_use_sma': False, 'sideways_use_ema': True, 'sideways_use_atr': True, 'sideways_use_adx': False, 'sideways_use_spike': False, 'sideways_rsi_required': True}.
[I 2025-08-31 12:07:50,643] Trial 112 finished with values: [-1000000000.0, 1000000000.0] and parameters: {'p_sma': 27, 'p_std': 15, 'p_atr': 16, 'p_adx': 13, 'rsi_period': 15, 'ema1': 5, 'ema2': 41, 'slip_atr_k': 0.14466953840730767, 'slip_spread_k': 0.12457802472224816, 'spread_hl_frac': 0.02440008713996497, 'bb_std_mult': 0.822416842177371, 'rsi_os': 44, 'rsi_ob': 66, 'vol_spike': 0.26556898989724925, 'adx_thresh': 21.802074833264562, 'atr_min_pct': 0.026782376392123313, 'atr_max_pct': 0.06901230478480029, 'tp_mult': 2.6150911135987425, 'tsl_mult': 0.46705056788648336, 'strategy': 'mean_reversion', 'time_stop': 102, 'use_sma': True, 'use_atr': False, 'use_adx': True, 'use_ema': False, 'use_spike': True, 'rsi_required': False, 'edge_k': 0.928293192512726, 'edge_cap': 0.2433563718140983, 'bull_strategy': 'mean_reversion', 'bull_bb_std_mult': 3.0447533798853144, 'bull_rsi_os': 7, 'bull_rsi_ob': 88, 'bull_adx_thresh': 9.755692288414014, 'bull_atr_min_pct': 0.02672553150417485, 'bull_atr_max_pct': 0.12522899529167536, 'bull_tp_mult': 2.452079207987936, 'bull_tsl_mult': 0.25662226693398305, 'bull_time_stop': 83, 'bull_use_sma': True, 'bull_use_ema': False, 'bull_use_atr': True, 'bull_use_adx': True, 'bull_use_spike': False, 'bull_rsi_required': True, 'bear_strategy': 'mean_reversion', 'bear_bb_std_mult': 1.194313827666917, 'bear_rsi_os': 24, 'bear_rsi_ob': 57, 'bear_adx_thresh': 30.84621478161519, 'bear_atr_min_pct': 0.023659435227698384, 'bear_atr_max_pct': 0.10037824408034912, 'bear_tp_mult': 1.606874097725121, 'bear_tsl_mult': 0.003059023522950066, 'bear_time_stop': 258, 'bear_use_sma': False, 'bear_use_ema': False, 'bear_use_atr': False, 'bear_use_adx': False, 'bear_use_spike': True, 'bear_rsi_required': False, 'sideways_strategy': 'breakout', 'sideways_bb_std_mult': 2.079122584046325, 'sideways_rsi_os': 5, 'sideways_rsi_ob': 48, 'sideways_adx_thresh': 9.148001071047872, 'sideways_atr_min_pct': 0.017613160251879992, 'sideways_atr_max_pct': 0.05762668919533092, 'sideways_tp_mult': 1.2970616969917117, 'sideways_tsl_mult': 0.4039638079614545, 'sideways_time_stop': 128, 'sideways_use_sma': True, 'sideways_use_ema': True, 'sideways_use_atr': True, 'sideways_use_adx': False, 'sideways_use_spike': False, 'sideways_rsi_required': True}.
[I 2025-08-31 12:07:50,731] Trial 115 finished with values: [-1000000000.0, 1000000000.0] and parameters: {'p_sma': 31, 'p_std': 37, 'p_atr': 10, 'p_adx': 16, 'rsi_period': 71, 'ema1': 26, 'ema2': 33, 'slip_atr_k': 0.10681498039377159, 'slip_spread_k': 0.12707268306073766, 'spread_hl_frac': 0.02147097326937951, 'bb_std_mult': 0.7950138763068423, 'rsi_os': 41, 'rsi_ob': 65, 'vol_spike': 0.2686203646972022, 'adx_thresh': 21.944047377099537, 'atr_min_pct': 0.026791952757266497, 'atr_max_pct': 0.06805785951095972, 'tp_mult': 2.5425546645602894, 'tsl_mult': 0.7672352447971189, 'strategy': 'mean_reversion', 'time_stop': 33, 'use_sma': True, 'use_atr': False, 'use_adx': True, 'use_ema': False, 'use_spike': True, 'rsi_required': False, 'edge_k': 0.9392891550623008, 'edge_cap': 0.25855135687533926, 'bull_strategy': 'mean_reversion', 'bull_bb_std_mult': 3.355699369473827, 'bull_rsi_os': 8, 'bull_rsi_ob': 89, 'bull_adx_thresh': 9.702763889110141, 'bull_atr_min_pct': 0.02815840203842672, 'bull_atr_max_pct': 0.12384193641527738, 'bull_tp_mult': 2.752104691768777, 'bull_tsl_mult': 0.2454030175340342, 'bull_time_stop': 98, 'bull_use_sma': False, 'bull_use_ema': False, 'bull_use_atr': True, 'bull_use_adx': True, 'bull_use_spike': False, 'bull_rsi_required': True, 'bear_strategy': 'mean_reversion', 'bear_bb_std_mult': 3.5935847235521408, 'bear_rsi_os': 50, 'bear_rsi_ob': 61, 'bear_adx_thresh': 33.02595204912349, 'bear_atr_min_pct': 0.027033022810099273, 'bear_atr_max_pct': 0.10569897815221674, 'bear_tp_mult': 1.5973026911451629, 'bear_tsl_mult': 0.14674731735377394, 'bear_time_stop': 274, 'bear_use_sma': False, 'bear_use_ema': False, 'bear_use_atr': False, 'bear_use_adx': False, 'bear_use_spike': True, 'bear_rsi_required': False, 'sideways_strategy': 'breakout', 'sideways_bb_std_mult': 2.352752987737805, 'sideways_rsi_os': 38, 'sideways_rsi_ob': 49, 'sideways_adx_thresh': 6.325109833101678, 'sideways_atr_min_pct': 0.017664926124241552, 'sideways_atr_max_pct': 0.05988506362502366, 'sideways_tp_mult': 1.1764493077117548, 'sideways_tsl_mult': 0.40591071070981527, 'sideways_time_stop': 163, 'sideways_use_sma': False, 'sideways_use_ema': True, 'sideways_use_atr': True, 'sideways_use_adx': False, 'sideways_use_spike': False, 'sideways_rsi_required': True}.
[I 2025-08-31 12:08:19,915] Trial 118 finished with values: [-1000000000.0, 1000000000.0] and parameters: {'p_sma': 7, 'p_std': 60, 'p_atr': 10, 'p_adx': 15, 'rsi_period': 70, 'ema1': 8, 'ema2': 36, 'slip_atr_k': 0.0915087509138713, 'slip_spread_k': 0.0361693670295818, 'spread_hl_frac': 0.0277520247878941, 'bb_std_mult': 1.0340916867167065, 'rsi_os': 42, 'rsi_ob': 64, 'vol_spike': 0.2514126125798198, 'adx_thresh': 20.35897645269475, 'atr_min_pct': 0.025825851880434344, 'atr_max_pct': 0.08125700974144864, 'tp_mult': 2.473779212166842, 'tsl_mult': 0.7629437655381639, 'strategy': 'mean_reversion', 'time_stop': 28, 'use_sma': True, 'use_atr': True, 'use_adx': False, 'use_ema': False, 'use_spike': True, 'rsi_required': False, 'edge_k': 1.1118509672049832, 'edge_cap': 0.3439549078847818, 'bull_strategy': 'mean_reversion', 'bull_bb_std_mult': 3.178185936351448, 'bull_rsi_os': 15, 'bull_rsi_ob': 85, 'bull_adx_thresh': 7.157374360439367, 'bull_atr_min_pct': 0.028233949554338455, 'bull_atr_max_pct': 0.01767289769814714, 'bull_tp_mult': 2.705304329397685, 'bull_tsl_mult': 0.34901055805508074, 'bull_time_stop': 94, 'bull_use_sma': False, 'bull_use_ema': False, 'bull_use_atr': False, 'bull_use_adx': True, 'bull_use_spike': False, 'bull_rsi_required': True, 'bear_strategy': 'mean_reversion', 'bear_bb_std_mult': 1.2925439752620616, 'bear_rsi_os': 27, 'bear_rsi_ob': 89, 'bear_adx_thresh': 33.68499395335761, 'bear_atr_min_pct': 0.0272396401607108, 'bear_atr_max_pct': 0.11929795114619904, 'bear_tp_mult': 1.8781778550858126, 'bear_tsl_mult': 0.3188561855277909, 'bear_time_stop': 274, 'bear_use_sma': False, 'bear_use_ema': False, 'bear_use_atr': False, 'bear_use_adx': False, 'bear_use_spike': True, 'bear_rsi_required': False, 'sideways_strategy': 'breakout', 'sideways_bb_std_mult': 2.3559019476953607, 'sideways_rsi_os': 38, 'sideways_rsi_ob': 51, 'sideways_adx_thresh': 7.749403039808168, 'sideways_atr_min_pct': 0.023695664236114772, 'sideways_atr_max_pct': 0.05152014302062325, 'sideways_tp_mult': 1.4265639458950665, 'sideways_tsl_mult': 0.8810458904521317, 'sideways_time_stop': 70, 'sideways_use_sma': False, 'sideways_use_ema': True, 'sideways_use_atr': True, 'sideways_use_adx': False, 'sideways_use_spike': False, 'sideways_rsi_required': True}.
