[I 2025-08-31 11:57:38,941] Trial 28 finished with values: [-1000000000.0, 1000000000.0] and parameters: {'p_sma': 46, 'p_std': 13, 'p_atr': 10, 'p_adx': 7, 'rsi_period': 51, 'ema1': 21, 'ema2': 32, 'slip_atr_k': 0.1818848338825998, 'slip_spread_k': 0.43752477077375834, 'spread_hl_frac': 0.04305078535271567, 'bb_std_mult': 2.207508906856862, 'rsi_os': 11, 'rsi_ob': 71, 'vol_spike': 0.2627864592240745, 'adx_thresh': 28.060885108413068, 'atr_min_pct': 0.029743224615448947, 'atr_max_pct': 0.05424181365980911, 'tp_mult': 2.80454913491557, 'tsl_mult': 0.04959394667297291, 'strategy': 'mean_reversion', 'time_stop': 48, 'use_sma': True, 'use_atr': True, 'use_adx': True, 'use_ema': True, 'use_spike': False, 'rsi_required': True, 'edge_k': 0.42799556545066375, 'edge_cap': 0.2551562490189755, 'bull_strategy': 'breakout', 'bull_bb_std_mult': 3.1793655682096014, 'bull_rsi_os': 30, 'bull_rsi_ob': 66, 'bull_adx_thresh': 18.112440714979332, 'bull_atr_min_pct': 0.00599240245441078, 'bull_atr_max_pct': 0.07966260406068561, 'bull_tp_mult': 1.0238569906157098, 'bull_tsl_mult': 0.8761183382549376, 'bull_time_stop': 136, 'bull_use_sma': False, 'bull_use_ema': True, 'bull_use_atr': False, 'bull_use_adx': False, 'bull_use_spike': True, 'bull_rsi_required': True, 'bear_strategy': 'mean_reversion', 'bear_bb_std_mult': 2.2069570073243607, 'bear_rsi_os': 12, 'bear_rsi_ob': 47, 'bear_adx_thresh': 31.727456214206924, 'bear_atr_min_pct': 0.011724096022361102, 'bear_atr_max_pct': 0.07712824977569215, 'bear_tp_mult': 1.893463908699338, 'bear_tsl_mult': 0.8355312010490781, 'bear_time_stop': 149, 'bear_use_sma': True, 'bear_use_ema': True, 'bear_use_atr': True, 'bear_use_adx': True, 'bear_use_spike': False, 'bear_rsi_required': False, 'sideways_strategy': 'mean_reversion', 'sideways_bb_std_mult': 1.649489737778586, 'sideways_rsi_os': 21, 'sideways_rsi_ob': 95, 'sideways_adx_thresh': 8.961980666837347, 'sideways_atr_min_pct': 0.0015174028484611025, 'sideways_atr_max_pct': 0.06893838795022747, 'sideways_tp_mult': 2.7717727409923136, 'sideways_tsl_mult': 0.44074353653004816, 'sideways_time_stop': 234, 'sideways_use_sma': False, 'sideways_use_ema': False, 'sideways_use_atr': False, 'sideways_use_adx': True, 'sideways_use_spike': False, 'sideways_rsi_required': True}.
[I 2025-08-31 11:57:39,036] Trial 26 finished with values: [-0.041420568228366705, 0.041212401975881566] and parameters: {'p_sma': 44, 'p_std': 32, 'p_atr': 11, 'p_adx': 12, 'rsi_period': 59, 'ema1': 21, 'ema2': 37, 'slip_atr_k': 0.18698350269796077, 'slip_spread_k': 0.4419420985693066, 'spread_hl_frac': 0.044199128863129426, 'bb_std_mult': 2.241839275345633, 'rsi_os': 12, 'rsi_ob': 72, 'vol_spike': 0.2513855069923685, 'adx_thresh': 27.638975200347645, 'atr_min_pct': 0.024339270156299397, 'atr_max_pct': 0.055583729023689084, 'tp_mult': 2.7477574180910747, 'tsl_mult': 0.1392318939827325, 'strategy': 'mean_reversion', 'time_stop': 55, 'use_sma': True, 'use_atr': True, 'use_adx': True, 'use_ema': True, 'use_spike': True, 'rsi_required': True, 'edge_k': 1.325839051937922, 'edge_cap': 0.47610608694328876, 'bull_strategy': 'breakout', 'bull_bb_std_mult': 3.155933625239172, 'bull_rsi_os': 32, 'bull_rsi_ob': 67, 'bull_adx_thresh': 30.43824070840604, 'bull_atr_min_pct': 0.00018377983228246814, 'bull_atr_max_pct': 0.026774642341510932, 'bull_tp_mult': 1.0295240276694024, 'bull_tsl_mult': 0.8799715912548685, 'bull_time_stop': 134, 'bull_use_sma': False, 'bull_use_ema': True, 'bull_use_atr': False, 'bull_use_adx': False, 'bull_use_spike': True, 'bull_rsi_required': True, 'bear_strategy': 'breakout', 'bear_bb_std_mult': 2.36238310636039, 'bear_rsi_os': 12, 'bear_rsi_ob': 50, 'bear_adx_thresh': 31.930206550123735, 'bear_atr_min_pct': 0.017682486954745606, 'bear_atr_max_pct': 0.07940733239290232, 'bear_tp_mult': 1.9554552283220121, 'bear_tsl_mult': 0.8739319767387681, 'bear_time_stop': 166, 'bear_use_sma': True, 'bear_use_ema': True, 'bear_use_atr': True, 'bear_use_adx': True, 'bear_use_spike': False, 'bear_rsi_required': False, 'sideways_strategy': 'breakout', 'sideways_bb_std_mult': 0.9322653461926085, 'sideways_rsi_os': 10, 'sideways_rsi_ob': 88, 'sideways_adx_thresh': 9.123050220223778, 'sideways_atr_min_pct': 0.00025496294539501083, 'sideways_atr_max_pct': 0.06606598851986772, 'sideways_tp_mult': 2.658756790323899, 'sideways_tsl_mult': 0.432375584581702, 'sideways_time_stop': 219, 'sideways_use_sma': False, 'sideways_use_ema': False, 'sideways_use_atr': False, 'sideways_use_adx': True, 'sideways_use_spike': False, 'sideways_rsi_required': True}.
[I 2025-08-31 11:58:08,119] Trial 29 finished with values: [-1000000000.0, 1000000000.0] and parameters: {'p_sma': 51, 'p_std': 25, 'p_atr': 10, 'p_adx': 7, 'rsi_period': 48, 'ema1': 21, 'ema2': 38, 'slip_atr_k': 0.04008824498370113, 'slip_spread_k': 0.6848645987714298, 'spread_hl_frac': 0.005841118150541654, 'bb_std_mult': 2.2683122652465073, 'rsi_os': 36, 'rsi_ob': 73, 'vol_spike': 0.2560523197132482, 'adx_thresh': 28.239567770326634, 'atr_min_pct': 0.015303893528996556, 'atr_max_pct': 0.05710435197202278, 'tp_mult': 2.776369644076061, 'tsl_mult': 0.0011745545251619083, 'strategy': 'mean_reversion', 'time_stop': 42, 'use_sma': True, 'use_atr': False, 'use_adx': True, 'use_ema': True, 'use_spike': False, 'rsi_required': True, 'edge_k': 0.3899353374727934, 'edge_cap': 0.2720877294516327, 'bull_strategy': 'breakout', 'bull_bb_std_mult': 3.20641563648027, 'bull_rsi_os': 30, 'bull_rsi_ob': 65, 'bull_adx_thresh': 30.39973206809301, 'bull_atr_min_pct': 0.011179060478144435, 'bull_atr_max_pct': 0.07952623870949632, 'bull_tp_mult': 2.3269436327414685, 'bull_tsl_mult': 0.8740228323646393, 'bull_time_stop': 136, 'bull_use_sma': False, 'bull_use_ema': True, 'bull_use_atr': False, 'bull_use_adx': False, 'bull_use_spike': True, 'bull_rsi_required': True, 'bear_strategy': 'mean_reversion', 'bear_bb_std_mult': 2.3278942695928944, 'bear_rsi_os': 14, 'bear_rsi_ob': 47, 'bear_adx_thresh': 31.494735453114338, 'bear_atr_min_pct': 0.011361875894945564, 'bear_atr_max_pct': 0.08192097463438516, 'bear_tp_mult': 2.5929042137575418, 'bear_tsl_mult': 0.8820565304944777, 'bear_time_stop': 252, 'bear_use_sma': True, 'bear_use_ema': True, 'bear_use_atr': True, 'bear_use_adx': True, 'bear_use_spike': False, 'bear_rsi_required': True, 'sideways_strategy': 'mean_reversion', 'sideways_bb_std_mult': 1.593694693665947, 'sideways_rsi_os': 55, 'sideways_rsi_ob': 94, 'sideways_adx_thresh': 9.094619052066498, 'sideways_atr_min_pct': 0.0006345779641434499, 'sideways_atr_max_pct': 0.10058392964112964, 'sideways_tp_mult': 2.508143201910186, 'sideways_tsl_mult': 0.47450470908596537, 'sideways_time_stop': 239, 'sideways_use_sma': False, 'sideways_use_ema': False, 'sideways_use_atr': False, 'sideways_use_adx': True, 'sideways_use_spike': False, 'sideways_rsi_required': True}.
[I 2025-08-31 11:58:08,709] Trial 30 finished with values: [-1000000000.0, 1000000000.0] and parameters: {'p_sma': 58, 'p_std': 24, 'p_atr': 13, 'p_adx': 7, 'rsi_period': 32, 'ema1': 12, 'ema2': 13, 'slip_atr_k': 0.037658297055199005, 'slip_spread_k': 0.6862876068811778, 'spread_hl_frac': 0.007797325523447997, 'bb_std_mult': 3.111281941968419, 'rsi_os': 34, 'rsi_ob': 66, 'vol_spike': 0.23001581286017547, 'adx_thresh': 30.347900690858943, 'atr_min_pct': 0.015350205770326659, 'atr_max_pct': 0.028503672833943092, 'tp_mult': 2.190716592028618, 'tsl_mult': 0.20067386056095682, 'strategy': 'mean_reversion', 'time_stop': 99, 'use_sma': False, 'use_atr': False, 'use_adx': False, 'use_ema': True, 'use_spike': False, 'rsi_required': True, 'edge_k': 1.699779486835401, 'edge_cap': 0.48967725074653407, 'bull_strategy': 'breakout', 'bull_bb_std_mult': 3.333405883910093, 'bull_rsi_os': 23, 'bull_rsi_ob': 73, 'bull_adx_thresh': 32.58358511510968, 'bull_atr_min_pct': 0.011797591787215914, 'bull_atr_max_pct': 0.09994777723513151, 'bull_tp_mult': 2.374866567057223, 'bull_tsl_mult': 0.9575859703018006, 'bull_time_stop': 183, 'bull_use_sma': False, 'bull_use_ema': True, 'bull_use_atr': False, 'bull_use_adx': False, 'bull_use_spike': True, 'bull_rsi_required': True, 'bear_strategy': 'mean_reversion', 'bear_bb_std_mult': 2.142230395368417, 'bear_rsi_os': 21, 'bear_rsi_ob': 45, 'bear_adx_thresh': 27.925825234851015, 'bear_atr_min_pct': 0.01637575192893879, 'bear_atr_max_pct': 0.08887369009411282, 'bear_tp_mult': 2.563901048400567, 'bear_tsl_mult': 0.9111136795102913, 'bear_time_stop': 247, 'bear_use_sma': True, 'bear_use_ema': True, 'bear_use_atr': True, 'bear_use_adx': True, 'bear_use_spike': False, 'bear_rsi_required': True, 'sideways_strategy': 'mean_reversion', 'sideways_bb_std_mult': 0.8358327206805235, 'sideways_rsi_os': 55, 'sideways_rsi_ob': 92, 'sideways_adx_thresh': 12.67285527604752, 'sideways_atr_min_pct': 0.0050767047996204346, 'sideways_atr_max_pct': 0.10114086970753651, 'sideways_tp_mult': 2.469464391528492, 'sideways_tsl_mult': 0.3875024454883548, 'sideways_time_stop': 187, 'sideways_use_sma': False, 'sideways_use_ema': False, 'sideways_use_atr': False, 'sideways_use_adx': True, 'sideways_use_spike': False, 'sideways_rsi_required': True}.
[I 2025-08-31 11:58:08,740] Trial 31 finished with values: [-1000000000.0, 1000000000.0] and parameters: {'p_sma': 53, 'p_std': 25, 'p_atr': 13, 'p_adx': 8, 'rsi_period': 34, 'ema1': 12, 'ema2': 46, 'slip_atr_k': 0.0412415171033937, 'slip_spread_k': 0.6934666360499411, 'spread_hl_frac': 0.005202618820919918, 'bb_std_mult': 3.0898251843591087, 'rsi_os': 35, 'rsi_ob': 67, 'vol_spike': 0.22446592224351575, 'adx_thresh': 31.569561428981512, 'atr_min_pct': 0.015395465888823968, 'atr_max_pct': 0.024535367932017833, 'tp_mult': 2.2472763288997935, 'tsl_mult': 0.16515269381245287, 'strategy': 'mean_reversion', 'time_stop': 90, 'use_sma': False, 'use_atr': False, 'use_adx': False, 'use_ema': True, 'use_spike': False, 'rsi_required': True, 'edge_k': 1.6951751069656353, 'edge_cap': 0.5029488228498051, 'bull_strategy': 'breakout', 'bull_bb_std_mult': 3.3521039665571877, 'bull_rsi_os': 21, 'bull_rsi_ob': 73, 'bull_adx_thresh': 31.76461118795632, 'bull_atr_min_pct': 0.011165110243321615, 'bull_atr_max_pct': 0.05850030844112829, 'bull_tp_mult': 2.383775338834093, 'bull_tsl_mult': 0.9345488250692342, 'bull_time_stop': 184, 'bull_use_sma': False, 'bull_use_ema': True, 'bull_use_atr': False, 'bull_use_adx': False, 'bull_use_spike': True, 'bull_rsi_required': True, 'bear_strategy': 'mean_reversion', 'bear_bb_std_mult': 2.030399498642229, 'bear_rsi_os': 22, 'bear_rsi_ob': 87, 'bear_adx_thresh': 28.21608201871829, 'bear_atr_min_pct': 0.02116198658926699, 'bear_atr_max_pct': 0.08521677552181582, 'bear_tp_mult': 2.610155634245559, 'bear_tsl_mult': 0.650861015496472, 'bear_time_stop': 260, 'bear_use_sma': True, 'bear_use_ema': True, 'bear_use_atr': True, 'bear_use_adx': True, 'bear_use_spike': False, 'bear_rsi_required': True, 'sideways_strategy': 'mean_reversion', 'sideways_bb_std_mult': 0.8733426581244003, 'sideways_rsi_os': 55, 'sideways_rsi_ob': 91, 'sideways_adx_thresh': 12.246127459958034, 'sideways_atr_min_pct': 0.004054758391873374, 'sideways_atr_max_pct': 0.10161763328353801, 'sideways_tp_mult': 2.48194129665472, 'sideways_tsl_mult': 0.3673777449131069, 'sideways_time_stop': 257, 'sideways_use_sma': False, 'sideways_use_ema': False, 'sideways_use_atr': False, 'sideways_use_adx': True, 'sideways_use_spike': False, 'sideways_rsi_required': True}.
[I 2025-08-31 11:58:09,030] Trial 32 finished with values: [-0.027937282237430194, 0.027808269746824446] and parameters: {'p_sma': 52, 'p_std': 6, 'p_atr': 13, 'p_adx': 7, 'rsi_period': 32, 'ema1': 12, 'ema2': 46, 'slip_atr_k': 0.03988864156702046, 'slip_spread_k': 0.6840387680057218, 'spread_hl_frac': 0.006443583109369995, 'bb_std_mult': 3.098884155846079, 'rsi_os': 35, 'rsi_ob': 59, 'vol_spike': 0.22582306113457473, 'adx_thresh': 34.953875737093355, 'atr_min_pct': 0.01674868528321362, 'atr_max_pct': 0.0495713456308772, 'tp_mult': 2.291021568934626, 'tsl_mult': 0.16463562649911667, 'strategy': 'mean_reversion', 'time_stop': 211, 'use_sma': False, 'use_atr': False, 'use_adx': True, 'use_ema': True, 'use_spike': True, 'rsi_required': True, 'edge_k': 1.7264235698885275, 'edge_cap': 0.47849705869432413, 'bull_strategy': 'breakout', 'bull_bb_std_mult': 1.450845511086257, 'bull_rsi_os': 22, 'bull_rsi_ob': 74, 'bull_adx_thresh': 31.74365218696829, 'bull_atr_min_pct': 0.01897974850367605, 'bull_atr_max_pct': 0.05792156599306507, 'bull_tp_mult': 2.35764887937085, 'bull_tsl_mult': 0.9435631903658467, 'bull_time_stop': 188, 'bull_use_sma': False, 'bull_use_ema': True, 'bull_use_atr': False, 'bull_use_adx': False, 'bull_use_spike': True, 'bull_rsi_required': True, 'bear_strategy': 'breakout', 'bear_bb_std_mult': 2.1412786558519135, 'bear_rsi_os': 19, 'bear_rsi_ob': 86, 'bear_adx_thresh': 28.16309175141618, 'bear_atr_min_pct': 0.020852833706798475, 'bear_atr_max_pct': 0.06131159306817539, 'bear_tp_mult': 2.5589074424734, 'bear_tsl_mult': 0.9023690087367624, 'bear_time_stop': 125, 'bear_use_sma': True, 'bear_use_ema': True, 'bear_use_atr': True, 'bear_use_adx': True, 'bear_use_spike': False, 'bear_rsi_required': True, 'sideways_strategy': 'breakout', 'sideways_bb_std_mult': 0.9143193085096538, 'sideways_rsi_os': 51, 'sideways_rsi_ob': 84, 'sideways_adx_thresh': 11.832920181903356, 'sideways_atr_min_pct': 0.0037156995182769798, 'sideways_atr_max_pct': 0.10006373760989512, 'sideways_tp_mult': 1.9419714729231614, 'sideways_tsl_mult': 0.3641462769361402, 'sideways_time_stop': 209, 'sideways_use_sma': False, 'sideways_use_ema': False, 'sideways_use_atr': False, 'sideways_use_adx': True, 'sideways_use_spike': False, 'sideways_rsi_required': True}.
[I 2025-08-31 11:58:37,606] Trial 34 finished with values: [-0.047145654791833635, 0.04699796256725113] and parameters: {'p_sma': 51, 'p_std': 34, 'p_atr': 8, 'p_adx': 10, 'rsi_period': 58, 'ema1': 13, 'ema2': 47, 'slip_atr_k': 0.1001890877011614, 'slip_spread_k': 0.532998950951656, 'spread_hl_frac': 0.016582995050982197, 'bb_std_mult': 2.305343204796632, 'rsi_os': 28, 'rsi_ob': 68, 'vol_spike': 0.29815203783790184, 'adx_thresh': 33.89923841240691, 'atr_min_pct': 0.018696299951289543, 'atr_max_pct': 0.04747658337627133, 'tp_mult': 2.624965344426698, 'tsl_mult': 0.16447173298932527, 'strategy': 'mean_reversion', 'time_stop': 69, 'use_sma': False, 'use_atr': True, 'use_adx': False, 'use_ema': True, 'use_spike': True, 'rsi_required': True, 'edge_k': 1.1944345152352578, 'edge_cap': 0.4029280029327341, 'bull_strategy': 'breakout', 'bull_bb_std_mult': 2.988138970194606, 'bull_rsi_os': 54, 'bull_rsi_ob': 77, 'bull_adx_thresh': 26.081832672091558, 'bull_atr_min_pct': 0.01839560830671931, 'bull_atr_max_pct': 0.06331784394321252, 'bull_tp_mult': 1.9252525920669625, 'bull_tsl_mult': 0.8257201079211703, 'bull_time_stop': 277, 'bull_use_sma': False, 'bull_use_ema': True, 'bull_use_atr': False, 'bull_use_adx': False, 'bull_use_spike': True, 'bull_rsi_required': True, 'bear_strategy': 'breakout', 'bear_bb_std_mult': 1.8539073688503458, 'bear_rsi_os': 28, 'bear_rsi_ob': 54, 'bear_adx_thresh': 5.089359230534644, 'bear_atr_min_pct': 0.020905047524770626, 'bear_atr_max_pct': 0.06039254289560773, 'bear_tp_mult': 2.8225695337024064, 'bear_tsl_mult': 0.6491438461943231, 'bear_time_stop': 126, 'bear_use_sma': True, 'bear_use_ema': True, 'bear_use_atr': True, 'bear_use_adx': True, 'bear_use_spike': False, 'bear_rsi_required': False, 'sideways_strategy': 'breakout', 'sideways_bb_std_mult': 1.1939694326352184, 'sideways_rsi_os': 44, 'sideways_rsi_ob': 84, 'sideways_adx_thresh': 11.714407377408994, 'sideways_atr_min_pct': 0.003147421642303825, 'sideways_atr_max_pct': 0.0934858692181229, 'sideways_tp_mult': 2.798639518953503, 'sideways_tsl_mult': 0.3539054377442891, 'sideways_time_stop': 203, 'sideways_use_sma': False, 'sideways_use_ema': False, 'sideways_use_atr': False, 'sideways_use_adx': True, 'sideways_use_spike': False, 'sideways_rsi_required': True}.
[I 2025-08-31 11:58:37,741] Trial 33 finished with values: [-0.022781129637860276, 0.022537310632946093] and parameters: {'p_sma': 60, 'p_std': 5, 'p_atr': 7, 'p_adx': 9, 'rsi_period': 58, 'ema1': 12, 'ema2': 10, 'slip_atr_k': 0.03882439036644602, 'slip_spread_k': 0.5354138409337511, 'spread_hl_frac': 0.008669810556968388, 'bb_std_mult': 2.9163333636767046, 'rsi_os': 28, 'rsi_ob': 58, 'vol_spike': 0.2252012487885796, 'adx_thresh': 32.68609158303572, 'atr_min_pct': 0.01885389898742626, 'atr_max_pct': 0.047678174886999186, 'tp_mult': 2.189426497855926, 'tsl_mult': 0.16642430923843649, 'strategy': 'mean_reversion', 'time_stop': 205, 'use_sma': False, 'use_atr': False, 'use_adx': True, 'use_ema': True, 'use_spike': True, 'rsi_required': True, 'edge_k': 1.2276372494888512, 'edge_cap': 0.5114669218243326, 'bull_strategy': 'breakout', 'bull_bb_std_mult': 1.4067247855650233, 'bull_rsi_os': 22, 'bull_rsi_ob': 71, 'bull_adx_thresh': 32.703029842573606, 'bull_atr_min_pct': 0.019372989007842383, 'bull_atr_max_pct': 0.058195630885124215, 'bull_tp_mult': 1.4310689067634694, 'bull_tsl_mult': 0.91462256209251, 'bull_time_stop': 290, 'bull_use_sma': False, 'bull_use_ema': True, 'bull_use_atr': False, 'bull_use_adx': False, 'bull_use_spike': True, 'bull_rsi_required': True, 'bear_strategy': 'breakout', 'bear_bb_std_mult': 2.062309455188471, 'bear_rsi_os': 20, 'bear_rsi_ob': 67, 'bear_adx_thresh': 27.956062347858655, 'bear_atr_min_pct': 0.015938395171549914, 'bear_atr_max_pct': 0.06275084490105635, 'bear_tp_mult': 2.2154889660017374, 'bear_tsl_mult': 0.6366233911587059, 'bear_time_stop': 169, 'bear_use_sma': True, 'bear_use_ema': True, 'bear_use_atr': True, 'bear_use_adx': True, 'bear_use_spike': False, 'bear_rsi_required': True, 'sideways_strategy': 'breakout', 'sideways_bb_std_mult': 0.8688671304002218, 'sideways_rsi_os': 41, 'sideways_rsi_ob': 85, 'sideways_adx_thresh': 29.920282712089676, 'sideways_atr_min_pct': 0.003910756095265843, 'sideways_atr_max_pct': 0.1000868538026053, 'sideways_tp_mult': 1.9849543953346822, 'sideways_tsl_mult': 0.34712531446534384, 'sideways_time_stop': 201, 'sideways_use_sma': False, 'sideways_use_ema': False, 'sideways_use_atr': False, 'sideways_use_adx': True, 'sideways_use_spike': True, 'sideways_rsi_required': False}.
[I 2025-08-31 11:58:38,056] Trial 36 finished with values: [-0.07743406555948862, 0.0773169707348422] and parameters: {'p_sma': 57, 'p_std': 9, 'p_atr': 7, 'p_adx': 10, 'rsi_period': 28, 'ema1': 27, 'ema2': 56, 'slip_atr_k': 0.05490720215530984, 'slip_spread_k': 0.5537402097306249, 'spread_hl_frac': 0.016862788347955605, 'bb_std_mult': 3.569493886098868, 'rsi_os': 29, 'rsi_ob': 58, 'vol_spike': 0.13596140046906674, 'adx_thresh': 34.293554305628646, 'atr_min_pct': 0.019547554851135785, 'atr_max_pct': 0.047392219362981984, 'tp_mult': 2.098945159603266, 'tsl_mult': 0.8359896498730026, 'strategy': 'mean_reversion', 'time_stop': 217, 'use_sma': False, 'use_atr': False, 'use_adx': True, 'use_ema': True, 'use_spike': True, 'rsi_required': True, 'edge_k': 1.9673919064790168, 'edge_cap': 0.5531221654423496, 'bull_strategy': 'breakout', 'bull_bb_std_mult': 1.340655665948102, 'bull_rsi_os': 25, 'bull_rsi_ob': 61, 'bull_adx_thresh': 28.383474517817938, 'bull_atr_min_pct': 0.0192942221228963, 'bull_atr_max_pct': 0.057644224483190565, 'bull_tp_mult': 1.3366208469212615, 'bull_tsl_mult': 0.9138032213434506, 'bull_time_stop': 211, 'bull_use_sma': False, 'bull_use_ema': True, 'bull_use_atr': False, 'bull_use_adx': False, 'bull_use_spike': True, 'bull_rsi_required': True, 'bear_strategy': 'breakout', 'bear_bb_std_mult': 2.647172548326039, 'bear_rsi_os': 28, 'bear_rsi_ob': 88, 'bear_adx_thresh': 20.18306770325578, 'bear_atr_min_pct': 0.020995729566254, 'bear_atr_max_pct': 0.061056218163589436, 'bear_tp_mult': 2.242348698289069, 'bear_tsl_mult': 0.8074290921008972, 'bear_time_stop': 125, 'bear_use_sma': False, 'bear_use_ema': True, 'bear_use_atr': True, 'bear_use_adx': True, 'bear_use_spike': False, 'bear_rsi_required': True, 'sideways_strategy': 'breakout', 'sideways_bb_std_mult': 1.088245959138485, 'sideways_rsi_os': 43, 'sideways_rsi_ob': 63, 'sideways_adx_thresh': 29.802483165374433, 'sideways_atr_min_pct': 0.002576086979974341, 'sideways_atr_max_pct': 0.1241939508370192, 'sideways_tp_mult': 1.9055054820536896, 'sideways_tsl_mult': 0.1946772513462922, 'sideways_time_stop': 210, 'sideways_use_sma': False, 'sideways_use_ema': False, 'sideways_use_atr': True, 'sideways_use_adx': True, 'sideways_use_spike': True, 'sideways_rsi_required': False}.
