[I 2025-08-31 13:38:19,240] Trial 794 finished with values: [-1000000000.0, 1000000000.0] and parameters: {'p_sma': 26, 'p_std': 60, 'p_atr': 30, 'p_adx': 28, 'rsi_period': 30, 'ema1': 15, 'ema2': 17, 'slip_atr_k': 0.04827294603559617, 'slip_spread_k': 0.3910459467714897, 'spread_hl_frac': 0.01764126641597941, 'bb_std_mult': 0.9409948675159092, 'rsi_os': 39, 'rsi_ob': 88, 'vol_spike': 0.02263581754594281, 'adx_thresh': 11.063360728582676, 'atr_min_pct': 0.026662306484371713, 'atr_max_pct': 0.056580680776250586, 'tp_mult': 2.502034272792102, 'tsl_mult': 0.9506441982031715, 'strategy': 'breakout', 'time_stop': 36, 'use_sma': False, 'use_atr': False, 'use_adx': True, 'use_ema': True, 'use_spike': True, 'rsi_required': False, 'edge_k': 0.6359912087849308, 'edge_cap': 0.3461113630257392, 'bull_strategy': 'mean_reversion', 'bull_bb_std_mult': 2.7403539541258315, 'bull_rsi_os': 30, 'bull_rsi_ob': 69, 'bull_adx_thresh': 18.002642293118388, 'bull_atr_min_pct': 0.020676833048729422, 'bull_atr_max_pct': 0.14331061392506012, 'bull_tp_mult': 2.209622519296465, 'bull_tsl_mult': 0.2521697604409998, 'bull_time_stop': 165, 'bull_use_sma': True, 'bull_use_ema': False, 'bull_use_atr': True, 'bull_use_adx': True, 'bull_use_spike': True, 'bull_rsi_required': True, 'bear_strategy': 'breakout', 'bear_bb_std_mult': 2.6607249061785, 'bear_rsi_os': 30, 'bear_rsi_ob': 80, 'bear_adx_thresh': 29.38360274507221, 'bear_atr_min_pct': 0.0015532710072382902, 'bear_atr_max_pct': 0.04441877698437746, 'bear_tp_mult': 2.4365297608990204, 'bear_tsl_mult': 0.32963794698770904, 'bear_time_stop': 137, 'bear_use_sma': False, 'bear_use_ema': True, 'bear_use_atr': False, 'bear_use_adx': False, 'bear_use_spike': True, 'bear_rsi_required': True, 'sideways_strategy': 'breakout', 'sideways_bb_std_mult': 2.6780544084527778, 'sideways_rsi_os': 30, 'sideways_rsi_ob': 89, 'sideways_adx_thresh': 24.897800710632186, 'sideways_atr_min_pct': 0.008197338888793176, 'sideways_atr_max_pct': 0.14764645264013132, 'sideways_tp_mult': 1.647963695760047, 'sideways_tsl_mult': 0.8968476446839664, 'sideways_time_stop': 42, 'sideways_use_sma': False, 'sideways_use_ema': False, 'sideways_use_atr': True, 'sideways_use_adx': True, 'sideways_use_spike': False, 'sideways_rsi_required': False}.
[I 2025-08-31 13:38:19,548] Trial 793 finished with values: [-1000000000.0, 1000000000.0] and parameters: {'p_sma': 34, 'p_std': 21, 'p_atr': 19, 'p_adx': 18, 'rsi_period': 48, 'ema1': 9, 'ema2': 52, 'slip_atr_k': 0.046454749057000366, 'slip_spread_k': 0.39001877078063096, 'spread_hl_frac': 0.017865935833442093, 'bb_std_mult': 3.36287332469879, 'rsi_os': 38, 'rsi_ob': 89, 'vol_spike': 0.11299309531502658, 'adx_thresh': 26.674227995604333, 'atr_min_pct': 0.026028373999242443, 'atr_max_pct': 0.02658043821819195, 'tp_mult': 2.453173703901728, 'tsl_mult': 0.601487293766361, 'strategy': 'breakout', 'time_stop': 300, 'use_sma': False, 'use_atr': False, 'use_adx': True, 'use_ema': True, 'use_spike': True, 'rsi_required': False, 'edge_k': 0.6413614178624457, 'edge_cap': 0.3491009139805876, 'bull_strategy': 'mean_reversion', 'bull_bb_std_mult': 2.755890826444984, 'bull_rsi_os': 5, 'bull_rsi_ob': 81, 'bull_adx_thresh': 19.42462771524151, 'bull_atr_min_pct': 0.020748646982504216, 'bull_atr_max_pct': 0.14293560666740557, 'bull_tp_mult': 2.27190805358887, 'bull_tsl_mult': 0.6589147967629195, 'bull_time_stop': 108, 'bull_use_sma': True, 'bull_use_ema': False, 'bull_use_atr': True, 'bull_use_adx': True, 'bull_use_spike': True, 'bull_rsi_required': True, 'bear_strategy': 'breakout', 'bear_bb_std_mult': 3.44326700456306, 'bear_rsi_os': 44, 'bear_rsi_ob': 73, 'bear_adx_thresh': 25.55579951886961, 'bear_atr_min_pct': 0.011849809684101733, 'bear_atr_max_pct': 0.024151802688959674, 'bear_tp_mult': 1.4360169947286296, 'bear_tsl_mult': 0.6678039974020515, 'bear_time_stop': 139, 'bear_use_sma': False, 'bear_use_ema': True, 'bear_use_atr': False, 'bear_use_adx': False, 'bear_use_spike': True, 'bear_rsi_required': True, 'sideways_strategy': 'breakout', 'sideways_bb_std_mult': 3.0449056287640386, 'sideways_rsi_os': 31, 'sideways_rsi_ob': 89, 'sideways_adx_thresh': 24.924878269458326, 'sideways_atr_min_pct': 0.0026677553752680605, 'sideways_atr_max_pct': 0.1476681565835022, 'sideways_tp_mult': 1.6440698129976121, 'sideways_tsl_mult': 0.8963519200959552, 'sideways_time_stop': 118, 'sideways_use_sma': False, 'sideways_use_ema': False, 'sideways_use_atr': True, 'sideways_use_adx': True, 'sideways_use_spike': False, 'sideways_rsi_required': False}.
[I 2025-08-31 13:38:20,050] Trial 791 finished with values: [-1000000000.0, 1000000000.0] and parameters: {'p_sma': 25, 'p_std': 44, 'p_atr': 17, 'p_adx': 13, 'rsi_period': 51, 'ema1': 14, 'ema2': 55, 'slip_atr_k': 0.04424488390745333, 'slip_spread_k': 0.8579071811117104, 'spread_hl_frac': 0.017856742816461782, 'bb_std_mult': 1.3952041746686528, 'rsi_os': 39, 'rsi_ob': 82, 'vol_spike': 0.023649070152198144, 'adx_thresh': 11.196160577810264, 'atr_min_pct': 0.026799065870812922, 'atr_max_pct': 0.05244703868458978, 'tp_mult': 2.580784136275303, 'tsl_mult': 0.6009412802568264, 'strategy': 'breakout', 'time_stop': 196, 'use_sma': False, 'use_atr': False, 'use_adx': True, 'use_ema': True, 'use_spike': True, 'rsi_required': False, 'edge_k': 1.6528681787098776, 'edge_cap': 0.5573682864247438, 'bull_strategy': 'mean_reversion', 'bull_bb_std_mult': 2.9133786967965154, 'bull_rsi_os': 5, 'bull_rsi_ob': 81, 'bull_adx_thresh': 17.93093576987407, 'bull_atr_min_pct': 0.020553883665279937, 'bull_atr_max_pct': 0.07080751503441605, 'bull_tp_mult': 2.1336182526010288, 'bull_tsl_mult': 0.6159197159333559, 'bull_time_stop': 111, 'bull_use_sma': False, 'bull_use_ema': True, 'bull_use_atr': True, 'bull_use_adx': False, 'bull_use_spike': True, 'bull_rsi_required': True, 'bear_strategy': 'mean_reversion', 'bear_bb_std_mult': 2.6485026713684654, 'bear_rsi_os': 30, 'bear_rsi_ob': 73, 'bear_adx_thresh': 24.246702778915854, 'bear_atr_min_pct': 0.0014715292745110002, 'bear_atr_max_pct': 0.13013828331756683, 'bear_tp_mult': 1.4300387636578873, 'bear_tsl_mult': 0.7130960026485058, 'bear_time_stop': 171, 'bear_use_sma': False, 'bear_use_ema': True, 'bear_use_atr': False, 'bear_use_adx': False, 'bear_use_spike': False, 'bear_rsi_required': True, 'sideways_strategy': 'breakout', 'sideways_bb_std_mult': 2.6889514133676715, 'sideways_rsi_os': 31, 'sideways_rsi_ob': 75, 'sideways_adx_thresh': 25.476367057315393, 'sideways_atr_min_pct': 0.00797813075496966, 'sideways_atr_max_pct': 0.14510188916523045, 'sideways_tp_mult': 2.2405114714241376, 'sideways_tsl_mult': 0.8860841048551937, 'sideways_time_stop': 118, 'sideways_use_sma': False, 'sideways_use_ema': False, 'sideways_use_atr': True, 'sideways_use_adx': True, 'sideways_use_spike': True, 'sideways_rsi_required': True}.
[I 2025-08-31 13:38:21,231] Trial 795 finished with values: [-1000000000.0, 1000000000.0] and parameters: {'p_sma': 21, 'p_std': 21, 'p_atr': 20, 'p_adx': 28, 'rsi_period': 71, 'ema1': 9, 'ema2': 17, 'slip_atr_k': 0.006808922316835234, 'slip_spread_k': 0.38918628177653436, 'spread_hl_frac': 0.04995967743554941, 'bb_std_mult': 2.207420871456358, 'rsi_os': 40, 'rsi_ob': 90, 'vol_spike': 7.71926215596963e-05, 'adx_thresh': 12.107681058584202, 'atr_min_pct': 0.025649503772044512, 'atr_max_pct': 0.1023786635685435, 'tp_mult': 2.5098238076002137, 'tsl_mult': 0.8275660811221116, 'strategy': 'breakout', 'time_stop': 5, 'use_sma': False, 'use_atr': False, 'use_adx': True, 'use_ema': True, 'use_spike': True, 'rsi_required': False, 'edge_k': 1.8358913758942599, 'edge_cap': 0.9992996221853804, 'bull_strategy': 'mean_reversion', 'bull_bb_std_mult': 1.2981457265633367, 'bull_rsi_os': 7, 'bull_rsi_ob': 68, 'bull_adx_thresh': 19.4423309792034, 'bull_atr_min_pct': 0.021252843796413984, 'bull_atr_max_pct': 0.01586427008897698, 'bull_tp_mult': 2.272024820054262, 'bull_tsl_mult': 0.9974977954302041, 'bull_time_stop': 46, 'bull_use_sma': True, 'bull_use_ema': False, 'bull_use_atr': True, 'bull_use_adx': True, 'bull_use_spike': True, 'bull_rsi_required': True, 'bear_strategy': 'breakout', 'bear_bb_std_mult': 2.882752439317212, 'bear_rsi_os': 30, 'bear_rsi_ob': 73, 'bear_adx_thresh': 25.056639975223256, 'bear_atr_min_pct': 0.011868206811360506, 'bear_atr_max_pct': 0.1253710994874361, 'bear_tp_mult': 2.048350018913844, 'bear_tsl_mult': 0.6694621808202685, 'bear_time_stop': 195, 'bear_use_sma': False, 'bear_use_ema': False, 'bear_use_atr': False, 'bear_use_adx': False, 'bear_use_spike': True, 'bear_rsi_required': False, 'sideways_strategy': 'breakout', 'sideways_bb_std_mult': 2.645402888921662, 'sideways_rsi_os': 18, 'sideways_rsi_ob': 64, 'sideways_adx_thresh': 24.31752601556643, 'sideways_atr_min_pct': 0.02434017583816133, 'sideways_atr_max_pct': 0.14780292592544533, 'sideways_tp_mult': 1.641382402788548, 'sideways_tsl_mult': 0.8832835432371802, 'sideways_time_stop': 33, 'sideways_use_sma': False, 'sideways_use_ema': False, 'sideways_use_atr': True, 'sideways_use_adx': True, 'sideways_use_spike': False, 'sideways_rsi_required': False}.
[I 2025-08-31 13:38:22,098] Trial 799 finished with values: [-1000000000.0, 1000000000.0] and parameters: {'p_sma': 15, 'p_std': 47, 'p_atr': 15, 'p_adx': 10, 'rsi_period': 26, 'ema1': 13, 'ema2': 30, 'slip_atr_k': 0.03740778027491481, 'slip_spread_k': 0.03466459498468499, 'spread_hl_frac': 0.016649488049976877, 'bb_std_mult': 2.3141085159840835, 'rsi_os': 33, 'rsi_ob': 95, 'vol_spike': 0.015583006590383941, 'adx_thresh': 10.179876812265901, 'atr_min_pct': 0.027890024280401365, 'atr_max_pct': 0.01391306849051871, 'tp_mult': 1.3381966323173393, 'tsl_mult': 0.9145416862397561, 'strategy': 'breakout', 'time_stop': 231, 'use_sma': True, 'use_atr': False, 'use_adx': True, 'use_ema': False, 'use_spike': True, 'rsi_required': False, 'edge_k': 0.12793546428714075, 'edge_cap': 0.6830430770598712, 'bull_strategy': 'mean_reversion', 'bull_bb_std_mult': 2.811026187155876, 'bull_rsi_os': 7, 'bull_rsi_ob': 87, 'bull_adx_thresh': 18.82208531125925, 'bull_atr_min_pct': 0.0020968840332081153, 'bull_atr_max_pct': 0.1406101549166226, 'bull_tp_mult': 2.3510936941002893, 'bull_tsl_mult': 0.7403163346789849, 'bull_time_stop': 22, 'bull_use_sma': True, 'bull_use_ema': True, 'bull_use_atr': True, 'bull_use_adx': True, 'bull_use_spike': True, 'bull_rsi_required': True, 'bear_strategy': 'breakout', 'bear_bb_std_mult': 0.5935136073465939, 'bear_rsi_os': 27, 'bear_rsi_ob': 59, 'bear_adx_thresh': 18.46412609532648, 'bear_atr_min_pct': 0.0009462876921972581, 'bear_atr_max_pct': 0.12640569882013705, 'bear_tp_mult': 1.3602961038220158, 'bear_tsl_mult': 0.7298745681705465, 'bear_time_stop': 108, 'bear_use_sma': False, 'bear_use_ema': False, 'bear_use_atr': False, 'bear_use_adx': False, 'bear_use_spike': True, 'bear_rsi_required': False, 'sideways_strategy': 'breakout', 'sideways_bb_std_mult': 3.2845931601977485, 'sideways_rsi_os': 27, 'sideways_rsi_ob': 66, 'sideways_adx_thresh': 6.47968148682655, 'sideways_atr_min_pct': 0.01999343191824366, 'sideways_atr_max_pct': 0.02839801033911557, 'sideways_tp_mult': 1.7003914938530165, 'sideways_tsl_mult': 0.3331000766633638, 'sideways_time_stop': 98, 'sideways_use_sma': False, 'sideways_use_ema': False, 'sideways_use_atr': True, 'sideways_use_adx': True, 'sideways_use_spike': False, 'sideways_rsi_required': True}.
[I 2025-08-31 13:38:53,883] Trial 796 finished with values: [-1000000000.0, 1000000000.0] and parameters: {'p_sma': 40, 'p_std': 37, 'p_atr': 21, 'p_adx': 27, 'rsi_period': 50, 'ema1': 9, 'ema2': 30, 'slip_atr_k': 0.2425378538386544, 'slip_spread_k': 0.11186463440000949, 'spread_hl_frac': 0.016761106192528016, 'bb_std_mult': 3.350061648368773, 'rsi_os': 38, 'rsi_ob': 94, 'vol_spike': 0.015791405408303164, 'adx_thresh': 11.866544441118407, 'atr_min_pct': 0.025791346622588248, 'atr_max_pct': 0.025870524317877633, 'tp_mult': 1.855969977501305, 'tsl_mult': 0.8266110173745009, 'strategy': 'breakout', 'time_stop': 196, 'use_sma': True, 'use_atr': False, 'use_adx': True, 'use_ema': True, 'use_spike': True, 'rsi_required': False, 'edge_k': 0.1317649060072943, 'edge_cap': 0.563135559981842, 'bull_strategy': 'mean_reversion', 'bull_bb_std_mult': 2.7317651027724486, 'bull_rsi_os': 7, 'bull_rsi_ob': 85, 'bull_adx_thresh': 19.64986613928629, 'bull_atr_min_pct': 0.013115342001306565, 'bull_atr_max_pct': 0.14227353153380465, 'bull_tp_mult': 2.2740803283278335, 'bull_tsl_mult': 0.233032358141626, 'bull_time_stop': 160, 'bull_use_sma': True, 'bull_use_ema': True, 'bull_use_atr': True, 'bull_use_adx': True, 'bull_use_spike': True, 'bull_rsi_required': True, 'bear_strategy': 'breakout', 'bear_bb_std_mult': 2.8582280201611683, 'bear_rsi_os': 30, 'bear_rsi_ob': 73, 'bear_adx_thresh': 19.929713779650232, 'bear_atr_min_pct': 0.011513839271575892, 'bear_atr_max_pct': 0.12599277594612007, 'bear_tp_mult': 2.542035939944166, 'bear_tsl_mult': 0.9117918254416142, 'bear_time_stop': 279, 'bear_use_sma': False, 'bear_use_ema': False, 'bear_use_atr': False, 'bear_use_adx': False, 'bear_use_spike': True, 'bear_rsi_required': False, 'sideways_strategy': 'breakout', 'sideways_bb_std_mult': 2.8378078276551517, 'sideways_rsi_os': 29, 'sideways_rsi_ob': 66, 'sideways_adx_thresh': 24.33238561266917, 'sideways_atr_min_pct': 0.02411520914973796, 'sideways_atr_max_pct': 0.017672744003514068, 'sideways_tp_mult': 1.699265560467612, 'sideways_tsl_mult': 0.8758638469651532, 'sideways_time_stop': 31, 'sideways_use_sma': False, 'sideways_use_ema': False, 'sideways_use_atr': True, 'sideways_use_adx': True, 'sideways_use_spike': False, 'sideways_rsi_required': True}.
[I 2025-08-31 13:38:54,528] Trial 798 finished with values: [-1000000000.0, 1000000000.0] and parameters: {'p_sma': 45, 'p_std': 48, 'p_atr': 20, 'p_adx': 10, 'rsi_period': 71, 'ema1': 24, 'ema2': 30, 'slip_atr_k': 0.14135262674453508, 'slip_spread_k': 0.35539244914913015, 'spread_hl_frac': 0.016218472316592906, 'bb_std_mult': 2.2265022693286602, 'rsi_os': 32, 'rsi_ob': 58, 'vol_spike': 0.0162885412961328, 'adx_thresh': 16.448078835216624, 'atr_min_pct': 0.028025738624515524, 'atr_max_pct': 0.09136189528027831, 'tp_mult': 2.9075960223994746, 'tsl_mult': 0.9135677636487777, 'strategy': 'breakout', 'time_stop': 67, 'use_sma': True, 'use_atr': False, 'use_adx': True, 'use_ema': False, 'use_spike': True, 'rsi_required': False, 'edge_k': 0.48674074540211054, 'edge_cap': 0.6824896523524029, 'bull_strategy': 'mean_reversion', 'bull_bb_std_mult': 3.4336926412376187, 'bull_rsi_os': 7, 'bull_rsi_ob': 85, 'bull_adx_thresh': 6.718672164892743, 'bull_atr_min_pct': 0.021594959150899994, 'bull_atr_max_pct': 0.05697119708419879, 'bull_tp_mult': 2.373622436955606, 'bull_tsl_mult': 0.24000918029813845, 'bull_time_stop': 183, 'bull_use_sma': True, 'bull_use_ema': True, 'bull_use_atr': True, 'bull_use_adx': True, 'bull_use_spike': True, 'bull_rsi_required': True, 'bear_strategy': 'breakout', 'bear_bb_std_mult': 2.8814519030798, 'bear_rsi_os': 27, 'bear_rsi_ob': 72, 'bear_adx_thresh': 19.802404433602188, 'bear_atr_min_pct': 0.0023199475884888984, 'bear_atr_max_pct': 0.12525508563985355, 'bear_tp_mult': 1.3487207421153156, 'bear_tsl_mult': 0.9506085251466473, 'bear_time_stop': 198, 'bear_use_sma': False, 'bear_use_ema': False, 'bear_use_atr': False, 'bear_use_adx': False, 'bear_use_spike': True, 'bear_rsi_required': False, 'sideways_strategy': 'breakout', 'sideways_bb_std_mult': 2.1400021590209004, 'sideways_rsi_os': 27, 'sideways_rsi_ob': 57, 'sideways_adx_thresh': 24.206395480700373, 'sideways_atr_min_pct': 0.0022392608778078337, 'sideways_atr_max_pct': 0.08884625610704687, 'sideways_tp_mult': 1.7052290026444004, 'sideways_tsl_mult': 0.10493240757692146, 'sideways_time_stop': 102, 'sideways_use_sma': False, 'sideways_use_ema': False, 'sideways_use_atr': True, 'sideways_use_adx': True, 'sideways_use_spike': False, 'sideways_rsi_required': True}.
[I 2025-08-31 13:38:55,090] Trial 797 finished with values: [-1000000000.0, 1000000000.0] and parameters: {'p_sma': 45, 'p_std': 5, 'p_atr': 20, 'p_adx': 14, 'rsi_period': 39, 'ema1': 17, 'ema2': 19, 'slip_atr_k': 0.0378408209759611, 'slip_spread_k': 0.3528317415607123, 'spread_hl_frac': 0.01642470860571675, 'bb_std_mult': 2.2471456831588115, 'rsi_os': 15, 'rsi_ob': 94, 'vol_spike': 0.28006277245562117, 'adx_thresh': 25.042932632905718, 'atr_min_pct': 0.0255900183196673, 'atr_max_pct': 0.04166607282078167, 'tp_mult': 1.8742669344617546, 'tsl_mult': 0.9046135156593802, 'strategy': 'breakout', 'time_stop': 174, 'use_sma': True, 'use_atr': False, 'use_adx': True, 'use_ema': True, 'use_spike': True, 'rsi_required': False, 'edge_k': 1.7838750511050612, 'edge_cap': 0.683369540081657, 'bull_strategy': 'mean_reversion', 'bull_bb_std_mult': 2.7113593068847823, 'bull_rsi_os': 52, 'bull_rsi_ob': 85, 'bull_adx_thresh': 18.888432662734253, 'bull_atr_min_pct': 0.012889002586780884, 'bull_atr_max_pct': 0.14068591886592038, 'bull_tp_mult': 2.334534844638963, 'bull_tsl_mult': 0.24081702007990086, 'bull_time_stop': 159, 'bull_use_sma': True, 'bull_use_ema': True, 'bull_use_atr': True, 'bull_use_adx': True, 'bull_use_spike': True, 'bull_rsi_required': True, 'bear_strategy': 'breakout', 'bear_bb_std_mult': 1.011362681124912, 'bear_rsi_os': 25, 'bear_rsi_ob': 72, 'bear_adx_thresh': 24.316260244475036, 'bear_atr_min_pct': 0.002391009854357081, 'bear_atr_max_pct': 0.1257517911623907, 'bear_tp_mult': 1.5510816235691718, 'bear_tsl_mult': 0.5166493949891079, 'bear_time_stop': 198, 'bear_use_sma': False, 'bear_use_ema': False, 'bear_use_atr': False, 'bear_use_adx': False, 'bear_use_spike': True, 'bear_rsi_required': False, 'sideways_strategy': 'breakout', 'sideways_bb_std_mult': 1.1775838914196974, 'sideways_rsi_os': 7, 'sideways_rsi_ob': 64, 'sideways_adx_thresh': 6.34621626002132, 'sideways_atr_min_pct': 0.017825155724652746, 'sideways_atr_max_pct': 0.017682220586099466, 'sideways_tp_mult': 2.0516729557409574, 'sideways_tsl_mult': 0.8796949623931015, 'sideways_time_stop': 31, 'sideways_use_sma': False, 'sideways_use_ema': False, 'sideways_use_atr': True, 'sideways_use_adx': True, 'sideways_use_spike': False, 'sideways_rsi_required': True}.
[I 2025-08-31 13:38:56,515] Trial 800 finished with values: [-0.0518280691891474, 0.05121541576962849] and parameters: {'p_sma': 45, 'p_std': 22, 'p_atr': 21, 'p_adx': 26, 'rsi_period': 32, 'ema1': 12, 'ema2': 20, 'slip_atr_k': 0.03386982760477522, 'slip_spread_k': 0.09785046428116484, 'spread_hl_frac': 0.01869121898675932, 'bb_std_mult': 2.221007577085867, 'rsi_os': 37, 'rsi_ob': 58, 'vol_spike': 0.0092138528685046, 'adx_thresh': 5.700303585195519, 'atr_min_pct': 0.023903451546294904, 'atr_max_pct': 0.04050088668688325, 'tp_mult': 2.562142691485719, 'tsl_mult': 0.19526777404258927, 'strategy': 'mean_reversion', 'time_stop': 175, 'use_sma': True, 'use_atr': False, 'use_adx': True, 'use_ema': True, 'use_spike': True, 'rsi_required': False, 'edge_k': 0.5619347630494583, 'edge_cap': 0.18292200208733295, 'bull_strategy': 'mean_reversion', 'bull_bb_std_mult': 2.6912138532152916, 'bull_rsi_os': 6, 'bull_rsi_ob': 66, 'bull_adx_thresh': 17.453744604258574, 'bull_atr_min_pct': 0.012735768638848, 'bull_atr_max_pct': 0.06129570956742522, 'bull_tp_mult': 2.472812948688988, 'bull_tsl_mult': 0.25712221829238074, 'bull_time_stop': 232, 'bull_use_sma': True, 'bull_use_ema': True, 'bull_use_atr': True, 'bull_use_adx': True, 'bull_use_spike': True, 'bull_rsi_required': True, 'bear_strategy': 'breakout', 'bear_bb_std_mult': 0.9831005823667629, 'bear_rsi_os': 34, 'bear_rsi_ob': 71, 'bear_adx_thresh': 19.517951819581608, 'bear_atr_min_pct': 0.0023398037711446426, 'bear_atr_max_pct': 0.12201178215530338, 'bear_tp_mult': 1.6899432739793618, 'bear_tsl_mult': 0.9648371764267705, 'bear_time_stop': 185, 'bear_use_sma': False, 'bear_use_ema': True, 'bear_use_atr': False, 'bear_use_adx': False, 'bear_use_spike': True, 'bear_rsi_required': True, 'sideways_strategy': 'breakout', 'sideways_bb_std_mult': 2.824197140873623, 'sideways_rsi_os': 29, 'sideways_rsi_ob': 64, 'sideways_adx_thresh': 24.128254579339107, 'sideways_atr_min_pct': 0.016361970144705154, 'sideways_atr_max_pct': 0.024377600740841082, 'sideways_tp_mult': 2.0525700569661876, 'sideways_tsl_mult': 0.8674971366222085, 'sideways_time_stop': 39, 'sideways_use_sma': False, 'sideways_use_ema': False, 'sideways_use_atr': True, 'sideways_use_adx': True, 'sideways_use_spike': False, 'sideways_rsi_required': True}.
