[I 2025-08-31 12:27:16,656] Trial 267 finished with values: [-1000000000.0, 1000000000.0] and parameters: {'p_sma': 55, 'p_std': 29, 'p_atr': 28, 'p_adx': 17, 'rsi_period': 80, 'ema1': 5, 'ema2': 17, 'slip_atr_k': 0.022053149428487587, 'slip_spread_k': 0.6271968216759198, 'spread_hl_frac': 0.032049312271314266, 'bb_std_mult': 1.6607829454097094, 'rsi_os': 39, 'rsi_ob': 73, 'vol_spike': 0.12759204758367118, 'adx_thresh': 20.333266271010043, 'atr_min_pct': 0.002463927308836447, 'atr_max_pct': 0.12837293912486403, 'tp_mult': 2.768597200334074, 'tsl_mult': 0.04939152439178587, 'strategy': 'breakout', 'time_stop': 220, 'use_sma': False, 'use_atr': True, 'use_adx': False, 'use_ema': False, 'use_spike': False, 'rsi_required': True, 'edge_k': 0.6526955409743928, 'edge_cap': 0.7035321112802545, 'bull_strategy': 'breakout', 'bull_bb_std_mult': 2.9827675355728385, 'bull_rsi_os': 8, 'bull_rsi_ob': 79, 'bull_adx_thresh': 9.55917649342278, 'bull_atr_min_pct': 0.02053549167007173, 'bull_atr_max_pct': 0.10254648393898896, 'bull_tp_mult': 1.3703447093644154, 'bull_tsl_mult': 0.18879100999170684, 'bull_time_stop': 96, 'bull_use_sma': True, 'bull_use_ema': True, 'bull_use_atr': False, 'bull_use_adx': False, 'bull_use_spike': False, 'bull_rsi_required': False, 'bear_strategy': 'breakout', 'bear_bb_std_mult': 3.3644268035341955, 'bear_rsi_os': 29, 'bear_rsi_ob': 72, 'bear_adx_thresh': 15.244113119536578, 'bear_atr_min_pct': 0.024852684703520242, 'bear_atr_max_pct': 0.09267885600455647, 'bear_tp_mult': 2.833660791184184, 'bear_tsl_mult': 0.15205995425484403, 'bear_time_stop': 244, 'bear_use_sma': True, 'bear_use_ema': True, 'bear_use_atr': True, 'bear_use_adx': True, 'bear_use_spike': True, 'bear_rsi_required': True, 'sideways_strategy': 'breakout', 'sideways_bb_std_mult': 3.5497337226558434, 'sideways_rsi_os': 13, 'sideways_rsi_ob': 78, 'sideways_adx_thresh': 15.392299461388063, 'sideways_atr_min_pct': 0.023495133129868256, 'sideways_atr_max_pct': 0.1219032782060654, 'sideways_tp_mult': 1.4680756896073135, 'sideways_tsl_mult': 0.621432527692153, 'sideways_time_stop': 223, 'sideways_use_sma': True, 'sideways_use_ema': False, 'sideways_use_atr': False, 'sideways_use_adx': False, 'sideways_use_spike': True, 'sideways_rsi_required': False}.
[I 2025-08-31 12:27:17,246] Trial 274 finished with values: [-1000000000.0, 1000000000.0] and parameters: {'p_sma': 47, 'p_std': 31, 'p_atr': 24, 'p_adx': 17, 'rsi_period': 49, 'ema1': 5, 'ema2': 13, 'slip_atr_k': 0.05513461111524226, 'slip_spread_k': 0.6405379226201964, 'spread_hl_frac': 0.007325033283533684, 'bb_std_mult': 1.3471010505062608, 'rsi_os': 51, 'rsi_ob': 75, 'vol_spike': 0.08931410244757645, 'adx_thresh': 22.55058029475097, 'atr_min_pct': 0.00025756146343176574, 'atr_max_pct': 0.14659217334825894, 'tp_mult': 2.6802401766788675, 'tsl_mult': 0.03164495505075503, 'strategy': 'mean_reversion', 'time_stop': 203, 'use_sma': False, 'use_atr': True, 'use_adx': False, 'use_ema': True, 'use_spike': False, 'rsi_required': True, 'edge_k': 0.7689292465294774, 'edge_cap': 0.6308408197826161, 'bull_strategy': 'breakout', 'bull_bb_std_mult': 2.919897434748301, 'bull_rsi_os': 10, 'bull_rsi_ob': 81, 'bull_adx_thresh': 22.591310671829604, 'bull_atr_min_pct': 0.021093628102205456, 'bull_atr_max_pct': 0.07492503066517563, 'bull_tp_mult': 2.717709815346815, 'bull_tsl_mult': 0.23307574887931862, 'bull_time_stop': 215, 'bull_use_sma': True, 'bull_use_ema': True, 'bull_use_atr': False, 'bull_use_adx': True, 'bull_use_spike': True, 'bull_rsi_required': False, 'bear_strategy': 'breakout', 'bear_bb_std_mult': 2.3369990422724634, 'bear_rsi_os': 29, 'bear_rsi_ob': 70, 'bear_adx_thresh': 6.130078598589044, 'bear_atr_min_pct': 0.007744439109739657, 'bear_atr_max_pct': 0.0837184492768867, 'bear_tp_mult': 2.934508519941293, 'bear_tsl_mult': 0.17161569586748798, 'bear_time_stop': 251, 'bear_use_sma': True, 'bear_use_ema': True, 'bear_use_atr': True, 'bear_use_adx': True, 'bear_use_spike': True, 'bear_rsi_required': True, 'sideways_strategy': 'breakout', 'sideways_bb_std_mult': 3.4667337862954652, 'sideways_rsi_os': 34, 'sideways_rsi_ob': 75, 'sideways_adx_thresh': 12.55281361550525, 'sideways_atr_min_pct': 0.00726248313102614, 'sideways_atr_max_pct': 0.1353974751875855, 'sideways_tp_mult': 1.8910235661734416, 'sideways_tsl_mult': 0.6586301364216375, 'sideways_time_stop': 202, 'sideways_use_sma': True, 'sideways_use_ema': False, 'sideways_use_atr': False, 'sideways_use_adx': True, 'sideways_use_spike': False, 'sideways_rsi_required': True}.
[I 2025-08-31 12:27:49,071] Trial 273 finished with values: [-1000000000.0, 1000000000.0] and parameters: {'p_sma': 49, 'p_std': 31, 'p_atr': 12, 'p_adx': 16, 'rsi_period': 77, 'ema1': 5, 'ema2': 13, 'slip_atr_k': 0.0012385512346825278, 'slip_spread_k': 0.6221042369283921, 'spread_hl_frac': 0.028371153253682047, 'bb_std_mult': 1.364787596658788, 'rsi_os': 41, 'rsi_ob': 73, 'vol_spike': 0.058831762383404776, 'adx_thresh': 17.839989047757854, 'atr_min_pct': 0.0008532424625616163, 'atr_max_pct': 0.1460737956052864, 'tp_mult': 1.062198725612888, 'tsl_mult': 0.03796833073778066, 'strategy': 'breakout', 'time_stop': 202, 'use_sma': False, 'use_atr': True, 'use_adx': False, 'use_ema': True, 'use_spike': False, 'rsi_required': True, 'edge_k': 0.540617091233741, 'edge_cap': 0.6101255331449612, 'bull_strategy': 'breakout', 'bull_bb_std_mult': 2.926863577339655, 'bull_rsi_os': 26, 'bull_rsi_ob': 80, 'bull_adx_thresh': 9.58058326196668, 'bull_atr_min_pct': 0.022459152786228533, 'bull_atr_max_pct': 0.11481866711023922, 'bull_tp_mult': 1.5411365844609863, 'bull_tsl_mult': 0.208282505427487, 'bull_time_stop': 225, 'bull_use_sma': True, 'bull_use_ema': True, 'bull_use_atr': False, 'bull_use_adx': True, 'bull_use_spike': True, 'bull_rsi_required': False, 'bear_strategy': 'breakout', 'bear_bb_std_mult': 2.749641774972078, 'bear_rsi_os': 29, 'bear_rsi_ob': 70, 'bear_adx_thresh': 11.35131855371602, 'bear_atr_min_pct': 0.015232359378890168, 'bear_atr_max_pct': 0.09602080775304625, 'bear_tp_mult': 2.8486708530414666, 'bear_tsl_mult': 0.1748463250678836, 'bear_time_stop': 251, 'bear_use_sma': True, 'bear_use_ema': True, 'bear_use_atr': True, 'bear_use_adx': True, 'bear_use_spike': True, 'bear_rsi_required': True, 'sideways_strategy': 'breakout', 'sideways_bb_std_mult': 3.487359588620117, 'sideways_rsi_os': 35, 'sideways_rsi_ob': 73, 'sideways_adx_thresh': 14.894459476468853, 'sideways_atr_min_pct': 0.023940903305563404, 'sideways_atr_max_pct': 0.1350471324914426, 'sideways_tp_mult': 1.5220651348457352, 'sideways_tsl_mult': 0.6645467725251553, 'sideways_time_stop': 202, 'sideways_use_sma': True, 'sideways_use_ema': False, 'sideways_use_atr': False, 'sideways_use_adx': True, 'sideways_use_spike': False, 'sideways_rsi_required': True}.
[I 2025-08-31 12:27:49,518] Trial 271 finished with values: [-1000000000.0, 1000000000.0] and parameters: {'p_sma': 49, 'p_std': 26, 'p_atr': 12, 'p_adx': 16, 'rsi_period': 77, 'ema1': 5, 'ema2': 13, 'slip_atr_k': 0.02271694030558844, 'slip_spread_k': 0.6325839229994529, 'spread_hl_frac': 0.028663183044099552, 'bb_std_mult': 1.3789927739816328, 'rsi_os': 36, 'rsi_ob': 74, 'vol_spike': 0.05794154608071838, 'adx_thresh': 7.938338713689227, 'atr_min_pct': 0.0004200724616290235, 'atr_max_pct': 0.14541494186760778, 'tp_mult': 2.6688444128200106, 'tsl_mult': 0.04188541735047218, 'strategy': 'mean_reversion', 'time_stop': 204, 'use_sma': False, 'use_atr': True, 'use_adx': False, 'use_ema': True, 'use_spike': False, 'rsi_required': True, 'edge_k': 0.734889780351869, 'edge_cap': 0.6268399658660612, 'bull_strategy': 'breakout', 'bull_bb_std_mult': 2.8582550115346854, 'bull_rsi_os': 10, 'bull_rsi_ob': 80, 'bull_adx_thresh': 9.677746867286967, 'bull_atr_min_pct': 0.022424870834469143, 'bull_atr_max_pct': 0.08442955119071102, 'bull_tp_mult': 1.5431925105453066, 'bull_tsl_mult': 0.20657442357722725, 'bull_time_stop': 91, 'bull_use_sma': True, 'bull_use_ema': True, 'bull_use_atr': False, 'bull_use_adx': True, 'bull_use_spike': True, 'bull_rsi_required': False, 'bear_strategy': 'breakout', 'bear_bb_std_mult': 3.3605881807543536, 'bear_rsi_os': 33, 'bear_rsi_ob': 74, 'bear_adx_thresh': 15.19424713613529, 'bear_atr_min_pct': 0.007484068137513764, 'bear_atr_max_pct': 0.09536857698491422, 'bear_tp_mult': 2.8231054120615973, 'bear_tsl_mult': 0.17495272796743438, 'bear_time_stop': 252, 'bear_use_sma': True, 'bear_use_ema': True, 'bear_use_atr': True, 'bear_use_adx': True, 'bear_use_spike': True, 'bear_rsi_required': True, 'sideways_strategy': 'breakout', 'sideways_bb_std_mult': 3.4633958128115263, 'sideways_rsi_os': 34, 'sideways_rsi_ob': 75, 'sideways_adx_thresh': 13.110480499127938, 'sideways_atr_min_pct': 0.029555384431473344, 'sideways_atr_max_pct': 0.12252070854526187, 'sideways_tp_mult': 1.4959698044422538, 'sideways_tsl_mult': 0.6599439718726441, 'sideways_time_stop': 203, 'sideways_use_sma': True, 'sideways_use_ema': False, 'sideways_use_atr': False, 'sideways_use_adx': True, 'sideways_use_spike': False, 'sideways_rsi_required': True}.
[I 2025-08-31 12:27:49,781] Trial 272 finished with values: [-1000000000.0, 1000000000.0] and parameters: {'p_sma': 47, 'p_std': 26, 'p_atr': 22, 'p_adx': 17, 'rsi_period': 78, 'ema1': 5, 'ema2': 15, 'slip_atr_k': 0.0229545008311154, 'slip_spread_k': 0.6421376756490239, 'spread_hl_frac': 0.028672147526707062, 'bb_std_mult': 2.396020882577888, 'rsi_os': 40, 'rsi_ob': 74, 'vol_spike': 0.05930296088751913, 'adx_thresh': 9.544280097999225, 'atr_min_pct': 0.0004209490207730173, 'atr_max_pct': 0.11826278862889127, 'tp_mult': 2.6563657256103985, 'tsl_mult': 0.03593522987073677, 'strategy': 'mean_reversion', 'time_stop': 207, 'use_sma': False, 'use_atr': True, 'use_adx': False, 'use_ema': True, 'use_spike': False, 'rsi_required': True, 'edge_k': 0.717967645238936, 'edge_cap': 0.641232276983911, 'bull_strategy': 'breakout', 'bull_bb_std_mult': 2.828631716245954, 'bull_rsi_os': 10, 'bull_rsi_ob': 80, 'bull_adx_thresh': 30.675585751209198, 'bull_atr_min_pct': 0.020668179634645588, 'bull_atr_max_pct': 0.09203470998956599, 'bull_tp_mult': 2.7135236742484117, 'bull_tsl_mult': 0.21129777912822337, 'bull_time_stop': 226, 'bull_use_sma': True, 'bull_use_ema': True, 'bull_use_atr': False, 'bull_use_adx': True, 'bull_use_spike': True, 'bull_rsi_required': False, 'bear_strategy': 'breakout', 'bear_bb_std_mult': 2.768525922854962, 'bear_rsi_os': 29, 'bear_rsi_ob': 71, 'bear_adx_thresh': 32.394529211476105, 'bear_atr_min_pct': 0.02781638013041755, 'bear_atr_max_pct': 0.08501270049765737, 'bear_tp_mult': 2.968561847378469, 'bear_tsl_mult': 0.17072997832716746, 'bear_time_stop': 251, 'bear_use_sma': True, 'bear_use_ema': True, 'bear_use_atr': True, 'bear_use_adx': True, 'bear_use_spike': True, 'bear_rsi_required': True, 'sideways_strategy': 'breakout', 'sideways_bb_std_mult': 3.460814082109145, 'sideways_rsi_os': 16, 'sideways_rsi_ob': 75, 'sideways_adx_thresh': 15.113433233028287, 'sideways_atr_min_pct': 0.02840277913111172, 'sideways_atr_max_pct': 0.13525859229143825, 'sideways_tp_mult': 1.535289356804225, 'sideways_tsl_mult': 0.6009343901876152, 'sideways_time_stop': 202, 'sideways_use_sma': True, 'sideways_use_ema': False, 'sideways_use_atr': False, 'sideways_use_adx': True, 'sideways_use_spike': False, 'sideways_rsi_required': True}.
[I 2025-08-31 12:27:50,718] Trial 275 finished with values: [-1000000000.0, 1000000000.0] and parameters: {'p_sma': 49, 'p_std': 27, 'p_atr': 22, 'p_adx': 16, 'rsi_period': 55, 'ema1': 5, 'ema2': 15, 'slip_atr_k': 0.02988630943286259, 'slip_spread_k': 0.6219564235368231, 'spread_hl_frac': 0.0284674317012158, 'bb_std_mult': 2.036974784615489, 'rsi_os': 22, 'rsi_ob': 74, 'vol_spike': 0.11636448826000322, 'adx_thresh': 22.180964581312484, 'atr_min_pct': 7.686134964436284e-05, 'atr_max_pct': 0.12335343756458667, 'tp_mult': 1.3221890422780231, 'tsl_mult': 0.027736617224503886, 'strategy': 'mean_reversion', 'time_stop': 204, 'use_sma': False, 'use_atr': True, 'use_adx': False, 'use_ema': False, 'use_spike': False, 'rsi_required': True, 'edge_k': 0.5509062692568385, 'edge_cap': 0.7990883481674461, 'bull_strategy': 'breakout', 'bull_bb_std_mult': 2.838587540925903, 'bull_rsi_os': 9, 'bull_rsi_ob': 80, 'bull_adx_thresh': 13.820299660775827, 'bull_atr_min_pct': 0.022177542807640283, 'bull_atr_max_pct': 0.09267348185446433, 'bull_tp_mult': 2.091849577172325, 'bull_tsl_mult': 0.20399837301478602, 'bull_time_stop': 89, 'bull_use_sma': True, 'bull_use_ema': True, 'bull_use_atr': False, 'bull_use_adx': True, 'bull_use_spike': False, 'bull_rsi_required': False, 'bear_strategy': 'breakout', 'bear_bb_std_mult': 2.7874447512062996, 'bear_rsi_os': 33, 'bear_rsi_ob': 71, 'bear_adx_thresh': 5.043730543081843, 'bear_atr_min_pct': 0.003659605222151679, 'bear_atr_max_pct': 0.06594516674228564, 'bear_tp_mult': 2.7975503244465827, 'bear_tsl_mult': 0.1235953019056179, 'bear_time_stop': 249, 'bear_use_sma': True, 'bear_use_ema': True, 'bear_use_atr': True, 'bear_use_adx': True, 'bear_use_spike': True, 'bear_rsi_required': True, 'sideways_strategy': 'breakout', 'sideways_bb_std_mult': 3.4528117324434384, 'sideways_rsi_os': 17, 'sideways_rsi_ob': 73, 'sideways_adx_thresh': 16.492016418917427, 'sideways_atr_min_pct': 0.02935960965931584, 'sideways_atr_max_pct': 0.12915990320460516, 'sideways_tp_mult': 1.5253668511603977, 'sideways_tsl_mult': 0.6650997962499446, 'sideways_time_stop': 207, 'sideways_use_sma': True, 'sideways_use_ema': False, 'sideways_use_atr': False, 'sideways_use_adx': False, 'sideways_use_spike': False, 'sideways_rsi_required': True}.
[I 2025-08-31 12:28:22,217] Trial 278 finished with values: [-1000000000.0, 1000000000.0] and parameters: {'p_sma': 53, 'p_std': 29, 'p_atr': 19, 'p_adx': 15, 'rsi_period': 57, 'ema1': 5, 'ema2': 22, 'slip_atr_k': 0.05845109278016069, 'slip_spread_k': 0.6026870066461247, 'spread_hl_frac': 0.00979077978839694, 'bb_std_mult': 2.0043988946322866, 'rsi_os': 7, 'rsi_ob': 75, 'vol_spike': 0.11561173209207612, 'adx_thresh': 10.791514811937365, 'atr_min_pct': 0.0029831032825472018, 'atr_max_pct': 0.12226951672602453, 'tp_mult': 2.6048281541047515, 'tsl_mult': 0.0010917985042890304, 'strategy': 'mean_reversion', 'time_stop': 213, 'use_sma': False, 'use_atr': True, 'use_adx': False, 'use_ema': False, 'use_spike': False, 'rsi_required': True, 'edge_k': 0.43375962817879365, 'edge_cap': 0.7885329951539516, 'bull_strategy': 'breakout', 'bull_bb_std_mult': 3.0346459736073386, 'bull_rsi_os': 9, 'bull_rsi_ob': 81, 'bull_adx_thresh': 8.025463645008095, 'bull_atr_min_pct': 0.021334571862205415, 'bull_atr_max_pct': 0.09194409197447603, 'bull_tp_mult': 2.100388041672163, 'bull_tsl_mult': 0.2636128107791212, 'bull_time_stop': 87, 'bull_use_sma': True, 'bull_use_ema': True, 'bull_use_atr': False, 'bull_use_adx': True, 'bull_use_spike': False, 'bull_rsi_required': False, 'bear_strategy': 'breakout', 'bear_bb_std_mult': 3.517546597819381, 'bear_rsi_os': 34, 'bear_rsi_ob': 73, 'bear_adx_thresh': 32.57013496696169, 'bear_atr_min_pct': 0.026965435769944316, 'bear_atr_max_pct': 0.06413159723108036, 'bear_tp_mult': 2.789246870074053, 'bear_tsl_mult': 0.1169283032320135, 'bear_time_stop': 230, 'bear_use_sma': True, 'bear_use_ema': True, 'bear_use_atr': True, 'bear_use_adx': True, 'bear_use_spike': False, 'bear_rsi_required': True, 'sideways_strategy': 'breakout', 'sideways_bb_std_mult': 3.596466124767262, 'sideways_rsi_os': 23, 'sideways_rsi_ob': 80, 'sideways_adx_thresh': 16.459593402904016, 'sideways_atr_min_pct': 0.0014858489402409854, 'sideways_atr_max_pct': 0.1291327637807747, 'sideways_tp_mult': 1.7745825647651163, 'sideways_tsl_mult': 0.6387309968974446, 'sideways_time_stop': 209, 'sideways_use_sma': True, 'sideways_use_ema': False, 'sideways_use_atr': False, 'sideways_use_adx': False, 'sideways_use_spike': False, 'sideways_rsi_required': True}.
[I 2025-08-31 12:28:22,723] Trial 279 finished with values: [-1000000000.0, 1000000000.0] and parameters: {'p_sma': 53, 'p_std': 29, 'p_atr': 13, 'p_adx': 15, 'rsi_period': 14, 'ema1': 5, 'ema2': 10, 'slip_atr_k': 0.0631404920329429, 'slip_spread_k': 0.5895547098748195, 'spread_hl_frac': 0.04442332802254277, 'bb_std_mult': 2.1277923061172137, 'rsi_os': 41, 'rsi_ob': 76, 'vol_spike': 0.09319861427523286, 'adx_thresh': 30.07590766684391, 'atr_min_pct': 0.0014799226089908602, 'atr_max_pct': 0.13731192515720358, 'tp_mult': 2.0523489534903043, 'tsl_mult': 0.008042595375842246, 'strategy': 'mean_reversion', 'time_stop': 213, 'use_sma': False, 'use_atr': True, 'use_adx': False, 'use_ema': False, 'use_spike': False, 'rsi_required': True, 'edge_k': 0.5882191320024612, 'edge_cap': 0.7994418477650185, 'bull_strategy': 'breakout', 'bull_bb_std_mult': 0.8220097070646266, 'bull_rsi_os': 49, 'bull_rsi_ob': 81, 'bull_adx_thresh': 8.203515558108304, 'bull_atr_min_pct': 0.021298779661912057, 'bull_atr_max_pct': 0.10815115948130698, 'bull_tp_mult': 2.6607081572302342, 'bull_tsl_mult': 0.2538088747695819, 'bull_time_stop': 9, 'bull_use_sma': True, 'bull_use_ema': True, 'bull_use_atr': False, 'bull_use_adx': True, 'bull_use_spike': False, 'bull_rsi_required': False, 'bear_strategy': 'breakout', 'bear_bb_std_mult': 2.6543677852512584, 'bear_rsi_os': 35, 'bear_rsi_ob': 73, 'bear_adx_thresh': 32.63791937240319, 'bear_atr_min_pct': 0.006185742192806213, 'bear_atr_max_pct': 0.03837261315240402, 'bear_tp_mult': 2.7515962268772687, 'bear_tsl_mult': 0.11815237801623246, 'bear_time_stop': 231, 'bear_use_sma': True, 'bear_use_ema': True, 'bear_use_atr': True, 'bear_use_adx': True, 'bear_use_spike': False, 'bear_rsi_required': True, 'sideways_strategy': 'mean_reversion', 'sideways_bb_std_mult': 3.5987268490381377, 'sideways_rsi_os': 5, 'sideways_rsi_ob': 77, 'sideways_adx_thresh': 12.711059495203326, 'sideways_atr_min_pct': 0.012863648832267946, 'sideways_atr_max_pct': 0.1392923457570419, 'sideways_tp_mult': 1.4275305982704176, 'sideways_tsl_mult': 0.6362067515942399, 'sideways_time_stop': 86, 'sideways_use_sma': True, 'sideways_use_ema': False, 'sideways_use_atr': False, 'sideways_use_adx': False, 'sideways_use_spike': False, 'sideways_rsi_required': True}.
[I 2025-08-31 12:28:22,730] Trial 276 finished with values: [-1000000000.0, 1000000000.0] and parameters: {'p_sma': 57, 'p_std': 26, 'p_atr': 13, 'p_adx': 15, 'rsi_period': 78, 'ema1': 5, 'ema2': 15, 'slip_atr_k': 0.05979118966645751, 'slip_spread_k': 0.6517769762406552, 'spread_hl_frac': 0.02870349500881007, 'bb_std_mult': 1.4182089536526135, 'rsi_os': 21, 'rsi_ob': 74, 'vol_spike': 0.1184587953253198, 'adx_thresh': 27.701761977923617, 'atr_min_pct': 0.00016967984689908434, 'atr_max_pct': 0.14098792565315946, 'tp_mult': 1.8555944962977156, 'tsl_mult': 0.023219500675303893, 'strategy': 'mean_reversion', 'time_stop': 209, 'use_sma': False, 'use_atr': True, 'use_adx': False, 'use_ema': False, 'use_spike': False, 'rsi_required': True, 'edge_k': 0.6978395046797506, 'edge_cap': 0.7874521484335594, 'bull_strategy': 'breakout', 'bull_bb_std_mult': 2.822273350486798, 'bull_rsi_os': 9, 'bull_rsi_ob': 80, 'bull_adx_thresh': 8.011922895282975, 'bull_atr_min_pct': 0.022289010335550814, 'bull_atr_max_pct': 0.09242617282505965, 'bull_tp_mult': 2.658298142160948, 'bull_tsl_mult': 0.2535399240032807, 'bull_time_stop': 89, 'bull_use_sma': True, 'bull_use_ema': True, 'bull_use_atr': False, 'bull_use_adx': True, 'bull_use_spike': False, 'bull_rsi_required': False, 'bear_strategy': 'breakout', 'bear_bb_std_mult': 2.8002110350142018, 'bear_rsi_os': 33, 'bear_rsi_ob': 73, 'bear_adx_thresh': 32.491855077395655, 'bear_atr_min_pct': 0.027676342862496952, 'bear_atr_max_pct': 0.07806516905923312, 'bear_tp_mult': 2.949385628177175, 'bear_tsl_mult': 0.11856042105975166, 'bear_time_stop': 232, 'bear_use_sma': True, 'bear_use_ema': True, 'bear_use_atr': True, 'bear_use_adx': True, 'bear_use_spike': False, 'bear_rsi_required': True, 'sideways_strategy': 'breakout', 'sideways_bb_std_mult': 3.5662250404627587, 'sideways_rsi_os': 36, 'sideways_rsi_ob': 86, 'sideways_adx_thresh': 17.41727541769234, 'sideways_atr_min_pct': 0.006437779672455152, 'sideways_atr_max_pct': 0.12896737022997698, 'sideways_tp_mult': 1.8069396911031952, 'sideways_tsl_mult': 0.5643517555151343, 'sideways_time_stop': 204, 'sideways_use_sma': True, 'sideways_use_ema': False, 'sideways_use_atr': False, 'sideways_use_adx': False, 'sideways_use_spike': False, 'sideways_rsi_required': True}.
