[I 2025-08-31 13:35:28,362] Trial 774 finished with values: [-1000000000.0, 1000000000.0] and parameters: {'p_sma': 10, 'p_std': 40, 'p_atr': 19, 'p_adx': 18, 'rsi_period': 43, 'ema1': 25, 'ema2': 20, 'slip_atr_k': 0.04027497685902037, 'slip_spread_k': 0.4057402108844351, 'spread_hl_frac': 0.021698590641648502, 'bb_std_mult': 2.3259150642336954, 'rsi_os': 28, 'rsi_ob': 91, 'vol_spike': 0.20203977121617145, 'adx_thresh': 30.51817382897009, 'atr_min_pct': 0.026374625336333588, 'atr_max_pct': 0.038607041450011315, 'tp_mult': 1.246306165150357, 'tsl_mult': 0.7339912230250132, 'strategy': 'breakout', 'time_stop': 255, 'use_sma': True, 'use_atr': False, 'use_adx': True, 'use_ema': True, 'use_spike': True, 'rsi_required': False, 'edge_k': 1.30386421440195, 'edge_cap': 0.678892379088205, 'bull_strategy': 'mean_reversion', 'bull_bb_std_mult': 3.0890564430915433, 'bull_rsi_os': 5, 'bull_rsi_ob': 58, 'bull_adx_thresh': 19.14618477428893, 'bull_atr_min_pct': 0.021319804299909057, 'bull_atr_max_pct': 0.14007461471317642, 'bull_tp_mult': 2.1959784962293045, 'bull_tsl_mult': 0.513714794594837, 'bull_time_stop': 178, 'bull_use_sma': True, 'bull_use_ema': False, 'bull_use_atr': True, 'bull_use_adx': True, 'bull_use_spike': True, 'bull_rsi_required': True, 'bear_strategy': 'breakout', 'bear_bb_std_mult': 1.26883979913482, 'bear_rsi_os': 30, 'bear_rsi_ob': 71, 'bear_adx_thresh': 16.168361728387502, 'bear_atr_min_pct': 0.0006633934234204575, 'bear_atr_max_pct': 0.13039354189826594, 'bear_tp_mult': 1.1615691937752977, 'bear_tsl_mult': 0.700421400213762, 'bear_time_stop': 210, 'bear_use_sma': False, 'bear_use_ema': True, 'bear_use_atr': False, 'bear_use_adx': False, 'bear_use_spike': True, 'bear_rsi_required': True, 'sideways_strategy': 'breakout', 'sideways_bb_std_mult': 1.7228358682260312, 'sideways_rsi_os': 29, 'sideways_rsi_ob': 55, 'sideways_adx_thresh': 25.606857970720004, 'sideways_atr_min_pct': 0.029480981417720993, 'sideways_atr_max_pct': 0.14981247229930553, 'sideways_tp_mult': 1.7840321025911248, 'sideways_tsl_mult': 0.5378403542077373, 'sideways_time_stop': 52, 'sideways_use_sma': False, 'sideways_use_ema': False, 'sideways_use_atr': True, 'sideways_use_adx': True, 'sideways_use_spike': False, 'sideways_rsi_required': True}.
[I 2025-08-31 13:36:00,740] Trial 777 finished with values: [-0.05936825434133497, 0.05878252045362179] and parameters: {'p_sma': 24, 'p_std': 34, 'p_atr': 23, 'p_adx': 13, 'rsi_period': 9, 'ema1': 12, 'ema2': 54, 'slip_atr_k': 0.043939217817832936, 'slip_spread_k': 0.41091384081124305, 'spread_hl_frac': 0.013539314566505086, 'bb_std_mult': 2.167001346956309, 'rsi_os': 40, 'rsi_ob': 68, 'vol_spike': 0.24843132339956786, 'adx_thresh': 5.742859248316572, 'atr_min_pct': 0.026522338079048653, 'atr_max_pct': 0.04381080756316033, 'tp_mult': 1.1048993946962038, 'tsl_mult': 0.6346892001313902, 'strategy': 'breakout', 'time_stop': 185, 'use_sma': True, 'use_atr': False, 'use_adx': True, 'use_ema': True, 'use_spike': True, 'rsi_required': False, 'edge_k': 0.07037890929354607, 'edge_cap': 0.6795511089657107, 'bull_strategy': 'mean_reversion', 'bull_bb_std_mult': 3.1074665362707465, 'bull_rsi_os': 7, 'bull_rsi_ob': 65, 'bull_adx_thresh': 19.23671502307055, 'bull_atr_min_pct': 0.020589384081244735, 'bull_atr_max_pct': 0.14364944608566507, 'bull_tp_mult': 2.3903984255614192, 'bull_tsl_mult': 0.2553737899684469, 'bull_time_stop': 29, 'bull_use_sma': True, 'bull_use_ema': False, 'bull_use_atr': True, 'bull_use_adx': True, 'bull_use_spike': True, 'bull_rsi_required': True, 'bear_strategy': 'breakout', 'bear_bb_std_mult': 1.5342200163898183, 'bear_rsi_os': 16, 'bear_rsi_ob': 67, 'bear_adx_thresh': 24.747679526510826, 'bear_atr_min_pct': 0.0006391887369209653, 'bear_atr_max_pct': 0.13009416547892366, 'bear_tp_mult': 2.3108332948094086, 'bear_tsl_mult': 0.7077833518346708, 'bear_time_stop': 209, 'bear_use_sma': False, 'bear_use_ema': True, 'bear_use_atr': False, 'bear_use_adx': False, 'bear_use_spike': True, 'bear_rsi_required': True, 'sideways_strategy': 'breakout', 'sideways_bb_std_mult': 2.6410907052433115, 'sideways_rsi_os': 29, 'sideways_rsi_ob': 65, 'sideways_adx_thresh': 29.7776238546177, 'sideways_atr_min_pct': 0.013848619822773193, 'sideways_atr_max_pct': 0.14990352310162233, 'sideways_tp_mult': 1.0504708367329134, 'sideways_tsl_mult': 0.4171656246307841, 'sideways_time_stop': 68, 'sideways_use_sma': False, 'sideways_use_ema': False, 'sideways_use_atr': True, 'sideways_use_adx': True, 'sideways_use_spike': False, 'sideways_rsi_required': True}.
[I 2025-08-31 13:36:01,542] Trial 778 finished with values: [-1000000000.0, 1000000000.0] and parameters: {'p_sma': 31, 'p_std': 21, 'p_atr': 10, 'p_adx': 23, 'rsi_period': 9, 'ema1': 23, 'ema2': 39, 'slip_atr_k': 0.22776919819677388, 'slip_spread_k': 0.4139221966627312, 'spread_hl_frac': 0.04016822641777695, 'bb_std_mult': 1.145318738531034, 'rsi_os': 8, 'rsi_ob': 68, 'vol_spike': 0.21437533262928518, 'adx_thresh': 5.899186044744647, 'atr_min_pct': 0.024570990177507558, 'atr_max_pct': 0.043521667992205755, 'tp_mult': 1.6703269378533085, 'tsl_mult': 0.43424272663513686, 'strategy': 'breakout', 'time_stop': 179, 'use_sma': False, 'use_atr': False, 'use_adx': True, 'use_ema': True, 'use_spike': True, 'rsi_required': False, 'edge_k': 1.5450357530950554, 'edge_cap': 0.7006781184651779, 'bull_strategy': 'mean_reversion', 'bull_bb_std_mult': 2.6566084936190433, 'bull_rsi_os': 7, 'bull_rsi_ob': 88, 'bull_adx_thresh': 17.825312109107372, 'bull_atr_min_pct': 0.02268337630216272, 'bull_atr_max_pct': 0.1430219178881039, 'bull_tp_mult': 2.3090235057745856, 'bull_tsl_mult': 0.2566110202597854, 'bull_time_stop': 157, 'bull_use_sma': True, 'bull_use_ema': False, 'bull_use_atr': True, 'bull_use_adx': True, 'bull_use_spike': True, 'bull_rsi_required': True, 'bear_strategy': 'breakout', 'bear_bb_std_mult': 3.5938816119789996, 'bear_rsi_os': 26, 'bear_rsi_ob': 52, 'bear_adx_thresh': 7.298403964676018, 'bear_atr_min_pct': 0.01561236376821385, 'bear_atr_max_pct': 0.1232334890093423, 'bear_tp_mult': 1.0120801786083204, 'bear_tsl_mult': 0.6960163425445746, 'bear_time_stop': 40, 'bear_use_sma': False, 'bear_use_ema': True, 'bear_use_atr': False, 'bear_use_adx': False, 'bear_use_spike': True, 'bear_rsi_required': True, 'sideways_strategy': 'breakout', 'sideways_bb_std_mult': 0.6678161607837443, 'sideways_rsi_os': 20, 'sideways_rsi_ob': 65, 'sideways_adx_thresh': 14.366152328559648, 'sideways_atr_min_pct': 0.017130023531767277, 'sideways_atr_max_pct': 0.14590316973078016, 'sideways_tp_mult': 2.4809956586138693, 'sideways_tsl_mult': 0.7764449023679625, 'sideways_time_stop': 11, 'sideways_use_sma': False, 'sideways_use_ema': False, 'sideways_use_atr': True, 'sideways_use_adx': True, 'sideways_use_spike': False, 'sideways_rsi_required': True}.
[I 2025-08-31 13:36:01,553] Trial 776 finished with values: [-0.04837043397808882, 0.04811504032994333] and parameters: {'p_sma': 39, 'p_std': 19, 'p_atr': 28, 'p_adx': 10, 'rsi_period': 56, 'ema1': 7, 'ema2': 33, 'slip_atr_k': 0.04378529847340836, 'slip_spread_k': 0.40689666177233125, 'spread_hl_frac': 0.03964672198755376, 'bb_std_mult': 2.1544949459426235, 'rsi_os': 35, 'rsi_ob': 89, 'vol_spike': 0.019911937955799777, 'adx_thresh': 6.683195581370024, 'atr_min_pct': 0.02642367579459919, 'atr_max_pct': 0.06238536450996879, 'tp_mult': 2.512483987861019, 'tsl_mult': 0.728586519124785, 'strategy': 'breakout', 'time_stop': 187, 'use_sma': False, 'use_atr': False, 'use_adx': True, 'use_ema': True, 'use_spike': True, 'rsi_required': False, 'edge_k': 0.4655980749399381, 'edge_cap': 0.3709101498599291, 'bull_strategy': 'mean_reversion', 'bull_bb_std_mult': 2.6667196314755364, 'bull_rsi_os': 7, 'bull_rsi_ob': 95, 'bull_adx_thresh': 17.787089333728968, 'bull_atr_min_pct': 0.020814523495103987, 'bull_atr_max_pct': 0.14265931939168022, 'bull_tp_mult': 2.3613454400050524, 'bull_tsl_mult': 0.9183027906837509, 'bull_time_stop': 179, 'bull_use_sma': True, 'bull_use_ema': False, 'bull_use_atr': True, 'bull_use_adx': True, 'bull_use_spike': True, 'bull_rsi_required': True, 'bear_strategy': 'breakout', 'bear_bb_std_mult': 0.8468675602487783, 'bear_rsi_os': 26, 'bear_rsi_ob': 74, 'bear_adx_thresh': 6.989576629551374, 'bear_atr_min_pct': 0.0005395375846307766, 'bear_atr_max_pct': 0.1240257703451666, 'bear_tp_mult': 1.163430661731974, 'bear_tsl_mult': 0.702209473736814, 'bear_time_stop': 209, 'bear_use_sma': False, 'bear_use_ema': True, 'bear_use_atr': False, 'bear_use_adx': False, 'bear_use_spike': True, 'bear_rsi_required': True, 'sideways_strategy': 'breakout', 'sideways_bb_std_mult': 0.6889599923565368, 'sideways_rsi_os': 52, 'sideways_rsi_ob': 65, 'sideways_adx_thresh': 34.356220511885255, 'sideways_atr_min_pct': 0.002276497695330648, 'sideways_atr_max_pct': 0.14674398970529134, 'sideways_tp_mult': 1.7743928822683939, 'sideways_tsl_mult': 0.5324921271909681, 'sideways_time_stop': 15, 'sideways_use_sma': False, 'sideways_use_ema': False, 'sideways_use_atr': True, 'sideways_use_adx': True, 'sideways_use_spike': False, 'sideways_rsi_required': True}.
[I 2025-08-31 13:36:01,639] Trial 775 finished with values: [-1000000000.0, 1000000000.0] and parameters: {'p_sma': 32, 'p_std': 21, 'p_atr': 23, 'p_adx': 14, 'rsi_period': 43, 'ema1': 12, 'ema2': 33, 'slip_atr_k': 0.042535229146837744, 'slip_spread_k': 0.40539781570194694, 'spread_hl_frac': 0.019330537690780678, 'bb_std_mult': 1.1527918793408032, 'rsi_os': 36, 'rsi_ob': 91, 'vol_spike': 0.021591299082606506, 'adx_thresh': 6.605595028502316, 'atr_min_pct': 0.026167050004624937, 'atr_max_pct': 0.06194151486113523, 'tp_mult': 2.508044488387799, 'tsl_mult': 0.6366098596807488, 'strategy': 'breakout', 'time_stop': 187, 'use_sma': False, 'use_atr': False, 'use_adx': True, 'use_ema': True, 'use_spike': True, 'rsi_required': False, 'edge_k': 0.056231447956804126, 'edge_cap': 0.6610269476941214, 'bull_strategy': 'mean_reversion', 'bull_bb_std_mult': 2.6796080529845394, 'bull_rsi_os': 5, 'bull_rsi_ob': 88, 'bull_adx_thresh': 19.16443916586968, 'bull_atr_min_pct': 0.022698793144888468, 'bull_atr_max_pct': 0.13871003312218527, 'bull_tp_mult': 2.3773021682501714, 'bull_tsl_mult': 0.28398002109560266, 'bull_time_stop': 179, 'bull_use_sma': True, 'bull_use_ema': False, 'bull_use_atr': True, 'bull_use_adx': True, 'bull_use_spike': True, 'bull_rsi_required': True, 'bear_strategy': 'breakout', 'bear_bb_std_mult': 3.5911401030574726, 'bear_rsi_os': 30, 'bear_rsi_ob': 66, 'bear_adx_thresh': 16.122148127922735, 'bear_atr_min_pct': 0.0006383275794024124, 'bear_atr_max_pct': 0.12446861113540973, 'bear_tp_mult': 1.1905220245520831, 'bear_tsl_mult': 0.6856044079578857, 'bear_time_stop': 209, 'bear_use_sma': False, 'bear_use_ema': True, 'bear_use_atr': False, 'bear_use_adx': False, 'bear_use_spike': True, 'bear_rsi_required': True, 'sideways_strategy': 'breakout', 'sideways_bb_std_mult': 2.7752668572397057, 'sideways_rsi_os': 29, 'sideways_rsi_ob': 65, 'sideways_adx_thresh': 25.45233691390796, 'sideways_atr_min_pct': 0.017208557311433885, 'sideways_atr_max_pct': 0.14991204499489505, 'sideways_tp_mult': 1.8015827794306272, 'sideways_tsl_mult': 0.8041786700667032, 'sideways_time_stop': 67, 'sideways_use_sma': False, 'sideways_use_ema': False, 'sideways_use_atr': True, 'sideways_use_adx': True, 'sideways_use_spike': False, 'sideways_rsi_required': True}.
[I 2025-08-31 13:36:35,805] Trial 781 finished with values: [-1000000000.0, 1000000000.0] and parameters: {'p_sma': 21, 'p_std': 22, 'p_atr': 7, 'p_adx': 14, 'rsi_period': 49, 'ema1': 26, 'ema2': 18, 'slip_atr_k': 0.013705819831430849, 'slip_spread_k': 0.44122309996873194, 'spread_hl_frac': 0.01626522361395975, 'bb_std_mult': 2.293778595003114, 'rsi_os': 11, 'rsi_ob': 71, 'vol_spike': 0.004305028714843732, 'adx_thresh': 14.302603608125363, 'atr_min_pct': 0.0244648008850933, 'atr_max_pct': 0.03363712390246183, 'tp_mult': 2.5492342110914223, 'tsl_mult': 0.21206399436613016, 'strategy': 'breakout', 'time_stop': 75, 'use_sma': False, 'use_atr': False, 'use_adx': True, 'use_ema': True, 'use_spike': True, 'rsi_required': False, 'edge_k': 0.6160645008648056, 'edge_cap': 0.23360659656322258, 'bull_strategy': 'mean_reversion', 'bull_bb_std_mult': 2.826532968408484, 'bull_rsi_os': 36, 'bull_rsi_ob': 89, 'bull_adx_thresh': 26.607560220683467, 'bull_atr_min_pct': 0.002509105342060962, 'bull_atr_max_pct': 0.13859381096351323, 'bull_tp_mult': 2.256982096401076, 'bull_tsl_mult': 0.2773747633858461, 'bull_time_stop': 159, 'bull_use_sma': True, 'bull_use_ema': True, 'bull_use_atr': True, 'bull_use_adx': True, 'bull_use_spike': True, 'bull_rsi_required': True, 'bear_strategy': 'breakout', 'bear_bb_std_mult': 2.851703878361572, 'bear_rsi_os': 20, 'bear_rsi_ob': 78, 'bear_adx_thresh': 28.25629326805948, 'bear_atr_min_pct': 1.4325197289521453e-06, 'bear_atr_max_pct': 0.12692461997196894, 'bear_tp_mult': 2.5911494894665577, 'bear_tsl_mult': 0.2681710300791902, 'bear_time_stop': 199, 'bear_use_sma': False, 'bear_use_ema': False, 'bear_use_atr': False, 'bear_use_adx': False, 'bear_use_spike': True, 'bear_rsi_required': False, 'sideways_strategy': 'breakout', 'sideways_bb_std_mult': 2.9265894634178147, 'sideways_rsi_os': 28, 'sideways_rsi_ob': 67, 'sideways_adx_thresh': 22.141216068526578, 'sideways_atr_min_pct': 0.0042097534773354005, 'sideways_atr_max_pct': 0.14988584228635493, 'sideways_tp_mult': 2.321747294536301, 'sideways_tsl_mult': 0.9252338577762007, 'sideways_time_stop': 33, 'sideways_use_sma': False, 'sideways_use_ema': False, 'sideways_use_atr': True, 'sideways_use_adx': True, 'sideways_use_spike': False, 'sideways_rsi_required': False}.
[I 2025-08-31 13:36:36,034] Trial 782 finished with values: [-1000000000.0, 1000000000.0] and parameters: {'p_sma': 33, 'p_std': 22, 'p_atr': 18, 'p_adx': 14, 'rsi_period': 49, 'ema1': 28, 'ema2': 19, 'slip_atr_k': 0.015557476670398737, 'slip_spread_k': 0.38046330693635616, 'spread_hl_frac': 0.047041106811813796, 'bb_std_mult': 2.566979481281306, 'rsi_os': 21, 'rsi_ob': 71, 'vol_spike': 0.0048052614215063905, 'adx_thresh': 9.491961353626962, 'atr_min_pct': 0.025525340331918833, 'atr_max_pct': 0.05516027151236683, 'tp_mult': 1.175891983835991, 'tsl_mult': 0.46245678563336023, 'strategy': 'breakout', 'time_stop': 51, 'use_sma': False, 'use_atr': False, 'use_adx': True, 'use_ema': False, 'use_spike': True, 'rsi_required': False, 'edge_k': 0.5985983805725752, 'edge_cap': 0.6216368201574387, 'bull_strategy': 'mean_reversion', 'bull_bb_std_mult': 2.7979197178916864, 'bull_rsi_os': 31, 'bull_rsi_ob': 93, 'bull_adx_thresh': 18.551566585665988, 'bull_atr_min_pct': 0.007889766964953674, 'bull_atr_max_pct': 0.14309026472728908, 'bull_tp_mult': 2.2860734550708943, 'bull_tsl_mult': 0.8674390723014118, 'bull_time_stop': 150, 'bull_use_sma': True, 'bull_use_ema': True, 'bull_use_atr': True, 'bull_use_adx': True, 'bull_use_spike': True, 'bull_rsi_required': True, 'bear_strategy': 'breakout', 'bear_bb_std_mult': 1.8350695397353225, 'bear_rsi_os': 15, 'bear_rsi_ob': 69, 'bear_adx_thresh': 23.23620475488456, 'bear_atr_min_pct': 0.0180173355479834, 'bear_atr_max_pct': 0.12765406243362107, 'bear_tp_mult': 1.074954949657487, 'bear_tsl_mult': 0.3667908644319186, 'bear_time_stop': 202, 'bear_use_sma': False, 'bear_use_ema': False, 'bear_use_atr': False, 'bear_use_adx': False, 'bear_use_spike': True, 'bear_rsi_required': False, 'sideways_strategy': 'breakout', 'sideways_bb_std_mult': 2.623057232748395, 'sideways_rsi_os': 31, 'sideways_rsi_ob': 67, 'sideways_adx_thresh': 24.413468752221696, 'sideways_atr_min_pct': 0.0041612317825216434, 'sideways_atr_max_pct': 0.14669712463194906, 'sideways_tp_mult': 2.6081927598677748, 'sideways_tsl_mult': 0.25921828375438727, 'sideways_time_stop': 264, 'sideways_use_sma': False, 'sideways_use_ema': False, 'sideways_use_atr': True, 'sideways_use_adx': True, 'sideways_use_spike': False, 'sideways_rsi_required': False}.
[I 2025-08-31 13:36:36,054] Trial 780 finished with values: [-1000000000.0, 1000000000.0] and parameters: {'p_sma': 29, 'p_std': 56, 'p_atr': 18, 'p_adx': 14, 'rsi_period': 49, 'ema1': 7, 'ema2': 18, 'slip_atr_k': 0.026385254623852453, 'slip_spread_k': 0.9302111096984323, 'spread_hl_frac': 0.04710103634782463, 'bb_std_mult': 2.55712845109872, 'rsi_os': 21, 'rsi_ob': 71, 'vol_spike': 0.1508127755759215, 'adx_thresh': 9.699609116056532, 'atr_min_pct': 0.025198347814305515, 'atr_max_pct': 0.033604468894943895, 'tp_mult': 2.5513239182513594, 'tsl_mult': 0.8855315417691098, 'strategy': 'breakout', 'time_stop': 164, 'use_sma': False, 'use_atr': False, 'use_adx': True, 'use_ema': True, 'use_spike': True, 'rsi_required': False, 'edge_k': 0.596908769274691, 'edge_cap': 0.6193938510174973, 'bull_strategy': 'mean_reversion', 'bull_bb_std_mult': 2.841017616531071, 'bull_rsi_os': 5, 'bull_rsi_ob': 83, 'bull_adx_thresh': 18.617570768296094, 'bull_atr_min_pct': 0.02265814114320096, 'bull_atr_max_pct': 0.1387648568507041, 'bull_tp_mult': 2.267867014256586, 'bull_tsl_mult': 0.27984834339872283, 'bull_time_stop': 162, 'bull_use_sma': True, 'bull_use_ema': True, 'bull_use_atr': True, 'bull_use_adx': True, 'bull_use_spike': True, 'bull_rsi_required': True, 'bear_strategy': 'breakout', 'bear_bb_std_mult': 3.4500726558564687, 'bear_rsi_os': 19, 'bear_rsi_ob': 78, 'bear_adx_thresh': 28.087762631049948, 'bear_atr_min_pct': 0.0010552798933078332, 'bear_atr_max_pct': 0.12572077564997458, 'bear_tp_mult': 2.6461249827326405, 'bear_tsl_mult': 0.8528682020148459, 'bear_time_stop': 202, 'bear_use_sma': False, 'bear_use_ema': False, 'bear_use_atr': False, 'bear_use_adx': False, 'bear_use_spike': True, 'bear_rsi_required': False, 'sideways_strategy': 'breakout', 'sideways_bb_std_mult': 2.929465778415667, 'sideways_rsi_os': 28, 'sideways_rsi_ob': 67, 'sideways_adx_thresh': 22.144807167317605, 'sideways_atr_min_pct': 0.004354921337922813, 'sideways_atr_max_pct': 0.1469115536568728, 'sideways_tp_mult': 1.7373923771310171, 'sideways_tsl_mult': 0.9239901048185922, 'sideways_time_stop': 19, 'sideways_use_sma': False, 'sideways_use_ema': False, 'sideways_use_atr': True, 'sideways_use_adx': True, 'sideways_use_spike': False, 'sideways_rsi_required': False}.
[I 2025-08-31 13:36:36,166] Trial 779 finished with values: [-0.028670482673244457, 0.0284295958221917] and parameters: {'p_sma': 31, 'p_std': 22, 'p_atr': 10, 'p_adx': 14, 'rsi_period': 49, 'ema1': 25, 'ema2': 19, 'slip_atr_k': 0.19843761694058415, 'slip_spread_k': 0.18058673110211337, 'spread_hl_frac': 0.01629356332019107, 'bb_std_mult': 2.7910330706437434, 'rsi_os': 50, 'rsi_ob': 65, 'vol_spike': 0.21579676613065657, 'adx_thresh': 9.531537461679283, 'atr_min_pct': 0.02423773861286112, 'atr_max_pct': 0.06270829149312952, 'tp_mult': 2.1268616936526326, 'tsl_mult': 0.8835788491007607, 'strategy': 'breakout', 'time_stop': 180, 'use_sma': False, 'use_atr': False, 'use_adx': True, 'use_ema': True, 'use_spike': True, 'rsi_required': False, 'edge_k': 0.17444887150392374, 'edge_cap': 0.7054903551217319, 'bull_strategy': 'mean_reversion', 'bull_bb_std_mult': 2.508112214377892, 'bull_rsi_os': 6, 'bull_rsi_ob': 94, 'bull_adx_thresh': 17.81330498637576, 'bull_atr_min_pct': 0.007370728907575089, 'bull_atr_max_pct': 0.14358400715812306, 'bull_tp_mult': 2.352479952267269, 'bull_tsl_mult': 0.8667902786778104, 'bull_time_stop': 182, 'bull_use_sma': True, 'bull_use_ema': True, 'bull_use_atr': True, 'bull_use_adx': True, 'bull_use_spike': True, 'bull_rsi_required': True, 'bear_strategy': 'breakout', 'bear_bb_std_mult': 1.7887233602517874, 'bear_rsi_os': 21, 'bear_rsi_ob': 78, 'bear_adx_thresh': 5.002007680056369, 'bear_atr_min_pct': 0.014522781674799989, 'bear_atr_max_pct': 0.12347811677059323, 'bear_tp_mult': 1.2615147746203712, 'bear_tsl_mult': 0.6942014409675079, 'bear_time_stop': 204, 'bear_use_sma': False, 'bear_use_ema': True, 'bear_use_atr': False, 'bear_use_adx': False, 'bear_use_spike': True, 'bear_rsi_required': True, 'sideways_strategy': 'breakout', 'sideways_bb_std_mult': 2.892950075413154, 'sideways_rsi_os': 47, 'sideways_rsi_ob': 67, 'sideways_adx_thresh': 22.356029959170986, 'sideways_atr_min_pct': 0.0041787701872599455, 'sideways_atr_max_pct': 0.146224193317366, 'sideways_tp_mult': 2.3303305346852787, 'sideways_tsl_mult': 0.7732936921464246, 'sideways_time_stop': 16, 'sideways_use_sma': False, 'sideways_use_ema': False, 'sideways_use_atr': True, 'sideways_use_adx': True, 'sideways_use_spike': False, 'sideways_rsi_required': True}.
