[I 2025-08-31 12:19:30,094] Trial 208 finished with values: [-0.04602243082203983, 0.04577179349800502] and parameters: {'p_sma': 34, 'p_std': 19, 'p_atr': 12, 'p_adx': 15, 'rsi_period': 76, 'ema1': 11, 'ema2': 38, 'slip_atr_k': 0.09392664485228071, 'slip_spread_k': 0.08981074381625598, 'spread_hl_frac': 0.04080018379212626, 'bb_std_mult': 0.8125486976357656, 'rsi_os': 42, 'rsi_ob': 78, 'vol_spike': 0.2506689671500096, 'adx_thresh': 24.73572282711592, 'atr_min_pct': 0.012849390021862528, 'atr_max_pct': 0.14557958350974237, 'tp_mult': 2.960364337700627, 'tsl_mult': 0.4804428371188918, 'strategy': 'mean_reversion', 'time_stop': 90, 'use_sma': True, 'use_atr': False, 'use_adx': True, 'use_ema': False, 'use_spike': False, 'rsi_required': False, 'edge_k': 1.0873947145922982, 'edge_cap': 0.3083561565736945, 'bull_strategy': 'mean_reversion', 'bull_bb_std_mult': 1.007768576789645, 'bull_rsi_os': 12, 'bull_rsi_ob': 94, 'bull_adx_thresh': 22.072212598895653, 'bull_atr_min_pct': 0.022493291163682913, 'bull_atr_max_pct': 0.07300915402117207, 'bull_tp_mult': 1.9754871995463155, 'bull_tsl_mult': 0.8038884346039092, 'bull_time_stop': 79, 'bull_use_sma': False, 'bull_use_ema': False, 'bull_use_atr': False, 'bull_use_adx': True, 'bull_use_spike': False, 'bull_rsi_required': False, 'bear_strategy': 'mean_reversion', 'bear_bb_std_mult': 1.5694620488055533, 'bear_rsi_os': 24, 'bear_rsi_ob': 60, 'bear_adx_thresh': 8.280576543567777, 'bear_atr_min_pct': 0.028087179261126395, 'bear_atr_max_pct': 0.09628316786907322, 'bear_tp_mult': 2.0624040318975587, 'bear_tsl_mult': 0.05137999801217921, 'bear_time_stop': 264, 'bear_use_sma': True, 'bear_use_ema': False, 'bear_use_atr': True, 'bear_use_adx': True, 'bear_use_spike': True, 'bear_rsi_required': False, 'sideways_strategy': 'breakout', 'sideways_bb_std_mult': 2.0701367880557218, 'sideways_rsi_os': 42, 'sideways_rsi_ob': 48, 'sideways_adx_thresh': 10.50362968429398, 'sideways_atr_min_pct': 0.0019991974696035838, 'sideways_atr_max_pct': 0.0307374272568664, 'sideways_tp_mult': 1.0771633435026513, 'sideways_tsl_mult': 0.40278528989128803, 'sideways_time_stop': 58, 'sideways_use_sma': False, 'sideways_use_ema': True, 'sideways_use_atr': False, 'sideways_use_adx': False, 'sideways_use_spike': False, 'sideways_rsi_required': True}.
[I 2025-08-31 12:19:30,334] Trial 205 finished with values: [-1000000000.0, 1000000000.0] and parameters: {'p_sma': 33, 'p_std': 19, 'p_atr': 10, 'p_adx': 15, 'rsi_period': 76, 'ema1': 6, 'ema2': 37, 'slip_atr_k': 0.09443330149216254, 'slip_spread_k': 0.11087187958978215, 'spread_hl_frac': 0.027935694959578816, 'bb_std_mult': 2.271070931442152, 'rsi_os': 42, 'rsi_ob': 58, 'vol_spike': 0.2594443409937139, 'adx_thresh': 18.513878204356033, 'atr_min_pct': 0.0017288468475880597, 'atr_max_pct': 0.07838754418514401, 'tp_mult': 1.7155001343358451, 'tsl_mult': 0.4195304703419782, 'strategy': 'mean_reversion', 'time_stop': 94, 'use_sma': True, 'use_atr': False, 'use_adx': False, 'use_ema': False, 'use_spike': True, 'rsi_required': True, 'edge_k': 1.0728253482211731, 'edge_cap': 0.914352917954735, 'bull_strategy': 'breakout', 'bull_bb_std_mult': 2.4215576486461896, 'bull_rsi_os': 28, 'bull_rsi_ob': 76, 'bull_adx_thresh': 19.01828537526304, 'bull_atr_min_pct': 0.022724278391405728, 'bull_atr_max_pct': 0.053676299745829006, 'bull_tp_mult': 1.1114619171178992, 'bull_tsl_mult': 0.2996161954988529, 'bull_time_stop': 76, 'bull_use_sma': True, 'bull_use_ema': True, 'bull_use_atr': True, 'bull_use_adx': True, 'bull_use_spike': True, 'bull_rsi_required': True, 'bear_strategy': 'mean_reversion', 'bear_bb_std_mult': 1.5708200515347548, 'bear_rsi_os': 22, 'bear_rsi_ob': 60, 'bear_adx_thresh': 32.67864398525268, 'bear_atr_min_pct': 0.02802579208901442, 'bear_atr_max_pct': 0.10359906751798076, 'bear_tp_mult': 1.3695509527681229, 'bear_tsl_mult': 0.0013717625350672669, 'bear_time_stop': 219, 'bear_use_sma': False, 'bear_use_ema': False, 'bear_use_atr': False, 'bear_use_adx': False, 'bear_use_spike': False, 'bear_rsi_required': False, 'sideways_strategy': 'breakout', 'sideways_bb_std_mult': 2.162029679234119, 'sideways_rsi_os': 36, 'sideways_rsi_ob': 48, 'sideways_adx_thresh': 10.574498583829063, 'sideways_atr_min_pct': 0.01355725214697456, 'sideways_atr_max_pct': 0.06182651475569618, 'sideways_tp_mult': 1.36329914766894, 'sideways_tsl_mult': 0.3963997035488671, 'sideways_time_stop': 191, 'sideways_use_sma': True, 'sideways_use_ema': True, 'sideways_use_atr': True, 'sideways_use_adx': True, 'sideways_use_spike': False, 'sideways_rsi_required': True}.
[I 2025-08-31 12:20:04,300] Trial 212 finished with values: [-1000000000.0, 1000000000.0] and parameters: {'p_sma': 36, 'p_std': 51, 'p_atr': 16, 'p_adx': 14, 'rsi_period': 43, 'ema1': 8, 'ema2': 36, 'slip_atr_k': 0.08659667919747428, 'slip_spread_k': 0.16261645581988604, 'spread_hl_frac': 0.02560970580719398, 'bb_std_mult': 1.1338391155722907, 'rsi_os': 46, 'rsi_ob': 80, 'vol_spike': 0.19489487662005064, 'adx_thresh': 21.740601121384124, 'atr_min_pct': 0.026838362234231992, 'atr_max_pct': 0.0961814715791337, 'tp_mult': 2.646574950952899, 'tsl_mult': 0.4544020083661265, 'strategy': 'mean_reversion', 'time_stop': 23, 'use_sma': False, 'use_atr': False, 'use_adx': True, 'use_ema': True, 'use_spike': True, 'rsi_required': False, 'edge_k': 1.261193396425159, 'edge_cap': 0.2747570185994111, 'bull_strategy': 'mean_reversion', 'bull_bb_std_mult': 3.4101988212475463, 'bull_rsi_os': 6, 'bull_rsi_ob': 66, 'bull_adx_thresh': 9.291340202757034, 'bull_atr_min_pct': 0.027317388362598595, 'bull_atr_max_pct': 0.06069163898042612, 'bull_tp_mult': 2.76244628723165, 'bull_tsl_mult': 0.27532259031825923, 'bull_time_stop': 117, 'bull_use_sma': False, 'bull_use_ema': False, 'bull_use_atr': False, 'bull_use_adx': False, 'bull_use_spike': False, 'bull_rsi_required': True, 'bear_strategy': 'breakout', 'bear_bb_std_mult': 1.0931342423203867, 'bear_rsi_os': 44, 'bear_rsi_ob': 53, 'bear_adx_thresh': 20.87405528125368, 'bear_atr_min_pct': 0.02293214666811002, 'bear_atr_max_pct': 0.02877441759973779, 'bear_tp_mult': 1.7856211017183938, 'bear_tsl_mult': 0.2995034158714901, 'bear_time_stop': 11, 'bear_use_sma': True, 'bear_use_ema': False, 'bear_use_atr': True, 'bear_use_adx': True, 'bear_use_spike': True, 'bear_rsi_required': True, 'sideways_strategy': 'mean_reversion', 'sideways_bb_std_mult': 3.046850231824604, 'sideways_rsi_os': 51, 'sideways_rsi_ob': 91, 'sideways_adx_thresh': 16.600270459255846, 'sideways_atr_min_pct': 0.0052757611958459474, 'sideways_atr_max_pct': 0.06876730229070438, 'sideways_tp_mult': 1.4343531403622742, 'sideways_tsl_mult': 0.48633371894775645, 'sideways_time_stop': 158, 'sideways_use_sma': False, 'sideways_use_ema': True, 'sideways_use_atr': False, 'sideways_use_adx': False, 'sideways_use_spike': True, 'sideways_rsi_required': False}.
[I 2025-08-31 12:20:04,492] Trial 209 finished with values: [-1000000000.0, 1000000000.0] and parameters: {'p_sma': 19, 'p_std': 16, 'p_atr': 16, 'p_adx': 14, 'rsi_period': 22, 'ema1': 11, 'ema2': 37, 'slip_atr_k': 0.09263054666476483, 'slip_spread_k': 0.36139880078894887, 'spread_hl_frac': 0.02765707473688583, 'bb_std_mult': 0.8253000179541252, 'rsi_os': 43, 'rsi_ob': 71, 'vol_spike': 0.2519017683346351, 'adx_thresh': 21.537416162852526, 'atr_min_pct': 0.029942656534878462, 'atr_max_pct': 0.07840932120229356, 'tp_mult': 2.6034557244660808, 'tsl_mult': 0.45348213300675766, 'strategy': 'mean_reversion', 'time_stop': 215, 'use_sma': True, 'use_atr': False, 'use_adx': True, 'use_ema': True, 'use_spike': True, 'rsi_required': False, 'edge_k': 0.1781421343650429, 'edge_cap': 0.2961952983565695, 'bull_strategy': 'mean_reversion', 'bull_bb_std_mult': 1.8569707840939391, 'bull_rsi_os': 5, 'bull_rsi_ob': 79, 'bull_adx_thresh': 6.417125198595188, 'bull_atr_min_pct': 0.027570281939164294, 'bull_atr_max_pct': 0.010283378551191921, 'bull_tp_mult': 2.7683748630567866, 'bull_tsl_mult': 0.40666429695760725, 'bull_time_stop': 176, 'bull_use_sma': False, 'bull_use_ema': False, 'bull_use_atr': False, 'bull_use_adx': True, 'bull_use_spike': False, 'bull_rsi_required': True, 'bear_strategy': 'mean_reversion', 'bear_bb_std_mult': 1.836027221367265, 'bear_rsi_os': 24, 'bear_rsi_ob': 53, 'bear_adx_thresh': 32.75762957021842, 'bear_atr_min_pct': 0.028078649357482208, 'bear_atr_max_pct': 0.0965021163954497, 'bear_tp_mult': 1.3599518679824354, 'bear_tsl_mult': 0.4013584196414871, 'bear_time_stop': 238, 'bear_use_sma': True, 'bear_use_ema': False, 'bear_use_atr': True, 'bear_use_adx': True, 'bear_use_spike': True, 'bear_rsi_required': False, 'sideways_strategy': 'breakout', 'sideways_bb_std_mult': 2.039099205098504, 'sideways_rsi_os': 51, 'sideways_rsi_ob': 62, 'sideways_adx_thresh': 9.534290379236516, 'sideways_atr_min_pct': 0.008226652672585204, 'sideways_atr_max_pct': 0.07718100403076454, 'sideways_tp_mult': 1.8298851296319174, 'sideways_tsl_mult': 0.40144778477127263, 'sideways_time_stop': 112, 'sideways_use_sma': True, 'sideways_use_ema': True, 'sideways_use_atr': False, 'sideways_use_adx': False, 'sideways_use_spike': False, 'sideways_rsi_required': True}.
[I 2025-08-31 12:20:04,509] Trial 210 finished with values: [-1000000000.0, 1000000000.0] and parameters: {'p_sma': 34, 'p_std': 19, 'p_atr': 16, 'p_adx': 14, 'rsi_period': 43, 'ema1': 11, 'ema2': 41, 'slip_atr_k': 0.0953754424788279, 'slip_spread_k': 0.1627266208946445, 'spread_hl_frac': 0.02756414705878475, 'bb_std_mult': 2.344914665730138, 'rsi_os': 43, 'rsi_ob': 59, 'vol_spike': 0.2376395116864503, 'adx_thresh': 21.467740476727293, 'atr_min_pct': 0.020838509487762655, 'atr_max_pct': 0.06905355377013836, 'tp_mult': 2.3322836509966303, 'tsl_mult': 0.45943211914372073, 'strategy': 'mean_reversion', 'time_stop': 79, 'use_sma': False, 'use_atr': False, 'use_adx': True, 'use_ema': True, 'use_spike': True, 'rsi_required': False, 'edge_k': 0.14947251608376466, 'edge_cap': 0.30131923071055255, 'bull_strategy': 'mean_reversion', 'bull_bb_std_mult': 0.9962359142352195, 'bull_rsi_os': 12, 'bull_rsi_ob': 94, 'bull_adx_thresh': 8.988759996139422, 'bull_atr_min_pct': 0.02783142640099457, 'bull_atr_max_pct': 0.0731306212155335, 'bull_tp_mult': 1.5102939555573691, 'bull_tsl_mult': 0.03429003468142494, 'bull_time_stop': 20, 'bull_use_sma': False, 'bull_use_ema': False, 'bull_use_atr': False, 'bull_use_adx': False, 'bull_use_spike': False, 'bull_rsi_required': True, 'bear_strategy': 'breakout', 'bear_bb_std_mult': 1.5822857303382152, 'bear_rsi_os': 23, 'bear_rsi_ob': 54, 'bear_adx_thresh': 8.351364917761218, 'bear_atr_min_pct': 0.02796064658953798, 'bear_atr_max_pct': 0.0713398850593983, 'bear_tp_mult': 2.0572123657347556, 'bear_tsl_mult': 0.059051711472840385, 'bear_time_stop': 240, 'bear_use_sma': True, 'bear_use_ema': False, 'bear_use_atr': True, 'bear_use_adx': True, 'bear_use_spike': True, 'bear_rsi_required': True, 'sideways_strategy': 'mean_reversion', 'sideways_bb_std_mult': 1.1164816173938847, 'sideways_rsi_os': 42, 'sideways_rsi_ob': 82, 'sideways_adx_thresh': 18.351934020243892, 'sideways_atr_min_pct': 0.006725297185828228, 'sideways_atr_max_pct': 0.07767527384439465, 'sideways_tp_mult': 1.065951993075657, 'sideways_tsl_mult': 0.4795489307930986, 'sideways_time_stop': 57, 'sideways_use_sma': False, 'sideways_use_ema': True, 'sideways_use_atr': False, 'sideways_use_adx': False, 'sideways_use_spike': True, 'sideways_rsi_required': False}.
[I 2025-08-31 12:20:04,579] Trial 211 finished with values: [-1000000000.0, 1000000000.0] and parameters: {'p_sma': 36, 'p_std': 16, 'p_atr': 21, 'p_adx': 14, 'rsi_period': 73, 'ema1': 29, 'ema2': 37, 'slip_atr_k': 0.08528557323277533, 'slip_spread_k': 0.1933865826844845, 'spread_hl_frac': 0.02786649572573935, 'bb_std_mult': 3.528351845083833, 'rsi_os': 46, 'rsi_ob': 58, 'vol_spike': 0.2383828037135786, 'adx_thresh': 16.334880318173333, 'atr_min_pct': 0.02688563740267505, 'atr_max_pct': 0.06763855511269021, 'tp_mult': 2.329016773993119, 'tsl_mult': 0.70397908092949, 'strategy': 'mean_reversion', 'time_stop': 77, 'use_sma': False, 'use_atr': False, 'use_adx': True, 'use_ema': True, 'use_spike': True, 'rsi_required': False, 'edge_k': 0.18793259895882541, 'edge_cap': 0.2748568675965497, 'bull_strategy': 'mean_reversion', 'bull_bb_std_mult': 3.394832854166747, 'bull_rsi_os': 29, 'bull_rsi_ob': 92, 'bull_adx_thresh': 10.201938865592762, 'bull_atr_min_pct': 0.02737814606303788, 'bull_atr_max_pct': 0.05978257829101775, 'bull_tp_mult': 1.5899034636049905, 'bull_tsl_mult': 0.18217584455095637, 'bull_time_stop': 21, 'bull_use_sma': False, 'bull_use_ema': False, 'bull_use_atr': False, 'bull_use_adx': False, 'bull_use_spike': False, 'bull_rsi_required': True, 'bear_strategy': 'breakout', 'bear_bb_std_mult': 1.8444062508214731, 'bear_rsi_os': 22, 'bear_rsi_ob': 63, 'bear_adx_thresh': 32.62910571675637, 'bear_atr_min_pct': 0.006134340661243364, 'bear_atr_max_pct': 0.09034698982474804, 'bear_tp_mult': 1.9941152891243015, 'bear_tsl_mult': 0.018785117271155727, 'bear_time_stop': 239, 'bear_use_sma': False, 'bear_use_ema': False, 'bear_use_atr': False, 'bear_use_adx': False, 'bear_use_spike': False, 'bear_rsi_required': True, 'sideways_strategy': 'mean_reversion', 'sideways_bb_std_mult': 2.832661271204545, 'sideways_rsi_os': 29, 'sideways_rsi_ob': 87, 'sideways_adx_thresh': 15.999133764866773, 'sideways_atr_min_pct': 0.0008787114145088579, 'sideways_atr_max_pct': 0.07727484180313994, 'sideways_tp_mult': 1.238994832666532, 'sideways_tsl_mult': 0.4859225619658564, 'sideways_time_stop': 5, 'sideways_use_sma': False, 'sideways_use_ema': True, 'sideways_use_atr': True, 'sideways_use_adx': False, 'sideways_use_spike': True, 'sideways_rsi_required': False}.
[I 2025-08-31 12:20:05,095] Trial 214 finished with values: [-1000000000.0, 1000000000.0] and parameters: {'p_sma': 32, 'p_std': 27, 'p_atr': 15, 'p_adx': 11, 'rsi_period': 73, 'ema1': 6, 'ema2': 35, 'slip_atr_k': 0.17308626586491746, 'slip_spread_k': 0.1921199618379222, 'spread_hl_frac': 0.024775819532230296, 'bb_std_mult': 1.035109244178205, 'rsi_os': 55, 'rsi_ob': 63, 'vol_spike': 0.05490960809214353, 'adx_thresh': 16.267416386462752, 'atr_min_pct': 0.027738638429635032, 'atr_max_pct': 0.075960761345936, 'tp_mult': 1.475706332994949, 'tsl_mult': 0.9758131204676006, 'strategy': 'mean_reversion', 'time_stop': 106, 'use_sma': True, 'use_atr': True, 'use_adx': True, 'use_ema': False, 'use_spike': True, 'rsi_required': False, 'edge_k': 1.2165791375700055, 'edge_cap': 0.24910380462273568, 'bull_strategy': 'mean_reversion', 'bull_bb_std_mult': 3.245445934864856, 'bull_rsi_os': 15, 'bull_rsi_ob': 48, 'bull_adx_thresh': 7.310103461771641, 'bull_atr_min_pct': 0.02589544871373968, 'bull_atr_max_pct': 0.04556670213654675, 'bull_tp_mult': 2.5945885380815428, 'bull_tsl_mult': 0.3227129227272578, 'bull_time_stop': 85, 'bull_use_sma': False, 'bull_use_ema': False, 'bull_use_atr': False, 'bull_use_adx': True, 'bull_use_spike': True, 'bull_rsi_required': False, 'bear_strategy': 'mean_reversion', 'bear_bb_std_mult': 1.5202939434519902, 'bear_rsi_os': 41, 'bear_rsi_ob': 63, 'bear_adx_thresh': 28.22564384056267, 'bear_atr_min_pct': 0.02895479678333777, 'bear_atr_max_pct': 0.07586431495379545, 'bear_tp_mult': 2.4489847304604617, 'bear_tsl_mult': 0.2945772239906278, 'bear_time_stop': 187, 'bear_use_sma': False, 'bear_use_ema': True, 'bear_use_atr': False, 'bear_use_adx': False, 'bear_use_spike': False, 'bear_rsi_required': False, 'sideways_strategy': 'breakout', 'sideways_bb_std_mult': 1.2056251957220714, 'sideways_rsi_os': 29, 'sideways_rsi_ob': 49, 'sideways_adx_thresh': 22.449010025571564, 'sideways_atr_min_pct': 0.0010991859274593289, 'sideways_atr_max_pct': 0.06555801869095026, 'sideways_tp_mult': 2.2907642959102423, 'sideways_tsl_mult': 0.1629199272333648, 'sideways_time_stop': 80, 'sideways_use_sma': False, 'sideways_use_ema': False, 'sideways_use_atr': True, 'sideways_use_adx': True, 'sideways_use_spike': False, 'sideways_rsi_required': True}.
[I 2025-08-31 12:20:36,992] Trial 216 finished with values: [-1000000000.0, 1000000000.0] and parameters: {'p_sma': 15, 'p_std': 54, 'p_atr': 15, 'p_adx': 13, 'rsi_period': 12, 'ema1': 6, 'ema2': 26, 'slip_atr_k': 0.055095134852153574, 'slip_spread_k': 0.7436753053947207, 'spread_hl_frac': 0.025033739809839677, 'bb_std_mult': 1.0430960262951783, 'rsi_os': 44, 'rsi_ob': 63, 'vol_spike': 0.2564028881110844, 'adx_thresh': 22.613527968434507, 'atr_min_pct': 0.015553795212830407, 'atr_max_pct': 0.08228245977591403, 'tp_mult': 2.5988024279898116, 'tsl_mult': 0.745832588565985, 'strategy': 'breakout', 'time_stop': 103, 'use_sma': True, 'use_atr': True, 'use_adx': True, 'use_ema': False, 'use_spike': True, 'rsi_required': False, 'edge_k': 1.2212066268938073, 'edge_cap': 0.2413800009724007, 'bull_strategy': 'mean_reversion', 'bull_bb_std_mult': 1.977141777525101, 'bull_rsi_os': 23, 'bull_rsi_ob': 48, 'bull_adx_thresh': 13.798395077108598, 'bull_atr_min_pct': 0.025764178968987566, 'bull_atr_max_pct': 0.04335901288174576, 'bull_tp_mult': 1.7105962793754939, 'bull_tsl_mult': 0.10685020694845115, 'bull_time_stop': 49, 'bull_use_sma': False, 'bull_use_ema': False, 'bull_use_atr': False, 'bull_use_adx': True, 'bull_use_spike': True, 'bull_rsi_required': False, 'bear_strategy': 'mean_reversion', 'bear_bb_std_mult': 1.4964064740835927, 'bear_rsi_os': 35, 'bear_rsi_ob': 62, 'bear_adx_thresh': 33.77083458776339, 'bear_atr_min_pct': 0.004612503824497523, 'bear_atr_max_pct': 0.1221221751937411, 'bear_tp_mult': 2.861144763710869, 'bear_tsl_mult': 0.4461486526952694, 'bear_time_stop': 260, 'bear_use_sma': False, 'bear_use_ema': True, 'bear_use_atr': False, 'bear_use_adx': False, 'bear_use_spike': True, 'bear_rsi_required': False, 'sideways_strategy': 'breakout', 'sideways_bb_std_mult': 1.273758891974671, 'sideways_rsi_os': 37, 'sideways_rsi_ob': 70, 'sideways_adx_thresh': 22.271759740871676, 'sideways_atr_min_pct': 0.011843519098954569, 'sideways_atr_max_pct': 0.06534500134436322, 'sideways_tp_mult': 2.2881779679356002, 'sideways_tsl_mult': 0.6385751864954916, 'sideways_time_stop': 177, 'sideways_use_sma': False, 'sideways_use_ema': False, 'sideways_use_atr': True, 'sideways_use_adx': True, 'sideways_use_spike': False, 'sideways_rsi_required': True}.
[I 2025-08-31 12:20:37,691] Trial 215 finished with values: [-1000000000.0, 1000000000.0] and parameters: {'p_sma': 12, 'p_std': 27, 'p_atr': 15, 'p_adx': 22, 'rsi_period': 63, 'ema1': 25, 'ema2': 25, 'slip_atr_k': 0.013813867202383687, 'slip_spread_k': 0.3241545008971372, 'spread_hl_frac': 0.004023097364557894, 'bb_std_mult': 1.0321445527141935, 'rsi_os': 40, 'rsi_ob': 63, 'vol_spike': 0.048107212128201376, 'adx_thresh': 22.572132804943912, 'atr_min_pct': 0.0032752931518203084, 'atr_max_pct': 0.08597023859546898, 'tp_mult': 2.253293998189124, 'tsl_mult': 0.10276299687505935, 'strategy': 'breakout', 'time_stop': 105, 'use_sma': True, 'use_atr': True, 'use_adx': True, 'use_ema': False, 'use_spike': True, 'rsi_required': False, 'edge_k': 1.2077247444802952, 'edge_cap': 0.23638611765343429, 'bull_strategy': 'mean_reversion', 'bull_bb_std_mult': 3.255932300166543, 'bull_rsi_os': 11, 'bull_rsi_ob': 51, 'bull_adx_thresh': 30.112313169460755, 'bull_atr_min_pct': 0.02582969630358603, 'bull_atr_max_pct': 0.04755618728351087, 'bull_tp_mult': 2.593913889538937, 'bull_tsl_mult': 0.3723358084556373, 'bull_time_stop': 48, 'bull_use_sma': False, 'bull_use_ema': False, 'bull_use_atr': False, 'bull_use_adx': True, 'bull_use_spike': True, 'bull_rsi_required': False, 'bear_strategy': 'mean_reversion', 'bear_bb_std_mult': 1.487297651651645, 'bear_rsi_os': 41, 'bear_rsi_ob': 79, 'bear_adx_thresh': 33.85082225552178, 'bear_atr_min_pct': 0.009985069148102767, 'bear_atr_max_pct': 0.12211605697825775, 'bear_tp_mult': 2.4517366809175423, 'bear_tsl_mult': 0.1683303417158339, 'bear_time_stop': 269, 'bear_use_sma': False, 'bear_use_ema': True, 'bear_use_atr': False, 'bear_use_adx': False, 'bear_use_spike': True, 'bear_rsi_required': False, 'sideways_strategy': 'breakout', 'sideways_bb_std_mult': 1.2934388914263795, 'sideways_rsi_os': 37, 'sideways_rsi_ob': 93, 'sideways_adx_thresh': 9.410850212763842, 'sideways_atr_min_pct': 0.010278312714712223, 'sideways_atr_max_pct': 0.06582538576568156, 'sideways_tp_mult': 1.9327991804356335, 'sideways_tsl_mult': 0.6074475665482448, 'sideways_time_stop': 178, 'sideways_use_sma': False, 'sideways_use_ema': False, 'sideways_use_atr': True, 'sideways_use_adx': True, 'sideways_use_spike': False, 'sideways_rsi_required': True}.
