[I 2025-08-31 12:18:19,481] Trial 199 finished with values: [-1000000000.0, 1000000000.0] and parameters: {'p_sma': 50, 'p_std': 31, 'p_atr': 11, 'p_adx': 19, 'rsi_period': 78, 'ema1': 5, 'ema2': 39, 'slip_atr_k': 0.2079433174634781, 'slip_spread_k': 0.14074135753887196, 'spread_hl_frac': 0.04781684776574272, 'bb_std_mult': 0.9243834402178228, 'rsi_os': 17, 'rsi_ob': 49, 'vol_spike': 0.14516909272398978, 'adx_thresh': 10.08161655370893, 'atr_min_pct': 0.0007722454612491252, 'atr_max_pct': 0.07287560883569952, 'tp_mult': 1.627968487699709, 'tsl_mult': 0.0800837814503853, 'strategy': 'breakout', 'time_stop': 100, 'use_sma': True, 'use_atr': False, 'use_adx': True, 'use_ema': False, 'use_spike': True, 'rsi_required': False, 'edge_k': 1.603690641393308, 'edge_cap': 0.5971596805959949, 'bull_strategy': 'mean_reversion', 'bull_bb_std_mult': 1.6328199290938608, 'bull_rsi_os': 13, 'bull_rsi_ob': 90, 'bull_adx_thresh': 11.092612074620348, 'bull_atr_min_pct': 0.014144050290692654, 'bull_atr_max_pct': 0.08571659077189467, 'bull_tp_mult': 2.72505121453222, 'bull_tsl_mult': 0.07175724611408202, 'bull_time_stop': 55, 'bull_use_sma': False, 'bull_use_ema': False, 'bull_use_atr': False, 'bull_use_adx': True, 'bull_use_spike': False, 'bull_rsi_required': True, 'bear_strategy': 'mean_reversion', 'bear_bb_std_mult': 1.6633855553552872, 'bear_rsi_os': 16, 'bear_rsi_ob': 85, 'bear_adx_thresh': 25.838714076857293, 'bear_atr_min_pct': 0.02927498835685272, 'bear_atr_max_pct': 0.09977014264453408, 'bear_tp_mult': 1.852888157960118, 'bear_tsl_mult': 0.9250457649531392, 'bear_time_stop': 116, 'bear_use_sma': False, 'bear_use_ema': False, 'bear_use_atr': False, 'bear_use_adx': False, 'bear_use_spike': True, 'bear_rsi_required': False, 'sideways_strategy': 'breakout', 'sideways_bb_std_mult': 1.5400736929441774, 'sideways_rsi_os': 24, 'sideways_rsi_ob': 46, 'sideways_adx_thresh': 11.932690100014298, 'sideways_atr_min_pct': 0.002031245713998468, 'sideways_atr_max_pct': 0.07091854097974656, 'sideways_tp_mult': 1.3249949158471563, 'sideways_tsl_mult': 0.43238857197453456, 'sideways_time_stop': 182, 'sideways_use_sma': False, 'sideways_use_ema': False, 'sideways_use_atr': True, 'sideways_use_adx': False, 'sideways_use_spike': False, 'sideways_rsi_required': True}.
[I 2025-08-31 12:18:19,702] Trial 198 finished with values: [-1000000000.0, 1000000000.0] and parameters: {'p_sma': 31, 'p_std': 31, 'p_atr': 11, 'p_adx': 13, 'rsi_period': 37, 'ema1': 15, 'ema2': 39, 'slip_atr_k': 0.20805066070620823, 'slip_spread_k': 0.13346536902374787, 'spread_hl_frac': 0.03150605039320135, 'bb_std_mult': 0.9224920888992283, 'rsi_os': 17, 'rsi_ob': 85, 'vol_spike': 0.22935361402593069, 'adx_thresh': 10.434177045866889, 'atr_min_pct': 0.027296678982804332, 'atr_max_pct': 0.07366975022756402, 'tp_mult': 2.601382616755364, 'tsl_mult': 0.06985574241731446, 'strategy': 'breakout', 'time_stop': 202, 'use_sma': True, 'use_atr': False, 'use_adx': True, 'use_ema': False, 'use_spike': True, 'rsi_required': False, 'edge_k': 1.1363294254816196, 'edge_cap': 0.7619311578632011, 'bull_strategy': 'mean_reversion', 'bull_bb_std_mult': 3.1758377757453813, 'bull_rsi_os': 13, 'bull_rsi_ob': 90, 'bull_adx_thresh': 9.872847927050454, 'bull_atr_min_pct': 0.01660002430548556, 'bull_atr_max_pct': 0.03523469571284491, 'bull_tp_mult': 2.711380330652732, 'bull_tsl_mult': 0.07872940796643924, 'bull_time_stop': 138, 'bull_use_sma': False, 'bull_use_ema': False, 'bull_use_atr': False, 'bull_use_adx': True, 'bull_use_spike': False, 'bull_rsi_required': True, 'bear_strategy': 'mean_reversion', 'bear_bb_std_mult': 1.6782915051802096, 'bear_rsi_os': 30, 'bear_rsi_ob': 92, 'bear_adx_thresh': 14.252398995834902, 'bear_atr_min_pct': 0.0009703804855473643, 'bear_atr_max_pct': 0.09949948633066201, 'bear_tp_mult': 2.728590504193234, 'bear_tsl_mult': 0.22609138332050777, 'bear_time_stop': 79, 'bear_use_sma': False, 'bear_use_ema': False, 'bear_use_atr': False, 'bear_use_adx': False, 'bear_use_spike': True, 'bear_rsi_required': False, 'sideways_strategy': 'breakout', 'sideways_bb_std_mult': 1.9412509302778957, 'sideways_rsi_os': 24, 'sideways_rsi_ob': 46, 'sideways_adx_thresh': 27.604942041416315, 'sideways_atr_min_pct': 0.003156849295257976, 'sideways_atr_max_pct': 0.07065693928679968, 'sideways_tp_mult': 1.499540884520968, 'sideways_tsl_mult': 0.4378426313781195, 'sideways_time_stop': 182, 'sideways_use_sma': False, 'sideways_use_ema': False, 'sideways_use_atr': True, 'sideways_use_adx': False, 'sideways_use_spike': False, 'sideways_rsi_required': True}.
[I 2025-08-31 12:18:19,803] Trial 200 finished with values: [-1000000000.0, 1000000000.0] and parameters: {'p_sma': 31, 'p_std': 49, 'p_atr': 30, 'p_adx': 19, 'rsi_period': 78, 'ema1': 7, 'ema2': 35, 'slip_atr_k': 0.2070871337116531, 'slip_spread_k': 0.1419947192015985, 'spread_hl_frac': 0.048301188321242326, 'bb_std_mult': 0.9293693182174931, 'rsi_os': 11, 'rsi_ob': 86, 'vol_spike': 0.2652949124322154, 'adx_thresh': 26.258143199423984, 'atr_min_pct': 0.0005667522961073281, 'atr_max_pct': 0.07368984736626964, 'tp_mult': 1.362408526210757, 'tsl_mult': 0.4976224499966842, 'strategy': 'breakout', 'time_stop': 203, 'use_sma': True, 'use_atr': False, 'use_adx': True, 'use_ema': False, 'use_spike': True, 'rsi_required': True, 'edge_k': 1.137264199022377, 'edge_cap': 0.2748355233121556, 'bull_strategy': 'mean_reversion', 'bull_bb_std_mult': 0.5090988714509337, 'bull_rsi_os': 14, 'bull_rsi_ob': 90, 'bull_adx_thresh': 9.786991153887067, 'bull_atr_min_pct': 0.024787706844686508, 'bull_atr_max_pct': 0.07974108264861256, 'bull_tp_mult': 2.731189593956244, 'bull_tsl_mult': 0.313520711253785, 'bull_time_stop': 210, 'bull_use_sma': True, 'bull_use_ema': True, 'bull_use_atr': True, 'bull_use_adx': True, 'bull_use_spike': False, 'bull_rsi_required': True, 'bear_strategy': 'mean_reversion', 'bear_bb_std_mult': 1.6977901253309287, 'bear_rsi_os': 16, 'bear_rsi_ob': 62, 'bear_adx_thresh': 14.26189229742645, 'bear_atr_min_pct': 0.013129352463837717, 'bear_atr_max_pct': 0.09277641942925628, 'bear_tp_mult': 2.331406878439825, 'bear_tsl_mult': 0.23118651094133585, 'bear_time_stop': 226, 'bear_use_sma': False, 'bear_use_ema': False, 'bear_use_atr': False, 'bear_use_adx': False, 'bear_use_spike': True, 'bear_rsi_required': False, 'sideways_strategy': 'breakout', 'sideways_bb_std_mult': 2.2390127513999842, 'sideways_rsi_os': 38, 'sideways_rsi_ob': 46, 'sideways_adx_thresh': 21.508866434033123, 'sideways_atr_min_pct': 0.02419908052361732, 'sideways_atr_max_pct': 0.13004308638928236, 'sideways_tp_mult': 1.4916155855397282, 'sideways_tsl_mult': 0.2121310669792303, 'sideways_time_stop': 182, 'sideways_use_sma': True, 'sideways_use_ema': True, 'sideways_use_atr': True, 'sideways_use_adx': False, 'sideways_use_spike': False, 'sideways_rsi_required': True}.
[I 2025-08-31 12:18:53,479] Trial 202 finished with values: [-0.026281956066976586, 0.02653919676372458] and parameters: {'p_sma': 31, 'p_std': 18, 'p_atr': 12, 'p_adx': 15, 'rsi_period': 66, 'ema1': 7, 'ema2': 55, 'slip_atr_k': 0.17957062836396054, 'slip_spread_k': 0.0971641521668628, 'spread_hl_frac': 0.03807141091082095, 'bb_std_mult': 0.8347785453890908, 'rsi_os': 42, 'rsi_ob': 85, 'vol_spike': 0.23294324598906116, 'adx_thresh': 22.85172008183374, 'atr_min_pct': 0.0017930545260538486, 'atr_max_pct': 0.14492833994722132, 'tp_mult': 2.5566156043698673, 'tsl_mult': 0.4207998505639631, 'strategy': 'mean_reversion', 'time_stop': 70, 'use_sma': True, 'use_atr': False, 'use_adx': False, 'use_ema': False, 'use_spike': True, 'rsi_required': True, 'edge_k': 1.0841811413664202, 'edge_cap': 0.962634847771715, 'bull_strategy': 'breakout', 'bull_bb_std_mult': 3.1825936162077437, 'bull_rsi_os': 28, 'bull_rsi_ob': 76, 'bull_adx_thresh': 10.217782866877263, 'bull_atr_min_pct': 0.022585171303887614, 'bull_atr_max_pct': 0.010213343171458125, 'bull_tp_mult': 2.6638095503787205, 'bull_tsl_mult': 0.8042734211232003, 'bull_time_stop': 75, 'bull_use_sma': True, 'bull_use_ema': True, 'bull_use_atr': True, 'bull_use_adx': True, 'bull_use_spike': False, 'bull_rsi_required': True, 'bear_strategy': 'mean_reversion', 'bear_bb_std_mult': 1.4227927809720489, 'bear_rsi_os': 22, 'bear_rsi_ob': 60, 'bear_adx_thresh': 20.795257998886463, 'bear_atr_min_pct': 0.013099546696797092, 'bear_atr_max_pct': 0.038783755615630286, 'bear_tp_mult': 2.0782539154464925, 'bear_tsl_mult': 0.11540329378980252, 'bear_time_stop': 225, 'bear_use_sma': False, 'bear_use_ema': False, 'bear_use_atr': False, 'bear_use_adx': False, 'bear_use_spike': True, 'bear_rsi_required': False, 'sideways_strategy': 'breakout', 'sideways_bb_std_mult': 2.2426742001722686, 'sideways_rsi_os': 38, 'sideways_rsi_ob': 47, 'sideways_adx_thresh': 27.720661903738147, 'sideways_atr_min_pct': 0.0021597223913175727, 'sideways_atr_max_pct': 0.061343836387010874, 'sideways_tp_mult': 1.502353229112785, 'sideways_tsl_mult': 0.8651141698195763, 'sideways_time_stop': 251, 'sideways_use_sma': True, 'sideways_use_ema': True, 'sideways_use_atr': True, 'sideways_use_adx': False, 'sideways_use_spike': False, 'sideways_rsi_required': True}.
[I 2025-08-31 12:18:54,101] Trial 203 finished with values: [-1000000000.0, 1000000000.0] and parameters: {'p_sma': 33, 'p_std': 44, 'p_atr': 10, 'p_adx': 23, 'rsi_period': 33, 'ema1': 6, 'ema2': 17, 'slip_atr_k': 0.09872463217356231, 'slip_spread_k': 0.11515304777035316, 'spread_hl_frac': 0.028439042454620127, 'bb_std_mult': 2.20707612493519, 'rsi_os': 33, 'rsi_ob': 61, 'vol_spike': 0.26039446018547957, 'adx_thresh': 23.758955573472118, 'atr_min_pct': 0.028388597380444264, 'atr_max_pct': 0.13520415816542009, 'tp_mult': 1.7171475123227404, 'tsl_mult': 0.4581286280198506, 'strategy': 'mean_reversion', 'time_stop': 93, 'use_sma': True, 'use_atr': True, 'use_adx': False, 'use_ema': False, 'use_spike': True, 'rsi_required': True, 'edge_k': 0.001909483344175844, 'edge_cap': 0.9672508746658662, 'bull_strategy': 'breakout', 'bull_bb_std_mult': 3.267667602545154, 'bull_rsi_os': 38, 'bull_rsi_ob': 76, 'bull_adx_thresh': 18.7229668142256, 'bull_atr_min_pct': 0.029892748037036045, 'bull_atr_max_pct': 0.05356312045155055, 'bull_tp_mult': 1.1784329306082264, 'bull_tsl_mult': 0.29905105273105614, 'bull_time_stop': 90, 'bull_use_sma': True, 'bull_use_ema': True, 'bull_use_atr': True, 'bull_use_adx': True, 'bull_use_spike': True, 'bull_rsi_required': True, 'bear_strategy': 'mean_reversion', 'bear_bb_std_mult': 1.577398003948045, 'bear_rsi_os': 22, 'bear_rsi_ob': 61, 'bear_adx_thresh': 10.87132419133394, 'bear_atr_min_pct': 0.013830790880749391, 'bear_atr_max_pct': 0.03772786202353391, 'bear_tp_mult': 1.0206413213846268, 'bear_tsl_mult': 0.11401466684348369, 'bear_time_stop': 228, 'bear_use_sma': False, 'bear_use_ema': True, 'bear_use_atr': False, 'bear_use_adx': False, 'bear_use_spike': False, 'bear_rsi_required': False, 'sideways_strategy': 'breakout', 'sideways_bb_std_mult': 3.1829149151560205, 'sideways_rsi_os': 34, 'sideways_rsi_ob': 47, 'sideways_adx_thresh': 9.16834582751457, 'sideways_atr_min_pct': 0.015638596643895594, 'sideways_atr_max_pct': 0.0671717867811504, 'sideways_tp_mult': 1.397630848097193, 'sideways_tsl_mult': 0.0037573323152093607, 'sideways_time_stop': 190, 'sideways_use_sma': False, 'sideways_use_ema': True, 'sideways_use_atr': True, 'sideways_use_adx': True, 'sideways_use_spike': False, 'sideways_rsi_required': True}.
[I 2025-08-31 12:18:54,230] Trial 201 finished with values: [-1000000000.0, 1000000000.0] and parameters: {'p_sma': 31, 'p_std': 18, 'p_atr': 10, 'p_adx': 26, 'rsi_period': 36, 'ema1': 7, 'ema2': 55, 'slip_atr_k': 0.1809665947831515, 'slip_spread_k': 0.1128921008516964, 'spread_hl_frac': 0.0385081659647742, 'bb_std_mult': 2.6624010343214066, 'rsi_os': 11, 'rsi_ob': 86, 'vol_spike': 0.14429409127139045, 'adx_thresh': 23.863115773214474, 'atr_min_pct': 0.009269413081714199, 'atr_max_pct': 0.11497744571618249, 'tp_mult': 2.556296452568755, 'tsl_mult': 0.42608487218556806, 'strategy': 'mean_reversion', 'time_stop': 101, 'use_sma': True, 'use_atr': False, 'use_adx': False, 'use_ema': False, 'use_spike': True, 'rsi_required': True, 'edge_k': 1.513295790427829, 'edge_cap': 0.6002503548506681, 'bull_strategy': 'mean_reversion', 'bull_bb_std_mult': 3.1707993928257214, 'bull_rsi_os': 14, 'bull_rsi_ob': 89, 'bull_adx_thresh': 10.646560887329766, 'bull_atr_min_pct': 0.018565969511493412, 'bull_atr_max_pct': 0.0262942462306325, 'bull_tp_mult': 2.5712273698863544, 'bull_tsl_mult': 0.3007684665544923, 'bull_time_stop': 56, 'bull_use_sma': True, 'bull_use_ema': True, 'bull_use_atr': True, 'bull_use_adx': True, 'bull_use_spike': False, 'bull_rsi_required': True, 'bear_strategy': 'mean_reversion', 'bear_bb_std_mult': 1.6680556428871796, 'bear_rsi_os': 11, 'bear_rsi_ob': 61, 'bear_adx_thresh': 14.595960632828195, 'bear_atr_min_pct': 0.029338870826554293, 'bear_atr_max_pct': 0.045693706294630695, 'bear_tp_mult': 1.8490525364154256, 'bear_tsl_mult': 0.13477946749513348, 'bear_time_stop': 218, 'bear_use_sma': False, 'bear_use_ema': False, 'bear_use_atr': False, 'bear_use_adx': False, 'bear_use_spike': True, 'bear_rsi_required': False, 'sideways_strategy': 'breakout', 'sideways_bb_std_mult': 2.2262776542148504, 'sideways_rsi_os': 38, 'sideways_rsi_ob': 47, 'sideways_adx_thresh': 27.86643519947385, 'sideways_atr_min_pct': 0.013407044865127176, 'sideways_atr_max_pct': 0.06119989148900583, 'sideways_tp_mult': 1.4964773152422168, 'sideways_tsl_mult': 0.5289351731940883, 'sideways_time_stop': 123, 'sideways_use_sma': True, 'sideways_use_ema': True, 'sideways_use_atr': True, 'sideways_use_adx': False, 'sideways_use_spike': False, 'sideways_rsi_required': True}.
[I 2025-08-31 12:18:54,326] Trial 204 finished with values: [-1000000000.0, 1000000000.0] and parameters: {'p_sma': 33, 'p_std': 60, 'p_atr': 10, 'p_adx': 23, 'rsi_period': 84, 'ema1': 6, 'ema2': 55, 'slip_atr_k': 0.22688207015107656, 'slip_spread_k': 0.11292154429478028, 'spread_hl_frac': 0.03846168841865636, 'bb_std_mult': 0.9887269065750453, 'rsi_os': 29, 'rsi_ob': 61, 'vol_spike': 0.25930470581656545, 'adx_thresh': 22.907660262260105, 'atr_min_pct': 0.02824264153150634, 'atr_max_pct': 0.11505248060634643, 'tp_mult': 2.547287562482458, 'tsl_mult': 0.4163871525590172, 'strategy': 'mean_reversion', 'time_stop': 69, 'use_sma': True, 'use_atr': True, 'use_adx': False, 'use_ema': False, 'use_spike': True, 'rsi_required': True, 'edge_k': 0.27974029294410185, 'edge_cap': 0.9693950771909308, 'bull_strategy': 'breakout', 'bull_bb_std_mult': 3.1778543307328206, 'bull_rsi_os': 15, 'bull_rsi_ob': 88, 'bull_adx_thresh': 8.110925429597211, 'bull_atr_min_pct': 0.01865801278998899, 'bull_atr_max_pct': 0.13659933350144401, 'bull_tp_mult': 2.667725628079463, 'bull_tsl_mult': 0.29570223382536637, 'bull_time_stop': 73, 'bull_use_sma': True, 'bull_use_ema': True, 'bull_use_atr': True, 'bull_use_adx': True, 'bull_use_spike': True, 'bull_rsi_required': True, 'bear_strategy': 'mean_reversion', 'bear_bb_std_mult': 1.431944851243689, 'bear_rsi_os': 7, 'bear_rsi_ob': 61, 'bear_adx_thresh': 33.86064191555965, 'bear_atr_min_pct': 0.013888457587172113, 'bear_atr_max_pct': 0.103343069476006, 'bear_tp_mult': 2.653881257273571, 'bear_tsl_mult': 0.11660775889981004, 'bear_time_stop': 43, 'bear_use_sma': False, 'bear_use_ema': True, 'bear_use_atr': False, 'bear_use_adx': False, 'bear_use_spike': False, 'bear_rsi_required': False, 'sideways_strategy': 'breakout', 'sideways_bb_std_mult': 2.1542187344343304, 'sideways_rsi_os': 35, 'sideways_rsi_ob': 47, 'sideways_adx_thresh': 10.51630591973399, 'sideways_atr_min_pct': 0.013615704231942473, 'sideways_atr_max_pct': 0.061932363070605324, 'sideways_tp_mult': 2.2288333133375833, 'sideways_tsl_mult': 0.8697170664512106, 'sideways_time_stop': 247, 'sideways_use_sma': False, 'sideways_use_ema': True, 'sideways_use_atr': True, 'sideways_use_adx': True, 'sideways_use_spike': False, 'sideways_rsi_required': True}.
[I 2025-08-31 12:19:29,650] Trial 207 finished with values: [-1000000000.0, 1000000000.0] and parameters: {'p_sma': 54, 'p_std': 20, 'p_atr': 12, 'p_adx': 15, 'rsi_period': 76, 'ema1': 20, 'ema2': 37, 'slip_atr_k': 0.22664656731320698, 'slip_spread_k': 0.08697005959317505, 'spread_hl_frac': 0.00209162509771324, 'bb_std_mult': 3.3827085841124926, 'rsi_os': 42, 'rsi_ob': 60, 'vol_spike': 0.27071829846401957, 'adx_thresh': 23.12827427848624, 'atr_min_pct': 0.029225396669862458, 'atr_max_pct': 0.07756562405574523, 'tp_mult': 2.5543483834130547, 'tsl_mult': 0.4778925312560661, 'strategy': 'mean_reversion', 'time_stop': 90, 'use_sma': True, 'use_atr': False, 'use_adx': True, 'use_ema': False, 'use_spike': False, 'rsi_required': False, 'edge_k': 1.066557500762495, 'edge_cap': 0.31216292358571873, 'bull_strategy': 'breakout', 'bull_bb_std_mult': 2.346048230996188, 'bull_rsi_os': 12, 'bull_rsi_ob': 88, 'bull_adx_thresh': 7.977796473618738, 'bull_atr_min_pct': 0.006012643831351415, 'bull_atr_max_pct': 0.011918550118886442, 'bull_tp_mult': 1.1193410212125872, 'bull_tsl_mult': 0.3370817491250113, 'bull_time_stop': 74, 'bull_use_sma': False, 'bull_use_ema': False, 'bull_use_atr': False, 'bull_use_adx': True, 'bull_use_spike': False, 'bull_rsi_required': False, 'bear_strategy': 'mean_reversion', 'bear_bb_std_mult': 1.4255227763133114, 'bear_rsi_os': 25, 'bear_rsi_ob': 77, 'bear_adx_thresh': 18.425104241716426, 'bear_atr_min_pct': 0.02857030443156525, 'bear_atr_max_pct': 0.09565069266175062, 'bear_tp_mult': 2.63439560903932, 'bear_tsl_mult': 0.3629958904101732, 'bear_time_stop': 72, 'bear_use_sma': False, 'bear_use_ema': False, 'bear_use_atr': False, 'bear_use_adx': False, 'bear_use_spike': True, 'bear_rsi_required': False, 'sideways_strategy': 'breakout', 'sideways_bb_std_mult': 2.154652605766331, 'sideways_rsi_os': 35, 'sideways_rsi_ob': 48, 'sideways_adx_thresh': 10.281810159686756, 'sideways_atr_min_pct': 0.021243755737579348, 'sideways_atr_max_pct': 0.1492606980175591, 'sideways_tp_mult': 1.3811021401230472, 'sideways_tsl_mult': 0.9578648371722869, 'sideways_time_stop': 23, 'sideways_use_sma': False, 'sideways_use_ema': True, 'sideways_use_atr': True, 'sideways_use_adx': False, 'sideways_use_spike': False, 'sideways_rsi_required': True}.
[I 2025-08-31 12:19:29,916] Trial 206 finished with values: [-0.05435749068809459, 0.05413651360518622] and parameters: {'p_sma': 19, 'p_std': 22, 'p_atr': 12, 'p_adx': 26, 'rsi_period': 26, 'ema1': 7, 'ema2': 55, 'slip_atr_k': 0.15901380101394105, 'slip_spread_k': 0.09585250178135754, 'spread_hl_frac': 0.0020505453429507867, 'bb_std_mult': 0.834921939505749, 'rsi_os': 42, 'rsi_ob': 61, 'vol_spike': 0.25040320418930223, 'adx_thresh': 23.072550701789666, 'atr_min_pct': 0.028148510407316838, 'atr_max_pct': 0.0779910182303644, 'tp_mult': 2.5580379339883765, 'tsl_mult': 0.4208984196510631, 'strategy': 'mean_reversion', 'time_stop': 91, 'use_sma': True, 'use_atr': False, 'use_adx': False, 'use_ema': False, 'use_spike': False, 'rsi_required': False, 'edge_k': 1.081266706072182, 'edge_cap': 0.6642446682441434, 'bull_strategy': 'mean_reversion', 'bull_bb_std_mult': 2.41995836055849, 'bull_rsi_os': 14, 'bull_rsi_ob': 88, 'bull_adx_thresh': 6.6759932142861445, 'bull_atr_min_pct': 0.02282543626521007, 'bull_atr_max_pct': 0.010041833204756354, 'bull_tp_mult': 2.6600867319132404, 'bull_tsl_mult': 0.7889180334998764, 'bull_time_stop': 76, 'bull_use_sma': False, 'bull_use_ema': False, 'bull_use_atr': False, 'bull_use_adx': True, 'bull_use_spike': False, 'bull_rsi_required': True, 'bear_strategy': 'mean_reversion', 'bear_bb_std_mult': 3.0931712937837865, 'bear_rsi_os': 24, 'bear_rsi_ob': 60, 'bear_adx_thresh': 32.82252363541694, 'bear_atr_min_pct': 0.02830086637343752, 'bear_atr_max_pct': 0.09492771964677837, 'bear_tp_mult': 1.2177821279129923, 'bear_tsl_mult': 0.3978217374123511, 'bear_time_stop': 71, 'bear_use_sma': False, 'bear_use_ema': False, 'bear_use_atr': False, 'bear_use_adx': False, 'bear_use_spike': True, 'bear_rsi_required': False, 'sideways_strategy': 'breakout', 'sideways_bb_std_mult': 2.150530274462303, 'sideways_rsi_os': 35, 'sideways_rsi_ob': 48, 'sideways_adx_thresh': 10.590197313136384, 'sideways_atr_min_pct': 0.002053785834269083, 'sideways_atr_max_pct': 0.07462960716139472, 'sideways_tp_mult': 1.37078887382127, 'sideways_tsl_mult': 0.4030281571133089, 'sideways_time_stop': 193, 'sideways_use_sma': True, 'sideways_use_ema': True, 'sideways_use_atr': True, 'sideways_use_adx': False, 'sideways_use_spike': False, 'sideways_rsi_required': True}.
