[I 2025-08-31 12:26:10,696] Trial 261 finished with values: [-0.11277734335308465, 0.11261090979828874] and parameters: {'p_sma': 57, 'p_std': 29, 'p_atr': 12, 'p_adx': 15, 'rsi_period': 82, 'ema1': 5, 'ema2': 11, 'slip_atr_k': 0.050891371929462095, 'slip_spread_k': 0.6653721800464246, 'spread_hl_frac': 0.030839658804528217, 'bb_std_mult': 1.859508731277543, 'rsi_os': 39, 'rsi_ob': 75, 'vol_spike': 0.0868631960531393, 'adx_thresh': 20.691318132333954, 'atr_min_pct': 0.0017489985672191392, 'atr_max_pct': 0.14292458781558728, 'tp_mult': 2.621425517816434, 'tsl_mult': 0.017944736028739517, 'strategy': 'mean_reversion', 'time_stop': 208, 'use_sma': False, 'use_atr': True, 'use_adx': False, 'use_ema': False, 'use_spike': False, 'rsi_required': True, 'edge_k': 0.6033992016878433, 'edge_cap': 0.7342017635037442, 'bull_strategy': 'breakout', 'bull_bb_std_mult': 2.9657522256333912, 'bull_rsi_os': 9, 'bull_rsi_ob': 80, 'bull_adx_thresh': 24.099572202708313, 'bull_atr_min_pct': 0.021790071459008832, 'bull_atr_max_pct': 0.08838440579370056, 'bull_tp_mult': 2.5683373407183745, 'bull_tsl_mult': 0.24137170661648139, 'bull_time_stop': 96, 'bull_use_sma': True, 'bull_use_ema': True, 'bull_use_atr': False, 'bull_use_adx': True, 'bull_use_spike': False, 'bull_rsi_required': False, 'bear_strategy': 'breakout', 'bear_bb_std_mult': 3.305868232616631, 'bear_rsi_os': 30, 'bear_rsi_ob': 72, 'bear_adx_thresh': 31.175364869266833, 'bear_atr_min_pct': 0.027338001774609186, 'bear_atr_max_pct': 0.08959248746273873, 'bear_tp_mult': 2.8957650325717554, 'bear_tsl_mult': 0.15925640832450946, 'bear_time_stop': 245, 'bear_use_sma': True, 'bear_use_ema': True, 'bear_use_atr': True, 'bear_use_adx': True, 'bear_use_spike': True, 'bear_rsi_required': True, 'sideways_strategy': 'breakout', 'sideways_bb_std_mult': 3.5915893439836486, 'sideways_rsi_os': 44, 'sideways_rsi_ob': 79, 'sideways_adx_thresh': 14.089615027010511, 'sideways_atr_min_pct': 0.0010559918998431152, 'sideways_atr_max_pct': 0.13249263907409414, 'sideways_tp_mult': 1.550738540249872, 'sideways_tsl_mult': 0.6527942564029215, 'sideways_time_stop': 216, 'sideways_use_sma': True, 'sideways_use_ema': False, 'sideways_use_atr': False, 'sideways_use_adx': False, 'sideways_use_spike': False, 'sideways_rsi_required': True}.
[I 2025-08-31 12:26:10,708] Trial 262 finished with values: [-1000000000.0, 1000000000.0] and parameters: {'p_sma': 52, 'p_std': 28, 'p_atr': 12, 'p_adx': 15, 'rsi_period': 82, 'ema1': 5, 'ema2': 14, 'slip_atr_k': 0.009449742233777609, 'slip_spread_k': 0.6627941014110854, 'spread_hl_frac': 0.03127712103072108, 'bb_std_mult': 1.470817937070846, 'rsi_os': 38, 'rsi_ob': 77, 'vol_spike': 0.12103971925246851, 'adx_thresh': 34.16361249229665, 'atr_min_pct': 0.0016129730412795266, 'atr_max_pct': 0.13287052539852875, 'tp_mult': 2.6243626699511275, 'tsl_mult': 0.011350096938537536, 'strategy': 'mean_reversion', 'time_stop': 210, 'use_sma': False, 'use_atr': True, 'use_adx': False, 'use_ema': False, 'use_spike': False, 'rsi_required': True, 'edge_k': 0.6130793755564621, 'edge_cap': 0.7375854520610076, 'bull_strategy': 'breakout', 'bull_bb_std_mult': 2.9248293234766907, 'bull_rsi_os': 9, 'bull_rsi_ob': 80, 'bull_adx_thresh': 21.71105078236166, 'bull_atr_min_pct': 0.02156315870625619, 'bull_atr_max_pct': 0.08992478639439348, 'bull_tp_mult': 2.608179232194684, 'bull_tsl_mult': 0.23558117915513127, 'bull_time_stop': 268, 'bull_use_sma': True, 'bull_use_ema': True, 'bull_use_atr': False, 'bull_use_adx': True, 'bull_use_spike': False, 'bull_rsi_required': False, 'bear_strategy': 'breakout', 'bear_bb_std_mult': 3.078053572978308, 'bear_rsi_os': 30, 'bear_rsi_ob': 72, 'bear_adx_thresh': 31.142334761388295, 'bear_atr_min_pct': 0.025819106030969423, 'bear_atr_max_pct': 0.09063574712167118, 'bear_tp_mult': 2.909705232805197, 'bear_tsl_mult': 0.15945421803251378, 'bear_time_stop': 245, 'bear_use_sma': True, 'bear_use_ema': True, 'bear_use_atr': True, 'bear_use_adx': True, 'bear_use_spike': True, 'bear_rsi_required': True, 'sideways_strategy': 'breakout', 'sideways_bb_std_mult': 3.48631473400438, 'sideways_rsi_os': 35, 'sideways_rsi_ob': 79, 'sideways_adx_thresh': 12.910903010772577, 'sideways_atr_min_pct': 0.0011933820007536393, 'sideways_atr_max_pct': 0.13247808041404902, 'sideways_tp_mult': 1.5092662244462958, 'sideways_tsl_mult': 0.6285853859161783, 'sideways_time_stop': 216, 'sideways_use_sma': True, 'sideways_use_ema': False, 'sideways_use_atr': False, 'sideways_use_adx': False, 'sideways_use_spike': False, 'sideways_rsi_required': True}.
[I 2025-08-31 12:26:42,129] Trial 263 finished with values: [-1000000000.0, 1000000000.0] and parameters: {'p_sma': 52, 'p_std': 28, 'p_atr': 26, 'p_adx': 15, 'rsi_period': 80, 'ema1': 5, 'ema2': 11, 'slip_atr_k': 0.009637855006720396, 'slip_spread_k': 0.6516103362137796, 'spread_hl_frac': 0.03080759076765134, 'bb_std_mult': 1.5034625076062793, 'rsi_os': 39, 'rsi_ob': 75, 'vol_spike': 0.0994345090867851, 'adx_thresh': 19.245704523890144, 'atr_min_pct': 0.0013098407331721225, 'atr_max_pct': 0.13304595929803104, 'tp_mult': 2.614321435044057, 'tsl_mult': 0.019465021791267186, 'strategy': 'mean_reversion', 'time_stop': 208, 'use_sma': False, 'use_atr': True, 'use_adx': False, 'use_ema': False, 'use_spike': False, 'rsi_required': True, 'edge_k': 0.6126457199678504, 'edge_cap': 0.666872712088767, 'bull_strategy': 'breakout', 'bull_bb_std_mult': 2.9691509165459413, 'bull_rsi_os': 9, 'bull_rsi_ob': 80, 'bull_adx_thresh': 7.115228178235423, 'bull_atr_min_pct': 0.02158932972873231, 'bull_atr_max_pct': 0.08890182489151557, 'bull_tp_mult': 2.588957691603358, 'bull_tsl_mult': 0.2362761212500055, 'bull_time_stop': 269, 'bull_use_sma': True, 'bull_use_ema': True, 'bull_use_atr': False, 'bull_use_adx': True, 'bull_use_spike': False, 'bull_rsi_required': False, 'bear_strategy': 'breakout', 'bear_bb_std_mult': 3.115657509450058, 'bear_rsi_os': 31, 'bear_rsi_ob': 72, 'bear_adx_thresh': 31.100875818705354, 'bear_atr_min_pct': 0.025638813047935936, 'bear_atr_max_pct': 0.08818568338263091, 'bear_tp_mult': 2.8734865241941714, 'bear_tsl_mult': 0.167805490608812, 'bear_time_stop': 246, 'bear_use_sma': True, 'bear_use_ema': True, 'bear_use_atr': True, 'bear_use_adx': True, 'bear_use_spike': True, 'bear_rsi_required': True, 'sideways_strategy': 'breakout', 'sideways_bb_std_mult': 3.510073484338508, 'sideways_rsi_os': 19, 'sideways_rsi_ob': 79, 'sideways_adx_thresh': 12.800712217912999, 'sideways_atr_min_pct': 0.0012169273331716253, 'sideways_atr_max_pct': 0.12460532125852802, 'sideways_tp_mult': 1.5018392295988041, 'sideways_tsl_mult': 0.6545841243184657, 'sideways_time_stop': 213, 'sideways_use_sma': True, 'sideways_use_ema': False, 'sideways_use_atr': False, 'sideways_use_adx': False, 'sideways_use_spike': False, 'sideways_rsi_required': False}.
[I 2025-08-31 12:26:42,942] Trial 265 finished with values: [-1000000000.0, 1000000000.0] and parameters: {'p_sma': 51, 'p_std': 28, 'p_atr': 13, 'p_adx': 15, 'rsi_period': 80, 'ema1': 5, 'ema2': 12, 'slip_atr_k': 0.018084238012144524, 'slip_spread_k': 0.6335514493008663, 'spread_hl_frac': 0.032357334486911055, 'bb_std_mult': 1.949395037038253, 'rsi_os': 39, 'rsi_ob': 73, 'vol_spike': 0.134358668424238, 'adx_thresh': 20.434639608960097, 'atr_min_pct': 0.0012173824303774027, 'atr_max_pct': 0.13406795915620878, 'tp_mult': 2.7879363943355915, 'tsl_mult': 0.0445096035884302, 'strategy': 'breakout', 'time_stop': 221, 'use_sma': False, 'use_atr': True, 'use_adx': False, 'use_ema': False, 'use_spike': False, 'rsi_required': True, 'edge_k': 0.6564064137624521, 'edge_cap': 0.673392808772634, 'bull_strategy': 'breakout', 'bull_bb_std_mult': 2.992443955926854, 'bull_rsi_os': 8, 'bull_rsi_ob': 79, 'bull_adx_thresh': 7.503295100064443, 'bull_atr_min_pct': 0.02099121143888576, 'bull_atr_max_pct': 0.10129516764965295, 'bull_tp_mult': 2.671868455757517, 'bull_tsl_mult': 0.19329670325173332, 'bull_time_stop': 134, 'bull_use_sma': True, 'bull_use_ema': True, 'bull_use_atr': False, 'bull_use_adx': False, 'bull_use_spike': False, 'bull_rsi_required': False, 'bear_strategy': 'breakout', 'bear_bb_std_mult': 2.4854450201917877, 'bear_rsi_os': 33, 'bear_rsi_ob': 72, 'bear_adx_thresh': 20.219246728720368, 'bear_atr_min_pct': 0.02522395043138881, 'bear_atr_max_pct': 0.08847046063441219, 'bear_tp_mult': 2.8612215875171523, 'bear_tsl_mult': 0.1493288429735962, 'bear_time_stop': 245, 'bear_use_sma': True, 'bear_use_ema': True, 'bear_use_atr': True, 'bear_use_adx': True, 'bear_use_spike': True, 'bear_rsi_required': True, 'sideways_strategy': 'breakout', 'sideways_bb_std_mult': 3.5268286243176834, 'sideways_rsi_os': 7, 'sideways_rsi_ob': 78, 'sideways_adx_thresh': 15.508845075581785, 'sideways_atr_min_pct': 0.0011846013279829175, 'sideways_atr_max_pct': 0.1375291660122761, 'sideways_tp_mult': 1.4658180941081531, 'sideways_tsl_mult': 0.6167788782294102, 'sideways_time_stop': 214, 'sideways_use_sma': True, 'sideways_use_ema': False, 'sideways_use_atr': False, 'sideways_use_adx': False, 'sideways_use_spike': True, 'sideways_rsi_required': False}.
[I 2025-08-31 12:26:43,165] Trial 266 finished with values: [-1000000000.0, 1000000000.0] and parameters: {'p_sma': 51, 'p_std': 28, 'p_atr': 13, 'p_adx': 15, 'rsi_period': 80, 'ema1': 5, 'ema2': 16, 'slip_atr_k': 0.025062062758086444, 'slip_spread_k': 0.6902041947724078, 'spread_hl_frac': 0.03150123280594068, 'bb_std_mult': 1.5951600531342756, 'rsi_os': 39, 'rsi_ob': 73, 'vol_spike': 0.13444528278637657, 'adx_thresh': 20.230340288918605, 'atr_min_pct': 0.0011727624477170294, 'atr_max_pct': 0.13490067676599665, 'tp_mult': 2.9248846021582127, 'tsl_mult': 0.08519789628839208, 'strategy': 'breakout', 'time_stop': 219, 'use_sma': False, 'use_atr': True, 'use_adx': False, 'use_ema': False, 'use_spike': False, 'rsi_required': True, 'edge_k': 0.6619432947632414, 'edge_cap': 0.6803691253421249, 'bull_strategy': 'breakout', 'bull_bb_std_mult': 2.9954814941138004, 'bull_rsi_os': 8, 'bull_rsi_ob': 79, 'bull_adx_thresh': 7.060194222654876, 'bull_atr_min_pct': 0.020999469606852134, 'bull_atr_max_pct': 0.0776253685693733, 'bull_tp_mult': 1.3564019874959912, 'bull_tsl_mult': 0.23879794605601612, 'bull_time_stop': 99, 'bull_use_sma': True, 'bull_use_ema': True, 'bull_use_atr': False, 'bull_use_adx': False, 'bull_use_spike': False, 'bull_rsi_required': False, 'bear_strategy': 'breakout', 'bear_bb_std_mult': 3.107944734857024, 'bear_rsi_os': 32, 'bear_rsi_ob': 72, 'bear_adx_thresh': 30.57238454844156, 'bear_atr_min_pct': 0.027594392574114533, 'bear_atr_max_pct': 0.09241668297392282, 'bear_tp_mult': 2.8573919901666627, 'bear_tsl_mult': 0.14993036771660698, 'bear_time_stop': 244, 'bear_use_sma': True, 'bear_use_ema': True, 'bear_use_atr': True, 'bear_use_adx': True, 'bear_use_spike': True, 'bear_rsi_required': True, 'sideways_strategy': 'breakout', 'sideways_bb_std_mult': 3.532727956570249, 'sideways_rsi_os': 6, 'sideways_rsi_ob': 87, 'sideways_adx_thresh': 15.51699188265599, 'sideways_atr_min_pct': 0.01433591354111446, 'sideways_atr_max_pct': 0.12549702473436575, 'sideways_tp_mult': 1.4631791519940822, 'sideways_tsl_mult': 0.6178846536974179, 'sideways_time_stop': 212, 'sideways_use_sma': True, 'sideways_use_ema': False, 'sideways_use_atr': False, 'sideways_use_adx': False, 'sideways_use_spike': True, 'sideways_rsi_required': False}.
[I 2025-08-31 12:26:43,409] Trial 264 finished with values: [-1000000000.0, 1000000000.0] and parameters: {'p_sma': 51, 'p_std': 28, 'p_atr': 12, 'p_adx': 15, 'rsi_period': 81, 'ema1': 5, 'ema2': 12, 'slip_atr_k': 0.009584114989191116, 'slip_spread_k': 0.6614649167031473, 'spread_hl_frac': 0.032365046369230835, 'bb_std_mult': 1.8503075573950487, 'rsi_os': 39, 'rsi_ob': 76, 'vol_spike': 0.13400486613438325, 'adx_thresh': 20.34348128592387, 'atr_min_pct': 0.0017833734916320387, 'atr_max_pct': 0.1334766738384025, 'tp_mult': 2.8343785440643905, 'tsl_mult': 0.019719222477085435, 'strategy': 'mean_reversion', 'time_stop': 210, 'use_sma': False, 'use_atr': True, 'use_adx': False, 'use_ema': False, 'use_spike': False, 'rsi_required': True, 'edge_k': 0.575946983868428, 'edge_cap': 0.7016508428521961, 'bull_strategy': 'breakout', 'bull_bb_std_mult': 2.9722128197275697, 'bull_rsi_os': 8, 'bull_rsi_ob': 79, 'bull_adx_thresh': 21.40090868400288, 'bull_atr_min_pct': 0.02178876579978583, 'bull_atr_max_pct': 0.0775436118728647, 'bull_tp_mult': 2.60216591494473, 'bull_tsl_mult': 0.23952221271580298, 'bull_time_stop': 98, 'bull_use_sma': True, 'bull_use_ema': True, 'bull_use_atr': False, 'bull_use_adx': False, 'bull_use_spike': False, 'bull_rsi_required': False, 'bear_strategy': 'breakout', 'bear_bb_std_mult': 3.090988055309344, 'bear_rsi_os': 31, 'bear_rsi_ob': 72, 'bear_adx_thresh': 31.310276671359613, 'bear_atr_min_pct': 0.026050215297762774, 'bear_atr_max_pct': 0.09191139461004097, 'bear_tp_mult': 2.899804068913798, 'bear_tsl_mult': 0.14481351380703106, 'bear_time_stop': 244, 'bear_use_sma': True, 'bear_use_ema': True, 'bear_use_atr': True, 'bear_use_adx': True, 'bear_use_spike': True, 'bear_rsi_required': True, 'sideways_strategy': 'breakout', 'sideways_bb_std_mult': 3.5081397183479925, 'sideways_rsi_os': 13, 'sideways_rsi_ob': 78, 'sideways_adx_thresh': 14.215501435453689, 'sideways_atr_min_pct': 0.0011881073437359883, 'sideways_atr_max_pct': 0.1267699276256561, 'sideways_tp_mult': 1.574922050665647, 'sideways_tsl_mult': 0.6238869372538272, 'sideways_time_stop': 212, 'sideways_use_sma': True, 'sideways_use_ema': False, 'sideways_use_atr': False, 'sideways_use_adx': False, 'sideways_use_spike': True, 'sideways_rsi_required': False}.
[I 2025-08-31 12:27:16,348] Trial 268 finished with values: [-1000000000.0, 1000000000.0] and parameters: {'p_sma': 55, 'p_std': 30, 'p_atr': 12, 'p_adx': 8, 'rsi_period': 78, 'ema1': 5, 'ema2': 17, 'slip_atr_k': 0.014016347740139054, 'slip_spread_k': 0.6876306891208536, 'spread_hl_frac': 0.029644535927928897, 'bb_std_mult': 2.219346201773728, 'rsi_os': 40, 'rsi_ob': 71, 'vol_spike': 0.06750389810089907, 'adx_thresh': 21.37396711364301, 'atr_min_pct': 0.0022525808828278964, 'atr_max_pct': 0.12666257153698818, 'tp_mult': 1.926585344886737, 'tsl_mult': 0.08489269450031285, 'strategy': 'mean_reversion', 'time_stop': 218, 'use_sma': False, 'use_atr': True, 'use_adx': False, 'use_ema': False, 'use_spike': False, 'rsi_required': True, 'edge_k': 0.5149453219808973, 'edge_cap': 0.7032620177072372, 'bull_strategy': 'breakout', 'bull_bb_std_mult': 2.8987275690534022, 'bull_rsi_os': 7, 'bull_rsi_ob': 79, 'bull_adx_thresh': 18.309202451090467, 'bull_atr_min_pct': 0.02035440241124313, 'bull_atr_max_pct': 0.07851086454999504, 'bull_tp_mult': 1.0691694690296338, 'bull_tsl_mult': 0.25014123587611553, 'bull_time_stop': 98, 'bull_use_sma': True, 'bull_use_ema': True, 'bull_use_atr': True, 'bull_use_adx': False, 'bull_use_spike': False, 'bull_rsi_required': False, 'bear_strategy': 'breakout', 'bear_bb_std_mult': 2.9261540219352526, 'bear_rsi_os': 29, 'bear_rsi_ob': 72, 'bear_adx_thresh': 26.292527092358018, 'bear_atr_min_pct': 0.027471038484779945, 'bear_atr_max_pct': 0.09236326331528207, 'bear_tp_mult': 2.8119109710281673, 'bear_tsl_mult': 0.14051994073953775, 'bear_time_stop': 239, 'bear_use_sma': True, 'bear_use_ema': True, 'bear_use_atr': True, 'bear_use_adx': True, 'bear_use_spike': True, 'bear_rsi_required': True, 'sideways_strategy': 'mean_reversion', 'sideways_bb_std_mult': 3.594592345949382, 'sideways_rsi_os': 33, 'sideways_rsi_ob': 88, 'sideways_adx_thresh': 13.360002769121191, 'sideways_atr_min_pct': 0.017758793458312265, 'sideways_atr_max_pct': 0.12666142950696094, 'sideways_tp_mult': 1.4544346740507976, 'sideways_tsl_mult': 0.6321338915348468, 'sideways_time_stop': 204, 'sideways_use_sma': True, 'sideways_use_ema': False, 'sideways_use_atr': False, 'sideways_use_adx': False, 'sideways_use_spike': True, 'sideways_rsi_required': True}.
[I 2025-08-31 12:27:16,426] Trial 269 finished with values: [-1000000000.0, 1000000000.0] and parameters: {'p_sma': 55, 'p_std': 30, 'p_atr': 28, 'p_adx': 15, 'rsi_period': 79, 'ema1': 5, 'ema2': 17, 'slip_atr_k': 0.015758580775443648, 'slip_spread_k': 0.6776455414522775, 'spread_hl_frac': 0.029424039133663295, 'bb_std_mult': 1.6684948135984914, 'rsi_os': 37, 'rsi_ob': 76, 'vol_spike': 0.0698319917898445, 'adx_thresh': 21.440166776414465, 'atr_min_pct': 0.0021613995105440576, 'atr_max_pct': 0.12919455604776353, 'tp_mult': 1.4139486564002424, 'tsl_mult': 0.053810420192960486, 'strategy': 'mean_reversion', 'time_stop': 214, 'use_sma': False, 'use_atr': True, 'use_adx': False, 'use_ema': False, 'use_spike': False, 'rsi_required': True, 'edge_k': 0.7459172074759667, 'edge_cap': 0.6993132138676632, 'bull_strategy': 'breakout', 'bull_bb_std_mult': 2.900675753174531, 'bull_rsi_os': 10, 'bull_rsi_ob': 81, 'bull_adx_thresh': 9.993741321652065, 'bull_atr_min_pct': 0.02032963151033334, 'bull_atr_max_pct': 0.07964331280287695, 'bull_tp_mult': 2.6832166937108872, 'bull_tsl_mult': 0.2571124317045275, 'bull_time_stop': 188, 'bull_use_sma': True, 'bull_use_ema': True, 'bull_use_atr': True, 'bull_use_adx': True, 'bull_use_spike': False, 'bull_rsi_required': False, 'bear_strategy': 'breakout', 'bear_bb_std_mult': 2.9090637709780904, 'bear_rsi_os': 31, 'bear_rsi_ob': 74, 'bear_adx_thresh': 31.586901774484264, 'bear_atr_min_pct': 0.02651002202613133, 'bear_atr_max_pct': 0.09389884156065582, 'bear_tp_mult': 2.809511717781964, 'bear_tsl_mult': 0.13599426149351707, 'bear_time_stop': 238, 'bear_use_sma': True, 'bear_use_ema': True, 'bear_use_atr': True, 'bear_use_adx': True, 'bear_use_spike': False, 'bear_rsi_required': True, 'sideways_strategy': 'mean_reversion', 'sideways_bb_std_mult': 3.5919381849828675, 'sideways_rsi_os': 33, 'sideways_rsi_ob': 88, 'sideways_adx_thresh': 13.856829086143755, 'sideways_atr_min_pct': 0.0004596473422967873, 'sideways_atr_max_pct': 0.12071267369212563, 'sideways_tp_mult': 1.449550635876365, 'sideways_tsl_mult': 0.6005673001770551, 'sideways_time_stop': 226, 'sideways_use_sma': True, 'sideways_use_ema': False, 'sideways_use_atr': False, 'sideways_use_adx': False, 'sideways_use_spike': False, 'sideways_rsi_required': True}.
[I 2025-08-31 12:27:16,546] Trial 270 finished with values: [-1000000000.0, 1000000000.0] and parameters: {'p_sma': 54, 'p_std': 30, 'p_atr': 21, 'p_adx': 8, 'rsi_period': 78, 'ema1': 5, 'ema2': 17, 'slip_atr_k': 0.021674054775662054, 'slip_spread_k': 0.6817767589569703, 'spread_hl_frac': 0.029515654106589604, 'bb_std_mult': 1.6815963439151076, 'rsi_os': 40, 'rsi_ob': 70, 'vol_spike': 0.07105162779837097, 'adx_thresh': 21.273020847245366, 'atr_min_pct': 0.002374841082896766, 'atr_max_pct': 0.1292180355282334, 'tp_mult': 1.5337997173876974, 'tsl_mult': 0.05584798521879592, 'strategy': 'mean_reversion', 'time_stop': 215, 'use_sma': False, 'use_atr': True, 'use_adx': False, 'use_ema': True, 'use_spike': False, 'rsi_required': True, 'edge_k': 0.7337726099873915, 'edge_cap': 0.6492168574091104, 'bull_strategy': 'breakout', 'bull_bb_std_mult': 2.860501363878331, 'bull_rsi_os': 10, 'bull_rsi_ob': 81, 'bull_adx_thresh': 9.140770903186022, 'bull_atr_min_pct': 0.020368762498398696, 'bull_atr_max_pct': 0.09933354060843894, 'bull_tp_mult': 2.9746332338013453, 'bull_tsl_mult': 0.26144205635510387, 'bull_time_stop': 184, 'bull_use_sma': True, 'bull_use_ema': True, 'bull_use_atr': True, 'bull_use_adx': True, 'bull_use_spike': True, 'bull_rsi_required': False, 'bear_strategy': 'breakout', 'bear_bb_std_mult': 3.354196649844104, 'bear_rsi_os': 29, 'bear_rsi_ob': 74, 'bear_adx_thresh': 31.702886300810277, 'bear_atr_min_pct': 0.024219954149000016, 'bear_atr_max_pct': 0.09468029716263869, 'bear_tp_mult': 2.815660919365336, 'bear_tsl_mult': 0.1267967057694393, 'bear_time_stop': 239, 'bear_use_sma': True, 'bear_use_ema': True, 'bear_use_atr': True, 'bear_use_adx': True, 'bear_use_spike': False, 'bear_rsi_required': True, 'sideways_strategy': 'mean_reversion', 'sideways_bb_std_mult': 3.5445223209580403, 'sideways_rsi_os': 33, 'sideways_rsi_ob': 90, 'sideways_adx_thresh': 13.446722355657466, 'sideways_atr_min_pct': 0.028522945607223172, 'sideways_atr_max_pct': 0.12270813214491587, 'sideways_tp_mult': 1.4478661898697072, 'sideways_tsl_mult': 0.6097539316632157, 'sideways_time_stop': 205, 'sideways_use_sma': True, 'sideways_use_ema': False, 'sideways_use_atr': False, 'sideways_use_adx': True, 'sideways_use_spike': False, 'sideways_rsi_required': True}.
