[I 2025-08-31 13:08:10,418] Trial 575 finished with values: [-1000000000.0, 1000000000.0] and parameters: {'p_sma': 10, 'p_std': 23, 'p_atr': 12, 'p_adx': 14, 'rsi_period': 49, 'ema1': 12, 'ema2': 11, 'slip_atr_k': 0.06399218323699586, 'slip_spread_k': 0.4476701862191107, 'spread_hl_frac': 0.03489798581814048, 'bb_std_mult': 2.2625499718814175, 'rsi_os': 37, 'rsi_ob': 54, 'vol_spike': 0.018619185279364087, 'adx_thresh': 21.456700102910805, 'atr_min_pct': 0.0017011675752241077, 'atr_max_pct': 0.05708643441278116, 'tp_mult': 1.3780219567143992, 'tsl_mult': 0.030390605114872772, 'strategy': 'breakout', 'time_stop': 234, 'use_sma': True, 'use_atr': True, 'use_adx': False, 'use_ema': True, 'use_spike': True, 'rsi_required': True, 'edge_k': 0.7465240953879159, 'edge_cap': 0.6950145517833649, 'bull_strategy': 'breakout', 'bull_bb_std_mult': 1.8745861331039384, 'bull_rsi_os': 7, 'bull_rsi_ob': 51, 'bull_adx_thresh': 18.099914429064604, 'bull_atr_min_pct': 0.019152370186175237, 'bull_atr_max_pct': 0.149961054109453, 'bull_tp_mult': 1.2589985366250218, 'bull_tsl_mult': 0.16595510994832863, 'bull_time_stop': 294, 'bull_use_sma': True, 'bull_use_ema': False, 'bull_use_atr': False, 'bull_use_adx': True, 'bull_use_spike': True, 'bull_rsi_required': False, 'bear_strategy': 'breakout', 'bear_bb_std_mult': 3.026368244800625, 'bear_rsi_os': 41, 'bear_rsi_ob': 73, 'bear_adx_thresh': 14.150609603404083, 'bear_atr_min_pct': 0.023692384298326534, 'bear_atr_max_pct': 0.025207233044404358, 'bear_tp_mult': 2.9182306606763606, 'bear_tsl_mult': 0.8884023180103402, 'bear_time_stop': 182, 'bear_use_sma': True, 'bear_use_ema': True, 'bear_use_atr': True, 'bear_use_adx': True, 'bear_use_spike': False, 'bear_rsi_required': True, 'sideways_strategy': 'breakout', 'sideways_bb_std_mult': 2.700214198541567, 'sideways_rsi_os': 30, 'sideways_rsi_ob': 71, 'sideways_adx_thresh': 27.35591517474732, 'sideways_atr_min_pct': 0.015849458969625536, 'sideways_atr_max_pct': 0.0966504094736336, 'sideways_tp_mult': 2.1045299043675643, 'sideways_tsl_mult': 0.9700091678475882, 'sideways_time_stop': 179, 'sideways_use_sma': True, 'sideways_use_ema': True, 'sideways_use_atr': False, 'sideways_use_adx': True, 'sideways_use_spike': False, 'sideways_rsi_required': False}.
[I 2025-08-31 13:08:10,814] Trial 574 finished with values: [-1000000000.0, 1000000000.0] and parameters: {'p_sma': 19, 'p_std': 23, 'p_atr': 12, 'p_adx': 14, 'rsi_period': 63, 'ema1': 12, 'ema2': 11, 'slip_atr_k': 0.2101775646265876, 'slip_spread_k': 0.922362927805072, 'spread_hl_frac': 0.016254936342778612, 'bb_std_mult': 2.3459463515427474, 'rsi_os': 37, 'rsi_ob': 77, 'vol_spike': 0.024867657255472672, 'adx_thresh': 21.32338018643175, 'atr_min_pct': 0.0030945642387268943, 'atr_max_pct': 0.05126980302278061, 'tp_mult': 1.421118638977188, 'tsl_mult': 0.01982131344745319, 'strategy': 'breakout', 'time_stop': 266, 'use_sma': False, 'use_atr': True, 'use_adx': True, 'use_ema': True, 'use_spike': False, 'rsi_required': True, 'edge_k': 0.6414264630669084, 'edge_cap': 0.6867719368002646, 'bull_strategy': 'breakout', 'bull_bb_std_mult': 1.1061776571968527, 'bull_rsi_os': 34, 'bull_rsi_ob': 88, 'bull_adx_thresh': 18.28391135374116, 'bull_atr_min_pct': 0.02042806491373587, 'bull_atr_max_pct': 0.1434980413364118, 'bull_tp_mult': 1.7344066121481942, 'bull_tsl_mult': 0.7008406499763598, 'bull_time_stop': 295, 'bull_use_sma': True, 'bull_use_ema': True, 'bull_use_atr': False, 'bull_use_adx': True, 'bull_use_spike': True, 'bull_rsi_required': True, 'bear_strategy': 'breakout', 'bear_bb_std_mult': 1.9322748848104312, 'bear_rsi_os': 29, 'bear_rsi_ob': 74, 'bear_adx_thresh': 14.387825569177755, 'bear_atr_min_pct': 0.006319228384222582, 'bear_atr_max_pct': 0.12497822159868596, 'bear_tp_mult': 1.0824633937919557, 'bear_tsl_mult': 0.8911363444794905, 'bear_time_stop': 160, 'bear_use_sma': True, 'bear_use_ema': True, 'bear_use_atr': False, 'bear_use_adx': False, 'bear_use_spike': False, 'bear_rsi_required': True, 'sideways_strategy': 'breakout', 'sideways_bb_std_mult': 2.617816591465311, 'sideways_rsi_os': 19, 'sideways_rsi_ob': 63, 'sideways_adx_thresh': 28.613840219105477, 'sideways_atr_min_pct': 0.008091511456433637, 'sideways_atr_max_pct': 0.08741059579136815, 'sideways_tp_mult': 1.5858796996684041, 'sideways_tsl_mult': 0.27001039145748984, 'sideways_time_stop': 274, 'sideways_use_sma': True, 'sideways_use_ema': True, 'sideways_use_atr': True, 'sideways_use_adx': True, 'sideways_use_spike': False, 'sideways_rsi_required': False}.
[I 2025-08-31 13:08:43,997] Trial 580 finished with values: [-1000000000.0, 1000000000.0] and parameters: {'p_sma': 19, 'p_std': 26, 'p_atr': 16, 'p_adx': 15, 'rsi_period': 58, 'ema1': 21, 'ema2': 53, 'slip_atr_k': 0.07559022396149323, 'slip_spread_k': 0.3774441421645973, 'spread_hl_frac': 0.022632093942530986, 'bb_std_mult': 2.4906806951402496, 'rsi_os': 40, 'rsi_ob': 78, 'vol_spike': 0.03346983443235603, 'adx_thresh': 20.11443345797896, 'atr_min_pct': 0.005172130790791457, 'atr_max_pct': 0.11915218764834287, 'tp_mult': 2.2034070154472594, 'tsl_mult': 0.6359212067426905, 'strategy': 'breakout', 'time_stop': 292, 'use_sma': False, 'use_atr': True, 'use_adx': False, 'use_ema': True, 'use_spike': False, 'rsi_required': True, 'edge_k': 0.6251313121594783, 'edge_cap': 0.7294584759651689, 'bull_strategy': 'mean_reversion', 'bull_bb_std_mult': 2.610902018127984, 'bull_rsi_os': 19, 'bull_rsi_ob': 48, 'bull_adx_thresh': 17.552323141568646, 'bull_atr_min_pct': 0.012696429786004635, 'bull_atr_max_pct': 0.14703385384063436, 'bull_tp_mult': 1.5943187081963317, 'bull_tsl_mult': 0.21721554154223355, 'bull_time_stop': 239, 'bull_use_sma': True, 'bull_use_ema': True, 'bull_use_atr': False, 'bull_use_adx': True, 'bull_use_spike': False, 'bull_rsi_required': False, 'bear_strategy': 'breakout', 'bear_bb_std_mult': 3.219656272216236, 'bear_rsi_os': 5, 'bear_rsi_ob': 70, 'bear_adx_thresh': 15.280287669381119, 'bear_atr_min_pct': 0.0018631635728577228, 'bear_atr_max_pct': 0.0754486878944096, 'bear_tp_mult': 2.87498713861159, 'bear_tsl_mult': 0.7631265474264626, 'bear_time_stop': 196, 'bear_use_sma': True, 'bear_use_ema': True, 'bear_use_atr': True, 'bear_use_adx': True, 'bear_use_spike': True, 'bear_rsi_required': True, 'sideways_strategy': 'mean_reversion', 'sideways_bb_std_mult': 2.7540205120721066, 'sideways_rsi_os': 33, 'sideways_rsi_ob': 91, 'sideways_adx_thresh': 26.17384112439058, 'sideways_atr_min_pct': 0.003304098700296536, 'sideways_atr_max_pct': 0.12898724512470075, 'sideways_tp_mult': 1.5639542819495624, 'sideways_tsl_mult': 0.37011227815485337, 'sideways_time_stop': 188, 'sideways_use_sma': False, 'sideways_use_ema': False, 'sideways_use_atr': False, 'sideways_use_adx': False, 'sideways_use_spike': False, 'sideways_rsi_required': True}.
[I 2025-08-31 13:08:44,150] Trial 578 finished with values: [-1000000000.0, 1000000000.0] and parameters: {'p_sma': 10, 'p_std': 23, 'p_atr': 12, 'p_adx': 8, 'rsi_period': 38, 'ema1': 12, 'ema2': 60, 'slip_atr_k': 0.20984563634396572, 'slip_spread_k': 0.8087390176725078, 'spread_hl_frac': 0.04039788659334616, 'bb_std_mult': 2.1559408708910612, 'rsi_os': 39, 'rsi_ob': 82, 'vol_spike': 0.1860741045143512, 'adx_thresh': 34.97492797097712, 'atr_min_pct': 0.0007874096013083295, 'atr_max_pct': 0.015702071576473395, 'tp_mult': 2.8416370027364044, 'tsl_mult': 0.6432329219597002, 'strategy': 'breakout', 'time_stop': 47, 'use_sma': False, 'use_atr': True, 'use_adx': False, 'use_ema': True, 'use_spike': False, 'rsi_required': True, 'edge_k': 0.837873604577569, 'edge_cap': 0.6972432639216729, 'bull_strategy': 'breakout', 'bull_bb_std_mult': 2.7580824628062426, 'bull_rsi_os': 6, 'bull_rsi_ob': 54, 'bull_adx_thresh': 15.20482394913115, 'bull_atr_min_pct': 0.028919157690419216, 'bull_atr_max_pct': 0.14679152702443787, 'bull_tp_mult': 1.357375333808632, 'bull_tsl_mult': 0.39999484268701024, 'bull_time_stop': 157, 'bull_use_sma': True, 'bull_use_ema': True, 'bull_use_atr': False, 'bull_use_adx': True, 'bull_use_spike': True, 'bull_rsi_required': False, 'bear_strategy': 'breakout', 'bear_bb_std_mult': 3.0405435390817424, 'bear_rsi_os': 27, 'bear_rsi_ob': 89, 'bear_adx_thresh': 15.02086824954944, 'bear_atr_min_pct': 0.0035991709971610122, 'bear_atr_max_pct': 0.04516487513648621, 'bear_tp_mult': 2.8048893537613595, 'bear_tsl_mult': 0.7552794673702068, 'bear_time_stop': 72, 'bear_use_sma': True, 'bear_use_ema': True, 'bear_use_atr': True, 'bear_use_adx': True, 'bear_use_spike': False, 'bear_rsi_required': True, 'sideways_strategy': 'breakout', 'sideways_bb_std_mult': 2.72425522905379, 'sideways_rsi_os': 30, 'sideways_rsi_ob': 71, 'sideways_adx_thresh': 26.163029818017158, 'sideways_atr_min_pct': 0.007872122328082085, 'sideways_atr_max_pct': 0.13555294903361514, 'sideways_tp_mult': 1.0312604585398863, 'sideways_tsl_mult': 0.8813458733805191, 'sideways_time_stop': 158, 'sideways_use_sma': True, 'sideways_use_ema': False, 'sideways_use_atr': False, 'sideways_use_adx': True, 'sideways_use_spike': False, 'sideways_rsi_required': True}.
[I 2025-08-31 13:08:44,427] Trial 581 finished with values: [-1000000000.0, 1000000000.0] and parameters: {'p_sma': 56, 'p_std': 35, 'p_atr': 29, 'p_adx': 15, 'rsi_period': 56, 'ema1': 21, 'ema2': 45, 'slip_atr_k': 0.17683582702757225, 'slip_spread_k': 0.4216063964409005, 'spread_hl_frac': 0.022549380182663878, 'bb_std_mult': 3.0330990358896757, 'rsi_os': 11, 'rsi_ob': 82, 'vol_spike': 0.04609084714120647, 'adx_thresh': 20.219544944635736, 'atr_min_pct': 0.0007747067139575391, 'atr_max_pct': 0.12029217252676606, 'tp_mult': 2.8313979364236306, 'tsl_mult': 0.5982656627037933, 'strategy': 'breakout', 'time_stop': 32, 'use_sma': False, 'use_atr': False, 'use_adx': False, 'use_ema': True, 'use_spike': False, 'rsi_required': True, 'edge_k': 0.7058259699153545, 'edge_cap': 0.4999052891721488, 'bull_strategy': 'mean_reversion', 'bull_bb_std_mult': 2.6135654185297077, 'bull_rsi_os': 19, 'bull_rsi_ob': 60, 'bull_adx_thresh': 17.64943429107607, 'bull_atr_min_pct': 0.012673969798116004, 'bull_atr_max_pct': 0.14657184280138924, 'bull_tp_mult': 1.395910608449365, 'bull_tsl_mult': 0.3462176144282323, 'bull_time_stop': 258, 'bull_use_sma': True, 'bull_use_ema': True, 'bull_use_atr': False, 'bull_use_adx': True, 'bull_use_spike': False, 'bull_rsi_required': False, 'bear_strategy': 'breakout', 'bear_bb_std_mult': 0.5035672721120084, 'bear_rsi_os': 5, 'bear_rsi_ob': 70, 'bear_adx_thresh': 15.275656446660816, 'bear_atr_min_pct': 1.258066036098019e-05, 'bear_atr_max_pct': 0.0463295884513672, 'bear_tp_mult': 2.479430738442667, 'bear_tsl_mult': 0.8253865401449079, 'bear_time_stop': 212, 'bear_use_sma': True, 'bear_use_ema': True, 'bear_use_atr': True, 'bear_use_adx': True, 'bear_use_spike': True, 'bear_rsi_required': True, 'sideways_strategy': 'mean_reversion', 'sideways_bb_std_mult': 2.729097300814268, 'sideways_rsi_os': 33, 'sideways_rsi_ob': 68, 'sideways_adx_thresh': 26.30509372271261, 'sideways_atr_min_pct': 0.002408863895664592, 'sideways_atr_max_pct': 0.0416130624594721, 'sideways_tp_mult': 1.6237872604563786, 'sideways_tsl_mult': 0.8892053990489927, 'sideways_time_stop': 261, 'sideways_use_sma': False, 'sideways_use_ema': False, 'sideways_use_atr': False, 'sideways_use_adx': False, 'sideways_use_spike': False, 'sideways_rsi_required': True}.
[I 2025-08-31 13:08:44,641] Trial 579 finished with values: [-1000000000.0, 1000000000.0] and parameters: {'p_sma': 29, 'p_std': 23, 'p_atr': 12, 'p_adx': 8, 'rsi_period': 38, 'ema1': 20, 'ema2': 45, 'slip_atr_k': 0.04934226028066096, 'slip_spread_k': 0.3810509830153883, 'spread_hl_frac': 0.016130858062345776, 'bb_std_mult': 2.1504066192375135, 'rsi_os': 40, 'rsi_ob': 50, 'vol_spike': 0.04606294536395658, 'adx_thresh': 8.455002217506548, 'atr_min_pct': 0.01786444373956441, 'atr_max_pct': 0.1240397672833802, 'tp_mult': 2.2889091082943445, 'tsl_mult': 0.03434960635219954, 'strategy': 'breakout', 'time_stop': 292, 'use_sma': False, 'use_atr': True, 'use_adx': False, 'use_ema': True, 'use_spike': False, 'rsi_required': True, 'edge_k': 1.03324581370931, 'edge_cap': 0.7299039676243535, 'bull_strategy': 'breakout', 'bull_bb_std_mult': 1.3607473399770376, 'bull_rsi_os': 18, 'bull_rsi_ob': 49, 'bull_adx_thresh': 18.139147760950177, 'bull_atr_min_pct': 0.012191864756552238, 'bull_atr_max_pct': 0.040761050206026515, 'bull_tp_mult': 1.3992999349041941, 'bull_tsl_mult': 0.6939610041733761, 'bull_time_stop': 258, 'bull_use_sma': True, 'bull_use_ema': True, 'bull_use_atr': False, 'bull_use_adx': True, 'bull_use_spike': False, 'bull_rsi_required': False, 'bear_strategy': 'breakout', 'bear_bb_std_mult': 3.02967614583303, 'bear_rsi_os': 27, 'bear_rsi_ob': 68, 'bear_adx_thresh': 14.93535091289958, 'bear_atr_min_pct': 0.0018483059587603835, 'bear_atr_max_pct': 0.12561794497968984, 'bear_tp_mult': 2.9245107817080815, 'bear_tsl_mult': 0.747192727652765, 'bear_time_stop': 158, 'bear_use_sma': True, 'bear_use_ema': True, 'bear_use_atr': True, 'bear_use_adx': True, 'bear_use_spike': True, 'bear_rsi_required': True, 'sideways_strategy': 'breakout', 'sideways_bb_std_mult': 2.723646347963226, 'sideways_rsi_os': 33, 'sideways_rsi_ob': 68, 'sideways_adx_thresh': 26.431621307347033, 'sideways_atr_min_pct': 0.014127902690657106, 'sideways_atr_max_pct': 0.12954573721913437, 'sideways_tp_mult': 1.6047977591548275, 'sideways_tsl_mult': 0.273386998580886, 'sideways_time_stop': 191, 'sideways_use_sma': True, 'sideways_use_ema': True, 'sideways_use_atr': False, 'sideways_use_adx': False, 'sideways_use_spike': False, 'sideways_rsi_required': True}.
[I 2025-08-31 13:09:19,934] Trial 584 finished with values: [-1000000000.0, 1000000000.0] and parameters: {'p_sma': 12, 'p_std': 48, 'p_atr': 13, 'p_adx': 28, 'rsi_period': 51, 'ema1': 20, 'ema2': 25, 'slip_atr_k': 0.04965649431860121, 'slip_spread_k': 0.9846192141284651, 'spread_hl_frac': 0.017557281255978097, 'bb_std_mult': 2.397642488733006, 'rsi_os': 35, 'rsi_ob': 51, 'vol_spike': 0.014323475429734398, 'adx_thresh': 19.287328308159267, 'atr_min_pct': 0.02533378290054326, 'atr_max_pct': 0.12385504095782475, 'tp_mult': 2.585136754050885, 'tsl_mult': 0.04252578862282651, 'strategy': 'breakout', 'time_stop': 169, 'use_sma': False, 'use_atr': True, 'use_adx': False, 'use_ema': True, 'use_spike': False, 'rsi_required': True, 'edge_k': 0.5806870506576214, 'edge_cap': 0.3956913607303052, 'bull_strategy': 'breakout', 'bull_bb_std_mult': 0.9418414763372498, 'bull_rsi_os': 30, 'bull_rsi_ob': 49, 'bull_adx_thresh': 19.24855974390801, 'bull_atr_min_pct': 0.00510596972489826, 'bull_atr_max_pct': 0.053203453369361955, 'bull_tp_mult': 1.2123301326987446, 'bull_tsl_mult': 0.5621482004262048, 'bull_time_stop': 285, 'bull_use_sma': False, 'bull_use_ema': True, 'bull_use_atr': True, 'bull_use_adx': False, 'bull_use_spike': False, 'bull_rsi_required': False, 'bear_strategy': 'breakout', 'bear_bb_std_mult': 2.074193540767185, 'bear_rsi_os': 28, 'bear_rsi_ob': 71, 'bear_adx_thresh': 13.476952062227637, 'bear_atr_min_pct': 0.0027673007044235055, 'bear_atr_max_pct': 0.11958040475490506, 'bear_tp_mult': 2.9614851452983615, 'bear_tsl_mult': 0.7912890561772945, 'bear_time_stop': 197, 'bear_use_sma': False, 'bear_use_ema': True, 'bear_use_atr': True, 'bear_use_adx': True, 'bear_use_spike': True, 'bear_rsi_required': True, 'sideways_strategy': 'breakout', 'sideways_bb_std_mult': 3.1054448361422424, 'sideways_rsi_os': 21, 'sideways_rsi_ob': 70, 'sideways_adx_thresh': 25.491086594468705, 'sideways_atr_min_pct': 0.0015118002932519073, 'sideways_atr_max_pct': 0.08217249851254745, 'sideways_tp_mult': 2.5732101954362574, 'sideways_tsl_mult': 0.8628251265762249, 'sideways_time_stop': 224, 'sideways_use_sma': True, 'sideways_use_ema': False, 'sideways_use_atr': False, 'sideways_use_adx': False, 'sideways_use_spike': True, 'sideways_rsi_required': True}.
[I 2025-08-31 13:09:20,113] Trial 583 finished with values: [-1000000000.0, 1000000000.0] and parameters: {'p_sma': 60, 'p_std': 21, 'p_atr': 11, 'p_adx': 15, 'rsi_period': 51, 'ema1': 28, 'ema2': 17, 'slip_atr_k': 0.15915103568985545, 'slip_spread_k': 0.0750934395784979, 'spread_hl_frac': 0.017308058968337175, 'bb_std_mult': 2.947763492863431, 'rsi_os': 40, 'rsi_ob': 52, 'vol_spike': 0.2236276370226487, 'adx_thresh': 10.604804318476896, 'atr_min_pct': 0.0024436866421787408, 'atr_max_pct': 0.1462042668583302, 'tp_mult': 2.106301297519848, 'tsl_mult': 0.00031885005189283624, 'strategy': 'breakout', 'time_stop': 162, 'use_sma': False, 'use_atr': False, 'use_adx': False, 'use_ema': True, 'use_spike': False, 'rsi_required': True, 'edge_k': 1.0207337323353376, 'edge_cap': 0.5039446279604938, 'bull_strategy': 'breakout', 'bull_bb_std_mult': 1.371627047120668, 'bull_rsi_os': 30, 'bull_rsi_ob': 49, 'bull_adx_thresh': 19.07013545625589, 'bull_atr_min_pct': 0.005214747586188482, 'bull_atr_max_pct': 0.05455059845155069, 'bull_tp_mult': 1.1458741755407957, 'bull_tsl_mult': 0.3515837834350994, 'bull_time_stop': 283, 'bull_use_sma': True, 'bull_use_ema': True, 'bull_use_atr': True, 'bull_use_adx': False, 'bull_use_spike': False, 'bull_rsi_required': False, 'bear_strategy': 'breakout', 'bear_bb_std_mult': 0.5164796630760842, 'bear_rsi_os': 29, 'bear_rsi_ob': 71, 'bear_adx_thresh': 13.236181476087316, 'bear_atr_min_pct': 0.021841681679972382, 'bear_atr_max_pct': 0.11718447054412598, 'bear_tp_mult': 2.4799986128869493, 'bear_tsl_mult': 0.7856711436575602, 'bear_time_stop': 211, 'bear_use_sma': True, 'bear_use_ema': True, 'bear_use_atr': True, 'bear_use_adx': True, 'bear_use_spike': True, 'bear_rsi_required': True, 'sideways_strategy': 'breakout', 'sideways_bb_std_mult': 2.631730168735219, 'sideways_rsi_os': 51, 'sideways_rsi_ob': 59, 'sideways_adx_thresh': 25.010848876229165, 'sideways_atr_min_pct': 0.014213948433527511, 'sideways_atr_max_pct': 0.02102483517020208, 'sideways_tp_mult': 1.6049199491084665, 'sideways_tsl_mult': 0.9013116804545195, 'sideways_time_stop': 192, 'sideways_use_sma': True, 'sideways_use_ema': False, 'sideways_use_atr': False, 'sideways_use_adx': False, 'sideways_use_spike': True, 'sideways_rsi_required': True}.
[I 2025-08-31 13:09:20,522] Trial 585 finished with values: [-1000000000.0, 1000000000.0] and parameters: {'p_sma': 44, 'p_std': 25, 'p_atr': 17, 'p_adx': 16, 'rsi_period': 55, 'ema1': 19, 'ema2': 15, 'slip_atr_k': 0.06720828343532241, 'slip_spread_k': 0.9905263711366168, 'spread_hl_frac': 0.01739963763474051, 'bb_std_mult': 0.6311900007626965, 'rsi_os': 26, 'rsi_ob': 79, 'vol_spike': 0.032084978235224826, 'adx_thresh': 30.953167975278824, 'atr_min_pct': 0.0020250858432981555, 'atr_max_pct': 0.04029508118859627, 'tp_mult': 2.664563502138032, 'tsl_mult': 0.546633510468966, 'strategy': 'breakout', 'time_stop': 170, 'use_sma': False, 'use_atr': False, 'use_adx': False, 'use_ema': True, 'use_spike': False, 'rsi_required': False, 'edge_k': 0.44452902993949883, 'edge_cap': 0.40120671605806796, 'bull_strategy': 'breakout', 'bull_bb_std_mult': 0.9414710493715892, 'bull_rsi_os': 5, 'bull_rsi_ob': 50, 'bull_adx_thresh': 19.119461105004188, 'bull_atr_min_pct': 0.020113455322278567, 'bull_atr_max_pct': 0.05478756232618709, 'bull_tp_mult': 1.2219539944404012, 'bull_tsl_mult': 0.5075217185370442, 'bull_time_stop': 285, 'bull_use_sma': False, 'bull_use_ema': True, 'bull_use_atr': True, 'bull_use_adx': False, 'bull_use_spike': False, 'bull_rsi_required': False, 'bear_strategy': 'mean_reversion', 'bear_bb_std_mult': 1.2930178329969337, 'bear_rsi_os': 29, 'bear_rsi_ob': 71, 'bear_adx_thresh': 22.43459473313725, 'bear_atr_min_pct': 0.02178538895201513, 'bear_atr_max_pct': 0.11631366289943376, 'bear_tp_mult': 2.8712612959204398, 'bear_tsl_mult': 0.03971950027652521, 'bear_time_stop': 202, 'bear_use_sma': False, 'bear_use_ema': False, 'bear_use_atr': True, 'bear_use_adx': True, 'bear_use_spike': True, 'bear_rsi_required': False, 'sideways_strategy': 'breakout', 'sideways_bb_std_mult': 2.6012321417150854, 'sideways_rsi_os': 13, 'sideways_rsi_ob': 77, 'sideways_adx_thresh': 25.270509481152, 'sideways_atr_min_pct': 0.0017233514864044683, 'sideways_atr_max_pct': 0.02123451975519769, 'sideways_tp_mult': 1.537147634949623, 'sideways_tsl_mult': 0.7775540298229183, 'sideways_time_stop': 227, 'sideways_use_sma': True, 'sideways_use_ema': False, 'sideways_use_atr': False, 'sideways_use_adx': False, 'sideways_use_spike': True, 'sideways_rsi_required': True}.
