[I 2025-08-31 13:45:13,727] Trial 844 finished with values: [-0.1436373235048466, 0.14299111604052894] and parameters: {'p_sma': 28, 'p_std': 24, 'p_atr': 18, 'p_adx': 27, 'rsi_period': 33, 'ema1': 6, 'ema2': 58, 'slip_atr_k': 0.21558557217159896, 'slip_spread_k': 0.4416205426602512, 'spread_hl_frac': 0.021324132947829234, 'bb_std_mult': 1.855064673342762, 'rsi_os': 39, 'rsi_ob': 59, 'vol_spike': 0.02357588435421718, 'adx_thresh': 27.302276058581228, 'atr_min_pct': 0.02632877288080763, 'atr_max_pct': 0.060151909054590544, 'tp_mult': 2.3211945124986513, 'tsl_mult': 0.691600285066151, 'strategy': 'breakout', 'time_stop': 164, 'use_sma': False, 'use_atr': False, 'use_adx': True, 'use_ema': False, 'use_spike': True, 'rsi_required': False, 'edge_k': 1.0404597706141705, 'edge_cap': 0.710705594619607, 'bull_strategy': 'mean_reversion', 'bull_bb_std_mult': 1.162974163996034, 'bull_rsi_os': 5, 'bull_rsi_ob': 85, 'bull_adx_thresh': 19.992328691018283, 'bull_atr_min_pct': 0.021740789774863514, 'bull_atr_max_pct': 0.1440776038273498, 'bull_tp_mult': 2.199273291055905, 'bull_tsl_mult': 0.30562969633534487, 'bull_time_stop': 186, 'bull_use_sma': True, 'bull_use_ema': True, 'bull_use_atr': True, 'bull_use_adx': True, 'bull_use_spike': True, 'bull_rsi_required': True, 'bear_strategy': 'breakout', 'bear_bb_std_mult': 3.587295431085593, 'bear_rsi_os': 52, 'bear_rsi_ob': 45, 'bear_adx_thresh': 19.32902326256373, 'bear_atr_min_pct': 0.0018731247325413562, 'bear_atr_max_pct': 0.06822044912090908, 'bear_tp_mult': 2.518038584872005, 'bear_tsl_mult': 0.6790401118493612, 'bear_time_stop': 97, 'bear_use_sma': False, 'bear_use_ema': True, 'bear_use_atr': False, 'bear_use_adx': False, 'bear_use_spike': True, 'bear_rsi_required': True, 'sideways_strategy': 'mean_reversion', 'sideways_bb_std_mult': 2.9816090382161597, 'sideways_rsi_os': 28, 'sideways_rsi_ob': 65, 'sideways_adx_thresh': 29.658838868718224, 'sideways_atr_min_pct': 0.02750958454917471, 'sideways_atr_max_pct': 0.1476453817518096, 'sideways_tp_mult': 1.6511322130394253, 'sideways_tsl_mult': 0.31182957549263246, 'sideways_time_stop': 44, 'sideways_use_sma': False, 'sideways_use_ema': True, 'sideways_use_atr': True, 'sideways_use_adx': True, 'sideways_use_spike': False, 'sideways_rsi_required': True}.
[I 2025-08-31 13:45:46,213] Trial 850 finished with values: [-1000000000.0, 1000000000.0] and parameters: {'p_sma': 41, 'p_std': 43, 'p_atr': 16, 'p_adx': 14, 'rsi_period': 48, 'ema1': 13, 'ema2': 39, 'slip_atr_k': 0.051256232877362515, 'slip_spread_k': 0.4059769549840332, 'spread_hl_frac': 0.01824732474191621, 'bb_std_mult': 2.1771956211653576, 'rsi_os': 26, 'rsi_ob': 85, 'vol_spike': 0.004937028389979281, 'adx_thresh': 5.556617543879092, 'atr_min_pct': 0.026060540366445964, 'atr_max_pct': 0.030960068424292303, 'tp_mult': 2.6058105042109347, 'tsl_mult': 0.36950475961884666, 'strategy': 'mean_reversion', 'time_stop': 131, 'use_sma': True, 'use_atr': False, 'use_adx': True, 'use_ema': True, 'use_spike': True, 'rsi_required': False, 'edge_k': 0.5880702624290326, 'edge_cap': 0.23849320067184698, 'bull_strategy': 'mean_reversion', 'bull_bb_std_mult': 2.5750077859669664, 'bull_rsi_os': 7, 'bull_rsi_ob': 84, 'bull_adx_thresh': 19.20407217860903, 'bull_atr_min_pct': 0.010326237220893103, 'bull_atr_max_pct': 0.010364031330115792, 'bull_tp_mult': 2.3505583334971956, 'bull_tsl_mult': 0.09405665996005691, 'bull_time_stop': 174, 'bull_use_sma': True, 'bull_use_ema': False, 'bull_use_atr': True, 'bull_use_adx': False, 'bull_use_spike': True, 'bull_rsi_required': True, 'bear_strategy': 'breakout', 'bear_bb_std_mult': 0.5527215353322215, 'bear_rsi_os': 27, 'bear_rsi_ob': 73, 'bear_adx_thresh': 18.181348345426297, 'bear_atr_min_pct': 0.016817864560925013, 'bear_atr_max_pct': 0.12398139901465972, 'bear_tp_mult': 1.037666482936089, 'bear_tsl_mult': 0.522428951790376, 'bear_time_stop': 195, 'bear_use_sma': False, 'bear_use_ema': False, 'bear_use_atr': False, 'bear_use_adx': False, 'bear_use_spike': False, 'bear_rsi_required': False, 'sideways_strategy': 'breakout', 'sideways_bb_std_mult': 2.273152692964253, 'sideways_rsi_os': 30, 'sideways_rsi_ob': 67, 'sideways_adx_thresh': 24.62073459526719, 'sideways_atr_min_pct': 0.00446744845996094, 'sideways_atr_max_pct': 0.14512219388711808, 'sideways_tp_mult': 2.5406700757570646, 'sideways_tsl_mult': 0.8527251862136598, 'sideways_time_stop': 37, 'sideways_use_sma': False, 'sideways_use_ema': False, 'sideways_use_atr': True, 'sideways_use_adx': True, 'sideways_use_spike': False, 'sideways_rsi_required': True}.
[I 2025-08-31 13:45:46,685] Trial 849 finished with values: [-1000000000.0, 1000000000.0] and parameters: {'p_sma': 34, 'p_std': 39, 'p_atr': 21, 'p_adx': 14, 'rsi_period': 48, 'ema1': 13, 'ema2': 25, 'slip_atr_k': 0.05110431289102699, 'slip_spread_k': 0.3380563539949647, 'spread_hl_frac': 0.02349094269176848, 'bb_std_mult': 2.0978770572702485, 'rsi_os': 19, 'rsi_ob': 66, 'vol_spike': 0.0235812981258368, 'adx_thresh': 30.25762682595643, 'atr_min_pct': 0.02764801863126986, 'atr_max_pct': 0.03180832916741809, 'tp_mult': 2.6148719010807353, 'tsl_mult': 0.37251369046850114, 'strategy': 'breakout', 'time_stop': 182, 'use_sma': True, 'use_atr': False, 'use_adx': True, 'use_ema': True, 'use_spike': True, 'rsi_required': False, 'edge_k': 0.47616183622147223, 'edge_cap': 0.24830903526816472, 'bull_strategy': 'mean_reversion', 'bull_bb_std_mult': 1.1753296022465975, 'bull_rsi_os': 6, 'bull_rsi_ob': 71, 'bull_adx_thresh': 17.804704411854793, 'bull_atr_min_pct': 0.020443527836697496, 'bull_atr_max_pct': 0.13629558047795964, 'bull_tp_mult': 2.3543792134592096, 'bull_tsl_mult': 0.3025262793341796, 'bull_time_stop': 162, 'bull_use_sma': True, 'bull_use_ema': True, 'bull_use_atr': True, 'bull_use_adx': True, 'bull_use_spike': True, 'bull_rsi_required': True, 'bear_strategy': 'breakout', 'bear_bb_std_mult': 1.3513814767077184, 'bear_rsi_os': 19, 'bear_rsi_ob': 79, 'bear_adx_thresh': 20.79623525476647, 'bear_atr_min_pct': 3.189060414824415e-05, 'bear_atr_max_pct': 0.06835350422965308, 'bear_tp_mult': 2.450300781176275, 'bear_tsl_mult': 0.5149334184048528, 'bear_time_stop': 116, 'bear_use_sma': False, 'bear_use_ema': True, 'bear_use_atr': False, 'bear_use_adx': False, 'bear_use_spike': False, 'bear_rsi_required': False, 'sideways_strategy': 'breakout', 'sideways_bb_std_mult': 1.564112953431637, 'sideways_rsi_os': 29, 'sideways_rsi_ob': 61, 'sideways_adx_thresh': 24.507469868446773, 'sideways_atr_min_pct': 0.0022699257975950463, 'sideways_atr_max_pct': 0.14482789081665454, 'sideways_tp_mult': 1.20785391622371, 'sideways_tsl_mult': 0.5562644408539261, 'sideways_time_stop': 46, 'sideways_use_sma': False, 'sideways_use_ema': False, 'sideways_use_atr': True, 'sideways_use_adx': True, 'sideways_use_spike': False, 'sideways_rsi_required': True}.
[I 2025-08-31 13:45:47,334] Trial 847 finished with values: [-0.17083682784049958, 0.17031115746180428] and parameters: {'p_sma': 40, 'p_std': 18, 'p_atr': 18, 'p_adx': 14, 'rsi_period': 42, 'ema1': 16, 'ema2': 48, 'slip_atr_k': 0.05076264632218393, 'slip_spread_k': 0.3400722151527282, 'spread_hl_frac': 0.03234091772175132, 'bb_std_mult': 2.1161511248327716, 'rsi_os': 27, 'rsi_ob': 85, 'vol_spike': 0.022849484428025025, 'adx_thresh': 5.719279864266841, 'atr_min_pct': 0.0289509254947183, 'atr_max_pct': 0.04328336153374027, 'tp_mult': 1.2401912391526349, 'tsl_mult': 0.8140432492784881, 'strategy': 'breakout', 'time_stop': 61, 'use_sma': True, 'use_atr': False, 'use_adx': True, 'use_ema': False, 'use_spike': True, 'rsi_required': False, 'edge_k': 0.5646019647519883, 'edge_cap': 0.6858541853062546, 'bull_strategy': 'mean_reversion', 'bull_bb_std_mult': 3.1782862557682345, 'bull_rsi_os': 36, 'bull_rsi_ob': 84, 'bull_adx_thresh': 32.89817833565853, 'bull_atr_min_pct': 0.020558168579706097, 'bull_atr_max_pct': 0.14441250670106093, 'bull_tp_mult': 2.2842516369358585, 'bull_tsl_mult': 0.2251423990808128, 'bull_time_stop': 187, 'bull_use_sma': True, 'bull_use_ema': False, 'bull_use_atr': True, 'bull_use_adx': False, 'bull_use_spike': True, 'bull_rsi_required': True, 'bear_strategy': 'breakout', 'bear_bb_std_mult': 3.5692240718990798, 'bear_rsi_os': 52, 'bear_rsi_ob': 86, 'bear_adx_thresh': 20.929131702426123, 'bear_atr_min_pct': 0.0004984510956342007, 'bear_atr_max_pct': 0.052406551706524, 'bear_tp_mult': 2.454554525129406, 'bear_tsl_mult': 0.7240591686820985, 'bear_time_stop': 195, 'bear_use_sma': False, 'bear_use_ema': True, 'bear_use_atr': False, 'bear_use_adx': False, 'bear_use_spike': True, 'bear_rsi_required': True, 'sideways_strategy': 'mean_reversion', 'sideways_bb_std_mult': 2.249546462026722, 'sideways_rsi_os': 17, 'sideways_rsi_ob': 65, 'sideways_adx_thresh': 24.291149873879945, 'sideways_atr_min_pct': 0.020712146442123342, 'sideways_atr_max_pct': 0.14329867211771372, 'sideways_tp_mult': 1.299706954404376, 'sideways_tsl_mult': 0.4314690281899947, 'sideways_time_stop': 36, 'sideways_use_sma': False, 'sideways_use_ema': True, 'sideways_use_atr': True, 'sideways_use_adx': True, 'sideways_use_spike': False, 'sideways_rsi_required': True}.
[I 2025-08-31 13:45:47,559] Trial 848 finished with values: [-1000000000.0, 1000000000.0] and parameters: {'p_sma': 40, 'p_std': 40, 'p_atr': 21, 'p_adx': 14, 'rsi_period': 84, 'ema1': 13, 'ema2': 17, 'slip_atr_k': 0.22743843020649876, 'slip_spread_k': 0.9388074111929388, 'spread_hl_frac': 0.0014944520416833862, 'bb_std_mult': 2.108769348821359, 'rsi_os': 19, 'rsi_ob': 66, 'vol_spike': 0.006688208262418921, 'adx_thresh': 27.16271892769153, 'atr_min_pct': 0.025232476817669554, 'atr_max_pct': 0.03190145942926056, 'tp_mult': 1.6123041128173714, 'tsl_mult': 0.7342203023826203, 'strategy': 'breakout', 'time_stop': 113, 'use_sma': True, 'use_atr': False, 'use_adx': True, 'use_ema': False, 'use_spike': True, 'rsi_required': False, 'edge_k': 0.5619474119192704, 'edge_cap': 0.6879422381407299, 'bull_strategy': 'mean_reversion', 'bull_bb_std_mult': 2.8145258169759235, 'bull_rsi_os': 16, 'bull_rsi_ob': 85, 'bull_adx_thresh': 19.30821539072363, 'bull_atr_min_pct': 0.020645904440420484, 'bull_atr_max_pct': 0.03960540034437775, 'bull_tp_mult': 2.3414030129319974, 'bull_tsl_mult': 0.3107265283102835, 'bull_time_stop': 159, 'bull_use_sma': True, 'bull_use_ema': True, 'bull_use_atr': True, 'bull_use_adx': True, 'bull_use_spike': True, 'bull_rsi_required': True, 'bear_strategy': 'breakout', 'bear_bb_std_mult': 1.4804148653227627, 'bear_rsi_os': 27, 'bear_rsi_ob': 76, 'bear_adx_thresh': 19.616863488427708, 'bear_atr_min_pct': 2.46903741557196e-05, 'bear_atr_max_pct': 0.12535556288410554, 'bear_tp_mult': 2.5095161971794546, 'bear_tsl_mult': 0.5216751575696935, 'bear_time_stop': 104, 'bear_use_sma': False, 'bear_use_ema': True, 'bear_use_atr': False, 'bear_use_adx': False, 'bear_use_spike': False, 'bear_rsi_required': False, 'sideways_strategy': 'mean_reversion', 'sideways_bb_std_mult': 2.8186597722848012, 'sideways_rsi_os': 40, 'sideways_rsi_ob': 61, 'sideways_adx_thresh': 24.366453913598065, 'sideways_atr_min_pct': 0.020689731905189086, 'sideways_atr_max_pct': 0.14314636861765978, 'sideways_tp_mult': 2.116732374695716, 'sideways_tsl_mult': 0.18333951823243783, 'sideways_time_stop': 36, 'sideways_use_sma': False, 'sideways_use_ema': True, 'sideways_use_atr': True, 'sideways_use_adx': True, 'sideways_use_spike': False, 'sideways_rsi_required': True}.
[I 2025-08-31 13:45:48,668] Trial 854 finished with values: [-1000000000.0, 1000000000.0] and parameters: {'p_sma': 44, 'p_std': 22, 'p_atr': 10, 'p_adx': 12, 'rsi_period': 49, 'ema1': 10, 'ema2': 19, 'slip_atr_k': 0.08782694673315064, 'slip_spread_k': 0.4152659800372441, 'spread_hl_frac': 0.018257442733837347, 'bb_std_mult': 2.241809200082435, 'rsi_os': 53, 'rsi_ob': 87, 'vol_spike': 0.25803111930393563, 'adx_thresh': 6.855199084410838, 'atr_min_pct': 0.010709743830368436, 'atr_max_pct': 0.05235550299443668, 'tp_mult': 2.459167398338027, 'tsl_mult': 0.8488111083702217, 'strategy': 'mean_reversion', 'time_stop': 146, 'use_sma': False, 'use_atr': False, 'use_adx': True, 'use_ema': True, 'use_spike': True, 'rsi_required': False, 'edge_k': 1.7937852977964823, 'edge_cap': 0.671718378561405, 'bull_strategy': 'mean_reversion', 'bull_bb_std_mult': 1.3222384662461608, 'bull_rsi_os': 38, 'bull_rsi_ob': 85, 'bull_adx_thresh': 18.077549717135128, 'bull_atr_min_pct': 0.0019217459833880957, 'bull_atr_max_pct': 0.14134204677314194, 'bull_tp_mult': 2.4031164122310575, 'bull_tsl_mult': 0.4075731672416891, 'bull_time_stop': 248, 'bull_use_sma': True, 'bull_use_ema': True, 'bull_use_atr': True, 'bull_use_adx': True, 'bull_use_spike': True, 'bull_rsi_required': True, 'bear_strategy': 'breakout', 'bear_bb_std_mult': 3.3273256122803523, 'bear_rsi_os': 29, 'bear_rsi_ob': 88, 'bear_adx_thresh': 19.76638277507108, 'bear_atr_min_pct': 0.0011475776077194662, 'bear_atr_max_pct': 0.02287300625134743, 'bear_tp_mult': 2.07741458061973, 'bear_tsl_mult': 0.7070979991194832, 'bear_time_stop': 148, 'bear_use_sma': False, 'bear_use_ema': False, 'bear_use_atr': False, 'bear_use_adx': False, 'bear_use_spike': True, 'bear_rsi_required': True, 'sideways_strategy': 'breakout', 'sideways_bb_std_mult': 3.1588894002977757, 'sideways_rsi_os': 32, 'sideways_rsi_ob': 67, 'sideways_adx_thresh': 20.383009412550155, 'sideways_atr_min_pct': 0.002915219108737812, 'sideways_atr_max_pct': 0.14998874948326935, 'sideways_tp_mult': 1.7651291829627493, 'sideways_tsl_mult': 0.7448363734019118, 'sideways_time_stop': 48, 'sideways_use_sma': False, 'sideways_use_ema': False, 'sideways_use_atr': True, 'sideways_use_adx': True, 'sideways_use_spike': False, 'sideways_rsi_required': False}.
[I 2025-08-31 13:46:19,615] Trial 853 finished with values: [-0.03348434433728653, 0.03334294242223538] and parameters: {'p_sma': 17, 'p_std': 21, 'p_atr': 28, 'p_adx': 9, 'rsi_period': 49, 'ema1': 10, 'ema2': 17, 'slip_atr_k': 0.2330660673791931, 'slip_spread_k': 0.30323824216361317, 'spread_hl_frac': 0.018048312468483214, 'bb_std_mult': 2.2204935312805802, 'rsi_os': 38, 'rsi_ob': 63, 'vol_spike': 0.18371946560125202, 'adx_thresh': 6.763276072098513, 'atr_min_pct': 0.02517837462972668, 'atr_max_pct': 0.14732279744435445, 'tp_mult': 2.4801263459403686, 'tsl_mult': 0.8548486177789664, 'strategy': 'breakout', 'time_stop': 111, 'use_sma': False, 'use_atr': False, 'use_adx': True, 'use_ema': True, 'use_spike': True, 'rsi_required': False, 'edge_k': 0.658721800240317, 'edge_cap': 0.6748813355400359, 'bull_strategy': 'mean_reversion', 'bull_bb_std_mult': 2.7956608632875297, 'bull_rsi_os': 5, 'bull_rsi_ob': 86, 'bull_adx_thresh': 18.37369096489839, 'bull_atr_min_pct': 0.021083667944800603, 'bull_atr_max_pct': 0.048107285891395186, 'bull_tp_mult': 1.621630816416745, 'bull_tsl_mult': 0.2532938723768745, 'bull_time_stop': 160, 'bull_use_sma': True, 'bull_use_ema': True, 'bull_use_atr': True, 'bull_use_adx': True, 'bull_use_spike': True, 'bull_rsi_required': True, 'bear_strategy': 'breakout', 'bear_bb_std_mult': 3.3592099224256238, 'bear_rsi_os': 29, 'bear_rsi_ob': 69, 'bear_adx_thresh': 18.703750655596902, 'bear_atr_min_pct': 0.0025244985019880163, 'bear_atr_max_pct': 0.12661628938461883, 'bear_tp_mult': 1.8653003415312126, 'bear_tsl_mult': 0.3690377989030562, 'bear_time_stop': 177, 'bear_use_sma': False, 'bear_use_ema': False, 'bear_use_atr': False, 'bear_use_adx': False, 'bear_use_spike': True, 'bear_rsi_required': True, 'sideways_strategy': 'breakout', 'sideways_bb_std_mult': 3.136955622784252, 'sideways_rsi_os': 48, 'sideways_rsi_ob': 58, 'sideways_adx_thresh': 20.337883360834432, 'sideways_atr_min_pct': 0.0030541967067400336, 'sideways_atr_max_pct': 0.14992013570496282, 'sideways_tp_mult': 1.7105659090721554, 'sideways_tsl_mult': 0.8268883768216552, 'sideways_time_stop': 48, 'sideways_use_sma': False, 'sideways_use_ema': False, 'sideways_use_atr': True, 'sideways_use_adx': True, 'sideways_use_spike': False, 'sideways_rsi_required': False}.
[I 2025-08-31 13:46:20,533] Trial 851 finished with values: [-1000000000.0, 1000000000.0] and parameters: {'p_sma': 44, 'p_std': 9, 'p_atr': 9, 'p_adx': 9, 'rsi_period': 49, 'ema1': 8, 'ema2': 20, 'slip_atr_k': 0.022172348189862454, 'slip_spread_k': 0.30032680730932365, 'spread_hl_frac': 0.017735895301148538, 'bb_std_mult': 2.1014969246199766, 'rsi_os': 53, 'rsi_ob': 84, 'vol_spike': 0.18909316516133348, 'adx_thresh': 9.920095809055505, 'atr_min_pct': 0.028686545814330375, 'atr_max_pct': 0.051294717478623054, 'tp_mult': 2.483013411260708, 'tsl_mult': 0.7353172897864304, 'strategy': 'breakout', 'time_stop': 114, 'use_sma': True, 'use_atr': False, 'use_adx': True, 'use_ema': True, 'use_spike': True, 'rsi_required': False, 'edge_k': 0.6562728990768587, 'edge_cap': 0.6854265850111293, 'bull_strategy': 'mean_reversion', 'bull_bb_std_mult': 2.789246014830021, 'bull_rsi_os': 14, 'bull_rsi_ob': 86, 'bull_adx_thresh': 17.889781389871057, 'bull_atr_min_pct': 0.012097399299841808, 'bull_atr_max_pct': 0.04854019842927723, 'bull_tp_mult': 2.4132052565694835, 'bull_tsl_mult': 0.24192024454035416, 'bull_time_stop': 159, 'bull_use_sma': True, 'bull_use_ema': True, 'bull_use_atr': True, 'bull_use_adx': True, 'bull_use_spike': True, 'bull_rsi_required': True, 'bear_strategy': 'breakout', 'bear_bb_std_mult': 0.7718181636417354, 'bear_rsi_os': 29, 'bear_rsi_ob': 88, 'bear_adx_thresh': 20.890575663949132, 'bear_atr_min_pct': 0.0027671222363031666, 'bear_atr_max_pct': 0.07413446100585938, 'bear_tp_mult': 2.294849208371952, 'bear_tsl_mult': 0.7141432421079627, 'bear_time_stop': 183, 'bear_use_sma': False, 'bear_use_ema': True, 'bear_use_atr': False, 'bear_use_adx': False, 'bear_use_spike': False, 'bear_rsi_required': True, 'sideways_strategy': 'breakout', 'sideways_bb_std_mult': 2.794884463771111, 'sideways_rsi_os': 15, 'sideways_rsi_ob': 66, 'sideways_adx_thresh': 25.812809226498416, 'sideways_atr_min_pct': 0.0021855302375897384, 'sideways_atr_max_pct': 0.09001583020976882, 'sideways_tp_mult': 1.8163657369777968, 'sideways_tsl_mult': 0.8370301849684555, 'sideways_time_stop': 288, 'sideways_use_sma': False, 'sideways_use_ema': False, 'sideways_use_atr': True, 'sideways_use_adx': True, 'sideways_use_spike': False, 'sideways_rsi_required': False}.
[I 2025-08-31 13:46:21,435] Trial 852 finished with values: [-0.08360663801104562, 0.08280760866280466] and parameters: {'p_sma': 39, 'p_std': 22, 'p_atr': 7, 'p_adx': 14, 'rsi_period': 29, 'ema1': 27, 'ema2': 47, 'slip_atr_k': 0.22610564327350743, 'slip_spread_k': 0.4101080490334032, 'spread_hl_frac': 0.01794619840800503, 'bb_std_mult': 2.2413877760917855, 'rsi_os': 53, 'rsi_ob': 63, 'vol_spike': 0.2603208656023629, 'adx_thresh': 9.544281044114223, 'atr_min_pct': 0.007272376329321549, 'atr_max_pct': 0.14710161161190768, 'tp_mult': 2.4696954333509376, 'tsl_mult': 0.8496851072608566, 'strategy': 'breakout', 'time_stop': 224, 'use_sma': False, 'use_atr': False, 'use_adx': True, 'use_ema': True, 'use_spike': True, 'rsi_required': False, 'edge_k': 1.3268289489271448, 'edge_cap': 0.6848823152103625, 'bull_strategy': 'mean_reversion', 'bull_bb_std_mult': 2.133691756874508, 'bull_rsi_os': 5, 'bull_rsi_ob': 64, 'bull_adx_thresh': 33.003413895562645, 'bull_atr_min_pct': 0.0027860624770970083, 'bull_atr_max_pct': 0.028397328728835124, 'bull_tp_mult': 1.5688765275353644, 'bull_tsl_mult': 0.2431714120909998, 'bull_time_stop': 216, 'bull_use_sma': True, 'bull_use_ema': True, 'bull_use_atr': True, 'bull_use_adx': True, 'bull_use_spike': True, 'bull_rsi_required': True, 'bear_strategy': 'breakout', 'bear_bb_std_mult': 1.1971678948703997, 'bear_rsi_os': 29, 'bear_rsi_ob': 95, 'bear_adx_thresh': 20.905413740849205, 'bear_atr_min_pct': 0.0011613699070719837, 'bear_atr_max_pct': 0.12016103289020329, 'bear_tp_mult': 2.279033689722857, 'bear_tsl_mult': 0.720155237408499, 'bear_time_stop': 176, 'bear_use_sma': False, 'bear_use_ema': True, 'bear_use_atr': False, 'bear_use_adx': False, 'bear_use_spike': True, 'bear_rsi_required': True, 'sideways_strategy': 'breakout', 'sideways_bb_std_mult': 3.1553450275199584, 'sideways_rsi_os': 31, 'sideways_rsi_ob': 58, 'sideways_adx_thresh': 20.333350851645495, 'sideways_atr_min_pct': 0.0032196089353835194, 'sideways_atr_max_pct': 0.02065622789520448, 'sideways_tp_mult': 1.7045213890529431, 'sideways_tsl_mult': 0.8248895020216511, 'sideways_time_stop': 35, 'sideways_use_sma': False, 'sideways_use_ema': False, 'sideways_use_atr': True, 'sideways_use_adx': True, 'sideways_use_spike': False, 'sideways_rsi_required': False}.
