[I 2025-08-31 12:01:38,512] Trial 61 finished with values: [-1000000000.0, 1000000000.0] and parameters: {'p_sma': 11, 'p_std': 14, 'p_atr': 10, 'p_adx': 16, 'rsi_period': 41, 'ema1': 10, 'ema2': 18, 'slip_atr_k': 0.0860308530845165, 'slip_spread_k': 0.8317173250680314, 'spread_hl_frac': 0.0007772494929876965, 'bb_std_mult': 2.0880527319875752, 'rsi_os': 49, 'rsi_ob': 88, 'vol_spike': 0.007133020585964378, 'adx_thresh': 17.851812892420682, 'atr_min_pct': 0.008780636860402768, 'atr_max_pct': 0.06034657629325085, 'tp_mult': 1.7470471319409164, 'tsl_mult': 0.20144445546590206, 'strategy': 'mean_reversion', 'time_stop': 196, 'use_sma': False, 'use_atr': False, 'use_adx': True, 'use_ema': True, 'use_spike': True, 'rsi_required': False, 'edge_k': 0.5458985601180428, 'edge_cap': 0.9663239181569172, 'bull_strategy': 'breakout', 'bull_bb_std_mult': 0.5194422293356851, 'bull_rsi_os': 29, 'bull_rsi_ob': 52, 'bull_adx_thresh': 16.398049986947495, 'bull_atr_min_pct': 0.022123998530286473, 'bull_atr_max_pct': 0.11298045605403845, 'bull_tp_mult': 1.4480998529687683, 'bull_tsl_mult': 0.6978512410521398, 'bull_time_stop': 230, 'bull_use_sma': True, 'bull_use_ema': True, 'bull_use_atr': True, 'bull_use_adx': True, 'bull_use_spike': True, 'bull_rsi_required': True, 'bear_strategy': 'breakout', 'bear_bb_std_mult': 0.8199027377621495, 'bear_rsi_os': 16, 'bear_rsi_ob': 91, 'bear_adx_thresh': 30.57553053302658, 'bear_atr_min_pct': 0.0033897749331599433, 'bear_atr_max_pct': 0.0797664298323063, 'bear_tp_mult': 1.7530625944446876, 'bear_tsl_mult': 0.7597083795880695, 'bear_time_stop': 193, 'bear_use_sma': True, 'bear_use_ema': False, 'bear_use_atr': True, 'bear_use_adx': True, 'bear_use_spike': False, 'bear_rsi_required': True, 'sideways_strategy': 'breakout', 'sideways_bb_std_mult': 0.644191276240718, 'sideways_rsi_os': 41, 'sideways_rsi_ob': 90, 'sideways_adx_thresh': 16.294992256125273, 'sideways_atr_min_pct': 0.008797982232128847, 'sideways_atr_max_pct': 0.04725664743766758, 'sideways_tp_mult': 1.9644328138347773, 'sideways_tsl_mult': 0.5633855573159037, 'sideways_time_stop': 59, 'sideways_use_sma': True, 'sideways_use_ema': True, 'sideways_use_atr': False, 'sideways_use_adx': True, 'sideways_use_spike': True, 'sideways_rsi_required': False}.
[I 2025-08-31 12:01:39,612] Trial 64 finished with values: [-0.12796170407331486, 0.12780838374289968] and parameters: {'p_sma': 44, 'p_std': 14, 'p_atr': 8, 'p_adx': 23, 'rsi_period': 39, 'ema1': 10, 'ema2': 17, 'slip_atr_k': 0.15614811892246241, 'slip_spread_k': 0.6425820494515406, 'spread_hl_frac': 0.017075082526852307, 'bb_std_mult': 2.7420341999144497, 'rsi_os': 30, 'rsi_ob': 88, 'vol_spike': 0.10153317393891076, 'adx_thresh': 23.822031644284507, 'atr_min_pct': 0.01823463420387502, 'atr_max_pct': 0.02974456181228257, 'tp_mult': 1.9628631045447624, 'tsl_mult': 0.1957604124666239, 'strategy': 'mean_reversion', 'time_stop': 28, 'use_sma': False, 'use_atr': False, 'use_adx': True, 'use_ema': True, 'use_spike': True, 'rsi_required': True, 'edge_k': 1.124302824681983, 'edge_cap': 0.4589489942288936, 'bull_strategy': 'breakout', 'bull_bb_std_mult': 1.469556636074231, 'bull_rsi_os': 19, 'bull_rsi_ob': 74, 'bull_adx_thresh': 33.79134708876518, 'bull_atr_min_pct': 0.02165232014202672, 'bull_atr_max_pct': 0.07558653444296935, 'bull_tp_mult': 1.4178457758893153, 'bull_tsl_mult': 0.8983483838046781, 'bull_time_stop': 287, 'bull_use_sma': False, 'bull_use_ema': True, 'bull_use_atr': False, 'bull_use_adx': False, 'bull_use_spike': True, 'bull_rsi_required': True, 'bear_strategy': 'breakout', 'bear_bb_std_mult': 0.8537132414671218, 'bear_rsi_os': 13, 'bear_rsi_ob': 95, 'bear_adx_thresh': 15.01400190055097, 'bear_atr_min_pct': 0.013898429174308303, 'bear_atr_max_pct': 0.07975150735372676, 'bear_tp_mult': 1.9399581426080967, 'bear_tsl_mult': 0.4049168601496382, 'bear_time_stop': 157, 'bear_use_sma': True, 'bear_use_ema': True, 'bear_use_atr': True, 'bear_use_adx': True, 'bear_use_spike': False, 'bear_rsi_required': True, 'sideways_strategy': 'breakout', 'sideways_bb_std_mult': 0.5760240972067914, 'sideways_rsi_os': 41, 'sideways_rsi_ob': 87, 'sideways_adx_thresh': 15.949910357685178, 'sideways_atr_min_pct': 0.0016215432017793667, 'sideways_atr_max_pct': 0.061131802303983414, 'sideways_tp_mult': 2.2427241602231973, 'sideways_tsl_mult': 0.9441136736509566, 'sideways_time_stop': 207, 'sideways_use_sma': False, 'sideways_use_ema': False, 'sideways_use_atr': False, 'sideways_use_adx': True, 'sideways_use_spike': True, 'sideways_rsi_required': False}.
[I 2025-08-31 12:01:39,781] Trial 65 finished with values: [-1000000000.0, 1000000000.0] and parameters: {'p_sma': 43, 'p_std': 14, 'p_atr': 9, 'p_adx': 8, 'rsi_period': 53, 'ema1': 14, 'ema2': 12, 'slip_atr_k': 0.03559809911888622, 'slip_spread_k': 0.20767649218231948, 'spread_hl_frac': 0.00031046741133543276, 'bb_std_mult': 2.9905585569219326, 'rsi_os': 26, 'rsi_ob': 52, 'vol_spike': 0.2796070326154801, 'adx_thresh': 17.964837251342715, 'atr_min_pct': 0.011787586774538257, 'atr_max_pct': 0.04121066237395712, 'tp_mult': 1.9170049669570686, 'tsl_mult': 0.2672546915529488, 'strategy': 'mean_reversion', 'time_stop': 173, 'use_sma': False, 'use_atr': True, 'use_adx': False, 'use_ema': False, 'use_spike': True, 'rsi_required': True, 'edge_k': 1.144101587592933, 'edge_cap': 0.450469236321062, 'bull_strategy': 'breakout', 'bull_bb_std_mult': 1.4878210567513854, 'bull_rsi_os': 20, 'bull_rsi_ob': 73, 'bull_adx_thresh': 13.154676368471304, 'bull_atr_min_pct': 0.021231384662556623, 'bull_atr_max_pct': 0.07429805202916119, 'bull_tp_mult': 1.0957375875923052, 'bull_tsl_mult': 0.26474790297615636, 'bull_time_stop': 286, 'bull_use_sma': False, 'bull_use_ema': True, 'bull_use_atr': False, 'bull_use_adx': False, 'bull_use_spike': True, 'bull_rsi_required': True, 'bear_strategy': 'breakout', 'bear_bb_std_mult': 2.1093593397470674, 'bear_rsi_os': 31, 'bear_rsi_ob': 85, 'bear_adx_thresh': 15.384771589448556, 'bear_atr_min_pct': 0.019646395562627976, 'bear_atr_max_pct': 0.05408067757736059, 'bear_tp_mult': 2.0318372675672585, 'bear_tsl_mult': 0.6752753720889454, 'bear_time_stop': 157, 'bear_use_sma': True, 'bear_use_ema': True, 'bear_use_atr': False, 'bear_use_adx': True, 'bear_use_spike': False, 'bear_rsi_required': True, 'sideways_strategy': 'breakout', 'sideways_bb_std_mult': 0.5231311368776148, 'sideways_rsi_os': 41, 'sideways_rsi_ob': 86, 'sideways_adx_thresh': 16.854535216039725, 'sideways_atr_min_pct': 0.008170158988286411, 'sideways_atr_max_pct': 0.1113909673371819, 'sideways_tp_mult': 1.239889254304165, 'sideways_tsl_mult': 0.931839841792854, 'sideways_time_stop': 16, 'sideways_use_sma': False, 'sideways_use_ema': False, 'sideways_use_atr': False, 'sideways_use_adx': True, 'sideways_use_spike': True, 'sideways_rsi_required': False}.
[I 2025-08-31 12:02:09,146] Trial 68 finished with values: [-1000000000.0, 1000000000.0] and parameters: {'p_sma': 29, 'p_std': 39, 'p_atr': 18, 'p_adx': 8, 'rsi_period': 52, 'ema1': 14, 'ema2': 12, 'slip_atr_k': 0.20383477389807708, 'slip_spread_k': 0.2051002241531547, 'spread_hl_frac': 0.018691715099462738, 'bb_std_mult': 1.0381913018442095, 'rsi_os': 26, 'rsi_ob': 76, 'vol_spike': 0.28358742509775353, 'adx_thresh': 5.07439798463229, 'atr_min_pct': 0.014227235146417048, 'atr_max_pct': 0.04002624850163255, 'tp_mult': 2.1543201791222093, 'tsl_mult': 0.2771039889809367, 'strategy': 'breakout', 'time_stop': 125, 'use_sma': True, 'use_atr': True, 'use_adx': False, 'use_ema': False, 'use_spike': False, 'rsi_required': True, 'edge_k': 1.3073921695719153, 'edge_cap': 0.43251915113174944, 'bull_strategy': 'mean_reversion', 'bull_bb_std_mult': 1.9859897652525218, 'bull_rsi_os': 21, 'bull_rsi_ob': 80, 'bull_adx_thresh': 24.69338231109791, 'bull_atr_min_pct': 0.015658729676542374, 'bull_atr_max_pct': 0.0330179732040546, 'bull_tp_mult': 1.5176638965274156, 'bull_tsl_mult': 0.12002552649784726, 'bull_time_stop': 266, 'bull_use_sma': False, 'bull_use_ema': True, 'bull_use_atr': False, 'bull_use_adx': False, 'bull_use_spike': True, 'bull_rsi_required': True, 'bear_strategy': 'mean_reversion', 'bear_bb_std_mult': 1.956492776942818, 'bear_rsi_os': 21, 'bear_rsi_ob': 70, 'bear_adx_thresh': 33.17331335640074, 'bear_atr_min_pct': 0.019622420278025663, 'bear_atr_max_pct': 0.054673590327822826, 'bear_tp_mult': 2.02409308519256, 'bear_tsl_mult': 0.3224110924191219, 'bear_time_stop': 290, 'bear_use_sma': True, 'bear_use_ema': True, 'bear_use_atr': False, 'bear_use_adx': True, 'bear_use_spike': False, 'bear_rsi_required': False, 'sideways_strategy': 'mean_reversion', 'sideways_bb_std_mult': 1.1193852957375179, 'sideways_rsi_os': 53, 'sideways_rsi_ob': 72, 'sideways_adx_thresh': 25.079299445270845, 'sideways_atr_min_pct': 0.021289920893302644, 'sideways_atr_max_pct': 0.09695043780983038, 'sideways_tp_mult': 1.1430746012322108, 'sideways_tsl_mult': 0.7582050511946077, 'sideways_time_stop': 29, 'sideways_use_sma': False, 'sideways_use_ema': False, 'sideways_use_atr': False, 'sideways_use_adx': True, 'sideways_use_spike': False, 'sideways_rsi_required': True}.
[I 2025-08-31 12:02:09,181] Trial 67 finished with values: [-1000000000.0, 1000000000.0] and parameters: {'p_sma': 42, 'p_std': 39, 'p_atr': 8, 'p_adx': 8, 'rsi_period': 54, 'ema1': 14, 'ema2': 12, 'slip_atr_k': 0.20635130298275065, 'slip_spread_k': 0.24912480988299768, 'spread_hl_frac': 0.034735317359175004, 'bb_std_mult': 2.8971376317805344, 'rsi_os': 22, 'rsi_ob': 76, 'vol_spike': 0.19556710500839442, 'adx_thresh': 7.160844699943626, 'atr_min_pct': 0.01447042522513417, 'atr_max_pct': 0.04122888495101631, 'tp_mult': 2.153224428429876, 'tsl_mult': 0.028915226256002652, 'strategy': 'mean_reversion', 'time_stop': 173, 'use_sma': False, 'use_atr': True, 'use_adx': False, 'use_ema': False, 'use_spike': False, 'rsi_required': True, 'edge_k': 1.3040553673299566, 'edge_cap': 0.46513181215170213, 'bull_strategy': 'mean_reversion', 'bull_bb_std_mult': 1.548041915050801, 'bull_rsi_os': 19, 'bull_rsi_ob': 85, 'bull_adx_thresh': 33.61555419649803, 'bull_atr_min_pct': 0.02129836974301089, 'bull_atr_max_pct': 0.07505433975401926, 'bull_tp_mult': 1.5339116963194261, 'bull_tsl_mult': 0.0923362207924287, 'bull_time_stop': 288, 'bull_use_sma': False, 'bull_use_ema': True, 'bull_use_atr': False, 'bull_use_adx': False, 'bull_use_spike': True, 'bull_rsi_required': True, 'bear_strategy': 'mean_reversion', 'bear_bb_std_mult': 1.9847374113797394, 'bear_rsi_os': 31, 'bear_rsi_ob': 70, 'bear_adx_thresh': 15.38298341816128, 'bear_atr_min_pct': 0.01945826103333719, 'bear_atr_max_pct': 0.05567833531293467, 'bear_tp_mult': 1.9112412669929448, 'bear_tsl_mult': 0.38214106447902585, 'bear_time_stop': 298, 'bear_use_sma': True, 'bear_use_ema': True, 'bear_use_atr': False, 'bear_use_adx': True, 'bear_use_spike': False, 'bear_rsi_required': False, 'sideways_strategy': 'mean_reversion', 'sideways_bb_std_mult': 1.0660610981486287, 'sideways_rsi_os': 45, 'sideways_rsi_ob': 86, 'sideways_adx_thresh': 25.079212450866944, 'sideways_atr_min_pct': 2.2992008620402894e-05, 'sideways_atr_max_pct': 0.13598351275543105, 'sideways_tp_mult': 2.1066833735031403, 'sideways_tsl_mult': 0.2189212618728958, 'sideways_time_stop': 199, 'sideways_use_sma': False, 'sideways_use_ema': False, 'sideways_use_atr': False, 'sideways_use_adx': True, 'sideways_use_spike': False, 'sideways_rsi_required': True}.
[I 2025-08-31 12:02:09,493] Trial 66 finished with values: [-1000000000.0, 1000000000.0] and parameters: {'p_sma': 29, 'p_std': 40, 'p_atr': 9, 'p_adx': 8, 'rsi_period': 84, 'ema1': 14, 'ema2': 12, 'slip_atr_k': 0.20147847067276414, 'slip_spread_k': 0.22786806494784234, 'spread_hl_frac': 0.018456730257143956, 'bb_std_mult': 2.939627247881762, 'rsi_os': 30, 'rsi_ob': 52, 'vol_spike': 0.19541258458021246, 'adx_thresh': 5.336675936908048, 'atr_min_pct': 0.01802636468628738, 'atr_max_pct': 0.03910974910992743, 'tp_mult': 1.916057360576776, 'tsl_mult': 0.2583254577257074, 'strategy': 'mean_reversion', 'time_stop': 124, 'use_sma': False, 'use_atr': True, 'use_adx': False, 'use_ema': False, 'use_spike': False, 'rsi_required': True, 'edge_k': 1.30319837812087, 'edge_cap': 0.46139101886802014, 'bull_strategy': 'breakout', 'bull_bb_std_mult': 1.99759173038239, 'bull_rsi_os': 20, 'bull_rsi_ob': 86, 'bull_adx_thresh': 33.62457024485834, 'bull_atr_min_pct': 0.02245661519433088, 'bull_atr_max_pct': 0.0747171543053648, 'bull_tp_mult': 1.5373438422034116, 'bull_tsl_mult': 0.9089659445126949, 'bull_time_stop': 289, 'bull_use_sma': False, 'bull_use_ema': True, 'bull_use_atr': False, 'bull_use_adx': False, 'bull_use_spike': True, 'bull_rsi_required': True, 'bear_strategy': 'mean_reversion', 'bear_bb_std_mult': 0.8430206988065823, 'bear_rsi_os': 31, 'bear_rsi_ob': 84, 'bear_adx_thresh': 33.33998852334463, 'bear_atr_min_pct': 0.01992197466846914, 'bear_atr_max_pct': 0.08272760762342274, 'bear_tp_mult': 2.034045121878188, 'bear_tsl_mult': 0.32041247707323206, 'bear_time_stop': 24, 'bear_use_sma': True, 'bear_use_ema': True, 'bear_use_atr': False, 'bear_use_adx': True, 'bear_use_spike': False, 'bear_rsi_required': True, 'sideways_strategy': 'mean_reversion', 'sideways_bb_std_mult': 0.5302391808306308, 'sideways_rsi_os': 45, 'sideways_rsi_ob': 87, 'sideways_adx_thresh': 25.32612143776052, 'sideways_atr_min_pct': 0.0011935496134738025, 'sideways_atr_max_pct': 0.13574435098420515, 'sideways_tp_mult': 1.2216165191686605, 'sideways_tsl_mult': 0.22342270450316098, 'sideways_time_stop': 204, 'sideways_use_sma': False, 'sideways_use_ema': False, 'sideways_use_atr': False, 'sideways_use_adx': True, 'sideways_use_spike': True, 'sideways_rsi_required': False}.
[I 2025-08-31 12:02:09,494] Trial 69 finished with values: [-1000000000.0, 1000000000.0] and parameters: {'p_sma': 28, 'p_std': 39, 'p_atr': 17, 'p_adx': 13, 'rsi_period': 12, 'ema1': 15, 'ema2': 52, 'slip_atr_k': 0.05024440191671788, 'slip_spread_k': 0.5171350752235944, 'spread_hl_frac': 0.03454932484798404, 'bb_std_mult': 2.9456199781056114, 'rsi_os': 21, 'rsi_ob': 57, 'vol_spike': 0.25291927593318575, 'adx_thresh': 12.945946631563237, 'atr_min_pct': 0.014037230847067496, 'atr_max_pct': 0.046129491501470436, 'tp_mult': 2.5045341593811306, 'tsl_mult': 0.049812204505377655, 'strategy': 'breakout', 'time_stop': 128, 'use_sma': True, 'use_atr': True, 'use_adx': False, 'use_ema': False, 'use_spike': False, 'rsi_required': True, 'edge_k': 1.3026833847573285, 'edge_cap': 0.7255862507655543, 'bull_strategy': 'mean_reversion', 'bull_bb_std_mult': 1.6059922352856064, 'bull_rsi_os': 24, 'bull_rsi_ob': 86, 'bull_adx_thresh': 24.451210049792035, 'bull_atr_min_pct': 0.01794455710097254, 'bull_atr_max_pct': 0.06325712599409604, 'bull_tp_mult': 1.276859233867749, 'bull_tsl_mult': 0.10336228116020396, 'bull_time_stop': 299, 'bull_use_sma': False, 'bull_use_ema': True, 'bull_use_atr': False, 'bull_use_adx': False, 'bull_use_spike': False, 'bull_rsi_required': True, 'bear_strategy': 'mean_reversion', 'bear_bb_std_mult': 2.9064212105562763, 'bear_rsi_os': 21, 'bear_rsi_ob': 70, 'bear_adx_thresh': 33.3713046965717, 'bear_atr_min_pct': 0.014998781257695899, 'bear_atr_max_pct': 0.05646724474667587, 'bear_tp_mult': 1.8334385753271731, 'bear_tsl_mult': 0.5900870304802084, 'bear_time_stop': 6, 'bear_use_sma': True, 'bear_use_ema': True, 'bear_use_atr': False, 'bear_use_adx': True, 'bear_use_spike': True, 'bear_rsi_required': False, 'sideways_strategy': 'mean_reversion', 'sideways_bb_std_mult': 0.9328381558797196, 'sideways_rsi_os': 45, 'sideways_rsi_ob': 71, 'sideways_adx_thresh': 30.74019026755974, 'sideways_atr_min_pct': 0.022221882604031004, 'sideways_atr_max_pct': 0.09971837231666035, 'sideways_tp_mult': 2.04758158271451, 'sideways_tsl_mult': 0.23757160873552402, 'sideways_time_stop': 101, 'sideways_use_sma': False, 'sideways_use_ema': False, 'sideways_use_atr': False, 'sideways_use_adx': True, 'sideways_use_spike': False, 'sideways_rsi_required': True}.
[I 2025-08-31 12:02:39,834] Trial 70 finished with values: [-1000000000.0, 1000000000.0] and parameters: {'p_sma': 31, 'p_std': 46, 'p_atr': 9, 'p_adx': 13, 'rsi_period': 59, 'ema1': 29, 'ema2': 15, 'slip_atr_k': 0.019694000815283764, 'slip_spread_k': 0.5230760752742089, 'spread_hl_frac': 0.009315038473635856, 'bb_std_mult': 0.6661680733059434, 'rsi_os': 34, 'rsi_ob': 69, 'vol_spike': 0.24679678620927648, 'adx_thresh': 28.170642402744335, 'atr_min_pct': 0.028734091964234463, 'atr_max_pct': 0.050844448164814406, 'tp_mult': 2.998930995255415, 'tsl_mult': 0.40546195229532067, 'strategy': 'mean_reversion', 'time_stop': 147, 'use_sma': False, 'use_atr': False, 'use_adx': True, 'use_ema': True, 'use_spike': False, 'rsi_required': True, 'edge_k': 1.7855677952972335, 'edge_cap': 0.6515954856581251, 'bull_strategy': 'breakout', 'bull_bb_std_mult': 1.1987316602527855, 'bull_rsi_os': 13, 'bull_rsi_ob': 77, 'bull_adx_thresh': 32.365211699468865, 'bull_atr_min_pct': 0.01699694746458595, 'bull_atr_max_pct': 0.022616408301490525, 'bull_tp_mult': 2.8151277083526653, 'bull_tsl_mult': 0.7828283469462998, 'bull_time_stop': 300, 'bull_use_sma': False, 'bull_use_ema': False, 'bull_use_atr': False, 'bull_use_adx': False, 'bull_use_spike': False, 'bull_rsi_required': False, 'bear_strategy': 'mean_reversion', 'bear_bb_std_mult': 2.877643456163161, 'bear_rsi_os': 9, 'bear_rsi_ob': 49, 'bear_adx_thresh': 13.799280986900193, 'bear_atr_min_pct': 0.02763693542550888, 'bear_atr_max_pct': 0.04899153120203373, 'bear_tp_mult': 1.8337399591535561, 'bear_tsl_mult': 0.4852403109292657, 'bear_time_stop': 110, 'bear_use_sma': False, 'bear_use_ema': True, 'bear_use_atr': True, 'bear_use_adx': True, 'bear_use_spike': True, 'bear_rsi_required': False, 'sideways_strategy': 'mean_reversion', 'sideways_bb_std_mult': 0.922509416128914, 'sideways_rsi_os': 26, 'sideways_rsi_ob': 66, 'sideways_adx_thresh': 7.037820414026333, 'sideways_atr_min_pct': 0.011605756794128841, 'sideways_atr_max_pct': 0.07992922855800347, 'sideways_tp_mult': 2.908642405292771, 'sideways_tsl_mult': 0.3173778965117171, 'sideways_time_stop': 106, 'sideways_use_sma': False, 'sideways_use_ema': False, 'sideways_use_atr': False, 'sideways_use_adx': False, 'sideways_use_spike': False, 'sideways_rsi_required': True}.
[I 2025-08-31 12:02:40,318] Trial 71 finished with values: [-1000000000.0, 1000000000.0] and parameters: {'p_sma': 52, 'p_std': 9, 'p_atr': 9, 'p_adx': 19, 'rsi_period': 59, 'ema1': 15, 'ema2': 15, 'slip_atr_k': 0.05149843033722645, 'slip_spread_k': 0.46467940408208863, 'spread_hl_frac': 0.00937881743054638, 'bb_std_mult': 3.141253424457522, 'rsi_os': 30, 'rsi_ob': 69, 'vol_spike': 0.249122748469846, 'adx_thresh': 28.61624560678045, 'atr_min_pct': 0.01805926468531648, 'atr_max_pct': 0.14373571235037147, 'tp_mult': 2.5198571128518377, 'tsl_mult': 0.15869841259723605, 'strategy': 'mean_reversion', 'time_stop': 146, 'use_sma': False, 'use_atr': False, 'use_adx': True, 'use_ema': True, 'use_spike': False, 'rsi_required': True, 'edge_k': 1.476378286962151, 'edge_cap': 0.6414670154345707, 'bull_strategy': 'breakout', 'bull_bb_std_mult': 1.1803229098228685, 'bull_rsi_os': 40, 'bull_rsi_ob': 77, 'bull_adx_thresh': 31.990108642755732, 'bull_atr_min_pct': 0.01671453289538945, 'bull_atr_max_pct': 0.06394314272133908, 'bull_tp_mult': 1.2680846728900759, 'bull_tsl_mult': 0.837635773963544, 'bull_time_stop': 300, 'bull_use_sma': False, 'bull_use_ema': False, 'bull_use_atr': False, 'bull_use_adx': False, 'bull_use_spike': False, 'bull_rsi_required': False, 'bear_strategy': 'mean_reversion', 'bear_bb_std_mult': 2.5377085654827716, 'bear_rsi_os': 36, 'bear_rsi_ob': 83, 'bear_adx_thresh': 26.659632821801374, 'bear_atr_min_pct': 0.0011345736025448923, 'bear_atr_max_pct': 0.040344997357532636, 'bear_tp_mult': 1.8273411625850258, 'bear_tsl_mult': 0.93777504796114, 'bear_time_stop': 32, 'bear_use_sma': False, 'bear_use_ema': True, 'bear_use_atr': True, 'bear_use_adx': True, 'bear_use_spike': True, 'bear_rsi_required': False, 'sideways_strategy': 'mean_reversion', 'sideways_bb_std_mult': 0.9414035724863973, 'sideways_rsi_os': 19, 'sideways_rsi_ob': 49, 'sideways_adx_thresh': 30.619835035066618, 'sideways_atr_min_pct': 0.011892210056229827, 'sideways_atr_max_pct': 0.08974927964230475, 'sideways_tp_mult': 2.378606765577737, 'sideways_tsl_mult': 0.3125469788391466, 'sideways_time_stop': 227, 'sideways_use_sma': False, 'sideways_use_ema': False, 'sideways_use_atr': False, 'sideways_use_adx': False, 'sideways_use_spike': False, 'sideways_rsi_required': True}.
