[I 2025-08-31 13:24:47,189] Trial 693 finished with values: [-1000000000.0, 1000000000.0] and parameters: {'p_sma': 29, 'p_std': 21, 'p_atr': 14, 'p_adx': 13, 'rsi_period': 30, 'ema1': 16, 'ema2': 18, 'slip_atr_k': 0.04721771726084776, 'slip_spread_k': 0.43232688252108714, 'spread_hl_frac': 0.0404359341346909, 'bb_std_mult': 1.6775242492081648, 'rsi_os': 49, 'rsi_ob': 87, 'vol_spike': 0.12114883484551191, 'adx_thresh': 8.635805752258944, 'atr_min_pct': 0.02721829765452202, 'atr_max_pct': 0.033257877834782575, 'tp_mult': 2.425056174566392, 'tsl_mult': 0.6396387088371048, 'strategy': 'breakout', 'time_stop': 182, 'use_sma': False, 'use_atr': False, 'use_adx': True, 'use_ema': True, 'use_spike': True, 'rsi_required': False, 'edge_k': 0.5496171324502559, 'edge_cap': 0.6091133734756005, 'bull_strategy': 'mean_reversion', 'bull_bb_std_mult': 0.5585856562769849, 'bull_rsi_os': 26, 'bull_rsi_ob': 91, 'bull_adx_thresh': 18.816225638711668, 'bull_atr_min_pct': 0.02369047472332575, 'bull_atr_max_pct': 0.1374925264856059, 'bull_tp_mult': 2.3546156623709065, 'bull_tsl_mult': 0.2662018131851873, 'bull_time_stop': 206, 'bull_use_sma': False, 'bull_use_ema': True, 'bull_use_atr': True, 'bull_use_adx': True, 'bull_use_spike': True, 'bull_rsi_required': True, 'bear_strategy': 'mean_reversion', 'bear_bb_std_mult': 3.4287563028065504, 'bear_rsi_os': 33, 'bear_rsi_ob': 73, 'bear_adx_thresh': 22.98327046183153, 'bear_atr_min_pct': 0.0016263754099128773, 'bear_atr_max_pct': 0.12917305459056508, 'bear_tp_mult': 1.041123151643225, 'bear_tsl_mult': 0.6928618725617604, 'bear_time_stop': 197, 'bear_use_sma': False, 'bear_use_ema': False, 'bear_use_atr': False, 'bear_use_adx': False, 'bear_use_spike': True, 'bear_rsi_required': False, 'sideways_strategy': 'mean_reversion', 'sideways_bb_std_mult': 0.827544782479418, 'sideways_rsi_os': 10, 'sideways_rsi_ob': 63, 'sideways_adx_thresh': 24.05127050439176, 'sideways_atr_min_pct': 0.00427576994691458, 'sideways_atr_max_pct': 0.1430547280005683, 'sideways_tp_mult': 1.7305975715471418, 'sideways_tsl_mult': 0.8703166487362948, 'sideways_time_stop': 32, 'sideways_use_sma': False, 'sideways_use_ema': False, 'sideways_use_atr': True, 'sideways_use_adx': True, 'sideways_use_spike': False, 'sideways_rsi_required': True}.
[I 2025-08-31 13:25:19,632] Trial 697 finished with values: [-1000000000.0, 1000000000.0] and parameters: {'p_sma': 46, 'p_std': 45, 'p_atr': 15, 'p_adx': 14, 'rsi_period': 35, 'ema1': 17, 'ema2': 21, 'slip_atr_k': 0.03607771329411992, 'slip_spread_k': 0.4543965354278921, 'spread_hl_frac': 0.01680471581577788, 'bb_std_mult': 2.1425811691986336, 'rsi_os': 32, 'rsi_ob': 83, 'vol_spike': 0.02309129577815372, 'adx_thresh': 7.565419218306438, 'atr_min_pct': 0.026833886144421188, 'atr_max_pct': 0.06355491042525287, 'tp_mult': 2.499386636454686, 'tsl_mult': 0.9698145759527576, 'strategy': 'breakout', 'time_stop': 287, 'use_sma': True, 'use_atr': False, 'use_adx': True, 'use_ema': True, 'use_spike': True, 'rsi_required': False, 'edge_k': 0.5984107140635213, 'edge_cap': 0.63849899053526, 'bull_strategy': 'mean_reversion', 'bull_bb_std_mult': 3.028875090063095, 'bull_rsi_os': 5, 'bull_rsi_ob': 83, 'bull_adx_thresh': 18.612461897354198, 'bull_atr_min_pct': 0.020982245698854648, 'bull_atr_max_pct': 0.11528463455726379, 'bull_tp_mult': 2.3159801743065214, 'bull_tsl_mult': 0.3888945128526556, 'bull_time_stop': 182, 'bull_use_sma': True, 'bull_use_ema': True, 'bull_use_atr': True, 'bull_use_adx': True, 'bull_use_spike': True, 'bull_rsi_required': True, 'bear_strategy': 'mean_reversion', 'bear_bb_std_mult': 3.394215139422575, 'bear_rsi_os': 14, 'bear_rsi_ob': 69, 'bear_adx_thresh': 17.875746077580384, 'bear_atr_min_pct': 5.7049474115474516e-05, 'bear_atr_max_pct': 0.11752376214919776, 'bear_tp_mult': 1.3159366923502862, 'bear_tsl_mult': 0.715901025855132, 'bear_time_stop': 194, 'bear_use_sma': False, 'bear_use_ema': False, 'bear_use_atr': False, 'bear_use_adx': False, 'bear_use_spike': True, 'bear_rsi_required': False, 'sideways_strategy': 'breakout', 'sideways_bb_std_mult': 2.798747497980394, 'sideways_rsi_os': 29, 'sideways_rsi_ob': 66, 'sideways_adx_thresh': 24.40416653666377, 'sideways_atr_min_pct': 0.01901678066227669, 'sideways_atr_max_pct': 0.14463788954284448, 'sideways_tp_mult': 1.6745643815100801, 'sideways_tsl_mult': 0.03743140007681456, 'sideways_time_stop': 28, 'sideways_use_sma': False, 'sideways_use_ema': False, 'sideways_use_atr': True, 'sideways_use_adx': True, 'sideways_use_spike': False, 'sideways_rsi_required': False}.
[I 2025-08-31 13:25:19,829] Trial 696 finished with values: [-1000000000.0, 1000000000.0] and parameters: {'p_sma': 46, 'p_std': 45, 'p_atr': 16, 'p_adx': 14, 'rsi_period': 60, 'ema1': 12, 'ema2': 21, 'slip_atr_k': 0.03156916508123471, 'slip_spread_k': 0.46052093128591587, 'spread_hl_frac': 0.009209111788998536, 'bb_std_mult': 2.1443980703563734, 'rsi_os': 8, 'rsi_ob': 84, 'vol_spike': 0.023747737879822088, 'adx_thresh': 7.2764742222965, 'atr_min_pct': 0.026766021435391973, 'atr_max_pct': 0.05349423979848076, 'tp_mult': 2.503498943006229, 'tsl_mult': 0.9534727818586268, 'strategy': 'breakout', 'time_stop': 50, 'use_sma': True, 'use_atr': False, 'use_adx': True, 'use_ema': True, 'use_spike': True, 'rsi_required': False, 'edge_k': 0.6199241971064559, 'edge_cap': 0.6392288782299835, 'bull_strategy': 'mean_reversion', 'bull_bb_std_mult': 2.1215501181075034, 'bull_rsi_os': 5, 'bull_rsi_ob': 83, 'bull_adx_thresh': 31.446213953163866, 'bull_atr_min_pct': 0.02105407246848238, 'bull_atr_max_pct': 0.13925806452783454, 'bull_tp_mult': 2.140293544313951, 'bull_tsl_mult': 0.29361048379464855, 'bull_time_stop': 182, 'bull_use_sma': True, 'bull_use_ema': True, 'bull_use_atr': True, 'bull_use_adx': True, 'bull_use_spike': True, 'bull_rsi_required': True, 'bear_strategy': 'mean_reversion', 'bear_bb_std_mult': 3.543551309063656, 'bear_rsi_os': 27, 'bear_rsi_ob': 69, 'bear_adx_thresh': 17.91562255184527, 'bear_atr_min_pct': 0.013236424987430478, 'bear_atr_max_pct': 0.054094338193875005, 'bear_tp_mult': 1.317442399576366, 'bear_tsl_mult': 0.6069404131172105, 'bear_time_stop': 17, 'bear_use_sma': False, 'bear_use_ema': False, 'bear_use_atr': False, 'bear_use_adx': False, 'bear_use_spike': True, 'bear_rsi_required': False, 'sideways_strategy': 'breakout', 'sideways_bb_std_mult': 2.8103993800408307, 'sideways_rsi_os': 28, 'sideways_rsi_ob': 65, 'sideways_adx_thresh': 24.373690046283553, 'sideways_atr_min_pct': 0.008557468699747162, 'sideways_atr_max_pct': 0.14434549457665552, 'sideways_tp_mult': 1.698381019535335, 'sideways_tsl_mult': 0.05562764552801358, 'sideways_time_stop': 49, 'sideways_use_sma': False, 'sideways_use_ema': False, 'sideways_use_atr': True, 'sideways_use_adx': True, 'sideways_use_spike': False, 'sideways_rsi_required': False}.
[I 2025-08-31 13:25:20,152] Trial 695 finished with values: [-1000000000.0, 1000000000.0] and parameters: {'p_sma': 29, 'p_std': 45, 'p_atr': 18, 'p_adx': 14, 'rsi_period': 66, 'ema1': 13, 'ema2': 19, 'slip_atr_k': 0.046147919625741475, 'slip_spread_k': 0.4525421752600851, 'spread_hl_frac': 0.01884529567039344, 'bb_std_mult': 2.2590611936050333, 'rsi_os': 23, 'rsi_ob': 86, 'vol_spike': 0.02226274374591612, 'adx_thresh': 5.058428277730677, 'atr_min_pct': 0.02678561079840225, 'atr_max_pct': 0.052141452211761564, 'tp_mult': 2.514380109168649, 'tsl_mult': 0.6366153034662502, 'strategy': 'breakout', 'time_stop': 31, 'use_sma': True, 'use_atr': False, 'use_adx': True, 'use_ema': True, 'use_spike': True, 'rsi_required': False, 'edge_k': 0.5596413135236695, 'edge_cap': 0.637535844295125, 'bull_strategy': 'mean_reversion', 'bull_bb_std_mult': 2.8418367993655234, 'bull_rsi_os': 41, 'bull_rsi_ob': 84, 'bull_adx_thresh': 18.63836676400428, 'bull_atr_min_pct': 0.021396103685275, 'bull_atr_max_pct': 0.1213415163657934, 'bull_tp_mult': 1.828569771928991, 'bull_tsl_mult': 0.27788850426823103, 'bull_time_stop': 182, 'bull_use_sma': True, 'bull_use_ema': True, 'bull_use_atr': True, 'bull_use_adx': True, 'bull_use_spike': True, 'bull_rsi_required': True, 'bear_strategy': 'mean_reversion', 'bear_bb_std_mult': 3.598279635295033, 'bear_rsi_os': 27, 'bear_rsi_ob': 52, 'bear_adx_thresh': 26.46738613320128, 'bear_atr_min_pct': 0.015981252267238108, 'bear_atr_max_pct': 0.1287083093117078, 'bear_tp_mult': 1.0175906786007567, 'bear_tsl_mult': 0.605230294914681, 'bear_time_stop': 198, 'bear_use_sma': False, 'bear_use_ema': False, 'bear_use_atr': False, 'bear_use_adx': False, 'bear_use_spike': True, 'bear_rsi_required': False, 'sideways_strategy': 'breakout', 'sideways_bb_std_mult': 2.8138157570545554, 'sideways_rsi_os': 28, 'sideways_rsi_ob': 63, 'sideways_adx_thresh': 24.22470534591442, 'sideways_atr_min_pct': 0.008672459547113657, 'sideways_atr_max_pct': 0.14337711936017838, 'sideways_tp_mult': 1.6957294706855914, 'sideways_tsl_mult': 0.047622618841265896, 'sideways_time_stop': 30, 'sideways_use_sma': False, 'sideways_use_ema': False, 'sideways_use_atr': True, 'sideways_use_adx': True, 'sideways_use_spike': False, 'sideways_rsi_required': False}.
[I 2025-08-31 13:25:20,406] Trial 694 finished with values: [-0.12471249946418961, 0.1246372323636789] and parameters: {'p_sma': 31, 'p_std': 45, 'p_atr': 16, 'p_adx': 13, 'rsi_period': 44, 'ema1': 12, 'ema2': 19, 'slip_atr_k': 0.047562633508969596, 'slip_spread_k': 0.39393629413796255, 'spread_hl_frac': 0.016792587784403165, 'bb_std_mult': 2.2403687414955047, 'rsi_os': 38, 'rsi_ob': 86, 'vol_spike': 0.013780162192767485, 'adx_thresh': 8.505841540640885, 'atr_min_pct': 0.023690249386193084, 'atr_max_pct': 0.053169553066742654, 'tp_mult': 2.497344569393032, 'tsl_mult': 0.9998892932848338, 'strategy': 'breakout', 'time_stop': 6, 'use_sma': True, 'use_atr': False, 'use_adx': True, 'use_ema': True, 'use_spike': True, 'rsi_required': False, 'edge_k': 0.604442274461111, 'edge_cap': 0.6945511621245624, 'bull_strategy': 'mean_reversion', 'bull_bb_std_mult': 3.0365083765867884, 'bull_rsi_os': 5, 'bull_rsi_ob': 90, 'bull_adx_thresh': 18.47395297174863, 'bull_atr_min_pct': 0.021883179806903973, 'bull_atr_max_pct': 0.13989298246475357, 'bull_tp_mult': 2.32639940775038, 'bull_tsl_mult': 0.024410751453605273, 'bull_time_stop': 182, 'bull_use_sma': False, 'bull_use_ema': True, 'bull_use_atr': True, 'bull_use_adx': True, 'bull_use_spike': True, 'bull_rsi_required': True, 'bear_strategy': 'mean_reversion', 'bear_bb_std_mult': 3.3944955828434846, 'bear_rsi_os': 14, 'bear_rsi_ob': 48, 'bear_adx_thresh': 17.97921849573159, 'bear_atr_min_pct': 5.74978139012449e-05, 'bear_atr_max_pct': 0.11719528258425586, 'bear_tp_mult': 1.012183228376461, 'bear_tsl_mult': 0.7072620434283208, 'bear_time_stop': 56, 'bear_use_sma': False, 'bear_use_ema': False, 'bear_use_atr': False, 'bear_use_adx': False, 'bear_use_spike': True, 'bear_rsi_required': False, 'sideways_strategy': 'mean_reversion', 'sideways_bb_std_mult': 2.8150091048210615, 'sideways_rsi_os': 51, 'sideways_rsi_ob': 61, 'sideways_adx_thresh': 24.220830925481618, 'sideways_atr_min_pct': 0.019915169318081336, 'sideways_atr_max_pct': 0.1438613495402868, 'sideways_tp_mult': 1.688145802488681, 'sideways_tsl_mult': 0.877232462753231, 'sideways_time_stop': 31, 'sideways_use_sma': False, 'sideways_use_ema': False, 'sideways_use_atr': True, 'sideways_use_adx': True, 'sideways_use_spike': False, 'sideways_rsi_required': True}.
[I 2025-08-31 13:25:53,917] Trial 698 finished with values: [-1000000000.0, 1000000000.0] and parameters: {'p_sma': 9, 'p_std': 36, 'p_atr': 17, 'p_adx': 12, 'rsi_period': 83, 'ema1': 13, 'ema2': 20, 'slip_atr_k': 0.042470657608402365, 'slip_spread_k': 0.3921791389263052, 'spread_hl_frac': 0.018441600304304365, 'bb_std_mult': 3.3986280456324236, 'rsi_os': 36, 'rsi_ob': 84, 'vol_spike': 0.014641834942581497, 'adx_thresh': 10.77429633228122, 'atr_min_pct': 0.02920232837284723, 'atr_max_pct': 0.05291672645462545, 'tp_mult': 2.570864327669271, 'tsl_mult': 0.9495416093108026, 'strategy': 'breakout', 'time_stop': 277, 'use_sma': True, 'use_atr': False, 'use_adx': True, 'use_ema': True, 'use_spike': True, 'rsi_required': False, 'edge_k': 0.61484175361954, 'edge_cap': 0.6923099669240289, 'bull_strategy': 'mean_reversion', 'bull_bb_std_mult': 2.098962910062052, 'bull_rsi_os': 41, 'bull_rsi_ob': 84, 'bull_adx_thresh': 18.383696669706215, 'bull_atr_min_pct': 0.02290089488516249, 'bull_atr_max_pct': 0.12067552550810977, 'bull_tp_mult': 1.9564008483948372, 'bull_tsl_mult': 0.29366365867472655, 'bull_time_stop': 186, 'bull_use_sma': True, 'bull_use_ema': False, 'bull_use_atr': True, 'bull_use_adx': True, 'bull_use_spike': True, 'bull_rsi_required': True, 'bear_strategy': 'breakout', 'bear_bb_std_mult': 3.539247299877396, 'bear_rsi_os': 29, 'bear_rsi_ob': 48, 'bear_adx_thresh': 25.610334209069126, 'bear_atr_min_pct': 0.0010515047135244847, 'bear_atr_max_pct': 0.05338980209806932, 'bear_tp_mult': 1.3332524652991062, 'bear_tsl_mult': 0.7156107580185326, 'bear_time_stop': 273, 'bear_use_sma': False, 'bear_use_ema': True, 'bear_use_atr': False, 'bear_use_adx': False, 'bear_use_spike': True, 'bear_rsi_required': True, 'sideways_strategy': 'breakout', 'sideways_bb_std_mult': 2.6840965400182344, 'sideways_rsi_os': 28, 'sideways_rsi_ob': 88, 'sideways_adx_thresh': 24.52664248005372, 'sideways_atr_min_pct': 0.0036338222046821455, 'sideways_atr_max_pct': 0.14976000410301318, 'sideways_tp_mult': 1.6976341990130723, 'sideways_tsl_mult': 0.8366059987148409, 'sideways_time_stop': 47, 'sideways_use_sma': False, 'sideways_use_ema': False, 'sideways_use_atr': True, 'sideways_use_adx': True, 'sideways_use_spike': False, 'sideways_rsi_required': True}.
[I 2025-08-31 13:25:54,709] Trial 700 finished with values: [-1000000000.0, 1000000000.0] and parameters: {'p_sma': 31, 'p_std': 19, 'p_atr': 16, 'p_adx': 23, 'rsi_period': 50, 'ema1': 9, 'ema2': 20, 'slip_atr_k': 0.04862676901811126, 'slip_spread_k': 0.39748256976346463, 'spread_hl_frac': 0.01705162215371498, 'bb_std_mult': 2.472235461258266, 'rsi_os': 36, 'rsi_ob': 91, 'vol_spike': 0.20107562308876625, 'adx_thresh': 6.226936991895892, 'atr_min_pct': 0.021617038075804413, 'atr_max_pct': 0.03880223927740553, 'tp_mult': 2.5774976256587063, 'tsl_mult': 0.9972734412403385, 'strategy': 'breakout', 'time_stop': 162, 'use_sma': False, 'use_atr': False, 'use_adx': True, 'use_ema': False, 'use_spike': True, 'rsi_required': False, 'edge_k': 0.5984010284569814, 'edge_cap': 0.6942134424179996, 'bull_strategy': 'mean_reversion', 'bull_bb_std_mult': 2.746749345866008, 'bull_rsi_os': 7, 'bull_rsi_ob': 82, 'bull_adx_thresh': 30.416137726407364, 'bull_atr_min_pct': 0.02205757370045724, 'bull_atr_max_pct': 0.13112502709319868, 'bull_tp_mult': 1.9581525316523263, 'bull_tsl_mult': 0.249298541749083, 'bull_time_stop': 195, 'bull_use_sma': False, 'bull_use_ema': False, 'bull_use_atr': True, 'bull_use_adx': True, 'bull_use_spike': True, 'bull_rsi_required': True, 'bear_strategy': 'breakout', 'bear_bb_std_mult': 3.4667145087806253, 'bear_rsi_os': 29, 'bear_rsi_ob': 71, 'bear_adx_thresh': 24.79378748565332, 'bear_atr_min_pct': 0.0006408528160982261, 'bear_atr_max_pct': 0.12080701820840653, 'bear_tp_mult': 1.4991998817227943, 'bear_tsl_mult': 0.6513819495503022, 'bear_time_stop': 211, 'bear_use_sma': False, 'bear_use_ema': True, 'bear_use_atr': False, 'bear_use_adx': False, 'bear_use_spike': True, 'bear_rsi_required': True, 'sideways_strategy': 'mean_reversion', 'sideways_bb_std_mult': 2.689581717190802, 'sideways_rsi_os': 51, 'sideways_rsi_ob': 88, 'sideways_adx_thresh': 24.99640546330955, 'sideways_atr_min_pct': 0.027764395523495522, 'sideways_atr_max_pct': 0.14955113937109712, 'sideways_tp_mult': 1.7338027567249774, 'sideways_tsl_mult': 0.8297339107089913, 'sideways_time_stop': 40, 'sideways_use_sma': False, 'sideways_use_ema': True, 'sideways_use_atr': True, 'sideways_use_adx': True, 'sideways_use_spike': False, 'sideways_rsi_required': True}.
[I 2025-08-31 13:25:54,721] Trial 701 finished with values: [-0.16496067203332854, 0.1647356313642926] and parameters: {'p_sma': 32, 'p_std': 19, 'p_atr': 17, 'p_adx': 12, 'rsi_period': 9, 'ema1': 13, 'ema2': 20, 'slip_atr_k': 0.041902804155695896, 'slip_spread_k': 0.4118139792307023, 'spread_hl_frac': 0.018457045463561802, 'bb_std_mult': 2.377133276250469, 'rsi_os': 46, 'rsi_ob': 91, 'vol_spike': 0.014725817750032023, 'adx_thresh': 6.263395536150309, 'atr_min_pct': 0.027745430258969854, 'atr_max_pct': 0.04246237180294834, 'tp_mult': 2.5767432409831086, 'tsl_mult': 0.5168575996571839, 'strategy': 'breakout', 'time_stop': 24, 'use_sma': False, 'use_atr': False, 'use_adx': True, 'use_ema': False, 'use_spike': True, 'rsi_required': False, 'edge_k': 0.6138463368372749, 'edge_cap': 0.6805795295166522, 'bull_strategy': 'mean_reversion', 'bull_bb_std_mult': 2.8959890793190093, 'bull_rsi_os': 7, 'bull_rsi_ob': 82, 'bull_adx_thresh': 34.508607833072034, 'bull_atr_min_pct': 0.022747469762168352, 'bull_atr_max_pct': 0.1400193388159833, 'bull_tp_mult': 1.9668907919798224, 'bull_tsl_mult': 0.35667343701904397, 'bull_time_stop': 137, 'bull_use_sma': True, 'bull_use_ema': False, 'bull_use_atr': True, 'bull_use_adx': True, 'bull_use_spike': True, 'bull_rsi_required': True, 'bear_strategy': 'breakout', 'bear_bb_std_mult': 3.4793963602949067, 'bear_rsi_os': 49, 'bear_rsi_ob': 72, 'bear_adx_thresh': 21.617536043801064, 'bear_atr_min_pct': 0.0007212029559018777, 'bear_atr_max_pct': 0.03036972590050345, 'bear_tp_mult': 1.2529028376999576, 'bear_tsl_mult': 0.6514864706179728, 'bear_time_stop': 152, 'bear_use_sma': False, 'bear_use_ema': True, 'bear_use_atr': False, 'bear_use_adx': False, 'bear_use_spike': True, 'bear_rsi_required': True, 'sideways_strategy': 'breakout', 'sideways_bb_std_mult': 2.7300456481742246, 'sideways_rsi_os': 28, 'sideways_rsi_ob': 50, 'sideways_adx_thresh': 23.124670444358003, 'sideways_atr_min_pct': 0.025895622536959678, 'sideways_atr_max_pct': 0.14981016792191532, 'sideways_tp_mult': 1.7465826777162206, 'sideways_tsl_mult': 0.8282981691796646, 'sideways_time_stop': 43, 'sideways_use_sma': False, 'sideways_use_ema': True, 'sideways_use_atr': True, 'sideways_use_adx': True, 'sideways_use_spike': False, 'sideways_rsi_required': True}.
[I 2025-08-31 13:25:54,875] Trial 699 finished with values: [-1000000000.0, 1000000000.0] and parameters: {'p_sma': 31, 'p_std': 18, 'p_atr': 17, 'p_adx': 12, 'rsi_period': 66, 'ema1': 13, 'ema2': 20, 'slip_atr_k': 0.04241125139932469, 'slip_spread_k': 0.39704617743403064, 'spread_hl_frac': 0.01888526766439765, 'bb_std_mult': 2.269352651473932, 'rsi_os': 36, 'rsi_ob': 91, 'vol_spike': 0.20730500009926733, 'adx_thresh': 10.638677748002458, 'atr_min_pct': 0.02776363488797504, 'atr_max_pct': 0.053078245320750644, 'tp_mult': 2.57320881716981, 'tsl_mult': 0.5395581582646035, 'strategy': 'breakout', 'time_stop': 128, 'use_sma': False, 'use_atr': False, 'use_adx': True, 'use_ema': False, 'use_spike': True, 'rsi_required': False, 'edge_k': 0.6048578348091607, 'edge_cap': 0.6903701377239567, 'bull_strategy': 'mean_reversion', 'bull_bb_std_mult': 1.2022384016443723, 'bull_rsi_os': 18, 'bull_rsi_ob': 86, 'bull_adx_thresh': 6.153940746248393, 'bull_atr_min_pct': 0.022918704130986067, 'bull_atr_max_pct': 0.13967392344023608, 'bull_tp_mult': 1.824241231428399, 'bull_tsl_mult': 0.24810671397872033, 'bull_time_stop': 154, 'bull_use_sma': True, 'bull_use_ema': False, 'bull_use_atr': True, 'bull_use_adx': True, 'bull_use_spike': True, 'bull_rsi_required': True, 'bear_strategy': 'breakout', 'bear_bb_std_mult': 3.425990526232695, 'bear_rsi_os': 29, 'bear_rsi_ob': 48, 'bear_adx_thresh': 21.80076146626287, 'bear_atr_min_pct': 0.02304568736821001, 'bear_atr_max_pct': 0.0302590534971652, 'bear_tp_mult': 1.2690483246978506, 'bear_tsl_mult': 0.7149054752145338, 'bear_time_stop': 155, 'bear_use_sma': False, 'bear_use_ema': True, 'bear_use_atr': False, 'bear_use_adx': False, 'bear_use_spike': True, 'bear_rsi_required': True, 'sideways_strategy': 'breakout', 'sideways_bb_std_mult': 2.6797918909219174, 'sideways_rsi_os': 53, 'sideways_rsi_ob': 65, 'sideways_adx_thresh': 23.307072308305973, 'sideways_atr_min_pct': 0.027828818235156698, 'sideways_atr_max_pct': 0.14982720449096354, 'sideways_tp_mult': 1.8564105672183566, 'sideways_tsl_mult': 0.8423890780734019, 'sideways_time_stop': 38, 'sideways_use_sma': False, 'sideways_use_ema': True, 'sideways_use_atr': True, 'sideways_use_adx': True, 'sideways_use_spike': False, 'sideways_rsi_required': True}.
