[I 2025-08-31 13:14:32,075] Trial 619 finished with values: [-1000000000.0, 1000000000.0] and parameters: {'p_sma': 13, 'p_std': 9, 'p_atr': 9, 'p_adx': 16, 'rsi_period': 49, 'ema1': 26, 'ema2': 16, 'slip_atr_k': 0.05350760085948705, 'slip_spread_k': 0.7864397175795187, 'spread_hl_frac': 0.023613091382640457, 'bb_std_mult': 3.117185507729867, 'rsi_os': 15, 'rsi_ob': 70, 'vol_spike': 0.1277009312008129, 'adx_thresh': 21.72349402285189, 'atr_min_pct': 0.0023076679210748702, 'atr_max_pct': 0.12780124332709655, 'tp_mult': 2.6687058251574487, 'tsl_mult': 0.3574908414022582, 'strategy': 'breakout', 'time_stop': 194, 'use_sma': False, 'use_atr': False, 'use_adx': False, 'use_ema': True, 'use_spike': False, 'rsi_required': False, 'edge_k': 0.6471157433748622, 'edge_cap': 0.7681351966373401, 'bull_strategy': 'breakout', 'bull_bb_std_mult': 2.8727156015872533, 'bull_rsi_os': 20, 'bull_rsi_ob': 49, 'bull_adx_thresh': 17.507327682368192, 'bull_atr_min_pct': 0.019633994088017838, 'bull_atr_max_pct': 0.14995487244166536, 'bull_tp_mult': 1.3488234568764998, 'bull_tsl_mult': 0.1968156084326819, 'bull_time_stop': 15, 'bull_use_sma': True, 'bull_use_ema': True, 'bull_use_atr': False, 'bull_use_adx': False, 'bull_use_spike': False, 'bull_rsi_required': False, 'bear_strategy': 'breakout', 'bear_bb_std_mult': 3.1314453647246374, 'bear_rsi_os': 28, 'bear_rsi_ob': 74, 'bear_adx_thresh': 11.415450655177462, 'bear_atr_min_pct': 0.0004403318962842833, 'bear_atr_max_pct': 0.07156289832018815, 'bear_tp_mult': 2.882019875598664, 'bear_tsl_mult': 0.5325048947955431, 'bear_time_stop': 201, 'bear_use_sma': True, 'bear_use_ema': True, 'bear_use_atr': True, 'bear_use_adx': True, 'bear_use_spike': True, 'bear_rsi_required': True, 'sideways_strategy': 'breakout', 'sideways_bb_std_mult': 2.5848349987626973, 'sideways_rsi_os': 32, 'sideways_rsi_ob': 73, 'sideways_adx_thresh': 26.81284517720096, 'sideways_atr_min_pct': 0.0035544471433969025, 'sideways_atr_max_pct': 0.06063349629659347, 'sideways_tp_mult': 2.2847970487619613, 'sideways_tsl_mult': 0.9189243655970245, 'sideways_time_stop': 219, 'sideways_use_sma': True, 'sideways_use_ema': False, 'sideways_use_atr': False, 'sideways_use_adx': False, 'sideways_use_spike': True, 'sideways_rsi_required': True}.
[I 2025-08-31 13:15:06,870] Trial 623 finished with values: [-1000000000.0, 1000000000.0] and parameters: {'p_sma': 13, 'p_std': 23, 'p_atr': 12, 'p_adx': 27, 'rsi_period': 52, 'ema1': 18, 'ema2': 14, 'slip_atr_k': 0.07325778857024662, 'slip_spread_k': 0.4072171669624802, 'spread_hl_frac': 0.049992919631552946, 'bb_std_mult': 2.156093069492118, 'rsi_os': 38, 'rsi_ob': 77, 'vol_spike': 0.019688611539042604, 'adx_thresh': 21.66250602310744, 'atr_min_pct': 0.011318713300462564, 'atr_max_pct': 0.1277737674336317, 'tp_mult': 2.656315731625087, 'tsl_mult': 0.3673050320466203, 'strategy': 'breakout', 'time_stop': 151, 'use_sma': False, 'use_atr': False, 'use_adx': True, 'use_ema': True, 'use_spike': True, 'rsi_required': False, 'edge_k': 0.6311985508543978, 'edge_cap': 0.7188231636400896, 'bull_strategy': 'breakout', 'bull_bb_std_mult': 2.1764592427450817, 'bull_rsi_os': 5, 'bull_rsi_ob': 87, 'bull_adx_thresh': 17.610878558845783, 'bull_atr_min_pct': 0.006980500952192756, 'bull_atr_max_pct': 0.14785318043948903, 'bull_tp_mult': 1.2128759010020742, 'bull_tsl_mult': 0.24515986310281662, 'bull_time_stop': 291, 'bull_use_sma': True, 'bull_use_ema': True, 'bull_use_atr': True, 'bull_use_adx': True, 'bull_use_spike': False, 'bull_rsi_required': True, 'bear_strategy': 'breakout', 'bear_bb_std_mult': 3.0089766274286127, 'bear_rsi_os': 28, 'bear_rsi_ob': 66, 'bear_adx_thresh': 11.665413993777435, 'bear_atr_min_pct': 0.0035038250833179466, 'bear_atr_max_pct': 0.13273026550665984, 'bear_tp_mult': 2.89207930869872, 'bear_tsl_mult': 0.75926440750387, 'bear_time_stop': 198, 'bear_use_sma': True, 'bear_use_ema': True, 'bear_use_atr': False, 'bear_use_adx': False, 'bear_use_spike': False, 'bear_rsi_required': True, 'sideways_strategy': 'breakout', 'sideways_bb_std_mult': 2.552385724425368, 'sideways_rsi_os': 23, 'sideways_rsi_ob': 68, 'sideways_adx_thresh': 26.746570910582335, 'sideways_atr_min_pct': 0.0036399519651693617, 'sideways_atr_max_pct': 0.13260294528777847, 'sideways_tp_mult': 2.4103048162936878, 'sideways_tsl_mult': 0.862015057602463, 'sideways_time_stop': 82, 'sideways_use_sma': True, 'sideways_use_ema': False, 'sideways_use_atr': True, 'sideways_use_adx': True, 'sideways_use_spike': False, 'sideways_rsi_required': True}.
[I 2025-08-31 13:15:07,515] Trial 622 finished with values: [-0.05514765107848507, 0.054829964936937585] and parameters: {'p_sma': 45, 'p_std': 27, 'p_atr': 12, 'p_adx': 28, 'rsi_period': 54, 'ema1': 18, 'ema2': 15, 'slip_atr_k': 0.061190051482116675, 'slip_spread_k': 0.788128739913087, 'spread_hl_frac': 0.005832339889080683, 'bb_std_mult': 2.2517261408561504, 'rsi_os': 38, 'rsi_ob': 70, 'vol_spike': 0.018489204306776166, 'adx_thresh': 25.606605234632784, 'atr_min_pct': 0.02134727117467148, 'atr_max_pct': 0.03745521711886105, 'tp_mult': 2.682989771769675, 'tsl_mult': 0.3467295050103313, 'strategy': 'breakout', 'time_stop': 121, 'use_sma': False, 'use_atr': False, 'use_adx': False, 'use_ema': True, 'use_spike': False, 'rsi_required': False, 'edge_k': 1.2461866479184298, 'edge_cap': 0.7168337404379691, 'bull_strategy': 'breakout', 'bull_bb_std_mult': 2.76094633102777, 'bull_rsi_os': 7, 'bull_rsi_ob': 65, 'bull_adx_thresh': 17.398131429879584, 'bull_atr_min_pct': 0.020407962155295334, 'bull_atr_max_pct': 0.010916398461268934, 'bull_tp_mult': 1.2201247107043214, 'bull_tsl_mult': 0.2029463857320758, 'bull_time_stop': 43, 'bull_use_sma': True, 'bull_use_ema': True, 'bull_use_atr': True, 'bull_use_adx': True, 'bull_use_spike': False, 'bull_rsi_required': False, 'bear_strategy': 'breakout', 'bear_bb_std_mult': 2.9919204848171717, 'bear_rsi_os': 46, 'bear_rsi_ob': 70, 'bear_adx_thresh': 14.756732050821913, 'bear_atr_min_pct': 0.0035599485366579007, 'bear_atr_max_pct': 0.1389622519811378, 'bear_tp_mult': 2.875775718380592, 'bear_tsl_mult': 0.7517748581824952, 'bear_time_stop': 95, 'bear_use_sma': True, 'bear_use_ema': True, 'bear_use_atr': True, 'bear_use_adx': True, 'bear_use_spike': True, 'bear_rsi_required': True, 'sideways_strategy': 'breakout', 'sideways_bb_std_mult': 1.1246659480097216, 'sideways_rsi_os': 32, 'sideways_rsi_ob': 74, 'sideways_adx_thresh': 26.880595886283544, 'sideways_atr_min_pct': 0.0036220583742528492, 'sideways_atr_max_pct': 0.06005669941621796, 'sideways_tp_mult': 2.295328756553866, 'sideways_tsl_mult': 0.9171864655400914, 'sideways_time_stop': 219, 'sideways_use_sma': True, 'sideways_use_ema': False, 'sideways_use_atr': False, 'sideways_use_adx': False, 'sideways_use_spike': True, 'sideways_rsi_required': True}.
[I 2025-08-31 13:15:07,660] Trial 624 finished with values: [-1000000000.0, 1000000000.0] and parameters: {'p_sma': 38, 'p_std': 23, 'p_atr': 12, 'p_adx': 14, 'rsi_period': 53, 'ema1': 15, 'ema2': 14, 'slip_atr_k': 0.07102798486915844, 'slip_spread_k': 0.3980652165784474, 'spread_hl_frac': 0.014775294443820341, 'bb_std_mult': 2.3335114579843834, 'rsi_os': 20, 'rsi_ob': 56, 'vol_spike': 0.0168313580965157, 'adx_thresh': 20.349011629050487, 'atr_min_pct': 0.010837139871089856, 'atr_max_pct': 0.11444590461729116, 'tp_mult': 1.5725412891289539, 'tsl_mult': 0.7396963264862988, 'strategy': 'breakout', 'time_stop': 150, 'use_sma': True, 'use_atr': True, 'use_adx': True, 'use_ema': True, 'use_spike': True, 'rsi_required': True, 'edge_k': 0.6812175735587079, 'edge_cap': 0.32801926151991423, 'bull_strategy': 'mean_reversion', 'bull_bb_std_mult': 1.3103960371822736, 'bull_rsi_os': 5, 'bull_rsi_ob': 87, 'bull_adx_thresh': 16.9928648654451, 'bull_atr_min_pct': 0.020651641676324557, 'bull_atr_max_pct': 0.06951074141256494, 'bull_tp_mult': 1.2478786606147727, 'bull_tsl_mult': 0.24389086509946317, 'bull_time_stop': 290, 'bull_use_sma': True, 'bull_use_ema': False, 'bull_use_atr': True, 'bull_use_adx': True, 'bull_use_spike': False, 'bull_rsi_required': True, 'bear_strategy': 'breakout', 'bear_bb_std_mult': 2.986651469582429, 'bear_rsi_os': 27, 'bear_rsi_ob': 70, 'bear_adx_thresh': 13.981868112705794, 'bear_atr_min_pct': 0.003908561528001855, 'bear_atr_max_pct': 0.1254615819171297, 'bear_tp_mult': 2.9622835931449916, 'bear_tsl_mult': 0.7578751081600976, 'bear_time_stop': 185, 'bear_use_sma': False, 'bear_use_ema': True, 'bear_use_atr': False, 'bear_use_adx': False, 'bear_use_spike': False, 'bear_rsi_required': True, 'sideways_strategy': 'breakout', 'sideways_bb_std_mult': 2.5109761354089524, 'sideways_rsi_os': 47, 'sideways_rsi_ob': 68, 'sideways_adx_thresh': 15.265086676849656, 'sideways_atr_min_pct': 0.007141742109444502, 'sideways_atr_max_pct': 0.1319978043426219, 'sideways_tp_mult': 1.5997748694352818, 'sideways_tsl_mult': 0.30480844925088757, 'sideways_time_stop': 168, 'sideways_use_sma': False, 'sideways_use_ema': True, 'sideways_use_atr': True, 'sideways_use_adx': True, 'sideways_use_spike': False, 'sideways_rsi_required': True}.
[I 2025-08-31 13:15:07,932] Trial 625 finished with values: [-1000000000.0, 1000000000.0] and parameters: {'p_sma': 55, 'p_std': 23, 'p_atr': 25, 'p_adx': 14, 'rsi_period': 54, 'ema1': 16, 'ema2': 14, 'slip_atr_k': 0.07053436674891247, 'slip_spread_k': 0.3981943141334226, 'spread_hl_frac': 0.01810632032483135, 'bb_std_mult': 1.3510825120148153, 'rsi_os': 39, 'rsi_ob': 53, 'vol_spike': 0.04264041473515491, 'adx_thresh': 33.922459353141775, 'atr_min_pct': 0.01141348348043613, 'atr_max_pct': 0.1139196166239571, 'tp_mult': 1.1653139278975941, 'tsl_mult': 0.0174005643622015, 'strategy': 'breakout', 'time_stop': 121, 'use_sma': True, 'use_atr': True, 'use_adx': True, 'use_ema': True, 'use_spike': True, 'rsi_required': True, 'edge_k': 1.8870277580794, 'edge_cap': 0.7176894357340595, 'bull_strategy': 'mean_reversion', 'bull_bb_std_mult': 1.709429581833577, 'bull_rsi_os': 49, 'bull_rsi_ob': 86, 'bull_adx_thresh': 17.031422487640533, 'bull_atr_min_pct': 0.020461561571718797, 'bull_atr_max_pct': 0.1474621781979715, 'bull_tp_mult': 1.2111371571982694, 'bull_tsl_mult': 0.2435588707925287, 'bull_time_stop': 290, 'bull_use_sma': True, 'bull_use_ema': False, 'bull_use_atr': True, 'bull_use_adx': True, 'bull_use_spike': False, 'bull_rsi_required': True, 'bear_strategy': 'breakout', 'bear_bb_std_mult': 0.9267119440155456, 'bear_rsi_os': 27, 'bear_rsi_ob': 66, 'bear_adx_thresh': 13.937064425379646, 'bear_atr_min_pct': 0.003883499763763617, 'bear_atr_max_pct': 0.13305344981289774, 'bear_tp_mult': 2.975132669520491, 'bear_tsl_mult': 0.7577351160097081, 'bear_time_stop': 151, 'bear_use_sma': False, 'bear_use_ema': True, 'bear_use_atr': False, 'bear_use_adx': False, 'bear_use_spike': True, 'bear_rsi_required': True, 'sideways_strategy': 'breakout', 'sideways_bb_std_mult': 2.4633015504005233, 'sideways_rsi_os': 29, 'sideways_rsi_ob': 68, 'sideways_adx_thresh': 14.6616112283313, 'sideways_atr_min_pct': 0.0015424201387291957, 'sideways_atr_max_pct': 0.13223137743854477, 'sideways_tp_mult': 2.5152453650168165, 'sideways_tsl_mult': 0.8624176409417837, 'sideways_time_stop': 200, 'sideways_use_sma': False, 'sideways_use_ema': True, 'sideways_use_atr': True, 'sideways_use_adx': True, 'sideways_use_spike': False, 'sideways_rsi_required': True}.
[I 2025-08-31 13:15:40,717] Trial 629 finished with values: [-1000000000.0, 1000000000.0] and parameters: {'p_sma': 42, 'p_std': 21, 'p_atr': 13, 'p_adx': 15, 'rsi_period': 48, 'ema1': 22, 'ema2': 29, 'slip_atr_k': 0.05765693138024887, 'slip_spread_k': 0.425978869540228, 'spread_hl_frac': 6.885967168768908e-05, 'bb_std_mult': 2.4021259385766784, 'rsi_os': 52, 'rsi_ob': 81, 'vol_spike': 0.03314905746230965, 'adx_thresh': 12.259699964962937, 'atr_min_pct': 0.006006587475578515, 'atr_max_pct': 0.12338962087329323, 'tp_mult': 2.0427739049753297, 'tsl_mult': 0.7019017595525017, 'strategy': 'breakout', 'time_stop': 257, 'use_sma': False, 'use_atr': True, 'use_adx': False, 'use_ema': True, 'use_spike': False, 'rsi_required': True, 'edge_k': 0.7194338688840259, 'edge_cap': 0.6868535667653469, 'bull_strategy': 'breakout', 'bull_bb_std_mult': 1.1481263772141768, 'bull_rsi_os': 9, 'bull_rsi_ob': 51, 'bull_adx_thresh': 18.17411042271409, 'bull_atr_min_pct': 0.02372294011083468, 'bull_atr_max_pct': 0.10876979203363088, 'bull_tp_mult': 2.450182203120414, 'bull_tsl_mult': 0.12044306269131064, 'bull_time_stop': 280, 'bull_use_sma': False, 'bull_use_ema': True, 'bull_use_atr': False, 'bull_use_adx': True, 'bull_use_spike': True, 'bull_rsi_required': False, 'bear_strategy': 'breakout', 'bear_bb_std_mult': 3.073927376783752, 'bear_rsi_os': 25, 'bear_rsi_ob': 69, 'bear_adx_thresh': 12.981416689546764, 'bear_atr_min_pct': 0.002099438743351668, 'bear_atr_max_pct': 0.14181018263548475, 'bear_tp_mult': 2.931202124761135, 'bear_tsl_mult': 0.6866438864380681, 'bear_time_stop': 218, 'bear_use_sma': True, 'bear_use_ema': True, 'bear_use_atr': True, 'bear_use_adx': True, 'bear_use_spike': True, 'bear_rsi_required': True, 'sideways_strategy': 'mean_reversion', 'sideways_bb_std_mult': 2.6376806716500516, 'sideways_rsi_os': 7, 'sideways_rsi_ob': 95, 'sideways_adx_thresh': 25.527340243112114, 'sideways_atr_min_pct': 0.010596176160901498, 'sideways_atr_max_pct': 0.1281522250938503, 'sideways_tp_mult': 1.5484268818000382, 'sideways_tsl_mult': 0.8849049149735646, 'sideways_time_stop': 210, 'sideways_use_sma': True, 'sideways_use_ema': False, 'sideways_use_atr': False, 'sideways_use_adx': False, 'sideways_use_spike': False, 'sideways_rsi_required': False}.
[I 2025-08-31 13:15:41,658] Trial 628 finished with values: [-1000000000.0, 1000000000.0] and parameters: {'p_sma': 55, 'p_std': 48, 'p_atr': 8, 'p_adx': 15, 'rsi_period': 46, 'ema1': 16, 'ema2': 29, 'slip_atr_k': 0.23838536674348615, 'slip_spread_k': 0.4274941150764715, 'spread_hl_frac': 0.04639000940858873, 'bb_std_mult': 2.4064628917802353, 'rsi_os': 40, 'rsi_ob': 81, 'vol_spike': 0.03483486469063552, 'adx_thresh': 18.514265732149234, 'atr_min_pct': 0.001362560945826302, 'atr_max_pct': 0.12517934198485017, 'tp_mult': 2.5836055669917584, 'tsl_mult': 0.024926298441442785, 'strategy': 'breakout', 'time_stop': 27, 'use_sma': True, 'use_atr': True, 'use_adx': False, 'use_ema': True, 'use_spike': False, 'rsi_required': True, 'edge_k': 1.5690400505540256, 'edge_cap': 0.13729224636562926, 'bull_strategy': 'breakout', 'bull_bb_std_mult': 1.1276967461954635, 'bull_rsi_os': 49, 'bull_rsi_ob': 51, 'bull_adx_thresh': 18.244624155872547, 'bull_atr_min_pct': 0.0038411713100682653, 'bull_atr_max_pct': 0.1312796125408473, 'bull_tp_mult': 1.2844011961601018, 'bull_tsl_mult': 0.4603583379082727, 'bull_time_stop': 300, 'bull_use_sma': False, 'bull_use_ema': False, 'bull_use_atr': False, 'bull_use_adx': True, 'bull_use_spike': True, 'bull_rsi_required': False, 'bear_strategy': 'breakout', 'bear_bb_std_mult': 3.209753410288879, 'bear_rsi_os': 26, 'bear_rsi_ob': 77, 'bear_adx_thresh': 13.53046440769692, 'bear_atr_min_pct': 0.002125865476019071, 'bear_atr_max_pct': 0.13130769595236827, 'bear_tp_mult': 1.4215247323985016, 'bear_tsl_mult': 0.7799996850479542, 'bear_time_stop': 217, 'bear_use_sma': True, 'bear_use_ema': True, 'bear_use_atr': True, 'bear_use_adx': True, 'bear_use_spike': True, 'bear_rsi_required': True, 'sideways_strategy': 'mean_reversion', 'sideways_bb_std_mult': 2.6507309826039105, 'sideways_rsi_os': 29, 'sideways_rsi_ob': 67, 'sideways_adx_thresh': 28.462497023062525, 'sideways_atr_min_pct': 0.0012887788142873623, 'sideways_atr_max_pct': 0.12912547204448646, 'sideways_tp_mult': 2.5166186758638576, 'sideways_tsl_mult': 0.8798572193653627, 'sideways_time_stop': 295, 'sideways_use_sma': True, 'sideways_use_ema': True, 'sideways_use_atr': False, 'sideways_use_adx': False, 'sideways_use_spike': False, 'sideways_rsi_required': True}.
[I 2025-08-31 13:15:41,949] Trial 627 finished with values: [-1000000000.0, 1000000000.0] and parameters: {'p_sma': 50, 'p_std': 47, 'p_atr': 23, 'p_adx': 13, 'rsi_period': 48, 'ema1': 19, 'ema2': 15, 'slip_atr_k': 0.23835792520035987, 'slip_spread_k': 0.4004431523644363, 'spread_hl_frac': 0.014050036738421628, 'bb_std_mult': 1.3748652673774866, 'rsi_os': 20, 'rsi_ob': 56, 'vol_spike': 0.04228297305130269, 'adx_thresh': 18.601958080502285, 'atr_min_pct': 0.0013663897125041696, 'atr_max_pct': 0.12446088807940497, 'tp_mult': 1.5746860927000963, 'tsl_mult': 0.8556629430160958, 'strategy': 'breakout', 'time_stop': 185, 'use_sma': True, 'use_atr': True, 'use_adx': True, 'use_ema': True, 'use_spike': True, 'rsi_required': True, 'edge_k': 1.5809373480426006, 'edge_cap': 0.2053163307807947, 'bull_strategy': 'mean_reversion', 'bull_bb_std_mult': 1.1318792319003437, 'bull_rsi_os': 9, 'bull_rsi_ob': 89, 'bull_adx_thresh': 18.280891512666077, 'bull_atr_min_pct': 0.01024492383154052, 'bull_atr_max_pct': 0.13814965111097044, 'bull_tp_mult': 1.2689740364243638, 'bull_tsl_mult': 0.1746839376904637, 'bull_time_stop': 265, 'bull_use_sma': False, 'bull_use_ema': False, 'bull_use_atr': False, 'bull_use_adx': True, 'bull_use_spike': True, 'bull_rsi_required': True, 'bear_strategy': 'breakout', 'bear_bb_std_mult': 2.948554104720418, 'bear_rsi_os': 55, 'bear_rsi_ob': 69, 'bear_adx_thresh': 13.678980668255617, 'bear_atr_min_pct': 0.02475406852371179, 'bear_atr_max_pct': 0.13176091151929734, 'bear_tp_mult': 1.728022421572433, 'bear_tsl_mult': 0.7845818271269152, 'bear_time_stop': 179, 'bear_use_sma': False, 'bear_use_ema': True, 'bear_use_atr': False, 'bear_use_adx': False, 'bear_use_spike': False, 'bear_rsi_required': True, 'sideways_strategy': 'mean_reversion', 'sideways_bb_std_mult': 2.4802282772445916, 'sideways_rsi_os': 29, 'sideways_rsi_ob': 92, 'sideways_adx_thresh': 28.29099794040455, 'sideways_atr_min_pct': 0.0173366613327934, 'sideways_atr_max_pct': 0.12925058722985466, 'sideways_tp_mult': 1.5995474580510496, 'sideways_tsl_mult': 0.1382552830029587, 'sideways_time_stop': 99, 'sideways_use_sma': False, 'sideways_use_ema': True, 'sideways_use_atr': True, 'sideways_use_adx': True, 'sideways_use_spike': False, 'sideways_rsi_required': True}.
[I 2025-08-31 13:15:41,949] Trial 626 finished with values: [-1000000000.0, 1000000000.0] and parameters: {'p_sma': 42, 'p_std': 6, 'p_atr': 12, 'p_adx': 13, 'rsi_period': 47, 'ema1': 29, 'ema2': 14, 'slip_atr_k': 0.061239048530449494, 'slip_spread_k': 0.4255666133652334, 'spread_hl_frac': 0.04644252033356944, 'bb_std_mult': 2.3673932794265253, 'rsi_os': 52, 'rsi_ob': 78, 'vol_spike': 0.034500589764627686, 'adx_thresh': 32.01717122595729, 'atr_min_pct': 0.014291121168246797, 'atr_max_pct': 0.12403500780226251, 'tp_mult': 1.5783655201353544, 'tsl_mult': 0.015448390451698988, 'strategy': 'breakout', 'time_stop': 186, 'use_sma': True, 'use_atr': True, 'use_adx': False, 'use_ema': True, 'use_spike': False, 'rsi_required': True, 'edge_k': 0.6966101646325176, 'edge_cap': 0.7195536193335423, 'bull_strategy': 'mean_reversion', 'bull_bb_std_mult': 1.2896469283882008, 'bull_rsi_os': 41, 'bull_rsi_ob': 89, 'bull_adx_thresh': 16.89496728867788, 'bull_atr_min_pct': 0.004000717464121976, 'bull_atr_max_pct': 0.13882641892913564, 'bull_tp_mult': 2.426135123215018, 'bull_tsl_mult': 0.6066828404233955, 'bull_time_stop': 264, 'bull_use_sma': False, 'bull_use_ema': False, 'bull_use_atr': True, 'bull_use_adx': True, 'bull_use_spike': False, 'bull_rsi_required': True, 'bear_strategy': 'breakout', 'bear_bb_std_mult': 0.9322043652488694, 'bear_rsi_os': 26, 'bear_rsi_ob': 77, 'bear_adx_thresh': 28.65634658118176, 'bear_atr_min_pct': 0.011750219279613955, 'bear_atr_max_pct': 0.03810159226330256, 'bear_tp_mult': 1.7366357611186802, 'bear_tsl_mult': 0.7793572289195914, 'bear_time_stop': 180, 'bear_use_sma': False, 'bear_use_ema': True, 'bear_use_atr': True, 'bear_use_adx': True, 'bear_use_spike': True, 'bear_rsi_required': True, 'sideways_strategy': 'mean_reversion', 'sideways_bb_std_mult': 2.4732025391521586, 'sideways_rsi_os': 31, 'sideways_rsi_ob': 95, 'sideways_adx_thresh': 25.04725240598971, 'sideways_atr_min_pct': 0.0012923994926082017, 'sideways_atr_max_pct': 0.1299731949741925, 'sideways_tp_mult': 2.220567358707479, 'sideways_tsl_mult': 0.12518599234026084, 'sideways_time_stop': 208, 'sideways_use_sma': False, 'sideways_use_ema': True, 'sideways_use_atr': False, 'sideways_use_adx': False, 'sideways_use_spike': False, 'sideways_rsi_required': True}.
