[I 2025-08-31 12:53:25,253] Trial 470 finished with values: [-1000000000.0, 1000000000.0] and parameters: {'p_sma': 49, 'p_std': 57, 'p_atr': 27, 'p_adx': 15, 'rsi_period': 50, 'ema1': 20, 'ema2': 16, 'slip_atr_k': 0.1632358132501773, 'slip_spread_k': 0.3911698429137249, 'spread_hl_frac': 0.018781444327495254, 'bb_std_mult': 2.345866532067738, 'rsi_os': 37, 'rsi_ob': 54, 'vol_spike': 0.15882818469294602, 'adx_thresh': 16.530803887636043, 'atr_min_pct': 0.002207589138784553, 'atr_max_pct': 0.12259773152603305, 'tp_mult': 1.9861078029440415, 'tsl_mult': 0.01970429694447535, 'strategy': 'breakout', 'time_stop': 30, 'use_sma': True, 'use_atr': True, 'use_adx': True, 'use_ema': True, 'use_spike': False, 'rsi_required': False, 'edge_k': 0.6875832194250745, 'edge_cap': 0.21331115859292366, 'bull_strategy': 'breakout', 'bull_bb_std_mult': 2.74263547759112, 'bull_rsi_os': 6, 'bull_rsi_ob': 50, 'bull_adx_thresh': 18.57051920814498, 'bull_atr_min_pct': 0.02959397161184399, 'bull_atr_max_pct': 0.14740863011895167, 'bull_tp_mult': 1.2055565896035116, 'bull_tsl_mult': 0.0019204545777023463, 'bull_time_stop': 17, 'bull_use_sma': True, 'bull_use_ema': True, 'bull_use_atr': True, 'bull_use_adx': True, 'bull_use_spike': True, 'bull_rsi_required': True, 'bear_strategy': 'breakout', 'bear_bb_std_mult': 3.0944518259828935, 'bear_rsi_os': 29, 'bear_rsi_ob': 51, 'bear_adx_thresh': 7.209297681035828, 'bear_atr_min_pct': 0.001984029580850987, 'bear_atr_max_pct': 0.14998446894650688, 'bear_tp_mult': 1.259948820672271, 'bear_tsl_mult': 0.7863449942336377, 'bear_time_stop': 198, 'bear_use_sma': True, 'bear_use_ema': True, 'bear_use_atr': True, 'bear_use_adx': True, 'bear_use_spike': True, 'bear_rsi_required': True, 'sideways_strategy': 'breakout', 'sideways_bb_std_mult': 2.602576115898565, 'sideways_rsi_os': 7, 'sideways_rsi_ob': 71, 'sideways_adx_thresh': 25.7540123139592, 'sideways_atr_min_pct': 0.006315877323874024, 'sideways_atr_max_pct': 0.05154036002706844, 'sideways_tp_mult': 1.5341002204589915, 'sideways_tsl_mult': 0.19798559854396647, 'sideways_time_stop': 209, 'sideways_use_sma': True, 'sideways_use_ema': False, 'sideways_use_atr': False, 'sideways_use_adx': True, 'sideways_use_spike': True, 'sideways_rsi_required': True}.
[I 2025-08-31 12:53:25,605] Trial 469 finished with values: [-1000000000.0, 1000000000.0] and parameters: {'p_sma': 53, 'p_std': 24, 'p_atr': 9, 'p_adx': 15, 'rsi_period': 53, 'ema1': 22, 'ema2': 27, 'slip_atr_k': 0.060337419581920085, 'slip_spread_k': 0.4005164380436014, 'spread_hl_frac': 0.01865783099883229, 'bb_std_mult': 2.3562685751404904, 'rsi_os': 16, 'rsi_ob': 47, 'vol_spike': 0.02966655463882748, 'adx_thresh': 16.537586850312408, 'atr_min_pct': 0.002234922342359198, 'atr_max_pct': 0.1139671631189608, 'tp_mult': 1.8108058348012241, 'tsl_mult': 0.03416733788039823, 'strategy': 'breakout', 'time_stop': 172, 'use_sma': True, 'use_atr': True, 'use_adx': True, 'use_ema': True, 'use_spike': False, 'rsi_required': False, 'edge_k': 0.6838906930321774, 'edge_cap': 0.7096183944573328, 'bull_strategy': 'breakout', 'bull_bb_std_mult': 2.744456322545883, 'bull_rsi_os': 18, 'bull_rsi_ob': 50, 'bull_adx_thresh': 18.482374478688946, 'bull_atr_min_pct': 0.007585283983983727, 'bull_atr_max_pct': 0.14765968021148482, 'bull_tp_mult': 1.220526935306431, 'bull_tsl_mult': 0.004239191599804293, 'bull_time_stop': 183, 'bull_use_sma': True, 'bull_use_ema': True, 'bull_use_atr': True, 'bull_use_adx': True, 'bull_use_spike': True, 'bull_rsi_required': True, 'bear_strategy': 'breakout', 'bear_bb_std_mult': 3.023460554978249, 'bear_rsi_os': 29, 'bear_rsi_ob': 81, 'bear_adx_thresh': 12.799182480395347, 'bear_atr_min_pct': 0.0018654612162003904, 'bear_atr_max_pct': 0.1499989909073141, 'bear_tp_mult': 2.9185092396865446, 'bear_tsl_mult': 0.7837917962918624, 'bear_time_stop': 146, 'bear_use_sma': True, 'bear_use_ema': True, 'bear_use_atr': True, 'bear_use_adx': True, 'bear_use_spike': True, 'bear_rsi_required': True, 'sideways_strategy': 'breakout', 'sideways_bb_std_mult': 2.777600075364055, 'sideways_rsi_os': 31, 'sideways_rsi_ob': 71, 'sideways_adx_thresh': 16.97111282655823, 'sideways_atr_min_pct': 0.025596980098373034, 'sideways_atr_max_pct': 0.12843098754559745, 'sideways_tp_mult': 1.1156244957223613, 'sideways_tsl_mult': 0.9117041576153369, 'sideways_time_stop': 83, 'sideways_use_sma': True, 'sideways_use_ema': False, 'sideways_use_atr': False, 'sideways_use_adx': True, 'sideways_use_spike': True, 'sideways_rsi_required': True}.
[I 2025-08-31 12:53:25,727] Trial 468 finished with values: [-0.19417931691264934, 0.19356579672159482] and parameters: {'p_sma': 50, 'p_std': 24, 'p_atr': 13, 'p_adx': 15, 'rsi_period': 46, 'ema1': 19, 'ema2': 14, 'slip_atr_k': 0.16449734665744586, 'slip_spread_k': 0.44684334639361684, 'spread_hl_frac': 0.018667495605488516, 'bb_std_mult': 3.024496251890226, 'rsi_os': 39, 'rsi_ob': 47, 'vol_spike': 0.03012862664444541, 'adx_thresh': 13.676579020270697, 'atr_min_pct': 0.001639453139167455, 'atr_max_pct': 0.12277772461500126, 'tp_mult': 1.3573151675838127, 'tsl_mult': 0.03151075116140811, 'strategy': 'breakout', 'time_stop': 249, 'use_sma': True, 'use_atr': True, 'use_adx': False, 'use_ema': True, 'use_spike': False, 'rsi_required': True, 'edge_k': 0.7007474369987363, 'edge_cap': 0.7107351462392317, 'bull_strategy': 'breakout', 'bull_bb_std_mult': 2.730204089080721, 'bull_rsi_os': 8, 'bull_rsi_ob': 50, 'bull_adx_thresh': 18.574463002602883, 'bull_atr_min_pct': 0.019708089126718734, 'bull_atr_max_pct': 0.1470941959057678, 'bull_tp_mult': 1.2126897183179617, 'bull_tsl_mult': 0.18582037161662537, 'bull_time_stop': 281, 'bull_use_sma': True, 'bull_use_ema': True, 'bull_use_atr': False, 'bull_use_adx': True, 'bull_use_spike': True, 'bull_rsi_required': False, 'bear_strategy': 'breakout', 'bear_bb_std_mult': 3.035389896520857, 'bear_rsi_os': 51, 'bear_rsi_ob': 85, 'bear_adx_thresh': 15.248807882224343, 'bear_atr_min_pct': 0.0016864464023335851, 'bear_atr_max_pct': 0.1492395154089678, 'bear_tp_mult': 2.916010268135077, 'bear_tsl_mult': 0.756970461370784, 'bear_time_stop': 203, 'bear_use_sma': True, 'bear_use_ema': True, 'bear_use_atr': True, 'bear_use_adx': True, 'bear_use_spike': True, 'bear_rsi_required': True, 'sideways_strategy': 'breakout', 'sideways_bb_std_mult': 2.594850820875508, 'sideways_rsi_os': 23, 'sideways_rsi_ob': 67, 'sideways_adx_thresh': 25.79187008635128, 'sideways_atr_min_pct': 0.026500984783452253, 'sideways_atr_max_pct': 0.08614585625807893, 'sideways_tp_mult': 1.5780359213706343, 'sideways_tsl_mult': 0.10088183990360411, 'sideways_time_stop': 135, 'sideways_use_sma': True, 'sideways_use_ema': False, 'sideways_use_atr': False, 'sideways_use_adx': True, 'sideways_use_spike': True, 'sideways_rsi_required': True}.
[I 2025-08-31 12:53:26,397] Trial 472 finished with values: [-1000000000.0, 1000000000.0] and parameters: {'p_sma': 28, 'p_std': 24, 'p_atr': 11, 'p_adx': 27, 'rsi_period': 41, 'ema1': 22, 'ema2': 14, 'slip_atr_k': 0.18515143160666295, 'slip_spread_k': 0.42980215979926073, 'spread_hl_frac': 0.021796223866293353, 'bb_std_mult': 0.7440009567386718, 'rsi_os': 52, 'rsi_ob': 79, 'vol_spike': 0.0004305011109389592, 'adx_thresh': 19.302869873650916, 'atr_min_pct': 0.01905517094187165, 'atr_max_pct': 0.017819054396768806, 'tp_mult': 1.021927286468662, 'tsl_mult': 0.0371387844053574, 'strategy': 'breakout', 'time_stop': 251, 'use_sma': False, 'use_atr': True, 'use_adx': False, 'use_ema': True, 'use_spike': False, 'rsi_required': True, 'edge_k': 0.6453784841257063, 'edge_cap': 0.08585917736632254, 'bull_strategy': 'mean_reversion', 'bull_bb_std_mult': 1.4666060983612736, 'bull_rsi_os': 30, 'bull_rsi_ob': 93, 'bull_adx_thresh': 16.870339192629405, 'bull_atr_min_pct': 0.020282064318412615, 'bull_atr_max_pct': 0.14998521300043655, 'bull_tp_mult': 1.2176164339838613, 'bull_tsl_mult': 0.13578066071734562, 'bull_time_stop': 296, 'bull_use_sma': True, 'bull_use_ema': True, 'bull_use_atr': False, 'bull_use_adx': False, 'bull_use_spike': False, 'bull_rsi_required': False, 'bear_strategy': 'breakout', 'bear_bb_std_mult': 3.0417129008843506, 'bear_rsi_os': 29, 'bear_rsi_ob': 71, 'bear_adx_thresh': 18.299408814517584, 'bear_atr_min_pct': 0.0016343463909042804, 'bear_atr_max_pct': 0.13244177577485447, 'bear_tp_mult': 2.8694718226572276, 'bear_tsl_mult': 0.7210128146628155, 'bear_time_stop': 106, 'bear_use_sma': True, 'bear_use_ema': True, 'bear_use_atr': True, 'bear_use_adx': True, 'bear_use_spike': True, 'bear_rsi_required': True, 'sideways_strategy': 'breakout', 'sideways_bb_std_mult': 2.7815296792274307, 'sideways_rsi_os': 42, 'sideways_rsi_ob': 67, 'sideways_adx_thresh': 16.83215449483101, 'sideways_atr_min_pct': 0.001962108394601751, 'sideways_atr_max_pct': 0.12808635753786357, 'sideways_tp_mult': 1.6018001954549652, 'sideways_tsl_mult': 0.5302436554568238, 'sideways_time_stop': 205, 'sideways_use_sma': True, 'sideways_use_ema': False, 'sideways_use_atr': False, 'sideways_use_adx': False, 'sideways_use_spike': True, 'sideways_rsi_required': True}.
[I 2025-08-31 12:53:26,407] Trial 471 finished with values: [-1000000000.0, 1000000000.0] and parameters: {'p_sma': 50, 'p_std': 24, 'p_atr': 11, 'p_adx': 16, 'rsi_period': 48, 'ema1': 22, 'ema2': 16, 'slip_atr_k': 0.1624961448098209, 'slip_spread_k': 0.3879844140635137, 'spread_hl_frac': 0.03643415073263956, 'bb_std_mult': 2.3479930210470283, 'rsi_os': 37, 'rsi_ob': 47, 'vol_spike': 0.03222713872586139, 'adx_thresh': 13.741600890040209, 'atr_min_pct': 0.020978860509399577, 'atr_max_pct': 0.01942171486510339, 'tp_mult': 1.8143355687887082, 'tsl_mult': 0.08062313332351331, 'strategy': 'breakout', 'time_stop': 173, 'use_sma': True, 'use_atr': True, 'use_adx': True, 'use_ema': True, 'use_spike': False, 'rsi_required': False, 'edge_k': 0.3401476873211413, 'edge_cap': 0.733035223209938, 'bull_strategy': 'breakout', 'bull_bb_std_mult': 2.7477727585059113, 'bull_rsi_os': 21, 'bull_rsi_ob': 67, 'bull_adx_thresh': 16.611343971926697, 'bull_atr_min_pct': 0.020541925287330495, 'bull_atr_max_pct': 0.14746335171069608, 'bull_tp_mult': 1.221587842658435, 'bull_tsl_mult': 0.1888098793670339, 'bull_time_stop': 281, 'bull_use_sma': True, 'bull_use_ema': True, 'bull_use_atr': True, 'bull_use_adx': True, 'bull_use_spike': True, 'bull_rsi_required': True, 'bear_strategy': 'breakout', 'bear_bb_std_mult': 3.1348667400691084, 'bear_rsi_os': 53, 'bear_rsi_ob': 81, 'bear_adx_thresh': 14.440202888645311, 'bear_atr_min_pct': 0.0020590736863314203, 'bear_atr_max_pct': 0.132253079200558, 'bear_tp_mult': 2.8626003333494943, 'bear_tsl_mult': 0.7826434762642871, 'bear_time_stop': 105, 'bear_use_sma': True, 'bear_use_ema': True, 'bear_use_atr': True, 'bear_use_adx': True, 'bear_use_spike': True, 'bear_rsi_required': True, 'sideways_strategy': 'breakout', 'sideways_bb_std_mult': 2.7932146047014332, 'sideways_rsi_os': 54, 'sideways_rsi_ob': 67, 'sideways_adx_thresh': 30.92016048067151, 'sideways_atr_min_pct': 0.011472044221519026, 'sideways_atr_max_pct': 0.12855786624782609, 'sideways_tp_mult': 1.5292609354228577, 'sideways_tsl_mult': 0.8924356734381544, 'sideways_time_stop': 166, 'sideways_use_sma': True, 'sideways_use_ema': False, 'sideways_use_atr': False, 'sideways_use_adx': True, 'sideways_use_spike': True, 'sideways_rsi_required': True}.
[I 2025-08-31 12:53:55,562] Trial 474 finished with values: [-0.1464994617688986, 0.14582724646822853] and parameters: {'p_sma': 54, 'p_std': 26, 'p_atr': 12, 'p_adx': 16, 'rsi_period': 48, 'ema1': 21, 'ema2': 45, 'slip_atr_k': 0.1828952330852826, 'slip_spread_k': 0.4267716498830807, 'spread_hl_frac': 0.021346370133503607, 'bb_std_mult': 2.891569574841322, 'rsi_os': 38, 'rsi_ob': 79, 'vol_spike': 0.032527391889013796, 'adx_thresh': 18.447645961990514, 'atr_min_pct': 0.013291670730861734, 'atr_max_pct': 0.04664514258436156, 'tp_mult': 2.6437348140685204, 'tsl_mult': 0.08588365409476974, 'strategy': 'breakout', 'time_stop': 5, 'use_sma': False, 'use_atr': True, 'use_adx': False, 'use_ema': True, 'use_spike': False, 'rsi_required': True, 'edge_k': 1.3489605178797957, 'edge_cap': 0.763497235241782, 'bull_strategy': 'mean_reversion', 'bull_bb_std_mult': 2.6553581121608394, 'bull_rsi_os': 5, 'bull_rsi_ob': 93, 'bull_adx_thresh': 16.757574457496812, 'bull_atr_min_pct': 0.02041506318599323, 'bull_atr_max_pct': 0.14979071102666416, 'bull_tp_mult': 1.3314864131047057, 'bull_tsl_mult': 0.20650241361604607, 'bull_time_stop': 300, 'bull_use_sma': True, 'bull_use_ema': True, 'bull_use_atr': False, 'bull_use_adx': False, 'bull_use_spike': False, 'bull_rsi_required': False, 'bear_strategy': 'breakout', 'bear_bb_std_mult': 0.669493485716322, 'bear_rsi_os': 40, 'bear_rsi_ob': 70, 'bear_adx_thresh': 13.983191887331282, 'bear_atr_min_pct': 0.0008430623177975768, 'bear_atr_max_pct': 0.1318900921044853, 'bear_tp_mult': 2.1230141057147556, 'bear_tsl_mult': 0.5836742347206394, 'bear_time_stop': 106, 'bear_use_sma': True, 'bear_use_ema': True, 'bear_use_atr': True, 'bear_use_adx': True, 'bear_use_spike': True, 'bear_rsi_required': False, 'sideways_strategy': 'breakout', 'sideways_bb_std_mult': 1.1357721450565035, 'sideways_rsi_os': 32, 'sideways_rsi_ob': 67, 'sideways_adx_thresh': 26.75064498997827, 'sideways_atr_min_pct': 0.011762533657203606, 'sideways_atr_max_pct': 0.058672820176523366, 'sideways_tp_mult': 2.4256313816424977, 'sideways_tsl_mult': 0.0025552382101339255, 'sideways_time_stop': 166, 'sideways_use_sma': True, 'sideways_use_ema': False, 'sideways_use_atr': False, 'sideways_use_adx': False, 'sideways_use_spike': False, 'sideways_rsi_required': True}.
[I 2025-08-31 12:53:55,599] Trial 473 finished with values: [-1000000000.0, 1000000000.0] and parameters: {'p_sma': 50, 'p_std': 24, 'p_atr': 11, 'p_adx': 22, 'rsi_period': 48, 'ema1': 20, 'ema2': 17, 'slip_atr_k': 0.0518796045875445, 'slip_spread_k': 0.4320211535916715, 'spread_hl_frac': 0.021375214480589134, 'bb_std_mult': 2.889355659095184, 'rsi_os': 38, 'rsi_ob': 77, 'vol_spike': 0.03045638427524064, 'adx_thresh': 29.168951926046745, 'atr_min_pct': 0.024065266465760793, 'atr_max_pct': 0.09889552251844241, 'tp_mult': 1.5676769468565315, 'tsl_mult': 0.0884895995508903, 'strategy': 'breakout', 'time_stop': 251, 'use_sma': False, 'use_atr': True, 'use_adx': False, 'use_ema': True, 'use_spike': False, 'rsi_required': True, 'edge_k': 0.34208665341209854, 'edge_cap': 0.0953807767784784, 'bull_strategy': 'mean_reversion', 'bull_bb_std_mult': 2.649112725533903, 'bull_rsi_os': 8, 'bull_rsi_ob': 71, 'bull_adx_thresh': 16.851494803392615, 'bull_atr_min_pct': 0.020676685105305948, 'bull_atr_max_pct': 0.14741155291774177, 'bull_tp_mult': 1.2193937459031345, 'bull_tsl_mult': 0.1434161592603735, 'bull_time_stop': 300, 'bull_use_sma': True, 'bull_use_ema': True, 'bull_use_atr': False, 'bull_use_adx': False, 'bull_use_spike': False, 'bull_rsi_required': False, 'bear_strategy': 'breakout', 'bear_bb_std_mult': 3.1455706726700137, 'bear_rsi_os': 27, 'bear_rsi_ob': 71, 'bear_adx_thresh': 14.513892596515795, 'bear_atr_min_pct': 0.001153322432530336, 'bear_atr_max_pct': 0.13373929864354006, 'bear_tp_mult': 2.8687890406477408, 'bear_tsl_mult': 0.7153591057831388, 'bear_time_stop': 91, 'bear_use_sma': True, 'bear_use_ema': True, 'bear_use_atr': True, 'bear_use_adx': True, 'bear_use_spike': True, 'bear_rsi_required': True, 'sideways_strategy': 'breakout', 'sideways_bb_std_mult': 2.5680211450722563, 'sideways_rsi_os': 23, 'sideways_rsi_ob': 93, 'sideways_adx_thresh': 27.197329717736853, 'sideways_atr_min_pct': 0.028980270165963475, 'sideways_atr_max_pct': 0.12730510019901503, 'sideways_tp_mult': 2.4086904120388883, 'sideways_tsl_mult': 0.8841084004473562, 'sideways_time_stop': 162, 'sideways_use_sma': True, 'sideways_use_ema': False, 'sideways_use_atr': False, 'sideways_use_adx': False, 'sideways_use_spike': False, 'sideways_rsi_required': True}.
[I 2025-08-31 12:53:59,128] Trial 475 finished with values: [-0.15261650275705685, 0.15203598441795207] and parameters: {'p_sma': 54, 'p_std': 26, 'p_atr': 12, 'p_adx': 16, 'rsi_period': 48, 'ema1': 15, 'ema2': 32, 'slip_atr_k': 0.07597531058284651, 'slip_spread_k': 0.016174682349182845, 'spread_hl_frac': 0.014867672726367194, 'bb_std_mult': 2.268632646760654, 'rsi_os': 38, 'rsi_ob': 77, 'vol_spike': 0.025638161971514507, 'adx_thresh': 18.585135128879685, 'atr_min_pct': 0.008767316741323878, 'atr_max_pct': 0.04560699722053944, 'tp_mult': 2.630399021789788, 'tsl_mult': 0.07382028238503076, 'strategy': 'breakout', 'time_stop': 289, 'use_sma': False, 'use_atr': True, 'use_adx': False, 'use_ema': True, 'use_spike': True, 'rsi_required': True, 'edge_k': 0.3487873008715967, 'edge_cap': 0.7723289653293915, 'bull_strategy': 'breakout', 'bull_bb_std_mult': 2.507628369386372, 'bull_rsi_os': 38, 'bull_rsi_ob': 48, 'bull_adx_thresh': 31.832226477076492, 'bull_atr_min_pct': 0.0030417644740296373, 'bull_atr_max_pct': 0.14437674280572454, 'bull_tp_mult': 1.3285585901181824, 'bull_tsl_mult': 0.6228314250610825, 'bull_time_stop': 140, 'bull_use_sma': True, 'bull_use_ema': True, 'bull_use_atr': False, 'bull_use_adx': True, 'bull_use_spike': False, 'bull_rsi_required': False, 'bear_strategy': 'breakout', 'bear_bb_std_mult': 3.162666546549468, 'bear_rsi_os': 43, 'bear_rsi_ob': 54, 'bear_adx_thresh': 13.957416091000269, 'bear_atr_min_pct': 0.0008507636954454226, 'bear_atr_max_pct': 0.12949753766197886, 'bear_tp_mult': 2.1190775439886846, 'bear_tsl_mult': 0.9975207955676463, 'bear_time_stop': 186, 'bear_use_sma': True, 'bear_use_ema': True, 'bear_use_atr': False, 'bear_use_adx': True, 'bear_use_spike': True, 'bear_rsi_required': False, 'sideways_strategy': 'breakout', 'sideways_bb_std_mult': 1.150324274695243, 'sideways_rsi_os': 55, 'sideways_rsi_ob': 93, 'sideways_adx_thresh': 27.06293179710075, 'sideways_atr_min_pct': 0.011826584093306499, 'sideways_atr_max_pct': 0.1313089605536099, 'sideways_tp_mult': 1.8281437806081942, 'sideways_tsl_mult': 0.8883670214152288, 'sideways_time_stop': 260, 'sideways_use_sma': True, 'sideways_use_ema': False, 'sideways_use_atr': False, 'sideways_use_adx': False, 'sideways_use_spike': False, 'sideways_rsi_required': True}.
[I 2025-08-31 12:53:59,230] Trial 476 finished with values: [-1000000000.0, 1000000000.0] and parameters: {'p_sma': 54, 'p_std': 26, 'p_atr': 12, 'p_adx': 14, 'rsi_period': 62, 'ema1': 21, 'ema2': 54, 'slip_atr_k': 0.06733763326313635, 'slip_spread_k': 0.36502276000156314, 'spread_hl_frac': 0.008024265547751635, 'bb_std_mult': 2.8796039492954177, 'rsi_os': 38, 'rsi_ob': 55, 'vol_spike': 0.02434125276613814, 'adx_thresh': 25.47874683410802, 'atr_min_pct': 0.0008652829669099751, 'atr_max_pct': 0.12567921139519395, 'tp_mult': 2.6327394314285146, 'tsl_mult': 0.2828775919903671, 'strategy': 'breakout', 'time_stop': 268, 'use_sma': False, 'use_atr': True, 'use_adx': False, 'use_ema': True, 'use_spike': True, 'rsi_required': True, 'edge_k': 1.9989556251821825, 'edge_cap': 0.7659535117571603, 'bull_strategy': 'mean_reversion', 'bull_bb_std_mult': 2.642985817598379, 'bull_rsi_os': 6, 'bull_rsi_ob': 48, 'bull_adx_thresh': 32.050281483796574, 'bull_atr_min_pct': 0.019016842987019843, 'bull_atr_max_pct': 0.14414241098127686, 'bull_tp_mult': 1.3272903861129315, 'bull_tsl_mult': 0.20607442077485472, 'bull_time_stop': 296, 'bull_use_sma': True, 'bull_use_ema': True, 'bull_use_atr': False, 'bull_use_adx': False, 'bull_use_spike': False, 'bull_rsi_required': False, 'bear_strategy': 'breakout', 'bear_bb_std_mult': 3.1436674940300584, 'bear_rsi_os': 27, 'bear_rsi_ob': 94, 'bear_adx_thresh': 13.845705671767787, 'bear_atr_min_pct': 0.020086194273470713, 'bear_atr_max_pct': 0.13445967838573009, 'bear_tp_mult': 2.967911159595277, 'bear_tsl_mult': 0.8870581225727883, 'bear_time_stop': 73, 'bear_use_sma': True, 'bear_use_ema': True, 'bear_use_atr': False, 'bear_use_adx': True, 'bear_use_spike': True, 'bear_rsi_required': False, 'sideways_strategy': 'breakout', 'sideways_bb_std_mult': 2.705170917968665, 'sideways_rsi_os': 27, 'sideways_rsi_ob': 64, 'sideways_adx_thresh': 26.95402802477023, 'sideways_atr_min_pct': 0.002741155900311755, 'sideways_atr_max_pct': 0.12165209548960014, 'sideways_tp_mult': 1.8655889396046819, 'sideways_tsl_mult': 0.8673023391188716, 'sideways_time_stop': 101, 'sideways_use_sma': True, 'sideways_use_ema': False, 'sideways_use_atr': False, 'sideways_use_adx': False, 'sideways_use_spike': False, 'sideways_rsi_required': True}.
