[I 2025-08-31 12:42:11,697] Trial 389 finished with values: [-1000000000.0, 1000000000.0] and parameters: {'p_sma': 50, 'p_std': 25, 'p_atr': 11, 'p_adx': 14, 'rsi_period': 48, 'ema1': 22, 'ema2': 14, 'slip_atr_k': 0.05736761856359577, 'slip_spread_k': 0.3197484778362775, 'spread_hl_frac': 0.017998952867213987, 'bb_std_mult': 2.2562704902805577, 'rsi_os': 36, 'rsi_ob': 79, 'vol_spike': 0.020065518515328805, 'adx_thresh': 18.923602900612224, 'atr_min_pct': 0.000600710434969826, 'atr_max_pct': 0.11758113566757296, 'tp_mult': 2.806052270401116, 'tsl_mult': 0.30102454076496576, 'strategy': 'breakout', 'time_stop': 166, 'use_sma': False, 'use_atr': True, 'use_adx': False, 'use_ema': True, 'use_spike': False, 'rsi_required': True, 'edge_k': 0.5855037753923843, 'edge_cap': 0.6969374901849544, 'bull_strategy': 'breakout', 'bull_bb_std_mult': 2.6935886293866167, 'bull_rsi_os': 5, 'bull_rsi_ob': 46, 'bull_adx_thresh': 16.992664467123713, 'bull_atr_min_pct': 0.0184666774057664, 'bull_atr_max_pct': 0.14606161876258678, 'bull_tp_mult': 1.2658757758742252, 'bull_tsl_mult': 0.10486044742971137, 'bull_time_stop': 270, 'bull_use_sma': True, 'bull_use_ema': True, 'bull_use_atr': False, 'bull_use_adx': False, 'bull_use_spike': False, 'bull_rsi_required': False, 'bear_strategy': 'breakout', 'bear_bb_std_mult': 3.1933913756233836, 'bear_rsi_os': 26, 'bear_rsi_ob': 69, 'bear_adx_thresh': 14.244337070895062, 'bear_atr_min_pct': 0.003283911432297877, 'bear_atr_max_pct': 0.12127775088947892, 'bear_tp_mult': 2.958469317970899, 'bear_tsl_mult': 0.7516473170077876, 'bear_time_stop': 177, 'bear_use_sma': True, 'bear_use_ema': True, 'bear_use_atr': True, 'bear_use_adx': True, 'bear_use_spike': True, 'bear_rsi_required': True, 'sideways_strategy': 'mean_reversion', 'sideways_bb_std_mult': 2.4302480522427605, 'sideways_rsi_os': 31, 'sideways_rsi_ob': 64, 'sideways_adx_thresh': 26.16630816131109, 'sideways_atr_min_pct': 0.0033165416551337824, 'sideways_atr_max_pct': 0.12449757267900811, 'sideways_tp_mult': 1.6790013047530812, 'sideways_tsl_mult': 0.8566416790202084, 'sideways_time_stop': 212, 'sideways_use_sma': True, 'sideways_use_ema': False, 'sideways_use_atr': False, 'sideways_use_adx': False, 'sideways_use_spike': True, 'sideways_rsi_required': False}.
[I 2025-08-31 12:42:11,893] Trial 387 finished with values: [-1000000000.0, 1000000000.0] and parameters: {'p_sma': 50, 'p_std': 22, 'p_atr': 17, 'p_adx': 15, 'rsi_period': 51, 'ema1': 22, 'ema2': 13, 'slip_atr_k': 0.05702825417206146, 'slip_spread_k': 0.3287333857458997, 'spread_hl_frac': 0.016577716710887612, 'bb_std_mult': 2.4174633123593456, 'rsi_os': 36, 'rsi_ob': 79, 'vol_spike': 0.023053525749896688, 'adx_thresh': 19.251433667789723, 'atr_min_pct': 0.0005526081697177633, 'atr_max_pct': 0.11633483554588979, 'tp_mult': 2.786744193036509, 'tsl_mult': 0.6567290273104247, 'strategy': 'breakout', 'time_stop': 178, 'use_sma': False, 'use_atr': True, 'use_adx': False, 'use_ema': True, 'use_spike': False, 'rsi_required': True, 'edge_k': 0.5910341854568437, 'edge_cap': 0.6835766360858905, 'bull_strategy': 'breakout', 'bull_bb_std_mult': 2.677343859332609, 'bull_rsi_os': 5, 'bull_rsi_ob': 52, 'bull_adx_thresh': 17.634347828664414, 'bull_atr_min_pct': 0.018438934034476835, 'bull_atr_max_pct': 0.14644589698994143, 'bull_tp_mult': 1.2697299268146245, 'bull_tsl_mult': 0.11323586786126517, 'bull_time_stop': 273, 'bull_use_sma': True, 'bull_use_ema': True, 'bull_use_atr': False, 'bull_use_adx': False, 'bull_use_spike': False, 'bull_rsi_required': False, 'bear_strategy': 'breakout', 'bear_bb_std_mult': 3.186235627881886, 'bear_rsi_os': 26, 'bear_rsi_ob': 69, 'bear_adx_thresh': 13.745995401485446, 'bear_atr_min_pct': 0.000723475475491734, 'bear_atr_max_pct': 0.12072625642529386, 'bear_tp_mult': 2.9426387862047934, 'bear_tsl_mult': 0.7530749691965896, 'bear_time_stop': 189, 'bear_use_sma': True, 'bear_use_ema': True, 'bear_use_atr': True, 'bear_use_adx': True, 'bear_use_spike': True, 'bear_rsi_required': True, 'sideways_strategy': 'mean_reversion', 'sideways_bb_std_mult': 2.740422036404026, 'sideways_rsi_os': 30, 'sideways_rsi_ob': 64, 'sideways_adx_thresh': 26.468544815876193, 'sideways_atr_min_pct': 0.0036574605939910833, 'sideways_atr_max_pct': 0.12556702753430393, 'sideways_tp_mult': 1.5930884024328467, 'sideways_tsl_mult': 0.8744264396759379, 'sideways_time_stop': 214, 'sideways_use_sma': True, 'sideways_use_ema': False, 'sideways_use_atr': False, 'sideways_use_adx': False, 'sideways_use_spike': True, 'sideways_rsi_required': False}.
[I 2025-08-31 12:42:12,083] Trial 390 finished with values: [-1000000000.0, 1000000000.0] and parameters: {'p_sma': 50, 'p_std': 23, 'p_atr': 30, 'p_adx': 14, 'rsi_period': 52, 'ema1': 18, 'ema2': 14, 'slip_atr_k': 0.05613614135882708, 'slip_spread_k': 0.4880958646821475, 'spread_hl_frac': 0.016362819441922815, 'bb_std_mult': 2.424873704730541, 'rsi_os': 34, 'rsi_ob': 86, 'vol_spike': 0.026146324254443135, 'adx_thresh': 18.7035971197397, 'atr_min_pct': 0.0009820165776987177, 'atr_max_pct': 0.12059297062035773, 'tp_mult': 2.777551021699892, 'tsl_mult': 0.30333488833829736, 'strategy': 'breakout', 'time_stop': 178, 'use_sma': False, 'use_atr': True, 'use_adx': False, 'use_ema': True, 'use_spike': False, 'rsi_required': True, 'edge_k': 0.5166025934938492, 'edge_cap': 0.6925365376440739, 'bull_strategy': 'breakout', 'bull_bb_std_mult': 2.7104452044122063, 'bull_rsi_os': 5, 'bull_rsi_ob': 45, 'bull_adx_thresh': 19.135920014405144, 'bull_atr_min_pct': 0.018251659335904117, 'bull_atr_max_pct': 0.14595350776848723, 'bull_tp_mult': 1.2738231195159841, 'bull_tsl_mult': 0.1409935559106109, 'bull_time_stop': 282, 'bull_use_sma': True, 'bull_use_ema': True, 'bull_use_atr': False, 'bull_use_adx': False, 'bull_use_spike': False, 'bull_rsi_required': False, 'bear_strategy': 'breakout', 'bear_bb_std_mult': 3.056756029551376, 'bear_rsi_os': 18, 'bear_rsi_ob': 68, 'bear_adx_thresh': 14.36438670450812, 'bear_atr_min_pct': 0.0012273609244761966, 'bear_atr_max_pct': 0.12445083827034735, 'bear_tp_mult': 2.9403649666185974, 'bear_tsl_mult': 0.7592120496038097, 'bear_time_stop': 198, 'bear_use_sma': True, 'bear_use_ema': True, 'bear_use_atr': True, 'bear_use_adx': True, 'bear_use_spike': True, 'bear_rsi_required': True, 'sideways_strategy': 'mean_reversion', 'sideways_bb_std_mult': 2.7133493909395554, 'sideways_rsi_os': 31, 'sideways_rsi_ob': 64, 'sideways_adx_thresh': 25.56587292243689, 'sideways_atr_min_pct': 0.002987936333014113, 'sideways_atr_max_pct': 0.12466065197720652, 'sideways_tp_mult': 1.5887006633968357, 'sideways_tsl_mult': 0.8427876437155989, 'sideways_time_stop': 208, 'sideways_use_sma': True, 'sideways_use_ema': False, 'sideways_use_atr': False, 'sideways_use_adx': False, 'sideways_use_spike': True, 'sideways_rsi_required': False}.
[I 2025-08-31 12:42:12,165] Trial 388 finished with values: [-1000000000.0, 1000000000.0] and parameters: {'p_sma': 50, 'p_std': 23, 'p_atr': 11, 'p_adx': 14, 'rsi_period': 48, 'ema1': 22, 'ema2': 13, 'slip_atr_k': 0.057700011329479176, 'slip_spread_k': 0.5191275514736579, 'spread_hl_frac': 0.014385430222771523, 'bb_std_mult': 2.236025727151621, 'rsi_os': 36, 'rsi_ob': 80, 'vol_spike': 0.022315411605142374, 'adx_thresh': 19.06171090962937, 'atr_min_pct': 0.0007582281796251586, 'atr_max_pct': 0.11711807559088025, 'tp_mult': 2.7550222524070107, 'tsl_mult': 0.9575217307850225, 'strategy': 'breakout', 'time_stop': 181, 'use_sma': False, 'use_atr': True, 'use_adx': False, 'use_ema': True, 'use_spike': False, 'rsi_required': True, 'edge_k': 0.5629844045879053, 'edge_cap': 0.6931623365139454, 'bull_strategy': 'breakout', 'bull_bb_std_mult': 2.7191667959189014, 'bull_rsi_os': 5, 'bull_rsi_ob': 54, 'bull_adx_thresh': 17.590046565403984, 'bull_atr_min_pct': 0.01841202614527446, 'bull_atr_max_pct': 0.14633569702522406, 'bull_tp_mult': 1.2851657544760466, 'bull_tsl_mult': 0.15335712010431402, 'bull_time_stop': 272, 'bull_use_sma': True, 'bull_use_ema': True, 'bull_use_atr': False, 'bull_use_adx': False, 'bull_use_spike': False, 'bull_rsi_required': False, 'bear_strategy': 'breakout', 'bear_bb_std_mult': 3.1712119234061733, 'bear_rsi_os': 26, 'bear_rsi_ob': 70, 'bear_adx_thresh': 14.517308195121439, 'bear_atr_min_pct': 0.0034814157882813567, 'bear_atr_max_pct': 0.12087012452256973, 'bear_tp_mult': 2.9600604681722507, 'bear_tsl_mult': 0.7748971743476847, 'bear_time_stop': 187, 'bear_use_sma': True, 'bear_use_ema': True, 'bear_use_atr': True, 'bear_use_adx': True, 'bear_use_spike': True, 'bear_rsi_required': True, 'sideways_strategy': 'mean_reversion', 'sideways_bb_std_mult': 2.6879199469391604, 'sideways_rsi_os': 31, 'sideways_rsi_ob': 64, 'sideways_adx_thresh': 26.325346618785222, 'sideways_atr_min_pct': 0.0032580381657666357, 'sideways_atr_max_pct': 0.12484204796124584, 'sideways_tp_mult': 1.589476578541044, 'sideways_tsl_mult': 0.8539262671833004, 'sideways_time_stop': 213, 'sideways_use_sma': True, 'sideways_use_ema': False, 'sideways_use_atr': False, 'sideways_use_adx': False, 'sideways_use_spike': True, 'sideways_rsi_required': False}.
[I 2025-08-31 12:42:44,352] Trial 394 finished with values: [-1000000000.0, 1000000000.0] and parameters: {'p_sma': 52, 'p_std': 21, 'p_atr': 23, 'p_adx': 16, 'rsi_period': 50, 'ema1': 20, 'ema2': 15, 'slip_atr_k': 0.06699498289313062, 'slip_spread_k': 0.37401945629565514, 'spread_hl_frac': 0.020552060678068165, 'bb_std_mult': 2.5056589646243728, 'rsi_os': 34, 'rsi_ob': 83, 'vol_spike': 0.015762035981126264, 'adx_thresh': 19.763092799547486, 'atr_min_pct': 0.0010256986584833965, 'atr_max_pct': 0.12277965498555884, 'tp_mult': 2.7273072802763796, 'tsl_mult': 0.04843895467958037, 'strategy': 'breakout', 'time_stop': 156, 'use_sma': False, 'use_atr': True, 'use_adx': False, 'use_ema': True, 'use_spike': False, 'rsi_required': True, 'edge_k': 0.8910192245964076, 'edge_cap': 0.7709668814186293, 'bull_strategy': 'breakout', 'bull_bb_std_mult': 2.589188163516812, 'bull_rsi_os': 6, 'bull_rsi_ob': 60, 'bull_adx_thresh': 13.542493375875138, 'bull_atr_min_pct': 0.019159912418801835, 'bull_atr_max_pct': 0.14209651637695403, 'bull_tp_mult': 1.3952555659092922, 'bull_tsl_mult': 0.36334035594722086, 'bull_time_stop': 262, 'bull_use_sma': True, 'bull_use_ema': True, 'bull_use_atr': True, 'bull_use_adx': True, 'bull_use_spike': True, 'bull_rsi_required': False, 'bear_strategy': 'breakout', 'bear_bb_std_mult': 3.0729087623660867, 'bear_rsi_os': 31, 'bear_rsi_ob': 69, 'bear_adx_thresh': 13.19319073645188, 'bear_atr_min_pct': 0.006280597468186912, 'bear_atr_max_pct': 0.14398522387185136, 'bear_tp_mult': 2.9263101407982672, 'bear_tsl_mult': 0.8409561914203297, 'bear_time_stop': 180, 'bear_use_sma': True, 'bear_use_ema': True, 'bear_use_atr': True, 'bear_use_adx': True, 'bear_use_spike': False, 'bear_rsi_required': True, 'sideways_strategy': 'breakout', 'sideways_bb_std_mult': 2.542849372518303, 'sideways_rsi_os': 29, 'sideways_rsi_ob': 71, 'sideways_adx_thresh': 27.551081451553895, 'sideways_atr_min_pct': 0.0028057020066327228, 'sideways_atr_max_pct': 0.13008664723572858, 'sideways_tp_mult': 1.6582907692923723, 'sideways_tsl_mult': 0.9210943879182456, 'sideways_time_stop': 202, 'sideways_use_sma': True, 'sideways_use_ema': False, 'sideways_use_atr': False, 'sideways_use_adx': True, 'sideways_use_spike': False, 'sideways_rsi_required': True}.
[I 2025-08-31 12:42:44,672] Trial 392 finished with values: [-1000000000.0, 1000000000.0] and parameters: {'p_sma': 51, 'p_std': 21, 'p_atr': 15, 'p_adx': 14, 'rsi_period': 52, 'ema1': 20, 'ema2': 14, 'slip_atr_k': 0.05424413373686722, 'slip_spread_k': 0.528712135158453, 'spread_hl_frac': 0.01456632342349622, 'bb_std_mult': 2.4851594096373684, 'rsi_os': 37, 'rsi_ob': 80, 'vol_spike': 0.015072365538763653, 'adx_thresh': 19.87908385317668, 'atr_min_pct': 0.0011036357692612451, 'atr_max_pct': 0.12132257792617387, 'tp_mult': 2.7364027396524495, 'tsl_mult': 0.03878708733536716, 'strategy': 'breakout', 'time_stop': 158, 'use_sma': False, 'use_atr': True, 'use_adx': False, 'use_ema': True, 'use_spike': False, 'rsi_required': True, 'edge_k': 0.4896076524304831, 'edge_cap': 0.7763494732218262, 'bull_strategy': 'breakout', 'bull_bb_std_mult': 2.6151830180878557, 'bull_rsi_os': 6, 'bull_rsi_ob': 54, 'bull_adx_thresh': 14.51733425553647, 'bull_atr_min_pct': 0.019340856817606358, 'bull_atr_max_pct': 0.1434081160994254, 'bull_tp_mult': 1.3803525898270221, 'bull_tsl_mult': 0.15358412019960876, 'bull_time_stop': 281, 'bull_use_sma': True, 'bull_use_ema': True, 'bull_use_atr': True, 'bull_use_adx': True, 'bull_use_spike': False, 'bull_rsi_required': False, 'bear_strategy': 'breakout', 'bear_bb_std_mult': 3.0389052176452087, 'bear_rsi_os': 32, 'bear_rsi_ob': 68, 'bear_adx_thresh': 14.558178635582546, 'bear_atr_min_pct': 0.004732371620963466, 'bear_atr_max_pct': 0.14390775817618007, 'bear_tp_mult': 2.9846727550361103, 'bear_tsl_mult': 0.7907340988028944, 'bear_time_stop': 197, 'bear_use_sma': True, 'bear_use_ema': True, 'bear_use_atr': True, 'bear_use_adx': True, 'bear_use_spike': True, 'bear_rsi_required': True, 'sideways_strategy': 'breakout', 'sideways_bb_std_mult': 2.5608602589748335, 'sideways_rsi_os': 29, 'sideways_rsi_ob': 66, 'sideways_adx_thresh': 25.50389616016102, 'sideways_atr_min_pct': 0.0029101729619593446, 'sideways_atr_max_pct': 0.13047428677073614, 'sideways_tp_mult': 1.6008273641661168, 'sideways_tsl_mult': 0.9200049174663507, 'sideways_time_stop': 212, 'sideways_use_sma': True, 'sideways_use_ema': False, 'sideways_use_atr': False, 'sideways_use_adx': False, 'sideways_use_spike': False, 'sideways_rsi_required': True}.
[I 2025-08-31 12:42:44,962] Trial 391 finished with values: [-0.028538527347684473, 0.028212089928370224] and parameters: {'p_sma': 52, 'p_std': 21, 'p_atr': 8, 'p_adx': 14, 'rsi_period': 51, 'ema1': 20, 'ema2': 14, 'slip_atr_k': 0.05457418859403105, 'slip_spread_k': 0.5297924923637083, 'spread_hl_frac': 0.014456049314913644, 'bb_std_mult': 2.4636410933571997, 'rsi_os': 37, 'rsi_ob': 79, 'vol_spike': 0.02291208958658684, 'adx_thresh': 19.71524280968902, 'atr_min_pct': 0.0010257970357373948, 'atr_max_pct': 0.12160953146246276, 'tp_mult': 2.7307799519198803, 'tsl_mult': 0.7180149345399606, 'strategy': 'breakout', 'time_stop': 179, 'use_sma': False, 'use_atr': True, 'use_adx': False, 'use_ema': True, 'use_spike': False, 'rsi_required': True, 'edge_k': 0.49050922251713935, 'edge_cap': 0.7700906929656094, 'bull_strategy': 'breakout', 'bull_bb_std_mult': 2.7114929778445402, 'bull_rsi_os': 5, 'bull_rsi_ob': 53, 'bull_adx_thresh': 19.15018660183959, 'bull_atr_min_pct': 0.01784634851319944, 'bull_atr_max_pct': 0.14667587994883516, 'bull_tp_mult': 1.3931176615732581, 'bull_tsl_mult': 0.1556453909409461, 'bull_time_stop': 282, 'bull_use_sma': True, 'bull_use_ema': True, 'bull_use_atr': True, 'bull_use_adx': False, 'bull_use_spike': False, 'bull_rsi_required': False, 'bear_strategy': 'breakout', 'bear_bb_std_mult': 3.0457664417480594, 'bear_rsi_os': 31, 'bear_rsi_ob': 69, 'bear_adx_thresh': 13.465121842528921, 'bear_atr_min_pct': 0.004454155487683128, 'bear_atr_max_pct': 0.14298139599659887, 'bear_tp_mult': 2.9331994363153746, 'bear_tsl_mult': 0.7805280409069957, 'bear_time_stop': 198, 'bear_use_sma': True, 'bear_use_ema': True, 'bear_use_atr': True, 'bear_use_adx': True, 'bear_use_spike': True, 'bear_rsi_required': True, 'sideways_strategy': 'mean_reversion', 'sideways_bb_std_mult': 2.721356439898552, 'sideways_rsi_os': 29, 'sideways_rsi_ob': 63, 'sideways_adx_thresh': 25.369857159282606, 'sideways_atr_min_pct': 0.003459124433457632, 'sideways_atr_max_pct': 0.13012786665780401, 'sideways_tp_mult': 1.5814658838649454, 'sideways_tsl_mult': 0.8868528126480459, 'sideways_time_stop': 208, 'sideways_use_sma': True, 'sideways_use_ema': False, 'sideways_use_atr': False, 'sideways_use_adx': False, 'sideways_use_spike': False, 'sideways_rsi_required': True}.
[I 2025-08-31 12:42:45,090] Trial 393 finished with values: [-1000000000.0, 1000000000.0] and parameters: {'p_sma': 52, 'p_std': 21, 'p_atr': 8, 'p_adx': 16, 'rsi_period': 50, 'ema1': 20, 'ema2': 15, 'slip_atr_k': 0.0666607307326022, 'slip_spread_k': 0.4451252018278931, 'spread_hl_frac': 0.02034915251624052, 'bb_std_mult': 2.55642907633676, 'rsi_os': 37, 'rsi_ob': 81, 'vol_spike': 0.013861966276256382, 'adx_thresh': 20.055785639091702, 'atr_min_pct': 0.015030391400370125, 'atr_max_pct': 0.1227437636496813, 'tp_mult': 2.717608000048593, 'tsl_mult': 0.03853321509665799, 'strategy': 'breakout', 'time_stop': 158, 'use_sma': False, 'use_atr': True, 'use_adx': False, 'use_ema': True, 'use_spike': False, 'rsi_required': True, 'edge_k': 0.6230617370438462, 'edge_cap': 0.7631488807297016, 'bull_strategy': 'breakout', 'bull_bb_std_mult': 2.589320364522044, 'bull_rsi_os': 6, 'bull_rsi_ob': 58, 'bull_adx_thresh': 14.571851439163407, 'bull_atr_min_pct': 0.017428862646014016, 'bull_atr_max_pct': 0.1431562701938731, 'bull_tp_mult': 1.1712482595966545, 'bull_tsl_mult': 0.41079426878129266, 'bull_time_stop': 263, 'bull_use_sma': True, 'bull_use_ema': True, 'bull_use_atr': True, 'bull_use_adx': True, 'bull_use_spike': True, 'bull_rsi_required': False, 'bear_strategy': 'breakout', 'bear_bb_std_mult': 3.0693769827445734, 'bear_rsi_os': 31, 'bear_rsi_ob': 68, 'bear_adx_thresh': 13.151167049524316, 'bear_atr_min_pct': 0.007912945971193628, 'bear_atr_max_pct': 0.14436657669374336, 'bear_tp_mult': 2.9886588406007095, 'bear_tsl_mult': 0.6840754041118956, 'bear_time_stop': 170, 'bear_use_sma': True, 'bear_use_ema': True, 'bear_use_atr': True, 'bear_use_adx': True, 'bear_use_spike': False, 'bear_rsi_required': True, 'sideways_strategy': 'breakout', 'sideways_bb_std_mult': 2.5514451163586127, 'sideways_rsi_os': 28, 'sideways_rsi_ob': 71, 'sideways_adx_thresh': 27.58993369325056, 'sideways_atr_min_pct': 0.0029075370707491825, 'sideways_atr_max_pct': 0.12948673246679587, 'sideways_tp_mult': 1.5712517839798712, 'sideways_tsl_mult': 0.9228573876983044, 'sideways_time_stop': 104, 'sideways_use_sma': True, 'sideways_use_ema': False, 'sideways_use_atr': False, 'sideways_use_adx': True, 'sideways_use_spike': False, 'sideways_rsi_required': True}.
[I 2025-08-31 12:43:18,080] Trial 395 finished with values: [-0.03450792083922738, 0.037516647956706325] and parameters: {'p_sma': 52, 'p_std': 21, 'p_atr': 11, 'p_adx': 16, 'rsi_period': 47, 'ema1': 17, 'ema2': 14, 'slip_atr_k': 0.0535508723653953, 'slip_spread_k': 0.5327941468093541, 'spread_hl_frac': 0.018144758010201392, 'bb_std_mult': 2.4933926066751204, 'rsi_os': 37, 'rsi_ob': 81, 'vol_spike': 0.011296784839423335, 'adx_thresh': 19.606235228184797, 'atr_min_pct': 0.02138510145434995, 'atr_max_pct': 0.12193664735978817, 'tp_mult': 2.7186523870430976, 'tsl_mult': 0.029801360959668417, 'strategy': 'breakout', 'time_stop': 160, 'use_sma': False, 'use_atr': True, 'use_adx': False, 'use_ema': True, 'use_spike': False, 'rsi_required': True, 'edge_k': 0.6228937203898369, 'edge_cap': 0.7473987213665241, 'bull_strategy': 'breakout', 'bull_bb_std_mult': 2.7417407962482954, 'bull_rsi_os': 6, 'bull_rsi_ob': 53, 'bull_adx_thresh': 16.438679817649167, 'bull_atr_min_pct': 0.019141451560637863, 'bull_atr_max_pct': 0.14825774410819575, 'bull_tp_mult': 1.1722899674128566, 'bull_tsl_mult': 0.4210523064747694, 'bull_time_stop': 251, 'bull_use_sma': True, 'bull_use_ema': True, 'bull_use_atr': True, 'bull_use_adx': True, 'bull_use_spike': False, 'bull_rsi_required': False, 'bear_strategy': 'breakout', 'bear_bb_std_mult': 3.0241725385485707, 'bear_rsi_os': 52, 'bear_rsi_ob': 68, 'bear_adx_thresh': 14.94081161397136, 'bear_atr_min_pct': 0.004696919159232373, 'bear_atr_max_pct': 0.14193806100486497, 'bear_tp_mult': 2.986694075878082, 'bear_tsl_mult': 0.693402828482461, 'bear_time_stop': 201, 'bear_use_sma': True, 'bear_use_ema': True, 'bear_use_atr': True, 'bear_use_adx': True, 'bear_use_spike': True, 'bear_rsi_required': True, 'sideways_strategy': 'breakout', 'sideways_bb_std_mult': 2.63437183984445, 'sideways_rsi_os': 29, 'sideways_rsi_ob': 57, 'sideways_adx_thresh': 25.346086659099353, 'sideways_atr_min_pct': 0.004855958839619557, 'sideways_atr_max_pct': 0.1324508716512197, 'sideways_tp_mult': 1.5668941832702574, 'sideways_tsl_mult': 0.8924597088249487, 'sideways_time_stop': 196, 'sideways_use_sma': True, 'sideways_use_ema': False, 'sideways_use_atr': False, 'sideways_use_adx': False, 'sideways_use_spike': False, 'sideways_rsi_required': True}.
