[I 2025-08-31 13:07:02,716] Trial 569 finished with values: [-0.022190984280047954, 0.02205129453412935] and parameters: {'p_sma': 48, 'p_std': 50, 'p_atr': 24, 'p_adx': 16, 'rsi_period': 62, 'ema1': 20, 'ema2': 19, 'slip_atr_k': 0.14377274525504372, 'slip_spread_k': 0.920521506134627, 'spread_hl_frac': 0.022566913340131122, 'bb_std_mult': 2.238074860209758, 'rsi_os': 39, 'rsi_ob': 80, 'vol_spike': 0.02393334341759617, 'adx_thresh': 11.14861246841416, 'atr_min_pct': 0.0028714437643160623, 'atr_max_pct': 0.12537674886186628, 'tp_mult': 1.3814009611321731, 'tsl_mult': 0.022716298872783924, 'strategy': 'breakout', 'time_stop': 173, 'use_sma': False, 'use_atr': True, 'use_adx': False, 'use_ema': True, 'use_spike': False, 'rsi_required': True, 'edge_k': 0.6726167051680967, 'edge_cap': 0.05072373986299772, 'bull_strategy': 'breakout', 'bull_bb_std_mult': 1.6196949786977979, 'bull_rsi_os': 7, 'bull_rsi_ob': 47, 'bull_adx_thresh': 17.980937064971556, 'bull_atr_min_pct': 0.02048453894912729, 'bull_atr_max_pct': 0.14618623797424085, 'bull_tp_mult': 1.2902062745088474, 'bull_tsl_mult': 0.6767178757757024, 'bull_time_stop': 115, 'bull_use_sma': True, 'bull_use_ema': True, 'bull_use_atr': True, 'bull_use_adx': False, 'bull_use_spike': False, 'bull_rsi_required': False, 'bear_strategy': 'mean_reversion', 'bear_bb_std_mult': 2.967954622990149, 'bear_rsi_os': 41, 'bear_rsi_ob': 53, 'bear_adx_thresh': 29.60645129186399, 'bear_atr_min_pct': 0.006287203561947527, 'bear_atr_max_pct': 0.07669563277771811, 'bear_tp_mult': 1.9357180250028145, 'bear_tsl_mult': 0.6998788434177867, 'bear_time_stop': 28, 'bear_use_sma': True, 'bear_use_ema': False, 'bear_use_atr': True, 'bear_use_adx': True, 'bear_use_spike': True, 'bear_rsi_required': False, 'sideways_strategy': 'breakout', 'sideways_bb_std_mult': 2.5532305126939683, 'sideways_rsi_os': 42, 'sideways_rsi_ob': 70, 'sideways_adx_thresh': 26.56177427349987, 'sideways_atr_min_pct': 0.0029976835390056657, 'sideways_atr_max_pct': 0.12613427073075048, 'sideways_tp_mult': 1.4937929150558475, 'sideways_tsl_mult': 0.8777990149309618, 'sideways_time_stop': 206, 'sideways_use_sma': True, 'sideways_use_ema': False, 'sideways_use_atr': False, 'sideways_use_adx': False, 'sideways_use_spike': True, 'sideways_rsi_required': True}.
[I 2025-08-31 13:07:03,129] Trial 568 finished with values: [-1000000000.0, 1000000000.0] and parameters: {'p_sma': 48, 'p_std': 54, 'p_atr': 24, 'p_adx': 16, 'rsi_period': 53, 'ema1': 20, 'ema2': 14, 'slip_atr_k': 0.07025275828922294, 'slip_spread_k': 0.39774317676701726, 'spread_hl_frac': 0.013222292555264466, 'bb_std_mult': 2.0896002233742164, 'rsi_os': 39, 'rsi_ob': 80, 'vol_spike': 0.13486333790202087, 'adx_thresh': 19.867067946347493, 'atr_min_pct': 0.026107146174278457, 'atr_max_pct': 0.12570640326461233, 'tp_mult': 2.348615791057483, 'tsl_mult': 0.29989276635385476, 'strategy': 'breakout', 'time_stop': 173, 'use_sma': False, 'use_atr': True, 'use_adx': False, 'use_ema': True, 'use_spike': False, 'rsi_required': True, 'edge_k': 0.6729546412195113, 'edge_cap': 0.7568427833195563, 'bull_strategy': 'breakout', 'bull_bb_std_mult': 2.2916258084179906, 'bull_rsi_os': 8, 'bull_rsi_ob': 53, 'bull_adx_thresh': 20.42138023677853, 'bull_atr_min_pct': 0.009925740173850728, 'bull_atr_max_pct': 0.14610067228946869, 'bull_tp_mult': 1.303004164702329, 'bull_tsl_mult': 0.03986443416550339, 'bull_time_stop': 113, 'bull_use_sma': True, 'bull_use_ema': True, 'bull_use_atr': True, 'bull_use_adx': False, 'bull_use_spike': False, 'bull_rsi_required': False, 'bear_strategy': 'mean_reversion', 'bear_bb_std_mult': 2.966983559840683, 'bear_rsi_os': 31, 'bear_rsi_ob': 71, 'bear_adx_thresh': 29.19287947744631, 'bear_atr_min_pct': 0.0017874820088253046, 'bear_atr_max_pct': 0.14074610927793543, 'bear_tp_mult': 2.999984841773868, 'bear_tsl_mult': 0.3946989606349814, 'bear_time_stop': 289, 'bear_use_sma': True, 'bear_use_ema': False, 'bear_use_atr': True, 'bear_use_adx': True, 'bear_use_spike': True, 'bear_rsi_required': False, 'sideways_strategy': 'breakout', 'sideways_bb_std_mult': 2.5510144491724125, 'sideways_rsi_os': 49, 'sideways_rsi_ob': 55, 'sideways_adx_thresh': 25.153371403222614, 'sideways_atr_min_pct': 0.028179272212485264, 'sideways_atr_max_pct': 0.12581386502173458, 'sideways_tp_mult': 1.5035165933202608, 'sideways_tsl_mult': 0.33688835480357865, 'sideways_time_stop': 17, 'sideways_use_sma': True, 'sideways_use_ema': False, 'sideways_use_atr': False, 'sideways_use_adx': False, 'sideways_use_spike': True, 'sideways_rsi_required': True}.
[I 2025-08-31 13:07:03,140] Trial 567 finished with values: [-1000000000.0, 1000000000.0] and parameters: {'p_sma': 51, 'p_std': 27, 'p_atr': 12, 'p_adx': 10, 'rsi_period': 67, 'ema1': 18, 'ema2': 19, 'slip_atr_k': 0.10725935143821202, 'slip_spread_k': 0.39886543115601447, 'spread_hl_frac': 0.013663186229851153, 'bb_std_mult': 2.0558144958880167, 'rsi_os': 16, 'rsi_ob': 79, 'vol_spike': 0.28258664893728935, 'adx_thresh': 11.379419182146764, 'atr_min_pct': 0.0012171418544374398, 'atr_max_pct': 0.1254073712886843, 'tp_mult': 1.8588433654319394, 'tsl_mult': 0.15933558845874268, 'strategy': 'breakout', 'time_stop': 174, 'use_sma': False, 'use_atr': True, 'use_adx': False, 'use_ema': True, 'use_spike': False, 'rsi_required': True, 'edge_k': 1.5060587100990175, 'edge_cap': 0.163039797189849, 'bull_strategy': 'mean_reversion', 'bull_bb_std_mult': 2.5386271981487565, 'bull_rsi_os': 8, 'bull_rsi_ob': 47, 'bull_adx_thresh': 20.058081751660794, 'bull_atr_min_pct': 0.016602291815846985, 'bull_atr_max_pct': 0.14498479119495938, 'bull_tp_mult': 1.1821949642791811, 'bull_tsl_mult': 0.22764662488525161, 'bull_time_stop': 285, 'bull_use_sma': True, 'bull_use_ema': True, 'bull_use_atr': False, 'bull_use_adx': False, 'bull_use_spike': False, 'bull_rsi_required': False, 'bear_strategy': 'mean_reversion', 'bear_bb_std_mult': 2.4477420374235046, 'bear_rsi_os': 32, 'bear_rsi_ob': 75, 'bear_adx_thresh': 15.699144513415337, 'bear_atr_min_pct': 0.01784436219116115, 'bear_atr_max_pct': 0.030933894170318672, 'bear_tp_mult': 2.99785077263367, 'bear_tsl_mult': 0.4002128240806691, 'bear_time_stop': 128, 'bear_use_sma': True, 'bear_use_ema': False, 'bear_use_atr': True, 'bear_use_adx': True, 'bear_use_spike': True, 'bear_rsi_required': False, 'sideways_strategy': 'mean_reversion', 'sideways_bb_std_mult': 0.5702407410338126, 'sideways_rsi_os': 7, 'sideways_rsi_ob': 66, 'sideways_adx_thresh': 20.579725089223725, 'sideways_atr_min_pct': 0.002935212653595507, 'sideways_atr_max_pct': 0.12577454891329365, 'sideways_tp_mult': 1.1163611340454, 'sideways_tsl_mult': 0.9189755066174488, 'sideways_time_stop': 207, 'sideways_use_sma': False, 'sideways_use_ema': False, 'sideways_use_atr': False, 'sideways_use_adx': False, 'sideways_use_spike': True, 'sideways_rsi_required': True}.
[I 2025-08-31 13:07:35,593] Trial 571 finished with values: [-0.15537448914018936, 0.1552255972546195] and parameters: {'p_sma': 48, 'p_std': 27, 'p_atr': 12, 'p_adx': 13, 'rsi_period': 10, 'ema1': 16, 'ema2': 13, 'slip_atr_k': 0.14469820782582604, 'slip_spread_k': 0.4901317421414988, 'spread_hl_frac': 0.038999831556864005, 'bb_std_mult': 1.322648939201645, 'rsi_os': 16, 'rsi_ob': 80, 'vol_spike': 0.13538619484479092, 'adx_thresh': 11.374039694701157, 'atr_min_pct': 0.0011057314714366423, 'atr_max_pct': 0.09086667612983845, 'tp_mult': 2.7129590858124772, 'tsl_mult': 0.1297541622681242, 'strategy': 'breakout', 'time_stop': 174, 'use_sma': True, 'use_atr': True, 'use_adx': True, 'use_ema': True, 'use_spike': True, 'rsi_required': True, 'edge_k': 0.6769164070494497, 'edge_cap': 0.21725141982211443, 'bull_strategy': 'breakout', 'bull_bb_std_mult': 1.0142091637714628, 'bull_rsi_os': 8, 'bull_rsi_ob': 47, 'bull_adx_thresh': 21.753470930160827, 'bull_atr_min_pct': 0.02082982280842073, 'bull_atr_max_pct': 0.14559414175725374, 'bull_tp_mult': 1.1768663996473494, 'bull_tsl_mult': 0.04179571818084027, 'bull_time_stop': 51, 'bull_use_sma': True, 'bull_use_ema': False, 'bull_use_atr': True, 'bull_use_adx': False, 'bull_use_spike': False, 'bull_rsi_required': True, 'bear_strategy': 'mean_reversion', 'bear_bb_std_mult': 3.106563346038245, 'bear_rsi_os': 34, 'bear_rsi_ob': 64, 'bear_adx_thresh': 13.405799088989697, 'bear_atr_min_pct': 0.016660889002481128, 'bear_atr_max_pct': 0.1475327018209806, 'bear_tp_mult': 2.9996124385842404, 'bear_tsl_mult': 0.6978486630280663, 'bear_time_stop': 133, 'bear_use_sma': True, 'bear_use_ema': False, 'bear_use_atr': False, 'bear_use_adx': False, 'bear_use_spike': True, 'bear_rsi_required': False, 'sideways_strategy': 'breakout', 'sideways_bb_std_mult': 2.5396773304047016, 'sideways_rsi_os': 49, 'sideways_rsi_ob': 73, 'sideways_adx_thresh': 32.260977617826114, 'sideways_atr_min_pct': 0.0015395995154838362, 'sideways_atr_max_pct': 0.12107235844255454, 'sideways_tp_mult': 1.8842608565703558, 'sideways_tsl_mult': 0.5491216040195929, 'sideways_time_stop': 205, 'sideways_use_sma': True, 'sideways_use_ema': False, 'sideways_use_atr': True, 'sideways_use_adx': False, 'sideways_use_spike': True, 'sideways_rsi_required': True}.
[I 2025-08-31 13:07:36,129] Trial 570 finished with values: [-1000000000.0, 1000000000.0] and parameters: {'p_sma': 48, 'p_std': 27, 'p_atr': 12, 'p_adx': 16, 'rsi_period': 53, 'ema1': 20, 'ema2': 19, 'slip_atr_k': 0.0571486091994728, 'slip_spread_k': 0.5564829945620909, 'spread_hl_frac': 0.016798727947092307, 'bb_std_mult': 2.3484319485730616, 'rsi_os': 37, 'rsi_ob': 79, 'vol_spike': 0.024387945566173776, 'adx_thresh': 20.048467331951958, 'atr_min_pct': 0.00293002017933279, 'atr_max_pct': 0.12646689323337543, 'tp_mult': 2.693183669813605, 'tsl_mult': 0.13042286072076575, 'strategy': 'breakout', 'time_stop': 192, 'use_sma': False, 'use_atr': True, 'use_adx': True, 'use_ema': True, 'use_spike': False, 'rsi_required': True, 'edge_k': 0.6836881734698644, 'edge_cap': 0.7627542783655461, 'bull_strategy': 'breakout', 'bull_bb_std_mult': 2.832974528729491, 'bull_rsi_os': 8, 'bull_rsi_ob': 47, 'bull_adx_thresh': 19.849520724380895, 'bull_atr_min_pct': 0.02088080375424524, 'bull_atr_max_pct': 0.14477956026216882, 'bull_tp_mult': 1.1785335508275478, 'bull_tsl_mult': 0.8226415780005634, 'bull_time_stop': 267, 'bull_use_sma': True, 'bull_use_ema': True, 'bull_use_atr': True, 'bull_use_adx': False, 'bull_use_spike': False, 'bull_rsi_required': True, 'bear_strategy': 'mean_reversion', 'bear_bb_std_mult': 3.1339493473525373, 'bear_rsi_os': 34, 'bear_rsi_ob': 53, 'bear_adx_thresh': 13.406683462743317, 'bear_atr_min_pct': 0.006167678977155602, 'bear_atr_max_pct': 0.057216649804255185, 'bear_tp_mult': 2.8903130397933516, 'bear_tsl_mult': 0.7009180848778138, 'bear_time_stop': 292, 'bear_use_sma': True, 'bear_use_ema': False, 'bear_use_atr': False, 'bear_use_adx': False, 'bear_use_spike': True, 'bear_rsi_required': False, 'sideways_strategy': 'breakout', 'sideways_bb_std_mult': 2.414719677988563, 'sideways_rsi_os': 31, 'sideways_rsi_ob': 68, 'sideways_adx_thresh': 32.17280605074395, 'sideways_atr_min_pct': 0.028222878397539647, 'sideways_atr_max_pct': 0.13071310784461498, 'sideways_tp_mult': 1.508701775844648, 'sideways_tsl_mult': 0.8389767751875097, 'sideways_time_stop': 36, 'sideways_use_sma': True, 'sideways_use_ema': False, 'sideways_use_atr': True, 'sideways_use_adx': False, 'sideways_use_spike': True, 'sideways_rsi_required': True}.
[I 2025-08-31 13:07:36,736] Trial 573 finished with values: [-0.06033472370458837, 0.06006786856030875] and parameters: {'p_sma': 46, 'p_std': 44, 'p_atr': 12, 'p_adx': 14, 'rsi_period': 11, 'ema1': 20, 'ema2': 58, 'slip_atr_k': 0.14452589363913632, 'slip_spread_k': 0.9211814053444961, 'spread_hl_frac': 0.043348812759423566, 'bb_std_mult': 3.439682498278933, 'rsi_os': 37, 'rsi_ob': 65, 'vol_spike': 0.0255472620739404, 'adx_thresh': 18.660097170338908, 'atr_min_pct': 0.02075235121648082, 'atr_max_pct': 0.130822714738676, 'tp_mult': 1.3894256076631502, 'tsl_mult': 0.12604322262559947, 'strategy': 'breakout', 'time_stop': 190, 'use_sma': True, 'use_atr': True, 'use_adx': True, 'use_ema': True, 'use_spike': True, 'rsi_required': True, 'edge_k': 1.650868786578443, 'edge_cap': 0.19386873476815591, 'bull_strategy': 'breakout', 'bull_bb_std_mult': 2.8414476812086797, 'bull_rsi_os': 7, 'bull_rsi_ob': 94, 'bull_adx_thresh': 21.71641813239595, 'bull_atr_min_pct': 0.020921496958269725, 'bull_atr_max_pct': 0.14288713320048757, 'bull_tp_mult': 1.2589186546017026, 'bull_tsl_mult': 0.4764807932545325, 'bull_time_stop': 181, 'bull_use_sma': True, 'bull_use_ema': False, 'bull_use_atr': False, 'bull_use_adx': True, 'bull_use_spike': False, 'bull_rsi_required': True, 'bear_strategy': 'breakout', 'bear_bb_std_mult': 3.1437997014540797, 'bear_rsi_os': 12, 'bear_rsi_ob': 53, 'bear_adx_thresh': 14.243302574084982, 'bear_atr_min_pct': 0.023715140458278054, 'bear_atr_max_pct': 0.14809357607989754, 'bear_tp_mult': 1.0809818218709286, 'bear_tsl_mult': 0.6991684596644102, 'bear_time_stop': 185, 'bear_use_sma': True, 'bear_use_ema': True, 'bear_use_atr': False, 'bear_use_adx': False, 'bear_use_spike': True, 'bear_rsi_required': True, 'sideways_strategy': 'breakout', 'sideways_bb_std_mult': 2.551097640912192, 'sideways_rsi_os': 31, 'sideways_rsi_ob': 89, 'sideways_adx_thresh': 27.221045840297066, 'sideways_atr_min_pct': 0.0023399527128944806, 'sideways_atr_max_pct': 0.0861015480592838, 'sideways_tp_mult': 1.5787152347997735, 'sideways_tsl_mult': 0.8355861336740392, 'sideways_time_stop': 35, 'sideways_use_sma': True, 'sideways_use_ema': True, 'sideways_use_atr': True, 'sideways_use_adx': False, 'sideways_use_spike': False, 'sideways_rsi_required': False}.
[I 2025-08-31 13:07:36,869] Trial 572 finished with values: [-0.061145813074927946, 0.06091280594837388] and parameters: {'p_sma': 51, 'p_std': 26, 'p_atr': 12, 'p_adx': 14, 'rsi_period': 48, 'ema1': 10, 'ema2': 58, 'slip_atr_k': 0.05778026694717344, 'slip_spread_k': 0.46201928833475214, 'spread_hl_frac': 0.00734933988395901, 'bb_std_mult': 2.3524808984116863, 'rsi_os': 37, 'rsi_ob': 77, 'vol_spike': 0.024871050353443454, 'adx_thresh': 18.702196000766968, 'atr_min_pct': 0.0029678460753661366, 'atr_max_pct': 0.13129887914753335, 'tp_mult': 1.4156738853263113, 'tsl_mult': 0.8781790307891815, 'strategy': 'breakout', 'time_stop': 191, 'use_sma': True, 'use_atr': True, 'use_adx': True, 'use_ema': True, 'use_spike': True, 'rsi_required': True, 'edge_k': 0.6295730345416622, 'edge_cap': 0.7810410888410448, 'bull_strategy': 'breakout', 'bull_bb_std_mult': 1.015143429897715, 'bull_rsi_os': 36, 'bull_rsi_ob': 59, 'bull_adx_thresh': 17.965073450639913, 'bull_atr_min_pct': 0.01916938502788419, 'bull_atr_max_pct': 0.021136939267488136, 'bull_tp_mult': 1.248273998401853, 'bull_tsl_mult': 0.8347215237517995, 'bull_time_stop': 50, 'bull_use_sma': True, 'bull_use_ema': False, 'bull_use_atr': False, 'bull_use_adx': True, 'bull_use_spike': False, 'bull_rsi_required': True, 'bear_strategy': 'breakout', 'bear_bb_std_mult': 0.6772600275328897, 'bear_rsi_os': 29, 'bear_rsi_ob': 78, 'bear_adx_thresh': 14.276350915761682, 'bear_atr_min_pct': 0.016220920712292503, 'bear_atr_max_pct': 0.018912816014267704, 'bear_tp_mult': 2.420243414010263, 'bear_tsl_mult': 0.8980677229951408, 'bear_time_stop': 184, 'bear_use_sma': True, 'bear_use_ema': True, 'bear_use_atr': False, 'bear_use_adx': False, 'bear_use_spike': True, 'bear_rsi_required': True, 'sideways_strategy': 'breakout', 'sideways_bb_std_mult': 1.7104743304071106, 'sideways_rsi_os': 42, 'sideways_rsi_ob': 61, 'sideways_adx_thresh': 27.170667012164802, 'sideways_atr_min_pct': 0.0021372628122545874, 'sideways_atr_max_pct': 0.08664994332305789, 'sideways_tp_mult': 2.075201258329906, 'sideways_tsl_mult': 0.9671307138721731, 'sideways_time_stop': 181, 'sideways_use_sma': True, 'sideways_use_ema': True, 'sideways_use_atr': True, 'sideways_use_adx': False, 'sideways_use_spike': False, 'sideways_rsi_required': False}.
[I 2025-08-31 13:08:09,667] Trial 577 finished with values: [-1000000000.0, 1000000000.0] and parameters: {'p_sma': 52, 'p_std': 23, 'p_atr': 12, 'p_adx': 11, 'rsi_period': 49, 'ema1': 19, 'ema2': 11, 'slip_atr_k': 0.22425978192211954, 'slip_spread_k': 0.42539746874841794, 'spread_hl_frac': 0.0012657368940925222, 'bb_std_mult': 2.2528275516058183, 'rsi_os': 33, 'rsi_ob': 77, 'vol_spike': 0.018806375860113057, 'adx_thresh': 21.4595168326753, 'atr_min_pct': 0.0017897568932692498, 'atr_max_pct': 0.05218171922911592, 'tp_mult': 2.7470385248608986, 'tsl_mult': 0.016973529197986132, 'strategy': 'breakout', 'time_stop': 114, 'use_sma': False, 'use_atr': True, 'use_adx': False, 'use_ema': True, 'use_spike': False, 'rsi_required': False, 'edge_k': 0.7574321534985167, 'edge_cap': 0.33976491563293176, 'bull_strategy': 'breakout', 'bull_bb_std_mult': 1.65472930302079, 'bull_rsi_os': 7, 'bull_rsi_ob': 51, 'bull_adx_thresh': 30.646243095616633, 'bull_atr_min_pct': 0.020437148776974837, 'bull_atr_max_pct': 0.14991562788770246, 'bull_tp_mult': 1.3069652164134808, 'bull_tsl_mult': 0.15976818190463868, 'bull_time_stop': 296, 'bull_use_sma': False, 'bull_use_ema': True, 'bull_use_atr': False, 'bull_use_adx': True, 'bull_use_spike': True, 'bull_rsi_required': False, 'bear_strategy': 'breakout', 'bear_bb_std_mult': 1.9266599363563575, 'bear_rsi_os': 47, 'bear_rsi_ob': 82, 'bear_adx_thresh': 12.110336498714059, 'bear_atr_min_pct': 0.012160358103403601, 'bear_atr_max_pct': 0.025676784600892726, 'bear_tp_mult': 2.6234051222201855, 'bear_tsl_mult': 0.7286122337073317, 'bear_time_stop': 29, 'bear_use_sma': False, 'bear_use_ema': True, 'bear_use_atr': True, 'bear_use_adx': True, 'bear_use_spike': False, 'bear_rsi_required': True, 'sideways_strategy': 'breakout', 'sideways_bb_std_mult': 2.63087464955834, 'sideways_rsi_os': 19, 'sideways_rsi_ob': 63, 'sideways_adx_thresh': 14.957550750262737, 'sideways_atr_min_pct': 0.009479100603101812, 'sideways_atr_max_pct': 0.09593802581604481, 'sideways_tp_mult': 1.644447316443569, 'sideways_tsl_mult': 0.8787212716969586, 'sideways_time_stop': 106, 'sideways_use_sma': True, 'sideways_use_ema': False, 'sideways_use_atr': False, 'sideways_use_adx': True, 'sideways_use_spike': False, 'sideways_rsi_required': True}.
[I 2025-08-31 13:08:10,136] Trial 576 finished with values: [-1000000000.0, 1000000000.0] and parameters: {'p_sma': 52, 'p_std': 23, 'p_atr': 23, 'p_adx': 11, 'rsi_period': 49, 'ema1': 12, 'ema2': 13, 'slip_atr_k': 0.20930876053967834, 'slip_spread_k': 0.7996512941732064, 'spread_hl_frac': 0.01832460013806707, 'bb_std_mult': 2.268480240190848, 'rsi_os': 39, 'rsi_ob': 77, 'vol_spike': 0.018356031768916536, 'adx_thresh': 7.5042050432101135, 'atr_min_pct': 0.0016821075811697742, 'atr_max_pct': 0.09818399242405776, 'tp_mult': 1.944645098467809, 'tsl_mult': 0.020922374616467735, 'strategy': 'breakout', 'time_stop': 49, 'use_sma': False, 'use_atr': True, 'use_adx': False, 'use_ema': True, 'use_spike': False, 'rsi_required': False, 'edge_k': 0.8413769020722783, 'edge_cap': 0.6923907289924989, 'bull_strategy': 'breakout', 'bull_bb_std_mult': 2.7474518041591267, 'bull_rsi_os': 6, 'bull_rsi_ob': 51, 'bull_adx_thresh': 15.259061454382376, 'bull_atr_min_pct': 0.029168716549393223, 'bull_atr_max_pct': 0.12390855071680315, 'bull_tp_mult': 1.290549350698869, 'bull_tsl_mult': 0.16434790628094503, 'bull_time_stop': 292, 'bull_use_sma': False, 'bull_use_ema': True, 'bull_use_atr': False, 'bull_use_adx': True, 'bull_use_spike': True, 'bull_rsi_required': False, 'bear_strategy': 'breakout', 'bear_bb_std_mult': 0.9867349784049526, 'bear_rsi_os': 50, 'bear_rsi_ob': 82, 'bear_adx_thresh': 12.273599283403227, 'bear_atr_min_pct': 0.005023832874171021, 'bear_atr_max_pct': 0.12285474049412615, 'bear_tp_mult': 2.8140654757378756, 'bear_tsl_mult': 0.7288207855366039, 'bear_time_stop': 112, 'bear_use_sma': False, 'bear_use_ema': True, 'bear_use_atr': True, 'bear_use_adx': True, 'bear_use_spike': False, 'bear_rsi_required': True, 'sideways_strategy': 'breakout', 'sideways_bb_std_mult': 0.8442935801197107, 'sideways_rsi_os': 19, 'sideways_rsi_ob': 71, 'sideways_adx_thresh': 28.68404878548117, 'sideways_atr_min_pct': 0.009357119587964997, 'sideways_atr_max_pct': 0.012707483656453647, 'sideways_tp_mult': 1.68493026804327, 'sideways_tsl_mult': 0.876100072298143, 'sideways_time_stop': 160, 'sideways_use_sma': True, 'sideways_use_ema': False, 'sideways_use_atr': False, 'sideways_use_adx': True, 'sideways_use_spike': False, 'sideways_rsi_required': True}.
