[I 2025-08-31 13:21:24,919] Trial 666 finished with values: [-1000000000.0, 1000000000.0] and parameters: {'p_sma': 23, 'p_std': 22, 'p_atr': 18, 'p_adx': 14, 'rsi_period': 49, 'ema1': 15, 'ema2': 22, 'slip_atr_k': 0.04446077632827569, 'slip_spread_k': 0.269363041960575, 'spread_hl_frac': 0.021231881966122773, 'bb_std_mult': 2.861200543311188, 'rsi_os': 41, 'rsi_ob': 89, 'vol_spike': 0.001063388178695137, 'adx_thresh': 8.35664841723827, 'atr_min_pct': 0.02437861738250516, 'atr_max_pct': 0.04153224868114503, 'tp_mult': 2.489835007407467, 'tsl_mult': 0.7347381235087703, 'strategy': 'breakout', 'time_stop': 268, 'use_sma': False, 'use_atr': False, 'use_adx': True, 'use_ema': True, 'use_spike': True, 'rsi_required': False, 'edge_k': 0.5203488921666941, 'edge_cap': 0.6740966910077534, 'bull_strategy': 'mean_reversion', 'bull_bb_std_mult': 2.952530541180676, 'bull_rsi_os': 6, 'bull_rsi_ob': 83, 'bull_adx_thresh': 18.75418470772232, 'bull_atr_min_pct': 0.022482364892589892, 'bull_atr_max_pct': 0.12392366264500006, 'bull_tp_mult': 2.4059028028858207, 'bull_tsl_mult': 0.2825205203931576, 'bull_time_stop': 200, 'bull_use_sma': True, 'bull_use_ema': False, 'bull_use_atr': True, 'bull_use_adx': True, 'bull_use_spike': True, 'bull_rsi_required': True, 'bear_strategy': 'mean_reversion', 'bear_bb_std_mult': 3.5312848525009546, 'bear_rsi_os': 8, 'bear_rsi_ob': 70, 'bear_adx_thresh': 22.103303723569258, 'bear_atr_min_pct': 8.673295155607781e-05, 'bear_atr_max_pct': 0.12693078781629252, 'bear_tp_mult': 1.285412067659794, 'bear_tsl_mult': 0.7044585913066246, 'bear_time_stop': 110, 'bear_use_sma': False, 'bear_use_ema': False, 'bear_use_atr': False, 'bear_use_adx': False, 'bear_use_spike': True, 'bear_rsi_required': False, 'sideways_strategy': 'breakout', 'sideways_bb_std_mult': 2.8236930082362965, 'sideways_rsi_os': 30, 'sideways_rsi_ob': 65, 'sideways_adx_thresh': 24.765820444865213, 'sideways_atr_min_pct': 0.0032990195863399742, 'sideways_atr_max_pct': 0.14729312418832058, 'sideways_tp_mult': 1.7643832892816422, 'sideways_tsl_mult': 0.11015257675674017, 'sideways_time_stop': 49, 'sideways_use_sma': False, 'sideways_use_ema': False, 'sideways_use_atr': True, 'sideways_use_adx': True, 'sideways_use_spike': False, 'sideways_rsi_required': True}.
[I 2025-08-31 13:21:25,523] Trial 667 finished with values: [-1000000000.0, 1000000000.0] and parameters: {'p_sma': 23, 'p_std': 21, 'p_atr': 16, 'p_adx': 14, 'rsi_period': 69, 'ema1': 9, 'ema2': 21, 'slip_atr_k': 0.044476072385603825, 'slip_spread_k': 0.9995410182676387, 'spread_hl_frac': 0.019701733014351366, 'bb_std_mult': 2.4578445427594966, 'rsi_os': 41, 'rsi_ob': 92, 'vol_spike': 0.01346762424964595, 'adx_thresh': 8.163779221625122, 'atr_min_pct': 0.024154500919979675, 'atr_max_pct': 0.059245431562236536, 'tp_mult': 2.526481174485483, 'tsl_mult': 0.6443828058816885, 'strategy': 'breakout', 'time_stop': 162, 'use_sma': False, 'use_atr': False, 'use_adx': True, 'use_ema': True, 'use_spike': True, 'rsi_required': False, 'edge_k': 0.5146950816740535, 'edge_cap': 0.6722759441718642, 'bull_strategy': 'mean_reversion', 'bull_bb_std_mult': 2.783305622299496, 'bull_rsi_os': 6, 'bull_rsi_ob': 83, 'bull_adx_thresh': 18.57262700204246, 'bull_atr_min_pct': 0.022481975276842044, 'bull_atr_max_pct': 0.1239498260797328, 'bull_tp_mult': 2.4293743230730884, 'bull_tsl_mult': 0.2892999982964374, 'bull_time_stop': 199, 'bull_use_sma': True, 'bull_use_ema': False, 'bull_use_atr': True, 'bull_use_adx': False, 'bull_use_spike': True, 'bull_rsi_required': True, 'bear_strategy': 'breakout', 'bear_bb_std_mult': 3.538463400264343, 'bear_rsi_os': 12, 'bear_rsi_ob': 69, 'bear_adx_thresh': 16.863374919280794, 'bear_atr_min_pct': 0.0003986741142128908, 'bear_atr_max_pct': 0.11991617287477328, 'bear_tp_mult': 1.3145658705346466, 'bear_tsl_mult': 0.7024493865568112, 'bear_time_stop': 198, 'bear_use_sma': False, 'bear_use_ema': True, 'bear_use_atr': False, 'bear_use_adx': False, 'bear_use_spike': True, 'bear_rsi_required': True, 'sideways_strategy': 'breakout', 'sideways_bb_std_mult': 2.857475604520689, 'sideways_rsi_os': 30, 'sideways_rsi_ob': 65, 'sideways_adx_thresh': 24.798024785352194, 'sideways_atr_min_pct': 0.005419956723110717, 'sideways_atr_max_pct': 0.14162582868423215, 'sideways_tp_mult': 1.759037712370433, 'sideways_tsl_mult': 0.8921389110014761, 'sideways_time_stop': 66, 'sideways_use_sma': False, 'sideways_use_ema': False, 'sideways_use_atr': True, 'sideways_use_adx': True, 'sideways_use_spike': True, 'sideways_rsi_required': True}.
[I 2025-08-31 13:21:25,631] Trial 669 finished with values: [-1000000000.0, 1000000000.0] and parameters: {'p_sma': 37, 'p_std': 22, 'p_atr': 16, 'p_adx': 14, 'rsi_period': 36, 'ema1': 16, 'ema2': 22, 'slip_atr_k': 0.03987611294185467, 'slip_spread_k': 0.33735702082402474, 'spread_hl_frac': 0.01738662671786563, 'bb_std_mult': 3.4715482508777176, 'rsi_os': 41, 'rsi_ob': 87, 'vol_spike': 0.016079534306781548, 'adx_thresh': 7.8701359906791515, 'atr_min_pct': 0.022026060901428807, 'atr_max_pct': 0.0509363859007327, 'tp_mult': 2.5510151330037503, 'tsl_mult': 0.8226159777776064, 'strategy': 'breakout', 'time_stop': 162, 'use_sma': False, 'use_atr': False, 'use_adx': True, 'use_ema': True, 'use_spike': True, 'rsi_required': False, 'edge_k': 0.5321874132352467, 'edge_cap': 0.6684110617140486, 'bull_strategy': 'mean_reversion', 'bull_bb_std_mult': 2.8160807274398594, 'bull_rsi_os': 24, 'bull_rsi_ob': 83, 'bull_adx_thresh': 18.527719626696516, 'bull_atr_min_pct': 0.021442888890344815, 'bull_atr_max_pct': 0.12582233413939686, 'bull_tp_mult': 2.4068028656721774, 'bull_tsl_mult': 0.2954080183475351, 'bull_time_stop': 201, 'bull_use_sma': True, 'bull_use_ema': True, 'bull_use_atr': True, 'bull_use_adx': False, 'bull_use_spike': True, 'bull_rsi_required': True, 'bear_strategy': 'breakout', 'bear_bb_std_mult': 3.5785022290413133, 'bear_rsi_os': 25, 'bear_rsi_ob': 90, 'bear_adx_thresh': 17.026851021695503, 'bear_atr_min_pct': 9.783477733022253e-05, 'bear_atr_max_pct': 0.1224633737406572, 'bear_tp_mult': 1.2735038982608915, 'bear_tsl_mult': 0.650175476286191, 'bear_time_stop': 198, 'bear_use_sma': False, 'bear_use_ema': True, 'bear_use_atr': False, 'bear_use_adx': False, 'bear_use_spike': True, 'bear_rsi_required': True, 'sideways_strategy': 'breakout', 'sideways_bb_std_mult': 2.737624453656805, 'sideways_rsi_os': 30, 'sideways_rsi_ob': 75, 'sideways_adx_thresh': 23.84279104489813, 'sideways_atr_min_pct': 0.004439416341375555, 'sideways_atr_max_pct': 0.1467628979513589, 'sideways_tp_mult': 1.7184166841453492, 'sideways_tsl_mult': 0.8334619647726103, 'sideways_time_stop': 67, 'sideways_use_sma': False, 'sideways_use_ema': False, 'sideways_use_atr': True, 'sideways_use_adx': True, 'sideways_use_spike': True, 'sideways_rsi_required': True}.
[I 2025-08-31 13:21:25,728] Trial 668 finished with values: [-1000000000.0, 1000000000.0] and parameters: {'p_sma': 43, 'p_std': 22, 'p_atr': 16, 'p_adx': 14, 'rsi_period': 69, 'ema1': 9, 'ema2': 22, 'slip_atr_k': 0.0435126701743632, 'slip_spread_k': 0.269232309602744, 'spread_hl_frac': 0.047929244109354126, 'bb_std_mult': 2.860895305192052, 'rsi_os': 40, 'rsi_ob': 92, 'vol_spike': 0.010926559855048694, 'adx_thresh': 8.169064766163421, 'atr_min_pct': 0.0218649772252386, 'atr_max_pct': 0.04073802500188227, 'tp_mult': 2.545265161627964, 'tsl_mult': 0.5956359162682129, 'strategy': 'breakout', 'time_stop': 268, 'use_sma': False, 'use_atr': False, 'use_adx': True, 'use_ema': True, 'use_spike': True, 'rsi_required': False, 'edge_k': 0.5261774102898337, 'edge_cap': 0.6702529760488015, 'bull_strategy': 'mean_reversion', 'bull_bb_std_mult': 2.7902827281733935, 'bull_rsi_os': 6, 'bull_rsi_ob': 83, 'bull_adx_thresh': 17.97057828833083, 'bull_atr_min_pct': 0.02256354920345801, 'bull_atr_max_pct': 0.13761556618969448, 'bull_tp_mult': 2.1665780833224857, 'bull_tsl_mult': 0.27910387804684383, 'bull_time_stop': 201, 'bull_use_sma': True, 'bull_use_ema': False, 'bull_use_atr': True, 'bull_use_adx': False, 'bull_use_spike': True, 'bull_rsi_required': True, 'bear_strategy': 'breakout', 'bear_bb_std_mult': 3.5995475093908236, 'bear_rsi_os': 28, 'bear_rsi_ob': 54, 'bear_adx_thresh': 16.837756322607152, 'bear_atr_min_pct': 0.00034592977373647975, 'bear_atr_max_pct': 0.12273727178894316, 'bear_tp_mult': 1.3028312583194503, 'bear_tsl_mult': 0.6353754288808992, 'bear_time_stop': 165, 'bear_use_sma': False, 'bear_use_ema': True, 'bear_use_atr': False, 'bear_use_adx': False, 'bear_use_spike': True, 'bear_rsi_required': True, 'sideways_strategy': 'breakout', 'sideways_bb_std_mult': 2.725296901553922, 'sideways_rsi_os': 30, 'sideways_rsi_ob': 65, 'sideways_adx_thresh': 23.76689218634099, 'sideways_atr_min_pct': 0.003338470929498176, 'sideways_atr_max_pct': 0.1460210742128508, 'sideways_tp_mult': 1.7073745759260819, 'sideways_tsl_mult': 0.8998153256487804, 'sideways_time_stop': 58, 'sideways_use_sma': False, 'sideways_use_ema': False, 'sideways_use_atr': True, 'sideways_use_adx': True, 'sideways_use_spike': True, 'sideways_rsi_required': True}.
[I 2025-08-31 13:21:59,839] Trial 672 finished with values: [-0.07770999355451058, 0.07721340503031937] and parameters: {'p_sma': 31, 'p_std': 22, 'p_atr': 19, 'p_adx': 14, 'rsi_period': 16, 'ema1': 10, 'ema2': 20, 'slip_atr_k': 0.045316342211926645, 'slip_spread_k': 0.428594897394696, 'spread_hl_frac': 0.035877758997008485, 'bb_std_mult': 0.7465621362435897, 'rsi_os': 18, 'rsi_ob': 91, 'vol_spike': 0.020251553155482136, 'adx_thresh': 10.378178340166965, 'atr_min_pct': 0.02740548748108456, 'atr_max_pct': 0.039824018787347676, 'tp_mult': 2.5549481430499434, 'tsl_mult': 0.5923775600854319, 'strategy': 'mean_reversion', 'time_stop': 154, 'use_sma': False, 'use_atr': False, 'use_adx': True, 'use_ema': False, 'use_spike': True, 'rsi_required': False, 'edge_k': 0.5927984990440253, 'edge_cap': 0.6230953681902143, 'bull_strategy': 'mean_reversion', 'bull_bb_std_mult': 3.5882206810125368, 'bull_rsi_os': 5, 'bull_rsi_ob': 86, 'bull_adx_thresh': 17.71494996472044, 'bull_atr_min_pct': 0.021578070583478715, 'bull_atr_max_pct': 0.13143082837451123, 'bull_tp_mult': 2.0386344853028224, 'bull_tsl_mult': 0.2551079267285772, 'bull_time_stop': 174, 'bull_use_sma': True, 'bull_use_ema': True, 'bull_use_atr': True, 'bull_use_adx': True, 'bull_use_spike': True, 'bull_rsi_required': True, 'bear_strategy': 'breakout', 'bear_bb_std_mult': 3.3608038600288057, 'bear_rsi_os': 28, 'bear_rsi_ob': 72, 'bear_adx_thresh': 25.221344061877147, 'bear_atr_min_pct': 0.0012847915194798016, 'bear_atr_max_pct': 0.12289203920691417, 'bear_tp_mult': 1.3707610674517685, 'bear_tsl_mult': 0.6310155818294882, 'bear_time_stop': 181, 'bear_use_sma': False, 'bear_use_ema': True, 'bear_use_atr': False, 'bear_use_adx': False, 'bear_use_spike': False, 'bear_rsi_required': True, 'sideways_strategy': 'breakout', 'sideways_bb_std_mult': 2.740878368239907, 'sideways_rsi_os': 29, 'sideways_rsi_ob': 66, 'sideways_adx_thresh': 23.16912218695599, 'sideways_atr_min_pct': 0.0032510765074870835, 'sideways_atr_max_pct': 0.14292727435020788, 'sideways_tp_mult': 1.7142881589218524, 'sideways_tsl_mult': 0.48561428289572806, 'sideways_time_stop': 24, 'sideways_use_sma': False, 'sideways_use_ema': True, 'sideways_use_atr': True, 'sideways_use_adx': True, 'sideways_use_spike': False, 'sideways_rsi_required': True}.
[I 2025-08-31 13:21:59,865] Trial 671 finished with values: [-1000000000.0, 1000000000.0] and parameters: {'p_sma': 25, 'p_std': 22, 'p_atr': 16, 'p_adx': 14, 'rsi_period': 48, 'ema1': 10, 'ema2': 20, 'slip_atr_k': 0.039852775727298465, 'slip_spread_k': 0.3010789639646315, 'spread_hl_frac': 0.01727116391232926, 'bb_std_mult': 2.9635029514794935, 'rsi_os': 37, 'rsi_ob': 92, 'vol_spike': 0.018876832510759382, 'adx_thresh': 5.03932023007554, 'atr_min_pct': 0.026468239904740662, 'atr_max_pct': 0.05127020103238591, 'tp_mult': 2.5409824033773254, 'tsl_mult': 0.9094931251631623, 'strategy': 'mean_reversion', 'time_stop': 154, 'use_sma': False, 'use_atr': False, 'use_adx': True, 'use_ema': True, 'use_spike': True, 'rsi_required': False, 'edge_k': 0.5946195068126826, 'edge_cap': 0.6472121192880891, 'bull_strategy': 'mean_reversion', 'bull_bb_std_mult': 2.7699226793844445, 'bull_rsi_os': 5, 'bull_rsi_ob': 86, 'bull_adx_thresh': 18.15867934767274, 'bull_atr_min_pct': 0.021362703061273282, 'bull_atr_max_pct': 0.12070919504473625, 'bull_tp_mult': 2.1724120383785017, 'bull_tsl_mult': 0.258293172341091, 'bull_time_stop': 179, 'bull_use_sma': True, 'bull_use_ema': True, 'bull_use_atr': True, 'bull_use_adx': False, 'bull_use_spike': True, 'bull_rsi_required': True, 'bear_strategy': 'breakout', 'bear_bb_std_mult': 3.590686226313869, 'bear_rsi_os': 28, 'bear_rsi_ob': 75, 'bear_adx_thresh': 17.341236457871023, 'bear_atr_min_pct': 0.0014033181200850504, 'bear_atr_max_pct': 0.12246470675884334, 'bear_tp_mult': 1.0844040701747173, 'bear_tsl_mult': 0.6375309503056055, 'bear_time_stop': 68, 'bear_use_sma': False, 'bear_use_ema': True, 'bear_use_atr': False, 'bear_use_adx': False, 'bear_use_spike': False, 'bear_rsi_required': True, 'sideways_strategy': 'breakout', 'sideways_bb_std_mult': 2.728949486785084, 'sideways_rsi_os': 21, 'sideways_rsi_ob': 66, 'sideways_adx_thresh': 23.451198914875768, 'sideways_atr_min_pct': 0.0033354862359973765, 'sideways_atr_max_pct': 0.14646403109023767, 'sideways_tp_mult': 1.7005428039446957, 'sideways_tsl_mult': 0.5605435705208509, 'sideways_time_stop': 58, 'sideways_use_sma': False, 'sideways_use_ema': False, 'sideways_use_atr': True, 'sideways_use_adx': True, 'sideways_use_spike': True, 'sideways_rsi_required': True}.
[I 2025-08-31 13:22:00,167] Trial 670 finished with values: [-1000000000.0, 1000000000.0] and parameters: {'p_sma': 44, 'p_std': 22, 'p_atr': 16, 'p_adx': 14, 'rsi_period': 70, 'ema1': 10, 'ema2': 22, 'slip_atr_k': 0.04412458355612028, 'slip_spread_k': 0.9998699333925923, 'spread_hl_frac': 0.035528714842095195, 'bb_std_mult': 0.736310898373888, 'rsi_os': 40, 'rsi_ob': 92, 'vol_spike': 0.018935540349354383, 'adx_thresh': 10.11676419409257, 'atr_min_pct': 0.026285556825029255, 'atr_max_pct': 0.0509452610142459, 'tp_mult': 2.567232027739778, 'tsl_mult': 0.823047015469268, 'strategy': 'mean_reversion', 'time_stop': 161, 'use_sma': False, 'use_atr': False, 'use_adx': True, 'use_ema': True, 'use_spike': True, 'rsi_required': False, 'edge_k': 0.5301994965384582, 'edge_cap': 0.6221284106137459, 'bull_strategy': 'mean_reversion', 'bull_bb_std_mult': 2.794032310219087, 'bull_rsi_os': 6, 'bull_rsi_ob': 83, 'bull_adx_thresh': 17.999757444681805, 'bull_atr_min_pct': 0.02155029552171487, 'bull_atr_max_pct': 0.12071910227225242, 'bull_tp_mult': 2.1682638359569792, 'bull_tsl_mult': 0.283355244238488, 'bull_time_stop': 174, 'bull_use_sma': True, 'bull_use_ema': True, 'bull_use_atr': True, 'bull_use_adx': False, 'bull_use_spike': True, 'bull_rsi_required': True, 'bear_strategy': 'breakout', 'bear_bb_std_mult': 3.384219326936862, 'bear_rsi_os': 27, 'bear_rsi_ob': 72, 'bear_adx_thresh': 23.543323957534273, 'bear_atr_min_pct': 0.001339941406284357, 'bear_atr_max_pct': 0.12082651794777662, 'bear_tp_mult': 1.333791908842123, 'bear_tsl_mult': 0.6356452182744313, 'bear_time_stop': 182, 'bear_use_sma': False, 'bear_use_ema': True, 'bear_use_atr': False, 'bear_use_adx': False, 'bear_use_spike': False, 'bear_rsi_required': True, 'sideways_strategy': 'breakout', 'sideways_bb_std_mult': 2.7339987360039912, 'sideways_rsi_os': 30, 'sideways_rsi_ob': 66, 'sideways_adx_thresh': 23.73818178028443, 'sideways_atr_min_pct': 0.004240068207131522, 'sideways_atr_max_pct': 0.14251819108769684, 'sideways_tp_mult': 1.728808234364498, 'sideways_tsl_mult': 0.9094858613641019, 'sideways_time_stop': 61, 'sideways_use_sma': False, 'sideways_use_ema': False, 'sideways_use_atr': True, 'sideways_use_adx': True, 'sideways_use_spike': True, 'sideways_rsi_required': True}.
[I 2025-08-31 13:22:00,255] Trial 673 finished with values: [-1000000000.0, 1000000000.0] and parameters: {'p_sma': 25, 'p_std': 22, 'p_atr': 15, 'p_adx': 12, 'rsi_period': 48, 'ema1': 10, 'ema2': 20, 'slip_atr_k': 0.044245275797498464, 'slip_spread_k': 0.9518652229635225, 'spread_hl_frac': 0.01933264352890056, 'bb_std_mult': 2.17653389091014, 'rsi_os': 26, 'rsi_ob': 91, 'vol_spike': 0.019393333509210853, 'adx_thresh': 7.150673015379699, 'atr_min_pct': 0.026385682785871584, 'atr_max_pct': 0.05254868967352355, 'tp_mult': 2.467449013880969, 'tsl_mult': 0.9088419549577375, 'strategy': 'mean_reversion', 'time_stop': 155, 'use_sma': False, 'use_atr': False, 'use_adx': True, 'use_ema': False, 'use_spike': True, 'rsi_required': False, 'edge_k': 0.5851667760933191, 'edge_cap': 0.6479633675414476, 'bull_strategy': 'mean_reversion', 'bull_bb_std_mult': 2.759270312405337, 'bull_rsi_os': 28, 'bull_rsi_ob': 87, 'bull_adx_thresh': 17.927786357644592, 'bull_atr_min_pct': 0.02132352922820937, 'bull_atr_max_pct': 0.13112657227579075, 'bull_tp_mult': 2.218137304562029, 'bull_tsl_mult': 0.2612701287293232, 'bull_time_stop': 178, 'bull_use_sma': False, 'bull_use_ema': True, 'bull_use_atr': True, 'bull_use_adx': True, 'bull_use_spike': True, 'bull_rsi_required': True, 'bear_strategy': 'breakout', 'bear_bb_std_mult': 3.3630977424019832, 'bear_rsi_os': 26, 'bear_rsi_ob': 72, 'bear_adx_thresh': 19.28240108179646, 'bear_atr_min_pct': 0.0014455356408361044, 'bear_atr_max_pct': 0.11781021939039485, 'bear_tp_mult': 1.0882473704438933, 'bear_tsl_mult': 0.7014810576821559, 'bear_time_stop': 123, 'bear_use_sma': False, 'bear_use_ema': True, 'bear_use_atr': False, 'bear_use_adx': False, 'bear_use_spike': False, 'bear_rsi_required': True, 'sideways_strategy': 'mean_reversion', 'sideways_bb_std_mult': 2.747213050282628, 'sideways_rsi_os': 29, 'sideways_rsi_ob': 66, 'sideways_adx_thresh': 24.031198447509347, 'sideways_atr_min_pct': 0.004281401202344132, 'sideways_atr_max_pct': 0.14371046835044107, 'sideways_tp_mult': 1.6998624938712958, 'sideways_tsl_mult': 0.28998416668959354, 'sideways_time_stop': 34, 'sideways_use_sma': False, 'sideways_use_ema': True, 'sideways_use_atr': True, 'sideways_use_adx': True, 'sideways_use_spike': False, 'sideways_rsi_required': True}.
[I 2025-08-31 13:22:33,091] Trial 677 finished with values: [-0.03122630737339982, 0.030581803081684192] and parameters: {'p_sma': 41, 'p_std': 20, 'p_atr': 14, 'p_adx': 13, 'rsi_period': 45, 'ema1': 14, 'ema2': 19, 'slip_atr_k': 0.03269912267715039, 'slip_spread_k': 0.8423073378040306, 'spread_hl_frac': 0.01951266052465363, 'bb_std_mult': 1.292134450034754, 'rsi_os': 34, 'rsi_ob': 83, 'vol_spike': 0.00903423114155701, 'adx_thresh': 6.7726547853292205, 'atr_min_pct': 0.02889362151268693, 'atr_max_pct': 0.045556139231683085, 'tp_mult': 2.4240929192373386, 'tsl_mult': 0.752633856926536, 'strategy': 'breakout', 'time_stop': 179, 'use_sma': False, 'use_atr': False, 'use_adx': True, 'use_ema': True, 'use_spike': True, 'rsi_required': False, 'edge_k': 0.4320583900032243, 'edge_cap': 0.6844469774585142, 'bull_strategy': 'mean_reversion', 'bull_bb_std_mult': 2.9042275590878006, 'bull_rsi_os': 5, 'bull_rsi_ob': 89, 'bull_adx_thresh': 19.577701270316307, 'bull_atr_min_pct': 0.022074632688463693, 'bull_atr_max_pct': 0.13773085550458858, 'bull_tp_mult': 2.304431660227524, 'bull_tsl_mult': 0.25464469063784, 'bull_time_stop': 215, 'bull_use_sma': False, 'bull_use_ema': True, 'bull_use_atr': True, 'bull_use_adx': True, 'bull_use_spike': True, 'bull_rsi_required': True, 'bear_strategy': 'breakout', 'bear_bb_std_mult': 3.4580898530527544, 'bear_rsi_os': 30, 'bear_rsi_ob': 83, 'bear_adx_thresh': 24.711625457526083, 'bear_atr_min_pct': 0.0006043055502686891, 'bear_atr_max_pct': 0.11230176111905585, 'bear_tp_mult': 1.138489147670298, 'bear_tsl_mult': 0.6762596707601372, 'bear_time_stop': 202, 'bear_use_sma': False, 'bear_use_ema': True, 'bear_use_atr': False, 'bear_use_adx': False, 'bear_use_spike': True, 'bear_rsi_required': True, 'sideways_strategy': 'mean_reversion', 'sideways_bb_std_mult': 2.7756827587136934, 'sideways_rsi_os': 27, 'sideways_rsi_ob': 64, 'sideways_adx_thresh': 24.979378366129442, 'sideways_atr_min_pct': 0.0033011214703699615, 'sideways_atr_max_pct': 0.14753602993765744, 'sideways_tp_mult': 1.7939240615541512, 'sideways_tsl_mult': 0.8654572945580191, 'sideways_time_stop': 26, 'sideways_use_sma': False, 'sideways_use_ema': False, 'sideways_use_atr': True, 'sideways_use_adx': True, 'sideways_use_spike': False, 'sideways_rsi_required': False}.
