[I 2025-08-31 13:12:13,383] Trial 602 finished with values: [-0.0526872306695666, 0.05245333507263674] and parameters: {'p_sma': 24, 'p_std': 22, 'p_atr': 12, 'p_adx': 14, 'rsi_period': 48, 'ema1': 19, 'ema2': 18, 'slip_atr_k': 0.0703991088976202, 'slip_spread_k': 0.44043963643030326, 'spread_hl_frac': 0.01865095076324466, 'bb_std_mult': 2.205235906878651, 'rsi_os': 39, 'rsi_ob': 58, 'vol_spike': 0.022580026765791864, 'adx_thresh': 24.65971222181882, 'atr_min_pct': 0.0011762352455305589, 'atr_max_pct': 0.1256571695958027, 'tp_mult': 2.6251649431464186, 'tsl_mult': 0.001074030351316431, 'strategy': 'breakout', 'time_stop': 170, 'use_sma': False, 'use_atr': False, 'use_adx': False, 'use_ema': True, 'use_spike': False, 'rsi_required': True, 'edge_k': 1.9376611548665437, 'edge_cap': 0.11952906630340321, 'bull_strategy': 'breakout', 'bull_bb_std_mult': 2.7764936972603116, 'bull_rsi_os': 8, 'bull_rsi_ob': 50, 'bull_adx_thresh': 12.503731887864653, 'bull_atr_min_pct': 5.8052017716787516e-05, 'bull_atr_max_pct': 0.11817797342802454, 'bull_tp_mult': 2.343342620031455, 'bull_tsl_mult': 0.7614181181039239, 'bull_time_stop': 269, 'bull_use_sma': True, 'bull_use_ema': True, 'bull_use_atr': True, 'bull_use_adx': False, 'bull_use_spike': False, 'bull_rsi_required': False, 'bear_strategy': 'mean_reversion', 'bear_bb_std_mult': 3.0260779077128896, 'bear_rsi_os': 13, 'bear_rsi_ob': 73, 'bear_adx_thresh': 14.060585190547759, 'bear_atr_min_pct': 0.01950555345980288, 'bear_atr_max_pct': 0.06555295230333846, 'bear_tp_mult': 2.8502573446155326, 'bear_tsl_mult': 0.7694682645831197, 'bear_time_stop': 20, 'bear_use_sma': True, 'bear_use_ema': False, 'bear_use_atr': True, 'bear_use_adx': True, 'bear_use_spike': True, 'bear_rsi_required': False, 'sideways_strategy': 'breakout', 'sideways_bb_std_mult': 2.6717511851081035, 'sideways_rsi_os': 26, 'sideways_rsi_ob': 70, 'sideways_adx_thresh': 27.409156126165527, 'sideways_atr_min_pct': 0.02579478398875457, 'sideways_atr_max_pct': 0.12850480952471321, 'sideways_tp_mult': 1.5735479812439528, 'sideways_tsl_mult': 0.24119157718348316, 'sideways_time_stop': 204, 'sideways_use_sma': True, 'sideways_use_ema': False, 'sideways_use_atr': False, 'sideways_use_adx': False, 'sideways_use_spike': True, 'sideways_rsi_required': False}.
[I 2025-08-31 13:12:13,599] Trial 605 finished with values: [-1000000000.0, 1000000000.0] and parameters: {'p_sma': 52, 'p_std': 22, 'p_atr': 18, 'p_adx': 7, 'rsi_period': 65, 'ema1': 19, 'ema2': 17, 'slip_atr_k': 0.06565103362390359, 'slip_spread_k': 0.03716853072752224, 'spread_hl_frac': 0.01754892347496375, 'bb_std_mult': 0.8002668911551285, 'rsi_os': 39, 'rsi_ob': 92, 'vol_spike': 0.014094069118223926, 'adx_thresh': 17.688848905426756, 'atr_min_pct': 0.0018366811601544964, 'atr_max_pct': 0.03273721850515182, 'tp_mult': 2.9353112350896833, 'tsl_mult': 0.0008283184411375967, 'strategy': 'breakout', 'time_stop': 172, 'use_sma': True, 'use_atr': True, 'use_adx': False, 'use_ema': True, 'use_spike': True, 'rsi_required': False, 'edge_k': 0.758886380349219, 'edge_cap': 0.7035953642253804, 'bull_strategy': 'breakout', 'bull_bb_std_mult': 2.741191431756677, 'bull_rsi_os': 5, 'bull_rsi_ob': 50, 'bull_adx_thresh': 27.235837111047786, 'bull_atr_min_pct': 0.021329022953878098, 'bull_atr_max_pct': 0.024478917955286478, 'bull_tp_mult': 2.0081652807353807, 'bull_tsl_mult': 0.1832434344853282, 'bull_time_stop': 196, 'bull_use_sma': True, 'bull_use_ema': False, 'bull_use_atr': True, 'bull_use_adx': True, 'bull_use_spike': False, 'bull_rsi_required': False, 'bear_strategy': 'breakout', 'bear_bb_std_mult': 3.487343408939097, 'bear_rsi_os': 29, 'bear_rsi_ob': 68, 'bear_adx_thresh': 9.298186399958576, 'bear_atr_min_pct': 0.01365844110701727, 'bear_atr_max_pct': 0.1294453421789268, 'bear_tp_mult': 2.857747103367242, 'bear_tsl_mult': 0.35300660579187626, 'bear_time_stop': 49, 'bear_use_sma': True, 'bear_use_ema': True, 'bear_use_atr': True, 'bear_use_adx': True, 'bear_use_spike': True, 'bear_rsi_required': True, 'sideways_strategy': 'breakout', 'sideways_bb_std_mult': 2.5592393498758477, 'sideways_rsi_os': 30, 'sideways_rsi_ob': 67, 'sideways_adx_thresh': 26.681611840746235, 'sideways_atr_min_pct': 0.002358604432454, 'sideways_atr_max_pct': 0.11752797053114386, 'sideways_tp_mult': 2.76955791744093, 'sideways_tsl_mult': 0.24461212446802794, 'sideways_time_stop': 218, 'sideways_use_sma': True, 'sideways_use_ema': False, 'sideways_use_atr': False, 'sideways_use_adx': False, 'sideways_use_spike': True, 'sideways_rsi_required': True}.
[I 2025-08-31 13:12:13,696] Trial 604 finished with values: [-0.05020362812760304, 0.05001256310425378] and parameters: {'p_sma': 53, 'p_std': 24, 'p_atr': 18, 'p_adx': 18, 'rsi_period': 48, 'ema1': 19, 'ema2': 17, 'slip_atr_k': 0.20257711422004204, 'slip_spread_k': 0.4422816841466649, 'spread_hl_frac': 0.017174419005408437, 'bb_std_mult': 2.333721275276743, 'rsi_os': 24, 'rsi_ob': 77, 'vol_spike': 0.01303005664342717, 'adx_thresh': 20.33088679749, 'atr_min_pct': 0.0015267221910534984, 'atr_max_pct': 0.1257451924390696, 'tp_mult': 1.6446006156081843, 'tsl_mult': 0.08485482024305377, 'strategy': 'breakout', 'time_stop': 172, 'use_sma': False, 'use_atr': False, 'use_adx': False, 'use_ema': True, 'use_spike': False, 'rsi_required': False, 'edge_k': 0.7637765517386592, 'edge_cap': 0.3576362179778174, 'bull_strategy': 'breakout', 'bull_bb_std_mult': 0.6024294223140392, 'bull_rsi_os': 26, 'bull_rsi_ob': 50, 'bull_adx_thresh': 20.710294092610592, 'bull_atr_min_pct': 0.00044916097514066666, 'bull_atr_max_pct': 0.14156861295394257, 'bull_tp_mult': 1.2592949231414, 'bull_tsl_mult': 0.17984519510285263, 'bull_time_stop': 117, 'bull_use_sma': True, 'bull_use_ema': True, 'bull_use_atr': True, 'bull_use_adx': True, 'bull_use_spike': False, 'bull_rsi_required': False, 'bear_strategy': 'mean_reversion', 'bear_bb_std_mult': 3.3170927666075913, 'bear_rsi_os': 36, 'bear_rsi_ob': 72, 'bear_adx_thresh': 28.021283795495165, 'bear_atr_min_pct': 0.019682539616270454, 'bear_atr_max_pct': 0.12862723999858816, 'bear_tp_mult': 2.8749411628063086, 'bear_tsl_mult': 0.7567178288788856, 'bear_time_stop': 196, 'bear_use_sma': True, 'bear_use_ema': False, 'bear_use_atr': True, 'bear_use_adx': True, 'bear_use_spike': True, 'bear_rsi_required': False, 'sideways_strategy': 'breakout', 'sideways_bb_std_mult': 2.6801281127814867, 'sideways_rsi_os': 31, 'sideways_rsi_ob': 64, 'sideways_adx_thresh': 26.778978446836625, 'sideways_atr_min_pct': 0.010153457606836901, 'sideways_atr_max_pct': 0.11889695770157932, 'sideways_tp_mult': 1.734214940669665, 'sideways_tsl_mult': 0.8195178096922632, 'sideways_time_stop': 69, 'sideways_use_sma': True, 'sideways_use_ema': False, 'sideways_use_atr': False, 'sideways_use_adx': False, 'sideways_use_spike': True, 'sideways_rsi_required': True}.
[I 2025-08-31 13:12:49,892] Trial 606 finished with values: [-1000000000.0, 1000000000.0] and parameters: {'p_sma': 25, 'p_std': 24, 'p_atr': 11, 'p_adx': 14, 'rsi_period': 48, 'ema1': 21, 'ema2': 17, 'slip_atr_k': 0.056444966519284615, 'slip_spread_k': 0.29157857732548087, 'spread_hl_frac': 0.017104450402190927, 'bb_std_mult': 0.8005126456043947, 'rsi_os': 34, 'rsi_ob': 78, 'vol_spike': 0.03784002333089869, 'adx_thresh': 21.297297048656247, 'atr_min_pct': 0.0017259376828866095, 'atr_max_pct': 0.1314225529403768, 'tp_mult': 2.9398015584941755, 'tsl_mult': 0.07173336805259294, 'strategy': 'breakout', 'time_stop': 79, 'use_sma': True, 'use_atr': True, 'use_adx': False, 'use_ema': True, 'use_spike': True, 'rsi_required': True, 'edge_k': 1.3327434023947686, 'edge_cap': 0.710672328711061, 'bull_strategy': 'mean_reversion', 'bull_bb_std_mult': 0.71780641439612, 'bull_rsi_os': 8, 'bull_rsi_ob': 48, 'bull_adx_thresh': 20.752869535225198, 'bull_atr_min_pct': 0.021070498327686323, 'bull_atr_max_pct': 0.14998555337574246, 'bull_tp_mult': 1.9170411634154279, 'bull_tsl_mult': 0.18964881821501964, 'bull_time_stop': 299, 'bull_use_sma': True, 'bull_use_ema': False, 'bull_use_atr': False, 'bull_use_adx': True, 'bull_use_spike': False, 'bull_rsi_required': False, 'bear_strategy': 'breakout', 'bear_bb_std_mult': 3.32484735887758, 'bear_rsi_os': 43, 'bear_rsi_ob': 74, 'bear_adx_thresh': 27.96833545962427, 'bear_atr_min_pct': 0.020285414303717435, 'bear_atr_max_pct': 0.1293344595943082, 'bear_tp_mult': 2.9223361044967078, 'bear_tsl_mult': 0.4813061540769427, 'bear_time_stop': 194, 'bear_use_sma': True, 'bear_use_ema': True, 'bear_use_atr': True, 'bear_use_adx': True, 'bear_use_spike': True, 'bear_rsi_required': True, 'sideways_strategy': 'mean_reversion', 'sideways_bb_std_mult': 2.677544227939301, 'sideways_rsi_os': 30, 'sideways_rsi_ob': 67, 'sideways_adx_thresh': 25.880440555300066, 'sideways_atr_min_pct': 0.0063238827625790445, 'sideways_atr_max_pct': 0.13088012611639302, 'sideways_tp_mult': 1.6176665446366891, 'sideways_tsl_mult': 0.23933224199098968, 'sideways_time_stop': 185, 'sideways_use_sma': False, 'sideways_use_ema': True, 'sideways_use_atr': False, 'sideways_use_adx': False, 'sideways_use_spike': False, 'sideways_rsi_required': True}.
[I 2025-08-31 13:12:50,190] Trial 607 finished with values: [-1000000000.0, 1000000000.0] and parameters: {'p_sma': 53, 'p_std': 24, 'p_atr': 12, 'p_adx': 15, 'rsi_period': 62, 'ema1': 21, 'ema2': 17, 'slip_atr_k': 0.20163757430581392, 'slip_spread_k': 0.3620852704819225, 'spread_hl_frac': 0.03675941287817806, 'bb_std_mult': 2.2896042112084345, 'rsi_os': 38, 'rsi_ob': 78, 'vol_spike': 0.012892823835770577, 'adx_thresh': 21.146053493836668, 'atr_min_pct': 0.001715081284625379, 'atr_max_pct': 0.13022391314312054, 'tp_mult': 2.4617225423882143, 'tsl_mult': 0.055942709687768225, 'strategy': 'breakout', 'time_stop': 239, 'use_sma': True, 'use_atr': True, 'use_adx': False, 'use_ema': True, 'use_spike': True, 'rsi_required': False, 'edge_k': 0.6021264341078687, 'edge_cap': 0.7025458960014955, 'bull_strategy': 'mean_reversion', 'bull_bb_std_mult': 2.701751646349125, 'bull_rsi_os': 44, 'bull_rsi_ob': 71, 'bull_adx_thresh': 5.365861678272076, 'bull_atr_min_pct': 0.020948376706816246, 'bull_atr_max_pct': 0.02439531724864373, 'bull_tp_mult': 1.9127702299872247, 'bull_tsl_mult': 0.0946891133121956, 'bull_time_stop': 297, 'bull_use_sma': True, 'bull_use_ema': False, 'bull_use_atr': False, 'bull_use_adx': True, 'bull_use_spike': True, 'bull_rsi_required': False, 'bear_strategy': 'breakout', 'bear_bb_std_mult': 3.3286479464738776, 'bear_rsi_os': 29, 'bear_rsi_ob': 51, 'bear_adx_thresh': 12.118905531056255, 'bear_atr_min_pct': 0.0015435161367004058, 'bear_atr_max_pct': 0.1288504195162879, 'bear_tp_mult': 1.2528600201369424, 'bear_tsl_mult': 0.5777850419772693, 'bear_time_stop': 194, 'bear_use_sma': True, 'bear_use_ema': True, 'bear_use_atr': True, 'bear_use_adx': True, 'bear_use_spike': True, 'bear_rsi_required': True, 'sideways_strategy': 'mean_reversion', 'sideways_bb_std_mult': 2.6688321587968566, 'sideways_rsi_os': 53, 'sideways_rsi_ob': 68, 'sideways_adx_thresh': 33.10723321085129, 'sideways_atr_min_pct': 0.002386573039990088, 'sideways_atr_max_pct': 0.11722318742606558, 'sideways_tp_mult': 1.7349848649929498, 'sideways_tsl_mult': 0.8788758768893302, 'sideways_time_stop': 185, 'sideways_use_sma': False, 'sideways_use_ema': True, 'sideways_use_atr': False, 'sideways_use_adx': False, 'sideways_use_spike': False, 'sideways_rsi_required': True}.
[I 2025-08-31 13:12:50,598] Trial 609 finished with values: [-1000000000.0, 1000000000.0] and parameters: {'p_sma': 50, 'p_std': 34, 'p_atr': 16, 'p_adx': 15, 'rsi_period': 46, 'ema1': 21, 'ema2': 34, 'slip_atr_k': 0.05524901486536648, 'slip_spread_k': 0.4155483618988527, 'spread_hl_frac': 0.01646977117566056, 'bb_std_mult': 2.28273304055205, 'rsi_os': 17, 'rsi_ob': 78, 'vol_spike': 0.037857886426223133, 'adx_thresh': 21.049329064023865, 'atr_min_pct': 0.004078782056823783, 'atr_max_pct': 0.13091071679466731, 'tp_mult': 1.2780772352186651, 'tsl_mult': 0.06464836661233765, 'strategy': 'breakout', 'time_stop': 77, 'use_sma': True, 'use_atr': True, 'use_adx': True, 'use_ema': True, 'use_spike': True, 'rsi_required': True, 'edge_k': 1.3379737326490535, 'edge_cap': 0.22677429380473935, 'bull_strategy': 'mean_reversion', 'bull_bb_std_mult': 0.8298728544941409, 'bull_rsi_os': 35, 'bull_rsi_ob': 71, 'bull_adx_thresh': 22.351954028614873, 'bull_atr_min_pct': 0.02025223303162705, 'bull_atr_max_pct': 0.14736980669802863, 'bull_tp_mult': 1.9156623564171165, 'bull_tsl_mult': 0.09848249898595007, 'bull_time_stop': 287, 'bull_use_sma': True, 'bull_use_ema': False, 'bull_use_atr': False, 'bull_use_adx': True, 'bull_use_spike': True, 'bull_rsi_required': True, 'bear_strategy': 'breakout', 'bear_bb_std_mult': 2.859382306326417, 'bear_rsi_os': 28, 'bear_rsi_ob': 71, 'bear_adx_thresh': 12.370395334202417, 'bear_atr_min_pct': 0.02029604606663883, 'bear_atr_max_pct': 0.02207534934203429, 'bear_tp_mult': 2.9602613359071435, 'bear_tsl_mult': 0.8140274934169938, 'bear_time_stop': 195, 'bear_use_sma': True, 'bear_use_ema': True, 'bear_use_atr': False, 'bear_use_adx': False, 'bear_use_spike': True, 'bear_rsi_required': True, 'sideways_strategy': 'mean_reversion', 'sideways_bb_std_mult': 2.892468138542595, 'sideways_rsi_os': 30, 'sideways_rsi_ob': 58, 'sideways_adx_thresh': 29.34153684495652, 'sideways_atr_min_pct': 0.006181874186658906, 'sideways_atr_max_pct': 0.13133360499447402, 'sideways_tp_mult': 1.9251091892219525, 'sideways_tsl_mult': 0.8227641978209231, 'sideways_time_stop': 257, 'sideways_use_sma': False, 'sideways_use_ema': True, 'sideways_use_atr': True, 'sideways_use_adx': False, 'sideways_use_spike': False, 'sideways_rsi_required': True}.
[I 2025-08-31 13:12:50,613] Trial 608 finished with values: [-0.06384636896141804, 0.06323558774177726] and parameters: {'p_sma': 53, 'p_std': 34, 'p_atr': 12, 'p_adx': 15, 'rsi_period': 19, 'ema1': 20, 'ema2': 40, 'slip_atr_k': 0.04478091718713072, 'slip_spread_k': 0.35965297961861975, 'spread_hl_frac': 0.016513597664446246, 'bb_std_mult': 2.0822412115991535, 'rsi_os': 41, 'rsi_ob': 78, 'vol_spike': 5.3443399789455254e-05, 'adx_thresh': 21.051101499450578, 'atr_min_pct': 0.0006578050418414211, 'atr_max_pct': 0.12962457348951353, 'tp_mult': 1.2937321453980586, 'tsl_mult': 0.06100407965348312, 'strategy': 'breakout', 'time_stop': 300, 'use_sma': True, 'use_atr': True, 'use_adx': True, 'use_ema': True, 'use_spike': True, 'rsi_required': True, 'edge_k': 0.609020621675245, 'edge_cap': 0.7423072102446622, 'bull_strategy': 'mean_reversion', 'bull_bb_std_mult': 0.724194118512665, 'bull_rsi_os': 51, 'bull_rsi_ob': 48, 'bull_adx_thresh': 14.343908922358704, 'bull_atr_min_pct': 0.020029865781885557, 'bull_atr_max_pct': 0.1467832068800995, 'bull_tp_mult': 1.9225404034994902, 'bull_tsl_mult': 0.8959742304045601, 'bull_time_stop': 298, 'bull_use_sma': True, 'bull_use_ema': False, 'bull_use_atr': False, 'bull_use_adx': True, 'bull_use_spike': True, 'bull_rsi_required': True, 'bear_strategy': 'breakout', 'bear_bb_std_mult': 1.7994692287400367, 'bear_rsi_os': 43, 'bear_rsi_ob': 51, 'bear_adx_thresh': 12.385846343250352, 'bear_atr_min_pct': 0.003311916066129371, 'bear_atr_max_pct': 0.022237933235237137, 'bear_tp_mult': 2.928218741425976, 'bear_tsl_mult': 0.4586472643099251, 'bear_time_stop': 178, 'bear_use_sma': True, 'bear_use_ema': True, 'bear_use_atr': False, 'bear_use_adx': False, 'bear_use_spike': True, 'bear_rsi_required': True, 'sideways_strategy': 'mean_reversion', 'sideways_bb_std_mult': 2.6520260431106886, 'sideways_rsi_os': 30, 'sideways_rsi_ob': 67, 'sideways_adx_thresh': 26.102590026100618, 'sideways_atr_min_pct': 0.0026464716980899444, 'sideways_atr_max_pct': 0.13012060334872755, 'sideways_tp_mult': 1.8464470556001358, 'sideways_tsl_mult': 0.8266262389059362, 'sideways_time_stop': 193, 'sideways_use_sma': False, 'sideways_use_ema': True, 'sideways_use_atr': True, 'sideways_use_adx': False, 'sideways_use_spike': False, 'sideways_rsi_required': True}.
[I 2025-08-31 13:13:22,514] Trial 613 finished with values: [-1000000000.0, 1000000000.0] and parameters: {'p_sma': 56, 'p_std': 59, 'p_atr': 13, 'p_adx': 29, 'rsi_period': 54, 'ema1': 20, 'ema2': 50, 'slip_atr_k': 0.060353840578116005, 'slip_spread_k': 0.4835167840872697, 'spread_hl_frac': 0.019628363091871007, 'bb_std_mult': 2.6022806892006125, 'rsi_os': 7, 'rsi_ob': 68, 'vol_spike': 0.027621690744378122, 'adx_thresh': 19.788880761102963, 'atr_min_pct': 0.01867419339769699, 'atr_max_pct': 0.11963548837091559, 'tp_mult': 2.566523308601428, 'tsl_mult': 0.5752677984146723, 'strategy': 'breakout', 'time_stop': 159, 'use_sma': False, 'use_atr': True, 'use_adx': False, 'use_ema': True, 'use_spike': False, 'rsi_required': True, 'edge_k': 0.6800701917637301, 'edge_cap': 0.7396275100435461, 'bull_strategy': 'breakout', 'bull_bb_std_mult': 2.643016041513874, 'bull_rsi_os': 6, 'bull_rsi_ob': 69, 'bull_adx_thresh': 18.54585124747258, 'bull_atr_min_pct': 0.02456176173137091, 'bull_atr_max_pct': 0.0374356089681833, 'bull_tp_mult': 1.1402129609317924, 'bull_tsl_mult': 0.1460245951728361, 'bull_time_stop': 274, 'bull_use_sma': False, 'bull_use_ema': True, 'bull_use_atr': False, 'bull_use_adx': True, 'bull_use_spike': False, 'bull_rsi_required': False, 'bear_strategy': 'breakout', 'bear_bb_std_mult': 0.6214192713625426, 'bear_rsi_os': 32, 'bear_rsi_ob': 92, 'bear_adx_thresh': 7.013075521679166, 'bear_atr_min_pct': 0.002650726666718344, 'bear_atr_max_pct': 0.12055867891332384, 'bear_tp_mult': 2.815199292333168, 'bear_tsl_mult': 0.7941124530398063, 'bear_time_stop': 298, 'bear_use_sma': False, 'bear_use_ema': True, 'bear_use_atr': True, 'bear_use_adx': True, 'bear_use_spike': False, 'bear_rsi_required': True, 'sideways_strategy': 'breakout', 'sideways_bb_std_mult': 2.5174488827436545, 'sideways_rsi_os': 44, 'sideways_rsi_ob': 64, 'sideways_adx_thresh': 27.993050229848496, 'sideways_atr_min_pct': 0.027157477753128875, 'sideways_atr_max_pct': 0.12529470731246894, 'sideways_tp_mult': 1.5034625112114846, 'sideways_tsl_mult': 0.9996470345386325, 'sideways_time_stop': 197, 'sideways_use_sma': True, 'sideways_use_ema': False, 'sideways_use_atr': False, 'sideways_use_adx': True, 'sideways_use_spike': False, 'sideways_rsi_required': True}.
[I 2025-08-31 13:13:22,972] Trial 611 finished with values: [-1000000000.0, 1000000000.0] and parameters: {'p_sma': 49, 'p_std': 26, 'p_atr': 22, 'p_adx': 15, 'rsi_period': 46, 'ema1': 20, 'ema2': 14, 'slip_atr_k': 0.12149756585434009, 'slip_spread_k': 0.42117026853985906, 'spread_hl_frac': 0.009717671838997178, 'bb_std_mult': 2.11745645910871, 'rsi_os': 40, 'rsi_ob': 68, 'vol_spike': 0.029984770581648633, 'adx_thresh': 5.5306266470668355, 'atr_min_pct': 0.0006149322165177581, 'atr_max_pct': 0.12015213526011681, 'tp_mult': 2.396491902459167, 'tsl_mult': 0.9077271535656554, 'strategy': 'breakout', 'time_stop': 176, 'use_sma': False, 'use_atr': True, 'use_adx': True, 'use_ema': True, 'use_spike': False, 'rsi_required': True, 'edge_k': 0.8660406869308337, 'edge_cap': 0.7378055072494402, 'bull_strategy': 'breakout', 'bull_bb_std_mult': 2.4280819989333224, 'bull_rsi_os': 37, 'bull_rsi_ob': 53, 'bull_adx_thresh': 17.227462375927747, 'bull_atr_min_pct': 0.024705852267091592, 'bull_atr_max_pct': 0.14727106471134743, 'bull_tp_mult': 1.1322733807623806, 'bull_tsl_mult': 0.1461804914560187, 'bull_time_stop': 274, 'bull_use_sma': False, 'bull_use_ema': True, 'bull_use_atr': False, 'bull_use_adx': True, 'bull_use_spike': True, 'bull_rsi_required': True, 'bear_strategy': 'breakout', 'bear_bb_std_mult': 3.060856111914322, 'bear_rsi_os': 20, 'bear_rsi_ob': 95, 'bear_adx_thresh': 13.42237412914104, 'bear_atr_min_pct': 0.0031163656945654653, 'bear_atr_max_pct': 0.14269410334030408, 'bear_tp_mult': 2.9605800577401, 'bear_tsl_mult': 0.7925827829518963, 'bear_time_stop': 120, 'bear_use_sma': False, 'bear_use_ema': True, 'bear_use_atr': False, 'bear_use_adx': False, 'bear_use_spike': False, 'bear_rsi_required': True, 'sideways_strategy': 'breakout', 'sideways_bb_std_mult': 2.3655907621320056, 'sideways_rsi_os': 45, 'sideways_rsi_ob': 65, 'sideways_adx_thresh': 22.57728621743079, 'sideways_atr_min_pct': 0.02674543845210943, 'sideways_atr_max_pct': 0.12526106259817255, 'sideways_tp_mult': 1.9208410794950932, 'sideways_tsl_mult': 0.824573275683673, 'sideways_time_stop': 194, 'sideways_use_sma': True, 'sideways_use_ema': False, 'sideways_use_atr': True, 'sideways_use_adx': True, 'sideways_use_spike': False, 'sideways_rsi_required': True}.
