[I 2025-08-31 13:33:12,781] Trial 756 finished with values: [-0.016414443016124602, 0.018699085850750283] and parameters: {'p_sma': 14, 'p_std': 53, 'p_atr': 27, 'p_adx': 9, 'rsi_period': 50, 'ema1': 17, 'ema2': 49, 'slip_atr_k': 0.039737281376745884, 'slip_spread_k': 0.23168914110329508, 'spread_hl_frac': 0.005172393245659074, 'bb_std_mult': 2.3429830572774923, 'rsi_os': 45, 'rsi_ob': 51, 'vol_spike': 0.24025206751737144, 'adx_thresh': 6.43753051092248, 'atr_min_pct': 0.023943385807565887, 'atr_max_pct': 0.040691586020476844, 'tp_mult': 2.5334168139205917, 'tsl_mult': 0.5246615176303498, 'strategy': 'mean_reversion', 'time_stop': 195, 'use_sma': True, 'use_atr': False, 'use_adx': True, 'use_ema': False, 'use_spike': True, 'rsi_required': False, 'edge_k': 0.444444044626823, 'edge_cap': 0.6813906400316823, 'bull_strategy': 'mean_reversion', 'bull_bb_std_mult': 2.8077236383231496, 'bull_rsi_os': 55, 'bull_rsi_ob': 83, 'bull_adx_thresh': 19.27012990418905, 'bull_atr_min_pct': 0.02254384701027847, 'bull_atr_max_pct': 0.14069818545961507, 'bull_tp_mult': 2.156378251258082, 'bull_tsl_mult': 0.5990723060330981, 'bull_time_stop': 156, 'bull_use_sma': True, 'bull_use_ema': False, 'bull_use_atr': True, 'bull_use_adx': False, 'bull_use_spike': True, 'bull_rsi_required': True, 'bear_strategy': 'breakout', 'bear_bb_std_mult': 2.682143531844008, 'bear_rsi_os': 13, 'bear_rsi_ob': 66, 'bear_adx_thresh': 21.540271839721015, 'bear_atr_min_pct': 0.002161072501723258, 'bear_atr_max_pct': 0.12914351446076694, 'bear_tp_mult': 1.4890859999425237, 'bear_tsl_mult': 0.023396251565826975, 'bear_time_stop': 186, 'bear_use_sma': False, 'bear_use_ema': True, 'bear_use_atr': False, 'bear_use_adx': False, 'bear_use_spike': False, 'bear_rsi_required': True, 'sideways_strategy': 'breakout', 'sideways_bb_std_mult': 2.7994467236496368, 'sideways_rsi_os': 52, 'sideways_rsi_ob': 68, 'sideways_adx_thresh': 20.763285712327928, 'sideways_atr_min_pct': 0.0024817546722411955, 'sideways_atr_max_pct': 0.14712502271269828, 'sideways_tp_mult': 1.8182942400945288, 'sideways_tsl_mult': 0.07456168482036285, 'sideways_time_stop': 79, 'sideways_use_sma': False, 'sideways_use_ema': True, 'sideways_use_atr': True, 'sideways_use_adx': True, 'sideways_use_spike': True, 'sideways_rsi_required': True}.
[I 2025-08-31 13:33:13,792] Trial 759 finished with values: [-1000000000.0, 1000000000.0] and parameters: {'p_sma': 45, 'p_std': 53, 'p_atr': 23, 'p_adx': 25, 'rsi_period': 18, 'ema1': 17, 'ema2': 18, 'slip_atr_k': 0.20367743617838174, 'slip_spread_k': 0.42800899234079753, 'spread_hl_frac': 0.03461184307648717, 'bb_std_mult': 2.336950412303367, 'rsi_os': 24, 'rsi_ob': 48, 'vol_spike': 0.23916196532086348, 'adx_thresh': 5.043642983223721, 'atr_min_pct': 0.024261210600980746, 'atr_max_pct': 0.0346429082694286, 'tp_mult': 2.4188928978831274, 'tsl_mult': 0.9545789997107921, 'strategy': 'mean_reversion', 'time_stop': 193, 'use_sma': True, 'use_atr': False, 'use_adx': True, 'use_ema': True, 'use_spike': True, 'rsi_required': False, 'edge_k': 0.6286590291307008, 'edge_cap': 0.683063969614361, 'bull_strategy': 'mean_reversion', 'bull_bb_std_mult': 0.9632245578172487, 'bull_rsi_os': 24, 'bull_rsi_ob': 83, 'bull_adx_thresh': 18.501766349176982, 'bull_atr_min_pct': 0.02073641411089074, 'bull_atr_max_pct': 0.06390818632296474, 'bull_tp_mult': 1.996119529079742, 'bull_tsl_mult': 0.8889497511766984, 'bull_time_stop': 155, 'bull_use_sma': True, 'bull_use_ema': False, 'bull_use_atr': True, 'bull_use_adx': False, 'bull_use_spike': True, 'bull_rsi_required': True, 'bear_strategy': 'breakout', 'bear_bb_std_mult': 3.5431810589780373, 'bear_rsi_os': 24, 'bear_rsi_ob': 81, 'bear_adx_thresh': 17.615877154118333, 'bear_atr_min_pct': 0.0012770722387466173, 'bear_atr_max_pct': 0.1197353927805942, 'bear_tp_mult': 1.3059229710735485, 'bear_tsl_mult': 0.6797050561041469, 'bear_time_stop': 208, 'bear_use_sma': False, 'bear_use_ema': True, 'bear_use_atr': False, 'bear_use_adx': False, 'bear_use_spike': False, 'bear_rsi_required': True, 'sideways_strategy': 'breakout', 'sideways_bb_std_mult': 2.8794714722237202, 'sideways_rsi_os': 6, 'sideways_rsi_ob': 66, 'sideways_adx_thresh': 24.824052859535122, 'sideways_atr_min_pct': 0.0025244141120880992, 'sideways_atr_max_pct': 0.1420730371783199, 'sideways_tp_mult': 2.7749057648756628, 'sideways_tsl_mult': 0.8764246339235705, 'sideways_time_stop': 51, 'sideways_use_sma': False, 'sideways_use_ema': False, 'sideways_use_atr': True, 'sideways_use_adx': True, 'sideways_use_spike': True, 'sideways_rsi_required': True}.
[I 2025-08-31 13:33:45,201] Trial 758 finished with values: [-0.04167481488807845, 0.04230271970920771] and parameters: {'p_sma': 60, 'p_std': 21, 'p_atr': 27, 'p_adx': 14, 'rsi_period': 50, 'ema1': 13, 'ema2': 46, 'slip_atr_k': 0.04415759774531887, 'slip_spread_k': 0.22646891641250283, 'spread_hl_frac': 0.01834342001910577, 'bb_std_mult': 3.4967905933799663, 'rsi_os': 37, 'rsi_ob': 51, 'vol_spike': 0.24339495655487478, 'adx_thresh': 5.3021506608040845, 'atr_min_pct': 0.029102663315687595, 'atr_max_pct': 0.04100467815065421, 'tp_mult': 2.5481563112884973, 'tsl_mult': 0.8430010421987582, 'strategy': 'breakout', 'time_stop': 191, 'use_sma': True, 'use_atr': False, 'use_adx': True, 'use_ema': True, 'use_spike': True, 'rsi_required': False, 'edge_k': 0.6333458792003674, 'edge_cap': 0.681226387985468, 'bull_strategy': 'mean_reversion', 'bull_bb_std_mult': 0.9826543866534192, 'bull_rsi_os': 6, 'bull_rsi_ob': 87, 'bull_adx_thresh': 27.4267133397848, 'bull_atr_min_pct': 0.009870080485603169, 'bull_atr_max_pct': 0.14186147887271117, 'bull_tp_mult': 1.9324880869303753, 'bull_tsl_mult': 0.5956734071431453, 'bull_time_stop': 244, 'bull_use_sma': True, 'bull_use_ema': False, 'bull_use_atr': True, 'bull_use_adx': True, 'bull_use_spike': True, 'bull_rsi_required': True, 'bear_strategy': 'breakout', 'bear_bb_std_mult': 2.096100479802033, 'bear_rsi_os': 24, 'bear_rsi_ob': 70, 'bear_adx_thresh': 24.015712111292927, 'bear_atr_min_pct': 0.008459465795474564, 'bear_atr_max_pct': 0.11927933807817831, 'bear_tp_mult': 1.4079887320340552, 'bear_tsl_mult': 0.6730212618858632, 'bear_time_stop': 82, 'bear_use_sma': False, 'bear_use_ema': True, 'bear_use_atr': False, 'bear_use_adx': False, 'bear_use_spike': True, 'bear_rsi_required': True, 'sideways_strategy': 'breakout', 'sideways_bb_std_mult': 2.7967472132160283, 'sideways_rsi_os': 48, 'sideways_rsi_ob': 86, 'sideways_adx_thresh': 24.709448619402185, 'sideways_atr_min_pct': 0.0025670096211455684, 'sideways_atr_max_pct': 0.14221663631581863, 'sideways_tp_mult': 2.551456950132955, 'sideways_tsl_mult': 0.02348929181296372, 'sideways_time_stop': 79, 'sideways_use_sma': False, 'sideways_use_ema': False, 'sideways_use_atr': True, 'sideways_use_adx': True, 'sideways_use_spike': False, 'sideways_rsi_required': True}.
[I 2025-08-31 13:33:45,553] Trial 757 finished with values: [-1000000000.0, 1000000000.0] and parameters: {'p_sma': 60, 'p_std': 20, 'p_atr': 27, 'p_adx': 9, 'rsi_period': 53, 'ema1': 13, 'ema2': 20, 'slip_atr_k': 0.04543507649911721, 'slip_spread_k': 0.22075677233293334, 'spread_hl_frac': 0.045486997333741064, 'bb_std_mult': 2.337034909801751, 'rsi_os': 18, 'rsi_ob': 54, 'vol_spike': 0.01417428520675959, 'adx_thresh': 8.809029067060512, 'atr_min_pct': 0.025957669038717116, 'atr_max_pct': 0.04185752037894248, 'tp_mult': 2.5354213511465384, 'tsl_mult': 0.8454829657074645, 'strategy': 'breakout', 'time_stop': 132, 'use_sma': True, 'use_atr': False, 'use_adx': True, 'use_ema': True, 'use_spike': True, 'rsi_required': False, 'edge_k': 0.6316166888324338, 'edge_cap': 0.6256704429822731, 'bull_strategy': 'mean_reversion', 'bull_bb_std_mult': 2.820303444929551, 'bull_rsi_os': 6, 'bull_rsi_ob': 87, 'bull_adx_thresh': 18.283581473686294, 'bull_atr_min_pct': 0.022037443192108312, 'bull_atr_max_pct': 0.14063894423066473, 'bull_tp_mult': 1.9399817551797145, 'bull_tsl_mult': 0.2541464016274249, 'bull_time_stop': 155, 'bull_use_sma': True, 'bull_use_ema': False, 'bull_use_atr': True, 'bull_use_adx': True, 'bull_use_spike': True, 'bull_rsi_required': True, 'bear_strategy': 'breakout', 'bear_bb_std_mult': 2.1763302720972217, 'bear_rsi_os': 24, 'bear_rsi_ob': 70, 'bear_adx_thresh': 17.57633841347729, 'bear_atr_min_pct': 0.008416772995628404, 'bear_atr_max_pct': 0.13487534850353713, 'bear_tp_mult': 1.3111984156287777, 'bear_tsl_mult': 0.6783174037513148, 'bear_time_stop': 81, 'bear_use_sma': False, 'bear_use_ema': True, 'bear_use_atr': False, 'bear_use_adx': False, 'bear_use_spike': True, 'bear_rsi_required': True, 'sideways_strategy': 'breakout', 'sideways_bb_std_mult': 2.816604905501128, 'sideways_rsi_os': 28, 'sideways_rsi_ob': 66, 'sideways_adx_thresh': 25.089668380856878, 'sideways_atr_min_pct': 0.002498747819639687, 'sideways_atr_max_pct': 0.041991827976899446, 'sideways_tp_mult': 1.87584475138128, 'sideways_tsl_mult': 0.894196471550728, 'sideways_time_stop': 52, 'sideways_use_sma': False, 'sideways_use_ema': False, 'sideways_use_atr': True, 'sideways_use_adx': True, 'sideways_use_spike': False, 'sideways_rsi_required': True}.
[I 2025-08-31 13:33:46,077] Trial 760 finished with values: [-1000000000.0, 1000000000.0] and parameters: {'p_sma': 34, 'p_std': 23, 'p_atr': 21, 'p_adx': 14, 'rsi_period': 52, 'ema1': 11, 'ema2': 59, 'slip_atr_k': 0.0395770121141572, 'slip_spread_k': 0.8994025044972909, 'spread_hl_frac': 0.018140959600670293, 'bb_std_mult': 2.2708798228738303, 'rsi_os': 17, 'rsi_ob': 48, 'vol_spike': 0.02774287835716903, 'adx_thresh': 5.189629952997835, 'atr_min_pct': 0.02606877798165449, 'atr_max_pct': 0.05783725002577938, 'tp_mult': 2.2653999165410488, 'tsl_mult': 0.5233929480170394, 'strategy': 'breakout', 'time_stop': 180, 'use_sma': True, 'use_atr': False, 'use_adx': True, 'use_ema': True, 'use_spike': True, 'rsi_required': False, 'edge_k': 0.44601881607013183, 'edge_cap': 0.9227109533966531, 'bull_strategy': 'mean_reversion', 'bull_bb_std_mult': 2.61589243626525, 'bull_rsi_os': 6, 'bull_rsi_ob': 67, 'bull_adx_thresh': 18.51838615292674, 'bull_atr_min_pct': 0.02211140050295084, 'bull_atr_max_pct': 0.14132440212480188, 'bull_tp_mult': 2.2807487618795674, 'bull_tsl_mult': 0.3992508554870792, 'bull_time_stop': 172, 'bull_use_sma': True, 'bull_use_ema': False, 'bull_use_atr': True, 'bull_use_adx': False, 'bull_use_spike': True, 'bull_rsi_required': True, 'bear_strategy': 'breakout', 'bear_bb_std_mult': 3.5145446637761175, 'bear_rsi_os': 28, 'bear_rsi_ob': 84, 'bear_adx_thresh': 21.706958063693133, 'bear_atr_min_pct': 0.0013114685388690337, 'bear_atr_max_pct': 0.127049678581737, 'bear_tp_mult': 1.4725865185164264, 'bear_tsl_mult': 0.62165032737201, 'bear_time_stop': 222, 'bear_use_sma': False, 'bear_use_ema': True, 'bear_use_atr': False, 'bear_use_adx': False, 'bear_use_spike': False, 'bear_rsi_required': True, 'sideways_strategy': 'breakout', 'sideways_bb_std_mult': 2.871944969153007, 'sideways_rsi_os': 14, 'sideways_rsi_ob': 66, 'sideways_adx_thresh': 24.83783401874601, 'sideways_atr_min_pct': 0.01855310180488232, 'sideways_atr_max_pct': 0.1478097348489466, 'sideways_tp_mult': 2.149721522189, 'sideways_tsl_mult': 0.3082716640888965, 'sideways_time_stop': 28, 'sideways_use_sma': False, 'sideways_use_ema': False, 'sideways_use_atr': True, 'sideways_use_adx': True, 'sideways_use_spike': True, 'sideways_rsi_required': True}.
[I 2025-08-31 13:33:47,120] Trial 761 finished with values: [-0.10535109046123292, 0.104791481524713] and parameters: {'p_sma': 36, 'p_std': 6, 'p_atr': 27, 'p_adx': 14, 'rsi_period': 50, 'ema1': 7, 'ema2': 48, 'slip_atr_k': 0.049803754218101105, 'slip_spread_k': 0.4614930707614414, 'spread_hl_frac': 0.01756173587194685, 'bb_std_mult': 2.252764999329524, 'rsi_os': 37, 'rsi_ob': 51, 'vol_spike': 0.02626271500273467, 'adx_thresh': 7.141923516241642, 'atr_min_pct': 0.025728168189731303, 'atr_max_pct': 0.04245690323025853, 'tp_mult': 2.5423921215747227, 'tsl_mult': 0.5264705121581602, 'strategy': 'breakout', 'time_stop': 182, 'use_sma': False, 'use_atr': False, 'use_adx': True, 'use_ema': True, 'use_spike': True, 'rsi_required': False, 'edge_k': 0.6281519761812234, 'edge_cap': 0.9737504869902197, 'bull_strategy': 'mean_reversion', 'bull_bb_std_mult': 2.82594942889326, 'bull_rsi_os': 6, 'bull_rsi_ob': 87, 'bull_adx_thresh': 18.464634165637687, 'bull_atr_min_pct': 0.009875787934444918, 'bull_atr_max_pct': 0.14120416763285804, 'bull_tp_mult': 2.29139636788566, 'bull_tsl_mult': 0.26017335857505264, 'bull_time_stop': 185, 'bull_use_sma': True, 'bull_use_ema': True, 'bull_use_atr': True, 'bull_use_adx': True, 'bull_use_spike': True, 'bull_rsi_required': True, 'bear_strategy': 'breakout', 'bear_bb_std_mult': 3.545906682413835, 'bear_rsi_os': 40, 'bear_rsi_ob': 72, 'bear_adx_thresh': 23.71312941963274, 'bear_atr_min_pct': 0.0014288788699939763, 'bear_atr_max_pct': 0.12890079559343812, 'bear_tp_mult': 1.1339154958811968, 'bear_tsl_mult': 0.22557390396544397, 'bear_time_stop': 81, 'bear_use_sma': False, 'bear_use_ema': True, 'bear_use_atr': False, 'bear_use_adx': False, 'bear_use_spike': True, 'bear_rsi_required': True, 'sideways_strategy': 'breakout', 'sideways_bb_std_mult': 2.7980440659546963, 'sideways_rsi_os': 15, 'sideways_rsi_ob': 68, 'sideways_adx_thresh': 19.426039429711683, 'sideways_atr_min_pct': 0.009093010910646706, 'sideways_atr_max_pct': 0.1495588530508218, 'sideways_tp_mult': 1.9783060074158259, 'sideways_tsl_mult': 0.1166804085308758, 'sideways_time_stop': 28, 'sideways_use_sma': False, 'sideways_use_ema': False, 'sideways_use_atr': True, 'sideways_use_adx': True, 'sideways_use_spike': False, 'sideways_rsi_required': True}.
[I 2025-08-31 13:34:19,966] Trial 763 finished with values: [-1000000000.0, 1000000000.0] and parameters: {'p_sma': 40, 'p_std': 42, 'p_atr': 16, 'p_adx': 14, 'rsi_period': 48, 'ema1': 11, 'ema2': 20, 'slip_atr_k': 0.049942522343439, 'slip_spread_k': 0.4603131673057192, 'spread_hl_frac': 0.017377691148191352, 'bb_std_mult': 2.2497330888238705, 'rsi_os': 13, 'rsi_ob': 84, 'vol_spike': 0.029777898908680794, 'adx_thresh': 7.314778210103157, 'atr_min_pct': 0.025753182796363124, 'atr_max_pct': 0.05857060441938646, 'tp_mult': 2.2502138889756145, 'tsl_mult': 0.8014929525375403, 'strategy': 'breakout', 'time_stop': 169, 'use_sma': False, 'use_atr': False, 'use_adx': True, 'use_ema': True, 'use_spike': True, 'rsi_required': False, 'edge_k': 0.43312492336249986, 'edge_cap': 0.7040152311517925, 'bull_strategy': 'mean_reversion', 'bull_bb_std_mult': 2.61229842101875, 'bull_rsi_os': 5, 'bull_rsi_ob': 70, 'bull_adx_thresh': 25.528409818721943, 'bull_atr_min_pct': 0.020783847425683056, 'bull_atr_max_pct': 0.14185116121854716, 'bull_tp_mult': 2.280936877778515, 'bull_tsl_mult': 0.28463763022124605, 'bull_time_stop': 186, 'bull_use_sma': True, 'bull_use_ema': True, 'bull_use_atr': True, 'bull_use_adx': True, 'bull_use_spike': True, 'bull_rsi_required': True, 'bear_strategy': 'breakout', 'bear_bb_std_mult': 3.501903710300975, 'bear_rsi_os': 31, 'bear_rsi_ob': 59, 'bear_adx_thresh': 20.488952338208183, 'bear_atr_min_pct': 0.00578668321656923, 'bear_atr_max_pct': 0.12731606000846232, 'bear_tp_mult': 1.0540013122796854, 'bear_tsl_mult': 0.7251226417454206, 'bear_time_stop': 186, 'bear_use_sma': False, 'bear_use_ema': True, 'bear_use_atr': False, 'bear_use_adx': False, 'bear_use_spike': True, 'bear_rsi_required': True, 'sideways_strategy': 'breakout', 'sideways_bb_std_mult': 2.6205503880155563, 'sideways_rsi_os': 12, 'sideways_rsi_ob': 68, 'sideways_adx_thresh': 20.7304654810559, 'sideways_atr_min_pct': 0.0053317110553911095, 'sideways_atr_max_pct': 0.1499678796906263, 'sideways_tp_mult': 1.1910024797833598, 'sideways_tsl_mult': 0.9461326571221165, 'sideways_time_stop': 26, 'sideways_use_sma': False, 'sideways_use_ema': False, 'sideways_use_atr': True, 'sideways_use_adx': True, 'sideways_use_spike': False, 'sideways_rsi_required': False}.
[I 2025-08-31 13:34:20,581] Trial 764 finished with values: [-1000000000.0, 1000000000.0] and parameters: {'p_sma': 35, 'p_std': 6, 'p_atr': 17, 'p_adx': 14, 'rsi_period': 48, 'ema1': 14, 'ema2': 41, 'slip_atr_k': 0.049925887371537706, 'slip_spread_k': 0.4680768298257345, 'spread_hl_frac': 0.020891401823316898, 'bb_std_mult': 2.231594895926037, 'rsi_os': 38, 'rsi_ob': 58, 'vol_spike': 0.024563555451677113, 'adx_thresh': 7.1464771086895045, 'atr_min_pct': 0.027472210618110664, 'atr_max_pct': 0.05225274942927202, 'tp_mult': 2.067166576847513, 'tsl_mult': 0.7983510939789115, 'strategy': 'breakout', 'time_stop': 281, 'use_sma': False, 'use_atr': False, 'use_adx': True, 'use_ema': True, 'use_spike': True, 'rsi_required': False, 'edge_k': 0.5847765110166249, 'edge_cap': 0.6980197110155091, 'bull_strategy': 'mean_reversion', 'bull_bb_std_mult': 2.9135808556701996, 'bull_rsi_os': 53, 'bull_rsi_ob': 84, 'bull_adx_thresh': 17.074464708434203, 'bull_atr_min_pct': 0.02414287331407409, 'bull_atr_max_pct': 0.14128915919231616, 'bull_tp_mult': 2.242978212856537, 'bull_tsl_mult': 0.2791640114539334, 'bull_time_stop': 184, 'bull_use_sma': True, 'bull_use_ema': True, 'bull_use_atr': True, 'bull_use_adx': True, 'bull_use_spike': True, 'bull_rsi_required': True, 'bear_strategy': 'breakout', 'bear_bb_std_mult': 2.747376799378876, 'bear_rsi_os': 31, 'bear_rsi_ob': 72, 'bear_adx_thresh': 26.54814989775764, 'bear_atr_min_pct': 0.0006716003623796868, 'bear_atr_max_pct': 0.12721715398415653, 'bear_tp_mult': 1.1136615935603247, 'bear_tsl_mult': 0.7205878280539523, 'bear_time_stop': 186, 'bear_use_sma': False, 'bear_use_ema': False, 'bear_use_atr': False, 'bear_use_adx': False, 'bear_use_spike': True, 'bear_rsi_required': False, 'sideways_strategy': 'breakout', 'sideways_bb_std_mult': 2.3203806571264245, 'sideways_rsi_os': 53, 'sideways_rsi_ob': 68, 'sideways_adx_thresh': 24.251204337438224, 'sideways_atr_min_pct': 0.01938591604142155, 'sideways_atr_max_pct': 0.1496129590712594, 'sideways_tp_mult': 1.270576034599019, 'sideways_tsl_mult': 0.07841720067059071, 'sideways_time_stop': 60, 'sideways_use_sma': False, 'sideways_use_ema': False, 'sideways_use_atr': True, 'sideways_use_adx': True, 'sideways_use_spike': False, 'sideways_rsi_required': False}.
[I 2025-08-31 13:34:20,750] Trial 762 finished with values: [-1000000000.0, 1000000000.0] and parameters: {'p_sma': 36, 'p_std': 12, 'p_atr': 17, 'p_adx': 14, 'rsi_period': 52, 'ema1': 8, 'ema2': 59, 'slip_atr_k': 0.050340870103089255, 'slip_spread_k': 0.47217885455699005, 'spread_hl_frac': 0.017431786191662288, 'bb_std_mult': 2.2739036306938623, 'rsi_os': 45, 'rsi_ob': 49, 'vol_spike': 0.02979476983067552, 'adx_thresh': 7.272926326695955, 'atr_min_pct': 0.02585101275732252, 'atr_max_pct': 0.05866360571026485, 'tp_mult': 2.252481274148003, 'tsl_mult': 0.8052350056891404, 'strategy': 'breakout', 'time_stop': 180, 'use_sma': False, 'use_atr': False, 'use_adx': True, 'use_ema': True, 'use_spike': True, 'rsi_required': False, 'edge_k': 0.24476470361561442, 'edge_cap': 0.9581157539374004, 'bull_strategy': 'mean_reversion', 'bull_bb_std_mult': 2.8182741319929274, 'bull_rsi_os': 5, 'bull_rsi_ob': 72, 'bull_adx_thresh': 17.226580651636123, 'bull_atr_min_pct': 0.02184789511557875, 'bull_atr_max_pct': 0.1416479509856549, 'bull_tp_mult': 2.2261469305532824, 'bull_tsl_mult': 0.25856388884448017, 'bull_time_stop': 186, 'bull_use_sma': True, 'bull_use_ema': True, 'bull_use_atr': True, 'bull_use_adx': True, 'bull_use_spike': True, 'bull_rsi_required': True, 'bear_strategy': 'breakout', 'bear_bb_std_mult': 2.7532133204075984, 'bear_rsi_os': 9, 'bear_rsi_ob': 72, 'bear_adx_thresh': 20.62481816548112, 'bear_atr_min_pct': 0.0014560085577685696, 'bear_atr_max_pct': 0.12769695542886145, 'bear_tp_mult': 1.47704430891314, 'bear_tsl_mult': 0.7149846627529743, 'bear_time_stop': 188, 'bear_use_sma': False, 'bear_use_ema': True, 'bear_use_atr': False, 'bear_use_adx': False, 'bear_use_spike': True, 'bear_rsi_required': True, 'sideways_strategy': 'breakout', 'sideways_bb_std_mult': 0.8823133616307373, 'sideways_rsi_os': 28, 'sideways_rsi_ob': 68, 'sideways_adx_thresh': 21.64593518361594, 'sideways_atr_min_pct': 0.005354418602777574, 'sideways_atr_max_pct': 0.14967906084290564, 'sideways_tp_mult': 1.753488429779031, 'sideways_tsl_mult': 0.8986070473556674, 'sideways_time_stop': 28, 'sideways_use_sma': False, 'sideways_use_ema': False, 'sideways_use_atr': True, 'sideways_use_adx': True, 'sideways_use_spike': False, 'sideways_rsi_required': False}.
