[I 2025-08-31 13:49:11,579] Trial 876 finished with values: [-0.08786925648964183, 0.08767380729720059] and parameters: {'p_sma': 29, 'p_std': 23, 'p_atr': 10, 'p_adx': 14, 'rsi_period': 51, 'ema1': 9, 'ema2': 19, 'slip_atr_k': 0.24012876462707328, 'slip_spread_k': 0.25916434541261274, 'spread_hl_frac': 0.015650119977037257, 'bb_std_mult': 1.2211645327617815, 'rsi_os': 37, 'rsi_ob': 65, 'vol_spike': 0.006088342192157042, 'adx_thresh': 7.43213873522201, 'atr_min_pct': 0.029140066814066154, 'atr_max_pct': 0.03658793166175522, 'tp_mult': 2.43171560329684, 'tsl_mult': 0.8212533452637337, 'strategy': 'mean_reversion', 'time_stop': 159, 'use_sma': True, 'use_atr': False, 'use_adx': True, 'use_ema': True, 'use_spike': True, 'rsi_required': False, 'edge_k': 0.5375551453207933, 'edge_cap': 0.48516962852107665, 'bull_strategy': 'mean_reversion', 'bull_bb_std_mult': 1.0110905185199903, 'bull_rsi_os': 7, 'bull_rsi_ob': 83, 'bull_adx_thresh': 20.938242555323704, 'bull_atr_min_pct': 0.02201535998567082, 'bull_atr_max_pct': 0.13641393945459918, 'bull_tp_mult': 2.376097050493347, 'bull_tsl_mult': 0.29695488769335565, 'bull_time_stop': 175, 'bull_use_sma': False, 'bull_use_ema': True, 'bull_use_atr': True, 'bull_use_adx': True, 'bull_use_spike': True, 'bull_rsi_required': True, 'bear_strategy': 'mean_reversion', 'bear_bb_std_mult': 3.2804740401858576, 'bear_rsi_os': 28, 'bear_rsi_ob': 77, 'bear_adx_thresh': 19.525639006426935, 'bear_atr_min_pct': 0.025300356409848762, 'bear_atr_max_pct': 0.12025196602510416, 'bear_tp_mult': 1.0118331997963326, 'bear_tsl_mult': 0.01141546682570621, 'bear_time_stop': 267, 'bear_use_sma': False, 'bear_use_ema': False, 'bear_use_atr': False, 'bear_use_adx': False, 'bear_use_spike': True, 'bear_rsi_required': True, 'sideways_strategy': 'breakout', 'sideways_bb_std_mult': 2.675255878543815, 'sideways_rsi_os': 53, 'sideways_rsi_ob': 64, 'sideways_adx_thresh': 5.031968437285922, 'sideways_atr_min_pct': 0.0026003487438986178, 'sideways_atr_max_pct': 0.1449195255293515, 'sideways_tp_mult': 2.2929313993236606, 'sideways_tsl_mult': 0.9116728767784219, 'sideways_time_stop': 39, 'sideways_use_sma': False, 'sideways_use_ema': False, 'sideways_use_atr': True, 'sideways_use_adx': True, 'sideways_use_spike': False, 'sideways_rsi_required': True}.
[I 2025-08-31 13:49:11,878] Trial 873 finished with values: [-1000000000.0, 1000000000.0] and parameters: {'p_sma': 16, 'p_std': 23, 'p_atr': 18, 'p_adx': 26, 'rsi_period': 47, 'ema1': 28, 'ema2': 24, 'slip_atr_k': 0.047199929745091795, 'slip_spread_k': 0.7912752855952416, 'spread_hl_frac': 0.015561606071243283, 'bb_std_mult': 2.302310174556518, 'rsi_os': 37, 'rsi_ob': 92, 'vol_spike': 0.00812976396692428, 'adx_thresh': 12.51496979153039, 'atr_min_pct': 0.012759730708207585, 'atr_max_pct': 0.03623929358438493, 'tp_mult': 2.3953620829320457, 'tsl_mult': 0.5791636688044732, 'strategy': 'mean_reversion', 'time_stop': 159, 'use_sma': True, 'use_atr': False, 'use_adx': True, 'use_ema': True, 'use_spike': True, 'rsi_required': False, 'edge_k': 0.4613910908731881, 'edge_cap': 0.45698463475381834, 'bull_strategy': 'mean_reversion', 'bull_bb_std_mult': 0.9306886459341908, 'bull_rsi_os': 7, 'bull_rsi_ob': 83, 'bull_adx_thresh': 11.965702494929735, 'bull_atr_min_pct': 0.021853891736274028, 'bull_atr_max_pct': 0.0628306292552258, 'bull_tp_mult': 2.38164922552112, 'bull_tsl_mult': 0.11862592240684805, 'bull_time_stop': 255, 'bull_use_sma': True, 'bull_use_ema': True, 'bull_use_atr': True, 'bull_use_adx': True, 'bull_use_spike': True, 'bull_rsi_required': True, 'bear_strategy': 'breakout', 'bear_bb_std_mult': 2.108666687248646, 'bear_rsi_os': 31, 'bear_rsi_ob': 77, 'bear_adx_thresh': 19.66741780745231, 'bear_atr_min_pct': 0.020967653435947926, 'bear_atr_max_pct': 0.12253345392613735, 'bear_tp_mult': 1.2542230959309686, 'bear_tsl_mult': 0.002793372799352045, 'bear_time_stop': 197, 'bear_use_sma': False, 'bear_use_ema': False, 'bear_use_atr': False, 'bear_use_adx': False, 'bear_use_spike': True, 'bear_rsi_required': True, 'sideways_strategy': 'breakout', 'sideways_bb_std_mult': 2.6781998829683125, 'sideways_rsi_os': 27, 'sideways_rsi_ob': 71, 'sideways_adx_thresh': 21.440027173317315, 'sideways_atr_min_pct': 0.0247599508836798, 'sideways_atr_max_pct': 0.14491678268932795, 'sideways_tp_mult': 2.833790956664966, 'sideways_tsl_mult': 0.849827458942056, 'sideways_time_stop': 41, 'sideways_use_sma': False, 'sideways_use_ema': False, 'sideways_use_atr': True, 'sideways_use_adx': True, 'sideways_use_spike': False, 'sideways_rsi_required': True}.
[I 2025-08-31 13:49:12,167] Trial 874 finished with values: [-0.021129424749762094, 0.02128093405112315] and parameters: {'p_sma': 29, 'p_std': 23, 'p_atr': 18, 'p_adx': 18, 'rsi_period': 47, 'ema1': 28, 'ema2': 10, 'slip_atr_k': 0.04667042313326399, 'slip_spread_k': 0.3996500075918377, 'spread_hl_frac': 0.020459691846266222, 'bb_std_mult': 2.990831080646399, 'rsi_os': 37, 'rsi_ob': 54, 'vol_spike': 0.0057594486180129745, 'adx_thresh': 7.457731930538944, 'atr_min_pct': 0.022295839259460853, 'atr_max_pct': 0.10241409309766142, 'tp_mult': 2.4111972127053956, 'tsl_mult': 0.8797439160133564, 'strategy': 'mean_reversion', 'time_stop': 160, 'use_sma': True, 'use_atr': False, 'use_adx': True, 'use_ema': True, 'use_spike': True, 'rsi_required': False, 'edge_k': 0.4225154191308663, 'edge_cap': 0.49430586611655325, 'bull_strategy': 'mean_reversion', 'bull_bb_std_mult': 2.7623399303316205, 'bull_rsi_os': 18, 'bull_rsi_ob': 86, 'bull_adx_thresh': 30.129215627594405, 'bull_atr_min_pct': 0.021739891157380137, 'bull_atr_max_pct': 0.02225555245372502, 'bull_tp_mult': 2.259099203961925, 'bull_tsl_mult': 0.2558463502377127, 'bull_time_stop': 255, 'bull_use_sma': True, 'bull_use_ema': True, 'bull_use_atr': True, 'bull_use_adx': True, 'bull_use_spike': True, 'bull_rsi_required': True, 'bear_strategy': 'breakout', 'bear_bb_std_mult': 3.4720211760490534, 'bear_rsi_os': 31, 'bear_rsi_ob': 73, 'bear_adx_thresh': 18.23464790862528, 'bear_atr_min_pct': 0.0022347194753101, 'bear_atr_max_pct': 0.12163883988837414, 'bear_tp_mult': 1.3948628304477073, 'bear_tsl_mult': 0.6723597002734597, 'bear_time_stop': 40, 'bear_use_sma': False, 'bear_use_ema': False, 'bear_use_atr': False, 'bear_use_adx': False, 'bear_use_spike': True, 'bear_rsi_required': True, 'sideways_strategy': 'breakout', 'sideways_bb_std_mult': 2.6709503858220724, 'sideways_rsi_os': 31, 'sideways_rsi_ob': 66, 'sideways_adx_thresh': 24.925364888345857, 'sideways_atr_min_pct': 0.002585788465545215, 'sideways_atr_max_pct': 0.14485941258477492, 'sideways_tp_mult': 2.2806711626781713, 'sideways_tsl_mult': 0.8519248558819086, 'sideways_time_stop': 257, 'sideways_use_sma': False, 'sideways_use_ema': False, 'sideways_use_atr': True, 'sideways_use_adx': True, 'sideways_use_spike': False, 'sideways_rsi_required': True}.
[I 2025-08-31 13:49:12,167] Trial 875 finished with values: [-1000000000.0, 1000000000.0] and parameters: {'p_sma': 29, 'p_std': 37, 'p_atr': 10, 'p_adx': 28, 'rsi_period': 47, 'ema1': 9, 'ema2': 19, 'slip_atr_k': 0.04691159598637434, 'slip_spread_k': 0.40352265688275496, 'spread_hl_frac': 0.02033126379101106, 'bb_std_mult': 3.0282016861934515, 'rsi_os': 37, 'rsi_ob': 93, 'vol_spike': 0.0269520389422392, 'adx_thresh': 12.613817694817783, 'atr_min_pct': 0.01547692938157539, 'atr_max_pct': 0.044163864598642716, 'tp_mult': 2.9090526615417174, 'tsl_mult': 0.8188653650617633, 'strategy': 'mean_reversion', 'time_stop': 176, 'use_sma': True, 'use_atr': False, 'use_adx': True, 'use_ema': True, 'use_spike': True, 'rsi_required': False, 'edge_k': 0.4581657155658599, 'edge_cap': 0.13124495730217467, 'bull_strategy': 'mean_reversion', 'bull_bb_std_mult': 2.7548724648237344, 'bull_rsi_os': 7, 'bull_rsi_ob': 86, 'bull_adx_thresh': 30.003600691096757, 'bull_atr_min_pct': 0.021838951026048863, 'bull_atr_max_pct': 0.02226718119099856, 'bull_tp_mult': 2.386697725666475, 'bull_tsl_mult': 0.23107679971122183, 'bull_time_stop': 180, 'bull_use_sma': True, 'bull_use_ema': True, 'bull_use_atr': True, 'bull_use_adx': True, 'bull_use_spike': True, 'bull_rsi_required': True, 'bear_strategy': 'breakout', 'bear_bb_std_mult': 3.452457240290977, 'bear_rsi_os': 28, 'bear_rsi_ob': 60, 'bear_adx_thresh': 19.450597671449664, 'bear_atr_min_pct': 0.0021654198337419097, 'bear_atr_max_pct': 0.07888844086124161, 'bear_tp_mult': 1.2323890765935321, 'bear_tsl_mult': 0.002410616954646394, 'bear_time_stop': 282, 'bear_use_sma': False, 'bear_use_ema': False, 'bear_use_atr': False, 'bear_use_adx': False, 'bear_use_spike': True, 'bear_rsi_required': True, 'sideways_strategy': 'breakout', 'sideways_bb_std_mult': 2.8404263144288104, 'sideways_rsi_os': 26, 'sideways_rsi_ob': 71, 'sideways_adx_thresh': 25.8347244912566, 'sideways_atr_min_pct': 0.002844117272837964, 'sideways_atr_max_pct': 0.14476510805854664, 'sideways_tp_mult': 1.6331350583167419, 'sideways_tsl_mult': 0.40215592977112546, 'sideways_time_stop': 48, 'sideways_use_sma': False, 'sideways_use_ema': False, 'sideways_use_atr': True, 'sideways_use_adx': True, 'sideways_use_spike': False, 'sideways_rsi_required': True}.
[I 2025-08-31 13:49:43,636] Trial 878 finished with values: [-1000000000.0, 1000000000.0] and parameters: {'p_sma': 6, 'p_std': 21, 'p_atr': 20, 'p_adx': 25, 'rsi_period': 49, 'ema1': 9, 'ema2': 50, 'slip_atr_k': 0.03943420950927583, 'slip_spread_k': 0.40600720487565845, 'spread_hl_frac': 0.012402888152326624, 'bb_std_mult': 3.4380848943749296, 'rsi_os': 12, 'rsi_ob': 68, 'vol_spike': 0.2774970774470146, 'adx_thresh': 6.734113478271643, 'atr_min_pct': 0.02250756169393574, 'atr_max_pct': 0.061402169209468685, 'tp_mult': 2.5314876343745674, 'tsl_mult': 0.7473819679323987, 'strategy': 'breakout', 'time_stop': 176, 'use_sma': False, 'use_atr': False, 'use_adx': True, 'use_ema': True, 'use_spike': True, 'rsi_required': False, 'edge_k': 1.7466365773512218, 'edge_cap': 0.9368212587566105, 'bull_strategy': 'mean_reversion', 'bull_bb_std_mult': 2.75572657714195, 'bull_rsi_os': 5, 'bull_rsi_ob': 86, 'bull_adx_thresh': 17.808390882186753, 'bull_atr_min_pct': 0.020347674791801083, 'bull_atr_max_pct': 0.1418374265151421, 'bull_tp_mult': 2.234748811182607, 'bull_tsl_mult': 0.22642243950881735, 'bull_time_stop': 180, 'bull_use_sma': True, 'bull_use_ema': False, 'bull_use_atr': True, 'bull_use_adx': True, 'bull_use_spike': True, 'bull_rsi_required': True, 'bear_strategy': 'breakout', 'bear_bb_std_mult': 1.0648304501704513, 'bear_rsi_os': 29, 'bear_rsi_ob': 66, 'bear_adx_thresh': 21.27106039768785, 'bear_atr_min_pct': 0.0023464672648504017, 'bear_atr_max_pct': 0.060557951065695226, 'bear_tp_mult': 1.13639861761308, 'bear_tsl_mult': 0.6623817734620848, 'bear_time_stop': 199, 'bear_use_sma': False, 'bear_use_ema': True, 'bear_use_atr': False, 'bear_use_adx': False, 'bear_use_spike': True, 'bear_rsi_required': True, 'sideways_strategy': 'breakout', 'sideways_bb_std_mult': 1.2093183862862529, 'sideways_rsi_os': 31, 'sideways_rsi_ob': 75, 'sideways_adx_thresh': 25.896280483921, 'sideways_atr_min_pct': 0.01436310059858207, 'sideways_atr_max_pct': 0.015182259822131436, 'sideways_tp_mult': 2.7952007337085405, 'sideways_tsl_mult': 0.2061881277392268, 'sideways_time_stop': 47, 'sideways_use_sma': False, 'sideways_use_ema': False, 'sideways_use_atr': True, 'sideways_use_adx': True, 'sideways_use_spike': False, 'sideways_rsi_required': True}.
[I 2025-08-31 13:49:44,125] Trial 877 finished with values: [-1000000000.0, 1000000000.0] and parameters: {'p_sma': 16, 'p_std': 13, 'p_atr': 17, 'p_adx': 13, 'rsi_period': 49, 'ema1': 9, 'ema2': 10, 'slip_atr_k': 0.04655377920346143, 'slip_spread_k': 0.4083195764278673, 'spread_hl_frac': 0.012849481492666247, 'bb_std_mult': 2.41948977836913, 'rsi_os': 33, 'rsi_ob': 87, 'vol_spike': 0.03400662354285494, 'adx_thresh': 8.302849467349171, 'atr_min_pct': 0.02290665477268724, 'atr_max_pct': 0.04615037167288721, 'tp_mult': 2.5246305520287255, 'tsl_mult': 0.7524715528319227, 'strategy': 'mean_reversion', 'time_stop': 72, 'use_sma': False, 'use_atr': False, 'use_adx': True, 'use_ema': True, 'use_spike': True, 'rsi_required': False, 'edge_k': 0.4328661143823227, 'edge_cap': 0.4547138337558233, 'bull_strategy': 'mean_reversion', 'bull_bb_std_mult': 2.7460544706080845, 'bull_rsi_os': 6, 'bull_rsi_ob': 65, 'bull_adx_thresh': 30.02248941457404, 'bull_atr_min_pct': 0.020384358069498378, 'bull_atr_max_pct': 0.14200493746588352, 'bull_tp_mult': 2.2493605554944036, 'bull_tsl_mult': 0.22753675889578423, 'bull_time_stop': 179, 'bull_use_sma': True, 'bull_use_ema': False, 'bull_use_atr': True, 'bull_use_adx': True, 'bull_use_spike': True, 'bull_rsi_required': True, 'bear_strategy': 'breakout', 'bear_bb_std_mult': 1.0733002219622607, 'bear_rsi_os': 34, 'bear_rsi_ob': 66, 'bear_adx_thresh': 20.45314581795501, 'bear_atr_min_pct': 0.02103794118729417, 'bear_atr_max_pct': 0.013347945050410495, 'bear_tp_mult': 1.2368025033232497, 'bear_tsl_mult': 0.6717574772261958, 'bear_time_stop': 200, 'bear_use_sma': False, 'bear_use_ema': False, 'bear_use_atr': False, 'bear_use_adx': False, 'bear_use_spike': True, 'bear_rsi_required': True, 'sideways_strategy': 'breakout', 'sideways_bb_std_mult': 1.1812252144396025, 'sideways_rsi_os': 26, 'sideways_rsi_ob': 75, 'sideways_adx_thresh': 24.707999632884057, 'sideways_atr_min_pct': 0.024741704838817984, 'sideways_atr_max_pct': 0.07735405033558003, 'sideways_tp_mult': 1.6428026081304705, 'sideways_tsl_mult': 0.8062173128877669, 'sideways_time_stop': 41, 'sideways_use_sma': False, 'sideways_use_ema': False, 'sideways_use_atr': True, 'sideways_use_adx': True, 'sideways_use_spike': False, 'sideways_rsi_required': True}.
[I 2025-08-31 13:49:44,236] Trial 880 finished with values: [-1000000000.0, 1000000000.0] and parameters: {'p_sma': 59, 'p_std': 5, 'p_atr': 20, 'p_adx': 13, 'rsi_period': 69, 'ema1': 9, 'ema2': 41, 'slip_atr_k': 0.10367669062596818, 'slip_spread_k': 0.5671624029757394, 'spread_hl_frac': 0.013202021319851508, 'bb_std_mult': 2.435764260342752, 'rsi_os': 40, 'rsi_ob': 87, 'vol_spike': 0.20750765505300978, 'adx_thresh': 30.95989864804082, 'atr_min_pct': 0.024196127251034576, 'atr_max_pct': 0.04831734348035713, 'tp_mult': 2.5118129727671796, 'tsl_mult': 0.7951371028772773, 'strategy': 'breakout', 'time_stop': 74, 'use_sma': False, 'use_atr': False, 'use_adx': True, 'use_ema': True, 'use_spike': True, 'rsi_required': False, 'edge_k': 0.561352670212006, 'edge_cap': 0.674688545301565, 'bull_strategy': 'mean_reversion', 'bull_bb_std_mult': 2.5578535560010804, 'bull_rsi_os': 6, 'bull_rsi_ob': 69, 'bull_adx_thresh': 28.674125404563352, 'bull_atr_min_pct': 0.020434788754821395, 'bull_atr_max_pct': 0.1417910959134739, 'bull_tp_mult': 2.1081279977901515, 'bull_tsl_mult': 0.41853247730156207, 'bull_time_stop': 181, 'bull_use_sma': False, 'bull_use_ema': False, 'bull_use_atr': True, 'bull_use_adx': False, 'bull_use_spike': True, 'bull_rsi_required': True, 'bear_strategy': 'mean_reversion', 'bear_bb_std_mult': 0.6327958609236066, 'bear_rsi_os': 36, 'bear_rsi_ob': 52, 'bear_adx_thresh': 20.27370382785804, 'bear_atr_min_pct': 0.0014912979328863371, 'bear_atr_max_pct': 0.05899419220406815, 'bear_tp_mult': 1.7653562267763732, 'bear_tsl_mult': 0.7349486615695328, 'bear_time_stop': 199, 'bear_use_sma': False, 'bear_use_ema': True, 'bear_use_atr': False, 'bear_use_adx': False, 'bear_use_spike': True, 'bear_rsi_required': False, 'sideways_strategy': 'breakout', 'sideways_bb_std_mult': 1.41835897625357, 'sideways_rsi_os': 39, 'sideways_rsi_ob': 52, 'sideways_adx_thresh': 9.09185330914882, 'sideways_atr_min_pct': 0.003265320181905283, 'sideways_atr_max_pct': 0.14764200800874236, 'sideways_tp_mult': 1.9406561848240769, 'sideways_tsl_mult': 0.8953441672212762, 'sideways_time_stop': 147, 'sideways_use_sma': False, 'sideways_use_ema': False, 'sideways_use_atr': True, 'sideways_use_adx': True, 'sideways_use_spike': True, 'sideways_rsi_required': False}.
[I 2025-08-31 13:49:44,563] Trial 879 finished with values: [-1000000000.0, 1000000000.0] and parameters: {'p_sma': 46, 'p_std': 21, 'p_atr': 20, 'p_adx': 13, 'rsi_period': 37, 'ema1': 9, 'ema2': 50, 'slip_atr_k': 0.1982289908910685, 'slip_spread_k': 0.12413605502649738, 'spread_hl_frac': 0.012766335420955911, 'bb_std_mult': 3.484870656274625, 'rsi_os': 40, 'rsi_ob': 87, 'vol_spike': 0.03395148128938563, 'adx_thresh': 30.968434135087875, 'atr_min_pct': 0.024849734863578166, 'atr_max_pct': 0.0796088042153762, 'tp_mult': 1.011157368349446, 'tsl_mult': 0.747516908850947, 'strategy': 'breakout', 'time_stop': 184, 'use_sma': False, 'use_atr': False, 'use_adx': True, 'use_ema': True, 'use_spike': True, 'rsi_required': False, 'edge_k': 1.5759149755885355, 'edge_cap': 0.6783403039887772, 'bull_strategy': 'mean_reversion', 'bull_bb_std_mult': 0.7599326836733349, 'bull_rsi_os': 53, 'bull_rsi_ob': 69, 'bull_adx_thresh': 17.883446598186243, 'bull_atr_min_pct': 0.020323993055203125, 'bull_atr_max_pct': 0.04340782380783199, 'bull_tp_mult': 2.213981694463525, 'bull_tsl_mult': 0.8881570312616356, 'bull_time_stop': 181, 'bull_use_sma': False, 'bull_use_ema': False, 'bull_use_atr': True, 'bull_use_adx': False, 'bull_use_spike': True, 'bull_rsi_required': True, 'bear_strategy': 'mean_reversion', 'bear_bb_std_mult': 0.6203063652584502, 'bear_rsi_os': 36, 'bear_rsi_ob': 72, 'bear_adx_thresh': 21.21055819689452, 'bear_atr_min_pct': 0.001548472702693583, 'bear_atr_max_pct': 0.128212603327113, 'bear_tp_mult': 1.7574524453673728, 'bear_tsl_mult': 0.7265593179835753, 'bear_time_stop': 200, 'bear_use_sma': False, 'bear_use_ema': True, 'bear_use_atr': False, 'bear_use_adx': False, 'bear_use_spike': True, 'bear_rsi_required': False, 'sideways_strategy': 'breakout', 'sideways_bb_std_mult': 1.1164784329377628, 'sideways_rsi_os': 30, 'sideways_rsi_ob': 93, 'sideways_adx_thresh': 5.964661719665841, 'sideways_atr_min_pct': 0.010616805298896248, 'sideways_atr_max_pct': 0.1475436990737702, 'sideways_tp_mult': 2.801950668608104, 'sideways_tsl_mult': 0.4678276255380284, 'sideways_time_stop': 151, 'sideways_use_sma': False, 'sideways_use_ema': False, 'sideways_use_atr': True, 'sideways_use_adx': True, 'sideways_use_spike': True, 'sideways_rsi_required': False}.
[I 2025-08-31 13:50:19,104] Trial 882 finished with values: [-1000000000.0, 1000000000.0] and parameters: {'p_sma': 31, 'p_std': 16, 'p_atr': 14, 'p_adx': 19, 'rsi_period': 31, 'ema1': 9, 'ema2': 41, 'slip_atr_k': 0.039499418268617886, 'slip_spread_k': 0.35884445569866413, 'spread_hl_frac': 0.017499505735604205, 'bb_std_mult': 2.332327573447013, 'rsi_os': 40, 'rsi_ob': 86, 'vol_spike': 0.22187574146103942, 'adx_thresh': 5.137783489292442, 'atr_min_pct': 0.014582932996202171, 'atr_max_pct': 0.04864055459841646, 'tp_mult': 2.612089563390744, 'tsl_mult': 0.7226625928173883, 'strategy': 'breakout', 'time_stop': 34, 'use_sma': False, 'use_atr': False, 'use_adx': True, 'use_ema': True, 'use_spike': True, 'rsi_required': False, 'edge_k': 1.1702788494952172, 'edge_cap': 0.6702792103376357, 'bull_strategy': 'mean_reversion', 'bull_bb_std_mult': 0.6303867775145935, 'bull_rsi_os': 6, 'bull_rsi_ob': 87, 'bull_adx_thresh': 28.781238150895295, 'bull_atr_min_pct': 0.026349688824117853, 'bull_atr_max_pct': 0.04311351382409881, 'bull_tp_mult': 2.441529184606604, 'bull_tsl_mult': 0.260543767999817, 'bull_time_stop': 175, 'bull_use_sma': False, 'bull_use_ema': True, 'bull_use_atr': True, 'bull_use_adx': False, 'bull_use_spike': True, 'bull_rsi_required': True, 'bear_strategy': 'mean_reversion', 'bear_bb_std_mult': 3.3538058810105804, 'bear_rsi_os': 55, 'bear_rsi_ob': 72, 'bear_adx_thresh': 20.615886727570945, 'bear_atr_min_pct': 0.0011991023155651854, 'bear_atr_max_pct': 0.12692131374465998, 'bear_tp_mult': 1.5029386678315577, 'bear_tsl_mult': 0.7199498708387452, 'bear_time_stop': 155, 'bear_use_sma': False, 'bear_use_ema': True, 'bear_use_atr': False, 'bear_use_adx': False, 'bear_use_spike': False, 'bear_rsi_required': False, 'sideways_strategy': 'breakout', 'sideways_bb_std_mult': 2.1334826063017487, 'sideways_rsi_os': 49, 'sideways_rsi_ob': 68, 'sideways_adx_thresh': 25.45299891040399, 'sideways_atr_min_pct': 0.02262342059912137, 'sideways_atr_max_pct': 0.14766737423579937, 'sideways_tp_mult': 1.6869246468021648, 'sideways_tsl_mult': 0.8753666147831666, 'sideways_time_stop': 149, 'sideways_use_sma': False, 'sideways_use_ema': False, 'sideways_use_atr': True, 'sideways_use_adx': True, 'sideways_use_spike': True, 'sideways_rsi_required': False}.
