[I 2025-08-31 12:08:20,142] Trial 117 finished with values: [-1000000000.0, 1000000000.0] and parameters: {'p_sma': 34, 'p_std': 57, 'p_atr': 12, 'p_adx': 16, 'rsi_period': 70, 'ema1': 8, 'ema2': 42, 'slip_atr_k': 0.0920878857098381, 'slip_spread_k': 0.18249914841532688, 'spread_hl_frac': 0.02793318219450191, 'bb_std_mult': 0.8413061218246702, 'rsi_os': 41, 'rsi_ob': 64, 'vol_spike': 0.2531187033358718, 'adx_thresh': 20.439635940296867, 'atr_min_pct': 0.025689486773219174, 'atr_max_pct': 0.06827703174402011, 'tp_mult': 2.4486830786222598, 'tsl_mult': 0.7993474740668265, 'strategy': 'mean_reversion', 'time_stop': 82, 'use_sma': True, 'use_atr': False, 'use_adx': True, 'use_ema': False, 'use_spike': True, 'rsi_required': False, 'edge_k': 0.45644173321023396, 'edge_cap': 0.25061754169247313, 'bull_strategy': 'mean_reversion', 'bull_bb_std_mult': 3.0663879516375343, 'bull_rsi_os': 12, 'bull_rsi_ob': 85, 'bull_adx_thresh': 7.011537691100608, 'bull_atr_min_pct': 0.02502345478900494, 'bull_atr_max_pct': 0.01004341497813338, 'bull_tp_mult': 2.7265022217810846, 'bull_tsl_mult': 0.3443339196795492, 'bull_time_stop': 84, 'bull_use_sma': False, 'bull_use_ema': False, 'bull_use_atr': False, 'bull_use_adx': True, 'bull_use_spike': False, 'bull_rsi_required': True, 'bear_strategy': 'mean_reversion', 'bear_bb_std_mult': 1.3681762628547227, 'bear_rsi_os': 35, 'bear_rsi_ob': 63, 'bear_adx_thresh': 29.69531569120889, 'bear_atr_min_pct': 0.027748633560103677, 'bear_atr_max_pct': 0.09601521239110969, 'bear_tp_mult': 1.8760254343089033, 'bear_tsl_mult': 0.3152401827103347, 'bear_time_stop': 271, 'bear_use_sma': False, 'bear_use_ema': False, 'bear_use_atr': False, 'bear_use_adx': False, 'bear_use_spike': True, 'bear_rsi_required': False, 'sideways_strategy': 'breakout', 'sideways_bb_std_mult': 2.1122611903233954, 'sideways_rsi_os': 38, 'sideways_rsi_ob': 54, 'sideways_adx_thresh': 9.048258472089175, 'sideways_atr_min_pct': 0.02908025756884207, 'sideways_atr_max_pct': 0.07293856692477693, 'sideways_tp_mult': 1.436103838968663, 'sideways_tsl_mult': 0.4404856444634564, 'sideways_time_stop': 67, 'sideways_use_sma': False, 'sideways_use_ema': True, 'sideways_use_atr': True, 'sideways_use_adx': False, 'sideways_use_spike': False, 'sideways_rsi_required': True}.
[I 2025-08-31 12:08:20,423] Trial 119 finished with values: [-1000000000.0, 1000000000.0] and parameters: {'p_sma': 34, 'p_std': 17, 'p_atr': 11, 'p_adx': 15, 'rsi_period': 69, 'ema1': 8, 'ema2': 36, 'slip_atr_k': 0.09041090800174353, 'slip_spread_k': 0.1736141678503279, 'spread_hl_frac': 0.02775943205687514, 'bb_std_mult': 1.094680500681322, 'rsi_os': 49, 'rsi_ob': 61, 'vol_spike': 0.12315938935119644, 'adx_thresh': 25.71136521542812, 'atr_min_pct': 0.02805221315688226, 'atr_max_pct': 0.14923715679323807, 'tp_mult': 1.3093116244181926, 'tsl_mult': 0.6642711639811393, 'strategy': 'mean_reversion', 'time_stop': 119, 'use_sma': True, 'use_atr': True, 'use_adx': False, 'use_ema': False, 'use_spike': False, 'rsi_required': False, 'edge_k': 0.23776967265643723, 'edge_cap': 0.33876038715057366, 'bull_strategy': 'mean_reversion', 'bull_bb_std_mult': 2.8599537267754545, 'bull_rsi_os': 47, 'bull_rsi_ob': 85, 'bull_adx_thresh': 7.103144548929317, 'bull_atr_min_pct': 0.023769329240834386, 'bull_atr_max_pct': 0.01845560492859858, 'bull_tp_mult': 2.704437133028494, 'bull_tsl_mult': 0.36220300498590896, 'bull_time_stop': 86, 'bull_use_sma': False, 'bull_use_ema': False, 'bull_use_atr': False, 'bull_use_adx': True, 'bull_use_spike': False, 'bull_rsi_required': True, 'bear_strategy': 'mean_reversion', 'bear_bb_std_mult': 1.3655063843849926, 'bear_rsi_os': 27, 'bear_rsi_ob': 60, 'bear_adx_thresh': 30.069982151386114, 'bear_atr_min_pct': 0.027756746792709435, 'bear_atr_max_pct': 0.11993385788138362, 'bear_tp_mult': 1.2236484077114074, 'bear_tsl_mult': 0.2890902148809415, 'bear_time_stop': 231, 'bear_use_sma': False, 'bear_use_ema': False, 'bear_use_atr': False, 'bear_use_adx': False, 'bear_use_spike': True, 'bear_rsi_required': False, 'sideways_strategy': 'mean_reversion', 'sideways_bb_std_mult': 2.108149233751825, 'sideways_rsi_os': 34, 'sideways_rsi_ob': 54, 'sideways_adx_thresh': 13.076734544317386, 'sideways_atr_min_pct': 0.00280687031022497, 'sideways_atr_max_pct': 0.051982254013294094, 'sideways_tp_mult': 1.2359566245141753, 'sideways_tsl_mult': 0.10826183437467157, 'sideways_time_stop': 206, 'sideways_use_sma': False, 'sideways_use_ema': True, 'sideways_use_atr': True, 'sideways_use_adx': False, 'sideways_use_spike': False, 'sideways_rsi_required': True}.
[I 2025-08-31 12:08:20,491] Trial 116 finished with values: [-1000000000.0, 1000000000.0] and parameters: {'p_sma': 30, 'p_std': 18, 'p_atr': 16, 'p_adx': 14, 'rsi_period': 71, 'ema1': 8, 'ema2': 41, 'slip_atr_k': 0.09199507336177665, 'slip_spread_k': 0.1817667966873048, 'spread_hl_frac': 0.025168404861883497, 'bb_std_mult': 1.1186918954047722, 'rsi_os': 41, 'rsi_ob': 65, 'vol_spike': 0.2692643529021902, 'adx_thresh': 20.140991318411505, 'atr_min_pct': 0.028208227258471687, 'atr_max_pct': 0.07614483293226001, 'tp_mult': 2.455238290803289, 'tsl_mult': 0.6571228214850222, 'strategy': 'mean_reversion', 'time_stop': 28, 'use_sma': True, 'use_atr': False, 'use_adx': True, 'use_ema': False, 'use_spike': True, 'rsi_required': False, 'edge_k': 1.1076228383556834, 'edge_cap': 0.2520246947681564, 'bull_strategy': 'mean_reversion', 'bull_bb_std_mult': 3.0505755113265876, 'bull_rsi_os': 47, 'bull_rsi_ob': 85, 'bull_adx_thresh': 9.788435887078558, 'bull_atr_min_pct': 0.028207648285890195, 'bull_atr_max_pct': 0.12347228940142782, 'bull_tp_mult': 2.753343835702938, 'bull_tsl_mult': 0.35298026950581785, 'bull_time_stop': 95, 'bull_use_sma': False, 'bull_use_ema': False, 'bull_use_atr': False, 'bull_use_adx': True, 'bull_use_spike': False, 'bull_rsi_required': True, 'bear_strategy': 'mean_reversion', 'bear_bb_std_mult': 1.3564979122432392, 'bear_rsi_os': 26, 'bear_rsi_ob': 61, 'bear_adx_thresh': 33.053053092048096, 'bear_atr_min_pct': 0.027105210579013654, 'bear_atr_max_pct': 0.10604240327662502, 'bear_tp_mult': 1.6092870631707716, 'bear_tsl_mult': 0.31529034888192575, 'bear_time_stop': 271, 'bear_use_sma': False, 'bear_use_ema': False, 'bear_use_atr': False, 'bear_use_adx': False, 'bear_use_spike': True, 'bear_rsi_required': False, 'sideways_strategy': 'breakout', 'sideways_bb_std_mult': 2.3548559837562637, 'sideways_rsi_os': 38, 'sideways_rsi_ob': 49, 'sideways_adx_thresh': 9.365372862141166, 'sideways_atr_min_pct': 0.028912802356239706, 'sideways_atr_max_pct': 0.0726036142103766, 'sideways_tp_mult': 1.4115651680540882, 'sideways_tsl_mult': 0.5122335395129259, 'sideways_time_stop': 129, 'sideways_use_sma': False, 'sideways_use_ema': True, 'sideways_use_atr': True, 'sideways_use_adx': False, 'sideways_use_spike': False, 'sideways_rsi_required': True}.
[I 2025-08-31 12:08:20,780] Trial 120 finished with values: [-1000000000.0, 1000000000.0] and parameters: {'p_sma': 34, 'p_std': 18, 'p_atr': 11, 'p_adx': 12, 'rsi_period': 75, 'ema1': 23, 'ema2': 40, 'slip_atr_k': 0.08968353214591959, 'slip_spread_k': 0.15987119163315808, 'spread_hl_frac': 0.027886473152796177, 'bb_std_mult': 0.5662957474572152, 'rsi_os': 50, 'rsi_ob': 60, 'vol_spike': 0.11948580884150192, 'adx_thresh': 25.898576191337455, 'atr_min_pct': 0.028376446017666347, 'atr_max_pct': 0.1487104882754231, 'tp_mult': 2.447356394954338, 'tsl_mult': 0.5319833306081071, 'strategy': 'mean_reversion', 'time_stop': 120, 'use_sma': True, 'use_atr': False, 'use_adx': True, 'use_ema': False, 'use_spike': False, 'rsi_required': False, 'edge_k': 1.7392905658592084, 'edge_cap': 0.20857815696163529, 'bull_strategy': 'mean_reversion', 'bull_bb_std_mult': 3.0689524685899916, 'bull_rsi_os': 47, 'bull_rsi_ob': 85, 'bull_adx_thresh': 11.012610908449162, 'bull_atr_min_pct': 0.024868666682390114, 'bull_atr_max_pct': 0.011667719940882056, 'bull_tp_mult': 2.8438237280906407, 'bull_tsl_mult': 0.3135699957928252, 'bull_time_stop': 86, 'bull_use_sma': False, 'bull_use_ema': False, 'bull_use_atr': False, 'bull_use_adx': True, 'bull_use_spike': False, 'bull_rsi_required': True, 'bear_strategy': 'mean_reversion', 'bear_bb_std_mult': 1.3819602351737752, 'bear_rsi_os': 43, 'bear_rsi_ob': 63, 'bear_adx_thresh': 29.580201504674903, 'bear_atr_min_pct': 0.029170671156278027, 'bear_atr_max_pct': 0.09728755472037011, 'bear_tp_mult': 1.6987952754767952, 'bear_tsl_mult': 0.07416894405054775, 'bear_time_stop': 248, 'bear_use_sma': False, 'bear_use_ema': False, 'bear_use_atr': False, 'bear_use_adx': False, 'bear_use_spike': True, 'bear_rsi_required': False, 'sideways_strategy': 'mean_reversion', 'sideways_bb_std_mult': 2.1112858999900705, 'sideways_rsi_os': 34, 'sideways_rsi_ob': 55, 'sideways_adx_thresh': 13.010100486481914, 'sideways_atr_min_pct': 0.026552724314482495, 'sideways_atr_max_pct': 0.06736835625425232, 'sideways_tp_mult': 2.704637825683071, 'sideways_tsl_mult': 0.10398996337646899, 'sideways_time_stop': 191, 'sideways_use_sma': False, 'sideways_use_ema': True, 'sideways_use_atr': True, 'sideways_use_adx': False, 'sideways_use_spike': False, 'sideways_rsi_required': True}.
[I 2025-08-31 12:08:20,808] Trial 121 finished with values: [-1000000000.0, 1000000000.0] and parameters: {'p_sma': 13, 'p_std': 18, 'p_atr': 27, 'p_adx': 29, 'rsi_period': 76, 'ema1': 6, 'ema2': 38, 'slip_atr_k': 0.11760574634024434, 'slip_spread_k': 0.10047861657159002, 'spread_hl_frac': 0.02554016447082816, 'bb_std_mult': 1.1836032287673575, 'rsi_os': 50, 'rsi_ob': 61, 'vol_spike': 0.1244345685009664, 'adx_thresh': 24.947296504749886, 'atr_min_pct': 0.028080081208413692, 'atr_max_pct': 0.14969743002852676, 'tp_mult': 2.9119304257075367, 'tsl_mult': 0.520939285866628, 'strategy': 'mean_reversion', 'time_stop': 117, 'use_sma': True, 'use_atr': False, 'use_adx': True, 'use_ema': False, 'use_spike': False, 'rsi_required': False, 'edge_k': 0.607163027591185, 'edge_cap': 0.9987773824022572, 'bull_strategy': 'mean_reversion', 'bull_bb_std_mult': 2.890787043478368, 'bull_rsi_os': 14, 'bull_rsi_ob': 84, 'bull_adx_thresh': 12.780642360840162, 'bull_atr_min_pct': 0.02471378829250341, 'bull_atr_max_pct': 0.11145124354328273, 'bull_tp_mult': 2.8237829770841785, 'bull_tsl_mult': 0.1875604589356369, 'bull_time_stop': 75, 'bull_use_sma': False, 'bull_use_ema': False, 'bull_use_atr': False, 'bull_use_adx': True, 'bull_use_spike': False, 'bull_rsi_required': True, 'bear_strategy': 'mean_reversion', 'bear_bb_std_mult': 0.9827342700926154, 'bear_rsi_os': 43, 'bear_rsi_ob': 58, 'bear_adx_thresh': 32.23597916571936, 'bear_atr_min_pct': 0.028060523674804518, 'bear_atr_max_pct': 0.017143638248753465, 'bear_tp_mult': 1.2330599447098263, 'bear_tsl_mult': 0.06175943788895656, 'bear_time_stop': 266, 'bear_use_sma': False, 'bear_use_ema': False, 'bear_use_atr': False, 'bear_use_adx': False, 'bear_use_spike': True, 'bear_rsi_required': False, 'sideways_strategy': 'mean_reversion', 'sideways_bb_std_mult': 2.1853065143484938, 'sideways_rsi_os': 34, 'sideways_rsi_ob': 48, 'sideways_adx_thresh': 10.20214070051905, 'sideways_atr_min_pct': 0.02587858117041983, 'sideways_atr_max_pct': 0.053630297692928874, 'sideways_tp_mult': 1.2481338166066722, 'sideways_tsl_mult': 0.5120916219067416, 'sideways_time_stop': 191, 'sideways_use_sma': False, 'sideways_use_ema': True, 'sideways_use_atr': True, 'sideways_use_adx': False, 'sideways_use_spike': False, 'sideways_rsi_required': True}.
[I 2025-08-31 12:08:48,435] Trial 123 finished with values: [-1000000000.0, 1000000000.0] and parameters: {'p_sma': 15, 'p_std': 25, 'p_atr': 28, 'p_adx': 29, 'rsi_period': 76, 'ema1': 23, 'ema2': 40, 'slip_atr_k': 0.11684676175965124, 'slip_spread_k': 0.08921639916576285, 'spread_hl_frac': 0.020184686562782182, 'bb_std_mult': 0.7273193676077456, 'rsi_os': 46, 'rsi_ob': 59, 'vol_spike': 0.28084262185854064, 'adx_thresh': 22.72637610569622, 'atr_min_pct': 0.029943271310538356, 'atr_max_pct': 0.08785537215757008, 'tp_mult': 2.570485221816594, 'tsl_mult': 0.5672958962486078, 'strategy': 'breakout', 'time_stop': 76, 'use_sma': True, 'use_atr': False, 'use_adx': True, 'use_ema': False, 'use_spike': False, 'rsi_required': False, 'edge_k': 0.6230918349059404, 'edge_cap': 0.7809780525607256, 'bull_strategy': 'mean_reversion', 'bull_bb_std_mult': 3.3036014263645956, 'bull_rsi_os': 14, 'bull_rsi_ob': 81, 'bull_adx_thresh': 8.29886764696761, 'bull_atr_min_pct': 0.02492699172650129, 'bull_atr_max_pct': 0.117218815347579, 'bull_tp_mult': 2.8278541775223522, 'bull_tsl_mult': 0.31207395924148973, 'bull_time_stop': 74, 'bull_use_sma': False, 'bull_use_ema': False, 'bull_use_atr': False, 'bull_use_adx': True, 'bull_use_spike': False, 'bull_rsi_required': False, 'bear_strategy': 'mean_reversion', 'bear_bb_std_mult': 1.4792884672171043, 'bear_rsi_os': 44, 'bear_rsi_ob': 63, 'bear_adx_thresh': 11.669088378709482, 'bear_atr_min_pct': 0.028952018075532177, 'bear_atr_max_pct': 0.09243283029861617, 'bear_tp_mult': 1.9903180800109816, 'bear_tsl_mult': 0.09354117247516676, 'bear_time_stop': 248, 'bear_use_sma': False, 'bear_use_ema': False, 'bear_use_atr': False, 'bear_use_adx': False, 'bear_use_spike': True, 'bear_rsi_required': False, 'sideways_strategy': 'mean_reversion', 'sideways_bb_std_mult': 1.925227711531147, 'sideways_rsi_os': 40, 'sideways_rsi_ob': 46, 'sideways_adx_thresh': 10.149513245675859, 'sideways_atr_min_pct': 0.020245062257291294, 'sideways_atr_max_pct': 0.06701213447388729, 'sideways_tp_mult': 1.3424846559435306, 'sideways_tsl_mult': 0.9736348196358773, 'sideways_time_stop': 189, 'sideways_use_sma': False, 'sideways_use_ema': True, 'sideways_use_atr': True, 'sideways_use_adx': False, 'sideways_use_spike': False, 'sideways_rsi_required': True}.
[I 2025-08-31 12:08:49,015] Trial 122 finished with values: [-1000000000.0, 1000000000.0] and parameters: {'p_sma': 36, 'p_std': 55, 'p_atr': 18, 'p_adx': 29, 'rsi_period': 76, 'ema1': 6, 'ema2': 40, 'slip_atr_k': 0.11469807241742364, 'slip_spread_k': 0.10068174397116308, 'spread_hl_frac': 0.020149131630482233, 'bb_std_mult': 1.1878564623545955, 'rsi_os': 46, 'rsi_ob': 93, 'vol_spike': 0.07391184822863812, 'adx_thresh': 24.5074724386806, 'atr_min_pct': 0.029563815054256263, 'atr_max_pct': 0.06335765411232099, 'tp_mult': 1.7255683635838148, 'tsl_mult': 0.5288202974361597, 'strategy': 'mean_reversion', 'time_stop': 117, 'use_sma': True, 'use_atr': False, 'use_adx': True, 'use_ema': False, 'use_spike': False, 'rsi_required': False, 'edge_k': 1.726049497820839, 'edge_cap': 0.21185968244220438, 'bull_strategy': 'mean_reversion', 'bull_bb_std_mult': 3.28256597886486, 'bull_rsi_os': 10, 'bull_rsi_ob': 93, 'bull_adx_thresh': 13.061036597275663, 'bull_atr_min_pct': 0.029353119651554002, 'bull_atr_max_pct': 0.043368804560524, 'bull_tp_mult': 2.610230433915462, 'bull_tsl_mult': 0.20076854121796164, 'bull_time_stop': 177, 'bull_use_sma': False, 'bull_use_ema': False, 'bull_use_atr': False, 'bull_use_adx': True, 'bull_use_spike': False, 'bull_rsi_required': True, 'bear_strategy': 'mean_reversion', 'bear_bb_std_mult': 0.9595556981101416, 'bear_rsi_os': 26, 'bear_rsi_ob': 58, 'bear_adx_thresh': 32.11834617857784, 'bear_atr_min_pct': 0.029605009928693388, 'bear_atr_max_pct': 0.09200996068266204, 'bear_tp_mult': 1.3343000833614445, 'bear_tsl_mult': 0.06582520655706538, 'bear_time_stop': 247, 'bear_use_sma': False, 'bear_use_ema': False, 'bear_use_atr': False, 'bear_use_adx': False, 'bear_use_spike': True, 'bear_rsi_required': False, 'sideways_strategy': 'mean_reversion', 'sideways_bb_std_mult': 1.9371176654506523, 'sideways_rsi_os': 15, 'sideways_rsi_ob': 46, 'sideways_adx_thresh': 9.99366047049891, 'sideways_atr_min_pct': 0.02041282594139096, 'sideways_atr_max_pct': 0.06872087214939185, 'sideways_tp_mult': 1.3400775852304945, 'sideways_tsl_mult': 0.5128329008652424, 'sideways_time_stop': 278, 'sideways_use_sma': False, 'sideways_use_ema': True, 'sideways_use_atr': True, 'sideways_use_adx': False, 'sideways_use_spike': False, 'sideways_rsi_required': True}.
[I 2025-08-31 12:08:50,544] Trial 124 finished with values: [-1000000000.0, 1000000000.0] and parameters: {'p_sma': 15, 'p_std': 26, 'p_atr': 28, 'p_adx': 23, 'rsi_period': 7, 'ema1': 6, 'ema2': 50, 'slip_atr_k': 0.21243007112282913, 'slip_spread_k': 0.07982661109871667, 'spread_hl_frac': 0.01968913237022524, 'bb_std_mult': 0.707599891011166, 'rsi_os': 46, 'rsi_ob': 62, 'vol_spike': 0.2824663693738426, 'adx_thresh': 24.80916386431534, 'atr_min_pct': 0.02918330567325951, 'atr_max_pct': 0.06364806188021094, 'tp_mult': 2.800414950010415, 'tsl_mult': 0.5745331289927279, 'strategy': 'breakout', 'time_stop': 71, 'use_sma': True, 'use_atr': False, 'use_adx': True, 'use_ema': False, 'use_spike': True, 'rsi_required': False, 'edge_k': 1.1644892189551468, 'edge_cap': 0.7865789937954119, 'bull_strategy': 'mean_reversion', 'bull_bb_std_mult': 3.2903446986591502, 'bull_rsi_os': 10, 'bull_rsi_ob': 81, 'bull_adx_thresh': 13.186372686154364, 'bull_atr_min_pct': 0.029996591786095515, 'bull_atr_max_pct': 0.11592915667948822, 'bull_tp_mult': 2.6301916565863617, 'bull_tsl_mult': 0.3838735856263249, 'bull_time_stop': 75, 'bull_use_sma': False, 'bull_use_ema': False, 'bull_use_atr': False, 'bull_use_adx': True, 'bull_use_spike': False, 'bull_rsi_required': False, 'bear_strategy': 'mean_reversion', 'bear_bb_std_mult': 1.6207353646987759, 'bear_rsi_os': 46, 'bear_rsi_ob': 55, 'bear_adx_thresh': 12.465319590393314, 'bear_atr_min_pct': 0.029089263638658724, 'bear_atr_max_pct': 0.016092720387549192, 'bear_tp_mult': 1.9883770533466745, 'bear_tsl_mult': 0.2062486393494689, 'bear_time_stop': 19, 'bear_use_sma': False, 'bear_use_ema': False, 'bear_use_atr': False, 'bear_use_adx': False, 'bear_use_spike': True, 'bear_rsi_required': False, 'sideways_strategy': 'breakout', 'sideways_bb_std_mult': 1.9365100672478184, 'sideways_rsi_os': 17, 'sideways_rsi_ob': 46, 'sideways_adx_thresh': 10.107870398283136, 'sideways_atr_min_pct': 0.02025066302306286, 'sideways_atr_max_pct': 0.06999088206382437, 'sideways_tp_mult': 1.5911226584727567, 'sideways_tsl_mult': 0.4532643904915087, 'sideways_time_stop': 172, 'sideways_use_sma': False, 'sideways_use_ema': True, 'sideways_use_atr': True, 'sideways_use_adx': False, 'sideways_use_spike': False, 'sideways_rsi_required': True}.
[I 2025-08-31 12:08:50,840] Trial 125 finished with values: [-1000000000.0, 1000000000.0] and parameters: {'p_sma': 36, 'p_std': 32, 'p_atr': 30, 'p_adx': 12, 'rsi_period': 67, 'ema1': 28, 'ema2': 45, 'slip_atr_k': 0.09733108256035593, 'slip_spread_k': 0.07669122230606269, 'spread_hl_frac': 0.020304333399266808, 'bb_std_mult': 1.7590055505072857, 'rsi_os': 46, 'rsi_ob': 78, 'vol_spike': 0.07583983058861525, 'adx_thresh': 24.508239953442164, 'atr_min_pct': 0.029997172803041754, 'atr_max_pct': 0.08696618561491906, 'tp_mult': 2.8005416546443302, 'tsl_mult': 0.3415772782789711, 'strategy': 'breakout', 'time_stop': 74, 'use_sma': True, 'use_atr': True, 'use_adx': False, 'use_ema': False, 'use_spike': True, 'rsi_required': False, 'edge_k': 0.33896035229085897, 'edge_cap': 0.2836445633594802, 'bull_strategy': 'mean_reversion', 'bull_bb_std_mult': 2.1178357071963276, 'bull_rsi_os': 13, 'bull_rsi_ob': 81, 'bull_adx_thresh': 5.870153087614785, 'bull_atr_min_pct': 0.022601442666118653, 'bull_atr_max_pct': 0.049689320399466316, 'bull_tp_mult': 2.6293051050505, 'bull_tsl_mult': 0.3863960446192769, 'bull_time_stop': 62, 'bull_use_sma': True, 'bull_use_ema': False, 'bull_use_atr': False, 'bull_use_adx': True, 'bull_use_spike': False, 'bull_rsi_required': False, 'bear_strategy': 'mean_reversion', 'bear_bb_std_mult': 1.6324550854055104, 'bear_rsi_os': 22, 'bear_rsi_ob': 46, 'bear_adx_thresh': 11.814131162444943, 'bear_atr_min_pct': 0.029322830514200558, 'bear_atr_max_pct': 0.0931268799781553, 'bear_tp_mult': 1.3289701743287443, 'bear_tsl_mult': 0.028397137356840352, 'bear_time_stop': 234, 'bear_use_sma': False, 'bear_use_ema': False, 'bear_use_atr': False, 'bear_use_adx': False, 'bear_use_spike': True, 'bear_rsi_required': False, 'sideways_strategy': 'breakout', 'sideways_bb_std_mult': 1.9428239979648927, 'sideways_rsi_os': 40, 'sideways_rsi_ob': 46, 'sideways_adx_thresh': 10.205982612177163, 'sideways_atr_min_pct': 0.009710677693760463, 'sideways_atr_max_pct': 0.06201985306810362, 'sideways_tp_mult': 1.3393892891297137, 'sideways_tsl_mult': 0.459127795745562, 'sideways_time_stop': 168, 'sideways_use_sma': True, 'sideways_use_ema': True, 'sideways_use_atr': True, 'sideways_use_adx': False, 'sideways_use_spike': False, 'sideways_rsi_required': True}.
