[I 2025-08-31 13:39:29,922] Trial 803 finished with values: [-1000000000.0, 1000000000.0] and parameters: {'p_sma': 7, 'p_std': 14, 'p_atr': 18, 'p_adx': 14, 'rsi_period': 48, 'ema1': 11, 'ema2': 18, 'slip_atr_k': 0.1785751902862151, 'slip_spread_k': 0.5702570970037599, 'spread_hl_frac': 0.018798033289765564, 'bb_std_mult': 2.3596583177813444, 'rsi_os': 40, 'rsi_ob': 69, 'vol_spike': 0.01015770892630541, 'adx_thresh': 8.695050835608491, 'atr_min_pct': 0.023789962806290248, 'atr_max_pct': 0.09888080957207754, 'tp_mult': 2.5564120453240644, 'tsl_mult': 0.2679693984313728, 'strategy': 'mean_reversion', 'time_stop': 245, 'use_sma': False, 'use_atr': False, 'use_adx': True, 'use_ema': True, 'use_spike': True, 'rsi_required': False, 'edge_k': 0.5622794634499462, 'edge_cap': 0.6514679800398188, 'bull_strategy': 'mean_reversion', 'bull_bb_std_mult': 2.8542314922186085, 'bull_rsi_os': 6, 'bull_rsi_ob': 76, 'bull_adx_thresh': 17.548857883557183, 'bull_atr_min_pct': 0.006202517836614177, 'bull_atr_max_pct': 0.13720066135548392, 'bull_tp_mult': 2.4130686226700577, 'bull_tsl_mult': 0.5592598190963581, 'bull_time_stop': 233, 'bull_use_sma': True, 'bull_use_ema': True, 'bull_use_atr': True, 'bull_use_adx': True, 'bull_use_spike': True, 'bull_rsi_required': True, 'bear_strategy': 'breakout', 'bear_bb_std_mult': 1.1050802228762318, 'bear_rsi_os': 29, 'bear_rsi_ob': 68, 'bear_adx_thresh': 19.058052431118533, 'bear_atr_min_pct': 0.012713810452557227, 'bear_atr_max_pct': 0.02002562448400909, 'bear_tp_mult': 2.1375937081275382, 'bear_tsl_mult': 0.7064768591827904, 'bear_time_stop': 185, 'bear_use_sma': False, 'bear_use_ema': True, 'bear_use_atr': False, 'bear_use_adx': False, 'bear_use_spike': True, 'bear_rsi_required': True, 'sideways_strategy': 'breakout', 'sideways_bb_std_mult': 2.7790409623662318, 'sideways_rsi_os': 29, 'sideways_rsi_ob': 68, 'sideways_adx_thresh': 32.742573064974245, 'sideways_atr_min_pct': 0.0027860497531415943, 'sideways_atr_max_pct': 0.1499595394998066, 'sideways_tp_mult': 1.7736119353365445, 'sideways_tsl_mult': 0.9543240487882645, 'sideways_time_stop': 22, 'sideways_use_sma': False, 'sideways_use_ema': False, 'sideways_use_atr': True, 'sideways_use_adx': True, 'sideways_use_spike': False, 'sideways_rsi_required': True}.
[I 2025-08-31 13:39:29,946] Trial 802 finished with values: [-1000000000.0, 1000000000.0] and parameters: {'p_sma': 23, 'p_std': 24, 'p_atr': 18, 'p_adx': 25, 'rsi_period': 39, 'ema1': 7, 'ema2': 18, 'slip_atr_k': 0.0339596655215552, 'slip_spread_k': 0.44623829924990516, 'spread_hl_frac': 0.0022425656619441507, 'bb_std_mult': 2.091080400628522, 'rsi_os': 37, 'rsi_ob': 92, 'vol_spike': 0.01048928523496465, 'adx_thresh': 8.762486626925721, 'atr_min_pct': 0.02409454730573899, 'atr_max_pct': 0.04122122217561785, 'tp_mult': 2.3760356384925636, 'tsl_mult': 0.8630048693464529, 'strategy': 'mean_reversion', 'time_stop': 175, 'use_sma': False, 'use_atr': False, 'use_adx': True, 'use_ema': True, 'use_spike': True, 'rsi_required': False, 'edge_k': 0.5640761527349964, 'edge_cap': 0.6566906719561785, 'bull_strategy': 'mean_reversion', 'bull_bb_std_mult': 3.5248731211910735, 'bull_rsi_os': 52, 'bull_rsi_ob': 83, 'bull_adx_thresh': 17.18951303037549, 'bull_atr_min_pct': 0.006125180123533545, 'bull_atr_max_pct': 0.14391499049367787, 'bull_tp_mult': 2.469627573825254, 'bull_tsl_mult': 0.5609013708468654, 'bull_time_stop': 252, 'bull_use_sma': True, 'bull_use_ema': True, 'bull_use_atr': True, 'bull_use_adx': True, 'bull_use_spike': True, 'bull_rsi_required': True, 'bear_strategy': 'breakout', 'bear_bb_std_mult': 0.9919799460038097, 'bear_rsi_os': 29, 'bear_rsi_ob': 71, 'bear_adx_thresh': 16.59546299319092, 'bear_atr_min_pct': 0.012964798663656376, 'bear_atr_max_pct': 0.12321178933596075, 'bear_tp_mult': 2.125464666397845, 'bear_tsl_mult': 0.6874238878373006, 'bear_time_stop': 184, 'bear_use_sma': False, 'bear_use_ema': True, 'bear_use_atr': False, 'bear_use_adx': False, 'bear_use_spike': True, 'bear_rsi_required': True, 'sideways_strategy': 'breakout', 'sideways_bb_std_mult': 2.7741999647950033, 'sideways_rsi_os': 9, 'sideways_rsi_ob': 72, 'sideways_adx_thresh': 18.623909751800444, 'sideways_atr_min_pct': 0.022297504801436687, 'sideways_atr_max_pct': 0.1448668160366142, 'sideways_tp_mult': 2.052994710802243, 'sideways_tsl_mult': 0.8238439045332303, 'sideways_time_stop': 70, 'sideways_use_sma': False, 'sideways_use_ema': False, 'sideways_use_atr': True, 'sideways_use_adx': True, 'sideways_use_spike': False, 'sideways_rsi_required': True}.
[I 2025-08-31 13:39:30,088] Trial 804 finished with values: [-1000000000.0, 1000000000.0] and parameters: {'p_sma': 8, 'p_std': 24, 'p_atr': 24, 'p_adx': 14, 'rsi_period': 19, 'ema1': 8, 'ema2': 18, 'slip_atr_k': 0.18479886111618532, 'slip_spread_k': 0.9704528973734236, 'spread_hl_frac': 0.0063671169661818315, 'bb_std_mult': 0.572808317425773, 'rsi_os': 41, 'rsi_ob': 69, 'vol_spike': 0.26874915629013685, 'adx_thresh': 8.555520147066465, 'atr_min_pct': 0.02475269469374015, 'atr_max_pct': 0.06901102554358057, 'tp_mult': 2.529986238339359, 'tsl_mult': 0.8616306259422891, 'strategy': 'mean_reversion', 'time_stop': 26, 'use_sma': False, 'use_atr': False, 'use_adx': True, 'use_ema': True, 'use_spike': True, 'rsi_required': False, 'edge_k': 0.37386338564124855, 'edge_cap': 0.6465575970884195, 'bull_strategy': 'mean_reversion', 'bull_bb_std_mult': 1.5676433086997779, 'bull_rsi_os': 21, 'bull_rsi_ob': 76, 'bull_adx_thresh': 18.185769416336758, 'bull_atr_min_pct': 0.02215246809756349, 'bull_atr_max_pct': 0.10265069651465032, 'bull_tp_mult': 2.197003983251604, 'bull_tsl_mult': 0.0097505788219851, 'bull_time_stop': 33, 'bull_use_sma': True, 'bull_use_ema': False, 'bull_use_atr': True, 'bull_use_adx': True, 'bull_use_spike': True, 'bull_rsi_required': True, 'bear_strategy': 'breakout', 'bear_bb_std_mult': 1.1546320608816178, 'bear_rsi_os': 29, 'bear_rsi_ob': 85, 'bear_adx_thresh': 17.871804346387318, 'bear_atr_min_pct': 0.02282895864253582, 'bear_atr_max_pct': 0.12891704891184327, 'bear_tp_mult': 1.778894248375737, 'bear_tsl_mult': 0.6857846828905073, 'bear_time_stop': 204, 'bear_use_sma': False, 'bear_use_ema': True, 'bear_use_atr': False, 'bear_use_adx': False, 'bear_use_spike': True, 'bear_rsi_required': True, 'sideways_strategy': 'breakout', 'sideways_bb_std_mult': 0.5637540882064862, 'sideways_rsi_os': 30, 'sideways_rsi_ob': 68, 'sideways_adx_thresh': 18.237899828256428, 'sideways_atr_min_pct': 0.0028395706653980067, 'sideways_atr_max_pct': 0.14993053712559068, 'sideways_tp_mult': 1.7531282191996274, 'sideways_tsl_mult': 0.8062382403589088, 'sideways_time_stop': 23, 'sideways_use_sma': False, 'sideways_use_ema': False, 'sideways_use_atr': True, 'sideways_use_adx': True, 'sideways_use_spike': False, 'sideways_rsi_required': False}.
[I 2025-08-31 13:39:30,285] Trial 801 finished with values: [-1000000000.0, 1000000000.0] and parameters: {'p_sma': 45, 'p_std': 14, 'p_atr': 18, 'p_adx': 25, 'rsi_period': 39, 'ema1': 7, 'ema2': 18, 'slip_atr_k': 0.03513161793691487, 'slip_spread_k': 0.0007335185082590345, 'spread_hl_frac': 0.018543308607457048, 'bb_std_mult': 2.3659329368658146, 'rsi_os': 37, 'rsi_ob': 93, 'vol_spike': 0.26821390532762135, 'adx_thresh': 8.958349401641533, 'atr_min_pct': 0.028535964737783814, 'atr_max_pct': 0.041029151115061877, 'tp_mult': 2.3822821039919315, 'tsl_mult': 0.3812095250920765, 'strategy': 'mean_reversion', 'time_stop': 241, 'use_sma': False, 'use_atr': False, 'use_adx': True, 'use_ema': True, 'use_spike': True, 'rsi_required': False, 'edge_k': 0.5619571708712457, 'edge_cap': 0.6585079271093199, 'bull_strategy': 'mean_reversion', 'bull_bb_std_mult': 2.699514969414432, 'bull_rsi_os': 6, 'bull_rsi_ob': 66, 'bull_adx_thresh': 17.472260794110415, 'bull_atr_min_pct': 0.026961350347208545, 'bull_atr_max_pct': 0.1032209929438157, 'bull_tp_mult': 2.4032008208741655, 'bull_tsl_mult': 0.2590177555072762, 'bull_time_stop': 34, 'bull_use_sma': True, 'bull_use_ema': True, 'bull_use_atr': True, 'bull_use_adx': True, 'bull_use_spike': True, 'bull_rsi_required': True, 'bear_strategy': 'breakout', 'bear_bb_std_mult': 3.5391877505409894, 'bear_rsi_os': 29, 'bear_rsi_ob': 56, 'bear_adx_thresh': 27.069586567840197, 'bear_atr_min_pct': 1.301562233532727e-05, 'bear_atr_max_pct': 0.06484571562000145, 'bear_tp_mult': 2.143314970631695, 'bear_tsl_mult': 0.9506108149492479, 'bear_time_stop': 202, 'bear_use_sma': False, 'bear_use_ema': True, 'bear_use_atr': False, 'bear_use_adx': False, 'bear_use_spike': True, 'bear_rsi_required': True, 'sideways_strategy': 'breakout', 'sideways_bb_std_mult': 2.7656312185475755, 'sideways_rsi_os': 9, 'sideways_rsi_ob': 72, 'sideways_adx_thresh': 18.193716201555034, 'sideways_atr_min_pct': 0.017915825073582654, 'sideways_atr_max_pct': 0.14994804630275357, 'sideways_tp_mult': 1.7816590260802962, 'sideways_tsl_mult': 0.8296451489472366, 'sideways_time_stop': 22, 'sideways_use_sma': False, 'sideways_use_ema': False, 'sideways_use_atr': True, 'sideways_use_adx': True, 'sideways_use_spike': False, 'sideways_rsi_required': True}.
[I 2025-08-31 13:40:08,289] Trial 806 finished with values: [-1000000000.0, 1000000000.0] and parameters: {'p_sma': 8, 'p_std': 24, 'p_atr': 15, 'p_adx': 14, 'rsi_period': 54, 'ema1': 7, 'ema2': 22, 'slip_atr_k': 0.18551189113956348, 'slip_spread_k': 0.42793826540882657, 'spread_hl_frac': 0.024867527611357076, 'bb_std_mult': 0.5641818911838454, 'rsi_os': 41, 'rsi_ob': 55, 'vol_spike': 0.029507641177194684, 'adx_thresh': 32.67537032260094, 'atr_min_pct': 0.011910943206573063, 'atr_max_pct': 0.059629075117989705, 'tp_mult': 2.5239108042961025, 'tsl_mult': 0.7858919582187056, 'strategy': 'breakout', 'time_stop': 168, 'use_sma': False, 'use_atr': False, 'use_adx': True, 'use_ema': False, 'use_spike': True, 'rsi_required': False, 'edge_k': 0.6038698254120054, 'edge_cap': 0.08367151426389086, 'bull_strategy': 'mean_reversion', 'bull_bb_std_mult': 2.5953151600078104, 'bull_rsi_os': 54, 'bull_rsi_ob': 59, 'bull_adx_thresh': 18.27797156204335, 'bull_atr_min_pct': 0.02237690551634594, 'bull_atr_max_pct': 0.14363927889692374, 'bull_tp_mult': 2.198391258882999, 'bull_tsl_mult': 0.2916038379843603, 'bull_time_stop': 9, 'bull_use_sma': False, 'bull_use_ema': False, 'bull_use_atr': True, 'bull_use_adx': True, 'bull_use_spike': True, 'bull_rsi_required': True, 'bear_strategy': 'mean_reversion', 'bear_bb_std_mult': 3.251831284891094, 'bear_rsi_os': 32, 'bear_rsi_ob': 84, 'bear_adx_thresh': 30.712607991631717, 'bear_atr_min_pct': 0.022953577458888832, 'bear_atr_max_pct': 0.12804734495477327, 'bear_tp_mult': 1.7875052754300418, 'bear_tsl_mult': 0.73195449649849, 'bear_time_stop': 22, 'bear_use_sma': False, 'bear_use_ema': True, 'bear_use_atr': False, 'bear_use_adx': False, 'bear_use_spike': False, 'bear_rsi_required': True, 'sideways_strategy': 'mean_reversion', 'sideways_bb_std_mult': 2.65924399927934, 'sideways_rsi_os': 30, 'sideways_rsi_ob': 65, 'sideways_adx_thresh': 24.780706215348925, 'sideways_atr_min_pct': 0.00477821615169644, 'sideways_atr_max_pct': 0.14988212883489146, 'sideways_tp_mult': 2.1794372690612738, 'sideways_tsl_mult': 0.9171667952793848, 'sideways_time_stop': 253, 'sideways_use_sma': False, 'sideways_use_ema': True, 'sideways_use_atr': True, 'sideways_use_adx': True, 'sideways_use_spike': True, 'sideways_rsi_required': False}.
[I 2025-08-31 13:40:08,800] Trial 805 finished with values: [-1000000000.0, 1000000000.0] and parameters: {'p_sma': 38, 'p_std': 24, 'p_atr': 15, 'p_adx': 23, 'rsi_period': 7, 'ema1': 12, 'ema2': 20, 'slip_atr_k': 0.18473938511129706, 'slip_spread_k': 0.961997194614627, 'spread_hl_frac': 0.024823735398348867, 'bb_std_mult': 2.3602137035295376, 'rsi_os': 41, 'rsi_ob': 88, 'vol_spike': 0.27089540483835267, 'adx_thresh': 5.080945123249957, 'atr_min_pct': 0.01200313705405074, 'atr_max_pct': 0.051953307126910035, 'tp_mult': 2.6138561437071415, 'tsl_mult': 0.7203133982045153, 'strategy': 'breakout', 'time_stop': 25, 'use_sma': False, 'use_atr': False, 'use_adx': True, 'use_ema': False, 'use_spike': True, 'rsi_required': False, 'edge_k': 0.37809454888630933, 'edge_cap': 0.4897891347958997, 'bull_strategy': 'mean_reversion', 'bull_bb_std_mult': 3.5996865154787643, 'bull_rsi_os': 5, 'bull_rsi_ob': 82, 'bull_adx_thresh': 18.247457843479168, 'bull_atr_min_pct': 0.0269612141399312, 'bull_atr_max_pct': 0.14398232514891052, 'bull_tp_mult': 2.1676086689247094, 'bull_tsl_mult': 0.832962433917362, 'bull_time_stop': 188, 'bull_use_sma': False, 'bull_use_ema': False, 'bull_use_atr': True, 'bull_use_adx': True, 'bull_use_spike': True, 'bull_rsi_required': True, 'bear_strategy': 'mean_reversion', 'bear_bb_std_mult': 2.213954172275149, 'bear_rsi_os': 32, 'bear_rsi_ob': 57, 'bear_adx_thresh': 18.006546159433714, 'bear_atr_min_pct': 1.8016657840173866e-05, 'bear_atr_max_pct': 0.04955735919448578, 'bear_tp_mult': 1.216327407154627, 'bear_tsl_mult': 0.6327578035502768, 'bear_time_stop': 288, 'bear_use_sma': False, 'bear_use_ema': True, 'bear_use_atr': False, 'bear_use_adx': False, 'bear_use_spike': False, 'bear_rsi_required': True, 'sideways_strategy': 'mean_reversion', 'sideways_bb_std_mult': 2.731940022743551, 'sideways_rsi_os': 30, 'sideways_rsi_ob': 65, 'sideways_adx_thresh': 25.622530148614707, 'sideways_atr_min_pct': 0.0020272556333913276, 'sideways_atr_max_pct': 0.14738501782855287, 'sideways_tp_mult': 2.9671255121155475, 'sideways_tsl_mult': 0.9951861999339111, 'sideways_time_stop': 84, 'sideways_use_sma': False, 'sideways_use_ema': True, 'sideways_use_atr': True, 'sideways_use_adx': True, 'sideways_use_spike': True, 'sideways_rsi_required': False}.
[I 2025-08-31 13:40:08,807] Trial 807 finished with values: [-1000000000.0, 1000000000.0] and parameters: {'p_sma': 38, 'p_std': 32, 'p_atr': 8, 'p_adx': 14, 'rsi_period': 54, 'ema1': 7, 'ema2': 20, 'slip_atr_k': 0.041749629418205994, 'slip_spread_k': 0.2521072103425577, 'spread_hl_frac': 0.017308934048943486, 'bb_std_mult': 2.364194546880462, 'rsi_os': 44, 'rsi_ob': 65, 'vol_spike': 0.299911739757195, 'adx_thresh': 34.275451584429646, 'atr_min_pct': 0.028721479450827186, 'atr_max_pct': 0.05966760829442622, 'tp_mult': 2.6058872419501102, 'tsl_mult': 0.32642181606541, 'strategy': 'breakout', 'time_stop': 169, 'use_sma': False, 'use_atr': False, 'use_adx': True, 'use_ema': False, 'use_spike': True, 'rsi_required': False, 'edge_k': 0.6001516975198458, 'edge_cap': 0.30317544158494925, 'bull_strategy': 'mean_reversion', 'bull_bb_std_mult': 2.800537250767966, 'bull_rsi_os': 33, 'bull_rsi_ob': 89, 'bull_adx_thresh': 20.447067584237065, 'bull_atr_min_pct': 0.0231135094211639, 'bull_atr_max_pct': 0.1434125282463074, 'bull_tp_mult': 2.1430676620247486, 'bull_tsl_mult': 0.1116997105998403, 'bull_time_stop': 224, 'bull_use_sma': False, 'bull_use_ema': True, 'bull_use_atr': True, 'bull_use_adx': False, 'bull_use_spike': True, 'bull_rsi_required': True, 'bear_strategy': 'mean_reversion', 'bear_bb_std_mult': 3.323186967894245, 'bear_rsi_os': 50, 'bear_rsi_ob': 55, 'bear_adx_thresh': 6.118018502785718, 'bear_atr_min_pct': 0.0010098776997783626, 'bear_atr_max_pct': 0.08726591125434287, 'bear_tp_mult': 1.2515359364682657, 'bear_tsl_mult': 0.7331447901069934, 'bear_time_stop': 221, 'bear_use_sma': False, 'bear_use_ema': True, 'bear_use_atr': False, 'bear_use_adx': False, 'bear_use_spike': False, 'bear_rsi_required': True, 'sideways_strategy': 'mean_reversion', 'sideways_bb_std_mult': 1.4770234777128806, 'sideways_rsi_os': 46, 'sideways_rsi_ob': 65, 'sideways_adx_thresh': 25.74790925152833, 'sideways_atr_min_pct': 0.0037366513533506535, 'sideways_atr_max_pct': 0.04738233931433325, 'sideways_tp_mult': 1.8692375836007769, 'sideways_tsl_mult': 0.8389976578982162, 'sideways_time_stop': 92, 'sideways_use_sma': False, 'sideways_use_ema': True, 'sideways_use_atr': True, 'sideways_use_adx': True, 'sideways_use_spike': True, 'sideways_rsi_required': True}.
[I 2025-08-31 13:40:09,014] Trial 808 finished with values: [-1000000000.0, 1000000000.0] and parameters: {'p_sma': 59, 'p_std': 20, 'p_atr': 17, 'p_adx': 14, 'rsi_period': 47, 'ema1': 8, 'ema2': 22, 'slip_atr_k': 0.05099661007375937, 'slip_spread_k': 0.4025395161943258, 'spread_hl_frac': 0.01740323692764087, 'bb_std_mult': 2.3018475503556926, 'rsi_os': 44, 'rsi_ob': 67, 'vol_spike': 0.03030527145455099, 'adx_thresh': 5.0378736753357245, 'atr_min_pct': 0.011972756405733776, 'atr_max_pct': 0.05141725931667704, 'tp_mult': 2.4877073756091237, 'tsl_mult': 0.7829775964894841, 'strategy': 'breakout', 'time_stop': 167, 'use_sma': False, 'use_atr': False, 'use_adx': True, 'use_ema': False, 'use_spike': True, 'rsi_required': False, 'edge_k': 0.6020748207704422, 'edge_cap': 0.30543807020385894, 'bull_strategy': 'mean_reversion', 'bull_bb_std_mult': 3.598705822967645, 'bull_rsi_os': 34, 'bull_rsi_ob': 89, 'bull_adx_thresh': 34.50732883071349, 'bull_atr_min_pct': 0.009276371495904864, 'bull_atr_max_pct': 0.07968447694275292, 'bull_tp_mult': 2.151147622101049, 'bull_tsl_mult': 0.28886774107613855, 'bull_time_stop': 190, 'bull_use_sma': False, 'bull_use_ema': False, 'bull_use_atr': True, 'bull_use_adx': False, 'bull_use_spike': True, 'bull_rsi_required': True, 'bear_strategy': 'mean_reversion', 'bear_bb_std_mult': 2.206832244902806, 'bear_rsi_os': 10, 'bear_rsi_ob': 70, 'bear_adx_thresh': 23.426886387028546, 'bear_atr_min_pct': 0.00061649262546192, 'bear_atr_max_pct': 0.13215599735430303, 'bear_tp_mult': 1.2032221016503062, 'bear_tsl_mult': 0.734130846947449, 'bear_time_stop': 191, 'bear_use_sma': False, 'bear_use_ema': True, 'bear_use_atr': False, 'bear_use_adx': False, 'bear_use_spike': False, 'bear_rsi_required': True, 'sideways_strategy': 'mean_reversion', 'sideways_bb_std_mult': 2.6108549466832227, 'sideways_rsi_os': 32, 'sideways_rsi_ob': 65, 'sideways_adx_thresh': 25.601668925864104, 'sideways_atr_min_pct': 0.004804531009605971, 'sideways_atr_max_pct': 0.10754197298878286, 'sideways_tp_mult': 2.6733247666545337, 'sideways_tsl_mult': 0.23017627283142578, 'sideways_time_stop': 49, 'sideways_use_sma': False, 'sideways_use_ema': True, 'sideways_use_atr': True, 'sideways_use_adx': True, 'sideways_use_spike': True, 'sideways_rsi_required': False}.
[I 2025-08-31 13:40:42,205] Trial 812 finished with values: [-1000000000.0, 1000000000.0] and parameters: {'p_sma': 36, 'p_std': 22, 'p_atr': 16, 'p_adx': 29, 'rsi_period': 64, 'ema1': 30, 'ema2': 35, 'slip_atr_k': 0.05215175805156687, 'slip_spread_k': 0.2849174054665374, 'spread_hl_frac': 0.04845186131467686, 'bb_std_mult': 2.4502102958232617, 'rsi_os': 39, 'rsi_ob': 86, 'vol_spike': 0.06762541536964782, 'adx_thresh': 6.354105664882334, 'atr_min_pct': 0.02677741483760551, 'atr_max_pct': 0.04515347558374178, 'tp_mult': 2.2161918178006683, 'tsl_mult': 0.5458358237731318, 'strategy': 'breakout', 'time_stop': 160, 'use_sma': False, 'use_atr': False, 'use_adx': True, 'use_ema': True, 'use_spike': True, 'rsi_required': False, 'edge_k': 0.5083610692495184, 'edge_cap': 0.123419894583012, 'bull_strategy': 'mean_reversion', 'bull_bb_std_mult': 2.8606100048764196, 'bull_rsi_os': 37, 'bull_rsi_ob': 91, 'bull_adx_thresh': 30.652315384585247, 'bull_atr_min_pct': 0.02139710878641587, 'bull_atr_max_pct': 0.13704071130150536, 'bull_tp_mult': 1.4915591535884958, 'bull_tsl_mult': 0.2678316192037659, 'bull_time_stop': 148, 'bull_use_sma': True, 'bull_use_ema': True, 'bull_use_atr': True, 'bull_use_adx': True, 'bull_use_spike': True, 'bull_rsi_required': True, 'bear_strategy': 'breakout', 'bear_bb_std_mult': 0.6798766210185052, 'bear_rsi_os': 31, 'bear_rsi_ob': 70, 'bear_adx_thresh': 21.685512356259196, 'bear_atr_min_pct': 0.0016047625693979442, 'bear_atr_max_pct': 0.1218134082411488, 'bear_tp_mult': 1.0820664200191734, 'bear_tsl_mult': 0.2036861084667625, 'bear_time_stop': 162, 'bear_use_sma': False, 'bear_use_ema': True, 'bear_use_atr': False, 'bear_use_adx': False, 'bear_use_spike': True, 'bear_rsi_required': True, 'sideways_strategy': 'breakout', 'sideways_bb_std_mult': 1.370711601861843, 'sideways_rsi_os': 5, 'sideways_rsi_ob': 67, 'sideways_adx_thresh': 24.673381741179735, 'sideways_atr_min_pct': 0.026557115083920904, 'sideways_atr_max_pct': 0.1442924492727358, 'sideways_tp_mult': 1.8281387413805121, 'sideways_tsl_mult': 0.583757660926434, 'sideways_time_stop': 155, 'sideways_use_sma': False, 'sideways_use_ema': False, 'sideways_use_atr': True, 'sideways_use_adx': True, 'sideways_use_spike': False, 'sideways_rsi_required': True}.
