[I 2025-08-31 12:02:40,691] Trial 72 finished with values: [-1000000000.0, 1000000000.0] and parameters: {'p_sma': 52, 'p_std': 46, 'p_atr': 19, 'p_adx': 7, 'rsi_period': 59, 'ema1': 7, 'ema2': 15, 'slip_atr_k': 0.020170991792019727, 'slip_spread_k': 0.5696831586507961, 'spread_hl_frac': 0.009277437447083972, 'bb_std_mult': 0.6757062797914042, 'rsi_os': 34, 'rsi_ob': 70, 'vol_spike': 0.2300448991035833, 'adx_thresh': 28.14289638320325, 'atr_min_pct': 0.015859276676092056, 'atr_max_pct': 0.05571504487898454, 'tp_mult': 2.8749745704566907, 'tsl_mult': 0.31911777419588805, 'strategy': 'mean_reversion', 'time_stop': 224, 'use_sma': False, 'use_atr': False, 'use_adx': True, 'use_ema': True, 'use_spike': True, 'rsi_required': True, 'edge_k': 0.859956755719812, 'edge_cap': 0.6337460348619802, 'bull_strategy': 'breakout', 'bull_bb_std_mult': 1.1862652710701178, 'bull_rsi_os': 32, 'bull_rsi_ob': 59, 'bull_adx_thresh': 32.07089815490298, 'bull_atr_min_pct': 0.01916224889415584, 'bull_atr_max_pct': 0.08487026742039286, 'bull_tp_mult': 2.8084063472807625, 'bull_tsl_mult': 0.16555789090519418, 'bull_time_stop': 266, 'bull_use_sma': False, 'bull_use_ema': False, 'bull_use_atr': False, 'bull_use_adx': False, 'bull_use_spike': False, 'bull_rsi_required': False, 'bear_strategy': 'breakout', 'bear_bb_std_mult': 2.4019216233783345, 'bear_rsi_os': 52, 'bear_rsi_ob': 60, 'bear_adx_thresh': 26.69172881307038, 'bear_atr_min_pct': 0.027641376081117004, 'bear_atr_max_pct': 0.07111177180313946, 'bear_tp_mult': 2.1613473961326446, 'bear_tsl_mult': 0.48376515077406457, 'bear_time_stop': 88, 'bear_use_sma': False, 'bear_use_ema': True, 'bear_use_atr': True, 'bear_use_adx': False, 'bear_use_spike': True, 'bear_rsi_required': False, 'sideways_strategy': 'breakout', 'sideways_bb_std_mult': 1.5119887337651958, 'sideways_rsi_os': 20, 'sideways_rsi_ob': 66, 'sideways_adx_thresh': 7.064908339144932, 'sideways_atr_min_pct': 0.005955275342157081, 'sideways_atr_max_pct': 0.08881129010228297, 'sideways_tp_mult': 1.5080740625978635, 'sideways_tsl_mult': 0.06389005060589387, 'sideways_time_stop': 147, 'sideways_use_sma': False, 'sideways_use_ema': True, 'sideways_use_atr': True, 'sideways_use_adx': False, 'sideways_use_spike': False, 'sideways_rsi_required': False}.
[I 2025-08-31 12:02:40,711] Trial 73 finished with values: [-0.10617139853049684, 0.10562242105591685] and parameters: {'p_sma': 52, 'p_std': 44, 'p_atr': 19, 'p_adx': 20, 'rsi_period': 59, 'ema1': 29, 'ema2': 14, 'slip_atr_k': 0.0183429702508464, 'slip_spread_k': 0.45753402039187097, 'spread_hl_frac': 0.005018943578286982, 'bb_std_mult': 3.151805654148195, 'rsi_os': 25, 'rsi_ob': 70, 'vol_spike': 0.2334229729230998, 'adx_thresh': 27.434279312859225, 'atr_min_pct': 0.01599905726758311, 'atr_max_pct': 0.055277382582886905, 'tp_mult': 2.689502222786745, 'tsl_mult': 0.16326900299765273, 'strategy': 'mean_reversion', 'time_stop': 224, 'use_sma': False, 'use_atr': False, 'use_adx': True, 'use_ema': True, 'use_spike': True, 'rsi_required': True, 'edge_k': 0.8945220155636451, 'edge_cap': 0.8394505695399919, 'bull_strategy': 'breakout', 'bull_bb_std_mult': 1.147584543446723, 'bull_rsi_os': 40, 'bull_rsi_ob': 77, 'bull_adx_thresh': 31.965862301512274, 'bull_atr_min_pct': 0.019323487244598748, 'bull_atr_max_pct': 0.08570314502835806, 'bull_tp_mult': 2.788332770665148, 'bull_tsl_mult': 0.15370150625825946, 'bull_time_stop': 267, 'bull_use_sma': False, 'bull_use_ema': False, 'bull_use_atr': False, 'bull_use_adx': False, 'bull_use_spike': False, 'bull_rsi_required': False, 'bear_strategy': 'breakout', 'bear_bb_std_mult': 2.3776558375221093, 'bear_rsi_os': 45, 'bear_rsi_ob': 62, 'bear_adx_thresh': 24.072565869497378, 'bear_atr_min_pct': 0.001298251093838132, 'bear_atr_max_pct': 0.07288341743845314, 'bear_tp_mult': 2.164878406240381, 'bear_tsl_mult': 0.4908160048527095, 'bear_time_stop': 86, 'bear_use_sma': False, 'bear_use_ema': True, 'bear_use_atr': True, 'bear_use_adx': False, 'bear_use_spike': True, 'bear_rsi_required': False, 'sideways_strategy': 'breakout', 'sideways_bb_std_mult': 1.408382652119697, 'sideways_rsi_os': 23, 'sideways_rsi_ob': 66, 'sideways_adx_thresh': 13.912173736123103, 'sideways_atr_min_pct': 0.02651886289292385, 'sideways_atr_max_pct': 0.08929417636953538, 'sideways_tp_mult': 2.8996238755357147, 'sideways_tsl_mult': 0.31448754991286754, 'sideways_time_stop': 277, 'sideways_use_sma': False, 'sideways_use_ema': True, 'sideways_use_atr': True, 'sideways_use_adx': False, 'sideways_use_spike': False, 'sideways_rsi_required': False}.
[I 2025-08-31 12:02:41,032] Trial 77 finished with values: [-1000000000.0, 1000000000.0] and parameters: {'p_sma': 60, 'p_std': 5, 'p_atr': 7, 'p_adx': 11, 'rsi_period': 65, 'ema1': 12, 'ema2': 10, 'slip_atr_k': 0.009330001149286272, 'slip_spread_k': 0.9370543124201276, 'spread_hl_frac': 0.013231994873715345, 'bb_std_mult': 2.803199887676184, 'rsi_os': 28, 'rsi_ob': 62, 'vol_spike': 0.26792650019669745, 'adx_thresh': 33.9516027596262, 'atr_min_pct': 0.019255614085788714, 'atr_max_pct': 0.010781030297449687, 'tp_mult': 2.4210156349608885, 'tsl_mult': 0.8990668174199126, 'strategy': 'breakout', 'time_stop': 243, 'use_sma': True, 'use_atr': True, 'use_adx': False, 'use_ema': True, 'use_spike': True, 'rsi_required': True, 'edge_k': 1.1969247849676332, 'edge_cap': 0.532232608117633, 'bull_strategy': 'breakout', 'bull_bb_std_mult': 0.8936453115644045, 'bull_rsi_os': 17, 'bull_rsi_ob': 69, 'bull_adx_thresh': 29.04616799934296, 'bull_atr_min_pct': 0.020695331510895868, 'bull_atr_max_pct': 0.05908886081795232, 'bull_tp_mult': 1.7602049737243068, 'bull_tsl_mult': 0.9435380632030178, 'bull_time_stop': 277, 'bull_use_sma': False, 'bull_use_ema': True, 'bull_use_atr': False, 'bull_use_adx': False, 'bull_use_spike': True, 'bull_rsi_required': True, 'bear_strategy': 'breakout', 'bear_bb_std_mult': 1.2029451781386227, 'bear_rsi_os': 28, 'bear_rsi_ob': 78, 'bear_adx_thresh': 6.357386104513321, 'bear_atr_min_pct': 0.02164407060406311, 'bear_atr_max_pct': 0.06263398116521458, 'bear_tp_mult': 1.5538498578339894, 'bear_tsl_mult': 0.614046485328346, 'bear_time_stop': 148, 'bear_use_sma': True, 'bear_use_ema': True, 'bear_use_atr': True, 'bear_use_adx': True, 'bear_use_spike': False, 'bear_rsi_required': True, 'sideways_strategy': 'breakout', 'sideways_bb_std_mult': 0.7809294987842921, 'sideways_rsi_os': 50, 'sideways_rsi_ob': 84, 'sideways_adx_thresh': 27.602890663436163, 'sideways_atr_min_pct': 0.006156363540309233, 'sideways_atr_max_pct': 0.10481186154511275, 'sideways_tp_mult': 1.6909448200710027, 'sideways_tsl_mult': 0.3411436168543814, 'sideways_time_stop': 187, 'sideways_use_sma': False, 'sideways_use_ema': False, 'sideways_use_atr': False, 'sideways_use_adx': True, 'sideways_use_spike': True, 'sideways_rsi_required': False}.
[I 2025-08-31 12:03:10,982] Trial 76 finished with values: [-1000000000.0, 1000000000.0] and parameters: {'p_sma': 60, 'p_std': 5, 'p_atr': 7, 'p_adx': 11, 'rsi_period': 66, 'ema1': 12, 'ema2': 10, 'slip_atr_k': 0.011096034579008124, 'slip_spread_k': 0.08572839673324828, 'spread_hl_frac': 0.012760999479212347, 'bb_std_mult': 2.8393288977135245, 'rsi_os': 28, 'rsi_ob': 82, 'vol_spike': 0.26731239240314697, 'adx_thresh': 33.590552696244146, 'atr_min_pct': 0.019234950021050464, 'atr_max_pct': 0.03398562633324067, 'tp_mult': 2.4075193696369324, 'tsl_mult': 0.6333474515981802, 'strategy': 'breakout', 'time_stop': 236, 'use_sma': True, 'use_atr': True, 'use_adx': False, 'use_ema': True, 'use_spike': True, 'rsi_required': True, 'edge_k': 1.8654490574972713, 'edge_cap': 0.8821474532445495, 'bull_strategy': 'breakout', 'bull_bb_std_mult': 2.3944595465893848, 'bull_rsi_os': 7, 'bull_rsi_ob': 69, 'bull_adx_thresh': 30.118017913284383, 'bull_atr_min_pct': 0.006751838166548172, 'bull_atr_max_pct': 0.09827201646246425, 'bull_tp_mult': 2.1162997719007883, 'bull_tsl_mult': 0.36032575309716575, 'bull_time_stop': 277, 'bull_use_sma': False, 'bull_use_ema': True, 'bull_use_atr': False, 'bull_use_adx': False, 'bull_use_spike': True, 'bull_rsi_required': True, 'bear_strategy': 'breakout', 'bear_bb_std_mult': 0.6769224880841542, 'bear_rsi_os': 27, 'bear_rsi_ob': 75, 'bear_adx_thresh': 16.949053659184592, 'bear_atr_min_pct': 0.013370676048784093, 'bear_atr_max_pct': 0.06132074588820375, 'bear_tp_mult': 2.7006564587236674, 'bear_tsl_mult': 0.8485080841871868, 'bear_time_stop': 56, 'bear_use_sma': True, 'bear_use_ema': True, 'bear_use_atr': True, 'bear_use_adx': True, 'bear_use_spike': False, 'bear_rsi_required': True, 'sideways_strategy': 'breakout', 'sideways_bb_std_mult': 0.8001879409019576, 'sideways_rsi_os': 50, 'sideways_rsi_ob': 83, 'sideways_adx_thresh': 32.869494593369765, 'sideways_atr_min_pct': 0.005838806091440587, 'sideways_atr_max_pct': 0.10264546067701373, 'sideways_tp_mult': 1.851657462730166, 'sideways_tsl_mult': 0.36920765148806733, 'sideways_time_stop': 76, 'sideways_use_sma': False, 'sideways_use_ema': False, 'sideways_use_atr': False, 'sideways_use_adx': True, 'sideways_use_spike': True, 'sideways_rsi_required': False}.
[I 2025-08-31 12:03:11,282] Trial 74 finished with values: [-1000000000.0, 1000000000.0] and parameters: {'p_sma': 53, 'p_std': 9, 'p_atr': 8, 'p_adx': 19, 'rsi_period': 64, 'ema1': 12, 'ema2': 10, 'slip_atr_k': 0.09972912929469875, 'slip_spread_k': 0.45723028322207604, 'spread_hl_frac': 0.004755670999609008, 'bb_std_mult': 1.5623799104436795, 'rsi_os': 28, 'rsi_ob': 82, 'vol_spike': 0.23298181206768168, 'adx_thresh': 33.742208528281104, 'atr_min_pct': 0.018776454264244673, 'atr_max_pct': 0.05558850558401154, 'tp_mult': 2.226458445764738, 'tsl_mult': 0.1613969573768767, 'strategy': 'mean_reversion', 'time_stop': 227, 'use_sma': False, 'use_atr': False, 'use_adx': True, 'use_ema': True, 'use_spike': True, 'rsi_required': True, 'edge_k': 1.4793867597940733, 'edge_cap': 0.38250366153863724, 'bull_strategy': 'breakout', 'bull_bb_std_mult': 2.413810790209637, 'bull_rsi_os': 41, 'bull_rsi_ob': 69, 'bull_adx_thresh': 26.169783310861998, 'bull_atr_min_pct': 0.019075336669919476, 'bull_atr_max_pct': 0.06711297657208215, 'bull_tp_mult': 1.7650491716746501, 'bull_tsl_mult': 0.8481444942787388, 'bull_time_stop': 273, 'bull_use_sma': False, 'bull_use_ema': True, 'bull_use_atr': False, 'bull_use_adx': False, 'bull_use_spike': True, 'bull_rsi_required': True, 'bear_strategy': 'breakout', 'bear_bb_std_mult': 2.521394999641714, 'bear_rsi_os': 52, 'bear_rsi_ob': 60, 'bear_adx_thresh': 26.75036039875253, 'bear_atr_min_pct': 0.014265386624269185, 'bear_atr_max_pct': 0.062359799040567813, 'bear_tp_mult': 2.151042674388388, 'bear_tsl_mult': 0.968241648748605, 'bear_time_stop': 91, 'bear_use_sma': False, 'bear_use_ema': True, 'bear_use_atr': True, 'bear_use_adx': False, 'bear_use_spike': False, 'bear_rsi_required': True, 'sideways_strategy': 'breakout', 'sideways_bb_std_mult': 1.521196796708343, 'sideways_rsi_os': 18, 'sideways_rsi_ob': 84, 'sideways_adx_thresh': 32.95344458251035, 'sideways_atr_min_pct': 0.005863586440927363, 'sideways_atr_max_pct': 0.09063723797094546, 'sideways_tp_mult': 1.868436279783603, 'sideways_tsl_mult': 0.41860810925816855, 'sideways_time_stop': 189, 'sideways_use_sma': False, 'sideways_use_ema': True, 'sideways_use_atr': True, 'sideways_use_adx': True, 'sideways_use_spike': True, 'sideways_rsi_required': False}.
[I 2025-08-31 12:03:11,620] Trial 75 finished with values: [-1000000000.0, 1000000000.0] and parameters: {'p_sma': 60, 'p_std': 34, 'p_atr': 8, 'p_adx': 11, 'rsi_period': 64, 'ema1': 12, 'ema2': 10, 'slip_atr_k': 0.0985001644244074, 'slip_spread_k': 0.5839976815319843, 'spread_hl_frac': 0.004516619888669755, 'bb_std_mult': 2.8088123374718648, 'rsi_os': 28, 'rsi_ob': 62, 'vol_spike': 0.2361467627447241, 'adx_thresh': 33.613853349588915, 'atr_min_pct': 0.019145944039936358, 'atr_max_pct': 0.05595499066686352, 'tp_mult': 2.6545499659159373, 'tsl_mult': 0.9577784788048298, 'strategy': 'mean_reversion', 'time_stop': 224, 'use_sma': False, 'use_atr': False, 'use_adx': True, 'use_ema': True, 'use_spike': True, 'rsi_required': True, 'edge_k': 1.20185999280034, 'edge_cap': 0.7952303255704559, 'bull_strategy': 'breakout', 'bull_bb_std_mult': 2.977227360796048, 'bull_rsi_os': 36, 'bull_rsi_ob': 67, 'bull_adx_thresh': 30.987063384002813, 'bull_atr_min_pct': 0.01899926506879543, 'bull_atr_max_pct': 0.051670153778451806, 'bull_tp_mult': 1.7390684604665045, 'bull_tsl_mult': 0.394407893485905, 'bull_time_stop': 274, 'bull_use_sma': False, 'bull_use_ema': True, 'bull_use_atr': False, 'bull_use_adx': False, 'bull_use_spike': True, 'bull_rsi_required': True, 'bear_strategy': 'breakout', 'bear_bb_std_mult': 2.373634415705309, 'bear_rsi_os': 27, 'bear_rsi_ob': 59, 'bear_adx_thresh': 5.948274307530955, 'bear_atr_min_pct': 0.01440891628465985, 'bear_atr_max_pct': 0.06305505521764079, 'bear_tp_mult': 2.8759514119730984, 'bear_tsl_mult': 0.8319439714295899, 'bear_time_stop': 134, 'bear_use_sma': True, 'bear_use_ema': True, 'bear_use_atr': True, 'bear_use_adx': False, 'bear_use_spike': False, 'bear_rsi_required': True, 'sideways_strategy': 'breakout', 'sideways_bb_std_mult': 1.2306180544523284, 'sideways_rsi_os': 9, 'sideways_rsi_ob': 84, 'sideways_adx_thresh': 27.9177775842342, 'sideways_atr_min_pct': 0.005740024580238531, 'sideways_atr_max_pct': 0.09455632477088972, 'sideways_tp_mult': 1.8940908743992966, 'sideways_tsl_mult': 0.4234077836597229, 'sideways_time_stop': 186, 'sideways_use_sma': False, 'sideways_use_ema': True, 'sideways_use_atr': True, 'sideways_use_adx': True, 'sideways_use_spike': True, 'sideways_rsi_required': False}.
[I 2025-08-31 12:03:11,866] Trial 78 finished with values: [-1000000000.0, 1000000000.0] and parameters: {'p_sma': 56, 'p_std': 7, 'p_atr': 8, 'p_adx': 26, 'rsi_period': 69, 'ema1': 12, 'ema2': 60, 'slip_atr_k': 0.07150503182770407, 'slip_spread_k': 0.38792271941178535, 'spread_hl_frac': 0.006865764106088745, 'bb_std_mult': 3.338967321101295, 'rsi_os': 23, 'rsi_ob': 82, 'vol_spike': 0.16339026996718617, 'adx_thresh': 33.467493259676104, 'atr_min_pct': 0.018742600899373924, 'atr_max_pct': 0.034623787850454064, 'tp_mult': 2.225126992823049, 'tsl_mult': 0.6374289067128385, 'strategy': 'mean_reversion', 'time_stop': 73, 'use_sma': False, 'use_atr': False, 'use_adx': True, 'use_ema': True, 'use_spike': True, 'rsi_required': True, 'edge_k': 0.7321587449234812, 'edge_cap': 0.367572339740038, 'bull_strategy': 'breakout', 'bull_bb_std_mult': 1.4082441697672925, 'bull_rsi_os': 52, 'bull_rsi_ob': 67, 'bull_adx_thresh': 30.966134836855396, 'bull_atr_min_pct': 0.01865151446842652, 'bull_atr_max_pct': 0.06682371267205084, 'bull_tp_mult': 1.0887091324029474, 'bull_tsl_mult': 0.4672682421777317, 'bull_time_stop': 20, 'bull_use_sma': False, 'bull_use_ema': True, 'bull_use_atr': False, 'bull_use_adx': True, 'bull_use_spike': True, 'bull_rsi_required': True, 'bear_strategy': 'breakout', 'bear_bb_std_mult': 1.926308180658432, 'bear_rsi_os': 18, 'bear_rsi_ob': 75, 'bear_adx_thresh': 5.1571409894956854, 'bear_atr_min_pct': 0.016635686710480085, 'bear_atr_max_pct': 0.059787497125217776, 'bear_tp_mult': 2.879933670743177, 'bear_tsl_mult': 0.6482689772824887, 'bear_time_stop': 274, 'bear_use_sma': True, 'bear_use_ema': False, 'bear_use_atr': True, 'bear_use_adx': True, 'bear_use_spike': False, 'bear_rsi_required': True, 'sideways_strategy': 'breakout', 'sideways_bb_std_mult': 2.4226828824925164, 'sideways_rsi_os': 12, 'sideways_rsi_ob': 84, 'sideways_adx_thresh': 32.99691793725763, 'sideways_atr_min_pct': 0.004648129313160897, 'sideways_atr_max_pct': 0.09294086253640481, 'sideways_tp_mult': 1.890984620598238, 'sideways_tsl_mult': 0.35179606480044906, 'sideways_time_stop': 213, 'sideways_use_sma': False, 'sideways_use_ema': False, 'sideways_use_atr': False, 'sideways_use_adx': True, 'sideways_use_spike': True, 'sideways_rsi_required': True}.
[I 2025-08-31 12:03:41,864] Trial 80 finished with values: [-1000000000.0, 1000000000.0] and parameters: {'p_sma': 56, 'p_std': 32, 'p_atr': 8, 'p_adx': 26, 'rsi_period': 31, 'ema1': 17, 'ema2': 57, 'slip_atr_k': 0.04311667074095902, 'slip_spread_k': 0.402568591452023, 'spread_hl_frac': 0.014878493246248055, 'bb_std_mult': 1.4661802143449636, 'rsi_os': 23, 'rsi_ob': 57, 'vol_spike': 0.17485207779321016, 'adx_thresh': 30.850082340146013, 'atr_min_pct': 0.021293798047232092, 'atr_max_pct': 0.10879607739688425, 'tp_mult': 2.053960759292928, 'tsl_mult': 0.37482404564559796, 'strategy': 'mean_reversion', 'time_stop': 77, 'use_sma': False, 'use_atr': False, 'use_adx': True, 'use_ema': True, 'use_spike': True, 'rsi_required': True, 'edge_k': 1.0354328599942533, 'edge_cap': 0.22139388519333686, 'bull_strategy': 'mean_reversion', 'bull_bb_std_mult': 1.4052594617434333, 'bull_rsi_os': 50, 'bull_rsi_ob': 67, 'bull_adx_thresh': 19.216264769094213, 'bull_atr_min_pct': 0.023170712114203424, 'bull_atr_max_pct': 0.05126237709387283, 'bull_tp_mult': 1.3773889371429333, 'bull_tsl_mult': 0.05612236559515804, 'bull_time_stop': 116, 'bull_use_sma': True, 'bull_use_ema': True, 'bull_use_atr': True, 'bull_use_adx': True, 'bull_use_spike': True, 'bull_rsi_required': True, 'bear_strategy': 'breakout', 'bear_bb_std_mult': 1.9107483858579302, 'bear_rsi_os': 17, 'bear_rsi_ob': 54, 'bear_adx_thresh': 5.284447498628392, 'bear_atr_min_pct': 0.01653372631180658, 'bear_atr_max_pct': 0.047422298585015565, 'bear_tp_mult': 2.7782012812252903, 'bear_tsl_mult': 0.6410020102385091, 'bear_time_stop': 132, 'bear_use_sma': True, 'bear_use_ema': False, 'bear_use_atr': True, 'bear_use_adx': True, 'bear_use_spike': False, 'bear_rsi_required': True, 'sideways_strategy': 'breakout', 'sideways_bb_std_mult': 1.2602227408393374, 'sideways_rsi_os': 10, 'sideways_rsi_ob': 78, 'sideways_adx_thresh': 10.59858785794136, 'sideways_atr_min_pct': 0.024097756843138578, 'sideways_atr_max_pct': 0.11859757976530481, 'sideways_tp_mult': 1.9839252536570748, 'sideways_tsl_mult': 0.1921103817204255, 'sideways_time_stop': 216, 'sideways_use_sma': True, 'sideways_use_ema': False, 'sideways_use_atr': False, 'sideways_use_adx': True, 'sideways_use_spike': True, 'sideways_rsi_required': True}.
[I 2025-08-31 12:03:41,937] Trial 82 finished with values: [-1000000000.0, 1000000000.0] and parameters: {'p_sma': 5, 'p_std': 7, 'p_atr': 21, 'p_adx': 9, 'rsi_period': 36, 'ema1': 22, 'ema2': 29, 'slip_atr_k': 0.038632175744212606, 'slip_spread_k': 0.2995952928135215, 'spread_hl_frac': 0.010358496849945664, 'bb_std_mult': 3.0778209019408456, 'rsi_os': 18, 'rsi_ob': 91, 'vol_spike': 0.019347709323929096, 'adx_thresh': 25.30449396637246, 'atr_min_pct': 0.020230894347196195, 'atr_max_pct': 0.046968113421391414, 'tp_mult': 2.0240377121549553, 'tsl_mult': 0.05959127996047145, 'strategy': 'mean_reversion', 'time_stop': 251, 'use_sma': False, 'use_atr': False, 'use_adx': True, 'use_ema': True, 'use_spike': False, 'rsi_required': False, 'edge_k': 1.650242403935013, 'edge_cap': 0.5764262933221072, 'bull_strategy': 'mean_reversion', 'bull_bb_std_mult': 1.3072575473293937, 'bull_rsi_os': 24, 'bull_rsi_ob': 53, 'bull_adx_thresh': 32.91111298060743, 'bull_atr_min_pct': 0.013458529195725745, 'bull_atr_max_pct': 0.06056474946430576, 'bull_tp_mult': 1.3478741406587353, 'bull_tsl_mult': 0.9651104616996058, 'bull_time_stop': 117, 'bull_use_sma': True, 'bull_use_ema': True, 'bull_use_atr': True, 'bull_use_adx': True, 'bull_use_spike': True, 'bull_rsi_required': True, 'bear_strategy': 'mean_reversion', 'bear_bb_std_mult': 2.048656859153885, 'bear_rsi_os': 48, 'bear_rsi_ob': 53, 'bear_adx_thresh': 23.193703028539005, 'bear_atr_min_pct': 0.024498816657616516, 'bear_atr_max_pct': 0.030967268530668134, 'bear_tp_mult': 2.510841994292547, 'bear_tsl_mult': 0.5246486127605682, 'bear_time_stop': 72, 'bear_use_sma': True, 'bear_use_ema': False, 'bear_use_atr': True, 'bear_use_adx': True, 'bear_use_spike': False, 'bear_rsi_required': True, 'sideways_strategy': 'mean_reversion', 'sideways_bb_std_mult': 1.1525896113475453, 'sideways_rsi_os': 30, 'sideways_rsi_ob': 78, 'sideways_adx_thresh': 21.979472987437255, 'sideways_atr_min_pct': 0.002048190820949399, 'sideways_atr_max_pct': 0.11117102244811058, 'sideways_tp_mult': 2.0009057887672435, 'sideways_tsl_mult': 0.695341758502495, 'sideways_time_stop': 224, 'sideways_use_sma': True, 'sideways_use_ema': False, 'sideways_use_atr': False, 'sideways_use_adx': True, 'sideways_use_spike': True, 'sideways_rsi_required': True}.
