[I 2025-08-31 12:03:42,063] Trial 79 finished with values: [-1000000000.0, 1000000000.0] and parameters: {'p_sma': 55, 'p_std': 28, 'p_atr': 8, 'p_adx': 9, 'rsi_period': 35, 'ema1': 17, 'ema2': 60, 'slip_atr_k': 0.0947025572968862, 'slip_spread_k': 0.3847960887188999, 'spread_hl_frac': 0.006818515654782115, 'bb_std_mult': 3.0640947313410805, 'rsi_os': 23, 'rsi_ob': 54, 'vol_spike': 0.17965370112755535, 'adx_thresh': 31.688760964651667, 'atr_min_pct': 0.020269539199250505, 'atr_max_pct': 0.048335446447291035, 'tp_mult': 2.0403912935867923, 'tsl_mult': 0.05406502860855106, 'strategy': 'mean_reversion', 'time_stop': 213, 'use_sma': False, 'use_atr': False, 'use_adx': True, 'use_ema': True, 'use_spike': True, 'rsi_required': True, 'edge_k': 1.3936129314440724, 'edge_cap': 0.20098302785957484, 'bull_strategy': 'mean_reversion', 'bull_bb_std_mult': 2.9297437308292023, 'bull_rsi_os': 24, 'bull_rsi_ob': 95, 'bull_adx_thresh': 30.952553894685273, 'bull_atr_min_pct': 0.004584331828191226, 'bull_atr_max_pct': 0.06631349772803907, 'bull_tp_mult': 1.8980739225616616, 'bull_tsl_mult': 0.053905532244038656, 'bull_time_stop': 13, 'bull_use_sma': False, 'bull_use_ema': True, 'bull_use_atr': False, 'bull_use_adx': True, 'bull_use_spike': True, 'bull_rsi_required': True, 'bear_strategy': 'breakout', 'bear_bb_std_mult': 1.5746503534784346, 'bear_rsi_os': 18, 'bear_rsi_ob': 59, 'bear_adx_thresh': 22.245141317427542, 'bear_atr_min_pct': 0.02520351760583809, 'bear_atr_max_pct': 0.06413166986083559, 'bear_tp_mult': 2.492157582847484, 'bear_tsl_mult': 0.9859480863611154, 'bear_time_stop': 241, 'bear_use_sma': True, 'bear_use_ema': False, 'bear_use_atr': True, 'bear_use_adx': True, 'bear_use_spike': False, 'bear_rsi_required': True, 'sideways_strategy': 'breakout', 'sideways_bb_std_mult': 2.435765612620033, 'sideways_rsi_os': 12, 'sideways_rsi_ob': 84, 'sideways_adx_thresh': 22.43181608136617, 'sideways_atr_min_pct': 0.004446953990766745, 'sideways_atr_max_pct': 0.11991673502612432, 'sideways_tp_mult': 2.748048920577482, 'sideways_tsl_mult': 0.1700484874844987, 'sideways_time_stop': 216, 'sideways_use_sma': False, 'sideways_use_ema': False, 'sideways_use_atr': False, 'sideways_use_adx': True, 'sideways_use_spike': True, 'sideways_rsi_required': True}.
[I 2025-08-31 12:03:42,136] Trial 81 finished with values: [-1000000000.0, 1000000000.0] and parameters: {'p_sma': 56, 'p_std': 27, 'p_atr': 23, 'p_adx': 9, 'rsi_period': 68, 'ema1': 17, 'ema2': 59, 'slip_atr_k': 0.043153286556023594, 'slip_spread_k': 0.3050810704273702, 'spread_hl_frac': 0.01518021398236811, 'bb_std_mult': 1.4641516865929685, 'rsi_os': 19, 'rsi_ob': 91, 'vol_spike': 0.17540802862081487, 'adx_thresh': 31.607435892393152, 'atr_min_pct': 0.020149158444888113, 'atr_max_pct': 0.12412214451927807, 'tp_mult': 2.1185139238217126, 'tsl_mult': 0.7156555949060865, 'strategy': 'mean_reversion', 'time_stop': 253, 'use_sma': False, 'use_atr': False, 'use_adx': True, 'use_ema': True, 'use_spike': True, 'rsi_required': False, 'edge_k': 1.0754727108678135, 'edge_cap': 0.1914317838854937, 'bull_strategy': 'mean_reversion', 'bull_bb_std_mult': 1.3956523025561347, 'bull_rsi_os': 49, 'bull_rsi_ob': 53, 'bull_adx_thresh': 18.75265865255898, 'bull_atr_min_pct': 0.0013495273221507224, 'bull_atr_max_pct': 0.04275989924346006, 'bull_tp_mult': 2.4439180539542478, 'bull_tsl_mult': 0.06599901119480628, 'bull_time_stop': 115, 'bull_use_sma': True, 'bull_use_ema': True, 'bull_use_atr': True, 'bull_use_adx': True, 'bull_use_spike': True, 'bull_rsi_required': True, 'bear_strategy': 'breakout', 'bear_bb_std_mult': 1.8113472840276073, 'bear_rsi_os': 23, 'bear_rsi_ob': 68, 'bear_adx_thresh': 23.06061868500308, 'bear_atr_min_pct': 0.015962228554093988, 'bear_atr_max_pct': 0.010383576480063064, 'bear_tp_mult': 2.4737412387571633, 'bear_tsl_mult': 0.6470837982312355, 'bear_time_stop': 73, 'bear_use_sma': True, 'bear_use_ema': False, 'bear_use_atr': True, 'bear_use_adx': True, 'bear_use_spike': False, 'bear_rsi_required': True, 'sideways_strategy': 'breakout', 'sideways_bb_std_mult': 2.9792058341553753, 'sideways_rsi_os': 43, 'sideways_rsi_ob': 62, 'sideways_adx_thresh': 10.606524841195405, 'sideways_atr_min_pct': 0.024768710687519478, 'sideways_atr_max_pct': 0.11118440968701765, 'sideways_tp_mult': 1.013052076599468, 'sideways_tsl_mult': 0.19167775068313453, 'sideways_time_stop': 213, 'sideways_use_sma': True, 'sideways_use_ema': False, 'sideways_use_atr': False, 'sideways_use_adx': True, 'sideways_use_spike': True, 'sideways_rsi_required': True}.
[I 2025-08-31 12:03:42,437] Trial 83 finished with values: [-1000000000.0, 1000000000.0] and parameters: {'p_sma': 46, 'p_std': 27, 'p_atr': 23, 'p_adx': 9, 'rsi_period': 56, 'ema1': 5, 'ema2': 47, 'slip_atr_k': 0.03281424409650275, 'slip_spread_k': 0.32089583686006495, 'spread_hl_frac': 0.030703620958299288, 'bb_std_mult': 2.706268377708321, 'rsi_os': 32, 'rsi_ob': 46, 'vol_spike': 0.20720269973274602, 'adx_thresh': 30.024270950358893, 'atr_min_pct': 0.0011114488546517531, 'atr_max_pct': 0.049644450991228675, 'tp_mult': 2.113464701721575, 'tsl_mult': 0.10501540048495778, 'strategy': 'mean_reversion', 'time_stop': 61, 'use_sma': True, 'use_atr': True, 'use_adx': False, 'use_ema': False, 'use_spike': True, 'rsi_required': False, 'edge_k': 1.3732463539477746, 'edge_cap': 0.6922216659145239, 'bull_strategy': 'breakout', 'bull_bb_std_mult': 1.0436175739849523, 'bull_rsi_os': 22, 'bull_rsi_ob': 72, 'bull_adx_thresh': 33.94945584805642, 'bull_atr_min_pct': 0.004503844968993538, 'bull_atr_max_pct': 0.042390663621387686, 'bull_tp_mult': 1.8974444686874534, 'bull_tsl_mult': 0.8222705081131602, 'bull_time_stop': 254, 'bull_use_sma': False, 'bull_use_ema': True, 'bull_use_atr': False, 'bull_use_adx': False, 'bull_use_spike': True, 'bull_rsi_required': True, 'bear_strategy': 'breakout', 'bear_bb_std_mult': 2.1947927652268686, 'bear_rsi_os': 6, 'bear_rsi_ob': 72, 'bear_adx_thresh': 24.377827728708798, 'bear_atr_min_pct': 0.015701717458812096, 'bear_atr_max_pct': 0.06660234040113391, 'bear_tp_mult': 1.1347724272677397, 'bear_tsl_mult': 0.592868232669846, 'bear_time_stop': 177, 'bear_use_sma': True, 'bear_use_ema': True, 'bear_use_atr': False, 'bear_use_adx': True, 'bear_use_spike': False, 'bear_rsi_required': False, 'sideways_strategy': 'breakout', 'sideways_bb_std_mult': 0.8495513676233278, 'sideways_rsi_os': 43, 'sideways_rsi_ob': 80, 'sideways_adx_thresh': 34.728749133274036, 'sideways_atr_min_pct': 0.0030945914334586096, 'sideways_atr_max_pct': 0.011497852061250619, 'sideways_tp_mult': 2.0960298262433366, 'sideways_tsl_mult': 0.4569964997485802, 'sideways_time_stop': 236, 'sideways_use_sma': False, 'sideways_use_ema': False, 'sideways_use_atr': False, 'sideways_use_adx': True, 'sideways_use_spike': False, 'sideways_rsi_required': False}.
[I 2025-08-31 12:04:11,041] Trial 86 finished with values: [-1000000000.0, 1000000000.0] and parameters: {'p_sma': 47, 'p_std': 10, 'p_atr': 7, 'p_adx': 7, 'rsi_period': 72, 'ema1': 11, 'ema2': 48, 'slip_atr_k': 0.15402754806923327, 'slip_spread_k': 0.0652754182114555, 'spread_hl_frac': 0.04492479505908716, 'bb_std_mult': 2.6970883611104908, 'rsi_os': 31, 'rsi_ob': 46, 'vol_spike': 0.18856767212078157, 'adx_thresh': 30.222150268301846, 'atr_min_pct': 0.006456742315564779, 'atr_max_pct': 0.04471188327965222, 'tp_mult': 2.130588720459978, 'tsl_mult': 0.1194320641939238, 'strategy': 'breakout', 'time_stop': 138, 'use_sma': True, 'use_atr': True, 'use_adx': False, 'use_ema': False, 'use_spike': False, 'rsi_required': True, 'edge_k': 0.9740244690375587, 'edge_cap': 0.688762055905227, 'bull_strategy': 'breakout', 'bull_bb_std_mult': 2.676810937363973, 'bull_rsi_os': 27, 'bull_rsi_ob': 72, 'bull_adx_thresh': 22.094304906564794, 'bull_atr_min_pct': 0.02074312080452859, 'bull_atr_max_pct': 0.14830727559809223, 'bull_tp_mult': 2.280874173010683, 'bull_tsl_mult': 0.8925402500941547, 'bull_time_stop': 253, 'bull_use_sma': False, 'bull_use_ema': False, 'bull_use_atr': False, 'bull_use_adx': False, 'bull_use_spike': True, 'bull_rsi_required': False, 'bear_strategy': 'mean_reversion', 'bear_bb_std_mult': 2.226090463373067, 'bear_rsi_os': 6, 'bear_rsi_ob': 72, 'bear_adx_thresh': 29.106038803292577, 'bear_atr_min_pct': 0.018663907693399644, 'bear_atr_max_pct': 0.06767690165476285, 'bear_tp_mult': 2.2698094994857954, 'bear_tsl_mult': 0.06645442389463707, 'bear_time_stop': 201, 'bear_use_sma': True, 'bear_use_ema': True, 'bear_use_atr': False, 'bear_use_adx': True, 'bear_use_spike': False, 'bear_rsi_required': False, 'sideways_strategy': 'mean_reversion', 'sideways_bb_std_mult': 1.0281337774634145, 'sideways_rsi_os': 36, 'sideways_rsi_ob': 80, 'sideways_adx_thresh': 20.56333259436613, 'sideways_atr_min_pct': 0.027745462419380668, 'sideways_atr_max_pct': 0.011972199461571797, 'sideways_tp_mult': 2.539527541611813, 'sideways_tsl_mult': 0.45981318163645124, 'sideways_time_stop': 241, 'sideways_use_sma': False, 'sideways_use_ema': False, 'sideways_use_atr': False, 'sideways_use_adx': False, 'sideways_use_spike': False, 'sideways_rsi_required': False}.
[I 2025-08-31 12:04:11,747] Trial 84 finished with values: [-0.034840581537553206, 0.03499847101262622] and parameters: {'p_sma': 21, 'p_std': 28, 'p_atr': 7, 'p_adx': 9, 'rsi_period': 56, 'ema1': 5, 'ema2': 48, 'slip_atr_k': 0.03360694333447701, 'slip_spread_k': 0.6316056400831302, 'spread_hl_frac': 0.04451576262893836, 'bb_std_mult': 2.7065199085063174, 'rsi_os': 32, 'rsi_ob': 53, 'vol_spike': 0.2036223370743616, 'adx_thresh': 31.63783081462494, 'atr_min_pct': 0.0027866117157893007, 'atr_max_pct': 0.049433433739356145, 'tp_mult': 2.119693385169116, 'tsl_mult': 0.23288197453067422, 'strategy': 'mean_reversion', 'time_stop': 111, 'use_sma': True, 'use_atr': True, 'use_adx': False, 'use_ema': False, 'use_spike': True, 'rsi_required': False, 'edge_k': 1.0865009987715069, 'edge_cap': 0.6834661014763742, 'bull_strategy': 'breakout', 'bull_bb_std_mult': 2.6812804655587668, 'bull_rsi_os': 22, 'bull_rsi_ob': 72, 'bull_adx_thresh': 21.826116066616265, 'bull_atr_min_pct': 0.00427170239031458, 'bull_atr_max_pct': 0.14592504973622777, 'bull_tp_mult': 2.703980500832446, 'bull_tsl_mult': 0.8168987427965617, 'bull_time_stop': 254, 'bull_use_sma': False, 'bull_use_ema': True, 'bull_use_atr': False, 'bull_use_adx': False, 'bull_use_spike': True, 'bull_rsi_required': True, 'bear_strategy': 'breakout', 'bear_bb_std_mult': 1.811923639024231, 'bear_rsi_os': 23, 'bear_rsi_ob': 62, 'bear_adx_thresh': 28.913567484455825, 'bear_atr_min_pct': 0.015657063979923128, 'bear_atr_max_pct': 0.06579843330257162, 'bear_tp_mult': 2.360385754297991, 'bear_tsl_mult': 0.5526236785374962, 'bear_time_stop': 201, 'bear_use_sma': True, 'bear_use_ema': True, 'bear_use_atr': False, 'bear_use_adx': True, 'bear_use_spike': False, 'bear_rsi_required': False, 'sideways_strategy': 'breakout', 'sideways_bb_std_mult': 2.9268939627668695, 'sideways_rsi_os': 37, 'sideways_rsi_ob': 55, 'sideways_adx_thresh': 34.73208960549716, 'sideways_atr_min_pct': 0.0032226843187640984, 'sideways_atr_max_pct': 0.08355937434959324, 'sideways_tp_mult': 2.70072390277577, 'sideways_tsl_mult': 0.4458000551756211, 'sideways_time_stop': 234, 'sideways_use_sma': False, 'sideways_use_ema': False, 'sideways_use_atr': False, 'sideways_use_adx': True, 'sideways_use_spike': False, 'sideways_rsi_required': False}.
[I 2025-08-31 12:04:11,830] Trial 85 finished with values: [-1000000000.0, 1000000000.0] and parameters: {'p_sma': 47, 'p_std': 10, 'p_atr': 7, 'p_adx': 9, 'rsi_period': 72, 'ema1': 13, 'ema2': 26, 'slip_atr_k': 0.15583795701732409, 'slip_spread_k': 0.33460110375082996, 'spread_hl_frac': 0.026403043850698513, 'bb_std_mult': 0.9689290073461556, 'rsi_os': 31, 'rsi_ob': 47, 'vol_spike': 0.29055658112071986, 'adx_thresh': 30.250961722855063, 'atr_min_pct': 0.0001237637852850703, 'atr_max_pct': 0.12446351925338453, 'tp_mult': 2.1357761433480618, 'tsl_mult': 0.22450881787583665, 'strategy': 'breakout', 'time_stop': 273, 'use_sma': True, 'use_atr': True, 'use_adx': False, 'use_ema': False, 'use_spike': False, 'rsi_required': False, 'edge_k': 1.0730539282283966, 'edge_cap': 0.6949467843131598, 'bull_strategy': 'breakout', 'bull_bb_std_mult': 2.745878423183645, 'bull_rsi_os': 27, 'bull_rsi_ob': 72, 'bull_adx_thresh': 34.0851961583337, 'bull_atr_min_pct': 0.02082635579819581, 'bull_atr_max_pct': 0.05409759247517845, 'bull_tp_mult': 2.451728132650092, 'bull_tsl_mult': 0.8239556820160139, 'bull_time_stop': 284, 'bull_use_sma': False, 'bull_use_ema': True, 'bull_use_atr': False, 'bull_use_adx': False, 'bull_use_spike': True, 'bull_rsi_required': False, 'bear_strategy': 'mean_reversion', 'bear_bb_std_mult': 0.5168401457769713, 'bear_rsi_os': 23, 'bear_rsi_ob': 68, 'bear_adx_thresh': 28.909496525574568, 'bear_atr_min_pct': 0.005683266395113426, 'bear_atr_max_pct': 0.06833899275469794, 'bear_tp_mult': 2.366107820416654, 'bear_tsl_mult': 0.6943906686852994, 'bear_time_stop': 156, 'bear_use_sma': True, 'bear_use_ema': True, 'bear_use_atr': False, 'bear_use_adx': True, 'bear_use_spike': False, 'bear_rsi_required': False, 'sideways_strategy': 'mean_reversion', 'sideways_bb_std_mult': 1.0147348996645595, 'sideways_rsi_os': 37, 'sideways_rsi_ob': 89, 'sideways_adx_thresh': 5.125238246805958, 'sideways_atr_min_pct': 0.003544078113166012, 'sideways_atr_max_pct': 0.0833274709087026, 'sideways_tp_mult': 2.135912827370845, 'sideways_tsl_mult': 0.28894295535708553, 'sideways_time_stop': 241, 'sideways_use_sma': False, 'sideways_use_ema': False, 'sideways_use_atr': False, 'sideways_use_adx': True, 'sideways_use_spike': False, 'sideways_rsi_required': False}.
[I 2025-08-31 12:04:12,193] Trial 87 finished with values: [-1000000000.0, 1000000000.0] and parameters: {'p_sma': 19, 'p_std': 10, 'p_atr': 7, 'p_adx': 7, 'rsi_period': 57, 'ema1': 13, 'ema2': 53, 'slip_atr_k': 0.1806510819695891, 'slip_spread_k': 0.6336489644306158, 'spread_hl_frac': 0.023045366104393346, 'bb_std_mult': 1.0843817470826176, 'rsi_os': 36, 'rsi_ob': 58, 'vol_spike': 0.2891537639942514, 'adx_thresh': 9.965519541807819, 'atr_min_pct': 0.006062234647441874, 'atr_max_pct': 0.019810832981720206, 'tp_mult': 2.311431225129256, 'tsl_mult': 0.2240852944249396, 'strategy': 'breakout', 'time_stop': 110, 'use_sma': True, 'use_atr': True, 'use_adx': False, 'use_ema': True, 'use_spike': False, 'rsi_required': True, 'edge_k': 1.0945311572705347, 'edge_cap': 0.483770864918704, 'bull_strategy': 'breakout', 'bull_bb_std_mult': 2.7195562679927323, 'bull_rsi_os': 53, 'bull_rsi_ob': 79, 'bull_adx_thresh': 15.639969701718035, 'bull_atr_min_pct': 0.018092175698296468, 'bull_atr_max_pct': 0.147777886389037, 'bull_tp_mult': 1.1448829940149474, 'bull_tsl_mult': 0.0022891780683731433, 'bull_time_stop': 245, 'bull_use_sma': False, 'bull_use_ema': False, 'bull_use_atr': False, 'bull_use_adx': False, 'bull_use_spike': True, 'bull_rsi_required': False, 'bear_strategy': 'mean_reversion', 'bear_bb_std_mult': 2.190379039103106, 'bear_rsi_os': 15, 'bear_rsi_ob': 86, 'bear_adx_thresh': 28.8819735135495, 'bear_atr_min_pct': 0.018535797051849674, 'bear_atr_max_pct': 0.11851363446291097, 'bear_tp_mult': 2.3660526789245924, 'bear_tsl_mult': 0.6944019525959092, 'bear_time_stop': 201, 'bear_use_sma': False, 'bear_use_ema': True, 'bear_use_atr': False, 'bear_use_adx': True, 'bear_use_spike': False, 'bear_rsi_required': True, 'sideways_strategy': 'mean_reversion', 'sideways_bb_std_mult': 1.0365917778498945, 'sideways_rsi_os': 37, 'sideways_rsi_ob': 89, 'sideways_adx_thresh': 11.933123946651047, 'sideways_atr_min_pct': 0.027972996928395878, 'sideways_atr_max_pct': 0.0812511722187037, 'sideways_tp_mult': 2.1585530363315506, 'sideways_tsl_mult': 0.775298216865411, 'sideways_time_stop': 243, 'sideways_use_sma': False, 'sideways_use_ema': False, 'sideways_use_atr': False, 'sideways_use_adx': False, 'sideways_use_spike': True, 'sideways_rsi_required': False}.
[I 2025-08-31 12:04:42,482] Trial 89 finished with values: [-1000000000.0, 1000000000.0] and parameters: {'p_sma': 18, 'p_std': 8, 'p_atr': 25, 'p_adx': 22, 'rsi_period': 56, 'ema1': 13, 'ema2': 34, 'slip_atr_k': 0.05900847735538875, 'slip_spread_k': 0.6233555243711071, 'spread_hl_frac': 0.026252334751119728, 'bb_std_mult': 0.7752938000208318, 'rsi_os': 43, 'rsi_ob': 56, 'vol_spike': 0.2048966527168794, 'adx_thresh': 32.365617100795085, 'atr_min_pct': 0.022967490909252826, 'atr_max_pct': 0.09386696379619945, 'tp_mult': 1.240563703549205, 'tsl_mult': 0.18510807108851277, 'strategy': 'mean_reversion', 'time_stop': 113, 'use_sma': False, 'use_atr': False, 'use_adx': True, 'use_ema': True, 'use_spike': True, 'rsi_required': True, 'edge_k': 1.1958970027063114, 'edge_cap': 0.09823456665385749, 'bull_strategy': 'breakout', 'bull_bb_std_mult': 1.2552771366135111, 'bull_rsi_os': 18, 'bull_rsi_ob': 70, 'bull_adx_thresh': 9.082530963443732, 'bull_atr_min_pct': 0.018208239823395905, 'bull_atr_max_pct': 0.054103497515825036, 'bull_tp_mult': 2.6073591170536043, 'bull_tsl_mult': 0.9316376217015921, 'bull_time_stop': 216, 'bull_use_sma': False, 'bull_use_ema': True, 'bull_use_atr': False, 'bull_use_adx': False, 'bull_use_spike': False, 'bull_rsi_required': False, 'bear_strategy': 'breakout', 'bear_bb_std_mult': 2.0559973411237067, 'bear_rsi_os': 20, 'bear_rsi_ob': 68, 'bear_adx_thresh': 19.252617266133043, 'bear_atr_min_pct': 0.012476166966999528, 'bear_atr_max_pct': 0.07498293672155158, 'bear_tp_mult': 2.3865125895429316, 'bear_tsl_mult': 0.6834429577878279, 'bear_time_stop': 155, 'bear_use_sma': False, 'bear_use_ema': True, 'bear_use_atr': True, 'bear_use_adx': False, 'bear_use_spike': False, 'bear_rsi_required': True, 'sideways_strategy': 'breakout', 'sideways_bb_std_mult': 1.7237678031713912, 'sideways_rsi_os': 38, 'sideways_rsi_ob': 52, 'sideways_adx_thresh': 5.457925567360817, 'sideways_atr_min_pct': 0.019637960577661172, 'sideways_atr_max_pct': 0.09932591599812902, 'sideways_tp_mult': 2.161887596697119, 'sideways_tsl_mult': 0.2899439352923378, 'sideways_time_stop': 167, 'sideways_use_sma': False, 'sideways_use_ema': False, 'sideways_use_atr': True, 'sideways_use_adx': True, 'sideways_use_spike': True, 'sideways_rsi_required': False}.
[I 2025-08-31 12:04:42,965] Trial 88 finished with values: [-1000000000.0, 1000000000.0] and parameters: {'p_sma': 20, 'p_std': 10, 'p_atr': 29, 'p_adx': 10, 'rsi_period': 46, 'ema1': 13, 'ema2': 26, 'slip_atr_k': 0.06731988052793708, 'slip_spread_k': 0.6436078966743569, 'spread_hl_frac': 0.022085864055300334, 'bb_std_mult': 1.1318484486044902, 'rsi_os': 42, 'rsi_ob': 58, 'vol_spike': 0.2228050131221801, 'adx_thresh': 10.247827375898158, 'atr_min_pct': 0.0027815769461675844, 'atr_max_pct': 0.07948459530747894, 'tp_mult': 2.294527195019892, 'tsl_mult': 0.13651733533689803, 'strategy': 'breakout', 'time_stop': 108, 'use_sma': False, 'use_atr': False, 'use_adx': True, 'use_ema': True, 'use_spike': True, 'rsi_required': True, 'edge_k': 1.9976498972399288, 'edge_cap': 0.42274762422276646, 'bull_strategy': 'breakout', 'bull_bb_std_mult': 1.6534683307704883, 'bull_rsi_os': 18, 'bull_rsi_ob': 74, 'bull_adx_thresh': 15.56077075970386, 'bull_atr_min_pct': 0.017989321737693915, 'bull_atr_max_pct': 0.05412295725095373, 'bull_tp_mult': 1.1444578344895584, 'bull_tsl_mult': 0.99307537455393, 'bull_time_stop': 282, 'bull_use_sma': False, 'bull_use_ema': True, 'bull_use_atr': False, 'bull_use_adx': False, 'bull_use_spike': False, 'bull_rsi_required': False, 'bear_strategy': 'mean_reversion', 'bear_bb_std_mult': 0.5518243433508077, 'bear_rsi_os': 15, 'bear_rsi_ob': 49, 'bear_adx_thresh': 28.554908300489323, 'bear_atr_min_pct': 0.017265811962610726, 'bear_atr_max_pct': 0.10322090747301986, 'bear_tp_mult': 2.630669396885409, 'bear_tsl_mult': 0.5464414595050519, 'bear_time_stop': 159, 'bear_use_sma': False, 'bear_use_ema': True, 'bear_use_atr': True, 'bear_use_adx': False, 'bear_use_spike': False, 'bear_rsi_required': True, 'sideways_strategy': 'breakout', 'sideways_bb_std_mult': 3.189655207496808, 'sideways_rsi_os': 23, 'sideways_rsi_ob': 57, 'sideways_adx_thresh': 13.115754636582432, 'sideways_atr_min_pct': 0.003579664869463319, 'sideways_atr_max_pct': 0.09825405950746588, 'sideways_tp_mult': 2.187768216879677, 'sideways_tsl_mult': 0.28690369206616356, 'sideways_time_stop': 160, 'sideways_use_sma': False, 'sideways_use_ema': True, 'sideways_use_atr': True, 'sideways_use_adx': True, 'sideways_use_spike': True, 'sideways_rsi_required': False}.
