[I 2025-08-31 11:56:36,631] Trial 19 finished with values: [-1000000000.0, 1000000000.0] and parameters: {'p_sma': 38, 'p_std': 59, 'p_atr': 24, 'p_adx': 18, 'rsi_period': 67, 'ema1': 30, 'ema2': 25, 'slip_atr_k': 0.16639458334974122, 'slip_spread_k': 0.42390003936240045, 'spread_hl_frac': 0.01979394253558367, 'bb_std_mult': 1.347120732270339, 'rsi_os': 30, 'rsi_ob': 78, 'vol_spike': 0.1993963382481823, 'adx_thresh': 24.518380579819066, 'atr_min_pct': 0.021103666155116003, 'atr_max_pct': 0.015565189630010703, 'tp_mult': 1.0794195781457678, 'tsl_mult': 0.2782787949615962, 'strategy': 'breakout', 'time_stop': 15, 'use_sma': False, 'use_atr': True, 'use_adx': False, 'use_ema': False, 'use_spike': False, 'rsi_required': True, 'edge_k': 0.7852349091917477, 'edge_cap': 0.6571506641873391, 'bull_strategy': 'breakout', 'bull_bb_std_mult': 3.5341982070672335, 'bull_rsi_os': 8, 'bull_rsi_ob': 81, 'bull_adx_thresh': 14.583854196588272, 'bull_atr_min_pct': 0.00018940342879546906, 'bull_atr_max_pct': 0.0107915566825387, 'bull_tp_mult': 2.9017355390145214, 'bull_tsl_mult': 0.9930974034214852, 'bull_time_stop': 36, 'bull_use_sma': False, 'bull_use_ema': True, 'bull_use_atr': False, 'bull_use_adx': False, 'bull_use_spike': False, 'bull_rsi_required': True, 'bear_strategy': 'mean_reversion', 'bear_bb_std_mult': 1.076692338885444, 'bear_rsi_os': 47, 'bear_rsi_ob': 61, 'bear_adx_thresh': 12.916628864101934, 'bear_atr_min_pct': 0.029278735709310902, 'bear_atr_max_pct': 0.04393693583990023, 'bear_tp_mult': 2.405198676509886, 'bear_tsl_mult': 0.7371442132566542, 'bear_time_stop': 180, 'bear_use_sma': True, 'bear_use_ema': True, 'bear_use_atr': False, 'bear_use_adx': False, 'bear_use_spike': False, 'bear_rsi_required': False, 'sideways_strategy': 'mean_reversion', 'sideways_bb_std_mult': 0.6291664936853711, 'sideways_rsi_os': 14, 'sideways_rsi_ob': 95, 'sideways_adx_thresh': 17.833863967553633, 'sideways_atr_min_pct': 0.029578103237667755, 'sideways_atr_max_pct': 0.0350710079045133, 'sideways_tp_mult': 2.9757850894073323, 'sideways_tsl_mult': 0.002949674557831433, 'sideways_time_stop': 84, 'sideways_use_sma': False, 'sideways_use_ema': False, 'sideways_use_atr': False, 'sideways_use_adx': True, 'sideways_use_spike': False, 'sideways_rsi_required': True}.
[I 2025-08-31 11:57:07,233] Trial 16 finished with values: [-1000000000.0, 1000000000.0] and parameters: {'p_sma': 38, 'p_std': 46, 'p_atr': 20, 'p_adx': 16, 'rsi_period': 41, 'ema1': 18, 'ema2': 51, 'slip_atr_k': 0.24583509726769356, 'slip_spread_k': 0.012584859013322791, 'spread_hl_frac': 0.03706495153001967, 'bb_std_mult': 1.32096121819532, 'rsi_os': 5, 'rsi_ob': 81, 'vol_spike': 0.030665277661566778, 'adx_thresh': 14.756185600583661, 'atr_min_pct': 0.026451445204039813, 'atr_max_pct': 0.14947565070743518, 'tp_mult': 2.6251464759961944, 'tsl_mult': 0.3016701074396275, 'strategy': 'breakout', 'time_stop': 12, 'use_sma': False, 'use_atr': False, 'use_adx': False, 'use_ema': False, 'use_spike': False, 'rsi_required': False, 'edge_k': 1.0742975704573106, 'edge_cap': 0.6116036237341627, 'bull_strategy': 'mean_reversion', 'bull_bb_std_mult': 3.1412216602902916, 'bull_rsi_os': 35, 'bull_rsi_ob': 83, 'bull_adx_thresh': 24.69110075019478, 'bull_atr_min_pct': 0.021961320101327723, 'bull_atr_max_pct': 0.12061337405074901, 'bull_tp_mult': 2.5101300657525623, 'bull_tsl_mult': 0.7526175849477725, 'bull_time_stop': 227, 'bull_use_sma': True, 'bull_use_ema': True, 'bull_use_atr': True, 'bull_use_adx': True, 'bull_use_spike': False, 'bull_rsi_required': False, 'bear_strategy': 'mean_reversion', 'bear_bb_std_mult': 1.3308567721718552, 'bear_rsi_os': 7, 'bear_rsi_ob': 58, 'bear_adx_thresh': 13.603045009145788, 'bear_atr_min_pct': 0.009489556574733375, 'bear_atr_max_pct': 0.04231108312278726, 'bear_tp_mult': 2.4088846907868082, 'bear_tsl_mult': 0.35754398788697167, 'bear_time_stop': 195, 'bear_use_sma': False, 'bear_use_ema': False, 'bear_use_atr': False, 'bear_use_adx': False, 'bear_use_spike': True, 'bear_rsi_required': False, 'sideways_strategy': 'mean_reversion', 'sideways_bb_std_mult': 1.3211147530171323, 'sideways_rsi_os': 28, 'sideways_rsi_ob': 77, 'sideways_adx_thresh': 14.361916061156752, 'sideways_atr_min_pct': 0.0006719162364255595, 'sideways_atr_max_pct': 0.08116315640388276, 'sideways_tp_mult': 1.3593262153593737, 'sideways_tsl_mult': 0.7060323779793254, 'sideways_time_stop': 300, 'sideways_use_sma': False, 'sideways_use_ema': True, 'sideways_use_atr': True, 'sideways_use_adx': False, 'sideways_use_spike': True, 'sideways_rsi_required': False}.
[I 2025-08-31 11:57:07,252] Trial 20 finished with values: [-1000000000.0, 1000000000.0] and parameters: {'p_sma': 38, 'p_std': 30, 'p_atr': 24, 'p_adx': 24, 'rsi_period': 67, 'ema1': 14, 'ema2': 27, 'slip_atr_k': 0.1686262762537234, 'slip_spread_k': 0.41118329569982903, 'spread_hl_frac': 0.03761007939822508, 'bb_std_mult': 0.5803341274465235, 'rsi_os': 28, 'rsi_ob': 83, 'vol_spike': 0.16723923686419903, 'adx_thresh': 24.754414431121777, 'atr_min_pct': 0.021401518259518408, 'atr_max_pct': 0.03723273102360935, 'tp_mult': 2.583759588977811, 'tsl_mult': 0.22729580617043663, 'strategy': 'breakout', 'time_stop': 79, 'use_sma': False, 'use_atr': True, 'use_adx': False, 'use_ema': False, 'use_spike': False, 'rsi_required': True, 'edge_k': 0.8000900828970492, 'edge_cap': 0.6884673697337448, 'bull_strategy': 'breakout', 'bull_bb_std_mult': 1.9386635943318944, 'bull_rsi_os': 19, 'bull_rsi_ob': 78, 'bull_adx_thresh': 23.446980920582494, 'bull_atr_min_pct': 0.009261810737034682, 'bull_atr_max_pct': 0.0673108786595781, 'bull_tp_mult': 2.522099716114956, 'bull_tsl_mult': 0.5385181917244546, 'bull_time_stop': 26, 'bull_use_sma': False, 'bull_use_ema': True, 'bull_use_atr': False, 'bull_use_adx': False, 'bull_use_spike': True, 'bull_rsi_required': True, 'bear_strategy': 'mean_reversion', 'bear_bb_std_mult': 0.9671435822504615, 'bear_rsi_os': 5, 'bear_rsi_ob': 61, 'bear_adx_thresh': 34.45606347928063, 'bear_atr_min_pct': 0.01890430604918815, 'bear_atr_max_pct': 0.14815200730890543, 'bear_tp_mult': 2.3799291050390043, 'bear_tsl_mult': 0.7422364910695542, 'bear_time_stop': 184, 'bear_use_sma': True, 'bear_use_ema': True, 'bear_use_atr': False, 'bear_use_adx': False, 'bear_use_spike': False, 'bear_rsi_required': False, 'sideways_strategy': 'mean_reversion', 'sideways_bb_std_mult': 1.4319486392324468, 'sideways_rsi_os': 16, 'sideways_rsi_ob': 70, 'sideways_adx_thresh': 17.94021840451321, 'sideways_atr_min_pct': 0.028427891230681974, 'sideways_atr_max_pct': 0.0895447454593938, 'sideways_tp_mult': 2.983503316164382, 'sideways_tsl_mult': 0.2501043425448762, 'sideways_time_stop': 169, 'sideways_use_sma': False, 'sideways_use_ema': False, 'sideways_use_atr': False, 'sideways_use_adx': True, 'sideways_use_spike': False, 'sideways_rsi_required': True}.
[I 2025-08-31 11:57:07,823] Trial 21 finished with values: [-0.045795826778986304, 0.04551162444438664] and parameters: {'p_sma': 37, 'p_std': 30, 'p_atr': 12, 'p_adx': 18, 'rsi_period': 56, 'ema1': 14, 'ema2': 35, 'slip_atr_k': 0.17249108149273293, 'slip_spread_k': 0.4216063129423594, 'spread_hl_frac': 0.037030369414617875, 'bb_std_mult': 1.354750742572683, 'rsi_os': 29, 'rsi_ob': 62, 'vol_spike': 0.29946899971608854, 'adx_thresh': 25.146348203218967, 'atr_min_pct': 0.021041222913492124, 'atr_max_pct': 0.04055743673595796, 'tp_mult': 2.653483665250327, 'tsl_mult': 0.14652288654179735, 'strategy': 'mean_reversion', 'time_stop': 72, 'use_sma': False, 'use_atr': True, 'use_adx': False, 'use_ema': True, 'use_spike': False, 'rsi_required': True, 'edge_k': 1.345905587289361, 'edge_cap': 0.4641629441548742, 'bull_strategy': 'breakout', 'bull_bb_std_mult': 3.159318595602649, 'bull_rsi_os': 19, 'bull_rsi_ob': 74, 'bull_adx_thresh': 21.216768141869185, 'bull_atr_min_pct': 0.00018098000500976741, 'bull_atr_max_pct': 0.06990991384387998, 'bull_tp_mult': 2.641431455757846, 'bull_tsl_mult': 0.7720429770554229, 'bull_time_stop': 101, 'bull_use_sma': False, 'bull_use_ema': True, 'bull_use_atr': False, 'bull_use_adx': False, 'bull_use_spike': True, 'bull_rsi_required': True, 'bear_strategy': 'mean_reversion', 'bear_bb_std_mult': 1.626688371632924, 'bear_rsi_os': 9, 'bear_rsi_ob': 50, 'bear_adx_thresh': 33.71242804782845, 'bear_atr_min_pct': 0.017749111245261386, 'bear_atr_max_pct': 0.04387654226255465, 'bear_tp_mult': 2.4934845065027837, 'bear_tsl_mult': 0.7485362827665211, 'bear_time_stop': 172, 'bear_use_sma': True, 'bear_use_ema': True, 'bear_use_atr': True, 'bear_use_adx': True, 'bear_use_spike': False, 'bear_rsi_required': False, 'sideways_strategy': 'mean_reversion', 'sideways_bb_std_mult': 1.337999670293089, 'sideways_rsi_os': 11, 'sideways_rsi_ob': 95, 'sideways_adx_thresh': 10.373566882058595, 'sideways_atr_min_pct': 0.00036682534426495453, 'sideways_atr_max_pct': 0.08064842017441326, 'sideways_tp_mult': 2.985030358434911, 'sideways_tsl_mult': 0.23367250925062383, 'sideways_time_stop': 173, 'sideways_use_sma': False, 'sideways_use_ema': False, 'sideways_use_atr': False, 'sideways_use_adx': True, 'sideways_use_spike': False, 'sideways_rsi_required': True}.
[I 2025-08-31 11:57:08,054] Trial 22 finished with values: [-1000000000.0, 1000000000.0] and parameters: {'p_sma': 34, 'p_std': 30, 'p_atr': 17, 'p_adx': 16, 'rsi_period': 55, 'ema1': 15, 'ema2': 34, 'slip_atr_k': 0.0106489431345866, 'slip_spread_k': 0.6478754434382099, 'spread_hl_frac': 0.0005205858241119493, 'bb_std_mult': 0.8689241564114214, 'rsi_os': 49, 'rsi_ob': 61, 'vol_spike': 0.2863948886025861, 'adx_thresh': 11.266615683270484, 'atr_min_pct': 0.018256087801760815, 'atr_max_pct': 0.03922582271391082, 'tp_mult': 2.446068700101154, 'tsl_mult': 0.5954138623726593, 'strategy': 'mean_reversion', 'time_stop': 76, 'use_sma': False, 'use_atr': True, 'use_adx': False, 'use_ema': True, 'use_spike': False, 'rsi_required': True, 'edge_k': 1.6162274633887075, 'edge_cap': 0.4517898688652693, 'bull_strategy': 'breakout', 'bull_bb_std_mult': 1.8831446294188616, 'bull_rsi_os': 18, 'bull_rsi_ob': 75, 'bull_adx_thresh': 22.729780766868203, 'bull_atr_min_pct': 0.008134893631824843, 'bull_atr_max_pct': 0.07199727771243042, 'bull_tp_mult': 2.580508523397853, 'bull_tsl_mult': 0.7632113129568825, 'bull_time_stop': 91, 'bull_use_sma': False, 'bull_use_ema': True, 'bull_use_atr': False, 'bull_use_adx': False, 'bull_use_spike': True, 'bull_rsi_required': True, 'bear_strategy': 'mean_reversion', 'bear_bb_std_mult': 1.6108627615624793, 'bear_rsi_os': 8, 'bear_rsi_ob': 52, 'bear_adx_thresh': 22.568434041085183, 'bear_atr_min_pct': 0.018689477572105418, 'bear_atr_max_pct': 0.055717212534166574, 'bear_tp_mult': 2.7287376355429513, 'bear_tsl_mult': 0.03197710951749477, 'bear_time_stop': 299, 'bear_use_sma': True, 'bear_use_ema': True, 'bear_use_atr': True, 'bear_use_adx': True, 'bear_use_spike': False, 'bear_rsi_required': False, 'sideways_strategy': 'mean_reversion', 'sideways_bb_std_mult': 1.3402893198783619, 'sideways_rsi_os': 30, 'sideways_rsi_ob': 67, 'sideways_adx_thresh': 10.500979279671059, 'sideways_atr_min_pct': 0.024787512544222373, 'sideways_atr_max_pct': 0.09177768573409008, 'sideways_tp_mult': 2.644687583648266, 'sideways_tsl_mult': 0.22383536830555922, 'sideways_time_stop': 180, 'sideways_use_sma': False, 'sideways_use_ema': True, 'sideways_use_atr': False, 'sideways_use_adx': True, 'sideways_use_spike': False, 'sideways_rsi_required': True}.
[I 2025-08-31 11:57:08,097] Trial 23 finished with values: [-1000000000.0, 1000000000.0] and parameters: {'p_sma': 13, 'p_std': 31, 'p_atr': 11, 'p_adx': 21, 'rsi_period': 79, 'ema1': 8, 'ema2': 36, 'slip_atr_k': 0.013983344482207338, 'slip_spread_k': 0.16155854953614213, 'spread_hl_frac': 0.0018751819726717453, 'bb_std_mult': 0.8819107847042204, 'rsi_os': 51, 'rsi_ob': 63, 'vol_spike': 0.23798176314727454, 'adx_thresh': 11.325526549885634, 'atr_min_pct': 0.010943566346427765, 'atr_max_pct': 0.034884479408504754, 'tp_mult': 1.6225503153142082, 'tsl_mult': 0.14305517066091883, 'strategy': 'mean_reversion', 'time_stop': 140, 'use_sma': False, 'use_atr': True, 'use_adx': False, 'use_ema': True, 'use_spike': True, 'rsi_required': True, 'edge_k': 1.384994223484689, 'edge_cap': 0.45979072525294595, 'bull_strategy': 'breakout', 'bull_bb_std_mult': 2.6232964813735795, 'bull_rsi_os': 13, 'bull_rsi_ob': 88, 'bull_adx_thresh': 5.009549246100023, 'bull_atr_min_pct': 2.9734207390196715e-05, 'bull_atr_max_pct': 0.028964472477111244, 'bull_tp_mult': 2.689892691754263, 'bull_tsl_mult': 0.3283556440810308, 'bull_time_stop': 89, 'bull_use_sma': False, 'bull_use_ema': True, 'bull_use_atr': False, 'bull_use_adx': False, 'bull_use_spike': True, 'bull_rsi_required': True, 'bear_strategy': 'breakout', 'bear_bb_std_mult': 1.6464984092414234, 'bear_rsi_os': 49, 'bear_rsi_ob': 51, 'bear_adx_thresh': 23.85274029734447, 'bear_atr_min_pct': 0.01662712449406784, 'bear_atr_max_pct': 0.030997504047279474, 'bear_tp_mult': 2.9712804159239576, 'bear_tsl_mult': 0.005593719927621754, 'bear_time_stop': 39, 'bear_use_sma': True, 'bear_use_ema': True, 'bear_use_atr': True, 'bear_use_adx': True, 'bear_use_spike': False, 'bear_rsi_required': False, 'sideways_strategy': 'breakout', 'sideways_bb_std_mult': 0.9988492548939089, 'sideways_rsi_os': 10, 'sideways_rsi_ob': 88, 'sideways_adx_thresh': 34.435498697185075, 'sideways_atr_min_pct': 0.015333914818749935, 'sideways_atr_max_pct': 0.050976313245774105, 'sideways_tp_mult': 2.597126325740745, 'sideways_tsl_mult': 0.9798159009186329, 'sideways_time_stop': 158, 'sideways_use_sma': False, 'sideways_use_ema': True, 'sideways_use_atr': False, 'sideways_use_adx': True, 'sideways_use_spike': False, 'sideways_rsi_required': True}.
[I 2025-08-31 11:57:08,128] Trial 24 finished with values: [-1000000000.0, 1000000000.0] and parameters: {'p_sma': 15, 'p_std': 30, 'p_atr': 11, 'p_adx': 21, 'rsi_period': 80, 'ema1': 8, 'ema2': 36, 'slip_atr_k': 0.017105033362985328, 'slip_spread_k': 0.11356065336996102, 'spread_hl_frac': 0.033806658695108335, 'bb_std_mult': 0.8943789511161346, 'rsi_os': 55, 'rsi_ob': 62, 'vol_spike': 0.2966983241892325, 'adx_thresh': 11.725390044253118, 'atr_min_pct': 0.010819293452313998, 'atr_max_pct': 0.035389030046318694, 'tp_mult': 1.664178732776095, 'tsl_mult': 0.910701997271963, 'strategy': 'mean_reversion', 'time_stop': 134, 'use_sma': False, 'use_atr': True, 'use_adx': False, 'use_ema': True, 'use_spike': True, 'rsi_required': True, 'edge_k': 1.3365490008321044, 'edge_cap': 0.44755804335880056, 'bull_strategy': 'breakout', 'bull_bb_std_mult': 2.6086342151880073, 'bull_rsi_os': 14, 'bull_rsi_ob': 88, 'bull_adx_thresh': 30.656274211069487, 'bull_atr_min_pct': 0.000873289933947214, 'bull_atr_max_pct': 0.030595495066841852, 'bull_tp_mult': 2.6625243714604867, 'bull_tsl_mult': 0.3286454778829533, 'bull_time_stop': 98, 'bull_use_sma': False, 'bull_use_ema': True, 'bull_use_atr': False, 'bull_use_adx': False, 'bull_use_spike': True, 'bull_rsi_required': True, 'bear_strategy': 'breakout', 'bear_bb_std_mult': 1.6631944366211666, 'bear_rsi_os': 50, 'bear_rsi_ob': 51, 'bear_adx_thresh': 23.228601715744638, 'bear_atr_min_pct': 0.018825362605893913, 'bear_atr_max_pct': 0.03137805442233043, 'bear_tp_mult': 2.9864228657770906, 'bear_tsl_mult': 0.026244592632536368, 'bear_time_stop': 41, 'bear_use_sma': True, 'bear_use_ema': True, 'bear_use_atr': True, 'bear_use_adx': True, 'bear_use_spike': False, 'bear_rsi_required': False, 'sideways_strategy': 'breakout', 'sideways_bb_std_mult': 0.9282422209428381, 'sideways_rsi_os': 10, 'sideways_rsi_ob': 88, 'sideways_adx_thresh': 21.763925855361318, 'sideways_atr_min_pct': 0.026371024795715018, 'sideways_atr_max_pct': 0.05286522936517789, 'sideways_tp_mult': 2.63820921292167, 'sideways_tsl_mult': 0.9978969245159419, 'sideways_time_stop': 167, 'sideways_use_sma': False, 'sideways_use_ema': True, 'sideways_use_atr': False, 'sideways_use_adx': True, 'sideways_use_spike': False, 'sideways_rsi_required': True}.
[I 2025-08-31 11:57:38,315] Trial 25 finished with values: [-0.03740521876983838, 0.037223935314608] and parameters: {'p_sma': 47, 'p_std': 31, 'p_atr': 11, 'p_adx': 7, 'rsi_period': 53, 'ema1': 15, 'ema2': 37, 'slip_atr_k': 0.007450902000617057, 'slip_spread_k': 0.6555841995674005, 'spread_hl_frac': 0.0009262588207549945, 'bb_std_mult': 2.3094119784883187, 'rsi_os': 35, 'rsi_ob': 63, 'vol_spike': 0.2938453963484484, 'adx_thresh': 28.344285411173466, 'atr_min_pct': 0.01783474589094371, 'atr_max_pct': 0.03702140324388841, 'tp_mult': 2.7219273073539147, 'tsl_mult': 0.09802497036152844, 'strategy': 'mean_reversion', 'time_stop': 73, 'use_sma': False, 'use_atr': True, 'use_adx': False, 'use_ema': True, 'use_spike': False, 'rsi_required': True, 'edge_k': 1.3424010124483885, 'edge_cap': 0.4465834827221519, 'bull_strategy': 'breakout', 'bull_bb_std_mult': 3.1161828910923473, 'bull_rsi_os': 19, 'bull_rsi_ob': 72, 'bull_adx_thresh': 30.077366312405683, 'bull_atr_min_pct': 0.0006827814264619243, 'bull_atr_max_pct': 0.06941899950159117, 'bull_tp_mult': 2.367425009645757, 'bull_tsl_mult': 0.8381534094911607, 'bull_time_stop': 98, 'bull_use_sma': False, 'bull_use_ema': True, 'bull_use_atr': False, 'bull_use_adx': False, 'bull_use_spike': True, 'bull_rsi_required': True, 'bear_strategy': 'mean_reversion', 'bear_bb_std_mult': 1.6522106309805846, 'bear_rsi_os': 13, 'bear_rsi_ob': 50, 'bear_adx_thresh': 31.63243994937889, 'bear_atr_min_pct': 0.01692779736922929, 'bear_atr_max_pct': 0.061160689311584346, 'bear_tp_mult': 2.6578971823131154, 'bear_tsl_mult': 0.8532285961243479, 'bear_time_stop': 150, 'bear_use_sma': True, 'bear_use_ema': True, 'bear_use_atr': True, 'bear_use_adx': True, 'bear_use_spike': False, 'bear_rsi_required': False, 'sideways_strategy': 'mean_reversion', 'sideways_bb_std_mult': 0.9576182263628792, 'sideways_rsi_os': 55, 'sideways_rsi_ob': 95, 'sideways_adx_thresh': 9.663305235434303, 'sideways_atr_min_pct': 0.003996128411269548, 'sideways_atr_max_pct': 0.09452296612122976, 'sideways_tp_mult': 2.6435448874146497, 'sideways_tsl_mult': 0.40733382821221886, 'sideways_time_stop': 168, 'sideways_use_sma': False, 'sideways_use_ema': False, 'sideways_use_atr': False, 'sideways_use_adx': True, 'sideways_use_spike': False, 'sideways_rsi_required': True}.
[I 2025-08-31 11:57:38,922] Trial 27 finished with values: [-1000000000.0, 1000000000.0] and parameters: {'p_sma': 45, 'p_std': 14, 'p_atr': 11, 'p_adx': 12, 'rsi_period': 51, 'ema1': 20, 'ema2': 36, 'slip_atr_k': 0.18498896507038629, 'slip_spread_k': 0.4339918764597731, 'spread_hl_frac': 0.04294985973292106, 'bb_std_mult': 2.1831303886785145, 'rsi_os': 14, 'rsi_ob': 73, 'vol_spike': 0.25988136043376303, 'adx_thresh': 27.987030424906777, 'atr_min_pct': 0.02993254273884712, 'atr_max_pct': 0.05859583511159244, 'tp_mult': 2.7673849899375385, 'tsl_mult': 0.02619302365961773, 'strategy': 'mean_reversion', 'time_stop': 44, 'use_sma': True, 'use_atr': True, 'use_adx': True, 'use_ema': True, 'use_spike': False, 'rsi_required': True, 'edge_k': 1.3337184301140617, 'edge_cap': 0.2563559677268338, 'bull_strategy': 'breakout', 'bull_bb_std_mult': 3.140214160298768, 'bull_rsi_os': 30, 'bull_rsi_ob': 67, 'bull_adx_thresh': 30.90935203785576, 'bull_atr_min_pct': 0.005774655539832673, 'bull_atr_max_pct': 0.08049267488884415, 'bull_tp_mult': 2.353395666827958, 'bull_tsl_mult': 0.8686538737408734, 'bull_time_stop': 130, 'bull_use_sma': False, 'bull_use_ema': True, 'bull_use_atr': False, 'bull_use_adx': False, 'bull_use_spike': True, 'bull_rsi_required': True, 'bear_strategy': 'mean_reversion', 'bear_bb_std_mult': 2.4534010954997276, 'bear_rsi_os': 11, 'bear_rsi_ob': 49, 'bear_adx_thresh': 31.151401292214064, 'bear_atr_min_pct': 0.009617296453802975, 'bear_atr_max_pct': 0.07467578472904847, 'bear_tp_mult': 1.873205828581122, 'bear_tsl_mult': 0.8702447436316932, 'bear_time_stop': 152, 'bear_use_sma': True, 'bear_use_ema': True, 'bear_use_atr': True, 'bear_use_adx': True, 'bear_use_spike': False, 'bear_rsi_required': False, 'sideways_strategy': 'mean_reversion', 'sideways_bb_std_mult': 1.66057276627447, 'sideways_rsi_os': 20, 'sideways_rsi_ob': 95, 'sideways_adx_thresh': 8.6829530495797, 'sideways_atr_min_pct': 0.0007216494444272667, 'sideways_atr_max_pct': 0.06811949078533565, 'sideways_tp_mult': 2.8248972487690605, 'sideways_tsl_mult': 0.4385714774055162, 'sideways_time_stop': 224, 'sideways_use_sma': False, 'sideways_use_ema': False, 'sideways_use_atr': False, 'sideways_use_adx': True, 'sideways_use_spike': False, 'sideways_rsi_required': True}.
