[I 2025-08-31 12:14:40,159] Trial 170 finished with values: [-1000000000.0, 1000000000.0] and parameters: {'p_sma': 8, 'p_std': 47, 'p_atr': 14, 'p_adx': 14, 'rsi_period': 79, 'ema1': 6, 'ema2': 20, 'slip_atr_k': 0.0899735993282072, 'slip_spread_k': 0.23138885754898592, 'spread_hl_frac': 0.016069250272416836, 'bb_std_mult': 1.2000606398811728, 'rsi_os': 35, 'rsi_ob': 59, 'vol_spike': 0.01236210400250537, 'adx_thresh': 15.477241054677656, 'atr_min_pct': 0.02773336042658509, 'atr_max_pct': 0.07076356513491415, 'tp_mult': 1.9631235778069576, 'tsl_mult': 0.44645027512718255, 'strategy': 'mean_reversion', 'time_stop': 262, 'use_sma': False, 'use_atr': False, 'use_adx': True, 'use_ema': True, 'use_spike': True, 'rsi_required': True, 'edge_k': 1.0992278763584953, 'edge_cap': 0.38903686259897996, 'bull_strategy': 'breakout', 'bull_bb_std_mult': 3.576826331942496, 'bull_rsi_os': 11, 'bull_rsi_ob': 53, 'bull_adx_thresh': 5.4477788329992975, 'bull_atr_min_pct': 0.028510023246184787, 'bull_atr_max_pct': 0.03804757208283242, 'bull_tp_mult': 2.838412379107241, 'bull_tsl_mult': 0.6938685429560163, 'bull_time_stop': 143, 'bull_use_sma': False, 'bull_use_ema': False, 'bull_use_atr': False, 'bull_use_adx': False, 'bull_use_spike': True, 'bull_rsi_required': True, 'bear_strategy': 'mean_reversion', 'bear_bb_std_mult': 1.9448328261522845, 'bear_rsi_os': 22, 'bear_rsi_ob': 60, 'bear_adx_thresh': 34.3253079706334, 'bear_atr_min_pct': 0.022217630092337945, 'bear_atr_max_pct': 0.10584303127750405, 'bear_tp_mult': 1.5742838718254735, 'bear_tsl_mult': 0.820885879428404, 'bear_time_stop': 195, 'bear_use_sma': False, 'bear_use_ema': True, 'bear_use_atr': False, 'bear_use_adx': False, 'bear_use_spike': False, 'bear_rsi_required': True, 'sideways_strategy': 'breakout', 'sideways_bb_std_mult': 2.6089548628787176, 'sideways_rsi_os': 36, 'sideways_rsi_ob': 59, 'sideways_adx_thresh': 5.936597384816446, 'sideways_atr_min_pct': 0.025027382583405103, 'sideways_atr_max_pct': 0.07554081025393904, 'sideways_tp_mult': 1.644183429041575, 'sideways_tsl_mult': 0.7972491560442938, 'sideways_time_stop': 42, 'sideways_use_sma': False, 'sideways_use_ema': True, 'sideways_use_atr': True, 'sideways_use_adx': False, 'sideways_use_spike': True, 'sideways_rsi_required': False}.
[I 2025-08-31 12:14:40,838] Trial 172 finished with values: [-1000000000.0, 1000000000.0] and parameters: {'p_sma': 40, 'p_std': 58, 'p_atr': 14, 'p_adx': 30, 'rsi_period': 76, 'ema1': 6, 'ema2': 37, 'slip_atr_k': 0.0718675027147136, 'slip_spread_k': 0.7116263224652154, 'spread_hl_frac': 0.027808713074901667, 'bb_std_mult': 0.5021816411826021, 'rsi_os': 35, 'rsi_ob': 90, 'vol_spike': 0.26188688882349326, 'adx_thresh': 23.695490187099928, 'atr_min_pct': 0.027650115880326252, 'atr_max_pct': 0.14020596721472714, 'tp_mult': 2.6156887336545487, 'tsl_mult': 0.9167371409689802, 'strategy': 'mean_reversion', 'time_stop': 142, 'use_sma': False, 'use_atr': False, 'use_adx': True, 'use_ema': True, 'use_spike': True, 'rsi_required': False, 'edge_k': 1.9488417561750215, 'edge_cap': 0.3878437177814448, 'bull_strategy': 'breakout', 'bull_bb_std_mult': 2.0445710530977066, 'bull_rsi_os': 17, 'bull_rsi_ob': 85, 'bull_adx_thresh': 16.071652072503284, 'bull_atr_min_pct': 0.02324606477322695, 'bull_atr_max_pct': 0.038354190653015416, 'bull_tp_mult': 2.8466747446553, 'bull_tsl_mult': 0.28994298828738685, 'bull_time_stop': 19, 'bull_use_sma': False, 'bull_use_ema': False, 'bull_use_atr': False, 'bull_use_adx': False, 'bull_use_spike': True, 'bull_rsi_required': False, 'bear_strategy': 'mean_reversion', 'bear_bb_std_mult': 0.7773381894926357, 'bear_rsi_os': 12, 'bear_rsi_ob': 80, 'bear_adx_thresh': 34.254904593042035, 'bear_atr_min_pct': 0.028198232004532375, 'bear_atr_max_pct': 0.07816671468458117, 'bear_tp_mult': 1.679639907721262, 'bear_tsl_mult': 0.30282766036031666, 'bear_time_stop': 214, 'bear_use_sma': False, 'bear_use_ema': False, 'bear_use_atr': False, 'bear_use_adx': False, 'bear_use_spike': False, 'bear_rsi_required': True, 'sideways_strategy': 'breakout', 'sideways_bb_std_mult': 3.056421981752563, 'sideways_rsi_os': 38, 'sideways_rsi_ob': 47, 'sideways_adx_thresh': 24.485312717765783, 'sideways_atr_min_pct': 0.002782029756079959, 'sideways_atr_max_pct': 0.06768961632064066, 'sideways_tp_mult': 2.2740927606150136, 'sideways_tsl_mult': 0.8323744828888138, 'sideways_time_stop': 103, 'sideways_use_sma': False, 'sideways_use_ema': True, 'sideways_use_atr': True, 'sideways_use_adx': True, 'sideways_use_spike': True, 'sideways_rsi_required': False}.
[I 2025-08-31 12:15:16,528] Trial 176 finished with values: [-1000000000.0, 1000000000.0] and parameters: {'p_sma': 21, 'p_std': 12, 'p_atr': 15, 'p_adx': 12, 'rsi_period': 75, 'ema1': 5, 'ema2': 35, 'slip_atr_k': 0.07691147850020996, 'slip_spread_k': 0.20901416778112747, 'spread_hl_frac': 0.025015690362843342, 'bb_std_mult': 1.1518503706164944, 'rsi_os': 43, 'rsi_ob': 81, 'vol_spike': 0.06652620266344562, 'adx_thresh': 22.73182171586904, 'atr_min_pct': 0.02653331444641891, 'atr_max_pct': 0.0779353870337646, 'tp_mult': 1.7643427618460932, 'tsl_mult': 0.5244186908494725, 'strategy': 'mean_reversion', 'time_stop': 86, 'use_sma': True, 'use_atr': True, 'use_adx': False, 'use_ema': False, 'use_spike': True, 'rsi_required': False, 'edge_k': 1.5388991165804755, 'edge_cap': 0.2808607927624579, 'bull_strategy': 'mean_reversion', 'bull_bb_std_mult': 3.149811542121846, 'bull_rsi_os': 14, 'bull_rsi_ob': 57, 'bull_adx_thresh': 14.782593496687284, 'bull_atr_min_pct': 0.02530573876827638, 'bull_atr_max_pct': 0.10200946934864343, 'bull_tp_mult': 2.6961747837787855, 'bull_tsl_mult': 0.5877147725563572, 'bull_time_stop': 218, 'bull_use_sma': True, 'bull_use_ema': True, 'bull_use_atr': False, 'bull_use_adx': True, 'bull_use_spike': False, 'bull_rsi_required': False, 'bear_strategy': 'mean_reversion', 'bear_bb_std_mult': 2.4816661524724615, 'bear_rsi_os': 27, 'bear_rsi_ob': 62, 'bear_adx_thresh': 22.278171313475095, 'bear_atr_min_pct': 0.0293257966405609, 'bear_atr_max_pct': 0.10036758020052358, 'bear_tp_mult': 1.7706766288931854, 'bear_tsl_mult': 0.42947929343270175, 'bear_time_stop': 105, 'bear_use_sma': False, 'bear_use_ema': False, 'bear_use_atr': False, 'bear_use_adx': False, 'bear_use_spike': True, 'bear_rsi_required': False, 'sideways_strategy': 'breakout', 'sideways_bb_std_mult': 3.240928268162656, 'sideways_rsi_os': 18, 'sideways_rsi_ob': 91, 'sideways_adx_thresh': 8.431892121985982, 'sideways_atr_min_pct': 0.011088441826145847, 'sideways_atr_max_pct': 0.08603137929989504, 'sideways_tp_mult': 2.7423664236397123, 'sideways_tsl_mult': 0.44083337797296984, 'sideways_time_stop': 161, 'sideways_use_sma': True, 'sideways_use_ema': False, 'sideways_use_atr': True, 'sideways_use_adx': True, 'sideways_use_spike': False, 'sideways_rsi_required': True}.
[I 2025-08-31 12:15:18,285] Trial 175 finished with values: [-1000000000.0, 1000000000.0] and parameters: {'p_sma': 42, 'p_std': 11, 'p_atr': 29, 'p_adx': 12, 'rsi_period': 76, 'ema1': 5, 'ema2': 37, 'slip_atr_k': 0.09657603768383, 'slip_spread_k': 0.21105017379255808, 'spread_hl_frac': 0.024943679807274573, 'bb_std_mult': 0.9873289691390399, 'rsi_os': 7, 'rsi_ob': 61, 'vol_spike': 0.26099775767121275, 'adx_thresh': 22.72283806128661, 'atr_min_pct': 0.0019229477188270304, 'atr_max_pct': 0.0770224946279072, 'tp_mult': 2.5646074774778285, 'tsl_mult': 0.572219572574247, 'strategy': 'mean_reversion', 'time_stop': 79, 'use_sma': False, 'use_atr': True, 'use_adx': False, 'use_ema': False, 'use_spike': True, 'rsi_required': False, 'edge_k': 1.1634096871498596, 'edge_cap': 0.2836850758336117, 'bull_strategy': 'mean_reversion', 'bull_bb_std_mult': 2.6468587755014514, 'bull_rsi_os': 17, 'bull_rsi_ob': 82, 'bull_adx_thresh': 28.091198935742426, 'bull_atr_min_pct': 0.022266626479784463, 'bull_atr_max_pct': 0.020105465982009026, 'bull_tp_mult': 2.70023562512809, 'bull_tsl_mult': 0.28422849525028726, 'bull_time_stop': 160, 'bull_use_sma': True, 'bull_use_ema': False, 'bull_use_atr': False, 'bull_use_adx': True, 'bull_use_spike': True, 'bull_rsi_required': False, 'bear_strategy': 'mean_reversion', 'bear_bb_std_mult': 2.53522352047292, 'bear_rsi_os': 27, 'bear_rsi_ob': 91, 'bear_adx_thresh': 21.737667079662714, 'bear_atr_min_pct': 0.027505237370871013, 'bear_atr_max_pct': 0.09976427879932173, 'bear_tp_mult': 1.6647013822956425, 'bear_tsl_mult': 0.4247787964989351, 'bear_time_stop': 212, 'bear_use_sma': False, 'bear_use_ema': False, 'bear_use_atr': False, 'bear_use_adx': False, 'bear_use_spike': False, 'bear_rsi_required': True, 'sideways_strategy': 'breakout', 'sideways_bb_std_mult': 1.980057656151902, 'sideways_rsi_os': 17, 'sideways_rsi_ob': 48, 'sideways_adx_thresh': 9.03846344150878, 'sideways_atr_min_pct': 0.027547670256655492, 'sideways_atr_max_pct': 0.06710499730418018, 'sideways_tp_mult': 2.747455530420607, 'sideways_tsl_mult': 0.6194929592666925, 'sideways_time_stop': 190, 'sideways_use_sma': True, 'sideways_use_ema': False, 'sideways_use_atr': True, 'sideways_use_adx': True, 'sideways_use_spike': True, 'sideways_rsi_required': False}.
[I 2025-08-31 12:15:18,577] Trial 173 finished with values: [-1000000000.0, 1000000000.0] and parameters: {'p_sma': 40, 'p_std': 16, 'p_atr': 9, 'p_adx': 30, 'rsi_period': 75, 'ema1': 8, 'ema2': 19, 'slip_atr_k': 0.08990498507274611, 'slip_spread_k': 0.21329733054397887, 'spread_hl_frac': 0.027514440625596714, 'bb_std_mult': 1.1824819045061625, 'rsi_os': 45, 'rsi_ob': 59, 'vol_spike': 0.18881636002883306, 'adx_thresh': 15.625779044646766, 'atr_min_pct': 0.02669582241680428, 'atr_max_pct': 0.07055916107312495, 'tp_mult': 2.5667730938459434, 'tsl_mult': 0.7330228092153965, 'strategy': 'mean_reversion', 'time_stop': 177, 'use_sma': False, 'use_atr': False, 'use_adx': True, 'use_ema': True, 'use_spike': True, 'rsi_required': False, 'edge_k': 0.09612333171219367, 'edge_cap': 0.38694391435759756, 'bull_strategy': 'mean_reversion', 'bull_bb_std_mult': 2.63035695625895, 'bull_rsi_os': 49, 'bull_rsi_ob': 57, 'bull_adx_thresh': 14.785713160147301, 'bull_atr_min_pct': 0.028491245081378038, 'bull_atr_max_pct': 0.019131484261111536, 'bull_tp_mult': 2.8438162549270025, 'bull_tsl_mult': 0.2891079709485243, 'bull_time_stop': 240, 'bull_use_sma': False, 'bull_use_ema': False, 'bull_use_atr': False, 'bull_use_adx': False, 'bull_use_spike': True, 'bull_rsi_required': False, 'bear_strategy': 'mean_reversion', 'bear_bb_std_mult': 1.0175169521811098, 'bear_rsi_os': 13, 'bear_rsi_ob': 60, 'bear_adx_thresh': 34.47711382138278, 'bear_atr_min_pct': 0.02760213281547113, 'bear_atr_max_pct': 0.10163807625113142, 'bear_tp_mult': 1.6685437412768553, 'bear_tsl_mult': 0.5072869747111453, 'bear_time_stop': 213, 'bear_use_sma': False, 'bear_use_ema': False, 'bear_use_atr': False, 'bear_use_adx': False, 'bear_use_spike': False, 'bear_rsi_required': True, 'sideways_strategy': 'breakout', 'sideways_bb_std_mult': 1.9954157361251323, 'sideways_rsi_os': 18, 'sideways_rsi_ob': 48, 'sideways_adx_thresh': 24.425478225010274, 'sideways_atr_min_pct': 0.011071392984734144, 'sideways_atr_max_pct': 0.06784701880814871, 'sideways_tp_mult': 1.416361700806259, 'sideways_tsl_mult': 0.5014615012655325, 'sideways_time_stop': 75, 'sideways_use_sma': False, 'sideways_use_ema': True, 'sideways_use_atr': True, 'sideways_use_adx': True, 'sideways_use_spike': True, 'sideways_rsi_required': False}.
[I 2025-08-31 12:15:18,666] Trial 174 finished with values: [-1000000000.0, 1000000000.0] and parameters: {'p_sma': 9, 'p_std': 11, 'p_atr': 22, 'p_adx': 14, 'rsi_period': 40, 'ema1': 5, 'ema2': 37, 'slip_atr_k': 0.09829163904294393, 'slip_spread_k': 0.7032683810577515, 'spread_hl_frac': 0.027737330024112352, 'bb_std_mult': 1.1882991884422127, 'rsi_os': 45, 'rsi_ob': 92, 'vol_spike': 0.11374820203433283, 'adx_thresh': 19.79072134021637, 'atr_min_pct': 0.026555942109511906, 'atr_max_pct': 0.07173927787581377, 'tp_mult': 2.589847387237473, 'tsl_mult': 0.9262317363857384, 'strategy': 'mean_reversion', 'time_stop': 258, 'use_sma': False, 'use_atr': True, 'use_adx': True, 'use_ema': True, 'use_spike': True, 'rsi_required': False, 'edge_k': 0.5505328948986709, 'edge_cap': 0.12466348100881641, 'bull_strategy': 'mean_reversion', 'bull_bb_std_mult': 2.078391473247834, 'bull_rsi_os': 48, 'bull_rsi_ob': 57, 'bull_adx_thresh': 5.582842741357167, 'bull_atr_min_pct': 0.028379338934587984, 'bull_atr_max_pct': 0.06123763402670804, 'bull_tp_mult': 2.690448181157111, 'bull_tsl_mult': 0.30491117929924755, 'bull_time_stop': 61, 'bull_use_sma': False, 'bull_use_ema': False, 'bull_use_atr': False, 'bull_use_adx': False, 'bull_use_spike': True, 'bull_rsi_required': False, 'bear_strategy': 'mean_reversion', 'bear_bb_std_mult': 1.743061078071597, 'bear_rsi_os': 22, 'bear_rsi_ob': 62, 'bear_adx_thresh': 21.422423496644704, 'bear_atr_min_pct': 0.021945591577166693, 'bear_atr_max_pct': 0.1386895193028276, 'bear_tp_mult': 1.6803749453843912, 'bear_tsl_mult': 0.36028634830749456, 'bear_time_stop': 211, 'bear_use_sma': False, 'bear_use_ema': False, 'bear_use_atr': False, 'bear_use_adx': False, 'bear_use_spike': False, 'bear_rsi_required': True, 'sideways_strategy': 'breakout', 'sideways_bb_std_mult': 1.9882227187031307, 'sideways_rsi_os': 34, 'sideways_rsi_ob': 71, 'sideways_adx_thresh': 9.132672139325942, 'sideways_atr_min_pct': 0.027222746133196838, 'sideways_atr_max_pct': 0.0691020429678144, 'sideways_tp_mult': 1.0195748964802092, 'sideways_tsl_mult': 0.8367263495099628, 'sideways_time_stop': 183, 'sideways_use_sma': False, 'sideways_use_ema': True, 'sideways_use_atr': True, 'sideways_use_adx': True, 'sideways_use_spike': True, 'sideways_rsi_required': False}.
[I 2025-08-31 12:15:19,093] Trial 180 finished with values: [-1000000000.0, 1000000000.0] and parameters: {'p_sma': 35, 'p_std': 53, 'p_atr': 18, 'p_adx': 22, 'rsi_period': 47, 'ema1': 17, 'ema2': 40, 'slip_atr_k': 0.2437191639871521, 'slip_spread_k': 0.06931819078611338, 'spread_hl_frac': 0.012410036859277516, 'bb_std_mult': 3.208349437335564, 'rsi_os': 42, 'rsi_ob': 63, 'vol_spike': 0.20266847391345644, 'adx_thresh': 21.12139544712059, 'atr_min_pct': 0.028676885416100868, 'atr_max_pct': 0.011942013382066297, 'tp_mult': 1.542100147652394, 'tsl_mult': 0.485288536804986, 'strategy': 'breakout', 'time_stop': 96, 'use_sma': True, 'use_atr': False, 'use_adx': True, 'use_ema': False, 'use_spike': False, 'rsi_required': False, 'edge_k': 1.2911228464318458, 'edge_cap': 0.2498823133744495, 'bull_strategy': 'mean_reversion', 'bull_bb_std_mult': 1.918111515305689, 'bull_rsi_os': 11, 'bull_rsi_ob': 65, 'bull_adx_thresh': 7.410289068373889, 'bull_atr_min_pct': 0.029534035277274356, 'bull_atr_max_pct': 0.013803912228613019, 'bull_tp_mult': 1.3076051076111987, 'bull_tsl_mult': 0.3390867009815204, 'bull_time_stop': 86, 'bull_use_sma': False, 'bull_use_ema': True, 'bull_use_atr': False, 'bull_use_adx': True, 'bull_use_spike': False, 'bull_rsi_required': True, 'bear_strategy': 'breakout', 'bear_bb_std_mult': 1.6715608958460075, 'bear_rsi_os': 34, 'bear_rsi_ob': 84, 'bear_adx_thresh': 32.78923567363124, 'bear_atr_min_pct': 0.02922483072279087, 'bear_atr_max_pct': 0.05137874090039274, 'bear_tp_mult': 2.0171907027956553, 'bear_tsl_mult': 0.2749895417891859, 'bear_time_stop': 285, 'bear_use_sma': True, 'bear_use_ema': False, 'bear_use_atr': True, 'bear_use_adx': True, 'bear_use_spike': True, 'bear_rsi_required': False, 'sideways_strategy': 'mean_reversion', 'sideways_bb_std_mult': 1.8934390700317276, 'sideways_rsi_os': 33, 'sideways_rsi_ob': 61, 'sideways_adx_thresh': 7.614490471890219, 'sideways_atr_min_pct': 0.001945757736913872, 'sideways_atr_max_pct': 0.07284846656868256, 'sideways_tp_mult': 1.366777567919897, 'sideways_tsl_mult': 0.38585457391441946, 'sideways_time_stop': 16, 'sideways_use_sma': False, 'sideways_use_ema': True, 'sideways_use_atr': False, 'sideways_use_adx': False, 'sideways_use_spike': False, 'sideways_rsi_required': True}.
[I 2025-08-31 12:15:53,619] Trial 177 finished with values: [-0.017668031320242306, 0.017576527165984616] and parameters: {'p_sma': 35, 'p_std': 11, 'p_atr': 29, 'p_adx': 14, 'rsi_period': 49, 'ema1': 5, 'ema2': 37, 'slip_atr_k': 0.1621313515104708, 'slip_spread_k': 0.976966562183216, 'spread_hl_frac': 0.04359540469891854, 'bb_std_mult': 0.9901345067850473, 'rsi_os': 42, 'rsi_ob': 61, 'vol_spike': 0.2703639642279307, 'adx_thresh': 22.88209452636026, 'atr_min_pct': 0.0019211988829586878, 'atr_max_pct': 0.07293155197551668, 'tp_mult': 2.561708128334845, 'tsl_mult': 0.9397394234166316, 'strategy': 'breakout', 'time_stop': 74, 'use_sma': True, 'use_atr': False, 'use_adx': True, 'use_ema': False, 'use_spike': True, 'rsi_required': False, 'edge_k': 1.162382985099506, 'edge_cap': 0.15627335879086335, 'bull_strategy': 'mean_reversion', 'bull_bb_std_mult': 1.7593290678535785, 'bull_rsi_os': 49, 'bull_rsi_ob': 65, 'bull_adx_thresh': 9.322546772577457, 'bull_atr_min_pct': 0.029747575105283173, 'bull_atr_max_pct': 0.020544200311038187, 'bull_tp_mult': 1.0669116255860436, 'bull_tsl_mult': 0.3088898003283935, 'bull_time_stop': 38, 'bull_use_sma': False, 'bull_use_ema': False, 'bull_use_atr': False, 'bull_use_adx': True, 'bull_use_spike': False, 'bull_rsi_required': True, 'bear_strategy': 'mean_reversion', 'bear_bb_std_mult': 1.739931444192451, 'bear_rsi_os': 34, 'bear_rsi_ob': 64, 'bear_adx_thresh': 21.214804910726123, 'bear_atr_min_pct': 0.027499335561424164, 'bear_atr_max_pct': 0.1384725258351281, 'bear_tp_mult': 1.5171690069772612, 'bear_tsl_mult': 0.3692806582599136, 'bear_time_stop': 283, 'bear_use_sma': False, 'bear_use_ema': False, 'bear_use_atr': False, 'bear_use_adx': False, 'bear_use_spike': True, 'bear_rsi_required': False, 'sideways_strategy': 'breakout', 'sideways_bb_std_mult': 1.9830310237533961, 'sideways_rsi_os': 33, 'sideways_rsi_ob': 72, 'sideways_adx_thresh': 9.054150076914585, 'sideways_atr_min_pct': 0.0019541518453120954, 'sideways_atr_max_pct': 0.12184270710477266, 'sideways_tp_mult': 1.4097800160806033, 'sideways_tsl_mult': 0.6781646829140697, 'sideways_time_stop': 189, 'sideways_use_sma': False, 'sideways_use_ema': True, 'sideways_use_atr': True, 'sideways_use_adx': False, 'sideways_use_spike': False, 'sideways_rsi_required': True}.
[I 2025-08-31 12:15:53,857] Trial 178 finished with values: [-0.029460637433595505, 0.029336872894138454] and parameters: {'p_sma': 10, 'p_std': 36, 'p_atr': 27, 'p_adx': 15, 'rsi_period': 39, 'ema1': 19, 'ema2': 46, 'slip_atr_k': 0.09002854913706536, 'slip_spread_k': 0.9679121587053037, 'spread_hl_frac': 0.012314498280248835, 'bb_std_mult': 0.9936536644190174, 'rsi_os': 45, 'rsi_ob': 63, 'vol_spike': 0.20170363245997647, 'adx_thresh': 6.4347600110615435, 'atr_min_pct': 0.028701794767432707, 'atr_max_pct': 0.09068786321881031, 'tp_mult': 2.5107796982831716, 'tsl_mult': 0.48047027291115507, 'strategy': 'breakout', 'time_stop': 97, 'use_sma': True, 'use_atr': False, 'use_adx': True, 'use_ema': False, 'use_spike': False, 'rsi_required': False, 'edge_k': 1.683692138619357, 'edge_cap': 0.9082290717531708, 'bull_strategy': 'mean_reversion', 'bull_bb_std_mult': 2.129912771542896, 'bull_rsi_os': 48, 'bull_rsi_ob': 65, 'bull_adx_thresh': 25.559931888787183, 'bull_atr_min_pct': 0.006731057013199553, 'bull_atr_max_pct': 0.06473766117958746, 'bull_tp_mult': 1.2342246686879985, 'bull_tsl_mult': 0.2377818958420238, 'bull_time_stop': 59, 'bull_use_sma': False, 'bull_use_ema': False, 'bull_use_atr': False, 'bull_use_adx': True, 'bull_use_spike': False, 'bull_rsi_required': True, 'bear_strategy': 'mean_reversion', 'bear_bb_std_mult': 1.7326158360725903, 'bear_rsi_os': 23, 'bear_rsi_ob': 59, 'bear_adx_thresh': 15.693758021420987, 'bear_atr_min_pct': 0.02931061015558766, 'bear_atr_max_pct': 0.02106703578676697, 'bear_tp_mult': 1.5232004675761448, 'bear_tsl_mult': 0.0840416337969878, 'bear_time_stop': 285, 'bear_use_sma': False, 'bear_use_ema': False, 'bear_use_atr': True, 'bear_use_adx': False, 'bear_use_spike': True, 'bear_rsi_required': False, 'sideways_strategy': 'mean_reversion', 'sideways_bb_std_mult': 2.017125739047032, 'sideways_rsi_os': 33, 'sideways_rsi_ob': 49, 'sideways_adx_thresh': 8.723571627598727, 'sideways_atr_min_pct': 0.0014696854149771309, 'sideways_atr_max_pct': 0.07142475816594922, 'sideways_tp_mult': 1.4291080299761785, 'sideways_tsl_mult': 0.39098483887702623, 'sideways_time_stop': 75, 'sideways_use_sma': False, 'sideways_use_ema': True, 'sideways_use_atr': True, 'sideways_use_adx': False, 'sideways_use_spike': False, 'sideways_rsi_required': True}.
