[I 2025-08-31 13:47:31,040] Trial 866 finished with values: [-1000000000.0, 1000000000.0] and parameters: {'p_sma': 31, 'p_std': 24, 'p_atr': 14, 'p_adx': 14, 'rsi_period': 53, 'ema1': 11, 'ema2': 54, 'slip_atr_k': 0.14119147835205245, 'slip_spread_k': 0.42847644692568243, 'spread_hl_frac': 0.016511227577871466, 'bb_std_mult': 1.9940073312709778, 'rsi_os': 9, 'rsi_ob': 89, 'vol_spike': 0.24981056018762154, 'adx_thresh': 7.496756944707436, 'atr_min_pct': 0.026568933915495602, 'atr_max_pct': 0.0172093290260161, 'tp_mult': 2.038108548784725, 'tsl_mult': 0.9264256746794026, 'strategy': 'breakout', 'time_stop': 181, 'use_sma': True, 'use_atr': False, 'use_adx': True, 'use_ema': False, 'use_spike': True, 'rsi_required': False, 'edge_k': 0.2202549994174079, 'edge_cap': 0.975306866490355, 'bull_strategy': 'mean_reversion', 'bull_bb_std_mult': 3.012661625459946, 'bull_rsi_os': 49, 'bull_rsi_ob': 57, 'bull_adx_thresh': 10.745279553957882, 'bull_atr_min_pct': 0.01527445873885481, 'bull_atr_max_pct': 0.05705181576183557, 'bull_tp_mult': 2.3250912068685707, 'bull_tsl_mult': 0.9319279499110742, 'bull_time_stop': 152, 'bull_use_sma': True, 'bull_use_ema': True, 'bull_use_atr': True, 'bull_use_adx': True, 'bull_use_spike': True, 'bull_rsi_required': True, 'bear_strategy': 'breakout', 'bear_bb_std_mult': 3.597152042632188, 'bear_rsi_os': 32, 'bear_rsi_ob': 71, 'bear_adx_thresh': 18.861238568131515, 'bear_atr_min_pct': 0.010764450627123577, 'bear_atr_max_pct': 0.01857422624554135, 'bear_tp_mult': 1.0508576151281537, 'bear_tsl_mult': 0.6418985605704071, 'bear_time_stop': 190, 'bear_use_sma': False, 'bear_use_ema': True, 'bear_use_atr': False, 'bear_use_adx': False, 'bear_use_spike': False, 'bear_rsi_required': True, 'sideways_strategy': 'mean_reversion', 'sideways_bb_std_mult': 2.7445698614857514, 'sideways_rsi_os': 51, 'sideways_rsi_ob': 64, 'sideways_adx_thresh': 22.646993113599162, 'sideways_atr_min_pct': 0.018469589067308015, 'sideways_atr_max_pct': 0.1499988659272042, 'sideways_tp_mult': 2.204787125894249, 'sideways_tsl_mult': 0.7045132502850895, 'sideways_time_stop': 34, 'sideways_use_sma': False, 'sideways_use_ema': True, 'sideways_use_atr': True, 'sideways_use_adx': True, 'sideways_use_spike': False, 'sideways_rsi_required': True}.
[I 2025-08-31 13:48:02,927] Trial 867 finished with values: [-1000000000.0, 1000000000.0] and parameters: {'p_sma': 26, 'p_std': 24, 'p_atr': 26, 'p_adx': 14, 'rsi_period': 51, 'ema1': 12, 'ema2': 32, 'slip_atr_k': 0.14358888617920654, 'slip_spread_k': 0.4285771809669826, 'spread_hl_frac': 0.02228584186769601, 'bb_std_mult': 2.1837250970954463, 'rsi_os': 39, 'rsi_ob': 91, 'vol_spike': 0.027128535119477243, 'adx_thresh': 16.212556115271347, 'atr_min_pct': 0.024396801886973737, 'atr_max_pct': 0.06914481705594834, 'tp_mult': 2.512784708260938, 'tsl_mult': 0.973525854866097, 'strategy': 'breakout', 'time_stop': 179, 'use_sma': True, 'use_atr': False, 'use_adx': True, 'use_ema': False, 'use_spike': True, 'rsi_required': False, 'edge_k': 1.277865129818279, 'edge_cap': 0.6996699221141096, 'bull_strategy': 'mean_reversion', 'bull_bb_std_mult': 2.8576666373700834, 'bull_rsi_os': 5, 'bull_rsi_ob': 86, 'bull_adx_thresh': 6.94388558038019, 'bull_atr_min_pct': 0.022544236366151646, 'bull_atr_max_pct': 0.08378975433264749, 'bull_tp_mult': 2.1517740739094293, 'bull_tsl_mult': 0.44008549994266993, 'bull_time_stop': 153, 'bull_use_sma': True, 'bull_use_ema': True, 'bull_use_atr': True, 'bull_use_adx': True, 'bull_use_spike': True, 'bull_rsi_required': True, 'bear_strategy': 'breakout', 'bear_bb_std_mult': 3.521525706077118, 'bear_rsi_os': 13, 'bear_rsi_ob': 71, 'bear_adx_thresh': 19.202371857391324, 'bear_atr_min_pct': 0.001041072312770614, 'bear_atr_max_pct': 0.12537287563735436, 'bear_tp_mult': 1.174540169854203, 'bear_tsl_mult': 0.6384598216056747, 'bear_time_stop': 196, 'bear_use_sma': False, 'bear_use_ema': True, 'bear_use_atr': False, 'bear_use_adx': False, 'bear_use_spike': False, 'bear_rsi_required': True, 'sideways_strategy': 'mean_reversion', 'sideways_bb_std_mult': 2.74834784863916, 'sideways_rsi_os': 32, 'sideways_rsi_ob': 64, 'sideways_adx_thresh': 13.906860774034646, 'sideways_atr_min_pct': 0.029164381718476434, 'sideways_atr_max_pct': 0.04072600877066454, 'sideways_tp_mult': 1.6293326786479319, 'sideways_tsl_mult': 0.8443136043849385, 'sideways_time_stop': 33, 'sideways_use_sma': False, 'sideways_use_ema': True, 'sideways_use_atr': True, 'sideways_use_adx': True, 'sideways_use_spike': False, 'sideways_rsi_required': True}.
[I 2025-08-31 13:48:03,432] Trial 865 finished with values: [-1000000000.0, 1000000000.0] and parameters: {'p_sma': 37, 'p_std': 20, 'p_atr': 15, 'p_adx': 15, 'rsi_period': 65, 'ema1': 29, 'ema2': 36, 'slip_atr_k': 0.11379710515366909, 'slip_spread_k': 0.42987638446969434, 'spread_hl_frac': 0.016629098822545377, 'bb_std_mult': 2.7505919508680017, 'rsi_os': 39, 'rsi_ob': 91, 'vol_spike': 0.0130049585442836, 'adx_thresh': 6.302225374117282, 'atr_min_pct': 0.02651981536209707, 'atr_max_pct': 0.039293742983114416, 'tp_mult': 2.6111269383007505, 'tsl_mult': 0.7902924368532024, 'strategy': 'breakout', 'time_stop': 45, 'use_sma': False, 'use_atr': False, 'use_adx': True, 'use_ema': False, 'use_spike': True, 'rsi_required': False, 'edge_k': 1.2861256240096293, 'edge_cap': 0.657367751879301, 'bull_strategy': 'mean_reversion', 'bull_bb_std_mult': 2.004136350989198, 'bull_rsi_os': 49, 'bull_rsi_ob': 74, 'bull_adx_thresh': 18.981665513511327, 'bull_atr_min_pct': 0.022833661349153263, 'bull_atr_max_pct': 0.0698767090024059, 'bull_tp_mult': 2.170288492679942, 'bull_tsl_mult': 0.2696817226214338, 'bull_time_stop': 170, 'bull_use_sma': True, 'bull_use_ema': True, 'bull_use_atr': True, 'bull_use_adx': True, 'bull_use_spike': True, 'bull_rsi_required': True, 'bear_strategy': 'breakout', 'bear_bb_std_mult': 3.5956879535904855, 'bear_rsi_os': 32, 'bear_rsi_ob': 70, 'bear_adx_thresh': 19.02748886299636, 'bear_atr_min_pct': 0.014612359755959689, 'bear_atr_max_pct': 0.13130835792004417, 'bear_tp_mult': 1.7117037318353432, 'bear_tsl_mult': 0.6442211672445626, 'bear_time_stop': 191, 'bear_use_sma': False, 'bear_use_ema': True, 'bear_use_atr': False, 'bear_use_adx': False, 'bear_use_spike': False, 'bear_rsi_required': True, 'sideways_strategy': 'mean_reversion', 'sideways_bb_std_mult': 2.7696853121201923, 'sideways_rsi_os': 29, 'sideways_rsi_ob': 86, 'sideways_adx_thresh': 15.785126692047069, 'sideways_atr_min_pct': 0.003888482826563769, 'sideways_atr_max_pct': 0.14998896170861636, 'sideways_tp_mult': 1.0130565326291237, 'sideways_tsl_mult': 0.7139855021843554, 'sideways_time_stop': 170, 'sideways_use_sma': False, 'sideways_use_ema': True, 'sideways_use_atr': True, 'sideways_use_adx': True, 'sideways_use_spike': False, 'sideways_rsi_required': True}.
[I 2025-08-31 13:48:03,561] Trial 864 finished with values: [-1000000000.0, 1000000000.0] and parameters: {'p_sma': 37, 'p_std': 20, 'p_atr': 14, 'p_adx': 23, 'rsi_period': 53, 'ema1': 12, 'ema2': 19, 'slip_atr_k': 0.1739943279671891, 'slip_spread_k': 0.42942950304018285, 'spread_hl_frac': 0.016690623932065808, 'bb_std_mult': 1.9644892325576764, 'rsi_os': 50, 'rsi_ob': 57, 'vol_spike': 0.014087502220285469, 'adx_thresh': 29.503824188123794, 'atr_min_pct': 0.02766161969504255, 'atr_max_pct': 0.06886455470003437, 'tp_mult': 2.5766022424112385, 'tsl_mult': 0.2211332874351996, 'strategy': 'breakout', 'time_stop': 42, 'use_sma': False, 'use_atr': False, 'use_adx': True, 'use_ema': False, 'use_spike': True, 'rsi_required': False, 'edge_k': 1.6462093695974733, 'edge_cap': 0.6540346471200374, 'bull_strategy': 'mean_reversion', 'bull_bb_std_mult': 3.0061201721983477, 'bull_rsi_os': 49, 'bull_rsi_ob': 84, 'bull_adx_thresh': 18.89714827880065, 'bull_atr_min_pct': 0.007026226437028681, 'bull_atr_max_pct': 0.06938269437592127, 'bull_tp_mult': 1.4746338428549364, 'bull_tsl_mult': 0.266282341457338, 'bull_time_stop': 177, 'bull_use_sma': True, 'bull_use_ema': True, 'bull_use_atr': True, 'bull_use_adx': True, 'bull_use_spike': True, 'bull_rsi_required': True, 'bear_strategy': 'breakout', 'bear_bb_std_mult': 2.788729033434664, 'bear_rsi_os': 10, 'bear_rsi_ob': 70, 'bear_adx_thresh': 18.507436659779113, 'bear_atr_min_pct': 0.01053850418590976, 'bear_atr_max_pct': 0.12506949430918304, 'bear_tp_mult': 1.1713722670739606, 'bear_tsl_mult': 0.6360341064944828, 'bear_time_stop': 126, 'bear_use_sma': False, 'bear_use_ema': True, 'bear_use_atr': False, 'bear_use_adx': False, 'bear_use_spike': False, 'bear_rsi_required': True, 'sideways_strategy': 'mean_reversion', 'sideways_bb_std_mult': 2.755366246937764, 'sideways_rsi_os': 24, 'sideways_rsi_ob': 78, 'sideways_adx_thresh': 23.308500199922285, 'sideways_atr_min_pct': 0.01854283104432168, 'sideways_atr_max_pct': 0.14746800259070483, 'sideways_tp_mult': 1.7509118475075283, 'sideways_tsl_mult': 0.7218464925257653, 'sideways_time_stop': 42, 'sideways_use_sma': False, 'sideways_use_ema': True, 'sideways_use_atr': True, 'sideways_use_adx': True, 'sideways_use_spike': False, 'sideways_rsi_required': True}.
[I 2025-08-31 13:48:04,711] Trial 868 finished with values: [-0.03930067261904113, 0.03882391589589992] and parameters: {'p_sma': 26, 'p_std': 22, 'p_atr': 15, 'p_adx': 8, 'rsi_period': 22, 'ema1': 18, 'ema2': 55, 'slip_atr_k': 0.004661843318785469, 'slip_spread_k': 0.5202568190160244, 'spread_hl_frac': 0.022177077856473385, 'bb_std_mult': 2.740018921239405, 'rsi_os': 39, 'rsi_ob': 61, 'vol_spike': 0.02564565199767396, 'adx_thresh': 27.942048801238975, 'atr_min_pct': 0.02779566473784001, 'atr_max_pct': 0.09768052466611835, 'tp_mult': 1.8224550475782577, 'tsl_mult': 0.7899813148860484, 'strategy': 'breakout', 'time_stop': 46, 'use_sma': False, 'use_atr': False, 'use_adx': True, 'use_ema': False, 'use_spike': True, 'rsi_required': False, 'edge_k': 0.5999241782537436, 'edge_cap': 0.3681759974469102, 'bull_strategy': 'mean_reversion', 'bull_bb_std_mult': 2.8332757109053492, 'bull_rsi_os': 5, 'bull_rsi_ob': 86, 'bull_adx_thresh': 19.839005775219512, 'bull_atr_min_pct': 0.022491266220052104, 'bull_atr_max_pct': 0.08363780958852532, 'bull_tp_mult': 2.17463976304794, 'bull_tsl_mult': 0.7382908715722444, 'bull_time_stop': 27, 'bull_use_sma': True, 'bull_use_ema': True, 'bull_use_atr': True, 'bull_use_adx': True, 'bull_use_spike': True, 'bull_rsi_required': True, 'bear_strategy': 'breakout', 'bear_bb_std_mult': 3.538780384554683, 'bear_rsi_os': 28, 'bear_rsi_ob': 74, 'bear_adx_thresh': 18.581433926505085, 'bear_atr_min_pct': 0.0010451763655761183, 'bear_atr_max_pct': 0.12543909091903271, 'bear_tp_mult': 1.1672017374055088, 'bear_tsl_mult': 0.6946009490327539, 'bear_time_stop': 54, 'bear_use_sma': False, 'bear_use_ema': True, 'bear_use_atr': False, 'bear_use_adx': False, 'bear_use_spike': True, 'bear_rsi_required': True, 'sideways_strategy': 'breakout', 'sideways_bb_std_mult': 2.57427447076091, 'sideways_rsi_os': 32, 'sideways_rsi_ob': 69, 'sideways_adx_thresh': 13.803478522142552, 'sideways_atr_min_pct': 0.003804035826221289, 'sideways_atr_max_pct': 0.04445840704971155, 'sideways_tp_mult': 1.7654180155242827, 'sideways_tsl_mult': 0.92831486282323, 'sideways_time_stop': 279, 'sideways_use_sma': False, 'sideways_use_ema': False, 'sideways_use_atr': True, 'sideways_use_adx': True, 'sideways_use_spike': False, 'sideways_rsi_required': True}.
[I 2025-08-31 13:48:38,172] Trial 872 finished with values: [-1000000000.0, 1000000000.0] and parameters: {'p_sma': 57, 'p_std': 52, 'p_atr': 27, 'p_adx': 14, 'rsi_period': 50, 'ema1': 14, 'ema2': 29, 'slip_atr_k': 0.15895178809114388, 'slip_spread_k': 0.388412057860232, 'spread_hl_frac': 0.018965198607979388, 'bb_std_mult': 0.9692596393331094, 'rsi_os': 30, 'rsi_ob': 81, 'vol_spike': 0.019978967919378553, 'adx_thresh': 6.13878127749873, 'atr_min_pct': 0.025654610510870843, 'atr_max_pct': 0.054136924762140784, 'tp_mult': 2.187736094534153, 'tsl_mult': 0.6658776854521365, 'strategy': 'breakout', 'time_stop': 170, 'use_sma': False, 'use_atr': False, 'use_adx': True, 'use_ema': True, 'use_spike': True, 'rsi_required': False, 'edge_k': 0.6087993656842133, 'edge_cap': 0.5436161820238101, 'bull_strategy': 'mean_reversion', 'bull_bb_std_mult': 2.7588004420894507, 'bull_rsi_os': 51, 'bull_rsi_ob': 85, 'bull_adx_thresh': 18.123521326601125, 'bull_atr_min_pct': 0.021102430665536215, 'bull_atr_max_pct': 0.0171182072248659, 'bull_tp_mult': 2.296458408629407, 'bull_tsl_mult': 0.8045790767126801, 'bull_time_stop': 39, 'bull_use_sma': True, 'bull_use_ema': True, 'bull_use_atr': True, 'bull_use_adx': True, 'bull_use_spike': True, 'bull_rsi_required': True, 'bear_strategy': 'breakout', 'bear_bb_std_mult': 1.913165669267647, 'bear_rsi_os': 43, 'bear_rsi_ob': 58, 'bear_adx_thresh': 21.453796288639552, 'bear_atr_min_pct': 0.02988236762154302, 'bear_atr_max_pct': 0.03409665700681237, 'bear_tp_mult': 1.055924247652142, 'bear_tsl_mult': 0.7411759893386723, 'bear_time_stop': 211, 'bear_use_sma': False, 'bear_use_ema': True, 'bear_use_atr': False, 'bear_use_adx': False, 'bear_use_spike': True, 'bear_rsi_required': True, 'sideways_strategy': 'breakout', 'sideways_bb_std_mult': 2.622682561256072, 'sideways_rsi_os': 22, 'sideways_rsi_ob': 68, 'sideways_adx_thresh': 32.52159472361819, 'sideways_atr_min_pct': 0.016668539490861046, 'sideways_atr_max_pct': 0.026799385935652044, 'sideways_tp_mult': 2.395640386634863, 'sideways_tsl_mult': 0.05861574224417743, 'sideways_time_stop': 272, 'sideways_use_sma': False, 'sideways_use_ema': False, 'sideways_use_atr': True, 'sideways_use_adx': True, 'sideways_use_spike': False, 'sideways_rsi_required': False}.
[I 2025-08-31 13:48:38,197] Trial 871 finished with values: [-1000000000.0, 1000000000.0] and parameters: {'p_sma': 12, 'p_std': 22, 'p_atr': 22, 'p_adx': 30, 'rsi_period': 12, 'ema1': 18, 'ema2': 21, 'slip_atr_k': 0.008423535842331575, 'slip_spread_k': 0.5071239602599763, 'spread_hl_frac': 0.01894903261505114, 'bb_std_mult': 2.278643243704905, 'rsi_os': 25, 'rsi_ob': 81, 'vol_spike': 0.12150964907730127, 'adx_thresh': 32.953098503006636, 'atr_min_pct': 0.027349496995518755, 'atr_max_pct': 0.057389839933551505, 'tp_mult': 1.8312602054612905, 'tsl_mult': 0.6580537669961734, 'strategy': 'breakout', 'time_stop': 170, 'use_sma': False, 'use_atr': False, 'use_adx': True, 'use_ema': True, 'use_spike': True, 'rsi_required': False, 'edge_k': 0.6095962191483559, 'edge_cap': 0.895195879309153, 'bull_strategy': 'mean_reversion', 'bull_bb_std_mult': 2.4624717300934447, 'bull_rsi_os': 22, 'bull_rsi_ob': 85, 'bull_adx_thresh': 19.59017272999509, 'bull_atr_min_pct': 0.008176800304958348, 'bull_atr_max_pct': 0.14479427465649272, 'bull_tp_mult': 2.9911465802017467, 'bull_tsl_mult': 0.23853548726192075, 'bull_time_stop': 43, 'bull_use_sma': True, 'bull_use_ema': True, 'bull_use_atr': True, 'bull_use_adx': True, 'bull_use_spike': True, 'bull_rsi_required': True, 'bear_strategy': 'breakout', 'bear_bb_std_mult': 3.3780040267079827, 'bear_rsi_os': 12, 'bear_rsi_ob': 74, 'bear_adx_thresh': 16.874293115950714, 'bear_atr_min_pct': 0.0006052068849745465, 'bear_atr_max_pct': 0.13008508976538358, 'bear_tp_mult': 1.3368943292499074, 'bear_tsl_mult': 0.6910572839035367, 'bear_time_stop': 27, 'bear_use_sma': False, 'bear_use_ema': True, 'bear_use_atr': False, 'bear_use_adx': False, 'bear_use_spike': True, 'bear_rsi_required': True, 'sideways_strategy': 'breakout', 'sideways_bb_std_mult': 2.574407488778555, 'sideways_rsi_os': 34, 'sideways_rsi_ob': 66, 'sideways_adx_thresh': 24.580604030061213, 'sideways_atr_min_pct': 0.006975700595312417, 'sideways_atr_max_pct': 0.143205047484336, 'sideways_tp_mult': 1.7032894615390757, 'sideways_tsl_mult': 0.09540337185340114, 'sideways_time_stop': 49, 'sideways_use_sma': False, 'sideways_use_ema': False, 'sideways_use_atr': True, 'sideways_use_adx': True, 'sideways_use_spike': False, 'sideways_rsi_required': False}.
[I 2025-08-31 13:48:38,423] Trial 870 finished with values: [-0.012790202076775281, 0.013243594461969824] and parameters: {'p_sma': 6, 'p_std': 22, 'p_atr': 14, 'p_adx': 26, 'rsi_period': 12, 'ema1': 9, 'ema2': 19, 'slip_atr_k': 0.0034773800838417412, 'slip_spread_k': 0.5150133050580663, 'spread_hl_frac': 0.020326839370185562, 'bb_std_mult': 2.30518532473851, 'rsi_os': 25, 'rsi_ob': 61, 'vol_spike': 0.023283411670395496, 'adx_thresh': 5.069345329949188, 'atr_min_pct': 0.02755038987845513, 'atr_max_pct': 0.09253978520586625, 'tp_mult': 2.4015917573318317, 'tsl_mult': 0.8776759517547928, 'strategy': 'breakout', 'time_stop': 170, 'use_sma': False, 'use_atr': False, 'use_adx': True, 'use_ema': True, 'use_spike': True, 'rsi_required': False, 'edge_k': 0.5991239861046398, 'edge_cap': 0.5301773486377214, 'bull_strategy': 'mean_reversion', 'bull_bb_std_mult': 2.7585645911505745, 'bull_rsi_os': 18, 'bull_rsi_ob': 85, 'bull_adx_thresh': 19.781271018244198, 'bull_atr_min_pct': 0.021156895511197645, 'bull_atr_max_pct': 0.1437270249742301, 'bull_tp_mult': 2.3059914061376454, 'bull_tsl_mult': 0.12290746076782472, 'bull_time_stop': 167, 'bull_use_sma': True, 'bull_use_ema': True, 'bull_use_atr': True, 'bull_use_adx': True, 'bull_use_spike': True, 'bull_rsi_required': True, 'bear_strategy': 'breakout', 'bear_bb_std_mult': 1.0677239132810203, 'bear_rsi_os': 28, 'bear_rsi_ob': 74, 'bear_adx_thresh': 21.156361615464945, 'bear_atr_min_pct': 0.029950256423623797, 'bear_atr_max_pct': 0.0359903006398392, 'bear_tp_mult': 1.0107440796974099, 'bear_tsl_mult': 0.691425351796434, 'bear_time_stop': 26, 'bear_use_sma': False, 'bear_use_ema': True, 'bear_use_atr': False, 'bear_use_adx': False, 'bear_use_spike': True, 'bear_rsi_required': True, 'sideways_strategy': 'breakout', 'sideways_bb_std_mult': 2.583032033945535, 'sideways_rsi_os': 49, 'sideways_rsi_ob': 66, 'sideways_adx_thresh': 24.700775104111187, 'sideways_atr_min_pct': 0.002568439659949977, 'sideways_atr_max_pct': 0.1433605033907472, 'sideways_tp_mult': 2.8040888564108464, 'sideways_tsl_mult': 0.5944722229106907, 'sideways_time_stop': 259, 'sideways_use_sma': False, 'sideways_use_ema': False, 'sideways_use_atr': True, 'sideways_use_adx': True, 'sideways_use_spike': False, 'sideways_rsi_required': True}.
[I 2025-08-31 13:48:38,508] Trial 869 finished with values: [-1000000000.0, 1000000000.0] and parameters: {'p_sma': 13, 'p_std': 52, 'p_atr': 30, 'p_adx': 26, 'rsi_period': 47, 'ema1': 18, 'ema2': 44, 'slip_atr_k': 0.17349536083610348, 'slip_spread_k': 0.38768700080254476, 'spread_hl_frac': 0.020524184404811727, 'bb_std_mult': 2.3032041360720803, 'rsi_os': 50, 'rsi_ob': 92, 'vol_spike': 0.02477700682087921, 'adx_thresh': 5.880046871660268, 'atr_min_pct': 0.027610935064593566, 'atr_max_pct': 0.09202485474117705, 'tp_mult': 2.198883451229314, 'tsl_mult': 0.6598251501527548, 'strategy': 'breakout', 'time_stop': 171, 'use_sma': False, 'use_atr': False, 'use_adx': True, 'use_ema': True, 'use_spike': True, 'rsi_required': False, 'edge_k': 0.5945635351781322, 'edge_cap': 0.5401991031008607, 'bull_strategy': 'mean_reversion', 'bull_bb_std_mult': 2.4617590836806382, 'bull_rsi_os': 5, 'bull_rsi_ob': 85, 'bull_adx_thresh': 19.46403689914894, 'bull_atr_min_pct': 0.021232784552275775, 'bull_atr_max_pct': 0.14443898012492173, 'bull_tp_mult': 2.296769361466606, 'bull_tsl_mult': 0.26192467162268385, 'bull_time_stop': 170, 'bull_use_sma': True, 'bull_use_ema': True, 'bull_use_atr': True, 'bull_use_adx': True, 'bull_use_spike': True, 'bull_rsi_required': True, 'bear_strategy': 'breakout', 'bear_bb_std_mult': 3.4537540864690737, 'bear_rsi_os': 45, 'bear_rsi_ob': 74, 'bear_adx_thresh': 18.458920826317637, 'bear_atr_min_pct': 0.005959950361912696, 'bear_atr_max_pct': 0.12329665916962489, 'bear_tp_mult': 1.1856167725596019, 'bear_tsl_mult': 0.6896760712852275, 'bear_time_stop': 209, 'bear_use_sma': False, 'bear_use_ema': True, 'bear_use_atr': False, 'bear_use_adx': False, 'bear_use_spike': True, 'bear_rsi_required': True, 'sideways_strategy': 'breakout', 'sideways_bb_std_mult': 0.9152449061616748, 'sideways_rsi_os': 34, 'sideways_rsi_ob': 66, 'sideways_adx_thresh': 25.12922976681664, 'sideways_atr_min_pct': 0.003942575786520378, 'sideways_atr_max_pct': 0.03518171605867136, 'sideways_tp_mult': 1.7693954469932522, 'sideways_tsl_mult': 0.8487928534568172, 'sideways_time_stop': 47, 'sideways_use_sma': False, 'sideways_use_ema': False, 'sideways_use_atr': True, 'sideways_use_adx': True, 'sideways_use_spike': False, 'sideways_rsi_required': True}.
