[I 2025-08-31 12:56:46,277] Trial 497 finished with values: [-1000000000.0, 1000000000.0] and parameters: {'p_sma': 53, 'p_std': 59, 'p_atr': 14, 'p_adx': 15, 'rsi_period': 37, 'ema1': 21, 'ema2': 59, 'slip_atr_k': 0.06522240378102086, 'slip_spread_k': 0.3438377007815413, 'spread_hl_frac': 0.01324030275660314, 'bb_std_mult': 2.4932422869538216, 'rsi_os': 40, 'rsi_ob': 69, 'vol_spike': 0.21941893285026215, 'adx_thresh': 20.30463927000549, 'atr_min_pct': 0.023001191476053007, 'atr_max_pct': 0.12493240042526739, 'tp_mult': 2.8677612570327855, 'tsl_mult': 0.048201025870182754, 'strategy': 'breakout', 'time_stop': 188, 'use_sma': False, 'use_atr': False, 'use_adx': False, 'use_ema': True, 'use_spike': True, 'rsi_required': False, 'edge_k': 0.626812514130159, 'edge_cap': 0.7281823490219058, 'bull_strategy': 'breakout', 'bull_bb_std_mult': 1.8983693996044295, 'bull_rsi_os': 47, 'bull_rsi_ob': 48, 'bull_adx_thresh': 29.099433787052263, 'bull_atr_min_pct': 0.016253023997490203, 'bull_atr_max_pct': 0.14195478569880515, 'bull_tp_mult': 2.410072141534575, 'bull_tsl_mult': 0.21437623660837257, 'bull_time_stop': 286, 'bull_use_sma': False, 'bull_use_ema': True, 'bull_use_atr': False, 'bull_use_adx': True, 'bull_use_spike': False, 'bull_rsi_required': False, 'bear_strategy': 'mean_reversion', 'bear_bb_std_mult': 3.150610819517326, 'bear_rsi_os': 29, 'bear_rsi_ob': 68, 'bear_adx_thresh': 13.73846966362509, 'bear_atr_min_pct': 0.0019379839444032165, 'bear_atr_max_pct': 0.13583258442863042, 'bear_tp_mult': 2.5256641705695815, 'bear_tsl_mult': 0.7923242427416741, 'bear_time_stop': 210, 'bear_use_sma': False, 'bear_use_ema': True, 'bear_use_atr': False, 'bear_use_adx': False, 'bear_use_spike': True, 'bear_rsi_required': True, 'sideways_strategy': 'mean_reversion', 'sideways_bb_std_mult': 2.829084205109261, 'sideways_rsi_os': 30, 'sideways_rsi_ob': 52, 'sideways_adx_thresh': 26.540433815134485, 'sideways_atr_min_pct': 0.016437095378219826, 'sideways_atr_max_pct': 0.12625923115708257, 'sideways_tp_mult': 1.658218932931134, 'sideways_tsl_mult': 0.945143727062027, 'sideways_time_stop': 227, 'sideways_use_sma': True, 'sideways_use_ema': False, 'sideways_use_atr': True, 'sideways_use_adx': False, 'sideways_use_spike': False, 'sideways_rsi_required': False}.
[I 2025-08-31 12:56:46,518] Trial 495 finished with values: [-1000000000.0, 1000000000.0] and parameters: {'p_sma': 27, 'p_std': 25, 'p_atr': 14, 'p_adx': 28, 'rsi_period': 39, 'ema1': 21, 'ema2': 18, 'slip_atr_k': 0.0627396984767956, 'slip_spread_k': 0.3380199237121405, 'spread_hl_frac': 0.01710148443303534, 'bb_std_mult': 2.186840284358687, 'rsi_os': 23, 'rsi_ob': 77, 'vol_spike': 0.03931565862787051, 'adx_thresh': 20.207401275787156, 'atr_min_pct': 0.018259741146583547, 'atr_max_pct': 0.12314725872945825, 'tp_mult': 2.663217254324982, 'tsl_mult': 0.0034624596670376484, 'strategy': 'breakout', 'time_stop': 187, 'use_sma': False, 'use_atr': True, 'use_adx': False, 'use_ema': True, 'use_spike': True, 'rsi_required': True, 'edge_k': 0.6393811535405715, 'edge_cap': 0.729596641399661, 'bull_strategy': 'breakout', 'bull_bb_std_mult': 2.691233864743296, 'bull_rsi_os': 44, 'bull_rsi_ob': 63, 'bull_adx_thresh': 24.12847771378263, 'bull_atr_min_pct': 0.017115682068022324, 'bull_atr_max_pct': 0.14737896791787486, 'bull_tp_mult': 1.3300227661445474, 'bull_tsl_mult': 0.21298734951025178, 'bull_time_stop': 288, 'bull_use_sma': True, 'bull_use_ema': True, 'bull_use_atr': False, 'bull_use_adx': False, 'bull_use_spike': False, 'bull_rsi_required': False, 'bear_strategy': 'mean_reversion', 'bear_bb_std_mult': 3.0776205422582965, 'bear_rsi_os': 16, 'bear_rsi_ob': 73, 'bear_adx_thresh': 28.39954881472727, 'bear_atr_min_pct': 0.003111413260386246, 'bear_atr_max_pct': 0.010300010772756649, 'bear_tp_mult': 2.999293656066506, 'bear_tsl_mult': 0.43442351164196646, 'bear_time_stop': 183, 'bear_use_sma': True, 'bear_use_ema': True, 'bear_use_atr': False, 'bear_use_adx': False, 'bear_use_spike': True, 'bear_rsi_required': True, 'sideways_strategy': 'breakout', 'sideways_bb_std_mult': 2.6354163345438657, 'sideways_rsi_os': 20, 'sideways_rsi_ob': 66, 'sideways_adx_thresh': 34.81950343380444, 'sideways_atr_min_pct': 0.016654714334587345, 'sideways_atr_max_pct': 0.13063299440920742, 'sideways_tp_mult': 1.6658456182201342, 'sideways_tsl_mult': 0.3482914178243024, 'sideways_time_stop': 204, 'sideways_use_sma': True, 'sideways_use_ema': False, 'sideways_use_atr': True, 'sideways_use_adx': False, 'sideways_use_spike': True, 'sideways_rsi_required': True}.
[I 2025-08-31 12:56:46,692] Trial 496 finished with values: [-1000000000.0, 1000000000.0] and parameters: {'p_sma': 41, 'p_std': 48, 'p_atr': 21, 'p_adx': 15, 'rsi_period': 44, 'ema1': 10, 'ema2': 18, 'slip_atr_k': 0.10745899832511588, 'slip_spread_k': 0.3467689448005524, 'spread_hl_frac': 0.015800542096822547, 'bb_std_mult': 2.5091571563445294, 'rsi_os': 47, 'rsi_ob': 69, 'vol_spike': 0.0344707444948501, 'adx_thresh': 20.320624963831097, 'atr_min_pct': 0.02995561648033508, 'atr_max_pct': 0.12435616763331159, 'tp_mult': 2.859599435811663, 'tsl_mult': 0.0019087633809953958, 'strategy': 'breakout', 'time_stop': 173, 'use_sma': False, 'use_atr': True, 'use_adx': False, 'use_ema': True, 'use_spike': True, 'rsi_required': True, 'edge_k': 0.05061308572487955, 'edge_cap': 0.7345249347263285, 'bull_strategy': 'breakout', 'bull_bb_std_mult': 0.7630134513686093, 'bull_rsi_os': 47, 'bull_rsi_ob': 74, 'bull_adx_thresh': 15.812075264207055, 'bull_atr_min_pct': 0.016093978710784235, 'bull_atr_max_pct': 0.14260642981180574, 'bull_tp_mult': 2.007413478844295, 'bull_tsl_mult': 0.21246836110540343, 'bull_time_stop': 286, 'bull_use_sma': True, 'bull_use_ema': True, 'bull_use_atr': False, 'bull_use_adx': False, 'bull_use_spike': False, 'bull_rsi_required': False, 'bear_strategy': 'mean_reversion', 'bear_bb_std_mult': 3.1497898771665325, 'bear_rsi_os': 29, 'bear_rsi_ob': 69, 'bear_adx_thresh': 13.87524605070022, 'bear_atr_min_pct': 0.024211628092101537, 'bear_atr_max_pct': 0.13636237798102832, 'bear_tp_mult': 2.51926584045955, 'bear_tsl_mult': 0.7359683760650306, 'bear_time_stop': 217, 'bear_use_sma': True, 'bear_use_ema': True, 'bear_use_atr': False, 'bear_use_adx': False, 'bear_use_spike': True, 'bear_rsi_required': True, 'sideways_strategy': 'breakout', 'sideways_bb_std_mult': 2.4508396880384, 'sideways_rsi_os': 30, 'sideways_rsi_ob': 91, 'sideways_adx_thresh': 25.07857747087338, 'sideways_atr_min_pct': 0.016805172362114124, 'sideways_atr_max_pct': 0.12616333491624246, 'sideways_tp_mult': 1.67835888001455, 'sideways_tsl_mult': 0.8797798055705289, 'sideways_time_stop': 20, 'sideways_use_sma': True, 'sideways_use_ema': False, 'sideways_use_atr': True, 'sideways_use_adx': False, 'sideways_use_spike': True, 'sideways_rsi_required': False}.
[I 2025-08-31 12:57:18,836] Trial 498 finished with values: [-1000000000.0, 1000000000.0] and parameters: {'p_sma': 52, 'p_std': 49, 'p_atr': 19, 'p_adx': 15, 'rsi_period': 46, 'ema1': 21, 'ema2': 44, 'slip_atr_k': 0.054840021292633497, 'slip_spread_k': 0.3499828407393543, 'spread_hl_frac': 0.015719345082045123, 'bb_std_mult': 2.5289722731911652, 'rsi_os': 37, 'rsi_ob': 79, 'vol_spike': 0.030339735494862848, 'adx_thresh': 20.199688688705827, 'atr_min_pct': 0.02019069650434511, 'atr_max_pct': 0.12410832588375281, 'tp_mult': 2.665570157285588, 'tsl_mult': 0.05142638149058262, 'strategy': 'breakout', 'time_stop': 171, 'use_sma': False, 'use_atr': False, 'use_adx': False, 'use_ema': True, 'use_spike': True, 'rsi_required': False, 'edge_k': 0.44929795835940334, 'edge_cap': 0.7336938793739415, 'bull_strategy': 'breakout', 'bull_bb_std_mult': 0.7521589193749352, 'bull_rsi_os': 5, 'bull_rsi_ob': 95, 'bull_adx_thresh': 17.859574980127668, 'bull_atr_min_pct': 0.0172462389196502, 'bull_atr_max_pct': 0.03990843715424134, 'bull_tp_mult': 1.2450548729637652, 'bull_tsl_mult': 0.059689045895285064, 'bull_time_stop': 287, 'bull_use_sma': False, 'bull_use_ema': True, 'bull_use_atr': False, 'bull_use_adx': True, 'bull_use_spike': False, 'bull_rsi_required': False, 'bear_strategy': 'mean_reversion', 'bear_bb_std_mult': 3.165431187284488, 'bear_rsi_os': 29, 'bear_rsi_ob': 78, 'bear_adx_thresh': 11.243258201693997, 'bear_atr_min_pct': 0.0020792677628794854, 'bear_atr_max_pct': 0.028398853071699932, 'bear_tp_mult': 1.7001116750205236, 'bear_tsl_mult': 0.736462886798791, 'bear_time_stop': 211, 'bear_use_sma': False, 'bear_use_ema': False, 'bear_use_atr': False, 'bear_use_adx': False, 'bear_use_spike': False, 'bear_rsi_required': True, 'sideways_strategy': 'mean_reversion', 'sideways_bb_std_mult': 2.633045301646395, 'sideways_rsi_os': 20, 'sideways_rsi_ob': 53, 'sideways_adx_thresh': 34.553456938105434, 'sideways_atr_min_pct': 0.017459581735041755, 'sideways_atr_max_pct': 0.12620054540561765, 'sideways_tp_mult': 1.6096472530063386, 'sideways_tsl_mult': 0.22550424369946692, 'sideways_time_stop': 196, 'sideways_use_sma': True, 'sideways_use_ema': False, 'sideways_use_atr': True, 'sideways_use_adx': True, 'sideways_use_spike': False, 'sideways_rsi_required': False}.
[I 2025-08-31 12:57:19,122] Trial 499 finished with values: [-1000000000.0, 1000000000.0] and parameters: {'p_sma': 16, 'p_std': 22, 'p_atr': 10, 'p_adx': 7, 'rsi_period': 44, 'ema1': 21, 'ema2': 33, 'slip_atr_k': 0.054288088475394736, 'slip_spread_k': 0.46982321991299497, 'spread_hl_frac': 0.016102158401548345, 'bb_std_mult': 2.176276233708253, 'rsi_os': 17, 'rsi_ob': 79, 'vol_spike': 0.02699531526796499, 'adx_thresh': 20.08991890336521, 'atr_min_pct': 0.005258793584641253, 'atr_max_pct': 0.11788383707021015, 'tp_mult': 1.5058616059816652, 'tsl_mult': 0.019630876002321627, 'strategy': 'breakout', 'time_stop': 62, 'use_sma': False, 'use_atr': True, 'use_adx': False, 'use_ema': True, 'use_spike': True, 'rsi_required': True, 'edge_k': 1.3131452759283202, 'edge_cap': 0.732016914543532, 'bull_strategy': 'breakout', 'bull_bb_std_mult': 0.8322470737627912, 'bull_rsi_os': 5, 'bull_rsi_ob': 54, 'bull_adx_thresh': 28.142576458200438, 'bull_atr_min_pct': 0.01711583621515773, 'bull_atr_max_pct': 0.04309250788770916, 'bull_tp_mult': 1.251513399250648, 'bull_tsl_mult': 0.06515365468268625, 'bull_time_stop': 201, 'bull_use_sma': True, 'bull_use_ema': False, 'bull_use_atr': False, 'bull_use_adx': False, 'bull_use_spike': False, 'bull_rsi_required': False, 'bear_strategy': 'breakout', 'bear_bb_std_mult': 3.1743767204846356, 'bear_rsi_os': 30, 'bear_rsi_ob': 73, 'bear_adx_thresh': 17.108855148790237, 'bear_atr_min_pct': 0.012605027654827117, 'bear_atr_max_pct': 0.017079224473012244, 'bear_tp_mult': 1.8983864033166808, 'bear_tsl_mult': 0.9148263411061073, 'bear_time_stop': 185, 'bear_use_sma': True, 'bear_use_ema': False, 'bear_use_atr': False, 'bear_use_adx': False, 'bear_use_spike': False, 'bear_rsi_required': True, 'sideways_strategy': 'breakout', 'sideways_bb_std_mult': 2.63609356746632, 'sideways_rsi_os': 13, 'sideways_rsi_ob': 72, 'sideways_adx_thresh': 24.216210394145957, 'sideways_atr_min_pct': 0.024457772648765662, 'sideways_atr_max_pct': 0.1336190201860414, 'sideways_tp_mult': 2.867442170306203, 'sideways_tsl_mult': 0.22423074709056195, 'sideways_time_stop': 195, 'sideways_use_sma': True, 'sideways_use_ema': False, 'sideways_use_atr': True, 'sideways_use_adx': True, 'sideways_use_spike': True, 'sideways_rsi_required': True}.
[I 2025-08-31 12:57:19,484] Trial 501 finished with values: [-1000000000.0, 1000000000.0] and parameters: {'p_sma': 15, 'p_std': 22, 'p_atr': 10, 'p_adx': 29, 'rsi_period': 46, 'ema1': 12, 'ema2': 50, 'slip_atr_k': 0.05439634619320069, 'slip_spread_k': 0.9440984844846441, 'spread_hl_frac': 0.016510129858367032, 'bb_std_mult': 2.304531403078832, 'rsi_os': 29, 'rsi_ob': 79, 'vol_spike': 0.0276335538182001, 'adx_thresh': 28.016618830776665, 'atr_min_pct': 0.024582148442538414, 'atr_max_pct': 0.11692802065177589, 'tp_mult': 2.708986058586666, 'tsl_mult': 0.031147364088455726, 'strategy': 'breakout', 'time_stop': 133, 'use_sma': False, 'use_atr': False, 'use_adx': False, 'use_ema': True, 'use_spike': False, 'rsi_required': False, 'edge_k': 0.13286160307965178, 'edge_cap': 0.7497807002537157, 'bull_strategy': 'mean_reversion', 'bull_bb_std_mult': 2.7822834724588765, 'bull_rsi_os': 32, 'bull_rsi_ob': 95, 'bull_adx_thresh': 17.905761299884436, 'bull_atr_min_pct': 0.020150115862955065, 'bull_atr_max_pct': 0.1454116636041752, 'bull_tp_mult': 1.831236400288169, 'bull_tsl_mult': 0.06852548670422476, 'bull_time_stop': 211, 'bull_use_sma': False, 'bull_use_ema': False, 'bull_use_atr': True, 'bull_use_adx': True, 'bull_use_spike': True, 'bull_rsi_required': True, 'bear_strategy': 'breakout', 'bear_bb_std_mult': 3.2852552788753, 'bear_rsi_os': 31, 'bear_rsi_ob': 48, 'bear_adx_thresh': 11.412918535958525, 'bear_atr_min_pct': 0.0014317540345119147, 'bear_atr_max_pct': 0.04396444407156195, 'bear_tp_mult': 2.9101708868432357, 'bear_tsl_mult': 0.0006945509937759109, 'bear_time_stop': 48, 'bear_use_sma': False, 'bear_use_ema': False, 'bear_use_atr': True, 'bear_use_adx': True, 'bear_use_spike': False, 'bear_rsi_required': True, 'sideways_strategy': 'mean_reversion', 'sideways_bb_std_mult': 2.628828330594791, 'sideways_rsi_os': 31, 'sideways_rsi_ob': 65, 'sideways_adx_thresh': 24.116137414058358, 'sideways_atr_min_pct': 0.0034649859178961647, 'sideways_atr_max_pct': 0.13461635232091365, 'sideways_tp_mult': 1.606003410700412, 'sideways_tsl_mult': 0.8497753480640743, 'sideways_time_stop': 195, 'sideways_use_sma': False, 'sideways_use_ema': True, 'sideways_use_atr': False, 'sideways_use_adx': True, 'sideways_use_spike': False, 'sideways_rsi_required': True}.
[I 2025-08-31 12:57:19,747] Trial 500 finished with values: [-0.1016771839560201, 0.10108363601516775] and parameters: {'p_sma': 15, 'p_std': 49, 'p_atr': 14, 'p_adx': 7, 'rsi_period': 44, 'ema1': 19, 'ema2': 44, 'slip_atr_k': 0.17314094544815184, 'slip_spread_k': 0.4735497530489808, 'spread_hl_frac': 0.006395333221595467, 'bb_std_mult': 2.3028897001817468, 'rsi_os': 37, 'rsi_ob': 79, 'vol_spike': 0.1404373725671484, 'adx_thresh': 19.14977549726379, 'atr_min_pct': 0.0039038550686862072, 'atr_max_pct': 0.11732248498055164, 'tp_mult': 2.69112478880375, 'tsl_mult': 0.019800634469594656, 'strategy': 'breakout', 'time_stop': 172, 'use_sma': False, 'use_atr': True, 'use_adx': False, 'use_ema': True, 'use_spike': False, 'rsi_required': True, 'edge_k': 0.4152758578353062, 'edge_cap': 0.7454682916631923, 'bull_strategy': 'mean_reversion', 'bull_bb_std_mult': 0.867623302223959, 'bull_rsi_os': 5, 'bull_rsi_ob': 53, 'bull_adx_thresh': 22.658348441928283, 'bull_atr_min_pct': 0.00264572192242302, 'bull_atr_max_pct': 0.14538009416238162, 'bull_tp_mult': 2.307117518166411, 'bull_tsl_mult': 0.24232677407682884, 'bull_time_stop': 283, 'bull_use_sma': False, 'bull_use_ema': False, 'bull_use_atr': True, 'bull_use_adx': True, 'bull_use_spike': False, 'bull_rsi_required': False, 'bear_strategy': 'breakout', 'bear_bb_std_mult': 3.187635669853457, 'bear_rsi_os': 48, 'bear_rsi_ob': 69, 'bear_adx_thresh': 11.152992753291757, 'bear_atr_min_pct': 0.0014856130917608062, 'bear_atr_max_pct': 0.06353706559051656, 'bear_tp_mult': 2.4438025701364494, 'bear_tsl_mult': 0.742011872495919, 'bear_time_stop': 131, 'bear_use_sma': False, 'bear_use_ema': False, 'bear_use_atr': True, 'bear_use_adx': True, 'bear_use_spike': False, 'bear_rsi_required': True, 'sideways_strategy': 'breakout', 'sideways_bb_std_mult': 1.0714530662505406, 'sideways_rsi_os': 31, 'sideways_rsi_ob': 72, 'sideways_adx_thresh': 24.552022789735208, 'sideways_atr_min_pct': 0.024440620841991032, 'sideways_atr_max_pct': 0.13497016358153155, 'sideways_tp_mult': 1.599372458413138, 'sideways_tsl_mult': 0.0490154345524606, 'sideways_time_stop': 195, 'sideways_use_sma': False, 'sideways_use_ema': True, 'sideways_use_atr': False, 'sideways_use_adx': True, 'sideways_use_spike': False, 'sideways_rsi_required': False}.
[I 2025-08-31 12:57:52,607] Trial 505 finished with values: [-1000000000.0, 1000000000.0] and parameters: {'p_sma': 50, 'p_std': 25, 'p_atr': 10, 'p_adx': 14, 'rsi_period': 49, 'ema1': 20, 'ema2': 15, 'slip_atr_k': 0.19953371891953703, 'slip_spread_k': 0.42118843229477837, 'spread_hl_frac': 0.01893458569665513, 'bb_std_mult': 2.400847559036902, 'rsi_os': 14, 'rsi_ob': 77, 'vol_spike': 0.020256991851313955, 'adx_thresh': 31.63217507881915, 'atr_min_pct': 0.025702999658827042, 'atr_max_pct': 0.08872527228232734, 'tp_mult': 2.6074329757219954, 'tsl_mult': 0.06554815827842628, 'strategy': 'breakout', 'time_stop': 162, 'use_sma': True, 'use_atr': True, 'use_adx': True, 'use_ema': True, 'use_spike': False, 'rsi_required': True, 'edge_k': 0.7950251880972524, 'edge_cap': 0.7153839271344951, 'bull_strategy': 'breakout', 'bull_bb_std_mult': 2.77961657624457, 'bull_rsi_os': 40, 'bull_rsi_ob': 50, 'bull_adx_thresh': 13.968557370206234, 'bull_atr_min_pct': 0.011447152233027795, 'bull_atr_max_pct': 0.05151529567970849, 'bull_tp_mult': 1.7023065603833345, 'bull_tsl_mult': 0.9186052743582508, 'bull_time_stop': 294, 'bull_use_sma': True, 'bull_use_ema': True, 'bull_use_atr': False, 'bull_use_adx': True, 'bull_use_spike': True, 'bull_rsi_required': True, 'bear_strategy': 'breakout', 'bear_bb_std_mult': 2.9493833590584564, 'bear_rsi_os': 30, 'bear_rsi_ob': 72, 'bear_adx_thresh': 12.285423268800773, 'bear_atr_min_pct': 2.520312553124654e-06, 'bear_atr_max_pct': 0.14038390371096154, 'bear_tp_mult': 2.8703447587278967, 'bear_tsl_mult': 0.7201465421829932, 'bear_time_stop': 117, 'bear_use_sma': True, 'bear_use_ema': True, 'bear_use_atr': True, 'bear_use_adx': True, 'bear_use_spike': True, 'bear_rsi_required': False, 'sideways_strategy': 'breakout', 'sideways_bb_std_mult': 2.553194646390058, 'sideways_rsi_os': 6, 'sideways_rsi_ob': 56, 'sideways_adx_thresh': 17.590087991383506, 'sideways_atr_min_pct': 0.002679425589743328, 'sideways_atr_max_pct': 0.12881509729768537, 'sideways_tp_mult': 2.768046802562322, 'sideways_tsl_mult': 0.8554225075263125, 'sideways_time_stop': 218, 'sideways_use_sma': True, 'sideways_use_ema': False, 'sideways_use_atr': False, 'sideways_use_adx': False, 'sideways_use_spike': False, 'sideways_rsi_required': True}.
[I 2025-08-31 12:57:52,930] Trial 504 finished with values: [-0.1675194077686778, 0.16694924413523454] and parameters: {'p_sma': 51, 'p_std': 25, 'p_atr': 10, 'p_adx': 14, 'rsi_period': 49, 'ema1': 11, 'ema2': 46, 'slip_atr_k': 0.045233771413075, 'slip_spread_k': 0.3899144612437433, 'spread_hl_frac': 0.018827946122957146, 'bb_std_mult': 2.407953260911524, 'rsi_os': 37, 'rsi_ob': 78, 'vol_spike': 0.019047520913429757, 'adx_thresh': 31.60892028869869, 'atr_min_pct': 0.0018106190488490514, 'atr_max_pct': 0.10994559279841759, 'tp_mult': 2.6177173663071893, 'tsl_mult': 0.8961134466008736, 'strategy': 'breakout', 'time_stop': 181, 'use_sma': True, 'use_atr': True, 'use_adx': True, 'use_ema': True, 'use_spike': False, 'rsi_required': True, 'edge_k': 0.7397292964889317, 'edge_cap': 0.751958829565148, 'bull_strategy': 'mean_reversion', 'bull_bb_std_mult': 2.855128124292148, 'bull_rsi_os': 6, 'bull_rsi_ob': 53, 'bull_adx_thresh': 22.84890466643738, 'bull_atr_min_pct': 0.013963106544283555, 'bull_atr_max_pct': 0.03620269591217479, 'bull_tp_mult': 1.3076657723167568, 'bull_tsl_mult': 0.7100282976231778, 'bull_time_stop': 282, 'bull_use_sma': True, 'bull_use_ema': True, 'bull_use_atr': True, 'bull_use_adx': True, 'bull_use_spike': False, 'bull_rsi_required': False, 'bear_strategy': 'breakout', 'bear_bb_std_mult': 1.304015408237974, 'bear_rsi_os': 48, 'bear_rsi_ob': 76, 'bear_adx_thresh': 8.68800447944707, 'bear_atr_min_pct': 0.0007271074007844599, 'bear_atr_max_pct': 0.048061722530989136, 'bear_tp_mult': 2.861281190463639, 'bear_tsl_mult': 0.7816243407274007, 'bear_time_stop': 82, 'bear_use_sma': True, 'bear_use_ema': True, 'bear_use_atr': True, 'bear_use_adx': True, 'bear_use_spike': True, 'bear_rsi_required': False, 'sideways_strategy': 'breakout', 'sideways_bb_std_mult': 1.0709644446889, 'sideways_rsi_os': 33, 'sideways_rsi_ob': 60, 'sideways_adx_thresh': 26.666202258735357, 'sideways_atr_min_pct': 0.002664363149528074, 'sideways_atr_max_pct': 0.11932459643750028, 'sideways_tp_mult': 1.5644128020312251, 'sideways_tsl_mult': 0.8592700785939108, 'sideways_time_stop': 210, 'sideways_use_sma': False, 'sideways_use_ema': True, 'sideways_use_atr': False, 'sideways_use_adx': False, 'sideways_use_spike': False, 'sideways_rsi_required': True}.
