[I 2025-08-31 12:36:03,204] Trial 344 finished with values: [-1000000000.0, 1000000000.0] and parameters: {'p_sma': 22, 'p_std': 30, 'p_atr': 11, 'p_adx': 25, 'rsi_period': 22, 'ema1': 28, 'ema2': 18, 'slip_atr_k': 0.12151067123754072, 'slip_spread_k': 0.7326127064948784, 'spread_hl_frac': 0.032963369626033995, 'bb_std_mult': 2.970722311461935, 'rsi_os': 14, 'rsi_ob': 48, 'vol_spike': 0.07766005609713532, 'adx_thresh': 14.71846055317079, 'atr_min_pct': 0.0016162779627673194, 'atr_max_pct': 0.13546504470770987, 'tp_mult': 2.6119204020957185, 'tsl_mult': 0.0629696787657737, 'strategy': 'mean_reversion', 'time_stop': 214, 'use_sma': False, 'use_atr': True, 'use_adx': False, 'use_ema': False, 'use_spike': False, 'rsi_required': True, 'edge_k': 0.6164915680728023, 'edge_cap': 0.4518452606319984, 'bull_strategy': 'breakout', 'bull_bb_std_mult': 1.9042356780399194, 'bull_rsi_os': 39, 'bull_rsi_ob': 52, 'bull_adx_thresh': 9.377435689432776, 'bull_atr_min_pct': 0.020283505304566726, 'bull_atr_max_pct': 0.08946203572356909, 'bull_tp_mult': 2.6739978325895137, 'bull_tsl_mult': 0.2446057975340633, 'bull_time_stop': 34, 'bull_use_sma': True, 'bull_use_ema': True, 'bull_use_atr': True, 'bull_use_adx': True, 'bull_use_spike': False, 'bull_rsi_required': False, 'bear_strategy': 'breakout', 'bear_bb_std_mult': 1.9479429869724696, 'bear_rsi_os': 27, 'bear_rsi_ob': 72, 'bear_adx_thresh': 31.185639816773485, 'bear_atr_min_pct': 0.024852519367876375, 'bear_atr_max_pct': 0.11923137337755399, 'bear_tp_mult': 2.793734032367679, 'bear_tsl_mult': 0.6809925393400055, 'bear_time_stop': 217, 'bear_use_sma': True, 'bear_use_ema': True, 'bear_use_atr': True, 'bear_use_adx': True, 'bear_use_spike': True, 'bear_rsi_required': True, 'sideways_strategy': 'breakout', 'sideways_bb_std_mult': 3.4968042433915443, 'sideways_rsi_os': 36, 'sideways_rsi_ob': 83, 'sideways_adx_thresh': 12.27644135139553, 'sideways_atr_min_pct': 0.01982594690929894, 'sideways_atr_max_pct': 0.14982247885335093, 'sideways_tp_mult': 1.469362500632563, 'sideways_tsl_mult': 0.015732662996865487, 'sideways_time_stop': 196, 'sideways_use_sma': True, 'sideways_use_ema': False, 'sideways_use_atr': False, 'sideways_use_adx': False, 'sideways_use_spike': False, 'sideways_rsi_required': True}.
[I 2025-08-31 12:36:31,676] Trial 342 finished with values: [-1000000000.0, 1000000000.0] and parameters: {'p_sma': 52, 'p_std': 31, 'p_atr': 12, 'p_adx': 9, 'rsi_period': 60, 'ema1': 18, 'ema2': 43, 'slip_atr_k': 0.032587530385663095, 'slip_spread_k': 0.970925123676929, 'spread_hl_frac': 0.009055442548301644, 'bb_std_mult': 2.931205906453186, 'rsi_os': 39, 'rsi_ob': 89, 'vol_spike': 0.06941949518594305, 'adx_thresh': 24.229113846979203, 'atr_min_pct': 0.001527212439357424, 'atr_max_pct': 0.1303788850718275, 'tp_mult': 2.82925916329117, 'tsl_mult': 0.03426961873226996, 'strategy': 'breakout', 'time_stop': 223, 'use_sma': False, 'use_atr': True, 'use_adx': False, 'use_ema': False, 'use_spike': False, 'rsi_required': True, 'edge_k': 0.31464295043796064, 'edge_cap': 0.6756229137925608, 'bull_strategy': 'breakout', 'bull_bb_std_mult': 1.4169722960367377, 'bull_rsi_os': 39, 'bull_rsi_ob': 64, 'bull_adx_thresh': 8.567298228739912, 'bull_atr_min_pct': 0.022253613156872576, 'bull_atr_max_pct': 0.07266055175552347, 'bull_tp_mult': 2.584473020507742, 'bull_tsl_mult': 0.2484332302669644, 'bull_time_stop': 242, 'bull_use_sma': True, 'bull_use_ema': True, 'bull_use_atr': True, 'bull_use_adx': True, 'bull_use_spike': True, 'bull_rsi_required': False, 'bear_strategy': 'breakout', 'bear_bb_std_mult': 2.620505719394884, 'bear_rsi_os': 42, 'bear_rsi_ob': 55, 'bear_adx_thresh': 31.288459544866676, 'bear_atr_min_pct': 0.028307682141328578, 'bear_atr_max_pct': 0.09613051999616533, 'bear_tp_mult': 2.880308768706169, 'bear_tsl_mult': 0.19767745355623056, 'bear_time_stop': 249, 'bear_use_sma': True, 'bear_use_ema': True, 'bear_use_atr': True, 'bear_use_adx': True, 'bear_use_spike': False, 'bear_rsi_required': True, 'sideways_strategy': 'breakout', 'sideways_bb_std_mult': 1.5387249745306417, 'sideways_rsi_os': 31, 'sideways_rsi_ob': 65, 'sideways_adx_thresh': 19.45058294700758, 'sideways_atr_min_pct': 0.0003387026559628617, 'sideways_atr_max_pct': 0.04002995258567298, 'sideways_tp_mult': 1.3448805433130941, 'sideways_tsl_mult': 0.2827226173668086, 'sideways_time_stop': 191, 'sideways_use_sma': True, 'sideways_use_ema': False, 'sideways_use_atr': False, 'sideways_use_adx': True, 'sideways_use_spike': False, 'sideways_rsi_required': True}.
[I 2025-08-31 12:36:32,325] Trial 343 finished with values: [-1000000000.0, 1000000000.0] and parameters: {'p_sma': 52, 'p_std': 53, 'p_atr': 12, 'p_adx': 9, 'rsi_period': 60, 'ema1': 6, 'ema2': 43, 'slip_atr_k': 0.031406769645706725, 'slip_spread_k': 0.7331019109467873, 'spread_hl_frac': 0.02995810400610043, 'bb_std_mult': 1.8701295962459616, 'rsi_os': 29, 'rsi_ob': 72, 'vol_spike': 0.17155881171115112, 'adx_thresh': 26.18148296033009, 'atr_min_pct': 0.0016717199027606942, 'atr_max_pct': 0.13381864977366956, 'tp_mult': 2.607921396206425, 'tsl_mult': 0.01962074785878147, 'strategy': 'mean_reversion', 'time_stop': 213, 'use_sma': False, 'use_atr': True, 'use_adx': False, 'use_ema': False, 'use_spike': False, 'rsi_required': True, 'edge_k': 0.3120157738800705, 'edge_cap': 0.6551585758292294, 'bull_strategy': 'breakout', 'bull_bb_std_mult': 2.890423374110708, 'bull_rsi_os': 37, 'bull_rsi_ob': 94, 'bull_adx_thresh': 8.69622530631453, 'bull_atr_min_pct': 0.020280073556790734, 'bull_atr_max_pct': 0.09073061823908225, 'bull_tp_mult': 2.377207556381765, 'bull_tsl_mult': 0.24829067709506789, 'bull_time_stop': 104, 'bull_use_sma': True, 'bull_use_ema': True, 'bull_use_atr': True, 'bull_use_adx': True, 'bull_use_spike': False, 'bull_rsi_required': False, 'bear_strategy': 'breakout', 'bear_bb_std_mult': 1.9484152086952697, 'bear_rsi_os': 8, 'bear_rsi_ob': 55, 'bear_adx_thresh': 31.378961981097447, 'bear_atr_min_pct': 0.02491440753415612, 'bear_atr_max_pct': 0.10085100096226564, 'bear_tp_mult': 2.8878693726528484, 'bear_tsl_mult': 0.08745920089259746, 'bear_time_stop': 36, 'bear_use_sma': True, 'bear_use_ema': True, 'bear_use_atr': True, 'bear_use_adx': True, 'bear_use_spike': True, 'bear_rsi_required': True, 'sideways_strategy': 'breakout', 'sideways_bb_std_mult': 3.5091353840707455, 'sideways_rsi_os': 36, 'sideways_rsi_ob': 81, 'sideways_adx_thresh': 22.05247516625448, 'sideways_atr_min_pct': 0.010750516384983283, 'sideways_atr_max_pct': 0.11318153031131395, 'sideways_tp_mult': 1.3361396029273682, 'sideways_tsl_mult': 0.6628278611747096, 'sideways_time_stop': 192, 'sideways_use_sma': True, 'sideways_use_ema': False, 'sideways_use_atr': False, 'sideways_use_adx': False, 'sideways_use_spike': False, 'sideways_rsi_required': True}.
[I 2025-08-31 12:36:34,974] Trial 345 finished with values: [-1000000000.0, 1000000000.0] and parameters: {'p_sma': 51, 'p_std': 53, 'p_atr': 16, 'p_adx': 9, 'rsi_period': 78, 'ema1': 6, 'ema2': 12, 'slip_atr_k': 0.034057548349214456, 'slip_spread_k': 0.3926240861576209, 'spread_hl_frac': 0.020316822636186914, 'bb_std_mult': 1.9018458392515045, 'rsi_os': 43, 'rsi_ob': 72, 'vol_spike': 0.06923699688734763, 'adx_thresh': 26.32088807970546, 'atr_min_pct': 0.0017582249026432916, 'atr_max_pct': 0.13553597939652087, 'tp_mult': 2.6112315847733902, 'tsl_mult': 0.06303652100453444, 'strategy': 'mean_reversion', 'time_stop': 213, 'use_sma': False, 'use_atr': True, 'use_adx': False, 'use_ema': False, 'use_spike': False, 'rsi_required': True, 'edge_k': 0.7205894372326189, 'edge_cap': 0.9543717717309348, 'bull_strategy': 'breakout', 'bull_bb_std_mult': 2.7038181686132234, 'bull_rsi_os': 7, 'bull_rsi_ob': 60, 'bull_adx_thresh': 7.603477532259746, 'bull_atr_min_pct': 0.020207817656595115, 'bull_atr_max_pct': 0.09443028439705513, 'bull_tp_mult': 1.6653252654282806, 'bull_tsl_mult': 0.2473222825268808, 'bull_time_stop': 93, 'bull_use_sma': True, 'bull_use_ema': True, 'bull_use_atr': True, 'bull_use_adx': True, 'bull_use_spike': False, 'bull_rsi_required': False, 'bear_strategy': 'breakout', 'bear_bb_std_mult': 2.733512494432186, 'bear_rsi_os': 30, 'bear_rsi_ob': 80, 'bear_adx_thresh': 31.544728467489623, 'bear_atr_min_pct': 0.015789594713364177, 'bear_atr_max_pct': 0.10030351625636168, 'bear_tp_mult': 2.096687849739462, 'bear_tsl_mult': 0.18694216232711713, 'bear_time_stop': 77, 'bear_use_sma': True, 'bear_use_ema': True, 'bear_use_atr': True, 'bear_use_adx': True, 'bear_use_spike': True, 'bear_rsi_required': True, 'sideways_strategy': 'breakout', 'sideways_bb_std_mult': 3.4928550432946, 'sideways_rsi_os': 36, 'sideways_rsi_ob': 66, 'sideways_adx_thresh': 31.69211209565394, 'sideways_atr_min_pct': 0.01934134873135275, 'sideways_atr_max_pct': 0.012427900961582652, 'sideways_tp_mult': 1.714074458681428, 'sideways_tsl_mult': 0.6698703458154982, 'sideways_time_stop': 100, 'sideways_use_sma': True, 'sideways_use_ema': False, 'sideways_use_atr': False, 'sideways_use_adx': False, 'sideways_use_spike': False, 'sideways_rsi_required': True}.
[I 2025-08-31 12:36:35,097] Trial 346 finished with values: [-1000000000.0, 1000000000.0] and parameters: {'p_sma': 51, 'p_std': 54, 'p_atr': 28, 'p_adx': 7, 'rsi_period': 78, 'ema1': 11, 'ema2': 45, 'slip_atr_k': 0.030348246814308824, 'slip_spread_k': 0.646623621424031, 'spread_hl_frac': 0.028090092458937354, 'bb_std_mult': 1.8810992872442012, 'rsi_os': 40, 'rsi_ob': 90, 'vol_spike': 0.08390261404750622, 'adx_thresh': 22.885076539814325, 'atr_min_pct': 0.008425779690625626, 'atr_max_pct': 0.13403300787485417, 'tp_mult': 2.597906265647489, 'tsl_mult': 0.9059663491044426, 'strategy': 'mean_reversion', 'time_stop': 126, 'use_sma': False, 'use_atr': True, 'use_adx': False, 'use_ema': True, 'use_spike': False, 'rsi_required': True, 'edge_k': 0.7482592812795857, 'edge_cap': 0.8180446812884574, 'bull_strategy': 'breakout', 'bull_bb_std_mult': 2.7187877230670474, 'bull_rsi_os': 9, 'bull_rsi_ob': 59, 'bull_adx_thresh': 17.14418909555804, 'bull_atr_min_pct': 0.022507816800096562, 'bull_atr_max_pct': 0.07709192767270129, 'bull_tp_mult': 2.7710725831049094, 'bull_tsl_mult': 0.19563058635418246, 'bull_time_stop': 243, 'bull_use_sma': True, 'bull_use_ema': True, 'bull_use_atr': False, 'bull_use_adx': True, 'bull_use_spike': False, 'bull_rsi_required': False, 'bear_strategy': 'breakout', 'bear_bb_std_mult': 2.897198702836544, 'bear_rsi_os': 29, 'bear_rsi_ob': 68, 'bear_adx_thresh': 23.500480637342847, 'bear_atr_min_pct': 0.027600261802396758, 'bear_atr_max_pct': 0.1235420932333304, 'bear_tp_mult': 2.99458529843091, 'bear_tsl_mult': 0.4812347146347771, 'bear_time_stop': 242, 'bear_use_sma': True, 'bear_use_ema': True, 'bear_use_atr': True, 'bear_use_adx': True, 'bear_use_spike': True, 'bear_rsi_required': True, 'sideways_strategy': 'breakout', 'sideways_bb_std_mult': 3.5345937278208823, 'sideways_rsi_os': 40, 'sideways_rsi_ob': 61, 'sideways_adx_thresh': 19.782243615582896, 'sideways_atr_min_pct': 0.026160545723675346, 'sideways_atr_max_pct': 0.012883031260878253, 'sideways_tp_mult': 2.264313990616168, 'sideways_tsl_mult': 0.6665343347313057, 'sideways_time_stop': 228, 'sideways_use_sma': True, 'sideways_use_ema': False, 'sideways_use_atr': False, 'sideways_use_adx': False, 'sideways_use_spike': False, 'sideways_rsi_required': True}.
[I 2025-08-31 12:36:35,818] Trial 350 finished with values: [-1000000000.0, 1000000000.0] and parameters: {'p_sma': 48, 'p_std': 58, 'p_atr': 25, 'p_adx': 12, 'rsi_period': 32, 'ema1': 5, 'ema2': 15, 'slip_atr_k': 0.036539662658142166, 'slip_spread_k': 0.596690488616041, 'spread_hl_frac': 0.02719239029232821, 'bb_std_mult': 3.369403144534909, 'rsi_os': 52, 'rsi_ob': 74, 'vol_spike': 0.09875732401665724, 'adx_thresh': 10.552129288314324, 'atr_min_pct': 0.0009014311992311027, 'atr_max_pct': 0.054099964272955936, 'tp_mult': 2.905880720361154, 'tsl_mult': 0.0003623720499885113, 'strategy': 'mean_reversion', 'time_stop': 197, 'use_sma': False, 'use_atr': True, 'use_adx': False, 'use_ema': True, 'use_spike': False, 'rsi_required': True, 'edge_k': 0.6970841705965626, 'edge_cap': 0.49468926974588556, 'bull_strategy': 'breakout', 'bull_bb_std_mult': 1.6296609583937456, 'bull_rsi_os': 30, 'bull_rsi_ob': 82, 'bull_adx_thresh': 32.66174725393202, 'bull_atr_min_pct': 0.01035159732959371, 'bull_atr_max_pct': 0.1344045684449599, 'bull_tp_mult': 2.711673597683579, 'bull_tsl_mult': 0.4999158425249411, 'bull_time_stop': 96, 'bull_use_sma': True, 'bull_use_ema': True, 'bull_use_atr': False, 'bull_use_adx': True, 'bull_use_spike': False, 'bull_rsi_required': False, 'bear_strategy': 'breakout', 'bear_bb_std_mult': 2.364580968631436, 'bear_rsi_os': 10, 'bear_rsi_ob': 70, 'bear_adx_thresh': 32.25676054798284, 'bear_atr_min_pct': 0.027001296688437385, 'bear_atr_max_pct': 0.0890873022162882, 'bear_tp_mult': 2.716449818579147, 'bear_tsl_mult': 0.12439364330810329, 'bear_time_stop': 165, 'bear_use_sma': True, 'bear_use_ema': True, 'bear_use_atr': True, 'bear_use_adx': True, 'bear_use_spike': True, 'bear_rsi_required': True, 'sideways_strategy': 'breakout', 'sideways_bb_std_mult': 3.1157376136998027, 'sideways_rsi_os': 54, 'sideways_rsi_ob': 82, 'sideways_adx_thresh': 11.763193859184307, 'sideways_atr_min_pct': 0.015527918494710238, 'sideways_atr_max_pct': 0.14590087263147222, 'sideways_tp_mult': 1.4554545630651916, 'sideways_tsl_mult': 0.6210790371975065, 'sideways_time_stop': 207, 'sideways_use_sma': True, 'sideways_use_ema': False, 'sideways_use_atr': False, 'sideways_use_adx': False, 'sideways_use_spike': False, 'sideways_rsi_required': True}.
[I 2025-08-31 12:37:06,733] Trial 348 finished with values: [-1000000000.0, 1000000000.0] and parameters: {'p_sma': 7, 'p_std': 33, 'p_atr': 16, 'p_adx': 20, 'rsi_period': 78, 'ema1': 26, 'ema2': 12, 'slip_atr_k': 0.017884543422463886, 'slip_spread_k': 0.3828078686205255, 'spread_hl_frac': 0.04298400232655753, 'bb_std_mult': 2.842388196522624, 'rsi_os': 43, 'rsi_ob': 67, 'vol_spike': 0.08287015008640698, 'adx_thresh': 9.25993126731095, 'atr_min_pct': 0.0008374648849107761, 'atr_max_pct': 0.13501822039993008, 'tp_mult': 2.727614193508242, 'tsl_mult': 0.05611884344753082, 'strategy': 'mean_reversion', 'time_stop': 199, 'use_sma': False, 'use_atr': True, 'use_adx': False, 'use_ema': True, 'use_spike': False, 'rsi_required': True, 'edge_k': 1.4397256096188396, 'edge_cap': 0.7152516663165072, 'bull_strategy': 'breakout', 'bull_bb_std_mult': 1.6739774815202788, 'bull_rsi_os': 9, 'bull_rsi_ob': 81, 'bull_adx_thresh': 22.59429390428387, 'bull_atr_min_pct': 0.014522891280897609, 'bull_atr_max_pct': 0.09491850118444654, 'bull_tp_mult': 2.714231072917209, 'bull_tsl_mult': 0.28171959747000735, 'bull_time_stop': 92, 'bull_use_sma': True, 'bull_use_ema': True, 'bull_use_atr': False, 'bull_use_adx': True, 'bull_use_spike': False, 'bull_rsi_required': False, 'bear_strategy': 'breakout', 'bear_bb_std_mult': 2.961840972243445, 'bear_rsi_os': 10, 'bear_rsi_ob': 95, 'bear_adx_thresh': 23.476888193679365, 'bear_atr_min_pct': 0.015823019824717, 'bear_atr_max_pct': 0.03912241092018693, 'bear_tp_mult': 2.987116767061172, 'bear_tsl_mult': 0.16817480968982348, 'bear_time_stop': 157, 'bear_use_sma': True, 'bear_use_ema': True, 'bear_use_atr': True, 'bear_use_adx': True, 'bear_use_spike': True, 'bear_rsi_required': True, 'sideways_strategy': 'breakout', 'sideways_bb_std_mult': 3.3342436262699366, 'sideways_rsi_os': 38, 'sideways_rsi_ob': 61, 'sideways_adx_thresh': 28.304283263994954, 'sideways_atr_min_pct': 0.02599304770990869, 'sideways_atr_max_pct': 0.14533673279924747, 'sideways_tp_mult': 2.311143061366778, 'sideways_tsl_mult': 0.6844740522539149, 'sideways_time_stop': 206, 'sideways_use_sma': True, 'sideways_use_ema': False, 'sideways_use_atr': False, 'sideways_use_adx': False, 'sideways_use_spike': False, 'sideways_rsi_required': True}.
[I 2025-08-31 12:37:06,959] Trial 347 finished with values: [-1000000000.0, 1000000000.0] and parameters: {'p_sma': 7, 'p_std': 53, 'p_atr': 29, 'p_adx': 7, 'rsi_period': 78, 'ema1': 6, 'ema2': 47, 'slip_atr_k': 0.01776833637089853, 'slip_spread_k': 0.7674153588106147, 'spread_hl_frac': 0.0281920617023838, 'bb_std_mult': 3.3578683191440506, 'rsi_os': 43, 'rsi_ob': 72, 'vol_spike': 0.17195569144391404, 'adx_thresh': 25.154286307428517, 'atr_min_pct': 0.000814042287555864, 'atr_max_pct': 0.13423736357117297, 'tp_mult': 2.601611547328943, 'tsl_mult': 0.9149270595946881, 'strategy': 'mean_reversion', 'time_stop': 209, 'use_sma': False, 'use_atr': True, 'use_adx': False, 'use_ema': True, 'use_spike': False, 'rsi_required': True, 'edge_k': 0.7222210896649441, 'edge_cap': 0.813206223978957, 'bull_strategy': 'breakout', 'bull_bb_std_mult': 3.5952699682344607, 'bull_rsi_os': 9, 'bull_rsi_ob': 58, 'bull_adx_thresh': 7.648159409087741, 'bull_atr_min_pct': 0.02039223954800474, 'bull_atr_max_pct': 0.09346676441197091, 'bull_tp_mult': 2.781922465855864, 'bull_tsl_mult': 0.3899076209095518, 'bull_time_stop': 103, 'bull_use_sma': True, 'bull_use_ema': True, 'bull_use_atr': False, 'bull_use_adx': True, 'bull_use_spike': False, 'bull_rsi_required': False, 'bear_strategy': 'breakout', 'bear_bb_std_mult': 2.3257296579929156, 'bear_rsi_os': 29, 'bear_rsi_ob': 75, 'bear_adx_thresh': 32.716592264915526, 'bear_atr_min_pct': 0.0275053227806162, 'bear_atr_max_pct': 0.02038077030868915, 'bear_tp_mult': 2.981739173213771, 'bear_tsl_mult': 0.46779773367940375, 'bear_time_stop': 37, 'bear_use_sma': True, 'bear_use_ema': True, 'bear_use_atr': True, 'bear_use_adx': True, 'bear_use_spike': True, 'bear_rsi_required': True, 'sideways_strategy': 'breakout', 'sideways_bb_std_mult': 1.3555561886959109, 'sideways_rsi_os': 34, 'sideways_rsi_ob': 60, 'sideways_adx_thresh': 28.266277202710008, 'sideways_atr_min_pct': 0.008736963752413639, 'sideways_atr_max_pct': 0.14701055081041003, 'sideways_tp_mult': 1.4435464439896946, 'sideways_tsl_mult': 0.6714775730834578, 'sideways_time_stop': 116, 'sideways_use_sma': True, 'sideways_use_ema': False, 'sideways_use_atr': False, 'sideways_use_adx': False, 'sideways_use_spike': False, 'sideways_rsi_required': True}.
[I 2025-08-31 12:37:07,507] Trial 349 finished with values: [-1000000000.0, 1000000000.0] and parameters: {'p_sma': 49, 'p_std': 56, 'p_atr': 28, 'p_adx': 22, 'rsi_period': 78, 'ema1': 5, 'ema2': 10, 'slip_atr_k': 0.0190815772858188, 'slip_spread_k': 0.6066265540203652, 'spread_hl_frac': 0.027997924102586044, 'bb_std_mult': 1.3004235858889985, 'rsi_os': 40, 'rsi_ob': 91, 'vol_spike': 0.08374513929594535, 'adx_thresh': 22.91567882499934, 'atr_min_pct': 0.0008883470878821234, 'atr_max_pct': 0.13899618403302486, 'tp_mult': 2.924461551967426, 'tsl_mult': 0.04482580198503698, 'strategy': 'mean_reversion', 'time_stop': 123, 'use_sma': False, 'use_atr': True, 'use_adx': False, 'use_ema': True, 'use_spike': False, 'rsi_required': True, 'edge_k': 0.7775770145571471, 'edge_cap': 0.5880327723243783, 'bull_strategy': 'breakout', 'bull_bb_std_mult': 1.7612045372359553, 'bull_rsi_os': 29, 'bull_rsi_ob': 82, 'bull_adx_thresh': 11.99168820542961, 'bull_atr_min_pct': 0.02192432899648531, 'bull_atr_max_pct': 0.10207370303174951, 'bull_tp_mult': 2.769559647381418, 'bull_tsl_mult': 0.19630573442419263, 'bull_time_stop': 97, 'bull_use_sma': True, 'bull_use_ema': True, 'bull_use_atr': False, 'bull_use_adx': True, 'bull_use_spike': False, 'bull_rsi_required': False, 'bear_strategy': 'breakout', 'bear_bb_std_mult': 2.9477160139883023, 'bear_rsi_os': 27, 'bear_rsi_ob': 75, 'bear_adx_thresh': 5.672811331651221, 'bear_atr_min_pct': 0.02796257992324921, 'bear_atr_max_pct': 0.08724980477747316, 'bear_tp_mult': 2.6094155210804297, 'bear_tsl_mult': 0.13913262330664555, 'bear_time_stop': 234, 'bear_use_sma': True, 'bear_use_ema': True, 'bear_use_atr': True, 'bear_use_adx': True, 'bear_use_spike': True, 'bear_rsi_required': True, 'sideways_strategy': 'breakout', 'sideways_bb_std_mult': 1.3236484588516004, 'sideways_rsi_os': 19, 'sideways_rsi_ob': 82, 'sideways_adx_thresh': 11.733938334441644, 'sideways_atr_min_pct': 0.0021136291087788706, 'sideways_atr_max_pct': 0.14615494697465226, 'sideways_tp_mult': 2.551137201173099, 'sideways_tsl_mult': 0.8227998639198185, 'sideways_time_stop': 227, 'sideways_use_sma': True, 'sideways_use_ema': False, 'sideways_use_atr': False, 'sideways_use_adx': False, 'sideways_use_spike': False, 'sideways_rsi_required': True}.
