[I 2025-08-31 12:04:43,145] Trial 91 finished with values: [-1000000000.0, 1000000000.0] and parameters: {'p_sma': 41, 'p_std': 49, 'p_atr': 14, 'p_adx': 22, 'rsi_period': 81, 'ema1': 8, 'ema2': 14, 'slip_atr_k': 0.031953869809248664, 'slip_spread_k': 0.4980834986844498, 'spread_hl_frac': 0.008197584026399743, 'bb_std_mult': 0.7917448543492411, 'rsi_os': 7, 'rsi_ob': 85, 'vol_spike': 0.221957518272631, 'adx_thresh': 34.85517426665612, 'atr_min_pct': 0.022559649949359717, 'atr_max_pct': 0.07576354726980664, 'tp_mult': 1.1424886963194036, 'tsl_mult': 0.1404119942999589, 'strategy': 'mean_reversion', 'time_stop': 203, 'use_sma': False, 'use_atr': False, 'use_adx': True, 'use_ema': True, 'use_spike': True, 'rsi_required': True, 'edge_k': 1.4409205552608864, 'edge_cap': 0.4264898385707375, 'bull_strategy': 'breakout', 'bull_bb_std_mult': 1.2752687812600152, 'bull_rsi_os': 18, 'bull_rsi_ob': 70, 'bull_adx_thresh': 5.001045504037375, 'bull_atr_min_pct': 0.017192922484790447, 'bull_atr_max_pct': 0.14272422379181277, 'bull_tp_mult': 2.597187404039131, 'bull_tsl_mult': 0.9795196088900615, 'bull_time_stop': 37, 'bull_use_sma': True, 'bull_use_ema': True, 'bull_use_atr': True, 'bull_use_adx': False, 'bull_use_spike': False, 'bull_rsi_required': True, 'bear_strategy': 'breakout', 'bear_bb_std_mult': 2.040749324563009, 'bear_rsi_os': 20, 'bear_rsi_ob': 66, 'bear_adx_thresh': 8.498684975203101, 'bear_atr_min_pct': 0.016980066766378588, 'bear_atr_max_pct': 0.05881199245108674, 'bear_tp_mult': 1.3802453472993417, 'bear_tsl_mult': 0.5475313402062464, 'bear_time_stop': 217, 'bear_use_sma': False, 'bear_use_ema': True, 'bear_use_atr': True, 'bear_use_adx': False, 'bear_use_spike': True, 'bear_rsi_required': True, 'sideways_strategy': 'breakout', 'sideways_bb_std_mult': 2.8806102236209714, 'sideways_rsi_os': 39, 'sideways_rsi_ob': 57, 'sideways_adx_thresh': 18.601402322734337, 'sideways_atr_min_pct': 0.007706461220217038, 'sideways_atr_max_pct': 0.033613431670046455, 'sideways_tp_mult': 2.0631995123876448, 'sideways_tsl_mult': 0.3944761099375412, 'sideways_time_stop': 162, 'sideways_use_sma': True, 'sideways_use_ema': True, 'sideways_use_atr': True, 'sideways_use_adx': True, 'sideways_use_spike': True, 'sideways_rsi_required': False}.
[I 2025-08-31 12:04:43,289] Trial 90 finished with values: [-0.0157974611381001, 0.015918723854958614] and parameters: {'p_sma': 40, 'p_std': 7, 'p_atr': 11, 'p_adx': 10, 'rsi_period': 79, 'ema1': 8, 'ema2': 33, 'slip_atr_k': 0.06445878144457223, 'slip_spread_k': 0.49679746080868653, 'spread_hl_frac': 0.03239597133157206, 'bb_std_mult': 1.1545564056784947, 'rsi_os': 25, 'rsi_ob': 58, 'vol_spike': 0.22406842883571088, 'adx_thresh': 9.508125159559333, 'atr_min_pct': 0.021794655380033348, 'atr_max_pct': 0.06559447140784039, 'tp_mult': 2.299479453525472, 'tsl_mult': 0.18683807608031777, 'strategy': 'mean_reversion', 'time_stop': 89, 'use_sma': False, 'use_atr': False, 'use_adx': True, 'use_ema': True, 'use_spike': True, 'rsi_required': True, 'edge_k': 1.1932385523950495, 'edge_cap': 0.47745613117607527, 'bull_strategy': 'breakout', 'bull_bb_std_mult': 3.0819224653129673, 'bull_rsi_os': 18, 'bull_rsi_ob': 76, 'bull_adx_thresh': 9.08816031742202, 'bull_atr_min_pct': 0.0179396192248689, 'bull_atr_max_pct': 0.023341410591070685, 'bull_tp_mult': 2.600229290915074, 'bull_tsl_mult': 0.9805750355950094, 'bull_time_stop': 56, 'bull_use_sma': False, 'bull_use_ema': False, 'bull_use_atr': False, 'bull_use_adx': False, 'bull_use_spike': False, 'bull_rsi_required': True, 'bear_strategy': 'breakout', 'bear_bb_std_mult': 2.048483366834447, 'bear_rsi_os': 20, 'bear_rsi_ob': 63, 'bear_adx_thresh': 32.0070795045434, 'bear_atr_min_pct': 0.017473652237996136, 'bear_atr_max_pct': 0.08812989248993781, 'bear_tp_mult': 1.3266008272196992, 'bear_tsl_mult': 0.5711663126057539, 'bear_time_stop': 214, 'bear_use_sma': False, 'bear_use_ema': True, 'bear_use_atr': True, 'bear_use_adx': False, 'bear_use_spike': True, 'bear_rsi_required': True, 'sideways_strategy': 'breakout', 'sideways_bb_std_mult': 1.7065014645237047, 'sideways_rsi_os': 38, 'sideways_rsi_ob': 50, 'sideways_adx_thresh': 18.644169271088984, 'sideways_atr_min_pct': 0.002204253337760878, 'sideways_atr_max_pct': 0.0973558924026515, 'sideways_tp_mult': 1.6544757821743006, 'sideways_tsl_mult': 0.39273017934417276, 'sideways_time_stop': 196, 'sideways_use_sma': False, 'sideways_use_ema': True, 'sideways_use_atr': True, 'sideways_use_adx': False, 'sideways_use_spike': True, 'sideways_rsi_required': False}.
[I 2025-08-31 12:05:14,862] Trial 94 finished with values: [-1000000000.0, 1000000000.0] and parameters: {'p_sma': 11, 'p_std': 5, 'p_atr': 11, 'p_adx': 17, 'rsi_period': 49, 'ema1': 15, 'ema2': 11, 'slip_atr_k': 0.02508496606080135, 'slip_spread_k': 0.5480986191811136, 'spread_hl_frac': 0.032104277685013144, 'bb_std_mult': 2.972516944927809, 'rsi_os': 25, 'rsi_ob': 95, 'vol_spike': 0.2153177435689407, 'adx_thresh': 12.967411715185506, 'atr_min_pct': 0.021499604901224666, 'atr_max_pct': 0.06590407603621157, 'tp_mult': 2.3880440990194955, 'tsl_mult': 0.17915828479713958, 'strategy': 'mean_reversion', 'time_stop': 187, 'use_sma': False, 'use_atr': False, 'use_adx': True, 'use_ema': True, 'use_spike': True, 'rsi_required': True, 'edge_k': 0.14589758582695012, 'edge_cap': 0.5306718148479544, 'bull_strategy': 'breakout', 'bull_bb_std_mult': 1.4842793810168755, 'bull_rsi_os': 25, 'bull_rsi_ob': 75, 'bull_adx_thresh': 32.502767658816076, 'bull_atr_min_pct': 0.01967627530818024, 'bull_atr_max_pct': 0.060044249668057874, 'bull_tp_mult': 2.0093265770529767, 'bull_tsl_mult': 0.5424811005015282, 'bull_time_stop': 293, 'bull_use_sma': False, 'bull_use_ema': False, 'bull_use_atr': False, 'bull_use_adx': False, 'bull_use_spike': True, 'bull_rsi_required': True, 'bear_strategy': 'breakout', 'bear_bb_std_mult': 3.438273988800755, 'bear_rsi_os': 22, 'bear_rsi_ob': 63, 'bear_adx_thresh': 31.627410321583362, 'bear_atr_min_pct': 0.014974742674878302, 'bear_atr_max_pct': 0.1421972254287919, 'bear_tp_mult': 1.083203952204043, 'bear_tsl_mult': 0.5702748634852022, 'bear_time_stop': 166, 'bear_use_sma': True, 'bear_use_ema': True, 'bear_use_atr': True, 'bear_use_adx': True, 'bear_use_spike': True, 'bear_rsi_required': True, 'sideways_strategy': 'breakout', 'sideways_bb_std_mult': 0.7361855466413486, 'sideways_rsi_os': 44, 'sideways_rsi_ob': 81, 'sideways_adx_thresh': 29.98993206071003, 'sideways_atr_min_pct': 0.0044457528887594, 'sideways_atr_max_pct': 0.10516232354155419, 'sideways_tp_mult': 1.304370181851707, 'sideways_tsl_mult': 0.35782497012826137, 'sideways_time_stop': 198, 'sideways_use_sma': False, 'sideways_use_ema': False, 'sideways_use_atr': False, 'sideways_use_adx': False, 'sideways_use_spike': True, 'sideways_rsi_required': False}.
[I 2025-08-31 12:05:15,151] Trial 95 finished with values: [-1000000000.0, 1000000000.0] and parameters: {'p_sma': 40, 'p_std': 22, 'p_atr': 13, 'p_adx': 17, 'rsi_period': 78, 'ema1': 6, 'ema2': 32, 'slip_atr_k': 0.1134602212927796, 'slip_spread_k': 0.4385773220898058, 'spread_hl_frac': 0.03727636860450356, 'bb_std_mult': 1.2346850822679305, 'rsi_os': 12, 'rsi_ob': 73, 'vol_spike': 0.2134243689841306, 'adx_thresh': 13.616107075995465, 'atr_min_pct': 0.024851662039033513, 'atr_max_pct': 0.06711671647537634, 'tp_mult': 2.749172985406894, 'tsl_mult': 0.24783183014331112, 'strategy': 'mean_reversion', 'time_stop': 101, 'use_sma': False, 'use_atr': False, 'use_adx': True, 'use_ema': True, 'use_spike': True, 'rsi_required': True, 'edge_k': 0.03752037441848233, 'edge_cap': 0.48326749160955573, 'bull_strategy': 'mean_reversion', 'bull_bb_std_mult': 3.105645574691898, 'bull_rsi_os': 14, 'bull_rsi_ob': 76, 'bull_adx_thresh': 6.195491016732126, 'bull_atr_min_pct': 0.016104863362130226, 'bull_atr_max_pct': 0.015206430315262249, 'bull_tp_mult': 2.729311744258589, 'bull_tsl_mult': 0.9958846031320127, 'bull_time_stop': 80, 'bull_use_sma': False, 'bull_use_ema': False, 'bull_use_atr': True, 'bull_use_adx': False, 'bull_use_spike': False, 'bull_rsi_required': True, 'bear_strategy': 'breakout', 'bear_bb_std_mult': 1.790796291180311, 'bear_rsi_os': 55, 'bear_rsi_ob': 62, 'bear_adx_thresh': 32.17976080066352, 'bear_atr_min_pct': 0.017863377360552612, 'bear_atr_max_pct': 0.09827792014238011, 'bear_tp_mult': 1.2706158570421278, 'bear_tsl_mult': 0.5688492466070584, 'bear_time_stop': 265, 'bear_use_sma': False, 'bear_use_ema': True, 'bear_use_atr': True, 'bear_use_adx': False, 'bear_use_spike': True, 'bear_rsi_required': True, 'sideways_strategy': 'breakout', 'sideways_bb_std_mult': 1.8985110511559162, 'sideways_rsi_os': 34, 'sideways_rsi_ob': 47, 'sideways_adx_thresh': 15.172206696682556, 'sideways_atr_min_pct': 0.00014241959708264588, 'sideways_atr_max_pct': 0.10288401550739548, 'sideways_tp_mult': 1.6448862038013552, 'sideways_tsl_mult': 0.5384976556340035, 'sideways_time_stop': 197, 'sideways_use_sma': False, 'sideways_use_ema': True, 'sideways_use_atr': True, 'sideways_use_adx': False, 'sideways_use_spike': True, 'sideways_rsi_required': False}.
[I 2025-08-31 12:05:15,286] Trial 93 finished with values: [-1000000000.0, 1000000000.0] and parameters: {'p_sma': 50, 'p_std': 12, 'p_atr': 14, 'p_adx': 17, 'rsi_period': 23, 'ema1': 9, 'ema2': 13, 'slip_atr_k': 0.05592094171816343, 'slip_spread_k': 0.501553996186717, 'spread_hl_frac': 0.00814510288133972, 'bb_std_mult': 3.402602931431813, 'rsi_os': 25, 'rsi_ob': 54, 'vol_spike': 0.22265324043364754, 'adx_thresh': 13.893180187869142, 'atr_min_pct': 0.017525272246907378, 'atr_max_pct': 0.07329162647807856, 'tp_mult': 1.6037513432197417, 'tsl_mult': 0.8695831590644498, 'strategy': 'mean_reversion', 'time_stop': 92, 'use_sma': False, 'use_atr': False, 'use_adx': True, 'use_ema': True, 'use_spike': True, 'rsi_required': True, 'edge_k': 1.4419502950788292, 'edge_cap': 0.5337857726788512, 'bull_strategy': 'breakout', 'bull_bb_std_mult': 3.0241396014529567, 'bull_rsi_os': 25, 'bull_rsi_ob': 90, 'bull_adx_thresh': 32.86490994739167, 'bull_atr_min_pct': 0.010272638934653756, 'bull_atr_max_pct': 0.10455937552091649, 'bull_tp_mult': 1.6576985126259287, 'bull_tsl_mult': 0.8781053607550928, 'bull_time_stop': 294, 'bull_use_sma': True, 'bull_use_ema': False, 'bull_use_atr': True, 'bull_use_adx': False, 'bull_use_spike': True, 'bull_rsi_required': True, 'bear_strategy': 'breakout', 'bear_bb_std_mult': 1.8035307336465882, 'bear_rsi_os': 22, 'bear_rsi_ob': 65, 'bear_adx_thresh': 8.997486743150468, 'bear_atr_min_pct': 0.008541684530800203, 'bear_atr_max_pct': 0.057923667805698104, 'bear_tp_mult': 1.2789100391639008, 'bear_tsl_mult': 0.5647727010080037, 'bear_time_stop': 214, 'bear_use_sma': True, 'bear_use_ema': True, 'bear_use_atr': True, 'bear_use_adx': True, 'bear_use_spike': True, 'bear_rsi_required': True, 'sideways_strategy': 'breakout', 'sideways_bb_std_mult': 2.8412671612542946, 'sideways_rsi_os': 39, 'sideways_rsi_ob': 68, 'sideways_adx_thresh': 18.928035957179357, 'sideways_atr_min_pct': 0.00753033820451282, 'sideways_atr_max_pct': 0.036888232775092955, 'sideways_tp_mult': 1.8349459280066633, 'sideways_tsl_mult': 0.38278699032071534, 'sideways_time_stop': 196, 'sideways_use_sma': True, 'sideways_use_ema': True, 'sideways_use_atr': False, 'sideways_use_adx': False, 'sideways_use_spike': True, 'sideways_rsi_required': False}.
[I 2025-08-31 12:05:15,481] Trial 92 finished with values: [-1000000000.0, 1000000000.0] and parameters: {'p_sma': 22, 'p_std': 12, 'p_atr': 14, 'p_adx': 10, 'rsi_period': 61, 'ema1': 8, 'ema2': 13, 'slip_atr_k': 0.06808905424658225, 'slip_spread_k': 0.49119831039114853, 'spread_hl_frac': 0.01076639070902181, 'bb_std_mult': 3.4566572330704757, 'rsi_os': 25, 'rsi_ob': 86, 'vol_spike': 0.22422575083557422, 'adx_thresh': 13.852425145517946, 'atr_min_pct': 0.007947667250428732, 'atr_max_pct': 0.07924818593486102, 'tp_mult': 1.094456234785652, 'tsl_mult': 0.14089914739663528, 'strategy': 'mean_reversion', 'time_stop': 187, 'use_sma': False, 'use_atr': False, 'use_adx': True, 'use_ema': True, 'use_spike': True, 'rsi_required': True, 'edge_k': 0.1069084634484273, 'edge_cap': 0.5308285049805701, 'bull_strategy': 'breakout', 'bull_bb_std_mult': 0.830700396483466, 'bull_rsi_os': 25, 'bull_rsi_ob': 75, 'bull_adx_thresh': 33.07879134728227, 'bull_atr_min_pct': 0.019841427559233873, 'bull_atr_max_pct': 0.10392098528279503, 'bull_tp_mult': 1.6549750049858374, 'bull_tsl_mult': 0.8622642209913455, 'bull_time_stop': 90, 'bull_use_sma': True, 'bull_use_ema': True, 'bull_use_atr': True, 'bull_use_adx': False, 'bull_use_spike': False, 'bull_rsi_required': True, 'bear_strategy': 'breakout', 'bear_bb_std_mult': 3.463829903182603, 'bear_rsi_os': 20, 'bear_rsi_ob': 66, 'bear_adx_thresh': 31.860773628189826, 'bear_atr_min_pct': 0.01742149055548098, 'bear_atr_max_pct': 0.10327275384154, 'bear_tp_mult': 1.3801481528763018, 'bear_tsl_mult': 0.5359376253532185, 'bear_time_stop': 163, 'bear_use_sma': True, 'bear_use_ema': True, 'bear_use_atr': True, 'bear_use_adx': False, 'bear_use_spike': True, 'bear_rsi_required': True, 'sideways_strategy': 'breakout', 'sideways_bb_std_mult': 3.275052609812644, 'sideways_rsi_os': 39, 'sideways_rsi_ob': 93, 'sideways_adx_thresh': 19.04987172437634, 'sideways_atr_min_pct': 0.005069087904740473, 'sideways_atr_max_pct': 0.03469150977526619, 'sideways_tp_mult': 2.0719688181325546, 'sideways_tsl_mult': 0.3915621151608395, 'sideways_time_stop': 196, 'sideways_use_sma': True, 'sideways_use_ema': True, 'sideways_use_atr': True, 'sideways_use_adx': True, 'sideways_use_spike': True, 'sideways_rsi_required': False}.
[I 2025-08-31 12:05:46,786] Trial 97 finished with values: [-0.03456156360307305, 0.03430066477377399] and parameters: {'p_sma': 38, 'p_std': 19, 'p_atr': 11, 'p_adx': 29, 'rsi_period': 76, 'ema1': 7, 'ema2': 38, 'slip_atr_k': 0.23427369826807715, 'slip_spread_k': 0.42446148217546553, 'spread_hl_frac': 0.03552743987347697, 'bb_std_mult': 1.2447335470017717, 'rsi_os': 5, 'rsi_ob': 57, 'vol_spike': 0.20221321312996993, 'adx_thresh': 7.949508216837504, 'atr_min_pct': 0.02343015240829138, 'atr_max_pct': 0.07092769681896072, 'tp_mult': 2.569402490628269, 'tsl_mult': 0.28765662923753793, 'strategy': 'mean_reversion', 'time_stop': 87, 'use_sma': False, 'use_atr': False, 'use_adx': True, 'use_ema': True, 'use_spike': True, 'rsi_required': False, 'edge_k': 1.2662605090534087, 'edge_cap': 0.2926990269611343, 'bull_strategy': 'breakout', 'bull_bb_std_mult': 3.0033132094772457, 'bull_rsi_os': 15, 'bull_rsi_ob': 79, 'bull_adx_thresh': 13.598838294981473, 'bull_atr_min_pct': 0.01576423781600633, 'bull_atr_max_pct': 0.024741403786038174, 'bull_tp_mult': 2.980338149346141, 'bull_tsl_mult': 0.9660739216172031, 'bull_time_stop': 55, 'bull_use_sma': True, 'bull_use_ema': False, 'bull_use_atr': False, 'bull_use_adx': True, 'bull_use_spike': False, 'bull_rsi_required': True, 'bear_strategy': 'breakout', 'bear_bb_std_mult': 3.1347199222155875, 'bear_rsi_os': 20, 'bear_rsi_ob': 66, 'bear_adx_thresh': 33.81166383908752, 'bear_atr_min_pct': 0.02174019759170287, 'bear_atr_max_pct': 0.08727982838806098, 'bear_tp_mult': 1.5320110189068994, 'bear_tsl_mult': 0.16033915886045652, 'bear_time_stop': 238, 'bear_use_sma': False, 'bear_use_ema': False, 'bear_use_atr': True, 'bear_use_adx': False, 'bear_use_spike': True, 'bear_rsi_required': True, 'sideways_strategy': 'breakout', 'sideways_bb_std_mult': 2.1204105630305046, 'sideways_rsi_os': 38, 'sideways_rsi_ob': 51, 'sideways_adx_thresh': 19.96884512421935, 'sideways_atr_min_pct': 0.0013303685914042651, 'sideways_atr_max_pct': 0.14336214700855682, 'sideways_tp_mult': 1.542662336089923, 'sideways_tsl_mult': 0.6062274011461888, 'sideways_time_stop': 89, 'sideways_use_sma': True, 'sideways_use_ema': True, 'sideways_use_atr': True, 'sideways_use_adx': False, 'sideways_use_spike': True, 'sideways_rsi_required': False}.
[I 2025-08-31 12:05:46,882] Trial 99 finished with values: [-0.015450516796954639, 0.01530900440177586] and parameters: {'p_sma': 38, 'p_std': 20, 'p_atr': 11, 'p_adx': 14, 'rsi_period': 75, 'ema1': 7, 'ema2': 37, 'slip_atr_k': 0.07587467084815373, 'slip_spread_k': 0.525578984184575, 'spread_hl_frac': 0.029133060053502323, 'bb_std_mult': 1.2325730962854897, 'rsi_os': 40, 'rsi_ob': 59, 'vol_spike': 0.2576610442078948, 'adx_thresh': 20.47623473283958, 'atr_min_pct': 0.02647345934178469, 'atr_max_pct': 0.07039576500395388, 'tp_mult': 2.5957050004768285, 'tsl_mult': 0.29874507228409647, 'strategy': 'mean_reversion', 'time_stop': 87, 'use_sma': True, 'use_atr': False, 'use_adx': True, 'use_ema': False, 'use_spike': True, 'rsi_required': False, 'edge_k': 1.2505223346965564, 'edge_cap': 0.36800223804853116, 'bull_strategy': 'mean_reversion', 'bull_bb_std_mult': 3.416695047010852, 'bull_rsi_os': 15, 'bull_rsi_ob': 81, 'bull_adx_thresh': 8.882115059493268, 'bull_atr_min_pct': 0.01486086605099177, 'bull_atr_max_pct': 0.02482015791306007, 'bull_tp_mult': 2.650877641315553, 'bull_tsl_mult': 0.9579956282306745, 'bull_time_stop': 55, 'bull_use_sma': False, 'bull_use_ema': False, 'bull_use_atr': False, 'bull_use_adx': True, 'bull_use_spike': False, 'bull_rsi_required': True, 'bear_strategy': 'breakout', 'bear_bb_std_mult': 1.6631945852700545, 'bear_rsi_os': 25, 'bear_rsi_ob': 62, 'bear_adx_thresh': 34.42598967274746, 'bear_atr_min_pct': 0.02977377871027212, 'bear_atr_max_pct': 0.08812374136614028, 'bear_tp_mult': 1.5666380346634967, 'bear_tsl_mult': 0.6075473997922752, 'bear_time_stop': 238, 'bear_use_sma': False, 'bear_use_ema': False, 'bear_use_atr': True, 'bear_use_adx': False, 'bear_use_spike': True, 'bear_rsi_required': False, 'sideways_strategy': 'breakout', 'sideways_bb_std_mult': 2.1331043310689735, 'sideways_rsi_os': 36, 'sideways_rsi_ob': 49, 'sideways_adx_thresh': 8.25673203895503, 'sideways_atr_min_pct': 0.001970336049011733, 'sideways_atr_max_pct': 0.08544185213647729, 'sideways_tp_mult': 1.5091165164177704, 'sideways_tsl_mult': 0.44062315413809305, 'sideways_time_stop': 181, 'sideways_use_sma': False, 'sideways_use_ema': True, 'sideways_use_atr': True, 'sideways_use_adx': False, 'sideways_use_spike': False, 'sideways_rsi_required': True}.
[I 2025-08-31 12:05:47,040] Trial 96 finished with values: [-1000000000.0, 1000000000.0] and parameters: {'p_sma': 39, 'p_std': 21, 'p_atr': 13, 'p_adx': 10, 'rsi_period': 77, 'ema1': 6, 'ema2': 31, 'slip_atr_k': 0.07635543824304508, 'slip_spread_k': 0.448980951459377, 'spread_hl_frac': 0.03273374187037347, 'bb_std_mult': 1.2329118452716634, 'rsi_os': 16, 'rsi_ob': 73, 'vol_spike': 0.04110850072012391, 'adx_thresh': 14.830903753902529, 'atr_min_pct': 0.02454384657613963, 'atr_max_pct': 0.07304730655695688, 'tp_mult': 2.592472896762649, 'tsl_mult': 0.24989364567939615, 'strategy': 'mean_reversion', 'time_stop': 90, 'use_sma': False, 'use_atr': False, 'use_adx': True, 'use_ema': True, 'use_spike': True, 'rsi_required': False, 'edge_k': 1.2606538567682266, 'edge_cap': 0.36291103617943804, 'bull_strategy': 'mean_reversion', 'bull_bb_std_mult': 3.1167569455194033, 'bull_rsi_os': 16, 'bull_rsi_ob': 79, 'bull_adx_thresh': 14.27885917815286, 'bull_atr_min_pct': 0.01232739099553995, 'bull_atr_max_pct': 0.016821764186041303, 'bull_tp_mult': 2.9949906758734883, 'bull_tsl_mult': 0.9742182508307929, 'bull_time_stop': 54, 'bull_use_sma': True, 'bull_use_ema': False, 'bull_use_atr': True, 'bull_use_adx': False, 'bull_use_spike': False, 'bull_rsi_required': True, 'bear_strategy': 'breakout', 'bear_bb_std_mult': 1.8498481850117998, 'bear_rsi_os': 21, 'bear_rsi_ob': 65, 'bear_adx_thresh': 32.35608148823154, 'bear_atr_min_pct': 0.020435978453970202, 'bear_atr_max_pct': 0.09223881067680025, 'bear_tp_mult': 1.2566231149876441, 'bear_tsl_mult': 0.6045300879496525, 'bear_time_stop': 266, 'bear_use_sma': False, 'bear_use_ema': True, 'bear_use_atr': True, 'bear_use_adx': False, 'bear_use_spike': True, 'bear_rsi_required': True, 'sideways_strategy': 'breakout', 'sideways_bb_std_mult': 1.8894471211943578, 'sideways_rsi_os': 34, 'sideways_rsi_ob': 45, 'sideways_adx_thresh': 11.787258407705945, 'sideways_atr_min_pct': 0.00047077184986195233, 'sideways_atr_max_pct': 0.08438810672285314, 'sideways_tp_mult': 1.5520118960528129, 'sideways_tsl_mult': 0.624904151987395, 'sideways_time_stop': 90, 'sideways_use_sma': True, 'sideways_use_ema': True, 'sideways_use_atr': True, 'sideways_use_adx': False, 'sideways_use_spike': True, 'sideways_rsi_required': False}.
