[I 2025-08-31 13:11:02,597] Trial 597 finished with values: [-1000000000.0, 1000000000.0] and parameters: {'p_sma': 52, 'p_std': 24, 'p_atr': 13, 'p_adx': 24, 'rsi_period': 52, 'ema1': 8, 'ema2': 13, 'slip_atr_k': 0.0508016773475543, 'slip_spread_k': 0.4717054135950617, 'spread_hl_frac': 0.01600521384275757, 'bb_std_mult': 2.8040354024463854, 'rsi_os': 22, 'rsi_ob': 76, 'vol_spike': 0.0596449536795229, 'adx_thresh': 6.345428233225061, 'atr_min_pct': 0.010465542287968142, 'atr_max_pct': 0.1072335422964732, 'tp_mult': 2.644073793278627, 'tsl_mult': 0.04896238781264932, 'strategy': 'breakout', 'time_stop': 182, 'use_sma': False, 'use_atr': True, 'use_adx': False, 'use_ema': True, 'use_spike': False, 'rsi_required': True, 'edge_k': 0.49842997455120563, 'edge_cap': 0.44836256367540867, 'bull_strategy': 'breakout', 'bull_bb_std_mult': 2.721918010400341, 'bull_rsi_os': 6, 'bull_rsi_ob': 92, 'bull_adx_thresh': 15.781886471656133, 'bull_atr_min_pct': 0.025963340204337854, 'bull_atr_max_pct': 0.1498988418279896, 'bull_tp_mult': 1.3248757729395968, 'bull_tsl_mult': 0.677807225192475, 'bull_time_stop': 290, 'bull_use_sma': True, 'bull_use_ema': True, 'bull_use_atr': False, 'bull_use_adx': True, 'bull_use_spike': False, 'bull_rsi_required': False, 'bear_strategy': 'breakout', 'bear_bb_std_mult': 2.9796100039223807, 'bear_rsi_os': 53, 'bear_rsi_ob': 49, 'bear_adx_thresh': 12.496281323811582, 'bear_atr_min_pct': 0.01005237320364648, 'bear_atr_max_pct': 0.13047522995939048, 'bear_tp_mult': 2.3323925219486727, 'bear_tsl_mult': 0.6713420831134017, 'bear_time_stop': 201, 'bear_use_sma': True, 'bear_use_ema': True, 'bear_use_atr': True, 'bear_use_adx': True, 'bear_use_spike': False, 'bear_rsi_required': True, 'sideways_strategy': 'breakout', 'sideways_bb_std_mult': 2.2941536851982485, 'sideways_rsi_os': 32, 'sideways_rsi_ob': 94, 'sideways_adx_thresh': 17.045932554375362, 'sideways_atr_min_pct': 0.0022566790537324856, 'sideways_atr_max_pct': 0.01675582272185233, 'sideways_tp_mult': 2.346654650290744, 'sideways_tsl_mult': 0.1924137167090274, 'sideways_time_stop': 128, 'sideways_use_sma': True, 'sideways_use_ema': False, 'sideways_use_atr': False, 'sideways_use_adx': True, 'sideways_use_spike': False, 'sideways_rsi_required': True}.
[I 2025-08-31 13:11:02,776] Trial 596 finished with values: [-1000000000.0, 1000000000.0] and parameters: {'p_sma': 52, 'p_std': 24, 'p_atr': 13, 'p_adx': 22, 'rsi_period': 52, 'ema1': 8, 'ema2': 42, 'slip_atr_k': 0.150261859162287, 'slip_spread_k': 0.46162610148317845, 'spread_hl_frac': 0.015149006179718007, 'bb_std_mult': 0.6917838657727862, 'rsi_os': 36, 'rsi_ob': 89, 'vol_spike': 0.2034538320426512, 'adx_thresh': 20.366892411158663, 'atr_min_pct': 0.009322625103485457, 'atr_max_pct': 0.044595259522090105, 'tp_mult': 1.7873102615822956, 'tsl_mult': 0.7249177771184891, 'strategy': 'breakout', 'time_stop': 183, 'use_sma': False, 'use_atr': True, 'use_adx': False, 'use_ema': True, 'use_spike': False, 'rsi_required': True, 'edge_k': 0.6552210343678743, 'edge_cap': 0.732649942541317, 'bull_strategy': 'breakout', 'bull_bb_std_mult': 2.0653628638902224, 'bull_rsi_os': 6, 'bull_rsi_ob': 48, 'bull_adx_thresh': 16.94204597878056, 'bull_atr_min_pct': 0.01958950269011531, 'bull_atr_max_pct': 0.14432171035149136, 'bull_tp_mult': 1.3008972336191076, 'bull_tsl_mult': 0.21897875094069225, 'bull_time_stop': 288, 'bull_use_sma': True, 'bull_use_ema': True, 'bull_use_atr': False, 'bull_use_adx': True, 'bull_use_spike': False, 'bull_rsi_required': False, 'bear_strategy': 'breakout', 'bear_bb_std_mult': 2.9577679912855435, 'bear_rsi_os': 27, 'bear_rsi_ob': 49, 'bear_adx_thresh': 12.979594617419453, 'bear_atr_min_pct': 0.0042527902893085496, 'bear_atr_max_pct': 0.1344106875777637, 'bear_tp_mult': 1.824107906896083, 'bear_tsl_mult': 0.6714379502367283, 'bear_time_stop': 272, 'bear_use_sma': True, 'bear_use_ema': True, 'bear_use_atr': True, 'bear_use_adx': True, 'bear_use_spike': False, 'bear_rsi_required': True, 'sideways_strategy': 'breakout', 'sideways_bb_std_mult': 1.8674124535757706, 'sideways_rsi_os': 32, 'sideways_rsi_ob': 67, 'sideways_adx_thresh': 17.214034592456834, 'sideways_atr_min_pct': 0.02315487143884317, 'sideways_atr_max_pct': 0.12207254797355221, 'sideways_tp_mult': 2.0243929316942517, 'sideways_tsl_mult': 0.8940944377532247, 'sideways_time_stop': 196, 'sideways_use_sma': True, 'sideways_use_ema': False, 'sideways_use_atr': False, 'sideways_use_adx': True, 'sideways_use_spike': False, 'sideways_rsi_required': True}.
[I 2025-08-31 13:11:02,881] Trial 595 finished with values: [-1000000000.0, 1000000000.0] and parameters: {'p_sma': 17, 'p_std': 26, 'p_atr': 24, 'p_adx': 15, 'rsi_period': 60, 'ema1': 20, 'ema2': 13, 'slip_atr_k': 0.050297737641160134, 'slip_spread_k': 0.3983117252081238, 'spread_hl_frac': 0.016529124789200576, 'bb_std_mult': 2.396126181267577, 'rsi_os': 22, 'rsi_ob': 76, 'vol_spike': 0.15250443373313188, 'adx_thresh': 18.478620471127947, 'atr_min_pct': 0.016325407277415088, 'atr_max_pct': 0.10758753306173706, 'tp_mult': 2.7263914065446087, 'tsl_mult': 0.04721217602105196, 'strategy': 'breakout', 'time_stop': 184, 'use_sma': False, 'use_atr': True, 'use_adx': False, 'use_ema': True, 'use_spike': False, 'rsi_required': True, 'edge_k': 1.8097344739102137, 'edge_cap': 0.7259635223943461, 'bull_strategy': 'breakout', 'bull_bb_std_mult': 1.2082174543032058, 'bull_rsi_os': 6, 'bull_rsi_ob': 57, 'bull_adx_thresh': 15.840171256182822, 'bull_atr_min_pct': 0.027297488166224508, 'bull_atr_max_pct': 0.14407644945088344, 'bull_tp_mult': 1.3300277358907504, 'bull_tsl_mult': 0.22097232957974286, 'bull_time_stop': 289, 'bull_use_sma': True, 'bull_use_ema': True, 'bull_use_atr': False, 'bull_use_adx': True, 'bull_use_spike': False, 'bull_rsi_required': False, 'bear_strategy': 'breakout', 'bear_bb_std_mult': 3.235105230728172, 'bear_rsi_os': 27, 'bear_rsi_ob': 71, 'bear_adx_thresh': 13.143286224483235, 'bear_atr_min_pct': 0.009999699650284593, 'bear_atr_max_pct': 0.13469611865601264, 'bear_tp_mult': 1.4852059725243207, 'bear_tsl_mult': 0.7681885511645815, 'bear_time_stop': 202, 'bear_use_sma': True, 'bear_use_ema': True, 'bear_use_atr': True, 'bear_use_adx': True, 'bear_use_spike': False, 'bear_rsi_required': True, 'sideways_strategy': 'breakout', 'sideways_bb_std_mult': 1.6308923050088382, 'sideways_rsi_os': 32, 'sideways_rsi_ob': 67, 'sideways_adx_thresh': 24.293575481698237, 'sideways_atr_min_pct': 0.023159945388121373, 'sideways_atr_max_pct': 0.12354615036788084, 'sideways_tp_mult': 2.018307550134249, 'sideways_tsl_mult': 0.9011542215250888, 'sideways_time_stop': 126, 'sideways_use_sma': True, 'sideways_use_ema': False, 'sideways_use_atr': False, 'sideways_use_adx': True, 'sideways_use_spike': False, 'sideways_rsi_required': True}.
[I 2025-08-31 13:11:03,057] Trial 594 finished with values: [-0.0529434103476889, 0.0528806452658513] and parameters: {'p_sma': 54, 'p_std': 55, 'p_atr': 13, 'p_adx': 13, 'rsi_period': 28, 'ema1': 24, 'ema2': 42, 'slip_atr_k': 0.05117077851679315, 'slip_spread_k': 0.41265441249409646, 'spread_hl_frac': 0.016206248147825925, 'bb_std_mult': 2.798886242698015, 'rsi_os': 41, 'rsi_ob': 64, 'vol_spike': 0.1522343632346883, 'adx_thresh': 19.720969615824725, 'atr_min_pct': 0.006895566339727583, 'atr_max_pct': 0.10417356821610868, 'tp_mult': 2.7289391961647462, 'tsl_mult': 0.03976297647754152, 'strategy': 'breakout', 'time_stop': 180, 'use_sma': False, 'use_atr': True, 'use_adx': False, 'use_ema': True, 'use_spike': False, 'rsi_required': True, 'edge_k': 0.6511898298143544, 'edge_cap': 0.7842717977473975, 'bull_strategy': 'breakout', 'bull_bb_std_mult': 2.0331241470544277, 'bull_rsi_os': 6, 'bull_rsi_ob': 92, 'bull_adx_thresh': 25.844573862828252, 'bull_atr_min_pct': 0.003036127808811611, 'bull_atr_max_pct': 0.14467808045194727, 'bull_tp_mult': 1.308838178276393, 'bull_tsl_mult': 0.2087527194048355, 'bull_time_stop': 290, 'bull_use_sma': False, 'bull_use_ema': True, 'bull_use_atr': False, 'bull_use_adx': True, 'bull_use_spike': True, 'bull_rsi_required': False, 'bear_strategy': 'breakout', 'bear_bb_std_mult': 3.120599365258293, 'bear_rsi_os': 30, 'bear_rsi_ob': 69, 'bear_adx_thresh': 24.609808414469946, 'bear_atr_min_pct': 0.0028690559581304887, 'bear_atr_max_pct': 0.13440998635630294, 'bear_tp_mult': 1.8390977386507366, 'bear_tsl_mult': 0.7242179313667636, 'bear_time_stop': 188, 'bear_use_sma': False, 'bear_use_ema': True, 'bear_use_atr': True, 'bear_use_adx': True, 'bear_use_spike': False, 'bear_rsi_required': True, 'sideways_strategy': 'breakout', 'sideways_bb_std_mult': 1.8247171796190091, 'sideways_rsi_os': 41, 'sideways_rsi_ob': 69, 'sideways_adx_thresh': 6.641738066572438, 'sideways_atr_min_pct': 0.0033122744654096267, 'sideways_atr_max_pct': 0.12228029004816396, 'sideways_tp_mult': 1.635106268938721, 'sideways_tsl_mult': 0.8706407344589356, 'sideways_time_stop': 290, 'sideways_use_sma': True, 'sideways_use_ema': True, 'sideways_use_atr': False, 'sideways_use_adx': True, 'sideways_use_spike': False, 'sideways_rsi_required': True}.
[I 2025-08-31 13:11:36,770] Trial 598 finished with values: [-1000000000.0, 1000000000.0] and parameters: {'p_sma': 37, 'p_std': 20, 'p_atr': 26, 'p_adx': 16, 'rsi_period': 43, 'ema1': 20, 'ema2': 24, 'slip_atr_k': 0.13802037964595293, 'slip_spread_k': 0.39342356590661526, 'spread_hl_frac': 0.014633765156426184, 'bb_std_mult': 2.478873535119988, 'rsi_os': 30, 'rsi_ob': 80, 'vol_spike': 0.19556923943260407, 'adx_thresh': 18.981679282633856, 'atr_min_pct': 0.009367214810838645, 'atr_max_pct': 0.04442683619451972, 'tp_mult': 2.701461620360495, 'tsl_mult': 0.022460130614888076, 'strategy': 'breakout', 'time_stop': 39, 'use_sma': False, 'use_atr': True, 'use_adx': False, 'use_ema': True, 'use_spike': False, 'rsi_required': True, 'edge_k': 0.6647428909832374, 'edge_cap': 0.7265367395168054, 'bull_strategy': 'breakout', 'bull_bb_std_mult': 1.9267482991008253, 'bull_rsi_os': 21, 'bull_rsi_ob': 57, 'bull_adx_thresh': 16.666048889350773, 'bull_atr_min_pct': 0.019805997984009706, 'bull_atr_max_pct': 0.045488408455686094, 'bull_tp_mult': 2.224311980869604, 'bull_tsl_mult': 0.44019236176311777, 'bull_time_stop': 215, 'bull_use_sma': True, 'bull_use_ema': True, 'bull_use_atr': False, 'bull_use_adx': False, 'bull_use_spike': False, 'bull_rsi_required': False, 'bear_strategy': 'breakout', 'bear_bb_std_mult': 3.227045110954147, 'bear_rsi_os': 28, 'bear_rsi_ob': 70, 'bear_adx_thresh': 18.36715230276523, 'bear_atr_min_pct': 0.004261023694603818, 'bear_atr_max_pct': 0.1341140358572238, 'bear_tp_mult': 1.826782535528321, 'bear_tsl_mult': 0.019140391995706496, 'bear_time_stop': 203, 'bear_use_sma': True, 'bear_use_ema': True, 'bear_use_atr': True, 'bear_use_adx': True, 'bear_use_spike': True, 'bear_rsi_required': True, 'sideways_strategy': 'breakout', 'sideways_bb_std_mult': 1.025418567657662, 'sideways_rsi_os': 41, 'sideways_rsi_ob': 69, 'sideways_adx_thresh': 23.693059091138316, 'sideways_atr_min_pct': 0.018646883745711787, 'sideways_atr_max_pct': 0.12252867209389516, 'sideways_tp_mult': 1.0105428999079304, 'sideways_tsl_mult': 0.8994536923544925, 'sideways_time_stop': 199, 'sideways_use_sma': True, 'sideways_use_ema': False, 'sideways_use_atr': False, 'sideways_use_adx': False, 'sideways_use_spike': False, 'sideways_rsi_required': False}.
[I 2025-08-31 13:11:37,056] Trial 600 finished with values: [-0.06057475674645196, 0.0604146277484147] and parameters: {'p_sma': 8, 'p_std': 20, 'p_atr': 12, 'p_adx': 16, 'rsi_period': 15, 'ema1': 14, 'ema2': 15, 'slip_atr_k': 0.07216297444396472, 'slip_spread_k': 0.38227252815257223, 'spread_hl_frac': 0.018452825755984656, 'bb_std_mult': 2.2103907574973234, 'rsi_os': 31, 'rsi_ob': 80, 'vol_spike': 0.2385648170970289, 'adx_thresh': 19.163964119142715, 'atr_min_pct': 0.024314100226996756, 'atr_max_pct': 0.11720232166083042, 'tp_mult': 2.6287433909816618, 'tsl_mult': 0.01790282130882563, 'strategy': 'breakout', 'time_stop': 132, 'use_sma': False, 'use_atr': False, 'use_adx': False, 'use_ema': True, 'use_spike': False, 'rsi_required': True, 'edge_k': 0.29840617596276, 'edge_cap': 0.7086549518771186, 'bull_strategy': 'breakout', 'bull_bb_std_mult': 1.9179759795256468, 'bull_rsi_os': 23, 'bull_rsi_ob': 46, 'bull_adx_thresh': 11.502344267512278, 'bull_atr_min_pct': 0.018851579842274414, 'bull_atr_max_pct': 0.11887706599573064, 'bull_tp_mult': 1.2068257176339021, 'bull_tsl_mult': 0.6335164714285159, 'bull_time_stop': 167, 'bull_use_sma': False, 'bull_use_ema': True, 'bull_use_atr': False, 'bull_use_adx': False, 'bull_use_spike': True, 'bull_rsi_required': False, 'bear_strategy': 'mean_reversion', 'bear_bb_std_mult': 3.2278865530804017, 'bear_rsi_os': 30, 'bear_rsi_ob': 70, 'bear_adx_thresh': 13.937415867069493, 'bear_atr_min_pct': 0.0020164715400242065, 'bear_atr_max_pct': 0.14556195848568854, 'bear_tp_mult': 2.833430459400977, 'bear_tsl_mult': 0.978314899758667, 'bear_time_stop': 142, 'bear_use_sma': False, 'bear_use_ema': False, 'bear_use_atr': True, 'bear_use_adx': True, 'bear_use_spike': True, 'bear_rsi_required': False, 'sideways_strategy': 'breakout', 'sideways_bb_std_mult': 1.4429918232742383, 'sideways_rsi_os': 26, 'sideways_rsi_ob': 69, 'sideways_adx_thresh': 27.318463687466892, 'sideways_atr_min_pct': 0.0014652199304191474, 'sideways_atr_max_pct': 0.12772581538457375, 'sideways_tp_mult': 1.5643523937840282, 'sideways_tsl_mult': 0.9349095690008983, 'sideways_time_stop': 235, 'sideways_use_sma': True, 'sideways_use_ema': False, 'sideways_use_atr': False, 'sideways_use_adx': False, 'sideways_use_spike': False, 'sideways_rsi_required': False}.
[I 2025-08-31 13:11:37,340] Trial 599 finished with values: [-1000000000.0, 1000000000.0] and parameters: {'p_sma': 51, 'p_std': 26, 'p_atr': 24, 'p_adx': 16, 'rsi_period': 50, 'ema1': 20, 'ema2': 18, 'slip_atr_k': 0.06510872382353083, 'slip_spread_k': 0.3825265678200559, 'spread_hl_frac': 0.01876676367293757, 'bb_std_mult': 2.211375218950341, 'rsi_os': 47, 'rsi_ob': 80, 'vol_spike': 0.02202811499162852, 'adx_thresh': 19.083566244900393, 'atr_min_pct': 0.0011457867696176476, 'atr_max_pct': 0.11733250260912356, 'tp_mult': 2.7018991574704425, 'tsl_mult': 0.016064562892511357, 'strategy': 'breakout', 'time_stop': 39, 'use_sma': False, 'use_atr': True, 'use_adx': False, 'use_ema': True, 'use_spike': False, 'rsi_required': True, 'edge_k': 0.8018398405712478, 'edge_cap': 0.0510322221684506, 'bull_strategy': 'breakout', 'bull_bb_std_mult': 1.5775859241145214, 'bull_rsi_os': 8, 'bull_rsi_ob': 73, 'bull_adx_thresh': 12.24112540774172, 'bull_atr_min_pct': 0.02034401683444839, 'bull_atr_max_pct': 0.14780494383321194, 'bull_tp_mult': 2.910740027513592, 'bull_tsl_mult': 0.23237958562195687, 'bull_time_stop': 34, 'bull_use_sma': False, 'bull_use_ema': True, 'bull_use_atr': False, 'bull_use_adx': False, 'bull_use_spike': False, 'bull_rsi_required': False, 'bear_strategy': 'breakout', 'bear_bb_std_mult': 3.2276590832946974, 'bear_rsi_os': 30, 'bear_rsi_ob': 70, 'bear_adx_thresh': 18.24992607800686, 'bear_atr_min_pct': 0.0021142501597394806, 'bear_atr_max_pct': 0.06671827006894046, 'bear_tp_mult': 2.0122759610017162, 'bear_tsl_mult': 0.7694701569799637, 'bear_time_stop': 203, 'bear_use_sma': False, 'bear_use_ema': True, 'bear_use_atr': True, 'bear_use_adx': True, 'bear_use_spike': True, 'bear_rsi_required': True, 'sideways_strategy': 'breakout', 'sideways_bb_std_mult': 1.6236360043388165, 'sideways_rsi_os': 41, 'sideways_rsi_ob': 69, 'sideways_adx_thresh': 30.57641631194387, 'sideways_atr_min_pct': 0.01950055083600817, 'sideways_atr_max_pct': 0.1276055067458083, 'sideways_tp_mult': 1.5721641259846113, 'sideways_tsl_mult': 0.3544663207651222, 'sideways_time_stop': 206, 'sideways_use_sma': True, 'sideways_use_ema': False, 'sideways_use_atr': False, 'sideways_use_adx': False, 'sideways_use_spike': False, 'sideways_rsi_required': False}.
[I 2025-08-31 13:11:37,436] Trial 601 finished with values: [-0.06706544182663476, 0.06679021069464296] and parameters: {'p_sma': 51, 'p_std': 20, 'p_atr': 12, 'p_adx': 19, 'rsi_period': 69, 'ema1': 14, 'ema2': 15, 'slip_atr_k': 0.2421702170237247, 'slip_spread_k': 0.381784587879913, 'spread_hl_frac': 0.01838109209332784, 'bb_std_mult': 2.483842803135942, 'rsi_os': 24, 'rsi_ob': 80, 'vol_spike': 0.022192851906466443, 'adx_thresh': 32.89226905613371, 'atr_min_pct': 0.0012097513472256207, 'atr_max_pct': 0.1255446712683223, 'tp_mult': 2.619793984587332, 'tsl_mult': 0.019149546910188112, 'strategy': 'breakout', 'time_stop': 170, 'use_sma': False, 'use_atr': False, 'use_adx': False, 'use_ema': True, 'use_spike': False, 'rsi_required': True, 'edge_k': 1.9571274578714206, 'edge_cap': 0.10328343913990501, 'bull_strategy': 'breakout', 'bull_bb_std_mult': 2.8017544547015207, 'bull_rsi_os': 25, 'bull_rsi_ob': 73, 'bull_adx_thresh': 11.914619561911632, 'bull_atr_min_pct': 0.0003748604857128565, 'bull_atr_max_pct': 0.04558047293212079, 'bull_tp_mult': 1.198363348776837, 'bull_tsl_mult': 0.7587881716726791, 'bull_time_stop': 168, 'bull_use_sma': True, 'bull_use_ema': True, 'bull_use_atr': True, 'bull_use_adx': False, 'bull_use_spike': False, 'bull_rsi_required': False, 'bear_strategy': 'mean_reversion', 'bear_bb_std_mult': 1.0507685131805167, 'bear_rsi_os': 28, 'bear_rsi_ob': 79, 'bear_adx_thresh': 13.839300234618738, 'bear_atr_min_pct': 0.007976228305679024, 'bear_atr_max_pct': 0.14556119617595664, 'bear_tp_mult': 2.014374710983564, 'bear_tsl_mult': 0.2690315039899134, 'bear_time_stop': 168, 'bear_use_sma': True, 'bear_use_ema': False, 'bear_use_atr': True, 'bear_use_adx': True, 'bear_use_spike': True, 'bear_rsi_required': False, 'sideways_strategy': 'breakout', 'sideways_bb_std_mult': 2.8056446323348463, 'sideways_rsi_os': 26, 'sideways_rsi_ob': 56, 'sideways_adx_thresh': 27.51651579915752, 'sideways_atr_min_pct': 0.001603594290562981, 'sideways_atr_max_pct': 0.1276675369959882, 'sideways_tp_mult': 1.5613053315486949, 'sideways_tsl_mult': 0.0032184285256819933, 'sideways_time_stop': 67, 'sideways_use_sma': True, 'sideways_use_ema': False, 'sideways_use_atr': False, 'sideways_use_adx': False, 'sideways_use_spike': True, 'sideways_rsi_required': False}.
[I 2025-08-31 13:12:13,229] Trial 603 finished with values: [-0.060946453451187876, 0.06033221497893682] and parameters: {'p_sma': 51, 'p_std': 22, 'p_atr': 18, 'p_adx': 19, 'rsi_period': 50, 'ema1': 19, 'ema2': 18, 'slip_atr_k': 0.06490097220035643, 'slip_spread_k': 0.4386968654821505, 'spread_hl_frac': 0.017665138074779207, 'bb_std_mult': 2.326241089105297, 'rsi_os': 39, 'rsi_ob': 77, 'vol_spike': 0.022027859026936363, 'adx_thresh': 20.369994781739482, 'atr_min_pct': 0.0011551248206049468, 'atr_max_pct': 0.12552594356936614, 'tp_mult': 2.6666004915838957, 'tsl_mult': 0.0004385025619629522, 'strategy': 'breakout', 'time_stop': 171, 'use_sma': False, 'use_atr': False, 'use_adx': False, 'use_ema': True, 'use_spike': False, 'rsi_required': False, 'edge_k': 0.8086862107306203, 'edge_cap': 0.7641969174117809, 'bull_strategy': 'breakout', 'bull_bb_std_mult': 2.80551640494778, 'bull_rsi_os': 5, 'bull_rsi_ob': 50, 'bull_adx_thresh': 13.305360706431173, 'bull_atr_min_pct': 0.014342926670400529, 'bull_atr_max_pct': 0.14999906620751566, 'bull_tp_mult': 2.3343540400025082, 'bull_tsl_mult': 0.7525799610884161, 'bull_time_stop': 120, 'bull_use_sma': True, 'bull_use_ema': True, 'bull_use_atr': True, 'bull_use_adx': True, 'bull_use_spike': False, 'bull_rsi_required': False, 'bear_strategy': 'breakout', 'bear_bb_std_mult': 3.4536724594959027, 'bear_rsi_os': 36, 'bear_rsi_ob': 79, 'bear_adx_thresh': 20.885165020732916, 'bear_atr_min_pct': 0.0020869381789474406, 'bear_atr_max_pct': 0.06905498085530157, 'bear_tp_mult': 2.559302440036859, 'bear_tsl_mult': 0.3580256240117118, 'bear_time_stop': 49, 'bear_use_sma': True, 'bear_use_ema': True, 'bear_use_atr': True, 'bear_use_adx': True, 'bear_use_spike': True, 'bear_rsi_required': True, 'sideways_strategy': 'breakout', 'sideways_bb_std_mult': 2.5534674227455056, 'sideways_rsi_os': 31, 'sideways_rsi_ob': 56, 'sideways_adx_thresh': 26.742057391807588, 'sideways_atr_min_pct': 0.015190780182471678, 'sideways_atr_max_pct': 0.10952886141263393, 'sideways_tp_mult': 1.4941875791914196, 'sideways_tsl_mult': 0.04386209231231808, 'sideways_time_stop': 204, 'sideways_use_sma': True, 'sideways_use_ema': False, 'sideways_use_atr': False, 'sideways_use_adx': False, 'sideways_use_spike': True, 'sideways_rsi_required': True}.
