[I 2025-08-31 12:47:13,758] Trial 423 finished with values: [-1000000000.0, 1000000000.0] and parameters: {'p_sma': 28, 'p_std': 24, 'p_atr': 10, 'p_adx': 15, 'rsi_period': 48, 'ema1': 21, 'ema2': 16, 'slip_atr_k': 0.06354435948344747, 'slip_spread_k': 0.4267882220479975, 'spread_hl_frac': 0.01611326276784477, 'bb_std_mult': 2.3665471996535206, 'rsi_os': 53, 'rsi_ob': 77, 'vol_spike': 0.01951357731912492, 'adx_thresh': 18.321576725860282, 'atr_min_pct': 0.0022513455424812605, 'atr_max_pct': 0.12663673140010473, 'tp_mult': 2.7221768114603395, 'tsl_mult': 0.020602722034905947, 'strategy': 'breakout', 'time_stop': 164, 'use_sma': True, 'use_atr': True, 'use_adx': False, 'use_ema': True, 'use_spike': False, 'rsi_required': True, 'edge_k': 0.6194062251501927, 'edge_cap': 0.514030860264928, 'bull_strategy': 'breakout', 'bull_bb_std_mult': 1.3135703457954766, 'bull_rsi_os': 6, 'bull_rsi_ob': 50, 'bull_adx_thresh': 12.632746214977242, 'bull_atr_min_pct': 0.01987405896999584, 'bull_atr_max_pct': 0.14396284352327038, 'bull_tp_mult': 1.0425143516667712, 'bull_tsl_mult': 0.20311231774979635, 'bull_time_stop': 289, 'bull_use_sma': True, 'bull_use_ema': False, 'bull_use_atr': False, 'bull_use_adx': False, 'bull_use_spike': False, 'bull_rsi_required': False, 'bear_strategy': 'breakout', 'bear_bb_std_mult': 1.1028225360992026, 'bear_rsi_os': 28, 'bear_rsi_ob': 79, 'bear_adx_thresh': 14.228507163678994, 'bear_atr_min_pct': 0.002153314938576958, 'bear_atr_max_pct': 0.14954862418203618, 'bear_tp_mult': 2.881955294931609, 'bear_tsl_mult': 0.7607988378788084, 'bear_time_stop': 206, 'bear_use_sma': True, 'bear_use_ema': True, 'bear_use_atr': True, 'bear_use_adx': True, 'bear_use_spike': True, 'bear_rsi_required': False, 'sideways_strategy': 'breakout', 'sideways_bb_std_mult': 2.678750483065765, 'sideways_rsi_os': 30, 'sideways_rsi_ob': 66, 'sideways_adx_thresh': 24.93623201623118, 'sideways_atr_min_pct': 0.0059938916424383554, 'sideways_atr_max_pct': 0.12318620896597224, 'sideways_tp_mult': 1.6615594053275655, 'sideways_tsl_mult': 0.8113745305159759, 'sideways_time_stop': 269, 'sideways_use_sma': True, 'sideways_use_ema': False, 'sideways_use_atr': False, 'sideways_use_adx': False, 'sideways_use_spike': False, 'sideways_rsi_required': True}.
[I 2025-08-31 12:47:13,942] Trial 425 finished with values: [-1000000000.0, 1000000000.0] and parameters: {'p_sma': 16, 'p_std': 24, 'p_atr': 13, 'p_adx': 16, 'rsi_period': 50, 'ema1': 19, 'ema2': 17, 'slip_atr_k': 0.05474058677439634, 'slip_spread_k': 0.3980598692885895, 'spread_hl_frac': 0.01930490388164082, 'bb_std_mult': 2.3665952192004904, 'rsi_os': 37, 'rsi_ob': 77, 'vol_spike': 0.009210294085466137, 'adx_thresh': 20.269972302835573, 'atr_min_pct': 0.01330967714435548, 'atr_max_pct': 0.12325840343992572, 'tp_mult': 2.7001988970485082, 'tsl_mult': 0.0004742516931754634, 'strategy': 'breakout', 'time_stop': 164, 'use_sma': False, 'use_atr': True, 'use_adx': True, 'use_ema': True, 'use_spike': False, 'rsi_required': False, 'edge_k': 1.9646948851540043, 'edge_cap': 0.6520771445907486, 'bull_strategy': 'breakout', 'bull_bb_std_mult': 2.7821005343164105, 'bull_rsi_os': 6, 'bull_rsi_ob': 52, 'bull_adx_thresh': 15.33433834459987, 'bull_atr_min_pct': 0.020060910782567578, 'bull_atr_max_pct': 0.14969560597000278, 'bull_tp_mult': 1.0595883275758962, 'bull_tsl_mult': 0.19616297740783742, 'bull_time_stop': 288, 'bull_use_sma': True, 'bull_use_ema': True, 'bull_use_atr': False, 'bull_use_adx': True, 'bull_use_spike': True, 'bull_rsi_required': False, 'bear_strategy': 'breakout', 'bear_bb_std_mult': 3.2756611808760594, 'bear_rsi_os': 28, 'bear_rsi_ob': 54, 'bear_adx_thresh': 12.394084319432096, 'bear_atr_min_pct': 0.0024005603652241868, 'bear_atr_max_pct': 0.12525236892625344, 'bear_tp_mult': 2.456847265815126, 'bear_tsl_mult': 0.7226529989727727, 'bear_time_stop': 185, 'bear_use_sma': True, 'bear_use_ema': True, 'bear_use_atr': True, 'bear_use_adx': True, 'bear_use_spike': False, 'bear_rsi_required': False, 'sideways_strategy': 'breakout', 'sideways_bb_std_mult': 2.6619730603738847, 'sideways_rsi_os': 30, 'sideways_rsi_ob': 66, 'sideways_adx_thresh': 24.56219635832141, 'sideways_atr_min_pct': 0.002790779704063773, 'sideways_atr_max_pct': 0.12434425218681729, 'sideways_tp_mult': 1.7143983675488434, 'sideways_tsl_mult': 0.932691728347084, 'sideways_time_stop': 192, 'sideways_use_sma': True, 'sideways_use_ema': False, 'sideways_use_atr': False, 'sideways_use_adx': True, 'sideways_use_spike': False, 'sideways_rsi_required': True}.
[I 2025-08-31 12:47:14,455] Trial 424 finished with values: [-0.018783767388012906, 0.018455087661909255] and parameters: {'p_sma': 51, 'p_std': 24, 'p_atr': 7, 'p_adx': 16, 'rsi_period': 48, 'ema1': 21, 'ema2': 16, 'slip_atr_k': 0.06238373471696842, 'slip_spread_k': 0.406690925313845, 'spread_hl_frac': 0.018836389771123792, 'bb_std_mult': 2.3518174966466123, 'rsi_os': 51, 'rsi_ob': 77, 'vol_spike': 0.01827307587001055, 'adx_thresh': 18.491715247760244, 'atr_min_pct': 2.8314436646152815e-05, 'atr_max_pct': 0.1273265783446286, 'tp_mult': 2.2711873484426475, 'tsl_mult': 0.021431895578952902, 'strategy': 'breakout', 'time_stop': 165, 'use_sma': False, 'use_atr': True, 'use_adx': False, 'use_ema': True, 'use_spike': False, 'rsi_required': False, 'edge_k': 0.6198003351713306, 'edge_cap': 0.6305467785466241, 'bull_strategy': 'breakout', 'bull_bb_std_mult': 2.634579505831093, 'bull_rsi_os': 6, 'bull_rsi_ob': 52, 'bull_adx_thresh': 13.998160914847581, 'bull_atr_min_pct': 0.019922630169815537, 'bull_atr_max_pct': 0.14998109038842738, 'bull_tp_mult': 1.063238340118214, 'bull_tsl_mult': 0.20310836931650822, 'bull_time_stop': 291, 'bull_use_sma': True, 'bull_use_ema': False, 'bull_use_atr': False, 'bull_use_adx': False, 'bull_use_spike': False, 'bull_rsi_required': False, 'bear_strategy': 'breakout', 'bear_bb_std_mult': 3.206086477265569, 'bear_rsi_os': 28, 'bear_rsi_ob': 91, 'bear_adx_thresh': 14.255575026471458, 'bear_atr_min_pct': 0.002032467927284299, 'bear_atr_max_pct': 0.13975596186873504, 'bear_tp_mult': 2.8897190630390552, 'bear_tsl_mult': 0.7688388420283541, 'bear_time_stop': 208, 'bear_use_sma': True, 'bear_use_ema': True, 'bear_use_atr': True, 'bear_use_adx': True, 'bear_use_spike': True, 'bear_rsi_required': True, 'sideways_strategy': 'breakout', 'sideways_bb_std_mult': 2.660963270865841, 'sideways_rsi_os': 30, 'sideways_rsi_ob': 65, 'sideways_adx_thresh': 26.58327585713897, 'sideways_atr_min_pct': 0.002975276662294816, 'sideways_atr_max_pct': 0.12534080765054784, 'sideways_tp_mult': 1.6453722817658045, 'sideways_tsl_mult': 0.8385271362361271, 'sideways_time_stop': 193, 'sideways_use_sma': True, 'sideways_use_ema': False, 'sideways_use_atr': False, 'sideways_use_adx': False, 'sideways_use_spike': False, 'sideways_rsi_required': True}.
[I 2025-08-31 12:47:14,527] Trial 426 finished with values: [-1000000000.0, 1000000000.0] and parameters: {'p_sma': 54, 'p_std': 24, 'p_atr': 13, 'p_adx': 16, 'rsi_period': 49, 'ema1': 19, 'ema2': 17, 'slip_atr_k': 0.05624958095426571, 'slip_spread_k': 0.4038189232617278, 'spread_hl_frac': 0.018772584062823904, 'bb_std_mult': 2.3653225205097743, 'rsi_os': 37, 'rsi_ob': 77, 'vol_spike': 0.01682007234406386, 'adx_thresh': 20.473969646303424, 'atr_min_pct': 0.0012287488563442923, 'atr_max_pct': 0.12357593470456767, 'tp_mult': 2.7184403805347577, 'tsl_mult': 0.0001785693406394194, 'strategy': 'breakout', 'time_stop': 174, 'use_sma': False, 'use_atr': True, 'use_adx': True, 'use_ema': True, 'use_spike': False, 'rsi_required': False, 'edge_k': 1.3234764434599875, 'edge_cap': 0.6317239782841587, 'bull_strategy': 'breakout', 'bull_bb_std_mult': 2.813566571673351, 'bull_rsi_os': 6, 'bull_rsi_ob': 52, 'bull_adx_thresh': 21.311909293640753, 'bull_atr_min_pct': 0.020109778784103454, 'bull_atr_max_pct': 0.1498507515313958, 'bull_tp_mult': 1.0910356057958568, 'bull_tsl_mult': 0.20703543208332367, 'bull_time_stop': 276, 'bull_use_sma': True, 'bull_use_ema': True, 'bull_use_atr': False, 'bull_use_adx': True, 'bull_use_spike': True, 'bull_rsi_required': False, 'bear_strategy': 'breakout', 'bear_bb_std_mult': 3.173670837912605, 'bear_rsi_os': 28, 'bear_rsi_ob': 91, 'bear_adx_thresh': 12.359117802264041, 'bear_atr_min_pct': 0.002442640075174058, 'bear_atr_max_pct': 0.1408615222480461, 'bear_tp_mult': 1.3299648908759925, 'bear_tsl_mult': 0.7224290707368752, 'bear_time_stop': 184, 'bear_use_sma': True, 'bear_use_ema': True, 'bear_use_atr': True, 'bear_use_adx': True, 'bear_use_spike': False, 'bear_rsi_required': False, 'sideways_strategy': 'breakout', 'sideways_bb_std_mult': 2.663244586261366, 'sideways_rsi_os': 30, 'sideways_rsi_ob': 66, 'sideways_adx_thresh': 26.4543943951992, 'sideways_atr_min_pct': 0.017303232558219663, 'sideways_atr_max_pct': 0.05635228928069877, 'sideways_tp_mult': 1.7221106645067688, 'sideways_tsl_mult': 0.841894185474868, 'sideways_time_stop': 191, 'sideways_use_sma': True, 'sideways_use_ema': False, 'sideways_use_atr': False, 'sideways_use_adx': True, 'sideways_use_spike': False, 'sideways_rsi_required': True}.
[I 2025-08-31 12:47:46,894] Trial 427 finished with values: [-1000000000.0, 1000000000.0] and parameters: {'p_sma': 55, 'p_std': 24, 'p_atr': 7, 'p_adx': 16, 'rsi_period': 52, 'ema1': 19, 'ema2': 13, 'slip_atr_k': 0.2222647751524256, 'slip_spread_k': 0.4036682318170013, 'spread_hl_frac': 0.016362959412830256, 'bb_std_mult': 2.343570949039238, 'rsi_os': 37, 'rsi_ob': 77, 'vol_spike': 0.007934845594300924, 'adx_thresh': 20.340463212115246, 'atr_min_pct': 0.0002921755571072583, 'atr_max_pct': 0.12376347858698698, 'tp_mult': 2.2647215014174, 'tsl_mult': 0.0014440917004888733, 'strategy': 'breakout', 'time_stop': 173, 'use_sma': False, 'use_atr': True, 'use_adx': True, 'use_ema': True, 'use_spike': False, 'rsi_required': False, 'edge_k': 0.7336995318963978, 'edge_cap': 0.8229832730304213, 'bull_strategy': 'breakout', 'bull_bb_std_mult': 2.818087768155765, 'bull_rsi_os': 5, 'bull_rsi_ob': 52, 'bull_adx_thresh': 11.864554308627744, 'bull_atr_min_pct': 0.019925184052068036, 'bull_atr_max_pct': 0.14999535879546783, 'bull_tp_mult': 1.5747786969396897, 'bull_tsl_mult': 0.1947410688051547, 'bull_time_stop': 294, 'bull_use_sma': True, 'bull_use_ema': True, 'bull_use_atr': False, 'bull_use_adx': True, 'bull_use_spike': True, 'bull_rsi_required': False, 'bear_strategy': 'breakout', 'bear_bb_std_mult': 3.188858181628484, 'bear_rsi_os': 28, 'bear_rsi_ob': 71, 'bear_adx_thresh': 12.27482580218921, 'bear_atr_min_pct': 0.0010808342781751924, 'bear_atr_max_pct': 0.14088372608050617, 'bear_tp_mult': 2.8828246601268215, 'bear_tsl_mult': 0.7277338734773482, 'bear_time_stop': 183, 'bear_use_sma': True, 'bear_use_ema': True, 'bear_use_atr': True, 'bear_use_adx': True, 'bear_use_spike': False, 'bear_rsi_required': True, 'sideways_strategy': 'breakout', 'sideways_bb_std_mult': 2.628996239545005, 'sideways_rsi_os': 31, 'sideways_rsi_ob': 69, 'sideways_adx_thresh': 26.697606909960797, 'sideways_atr_min_pct': 0.003056130032868328, 'sideways_atr_max_pct': 0.029003861213474452, 'sideways_tp_mult': 1.7256189740225574, 'sideways_tsl_mult': 0.8365919629127434, 'sideways_time_stop': 195, 'sideways_use_sma': True, 'sideways_use_ema': False, 'sideways_use_atr': False, 'sideways_use_adx': True, 'sideways_use_spike': False, 'sideways_rsi_required': True}.
[I 2025-08-31 12:47:48,334] Trial 429 finished with values: [-1000000000.0, 1000000000.0] and parameters: {'p_sma': 49, 'p_std': 23, 'p_atr': 20, 'p_adx': 15, 'rsi_period': 52, 'ema1': 20, 'ema2': 50, 'slip_atr_k': 0.051251377016467474, 'slip_spread_k': 0.442573884930236, 'spread_hl_frac': 0.01635731443062781, 'bb_std_mult': 2.287365615374471, 'rsi_os': 5, 'rsi_ob': 79, 'vol_spike': 0.032228413642123664, 'adx_thresh': 19.835648128853926, 'atr_min_pct': 0.008199100770073424, 'atr_max_pct': 0.127872709724516, 'tp_mult': 2.652964789811917, 'tsl_mult': 0.06655617323773827, 'strategy': 'breakout', 'time_stop': 185, 'use_sma': True, 'use_atr': True, 'use_adx': False, 'use_ema': True, 'use_spike': False, 'rsi_required': True, 'edge_k': 0.006528642539694429, 'edge_cap': 0.8190697023699876, 'bull_strategy': 'breakout', 'bull_bb_std_mult': 2.700034429405569, 'bull_rsi_os': 5, 'bull_rsi_ob': 49, 'bull_adx_thresh': 16.489908925966034, 'bull_atr_min_pct': 0.019394511468118162, 'bull_atr_max_pct': 0.143807658413671, 'bull_tp_mult': 1.201911309998776, 'bull_tsl_mult': 0.1778409997980925, 'bull_time_stop': 295, 'bull_use_sma': True, 'bull_use_ema': True, 'bull_use_atr': False, 'bull_use_adx': True, 'bull_use_spike': False, 'bull_rsi_required': True, 'bear_strategy': 'breakout', 'bear_bb_std_mult': 3.115563796346661, 'bear_rsi_os': 27, 'bear_rsi_ob': 71, 'bear_adx_thresh': 13.19148674876238, 'bear_atr_min_pct': 0.0009894822418206033, 'bear_atr_max_pct': 0.1360073603528653, 'bear_tp_mult': 2.9459958034921807, 'bear_tsl_mult': 0.7877285259203491, 'bear_time_stop': 210, 'bear_use_sma': True, 'bear_use_ema': True, 'bear_use_atr': True, 'bear_use_adx': True, 'bear_use_spike': True, 'bear_rsi_required': True, 'sideways_strategy': 'mean_reversion', 'sideways_bb_std_mult': 2.5835397980782586, 'sideways_rsi_os': 27, 'sideways_rsi_ob': 68, 'sideways_adx_thresh': 28.2809527552314, 'sideways_atr_min_pct': 0.0030197065329406747, 'sideways_atr_max_pct': 0.02809211629658815, 'sideways_tp_mult': 1.6117217857279507, 'sideways_tsl_mult': 0.8716071602432827, 'sideways_time_stop': 198, 'sideways_use_sma': True, 'sideways_use_ema': True, 'sideways_use_atr': False, 'sideways_use_adx': False, 'sideways_use_spike': False, 'sideways_rsi_required': False}.
[I 2025-08-31 12:47:48,423] Trial 428 finished with values: [-1000000000.0, 1000000000.0] and parameters: {'p_sma': 55, 'p_std': 24, 'p_atr': 11, 'p_adx': 15, 'rsi_period': 52, 'ema1': 19, 'ema2': 12, 'slip_atr_k': 0.2214928312568788, 'slip_spread_k': 0.43584520884533273, 'spread_hl_frac': 0.018667865836996672, 'bb_std_mult': 2.301885445982736, 'rsi_os': 5, 'rsi_ob': 77, 'vol_spike': 0.013805782335617073, 'adx_thresh': 20.568460592583154, 'atr_min_pct': 0.019833118191273306, 'atr_max_pct': 0.12340527941358508, 'tp_mult': 2.6537472916945735, 'tsl_mult': 0.5681809173577402, 'strategy': 'breakout', 'time_stop': 174, 'use_sma': False, 'use_atr': True, 'use_adx': False, 'use_ema': True, 'use_spike': False, 'rsi_required': True, 'edge_k': 1.7677455363533054, 'edge_cap': 0.8236116829435398, 'bull_strategy': 'breakout', 'bull_bb_std_mult': 2.7865485091762596, 'bull_rsi_os': 5, 'bull_rsi_ob': 51, 'bull_adx_thresh': 21.29257916005951, 'bull_atr_min_pct': 0.01965678852628846, 'bull_atr_max_pct': 0.13883856218331408, 'bull_tp_mult': 1.136407569819601, 'bull_tsl_mult': 0.21564053452668658, 'bull_time_stop': 276, 'bull_use_sma': True, 'bull_use_ema': True, 'bull_use_atr': False, 'bull_use_adx': True, 'bull_use_spike': False, 'bull_rsi_required': False, 'bear_strategy': 'breakout', 'bear_bb_std_mult': 3.1517681701575047, 'bear_rsi_os': 27, 'bear_rsi_ob': 71, 'bear_adx_thresh': 15.052414117421588, 'bear_atr_min_pct': 0.0011989943859666064, 'bear_atr_max_pct': 0.13965014501113293, 'bear_tp_mult': 1.3265424449917342, 'bear_tsl_mult': 0.7328491722213046, 'bear_time_stop': 208, 'bear_use_sma': True, 'bear_use_ema': True, 'bear_use_atr': True, 'bear_use_adx': True, 'bear_use_spike': True, 'bear_rsi_required': True, 'sideways_strategy': 'mean_reversion', 'sideways_bb_std_mult': 2.590400474538398, 'sideways_rsi_os': 31, 'sideways_rsi_ob': 68, 'sideways_adx_thresh': 26.421256256880937, 'sideways_atr_min_pct': 0.009528027960082808, 'sideways_atr_max_pct': 0.12933571147697048, 'sideways_tp_mult': 1.585153641750953, 'sideways_tsl_mult': 0.8454436879236168, 'sideways_time_stop': 197, 'sideways_use_sma': True, 'sideways_use_ema': True, 'sideways_use_atr': False, 'sideways_use_adx': False, 'sideways_use_spike': False, 'sideways_rsi_required': False}.
[I 2025-08-31 12:47:48,775] Trial 430 finished with values: [-1000000000.0, 1000000000.0] and parameters: {'p_sma': 53, 'p_std': 23, 'p_atr': 7, 'p_adx': 15, 'rsi_period': 52, 'ema1': 20, 'ema2': 13, 'slip_atr_k': 0.048844531381156776, 'slip_spread_k': 0.43372019566614617, 'spread_hl_frac': 0.016325751314973404, 'bb_std_mult': 2.2673549809321143, 'rsi_os': 25, 'rsi_ob': 79, 'vol_spike': 0.03399016781824865, 'adx_thresh': 19.778405215152738, 'atr_min_pct': 0.00011144025093639577, 'atr_max_pct': 0.11675670414493677, 'tp_mult': 2.2667832495103646, 'tsl_mult': 0.979320968112283, 'strategy': 'breakout', 'time_stop': 185, 'use_sma': True, 'use_atr': True, 'use_adx': False, 'use_ema': True, 'use_spike': False, 'rsi_required': True, 'edge_k': 1.7693298348657294, 'edge_cap': 0.8163905759741013, 'bull_strategy': 'breakout', 'bull_bb_std_mult': 2.2079243817865524, 'bull_rsi_os': 5, 'bull_rsi_ob': 49, 'bull_adx_thresh': 18.71939911002889, 'bull_atr_min_pct': 0.019458983164206425, 'bull_atr_max_pct': 0.13924921847706534, 'bull_tp_mult': 1.553285290666781, 'bull_tsl_mult': 0.1800948847827131, 'bull_time_stop': 276, 'bull_use_sma': True, 'bull_use_ema': True, 'bull_use_atr': False, 'bull_use_adx': True, 'bull_use_spike': False, 'bull_rsi_required': True, 'bear_strategy': 'breakout', 'bear_bb_std_mult': 3.1277089512804572, 'bear_rsi_os': 27, 'bear_rsi_ob': 71, 'bear_adx_thresh': 14.926050049730598, 'bear_atr_min_pct': 0.0010065452979388775, 'bear_atr_max_pct': 0.1382031643416951, 'bear_tp_mult': 2.947116687109112, 'bear_tsl_mult': 0.7812995971057822, 'bear_time_stop': 210, 'bear_use_sma': True, 'bear_use_ema': True, 'bear_use_atr': True, 'bear_use_adx': True, 'bear_use_spike': True, 'bear_rsi_required': True, 'sideways_strategy': 'mean_reversion', 'sideways_bb_std_mult': 2.593540031678298, 'sideways_rsi_os': 31, 'sideways_rsi_ob': 68, 'sideways_adx_thresh': 28.41751910768425, 'sideways_atr_min_pct': 0.022474041269333094, 'sideways_atr_max_pct': 0.1287381782636431, 'sideways_tp_mult': 1.605266925382613, 'sideways_tsl_mult': 0.8738684044626502, 'sideways_time_stop': 209, 'sideways_use_sma': True, 'sideways_use_ema': True, 'sideways_use_atr': False, 'sideways_use_adx': False, 'sideways_use_spike': False, 'sideways_rsi_required': False}.
[I 2025-08-31 12:48:22,322] Trial 433 finished with values: [-1000000000.0, 1000000000.0] and parameters: {'p_sma': 51, 'p_std': 25, 'p_atr': 12, 'p_adx': 14, 'rsi_period': 50, 'ema1': 20, 'ema2': 42, 'slip_atr_k': 0.059865182410121634, 'slip_spread_k': 0.3871056751195461, 'spread_hl_frac': 0.016770306593719694, 'bb_std_mult': 2.2382678535996945, 'rsi_os': 39, 'rsi_ob': 79, 'vol_spike': 0.03680616227449578, 'adx_thresh': 19.422057379093946, 'atr_min_pct': 0.005822284427242103, 'atr_max_pct': 0.12073013142606646, 'tp_mult': 2.077870864845811, 'tsl_mult': 0.2540057947070084, 'strategy': 'breakout', 'time_stop': 183, 'use_sma': False, 'use_atr': True, 'use_adx': False, 'use_ema': True, 'use_spike': False, 'rsi_required': True, 'edge_k': 0.9687516735923194, 'edge_cap': 0.8072609997111153, 'bull_strategy': 'mean_reversion', 'bull_bb_std_mult': 2.2207497950934085, 'bull_rsi_os': 7, 'bull_rsi_ob': 49, 'bull_adx_thresh': 16.928115184299305, 'bull_atr_min_pct': 0.018518590927219872, 'bull_atr_max_pct': 0.14458197251005064, 'bull_tp_mult': 1.1631241867108912, 'bull_tsl_mult': 0.21598992246525192, 'bull_time_stop': 284, 'bull_use_sma': False, 'bull_use_ema': True, 'bull_use_atr': False, 'bull_use_adx': True, 'bull_use_spike': False, 'bull_rsi_required': True, 'bear_strategy': 'breakout', 'bear_bb_std_mult': 2.9626824024522755, 'bear_rsi_os': 29, 'bear_rsi_ob': 67, 'bear_adx_thresh': 11.591127490778858, 'bear_atr_min_pct': 0.0033659030651750042, 'bear_atr_max_pct': 0.13150756119283397, 'bear_tp_mult': 2.909716810502887, 'bear_tsl_mult': 0.7582091193395024, 'bear_time_stop': 200, 'bear_use_sma': True, 'bear_use_ema': True, 'bear_use_atr': True, 'bear_use_adx': True, 'bear_use_spike': True, 'bear_rsi_required': True, 'sideways_strategy': 'breakout', 'sideways_bb_std_mult': 2.50602812620453, 'sideways_rsi_os': 28, 'sideways_rsi_ob': 67, 'sideways_adx_thresh': 27.419599522020174, 'sideways_atr_min_pct': 0.023557136700962156, 'sideways_atr_max_pct': 0.09348857219071297, 'sideways_tp_mult': 1.543745193967125, 'sideways_tsl_mult': 0.8801464273200583, 'sideways_time_stop': 294, 'sideways_use_sma': True, 'sideways_use_ema': False, 'sideways_use_atr': False, 'sideways_use_adx': False, 'sideways_use_spike': True, 'sideways_rsi_required': True}.
