[I 2025-08-31 13:04:14,547] Trial 549 finished with values: [-0.09978303637214536, 0.09959823674761503] and parameters: {'p_sma': 50, 'p_std': 25, 'p_atr': 13, 'p_adx': 16, 'rsi_period': 52, 'ema1': 23, 'ema2': 18, 'slip_atr_k': 0.12819882283903627, 'slip_spread_k': 0.39123305582916923, 'spread_hl_frac': 0.008440337740786452, 'bb_std_mult': 2.138079542325749, 'rsi_os': 40, 'rsi_ob': 85, 'vol_spike': 0.16174560995121715, 'adx_thresh': 25.188009860192782, 'atr_min_pct': 0.008579573966612804, 'atr_max_pct': 0.12671454747226538, 'tp_mult': 2.6335723677711087, 'tsl_mult': 0.9382174097235767, 'strategy': 'breakout', 'time_stop': 9, 'use_sma': True, 'use_atr': False, 'use_adx': True, 'use_ema': True, 'use_spike': True, 'rsi_required': True, 'edge_k': 0.9183471392184474, 'edge_cap': 0.7028529263527351, 'bull_strategy': 'mean_reversion', 'bull_bb_std_mult': 2.863430838773172, 'bull_rsi_os': 27, 'bull_rsi_ob': 75, 'bull_adx_thresh': 25.36520246135818, 'bull_atr_min_pct': 0.020201975749454225, 'bull_atr_max_pct': 0.04987012278859456, 'bull_tp_mult': 1.3320238046640325, 'bull_tsl_mult': 0.18109562437051102, 'bull_time_stop': 281, 'bull_use_sma': True, 'bull_use_ema': True, 'bull_use_atr': False, 'bull_use_adx': False, 'bull_use_spike': False, 'bull_rsi_required': False, 'bear_strategy': 'breakout', 'bear_bb_std_mult': 3.1014549606653135, 'bear_rsi_os': 26, 'bear_rsi_ob': 71, 'bear_adx_thresh': 20.33413968326553, 'bear_atr_min_pct': 0.0013240213977655287, 'bear_atr_max_pct': 0.12715263816556904, 'bear_tp_mult': 2.998445963527189, 'bear_tsl_mult': 0.8019133206238853, 'bear_time_stop': 176, 'bear_use_sma': True, 'bear_use_ema': False, 'bear_use_atr': False, 'bear_use_adx': False, 'bear_use_spike': True, 'bear_rsi_required': False, 'sideways_strategy': 'mean_reversion', 'sideways_bb_std_mult': 2.583992109861645, 'sideways_rsi_os': 31, 'sideways_rsi_ob': 51, 'sideways_adx_thresh': 5.936655783021546, 'sideways_atr_min_pct': 0.0020242580012182197, 'sideways_atr_max_pct': 0.10496905487388752, 'sideways_tp_mult': 1.782726807897878, 'sideways_tsl_mult': 0.8533025918303999, 'sideways_time_stop': 147, 'sideways_use_sma': False, 'sideways_use_ema': False, 'sideways_use_atr': True, 'sideways_use_adx': False, 'sideways_use_spike': True, 'sideways_rsi_required': True}.
[I 2025-08-31 13:04:49,013] Trial 552 finished with values: [-0.11546926730276519, 0.11528675329904466] and parameters: {'p_sma': 50, 'p_std': 25, 'p_atr': 13, 'p_adx': 28, 'rsi_period': 26, 'ema1': 14, 'ema2': 31, 'slip_atr_k': 0.06761224363933026, 'slip_spread_k': 0.4114723222227278, 'spread_hl_frac': 0.008381735398224364, 'bb_std_mult': 2.211186916176568, 'rsi_os': 25, 'rsi_ob': 91, 'vol_spike': 0.015852634760540132, 'adx_thresh': 6.02006665965177, 'atr_min_pct': 0.006215589343880491, 'atr_max_pct': 0.127822855247021, 'tp_mult': 2.752933009871379, 'tsl_mult': 0.016910574690298528, 'strategy': 'breakout', 'time_stop': 176, 'use_sma': True, 'use_atr': True, 'use_adx': True, 'use_ema': True, 'use_spike': True, 'rsi_required': True, 'edge_k': 0.7110643822645161, 'edge_cap': 0.7364833395075783, 'bull_strategy': 'breakout', 'bull_bb_std_mult': 2.8681818869686126, 'bull_rsi_os': 5, 'bull_rsi_ob': 74, 'bull_adx_thresh': 13.98463885800742, 'bull_atr_min_pct': 0.0036235301354990146, 'bull_atr_max_pct': 0.048975277584356464, 'bull_tp_mult': 1.2520452806234987, 'bull_tsl_mult': 0.22867610903710578, 'bull_time_stop': 279, 'bull_use_sma': True, 'bull_use_ema': True, 'bull_use_atr': True, 'bull_use_adx': False, 'bull_use_spike': False, 'bull_rsi_required': False, 'bear_strategy': 'mean_reversion', 'bear_bb_std_mult': 0.8821924201854658, 'bear_rsi_os': 30, 'bear_rsi_ob': 50, 'bear_adx_thresh': 5.585621700228771, 'bear_atr_min_pct': 0.0024333720033142907, 'bear_atr_max_pct': 0.12172940438669913, 'bear_tp_mult': 1.1342040132790503, 'bear_tsl_mult': 0.4936256871417966, 'bear_time_stop': 191, 'bear_use_sma': True, 'bear_use_ema': False, 'bear_use_atr': False, 'bear_use_adx': False, 'bear_use_spike': True, 'bear_rsi_required': False, 'sideways_strategy': 'breakout', 'sideways_bb_std_mult': 2.7369265609612317, 'sideways_rsi_os': 31, 'sideways_rsi_ob': 51, 'sideways_adx_thresh': 25.781338258457215, 'sideways_atr_min_pct': 0.0018376006075019376, 'sideways_atr_max_pct': 0.11859016810684919, 'sideways_tp_mult': 2.3850882259453603, 'sideways_tsl_mult': 0.845738054676867, 'sideways_time_stop': 183, 'sideways_use_sma': True, 'sideways_use_ema': False, 'sideways_use_atr': True, 'sideways_use_adx': False, 'sideways_use_spike': True, 'sideways_rsi_required': True}.
[I 2025-08-31 13:04:49,126] Trial 550 finished with values: [-0.1119065686538071, 0.11165561408979621] and parameters: {'p_sma': 50, 'p_std': 25, 'p_atr': 13, 'p_adx': 21, 'rsi_period': 50, 'ema1': 23, 'ema2': 31, 'slip_atr_k': 0.06048458307406523, 'slip_spread_k': 0.4141980559699277, 'spread_hl_frac': 0.015069122363372793, 'bb_std_mult': 2.205976315535236, 'rsi_os': 22, 'rsi_ob': 78, 'vol_spike': 0.030643277749850734, 'adx_thresh': 9.610421290346446, 'atr_min_pct': 0.007899685215121152, 'atr_max_pct': 0.12711588776910748, 'tp_mult': 2.4476231185336124, 'tsl_mult': 0.40000933028925834, 'strategy': 'breakout', 'time_stop': 174, 'use_sma': False, 'use_atr': True, 'use_adx': False, 'use_ema': True, 'use_spike': False, 'rsi_required': True, 'edge_k': 1.3715182875725098, 'edge_cap': 0.9866755219998766, 'bull_strategy': 'breakout', 'bull_bb_std_mult': 2.3797619286630605, 'bull_rsi_os': 45, 'bull_rsi_ob': 52, 'bull_adx_thresh': 13.987082152794338, 'bull_atr_min_pct': 0.02511395696398413, 'bull_atr_max_pct': 0.14838120498517385, 'bull_tp_mult': 1.3608155670319624, 'bull_tsl_mult': 0.24164810456437685, 'bull_time_stop': 12, 'bull_use_sma': True, 'bull_use_ema': True, 'bull_use_atr': True, 'bull_use_adx': False, 'bull_use_spike': False, 'bull_rsi_required': False, 'bear_strategy': 'mean_reversion', 'bear_bb_std_mult': 3.1083333853349626, 'bear_rsi_os': 30, 'bear_rsi_ob': 71, 'bear_adx_thresh': 16.540483386250344, 'bear_atr_min_pct': 0.0024194561658858562, 'bear_atr_max_pct': 0.1460591744997806, 'bear_tp_mult': 2.840829646892621, 'bear_tsl_mult': 0.23296999144910324, 'bear_time_stop': 193, 'bear_use_sma': True, 'bear_use_ema': False, 'bear_use_atr': True, 'bear_use_adx': True, 'bear_use_spike': True, 'bear_rsi_required': False, 'sideways_strategy': 'breakout', 'sideways_bb_std_mult': 2.592372913729243, 'sideways_rsi_os': 54, 'sideways_rsi_ob': 51, 'sideways_adx_thresh': 25.881191632081116, 'sideways_atr_min_pct': 0.0016844670383751898, 'sideways_atr_max_pct': 0.13752606922492444, 'sideways_tp_mult': 1.548520376885735, 'sideways_tsl_mult': 0.8564909656624199, 'sideways_time_stop': 147, 'sideways_use_sma': True, 'sideways_use_ema': False, 'sideways_use_atr': False, 'sideways_use_adx': False, 'sideways_use_spike': True, 'sideways_rsi_required': True}.
[I 2025-08-31 13:04:49,254] Trial 551 finished with values: [-0.05909653014257821, 0.05885510307245667] and parameters: {'p_sma': 50, 'p_std': 25, 'p_atr': 13, 'p_adx': 24, 'rsi_period': 13, 'ema1': 23, 'ema2': 31, 'slip_atr_k': 0.060355078655054135, 'slip_spread_k': 0.4174553596158708, 'spread_hl_frac': 0.015549413695574986, 'bb_std_mult': 2.129336502733353, 'rsi_os': 46, 'rsi_ob': 78, 'vol_spike': 0.11218104593446018, 'adx_thresh': 9.753892976851429, 'atr_min_pct': 0.007597936114632186, 'atr_max_pct': 0.12929345673673484, 'tp_mult': 2.73536515015522, 'tsl_mult': 0.019501965926002826, 'strategy': 'breakout', 'time_stop': 10, 'use_sma': False, 'use_atr': True, 'use_adx': False, 'use_ema': True, 'use_spike': False, 'rsi_required': True, 'edge_k': 0.8942327973812104, 'edge_cap': 0.7483379607972714, 'bull_strategy': 'breakout', 'bull_bb_std_mult': 2.8623622489994776, 'bull_rsi_os': 45, 'bull_rsi_ob': 45, 'bull_adx_thresh': 13.797751473881178, 'bull_atr_min_pct': 0.007820951060685293, 'bull_atr_max_pct': 0.14716583224350707, 'bull_tp_mult': 2.3847282105105685, 'bull_tsl_mult': 0.23752297107191542, 'bull_time_stop': 279, 'bull_use_sma': True, 'bull_use_ema': True, 'bull_use_atr': True, 'bull_use_adx': False, 'bull_use_spike': False, 'bull_rsi_required': False, 'bear_strategy': 'mean_reversion', 'bear_bb_std_mult': 3.0695435732058147, 'bear_rsi_os': 30, 'bear_rsi_ob': 90, 'bear_adx_thresh': 20.350098590627358, 'bear_atr_min_pct': 0.0024321573418532604, 'bear_atr_max_pct': 0.134959905915288, 'bear_tp_mult': 1.6135041814069782, 'bear_tsl_mult': 0.7483982942514753, 'bear_time_stop': 193, 'bear_use_sma': True, 'bear_use_ema': False, 'bear_use_atr': True, 'bear_use_adx': True, 'bear_use_spike': True, 'bear_rsi_required': False, 'sideways_strategy': 'breakout', 'sideways_bb_std_mult': 2.760572363034338, 'sideways_rsi_os': 30, 'sideways_rsi_ob': 52, 'sideways_adx_thresh': 25.89746455087101, 'sideways_atr_min_pct': 0.001933803280820844, 'sideways_atr_max_pct': 0.13634984276311266, 'sideways_tp_mult': 1.551357732897114, 'sideways_tsl_mult': 0.8516720888034678, 'sideways_time_stop': 205, 'sideways_use_sma': True, 'sideways_use_ema': False, 'sideways_use_atr': False, 'sideways_use_adx': False, 'sideways_use_spike': True, 'sideways_rsi_required': True}.
[I 2025-08-31 13:04:49,644] Trial 553 finished with values: [-0.04898843251772067, 0.04920597909840761] and parameters: {'p_sma': 42, 'p_std': 36, 'p_atr': 11, 'p_adx': 22, 'rsi_period': 20, 'ema1': 20, 'ema2': 31, 'slip_atr_k': 0.06736396624481857, 'slip_spread_k': 0.41232788289270944, 'spread_hl_frac': 0.015425224150570526, 'bb_std_mult': 2.219815733236658, 'rsi_os': 7, 'rsi_ob': 78, 'vol_spike': 0.030959780043659936, 'adx_thresh': 32.27970701234286, 'atr_min_pct': 0.0021448713600373, 'atr_max_pct': 0.1275012312212481, 'tp_mult': 2.9592481183347275, 'tsl_mult': 0.018894131354214104, 'strategy': 'breakout', 'time_stop': 61, 'use_sma': False, 'use_atr': True, 'use_adx': False, 'use_ema': True, 'use_spike': False, 'rsi_required': True, 'edge_k': 0.7201248414271071, 'edge_cap': 0.7447343556851655, 'bull_strategy': 'breakout', 'bull_bb_std_mult': 2.7561012542246117, 'bull_rsi_os': 45, 'bull_rsi_ob': 68, 'bull_adx_thresh': 14.577720673607057, 'bull_atr_min_pct': 0.02663178626297925, 'bull_atr_max_pct': 0.14763195421516806, 'bull_tp_mult': 2.387735233466314, 'bull_tsl_mult': 0.5779549342202234, 'bull_time_stop': 280, 'bull_use_sma': True, 'bull_use_ema': False, 'bull_use_atr': True, 'bull_use_adx': False, 'bull_use_spike': False, 'bull_rsi_required': False, 'bear_strategy': 'mean_reversion', 'bear_bb_std_mult': 0.8621361122869746, 'bear_rsi_os': 30, 'bear_rsi_ob': 48, 'bear_adx_thresh': 16.642916274311226, 'bear_atr_min_pct': 0.002314416566484007, 'bear_atr_max_pct': 0.12143407225943517, 'bear_tp_mult': 2.85169992247202, 'bear_tsl_mult': 0.3231035768532979, 'bear_time_stop': 192, 'bear_use_sma': True, 'bear_use_ema': True, 'bear_use_atr': True, 'bear_use_adx': True, 'bear_use_spike': True, 'bear_rsi_required': True, 'sideways_strategy': 'breakout', 'sideways_bb_std_mult': 2.8837208751811403, 'sideways_rsi_os': 29, 'sideways_rsi_ob': 54, 'sideways_adx_thresh': 27.62557657309393, 'sideways_atr_min_pct': 0.0026437515098394, 'sideways_atr_max_pct': 0.12343305886698284, 'sideways_tp_mult': 1.970337889129193, 'sideways_tsl_mult': 0.8840267106877383, 'sideways_time_stop': 230, 'sideways_use_sma': True, 'sideways_use_ema': True, 'sideways_use_atr': False, 'sideways_use_adx': False, 'sideways_use_spike': True, 'sideways_rsi_required': False}.
[I 2025-08-31 13:05:23,071] Trial 556 finished with values: [-1000000000.0, 1000000000.0] and parameters: {'p_sma': 52, 'p_std': 5, 'p_atr': 11, 'p_adx': 25, 'rsi_period': 40, 'ema1': 20, 'ema2': 12, 'slip_atr_k': 0.05353574385384699, 'slip_spread_k': 0.37121033767052247, 'spread_hl_frac': 0.018071846317370452, 'bb_std_mult': 2.6602010654463695, 'rsi_os': 38, 'rsi_ob': 81, 'vol_spike': 0.030096960113183094, 'adx_thresh': 19.349341049321882, 'atr_min_pct': 0.0021275817340055876, 'atr_max_pct': 0.12157885587525567, 'tp_mult': 1.2316329600853664, 'tsl_mult': 0.035943305062997505, 'strategy': 'breakout', 'time_stop': 157, 'use_sma': False, 'use_atr': True, 'use_adx': False, 'use_ema': True, 'use_spike': False, 'rsi_required': True, 'edge_k': 0.5921323025122394, 'edge_cap': 0.7377156277009791, 'bull_strategy': 'breakout', 'bull_bb_std_mult': 2.78454027076896, 'bull_rsi_os': 41, 'bull_rsi_ob': 64, 'bull_adx_thresh': 32.57038224066835, 'bull_atr_min_pct': 0.02794271495749758, 'bull_atr_max_pct': 0.14774172156954674, 'bull_tp_mult': 1.6284132465021863, 'bull_tsl_mult': 0.6486293337413793, 'bull_time_stop': 220, 'bull_use_sma': True, 'bull_use_ema': False, 'bull_use_atr': False, 'bull_use_adx': True, 'bull_use_spike': False, 'bull_rsi_required': False, 'bear_strategy': 'breakout', 'bear_bb_std_mult': 1.3833314764408877, 'bear_rsi_os': 29, 'bear_rsi_ob': 47, 'bear_adx_thresh': 13.800097304221639, 'bear_atr_min_pct': 0.001747087835915165, 'bear_atr_max_pct': 0.13709760548698202, 'bear_tp_mult': 2.849041623543761, 'bear_tsl_mult': 0.7241741077418123, 'bear_time_stop': 204, 'bear_use_sma': True, 'bear_use_ema': True, 'bear_use_atr': True, 'bear_use_adx': True, 'bear_use_spike': True, 'bear_rsi_required': True, 'sideways_strategy': 'breakout', 'sideways_bb_std_mult': 2.6669082653246754, 'sideways_rsi_os': 29, 'sideways_rsi_ob': 75, 'sideways_adx_thresh': 27.86184384724187, 'sideways_atr_min_pct': 0.022066603118619486, 'sideways_atr_max_pct': 0.12397468432548642, 'sideways_tp_mult': 1.6634312820341184, 'sideways_tsl_mult': 0.5040936806610683, 'sideways_time_stop': 194, 'sideways_use_sma': True, 'sideways_use_ema': True, 'sideways_use_atr': False, 'sideways_use_adx': False, 'sideways_use_spike': False, 'sideways_rsi_required': False}.
[I 2025-08-31 13:05:23,779] Trial 555 finished with values: [-1000000000.0, 1000000000.0] and parameters: {'p_sma': 52, 'p_std': 37, 'p_atr': 11, 'p_adx': 25, 'rsi_period': 21, 'ema1': 20, 'ema2': 13, 'slip_atr_k': 0.05341821938143946, 'slip_spread_k': 0.43462720154500084, 'spread_hl_frac': 0.00307974455622231, 'bb_std_mult': 3.355463114939935, 'rsi_os': 30, 'rsi_ob': 87, 'vol_spike': 0.029340801804458493, 'adx_thresh': 19.3379752260025, 'atr_min_pct': 0.002089157723245436, 'atr_max_pct': 0.12139063744190631, 'tp_mult': 2.679920880657647, 'tsl_mult': 0.0354680388877632, 'strategy': 'breakout', 'time_stop': 155, 'use_sma': False, 'use_atr': True, 'use_adx': False, 'use_ema': True, 'use_spike': False, 'rsi_required': True, 'edge_k': 0.7258240013432562, 'edge_cap': 0.7369492952459958, 'bull_strategy': 'breakout', 'bull_bb_std_mult': 2.7823246979666987, 'bull_rsi_os': 38, 'bull_rsi_ob': 64, 'bull_adx_thresh': 14.717641044010767, 'bull_atr_min_pct': 0.020873314005904198, 'bull_atr_max_pct': 0.14735072981199135, 'bull_tp_mult': 1.231705213057917, 'bull_tsl_mult': 0.25259620113348924, 'bull_time_stop': 300, 'bull_use_sma': True, 'bull_use_ema': False, 'bull_use_atr': False, 'bull_use_adx': True, 'bull_use_spike': False, 'bull_rsi_required': False, 'bear_strategy': 'breakout', 'bear_bb_std_mult': 3.2793525550795644, 'bear_rsi_os': 45, 'bear_rsi_ob': 67, 'bear_adx_thresh': 7.415870941085837, 'bear_atr_min_pct': 0.009244548552640418, 'bear_atr_max_pct': 0.13709318306765284, 'bear_tp_mult': 2.9263382046843063, 'bear_tsl_mult': 0.32283871724775237, 'bear_time_stop': 207, 'bear_use_sma': True, 'bear_use_ema': True, 'bear_use_atr': True, 'bear_use_adx': True, 'bear_use_spike': True, 'bear_rsi_required': True, 'sideways_strategy': 'breakout', 'sideways_bb_std_mult': 1.4788518665188115, 'sideways_rsi_os': 45, 'sideways_rsi_ob': 66, 'sideways_adx_thresh': 27.885719184820537, 'sideways_atr_min_pct': 0.004667123384292678, 'sideways_atr_max_pct': 0.09181078471059875, 'sideways_tp_mult': 2.317496021246317, 'sideways_tsl_mult': 0.8835503753762601, 'sideways_time_stop': 195, 'sideways_use_sma': True, 'sideways_use_ema': True, 'sideways_use_atr': False, 'sideways_use_adx': False, 'sideways_use_spike': False, 'sideways_rsi_required': False}.
[I 2025-08-31 13:05:23,859] Trial 554 finished with values: [-1000000000.0, 1000000000.0] and parameters: {'p_sma': 52, 'p_std': 37, 'p_atr': 25, 'p_adx': 26, 'rsi_period': 57, 'ema1': 19, 'ema2': 12, 'slip_atr_k': 0.060876730021124204, 'slip_spread_k': 0.30942936949461863, 'spread_hl_frac': 0.01536406736808056, 'bb_std_mult': 2.524645224936373, 'rsi_os': 19, 'rsi_ob': 78, 'vol_spike': 0.17892326625663885, 'adx_thresh': 9.929214625464837, 'atr_min_pct': 0.018816925675870157, 'atr_max_pct': 0.12324404525619755, 'tp_mult': 2.727790645187327, 'tsl_mult': 0.37953843685314625, 'strategy': 'breakout', 'time_stop': 181, 'use_sma': False, 'use_atr': True, 'use_adx': False, 'use_ema': True, 'use_spike': False, 'rsi_required': True, 'edge_k': 0.7209746569262727, 'edge_cap': 0.7427175244417928, 'bull_strategy': 'breakout', 'bull_bb_std_mult': 2.7961167291445506, 'bull_rsi_os': 6, 'bull_rsi_ob': 52, 'bull_adx_thresh': 15.025443636491458, 'bull_atr_min_pct': 0.026578226409063408, 'bull_atr_max_pct': 0.14999873707178643, 'bull_tp_mult': 1.8703435910347719, 'bull_tsl_mult': 0.2454021147613189, 'bull_time_stop': 187, 'bull_use_sma': True, 'bull_use_ema': False, 'bull_use_atr': True, 'bull_use_adx': True, 'bull_use_spike': False, 'bull_rsi_required': False, 'bear_strategy': 'breakout', 'bear_bb_std_mult': 1.8335626847490203, 'bear_rsi_os': 30, 'bear_rsi_ob': 47, 'bear_adx_thresh': 13.81538420315761, 'bear_atr_min_pct': 0.012935680525922501, 'bear_atr_max_pct': 0.13543239385080982, 'bear_tp_mult': 2.8518178398195015, 'bear_tsl_mult': 0.23793232671119657, 'bear_time_stop': 206, 'bear_use_sma': True, 'bear_use_ema': True, 'bear_use_atr': True, 'bear_use_adx': True, 'bear_use_spike': True, 'bear_rsi_required': True, 'sideways_strategy': 'breakout', 'sideways_bb_std_mult': 2.65232708196186, 'sideways_rsi_os': 5, 'sideways_rsi_ob': 69, 'sideways_adx_thresh': 27.843125600361198, 'sideways_atr_min_pct': 0.0025905553315389057, 'sideways_atr_max_pct': 0.09201067504896103, 'sideways_tp_mult': 1.5388587978272026, 'sideways_tsl_mult': 0.8872042987399884, 'sideways_time_stop': 111, 'sideways_use_sma': True, 'sideways_use_ema': True, 'sideways_use_atr': False, 'sideways_use_adx': False, 'sideways_use_spike': False, 'sideways_rsi_required': False}.
[I 2025-08-31 13:05:23,976] Trial 557 finished with values: [-1000000000.0, 1000000000.0] and parameters: {'p_sma': 55, 'p_std': 5, 'p_atr': 18, 'p_adx': 14, 'rsi_period': 36, 'ema1': 30, 'ema2': 49, 'slip_atr_k': 0.0534859928473488, 'slip_spread_k': 0.4434094493535951, 'spread_hl_frac': 0.0033753658558038427, 'bb_std_mult': 2.5389382023094655, 'rsi_os': 19, 'rsi_ob': 87, 'vol_spike': 0.012769493251035248, 'adx_thresh': 19.361798864401607, 'atr_min_pct': 0.0124414177775319, 'atr_max_pct': 0.12218574963599149, 'tp_mult': 1.220066567903206, 'tsl_mult': 3.3048224870484144e-05, 'strategy': 'breakout', 'time_stop': 157, 'use_sma': False, 'use_atr': True, 'use_adx': False, 'use_ema': True, 'use_spike': False, 'rsi_required': True, 'edge_k': 0.6046207014401412, 'edge_cap': 0.7166614653739589, 'bull_strategy': 'breakout', 'bull_bb_std_mult': 2.793703668175456, 'bull_rsi_os': 38, 'bull_rsi_ob': 50, 'bull_adx_thresh': 34.00213572449579, 'bull_atr_min_pct': 0.014807920802871721, 'bull_atr_max_pct': 0.1343532724501414, 'bull_tp_mult': 1.8587240632388353, 'bull_tsl_mult': 0.1955477550933592, 'bull_time_stop': 291, 'bull_use_sma': True, 'bull_use_ema': False, 'bull_use_atr': False, 'bull_use_adx': True, 'bull_use_spike': False, 'bull_rsi_required': False, 'bear_strategy': 'breakout', 'bear_bb_std_mult': 3.2732382839879723, 'bear_rsi_os': 28, 'bear_rsi_ob': 69, 'bear_adx_thresh': 13.722586788144744, 'bear_atr_min_pct': 0.0004765341448949212, 'bear_atr_max_pct': 0.13729117235368601, 'bear_tp_mult': 2.944081579906803, 'bear_tsl_mult': 0.722942310394434, 'bear_time_stop': 206, 'bear_use_sma': True, 'bear_use_ema': True, 'bear_use_atr': True, 'bear_use_adx': True, 'bear_use_spike': True, 'bear_rsi_required': True, 'sideways_strategy': 'breakout', 'sideways_bb_std_mult': 2.6612288327874936, 'sideways_rsi_os': 5, 'sideways_rsi_ob': 69, 'sideways_adx_thresh': 29.630944845347518, 'sideways_atr_min_pct': 0.022125246342130898, 'sideways_atr_max_pct': 0.09210579699592752, 'sideways_tp_mult': 2.4649186422981657, 'sideways_tsl_mult': 0.29886259329297493, 'sideways_time_stop': 193, 'sideways_use_sma': True, 'sideways_use_ema': True, 'sideways_use_atr': False, 'sideways_use_adx': False, 'sideways_use_spike': False, 'sideways_rsi_required': False}.
