[I 2025-08-31 12:31:41,553] Trial 304 finished with values: [-1000000000.0, 1000000000.0] and parameters: {'p_sma': 56, 'p_std': 26, 'p_atr': 27, 'p_adx': 19, 'rsi_period': 80, 'ema1': 5, 'ema2': 26, 'slip_atr_k': 0.02783321709058985, 'slip_spread_k': 0.682527656154785, 'spread_hl_frac': 0.029391007341644234, 'bb_std_mult': 1.6353127786965127, 'rsi_os': 33, 'rsi_ob': 75, 'vol_spike': 0.07916148784244133, 'adx_thresh': 20.823652380222622, 'atr_min_pct': 0.002011984303256435, 'atr_max_pct': 0.1309826657044757, 'tp_mult': 2.135993904558333, 'tsl_mult': 0.019278553089440868, 'strategy': 'breakout', 'time_stop': 216, 'use_sma': False, 'use_atr': True, 'use_adx': False, 'use_ema': False, 'use_spike': False, 'rsi_required': True, 'edge_k': 0.6893854858719666, 'edge_cap': 0.5391468204066512, 'bull_strategy': 'breakout', 'bull_bb_std_mult': 2.143541595810588, 'bull_rsi_os': 34, 'bull_rsi_ob': 46, 'bull_adx_thresh': 5.0557041160971945, 'bull_atr_min_pct': 0.014965565010939427, 'bull_atr_max_pct': 0.081273953272026, 'bull_tp_mult': 2.709562754154075, 'bull_tsl_mult': 0.7539664629706361, 'bull_time_stop': 206, 'bull_use_sma': True, 'bull_use_ema': True, 'bull_use_atr': False, 'bull_use_adx': True, 'bull_use_spike': False, 'bull_rsi_required': False, 'bear_strategy': 'breakout', 'bear_bb_std_mult': 3.5983454210843293, 'bear_rsi_os': 29, 'bear_rsi_ob': 70, 'bear_adx_thresh': 20.734053338822278, 'bear_atr_min_pct': 0.014780004815693006, 'bear_atr_max_pct': 0.09838634865244146, 'bear_tp_mult': 2.7199564233883535, 'bear_tsl_mult': 0.1812566237355093, 'bear_time_stop': 53, 'bear_use_sma': True, 'bear_use_ema': True, 'bear_use_atr': True, 'bear_use_adx': True, 'bear_use_spike': True, 'bear_rsi_required': True, 'sideways_strategy': 'breakout', 'sideways_bb_std_mult': 3.349149617670987, 'sideways_rsi_os': 41, 'sideways_rsi_ob': 82, 'sideways_adx_thresh': 11.089049024130492, 'sideways_atr_min_pct': 0.012051318946034192, 'sideways_atr_max_pct': 0.08744995613386132, 'sideways_tp_mult': 2.7315495962213316, 'sideways_tsl_mult': 0.6319835842430339, 'sideways_time_stop': 209, 'sideways_use_sma': True, 'sideways_use_ema': False, 'sideways_use_atr': False, 'sideways_use_adx': False, 'sideways_use_spike': False, 'sideways_rsi_required': True}.
[I 2025-08-31 12:32:13,820] Trial 309 finished with values: [-1000000000.0, 1000000000.0] and parameters: {'p_sma': 50, 'p_std': 56, 'p_atr': 12, 'p_adx': 10, 'rsi_period': 76, 'ema1': 5, 'ema2': 51, 'slip_atr_k': 0.026306110750911976, 'slip_spread_k': 0.7168743939840346, 'spread_hl_frac': 0.029054805202231703, 'bb_std_mult': 1.669082054337346, 'rsi_os': 41, 'rsi_ob': 74, 'vol_spike': 0.09343348115376635, 'adx_thresh': 19.735436071065337, 'atr_min_pct': 0.002764340142455018, 'atr_max_pct': 0.13377559474259998, 'tp_mult': 2.151152096635742, 'tsl_mult': 0.9368406099631429, 'strategy': 'mean_reversion', 'time_stop': 219, 'use_sma': False, 'use_atr': True, 'use_adx': False, 'use_ema': False, 'use_spike': False, 'rsi_required': True, 'edge_k': 0.7425602499005582, 'edge_cap': 0.8078599752548963, 'bull_strategy': 'breakout', 'bull_bb_std_mult': 0.6978545245782712, 'bull_rsi_os': 33, 'bull_rsi_ob': 65, 'bull_adx_thresh': 9.732881631670752, 'bull_atr_min_pct': 0.016014667134575517, 'bull_atr_max_pct': 0.09509153602242643, 'bull_tp_mult': 2.688654668640653, 'bull_tsl_mult': 0.8991846562668047, 'bull_time_stop': 81, 'bull_use_sma': True, 'bull_use_ema': True, 'bull_use_atr': True, 'bull_use_adx': True, 'bull_use_spike': True, 'bull_rsi_required': False, 'bear_strategy': 'breakout', 'bear_bb_std_mult': 2.504354354660564, 'bear_rsi_os': 29, 'bear_rsi_ob': 75, 'bear_adx_thresh': 12.923874892703092, 'bear_atr_min_pct': 0.027173533718336435, 'bear_atr_max_pct': 0.09076208344385346, 'bear_tp_mult': 2.89534730247688, 'bear_tsl_mult': 0.12828512557148997, 'bear_time_stop': 120, 'bear_use_sma': True, 'bear_use_ema': True, 'bear_use_atr': True, 'bear_use_adx': True, 'bear_use_spike': False, 'bear_rsi_required': True, 'sideways_strategy': 'breakout', 'sideways_bb_std_mult': 2.6686752167465833, 'sideways_rsi_os': 8, 'sideways_rsi_ob': 81, 'sideways_adx_thresh': 12.288524394826208, 'sideways_atr_min_pct': 0.0008019887746328299, 'sideways_atr_max_pct': 0.03074639981577138, 'sideways_tp_mult': 1.3803300699503072, 'sideways_tsl_mult': 0.6545877133576871, 'sideways_time_stop': 35, 'sideways_use_sma': True, 'sideways_use_ema': False, 'sideways_use_atr': False, 'sideways_use_adx': True, 'sideways_use_spike': False, 'sideways_rsi_required': True}.
[I 2025-08-31 12:32:14,327] Trial 310 finished with values: [-1000000000.0, 1000000000.0] and parameters: {'p_sma': 53, 'p_std': 30, 'p_atr': 12, 'p_adx': 10, 'rsi_period': 7, 'ema1': 6, 'ema2': 45, 'slip_atr_k': 0.03495699393046651, 'slip_spread_k': 0.7191517554219122, 'spread_hl_frac': 0.02797084205813331, 'bb_std_mult': 1.4397864039677915, 'rsi_os': 41, 'rsi_ob': 74, 'vol_spike': 0.09399274975196885, 'adx_thresh': 23.01674609553636, 'atr_min_pct': 0.00274137092010744, 'atr_max_pct': 0.13523515002412662, 'tp_mult': 2.709346520939339, 'tsl_mult': 0.01821982303691967, 'strategy': 'mean_reversion', 'time_stop': 195, 'use_sma': False, 'use_atr': True, 'use_adx': False, 'use_ema': False, 'use_spike': False, 'rsi_required': True, 'edge_k': 0.7463489115783039, 'edge_cap': 0.8031315886583241, 'bull_strategy': 'breakout', 'bull_bb_std_mult': 1.2194608762858574, 'bull_rsi_os': 11, 'bull_rsi_ob': 80, 'bull_adx_thresh': 14.232945677696263, 'bull_atr_min_pct': 0.022856697924913127, 'bull_atr_max_pct': 0.09568345013365943, 'bull_tp_mult': 2.3248208705570974, 'bull_tsl_mult': 0.18291288294696, 'bull_time_stop': 149, 'bull_use_sma': True, 'bull_use_ema': True, 'bull_use_atr': True, 'bull_use_adx': True, 'bull_use_spike': True, 'bull_rsi_required': False, 'bear_strategy': 'breakout', 'bear_bb_std_mult': 1.051435286297806, 'bear_rsi_os': 47, 'bear_rsi_ob': 74, 'bear_adx_thresh': 33.183358751910504, 'bear_atr_min_pct': 0.009855468283196136, 'bear_atr_max_pct': 0.09178286232794171, 'bear_tp_mult': 2.8948962384349786, 'bear_tsl_mult': 0.1231437699452761, 'bear_time_stop': 101, 'bear_use_sma': True, 'bear_use_ema': True, 'bear_use_atr': True, 'bear_use_adx': True, 'bear_use_spike': False, 'bear_rsi_required': True, 'sideways_strategy': 'breakout', 'sideways_bb_std_mult': 3.5006522937938556, 'sideways_rsi_os': 11, 'sideways_rsi_ob': 81, 'sideways_adx_thresh': 12.010219669159676, 'sideways_atr_min_pct': 0.01712163406795149, 'sideways_atr_max_pct': 0.12795774725996206, 'sideways_tp_mult': 1.9673353871151074, 'sideways_tsl_mult': 0.31130926291506456, 'sideways_time_stop': 93, 'sideways_use_sma': True, 'sideways_use_ema': False, 'sideways_use_atr': False, 'sideways_use_adx': True, 'sideways_use_spike': False, 'sideways_rsi_required': True}.
[I 2025-08-31 12:32:14,597] Trial 308 finished with values: [-1000000000.0, 1000000000.0] and parameters: {'p_sma': 50, 'p_std': 30, 'p_atr': 17, 'p_adx': 12, 'rsi_period': 76, 'ema1': 5, 'ema2': 10, 'slip_atr_k': 0.025636625651902556, 'slip_spread_k': 0.6305072534455093, 'spread_hl_frac': 0.02769360411029532, 'bb_std_mult': 1.627942478660317, 'rsi_os': 41, 'rsi_ob': 74, 'vol_spike': 0.0955072037766443, 'adx_thresh': 34.60829777408773, 'atr_min_pct': 0.0026995135687341385, 'atr_max_pct': 0.13365886702406915, 'tp_mult': 1.8867371622092126, 'tsl_mult': 0.02008538801687635, 'strategy': 'mean_reversion', 'time_stop': 218, 'use_sma': False, 'use_atr': True, 'use_adx': False, 'use_ema': False, 'use_spike': False, 'rsi_required': True, 'edge_k': 0.7467694610113238, 'edge_cap': 0.5227111523937932, 'bull_strategy': 'breakout', 'bull_bb_std_mult': 0.6872596298866618, 'bull_rsi_os': 11, 'bull_rsi_ob': 80, 'bull_adx_thresh': 9.665296145457983, 'bull_atr_min_pct': 0.016047297395663948, 'bull_atr_max_pct': 0.0800741332282863, 'bull_tp_mult': 2.6872417294676914, 'bull_tsl_mult': 0.4048861741836292, 'bull_time_stop': 233, 'bull_use_sma': True, 'bull_use_ema': True, 'bull_use_atr': True, 'bull_use_adx': True, 'bull_use_spike': True, 'bull_rsi_required': False, 'bear_strategy': 'breakout', 'bear_bb_std_mult': 1.2124663894277767, 'bear_rsi_os': 45, 'bear_rsi_ob': 75, 'bear_adx_thresh': 29.19613071243761, 'bear_atr_min_pct': 0.0270823272731708, 'bear_atr_max_pct': 0.09089454005648734, 'bear_tp_mult': 2.7301940973735475, 'bear_tsl_mult': 0.13040420196934555, 'bear_time_stop': 120, 'bear_use_sma': True, 'bear_use_ema': True, 'bear_use_atr': True, 'bear_use_adx': True, 'bear_use_spike': False, 'bear_rsi_required': True, 'sideways_strategy': 'breakout', 'sideways_bb_std_mult': 0.68728056512451, 'sideways_rsi_os': 49, 'sideways_rsi_ob': 81, 'sideways_adx_thresh': 12.147398377437256, 'sideways_atr_min_pct': 0.02454457168673815, 'sideways_atr_max_pct': 0.03142709222613535, 'sideways_tp_mult': 1.5549465571535908, 'sideways_tsl_mult': 0.6532015206369068, 'sideways_time_stop': 39, 'sideways_use_sma': True, 'sideways_use_ema': False, 'sideways_use_atr': False, 'sideways_use_adx': True, 'sideways_use_spike': False, 'sideways_rsi_required': True}.
[I 2025-08-31 12:32:14,717] Trial 307 finished with values: [-1000000000.0, 1000000000.0] and parameters: {'p_sma': 51, 'p_std': 30, 'p_atr': 12, 'p_adx': 10, 'rsi_period': 63, 'ema1': 5, 'ema2': 23, 'slip_atr_k': 0.026368032349453625, 'slip_spread_k': 0.5688643624966501, 'spread_hl_frac': 0.029298407323203147, 'bb_std_mult': 1.6823429622571762, 'rsi_os': 41, 'rsi_ob': 92, 'vol_spike': 0.08940708720578912, 'adx_thresh': 20.021594508370693, 'atr_min_pct': 0.002178745365187092, 'atr_max_pct': 0.13693767544904453, 'tp_mult': 2.39954700790455, 'tsl_mult': 0.023722954125637782, 'strategy': 'mean_reversion', 'time_stop': 287, 'use_sma': False, 'use_atr': True, 'use_adx': False, 'use_ema': True, 'use_spike': False, 'rsi_required': True, 'edge_k': 0.7150707970176681, 'edge_cap': 0.5378118090890658, 'bull_strategy': 'breakout', 'bull_bb_std_mult': 0.942637742259371, 'bull_rsi_os': 33, 'bull_rsi_ob': 80, 'bull_adx_thresh': 5.130564430239517, 'bull_atr_min_pct': 0.02085837898886666, 'bull_atr_max_pct': 0.0871688251544113, 'bull_tp_mult': 1.9508181760277346, 'bull_tsl_mult': 0.955294054873228, 'bull_time_stop': 99, 'bull_use_sma': True, 'bull_use_ema': True, 'bull_use_atr': True, 'bull_use_adx': True, 'bull_use_spike': False, 'bull_rsi_required': False, 'bear_strategy': 'breakout', 'bear_bb_std_mult': 2.3606591045993195, 'bear_rsi_os': 29, 'bear_rsi_ob': 74, 'bear_adx_thresh': 29.430483553242084, 'bear_atr_min_pct': 0.0008776436254428963, 'bear_atr_max_pct': 0.0915907608286041, 'bear_tp_mult': 2.853961155827068, 'bear_tsl_mult': 0.10092939987554961, 'bear_time_stop': 235, 'bear_use_sma': True, 'bear_use_ema': True, 'bear_use_atr': True, 'bear_use_adx': True, 'bear_use_spike': True, 'bear_rsi_required': True, 'sideways_strategy': 'breakout', 'sideways_bb_std_mult': 3.5363267314317315, 'sideways_rsi_os': 19, 'sideways_rsi_ob': 81, 'sideways_adx_thresh': 12.249360615105443, 'sideways_atr_min_pct': 4.372716423089323e-05, 'sideways_atr_max_pct': 0.08836922869228661, 'sideways_tp_mult': 1.4650305646894455, 'sideways_tsl_mult': 0.6574233456385202, 'sideways_time_stop': 64, 'sideways_use_sma': True, 'sideways_use_ema': False, 'sideways_use_atr': False, 'sideways_use_adx': False, 'sideways_use_spike': False, 'sideways_rsi_required': True}.
[I 2025-08-31 12:32:47,295] Trial 312 finished with values: [-1000000000.0, 1000000000.0] and parameters: {'p_sma': 51, 'p_std': 30, 'p_atr': 17, 'p_adx': 12, 'rsi_period': 63, 'ema1': 16, 'ema2': 28, 'slip_atr_k': 0.03592564507651516, 'slip_spread_k': 0.6295626725867687, 'spread_hl_frac': 0.031287877718058986, 'bb_std_mult': 1.7293145726436978, 'rsi_os': 42, 'rsi_ob': 87, 'vol_spike': 0.07341585385127493, 'adx_thresh': 22.833508887222294, 'atr_min_pct': 0.0019719680301821182, 'atr_max_pct': 0.13859865748495914, 'tp_mult': 2.6365199513537174, 'tsl_mult': 0.7893044378002935, 'strategy': 'mean_reversion', 'time_stop': 293, 'use_sma': False, 'use_atr': True, 'use_adx': False, 'use_ema': False, 'use_spike': False, 'rsi_required': True, 'edge_k': 0.7701542564598044, 'edge_cap': 0.8324111631847884, 'bull_strategy': 'breakout', 'bull_bb_std_mult': 2.262098556903943, 'bull_rsi_os': 9, 'bull_rsi_ob': 81, 'bull_adx_thresh': 28.183567526266856, 'bull_atr_min_pct': 0.021432769032436464, 'bull_atr_max_pct': 0.08867093463173617, 'bull_tp_mult': 2.627844077135514, 'bull_tsl_mult': 0.5224164017057507, 'bull_time_stop': 234, 'bull_use_sma': True, 'bull_use_ema': True, 'bull_use_atr': False, 'bull_use_adx': True, 'bull_use_spike': False, 'bull_rsi_required': False, 'bear_strategy': 'breakout', 'bear_bb_std_mult': 1.15977096931947, 'bear_rsi_os': 28, 'bear_rsi_ob': 67, 'bear_adx_thresh': 29.153565444703936, 'bear_atr_min_pct': 0.017546104008461433, 'bear_atr_max_pct': 0.09471842206103773, 'bear_tp_mult': 2.8169988782121957, 'bear_tsl_mult': 0.5886768133636457, 'bear_time_stop': 144, 'bear_use_sma': True, 'bear_use_ema': True, 'bear_use_atr': True, 'bear_use_adx': True, 'bear_use_spike': True, 'bear_rsi_required': True, 'sideways_strategy': 'breakout', 'sideways_bb_std_mult': 3.535183924540701, 'sideways_rsi_os': 33, 'sideways_rsi_ob': 83, 'sideways_adx_thresh': 12.532061214523214, 'sideways_atr_min_pct': 0.018706624060584497, 'sideways_atr_max_pct': 0.10008672150667289, 'sideways_tp_mult': 1.5529344951624204, 'sideways_tsl_mult': 0.054088585215197216, 'sideways_time_stop': 64, 'sideways_use_sma': True, 'sideways_use_ema': False, 'sideways_use_atr': False, 'sideways_use_adx': False, 'sideways_use_spike': False, 'sideways_rsi_required': True}.
[I 2025-08-31 12:32:47,610] Trial 311 finished with values: [-1000000000.0, 1000000000.0] and parameters: {'p_sma': 53, 'p_std': 30, 'p_atr': 7, 'p_adx': 12, 'rsi_period': 51, 'ema1': 14, 'ema2': 28, 'slip_atr_k': 0.034922759935856106, 'slip_spread_k': 0.6317752289370873, 'spread_hl_frac': 0.02790431097606757, 'bb_std_mult': 1.435690245407267, 'rsi_os': 42, 'rsi_ob': 55, 'vol_spike': 0.07312274498391896, 'adx_thresh': 22.73764231445025, 'atr_min_pct': 0.002063143421220925, 'atr_max_pct': 0.1384292686970603, 'tp_mult': 1.0147770141165142, 'tsl_mult': 0.24455064032820828, 'strategy': 'mean_reversion', 'time_stop': 196, 'use_sma': False, 'use_atr': True, 'use_adx': False, 'use_ema': False, 'use_spike': False, 'rsi_required': True, 'edge_k': 0.7579698208230929, 'edge_cap': 0.5107446795369394, 'bull_strategy': 'breakout', 'bull_bb_std_mult': 1.2081921798898279, 'bull_rsi_os': 9, 'bull_rsi_ob': 81, 'bull_adx_thresh': 8.737205299044659, 'bull_atr_min_pct': 0.021438616592706676, 'bull_atr_max_pct': 0.09613077622747507, 'bull_tp_mult': 2.7940109761677725, 'bull_tsl_mult': 0.2544539553967126, 'bull_time_stop': 116, 'bull_use_sma': True, 'bull_use_ema': True, 'bull_use_atr': True, 'bull_use_adx': True, 'bull_use_spike': False, 'bull_rsi_required': False, 'bear_strategy': 'breakout', 'bear_bb_std_mult': 2.9232037522166268, 'bear_rsi_os': 30, 'bear_rsi_ob': 74, 'bear_adx_thresh': 31.744130082092624, 'bear_atr_min_pct': 0.02788926829496747, 'bear_atr_max_pct': 0.09391527413883621, 'bear_tp_mult': 2.8563114073140943, 'bear_tsl_mult': 0.12958067709918084, 'bear_time_stop': 139, 'bear_use_sma': True, 'bear_use_ema': True, 'bear_use_atr': True, 'bear_use_adx': True, 'bear_use_spike': True, 'bear_rsi_required': True, 'sideways_strategy': 'breakout', 'sideways_bb_std_mult': 3.597943152429884, 'sideways_rsi_os': 49, 'sideways_rsi_ob': 83, 'sideways_adx_thresh': 12.111082399538086, 'sideways_atr_min_pct': 0.01414576181049676, 'sideways_atr_max_pct': 0.13368377063513204, 'sideways_tp_mult': 2.0623194998298047, 'sideways_tsl_mult': 0.854823654800626, 'sideways_time_stop': 194, 'sideways_use_sma': True, 'sideways_use_ema': False, 'sideways_use_atr': False, 'sideways_use_adx': False, 'sideways_use_spike': False, 'sideways_rsi_required': True}.
[I 2025-08-31 12:32:47,706] Trial 313 finished with values: [-0.09062735004224853, 0.09050085397513298] and parameters: {'p_sma': 53, 'p_std': 28, 'p_atr': 13, 'p_adx': 18, 'rsi_period': 48, 'ema1': 14, 'ema2': 28, 'slip_atr_k': 0.03488752491829325, 'slip_spread_k': 0.6543989640513547, 'spread_hl_frac': 0.03564452619951053, 'bb_std_mult': 1.7789082096065, 'rsi_os': 26, 'rsi_ob': 68, 'vol_spike': 0.07426255821473718, 'adx_thresh': 15.348725055778448, 'atr_min_pct': 0.002071235960692502, 'atr_max_pct': 0.13867924275385124, 'tp_mult': 2.6577388067727306, 'tsl_mult': 0.9703909989665929, 'strategy': 'mean_reversion', 'time_stop': 206, 'use_sma': False, 'use_atr': True, 'use_adx': False, 'use_ema': True, 'use_spike': False, 'rsi_required': True, 'edge_k': 0.6451539653395841, 'edge_cap': 0.7322894074375742, 'bull_strategy': 'breakout', 'bull_bb_std_mult': 0.9494617962095473, 'bull_rsi_os': 25, 'bull_rsi_ob': 68, 'bull_adx_thresh': 19.297900027829257, 'bull_atr_min_pct': 0.021387633566723876, 'bull_atr_max_pct': 0.08754656613975464, 'bull_tp_mult': 2.6344660728175766, 'bull_tsl_mult': 0.5197597262174407, 'bull_time_stop': 123, 'bull_use_sma': True, 'bull_use_ema': True, 'bull_use_atr': False, 'bull_use_adx': True, 'bull_use_spike': False, 'bull_rsi_required': False, 'bear_strategy': 'breakout', 'bear_bb_std_mult': 2.89522672297352, 'bear_rsi_os': 30, 'bear_rsi_ob': 67, 'bear_adx_thresh': 31.823724491162643, 'bear_atr_min_pct': 0.027966400454219643, 'bear_atr_max_pct': 0.09436360863480445, 'bear_tp_mult': 2.8482292972304872, 'bear_tsl_mult': 0.8357028172789187, 'bear_time_stop': 250, 'bear_use_sma': True, 'bear_use_ema': True, 'bear_use_atr': True, 'bear_use_adx': True, 'bear_use_spike': True, 'bear_rsi_required': True, 'sideways_strategy': 'breakout', 'sideways_bb_std_mult': 3.598441918317625, 'sideways_rsi_os': 44, 'sideways_rsi_ob': 83, 'sideways_adx_thresh': 12.345876907965062, 'sideways_atr_min_pct': 0.0018931325260152954, 'sideways_atr_max_pct': 0.10030425239522511, 'sideways_tp_mult': 2.3824169331701612, 'sideways_tsl_mult': 0.6746050693157201, 'sideways_time_stop': 193, 'sideways_use_sma': True, 'sideways_use_ema': False, 'sideways_use_atr': False, 'sideways_use_adx': False, 'sideways_use_spike': False, 'sideways_rsi_required': False}.
[I 2025-08-31 12:32:47,896] Trial 314 finished with values: [-1000000000.0, 1000000000.0] and parameters: {'p_sma': 53, 'p_std': 28, 'p_atr': 21, 'p_adx': 17, 'rsi_period': 51, 'ema1': 14, 'ema2': 14, 'slip_atr_k': 0.034526831277028866, 'slip_spread_k': 0.6587146362979903, 'spread_hl_frac': 0.030839417950682308, 'bb_std_mult': 1.8192020543934238, 'rsi_os': 42, 'rsi_ob': 68, 'vol_spike': 0.07052403399276795, 'adx_thresh': 21.541771526099517, 'atr_min_pct': 0.0014278285347593253, 'atr_max_pct': 0.1384188863002795, 'tp_mult': 2.653827239317836, 'tsl_mult': 0.262238965598677, 'strategy': 'mean_reversion', 'time_stop': 207, 'use_sma': False, 'use_atr': True, 'use_adx': False, 'use_ema': False, 'use_spike': False, 'rsi_required': True, 'edge_k': 0.7913460530701828, 'edge_cap': 0.874725830548851, 'bull_strategy': 'breakout', 'bull_bb_std_mult': 2.936675105059305, 'bull_rsi_os': 38, 'bull_rsi_ob': 68, 'bull_adx_thresh': 26.291511545268833, 'bull_atr_min_pct': 0.021609309504380197, 'bull_atr_max_pct': 0.09858556938395194, 'bull_tp_mult': 2.6235231448228085, 'bull_tsl_mult': 0.5195579446767136, 'bull_time_stop': 159, 'bull_use_sma': True, 'bull_use_ema': True, 'bull_use_atr': False, 'bull_use_adx': False, 'bull_use_spike': False, 'bull_rsi_required': False, 'bear_strategy': 'breakout', 'bear_bb_std_mult': 2.0932741671553496, 'bear_rsi_os': 12, 'bear_rsi_ob': 71, 'bear_adx_thresh': 32.009476846380714, 'bear_atr_min_pct': 0.02804132075895533, 'bear_atr_max_pct': 0.010722330062100063, 'bear_tp_mult': 2.80226033228085, 'bear_tsl_mult': 0.15800489933380524, 'bear_time_stop': 137, 'bear_use_sma': True, 'bear_use_ema': True, 'bear_use_atr': True, 'bear_use_adx': True, 'bear_use_spike': True, 'bear_rsi_required': True, 'sideways_strategy': 'mean_reversion', 'sideways_bb_std_mult': 0.962792216088763, 'sideways_rsi_os': 37, 'sideways_rsi_ob': 83, 'sideways_adx_thresh': 11.034615450663802, 'sideways_atr_min_pct': 0.0013548315271486313, 'sideways_atr_max_pct': 0.13304502618944858, 'sideways_tp_mult': 2.036390809434102, 'sideways_tsl_mult': 0.6713737836067748, 'sideways_time_stop': 194, 'sideways_use_sma': True, 'sideways_use_ema': False, 'sideways_use_atr': False, 'sideways_use_adx': False, 'sideways_use_spike': True, 'sideways_rsi_required': False}.
