[I 2025-08-31 12:23:57,180] Trial 245 finished with values: [-0.013022398617243525, 0.013799856472063839] and parameters: {'p_sma': 33, 'p_std': 17, 'p_atr': 12, 'p_adx': 15, 'rsi_period': 75, 'ema1': 6, 'ema2': 21, 'slip_atr_k': 0.03838491897937611, 'slip_spread_k': 0.14569338586510622, 'spread_hl_frac': 0.028111956931444977, 'bb_std_mult': 1.0353599591743137, 'rsi_os': 42, 'rsi_ob': 74, 'vol_spike': 0.08037100515473167, 'adx_thresh': 22.229484092324064, 'atr_min_pct': 0.005255295841848822, 'atr_max_pct': 0.0728633039903502, 'tp_mult': 2.6200370740666794, 'tsl_mult': 0.0007591195593396605, 'strategy': 'mean_reversion', 'time_stop': 194, 'use_sma': False, 'use_atr': False, 'use_adx': False, 'use_ema': False, 'use_spike': True, 'rsi_required': True, 'edge_k': 0.8431807461314236, 'edge_cap': 0.8485624018649283, 'bull_strategy': 'breakout', 'bull_bb_std_mult': 2.8260133672106766, 'bull_rsi_os': 11, 'bull_rsi_ob': 79, 'bull_adx_thresh': 8.829293210574315, 'bull_atr_min_pct': 0.02102400331685799, 'bull_atr_max_pct': 0.119192471563379, 'bull_tp_mult': 2.721215044902663, 'bull_tsl_mult': 0.29471859342536677, 'bull_time_stop': 85, 'bull_use_sma': True, 'bull_use_ema': True, 'bull_use_atr': False, 'bull_use_adx': True, 'bull_use_spike': False, 'bull_rsi_required': False, 'bear_strategy': 'breakout', 'bear_bb_std_mult': 2.448123188152193, 'bear_rsi_os': 25, 'bear_rsi_ob': 73, 'bear_adx_thresh': 33.12672865128489, 'bear_atr_min_pct': 0.0276522455815179, 'bear_atr_max_pct': 0.09951895658791404, 'bear_tp_mult': 2.7674246336152684, 'bear_tsl_mult': 0.11614607530043547, 'bear_time_stop': 232, 'bear_use_sma': False, 'bear_use_ema': False, 'bear_use_atr': False, 'bear_use_adx': False, 'bear_use_spike': True, 'bear_rsi_required': True, 'sideways_strategy': 'breakout', 'sideways_bb_std_mult': 3.5200906742331988, 'sideways_rsi_os': 35, 'sideways_rsi_ob': 83, 'sideways_adx_thresh': 9.948108335696915, 'sideways_atr_min_pct': 0.0004991499789152047, 'sideways_atr_max_pct': 0.13586038541996212, 'sideways_tp_mult': 1.3773719458546938, 'sideways_tsl_mult': 0.6840364380408877, 'sideways_time_stop': 191, 'sideways_use_sma': True, 'sideways_use_ema': False, 'sideways_use_atr': True, 'sideways_use_adx': False, 'sideways_use_spike': False, 'sideways_rsi_required': True}.
[I 2025-08-31 12:23:57,348] Trial 244 finished with values: [-1000000000.0, 1000000000.0] and parameters: {'p_sma': 33, 'p_std': 17, 'p_atr': 29, 'p_adx': 14, 'rsi_period': 40, 'ema1': 28, 'ema2': 16, 'slip_atr_k': 0.09678924685130587, 'slip_spread_k': 0.8763225826026169, 'spread_hl_frac': 0.027979682416380453, 'bb_std_mult': 0.9630258420355193, 'rsi_os': 42, 'rsi_ob': 74, 'vol_spike': 0.02375017481329289, 'adx_thresh': 22.18442723783263, 'atr_min_pct': 0.005471563727605431, 'atr_max_pct': 0.07279939850187161, 'tp_mult': 1.7846110896099558, 'tsl_mult': 0.5765801185535728, 'strategy': 'mean_reversion', 'time_stop': 94, 'use_sma': False, 'use_atr': False, 'use_adx': False, 'use_ema': False, 'use_spike': True, 'rsi_required': True, 'edge_k': 1.2300876268065777, 'edge_cap': 0.8476060708087532, 'bull_strategy': 'breakout', 'bull_bb_std_mult': 3.3706709259246765, 'bull_rsi_os': 37, 'bull_rsi_ob': 60, 'bull_adx_thresh': 34.321142039843, 'bull_atr_min_pct': 0.020921389973541045, 'bull_atr_max_pct': 0.08202118038387643, 'bull_tp_mult': 1.637789609755043, 'bull_tsl_mult': 0.2906726363449401, 'bull_time_stop': 85, 'bull_use_sma': True, 'bull_use_ema': True, 'bull_use_atr': False, 'bull_use_adx': True, 'bull_use_spike': False, 'bull_rsi_required': True, 'bear_strategy': 'breakout', 'bear_bb_std_mult': 2.4090418676812533, 'bear_rsi_os': 18, 'bear_rsi_ob': 48, 'bear_adx_thresh': 10.277309254922677, 'bear_atr_min_pct': 0.021267463803164216, 'bear_atr_max_pct': 0.09855091644131535, 'bear_tp_mult': 2.220702782704388, 'bear_tsl_mult': 0.2060847574338579, 'bear_time_stop': 227, 'bear_use_sma': False, 'bear_use_ema': False, 'bear_use_atr': False, 'bear_use_adx': False, 'bear_use_spike': False, 'bear_rsi_required': True, 'sideways_strategy': 'breakout', 'sideways_bb_std_mult': 3.5344806236328457, 'sideways_rsi_os': 10, 'sideways_rsi_ob': 47, 'sideways_adx_thresh': 10.159712767006544, 'sideways_atr_min_pct': 0.0020372354171874223, 'sideways_atr_max_pct': 0.06849896995157284, 'sideways_tp_mult': 2.6475787950987812, 'sideways_tsl_mult': 0.5839898549018229, 'sideways_time_stop': 64, 'sideways_use_sma': True, 'sideways_use_ema': False, 'sideways_use_atr': True, 'sideways_use_adx': False, 'sideways_use_spike': False, 'sideways_rsi_required': True}.
[I 2025-08-31 12:23:57,900] Trial 243 finished with values: [-1000000000.0, 1000000000.0] and parameters: {'p_sma': 59, 'p_std': 17, 'p_atr': 12, 'p_adx': 15, 'rsi_period': 46, 'ema1': 28, 'ema2': 44, 'slip_atr_k': 0.09715098534900164, 'slip_spread_k': 0.5399631839286264, 'spread_hl_frac': 0.028173908848727763, 'bb_std_mult': 1.0611412528279427, 'rsi_os': 42, 'rsi_ob': 74, 'vol_spike': 0.06390137024885505, 'adx_thresh': 13.549637390394572, 'atr_min_pct': 0.005507768416397668, 'atr_max_pct': 0.0711140768731822, 'tp_mult': 2.4882280888509367, 'tsl_mult': 0.406689211574167, 'strategy': 'mean_reversion', 'time_stop': 150, 'use_sma': True, 'use_atr': False, 'use_adx': False, 'use_ema': False, 'use_spike': True, 'rsi_required': True, 'edge_k': 0.8965558228335694, 'edge_cap': 0.3165254272752713, 'bull_strategy': 'breakout', 'bull_bb_std_mult': 2.8284225967906185, 'bull_rsi_os': 11, 'bull_rsi_ob': 79, 'bull_adx_thresh': 34.44898758372037, 'bull_atr_min_pct': 0.028164421989597656, 'bull_atr_max_pct': 0.12169404964962596, 'bull_tp_mult': 1.6363094422554363, 'bull_tsl_mult': 0.8474937359724485, 'bull_time_stop': 84, 'bull_use_sma': True, 'bull_use_ema': True, 'bull_use_atr': False, 'bull_use_adx': True, 'bull_use_spike': False, 'bull_rsi_required': True, 'bear_strategy': 'breakout', 'bear_bb_std_mult': 1.8031501362268532, 'bear_rsi_os': 39, 'bear_rsi_ob': 59, 'bear_adx_thresh': 32.455885792480565, 'bear_atr_min_pct': 0.027405850965825228, 'bear_atr_max_pct': 0.0985551222344876, 'bear_tp_mult': 2.555526155761415, 'bear_tsl_mult': 0.28098164543155063, 'bear_time_stop': 227, 'bear_use_sma': False, 'bear_use_ema': False, 'bear_use_atr': False, 'bear_use_adx': False, 'bear_use_spike': True, 'bear_rsi_required': True, 'sideways_strategy': 'breakout', 'sideways_bb_std_mult': 0.7732327773129624, 'sideways_rsi_os': 9, 'sideways_rsi_ob': 58, 'sideways_adx_thresh': 21.08180651562791, 'sideways_atr_min_pct': 0.022749026708169157, 'sideways_atr_max_pct': 0.06804240315545344, 'sideways_tp_mult': 1.3639547590684447, 'sideways_tsl_mult': 0.18205815701058503, 'sideways_time_stop': 193, 'sideways_use_sma': True, 'sideways_use_ema': True, 'sideways_use_atr': True, 'sideways_use_adx': False, 'sideways_use_spike': False, 'sideways_rsi_required': True}.
[I 2025-08-31 12:23:58,715] Trial 246 finished with values: [-0.05879509366523816, 0.05856378827860174] and parameters: {'p_sma': 33, 'p_std': 17, 'p_atr': 12, 'p_adx': 13, 'rsi_period': 45, 'ema1': 6, 'ema2': 49, 'slip_atr_k': 0.18555988416693447, 'slip_spread_k': 0.30100150291665073, 'spread_hl_frac': 0.027378090323066182, 'bb_std_mult': 3.019753045670421, 'rsi_os': 15, 'rsi_ob': 62, 'vol_spike': 0.2567830319659073, 'adx_thresh': 32.00246223445334, 'atr_min_pct': 0.01838895124248011, 'atr_max_pct': 0.07282145472892214, 'tp_mult': 2.4900669510283997, 'tsl_mult': 0.8969417767792578, 'strategy': 'mean_reversion', 'time_stop': 103, 'use_sma': False, 'use_atr': False, 'use_adx': False, 'use_ema': False, 'use_spike': True, 'rsi_required': False, 'edge_k': 1.7707038732447913, 'edge_cap': 0.9080985262603845, 'bull_strategy': 'breakout', 'bull_bb_std_mult': 2.942987066214119, 'bull_rsi_os': 36, 'bull_rsi_ob': 86, 'bull_adx_thresh': 34.51685944515734, 'bull_atr_min_pct': 0.020855825506529493, 'bull_atr_max_pct': 0.13319259072108938, 'bull_tp_mult': 2.7240196032570054, 'bull_tsl_mult': 0.6176588839005811, 'bull_time_stop': 87, 'bull_use_sma': False, 'bull_use_ema': False, 'bull_use_atr': False, 'bull_use_adx': True, 'bull_use_spike': False, 'bull_rsi_required': False, 'bear_strategy': 'breakout', 'bear_bb_std_mult': 1.7058104371472254, 'bear_rsi_os': 24, 'bear_rsi_ob': 71, 'bear_adx_thresh': 10.280958543096526, 'bear_atr_min_pct': 0.018160198546667783, 'bear_atr_max_pct': 0.12643837710172096, 'bear_tp_mult': 2.7801597293881253, 'bear_tsl_mult': 0.7489183709701146, 'bear_time_stop': 226, 'bear_use_sma': False, 'bear_use_ema': False, 'bear_use_atr': False, 'bear_use_adx': False, 'bear_use_spike': False, 'bear_rsi_required': True, 'sideways_strategy': 'breakout', 'sideways_bb_std_mult': 3.2543766630694666, 'sideways_rsi_os': 38, 'sideways_rsi_ob': 63, 'sideways_adx_thresh': 23.59515895083553, 'sideways_atr_min_pct': 0.0020677088399453964, 'sideways_atr_max_pct': 0.1410328721831047, 'sideways_tp_mult': 1.3717788309086214, 'sideways_tsl_mult': 0.1803535904165806, 'sideways_time_stop': 181, 'sideways_use_sma': True, 'sideways_use_ema': False, 'sideways_use_atr': True, 'sideways_use_adx': False, 'sideways_use_spike': False, 'sideways_rsi_required': True}.
[I 2025-08-31 12:24:33,374] Trial 248 finished with values: [-1000000000.0, 1000000000.0] and parameters: {'p_sma': 33, 'p_std': 19, 'p_atr': 13, 'p_adx': 16, 'rsi_period': 76, 'ema1': 17, 'ema2': 23, 'slip_atr_k': 0.03582574654418384, 'slip_spread_k': 0.5342826787482656, 'spread_hl_frac': 0.030727455263229987, 'bb_std_mult': 1.1635373122233048, 'rsi_os': 39, 'rsi_ob': 75, 'vol_spike': 0.0630701601042693, 'adx_thresh': 20.74632986338203, 'atr_min_pct': 0.00400594898929562, 'atr_max_pct': 0.06951541040950023, 'tp_mult': 2.7305722479921375, 'tsl_mult': 0.0025231204249810315, 'strategy': 'mean_reversion', 'time_stop': 192, 'use_sma': False, 'use_atr': False, 'use_adx': False, 'use_ema': False, 'use_spike': True, 'rsi_required': True, 'edge_k': 0.8765456892015949, 'edge_cap': 0.7874754973342014, 'bull_strategy': 'breakout', 'bull_bb_std_mult': 2.815239770648016, 'bull_rsi_os': 10, 'bull_rsi_ob': 75, 'bull_adx_thresh': 7.561728190553582, 'bull_atr_min_pct': 0.019953864522149155, 'bull_atr_max_pct': 0.12097448475567418, 'bull_tp_mult': 2.6161318575747643, 'bull_tsl_mult': 0.27131718313883, 'bull_time_stop': 94, 'bull_use_sma': True, 'bull_use_ema': True, 'bull_use_atr': False, 'bull_use_adx': False, 'bull_use_spike': False, 'bull_rsi_required': False, 'bear_strategy': 'breakout', 'bear_bb_std_mult': 2.5580569672976576, 'bear_rsi_os': 26, 'bear_rsi_ob': 73, 'bear_adx_thresh': 31.11926707977922, 'bear_atr_min_pct': 0.02619072688261806, 'bear_atr_max_pct': 0.09871926208891774, 'bear_tp_mult': 2.7575101751579796, 'bear_tsl_mult': 0.11879982607033539, 'bear_time_stop': 234, 'bear_use_sma': False, 'bear_use_ema': False, 'bear_use_atr': False, 'bear_use_adx': False, 'bear_use_spike': True, 'bear_rsi_required': True, 'sideways_strategy': 'breakout', 'sideways_bb_std_mult': 3.243264056025008, 'sideways_rsi_os': 34, 'sideways_rsi_ob': 83, 'sideways_adx_thresh': 12.62934042932395, 'sideways_atr_min_pct': 0.0001308546789072623, 'sideways_atr_max_pct': 0.134902665287422, 'sideways_tp_mult': 1.3602699294721867, 'sideways_tsl_mult': 0.7214970527982618, 'sideways_time_stop': 198, 'sideways_use_sma': True, 'sideways_use_ema': False, 'sideways_use_atr': True, 'sideways_use_adx': False, 'sideways_use_spike': True, 'sideways_rsi_required': False}.
[I 2025-08-31 12:24:33,904] Trial 247 finished with values: [-1000000000.0, 1000000000.0] and parameters: {'p_sma': 46, 'p_std': 18, 'p_atr': 13, 'p_adx': 16, 'rsi_period': 82, 'ema1': 17, 'ema2': 23, 'slip_atr_k': 0.03530379961747357, 'slip_spread_k': 0.2938619189639698, 'spread_hl_frac': 0.03022217937754835, 'bb_std_mult': 3.591763053183893, 'rsi_os': 40, 'rsi_ob': 75, 'vol_spike': 0.0747892817521518, 'adx_thresh': 21.016598271488643, 'atr_min_pct': 0.003797621596840416, 'atr_max_pct': 0.06801215018286107, 'tp_mult': 2.7208207377418328, 'tsl_mult': 0.026315822965992303, 'strategy': 'mean_reversion', 'time_stop': 192, 'use_sma': False, 'use_atr': False, 'use_adx': False, 'use_ema': False, 'use_spike': True, 'rsi_required': True, 'edge_k': 0.8804222432430053, 'edge_cap': 0.7711748773365334, 'bull_strategy': 'breakout', 'bull_bb_std_mult': 2.8145598974821526, 'bull_rsi_os': 9, 'bull_rsi_ob': 76, 'bull_adx_thresh': 8.953341865469767, 'bull_atr_min_pct': 0.020286031155561317, 'bull_atr_max_pct': 0.14024472655435424, 'bull_tp_mult': 2.638063535588989, 'bull_tsl_mult': 0.2801430173010458, 'bull_time_stop': 92, 'bull_use_sma': True, 'bull_use_ema': True, 'bull_use_atr': False, 'bull_use_adx': False, 'bull_use_spike': False, 'bull_rsi_required': False, 'bear_strategy': 'breakout', 'bear_bb_std_mult': 2.5694463677638493, 'bear_rsi_os': 27, 'bear_rsi_ob': 73, 'bear_adx_thresh': 32.25949993409203, 'bear_atr_min_pct': 0.025991521703880735, 'bear_atr_max_pct': 0.1267732989139937, 'bear_tp_mult': 2.778048884890966, 'bear_tsl_mult': 0.11459512372277374, 'bear_time_stop': 234, 'bear_use_sma': False, 'bear_use_ema': False, 'bear_use_atr': False, 'bear_use_adx': False, 'bear_use_spike': True, 'bear_rsi_required': True, 'sideways_strategy': 'breakout', 'sideways_bb_std_mult': 3.2855083291524805, 'sideways_rsi_os': 34, 'sideways_rsi_ob': 83, 'sideways_adx_thresh': 12.466403827239617, 'sideways_atr_min_pct': 1.6023154011958615e-05, 'sideways_atr_max_pct': 0.1357797152901781, 'sideways_tp_mult': 1.3588517274641025, 'sideways_tsl_mult': 0.72221328252506, 'sideways_time_stop': 199, 'sideways_use_sma': True, 'sideways_use_ema': False, 'sideways_use_atr': True, 'sideways_use_adx': False, 'sideways_use_spike': True, 'sideways_rsi_required': False}.
[I 2025-08-31 12:24:34,081] Trial 250 finished with values: [-1000000000.0, 1000000000.0] and parameters: {'p_sma': 31, 'p_std': 18, 'p_atr': 13, 'p_adx': 17, 'rsi_period': 76, 'ema1': 17, 'ema2': 21, 'slip_atr_k': 0.03709663467512557, 'slip_spread_k': 0.17892403565037224, 'spread_hl_frac': 0.030009519161292818, 'bb_std_mult': 1.2294967520685023, 'rsi_os': 39, 'rsi_ob': 72, 'vol_spike': 0.04437385907394593, 'adx_thresh': 20.620905701856163, 'atr_min_pct': 0.00264420330961151, 'atr_max_pct': 0.06784970914169382, 'tp_mult': 2.749057183618718, 'tsl_mult': 0.006177368926113131, 'strategy': 'breakout', 'time_stop': 193, 'use_sma': False, 'use_atr': False, 'use_adx': False, 'use_ema': False, 'use_spike': True, 'rsi_required': True, 'edge_k': 0.8399579018480567, 'edge_cap': 0.7742633628142832, 'bull_strategy': 'breakout', 'bull_bb_std_mult': 2.7810337675691317, 'bull_rsi_os': 9, 'bull_rsi_ob': 77, 'bull_adx_thresh': 12.364998898762146, 'bull_atr_min_pct': 0.01996300046107176, 'bull_atr_max_pct': 0.1497886599949167, 'bull_tp_mult': 2.64217812139611, 'bull_tsl_mult': 0.6687855345361949, 'bull_time_stop': 94, 'bull_use_sma': True, 'bull_use_ema': True, 'bull_use_atr': True, 'bull_use_adx': False, 'bull_use_spike': False, 'bull_rsi_required': False, 'bear_strategy': 'breakout', 'bear_bb_std_mult': 2.57425664961906, 'bear_rsi_os': 27, 'bear_rsi_ob': 74, 'bear_adx_thresh': 32.17434242719258, 'bear_atr_min_pct': 0.026174772176943424, 'bear_atr_max_pct': 0.09865326605660756, 'bear_tp_mult': 2.7534741926315656, 'bear_tsl_mult': 0.12162395750093993, 'bear_time_stop': 233, 'bear_use_sma': False, 'bear_use_ema': False, 'bear_use_atr': False, 'bear_use_adx': False, 'bear_use_spike': True, 'bear_rsi_required': True, 'sideways_strategy': 'mean_reversion', 'sideways_bb_std_mult': 3.16527085769495, 'sideways_rsi_os': 34, 'sideways_rsi_ob': 83, 'sideways_adx_thresh': 11.901331760461495, 'sideways_atr_min_pct': 0.000257615778590841, 'sideways_atr_max_pct': 0.12768927202237654, 'sideways_tp_mult': 1.3134170451491278, 'sideways_tsl_mult': 0.7349027435500181, 'sideways_time_stop': 208, 'sideways_use_sma': True, 'sideways_use_ema': False, 'sideways_use_atr': True, 'sideways_use_adx': False, 'sideways_use_spike': True, 'sideways_rsi_required': False}.
[I 2025-08-31 12:24:34,162] Trial 249 finished with values: [-1000000000.0, 1000000000.0] and parameters: {'p_sma': 46, 'p_std': 18, 'p_atr': 13, 'p_adx': 16, 'rsi_period': 76, 'ema1': 6, 'ema2': 21, 'slip_atr_k': 0.03352790876038548, 'slip_spread_k': 0.1491476494312068, 'spread_hl_frac': 0.030370797389037574, 'bb_std_mult': 1.19624065678618, 'rsi_os': 40, 'rsi_ob': 75, 'vol_spike': 0.07521114541181263, 'adx_thresh': 21.194089291505804, 'atr_min_pct': 0.0041850073879700165, 'atr_max_pct': 0.06829562306533439, 'tp_mult': 2.7353485205492456, 'tsl_mult': 0.03456664847109056, 'strategy': 'mean_reversion', 'time_stop': 193, 'use_sma': False, 'use_atr': False, 'use_adx': False, 'use_ema': False, 'use_spike': True, 'rsi_required': True, 'edge_k': 0.8732808131266356, 'edge_cap': 0.9163908708918006, 'bull_strategy': 'breakout', 'bull_bb_std_mult': 2.8885293160384644, 'bull_rsi_os': 9, 'bull_rsi_ob': 77, 'bull_adx_thresh': 7.639647478284958, 'bull_atr_min_pct': 0.020427084860732827, 'bull_atr_max_pct': 0.1322139277763999, 'bull_tp_mult': 2.6467263919813218, 'bull_tsl_mult': 0.7334838253274659, 'bull_time_stop': 93, 'bull_use_sma': True, 'bull_use_ema': True, 'bull_use_atr': True, 'bull_use_adx': False, 'bull_use_spike': False, 'bull_rsi_required': False, 'bear_strategy': 'breakout', 'bear_bb_std_mult': 2.5797679860180907, 'bear_rsi_os': 27, 'bear_rsi_ob': 73, 'bear_adx_thresh': 32.08745387057491, 'bear_atr_min_pct': 0.026894573361438134, 'bear_atr_max_pct': 0.023451332990127083, 'bear_tp_mult': 2.7927197255625025, 'bear_tsl_mult': 0.11434937842517999, 'bear_time_stop': 233, 'bear_use_sma': False, 'bear_use_ema': False, 'bear_use_atr': False, 'bear_use_adx': False, 'bear_use_spike': True, 'bear_rsi_required': True, 'sideways_strategy': 'mean_reversion', 'sideways_bb_std_mult': 3.26778073084026, 'sideways_rsi_os': 34, 'sideways_rsi_ob': 83, 'sideways_adx_thresh': 6.756558412475827, 'sideways_atr_min_pct': 7.785674875098977e-05, 'sideways_atr_max_pct': 0.14121681023672733, 'sideways_tp_mult': 1.2964932788857895, 'sideways_tsl_mult': 0.7249692038367774, 'sideways_time_stop': 210, 'sideways_use_sma': True, 'sideways_use_ema': False, 'sideways_use_atr': True, 'sideways_use_adx': False, 'sideways_use_spike': True, 'sideways_rsi_required': False}.
[I 2025-08-31 12:25:06,212] Trial 251 finished with values: [-1000000000.0, 1000000000.0] and parameters: {'p_sma': 16, 'p_std': 18, 'p_atr': 13, 'p_adx': 16, 'rsi_period': 77, 'ema1': 7, 'ema2': 27, 'slip_atr_k': 0.037374295823296336, 'slip_spread_k': 0.0010566223213294146, 'spread_hl_frac': 0.030108926654606866, 'bb_std_mult': 1.2493989775632448, 'rsi_os': 40, 'rsi_ob': 72, 'vol_spike': 0.074274872773863, 'adx_thresh': 21.288353587817394, 'atr_min_pct': 0.008909839873961167, 'atr_max_pct': 0.06602663602725213, 'tp_mult': 2.6955786491195544, 'tsl_mult': 0.03889639594985101, 'strategy': 'breakout', 'time_stop': 196, 'use_sma': False, 'use_atr': False, 'use_adx': False, 'use_ema': True, 'use_spike': True, 'rsi_required': True, 'edge_k': 0.8254284112781557, 'edge_cap': 0.7661542088336477, 'bull_strategy': 'breakout', 'bull_bb_std_mult': 2.7742312107471188, 'bull_rsi_os': 8, 'bull_rsi_ob': 76, 'bull_adx_thresh': 12.490688803195045, 'bull_atr_min_pct': 0.021531782483626485, 'bull_atr_max_pct': 0.1246770447977825, 'bull_tp_mult': 2.644745904302793, 'bull_tsl_mult': 0.29172533569571124, 'bull_time_stop': 91, 'bull_use_sma': True, 'bull_use_ema': True, 'bull_use_atr': True, 'bull_use_adx': True, 'bull_use_spike': False, 'bull_rsi_required': False, 'bear_strategy': 'breakout', 'bear_bb_std_mult': 1.9956375972534353, 'bear_rsi_os': 27, 'bear_rsi_ob': 73, 'bear_adx_thresh': 32.154038482463186, 'bear_atr_min_pct': 0.0262949628617722, 'bear_atr_max_pct': 0.04427290887464009, 'bear_tp_mult': 2.6982739471943455, 'bear_tsl_mult': 0.10328789936461769, 'bear_time_stop': 234, 'bear_use_sma': False, 'bear_use_ema': False, 'bear_use_atr': False, 'bear_use_adx': False, 'bear_use_spike': True, 'bear_rsi_required': True, 'sideways_strategy': 'mean_reversion', 'sideways_bb_std_mult': 3.3886492388121985, 'sideways_rsi_os': 33, 'sideways_rsi_ob': 83, 'sideways_adx_thresh': 12.134859310924497, 'sideways_atr_min_pct': 8.955030707139054e-05, 'sideways_atr_max_pct': 0.12769191482037845, 'sideways_tp_mult': 2.0295904218294223, 'sideways_tsl_mult': 0.6860272904428212, 'sideways_time_stop': 206, 'sideways_use_sma': True, 'sideways_use_ema': False, 'sideways_use_atr': True, 'sideways_use_adx': False, 'sideways_use_spike': False, 'sideways_rsi_required': True}.
