[I 2025-08-31 12:05:47,121] Trial 98 finished with values: [-1000000000.0, 1000000000.0] and parameters: {'p_sma': 37, 'p_std': 20, 'p_atr': 11, 'p_adx': 10, 'rsi_period': 82, 'ema1': 7, 'ema2': 38, 'slip_atr_k': 0.23928748410330544, 'slip_spread_k': 0.521265942494972, 'spread_hl_frac': 0.02907390899735259, 'bb_std_mult': 1.3027067659110918, 'rsi_os': 12, 'rsi_ob': 59, 'vol_spike': 0.03751938466094719, 'adx_thresh': 20.91443396928306, 'atr_min_pct': 0.02625777495436499, 'atr_max_pct': 0.08213189699636887, 'tp_mult': 1.4035822350700915, 'tsl_mult': 0.22654288041418674, 'strategy': 'mean_reversion', 'time_stop': 86, 'use_sma': False, 'use_atr': False, 'use_adx': True, 'use_ema': False, 'use_spike': True, 'rsi_required': False, 'edge_k': 1.265661200759092, 'edge_cap': 0.3118930200788945, 'bull_strategy': 'breakout', 'bull_bb_std_mult': 3.409112019590167, 'bull_rsi_os': 15, 'bull_rsi_ob': 82, 'bull_adx_thresh': 11.387493944656422, 'bull_atr_min_pct': 0.012310262073153624, 'bull_atr_max_pct': 0.022804599888829973, 'bull_tp_mult': 2.9983053979949488, 'bull_tsl_mult': 0.968059874437008, 'bull_time_stop': 45, 'bull_use_sma': False, 'bull_use_ema': False, 'bull_use_atr': False, 'bull_use_adx': True, 'bull_use_spike': False, 'bull_rsi_required': True, 'bear_strategy': 'breakout', 'bear_bb_std_mult': 3.138868523917452, 'bear_rsi_os': 25, 'bear_rsi_ob': 57, 'bear_adx_thresh': 34.24005811511895, 'bear_atr_min_pct': 0.02170717943375442, 'bear_atr_max_pct': 0.09009780436245766, 'bear_tp_mult': 1.356084811125134, 'bear_tsl_mult': 0.5262987169956832, 'bear_time_stop': 281, 'bear_use_sma': False, 'bear_use_ema': False, 'bear_use_atr': True, 'bear_use_adx': False, 'bear_use_spike': True, 'bear_rsi_required': True, 'sideways_strategy': 'breakout', 'sideways_bb_std_mult': 2.1366532513141863, 'sideways_rsi_os': 32, 'sideways_rsi_ob': 52, 'sideways_adx_thresh': 17.090703095961434, 'sideways_atr_min_pct': 0.0010728521633308612, 'sideways_atr_max_pct': 0.1420512627873372, 'sideways_tp_mult': 1.543684120709077, 'sideways_tsl_mult': 0.6437233334027407, 'sideways_time_stop': 176, 'sideways_use_sma': False, 'sideways_use_ema': True, 'sideways_use_atr': True, 'sideways_use_adx': False, 'sideways_use_spike': True, 'sideways_rsi_required': False}.
[I 2025-08-31 12:06:17,886] Trial 102 finished with values: [-1000000000.0, 1000000000.0] and parameters: {'p_sma': 37, 'p_std': 19, 'p_atr': 11, 'p_adx': 15, 'rsi_period': 83, 'ema1': 7, 'ema2': 39, 'slip_atr_k': 0.24030592824178582, 'slip_spread_k': 0.5783505680552735, 'spread_hl_frac': 0.029864973760271942, 'bb_std_mult': 1.3510976524728007, 'rsi_os': 39, 'rsi_ob': 59, 'vol_spike': 0.2619299649201641, 'adx_thresh': 21.139252389352695, 'atr_min_pct': 0.027413590122601292, 'atr_max_pct': 0.07036949335251061, 'tp_mult': 2.844904903777159, 'tsl_mult': 0.5048118340232011, 'strategy': 'breakout', 'time_stop': 83, 'use_sma': True, 'use_atr': False, 'use_adx': True, 'use_ema': False, 'use_spike': False, 'rsi_required': False, 'edge_k': 0.39500375216558825, 'edge_cap': 0.30276814205721425, 'bull_strategy': 'mean_reversion', 'bull_bb_std_mult': 3.440270197312823, 'bull_rsi_os': 11, 'bull_rsi_ob': 82, 'bull_adx_thresh': 11.674943436544645, 'bull_atr_min_pct': 0.008172555140126655, 'bull_atr_max_pct': 0.026854569788766616, 'bull_tp_mult': 2.680588565009847, 'bull_tsl_mult': 0.9439065150995061, 'bull_time_stop': 45, 'bull_use_sma': False, 'bull_use_ema': False, 'bull_use_atr': False, 'bull_use_adx': True, 'bull_use_spike': False, 'bull_rsi_required': True, 'bear_strategy': 'breakout', 'bear_bb_std_mult': 1.4419452850027015, 'bear_rsi_os': 25, 'bear_rsi_ob': 57, 'bear_adx_thresh': 33.90054650476611, 'bear_atr_min_pct': 0.029869598188543716, 'bear_atr_max_pct': 0.08747286145110182, 'bear_tp_mult': 1.5385347946007508, 'bear_tsl_mult': 0.6258606014473054, 'bear_time_stop': 237, 'bear_use_sma': False, 'bear_use_ema': False, 'bear_use_atr': True, 'bear_use_adx': False, 'bear_use_spike': True, 'bear_rsi_required': False, 'sideways_strategy': 'mean_reversion', 'sideways_bb_std_mult': 2.155101476266235, 'sideways_rsi_os': 30, 'sideways_rsi_ob': 50, 'sideways_adx_thresh': 8.201160996793275, 'sideways_atr_min_pct': 0.0011745630205497056, 'sideways_atr_max_pct': 0.07679106666961602, 'sideways_tp_mult': 1.481170099495003, 'sideways_tsl_mult': 0.4919635888836198, 'sideways_time_stop': 138, 'sideways_use_sma': False, 'sideways_use_ema': True, 'sideways_use_atr': True, 'sideways_use_adx': False, 'sideways_use_spike': False, 'sideways_rsi_required': True}.
[I 2025-08-31 12:06:18,008] Trial 101 finished with values: [-0.023016347386465186, 0.023272673472145226] and parameters: {'p_sma': 37, 'p_std': 20, 'p_atr': 11, 'p_adx': 15, 'rsi_period': 78, 'ema1': 7, 'ema2': 38, 'slip_atr_k': 0.08187155241690659, 'slip_spread_k': 0.5764578661906715, 'spread_hl_frac': 0.03204317217892974, 'bb_std_mult': 1.2578780837135282, 'rsi_os': 40, 'rsi_ob': 64, 'vol_spike': 0.25662713984728525, 'adx_thresh': 20.449121625629697, 'atr_min_pct': 0.0268171327188637, 'atr_max_pct': 0.07039080981812129, 'tp_mult': 2.562538944406306, 'tsl_mult': 0.5067227683734562, 'strategy': 'mean_reversion', 'time_stop': 88, 'use_sma': True, 'use_atr': False, 'use_adx': True, 'use_ema': False, 'use_spike': False, 'rsi_required': False, 'edge_k': 1.270104718167019, 'edge_cap': 0.29848911446712034, 'bull_strategy': 'mean_reversion', 'bull_bb_std_mult': 3.437717706171041, 'bull_rsi_os': 11, 'bull_rsi_ob': 82, 'bull_adx_thresh': 11.468893665905098, 'bull_atr_min_pct': 0.003756380354910771, 'bull_atr_max_pct': 0.021859296123754587, 'bull_tp_mult': 2.6525082955887993, 'bull_tsl_mult': 0.2974960023384652, 'bull_time_stop': 56, 'bull_use_sma': False, 'bull_use_ema': False, 'bull_use_atr': False, 'bull_use_adx': True, 'bull_use_spike': False, 'bull_rsi_required': True, 'bear_strategy': 'breakout', 'bear_bb_std_mult': 1.4055853076624758, 'bear_rsi_os': 26, 'bear_rsi_ob': 57, 'bear_adx_thresh': 34.266191045176946, 'bear_atr_min_pct': 0.029051913813567296, 'bear_atr_max_pct': 0.09139684210885105, 'bear_tp_mult': 1.5289332972770173, 'bear_tsl_mult': 0.6241732366193482, 'bear_time_stop': 240, 'bear_use_sma': False, 'bear_use_ema': False, 'bear_use_atr': True, 'bear_use_adx': False, 'bear_use_spike': True, 'bear_rsi_required': False, 'sideways_strategy': 'mean_reversion', 'sideways_bb_std_mult': 2.279953197610229, 'sideways_rsi_os': 32, 'sideways_rsi_ob': 50, 'sideways_adx_thresh': 8.210848384131221, 'sideways_atr_min_pct': 0.0011361091168577181, 'sideways_atr_max_pct': 0.07558450645707711, 'sideways_tp_mult': 1.516417475345022, 'sideways_tsl_mult': 0.4934058689262378, 'sideways_time_stop': 136, 'sideways_use_sma': False, 'sideways_use_ema': True, 'sideways_use_atr': True, 'sideways_use_adx': False, 'sideways_use_spike': False, 'sideways_rsi_required': True}.
[I 2025-08-31 12:06:18,462] Trial 103 finished with values: [-1000000000.0, 1000000000.0] and parameters: {'p_sma': 32, 'p_std': 23, 'p_atr': 12, 'p_adx': 15, 'rsi_period': 75, 'ema1': 7, 'ema2': 40, 'slip_atr_k': 0.08260735254420389, 'slip_spread_k': 0.5654491414656087, 'spread_hl_frac': 0.029717387383202114, 'bb_std_mult': 1.390765146937623, 'rsi_os': 38, 'rsi_ob': 63, 'vol_spike': 0.27641936311400844, 'adx_thresh': 19.355963886196005, 'atr_min_pct': 0.02731429468652811, 'atr_max_pct': 0.09085414940921029, 'tp_mult': 2.7278299982868415, 'tsl_mult': 0.4285307274602157, 'strategy': 'breakout', 'time_stop': 67, 'use_sma': True, 'use_atr': True, 'use_adx': False, 'use_ema': False, 'use_spike': False, 'rsi_required': False, 'edge_k': 1.3460010584341744, 'edge_cap': 0.3029260707631922, 'bull_strategy': 'mean_reversion', 'bull_bb_std_mult': 3.518495503709048, 'bull_rsi_os': 10, 'bull_rsi_ob': 83, 'bull_adx_thresh': 6.906114084128034, 'bull_atr_min_pct': 0.007759648573956348, 'bull_atr_max_pct': 0.03386128769331247, 'bull_tp_mult': 2.6498703512707436, 'bull_tsl_mult': 0.9358586900267751, 'bull_time_stop': 30, 'bull_use_sma': False, 'bull_use_ema': False, 'bull_use_atr': False, 'bull_use_adx': True, 'bull_use_spike': False, 'bull_rsi_required': True, 'bear_strategy': 'breakout', 'bear_bb_std_mult': 1.4238924680898697, 'bear_rsi_os': 25, 'bear_rsi_ob': 62, 'bear_adx_thresh': 34.88914517134698, 'bear_atr_min_pct': 0.028417940693152097, 'bear_atr_max_pct': 0.08566775251974579, 'bear_tp_mult': 1.5629090760724664, 'bear_tsl_mult': 0.6165243991647691, 'bear_time_stop': 237, 'bear_use_sma': False, 'bear_use_ema': False, 'bear_use_atr': True, 'bear_use_adx': False, 'bear_use_spike': True, 'bear_rsi_required': False, 'sideways_strategy': 'mean_reversion', 'sideways_bb_std_mult': 2.2614200670146154, 'sideways_rsi_os': 30, 'sideways_rsi_ob': 50, 'sideways_adx_thresh': 8.499588409243731, 'sideways_atr_min_pct': 0.001846444901877145, 'sideways_atr_max_pct': 0.07733696732428645, 'sideways_tp_mult': 1.4749657477216644, 'sideways_tsl_mult': 0.4887912712979685, 'sideways_time_stop': 151, 'sideways_use_sma': False, 'sideways_use_ema': True, 'sideways_use_atr': True, 'sideways_use_adx': False, 'sideways_use_spike': False, 'sideways_rsi_required': True}.
[I 2025-08-31 12:06:18,533] Trial 100 finished with values: [-1000000000.0, 1000000000.0] and parameters: {'p_sma': 38, 'p_std': 19, 'p_atr': 11, 'p_adx': 15, 'rsi_period': 77, 'ema1': 7, 'ema2': 39, 'slip_atr_k': 0.07833368349299873, 'slip_spread_k': 0.5599814214999916, 'spread_hl_frac': 0.028898433714303326, 'bb_std_mult': 1.2265940051309598, 'rsi_os': 39, 'rsi_ob': 64, 'vol_spike': 0.25903868219327597, 'adx_thresh': 21.09866213513021, 'atr_min_pct': 0.027389551061098808, 'atr_max_pct': 0.0830017244043221, 'tp_mult': 2.577531384340166, 'tsl_mult': 0.49115005254987376, 'strategy': 'mean_reversion', 'time_stop': 87, 'use_sma': True, 'use_atr': False, 'use_adx': True, 'use_ema': False, 'use_spike': False, 'rsi_required': False, 'edge_k': 0.4032301458294617, 'edge_cap': 0.3157806003635015, 'bull_strategy': 'mean_reversion', 'bull_bb_std_mult': 3.435814886757583, 'bull_rsi_os': 11, 'bull_rsi_ob': 82, 'bull_adx_thresh': 11.61907543108675, 'bull_atr_min_pct': 0.00804534575107118, 'bull_atr_max_pct': 0.02528059793437427, 'bull_tp_mult': 2.657373105383921, 'bull_tsl_mult': 0.9382364749882179, 'bull_time_stop': 57, 'bull_use_sma': False, 'bull_use_ema': False, 'bull_use_atr': False, 'bull_use_adx': True, 'bull_use_spike': False, 'bull_rsi_required': True, 'bear_strategy': 'breakout', 'bear_bb_std_mult': 1.4361611707787112, 'bear_rsi_os': 25, 'bear_rsi_ob': 62, 'bear_adx_thresh': 34.466881664585316, 'bear_atr_min_pct': 0.02980074695444847, 'bear_atr_max_pct': 0.08709905939755415, 'bear_tp_mult': 1.6711954335636752, 'bear_tsl_mult': 0.6039917794259043, 'bear_time_stop': 239, 'bear_use_sma': False, 'bear_use_ema': False, 'bear_use_atr': True, 'bear_use_adx': False, 'bear_use_spike': True, 'bear_rsi_required': False, 'sideways_strategy': 'mean_reversion', 'sideways_bb_std_mult': 2.2618155609661708, 'sideways_rsi_os': 29, 'sideways_rsi_ob': 50, 'sideways_adx_thresh': 8.310716406197141, 'sideways_atr_min_pct': 0.0020767808658251666, 'sideways_atr_max_pct': 0.07570212767464647, 'sideways_tp_mult': 1.5249004657130434, 'sideways_tsl_mult': 0.5298327659069544, 'sideways_time_stop': 145, 'sideways_use_sma': False, 'sideways_use_ema': True, 'sideways_use_atr': True, 'sideways_use_adx': False, 'sideways_use_spike': False, 'sideways_rsi_required': True}.
[I 2025-08-31 12:06:48,758] Trial 104 finished with values: [-1000000000.0, 1000000000.0] and parameters: {'p_sma': 33, 'p_std': 16, 'p_atr': 11, 'p_adx': 14, 'rsi_period': 74, 'ema1': 6, 'ema2': 37, 'slip_atr_k': 0.0826985675546263, 'slip_spread_k': 0.5983998519978511, 'spread_hl_frac': 0.02664344090538569, 'bb_std_mult': 1.4137079411100162, 'rsi_os': 39, 'rsi_ob': 63, 'vol_spike': 0.2558695944314283, 'adx_thresh': 19.51960241407105, 'atr_min_pct': 0.027935671816652557, 'atr_max_pct': 0.08948645716116385, 'tp_mult': 2.713914750704399, 'tsl_mult': 0.29510739716244744, 'strategy': 'mean_reversion', 'time_stop': 62, 'use_sma': True, 'use_atr': True, 'use_adx': False, 'use_ema': False, 'use_spike': True, 'rsi_required': False, 'edge_k': 1.1290407651156207, 'edge_cap': 0.27174234639124367, 'bull_strategy': 'mean_reversion', 'bull_bb_std_mult': 3.524233228341669, 'bull_rsi_os': 9, 'bull_rsi_ob': 83, 'bull_adx_thresh': 9.022229489129296, 'bull_atr_min_pct': 0.005447826851658523, 'bull_atr_max_pct': 0.03257506608310541, 'bull_tp_mult': 2.862517029237623, 'bull_tsl_mult': 0.9260721352963742, 'bull_time_stop': 30, 'bull_use_sma': False, 'bull_use_ema': False, 'bull_use_atr': False, 'bull_use_adx': True, 'bull_use_spike': False, 'bull_rsi_required': True, 'bear_strategy': 'breakout', 'bear_bb_std_mult': 1.6734315702840656, 'bear_rsi_os': 29, 'bear_rsi_ob': 62, 'bear_adx_thresh': 34.3510841360794, 'bear_atr_min_pct': 0.028299909296578694, 'bear_atr_max_pct': 0.08597871473023239, 'bear_tp_mult': 1.6913230177158718, 'bear_tsl_mult': 0.1875185724520822, 'bear_time_stop': 253, 'bear_use_sma': False, 'bear_use_ema': False, 'bear_use_atr': False, 'bear_use_adx': False, 'bear_use_spike': True, 'bear_rsi_required': False, 'sideways_strategy': 'breakout', 'sideways_bb_std_mult': 2.2845214497326585, 'sideways_rsi_os': 26, 'sideways_rsi_ob': 47, 'sideways_adx_thresh': 9.694539677330766, 'sideways_atr_min_pct': 0.0019292166338328708, 'sideways_atr_max_pct': 0.07786646600932853, 'sideways_tp_mult': 1.361408175978033, 'sideways_tsl_mult': 0.4377493958066006, 'sideways_time_stop': 183, 'sideways_use_sma': False, 'sideways_use_ema': True, 'sideways_use_atr': True, 'sideways_use_adx': False, 'sideways_use_spike': False, 'sideways_rsi_required': True}.
[I 2025-08-31 12:06:49,542] Trial 107 finished with values: [-1000000000.0, 1000000000.0] and parameters: {'p_sma': 33, 'p_std': 25, 'p_atr': 12, 'p_adx': 14, 'rsi_period': 74, 'ema1': 6, 'ema2': 37, 'slip_atr_k': 0.07245056621933847, 'slip_spread_k': 0.42079407200773156, 'spread_hl_frac': 0.027251567204582883, 'bb_std_mult': 1.01754876630419, 'rsi_os': 43, 'rsi_ob': 61, 'vol_spike': 0.25533427643935186, 'adx_thresh': 17.028551200000283, 'atr_min_pct': 0.02848143021403208, 'atr_max_pct': 0.07690251857934992, 'tp_mult': 2.666034915292837, 'tsl_mult': 0.5535313005454284, 'strategy': 'mean_reversion', 'time_stop': 98, 'use_sma': True, 'use_atr': False, 'use_adx': True, 'use_ema': False, 'use_spike': True, 'rsi_required': False, 'edge_k': 1.265903046305456, 'edge_cap': 0.2845838298159705, 'bull_strategy': 'mean_reversion', 'bull_bb_std_mult': 3.3038536938655345, 'bull_rsi_os': 14, 'bull_rsi_ob': 80, 'bull_adx_thresh': 8.884641206062673, 'bull_atr_min_pct': 0.014654100969349713, 'bull_atr_max_pct': 0.01904796362582885, 'bull_tp_mult': 2.862422142716301, 'bull_tsl_mult': 0.916738508705421, 'bull_time_stop': 62, 'bull_use_sma': False, 'bull_use_ema': False, 'bull_use_atr': False, 'bull_use_adx': True, 'bull_use_spike': False, 'bull_rsi_required': False, 'bear_strategy': 'mean_reversion', 'bear_bb_std_mult': 1.660985855355702, 'bear_rsi_os': 29, 'bear_rsi_ob': 60, 'bear_adx_thresh': 33.763061846182275, 'bear_atr_min_pct': 0.028841356714659365, 'bear_atr_max_pct': 0.09790260681423903, 'bear_tp_mult': 1.6311488603182362, 'bear_tsl_mult': 0.6710816315269665, 'bear_time_stop': 253, 'bear_use_sma': False, 'bear_use_ema': False, 'bear_use_atr': False, 'bear_use_adx': False, 'bear_use_spike': True, 'bear_rsi_required': False, 'sideways_strategy': 'breakout', 'sideways_bb_std_mult': 2.0589179743551527, 'sideways_rsi_os': 36, 'sideways_rsi_ob': 47, 'sideways_adx_thresh': 9.754012252723246, 'sideways_atr_min_pct': 0.0024182099609481524, 'sideways_atr_max_pct': 0.07088039849192336, 'sideways_tp_mult': 1.373611012519143, 'sideways_tsl_mult': 0.441128282900511, 'sideways_time_stop': 179, 'sideways_use_sma': False, 'sideways_use_ema': True, 'sideways_use_atr': True, 'sideways_use_adx': False, 'sideways_use_spike': False, 'sideways_rsi_required': True}.
[I 2025-08-31 12:06:49,543] Trial 105 finished with values: [-1000000000.0, 1000000000.0] and parameters: {'p_sma': 33, 'p_std': 23, 'p_atr': 12, 'p_adx': 14, 'rsi_period': 74, 'ema1': 6, 'ema2': 37, 'slip_atr_k': 0.08172603490450084, 'slip_spread_k': 0.843363524938916, 'spread_hl_frac': 0.026859109400138068, 'bb_std_mult': 1.4298830910416642, 'rsi_os': 40, 'rsi_ob': 63, 'vol_spike': 0.27515343569885714, 'adx_thresh': 19.14066127094634, 'atr_min_pct': 0.027561860550946678, 'atr_max_pct': 0.08307648017364763, 'tp_mult': 2.6798041381033513, 'tsl_mult': 0.429338265079406, 'strategy': 'mean_reversion', 'time_stop': 65, 'use_sma': True, 'use_atr': True, 'use_adx': False, 'use_ema': False, 'use_spike': False, 'rsi_required': False, 'edge_k': 1.3524629202306586, 'edge_cap': 0.2823297710349475, 'bull_strategy': 'mean_reversion', 'bull_bb_std_mult': 3.561980070783565, 'bull_rsi_os': 9, 'bull_rsi_ob': 84, 'bull_adx_thresh': 9.017518921634245, 'bull_atr_min_pct': 0.005399246464994735, 'bull_atr_max_pct': 0.032944037915002174, 'bull_tp_mult': 2.871236389555616, 'bull_tsl_mult': 0.9168892609164031, 'bull_time_stop': 30, 'bull_use_sma': False, 'bull_use_ema': False, 'bull_use_atr': False, 'bull_use_adx': True, 'bull_use_spike': False, 'bull_rsi_required': True, 'bear_strategy': 'mean_reversion', 'bear_bb_std_mult': 1.3145493320158699, 'bear_rsi_os': 26, 'bear_rsi_ob': 62, 'bear_adx_thresh': 34.89458950508519, 'bear_atr_min_pct': 0.02851265277212036, 'bear_atr_max_pct': 0.08635298379438525, 'bear_tp_mult': 1.6462933769805947, 'bear_tsl_mult': 0.6654229983807809, 'bear_time_stop': 252, 'bear_use_sma': False, 'bear_use_ema': False, 'bear_use_atr': False, 'bear_use_adx': False, 'bear_use_spike': True, 'bear_rsi_required': False, 'sideways_strategy': 'mean_reversion', 'sideways_bb_std_mult': 2.238547975557894, 'sideways_rsi_os': 36, 'sideways_rsi_ob': 47, 'sideways_adx_thresh': 9.659368133729444, 'sideways_atr_min_pct': 0.0016338240686474131, 'sideways_atr_max_pct': 0.0703420167394526, 'sideways_tp_mult': 1.3587392892597336, 'sideways_tsl_mult': 0.5258721128695258, 'sideways_time_stop': 172, 'sideways_use_sma': False, 'sideways_use_ema': True, 'sideways_use_atr': True, 'sideways_use_adx': False, 'sideways_use_spike': False, 'sideways_rsi_required': True}.
[I 2025-08-31 12:06:49,543] Trial 106 finished with values: [-0.015008065793995384, 0.015169802968254207] and parameters: {'p_sma': 33, 'p_std': 16, 'p_atr': 11, 'p_adx': 14, 'rsi_period': 74, 'ema1': 6, 'ema2': 37, 'slip_atr_k': 0.0893830421876397, 'slip_spread_k': 0.14178910499286979, 'spread_hl_frac': 0.026618977424354488, 'bb_std_mult': 1.0073539235424616, 'rsi_os': 43, 'rsi_ob': 61, 'vol_spike': 0.2549897503955088, 'adx_thresh': 22.854762443989483, 'atr_min_pct': 0.027935468958442553, 'atr_max_pct': 0.07577234699577601, 'tp_mult': 2.57133434532997, 'tsl_mult': 0.4666485149243018, 'strategy': 'mean_reversion', 'time_stop': 95, 'use_sma': True, 'use_atr': False, 'use_adx': True, 'use_ema': False, 'use_spike': True, 'rsi_required': False, 'edge_k': 1.1495810401771027, 'edge_cap': 0.2794757280822399, 'bull_strategy': 'mean_reversion', 'bull_bb_std_mult': 3.242126238513492, 'bull_rsi_os': 13, 'bull_rsi_ob': 84, 'bull_adx_thresh': 8.96290217077095, 'bull_atr_min_pct': 0.0257859775064224, 'bull_atr_max_pct': 0.02973189562719775, 'bull_tp_mult': 2.734610818349113, 'bull_tsl_mult': 0.2966465869150837, 'bull_time_stop': 78, 'bull_use_sma': False, 'bull_use_ema': False, 'bull_use_atr': False, 'bull_use_adx': True, 'bull_use_spike': False, 'bull_rsi_required': True, 'bear_strategy': 'mean_reversion', 'bear_bb_std_mult': 1.6403952885493474, 'bear_rsi_os': 24, 'bear_rsi_ob': 61, 'bear_adx_thresh': 33.651520806132346, 'bear_atr_min_pct': 0.028746985430904592, 'bear_atr_max_pct': 0.10001142304921602, 'bear_tp_mult': 1.6682946551238358, 'bear_tsl_mult': 0.1851066650861629, 'bear_time_stop': 252, 'bear_use_sma': False, 'bear_use_ema': False, 'bear_use_atr': False, 'bear_use_adx': False, 'bear_use_spike': True, 'bear_rsi_required': False, 'sideways_strategy': 'breakout', 'sideways_bb_std_mult': 2.0594404997440137, 'sideways_rsi_os': 36, 'sideways_rsi_ob': 47, 'sideways_adx_thresh': 9.573650788205562, 'sideways_atr_min_pct': 0.0020443111646153353, 'sideways_atr_max_pct': 0.0688611783609241, 'sideways_tp_mult': 1.3847096088237756, 'sideways_tsl_mult': 0.4384837952971185, 'sideways_time_stop': 183, 'sideways_use_sma': False, 'sideways_use_ema': True, 'sideways_use_atr': True, 'sideways_use_adx': False, 'sideways_use_spike': False, 'sideways_rsi_required': True}.
