[I 2025-08-31 13:44:04,550] Trial 835 finished with values: [-1000000000.0, 1000000000.0] and parameters: {'p_sma': 19, 'p_std': 12, 'p_atr': 8, 'p_adx': 21, 'rsi_period': 11, 'ema1': 14, 'ema2': 27, 'slip_atr_k': 0.04635276580822189, 'slip_spread_k': 0.5947227737781516, 'spread_hl_frac': 0.04199695971001338, 'bb_std_mult': 2.304904955846272, 'rsi_os': 10, 'rsi_ob': 83, 'vol_spike': 0.15705328393260565, 'adx_thresh': 17.074310787274978, 'atr_min_pct': 0.012998305565689362, 'atr_max_pct': 0.03801440345460928, 'tp_mult': 1.774196343854043, 'tsl_mult': 0.5072570898656608, 'strategy': 'mean_reversion', 'time_stop': 292, 'use_sma': False, 'use_atr': False, 'use_adx': True, 'use_ema': True, 'use_spike': True, 'rsi_required': False, 'edge_k': 0.6457183443680914, 'edge_cap': 0.8538663200768086, 'bull_strategy': 'mean_reversion', 'bull_bb_std_mult': 2.872756814366161, 'bull_rsi_os': 8, 'bull_rsi_ob': 84, 'bull_adx_thresh': 17.51219851656246, 'bull_atr_min_pct': 0.02024042698975318, 'bull_atr_max_pct': 0.03235187895114199, 'bull_tp_mult': 2.3461896114607894, 'bull_tsl_mult': 0.5288166041105266, 'bull_time_stop': 17, 'bull_use_sma': True, 'bull_use_ema': True, 'bull_use_atr': True, 'bull_use_adx': True, 'bull_use_spike': True, 'bull_rsi_required': True, 'bear_strategy': 'breakout', 'bear_bb_std_mult': 3.4243310208551145, 'bear_rsi_os': 26, 'bear_rsi_ob': 49, 'bear_adx_thresh': 19.9744571860859, 'bear_atr_min_pct': 0.015360933241851383, 'bear_atr_max_pct': 0.1339141985631279, 'bear_tp_mult': 1.5748363588686671, 'bear_tsl_mult': 0.7001631214263688, 'bear_time_stop': 87, 'bear_use_sma': False, 'bear_use_ema': False, 'bear_use_atr': False, 'bear_use_adx': False, 'bear_use_spike': True, 'bear_rsi_required': True, 'sideways_strategy': 'breakout', 'sideways_bb_std_mult': 3.354648268964663, 'sideways_rsi_os': 29, 'sideways_rsi_ob': 87, 'sideways_adx_thresh': 8.156499802565243, 'sideways_atr_min_pct': 0.02357947386115558, 'sideways_atr_max_pct': 0.14741899207901352, 'sideways_tp_mult': 1.7320172700460001, 'sideways_tsl_mult': 0.5082150789399816, 'sideways_time_stop': 43, 'sideways_use_sma': False, 'sideways_use_ema': False, 'sideways_use_atr': True, 'sideways_use_adx': True, 'sideways_use_spike': False, 'sideways_rsi_required': True}.
[I 2025-08-31 13:44:04,857] Trial 838 finished with values: [-1000000000.0, 1000000000.0] and parameters: {'p_sma': 20, 'p_std': 22, 'p_atr': 8, 'p_adx': 18, 'rsi_period': 61, 'ema1': 14, 'ema2': 53, 'slip_atr_k': 0.0368738640380951, 'slip_spread_k': 0.4407536443338976, 'spread_hl_frac': 0.016938729487594145, 'bb_std_mult': 2.29145228655721, 'rsi_os': 18, 'rsi_ob': 56, 'vol_spike': 0.011898849321639992, 'adx_thresh': 5.716036432032924, 'atr_min_pct': 0.016401912044040522, 'atr_max_pct': 0.04737097415106658, 'tp_mult': 1.9538484746575615, 'tsl_mult': 0.7472538409306866, 'strategy': 'breakout', 'time_stop': 81, 'use_sma': False, 'use_atr': False, 'use_adx': True, 'use_ema': True, 'use_spike': True, 'rsi_required': False, 'edge_k': 0.6215485232873516, 'edge_cap': 0.8607477571389298, 'bull_strategy': 'mean_reversion', 'bull_bb_std_mult': 2.740779608210428, 'bull_rsi_os': 8, 'bull_rsi_ob': 84, 'bull_adx_thresh': 28.07715312753782, 'bull_atr_min_pct': 0.02508585600242799, 'bull_atr_max_pct': 0.10706204868166681, 'bull_tp_mult': 2.219122015103177, 'bull_tsl_mult': 0.27175031647841863, 'bull_time_stop': 165, 'bull_use_sma': False, 'bull_use_ema': True, 'bull_use_atr': True, 'bull_use_adx': True, 'bull_use_spike': True, 'bull_rsi_required': True, 'bear_strategy': 'mean_reversion', 'bear_bb_std_mult': 2.3484642750992677, 'bear_rsi_os': 25, 'bear_rsi_ob': 71, 'bear_adx_thresh': 20.36916855572735, 'bear_atr_min_pct': 0.015613427578601272, 'bear_atr_max_pct': 0.011569167077565584, 'bear_tp_mult': 2.6280328469012946, 'bear_tsl_mult': 0.4151075755505668, 'bear_time_stop': 213, 'bear_use_sma': False, 'bear_use_ema': True, 'bear_use_atr': False, 'bear_use_adx': False, 'bear_use_spike': False, 'bear_rsi_required': True, 'sideways_strategy': 'breakout', 'sideways_bb_std_mult': 2.904457361658871, 'sideways_rsi_os': 27, 'sideways_rsi_ob': 68, 'sideways_adx_thresh': 34.929003987780376, 'sideways_atr_min_pct': 0.006221715109110392, 'sideways_atr_max_pct': 0.14743028917419532, 'sideways_tp_mult': 1.792115340269153, 'sideways_tsl_mult': 0.3838303095831411, 'sideways_time_stop': 53, 'sideways_use_sma': False, 'sideways_use_ema': False, 'sideways_use_atr': True, 'sideways_use_adx': True, 'sideways_use_spike': True, 'sideways_rsi_required': True}.
[I 2025-08-31 13:44:37,596] Trial 842 finished with values: [-1000000000.0, 1000000000.0] and parameters: {'p_sma': 32, 'p_std': 20, 'p_atr': 14, 'p_adx': 11, 'rsi_period': 17, 'ema1': 8, 'ema2': 21, 'slip_atr_k': 0.04023996649013368, 'slip_spread_k': 0.42105581941013054, 'spread_hl_frac': 0.04573423164823905, 'bb_std_mult': 0.5027612210764272, 'rsi_os': 37, 'rsi_ob': 90, 'vol_spike': 0.023203106718597315, 'adx_thresh': 9.243986572150263, 'atr_min_pct': 0.024493582803758046, 'atr_max_pct': 0.03511333943458499, 'tp_mult': 1.300098738764198, 'tsl_mult': 0.7668737471397179, 'strategy': 'breakout', 'time_stop': 177, 'use_sma': False, 'use_atr': False, 'use_adx': True, 'use_ema': True, 'use_spike': True, 'rsi_required': False, 'edge_k': 0.5222388915120517, 'edge_cap': 0.067106163704518, 'bull_strategy': 'mean_reversion', 'bull_bb_std_mult': 2.351908276592191, 'bull_rsi_os': 47, 'bull_rsi_ob': 86, 'bull_adx_thresh': 29.45516487416772, 'bull_atr_min_pct': 0.01366946232275822, 'bull_atr_max_pct': 0.02394157458572005, 'bull_tp_mult': 2.9271221156237903, 'bull_tsl_mult': 0.8163370459515935, 'bull_time_stop': 118, 'bull_use_sma': False, 'bull_use_ema': True, 'bull_use_atr': True, 'bull_use_adx': True, 'bull_use_spike': True, 'bull_rsi_required': True, 'bear_strategy': 'mean_reversion', 'bear_bb_std_mult': 3.3220112997856375, 'bear_rsi_os': 28, 'bear_rsi_ob': 74, 'bear_adx_thresh': 17.950833764749895, 'bear_atr_min_pct': 0.02179965013385411, 'bear_atr_max_pct': 0.05523158078909572, 'bear_tp_mult': 1.9845678446603638, 'bear_tsl_mult': 0.708560899821389, 'bear_time_stop': 201, 'bear_use_sma': False, 'bear_use_ema': True, 'bear_use_atr': False, 'bear_use_adx': False, 'bear_use_spike': True, 'bear_rsi_required': True, 'sideways_strategy': 'breakout', 'sideways_bb_std_mult': 2.8733041748592187, 'sideways_rsi_os': 32, 'sideways_rsi_ob': 85, 'sideways_adx_thresh': 24.312637808741087, 'sideways_atr_min_pct': 0.005135423232074587, 'sideways_atr_max_pct': 0.14465878082175748, 'sideways_tp_mult': 1.2485697195685028, 'sideways_tsl_mult': 0.79420170402224, 'sideways_time_stop': 52, 'sideways_use_sma': False, 'sideways_use_ema': False, 'sideways_use_atr': True, 'sideways_use_adx': True, 'sideways_use_spike': True, 'sideways_rsi_required': False}.
[I 2025-08-31 13:44:37,954] Trial 840 finished with values: [-1000000000.0, 1000000000.0] and parameters: {'p_sma': 32, 'p_std': 22, 'p_atr': 10, 'p_adx': 14, 'rsi_period': 53, 'ema1': 28, 'ema2': 22, 'slip_atr_k': 0.12044393473264772, 'slip_spread_k': 0.847375551330542, 'spread_hl_frac': 0.03729821962666338, 'bb_std_mult': 2.5066344870799515, 'rsi_os': 37, 'rsi_ob': 56, 'vol_spike': 0.28805706275808063, 'adx_thresh': 32.075952389605305, 'atr_min_pct': 0.016424434175775278, 'atr_max_pct': 0.04777947873953005, 'tp_mult': 2.563936749505679, 'tsl_mult': 0.7692692878503358, 'strategy': 'breakout', 'time_stop': 176, 'use_sma': False, 'use_atr': False, 'use_adx': True, 'use_ema': True, 'use_spike': True, 'rsi_required': False, 'edge_k': 0.6204922769121209, 'edge_cap': 0.8715246138719679, 'bull_strategy': 'mean_reversion', 'bull_bb_std_mult': 2.7280625749670206, 'bull_rsi_os': 5, 'bull_rsi_ob': 86, 'bull_adx_thresh': 18.34560399589091, 'bull_atr_min_pct': 0.016590635784591554, 'bull_atr_max_pct': 0.10700626420679038, 'bull_tp_mult': 1.6944875529685384, 'bull_tsl_mult': 0.2735282906488723, 'bull_time_stop': 119, 'bull_use_sma': False, 'bull_use_ema': True, 'bull_use_atr': True, 'bull_use_adx': True, 'bull_use_spike': True, 'bull_rsi_required': True, 'bear_strategy': 'mean_reversion', 'bear_bb_std_mult': 0.9056442241807918, 'bear_rsi_os': 28, 'bear_rsi_ob': 81, 'bear_adx_thresh': 19.082225839755118, 'bear_atr_min_pct': 0.017697544600073334, 'bear_atr_max_pct': 0.128752084209336, 'bear_tp_mult': 1.1016575592233617, 'bear_tsl_mult': 0.4199937527262924, 'bear_time_stop': 200, 'bear_use_sma': False, 'bear_use_ema': True, 'bear_use_atr': False, 'bear_use_adx': False, 'bear_use_spike': True, 'bear_rsi_required': True, 'sideways_strategy': 'breakout', 'sideways_bb_std_mult': 2.8972121533078514, 'sideways_rsi_os': 43, 'sideways_rsi_ob': 51, 'sideways_adx_thresh': 34.88595781251337, 'sideways_atr_min_pct': 0.02994774087791304, 'sideways_atr_max_pct': 0.03789204195238769, 'sideways_tp_mult': 1.634661917466757, 'sideways_tsl_mult': 0.798191344016514, 'sideways_time_stop': 53, 'sideways_use_sma': False, 'sideways_use_ema': False, 'sideways_use_atr': True, 'sideways_use_adx': True, 'sideways_use_spike': True, 'sideways_rsi_required': False}.
[I 2025-08-31 13:44:38,419] Trial 839 finished with values: [-1000000000.0, 1000000000.0] and parameters: {'p_sma': 20, 'p_std': 59, 'p_atr': 14, 'p_adx': 27, 'rsi_period': 35, 'ema1': 9, 'ema2': 22, 'slip_atr_k': 0.05233285405103788, 'slip_spread_k': 0.5898870815557197, 'spread_hl_frac': 0.03865215105921537, 'bb_std_mult': 2.4867890937486, 'rsi_os': 39, 'rsi_ob': 81, 'vol_spike': 0.20973113022074913, 'adx_thresh': 7.459634057883816, 'atr_min_pct': 0.008591414601022529, 'atr_max_pct': 0.0468690314842987, 'tp_mult': 1.9744655616654143, 'tsl_mult': 0.3445007406268262, 'strategy': 'breakout', 'time_stop': 161, 'use_sma': False, 'use_atr': False, 'use_adx': True, 'use_ema': True, 'use_spike': True, 'rsi_required': False, 'edge_k': 0.6349238377272122, 'edge_cap': 0.20040928388447254, 'bull_strategy': 'mean_reversion', 'bull_bb_std_mult': 3.3344213650654675, 'bull_rsi_os': 45, 'bull_rsi_ob': 86, 'bull_adx_thresh': 20.46797895616419, 'bull_atr_min_pct': 0.021746001443533076, 'bull_atr_max_pct': 0.03149809306999868, 'bull_tp_mult': 2.210406761738367, 'bull_tsl_mult': 0.6416905499082228, 'bull_time_stop': 117, 'bull_use_sma': False, 'bull_use_ema': True, 'bull_use_atr': True, 'bull_use_adx': True, 'bull_use_spike': True, 'bull_rsi_required': True, 'bear_strategy': 'mean_reversion', 'bear_bb_std_mult': 3.32823733981508, 'bear_rsi_os': 15, 'bear_rsi_ob': 83, 'bear_adx_thresh': 17.93942239814495, 'bear_atr_min_pct': 0.0018215844463467107, 'bear_atr_max_pct': 0.1288608864958841, 'bear_tp_mult': 1.099998694990467, 'bear_tsl_mult': 0.6869583702710161, 'bear_time_stop': 213, 'bear_use_sma': False, 'bear_use_ema': True, 'bear_use_atr': False, 'bear_use_adx': False, 'bear_use_spike': True, 'bear_rsi_required': True, 'sideways_strategy': 'breakout', 'sideways_bb_std_mult': 2.959887820360029, 'sideways_rsi_os': 47, 'sideways_rsi_ob': 66, 'sideways_adx_thresh': 23.603958693064335, 'sideways_atr_min_pct': 0.012709475939492558, 'sideways_atr_max_pct': 0.14996118538732672, 'sideways_tp_mult': 1.906563098348741, 'sideways_tsl_mult': 0.022578175568415182, 'sideways_time_stop': 54, 'sideways_use_sma': False, 'sideways_use_ema': False, 'sideways_use_atr': True, 'sideways_use_adx': True, 'sideways_use_spike': True, 'sideways_rsi_required': True}.
[I 2025-08-31 13:44:38,747] Trial 841 finished with values: [-1000000000.0, 1000000000.0] and parameters: {'p_sma': 58, 'p_std': 20, 'p_atr': 14, 'p_adx': 14, 'rsi_period': 16, 'ema1': 18, 'ema2': 22, 'slip_atr_k': 0.03854964557920444, 'slip_spread_k': 0.4407933540887024, 'spread_hl_frac': 0.007509268218881985, 'bb_std_mult': 2.4748063945664835, 'rsi_os': 41, 'rsi_ob': 90, 'vol_spike': 0.2863802197673303, 'adx_thresh': 31.965105337883085, 'atr_min_pct': 0.024166840295683202, 'atr_max_pct': 0.04777400522499186, 'tp_mult': 2.327157592214225, 'tsl_mult': 0.765065736512531, 'strategy': 'breakout', 'time_stop': 277, 'use_sma': False, 'use_atr': False, 'use_adx': True, 'use_ema': True, 'use_spike': True, 'rsi_required': False, 'edge_k': 1.936362424695273, 'edge_cap': 0.3906025081102775, 'bull_strategy': 'mean_reversion', 'bull_bb_std_mult': 2.7025217132578563, 'bull_rsi_os': 5, 'bull_rsi_ob': 86, 'bull_adx_thresh': 20.351438576246515, 'bull_atr_min_pct': 0.016756179416941786, 'bull_atr_max_pct': 0.14472467709418857, 'bull_tp_mult': 2.222833291316411, 'bull_tsl_mult': 0.6345332427672186, 'bull_time_stop': 166, 'bull_use_sma': False, 'bull_use_ema': True, 'bull_use_atr': True, 'bull_use_adx': True, 'bull_use_spike': True, 'bull_rsi_required': True, 'bear_strategy': 'mean_reversion', 'bear_bb_std_mult': 0.8745712777461754, 'bear_rsi_os': 15, 'bear_rsi_ob': 45, 'bear_adx_thresh': 19.17447224960511, 'bear_atr_min_pct': 0.0017722157539015386, 'bear_atr_max_pct': 0.12872030730898817, 'bear_tp_mult': 1.1125381585161211, 'bear_tsl_mult': 0.7064289458066784, 'bear_time_stop': 199, 'bear_use_sma': False, 'bear_use_ema': True, 'bear_use_atr': False, 'bear_use_adx': False, 'bear_use_spike': True, 'bear_rsi_required': True, 'sideways_strategy': 'breakout', 'sideways_bb_std_mult': 2.8816136863195077, 'sideways_rsi_os': 10, 'sideways_rsi_ob': 68, 'sideways_adx_thresh': 34.9177026646616, 'sideways_atr_min_pct': 0.012594355268195214, 'sideways_atr_max_pct': 0.1470959464502043, 'sideways_tp_mult': 1.6266720837980417, 'sideways_tsl_mult': 0.8826636538336182, 'sideways_time_stop': 52, 'sideways_use_sma': False, 'sideways_use_ema': False, 'sideways_use_atr': True, 'sideways_use_adx': True, 'sideways_use_spike': True, 'sideways_rsi_required': False}.
[I 2025-08-31 13:45:12,855] Trial 843 finished with values: [-0.03804603327402112, 0.03736873585786497] and parameters: {'p_sma': 11, 'p_std': 23, 'p_atr': 19, 'p_adx': 12, 'rsi_period': 51, 'ema1': 6, 'ema2': 22, 'slip_atr_k': 0.12135561058209933, 'slip_spread_k': 0.8464700070132685, 'spread_hl_frac': 0.019264224911762978, 'bb_std_mult': 2.397402330198048, 'rsi_os': 39, 'rsi_ob': 81, 'vol_spike': 0.28679268072994957, 'adx_thresh': 8.099815143599201, 'atr_min_pct': 0.029994080376218882, 'atr_max_pct': 0.06036172428446099, 'tp_mult': 2.131243708289917, 'tsl_mult': 0.3367374048036367, 'strategy': 'breakout', 'time_stop': 164, 'use_sma': False, 'use_atr': False, 'use_adx': True, 'use_ema': True, 'use_spike': True, 'rsi_required': False, 'edge_k': 0.5434386128916473, 'edge_cap': 0.612352550266927, 'bull_strategy': 'mean_reversion', 'bull_bb_std_mult': 2.8158596847693045, 'bull_rsi_os': 45, 'bull_rsi_ob': 85, 'bull_adx_thresh': 18.233242306581467, 'bull_atr_min_pct': 0.027784651932709986, 'bull_atr_max_pct': 0.14406520782101767, 'bull_tp_mult': 2.211414394141194, 'bull_tsl_mult': 0.0005870511368895048, 'bull_time_stop': 174, 'bull_use_sma': True, 'bull_use_ema': True, 'bull_use_atr': True, 'bull_use_adx': True, 'bull_use_spike': True, 'bull_rsi_required': True, 'bear_strategy': 'breakout', 'bear_bb_std_mult': 0.8859861410821335, 'bear_rsi_os': 28, 'bear_rsi_ob': 70, 'bear_adx_thresh': 19.275803628836123, 'bear_atr_min_pct': 0.0017574792629219153, 'bear_atr_max_pct': 0.12888209713106474, 'bear_tp_mult': 1.0974535767661564, 'bear_tsl_mult': 0.683779439298475, 'bear_time_stop': 95, 'bear_use_sma': False, 'bear_use_ema': True, 'bear_use_atr': False, 'bear_use_adx': False, 'bear_use_spike': True, 'bear_rsi_required': True, 'sideways_strategy': 'breakout', 'sideways_bb_std_mult': 2.6591362474219378, 'sideways_rsi_os': 43, 'sideways_rsi_ob': 65, 'sideways_adx_thresh': 15.00556642477806, 'sideways_atr_min_pct': 0.0020066429744808436, 'sideways_atr_max_pct': 0.09809641897060185, 'sideways_tp_mult': 2.943378348897894, 'sideways_tsl_mult': 0.31618938776280725, 'sideways_time_stop': 47, 'sideways_use_sma': False, 'sideways_use_ema': False, 'sideways_use_atr': True, 'sideways_use_adx': True, 'sideways_use_spike': False, 'sideways_rsi_required': True}.
[I 2025-08-31 13:45:13,340] Trial 846 finished with values: [-0.12175119697072934, 0.12112100768464658] and parameters: {'p_sma': 10, 'p_std': 24, 'p_atr': 26, 'p_adx': 13, 'rsi_period': 42, 'ema1': 16, 'ema2': 60, 'slip_atr_k': 0.21897074116684667, 'slip_spread_k': 0.37272829825410253, 'spread_hl_frac': 0.02097550790752739, 'bb_std_mult': 2.3913934053139307, 'rsi_os': 16, 'rsi_ob': 59, 'vol_spike': 0.13717409212076312, 'adx_thresh': 8.162831873218378, 'atr_min_pct': 0.009888059667220124, 'atr_max_pct': 0.042452301434838885, 'tp_mult': 1.358259036752735, 'tsl_mult': 0.8065588386897568, 'strategy': 'breakout', 'time_stop': 167, 'use_sma': False, 'use_atr': False, 'use_adx': True, 'use_ema': False, 'use_spike': True, 'rsi_required': False, 'edge_k': 1.0372188342623847, 'edge_cap': 0.613639516111159, 'bull_strategy': 'mean_reversion', 'bull_bb_std_mult': 3.056703283953166, 'bull_rsi_os': 55, 'bull_rsi_ob': 85, 'bull_adx_thresh': 25.463662809765044, 'bull_atr_min_pct': 0.02261375421852493, 'bull_atr_max_pct': 0.14384519142884847, 'bull_tp_mult': 2.3003949865474684, 'bull_tsl_mult': 0.22353657618278822, 'bull_time_stop': 187, 'bull_use_sma': True, 'bull_use_ema': False, 'bull_use_atr': True, 'bull_use_adx': False, 'bull_use_spike': True, 'bull_rsi_required': True, 'bear_strategy': 'breakout', 'bear_bb_std_mult': 3.5880131274673355, 'bear_rsi_os': 46, 'bear_rsi_ob': 71, 'bear_adx_thresh': 20.766129946117374, 'bear_atr_min_pct': 0.0004979985378670396, 'bear_atr_max_pct': 0.13178040510830777, 'bear_tp_mult': 1.232725667200278, 'bear_tsl_mult': 0.6752751058853738, 'bear_time_stop': 191, 'bear_use_sma': False, 'bear_use_ema': True, 'bear_use_atr': False, 'bear_use_adx': False, 'bear_use_spike': True, 'bear_rsi_required': True, 'sideways_strategy': 'mean_reversion', 'sideways_bb_std_mult': 2.5773700846035204, 'sideways_rsi_os': 17, 'sideways_rsi_ob': 65, 'sideways_adx_thresh': 25.225912941279137, 'sideways_atr_min_pct': 0.027648503120402106, 'sideways_atr_max_pct': 0.10297389087138933, 'sideways_tp_mult': 1.6569653787262668, 'sideways_tsl_mult': 0.42905459614101604, 'sideways_time_stop': 44, 'sideways_use_sma': False, 'sideways_use_ema': True, 'sideways_use_atr': True, 'sideways_use_adx': True, 'sideways_use_spike': False, 'sideways_rsi_required': True}.
[I 2025-08-31 13:45:13,587] Trial 845 finished with values: [-1000000000.0, 1000000000.0] and parameters: {'p_sma': 28, 'p_std': 35, 'p_atr': 19, 'p_adx': 13, 'rsi_period': 51, 'ema1': 16, 'ema2': 17, 'slip_atr_k': 0.21994065847658903, 'slip_spread_k': 0.9415096146434356, 'spread_hl_frac': 0.0016146085908395405, 'bb_std_mult': 2.404517701782736, 'rsi_os': 41, 'rsi_ob': 93, 'vol_spike': 0.007221798370703303, 'adx_thresh': 8.049656726753172, 'atr_min_pct': 0.025318464472021476, 'atr_max_pct': 0.04302593756886701, 'tp_mult': 2.333307218992812, 'tsl_mult': 0.6854810033072345, 'strategy': 'breakout', 'time_stop': 236, 'use_sma': False, 'use_atr': False, 'use_adx': True, 'use_ema': False, 'use_spike': True, 'rsi_required': False, 'edge_k': 0.5576369511958581, 'edge_cap': 0.3885123751597757, 'bull_strategy': 'mean_reversion', 'bull_bb_std_mult': 2.818763790297464, 'bull_rsi_os': 5, 'bull_rsi_ob': 85, 'bull_adx_thresh': 25.54839448068745, 'bull_atr_min_pct': 0.02282243224100451, 'bull_atr_max_pct': 0.08742822664159948, 'bull_tp_mult': 2.291193695745824, 'bull_tsl_mult': 0.2225098940082123, 'bull_time_stop': 187, 'bull_use_sma': True, 'bull_use_ema': True, 'bull_use_atr': True, 'bull_use_adx': True, 'bull_use_spike': True, 'bull_rsi_required': True, 'bear_strategy': 'breakout', 'bear_bb_std_mult': 3.5626313955549676, 'bear_rsi_os': 29, 'bear_rsi_ob': 71, 'bear_adx_thresh': 19.09920891804443, 'bear_atr_min_pct': 0.0017478537946542735, 'bear_atr_max_pct': 0.1311369604352563, 'bear_tp_mult': 1.2161871660671504, 'bear_tsl_mult': 0.7097521607228634, 'bear_time_stop': 189, 'bear_use_sma': False, 'bear_use_ema': True, 'bear_use_atr': False, 'bear_use_adx': False, 'bear_use_spike': True, 'bear_rsi_required': True, 'sideways_strategy': 'mean_reversion', 'sideways_bb_std_mult': 2.6605103033475626, 'sideways_rsi_os': 21, 'sideways_rsi_ob': 65, 'sideways_adx_thresh': 29.518795906721053, 'sideways_atr_min_pct': 0.027595769837679612, 'sideways_atr_max_pct': 0.1041752027484596, 'sideways_tp_mult': 1.6608001559077583, 'sideways_tsl_mult': 0.8885908100550595, 'sideways_time_stop': 36, 'sideways_use_sma': False, 'sideways_use_ema': True, 'sideways_use_atr': True, 'sideways_use_adx': True, 'sideways_use_spike': False, 'sideways_rsi_required': True}.
