[I 2025-08-31 13:22:33,227] Trial 676 finished with values: [-1000000000.0, 1000000000.0] and parameters: {'p_sma': 16, 'p_std': 20, 'p_atr': 20, 'p_adx': 13, 'rsi_period': 45, 'ema1': 14, 'ema2': 19, 'slip_atr_k': 0.03266018744516622, 'slip_spread_k': 0.8425007769829139, 'spread_hl_frac': 0.019701300323521315, 'bb_std_mult': 3.5588469804774356, 'rsi_os': 9, 'rsi_ob': 94, 'vol_spike': 0.29421407248313014, 'adx_thresh': 6.455090513494534, 'atr_min_pct': 0.028842395918808345, 'atr_max_pct': 0.04446578142729407, 'tp_mult': 2.405388389916023, 'tsl_mult': 0.7149471190214676, 'strategy': 'breakout', 'time_stop': 66, 'use_sma': False, 'use_atr': False, 'use_adx': True, 'use_ema': True, 'use_spike': True, 'rsi_required': False, 'edge_k': 0.42865522164333253, 'edge_cap': 0.6867256054600043, 'bull_strategy': 'mean_reversion', 'bull_bb_std_mult': 3.458719829494269, 'bull_rsi_os': 5, 'bull_rsi_ob': 89, 'bull_adx_thresh': 19.93567619929526, 'bull_atr_min_pct': 0.021830777797227294, 'bull_atr_max_pct': 0.12906762031294994, 'bull_tp_mult': 2.2836384856270775, 'bull_tsl_mult': 0.26286499584716494, 'bull_time_stop': 213, 'bull_use_sma': False, 'bull_use_ema': True, 'bull_use_atr': True, 'bull_use_adx': True, 'bull_use_spike': True, 'bull_rsi_required': True, 'bear_strategy': 'breakout', 'bear_bb_std_mult': 3.427579217420052, 'bear_rsi_os': 30, 'bear_rsi_ob': 83, 'bear_adx_thresh': 24.254128530336736, 'bear_atr_min_pct': 0.0005409092504950453, 'bear_atr_max_pct': 0.1105038970862783, 'bear_tp_mult': 1.1345609604250806, 'bear_tsl_mult': 0.6659277744312485, 'bear_time_stop': 193, 'bear_use_sma': False, 'bear_use_ema': True, 'bear_use_atr': False, 'bear_use_adx': False, 'bear_use_spike': True, 'bear_rsi_required': True, 'sideways_strategy': 'mean_reversion', 'sideways_bb_std_mult': 2.806411985378212, 'sideways_rsi_os': 18, 'sideways_rsi_ob': 64, 'sideways_adx_thresh': 25.064109401350436, 'sideways_atr_min_pct': 0.0035113921321972483, 'sideways_atr_max_pct': 0.14681937209186516, 'sideways_tp_mult': 1.7011227000755087, 'sideways_tsl_mult': 0.8653489067878143, 'sideways_time_stop': 24, 'sideways_use_sma': False, 'sideways_use_ema': False, 'sideways_use_atr': True, 'sideways_use_adx': True, 'sideways_use_spike': False, 'sideways_rsi_required': False}.
[I 2025-08-31 13:22:33,310] Trial 675 finished with values: [-1000000000.0, 1000000000.0] and parameters: {'p_sma': 36, 'p_std': 20, 'p_atr': 14, 'p_adx': 12, 'rsi_period': 48, 'ema1': 12, 'ema2': 19, 'slip_atr_k': 0.04145371737782456, 'slip_spread_k': 0.942730597706252, 'spread_hl_frac': 0.043829925421376044, 'bb_std_mult': 2.4234475663793558, 'rsi_os': 45, 'rsi_ob': 83, 'vol_spike': 0.16799515910298837, 'adx_thresh': 6.818501827724532, 'atr_min_pct': 0.020544505237339195, 'atr_max_pct': 0.055648285080994515, 'tp_mult': 2.4682941002150094, 'tsl_mult': 0.715472068866407, 'strategy': 'breakout', 'time_stop': 179, 'use_sma': False, 'use_atr': False, 'use_adx': True, 'use_ema': True, 'use_spike': True, 'rsi_required': False, 'edge_k': 0.4618970177193994, 'edge_cap': 0.6293920423544507, 'bull_strategy': 'mean_reversion', 'bull_bb_std_mult': 2.9067318390057455, 'bull_rsi_os': 6, 'bull_rsi_ob': 87, 'bull_adx_thresh': 19.7048305690269, 'bull_atr_min_pct': 0.022119973541364524, 'bull_atr_max_pct': 0.1324459654254066, 'bull_tp_mult': 2.2511304264381815, 'bull_tsl_mult': 0.25890909103813986, 'bull_time_stop': 213, 'bull_use_sma': False, 'bull_use_ema': True, 'bull_use_atr': True, 'bull_use_adx': True, 'bull_use_spike': True, 'bull_rsi_required': True, 'bear_strategy': 'breakout', 'bear_bb_std_mult': 3.458153209399781, 'bear_rsi_os': 26, 'bear_rsi_ob': 71, 'bear_adx_thresh': 23.819089525840294, 'bear_atr_min_pct': 0.001252330919204845, 'bear_atr_max_pct': 0.11974972893735705, 'bear_tp_mult': 1.142433048123418, 'bear_tsl_mult': 0.701642788836593, 'bear_time_stop': 193, 'bear_use_sma': False, 'bear_use_ema': True, 'bear_use_atr': False, 'bear_use_adx': False, 'bear_use_spike': True, 'bear_rsi_required': True, 'sideways_strategy': 'mean_reversion', 'sideways_bb_std_mult': 2.7587722435388464, 'sideways_rsi_os': 26, 'sideways_rsi_ob': 64, 'sideways_adx_thresh': 24.24087158206009, 'sideways_atr_min_pct': 0.004365127205924405, 'sideways_atr_max_pct': 0.14330205867688955, 'sideways_tp_mult': 1.700972263239739, 'sideways_tsl_mult': 0.28566560283860126, 'sideways_time_stop': 35, 'sideways_use_sma': False, 'sideways_use_ema': False, 'sideways_use_atr': True, 'sideways_use_adx': True, 'sideways_use_spike': False, 'sideways_rsi_required': True}.
[I 2025-08-31 13:22:33,689] Trial 674 finished with values: [-1000000000.0, 1000000000.0] and parameters: {'p_sma': 17, 'p_std': 20, 'p_atr': 14, 'p_adx': 13, 'rsi_period': 48, 'ema1': 17, 'ema2': 19, 'slip_atr_k': 0.0439188154509033, 'slip_spread_k': 0.36437560298179156, 'spread_hl_frac': 0.019549155191784778, 'bb_std_mult': 2.4199803621861196, 'rsi_os': 27, 'rsi_ob': 94, 'vol_spike': 0.16552193633482595, 'adx_thresh': 6.8701018858718275, 'atr_min_pct': 0.020758597365196862, 'atr_max_pct': 0.05648144347755609, 'tp_mult': 2.473871322801227, 'tsl_mult': 0.7112494447540798, 'strategy': 'breakout', 'time_stop': 246, 'use_sma': False, 'use_atr': False, 'use_adx': True, 'use_ema': True, 'use_spike': True, 'rsi_required': False, 'edge_k': 0.44854556196111617, 'edge_cap': 0.6359440642404875, 'bull_strategy': 'mean_reversion', 'bull_bb_std_mult': 3.127970988513815, 'bull_rsi_os': 54, 'bull_rsi_ob': 90, 'bull_adx_thresh': 19.901867299754432, 'bull_atr_min_pct': 0.021311009874080963, 'bull_atr_max_pct': 0.13754366509143948, 'bull_tp_mult': 2.2222247915946296, 'bull_tsl_mult': 0.2605446853692108, 'bull_time_stop': 189, 'bull_use_sma': False, 'bull_use_ema': True, 'bull_use_atr': True, 'bull_use_adx': True, 'bull_use_spike': True, 'bull_rsi_required': True, 'bear_strategy': 'breakout', 'bear_bb_std_mult': 3.368971045134689, 'bear_rsi_os': 30, 'bear_rsi_ob': 71, 'bear_adx_thresh': 23.377805765712473, 'bear_atr_min_pct': 0.0013193556547314077, 'bear_atr_max_pct': 0.11889048916239904, 'bear_tp_mult': 1.127025692311753, 'bear_tsl_mult': 0.6674235371243606, 'bear_time_stop': 143, 'bear_use_sma': False, 'bear_use_ema': True, 'bear_use_atr': False, 'bear_use_adx': False, 'bear_use_spike': True, 'bear_rsi_required': True, 'sideways_strategy': 'mean_reversion', 'sideways_bb_std_mult': 2.7563241934373965, 'sideways_rsi_os': 27, 'sideways_rsi_ob': 64, 'sideways_adx_thresh': 24.93710580994197, 'sideways_atr_min_pct': 0.004862966885132294, 'sideways_atr_max_pct': 0.14365688396851709, 'sideways_tp_mult': 1.6928187560019197, 'sideways_tsl_mult': 0.5135893038118114, 'sideways_time_stop': 38, 'sideways_use_sma': False, 'sideways_use_ema': False, 'sideways_use_atr': True, 'sideways_use_adx': True, 'sideways_use_spike': False, 'sideways_rsi_required': True}.
[I 2025-08-31 13:23:06,974] Trial 678 finished with values: [-0.05744212169663876, 0.05685148846350032] and parameters: {'p_sma': 15, 'p_std': 21, 'p_atr': 20, 'p_adx': 13, 'rsi_period': 47, 'ema1': 13, 'ema2': 19, 'slip_atr_k': 0.0471643324292279, 'slip_spread_k': 0.09087029859191398, 'spread_hl_frac': 0.0016775385750268275, 'bb_std_mult': 2.433295451340284, 'rsi_os': 38, 'rsi_ob': 94, 'vol_spike': 0.10944270588333682, 'adx_thresh': 6.072115254603904, 'atr_min_pct': 0.022835818025686676, 'atr_max_pct': 0.057752494372834, 'tp_mult': 2.499281165005982, 'tsl_mult': 0.7113612919441552, 'strategy': 'breakout', 'time_stop': 180, 'use_sma': False, 'use_atr': False, 'use_adx': True, 'use_ema': True, 'use_spike': True, 'rsi_required': False, 'edge_k': 0.5581931759384188, 'edge_cap': 0.6521398588408435, 'bull_strategy': 'mean_reversion', 'bull_bb_std_mult': 2.8560209781691457, 'bull_rsi_os': 6, 'bull_rsi_ob': 88, 'bull_adx_thresh': 19.892673010782488, 'bull_atr_min_pct': 0.02180909948185638, 'bull_atr_max_pct': 0.1332509125353819, 'bull_tp_mult': 2.245833109069461, 'bull_tsl_mult': 0.2759181356011342, 'bull_time_stop': 207, 'bull_use_sma': True, 'bull_use_ema': True, 'bull_use_atr': True, 'bull_use_adx': True, 'bull_use_spike': True, 'bull_rsi_required': True, 'bear_strategy': 'breakout', 'bear_bb_std_mult': 3.447771591461234, 'bear_rsi_os': 38, 'bear_rsi_ob': 70, 'bear_adx_thresh': 19.83707009088331, 'bear_atr_min_pct': 0.0010226587852650711, 'bear_atr_max_pct': 0.12970203811316625, 'bear_tp_mult': 1.2447605725937052, 'bear_tsl_mult': 0.6935148288842702, 'bear_time_stop': 81, 'bear_use_sma': False, 'bear_use_ema': True, 'bear_use_atr': False, 'bear_use_adx': False, 'bear_use_spike': True, 'bear_rsi_required': True, 'sideways_strategy': 'breakout', 'sideways_bb_std_mult': 2.81439319071496, 'sideways_rsi_os': 26, 'sideways_rsi_ob': 64, 'sideways_adx_thresh': 24.66928248654283, 'sideways_atr_min_pct': 0.004732714405829419, 'sideways_atr_max_pct': 0.14037982798970758, 'sideways_tp_mult': 1.747506602491653, 'sideways_tsl_mult': 0.8427835820932507, 'sideways_time_stop': 38, 'sideways_use_sma': False, 'sideways_use_ema': False, 'sideways_use_atr': True, 'sideways_use_adx': True, 'sideways_use_spike': False, 'sideways_rsi_required': True}.
[I 2025-08-31 13:23:07,070] Trial 679 finished with values: [-1000000000.0, 1000000000.0] and parameters: {'p_sma': 21, 'p_std': 19, 'p_atr': 15, 'p_adx': 12, 'rsi_period': 47, 'ema1': 7, 'ema2': 19, 'slip_atr_k': 0.04771923294536146, 'slip_spread_k': 0.015085267737249941, 'spread_hl_frac': 0.017586036890594223, 'bb_std_mult': 2.569421577578633, 'rsi_os': 37, 'rsi_ob': 85, 'vol_spike': 0.24344165986078398, 'adx_thresh': 7.403481853045964, 'atr_min_pct': 0.02060924078845501, 'atr_max_pct': 0.056960296444086796, 'tp_mult': 2.490730016962936, 'tsl_mult': 0.5716221354370481, 'strategy': 'breakout', 'time_stop': 168, 'use_sma': True, 'use_atr': False, 'use_adx': True, 'use_ema': True, 'use_spike': True, 'rsi_required': False, 'edge_k': 0.5654484805206496, 'edge_cap': 0.6520398037369146, 'bull_strategy': 'mean_reversion', 'bull_bb_std_mult': 3.1146486088486207, 'bull_rsi_os': 51, 'bull_rsi_ob': 84, 'bull_adx_thresh': 18.684014539532196, 'bull_atr_min_pct': 0.021300158525058257, 'bull_atr_max_pct': 0.13317799672384933, 'bull_tp_mult': 1.9828059347546714, 'bull_tsl_mult': 0.30647589430862304, 'bull_time_stop': 190, 'bull_use_sma': True, 'bull_use_ema': True, 'bull_use_atr': True, 'bull_use_adx': True, 'bull_use_spike': True, 'bull_rsi_required': True, 'bear_strategy': 'breakout', 'bear_bb_std_mult': 3.370320077789889, 'bear_rsi_os': 29, 'bear_rsi_ob': 70, 'bear_adx_thresh': 20.043754959296585, 'bear_atr_min_pct': 0.0012263269526479087, 'bear_atr_max_pct': 0.13077194735553652, 'bear_tp_mult': 1.2543953624492783, 'bear_tsl_mult': 0.7056741282786815, 'bear_time_stop': 193, 'bear_use_sma': False, 'bear_use_ema': True, 'bear_use_atr': False, 'bear_use_adx': False, 'bear_use_spike': True, 'bear_rsi_required': True, 'sideways_strategy': 'breakout', 'sideways_bb_std_mult': 2.921847292441755, 'sideways_rsi_os': 25, 'sideways_rsi_ob': 66, 'sideways_adx_thresh': 24.41725532290753, 'sideways_atr_min_pct': 0.005013910069550927, 'sideways_atr_max_pct': 0.14132155346305106, 'sideways_tp_mult': 1.751040620103798, 'sideways_tsl_mult': 0.8434998129944521, 'sideways_time_stop': 74, 'sideways_use_sma': False, 'sideways_use_ema': False, 'sideways_use_atr': True, 'sideways_use_adx': True, 'sideways_use_spike': False, 'sideways_rsi_required': True}.
[I 2025-08-31 13:23:07,076] Trial 681 finished with values: [-1000000000.0, 1000000000.0] and parameters: {'p_sma': 21, 'p_std': 21, 'p_atr': 18, 'p_adx': 14, 'rsi_period': 40, 'ema1': 7, 'ema2': 18, 'slip_atr_k': 0.04746529776700118, 'slip_spread_k': 0.08948903812249215, 'spread_hl_frac': 0.01761965816191554, 'bb_std_mult': 3.0499551449804922, 'rsi_os': 37, 'rsi_ob': 87, 'vol_spike': 0.19310683429577755, 'adx_thresh': 5.7560220858372055, 'atr_min_pct': 0.022910249652629805, 'atr_max_pct': 0.03821901124291589, 'tp_mult': 2.505858498568135, 'tsl_mult': 0.933931052822516, 'strategy': 'breakout', 'time_stop': 167, 'use_sma': True, 'use_atr': False, 'use_adx': True, 'use_ema': False, 'use_spike': True, 'rsi_required': False, 'edge_k': 0.5787434737460072, 'edge_cap': 0.6613774825379617, 'bull_strategy': 'mean_reversion', 'bull_bb_std_mult': 1.9853982858561285, 'bull_rsi_os': 52, 'bull_rsi_ob': 84, 'bull_adx_thresh': 28.26865131276203, 'bull_atr_min_pct': 0.022866708408750706, 'bull_atr_max_pct': 0.13384636462595914, 'bull_tp_mult': 2.4908464359716325, 'bull_tsl_mult': 0.3090780574066273, 'bull_time_stop': 158, 'bull_use_sma': True, 'bull_use_ema': True, 'bull_use_atr': True, 'bull_use_adx': True, 'bull_use_spike': True, 'bull_rsi_required': True, 'bear_strategy': 'mean_reversion', 'bear_bb_std_mult': 3.5980923714495585, 'bear_rsi_os': 10, 'bear_rsi_ob': 89, 'bear_adx_thresh': 20.146242406732284, 'bear_atr_min_pct': 0.0007751117123188022, 'bear_atr_max_pct': 0.130528956176956, 'bear_tp_mult': 1.2279371558708252, 'bear_tsl_mult': 0.7064793207118231, 'bear_time_stop': 23, 'bear_use_sma': False, 'bear_use_ema': False, 'bear_use_atr': False, 'bear_use_adx': False, 'bear_use_spike': True, 'bear_rsi_required': False, 'sideways_strategy': 'breakout', 'sideways_bb_std_mult': 2.8279359522040606, 'sideways_rsi_os': 29, 'sideways_rsi_ob': 90, 'sideways_adx_thresh': 24.266440326942664, 'sideways_atr_min_pct': 0.003823194069573983, 'sideways_atr_max_pct': 0.14982670306483234, 'sideways_tp_mult': 1.833420758876539, 'sideways_tsl_mult': 0.8536382416244664, 'sideways_time_stop': 74, 'sideways_use_sma': False, 'sideways_use_ema': True, 'sideways_use_atr': True, 'sideways_use_adx': True, 'sideways_use_spike': False, 'sideways_rsi_required': True}.
[I 2025-08-31 13:23:07,345] Trial 680 finished with values: [-0.092446636088231, 0.09186087605041275] and parameters: {'p_sma': 21, 'p_std': 19, 'p_atr': 15, 'p_adx': 13, 'rsi_period': 49, 'ema1': 7, 'ema2': 18, 'slip_atr_k': 0.04699519956503419, 'slip_spread_k': 0.007432691764389487, 'spread_hl_frac': 0.017623620572960654, 'bb_std_mult': 2.3340373745992653, 'rsi_os': 38, 'rsi_ob': 84, 'vol_spike': 0.10884800616955677, 'adx_thresh': 7.4600264448588955, 'atr_min_pct': 0.022776697026533788, 'atr_max_pct': 0.03618759953843792, 'tp_mult': 2.4757296765719716, 'tsl_mult': 0.6659930420065053, 'strategy': 'breakout', 'time_stop': 168, 'use_sma': True, 'use_atr': False, 'use_adx': True, 'use_ema': False, 'use_spike': True, 'rsi_required': False, 'edge_k': 0.5604743004238549, 'edge_cap': 0.6488911902879395, 'bull_strategy': 'mean_reversion', 'bull_bb_std_mult': 1.9847082624541774, 'bull_rsi_os': 53, 'bull_rsi_ob': 85, 'bull_adx_thresh': 18.74048245481963, 'bull_atr_min_pct': 0.02117454204616126, 'bull_atr_max_pct': 0.13315969152957102, 'bull_tp_mult': 2.4665799016327807, 'bull_tsl_mult': 0.3096566654055366, 'bull_time_stop': 189, 'bull_use_sma': True, 'bull_use_ema': True, 'bull_use_atr': True, 'bull_use_adx': True, 'bull_use_spike': True, 'bull_rsi_required': True, 'bear_strategy': 'breakout', 'bear_bb_std_mult': 3.5949126829970135, 'bear_rsi_os': 42, 'bear_rsi_ob': 70, 'bear_adx_thresh': 19.919583937213265, 'bear_atr_min_pct': 0.0009128456909884303, 'bear_atr_max_pct': 0.13014014977994973, 'bear_tp_mult': 1.185040006439053, 'bear_tsl_mult': 0.706583321177008, 'bear_time_stop': 200, 'bear_use_sma': False, 'bear_use_ema': True, 'bear_use_atr': False, 'bear_use_adx': False, 'bear_use_spike': True, 'bear_rsi_required': True, 'sideways_strategy': 'breakout', 'sideways_bb_std_mult': 2.8969543324088662, 'sideways_rsi_os': 29, 'sideways_rsi_ob': 66, 'sideways_adx_thresh': 24.868133892843968, 'sideways_atr_min_pct': 0.00376029608002241, 'sideways_atr_max_pct': 0.1499461120566504, 'sideways_tp_mult': 1.8581135724946476, 'sideways_tsl_mult': 0.516103225303163, 'sideways_time_stop': 55, 'sideways_use_sma': False, 'sideways_use_ema': True, 'sideways_use_atr': True, 'sideways_use_adx': True, 'sideways_use_spike': False, 'sideways_rsi_required': True}.
[I 2025-08-31 13:23:38,731] Trial 685 finished with values: [-0.025455716868008182, 0.02540246643702907] and parameters: {'p_sma': 40, 'p_std': 22, 'p_atr': 17, 'p_adx': 14, 'rsi_period': 50, 'ema1': 15, 'ema2': 20, 'slip_atr_k': 0.03786653919566005, 'slip_spread_k': 0.8969450183343453, 'spread_hl_frac': 0.007802546358380749, 'bb_std_mult': 2.189408078547856, 'rsi_os': 25, 'rsi_ob': 90, 'vol_spike': 0.15765111844182136, 'adx_thresh': 7.872598378903518, 'atr_min_pct': 0.029979938411522012, 'atr_max_pct': 0.048946511574895685, 'tp_mult': 2.562063691323853, 'tsl_mult': 0.7887701474275541, 'strategy': 'breakout', 'time_stop': 184, 'use_sma': False, 'use_atr': False, 'use_adx': True, 'use_ema': True, 'use_spike': True, 'rsi_required': False, 'edge_k': 0.6034115960982268, 'edge_cap': 0.6873193593917138, 'bull_strategy': 'mean_reversion', 'bull_bb_std_mult': 1.775721014618262, 'bull_rsi_os': 5, 'bull_rsi_ob': 86, 'bull_adx_thresh': 17.73495176367445, 'bull_atr_min_pct': 0.022480566516538923, 'bull_atr_max_pct': 0.11707144761374541, 'bull_tp_mult': 2.0241138755608117, 'bull_tsl_mult': 0.2763181618114511, 'bull_time_stop': 182, 'bull_use_sma': True, 'bull_use_ema': False, 'bull_use_atr': True, 'bull_use_adx': True, 'bull_use_spike': True, 'bull_rsi_required': True, 'bear_strategy': 'mean_reversion', 'bear_bb_std_mult': 3.4892533337326976, 'bear_rsi_os': 31, 'bear_rsi_ob': 74, 'bear_adx_thresh': 18.1482328839767, 'bear_atr_min_pct': 0.01774379558107778, 'bear_atr_max_pct': 0.12642454263823277, 'bear_tp_mult': 1.0442176688550506, 'bear_tsl_mult': 0.6799650505648658, 'bear_time_stop': 207, 'bear_use_sma': False, 'bear_use_ema': False, 'bear_use_atr': False, 'bear_use_adx': False, 'bear_use_spike': True, 'bear_rsi_required': False, 'sideways_strategy': 'breakout', 'sideways_bb_std_mult': 3.069933656506067, 'sideways_rsi_os': 46, 'sideways_rsi_ob': 76, 'sideways_adx_thresh': 23.02574755135072, 'sideways_atr_min_pct': 0.0030167635654712627, 'sideways_atr_max_pct': 0.1457232131194619, 'sideways_tp_mult': 1.6837538330772484, 'sideways_tsl_mult': 0.3507440154201138, 'sideways_time_stop': 52, 'sideways_use_sma': False, 'sideways_use_ema': False, 'sideways_use_atr': True, 'sideways_use_adx': True, 'sideways_use_spike': False, 'sideways_rsi_required': False}.
[I 2025-08-31 13:23:40,162] Trial 682 finished with values: [-0.06537067117021744, 0.06495057250067442] and parameters: {'p_sma': 39, 'p_std': 21, 'p_atr': 17, 'p_adx': 14, 'rsi_period': 33, 'ema1': 7, 'ema2': 18, 'slip_atr_k': 0.03767511439595331, 'slip_spread_k': 0.016418657823910277, 'spread_hl_frac': 0.007558820742690191, 'bb_std_mult': 2.3190052426343426, 'rsi_os': 37, 'rsi_ob': 88, 'vol_spike': 0.2710394671680407, 'adx_thresh': 9.623709928678158, 'atr_min_pct': 0.029898382485092922, 'atr_max_pct': 0.04901358481051235, 'tp_mult': 2.503663469200536, 'tsl_mult': 0.615030725355643, 'strategy': 'breakout', 'time_stop': 168, 'use_sma': True, 'use_atr': False, 'use_adx': True, 'use_ema': False, 'use_spike': True, 'rsi_required': False, 'edge_k': 0.5951719647876093, 'edge_cap': 0.6528088952855462, 'bull_strategy': 'mean_reversion', 'bull_bb_std_mult': 1.7777286825276268, 'bull_rsi_os': 5, 'bull_rsi_ob': 86, 'bull_adx_thresh': 19.040720515773664, 'bull_atr_min_pct': 0.02300923239683831, 'bull_atr_max_pct': 0.1390803062326702, 'bull_tp_mult': 2.471462126780129, 'bull_tsl_mult': 0.3068874184385651, 'bull_time_stop': 156, 'bull_use_sma': True, 'bull_use_ema': True, 'bull_use_atr': True, 'bull_use_adx': True, 'bull_use_spike': True, 'bull_rsi_required': True, 'bear_strategy': 'mean_reversion', 'bear_bb_std_mult': 3.524392933297463, 'bear_rsi_os': 29, 'bear_rsi_ob': 63, 'bear_adx_thresh': 20.04848391511161, 'bear_atr_min_pct': 0.0008003450398805776, 'bear_atr_max_pct': 0.12562792299157235, 'bear_tp_mult': 1.215509912594445, 'bear_tsl_mult': 0.7060286476285497, 'bear_time_stop': 284, 'bear_use_sma': False, 'bear_use_ema': False, 'bear_use_atr': False, 'bear_use_adx': False, 'bear_use_spike': True, 'bear_rsi_required': False, 'sideways_strategy': 'breakout', 'sideways_bb_std_mult': 2.9192931465039926, 'sideways_rsi_os': 24, 'sideways_rsi_ob': 90, 'sideways_adx_thresh': 22.84951522697762, 'sideways_atr_min_pct': 0.0035590267374376533, 'sideways_atr_max_pct': 0.14749390812710564, 'sideways_tp_mult': 1.8022771624666143, 'sideways_tsl_mult': 0.18261414061626569, 'sideways_time_stop': 73, 'sideways_use_sma': False, 'sideways_use_ema': True, 'sideways_use_atr': True, 'sideways_use_adx': True, 'sideways_use_spike': False, 'sideways_rsi_required': True}.
