[I 2025-08-31 13:09:20,801] Trial 582 finished with values: [-0.02950012275823133, 0.029753459161826246] and parameters: {'p_sma': 59, 'p_std': 22, 'p_atr': 12, 'p_adx': 15, 'rsi_period': 56, 'ema1': 28, 'ema2': 60, 'slip_atr_k': 0.1762608970630748, 'slip_spread_k': 0.0730257659436247, 'spread_hl_frac': 0.033403573640054016, 'bb_std_mult': 3.5926062983204115, 'rsi_os': 40, 'rsi_ob': 84, 'vol_spike': 0.18736002980981295, 'adx_thresh': 28.018964326320287, 'atr_min_pct': 0.0006967127719689876, 'atr_max_pct': 0.015445476332853439, 'tp_mult': 2.591629370261343, 'tsl_mult': 0.2691875236125455, 'strategy': 'breakout', 'time_stop': 146, 'use_sma': False, 'use_atr': False, 'use_adx': False, 'use_ema': True, 'use_spike': False, 'rsi_required': True, 'edge_k': 1.0349081890555312, 'edge_cap': 0.4990132278832585, 'bull_strategy': 'breakout', 'bull_bb_std_mult': 3.522656154499656, 'bull_rsi_os': 5, 'bull_rsi_ob': 54, 'bull_adx_thresh': 19.040589231786225, 'bull_atr_min_pct': 0.0015120547057989233, 'bull_atr_max_pct': 0.053942188861717144, 'bull_tp_mult': 1.3607867469662351, 'bull_tsl_mult': 0.5905895140230325, 'bull_time_stop': 282, 'bull_use_sma': True, 'bull_use_ema': True, 'bull_use_atr': True, 'bull_use_adx': True, 'bull_use_spike': False, 'bull_rsi_required': False, 'bear_strategy': 'breakout', 'bear_bb_std_mult': 3.0381269843416754, 'bear_rsi_os': 9, 'bear_rsi_ob': 67, 'bear_adx_thresh': 23.720922820297297, 'bear_atr_min_pct': 0.003598834705149461, 'bear_atr_max_pct': 0.04684774228502394, 'bear_tp_mult': 1.9234578085108638, 'bear_tsl_mult': 0.8197980678806339, 'bear_time_stop': 211, 'bear_use_sma': True, 'bear_use_ema': True, 'bear_use_atr': True, 'bear_use_adx': True, 'bear_use_spike': True, 'bear_rsi_required': True, 'sideways_strategy': 'breakout', 'sideways_bb_std_mult': 2.72290491456341, 'sideways_rsi_os': 13, 'sideways_rsi_ob': 68, 'sideways_adx_thresh': 25.36451856474593, 'sideways_atr_min_pct': 0.01425074253628616, 'sideways_atr_max_pct': 0.13478070012679025, 'sideways_tp_mult': 2.5876688499883143, 'sideways_tsl_mult': 0.8999264049114293, 'sideways_time_stop': 226, 'sideways_use_sma': True, 'sideways_use_ema': False, 'sideways_use_atr': False, 'sideways_use_adx': False, 'sideways_use_spike': True, 'sideways_rsi_required': True}.
[I 2025-08-31 13:09:55,172] Trial 587 finished with values: [-0.07641875121063546, 0.07606595023508876] and parameters: {'p_sma': 41, 'p_std': 51, 'p_atr': 8, 'p_adx': 16, 'rsi_period': 47, 'ema1': 19, 'ema2': 55, 'slip_atr_k': 0.062142914102414896, 'slip_spread_k': 0.3257328918086232, 'spread_hl_frac': 0.014145743795142305, 'bb_std_mult': 2.3041186181615467, 'rsi_os': 38, 'rsi_ob': 79, 'vol_spike': 0.03273951769708219, 'adx_thresh': 20.764253479831154, 'atr_min_pct': 1.450834418813187e-05, 'atr_max_pct': 0.1274798137532064, 'tp_mult': 2.6675549398436753, 'tsl_mult': 0.20719690592952494, 'strategy': 'breakout', 'time_stop': 273, 'use_sma': True, 'use_atr': True, 'use_adx': False, 'use_ema': True, 'use_spike': True, 'rsi_required': False, 'edge_k': 0.45207875724130486, 'edge_cap': 0.7473738284805812, 'bull_strategy': 'breakout', 'bull_bb_std_mult': 2.6584569887565523, 'bull_rsi_os': 5, 'bull_rsi_ob': 67, 'bull_adx_thresh': 20.63859354048727, 'bull_atr_min_pct': 0.008343567871787465, 'bull_atr_max_pct': 0.033118068526681685, 'bull_tp_mult': 2.145442515337551, 'bull_tsl_mult': 0.22902857693416453, 'bull_time_stop': 277, 'bull_use_sma': True, 'bull_use_ema': False, 'bull_use_atr': False, 'bull_use_adx': True, 'bull_use_spike': False, 'bull_rsi_required': False, 'bear_strategy': 'mean_reversion', 'bear_bb_std_mult': 2.3380341455439417, 'bear_rsi_os': 52, 'bear_rsi_ob': 57, 'bear_adx_thresh': 13.906294685688032, 'bear_atr_min_pct': 0.0009090923805357871, 'bear_atr_max_pct': 0.10832676106659922, 'bear_tp_mult': 2.0874419123165624, 'bear_tsl_mult': 0.43149814154260596, 'bear_time_stop': 11, 'bear_use_sma': True, 'bear_use_ema': False, 'bear_use_atr': True, 'bear_use_adx': True, 'bear_use_spike': True, 'bear_rsi_required': False, 'sideways_strategy': 'breakout', 'sideways_bb_std_mult': 2.6090338436420875, 'sideways_rsi_os': 29, 'sideways_rsi_ob': 66, 'sideways_adx_thresh': 25.377738020485246, 'sideways_atr_min_pct': 0.004483664375485627, 'sideways_atr_max_pct': 0.13390347439249112, 'sideways_tp_mult': 1.525823340464123, 'sideways_tsl_mult': 0.9433969804345819, 'sideways_time_stop': 76, 'sideways_use_sma': True, 'sideways_use_ema': False, 'sideways_use_atr': False, 'sideways_use_adx': False, 'sideways_use_spike': False, 'sideways_rsi_required': False}.
[I 2025-08-31 13:09:55,851] Trial 588 finished with values: [-1000000000.0, 1000000000.0] and parameters: {'p_sma': 50, 'p_std': 58, 'p_atr': 12, 'p_adx': 26, 'rsi_period': 52, 'ema1': 22, 'ema2': 14, 'slip_atr_k': 0.06110502198526272, 'slip_spread_k': 0.43477772291784766, 'spread_hl_frac': 0.018666009065807787, 'bb_std_mult': 2.2044096371234887, 'rsi_os': 38, 'rsi_ob': 78, 'vol_spike': 0.02738485789792172, 'adx_thresh': 20.86497633281192, 'atr_min_pct': 6.059669379300547e-05, 'atr_max_pct': 0.026394027430888346, 'tp_mult': 2.788248867573929, 'tsl_mult': 0.09293660836561568, 'strategy': 'breakout', 'time_stop': 19, 'use_sma': True, 'use_atr': True, 'use_adx': False, 'use_ema': True, 'use_spike': True, 'rsi_required': False, 'edge_k': 0.7093352605148804, 'edge_cap': 0.7488502711350679, 'bull_strategy': 'mean_reversion', 'bull_bb_std_mult': 2.8689708885657885, 'bull_rsi_os': 42, 'bull_rsi_ob': 66, 'bull_adx_thresh': 29.173397672682956, 'bull_atr_min_pct': 0.01852263292904048, 'bull_atr_max_pct': 0.14743761956192294, 'bull_tp_mult': 2.0829999734456917, 'bull_tsl_mult': 0.26093840803261253, 'bull_time_stop': 278, 'bull_use_sma': True, 'bull_use_ema': False, 'bull_use_atr': False, 'bull_use_adx': True, 'bull_use_spike': False, 'bull_rsi_required': False, 'bear_strategy': 'breakout', 'bear_bb_std_mult': 3.1678189860445407, 'bear_rsi_os': 19, 'bear_rsi_ob': 72, 'bear_adx_thresh': 11.463609027213504, 'bear_atr_min_pct': 0.000889286219127712, 'bear_atr_max_pct': 0.14132532354640173, 'bear_tp_mult': 2.8883753093826714, 'bear_tsl_mult': 0.6224036886888143, 'bear_time_stop': 218, 'bear_use_sma': True, 'bear_use_ema': True, 'bear_use_atr': True, 'bear_use_adx': True, 'bear_use_spike': True, 'bear_rsi_required': True, 'sideways_strategy': 'mean_reversion', 'sideways_bb_std_mult': 2.966144807570546, 'sideways_rsi_os': 28, 'sideways_rsi_ob': 66, 'sideways_adx_thresh': 16.075026774053125, 'sideways_atr_min_pct': 0.00472050443939318, 'sideways_atr_max_pct': 0.134374805424211, 'sideways_tp_mult': 2.898742482883733, 'sideways_tsl_mult': 0.8402890199556092, 'sideways_time_stop': 201, 'sideways_use_sma': False, 'sideways_use_ema': False, 'sideways_use_atr': False, 'sideways_use_adx': False, 'sideways_use_spike': False, 'sideways_rsi_required': False}.
[I 2025-08-31 13:09:56,105] Trial 586 finished with values: [-0.023756356403904277, 0.023561411589311475] and parameters: {'p_sma': 27, 'p_std': 21, 'p_atr': 21, 'p_adx': 23, 'rsi_period': 55, 'ema1': 28, 'ema2': 47, 'slip_atr_k': 0.0679368795356177, 'slip_spread_k': 0.260639971526467, 'spread_hl_frac': 0.011675683326723857, 'bb_std_mult': 2.3062562317403037, 'rsi_os': 53, 'rsi_ob': 84, 'vol_spike': 0.032996818754253886, 'adx_thresh': 31.16171180405783, 'atr_min_pct': 0.0022830890305337425, 'atr_max_pct': 0.1481584553393545, 'tp_mult': 2.1218088196513745, 'tsl_mult': 0.544388349151877, 'strategy': 'breakout', 'time_stop': 162, 'use_sma': True, 'use_atr': False, 'use_adx': False, 'use_ema': True, 'use_spike': True, 'rsi_required': False, 'edge_k': 0.7038754031270646, 'edge_cap': 0.7521869271837649, 'bull_strategy': 'breakout', 'bull_bb_std_mult': 2.668303959144862, 'bull_rsi_os': 5, 'bull_rsi_ob': 50, 'bull_adx_thresh': 28.983352775924118, 'bull_atr_min_pct': 0.0014888764099627982, 'bull_atr_max_pct': 0.14995833885366636, 'bull_tp_mult': 2.086934737736666, 'bull_tsl_mult': 0.2560652692956495, 'bull_time_stop': 281, 'bull_use_sma': True, 'bull_use_ema': False, 'bull_use_atr': True, 'bull_use_adx': False, 'bull_use_spike': False, 'bull_rsi_required': False, 'bear_strategy': 'mean_reversion', 'bear_bb_std_mult': 3.166885609057108, 'bear_rsi_os': 29, 'bear_rsi_ob': 91, 'bear_adx_thresh': 17.350622763610495, 'bear_atr_min_pct': 0.0011717271305609171, 'bear_atr_max_pct': 0.08435399527126337, 'bear_tp_mult': 2.1018282293675172, 'bear_tsl_mult': 0.042600457807851655, 'bear_time_stop': 6, 'bear_use_sma': True, 'bear_use_ema': False, 'bear_use_atr': True, 'bear_use_adx': True, 'bear_use_spike': True, 'bear_rsi_required': False, 'sideways_strategy': 'breakout', 'sideways_bb_std_mult': 2.6257634721452163, 'sideways_rsi_os': 13, 'sideways_rsi_ob': 87, 'sideways_adx_thresh': 22.08942235625987, 'sideways_atr_min_pct': 0.004700684899262942, 'sideways_atr_max_pct': 0.13318994830210928, 'sideways_tp_mult': 1.5422400572241655, 'sideways_tsl_mult': 0.8385784388474392, 'sideways_time_stop': 215, 'sideways_use_sma': True, 'sideways_use_ema': False, 'sideways_use_atr': False, 'sideways_use_adx': False, 'sideways_use_spike': True, 'sideways_rsi_required': True}.
[I 2025-08-31 13:09:56,307] Trial 589 finished with values: [-1000000000.0, 1000000000.0] and parameters: {'p_sma': 40, 'p_std': 46, 'p_atr': 11, 'p_adx': 17, 'rsi_period': 24, 'ema1': 22, 'ema2': 14, 'slip_atr_k': 0.06074115265857981, 'slip_spread_k': 0.3326666729753866, 'spread_hl_frac': 0.011964266251393116, 'bb_std_mult': 2.306789740562328, 'rsi_os': 5, 'rsi_ob': 78, 'vol_spike': 0.12240919722508986, 'adx_thresh': 15.88172128473811, 'atr_min_pct': 0.022674721547080324, 'atr_max_pct': 0.1282589890535011, 'tp_mult': 2.7864399794782972, 'tsl_mult': 0.8239392150976148, 'strategy': 'breakout', 'time_stop': 275, 'use_sma': True, 'use_atr': True, 'use_adx': True, 'use_ema': True, 'use_spike': True, 'rsi_required': False, 'edge_k': 0.6972428391142098, 'edge_cap': 0.7503764939710483, 'bull_strategy': 'mean_reversion', 'bull_bb_std_mult': 2.8904636921840434, 'bull_rsi_os': 7, 'bull_rsi_ob': 90, 'bull_adx_thresh': 22.83138518695089, 'bull_atr_min_pct': 0.013592480125629695, 'bull_atr_max_pct': 0.03368832750424508, 'bull_tp_mult': 1.2823383411295481, 'bull_tsl_mult': 0.25719624045329725, 'bull_time_stop': 6, 'bull_use_sma': True, 'bull_use_ema': False, 'bull_use_atr': False, 'bull_use_adx': True, 'bull_use_spike': False, 'bull_rsi_required': True, 'bear_strategy': 'mean_reversion', 'bear_bb_std_mult': 3.1817478099415095, 'bear_rsi_os': 31, 'bear_rsi_ob': 86, 'bear_adx_thresh': 7.947034207148478, 'bear_atr_min_pct': 0.0011483457791002982, 'bear_atr_max_pct': 0.10867177863478798, 'bear_tp_mult': 2.90371005551966, 'bear_tsl_mult': 0.42388441095630325, 'bear_time_stop': 12, 'bear_use_sma': True, 'bear_use_ema': False, 'bear_use_atr': False, 'bear_use_adx': False, 'bear_use_spike': True, 'bear_rsi_required': False, 'sideways_strategy': 'mean_reversion', 'sideways_bb_std_mult': 2.4319040199524276, 'sideways_rsi_os': 29, 'sideways_rsi_ob': 66, 'sideways_adx_thresh': 26.520073716135045, 'sideways_atr_min_pct': 0.004308068269441162, 'sideways_atr_max_pct': 0.13110172369761347, 'sideways_tp_mult': 1.6831382873686744, 'sideways_tsl_mult': 0.8425885192395488, 'sideways_time_stop': 201, 'sideways_use_sma': False, 'sideways_use_ema': False, 'sideways_use_atr': True, 'sideways_use_adx': False, 'sideways_use_spike': False, 'sideways_rsi_required': False}.
[I 2025-08-31 13:10:28,974] Trial 590 finished with values: [-1000000000.0, 1000000000.0] and parameters: {'p_sma': 51, 'p_std': 41, 'p_atr': 11, 'p_adx': 15, 'rsi_period': 84, 'ema1': 13, 'ema2': 48, 'slip_atr_k': 0.05689749525267327, 'slip_spread_k': 0.5133311694615678, 'spread_hl_frac': 0.011880738798348795, 'bb_std_mult': 2.21440482292564, 'rsi_os': 38, 'rsi_ob': 81, 'vol_spike': 0.14404608251034018, 'adx_thresh': 12.622636824160356, 'atr_min_pct': 0.0023903661404327224, 'atr_max_pct': 0.12167573389356608, 'tp_mult': 2.999452951484394, 'tsl_mult': 0.9672452867224062, 'strategy': 'breakout', 'time_stop': 18, 'use_sma': True, 'use_atr': True, 'use_adx': True, 'use_ema': True, 'use_spike': True, 'rsi_required': True, 'edge_k': 0.7124844409910591, 'edge_cap': 0.7653978677084555, 'bull_strategy': 'mean_reversion', 'bull_bb_std_mult': 2.9012599602265428, 'bull_rsi_os': 7, 'bull_rsi_ob': 51, 'bull_adx_thresh': 24.655965819128614, 'bull_atr_min_pct': 0.0061470238920654785, 'bull_atr_max_pct': 0.14170499329821587, 'bull_tp_mult': 2.9929999546112325, 'bull_tsl_mult': 0.2479995625830278, 'bull_time_stop': 60, 'bull_use_sma': True, 'bull_use_ema': False, 'bull_use_atr': False, 'bull_use_adx': True, 'bull_use_spike': False, 'bull_rsi_required': True, 'bear_strategy': 'breakout', 'bear_bb_std_mult': 2.8763621618834954, 'bear_rsi_os': 31, 'bear_rsi_ob': 72, 'bear_adx_thresh': 26.939883742652306, 'bear_atr_min_pct': 0.014549048849007387, 'bear_atr_max_pct': 0.14147110199385504, 'bear_tp_mult': 2.9174780829330778, 'bear_tsl_mult': 0.740812207274465, 'bear_time_stop': 101, 'bear_use_sma': True, 'bear_use_ema': True, 'bear_use_atr': False, 'bear_use_adx': False, 'bear_use_spike': True, 'bear_rsi_required': True, 'sideways_strategy': 'mean_reversion', 'sideways_bb_std_mult': 2.4486073426440114, 'sideways_rsi_os': 24, 'sideways_rsi_ob': 66, 'sideways_adx_thresh': 16.271003298524896, 'sideways_atr_min_pct': 0.012352370210429392, 'sideways_atr_max_pct': 0.13103099810565605, 'sideways_tp_mult': 1.6796342259750603, 'sideways_tsl_mult': 0.8533475823855993, 'sideways_time_stop': 212, 'sideways_use_sma': False, 'sideways_use_ema': False, 'sideways_use_atr': True, 'sideways_use_adx': False, 'sideways_use_spike': False, 'sideways_rsi_required': True}.
[I 2025-08-31 13:10:30,149] Trial 592 finished with values: [-0.038166079028825295, 0.03772576085607495] and parameters: {'p_sma': 54, 'p_std': 39, 'p_atr': 11, 'p_adx': 21, 'rsi_period': 32, 'ema1': 24, 'ema2': 16, 'slip_atr_k': 0.0566361573002755, 'slip_spread_k': 0.42492937083228965, 'spread_hl_frac': 0.020699342621474222, 'bb_std_mult': 2.396057843678169, 'rsi_os': 28, 'rsi_ob': 64, 'vol_spike': 0.013679624139183024, 'adx_thresh': 26.512266410131208, 'atr_min_pct': 0.022526937817997496, 'atr_max_pct': 0.12259043833904373, 'tp_mult': 1.5104644137219505, 'tsl_mult': 0.7917976386379755, 'strategy': 'breakout', 'time_stop': 178, 'use_sma': False, 'use_atr': True, 'use_adx': True, 'use_ema': True, 'use_spike': False, 'rsi_required': True, 'edge_k': 0.743779471509232, 'edge_cap': 0.7895393688140584, 'bull_strategy': 'mean_reversion', 'bull_bb_std_mult': 2.804163107448623, 'bull_rsi_os': 7, 'bull_rsi_ob': 52, 'bull_adx_thresh': 23.663636377433132, 'bull_atr_min_pct': 0.015571193492144208, 'bull_atr_max_pct': 0.05854403284458877, 'bull_tp_mult': 1.2856615635731239, 'bull_tsl_mult': 0.20491092551738307, 'bull_time_stop': 61, 'bull_use_sma': False, 'bull_use_ema': True, 'bull_use_atr': False, 'bull_use_adx': True, 'bull_use_spike': True, 'bull_rsi_required': True, 'bear_strategy': 'breakout', 'bear_bb_std_mult': 3.0939181947269883, 'bear_rsi_os': 31, 'bear_rsi_ob': 73, 'bear_adx_thresh': 19.579323241594707, 'bear_atr_min_pct': 0.0027868458645616528, 'bear_atr_max_pct': 0.13961586462852424, 'bear_tp_mult': 2.9529709736766727, 'bear_tsl_mult': 0.7378985273430658, 'bear_time_stop': 189, 'bear_use_sma': False, 'bear_use_ema': True, 'bear_use_atr': False, 'bear_use_adx': False, 'bear_use_spike': True, 'bear_rsi_required': True, 'sideways_strategy': 'mean_reversion', 'sideways_bb_std_mult': 3.2919046299565773, 'sideways_rsi_os': 16, 'sideways_rsi_ob': 65, 'sideways_adx_thresh': 6.86293050814281, 'sideways_atr_min_pct': 0.0032668263900759945, 'sideways_atr_max_pct': 0.14045318605681076, 'sideways_tp_mult': 1.6837768004305032, 'sideways_tsl_mult': 0.8689653863429522, 'sideways_time_stop': 210, 'sideways_use_sma': False, 'sideways_use_ema': True, 'sideways_use_atr': True, 'sideways_use_adx': False, 'sideways_use_spike': False, 'sideways_rsi_required': True}.
[I 2025-08-31 13:10:30,290] Trial 593 finished with values: [-0.06718616126088128, 0.06693722822993585] and parameters: {'p_sma': 54, 'p_std': 25, 'p_atr': 28, 'p_adx': 10, 'rsi_period': 29, 'ema1': 21, 'ema2': 16, 'slip_atr_k': 0.21856015549572932, 'slip_spread_k': 0.41330798640680394, 'spread_hl_frac': 0.02020622396884556, 'bb_std_mult': 2.4434069721639853, 'rsi_os': 28, 'rsi_ob': 64, 'vol_spike': 0.02146124096250263, 'adx_thresh': 19.77209856782014, 'atr_min_pct': 0.0070772741703052176, 'atr_max_pct': 0.12174626730475033, 'tp_mult': 1.464638888828523, 'tsl_mult': 0.9701822154504005, 'strategy': 'breakout', 'time_stop': 178, 'use_sma': False, 'use_atr': True, 'use_adx': True, 'use_ema': True, 'use_spike': False, 'rsi_required': True, 'edge_k': 0.9695716772385561, 'edge_cap': 0.7154369186566362, 'bull_strategy': 'breakout', 'bull_bb_std_mult': 3.434181556910287, 'bull_rsi_os': 7, 'bull_rsi_ob': 52, 'bull_adx_thresh': 25.889103006054064, 'bull_atr_min_pct': 0.0030507002326655586, 'bull_atr_max_pct': 0.06048895512405339, 'bull_tp_mult': 1.253330225363815, 'bull_tsl_mult': 0.41993413491991566, 'bull_time_stop': 20, 'bull_use_sma': False, 'bull_use_ema': True, 'bull_use_atr': False, 'bull_use_adx': True, 'bull_use_spike': True, 'bull_rsi_required': True, 'bear_strategy': 'breakout', 'bear_bb_std_mult': 3.0964825013582753, 'bear_rsi_os': 17, 'bear_rsi_ob': 69, 'bear_adx_thresh': 27.167681991406, 'bear_atr_min_pct': 0.0026206109759628594, 'bear_atr_max_pct': 0.13949574602728856, 'bear_tp_mult': 2.9555874643033997, 'bear_tsl_mult': 0.7372064730111968, 'bear_time_stop': 188, 'bear_use_sma': False, 'bear_use_ema': True, 'bear_use_atr': False, 'bear_use_adx': False, 'bear_use_spike': False, 'bear_rsi_required': True, 'sideways_strategy': 'breakout', 'sideways_bb_std_mult': 2.524104275920392, 'sideways_rsi_os': 55, 'sideways_rsi_ob': 65, 'sideways_adx_thresh': 19.397573283058257, 'sideways_atr_min_pct': 0.0027476908731667153, 'sideways_atr_max_pct': 0.1386990617870463, 'sideways_tp_mult': 1.645918548927639, 'sideways_tsl_mult': 0.8668406517700986, 'sideways_time_stop': 210, 'sideways_use_sma': True, 'sideways_use_ema': True, 'sideways_use_atr': True, 'sideways_use_adx': True, 'sideways_use_spike': False, 'sideways_rsi_required': True}.
[I 2025-08-31 13:10:30,498] Trial 591 finished with values: [-1000000000.0, 1000000000.0] and parameters: {'p_sma': 54, 'p_std': 25, 'p_atr': 28, 'p_adx': 22, 'rsi_period': 31, 'ema1': 21, 'ema2': 47, 'slip_atr_k': 0.05613636234549671, 'slip_spread_k': 0.4118621323920839, 'spread_hl_frac': 0.020092262030796275, 'bb_std_mult': 2.398795546757243, 'rsi_os': 41, 'rsi_ob': 64, 'vol_spike': 0.14351590450255516, 'adx_thresh': 15.880776871794584, 'atr_min_pct': 0.022367886245209447, 'atr_max_pct': 0.12103655171070246, 'tp_mult': 2.7198861460493364, 'tsl_mult': 0.6733494309248148, 'strategy': 'breakout', 'time_stop': 178, 'use_sma': False, 'use_atr': True, 'use_adx': True, 'use_ema': True, 'use_spike': False, 'rsi_required': True, 'edge_k': 0.9777834749354126, 'edge_cap': 0.7798913855276741, 'bull_strategy': 'mean_reversion', 'bull_bb_std_mult': 2.2344369395043264, 'bull_rsi_os': 7, 'bull_rsi_ob': 52, 'bull_adx_thresh': 31.22986184464436, 'bull_atr_min_pct': 0.01939022761011739, 'bull_atr_max_pct': 0.059044472520565744, 'bull_tp_mult': 1.2893684810625852, 'bull_tsl_mult': 0.2081854685944494, 'bull_time_stop': 59, 'bull_use_sma': True, 'bull_use_ema': True, 'bull_use_atr': False, 'bull_use_adx': True, 'bull_use_spike': False, 'bull_rsi_required': True, 'bear_strategy': 'breakout', 'bear_bb_std_mult': 3.1051890253331202, 'bear_rsi_os': 31, 'bear_rsi_ob': 85, 'bear_adx_thresh': 13.184620570308425, 'bear_atr_min_pct': 0.015312154166060311, 'bear_atr_max_pct': 0.1333986471478798, 'bear_tp_mult': 2.264726112399561, 'bear_tsl_mult': 0.7196864444598783, 'bear_time_stop': 192, 'bear_use_sma': True, 'bear_use_ema': True, 'bear_use_atr': False, 'bear_use_adx': False, 'bear_use_spike': True, 'bear_rsi_required': True, 'sideways_strategy': 'mean_reversion', 'sideways_bb_std_mult': 1.833978929500621, 'sideways_rsi_os': 31, 'sideways_rsi_ob': 54, 'sideways_adx_thresh': 6.823134961792162, 'sideways_atr_min_pct': 0.0032720014361797218, 'sideways_atr_max_pct': 0.13870711794263707, 'sideways_tp_mult': 2.024509369086832, 'sideways_tsl_mult': 0.864791366429226, 'sideways_time_stop': 212, 'sideways_use_sma': False, 'sideways_use_ema': True, 'sideways_use_atr': True, 'sideways_use_adx': False, 'sideways_use_spike': False, 'sideways_rsi_required': True}.
