[I 2025-08-31 13:26:26,994] Trial 703 finished with values: [-1000000000.0, 1000000000.0] and parameters: {'p_sma': 24, 'p_std': 54, 'p_atr': 22, 'p_adx': 20, 'rsi_period': 48, 'ema1': 11, 'ema2': 18, 'slip_atr_k': 0.03646203638240469, 'slip_spread_k': 0.33273104101165, 'spread_hl_frac': 0.02047320649909357, 'bb_std_mult': 2.0095333599450305, 'rsi_os': 40, 'rsi_ob': 95, 'vol_spike': 0.2362719851362865, 'adx_thresh': 6.842859579533483, 'atr_min_pct': 0.022252066934355403, 'atr_max_pct': 0.045187460879615615, 'tp_mult': 2.4656665398725037, 'tsl_mult': 0.88420810485111, 'strategy': 'breakout', 'time_stop': 42, 'use_sma': False, 'use_atr': False, 'use_adx': True, 'use_ema': True, 'use_spike': True, 'rsi_required': False, 'edge_k': 0.5606779540413674, 'edge_cap': 0.6656154239512396, 'bull_strategy': 'mean_reversion', 'bull_bb_std_mult': 0.6298017637470417, 'bull_rsi_os': 6, 'bull_rsi_ob': 88, 'bull_adx_thresh': 17.550323630855303, 'bull_atr_min_pct': 0.020909238395061713, 'bull_atr_max_pct': 0.13558484294062456, 'bull_tp_mult': 2.188371250971453, 'bull_tsl_mult': 0.3306229417750576, 'bull_time_stop': 161, 'bull_use_sma': True, 'bull_use_ema': True, 'bull_use_atr': True, 'bull_use_adx': True, 'bull_use_spike': True, 'bull_rsi_required': True, 'bear_strategy': 'breakout', 'bear_bb_std_mult': 3.404341210152624, 'bear_rsi_os': 51, 'bear_rsi_ob': 50, 'bear_adx_thresh': 18.62903481864468, 'bear_atr_min_pct': 0.014103200750676458, 'bear_atr_max_pct': 0.13224969268598766, 'bear_tp_mult': 1.163690332899993, 'bear_tsl_mult': 0.6938154156154943, 'bear_time_stop': 103, 'bear_use_sma': False, 'bear_use_ema': True, 'bear_use_atr': False, 'bear_use_adx': False, 'bear_use_spike': True, 'bear_rsi_required': True, 'sideways_strategy': 'breakout', 'sideways_bb_std_mult': 1.8897764400585602, 'sideways_rsi_os': 8, 'sideways_rsi_ob': 67, 'sideways_adx_thresh': 23.65500604950984, 'sideways_atr_min_pct': 0.011832969319833275, 'sideways_atr_max_pct': 0.1413940553417997, 'sideways_tp_mult': 1.676724895657824, 'sideways_tsl_mult': 0.40268214862727747, 'sideways_time_stop': 52, 'sideways_use_sma': False, 'sideways_use_ema': False, 'sideways_use_atr': True, 'sideways_use_adx': True, 'sideways_use_spike': False, 'sideways_rsi_required': True}.
[I 2025-08-31 13:26:27,339] Trial 704 finished with values: [-1000000000.0, 1000000000.0] and parameters: {'p_sma': 24, 'p_std': 54, 'p_atr': 22, 'p_adx': 11, 'rsi_period': 48, 'ema1': 11, 'ema2': 19, 'slip_atr_k': 0.2151932350498823, 'slip_spread_k': 0.3622700278411705, 'spread_hl_frac': 0.020372744892354525, 'bb_std_mult': 2.044852122773987, 'rsi_os': 40, 'rsi_ob': 88, 'vol_spike': 0.13965712649301748, 'adx_thresh': 6.78192148793294, 'atr_min_pct': 0.022415191191369838, 'atr_max_pct': 0.046295959649199456, 'tp_mult': 2.371904788599497, 'tsl_mult': 0.8795635733101175, 'strategy': 'breakout', 'time_stop': 188, 'use_sma': False, 'use_atr': False, 'use_adx': True, 'use_ema': True, 'use_spike': True, 'rsi_required': False, 'edge_k': 0.5581314674783917, 'edge_cap': 0.6644147093326257, 'bull_strategy': 'mean_reversion', 'bull_bb_std_mult': 2.7749847989295153, 'bull_rsi_os': 29, 'bull_rsi_ob': 88, 'bull_adx_thresh': 17.37695260506521, 'bull_atr_min_pct': 0.02141163919601361, 'bull_atr_max_pct': 0.1349210879545323, 'bull_tp_mult': 2.202291625741164, 'bull_tsl_mult': 0.5315960236718386, 'bull_time_stop': 163, 'bull_use_sma': True, 'bull_use_ema': True, 'bull_use_atr': True, 'bull_use_adx': True, 'bull_use_spike': True, 'bull_rsi_required': True, 'bear_strategy': 'breakout', 'bear_bb_std_mult': 3.4420752813060065, 'bear_rsi_os': 52, 'bear_rsi_ob': 76, 'bear_adx_thresh': 19.05072223024372, 'bear_atr_min_pct': 0.01504091193587126, 'bear_atr_max_pct': 0.13339951909601888, 'bear_tp_mult': 1.1168123084695514, 'bear_tsl_mult': 0.7018205203626224, 'bear_time_stop': 205, 'bear_use_sma': False, 'bear_use_ema': True, 'bear_use_atr': False, 'bear_use_adx': False, 'bear_use_spike': True, 'bear_rsi_required': True, 'sideways_strategy': 'breakout', 'sideways_bb_std_mult': 2.7220840530008767, 'sideways_rsi_os': 8, 'sideways_rsi_ob': 67, 'sideways_adx_thresh': 23.488956733336906, 'sideways_atr_min_pct': 0.029155022298601084, 'sideways_atr_max_pct': 0.14009871835722298, 'sideways_tp_mult': 1.783046018770999, 'sideways_tsl_mult': 0.39270918905876673, 'sideways_time_stop': 50, 'sideways_use_sma': False, 'sideways_use_ema': False, 'sideways_use_atr': True, 'sideways_use_adx': True, 'sideways_use_spike': False, 'sideways_rsi_required': True}.
[I 2025-08-31 13:26:27,795] Trial 705 finished with values: [-1000000000.0, 1000000000.0] and parameters: {'p_sma': 14, 'p_std': 23, 'p_atr': 20, 'p_adx': 14, 'rsi_period': 39, 'ema1': 17, 'ema2': 22, 'slip_atr_k': 0.03722402198567308, 'slip_spread_k': 0.33855620607220904, 'spread_hl_frac': 0.04516779177977043, 'bb_std_mult': 2.05061436306026, 'rsi_os': 40, 'rsi_ob': 95, 'vol_spike': 0.019114507439133115, 'adx_thresh': 7.168133136520122, 'atr_min_pct': 0.02488033506368039, 'atr_max_pct': 0.04648969219377517, 'tp_mult': 2.461026344411228, 'tsl_mult': 0.8719990661822237, 'strategy': 'mean_reversion', 'time_stop': 165, 'use_sma': False, 'use_atr': False, 'use_adx': True, 'use_ema': True, 'use_spike': True, 'rsi_required': False, 'edge_k': 0.5562383804432905, 'edge_cap': 0.6631492273707504, 'bull_strategy': 'mean_reversion', 'bull_bb_std_mult': 2.7622415642774767, 'bull_rsi_os': 38, 'bull_rsi_ob': 84, 'bull_adx_thresh': 17.542709514759558, 'bull_atr_min_pct': 0.021616347467812685, 'bull_atr_max_pct': 0.1240326407727938, 'bull_tp_mult': 2.181396883911072, 'bull_tsl_mult': 0.27253610672262857, 'bull_time_stop': 162, 'bull_use_sma': True, 'bull_use_ema': True, 'bull_use_atr': True, 'bull_use_adx': False, 'bull_use_spike': True, 'bull_rsi_required': True, 'bear_strategy': 'breakout', 'bear_bb_std_mult': 3.542308791039913, 'bear_rsi_os': 51, 'bear_rsi_ob': 65, 'bear_adx_thresh': 17.16601101761551, 'bear_atr_min_pct': 0.017084622352030777, 'bear_atr_max_pct': 0.13194084315978089, 'bear_tp_mult': 1.1088923572761156, 'bear_tsl_mult': 0.6872615488145575, 'bear_time_stop': 207, 'bear_use_sma': False, 'bear_use_ema': True, 'bear_use_atr': False, 'bear_use_adx': False, 'bear_use_spike': False, 'bear_rsi_required': True, 'sideways_strategy': 'breakout', 'sideways_bb_std_mult': 2.9911270621350283, 'sideways_rsi_os': 30, 'sideways_rsi_ob': 54, 'sideways_adx_thresh': 25.290868267786223, 'sideways_atr_min_pct': 0.021096686880554282, 'sideways_atr_max_pct': 0.14130732114721378, 'sideways_tp_mult': 1.7837755654007676, 'sideways_tsl_mult': 0.8613443615772973, 'sideways_time_stop': 23, 'sideways_use_sma': False, 'sideways_use_ema': False, 'sideways_use_atr': True, 'sideways_use_adx': True, 'sideways_use_spike': True, 'sideways_rsi_required': True}.
[I 2025-08-31 13:26:28,007] Trial 702 finished with values: [-1000000000.0, 1000000000.0] and parameters: {'p_sma': 33, 'p_std': 38, 'p_atr': 20, 'p_adx': 23, 'rsi_period': 50, 'ema1': 9, 'ema2': 22, 'slip_atr_k': 0.03633588136339069, 'slip_spread_k': 0.4036587345499022, 'spread_hl_frac': 0.020527416962873513, 'bb_std_mult': 2.0131826124751617, 'rsi_os': 40, 'rsi_ob': 91, 'vol_spike': 0.13959281246804214, 'adx_thresh': 6.4008821202812305, 'atr_min_pct': 0.021217097779650862, 'atr_max_pct': 0.043270517488674796, 'tp_mult': 2.377436976187513, 'tsl_mult': 0.5392493000051948, 'strategy': 'breakout', 'time_stop': 188, 'use_sma': False, 'use_atr': False, 'use_adx': True, 'use_ema': False, 'use_spike': True, 'rsi_required': False, 'edge_k': 0.5669634025843586, 'edge_cap': 0.6675957482088494, 'bull_strategy': 'mean_reversion', 'bull_bb_std_mult': 2.902742968785569, 'bull_rsi_os': 7, 'bull_rsi_ob': 86, 'bull_adx_thresh': 19.33486207390185, 'bull_atr_min_pct': 0.021904321006000135, 'bull_atr_max_pct': 0.13136584974978005, 'bull_tp_mult': 2.028455787893094, 'bull_tsl_mult': 0.5432915819829982, 'bull_time_stop': 193, 'bull_use_sma': True, 'bull_use_ema': False, 'bull_use_atr': True, 'bull_use_adx': True, 'bull_use_spike': True, 'bull_rsi_required': True, 'bear_strategy': 'breakout', 'bear_bb_std_mult': 3.425351909837766, 'bear_rsi_os': 49, 'bear_rsi_ob': 92, 'bear_adx_thresh': 21.748319108545285, 'bear_atr_min_pct': 0.010643092570325356, 'bear_atr_max_pct': 0.12032042349379947, 'bear_tp_mult': 1.101347075542128, 'bear_tsl_mult': 0.6539272306998773, 'bear_time_stop': 207, 'bear_use_sma': False, 'bear_use_ema': True, 'bear_use_atr': False, 'bear_use_adx': False, 'bear_use_spike': True, 'bear_rsi_required': True, 'sideways_strategy': 'breakout', 'sideways_bb_std_mult': 1.9154224502043917, 'sideways_rsi_os': 8, 'sideways_rsi_ob': 65, 'sideways_adx_thresh': 24.939928233986972, 'sideways_atr_min_pct': 0.01691714313501728, 'sideways_atr_max_pct': 0.14668853590026357, 'sideways_tp_mult': 1.8508820983002547, 'sideways_tsl_mult': 0.8466416103469991, 'sideways_time_stop': 43, 'sideways_use_sma': False, 'sideways_use_ema': True, 'sideways_use_atr': True, 'sideways_use_adx': True, 'sideways_use_spike': False, 'sideways_rsi_required': True}.
[I 2025-08-31 13:26:28,832] Trial 707 finished with values: [-1000000000.0, 1000000000.0] and parameters: {'p_sma': 41, 'p_std': 23, 'p_atr': 20, 'p_adx': 14, 'rsi_period': 64, 'ema1': 15, 'ema2': 19, 'slip_atr_k': 0.03046138005579923, 'slip_spread_k': 0.042082767468537174, 'spread_hl_frac': 0.034178471794597785, 'bb_std_mult': 2.3910721700805766, 'rsi_os': 54, 'rsi_ob': 85, 'vol_spike': 0.1824984634274615, 'adx_thresh': 7.841451756555689, 'atr_min_pct': 0.01920795452945227, 'atr_max_pct': 0.04214091444924951, 'tp_mult': 2.5288026371551027, 'tsl_mult': 0.6706863155462216, 'strategy': 'mean_reversion', 'time_stop': 163, 'use_sma': False, 'use_atr': False, 'use_adx': True, 'use_ema': True, 'use_spike': True, 'rsi_required': False, 'edge_k': 0.48570497811426594, 'edge_cap': 0.6661818971878231, 'bull_strategy': 'mean_reversion', 'bull_bb_std_mult': 2.9156565112795008, 'bull_rsi_os': 20, 'bull_rsi_ob': 84, 'bull_adx_thresh': 19.273602770617746, 'bull_atr_min_pct': 0.021691300725890927, 'bull_atr_max_pct': 0.1228993019452739, 'bull_tp_mult': 2.045848152309604, 'bull_tsl_mult': 0.27046003230021476, 'bull_time_stop': 197, 'bull_use_sma': True, 'bull_use_ema': True, 'bull_use_atr': True, 'bull_use_adx': False, 'bull_use_spike': True, 'bull_rsi_required': True, 'bear_strategy': 'breakout', 'bear_bb_std_mult': 3.535152176403925, 'bear_rsi_os': 16, 'bear_rsi_ob': 80, 'bear_adx_thresh': 17.262942817331155, 'bear_atr_min_pct': 0.01217481508224372, 'bear_atr_max_pct': 0.05766233784597168, 'bear_tp_mult': 1.1010205513415172, 'bear_tsl_mult': 0.2495806553114307, 'bear_time_stop': 168, 'bear_use_sma': False, 'bear_use_ema': True, 'bear_use_atr': False, 'bear_use_adx': False, 'bear_use_spike': False, 'bear_rsi_required': True, 'sideways_strategy': 'breakout', 'sideways_bb_std_mult': 3.3004797648985065, 'sideways_rsi_os': 14, 'sideways_rsi_ob': 65, 'sideways_adx_thresh': 25.176798578002604, 'sideways_atr_min_pct': 0.003016645033807455, 'sideways_atr_max_pct': 0.14681168296400673, 'sideways_tp_mult': 1.8318792049079247, 'sideways_tsl_mult': 0.8611088473879731, 'sideways_time_stop': 79, 'sideways_use_sma': False, 'sideways_use_ema': False, 'sideways_use_atr': True, 'sideways_use_adx': True, 'sideways_use_spike': True, 'sideways_rsi_required': False}.
[I 2025-08-31 13:26:28,851] Trial 709 finished with values: [-1000000000.0, 1000000000.0] and parameters: {'p_sma': 18, 'p_std': 22, 'p_atr': 18, 'p_adx': 14, 'rsi_period': 51, 'ema1': 14, 'ema2': 19, 'slip_atr_k': 0.1050362543969782, 'slip_spread_k': 0.20097283557821577, 'spread_hl_frac': 0.01766582742864686, 'bb_std_mult': 2.3936837488371276, 'rsi_os': 54, 'rsi_ob': 87, 'vol_spike': 0.0071884368921804834, 'adx_thresh': 7.795923476403208, 'atr_min_pct': 0.019712373719621708, 'atr_max_pct': 0.05613611989613583, 'tp_mult': 2.5374023241779544, 'tsl_mult': 0.8132413998425186, 'strategy': 'mean_reversion', 'time_stop': 261, 'use_sma': False, 'use_atr': False, 'use_adx': True, 'use_ema': True, 'use_spike': True, 'rsi_required': False, 'edge_k': 0.4763517224099181, 'edge_cap': 0.6490708086977327, 'bull_strategy': 'mean_reversion', 'bull_bb_std_mult': 3.371427890092818, 'bull_rsi_os': 20, 'bull_rsi_ob': 89, 'bull_adx_thresh': 18.101996937874183, 'bull_atr_min_pct': 0.02092344900506336, 'bull_atr_max_pct': 0.11250537983876863, 'bull_tp_mult': 2.258049794734468, 'bull_tsl_mult': 0.26064418110524284, 'bull_time_stop': 204, 'bull_use_sma': False, 'bull_use_ema': True, 'bull_use_atr': True, 'bull_use_adx': False, 'bull_use_spike': True, 'bull_rsi_required': True, 'bear_strategy': 'breakout', 'bear_bb_std_mult': 2.706063179454084, 'bear_rsi_os': 17, 'bear_rsi_ob': 78, 'bear_adx_thresh': 23.709647173990223, 'bear_atr_min_pct': 0.0016758321822157476, 'bear_atr_max_pct': 0.05698673308080618, 'bear_tp_mult': 1.1563283023114415, 'bear_tsl_mult': 0.9531359892402458, 'bear_time_stop': 277, 'bear_use_sma': False, 'bear_use_ema': True, 'bear_use_atr': False, 'bear_use_adx': False, 'bear_use_spike': False, 'bear_rsi_required': True, 'sideways_strategy': 'mean_reversion', 'sideways_bb_std_mult': 3.323671884140534, 'sideways_rsi_os': 31, 'sideways_rsi_ob': 52, 'sideways_adx_thresh': 25.08877836553368, 'sideways_atr_min_pct': 0.00288057734165038, 'sideways_atr_max_pct': 0.14708547398765, 'sideways_tp_mult': 1.7349750086311249, 'sideways_tsl_mult': 0.09237001329466221, 'sideways_time_stop': 69, 'sideways_use_sma': False, 'sideways_use_ema': False, 'sideways_use_atr': True, 'sideways_use_adx': True, 'sideways_use_spike': True, 'sideways_rsi_required': False}.
[I 2025-08-31 13:26:56,170] Trial 708 finished with values: [-1000000000.0, 1000000000.0] and parameters: {'p_sma': 34, 'p_std': 38, 'p_atr': 18, 'p_adx': 14, 'rsi_period': 51, 'ema1': 14, 'ema2': 19, 'slip_atr_k': 0.02973952104738059, 'slip_spread_k': 0.19310725000515205, 'spread_hl_frac': 0.01757032329692965, 'bb_std_mult': 2.38363362256699, 'rsi_os': 39, 'rsi_ob': 88, 'vol_spike': 0.18242279729276067, 'adx_thresh': 7.831419336948664, 'atr_min_pct': 0.019980634086774623, 'atr_max_pct': 0.04187352472327851, 'tp_mult': 2.529603190044046, 'tsl_mult': 0.8155641404060237, 'strategy': 'breakout', 'time_stop': 13, 'use_sma': False, 'use_atr': False, 'use_adx': True, 'use_ema': True, 'use_spike': True, 'rsi_required': False, 'edge_k': 0.6194910534380753, 'edge_cap': 0.6750387907665816, 'bull_strategy': 'mean_reversion', 'bull_bb_std_mult': 2.8522546758204035, 'bull_rsi_os': 6, 'bull_rsi_ob': 86, 'bull_adx_thresh': 19.308055610757737, 'bull_atr_min_pct': 0.021718362302276733, 'bull_atr_max_pct': 0.11201415193582322, 'bull_tp_mult': 2.0380513135724585, 'bull_tsl_mult': 0.5116644171213697, 'bull_time_stop': 175, 'bull_use_sma': False, 'bull_use_ema': True, 'bull_use_atr': True, 'bull_use_adx': True, 'bull_use_spike': True, 'bull_rsi_required': True, 'bear_strategy': 'breakout', 'bear_bb_std_mult': 3.594991678033608, 'bear_rsi_os': 28, 'bear_rsi_ob': 91, 'bear_adx_thresh': 24.086711232178907, 'bear_atr_min_pct': 0.0123468323695379, 'bear_atr_max_pct': 0.11389995996204866, 'bear_tp_mult': 1.461087173400429, 'bear_tsl_mult': 0.7124839932383369, 'bear_time_stop': 168, 'bear_use_sma': False, 'bear_use_ema': True, 'bear_use_atr': False, 'bear_use_adx': False, 'bear_use_spike': True, 'bear_rsi_required': True, 'sideways_strategy': 'mean_reversion', 'sideways_bb_std_mult': 2.2348724275153815, 'sideways_rsi_os': 6, 'sideways_rsi_ob': 65, 'sideways_adx_thresh': 24.950608945344204, 'sideways_atr_min_pct': 0.014846377834866307, 'sideways_atr_max_pct': 0.14625890388108298, 'sideways_tp_mult': 1.737102654719135, 'sideways_tsl_mult': 0.9810693679573979, 'sideways_time_stop': 79, 'sideways_use_sma': False, 'sideways_use_ema': False, 'sideways_use_atr': True, 'sideways_use_adx': True, 'sideways_use_spike': False, 'sideways_rsi_required': False}.
[I 2025-08-31 13:26:56,610] Trial 706 finished with values: [-1000000000.0, 1000000000.0] and parameters: {'p_sma': 14, 'p_std': 23, 'p_atr': 20, 'p_adx': 14, 'rsi_period': 49, 'ema1': 14, 'ema2': 22, 'slip_atr_k': 0.03391459387280034, 'slip_spread_k': 0.583403356289575, 'spread_hl_frac': 0.017743309348380032, 'bb_std_mult': 3.284742707657877, 'rsi_os': 42, 'rsi_ob': 88, 'vol_spike': 0.005770875994402765, 'adx_thresh': 7.879100978506429, 'atr_min_pct': 0.024802356991642665, 'atr_max_pct': 0.04688194024460942, 'tp_mult': 2.52277778860508, 'tsl_mult': 0.6748183522884116, 'strategy': 'mean_reversion', 'time_stop': 260, 'use_sma': False, 'use_atr': False, 'use_adx': True, 'use_ema': True, 'use_spike': True, 'rsi_required': False, 'edge_k': 0.5519259605486011, 'edge_cap': 0.661737049357375, 'bull_strategy': 'mean_reversion', 'bull_bb_std_mult': 3.3850867913653975, 'bull_rsi_os': 5, 'bull_rsi_ob': 89, 'bull_adx_thresh': 19.281447226561813, 'bull_atr_min_pct': 0.021651600206900178, 'bull_atr_max_pct': 0.1328364833978715, 'bull_tp_mult': 1.8808050079131966, 'bull_tsl_mult': 0.26649457430754175, 'bull_time_stop': 204, 'bull_use_sma': True, 'bull_use_ema': True, 'bull_use_atr': True, 'bull_use_adx': False, 'bull_use_spike': True, 'bull_rsi_required': True, 'bear_strategy': 'breakout', 'bear_bb_std_mult': 2.81933833965296, 'bear_rsi_os': 30, 'bear_rsi_ob': 45, 'bear_adx_thresh': 19.390646781163028, 'bear_atr_min_pct': 0.014962511405548265, 'bear_atr_max_pct': 0.11234961895015938, 'bear_tp_mult': 1.095917476476903, 'bear_tsl_mult': 0.2513536526901885, 'bear_time_stop': 204, 'bear_use_sma': False, 'bear_use_ema': True, 'bear_use_atr': False, 'bear_use_adx': False, 'bear_use_spike': False, 'bear_rsi_required': True, 'sideways_strategy': 'breakout', 'sideways_bb_std_mult': 2.9985763571842545, 'sideways_rsi_os': 30, 'sideways_rsi_ob': 52, 'sideways_adx_thresh': 25.164062927655657, 'sideways_atr_min_pct': 0.004988704783028659, 'sideways_atr_max_pct': 0.1410190291513582, 'sideways_tp_mult': 1.8025168787983579, 'sideways_tsl_mult': 0.8596177051935653, 'sideways_time_stop': 70, 'sideways_use_sma': False, 'sideways_use_ema': False, 'sideways_use_atr': True, 'sideways_use_adx': True, 'sideways_use_spike': True, 'sideways_rsi_required': True}.
[I 2025-08-31 13:27:01,784] Trial 710 finished with values: [-1000000000.0, 1000000000.0] and parameters: {'p_sma': 35, 'p_std': 40, 'p_atr': 15, 'p_adx': 24, 'rsi_period': 21, 'ema1': 14, 'ema2': 18, 'slip_atr_k': 0.04855390138138587, 'slip_spread_k': 0.4263973120012028, 'spread_hl_frac': 0.0178170282173002, 'bb_std_mult': 2.348828937564751, 'rsi_os': 6, 'rsi_ob': 88, 'vol_spike': 0.007158548117497433, 'adx_thresh': 9.096963120465588, 'atr_min_pct': 0.01975488982143032, 'atr_max_pct': 0.03816743551217188, 'tp_mult': 2.573229002717834, 'tsl_mult': 0.8069790442700868, 'strategy': 'breakout', 'time_stop': 178, 'use_sma': False, 'use_atr': False, 'use_adx': True, 'use_ema': True, 'use_spike': True, 'rsi_required': False, 'edge_k': 0.6133549432372004, 'edge_cap': 0.5875267706902066, 'bull_strategy': 'mean_reversion', 'bull_bb_std_mult': 1.6796890909510727, 'bull_rsi_os': 15, 'bull_rsi_ob': 89, 'bull_adx_thresh': 17.870040496728688, 'bull_atr_min_pct': 0.022422344718119516, 'bull_atr_max_pct': 0.11732880430883834, 'bull_tp_mult': 1.8940309800988289, 'bull_tsl_mult': 0.2432442934128098, 'bull_time_stop': 150, 'bull_use_sma': False, 'bull_use_ema': True, 'bull_use_atr': True, 'bull_use_adx': True, 'bull_use_spike': True, 'bull_rsi_required': True, 'bear_strategy': 'breakout', 'bear_bb_std_mult': 2.755969926810069, 'bear_rsi_os': 30, 'bear_rsi_ob': 70, 'bear_adx_thresh': 19.415665382520757, 'bear_atr_min_pct': 0.007986924017528218, 'bear_atr_max_pct': 0.019061185263555873, 'bear_tp_mult': 1.158736327196644, 'bear_tsl_mult': 0.7181500681128471, 'bear_time_stop': 188, 'bear_use_sma': False, 'bear_use_ema': True, 'bear_use_atr': False, 'bear_use_adx': False, 'bear_use_spike': True, 'bear_rsi_required': True, 'sideways_strategy': 'mean_reversion', 'sideways_bb_std_mult': 0.661474836181549, 'sideways_rsi_os': 16, 'sideways_rsi_ob': 66, 'sideways_adx_thresh': 24.79665552689182, 'sideways_atr_min_pct': 0.004830825737931515, 'sideways_atr_max_pct': 0.1473906219624166, 'sideways_tp_mult': 1.724031276368795, 'sideways_tsl_mult': 0.9731200225326575, 'sideways_time_stop': 68, 'sideways_use_sma': False, 'sideways_use_ema': False, 'sideways_use_atr': True, 'sideways_use_adx': True, 'sideways_use_spike': False, 'sideways_rsi_required': True}.
