[I 2025-08-31 13:46:22,898] Trial 855 finished with values: [-1000000000.0, 1000000000.0] and parameters: {'p_sma': 17, 'p_std': 21, 'p_atr': 23, 'p_adx': 15, 'rsi_period': 47, 'ema1': 8, 'ema2': 20, 'slip_atr_k': 0.019632251673043874, 'slip_spread_k': 0.3021828034483818, 'spread_hl_frac': 0.01939014226885125, 'bb_std_mult': 2.3584410957643334, 'rsi_os': 38, 'rsi_ob': 84, 'vol_spike': 0.19041563222163022, 'adx_thresh': 9.730726750699443, 'atr_min_pct': 0.02464402304697168, 'atr_max_pct': 0.049235479239729645, 'tp_mult': 2.5497964000929048, 'tsl_mult': 0.46750464038827166, 'strategy': 'breakout', 'time_stop': 93, 'use_sma': False, 'use_atr': False, 'use_adx': True, 'use_ema': True, 'use_spike': True, 'rsi_required': False, 'edge_k': 0.6536220562202197, 'edge_cap': 0.7122004436609682, 'bull_strategy': 'mean_reversion', 'bull_bb_std_mult': 2.147497639765928, 'bull_rsi_os': 7, 'bull_rsi_ob': 61, 'bull_adx_thresh': 17.377705364072895, 'bull_atr_min_pct': 0.02142364761188347, 'bull_atr_max_pct': 0.04749432402393602, 'bull_tp_mult': 1.5976753253397082, 'bull_tsl_mult': 0.244298335776653, 'bull_time_stop': 216, 'bull_use_sma': True, 'bull_use_ema': True, 'bull_use_atr': True, 'bull_use_adx': True, 'bull_use_spike': True, 'bull_rsi_required': True, 'bear_strategy': 'breakout', 'bear_bb_std_mult': 0.7688350453303905, 'bear_rsi_os': 30, 'bear_rsi_ob': 69, 'bear_adx_thresh': 17.51729462049312, 'bear_atr_min_pct': 0.002676651623090412, 'bear_atr_max_pct': 0.074914894479648, 'bear_tp_mult': 1.889320220686282, 'bear_tsl_mult': 0.9035819648779002, 'bear_time_stop': 186, 'bear_use_sma': False, 'bear_use_ema': True, 'bear_use_atr': False, 'bear_use_adx': False, 'bear_use_spike': True, 'bear_rsi_required': True, 'sideways_strategy': 'breakout', 'sideways_bb_std_mult': 3.2561588112599344, 'sideways_rsi_os': 31, 'sideways_rsi_ob': 70, 'sideways_adx_thresh': 25.325714729243533, 'sideways_atr_min_pct': 0.0037341871078633328, 'sideways_atr_max_pct': 0.02012978196932446, 'sideways_tp_mult': 1.712629162162687, 'sideways_tsl_mult': 0.8214381702980325, 'sideways_time_stop': 55, 'sideways_use_sma': False, 'sideways_use_ema': False, 'sideways_use_atr': True, 'sideways_use_adx': True, 'sideways_use_spike': False, 'sideways_rsi_required': False}.
[I 2025-08-31 13:46:55,215] Trial 856 finished with values: [-1000000000.0, 1000000000.0] and parameters: {'p_sma': 21, 'p_std': 23, 'p_atr': 9, 'p_adx': 13, 'rsi_period': 55, 'ema1': 7, 'ema2': 20, 'slip_atr_k': 0.04291840579618814, 'slip_spread_k': 0.3651661638506514, 'spread_hl_frac': 0.011582313897556654, 'bb_std_mult': 2.350402959528445, 'rsi_os': 36, 'rsi_ob': 84, 'vol_spike': 0.04801054249595671, 'adx_thresh': 9.86149817027992, 'atr_min_pct': 0.02873494876898467, 'atr_max_pct': 0.05168567405237382, 'tp_mult': 1.1140846859392841, 'tsl_mult': 0.7185270877616566, 'strategy': 'breakout', 'time_stop': 124, 'use_sma': False, 'use_atr': False, 'use_adx': True, 'use_ema': True, 'use_spike': True, 'rsi_required': False, 'edge_k': 0.6018312362716034, 'edge_cap': 0.7111023234969562, 'bull_strategy': 'mean_reversion', 'bull_bb_std_mult': 2.922203587976748, 'bull_rsi_os': 6, 'bull_rsi_ob': 87, 'bull_adx_thresh': 24.21101581465763, 'bull_atr_min_pct': 0.021895298790912576, 'bull_atr_max_pct': 0.1385621134927934, 'bull_tp_mult': 2.430559969491376, 'bull_tsl_mult': 0.2720823671218371, 'bull_time_stop': 203, 'bull_use_sma': True, 'bull_use_ema': True, 'bull_use_atr': True, 'bull_use_adx': True, 'bull_use_spike': True, 'bull_rsi_required': True, 'bear_strategy': 'breakout', 'bear_bb_std_mult': 3.414875620572085, 'bear_rsi_os': 30, 'bear_rsi_ob': 68, 'bear_adx_thresh': 17.696045708155093, 'bear_atr_min_pct': 0.008828859215618174, 'bear_atr_max_pct': 0.12150261861218592, 'bear_tp_mult': 2.3026729114271696, 'bear_tsl_mult': 0.9091039716220711, 'bear_time_stop': 183, 'bear_use_sma': False, 'bear_use_ema': True, 'bear_use_atr': False, 'bear_use_adx': False, 'bear_use_spike': True, 'bear_rsi_required': True, 'sideways_strategy': 'breakout', 'sideways_bb_std_mult': 2.7819357165037006, 'sideways_rsi_os': 30, 'sideways_rsi_ob': 69, 'sideways_adx_thresh': 25.872499972709342, 'sideways_atr_min_pct': 0.0020053497182640706, 'sideways_atr_max_pct': 0.04931082585734339, 'sideways_tp_mult': 1.8204120850811976, 'sideways_tsl_mult': 0.8613120536287899, 'sideways_time_stop': 54, 'sideways_use_sma': False, 'sideways_use_ema': False, 'sideways_use_atr': True, 'sideways_use_adx': True, 'sideways_use_spike': False, 'sideways_rsi_required': True}.
[I 2025-08-31 13:46:55,795] Trial 858 finished with values: [-1000000000.0, 1000000000.0] and parameters: {'p_sma': 21, 'p_std': 46, 'p_atr': 23, 'p_adx': 13, 'rsi_period': 57, 'ema1': 7, 'ema2': 20, 'slip_atr_k': 0.033177455194104914, 'slip_spread_k': 0.3607895730481819, 'spread_hl_frac': 0.02581469779346183, 'bb_std_mult': 2.3418367943165115, 'rsi_os': 40, 'rsi_ob': 94, 'vol_spike': 0.03167342524796809, 'adx_thresh': 11.310631304730064, 'atr_min_pct': 0.02345135017047129, 'atr_max_pct': 0.08525111553665579, 'tp_mult': 2.542849071931139, 'tsl_mult': 0.2831449656053589, 'strategy': 'mean_reversion', 'time_stop': 171, 'use_sma': False, 'use_atr': False, 'use_adx': True, 'use_ema': True, 'use_spike': True, 'rsi_required': False, 'edge_k': 0.534399013149473, 'edge_cap': 0.9172280912592177, 'bull_strategy': 'mean_reversion', 'bull_bb_std_mult': 2.9055927261196137, 'bull_rsi_os': 20, 'bull_rsi_ob': 73, 'bull_adx_thresh': 17.278298492868807, 'bull_atr_min_pct': 0.02866337078057469, 'bull_atr_max_pct': 0.09186884520952385, 'bull_tp_mult': 2.2495026117894823, 'bull_tsl_mult': 0.33658025846616446, 'bull_time_stop': 5, 'bull_use_sma': False, 'bull_use_ema': False, 'bull_use_atr': True, 'bull_use_adx': False, 'bull_use_spike': True, 'bull_rsi_required': True, 'bear_strategy': 'mean_reversion', 'bear_bb_std_mult': 2.7040263446610786, 'bear_rsi_os': 26, 'bear_rsi_ob': 54, 'bear_adx_thresh': 17.71803083450791, 'bear_atr_min_pct': 0.00894688491469619, 'bear_atr_max_pct': 0.1334994941707231, 'bear_tp_mult': 1.6614975718809593, 'bear_tsl_mult': 0.45460578555674314, 'bear_time_stop': 203, 'bear_use_sma': False, 'bear_use_ema': True, 'bear_use_atr': False, 'bear_use_adx': False, 'bear_use_spike': True, 'bear_rsi_required': True, 'sideways_strategy': 'breakout', 'sideways_bb_std_mult': 2.6018348761411296, 'sideways_rsi_os': 30, 'sideways_rsi_ob': 63, 'sideways_adx_thresh': 25.262190391906483, 'sideways_atr_min_pct': 0.01150765953418862, 'sideways_atr_max_pct': 0.030404604736384754, 'sideways_tp_mult': 1.7591433506174239, 'sideways_tsl_mult': 0.8883957770341036, 'sideways_time_stop': 56, 'sideways_use_sma': False, 'sideways_use_ema': False, 'sideways_use_atr': True, 'sideways_use_adx': True, 'sideways_use_spike': True, 'sideways_rsi_required': True}.
[I 2025-08-31 13:46:55,988] Trial 857 finished with values: [-1000000000.0, 1000000000.0] and parameters: {'p_sma': 9, 'p_std': 23, 'p_atr': 17, 'p_adx': 13, 'rsi_period': 57, 'ema1': 27, 'ema2': 20, 'slip_atr_k': 0.0427457104806, 'slip_spread_k': 0.717419498008059, 'spread_hl_frac': 0.019433951240732463, 'bb_std_mult': 1.6712647692683085, 'rsi_os': 36, 'rsi_ob': 94, 'vol_spike': 0.03236251361312482, 'adx_thresh': 11.448839116911785, 'atr_min_pct': 0.028065950760240186, 'atr_max_pct': 0.05046093353956844, 'tp_mult': 2.551091993840958, 'tsl_mult': 0.4570672235910604, 'strategy': 'breakout', 'time_stop': 173, 'use_sma': False, 'use_atr': False, 'use_adx': True, 'use_ema': True, 'use_spike': True, 'rsi_required': False, 'edge_k': 1.3257900244639642, 'edge_cap': 0.6390268055089999, 'bull_strategy': 'mean_reversion', 'bull_bb_std_mult': 2.6635289986223376, 'bull_rsi_os': 6, 'bull_rsi_ob': 87, 'bull_adx_thresh': 17.275272106763662, 'bull_atr_min_pct': 0.015973951111340607, 'bull_atr_max_pct': 0.08162151223060408, 'bull_tp_mult': 1.067592792980487, 'bull_tsl_mult': 0.5942992654796075, 'bull_time_stop': 203, 'bull_use_sma': False, 'bull_use_ema': False, 'bull_use_atr': True, 'bull_use_adx': False, 'bull_use_spike': True, 'bull_rsi_required': True, 'bear_strategy': 'mean_reversion', 'bear_bb_std_mult': 1.189810536804583, 'bear_rsi_os': 30, 'bear_rsi_ob': 68, 'bear_adx_thresh': 17.46573848619245, 'bear_atr_min_pct': 0.0014677873993690954, 'bear_atr_max_pct': 0.12179538788576079, 'bear_tp_mult': 1.2876853099203913, 'bear_tsl_mult': 0.7446210850906579, 'bear_time_stop': 221, 'bear_use_sma': False, 'bear_use_ema': True, 'bear_use_atr': False, 'bear_use_adx': False, 'bear_use_spike': True, 'bear_rsi_required': True, 'sideways_strategy': 'breakout', 'sideways_bb_std_mult': 3.2468700713005187, 'sideways_rsi_os': 45, 'sideways_rsi_ob': 90, 'sideways_adx_thresh': 25.18526691680554, 'sideways_atr_min_pct': 0.011368017700413185, 'sideways_atr_max_pct': 0.14699874529931314, 'sideways_tp_mult': 1.7187228820691793, 'sideways_tsl_mult': 0.8661437175594724, 'sideways_time_stop': 55, 'sideways_use_sma': False, 'sideways_use_ema': False, 'sideways_use_atr': True, 'sideways_use_adx': True, 'sideways_use_spike': True, 'sideways_rsi_required': True}.
[I 2025-08-31 13:46:56,174] Trial 859 finished with values: [-1000000000.0, 1000000000.0] and parameters: {'p_sma': 21, 'p_std': 57, 'p_atr': 16, 'p_adx': 11, 'rsi_period': 45, 'ema1': 17, 'ema2': 18, 'slip_atr_k': 0.0821194427442686, 'slip_spread_k': 0.7218232492983305, 'spread_hl_frac': 0.014380322508779832, 'bb_std_mult': 1.6592649462215778, 'rsi_os': 34, 'rsi_ob': 72, 'vol_spike': 0.2355414299768119, 'adx_thresh': 11.59507930934742, 'atr_min_pct': 0.004517449712711971, 'atr_max_pct': 0.0844710275499141, 'tp_mult': 2.529301906742719, 'tsl_mult': 0.6001791072348924, 'strategy': 'mean_reversion', 'time_stop': 189, 'use_sma': False, 'use_atr': False, 'use_adx': True, 'use_ema': True, 'use_spike': True, 'rsi_required': False, 'edge_k': 0.042831483319425656, 'edge_cap': 0.6365613276292862, 'bull_strategy': 'mean_reversion', 'bull_bb_std_mult': 2.909088401488933, 'bull_rsi_os': 6, 'bull_rsi_ob': 87, 'bull_adx_thresh': 18.689108017744786, 'bull_atr_min_pct': 0.0036262501644196317, 'bull_atr_max_pct': 0.13886236061142593, 'bull_tp_mult': 2.256540724000037, 'bull_tsl_mult': 0.2794380799499824, 'bull_time_stop': 199, 'bull_use_sma': False, 'bull_use_ema': False, 'bull_use_atr': True, 'bull_use_adx': False, 'bull_use_spike': True, 'bull_rsi_required': True, 'bear_strategy': 'mean_reversion', 'bear_bb_std_mult': 2.7204940284220376, 'bear_rsi_os': 48, 'bear_rsi_ob': 72, 'bear_adx_thresh': 17.86948008251553, 'bear_atr_min_pct': 0.008850513708274312, 'bear_atr_max_pct': 0.1334917847030111, 'bear_tp_mult': 1.4535990024258578, 'bear_tsl_mult': 0.3509160422825185, 'bear_time_stop': 203, 'bear_use_sma': False, 'bear_use_ema': True, 'bear_use_atr': False, 'bear_use_adx': False, 'bear_use_spike': True, 'bear_rsi_required': False, 'sideways_strategy': 'breakout', 'sideways_bb_std_mult': 2.0623772398950475, 'sideways_rsi_os': 30, 'sideways_rsi_ob': 73, 'sideways_adx_thresh': 23.74788733991206, 'sideways_atr_min_pct': 0.005170364186741143, 'sideways_atr_max_pct': 0.1473087336448731, 'sideways_tp_mult': 1.7933484655125764, 'sideways_tsl_mult': 0.8615363765139301, 'sideways_time_stop': 56, 'sideways_use_sma': False, 'sideways_use_ema': False, 'sideways_use_atr': True, 'sideways_use_adx': True, 'sideways_use_spike': True, 'sideways_rsi_required': True}.
[I 2025-08-31 13:47:28,113] Trial 862 finished with values: [-1000000000.0, 1000000000.0] and parameters: {'p_sma': 18, 'p_std': 58, 'p_atr': 20, 'p_adx': 22, 'rsi_period': 45, 'ema1': 17, 'ema2': 18, 'slip_atr_k': 0.2112850428294106, 'slip_spread_k': 0.467281796221821, 'spread_hl_frac': 0.014623816576632812, 'bb_std_mult': 2.4362907706122083, 'rsi_os': 42, 'rsi_ob': 83, 'vol_spike': 0.018948590573543422, 'adx_thresh': 8.835191733273703, 'atr_min_pct': 0.02584631848909198, 'atr_max_pct': 0.04520390162913509, 'tp_mult': 2.962156554135064, 'tsl_mult': 0.14532146260179857, 'strategy': 'mean_reversion', 'time_stop': 157, 'use_sma': False, 'use_atr': False, 'use_adx': True, 'use_ema': True, 'use_spike': True, 'rsi_required': False, 'edge_k': 0.4832180179024329, 'edge_cap': 0.5772723923930478, 'bull_strategy': 'mean_reversion', 'bull_bb_std_mult': 2.721249954652086, 'bull_rsi_os': 30, 'bull_rsi_ob': 84, 'bull_adx_thresh': 16.251773733110074, 'bull_atr_min_pct': 0.004476387175656236, 'bull_atr_max_pct': 0.13922699143666392, 'bull_tp_mult': 2.8907611197968457, 'bull_tsl_mult': 0.6910891137788335, 'bull_time_stop': 173, 'bull_use_sma': True, 'bull_use_ema': True, 'bull_use_atr': True, 'bull_use_adx': True, 'bull_use_spike': True, 'bull_rsi_required': True, 'bear_strategy': 'breakout', 'bear_bb_std_mult': 2.2910461618234947, 'bear_rsi_os': 27, 'bear_rsi_ob': 92, 'bear_adx_thresh': 20.165204908774108, 'bear_atr_min_pct': 0.02429923033624095, 'bear_atr_max_pct': 0.1272856661511379, 'bear_tp_mult': 1.450759733243591, 'bear_tsl_mult': 0.21687141766215362, 'bear_time_stop': 167, 'bear_use_sma': False, 'bear_use_ema': False, 'bear_use_atr': False, 'bear_use_adx': False, 'bear_use_spike': True, 'bear_rsi_required': False, 'sideways_strategy': 'breakout', 'sideways_bb_std_mult': 2.6735970501669932, 'sideways_rsi_os': 28, 'sideways_rsi_ob': 67, 'sideways_adx_thresh': 23.744789218106373, 'sideways_atr_min_pct': 0.004400533800190088, 'sideways_atr_max_pct': 0.08050934215247943, 'sideways_tp_mult': 1.67560237359718, 'sideways_tsl_mult': 0.8983505919105242, 'sideways_time_stop': 43, 'sideways_use_sma': False, 'sideways_use_ema': False, 'sideways_use_atr': True, 'sideways_use_adx': True, 'sideways_use_spike': False, 'sideways_rsi_required': True}.
[I 2025-08-31 13:47:28,978] Trial 861 finished with values: [-1000000000.0, 1000000000.0] and parameters: {'p_sma': 9, 'p_std': 19, 'p_atr': 16, 'p_adx': 11, 'rsi_period': 45, 'ema1': 17, 'ema2': 18, 'slip_atr_k': 0.04294480808172452, 'slip_spread_k': 0.3887902154219804, 'spread_hl_frac': 0.01428566322675902, 'bb_std_mult': 0.654377492041452, 'rsi_os': 41, 'rsi_ob': 86, 'vol_spike': 0.015918830909087696, 'adx_thresh': 9.008415585866608, 'atr_min_pct': 0.004864761546858717, 'atr_max_pct': 0.07330898234915953, 'tp_mult': 2.577504988890212, 'tsl_mult': 0.6168301467621151, 'strategy': 'breakout', 'time_stop': 191, 'use_sma': False, 'use_atr': False, 'use_adx': True, 'use_ema': True, 'use_spike': True, 'rsi_required': False, 'edge_k': 1.6427520339802721, 'edge_cap': 0.6406510485289871, 'bull_strategy': 'mean_reversion', 'bull_bb_std_mult': 2.6697754944322822, 'bull_rsi_os': 7, 'bull_rsi_ob': 84, 'bull_adx_thresh': 23.479885989673683, 'bull_atr_min_pct': 0.015947873662941574, 'bull_atr_max_pct': 0.14125618511263593, 'bull_tp_mult': 2.8649496199134745, 'bull_tsl_mult': 0.2819277833878626, 'bull_time_stop': 179, 'bull_use_sma': False, 'bull_use_ema': False, 'bull_use_atr': True, 'bull_use_adx': False, 'bull_use_spike': True, 'bull_rsi_required': True, 'bear_strategy': 'mean_reversion', 'bear_bb_std_mult': 3.2352601751514896, 'bear_rsi_os': 10, 'bear_rsi_ob': 72, 'bear_adx_thresh': 19.995054193156353, 'bear_atr_min_pct': 0.009959828959998845, 'bear_atr_max_pct': 0.12559316596160866, 'bear_tp_mult': 1.4651329843089373, 'bear_tsl_mult': 0.3491996711812136, 'bear_time_stop': 224, 'bear_use_sma': False, 'bear_use_ema': False, 'bear_use_atr': False, 'bear_use_adx': False, 'bear_use_spike': True, 'bear_rsi_required': False, 'sideways_strategy': 'breakout', 'sideways_bb_std_mult': 2.0626679645698487, 'sideways_rsi_os': 6, 'sideways_rsi_ob': 67, 'sideways_adx_thresh': 23.768751310299873, 'sideways_atr_min_pct': 0.021574767656411545, 'sideways_atr_max_pct': 0.14714163816516496, 'sideways_tp_mult': 1.6846145641107826, 'sideways_tsl_mult': 0.870894216420689, 'sideways_time_stop': 43, 'sideways_use_sma': False, 'sideways_use_ema': False, 'sideways_use_atr': True, 'sideways_use_adx': True, 'sideways_use_spike': True, 'sideways_rsi_required': True}.
[I 2025-08-31 13:47:30,008] Trial 860 finished with values: [-1000000000.0, 1000000000.0] and parameters: {'p_sma': 36, 'p_std': 20, 'p_atr': 16, 'p_adx': 15, 'rsi_period': 44, 'ema1': 6, 'ema2': 37, 'slip_atr_k': 0.03376598635855971, 'slip_spread_k': 0.2092044996017418, 'spread_hl_frac': 0.0432905540364653, 'bb_std_mult': 1.0955474396065161, 'rsi_os': 48, 'rsi_ob': 94, 'vol_spike': 0.016047744227616602, 'adx_thresh': 8.8724200936149, 'atr_min_pct': 0.02350703663361641, 'atr_max_pct': 0.08277073889149159, 'tp_mult': 1.5433194296411321, 'tsl_mult': 0.2807845395783723, 'strategy': 'mean_reversion', 'time_stop': 191, 'use_sma': False, 'use_atr': False, 'use_adx': True, 'use_ema': True, 'use_spike': True, 'rsi_required': False, 'edge_k': 0.5198680427167218, 'edge_cap': 0.5813296635965725, 'bull_strategy': 'mean_reversion', 'bull_bb_std_mult': 0.5004159865780191, 'bull_rsi_os': 9, 'bull_rsi_ob': 84, 'bull_adx_thresh': 18.84186609304982, 'bull_atr_min_pct': 0.028793734773228885, 'bull_atr_max_pct': 0.07541297513189897, 'bull_tp_mult': 1.074155427099535, 'bull_tsl_mult': 0.28719222295845204, 'bull_time_stop': 177, 'bull_use_sma': False, 'bull_use_ema': False, 'bull_use_atr': True, 'bull_use_adx': False, 'bull_use_spike': True, 'bull_rsi_required': True, 'bear_strategy': 'mean_reversion', 'bear_bb_std_mult': 3.237306595017579, 'bear_rsi_os': 26, 'bear_rsi_ob': 70, 'bear_adx_thresh': 20.10346021993196, 'bear_atr_min_pct': 0.023666956221343682, 'bear_atr_max_pct': 0.13325441658036621, 'bear_tp_mult': 1.2797718960658289, 'bear_tsl_mult': 0.34568720408659914, 'bear_time_stop': 203, 'bear_use_sma': False, 'bear_use_ema': True, 'bear_use_atr': False, 'bear_use_adx': False, 'bear_use_spike': True, 'bear_rsi_required': False, 'sideways_strategy': 'breakout', 'sideways_bb_std_mult': 0.6158676762457458, 'sideways_rsi_os': 29, 'sideways_rsi_ob': 56, 'sideways_adx_thresh': 23.881408077265146, 'sideways_atr_min_pct': 0.004509517770531454, 'sideways_atr_max_pct': 0.14687427160378821, 'sideways_tp_mult': 1.74643294234746, 'sideways_tsl_mult': 0.8846431162611467, 'sideways_time_stop': 133, 'sideways_use_sma': False, 'sideways_use_ema': False, 'sideways_use_atr': True, 'sideways_use_adx': True, 'sideways_use_spike': True, 'sideways_rsi_required': True}.
[I 2025-08-31 13:47:30,026] Trial 863 finished with values: [-1000000000.0, 1000000000.0] and parameters: {'p_sma': 35, 'p_std': 19, 'p_atr': 15, 'p_adx': 15, 'rsi_period': 53, 'ema1': 11, 'ema2': 18, 'slip_atr_k': 0.03695642250695009, 'slip_spread_k': 0.4575784806509594, 'spread_hl_frac': 0.01677468669923202, 'bb_std_mult': 2.6310315179169614, 'rsi_os': 41, 'rsi_ob': 89, 'vol_spike': 0.01525483101578212, 'adx_thresh': 8.826814633502824, 'atr_min_pct': 0.026487294718376676, 'atr_max_pct': 0.07566982280228379, 'tp_mult': 2.574204399185045, 'tsl_mult': 0.5556508700545053, 'strategy': 'breakout', 'time_stop': 182, 'use_sma': False, 'use_atr': False, 'use_adx': True, 'use_ema': True, 'use_spike': True, 'rsi_required': False, 'edge_k': 0.18502226199780025, 'edge_cap': 0.6561740732881332, 'bull_strategy': 'mean_reversion', 'bull_bb_std_mult': 2.702551486630357, 'bull_rsi_os': 35, 'bull_rsi_ob': 84, 'bull_adx_thresh': 18.67996713282213, 'bull_atr_min_pct': 0.015203432912287514, 'bull_atr_max_pct': 0.06872537727005079, 'bull_tp_mult': 1.4817928918918561, 'bull_tsl_mult': 0.6870135401985425, 'bull_time_stop': 228, 'bull_use_sma': True, 'bull_use_ema': True, 'bull_use_atr': True, 'bull_use_adx': True, 'bull_use_spike': True, 'bull_rsi_required': True, 'bear_strategy': 'breakout', 'bear_bb_std_mult': 1.76096309881619, 'bear_rsi_os': 27, 'bear_rsi_ob': 70, 'bear_adx_thresh': 18.826186188209356, 'bear_atr_min_pct': 0.010534613709204, 'bear_atr_max_pct': 0.04234592009529036, 'bear_tp_mult': 1.5386673506753974, 'bear_tsl_mult': 0.2639813749738942, 'bear_time_stop': 192, 'bear_use_sma': False, 'bear_use_ema': False, 'bear_use_atr': False, 'bear_use_adx': False, 'bear_use_spike': False, 'bear_rsi_required': False, 'sideways_strategy': 'mean_reversion', 'sideways_bb_std_mult': 0.6133181269454708, 'sideways_rsi_os': 28, 'sideways_rsi_ob': 67, 'sideways_adx_thresh': 23.134087030146524, 'sideways_atr_min_pct': 0.021670144086855577, 'sideways_atr_max_pct': 0.06191536808974642, 'sideways_tp_mult': 1.6567976937924072, 'sideways_tsl_mult': 0.8881040547700503, 'sideways_time_stop': 165, 'sideways_use_sma': False, 'sideways_use_ema': True, 'sideways_use_atr': True, 'sideways_use_adx': True, 'sideways_use_spike': False, 'sideways_rsi_required': True}.
