[I 2025-08-31 13:16:15,907] Trial 630 finished with values: [-1000000000.0, 1000000000.0] and parameters: {'p_sma': 51, 'p_std': 7, 'p_atr': 12, 'p_adx': 13, 'rsi_period': 45, 'ema1': 19, 'ema2': 15, 'slip_atr_k': 0.11105749155635733, 'slip_spread_k': 0.4301045070565091, 'spread_hl_frac': 0.014150577557360447, 'bb_std_mult': 1.199072989736388, 'rsi_os': 41, 'rsi_ob': 45, 'vol_spike': 0.027238386138560666, 'adx_thresh': 18.211785155961362, 'atr_min_pct': 0.0014080914567917114, 'atr_max_pct': 0.08314765622658842, 'tp_mult': 2.5811043356783476, 'tsl_mult': 0.2896096791601076, 'strategy': 'breakout', 'time_stop': 182, 'use_sma': False, 'use_atr': True, 'use_adx': False, 'use_ema': True, 'use_spike': False, 'rsi_required': True, 'edge_k': 0.0933906875515621, 'edge_cap': 0.7319660663563993, 'bull_strategy': 'breakout', 'bull_bb_std_mult': 2.6630355402987127, 'bull_rsi_os': 31, 'bull_rsi_ob': 75, 'bull_adx_thresh': 18.19607234332539, 'bull_atr_min_pct': 0.018543896475247786, 'bull_atr_max_pct': 0.1452757341706454, 'bull_tp_mult': 1.292806563075019, 'bull_tsl_mult': 0.17464662549396134, 'bull_time_stop': 300, 'bull_use_sma': False, 'bull_use_ema': True, 'bull_use_atr': False, 'bull_use_adx': True, 'bull_use_spike': True, 'bull_rsi_required': False, 'bear_strategy': 'mean_reversion', 'bear_bb_std_mult': 3.181852235636456, 'bear_rsi_os': 29, 'bear_rsi_ob': 80, 'bear_adx_thresh': 5.752909597768969, 'bear_atr_min_pct': 0.002399090567568067, 'bear_atr_max_pct': 0.0618537285437386, 'bear_tp_mult': 1.4267714939544613, 'bear_tsl_mult': 0.7796121219069726, 'bear_time_stop': 179, 'bear_use_sma': True, 'bear_use_ema': False, 'bear_use_atr': True, 'bear_use_adx': True, 'bear_use_spike': False, 'bear_rsi_required': False, 'sideways_strategy': 'mean_reversion', 'sideways_bb_std_mult': 1.3757207898000399, 'sideways_rsi_os': 31, 'sideways_rsi_ob': 78, 'sideways_adx_thresh': 28.963892743465806, 'sideways_atr_min_pct': 0.012941428488830183, 'sideways_atr_max_pct': 0.05635280127355486, 'sideways_tp_mult': 1.6388237068889273, 'sideways_tsl_mult': 0.89274108832497, 'sideways_time_stop': 206, 'sideways_use_sma': True, 'sideways_use_ema': False, 'sideways_use_atr': False, 'sideways_use_adx': False, 'sideways_use_spike': False, 'sideways_rsi_required': True}.
[I 2025-08-31 13:16:16,222] Trial 632 finished with values: [-0.06986813825389304, 0.06954322828972959] and parameters: {'p_sma': 53, 'p_std': 24, 'p_atr': 29, 'p_adx': 16, 'rsi_period': 22, 'ema1': 20, 'ema2': 56, 'slip_atr_k': 0.1874574188069323, 'slip_spread_k': 0.4465892328897023, 'spread_hl_frac': 0.015596466806762693, 'bb_std_mult': 2.180004902608017, 'rsi_os': 32, 'rsi_ob': 79, 'vol_spike': 0.027304577857921064, 'adx_thresh': 19.286825622119224, 'atr_min_pct': 0.017065236728034117, 'atr_max_pct': 0.08237280500269857, 'tp_mult': 1.7122723117058174, 'tsl_mult': 0.0013533639125140155, 'strategy': 'breakout', 'time_stop': 178, 'use_sma': False, 'use_atr': True, 'use_adx': False, 'use_ema': True, 'use_spike': False, 'rsi_required': True, 'edge_k': 1.6842703791857905, 'edge_cap': 0.7394356446998218, 'bull_strategy': 'breakout', 'bull_bb_std_mult': 2.670085687000288, 'bull_rsi_os': 8, 'bull_rsi_ob': 52, 'bull_adx_thresh': 17.71708715279953, 'bull_atr_min_pct': 0.018657195590252307, 'bull_atr_max_pct': 0.1448212207744264, 'bull_tp_mult': 2.9500948085459084, 'bull_tsl_mult': 0.6643630547952426, 'bull_time_stop': 285, 'bull_use_sma': True, 'bull_use_ema': True, 'bull_use_atr': False, 'bull_use_adx': True, 'bull_use_spike': False, 'bull_rsi_required': False, 'bear_strategy': 'mean_reversion', 'bear_bb_std_mult': 3.068373328889955, 'bear_rsi_os': 16, 'bear_rsi_ob': 71, 'bear_adx_thresh': 12.761747832268394, 'bear_atr_min_pct': 0.0024734646357425375, 'bear_atr_max_pct': 0.06293885384476847, 'bear_tp_mult': 1.6674299091882951, 'bear_tsl_mult': 0.7287359789475685, 'bear_time_stop': 191, 'bear_use_sma': True, 'bear_use_ema': False, 'bear_use_atr': True, 'bear_use_adx': True, 'bear_use_spike': True, 'bear_rsi_required': False, 'sideways_strategy': 'breakout', 'sideways_bb_std_mult': 1.5204441682082286, 'sideways_rsi_os': 31, 'sideways_rsi_ob': 70, 'sideways_adx_thresh': 21.615682255900083, 'sideways_atr_min_pct': 0.0022270541095380765, 'sideways_atr_max_pct': 0.13541250571899688, 'sideways_tp_mult': 1.6485059913244797, 'sideways_tsl_mult': 0.7642896206114447, 'sideways_time_stop': 189, 'sideways_use_sma': True, 'sideways_use_ema': False, 'sideways_use_atr': False, 'sideways_use_adx': False, 'sideways_use_spike': False, 'sideways_rsi_required': False}.
[I 2025-08-31 13:16:16,247] Trial 631 finished with values: [-1000000000.0, 1000000000.0] and parameters: {'p_sma': 50, 'p_std': 52, 'p_atr': 19, 'p_adx': 9, 'rsi_period': 8, 'ema1': 19, 'ema2': 13, 'slip_atr_k': 0.18793205238003624, 'slip_spread_k': 0.44602784314142996, 'spread_hl_frac': 0.019330263335326725, 'bb_std_mult': 1.205203114492781, 'rsi_os': 37, 'rsi_ob': 45, 'vol_spike': 0.29954884602704024, 'adx_thresh': 19.51234764487199, 'atr_min_pct': 5.731243885816954e-05, 'atr_max_pct': 0.11922701414666882, 'tp_mult': 1.078806590164413, 'tsl_mult': 0.014407218394985245, 'strategy': 'breakout', 'time_stop': 186, 'use_sma': False, 'use_atr': True, 'use_adx': False, 'use_ema': True, 'use_spike': False, 'rsi_required': True, 'edge_k': 0.6816226503380483, 'edge_cap': 0.07760423223507579, 'bull_strategy': 'breakout', 'bull_bb_std_mult': 2.641612243677741, 'bull_rsi_os': 31, 'bull_rsi_ob': 52, 'bull_adx_thresh': 17.89151582049707, 'bull_atr_min_pct': 0.01997951494384807, 'bull_atr_max_pct': 0.12225697946336109, 'bull_tp_mult': 1.3826375445075016, 'bull_tsl_mult': 0.17727879912916952, 'bull_time_stop': 188, 'bull_use_sma': True, 'bull_use_ema': True, 'bull_use_atr': False, 'bull_use_adx': True, 'bull_use_spike': False, 'bull_rsi_required': False, 'bear_strategy': 'mean_reversion', 'bear_bb_std_mult': 1.413888094499917, 'bear_rsi_os': 21, 'bear_rsi_ob': 87, 'bear_adx_thresh': 12.701128392862618, 'bear_atr_min_pct': 0.00275096759458632, 'bear_atr_max_pct': 0.06152798682589199, 'bear_tp_mult': 2.180933549270882, 'bear_tsl_mult': 0.2948141912406257, 'bear_time_stop': 180, 'bear_use_sma': True, 'bear_use_ema': False, 'bear_use_atr': True, 'bear_use_adx': True, 'bear_use_spike': False, 'bear_rsi_required': False, 'sideways_strategy': 'breakout', 'sideways_bb_std_mult': 1.7489574351096735, 'sideways_rsi_os': 31, 'sideways_rsi_ob': 78, 'sideways_adx_thresh': 34.980766983152456, 'sideways_atr_min_pct': 0.01780137476686392, 'sideways_atr_max_pct': 0.03046361796273226, 'sideways_tp_mult': 2.220245097645375, 'sideways_tsl_mult': 0.8983813412530819, 'sideways_time_stop': 204, 'sideways_use_sma': True, 'sideways_use_ema': False, 'sideways_use_atr': False, 'sideways_use_adx': False, 'sideways_use_spike': False, 'sideways_rsi_required': True}.
[I 2025-08-31 13:16:16,335] Trial 633 finished with values: [-1000000000.0, 1000000000.0] and parameters: {'p_sma': 53, 'p_std': 24, 'p_atr': 26, 'p_adx': 16, 'rsi_period': 51, 'ema1': 13, 'ema2': 53, 'slip_atr_k': 0.167989407079008, 'slip_spread_k': 0.43947231151745697, 'spread_hl_frac': 0.01581014453685773, 'bb_std_mult': 2.674416884433758, 'rsi_os': 36, 'rsi_ob': 79, 'vol_spike': 0.17327873183738518, 'adx_thresh': 19.437230656097082, 'atr_min_pct': 0.016899252414434004, 'atr_max_pct': 0.10054829822445879, 'tp_mult': 2.623388531437042, 'tsl_mult': 0.31792435209634995, 'strategy': 'breakout', 'time_stop': 177, 'use_sma': False, 'use_atr': True, 'use_adx': False, 'use_ema': True, 'use_spike': False, 'rsi_required': True, 'edge_k': 0.10555279995861189, 'edge_cap': 0.07459699916597479, 'bull_strategy': 'breakout', 'bull_bb_std_mult': 2.691413991112969, 'bull_rsi_os': 22, 'bull_rsi_ob': 52, 'bull_adx_thresh': 17.887074922016737, 'bull_atr_min_pct': 0.019860679049189253, 'bull_atr_max_pct': 0.14505122349847707, 'bull_tp_mult': 1.4003399708910071, 'bull_tsl_mult': 0.2233160157239357, 'bull_time_stop': 285, 'bull_use_sma': True, 'bull_use_ema': True, 'bull_use_atr': False, 'bull_use_adx': True, 'bull_use_spike': False, 'bull_rsi_required': False, 'bear_strategy': 'mean_reversion', 'bear_bb_std_mult': 1.3947482553144526, 'bear_rsi_os': 18, 'bear_rsi_ob': 81, 'bear_adx_thresh': 5.51283241342027, 'bear_atr_min_pct': 0.002949111862725142, 'bear_atr_max_pct': 0.061916043642054136, 'bear_tp_mult': 2.8442060732752004, 'bear_tsl_mult': 0.7304783750215517, 'bear_time_stop': 172, 'bear_use_sma': True, 'bear_use_ema': False, 'bear_use_atr': True, 'bear_use_adx': True, 'bear_use_spike': True, 'bear_rsi_required': False, 'sideways_strategy': 'breakout', 'sideways_bb_std_mult': 1.2221893326179138, 'sideways_rsi_os': 31, 'sideways_rsi_ob': 78, 'sideways_adx_thresh': 27.452840461844033, 'sideways_atr_min_pct': 0.002109183778822245, 'sideways_atr_max_pct': 0.13640717518005901, 'sideways_tp_mult': 1.6513460387551104, 'sideways_tsl_mult': 0.3826003252558011, 'sideways_time_stop': 200, 'sideways_use_sma': True, 'sideways_use_ema': False, 'sideways_use_atr': False, 'sideways_use_adx': False, 'sideways_use_spike': False, 'sideways_rsi_required': False}.
[I 2025-08-31 13:16:48,965] Trial 634 finished with values: [-1000000000.0, 1000000000.0] and parameters: {'p_sma': 18, 'p_std': 52, 'p_atr': 13, 'p_adx': 16, 'rsi_period': 13, 'ema1': 20, 'ema2': 56, 'slip_atr_k': 0.06660917713417276, 'slip_spread_k': 0.3381778734568479, 'spread_hl_frac': 0.01567610504799258, 'bb_std_mult': 2.2609205412320934, 'rsi_os': 36, 'rsi_ob': 79, 'vol_spike': 0.053079151959122495, 'adx_thresh': 19.204227162788477, 'atr_min_pct': 0.017548891256079262, 'atr_max_pct': 0.1204753631495305, 'tp_mult': 1.0685920875894275, 'tsl_mult': 0.04714187706065827, 'strategy': 'breakout', 'time_stop': 166, 'use_sma': False, 'use_atr': True, 'use_adx': False, 'use_ema': True, 'use_spike': False, 'rsi_required': True, 'edge_k': 1.6706514598219688, 'edge_cap': 0.7489244102096645, 'bull_strategy': 'breakout', 'bull_bb_std_mult': 1.4602851120320994, 'bull_rsi_os': 43, 'bull_rsi_ob': 45, 'bull_adx_thresh': 17.804921685432237, 'bull_atr_min_pct': 0.011265600364288444, 'bull_atr_max_pct': 0.1275058008911901, 'bull_tp_mult': 2.9599793982725684, 'bull_tsl_mult': 0.9116023755616078, 'bull_time_stop': 287, 'bull_use_sma': True, 'bull_use_ema': True, 'bull_use_atr': False, 'bull_use_adx': True, 'bull_use_spike': False, 'bull_rsi_required': False, 'bear_strategy': 'mean_reversion', 'bear_bb_std_mult': 3.0625704359623582, 'bear_rsi_os': 33, 'bear_rsi_ob': 88, 'bear_adx_thresh': 21.760569014601042, 'bear_atr_min_pct': 0.0027644529358700053, 'bear_atr_max_pct': 0.1359505291003618, 'bear_tp_mult': 1.9325486415000113, 'bear_tsl_mult': 0.7300823085560286, 'bear_time_stop': 61, 'bear_use_sma': True, 'bear_use_ema': False, 'bear_use_atr': True, 'bear_use_adx': True, 'bear_use_spike': True, 'bear_rsi_required': False, 'sideways_strategy': 'breakout', 'sideways_bb_std_mult': 0.5846343964027998, 'sideways_rsi_os': 12, 'sideways_rsi_ob': 70, 'sideways_adx_thresh': 27.51946350597503, 'sideways_atr_min_pct': 0.002718942994137115, 'sideways_atr_max_pct': 0.10252595213854554, 'sideways_tp_mult': 2.7383958803050166, 'sideways_tsl_mult': 0.8447316935343855, 'sideways_time_stop': 151, 'sideways_use_sma': True, 'sideways_use_ema': False, 'sideways_use_atr': False, 'sideways_use_adx': False, 'sideways_use_spike': False, 'sideways_rsi_required': False}.
[I 2025-08-31 13:16:49,380] Trial 637 finished with values: [-0.08637575517356066, 0.08585059677535427] and parameters: {'p_sma': 18, 'p_std': 41, 'p_atr': 11, 'p_adx': 15, 'rsi_period': 13, 'ema1': 21, 'ema2': 26, 'slip_atr_k': 0.13400606964693132, 'slip_spread_k': 0.5406251098258423, 'spread_hl_frac': 0.017104494250864535, 'bb_std_mult': 2.4494676052809625, 'rsi_os': 14, 'rsi_ob': 77, 'vol_spike': 0.008761759973291268, 'adx_thresh': 20.66953057187096, 'atr_min_pct': 0.0006542797757741447, 'atr_max_pct': 0.14455984055062582, 'tp_mult': 2.6982580163204117, 'tsl_mult': 0.04756742788523327, 'strategy': 'breakout', 'time_stop': 163, 'use_sma': False, 'use_atr': False, 'use_adx': False, 'use_ema': True, 'use_spike': False, 'rsi_required': False, 'edge_k': 0.7757063346277075, 'edge_cap': 0.7837757366392306, 'bull_strategy': 'breakout', 'bull_bb_std_mult': 1.480845864813925, 'bull_rsi_os': 43, 'bull_rsi_ob': 48, 'bull_adx_thresh': 17.139483208356577, 'bull_atr_min_pct': 0.0254474140823834, 'bull_atr_max_pct': 0.1499533871710746, 'bull_tp_mult': 1.7436122795715225, 'bull_tsl_mult': 0.22778221986194216, 'bull_time_stop': 222, 'bull_use_sma': True, 'bull_use_ema': True, 'bull_use_atr': False, 'bull_use_adx': False, 'bull_use_spike': False, 'bull_rsi_required': False, 'bear_strategy': 'breakout', 'bear_bb_std_mult': 1.3353451818594408, 'bear_rsi_os': 32, 'bear_rsi_ob': 72, 'bear_adx_thresh': 21.743629531118778, 'bear_atr_min_pct': 0.001793713036863083, 'bear_atr_max_pct': 0.1378479907139656, 'bear_tp_mult': 1.94183391460595, 'bear_tsl_mult': 0.997746036094117, 'bear_time_stop': 202, 'bear_use_sma': True, 'bear_use_ema': True, 'bear_use_atr': True, 'bear_use_adx': True, 'bear_use_spike': True, 'bear_rsi_required': True, 'sideways_strategy': 'breakout', 'sideways_bb_std_mult': 0.5909276898336169, 'sideways_rsi_os': 33, 'sideways_rsi_ob': 67, 'sideways_adx_thresh': 20.964942369442085, 'sideways_atr_min_pct': 0.021454477203539775, 'sideways_atr_max_pct': 0.12506967948842135, 'sideways_tp_mult': 1.5332288864829633, 'sideways_tsl_mult': 0.9550761527541495, 'sideways_time_stop': 196, 'sideways_use_sma': True, 'sideways_use_ema': False, 'sideways_use_atr': False, 'sideways_use_adx': False, 'sideways_use_spike': True, 'sideways_rsi_required': True}.
[I 2025-08-31 13:16:50,015] Trial 636 finished with values: [-1000000000.0, 1000000000.0] and parameters: {'p_sma': 58, 'p_std': 50, 'p_atr': 21, 'p_adx': 15, 'rsi_period': 51, 'ema1': 13, 'ema2': 26, 'slip_atr_k': 0.0661720445805442, 'slip_spread_k': 0.3785988036943175, 'spread_hl_frac': 0.037933585241540266, 'bb_std_mult': 2.261981773214572, 'rsi_os': 46, 'rsi_ob': 77, 'vol_spike': 0.007302498848687843, 'adx_thresh': 28.54531862652403, 'atr_min_pct': 0.0007411869089643795, 'atr_max_pct': 0.08998659748604498, 'tp_mult': 2.711113551925349, 'tsl_mult': 0.04842872511704518, 'strategy': 'breakout', 'time_stop': 166, 'use_sma': False, 'use_atr': True, 'use_adx': False, 'use_ema': True, 'use_spike': False, 'rsi_required': True, 'edge_k': 0.6603746067037476, 'edge_cap': 0.1800163614041832, 'bull_strategy': 'breakout', 'bull_bb_std_mult': 2.340392047769884, 'bull_rsi_os': 6, 'bull_rsi_ob': 45, 'bull_adx_thresh': 16.887116329946664, 'bull_atr_min_pct': 0.019459116662296324, 'bull_atr_max_pct': 0.1474290820082545, 'bull_tp_mult': 1.1934735810948505, 'bull_tsl_mult': 0.9298617352559853, 'bull_time_stop': 225, 'bull_use_sma': True, 'bull_use_ema': True, 'bull_use_atr': False, 'bull_use_adx': False, 'bull_use_spike': False, 'bull_rsi_required': False, 'bear_strategy': 'breakout', 'bear_bb_std_mult': 3.1009602201161037, 'bear_rsi_os': 32, 'bear_rsi_ob': 72, 'bear_adx_thresh': 26.070706290914778, 'bear_atr_min_pct': 0.00562456534818016, 'bear_atr_max_pct': 0.13725845339981824, 'bear_tp_mult': 1.9528884479397979, 'bear_tsl_mult': 0.7372930871785199, 'bear_time_stop': 204, 'bear_use_sma': True, 'bear_use_ema': True, 'bear_use_atr': True, 'bear_use_adx': True, 'bear_use_spike': True, 'bear_rsi_required': True, 'sideways_strategy': 'breakout', 'sideways_bb_std_mult': 2.861545134960779, 'sideways_rsi_os': 17, 'sideways_rsi_ob': 67, 'sideways_adx_thresh': 19.900517402037643, 'sideways_atr_min_pct': 0.00260189130261898, 'sideways_atr_max_pct': 0.12653921055542028, 'sideways_tp_mult': 1.5132918154920252, 'sideways_tsl_mult': 0.8473056373616088, 'sideways_time_stop': 272, 'sideways_use_sma': True, 'sideways_use_ema': False, 'sideways_use_atr': False, 'sideways_use_adx': False, 'sideways_use_spike': True, 'sideways_rsi_required': False}.
[I 2025-08-31 13:16:50,015] Trial 635 finished with values: [-0.11579172787525638, 0.11521970714691601] and parameters: {'p_sma': 58, 'p_std': 50, 'p_atr': 21, 'p_adx': 15, 'rsi_period': 12, 'ema1': 21, 'ema2': 16, 'slip_atr_k': 0.0657646177129897, 'slip_spread_k': 0.38181189834733675, 'spread_hl_frac': 0.02177467844744976, 'bb_std_mult': 1.967151003801591, 'rsi_os': 14, 'rsi_ob': 77, 'vol_spike': 0.28451102795762107, 'adx_thresh': 28.6645712600899, 'atr_min_pct': 0.010029604270078145, 'atr_max_pct': 0.023961691526127357, 'tp_mult': 2.725228268421158, 'tsl_mult': 0.9438961676521436, 'strategy': 'breakout', 'time_stop': 166, 'use_sma': False, 'use_atr': True, 'use_adx': False, 'use_ema': True, 'use_spike': False, 'rsi_required': True, 'edge_k': 1.439372262121102, 'edge_cap': 0.7778825527601532, 'bull_strategy': 'breakout', 'bull_bb_std_mult': 2.911722096151594, 'bull_rsi_os': 6, 'bull_rsi_ob': 56, 'bull_adx_thresh': 17.13965807258962, 'bull_atr_min_pct': 0.019227922445277643, 'bull_atr_max_pct': 0.14690564194666175, 'bull_tp_mult': 1.7267698718879656, 'bull_tsl_mult': 0.9956360454706414, 'bull_time_stop': 227, 'bull_use_sma': True, 'bull_use_ema': True, 'bull_use_atr': False, 'bull_use_adx': False, 'bull_use_spike': False, 'bull_rsi_required': False, 'bear_strategy': 'breakout', 'bear_bb_std_mult': 3.1029761445014334, 'bear_rsi_os': 32, 'bear_rsi_ob': 46, 'bear_adx_thresh': 14.40549648674, 'bear_atr_min_pct': 0.0016931399625265153, 'bear_atr_max_pct': 0.05013968109832862, 'bear_tp_mult': 2.8469469601396207, 'bear_tsl_mult': 0.7378990752362272, 'bear_time_stop': 135, 'bear_use_sma': True, 'bear_use_ema': True, 'bear_use_atr': True, 'bear_use_adx': True, 'bear_use_spike': True, 'bear_rsi_required': True, 'sideways_strategy': 'breakout', 'sideways_bb_std_mult': 1.1896222856811494, 'sideways_rsi_os': 33, 'sideways_rsi_ob': 53, 'sideways_adx_thresh': 20.122385228261397, 'sideways_atr_min_pct': 0.002731086225608048, 'sideways_atr_max_pct': 0.12028512115862275, 'sideways_tp_mult': 2.1493003058469795, 'sideways_tsl_mult': 0.2129910668567077, 'sideways_time_stop': 200, 'sideways_use_sma': True, 'sideways_use_ema': False, 'sideways_use_atr': False, 'sideways_use_adx': False, 'sideways_use_spike': True, 'sideways_rsi_required': False}.
[I 2025-08-31 13:17:25,108] Trial 641 finished with values: [-1000000000.0, 1000000000.0] and parameters: {'p_sma': 51, 'p_std': 22, 'p_atr': 12, 'p_adx': 14, 'rsi_period': 58, 'ema1': 9, 'ema2': 10, 'slip_atr_k': 0.04201109550481581, 'slip_spread_k': 0.4115711978927699, 'spread_hl_frac': 0.03309729690007608, 'bb_std_mult': 2.3041344239536374, 'rsi_os': 49, 'rsi_ob': 83, 'vol_spike': 0.22742385457096861, 'adx_thresh': 6.759829615236397, 'atr_min_pct': 0.008810920902726647, 'atr_max_pct': 0.12717714178155465, 'tp_mult': 2.5264695845907275, 'tsl_mult': 0.0003975442345252461, 'strategy': 'breakout', 'time_stop': 282, 'use_sma': False, 'use_atr': False, 'use_adx': True, 'use_ema': True, 'use_spike': True, 'rsi_required': False, 'edge_k': 0.5695348960924924, 'edge_cap': 0.9237532258217263, 'bull_strategy': 'mean_reversion', 'bull_bb_std_mult': 2.804656880852768, 'bull_rsi_os': 5, 'bull_rsi_ob': 50, 'bull_adx_thresh': 16.752600430250354, 'bull_atr_min_pct': 0.01642299954905339, 'bull_atr_max_pct': 0.14200955447873093, 'bull_tp_mult': 1.3130248385784768, 'bull_tsl_mult': 0.2648825816997732, 'bull_time_stop': 278, 'bull_use_sma': True, 'bull_use_ema': True, 'bull_use_atr': True, 'bull_use_adx': True, 'bull_use_spike': True, 'bull_rsi_required': True, 'bear_strategy': 'breakout', 'bear_bb_std_mult': 2.934452632478637, 'bear_rsi_os': 29, 'bear_rsi_ob': 64, 'bear_adx_thresh': 13.331141009558996, 'bear_atr_min_pct': 0.005002139322885556, 'bear_atr_max_pct': 0.14374548815097557, 'bear_tp_mult': 1.3444484376179164, 'bear_tsl_mult': 0.7090781831322028, 'bear_time_stop': 193, 'bear_use_sma': False, 'bear_use_ema': True, 'bear_use_atr': False, 'bear_use_adx': False, 'bear_use_spike': True, 'bear_rsi_required': True, 'sideways_strategy': 'breakout', 'sideways_bb_std_mult': 2.679038844371419, 'sideways_rsi_os': 30, 'sideways_rsi_ob': 66, 'sideways_adx_thresh': 7.727622201051023, 'sideways_atr_min_pct': 0.01604581598695693, 'sideways_atr_max_pct': 0.132543299741043, 'sideways_tp_mult': 1.6986952521545966, 'sideways_tsl_mult': 0.9337522955890649, 'sideways_time_stop': 214, 'sideways_use_sma': False, 'sideways_use_ema': False, 'sideways_use_atr': True, 'sideways_use_adx': True, 'sideways_use_spike': False, 'sideways_rsi_required': True}.
