[I 2025-08-31 12:30:35,207] Trial 297 finished with values: [-1000000000.0, 1000000000.0] and parameters: {'p_sma': 57, 'p_std': 29, 'p_atr': 12, 'p_adx': 21, 'rsi_period': 65, 'ema1': 9, 'ema2': 16, 'slip_atr_k': 0.2170054563110359, 'slip_spread_k': 0.6461404553264153, 'spread_hl_frac': 0.0006172082062381908, 'bb_std_mult': 2.3900235172361746, 'rsi_os': 6, 'rsi_ob': 50, 'vol_spike': 0.08649115517796775, 'adx_thresh': 25.734204431004922, 'atr_min_pct': 0.0015984903725852551, 'atr_max_pct': 0.1201767622522944, 'tp_mult': 2.616285522477189, 'tsl_mult': 0.043603178182591115, 'strategy': 'mean_reversion', 'time_stop': 203, 'use_sma': False, 'use_atr': True, 'use_adx': False, 'use_ema': False, 'use_spike': False, 'rsi_required': True, 'edge_k': 0.5213559403655315, 'edge_cap': 0.812264760598212, 'bull_strategy': 'breakout', 'bull_bb_std_mult': 2.801968137332456, 'bull_rsi_os': 46, 'bull_rsi_ob': 61, 'bull_adx_thresh': 29.510205249056703, 'bull_atr_min_pct': 0.010979926706221556, 'bull_atr_max_pct': 0.12278752957243479, 'bull_tp_mult': 2.6912931141920824, 'bull_tsl_mult': 0.23590346293673267, 'bull_time_stop': 140, 'bull_use_sma': True, 'bull_use_ema': True, 'bull_use_atr': False, 'bull_use_adx': False, 'bull_use_spike': False, 'bull_rsi_required': False, 'bear_strategy': 'breakout', 'bear_bb_std_mult': 2.2585364686021014, 'bear_rsi_os': 31, 'bear_rsi_ob': 72, 'bear_adx_thresh': 15.921089441058259, 'bear_atr_min_pct': 0.005045396605925387, 'bear_atr_max_pct': 0.09457119446465476, 'bear_tp_mult': 2.9869476793446026, 'bear_tsl_mult': 0.7026445890396362, 'bear_time_stop': 80, 'bear_use_sma': True, 'bear_use_ema': True, 'bear_use_atr': True, 'bear_use_adx': True, 'bear_use_spike': True, 'bear_rsi_required': True, 'sideways_strategy': 'mean_reversion', 'sideways_bb_std_mult': 3.4758971972934978, 'sideways_rsi_os': 28, 'sideways_rsi_ob': 74, 'sideways_adx_thresh': 13.10358511993231, 'sideways_atr_min_pct': 0.007930294785614377, 'sideways_atr_max_pct': 0.09288231404325549, 'sideways_tp_mult': 1.0107577293298138, 'sideways_tsl_mult': 0.6045908997097638, 'sideways_time_stop': 125, 'sideways_use_sma': True, 'sideways_use_ema': False, 'sideways_use_atr': False, 'sideways_use_adx': False, 'sideways_use_spike': True, 'sideways_rsi_required': False}.
[I 2025-08-31 12:30:35,234] Trial 299 finished with values: [-1000000000.0, 1000000000.0] and parameters: {'p_sma': 53, 'p_std': 29, 'p_atr': 13, 'p_adx': 18, 'rsi_period': 35, 'ema1': 6, 'ema2': 16, 'slip_atr_k': 0.006648173266170676, 'slip_spread_k': 0.6496169394518349, 'spread_hl_frac': 0.01515966728597318, 'bb_std_mult': 2.054839423059478, 'rsi_os': 52, 'rsi_ob': 70, 'vol_spike': 0.08477033393969732, 'adx_thresh': 22.328391168487244, 'atr_min_pct': 0.0015416743280956755, 'atr_max_pct': 0.13515637148195112, 'tp_mult': 2.60692652335168, 'tsl_mult': 0.030331377007664202, 'strategy': 'mean_reversion', 'time_stop': 254, 'use_sma': False, 'use_atr': True, 'use_adx': False, 'use_ema': False, 'use_spike': False, 'rsi_required': True, 'edge_k': 0.7267098952938789, 'edge_cap': 0.6132229655445529, 'bull_strategy': 'breakout', 'bull_bb_std_mult': 2.651029337165526, 'bull_rsi_os': 46, 'bull_rsi_ob': 77, 'bull_adx_thresh': 24.662035483639077, 'bull_atr_min_pct': 0.017317432766320986, 'bull_atr_max_pct': 0.0749926157848699, 'bull_tp_mult': 2.7850652293815146, 'bull_tsl_mult': 0.48110338851656276, 'bull_time_stop': 90, 'bull_use_sma': True, 'bull_use_ema': True, 'bull_use_atr': True, 'bull_use_adx': False, 'bull_use_spike': False, 'bull_rsi_required': False, 'bear_strategy': 'breakout', 'bear_bb_std_mult': 2.287180148144208, 'bear_rsi_os': 31, 'bear_rsi_ob': 83, 'bear_adx_thresh': 33.470530909373416, 'bear_atr_min_pct': 0.009056075830561793, 'bear_atr_max_pct': 0.13206599096900953, 'bear_tp_mult': 2.322621493659152, 'bear_tsl_mult': 0.7073457597743582, 'bear_time_stop': 234, 'bear_use_sma': True, 'bear_use_ema': True, 'bear_use_atr': True, 'bear_use_adx': True, 'bear_use_spike': True, 'bear_rsi_required': True, 'sideways_strategy': 'mean_reversion', 'sideways_bb_std_mult': 3.4555960199198483, 'sideways_rsi_os': 47, 'sideways_rsi_ob': 82, 'sideways_adx_thresh': 13.128626633575953, 'sideways_atr_min_pct': 0.001771623574502824, 'sideways_atr_max_pct': 0.13211321239732987, 'sideways_tp_mult': 2.6108586251899135, 'sideways_tsl_mult': 0.6523792156222701, 'sideways_time_stop': 108, 'sideways_use_sma': True, 'sideways_use_ema': False, 'sideways_use_atr': False, 'sideways_use_adx': False, 'sideways_use_spike': True, 'sideways_rsi_required': False}.
[I 2025-08-31 12:31:02,430] Trial 298 finished with values: [-1000000000.0, 1000000000.0] and parameters: {'p_sma': 54, 'p_std': 28, 'p_atr': 12, 'p_adx': 27, 'rsi_period': 38, 'ema1': 6, 'ema2': 16, 'slip_atr_k': 0.21858354449712686, 'slip_spread_k': 0.6478130426594294, 'spread_hl_frac': 0.005567045946860784, 'bb_std_mult': 3.312571325108102, 'rsi_os': 18, 'rsi_ob': 70, 'vol_spike': 0.05008075685231149, 'adx_thresh': 22.38310531701148, 'atr_min_pct': 0.0013504785826207125, 'atr_max_pct': 0.14347173645282862, 'tp_mult': 2.2845257215431656, 'tsl_mult': 0.18317096762015178, 'strategy': 'mean_reversion', 'time_stop': 211, 'use_sma': False, 'use_atr': True, 'use_adx': False, 'use_ema': False, 'use_spike': False, 'rsi_required': True, 'edge_k': 1.5652155381729156, 'edge_cap': 0.9525753728011686, 'bull_strategy': 'breakout', 'bull_bb_std_mult': 2.6659953044716382, 'bull_rsi_os': 48, 'bull_rsi_ob': 56, 'bull_adx_thresh': 9.180667958449911, 'bull_atr_min_pct': 0.01899419735995289, 'bull_atr_max_pct': 0.10084243929132561, 'bull_tp_mult': 2.2576968880683994, 'bull_tsl_mult': 0.23514451964256375, 'bull_time_stop': 90, 'bull_use_sma': True, 'bull_use_ema': True, 'bull_use_atr': True, 'bull_use_adx': False, 'bull_use_spike': False, 'bull_rsi_required': False, 'bear_strategy': 'breakout', 'bear_bb_std_mult': 3.174427378176728, 'bear_rsi_os': 31, 'bear_rsi_ob': 51, 'bear_adx_thresh': 8.876206814063867, 'bear_atr_min_pct': 0.005084504094886175, 'bear_atr_max_pct': 0.052086643373112224, 'bear_tp_mult': 2.9523559212303963, 'bear_tsl_mult': 0.6967354813422771, 'bear_time_stop': 255, 'bear_use_sma': True, 'bear_use_ema': True, 'bear_use_atr': True, 'bear_use_adx': True, 'bear_use_spike': True, 'bear_rsi_required': True, 'sideways_strategy': 'mean_reversion', 'sideways_bb_std_mult': 3.5286879212555493, 'sideways_rsi_os': 47, 'sideways_rsi_ob': 84, 'sideways_adx_thresh': 13.020638136160574, 'sideways_atr_min_pct': 0.007758230329718203, 'sideways_atr_max_pct': 0.09572292212543299, 'sideways_tp_mult': 2.8889051400252765, 'sideways_tsl_mult': 0.8084173362974492, 'sideways_time_stop': 143, 'sideways_use_sma': True, 'sideways_use_ema': False, 'sideways_use_atr': False, 'sideways_use_adx': False, 'sideways_use_spike': True, 'sideways_rsi_required': False}.
[I 2025-08-31 12:31:07,455] Trial 301 finished with values: [-0.04003402170508563, 0.03984025761047551] and parameters: {'p_sma': 58, 'p_std': 56, 'p_atr': 14, 'p_adx': 19, 'rsi_period': 35, 'ema1': 6, 'ema2': 23, 'slip_atr_k': 0.026772254452666677, 'slip_spread_k': 0.6808857555064773, 'spread_hl_frac': 0.029487037920861808, 'bb_std_mult': 1.436487527494626, 'rsi_os': 13, 'rsi_ob': 75, 'vol_spike': 0.08625985180768175, 'adx_thresh': 22.463554157392426, 'atr_min_pct': 0.000635236837539068, 'atr_max_pct': 0.1367476769417581, 'tp_mult': 1.8933179342350468, 'tsl_mult': 0.01980415467994848, 'strategy': 'breakout', 'time_stop': 211, 'use_sma': False, 'use_atr': True, 'use_adx': False, 'use_ema': False, 'use_spike': False, 'rsi_required': True, 'edge_k': 0.7252940571239394, 'edge_cap': 0.6155954094568415, 'bull_strategy': 'breakout', 'bull_bb_std_mult': 2.108971871057643, 'bull_rsi_os': 10, 'bull_rsi_ob': 56, 'bull_adx_thresh': 8.537633975663988, 'bull_atr_min_pct': 0.004927000160367158, 'bull_atr_max_pct': 0.10506218223579934, 'bull_tp_mult': 1.9117890722378623, 'bull_tsl_mult': 0.25027349032286256, 'bull_time_stop': 96, 'bull_use_sma': True, 'bull_use_ema': True, 'bull_use_atr': True, 'bull_use_adx': True, 'bull_use_spike': False, 'bull_rsi_required': False, 'bear_strategy': 'breakout', 'bear_bb_std_mult': 1.2350553464580933, 'bear_rsi_os': 8, 'bear_rsi_ob': 70, 'bear_adx_thresh': 33.43810478174474, 'bear_atr_min_pct': 0.014365359427942969, 'bear_atr_max_pct': 0.09789282678475732, 'bear_tp_mult': 2.370440265031563, 'bear_tsl_mult': 0.18759903316077528, 'bear_time_stop': 110, 'bear_use_sma': True, 'bear_use_ema': True, 'bear_use_atr': True, 'bear_use_adx': True, 'bear_use_spike': True, 'bear_rsi_required': True, 'sideways_strategy': 'breakout', 'sideways_bb_std_mult': 0.6046950451619619, 'sideways_rsi_os': 33, 'sideways_rsi_ob': 82, 'sideways_adx_thresh': 11.391175327469186, 'sideways_atr_min_pct': 0.0017814068578196323, 'sideways_atr_max_pct': 0.11117203311482995, 'sideways_tp_mult': 1.4674395923688788, 'sideways_tsl_mult': 0.6508374193734383, 'sideways_time_stop': 140, 'sideways_use_sma': True, 'sideways_use_ema': False, 'sideways_use_atr': False, 'sideways_use_adx': False, 'sideways_use_spike': False, 'sideways_rsi_required': True}.
[I 2025-08-31 12:31:07,604] Trial 300 finished with values: [-0.022722854081145494, 0.022497481098014114] and parameters: {'p_sma': 56, 'p_std': 56, 'p_atr': 14, 'p_adx': 19, 'rsi_period': 64, 'ema1': 6, 'ema2': 27, 'slip_atr_k': 0.04498050418525275, 'slip_spread_k': 0.6488264283263488, 'spread_hl_frac': 0.029556070573455485, 'bb_std_mult': 2.06177828551734, 'rsi_os': 40, 'rsi_ob': 75, 'vol_spike': 0.08572290151312532, 'adx_thresh': 22.33677679865273, 'atr_min_pct': 0.0007350524190316339, 'atr_max_pct': 0.13627379421684865, 'tp_mult': 2.2879692870909576, 'tsl_mult': 0.019709615360663662, 'strategy': 'breakout', 'time_stop': 253, 'use_sma': False, 'use_atr': True, 'use_adx': False, 'use_ema': False, 'use_spike': False, 'rsi_required': True, 'edge_k': 0.719650961185994, 'edge_cap': 0.515205870230169, 'bull_strategy': 'breakout', 'bull_bb_std_mult': 2.6766865344569655, 'bull_rsi_os': 34, 'bull_rsi_ob': 77, 'bull_adx_thresh': 5.260522510950162, 'bull_atr_min_pct': 0.0016884636789375376, 'bull_atr_max_pct': 0.11207726891075852, 'bull_tp_mult': 2.6980095967469615, 'bull_tsl_mult': 0.2519463078228896, 'bull_time_stop': 141, 'bull_use_sma': True, 'bull_use_ema': True, 'bull_use_atr': True, 'bull_use_adx': True, 'bull_use_spike': False, 'bull_rsi_required': False, 'bear_strategy': 'breakout', 'bear_bb_std_mult': 2.268669271849949, 'bear_rsi_os': 8, 'bear_rsi_ob': 51, 'bear_adx_thresh': 33.43043078931884, 'bear_atr_min_pct': 0.014534373186455849, 'bear_atr_max_pct': 0.09686475272874086, 'bear_tp_mult': 2.3738444165183923, 'bear_tsl_mult': 0.1766772496231661, 'bear_time_stop': 234, 'bear_use_sma': True, 'bear_use_ema': True, 'bear_use_atr': True, 'bear_use_adx': True, 'bear_use_spike': True, 'bear_rsi_required': True, 'sideways_strategy': 'breakout', 'sideways_bb_std_mult': 3.512822187107819, 'sideways_rsi_os': 50, 'sideways_rsi_ob': 82, 'sideways_adx_thresh': 13.034342117512745, 'sideways_atr_min_pct': 0.012122790198135116, 'sideways_atr_max_pct': 0.09885892586715522, 'sideways_tp_mult': 1.0214492021070254, 'sideways_tsl_mult': 0.8092754697765383, 'sideways_time_stop': 34, 'sideways_use_sma': True, 'sideways_use_ema': False, 'sideways_use_atr': False, 'sideways_use_adx': False, 'sideways_use_spike': False, 'sideways_rsi_required': True}.
[I 2025-08-31 12:31:07,749] Trial 302 finished with values: [-1000000000.0, 1000000000.0] and parameters: {'p_sma': 46, 'p_std': 27, 'p_atr': 29, 'p_adx': 19, 'rsi_period': 79, 'ema1': 25, 'ema2': 26, 'slip_atr_k': 0.045356759707013666, 'slip_spread_k': 0.6807064551185673, 'spread_hl_frac': 0.028079522021855815, 'bb_std_mult': 2.6998873874019624, 'rsi_os': 33, 'rsi_ob': 75, 'vol_spike': 0.0807088217128728, 'adx_thresh': 20.978339650955306, 'atr_min_pct': 0.0008168283820989069, 'atr_max_pct': 0.13058173458113448, 'tp_mult': 1.5002890961590736, 'tsl_mult': 0.2988599956163814, 'strategy': 'breakout', 'time_stop': 5, 'use_sma': False, 'use_atr': True, 'use_adx': False, 'use_ema': False, 'use_spike': False, 'rsi_required': True, 'edge_k': 0.6788056522697309, 'edge_cap': 0.7655055779500909, 'bull_strategy': 'breakout', 'bull_bb_std_mult': 2.9377361935356743, 'bull_rsi_os': 10, 'bull_rsi_ob': 78, 'bull_adx_thresh': 11.441517956667372, 'bull_atr_min_pct': 0.00779433318812911, 'bull_atr_max_pct': 0.11666482879367712, 'bull_tp_mult': 2.2755600475577493, 'bull_tsl_mult': 0.8328241855736044, 'bull_time_stop': 77, 'bull_use_sma': True, 'bull_use_ema': True, 'bull_use_atr': False, 'bull_use_adx': True, 'bull_use_spike': False, 'bull_rsi_required': False, 'bear_strategy': 'breakout', 'bear_bb_std_mult': 2.711351619017374, 'bear_rsi_os': 34, 'bear_rsi_ob': 88, 'bear_adx_thresh': 17.48802107377137, 'bear_atr_min_pct': 0.025936848635120878, 'bear_atr_max_pct': 0.09749788457672247, 'bear_tp_mult': 2.771948942478726, 'bear_tsl_mult': 0.18401332928999797, 'bear_time_stop': 51, 'bear_use_sma': True, 'bear_use_ema': True, 'bear_use_atr': True, 'bear_use_adx': True, 'bear_use_spike': True, 'bear_rsi_required': True, 'sideways_strategy': 'breakout', 'sideways_bb_std_mult': 0.5899704426489143, 'sideways_rsi_os': 35, 'sideways_rsi_ob': 82, 'sideways_adx_thresh': 11.549440038599746, 'sideways_atr_min_pct': 0.011583767578485171, 'sideways_atr_max_pct': 0.11674426878275405, 'sideways_tp_mult': 2.730420050200774, 'sideways_tsl_mult': 0.6320319802150024, 'sideways_time_stop': 209, 'sideways_use_sma': True, 'sideways_use_ema': False, 'sideways_use_atr': False, 'sideways_use_adx': False, 'sideways_use_spike': False, 'sideways_rsi_required': True}.
[I 2025-08-31 12:31:39,490] Trial 303 finished with values: [-1000000000.0, 1000000000.0] and parameters: {'p_sma': 39, 'p_std': 34, 'p_atr': 14, 'p_adx': 19, 'rsi_period': 80, 'ema1': 6, 'ema2': 26, 'slip_atr_k': 0.04633926393583277, 'slip_spread_k': 0.6773821483001807, 'spread_hl_frac': 0.01679576236828375, 'bb_std_mult': 1.8903183794932845, 'rsi_os': 40, 'rsi_ob': 74, 'vol_spike': 0.08489115313290904, 'adx_thresh': 21.183538484812576, 'atr_min_pct': 0.0007901819079758967, 'atr_max_pct': 0.1305301695780788, 'tp_mult': 2.5572836514346897, 'tsl_mult': 0.0222319567934831, 'strategy': 'breakout', 'time_stop': 211, 'use_sma': False, 'use_atr': True, 'use_adx': False, 'use_ema': False, 'use_spike': False, 'rsi_required': True, 'edge_k': 0.6942186510431213, 'edge_cap': 0.7666805903007251, 'bull_strategy': 'breakout', 'bull_bb_std_mult': 2.1025072532178095, 'bull_rsi_os': 10, 'bull_rsi_ob': 50, 'bull_adx_thresh': 15.025662004412835, 'bull_atr_min_pct': 0.005106862434595672, 'bull_atr_max_pct': 0.11091088958239928, 'bull_tp_mult': 2.723443613111343, 'bull_tsl_mult': 0.25553226838131127, 'bull_time_stop': 206, 'bull_use_sma': True, 'bull_use_ema': True, 'bull_use_atr': False, 'bull_use_adx': True, 'bull_use_spike': False, 'bull_rsi_required': False, 'bear_strategy': 'breakout', 'bear_bb_std_mult': 3.4247546549264927, 'bear_rsi_os': 7, 'bear_rsi_ob': 73, 'bear_adx_thresh': 17.603688478346662, 'bear_atr_min_pct': 0.023280546393720104, 'bear_atr_max_pct': 0.09857973350450444, 'bear_tp_mult': 2.396839341687178, 'bear_tsl_mult': 0.17953748311046527, 'bear_time_stop': 229, 'bear_use_sma': True, 'bear_use_ema': True, 'bear_use_atr': True, 'bear_use_adx': True, 'bear_use_spike': True, 'bear_rsi_required': True, 'sideways_strategy': 'breakout', 'sideways_bb_std_mult': 3.3501759293433504, 'sideways_rsi_os': 21, 'sideways_rsi_ob': 82, 'sideways_adx_thresh': 11.489427187732712, 'sideways_atr_min_pct': 0.011382792245381721, 'sideways_atr_max_pct': 0.11108474900717147, 'sideways_tp_mult': 2.71761903746911, 'sideways_tsl_mult': 0.6362698707955442, 'sideways_time_stop': 212, 'sideways_use_sma': True, 'sideways_use_ema': False, 'sideways_use_atr': False, 'sideways_use_adx': False, 'sideways_use_spike': False, 'sideways_rsi_required': True}.
[I 2025-08-31 12:31:41,342] Trial 305 finished with values: [-1000000000.0, 1000000000.0] and parameters: {'p_sma': 52, 'p_std': 27, 'p_atr': 27, 'p_adx': 19, 'rsi_period': 79, 'ema1': 5, 'ema2': 26, 'slip_atr_k': 0.025641667041838897, 'slip_spread_k': 0.6807060427821545, 'spread_hl_frac': 0.029767771923238068, 'bb_std_mult': 1.8048393582924438, 'rsi_os': 13, 'rsi_ob': 75, 'vol_spike': 0.08111511311934531, 'adx_thresh': 29.589117996619848, 'atr_min_pct': 0.0006338195524181042, 'atr_max_pct': 0.1305726680026225, 'tp_mult': 2.5436825833949377, 'tsl_mult': 0.01722192772354103, 'strategy': 'breakout', 'time_stop': 209, 'use_sma': False, 'use_atr': True, 'use_adx': False, 'use_ema': True, 'use_spike': False, 'rsi_required': True, 'edge_k': 0.6903215272150284, 'edge_cap': 0.41350447415719294, 'bull_strategy': 'breakout', 'bull_bb_std_mult': 2.115190927765006, 'bull_rsi_os': 8, 'bull_rsi_ob': 78, 'bull_adx_thresh': 8.430176345328025, 'bull_atr_min_pct': 0.020763976993873376, 'bull_atr_max_pct': 0.0863442574846424, 'bull_tp_mult': 1.9391016687732157, 'bull_tsl_mult': 0.6233828063082542, 'bull_time_stop': 97, 'bull_use_sma': True, 'bull_use_ema': True, 'bull_use_atr': False, 'bull_use_adx': True, 'bull_use_spike': False, 'bull_rsi_required': False, 'bear_strategy': 'breakout', 'bear_bb_std_mult': 3.5928807746908786, 'bear_rsi_os': 34, 'bear_rsi_ob': 70, 'bear_adx_thresh': 21.0865781442077, 'bear_atr_min_pct': 0.023851296120863057, 'bear_atr_max_pct': 0.09737252256179933, 'bear_tp_mult': 2.7669432070463817, 'bear_tsl_mult': 0.0980277435401399, 'bear_time_stop': 110, 'bear_use_sma': True, 'bear_use_ema': True, 'bear_use_atr': True, 'bear_use_adx': True, 'bear_use_spike': True, 'bear_rsi_required': True, 'sideways_strategy': 'breakout', 'sideways_bb_std_mult': 3.547308746464996, 'sideways_rsi_os': 21, 'sideways_rsi_ob': 82, 'sideways_adx_thresh': 11.444980273866284, 'sideways_atr_min_pct': 0.0015390378350743845, 'sideways_atr_max_pct': 0.11607349079265365, 'sideways_tp_mult': 1.4639631350480384, 'sideways_tsl_mult': 0.6258960171083615, 'sideways_time_stop': 210, 'sideways_use_sma': True, 'sideways_use_ema': False, 'sideways_use_atr': False, 'sideways_use_adx': False, 'sideways_use_spike': False, 'sideways_rsi_required': True}.
[I 2025-08-31 12:31:41,367] Trial 306 finished with values: [-1000000000.0, 1000000000.0] and parameters: {'p_sma': 51, 'p_std': 26, 'p_atr': 27, 'p_adx': 11, 'rsi_period': 81, 'ema1': 5, 'ema2': 23, 'slip_atr_k': 0.02888769333712215, 'slip_spread_k': 0.3413901058881777, 'spread_hl_frac': 0.030460871270077676, 'bb_std_mult': 1.9339977959274264, 'rsi_os': 40, 'rsi_ob': 76, 'vol_spike': 0.08677632296962667, 'adx_thresh': 29.592109489572017, 'atr_min_pct': 0.0022240917019320716, 'atr_max_pct': 0.13658088461929835, 'tp_mult': 2.544667682469488, 'tsl_mult': 0.830516351467587, 'strategy': 'breakout', 'time_stop': 284, 'use_sma': False, 'use_atr': True, 'use_adx': False, 'use_ema': True, 'use_spike': False, 'rsi_required': True, 'edge_k': 0.7228431952954725, 'edge_cap': 0.11585301362013661, 'bull_strategy': 'breakout', 'bull_bb_std_mult': 2.86622956888179, 'bull_rsi_os': 8, 'bull_rsi_ob': 82, 'bull_adx_thresh': 32.22131072651196, 'bull_atr_min_pct': 0.021088514542246597, 'bull_atr_max_pct': 0.10423672777344448, 'bull_tp_mult': 1.7013912670710192, 'bull_tsl_mult': 0.2824943195158947, 'bull_time_stop': 100, 'bull_use_sma': True, 'bull_use_ema': True, 'bull_use_atr': False, 'bull_use_adx': True, 'bull_use_spike': False, 'bull_rsi_required': False, 'bear_strategy': 'breakout', 'bear_bb_std_mult': 3.4304365407422086, 'bear_rsi_os': 7, 'bear_rsi_ob': 70, 'bear_adx_thresh': 32.67004290410068, 'bear_atr_min_pct': 0.023552943664389828, 'bear_atr_max_pct': 0.09776847215860224, 'bear_tp_mult': 2.8389522785992467, 'bear_tsl_mult': 0.10248101201347948, 'bear_time_stop': 237, 'bear_use_sma': True, 'bear_use_ema': True, 'bear_use_atr': True, 'bear_use_adx': True, 'bear_use_spike': True, 'bear_rsi_required': True, 'sideways_strategy': 'breakout', 'sideways_bb_std_mult': 3.5337389863495168, 'sideways_rsi_os': 33, 'sideways_rsi_ob': 82, 'sideways_adx_thresh': 11.597820007724795, 'sideways_atr_min_pct': 1.8672617267638547e-05, 'sideways_atr_max_pct': 0.11056243182156386, 'sideways_tp_mult': 1.4627996203453026, 'sideways_tsl_mult': 0.08568717632844847, 'sideways_time_stop': 200, 'sideways_use_sma': True, 'sideways_use_ema': False, 'sideways_use_atr': False, 'sideways_use_adx': False, 'sideways_use_spike': False, 'sideways_rsi_required': True}.
