[I 2025-08-31 13:40:42,219] Trial 810 finished with values: [-0.12750726973451254, 0.12691222442076772] and parameters: {'p_sma': 12, 'p_std': 17, 'p_atr': 17, 'p_adx': 14, 'rsi_period': 82, 'ema1': 30, 'ema2': 46, 'slip_atr_k': 0.1057531129644833, 'slip_spread_k': 0.40290496950869337, 'spread_hl_frac': 0.012935006405060255, 'bb_std_mult': 2.2856654446771656, 'rsi_os': 39, 'rsi_ob': 84, 'vol_spike': 0.02432472677495969, 'adx_thresh': 6.427942690174606, 'atr_min_pct': 0.025297506445405845, 'atr_max_pct': 0.04937858857602423, 'tp_mult': 2.4616670734504718, 'tsl_mult': 0.6479038316530402, 'strategy': 'breakout', 'time_stop': 181, 'use_sma': False, 'use_atr': False, 'use_adx': True, 'use_ema': True, 'use_spike': True, 'rsi_required': False, 'edge_k': 0.5021015281050154, 'edge_cap': 0.708278259598815, 'bull_strategy': 'mean_reversion', 'bull_bb_std_mult': 0.8569399002459737, 'bull_rsi_os': 8, 'bull_rsi_ob': 87, 'bull_adx_thresh': 31.800559492858223, 'bull_atr_min_pct': 0.021663899172312776, 'bull_atr_max_pct': 0.043151496556419935, 'bull_tp_mult': 2.243994747813251, 'bull_tsl_mult': 0.26416876694083374, 'bull_time_stop': 65, 'bull_use_sma': True, 'bull_use_ema': True, 'bull_use_atr': True, 'bull_use_adx': False, 'bull_use_spike': True, 'bull_rsi_required': True, 'bear_strategy': 'breakout', 'bear_bb_std_mult': 0.7067038599052253, 'bear_rsi_os': 54, 'bear_rsi_ob': 70, 'bear_adx_thresh': 29.800256885135262, 'bear_atr_min_pct': 0.0005827861702530419, 'bear_atr_max_pct': 0.13209600051536174, 'bear_tp_mult': 1.0656726266002967, 'bear_tsl_mult': 0.714058791406977, 'bear_time_stop': 194, 'bear_use_sma': False, 'bear_use_ema': True, 'bear_use_atr': False, 'bear_use_adx': False, 'bear_use_spike': True, 'bear_rsi_required': True, 'sideways_strategy': 'breakout', 'sideways_bb_std_mult': 2.6056946888865498, 'sideways_rsi_os': 32, 'sideways_rsi_ob': 66, 'sideways_adx_thresh': 25.001181246411402, 'sideways_atr_min_pct': 0.00741400679609431, 'sideways_atr_max_pct': 0.07981558630851232, 'sideways_tp_mult': 2.666055029574533, 'sideways_tsl_mult': 0.8595765638481123, 'sideways_time_stop': 239, 'sideways_use_sma': False, 'sideways_use_ema': False, 'sideways_use_atr': True, 'sideways_use_adx': True, 'sideways_use_spike': False, 'sideways_rsi_required': True}.
[I 2025-08-31 13:40:42,229] Trial 811 finished with values: [-0.1436634815817346, 0.1431053823935362] and parameters: {'p_sma': 47, 'p_std': 20, 'p_atr': 17, 'p_adx': 29, 'rsi_period': 47, 'ema1': 13, 'ema2': 28, 'slip_atr_k': 0.05173814928854335, 'slip_spread_k': 0.40138813174468907, 'spread_hl_frac': 0.02242855092953617, 'bb_std_mult': 1.9308017542229692, 'rsi_os': 38, 'rsi_ob': 67, 'vol_spike': 0.2248907818801733, 'adx_thresh': 6.405208182509326, 'atr_min_pct': 0.02694603669394793, 'atr_max_pct': 0.04957586643361304, 'tp_mult': 2.5003709224584654, 'tsl_mult': 0.53723063765844, 'strategy': 'breakout', 'time_stop': 285, 'use_sma': False, 'use_atr': False, 'use_adx': True, 'use_ema': True, 'use_spike': True, 'rsi_required': False, 'edge_k': 0.5085577833247231, 'edge_cap': 0.7078299312811721, 'bull_strategy': 'mean_reversion', 'bull_bb_std_mult': 2.42177610577173, 'bull_rsi_os': 8, 'bull_rsi_ob': 62, 'bull_adx_thresh': 30.532550007788586, 'bull_atr_min_pct': 0.021468957827678697, 'bull_atr_max_pct': 0.1400059770843408, 'bull_tp_mult': 2.2458710108626057, 'bull_tsl_mult': 0.27821801099202037, 'bull_time_stop': 149, 'bull_use_sma': True, 'bull_use_ema': True, 'bull_use_atr': True, 'bull_use_adx': False, 'bull_use_spike': True, 'bull_rsi_required': True, 'bear_strategy': 'breakout', 'bear_bb_std_mult': 3.4434414257267307, 'bear_rsi_os': 54, 'bear_rsi_ob': 70, 'bear_adx_thresh': 21.71204710757164, 'bear_atr_min_pct': 0.0006317076589434155, 'bear_atr_max_pct': 0.13121716837637942, 'bear_tp_mult': 1.050959295863985, 'bear_tsl_mult': 0.6653897284172084, 'bear_time_stop': 159, 'bear_use_sma': False, 'bear_use_ema': True, 'bear_use_atr': False, 'bear_use_adx': False, 'bear_use_spike': True, 'bear_rsi_required': True, 'sideways_strategy': 'breakout', 'sideways_bb_std_mult': 1.3739226958161725, 'sideways_rsi_os': 28, 'sideways_rsi_ob': 88, 'sideways_adx_thresh': 14.681392557113, 'sideways_atr_min_pct': 0.005713735122230848, 'sideways_atr_max_pct': 0.10921225461922698, 'sideways_tp_mult': 2.65482973068182, 'sideways_tsl_mult': 0.8587263829808065, 'sideways_time_stop': 50, 'sideways_use_sma': False, 'sideways_use_ema': False, 'sideways_use_atr': True, 'sideways_use_adx': True, 'sideways_use_spike': False, 'sideways_rsi_required': True}.
[I 2025-08-31 13:40:42,517] Trial 809 finished with values: [-0.10592444855159466, 0.10534302172435357] and parameters: {'p_sma': 47, 'p_std': 41, 'p_atr': 16, 'p_adx': 29, 'rsi_period': 7, 'ema1': 6, 'ema2': 34, 'slip_atr_k': 0.050467386819971816, 'slip_spread_k': 0.3718387793560264, 'spread_hl_frac': 0.017298317496819274, 'bb_std_mult': 2.2996153523701626, 'rsi_os': 44, 'rsi_ob': 47, 'vol_spike': 0.026567229677700407, 'adx_thresh': 6.238735167616381, 'atr_min_pct': 0.007783352923593776, 'atr_max_pct': 0.05115751495752809, 'tp_mult': 2.593815090556626, 'tsl_mult': 0.7208709507603563, 'strategy': 'breakout', 'time_stop': 286, 'use_sma': False, 'use_atr': False, 'use_adx': True, 'use_ema': False, 'use_spike': True, 'rsi_required': False, 'edge_k': 1.453934450749647, 'edge_cap': 0.5999974358625054, 'bull_strategy': 'mean_reversion', 'bull_bb_std_mult': 2.8041123333326126, 'bull_rsi_os': 5, 'bull_rsi_ob': 88, 'bull_adx_thresh': 18.86484830520403, 'bull_atr_min_pct': 0.009242718363347145, 'bull_atr_max_pct': 0.13710844274150585, 'bull_tp_mult': 2.153313887775362, 'bull_tsl_mult': 0.8382306455473689, 'bull_time_stop': 148, 'bull_use_sma': True, 'bull_use_ema': True, 'bull_use_atr': True, 'bull_use_adx': False, 'bull_use_spike': True, 'bull_rsi_required': True, 'bear_strategy': 'breakout', 'bear_bb_std_mult': 3.4643843981937548, 'bear_rsi_os': 50, 'bear_rsi_ob': 61, 'bear_adx_thresh': 23.415284809077658, 'bear_atr_min_pct': 0.0011938924332636016, 'bear_atr_max_pct': 0.08549786078539919, 'bear_tp_mult': 1.2296677638938562, 'bear_tsl_mult': 0.7134799395256012, 'bear_time_stop': 191, 'bear_use_sma': False, 'bear_use_ema': True, 'bear_use_atr': False, 'bear_use_adx': False, 'bear_use_spike': True, 'bear_rsi_required': True, 'sideways_strategy': 'mean_reversion', 'sideways_bb_std_mult': 1.4963579333767645, 'sideways_rsi_os': 32, 'sideways_rsi_ob': 66, 'sideways_adx_thresh': 25.55868021976987, 'sideways_atr_min_pct': 0.02644813801737503, 'sideways_atr_max_pct': 0.14499954898153747, 'sideways_tp_mult': 1.8512586645417801, 'sideways_tsl_mult': 0.23019209081119657, 'sideways_time_stop': 239, 'sideways_use_sma': False, 'sideways_use_ema': True, 'sideways_use_atr': True, 'sideways_use_adx': True, 'sideways_use_spike': False, 'sideways_rsi_required': True}.
[I 2025-08-31 13:41:16,889] Trial 814 finished with values: [-0.047208040173378096, 0.04641711484948712] and parameters: {'p_sma': 29, 'p_std': 46, 'p_atr': 10, 'p_adx': 13, 'rsi_period': 24, 'ema1': 11, 'ema2': 19, 'slip_atr_k': 0.20627539296791164, 'slip_spread_k': 0.37393068328384893, 'spread_hl_frac': 0.019695486247026852, 'bb_std_mult': 2.415051406288056, 'rsi_os': 48, 'rsi_ob': 91, 'vol_spike': 0.018738336148444373, 'adx_thresh': 7.062934622927731, 'atr_min_pct': 0.005190551510925923, 'atr_max_pct': 0.03640487185339632, 'tp_mult': 2.5587599828464747, 'tsl_mult': 0.9991433782074808, 'strategy': 'breakout', 'time_stop': 187, 'use_sma': False, 'use_atr': False, 'use_adx': True, 'use_ema': True, 'use_spike': True, 'rsi_required': False, 'edge_k': 0.41896670590407414, 'edge_cap': 0.6270807829151706, 'bull_strategy': 'mean_reversion', 'bull_bb_std_mult': 3.0284300162127527, 'bull_rsi_os': 5, 'bull_rsi_ob': 83, 'bull_adx_thresh': 18.40455578513398, 'bull_atr_min_pct': 0.020538767411676626, 'bull_atr_max_pct': 0.06577354008013331, 'bull_tp_mult': 2.330366705126515, 'bull_tsl_mult': 0.5019284850642368, 'bull_time_stop': 175, 'bull_use_sma': True, 'bull_use_ema': True, 'bull_use_atr': True, 'bull_use_adx': True, 'bull_use_spike': True, 'bull_rsi_required': True, 'bear_strategy': 'breakout', 'bear_bb_std_mult': 2.0431651244161473, 'bear_rsi_os': 27, 'bear_rsi_ob': 61, 'bear_adx_thresh': 20.54441573592285, 'bear_atr_min_pct': 0.0020024564622658585, 'bear_atr_max_pct': 0.12725726161560802, 'bear_tp_mult': 1.1542959444178504, 'bear_tsl_mult': 0.6932227015507993, 'bear_time_stop': 197, 'bear_use_sma': False, 'bear_use_ema': False, 'bear_use_atr': False, 'bear_use_adx': False, 'bear_use_spike': True, 'bear_rsi_required': False, 'sideways_strategy': 'breakout', 'sideways_bb_std_mult': 1.7513937955477705, 'sideways_rsi_os': 50, 'sideways_rsi_ob': 69, 'sideways_adx_thresh': 31.799692890369982, 'sideways_atr_min_pct': 0.028530444123200306, 'sideways_atr_max_pct': 0.1456478597666042, 'sideways_tp_mult': 2.8904591750851725, 'sideways_tsl_mult': 0.9085507194887793, 'sideways_time_stop': 61, 'sideways_use_sma': False, 'sideways_use_ema': False, 'sideways_use_atr': True, 'sideways_use_adx': True, 'sideways_use_spike': False, 'sideways_rsi_required': True}.
[I 2025-08-31 13:41:17,152] Trial 816 finished with values: [-1000000000.0, 1000000000.0] and parameters: {'p_sma': 28, 'p_std': 23, 'p_atr': 26, 'p_adx': 13, 'rsi_period': 44, 'ema1': 10, 'ema2': 19, 'slip_atr_k': 0.02560750384178491, 'slip_spread_k': 0.4212271048584853, 'spread_hl_frac': 0.03488565203893204, 'bb_std_mult': 2.421117350718066, 'rsi_os': 40, 'rsi_ob': 52, 'vol_spike': 0.018511859093753216, 'adx_thresh': 31.360838629025608, 'atr_min_pct': 0.005591580912145018, 'atr_max_pct': 0.06449167883598614, 'tp_mult': 2.987936620907847, 'tsl_mult': 0.9445515115695431, 'strategy': 'breakout', 'time_stop': 180, 'use_sma': True, 'use_atr': False, 'use_adx': True, 'use_ema': True, 'use_spike': True, 'rsi_required': False, 'edge_k': 0.6481412925557083, 'edge_cap': 0.6299252790433774, 'bull_strategy': 'mean_reversion', 'bull_bb_std_mult': 2.7777836725349667, 'bull_rsi_os': 5, 'bull_rsi_ob': 83, 'bull_adx_thresh': 16.96519886750205, 'bull_atr_min_pct': 0.020577846361178577, 'bull_atr_max_pct': 0.14028654973994248, 'bull_tp_mult': 2.313741104967935, 'bull_tsl_mult': 0.4925504841827102, 'bull_time_stop': 135, 'bull_use_sma': True, 'bull_use_ema': True, 'bull_use_atr': True, 'bull_use_adx': True, 'bull_use_spike': True, 'bull_rsi_required': True, 'bear_strategy': 'breakout', 'bear_bb_std_mult': 1.7014166918839235, 'bear_rsi_os': 17, 'bear_rsi_ob': 53, 'bear_adx_thresh': 15.559812498440971, 'bear_atr_min_pct': 0.007776327059812624, 'bear_atr_max_pct': 0.12762812454692712, 'bear_tp_mult': 2.2341595374907857, 'bear_tsl_mult': 0.6813979616629872, 'bear_time_stop': 198, 'bear_use_sma': False, 'bear_use_ema': False, 'bear_use_atr': False, 'bear_use_adx': False, 'bear_use_spike': True, 'bear_rsi_required': False, 'sideways_strategy': 'breakout', 'sideways_bb_std_mult': 2.7198240237494073, 'sideways_rsi_os': 16, 'sideways_rsi_ob': 63, 'sideways_adx_thresh': 30.92622258822772, 'sideways_atr_min_pct': 0.003434127800766961, 'sideways_atr_max_pct': 0.14723991724492802, 'sideways_tp_mult': 1.6791192614854278, 'sideways_tsl_mult': 0.9092757906737804, 'sideways_time_stop': 65, 'sideways_use_sma': False, 'sideways_use_ema': False, 'sideways_use_atr': True, 'sideways_use_adx': True, 'sideways_use_spike': False, 'sideways_rsi_required': True}.
[I 2025-08-31 13:41:17,261] Trial 813 finished with values: [-1000000000.0, 1000000000.0] and parameters: {'p_sma': 17, 'p_std': 23, 'p_atr': 9, 'p_adx': 13, 'rsi_period': 50, 'ema1': 26, 'ema2': 19, 'slip_atr_k': 0.026107326935843514, 'slip_spread_k': 0.37115612492593003, 'spread_hl_frac': 0.008534767259049465, 'bb_std_mult': 2.15517950325405, 'rsi_os': 52, 'rsi_ob': 91, 'vol_spike': 0.017095148594476334, 'adx_thresh': 29.086885232817977, 'atr_min_pct': 0.00562488246574154, 'atr_max_pct': 0.06565645385352088, 'tp_mult': 2.6023051861461437, 'tsl_mult': 0.8036193098463597, 'strategy': 'breakout', 'time_stop': 189, 'use_sma': False, 'use_atr': False, 'use_adx': True, 'use_ema': True, 'use_spike': True, 'rsi_required': False, 'edge_k': 1.4554819113663133, 'edge_cap': 0.5928730630348417, 'bull_strategy': 'mean_reversion', 'bull_bb_std_mult': 2.781138345571347, 'bull_rsi_os': 5, 'bull_rsi_ob': 83, 'bull_adx_thresh': 16.238221358027076, 'bull_atr_min_pct': 0.021056235288307575, 'bull_atr_max_pct': 0.06586997679270774, 'bull_tp_mult': 2.3156193124810467, 'bull_tsl_mult': 0.7160155944601481, 'bull_time_stop': 135, 'bull_use_sma': True, 'bull_use_ema': True, 'bull_use_atr': True, 'bull_use_adx': True, 'bull_use_spike': True, 'bull_rsi_required': True, 'bear_strategy': 'breakout', 'bear_bb_std_mult': 1.8944098525514947, 'bear_rsi_os': 27, 'bear_rsi_ob': 90, 'bear_adx_thresh': 15.764795655027722, 'bear_atr_min_pct': 0.0018871358046249633, 'bear_atr_max_pct': 0.12704407310069865, 'bear_tp_mult': 2.2167374092388847, 'bear_tsl_mult': 0.6907039612923631, 'bear_time_stop': 214, 'bear_use_sma': False, 'bear_use_ema': False, 'bear_use_atr': False, 'bear_use_adx': False, 'bear_use_spike': True, 'bear_rsi_required': False, 'sideways_strategy': 'breakout', 'sideways_bb_std_mult': 2.385148976853436, 'sideways_rsi_os': 14, 'sideways_rsi_ob': 60, 'sideways_adx_thresh': 23.87602067927295, 'sideways_atr_min_pct': 0.02841768510202579, 'sideways_atr_max_pct': 0.14505348078265584, 'sideways_tp_mult': 1.6847876343658506, 'sideways_tsl_mult': 0.9092077383271734, 'sideways_time_stop': 63, 'sideways_use_sma': False, 'sideways_use_ema': False, 'sideways_use_atr': True, 'sideways_use_adx': True, 'sideways_use_spike': False, 'sideways_rsi_required': True}.
[I 2025-08-31 13:41:17,376] Trial 815 finished with values: [-1000000000.0, 1000000000.0] and parameters: {'p_sma': 33, 'p_std': 23, 'p_atr': 19, 'p_adx': 13, 'rsi_period': 44, 'ema1': 26, 'ema2': 25, 'slip_atr_k': 0.2056337319132899, 'slip_spread_k': 0.3814972402857669, 'spread_hl_frac': 0.021240364066019715, 'bb_std_mult': 3.103163683852374, 'rsi_os': 40, 'rsi_ob': 63, 'vol_spike': 0.01920490540623504, 'adx_thresh': 13.334231104992456, 'atr_min_pct': 0.02953372331843589, 'atr_max_pct': 0.06466990494337814, 'tp_mult': 1.4396295646454673, 'tsl_mult': 0.9491229950560467, 'strategy': 'breakout', 'time_stop': 180, 'use_sma': False, 'use_atr': False, 'use_adx': True, 'use_ema': True, 'use_spike': True, 'rsi_required': False, 'edge_k': 1.3652150096585265, 'edge_cap': 0.6362644871965747, 'bull_strategy': 'mean_reversion', 'bull_bb_std_mult': 2.780693937471682, 'bull_rsi_os': 5, 'bull_rsi_ob': 83, 'bull_adx_thresh': 18.918765475459782, 'bull_atr_min_pct': 0.029244944774228558, 'bull_atr_max_pct': 0.05196543501453753, 'bull_tp_mult': 2.3047246856313, 'bull_tsl_mult': 0.044247458437007614, 'bull_time_stop': 176, 'bull_use_sma': True, 'bull_use_ema': True, 'bull_use_atr': True, 'bull_use_adx': True, 'bull_use_spike': True, 'bull_rsi_required': True, 'bear_strategy': 'breakout', 'bear_bb_std_mult': 2.0411083570218835, 'bear_rsi_os': 5, 'bear_rsi_ob': 90, 'bear_adx_thresh': 15.586568888570003, 'bear_atr_min_pct': 0.0017178656074887141, 'bear_atr_max_pct': 0.1276648007385283, 'bear_tp_mult': 1.1357707399868309, 'bear_tsl_mult': 0.6855086597474621, 'bear_time_stop': 197, 'bear_use_sma': False, 'bear_use_ema': False, 'bear_use_atr': False, 'bear_use_adx': False, 'bear_use_spike': True, 'bear_rsi_required': False, 'sideways_strategy': 'breakout', 'sideways_bb_std_mult': 1.8573055375606977, 'sideways_rsi_os': 28, 'sideways_rsi_ob': 63, 'sideways_adx_thresh': 31.739551804358047, 'sideways_atr_min_pct': 0.014687435162839919, 'sideways_atr_max_pct': 0.14683677010663845, 'sideways_tp_mult': 1.6767336086559161, 'sideways_tsl_mult': 0.90857676962419, 'sideways_time_stop': 64, 'sideways_use_sma': False, 'sideways_use_ema': False, 'sideways_use_atr': True, 'sideways_use_adx': True, 'sideways_use_spike': False, 'sideways_rsi_required': True}.
[I 2025-08-31 13:41:49,507] Trial 820 finished with values: [-0.10125102531616026, 0.1011224102591731] and parameters: {'p_sma': 22, 'p_std': 11, 'p_atr': 14, 'p_adx': 14, 'rsi_period': 50, 'ema1': 17, 'ema2': 17, 'slip_atr_k': 0.15018966574321344, 'slip_spread_k': 0.45382071193206236, 'spread_hl_frac': 0.015160695673577381, 'bb_std_mult': 1.48085989648911, 'rsi_os': 38, 'rsi_ob': 83, 'vol_spike': 0.008305001601938845, 'adx_thresh': 10.020924064814666, 'atr_min_pct': 0.024693113205901562, 'atr_max_pct': 0.14283620473695147, 'tp_mult': 2.552824448207774, 'tsl_mult': 0.4480826046498154, 'strategy': 'mean_reversion', 'time_stop': 163, 'use_sma': True, 'use_atr': False, 'use_adx': True, 'use_ema': True, 'use_spike': True, 'rsi_required': False, 'edge_k': 0.4607858804613035, 'edge_cap': 0.6719429883471821, 'bull_strategy': 'mean_reversion', 'bull_bb_std_mult': 0.5196808929224692, 'bull_rsi_os': 42, 'bull_rsi_ob': 87, 'bull_adx_thresh': 26.309704343507025, 'bull_atr_min_pct': 0.0008324428684614374, 'bull_atr_max_pct': 0.14377936392199467, 'bull_tp_mult': 2.3877118218463793, 'bull_tsl_mult': 0.2299849836380905, 'bull_time_stop': 197, 'bull_use_sma': True, 'bull_use_ema': False, 'bull_use_atr': True, 'bull_use_adx': True, 'bull_use_spike': True, 'bull_rsi_required': True, 'bear_strategy': 'breakout', 'bear_bb_std_mult': 3.5499333070444288, 'bear_rsi_os': 28, 'bear_rsi_ob': 72, 'bear_adx_thresh': 17.28429572747253, 'bear_atr_min_pct': 0.016524347727816288, 'bear_atr_max_pct': 0.07746034309701358, 'bear_tp_mult': 2.3552796826969216, 'bear_tsl_mult': 0.39390911116231253, 'bear_time_stop': 180, 'bear_use_sma': False, 'bear_use_ema': True, 'bear_use_atr': False, 'bear_use_adx': False, 'bear_use_spike': True, 'bear_rsi_required': True, 'sideways_strategy': 'breakout', 'sideways_bb_std_mult': 1.0221371196000202, 'sideways_rsi_os': 29, 'sideways_rsi_ob': 92, 'sideways_adx_thresh': 24.34558196782293, 'sideways_atr_min_pct': 0.002162000043118012, 'sideways_atr_max_pct': 0.0579780986959678, 'sideways_tp_mult': 1.743665767422372, 'sideways_tsl_mult': 0.4783642008103787, 'sideways_time_stop': 43, 'sideways_use_sma': False, 'sideways_use_ema': False, 'sideways_use_atr': True, 'sideways_use_adx': True, 'sideways_use_spike': False, 'sideways_rsi_required': False}.
[I 2025-08-31 13:41:49,531] Trial 817 finished with values: [-0.07670473681409662, 0.07636263287132705] and parameters: {'p_sma': 33, 'p_std': 23, 'p_atr': 7, 'p_adx': 8, 'rsi_period': 21, 'ema1': 18, 'ema2': 20, 'slip_atr_k': 0.16794115526762177, 'slip_spread_k': 0.3356921576064568, 'spread_hl_frac': 0.004908714814352625, 'bb_std_mult': 0.7122163416830929, 'rsi_os': 40, 'rsi_ob': 87, 'vol_spike': 0.017763911779627942, 'adx_thresh': 7.468350937530193, 'atr_min_pct': 0.02963788241926043, 'atr_max_pct': 0.055560196031584526, 'tp_mult': 1.4378542926601812, 'tsl_mult': 0.9350539451598258, 'strategy': 'breakout', 'time_stop': 181, 'use_sma': True, 'use_atr': False, 'use_adx': True, 'use_ema': True, 'use_spike': True, 'rsi_required': False, 'edge_k': 1.1997676064763751, 'edge_cap': 0.6658329369155728, 'bull_strategy': 'mean_reversion', 'bull_bb_std_mult': 2.0621542751055553, 'bull_rsi_os': 50, 'bull_rsi_ob': 86, 'bull_adx_thresh': 16.42430962556237, 'bull_atr_min_pct': 0.022512158642491713, 'bull_atr_max_pct': 0.14065091412237396, 'bull_tp_mult': 2.308044101043648, 'bull_tsl_mult': 0.3846594244532564, 'bull_time_stop': 135, 'bull_use_sma': True, 'bull_use_ema': True, 'bull_use_atr': True, 'bull_use_adx': True, 'bull_use_spike': True, 'bull_rsi_required': True, 'bear_strategy': 'breakout', 'bear_bb_std_mult': 2.7950089419760613, 'bear_rsi_os': 28, 'bear_rsi_ob': 90, 'bear_adx_thresh': 17.13306224969608, 'bear_atr_min_pct': 0.007545620857297953, 'bear_atr_max_pct': 0.1234845297907807, 'bear_tp_mult': 1.0126436149370097, 'bear_tsl_mult': 0.994742822507328, 'bear_time_stop': 179, 'bear_use_sma': False, 'bear_use_ema': True, 'bear_use_atr': False, 'bear_use_adx': False, 'bear_use_spike': True, 'bear_rsi_required': True, 'sideways_strategy': 'breakout', 'sideways_bb_std_mult': 2.3461708725456125, 'sideways_rsi_os': 52, 'sideways_rsi_ob': 67, 'sideways_adx_thresh': 23.831648723195418, 'sideways_atr_min_pct': 0.003409727376745593, 'sideways_atr_max_pct': 0.05469242686969766, 'sideways_tp_mult': 1.682654875704163, 'sideways_tsl_mult': 0.8498010200948889, 'sideways_time_stop': 43, 'sideways_use_sma': False, 'sideways_use_ema': False, 'sideways_use_atr': True, 'sideways_use_adx': True, 'sideways_use_spike': False, 'sideways_rsi_required': True}.
