[I 2025-08-31 12:00:38,434] Trial 55 finished with values: [-0.04649504354138756, 0.046347462134881924] and parameters: {'p_sma': 43, 'p_std': 5, 'p_atr': 8, 'p_adx': 25, 'rsi_period': 52, 'ema1': 14, 'ema2': 28, 'slip_atr_k': 0.10400489457041598, 'slip_spread_k': 0.27397616685940696, 'spread_hl_frac': 0.012523720479128753, 'bb_std_mult': 2.746605181841172, 'rsi_os': 26, 'rsi_ob': 56, 'vol_spike': 0.23511849227189996, 'adx_thresh': 34.72871367894143, 'atr_min_pct': 0.025926145700435017, 'atr_max_pct': 0.05331362165603122, 'tp_mult': 1.9713288850502695, 'tsl_mult': 0.3987386350238943, 'strategy': 'mean_reversion', 'time_stop': 259, 'use_sma': False, 'use_atr': False, 'use_adx': True, 'use_ema': False, 'use_spike': True, 'rsi_required': True, 'edge_k': 1.0434577536512688, 'edge_cap': 0.4029585882376543, 'bull_strategy': 'mean_reversion', 'bull_bb_std_mult': 1.534219425643411, 'bull_rsi_os': 21, 'bull_rsi_ob': 78, 'bull_adx_thresh': 7.992425663428669, 'bull_atr_min_pct': 0.021408168962460467, 'bull_atr_max_pct': 0.06393907721742927, 'bull_tp_mult': 1.7026184739264265, 'bull_tsl_mult': 0.9889914309938862, 'bull_time_stop': 279, 'bull_use_sma': False, 'bull_use_ema': False, 'bull_use_atr': False, 'bull_use_adx': False, 'bull_use_spike': True, 'bull_rsi_required': True, 'bear_strategy': 'breakout', 'bear_bb_std_mult': 3.3145653131218378, 'bear_rsi_os': 29, 'bear_rsi_ob': 95, 'bear_adx_thresh': 15.339934772496989, 'bear_atr_min_pct': 0.015263196824034856, 'bear_atr_max_pct': 0.07399631046539573, 'bear_tp_mult': 2.5182412546401953, 'bear_tsl_mult': 0.42053993562254655, 'bear_time_stop': 287, 'bear_use_sma': True, 'bear_use_ema': True, 'bear_use_atr': False, 'bear_use_adx': True, 'bear_use_spike': False, 'bear_rsi_required': True, 'sideways_strategy': 'breakout', 'sideways_bb_std_mult': 0.5022525724815284, 'sideways_rsi_os': 44, 'sideways_rsi_ob': 85, 'sideways_adx_thresh': 19.278517532315732, 'sideways_atr_min_pct': 0.003258616246878057, 'sideways_atr_max_pct': 0.09270699689294441, 'sideways_tp_mult': 1.43548110747971, 'sideways_tsl_mult': 0.34159653940867585, 'sideways_time_stop': 199, 'sideways_use_sma': False, 'sideways_use_ema': True, 'sideways_use_atr': False, 'sideways_use_adx': False, 'sideways_use_spike': True, 'sideways_rsi_required': False}.
[I 2025-08-31 12:00:38,435] Trial 52 finished with values: [-1000000000.0, 1000000000.0] and parameters: {'p_sma': 48, 'p_std': 50, 'p_atr': 28, 'p_adx': 28, 'rsi_period': 49, 'ema1': 25, 'ema2': 44, 'slip_atr_k': 0.07215386663181622, 'slip_spread_k': 0.9983856068969064, 'spread_hl_frac': 0.013715291722728, 'bb_std_mult': 1.9980109202437633, 'rsi_os': 38, 'rsi_ob': 55, 'vol_spike': 0.06058669199315886, 'adx_thresh': 26.23094042531164, 'atr_min_pct': 0.02525310632311406, 'atr_max_pct': 0.1160758772327117, 'tp_mult': 2.20165278187193, 'tsl_mult': 0.07752343735446232, 'strategy': 'mean_reversion', 'time_stop': 180, 'use_sma': True, 'use_atr': False, 'use_adx': True, 'use_ema': False, 'use_spike': True, 'rsi_required': True, 'edge_k': 0.23325219822445276, 'edge_cap': 0.4128982997602519, 'bull_strategy': 'mean_reversion', 'bull_bb_std_mult': 1.7788614068236281, 'bull_rsi_os': 11, 'bull_rsi_ob': 68, 'bull_adx_thresh': 31.892826787004964, 'bull_atr_min_pct': 0.027798058392495783, 'bull_atr_max_pct': 0.08913275108519342, 'bull_tp_mult': 1.6888276360167467, 'bull_tsl_mult': 0.5577425927150419, 'bull_time_stop': 166, 'bull_use_sma': True, 'bull_use_ema': False, 'bull_use_atr': False, 'bull_use_adx': False, 'bull_use_spike': True, 'bull_rsi_required': True, 'bear_strategy': 'breakout', 'bear_bb_std_mult': 3.2623255978686796, 'bear_rsi_os': 11, 'bear_rsi_ob': 76, 'bear_adx_thresh': 18.290859774510032, 'bear_atr_min_pct': 0.012979764243602046, 'bear_atr_max_pct': 0.10852325074616721, 'bear_tp_mult': 1.1470637719264638, 'bear_tsl_mult': 0.4493390862798087, 'bear_time_stop': 100, 'bear_use_sma': True, 'bear_use_ema': True, 'bear_use_atr': False, 'bear_use_adx': False, 'bear_use_spike': False, 'bear_rsi_required': True, 'sideways_strategy': 'breakout', 'sideways_bb_std_mult': 1.9517255614195475, 'sideways_rsi_os': 35, 'sideways_rsi_ob': 82, 'sideways_adx_thresh': 23.36661771546822, 'sideways_atr_min_pct': 0.003322472935289104, 'sideways_atr_max_pct': 0.12176886360818988, 'sideways_tp_mult': 1.3464813286051762, 'sideways_tsl_mult': 0.4082510383871585, 'sideways_time_stop': 168, 'sideways_use_sma': False, 'sideways_use_ema': True, 'sideways_use_atr': False, 'sideways_use_adx': True, 'sideways_use_spike': True, 'sideways_rsi_required': False}.
[I 2025-08-31 12:01:08,396] Trial 58 finished with values: [-1000000000.0, 1000000000.0] and parameters: {'p_sma': 24, 'p_std': 7, 'p_atr': 15, 'p_adx': 19, 'rsi_period': 8, 'ema1': 19, 'ema2': 13, 'slip_atr_k': 0.04928153724205941, 'slip_spread_k': 0.7145831939238735, 'spread_hl_frac': 0.0060085074098731855, 'bb_std_mult': 2.4400212780698562, 'rsi_os': 14, 'rsi_ob': 60, 'vol_spike': 0.24513677647372978, 'adx_thresh': 32.23651892439893, 'atr_min_pct': 0.0024023762802378584, 'atr_max_pct': 0.12929283105521067, 'tp_mult': 2.2928552993988482, 'tsl_mult': 0.31339062220423464, 'strategy': 'breakout', 'time_stop': 285, 'use_sma': False, 'use_atr': False, 'use_adx': True, 'use_ema': True, 'use_spike': True, 'rsi_required': True, 'edge_k': 1.322403140075875, 'edge_cap': 0.5115157158668714, 'bull_strategy': 'breakout', 'bull_bb_std_mult': 1.2436045203173238, 'bull_rsi_os': 24, 'bull_rsi_ob': 64, 'bull_adx_thresh': 27.998087080084225, 'bull_atr_min_pct': 0.028611354081563744, 'bull_atr_max_pct': 0.12927433790227655, 'bull_tp_mult': 2.180591474666836, 'bull_tsl_mult': 0.41801721879616527, 'bull_time_stop': 69, 'bull_use_sma': False, 'bull_use_ema': True, 'bull_use_atr': False, 'bull_use_adx': False, 'bull_use_spike': False, 'bull_rsi_required': False, 'bear_strategy': 'breakout', 'bear_bb_std_mult': 1.7520437676124856, 'bear_rsi_os': 23, 'bear_rsi_ob': 64, 'bear_adx_thresh': 27.75260945939546, 'bear_atr_min_pct': 0.022679688306902278, 'bear_atr_max_pct': 0.04593872974337098, 'bear_tp_mult': 2.0984817777742473, 'bear_tsl_mult': 0.19181664090095774, 'bear_time_stop': 163, 'bear_use_sma': False, 'bear_use_ema': True, 'bear_use_atr': True, 'bear_use_adx': False, 'bear_use_spike': True, 'bear_rsi_required': True, 'sideways_strategy': 'breakout', 'sideways_bb_std_mult': 2.2550276904518536, 'sideways_rsi_os': 28, 'sideways_rsi_ob': 88, 'sideways_adx_thresh': 25.78133153917809, 'sideways_atr_min_pct': 0.019051015598633037, 'sideways_atr_max_pct': 0.08639877633727806, 'sideways_tp_mult': 1.781276140101469, 'sideways_tsl_mult': 0.13382155270729879, 'sideways_time_stop': 118, 'sideways_use_sma': False, 'sideways_use_ema': False, 'sideways_use_atr': True, 'sideways_use_adx': False, 'sideways_use_spike': True, 'sideways_rsi_required': False}.
[I 2025-08-31 12:01:08,511] Trial 59 finished with values: [-1000000000.0, 1000000000.0] and parameters: {'p_sma': 17, 'p_std': 10, 'p_atr': 15, 'p_adx': 30, 'rsi_period': 65, 'ema1': 19, 'ema2': 13, 'slip_atr_k': 0.0032000541376262653, 'slip_spread_k': 0.746738386316427, 'spread_hl_frac': 0.007093544056845915, 'bb_std_mult': 2.4319782864825235, 'rsi_os': 42, 'rsi_ob': 60, 'vol_spike': 0.1475955600288644, 'adx_thresh': 32.60619063330954, 'atr_min_pct': 0.022467703535701985, 'atr_max_pct': 0.1360845398471954, 'tp_mult': 2.2628729762620865, 'tsl_mult': 0.6489106913948284, 'strategy': 'breakout', 'time_stop': 283, 'use_sma': False, 'use_atr': False, 'use_adx': True, 'use_ema': True, 'use_spike': True, 'rsi_required': True, 'edge_k': 0.004307776539716812, 'edge_cap': 0.49893523690224983, 'bull_strategy': 'breakout', 'bull_bb_std_mult': 1.173628742420246, 'bull_rsi_os': 32, 'bull_rsi_ob': 64, 'bull_adx_thresh': 27.68982217009629, 'bull_atr_min_pct': 0.02546519200238193, 'bull_atr_max_pct': 0.135373778490037, 'bull_tp_mult': 1.2978502039843085, 'bull_tsl_mult': 0.7669573087400707, 'bull_time_stop': 66, 'bull_use_sma': False, 'bull_use_ema': True, 'bull_use_atr': False, 'bull_use_adx': False, 'bull_use_spike': False, 'bull_rsi_required': False, 'bear_strategy': 'breakout', 'bear_bb_std_mult': 1.7211007976991761, 'bear_rsi_os': 25, 'bear_rsi_ob': 56, 'bear_adx_thresh': 21.5673537478578, 'bear_atr_min_pct': 0.027029813018333466, 'bear_atr_max_pct': 0.1157016040754481, 'bear_tp_mult': 2.1076800744147453, 'bear_tsl_mult': 0.23963258197805754, 'bear_time_stop': 174, 'bear_use_sma': False, 'bear_use_ema': True, 'bear_use_atr': True, 'bear_use_adx': False, 'bear_use_spike': True, 'bear_rsi_required': True, 'sideways_strategy': 'breakout', 'sideways_bb_std_mult': 1.4274728585835907, 'sideways_rsi_os': 28, 'sideways_rsi_ob': 76, 'sideways_adx_thresh': 26.2435637990808, 'sideways_atr_min_pct': 0.018104251634461013, 'sideways_atr_max_pct': 0.023274056928471988, 'sideways_tp_mult': 1.7927806397857196, 'sideways_tsl_mult': 0.27652986487841696, 'sideways_time_stop': 180, 'sideways_use_sma': False, 'sideways_use_ema': False, 'sideways_use_atr': True, 'sideways_use_adx': False, 'sideways_use_spike': True, 'sideways_rsi_required': False}.
[I 2025-08-31 12:01:08,511] Trial 57 finished with values: [-1000000000.0, 1000000000.0] and parameters: {'p_sma': 24, 'p_std': 6, 'p_atr': 15, 'p_adx': 25, 'rsi_period': 54, 'ema1': 25, 'ema2': 14, 'slip_atr_k': 0.07634902863175619, 'slip_spread_k': 0.27913463976286607, 'spread_hl_frac': 0.007872010016813199, 'bb_std_mult': 2.4360712990248237, 'rsi_os': 14, 'rsi_ob': 60, 'vol_spike': 0.1510958126106432, 'adx_thresh': 34.84141629387234, 'atr_min_pct': 0.025363127034682832, 'atr_max_pct': 0.05234977960972644, 'tp_mult': 2.276715511963053, 'tsl_mult': 0.3932214302508991, 'strategy': 'breakout', 'time_stop': 150, 'use_sma': False, 'use_atr': False, 'use_adx': True, 'use_ema': False, 'use_spike': True, 'rsi_required': True, 'edge_k': 1.0528543193602808, 'edge_cap': 0.5230576119360467, 'bull_strategy': 'breakout', 'bull_bb_std_mult': 1.52046192907892, 'bull_rsi_os': 20, 'bull_rsi_ob': 64, 'bull_adx_thresh': 7.884225070958532, 'bull_atr_min_pct': 0.012929864222082098, 'bull_atr_max_pct': 0.13045973460566992, 'bull_tp_mult': 2.187367365825403, 'bull_tsl_mult': 0.9934901423963013, 'bull_time_stop': 70, 'bull_use_sma': False, 'bull_use_ema': False, 'bull_use_atr': False, 'bull_use_adx': False, 'bull_use_spike': False, 'bull_rsi_required': False, 'bear_strategy': 'breakout', 'bear_bb_std_mult': 1.7425544284098706, 'bear_rsi_os': 26, 'bear_rsi_ob': 64, 'bear_adx_thresh': 21.569902361610293, 'bear_atr_min_pct': 0.01566082760219514, 'bear_atr_max_pct': 0.07294469068764775, 'bear_tp_mult': 2.4986754424196977, 'bear_tsl_mult': 0.4471147441668779, 'bear_time_stop': 173, 'bear_use_sma': False, 'bear_use_ema': True, 'bear_use_atr': False, 'bear_use_adx': False, 'bear_use_spike': True, 'bear_rsi_required': True, 'sideways_strategy': 'breakout', 'sideways_bb_std_mult': 0.9499665947734014, 'sideways_rsi_os': 35, 'sideways_rsi_ob': 92, 'sideways_adx_thresh': 26.352381007021997, 'sideways_atr_min_pct': 0.0038166918404832417, 'sideways_atr_max_pct': 0.018411204420908794, 'sideways_tp_mult': 1.7964650445366348, 'sideways_tsl_mult': 0.14255475995263697, 'sideways_time_stop': 177, 'sideways_use_sma': False, 'sideways_use_ema': False, 'sideways_use_atr': True, 'sideways_use_adx': False, 'sideways_use_spike': True, 'sideways_rsi_required': False}.
[I 2025-08-31 12:01:08,757] Trial 56 finished with values: [-1000000000.0, 1000000000.0] and parameters: {'p_sma': 57, 'p_std': 6, 'p_atr': 28, 'p_adx': 30, 'rsi_period': 51, 'ema1': 24, 'ema2': 11, 'slip_atr_k': 0.08212703479787946, 'slip_spread_k': 0.7868105157934104, 'spread_hl_frac': 0.011917002769533929, 'bb_std_mult': 2.73627637866631, 'rsi_os': 26, 'rsi_ob': 60, 'vol_spike': 7.274275298987942e-05, 'adx_thresh': 17.905272860790475, 'atr_min_pct': 0.02230357232722654, 'atr_max_pct': 0.0518979134090822, 'tp_mult': 1.1976340901307103, 'tsl_mult': 0.35844674692363077, 'strategy': 'breakout', 'time_stop': 259, 'use_sma': True, 'use_atr': False, 'use_adx': True, 'use_ema': False, 'use_spike': True, 'rsi_required': True, 'edge_k': 1.017134975580842, 'edge_cap': 0.49817754393980285, 'bull_strategy': 'mean_reversion', 'bull_bb_std_mult': 1.5851188066080137, 'bull_rsi_os': 22, 'bull_rsi_ob': 64, 'bull_adx_thresh': 7.409863663569359, 'bull_atr_min_pct': 0.027563608625023703, 'bull_atr_max_pct': 0.06253425822811684, 'bull_tp_mult': 1.6913104004626067, 'bull_tsl_mult': 0.963654519304156, 'bull_time_stop': 149, 'bull_use_sma': False, 'bull_use_ema': False, 'bull_use_atr': False, 'bull_use_adx': False, 'bull_use_spike': False, 'bull_rsi_required': True, 'bear_strategy': 'breakout', 'bear_bb_std_mult': 3.362555861277393, 'bear_rsi_os': 17, 'bear_rsi_ob': 64, 'bear_adx_thresh': 27.938737674796833, 'bear_atr_min_pct': 0.015277065909918527, 'bear_atr_max_pct': 0.1401496486391853, 'bear_tp_mult': 2.5000438197363573, 'bear_tsl_mult': 0.4472634736615884, 'bear_time_stop': 172, 'bear_use_sma': True, 'bear_use_ema': True, 'bear_use_atr': False, 'bear_use_adx': False, 'bear_use_spike': False, 'bear_rsi_required': True, 'sideways_strategy': 'breakout', 'sideways_bb_std_mult': 0.7003968956216673, 'sideways_rsi_os': 35, 'sideways_rsi_ob': 92, 'sideways_adx_thresh': 19.180591233762286, 'sideways_atr_min_pct': 0.00395833455812915, 'sideways_atr_max_pct': 0.024129508063445458, 'sideways_tp_mult': 1.4567324389829972, 'sideways_tsl_mult': 0.27293937136776053, 'sideways_time_stop': 174, 'sideways_use_sma': False, 'sideways_use_ema': True, 'sideways_use_atr': True, 'sideways_use_adx': False, 'sideways_use_spike': True, 'sideways_rsi_required': False}.
[I 2025-08-31 12:01:09,047] Trial 60 finished with values: [-1000000000.0, 1000000000.0] and parameters: {'p_sma': 36, 'p_std': 22, 'p_atr': 10, 'p_adx': 16, 'rsi_period': 70, 'ema1': 10, 'ema2': 10, 'slip_atr_k': 0.0876901724683972, 'slip_spread_k': 0.39651226307584925, 'spread_hl_frac': 0.040073240746311994, 'bb_std_mult': 1.806672003774653, 'rsi_os': 52, 'rsi_ob': 65, 'vol_spike': 0.0012001129653747278, 'adx_thresh': 30.804254207730136, 'atr_min_pct': 0.009345979347280122, 'atr_max_pct': 0.06098348570955695, 'tp_mult': 1.4415940095031, 'tsl_mult': 0.1253822556311182, 'strategy': 'mean_reversion', 'time_stop': 193, 'use_sma': False, 'use_atr': False, 'use_adx': True, 'use_ema': True, 'use_spike': True, 'rsi_required': False, 'edge_k': 1.557438221314978, 'edge_cap': 0.5964519810066173, 'bull_strategy': 'breakout', 'bull_bb_std_mult': 1.6808389903825705, 'bull_rsi_os': 28, 'bull_rsi_ob': 91, 'bull_adx_thresh': 29.95478826095771, 'bull_atr_min_pct': 0.00967271666803182, 'bull_atr_max_pct': 0.04793264197836049, 'bull_tp_mult': 1.949824440025876, 'bull_tsl_mult': 0.7168758229726568, 'bull_time_stop': 232, 'bull_use_sma': True, 'bull_use_ema': True, 'bull_use_atr': True, 'bull_use_adx': True, 'bull_use_spike': True, 'bull_rsi_required': True, 'bear_strategy': 'breakout', 'bear_bb_std_mult': 1.490666660093844, 'bear_rsi_os': 41, 'bear_rsi_ob': 91, 'bear_adx_thresh': 19.3811669065532, 'bear_atr_min_pct': 0.010331970133273808, 'bear_atr_max_pct': 0.02121012363730588, 'bear_tp_mult': 2.297853853350079, 'bear_tsl_mult': 0.7561796745327811, 'bear_time_stop': 187, 'bear_use_sma': True, 'bear_use_ema': False, 'bear_use_atr': True, 'bear_use_adx': True, 'bear_use_spike': False, 'bear_rsi_required': True, 'sideways_strategy': 'breakout', 'sideways_bb_std_mult': 1.2965049904651615, 'sideways_rsi_os': 31, 'sideways_rsi_ob': 59, 'sideways_adx_thresh': 33.07095802656653, 'sideways_atr_min_pct': 0.016183034243039855, 'sideways_atr_max_pct': 0.04503138682343978, 'sideways_tp_mult': 1.9388013645847775, 'sideways_tsl_mult': 0.46046025681238123, 'sideways_time_stop': 52, 'sideways_use_sma': True, 'sideways_use_ema': True, 'sideways_use_atr': False, 'sideways_use_adx': True, 'sideways_use_spike': True, 'sideways_rsi_required': False}.
[I 2025-08-31 12:01:09,065] Trial 62 finished with values: [-1000000000.0, 1000000000.0] and parameters: {'p_sma': 35, 'p_std': 57, 'p_atr': 10, 'p_adx': 11, 'rsi_period': 43, 'ema1': 10, 'ema2': 18, 'slip_atr_k': 0.09364519012979207, 'slip_spread_k': 0.5412334546328977, 'spread_hl_frac': 0.040258081653015365, 'bb_std_mult': 2.787390787257457, 'rsi_os': 52, 'rsi_ob': 88, 'vol_spike': 0.007884676959100279, 'adx_thresh': 23.721228540582782, 'atr_min_pct': 0.008745058253719355, 'atr_max_pct': 0.063241957140441, 'tp_mult': 1.995668034878603, 'tsl_mult': 0.11345403120636488, 'strategy': 'mean_reversion', 'time_stop': 196, 'use_sma': False, 'use_atr': False, 'use_adx': True, 'use_ema': True, 'use_spike': True, 'rsi_required': False, 'edge_k': 0.5469933985565902, 'edge_cap': 0.6003215268986849, 'bull_strategy': 'breakout', 'bull_bb_std_mult': 1.721784188225723, 'bull_rsi_os': 23, 'bull_rsi_ob': 92, 'bull_adx_thresh': 17.34920404285389, 'bull_atr_min_pct': 0.029995612659504345, 'bull_atr_max_pct': 0.04630924797723223, 'bull_tp_mult': 1.4498822711054007, 'bull_tsl_mult': 0.7194184415431176, 'bull_time_stop': 235, 'bull_use_sma': True, 'bull_use_ema': True, 'bull_use_atr': True, 'bull_use_adx': True, 'bull_use_spike': True, 'bull_rsi_required': True, 'bear_strategy': 'breakout', 'bear_bb_std_mult': 3.1230471250369956, 'bear_rsi_os': 42, 'bear_rsi_ob': 92, 'bear_adx_thresh': 30.488187899329926, 'bear_atr_min_pct': 0.004151636176850623, 'bear_atr_max_pct': 0.06252641605286868, 'bear_tp_mult': 1.732911503457902, 'bear_tsl_mult': 0.7599184016276219, 'bear_time_stop': 195, 'bear_use_sma': True, 'bear_use_ema': False, 'bear_use_atr': True, 'bear_use_adx': True, 'bear_use_spike': False, 'bear_rsi_required': True, 'sideways_strategy': 'breakout', 'sideways_bb_std_mult': 0.7140990686646969, 'sideways_rsi_os': 6, 'sideways_rsi_ob': 90, 'sideways_adx_thresh': 15.725896976949665, 'sideways_atr_min_pct': 0.01666360633806945, 'sideways_atr_max_pct': 0.06435869929011041, 'sideways_tp_mult': 1.950974807084462, 'sideways_tsl_mult': 0.5708550873223428, 'sideways_time_stop': 41, 'sideways_use_sma': True, 'sideways_use_ema': True, 'sideways_use_atr': False, 'sideways_use_adx': True, 'sideways_use_spike': True, 'sideways_rsi_required': False}.
[I 2025-08-31 12:01:37,624] Trial 63 finished with values: [-1000000000.0, 1000000000.0] and parameters: {'p_sma': 35, 'p_std': 57, 'p_atr': 10, 'p_adx': 15, 'rsi_period': 41, 'ema1': 10, 'ema2': 17, 'slip_atr_k': 0.11866135057651411, 'slip_spread_k': 0.6527021266554375, 'spread_hl_frac': 0.00024293594642060302, 'bb_std_mult': 3.431525632336514, 'rsi_os': 48, 'rsi_ob': 65, 'vol_spike': 0.09808941412376157, 'adx_thresh': 24.370420304488498, 'atr_min_pct': 0.011593122445779404, 'atr_max_pct': 0.029149144507167483, 'tp_mult': 2.0170355892210603, 'tsl_mult': 0.20392848652142084, 'strategy': 'mean_reversion', 'time_stop': 199, 'use_sma': False, 'use_atr': False, 'use_adx': True, 'use_ema': True, 'use_spike': True, 'rsi_required': False, 'edge_k': 1.5558138015756349, 'edge_cap': 0.9683401726204859, 'bull_strategy': 'breakout', 'bull_bb_std_mult': 0.5266860681129863, 'bull_rsi_os': 33, 'bull_rsi_ob': 74, 'bull_adx_thresh': 12.488695947181078, 'bull_atr_min_pct': 0.0029305901129407074, 'bull_atr_max_pct': 0.1126806022581267, 'bull_tp_mult': 1.955975671163894, 'bull_tsl_mult': 0.7266814840581101, 'bull_time_stop': 229, 'bull_use_sma': True, 'bull_use_ema': True, 'bull_use_atr': True, 'bull_use_adx': True, 'bull_use_spike': True, 'bull_rsi_required': True, 'bear_strategy': 'breakout', 'bear_bb_std_mult': 2.1004067175104484, 'bear_rsi_os': 13, 'bear_rsi_ob': 56, 'bear_adx_thresh': 29.019882187191474, 'bear_atr_min_pct': 0.01015497030115398, 'bear_atr_max_pct': 0.022319258729706318, 'bear_tp_mult': 1.7186297860024877, 'bear_tsl_mult': 0.6770890396530106, 'bear_time_stop': 188, 'bear_use_sma': True, 'bear_use_ema': False, 'bear_use_atr': True, 'bear_use_adx': True, 'bear_use_spike': False, 'bear_rsi_required': True, 'sideways_strategy': 'breakout', 'sideways_bb_std_mult': 3.304916564656594, 'sideways_rsi_os': 41, 'sideways_rsi_ob': 59, 'sideways_adx_thresh': 16.411115810528763, 'sideways_atr_min_pct': 0.008819816361243663, 'sideways_atr_max_pct': 0.0422253035486781, 'sideways_tp_mult': 2.249386157930812, 'sideways_tsl_mult': 0.56172644299387, 'sideways_time_stop': 42, 'sideways_use_sma': True, 'sideways_use_ema': False, 'sideways_use_atr': False, 'sideways_use_adx': True, 'sideways_use_spike': True, 'sideways_rsi_required': False}.
