[I 2025-08-31 11:56:34,534] Trial 12 finished with values: [-1000000000.0, 1000000000.0] and parameters: {'p_sma': 20, 'p_std': 16, 'p_atr': 9, 'p_adx': 30, 'rsi_period': 43, 'ema1': 11, 'ema2': 54, 'slip_atr_k': 0.20430707792914882, 'slip_spread_k': 0.7621561859969364, 'spread_hl_frac': 0.011587468062252155, 'bb_std_mult': 1.9028374394023426, 'rsi_os': 54, 'rsi_ob': 90, 'vol_spike': 0.16102886615538797, 'adx_thresh': 31.32205129986611, 'atr_min_pct': 0.013323929937727734, 'atr_max_pct': 0.07496814604426683, 'tp_mult': 1.9395649879676644, 'tsl_mult': 0.3814727236025588, 'strategy': 'mean_reversion', 'time_stop': 275, 'use_sma': True, 'use_atr': True, 'use_adx': False, 'use_ema': False, 'use_spike': True, 'rsi_required': True, 'edge_k': 1.9335690529666403, 'edge_cap': 0.8391304795312958, 'bull_strategy': 'breakout', 'bull_bb_std_mult': 3.457089391210932, 'bull_rsi_os': 19, 'bull_rsi_ob': 71, 'bull_adx_thresh': 8.081129064168396, 'bull_atr_min_pct': 0.004286020846244565, 'bull_atr_max_pct': 0.036146026885038506, 'bull_tp_mult': 2.174446808841405, 'bull_tsl_mult': 0.4260735087604457, 'bull_time_stop': 163, 'bull_use_sma': True, 'bull_use_ema': False, 'bull_use_atr': True, 'bull_use_adx': False, 'bull_use_spike': True, 'bull_rsi_required': True, 'bear_strategy': 'breakout', 'bear_bb_std_mult': 1.3973179901954345, 'bear_rsi_os': 6, 'bear_rsi_ob': 93, 'bear_adx_thresh': 14.83945356787555, 'bear_atr_min_pct': 0.02355563109587295, 'bear_atr_max_pct': 0.06865453961200452, 'bear_tp_mult': 2.7936358652823117, 'bear_tsl_mult': 0.46842220890294595, 'bear_time_stop': 118, 'bear_use_sma': True, 'bear_use_ema': True, 'bear_use_atr': False, 'bear_use_adx': False, 'bear_use_spike': True, 'bear_rsi_required': True, 'sideways_strategy': 'breakout', 'sideways_bb_std_mult': 3.581178847885805, 'sideways_rsi_os': 50, 'sideways_rsi_ob': 90, 'sideways_adx_thresh': 24.54874448959214, 'sideways_atr_min_pct': 0.01731320221827126, 'sideways_atr_max_pct': 0.028170072775961542, 'sideways_tp_mult': 2.0825126992661542, 'sideways_tsl_mult': 0.6316945778284795, 'sideways_time_stop': 67, 'sideways_use_sma': True, 'sideways_use_ema': True, 'sideways_use_atr': True, 'sideways_use_adx': False, 'sideways_use_spike': False, 'sideways_rsi_required': True}.
[I 2025-08-31 11:56:34,648] Trial 8 finished with values: [-1000000000.0, 1000000000.0] and parameters: {'p_sma': 31, 'p_std': 21, 'p_atr': 30, 'p_adx': 27, 'rsi_period': 13, 'ema1': 22, 'ema2': 58, 'slip_atr_k': 0.12269020038021658, 'slip_spread_k': 0.9971570305422957, 'spread_hl_frac': 0.014521109301513808, 'bb_std_mult': 1.6424315591435195, 'rsi_os': 17, 'rsi_ob': 93, 'vol_spike': 0.19060303690840416, 'adx_thresh': 21.008696444922915, 'atr_min_pct': 0.007390701790902492, 'atr_max_pct': 0.13202554710754094, 'tp_mult': 1.3641536855502672, 'tsl_mult': 0.11437026368312864, 'strategy': 'breakout', 'time_stop': 180, 'use_sma': True, 'use_atr': True, 'use_adx': True, 'use_ema': True, 'use_spike': False, 'rsi_required': False, 'edge_k': 1.218018275959228, 'edge_cap': 0.3473235674278295, 'bull_strategy': 'mean_reversion', 'bull_bb_std_mult': 0.6066090132473066, 'bull_rsi_os': 55, 'bull_rsi_ob': 57, 'bull_adx_thresh': 34.07891109228448, 'bull_atr_min_pct': 0.011369282477073408, 'bull_atr_max_pct': 0.08831980392246655, 'bull_tp_mult': 1.7738198884196257, 'bull_tsl_mult': 0.5995805258630392, 'bull_time_stop': 162, 'bull_use_sma': True, 'bull_use_ema': False, 'bull_use_atr': True, 'bull_use_adx': False, 'bull_use_spike': True, 'bull_rsi_required': True, 'bear_strategy': 'breakout', 'bear_bb_std_mult': 3.006853131072084, 'bear_rsi_os': 31, 'bear_rsi_ob': 77, 'bear_adx_thresh': 17.929334423455025, 'bear_atr_min_pct': 0.023056673637917257, 'bear_atr_max_pct': 0.12377180022085091, 'bear_tp_mult': 1.2819210531469694, 'bear_tsl_mult': 0.5760943707698656, 'bear_time_stop': 271, 'bear_use_sma': True, 'bear_use_ema': True, 'bear_use_atr': True, 'bear_use_adx': True, 'bear_use_spike': False, 'bear_rsi_required': True, 'sideways_strategy': 'mean_reversion', 'sideways_bb_std_mult': 1.984961859832358, 'sideways_rsi_os': 16, 'sideways_rsi_ob': 58, 'sideways_adx_thresh': 25.8566108923922, 'sideways_atr_min_pct': 0.014904785160239156, 'sideways_atr_max_pct': 0.14186627716111444, 'sideways_tp_mult': 1.1899077604208155, 'sideways_tsl_mult': 0.42473682156093906, 'sideways_time_stop': 125, 'sideways_use_sma': True, 'sideways_use_ema': True, 'sideways_use_atr': True, 'sideways_use_adx': True, 'sideways_use_spike': False, 'sideways_rsi_required': True}.
[I 2025-08-31 11:56:35,350] Trial 13 finished with values: [-1000000000.0, 1000000000.0] and parameters: {'p_sma': 33, 'p_std': 35, 'p_atr': 29, 'p_adx': 14, 'rsi_period': 10, 'ema1': 6, 'ema2': 29, 'slip_atr_k': 0.160350516645294, 'slip_spread_k': 0.3370005912274796, 'spread_hl_frac': 0.027980718929786354, 'bb_std_mult': 0.5016706201955797, 'rsi_os': 20, 'rsi_ob': 45, 'vol_spike': 0.24131283673518622, 'adx_thresh': 6.559406535510941, 'atr_min_pct': 0.0020984865026702666, 'atr_max_pct': 0.1462923414093299, 'tp_mult': 1.057262829597217, 'tsl_mult': 0.688505917534784, 'strategy': 'mean_reversion', 'time_stop': 108, 'use_sma': True, 'use_atr': True, 'use_adx': False, 'use_ema': True, 'use_spike': False, 'rsi_required': False, 'edge_k': 0.15704958464717755, 'edge_cap': 0.2442197228295958, 'bull_strategy': 'mean_reversion', 'bull_bb_std_mult': 1.582537609859323, 'bull_rsi_os': 38, 'bull_rsi_ob': 81, 'bull_adx_thresh': 5.795088235872724, 'bull_atr_min_pct': 0.029524419319925416, 'bull_atr_max_pct': 0.0947672752783346, 'bull_tp_mult': 1.6414437372619568, 'bull_tsl_mult': 0.6543267026032166, 'bull_time_stop': 6, 'bull_use_sma': True, 'bull_use_ema': False, 'bull_use_atr': False, 'bull_use_adx': True, 'bull_use_spike': False, 'bull_rsi_required': True, 'bear_strategy': 'mean_reversion', 'bear_bb_std_mult': 0.6375815175572791, 'bear_rsi_os': 34, 'bear_rsi_ob': 47, 'bear_adx_thresh': 22.547401437717216, 'bear_atr_min_pct': 0.013683511299190704, 'bear_atr_max_pct': 0.052350341859196785, 'bear_tp_mult': 1.6585458292898212, 'bear_tsl_mult': 0.9902677250760508, 'bear_time_stop': 11, 'bear_use_sma': False, 'bear_use_ema': False, 'bear_use_atr': True, 'bear_use_adx': False, 'bear_use_spike': False, 'bear_rsi_required': False, 'sideways_strategy': 'mean_reversion', 'sideways_bb_std_mult': 3.176060082127285, 'sideways_rsi_os': 23, 'sideways_rsi_ob': 68, 'sideways_adx_thresh': 7.456372302002732, 'sideways_atr_min_pct': 0.018835414035734438, 'sideways_atr_max_pct': 0.0823098052149639, 'sideways_tp_mult': 1.066471837806192, 'sideways_tsl_mult': 0.31510864188770615, 'sideways_time_stop': 35, 'sideways_use_sma': True, 'sideways_use_ema': False, 'sideways_use_atr': False, 'sideways_use_adx': False, 'sideways_use_spike': True, 'sideways_rsi_required': False}.
[I 2025-08-31 11:56:35,601] Trial 14 finished with values: [-1000000000.0, 1000000000.0] and parameters: {'p_sma': 21, 'p_std': 38, 'p_atr': 20, 'p_adx': 14, 'rsi_period': 70, 'ema1': 5, 'ema2': 48, 'slip_atr_k': 0.24728648960891222, 'slip_spread_k': 0.31189722561245564, 'spread_hl_frac': 0.02810478606231224, 'bb_std_mult': 0.8584359632499756, 'rsi_os': 23, 'rsi_ob': 45, 'vol_spike': 0.2767232053382115, 'adx_thresh': 6.125453816610817, 'atr_min_pct': 0.0006705445873646208, 'atr_max_pct': 0.10481237336529248, 'tp_mult': 2.9795590347557876, 'tsl_mult': 0.6898987055620268, 'strategy': 'mean_reversion', 'time_stop': 119, 'use_sma': False, 'use_atr': True, 'use_adx': False, 'use_ema': False, 'use_spike': False, 'rsi_required': False, 'edge_k': 0.10032228102224838, 'edge_cap': 0.12601529865494415, 'bull_strategy': 'mean_reversion', 'bull_bb_std_mult': 1.6601101683312365, 'bull_rsi_os': 36, 'bull_rsi_ob': 93, 'bull_adx_thresh': 27.03022659220739, 'bull_atr_min_pct': 0.027276877320286816, 'bull_atr_max_pct': 0.10715876461384047, 'bull_tp_mult': 1.6147846465428572, 'bull_tsl_mult': 0.6322980309697172, 'bull_time_stop': 11, 'bull_use_sma': True, 'bull_use_ema': False, 'bull_use_atr': True, 'bull_use_adx': True, 'bull_use_spike': False, 'bull_rsi_required': False, 'bear_strategy': 'mean_reversion', 'bear_bb_std_mult': 0.5076541099061742, 'bear_rsi_os': 55, 'bear_rsi_ob': 45, 'bear_adx_thresh': 20.590262710789414, 'bear_atr_min_pct': 5.195831849788109e-05, 'bear_atr_max_pct': 0.02503829596617848, 'bear_tp_mult': 1.6451887009843407, 'bear_tsl_mult': 0.9545624759427762, 'bear_time_stop': 13, 'bear_use_sma': False, 'bear_use_ema': False, 'bear_use_atr': False, 'bear_use_adx': False, 'bear_use_spike': True, 'bear_rsi_required': False, 'sideways_strategy': 'mean_reversion', 'sideways_bb_std_mult': 3.1216415753475824, 'sideways_rsi_os': 24, 'sideways_rsi_ob': 71, 'sideways_adx_thresh': 6.35498798723987, 'sideways_atr_min_pct': 0.020605027938306816, 'sideways_atr_max_pct': 0.07367419698560009, 'sideways_tp_mult': 1.0714356907124716, 'sideways_tsl_mult': 0.2927277677365639, 'sideways_time_stop': 7, 'sideways_use_sma': True, 'sideways_use_ema': True, 'sideways_use_atr': False, 'sideways_use_adx': False, 'sideways_use_spike': True, 'sideways_rsi_required': False}.
[I 2025-08-31 11:56:35,768] Trial 10 finished with values: [-0.05661250234443127, 0.05638235007249881] and parameters: {'p_sma': 30, 'p_std': 36, 'p_atr': 15, 'p_adx': 21, 'rsi_period': 72, 'ema1': 6, 'ema2': 30, 'slip_atr_k': 0.22076918824543484, 'slip_spread_k': 0.08612469859012362, 'spread_hl_frac': 0.03194389076072651, 'bb_std_mult': 0.6486416420563006, 'rsi_os': 45, 'rsi_ob': 67, 'vol_spike': 0.16894357870138135, 'adx_thresh': 18.784821441844443, 'atr_min_pct': 0.014141475613185564, 'atr_max_pct': 0.03217670465556913, 'tp_mult': 1.3363169935130454, 'tsl_mult': 0.23826872966187784, 'strategy': 'breakout', 'time_stop': 106, 'use_sma': False, 'use_atr': True, 'use_adx': False, 'use_ema': False, 'use_spike': False, 'rsi_required': True, 'edge_k': 1.5852990898349892, 'edge_cap': 0.6854629384651497, 'bull_strategy': 'breakout', 'bull_bb_std_mult': 2.765777130511709, 'bull_rsi_os': 10, 'bull_rsi_ob': 79, 'bull_adx_thresh': 12.989648414419188, 'bull_atr_min_pct': 0.0005374423908411107, 'bull_atr_max_pct': 0.02898062412527952, 'bull_tp_mult': 2.7217068848294628, 'bull_tsl_mult': 0.7358465380995208, 'bull_time_stop': 40, 'bull_use_sma': False, 'bull_use_ema': True, 'bull_use_atr': False, 'bull_use_adx': False, 'bull_use_spike': True, 'bull_rsi_required': True, 'bear_strategy': 'mean_reversion', 'bear_bb_std_mult': 0.6329138225009341, 'bear_rsi_os': 53, 'bear_rsi_ob': 55, 'bear_adx_thresh': 24.452641198542526, 'bear_atr_min_pct': 0.02457890811784333, 'bear_atr_max_pct': 0.01893734105262754, 'bear_tp_mult': 2.6982790236131144, 'bear_tsl_mult': 0.43268769436729637, 'bear_time_stop': 53, 'bear_use_sma': True, 'bear_use_ema': True, 'bear_use_atr': False, 'bear_use_adx': False, 'bear_use_spike': False, 'bear_rsi_required': False, 'sideways_strategy': 'mean_reversion', 'sideways_bb_std_mult': 0.6914368584251357, 'sideways_rsi_os': 14, 'sideways_rsi_ob': 88, 'sideways_adx_thresh': 12.530849697560916, 'sideways_atr_min_pct': 0.02812724847345294, 'sideways_atr_max_pct': 0.013655247474842393, 'sideways_tp_mult': 2.4791307492559875, 'sideways_tsl_mult': 0.14801511690684221, 'sideways_time_stop': 111, 'sideways_use_sma': False, 'sideways_use_ema': True, 'sideways_use_atr': False, 'sideways_use_adx': True, 'sideways_use_spike': False, 'sideways_rsi_required': True}.
[I 2025-08-31 11:56:35,986] Trial 15 finished with values: [-1000000000.0, 1000000000.0] and parameters: {'p_sma': 20, 'p_std': 37, 'p_atr': 20, 'p_adx': 15, 'rsi_period': 37, 'ema1': 18, 'ema2': 50, 'slip_atr_k': 0.249221293406878, 'slip_spread_k': 0.03511300394303435, 'spread_hl_frac': 0.03076501172254304, 'bb_std_mult': 1.1908108188217572, 'rsi_os': 6, 'rsi_ob': 47, 'vol_spike': 0.010157299964474495, 'adx_thresh': 15.216892859854498, 'atr_min_pct': 0.02669250038446605, 'atr_max_pct': 0.10306221826207505, 'tp_mult': 2.928627251844103, 'tsl_mult': 0.6799868601646369, 'strategy': 'mean_reversion', 'time_stop': 114, 'use_sma': False, 'use_atr': False, 'use_adx': False, 'use_ema': False, 'use_spike': False, 'rsi_required': False, 'edge_k': 1.104183876098396, 'edge_cap': 0.587117124080747, 'bull_strategy': 'mean_reversion', 'bull_bb_std_mult': 2.9044397951476255, 'bull_rsi_os': 38, 'bull_rsi_ob': 94, 'bull_adx_thresh': 26.7972057604428, 'bull_atr_min_pct': 0.02291529784630294, 'bull_atr_max_pct': 0.012448753609082847, 'bull_tp_mult': 2.528429992745801, 'bull_tsl_mult': 0.700979867000188, 'bull_time_stop': 224, 'bull_use_sma': True, 'bull_use_ema': True, 'bull_use_atr': True, 'bull_use_adx': True, 'bull_use_spike': False, 'bull_rsi_required': False, 'bear_strategy': 'mean_reversion', 'bear_bb_std_mult': 1.2395822479972196, 'bear_rsi_os': 54, 'bear_rsi_ob': 58, 'bear_adx_thresh': 18.866129372069203, 'bear_atr_min_pct': 0.008996273813319917, 'bear_atr_max_pct': 0.012759391410883836, 'bear_tp_mult': 1.5902898904814604, 'bear_tsl_mult': 0.3673816131089548, 'bear_time_stop': 222, 'bear_use_sma': False, 'bear_use_ema': False, 'bear_use_atr': False, 'bear_use_adx': False, 'bear_use_spike': True, 'bear_rsi_required': False, 'sideways_strategy': 'mean_reversion', 'sideways_bb_std_mult': 1.151041377175667, 'sideways_rsi_os': 26, 'sideways_rsi_ob': 75, 'sideways_adx_thresh': 12.427670551009687, 'sideways_atr_min_pct': 0.022938242046753016, 'sideways_atr_max_pct': 0.05595233173604788, 'sideways_tp_mult': 1.411052995645885, 'sideways_tsl_mult': 0.7247980703684357, 'sideways_time_stop': 9, 'sideways_use_sma': False, 'sideways_use_ema': True, 'sideways_use_atr': False, 'sideways_use_adx': False, 'sideways_use_spike': True, 'sideways_rsi_required': False}.
[I 2025-08-31 11:56:36,443] Trial 11 finished with values: [-1000000000.0, 1000000000.0] and parameters: {'p_sma': 26, 'p_std': 41, 'p_atr': 16, 'p_adx': 27, 'rsi_period': 41, 'ema1': 5, 'ema2': 59, 'slip_atr_k': 0.08933892658051429, 'slip_spread_k': 0.14200496299757648, 'spread_hl_frac': 0.024689017873847852, 'bb_std_mult': 2.9157381238164466, 'rsi_os': 41, 'rsi_ob': 88, 'vol_spike': 0.07209297264541027, 'adx_thresh': 16.317748978324925, 'atr_min_pct': 0.009539481279650017, 'atr_max_pct': 0.11934105311587931, 'tp_mult': 1.3005616727368488, 'tsl_mult': 0.42313812593471023, 'strategy': 'breakout', 'time_stop': 248, 'use_sma': True, 'use_atr': False, 'use_adx': True, 'use_ema': False, 'use_spike': False, 'rsi_required': True, 'edge_k': 1.8108737073174315, 'edge_cap': 0.749970046881982, 'bull_strategy': 'breakout', 'bull_bb_std_mult': 2.8405307382044107, 'bull_rsi_os': 39, 'bull_rsi_ob': 65, 'bull_adx_thresh': 19.32584762114622, 'bull_atr_min_pct': 0.025106961384273426, 'bull_atr_max_pct': 0.04610810815294486, 'bull_tp_mult': 1.9368447863730283, 'bull_tsl_mult': 0.08898720764326229, 'bull_time_stop': 56, 'bull_use_sma': True, 'bull_use_ema': False, 'bull_use_atr': True, 'bull_use_adx': True, 'bull_use_spike': False, 'bull_rsi_required': True, 'bear_strategy': 'mean_reversion', 'bear_bb_std_mult': 2.981267072985447, 'bear_rsi_os': 38, 'bear_rsi_ob': 82, 'bear_adx_thresh': 25.856571835386845, 'bear_atr_min_pct': 0.0006361568149296915, 'bear_atr_max_pct': 0.11470102644480595, 'bear_tp_mult': 1.6154053823955281, 'bear_tsl_mult': 0.4327884674839688, 'bear_time_stop': 84, 'bear_use_sma': True, 'bear_use_ema': False, 'bear_use_atr': False, 'bear_use_adx': False, 'bear_use_spike': True, 'bear_rsi_required': False, 'sideways_strategy': 'mean_reversion', 'sideways_bb_std_mult': 1.0041319142729401, 'sideways_rsi_os': 25, 'sideways_rsi_ob': 85, 'sideways_adx_thresh': 5.348307619865222, 'sideways_atr_min_pct': 0.0220486789540785, 'sideways_atr_max_pct': 0.011669465928102052, 'sideways_tp_mult': 2.1938910615993743, 'sideways_tsl_mult': 0.5702658961767761, 'sideways_time_stop': 130, 'sideways_use_sma': True, 'sideways_use_ema': True, 'sideways_use_atr': True, 'sideways_use_adx': False, 'sideways_use_spike': True, 'sideways_rsi_required': True}.
[I 2025-08-31 11:56:36,517] Trial 17 finished with values: [-1000000000.0, 1000000000.0] and parameters: {'p_sma': 39, 'p_std': 43, 'p_atr': 20, 'p_adx': 18, 'rsi_period': 69, 'ema1': 30, 'ema2': 12, 'slip_atr_k': 0.08023736492436075, 'slip_spread_k': 0.022046904642847642, 'spread_hl_frac': 0.019972183006659483, 'bb_std_mult': 1.3114607765529673, 'rsi_os': 41, 'rsi_ob': 79, 'vol_spike': 0.20812584288843622, 'adx_thresh': 16.120925797202545, 'atr_min_pct': 0.023242517427531497, 'atr_max_pct': 0.014073503878972188, 'tp_mult': 1.0315714909401799, 'tsl_mult': 0.24509447606533, 'strategy': 'breakout', 'time_stop': 5, 'use_sma': False, 'use_atr': True, 'use_adx': False, 'use_ema': False, 'use_spike': False, 'rsi_required': True, 'edge_k': 1.0954862349676384, 'edge_cap': 0.6490305581609348, 'bull_strategy': 'breakout', 'bull_bb_std_mult': 3.271948450552422, 'bull_rsi_os': 5, 'bull_rsi_ob': 83, 'bull_adx_thresh': 14.262658617362439, 'bull_atr_min_pct': 0.021620198171725665, 'bull_atr_max_pct': 0.010458058020816206, 'bull_tp_mult': 2.9641322326060626, 'bull_tsl_mult': 0.9793761665414985, 'bull_time_stop': 50, 'bull_use_sma': False, 'bull_use_ema': True, 'bull_use_atr': False, 'bull_use_adx': False, 'bull_use_spike': False, 'bull_rsi_required': True, 'bear_strategy': 'mean_reversion', 'bear_bb_std_mult': 1.3192677627268221, 'bear_rsi_os': 46, 'bear_rsi_ob': 58, 'bear_adx_thresh': 11.534904660346648, 'bear_atr_min_pct': 0.02943617605896813, 'bear_atr_max_pct': 0.01401921568652085, 'bear_tp_mult': 2.42466836594017, 'bear_tsl_mult': 0.3545709114331794, 'bear_time_stop': 67, 'bear_use_sma': True, 'bear_use_ema': True, 'bear_use_atr': False, 'bear_use_adx': False, 'bear_use_spike': False, 'bear_rsi_required': False, 'sideways_strategy': 'mean_reversion', 'sideways_bb_std_mult': 0.5481120696133864, 'sideways_rsi_os': 16, 'sideways_rsi_ob': 80, 'sideways_adx_thresh': 14.390480505690403, 'sideways_atr_min_pct': 0.029305278553718776, 'sideways_atr_max_pct': 0.03967951915190039, 'sideways_tp_mult': 2.3528394646136817, 'sideways_tsl_mult': 0.007444210711869403, 'sideways_time_stop': 81, 'sideways_use_sma': False, 'sideways_use_ema': True, 'sideways_use_atr': False, 'sideways_use_adx': True, 'sideways_use_spike': False, 'sideways_rsi_required': True}.
[I 2025-08-31 11:56:36,593] Trial 18 finished with values: [-1000000000.0, 1000000000.0] and parameters: {'p_sma': 40, 'p_std': 59, 'p_atr': 25, 'p_adx': 24, 'rsi_period': 66, 'ema1': 30, 'ema2': 25, 'slip_atr_k': 0.07830274175476437, 'slip_spread_k': 0.1635397314618623, 'spread_hl_frac': 0.020937318712099168, 'bb_std_mult': 0.5276582076066619, 'rsi_os': 41, 'rsi_ob': 79, 'vol_spike': 0.1978646785247934, 'adx_thresh': 15.979606513280885, 'atr_min_pct': 0.021909036075592934, 'atr_max_pct': 0.01503966059645669, 'tp_mult': 1.0159520053243765, 'tsl_mult': 0.23802461432091018, 'strategy': 'breakout', 'time_stop': 10, 'use_sma': False, 'use_atr': True, 'use_adx': False, 'use_ema': False, 'use_spike': False, 'rsi_required': True, 'edge_k': 0.8426656983423929, 'edge_cap': 0.6851330439021455, 'bull_strategy': 'breakout', 'bull_bb_std_mult': 3.5953395061766997, 'bull_rsi_os': 6, 'bull_rsi_ob': 81, 'bull_adx_thresh': 15.349605053641849, 'bull_atr_min_pct': 0.008959489128234615, 'bull_atr_max_pct': 0.010087648752742859, 'bull_tp_mult': 2.9111128837863625, 'bull_tsl_mult': 0.4913825551111983, 'bull_time_stop': 47, 'bull_use_sma': False, 'bull_use_ema': True, 'bull_use_atr': False, 'bull_use_adx': False, 'bull_use_spike': False, 'bull_rsi_required': True, 'bear_strategy': 'mean_reversion', 'bear_bb_std_mult': 1.0595369851641323, 'bear_rsi_os': 43, 'bear_rsi_ob': 61, 'bear_adx_thresh': 12.329895817017652, 'bear_atr_min_pct': 0.028993996227277892, 'bear_atr_max_pct': 0.14686731178171125, 'bear_tp_mult': 2.4225929750326065, 'bear_tsl_mult': 0.7851777906666249, 'bear_time_stop': 81, 'bear_use_sma': True, 'bear_use_ema': True, 'bear_use_atr': False, 'bear_use_adx': False, 'bear_use_spike': False, 'bear_rsi_required': False, 'sideways_strategy': 'mean_reversion', 'sideways_bb_std_mult': 0.5919195829531647, 'sideways_rsi_os': 15, 'sideways_rsi_ob': 83, 'sideways_adx_thresh': 17.48017682828163, 'sideways_atr_min_pct': 0.02987610993924404, 'sideways_atr_max_pct': 0.033141202734345725, 'sideways_tp_mult': 2.2668008686685948, 'sideways_tsl_mult': 0.007937224605678306, 'sideways_time_stop': 95, 'sideways_use_sma': False, 'sideways_use_ema': False, 'sideways_use_atr': False, 'sideways_use_adx': True, 'sideways_use_spike': False, 'sideways_rsi_required': True}.
