[I 2025-08-31 12:10:52,702] Trial 144 finished with values: [-1000000000.0, 1000000000.0] and parameters: {'p_sma': 29, 'p_std': 14, 'p_atr': 11, 'p_adx': 24, 'rsi_period': 44, 'ema1': 6, 'ema2': 31, 'slip_atr_k': 0.23146434391932755, 'slip_spread_k': 0.20967510874370918, 'spread_hl_frac': 0.02620931560844717, 'bb_std_mult': 1.2866098257303589, 'rsi_os': 9, 'rsi_ob': 74, 'vol_spike': 0.2742789869743567, 'adx_thresh': 23.426636333413292, 'atr_min_pct': 0.026224624462900678, 'atr_max_pct': 0.11748822197267017, 'tp_mult': 2.5950128069941525, 'tsl_mult': 0.4848225111053024, 'strategy': 'mean_reversion', 'time_stop': 91, 'use_sma': True, 'use_atr': True, 'use_adx': False, 'use_ema': False, 'use_spike': True, 'rsi_required': False, 'edge_k': 1.0917450337401444, 'edge_cap': 0.07052609918602104, 'bull_strategy': 'mean_reversion', 'bull_bb_std_mult': 3.225773473958551, 'bull_rsi_os': 13, 'bull_rsi_ob': 82, 'bull_adx_thresh': 8.579469383848076, 'bull_atr_min_pct': 0.015187145705381431, 'bull_atr_max_pct': 0.04066607492157839, 'bull_tp_mult': 2.726156452051506, 'bull_tsl_mult': 0.30200970490690254, 'bull_time_stop': 52, 'bull_use_sma': True, 'bull_use_ema': False, 'bull_use_atr': False, 'bull_use_adx': True, 'bull_use_spike': False, 'bull_rsi_required': True, 'bear_strategy': 'mean_reversion', 'bear_bb_std_mult': 1.8703067556963655, 'bear_rsi_os': 25, 'bear_rsi_ob': 77, 'bear_adx_thresh': 32.629706760658415, 'bear_atr_min_pct': 0.02979330370659769, 'bear_atr_max_pct': 0.03532313993224876, 'bear_tp_mult': 1.3989101013517131, 'bear_tsl_mult': 0.2930715388781262, 'bear_time_stop': 36, 'bear_use_sma': False, 'bear_use_ema': False, 'bear_use_atr': False, 'bear_use_adx': False, 'bear_use_spike': True, 'bear_rsi_required': False, 'sideways_strategy': 'breakout', 'sideways_bb_std_mult': 2.050223873270766, 'sideways_rsi_os': 25, 'sideways_rsi_ob': 68, 'sideways_adx_thresh': 9.354897802376941, 'sideways_atr_min_pct': 0.0021660198459523008, 'sideways_atr_max_pct': 0.14656180004003214, 'sideways_tp_mult': 2.941498331537285, 'sideways_tsl_mult': 0.9052127441856009, 'sideways_time_stop': 183, 'sideways_use_sma': True, 'sideways_use_ema': True, 'sideways_use_atr': True, 'sideways_use_adx': False, 'sideways_use_spike': False, 'sideways_rsi_required': True}.
[I 2025-08-31 12:10:53,453] Trial 145 finished with values: [-1000000000.0, 1000000000.0] and parameters: {'p_sma': 10, 'p_std': 14, 'p_atr': 11, 'p_adx': 15, 'rsi_period': 44, 'ema1': 6, 'ema2': 30, 'slip_atr_k': 0.23438888797469054, 'slip_spread_k': 0.7558945981502864, 'spread_hl_frac': 0.025934979260672994, 'bb_std_mult': 2.2629326726757912, 'rsi_os': 10, 'rsi_ob': 84, 'vol_spike': 0.2357082710626777, 'adx_thresh': 23.355827391909706, 'atr_min_pct': 0.02509162104286279, 'atr_max_pct': 0.12010736713448447, 'tp_mult': 2.5817724816277803, 'tsl_mult': 0.4483617993865535, 'strategy': 'mean_reversion', 'time_stop': 91, 'use_sma': True, 'use_atr': False, 'use_adx': True, 'use_ema': False, 'use_spike': True, 'rsi_required': False, 'edge_k': 0.4981323050215146, 'edge_cap': 0.10479424562695233, 'bull_strategy': 'mean_reversion', 'bull_bb_std_mult': 3.3862214447731525, 'bull_rsi_os': 11, 'bull_rsi_ob': 86, 'bull_adx_thresh': 18.2647314139215, 'bull_atr_min_pct': 0.015185694929767549, 'bull_atr_max_pct': 0.1326226211215115, 'bull_tp_mult': 2.7355225869151663, 'bull_tsl_mult': 0.4119193096885964, 'bull_time_stop': 143, 'bull_use_sma': False, 'bull_use_ema': False, 'bull_use_atr': False, 'bull_use_adx': True, 'bull_use_spike': False, 'bull_rsi_required': True, 'bear_strategy': 'mean_reversion', 'bear_bb_std_mult': 2.7719245633548395, 'bear_rsi_os': 41, 'bear_rsi_ob': 63, 'bear_adx_thresh': 31.571757378222436, 'bear_atr_min_pct': 0.029886313628790878, 'bear_atr_max_pct': 0.09797748990092939, 'bear_tp_mult': 1.5497138571655045, 'bear_tsl_mult': 0.20881162489165894, 'bear_time_stop': 253, 'bear_use_sma': False, 'bear_use_ema': False, 'bear_use_atr': False, 'bear_use_adx': False, 'bear_use_spike': True, 'bear_rsi_required': False, 'sideways_strategy': 'breakout', 'sideways_bb_std_mult': 1.600529149354311, 'sideways_rsi_os': 35, 'sideways_rsi_ob': 45, 'sideways_adx_thresh': 9.398580616694309, 'sideways_atr_min_pct': 0.0037049276291356605, 'sideways_atr_max_pct': 0.07379036619617012, 'sideways_tp_mult': 1.3853216151987187, 'sideways_tsl_mult': 0.4550952370621414, 'sideways_time_stop': 185, 'sideways_use_sma': False, 'sideways_use_ema': True, 'sideways_use_atr': True, 'sideways_use_adx': False, 'sideways_use_spike': False, 'sideways_rsi_required': True}.
[I 2025-08-31 12:11:30,188] Trial 148 finished with values: [-1000000000.0, 1000000000.0] and parameters: {'p_sma': 41, 'p_std': 20, 'p_atr': 10, 'p_adx': 15, 'rsi_period': 81, 'ema1': 5, 'ema2': 39, 'slip_atr_k': 0.21561118116860728, 'slip_spread_k': 0.1833642055708103, 'spread_hl_frac': 0.02290523252649005, 'bb_std_mult': 2.3472432124393374, 'rsi_os': 45, 'rsi_ob': 63, 'vol_spike': 0.257413128459555, 'adx_thresh': 23.036200104096512, 'atr_min_pct': 0.028793635355796054, 'atr_max_pct': 0.12393979876915605, 'tp_mult': 2.9593661580723385, 'tsl_mult': 0.3927082469736468, 'strategy': 'mean_reversion', 'time_stop': 155, 'use_sma': True, 'use_atr': False, 'use_adx': True, 'use_ema': False, 'use_spike': True, 'rsi_required': False, 'edge_k': 1.2020454067059374, 'edge_cap': 0.8112044022292451, 'bull_strategy': 'mean_reversion', 'bull_bb_std_mult': 2.479251247565872, 'bull_rsi_os': 15, 'bull_rsi_ob': 47, 'bull_adx_thresh': 27.252014116622274, 'bull_atr_min_pct': 0.009198027739875015, 'bull_atr_max_pct': 0.014733867147948745, 'bull_tp_mult': 2.7999983891587625, 'bull_tsl_mult': 0.5721075784464826, 'bull_time_stop': 112, 'bull_use_sma': False, 'bull_use_ema': False, 'bull_use_atr': True, 'bull_use_adx': True, 'bull_use_spike': False, 'bull_rsi_required': True, 'bear_strategy': 'mean_reversion', 'bear_bb_std_mult': 2.772651018069389, 'bear_rsi_os': 28, 'bear_rsi_ob': 63, 'bear_adx_thresh': 9.7785741692571, 'bear_atr_min_pct': 0.02996236515482177, 'bear_atr_max_pct': 0.09823269191204034, 'bear_tp_mult': 2.6658567224039467, 'bear_tsl_mult': 0.40229587257565697, 'bear_time_stop': 254, 'bear_use_sma': False, 'bear_use_ema': False, 'bear_use_atr': False, 'bear_use_adx': False, 'bear_use_spike': True, 'bear_rsi_required': False, 'sideways_strategy': 'breakout', 'sideways_bb_std_mult': 3.1188067855607384, 'sideways_rsi_os': 35, 'sideways_rsi_ob': 45, 'sideways_adx_thresh': 26.7442304851618, 'sideways_atr_min_pct': 0.003803685917358575, 'sideways_atr_max_pct': 0.0740977132875229, 'sideways_tp_mult': 1.3894836513183362, 'sideways_tsl_mult': 0.4561814107129811, 'sideways_time_stop': 204, 'sideways_use_sma': False, 'sideways_use_ema': True, 'sideways_use_atr': True, 'sideways_use_adx': False, 'sideways_use_spike': False, 'sideways_rsi_required': True}.
[I 2025-08-31 12:11:30,603] Trial 146 finished with values: [-1000000000.0, 1000000000.0] and parameters: {'p_sma': 32, 'p_std': 20, 'p_atr': 11, 'p_adx': 14, 'rsi_period': 75, 'ema1': 6, 'ema2': 31, 'slip_atr_k': 0.22286092073075953, 'slip_spread_k': 0.18756406996782493, 'spread_hl_frac': 0.025880984620557095, 'bb_std_mult': 1.1577785098313509, 'rsi_os': 9, 'rsi_ob': 58, 'vol_spike': 0.22896907156378601, 'adx_thresh': 23.290405974334902, 'atr_min_pct': 0.01251472482181117, 'atr_max_pct': 0.11965364191121022, 'tp_mult': 1.665059779159391, 'tsl_mult': 0.39576368079080887, 'strategy': 'mean_reversion', 'time_stop': 91, 'use_sma': True, 'use_atr': False, 'use_adx': True, 'use_ema': False, 'use_spike': True, 'rsi_required': False, 'edge_k': 0.500411138420163, 'edge_cap': 0.2650398988724425, 'bull_strategy': 'mean_reversion', 'bull_bb_std_mult': 2.502887718558413, 'bull_rsi_os': 15, 'bull_rsi_ob': 82, 'bull_adx_thresh': 17.840147302823098, 'bull_atr_min_pct': 0.02407750871890315, 'bull_atr_max_pct': 0.14389471269824133, 'bull_tp_mult': 2.807207902247099, 'bull_tsl_mult': 0.375326242668631, 'bull_time_stop': 52, 'bull_use_sma': False, 'bull_use_ema': False, 'bull_use_atr': True, 'bull_use_adx': True, 'bull_use_spike': False, 'bull_rsi_required': True, 'bear_strategy': 'mean_reversion', 'bear_bb_std_mult': 2.7913372922468302, 'bear_rsi_os': 28, 'bear_rsi_ob': 78, 'bear_adx_thresh': 9.29742078409984, 'bear_atr_min_pct': 0.010582519463923466, 'bear_atr_max_pct': 0.09899152120439123, 'bear_tp_mult': 1.7157642675926263, 'bear_tsl_mult': 0.2846720527068061, 'bear_time_stop': 251, 'bear_use_sma': False, 'bear_use_ema': False, 'bear_use_atr': False, 'bear_use_adx': False, 'bear_use_spike': True, 'bear_rsi_required': False, 'sideways_strategy': 'breakout', 'sideways_bb_std_mult': 3.091207357654806, 'sideways_rsi_os': 25, 'sideways_rsi_ob': 45, 'sideways_adx_thresh': 9.441975932837675, 'sideways_atr_min_pct': 0.0038324036207357816, 'sideways_atr_max_pct': 0.13245414684621765, 'sideways_tp_mult': 1.3886505273376812, 'sideways_tsl_mult': 0.582895512624094, 'sideways_time_stop': 185, 'sideways_use_sma': False, 'sideways_use_ema': True, 'sideways_use_atr': True, 'sideways_use_adx': False, 'sideways_use_spike': False, 'sideways_rsi_required': True}.
[I 2025-08-31 12:11:30,741] Trial 149 finished with values: [-1000000000.0, 1000000000.0] and parameters: {'p_sma': 31, 'p_std': 19, 'p_atr': 12, 'p_adx': 14, 'rsi_period': 21, 'ema1': 5, 'ema2': 36, 'slip_atr_k': 0.08165398667145281, 'slip_spread_k': 0.18682794705477826, 'spread_hl_frac': 0.027045455241226563, 'bb_std_mult': 0.6195539258565508, 'rsi_os': 45, 'rsi_ob': 57, 'vol_spike': 0.25650748068238954, 'adx_thresh': 5.902633706043874, 'atr_min_pct': 0.028818097549616416, 'atr_max_pct': 0.08413298202151462, 'tp_mult': 1.2456957805241524, 'tsl_mult': 0.40482836568578495, 'strategy': 'mean_reversion', 'time_stop': 156, 'use_sma': True, 'use_atr': False, 'use_adx': True, 'use_ema': False, 'use_spike': True, 'rsi_required': False, 'edge_k': 1.2000666184779205, 'edge_cap': 0.27240799470841126, 'bull_strategy': 'mean_reversion', 'bull_bb_std_mult': 2.4833752649702445, 'bull_rsi_os': 55, 'bull_rsi_ob': 80, 'bull_adx_thresh': 13.721657669068826, 'bull_atr_min_pct': 0.02411385492733563, 'bull_atr_max_pct': 0.14307334692573553, 'bull_tp_mult': 2.8090140929097758, 'bull_tsl_mult': 0.32358524697598756, 'bull_time_stop': 6, 'bull_use_sma': False, 'bull_use_ema': False, 'bull_use_atr': True, 'bull_use_adx': True, 'bull_use_spike': False, 'bull_rsi_required': True, 'bear_strategy': 'mean_reversion', 'bear_bb_std_mult': 1.7844073914105234, 'bear_rsi_os': 28, 'bear_rsi_ob': 60, 'bear_adx_thresh': 7.674050527657515, 'bear_atr_min_pct': 0.010638875282642823, 'bear_atr_max_pct': 0.09014344809532876, 'bear_tp_mult': 2.11895049635696, 'bear_tsl_mult': 0.3844825699731736, 'bear_time_stop': 250, 'bear_use_sma': False, 'bear_use_ema': False, 'bear_use_atr': False, 'bear_use_adx': False, 'bear_use_spike': True, 'bear_rsi_required': False, 'sideways_strategy': 'breakout', 'sideways_bb_std_mult': 3.386726374419637, 'sideways_rsi_os': 13, 'sideways_rsi_ob': 47, 'sideways_adx_thresh': 26.947824660243562, 'sideways_atr_min_pct': 0.00017677927127114808, 'sideways_atr_max_pct': 0.05941312971166997, 'sideways_tp_mult': 1.2648034593987714, 'sideways_tsl_mult': 0.40964956720826357, 'sideways_time_stop': 253, 'sideways_use_sma': False, 'sideways_use_ema': True, 'sideways_use_atr': True, 'sideways_use_adx': False, 'sideways_use_spike': False, 'sideways_rsi_required': True}.
[I 2025-08-31 12:11:30,833] Trial 147 finished with values: [-1000000000.0, 1000000000.0] and parameters: {'p_sma': 32, 'p_std': 19, 'p_atr': 11, 'p_adx': 14, 'rsi_period': 68, 'ema1': 6, 'ema2': 32, 'slip_atr_k': 0.08006053774268837, 'slip_spread_k': 0.6642289121783493, 'spread_hl_frac': 0.025960773685167877, 'bb_std_mult': 1.1261806371856704, 'rsi_os': 45, 'rsi_ob': 58, 'vol_spike': 0.27458795626311994, 'adx_thresh': 23.088201498772598, 'atr_min_pct': 0.02523061614685228, 'atr_max_pct': 0.05883894787196206, 'tp_mult': 1.680422773656014, 'tsl_mult': 0.40148872885253933, 'strategy': 'mean_reversion', 'time_stop': 90, 'use_sma': True, 'use_atr': False, 'use_adx': True, 'use_ema': False, 'use_spike': True, 'rsi_required': False, 'edge_k': 1.1895290638032927, 'edge_cap': 0.2665804531750564, 'bull_strategy': 'mean_reversion', 'bull_bb_std_mult': 3.2507152534310677, 'bull_rsi_os': 12, 'bull_rsi_ob': 82, 'bull_adx_thresh': 17.59304067948972, 'bull_atr_min_pct': 0.02430163124153817, 'bull_atr_max_pct': 0.1327926776605901, 'bull_tp_mult': 2.5734679994538245, 'bull_tsl_mult': 0.3198703789053501, 'bull_time_stop': 209, 'bull_use_sma': False, 'bull_use_ema': False, 'bull_use_atr': True, 'bull_use_adx': True, 'bull_use_spike': False, 'bull_rsi_required': True, 'bear_strategy': 'mean_reversion', 'bear_bb_std_mult': 1.8039730349322451, 'bear_rsi_os': 28, 'bear_rsi_ob': 63, 'bear_adx_thresh': 9.252554929679144, 'bear_atr_min_pct': 0.010845200348827428, 'bear_atr_max_pct': 0.09851363323963593, 'bear_tp_mult': 1.5397998920537876, 'bear_tsl_mult': 0.20570666803313514, 'bear_time_stop': 32, 'bear_use_sma': False, 'bear_use_ema': False, 'bear_use_atr': False, 'bear_use_adx': False, 'bear_use_spike': True, 'bear_rsi_required': False, 'sideways_strategy': 'breakout', 'sideways_bb_std_mult': 1.6137503868312881, 'sideways_rsi_os': 35, 'sideways_rsi_ob': 69, 'sideways_adx_thresh': 9.435049484268875, 'sideways_atr_min_pct': 0.0036578769164370226, 'sideways_atr_max_pct': 0.04721538421092367, 'sideways_tp_mult': 1.3908760694588387, 'sideways_tsl_mult': 0.45305533455138997, 'sideways_time_stop': 96, 'sideways_use_sma': False, 'sideways_use_ema': True, 'sideways_use_atr': True, 'sideways_use_adx': False, 'sideways_use_spike': False, 'sideways_rsi_required': True}.
[I 2025-08-31 12:12:02,859] Trial 152 finished with values: [-0.08884611632875383, 0.08863755010980008] and parameters: {'p_sma': 37, 'p_std': 44, 'p_atr': 23, 'p_adx': 18, 'rsi_period': 68, 'ema1': 30, 'ema2': 37, 'slip_atr_k': 0.17381813183870465, 'slip_spread_k': 0.2612127390060119, 'spread_hl_frac': 0.03340505165993355, 'bb_std_mult': 3.5108780613652164, 'rsi_os': 48, 'rsi_ob': 61, 'vol_spike': 0.24926089853689887, 'adx_thresh': 16.832035774886087, 'atr_min_pct': 0.02723496286134606, 'atr_max_pct': 0.0715854284986772, 'tp_mult': 2.66001803804434, 'tsl_mult': 0.5455084670614841, 'strategy': 'mean_reversion', 'time_stop': 103, 'use_sma': True, 'use_atr': False, 'use_adx': True, 'use_ema': False, 'use_spike': True, 'rsi_required': False, 'edge_k': 0.19770621532101562, 'edge_cap': 0.3027852565584471, 'bull_strategy': 'mean_reversion', 'bull_bb_std_mult': 3.313983304888561, 'bull_rsi_os': 11, 'bull_rsi_ob': 91, 'bull_adx_thresh': 21.951692401098654, 'bull_atr_min_pct': 0.025748503725760246, 'bull_atr_max_pct': 0.07690377522568138, 'bull_tp_mult': 1.5872010668432868, 'bull_tsl_mult': 0.1673696619108243, 'bull_time_stop': 124, 'bull_use_sma': False, 'bull_use_ema': False, 'bull_use_atr': False, 'bull_use_adx': True, 'bull_use_spike': False, 'bull_rsi_required': True, 'bear_strategy': 'mean_reversion', 'bear_bb_std_mult': 1.2707076727481177, 'bear_rsi_os': 21, 'bear_rsi_ob': 87, 'bear_adx_thresh': 33.4453330316822, 'bear_atr_min_pct': 0.028944200990332146, 'bear_atr_max_pct': 0.12486325364253786, 'bear_tp_mult': 1.8153393738299834, 'bear_tsl_mult': 0.10690345388733913, 'bear_time_stop': 233, 'bear_use_sma': False, 'bear_use_ema': False, 'bear_use_atr': False, 'bear_use_adx': False, 'bear_use_spike': True, 'bear_rsi_required': False, 'sideways_strategy': 'breakout', 'sideways_bb_std_mult': 1.8553719995481028, 'sideways_rsi_os': 42, 'sideways_rsi_ob': 69, 'sideways_adx_thresh': 19.986412293893878, 'sideways_atr_min_pct': 0.0007383557201723237, 'sideways_atr_max_pct': 0.02150603687561757, 'sideways_tp_mult': 1.325420801661897, 'sideways_tsl_mult': 0.48896476822379725, 'sideways_time_stop': 193, 'sideways_use_sma': False, 'sideways_use_ema': True, 'sideways_use_atr': True, 'sideways_use_adx': False, 'sideways_use_spike': False, 'sideways_rsi_required': True}.
[I 2025-08-31 12:12:03,115] Trial 151 finished with values: [-0.27822099887589036, 0.27811537939669234] and parameters: {'p_sma': 37, 'p_std': 13, 'p_atr': 13, 'p_adx': 23, 'rsi_period': 68, 'ema1': 18, 'ema2': 37, 'slip_atr_k': 0.07921345865712266, 'slip_spread_k': 0.023327326209212518, 'spread_hl_frac': 0.03305982581468759, 'bb_std_mult': 1.530531507311804, 'rsi_os': 48, 'rsi_ob': 94, 'vol_spike': 0.029386340697625996, 'adx_thresh': 10.962595725064489, 'atr_min_pct': 0.02716469314909198, 'atr_max_pct': 0.08323491873006603, 'tp_mult': 2.639009850096216, 'tsl_mult': 0.45011128389493743, 'strategy': 'mean_reversion', 'time_stop': 101, 'use_sma': True, 'use_atr': False, 'use_adx': True, 'use_ema': False, 'use_spike': True, 'rsi_required': False, 'edge_k': 0.24736742930571542, 'edge_cap': 0.24058125121332558, 'bull_strategy': 'mean_reversion', 'bull_bb_std_mult': 3.298558836841622, 'bull_rsi_os': 8, 'bull_rsi_ob': 80, 'bull_adx_thresh': 7.507523624149211, 'bull_atr_min_pct': 0.025815043973050466, 'bull_atr_max_pct': 0.0779565852193649, 'bull_tp_mult': 2.389765973239588, 'bull_tsl_mult': 0.44800696211250046, 'bull_time_stop': 88, 'bull_use_sma': False, 'bull_use_ema': False, 'bull_use_atr': False, 'bull_use_adx': True, 'bull_use_spike': False, 'bull_rsi_required': True, 'bear_strategy': 'mean_reversion', 'bear_bb_std_mult': 0.7126558611269187, 'bear_rsi_os': 21, 'bear_rsi_ob': 87, 'bear_adx_thresh': 24.908609459600385, 'bear_atr_min_pct': 0.028625904968860635, 'bear_atr_max_pct': 0.08972679088870986, 'bear_tp_mult': 2.1270186569737635, 'bear_tsl_mult': 0.24835464497216708, 'bear_time_stop': 233, 'bear_use_sma': False, 'bear_use_ema': False, 'bear_use_atr': False, 'bear_use_adx': False, 'bear_use_spike': True, 'bear_rsi_required': False, 'sideways_strategy': 'breakout', 'sideways_bb_std_mult': 2.758290561067546, 'sideways_rsi_os': 48, 'sideways_rsi_ob': 47, 'sideways_adx_thresh': 19.897382721449567, 'sideways_atr_min_pct': 4.137660553692711e-05, 'sideways_atr_max_pct': 0.06001146954455219, 'sideways_tp_mult': 1.3223813833246343, 'sideways_tsl_mult': 0.04205091662295163, 'sideways_time_stop': 91, 'sideways_use_sma': False, 'sideways_use_ema': True, 'sideways_use_atr': True, 'sideways_use_adx': False, 'sideways_use_spike': False, 'sideways_rsi_required': True}.
[I 2025-08-31 12:12:03,201] Trial 150 finished with values: [-0.16289703869401384, 0.1628147373259544] and parameters: {'p_sma': 31, 'p_std': 51, 'p_atr': 29, 'p_adx': 14, 'rsi_period': 20, 'ema1': 20, 'ema2': 43, 'slip_atr_k': 0.06591710085723561, 'slip_spread_k': 0.8155330740809326, 'spread_hl_frac': 0.024598649826385086, 'bb_std_mult': 2.559414697526784, 'rsi_os': 42, 'rsi_ob': 57, 'vol_spike': 0.24966287519825142, 'adx_thresh': 11.361956437465318, 'atr_min_pct': 0.023505153682831126, 'atr_max_pct': 0.08102688680494216, 'tp_mult': 2.747602639466106, 'tsl_mult': 0.41347180192861976, 'strategy': 'mean_reversion', 'time_stop': 99, 'use_sma': True, 'use_atr': False, 'use_adx': True, 'use_ema': False, 'use_spike': True, 'rsi_required': False, 'edge_k': 1.2544821517915012, 'edge_cap': 0.2703659331188486, 'bull_strategy': 'mean_reversion', 'bull_bb_std_mult': 2.8022466502877608, 'bull_rsi_os': 31, 'bull_rsi_ob': 80, 'bull_adx_thresh': 17.382458989809464, 'bull_atr_min_pct': 0.02407649681056559, 'bull_atr_max_pct': 0.03521684939534924, 'bull_tp_mult': 2.3210761396169874, 'bull_tsl_mult': 0.3206470001771726, 'bull_time_stop': 122, 'bull_use_sma': False, 'bull_use_ema': False, 'bull_use_atr': True, 'bull_use_adx': True, 'bull_use_spike': False, 'bull_rsi_required': True, 'bear_strategy': 'mean_reversion', 'bear_bb_std_mult': 1.8235259342362877, 'bear_rsi_os': 24, 'bear_rsi_ob': 60, 'bear_adx_thresh': 27.400529527037065, 'bear_atr_min_pct': 0.010854964323343414, 'bear_atr_max_pct': 0.12251506090026353, 'bear_tp_mult': 1.7998422704539225, 'bear_tsl_mult': 0.45842577931752293, 'bear_time_stop': 279, 'bear_use_sma': False, 'bear_use_ema': False, 'bear_use_atr': False, 'bear_use_adx': False, 'bear_use_spike': True, 'bear_rsi_required': False, 'sideways_strategy': 'breakout', 'sideways_bb_std_mult': 2.7832000245367445, 'sideways_rsi_os': 49, 'sideways_rsi_ob': 47, 'sideways_adx_thresh': 32.165525775767904, 'sideways_atr_min_pct': 0.000935038663816379, 'sideways_atr_max_pct': 0.05949887131878942, 'sideways_tp_mult': 1.5151582728024655, 'sideways_tsl_mult': 0.4201660667332449, 'sideways_time_stop': 85, 'sideways_use_sma': False, 'sideways_use_ema': True, 'sideways_use_atr': True, 'sideways_use_adx': False, 'sideways_use_spike': False, 'sideways_rsi_required': True}.
