[I 2025-08-31 13:27:02,284] Trial 711 finished with values: [-1000000000.0, 1000000000.0] and parameters: {'p_sma': 27, 'p_std': 13, 'p_atr': 15, 'p_adx': 14, 'rsi_period': 49, 'ema1': 9, 'ema2': 21, 'slip_atr_k': 0.15385374860985193, 'slip_spread_k': 0.5874642267050865, 'spread_hl_frac': 0.01680864199508056, 'bb_std_mult': 3.2847602739099977, 'rsi_os': 31, 'rsi_ob': 89, 'vol_spike': 0.1482946361764759, 'adx_thresh': 9.31212690643094, 'atr_min_pct': 0.025795890953385674, 'atr_max_pct': 0.039068391670929375, 'tp_mult': 2.5779090925886483, 'tsl_mult': 0.6974592773208796, 'strategy': 'breakout', 'time_stop': 178, 'use_sma': False, 'use_atr': False, 'use_adx': True, 'use_ema': True, 'use_spike': True, 'rsi_required': False, 'edge_k': 0.6152716322554135, 'edge_cap': 0.628240852156046, 'bull_strategy': 'mean_reversion', 'bull_bb_std_mult': 1.0681539376965035, 'bull_rsi_os': 15, 'bull_rsi_ob': 85, 'bull_adx_thresh': 18.0666509413105, 'bull_atr_min_pct': 0.022273967917932336, 'bull_atr_max_pct': 0.13967933164862964, 'bull_tp_mult': 2.403448126494638, 'bull_tsl_mult': 0.24193430851861422, 'bull_time_stop': 175, 'bull_use_sma': True, 'bull_use_ema': True, 'bull_use_atr': True, 'bull_use_adx': True, 'bull_use_spike': True, 'bull_rsi_required': True, 'bear_strategy': 'breakout', 'bear_bb_std_mult': 3.315938847104455, 'bear_rsi_os': 30, 'bear_rsi_ob': 70, 'bear_adx_thresh': 9.905033459015696, 'bear_atr_min_pct': 0.0015101993854351233, 'bear_atr_max_pct': 0.1108105667979172, 'bear_tp_mult': 1.4563900993931735, 'bear_tsl_mult': 0.720001934560481, 'bear_time_stop': 191, 'bear_use_sma': False, 'bear_use_ema': True, 'bear_use_atr': False, 'bear_use_adx': False, 'bear_use_spike': True, 'bear_rsi_required': True, 'sideways_strategy': 'mean_reversion', 'sideways_bb_std_mult': 2.274480334166194, 'sideways_rsi_os': 22, 'sideways_rsi_ob': 67, 'sideways_adx_thresh': 23.874582212443602, 'sideways_atr_min_pct': 0.015051201507262595, 'sideways_atr_max_pct': 0.13891319395756835, 'sideways_tp_mult': 1.673769733774434, 'sideways_tsl_mult': 0.726606957150789, 'sideways_time_stop': 57, 'sideways_use_sma': False, 'sideways_use_ema': False, 'sideways_use_atr': True, 'sideways_use_adx': True, 'sideways_use_spike': False, 'sideways_rsi_required': True}.
[I 2025-08-31 13:27:33,777] Trial 713 finished with values: [-1000000000.0, 1000000000.0] and parameters: {'p_sma': 35, 'p_std': 20, 'p_atr': 15, 'p_adx': 13, 'rsi_period': 43, 'ema1': 7, 'ema2': 21, 'slip_atr_k': 0.19507419974510432, 'slip_spread_k': 0.4285690293681541, 'spread_hl_frac': 0.019422315589569635, 'bb_std_mult': 2.3097310600857655, 'rsi_os': 41, 'rsi_ob': 83, 'vol_spike': 0.024961606467191918, 'adx_thresh': 8.93177026106052, 'atr_min_pct': 0.02922372449350718, 'atr_max_pct': 0.03662068971033191, 'tp_mult': 2.579846881598025, 'tsl_mult': 0.585631948789349, 'strategy': 'breakout', 'time_stop': 177, 'use_sma': True, 'use_atr': False, 'use_adx': True, 'use_ema': True, 'use_spike': True, 'rsi_required': False, 'edge_k': 0.5145272816255057, 'edge_cap': 0.995499097301924, 'bull_strategy': 'mean_reversion', 'bull_bb_std_mult': 1.0704188043483018, 'bull_rsi_os': 16, 'bull_rsi_ob': 83, 'bull_adx_thresh': 27.85746581731316, 'bull_atr_min_pct': 0.015003700018102077, 'bull_atr_max_pct': 0.13991197503994343, 'bull_tp_mult': 2.427961051266234, 'bull_tsl_mult': 0.24577124635117042, 'bull_time_stop': 151, 'bull_use_sma': True, 'bull_use_ema': True, 'bull_use_atr': True, 'bull_use_adx': True, 'bull_use_spike': True, 'bull_rsi_required': True, 'bear_strategy': 'mean_reversion', 'bear_bb_std_mult': 2.5866768282253845, 'bear_rsi_os': 22, 'bear_rsi_ob': 70, 'bear_adx_thresh': 25.89061351325468, 'bear_atr_min_pct': 0.0014024268240519391, 'bear_atr_max_pct': 0.12732998008259921, 'bear_tp_mult': 1.3495909174428495, 'bear_tsl_mult': 0.6915846935292937, 'bear_time_stop': 191, 'bear_use_sma': False, 'bear_use_ema': False, 'bear_use_atr': False, 'bear_use_adx': False, 'bear_use_spike': True, 'bear_rsi_required': False, 'sideways_strategy': 'breakout', 'sideways_bb_std_mult': 0.5046219593399712, 'sideways_rsi_os': 11, 'sideways_rsi_ob': 67, 'sideways_adx_thresh': 5.004701808635183, 'sideways_atr_min_pct': 0.005952236901337353, 'sideways_atr_max_pct': 0.13865827511301607, 'sideways_tp_mult': 2.9368664931768307, 'sideways_tsl_mult': 0.2018788356484536, 'sideways_time_stop': 56, 'sideways_use_sma': False, 'sideways_use_ema': False, 'sideways_use_atr': True, 'sideways_use_adx': True, 'sideways_use_spike': False, 'sideways_rsi_required': True}.
[I 2025-08-31 13:27:34,214] Trial 712 finished with values: [-1000000000.0, 1000000000.0] and parameters: {'p_sma': 6, 'p_std': 21, 'p_atr': 15, 'p_adx': 13, 'rsi_period': 20, 'ema1': 10, 'ema2': 21, 'slip_atr_k': 0.15518021467027301, 'slip_spread_k': 0.427940881825217, 'spread_hl_frac': 0.01658574665818069, 'bb_std_mult': 2.2990550570711044, 'rsi_os': 34, 'rsi_ob': 83, 'vol_spike': 0.026238972552124245, 'adx_thresh': 9.214592460651449, 'atr_min_pct': 0.028470953649636185, 'atr_max_pct': 0.04914601024421719, 'tp_mult': 2.5744922821485376, 'tsl_mult': 0.9221278063720835, 'strategy': 'breakout', 'time_stop': 177, 'use_sma': False, 'use_atr': False, 'use_adx': True, 'use_ema': True, 'use_spike': True, 'rsi_required': False, 'edge_k': 0.5406947917551906, 'edge_cap': 0.5974446257205422, 'bull_strategy': 'mean_reversion', 'bull_bb_std_mult': 1.0543703763319945, 'bull_rsi_os': 15, 'bull_rsi_ob': 83, 'bull_adx_thresh': 18.162902442397566, 'bull_atr_min_pct': 0.028278885788266917, 'bull_atr_max_pct': 0.13307111884645254, 'bull_tp_mult': 2.5674464807311024, 'bull_tsl_mult': 0.2397047439611941, 'bull_time_stop': 154, 'bull_use_sma': True, 'bull_use_ema': True, 'bull_use_atr': True, 'bull_use_adx': True, 'bull_use_spike': True, 'bull_rsi_required': True, 'bear_strategy': 'mean_reversion', 'bear_bb_std_mult': 2.603676389552138, 'bear_rsi_os': 47, 'bear_rsi_ob': 71, 'bear_adx_thresh': 19.514492859905936, 'bear_atr_min_pct': 0.0013591733212294076, 'bear_atr_max_pct': 0.1275612103531964, 'bear_tp_mult': 1.24112258527023, 'bear_tsl_mult': 0.6885283658984576, 'bear_time_stop': 188, 'bear_use_sma': False, 'bear_use_ema': False, 'bear_use_atr': False, 'bear_use_adx': False, 'bear_use_spike': True, 'bear_rsi_required': False, 'sideways_strategy': 'breakout', 'sideways_bb_std_mult': 1.0689432285463316, 'sideways_rsi_os': 11, 'sideways_rsi_ob': 66, 'sideways_adx_thresh': 24.028498266055912, 'sideways_atr_min_pct': 0.018170150099020482, 'sideways_atr_max_pct': 0.13890601482398401, 'sideways_tp_mult': 1.691738031790007, 'sideways_tsl_mult': 0.8973715513258322, 'sideways_time_stop': 59, 'sideways_use_sma': False, 'sideways_use_ema': False, 'sideways_use_atr': True, 'sideways_use_adx': True, 'sideways_use_spike': False, 'sideways_rsi_required': True}.
[I 2025-08-31 13:27:34,806] Trial 715 finished with values: [-1000000000.0, 1000000000.0] and parameters: {'p_sma': 44, 'p_std': 20, 'p_atr': 16, 'p_adx': 13, 'rsi_period': 44, 'ema1': 10, 'ema2': 18, 'slip_atr_k': 0.041776286605431145, 'slip_spread_k': 0.3728224467816615, 'spread_hl_frac': 0.019209049527834126, 'bb_std_mult': 2.3158821305710258, 'rsi_os': 33, 'rsi_ob': 94, 'vol_spike': 0.02593912465500346, 'adx_thresh': 5.720925887934898, 'atr_min_pct': 0.02831679684659699, 'atr_max_pct': 0.04983102216176905, 'tp_mult': 2.4513631302185654, 'tsl_mult': 0.9146895747767567, 'strategy': 'breakout', 'time_stop': 240, 'use_sma': True, 'use_atr': False, 'use_adx': True, 'use_ema': False, 'use_spike': True, 'rsi_required': False, 'edge_k': 1.9957871220263286, 'edge_cap': 0.6943430929910196, 'bull_strategy': 'mean_reversion', 'bull_bb_std_mult': 2.8144503499495515, 'bull_rsi_os': 5, 'bull_rsi_ob': 83, 'bull_adx_thresh': 34.97403424423039, 'bull_atr_min_pct': 0.023798888622821066, 'bull_atr_max_pct': 0.1294728102376468, 'bull_tp_mult': 2.514938492995079, 'bull_tsl_mult': 0.29700401446365265, 'bull_time_stop': 189, 'bull_use_sma': True, 'bull_use_ema': True, 'bull_use_atr': True, 'bull_use_adx': True, 'bull_use_spike': True, 'bull_rsi_required': True, 'bear_strategy': 'mean_reversion', 'bear_bb_std_mult': 3.339005711882921, 'bear_rsi_os': 28, 'bear_rsi_ob': 72, 'bear_adx_thresh': 25.95678860311564, 'bear_atr_min_pct': 0.0007975378721121521, 'bear_atr_max_pct': 0.1281256484485978, 'bear_tp_mult': 1.5240444773080666, 'bear_tsl_mult': 0.6751688320274072, 'bear_time_stop': 199, 'bear_use_sma': False, 'bear_use_ema': False, 'bear_use_atr': False, 'bear_use_adx': False, 'bear_use_spike': True, 'bear_rsi_required': False, 'sideways_strategy': 'breakout', 'sideways_bb_std_mult': 1.0849314132510073, 'sideways_rsi_os': 11, 'sideways_rsi_ob': 59, 'sideways_adx_thresh': 24.076893704491305, 'sideways_atr_min_pct': 0.006063357984047188, 'sideways_atr_max_pct': 0.14346313781898712, 'sideways_tp_mult': 1.671089169208521, 'sideways_tsl_mult': 0.8817972600222664, 'sideways_time_stop': 59, 'sideways_use_sma': False, 'sideways_use_ema': True, 'sideways_use_atr': True, 'sideways_use_adx': True, 'sideways_use_spike': False, 'sideways_rsi_required': True}.
[I 2025-08-31 13:27:35,004] Trial 714 finished with values: [-1000000000.0, 1000000000.0] and parameters: {'p_sma': 27, 'p_std': 20, 'p_atr': 16, 'p_adx': 13, 'rsi_period': 41, 'ema1': 8, 'ema2': 21, 'slip_atr_k': 0.04205607071069713, 'slip_spread_k': 0.3712214877908107, 'spread_hl_frac': 0.03695897830655707, 'bb_std_mult': 2.302931485067717, 'rsi_os': 5, 'rsi_ob': 82, 'vol_spike': 0.025294409838856998, 'adx_thresh': 9.318875532703006, 'atr_min_pct': 0.02872853942703682, 'atr_max_pct': 0.05015259391796263, 'tp_mult': 2.5852319542504554, 'tsl_mult': 0.6100518062965613, 'strategy': 'breakout', 'time_stop': 227, 'use_sma': True, 'use_atr': False, 'use_adx': True, 'use_ema': True, 'use_spike': True, 'rsi_required': False, 'edge_k': 0.38004571848394086, 'edge_cap': 0.549337762742673, 'bull_strategy': 'mean_reversion', 'bull_bb_std_mult': 2.799981602168867, 'bull_rsi_os': 5, 'bull_rsi_ob': 83, 'bull_adx_thresh': 18.17573931392587, 'bull_atr_min_pct': 0.023503870133468597, 'bull_atr_max_pct': 0.1394444393191016, 'bull_tp_mult': 2.388535219751821, 'bull_tsl_mult': 0.8784227765342878, 'bull_time_stop': 218, 'bull_use_sma': True, 'bull_use_ema': True, 'bull_use_atr': True, 'bull_use_adx': True, 'bull_use_spike': True, 'bull_rsi_required': True, 'bear_strategy': 'mean_reversion', 'bear_bb_std_mult': 2.5990883059876153, 'bear_rsi_os': 21, 'bear_rsi_ob': 72, 'bear_adx_thresh': 9.665837836371677, 'bear_atr_min_pct': 0.0013813527654174616, 'bear_atr_max_pct': 0.12256291943605044, 'bear_tp_mult': 1.5289844503698924, 'bear_tsl_mult': 0.6880991488940411, 'bear_time_stop': 191, 'bear_use_sma': False, 'bear_use_ema': False, 'bear_use_atr': False, 'bear_use_adx': False, 'bear_use_spike': True, 'bear_rsi_required': False, 'sideways_strategy': 'breakout', 'sideways_bb_std_mult': 2.7554018837344807, 'sideways_rsi_os': 22, 'sideways_rsi_ob': 67, 'sideways_adx_thresh': 24.027011039694795, 'sideways_atr_min_pct': 0.006742303096875983, 'sideways_atr_max_pct': 0.13902435877178526, 'sideways_tp_mult': 1.668228658496654, 'sideways_tsl_mult': 0.2016717691733752, 'sideways_time_stop': 25, 'sideways_use_sma': False, 'sideways_use_ema': True, 'sideways_use_atr': True, 'sideways_use_adx': True, 'sideways_use_spike': False, 'sideways_rsi_required': True}.
[I 2025-08-31 13:28:09,162] Trial 719 finished with values: [-1000000000.0, 1000000000.0] and parameters: {'p_sma': 40, 'p_std': 35, 'p_atr': 14, 'p_adx': 25, 'rsi_period': 47, 'ema1': 8, 'ema2': 18, 'slip_atr_k': 0.0480370747221553, 'slip_spread_k': 0.4139912517960901, 'spread_hl_frac': 0.019431156800356786, 'bb_std_mult': 0.67220682832803, 'rsi_os': 38, 'rsi_ob': 92, 'vol_spike': 0.017858574235576186, 'adx_thresh': 10.384268901751984, 'atr_min_pct': 0.02324067371995555, 'atr_max_pct': 0.06217203412321605, 'tp_mult': 2.48196064535608, 'tsl_mult': 0.7379677303174783, 'strategy': 'breakout', 'time_stop': 170, 'use_sma': False, 'use_atr': False, 'use_adx': True, 'use_ema': False, 'use_spike': True, 'rsi_required': False, 'edge_k': 0.16264684859363254, 'edge_cap': 0.6923550532376233, 'bull_strategy': 'mean_reversion', 'bull_bb_std_mult': 2.712783070256284, 'bull_rsi_os': 37, 'bull_rsi_ob': 91, 'bull_adx_thresh': 18.837123612331652, 'bull_atr_min_pct': 0.020882435441729415, 'bull_atr_max_pct': 0.026838821956772937, 'bull_tp_mult': 2.1378149754237072, 'bull_tsl_mult': 0.2752819933297547, 'bull_time_stop': 178, 'bull_use_sma': False, 'bull_use_ema': False, 'bull_use_atr': True, 'bull_use_adx': True, 'bull_use_spike': True, 'bull_rsi_required': True, 'bear_strategy': 'breakout', 'bear_bb_std_mult': 3.4915244235598237, 'bear_rsi_os': 25, 'bear_rsi_ob': 74, 'bear_adx_thresh': 20.881317950976804, 'bear_atr_min_pct': 0.0007025106181929822, 'bear_atr_max_pct': 0.012775934845313378, 'bear_tp_mult': 1.2105090578594264, 'bear_tsl_mult': 0.21328011270615332, 'bear_time_stop': 115, 'bear_use_sma': False, 'bear_use_ema': True, 'bear_use_atr': False, 'bear_use_adx': False, 'bear_use_spike': True, 'bear_rsi_required': True, 'sideways_strategy': 'breakout', 'sideways_bb_std_mult': 1.2971952414900145, 'sideways_rsi_os': 39, 'sideways_rsi_ob': 63, 'sideways_adx_thresh': 24.58777005712043, 'sideways_atr_min_pct': 0.024095389086024585, 'sideways_atr_max_pct': 0.14508285124329678, 'sideways_tp_mult': 1.761168603239695, 'sideways_tsl_mult': 0.891353923457386, 'sideways_time_stop': 6, 'sideways_use_sma': False, 'sideways_use_ema': False, 'sideways_use_atr': True, 'sideways_use_adx': True, 'sideways_use_spike': False, 'sideways_rsi_required': False}.
[I 2025-08-31 13:28:09,415] Trial 716 finished with values: [-1000000000.0, 1000000000.0] and parameters: {'p_sma': 25, 'p_std': 21, 'p_atr': 14, 'p_adx': 13, 'rsi_period': 41, 'ema1': 8, 'ema2': 18, 'slip_atr_k': 0.04152686023165468, 'slip_spread_k': 0.3738594534512497, 'spread_hl_frac': 0.016063785424583785, 'bb_std_mult': 2.208630228151801, 'rsi_os': 38, 'rsi_ob': 93, 'vol_spike': 0.016666984088287456, 'adx_thresh': 7.299268664100002, 'atr_min_pct': 0.028586529582702466, 'atr_max_pct': 0.06423168246881832, 'tp_mult': 2.4377826953291057, 'tsl_mult': 0.9204059380706254, 'strategy': 'breakout', 'time_stop': 228, 'use_sma': False, 'use_atr': False, 'use_adx': True, 'use_ema': False, 'use_spike': True, 'rsi_required': False, 'edge_k': 1.994431470519475, 'edge_cap': 0.6946884761308265, 'bull_strategy': 'mean_reversion', 'bull_bb_std_mult': 1.4304168329860076, 'bull_rsi_os': 5, 'bull_rsi_ob': 87, 'bull_adx_thresh': 32.28277095947185, 'bull_atr_min_pct': 0.02087946217963801, 'bull_atr_max_pct': 0.1288606073081549, 'bull_tp_mult': 2.5109372590705057, 'bull_tsl_mult': 0.2928739581946327, 'bull_time_stop': 189, 'bull_use_sma': True, 'bull_use_ema': True, 'bull_use_atr': True, 'bull_use_adx': True, 'bull_use_spike': True, 'bull_rsi_required': True, 'bear_strategy': 'mean_reversion', 'bear_bb_std_mult': 3.3599672873867883, 'bear_rsi_os': 27, 'bear_rsi_ob': 72, 'bear_adx_thresh': 18.678257897888393, 'bear_atr_min_pct': 0.0007879727082581623, 'bear_atr_max_pct': 0.12239075480178223, 'bear_tp_mult': 1.5251894493005616, 'bear_tsl_mult': 0.6950582601022611, 'bear_time_stop': 199, 'bear_use_sma': False, 'bear_use_ema': False, 'bear_use_atr': False, 'bear_use_adx': False, 'bear_use_spike': True, 'bear_rsi_required': False, 'sideways_strategy': 'breakout', 'sideways_bb_std_mult': 1.6924754978996717, 'sideways_rsi_os': 29, 'sideways_rsi_ob': 59, 'sideways_adx_thresh': 24.39190257384422, 'sideways_atr_min_pct': 0.0035954687280708364, 'sideways_atr_max_pct': 0.14483190134458335, 'sideways_tp_mult': 1.6722200669109615, 'sideways_tsl_mult': 0.0001631441870561523, 'sideways_time_stop': 35, 'sideways_use_sma': False, 'sideways_use_ema': True, 'sideways_use_atr': True, 'sideways_use_adx': True, 'sideways_use_spike': False, 'sideways_rsi_required': True}.
[I 2025-08-31 13:28:09,643] Trial 717 finished with values: [-1000000000.0, 1000000000.0] and parameters: {'p_sma': 12, 'p_std': 20, 'p_atr': 14, 'p_adx': 9, 'rsi_period': 41, 'ema1': 8, 'ema2': 18, 'slip_atr_k': 0.04325729695185364, 'slip_spread_k': 0.3711796331390972, 'spread_hl_frac': 0.0026019073664340225, 'bb_std_mult': 0.6369811024557424, 'rsi_os': 38, 'rsi_ob': 82, 'vol_spike': 0.018362333373020862, 'adx_thresh': 10.314061148798643, 'atr_min_pct': 0.018471046123101582, 'atr_max_pct': 0.05059945021591169, 'tp_mult': 2.4608862371932356, 'tsl_mult': 0.7498145785220791, 'strategy': 'breakout', 'time_stop': 296, 'use_sma': True, 'use_atr': False, 'use_adx': True, 'use_ema': False, 'use_spike': True, 'rsi_required': False, 'edge_k': 0.4013323231735727, 'edge_cap': 0.6966132196130781, 'bull_strategy': 'mean_reversion', 'bull_bb_std_mult': 2.7155513766097457, 'bull_rsi_os': 5, 'bull_rsi_ob': 91, 'bull_adx_thresh': 32.355286983974814, 'bull_atr_min_pct': 0.007747768799589794, 'bull_atr_max_pct': 0.12899435570326762, 'bull_tp_mult': 2.1291885822366052, 'bull_tsl_mult': 0.2881205271336983, 'bull_time_stop': 189, 'bull_use_sma': True, 'bull_use_ema': True, 'bull_use_atr': True, 'bull_use_adx': True, 'bull_use_spike': True, 'bull_rsi_required': True, 'bear_strategy': 'breakout', 'bear_bb_std_mult': 3.3403545605801725, 'bear_rsi_os': 29, 'bear_rsi_ob': 72, 'bear_adx_thresh': 20.76461178324631, 'bear_atr_min_pct': 0.022262718767898166, 'bear_atr_max_pct': 0.12270733933407507, 'bear_tp_mult': 1.1951826533679166, 'bear_tsl_mult': 0.6203545941756587, 'bear_time_stop': 112, 'bear_use_sma': False, 'bear_use_ema': True, 'bear_use_atr': False, 'bear_use_adx': False, 'bear_use_spike': True, 'bear_rsi_required': True, 'sideways_strategy': 'breakout', 'sideways_bb_std_mult': 2.8743047967246014, 'sideways_rsi_os': 20, 'sideways_rsi_ob': 62, 'sideways_adx_thresh': 24.506337826578644, 'sideways_atr_min_pct': 0.0036501078034615417, 'sideways_atr_max_pct': 0.1447835521340944, 'sideways_tp_mult': 1.6671815791948053, 'sideways_tsl_mult': 0.2587024737636048, 'sideways_time_stop': 35, 'sideways_use_sma': False, 'sideways_use_ema': True, 'sideways_use_atr': True, 'sideways_use_adx': True, 'sideways_use_spike': False, 'sideways_rsi_required': True}.
[I 2025-08-31 13:28:09,827] Trial 718 finished with values: [-1000000000.0, 1000000000.0] and parameters: {'p_sma': 37, 'p_std': 22, 'p_atr': 9, 'p_adx': 21, 'rsi_period': 47, 'ema1': 15, 'ema2': 18, 'slip_atr_k': 0.18135146337312297, 'slip_spread_k': 0.8755049126921147, 'spread_hl_frac': 0.0067268213141005034, 'bb_std_mult': 2.5521323103805154, 'rsi_os': 38, 'rsi_ob': 92, 'vol_spike': 0.21286417378144162, 'adx_thresh': 11.48335065694556, 'atr_min_pct': 0.02620795973701751, 'atr_max_pct': 0.05867227526632068, 'tp_mult': 2.4753213431806227, 'tsl_mult': 0.6173953136958301, 'strategy': 'breakout', 'time_stop': 172, 'use_sma': False, 'use_atr': False, 'use_adx': True, 'use_ema': False, 'use_spike': True, 'rsi_required': False, 'edge_k': 0.5822423203424045, 'edge_cap': 0.4442968444747196, 'bull_strategy': 'mean_reversion', 'bull_bb_std_mult': 1.8725484124774894, 'bull_rsi_os': 50, 'bull_rsi_ob': 87, 'bull_adx_thresh': 17.361632870476274, 'bull_atr_min_pct': 0.020934841985399064, 'bull_atr_max_pct': 0.06691988520976612, 'bull_tp_mult': 2.3693861175290003, 'bull_tsl_mult': 0.7318146640790362, 'bull_time_stop': 219, 'bull_use_sma': True, 'bull_use_ema': False, 'bull_use_atr': True, 'bull_use_adx': True, 'bull_use_spike': True, 'bull_rsi_required': True, 'bear_strategy': 'breakout', 'bear_bb_std_mult': 3.504111482175342, 'bear_rsi_os': 27, 'bear_rsi_ob': 72, 'bear_adx_thresh': 22.299978207615577, 'bear_atr_min_pct': 0.022271108194289107, 'bear_atr_max_pct': 0.12448202826726945, 'bear_tp_mult': 1.2795918361092533, 'bear_tsl_mult': 0.7209741535038, 'bear_time_stop': 199, 'bear_use_sma': False, 'bear_use_ema': True, 'bear_use_atr': False, 'bear_use_adx': False, 'bear_use_spike': True, 'bear_rsi_required': True, 'sideways_strategy': 'breakout', 'sideways_bb_std_mult': 2.877655804932843, 'sideways_rsi_os': 29, 'sideways_rsi_ob': 62, 'sideways_adx_thresh': 24.468199332390537, 'sideways_atr_min_pct': 0.006881809490534348, 'sideways_atr_max_pct': 0.14521024342854658, 'sideways_tp_mult': 1.7599955363207624, 'sideways_tsl_mult': 0.8886490672834475, 'sideways_time_stop': 5, 'sideways_use_sma': False, 'sideways_use_ema': True, 'sideways_use_atr': True, 'sideways_use_adx': True, 'sideways_use_spike': False, 'sideways_rsi_required': False}.
