[I 2025-08-31 12:17:07,178] Trial 186 finished with values: [-0.05148465410790226, 0.0512395106214719] and parameters: {'p_sma': 34, 'p_std': 17, 'p_atr': 27, 'p_adx': 14, 'rsi_period': 9, 'ema1': 7, 'ema2': 36, 'slip_atr_k': 0.1967641047700355, 'slip_spread_k': 0.13082103170111545, 'spread_hl_frac': 0.02631248695955778, 'bb_std_mult': 1.043202142380286, 'rsi_os': 41, 'rsi_ob': 76, 'vol_spike': 0.10163663049164033, 'adx_thresh': 24.196868265740783, 'atr_min_pct': 0.004632984415644447, 'atr_max_pct': 0.03736640565522098, 'tp_mult': 2.6163815437110283, 'tsl_mult': 0.808223051309085, 'strategy': 'mean_reversion', 'time_stop': 86, 'use_sma': True, 'use_atr': False, 'use_adx': True, 'use_ema': False, 'use_spike': True, 'rsi_required': False, 'edge_k': 1.1885270733035689, 'edge_cap': 0.26033691848134116, 'bull_strategy': 'mean_reversion', 'bull_bb_std_mult': 3.3329162285271035, 'bull_rsi_os': 54, 'bull_rsi_ob': 83, 'bull_adx_thresh': 9.000779153570459, 'bull_atr_min_pct': 0.008679169566671707, 'bull_atr_max_pct': 0.12756677808328065, 'bull_tp_mult': 2.787675721027717, 'bull_tsl_mult': 0.24317782117214198, 'bull_time_stop': 111, 'bull_use_sma': False, 'bull_use_ema': False, 'bull_use_atr': False, 'bull_use_adx': True, 'bull_use_spike': False, 'bull_rsi_required': True, 'bear_strategy': 'mean_reversion', 'bear_bb_std_mult': 0.6009172984879725, 'bear_rsi_os': 26, 'bear_rsi_ob': 60, 'bear_adx_thresh': 33.42008534831458, 'bear_atr_min_pct': 0.028661882484821773, 'bear_atr_max_pct': 0.0978775906224604, 'bear_tp_mult': 1.7315972477982462, 'bear_tsl_mult': 0.1926377848615947, 'bear_time_stop': 276, 'bear_use_sma': False, 'bear_use_ema': False, 'bear_use_atr': False, 'bear_use_adx': False, 'bear_use_spike': True, 'bear_rsi_required': False, 'sideways_strategy': 'breakout', 'sideways_bb_std_mult': 2.0617818259424583, 'sideways_rsi_os': 35, 'sideways_rsi_ob': 45, 'sideways_adx_thresh': 8.59607415468538, 'sideways_atr_min_pct': 0.002535453725311264, 'sideways_atr_max_pct': 0.11426764122238614, 'sideways_tp_mult': 2.5260529705072297, 'sideways_tsl_mult': 0.9004527784217808, 'sideways_time_stop': 174, 'sideways_use_sma': False, 'sideways_use_ema': True, 'sideways_use_atr': True, 'sideways_use_adx': False, 'sideways_use_spike': False, 'sideways_rsi_required': True}.
[I 2025-08-31 12:17:07,325] Trial 189 finished with values: [-1000000000.0, 1000000000.0] and parameters: {'p_sma': 32, 'p_std': 42, 'p_atr': 12, 'p_adx': 14, 'rsi_period': 72, 'ema1': 18, 'ema2': 52, 'slip_atr_k': 0.09134507521638403, 'slip_spread_k': 0.100639199383561, 'spread_hl_frac': 0.02667969908525652, 'bb_std_mult': 1.0983964295671689, 'rsi_os': 22, 'rsi_ob': 76, 'vol_spike': 0.2541910630961041, 'adx_thresh': 17.41441029761909, 'atr_min_pct': 0.01199973193505499, 'atr_max_pct': 0.09963207058622994, 'tp_mult': 1.2015099728480991, 'tsl_mult': 0.44310284992592064, 'strategy': 'mean_reversion', 'time_stop': 86, 'use_sma': True, 'use_atr': True, 'use_adx': True, 'use_ema': False, 'use_spike': False, 'rsi_required': True, 'edge_k': 1.6628604761989279, 'edge_cap': 0.19166315902288153, 'bull_strategy': 'mean_reversion', 'bull_bb_std_mult': 3.348864433141569, 'bull_rsi_os': 10, 'bull_rsi_ob': 85, 'bull_adx_thresh': 8.549389691837884, 'bull_atr_min_pct': 0.02633640801585828, 'bull_atr_max_pct': 0.11797997607276434, 'bull_tp_mult': 2.7885285922488854, 'bull_tsl_mult': 0.527639254178582, 'bull_time_stop': 198, 'bull_use_sma': False, 'bull_use_ema': True, 'bull_use_atr': False, 'bull_use_adx': True, 'bull_use_spike': False, 'bull_rsi_required': True, 'bear_strategy': 'mean_reversion', 'bear_bb_std_mult': 3.206186896138695, 'bear_rsi_os': 26, 'bear_rsi_ob': 61, 'bear_adx_thresh': 33.20808500096325, 'bear_atr_min_pct': 0.028784532686312914, 'bear_atr_max_pct': 0.019823988972423212, 'bear_tp_mult': 1.4996474347546755, 'bear_tsl_mult': 0.08560524990348323, 'bear_time_stop': 300, 'bear_use_sma': False, 'bear_use_ema': True, 'bear_use_atr': False, 'bear_use_adx': False, 'bear_use_spike': True, 'bear_rsi_required': False, 'sideways_strategy': 'breakout', 'sideways_bb_std_mult': 2.0366026008703066, 'sideways_rsi_os': 31, 'sideways_rsi_ob': 47, 'sideways_adx_thresh': 29.836802958504734, 'sideways_atr_min_pct': 0.004529637420652238, 'sideways_atr_max_pct': 0.07515034149056786, 'sideways_tp_mult': 1.4333518597054622, 'sideways_tsl_mult': 0.45496592282128195, 'sideways_time_stop': 221, 'sideways_use_sma': False, 'sideways_use_ema': True, 'sideways_use_atr': True, 'sideways_use_adx': False, 'sideways_use_spike': False, 'sideways_rsi_required': True}.
[I 2025-08-31 12:17:07,884] Trial 192 finished with values: [-1000000000.0, 1000000000.0] and parameters: {'p_sma': 34, 'p_std': 16, 'p_atr': 13, 'p_adx': 14, 'rsi_period': 18, 'ema1': 18, 'ema2': 49, 'slip_atr_k': 0.06238818900782844, 'slip_spread_k': 0.12425921823349555, 'spread_hl_frac': 0.023788775184376783, 'bb_std_mult': 2.005900493430282, 'rsi_os': 51, 'rsi_ob': 61, 'vol_spike': 0.038721428491555174, 'adx_thresh': 17.18969865909886, 'atr_min_pct': 0.025652312922408993, 'atr_max_pct': 0.1276922214973072, 'tp_mult': 1.164375461423355, 'tsl_mult': 0.5103687585290156, 'strategy': 'mean_reversion', 'time_stop': 87, 'use_sma': True, 'use_atr': True, 'use_adx': True, 'use_ema': True, 'use_spike': True, 'rsi_required': False, 'edge_k': 1.2270515790859597, 'edge_cap': 0.3331373914842875, 'bull_strategy': 'mean_reversion', 'bull_bb_std_mult': 3.169146003511143, 'bull_rsi_os': 15, 'bull_rsi_ob': 81, 'bull_adx_thresh': 29.370907253008795, 'bull_atr_min_pct': 0.01962222622366944, 'bull_atr_max_pct': 0.016521198002833283, 'bull_tp_mult': 2.6373295865977235, 'bull_tsl_mult': 0.2732912974290613, 'bull_time_stop': 70, 'bull_use_sma': False, 'bull_use_ema': False, 'bull_use_atr': False, 'bull_use_adx': False, 'bull_use_spike': False, 'bull_rsi_required': True, 'bear_strategy': 'mean_reversion', 'bear_bb_std_mult': 1.7512355236827832, 'bear_rsi_os': 25, 'bear_rsi_ob': 48, 'bear_adx_thresh': 31.23248759562765, 'bear_atr_min_pct': 0.027882603417873353, 'bear_atr_max_pct': 0.022698722283108957, 'bear_tp_mult': 1.6213541107274205, 'bear_tsl_mult': 0.8473531737921516, 'bear_time_stop': 142, 'bear_use_sma': True, 'bear_use_ema': True, 'bear_use_atr': True, 'bear_use_adx': True, 'bear_use_spike': True, 'bear_rsi_required': False, 'sideways_strategy': 'breakout', 'sideways_bb_std_mult': 2.237703732503779, 'sideways_rsi_os': 36, 'sideways_rsi_ob': 74, 'sideways_adx_thresh': 9.748257797891036, 'sideways_atr_min_pct': 0.0016052271284665053, 'sideways_atr_max_pct': 0.010284421572403932, 'sideways_tp_mult': 2.633998172314369, 'sideways_tsl_mult': 0.46412670439329945, 'sideways_time_stop': 172, 'sideways_use_sma': False, 'sideways_use_ema': True, 'sideways_use_atr': False, 'sideways_use_adx': False, 'sideways_use_spike': True, 'sideways_rsi_required': False}.
[I 2025-08-31 12:17:08,438] Trial 195 finished with values: [-1000000000.0, 1000000000.0] and parameters: {'p_sma': 35, 'p_std': 13, 'p_atr': 20, 'p_adx': 26, 'rsi_period': 75, 'ema1': 6, 'ema2': 35, 'slip_atr_k': 0.08004685320596683, 'slip_spread_k': 0.1725231180658934, 'spread_hl_frac': 0.014165288035492858, 'bb_std_mult': 2.469962671408049, 'rsi_os': 44, 'rsi_ob': 62, 'vol_spike': 0.29972459513120314, 'adx_thresh': 22.219175186636708, 'atr_min_pct': 0.02788868306221813, 'atr_max_pct': 0.021224337800747034, 'tp_mult': 2.6796301051648426, 'tsl_mult': 0.031006172688150313, 'strategy': 'breakout', 'time_stop': 94, 'use_sma': False, 'use_atr': False, 'use_adx': True, 'use_ema': True, 'use_spike': True, 'rsi_required': False, 'edge_k': 1.1118288613893952, 'edge_cap': 0.28809559981606986, 'bull_strategy': 'breakout', 'bull_bb_std_mult': 3.2109238866388075, 'bull_rsi_os': 45, 'bull_rsi_ob': 86, 'bull_adx_thresh': 7.870614375742562, 'bull_atr_min_pct': 0.020277029895081178, 'bull_atr_max_pct': 0.021442695608613067, 'bull_tp_mult': 1.467109548032505, 'bull_tsl_mult': 0.32463099583751465, 'bull_time_stop': 64, 'bull_use_sma': False, 'bull_use_ema': False, 'bull_use_atr': False, 'bull_use_adx': True, 'bull_use_spike': True, 'bull_rsi_required': False, 'bear_strategy': 'breakout', 'bear_bb_std_mult': 1.6052053146476029, 'bear_rsi_os': 39, 'bear_rsi_ob': 71, 'bear_adx_thresh': 32.04206896507157, 'bear_atr_min_pct': 0.024231993548041217, 'bear_atr_max_pct': 0.10648982097117227, 'bear_tp_mult': 2.996398887835333, 'bear_tsl_mult': 0.16035276725401984, 'bear_time_stop': 201, 'bear_use_sma': True, 'bear_use_ema': False, 'bear_use_atr': True, 'bear_use_adx': True, 'bear_use_spike': False, 'bear_rsi_required': True, 'sideways_strategy': 'mean_reversion', 'sideways_bb_std_mult': 2.94103232805235, 'sideways_rsi_os': 37, 'sideways_rsi_ob': 79, 'sideways_adx_thresh': 25.654550532293293, 'sideways_atr_min_pct': 0.028463676070559607, 'sideways_atr_max_pct': 0.06608425911155824, 'sideways_tp_mult': 1.36261160490393, 'sideways_tsl_mult': 0.417621691525976, 'sideways_time_stop': 273, 'sideways_use_sma': False, 'sideways_use_ema': True, 'sideways_use_atr': False, 'sideways_use_adx': True, 'sideways_use_spike': False, 'sideways_rsi_required': True}.
[I 2025-08-31 12:17:40,594] Trial 191 finished with values: [-0.019539500837695734, 0.02007422145913403] and parameters: {'p_sma': 35, 'p_std': 16, 'p_atr': 13, 'p_adx': 14, 'rsi_period': 78, 'ema1': 15, 'ema2': 35, 'slip_atr_k': 0.06358631023393913, 'slip_spread_k': 0.11973134564851323, 'spread_hl_frac': 0.024100508247645213, 'bb_std_mult': 2.474660139982793, 'rsi_os': 33, 'rsi_ob': 76, 'vol_spike': 0.035936411311265626, 'adx_thresh': 18.719799618124142, 'atr_min_pct': 0.012163189059901425, 'atr_max_pct': 0.073137674639813, 'tp_mult': 1.1714897383532343, 'tsl_mult': 0.5229679331407278, 'strategy': 'mean_reversion', 'time_stop': 85, 'use_sma': True, 'use_atr': False, 'use_adx': True, 'use_ema': True, 'use_spike': True, 'rsi_required': True, 'edge_k': 1.0912479081594832, 'edge_cap': 0.3402079794298863, 'bull_strategy': 'mean_reversion', 'bull_bb_std_mult': 3.0762360540026465, 'bull_rsi_os': 53, 'bull_rsi_ob': 88, 'bull_adx_thresh': 7.927369726981528, 'bull_atr_min_pct': 0.027164017843995567, 'bull_atr_max_pct': 0.06455123990360684, 'bull_tp_mult': 2.6501520146349486, 'bull_tsl_mult': 0.5245758474294376, 'bull_time_stop': 204, 'bull_use_sma': False, 'bull_use_ema': True, 'bull_use_atr': False, 'bull_use_adx': True, 'bull_use_spike': False, 'bull_rsi_required': True, 'bear_strategy': 'mean_reversion', 'bear_bb_std_mult': 1.7189722105993415, 'bear_rsi_os': 39, 'bear_rsi_ob': 71, 'bear_adx_thresh': 34.92784963487115, 'bear_atr_min_pct': 0.027768082006048737, 'bear_atr_max_pct': 0.10684556025374413, 'bear_tp_mult': 2.0712701546325576, 'bear_tsl_mult': 0.0876961585226575, 'bear_time_stop': 115, 'bear_use_sma': True, 'bear_use_ema': False, 'bear_use_atr': False, 'bear_use_adx': True, 'bear_use_spike': True, 'bear_rsi_required': False, 'sideways_strategy': 'breakout', 'sideways_bb_std_mult': 2.2347410755554953, 'sideways_rsi_os': 38, 'sideways_rsi_ob': 73, 'sideways_adx_thresh': 25.79392877240572, 'sideways_atr_min_pct': 0.0015512199210843333, 'sideways_atr_max_pct': 0.06562010082448626, 'sideways_tp_mult': 1.3601395532348286, 'sideways_tsl_mult': 0.4386911870606975, 'sideways_time_stop': 174, 'sideways_use_sma': False, 'sideways_use_ema': True, 'sideways_use_atr': False, 'sideways_use_adx': False, 'sideways_use_spike': False, 'sideways_rsi_required': True}.
[I 2025-08-31 12:17:40,870] Trial 194 finished with values: [-1000000000.0, 1000000000.0] and parameters: {'p_sma': 35, 'p_std': 15, 'p_atr': 20, 'p_adx': 27, 'rsi_period': 75, 'ema1': 6, 'ema2': 27, 'slip_atr_k': 0.07849158132853487, 'slip_spread_k': 0.16740894415761373, 'spread_hl_frac': 0.024111630127168975, 'bb_std_mult': 2.463374012214665, 'rsi_os': 44, 'rsi_ob': 62, 'vol_spike': 0.24499038475831317, 'adx_thresh': 22.2448379607846, 'atr_min_pct': 0.027745066225396114, 'atr_max_pct': 0.12683702937747335, 'tp_mult': 2.4438793326608312, 'tsl_mult': 0.5192113369935513, 'strategy': 'mean_reversion', 'time_stop': 247, 'use_sma': False, 'use_atr': False, 'use_adx': True, 'use_ema': True, 'use_spike': True, 'rsi_required': False, 'edge_k': 0.6753883280019937, 'edge_cap': 0.29853159437419485, 'bull_strategy': 'breakout', 'bull_bb_std_mult': 2.1756849721550635, 'bull_rsi_os': 45, 'bull_rsi_ob': 81, 'bull_adx_thresh': 26.6542630200799, 'bull_atr_min_pct': 0.02520689655054615, 'bull_atr_max_pct': 0.021286725158557254, 'bull_tp_mult': 2.6442802924549644, 'bull_tsl_mult': 0.2672488145987731, 'bull_time_stop': 66, 'bull_use_sma': False, 'bull_use_ema': False, 'bull_use_atr': False, 'bull_use_adx': False, 'bull_use_spike': True, 'bull_rsi_required': False, 'bear_strategy': 'breakout', 'bear_bb_std_mult': 1.753690157609425, 'bear_rsi_os': 46, 'bear_rsi_ob': 63, 'bear_adx_thresh': 5.724025080121075, 'bear_atr_min_pct': 0.020803423590623468, 'bear_atr_max_pct': 0.10611965947584166, 'bear_tp_mult': 1.6209232783934582, 'bear_tsl_mult': 0.988712348731736, 'bear_time_stop': 204, 'bear_use_sma': True, 'bear_use_ema': False, 'bear_use_atr': True, 'bear_use_adx': True, 'bear_use_spike': False, 'bear_rsi_required': True, 'sideways_strategy': 'mean_reversion', 'sideways_bb_std_mult': 2.926617364739982, 'sideways_rsi_os': 36, 'sideways_rsi_ob': 77, 'sideways_adx_thresh': 9.797003433085822, 'sideways_atr_min_pct': 0.001220227196932992, 'sideways_atr_max_pct': 0.06530269338696958, 'sideways_tp_mult': 1.3311671818059985, 'sideways_tsl_mult': 0.4232884281985997, 'sideways_time_stop': 172, 'sideways_use_sma': False, 'sideways_use_ema': True, 'sideways_use_atr': False, 'sideways_use_adx': True, 'sideways_use_spike': True, 'sideways_rsi_required': False}.
[I 2025-08-31 12:17:40,888] Trial 193 finished with values: [-1000000000.0, 1000000000.0] and parameters: {'p_sma': 35, 'p_std': 13, 'p_atr': 13, 'p_adx': 14, 'rsi_period': 72, 'ema1': 23, 'ema2': 33, 'slip_atr_k': 0.07858570602750818, 'slip_spread_k': 0.17750309080242502, 'spread_hl_frac': 0.023518567852610407, 'bb_std_mult': 2.4414317565773938, 'rsi_os': 45, 'rsi_ob': 62, 'vol_spike': 0.24851845696927405, 'adx_thresh': 22.230613838030617, 'atr_min_pct': 0.025704569882455786, 'atr_max_pct': 0.10040864469482502, 'tp_mult': 2.446257192489244, 'tsl_mult': 0.9474333052052681, 'strategy': 'mean_reversion', 'time_stop': 115, 'use_sma': False, 'use_atr': True, 'use_adx': True, 'use_ema': True, 'use_spike': False, 'rsi_required': False, 'edge_k': 1.0217815042503586, 'edge_cap': 0.5686161528705855, 'bull_strategy': 'mean_reversion', 'bull_bb_std_mult': 3.080661892492853, 'bull_rsi_os': 45, 'bull_rsi_ob': 86, 'bull_adx_thresh': 29.05328118567609, 'bull_atr_min_pct': 0.02715068400253631, 'bull_atr_max_pct': 0.11597532292958553, 'bull_tp_mult': 1.399331986354347, 'bull_tsl_mult': 0.20669827788032868, 'bull_time_stop': 64, 'bull_use_sma': False, 'bull_use_ema': False, 'bull_use_atr': False, 'bull_use_adx': False, 'bull_use_spike': False, 'bull_rsi_required': False, 'bear_strategy': 'breakout', 'bear_bb_std_mult': 1.762707435446149, 'bear_rsi_os': 24, 'bear_rsi_ob': 66, 'bear_adx_thresh': 34.90304082714076, 'bear_atr_min_pct': 0.027495250511216568, 'bear_atr_max_pct': 0.10783085969670438, 'bear_tp_mult': 1.4803417823107554, 'bear_tsl_mult': 0.09212034012235121, 'bear_time_stop': 202, 'bear_use_sma': True, 'bear_use_ema': True, 'bear_use_atr': True, 'bear_use_adx': True, 'bear_use_spike': True, 'bear_rsi_required': True, 'sideways_strategy': 'mean_reversion', 'sideways_bb_std_mult': 2.024304598871438, 'sideways_rsi_os': 37, 'sideways_rsi_ob': 73, 'sideways_adx_thresh': 31.191157683466095, 'sideways_atr_min_pct': 0.0013713178352033016, 'sideways_atr_max_pct': 0.14453892643168476, 'sideways_tp_mult': 1.373383564621989, 'sideways_tsl_mult': 0.4720674360606836, 'sideways_time_stop': 172, 'sideways_use_sma': False, 'sideways_use_ema': True, 'sideways_use_atr': False, 'sideways_use_adx': False, 'sideways_use_spike': True, 'sideways_rsi_required': False}.
[I 2025-08-31 12:17:42,300] Trial 196 finished with values: [-1000000000.0, 1000000000.0] and parameters: {'p_sma': 50, 'p_std': 15, 'p_atr': 11, 'p_adx': 14, 'rsi_period': 30, 'ema1': 5, 'ema2': 40, 'slip_atr_k': 0.08555436520620932, 'slip_spread_k': 0.1890276460486906, 'spread_hl_frac': 0.04593615692581784, 'bb_std_mult': 0.8882293573882135, 'rsi_os': 44, 'rsi_ob': 62, 'vol_spike': 0.246474146728828, 'adx_thresh': 27.16568890430169, 'atr_min_pct': 0.02745997059382412, 'atr_max_pct': 0.07323066852389229, 'tp_mult': 2.88563835237251, 'tsl_mult': 0.47335796847450423, 'strategy': 'mean_reversion', 'time_stop': 114, 'use_sma': False, 'use_atr': False, 'use_adx': True, 'use_ema': False, 'use_spike': False, 'rsi_required': False, 'edge_k': 0.6706394791004213, 'edge_cap': 0.5689092380836216, 'bull_strategy': 'mean_reversion', 'bull_bb_std_mult': 2.1918611689523235, 'bull_rsi_os': 13, 'bull_rsi_ob': 88, 'bull_adx_thresh': 26.84401252094432, 'bull_atr_min_pct': 0.014334350527341399, 'bull_atr_max_pct': 0.04215607192810822, 'bull_tp_mult': 2.720628056961755, 'bull_tsl_mult': 0.2755431471807289, 'bull_time_stop': 99, 'bull_use_sma': False, 'bull_use_ema': False, 'bull_use_atr': False, 'bull_use_adx': False, 'bull_use_spike': False, 'bull_rsi_required': True, 'bear_strategy': 'breakout', 'bear_bb_std_mult': 3.5976829467859845, 'bear_rsi_os': 55, 'bear_rsi_ob': 66, 'bear_adx_thresh': 34.92916540701208, 'bear_atr_min_pct': 0.027521473114513643, 'bear_atr_max_pct': 0.10031745438263077, 'bear_tp_mult': 1.9056355244486542, 'bear_tsl_mult': 0.9293377328622581, 'bear_time_stop': 129, 'bear_use_sma': False, 'bear_use_ema': False, 'bear_use_atr': False, 'bear_use_adx': False, 'bear_use_spike': True, 'bear_rsi_required': True, 'sideways_strategy': 'mean_reversion', 'sideways_bb_std_mult': 1.9428099825130187, 'sideways_rsi_os': 34, 'sideways_rsi_ob': 95, 'sideways_adx_thresh': 34.999309643004665, 'sideways_atr_min_pct': 0.0006316050579732776, 'sideways_atr_max_pct': 0.07076156734972672, 'sideways_tp_mult': 1.316396539490668, 'sideways_tsl_mult': 0.43366149930903497, 'sideways_time_stop': 142, 'sideways_use_sma': False, 'sideways_use_ema': False, 'sideways_use_atr': True, 'sideways_use_adx': False, 'sideways_use_spike': True, 'sideways_rsi_required': False}.
[I 2025-08-31 12:18:18,976] Trial 197 finished with values: [-1000000000.0, 1000000000.0] and parameters: {'p_sma': 48, 'p_std': 30, 'p_atr': 30, 'p_adx': 13, 'rsi_period': 78, 'ema1': 5, 'ema2': 22, 'slip_atr_k': 0.2140534861379201, 'slip_spread_k': 0.13717079031507942, 'spread_hl_frac': 0.025241142157348226, 'bb_std_mult': 0.9317411608566009, 'rsi_os': 39, 'rsi_ob': 64, 'vol_spike': 0.2655324123766914, 'adx_thresh': 9.916492245198498, 'atr_min_pct': 0.017496177946984326, 'atr_max_pct': 0.0739651537256819, 'tp_mult': 2.8610152252360392, 'tsl_mult': 0.3584051905419652, 'strategy': 'breakout', 'time_stop': 162, 'use_sma': True, 'use_atr': False, 'use_adx': True, 'use_ema': False, 'use_spike': True, 'rsi_required': False, 'edge_k': 1.1303587998599618, 'edge_cap': 0.053459217784483926, 'bull_strategy': 'mean_reversion', 'bull_bb_std_mult': 3.2688223628439896, 'bull_rsi_os': 13, 'bull_rsi_ob': 91, 'bull_adx_thresh': 9.735404416022876, 'bull_atr_min_pct': 0.02476388118951265, 'bull_atr_max_pct': 0.034906926401859405, 'bull_tp_mult': 2.737038496259115, 'bull_tsl_mult': 0.31334837398059767, 'bull_time_stop': 100, 'bull_use_sma': False, 'bull_use_ema': False, 'bull_use_atr': False, 'bull_use_adx': True, 'bull_use_spike': False, 'bull_rsi_required': True, 'bear_strategy': 'mean_reversion', 'bear_bb_std_mult': 1.688708731557104, 'bear_rsi_os': 32, 'bear_rsi_ob': 62, 'bear_adx_thresh': 32.43276223664454, 'bear_atr_min_pct': 0.029324542869913834, 'bear_atr_max_pct': 0.10022882813730483, 'bear_tp_mult': 2.721664720273502, 'bear_tsl_mult': 0.2271098446859363, 'bear_time_stop': 113, 'bear_use_sma': False, 'bear_use_ema': False, 'bear_use_atr': False, 'bear_use_adx': False, 'bear_use_spike': True, 'bear_rsi_required': False, 'sideways_strategy': 'breakout', 'sideways_bb_std_mult': 1.9437624185246678, 'sideways_rsi_os': 7, 'sideways_rsi_ob': 46, 'sideways_adx_thresh': 11.376229870442488, 'sideways_atr_min_pct': 0.003492246888922259, 'sideways_atr_max_pct': 0.07126491104993972, 'sideways_tp_mult': 1.300208686736669, 'sideways_tsl_mult': 0.7115356338473977, 'sideways_time_stop': 165, 'sideways_use_sma': False, 'sideways_use_ema': False, 'sideways_use_atr': True, 'sideways_use_adx': False, 'sideways_use_spike': False, 'sideways_rsi_required': True}.
