[I 2025-08-31 11:58:38,056] Trial 35 finished with values: [-1000000000.0, 1000000000.0] and parameters: {'p_sma': 43, 'p_std': 20, 'p_atr': 8, 'p_adx': 11, 'rsi_period': 61, 'ema1': 27, 'ema2': 31, 'slip_atr_k': 0.10605094174396212, 'slip_spread_k': 0.5562858985965928, 'spread_hl_frac': 0.015241199056727798, 'bb_std_mult': 2.373677452968448, 'rsi_os': 27, 'rsi_ob': 59, 'vol_spike': 0.2967561446120033, 'adx_thresh': 33.49213067236151, 'atr_min_pct': 0.019043277505752194, 'atr_max_pct': 0.04739062490411345, 'tp_mult': 2.545950799822483, 'tsl_mult': 0.8138470027805353, 'strategy': 'mean_reversion', 'time_stop': 208, 'use_sma': False, 'use_atr': True, 'use_adx': True, 'use_ema': True, 'use_spike': True, 'rsi_required': True, 'edge_k': 1.2473178215367249, 'edge_cap': 0.3922030574091354, 'bull_strategy': 'breakout', 'bull_bb_std_mult': 2.8346579446254636, 'bull_rsi_os': 55, 'bull_rsi_ob': 62, 'bull_adx_thresh': 26.44931241278996, 'bull_atr_min_pct': 0.018522370247625455, 'bull_atr_max_pct': 0.05775440976294091, 'bull_tp_mult': 1.4681836462411328, 'bull_tsl_mult': 0.20942851033129872, 'bull_time_stop': 259, 'bull_use_sma': False, 'bull_use_ema': True, 'bull_use_atr': False, 'bull_use_adx': False, 'bull_use_spike': True, 'bull_rsi_required': True, 'bear_strategy': 'breakout', 'bear_bb_std_mult': 2.5984232133525182, 'bear_rsi_os': 26, 'bear_rsi_ob': 53, 'bear_adx_thresh': 34.98629081967059, 'bear_atr_min_pct': 0.014711084527986279, 'bear_atr_max_pct': 0.058561943425163965, 'bear_tp_mult': 2.826478519750638, 'bear_tsl_mult': 0.7970830840325598, 'bear_time_stop': 121, 'bear_use_sma': True, 'bear_use_ema': True, 'bear_use_atr': True, 'bear_use_adx': True, 'bear_use_spike': False, 'bear_rsi_required': False, 'sideways_strategy': 'breakout', 'sideways_bb_std_mult': 1.2290475524131221, 'sideways_rsi_os': 42, 'sideways_rsi_ob': 85, 'sideways_adx_thresh': 29.319209758986446, 'sideways_atr_min_pct': 0.009964248416605034, 'sideways_atr_max_pct': 0.11592502767693888, 'sideways_tp_mult': 2.7948497787084037, 'sideways_tsl_mult': 0.19611336646875127, 'sideways_time_stop': 218, 'sideways_use_sma': False, 'sideways_use_ema': False, 'sideways_use_atr': False, 'sideways_use_adx': True, 'sideways_use_spike': True, 'sideways_rsi_required': False}.
[I 2025-08-31 11:59:07,855] Trial 39 finished with values: [-1000000000.0, 1000000000.0] and parameters: {'p_sma': 60, 'p_std': 8, 'p_atr': 9, 'p_adx': 9, 'rsi_period': 74, 'ema1': 9, 'ema2': 18, 'slip_atr_k': 0.06392742877410423, 'slip_spread_k': 0.6146671942568425, 'spread_hl_frac': 0.010346762152034185, 'bb_std_mult': 2.8803169733197964, 'rsi_os': 21, 'rsi_ob': 53, 'vol_spike': 0.13743832110499457, 'adx_thresh': 32.01768011482804, 'atr_min_pct': 0.023840511290880814, 'atr_max_pct': 0.07101566217235505, 'tp_mult': 1.856723783966954, 'tsl_mult': 0.5685591116026131, 'strategy': 'mean_reversion', 'time_stop': 210, 'use_sma': True, 'use_atr': False, 'use_adx': True, 'use_ema': True, 'use_spike': True, 'rsi_required': False, 'edge_k': 0.9806843858460976, 'edge_cap': 0.5572463073901549, 'bull_strategy': 'mean_reversion', 'bull_bb_std_mult': 1.3626783001821763, 'bull_rsi_os': 15, 'bull_rsi_ob': 55, 'bull_adx_thresh': 33.304968204081035, 'bull_atr_min_pct': 0.0202981616518623, 'bull_atr_max_pct': 0.052827865520241546, 'bull_tp_mult': 1.0180115231828497, 'bull_tsl_mult': 0.00012057325389669415, 'bull_time_stop': 290, 'bull_use_sma': False, 'bull_use_ema': False, 'bull_use_atr': False, 'bull_use_adx': True, 'bull_use_spike': True, 'bull_rsi_required': False, 'bear_strategy': 'breakout', 'bear_bb_std_mult': 3.532843037408482, 'bear_rsi_os': 19, 'bear_rsi_ob': 71, 'bear_adx_thresh': 26.62092823996466, 'bear_atr_min_pct': 0.013028055087447086, 'bear_atr_max_pct': 0.06949122639740345, 'bear_tp_mult': 2.055326782160356, 'bear_tsl_mult': 0.5542098297740504, 'bear_time_stop': 163, 'bear_use_sma': False, 'bear_use_ema': False, 'bear_use_atr': True, 'bear_use_adx': True, 'bear_use_spike': False, 'bear_rsi_required': True, 'sideways_strategy': 'breakout', 'sideways_bb_std_mult': 2.1831413719188957, 'sideways_rsi_os': 32, 'sideways_rsi_ob': 74, 'sideways_adx_thresh': 34.395726321867755, 'sideways_atr_min_pct': 0.0071337836450841696, 'sideways_atr_max_pct': 0.11477438970177783, 'sideways_tp_mult': 1.7206543952290585, 'sideways_tsl_mult': 0.3039120055727351, 'sideways_time_stop': 267, 'sideways_use_sma': True, 'sideways_use_ema': False, 'sideways_use_atr': True, 'sideways_use_adx': True, 'sideways_use_spike': True, 'sideways_rsi_required': False}.
[I 2025-08-31 11:59:08,225] Trial 40 finished with values: [-1000000000.0, 1000000000.0] and parameters: {'p_sma': 60, 'p_std': 8, 'p_atr': 9, 'p_adx': 9, 'rsi_period': 62, 'ema1': 9, 'ema2': 16, 'slip_atr_k': 0.05986361754179079, 'slip_spread_k': 0.6148791095460003, 'spread_hl_frac': 0.01031916402434345, 'bb_std_mult': 2.840108866987036, 'rsi_os': 24, 'rsi_ob': 54, 'vol_spike': 0.18378571803218255, 'adx_thresh': 31.099303694232244, 'atr_min_pct': 0.023972502827195624, 'atr_max_pct': 0.06780572396002627, 'tp_mult': 1.8544886436454824, 'tsl_mult': 0.5924700032228595, 'strategy': 'mean_reversion', 'time_stop': 240, 'use_sma': True, 'use_atr': False, 'use_adx': True, 'use_ema': True, 'use_spike': True, 'rsi_required': False, 'edge_k': 0.9313860302167972, 'edge_cap': 0.5430436611106324, 'bull_strategy': 'mean_reversion', 'bull_bb_std_mult': 1.329060663817651, 'bull_rsi_os': 26, 'bull_rsi_ob': 56, 'bull_adx_thresh': 32.94441261792876, 'bull_atr_min_pct': 0.020245688807188415, 'bull_atr_max_pct': 0.052115245346, 'bull_tp_mult': 1.0492615885212646, 'bull_tsl_mult': 0.22656365333093176, 'bull_time_stop': 297, 'bull_use_sma': False, 'bull_use_ema': False, 'bull_use_atr': False, 'bull_use_adx': True, 'bull_use_spike': True, 'bull_rsi_required': False, 'bear_strategy': 'breakout', 'bear_bb_std_mult': 3.26329878937627, 'bear_rsi_os': 19, 'bear_rsi_ob': 73, 'bear_adx_thresh': 16.17265337838915, 'bear_atr_min_pct': 0.011543767304934293, 'bear_atr_max_pct': 0.06878744984127874, 'bear_tp_mult': 2.0970458474251528, 'bear_tsl_mult': 0.5730101307927987, 'bear_time_stop': 166, 'bear_use_sma': False, 'bear_use_ema': False, 'bear_use_atr': True, 'bear_use_adx': True, 'bear_use_spike': False, 'bear_rsi_required': True, 'sideways_strategy': 'breakout', 'sideways_bb_std_mult': 0.7953572408644347, 'sideways_rsi_os': 33, 'sideways_rsi_ob': 49, 'sideways_adx_thresh': 33.48578539159827, 'sideways_atr_min_pct': 0.006837543013922297, 'sideways_atr_max_pct': 0.1307020044718049, 'sideways_tp_mult': 1.6889524388230703, 'sideways_tsl_mult': 0.4928820215049591, 'sideways_time_stop': 261, 'sideways_use_sma': True, 'sideways_use_ema': False, 'sideways_use_atr': True, 'sideways_use_adx': True, 'sideways_use_spike': True, 'sideways_rsi_required': False}.
[I 2025-08-31 11:59:08,309] Trial 38 finished with values: [-1000000000.0, 1000000000.0] and parameters: {'p_sma': 60, 'p_std': 5, 'p_atr': 7, 'p_adx': 12, 'rsi_period': 62, 'ema1': 27, 'ema2': 16, 'slip_atr_k': 0.06004748431663218, 'slip_spread_k': 0.5898380631905418, 'spread_hl_frac': 0.00853430334719422, 'bb_std_mult': 3.593973140874173, 'rsi_os': 24, 'rsi_ob': 58, 'vol_spike': 0.1489444612580475, 'adx_thresh': 33.027334506844824, 'atr_min_pct': 0.02394039159362417, 'atr_max_pct': 0.06969710403409009, 'tp_mult': 2.081125053830041, 'tsl_mult': 0.8505325766714145, 'strategy': 'mean_reversion', 'time_stop': 206, 'use_sma': True, 'use_atr': False, 'use_adx': True, 'use_ema': True, 'use_spike': True, 'rsi_required': True, 'edge_k': 0.9463498728571477, 'edge_cap': 0.5690686002048654, 'bull_strategy': 'mean_reversion', 'bull_bb_std_mult': 1.431965901922484, 'bull_rsi_os': 27, 'bull_rsi_ob': 62, 'bull_adx_thresh': 28.707268409629073, 'bull_atr_min_pct': 0.019968861728243727, 'bull_atr_max_pct': 0.05557984384872837, 'bull_tp_mult': 1.4052141209441509, 'bull_tsl_mult': 0.2026157055755754, 'bull_time_stop': 297, 'bull_use_sma': False, 'bull_use_ema': False, 'bull_use_atr': False, 'bull_use_adx': False, 'bull_use_spike': True, 'bull_rsi_required': False, 'bear_strategy': 'breakout', 'bear_bb_std_mult': 2.7383866928197076, 'bear_rsi_os': 19, 'bear_rsi_ob': 72, 'bear_adx_thresh': 21.123187188984332, 'bear_atr_min_pct': 0.014254629679973888, 'bear_atr_max_pct': 0.06675032028013879, 'bear_tp_mult': 2.2013630105807573, 'bear_tsl_mult': 0.595884555935144, 'bear_time_stop': 169, 'bear_use_sma': False, 'bear_use_ema': True, 'bear_use_atr': True, 'bear_use_adx': True, 'bear_use_spike': False, 'bear_rsi_required': True, 'sideways_strategy': 'breakout', 'sideways_bb_std_mult': 1.1816005167359713, 'sideways_rsi_os': 33, 'sideways_rsi_ob': 74, 'sideways_adx_thresh': 29.278374220253163, 'sideways_atr_min_pct': 0.006854205881924405, 'sideways_atr_max_pct': 0.1273206684875264, 'sideways_tp_mult': 1.9201489684042323, 'sideways_tsl_mult': 0.5106625940075417, 'sideways_time_stop': 220, 'sideways_use_sma': False, 'sideways_use_ema': False, 'sideways_use_atr': True, 'sideways_use_adx': True, 'sideways_use_spike': True, 'sideways_rsi_required': False}.
[I 2025-08-31 11:59:08,371] Trial 37 finished with values: [-1000000000.0, 1000000000.0] and parameters: {'p_sma': 58, 'p_std': 8, 'p_atr': 26, 'p_adx': 9, 'rsi_period': 27, 'ema1': 9, 'ema2': 55, 'slip_atr_k': 0.06446593265039721, 'slip_spread_k': 0.606044726260716, 'spread_hl_frac': 0.00959657116759065, 'bb_std_mult': 3.557963321306587, 'rsi_os': 39, 'rsi_ob': 58, 'vol_spike': 0.13442330357375443, 'adx_thresh': 34.56034882744018, 'atr_min_pct': 0.019766377381296114, 'atr_max_pct': 0.07459553555999576, 'tp_mult': 2.0974938251116293, 'tsl_mult': 0.8230814274638665, 'strategy': 'mean_reversion', 'time_stop': 226, 'use_sma': False, 'use_atr': False, 'use_adx': True, 'use_ema': True, 'use_spike': True, 'rsi_required': True, 'edge_k': 1.9133982282649946, 'edge_cap': 0.5538453852034423, 'bull_strategy': 'breakout', 'bull_bb_std_mult': 1.3339286602740428, 'bull_rsi_os': 26, 'bull_rsi_ob': 61, 'bull_adx_thresh': 33.05110367717776, 'bull_atr_min_pct': 0.019933786247399596, 'bull_atr_max_pct': 0.05509187711862645, 'bull_tp_mult': 1.3604789951494454, 'bull_tsl_mult': 0.9268673209506096, 'bull_time_stop': 221, 'bull_use_sma': False, 'bull_use_ema': False, 'bull_use_atr': False, 'bull_use_adx': False, 'bull_use_spike': True, 'bull_rsi_required': False, 'bear_strategy': 'breakout', 'bear_bb_std_mult': 2.7227405171652093, 'bear_rsi_os': 19, 'bear_rsi_ob': 89, 'bear_adx_thresh': 32.63780671338991, 'bear_atr_min_pct': 0.02569521049458612, 'bear_atr_max_pct': 0.0656996012305839, 'bear_tp_mult': 2.1951761865010444, 'bear_tsl_mult': 0.8033601272790458, 'bear_time_stop': 108, 'bear_use_sma': False, 'bear_use_ema': True, 'bear_use_atr': True, 'bear_use_adx': True, 'bear_use_spike': False, 'bear_rsi_required': True, 'sideways_strategy': 'breakout', 'sideways_bb_std_mult': 1.0354774908689983, 'sideways_rsi_os': 33, 'sideways_rsi_ob': 63, 'sideways_adx_thresh': 29.474697916552074, 'sideways_atr_min_pct': 0.007646173885545176, 'sideways_atr_max_pct': 0.11529453264822523, 'sideways_tp_mult': 1.8627597850834712, 'sideways_tsl_mult': 0.5033168446365867, 'sideways_time_stop': 215, 'sideways_use_sma': False, 'sideways_use_ema': False, 'sideways_use_atr': True, 'sideways_use_adx': True, 'sideways_use_spike': True, 'sideways_rsi_required': False}.
[I 2025-08-31 11:59:08,587] Trial 41 finished with values: [-1000000000.0, 1000000000.0] and parameters: {'p_sma': 55, 'p_std': 6, 'p_atr': 7, 'p_adx': 12, 'rsi_period': 63, 'ema1': 16, 'ema2': 15, 'slip_atr_k': 0.0005885856846945398, 'slip_spread_k': 0.4738096442140889, 'spread_hl_frac': 0.024173486668694646, 'bb_std_mult': 3.3315496209921807, 'rsi_os': 17, 'rsi_ob': 50, 'vol_spike': 0.17744527378519204, 'adx_thresh': 9.07568252306129, 'atr_min_pct': 0.016670988405866012, 'atr_max_pct': 0.08530204602601799, 'tp_mult': 2.05848195079579, 'tsl_mult': 0.9981527973005155, 'strategy': 'mean_reversion', 'time_stop': 239, 'use_sma': True, 'use_atr': False, 'use_adx': True, 'use_ema': True, 'use_spike': True, 'rsi_required': True, 'edge_k': 0.6423112326659475, 'edge_cap': 0.7417293120355821, 'bull_strategy': 'mean_reversion', 'bull_bb_std_mult': 0.9535242663925158, 'bull_rsi_os': 26, 'bull_rsi_ob': 69, 'bull_adx_thresh': 34.65601389473083, 'bull_atr_min_pct': 0.014248799628227397, 'bull_atr_max_pct': 0.020960723521584256, 'bull_tp_mult': 1.2170747696417519, 'bull_tsl_mult': 0.42770420319887986, 'bull_time_stop': 253, 'bull_use_sma': False, 'bull_use_ema': False, 'bull_use_atr': False, 'bull_use_adx': False, 'bull_use_spike': False, 'bull_rsi_required': False, 'bear_strategy': 'breakout', 'bear_bb_std_mult': 1.8655053075023433, 'bear_rsi_os': 33, 'bear_rsi_ob': 74, 'bear_adx_thresh': 29.61529791446549, 'bear_atr_min_pct': 0.006889662596032407, 'bear_atr_max_pct': 0.12591080216228281, 'bear_tp_mult': 2.217528013551467, 'bear_tsl_mult': 0.6202854748113443, 'bear_time_stop': 206, 'bear_use_sma': False, 'bear_use_ema': True, 'bear_use_atr': True, 'bear_use_adx': True, 'bear_use_spike': True, 'bear_rsi_required': True, 'sideways_strategy': 'breakout', 'sideways_bb_std_mult': 0.7998515232719933, 'sideways_rsi_os': 37, 'sideways_rsi_ob': 45, 'sideways_adx_thresh': 28.34355188940525, 'sideways_atr_min_pct': 0.006735988249790413, 'sideways_atr_max_pct': 0.12933347681083424, 'sideways_tp_mult': 1.9997220216705227, 'sideways_tsl_mult': 0.5111310466151381, 'sideways_time_stop': 192, 'sideways_use_sma': False, 'sideways_use_ema': False, 'sideways_use_atr': False, 'sideways_use_adx': False, 'sideways_use_spike': True, 'sideways_rsi_required': False}.
[I 2025-08-31 11:59:08,598] Trial 44 finished with values: [-1000000000.0, 1000000000.0] and parameters: {'p_sma': 5, 'p_std': 5, 'p_atr': 7, 'p_adx': 12, 'rsi_period': 55, 'ema1': 16, 'ema2': 23, 'slip_atr_k': 0.025942200471205677, 'slip_spread_k': 0.4800458120457166, 'spread_hl_frac': 0.04927670010752374, 'bb_std_mult': 3.2254002494649208, 'rsi_os': 32, 'rsi_ob': 50, 'vol_spike': 0.21725655266979893, 'adx_thresh': 9.282018806365778, 'atr_min_pct': 0.01694368275073334, 'atr_max_pct': 0.08626080573888682, 'tp_mult': 2.32783148754952, 'tsl_mult': 0.3457828556813822, 'strategy': 'mean_reversion', 'time_stop': 260, 'use_sma': False, 'use_atr': False, 'use_adx': True, 'use_ema': True, 'use_spike': True, 'rsi_required': True, 'edge_k': 1.435557327475927, 'edge_cap': 0.9224567062232897, 'bull_strategy': 'breakout', 'bull_bb_std_mult': 1.0523761402344993, 'bull_rsi_os': 45, 'bull_rsi_ob': 45, 'bull_adx_thresh': 29.412288308293792, 'bull_atr_min_pct': 0.016365572951838055, 'bull_atr_max_pct': 0.039117288924713584, 'bull_tp_mult': 1.1611644765665186, 'bull_tsl_mult': 0.8036554102764879, 'bull_time_stop': 244, 'bull_use_sma': False, 'bull_use_ema': True, 'bull_use_atr': False, 'bull_use_adx': False, 'bull_use_spike': False, 'bull_rsi_required': True, 'bear_strategy': 'breakout', 'bear_bb_std_mult': 1.8506146312074232, 'bear_rsi_os': 33, 'bear_rsi_ob': 67, 'bear_adx_thresh': 10.122687901241024, 'bear_atr_min_pct': 0.01595575902426245, 'bear_atr_max_pct': 0.05138480002216022, 'bear_tp_mult': 1.979594258468005, 'bear_tsl_mult': 0.6536496868683794, 'bear_time_stop': 205, 'bear_use_sma': True, 'bear_use_ema': True, 'bear_use_atr': True, 'bear_use_adx': True, 'bear_use_spike': True, 'bear_rsi_required': True, 'sideways_strategy': 'breakout', 'sideways_bb_std_mult': 2.987803158485234, 'sideways_rsi_os': 39, 'sideways_rsi_ob': 54, 'sideways_adx_thresh': 21.286549518003298, 'sideways_atr_min_pct': 0.004976489377902065, 'sideways_atr_max_pct': 0.10540093388959312, 'sideways_tp_mult': 2.069680539954822, 'sideways_tsl_mult': 0.26390464596057, 'sideways_time_stop': 193, 'sideways_use_sma': False, 'sideways_use_ema': False, 'sideways_use_atr': False, 'sideways_use_adx': False, 'sideways_use_spike': True, 'sideways_rsi_required': False}.
[I 2025-08-31 11:59:36,952] Trial 43 finished with values: [-1000000000.0, 1000000000.0] and parameters: {'p_sma': 55, 'p_std': 11, 'p_atr': 26, 'p_adx': 13, 'rsi_period': 76, 'ema1': 16, 'ema2': 22, 'slip_atr_k': 0.026589146248785958, 'slip_spread_k': 0.5031589399144066, 'spread_hl_frac': 0.02280302298170953, 'bb_std_mult': 3.2614374852435075, 'rsi_os': 16, 'rsi_ob': 56, 'vol_spike': 0.21563206096913773, 'adx_thresh': 26.842449870189224, 'atr_min_pct': 0.016922615414483925, 'atr_max_pct': 0.08790703229555596, 'tp_mult': 2.3577456557863155, 'tsl_mult': 0.5285566629079083, 'strategy': 'mean_reversion', 'time_stop': 227, 'use_sma': False, 'use_atr': False, 'use_adx': True, 'use_ema': True, 'use_spike': True, 'rsi_required': True, 'edge_k': 1.4848550444863071, 'edge_cap': 0.17969400047902578, 'bull_strategy': 'breakout', 'bull_bb_std_mult': 0.9726285907112223, 'bull_rsi_os': 43, 'bull_rsi_ob': 47, 'bull_adx_thresh': 34.909061250318985, 'bull_atr_min_pct': 0.014283713285131071, 'bull_atr_max_pct': 0.03867483638073023, 'bull_tp_mult': 1.181472994095259, 'bull_tsl_mult': 0.8181283082421239, 'bull_time_stop': 263, 'bull_use_sma': True, 'bull_use_ema': True, 'bull_use_atr': True, 'bull_use_adx': False, 'bull_use_spike': False, 'bull_rsi_required': False, 'bear_strategy': 'breakout', 'bear_bb_std_mult': 1.9882345218827198, 'bear_rsi_os': 33, 'bear_rsi_ob': 67, 'bear_adx_thresh': 10.181471016395804, 'bear_atr_min_pct': 0.008044679909501593, 'bear_atr_max_pct': 0.12930190648362558, 'bear_tp_mult': 1.2599034414510568, 'bear_tsl_mult': 0.2762696006979256, 'bear_time_stop': 208, 'bear_use_sma': True, 'bear_use_ema': True, 'bear_use_atr': True, 'bear_use_adx': True, 'bear_use_spike': True, 'bear_rsi_required': True, 'sideways_strategy': 'breakout', 'sideways_bb_std_mult': 2.698321667038934, 'sideways_rsi_os': 39, 'sideways_rsi_ob': 78, 'sideways_adx_thresh': 27.10659977153049, 'sideways_atr_min_pct': 0.010423597554161952, 'sideways_atr_max_pct': 0.10816962586012689, 'sideways_tp_mult': 2.0271609759914773, 'sideways_tsl_mult': 0.07489896849559774, 'sideways_time_stop': 136, 'sideways_use_sma': False, 'sideways_use_ema': False, 'sideways_use_atr': False, 'sideways_use_adx': False, 'sideways_use_spike': True, 'sideways_rsi_required': False}.
[I 2025-08-31 11:59:37,571] Trial 42 finished with values: [-1000000000.0, 1000000000.0] and parameters: {'p_sma': 56, 'p_std': 12, 'p_atr': 7, 'p_adx': 12, 'rsi_period': 61, 'ema1': 16, 'ema2': 22, 'slip_atr_k': 0.027841726188942997, 'slip_spread_k': 0.49487821826814854, 'spread_hl_frac': 0.04720579006384608, 'bb_std_mult': 3.2176578173472112, 'rsi_os': 32, 'rsi_ob': 51, 'vol_spike': 0.2174318719630353, 'adx_thresh': 32.767885303765866, 'atr_min_pct': 0.016886094790955618, 'atr_max_pct': 0.0786470901690399, 'tp_mult': 2.352900835190839, 'tsl_mult': 0.33878238959218643, 'strategy': 'mean_reversion', 'time_stop': 196, 'use_sma': False, 'use_atr': False, 'use_adx': True, 'use_ema': True, 'use_spike': True, 'rsi_required': True, 'edge_k': 0.6961141757661585, 'edge_cap': 0.1588691802888596, 'bull_strategy': 'mean_reversion', 'bull_bb_std_mult': 0.7758214079405297, 'bull_rsi_os': 45, 'bull_rsi_ob': 47, 'bull_adx_thresh': 34.71014109168026, 'bull_atr_min_pct': 0.015358920114955767, 'bull_atr_max_pct': 0.04010336189700284, 'bull_tp_mult': 1.2229280141944345, 'bull_tsl_mult': 0.9193770525934839, 'bull_time_stop': 249, 'bull_use_sma': False, 'bull_use_ema': True, 'bull_use_atr': False, 'bull_use_adx': False, 'bull_use_spike': False, 'bull_rsi_required': False, 'bear_strategy': 'breakout', 'bear_bb_std_mult': 1.89008826696313, 'bear_rsi_os': 34, 'bear_rsi_ob': 67, 'bear_adx_thresh': 10.28781884136265, 'bear_atr_min_pct': 0.006748968690184785, 'bear_atr_max_pct': 0.12841020498900943, 'bear_tp_mult': 2.2292777277015166, 'bear_tsl_mult': 0.6252783131852863, 'bear_time_stop': 222, 'bear_use_sma': False, 'bear_use_ema': True, 'bear_use_atr': True, 'bear_use_adx': True, 'bear_use_spike': True, 'bear_rsi_required': True, 'sideways_strategy': 'breakout', 'sideways_bb_std_mult': 2.554544575963823, 'sideways_rsi_os': 38, 'sideways_rsi_ob': 79, 'sideways_adx_thresh': 28.67173478128277, 'sideways_atr_min_pct': 0.005961646681837367, 'sideways_atr_max_pct': 0.10795280691988901, 'sideways_tp_mult': 2.0195212485116065, 'sideways_tsl_mult': 0.8108361304125309, 'sideways_time_stop': 287, 'sideways_use_sma': False, 'sideways_use_ema': False, 'sideways_use_atr': False, 'sideways_use_adx': False, 'sideways_use_spike': True, 'sideways_rsi_required': False}.
