[I 2025-08-31 12:50:35,984] Trial 448 finished with values: [-0.0960399433003507, 0.09620061539803658] and parameters: {'p_sma': 50, 'p_std': 9, 'p_atr': 28, 'p_adx': 25, 'rsi_period': 55, 'ema1': 18, 'ema2': 15, 'slip_atr_k': 0.14918519542712444, 'slip_spread_k': 0.4374966327409157, 'spread_hl_frac': 0.013926020004821512, 'bb_std_mult': 2.259936451105198, 'rsi_os': 8, 'rsi_ob': 81, 'vol_spike': 0.040963045789248045, 'adx_thresh': 20.671807158557975, 'atr_min_pct': 0.0014041835171202269, 'atr_max_pct': 0.1240226662204251, 'tp_mult': 2.6486680330622514, 'tsl_mult': 0.693633691689225, 'strategy': 'breakout', 'time_stop': 178, 'use_sma': True, 'use_atr': False, 'use_adx': True, 'use_ema': True, 'use_spike': False, 'rsi_required': True, 'edge_k': 0.08723916746585658, 'edge_cap': 0.6717911855245756, 'bull_strategy': 'breakout', 'bull_bb_std_mult': 2.7296310486059827, 'bull_rsi_os': 26, 'bull_rsi_ob': 51, 'bull_adx_thresh': 17.430208990525866, 'bull_atr_min_pct': 0.019271513537580207, 'bull_atr_max_pct': 0.1474281781821784, 'bull_tp_mult': 1.0829102708338516, 'bull_tsl_mult': 0.2258973382534357, 'bull_time_stop': 281, 'bull_use_sma': False, 'bull_use_ema': True, 'bull_use_atr': True, 'bull_use_adx': True, 'bull_use_spike': False, 'bull_rsi_required': True, 'bear_strategy': 'breakout', 'bear_bb_std_mult': 3.1941083447922023, 'bear_rsi_os': 42, 'bear_rsi_ob': 71, 'bear_adx_thresh': 12.600566601502184, 'bear_atr_min_pct': 0.0026603164958398113, 'bear_atr_max_pct': 0.13604091246062455, 'bear_tp_mult': 1.398679014585428, 'bear_tsl_mult': 0.798984321515076, 'bear_time_stop': 183, 'bear_use_sma': True, 'bear_use_ema': False, 'bear_use_atr': True, 'bear_use_adx': True, 'bear_use_spike': True, 'bear_rsi_required': True, 'sideways_strategy': 'breakout', 'sideways_bb_std_mult': 2.535293132486653, 'sideways_rsi_os': 29, 'sideways_rsi_ob': 67, 'sideways_adx_thresh': 25.415765003340915, 'sideways_atr_min_pct': 0.0027510932244141284, 'sideways_atr_max_pct': 0.12442455561785581, 'sideways_tp_mult': 1.5437900670732585, 'sideways_tsl_mult': 0.8304336014140462, 'sideways_time_stop': 209, 'sideways_use_sma': True, 'sideways_use_ema': False, 'sideways_use_atr': False, 'sideways_use_adx': False, 'sideways_use_spike': False, 'sideways_rsi_required': True}.
[I 2025-08-31 12:51:10,056] Trial 454 finished with values: [-1000000000.0, 1000000000.0] and parameters: {'p_sma': 53, 'p_std': 23, 'p_atr': 11, 'p_adx': 14, 'rsi_period': 44, 'ema1': 21, 'ema2': 18, 'slip_atr_k': 0.06326659638759875, 'slip_spread_k': 0.3993897112753419, 'spread_hl_frac': 0.017536383259488652, 'bb_std_mult': 2.3054712959496655, 'rsi_os': 38, 'rsi_ob': 79, 'vol_spike': 0.022627860489005794, 'adx_thresh': 30.829892385088783, 'atr_min_pct': 0.017212987373618635, 'atr_max_pct': 0.1276132645622265, 'tp_mult': 1.6893958596656198, 'tsl_mult': 0.06034909852782895, 'strategy': 'breakout', 'time_stop': 188, 'use_sma': False, 'use_atr': True, 'use_adx': False, 'use_ema': True, 'use_spike': False, 'rsi_required': True, 'edge_k': 0.741868962714022, 'edge_cap': 0.9347251991284502, 'bull_strategy': 'mean_reversion', 'bull_bb_std_mult': 2.593177750119042, 'bull_rsi_os': 46, 'bull_rsi_ob': 53, 'bull_adx_thresh': 19.01504445369225, 'bull_atr_min_pct': 0.006521765491160946, 'bull_atr_max_pct': 0.14322759655170364, 'bull_tp_mult': 1.204907449985421, 'bull_tsl_mult': 0.6562364211880913, 'bull_time_stop': 290, 'bull_use_sma': True, 'bull_use_ema': True, 'bull_use_atr': False, 'bull_use_adx': False, 'bull_use_spike': False, 'bull_rsi_required': False, 'bear_strategy': 'mean_reversion', 'bear_bb_std_mult': 2.9263935813380266, 'bear_rsi_os': 30, 'bear_rsi_ob': 72, 'bear_adx_thresh': 13.338521007521008, 'bear_atr_min_pct': 0.0015182532679658967, 'bear_atr_max_pct': 0.1390304166730551, 'bear_tp_mult': 2.87697674672254, 'bear_tsl_mult': 0.7531243397669254, 'bear_time_stop': 193, 'bear_use_sma': True, 'bear_use_ema': True, 'bear_use_atr': True, 'bear_use_adx': True, 'bear_use_spike': True, 'bear_rsi_required': True, 'sideways_strategy': 'breakout', 'sideways_bb_std_mult': 2.7692939186600345, 'sideways_rsi_os': 25, 'sideways_rsi_ob': 68, 'sideways_adx_thresh': 27.79249741089168, 'sideways_atr_min_pct': 0.02070660160708721, 'sideways_atr_max_pct': 0.09026482752633831, 'sideways_tp_mult': 1.6424778932621271, 'sideways_tsl_mult': 0.877278459718996, 'sideways_time_stop': 195, 'sideways_use_sma': False, 'sideways_use_ema': False, 'sideways_use_atr': False, 'sideways_use_adx': False, 'sideways_use_spike': True, 'sideways_rsi_required': True}.
[I 2025-08-31 12:51:10,215] Trial 453 finished with values: [-1000000000.0, 1000000000.0] and parameters: {'p_sma': 6, 'p_std': 24, 'p_atr': 23, 'p_adx': 15, 'rsi_period': 51, 'ema1': 20, 'ema2': 15, 'slip_atr_k': 0.0633770375457853, 'slip_spread_k': 0.4000478608820974, 'spread_hl_frac': 0.019741833495928986, 'bb_std_mult': 2.2865849810020404, 'rsi_os': 18, 'rsi_ob': 77, 'vol_spike': 0.022291058680480143, 'adx_thresh': 34.12625899965957, 'atr_min_pct': 0.0005658429684229386, 'atr_max_pct': 0.1283962199228599, 'tp_mult': 2.647345916753806, 'tsl_mult': 0.05759568215510802, 'strategy': 'breakout', 'time_stop': 174, 'use_sma': False, 'use_atr': True, 'use_adx': False, 'use_ema': True, 'use_spike': False, 'rsi_required': True, 'edge_k': 0.7327165629659178, 'edge_cap': 0.5410262605869448, 'bull_strategy': 'breakout', 'bull_bb_std_mult': 1.7063674039309547, 'bull_rsi_os': 46, 'bull_rsi_ob': 51, 'bull_adx_thresh': 19.18975158155905, 'bull_atr_min_pct': 0.004100863349352087, 'bull_atr_max_pct': 0.14382115969658296, 'bull_tp_mult': 1.0567064611768502, 'bull_tsl_mult': 0.6428327862235734, 'bull_time_stop': 289, 'bull_use_sma': True, 'bull_use_ema': True, 'bull_use_atr': False, 'bull_use_adx': True, 'bull_use_spike': False, 'bull_rsi_required': False, 'bear_strategy': 'mean_reversion', 'bear_bb_std_mult': 3.0041696856390345, 'bear_rsi_os': 46, 'bear_rsi_ob': 72, 'bear_adx_thresh': 11.917930512499835, 'bear_atr_min_pct': 0.002471671305642151, 'bear_atr_max_pct': 0.13870216225095458, 'bear_tp_mult': 1.3840851160612255, 'bear_tsl_mult': 0.6968766796389239, 'bear_time_stop': 191, 'bear_use_sma': True, 'bear_use_ema': True, 'bear_use_atr': True, 'bear_use_adx': True, 'bear_use_spike': True, 'bear_rsi_required': True, 'sideways_strategy': 'breakout', 'sideways_bb_std_mult': 2.6900481977832515, 'sideways_rsi_os': 25, 'sideways_rsi_ob': 68, 'sideways_adx_thresh': 25.2397614601508, 'sideways_atr_min_pct': 0.0035301612147936876, 'sideways_atr_max_pct': 0.12564489606609222, 'sideways_tp_mult': 1.6425783510210745, 'sideways_tsl_mult': 0.8896893492356283, 'sideways_time_stop': 206, 'sideways_use_sma': False, 'sideways_use_ema': False, 'sideways_use_atr': False, 'sideways_use_adx': False, 'sideways_use_spike': True, 'sideways_rsi_required': True}.
[I 2025-08-31 12:51:10,333] Trial 451 finished with values: [-1000000000.0, 1000000000.0] and parameters: {'p_sma': 6, 'p_std': 24, 'p_atr': 11, 'p_adx': 23, 'rsi_period': 53, 'ema1': 18, 'ema2': 49, 'slip_atr_k': 0.06411723156201826, 'slip_spread_k': 0.39821298450461234, 'spread_hl_frac': 0.017149685047774824, 'bb_std_mult': 3.533166662987079, 'rsi_os': 38, 'rsi_ob': 79, 'vol_spike': 0.02753536540456993, 'adx_thresh': 34.07975218012268, 'atr_min_pct': 0.002315006389794711, 'atr_max_pct': 0.12845585719558614, 'tp_mult': 2.9431057201405015, 'tsl_mult': 0.6712162749909942, 'strategy': 'breakout', 'time_stop': 176, 'use_sma': True, 'use_atr': True, 'use_adx': True, 'use_ema': True, 'use_spike': False, 'rsi_required': True, 'edge_k': 1.8709623195282852, 'edge_cap': 0.9365538021173337, 'bull_strategy': 'mean_reversion', 'bull_bb_std_mult': 1.8343501617646412, 'bull_rsi_os': 40, 'bull_rsi_ob': 51, 'bull_adx_thresh': 17.462759660958817, 'bull_atr_min_pct': 0.012504494069813755, 'bull_atr_max_pct': 0.14447884593946717, 'bull_tp_mult': 1.1262930248789071, 'bull_tsl_mult': 0.21891382150113553, 'bull_time_stop': 287, 'bull_use_sma': True, 'bull_use_ema': False, 'bull_use_atr': True, 'bull_use_adx': True, 'bull_use_spike': True, 'bull_rsi_required': True, 'bear_strategy': 'breakout', 'bear_bb_std_mult': 3.2106708084439943, 'bear_rsi_os': 28, 'bear_rsi_ob': 67, 'bear_adx_thresh': 11.990473870369613, 'bear_atr_min_pct': 0.0025689425349793276, 'bear_atr_max_pct': 0.13748966238835483, 'bear_tp_mult': 2.9458640107862646, 'bear_tsl_mult': 0.6979408087670875, 'bear_time_stop': 178, 'bear_use_sma': True, 'bear_use_ema': True, 'bear_use_atr': True, 'bear_use_adx': True, 'bear_use_spike': False, 'bear_rsi_required': True, 'sideways_strategy': 'breakout', 'sideways_bb_std_mult': 2.7520573096988583, 'sideways_rsi_os': 25, 'sideways_rsi_ob': 67, 'sideways_adx_thresh': 25.091474551284474, 'sideways_atr_min_pct': 0.0020010245107556185, 'sideways_atr_max_pct': 0.12577911802064048, 'sideways_tp_mult': 1.6448480992942054, 'sideways_tsl_mult': 0.8815206406391785, 'sideways_time_stop': 278, 'sideways_use_sma': True, 'sideways_use_ema': False, 'sideways_use_atr': False, 'sideways_use_adx': True, 'sideways_use_spike': True, 'sideways_rsi_required': True}.
[I 2025-08-31 12:51:10,619] Trial 452 finished with values: [-1000000000.0, 1000000000.0] and parameters: {'p_sma': 53, 'p_std': 47, 'p_atr': 11, 'p_adx': 23, 'rsi_period': 47, 'ema1': 21, 'ema2': 18, 'slip_atr_k': 0.23882954761436714, 'slip_spread_k': 0.3504186434498403, 'spread_hl_frac': 0.02000618194913508, 'bb_std_mult': 2.2938837596485744, 'rsi_os': 14, 'rsi_ob': 66, 'vol_spike': 0.022684877346153078, 'adx_thresh': 19.682441431883074, 'atr_min_pct': 0.0027154812479182116, 'atr_max_pct': 0.06040417249003285, 'tp_mult': 1.6297225639805655, 'tsl_mult': 0.054257145939492976, 'strategy': 'breakout', 'time_stop': 176, 'use_sma': True, 'use_atr': True, 'use_adx': False, 'use_ema': True, 'use_spike': False, 'rsi_required': True, 'edge_k': 0.7377466038981371, 'edge_cap': 0.5295975048625651, 'bull_strategy': 'mean_reversion', 'bull_bb_std_mult': 1.7310149971156412, 'bull_rsi_os': 8, 'bull_rsi_ob': 51, 'bull_adx_thresh': 19.096281690048137, 'bull_atr_min_pct': 0.0065236795134056, 'bull_atr_max_pct': 0.1440221996404497, 'bull_tp_mult': 1.1892338839197516, 'bull_tsl_mult': 0.23127449862733152, 'bull_time_stop': 290, 'bull_use_sma': True, 'bull_use_ema': True, 'bull_use_atr': False, 'bull_use_adx': True, 'bull_use_spike': True, 'bull_rsi_required': False, 'bear_strategy': 'mean_reversion', 'bear_bb_std_mult': 2.938285292176733, 'bear_rsi_os': 29, 'bear_rsi_ob': 72, 'bear_adx_thresh': 11.842750833651769, 'bear_atr_min_pct': 0.002457172697701488, 'bear_atr_max_pct': 0.13799375509124592, 'bear_tp_mult': 2.412775399950371, 'bear_tsl_mult': 0.6999532168169214, 'bear_time_stop': 216, 'bear_use_sma': True, 'bear_use_ema': True, 'bear_use_atr': True, 'bear_use_adx': True, 'bear_use_spike': True, 'bear_rsi_required': True, 'sideways_strategy': 'breakout', 'sideways_bb_std_mult': 2.7536839867372356, 'sideways_rsi_os': 25, 'sideways_rsi_ob': 67, 'sideways_adx_thresh': 25.57019628364717, 'sideways_atr_min_pct': 0.021399199530964925, 'sideways_atr_max_pct': 0.12425100050573834, 'sideways_tp_mult': 1.617862374473288, 'sideways_tsl_mult': 0.9683095188107198, 'sideways_time_stop': 243, 'sideways_use_sma': True, 'sideways_use_ema': False, 'sideways_use_atr': False, 'sideways_use_adx': True, 'sideways_use_spike': True, 'sideways_rsi_required': True}.
[I 2025-08-31 12:51:41,526] Trial 456 finished with values: [-0.0198906646597099, 0.020108022915187918] and parameters: {'p_sma': 49, 'p_std': 24, 'p_atr': 12, 'p_adx': 16, 'rsi_period': 49, 'ema1': 20, 'ema2': 57, 'slip_atr_k': 0.16088114016996755, 'slip_spread_k': 0.4211799842394397, 'spread_hl_frac': 0.015424894571186206, 'bb_std_mult': 2.121304532489724, 'rsi_os': 40, 'rsi_ob': 47, 'vol_spike': 0.000319959482540072, 'adx_thresh': 19.440714256126153, 'atr_min_pct': 2.6857013960561796e-05, 'atr_max_pct': 0.11919610028396475, 'tp_mult': 1.0392114364739156, 'tsl_mult': 0.019262147717589804, 'strategy': 'breakout', 'time_stop': 149, 'use_sma': False, 'use_atr': True, 'use_adx': False, 'use_ema': True, 'use_spike': False, 'rsi_required': True, 'edge_k': 0.6242747897032148, 'edge_cap': 0.8875025202666909, 'bull_strategy': 'breakout', 'bull_bb_std_mult': 1.8513590350502895, 'bull_rsi_os': 42, 'bull_rsi_ob': 49, 'bull_adx_thresh': 23.068269997517643, 'bull_atr_min_pct': 0.012649946700866244, 'bull_atr_max_pct': 0.14483647797937566, 'bull_tp_mult': 1.3086613251906654, 'bull_tsl_mult': 0.22362305876208183, 'bull_time_stop': 294, 'bull_use_sma': True, 'bull_use_ema': False, 'bull_use_atr': False, 'bull_use_adx': True, 'bull_use_spike': True, 'bull_rsi_required': False, 'bear_strategy': 'breakout', 'bear_bb_std_mult': 3.0516520734634014, 'bear_rsi_os': 29, 'bear_rsi_ob': 51, 'bear_adx_thresh': 13.261773517456616, 'bear_atr_min_pct': 0.0017202889886475028, 'bear_atr_max_pct': 0.14291588127993024, 'bear_tp_mult': 2.0303540026091924, 'bear_tsl_mult': 0.7206296772523954, 'bear_time_stop': 195, 'bear_use_sma': True, 'bear_use_ema': True, 'bear_use_atr': True, 'bear_use_adx': True, 'bear_use_spike': False, 'bear_rsi_required': False, 'sideways_strategy': 'breakout', 'sideways_bb_std_mult': 2.6663931718043403, 'sideways_rsi_os': 30, 'sideways_rsi_ob': 66, 'sideways_adx_thresh': 26.351705619931025, 'sideways_atr_min_pct': 0.002034824328024357, 'sideways_atr_max_pct': 0.12766368307422826, 'sideways_tp_mult': 1.6929172744873475, 'sideways_tsl_mult': 0.9655671601483082, 'sideways_time_stop': 245, 'sideways_use_sma': True, 'sideways_use_ema': False, 'sideways_use_atr': False, 'sideways_use_adx': True, 'sideways_use_spike': False, 'sideways_rsi_required': True}.
[I 2025-08-31 12:51:41,877] Trial 457 finished with values: [-0.04335493985846606, 0.043175894044495185] and parameters: {'p_sma': 51, 'p_std': 25, 'p_atr': 14, 'p_adx': 16, 'rsi_period': 49, 'ema1': 20, 'ema2': 13, 'slip_atr_k': 0.05391712791967459, 'slip_spread_k': 0.4147709176381273, 'spread_hl_frac': 0.015849542556106863, 'bb_std_mult': 2.21933637889631, 'rsi_os': 32, 'rsi_ob': 77, 'vol_spike': 0.035693848710323245, 'adx_thresh': 19.60398531003232, 'atr_min_pct': 0.0005604660375452376, 'atr_max_pct': 0.11968128611477563, 'tp_mult': 2.721904759422809, 'tsl_mult': 0.5913498740393277, 'strategy': 'breakout', 'time_stop': 150, 'use_sma': False, 'use_atr': True, 'use_adx': False, 'use_ema': True, 'use_spike': False, 'rsi_required': True, 'edge_k': 0.7163156727472565, 'edge_cap': 0.7822745615409168, 'bull_strategy': 'breakout', 'bull_bb_std_mult': 2.7968600240325605, 'bull_rsi_os': 6, 'bull_rsi_ob': 49, 'bull_adx_thresh': 15.290073325499597, 'bull_atr_min_pct': 0.0011443866214571208, 'bull_atr_max_pct': 0.1497288409141369, 'bull_tp_mult': 1.4124555216018635, 'bull_tsl_mult': 0.7921424599677154, 'bull_time_stop': 295, 'bull_use_sma': True, 'bull_use_ema': True, 'bull_use_atr': False, 'bull_use_adx': False, 'bull_use_spike': False, 'bull_rsi_required': False, 'bear_strategy': 'breakout', 'bear_bb_std_mult': 3.071968875613399, 'bear_rsi_os': 6, 'bear_rsi_ob': 77, 'bear_adx_thresh': 13.431193099959106, 'bear_atr_min_pct': 0.0017073585261436156, 'bear_atr_max_pct': 0.14309024724402222, 'bear_tp_mult': 1.83667631922678, 'bear_tsl_mult': 0.7212953289178045, 'bear_time_stop': 198, 'bear_use_sma': True, 'bear_use_ema': True, 'bear_use_atr': True, 'bear_use_adx': True, 'bear_use_spike': True, 'bear_rsi_required': False, 'sideways_strategy': 'breakout', 'sideways_bb_std_mult': 2.616966949106085, 'sideways_rsi_os': 32, 'sideways_rsi_ob': 65, 'sideways_adx_thresh': 26.429075613739112, 'sideways_atr_min_pct': 0.008420102025229496, 'sideways_atr_max_pct': 0.12822077979395935, 'sideways_tp_mult': 2.4972663132688737, 'sideways_tsl_mult': 0.8588158638369896, 'sideways_time_stop': 243, 'sideways_use_sma': True, 'sideways_use_ema': False, 'sideways_use_atr': False, 'sideways_use_adx': False, 'sideways_use_spike': False, 'sideways_rsi_required': True}.
[I 2025-08-31 12:51:42,109] Trial 455 finished with values: [-0.1347762216079964, 0.13423131033167213] and parameters: {'p_sma': 37, 'p_std': 25, 'p_atr': 24, 'p_adx': 23, 'rsi_period': 52, 'ema1': 20, 'ema2': 57, 'slip_atr_k': 0.055085402517128894, 'slip_spread_k': 0.4152671170158805, 'spread_hl_frac': 0.01819861280454991, 'bb_std_mult': 2.1061640075762935, 'rsi_os': 38, 'rsi_ob': 88, 'vol_spike': 0.021276895281715957, 'adx_thresh': 12.277404821993004, 'atr_min_pct': 0.0005444204493420065, 'atr_max_pct': 0.11796020609845055, 'tp_mult': 2.7227883112952576, 'tsl_mult': 0.0002352770272286281, 'strategy': 'breakout', 'time_stop': 171, 'use_sma': False, 'use_atr': True, 'use_adx': False, 'use_ema': True, 'use_spike': False, 'rsi_required': True, 'edge_k': 0.6466057996080368, 'edge_cap': 0.5215952413909948, 'bull_strategy': 'breakout', 'bull_bb_std_mult': 1.8442903132564947, 'bull_rsi_os': 36, 'bull_rsi_ob': 51, 'bull_adx_thresh': 19.551635191043996, 'bull_atr_min_pct': 0.02020446751395922, 'bull_atr_max_pct': 0.14992935001526314, 'bull_tp_mult': 1.3190546315566027, 'bull_tsl_mult': 0.22794463256064182, 'bull_time_stop': 293, 'bull_use_sma': True, 'bull_use_ema': True, 'bull_use_atr': False, 'bull_use_adx': True, 'bull_use_spike': False, 'bull_rsi_required': False, 'bear_strategy': 'breakout', 'bear_bb_std_mult': 3.0517306470569845, 'bear_rsi_os': 45, 'bear_rsi_ob': 67, 'bear_adx_thresh': 11.864713718980195, 'bear_atr_min_pct': 0.0009084693225399083, 'bear_atr_max_pct': 0.142148597004024, 'bear_tp_mult': 2.070219556941893, 'bear_tsl_mult': 0.7100376021785862, 'bear_time_stop': 197, 'bear_use_sma': True, 'bear_use_ema': True, 'bear_use_atr': True, 'bear_use_adx': True, 'bear_use_spike': True, 'bear_rsi_required': False, 'sideways_strategy': 'breakout', 'sideways_bb_std_mult': 2.6643341267122267, 'sideways_rsi_os': 29, 'sideways_rsi_ob': 65, 'sideways_adx_thresh': 26.43255826653753, 'sideways_atr_min_pct': 0.0035330774725170163, 'sideways_atr_max_pct': 0.09626725076911294, 'sideways_tp_mult': 2.605768919791185, 'sideways_tsl_mult': 0.8850333165047877, 'sideways_time_stop': 230, 'sideways_use_sma': True, 'sideways_use_ema': False, 'sideways_use_atr': False, 'sideways_use_adx': False, 'sideways_use_spike': False, 'sideways_rsi_required': True}.
[I 2025-08-31 12:51:42,192] Trial 458 finished with values: [-0.03757640771638926, 0.0374939547662014] and parameters: {'p_sma': 55, 'p_std': 25, 'p_atr': 12, 'p_adx': 16, 'rsi_period': 49, 'ema1': 20, 'ema2': 52, 'slip_atr_k': 0.054678866540733576, 'slip_spread_k': 0.42310746758810613, 'spread_hl_frac': 0.015698118730246177, 'bb_std_mult': 2.1104615296849496, 'rsi_os': 31, 'rsi_ob': 77, 'vol_spike': 0.03654948556623938, 'adx_thresh': 12.565208655122841, 'atr_min_pct': 8.47843518478027e-05, 'atr_max_pct': 0.11945159067458558, 'tp_mult': 1.7586070697319987, 'tsl_mult': 0.36502216040396873, 'strategy': 'breakout', 'time_stop': 185, 'use_sma': False, 'use_atr': True, 'use_adx': False, 'use_ema': True, 'use_spike': False, 'rsi_required': False, 'edge_k': 0.6338501790573341, 'edge_cap': 0.4740878172198429, 'bull_strategy': 'breakout', 'bull_bb_std_mult': 2.8189568191800327, 'bull_rsi_os': 42, 'bull_rsi_ob': 49, 'bull_adx_thresh': 15.430641422927007, 'bull_atr_min_pct': 0.0011035841267907145, 'bull_atr_max_pct': 0.14768341678704472, 'bull_tp_mult': 1.410199530749936, 'bull_tsl_mult': 0.18919747973011125, 'bull_time_stop': 295, 'bull_use_sma': True, 'bull_use_ema': True, 'bull_use_atr': False, 'bull_use_adx': False, 'bull_use_spike': False, 'bull_rsi_required': False, 'bear_strategy': 'breakout', 'bear_bb_std_mult': 1.8920723440512868, 'bear_rsi_os': 14, 'bear_rsi_ob': 77, 'bear_adx_thresh': 13.562994316777157, 'bear_atr_min_pct': 0.0014756021597016997, 'bear_atr_max_pct': 0.14264428140371907, 'bear_tp_mult': 2.503583499283513, 'bear_tsl_mult': 0.7301633135286392, 'bear_time_stop': 197, 'bear_use_sma': True, 'bear_use_ema': True, 'bear_use_atr': True, 'bear_use_adx': True, 'bear_use_spike': True, 'bear_rsi_required': False, 'sideways_strategy': 'breakout', 'sideways_bb_std_mult': 2.609568504740615, 'sideways_rsi_os': 14, 'sideways_rsi_ob': 65, 'sideways_adx_thresh': 26.362711158393378, 'sideways_atr_min_pct': 0.003392876252542379, 'sideways_atr_max_pct': 0.09828344724233104, 'sideways_tp_mult': 1.9538107227028771, 'sideways_tsl_mult': 0.856286604226482, 'sideways_time_stop': 153, 'sideways_use_sma': True, 'sideways_use_ema': False, 'sideways_use_atr': False, 'sideways_use_adx': False, 'sideways_use_spike': False, 'sideways_rsi_required': True}.
