[I 2025-08-31 13:42:56,541] Trial 828 finished with values: [-1000000000.0, 1000000000.0] and parameters: {'p_sma': 30, 'p_std': 16, 'p_atr': 24, 'p_adx': 24, 'rsi_period': 67, 'ema1': 6, 'ema2': 42, 'slip_atr_k': 0.097191199450409, 'slip_spread_k': 0.40071329396164773, 'spread_hl_frac': 0.04448092694150894, 'bb_std_mult': 2.1853941844216096, 'rsi_os': 35, 'rsi_ob': 70, 'vol_spike': 0.0397537717099659, 'adx_thresh': 10.621161473688764, 'atr_min_pct': 0.02304311957764007, 'atr_max_pct': 0.0570064151523921, 'tp_mult': 2.083866430335665, 'tsl_mult': 0.7056428015411781, 'strategy': 'breakout', 'time_stop': 153, 'use_sma': False, 'use_atr': False, 'use_adx': True, 'use_ema': False, 'use_spike': True, 'rsi_required': False, 'edge_k': 0.2611972851993052, 'edge_cap': 0.4370289960175288, 'bull_strategy': 'mean_reversion', 'bull_bb_std_mult': 0.7076304975267496, 'bull_rsi_os': 6, 'bull_rsi_ob': 86, 'bull_adx_thresh': 27.393771876763026, 'bull_atr_min_pct': 0.014488881451722361, 'bull_atr_max_pct': 0.13741695789944458, 'bull_tp_mult': 2.2927126757527856, 'bull_tsl_mult': 0.46323713668131755, 'bull_time_stop': 181, 'bull_use_sma': True, 'bull_use_ema': False, 'bull_use_atr': True, 'bull_use_adx': False, 'bull_use_spike': True, 'bull_rsi_required': True, 'bear_strategy': 'breakout', 'bear_bb_std_mult': 3.2558645439793388, 'bear_rsi_os': 31, 'bear_rsi_ob': 47, 'bear_adx_thresh': 19.65379644881306, 'bear_atr_min_pct': 0.025011370807280026, 'bear_atr_max_pct': 0.12978817763101197, 'bear_tp_mult': 1.312380228794817, 'bear_tsl_mult': 0.5704384359166789, 'bear_time_stop': 188, 'bear_use_sma': False, 'bear_use_ema': True, 'bear_use_atr': False, 'bear_use_adx': False, 'bear_use_spike': True, 'bear_rsi_required': True, 'sideways_strategy': 'mean_reversion', 'sideways_bb_std_mult': 2.610905765048297, 'sideways_rsi_os': 42, 'sideways_rsi_ob': 45, 'sideways_adx_thresh': 9.58629587318526, 'sideways_atr_min_pct': 0.0029256820351316565, 'sideways_atr_max_pct': 0.14735287033794284, 'sideways_tp_mult': 2.487389641897644, 'sideways_tsl_mult': 0.8723560327397024, 'sideways_time_stop': 48, 'sideways_use_sma': False, 'sideways_use_ema': True, 'sideways_use_atr': True, 'sideways_use_adx': True, 'sideways_use_spike': False, 'sideways_rsi_required': False}.
[I 2025-08-31 13:42:57,447] Trial 830 finished with values: [-1000000000.0, 1000000000.0] and parameters: {'p_sma': 24, 'p_std': 55, 'p_atr': 24, 'p_adx': 15, 'rsi_period': 46, 'ema1': 23, 'ema2': 18, 'slip_atr_k': 0.04610682235059971, 'slip_spread_k': 0.3901168834938504, 'spread_hl_frac': 0.015891854869924445, 'bb_std_mult': 0.7776139521290766, 'rsi_os': 23, 'rsi_ob': 86, 'vol_spike': 0.04101392693353656, 'adx_thresh': 24.35297265537254, 'atr_min_pct': 0.028204711372544662, 'atr_max_pct': 0.05658083172966677, 'tp_mult': 2.5184534700681596, 'tsl_mult': 0.4277571518684438, 'strategy': 'breakout', 'time_stop': 12, 'use_sma': False, 'use_atr': False, 'use_adx': True, 'use_ema': True, 'use_spike': True, 'rsi_required': False, 'edge_k': 1.5397596995413094, 'edge_cap': 0.4118103307781644, 'bull_strategy': 'mean_reversion', 'bull_bb_std_mult': 2.616283574217951, 'bull_rsi_os': 7, 'bull_rsi_ob': 86, 'bull_adx_thresh': 18.807455782486517, 'bull_atr_min_pct': 0.005256809101122702, 'bull_atr_max_pct': 0.07225419680322503, 'bull_tp_mult': 1.5227501629430742, 'bull_tsl_mult': 0.46877228895588113, 'bull_time_stop': 241, 'bull_use_sma': True, 'bull_use_ema': False, 'bull_use_atr': True, 'bull_use_adx': False, 'bull_use_spike': True, 'bull_rsi_required': True, 'bear_strategy': 'breakout', 'bear_bb_std_mult': 1.5820187707471864, 'bear_rsi_os': 30, 'bear_rsi_ob': 47, 'bear_adx_thresh': 18.370817688948165, 'bear_atr_min_pct': 0.001002267352176536, 'bear_atr_max_pct': 0.12175240731186332, 'bear_tp_mult': 1.5027786866384374, 'bear_tsl_mult': 0.5726811071493096, 'bear_time_stop': 64, 'bear_use_sma': False, 'bear_use_ema': False, 'bear_use_atr': False, 'bear_use_adx': False, 'bear_use_spike': True, 'bear_rsi_required': True, 'sideways_strategy': 'breakout', 'sideways_bb_std_mult': 2.7098588013643754, 'sideways_rsi_os': 30, 'sideways_rsi_ob': 64, 'sideways_adx_thresh': 22.957784242922102, 'sideways_atr_min_pct': 0.010236300730163342, 'sideways_atr_max_pct': 0.1441553271005745, 'sideways_tp_mult': 2.7468694466228363, 'sideways_tsl_mult': 0.8672370664855565, 'sideways_time_stop': 40, 'sideways_use_sma': False, 'sideways_use_ema': False, 'sideways_use_atr': True, 'sideways_use_adx': True, 'sideways_use_spike': False, 'sideways_rsi_required': True}.
[I 2025-08-31 13:42:57,912] Trial 829 finished with values: [-0.029848664400972336, 0.02925294049026105] and parameters: {'p_sma': 39, 'p_std': 22, 'p_atr': 25, 'p_adx': 15, 'rsi_period': 46, 'ema1': 11, 'ema2': 49, 'slip_atr_k': 0.029694493025255786, 'slip_spread_k': 0.3989885698824421, 'spread_hl_frac': 0.01967435377132117, 'bb_std_mult': 3.2387429733409174, 'rsi_os': 23, 'rsi_ob': 70, 'vol_spike': 0.03883431578950573, 'adx_thresh': 10.54739333247492, 'atr_min_pct': 0.02716504850147747, 'atr_max_pct': 0.05441544054089304, 'tp_mult': 2.5336456378877994, 'tsl_mult': 0.659925966170102, 'strategy': 'breakout', 'time_stop': 154, 'use_sma': False, 'use_atr': False, 'use_adx': True, 'use_ema': False, 'use_spike': True, 'rsi_required': False, 'edge_k': 0.2750386863480777, 'edge_cap': 0.6703949855005297, 'bull_strategy': 'mean_reversion', 'bull_bb_std_mult': 2.639315296300405, 'bull_rsi_os': 7, 'bull_rsi_ob': 86, 'bull_adx_thresh': 18.842182408629863, 'bull_atr_min_pct': 0.021176672654314894, 'bull_atr_max_pct': 0.13781324184039975, 'bull_tp_mult': 2.2610593931988268, 'bull_tsl_mult': 0.2514766806289339, 'bull_time_stop': 193, 'bull_use_sma': True, 'bull_use_ema': False, 'bull_use_atr': True, 'bull_use_adx': False, 'bull_use_spike': True, 'bull_rsi_required': True, 'bear_strategy': 'breakout', 'bear_bb_std_mult': 1.5788116571241995, 'bear_rsi_os': 31, 'bear_rsi_ob': 63, 'bear_adx_thresh': 18.346344968639343, 'bear_atr_min_pct': 0.0012506289327637223, 'bear_atr_max_pct': 0.032404600088614594, 'bear_tp_mult': 1.1924320560978963, 'bear_tsl_mult': 0.7392687921543121, 'bear_time_stop': 207, 'bear_use_sma': False, 'bear_use_ema': True, 'bear_use_atr': False, 'bear_use_adx': False, 'bear_use_spike': True, 'bear_rsi_required': True, 'sideways_strategy': 'mean_reversion', 'sideways_bb_std_mult': 2.741396250354586, 'sideways_rsi_os': 41, 'sideways_rsi_ob': 64, 'sideways_adx_thresh': 16.32615725782166, 'sideways_atr_min_pct': 0.009231347201047194, 'sideways_atr_max_pct': 0.08415572633499141, 'sideways_tp_mult': 1.1548166461530611, 'sideways_tsl_mult': 0.9404800086501184, 'sideways_time_stop': 40, 'sideways_use_sma': False, 'sideways_use_ema': True, 'sideways_use_atr': True, 'sideways_use_adx': True, 'sideways_use_spike': False, 'sideways_rsi_required': True}.
[I 2025-08-31 13:43:30,652] Trial 833 finished with values: [-1000000000.0, 1000000000.0] and parameters: {'p_sma': 23, 'p_std': 33, 'p_atr': 25, 'p_adx': 15, 'rsi_period': 50, 'ema1': 10, 'ema2': 19, 'slip_atr_k': 0.03002753780446443, 'slip_spread_k': 0.9097189460341525, 'spread_hl_frac': 0.014263756607409616, 'bb_std_mult': 2.3564585870031034, 'rsi_os': 15, 'rsi_ob': 92, 'vol_spike': 0.1269449202677742, 'adx_thresh': 14.69964608377694, 'atr_min_pct': 0.027102035713549775, 'atr_max_pct': 0.08720147921502591, 'tp_mult': 2.5568967018930686, 'tsl_mult': 0.6478439324784893, 'strategy': 'mean_reversion', 'time_stop': 168, 'use_sma': True, 'use_atr': False, 'use_adx': True, 'use_ema': True, 'use_spike': True, 'rsi_required': False, 'edge_k': 1.6059392057945963, 'edge_cap': 0.6638092687503373, 'bull_strategy': 'mean_reversion', 'bull_bb_std_mult': 1.6432443443908609, 'bull_rsi_os': 27, 'bull_rsi_ob': 84, 'bull_adx_thresh': 16.981824491538134, 'bull_atr_min_pct': 0.011202658157107567, 'bull_atr_max_pct': 0.14143396781686016, 'bull_tp_mult': 2.373076655049547, 'bull_tsl_mult': 0.24738380479699829, 'bull_time_stop': 194, 'bull_use_sma': True, 'bull_use_ema': True, 'bull_use_atr': True, 'bull_use_adx': True, 'bull_use_spike': True, 'bull_rsi_required': True, 'bear_strategy': 'breakout', 'bear_bb_std_mult': 3.4968694881299807, 'bear_rsi_os': 29, 'bear_rsi_ob': 67, 'bear_adx_thresh': 18.659811818766304, 'bear_atr_min_pct': 0.0006272727395768263, 'bear_atr_max_pct': 0.026606357536057154, 'bear_tp_mult': 1.1562671215540683, 'bear_tsl_mult': 0.7324053783416608, 'bear_time_stop': 206, 'bear_use_sma': False, 'bear_use_ema': True, 'bear_use_atr': False, 'bear_use_adx': False, 'bear_use_spike': True, 'bear_rsi_required': False, 'sideways_strategy': 'breakout', 'sideways_bb_std_mult': 2.7511182598659816, 'sideways_rsi_os': 28, 'sideways_rsi_ob': 66, 'sideways_adx_thresh': 7.2561933017904945, 'sideways_atr_min_pct': 0.019071090615831083, 'sideways_atr_max_pct': 0.11276409678097751, 'sideways_tp_mult': 1.1521866650720196, 'sideways_tsl_mult': 0.07245037752002759, 'sideways_time_stop': 39, 'sideways_use_sma': False, 'sideways_use_ema': False, 'sideways_use_atr': True, 'sideways_use_adx': True, 'sideways_use_spike': False, 'sideways_rsi_required': True}.
[I 2025-08-31 13:43:30,839] Trial 831 finished with values: [-1000000000.0, 1000000000.0] and parameters: {'p_sma': 25, 'p_std': 49, 'p_atr': 29, 'p_adx': 15, 'rsi_period': 50, 'ema1': 12, 'ema2': 18, 'slip_atr_k': 0.046342768373087304, 'slip_spread_k': 0.3916088962218719, 'spread_hl_frac': 0.01589513656615226, 'bb_std_mult': 3.2372651675621396, 'rsi_os': 46, 'rsi_ob': 92, 'vol_spike': 0.06255187460735404, 'adx_thresh': 10.709071544793847, 'atr_min_pct': 0.02348638769931128, 'atr_max_pct': 0.028280293520924385, 'tp_mult': 2.5034708915360167, 'tsl_mult': 0.5111843493188211, 'strategy': 'mean_reversion', 'time_stop': 291, 'use_sma': False, 'use_atr': False, 'use_adx': True, 'use_ema': True, 'use_spike': True, 'rsi_required': False, 'edge_k': 0.5872048331675621, 'edge_cap': 0.43282532654349093, 'bull_strategy': 'mean_reversion', 'bull_bb_std_mult': 2.258488631022719, 'bull_rsi_os': 27, 'bull_rsi_ob': 84, 'bull_adx_thresh': 16.912570138577063, 'bull_atr_min_pct': 0.005179153383197813, 'bull_atr_max_pct': 0.13815664716060053, 'bull_tp_mult': 2.364235686240464, 'bull_tsl_mult': 0.903859873908369, 'bull_time_stop': 196, 'bull_use_sma': True, 'bull_use_ema': False, 'bull_use_atr': True, 'bull_use_adx': False, 'bull_use_spike': True, 'bull_rsi_required': True, 'bear_strategy': 'breakout', 'bear_bb_std_mult': 3.494246992406916, 'bear_rsi_os': 30, 'bear_rsi_ob': 63, 'bear_adx_thresh': 18.72624168864555, 'bear_atr_min_pct': 0.0010505443495993445, 'bear_atr_max_pct': 0.12256701148395498, 'bear_tp_mult': 1.602171146293309, 'bear_tsl_mult': 0.7349602201911505, 'bear_time_stop': 189, 'bear_use_sma': False, 'bear_use_ema': False, 'bear_use_atr': False, 'bear_use_adx': False, 'bear_use_spike': True, 'bear_rsi_required': True, 'sideways_strategy': 'breakout', 'sideways_bb_std_mult': 2.7321405108160115, 'sideways_rsi_os': 30, 'sideways_rsi_ob': 95, 'sideways_adx_thresh': 16.440413185343033, 'sideways_atr_min_pct': 0.023434530770773017, 'sideways_atr_max_pct': 0.11133966235210144, 'sideways_tp_mult': 1.7422086367449459, 'sideways_tsl_mult': 0.8734173001491274, 'sideways_time_stop': 39, 'sideways_use_sma': False, 'sideways_use_ema': False, 'sideways_use_atr': True, 'sideways_use_adx': True, 'sideways_use_spike': False, 'sideways_rsi_required': True}.
[I 2025-08-31 13:43:31,260] Trial 832 finished with values: [-1000000000.0, 1000000000.0] and parameters: {'p_sma': 26, 'p_std': 33, 'p_atr': 30, 'p_adx': 15, 'rsi_period': 48, 'ema1': 23, 'ema2': 19, 'slip_atr_k': 0.04624422507288826, 'slip_spread_k': 0.047974726642566023, 'spread_hl_frac': 0.01581875448759963, 'bb_std_mult': 2.336654770651339, 'rsi_os': 13, 'rsi_ob': 53, 'vol_spike': 0.16778430581896275, 'adx_thresh': 34.95636519130392, 'atr_min_pct': 0.027017933981369802, 'atr_max_pct': 0.0539764762120107, 'tp_mult': 2.5013223887764657, 'tsl_mult': 0.4229924194911756, 'strategy': 'mean_reversion', 'time_stop': 167, 'use_sma': True, 'use_atr': False, 'use_adx': True, 'use_ema': True, 'use_spike': True, 'rsi_required': False, 'edge_k': 0.5847034647876004, 'edge_cap': 0.6663243482177859, 'bull_strategy': 'mean_reversion', 'bull_bb_std_mult': 2.8675210601575216, 'bull_rsi_os': 28, 'bull_rsi_ob': 84, 'bull_adx_thresh': 34.186796933195666, 'bull_atr_min_pct': 0.005113289987412261, 'bull_atr_max_pct': 0.14083815093802002, 'bull_tp_mult': 1.4600049932231585, 'bull_tsl_mult': 0.25234748279236685, 'bull_time_stop': 155, 'bull_use_sma': True, 'bull_use_ema': True, 'bull_use_atr': True, 'bull_use_adx': True, 'bull_use_spike': True, 'bull_rsi_required': True, 'bear_strategy': 'breakout', 'bear_bb_std_mult': 3.510370234840937, 'bear_rsi_os': 30, 'bear_rsi_ob': 49, 'bear_adx_thresh': 18.429993468966195, 'bear_atr_min_pct': 0.0011297647501045623, 'bear_atr_max_pct': 0.13386111498289377, 'bear_tp_mult': 1.1453546791921443, 'bear_tsl_mult': 0.7388880906729964, 'bear_time_stop': 206, 'bear_use_sma': False, 'bear_use_ema': False, 'bear_use_atr': False, 'bear_use_adx': False, 'bear_use_spike': True, 'bear_rsi_required': True, 'sideways_strategy': 'breakout', 'sideways_bb_std_mult': 2.7230428956812145, 'sideways_rsi_os': 33, 'sideways_rsi_ob': 49, 'sideways_adx_thresh': 17.37514837931413, 'sideways_atr_min_pct': 0.013631127913519699, 'sideways_atr_max_pct': 0.14414142287595091, 'sideways_tp_mult': 2.58256938475854, 'sideways_tsl_mult': 0.9374683345204534, 'sideways_time_stop': 39, 'sideways_use_sma': False, 'sideways_use_ema': False, 'sideways_use_atr': True, 'sideways_use_adx': True, 'sideways_use_spike': False, 'sideways_rsi_required': True}.
[I 2025-08-31 13:43:31,341] Trial 834 finished with values: [-1000000000.0, 1000000000.0] and parameters: {'p_sma': 23, 'p_std': 22, 'p_atr': 17, 'p_adx': 21, 'rsi_period': 50, 'ema1': 12, 'ema2': 19, 'slip_atr_k': 0.04573997740083741, 'slip_spread_k': 0.07598879735163405, 'spread_hl_frac': 0.01720466943426858, 'bb_std_mult': 2.904108585142766, 'rsi_os': 43, 'rsi_ob': 88, 'vol_spike': 0.06220174442047109, 'adx_thresh': 6.764446272359654, 'atr_min_pct': 0.006288030574882576, 'atr_max_pct': 0.03843111353481163, 'tp_mult': 2.478139732538941, 'tsl_mult': 0.8890655166306678, 'strategy': 'mean_reversion', 'time_stop': 265, 'use_sma': True, 'use_atr': False, 'use_adx': True, 'use_ema': True, 'use_spike': True, 'rsi_required': False, 'edge_k': 0.5902361085242804, 'edge_cap': 0.16115448349424466, 'bull_strategy': 'mean_reversion', 'bull_bb_std_mult': 1.4766329854663138, 'bull_rsi_os': 40, 'bull_rsi_ob': 85, 'bull_adx_thresh': 16.927872564494596, 'bull_atr_min_pct': 0.020254756521173194, 'bull_atr_max_pct': 0.14061618966567985, 'bull_tp_mult': 2.335025502541963, 'bull_tsl_mult': 0.2502437784963804, 'bull_time_stop': 143, 'bull_use_sma': True, 'bull_use_ema': True, 'bull_use_atr': True, 'bull_use_adx': True, 'bull_use_spike': True, 'bull_rsi_required': True, 'bear_strategy': 'breakout', 'bear_bb_std_mult': 3.483363472336812, 'bear_rsi_os': 29, 'bear_rsi_ob': 72, 'bear_adx_thresh': 20.158216108712715, 'bear_atr_min_pct': 0.0005290335572240765, 'bear_atr_max_pct': 0.12478852958431465, 'bear_tp_mult': 1.361608748141538, 'bear_tsl_mult': 0.6683001532233557, 'bear_time_stop': 271, 'bear_use_sma': False, 'bear_use_ema': False, 'bear_use_atr': False, 'bear_use_adx': False, 'bear_use_spike': True, 'bear_rsi_required': False, 'sideways_strategy': 'breakout', 'sideways_bb_std_mult': 2.6867245787840646, 'sideways_rsi_os': 19, 'sideways_rsi_ob': 95, 'sideways_adx_thresh': 25.549478340164594, 'sideways_atr_min_pct': 0.003405897872638461, 'sideways_atr_max_pct': 0.11467845713576827, 'sideways_tp_mult': 1.7280885840083338, 'sideways_tsl_mult': 0.5059999455982089, 'sideways_time_stop': 39, 'sideways_use_sma': False, 'sideways_use_ema': False, 'sideways_use_atr': True, 'sideways_use_adx': True, 'sideways_use_spike': False, 'sideways_rsi_required': True}.
[I 2025-08-31 13:44:04,041] Trial 837 finished with values: [-1000000000.0, 1000000000.0] and parameters: {'p_sma': 5, 'p_std': 53, 'p_atr': 22, 'p_adx': 13, 'rsi_period': 48, 'ema1': 24, 'ema2': 20, 'slip_atr_k': 0.03484156290339102, 'slip_spread_k': 0.0782909447223959, 'spread_hl_frac': 0.016861410753481777, 'bb_std_mult': 2.2890003227895335, 'rsi_os': 39, 'rsi_ob': 88, 'vol_spike': 0.012092279155062374, 'adx_thresh': 6.977186582768706, 'atr_min_pct': 0.006404261394409205, 'atr_max_pct': 0.012376408948878204, 'tp_mult': 2.5867600905818366, 'tsl_mult': 0.8944703745812441, 'strategy': 'breakout', 'time_stop': 186, 'use_sma': False, 'use_atr': False, 'use_adx': True, 'use_ema': True, 'use_spike': True, 'rsi_required': False, 'edge_k': 0.6496282640991718, 'edge_cap': 0.6475631493251357, 'bull_strategy': 'mean_reversion', 'bull_bb_std_mult': 2.7405640747080184, 'bull_rsi_os': 25, 'bull_rsi_ob': 84, 'bull_adx_thresh': 17.69461093905356, 'bull_atr_min_pct': 0.025197945494499288, 'bull_atr_max_pct': 0.14431847728218716, 'bull_tp_mult': 1.0199758688813878, 'bull_tsl_mult': 0.26996797243306264, 'bull_time_stop': 142, 'bull_use_sma': True, 'bull_use_ema': True, 'bull_use_atr': True, 'bull_use_adx': True, 'bull_use_spike': True, 'bull_rsi_required': True, 'bear_strategy': 'breakout', 'bear_bb_std_mult': 3.433071029958009, 'bear_rsi_os': 33, 'bear_rsi_ob': 72, 'bear_adx_thresh': 20.249846211823076, 'bear_atr_min_pct': 0.002346470847229043, 'bear_atr_max_pct': 0.12492911248797953, 'bear_tp_mult': 1.357106017440619, 'bear_tsl_mult': 0.6525270417068515, 'bear_time_stop': 295, 'bear_use_sma': False, 'bear_use_ema': True, 'bear_use_atr': False, 'bear_use_adx': False, 'bear_use_spike': False, 'bear_rsi_required': False, 'sideways_strategy': 'breakout', 'sideways_bb_std_mult': 3.3632925669327096, 'sideways_rsi_os': 26, 'sideways_rsi_ob': 68, 'sideways_adx_thresh': 25.659240208642384, 'sideways_atr_min_pct': 0.0034831981778037993, 'sideways_atr_max_pct': 0.14992602692196605, 'sideways_tp_mult': 1.7143302742599824, 'sideways_tsl_mult': 0.8430696025543055, 'sideways_time_stop': 54, 'sideways_use_sma': False, 'sideways_use_ema': False, 'sideways_use_atr': True, 'sideways_use_adx': True, 'sideways_use_spike': False, 'sideways_rsi_required': True}.
[I 2025-08-31 13:44:04,426] Trial 836 finished with values: [-0.02691340654883001, 0.02630626414363344] and parameters: {'p_sma': 36, 'p_std': 12, 'p_atr': 17, 'p_adx': 19, 'rsi_period': 62, 'ema1': 9, 'ema2': 27, 'slip_atr_k': 0.052297980141824234, 'slip_spread_k': 0.5936596774287188, 'spread_hl_frac': 0.009727550367417244, 'bb_std_mult': 2.3118508055971856, 'rsi_os': 55, 'rsi_ob': 88, 'vol_spike': 0.012717321849537565, 'adx_thresh': 7.505213885415371, 'atr_min_pct': 0.008694588812760334, 'atr_max_pct': 0.01283837164270557, 'tp_mult': 2.596755523746053, 'tsl_mult': 0.23942967299908496, 'strategy': 'breakout', 'time_stop': 54, 'use_sma': True, 'use_atr': False, 'use_adx': True, 'use_ema': True, 'use_spike': True, 'rsi_required': False, 'edge_k': 1.7142348184890341, 'edge_cap': 0.6494143545784866, 'bull_strategy': 'mean_reversion', 'bull_bb_std_mult': 2.8808943643122245, 'bull_rsi_os': 8, 'bull_rsi_ob': 84, 'bull_adx_thresh': 5.032368851851885, 'bull_atr_min_pct': 0.021736019629137827, 'bull_atr_max_pct': 0.14072818788288977, 'bull_tp_mult': 2.182365507376341, 'bull_tsl_mult': 0.5305589880899788, 'bull_time_stop': 155, 'bull_use_sma': True, 'bull_use_ema': True, 'bull_use_atr': True, 'bull_use_adx': True, 'bull_use_spike': True, 'bull_rsi_required': True, 'bear_strategy': 'breakout', 'bear_bb_std_mult': 3.4146818178566525, 'bear_rsi_os': 33, 'bear_rsi_ob': 72, 'bear_adx_thresh': 20.393457494282103, 'bear_atr_min_pct': 0.002304193689500544, 'bear_atr_max_pct': 0.08314778277671259, 'bear_tp_mult': 2.667657853559899, 'bear_tsl_mult': 0.6528228457650322, 'bear_time_stop': 88, 'bear_use_sma': False, 'bear_use_ema': True, 'bear_use_atr': False, 'bear_use_adx': False, 'bear_use_spike': False, 'bear_rsi_required': False, 'sideways_strategy': 'breakout', 'sideways_bb_std_mult': 3.354187500122099, 'sideways_rsi_os': 33, 'sideways_rsi_ob': 66, 'sideways_adx_thresh': 23.248983529191563, 'sideways_atr_min_pct': 0.003532803073482661, 'sideways_atr_max_pct': 0.1499574457947759, 'sideways_tp_mult': 1.9001494421030738, 'sideways_tsl_mult': 0.8376401564305322, 'sideways_time_stop': 45, 'sideways_use_sma': False, 'sideways_use_ema': False, 'sideways_use_atr': True, 'sideways_use_adx': True, 'sideways_use_spike': False, 'sideways_rsi_required': True}.
