[I 2025-08-31 12:52:15,768] Trial 460 finished with values: [-1000000000.0, 1000000000.0] and parameters: {'p_sma': 14, 'p_std': 23, 'p_atr': 17, 'p_adx': 14, 'rsi_period': 52, 'ema1': 19, 'ema2': 57, 'slip_atr_k': 0.2037722354825348, 'slip_spread_k': 0.3761034738733852, 'spread_hl_frac': 0.04553914104761644, 'bb_std_mult': 2.4479794396649637, 'rsi_os': 40, 'rsi_ob': 78, 'vol_spike': 0.01103640418857565, 'adx_thresh': 11.856073549927235, 'atr_min_pct': 0.001745693155021313, 'atr_max_pct': 0.10535389849502692, 'tp_mult': 1.468479174692459, 'tsl_mult': 0.018696469826719908, 'strategy': 'breakout', 'time_stop': 184, 'use_sma': False, 'use_atr': True, 'use_adx': False, 'use_ema': True, 'use_spike': True, 'rsi_required': True, 'edge_k': 0.6028924587218271, 'edge_cap': 0.8953902585708544, 'bull_strategy': 'breakout', 'bull_bb_std_mult': 2.8357927929280438, 'bull_rsi_os': 35, 'bull_rsi_ob': 47, 'bull_adx_thresh': 21.534872263981043, 'bull_atr_min_pct': 0.02033282982912312, 'bull_atr_max_pct': 0.13787089635829092, 'bull_tp_mult': 1.2573017996924563, 'bull_tsl_mult': 0.8345391378870891, 'bull_time_stop': 272, 'bull_use_sma': True, 'bull_use_ema': True, 'bull_use_atr': False, 'bull_use_adx': True, 'bull_use_spike': False, 'bull_rsi_required': False, 'bear_strategy': 'breakout', 'bear_bb_std_mult': 0.535188299452364, 'bear_rsi_os': 13, 'bear_rsi_ob': 90, 'bear_adx_thresh': 15.945713360517301, 'bear_atr_min_pct': 0.000779020953365942, 'bear_atr_max_pct': 0.11948123258644089, 'bear_tp_mult': 1.2133745722527973, 'bear_tsl_mult': 0.774414206065721, 'bear_time_stop': 206, 'bear_use_sma': True, 'bear_use_ema': False, 'bear_use_atr': False, 'bear_use_adx': False, 'bear_use_spike': True, 'bear_rsi_required': False, 'sideways_strategy': 'breakout', 'sideways_bb_std_mult': 2.677867829790742, 'sideways_rsi_os': 29, 'sideways_rsi_ob': 66, 'sideways_adx_thresh': 26.261708135083524, 'sideways_atr_min_pct': 0.0038746320839642247, 'sideways_atr_max_pct': 0.13259582759830732, 'sideways_tp_mult': 1.9359703609487346, 'sideways_tsl_mult': 0.13134572290290686, 'sideways_time_stop': 206, 'sideways_use_sma': True, 'sideways_use_ema': False, 'sideways_use_atr': True, 'sideways_use_adx': False, 'sideways_use_spike': False, 'sideways_rsi_required': True}.
[I 2025-08-31 12:52:16,240] Trial 459 finished with values: [-0.0629643089164732, 0.06232844346043305] and parameters: {'p_sma': 24, 'p_std': 23, 'p_atr': 12, 'p_adx': 16, 'rsi_period': 49, 'ema1': 20, 'ema2': 13, 'slip_atr_k': 0.055963655754709934, 'slip_spread_k': 0.42007166009039915, 'spread_hl_frac': 0.015506703248944318, 'bb_std_mult': 3.2428479167001933, 'rsi_os': 31, 'rsi_ob': 49, 'vol_spike': 0.03573563478776036, 'adx_thresh': 19.75600741889626, 'atr_min_pct': 0.012461101034206097, 'atr_max_pct': 0.11815400653434732, 'tp_mult': 2.9928135460599528, 'tsl_mult': 0.5547482918337562, 'strategy': 'breakout', 'time_stop': 148, 'use_sma': False, 'use_atr': True, 'use_adx': False, 'use_ema': True, 'use_spike': False, 'rsi_required': True, 'edge_k': 0.1864511133321597, 'edge_cap': 0.7811582473417461, 'bull_strategy': 'breakout', 'bull_bb_std_mult': 2.8215317279051244, 'bull_rsi_os': 55, 'bull_rsi_ob': 49, 'bull_adx_thresh': 23.127803993652957, 'bull_atr_min_pct': 0.020287690936591305, 'bull_atr_max_pct': 0.14995463177498464, 'bull_tp_mult': 1.2529376273890818, 'bull_tsl_mult': 0.22977570543090148, 'bull_time_stop': 296, 'bull_use_sma': True, 'bull_use_ema': True, 'bull_use_atr': False, 'bull_use_adx': False, 'bull_use_spike': False, 'bull_rsi_required': False, 'bear_strategy': 'breakout', 'bear_bb_std_mult': 0.5536416939751809, 'bear_rsi_os': 37, 'bear_rsi_ob': 49, 'bear_adx_thresh': 13.50498579675161, 'bear_atr_min_pct': 0.0016595249268148342, 'bear_atr_max_pct': 0.11909469050882662, 'bear_tp_mult': 2.0631569625841455, 'bear_tsl_mult': 0.7714940979871888, 'bear_time_stop': 197, 'bear_use_sma': True, 'bear_use_ema': False, 'bear_use_atr': True, 'bear_use_adx': False, 'bear_use_spike': True, 'bear_rsi_required': False, 'sideways_strategy': 'breakout', 'sideways_bb_std_mult': 2.6693932572124552, 'sideways_rsi_os': 17, 'sideways_rsi_ob': 65, 'sideways_adx_thresh': 26.281766583109274, 'sideways_atr_min_pct': 0.001901159462783966, 'sideways_atr_max_pct': 0.12795108561512014, 'sideways_tp_mult': 2.4756381388729074, 'sideways_tsl_mult': 0.12319941569271481, 'sideways_time_stop': 154, 'sideways_use_sma': True, 'sideways_use_ema': False, 'sideways_use_atr': True, 'sideways_use_adx': False, 'sideways_use_spike': False, 'sideways_rsi_required': True}.
[I 2025-08-31 12:52:16,515] Trial 462 finished with values: [-1000000000.0, 1000000000.0] and parameters: {'p_sma': 14, 'p_std': 22, 'p_atr': 29, 'p_adx': 14, 'rsi_period': 51, 'ema1': 19, 'ema2': 12, 'slip_atr_k': 0.0476670897363971, 'slip_spread_k': 0.36873146474110424, 'spread_hl_frac': 0.016792764252346992, 'bb_std_mult': 2.4206552237055403, 'rsi_os': 40, 'rsi_ob': 91, 'vol_spike': 0.011152067586444377, 'adx_thresh': 11.709325348557796, 'atr_min_pct': 0.004619911896276816, 'atr_max_pct': 0.11569825521782523, 'tp_mult': 1.2577004878053257, 'tsl_mult': 0.8624935534086786, 'strategy': 'breakout', 'time_stop': 183, 'use_sma': False, 'use_atr': False, 'use_adx': False, 'use_ema': True, 'use_spike': True, 'rsi_required': True, 'edge_k': 0.1682430260696407, 'edge_cap': 0.6887034470036008, 'bull_strategy': 'breakout', 'bull_bb_std_mult': 1.1603002055918985, 'bull_rsi_os': 34, 'bull_rsi_ob': 47, 'bull_adx_thresh': 23.31037518420403, 'bull_atr_min_pct': 0.010201224638936843, 'bull_atr_max_pct': 0.14623868287105704, 'bull_tp_mult': 1.2578974539169774, 'bull_tsl_mult': 0.8430505260485477, 'bull_time_stop': 285, 'bull_use_sma': False, 'bull_use_ema': True, 'bull_use_atr': False, 'bull_use_adx': True, 'bull_use_spike': False, 'bull_rsi_required': False, 'bear_strategy': 'breakout', 'bear_bb_std_mult': 0.5745602033994781, 'bear_rsi_os': 37, 'bear_rsi_ob': 73, 'bear_adx_thresh': 15.88126184714552, 'bear_atr_min_pct': 0.003908954964909042, 'bear_atr_max_pct': 0.1162081380597917, 'bear_tp_mult': 1.9577132336208711, 'bear_tsl_mult': 0.7604880034475584, 'bear_time_stop': 190, 'bear_use_sma': False, 'bear_use_ema': False, 'bear_use_atr': False, 'bear_use_adx': False, 'bear_use_spike': True, 'bear_rsi_required': True, 'sideways_strategy': 'mean_reversion', 'sideways_bb_std_mult': 2.6917308169419623, 'sideways_rsi_os': 45, 'sideways_rsi_ob': 66, 'sideways_adx_thresh': 22.719783438728705, 'sideways_atr_min_pct': 0.01309417950768145, 'sideways_atr_max_pct': 0.1321067755414286, 'sideways_tp_mult': 1.5765917076073477, 'sideways_tsl_mult': 0.7754940190498905, 'sideways_time_stop': 89, 'sideways_use_sma': False, 'sideways_use_ema': True, 'sideways_use_atr': True, 'sideways_use_adx': False, 'sideways_use_spike': False, 'sideways_rsi_required': False}.
[I 2025-08-31 12:52:16,676] Trial 461 finished with values: [-1000000000.0, 1000000000.0] and parameters: {'p_sma': 22, 'p_std': 22, 'p_atr': 17, 'p_adx': 14, 'rsi_period': 51, 'ema1': 19, 'ema2': 51, 'slip_atr_k': 0.048271895271140654, 'slip_spread_k': 0.37769371604650886, 'spread_hl_frac': 0.0165701744173482, 'bb_std_mult': 2.4385272860561518, 'rsi_os': 40, 'rsi_ob': 94, 'vol_spike': 0.012286550501793772, 'adx_thresh': 20.859450394419326, 'atr_min_pct': 0.004644175070560388, 'atr_max_pct': 0.12477206451814875, 'tp_mult': 2.688625462486358, 'tsl_mult': 0.8706116275437193, 'strategy': 'breakout', 'time_stop': 181, 'use_sma': False, 'use_atr': True, 'use_adx': False, 'use_ema': True, 'use_spike': True, 'rsi_required': True, 'edge_k': 0.6168003049646789, 'edge_cap': 0.8382800011499243, 'bull_strategy': 'breakout', 'bull_bb_std_mult': 1.1685762717213939, 'bull_rsi_os': 42, 'bull_rsi_ob': 48, 'bull_adx_thresh': 21.74867292632529, 'bull_atr_min_pct': 0.008911664478794872, 'bull_atr_max_pct': 0.1457432257228273, 'bull_tp_mult': 1.2585983081129755, 'bull_tsl_mult': 0.5519132949645456, 'bull_time_stop': 269, 'bull_use_sma': False, 'bull_use_ema': True, 'bull_use_atr': False, 'bull_use_adx': False, 'bull_use_spike': False, 'bull_rsi_required': False, 'bear_strategy': 'breakout', 'bear_bb_std_mult': 3.103155711391903, 'bear_rsi_os': 11, 'bear_rsi_ob': 84, 'bear_adx_thresh': 15.938201986910197, 'bear_atr_min_pct': 0.003860287374621453, 'bear_atr_max_pct': 0.12387147694213627, 'bear_tp_mult': 2.484764953113101, 'bear_tsl_mult': 0.7774128839268164, 'bear_time_stop': 207, 'bear_use_sma': False, 'bear_use_ema': False, 'bear_use_atr': False, 'bear_use_adx': False, 'bear_use_spike': True, 'bear_rsi_required': True, 'sideways_strategy': 'breakout', 'sideways_bb_std_mult': 2.468075002533133, 'sideways_rsi_os': 20, 'sideways_rsi_ob': 66, 'sideways_adx_thresh': 27.977906609989027, 'sideways_atr_min_pct': 0.0021245386041082587, 'sideways_atr_max_pct': 0.13244710062408344, 'sideways_tp_mult': 2.9591171158801632, 'sideways_tsl_mult': 0.8445731754195531, 'sideways_time_stop': 88, 'sideways_use_sma': False, 'sideways_use_ema': True, 'sideways_use_atr': True, 'sideways_use_adx': False, 'sideways_use_spike': False, 'sideways_rsi_required': True}.
[I 2025-08-31 12:52:48,577] Trial 466 finished with values: [-1000000000.0, 1000000000.0] and parameters: {'p_sma': 19, 'p_std': 26, 'p_atr': 12, 'p_adx': 7, 'rsi_period': 45, 'ema1': 21, 'ema2': 30, 'slip_atr_k': 0.13288395299002437, 'slip_spread_k': 0.47466881298452424, 'spread_hl_frac': 0.00546197999734218, 'bb_std_mult': 2.217004485487174, 'rsi_os': 50, 'rsi_ob': 79, 'vol_spike': 0.016850427803944384, 'adx_thresh': 27.47372256244966, 'atr_min_pct': 0.007023342842146804, 'atr_max_pct': 0.030436880414314527, 'tp_mult': 2.777124441395755, 'tsl_mult': 0.7408799841650571, 'strategy': 'breakout', 'time_stop': 53, 'use_sma': False, 'use_atr': False, 'use_adx': True, 'use_ema': True, 'use_spike': False, 'rsi_required': False, 'edge_k': 0.792582668594291, 'edge_cap': 0.6062169550749026, 'bull_strategy': 'mean_reversion', 'bull_bb_std_mult': 2.705298842530518, 'bull_rsi_os': 51, 'bull_rsi_ob': 52, 'bull_adx_thresh': 12.316345388013115, 'bull_atr_min_pct': 0.019483418541143972, 'bull_atr_max_pct': 0.14264741879522502, 'bull_tp_mult': 1.2992545847319894, 'bull_tsl_mult': 0.9424623012239504, 'bull_time_stop': 286, 'bull_use_sma': True, 'bull_use_ema': False, 'bull_use_atr': True, 'bull_use_adx': True, 'bull_use_spike': False, 'bull_rsi_required': True, 'bear_strategy': 'mean_reversion', 'bear_bb_std_mult': 3.2900437427390297, 'bear_rsi_os': 28, 'bear_rsi_ob': 68, 'bear_adx_thresh': 10.852337434016961, 'bear_atr_min_pct': 0.0031565021960708803, 'bear_atr_max_pct': 0.1297866348515012, 'bear_tp_mult': 1.0471915738296338, 'bear_tsl_mult': 0.7415528794424588, 'bear_time_stop': 191, 'bear_use_sma': True, 'bear_use_ema': True, 'bear_use_atr': True, 'bear_use_adx': True, 'bear_use_spike': False, 'bear_rsi_required': True, 'sideways_strategy': 'mean_reversion', 'sideways_bb_std_mult': 2.544007371189621, 'sideways_rsi_os': 30, 'sideways_rsi_ob': 69, 'sideways_adx_thresh': 27.373033960292403, 'sideways_atr_min_pct': 0.0028476999474951127, 'sideways_atr_max_pct': 0.13689486890419747, 'sideways_tp_mult': 1.6036006845831596, 'sideways_tsl_mult': 0.9449484829599685, 'sideways_time_stop': 112, 'sideways_use_sma': True, 'sideways_use_ema': False, 'sideways_use_atr': False, 'sideways_use_adx': False, 'sideways_use_spike': False, 'sideways_rsi_required': False}.
[I 2025-08-31 12:52:49,504] Trial 465 finished with values: [-1000000000.0, 1000000000.0] and parameters: {'p_sma': 43, 'p_std': 44, 'p_atr': 12, 'p_adx': 15, 'rsi_period': 57, 'ema1': 20, 'ema2': 30, 'slip_atr_k': 0.05820455244301395, 'slip_spread_k': 0.47613829724890244, 'spread_hl_frac': 0.049884640392197636, 'bb_std_mult': 2.1920751160562992, 'rsi_os': 28, 'rsi_ob': 78, 'vol_spike': 0.18763623500273946, 'adx_thresh': 5.008244416779148, 'atr_min_pct': 0.009562475449934445, 'atr_max_pct': 0.024335183826311994, 'tp_mult': 2.1129095883176663, 'tsl_mult': 0.1410153386167215, 'strategy': 'breakout', 'time_stop': 55, 'use_sma': False, 'use_atr': False, 'use_adx': False, 'use_ema': True, 'use_spike': False, 'rsi_required': True, 'edge_k': 0.7766848012247352, 'edge_cap': 0.6118697403329877, 'bull_strategy': 'mean_reversion', 'bull_bb_std_mult': 0.6475830636921907, 'bull_rsi_os': 7, 'bull_rsi_ob': 53, 'bull_adx_thresh': 14.187118354924548, 'bull_atr_min_pct': 0.018016723417553115, 'bull_atr_max_pct': 0.14069772092900434, 'bull_tp_mult': 1.2955190998717294, 'bull_tsl_mult': 0.550691107071791, 'bull_time_stop': 270, 'bull_use_sma': False, 'bull_use_ema': False, 'bull_use_atr': False, 'bull_use_adx': True, 'bull_use_spike': False, 'bull_rsi_required': False, 'bear_strategy': 'mean_reversion', 'bear_bb_std_mult': 3.322068221133187, 'bear_rsi_os': 31, 'bear_rsi_ob': 71, 'bear_adx_thresh': 13.449693171425727, 'bear_atr_min_pct': 0.003402191615739442, 'bear_atr_max_pct': 0.12421021330436327, 'bear_tp_mult': 1.0473749793458063, 'bear_tsl_mult': 0.7493590874215933, 'bear_time_stop': 212, 'bear_use_sma': False, 'bear_use_ema': True, 'bear_use_atr': True, 'bear_use_adx': True, 'bear_use_spike': False, 'bear_rsi_required': True, 'sideways_strategy': 'mean_reversion', 'sideways_bb_std_mult': 2.5118685233322187, 'sideways_rsi_os': 31, 'sideways_rsi_ob': 68, 'sideways_adx_thresh': 27.69621258524096, 'sideways_atr_min_pct': 0.002815998850716888, 'sideways_atr_max_pct': 0.13640242068916292, 'sideways_tp_mult': 1.751988884645825, 'sideways_tsl_mult': 0.8391186365052394, 'sideways_time_stop': 218, 'sideways_use_sma': False, 'sideways_use_ema': True, 'sideways_use_atr': False, 'sideways_use_adx': False, 'sideways_use_spike': False, 'sideways_rsi_required': False}.
[I 2025-08-31 12:52:49,769] Trial 463 finished with values: [-1000000000.0, 1000000000.0] and parameters: {'p_sma': 18, 'p_std': 22, 'p_atr': 29, 'p_adx': 28, 'rsi_period': 57, 'ema1': 19, 'ema2': 12, 'slip_atr_k': 0.1324645251487618, 'slip_spread_k': 0.45045689164224556, 'spread_hl_frac': 0.016880525729661984, 'bb_std_mult': 2.1971115742526157, 'rsi_os': 40, 'rsi_ob': 92, 'vol_spike': 0.01675803321256314, 'adx_thresh': 20.96402102175699, 'atr_min_pct': 0.0014610027993080831, 'atr_max_pct': 0.024309547879349677, 'tp_mult': 2.6871603285099668, 'tsl_mult': 0.5551138478460768, 'strategy': 'breakout', 'time_stop': 54, 'use_sma': False, 'use_atr': False, 'use_adx': False, 'use_ema': True, 'use_spike': False, 'rsi_required': True, 'edge_k': 0.1980834830386603, 'edge_cap': 0.8381846805893006, 'bull_strategy': 'breakout', 'bull_bb_std_mult': 2.6956576732329656, 'bull_rsi_os': 55, 'bull_rsi_ob': 46, 'bull_adx_thresh': 23.304557134949576, 'bull_atr_min_pct': 0.019672311231577127, 'bull_atr_max_pct': 0.1455140103514427, 'bull_tp_mult': 1.2742088498151887, 'bull_tsl_mult': 0.23074038907771577, 'bull_time_stop': 286, 'bull_use_sma': False, 'bull_use_ema': True, 'bull_use_atr': False, 'bull_use_adx': True, 'bull_use_spike': False, 'bull_rsi_required': False, 'bear_strategy': 'mean_reversion', 'bear_bb_std_mult': 1.1622925252305762, 'bear_rsi_os': 37, 'bear_rsi_ob': 65, 'bear_adx_thresh': 10.814547466169365, 'bear_atr_min_pct': 0.0032661077303681608, 'bear_atr_max_pct': 0.11462951965494403, 'bear_tp_mult': 2.0125791507222806, 'bear_tsl_mult': 0.7501386949505592, 'bear_time_stop': 203, 'bear_use_sma': False, 'bear_use_ema': False, 'bear_use_atr': True, 'bear_use_adx': False, 'bear_use_spike': True, 'bear_rsi_required': True, 'sideways_strategy': 'mean_reversion', 'sideways_bb_std_mult': 2.515336427361829, 'sideways_rsi_os': 30, 'sideways_rsi_ob': 68, 'sideways_adx_thresh': 27.977836820479208, 'sideways_atr_min_pct': 0.010262365655959936, 'sideways_atr_max_pct': 0.023184506034722087, 'sideways_tp_mult': 1.7011626050212239, 'sideways_tsl_mult': 0.8486371373350909, 'sideways_time_stop': 90, 'sideways_use_sma': False, 'sideways_use_ema': True, 'sideways_use_atr': True, 'sideways_use_adx': False, 'sideways_use_spike': False, 'sideways_rsi_required': False}.
[I 2025-08-31 12:52:49,769] Trial 464 finished with values: [-1000000000.0, 1000000000.0] and parameters: {'p_sma': 43, 'p_std': 50, 'p_atr': 29, 'p_adx': 15, 'rsi_period': 46, 'ema1': 21, 'ema2': 30, 'slip_atr_k': 0.11206758811246892, 'slip_spread_k': 0.44977799452004, 'spread_hl_frac': 0.01678700125703437, 'bb_std_mult': 3.0056901177686877, 'rsi_os': 36, 'rsi_ob': 80, 'vol_spike': 0.01564881765178426, 'adx_thresh': 20.82501740140926, 'atr_min_pct': 0.0016231402103942683, 'atr_max_pct': 0.03221996167361945, 'tp_mult': 2.6839057942566944, 'tsl_mult': 0.8275982992753472, 'strategy': 'breakout', 'time_stop': 295, 'use_sma': False, 'use_atr': False, 'use_adx': False, 'use_ema': True, 'use_spike': True, 'rsi_required': True, 'edge_k': 0.2588574687482793, 'edge_cap': 0.6087238627019058, 'bull_strategy': 'breakout', 'bull_bb_std_mult': 0.89798524884465, 'bull_rsi_os': 7, 'bull_rsi_ob': 53, 'bull_adx_thresh': 20.200512748215914, 'bull_atr_min_pct': 0.0180546771431562, 'bull_atr_max_pct': 0.14632712978282714, 'bull_tp_mult': 1.288599149637641, 'bull_tsl_mult': 0.4970012846645206, 'bull_time_stop': 286, 'bull_use_sma': False, 'bull_use_ema': False, 'bull_use_atr': False, 'bull_use_adx': True, 'bull_use_spike': False, 'bull_rsi_required': False, 'bear_strategy': 'mean_reversion', 'bear_bb_std_mult': 3.3005704550160453, 'bear_rsi_os': 31, 'bear_rsi_ob': 84, 'bear_adx_thresh': 15.339810160295354, 'bear_atr_min_pct': 0.0035261956781753386, 'bear_atr_max_pct': 0.11368050654655328, 'bear_tp_mult': 2.953965623918944, 'bear_tsl_mult': 0.7475359160168944, 'bear_time_stop': 208, 'bear_use_sma': False, 'bear_use_ema': True, 'bear_use_atr': False, 'bear_use_adx': True, 'bear_use_spike': False, 'bear_rsi_required': True, 'sideways_strategy': 'mean_reversion', 'sideways_bb_std_mult': 2.4917961049225146, 'sideways_rsi_os': 30, 'sideways_rsi_ob': 69, 'sideways_adx_thresh': 22.602259706287047, 'sideways_atr_min_pct': 0.010134250946709087, 'sideways_atr_max_pct': 0.015080125350142068, 'sideways_tp_mult': 1.5736426028219306, 'sideways_tsl_mult': 0.7755244174034062, 'sideways_time_stop': 200, 'sideways_use_sma': False, 'sideways_use_ema': True, 'sideways_use_atr': False, 'sideways_use_adx': False, 'sideways_use_spike': False, 'sideways_rsi_required': False}.
[I 2025-08-31 12:53:24,349] Trial 467 finished with values: [-1000000000.0, 1000000000.0] and parameters: {'p_sma': 49, 'p_std': 45, 'p_atr': 13, 'p_adx': 15, 'rsi_period': 53, 'ema1': 20, 'ema2': 14, 'slip_atr_k': 0.0591677806765415, 'slip_spread_k': 0.3938135146568222, 'spread_hl_frac': 0.01877637858185137, 'bb_std_mult': 2.1704197936926684, 'rsi_os': 39, 'rsi_ob': 78, 'vol_spike': 0.2963905770714953, 'adx_thresh': 33.17718481374932, 'atr_min_pct': 0.014263633725657247, 'atr_max_pct': 0.11280469160653887, 'tp_mult': 1.337322943159093, 'tsl_mult': 0.14723587731057625, 'strategy': 'breakout', 'time_stop': 164, 'use_sma': True, 'use_atr': True, 'use_adx': False, 'use_ema': True, 'use_spike': False, 'rsi_required': True, 'edge_k': 1.5892777315173896, 'edge_cap': 0.7073284788738898, 'bull_strategy': 'breakout', 'bull_bb_std_mult': 0.6397308134101751, 'bull_rsi_os': 7, 'bull_rsi_ob': 50, 'bull_adx_thresh': 14.351018062291075, 'bull_atr_min_pct': 0.01803409146166558, 'bull_atr_max_pct': 0.14118629984885372, 'bull_tp_mult': 1.2968769701198761, 'bull_tsl_mult': 0.44645799758838106, 'bull_time_stop': 272, 'bull_use_sma': True, 'bull_use_ema': False, 'bull_use_atr': False, 'bull_use_adx': True, 'bull_use_spike': True, 'bull_rsi_required': False, 'bear_strategy': 'mean_reversion', 'bear_bb_std_mult': 2.996764028217778, 'bear_rsi_os': 17, 'bear_rsi_ob': 51, 'bear_adx_thresh': 13.01354410267176, 'bear_atr_min_pct': 0.0020785638618304888, 'bear_atr_max_pct': 0.12733076182910974, 'bear_tp_mult': 2.9188353710693615, 'bear_tsl_mult': 0.7562511271487027, 'bear_time_stop': 212, 'bear_use_sma': True, 'bear_use_ema': True, 'bear_use_atr': True, 'bear_use_adx': True, 'bear_use_spike': False, 'bear_rsi_required': True, 'sideways_strategy': 'breakout', 'sideways_bb_std_mult': 2.5041119645334957, 'sideways_rsi_os': 31, 'sideways_rsi_ob': 63, 'sideways_adx_thresh': 25.769242276050562, 'sideways_atr_min_pct': 0.007424211686095222, 'sideways_atr_max_pct': 0.023481894400985318, 'sideways_tp_mult': 1.692934346316383, 'sideways_tsl_mult': 0.8633404134876149, 'sideways_time_stop': 199, 'sideways_use_sma': True, 'sideways_use_ema': False, 'sideways_use_atr': False, 'sideways_use_adx': True, 'sideways_use_spike': False, 'sideways_rsi_required': True}.
