[I 2025-08-31 12:09:50,435] Trial 134 finished with values: [-0.06445103556128595, 0.06412219157107706] and parameters: {'p_sma': 23, 'p_std': 13, 'p_atr': 10, 'p_adx': 20, 'rsi_period': 28, 'ema1': 21, 'ema2': 38, 'slip_atr_k': 0.19019021078055381, 'slip_spread_k': 0.24261296467009508, 'spread_hl_frac': 0.030980949351672952, 'bb_std_mult': 0.8989813595123484, 'rsi_os': 43, 'rsi_ob': 60, 'vol_spike': 0.050468365443349386, 'adx_thresh': 23.513725258271446, 'atr_min_pct': 0.0268349929969906, 'atr_max_pct': 0.1324537804231628, 'tp_mult': 2.4932108423387778, 'tsl_mult': 0.3736823699054074, 'strategy': 'mean_reversion', 'time_stop': 6, 'use_sma': True, 'use_atr': False, 'use_adx': True, 'use_ema': False, 'use_spike': True, 'rsi_required': False, 'edge_k': 1.061237568198768, 'edge_cap': 0.33155489983230363, 'bull_strategy': 'mean_reversion', 'bull_bb_std_mult': 3.4878142960966656, 'bull_rsi_os': 16, 'bull_rsi_ob': 55, 'bull_adx_thresh': 8.387892091837934, 'bull_atr_min_pct': 0.0035828797604642235, 'bull_atr_max_pct': 0.08296119919461965, 'bull_tp_mult': 2.7740046038089123, 'bull_tsl_mult': 0.22415583088683005, 'bull_time_stop': 131, 'bull_use_sma': False, 'bull_use_ema': False, 'bull_use_atr': True, 'bull_use_adx': True, 'bull_use_spike': False, 'bull_rsi_required': True, 'bear_strategy': 'mean_reversion', 'bear_bb_std_mult': 1.5288864220096499, 'bear_rsi_os': 23, 'bear_rsi_ob': 65, 'bear_adx_thresh': 34.19076598244441, 'bear_atr_min_pct': 0.025376177589540583, 'bear_atr_max_pct': 0.13189464378033872, 'bear_tp_mult': 1.754043771261678, 'bear_tsl_mult': 0.22085406277372532, 'bear_time_stop': 115, 'bear_use_sma': False, 'bear_use_ema': False, 'bear_use_atr': False, 'bear_use_adx': False, 'bear_use_spike': True, 'bear_rsi_required': False, 'sideways_strategy': 'breakout', 'sideways_bb_std_mult': 3.437397833947254, 'sideways_rsi_os': 35, 'sideways_rsi_ob': 52, 'sideways_adx_thresh': 8.753726899765885, 'sideways_atr_min_pct': 0.0029139182710007953, 'sideways_atr_max_pct': 0.02622736275825604, 'sideways_tp_mult': 2.6041545517791507, 'sideways_tsl_mult': 0.7460212618709186, 'sideways_time_stop': 30, 'sideways_use_sma': False, 'sideways_use_ema': True, 'sideways_use_atr': True, 'sideways_use_adx': False, 'sideways_use_spike': False, 'sideways_rsi_required': True}.
[I 2025-08-31 12:09:50,737] Trial 136 finished with values: [-1000000000.0, 1000000000.0] and parameters: {'p_sma': 32, 'p_std': 34, 'p_atr': 25, 'p_adx': 20, 'rsi_period': 27, 'ema1': 21, 'ema2': 38, 'slip_atr_k': 0.11008475633386304, 'slip_spread_k': 0.22879684186599253, 'spread_hl_frac': 0.023636854846078113, 'bb_std_mult': 0.8754641043869226, 'rsi_os': 43, 'rsi_ob': 49, 'vol_spike': 0.24408618732937354, 'adx_thresh': 27.34746501701273, 'atr_min_pct': 0.02777198449427928, 'atr_max_pct': 0.07357603494847575, 'tp_mult': 2.38408340976242, 'tsl_mult': 0.44118534306007695, 'strategy': 'mean_reversion', 'time_stop': 19, 'use_sma': True, 'use_atr': False, 'use_adx': True, 'use_ema': False, 'use_spike': True, 'rsi_required': False, 'edge_k': 1.1542078772474114, 'edge_cap': 0.35251544468729246, 'bull_strategy': 'mean_reversion', 'bull_bb_std_mult': 2.9599644199571506, 'bull_rsi_os': 16, 'bull_rsi_ob': 83, 'bull_adx_thresh': 20.290015080432095, 'bull_atr_min_pct': 0.028984728317450546, 'bull_atr_max_pct': 0.097814394766632, 'bull_tp_mult': 2.2370478104194387, 'bull_tsl_mult': 0.22312671206546936, 'bull_time_stop': 158, 'bull_use_sma': False, 'bull_use_ema': False, 'bull_use_atr': False, 'bull_use_adx': True, 'bull_use_spike': False, 'bull_rsi_required': False, 'bear_strategy': 'mean_reversion', 'bear_bb_std_mult': 1.5918060774827052, 'bear_rsi_os': 10, 'bear_rsi_ob': 60, 'bear_adx_thresh': 34.43013593357659, 'bear_atr_min_pct': 0.028171263863839606, 'bear_atr_max_pct': 0.025732229324332383, 'bear_tp_mult': 2.068334806733648, 'bear_tsl_mult': 0.10731717572742794, 'bear_time_stop': 223, 'bear_use_sma': False, 'bear_use_ema': False, 'bear_use_atr': False, 'bear_use_adx': False, 'bear_use_spike': True, 'bear_rsi_required': False, 'sideways_strategy': 'breakout', 'sideways_bb_std_mult': 1.8625134828160619, 'sideways_rsi_os': 32, 'sideways_rsi_ob': 49, 'sideways_adx_thresh': 14.015461706355014, 'sideways_atr_min_pct': 0.015907810417481905, 'sideways_atr_max_pct': 0.016218242647819042, 'sideways_tp_mult': 1.1921936729830191, 'sideways_tsl_mult': 0.7446849432446221, 'sideways_time_stop': 174, 'sideways_use_sma': False, 'sideways_use_ema': True, 'sideways_use_atr': True, 'sideways_use_adx': False, 'sideways_use_spike': False, 'sideways_rsi_required': True}.
[I 2025-08-31 12:10:19,789] Trial 138 finished with values: [-1000000000.0, 1000000000.0] and parameters: {'p_sma': 8, 'p_std': 16, 'p_atr': 27, 'p_adx': 20, 'rsi_period': 30, 'ema1': 7, 'ema2': 55, 'slip_atr_k': 0.07353901574007134, 'slip_spread_k': 0.15062743145225277, 'spread_hl_frac': 0.041456136387100745, 'bb_std_mult': 0.9886551805599295, 'rsi_os': 37, 'rsi_ob': 80, 'vol_spike': 0.15724736859231547, 'adx_thresh': 23.880657185890183, 'atr_min_pct': 0.02756545341281286, 'atr_max_pct': 0.13095604163387564, 'tp_mult': 2.6967195993010282, 'tsl_mult': 0.502331661220841, 'strategy': 'breakout', 'time_stop': 16, 'use_sma': True, 'use_atr': False, 'use_adx': True, 'use_ema': False, 'use_spike': True, 'rsi_required': False, 'edge_k': 1.176528930078174, 'edge_cap': 0.36136415261943805, 'bull_strategy': 'mean_reversion', 'bull_bb_std_mult': 3.474786922327721, 'bull_rsi_os': 16, 'bull_rsi_ob': 84, 'bull_adx_thresh': 23.39835290994636, 'bull_atr_min_pct': 0.010460033588041281, 'bull_atr_max_pct': 0.0929582554711875, 'bull_tp_mult': 2.6817901997931544, 'bull_tsl_mult': 0.22701172025199096, 'bull_time_stop': 66, 'bull_use_sma': False, 'bull_use_ema': False, 'bull_use_atr': False, 'bull_use_adx': True, 'bull_use_spike': False, 'bull_rsi_required': False, 'bear_strategy': 'mean_reversion', 'bear_bb_std_mult': 2.6903917582607213, 'bear_rsi_os': 23, 'bear_rsi_ob': 82, 'bear_adx_thresh': 16.358074774501628, 'bear_atr_min_pct': 0.0028897220492777945, 'bear_atr_max_pct': 0.149701883637463, 'bear_tp_mult': 1.4341921190869233, 'bear_tsl_mult': 0.18355779382266665, 'bear_time_stop': 241, 'bear_use_sma': False, 'bear_use_ema': False, 'bear_use_atr': False, 'bear_use_adx': False, 'bear_use_spike': True, 'bear_rsi_required': False, 'sideways_strategy': 'breakout', 'sideways_bb_std_mult': 2.2014641511449757, 'sideways_rsi_os': 32, 'sideways_rsi_ob': 49, 'sideways_adx_thresh': 8.848258627078481, 'sideways_atr_min_pct': 0.022067480722224923, 'sideways_atr_max_pct': 0.06422282085523669, 'sideways_tp_mult': 1.204685622706687, 'sideways_tsl_mult': 0.730800957852676, 'sideways_time_stop': 264, 'sideways_use_sma': False, 'sideways_use_ema': True, 'sideways_use_atr': True, 'sideways_use_adx': False, 'sideways_use_spike': False, 'sideways_rsi_required': True}.
[I 2025-08-31 12:10:19,995] Trial 137 finished with values: [-0.07567968697900573, 0.07551647011959062] and parameters: {'p_sma': 25, 'p_std': 16, 'p_atr': 25, 'p_adx': 27, 'rsi_period': 24, 'ema1': 7, 'ema2': 38, 'slip_atr_k': 0.19035520035214643, 'slip_spread_k': 0.9604281206220026, 'spread_hl_frac': 0.042360592207769845, 'bb_std_mult': 1.0603212864044878, 'rsi_os': 42, 'rsi_ob': 59, 'vol_spike': 0.26115549911407987, 'adx_thresh': 22.341856990152714, 'atr_min_pct': 0.0011408429750316244, 'atr_max_pct': 0.07565934500574115, 'tp_mult': 2.5840579833663244, 'tsl_mult': 0.4366929903096266, 'strategy': 'breakout', 'time_stop': 83, 'use_sma': True, 'use_atr': False, 'use_adx': True, 'use_ema': False, 'use_spike': True, 'rsi_required': False, 'edge_k': 1.905194916783491, 'edge_cap': 0.363177532185402, 'bull_strategy': 'mean_reversion', 'bull_bb_std_mult': 3.4836044110553237, 'bull_rsi_os': 16, 'bull_rsi_ob': 55, 'bull_adx_thresh': 23.629448430500904, 'bull_atr_min_pct': 0.026927281537106214, 'bull_atr_max_pct': 0.09778584764644094, 'bull_tp_mult': 2.67708714447271, 'bull_tsl_mult': 0.4788504837228711, 'bull_time_stop': 68, 'bull_use_sma': False, 'bull_use_ema': False, 'bull_use_atr': False, 'bull_use_adx': True, 'bull_use_spike': False, 'bull_rsi_required': False, 'bear_strategy': 'mean_reversion', 'bear_bb_std_mult': 1.6056444724326084, 'bear_rsi_os': 23, 'bear_rsi_ob': 82, 'bear_adx_thresh': 33.31737724322058, 'bear_atr_min_pct': 0.028150873735997648, 'bear_atr_max_pct': 0.14914200489824303, 'bear_tp_mult': 2.928933021065686, 'bear_tsl_mult': 0.16771151392733158, 'bear_time_stop': 219, 'bear_use_sma': False, 'bear_use_ema': False, 'bear_use_atr': False, 'bear_use_adx': False, 'bear_use_spike': True, 'bear_rsi_required': False, 'sideways_strategy': 'breakout', 'sideways_bb_std_mult': 2.1926846067192094, 'sideways_rsi_os': 32, 'sideways_rsi_ob': 49, 'sideways_adx_thresh': 6.855709008520364, 'sideways_atr_min_pct': 0.0015409918163712347, 'sideways_atr_max_pct': 0.01720425440811303, 'sideways_tp_mult': 2.323411538876387, 'sideways_tsl_mult': 0.47585251392915306, 'sideways_time_stop': 260, 'sideways_use_sma': False, 'sideways_use_ema': True, 'sideways_use_atr': True, 'sideways_use_adx': False, 'sideways_use_spike': False, 'sideways_rsi_required': True}.
[I 2025-08-31 12:10:20,318] Trial 139 finished with values: [-1000000000.0, 1000000000.0] and parameters: {'p_sma': 34, 'p_std': 16, 'p_atr': 26, 'p_adx': 25, 'rsi_period': 78, 'ema1': 7, 'ema2': 24, 'slip_atr_k': 0.09551484486006058, 'slip_spread_k': 0.15282854128535714, 'spread_hl_frac': 0.04521953854993497, 'bb_std_mult': 1.0025727590091722, 'rsi_os': 37, 'rsi_ob': 89, 'vol_spike': 0.24686838580144577, 'adx_thresh': 15.913288757435227, 'atr_min_pct': 0.005004904475460198, 'atr_max_pct': 0.0741720561229451, 'tp_mult': 2.373503359308854, 'tsl_mult': 0.4351677958954978, 'strategy': 'breakout', 'time_stop': 82, 'use_sma': True, 'use_atr': False, 'use_adx': True, 'use_ema': False, 'use_spike': False, 'rsi_required': False, 'edge_k': 0.6790745028996432, 'edge_cap': 0.9318097773300618, 'bull_strategy': 'mean_reversion', 'bull_bb_std_mult': 1.8769998722920123, 'bull_rsi_os': 17, 'bull_rsi_ob': 86, 'bull_adx_thresh': 23.701837633250207, 'bull_atr_min_pct': 0.01078515856908991, 'bull_atr_max_pct': 0.09469559132664555, 'bull_tp_mult': 2.2577266738969852, 'bull_tsl_mult': 0.6670776814139721, 'bull_time_stop': 68, 'bull_use_sma': False, 'bull_use_ema': False, 'bull_use_atr': False, 'bull_use_adx': True, 'bull_use_spike': False, 'bull_rsi_required': False, 'bear_strategy': 'mean_reversion', 'bear_bb_std_mult': 1.6283169153185044, 'bear_rsi_os': 37, 'bear_rsi_ob': 82, 'bear_adx_thresh': 20.44455139117696, 'bear_atr_min_pct': 0.0055113628481859335, 'bear_atr_max_pct': 0.10457246850901825, 'bear_tp_mult': 1.5022678955153859, 'bear_tsl_mult': 0.18174046872119684, 'bear_time_stop': 225, 'bear_use_sma': False, 'bear_use_ema': False, 'bear_use_atr': False, 'bear_use_adx': False, 'bear_use_spike': True, 'bear_rsi_required': False, 'sideways_strategy': 'mean_reversion', 'sideways_bb_std_mult': 2.1870720934019423, 'sideways_rsi_os': 37, 'sideways_rsi_ob': 48, 'sideways_adx_thresh': 6.801000502509822, 'sideways_atr_min_pct': 0.000597871679732264, 'sideways_atr_max_pct': 0.0174262494053663, 'sideways_tp_mult': 1.161310998032683, 'sideways_tsl_mult': 0.3806404229991482, 'sideways_time_stop': 175, 'sideways_use_sma': False, 'sideways_use_ema': True, 'sideways_use_atr': True, 'sideways_use_adx': False, 'sideways_use_spike': False, 'sideways_rsi_required': True}.
[I 2025-08-31 12:10:20,382] Trial 140 finished with values: [-1000000000.0, 1000000000.0] and parameters: {'p_sma': 39, 'p_std': 16, 'p_atr': 17, 'p_adx': 25, 'rsi_period': 78, 'ema1': 7, 'ema2': 35, 'slip_atr_k': 0.08725594361896119, 'slip_spread_k': 0.9245086298904204, 'spread_hl_frac': 0.042054399117755874, 'bb_std_mult': 1.0009146562233961, 'rsi_os': 37, 'rsi_ob': 77, 'vol_spike': 0.2507130833412189, 'adx_thresh': 21.65958948673345, 'atr_min_pct': 0.00741715814841234, 'atr_max_pct': 0.0175215885060412, 'tp_mult': 1.7927507201528212, 'tsl_mult': 0.49073596916184264, 'strategy': 'breakout', 'time_stop': 82, 'use_sma': True, 'use_atr': False, 'use_adx': True, 'use_ema': False, 'use_spike': False, 'rsi_required': False, 'edge_k': 1.6269597901403205, 'edge_cap': 0.2910246818086296, 'bull_strategy': 'mean_reversion', 'bull_bb_std_mult': 3.198350310902104, 'bull_rsi_os': 13, 'bull_rsi_ob': 84, 'bull_adx_thresh': 23.083307801703814, 'bull_atr_min_pct': 0.02707231985371462, 'bull_atr_max_pct': 0.09068692691996207, 'bull_tp_mult': 2.497572523962977, 'bull_tsl_mult': 0.4931984081564454, 'bull_time_stop': 66, 'bull_use_sma': False, 'bull_use_ema': False, 'bull_use_atr': False, 'bull_use_adx': True, 'bull_use_spike': False, 'bull_rsi_required': False, 'bear_strategy': 'mean_reversion', 'bear_bb_std_mult': 1.7047895938014905, 'bear_rsi_os': 37, 'bear_rsi_ob': 61, 'bear_adx_thresh': 6.968114122300655, 'bear_atr_min_pct': 0.0031375192086205723, 'bear_atr_max_pct': 0.09521912795095112, 'bear_tp_mult': 1.4428136757691323, 'bear_tsl_mult': 0.12773058333894466, 'bear_time_stop': 242, 'bear_use_sma': False, 'bear_use_ema': False, 'bear_use_atr': False, 'bear_use_adx': False, 'bear_use_spike': True, 'bear_rsi_required': False, 'sideways_strategy': 'mean_reversion', 'sideways_bb_std_mult': 2.1852435680446636, 'sideways_rsi_os': 37, 'sideways_rsi_ob': 51, 'sideways_adx_thresh': 11.460616419648437, 'sideways_atr_min_pct': 0.02209328880677008, 'sideways_atr_max_pct': 0.12483606883024143, 'sideways_tp_mult': 1.1201982802743267, 'sideways_tsl_mult': 0.3708373317470663, 'sideways_time_stop': 267, 'sideways_use_sma': False, 'sideways_use_ema': True, 'sideways_use_atr': True, 'sideways_use_adx': False, 'sideways_use_spike': False, 'sideways_rsi_required': True}.
[I 2025-08-31 12:10:20,670] Trial 142 finished with values: [-1000000000.0, 1000000000.0] and parameters: {'p_sma': 29, 'p_std': 17, 'p_atr': 17, 'p_adx': 16, 'rsi_period': 73, 'ema1': 24, 'ema2': 24, 'slip_atr_k': 0.0866083137270559, 'slip_spread_k': 0.10858875504627394, 'spread_hl_frac': 0.029688374064747447, 'bb_std_mult': 1.9238177600314932, 'rsi_os': 40, 'rsi_ob': 74, 'vol_spike': 0.1403829308795666, 'adx_thresh': 21.22933786792033, 'atr_min_pct': 0.026090217484342804, 'atr_max_pct': 0.016644665943288617, 'tp_mult': 1.831175457652085, 'tsl_mult': 0.490324595989054, 'strategy': 'mean_reversion', 'time_stop': 288, 'use_sma': True, 'use_atr': True, 'use_adx': False, 'use_ema': False, 'use_spike': False, 'rsi_required': False, 'edge_k': 0.9822344130229805, 'edge_cap': 0.9461479931179668, 'bull_strategy': 'mean_reversion', 'bull_bb_std_mult': 3.2111560225602744, 'bull_rsi_os': 13, 'bull_rsi_ob': 87, 'bull_adx_thresh': 9.2485372957535, 'bull_atr_min_pct': 0.013720301670669748, 'bull_atr_max_pct': 0.08826670704696297, 'bull_tp_mult': 2.5048828304485014, 'bull_tsl_mult': 0.29712801379217324, 'bull_time_stop': 191, 'bull_use_sma': True, 'bull_use_ema': False, 'bull_use_atr': False, 'bull_use_adx': True, 'bull_use_spike': False, 'bull_rsi_required': True, 'bear_strategy': 'mean_reversion', 'bear_bb_std_mult': 1.6906751706910585, 'bear_rsi_os': 37, 'bear_rsi_ob': 55, 'bear_adx_thresh': 6.600807739012019, 'bear_atr_min_pct': 0.005217390009582693, 'bear_atr_max_pct': 0.1445610725440092, 'bear_tp_mult': 1.6734031147176875, 'bear_tsl_mult': 0.9055253938727206, 'bear_time_stop': 263, 'bear_use_sma': False, 'bear_use_ema': False, 'bear_use_atr': False, 'bear_use_adx': False, 'bear_use_spike': True, 'bear_rsi_required': False, 'sideways_strategy': 'mean_reversion', 'sideways_bb_std_mult': 2.0381480543662587, 'sideways_rsi_os': 33, 'sideways_rsi_ob': 47, 'sideways_adx_thresh': 11.636650506683765, 'sideways_atr_min_pct': 0.0022871851836529064, 'sideways_atr_max_pct': 0.0787183128093936, 'sideways_tp_mult': 2.8691726620144555, 'sideways_tsl_mult': 0.5518052943585599, 'sideways_time_stop': 57, 'sideways_use_sma': True, 'sideways_use_ema': True, 'sideways_use_atr': True, 'sideways_use_adx': False, 'sideways_use_spike': False, 'sideways_rsi_required': True}.
[I 2025-08-31 12:10:52,128] Trial 143 finished with values: [-0.075923794214806, 0.07595932712716388] and parameters: {'p_sma': 29, 'p_std': 14, 'p_atr': 9, 'p_adx': 16, 'rsi_period': 38, 'ema1': 6, 'ema2': 35, 'slip_atr_k': 0.07612907320609721, 'slip_spread_k': 0.7298675942352014, 'spread_hl_frac': 0.029103584948452336, 'bb_std_mult': 1.2893252850071963, 'rsi_os': 40, 'rsi_ob': 68, 'vol_spike': 0.23865600374865759, 'adx_thresh': 21.637079136847202, 'atr_min_pct': 0.02451365130867543, 'atr_max_pct': 0.09898829869316986, 'tp_mult': 1.440022801170541, 'tsl_mult': 0.48324838518523555, 'strategy': 'mean_reversion', 'time_stop': 292, 'use_sma': True, 'use_atr': True, 'use_adx': False, 'use_ema': False, 'use_spike': False, 'rsi_required': False, 'edge_k': 1.1036313023964317, 'edge_cap': 0.09135105283463629, 'bull_strategy': 'mean_reversion', 'bull_bb_std_mult': 3.3891724516857566, 'bull_rsi_os': 13, 'bull_rsi_ob': 62, 'bull_adx_thresh': 9.136799901124062, 'bull_atr_min_pct': 0.006561703098405331, 'bull_atr_max_pct': 0.04114025467755261, 'bull_tp_mult': 2.4784657203270313, 'bull_tsl_mult': 0.4300568662265531, 'bull_time_stop': 91, 'bull_use_sma': True, 'bull_use_ema': False, 'bull_use_atr': False, 'bull_use_adx': True, 'bull_use_spike': False, 'bull_rsi_required': True, 'bear_strategy': 'mean_reversion', 'bear_bb_std_mult': 1.7020057997205007, 'bear_rsi_os': 40, 'bear_rsi_ob': 61, 'bear_adx_thresh': 10.905030763992228, 'bear_atr_min_pct': 0.00031581823938453893, 'bear_atr_max_pct': 0.1438219516356954, 'bear_tp_mult': 2.7612909980851157, 'bear_tsl_mult': 0.340392261785775, 'bear_time_stop': 265, 'bear_use_sma': False, 'bear_use_ema': False, 'bear_use_atr': False, 'bear_use_adx': False, 'bear_use_spike': True, 'bear_rsi_required': False, 'sideways_strategy': 'mean_reversion', 'sideways_bb_std_mult': 2.0645247463623835, 'sideways_rsi_os': 37, 'sideways_rsi_ob': 51, 'sideways_adx_thresh': 33.94063352308354, 'sideways_atr_min_pct': 0.018524614115381473, 'sideways_atr_max_pct': 0.12656812253246644, 'sideways_tp_mult': 1.1054233666210975, 'sideways_tsl_mult': 0.07208674142846078, 'sideways_time_stop': 183, 'sideways_use_sma': True, 'sideways_use_ema': True, 'sideways_use_atr': True, 'sideways_use_adx': False, 'sideways_use_spike': False, 'sideways_rsi_required': True}.
[I 2025-08-31 12:10:52,342] Trial 141 finished with values: [-1000000000.0, 1000000000.0] and parameters: {'p_sma': 25, 'p_std': 17, 'p_atr': 9, 'p_adx': 25, 'rsi_period': 73, 'ema1': 26, 'ema2': 30, 'slip_atr_k': 0.09564882677514902, 'slip_spread_k': 0.10910617201168585, 'spread_hl_frac': 0.0450990730742641, 'bb_std_mult': 1.2810153292751831, 'rsi_os': 40, 'rsi_ob': 68, 'vol_spike': 0.1407647735758472, 'adx_thresh': 21.353388911312756, 'atr_min_pct': 0.02616499936770716, 'atr_max_pct': 0.07422011696051628, 'tp_mult': 2.5822197280649943, 'tsl_mult': 0.49263464738723417, 'strategy': 'breakout', 'time_stop': 83, 'use_sma': True, 'use_atr': False, 'use_adx': True, 'use_ema': False, 'use_spike': False, 'rsi_required': False, 'edge_k': 1.8835914844544845, 'edge_cap': 0.07688676428813368, 'bull_strategy': 'mean_reversion', 'bull_bb_std_mult': 3.1933475806148195, 'bull_rsi_os': 13, 'bull_rsi_ob': 86, 'bull_adx_thresh': 12.090276745544223, 'bull_atr_min_pct': 0.022034876588709437, 'bull_atr_max_pct': 0.08827589879029012, 'bull_tp_mult': 2.6850861750541988, 'bull_tsl_mult': 0.513116280423375, 'bull_time_stop': 69, 'bull_use_sma': False, 'bull_use_ema': False, 'bull_use_atr': False, 'bull_use_adx': True, 'bull_use_spike': False, 'bull_rsi_required': True, 'bear_strategy': 'mean_reversion', 'bear_bb_std_mult': 1.670410756674518, 'bear_rsi_os': 36, 'bear_rsi_ob': 56, 'bear_adx_thresh': 31.661969767268225, 'bear_atr_min_pct': 0.02744948427954526, 'bear_atr_max_pct': 0.03290426900698586, 'bear_tp_mult': 2.934183631542284, 'bear_tsl_mult': 0.16900261159244018, 'bear_time_stop': 58, 'bear_use_sma': False, 'bear_use_ema': False, 'bear_use_atr': False, 'bear_use_adx': False, 'bear_use_spike': True, 'bear_rsi_required': False, 'sideways_strategy': 'mean_reversion', 'sideways_bb_std_mult': 2.1988308597574298, 'sideways_rsi_os': 37, 'sideways_rsi_ob': 51, 'sideways_adx_thresh': 6.898636108385685, 'sideways_atr_min_pct': 0.0016176582204297384, 'sideways_atr_max_pct': 0.1336930293578838, 'sideways_tp_mult': 1.1296336346517855, 'sideways_tsl_mult': 0.3797384966178995, 'sideways_time_stop': 52, 'sideways_use_sma': False, 'sideways_use_ema': True, 'sideways_use_atr': True, 'sideways_use_adx': False, 'sideways_use_spike': False, 'sideways_rsi_required': True}.
