[I 2025-08-31 12:45:35,575] Trial 413 finished with values: [-1000000000.0, 1000000000.0] and parameters: {'p_sma': 53, 'p_std': 26, 'p_atr': 12, 'p_adx': 15, 'rsi_period': 49, 'ema1': 20, 'ema2': 60, 'slip_atr_k': 0.05947974037396894, 'slip_spread_k': 0.4626941206302547, 'spread_hl_frac': 0.014896848372554906, 'bb_std_mult': 2.233437147035944, 'rsi_os': 39, 'rsi_ob': 78, 'vol_spike': 0.039331660544413366, 'adx_thresh': 19.286432189492906, 'atr_min_pct': 0.011466881160653926, 'atr_max_pct': 0.11826252753437981, 'tp_mult': 2.675904558296395, 'tsl_mult': 0.8420317231381123, 'strategy': 'breakout', 'time_stop': 176, 'use_sma': False, 'use_atr': True, 'use_adx': False, 'use_ema': True, 'use_spike': False, 'rsi_required': True, 'edge_k': 0.7071663656854769, 'edge_cap': 0.6709434225589538, 'bull_strategy': 'mean_reversion', 'bull_bb_std_mult': 2.52613892035324, 'bull_rsi_os': 7, 'bull_rsi_ob': 48, 'bull_adx_thresh': 19.66355539789125, 'bull_atr_min_pct': 0.01893839270516824, 'bull_atr_max_pct': 0.14189394519690157, 'bull_tp_mult': 1.486507097679484, 'bull_tsl_mult': 0.15984932722669198, 'bull_time_stop': 282, 'bull_use_sma': False, 'bull_use_ema': True, 'bull_use_atr': True, 'bull_use_adx': True, 'bull_use_spike': False, 'bull_rsi_required': False, 'bear_strategy': 'mean_reversion', 'bear_bb_std_mult': 3.0844957099458457, 'bear_rsi_os': 16, 'bear_rsi_ob': 71, 'bear_adx_thresh': 13.573953962782648, 'bear_atr_min_pct': 0.0030140656426970525, 'bear_atr_max_pct': 0.13358325452933706, 'bear_tp_mult': 2.987992811256352, 'bear_tsl_mult': 0.7464041110198684, 'bear_time_stop': 195, 'bear_use_sma': True, 'bear_use_ema': True, 'bear_use_atr': True, 'bear_use_adx': True, 'bear_use_spike': True, 'bear_rsi_required': True, 'sideways_strategy': 'breakout', 'sideways_bb_std_mult': 3.0854875246275686, 'sideways_rsi_os': 29, 'sideways_rsi_ob': 70, 'sideways_adx_thresh': 25.699486528774052, 'sideways_atr_min_pct': 0.0038100953130133274, 'sideways_atr_max_pct': 0.13426567216852664, 'sideways_tp_mult': 1.591833986817321, 'sideways_tsl_mult': 0.8968465578437875, 'sideways_time_stop': 223, 'sideways_use_sma': False, 'sideways_use_ema': False, 'sideways_use_atr': False, 'sideways_use_adx': False, 'sideways_use_spike': True, 'sideways_rsi_required': True}.
[I 2025-08-31 12:46:08,084] Trial 418 finished with values: [-0.02400604162496034, 0.02333688074197001] and parameters: {'p_sma': 52, 'p_std': 24, 'p_atr': 12, 'p_adx': 15, 'rsi_period': 45, 'ema1': 21, 'ema2': 17, 'slip_atr_k': 0.06395696454788605, 'slip_spread_k': 0.3786455473845854, 'spread_hl_frac': 0.017934006975749588, 'bb_std_mult': 2.4641372922484805, 'rsi_os': 37, 'rsi_ob': 80, 'vol_spike': 0.0252533856819048, 'adx_thresh': 18.466541829370698, 'atr_min_pct': 0.0002033323664192765, 'atr_max_pct': 0.12562945231701342, 'tp_mult': 2.712190205826299, 'tsl_mult': 0.02265452993588159, 'strategy': 'breakout', 'time_stop': 165, 'use_sma': False, 'use_atr': True, 'use_adx': False, 'use_ema': True, 'use_spike': False, 'rsi_required': False, 'edge_k': 0.6151931951844991, 'edge_cap': 0.5899823883279489, 'bull_strategy': 'breakout', 'bull_bb_std_mult': 2.631738559975863, 'bull_rsi_os': 6, 'bull_rsi_ob': 50, 'bull_adx_thresh': 26.101788563368306, 'bull_atr_min_pct': 0.019836736496419594, 'bull_atr_max_pct': 0.14938728150416627, 'bull_tp_mult': 1.2326095009042164, 'bull_tsl_mult': 0.21566334441471186, 'bull_time_stop': 290, 'bull_use_sma': True, 'bull_use_ema': False, 'bull_use_atr': False, 'bull_use_adx': False, 'bull_use_spike': False, 'bull_rsi_required': False, 'bear_strategy': 'breakout', 'bear_bb_std_mult': 3.1850066191737567, 'bear_rsi_os': 30, 'bear_rsi_ob': 70, 'bear_adx_thresh': 14.344382325546917, 'bear_atr_min_pct': 0.0020404591453583474, 'bear_atr_max_pct': 0.14137955879600653, 'bear_tp_mult': 2.8831914940369914, 'bear_tsl_mult': 0.7635295250814803, 'bear_time_stop': 188, 'bear_use_sma': True, 'bear_use_ema': True, 'bear_use_atr': True, 'bear_use_adx': True, 'bear_use_spike': True, 'bear_rsi_required': False, 'sideways_strategy': 'breakout', 'sideways_bb_std_mult': 2.923482458605082, 'sideways_rsi_os': 32, 'sideways_rsi_ob': 65, 'sideways_adx_thresh': 26.94057578199547, 'sideways_atr_min_pct': 0.00228894856818246, 'sideways_atr_max_pct': 0.13092148912576332, 'sideways_tp_mult': 1.6457206412813918, 'sideways_tsl_mult': 0.8413785213362013, 'sideways_time_stop': 126, 'sideways_use_sma': True, 'sideways_use_ema': False, 'sideways_use_atr': False, 'sideways_use_adx': False, 'sideways_use_spike': False, 'sideways_rsi_required': True}.
[I 2025-08-31 12:46:08,445] Trial 417 finished with values: [-0.0101141324591274, 0.010700458919490178] and parameters: {'p_sma': 52, 'p_std': 24, 'p_atr': 12, 'p_adx': 15, 'rsi_period': 48, 'ema1': 21, 'ema2': 60, 'slip_atr_k': 0.0637028117572883, 'slip_spread_k': 0.46735454989805036, 'spread_hl_frac': 0.01760820215157382, 'bb_std_mult': 2.4555619386202254, 'rsi_os': 37, 'rsi_ob': 80, 'vol_spike': 0.023164225689038087, 'adx_thresh': 18.738020605502346, 'atr_min_pct': 1.2076937987474338e-06, 'atr_max_pct': 0.1272591117884898, 'tp_mult': 2.720572708530209, 'tsl_mult': 0.02718595481788828, 'strategy': 'breakout', 'time_stop': 168, 'use_sma': False, 'use_atr': True, 'use_adx': False, 'use_ema': True, 'use_spike': False, 'rsi_required': True, 'edge_k': 0.6014162291812599, 'edge_cap': 0.5251050238457199, 'bull_strategy': 'breakout', 'bull_bb_std_mult': 2.526936607924817, 'bull_rsi_os': 6, 'bull_rsi_ob': 50, 'bull_adx_thresh': 22.5550181536217, 'bull_atr_min_pct': 0.019846698170609186, 'bull_atr_max_pct': 0.14978631856165206, 'bull_tp_mult': 1.4641166825216452, 'bull_tsl_mult': 0.2094031249433914, 'bull_time_stop': 291, 'bull_use_sma': True, 'bull_use_ema': False, 'bull_use_atr': False, 'bull_use_adx': False, 'bull_use_spike': False, 'bull_rsi_required': False, 'bear_strategy': 'breakout', 'bear_bb_std_mult': 3.1935714941314393, 'bear_rsi_os': 28, 'bear_rsi_ob': 81, 'bear_adx_thresh': 14.701520726026114, 'bear_atr_min_pct': 0.0021435353473064534, 'bear_atr_max_pct': 0.14929261722779014, 'bear_tp_mult': 2.8931530311013045, 'bear_tsl_mult': 0.7569342875826204, 'bear_time_stop': 186, 'bear_use_sma': True, 'bear_use_ema': True, 'bear_use_atr': True, 'bear_use_adx': True, 'bear_use_spike': True, 'bear_rsi_required': True, 'sideways_strategy': 'breakout', 'sideways_bb_std_mult': 2.3576876068883443, 'sideways_rsi_os': 32, 'sideways_rsi_ob': 68, 'sideways_adx_thresh': 26.754485390506687, 'sideways_atr_min_pct': 0.003106369178704596, 'sideways_atr_max_pct': 0.028450126069301515, 'sideways_tp_mult': 1.590966407378079, 'sideways_tsl_mult': 0.8083559487629796, 'sideways_time_stop': 269, 'sideways_use_sma': True, 'sideways_use_ema': False, 'sideways_use_atr': False, 'sideways_use_adx': False, 'sideways_use_spike': False, 'sideways_rsi_required': True}.
[I 2025-08-31 12:46:08,535] Trial 416 finished with values: [-0.014149215295105377, 0.01404107370951419] and parameters: {'p_sma': 16, 'p_std': 24, 'p_atr': 12, 'p_adx': 15, 'rsi_period': 49, 'ema1': 21, 'ema2': 17, 'slip_atr_k': 0.06284437569183707, 'slip_spread_k': 0.4649267042222771, 'spread_hl_frac': 0.01765526902190501, 'bb_std_mult': 2.316073920567587, 'rsi_os': 39, 'rsi_ob': 77, 'vol_spike': 0.02889236730424924, 'adx_thresh': 18.660231126413066, 'atr_min_pct': 0.0003400407239576009, 'atr_max_pct': 0.12677709824027664, 'tp_mult': 1.0932500214166332, 'tsl_mult': 0.02427993957036634, 'strategy': 'breakout', 'time_stop': 168, 'use_sma': False, 'use_atr': True, 'use_adx': False, 'use_ema': True, 'use_spike': False, 'rsi_required': True, 'edge_k': 0.598888333625246, 'edge_cap': 0.8562828553062602, 'bull_strategy': 'breakout', 'bull_bb_std_mult': 2.6375545712544946, 'bull_rsi_os': 6, 'bull_rsi_ob': 50, 'bull_adx_thresh': 19.95649056701356, 'bull_atr_min_pct': 0.02008011591894174, 'bull_atr_max_pct': 0.1496202173278779, 'bull_tp_mult': 1.049544261228191, 'bull_tsl_mult': 0.20963563380002498, 'bull_time_stop': 290, 'bull_use_sma': True, 'bull_use_ema': False, 'bull_use_atr': False, 'bull_use_adx': False, 'bull_use_spike': False, 'bull_rsi_required': False, 'bear_strategy': 'breakout', 'bear_bb_std_mult': 3.1990904504734043, 'bear_rsi_os': 30, 'bear_rsi_ob': 71, 'bear_adx_thresh': 14.087511964584673, 'bear_atr_min_pct': 0.002011337779966745, 'bear_atr_max_pct': 0.1492871931333391, 'bear_tp_mult': 2.8955165916604466, 'bear_tsl_mult': 0.7549112556725953, 'bear_time_stop': 186, 'bear_use_sma': True, 'bear_use_ema': True, 'bear_use_atr': True, 'bear_use_adx': True, 'bear_use_spike': True, 'bear_rsi_required': True, 'sideways_strategy': 'breakout', 'sideways_bb_std_mult': 2.973075072974464, 'sideways_rsi_os': 32, 'sideways_rsi_ob': 68, 'sideways_adx_thresh': 26.99190863635429, 'sideways_atr_min_pct': 0.0024741275041694744, 'sideways_atr_max_pct': 0.028629891674967427, 'sideways_tp_mult': 1.6658542748974168, 'sideways_tsl_mult': 0.8096788473843237, 'sideways_time_stop': 92, 'sideways_use_sma': True, 'sideways_use_ema': False, 'sideways_use_atr': False, 'sideways_use_adx': False, 'sideways_use_spike': False, 'sideways_rsi_required': True}.
[I 2025-08-31 12:46:09,034] Trial 415 finished with values: [-1000000000.0, 1000000000.0] and parameters: {'p_sma': 53, 'p_std': 5, 'p_atr': 12, 'p_adx': 15, 'rsi_period': 54, 'ema1': 20, 'ema2': 60, 'slip_atr_k': 0.049636471547658254, 'slip_spread_k': 0.36807187769961086, 'spread_hl_frac': 0.017478541814504516, 'bb_std_mult': 2.2944388703785115, 'rsi_os': 38, 'rsi_ob': 78, 'vol_spike': 0.028594907736992886, 'adx_thresh': 18.88948654044707, 'atr_min_pct': 0.011061854206874229, 'atr_max_pct': 0.11941091643210663, 'tp_mult': 2.677336570211599, 'tsl_mult': 0.7799016284792731, 'strategy': 'breakout', 'time_stop': 169, 'use_sma': False, 'use_atr': True, 'use_adx': False, 'use_ema': True, 'use_spike': False, 'rsi_required': True, 'edge_k': 0.7137164420360008, 'edge_cap': 0.5986545227900727, 'bull_strategy': 'breakout', 'bull_bb_std_mult': 2.712407201035555, 'bull_rsi_os': 7, 'bull_rsi_ob': 48, 'bull_adx_thresh': 19.696916291982937, 'bull_atr_min_pct': 0.019043679850130682, 'bull_atr_max_pct': 0.14781347957810087, 'bull_tp_mult': 1.466107806877106, 'bull_tsl_mult': 0.22312350288732635, 'bull_time_stop': 282, 'bull_use_sma': True, 'bull_use_ema': True, 'bull_use_atr': True, 'bull_use_adx': True, 'bull_use_spike': False, 'bull_rsi_required': False, 'bear_strategy': 'mean_reversion', 'bear_bb_std_mult': 3.0755133965828243, 'bear_rsi_os': 30, 'bear_rsi_ob': 80, 'bear_adx_thresh': 14.128855350168356, 'bear_atr_min_pct': 0.0028334917026185354, 'bear_atr_max_pct': 0.1411403164173655, 'bear_tp_mult': 2.958547217385201, 'bear_tsl_mult': 0.7463387495317994, 'bear_time_stop': 191, 'bear_use_sma': True, 'bear_use_ema': True, 'bear_use_atr': True, 'bear_use_adx': True, 'bear_use_spike': True, 'bear_rsi_required': True, 'sideways_strategy': 'breakout', 'sideways_bb_std_mult': 2.9449286216431414, 'sideways_rsi_os': 32, 'sideways_rsi_ob': 68, 'sideways_adx_thresh': 25.562013756410607, 'sideways_atr_min_pct': 0.003257577451929556, 'sideways_atr_max_pct': 0.1341617277458519, 'sideways_tp_mult': 1.570287522193687, 'sideways_tsl_mult': 0.9082755852745119, 'sideways_time_stop': 123, 'sideways_use_sma': True, 'sideways_use_ema': False, 'sideways_use_atr': False, 'sideways_use_adx': False, 'sideways_use_spike': True, 'sideways_rsi_required': False}.
[I 2025-08-31 12:46:40,218] Trial 421 finished with values: [-1000000000.0, 1000000000.0] and parameters: {'p_sma': 5, 'p_std': 24, 'p_atr': 16, 'p_adx': 15, 'rsi_period': 48, 'ema1': 21, 'ema2': 17, 'slip_atr_k': 0.06588098261817281, 'slip_spread_k': 0.4188002402221872, 'spread_hl_frac': 0.017528022454085305, 'bb_std_mult': 2.3103241744749092, 'rsi_os': 39, 'rsi_ob': 80, 'vol_spike': 0.028334483076402964, 'adx_thresh': 20.682846458154188, 'atr_min_pct': 0.00044965098154614645, 'atr_max_pct': 0.1272068130891874, 'tp_mult': 2.206928732979415, 'tsl_mult': 0.8878921719656077, 'strategy': 'breakout', 'time_stop': 170, 'use_sma': False, 'use_atr': True, 'use_adx': False, 'use_ema': True, 'use_spike': False, 'rsi_required': False, 'edge_k': 0.59067779975833, 'edge_cap': 0.8498703568421433, 'bull_strategy': 'breakout', 'bull_bb_std_mult': 2.62728791322209, 'bull_rsi_os': 6, 'bull_rsi_ob': 50, 'bull_adx_thresh': 22.34784261584725, 'bull_atr_min_pct': 0.019704628570604094, 'bull_atr_max_pct': 0.14995807213400988, 'bull_tp_mult': 1.4448669468285111, 'bull_tsl_mult': 0.21298957489785644, 'bull_time_stop': 292, 'bull_use_sma': True, 'bull_use_ema': False, 'bull_use_atr': False, 'bull_use_adx': True, 'bull_use_spike': True, 'bull_rsi_required': False, 'bear_strategy': 'breakout', 'bear_bb_std_mult': 3.1802506813934515, 'bear_rsi_os': 30, 'bear_rsi_ob': 70, 'bear_adx_thresh': 14.768878247935884, 'bear_atr_min_pct': 0.0020404651103606833, 'bear_atr_max_pct': 0.12742113628226973, 'bear_tp_mult': 2.8914570926534497, 'bear_tsl_mult': 0.7293381588215021, 'bear_time_stop': 188, 'bear_use_sma': True, 'bear_use_ema': True, 'bear_use_atr': True, 'bear_use_adx': True, 'bear_use_spike': False, 'bear_rsi_required': True, 'sideways_strategy': 'breakout', 'sideways_bb_std_mult': 2.5946150879639083, 'sideways_rsi_os': 32, 'sideways_rsi_ob': 69, 'sideways_adx_thresh': 26.958275937567734, 'sideways_atr_min_pct': 0.002380314707745277, 'sideways_atr_max_pct': 0.12179304080618426, 'sideways_tp_mult': 1.6542086899260942, 'sideways_tsl_mult': 0.8220379696341819, 'sideways_time_stop': 158, 'sideways_use_sma': True, 'sideways_use_ema': False, 'sideways_use_atr': False, 'sideways_use_adx': True, 'sideways_use_spike': False, 'sideways_rsi_required': True}.
[I 2025-08-31 12:46:40,746] Trial 420 finished with values: [-0.023681710948278978, 0.022995914760174124] and parameters: {'p_sma': 51, 'p_std': 24, 'p_atr': 10, 'p_adx': 15, 'rsi_period': 48, 'ema1': 21, 'ema2': 42, 'slip_atr_k': 0.06416762965339828, 'slip_spread_k': 0.42804812911439283, 'spread_hl_frac': 0.017847155117393407, 'bb_std_mult': 2.337771092211738, 'rsi_os': 39, 'rsi_ob': 77, 'vol_spike': 0.02520709682399351, 'adx_thresh': 18.832141685992553, 'atr_min_pct': 0.00022587737682641337, 'atr_max_pct': 0.12623617371526683, 'tp_mult': 1.0997999211880058, 'tsl_mult': 0.782353633124145, 'strategy': 'breakout', 'time_stop': 166, 'use_sma': False, 'use_atr': True, 'use_adx': False, 'use_ema': True, 'use_spike': False, 'rsi_required': False, 'edge_k': 1.967293893327033, 'edge_cap': 0.639260535367891, 'bull_strategy': 'breakout', 'bull_bb_std_mult': 2.607592778851137, 'bull_rsi_os': 6, 'bull_rsi_ob': 50, 'bull_adx_thresh': 26.227291374107033, 'bull_atr_min_pct': 0.019841390198444803, 'bull_atr_max_pct': 0.1493414502196194, 'bull_tp_mult': 1.067377415063328, 'bull_tsl_mult': 0.2082291693250838, 'bull_time_stop': 292, 'bull_use_sma': True, 'bull_use_ema': False, 'bull_use_atr': False, 'bull_use_adx': True, 'bull_use_spike': True, 'bull_rsi_required': False, 'bear_strategy': 'breakout', 'bear_bb_std_mult': 3.196951569324512, 'bear_rsi_os': 30, 'bear_rsi_ob': 70, 'bear_adx_thresh': 14.27992792302347, 'bear_atr_min_pct': 0.0024149741334892213, 'bear_atr_max_pct': 0.14037875601494498, 'bear_tp_mult': 2.8898632651687866, 'bear_tsl_mult': 0.7267032078302595, 'bear_time_stop': 186, 'bear_use_sma': True, 'bear_use_ema': True, 'bear_use_atr': True, 'bear_use_adx': True, 'bear_use_spike': False, 'bear_rsi_required': True, 'sideways_strategy': 'breakout', 'sideways_bb_std_mult': 2.6161218500330485, 'sideways_rsi_os': 32, 'sideways_rsi_ob': 68, 'sideways_adx_thresh': 27.04935243339449, 'sideways_atr_min_pct': 0.002354342193954538, 'sideways_atr_max_pct': 0.12389591659850518, 'sideways_tp_mult': 1.6497552521636607, 'sideways_tsl_mult': 0.8176477679418972, 'sideways_time_stop': 196, 'sideways_use_sma': True, 'sideways_use_ema': False, 'sideways_use_atr': False, 'sideways_use_adx': True, 'sideways_use_spike': False, 'sideways_rsi_required': True}.
[I 2025-08-31 12:46:40,766] Trial 422 finished with values: [-0.007204722650076101, 0.009738505408651243] and parameters: {'p_sma': 49, 'p_std': 24, 'p_atr': 20, 'p_adx': 15, 'rsi_period': 48, 'ema1': 21, 'ema2': 17, 'slip_atr_k': 0.0642948943849223, 'slip_spread_k': 0.42444600922062115, 'spread_hl_frac': 0.018867373441547163, 'bb_std_mult': 2.3521565339102515, 'rsi_os': 39, 'rsi_ob': 79, 'vol_spike': 0.017020913146733322, 'adx_thresh': 20.564140974406683, 'atr_min_pct': 0.0003476685498127218, 'atr_max_pct': 0.12565203576987158, 'tp_mult': 2.725623193056037, 'tsl_mult': 0.01887501673207529, 'strategy': 'breakout', 'time_stop': 167, 'use_sma': False, 'use_atr': True, 'use_adx': False, 'use_ema': True, 'use_spike': False, 'rsi_required': False, 'edge_k': 0.6113864490681786, 'edge_cap': 0.5128553291380309, 'bull_strategy': 'breakout', 'bull_bb_std_mult': 2.6641623477708904, 'bull_rsi_os': 6, 'bull_rsi_ob': 50, 'bull_adx_thresh': 12.658451843384485, 'bull_atr_min_pct': 0.01991260521229951, 'bull_atr_max_pct': 0.14387942236231102, 'bull_tp_mult': 1.0641975507851664, 'bull_tsl_mult': 0.20601385931180224, 'bull_time_stop': 294, 'bull_use_sma': True, 'bull_use_ema': False, 'bull_use_atr': False, 'bull_use_adx': False, 'bull_use_spike': True, 'bull_rsi_required': False, 'bear_strategy': 'breakout', 'bear_bb_std_mult': 3.1694545599311175, 'bear_rsi_os': 28, 'bear_rsi_ob': 70, 'bear_adx_thresh': 14.809256886051257, 'bear_atr_min_pct': 0.002075967556483724, 'bear_atr_max_pct': 0.12301275051435384, 'bear_tp_mult': 2.8926218246626454, 'bear_tsl_mult': 0.7203118219577126, 'bear_time_stop': 209, 'bear_use_sma': True, 'bear_use_ema': True, 'bear_use_atr': True, 'bear_use_adx': True, 'bear_use_spike': False, 'bear_rsi_required': True, 'sideways_strategy': 'breakout', 'sideways_bb_std_mult': 2.593691532001447, 'sideways_rsi_os': 30, 'sideways_rsi_ob': 69, 'sideways_adx_thresh': 24.741335553165108, 'sideways_atr_min_pct': 0.0024372442526883606, 'sideways_atr_max_pct': 0.12324180579146823, 'sideways_tp_mult': 1.6495473512379806, 'sideways_tsl_mult': 0.8179247547881328, 'sideways_time_stop': 191, 'sideways_use_sma': True, 'sideways_use_ema': False, 'sideways_use_atr': False, 'sideways_use_adx': True, 'sideways_use_spike': False, 'sideways_rsi_required': True}.
[I 2025-08-31 12:46:40,861] Trial 419 finished with values: [-0.12972723463730673, 0.12912979981724676] and parameters: {'p_sma': 51, 'p_std': 25, 'p_atr': 12, 'p_adx': 15, 'rsi_period': 47, 'ema1': 21, 'ema2': 58, 'slip_atr_k': 0.06378525272289048, 'slip_spread_k': 0.4181392080328699, 'spread_hl_frac': 0.017735245815449545, 'bb_std_mult': 2.4284279707159495, 'rsi_os': 39, 'rsi_ob': 80, 'vol_spike': 0.023978030361417647, 'adx_thresh': 18.255301316388746, 'atr_min_pct': 0.0021611988188503786, 'atr_max_pct': 0.12569286570254123, 'tp_mult': 1.2966209014111802, 'tsl_mult': 0.023158253850756785, 'strategy': 'breakout', 'time_stop': 167, 'use_sma': False, 'use_atr': True, 'use_adx': False, 'use_ema': True, 'use_spike': False, 'rsi_required': True, 'edge_k': 0.5939516850557138, 'edge_cap': 0.5904013213087355, 'bull_strategy': 'breakout', 'bull_bb_std_mult': 2.6453589092624674, 'bull_rsi_os': 6, 'bull_rsi_ob': 50, 'bull_adx_thresh': 22.51399218299028, 'bull_atr_min_pct': 0.01994030516500545, 'bull_atr_max_pct': 0.14742596769216396, 'bull_tp_mult': 1.2899104957265777, 'bull_tsl_mult': 0.20601622415369014, 'bull_time_stop': 293, 'bull_use_sma': True, 'bull_use_ema': False, 'bull_use_atr': False, 'bull_use_adx': False, 'bull_use_spike': False, 'bull_rsi_required': False, 'bear_strategy': 'breakout', 'bear_bb_std_mult': 3.1783177185346076, 'bear_rsi_os': 47, 'bear_rsi_ob': 80, 'bear_adx_thresh': 14.36562930801082, 'bear_atr_min_pct': 0.0021074260751442523, 'bear_atr_max_pct': 0.1378112642274385, 'bear_tp_mult': 2.909385422486996, 'bear_tsl_mult': 0.7620461105893299, 'bear_time_stop': 207, 'bear_use_sma': True, 'bear_use_ema': True, 'bear_use_atr': True, 'bear_use_adx': True, 'bear_use_spike': True, 'bear_rsi_required': True, 'sideways_strategy': 'breakout', 'sideways_bb_std_mult': 2.4427823147944276, 'sideways_rsi_os': 32, 'sideways_rsi_ob': 65, 'sideways_adx_thresh': 26.895715576263587, 'sideways_atr_min_pct': 0.0023716304943528135, 'sideways_atr_max_pct': 0.12326532948145394, 'sideways_tp_mult': 1.6575021619995647, 'sideways_tsl_mult': 0.8155567927072047, 'sideways_time_stop': 95, 'sideways_use_sma': True, 'sideways_use_ema': False, 'sideways_use_atr': False, 'sideways_use_adx': False, 'sideways_use_spike': False, 'sideways_rsi_required': True}.
