[I 2025-08-31 12:49:29,207] Trial 441 finished with values: [-1000000000.0, 1000000000.0] and parameters: {'p_sma': 8, 'p_std': 26, 'p_atr': 13, 'p_adx': 27, 'rsi_period': 50, 'ema1': 20, 'ema2': 16, 'slip_atr_k': 0.06909269094989859, 'slip_spread_k': 0.45863412788343416, 'spread_hl_frac': 0.015552253812991256, 'bb_std_mult': 2.389565408920387, 'rsi_os': 40, 'rsi_ob': 78, 'vol_spike': 0.014625829134370633, 'adx_thresh': 20.050706276053738, 'atr_min_pct': 0.0017790804562285408, 'atr_max_pct': 0.09299673080651435, 'tp_mult': 2.748316267616423, 'tsl_mult': 0.024028716894748725, 'strategy': 'breakout', 'time_stop': 169, 'use_sma': False, 'use_atr': True, 'use_adx': False, 'use_ema': True, 'use_spike': False, 'rsi_required': False, 'edge_k': 1.4668528667777165, 'edge_cap': 0.5678830087158602, 'bull_strategy': 'breakout', 'bull_bb_std_mult': 1.5895655086196587, 'bull_rsi_os': 6, 'bull_rsi_ob': 51, 'bull_adx_thresh': 14.911653311173191, 'bull_atr_min_pct': 0.016654185743901467, 'bull_atr_max_pct': 0.14991225756516305, 'bull_tp_mult': 1.3633434242446354, 'bull_tsl_mult': 0.1687350493437487, 'bull_time_stop': 293, 'bull_use_sma': True, 'bull_use_ema': True, 'bull_use_atr': False, 'bull_use_adx': True, 'bull_use_spike': False, 'bull_rsi_required': False, 'bear_strategy': 'breakout', 'bear_bb_std_mult': 0.8749758651978334, 'bear_rsi_os': 15, 'bear_rsi_ob': 56, 'bear_adx_thresh': 14.02232083488742, 'bear_atr_min_pct': 0.0019977282935652214, 'bear_atr_max_pct': 0.1469149696110788, 'bear_tp_mult': 2.998008396250236, 'bear_tsl_mult': 0.7414464538701214, 'bear_time_stop': 194, 'bear_use_sma': True, 'bear_use_ema': True, 'bear_use_atr': True, 'bear_use_adx': False, 'bear_use_spike': True, 'bear_rsi_required': False, 'sideways_strategy': 'breakout', 'sideways_bb_std_mult': 2.641824970233049, 'sideways_rsi_os': 30, 'sideways_rsi_ob': 65, 'sideways_adx_thresh': 26.792708855829034, 'sideways_atr_min_pct': 0.004561611409316907, 'sideways_atr_max_pct': 0.12060016121998768, 'sideways_tp_mult': 1.677618911572338, 'sideways_tsl_mult': 0.9020100678912985, 'sideways_time_stop': 188, 'sideways_use_sma': True, 'sideways_use_ema': False, 'sideways_use_atr': True, 'sideways_use_adx': False, 'sideways_use_spike': False, 'sideways_rsi_required': True}.
[I 2025-08-31 12:49:29,630] Trial 442 finished with values: [-0.1654453308586451, 0.1648713987678183] and parameters: {'p_sma': 52, 'p_std': 41, 'p_atr': 13, 'p_adx': 15, 'rsi_period': 50, 'ema1': 20, 'ema2': 16, 'slip_atr_k': 0.07166963321895135, 'slip_spread_k': 0.4539258462032624, 'spread_hl_frac': 0.018556552055616665, 'bb_std_mult': 2.3891714146860368, 'rsi_os': 11, 'rsi_ob': 80, 'vol_spike': 0.017397459769045442, 'adx_thresh': 19.94777975445923, 'atr_min_pct': 0.0020335722193257945, 'atr_max_pct': 0.1214357054586945, 'tp_mult': 1.8617294338268928, 'tsl_mult': 0.020868396799289063, 'strategy': 'breakout', 'time_stop': 170, 'use_sma': False, 'use_atr': True, 'use_adx': False, 'use_ema': True, 'use_spike': True, 'rsi_required': False, 'edge_k': 1.4621499681011683, 'edge_cap': 0.3648027602424967, 'bull_strategy': 'breakout', 'bull_bb_std_mult': 1.5886817755918454, 'bull_rsi_os': 44, 'bull_rsi_ob': 50, 'bull_adx_thresh': 15.96764727860292, 'bull_atr_min_pct': 0.017178804954928954, 'bull_atr_max_pct': 0.1421307767892261, 'bull_tp_mult': 1.307648433102994, 'bull_tsl_mult': 0.16810517197896846, 'bull_time_stop': 293, 'bull_use_sma': True, 'bull_use_ema': True, 'bull_use_atr': False, 'bull_use_adx': True, 'bull_use_spike': False, 'bull_rsi_required': False, 'bear_strategy': 'breakout', 'bear_bb_std_mult': 1.3488201981516457, 'bear_rsi_os': 49, 'bear_rsi_ob': 69, 'bear_adx_thresh': 14.066509325162563, 'bear_atr_min_pct': 0.00026655936329773866, 'bear_atr_max_pct': 0.14568868875410348, 'bear_tp_mult': 2.9988788425372346, 'bear_tsl_mult': 0.7414280693388925, 'bear_time_stop': 214, 'bear_use_sma': True, 'bear_use_ema': True, 'bear_use_atr': False, 'bear_use_adx': False, 'bear_use_spike': True, 'bear_rsi_required': False, 'sideways_strategy': 'breakout', 'sideways_bb_std_mult': 2.64405041831003, 'sideways_rsi_os': 31, 'sideways_rsi_ob': 66, 'sideways_adx_thresh': 24.634689163936947, 'sideways_atr_min_pct': 0.003171309367069491, 'sideways_atr_max_pct': 0.010052821374133394, 'sideways_tp_mult': 1.5856773138388849, 'sideways_tsl_mult': 0.9055584062971037, 'sideways_time_stop': 189, 'sideways_use_sma': True, 'sideways_use_ema': True, 'sideways_use_atr': True, 'sideways_use_adx': False, 'sideways_use_spike': False, 'sideways_rsi_required': True}.
[I 2025-08-31 12:50:01,791] Trial 443 finished with values: [-0.1254191130890394, 0.12497117863527438] and parameters: {'p_sma': 52, 'p_std': 22, 'p_atr': 15, 'p_adx': 30, 'rsi_period': 50, 'ema1': 20, 'ema2': 16, 'slip_atr_k': 0.05905411333946009, 'slip_spread_k': 0.3789563946740041, 'spread_hl_frac': 0.015570213850195146, 'bb_std_mult': 2.162106999968997, 'rsi_os': 40, 'rsi_ob': 77, 'vol_spike': 0.0042660688603306865, 'adx_thresh': 17.659584121783883, 'atr_min_pct': 0.01028759391160061, 'atr_max_pct': 0.03993968732619658, 'tp_mult': 2.8698590893355385, 'tsl_mult': 0.01884640887587654, 'strategy': 'breakout', 'time_stop': 24, 'use_sma': False, 'use_atr': True, 'use_adx': False, 'use_ema': True, 'use_spike': True, 'rsi_required': False, 'edge_k': 1.634812165895494, 'edge_cap': 0.5646104966987663, 'bull_strategy': 'breakout', 'bull_bb_std_mult': 2.7724252555689137, 'bull_rsi_os': 6, 'bull_rsi_ob': 50, 'bull_adx_thresh': 13.525795999237506, 'bull_atr_min_pct': 0.01863326874118683, 'bull_atr_max_pct': 0.14994669263150892, 'bull_tp_mult': 1.0195974444166036, 'bull_tsl_mult': 0.17423433521767134, 'bull_time_stop': 277, 'bull_use_sma': True, 'bull_use_ema': True, 'bull_use_atr': False, 'bull_use_adx': True, 'bull_use_spike': False, 'bull_rsi_required': False, 'bear_strategy': 'breakout', 'bear_bb_std_mult': 3.0967272628738103, 'bear_rsi_os': 49, 'bear_rsi_ob': 69, 'bear_adx_thresh': 14.760974741104205, 'bear_atr_min_pct': 0.0020094328577451317, 'bear_atr_max_pct': 0.1286517882787546, 'bear_tp_mult': 2.3292980648422414, 'bear_tsl_mult': 0.7744961446509592, 'bear_time_stop': 205, 'bear_use_sma': False, 'bear_use_ema': True, 'bear_use_atr': False, 'bear_use_adx': False, 'bear_use_spike': True, 'bear_rsi_required': True, 'sideways_strategy': 'mean_reversion', 'sideways_bb_std_mult': 2.629376765394132, 'sideways_rsi_os': 5, 'sideways_rsi_ob': 69, 'sideways_adx_thresh': 26.768293847263813, 'sideways_atr_min_pct': 0.018045821918857886, 'sideways_atr_max_pct': 0.1348624769604484, 'sideways_tp_mult': 1.6031895819811535, 'sideways_tsl_mult': 0.8508847111920148, 'sideways_time_stop': 201, 'sideways_use_sma': True, 'sideways_use_ema': True, 'sideways_use_atr': True, 'sideways_use_adx': False, 'sideways_use_spike': False, 'sideways_rsi_required': False}.
[I 2025-08-31 12:50:02,363] Trial 445 finished with values: [-0.05231521965733177, 0.05189967687676055] and parameters: {'p_sma': 52, 'p_std': 41, 'p_atr': 15, 'p_adx': 26, 'rsi_period': 51, 'ema1': 19, 'ema2': 15, 'slip_atr_k': 0.1940757993379265, 'slip_spread_k': 0.3827197862625648, 'spread_hl_frac': 0.017080462732381178, 'bb_std_mult': 2.39834227229206, 'rsi_os': 36, 'rsi_ob': 80, 'vol_spike': 0.0045905996592604525, 'adx_thresh': 19.9475167145041, 'atr_min_pct': 0.0008517648190292826, 'atr_max_pct': 0.035015650268301536, 'tp_mult': 2.6753311297211844, 'tsl_mult': 0.06146008898330778, 'strategy': 'breakout', 'time_stop': 160, 'use_sma': False, 'use_atr': False, 'use_adx': False, 'use_ema': True, 'use_spike': True, 'rsi_required': True, 'edge_k': 0.6737570652090339, 'edge_cap': 0.13155110035521017, 'bull_strategy': 'breakout', 'bull_bb_std_mult': 3.5133209526444764, 'bull_rsi_os': 5, 'bull_rsi_ob': 48, 'bull_adx_thresh': 15.751151734968465, 'bull_atr_min_pct': 0.018557237257648514, 'bull_atr_max_pct': 0.14165611539583908, 'bull_tp_mult': 1.2965623800639148, 'bull_tsl_mult': 0.7730860429016495, 'bull_time_stop': 278, 'bull_use_sma': True, 'bull_use_ema': True, 'bull_use_atr': False, 'bull_use_adx': True, 'bull_use_spike': False, 'bull_rsi_required': False, 'bear_strategy': 'breakout', 'bear_bb_std_mult': 3.1323597301884045, 'bear_rsi_os': 39, 'bear_rsi_ob': 69, 'bear_adx_thresh': 15.428078684774617, 'bear_atr_min_pct': 0.003760354564832655, 'bear_atr_max_pct': 0.1277674708224522, 'bear_tp_mult': 2.3194161754126554, 'bear_tsl_mult': 0.7741097133514151, 'bear_time_stop': 201, 'bear_use_sma': False, 'bear_use_ema': False, 'bear_use_atr': False, 'bear_use_adx': False, 'bear_use_spike': True, 'bear_rsi_required': True, 'sideways_strategy': 'mean_reversion', 'sideways_bb_std_mult': 2.56033368358641, 'sideways_rsi_os': 31, 'sideways_rsi_ob': 66, 'sideways_adx_thresh': 27.2747751012209, 'sideways_atr_min_pct': 0.018765944962875356, 'sideways_atr_max_pct': 0.08051215064718331, 'sideways_tp_mult': 1.585567608979978, 'sideways_tsl_mult': 0.811652185549015, 'sideways_time_stop': 201, 'sideways_use_sma': True, 'sideways_use_ema': True, 'sideways_use_atr': True, 'sideways_use_adx': False, 'sideways_use_spike': False, 'sideways_rsi_required': False}.
[I 2025-08-31 12:50:02,648] Trial 446 finished with values: [-0.09378026904430625, 0.09385849511716658] and parameters: {'p_sma': 50, 'p_std': 22, 'p_atr': 15, 'p_adx': 25, 'rsi_period': 55, 'ema1': 19, 'ema2': 15, 'slip_atr_k': 0.0578211661410426, 'slip_spread_k': 0.37738400103277964, 'spread_hl_frac': 0.020595699091754127, 'bb_std_mult': 2.157412706560539, 'rsi_os': 8, 'rsi_ob': 81, 'vol_spike': 0.04243477594579413, 'adx_thresh': 17.858097427612073, 'atr_min_pct': 0.023597848245870565, 'atr_max_pct': 0.08759232135526353, 'tp_mult': 2.662574738624221, 'tsl_mult': 0.0003230537321118332, 'strategy': 'breakout', 'time_stop': 158, 'use_sma': False, 'use_atr': False, 'use_adx': False, 'use_ema': True, 'use_spike': True, 'rsi_required': True, 'edge_k': 0.6871216471502845, 'edge_cap': 0.6657165201304442, 'bull_strategy': 'breakout', 'bull_bb_std_mult': 2.7741710638187, 'bull_rsi_os': 5, 'bull_rsi_ob': 48, 'bull_adx_thresh': 13.51751504238352, 'bull_atr_min_pct': 0.018942489520400476, 'bull_atr_max_pct': 0.1496163939012908, 'bull_tp_mult': 1.2649315837717776, 'bull_tsl_mult': 0.6008945730586293, 'bull_time_stop': 278, 'bull_use_sma': False, 'bull_use_ema': True, 'bull_use_atr': False, 'bull_use_adx': True, 'bull_use_spike': False, 'bull_rsi_required': False, 'bear_strategy': 'breakout', 'bear_bb_std_mult': 1.0448781765193338, 'bear_rsi_os': 42, 'bear_rsi_ob': 70, 'bear_adx_thresh': 14.702742944603232, 'bear_atr_min_pct': 0.0025253621298989945, 'bear_atr_max_pct': 0.12945407128300415, 'bear_tp_mult': 2.219215445823766, 'bear_tsl_mult': 0.8032005038321117, 'bear_time_stop': 206, 'bear_use_sma': False, 'bear_use_ema': False, 'bear_use_atr': False, 'bear_use_adx': True, 'bear_use_spike': True, 'bear_rsi_required': True, 'sideways_strategy': 'mean_reversion', 'sideways_bb_std_mult': 2.5287780877469763, 'sideways_rsi_os': 30, 'sideways_rsi_ob': 69, 'sideways_adx_thresh': 27.093485953016522, 'sideways_atr_min_pct': 0.0029002861921359345, 'sideways_atr_max_pct': 0.08126053764436608, 'sideways_tp_mult': 1.7706459410054811, 'sideways_tsl_mult': 0.8550047256128537, 'sideways_time_stop': 201, 'sideways_use_sma': True, 'sideways_use_ema': True, 'sideways_use_atr': False, 'sideways_use_adx': False, 'sideways_use_spike': False, 'sideways_rsi_required': False}.
[I 2025-08-31 12:50:02,938] Trial 444 finished with values: [-1000000000.0, 1000000000.0] and parameters: {'p_sma': 52, 'p_std': 26, 'p_atr': 12, 'p_adx': 25, 'rsi_period': 55, 'ema1': 20, 'ema2': 16, 'slip_atr_k': 0.1476269225114242, 'slip_spread_k': 0.4519316377184964, 'spread_hl_frac': 0.013944297635444225, 'bb_std_mult': 2.379374179599486, 'rsi_os': 10, 'rsi_ob': 81, 'vol_spike': 0.012549300042661804, 'adx_thresh': 17.57677307477308, 'atr_min_pct': 0.0010463708084242546, 'atr_max_pct': 0.12438100995847447, 'tp_mult': 2.3775507960458544, 'tsl_mult': 0.3371768526198425, 'strategy': 'breakout', 'time_stop': 163, 'use_sma': False, 'use_atr': False, 'use_adx': False, 'use_ema': True, 'use_spike': True, 'rsi_required': False, 'edge_k': 0.6817602362289901, 'edge_cap': 0.6639817038783401, 'bull_strategy': 'breakout', 'bull_bb_std_mult': 2.7711670249685345, 'bull_rsi_os': 5, 'bull_rsi_ob': 50, 'bull_adx_thresh': 16.030486655140702, 'bull_atr_min_pct': 0.01416240574426098, 'bull_atr_max_pct': 0.14964835677881766, 'bull_tp_mult': 1.0203002782697395, 'bull_tsl_mult': 0.9037342782356803, 'bull_time_stop': 278, 'bull_use_sma': True, 'bull_use_ema': True, 'bull_use_atr': False, 'bull_use_adx': True, 'bull_use_spike': False, 'bull_rsi_required': False, 'bear_strategy': 'breakout', 'bear_bb_std_mult': 1.0389091534111277, 'bear_rsi_os': 5, 'bear_rsi_ob': 69, 'bear_adx_thresh': 14.604569304565493, 'bear_atr_min_pct': 0.0019269462963459813, 'bear_atr_max_pct': 0.11913294101466133, 'bear_tp_mult': 2.227585680585356, 'bear_tsl_mult': 0.7999075824878115, 'bear_time_stop': 202, 'bear_use_sma': False, 'bear_use_ema': True, 'bear_use_atr': False, 'bear_use_adx': False, 'bear_use_spike': True, 'bear_rsi_required': False, 'sideways_strategy': 'mean_reversion', 'sideways_bb_std_mult': 2.612884336120436, 'sideways_rsi_os': 30, 'sideways_rsi_ob': 70, 'sideways_adx_thresh': 26.85148587439928, 'sideways_atr_min_pct': 0.01892998188568675, 'sideways_atr_max_pct': 0.1352605304688021, 'sideways_tp_mult': 1.5880480528442047, 'sideways_tsl_mult': 0.8090623422910564, 'sideways_time_stop': 61, 'sideways_use_sma': True, 'sideways_use_ema': True, 'sideways_use_atr': True, 'sideways_use_adx': False, 'sideways_use_spike': False, 'sideways_rsi_required': False}.
[I 2025-08-31 12:50:35,559] Trial 447 finished with values: [-0.08390889024830539, 0.08402871153497483] and parameters: {'p_sma': 54, 'p_std': 39, 'p_atr': 12, 'p_adx': 26, 'rsi_period': 55, 'ema1': 19, 'ema2': 15, 'slip_atr_k': 0.19495764938119559, 'slip_spread_k': 0.4321643252218299, 'spread_hl_frac': 0.01394403139423343, 'bb_std_mult': 2.2706733303928606, 'rsi_os': 36, 'rsi_ob': 81, 'vol_spike': 0.04363270301518393, 'adx_thresh': 20.35202970615116, 'atr_min_pct': 0.001113714560329842, 'atr_max_pct': 0.05304913846583824, 'tp_mult': 2.6906357390745934, 'tsl_mult': 0.3437523294634648, 'strategy': 'breakout', 'time_stop': 159, 'use_sma': False, 'use_atr': False, 'use_adx': True, 'use_ema': True, 'use_spike': False, 'rsi_required': True, 'edge_k': 0.678464172023246, 'edge_cap': 0.6372774357962911, 'bull_strategy': 'breakout', 'bull_bb_std_mult': 3.532150272641756, 'bull_rsi_os': 5, 'bull_rsi_ob': 48, 'bull_adx_thresh': 16.233343040594747, 'bull_atr_min_pct': 0.01918092514899579, 'bull_atr_max_pct': 0.14716049797942732, 'bull_tp_mult': 1.2537982684193714, 'bull_tsl_mult': 0.8637007611125076, 'bull_time_stop': 280, 'bull_use_sma': False, 'bull_use_ema': True, 'bull_use_atr': True, 'bull_use_adx': True, 'bull_use_spike': False, 'bull_rsi_required': True, 'bear_strategy': 'breakout', 'bear_bb_std_mult': 3.1328930072625547, 'bear_rsi_os': 41, 'bear_rsi_ob': 70, 'bear_adx_thresh': 12.602106840796422, 'bear_atr_min_pct': 0.0032884333140066517, 'bear_atr_max_pct': 0.13496061079014401, 'bear_tp_mult': 2.9491572362926317, 'bear_tsl_mult': 0.8053698609188277, 'bear_time_stop': 201, 'bear_use_sma': False, 'bear_use_ema': False, 'bear_use_atr': True, 'bear_use_adx': True, 'bear_use_spike': True, 'bear_rsi_required': True, 'sideways_strategy': 'mean_reversion', 'sideways_bb_std_mult': 2.5467016802311866, 'sideways_rsi_os': 31, 'sideways_rsi_ob': 66, 'sideways_adx_thresh': 28.980519025739937, 'sideways_atr_min_pct': 0.015800814808087357, 'sideways_atr_max_pct': 0.1298554972245393, 'sideways_tp_mult': 1.542269569505511, 'sideways_tsl_mult': 0.8183412254109794, 'sideways_time_stop': 61, 'sideways_use_sma': True, 'sideways_use_ema': False, 'sideways_use_atr': False, 'sideways_use_adx': False, 'sideways_use_spike': False, 'sideways_rsi_required': False}.
[I 2025-08-31 12:50:35,701] Trial 449 finished with values: [-1000000000.0, 1000000000.0] and parameters: {'p_sma': 41, 'p_std': 26, 'p_atr': 18, 'p_adx': 15, 'rsi_period': 53, 'ema1': 18, 'ema2': 48, 'slip_atr_k': 0.15368505582704653, 'slip_spread_k': 0.4335753283551959, 'spread_hl_frac': 0.01727591470026924, 'bb_std_mult': 3.4133261833401662, 'rsi_os': 23, 'rsi_ob': 45, 'vol_spike': 0.029341521763241937, 'adx_thresh': 20.6689407223486, 'atr_min_pct': 0.001283224982573535, 'atr_max_pct': 0.12415839368570565, 'tp_mult': 2.6384892241066056, 'tsl_mult': 0.19216546532369227, 'strategy': 'breakout', 'time_stop': 177, 'use_sma': True, 'use_atr': True, 'use_adx': True, 'use_ema': True, 'use_spike': False, 'rsi_required': True, 'edge_k': 1.9150460550913335, 'edge_cap': 0.7107235413214327, 'bull_strategy': 'breakout', 'bull_bb_std_mult': 2.69802413829817, 'bull_rsi_os': 26, 'bull_rsi_ob': 50, 'bull_adx_thresh': 17.5925133960277, 'bull_atr_min_pct': 0.015472982827184288, 'bull_atr_max_pct': 0.14670931621993263, 'bull_tp_mult': 1.1080749689121796, 'bull_tsl_mult': 0.9004052776054906, 'bull_time_stop': 284, 'bull_use_sma': True, 'bull_use_ema': False, 'bull_use_atr': True, 'bull_use_adx': True, 'bull_use_spike': True, 'bull_rsi_required': True, 'bear_strategy': 'breakout', 'bear_bb_std_mult': 3.1939270586106874, 'bear_rsi_os': 29, 'bear_rsi_ob': 70, 'bear_adx_thresh': 12.770359210109351, 'bear_atr_min_pct': 0.003132575161440665, 'bear_atr_max_pct': 0.1348274424949173, 'bear_tp_mult': 2.9491542243376907, 'bear_tsl_mult': 0.8048847868592252, 'bear_time_stop': 180, 'bear_use_sma': True, 'bear_use_ema': True, 'bear_use_atr': True, 'bear_use_adx': True, 'bear_use_spike': False, 'bear_rsi_required': True, 'sideways_strategy': 'breakout', 'sideways_bb_std_mult': 2.594878092820974, 'sideways_rsi_os': 32, 'sideways_rsi_ob': 70, 'sideways_adx_thresh': 28.94879519262945, 'sideways_atr_min_pct': 0.0026210152967435633, 'sideways_atr_max_pct': 0.13092418722048701, 'sideways_tp_mult': 1.5348711874689573, 'sideways_tsl_mult': 0.8326840161037172, 'sideways_time_stop': 62, 'sideways_use_sma': True, 'sideways_use_ema': False, 'sideways_use_atr': False, 'sideways_use_adx': True, 'sideways_use_spike': False, 'sideways_rsi_required': True}.
[I 2025-08-31 12:50:35,867] Trial 450 finished with values: [-0.057524249400103145, 0.05727649745295447] and parameters: {'p_sma': 54, 'p_std': 47, 'p_atr': 30, 'p_adx': 14, 'rsi_period': 47, 'ema1': 21, 'ema2': 53, 'slip_atr_k': 0.12602010630030652, 'slip_spread_k': 0.34804595778607966, 'spread_hl_frac': 0.01671850432616443, 'bb_std_mult': 3.5930903657716553, 'rsi_os': 38, 'rsi_ob': 66, 'vol_spike': 0.029599653315272388, 'adx_thresh': 20.57791725309961, 'atr_min_pct': 0.0025421171176545614, 'atr_max_pct': 0.061310075687301735, 'tp_mult': 1.6182450880882868, 'tsl_mult': 0.6478819115384975, 'strategy': 'breakout', 'time_stop': 179, 'use_sma': True, 'use_atr': True, 'use_adx': True, 'use_ema': True, 'use_spike': False, 'rsi_required': True, 'edge_k': 1.8798653536976397, 'edge_cap': 0.4430500723509902, 'bull_strategy': 'mean_reversion', 'bull_bb_std_mult': 1.9422413359629749, 'bull_rsi_os': 8, 'bull_rsi_ob': 49, 'bull_adx_thresh': 17.419051378194496, 'bull_atr_min_pct': 6.4775762765676564e-06, 'bull_atr_max_pct': 0.14667164130253788, 'bull_tp_mult': 1.1242886438014645, 'bull_tsl_mult': 0.20238681576766987, 'bull_time_stop': 284, 'bull_use_sma': False, 'bull_use_ema': False, 'bull_use_atr': True, 'bull_use_adx': True, 'bull_use_spike': True, 'bull_rsi_required': True, 'bear_strategy': 'breakout', 'bear_bb_std_mult': 3.162018414740062, 'bear_rsi_os': 28, 'bear_rsi_ob': 53, 'bear_adx_thresh': 12.527853054751773, 'bear_atr_min_pct': 0.0029821798670444668, 'bear_atr_max_pct': 0.12525719842913438, 'bear_tp_mult': 2.925263934997987, 'bear_tsl_mult': 0.7661907170072197, 'bear_time_stop': 184, 'bear_use_sma': True, 'bear_use_ema': True, 'bear_use_atr': True, 'bear_use_adx': True, 'bear_use_spike': False, 'bear_rsi_required': True, 'sideways_strategy': 'breakout', 'sideways_bb_std_mult': 2.769902399089862, 'sideways_rsi_os': 32, 'sideways_rsi_ob': 67, 'sideways_adx_thresh': 25.499709530491078, 'sideways_atr_min_pct': 0.021564311225353124, 'sideways_atr_max_pct': 0.13024964636768513, 'sideways_tp_mult': 1.534406835667478, 'sideways_tsl_mult': 0.8744344538661691, 'sideways_time_stop': 278, 'sideways_use_sma': True, 'sideways_use_ema': False, 'sideways_use_atr': False, 'sideways_use_adx': True, 'sideways_use_spike': True, 'sideways_rsi_required': True}.
