[I 2025-08-31 13:19:44,625] Trial 654 finished with values: [-1000000000.0, 1000000000.0] and parameters: {'p_sma': 28, 'p_std': 21, 'p_atr': 15, 'p_adx': 13, 'rsi_period': 47, 'ema1': 11, 'ema2': 19, 'slip_atr_k': 0.035534493113145604, 'slip_spread_k': 0.39355028278383125, 'spread_hl_frac': 0.019282759035862858, 'bb_std_mult': 2.4061956425214084, 'rsi_os': 42, 'rsi_ob': 95, 'vol_spike': 0.012741395219662137, 'adx_thresh': 5.217078724937501, 'atr_min_pct': 0.025247084026519158, 'atr_max_pct': 0.054294335044565975, 'tp_mult': 2.4479646853267947, 'tsl_mult': 0.6893096291482199, 'strategy': 'mean_reversion', 'time_stop': 167, 'use_sma': False, 'use_atr': False, 'use_adx': True, 'use_ema': False, 'use_spike': True, 'rsi_required': False, 'edge_k': 0.572768671296338, 'edge_cap': 0.6376947192869368, 'bull_strategy': 'mean_reversion', 'bull_bb_std_mult': 2.8789692265801707, 'bull_rsi_os': 5, 'bull_rsi_ob': 88, 'bull_adx_thresh': 18.247935677918107, 'bull_atr_min_pct': 0.021634616587585382, 'bull_atr_max_pct': 0.13528836502765373, 'bull_tp_mult': 2.1113264163743497, 'bull_tsl_mult': 0.2687238353838227, 'bull_time_stop': 160, 'bull_use_sma': False, 'bull_use_ema': True, 'bull_use_atr': True, 'bull_use_adx': True, 'bull_use_spike': True, 'bull_rsi_required': True, 'bear_strategy': 'breakout', 'bear_bb_std_mult': 3.486416997849698, 'bear_rsi_os': 31, 'bear_rsi_ob': 56, 'bear_adx_thresh': 22.83015065696301, 'bear_atr_min_pct': 0.0008583033194367728, 'bear_atr_max_pct': 0.11502555475370668, 'bear_tp_mult': 1.0147319142492859, 'bear_tsl_mult': 0.6862927865173198, 'bear_time_stop': 196, 'bear_use_sma': False, 'bear_use_ema': True, 'bear_use_atr': False, 'bear_use_adx': False, 'bear_use_spike': False, 'bear_rsi_required': True, 'sideways_strategy': 'mean_reversion', 'sideways_bb_std_mult': 2.767297910535403, 'sideways_rsi_os': 29, 'sideways_rsi_ob': 65, 'sideways_adx_thresh': 24.377024086767133, 'sideways_atr_min_pct': 0.004009704104058983, 'sideways_atr_max_pct': 0.14473289592834762, 'sideways_tp_mult': 1.723806018107801, 'sideways_tsl_mult': 0.8542589859804804, 'sideways_time_stop': 39, 'sideways_use_sma': False, 'sideways_use_ema': True, 'sideways_use_atr': True, 'sideways_use_adx': True, 'sideways_use_spike': False, 'sideways_rsi_required': True}.
[I 2025-08-31 13:20:18,842] Trial 660 finished with values: [-0.045089541412341116, 0.04447125539057127] and parameters: {'p_sma': 28, 'p_std': 21, 'p_atr': 15, 'p_adx': 13, 'rsi_period': 48, 'ema1': 13, 'ema2': 19, 'slip_atr_k': 0.03458271773162695, 'slip_spread_k': 0.38216378566815445, 'spread_hl_frac': 0.01857294713274191, 'bb_std_mult': 2.3132453781675206, 'rsi_os': 42, 'rsi_ob': 86, 'vol_spike': 0.016685158418141794, 'adx_thresh': 5.80680079712609, 'atr_min_pct': 0.023472281429676996, 'atr_max_pct': 0.04745611997231448, 'tp_mult': 2.5430957687808324, 'tsl_mult': 0.8617018558841887, 'strategy': 'breakout', 'time_stop': 113, 'use_sma': False, 'use_atr': False, 'use_adx': True, 'use_ema': True, 'use_spike': True, 'rsi_required': False, 'edge_k': 0.48379913307134625, 'edge_cap': 0.6566759454227846, 'bull_strategy': 'mean_reversion', 'bull_bb_std_mult': 2.8088379699997534, 'bull_rsi_os': 5, 'bull_rsi_ob': 84, 'bull_adx_thresh': 19.335644140284447, 'bull_atr_min_pct': 0.021304985283952083, 'bull_atr_max_pct': 0.12379462853320361, 'bull_tp_mult': 2.2563808262696905, 'bull_tsl_mult': 0.2599161688194994, 'bull_time_stop': 183, 'bull_use_sma': True, 'bull_use_ema': True, 'bull_use_atr': True, 'bull_use_adx': True, 'bull_use_spike': True, 'bull_rsi_required': True, 'bear_strategy': 'breakout', 'bear_bb_std_mult': 3.3956118336963206, 'bear_rsi_os': 35, 'bear_rsi_ob': 67, 'bear_adx_thresh': 18.386322453359494, 'bear_atr_min_pct': 0.0008700427978489301, 'bear_atr_max_pct': 0.11310405490773907, 'bear_tp_mult': 1.1568848728302665, 'bear_tsl_mult': 0.6661803970044111, 'bear_time_stop': 197, 'bear_use_sma': False, 'bear_use_ema': True, 'bear_use_atr': False, 'bear_use_adx': False, 'bear_use_spike': True, 'bear_rsi_required': True, 'sideways_strategy': 'breakout', 'sideways_bb_std_mult': 2.917603317645452, 'sideways_rsi_os': 27, 'sideways_rsi_ob': 65, 'sideways_adx_thresh': 23.024615792446113, 'sideways_atr_min_pct': 0.003640699775602478, 'sideways_atr_max_pct': 0.14626123272430155, 'sideways_tp_mult': 1.7121317720007752, 'sideways_tsl_mult': 0.7864326534937989, 'sideways_time_stop': 21, 'sideways_use_sma': False, 'sideways_use_ema': False, 'sideways_use_atr': True, 'sideways_use_adx': True, 'sideways_use_spike': False, 'sideways_rsi_required': True}.
[I 2025-08-31 13:20:18,843] Trial 659 finished with values: [-1000000000.0, 1000000000.0] and parameters: {'p_sma': 16, 'p_std': 21, 'p_atr': 15, 'p_adx': 13, 'rsi_period': 46, 'ema1': 13, 'ema2': 19, 'slip_atr_k': 0.03479739894679195, 'slip_spread_k': 0.38068943201893896, 'spread_hl_frac': 0.018511247086371408, 'bb_std_mult': 2.3255100373391406, 'rsi_os': 39, 'rsi_ob': 86, 'vol_spike': 0.01492778479699908, 'adx_thresh': 6.283188039084186, 'atr_min_pct': 0.024549616032968947, 'atr_max_pct': 0.040375852105817574, 'tp_mult': 2.5464497022665555, 'tsl_mult': 0.8502843261389119, 'strategy': 'breakout', 'time_stop': 146, 'use_sma': False, 'use_atr': False, 'use_adx': True, 'use_ema': True, 'use_spike': True, 'rsi_required': False, 'edge_k': 0.47842770681796853, 'edge_cap': 0.6510508024997863, 'bull_strategy': 'mean_reversion', 'bull_bb_std_mult': 2.822857565654134, 'bull_rsi_os': 5, 'bull_rsi_ob': 84, 'bull_adx_thresh': 18.39953373980402, 'bull_atr_min_pct': 0.021620997151369132, 'bull_atr_max_pct': 0.1343730448385337, 'bull_tp_mult': 2.1060424050746374, 'bull_tsl_mult': 0.2670706545430125, 'bull_time_stop': 159, 'bull_use_sma': True, 'bull_use_ema': True, 'bull_use_atr': True, 'bull_use_adx': True, 'bull_use_spike': True, 'bull_rsi_required': True, 'bear_strategy': 'breakout', 'bear_bb_std_mult': 3.420495239088224, 'bear_rsi_os': 30, 'bear_rsi_ob': 67, 'bear_adx_thresh': 18.545703029992872, 'bear_atr_min_pct': 0.0006051525576719598, 'bear_atr_max_pct': 0.11557402890438924, 'bear_tp_mult': 1.1066338433410483, 'bear_tsl_mult': 0.6585500875659263, 'bear_time_stop': 175, 'bear_use_sma': False, 'bear_use_ema': True, 'bear_use_atr': False, 'bear_use_adx': False, 'bear_use_spike': True, 'bear_rsi_required': True, 'sideways_strategy': 'breakout', 'sideways_bb_std_mult': 2.9101727183977992, 'sideways_rsi_os': 28, 'sideways_rsi_ob': 62, 'sideways_adx_thresh': 24.045059349479374, 'sideways_atr_min_pct': 0.0038074107890515405, 'sideways_atr_max_pct': 0.1466546170172846, 'sideways_tp_mult': 1.8136480485760451, 'sideways_tsl_mult': 0.7914083009021853, 'sideways_time_stop': 38, 'sideways_use_sma': False, 'sideways_use_ema': False, 'sideways_use_atr': True, 'sideways_use_adx': True, 'sideways_use_spike': False, 'sideways_rsi_required': True}.
[I 2025-08-31 13:20:19,025] Trial 661 finished with values: [-0.0519681542693361, 0.0513614311390639] and parameters: {'p_sma': 29, 'p_std': 20, 'p_atr': 16, 'p_adx': 13, 'rsi_period': 45, 'ema1': 12, 'ema2': 19, 'slip_atr_k': 0.034628233408236495, 'slip_spread_k': 0.37618637312669795, 'spread_hl_frac': 0.018377904963769932, 'bb_std_mult': 2.3019166511579114, 'rsi_os': 39, 'rsi_ob': 86, 'vol_spike': 0.016435620354633064, 'adx_thresh': 5.965572821272663, 'atr_min_pct': 0.023157802937575175, 'atr_max_pct': 0.048009518267544175, 'tp_mult': 2.485767280105796, 'tsl_mult': 0.8879677329014232, 'strategy': 'breakout', 'time_stop': 111, 'use_sma': False, 'use_atr': False, 'use_adx': True, 'use_ema': True, 'use_spike': True, 'rsi_required': False, 'edge_k': 0.47845114950069323, 'edge_cap': 0.6518903247331422, 'bull_strategy': 'mean_reversion', 'bull_bb_std_mult': 2.8097927818466357, 'bull_rsi_os': 5, 'bull_rsi_ob': 84, 'bull_adx_thresh': 19.52372326398736, 'bull_atr_min_pct': 0.021719399455010276, 'bull_atr_max_pct': 0.13097725521965808, 'bull_tp_mult': 2.547926918715607, 'bull_tsl_mult': 0.26480634396351677, 'bull_time_stop': 168, 'bull_use_sma': True, 'bull_use_ema': True, 'bull_use_atr': True, 'bull_use_adx': True, 'bull_use_spike': True, 'bull_rsi_required': True, 'bear_strategy': 'breakout', 'bear_bb_std_mult': 3.437825362357396, 'bear_rsi_os': 35, 'bear_rsi_ob': 94, 'bear_adx_thresh': 21.13062631999686, 'bear_atr_min_pct': 0.0010295764906522002, 'bear_atr_max_pct': 0.11671299858358294, 'bear_tp_mult': 1.163661862905631, 'bear_tsl_mult': 0.6679162895468563, 'bear_time_stop': 266, 'bear_use_sma': False, 'bear_use_ema': True, 'bear_use_atr': False, 'bear_use_adx': False, 'bear_use_spike': True, 'bear_rsi_required': True, 'sideways_strategy': 'breakout', 'sideways_bb_std_mult': 2.7445549736123716, 'sideways_rsi_os': 27, 'sideways_rsi_ob': 63, 'sideways_adx_thresh': 23.232352521695113, 'sideways_atr_min_pct': 0.0036823383886965834, 'sideways_atr_max_pct': 0.1496468636848802, 'sideways_tp_mult': 1.82814167604575, 'sideways_tsl_mult': 0.3264305787925769, 'sideways_time_stop': 19, 'sideways_use_sma': False, 'sideways_use_ema': False, 'sideways_use_atr': True, 'sideways_use_adx': True, 'sideways_use_spike': False, 'sideways_rsi_required': False}.
[I 2025-08-31 13:20:19,245] Trial 658 finished with values: [-0.03646354630013959, 0.03584826693700418] and parameters: {'p_sma': 38, 'p_std': 21, 'p_atr': 17, 'p_adx': 13, 'rsi_period': 46, 'ema1': 12, 'ema2': 20, 'slip_atr_k': 0.03506873611918847, 'slip_spread_k': 0.41118755565961895, 'spread_hl_frac': 0.01893689238726186, 'bb_std_mult': 2.3796592114461146, 'rsi_os': 39, 'rsi_ob': 85, 'vol_spike': 0.014998840651416843, 'adx_thresh': 6.597593230724904, 'atr_min_pct': 0.02347748680491724, 'atr_max_pct': 0.05343043672278844, 'tp_mult': 2.5419737969105287, 'tsl_mult': 0.8560993034120004, 'strategy': 'breakout', 'time_stop': 145, 'use_sma': False, 'use_atr': False, 'use_adx': True, 'use_ema': True, 'use_spike': True, 'rsi_required': False, 'edge_k': 0.5672490152785389, 'edge_cap': 0.6402628219151855, 'bull_strategy': 'mean_reversion', 'bull_bb_std_mult': 2.8533397687444193, 'bull_rsi_os': 5, 'bull_rsi_ob': 87, 'bull_adx_thresh': 18.349557522115997, 'bull_atr_min_pct': 0.021649509799803863, 'bull_atr_max_pct': 0.1362983053121713, 'bull_tp_mult': 2.1271087598758855, 'bull_tsl_mult': 0.27104590207027257, 'bull_time_stop': 163, 'bull_use_sma': False, 'bull_use_ema': True, 'bull_use_atr': True, 'bull_use_adx': True, 'bull_use_spike': True, 'bull_rsi_required': True, 'bear_strategy': 'breakout', 'bear_bb_std_mult': 3.4013449927183714, 'bear_rsi_os': 31, 'bear_rsi_ob': 67, 'bear_adx_thresh': 21.248004370959432, 'bear_atr_min_pct': 0.0010660827465250335, 'bear_atr_max_pct': 0.11530282394526785, 'bear_tp_mult': 1.1137694102532534, 'bear_tsl_mult': 0.680203824259087, 'bear_time_stop': 175, 'bear_use_sma': False, 'bear_use_ema': True, 'bear_use_atr': False, 'bear_use_adx': False, 'bear_use_spike': True, 'bear_rsi_required': True, 'sideways_strategy': 'mean_reversion', 'sideways_bb_std_mult': 2.7564376240888007, 'sideways_rsi_os': 28, 'sideways_rsi_ob': 62, 'sideways_adx_thresh': 24.49278097217129, 'sideways_atr_min_pct': 0.003904354555048853, 'sideways_atr_max_pct': 0.1499906052711659, 'sideways_tp_mult': 1.7179540593188944, 'sideways_tsl_mult': 0.7884405217885301, 'sideways_time_stop': 41, 'sideways_use_sma': False, 'sideways_use_ema': False, 'sideways_use_atr': True, 'sideways_use_adx': True, 'sideways_use_spike': False, 'sideways_rsi_required': True}.
[I 2025-08-31 13:20:51,180] Trial 663 finished with values: [-0.05073932611655818, 0.05018796733788169] and parameters: {'p_sma': 23, 'p_std': 20, 'p_atr': 18, 'p_adx': 13, 'rsi_period': 49, 'ema1': 8, 'ema2': 22, 'slip_atr_k': 0.04518874180882931, 'slip_spread_k': 0.41683311101778553, 'spread_hl_frac': 0.018019717271853516, 'bb_std_mult': 2.2726218108011995, 'rsi_os': 39, 'rsi_ob': 84, 'vol_spike': 0.015824534404914242, 'adx_thresh': 9.15054505503259, 'atr_min_pct': 0.02809801243352853, 'atr_max_pct': 0.04767352790610012, 'tp_mult': 2.51535125273988, 'tsl_mult': 0.8870602689765636, 'strategy': 'breakout', 'time_stop': 173, 'use_sma': True, 'use_atr': False, 'use_adx': True, 'use_ema': True, 'use_spike': True, 'rsi_required': False, 'edge_k': 0.585130482945627, 'edge_cap': 0.6769460896342708, 'bull_strategy': 'mean_reversion', 'bull_bb_std_mult': 2.9845954702749453, 'bull_rsi_os': 5, 'bull_rsi_ob': 85, 'bull_adx_thresh': 19.32548619701826, 'bull_atr_min_pct': 0.023423690477814212, 'bull_atr_max_pct': 0.13782692774721989, 'bull_tp_mult': 2.0001318976479343, 'bull_tsl_mult': 0.3076964718761432, 'bull_time_stop': 168, 'bull_use_sma': True, 'bull_use_ema': True, 'bull_use_atr': True, 'bull_use_adx': True, 'bull_use_spike': True, 'bull_rsi_required': True, 'bear_strategy': 'mean_reversion', 'bear_bb_std_mult': 3.4015083105273822, 'bear_rsi_os': 53, 'bear_rsi_ob': 58, 'bear_adx_thresh': 21.078117835924402, 'bear_atr_min_pct': 0.0010681049153554569, 'bear_atr_max_pct': 0.12722328152450854, 'bear_tp_mult': 1.168393829423492, 'bear_tsl_mult': 0.6706684927943364, 'bear_time_stop': 43, 'bear_use_sma': False, 'bear_use_ema': False, 'bear_use_atr': False, 'bear_use_adx': False, 'bear_use_spike': True, 'bear_rsi_required': False, 'sideways_strategy': 'breakout', 'sideways_bb_std_mult': 2.981078961305151, 'sideways_rsi_os': 28, 'sideways_rsi_ob': 63, 'sideways_adx_thresh': 24.411364042299514, 'sideways_atr_min_pct': 0.003528393578924125, 'sideways_atr_max_pct': 0.14172610496913532, 'sideways_tp_mult': 1.815151799539638, 'sideways_tsl_mult': 0.8879873204418358, 'sideways_time_stop': 45, 'sideways_use_sma': False, 'sideways_use_ema': False, 'sideways_use_atr': True, 'sideways_use_adx': True, 'sideways_use_spike': False, 'sideways_rsi_required': False}.
[I 2025-08-31 13:20:51,321] Trial 662 finished with values: [-1000000000.0, 1000000000.0] and parameters: {'p_sma': 35, 'p_std': 19, 'p_atr': 18, 'p_adx': 13, 'rsi_period': 49, 'ema1': 8, 'ema2': 19, 'slip_atr_k': 0.040753666439538136, 'slip_spread_k': 0.41680856866920307, 'spread_hl_frac': 0.018433703444256235, 'bb_std_mult': 2.270322845002259, 'rsi_os': 39, 'rsi_ob': 85, 'vol_spike': 0.00028561268681666016, 'adx_thresh': 9.271298434188267, 'atr_min_pct': 0.028719941598868856, 'atr_max_pct': 0.04893014384996709, 'tp_mult': 2.4789631849469034, 'tsl_mult': 0.7356945619352256, 'strategy': 'breakout', 'time_stop': 177, 'use_sma': True, 'use_atr': False, 'use_adx': True, 'use_ema': True, 'use_spike': True, 'rsi_required': False, 'edge_k': 0.5323933344318676, 'edge_cap': 0.6837904460995478, 'bull_strategy': 'mean_reversion', 'bull_bb_std_mult': 2.936240606329323, 'bull_rsi_os': 5, 'bull_rsi_ob': 85, 'bull_adx_thresh': 19.263379634197037, 'bull_atr_min_pct': 0.02221140384681084, 'bull_atr_max_pct': 0.13046954194525626, 'bull_tp_mult': 2.55359315316528, 'bull_tsl_mult': 0.32478971537950474, 'bull_time_stop': 166, 'bull_use_sma': True, 'bull_use_ema': True, 'bull_use_atr': True, 'bull_use_adx': True, 'bull_use_spike': True, 'bull_rsi_required': True, 'bear_strategy': 'mean_reversion', 'bear_bb_std_mult': 3.523890109951913, 'bear_rsi_os': 44, 'bear_rsi_ob': 94, 'bear_adx_thresh': 21.345180814063706, 'bear_atr_min_pct': 0.0012495041686475233, 'bear_atr_max_pct': 0.12622832383139726, 'bear_tp_mult': 1.1956102870861292, 'bear_tsl_mult': 0.6973925865065943, 'bear_time_stop': 189, 'bear_use_sma': False, 'bear_use_ema': False, 'bear_use_atr': False, 'bear_use_adx': False, 'bear_use_spike': True, 'bear_rsi_required': False, 'sideways_strategy': 'breakout', 'sideways_bb_std_mult': 2.98155538986188, 'sideways_rsi_os': 28, 'sideways_rsi_ob': 62, 'sideways_adx_thresh': 24.73779934762629, 'sideways_atr_min_pct': 0.0035106867130282886, 'sideways_atr_max_pct': 0.14991463527266038, 'sideways_tp_mult': 1.8090087908360095, 'sideways_tsl_mult': 0.8775278314935153, 'sideways_time_stop': 46, 'sideways_use_sma': False, 'sideways_use_ema': False, 'sideways_use_atr': True, 'sideways_use_adx': True, 'sideways_use_spike': False, 'sideways_rsi_required': False}.
[I 2025-08-31 13:20:51,430] Trial 665 finished with values: [-1000000000.0, 1000000000.0] and parameters: {'p_sma': 24, 'p_std': 20, 'p_atr': 19, 'p_adx': 14, 'rsi_period': 49, 'ema1': 8, 'ema2': 21, 'slip_atr_k': 0.04462681277955555, 'slip_spread_k': 0.4100019446746872, 'spread_hl_frac': 0.017880233672356437, 'bb_std_mult': 2.263864919398917, 'rsi_os': 37, 'rsi_ob': 90, 'vol_spike': 0.0007241527295154294, 'adx_thresh': 8.943687766598721, 'atr_min_pct': 0.028268399915903, 'atr_max_pct': 0.05817284449890242, 'tp_mult': 2.5124376206014443, 'tsl_mult': 0.6537491217839654, 'strategy': 'breakout', 'time_stop': 176, 'use_sma': True, 'use_atr': False, 'use_adx': True, 'use_ema': True, 'use_spike': True, 'rsi_required': False, 'edge_k': 0.5933044004538259, 'edge_cap': 0.6719411681920046, 'bull_strategy': 'mean_reversion', 'bull_bb_std_mult': 2.9605964596786873, 'bull_rsi_os': 6, 'bull_rsi_ob': 85, 'bull_adx_thresh': 18.974030678521693, 'bull_atr_min_pct': 0.023386837624888693, 'bull_atr_max_pct': 0.12446210246787974, 'bull_tp_mult': 2.3229677402561917, 'bull_tsl_mult': 0.32461702224689926, 'bull_time_stop': 186, 'bull_use_sma': True, 'bull_use_ema': False, 'bull_use_atr': True, 'bull_use_adx': True, 'bull_use_spike': True, 'bull_rsi_required': True, 'bear_strategy': 'mean_reversion', 'bear_bb_std_mult': 3.515261899508982, 'bear_rsi_os': 8, 'bear_rsi_ob': 69, 'bear_adx_thresh': 22.258701077409505, 'bear_atr_min_pct': 9.544947174368866e-05, 'bear_atr_max_pct': 0.12878639045003185, 'bear_tp_mult': 1.2065068316701382, 'bear_tsl_mult': 0.698556856935059, 'bear_time_stop': 188, 'bear_use_sma': False, 'bear_use_ema': False, 'bear_use_atr': False, 'bear_use_adx': False, 'bear_use_spike': True, 'bear_rsi_required': False, 'sideways_strategy': 'breakout', 'sideways_bb_std_mult': 2.8648049274695673, 'sideways_rsi_os': 15, 'sideways_rsi_ob': 65, 'sideways_adx_thresh': 24.82086051098787, 'sideways_atr_min_pct': 0.0054460550371408295, 'sideways_atr_max_pct': 0.14079228684872958, 'sideways_tp_mult': 1.768710452037123, 'sideways_tsl_mult': 0.888780381729098, 'sideways_time_stop': 48, 'sideways_use_sma': False, 'sideways_use_ema': False, 'sideways_use_atr': True, 'sideways_use_adx': True, 'sideways_use_spike': False, 'sideways_rsi_required': False}.
[I 2025-08-31 13:20:51,626] Trial 664 finished with values: [-1000000000.0, 1000000000.0] and parameters: {'p_sma': 43, 'p_std': 20, 'p_atr': 14, 'p_adx': 14, 'rsi_period': 49, 'ema1': 9, 'ema2': 21, 'slip_atr_k': 0.042055332660934024, 'slip_spread_k': 0.4110646597167345, 'spread_hl_frac': 0.018166623929280905, 'bb_std_mult': 3.319342064876299, 'rsi_os': 41, 'rsi_ob': 89, 'vol_spike': 0.016030281961451898, 'adx_thresh': 8.73420834475192, 'atr_min_pct': 0.028135969059355295, 'atr_max_pct': 0.04555221923615381, 'tp_mult': 2.5392686098074293, 'tsl_mult': 0.739421790698302, 'strategy': 'breakout', 'time_stop': 172, 'use_sma': True, 'use_atr': False, 'use_adx': True, 'use_ema': True, 'use_spike': True, 'rsi_required': False, 'edge_k': 0.5875160816446457, 'edge_cap': 0.679979606427318, 'bull_strategy': 'mean_reversion', 'bull_bb_std_mult': 2.984437748769918, 'bull_rsi_os': 6, 'bull_rsi_ob': 87, 'bull_adx_thresh': 18.829990439207755, 'bull_atr_min_pct': 0.023238794932163107, 'bull_atr_max_pct': 0.13780477683512748, 'bull_tp_mult': 2.336614695465725, 'bull_tsl_mult': 0.31575805675642005, 'bull_time_stop': 185, 'bull_use_sma': True, 'bull_use_ema': False, 'bull_use_atr': True, 'bull_use_adx': True, 'bull_use_spike': True, 'bull_rsi_required': True, 'bear_strategy': 'mean_reversion', 'bear_bb_std_mult': 3.523644154123952, 'bear_rsi_os': 28, 'bear_rsi_ob': 71, 'bear_adx_thresh': 22.114902351644556, 'bear_atr_min_pct': 0.0012305552782606735, 'bear_atr_max_pct': 0.12768778593078306, 'bear_tp_mult': 1.2948248533812217, 'bear_tsl_mult': 0.7042028944554698, 'bear_time_stop': 189, 'bear_use_sma': False, 'bear_use_ema': False, 'bear_use_atr': False, 'bear_use_adx': False, 'bear_use_spike': True, 'bear_rsi_required': False, 'sideways_strategy': 'breakout', 'sideways_bb_std_mult': 2.8569924920451344, 'sideways_rsi_os': 30, 'sideways_rsi_ob': 65, 'sideways_adx_thresh': 24.745640348601246, 'sideways_atr_min_pct': 0.005562701858643347, 'sideways_atr_max_pct': 0.14992940730429422, 'sideways_tp_mult': 1.7594676734445847, 'sideways_tsl_mult': 0.8852583616461739, 'sideways_time_stop': 47, 'sideways_use_sma': False, 'sideways_use_ema': False, 'sideways_use_atr': True, 'sideways_use_adx': True, 'sideways_use_spike': False, 'sideways_rsi_required': True}.
