[I 2025-08-31 13:01:49,222] Trial 530 finished with values: [-1000000000.0, 1000000000.0] and parameters: {'p_sma': 9, 'p_std': 40, 'p_atr': 11, 'p_adx': 9, 'rsi_period': 49, 'ema1': 26, 'ema2': 41, 'slip_atr_k': 0.2166117043400253, 'slip_spread_k': 0.370631742563594, 'spread_hl_frac': 0.017826505504359182, 'bb_std_mult': 2.1849494636364293, 'rsi_os': 41, 'rsi_ob': 50, 'vol_spike': 0.028749917328373332, 'adx_thresh': 20.784707464514323, 'atr_min_pct': 0.000667733220075325, 'atr_max_pct': 0.12544017647291206, 'tp_mult': 2.7065098095132676, 'tsl_mult': 0.0012353775486356258, 'strategy': 'breakout', 'time_stop': 142, 'use_sma': False, 'use_atr': True, 'use_adx': False, 'use_ema': True, 'use_spike': True, 'rsi_required': False, 'edge_k': 0.7005044094709056, 'edge_cap': 0.7737865809722573, 'bull_strategy': 'breakout', 'bull_bb_std_mult': 2.8731416833104073, 'bull_rsi_os': 31, 'bull_rsi_ob': 51, 'bull_adx_thresh': 17.94936787388287, 'bull_atr_min_pct': 0.008867684575545747, 'bull_atr_max_pct': 0.14141880476775165, 'bull_tp_mult': 2.90575321015592, 'bull_tsl_mult': 0.20145168824680287, 'bull_time_stop': 295, 'bull_use_sma': False, 'bull_use_ema': True, 'bull_use_atr': False, 'bull_use_adx': False, 'bull_use_spike': False, 'bull_rsi_required': False, 'bear_strategy': 'breakout', 'bear_bb_std_mult': 3.16133081623413, 'bear_rsi_os': 7, 'bear_rsi_ob': 72, 'bear_adx_thresh': 25.62435429183383, 'bear_atr_min_pct': 0.001186857662615186, 'bear_atr_max_pct': 0.08056751880912497, 'bear_tp_mult': 2.9588766525213774, 'bear_tsl_mult': 0.75025646824275, 'bear_time_stop': 67, 'bear_use_sma': False, 'bear_use_ema': True, 'bear_use_atr': True, 'bear_use_adx': True, 'bear_use_spike': True, 'bear_rsi_required': True, 'sideways_strategy': 'breakout', 'sideways_bb_std_mult': 2.771531569573987, 'sideways_rsi_os': 52, 'sideways_rsi_ob': 70, 'sideways_adx_thresh': 5.072504397079166, 'sideways_atr_min_pct': 0.025276160020116054, 'sideways_atr_max_pct': 0.10058388303027845, 'sideways_tp_mult': 1.5755700336008476, 'sideways_tsl_mult': 0.8359184961596059, 'sideways_time_stop': 222, 'sideways_use_sma': True, 'sideways_use_ema': False, 'sideways_use_atr': False, 'sideways_use_adx': False, 'sideways_use_spike': True, 'sideways_rsi_required': True}.
[I 2025-08-31 13:01:49,447] Trial 533 finished with values: [-1000000000.0, 1000000000.0] and parameters: {'p_sma': 54, 'p_std': 11, 'p_atr': 20, 'p_adx': 16, 'rsi_period': 48, 'ema1': 9, 'ema2': 16, 'slip_atr_k': 0.05104944132281397, 'slip_spread_k': 0.40401475144647564, 'spread_hl_frac': 0.016963033114734873, 'bb_std_mult': 2.249352884772835, 'rsi_os': 36, 'rsi_ob': 82, 'vol_spike': 0.028889418534945872, 'adx_thresh': 14.199125780687112, 'atr_min_pct': 0.0015517449570886326, 'atr_max_pct': 0.020951726522716492, 'tp_mult': 1.6826926431808016, 'tsl_mult': 0.700634059635203, 'strategy': 'breakout', 'time_stop': 178, 'use_sma': False, 'use_atr': True, 'use_adx': False, 'use_ema': True, 'use_spike': True, 'rsi_required': True, 'edge_k': 0.65201438447796, 'edge_cap': 0.7240246156955832, 'bull_strategy': 'breakout', 'bull_bb_std_mult': 2.7871530583986788, 'bull_rsi_os': 21, 'bull_rsi_ob': 47, 'bull_adx_thresh': 15.486574866920611, 'bull_atr_min_pct': 0.017688431905117746, 'bull_atr_max_pct': 0.1407575185110988, 'bull_tp_mult': 1.2680003626974066, 'bull_tsl_mult': 0.24288083743425998, 'bull_time_stop': 295, 'bull_use_sma': True, 'bull_use_ema': True, 'bull_use_atr': False, 'bull_use_adx': False, 'bull_use_spike': False, 'bull_rsi_required': False, 'bear_strategy': 'mean_reversion', 'bear_bb_std_mult': 2.8991050368152314, 'bear_rsi_os': 30, 'bear_rsi_ob': 72, 'bear_adx_thresh': 25.303739520833467, 'bear_atr_min_pct': 0.0020101564360483926, 'bear_atr_max_pct': 0.06554528779459777, 'bear_tp_mult': 2.938036544407046, 'bear_tsl_mult': 0.8680872861821085, 'bear_time_stop': 64, 'bear_use_sma': True, 'bear_use_ema': True, 'bear_use_atr': False, 'bear_use_adx': False, 'bear_use_spike': True, 'bear_rsi_required': True, 'sideways_strategy': 'breakout', 'sideways_bb_std_mult': 0.9736108542519568, 'sideways_rsi_os': 29, 'sideways_rsi_ob': 65, 'sideways_adx_thresh': 25.510297874605108, 'sideways_atr_min_pct': 0.003113856522384493, 'sideways_atr_max_pct': 0.10092589434948228, 'sideways_tp_mult': 1.6517201527276422, 'sideways_tsl_mult': 0.8289242383490603, 'sideways_time_stop': 55, 'sideways_use_sma': True, 'sideways_use_ema': False, 'sideways_use_atr': True, 'sideways_use_adx': False, 'sideways_use_spike': True, 'sideways_rsi_required': True}.
[I 2025-08-31 13:01:49,584] Trial 532 finished with values: [-0.023791214724893317, 0.0236758181437514] and parameters: {'p_sma': 54, 'p_std': 11, 'p_atr': 20, 'p_adx': 30, 'rsi_period': 7, 'ema1': 19, 'ema2': 14, 'slip_atr_k': 0.05339578286144533, 'slip_spread_k': 0.40457315679205136, 'spread_hl_frac': 0.0416372134594129, 'bb_std_mult': 2.254511988756702, 'rsi_os': 37, 'rsi_ob': 80, 'vol_spike': 0.21142245654206668, 'adx_thresh': 28.537039029495645, 'atr_min_pct': 0.016796699114109297, 'atr_max_pct': 0.021511238937666405, 'tp_mult': 2.720838095661204, 'tsl_mult': 0.1907869794977401, 'strategy': 'breakout', 'time_stop': 16, 'use_sma': False, 'use_atr': True, 'use_adx': False, 'use_ema': True, 'use_spike': True, 'rsi_required': False, 'edge_k': 0.703326479962058, 'edge_cap': 0.7452013119728799, 'bull_strategy': 'breakout', 'bull_bb_std_mult': 2.8468642193369744, 'bull_rsi_os': 33, 'bull_rsi_ob': 51, 'bull_adx_thresh': 21.23229954232869, 'bull_atr_min_pct': 0.017821310752418804, 'bull_atr_max_pct': 0.13998436642598355, 'bull_tp_mult': 2.2573180553603804, 'bull_tsl_mult': 0.3788260573764224, 'bull_time_stop': 295, 'bull_use_sma': False, 'bull_use_ema': True, 'bull_use_atr': False, 'bull_use_adx': False, 'bull_use_spike': False, 'bull_rsi_required': False, 'bear_strategy': 'breakout', 'bear_bb_std_mult': 2.912894225506978, 'bear_rsi_os': 15, 'bear_rsi_ob': 76, 'bear_adx_thresh': 22.221396431858683, 'bear_atr_min_pct': 0.004488480617766378, 'bear_atr_max_pct': 0.11801820107123988, 'bear_tp_mult': 2.9614967575032085, 'bear_tsl_mult': 0.7456058651563339, 'bear_time_stop': 213, 'bear_use_sma': False, 'bear_use_ema': True, 'bear_use_atr': True, 'bear_use_adx': True, 'bear_use_spike': True, 'bear_rsi_required': True, 'sideways_strategy': 'breakout', 'sideways_bb_std_mult': 1.783807858300839, 'sideways_rsi_os': 52, 'sideways_rsi_ob': 95, 'sideways_adx_thresh': 25.554384219836322, 'sideways_atr_min_pct': 0.0033453298350701773, 'sideways_atr_max_pct': 0.09948803196822759, 'sideways_tp_mult': 2.971893828617435, 'sideways_tsl_mult': 0.8271002814732863, 'sideways_time_stop': 95, 'sideways_use_sma': True, 'sideways_use_ema': False, 'sideways_use_atr': False, 'sideways_use_adx': False, 'sideways_use_spike': True, 'sideways_rsi_required': True}.
[I 2025-08-31 13:02:23,375] Trial 537 finished with values: [-1000000000.0, 1000000000.0] and parameters: {'p_sma': 57, 'p_std': 56, 'p_atr': 12, 'p_adx': 14, 'rsi_period': 65, 'ema1': 21, 'ema2': 14, 'slip_atr_k': 0.13735267755811228, 'slip_spread_k': 0.43530795820876045, 'spread_hl_frac': 0.01583250242572767, 'bb_std_mult': 2.3109691920450808, 'rsi_os': 51, 'rsi_ob': 78, 'vol_spike': 0.02427837021458887, 'adx_thresh': 33.53282764481605, 'atr_min_pct': 0.001902894350702755, 'atr_max_pct': 0.1201209139386487, 'tp_mult': 2.822320817213333, 'tsl_mult': 0.033591022592219924, 'strategy': 'breakout', 'time_stop': 161, 'use_sma': False, 'use_atr': True, 'use_adx': False, 'use_ema': True, 'use_spike': False, 'rsi_required': True, 'edge_k': 0.5453406101249332, 'edge_cap': 0.7257510404928925, 'bull_strategy': 'mean_reversion', 'bull_bb_std_mult': 2.7398624730007386, 'bull_rsi_os': 51, 'bull_rsi_ob': 52, 'bull_adx_thresh': 20.40664661560967, 'bull_atr_min_pct': 0.02049689123519713, 'bull_atr_max_pct': 0.1463745041945081, 'bull_tp_mult': 1.9642776770277093, 'bull_tsl_mult': 0.1531248021902998, 'bull_time_stop': 246, 'bull_use_sma': True, 'bull_use_ema': True, 'bull_use_atr': True, 'bull_use_adx': True, 'bull_use_spike': True, 'bull_rsi_required': True, 'bear_strategy': 'mean_reversion', 'bear_bb_std_mult': 3.05025317703674, 'bear_rsi_os': 27, 'bear_rsi_ob': 70, 'bear_adx_thresh': 13.774804101358864, 'bear_atr_min_pct': 0.003767880886852308, 'bear_atr_max_pct': 0.01314760133166891, 'bear_tp_mult': 1.8567323018600137, 'bear_tsl_mult': 0.7719850258723763, 'bear_time_stop': 201, 'bear_use_sma': True, 'bear_use_ema': False, 'bear_use_atr': False, 'bear_use_adx': False, 'bear_use_spike': False, 'bear_rsi_required': True, 'sideways_strategy': 'mean_reversion', 'sideways_bb_std_mult': 0.7091094372903921, 'sideways_rsi_os': 17, 'sideways_rsi_ob': 74, 'sideways_adx_thresh': 26.966866739804285, 'sideways_atr_min_pct': 0.012651179757517218, 'sideways_atr_max_pct': 0.13298448721506376, 'sideways_tp_mult': 2.1303359144962997, 'sideways_tsl_mult': 0.895095478354603, 'sideways_time_stop': 198, 'sideways_use_sma': False, 'sideways_use_ema': False, 'sideways_use_atr': True, 'sideways_use_adx': True, 'sideways_use_spike': False, 'sideways_rsi_required': True}.
[I 2025-08-31 13:02:23,641] Trial 535 finished with values: [-1000000000.0, 1000000000.0] and parameters: {'p_sma': 57, 'p_std': 10, 'p_atr': 12, 'p_adx': 14, 'rsi_period': 31, 'ema1': 19, 'ema2': 14, 'slip_atr_k': 0.052876993605668936, 'slip_spread_k': 0.42709757938932696, 'spread_hl_frac': 0.01059138975143862, 'bb_std_mult': 2.2842885062174125, 'rsi_os': 36, 'rsi_ob': 67, 'vol_spike': 0.2986116179573808, 'adx_thresh': 33.287716164560265, 'atr_min_pct': 0.021244983717357696, 'atr_max_pct': 0.11926687742666311, 'tp_mult': 2.742063880842363, 'tsl_mult': 0.17814759528747548, 'strategy': 'breakout', 'time_stop': 168, 'use_sma': False, 'use_atr': True, 'use_adx': False, 'use_ema': True, 'use_spike': False, 'rsi_required': True, 'edge_k': 0.6371427021890967, 'edge_cap': 0.7198921795706634, 'bull_strategy': 'mean_reversion', 'bull_bb_std_mult': 2.8024487387501473, 'bull_rsi_os': 35, 'bull_rsi_ob': 47, 'bull_adx_thresh': 21.171006211382263, 'bull_atr_min_pct': 0.020729043462556915, 'bull_atr_max_pct': 0.1472931508690098, 'bull_tp_mult': 1.9591292519305719, 'bull_tsl_mult': 0.13369706231625444, 'bull_time_stop': 300, 'bull_use_sma': True, 'bull_use_ema': True, 'bull_use_atr': True, 'bull_use_adx': True, 'bull_use_spike': False, 'bull_rsi_required': False, 'bear_strategy': 'mean_reversion', 'bear_bb_std_mult': 2.921986005879673, 'bear_rsi_os': 39, 'bear_rsi_ob': 70, 'bear_adx_thresh': 26.81358774854287, 'bear_atr_min_pct': 0.020873839787585162, 'bear_atr_max_pct': 0.05238220337424365, 'bear_tp_mult': 2.36003352208517, 'bear_tsl_mult': 0.7686627797246817, 'bear_time_stop': 201, 'bear_use_sma': True, 'bear_use_ema': True, 'bear_use_atr': False, 'bear_use_adx': False, 'bear_use_spike': True, 'bear_rsi_required': True, 'sideways_strategy': 'mean_reversion', 'sideways_bb_std_mult': 2.5351299486513192, 'sideways_rsi_os': 29, 'sideways_rsi_ob': 65, 'sideways_adx_thresh': 25.670446096350545, 'sideways_atr_min_pct': 0.0031744690555149105, 'sideways_atr_max_pct': 0.13311308055818374, 'sideways_tp_mult': 1.51067615176127, 'sideways_tsl_mult': 0.8926965470579028, 'sideways_time_stop': 56, 'sideways_use_sma': False, 'sideways_use_ema': False, 'sideways_use_atr': True, 'sideways_use_adx': False, 'sideways_use_spike': False, 'sideways_rsi_required': True}.
[I 2025-08-31 13:02:24,299] Trial 536 finished with values: [-1000000000.0, 1000000000.0] and parameters: {'p_sma': 20, 'p_std': 10, 'p_atr': 21, 'p_adx': 11, 'rsi_period': 54, 'ema1': 19, 'ema2': 14, 'slip_atr_k': 0.04741777960798987, 'slip_spread_k': 0.4361524834553779, 'spread_hl_frac': 0.015905533549195116, 'bb_std_mult': 0.7729675810416066, 'rsi_os': 37, 'rsi_ob': 67, 'vol_spike': 0.05412337823917565, 'adx_thresh': 18.96035283615686, 'atr_min_pct': 0.0034094726094249885, 'atr_max_pct': 0.11929464118227673, 'tp_mult': 1.317063322664361, 'tsl_mult': 0.0274548210437335, 'strategy': 'breakout', 'time_stop': 177, 'use_sma': False, 'use_atr': True, 'use_adx': False, 'use_ema': True, 'use_spike': False, 'rsi_required': True, 'edge_k': 0.5430611803927841, 'edge_cap': 0.7220178497892047, 'bull_strategy': 'mean_reversion', 'bull_bb_std_mult': 2.7196530794825913, 'bull_rsi_os': 8, 'bull_rsi_ob': 51, 'bull_adx_thresh': 20.882826293767508, 'bull_atr_min_pct': 0.01934351595205961, 'bull_atr_max_pct': 0.14705643828310094, 'bull_tp_mult': 1.9662978079187277, 'bull_tsl_mult': 0.37290272756891174, 'bull_time_stop': 275, 'bull_use_sma': True, 'bull_use_ema': True, 'bull_use_atr': True, 'bull_use_adx': True, 'bull_use_spike': True, 'bull_rsi_required': True, 'bear_strategy': 'mean_reversion', 'bear_bb_std_mult': 3.047939806771701, 'bear_rsi_os': 15, 'bear_rsi_ob': 70, 'bear_adx_thresh': 24.26749205338313, 'bear_atr_min_pct': 0.02112415892355269, 'bear_atr_max_pct': 0.014260286347537662, 'bear_tp_mult': 2.8232510983192673, 'bear_tsl_mult': 0.5937904231965712, 'bear_time_stop': 215, 'bear_use_sma': True, 'bear_use_ema': True, 'bear_use_atr': True, 'bear_use_adx': True, 'bear_use_spike': False, 'bear_rsi_required': True, 'sideways_strategy': 'mean_reversion', 'sideways_bb_std_mult': 2.6447316632338795, 'sideways_rsi_os': 27, 'sideways_rsi_ob': 68, 'sideways_adx_thresh': 26.93223722200773, 'sideways_atr_min_pct': 0.0032016856196094316, 'sideways_atr_max_pct': 0.04860063478896243, 'sideways_tp_mult': 2.043696515651578, 'sideways_tsl_mult': 0.2443099181212478, 'sideways_time_stop': 129, 'sideways_use_sma': False, 'sideways_use_ema': False, 'sideways_use_atr': False, 'sideways_use_adx': True, 'sideways_use_spike': False, 'sideways_rsi_required': True}.
[I 2025-08-31 13:02:24,299] Trial 534 finished with values: [-1000000000.0, 1000000000.0] and parameters: {'p_sma': 17, 'p_std': 23, 'p_atr': 20, 'p_adx': 14, 'rsi_period': 54, 'ema1': 9, 'ema2': 14, 'slip_atr_k': 0.050330351705828294, 'slip_spread_k': 0.4320866658444141, 'spread_hl_frac': 0.016920001036239175, 'bb_std_mult': 2.284565450212453, 'rsi_os': 51, 'rsi_ob': 79, 'vol_spike': 0.19841374064701364, 'adx_thresh': 14.197654686750159, 'atr_min_pct': 0.0019531723958122684, 'atr_max_pct': 0.1253095832848513, 'tp_mult': 1.6781081702594862, 'tsl_mult': 0.685734813912381, 'strategy': 'breakout', 'time_stop': 162, 'use_sma': False, 'use_atr': True, 'use_adx': False, 'use_ema': True, 'use_spike': True, 'rsi_required': True, 'edge_k': 0.5346448043031036, 'edge_cap': 0.7246203643666356, 'bull_strategy': 'breakout', 'bull_bb_std_mult': 2.8119177786616647, 'bull_rsi_os': 8, 'bull_rsi_ob': 51, 'bull_adx_thresh': 15.674600650720317, 'bull_atr_min_pct': 0.020841223043294888, 'bull_atr_max_pct': 0.02302329778643404, 'bull_tp_mult': 2.2418915275446345, 'bull_tsl_mult': 0.13216223523395046, 'bull_time_stop': 273, 'bull_use_sma': True, 'bull_use_ema': True, 'bull_use_atr': False, 'bull_use_adx': False, 'bull_use_spike': False, 'bull_rsi_required': False, 'bear_strategy': 'mean_reversion', 'bear_bb_std_mult': 3.3394396522933145, 'bear_rsi_os': 13, 'bear_rsi_ob': 76, 'bear_adx_thresh': 6.7060554889958475, 'bear_atr_min_pct': 0.020974057704543962, 'bear_atr_max_pct': 0.051666027273765694, 'bear_tp_mult': 2.952313617342661, 'bear_tsl_mult': 0.77031332838787, 'bear_time_stop': 213, 'bear_use_sma': True, 'bear_use_ema': True, 'bear_use_atr': False, 'bear_use_adx': False, 'bear_use_spike': True, 'bear_rsi_required': True, 'sideways_strategy': 'breakout', 'sideways_bb_std_mult': 0.7156469395537446, 'sideways_rsi_os': 27, 'sideways_rsi_ob': 70, 'sideways_adx_thresh': 27.180112372764054, 'sideways_atr_min_pct': 0.013469784961719314, 'sideways_atr_max_pct': 0.13267730636930897, 'sideways_tp_mult': 1.5190769560606436, 'sideways_tsl_mult': 0.9006286505775407, 'sideways_time_stop': 95, 'sideways_use_sma': True, 'sideways_use_ema': False, 'sideways_use_atr': True, 'sideways_use_adx': False, 'sideways_use_spike': True, 'sideways_rsi_required': True}.
[I 2025-08-31 13:03:02,292] Trial 540 finished with values: [-1000000000.0, 1000000000.0] and parameters: {'p_sma': 45, 'p_std': 25, 'p_atr': 17, 'p_adx': 27, 'rsi_period': 52, 'ema1': 20, 'ema2': 34, 'slip_atr_k': 0.058119132597551956, 'slip_spread_k': 0.8922957550777468, 'spread_hl_frac': 0.01312891890495272, 'bb_std_mult': 2.446009703289647, 'rsi_os': 13, 'rsi_ob': 78, 'vol_spike': 0.03555122461813083, 'adx_thresh': 34.56834661185188, 'atr_min_pct': 0.013451039827716489, 'atr_max_pct': 0.10621307054172516, 'tp_mult': 2.1545584783182408, 'tsl_mult': 8.956110790013516e-05, 'strategy': 'breakout', 'time_stop': 127, 'use_sma': True, 'use_atr': False, 'use_adx': True, 'use_ema': True, 'use_spike': False, 'rsi_required': True, 'edge_k': 0.3865798751998345, 'edge_cap': 0.11748419793647302, 'bull_strategy': 'breakout', 'bull_bb_std_mult': 1.4365707993445649, 'bull_rsi_os': 5, 'bull_rsi_ob': 49, 'bull_adx_thresh': 16.973763861626157, 'bull_atr_min_pct': 0.01977752143003968, 'bull_atr_max_pct': 0.05634731849928059, 'bull_tp_mult': 1.2029513017439497, 'bull_tsl_mult': 0.2488403658189266, 'bull_time_stop': 285, 'bull_use_sma': True, 'bull_use_ema': False, 'bull_use_atr': False, 'bull_use_adx': True, 'bull_use_spike': False, 'bull_rsi_required': False, 'bear_strategy': 'breakout', 'bear_bb_std_mult': 3.2157090896631355, 'bear_rsi_os': 28, 'bear_rsi_ob': 71, 'bear_adx_thresh': 12.790175531254494, 'bear_atr_min_pct': 0.0053473933959864006, 'bear_atr_max_pct': 0.14749671661871072, 'bear_tp_mult': 1.428813285869969, 'bear_tsl_mult': 0.7016733318042441, 'bear_time_stop': 77, 'bear_use_sma': True, 'bear_use_ema': False, 'bear_use_atr': True, 'bear_use_adx': True, 'bear_use_spike': True, 'bear_rsi_required': False, 'sideways_strategy': 'breakout', 'sideways_bb_std_mult': 2.7271565536208944, 'sideways_rsi_os': 14, 'sideways_rsi_ob': 58, 'sideways_adx_thresh': 15.929824493485977, 'sideways_atr_min_pct': 0.0074784751069207275, 'sideways_atr_max_pct': 0.014776477620378342, 'sideways_tp_mult': 1.696161497889194, 'sideways_tsl_mult': 0.020044325718735823, 'sideways_time_stop': 213, 'sideways_use_sma': True, 'sideways_use_ema': True, 'sideways_use_atr': False, 'sideways_use_adx': False, 'sideways_use_spike': False, 'sideways_rsi_required': False}.
[I 2025-08-31 13:03:02,325] Trial 538 finished with values: [-0.10142167205252006, 0.10088102437371488] and parameters: {'p_sma': 51, 'p_std': 24, 'p_atr': 7, 'p_adx': 14, 'rsi_period': 54, 'ema1': 10, 'ema2': 17, 'slip_atr_k': 0.04708370634973388, 'slip_spread_k': 0.9540942220714272, 'spread_hl_frac': 0.010320311130946794, 'bb_std_mult': 3.5136745623650607, 'rsi_os': 13, 'rsi_ob': 67, 'vol_spike': 0.037291439692767894, 'adx_thresh': 7.906923102775977, 'atr_min_pct': 0.013694885874637592, 'atr_max_pct': 0.1301021673657992, 'tp_mult': 2.004615301266454, 'tsl_mult': 0.9867953334409714, 'strategy': 'breakout', 'time_stop': 166, 'use_sma': False, 'use_atr': True, 'use_adx': False, 'use_ema': True, 'use_spike': False, 'rsi_required': True, 'edge_k': 0.6321688058521946, 'edge_cap': 0.38043154320666844, 'bull_strategy': 'breakout', 'bull_bb_std_mult': 2.7320895286750986, 'bull_rsi_os': 8, 'bull_rsi_ob': 91, 'bull_adx_thresh': 16.321706731729208, 'bull_atr_min_pct': 0.02421170020861621, 'bull_atr_max_pct': 0.14695771145861544, 'bull_tp_mult': 2.1237309271814198, 'bull_tsl_mult': 0.8583398435891518, 'bull_time_stop': 274, 'bull_use_sma': True, 'bull_use_ema': False, 'bull_use_atr': True, 'bull_use_adx': True, 'bull_use_spike': False, 'bull_rsi_required': False, 'bear_strategy': 'breakout', 'bear_bb_std_mult': 3.063766157386921, 'bear_rsi_os': 40, 'bear_rsi_ob': 58, 'bear_adx_thresh': 13.962084723946925, 'bear_atr_min_pct': 0.0016586284448032403, 'bear_atr_max_pct': 0.11371767068338555, 'bear_tp_mult': 1.182421119605946, 'bear_tsl_mult': 0.6106353584812823, 'bear_time_stop': 186, 'bear_use_sma': True, 'bear_use_ema': True, 'bear_use_atr': True, 'bear_use_adx': True, 'bear_use_spike': True, 'bear_rsi_required': True, 'sideways_strategy': 'breakout', 'sideways_bb_std_mult': 2.530423846005706, 'sideways_rsi_os': 33, 'sideways_rsi_ob': 68, 'sideways_adx_thresh': 27.26117885220087, 'sideways_atr_min_pct': 0.01354466445649806, 'sideways_atr_max_pct': 0.04819501356612012, 'sideways_tp_mult': 1.4997808480668111, 'sideways_tsl_mult': 0.8922778689927272, 'sideways_time_stop': 71, 'sideways_use_sma': True, 'sideways_use_ema': True, 'sideways_use_atr': False, 'sideways_use_adx': False, 'sideways_use_spike': False, 'sideways_rsi_required': False}.
