[I 2025-08-31 13:03:02,331] Trial 541 finished with values: [-1000000000.0, 1000000000.0] and parameters: {'p_sma': 5, 'p_std': 24, 'p_atr': 9, 'p_adx': 23, 'rsi_period': 34, 'ema1': 20, 'ema2': 33, 'slip_atr_k': 0.057386720610855584, 'slip_spread_k': 0.8883883763777745, 'spread_hl_frac': 0.03625381986972804, 'bb_std_mult': 3.505570081140485, 'rsi_os': 32, 'rsi_ob': 53, 'vol_spike': 0.017636546942881075, 'adx_thresh': 20.02937714393498, 'atr_min_pct': 0.0011473514856702983, 'atr_max_pct': 0.12940658962159832, 'tp_mult': 1.991285646202764, 'tsl_mult': 0.015879665332138318, 'strategy': 'breakout', 'time_stop': 127, 'use_sma': True, 'use_atr': False, 'use_adx': True, 'use_ema': True, 'use_spike': False, 'rsi_required': True, 'edge_k': 1.83821358562506, 'edge_cap': 0.38151486391903294, 'bull_strategy': 'breakout', 'bull_bb_std_mult': 2.8772119477328033, 'bull_rsi_os': 29, 'bull_rsi_ob': 49, 'bull_adx_thresh': 30.040555012136807, 'bull_atr_min_pct': 0.020002754058840493, 'bull_atr_max_pct': 0.1451608905050159, 'bull_tp_mult': 1.2010280997633551, 'bull_tsl_mult': 0.4568731156457495, 'bull_time_stop': 285, 'bull_use_sma': True, 'bull_use_ema': False, 'bull_use_atr': False, 'bull_use_adx': True, 'bull_use_spike': False, 'bull_rsi_required': False, 'bear_strategy': 'breakout', 'bear_bb_std_mult': 3.218988078533944, 'bear_rsi_os': 28, 'bear_rsi_ob': 71, 'bear_adx_thresh': 12.68680452626507, 'bear_atr_min_pct': 0.002407423248102721, 'bear_atr_max_pct': 0.13139854741928284, 'bear_tp_mult': 2.9007296321214335, 'bear_tsl_mult': 0.9600545531216182, 'bear_time_stop': 192, 'bear_use_sma': True, 'bear_use_ema': False, 'bear_use_atr': True, 'bear_use_adx': True, 'bear_use_spike': True, 'bear_rsi_required': False, 'sideways_strategy': 'breakout', 'sideways_bb_std_mult': 2.6936357406650453, 'sideways_rsi_os': 32, 'sideways_rsi_ob': 67, 'sideways_adx_thresh': 26.422299117432857, 'sideways_atr_min_pct': 0.0025157816181621802, 'sideways_atr_max_pct': 0.12089985725295878, 'sideways_tp_mult': 1.668755965376354, 'sideways_tsl_mult': 0.02774794008738457, 'sideways_time_stop': 214, 'sideways_use_sma': True, 'sideways_use_ema': True, 'sideways_use_atr': False, 'sideways_use_adx': False, 'sideways_use_spike': False, 'sideways_rsi_required': False}.
[I 2025-08-31 13:03:02,424] Trial 539 finished with values: [-0.03100569106585549, 0.03085006005521506] and parameters: {'p_sma': 13, 'p_std': 27, 'p_atr': 7, 'p_adx': 15, 'rsi_period': 34, 'ema1': 20, 'ema2': 56, 'slip_atr_k': 0.04616215005142478, 'slip_spread_k': 0.3865481485362624, 'spread_hl_frac': 0.03738209192059903, 'bb_std_mult': 2.973455306781848, 'rsi_os': 12, 'rsi_ob': 45, 'vol_spike': 0.055424684210158184, 'adx_thresh': 18.995145885374434, 'atr_min_pct': 0.0036471351937398078, 'atr_max_pct': 0.12463698142997326, 'tp_mult': 1.555463603510513, 'tsl_mult': 0.01927457150264486, 'strategy': 'breakout', 'time_stop': 177, 'use_sma': False, 'use_atr': True, 'use_adx': False, 'use_ema': True, 'use_spike': False, 'rsi_required': True, 'edge_k': 0.7459266568464361, 'edge_cap': 0.7425099610660002, 'bull_strategy': 'breakout', 'bull_bb_std_mult': 2.7211964740059105, 'bull_rsi_os': 29, 'bull_rsi_ob': 51, 'bull_adx_thresh': 29.741087863325852, 'bull_atr_min_pct': 0.01939354528821231, 'bull_atr_max_pct': 0.14995899722680345, 'bull_tp_mult': 1.2072145043083964, 'bull_tsl_mult': 0.8651279178408208, 'bull_time_stop': 273, 'bull_use_sma': True, 'bull_use_ema': False, 'bull_use_atr': False, 'bull_use_adx': True, 'bull_use_spike': False, 'bull_rsi_required': False, 'bear_strategy': 'breakout', 'bear_bb_std_mult': 3.3398676779412173, 'bear_rsi_os': 33, 'bear_rsi_ob': 58, 'bear_adx_thresh': 12.744934722990623, 'bear_atr_min_pct': 0.0019149330759190373, 'bear_atr_max_pct': 0.13201546255549412, 'bear_tp_mult': 2.824147771375999, 'bear_tsl_mult': 0.7069757884738626, 'bear_time_stop': 187, 'bear_use_sma': True, 'bear_use_ema': True, 'bear_use_atr': True, 'bear_use_adx': True, 'bear_use_spike': True, 'bear_rsi_required': True, 'sideways_strategy': 'breakout', 'sideways_bb_std_mult': 2.656857627998543, 'sideways_rsi_os': 27, 'sideways_rsi_ob': 77, 'sideways_adx_thresh': 27.14506330000886, 'sideways_atr_min_pct': 0.0058275175856902575, 'sideways_atr_max_pct': 0.028654121742905866, 'sideways_tp_mult': 1.7048011000344665, 'sideways_tsl_mult': 0.8602524534533006, 'sideways_time_stop': 238, 'sideways_use_sma': True, 'sideways_use_ema': True, 'sideways_use_atr': False, 'sideways_use_adx': False, 'sideways_use_spike': False, 'sideways_rsi_required': False}.
[I 2025-08-31 13:03:38,732] Trial 543 finished with values: [-1000000000.0, 1000000000.0] and parameters: {'p_sma': 26, 'p_std': 39, 'p_atr': 12, 'p_adx': 15, 'rsi_period': 47, 'ema1': 21, 'ema2': 28, 'slip_atr_k': 0.0669444615292562, 'slip_spread_k': 0.2150432166374559, 'spread_hl_frac': 0.020021662671057122, 'bb_std_mult': 2.348562001866602, 'rsi_os': 39, 'rsi_ob': 79, 'vol_spike': 0.023189910444935593, 'adx_thresh': 21.184394477189038, 'atr_min_pct': 0.0007263017573544946, 'atr_max_pct': 0.10072947057339798, 'tp_mult': 2.68590336413979, 'tsl_mult': 0.05187302740996007, 'strategy': 'breakout', 'time_stop': 183, 'use_sma': False, 'use_atr': True, 'use_adx': False, 'use_ema': True, 'use_spike': False, 'rsi_required': False, 'edge_k': 0.7822071774362742, 'edge_cap': 0.7739215779992907, 'bull_strategy': 'breakout', 'bull_bb_std_mult': 0.5038461876489593, 'bull_rsi_os': 7, 'bull_rsi_ob': 48, 'bull_adx_thresh': 18.86205196453418, 'bull_atr_min_pct': 0.018789033996739514, 'bull_atr_max_pct': 0.14319698406477444, 'bull_tp_mult': 1.275709564467057, 'bull_tsl_mult': 0.211926413434278, 'bull_time_stop': 38, 'bull_use_sma': False, 'bull_use_ema': True, 'bull_use_atr': False, 'bull_use_adx': True, 'bull_use_spike': True, 'bull_rsi_required': True, 'bear_strategy': 'breakout', 'bear_bb_std_mult': 1.2199496523452953, 'bear_rsi_os': 19, 'bear_rsi_ob': 74, 'bear_adx_thresh': 14.714806928917767, 'bear_atr_min_pct': 0.014113673512151708, 'bear_atr_max_pct': 0.14271022398050406, 'bear_tp_mult': 2.0343130341730316, 'bear_tsl_mult': 0.8447986228043041, 'bear_time_stop': 86, 'bear_use_sma': False, 'bear_use_ema': True, 'bear_use_atr': True, 'bear_use_adx': True, 'bear_use_spike': False, 'bear_rsi_required': True, 'sideways_strategy': 'breakout', 'sideways_bb_std_mult': 2.4858480357388824, 'sideways_rsi_os': 9, 'sideways_rsi_ob': 67, 'sideways_adx_thresh': 24.795857704474724, 'sideways_atr_min_pct': 0.014630542787406779, 'sideways_atr_max_pct': 0.12901154333190423, 'sideways_tp_mult': 1.6133216451556442, 'sideways_tsl_mult': 0.09089910680153823, 'sideways_time_stop': 199, 'sideways_use_sma': True, 'sideways_use_ema': False, 'sideways_use_atr': False, 'sideways_use_adx': True, 'sideways_use_spike': False, 'sideways_rsi_required': True}.
[I 2025-08-31 13:03:38,831] Trial 542 finished with values: [-1000000000.0, 1000000000.0] and parameters: {'p_sma': 52, 'p_std': 27, 'p_atr': 12, 'p_adx': 16, 'rsi_period': 47, 'ema1': 18, 'ema2': 28, 'slip_atr_k': 0.18076135085274958, 'slip_spread_k': 0.4959611510222649, 'spread_hl_frac': 0.020576596583701257, 'bb_std_mult': 2.354640166815439, 'rsi_os': 26, 'rsi_ob': 83, 'vol_spike': 0.025128492391566313, 'adx_thresh': 21.430258773944182, 'atr_min_pct': 0.017342734094886608, 'atr_max_pct': 0.042962225787631196, 'tp_mult': 2.671528867354507, 'tsl_mult': 0.04158551942955014, 'strategy': 'breakout', 'time_stop': 186, 'use_sma': False, 'use_atr': True, 'use_adx': False, 'use_ema': True, 'use_spike': False, 'rsi_required': False, 'edge_k': 0.7407694029227334, 'edge_cap': 0.7554861879669776, 'bull_strategy': 'breakout', 'bull_bb_std_mult': 0.5515895531147279, 'bull_rsi_os': 43, 'bull_rsi_ob': 48, 'bull_adx_thresh': 18.754900982727722, 'bull_atr_min_pct': 0.018953447697183733, 'bull_atr_max_pct': 0.1285191212354946, 'bull_tp_mult': 1.280523168365392, 'bull_tsl_mult': 0.21075316683207496, 'bull_time_stop': 40, 'bull_use_sma': False, 'bull_use_ema': True, 'bull_use_atr': False, 'bull_use_adx': True, 'bull_use_spike': True, 'bull_rsi_required': True, 'bear_strategy': 'breakout', 'bear_bb_std_mult': 2.387435738117378, 'bear_rsi_os': 33, 'bear_rsi_ob': 73, 'bear_adx_thresh': 14.682848137624818, 'bear_atr_min_pct': 0.003134840540109279, 'bear_atr_max_pct': 0.13890987798456322, 'bear_tp_mult': 1.510649934471676, 'bear_tsl_mult': 0.724795616371247, 'bear_time_stop': 89, 'bear_use_sma': False, 'bear_use_ema': True, 'bear_use_atr': True, 'bear_use_adx': True, 'bear_use_spike': False, 'bear_rsi_required': True, 'sideways_strategy': 'breakout', 'sideways_bb_std_mult': 3.2359933889047667, 'sideways_rsi_os': 31, 'sideways_rsi_ob': 67, 'sideways_adx_thresh': 19.92119465942842, 'sideways_atr_min_pct': 0.026434027973217488, 'sideways_atr_max_pct': 0.12971682158933825, 'sideways_tp_mult': 1.6240442258562777, 'sideways_tsl_mult': 0.9276686941472009, 'sideways_time_stop': 82, 'sideways_use_sma': True, 'sideways_use_ema': False, 'sideways_use_atr': False, 'sideways_use_adx': True, 'sideways_use_spike': False, 'sideways_rsi_required': True}.
[I 2025-08-31 13:03:39,230] Trial 545 finished with values: [-1000000000.0, 1000000000.0] and parameters: {'p_sma': 37, 'p_std': 45, 'p_atr': 12, 'p_adx': 15, 'rsi_period': 46, 'ema1': 21, 'ema2': 16, 'slip_atr_k': 0.15414816959701186, 'slip_spread_k': 0.21788142530857557, 'spread_hl_frac': 0.01914261477960246, 'bb_std_mult': 2.338045359002202, 'rsi_os': 39, 'rsi_ob': 79, 'vol_spike': 0.021126083336639314, 'adx_thresh': 20.03332338721621, 'atr_min_pct': 0.023474372173525743, 'atr_max_pct': 0.062735363107184, 'tp_mult': 2.6960435195638586, 'tsl_mult': 0.5775309871683113, 'strategy': 'breakout', 'time_stop': 192, 'use_sma': False, 'use_atr': True, 'use_adx': False, 'use_ema': True, 'use_spike': False, 'rsi_required': False, 'edge_k': 1.292843019748151, 'edge_cap': 0.7829316930524823, 'bull_strategy': 'breakout', 'bull_bb_std_mult': 1.9725763447826334, 'bull_rsi_os': 7, 'bull_rsi_ob': 48, 'bull_adx_thresh': 18.902255683836277, 'bull_atr_min_pct': 0.019080399550328458, 'bull_atr_max_pct': 0.14422115855340867, 'bull_tp_mult': 1.2690190142195397, 'bull_tsl_mult': 0.214843845363691, 'bull_time_stop': 288, 'bull_use_sma': False, 'bull_use_ema': True, 'bull_use_atr': False, 'bull_use_adx': True, 'bull_use_spike': True, 'bull_rsi_required': True, 'bear_strategy': 'breakout', 'bear_bb_std_mult': 2.9773181025161275, 'bear_rsi_os': 29, 'bear_rsi_ob': 73, 'bear_adx_thresh': 14.540610835342514, 'bear_atr_min_pct': 0.0035255217253733, 'bear_atr_max_pct': 0.14243580478171372, 'bear_tp_mult': 2.8933773796789333, 'bear_tsl_mult': 0.28647948667553524, 'bear_time_stop': 53, 'bear_use_sma': False, 'bear_use_ema': True, 'bear_use_atr': True, 'bear_use_adx': True, 'bear_use_spike': False, 'bear_rsi_required': True, 'sideways_strategy': 'breakout', 'sideways_bb_std_mult': 1.6586051035843954, 'sideways_rsi_os': 9, 'sideways_rsi_ob': 90, 'sideways_adx_thresh': 7.246016061106593, 'sideways_atr_min_pct': 0.020576987512690544, 'sideways_atr_max_pct': 0.12959751429758962, 'sideways_tp_mult': 1.606364296741102, 'sideways_tsl_mult': 0.9286050030278621, 'sideways_time_stop': 6, 'sideways_use_sma': True, 'sideways_use_ema': False, 'sideways_use_atr': False, 'sideways_use_adx': True, 'sideways_use_spike': False, 'sideways_rsi_required': True}.
[I 2025-08-31 13:03:39,315] Trial 544 finished with values: [-1000000000.0, 1000000000.0] and parameters: {'p_sma': 23, 'p_std': 22, 'p_atr': 12, 'p_adx': 15, 'rsi_period': 47, 'ema1': 21, 'ema2': 16, 'slip_atr_k': 0.11218495627241065, 'slip_spread_k': 0.47075405641032053, 'spread_hl_frac': 0.019204888332779675, 'bb_std_mult': 2.414119851140731, 'rsi_os': 39, 'rsi_ob': 55, 'vol_spike': 0.022267002484672484, 'adx_thresh': 27.202228686374717, 'atr_min_pct': 0.0006817574882986478, 'atr_max_pct': 0.12361232707171353, 'tp_mult': 2.6767985648032764, 'tsl_mult': 0.05064642893672741, 'strategy': 'breakout', 'time_stop': 190, 'use_sma': False, 'use_atr': True, 'use_adx': False, 'use_ema': True, 'use_spike': False, 'rsi_required': False, 'edge_k': 1.2872034382152462, 'edge_cap': 0.7640999866409475, 'bull_strategy': 'breakout', 'bull_bb_std_mult': 2.621358316080279, 'bull_rsi_os': 7, 'bull_rsi_ob': 89, 'bull_adx_thresh': 34.87824671884731, 'bull_atr_min_pct': 0.018702129990331533, 'bull_atr_max_pct': 0.14345735131537407, 'bull_tp_mult': 1.2783156157591724, 'bull_tsl_mult': 0.21150035733156541, 'bull_time_stop': 288, 'bull_use_sma': False, 'bull_use_ema': True, 'bull_use_atr': False, 'bull_use_adx': True, 'bull_use_spike': True, 'bull_rsi_required': True, 'bear_strategy': 'breakout', 'bear_bb_std_mult': 3.105731809155755, 'bear_rsi_os': 32, 'bear_rsi_ob': 73, 'bear_adx_thresh': 14.603967092926737, 'bear_atr_min_pct': 0.003441104855191555, 'bear_atr_max_pct': 0.13909677235646156, 'bear_tp_mult': 2.8937968949876556, 'bear_tsl_mult': 0.8402214059442688, 'bear_time_stop': 90, 'bear_use_sma': False, 'bear_use_ema': True, 'bear_use_atr': True, 'bear_use_adx': True, 'bear_use_spike': False, 'bear_rsi_required': True, 'sideways_strategy': 'breakout', 'sideways_bb_std_mult': 1.2867323169274916, 'sideways_rsi_os': 9, 'sideways_rsi_ob': 68, 'sideways_adx_thresh': 24.693525893784788, 'sideways_atr_min_pct': 0.020892603417432744, 'sideways_atr_max_pct': 0.12955109704558795, 'sideways_tp_mult': 1.605578280632348, 'sideways_tsl_mult': 0.08719134308272053, 'sideways_time_stop': 198, 'sideways_use_sma': True, 'sideways_use_ema': False, 'sideways_use_atr': False, 'sideways_use_adx': True, 'sideways_use_spike': False, 'sideways_rsi_required': True}.
[I 2025-08-31 13:04:14,015] Trial 548 finished with values: [-0.03980132928499136, 0.039646108611670915] and parameters: {'p_sma': 22, 'p_std': 22, 'p_atr': 19, 'p_adx': 16, 'rsi_period': 17, 'ema1': 8, 'ema2': 43, 'slip_atr_k': 0.12865454941404336, 'slip_spread_k': 0.4708856951576143, 'spread_hl_frac': 0.017262448107541444, 'bb_std_mult': 2.4393421361971046, 'rsi_os': 9, 'rsi_ob': 55, 'vol_spike': 0.033036080988018315, 'adx_thresh': 13.218370084134577, 'atr_min_pct': 0.0013745394044282367, 'atr_max_pct': 0.05407411618344007, 'tp_mult': 2.7970804927734974, 'tsl_mult': 0.3592450347450168, 'strategy': 'breakout', 'time_stop': 149, 'use_sma': True, 'use_atr': False, 'use_adx': True, 'use_ema': True, 'use_spike': True, 'rsi_required': True, 'edge_k': 0.6598177236959438, 'edge_cap': 0.695028662436521, 'bull_strategy': 'mean_reversion', 'bull_bb_std_mult': 2.6347435863342845, 'bull_rsi_os': 27, 'bull_rsi_ob': 50, 'bull_adx_thresh': 22.015023359847937, 'bull_atr_min_pct': 0.004370378309746044, 'bull_atr_max_pct': 0.02989756222389628, 'bull_tp_mult': 1.3251775214413712, 'bull_tsl_mult': 0.17659853762916444, 'bull_time_stop': 135, 'bull_use_sma': True, 'bull_use_ema': True, 'bull_use_atr': False, 'bull_use_adx': True, 'bull_use_spike': False, 'bull_rsi_required': False, 'bear_strategy': 'breakout', 'bear_bb_std_mult': 0.8025155221902192, 'bear_rsi_os': 26, 'bear_rsi_ob': 94, 'bear_adx_thresh': 9.679970493644458, 'bear_atr_min_pct': 0.0024860511552506513, 'bear_atr_max_pct': 0.1276056600885357, 'bear_tp_mult': 2.2016351742162295, 'bear_tsl_mult': 0.7874212877195118, 'bear_time_stop': 174, 'bear_use_sma': True, 'bear_use_ema': False, 'bear_use_atr': False, 'bear_use_adx': False, 'bear_use_spike': True, 'bear_rsi_required': False, 'sideways_strategy': 'mean_reversion', 'sideways_bb_std_mult': 1.2969739702693288, 'sideways_rsi_os': 31, 'sideways_rsi_ob': 65, 'sideways_adx_thresh': 6.165978555049289, 'sideways_atr_min_pct': 0.01928497095926509, 'sideways_atr_max_pct': 0.12703741273800334, 'sideways_tp_mult': 2.5289590284512755, 'sideways_tsl_mult': 0.8668661968559717, 'sideways_time_stop': 203, 'sideways_use_sma': False, 'sideways_use_ema': False, 'sideways_use_atr': True, 'sideways_use_adx': False, 'sideways_use_spike': False, 'sideways_rsi_required': True}.
[I 2025-08-31 13:04:14,144] Trial 547 finished with values: [-1000000000.0, 1000000000.0] and parameters: {'p_sma': 22, 'p_std': 23, 'p_atr': 14, 'p_adx': 20, 'rsi_period': 52, 'ema1': 22, 'ema2': 16, 'slip_atr_k': 0.05762838765497035, 'slip_spread_k': 0.38892214814885323, 'spread_hl_frac': 0.019390541765345885, 'bb_std_mult': 2.429792533432001, 'rsi_os': 40, 'rsi_ob': 77, 'vol_spike': 0.00994688874043868, 'adx_thresh': 19.99027789407716, 'atr_min_pct': 0.015256990313454594, 'atr_max_pct': 0.12405125232949046, 'tp_mult': 2.6379829792562033, 'tsl_mult': 0.08227642696921882, 'strategy': 'breakout', 'time_stop': 170, 'use_sma': False, 'use_atr': False, 'use_adx': False, 'use_ema': True, 'use_spike': False, 'rsi_required': True, 'edge_k': 0.6615270828434024, 'edge_cap': 0.7822219446487952, 'bull_strategy': 'mean_reversion', 'bull_bb_std_mult': 2.610869929576103, 'bull_rsi_os': 6, 'bull_rsi_ob': 50, 'bull_adx_thresh': 17.882026285188495, 'bull_atr_min_pct': 0.02019557992146312, 'bull_atr_max_pct': 0.029866033958715926, 'bull_tp_mult': 2.037830425723071, 'bull_tsl_mult': 0.1789240439044703, 'bull_time_stop': 288, 'bull_use_sma': True, 'bull_use_ema': True, 'bull_use_atr': False, 'bull_use_adx': True, 'bull_use_spike': False, 'bull_rsi_required': False, 'bear_strategy': 'breakout', 'bear_bb_std_mult': 0.7496772043269857, 'bear_rsi_os': 26, 'bear_rsi_ob': 52, 'bear_adx_thresh': 13.724439699616504, 'bear_atr_min_pct': 0.0012906412929285104, 'bear_atr_max_pct': 0.12715177491471352, 'bear_tp_mult': 2.895937206909637, 'bear_tsl_mult': 0.8016155178930694, 'bear_time_stop': 199, 'bear_use_sma': True, 'bear_use_ema': True, 'bear_use_atr': True, 'bear_use_adx': True, 'bear_use_spike': True, 'bear_rsi_required': True, 'sideways_strategy': 'mean_reversion', 'sideways_bb_std_mult': 2.59992363680363, 'sideways_rsi_os': 33, 'sideways_rsi_ob': 64, 'sideways_adx_thresh': 26.494647179840598, 'sideways_atr_min_pct': 0.006647002899705094, 'sideways_atr_max_pct': 0.12707217041212052, 'sideways_tp_mult': 1.7876899056285058, 'sideways_tsl_mult': 0.8674197965565764, 'sideways_time_stop': 28, 'sideways_use_sma': False, 'sideways_use_ema': False, 'sideways_use_atr': False, 'sideways_use_adx': False, 'sideways_use_spike': False, 'sideways_rsi_required': True}.
[I 2025-08-31 13:04:14,339] Trial 546 finished with values: [-1000000000.0, 1000000000.0] and parameters: {'p_sma': 22, 'p_std': 23, 'p_atr': 19, 'p_adx': 20, 'rsi_period': 52, 'ema1': 22, 'ema2': 16, 'slip_atr_k': 0.05768692865246815, 'slip_spread_k': 0.3889428742091937, 'spread_hl_frac': 0.01920644350695079, 'bb_std_mult': 2.428951527415398, 'rsi_os': 6, 'rsi_ob': 77, 'vol_spike': 0.16209259116073282, 'adx_thresh': 27.25474286995107, 'atr_min_pct': 0.015463100314551503, 'atr_max_pct': 0.0484720102884377, 'tp_mult': 2.7792988910665786, 'tsl_mult': 0.06978372356278087, 'strategy': 'breakout', 'time_stop': 170, 'use_sma': False, 'use_atr': False, 'use_adx': False, 'use_ema': True, 'use_spike': False, 'rsi_required': True, 'edge_k': 0.07953906402841315, 'edge_cap': 0.7063877365746093, 'bull_strategy': 'mean_reversion', 'bull_bb_std_mult': 2.660211268309706, 'bull_rsi_os': 25, 'bull_rsi_ob': 53, 'bull_adx_thresh': 26.766969009626973, 'bull_atr_min_pct': 0.010607816852793642, 'bull_atr_max_pct': 0.1447367799587285, 'bull_tp_mult': 1.3367309612006766, 'bull_tsl_mult': 0.7731697371400217, 'bull_time_stop': 253, 'bull_use_sma': True, 'bull_use_ema': True, 'bull_use_atr': False, 'bull_use_adx': True, 'bull_use_spike': False, 'bull_rsi_required': False, 'bear_strategy': 'breakout', 'bear_bb_std_mult': 3.027847411157445, 'bear_rsi_os': 26, 'bear_rsi_ob': 93, 'bear_adx_thresh': 17.86120295135651, 'bear_atr_min_pct': 0.0012966047220588483, 'bear_atr_max_pct': 0.12798401480783134, 'bear_tp_mult': 1.618619217326486, 'bear_tsl_mult': 0.7920076100147689, 'bear_time_stop': 198, 'bear_use_sma': True, 'bear_use_ema': True, 'bear_use_atr': True, 'bear_use_adx': True, 'bear_use_spike': True, 'bear_rsi_required': True, 'sideways_strategy': 'mean_reversion', 'sideways_bb_std_mult': 2.604200377147754, 'sideways_rsi_os': 33, 'sideways_rsi_ob': 64, 'sideways_adx_thresh': 26.28337963011169, 'sideways_atr_min_pct': 0.020539644638132678, 'sideways_atr_max_pct': 0.1370176135119127, 'sideways_tp_mult': 1.5913801336169189, 'sideways_tsl_mult': 0.8594770265990185, 'sideways_time_stop': 204, 'sideways_use_sma': False, 'sideways_use_ema': False, 'sideways_use_atr': False, 'sideways_use_adx': False, 'sideways_use_spike': False, 'sideways_rsi_required': True}.
