[I 2025-08-31 12:13:16,848] Trial 163 finished with values: [-0.09665436318691978, 0.09649527059347018] and parameters: {'p_sma': 28, 'p_std': 41, 'p_atr': 10, 'p_adx': 12, 'rsi_period': 71, 'ema1': 26, 'ema2': 39, 'slip_atr_k': 0.1353140091039753, 'slip_spread_k': 0.7763317240957719, 'spread_hl_frac': 0.001724695390242302, 'bb_std_mult': 0.860282274887896, 'rsi_os': 19, 'rsi_ob': 55, 'vol_spike': 0.2539906401220706, 'adx_thresh': 9.03179438940195, 'atr_min_pct': 0.0148641690108325, 'atr_max_pct': 0.06485848760650902, 'tp_mult': 2.6167819932819496, 'tsl_mult': 0.4722375100819399, 'strategy': 'mean_reversion', 'time_stop': 45, 'use_sma': True, 'use_atr': False, 'use_adx': True, 'use_ema': False, 'use_spike': True, 'rsi_required': False, 'edge_k': 0.8062650190829872, 'edge_cap': 0.8911279828134193, 'bull_strategy': 'mean_reversion', 'bull_bb_std_mult': 3.3443922115236946, 'bull_rsi_os': 39, 'bull_rsi_ob': 61, 'bull_adx_thresh': 10.384082228630842, 'bull_atr_min_pct': 0.0003623424997666255, 'bull_atr_max_pct': 0.023645546686358723, 'bull_tp_mult': 2.1479154872170403, 'bull_tsl_mult': 0.34046760992558456, 'bull_time_stop': 190, 'bull_use_sma': False, 'bull_use_ema': True, 'bull_use_atr': False, 'bull_use_adx': True, 'bull_use_spike': False, 'bull_rsi_required': True, 'bear_strategy': 'mean_reversion', 'bear_bb_std_mult': 2.615938796998822, 'bear_rsi_os': 26, 'bear_rsi_ob': 62, 'bear_adx_thresh': 19.824610734504446, 'bear_atr_min_pct': 0.02674780971036864, 'bear_atr_max_pct': 0.09482918952880001, 'bear_tp_mult': 1.8971460516576966, 'bear_tsl_mult': 0.875676034649625, 'bear_time_stop': 64, 'bear_use_sma': True, 'bear_use_ema': False, 'bear_use_atr': False, 'bear_use_adx': True, 'bear_use_spike': True, 'bear_rsi_required': False, 'sideways_strategy': 'breakout', 'sideways_bb_std_mult': 2.2851633634666304, 'sideways_rsi_os': 46, 'sideways_rsi_ob': 53, 'sideways_adx_thresh': 8.257025126926209, 'sideways_atr_min_pct': 0.0016608212513837142, 'sideways_atr_max_pct': 0.06341551713161403, 'sideways_tp_mult': 1.5560775115444874, 'sideways_tsl_mult': 0.991319106048976, 'sideways_time_stop': 111, 'sideways_use_sma': False, 'sideways_use_ema': False, 'sideways_use_atr': False, 'sideways_use_adx': False, 'sideways_use_spike': False, 'sideways_rsi_required': True}.
[I 2025-08-31 12:13:17,359] Trial 162 finished with values: [-1000000000.0, 1000000000.0] and parameters: {'p_sma': 27, 'p_std': 18, 'p_atr': 10, 'p_adx': 15, 'rsi_period': 34, 'ema1': 26, 'ema2': 39, 'slip_atr_k': 0.10503772730445693, 'slip_spread_k': 0.7799926545280097, 'spread_hl_frac': 0.039516490038749505, 'bb_std_mult': 2.106664185211261, 'rsi_os': 47, 'rsi_ob': 51, 'vol_spike': 0.16829638349683468, 'adx_thresh': 20.462822592364823, 'atr_min_pct': 0.010072758712091805, 'atr_max_pct': 0.06542403115320865, 'tp_mult': 2.523828132289694, 'tsl_mult': 0.010485539724875648, 'strategy': 'mean_reversion', 'time_stop': 280, 'use_sma': True, 'use_atr': False, 'use_adx': True, 'use_ema': False, 'use_spike': False, 'rsi_required': False, 'edge_k': 0.7513140394843721, 'edge_cap': 0.6646710992433168, 'bull_strategy': 'mean_reversion', 'bull_bb_std_mult': 3.411784178951163, 'bull_rsi_os': 15, 'bull_rsi_ob': 60, 'bull_adx_thresh': 6.709974147457103, 'bull_atr_min_pct': 0.029291013886123103, 'bull_atr_max_pct': 0.028301494269435384, 'bull_tp_mult': 2.0543428569369757, 'bull_tsl_mult': 0.25541574815901763, 'bull_time_stop': 72, 'bull_use_sma': False, 'bull_use_ema': True, 'bull_use_atr': False, 'bull_use_adx': True, 'bull_use_spike': False, 'bull_rsi_required': True, 'bear_strategy': 'mean_reversion', 'bear_bb_std_mult': 1.544800341408566, 'bear_rsi_os': 25, 'bear_rsi_ob': 61, 'bear_adx_thresh': 32.18078006630284, 'bear_atr_min_pct': 0.027019710633760154, 'bear_atr_max_pct': 0.09508155572259662, 'bear_tp_mult': 1.483227588337444, 'bear_tsl_mult': 0.8871579691032309, 'bear_time_stop': 270, 'bear_use_sma': True, 'bear_use_ema': False, 'bear_use_atr': False, 'bear_use_adx': True, 'bear_use_spike': True, 'bear_rsi_required': False, 'sideways_strategy': 'mean_reversion', 'sideways_bb_std_mult': 2.098237227235155, 'sideways_rsi_os': 39, 'sideways_rsi_ob': 76, 'sideways_adx_thresh': 28.842195990782887, 'sideways_atr_min_pct': 0.001800645375820022, 'sideways_atr_max_pct': 0.08126839062107517, 'sideways_tp_mult': 2.6902285937516885, 'sideways_tsl_mult': 0.9723730546936284, 'sideways_time_stop': 201, 'sideways_use_sma': False, 'sideways_use_ema': True, 'sideways_use_atr': False, 'sideways_use_adx': False, 'sideways_use_spike': False, 'sideways_rsi_required': True}.
[I 2025-08-31 12:14:01,208] Trial 164 finished with values: [-1000000000.0, 1000000000.0] and parameters: {'p_sma': 30, 'p_std': 13, 'p_atr': 10, 'p_adx': 21, 'rsi_period': 71, 'ema1': 24, 'ema2': 39, 'slip_atr_k': 0.10472865947657406, 'slip_spread_k': 0.04555264817215983, 'spread_hl_frac': 0.025277791469280247, 'bb_std_mult': 1.0656060510361054, 'rsi_os': 41, 'rsi_ob': 61, 'vol_spike': 0.25371655492530204, 'adx_thresh': 22.74194222352386, 'atr_min_pct': 0.0030064644002011365, 'atr_max_pct': 0.07519008443729074, 'tp_mult': 1.4912496649686053, 'tsl_mult': 0.4684198556006844, 'strategy': 'mean_reversion', 'time_stop': 39, 'use_sma': True, 'use_atr': False, 'use_adx': True, 'use_ema': False, 'use_spike': True, 'rsi_required': False, 'edge_k': 1.0557921038891271, 'edge_cap': 0.24703560557551005, 'bull_strategy': 'mean_reversion', 'bull_bb_std_mult': 0.8780294676186244, 'bull_rsi_os': 12, 'bull_rsi_ob': 59, 'bull_adx_thresh': 8.60940563109812, 'bull_atr_min_pct': 0.021710457980415904, 'bull_atr_max_pct': 0.024082931434791052, 'bull_tp_mult': 2.1388816505296813, 'bull_tsl_mult': 0.30348101916634707, 'bull_time_stop': 184, 'bull_use_sma': False, 'bull_use_ema': True, 'bull_use_atr': False, 'bull_use_adx': True, 'bull_use_spike': False, 'bull_rsi_required': True, 'bear_strategy': 'mean_reversion', 'bear_bb_std_mult': 3.3334067994936842, 'bear_rsi_os': 24, 'bear_rsi_ob': 95, 'bear_adx_thresh': 33.59531549680424, 'bear_atr_min_pct': 0.026704867208293546, 'bear_atr_max_pct': 0.04137960663532309, 'bear_tp_mult': 2.27534647716782, 'bear_tsl_mult': 0.14029324866996506, 'bear_time_stop': 288, 'bear_use_sma': True, 'bear_use_ema': False, 'bear_use_atr': False, 'bear_use_adx': True, 'bear_use_spike': True, 'bear_rsi_required': False, 'sideways_strategy': 'breakout', 'sideways_bb_std_mult': 2.080606643821717, 'sideways_rsi_os': 22, 'sideways_rsi_ob': 46, 'sideways_adx_thresh': 28.602690521326814, 'sideways_atr_min_pct': 0.029932811051002484, 'sideways_atr_max_pct': 0.06457956989508473, 'sideways_tp_mult': 2.997872643788661, 'sideways_tsl_mult': 0.9355360260934444, 'sideways_time_stop': 176, 'sideways_use_sma': False, 'sideways_use_ema': True, 'sideways_use_atr': False, 'sideways_use_adx': False, 'sideways_use_spike': False, 'sideways_rsi_required': True}.
[I 2025-08-31 12:14:01,478] Trial 166 finished with values: [-1000000000.0, 1000000000.0] and parameters: {'p_sma': 30, 'p_std': 12, 'p_atr': 11, 'p_adx': 14, 'rsi_period': 12, 'ema1': 6, 'ema2': 53, 'slip_atr_k': 0.10451880655486069, 'slip_spread_k': 0.9036548506277198, 'spread_hl_frac': 0.017882170848308936, 'bb_std_mult': 1.0734476688883297, 'rsi_os': 41, 'rsi_ob': 51, 'vol_spike': 0.24181135092955305, 'adx_thresh': 29.12429060083829, 'atr_min_pct': 0.01017522996614978, 'atr_max_pct': 0.0754520411126975, 'tp_mult': 2.4255035713357054, 'tsl_mult': 0.42196728895419816, 'strategy': 'mean_reversion', 'time_stop': 94, 'use_sma': True, 'use_atr': False, 'use_adx': True, 'use_ema': False, 'use_spike': True, 'rsi_required': False, 'edge_k': 0.35013775044298134, 'edge_cap': 0.2939543007145777, 'bull_strategy': 'mean_reversion', 'bull_bb_std_mult': 1.0834926381515746, 'bull_rsi_os': 15, 'bull_rsi_ob': 83, 'bull_adx_thresh': 8.750532322546087, 'bull_atr_min_pct': 0.021109875132221952, 'bull_atr_max_pct': 0.04485008452826847, 'bull_tp_mult': 1.8724458807015416, 'bull_tsl_mult': 0.12388740838861045, 'bull_time_stop': 74, 'bull_use_sma': False, 'bull_use_ema': True, 'bull_use_atr': True, 'bull_use_adx': True, 'bull_use_spike': False, 'bull_rsi_required': True, 'bear_strategy': 'mean_reversion', 'bear_bb_std_mult': 3.039137764935014, 'bear_rsi_os': 24, 'bear_rsi_ob': 94, 'bear_adx_thresh': 18.767788901029245, 'bear_atr_min_pct': 0.028831620099211547, 'bear_atr_max_pct': 0.09506549235964205, 'bear_tp_mult': 1.6415924556688923, 'bear_tsl_mult': 0.7919136945935152, 'bear_time_stop': 207, 'bear_use_sma': True, 'bear_use_ema': False, 'bear_use_atr': False, 'bear_use_adx': True, 'bear_use_spike': True, 'bear_rsi_required': False, 'sideways_strategy': 'breakout', 'sideways_bb_std_mult': 1.7189210063690858, 'sideways_rsi_os': 34, 'sideways_rsi_ob': 56, 'sideways_adx_thresh': 7.938818107210566, 'sideways_atr_min_pct': 0.014628386494160496, 'sideways_atr_max_pct': 0.042417245982479486, 'sideways_tp_mult': 2.4772834293666692, 'sideways_tsl_mult': 0.47031918553708074, 'sideways_time_stop': 189, 'sideways_use_sma': False, 'sideways_use_ema': True, 'sideways_use_atr': False, 'sideways_use_adx': False, 'sideways_use_spike': False, 'sideways_rsi_required': True}.
[I 2025-08-31 12:14:01,864] Trial 167 finished with values: [-1000000000.0, 1000000000.0] and parameters: {'p_sma': 13, 'p_std': 21, 'p_atr': 11, 'p_adx': 14, 'rsi_period': 72, 'ema1': 24, 'ema2': 36, 'slip_atr_k': 0.10296890729289282, 'slip_spread_k': 0.08703959467391409, 'spread_hl_frac': 0.03547408458023667, 'bb_std_mult': 1.7111734952830826, 'rsi_os': 13, 'rsi_ob': 61, 'vol_spike': 0.23962962269426286, 'adx_thresh': 21.926167018223726, 'atr_min_pct': 0.016182655586934325, 'atr_max_pct': 0.07755028198476346, 'tp_mult': 2.4829159222168187, 'tsl_mult': 0.42658501523769304, 'strategy': 'mean_reversion', 'time_stop': 96, 'use_sma': True, 'use_atr': False, 'use_adx': True, 'use_ema': False, 'use_spike': True, 'rsi_required': False, 'edge_k': 1.2418431940030323, 'edge_cap': 0.8620696914558583, 'bull_strategy': 'mean_reversion', 'bull_bb_std_mult': 3.2818198765669173, 'bull_rsi_os': 14, 'bull_rsi_ob': 78, 'bull_adx_thresh': 8.680173074790954, 'bull_atr_min_pct': 0.021545192951112506, 'bull_atr_max_pct': 0.04542205123789184, 'bull_tp_mult': 2.7492438704043933, 'bull_tsl_mult': 0.1354944614414389, 'bull_time_stop': 101, 'bull_use_sma': False, 'bull_use_ema': False, 'bull_use_atr': True, 'bull_use_adx': True, 'bull_use_spike': False, 'bull_rsi_required': True, 'bear_strategy': 'mean_reversion', 'bear_bb_std_mult': 1.622690319628097, 'bear_rsi_os': 24, 'bear_rsi_ob': 74, 'bear_adx_thresh': 33.45902970204385, 'bear_atr_min_pct': 0.028953129109978205, 'bear_atr_max_pct': 0.041303409616117163, 'bear_tp_mult': 2.2637957042419607, 'bear_tsl_mult': 0.3443833228006026, 'bear_time_stop': 292, 'bear_use_sma': True, 'bear_use_ema': False, 'bear_use_atr': False, 'bear_use_adx': True, 'bear_use_spike': True, 'bear_rsi_required': False, 'sideways_strategy': 'breakout', 'sideways_bb_std_mult': 2.4755181365563033, 'sideways_rsi_os': 21, 'sideways_rsi_ob': 57, 'sideways_adx_thresh': 22.945788515773895, 'sideways_atr_min_pct': 0.003073557979080312, 'sideways_atr_max_pct': 0.040070694324608316, 'sideways_tp_mult': 2.4741723599864907, 'sideways_tsl_mult': 0.470932899394481, 'sideways_time_stop': 199, 'sideways_use_sma': False, 'sideways_use_ema': True, 'sideways_use_atr': False, 'sideways_use_adx': False, 'sideways_use_spike': False, 'sideways_rsi_required': True}.
[I 2025-08-31 12:14:02,215] Trial 165 finished with values: [-0.03105555349155953, 0.031078549216958407] and parameters: {'p_sma': 40, 'p_std': 12, 'p_atr': 11, 'p_adx': 14, 'rsi_period': 71, 'ema1': 24, 'ema2': 39, 'slip_atr_k': 0.07004363446292278, 'slip_spread_k': 0.16534393743215398, 'spread_hl_frac': 0.018319057003977443, 'bb_std_mult': 1.0416417641138445, 'rsi_os': 41, 'rsi_ob': 60, 'vol_spike': 0.2571304998629079, 'adx_thresh': 15.532156881194588, 'atr_min_pct': 0.0030458377303371406, 'atr_max_pct': 0.07698147903873573, 'tp_mult': 2.610513935174099, 'tsl_mult': 0.47638092542089816, 'strategy': 'mean_reversion', 'time_stop': 178, 'use_sma': True, 'use_atr': False, 'use_adx': True, 'use_ema': False, 'use_spike': True, 'rsi_required': False, 'edge_k': 1.0861659698000563, 'edge_cap': 0.8737610936708167, 'bull_strategy': 'mean_reversion', 'bull_bb_std_mult': 3.344366932615708, 'bull_rsi_os': 14, 'bull_rsi_ob': 83, 'bull_adx_thresh': 8.683902542084343, 'bull_atr_min_pct': 0.021270432049896374, 'bull_atr_max_pct': 0.025857750165715586, 'bull_tp_mult': 2.157398459315159, 'bull_tsl_mult': 0.30146958293468545, 'bull_time_stop': 73, 'bull_use_sma': False, 'bull_use_ema': True, 'bull_use_atr': False, 'bull_use_adx': True, 'bull_use_spike': False, 'bull_rsi_required': True, 'bear_strategy': 'mean_reversion', 'bear_bb_std_mult': 0.5868780489073961, 'bear_rsi_os': 12, 'bear_rsi_ob': 94, 'bear_adx_thresh': 33.668978032345954, 'bear_atr_min_pct': 0.02234574804987388, 'bear_atr_max_pct': 0.04104746485396425, 'bear_tp_mult': 1.904306969181059, 'bear_tsl_mult': 0.335818805786619, 'bear_time_stop': 291, 'bear_use_sma': True, 'bear_use_ema': False, 'bear_use_atr': False, 'bear_use_adx': True, 'bear_use_spike': True, 'bear_rsi_required': False, 'sideways_strategy': 'breakout', 'sideways_bb_std_mult': 1.6950560568640065, 'sideways_rsi_os': 39, 'sideways_rsi_ob': 76, 'sideways_adx_thresh': 23.419943351493753, 'sideways_atr_min_pct': 0.0018834662657603036, 'sideways_atr_max_pct': 0.042430928725523405, 'sideways_tp_mult': 2.680342298398518, 'sideways_tsl_mult': 0.34014127551604684, 'sideways_time_stop': 110, 'sideways_use_sma': False, 'sideways_use_ema': True, 'sideways_use_atr': False, 'sideways_use_adx': False, 'sideways_use_spike': False, 'sideways_rsi_required': True}.
[I 2025-08-31 12:14:02,714] Trial 168 finished with values: [-1000000000.0, 1000000000.0] and parameters: {'p_sma': 6, 'p_std': 21, 'p_atr': 12, 'p_adx': 28, 'rsi_period': 80, 'ema1': 29, 'ema2': 36, 'slip_atr_k': 0.09263228701089193, 'slip_spread_k': 0.16491611710146653, 'spread_hl_frac': 0.02267176137712725, 'bb_std_mult': 1.7118966789465067, 'rsi_os': 53, 'rsi_ob': 60, 'vol_spike': 0.013889120866746929, 'adx_thresh': 21.893647005988694, 'atr_min_pct': 0.00578723572282229, 'atr_max_pct': 0.031917928142633036, 'tp_mult': 1.0996241598806609, 'tsl_mult': 0.840990517952485, 'strategy': 'mean_reversion', 'time_stop': 168, 'use_sma': True, 'use_atr': False, 'use_adx': True, 'use_ema': False, 'use_spike': True, 'rsi_required': True, 'edge_k': 1.2232465972988047, 'edge_cap': 0.29256069752744734, 'bull_strategy': 'breakout', 'bull_bb_std_mult': 3.230009927715739, 'bull_rsi_os': 44, 'bull_rsi_ob': 78, 'bull_adx_thresh': 10.15957550243973, 'bull_atr_min_pct': 0.011783763603860582, 'bull_atr_max_pct': 0.07239711760244565, 'bull_tp_mult': 2.763082112946127, 'bull_tsl_mult': 0.3591647483666067, 'bull_time_stop': 48, 'bull_use_sma': False, 'bull_use_ema': False, 'bull_use_atr': True, 'bull_use_adx': True, 'bull_use_spike': False, 'bull_rsi_required': True, 'bear_strategy': 'mean_reversion', 'bear_bb_std_mult': 1.6216013160643463, 'bear_rsi_os': 19, 'bear_rsi_ob': 73, 'bear_adx_thresh': 34.08522270062839, 'bear_atr_min_pct': 0.008043440116507707, 'bear_atr_max_pct': 0.106605711469355, 'bear_tp_mult': 1.5802023312214117, 'bear_tsl_mult': 0.7325764551880809, 'bear_time_stop': 294, 'bear_use_sma': False, 'bear_use_ema': True, 'bear_use_atr': False, 'bear_use_adx': False, 'bear_use_spike': True, 'bear_rsi_required': False, 'sideways_strategy': 'breakout', 'sideways_bb_std_mult': 2.5275909972747006, 'sideways_rsi_os': 36, 'sideways_rsi_ob': 46, 'sideways_adx_thresh': 10.052518081069971, 'sideways_atr_min_pct': 0.025438423218091866, 'sideways_atr_max_pct': 0.07621673602344926, 'sideways_tp_mult': 2.363869130027721, 'sideways_tsl_mult': 0.1295802298158012, 'sideways_time_stop': 292, 'sideways_use_sma': False, 'sideways_use_ema': True, 'sideways_use_atr': True, 'sideways_use_adx': False, 'sideways_use_spike': False, 'sideways_rsi_required': True}.
[I 2025-08-31 12:14:39,228] Trial 169 finished with values: [-1000000000.0, 1000000000.0] and parameters: {'p_sma': 36, 'p_std': 55, 'p_atr': 11, 'p_adx': 18, 'rsi_period': 80, 'ema1': 6, 'ema2': 28, 'slip_atr_k': 0.004142807029679854, 'slip_spread_k': 0.23934889477256927, 'spread_hl_frac': 0.036533002863772784, 'bb_std_mult': 3.2928769870177064, 'rsi_os': 43, 'rsi_ob': 72, 'vol_spike': 0.01892830875692536, 'adx_thresh': 21.949530835657004, 'atr_min_pct': 0.02785765582386198, 'atr_max_pct': 0.03187847242991304, 'tp_mult': 2.4766678866454463, 'tsl_mult': 0.45538286306907805, 'strategy': 'mean_reversion', 'time_stop': 218, 'use_sma': True, 'use_atr': False, 'use_adx': True, 'use_ema': False, 'use_spike': True, 'rsi_required': True, 'edge_k': 1.9597988334988727, 'edge_cap': 0.8650095006879264, 'bull_strategy': 'breakout', 'bull_bb_std_mult': 3.2908999611169536, 'bull_rsi_os': 35, 'bull_rsi_ob': 79, 'bull_adx_thresh': 9.904228363120971, 'bull_atr_min_pct': 0.023471882347110173, 'bull_atr_max_pct': 0.038657071668080294, 'bull_tp_mult': 2.748784317299245, 'bull_tsl_mult': 0.6863355446126967, 'bull_time_stop': 13, 'bull_use_sma': False, 'bull_use_ema': False, 'bull_use_atr': True, 'bull_use_adx': True, 'bull_use_spike': False, 'bull_rsi_required': True, 'bear_strategy': 'mean_reversion', 'bear_bb_std_mult': 1.6262358516353184, 'bear_rsi_os': 19, 'bear_rsi_ob': 61, 'bear_adx_thresh': 34.00375668970729, 'bear_atr_min_pct': 0.02830673280125098, 'bear_atr_max_pct': 0.027927990309600734, 'bear_tp_mult': 1.1196091007381739, 'bear_tsl_mult': 0.006745996808139421, 'bear_time_stop': 293, 'bear_use_sma': False, 'bear_use_ema': True, 'bear_use_atr': False, 'bear_use_adx': False, 'bear_use_spike': True, 'bear_rsi_required': False, 'sideways_strategy': 'breakout', 'sideways_bb_std_mult': 2.600739450360687, 'sideways_rsi_os': 36, 'sideways_rsi_ob': 59, 'sideways_adx_thresh': 10.039526598402466, 'sideways_atr_min_pct': 0.016912733615331493, 'sideways_atr_max_pct': 0.05652723757306027, 'sideways_tp_mult': 1.640795514049655, 'sideways_tsl_mult': 0.3331602113904916, 'sideways_time_stop': 285, 'sideways_use_sma': False, 'sideways_use_ema': True, 'sideways_use_atr': True, 'sideways_use_adx': False, 'sideways_use_spike': False, 'sideways_rsi_required': True}.
[I 2025-08-31 12:14:39,638] Trial 171 finished with values: [-1000000000.0, 1000000000.0] and parameters: {'p_sma': 40, 'p_std': 58, 'p_atr': 11, 'p_adx': 30, 'rsi_period': 80, 'ema1': 8, 'ema2': 20, 'slip_atr_k': 0.07115584405051849, 'slip_spread_k': 0.23776467461116613, 'spread_hl_frac': 0.027051222338080397, 'bb_std_mult': 1.0447779814462876, 'rsi_os': 35, 'rsi_ob': 59, 'vol_spike': 0.1851444646917043, 'adx_thresh': 23.77171566061997, 'atr_min_pct': 0.008111440049303548, 'atr_max_pct': 0.06999056764941514, 'tp_mult': 2.5644379663153534, 'tsl_mult': 0.8533753679719125, 'strategy': 'mean_reversion', 'time_stop': 141, 'use_sma': True, 'use_atr': False, 'use_adx': True, 'use_ema': True, 'use_spike': True, 'rsi_required': True, 'edge_k': 0.0647416205723158, 'edge_cap': 0.38333138304145753, 'bull_strategy': 'breakout', 'bull_bb_std_mult': 3.0205560797304862, 'bull_rsi_os': 35, 'bull_rsi_ob': 85, 'bull_adx_thresh': 19.77233802557495, 'bull_atr_min_pct': 0.023268076586749866, 'bull_atr_max_pct': 0.10647903947433178, 'bull_tp_mult': 2.839708967083901, 'bull_tsl_mult': 0.36251746085148945, 'bull_time_stop': 242, 'bull_use_sma': False, 'bull_use_ema': False, 'bull_use_atr': False, 'bull_use_adx': False, 'bull_use_spike': False, 'bull_rsi_required': True, 'bear_strategy': 'mean_reversion', 'bear_bb_std_mult': 1.9153877999784985, 'bear_rsi_os': 23, 'bear_rsi_ob': 52, 'bear_adx_thresh': 34.020709742120175, 'bear_atr_min_pct': 0.028198591050009516, 'bear_atr_max_pct': 0.10191812446690914, 'bear_tp_mult': 1.57313916914501, 'bear_tsl_mult': 0.8191250986521738, 'bear_time_stop': 192, 'bear_use_sma': False, 'bear_use_ema': True, 'bear_use_atr': False, 'bear_use_adx': False, 'bear_use_spike': True, 'bear_rsi_required': False, 'sideways_strategy': 'breakout', 'sideways_bb_std_mult': 1.4651721854090645, 'sideways_rsi_os': 38, 'sideways_rsi_ob': 46, 'sideways_adx_thresh': 23.905570135964403, 'sideways_atr_min_pct': 0.016899396471770866, 'sideways_atr_max_pct': 0.05696211965478113, 'sideways_tp_mult': 2.378892740738782, 'sideways_tsl_mult': 0.4995147076183801, 'sideways_time_stop': 40, 'sideways_use_sma': False, 'sideways_use_ema': True, 'sideways_use_atr': True, 'sideways_use_adx': False, 'sideways_use_spike': False, 'sideways_rsi_required': True}.
