[I 2025-08-31 12:35:30,311] Trial 334 finished with values: [-0.14012515845937723, 0.1395282317041284] and parameters: {'p_sma': 47, 'p_std': 29, 'p_atr': 13, 'p_adx': 8, 'rsi_period': 75, 'ema1': 5, 'ema2': 49, 'slip_atr_k': 0.03971814063665158, 'slip_spread_k': 0.906688029668784, 'spread_hl_frac': 0.031260679022231945, 'bb_std_mult': 1.461052322808326, 'rsi_os': 42, 'rsi_ob': 75, 'vol_spike': 0.20080911812785499, 'adx_thresh': 32.726831056398986, 'atr_min_pct': 0.01954224227382446, 'atr_max_pct': 0.02915591650414845, 'tp_mult': 2.5688154989968144, 'tsl_mult': 0.06522620636707935, 'strategy': 'mean_reversion', 'time_stop': 57, 'use_sma': False, 'use_atr': True, 'use_adx': False, 'use_ema': False, 'use_spike': False, 'rsi_required': True, 'edge_k': 1.8568918126826288, 'edge_cap': 0.8435751790027923, 'bull_strategy': 'breakout', 'bull_bb_std_mult': 2.3387191861063306, 'bull_rsi_os': 19, 'bull_rsi_ob': 79, 'bull_adx_thresh': 23.225721650583157, 'bull_atr_min_pct': 0.007020361860449796, 'bull_atr_max_pct': 0.065150100061572, 'bull_tp_mult': 1.997123779625179, 'bull_tsl_mult': 0.2700715075455449, 'bull_time_stop': 88, 'bull_use_sma': True, 'bull_use_ema': True, 'bull_use_atr': False, 'bull_use_adx': False, 'bull_use_spike': False, 'bull_rsi_required': False, 'bear_strategy': 'breakout', 'bear_bb_std_mult': 2.493231324700208, 'bear_rsi_os': 45, 'bear_rsi_ob': 52, 'bear_adx_thresh': 33.26159121651724, 'bear_atr_min_pct': 0.0015765241570480006, 'bear_atr_max_pct': 0.06736013517256512, 'bear_tp_mult': 2.1560351045725974, 'bear_tsl_mult': 0.15637290819792155, 'bear_time_stop': 238, 'bear_use_sma': True, 'bear_use_ema': True, 'bear_use_atr': True, 'bear_use_adx': True, 'bear_use_spike': True, 'bear_rsi_required': True, 'sideways_strategy': 'mean_reversion', 'sideways_bb_std_mult': 3.4580799121972774, 'sideways_rsi_os': 38, 'sideways_rsi_ob': 69, 'sideways_adx_thresh': 34.04065934096261, 'sideways_atr_min_pct': 0.0020598931445455545, 'sideways_atr_max_pct': 0.05365429408854724, 'sideways_tp_mult': 1.390474768635549, 'sideways_tsl_mult': 0.5943171842940294, 'sideways_time_stop': 292, 'sideways_use_sma': True, 'sideways_use_ema': False, 'sideways_use_atr': False, 'sideways_use_adx': False, 'sideways_use_spike': True, 'sideways_rsi_required': False}.
[I 2025-08-31 12:35:30,663] Trial 336 finished with values: [-1000000000.0, 1000000000.0] and parameters: {'p_sma': 47, 'p_std': 37, 'p_atr': 13, 'p_adx': 12, 'rsi_period': 79, 'ema1': 5, 'ema2': 56, 'slip_atr_k': 0.12816344271180305, 'slip_spread_k': 0.8373881758376376, 'spread_hl_frac': 0.03123681485679872, 'bb_std_mult': 1.6063326044402342, 'rsi_os': 12, 'rsi_ob': 84, 'vol_spike': 0.15395368169482657, 'adx_thresh': 7.577376163953717, 'atr_min_pct': 0.0191609214644095, 'atr_max_pct': 0.14059733996233473, 'tp_mult': 2.570687607759009, 'tsl_mult': 0.00023124694403234627, 'strategy': 'mean_reversion', 'time_stop': 220, 'use_sma': False, 'use_atr': True, 'use_adx': False, 'use_ema': True, 'use_spike': False, 'rsi_required': True, 'edge_k': 0.6774059997966213, 'edge_cap': 0.7601214795471829, 'bull_strategy': 'breakout', 'bull_bb_std_mult': 2.961229245482757, 'bull_rsi_os': 11, 'bull_rsi_ob': 79, 'bull_adx_thresh': 18.093077765157293, 'bull_atr_min_pct': 0.0224200702983161, 'bull_atr_max_pct': 0.08705054343109303, 'bull_tp_mult': 2.867633458804816, 'bull_tsl_mult': 0.7800670887845135, 'bull_time_stop': 14, 'bull_use_sma': True, 'bull_use_ema': True, 'bull_use_atr': False, 'bull_use_adx': False, 'bull_use_spike': False, 'bull_rsi_required': False, 'bear_strategy': 'breakout', 'bear_bb_std_mult': 2.439406497757108, 'bear_rsi_os': 30, 'bear_rsi_ob': 48, 'bear_adx_thresh': 33.601512376704115, 'bear_atr_min_pct': 0.0134941943441827, 'bear_atr_max_pct': 0.1001190154800861, 'bear_tp_mult': 1.2474584636535182, 'bear_tsl_mult': 0.14659099813238316, 'bear_time_stop': 129, 'bear_use_sma': True, 'bear_use_ema': True, 'bear_use_atr': True, 'bear_use_adx': True, 'bear_use_spike': True, 'bear_rsi_required': True, 'sideways_strategy': 'mean_reversion', 'sideways_bb_std_mult': 3.595989147394498, 'sideways_rsi_os': 51, 'sideways_rsi_ob': 70, 'sideways_adx_thresh': 33.76727470781392, 'sideways_atr_min_pct': 0.0020775869371998353, 'sideways_atr_max_pct': 0.053348948373549726, 'sideways_tp_mult': 1.421025578232417, 'sideways_tsl_mult': 0.6130282741029063, 'sideways_time_stop': 196, 'sideways_use_sma': True, 'sideways_use_ema': False, 'sideways_use_atr': False, 'sideways_use_adx': False, 'sideways_use_spike': True, 'sideways_rsi_required': False}.
[I 2025-08-31 12:35:30,776] Trial 335 finished with values: [-1000000000.0, 1000000000.0] and parameters: {'p_sma': 50, 'p_std': 29, 'p_atr': 13, 'p_adx': 8, 'rsi_period': 75, 'ema1': 20, 'ema2': 56, 'slip_atr_k': 0.023603972986319915, 'slip_spread_k': 0.679313855860784, 'spread_hl_frac': 0.048837430834763405, 'bb_std_mult': 1.7112067699893503, 'rsi_os': 42, 'rsi_ob': 75, 'vol_spike': 0.19297271969601454, 'adx_thresh': 32.38380311864972, 'atr_min_pct': 0.003296319921494633, 'atr_max_pct': 0.12667319503978047, 'tp_mult': 1.3351848141822953, 'tsl_mult': 0.31981402322375874, 'strategy': 'mean_reversion', 'time_stop': 265, 'use_sma': False, 'use_atr': True, 'use_adx': False, 'use_ema': True, 'use_spike': False, 'rsi_required': True, 'edge_k': 0.6881372359637389, 'edge_cap': 0.8482882997827359, 'bull_strategy': 'breakout', 'bull_bb_std_mult': 2.5323406055784234, 'bull_rsi_os': 12, 'bull_rsi_ob': 79, 'bull_adx_thresh': 34.98363829438333, 'bull_atr_min_pct': 0.018133976186294313, 'bull_atr_max_pct': 0.10165831106173025, 'bull_tp_mult': 2.8486214358552466, 'bull_tsl_mult': 0.6825421194500314, 'bull_time_stop': 86, 'bull_use_sma': True, 'bull_use_ema': True, 'bull_use_atr': False, 'bull_use_adx': False, 'bull_use_spike': False, 'bull_rsi_required': False, 'bear_strategy': 'breakout', 'bear_bb_std_mult': 2.835195738985295, 'bear_rsi_os': 17, 'bear_rsi_ob': 50, 'bear_adx_thresh': 33.13667085238212, 'bear_atr_min_pct': 0.006825457313846614, 'bear_atr_max_pct': 0.11233819592622458, 'bear_tp_mult': 2.8320965856465605, 'bear_tsl_mult': 0.6079170520950498, 'bear_time_stop': 43, 'bear_use_sma': True, 'bear_use_ema': True, 'bear_use_atr': True, 'bear_use_adx': True, 'bear_use_spike': True, 'bear_rsi_required': True, 'sideways_strategy': 'mean_reversion', 'sideways_bb_std_mult': 3.4581919521052398, 'sideways_rsi_os': 52, 'sideways_rsi_ob': 70, 'sideways_adx_thresh': 27.227410621547715, 'sideways_atr_min_pct': 0.0012086343741550456, 'sideways_atr_max_pct': 0.12133465773712115, 'sideways_tp_mult': 1.3923115287509622, 'sideways_tsl_mult': 0.6376240269385965, 'sideways_time_stop': 300, 'sideways_use_sma': True, 'sideways_use_ema': False, 'sideways_use_atr': False, 'sideways_use_adx': False, 'sideways_use_spike': True, 'sideways_rsi_required': False}.
[I 2025-08-31 12:35:30,863] Trial 333 finished with values: [-1000000000.0, 1000000000.0] and parameters: {'p_sma': 47, 'p_std': 40, 'p_atr': 13, 'p_adx': 8, 'rsi_period': 75, 'ema1': 5, 'ema2': 54, 'slip_atr_k': 0.24655906034773817, 'slip_spread_k': 0.26978953339091594, 'spread_hl_frac': 0.04868821419911614, 'bb_std_mult': 1.713938905547532, 'rsi_os': 42, 'rsi_ob': 75, 'vol_spike': 0.08995844809523497, 'adx_thresh': 20.931218810548213, 'atr_min_pct': 0.014402304329369276, 'atr_max_pct': 0.02857270240996628, 'tp_mult': 2.226451873791917, 'tsl_mult': 0.635447309967512, 'strategy': 'mean_reversion', 'time_stop': 263, 'use_sma': False, 'use_atr': True, 'use_adx': False, 'use_ema': False, 'use_spike': False, 'rsi_required': True, 'edge_k': 0.6590828935887075, 'edge_cap': 0.837845519667284, 'bull_strategy': 'breakout', 'bull_bb_std_mult': 2.327411397582373, 'bull_rsi_os': 12, 'bull_rsi_ob': 62, 'bull_adx_thresh': 7.12625198647862, 'bull_atr_min_pct': 0.0034334525644570454, 'bull_atr_max_pct': 0.08640903569229907, 'bull_tp_mult': 2.8549007916605387, 'bull_tsl_mult': 0.6893571732718311, 'bull_time_stop': 257, 'bull_use_sma': True, 'bull_use_ema': True, 'bull_use_atr': False, 'bull_use_adx': False, 'bull_use_spike': False, 'bull_rsi_required': False, 'bear_strategy': 'breakout', 'bear_bb_std_mult': 2.8478373016543217, 'bear_rsi_os': 15, 'bear_rsi_ob': 52, 'bear_adx_thresh': 33.48001818763509, 'bear_atr_min_pct': 0.006796090501566893, 'bear_atr_max_pct': 0.11107736407562663, 'bear_tp_mult': 2.826282305666676, 'bear_tsl_mult': 0.15270067243062832, 'bear_time_stop': 237, 'bear_use_sma': True, 'bear_use_ema': True, 'bear_use_atr': True, 'bear_use_adx': True, 'bear_use_spike': True, 'bear_rsi_required': True, 'sideways_strategy': 'mean_reversion', 'sideways_bb_std_mult': 3.5990495565621887, 'sideways_rsi_os': 14, 'sideways_rsi_ob': 69, 'sideways_adx_thresh': 25.911751819741227, 'sideways_atr_min_pct': 0.0012245937421544346, 'sideways_atr_max_pct': 0.13989628677340954, 'sideways_tp_mult': 1.39617686855189, 'sideways_tsl_mult': 0.5922078612392481, 'sideways_time_stop': 130, 'sideways_use_sma': True, 'sideways_use_ema': False, 'sideways_use_atr': False, 'sideways_use_adx': False, 'sideways_use_spike': True, 'sideways_rsi_required': False}.
[I 2025-08-31 12:36:01,737] Trial 338 finished with values: [-1000000000.0, 1000000000.0] and parameters: {'p_sma': 50, 'p_std': 29, 'p_atr': 14, 'p_adx': 19, 'rsi_period': 75, 'ema1': 29, 'ema2': 25, 'slip_atr_k': 0.1607044518091613, 'slip_spread_k': 0.6801121944323768, 'spread_hl_frac': 0.028720972954733328, 'bb_std_mult': 2.157041291093072, 'rsi_os': 41, 'rsi_ob': 75, 'vol_spike': 0.0911457670211622, 'adx_thresh': 20.772352549534038, 'atr_min_pct': 0.024420744933292264, 'atr_max_pct': 0.12607324394785227, 'tp_mult': 1.3602025548604018, 'tsl_mult': 0.3287934183321504, 'strategy': 'breakout', 'time_stop': 274, 'use_sma': False, 'use_atr': True, 'use_adx': False, 'use_ema': False, 'use_spike': False, 'rsi_required': True, 'edge_k': 1.6143742975081226, 'edge_cap': 0.05424349554999308, 'bull_strategy': 'breakout', 'bull_bb_std_mult': 1.5261901916657052, 'bull_rsi_os': 50, 'bull_rsi_ob': 62, 'bull_adx_thresh': 31.176301624312938, 'bull_atr_min_pct': 0.021081334540919105, 'bull_atr_max_pct': 0.08433432673085065, 'bull_tp_mult': 2.702594643779031, 'bull_tsl_mult': 0.6527885625497512, 'bull_time_stop': 278, 'bull_use_sma': True, 'bull_use_ema': True, 'bull_use_atr': False, 'bull_use_adx': True, 'bull_use_spike': True, 'bull_rsi_required': False, 'bear_strategy': 'breakout', 'bear_bb_std_mult': 3.311939182827519, 'bear_rsi_os': 38, 'bear_rsi_ob': 71, 'bear_adx_thresh': 32.24525804888172, 'bear_atr_min_pct': 0.025991294117892423, 'bear_atr_max_pct': 0.11122517281508573, 'bear_tp_mult': 2.8235630160354415, 'bear_tsl_mult': 0.13593793075281366, 'bear_time_stop': 19, 'bear_use_sma': True, 'bear_use_ema': True, 'bear_use_atr': True, 'bear_use_adx': True, 'bear_use_spike': False, 'bear_rsi_required': True, 'sideways_strategy': 'breakout', 'sideways_bb_std_mult': 2.7282075246153967, 'sideways_rsi_os': 34, 'sideways_rsi_ob': 82, 'sideways_adx_thresh': 12.954220644951759, 'sideways_atr_min_pct': 0.021672299770967872, 'sideways_atr_max_pct': 0.04993105895639921, 'sideways_tp_mult': 1.0831504276657737, 'sideways_tsl_mult': 0.6456564693788651, 'sideways_time_stop': 241, 'sideways_use_sma': True, 'sideways_use_ema': False, 'sideways_use_atr': False, 'sideways_use_adx': True, 'sideways_use_spike': False, 'sideways_rsi_required': True}.
[I 2025-08-31 12:36:02,199] Trial 337 finished with values: [-0.11479402546330764, 0.11458310835714289] and parameters: {'p_sma': 18, 'p_std': 29, 'p_atr': 13, 'p_adx': 30, 'rsi_period': 14, 'ema1': 5, 'ema2': 56, 'slip_atr_k': 0.1420611770771563, 'slip_spread_k': 0.2592944576724088, 'spread_hl_frac': 0.028876789502909804, 'bb_std_mult': 1.724783297158606, 'rsi_os': 37, 'rsi_ob': 75, 'vol_spike': 0.2166587664999352, 'adx_thresh': 7.780091774635887, 'atr_min_pct': 0.003424395134036939, 'atr_max_pct': 0.14071863691742628, 'tp_mult': 2.534836145873997, 'tsl_mult': 0.00046421335468324956, 'strategy': 'mean_reversion', 'time_stop': 144, 'use_sma': False, 'use_atr': True, 'use_adx': False, 'use_ema': True, 'use_spike': False, 'rsi_required': True, 'edge_k': 0.673314691456412, 'edge_cap': 0.903389963749573, 'bull_strategy': 'breakout', 'bull_bb_std_mult': 2.959933990909127, 'bull_rsi_os': 12, 'bull_rsi_ob': 71, 'bull_adx_thresh': 23.868063002360486, 'bull_atr_min_pct': 0.021004814189843814, 'bull_atr_max_pct': 0.07068410599679485, 'bull_tp_mult': 1.8984310075339241, 'bull_tsl_mult': 0.6914936809050702, 'bull_time_stop': 78, 'bull_use_sma': True, 'bull_use_ema': True, 'bull_use_atr': False, 'bull_use_adx': False, 'bull_use_spike': False, 'bull_rsi_required': False, 'bear_strategy': 'breakout', 'bear_bb_std_mult': 3.489275203037197, 'bear_rsi_os': 49, 'bear_rsi_ob': 71, 'bear_adx_thresh': 22.670090422715287, 'bear_atr_min_pct': 0.016917871950006064, 'bear_atr_max_pct': 0.1125102391324693, 'bear_tp_mult': 2.8348882614040494, 'bear_tsl_mult': 0.6112875735486444, 'bear_time_stop': 44, 'bear_use_sma': True, 'bear_use_ema': True, 'bear_use_atr': True, 'bear_use_adx': True, 'bear_use_spike': True, 'bear_rsi_required': True, 'sideways_strategy': 'mean_reversion', 'sideways_bb_std_mult': 3.5844795162939445, 'sideways_rsi_os': 35, 'sideways_rsi_ob': 53, 'sideways_adx_thresh': 25.8844315858798, 'sideways_atr_min_pct': 0.001271300200534585, 'sideways_atr_max_pct': 0.122077444827081, 'sideways_tp_mult': 1.6571396615725527, 'sideways_tsl_mult': 0.6406549088266285, 'sideways_time_stop': 12, 'sideways_use_sma': True, 'sideways_use_ema': False, 'sideways_use_atr': False, 'sideways_use_adx': False, 'sideways_use_spike': False, 'sideways_rsi_required': True}.
[I 2025-08-31 12:36:02,496] Trial 339 finished with values: [-0.31012502358969796, 0.30999885755833007] and parameters: {'p_sma': 54, 'p_std': 27, 'p_atr': 20, 'p_adx': 19, 'rsi_period': 14, 'ema1': 18, 'ema2': 25, 'slip_atr_k': 0.13801163513506665, 'slip_spread_k': 0.5846089538439039, 'spread_hl_frac': 0.006918496197236893, 'bb_std_mult': 1.3831952761049038, 'rsi_os': 41, 'rsi_ob': 52, 'vol_spike': 0.0888785153734619, 'adx_thresh': 20.68662578886555, 'atr_min_pct': 0.002661896321675062, 'atr_max_pct': 0.1298757861585279, 'tp_mult': 2.6755544418127615, 'tsl_mult': 0.03228152062514485, 'strategy': 'breakout', 'time_stop': 225, 'use_sma': False, 'use_atr': True, 'use_adx': False, 'use_ema': False, 'use_spike': False, 'rsi_required': True, 'edge_k': 1.3530170679128353, 'edge_cap': 0.734404971678055, 'bull_strategy': 'breakout', 'bull_bb_std_mult': 1.5127477351027285, 'bull_rsi_os': 50, 'bull_rsi_ob': 64, 'bull_adx_thresh': 31.14421092189255, 'bull_atr_min_pct': 0.0034036542425733146, 'bull_atr_max_pct': 0.10739135474894658, 'bull_tp_mult': 2.571633729416148, 'bull_tsl_mult': 0.29321928969426453, 'bull_time_stop': 277, 'bull_use_sma': True, 'bull_use_ema': True, 'bull_use_atr': False, 'bull_use_adx': True, 'bull_use_spike': True, 'bull_rsi_required': False, 'bear_strategy': 'breakout', 'bear_bb_std_mult': 3.483213153039266, 'bear_rsi_os': 37, 'bear_rsi_ob': 71, 'bear_adx_thresh': 13.965883299559408, 'bear_atr_min_pct': 0.01246376749148623, 'bear_atr_max_pct': 0.09605522838440113, 'bear_tp_mult': 2.8623605191356, 'bear_tsl_mult': 0.5091950430266459, 'bear_time_stop': 249, 'bear_use_sma': True, 'bear_use_ema': True, 'bear_use_atr': True, 'bear_use_adx': True, 'bear_use_spike': False, 'bear_rsi_required': True, 'sideways_strategy': 'breakout', 'sideways_bb_std_mult': 0.8266826401997496, 'sideways_rsi_os': 35, 'sideways_rsi_ob': 85, 'sideways_adx_thresh': 13.069309742312496, 'sideways_atr_min_pct': 7.295079131791572e-05, 'sideways_atr_max_pct': 0.050268394272051306, 'sideways_tp_mult': 1.0866576780986594, 'sideways_tsl_mult': 0.6464850647305177, 'sideways_time_stop': 13, 'sideways_use_sma': True, 'sideways_use_ema': False, 'sideways_use_atr': False, 'sideways_use_adx': True, 'sideways_use_spike': False, 'sideways_rsi_required': True}.
[I 2025-08-31 12:36:02,622] Trial 340 finished with values: [-0.20132512567069716, 0.20118032242871528] and parameters: {'p_sma': 52, 'p_std': 27, 'p_atr': 26, 'p_adx': 30, 'rsi_period': 14, 'ema1': 29, 'ema2': 14, 'slip_atr_k': 0.14024393348402955, 'slip_spread_k': 0.6509247647136294, 'spread_hl_frac': 0.02909494710433332, 'bb_std_mult': 2.14406434711776, 'rsi_os': 41, 'rsi_ob': 78, 'vol_spike': 0.2930463903744855, 'adx_thresh': 30.434997901493894, 'atr_min_pct': 0.002601488836471417, 'atr_max_pct': 0.13043104978446718, 'tp_mult': 1.73495164928219, 'tsl_mult': 0.022049134931711914, 'strategy': 'breakout', 'time_stop': 143, 'use_sma': False, 'use_atr': True, 'use_adx': False, 'use_ema': False, 'use_spike': False, 'rsi_required': True, 'edge_k': 0.8000509439343424, 'edge_cap': 0.6670852102453447, 'bull_strategy': 'breakout', 'bull_bb_std_mult': 1.3993336734520072, 'bull_rsi_os': 50, 'bull_rsi_ob': 56, 'bull_adx_thresh': 8.847199678142772, 'bull_atr_min_pct': 0.021194850807165527, 'bull_atr_max_pct': 0.10780438481833002, 'bull_tp_mult': 1.9025217838473223, 'bull_tsl_mult': 0.2965033128233019, 'bull_time_stop': 175, 'bull_use_sma': True, 'bull_use_ema': True, 'bull_use_atr': False, 'bull_use_adx': True, 'bull_use_spike': True, 'bull_rsi_required': False, 'bear_strategy': 'breakout', 'bear_bb_std_mult': 2.6078765637816006, 'bear_rsi_os': 38, 'bear_rsi_ob': 55, 'bear_adx_thresh': 22.752090621711066, 'bear_atr_min_pct': 0.026635748327292062, 'bear_atr_max_pct': 0.09706949072233421, 'bear_tp_mult': 2.8902077997941267, 'bear_tsl_mult': 0.08997947949717586, 'bear_time_stop': 247, 'bear_use_sma': True, 'bear_use_ema': True, 'bear_use_atr': True, 'bear_use_adx': True, 'bear_use_spike': False, 'bear_rsi_required': True, 'sideways_strategy': 'breakout', 'sideways_bb_std_mult': 1.5683079475062915, 'sideways_rsi_os': 35, 'sideways_rsi_ob': 79, 'sideways_adx_thresh': 21.703133135348338, 'sideways_atr_min_pct': 0.0004517640726848613, 'sideways_atr_max_pct': 0.03890485038409618, 'sideways_tp_mult': 1.3387122012522863, 'sideways_tsl_mult': 0.29699416063039086, 'sideways_time_stop': 15, 'sideways_use_sma': True, 'sideways_use_ema': False, 'sideways_use_atr': False, 'sideways_use_adx': True, 'sideways_use_spike': False, 'sideways_rsi_required': True}.
[I 2025-08-31 12:36:03,133] Trial 341 finished with values: [-1000000000.0, 1000000000.0] and parameters: {'p_sma': 54, 'p_std': 27, 'p_atr': 11, 'p_adx': 10, 'rsi_period': 81, 'ema1': 6, 'ema2': 30, 'slip_atr_k': 0.20131859079920555, 'slip_spread_k': 0.7375322942125644, 'spread_hl_frac': 0.030034602462874475, 'bb_std_mult': 1.3959195257237382, 'rsi_os': 39, 'rsi_ob': 48, 'vol_spike': 0.07552794815276934, 'adx_thresh': 14.391133760537674, 'atr_min_pct': 0.002615151764463037, 'atr_max_pct': 0.13091932870570586, 'tp_mult': 2.6765839781733387, 'tsl_mult': 0.02903953354688375, 'strategy': 'mean_reversion', 'time_stop': 224, 'use_sma': False, 'use_atr': True, 'use_adx': False, 'use_ema': False, 'use_spike': False, 'rsi_required': True, 'edge_k': 0.39690896909268014, 'edge_cap': 0.6615635378887849, 'bull_strategy': 'breakout', 'bull_bb_std_mult': 1.386800823270185, 'bull_rsi_os': 36, 'bull_rsi_ob': 56, 'bull_adx_thresh': 8.753645839024891, 'bull_atr_min_pct': 0.02109066981743794, 'bull_atr_max_pct': 0.07241770134743236, 'bull_tp_mult': 2.558624841424538, 'bull_tsl_mult': 0.24605715223519214, 'bull_time_stop': 78, 'bull_use_sma': True, 'bull_use_ema': True, 'bull_use_atr': True, 'bull_use_adx': True, 'bull_use_spike': False, 'bull_rsi_required': False, 'bear_strategy': 'breakout', 'bear_bb_std_mult': 2.6321362163079125, 'bear_rsi_os': 8, 'bear_rsi_ob': 72, 'bear_adx_thresh': 31.06897276156276, 'bear_atr_min_pct': 0.028243435359273247, 'bear_atr_max_pct': 0.09576112019867411, 'bear_tp_mult': 2.885591977239406, 'bear_tsl_mult': 0.08618497867522679, 'bear_time_stop': 253, 'bear_use_sma': True, 'bear_use_ema': True, 'bear_use_atr': True, 'bear_use_adx': True, 'bear_use_spike': True, 'bear_rsi_required': True, 'sideways_strategy': 'breakout', 'sideways_bb_std_mult': 1.676928095561787, 'sideways_rsi_os': 11, 'sideways_rsi_ob': 84, 'sideways_adx_thresh': 30.608159108342143, 'sideways_atr_min_pct': 0.010635047875765406, 'sideways_atr_max_pct': 0.039735735233627556, 'sideways_tp_mult': 1.3352328474202078, 'sideways_tsl_mult': 0.2890054132880735, 'sideways_time_stop': 13, 'sideways_use_sma': True, 'sideways_use_ema': False, 'sideways_use_atr': False, 'sideways_use_adx': False, 'sideways_use_spike': False, 'sideways_rsi_required': True}.
