[I 2025-08-31 13:05:56,516] Trial 559 finished with values: [-1000000000.0, 1000000000.0] and parameters: {'p_sma': 7, 'p_std': 57, 'p_atr': 15, 'p_adx': 14, 'rsi_period': 50, 'ema1': 19, 'ema2': 51, 'slip_atr_k': 0.04188243495402057, 'slip_spread_k': 0.24204429794478666, 'spread_hl_frac': 0.016751486199416393, 'bb_std_mult': 2.2902014833142252, 'rsi_os': 48, 'rsi_ob': 93, 'vol_spike': 0.2753627516203092, 'adx_thresh': 20.601484241752836, 'atr_min_pct': 0.011506331162225426, 'atr_max_pct': 0.11801403411697493, 'tp_mult': 2.6437604982415204, 'tsl_mult': 0.0004645984365479715, 'strategy': 'breakout', 'time_stop': 260, 'use_sma': True, 'use_atr': True, 'use_adx': True, 'use_ema': True, 'use_spike': True, 'rsi_required': False, 'edge_k': 1.599943826212477, 'edge_cap': 0.7144311850909036, 'bull_strategy': 'breakout', 'bull_bb_std_mult': 1.5032032392166732, 'bull_rsi_os': 6, 'bull_rsi_ob': 62, 'bull_adx_thresh': 17.136177123853503, 'bull_atr_min_pct': 0.019626886522282155, 'bull_atr_max_pct': 0.1351022496374051, 'bull_tp_mult': 1.378406271570832, 'bull_tsl_mult': 0.19701454660548995, 'bull_time_stop': 231, 'bull_use_sma': False, 'bull_use_ema': True, 'bull_use_atr': False, 'bull_use_adx': True, 'bull_use_spike': True, 'bull_rsi_required': True, 'bear_strategy': 'breakout', 'bear_bb_std_mult': 3.193530959324965, 'bear_rsi_os': 28, 'bear_rsi_ob': 70, 'bear_adx_thresh': 12.990362620938747, 'bear_atr_min_pct': 0.004267324970720987, 'bear_atr_max_pct': 0.14430111466749912, 'bear_tp_mult': 1.690264178678933, 'bear_tsl_mult': 0.7456423186986998, 'bear_time_stop': 283, 'bear_use_sma': False, 'bear_use_ema': True, 'bear_use_atr': False, 'bear_use_adx': False, 'bear_use_spike': False, 'bear_rsi_required': True, 'sideways_strategy': 'breakout', 'sideways_bb_std_mult': 2.347843369199098, 'sideways_rsi_os': 32, 'sideways_rsi_ob': 68, 'sideways_adx_thresh': 26.61593155755476, 'sideways_atr_min_pct': 0.017590552101628538, 'sideways_atr_max_pct': 0.13206312461091524, 'sideways_tp_mult': 1.5798682115191438, 'sideways_tsl_mult': 0.8068233553338742, 'sideways_time_stop': 216, 'sideways_use_sma': True, 'sideways_use_ema': False, 'sideways_use_atr': True, 'sideways_use_adx': True, 'sideways_use_spike': False, 'sideways_rsi_required': True}.
[I 2025-08-31 13:05:56,751] Trial 561 finished with values: [-1000000000.0, 1000000000.0] and parameters: {'p_sma': 51, 'p_std': 26, 'p_atr': 10, 'p_adx': 15, 'rsi_period': 50, 'ema1': 17, 'ema2': 15, 'slip_atr_k': 0.04464182712178949, 'slip_spread_k': 0.367597935657839, 'spread_hl_frac': 0.01733880486096177, 'bb_std_mult': 2.3040892180015287, 'rsi_os': 48, 'rsi_ob': 57, 'vol_spike': 0.01748062035840513, 'adx_thresh': 20.653137447525328, 'atr_min_pct': 0.0012838137232154528, 'atr_max_pct': 0.11815473058921747, 'tp_mult': 1.0102027646839518, 'tsl_mult': 0.3289095984288819, 'strategy': 'breakout', 'time_stop': 167, 'use_sma': True, 'use_atr': True, 'use_adx': True, 'use_ema': True, 'use_spike': True, 'rsi_required': False, 'edge_k': 0.016293036565746433, 'edge_cap': 0.7648361501222933, 'bull_strategy': 'mean_reversion', 'bull_bb_std_mult': 0.6702351075793773, 'bull_rsi_os': 6, 'bull_rsi_ob': 49, 'bull_adx_thresh': 17.27921870639737, 'bull_atr_min_pct': 0.019728251779518965, 'bull_atr_max_pct': 0.1499242383454307, 'bull_tp_mult': 1.31669181349, 'bull_tsl_mult': 0.9344466452993785, 'bull_time_stop': 231, 'bull_use_sma': False, 'bull_use_ema': True, 'bull_use_atr': False, 'bull_use_adx': True, 'bull_use_spike': True, 'bull_rsi_required': True, 'bear_strategy': 'breakout', 'bear_bb_std_mult': 3.176045042002358, 'bear_rsi_os': 27, 'bear_rsi_ob': 70, 'bear_adx_thresh': 12.799696266433031, 'bear_atr_min_pct': 0.007219702368709357, 'bear_atr_max_pct': 0.14475637425136528, 'bear_tp_mult': 2.6895263708729784, 'bear_tsl_mult': 0.7390588703686726, 'bear_time_stop': 183, 'bear_use_sma': False, 'bear_use_ema': True, 'bear_use_atr': False, 'bear_use_adx': False, 'bear_use_spike': False, 'bear_rsi_required': True, 'sideways_strategy': 'mean_reversion', 'sideways_bb_std_mult': 2.480473828069321, 'sideways_rsi_os': 32, 'sideways_rsi_ob': 67, 'sideways_adx_thresh': 26.688343546463063, 'sideways_atr_min_pct': 0.003880648369584923, 'sideways_atr_max_pct': 0.05882786187698527, 'sideways_tp_mult': 1.6479489436918044, 'sideways_tsl_mult': 0.8071404771568474, 'sideways_time_stop': 210, 'sideways_use_sma': False, 'sideways_use_ema': False, 'sideways_use_atr': True, 'sideways_use_adx': True, 'sideways_use_spike': False, 'sideways_rsi_required': True}.
[I 2025-08-31 13:05:56,888] Trial 558 finished with values: [-1000000000.0, 1000000000.0] and parameters: {'p_sma': 55, 'p_std': 24, 'p_atr': 10, 'p_adx': 14, 'rsi_period': 50, 'ema1': 30, 'ema2': 15, 'slip_atr_k': 0.053448838134574676, 'slip_spread_k': 0.44331609795357496, 'spread_hl_frac': 0.048762392455638605, 'bb_std_mult': 0.5034256337751346, 'rsi_os': 41, 'rsi_ob': 57, 'vol_spike': 0.17749249377208304, 'adx_thresh': 20.801829402941095, 'atr_min_pct': 0.00433104637326906, 'atr_max_pct': 0.12314195379048762, 'tp_mult': 1.5999535632574526, 'tsl_mult': 0.036144561381211804, 'strategy': 'breakout', 'time_stop': 283, 'use_sma': False, 'use_atr': True, 'use_adx': False, 'use_ema': True, 'use_spike': False, 'rsi_required': False, 'edge_k': 0.026898044847176728, 'edge_cap': 0.7176695010730278, 'bull_strategy': 'breakout', 'bull_bb_std_mult': 2.695473846593371, 'bull_rsi_os': 6, 'bull_rsi_ob': 62, 'bull_adx_thresh': 27.747660859980655, 'bull_atr_min_pct': 0.019666777141083974, 'bull_atr_max_pct': 0.14991402384803543, 'bull_tp_mult': 1.2332377064448423, 'bull_tsl_mult': 0.1919021981027573, 'bull_time_stop': 300, 'bull_use_sma': False, 'bull_use_ema': True, 'bull_use_atr': False, 'bull_use_adx': True, 'bull_use_spike': False, 'bull_rsi_required': False, 'bear_strategy': 'breakout', 'bear_bb_std_mult': 3.271645006158637, 'bear_rsi_os': 21, 'bear_rsi_ob': 69, 'bear_adx_thresh': 18.756416408365304, 'bear_atr_min_pct': 0.01277888972838007, 'bear_atr_max_pct': 0.13386959216413613, 'bear_tp_mult': 2.9439298379145957, 'bear_tsl_mult': 0.7569669895628779, 'bear_time_stop': 147, 'bear_use_sma': False, 'bear_use_ema': True, 'bear_use_atr': True, 'bear_use_adx': True, 'bear_use_spike': True, 'bear_rsi_required': True, 'sideways_strategy': 'breakout', 'sideways_bb_std_mult': 2.4856353518274545, 'sideways_rsi_os': 5, 'sideways_rsi_ob': 69, 'sideways_adx_thresh': 21.372321739632984, 'sideways_atr_min_pct': 0.002703955009965663, 'sideways_atr_max_pct': 0.1328221693426827, 'sideways_tp_mult': 2.4567749642091066, 'sideways_tsl_mult': 0.06279690055820125, 'sideways_time_stop': 114, 'sideways_use_sma': True, 'sideways_use_ema': False, 'sideways_use_atr': False, 'sideways_use_adx': False, 'sideways_use_spike': False, 'sideways_rsi_required': True}.
[I 2025-08-31 13:05:56,954] Trial 560 finished with values: [-1000000000.0, 1000000000.0] and parameters: {'p_sma': 53, 'p_std': 24, 'p_atr': 15, 'p_adx': 19, 'rsi_period': 50, 'ema1': 19, 'ema2': 51, 'slip_atr_k': 0.04416284380861777, 'slip_spread_k': 0.35808094820739234, 'spread_hl_frac': 0.046021401575764134, 'bb_std_mult': 2.2879811065330826, 'rsi_os': 40, 'rsi_ob': 76, 'vol_spike': 0.0395899997415662, 'adx_thresh': 20.60479238831481, 'atr_min_pct': 0.012481584597286382, 'atr_max_pct': 0.08581930798448545, 'tp_mult': 2.626461903369653, 'tsl_mult': 0.06310195198649066, 'strategy': 'breakout', 'time_stop': 165, 'use_sma': True, 'use_atr': True, 'use_adx': True, 'use_ema': True, 'use_spike': True, 'rsi_required': False, 'edge_k': 0.7928891447135181, 'edge_cap': 0.7214836369345419, 'bull_strategy': 'breakout', 'bull_bb_std_mult': 2.7041571031985914, 'bull_rsi_os': 52, 'bull_rsi_ob': 50, 'bull_adx_thresh': 33.99899889036707, 'bull_atr_min_pct': 0.019639658545140316, 'bull_atr_max_pct': 0.14974805870666938, 'bull_tp_mult': 2.4501712986916964, 'bull_tsl_mult': 0.1946567182794046, 'bull_time_stop': 207, 'bull_use_sma': False, 'bull_use_ema': True, 'bull_use_atr': False, 'bull_use_adx': True, 'bull_use_spike': True, 'bull_rsi_required': True, 'bear_strategy': 'breakout', 'bear_bb_std_mult': 2.2360184249826123, 'bear_rsi_os': 28, 'bear_rsi_ob': 69, 'bear_adx_thresh': 12.738985554707325, 'bear_atr_min_pct': 0.007277099664479402, 'bear_atr_max_pct': 0.13121369193077115, 'bear_tp_mult': 2.691335009726634, 'bear_tsl_mult': 0.7569675919819717, 'bear_time_stop': 279, 'bear_use_sma': False, 'bear_use_ema': True, 'bear_use_atr': False, 'bear_use_adx': False, 'bear_use_spike': False, 'bear_rsi_required': True, 'sideways_strategy': 'breakout', 'sideways_bb_std_mult': 1.198069103070381, 'sideways_rsi_os': 32, 'sideways_rsi_ob': 67, 'sideways_adx_thresh': 18.635036976545987, 'sideways_atr_min_pct': 0.0037127384358939964, 'sideways_atr_max_pct': 0.026409242985151113, 'sideways_tp_mult': 2.1813054993107275, 'sideways_tsl_mult': 0.8144187710910954, 'sideways_time_stop': 216, 'sideways_use_sma': True, 'sideways_use_ema': False, 'sideways_use_atr': True, 'sideways_use_adx': True, 'sideways_use_spike': False, 'sideways_rsi_required': True}.
[I 2025-08-31 13:06:29,326] Trial 564 finished with values: [-1000000000.0, 1000000000.0] and parameters: {'p_sma': 53, 'p_std': 21, 'p_atr': 12, 'p_adx': 15, 'rsi_period': 45, 'ema1': 15, 'ema2': 17, 'slip_atr_k': 0.19783196171830036, 'slip_spread_k': 0.7667506579147073, 'spread_hl_frac': 0.01675405627314335, 'bb_std_mult': 3.2322674163665805, 'rsi_os': 38, 'rsi_ob': 76, 'vol_spike': 0.03984410673325566, 'adx_thresh': 15.025888946919185, 'atr_min_pct': 0.0004805923986314467, 'atr_max_pct': 0.13083026945130108, 'tp_mult': 2.591080646549843, 'tsl_mult': 0.06348940121735429, 'strategy': 'breakout', 'time_stop': 179, 'use_sma': False, 'use_atr': False, 'use_adx': False, 'use_ema': True, 'use_spike': False, 'rsi_required': True, 'edge_k': 1.9195032609299756, 'edge_cap': 0.46735209049523607, 'bull_strategy': 'breakout', 'bull_bb_std_mult': 1.756333532483789, 'bull_rsi_os': 49, 'bull_rsi_ob': 50, 'bull_adx_thresh': 12.350941819827451, 'bull_atr_min_pct': 0.018381197248138696, 'bull_atr_max_pct': 0.04359727949481229, 'bull_tp_mult': 2.509197255119425, 'bull_tsl_mult': 0.4955736999240036, 'bull_time_stop': 292, 'bull_use_sma': True, 'bull_use_ema': True, 'bull_use_atr': False, 'bull_use_adx': True, 'bull_use_spike': False, 'bull_rsi_required': False, 'bear_strategy': 'breakout', 'bear_bb_std_mult': 1.0959658992474965, 'bear_rsi_os': 29, 'bear_rsi_ob': 72, 'bear_adx_thresh': 11.700023617164314, 'bear_atr_min_pct': 0.003038429423862761, 'bear_atr_max_pct': 0.1310350259017869, 'bear_tp_mult': 2.1518111771424886, 'bear_tsl_mult': 0.7747829593684221, 'bear_time_stop': 199, 'bear_use_sma': True, 'bear_use_ema': True, 'bear_use_atr': True, 'bear_use_adx': True, 'bear_use_spike': True, 'bear_rsi_required': True, 'sideways_strategy': 'breakout', 'sideways_bb_std_mult': 2.713941476255333, 'sideways_rsi_os': 30, 'sideways_rsi_ob': 65, 'sideways_adx_thresh': 25.627953587468006, 'sideways_atr_min_pct': 0.023872874606535848, 'sideways_atr_max_pct': 0.05235750314020024, 'sideways_tp_mult': 2.820135678063536, 'sideways_tsl_mult': 0.910236835671065, 'sideways_time_stop': 137, 'sideways_use_sma': True, 'sideways_use_ema': False, 'sideways_use_atr': False, 'sideways_use_adx': False, 'sideways_use_spike': False, 'sideways_rsi_required': True}.
[I 2025-08-31 13:06:29,962] Trial 563 finished with values: [-0.07592133034084558, 0.07704093310734506] and parameters: {'p_sma': 54, 'p_std': 24, 'p_atr': 30, 'p_adx': 15, 'rsi_period': 45, 'ema1': 21, 'ema2': 15, 'slip_atr_k': 0.0796850425597739, 'slip_spread_k': 0.7580791607682893, 'spread_hl_frac': 0.049173356872716026, 'bb_std_mult': 3.1945908222928763, 'rsi_os': 41, 'rsi_ob': 76, 'vol_spike': 0.006844236199877146, 'adx_thresh': 14.834924595630259, 'atr_min_pct': 2.9533175591664462e-05, 'atr_max_pct': 0.11310404380541716, 'tp_mult': 2.68988478851436, 'tsl_mult': 0.06375874013204595, 'strategy': 'breakout', 'time_stop': 182, 'use_sma': False, 'use_atr': False, 'use_adx': False, 'use_ema': True, 'use_spike': False, 'rsi_required': True, 'edge_k': 0.781755692399607, 'edge_cap': 0.4710868035759681, 'bull_strategy': 'breakout', 'bull_bb_std_mult': 2.6952843458184543, 'bull_rsi_os': 5, 'bull_rsi_ob': 50, 'bull_adx_thresh': 16.424383175897194, 'bull_atr_min_pct': 0.018307914298905204, 'bull_atr_max_pct': 0.1391910741138385, 'bull_tp_mult': 1.231878374447214, 'bull_tsl_mult': 0.15826924118488545, 'bull_time_stop': 202, 'bull_use_sma': True, 'bull_use_ema': True, 'bull_use_atr': False, 'bull_use_adx': True, 'bull_use_spike': False, 'bull_rsi_required': False, 'bear_strategy': 'breakout', 'bear_bb_std_mult': 2.2208397303276097, 'bear_rsi_os': 44, 'bear_rsi_ob': 72, 'bear_adx_thresh': 10.518397846480108, 'bear_atr_min_pct': 0.003048094222055563, 'bear_atr_max_pct': 0.11467271250843826, 'bear_tp_mult': 1.2923410912829767, 'bear_tsl_mult': 0.6589299988836641, 'bear_time_stop': 220, 'bear_use_sma': True, 'bear_use_ema': True, 'bear_use_atr': True, 'bear_use_adx': True, 'bear_use_spike': True, 'bear_rsi_required': True, 'sideways_strategy': 'breakout', 'sideways_bb_std_mult': 2.8318146395522925, 'sideways_rsi_os': 22, 'sideways_rsi_ob': 67, 'sideways_adx_thresh': 18.55659376798653, 'sideways_atr_min_pct': 0.02895207129117345, 'sideways_atr_max_pct': 0.05147893407902769, 'sideways_tp_mult': 2.8223287596113584, 'sideways_tsl_mult': 0.14508605301114919, 'sideways_time_stop': 199, 'sideways_use_sma': True, 'sideways_use_ema': False, 'sideways_use_atr': False, 'sideways_use_adx': False, 'sideways_use_spike': False, 'sideways_rsi_required': True}.
[I 2025-08-31 13:06:30,155] Trial 562 finished with values: [-1000000000.0, 1000000000.0] and parameters: {'p_sma': 53, 'p_std': 24, 'p_atr': 30, 'p_adx': 15, 'rsi_period': 48, 'ema1': 17, 'ema2': 15, 'slip_atr_k': 0.11916965392692447, 'slip_spread_k': 0.35388458614748375, 'spread_hl_frac': 0.04880443380328267, 'bb_std_mult': 0.5028775629114897, 'rsi_os': 41, 'rsi_ob': 79, 'vol_spike': 0.03857621802003767, 'adx_thresh': 21.3024580966894, 'atr_min_pct': 0.0013688949694416906, 'atr_max_pct': 0.08566097566272887, 'tp_mult': 1.8470817163979263, 'tsl_mult': 0.1591088310910559, 'strategy': 'breakout', 'time_stop': 166, 'use_sma': False, 'use_atr': False, 'use_adx': False, 'use_ema': True, 'use_spike': False, 'rsi_required': False, 'edge_k': 0.7865422618459736, 'edge_cap': 0.06765161653966656, 'bull_strategy': 'mean_reversion', 'bull_bb_std_mult': 2.700862711850778, 'bull_rsi_os': 53, 'bull_rsi_ob': 49, 'bull_adx_thresh': 15.90295078429838, 'bull_atr_min_pct': 0.011296924517601753, 'bull_atr_max_pct': 0.14073132825171797, 'bull_tp_mult': 2.5224899446637714, 'bull_tsl_mult': 0.5367584414987717, 'bull_time_stop': 208, 'bull_use_sma': False, 'bull_use_ema': True, 'bull_use_atr': False, 'bull_use_adx': True, 'bull_use_spike': True, 'bull_rsi_required': False, 'bear_strategy': 'breakout', 'bear_bb_std_mult': 2.454753731935635, 'bear_rsi_os': 38, 'bear_rsi_ob': 72, 'bear_adx_thresh': 12.700499288780149, 'bear_atr_min_pct': 0.018846988639303248, 'bear_atr_max_pct': 0.13074559974330038, 'bear_tp_mult': 2.9096455127791487, 'bear_tsl_mult': 0.9264989258557265, 'bear_time_stop': 40, 'bear_use_sma': False, 'bear_use_ema': True, 'bear_use_atr': True, 'bear_use_adx': True, 'bear_use_spike': False, 'bear_rsi_required': True, 'sideways_strategy': 'mean_reversion', 'sideways_bb_std_mult': 2.49857111103342, 'sideways_rsi_os': 15, 'sideways_rsi_ob': 67, 'sideways_adx_thresh': 34.14597569594785, 'sideways_atr_min_pct': 0.0038935585231311878, 'sideways_atr_max_pct': 0.02561394197020287, 'sideways_tp_mult': 2.1938760712193006, 'sideways_tsl_mult': 0.9172952726420562, 'sideways_time_stop': 209, 'sideways_use_sma': False, 'sideways_use_ema': False, 'sideways_use_atr': False, 'sideways_use_adx': True, 'sideways_use_spike': False, 'sideways_rsi_required': True}.
[I 2025-08-31 13:06:30,155] Trial 565 finished with values: [-1000000000.0, 1000000000.0] and parameters: {'p_sma': 28, 'p_std': 22, 'p_atr': 27, 'p_adx': 15, 'rsi_period': 48, 'ema1': 18, 'ema2': 17, 'slip_atr_k': 0.06328697019191752, 'slip_spread_k': 0.758040232805012, 'spread_hl_frac': 0.01831195494039478, 'bb_std_mult': 3.265488024775638, 'rsi_os': 38, 'rsi_ob': 46, 'vol_spike': 0.008206495578880122, 'adx_thresh': 29.10051363640232, 'atr_min_pct': 0.0005793023457937087, 'atr_max_pct': 0.03028361172745258, 'tp_mult': 1.740559872130302, 'tsl_mult': 0.050600377966279295, 'strategy': 'breakout', 'time_stop': 184, 'use_sma': False, 'use_atr': False, 'use_adx': False, 'use_ema': True, 'use_spike': False, 'rsi_required': True, 'edge_k': 1.5170031396146157, 'edge_cap': 0.46414418019694803, 'bull_strategy': 'mean_reversion', 'bull_bb_std_mult': 2.5564683543526345, 'bull_rsi_os': 5, 'bull_rsi_ob': 70, 'bull_adx_thresh': 16.409247753011076, 'bull_atr_min_pct': 0.023532525413694105, 'bull_atr_max_pct': 0.1386128363328488, 'bull_tp_mult': 2.297947873769676, 'bull_tsl_mult': 0.9814338385084149, 'bull_time_stop': 292, 'bull_use_sma': True, 'bull_use_ema': True, 'bull_use_atr': False, 'bull_use_adx': True, 'bull_use_spike': False, 'bull_rsi_required': False, 'bear_strategy': 'breakout', 'bear_bb_std_mult': 1.4624289510273347, 'bear_rsi_os': 32, 'bear_rsi_ob': 75, 'bear_adx_thresh': 10.549277592967968, 'bear_atr_min_pct': 0.018823451773555197, 'bear_atr_max_pct': 0.028582617302281954, 'bear_tp_mult': 1.7749721151205966, 'bear_tsl_mult': 0.777285321832743, 'bear_time_stop': 199, 'bear_use_sma': True, 'bear_use_ema': True, 'bear_use_atr': True, 'bear_use_adx': True, 'bear_use_spike': True, 'bear_rsi_required': True, 'sideways_strategy': 'mean_reversion', 'sideways_bb_std_mult': 2.8271029757392188, 'sideways_rsi_os': 30, 'sideways_rsi_ob': 65, 'sideways_adx_thresh': 34.02447429164669, 'sideways_atr_min_pct': 0.0237065470974437, 'sideways_atr_max_pct': 0.051583850795019336, 'sideways_tp_mult': 1.7322859997159852, 'sideways_tsl_mult': 0.9162559110354173, 'sideways_time_stop': 200, 'sideways_use_sma': False, 'sideways_use_ema': False, 'sideways_use_atr': False, 'sideways_use_adx': False, 'sideways_use_spike': False, 'sideways_rsi_required': True}.
[I 2025-08-31 13:07:02,022] Trial 566 finished with values: [-1000000000.0, 1000000000.0] and parameters: {'p_sma': 39, 'p_std': 50, 'p_atr': 27, 'p_adx': 16, 'rsi_period': 67, 'ema1': 18, 'ema2': 15, 'slip_atr_k': 0.1679617261639989, 'slip_spread_k': 0.4019217722236686, 'spread_hl_frac': 0.018029613962110336, 'bb_std_mult': 2.237371542736788, 'rsi_os': 39, 'rsi_ob': 48, 'vol_spike': 0.16989024780087325, 'adx_thresh': 19.862289261485724, 'atr_min_pct': 0.0014507540209039984, 'atr_max_pct': 0.11222031420533894, 'tp_mult': 2.347711252430508, 'tsl_mult': 0.16341748852835664, 'strategy': 'breakout', 'time_stop': 185, 'use_sma': False, 'use_atr': False, 'use_adx': False, 'use_ema': True, 'use_spike': False, 'rsi_required': True, 'edge_k': 0.6714939626607082, 'edge_cap': 0.15650434180595535, 'bull_strategy': 'mean_reversion', 'bull_bb_std_mult': 2.735317970442597, 'bull_rsi_os': 5, 'bull_rsi_ob': 52, 'bull_adx_thresh': 16.475797348713336, 'bull_atr_min_pct': 0.020171947271816898, 'bull_atr_max_pct': 0.13066179155242993, 'bull_tp_mult': 1.2978708139489665, 'bull_tsl_mult': 0.23035328288792592, 'bull_time_stop': 286, 'bull_use_sma': True, 'bull_use_ema': True, 'bull_use_atr': False, 'bull_use_adx': True, 'bull_use_spike': False, 'bull_rsi_required': False, 'bear_strategy': 'mean_reversion', 'bear_bb_std_mult': 2.972137590160473, 'bear_rsi_os': 38, 'bear_rsi_ob': 87, 'bear_adx_thresh': 21.3527276276278, 'bear_atr_min_pct': 0.01863345958671965, 'bear_atr_max_pct': 0.11198485027454866, 'bear_tp_mult': 1.3749643206867266, 'bear_tsl_mult': 0.4009977658935411, 'bear_time_stop': 126, 'bear_use_sma': True, 'bear_use_ema': False, 'bear_use_atr': True, 'bear_use_adx': True, 'bear_use_spike': True, 'bear_rsi_required': False, 'sideways_strategy': 'mean_reversion', 'sideways_bb_std_mult': 1.5659297473091773, 'sideways_rsi_os': 28, 'sideways_rsi_ob': 66, 'sideways_adx_thresh': 26.705861744069605, 'sideways_atr_min_pct': 0.002945253101802966, 'sideways_atr_max_pct': 0.126176808480284, 'sideways_tp_mult': 2.7144278130478545, 'sideways_tsl_mult': 0.1131636669003866, 'sideways_time_stop': 199, 'sideways_use_sma': False, 'sideways_use_ema': False, 'sideways_use_atr': False, 'sideways_use_adx': False, 'sideways_use_spike': False, 'sideways_rsi_required': True}.
