[I 2025-08-31 13:00:38,862] Trial 522 finished with values: [-1000000000.0, 1000000000.0] and parameters: {'p_sma': 49, 'p_std': 26, 'p_atr': 25, 'p_adx': 15, 'rsi_period': 51, 'ema1': 20, 'ema2': 13, 'slip_atr_k': 0.06436895023490416, 'slip_spread_k': 0.8309965892698361, 'spread_hl_frac': 0.0441067623113782, 'bb_std_mult': 3.087763358316839, 'rsi_os': 15, 'rsi_ob': 76, 'vol_spike': 0.23247412629745853, 'adx_thresh': 26.12243852002639, 'atr_min_pct': 0.019602582438958127, 'atr_max_pct': 0.1289160869910303, 'tp_mult': 1.2717621797985, 'tsl_mult': 0.028329457980079648, 'strategy': 'breakout', 'time_stop': 167, 'use_sma': True, 'use_atr': False, 'use_adx': True, 'use_ema': True, 'use_spike': False, 'rsi_required': True, 'edge_k': 0.27672855406061403, 'edge_cap': 0.6998382995729342, 'bull_strategy': 'mean_reversion', 'bull_bb_std_mult': 2.4876309749127676, 'bull_rsi_os': 17, 'bull_rsi_ob': 50, 'bull_adx_thresh': 14.73730687063896, 'bull_atr_min_pct': 0.015400208443783566, 'bull_atr_max_pct': 0.04660125748392998, 'bull_tp_mult': 1.1661082949476183, 'bull_tsl_mult': 0.22314879757323428, 'bull_time_stop': 173, 'bull_use_sma': True, 'bull_use_ema': False, 'bull_use_atr': True, 'bull_use_adx': True, 'bull_use_spike': True, 'bull_rsi_required': True, 'bear_strategy': 'breakout', 'bear_bb_std_mult': 3.2046393374829134, 'bear_rsi_os': 27, 'bear_rsi_ob': 70, 'bear_adx_thresh': 13.40500836035553, 'bear_atr_min_pct': 0.018390977901793122, 'bear_atr_max_pct': 0.05948479698789487, 'bear_tp_mult': 1.22370826213922, 'bear_tsl_mult': 0.7629462860460039, 'bear_time_stop': 179, 'bear_use_sma': True, 'bear_use_ema': False, 'bear_use_atr': True, 'bear_use_adx': True, 'bear_use_spike': False, 'bear_rsi_required': False, 'sideways_strategy': 'mean_reversion', 'sideways_bb_std_mult': 2.579866032553725, 'sideways_rsi_os': 30, 'sideways_rsi_ob': 66, 'sideways_adx_thresh': 28.209612108808283, 'sideways_atr_min_pct': 0.01108327650869453, 'sideways_atr_max_pct': 0.1282871130164785, 'sideways_tp_mult': 2.6152934330467072, 'sideways_tsl_mult': 0.8743836230692329, 'sideways_time_stop': 119, 'sideways_use_sma': False, 'sideways_use_ema': True, 'sideways_use_atr': False, 'sideways_use_adx': True, 'sideways_use_spike': False, 'sideways_rsi_required': True}.
[I 2025-08-31 13:00:39,201] Trial 524 finished with values: [-1000000000.0, 1000000000.0] and parameters: {'p_sma': 51, 'p_std': 25, 'p_atr': 27, 'p_adx': 26, 'rsi_period': 51, 'ema1': 20, 'ema2': 13, 'slip_atr_k': 0.06344890377921153, 'slip_spread_k': 0.8341373431103227, 'spread_hl_frac': 0.004757181336356345, 'bb_std_mult': 2.339570585519976, 'rsi_os': 38, 'rsi_ob': 80, 'vol_spike': 0.2321983383210982, 'adx_thresh': 18.09457593545016, 'atr_min_pct': 0.009661810569244554, 'atr_max_pct': 0.12219838325352103, 'tp_mult': 1.1382283494212373, 'tsl_mult': 0.8418169293599835, 'strategy': 'breakout', 'time_stop': 155, 'use_sma': True, 'use_atr': False, 'use_adx': True, 'use_ema': True, 'use_spike': False, 'rsi_required': True, 'edge_k': 0.22379323159346354, 'edge_cap': 0.7034615628447413, 'bull_strategy': 'mean_reversion', 'bull_bb_std_mult': 2.672654753252505, 'bull_rsi_os': 19, 'bull_rsi_ob': 52, 'bull_adx_thresh': 19.40128691414735, 'bull_atr_min_pct': 0.029950672860246986, 'bull_atr_max_pct': 0.03271212188794417, 'bull_tp_mult': 2.955283055141502, 'bull_tsl_mult': 0.2240123980046098, 'bull_time_stop': 281, 'bull_use_sma': True, 'bull_use_ema': True, 'bull_use_atr': True, 'bull_use_adx': True, 'bull_use_spike': False, 'bull_rsi_required': False, 'bear_strategy': 'breakout', 'bear_bb_std_mult': 2.2810410837959845, 'bear_rsi_os': 28, 'bear_rsi_ob': 73, 'bear_adx_thresh': 13.098119005880225, 'bear_atr_min_pct': 0.002013708182792506, 'bear_atr_max_pct': 0.13338599344747765, 'bear_tp_mult': 2.890056176604994, 'bear_tsl_mult': 0.5276896780678015, 'bear_time_stop': 197, 'bear_use_sma': True, 'bear_use_ema': True, 'bear_use_atr': True, 'bear_use_adx': True, 'bear_use_spike': True, 'bear_rsi_required': False, 'sideways_strategy': 'mean_reversion', 'sideways_bb_std_mult': 2.8029934054595347, 'sideways_rsi_os': 40, 'sideways_rsi_ob': 66, 'sideways_adx_thresh': 31.536604945994817, 'sideways_atr_min_pct': 0.0018444320887593905, 'sideways_atr_max_pct': 0.07841653289415443, 'sideways_tp_mult': 1.637740807960947, 'sideways_tsl_mult': 0.7483691970809642, 'sideways_time_stop': 189, 'sideways_use_sma': False, 'sideways_use_ema': True, 'sideways_use_atr': False, 'sideways_use_adx': False, 'sideways_use_spike': False, 'sideways_rsi_required': True}.
[I 2025-08-31 13:00:39,392] Trial 525 finished with values: [-0.024718811241423833, 0.024593698722715773] and parameters: {'p_sma': 51, 'p_std': 58, 'p_atr': 26, 'p_adx': 22, 'rsi_period': 51, 'ema1': 15, 'ema2': 29, 'slip_atr_k': 0.07249321920508106, 'slip_spread_k': 0.39518940879887327, 'spread_hl_frac': 0.03934880979583166, 'bb_std_mult': 2.3756934034652755, 'rsi_os': 39, 'rsi_ob': 77, 'vol_spike': 0.18981561490092091, 'adx_thresh': 20.518562199345116, 'atr_min_pct': 0.0025952560953495284, 'atr_max_pct': 0.12217870267684065, 'tp_mult': 2.9073579305185655, 'tsl_mult': 0.6532158165212367, 'strategy': 'breakout', 'time_stop': 71, 'use_sma': True, 'use_atr': False, 'use_adx': True, 'use_ema': True, 'use_spike': False, 'rsi_required': True, 'edge_k': 0.9507340305098855, 'edge_cap': 0.7301296637707496, 'bull_strategy': 'breakout', 'bull_bb_std_mult': 2.6577889421944745, 'bull_rsi_os': 6, 'bull_rsi_ob': 55, 'bull_adx_thresh': 19.580871857157103, 'bull_atr_min_pct': 0.0006748158309603496, 'bull_atr_max_pct': 0.144659985303826, 'bull_tp_mult': 1.235098866322375, 'bull_tsl_mult': 0.22392825323589804, 'bull_time_stop': 282, 'bull_use_sma': True, 'bull_use_ema': True, 'bull_use_atr': False, 'bull_use_adx': True, 'bull_use_spike': False, 'bull_rsi_required': False, 'bear_strategy': 'breakout', 'bear_bb_std_mult': 3.2135106482296343, 'bear_rsi_os': 11, 'bear_rsi_ob': 74, 'bear_adx_thresh': 13.293479778630562, 'bear_atr_min_pct': 0.02210218994380207, 'bear_atr_max_pct': 0.13694196343813517, 'bear_tp_mult': 2.8729977452654705, 'bear_tsl_mult': 0.7681732173623719, 'bear_time_stop': 197, 'bear_use_sma': True, 'bear_use_ema': True, 'bear_use_atr': True, 'bear_use_adx': True, 'bear_use_spike': True, 'bear_rsi_required': False, 'sideways_strategy': 'breakout', 'sideways_bb_std_mult': 1.3865001007262567, 'sideways_rsi_os': 31, 'sideways_rsi_ob': 76, 'sideways_adx_thresh': 19.06507818222117, 'sideways_atr_min_pct': 0.010999880317758774, 'sideways_atr_max_pct': 0.12577848966467267, 'sideways_tp_mult': 2.558713088803345, 'sideways_tsl_mult': 0.7546864038174189, 'sideways_time_stop': 190, 'sideways_use_sma': True, 'sideways_use_ema': False, 'sideways_use_atr': False, 'sideways_use_adx': False, 'sideways_use_spike': False, 'sideways_rsi_required': True}.
[I 2025-08-31 13:00:39,712] Trial 523 finished with values: [-0.07522799281876635, 0.07464129843719151] and parameters: {'p_sma': 51, 'p_std': 25, 'p_atr': 22, 'p_adx': 15, 'rsi_period': 51, 'ema1': 21, 'ema2': 15, 'slip_atr_k': 0.06288490059749595, 'slip_spread_k': 0.8315119567870761, 'spread_hl_frac': 0.00472785793639411, 'bb_std_mult': 2.3659618186958546, 'rsi_os': 38, 'rsi_ob': 76, 'vol_spike': 0.23163256374182048, 'adx_thresh': 18.196880976107302, 'atr_min_pct': 0.002652291404443986, 'atr_max_pct': 0.0584993583655356, 'tp_mult': 1.1370464404925422, 'tsl_mult': 0.02226185734696611, 'strategy': 'breakout', 'time_stop': 74, 'use_sma': True, 'use_atr': False, 'use_adx': True, 'use_ema': True, 'use_spike': False, 'rsi_required': True, 'edge_k': 0.6018475998192336, 'edge_cap': 0.7044816319219169, 'bull_strategy': 'breakout', 'bull_bb_std_mult': 1.0852245472541, 'bull_rsi_os': 17, 'bull_rsi_ob': 55, 'bull_adx_thresh': 14.64004393084975, 'bull_atr_min_pct': 0.00584145031929873, 'bull_atr_max_pct': 0.1451236889432575, 'bull_tp_mult': 1.79301997335336, 'bull_tsl_mult': 0.5276373267438007, 'bull_time_stop': 263, 'bull_use_sma': True, 'bull_use_ema': False, 'bull_use_atr': False, 'bull_use_adx': True, 'bull_use_spike': False, 'bull_rsi_required': False, 'bear_strategy': 'breakout', 'bear_bb_std_mult': 1.9834137230281854, 'bear_rsi_os': 36, 'bear_rsi_ob': 45, 'bear_adx_thresh': 13.2929871967632, 'bear_atr_min_pct': 0.0006657508799845281, 'bear_atr_max_pct': 0.060392835441445955, 'bear_tp_mult': 2.860169431037563, 'bear_tsl_mult': 0.5124448064754596, 'bear_time_stop': 16, 'bear_use_sma': True, 'bear_use_ema': True, 'bear_use_atr': True, 'bear_use_adx': True, 'bear_use_spike': True, 'bear_rsi_required': False, 'sideways_strategy': 'breakout', 'sideways_bb_std_mult': 2.5762227215328855, 'sideways_rsi_os': 30, 'sideways_rsi_ob': 66, 'sideways_adx_thresh': 31.434091347500974, 'sideways_atr_min_pct': 0.02291556152926957, 'sideways_atr_max_pct': 0.12532238977502072, 'sideways_tp_mult': 1.627416300277068, 'sideways_tsl_mult': 0.7417729463667769, 'sideways_time_stop': 189, 'sideways_use_sma': True, 'sideways_use_ema': True, 'sideways_use_atr': False, 'sideways_use_adx': False, 'sideways_use_spike': False, 'sideways_rsi_required': True}.
[I 2025-08-31 13:01:13,046] Trial 527 finished with values: [-1000000000.0, 1000000000.0] and parameters: {'p_sma': 53, 'p_std': 24, 'p_atr': 12, 'p_adx': 15, 'rsi_period': 61, 'ema1': 28, 'ema2': 52, 'slip_atr_k': 0.07286177090587646, 'slip_spread_k': 0.45562952362017795, 'spread_hl_frac': 0.016521944701636763, 'bb_std_mult': 2.404582675396895, 'rsi_os': 50, 'rsi_ob': 77, 'vol_spike': 0.12496915680527354, 'adx_thresh': 17.05599578629725, 'atr_min_pct': 0.00263612831491557, 'atr_max_pct': 0.11530100391801562, 'tp_mult': 2.608067636647887, 'tsl_mult': 0.279196897274874, 'strategy': 'breakout', 'time_stop': 27, 'use_sma': False, 'use_atr': True, 'use_adx': False, 'use_ema': True, 'use_spike': False, 'rsi_required': True, 'edge_k': 0.6089184531829358, 'edge_cap': 0.7351775366838403, 'bull_strategy': 'breakout', 'bull_bb_std_mult': 2.5870406526534815, 'bull_rsi_os': 22, 'bull_rsi_ob': 57, 'bull_adx_thresh': 19.877300480302516, 'bull_atr_min_pct': 0.018447773746366723, 'bull_atr_max_pct': 0.14994066042661833, 'bull_tp_mult': 1.790886616795365, 'bull_tsl_mult': 0.7993683849727791, 'bull_time_stop': 148, 'bull_use_sma': True, 'bull_use_ema': True, 'bull_use_atr': False, 'bull_use_adx': True, 'bull_use_spike': False, 'bull_rsi_required': False, 'bear_strategy': 'breakout', 'bear_bb_std_mult': 0.6248394123845655, 'bear_rsi_os': 30, 'bear_rsi_ob': 45, 'bear_adx_thresh': 14.616997398197793, 'bear_atr_min_pct': 0.023128916242182985, 'bear_atr_max_pct': 0.035835258755895286, 'bear_tp_mult': 1.7455732494969667, 'bear_tsl_mult': 0.3045627657476065, 'bear_time_stop': 207, 'bear_use_sma': True, 'bear_use_ema': True, 'bear_use_atr': True, 'bear_use_adx': True, 'bear_use_spike': True, 'bear_rsi_required': True, 'sideways_strategy': 'breakout', 'sideways_bb_std_mult': 1.3482585414459058, 'sideways_rsi_os': 31, 'sideways_rsi_ob': 68, 'sideways_adx_thresh': 23.521173324022712, 'sideways_atr_min_pct': 0.02725899253829138, 'sideways_atr_max_pct': 0.12526013075536085, 'sideways_tp_mult': 1.145212180446106, 'sideways_tsl_mult': 0.9382294290080709, 'sideways_time_stop': 206, 'sideways_use_sma': True, 'sideways_use_ema': False, 'sideways_use_atr': False, 'sideways_use_adx': False, 'sideways_use_spike': False, 'sideways_rsi_required': False}.
[I 2025-08-31 13:01:13,691] Trial 528 finished with values: [-1000000000.0, 1000000000.0] and parameters: {'p_sma': 53, 'p_std': 20, 'p_atr': 22, 'p_adx': 15, 'rsi_period': 28, 'ema1': 26, 'ema2': 12, 'slip_atr_k': 0.20619012218299632, 'slip_spread_k': 0.4535140593621073, 'spread_hl_frac': 0.017779221927976572, 'bb_std_mult': 2.1805769990077493, 'rsi_os': 50, 'rsi_ob': 92, 'vol_spike': 0.0004983974860495177, 'adx_thresh': 30.50743155984089, 'atr_min_pct': 0.0006170447208894651, 'atr_max_pct': 0.11525881068553367, 'tp_mult': 2.60600693512331, 'tsl_mult': 0.012764715897530352, 'strategy': 'breakout', 'time_stop': 138, 'use_sma': False, 'use_atr': True, 'use_adx': False, 'use_ema': True, 'use_spike': False, 'rsi_required': False, 'edge_k': 0.765014918550305, 'edge_cap': 0.7660425129394066, 'bull_strategy': 'breakout', 'bull_bb_std_mult': 2.5727823641380683, 'bull_rsi_os': 5, 'bull_rsi_ob': 70, 'bull_adx_thresh': 18.296238096438966, 'bull_atr_min_pct': 0.00909345107814764, 'bull_atr_max_pct': 0.14480613868184897, 'bull_tp_mult': 1.377394546968167, 'bull_tsl_mult': 0.2014014423487743, 'bull_time_stop': 147, 'bull_use_sma': False, 'bull_use_ema': True, 'bull_use_atr': False, 'bull_use_adx': True, 'bull_use_spike': False, 'bull_rsi_required': False, 'bear_strategy': 'breakout', 'bear_bb_std_mult': 2.0022990525837243, 'bear_rsi_os': 6, 'bear_rsi_ob': 68, 'bear_adx_thresh': 23.129229460897804, 'bear_atr_min_pct': 0.0009755269043091562, 'bear_atr_max_pct': 0.08056925192631172, 'bear_tp_mult': 2.5816712400184407, 'bear_tsl_mult': 0.4524284810597892, 'bear_time_stop': 208, 'bear_use_sma': False, 'bear_use_ema': True, 'bear_use_atr': True, 'bear_use_adx': True, 'bear_use_spike': True, 'bear_rsi_required': True, 'sideways_strategy': 'breakout', 'sideways_bb_std_mult': 2.437037530171593, 'sideways_rsi_os': 11, 'sideways_rsi_ob': 92, 'sideways_adx_thresh': 25.10227996117694, 'sideways_atr_min_pct': 0.01829328316298594, 'sideways_atr_max_pct': 0.13057926782764348, 'sideways_tp_mult': 1.577358691503617, 'sideways_tsl_mult': 0.19621665607351219, 'sideways_time_stop': 222, 'sideways_use_sma': True, 'sideways_use_ema': False, 'sideways_use_atr': False, 'sideways_use_adx': False, 'sideways_use_spike': False, 'sideways_rsi_required': False}.
[I 2025-08-31 13:01:14,093] Trial 526 finished with values: [-1000000000.0, 1000000000.0] and parameters: {'p_sma': 53, 'p_std': 21, 'p_atr': 11, 'p_adx': 15, 'rsi_period': 50, 'ema1': 21, 'ema2': 41, 'slip_atr_k': 0.07062114170284424, 'slip_spread_k': 0.36524455023731656, 'spread_hl_frac': 0.016132517994086656, 'bb_std_mult': 2.358434366630401, 'rsi_os': 18, 'rsi_ob': 86, 'vol_spike': 0.21825000013823176, 'adx_thresh': 20.603907240965682, 'atr_min_pct': 0.0025455974271272994, 'atr_max_pct': 0.12224938065892342, 'tp_mult': 2.6000577665242193, 'tsl_mult': 0.841368018485368, 'strategy': 'breakout', 'time_stop': 71, 'use_sma': True, 'use_atr': True, 'use_adx': True, 'use_ema': True, 'use_spike': False, 'rsi_required': True, 'edge_k': 0.6985262072185525, 'edge_cap': 0.7695120523559499, 'bull_strategy': 'breakout', 'bull_bb_std_mult': 2.661576567141889, 'bull_rsi_os': 6, 'bull_rsi_ob': 55, 'bull_adx_thresh': 19.545452175460348, 'bull_atr_min_pct': 0.007199462663015564, 'bull_atr_max_pct': 0.1428188614606942, 'bull_tp_mult': 1.2385884999331962, 'bull_tsl_mult': 0.19714186970192432, 'bull_time_stop': 289, 'bull_use_sma': True, 'bull_use_ema': True, 'bull_use_atr': False, 'bull_use_adx': True, 'bull_use_spike': False, 'bull_rsi_required': False, 'bear_strategy': 'breakout', 'bear_bb_std_mult': 3.144182432130588, 'bear_rsi_os': 11, 'bear_rsi_ob': 82, 'bear_adx_thresh': 13.377668025847552, 'bear_atr_min_pct': 0.0006808763707581607, 'bear_atr_max_pct': 0.13617006316256886, 'bear_tp_mult': 2.8848338758028618, 'bear_tsl_mult': 0.41025252627098163, 'bear_time_stop': 196, 'bear_use_sma': True, 'bear_use_ema': True, 'bear_use_atr': True, 'bear_use_adx': True, 'bear_use_spike': True, 'bear_rsi_required': False, 'sideways_strategy': 'breakout', 'sideways_bb_std_mult': 2.7900268476196266, 'sideways_rsi_os': 11, 'sideways_rsi_ob': 67, 'sideways_adx_thresh': 31.245800246312257, 'sideways_atr_min_pct': 0.0016753008748328158, 'sideways_atr_max_pct': 0.10875432262663073, 'sideways_tp_mult': 1.5692274543300178, 'sideways_tsl_mult': 0.7429193393656611, 'sideways_time_stop': 189, 'sideways_use_sma': True, 'sideways_use_ema': False, 'sideways_use_atr': False, 'sideways_use_adx': False, 'sideways_use_spike': False, 'sideways_rsi_required': True}.
[I 2025-08-31 13:01:14,218] Trial 529 finished with values: [-0.15988232388465606, 0.15971620482780652] and parameters: {'p_sma': 53, 'p_std': 20, 'p_atr': 11, 'p_adx': 9, 'rsi_period': 49, 'ema1': 27, 'ema2': 48, 'slip_atr_k': 0.1909291836310582, 'slip_spread_k': 0.453188493406289, 'spread_hl_frac': 0.018039803543464517, 'bb_std_mult': 2.1741793976828636, 'rsi_os': 39, 'rsi_ob': 80, 'vol_spike': 0.14604423665397206, 'adx_thresh': 17.213443157909303, 'atr_min_pct': 0.0006954826688111449, 'atr_max_pct': 0.11556491609118436, 'tp_mult': 2.6086871953211612, 'tsl_mult': 0.7981110040786158, 'strategy': 'breakout', 'time_stop': 182, 'use_sma': False, 'use_atr': True, 'use_adx': False, 'use_ema': True, 'use_spike': False, 'rsi_required': False, 'edge_k': 0.7682440142641357, 'edge_cap': 0.7513479330491146, 'bull_strategy': 'breakout', 'bull_bb_std_mult': 2.7248397360487795, 'bull_rsi_os': 24, 'bull_rsi_ob': 65, 'bull_adx_thresh': 18.332760005225865, 'bull_atr_min_pct': 0.009223960075016756, 'bull_atr_max_pct': 0.1498041853713207, 'bull_tp_mult': 1.3236705425411863, 'bull_tsl_mult': 0.8089760380729143, 'bull_time_stop': 290, 'bull_use_sma': False, 'bull_use_ema': True, 'bull_use_atr': False, 'bull_use_adx': True, 'bull_use_spike': False, 'bull_rsi_required': False, 'bear_strategy': 'breakout', 'bear_bb_std_mult': 3.1354033035071796, 'bear_rsi_os': 7, 'bear_rsi_ob': 68, 'bear_adx_thresh': 19.384189649823504, 'bear_atr_min_pct': 0.011766478847724854, 'bear_atr_max_pct': 0.0360160327444016, 'bear_tp_mult': 2.9472670152433516, 'bear_tsl_mult': 0.7361843838636236, 'bear_time_stop': 207, 'bear_use_sma': False, 'bear_use_ema': True, 'bear_use_atr': True, 'bear_use_adx': True, 'bear_use_spike': True, 'bear_rsi_required': True, 'sideways_strategy': 'breakout', 'sideways_bb_std_mult': 2.44931863871329, 'sideways_rsi_os': 47, 'sideways_rsi_ob': 88, 'sideways_adx_thresh': 23.345247757081385, 'sideways_atr_min_pct': 0.0016868362213493405, 'sideways_atr_max_pct': 0.11300048085292388, 'sideways_tp_mult': 1.5725671548030005, 'sideways_tsl_mult': 0.9586071536172576, 'sideways_time_stop': 207, 'sideways_use_sma': True, 'sideways_use_ema': False, 'sideways_use_atr': False, 'sideways_use_adx': False, 'sideways_use_spike': False, 'sideways_rsi_required': False}.
[I 2025-08-31 13:01:48,806] Trial 531 finished with values: [-1000000000.0, 1000000000.0] and parameters: {'p_sma': 54, 'p_std': 22, 'p_atr': 11, 'p_adx': 30, 'rsi_period': 49, 'ema1': 27, 'ema2': 32, 'slip_atr_k': 0.19008363894321817, 'slip_spread_k': 0.4016195438633388, 'spread_hl_frac': 0.018274415460542946, 'bb_std_mult': 2.263503415847301, 'rsi_os': 41, 'rsi_ob': 80, 'vol_spike': 0.21642380035329029, 'adx_thresh': 20.581654194400816, 'atr_min_pct': 0.0014917567304947369, 'atr_max_pct': 0.016094705817246396, 'tp_mult': 2.391070154502039, 'tsl_mult': 0.0005662808327041406, 'strategy': 'breakout', 'time_stop': 181, 'use_sma': False, 'use_atr': True, 'use_adx': False, 'use_ema': True, 'use_spike': True, 'rsi_required': True, 'edge_k': 0.6940472838633068, 'edge_cap': 0.7437360572819706, 'bull_strategy': 'breakout', 'bull_bb_std_mult': 2.0659403143916206, 'bull_rsi_os': 32, 'bull_rsi_ob': 46, 'bull_adx_thresh': 5.703555162262926, 'bull_atr_min_pct': 0.0176565974210922, 'bull_atr_max_pct': 0.14994605807675654, 'bull_tp_mult': 1.320618024649566, 'bull_tsl_mult': 0.6094373881366871, 'bull_time_stop': 295, 'bull_use_sma': True, 'bull_use_ema': True, 'bull_use_atr': False, 'bull_use_adx': False, 'bull_use_spike': False, 'bull_rsi_required': False, 'bear_strategy': 'breakout', 'bear_bb_std_mult': 3.140672351900873, 'bear_rsi_os': 29, 'bear_rsi_ob': 72, 'bear_adx_thresh': 25.570137314110845, 'bear_atr_min_pct': 0.0020220427601288795, 'bear_atr_max_pct': 0.1187487842601707, 'bear_tp_mult': 2.931512828556655, 'bear_tsl_mult': 0.7333935292775091, 'bear_time_stop': 193, 'bear_use_sma': True, 'bear_use_ema': True, 'bear_use_atr': True, 'bear_use_adx': True, 'bear_use_spike': True, 'bear_rsi_required': True, 'sideways_strategy': 'breakout', 'sideways_bb_std_mult': 2.6473079555912515, 'sideways_rsi_os': 47, 'sideways_rsi_ob': 63, 'sideways_adx_thresh': 26.9154953159723, 'sideways_atr_min_pct': 0.025171757653705797, 'sideways_atr_max_pct': 0.11266219870306438, 'sideways_tp_mult': 2.9941115432347702, 'sideways_tsl_mult': 0.8244734584380895, 'sideways_time_stop': 209, 'sideways_use_sma': True, 'sideways_use_ema': False, 'sideways_use_atr': False, 'sideways_use_adx': False, 'sideways_use_spike': True, 'sideways_rsi_required': True}.
