[I 2025-08-31 12:22:51,383] Trial 236 finished with values: [-0.04018311855628598, 0.03984618426881426] and parameters: {'p_sma': 35, 'p_std': 15, 'p_atr': 11, 'p_adx': 7, 'rsi_period': 45, 'ema1': 7, 'ema2': 35, 'slip_atr_k': 0.09097058595859278, 'slip_spread_k': 0.8623096120085794, 'spread_hl_frac': 0.02453153473208101, 'bb_std_mult': 0.5676288498696203, 'rsi_os': 43, 'rsi_ob': 62, 'vol_spike': 0.25364354613389284, 'adx_thresh': 22.021951970016215, 'atr_min_pct': 0.027035156186620817, 'atr_max_pct': 0.04305255710795835, 'tp_mult': 1.9974071462783454, 'tsl_mult': 0.533035943662535, 'strategy': 'mean_reversion', 'time_stop': 254, 'use_sma': True, 'use_atr': True, 'use_adx': True, 'use_ema': False, 'use_spike': False, 'rsi_required': False, 'edge_k': 1.1557816567437713, 'edge_cap': 0.4748849778238615, 'bull_strategy': 'mean_reversion', 'bull_bb_std_mult': 2.8108425057833775, 'bull_rsi_os': 13, 'bull_rsi_ob': 45, 'bull_adx_thresh': 19.922267213551983, 'bull_atr_min_pct': 0.004984815446310277, 'bull_atr_max_pct': 0.08437578222135678, 'bull_tp_mult': 1.3233216763254503, 'bull_tsl_mult': 0.667681793623887, 'bull_time_stop': 75, 'bull_use_sma': False, 'bull_use_ema': False, 'bull_use_atr': False, 'bull_use_adx': True, 'bull_use_spike': True, 'bull_rsi_required': True, 'bear_strategy': 'mean_reversion', 'bear_bb_std_mult': 2.420228268930089, 'bear_rsi_os': 5, 'bear_rsi_ob': 62, 'bear_adx_thresh': 17.976118131538897, 'bear_atr_min_pct': 0.027581504357800886, 'bear_atr_max_pct': 0.05406717524926832, 'bear_tp_mult': 1.473614041485763, 'bear_tsl_mult': 0.1729139545360815, 'bear_time_stop': 90, 'bear_use_sma': False, 'bear_use_ema': True, 'bear_use_atr': False, 'bear_use_adx': True, 'bear_use_spike': True, 'bear_rsi_required': False, 'sideways_strategy': 'breakout', 'sideways_bb_std_mult': 1.8129816231122988, 'sideways_rsi_os': 36, 'sideways_rsi_ob': 47, 'sideways_adx_thresh': 8.803401485968473, 'sideways_atr_min_pct': 0.0028179394697693087, 'sideways_atr_max_pct': 0.06833380258956628, 'sideways_tp_mult': 1.4042898345898573, 'sideways_tsl_mult': 0.46920126401075196, 'sideways_time_stop': 173, 'sideways_use_sma': False, 'sideways_use_ema': True, 'sideways_use_atr': False, 'sideways_use_adx': True, 'sideways_use_spike': False, 'sideways_rsi_required': True}.
[I 2025-08-31 12:22:51,498] Trial 234 finished with values: [-1000000000.0, 1000000000.0] and parameters: {'p_sma': 43, 'p_std': 15, 'p_atr': 11, 'p_adx': 14, 'rsi_period': 29, 'ema1': 15, 'ema2': 29, 'slip_atr_k': 0.08895216318093062, 'slip_spread_k': 0.1676471798806511, 'spread_hl_frac': 0.02608290087648793, 'bb_std_mult': 2.575580472697947, 'rsi_os': 44, 'rsi_ob': 62, 'vol_spike': 0.25183956177212735, 'adx_thresh': 23.202646398435967, 'atr_min_pct': 0.02864877270853743, 'atr_max_pct': 0.04465494774072206, 'tp_mult': 2.007199292915961, 'tsl_mult': 0.4995291402892228, 'strategy': 'mean_reversion', 'time_stop': 33, 'use_sma': True, 'use_atr': True, 'use_adx': True, 'use_ema': False, 'use_spike': True, 'rsi_required': False, 'edge_k': 1.0358020481195798, 'edge_cap': 0.30194848479961817, 'bull_strategy': 'mean_reversion', 'bull_bb_std_mult': 1.5719159276709291, 'bull_rsi_os': 13, 'bull_rsi_ob': 82, 'bull_adx_thresh': 8.661608410129023, 'bull_atr_min_pct': 0.025272671381943834, 'bull_atr_max_pct': 0.08550300279343581, 'bull_tp_mult': 1.3219007893835355, 'bull_tsl_mult': 0.30584455410820544, 'bull_time_stop': 77, 'bull_use_sma': False, 'bull_use_ema': False, 'bull_use_atr': False, 'bull_use_adx': True, 'bull_use_spike': False, 'bull_rsi_required': True, 'bear_strategy': 'mean_reversion', 'bear_bb_std_mult': 1.6407286582984506, 'bear_rsi_os': 23, 'bear_rsi_ob': 62, 'bear_adx_thresh': 24.948566401322505, 'bear_atr_min_pct': 0.029555796727124405, 'bear_atr_max_pct': 0.09382321103085739, 'bear_tp_mult': 1.4535089269467178, 'bear_tsl_mult': 0.32397286560705374, 'bear_time_stop': 254, 'bear_use_sma': False, 'bear_use_ema': True, 'bear_use_atr': False, 'bear_use_adx': False, 'bear_use_spike': True, 'bear_rsi_required': False, 'sideways_strategy': 'breakout', 'sideways_bb_std_mult': 1.8308490549100374, 'sideways_rsi_os': 34, 'sideways_rsi_ob': 76, 'sideways_adx_thresh': 26.28590380698838, 'sideways_atr_min_pct': 0.026953648849631306, 'sideways_atr_max_pct': 0.04266828708092448, 'sideways_tp_mult': 1.4080912915452342, 'sideways_tsl_mult': 0.4470686622816064, 'sideways_time_stop': 297, 'sideways_use_sma': False, 'sideways_use_ema': True, 'sideways_use_atr': True, 'sideways_use_adx': False, 'sideways_use_spike': False, 'sideways_rsi_required': True}.
[I 2025-08-31 12:22:51,801] Trial 235 finished with values: [-0.07780516613693567, 0.07759425921094147] and parameters: {'p_sma': 21, 'p_std': 15, 'p_atr': 11, 'p_adx': 24, 'rsi_period': 77, 'ema1': 7, 'ema2': 37, 'slip_atr_k': 0.09066144713427829, 'slip_spread_k': 0.42518708360914337, 'spread_hl_frac': 0.025605562960275614, 'bb_std_mult': 1.5880027607967633, 'rsi_os': 43, 'rsi_ob': 62, 'vol_spike': 0.09571694393466579, 'adx_thresh': 23.31771534559527, 'atr_min_pct': 0.01640883954340602, 'atr_max_pct': 0.042519263857491656, 'tp_mult': 2.5775104916731477, 'tsl_mult': 0.5010532182458995, 'strategy': 'mean_reversion', 'time_stop': 210, 'use_sma': True, 'use_atr': True, 'use_adx': True, 'use_ema': False, 'use_spike': False, 'rsi_required': False, 'edge_k': 1.6690647946308395, 'edge_cap': 0.9390756141684875, 'bull_strategy': 'mean_reversion', 'bull_bb_std_mult': 3.139920825585654, 'bull_rsi_os': 13, 'bull_rsi_ob': 45, 'bull_adx_thresh': 8.31672739086808, 'bull_atr_min_pct': 0.0009037520400049601, 'bull_atr_max_pct': 0.13958095599831272, 'bull_tp_mult': 2.430275040637516, 'bull_tsl_mult': 0.46328667328541684, 'bull_time_stop': 79, 'bull_use_sma': False, 'bull_use_ema': False, 'bull_use_atr': False, 'bull_use_adx': True, 'bull_use_spike': False, 'bull_rsi_required': True, 'bear_strategy': 'mean_reversion', 'bear_bb_std_mult': 1.6442063171699561, 'bear_rsi_os': 23, 'bear_rsi_ob': 62, 'bear_adx_thresh': 17.8702739024168, 'bear_atr_min_pct': 1.0820143403610094e-05, 'bear_atr_max_pct': 0.09389850167917019, 'bear_tp_mult': 1.4559188286585103, 'bear_tsl_mult': 0.07626297475504362, 'bear_time_stop': 16, 'bear_use_sma': False, 'bear_use_ema': True, 'bear_use_atr': False, 'bear_use_adx': False, 'bear_use_spike': True, 'bear_rsi_required': False, 'sideways_strategy': 'breakout', 'sideways_bb_std_mult': 1.8302922958173171, 'sideways_rsi_os': 33, 'sideways_rsi_ob': 47, 'sideways_adx_thresh': 8.791841506386799, 'sideways_atr_min_pct': 0.026871951066098874, 'sideways_atr_max_pct': 0.043796977910543336, 'sideways_tp_mult': 1.6964921951640932, 'sideways_tsl_mult': 0.2665502908607044, 'sideways_time_stop': 49, 'sideways_use_sma': False, 'sideways_use_ema': True, 'sideways_use_atr': True, 'sideways_use_adx': False, 'sideways_use_spike': False, 'sideways_rsi_required': True}.
[I 2025-08-31 12:22:52,332] Trial 238 finished with values: [-1000000000.0, 1000000000.0] and parameters: {'p_sma': 35, 'p_std': 15, 'p_atr': 11, 'p_adx': 24, 'rsi_period': 72, 'ema1': 10, 'ema2': 59, 'slip_atr_k': 0.02070090961156207, 'slip_spread_k': 0.4065074614697735, 'spread_hl_frac': 0.025260559776257775, 'bb_std_mult': 0.5989130905080728, 'rsi_os': 43, 'rsi_ob': 53, 'vol_spike': 0.1746941551722294, 'adx_thresh': 12.103679730862147, 'atr_min_pct': 0.027000003232316543, 'atr_max_pct': 0.019161862539355735, 'tp_mult': 2.542496467811324, 'tsl_mult': 0.5236261453348083, 'strategy': 'mean_reversion', 'time_stop': 170, 'use_sma': True, 'use_atr': True, 'use_adx': True, 'use_ema': False, 'use_spike': False, 'rsi_required': False, 'edge_k': 1.1416639589727808, 'edge_cap': 0.29229050652176003, 'bull_strategy': 'mean_reversion', 'bull_bb_std_mult': 3.2735221863055752, 'bull_rsi_os': 12, 'bull_rsi_ob': 63, 'bull_adx_thresh': 31.449168645573828, 'bull_atr_min_pct': 0.0007458364483435061, 'bull_atr_max_pct': 0.05553136026000906, 'bull_tp_mult': 2.7663557753098993, 'bull_tsl_mult': 0.00930695711922036, 'bull_time_stop': 72, 'bull_use_sma': False, 'bull_use_ema': False, 'bull_use_atr': False, 'bull_use_adx': True, 'bull_use_spike': True, 'bull_rsi_required': True, 'bear_strategy': 'mean_reversion', 'bear_bb_std_mult': 0.9171821278834957, 'bear_rsi_os': 49, 'bear_rsi_ob': 61, 'bear_adx_thresh': 30.09705590701688, 'bear_atr_min_pct': 0.019916578934094806, 'bear_atr_max_pct': 0.10350176171355542, 'bear_tp_mult': 1.6408648518614677, 'bear_tsl_mult': 0.8592629472740714, 'bear_time_stop': 288, 'bear_use_sma': True, 'bear_use_ema': True, 'bear_use_atr': True, 'bear_use_adx': True, 'bear_use_spike': True, 'bear_rsi_required': False, 'sideways_strategy': 'breakout', 'sideways_bb_std_mult': 1.9736384639492175, 'sideways_rsi_os': 36, 'sideways_rsi_ob': 60, 'sideways_adx_thresh': 8.888613527226777, 'sideways_atr_min_pct': 0.015070084257146725, 'sideways_atr_max_pct': 0.06423647753594341, 'sideways_tp_mult': 1.3009959705452938, 'sideways_tsl_mult': 0.4427695524135318, 'sideways_time_stop': 254, 'sideways_use_sma': False, 'sideways_use_ema': True, 'sideways_use_atr': False, 'sideways_use_adx': True, 'sideways_use_spike': False, 'sideways_rsi_required': True}.
[I 2025-08-31 12:23:24,141] Trial 240 finished with values: [-1000000000.0, 1000000000.0] and parameters: {'p_sma': 35, 'p_std': 16, 'p_atr': 11, 'p_adx': 7, 'rsi_period': 72, 'ema1': 10, 'ema2': 58, 'slip_atr_k': 0.005559814262488499, 'slip_spread_k': 0.850453685899792, 'spread_hl_frac': 0.02137783841307934, 'bb_std_mult': 0.6376619422077188, 'rsi_os': 8, 'rsi_ob': 59, 'vol_spike': 0.18046228881528625, 'adx_thresh': 21.836097059602096, 'atr_min_pct': 0.02776438548928567, 'atr_max_pct': 0.13933045182650508, 'tp_mult': 2.5131010649011807, 'tsl_mult': 0.5276852966780886, 'strategy': 'mean_reversion', 'time_stop': 108, 'use_sma': True, 'use_atr': False, 'use_adx': True, 'use_ema': False, 'use_spike': False, 'rsi_required': False, 'edge_k': 1.110208845971205, 'edge_cap': 0.2952027431503937, 'bull_strategy': 'mean_reversion', 'bull_bb_std_mult': 3.2873395580338527, 'bull_rsi_os': 55, 'bull_rsi_ob': 87, 'bull_adx_thresh': 15.308860358793911, 'bull_atr_min_pct': 0.02684111748156822, 'bull_atr_max_pct': 0.01594234057782996, 'bull_tp_mult': 2.2825992647156856, 'bull_tsl_mult': 0.15059386998269647, 'bull_time_stop': 72, 'bull_use_sma': False, 'bull_use_ema': False, 'bull_use_atr': False, 'bull_use_adx': True, 'bull_use_spike': True, 'bull_rsi_required': False, 'bear_strategy': 'mean_reversion', 'bear_bb_std_mult': 2.275661869231156, 'bear_rsi_os': 50, 'bear_rsi_ob': 61, 'bear_adx_thresh': 34.040176526178236, 'bear_atr_min_pct': 0.01991799183347182, 'bear_atr_max_pct': 0.054209769096035684, 'bear_tp_mult': 1.6438939571147788, 'bear_tsl_mult': 0.8982563420906656, 'bear_time_stop': 86, 'bear_use_sma': True, 'bear_use_ema': False, 'bear_use_atr': True, 'bear_use_adx': True, 'bear_use_spike': True, 'bear_rsi_required': False, 'sideways_strategy': 'breakout', 'sideways_bb_std_mult': 2.071062854142661, 'sideways_rsi_os': 36, 'sideways_rsi_ob': 85, 'sideways_adx_thresh': 9.805477242483905, 'sideways_atr_min_pct': 0.0028788899293190097, 'sideways_atr_max_pct': 0.06404193576594476, 'sideways_tp_mult': 1.3442312889565358, 'sideways_tsl_mult': 0.2388202507390671, 'sideways_time_stop': 177, 'sideways_use_sma': False, 'sideways_use_ema': True, 'sideways_use_atr': False, 'sideways_use_adx': True, 'sideways_use_spike': False, 'sideways_rsi_required': True}.
[I 2025-08-31 12:23:24,489] Trial 237 finished with values: [-0.051999871523060626, 0.05181962016801167] and parameters: {'p_sma': 35, 'p_std': 15, 'p_atr': 11, 'p_adx': 20, 'rsi_period': 71, 'ema1': 10, 'ema2': 37, 'slip_atr_k': 0.024334084840238232, 'slip_spread_k': 0.11351988554110234, 'spread_hl_frac': 0.02577199885049158, 'bb_std_mult': 3.4655957578701244, 'rsi_os': 24, 'rsi_ob': 53, 'vol_spike': 0.11615771806307804, 'adx_thresh': 14.925046621421753, 'atr_min_pct': 0.027816479531559583, 'atr_max_pct': 0.1389487287265999, 'tp_mult': 2.5681667446795973, 'tsl_mult': 0.5233897420277548, 'strategy': 'mean_reversion', 'time_stop': 110, 'use_sma': True, 'use_atr': True, 'use_adx': True, 'use_ema': False, 'use_spike': False, 'rsi_required': False, 'edge_k': 1.6938107898498445, 'edge_cap': 0.5070967893277244, 'bull_strategy': 'mean_reversion', 'bull_bb_std_mult': 1.6983342052115242, 'bull_rsi_os': 13, 'bull_rsi_ob': 82, 'bull_adx_thresh': 20.019830841093338, 'bull_atr_min_pct': 0.02920698058139158, 'bull_atr_max_pct': 0.1466537402740971, 'bull_tp_mult': 2.413454185685912, 'bull_tsl_mult': 0.46482763502626345, 'bull_time_stop': 71, 'bull_use_sma': False, 'bull_use_ema': False, 'bull_use_atr': False, 'bull_use_adx': True, 'bull_use_spike': True, 'bull_rsi_required': True, 'bear_strategy': 'mean_reversion', 'bear_bb_std_mult': 1.6380983340675612, 'bear_rsi_os': 23, 'bear_rsi_ob': 62, 'bear_adx_thresh': 34.27996918631601, 'bear_atr_min_pct': 0.028610553727328777, 'bear_atr_max_pct': 0.10261820871999322, 'bear_tp_mult': 1.6518431833320786, 'bear_tsl_mult': 0.17735951906673847, 'bear_time_stop': 104, 'bear_use_sma': True, 'bear_use_ema': True, 'bear_use_atr': True, 'bear_use_adx': True, 'bear_use_spike': True, 'bear_rsi_required': False, 'sideways_strategy': 'breakout', 'sideways_bb_std_mult': 2.0753632870278658, 'sideways_rsi_os': 53, 'sideways_rsi_ob': 48, 'sideways_adx_thresh': 8.883147436465627, 'sideways_atr_min_pct': 0.0028512702136197225, 'sideways_atr_max_pct': 0.06435174721120679, 'sideways_tp_mult': 2.108765616756426, 'sideways_tsl_mult': 0.44591622881879656, 'sideways_time_stop': 174, 'sideways_use_sma': False, 'sideways_use_ema': True, 'sideways_use_atr': False, 'sideways_use_adx': True, 'sideways_use_spike': False, 'sideways_rsi_required': True}.
[I 2025-08-31 12:23:24,521] Trial 239 finished with values: [-1000000000.0, 1000000000.0] and parameters: {'p_sma': 30, 'p_std': 15, 'p_atr': 11, 'p_adx': 24, 'rsi_period': 72, 'ema1': 10, 'ema2': 47, 'slip_atr_k': 0.09350622387932596, 'slip_spread_k': 0.9282840155159668, 'spread_hl_frac': 0.025492053003138223, 'bb_std_mult': 0.6253344700040744, 'rsi_os': 24, 'rsi_ob': 61, 'vol_spike': 0.06633316088000181, 'adx_thresh': 12.219096398870535, 'atr_min_pct': 0.01664970124372138, 'atr_max_pct': 0.07062611099889717, 'tp_mult': 2.570424610591152, 'tsl_mult': 0.5229012426817476, 'strategy': 'mean_reversion', 'time_stop': 169, 'use_sma': True, 'use_atr': True, 'use_adx': True, 'use_ema': False, 'use_spike': False, 'rsi_required': False, 'edge_k': 1.1515578388029457, 'edge_cap': 0.9967719009331666, 'bull_strategy': 'mean_reversion', 'bull_bb_std_mult': 3.2921243593634326, 'bull_rsi_os': 13, 'bull_rsi_ob': 63, 'bull_adx_thresh': 9.822246357987959, 'bull_atr_min_pct': 0.028194305419629487, 'bull_atr_max_pct': 0.11301451592619546, 'bull_tp_mult': 2.7638732756115627, 'bull_tsl_mult': 0.010564397702744532, 'bull_time_stop': 72, 'bull_use_sma': False, 'bull_use_ema': False, 'bull_use_atr': False, 'bull_use_adx': True, 'bull_use_spike': True, 'bull_rsi_required': True, 'bear_strategy': 'mean_reversion', 'bear_bb_std_mult': 0.9147581370827069, 'bear_rsi_os': 39, 'bear_rsi_ob': 81, 'bear_adx_thresh': 34.309661722712086, 'bear_atr_min_pct': 0.0002908106352621266, 'bear_atr_max_pct': 0.01669299215810656, 'bear_tp_mult': 2.551815852639536, 'bear_tsl_mult': 0.09781546694118326, 'bear_time_stop': 275, 'bear_use_sma': True, 'bear_use_ema': True, 'bear_use_atr': True, 'bear_use_adx': True, 'bear_use_spike': True, 'bear_rsi_required': False, 'sideways_strategy': 'breakout', 'sideways_bb_std_mult': 1.9670390842476706, 'sideways_rsi_os': 36, 'sideways_rsi_ob': 58, 'sideways_adx_thresh': 8.857514837998636, 'sideways_atr_min_pct': 0.01509755462450596, 'sideways_atr_max_pct': 0.06406951068847146, 'sideways_tp_mult': 2.107565308970817, 'sideways_tsl_mult': 0.4382270145470893, 'sideways_time_stop': 257, 'sideways_use_sma': False, 'sideways_use_ema': True, 'sideways_use_atr': False, 'sideways_use_adx': True, 'sideways_use_spike': False, 'sideways_rsi_required': True}.
[I 2025-08-31 12:23:24,722] Trial 241 finished with values: [-0.02081808183642042, 0.020501096966428416] and parameters: {'p_sma': 16, 'p_std': 16, 'p_atr': 11, 'p_adx': 7, 'rsi_period': 40, 'ema1': 6, 'ema2': 44, 'slip_atr_k': 0.005351897232034608, 'slip_spread_k': 0.8735082886955396, 'spread_hl_frac': 4.223410890107776e-06, 'bb_std_mult': 1.0608819209834146, 'rsi_os': 24, 'rsi_ob': 56, 'vol_spike': 0.11813678526682427, 'adx_thresh': 13.157929631308498, 'atr_min_pct': 0.027759079049246783, 'atr_max_pct': 0.07126789685571569, 'tp_mult': 2.510991828044451, 'tsl_mult': 0.5391864440372199, 'strategy': 'mean_reversion', 'time_stop': 102, 'use_sma': True, 'use_atr': False, 'use_adx': True, 'use_ema': False, 'use_spike': True, 'rsi_required': False, 'edge_k': 0.5896786506001708, 'edge_cap': 0.48067566454345373, 'bull_strategy': 'breakout', 'bull_bb_std_mult': 2.836406057346754, 'bull_rsi_os': 13, 'bull_rsi_ob': 79, 'bull_adx_thresh': 9.991193395612392, 'bull_atr_min_pct': 0.029237934567585843, 'bull_atr_max_pct': 0.07780978998268102, 'bull_tp_mult': 1.6299361186621426, 'bull_tsl_mult': 0.8482617256627278, 'bull_time_stop': 72, 'bull_use_sma': False, 'bull_use_ema': False, 'bull_use_atr': False, 'bull_use_adx': True, 'bull_use_spike': True, 'bull_rsi_required': False, 'bear_strategy': 'mean_reversion', 'bear_bb_std_mult': 2.4476027051942792, 'bear_rsi_os': 5, 'bear_rsi_ob': 86, 'bear_adx_thresh': 34.186408215616495, 'bear_atr_min_pct': 0.02860561904062135, 'bear_atr_max_pct': 0.09823424775922812, 'bear_tp_mult': 2.7837328790789835, 'bear_tsl_mult': 0.0998752693081138, 'bear_time_stop': 94, 'bear_use_sma': False, 'bear_use_ema': False, 'bear_use_atr': False, 'bear_use_adx': False, 'bear_use_spike': True, 'bear_rsi_required': False, 'sideways_strategy': 'breakout', 'sideways_bb_std_mult': 2.0680924020486433, 'sideways_rsi_os': 36, 'sideways_rsi_ob': 48, 'sideways_adx_thresh': 23.476668996159283, 'sideways_atr_min_pct': 0.002557929976013733, 'sideways_atr_max_pct': 0.06745582832498252, 'sideways_tp_mult': 1.3511911732189885, 'sideways_tsl_mult': 0.4704958834697368, 'sideways_time_stop': 177, 'sideways_use_sma': False, 'sideways_use_ema': True, 'sideways_use_atr': True, 'sideways_use_adx': True, 'sideways_use_spike': False, 'sideways_rsi_required': True}.
[I 2025-08-31 12:23:25,287] Trial 242 finished with values: [-1000000000.0, 1000000000.0] and parameters: {'p_sma': 59, 'p_std': 16, 'p_atr': 25, 'p_adx': 15, 'rsi_period': 40, 'ema1': 6, 'ema2': 35, 'slip_atr_k': 0.09574068754878105, 'slip_spread_k': 0.11455298520268475, 'spread_hl_frac': 0.02828860649356964, 'bb_std_mult': 1.0619916106031277, 'rsi_os': 42, 'rsi_ob': 45, 'vol_spike': 0.081911426271047, 'adx_thresh': 22.311613969060975, 'atr_min_pct': 0.02644411235254175, 'atr_max_pct': 0.07100448594335008, 'tp_mult': 2.5828704298004608, 'tsl_mult': 0.6653332511471284, 'strategy': 'mean_reversion', 'time_stop': 93, 'use_sma': True, 'use_atr': False, 'use_adx': True, 'use_ema': False, 'use_spike': True, 'rsi_required': True, 'edge_k': 1.1720888700945975, 'edge_cap': 0.8502627376721268, 'bull_strategy': 'breakout', 'bull_bb_std_mult': 3.364597800828192, 'bull_rsi_os': 13, 'bull_rsi_ob': 79, 'bull_adx_thresh': 19.917905185087882, 'bull_atr_min_pct': 0.01232919641000969, 'bull_atr_max_pct': 0.1467488709262106, 'bull_tp_mult': 2.725907764705037, 'bull_tsl_mult': 0.5818575776809586, 'bull_time_stop': 85, 'bull_use_sma': True, 'bull_use_ema': True, 'bull_use_atr': False, 'bull_use_adx': True, 'bull_use_spike': False, 'bull_rsi_required': True, 'bear_strategy': 'mean_reversion', 'bear_bb_std_mult': 2.4085789447676595, 'bear_rsi_os': 5, 'bear_rsi_ob': 94, 'bear_adx_thresh': 33.114356069965034, 'bear_atr_min_pct': 0.028612098351510407, 'bear_atr_max_pct': 0.034411116360195365, 'bear_tp_mult': 2.5391990109544027, 'bear_tsl_mult': 0.20361927704575572, 'bear_time_stop': 277, 'bear_use_sma': False, 'bear_use_ema': False, 'bear_use_atr': False, 'bear_use_adx': False, 'bear_use_spike': True, 'bear_rsi_required': False, 'sideways_strategy': 'breakout', 'sideways_bb_std_mult': 3.5298397915269435, 'sideways_rsi_os': 22, 'sideways_rsi_ob': 48, 'sideways_adx_thresh': 8.407802665215353, 'sideways_atr_min_pct': 0.000595035880454248, 'sideways_atr_max_pct': 0.067796132529438, 'sideways_tp_mult': 1.980329465868877, 'sideways_tsl_mult': 0.5855667053061602, 'sideways_time_stop': 194, 'sideways_use_sma': False, 'sideways_use_ema': True, 'sideways_use_atr': True, 'sideways_use_adx': False, 'sideways_use_spike': False, 'sideways_rsi_required': True}.
