[I 2025-08-31 12:08:51,034] Trial 126 finished with values: [-1000000000.0, 1000000000.0] and parameters: {'p_sma': 36, 'p_std': 55, 'p_atr': 21, 'p_adx': 12, 'rsi_period': 7, 'ema1': 28, 'ema2': 50, 'slip_atr_k': 0.101430758396037, 'slip_spread_k': 0.05839169594590249, 'spread_hl_frac': 0.049542334226623394, 'bb_std_mult': 0.9990279570357852, 'rsi_os': 55, 'rsi_ob': 62, 'vol_spike': 0.06537138573559721, 'adx_thresh': 24.330460520494267, 'atr_min_pct': 0.0035760036370835694, 'atr_max_pct': 0.142563665407819, 'tp_mult': 2.809098204009905, 'tsl_mult': 0.7130152408462862, 'strategy': 'mean_reversion', 'time_stop': 106, 'use_sma': True, 'use_atr': True, 'use_adx': False, 'use_ema': False, 'use_spike': True, 'rsi_required': False, 'edge_k': 0.7830016596243309, 'edge_cap': 0.2867171987645344, 'bull_strategy': 'mean_reversion', 'bull_bb_std_mult': 3.1666065150229405, 'bull_rsi_os': 10, 'bull_rsi_ob': 93, 'bull_adx_thresh': 7.629074118353355, 'bull_atr_min_pct': 0.0229382422192345, 'bull_atr_max_pct': 0.045116915826327326, 'bull_tp_mult': 2.615803178316752, 'bull_tsl_mult': 0.27505214745255757, 'bull_time_stop': 59, 'bull_use_sma': True, 'bull_use_ema': False, 'bull_use_atr': False, 'bull_use_adx': True, 'bull_use_spike': False, 'bull_rsi_required': True, 'bear_strategy': 'mean_reversion', 'bear_bb_std_mult': 1.7329814109683825, 'bear_rsi_os': 22, 'bear_rsi_ob': 46, 'bear_adx_thresh': 33.79849617473358, 'bear_atr_min_pct': 0.029453846463841644, 'bear_atr_max_pct': 0.10059327739358331, 'bear_tp_mult': 1.9323657924769473, 'bear_tsl_mult': 0.035817725009249624, 'bear_time_stop': 49, 'bear_use_sma': False, 'bear_use_ema': False, 'bear_use_atr': False, 'bear_use_adx': False, 'bear_use_spike': True, 'bear_rsi_required': False, 'sideways_strategy': 'breakout', 'sideways_bb_std_mult': 2.032990020199088, 'sideways_rsi_os': 36, 'sideways_rsi_ob': 46, 'sideways_adx_thresh': 10.778619751595539, 'sideways_atr_min_pct': 0.004158615331319065, 'sideways_atr_max_pct': 0.06936375375637462, 'sideways_tp_mult': 1.609812598988844, 'sideways_tsl_mult': 0.8347451790990443, 'sideways_time_stop': 279, 'sideways_use_sma': True, 'sideways_use_ema': True, 'sideways_use_atr': True, 'sideways_use_adx': False, 'sideways_use_spike': False, 'sideways_rsi_required': True}.
[I 2025-08-31 12:08:51,147] Trial 129 finished with values: [-1000000000.0, 1000000000.0] and parameters: {'p_sma': 32, 'p_std': 49, 'p_atr': 21, 'p_adx': 13, 'rsi_period': 32, 'ema1': 7, 'ema2': 20, 'slip_atr_k': 0.10459048354862013, 'slip_spread_k': 0.058439079193992535, 'spread_hl_frac': 0.03874108981578181, 'bb_std_mult': 1.9908132937742467, 'rsi_os': 54, 'rsi_ob': 62, 'vol_spike': 0.10754754705866978, 'adx_thresh': 8.199332126833072, 'atr_min_pct': 0.028853074625811638, 'atr_max_pct': 0.1108789838286872, 'tp_mult': 2.640911779852152, 'tsl_mult': 0.6173535000562849, 'strategy': 'mean_reversion', 'time_stop': 107, 'use_sma': True, 'use_atr': True, 'use_adx': False, 'use_ema': False, 'use_spike': True, 'rsi_required': False, 'edge_k': 1.2213403495765465, 'edge_cap': 0.18057332794546987, 'bull_strategy': 'mean_reversion', 'bull_bb_std_mult': 2.557133137976277, 'bull_rsi_os': 43, 'bull_rsi_ob': 58, 'bull_adx_thresh': 25.504281357893763, 'bull_atr_min_pct': 0.0011670588623354117, 'bull_atr_max_pct': 0.02456474300168219, 'bull_tp_mult': 2.5450570942435857, 'bull_tsl_mult': 0.27024340231843524, 'bull_time_stop': 150, 'bull_use_sma': True, 'bull_use_ema': False, 'bull_use_atr': True, 'bull_use_adx': True, 'bull_use_spike': False, 'bull_rsi_required': True, 'bear_strategy': 'mean_reversion', 'bear_bb_std_mult': 1.7569248503144212, 'bear_rsi_os': 30, 'bear_rsi_ob': 93, 'bear_adx_thresh': 13.519654798759557, 'bear_atr_min_pct': 0.028612214999028746, 'bear_atr_max_pct': 0.10137135763949873, 'bear_tp_mult': 1.939301341524214, 'bear_tsl_mult': 0.3856579674587752, 'bear_time_stop': 50, 'bear_use_sma': False, 'bear_use_ema': False, 'bear_use_atr': False, 'bear_use_adx': False, 'bear_use_spike': True, 'bear_rsi_required': False, 'sideways_strategy': 'breakout', 'sideways_bb_std_mult': 1.7168369163911814, 'sideways_rsi_os': 36, 'sideways_rsi_ob': 51, 'sideways_adx_thresh': 7.792457897922569, 'sideways_atr_min_pct': 0.01261370456139792, 'sideways_atr_max_pct': 0.05480412028608596, 'sideways_tp_mult': 1.4907944660864516, 'sideways_tsl_mult': 0.6741183060351987, 'sideways_time_stop': 180, 'sideways_use_sma': True, 'sideways_use_ema': True, 'sideways_use_atr': True, 'sideways_use_adx': False, 'sideways_use_spike': False, 'sideways_rsi_required': True}.
[I 2025-08-31 12:09:18,278] Trial 127 finished with values: [-0.04100124027534313, 0.0408753430269847] and parameters: {'p_sma': 32, 'p_std': 33, 'p_atr': 25, 'p_adx': 27, 'rsi_period': 29, 'ema1': 19, 'ema2': 24, 'slip_atr_k': 0.09873381217216352, 'slip_spread_k': 0.06541052519978147, 'spread_hl_frac': 0.023683693052755098, 'bb_std_mult': 1.00308414015268, 'rsi_os': 37, 'rsi_ob': 57, 'vol_spike': 0.05136774991166597, 'adx_thresh': 7.0008759744870215, 'atr_min_pct': 0.003806819814842958, 'atr_max_pct': 0.13528022591939137, 'tp_mult': 2.800811016303748, 'tsl_mult': 0.3454601150532006, 'strategy': 'mean_reversion', 'time_stop': 107, 'use_sma': True, 'use_atr': True, 'use_adx': False, 'use_ema': False, 'use_spike': True, 'rsi_required': False, 'edge_k': 1.1762104033516239, 'edge_cap': 0.2860724673999631, 'bull_strategy': 'mean_reversion', 'bull_bb_std_mult': 3.1574579344161737, 'bull_rsi_os': 16, 'bull_rsi_ob': 51, 'bull_adx_thresh': 11.02944160891205, 'bull_atr_min_pct': 0.001705425507466208, 'bull_atr_max_pct': 0.023676789746301795, 'bull_tp_mult': 2.557135055823933, 'bull_tsl_mult': 0.27238060301084815, 'bull_time_stop': 65, 'bull_use_sma': True, 'bull_use_ema': False, 'bull_use_atr': False, 'bull_use_adx': True, 'bull_use_spike': False, 'bull_rsi_required': False, 'bear_strategy': 'mean_reversion', 'bear_bb_std_mult': 1.6271643331764165, 'bear_rsi_os': 22, 'bear_rsi_ob': 56, 'bear_adx_thresh': 33.460792561396815, 'bear_atr_min_pct': 0.029001673128500494, 'bear_atr_max_pct': 0.10101905871527413, 'bear_tp_mult': 1.0746150028963215, 'bear_tsl_mult': 0.37930894471284304, 'bear_time_stop': 232, 'bear_use_sma': False, 'bear_use_ema': False, 'bear_use_atr': False, 'bear_use_adx': False, 'bear_use_spike': True, 'bear_rsi_required': False, 'sideways_strategy': 'breakout', 'sideways_bb_std_mult': 2.0241965269467728, 'sideways_rsi_os': 36, 'sideways_rsi_ob': 52, 'sideways_adx_thresh': 7.814820413701346, 'sideways_atr_min_pct': 0.003999835470017225, 'sideways_atr_max_pct': 0.06194989956302629, 'sideways_tp_mult': 1.4907775751775252, 'sideways_tsl_mult': 0.4544038095518721, 'sideways_time_stop': 174, 'sideways_use_sma': True, 'sideways_use_ema': True, 'sideways_use_atr': True, 'sideways_use_adx': False, 'sideways_use_spike': False, 'sideways_rsi_required': True}.
[I 2025-08-31 12:09:19,566] Trial 128 finished with values: [-1000000000.0, 1000000000.0] and parameters: {'p_sma': 35, 'p_std': 32, 'p_atr': 12, 'p_adx': 13, 'rsi_period': 10, 'ema1': 28, 'ema2': 33, 'slip_atr_k': 0.10158354306571017, 'slip_spread_k': 0.22558821824328243, 'spread_hl_frac': 0.048824252951475515, 'bb_std_mult': 1.8246194723883473, 'rsi_os': 5, 'rsi_ob': 57, 'vol_spike': 0.021723340731997526, 'adx_thresh': 7.466684630538731, 'atr_min_pct': 0.003907086493217518, 'atr_max_pct': 0.0934417106537569, 'tp_mult': 2.6333188990687217, 'tsl_mult': 0.3377111436063626, 'strategy': 'mean_reversion', 'time_stop': 106, 'use_sma': True, 'use_atr': True, 'use_adx': False, 'use_ema': False, 'use_spike': True, 'rsi_required': False, 'edge_k': 1.2248048938361507, 'edge_cap': 0.17642361265871176, 'bull_strategy': 'mean_reversion', 'bull_bb_std_mult': 3.1292049230797128, 'bull_rsi_os': 12, 'bull_rsi_ob': 50, 'bull_adx_thresh': 6.266701008719959, 'bull_atr_min_pct': 0.022689322984997012, 'bull_atr_max_pct': 0.04920337524838156, 'bull_tp_mult': 2.5563389541352386, 'bull_tsl_mult': 0.27400802420276565, 'bull_time_stop': 59, 'bull_use_sma': True, 'bull_use_ema': False, 'bull_use_atr': False, 'bull_use_adx': True, 'bull_use_spike': False, 'bull_rsi_required': True, 'bear_strategy': 'mean_reversion', 'bear_bb_std_mult': 1.73191542373616, 'bear_rsi_os': 22, 'bear_rsi_ob': 45, 'bear_adx_thresh': 33.70810042731343, 'bear_atr_min_pct': 0.007187182219671087, 'bear_atr_max_pct': 0.10154619611768595, 'bear_tp_mult': 1.0477624101457197, 'bear_tsl_mult': 0.026378603499625286, 'bear_time_stop': 47, 'bear_use_sma': False, 'bear_use_ema': False, 'bear_use_atr': False, 'bear_use_adx': False, 'bear_use_spike': True, 'bear_rsi_required': False, 'sideways_strategy': 'breakout', 'sideways_bb_std_mult': 2.0037992464975165, 'sideways_rsi_os': 36, 'sideways_rsi_ob': 64, 'sideways_adx_thresh': 8.163957532828917, 'sideways_atr_min_pct': 0.01250112759690309, 'sideways_atr_max_pct': 0.06195994596816109, 'sideways_tp_mult': 2.422651270314004, 'sideways_tsl_mult': 0.6994266764732922, 'sideways_time_stop': 155, 'sideways_use_sma': True, 'sideways_use_ema': True, 'sideways_use_atr': True, 'sideways_use_adx': False, 'sideways_use_spike': False, 'sideways_rsi_required': True}.
[I 2025-08-31 12:09:20,362] Trial 130 finished with values: [-0.04509311481830447, 0.045311917626128496] and parameters: {'p_sma': 32, 'p_std': 20, 'p_atr': 12, 'p_adx': 14, 'rsi_period': 10, 'ema1': 20, 'ema2': 32, 'slip_atr_k': 0.23168210420941965, 'slip_spread_k': 0.24133505453528553, 'spread_hl_frac': 0.023755586883245423, 'bb_std_mult': 0.8957036070338702, 'rsi_os': 5, 'rsi_ob': 57, 'vol_spike': 0.021332019064447594, 'adx_thresh': 23.398967278455565, 'atr_min_pct': 0.02702040293697217, 'atr_max_pct': 0.07931674519684088, 'tp_mult': 2.646882249039392, 'tsl_mult': 0.3690662874287619, 'strategy': 'mean_reversion', 'time_stop': 93, 'use_sma': True, 'use_atr': False, 'use_adx': True, 'use_ema': False, 'use_spike': True, 'rsi_required': False, 'edge_k': 1.056575838477742, 'edge_cap': 0.17026245875414545, 'bull_strategy': 'mean_reversion', 'bull_bb_std_mult': 2.584095561640625, 'bull_rsi_os': 15, 'bull_rsi_ob': 51, 'bull_adx_thresh': 20.321356095351543, 'bull_atr_min_pct': 0.0022446074549422237, 'bull_atr_max_pct': 0.13594489283826872, 'bull_tp_mult': 2.5350191131073623, 'bull_tsl_mult': 0.3223205968936169, 'bull_time_stop': 146, 'bull_use_sma': False, 'bull_use_ema': False, 'bull_use_atr': True, 'bull_use_adx': True, 'bull_use_spike': False, 'bull_rsi_required': True, 'bear_strategy': 'mean_reversion', 'bear_bb_std_mult': 1.499663585855523, 'bear_rsi_os': 32, 'bear_rsi_ob': 93, 'bear_adx_thresh': 13.840084994102504, 'bear_atr_min_pct': 0.02502668587160088, 'bear_atr_max_pct': 0.02681336269452289, 'bear_tp_mult': 1.045492704487669, 'bear_tsl_mult': 0.3999662855010353, 'bear_time_stop': 116, 'bear_use_sma': False, 'bear_use_ema': False, 'bear_use_atr': False, 'bear_use_adx': False, 'bear_use_spike': True, 'bear_rsi_required': False, 'sideways_strategy': 'breakout', 'sideways_bb_std_mult': 1.6331854599778788, 'sideways_rsi_os': 35, 'sideways_rsi_ob': 64, 'sideways_adx_thresh': 8.007591774053196, 'sideways_atr_min_pct': 0.016077959484310473, 'sideways_atr_max_pct': 0.04832456544095873, 'sideways_tp_mult': 2.411639856147828, 'sideways_tsl_mult': 0.6981776736960181, 'sideways_time_stop': 153, 'sideways_use_sma': False, 'sideways_use_ema': True, 'sideways_use_atr': True, 'sideways_use_adx': False, 'sideways_use_spike': False, 'sideways_rsi_required': True}.
[I 2025-08-31 12:09:20,925] Trial 131 finished with values: [-0.054253550192700284, 0.054063872146773516] and parameters: {'p_sma': 28, 'p_std': 13, 'p_atr': 12, 'p_adx': 14, 'rsi_period': 18, 'ema1': 9, 'ema2': 37, 'slip_atr_k': 0.16630503749522024, 'slip_spread_k': 0.2044548223878212, 'spread_hl_frac': 0.047800172669094344, 'bb_std_mult': 2.1646600686929705, 'rsi_os': 43, 'rsi_ob': 60, 'vol_spike': 0.05263374094573252, 'adx_thresh': 18.42457034262096, 'atr_min_pct': 0.026987621214422247, 'atr_max_pct': 0.13632961275538094, 'tp_mult': 2.508351234984771, 'tsl_mult': 0.956030205440086, 'strategy': 'mean_reversion', 'time_stop': 94, 'use_sma': True, 'use_atr': False, 'use_adx': True, 'use_ema': False, 'use_spike': True, 'rsi_required': False, 'edge_k': 1.0452314772223184, 'edge_cap': 0.8727450197193899, 'bull_strategy': 'mean_reversion', 'bull_bb_std_mult': 0.6156710941507568, 'bull_rsi_os': 37, 'bull_rsi_ob': 49, 'bull_adx_thresh': 10.934499823327194, 'bull_atr_min_pct': 0.02350231420997625, 'bull_atr_max_pct': 0.08197587956091178, 'bull_tp_mult': 2.7799942901195807, 'bull_tsl_mult': 0.32978847981370907, 'bull_time_stop': 106, 'bull_use_sma': False, 'bull_use_ema': False, 'bull_use_atr': False, 'bull_use_adx': True, 'bull_use_spike': False, 'bull_rsi_required': True, 'bear_strategy': 'mean_reversion', 'bear_bb_std_mult': 1.5094693413975533, 'bear_rsi_os': 32, 'bear_rsi_ob': 65, 'bear_adx_thresh': 34.98810548166816, 'bear_atr_min_pct': 0.025395696772386282, 'bear_atr_max_pct': 0.13420835366583078, 'bear_tp_mult': 1.0796966843920535, 'bear_tsl_mult': 0.35519158675309315, 'bear_time_stop': 283, 'bear_use_sma': False, 'bear_use_ema': False, 'bear_use_atr': False, 'bear_use_adx': False, 'bear_use_spike': True, 'bear_rsi_required': False, 'sideways_strategy': 'breakout', 'sideways_bb_std_mult': 2.699255268121312, 'sideways_rsi_os': 54, 'sideways_rsi_ob': 75, 'sideways_adx_thresh': 8.727458761774207, 'sideways_atr_min_pct': 0.0031204392780236267, 'sideways_atr_max_pct': 0.026290743297908634, 'sideways_tp_mult': 2.5766452917008644, 'sideways_tsl_mult': 0.7827123668421825, 'sideways_time_stop': 154, 'sideways_use_sma': False, 'sideways_use_ema': True, 'sideways_use_atr': True, 'sideways_use_adx': False, 'sideways_use_spike': False, 'sideways_rsi_required': True}.
[I 2025-08-31 12:09:49,933] Trial 135 finished with values: [-1000000000.0, 1000000000.0] and parameters: {'p_sma': 23, 'p_std': 20, 'p_atr': 11, 'p_adx': 15, 'rsi_period': 73, 'ema1': 19, 'ema2': 36, 'slip_atr_k': 0.08406579854907717, 'slip_spread_k': 0.03786410748763766, 'spread_hl_frac': 0.03160964403982756, 'bb_std_mult': 0.9016828203845604, 'rsi_os': 40, 'rsi_ob': 71, 'vol_spike': 0.2591604144217621, 'adx_thresh': 22.26796839664123, 'atr_min_pct': 0.009736711503764487, 'atr_max_pct': 0.07867733657604652, 'tp_mult': 1.5775407773235806, 'tsl_mult': 0.37150392767132956, 'strategy': 'mean_reversion', 'time_stop': 132, 'use_sma': True, 'use_atr': False, 'use_adx': True, 'use_ema': False, 'use_spike': True, 'rsi_required': False, 'edge_k': 1.8248096522264168, 'edge_cap': 0.3259187155886063, 'bull_strategy': 'mean_reversion', 'bull_bb_std_mult': 2.3403426259131788, 'bull_rsi_os': 34, 'bull_rsi_ob': 45, 'bull_adx_thresh': 8.267260198989497, 'bull_atr_min_pct': 0.0030323416707830845, 'bull_atr_max_pct': 0.13803641250192666, 'bull_tp_mult': 2.8910211698346275, 'bull_tsl_mult': 0.6110168731266883, 'bull_time_stop': 127, 'bull_use_sma': False, 'bull_use_ema': False, 'bull_use_atr': True, 'bull_use_adx': True, 'bull_use_spike': False, 'bull_rsi_required': True, 'bear_strategy': 'mean_reversion', 'bear_bb_std_mult': 3.042293626343175, 'bear_rsi_os': 53, 'bear_rsi_ob': 51, 'bear_adx_thresh': 32.61483790813884, 'bear_atr_min_pct': 0.026227377500477204, 'bear_atr_max_pct': 0.10722999909768169, 'bear_tp_mult': 1.1813364769285861, 'bear_tsl_mult': 0.22954110739814287, 'bear_time_stop': 256, 'bear_use_sma': False, 'bear_use_ema': False, 'bear_use_atr': False, 'bear_use_adx': False, 'bear_use_spike': True, 'bear_rsi_required': False, 'sideways_strategy': 'breakout', 'sideways_bb_std_mult': 2.492572567547659, 'sideways_rsi_os': 21, 'sideways_rsi_ob': 61, 'sideways_adx_thresh': 12.355775001254813, 'sideways_atr_min_pct': 0.010951395757346187, 'sideways_atr_max_pct': 0.07342486112634183, 'sideways_tp_mult': 1.453861008868191, 'sideways_tsl_mult': 0.4289606604232006, 'sideways_time_stop': 26, 'sideways_use_sma': False, 'sideways_use_ema': True, 'sideways_use_atr': True, 'sideways_use_adx': False, 'sideways_use_spike': False, 'sideways_rsi_required': True}.
[I 2025-08-31 12:09:50,142] Trial 132 finished with values: [-0.04469922877590671, 0.04434525615592636] and parameters: {'p_sma': 29, 'p_std': 13, 'p_atr': 25, 'p_adx': 27, 'rsi_period': 29, 'ema1': 20, 'ema2': 33, 'slip_atr_k': 0.19354884749779327, 'slip_spread_k': 0.2211628707010901, 'spread_hl_frac': 0.03556856817927667, 'bb_std_mult': 0.8785705071077322, 'rsi_os': 43, 'rsi_ob': 57, 'vol_spike': 0.25973809405927784, 'adx_thresh': 22.40119908483432, 'atr_min_pct': 0.026877716552705072, 'atr_max_pct': 0.07825734701385495, 'tp_mult': 1.5951618309476663, 'tsl_mult': 0.4139714190478664, 'strategy': 'mean_reversion', 'time_stop': 131, 'use_sma': True, 'use_atr': False, 'use_adx': True, 'use_ema': False, 'use_spike': True, 'rsi_required': False, 'edge_k': 1.0619840513481034, 'edge_cap': 0.8787610852727272, 'bull_strategy': 'mean_reversion', 'bull_bb_std_mult': 3.4860107924683708, 'bull_rsi_os': 35, 'bull_rsi_ob': 83, 'bull_adx_thresh': 10.97656584130253, 'bull_atr_min_pct': 0.002919766722092921, 'bull_atr_max_pct': 0.08210043644269913, 'bull_tp_mult': 2.786434480264996, 'bull_tsl_mult': 0.2211901572589391, 'bull_time_stop': 123, 'bull_use_sma': False, 'bull_use_ema': False, 'bull_use_atr': False, 'bull_use_adx': True, 'bull_use_spike': False, 'bull_rsi_required': True, 'bear_strategy': 'mean_reversion', 'bear_bb_std_mult': 0.7304327617684361, 'bear_rsi_os': 23, 'bear_rsi_ob': 64, 'bear_adx_thresh': 34.38149307762875, 'bear_atr_min_pct': 0.02641454859215549, 'bear_atr_max_pct': 0.1348274758716547, 'bear_tp_mult': 1.056621660503012, 'bear_tsl_mult': 0.34512340280469767, 'bear_time_stop': 220, 'bear_use_sma': False, 'bear_use_ema': False, 'bear_use_atr': False, 'bear_use_adx': False, 'bear_use_spike': True, 'bear_rsi_required': False, 'sideways_strategy': 'breakout', 'sideways_bb_std_mult': 2.5040762363340603, 'sideways_rsi_os': 31, 'sideways_rsi_ob': 62, 'sideways_adx_thresh': 8.550817796414917, 'sideways_atr_min_pct': 0.0034020740176925867, 'sideways_atr_max_pct': 0.019620461369280688, 'sideways_tp_mult': 2.57946233689342, 'sideways_tsl_mult': 0.742222099918223, 'sideways_time_stop': 157, 'sideways_use_sma': False, 'sideways_use_ema': True, 'sideways_use_atr': True, 'sideways_use_adx': False, 'sideways_use_spike': False, 'sideways_rsi_required': True}.
[I 2025-08-31 12:09:50,311] Trial 133 finished with values: [-0.12489993747809891, 0.12460330712943823] and parameters: {'p_sma': 30, 'p_std': 15, 'p_atr': 10, 'p_adx': 14, 'rsi_period': 25, 'ema1': 9, 'ema2': 38, 'slip_atr_k': 0.18942897503768413, 'slip_spread_k': 0.2683181723073116, 'spread_hl_frac': 0.0358914873255089, 'bb_std_mult': 1.0532678478292112, 'rsi_os': 43, 'rsi_ob': 60, 'vol_spike': 0.26201971962165593, 'adx_thresh': 22.519911362241658, 'atr_min_pct': 0.01068489293071715, 'atr_max_pct': 0.07806905121531404, 'tp_mult': 2.5011283421660098, 'tsl_mult': 0.41500272693292, 'strategy': 'mean_reversion', 'time_stop': 90, 'use_sma': True, 'use_atr': False, 'use_adx': True, 'use_ema': False, 'use_spike': True, 'rsi_required': False, 'edge_k': 1.1424684301171566, 'edge_cap': 0.3296958407276594, 'bull_strategy': 'mean_reversion', 'bull_bb_std_mult': 2.9765310170303345, 'bull_rsi_os': 37, 'bull_rsi_ob': 83, 'bull_adx_thresh': 10.929020448158578, 'bull_atr_min_pct': 0.0021000825575464045, 'bull_atr_max_pct': 0.02081099145829219, 'bull_tp_mult': 2.1068276927029803, 'bull_tsl_mult': 0.32802010252881997, 'bull_time_stop': 106, 'bull_use_sma': False, 'bull_use_ema': False, 'bull_use_atr': True, 'bull_use_adx': True, 'bull_use_spike': False, 'bull_rsi_required': True, 'bear_strategy': 'mean_reversion', 'bear_bb_std_mult': 1.4912122088544586, 'bear_rsi_os': 54, 'bear_rsi_ob': 65, 'bear_adx_thresh': 34.95556091883599, 'bear_atr_min_pct': 0.026338137570688307, 'bear_atr_max_pct': 0.13395269356202916, 'bear_tp_mult': 1.1839700093485228, 'bear_tsl_mult': 0.23256410654312148, 'bear_time_stop': 98, 'bear_use_sma': False, 'bear_use_ema': False, 'bear_use_atr': False, 'bear_use_adx': False, 'bear_use_spike': True, 'bear_rsi_required': False, 'sideways_strategy': 'breakout', 'sideways_bb_std_mult': 3.513541954032458, 'sideways_rsi_os': 54, 'sideways_rsi_ob': 73, 'sideways_adx_thresh': 12.417176881193203, 'sideways_atr_min_pct': 0.0030164058528387196, 'sideways_atr_max_pct': 0.027912698501372533, 'sideways_tp_mult': 1.4014998531913339, 'sideways_tsl_mult': 0.4263509119008331, 'sideways_time_stop': 300, 'sideways_use_sma': False, 'sideways_use_ema': True, 'sideways_use_atr': True, 'sideways_use_adx': False, 'sideways_use_spike': False, 'sideways_rsi_required': True}.
