[I 2025-09-01 14:32:12,385] Trial 254 finished with values: [-1000000000.0, 1000000000.0] and parameters: {'p_sma': 10, 'p_std': 20, 'p_atr': 21, 'p_adx': 27, 'rsi_period': 22, 'ema1': 25, 'ema2': 52, 'slip_atr_k': 0.02290682588157284, 'slip_spread_k': 0.19831773582612372, 'spread_hl_frac': 0.04803865645996112, 'bb_std_mult': 1.9568460845136566, 'rsi_os': 35, 'rsi_ob': 82, 'vol_spike': 0.2945059972217328, 'adx_thresh': 16.136563594859297, 'atr_min_pct': 0.0162722778756237, 'atr_max_pct': 0.07578298426834512, 'tp_mult': 1.5574935548152977, 'tsl_mult': 0.04226231463891833, 'strategy': 'breakout', 'time_stop': 157, 'use_sma': False, 'use_atr': True, 'use_adx': True, 'use_ema': False, 'use_spike': True, 'rsi_required': False, 'edge_k': 0.4171147697642495, 'edge_cap': 0.2518760126582847, 'bull_strategy': 'breakout', 'bull_bb_std_mult': 3.0509849033620653, 'bull_rsi_os': 16, 'bull_rsi_ob': 74, 'bull_adx_thresh': 10.582979241618016, 'bull_atr_min_pct': 0.014771651594990994, 'bull_atr_max_pct': 0.14046390945923537, 'bull_tp_mult': 2.0674152849532894, 'bull_tsl_mult': 0.3818948131109742, 'bull_time_stop': 155, 'bull_use_sma': True, 'bull_use_ema': False, 'bull_use_atr': False, 'bull_use_adx': True, 'bull_use_spike': False, 'bull_rsi_required': True, 'bear_strategy': 'mean_reversion', 'bear_bb_std_mult': 2.547121431583622, 'bear_rsi_os': 37, 'bear_rsi_ob': 77, 'bear_adx_thresh': 26.64231254311442, 'bear_atr_min_pct': 0.02388262075195871, 'bear_atr_max_pct': 0.03466591443217118, 'bear_tp_mult': 1.1271959404944671, 'bear_tsl_mult': 0.6134131780508191, 'bear_time_stop': 66, 'bear_use_sma': False, 'bear_use_ema': False, 'bear_use_atr': False, 'bear_use_adx': True, 'bear_use_spike': False, 'bear_rsi_required': False, 'sideways_strategy': 'mean_reversion', 'sideways_bb_std_mult': 3.5940244459026323, 'sideways_rsi_os': 10, 'sideways_rsi_ob': 92, 'sideways_adx_thresh': 17.238073769589004, 'sideways_atr_min_pct': 0.01575329532369618, 'sideways_atr_max_pct': 0.020302868121904537, 'sideways_tp_mult': 1.2093469913576258, 'sideways_tsl_mult': 0.34805520137404294, 'sideways_time_stop': 52, 'sideways_use_sma': False, 'sideways_use_ema': False, 'sideways_use_atr': True, 'sideways_use_adx': False, 'sideways_use_spike': True, 'sideways_rsi_required': True}.
[I 2025-09-01 14:32:12,798] Trial 252 finished with values: [-1000000000.0, 1000000000.0] and parameters: {'p_sma': 13, 'p_std': 60, 'p_atr': 20, 'p_adx': 26, 'rsi_period': 63, 'ema1': 30, 'ema2': 52, 'slip_atr_k': 0.048363332075704694, 'slip_spread_k': 0.24864779446454685, 'spread_hl_frac': 0.013493169682269563, 'bb_std_mult': 1.3757599948535575, 'rsi_os': 35, 'rsi_ob': 76, 'vol_spike': 0.29543334607006655, 'adx_thresh': 15.850061537993142, 'atr_min_pct': 0.014850339494484204, 'atr_max_pct': 0.06891563927128672, 'tp_mult': 2.0463858122458976, 'tsl_mult': 0.03847553357923726, 'strategy': 'breakout', 'time_stop': 157, 'use_sma': False, 'use_atr': True, 'use_adx': True, 'use_ema': False, 'use_spike': True, 'rsi_required': False, 'edge_k': 0.5541171278422821, 'edge_cap': 0.4334264192834097, 'bull_strategy': 'breakout', 'bull_bb_std_mult': 1.7660833746550617, 'bull_rsi_os': 45, 'bull_rsi_ob': 50, 'bull_adx_thresh': 11.790418626348584, 'bull_atr_min_pct': 0.023214346886451895, 'bull_atr_max_pct': 0.02141292031931252, 'bull_tp_mult': 2.0522294338485754, 'bull_tsl_mult': 0.38182341527911823, 'bull_time_stop': 255, 'bull_use_sma': True, 'bull_use_ema': False, 'bull_use_atr': False, 'bull_use_adx': True, 'bull_use_spike': False, 'bull_rsi_required': False, 'bear_strategy': 'mean_reversion', 'bear_bb_std_mult': 3.0371688675124306, 'bear_rsi_os': 37, 'bear_rsi_ob': 77, 'bear_adx_thresh': 28.44355998102197, 'bear_atr_min_pct': 0.02394274083342528, 'bear_atr_max_pct': 0.04832638325867493, 'bear_tp_mult': 2.039968913885721, 'bear_tsl_mult': 0.6461048962647353, 'bear_time_stop': 278, 'bear_use_sma': False, 'bear_use_ema': False, 'bear_use_atr': False, 'bear_use_adx': True, 'bear_use_spike': False, 'bear_rsi_required': False, 'sideways_strategy': 'mean_reversion', 'sideways_bb_std_mult': 3.5921650355787564, 'sideways_rsi_os': 10, 'sideways_rsi_ob': 91, 'sideways_adx_thresh': 7.46614093425246, 'sideways_atr_min_pct': 0.0073114384793791076, 'sideways_atr_max_pct': 0.1358532187322755, 'sideways_tp_mult': 1.8551736002013872, 'sideways_tsl_mult': 0.023467824743204024, 'sideways_time_stop': 203, 'sideways_use_sma': False, 'sideways_use_ema': False, 'sideways_use_atr': True, 'sideways_use_adx': False, 'sideways_use_spike': True, 'sideways_rsi_required': True}.
[I 2025-09-01 14:32:13,162] Trial 255 finished with values: [-1000000000.0, 1000000000.0] and parameters: {'p_sma': 26, 'p_std': 7, 'p_atr': 13, 'p_adx': 26, 'rsi_period': 65, 'ema1': 25, 'ema2': 51, 'slip_atr_k': 0.1200285207521605, 'slip_spread_k': 0.9860505842634323, 'spread_hl_frac': 0.012916014542256122, 'bb_std_mult': 1.5278361045385018, 'rsi_os': 39, 'rsi_ob': 47, 'vol_spike': 0.2714042947938018, 'adx_thresh': 19.58703057666873, 'atr_min_pct': 0.01478809710458931, 'atr_max_pct': 0.06118182491461839, 'tp_mult': 2.851299283169309, 'tsl_mult': 0.03505090579095703, 'strategy': 'breakout', 'time_stop': 250, 'use_sma': False, 'use_atr': True, 'use_adx': True, 'use_ema': False, 'use_spike': True, 'rsi_required': False, 'edge_k': 0.505022322673052, 'edge_cap': 0.1076238383291357, 'bull_strategy': 'breakout', 'bull_bb_std_mult': 3.1244897441748307, 'bull_rsi_os': 16, 'bull_rsi_ob': 62, 'bull_adx_thresh': 12.701291523739641, 'bull_atr_min_pct': 0.007726273232141935, 'bull_atr_max_pct': 0.10069098307089937, 'bull_tp_mult': 2.0509176865114314, 'bull_tsl_mult': 0.37334313451442164, 'bull_time_stop': 161, 'bull_use_sma': True, 'bull_use_ema': False, 'bull_use_atr': False, 'bull_use_adx': True, 'bull_use_spike': False, 'bull_rsi_required': True, 'bear_strategy': 'mean_reversion', 'bear_bb_std_mult': 2.607417062082101, 'bear_rsi_os': 54, 'bear_rsi_ob': 58, 'bear_adx_thresh': 30.81148027386188, 'bear_atr_min_pct': 0.012702578753427424, 'bear_atr_max_pct': 0.11247710322735589, 'bear_tp_mult': 2.421171929051685, 'bear_tsl_mult': 0.5711992974895116, 'bear_time_stop': 132, 'bear_use_sma': False, 'bear_use_ema': False, 'bear_use_atr': False, 'bear_use_adx': True, 'bear_use_spike': False, 'bear_rsi_required': False, 'sideways_strategy': 'mean_reversion', 'sideways_bb_std_mult': 3.596209044427442, 'sideways_rsi_os': 11, 'sideways_rsi_ob': 72, 'sideways_adx_thresh': 20.051857192564245, 'sideways_atr_min_pct': 0.012086210926773696, 'sideways_atr_max_pct': 0.029253051730798812, 'sideways_tp_mult': 1.8572031329463228, 'sideways_tsl_mult': 0.700996272117982, 'sideways_time_stop': 133, 'sideways_use_sma': False, 'sideways_use_ema': False, 'sideways_use_atr': True, 'sideways_use_adx': False, 'sideways_use_spike': True, 'sideways_rsi_required': True}.
[I 2025-09-01 14:32:13,600] Trial 253 finished with values: [-1000000000.0, 1000000000.0] and parameters: {'p_sma': 9, 'p_std': 7, 'p_atr': 11, 'p_adx': 26, 'rsi_period': 63, 'ema1': 30, 'ema2': 52, 'slip_atr_k': 0.04567681530002762, 'slip_spread_k': 0.4965119646128477, 'spread_hl_frac': 0.014612913201194034, 'bb_std_mult': 1.5541154674449884, 'rsi_os': 35, 'rsi_ob': 76, 'vol_spike': 0.293803046447787, 'adx_thresh': 17.831987163273286, 'atr_min_pct': 0.020106639172679408, 'atr_max_pct': 0.06985360672124587, 'tp_mult': 1.1463454327151452, 'tsl_mult': 0.09374669166813501, 'strategy': 'breakout', 'time_stop': 245, 'use_sma': False, 'use_atr': True, 'use_adx': True, 'use_ema': False, 'use_spike': True, 'rsi_required': False, 'edge_k': 0.5426299563766845, 'edge_cap': 0.5551460317995776, 'bull_strategy': 'breakout', 'bull_bb_std_mult': 3.081663923573313, 'bull_rsi_os': 45, 'bull_rsi_ob': 50, 'bull_adx_thresh': 22.42104344108836, 'bull_atr_min_pct': 0.007803437990936486, 'bull_atr_max_pct': 0.02082856973923375, 'bull_tp_mult': 2.0650827818615634, 'bull_tsl_mult': 0.6959175508882363, 'bull_time_stop': 161, 'bull_use_sma': True, 'bull_use_ema': False, 'bull_use_atr': False, 'bull_use_adx': True, 'bull_use_spike': False, 'bull_rsi_required': True, 'bear_strategy': 'mean_reversion', 'bear_bb_std_mult': 2.071125844780383, 'bear_rsi_os': 8, 'bear_rsi_ob': 58, 'bear_adx_thresh': 28.31367611502764, 'bear_atr_min_pct': 0.023965695292973717, 'bear_atr_max_pct': 0.12759298000509717, 'bear_tp_mult': 1.2097664087324564, 'bear_tsl_mult': 0.6479761917987067, 'bear_time_stop': 210, 'bear_use_sma': False, 'bear_use_ema': False, 'bear_use_atr': False, 'bear_use_adx': True, 'bear_use_spike': False, 'bear_rsi_required': False, 'sideways_strategy': 'mean_reversion', 'sideways_bb_std_mult': 3.5710423285593658, 'sideways_rsi_os': 10, 'sideways_rsi_ob': 94, 'sideways_adx_thresh': 19.098178934761528, 'sideways_atr_min_pct': 0.007212837170203116, 'sideways_atr_max_pct': 0.13529098520718977, 'sideways_tp_mult': 1.7585754158617533, 'sideways_tsl_mult': 0.2467221484506364, 'sideways_time_stop': 127, 'sideways_use_sma': False, 'sideways_use_ema': False, 'sideways_use_atr': True, 'sideways_use_adx': False, 'sideways_use_spike': True, 'sideways_rsi_required': True}.
[I 2025-09-01 14:32:51,310] Trial 256 finished with values: [-1000000000.0, 1000000000.0] and parameters: {'p_sma': 27, 'p_std': 8, 'p_atr': 11, 'p_adx': 26, 'rsi_period': 65, 'ema1': 29, 'ema2': 54, 'slip_atr_k': 0.04022163941964481, 'slip_spread_k': 0.49936222836158206, 'spread_hl_frac': 0.012962707634039075, 'bb_std_mult': 1.5658544578214666, 'rsi_os': 27, 'rsi_ob': 74, 'vol_spike': 0.2993980222119354, 'adx_thresh': 11.17533438953291, 'atr_min_pct': 0.014745509109868948, 'atr_max_pct': 0.08211969779890811, 'tp_mult': 2.8421579899171814, 'tsl_mult': 0.6983203923633304, 'strategy': 'breakout', 'time_stop': 53, 'use_sma': False, 'use_atr': True, 'use_adx': True, 'use_ema': False, 'use_spike': True, 'rsi_required': False, 'edge_k': 0.49576184906927145, 'edge_cap': 0.1127304856025145, 'bull_strategy': 'breakout', 'bull_bb_std_mult': 3.1428703678795635, 'bull_rsi_os': 45, 'bull_rsi_ob': 48, 'bull_adx_thresh': 31.849465970132115, 'bull_atr_min_pct': 0.009035184048293936, 'bull_atr_max_pct': 0.017285603692671552, 'bull_tp_mult': 1.9937285590231082, 'bull_tsl_mult': 0.36765722622121194, 'bull_time_stop': 293, 'bull_use_sma': True, 'bull_use_ema': False, 'bull_use_atr': False, 'bull_use_adx': True, 'bull_use_spike': False, 'bull_rsi_required': True, 'bear_strategy': 'mean_reversion', 'bear_bb_std_mult': 0.5927805880410757, 'bear_rsi_os': 7, 'bear_rsi_ob': 80, 'bear_adx_thresh': 30.869839144413458, 'bear_atr_min_pct': 0.022290209509385487, 'bear_atr_max_pct': 0.04806933488596033, 'bear_tp_mult': 2.894596148944999, 'bear_tsl_mult': 0.6877071222844974, 'bear_time_stop': 288, 'bear_use_sma': False, 'bear_use_ema': False, 'bear_use_atr': False, 'bear_use_adx': True, 'bear_use_spike': False, 'bear_rsi_required': False, 'sideways_strategy': 'mean_reversion', 'sideways_bb_std_mult': 1.9731375165034284, 'sideways_rsi_os': 31, 'sideways_rsi_ob': 94, 'sideways_adx_thresh': 19.044373933481694, 'sideways_atr_min_pct': 0.004717443296838988, 'sideways_atr_max_pct': 0.12545818859997881, 'sideways_tp_mult': 1.8324787585226605, 'sideways_tsl_mult': 0.23975940450064825, 'sideways_time_stop': 99, 'sideways_use_sma': False, 'sideways_use_ema': False, 'sideways_use_atr': True, 'sideways_use_adx': False, 'sideways_use_spike': True, 'sideways_rsi_required': True}.
[I 2025-09-01 14:32:52,701] Trial 258 finished with values: [-1000000000.0, 1000000000.0] and parameters: {'p_sma': 29, 'p_std': 9, 'p_atr': 22, 'p_adx': 24, 'rsi_period': 67, 'ema1': 29, 'ema2': 60, 'slip_atr_k': 0.06440201892240968, 'slip_spread_k': 0.9292644493179458, 'spread_hl_frac': 0.014930685833428893, 'bb_std_mult': 1.543771403236549, 'rsi_os': 33, 'rsi_ob': 74, 'vol_spike': 0.10693414095178261, 'adx_thresh': 20.735895714734173, 'atr_min_pct': 0.013847932039849955, 'atr_max_pct': 0.10283571101982533, 'tp_mult': 2.9527789431714173, 'tsl_mult': 0.07979313348620005, 'strategy': 'breakout', 'time_stop': 52, 'use_sma': False, 'use_atr': True, 'use_adx': True, 'use_ema': False, 'use_spike': True, 'rsi_required': False, 'edge_k': 1.9520871971700502, 'edge_cap': 0.2833350476751333, 'bull_strategy': 'breakout', 'bull_bb_std_mult': 2.9692258620337073, 'bull_rsi_os': 18, 'bull_rsi_ob': 78, 'bull_adx_thresh': 14.74114145936669, 'bull_atr_min_pct': 0.023994054844049546, 'bull_atr_max_pct': 0.01674701685947947, 'bull_tp_mult': 1.9893873890192715, 'bull_tsl_mult': 0.33155118298912856, 'bull_time_stop': 148, 'bull_use_sma': True, 'bull_use_ema': False, 'bull_use_atr': False, 'bull_use_adx': False, 'bull_use_spike': False, 'bull_rsi_required': True, 'bear_strategy': 'mean_reversion', 'bear_bb_std_mult': 2.974415967892627, 'bear_rsi_os': 8, 'bear_rsi_ob': 62, 'bear_adx_thresh': 26.93928337193037, 'bear_atr_min_pct': 0.013953805110390658, 'bear_atr_max_pct': 0.04227549213437395, 'bear_tp_mult': 1.6264258280670427, 'bear_tsl_mult': 0.5210347023287469, 'bear_time_stop': 289, 'bear_use_sma': False, 'bear_use_ema': False, 'bear_use_atr': False, 'bear_use_adx': True, 'bear_use_spike': False, 'bear_rsi_required': False, 'sideways_strategy': 'mean_reversion', 'sideways_bb_std_mult': 1.096939720692676, 'sideways_rsi_os': 34, 'sideways_rsi_ob': 94, 'sideways_adx_thresh': 10.146453022316251, 'sideways_atr_min_pct': 0.0033533061947811768, 'sideways_atr_max_pct': 0.03589350442523147, 'sideways_tp_mult': 1.7666082914884809, 'sideways_tsl_mult': 0.24438101683189922, 'sideways_time_stop': 127, 'sideways_use_sma': False, 'sideways_use_ema': False, 'sideways_use_atr': True, 'sideways_use_adx': False, 'sideways_use_spike': True, 'sideways_rsi_required': True}.
[I 2025-09-01 14:32:52,968] Trial 257 finished with values: [-1000000000.0, 1000000000.0] and parameters: {'p_sma': 27, 'p_std': 8, 'p_atr': 11, 'p_adx': 9, 'rsi_period': 65, 'ema1': 29, 'ema2': 48, 'slip_atr_k': 0.060977048238926246, 'slip_spread_k': 0.49510558524036474, 'spread_hl_frac': 0.015061366939194564, 'bb_std_mult': 1.5530378798206266, 'rsi_os': 33, 'rsi_ob': 74, 'vol_spike': 0.27114399102669295, 'adx_thresh': 19.565552804194347, 'atr_min_pct': 0.015867928185849506, 'atr_max_pct': 0.08848311333379678, 'tp_mult': 2.840236600445227, 'tsl_mult': 0.014710008953047984, 'strategy': 'breakout', 'time_stop': 52, 'use_sma': False, 'use_atr': True, 'use_adx': True, 'use_ema': False, 'use_spike': True, 'rsi_required': False, 'edge_k': 1.6541472962844526, 'edge_cap': 0.10999177410595853, 'bull_strategy': 'breakout', 'bull_bb_std_mult': 3.0967836635388846, 'bull_rsi_os': 18, 'bull_rsi_ob': 48, 'bull_adx_thresh': 10.815478803460769, 'bull_atr_min_pct': 0.007518960604241513, 'bull_atr_max_pct': 0.10192894645870951, 'bull_tp_mult': 1.9928175153681487, 'bull_tsl_mult': 0.3568019218693436, 'bull_time_stop': 40, 'bull_use_sma': True, 'bull_use_ema': False, 'bull_use_atr': False, 'bull_use_adx': False, 'bull_use_spike': False, 'bull_rsi_required': True, 'bear_strategy': 'mean_reversion', 'bear_bb_std_mult': 3.2367903946386964, 'bear_rsi_os': 8, 'bear_rsi_ob': 58, 'bear_adx_thresh': 30.82829007625694, 'bear_atr_min_pct': 0.029420803408994715, 'bear_atr_max_pct': 0.11213528853917551, 'bear_tp_mult': 2.9057960165935723, 'bear_tsl_mult': 0.514813876335124, 'bear_time_stop': 210, 'bear_use_sma': False, 'bear_use_ema': False, 'bear_use_atr': False, 'bear_use_adx': True, 'bear_use_spike': False, 'bear_rsi_required': False, 'sideways_strategy': 'mean_reversion', 'sideways_bb_std_mult': 1.9614947662680944, 'sideways_rsi_os': 31, 'sideways_rsi_ob': 76, 'sideways_adx_thresh': 19.07449081110352, 'sideways_atr_min_pct': 0.012217460096019069, 'sideways_atr_max_pct': 0.13487379326541107, 'sideways_tp_mult': 1.77573764186797, 'sideways_tsl_mult': 0.25405353337032816, 'sideways_time_stop': 100, 'sideways_use_sma': False, 'sideways_use_ema': False, 'sideways_use_atr': True, 'sideways_use_adx': False, 'sideways_use_spike': True, 'sideways_rsi_required': True}.
[I 2025-09-01 14:32:52,968] Trial 259 finished with values: [-1000000000.0, 1000000000.0] and parameters: {'p_sma': 11, 'p_std': 11, 'p_atr': 19, 'p_adx': 24, 'rsi_period': 66, 'ema1': 29, 'ema2': 60, 'slip_atr_k': 0.10803104536541468, 'slip_spread_k': 0.23099366759201032, 'spread_hl_frac': 0.014977043755538884, 'bb_std_mult': 0.8496817054730195, 'rsi_os': 27, 'rsi_ob': 55, 'vol_spike': 0.2798619232612563, 'adx_thresh': 12.966277823642265, 'atr_min_pct': 0.015884041241212694, 'atr_max_pct': 0.10199305777628176, 'tp_mult': 1.6304121771651692, 'tsl_mult': 0.8507590138113346, 'strategy': 'breakout', 'time_stop': 79, 'use_sma': False, 'use_atr': True, 'use_adx': False, 'use_ema': False, 'use_spike': True, 'rsi_required': False, 'edge_k': 1.9462271381037575, 'edge_cap': 0.08646516470833843, 'bull_strategy': 'breakout', 'bull_bb_std_mult': 2.2187841261118764, 'bull_rsi_os': 18, 'bull_rsi_ob': 48, 'bull_adx_thresh': 20.24992497476797, 'bull_atr_min_pct': 0.02406718439530576, 'bull_atr_max_pct': 0.017006072307496976, 'bull_tp_mult': 1.9955119169525546, 'bull_tsl_mult': 0.32866792460981475, 'bull_time_stop': 215, 'bull_use_sma': True, 'bull_use_ema': False, 'bull_use_atr': False, 'bull_use_adx': False, 'bull_use_spike': False, 'bull_rsi_required': True, 'bear_strategy': 'mean_reversion', 'bear_bb_std_mult': 3.218583663045151, 'bear_rsi_os': 7, 'bear_rsi_ob': 79, 'bear_adx_thresh': 21.76771170606587, 'bear_atr_min_pct': 0.02245671257744291, 'bear_atr_max_pct': 0.14254751357352297, 'bear_tp_mult': 1.9713039798008838, 'bear_tsl_mult': 0.6953097939988125, 'bear_time_stop': 288, 'bear_use_sma': False, 'bear_use_ema': False, 'bear_use_atr': False, 'bear_use_adx': True, 'bear_use_spike': False, 'bear_rsi_required': False, 'sideways_strategy': 'mean_reversion', 'sideways_bb_std_mult': 2.0819352175395465, 'sideways_rsi_os': 27, 'sideways_rsi_ob': 85, 'sideways_adx_thresh': 11.665168127688627, 'sideways_atr_min_pct': 0.004689778943821009, 'sideways_atr_max_pct': 0.03475539013254658, 'sideways_tp_mult': 2.069600033528858, 'sideways_tsl_mult': 0.3107773939825617, 'sideways_time_stop': 34, 'sideways_use_sma': False, 'sideways_use_ema': False, 'sideways_use_atr': True, 'sideways_use_adx': False, 'sideways_use_spike': True, 'sideways_rsi_required': True}.
[I 2025-09-01 14:32:53,658] Trial 261 finished with values: [-1000000000.0, 1000000000.0] and parameters: {'p_sma': 15, 'p_std': 15, 'p_atr': 20, 'p_adx': 25, 'rsi_period': 70, 'ema1': 30, 'ema2': 54, 'slip_atr_k': 0.07027662850597366, 'slip_spread_k': 0.7469814804277085, 'spread_hl_frac': 0.01146691570648232, 'bb_std_mult': 2.876930330227082, 'rsi_os': 36, 'rsi_ob': 72, 'vol_spike': 0.2836737734730648, 'adx_thresh': 19.08539550441191, 'atr_min_pct': 0.016397950113276535, 'atr_max_pct': 0.01450610483496216, 'tp_mult': 2.907780926267805, 'tsl_mult': 0.1120978813685069, 'strategy': 'breakout', 'time_stop': 42, 'use_sma': False, 'use_atr': True, 'use_adx': False, 'use_ema': False, 'use_spike': True, 'rsi_required': False, 'edge_k': 1.5617132726523302, 'edge_cap': 0.3703136074732293, 'bull_strategy': 'breakout', 'bull_bb_std_mult': 2.8517958524434524, 'bull_rsi_os': 26, 'bull_rsi_ob': 87, 'bull_adx_thresh': 27.431986911837534, 'bull_atr_min_pct': 0.021607736415483497, 'bull_atr_max_pct': 0.013084362592300933, 'bull_tp_mult': 2.209323761008693, 'bull_tsl_mult': 0.35402663814809165, 'bull_time_stop': 28, 'bull_use_sma': True, 'bull_use_ema': False, 'bull_use_atr': False, 'bull_use_adx': True, 'bull_use_spike': False, 'bull_rsi_required': True, 'bear_strategy': 'mean_reversion', 'bear_bb_std_mult': 2.6331199961432814, 'bear_rsi_os': 28, 'bear_rsi_ob': 72, 'bear_adx_thresh': 29.151745928200775, 'bear_atr_min_pct': 0.005649105604296883, 'bear_atr_max_pct': 0.10311413697977503, 'bear_tp_mult': 2.495829097208028, 'bear_tsl_mult': 0.8601370273643957, 'bear_time_stop': 171, 'bear_use_sma': False, 'bear_use_ema': False, 'bear_use_atr': False, 'bear_use_adx': True, 'bear_use_spike': False, 'bear_rsi_required': False, 'sideways_strategy': 'mean_reversion', 'sideways_bb_std_mult': 1.4484291684603219, 'sideways_rsi_os': 38, 'sideways_rsi_ob': 91, 'sideways_adx_thresh': 6.2524384839693425, 'sideways_atr_min_pct': 0.006257616415534492, 'sideways_atr_max_pct': 0.13317748808401167, 'sideways_tp_mult': 2.6289283148165827, 'sideways_tsl_mult': 0.27311990021039134, 'sideways_time_stop': 117, 'sideways_use_sma': False, 'sideways_use_ema': False, 'sideways_use_atr': False, 'sideways_use_adx': False, 'sideways_use_spike': True, 'sideways_rsi_required': True}.
