[I 2025-09-01 15:08:01,892] Trial 479 finished with values: [-1000000000.0, 1000000000.0] and parameters: {'p_sma': 9, 'p_std': 11, 'p_atr': 22, 'p_adx': 24, 'rsi_period': 68, 'ema1': 29, 'ema2': 46, 'slip_atr_k': 0.08318055775941471, 'slip_spread_k': 0.22473882927234096, 'spread_hl_frac': 0.029532380951142703, 'bb_std_mult': 0.584352172282746, 'rsi_os': 36, 'rsi_ob': 73, 'vol_spike': 0.1986559348561479, 'adx_thresh': 24.949950011274247, 'atr_min_pct': 0.006280805829050912, 'atr_max_pct': 0.0658859396930718, 'tp_mult': 2.5576255340032206, 'tsl_mult': 0.5991131770440846, 'strategy': 'mean_reversion', 'time_stop': 59, 'use_sma': True, 'use_atr': False, 'use_adx': False, 'use_ema': True, 'use_spike': True, 'rsi_required': True, 'edge_k': 0.4215869221536993, 'edge_cap': 0.08658165014138576, 'bull_strategy': 'breakout', 'bull_bb_std_mult': 0.6609804098361607, 'bull_rsi_os': 13, 'bull_rsi_ob': 50, 'bull_adx_thresh': 31.915951110618103, 'bull_atr_min_pct': 0.010939629870172793, 'bull_atr_max_pct': 0.10844967280847112, 'bull_tp_mult': 1.8302590703087807, 'bull_tsl_mult': 0.3510135767510074, 'bull_time_stop': 158, 'bull_use_sma': False, 'bull_use_ema': False, 'bull_use_atr': True, 'bull_use_adx': True, 'bull_use_spike': False, 'bull_rsi_required': False, 'bear_strategy': 'mean_reversion', 'bear_bb_std_mult': 2.906992524906237, 'bear_rsi_os': 5, 'bear_rsi_ob': 82, 'bear_adx_thresh': 31.98048126793103, 'bear_atr_min_pct': 0.015187988803883778, 'bear_atr_max_pct': 0.07442602014182978, 'bear_tp_mult': 2.264507051199708, 'bear_tsl_mult': 0.3740844114173574, 'bear_time_stop': 163, 'bear_use_sma': False, 'bear_use_ema': False, 'bear_use_atr': False, 'bear_use_adx': True, 'bear_use_spike': False, 'bear_rsi_required': True, 'sideways_strategy': 'breakout', 'sideways_bb_std_mult': 3.4508745036377464, 'sideways_rsi_os': 11, 'sideways_rsi_ob': 61, 'sideways_adx_thresh': 15.802081532527573, 'sideways_atr_min_pct': 0.004022841766819076, 'sideways_atr_max_pct': 0.13002119877686272, 'sideways_tp_mult': 2.8025666455769964, 'sideways_tsl_mult': 0.9573039290144241, 'sideways_time_stop': 28, 'sideways_use_sma': False, 'sideways_use_ema': True, 'sideways_use_atr': True, 'sideways_use_adx': False, 'sideways_use_spike': False, 'sideways_rsi_required': False}.
[I 2025-09-01 15:08:01,920] Trial 478 finished with values: [-1000000000.0, 1000000000.0] and parameters: {'p_sma': 15, 'p_std': 57, 'p_atr': 28, 'p_adx': 17, 'rsi_period': 68, 'ema1': 29, 'ema2': 48, 'slip_atr_k': 0.05440270665296782, 'slip_spread_k': 0.22534526838959068, 'spread_hl_frac': 0.013468807466024753, 'bb_std_mult': 1.5551989381322613, 'rsi_os': 15, 'rsi_ob': 78, 'vol_spike': 0.07974364426790242, 'adx_thresh': 10.176702068240187, 'atr_min_pct': 0.002299254857689295, 'atr_max_pct': 0.06659588669010982, 'tp_mult': 2.562635177534129, 'tsl_mult': 0.4426361468129772, 'strategy': 'mean_reversion', 'time_stop': 59, 'use_sma': True, 'use_atr': False, 'use_adx': False, 'use_ema': True, 'use_spike': True, 'rsi_required': True, 'edge_k': 0.4266512732760923, 'edge_cap': 0.12328286603161337, 'bull_strategy': 'breakout', 'bull_bb_std_mult': 2.900056609182122, 'bull_rsi_os': 23, 'bull_rsi_ob': 50, 'bull_adx_thresh': 32.152639167299796, 'bull_atr_min_pct': 0.011082544341040123, 'bull_atr_max_pct': 0.08569709378410492, 'bull_tp_mult': 2.02959039225805, 'bull_tsl_mult': 0.35209151266815103, 'bull_time_stop': 49, 'bull_use_sma': False, 'bull_use_ema': False, 'bull_use_atr': True, 'bull_use_adx': True, 'bull_use_spike': False, 'bull_rsi_required': False, 'bear_strategy': 'mean_reversion', 'bear_bb_std_mult': 2.926674145691541, 'bear_rsi_os': 5, 'bear_rsi_ob': 84, 'bear_adx_thresh': 26.62201465946603, 'bear_atr_min_pct': 0.0238102387287537, 'bear_atr_max_pct': 0.036893254953899356, 'bear_tp_mult': 2.521950301266322, 'bear_tsl_mult': 0.614335022542741, 'bear_time_stop': 84, 'bear_use_sma': False, 'bear_use_ema': False, 'bear_use_atr': False, 'bear_use_adx': True, 'bear_use_spike': False, 'bear_rsi_required': True, 'sideways_strategy': 'breakout', 'sideways_bb_std_mult': 3.124158238726864, 'sideways_rsi_os': 17, 'sideways_rsi_ob': 86, 'sideways_adx_thresh': 5.045587652162913, 'sideways_atr_min_pct': 0.01481746340487784, 'sideways_atr_max_pct': 0.12927380138717987, 'sideways_tp_mult': 1.7022870079474262, 'sideways_tsl_mult': 0.3371754746579362, 'sideways_time_stop': 94, 'sideways_use_sma': False, 'sideways_use_ema': True, 'sideways_use_atr': True, 'sideways_use_adx': False, 'sideways_use_spike': False, 'sideways_rsi_required': False}.
[I 2025-09-01 15:08:02,347] Trial 476 finished with values: [-1000000000.0, 1000000000.0] and parameters: {'p_sma': 13, 'p_std': 10, 'p_atr': 27, 'p_adx': 24, 'rsi_period': 77, 'ema1': 30, 'ema2': 51, 'slip_atr_k': 0.04649524142939494, 'slip_spread_k': 0.2467634105666475, 'spread_hl_frac': 0.022548602539450045, 'bb_std_mult': 0.5807720011270372, 'rsi_os': 14, 'rsi_ob': 75, 'vol_spike': 0.2911140391394635, 'adx_thresh': 18.72928691522404, 'atr_min_pct': 0.017866911831243226, 'atr_max_pct': 0.06546966315129325, 'tp_mult': 2.6563699127968707, 'tsl_mult': 0.7098705609425631, 'strategy': 'mean_reversion', 'time_stop': 205, 'use_sma': False, 'use_atr': False, 'use_adx': True, 'use_ema': True, 'use_spike': True, 'rsi_required': True, 'edge_k': 0.6455293324758107, 'edge_cap': 0.1084255564684247, 'bull_strategy': 'breakout', 'bull_bb_std_mult': 2.635377331307757, 'bull_rsi_os': 21, 'bull_rsi_ob': 50, 'bull_adx_thresh': 8.421069374283784, 'bull_atr_min_pct': 0.0079844354178239, 'bull_atr_max_pct': 0.024470299915050862, 'bull_tp_mult': 2.171348648380208, 'bull_tsl_mult': 0.06444431844021242, 'bull_time_stop': 182, 'bull_use_sma': False, 'bull_use_ema': True, 'bull_use_atr': True, 'bull_use_adx': False, 'bull_use_spike': False, 'bull_rsi_required': False, 'bear_strategy': 'breakout', 'bear_bb_std_mult': 2.6726690056657243, 'bear_rsi_os': 33, 'bear_rsi_ob': 80, 'bear_adx_thresh': 19.322878126025635, 'bear_atr_min_pct': 0.022006420756958345, 'bear_atr_max_pct': 0.03546886804303858, 'bear_tp_mult': 2.2500958882146986, 'bear_tsl_mult': 0.29883660168554477, 'bear_time_stop': 269, 'bear_use_sma': True, 'bear_use_ema': False, 'bear_use_atr': True, 'bear_use_adx': True, 'bear_use_spike': True, 'bear_rsi_required': False, 'sideways_strategy': 'breakout', 'sideways_bb_std_mult': 3.2946051957612754, 'sideways_rsi_os': 16, 'sideways_rsi_ob': 89, 'sideways_adx_thresh': 15.49165569049163, 'sideways_atr_min_pct': 0.0050421493526814475, 'sideways_atr_max_pct': 0.1257151544697321, 'sideways_tp_mult': 2.3216815548254006, 'sideways_tsl_mult': 0.3038262594163586, 'sideways_time_stop': 126, 'sideways_use_sma': True, 'sideways_use_ema': False, 'sideways_use_atr': False, 'sideways_use_adx': False, 'sideways_use_spike': True, 'sideways_rsi_required': False}.
[I 2025-09-01 15:08:46,431] Trial 482 finished with values: [-0.022459419994907304, 0.022304515851426156] and parameters: {'p_sma': 25, 'p_std': 7, 'p_atr': 16, 'p_adx': 25, 'rsi_period': 75, 'ema1': 17, 'ema2': 51, 'slip_atr_k': 0.0651211970035998, 'slip_spread_k': 0.9158572573659128, 'spread_hl_frac': 0.016455942091198727, 'bb_std_mult': 1.6199760340854146, 'rsi_os': 33, 'rsi_ob': 75, 'vol_spike': 0.2879309797686608, 'adx_thresh': 30.794903230251144, 'atr_min_pct': 0.029972606313068355, 'atr_max_pct': 0.07916724333488268, 'tp_mult': 2.9998714732764302, 'tsl_mult': 0.6619048980654565, 'strategy': 'breakout', 'time_stop': 69, 'use_sma': False, 'use_atr': True, 'use_adx': True, 'use_ema': False, 'use_spike': False, 'rsi_required': False, 'edge_k': 0.5785416689001575, 'edge_cap': 0.8882996646928597, 'bull_strategy': 'mean_reversion', 'bull_bb_std_mult': 2.736376788168419, 'bull_rsi_os': 17, 'bull_rsi_ob': 63, 'bull_adx_thresh': 15.787838034125333, 'bull_atr_min_pct': 0.0033659661547124266, 'bull_atr_max_pct': 0.01509742418441569, 'bull_tp_mult': 2.085570775767588, 'bull_tsl_mult': 0.5517031024397288, 'bull_time_stop': 178, 'bull_use_sma': True, 'bull_use_ema': False, 'bull_use_atr': False, 'bull_use_adx': True, 'bull_use_spike': True, 'bull_rsi_required': True, 'bear_strategy': 'mean_reversion', 'bear_bb_std_mult': 1.9442621924283379, 'bear_rsi_os': 41, 'bear_rsi_ob': 45, 'bear_adx_thresh': 29.369726456434513, 'bear_atr_min_pct': 0.027881191176661522, 'bear_atr_max_pct': 0.1336699160346423, 'bear_tp_mult': 2.5545511372223233, 'bear_tsl_mult': 0.648982193150257, 'bear_time_stop': 118, 'bear_use_sma': False, 'bear_use_ema': True, 'bear_use_atr': False, 'bear_use_adx': False, 'bear_use_spike': False, 'bear_rsi_required': False, 'sideways_strategy': 'mean_reversion', 'sideways_bb_std_mult': 2.5309002960043863, 'sideways_rsi_os': 15, 'sideways_rsi_ob': 58, 'sideways_adx_thresh': 6.504047030461396, 'sideways_atr_min_pct': 0.020441373107970416, 'sideways_atr_max_pct': 0.1348386367339377, 'sideways_tp_mult': 2.5988232497928125, 'sideways_tsl_mult': 0.44828748369689836, 'sideways_time_stop': 300, 'sideways_use_sma': False, 'sideways_use_ema': False, 'sideways_use_atr': True, 'sideways_use_adx': True, 'sideways_use_spike': True, 'sideways_rsi_required': True}.
[I 2025-09-01 15:08:47,660] Trial 481 finished with values: [-1000000000.0, 1000000000.0] and parameters: {'p_sma': 46, 'p_std': 9, 'p_atr': 10, 'p_adx': 25, 'rsi_period': 9, 'ema1': 29, 'ema2': 51, 'slip_atr_k': 0.025365928064922563, 'slip_spread_k': 0.06083905866896899, 'spread_hl_frac': 0.015319836328090631, 'bb_std_mult': 1.6054824305085604, 'rsi_os': 33, 'rsi_ob': 82, 'vol_spike': 0.2887137479194584, 'adx_thresh': 20.17914145606475, 'atr_min_pct': 0.021783933443032744, 'atr_max_pct': 0.08089161157232753, 'tp_mult': 2.120976417305495, 'tsl_mult': 0.03601072091334702, 'strategy': 'breakout', 'time_stop': 206, 'use_sma': False, 'use_atr': True, 'use_adx': True, 'use_ema': False, 'use_spike': False, 'rsi_required': False, 'edge_k': 0.5854106071634602, 'edge_cap': 0.36860372661712376, 'bull_strategy': 'mean_reversion', 'bull_bb_std_mult': 2.7490311545223394, 'bull_rsi_os': 38, 'bull_rsi_ob': 63, 'bull_adx_thresh': 10.506488867179886, 'bull_atr_min_pct': 0.004827455202872509, 'bull_atr_max_pct': 0.01656169107320065, 'bull_tp_mult': 1.084673543475199, 'bull_tsl_mult': 0.36550659005900177, 'bull_time_stop': 156, 'bull_use_sma': True, 'bull_use_ema': False, 'bull_use_atr': False, 'bull_use_adx': True, 'bull_use_spike': True, 'bull_rsi_required': True, 'bear_strategy': 'mean_reversion', 'bear_bb_std_mult': 2.784729790567584, 'bear_rsi_os': 41, 'bear_rsi_ob': 80, 'bear_adx_thresh': 16.297216667322623, 'bear_atr_min_pct': 0.02472549957225443, 'bear_atr_max_pct': 0.11101877356234406, 'bear_tp_mult': 1.7669432780675247, 'bear_tsl_mult': 0.7627535899526428, 'bear_time_stop': 290, 'bear_use_sma': False, 'bear_use_ema': True, 'bear_use_atr': False, 'bear_use_adx': False, 'bear_use_spike': False, 'bear_rsi_required': False, 'sideways_strategy': 'mean_reversion', 'sideways_bb_std_mult': 2.293544066150013, 'sideways_rsi_os': 15, 'sideways_rsi_ob': 81, 'sideways_adx_thresh': 5.712293003191146, 'sideways_atr_min_pct': 0.006468554923723868, 'sideways_atr_max_pct': 0.1351076603843769, 'sideways_tp_mult': 2.3222082931967933, 'sideways_tsl_mult': 0.45593158887306734, 'sideways_time_stop': 257, 'sideways_use_sma': False, 'sideways_use_ema': False, 'sideways_use_atr': True, 'sideways_use_adx': True, 'sideways_use_spike': True, 'sideways_rsi_required': True}.
[I 2025-09-01 15:08:48,205] Trial 483 finished with values: [-0.05642395608681183, 0.056358688480904466] and parameters: {'p_sma': 29, 'p_std': 7, 'p_atr': 16, 'p_adx': 25, 'rsi_period': 12, 'ema1': 17, 'ema2': 53, 'slip_atr_k': 0.06709733804043108, 'slip_spread_k': 0.6596887789200655, 'spread_hl_frac': 0.048227452420752354, 'bb_std_mult': 1.9998485964371875, 'rsi_os': 34, 'rsi_ob': 80, 'vol_spike': 0.2872877704034662, 'adx_thresh': 23.019977748163676, 'atr_min_pct': 0.01623336565468016, 'atr_max_pct': 0.08055090590206113, 'tp_mult': 2.8870707153302986, 'tsl_mult': 0.06692348512301023, 'strategy': 'breakout', 'time_stop': 70, 'use_sma': False, 'use_atr': True, 'use_adx': True, 'use_ema': False, 'use_spike': False, 'rsi_required': False, 'edge_k': 1.5946112716066125, 'edge_cap': 0.36819142312923997, 'bull_strategy': 'mean_reversion', 'bull_bb_std_mult': 1.8254471192690642, 'bull_rsi_os': 17, 'bull_rsi_ob': 47, 'bull_adx_thresh': 25.091772487511076, 'bull_atr_min_pct': 0.0011932352338740295, 'bull_atr_max_pct': 0.0142177415265578, 'bull_tp_mult': 1.590941219802267, 'bull_tsl_mult': 0.12839774828588618, 'bull_time_stop': 156, 'bull_use_sma': True, 'bull_use_ema': False, 'bull_use_atr': False, 'bull_use_adx': True, 'bull_use_spike': True, 'bull_rsi_required': True, 'bear_strategy': 'mean_reversion', 'bear_bb_std_mult': 2.2707470994560275, 'bear_rsi_os': 9, 'bear_rsi_ob': 78, 'bear_adx_thresh': 29.507414374095745, 'bear_atr_min_pct': 0.024684233102295932, 'bear_atr_max_pct': 0.1280803712237535, 'bear_tp_mult': 1.7826667904031916, 'bear_tsl_mult': 0.6549101559287099, 'bear_time_stop': 78, 'bear_use_sma': False, 'bear_use_ema': True, 'bear_use_atr': False, 'bear_use_adx': False, 'bear_use_spike': False, 'bear_rsi_required': False, 'sideways_strategy': 'mean_reversion', 'sideways_bb_std_mult': 3.3003736576424823, 'sideways_rsi_os': 15, 'sideways_rsi_ob': 66, 'sideways_adx_thresh': 13.505462659813137, 'sideways_atr_min_pct': 0.0037371892911789934, 'sideways_atr_max_pct': 0.1344962254127941, 'sideways_tp_mult': 1.2955319341092806, 'sideways_tsl_mult': 0.4563085905333877, 'sideways_time_stop': 110, 'sideways_use_sma': False, 'sideways_use_ema': False, 'sideways_use_atr': True, 'sideways_use_adx': True, 'sideways_use_spike': True, 'sideways_rsi_required': True}.
[I 2025-09-01 15:08:48,574] Trial 480 finished with values: [-0.008227485965722203, 0.0083042275842552] and parameters: {'p_sma': 9, 'p_std': 27, 'p_atr': 22, 'p_adx': 26, 'rsi_period': 61, 'ema1': 17, 'ema2': 37, 'slip_atr_k': 0.09413361179838466, 'slip_spread_k': 0.9130960602427036, 'spread_hl_frac': 0.008638024562695537, 'bb_std_mult': 1.5619447353846685, 'rsi_os': 15, 'rsi_ob': 80, 'vol_spike': 0.19720269179328495, 'adx_thresh': 20.184964121846633, 'atr_min_pct': 0.014396722750826867, 'atr_max_pct': 0.08079604596141625, 'tp_mult': 2.892780054646274, 'tsl_mult': 0.7117397790914163, 'strategy': 'mean_reversion', 'time_stop': 59, 'use_sma': True, 'use_atr': True, 'use_adx': False, 'use_ema': False, 'use_spike': False, 'rsi_required': False, 'edge_k': 0.5856086115650517, 'edge_cap': 0.125697480699991, 'bull_strategy': 'breakout', 'bull_bb_std_mult': 2.911789862126067, 'bull_rsi_os': 17, 'bull_rsi_ob': 50, 'bull_adx_thresh': 25.0349313956353, 'bull_atr_min_pct': 0.0012938789450762226, 'bull_atr_max_pct': 0.08536893053591008, 'bull_tp_mult': 2.030745296186222, 'bull_tsl_mult': 0.5306721652928822, 'bull_time_stop': 155, 'bull_use_sma': True, 'bull_use_ema': False, 'bull_use_atr': False, 'bull_use_adx': True, 'bull_use_spike': True, 'bull_rsi_required': True, 'bear_strategy': 'mean_reversion', 'bear_bb_std_mult': 2.9113830224108335, 'bear_rsi_os': 14, 'bear_rsi_ob': 78, 'bear_adx_thresh': 29.457787654907285, 'bear_atr_min_pct': 0.01117576361360266, 'bear_atr_max_pct': 0.11143367760973037, 'bear_tp_mult': 2.551494860127395, 'bear_tsl_mult': 0.6517316819889041, 'bear_time_stop': 111, 'bear_use_sma': False, 'bear_use_ema': False, 'bear_use_atr': False, 'bear_use_adx': False, 'bear_use_spike': False, 'bear_rsi_required': True, 'sideways_strategy': 'mean_reversion', 'sideways_bb_std_mult': 2.5308153250476937, 'sideways_rsi_os': 11, 'sideways_rsi_ob': 86, 'sideways_adx_thresh': 32.70980567563909, 'sideways_atr_min_pct': 0.0035767832780347333, 'sideways_atr_max_pct': 0.13157504766819114, 'sideways_tp_mult': 2.6046927209739787, 'sideways_tsl_mult': 0.44866317695208974, 'sideways_time_stop': 111, 'sideways_use_sma': False, 'sideways_use_ema': True, 'sideways_use_atr': True, 'sideways_use_adx': False, 'sideways_use_spike': False, 'sideways_rsi_required': False}.
[I 2025-09-01 15:09:35,240] Trial 485 finished with values: [-1000000000.0, 1000000000.0] and parameters: {'p_sma': 19, 'p_std': 27, 'p_atr': 9, 'p_adx': 12, 'rsi_period': 63, 'ema1': 20, 'ema2': 20, 'slip_atr_k': 0.06418349916104724, 'slip_spread_k': 0.1841716904162172, 'spread_hl_frac': 0.008544504667750873, 'bb_std_mult': 1.1349868897081756, 'rsi_os': 17, 'rsi_ob': 72, 'vol_spike': 0.2945743079655944, 'adx_thresh': 6.117603468762857, 'atr_min_pct': 0.009750762323230267, 'atr_max_pct': 0.07117334359314181, 'tp_mult': 2.8857952377811955, 'tsl_mult': 0.06221582282176974, 'strategy': 'breakout', 'time_stop': 264, 'use_sma': False, 'use_atr': True, 'use_adx': True, 'use_ema': False, 'use_spike': True, 'rsi_required': False, 'edge_k': 1.3049450739198032, 'edge_cap': 0.19653983636338673, 'bull_strategy': 'breakout', 'bull_bb_std_mult': 3.0378667550472818, 'bull_rsi_os': 45, 'bull_rsi_ob': 95, 'bull_adx_thresh': 11.54541452274901, 'bull_atr_min_pct': 0.02881344975277795, 'bull_atr_max_pct': 0.020313708987868426, 'bull_tp_mult': 1.450644434517209, 'bull_tsl_mult': 0.3780341525404591, 'bull_time_stop': 171, 'bull_use_sma': True, 'bull_use_ema': False, 'bull_use_atr': False, 'bull_use_adx': True, 'bull_use_spike': False, 'bull_rsi_required': True, 'bear_strategy': 'mean_reversion', 'bear_bb_std_mult': 1.7010594937756003, 'bear_rsi_os': 9, 'bear_rsi_ob': 77, 'bear_adx_thresh': 24.52287799728277, 'bear_atr_min_pct': 0.024087746592811165, 'bear_atr_max_pct': 0.060930867176315906, 'bear_tp_mult': 2.1651550631253293, 'bear_tsl_mult': 0.9995951470689726, 'bear_time_stop': 76, 'bear_use_sma': False, 'bear_use_ema': False, 'bear_use_atr': False, 'bear_use_adx': True, 'bear_use_spike': False, 'bear_rsi_required': True, 'sideways_strategy': 'mean_reversion', 'sideways_bb_std_mult': 1.2181005960709728, 'sideways_rsi_os': 18, 'sideways_rsi_ob': 75, 'sideways_adx_thresh': 13.486035167140615, 'sideways_atr_min_pct': 0.0032155904125211895, 'sideways_atr_max_pct': 0.1380209165400951, 'sideways_tp_mult': 1.824897580651425, 'sideways_tsl_mult': 0.4976804590623286, 'sideways_time_stop': 111, 'sideways_use_sma': False, 'sideways_use_ema': False, 'sideways_use_atr': True, 'sideways_use_adx': False, 'sideways_use_spike': True, 'sideways_rsi_required': True}.
[I 2025-09-01 15:09:35,942] Trial 486 finished with values: [-1000000000.0, 1000000000.0] and parameters: {'p_sma': 10, 'p_std': 46, 'p_atr': 21, 'p_adx': 11, 'rsi_period': 63, 'ema1': 14, 'ema2': 53, 'slip_atr_k': 0.14169961167471973, 'slip_spread_k': 0.16689908427782546, 'spread_hl_frac': 0.01468994290036325, 'bb_std_mult': 1.1539660500505105, 'rsi_os': 10, 'rsi_ob': 72, 'vol_spike': 0.18058250928185318, 'adx_thresh': 6.161081964644296, 'atr_min_pct': 0.014349778013068176, 'atr_max_pct': 0.07163298921060443, 'tp_mult': 2.941275920478593, 'tsl_mult': 0.2210501714710168, 'strategy': 'breakout', 'time_stop': 173, 'use_sma': False, 'use_atr': True, 'use_adx': False, 'use_ema': False, 'use_spike': True, 'rsi_required': False, 'edge_k': 0.47266719790040157, 'edge_cap': 0.05063350203914654, 'bull_strategy': 'breakout', 'bull_bb_std_mult': 3.0467459952902187, 'bull_rsi_os': 45, 'bull_rsi_ob': 49, 'bull_adx_thresh': 6.957980692769411, 'bull_atr_min_pct': 0.01843660159347612, 'bull_atr_max_pct': 0.04693056545202498, 'bull_tp_mult': 2.0565994081230574, 'bull_tsl_mult': 0.6565729098574736, 'bull_time_stop': 138, 'bull_use_sma': True, 'bull_use_ema': False, 'bull_use_atr': False, 'bull_use_adx': True, 'bull_use_spike': False, 'bull_rsi_required': True, 'bear_strategy': 'mean_reversion', 'bear_bb_std_mult': 1.6714058688306923, 'bear_rsi_os': 11, 'bear_rsi_ob': 74, 'bear_adx_thresh': 28.146411107275153, 'bear_atr_min_pct': 0.002249832250909493, 'bear_atr_max_pct': 0.11347858785970316, 'bear_tp_mult': 2.4544702318441955, 'bear_tsl_mult': 0.3345194000532493, 'bear_time_stop': 230, 'bear_use_sma': False, 'bear_use_ema': False, 'bear_use_atr': False, 'bear_use_adx': True, 'bear_use_spike': False, 'bear_rsi_required': True, 'sideways_strategy': 'mean_reversion', 'sideways_bb_std_mult': 3.2427416293812326, 'sideways_rsi_os': 34, 'sideways_rsi_ob': 64, 'sideways_adx_thresh': 22.100556480698405, 'sideways_atr_min_pct': 0.004528897407441525, 'sideways_atr_max_pct': 0.1180972161138652, 'sideways_tp_mult': 1.8381424077628459, 'sideways_tsl_mult': 0.36323332396679664, 'sideways_time_stop': 37, 'sideways_use_sma': False, 'sideways_use_ema': False, 'sideways_use_atr': True, 'sideways_use_adx': False, 'sideways_use_spike': True, 'sideways_rsi_required': True}.
