[I 2025-09-01 14:14:55,327] Trial 141 finished with values: [-1000000000.0, 1000000000.0] and parameters: {'p_sma': 26, 'p_std': 56, 'p_atr': 30, 'p_adx': 19, 'rsi_period': 13, 'ema1': 20, 'ema2': 39, 'slip_atr_k': 0.1641832252503811, 'slip_spread_k': 0.807450263188257, 'spread_hl_frac': 0.015570633277297796, 'bb_std_mult': 2.515599518321021, 'rsi_os': 36, 'rsi_ob': 46, 'vol_spike': 0.07943105706252439, 'adx_thresh': 14.925604305306194, 'atr_min_pct': 0.02448278163688381, 'atr_max_pct': 0.057174159726242846, 'tp_mult': 1.3092077634698938, 'tsl_mult': 0.1763246070769639, 'strategy': 'breakout', 'time_stop': 149, 'use_sma': False, 'use_atr': False, 'use_adx': True, 'use_ema': True, 'use_spike': False, 'rsi_required': True, 'edge_k': 1.5348306852760438, 'edge_cap': 0.8798010668868403, 'bull_strategy': 'mean_reversion', 'bull_bb_std_mult': 2.2960228035343637, 'bull_rsi_os': 29, 'bull_rsi_ob': 55, 'bull_adx_thresh': 34.403039272676594, 'bull_atr_min_pct': 0.004455734503778617, 'bull_atr_max_pct': 0.09760456639023343, 'bull_tp_mult': 2.751365928877024, 'bull_tsl_mult': 0.7351552243806455, 'bull_time_stop': 78, 'bull_use_sma': False, 'bull_use_ema': False, 'bull_use_atr': True, 'bull_use_adx': True, 'bull_use_spike': True, 'bull_rsi_required': True, 'bear_strategy': 'mean_reversion', 'bear_bb_std_mult': 0.8225316163503921, 'bear_rsi_os': 42, 'bear_rsi_ob': 93, 'bear_adx_thresh': 34.080542016366685, 'bear_atr_min_pct': 0.012286913428327738, 'bear_atr_max_pct': 0.1406421180898142, 'bear_tp_mult': 1.3110334116093898, 'bear_tsl_mult': 0.2596523629040379, 'bear_time_stop': 266, 'bear_use_sma': True, 'bear_use_ema': False, 'bear_use_atr': False, 'bear_use_adx': False, 'bear_use_spike': True, 'bear_rsi_required': False, 'sideways_strategy': 'breakout', 'sideways_bb_std_mult': 2.9961122413003114, 'sideways_rsi_os': 43, 'sideways_rsi_ob': 55, 'sideways_adx_thresh': 16.2620953890357, 'sideways_atr_min_pct': 0.023890093507801136, 'sideways_atr_max_pct': 0.08839250824730652, 'sideways_tp_mult': 2.092892646998304, 'sideways_tsl_mult': 0.51539575776433, 'sideways_time_stop': 183, 'sideways_use_sma': True, 'sideways_use_ema': False, 'sideways_use_atr': True, 'sideways_use_adx': True, 'sideways_use_spike': False, 'sideways_rsi_required': False}.
[I 2025-09-01 14:14:55,328] Trial 145 finished with values: [-0.01976795704476353, 0.019797550507984152] and parameters: {'p_sma': 36, 'p_std': 53, 'p_atr': 14, 'p_adx': 19, 'rsi_period': 46, 'ema1': 20, 'ema2': 40, 'slip_atr_k': 0.21991703490582948, 'slip_spread_k': 0.42343136838819284, 'spread_hl_frac': 0.01874378129720035, 'bb_std_mult': 3.48077331726034, 'rsi_os': 13, 'rsi_ob': 69, 'vol_spike': 0.15520455873222602, 'adx_thresh': 22.988540133076313, 'atr_min_pct': 0.02442458411366604, 'atr_max_pct': 0.05583551296499498, 'tp_mult': 1.8495958124696958, 'tsl_mult': 0.7516747341624432, 'strategy': 'mean_reversion', 'time_stop': 179, 'use_sma': False, 'use_atr': False, 'use_adx': True, 'use_ema': False, 'use_spike': False, 'rsi_required': True, 'edge_k': 0.8355151570255781, 'edge_cap': 0.7759573130687305, 'bull_strategy': 'breakout', 'bull_bb_std_mult': 1.0492144367505316, 'bull_rsi_os': 13, 'bull_rsi_ob': 63, 'bull_adx_thresh': 33.595715213327836, 'bull_atr_min_pct': 0.0018309406398046616, 'bull_atr_max_pct': 0.12424870261437482, 'bull_tp_mult': 1.47381896412729, 'bull_tsl_mult': 0.0032109521864558867, 'bull_time_stop': 98, 'bull_use_sma': True, 'bull_use_ema': False, 'bull_use_atr': False, 'bull_use_adx': True, 'bull_use_spike': True, 'bull_rsi_required': True, 'bear_strategy': 'breakout', 'bear_bb_std_mult': 0.5858252057561326, 'bear_rsi_os': 10, 'bear_rsi_ob': 92, 'bear_adx_thresh': 7.106269921672993, 'bear_atr_min_pct': 0.019825824765398806, 'bear_atr_max_pct': 0.09485276477536878, 'bear_tp_mult': 2.8266216060509475, 'bear_tsl_mult': 0.26237514575095755, 'bear_time_stop': 108, 'bear_use_sma': True, 'bear_use_ema': False, 'bear_use_atr': False, 'bear_use_adx': True, 'bear_use_spike': True, 'bear_rsi_required': True, 'sideways_strategy': 'breakout', 'sideways_bb_std_mult': 1.5770414766316543, 'sideways_rsi_os': 19, 'sideways_rsi_ob': 51, 'sideways_adx_thresh': 28.89171479885185, 'sideways_atr_min_pct': 0.028635293932537942, 'sideways_atr_max_pct': 0.08189870631966303, 'sideways_tp_mult': 2.0827131003848973, 'sideways_tsl_mult': 0.41991038754996485, 'sideways_time_stop': 115, 'sideways_use_sma': True, 'sideways_use_ema': False, 'sideways_use_atr': True, 'sideways_use_adx': True, 'sideways_use_spike': False, 'sideways_rsi_required': False}.
[I 2025-09-01 14:14:55,741] Trial 149 finished with values: [-1000000000.0, 1000000000.0] and parameters: {'p_sma': 17, 'p_std': 54, 'p_atr': 25, 'p_adx': 8, 'rsi_period': 55, 'ema1': 19, 'ema2': 42, 'slip_atr_k': 0.021986088260389863, 'slip_spread_k': 0.40792304396778706, 'spread_hl_frac': 0.020218014760049776, 'bb_std_mult': 2.152232724742771, 'rsi_os': 51, 'rsi_ob': 52, 'vol_spike': 0.12367365820547399, 'adx_thresh': 22.594240601519523, 'atr_min_pct': 0.01022220277557307, 'atr_max_pct': 0.1255258255752275, 'tp_mult': 1.0994618308940365, 'tsl_mult': 0.15734161609423142, 'strategy': 'mean_reversion', 'time_stop': 176, 'use_sma': False, 'use_atr': True, 'use_adx': True, 'use_ema': False, 'use_spike': False, 'rsi_required': False, 'edge_k': 0.21098281504050775, 'edge_cap': 0.0997792272120942, 'bull_strategy': 'mean_reversion', 'bull_bb_std_mult': 1.1123929784383462, 'bull_rsi_os': 33, 'bull_rsi_ob': 66, 'bull_adx_thresh': 26.446117584167723, 'bull_atr_min_pct': 0.025836122670005304, 'bull_atr_max_pct': 0.11559232825905735, 'bull_tp_mult': 2.3549490307482595, 'bull_tsl_mult': 0.0012599127715311152, 'bull_time_stop': 285, 'bull_use_sma': True, 'bull_use_ema': True, 'bull_use_atr': False, 'bull_use_adx': True, 'bull_use_spike': False, 'bull_rsi_required': False, 'bear_strategy': 'breakout', 'bear_bb_std_mult': 1.665305345575318, 'bear_rsi_os': 33, 'bear_rsi_ob': 95, 'bear_adx_thresh': 25.931756601601034, 'bear_atr_min_pct': 0.023230214985795354, 'bear_atr_max_pct': 0.09643852665017394, 'bear_tp_mult': 2.818673018940782, 'bear_tsl_mult': 0.19051040050972762, 'bear_time_stop': 294, 'bear_use_sma': False, 'bear_use_ema': False, 'bear_use_atr': True, 'bear_use_adx': True, 'bear_use_spike': False, 'bear_rsi_required': True, 'sideways_strategy': 'mean_reversion', 'sideways_bb_std_mult': 1.7736743275842162, 'sideways_rsi_os': 35, 'sideways_rsi_ob': 51, 'sideways_adx_thresh': 9.702864715252042, 'sideways_atr_min_pct': 0.008732911871680732, 'sideways_atr_max_pct': 0.13779743311323192, 'sideways_tp_mult': 2.3170983081779375, 'sideways_tsl_mult': 0.41427935753551887, 'sideways_time_stop': 274, 'sideways_use_sma': False, 'sideways_use_ema': False, 'sideways_use_atr': True, 'sideways_use_adx': False, 'sideways_use_spike': True, 'sideways_rsi_required': True}.
[I 2025-09-01 14:14:55,744] Trial 146 finished with values: [-1000000000.0, 1000000000.0] and parameters: {'p_sma': 37, 'p_std': 24, 'p_atr': 25, 'p_adx': 13, 'rsi_period': 12, 'ema1': 26, 'ema2': 42, 'slip_atr_k': 0.22453594684988581, 'slip_spread_k': 0.42070424996396033, 'spread_hl_frac': 0.016197370911340943, 'bb_std_mult': 2.1166274300587276, 'rsi_os': 13, 'rsi_ob': 54, 'vol_spike': 0.04314979594001879, 'adx_thresh': 14.892362714309755, 'atr_min_pct': 0.0271473011798255, 'atr_max_pct': 0.018745058946525756, 'tp_mult': 2.141851465164218, 'tsl_mult': 0.15624225064952135, 'strategy': 'mean_reversion', 'time_stop': 178, 'use_sma': False, 'use_atr': False, 'use_adx': True, 'use_ema': False, 'use_spike': False, 'rsi_required': True, 'edge_k': 0.9478271117153525, 'edge_cap': 0.7802289150276946, 'bull_strategy': 'mean_reversion', 'bull_bb_std_mult': 1.321990503002589, 'bull_rsi_os': 14, 'bull_rsi_ob': 74, 'bull_adx_thresh': 23.3948977629545, 'bull_atr_min_pct': 0.027547791771310788, 'bull_atr_max_pct': 0.09772008925569228, 'bull_tp_mult': 1.4772088436223771, 'bull_tsl_mult': 0.9247900493885637, 'bull_time_stop': 284, 'bull_use_sma': True, 'bull_use_ema': False, 'bull_use_atr': False, 'bull_use_adx': True, 'bull_use_spike': True, 'bull_rsi_required': True, 'bear_strategy': 'breakout', 'bear_bb_std_mult': 1.722492999816234, 'bear_rsi_os': 33, 'bear_rsi_ob': 88, 'bear_adx_thresh': 18.536194559165416, 'bear_atr_min_pct': 0.012975324745526975, 'bear_atr_max_pct': 0.1305442346414165, 'bear_tp_mult': 2.831464647085512, 'bear_tsl_mult': 0.2606711378989367, 'bear_time_stop': 109, 'bear_use_sma': True, 'bear_use_ema': True, 'bear_use_atr': False, 'bear_use_adx': True, 'bear_use_spike': True, 'bear_rsi_required': True, 'sideways_strategy': 'breakout', 'sideways_bb_std_mult': 2.958527096922034, 'sideways_rsi_os': 21, 'sideways_rsi_ob': 50, 'sideways_adx_thresh': 34.94612119611345, 'sideways_atr_min_pct': 0.004955197218099462, 'sideways_atr_max_pct': 0.027721927956755932, 'sideways_tp_mult': 2.7412182981728748, 'sideways_tsl_mult': 0.6829476547875956, 'sideways_time_stop': 121, 'sideways_use_sma': True, 'sideways_use_ema': False, 'sideways_use_atr': True, 'sideways_use_adx': True, 'sideways_use_spike': False, 'sideways_rsi_required': False}.
[I 2025-09-01 14:14:55,749] Trial 148 finished with values: [-1000000000.0, 1000000000.0] and parameters: {'p_sma': 38, 'p_std': 53, 'p_atr': 25, 'p_adx': 12, 'rsi_period': 62, 'ema1': 19, 'ema2': 42, 'slip_atr_k': 0.022669894039477348, 'slip_spread_k': 0.4225215850015437, 'spread_hl_frac': 0.032911725289133116, 'bb_std_mult': 1.2585214371543, 'rsi_os': 51, 'rsi_ob': 83, 'vol_spike': 0.21976832085346631, 'adx_thresh': 22.813144235121733, 'atr_min_pct': 0.008820513821991314, 'atr_max_pct': 0.0899676603369102, 'tp_mult': 1.1002961148950625, 'tsl_mult': 0.15997533145967616, 'strategy': 'mean_reversion', 'time_stop': 176, 'use_sma': False, 'use_atr': True, 'use_adx': True, 'use_ema': False, 'use_spike': False, 'rsi_required': False, 'edge_k': 1.8084577609286745, 'edge_cap': 0.38647674537092536, 'bull_strategy': 'mean_reversion', 'bull_bb_std_mult': 1.0897754403739286, 'bull_rsi_os': 31, 'bull_rsi_ob': 66, 'bull_adx_thresh': 12.856677080658342, 'bull_atr_min_pct': 0.011948863544149178, 'bull_atr_max_pct': 0.04306915894634893, 'bull_tp_mult': 2.1788072244198977, 'bull_tsl_mult': 0.004384207563559428, 'bull_time_stop': 99, 'bull_use_sma': True, 'bull_use_ema': True, 'bull_use_atr': False, 'bull_use_adx': True, 'bull_use_spike': False, 'bull_rsi_required': False, 'bear_strategy': 'breakout', 'bear_bb_std_mult': 1.7044669945716868, 'bear_rsi_os': 12, 'bear_rsi_ob': 80, 'bear_adx_thresh': 25.701593791382738, 'bear_atr_min_pct': 0.019849887920366086, 'bear_atr_max_pct': 0.025403858885345413, 'bear_tp_mult': 2.1116327052624673, 'bear_tsl_mult': 0.5268033935335212, 'bear_time_stop': 109, 'bear_use_sma': False, 'bear_use_ema': False, 'bear_use_atr': True, 'bear_use_adx': True, 'bear_use_spike': False, 'bear_rsi_required': True, 'sideways_strategy': 'mean_reversion', 'sideways_bb_std_mult': 1.812151428950792, 'sideways_rsi_os': 52, 'sideways_rsi_ob': 90, 'sideways_adx_thresh': 22.146455982144346, 'sideways_atr_min_pct': 0.00862142386761935, 'sideways_atr_max_pct': 0.07995950032248164, 'sideways_tp_mult': 2.306055407395395, 'sideways_tsl_mult': 0.34148038634771816, 'sideways_time_stop': 199, 'sideways_use_sma': False, 'sideways_use_ema': False, 'sideways_use_atr': True, 'sideways_use_adx': False, 'sideways_use_spike': True, 'sideways_rsi_required': True}.
[I 2025-09-01 14:14:56,149] Trial 152 finished with values: [-1000000000.0, 1000000000.0] and parameters: {'p_sma': 40, 'p_std': 36, 'p_atr': 7, 'p_adx': 20, 'rsi_period': 60, 'ema1': 18, 'ema2': 59, 'slip_atr_k': 0.24080439646726814, 'slip_spread_k': 0.6756175101576057, 'spread_hl_frac': 0.0010208584024335617, 'bb_std_mult': 1.9444518721788706, 'rsi_os': 55, 'rsi_ob': 93, 'vol_spike': 0.06468194371970169, 'adx_thresh': 21.85483047953422, 'atr_min_pct': 0.021398136741155416, 'atr_max_pct': 0.14513063438186283, 'tp_mult': 2.0087646601643043, 'tsl_mult': 0.28157287832079203, 'strategy': 'mean_reversion', 'time_stop': 51, 'use_sma': False, 'use_atr': False, 'use_adx': False, 'use_ema': False, 'use_spike': False, 'rsi_required': True, 'edge_k': 0.8202311862851981, 'edge_cap': 0.27056466424778036, 'bull_strategy': 'breakout', 'bull_bb_std_mult': 0.741086705589693, 'bull_rsi_os': 32, 'bull_rsi_ob': 49, 'bull_adx_thresh': 8.071421217394834, 'bull_atr_min_pct': 0.001750397530516645, 'bull_atr_max_pct': 0.10316675619411511, 'bull_tp_mult': 2.9273440361421357, 'bull_tsl_mult': 0.4137929861137413, 'bull_time_stop': 23, 'bull_use_sma': True, 'bull_use_ema': True, 'bull_use_atr': True, 'bull_use_adx': True, 'bull_use_spike': True, 'bull_rsi_required': True, 'bear_strategy': 'breakout', 'bear_bb_std_mult': 3.2337215453237644, 'bear_rsi_os': 13, 'bear_rsi_ob': 55, 'bear_adx_thresh': 22.71244317667347, 'bear_atr_min_pct': 0.007812639331197892, 'bear_atr_max_pct': 0.012363922564376566, 'bear_tp_mult': 2.7513110571949855, 'bear_tsl_mult': 0.29816437091503495, 'bear_time_stop': 259, 'bear_use_sma': True, 'bear_use_ema': False, 'bear_use_atr': True, 'bear_use_adx': False, 'bear_use_spike': True, 'bear_rsi_required': True, 'sideways_strategy': 'breakout', 'sideways_bb_std_mult': 2.7912010154696905, 'sideways_rsi_os': 17, 'sideways_rsi_ob': 48, 'sideways_adx_thresh': 7.492652988474461, 'sideways_atr_min_pct': 0.0076478493751003605, 'sideways_atr_max_pct': 0.038039679242979414, 'sideways_tp_mult': 2.2718040132904718, 'sideways_tsl_mult': 0.060836377481423065, 'sideways_time_stop': 138, 'sideways_use_sma': True, 'sideways_use_ema': True, 'sideways_use_atr': True, 'sideways_use_adx': True, 'sideways_use_spike': False, 'sideways_rsi_required': False}.
[I 2025-09-01 14:15:38,216] Trial 147 finished with values: [-1000000000.0, 1000000000.0] and parameters: {'p_sma': 36, 'p_std': 53, 'p_atr': 7, 'p_adx': 12, 'rsi_period': 55, 'ema1': 20, 'ema2': 20, 'slip_atr_k': 0.07273058679174013, 'slip_spread_k': 0.41730507410562273, 'spread_hl_frac': 0.020115375961140575, 'bb_std_mult': 2.1325066374888855, 'rsi_os': 6, 'rsi_ob': 94, 'vol_spike': 0.044632714898523676, 'adx_thresh': 16.28274606063141, 'atr_min_pct': 0.021109252371857932, 'atr_max_pct': 0.08918741087462859, 'tp_mult': 1.1102270854093965, 'tsl_mult': 0.28519443875069933, 'strategy': 'mean_reversion', 'time_stop': 180, 'use_sma': False, 'use_atr': False, 'use_adx': True, 'use_ema': False, 'use_spike': False, 'rsi_required': True, 'edge_k': 0.8373488742502948, 'edge_cap': 0.37602545548383653, 'bull_strategy': 'mean_reversion', 'bull_bb_std_mult': 1.0610409053607823, 'bull_rsi_os': 32, 'bull_rsi_ob': 53, 'bull_adx_thresh': 7.68248305472282, 'bull_atr_min_pct': 0.012062146259940312, 'bull_atr_max_pct': 0.09727951775648333, 'bull_tp_mult': 2.182048756991816, 'bull_tsl_mult': 0.9243125921693718, 'bull_time_stop': 79, 'bull_use_sma': True, 'bull_use_ema': True, 'bull_use_atr': False, 'bull_use_adx': True, 'bull_use_spike': True, 'bull_rsi_required': False, 'bear_strategy': 'breakout', 'bear_bb_std_mult': 1.7215728016159877, 'bear_rsi_os': 13, 'bear_rsi_ob': 88, 'bear_adx_thresh': 17.3108165007374, 'bear_atr_min_pct': 0.013037453116658108, 'bear_atr_max_pct': 0.09459275905788869, 'bear_tp_mult': 2.811275822736025, 'bear_tsl_mult': 0.19851735695768707, 'bear_time_stop': 267, 'bear_use_sma': False, 'bear_use_ema': True, 'bear_use_atr': True, 'bear_use_adx': True, 'bear_use_spike': True, 'bear_rsi_required': True, 'sideways_strategy': 'breakout', 'sideways_bb_std_mult': 2.8247582873238537, 'sideways_rsi_os': 51, 'sideways_rsi_ob': 50, 'sideways_adx_thresh': 28.90347798334495, 'sideways_atr_min_pct': 0.016759316862290864, 'sideways_atr_max_pct': 0.054445098150870175, 'sideways_tp_mult': 2.288311023987898, 'sideways_tsl_mult': 0.5600447663816802, 'sideways_time_stop': 116, 'sideways_use_sma': True, 'sideways_use_ema': True, 'sideways_use_atr': True, 'sideways_use_adx': True, 'sideways_use_spike': False, 'sideways_rsi_required': False}.
[I 2025-09-01 14:15:41,319] Trial 151 finished with values: [-1000000000.0, 1000000000.0] and parameters: {'p_sma': 40, 'p_std': 36, 'p_atr': 7, 'p_adx': 20, 'rsi_period': 62, 'ema1': 18, 'ema2': 44, 'slip_atr_k': 0.2387766191544651, 'slip_spread_k': 0.6722705821342186, 'spread_hl_frac': 0.025241904373229793, 'bb_std_mult': 3.5389717560330314, 'rsi_os': 19, 'rsi_ob': 75, 'vol_spike': 0.06839984471673646, 'adx_thresh': 23.758011762010884, 'atr_min_pct': 0.020867405576901827, 'atr_max_pct': 0.024630446984120084, 'tp_mult': 2.015616515421873, 'tsl_mult': 0.8288424613601796, 'strategy': 'mean_reversion', 'time_stop': 35, 'use_sma': False, 'use_atr': True, 'use_adx': False, 'use_ema': False, 'use_spike': False, 'rsi_required': False, 'edge_k': 0.8248613564639669, 'edge_cap': 0.16922900327148366, 'bull_strategy': 'mean_reversion', 'bull_bb_std_mult': 1.0829537607245803, 'bull_rsi_os': 31, 'bull_rsi_ob': 49, 'bull_adx_thresh': 31.799817180167448, 'bull_atr_min_pct': 0.001866630596467536, 'bull_atr_max_pct': 0.12527500364722735, 'bull_tp_mult': 1.4046169440075131, 'bull_tsl_mult': 0.4089812727699699, 'bull_time_stop': 98, 'bull_use_sma': True, 'bull_use_ema': True, 'bull_use_atr': True, 'bull_use_adx': True, 'bull_use_spike': True, 'bull_rsi_required': False, 'bear_strategy': 'breakout', 'bear_bb_std_mult': 1.605372387855463, 'bear_rsi_os': 12, 'bear_rsi_ob': 89, 'bear_adx_thresh': 22.379962942600628, 'bear_atr_min_pct': 0.01999684085896602, 'bear_atr_max_pct': 0.010020821722350026, 'bear_tp_mult': 2.4633003523203265, 'bear_tsl_mult': 0.2947179711178731, 'bear_time_stop': 125, 'bear_use_sma': False, 'bear_use_ema': False, 'bear_use_atr': True, 'bear_use_adx': False, 'bear_use_spike': False, 'bear_rsi_required': True, 'sideways_strategy': 'mean_reversion', 'sideways_bb_std_mult': 2.831941565165059, 'sideways_rsi_os': 51, 'sideways_rsi_ob': 61, 'sideways_adx_thresh': 21.867116734257095, 'sideways_atr_min_pct': 0.01338136093010087, 'sideways_atr_max_pct': 0.0806205566245114, 'sideways_tp_mult': 2.2672560520628937, 'sideways_tsl_mult': 0.8061688479317702, 'sideways_time_stop': 45, 'sideways_use_sma': False, 'sideways_use_ema': True, 'sideways_use_atr': True, 'sideways_use_adx': True, 'sideways_use_spike': False, 'sideways_rsi_required': False}.
[I 2025-09-01 14:15:41,653] Trial 150 finished with values: [-1000000000.0, 1000000000.0] and parameters: {'p_sma': 40, 'p_std': 36, 'p_atr': 10, 'p_adx': 16, 'rsi_period': 59, 'ema1': 18, 'ema2': 58, 'slip_atr_k': 0.24527797685019628, 'slip_spread_k': 0.42386425337505185, 'spread_hl_frac': 0.01939701850055223, 'bb_std_mult': 1.2913508326542225, 'rsi_os': 13, 'rsi_ob': 83, 'vol_spike': 0.06705364996407313, 'adx_thresh': 23.65363131868014, 'atr_min_pct': 0.017157758066005113, 'atr_max_pct': 0.14400666894329017, 'tp_mult': 1.8708558669950435, 'tsl_mult': 0.7219601838139774, 'strategy': 'mean_reversion', 'time_stop': 248, 'use_sma': False, 'use_atr': False, 'use_adx': False, 'use_ema': False, 'use_spike': False, 'rsi_required': True, 'edge_k': 1.4563306315725768, 'edge_cap': 0.7416825638288606, 'bull_strategy': 'mean_reversion', 'bull_bb_std_mult': 1.0775132153408127, 'bull_rsi_os': 32, 'bull_rsi_ob': 49, 'bull_adx_thresh': 7.733535645650586, 'bull_atr_min_pct': 0.02120432721993212, 'bull_atr_max_pct': 0.041654925352645394, 'bull_tp_mult': 1.4112661468582692, 'bull_tsl_mult': 0.9282399159582662, 'bull_time_stop': 96, 'bull_use_sma': True, 'bull_use_ema': True, 'bull_use_atr': False, 'bull_use_adx': True, 'bull_use_spike': True, 'bull_rsi_required': False, 'bear_strategy': 'breakout', 'bear_bb_std_mult': 1.823326400931292, 'bear_rsi_os': 12, 'bear_rsi_ob': 88, 'bear_adx_thresh': 31.420447790601834, 'bear_atr_min_pct': 0.020113225645184335, 'bear_atr_max_pct': 0.12358494519006355, 'bear_tp_mult': 2.1081871379147494, 'bear_tsl_mult': 0.3062029684223174, 'bear_time_stop': 125, 'bear_use_sma': True, 'bear_use_ema': True, 'bear_use_atr': True, 'bear_use_adx': True, 'bear_use_spike': True, 'bear_rsi_required': True, 'sideways_strategy': 'breakout', 'sideways_bb_std_mult': 2.801587177163855, 'sideways_rsi_os': 51, 'sideways_rsi_ob': 50, 'sideways_adx_thresh': 11.739265707715854, 'sideways_atr_min_pct': 0.005445369993765147, 'sideways_atr_max_pct': 0.07496756075852402, 'sideways_tp_mult': 2.2837100450082786, 'sideways_tsl_mult': 0.6120507572000695, 'sideways_time_stop': 202, 'sideways_use_sma': True, 'sideways_use_ema': True, 'sideways_use_atr': True, 'sideways_use_adx': True, 'sideways_use_spike': False, 'sideways_rsi_required': False}.
