[I 2025-09-01 14:15:42,421] Trial 153 finished with values: [-1000000000.0, 1000000000.0] and parameters: {'p_sma': 38, 'p_std': 43, 'p_atr': 10, 'p_adx': 22, 'rsi_period': 47, 'ema1': 20, 'ema2': 44, 'slip_atr_k': 0.07221968061907313, 'slip_spread_k': 0.45343587955873926, 'spread_hl_frac': 0.025675037295085298, 'bb_std_mult': 3.5407986259999644, 'rsi_os': 16, 'rsi_ob': 77, 'vol_spike': 0.06766422042350373, 'adx_thresh': 23.754199539300245, 'atr_min_pct': 0.017174488628074528, 'atr_max_pct': 0.12447150497573112, 'tp_mult': 2.411898612899759, 'tsl_mult': 0.8853480130578286, 'strategy': 'mean_reversion', 'time_stop': 138, 'use_sma': True, 'use_atr': False, 'use_adx': False, 'use_ema': False, 'use_spike': False, 'rsi_required': True, 'edge_k': 1.4410988455580438, 'edge_cap': 0.16755106649779639, 'bull_strategy': 'mean_reversion', 'bull_bb_std_mult': 3.4496319562760487, 'bull_rsi_os': 36, 'bull_rsi_ob': 54, 'bull_adx_thresh': 17.159584891651438, 'bull_atr_min_pct': 0.019585440496649276, 'bull_atr_max_pct': 0.12028937910025407, 'bull_tp_mult': 1.1073787306488434, 'bull_tsl_mult': 0.09093512558216643, 'bull_time_stop': 89, 'bull_use_sma': True, 'bull_use_ema': True, 'bull_use_atr': True, 'bull_use_adx': True, 'bull_use_spike': True, 'bull_rsi_required': True, 'bear_strategy': 'breakout', 'bear_bb_std_mult': 1.8355680177469578, 'bear_rsi_os': 29, 'bear_rsi_ob': 89, 'bear_adx_thresh': 7.268058375257834, 'bear_atr_min_pct': 0.016357253041499212, 'bear_atr_max_pct': 0.05654540326769805, 'bear_tp_mult': 2.678070833466289, 'bear_tsl_mult': 0.14679086304552702, 'bear_time_stop': 238, 'bear_use_sma': True, 'bear_use_ema': True, 'bear_use_atr': True, 'bear_use_adx': False, 'bear_use_spike': True, 'bear_rsi_required': True, 'sideways_strategy': 'breakout', 'sideways_bb_std_mult': 2.836440011780951, 'sideways_rsi_os': 22, 'sideways_rsi_ob': 52, 'sideways_adx_thresh': 23.667523130034944, 'sideways_atr_min_pct': 0.0224533748777627, 'sideways_atr_max_pct': 0.016829987493455364, 'sideways_tp_mult': 2.353259784309537, 'sideways_tsl_mult': 0.5629363818175407, 'sideways_time_stop': 129, 'sideways_use_sma': True, 'sideways_use_ema': True, 'sideways_use_atr': False, 'sideways_use_adx': True, 'sideways_use_spike': False, 'sideways_rsi_required': False}.
[I 2025-09-01 14:16:21,173] Trial 154 finished with values: [-1000000000.0, 1000000000.0] and parameters: {'p_sma': 38, 'p_std': 51, 'p_atr': 10, 'p_adx': 23, 'rsi_period': 32, 'ema1': 21, 'ema2': 40, 'slip_atr_k': 0.21970409184607306, 'slip_spread_k': 0.3456573667834613, 'spread_hl_frac': 0.02565031140768166, 'bb_std_mult': 2.2902058025133027, 'rsi_os': 19, 'rsi_ob': 62, 'vol_spike': 0.0668224540528866, 'adx_thresh': 23.439584419012764, 'atr_min_pct': 0.008318640978455354, 'atr_max_pct': 0.12327362337741173, 'tp_mult': 1.0121307753735795, 'tsl_mult': 0.2146471891198944, 'strategy': 'mean_reversion', 'time_stop': 168, 'use_sma': True, 'use_atr': False, 'use_adx': True, 'use_ema': False, 'use_spike': False, 'rsi_required': True, 'edge_k': 1.0054294162166868, 'edge_cap': 0.1683226044432951, 'bull_strategy': 'breakout', 'bull_bb_std_mult': 3.4815542381291786, 'bull_rsi_os': 11, 'bull_rsi_ob': 57, 'bull_adx_thresh': 6.95668841225885, 'bull_atr_min_pct': 0.016368834533326375, 'bull_atr_max_pct': 0.11992858035493213, 'bull_tp_mult': 1.3825752165400913, 'bull_tsl_mult': 0.028361048927327475, 'bull_time_stop': 116, 'bull_use_sma': False, 'bull_use_ema': True, 'bull_use_atr': True, 'bull_use_adx': True, 'bull_use_spike': True, 'bull_rsi_required': True, 'bear_strategy': 'breakout', 'bear_bb_std_mult': 0.9286526431840629, 'bear_rsi_os': 12, 'bear_rsi_ob': 89, 'bear_adx_thresh': 5.739822092582978, 'bear_atr_min_pct': 0.017765968584811113, 'bear_atr_max_pct': 0.1241724934355759, 'bear_tp_mult': 2.68159066497443, 'bear_tsl_mult': 0.3459487173200557, 'bear_time_stop': 121, 'bear_use_sma': True, 'bear_use_ema': False, 'bear_use_atr': True, 'bear_use_adx': False, 'bear_use_spike': True, 'bear_rsi_required': True, 'sideways_strategy': 'breakout', 'sideways_bb_std_mult': 3.107851846445607, 'sideways_rsi_os': 22, 'sideways_rsi_ob': 52, 'sideways_adx_thresh': 23.862484948582974, 'sideways_atr_min_pct': 0.015614103427746221, 'sideways_atr_max_pct': 0.07501474454292109, 'sideways_tp_mult': 1.4903608522462917, 'sideways_tsl_mult': 0.7428574607782132, 'sideways_time_stop': 130, 'sideways_use_sma': True, 'sideways_use_ema': False, 'sideways_use_atr': False, 'sideways_use_adx': True, 'sideways_use_spike': False, 'sideways_rsi_required': False}.
[I 2025-09-01 14:16:23,029] Trial 157 finished with values: [-1000000000.0, 1000000000.0] and parameters: {'p_sma': 57, 'p_std': 51, 'p_atr': 24, 'p_adx': 10, 'rsi_period': 68, 'ema1': 21, 'ema2': 41, 'slip_atr_k': 0.21874147385224607, 'slip_spread_k': 0.316973464991793, 'spread_hl_frac': 0.003296727490754027, 'bb_std_mult': 3.305021546474292, 'rsi_os': 17, 'rsi_ob': 62, 'vol_spike': 0.16589565855244656, 'adx_thresh': 20.90585394149979, 'atr_min_pct': 0.008081944825990173, 'atr_max_pct': 0.11553167113769419, 'tp_mult': 1.8424168967474692, 'tsl_mult': 0.7818627203730305, 'strategy': 'mean_reversion', 'time_stop': 168, 'use_sma': True, 'use_atr': False, 'use_adx': True, 'use_ema': True, 'use_spike': True, 'rsi_required': True, 'edge_k': 1.0071648379335993, 'edge_cap': 0.8365986344642451, 'bull_strategy': 'breakout', 'bull_bb_std_mult': 2.745264202179349, 'bull_rsi_os': 12, 'bull_rsi_ob': 71, 'bull_adx_thresh': 6.620768816197675, 'bull_atr_min_pct': 0.02920672820568089, 'bull_atr_max_pct': 0.11990246248794227, 'bull_tp_mult': 1.5372470253257196, 'bull_tsl_mult': 0.029473498081420885, 'bull_time_stop': 227, 'bull_use_sma': False, 'bull_use_ema': True, 'bull_use_atr': True, 'bull_use_adx': False, 'bull_use_spike': False, 'bull_rsi_required': True, 'bear_strategy': 'breakout', 'bear_bb_std_mult': 0.9192496803910034, 'bear_rsi_os': 20, 'bear_rsi_ob': 90, 'bear_adx_thresh': 5.169568993739436, 'bear_atr_min_pct': 0.014249926316459487, 'bear_atr_max_pct': 0.1080881301414676, 'bear_tp_mult': 2.729163270488901, 'bear_tsl_mult': 0.3415484201152235, 'bear_time_stop': 262, 'bear_use_sma': True, 'bear_use_ema': False, 'bear_use_atr': True, 'bear_use_adx': False, 'bear_use_spike': True, 'bear_rsi_required': True, 'sideways_strategy': 'breakout', 'sideways_bb_std_mult': 0.6803590152158281, 'sideways_rsi_os': 24, 'sideways_rsi_ob': 53, 'sideways_adx_thresh': 22.60233209517098, 'sideways_atr_min_pct': 0.02997434895979399, 'sideways_atr_max_pct': 0.07111140775382598, 'sideways_tp_mult': 2.9969206471372054, 'sideways_tsl_mult': 0.3923396540744334, 'sideways_time_stop': 218, 'sideways_use_sma': True, 'sideways_use_ema': False, 'sideways_use_atr': False, 'sideways_use_adx': True, 'sideways_use_spike': False, 'sideways_rsi_required': False}.
[I 2025-09-01 14:16:24,035] Trial 156 finished with values: [-1000000000.0, 1000000000.0] and parameters: {'p_sma': 35, 'p_std': 51, 'p_atr': 24, 'p_adx': 22, 'rsi_period': 47, 'ema1': 24, 'ema2': 41, 'slip_atr_k': 0.036045893011659766, 'slip_spread_k': 0.3495896914211561, 'spread_hl_frac': 0.0214834247006072, 'bb_std_mult': 1.864299666436067, 'rsi_os': 28, 'rsi_ob': 64, 'vol_spike': 0.056276414302811245, 'adx_thresh': 20.247422475765323, 'atr_min_pct': 0.008308395140626436, 'atr_max_pct': 0.11616542821055939, 'tp_mult': 1.8194905530430527, 'tsl_mult': 0.20014874627305296, 'strategy': 'mean_reversion', 'time_stop': 236, 'use_sma': True, 'use_atr': False, 'use_adx': True, 'use_ema': True, 'use_spike': True, 'rsi_required': True, 'edge_k': 1.0203535716232572, 'edge_cap': 0.7950999652210275, 'bull_strategy': 'breakout', 'bull_bb_std_mult': 3.4498058038527746, 'bull_rsi_os': 11, 'bull_rsi_ob': 53, 'bull_adx_thresh': 6.806789811797501, 'bull_atr_min_pct': 0.02285269296369627, 'bull_atr_max_pct': 0.12040907577670457, 'bull_tp_mult': 1.0804348561589328, 'bull_tsl_mult': 0.02299009827050113, 'bull_time_stop': 116, 'bull_use_sma': False, 'bull_use_ema': True, 'bull_use_atr': True, 'bull_use_adx': False, 'bull_use_spike': True, 'bull_rsi_required': True, 'bear_strategy': 'breakout', 'bear_bb_std_mult': 3.5032279359344978, 'bear_rsi_os': 30, 'bear_rsi_ob': 90, 'bear_adx_thresh': 11.281561024704775, 'bear_atr_min_pct': 0.01795744801256296, 'bear_atr_max_pct': 0.016471580989466262, 'bear_tp_mult': 2.6745142097591676, 'bear_tsl_mult': 0.3509973499574015, 'bear_time_stop': 208, 'bear_use_sma': True, 'bear_use_ema': False, 'bear_use_atr': True, 'bear_use_adx': False, 'bear_use_spike': True, 'bear_rsi_required': True, 'sideways_strategy': 'breakout', 'sideways_bb_std_mult': 3.1090059218509145, 'sideways_rsi_os': 22, 'sideways_rsi_ob': 52, 'sideways_adx_thresh': 23.642363283171942, 'sideways_atr_min_pct': 0.022704950880486695, 'sideways_atr_max_pct': 0.0855814468219944, 'sideways_tp_mult': 2.994115527542713, 'sideways_tsl_mult': 0.3948037523942164, 'sideways_time_stop': 192, 'sideways_use_sma': True, 'sideways_use_ema': False, 'sideways_use_atr': False, 'sideways_use_adx': True, 'sideways_use_spike': False, 'sideways_rsi_required': False}.
[I 2025-09-01 14:16:24,583] Trial 155 finished with values: [-0.23578936406835616, 0.23567656320054792] and parameters: {'p_sma': 35, 'p_std': 51, 'p_atr': 12, 'p_adx': 22, 'rsi_period': 59, 'ema1': 13, 'ema2': 41, 'slip_atr_k': 0.23100995239451533, 'slip_spread_k': 0.34903343532452197, 'spread_hl_frac': 0.02164799305633508, 'bb_std_mult': 2.266557692963976, 'rsi_os': 16, 'rsi_ob': 62, 'vol_spike': 0.17188107412882317, 'adx_thresh': 23.43522088358953, 'atr_min_pct': 0.008285049055118503, 'atr_max_pct': 0.12200977795743972, 'tp_mult': 1.8651751306537274, 'tsl_mult': 0.20660538476333118, 'strategy': 'mean_reversion', 'time_stop': 136, 'use_sma': True, 'use_atr': False, 'use_adx': True, 'use_ema': True, 'use_spike': False, 'rsi_required': True, 'edge_k': 0.9996826339387047, 'edge_cap': 0.7929566493739896, 'bull_strategy': 'breakout', 'bull_bb_std_mult': 0.9961756548928744, 'bull_rsi_os': 33, 'bull_rsi_ob': 53, 'bull_adx_thresh': 6.756358552155735, 'bull_atr_min_pct': 0.010741338120831539, 'bull_atr_max_pct': 0.12047887941890148, 'bull_tp_mult': 1.1069933352562025, 'bull_tsl_mult': 0.029840793966125132, 'bull_time_stop': 92, 'bull_use_sma': False, 'bull_use_ema': True, 'bull_use_atr': True, 'bull_use_adx': False, 'bull_use_spike': True, 'bull_rsi_required': True, 'bear_strategy': 'breakout', 'bear_bb_std_mult': 1.849320284295089, 'bear_rsi_os': 20, 'bear_rsi_ob': 90, 'bear_adx_thresh': 13.281958763058899, 'bear_atr_min_pct': 0.017786089177280563, 'bear_atr_max_pct': 0.12422183782637203, 'bear_tp_mult': 1.940419526590905, 'bear_tsl_mult': 0.5460724877338553, 'bear_time_stop': 228, 'bear_use_sma': True, 'bear_use_ema': True, 'bear_use_atr': True, 'bear_use_adx': False, 'bear_use_spike': True, 'bear_rsi_required': True, 'sideways_strategy': 'breakout', 'sideways_bb_std_mult': 3.1102106473385156, 'sideways_rsi_os': 22, 'sideways_rsi_ob': 52, 'sideways_adx_thresh': 12.306398733463048, 'sideways_atr_min_pct': 0.0007214666579435439, 'sideways_atr_max_pct': 0.07598953163203895, 'sideways_tp_mult': 2.9930850810909853, 'sideways_tsl_mult': 0.7310992036904995, 'sideways_time_stop': 131, 'sideways_use_sma': True, 'sideways_use_ema': False, 'sideways_use_atr': False, 'sideways_use_adx': True, 'sideways_use_spike': False, 'sideways_rsi_required': False}.
[I 2025-09-01 14:17:03,730] Trial 160 finished with values: [-1000000000.0, 1000000000.0] and parameters: {'p_sma': 43, 'p_std': 7, 'p_atr': 14, 'p_adx': 21, 'rsi_period': 57, 'ema1': 19, 'ema2': 46, 'slip_atr_k': 0.23081622031949406, 'slip_spread_k': 0.04327452214748756, 'spread_hl_frac': 0.02378096637977378, 'bb_std_mult': 3.1564858878057236, 'rsi_os': 18, 'rsi_ob': 72, 'vol_spike': 0.1401022502997557, 'adx_thresh': 21.751539381160928, 'atr_min_pct': 0.00948124119143936, 'atr_max_pct': 0.12029245746432923, 'tp_mult': 2.697166808771547, 'tsl_mult': 0.5546855652213851, 'strategy': 'breakout', 'time_stop': 268, 'use_sma': False, 'use_atr': True, 'use_adx': True, 'use_ema': False, 'use_spike': False, 'rsi_required': False, 'edge_k': 0.6561727735434494, 'edge_cap': 0.7733626783590473, 'bull_strategy': 'mean_reversion', 'bull_bb_std_mult': 1.4147918271411453, 'bull_rsi_os': 48, 'bull_rsi_ob': 85, 'bull_adx_thresh': 14.27459613995445, 'bull_atr_min_pct': 0.01786769615183503, 'bull_atr_max_pct': 0.0760123710404439, 'bull_tp_mult': 1.6107198218413523, 'bull_tsl_mult': 0.05461946526339101, 'bull_time_stop': 125, 'bull_use_sma': True, 'bull_use_ema': False, 'bull_use_atr': True, 'bull_use_adx': True, 'bull_use_spike': False, 'bull_rsi_required': True, 'bear_strategy': 'mean_reversion', 'bear_bb_std_mult': 2.3287058042236963, 'bear_rsi_os': 51, 'bear_rsi_ob': 91, 'bear_adx_thresh': 13.354938686243873, 'bear_atr_min_pct': 0.019265508833175723, 'bear_atr_max_pct': 0.02023055267719341, 'bear_tp_mult': 2.5987266032532976, 'bear_tsl_mult': 0.22476013338658563, 'bear_time_stop': 283, 'bear_use_sma': True, 'bear_use_ema': False, 'bear_use_atr': False, 'bear_use_adx': False, 'bear_use_spike': False, 'bear_rsi_required': False, 'sideways_strategy': 'mean_reversion', 'sideways_bb_std_mult': 2.3361460948953603, 'sideways_rsi_os': 38, 'sideways_rsi_ob': 56, 'sideways_adx_thresh': 25.913302581744077, 'sideways_atr_min_pct': 0.028130328400291452, 'sideways_atr_max_pct': 0.0824086809348051, 'sideways_tp_mult': 2.0075736236302104, 'sideways_tsl_mult': 0.2925775811759024, 'sideways_time_stop': 119, 'sideways_use_sma': False, 'sideways_use_ema': False, 'sideways_use_atr': True, 'sideways_use_adx': False, 'sideways_use_spike': True, 'sideways_rsi_required': True}.
[I 2025-09-01 14:17:04,262] Trial 161 finished with values: [-1000000000.0, 1000000000.0] and parameters: {'p_sma': 9, 'p_std': 19, 'p_atr': 15, 'p_adx': 21, 'rsi_period': 53, 'ema1': 17, 'ema2': 31, 'slip_atr_k': 0.045621334904910105, 'slip_spread_k': 0.9089570653515384, 'spread_hl_frac': 0.04809715721246523, 'bb_std_mult': 2.3485193571288647, 'rsi_os': 40, 'rsi_ob': 69, 'vol_spike': 0.05894564424473685, 'adx_thresh': 22.25482334311333, 'atr_min_pct': 0.009835252824025129, 'atr_max_pct': 0.07715584941615437, 'tp_mult': 2.724263941721086, 'tsl_mult': 0.25531845507159456, 'strategy': 'breakout', 'time_stop': 201, 'use_sma': False, 'use_atr': True, 'use_adx': True, 'use_ema': False, 'use_spike': False, 'rsi_required': False, 'edge_k': 1.368708634328151, 'edge_cap': 0.7634259832607044, 'bull_strategy': 'mean_reversion', 'bull_bb_std_mult': 1.2441346393958412, 'bull_rsi_os': 30, 'bull_rsi_ob': 88, 'bull_adx_thresh': 10.853578121104185, 'bull_atr_min_pct': 0.006400588570213828, 'bull_atr_max_pct': 0.0659573129711226, 'bull_tp_mult': 1.6085569728101785, 'bull_tsl_mult': 0.9916561901137952, 'bull_time_stop': 126, 'bull_use_sma': True, 'bull_use_ema': False, 'bull_use_atr': True, 'bull_use_adx': True, 'bull_use_spike': False, 'bull_rsi_required': True, 'bear_strategy': 'mean_reversion', 'bear_bb_std_mult': 2.7704118356435172, 'bear_rsi_os': 23, 'bear_rsi_ob': 47, 'bear_adx_thresh': 13.613982089536533, 'bear_atr_min_pct': 0.01916887141020354, 'bear_atr_max_pct': 0.13465294112644383, 'bear_tp_mult': 1.3850378164555583, 'bear_tsl_mult': 0.7737918491374545, 'bear_time_stop': 271, 'bear_use_sma': True, 'bear_use_ema': False, 'bear_use_atr': False, 'bear_use_adx': False, 'bear_use_spike': False, 'bear_rsi_required': False, 'sideways_strategy': 'mean_reversion', 'sideways_bb_std_mult': 2.318307822354937, 'sideways_rsi_os': 38, 'sideways_rsi_ob': 81, 'sideways_adx_thresh': 25.923450598934586, 'sideways_atr_min_pct': 0.026720608890901366, 'sideways_atr_max_pct': 0.1273454611901287, 'sideways_tp_mult': 2.170264484413666, 'sideways_tsl_mult': 0.3016039311120785, 'sideways_time_stop': 116, 'sideways_use_sma': False, 'sideways_use_ema': False, 'sideways_use_atr': True, 'sideways_use_adx': False, 'sideways_use_spike': True, 'sideways_rsi_required': True}.
[I 2025-09-01 14:17:04,974] Trial 158 finished with values: [-1000000000.0, 1000000000.0] and parameters: {'p_sma': 57, 'p_std': 52, 'p_atr': 15, 'p_adx': 22, 'rsi_period': 69, 'ema1': 24, 'ema2': 41, 'slip_atr_k': 0.04721017224525223, 'slip_spread_k': 0.3134540132586415, 'spread_hl_frac': 0.022250430248030723, 'bb_std_mult': 3.3009425513539083, 'rsi_os': 17, 'rsi_ob': 70, 'vol_spike': 0.1653035224873209, 'adx_thresh': 21.110515122369947, 'atr_min_pct': 0.009439145604064943, 'atr_max_pct': 0.11543131335089424, 'tp_mult': 1.530933011579464, 'tsl_mult': 0.7373683638203231, 'strategy': 'breakout', 'time_stop': 21, 'use_sma': False, 'use_atr': False, 'use_adx': True, 'use_ema': True, 'use_spike': True, 'rsi_required': True, 'edge_k': 0.9444901776073048, 'edge_cap': 0.8356104975450412, 'bull_strategy': 'breakout', 'bull_bb_std_mult': 2.0011084543899647, 'bull_rsi_os': 47, 'bull_rsi_ob': 59, 'bull_adx_thresh': 10.90173713694169, 'bull_atr_min_pct': 0.010655768211926514, 'bull_atr_max_pct': 0.144051528036012, 'bull_tp_mult': 2.474983228823536, 'bull_tsl_mult': 0.03783527377060336, 'bull_time_stop': 227, 'bull_use_sma': False, 'bull_use_ema': False, 'bull_use_atr': True, 'bull_use_adx': False, 'bull_use_spike': False, 'bull_rsi_required': True, 'bear_strategy': 'mean_reversion', 'bear_bb_std_mult': 1.329945826372965, 'bear_rsi_os': 22, 'bear_rsi_ob': 91, 'bear_adx_thresh': 13.617059571498551, 'bear_atr_min_pct': 0.0014536781007017593, 'bear_atr_max_pct': 0.015451300701917482, 'bear_tp_mult': 2.737343113694568, 'bear_tsl_mult': 0.22179957260559413, 'bear_time_stop': 262, 'bear_use_sma': True, 'bear_use_ema': False, 'bear_use_atr': True, 'bear_use_adx': False, 'bear_use_spike': True, 'bear_rsi_required': False, 'sideways_strategy': 'breakout', 'sideways_bb_std_mult': 2.9098590184894566, 'sideways_rsi_os': 24, 'sideways_rsi_ob': 82, 'sideways_adx_thresh': 23.07258454650933, 'sideways_atr_min_pct': 0.006964683771539918, 'sideways_atr_max_pct': 0.07002347843243806, 'sideways_tp_mult': 1.0550295342873341, 'sideways_tsl_mult': 0.3042107142862489, 'sideways_time_stop': 120, 'sideways_use_sma': True, 'sideways_use_ema': False, 'sideways_use_atr': False, 'sideways_use_adx': False, 'sideways_use_spike': True, 'sideways_rsi_required': True}.
[I 2025-09-01 14:17:04,984] Trial 159 finished with values: [-1000000000.0, 1000000000.0] and parameters: {'p_sma': 35, 'p_std': 7, 'p_atr': 12, 'p_adx': 22, 'rsi_period': 64, 'ema1': 19, 'ema2': 41, 'slip_atr_k': 0.03906142538803363, 'slip_spread_k': 0.11482552565872095, 'spread_hl_frac': 0.021706651489427846, 'bb_std_mult': 1.1092827716840308, 'rsi_os': 16, 'rsi_ob': 80, 'vol_spike': 0.17963967700243352, 'adx_thresh': 21.404405988309364, 'atr_min_pct': 0.009345263153662768, 'atr_max_pct': 0.0832728762808607, 'tp_mult': 1.8216616294798214, 'tsl_mult': 0.2631014279110147, 'strategy': 'breakout', 'time_stop': 65, 'use_sma': False, 'use_atr': False, 'use_adx': True, 'use_ema': True, 'use_spike': True, 'rsi_required': True, 'edge_k': 1.1854224083020322, 'edge_cap': 0.7705480614305321, 'bull_strategy': 'mean_reversion', 'bull_bb_std_mult': 1.9927336127499116, 'bull_rsi_os': 47, 'bull_rsi_ob': 53, 'bull_adx_thresh': 25.549785385864684, 'bull_atr_min_pct': 0.018009496096515136, 'bull_atr_max_pct': 0.1147794848580819, 'bull_tp_mult': 1.4859232978877661, 'bull_tsl_mult': 0.37027653491472656, 'bull_time_stop': 108, 'bull_use_sma': True, 'bull_use_ema': False, 'bull_use_atr': True, 'bull_use_adx': False, 'bull_use_spike': True, 'bull_rsi_required': True, 'bear_strategy': 'mean_reversion', 'bear_bb_std_mult': 2.7327624152575813, 'bear_rsi_os': 23, 'bear_rsi_ob': 91, 'bear_adx_thresh': 11.229398908313735, 'bear_atr_min_pct': 0.021494196889679473, 'bear_atr_max_pct': 0.11472984848023285, 'bear_tp_mult': 2.6170878626077982, 'bear_tsl_mult': 0.2301004680027826, 'bear_time_stop': 284, 'bear_use_sma': True, 'bear_use_ema': False, 'bear_use_atr': False, 'bear_use_adx': False, 'bear_use_spike': True, 'bear_rsi_required': False, 'sideways_strategy': 'breakout', 'sideways_bb_std_mult': 2.36476211227383, 'sideways_rsi_os': 25, 'sideways_rsi_ob': 82, 'sideways_adx_thresh': 26.13041365280259, 'sideways_atr_min_pct': 0.0274152604554726, 'sideways_atr_max_pct': 0.08554739760412003, 'sideways_tp_mult': 2.1662332921205105, 'sideways_tsl_mult': 0.023412632279723955, 'sideways_time_stop': 265, 'sideways_use_sma': True, 'sideways_use_ema': False, 'sideways_use_atr': True, 'sideways_use_adx': False, 'sideways_use_spike': True, 'sideways_rsi_required': True}.
