[I 2025-09-01 14:37:30,607] Trial 288 finished with values: [-1000000000.0, 1000000000.0] and parameters: {'p_sma': 50, 'p_std': 7, 'p_atr': 22, 'p_adx': 25, 'rsi_period': 70, 'ema1': 30, 'ema2': 54, 'slip_atr_k': 0.0638879189988833, 'slip_spread_k': 0.1507019618159086, 'spread_hl_frac': 0.033262923475800066, 'bb_std_mult': 1.3395838476872552, 'rsi_os': 32, 'rsi_ob': 54, 'vol_spike': 0.11462360032868403, 'adx_thresh': 26.355798925144704, 'atr_min_pct': 0.021877356441236666, 'atr_max_pct': 0.07105019443506683, 'tp_mult': 2.8688716332918047, 'tsl_mult': 0.11787692219570695, 'strategy': 'breakout', 'time_stop': 299, 'use_sma': False, 'use_atr': True, 'use_adx': False, 'use_ema': False, 'use_spike': True, 'rsi_required': False, 'edge_k': 1.275236848955477, 'edge_cap': 0.18255911197262503, 'bull_strategy': 'breakout', 'bull_bb_std_mult': 2.8402745249422536, 'bull_rsi_os': 16, 'bull_rsi_ob': 49, 'bull_adx_thresh': 12.382589849903464, 'bull_atr_min_pct': 0.004786659610427125, 'bull_atr_max_pct': 0.106716147337317, 'bull_tp_mult': 2.0798700950235167, 'bull_tsl_mult': 0.3572288075800897, 'bull_time_stop': 5, 'bull_use_sma': True, 'bull_use_ema': False, 'bull_use_atr': False, 'bull_use_adx': True, 'bull_use_spike': False, 'bull_rsi_required': True, 'bear_strategy': 'mean_reversion', 'bear_bb_std_mult': 1.1088820956688572, 'bear_rsi_os': 8, 'bear_rsi_ob': 53, 'bear_adx_thresh': 28.260667356018374, 'bear_atr_min_pct': 0.024273115425694505, 'bear_atr_max_pct': 0.08123501242789348, 'bear_tp_mult': 2.501437879571112, 'bear_tsl_mult': 0.6402093739635133, 'bear_time_stop': 141, 'bear_use_sma': False, 'bear_use_ema': False, 'bear_use_atr': True, 'bear_use_adx': True, 'bear_use_spike': False, 'bear_rsi_required': False, 'sideways_strategy': 'mean_reversion', 'sideways_bb_std_mult': 3.3313841270879374, 'sideways_rsi_os': 14, 'sideways_rsi_ob': 68, 'sideways_adx_thresh': 8.591710601828341, 'sideways_atr_min_pct': 0.0037123536238991136, 'sideways_atr_max_pct': 0.12469064094106866, 'sideways_tp_mult': 1.3519203165877758, 'sideways_tsl_mult': 0.3357241546026549, 'sideways_time_stop': 24, 'sideways_use_sma': False, 'sideways_use_ema': False, 'sideways_use_atr': True, 'sideways_use_adx': False, 'sideways_use_spike': True, 'sideways_rsi_required': True}.
[I 2025-09-01 14:37:30,834] Trial 287 finished with values: [-1000000000.0, 1000000000.0] and parameters: {'p_sma': 15, 'p_std': 59, 'p_atr': 18, 'p_adx': 25, 'rsi_period': 69, 'ema1': 30, 'ema2': 54, 'slip_atr_k': 0.07313269271254352, 'slip_spread_k': 0.14981963270315463, 'spread_hl_frac': 0.04761920414404344, 'bb_std_mult': 1.3817948280218595, 'rsi_os': 22, 'rsi_ob': 74, 'vol_spike': 0.2996195317316858, 'adx_thresh': 21.18557750952656, 'atr_min_pct': 0.0156916509929124, 'atr_max_pct': 0.07577833893629655, 'tp_mult': 1.2446432957637152, 'tsl_mult': 0.1066642618135206, 'strategy': 'breakout', 'time_stop': 45, 'use_sma': True, 'use_atr': True, 'use_adx': False, 'use_ema': True, 'use_spike': True, 'rsi_required': False, 'edge_k': 0.10259564142846156, 'edge_cap': 0.47761978146901996, 'bull_strategy': 'breakout', 'bull_bb_std_mult': 2.8401646362898894, 'bull_rsi_os': 16, 'bull_rsi_ob': 70, 'bull_adx_thresh': 12.223741868862758, 'bull_atr_min_pct': 0.02254619308801719, 'bull_atr_max_pct': 0.018577257681837513, 'bull_tp_mult': 2.730722202383122, 'bull_tsl_mult': 0.35845922013712106, 'bull_time_stop': 8, 'bull_use_sma': False, 'bull_use_ema': True, 'bull_use_atr': False, 'bull_use_adx': True, 'bull_use_spike': False, 'bull_rsi_required': True, 'bear_strategy': 'mean_reversion', 'bear_bb_std_mult': 0.7787491361946155, 'bear_rsi_os': 8, 'bear_rsi_ob': 55, 'bear_adx_thresh': 28.247799889707604, 'bear_atr_min_pct': 0.024219655060907293, 'bear_atr_max_pct': 0.10576574424186252, 'bear_tp_mult': 2.509645878245485, 'bear_tsl_mult': 0.6443443831666977, 'bear_time_stop': 284, 'bear_use_sma': False, 'bear_use_ema': True, 'bear_use_atr': True, 'bear_use_adx': True, 'bear_use_spike': False, 'bear_rsi_required': False, 'sideways_strategy': 'mean_reversion', 'sideways_bb_std_mult': 3.3298068519468926, 'sideways_rsi_os': 53, 'sideways_rsi_ob': 68, 'sideways_adx_thresh': 32.14328417232255, 'sideways_atr_min_pct': 0.003667384577818726, 'sideways_atr_max_pct': 0.13751870296322927, 'sideways_tp_mult': 1.7952788806543238, 'sideways_tsl_mult': 0.6698361929207353, 'sideways_time_stop': 282, 'sideways_use_sma': False, 'sideways_use_ema': False, 'sideways_use_atr': False, 'sideways_use_adx': False, 'sideways_use_spike': True, 'sideways_rsi_required': True}.
[I 2025-09-01 14:37:31,003] Trial 289 finished with values: [-0.021860653999741575, 0.021988062122642423] and parameters: {'p_sma': 58, 'p_std': 7, 'p_atr': 22, 'p_adx': 25, 'rsi_period': 62, 'ema1': 14, 'ema2': 54, 'slip_atr_k': 0.07070512824575453, 'slip_spread_k': 0.23711582389511837, 'spread_hl_frac': 0.04197976893104202, 'bb_std_mult': 1.3932797054364625, 'rsi_os': 32, 'rsi_ob': 77, 'vol_spike': 0.14130358448966038, 'adx_thresh': 21.169958186871646, 'atr_min_pct': 0.015602239236450263, 'atr_max_pct': 0.14167529014153585, 'tp_mult': 2.8705491610153415, 'tsl_mult': 0.10505025472805823, 'strategy': 'breakout', 'time_stop': 71, 'use_sma': False, 'use_atr': True, 'use_adx': False, 'use_ema': False, 'use_spike': True, 'rsi_required': False, 'edge_k': 1.129407790755263, 'edge_cap': 0.06530327727931838, 'bull_strategy': 'breakout', 'bull_bb_std_mult': 2.8601386203416728, 'bull_rsi_os': 15, 'bull_rsi_ob': 49, 'bull_adx_thresh': 8.938486600126343, 'bull_atr_min_pct': 0.00542937152222874, 'bull_atr_max_pct': 0.10591201986081059, 'bull_tp_mult': 2.346420940685144, 'bull_tsl_mult': 0.36425307268334434, 'bull_time_stop': 155, 'bull_use_sma': True, 'bull_use_ema': False, 'bull_use_atr': False, 'bull_use_adx': True, 'bull_use_spike': False, 'bull_rsi_required': True, 'bear_strategy': 'mean_reversion', 'bear_bb_std_mult': 1.9623692743032803, 'bear_rsi_os': 19, 'bear_rsi_ob': 72, 'bear_adx_thresh': 28.252167603322665, 'bear_atr_min_pct': 0.00803575767027254, 'bear_atr_max_pct': 0.11616430568408016, 'bear_tp_mult': 2.4811344180021146, 'bear_tsl_mult': 0.6395031213761445, 'bear_time_stop': 39, 'bear_use_sma': False, 'bear_use_ema': False, 'bear_use_atr': True, 'bear_use_adx': True, 'bear_use_spike': False, 'bear_rsi_required': False, 'sideways_strategy': 'mean_reversion', 'sideways_bb_std_mult': 3.32172985329161, 'sideways_rsi_os': 49, 'sideways_rsi_ob': 69, 'sideways_adx_thresh': 32.13962262027204, 'sideways_atr_min_pct': 0.0036121349522894412, 'sideways_atr_max_pct': 0.13419255487394052, 'sideways_tp_mult': 1.7760549997174098, 'sideways_tsl_mult': 0.859704092107606, 'sideways_time_stop': 268, 'sideways_use_sma': False, 'sideways_use_ema': False, 'sideways_use_atr': True, 'sideways_use_adx': False, 'sideways_use_spike': True, 'sideways_rsi_required': True}.
[I 2025-09-01 14:38:07,076] Trial 291 finished with values: [-1000000000.0, 1000000000.0] and parameters: {'p_sma': 11, 'p_std': 22, 'p_atr': 18, 'p_adx': 14, 'rsi_period': 14, 'ema1': 23, 'ema2': 51, 'slip_atr_k': 0.07361549616876603, 'slip_spread_k': 0.2373560146306504, 'spread_hl_frac': 0.012770858825675824, 'bb_std_mult': 1.390086907869533, 'rsi_os': 36, 'rsi_ob': 76, 'vol_spike': 0.17869914935922782, 'adx_thresh': 19.989879057541227, 'atr_min_pct': 0.01678727290764568, 'atr_max_pct': 0.07604476040687025, 'tp_mult': 2.802492804538907, 'tsl_mult': 0.6606107799921601, 'strategy': 'breakout', 'time_stop': 43, 'use_sma': False, 'use_atr': True, 'use_adx': True, 'use_ema': True, 'use_spike': True, 'rsi_required': False, 'edge_k': 0.5138432729698055, 'edge_cap': 0.15990570635032592, 'bull_strategy': 'breakout', 'bull_bb_std_mult': 2.8866145041782474, 'bull_rsi_os': 17, 'bull_rsi_ob': 76, 'bull_adx_thresh': 15.902423213594131, 'bull_atr_min_pct': 0.005427082900240026, 'bull_atr_max_pct': 0.019120510240429104, 'bull_tp_mult': 2.6740261572896626, 'bull_tsl_mult': 0.3442953299107249, 'bull_time_stop': 170, 'bull_use_sma': True, 'bull_use_ema': False, 'bull_use_atr': False, 'bull_use_adx': True, 'bull_use_spike': False, 'bull_rsi_required': True, 'bear_strategy': 'mean_reversion', 'bear_bb_std_mult': 0.7967523771151948, 'bear_rsi_os': 17, 'bear_rsi_ob': 56, 'bear_adx_thresh': 5.511137433944382, 'bear_atr_min_pct': 0.008002226285787568, 'bear_atr_max_pct': 0.09786070046803547, 'bear_tp_mult': 2.533566975505715, 'bear_tsl_mult': 0.619534337217271, 'bear_time_stop': 39, 'bear_use_sma': False, 'bear_use_ema': True, 'bear_use_atr': False, 'bear_use_adx': True, 'bear_use_spike': False, 'bear_rsi_required': False, 'sideways_strategy': 'mean_reversion', 'sideways_bb_std_mult': 3.371564202832953, 'sideways_rsi_os': 49, 'sideways_rsi_ob': 88, 'sideways_adx_thresh': 6.54658728518383, 'sideways_atr_min_pct': 0.022922444890307488, 'sideways_atr_max_pct': 0.1150593700330105, 'sideways_tp_mult': 2.5148618856662335, 'sideways_tsl_mult': 0.7427171682098747, 'sideways_time_stop': 106, 'sideways_use_sma': False, 'sideways_use_ema': False, 'sideways_use_atr': False, 'sideways_use_adx': False, 'sideways_use_spike': True, 'sideways_rsi_required': True}.
[I 2025-09-01 14:38:07,091] Trial 294 finished with values: [-1000000000.0, 1000000000.0] and parameters: {'p_sma': 11, 'p_std': 29, 'p_atr': 12, 'p_adx': 26, 'rsi_period': 65, 'ema1': 22, 'ema2': 49, 'slip_atr_k': 0.043242533115672416, 'slip_spread_k': 0.0031074226131384552, 'spread_hl_frac': 0.0037223376182263478, 'bb_std_mult': 1.612091030781261, 'rsi_os': 36, 'rsi_ob': 76, 'vol_spike': 0.21913638157224724, 'adx_thresh': 20.0412349324247, 'atr_min_pct': 0.016719771231417987, 'atr_max_pct': 0.10858799716014564, 'tp_mult': 2.2406455838423307, 'tsl_mult': 0.07315045060601622, 'strategy': 'breakout', 'time_stop': 64, 'use_sma': False, 'use_atr': True, 'use_adx': True, 'use_ema': True, 'use_spike': True, 'rsi_required': False, 'edge_k': 0.5368753001742207, 'edge_cap': 0.05018157752340648, 'bull_strategy': 'breakout', 'bull_bb_std_mult': 2.903790258280068, 'bull_rsi_os': 43, 'bull_rsi_ob': 47, 'bull_adx_thresh': 10.509650738287828, 'bull_atr_min_pct': 0.0031214138827333326, 'bull_atr_max_pct': 0.025638977529573156, 'bull_tp_mult': 2.1317265008039725, 'bull_tsl_mult': 0.1215448928043883, 'bull_time_stop': 177, 'bull_use_sma': True, 'bull_use_ema': False, 'bull_use_atr': False, 'bull_use_adx': False, 'bull_use_spike': False, 'bull_rsi_required': True, 'bear_strategy': 'mean_reversion', 'bear_bb_std_mult': 2.7801543803269135, 'bear_rsi_os': 6, 'bear_rsi_ob': 78, 'bear_adx_thresh': 29.48102420485913, 'bear_atr_min_pct': 0.022222552382295743, 'bear_atr_max_pct': 0.13652847247467365, 'bear_tp_mult': 2.4034439009227166, 'bear_tsl_mult': 0.6041285609068535, 'bear_time_stop': 10, 'bear_use_sma': False, 'bear_use_ema': True, 'bear_use_atr': False, 'bear_use_adx': True, 'bear_use_spike': False, 'bear_rsi_required': False, 'sideways_strategy': 'mean_reversion', 'sideways_bb_std_mult': 2.5523713701809263, 'sideways_rsi_os': 16, 'sideways_rsi_ob': 88, 'sideways_adx_thresh': 27.60140930959293, 'sideways_atr_min_pct': 0.0044739285604719035, 'sideways_atr_max_pct': 0.09131386449652074, 'sideways_tp_mult': 2.578112069724275, 'sideways_tsl_mult': 0.27379429222395324, 'sideways_time_stop': 105, 'sideways_use_sma': False, 'sideways_use_ema': False, 'sideways_use_atr': False, 'sideways_use_adx': False, 'sideways_use_spike': True, 'sideways_rsi_required': True}.
[I 2025-09-01 14:38:07,540] Trial 293 finished with values: [-1000000000.0, 1000000000.0] and parameters: {'p_sma': 11, 'p_std': 21, 'p_atr': 18, 'p_adx': 14, 'rsi_period': 62, 'ema1': 5, 'ema2': 49, 'slip_atr_k': 0.041294470233018105, 'slip_spread_k': 0.002461603030431081, 'spread_hl_frac': 0.031118789218738143, 'bb_std_mult': 1.4066284935687547, 'rsi_os': 37, 'rsi_ob': 94, 'vol_spike': 0.17710437449625505, 'adx_thresh': 20.001229021187275, 'atr_min_pct': 0.016732100540869498, 'atr_max_pct': 0.07543826715235752, 'tp_mult': 2.853362975690748, 'tsl_mult': 0.001409563524250354, 'strategy': 'breakout', 'time_stop': 65, 'use_sma': False, 'use_atr': True, 'use_adx': True, 'use_ema': False, 'use_spike': True, 'rsi_required': False, 'edge_k': 0.5020903110447507, 'edge_cap': 0.06897457085881695, 'bull_strategy': 'breakout', 'bull_bb_std_mult': 2.8980898892535265, 'bull_rsi_os': 17, 'bull_rsi_ob': 92, 'bull_adx_thresh': 15.616449294105983, 'bull_atr_min_pct': 0.0032460713927840944, 'bull_atr_max_pct': 0.07003868762685729, 'bull_tp_mult': 2.1270919347058186, 'bull_tsl_mult': 0.2775865529960365, 'bull_time_stop': 177, 'bull_use_sma': True, 'bull_use_ema': False, 'bull_use_atr': False, 'bull_use_adx': False, 'bull_use_spike': False, 'bull_rsi_required': True, 'bear_strategy': 'mean_reversion', 'bear_bb_std_mult': 2.7764956600521935, 'bear_rsi_os': 17, 'bear_rsi_ob': 73, 'bear_adx_thresh': 19.929647958873108, 'bear_atr_min_pct': 0.02228219975114668, 'bear_atr_max_pct': 0.1376639512139226, 'bear_tp_mult': 2.541099654656395, 'bear_tsl_mult': 0.14707939911581913, 'bear_time_stop': 182, 'bear_use_sma': False, 'bear_use_ema': False, 'bear_use_atr': False, 'bear_use_adx': True, 'bear_use_spike': False, 'bear_rsi_required': False, 'sideways_strategy': 'mean_reversion', 'sideways_bb_std_mult': 3.227994820334945, 'sideways_rsi_os': 16, 'sideways_rsi_ob': 79, 'sideways_adx_thresh': 27.75658950853022, 'sideways_atr_min_pct': 0.013716120652345787, 'sideways_atr_max_pct': 0.09421171507364898, 'sideways_tp_mult': 1.9727090855928624, 'sideways_tsl_mult': 0.7521261793512704, 'sideways_time_stop': 5, 'sideways_use_sma': False, 'sideways_use_ema': False, 'sideways_use_atr': True, 'sideways_use_adx': False, 'sideways_use_spike': True, 'sideways_rsi_required': True}.
[I 2025-09-01 14:38:07,712] Trial 292 finished with values: [-1000000000.0, 1000000000.0] and parameters: {'p_sma': 11, 'p_std': 18, 'p_atr': 18, 'p_adx': 25, 'rsi_period': 62, 'ema1': 22, 'ema2': 51, 'slip_atr_k': 0.24998727288668776, 'slip_spread_k': 0.23247245478845202, 'spread_hl_frac': 0.012643282660961897, 'bb_std_mult': 1.41004805322331, 'rsi_os': 36, 'rsi_ob': 76, 'vol_spike': 0.21668119393320745, 'adx_thresh': 27.49201021718464, 'atr_min_pct': 0.01651928065511202, 'atr_max_pct': 0.05061808965606479, 'tp_mult': 1.243355022327623, 'tsl_mult': 0.9775932952944135, 'strategy': 'breakout', 'time_stop': 47, 'use_sma': False, 'use_atr': True, 'use_adx': True, 'use_ema': True, 'use_spike': True, 'rsi_required': False, 'edge_k': 1.14721996392983, 'edge_cap': 0.06339718555215523, 'bull_strategy': 'breakout', 'bull_bb_std_mult': 2.8734533379478786, 'bull_rsi_os': 17, 'bull_rsi_ob': 47, 'bull_adx_thresh': 9.165887282385688, 'bull_atr_min_pct': 0.005363743438048452, 'bull_atr_max_pct': 0.0143333362686322, 'bull_tp_mult': 2.675997042340955, 'bull_tsl_mult': 0.9030614335705525, 'bull_time_stop': 174, 'bull_use_sma': True, 'bull_use_ema': False, 'bull_use_atr': False, 'bull_use_adx': True, 'bull_use_spike': False, 'bull_rsi_required': True, 'bear_strategy': 'mean_reversion', 'bear_bb_std_mult': 3.355751587885162, 'bear_rsi_os': 29, 'bear_rsi_ob': 56, 'bear_adx_thresh': 29.402489642068275, 'bear_atr_min_pct': 0.02220648592572966, 'bear_atr_max_pct': 0.10441897556955289, 'bear_tp_mult': 2.4012528514583007, 'bear_tsl_mult': 0.6129241891681616, 'bear_time_stop': 287, 'bear_use_sma': False, 'bear_use_ema': True, 'bear_use_atr': False, 'bear_use_adx': True, 'bear_use_spike': False, 'bear_rsi_required': False, 'sideways_strategy': 'mean_reversion', 'sideways_bb_std_mult': 3.3371583512098715, 'sideways_rsi_os': 16, 'sideways_rsi_ob': 79, 'sideways_adx_thresh': 28.04029632122176, 'sideways_atr_min_pct': 0.004356625717939987, 'sideways_atr_max_pct': 0.0655375673700619, 'sideways_tp_mult': 1.6490824691441557, 'sideways_tsl_mult': 0.2614278164204334, 'sideways_time_stop': 105, 'sideways_use_sma': False, 'sideways_use_ema': False, 'sideways_use_atr': False, 'sideways_use_adx': False, 'sideways_use_spike': True, 'sideways_rsi_required': True}.
[I 2025-09-01 14:38:51,624] Trial 297 finished with values: [-0.02184672198399462, 0.021850539039508905] and parameters: {'p_sma': 20, 'p_std': 8, 'p_atr': 21, 'p_adx': 8, 'rsi_period': 63, 'ema1': 12, 'ema2': 32, 'slip_atr_k': 0.18945452044515515, 'slip_spread_k': 0.21186000165429286, 'spread_hl_frac': 0.03808152537734707, 'bb_std_mult': 3.2920843598599348, 'rsi_os': 38, 'rsi_ob': 72, 'vol_spike': 0.28166137021178256, 'adx_thresh': 19.372287743636463, 'atr_min_pct': 0.018333741828246698, 'atr_max_pct': 0.07331027117319562, 'tp_mult': 2.9998311995456866, 'tsl_mult': 0.4257145857875564, 'strategy': 'mean_reversion', 'time_stop': 76, 'use_sma': False, 'use_atr': True, 'use_adx': True, 'use_ema': False, 'use_spike': True, 'rsi_required': False, 'edge_k': 0.5678776216573928, 'edge_cap': 0.0729294690765251, 'bull_strategy': 'breakout', 'bull_bb_std_mult': 2.774540523394964, 'bull_rsi_os': 18, 'bull_rsi_ob': 74, 'bull_adx_thresh': 11.700555774994562, 'bull_atr_min_pct': 0.0037608054302369774, 'bull_atr_max_pct': 0.013755499488255454, 'bull_tp_mult': 2.0856397269026576, 'bull_tsl_mult': 0.38007541786393395, 'bull_time_stop': 165, 'bull_use_sma': True, 'bull_use_ema': True, 'bull_use_atr': False, 'bull_use_adx': True, 'bull_use_spike': False, 'bull_rsi_required': False, 'bear_strategy': 'breakout', 'bear_bb_std_mult': 2.670543808193923, 'bear_rsi_os': 43, 'bear_rsi_ob': 81, 'bear_adx_thresh': 23.64691034762292, 'bear_atr_min_pct': 0.025397631169088806, 'bear_atr_max_pct': 0.10280498481741614, 'bear_tp_mult': 2.4581692706061267, 'bear_tsl_mult': 0.9596616749993123, 'bear_time_stop': 287, 'bear_use_sma': False, 'bear_use_ema': False, 'bear_use_atr': False, 'bear_use_adx': True, 'bear_use_spike': False, 'bear_rsi_required': True, 'sideways_strategy': 'mean_reversion', 'sideways_bb_std_mult': 1.21932178796096, 'sideways_rsi_os': 40, 'sideways_rsi_ob': 64, 'sideways_adx_thresh': 8.167030785597834, 'sideways_atr_min_pct': 0.005810115191847263, 'sideways_atr_max_pct': 0.14092918877174543, 'sideways_tp_mult': 1.2832704247653335, 'sideways_tsl_mult': 0.25419658466496714, 'sideways_time_stop': 75, 'sideways_use_sma': False, 'sideways_use_ema': False, 'sideways_use_atr': True, 'sideways_use_adx': True, 'sideways_use_spike': False, 'sideways_rsi_required': False}.
[I 2025-09-01 14:38:51,634] Trial 298 finished with values: [-0.05205610245893055, 0.052208630923410076] and parameters: {'p_sma': 10, 'p_std': 8, 'p_atr': 21, 'p_adx': 26, 'rsi_period': 64, 'ema1': 26, 'ema2': 19, 'slip_atr_k': 0.04918881702247663, 'slip_spread_k': 0.2098934773858707, 'spread_hl_frac': 0.014537693885931064, 'bb_std_mult': 0.570822391640061, 'rsi_os': 26, 'rsi_ob': 58, 'vol_spike': 0.2845304049206611, 'adx_thresh': 19.221152658511656, 'atr_min_pct': 0.018336553079012538, 'atr_max_pct': 0.14773474038845213, 'tp_mult': 2.914219365232295, 'tsl_mult': 0.0791707624061719, 'strategy': 'mean_reversion', 'time_stop': 77, 'use_sma': False, 'use_atr': True, 'use_adx': True, 'use_ema': False, 'use_spike': True, 'rsi_required': False, 'edge_k': 0.002681050635407245, 'edge_cap': 0.6024009298570189, 'bull_strategy': 'breakout', 'bull_bb_std_mult': 2.9392683947064446, 'bull_rsi_os': 53, 'bull_rsi_ob': 79, 'bull_adx_thresh': 21.07318610604847, 'bull_atr_min_pct': 0.004104797253149456, 'bull_atr_max_pct': 0.02211694621446751, 'bull_tp_mult': 2.082772579473298, 'bull_tsl_mult': 0.3896874870755354, 'bull_time_stop': 243, 'bull_use_sma': False, 'bull_use_ema': True, 'bull_use_atr': False, 'bull_use_adx': True, 'bull_use_spike': False, 'bull_rsi_required': False, 'bear_strategy': 'breakout', 'bear_bb_std_mult': 2.67613247993686, 'bear_rsi_os': 10, 'bear_rsi_ob': 80, 'bear_adx_thresh': 27.63934674873947, 'bear_atr_min_pct': 0.011658370446259069, 'bear_atr_max_pct': 0.11393521791394985, 'bear_tp_mult': 2.461228045658689, 'bear_tsl_mult': 0.45646565787981963, 'bear_time_stop': 300, 'bear_use_sma': False, 'bear_use_ema': False, 'bear_use_atr': False, 'bear_use_adx': True, 'bear_use_spike': False, 'bear_rsi_required': True, 'sideways_strategy': 'mean_reversion', 'sideways_bb_std_mult': 2.1771579653762414, 'sideways_rsi_os': 39, 'sideways_rsi_ob': 91, 'sideways_adx_thresh': 5.806058668821708, 'sideways_atr_min_pct': 1.0043522939184521e-05, 'sideways_atr_max_pct': 0.1442000794167913, 'sideways_tp_mult': 1.750993582737866, 'sideways_tsl_mult': 0.2954031482270323, 'sideways_time_stop': 127, 'sideways_use_sma': False, 'sideways_use_ema': False, 'sideways_use_atr': True, 'sideways_use_adx': True, 'sideways_use_spike': False, 'sideways_rsi_required': False}.
