[I 2025-09-01 14:18:58,163] Trial 173 finished with values: [-1000000000.0, 1000000000.0] and parameters: {'p_sma': 56, 'p_std': 45, 'p_atr': 27, 'p_adx': 29, 'rsi_period': 67, 'ema1': 28, 'ema2': 48, 'slip_atr_k': 0.04978727063041463, 'slip_spread_k': 0.8703529373765793, 'spread_hl_frac': 0.009771985156831156, 'bb_std_mult': 2.8617494742273806, 'rsi_os': 35, 'rsi_ob': 69, 'vol_spike': 0.031025383440126685, 'adx_thresh': 18.44384908806483, 'atr_min_pct': 0.010685589633045046, 'atr_max_pct': 0.08105083327424015, 'tp_mult': 2.6500319938385486, 'tsl_mult': 0.2983033230135457, 'strategy': 'breakout', 'time_stop': 32, 'use_sma': False, 'use_atr': False, 'use_adx': True, 'use_ema': False, 'use_spike': False, 'rsi_required': True, 'edge_k': 0.31900827309187296, 'edge_cap': 0.8625722635822124, 'bull_strategy': 'breakout', 'bull_bb_std_mult': 2.5386071224597817, 'bull_rsi_os': 8, 'bull_rsi_ob': 47, 'bull_adx_thresh': 12.63838001483423, 'bull_atr_min_pct': 0.00357944705313703, 'bull_atr_max_pct': 0.0315468633927088, 'bull_tp_mult': 1.8223906379673045, 'bull_tsl_mult': 0.21812693315813428, 'bull_time_stop': 115, 'bull_use_sma': True, 'bull_use_ema': False, 'bull_use_atr': False, 'bull_use_adx': True, 'bull_use_spike': False, 'bull_rsi_required': True, 'bear_strategy': 'mean_reversion', 'bear_bb_std_mult': 3.0830632179596993, 'bear_rsi_os': 8, 'bear_rsi_ob': 59, 'bear_adx_thresh': 10.443900976410418, 'bear_atr_min_pct': 0.026977826887673625, 'bear_atr_max_pct': 0.10125397610623596, 'bear_tp_mult': 1.6793183516059251, 'bear_tsl_mult': 0.7545391070357407, 'bear_time_stop': 285, 'bear_use_sma': True, 'bear_use_ema': False, 'bear_use_atr': False, 'bear_use_adx': True, 'bear_use_spike': True, 'bear_rsi_required': False, 'sideways_strategy': 'breakout', 'sideways_bb_std_mult': 2.678835186454818, 'sideways_rsi_os': 18, 'sideways_rsi_ob': 84, 'sideways_adx_thresh': 13.08507598944604, 'sideways_atr_min_pct': 0.004852639842959513, 'sideways_atr_max_pct': 0.12171618136481964, 'sideways_tp_mult': 1.5820543411560133, 'sideways_tsl_mult': 0.32438808583242906, 'sideways_time_stop': 101, 'sideways_use_sma': True, 'sideways_use_ema': False, 'sideways_use_atr': True, 'sideways_use_adx': False, 'sideways_use_spike': True, 'sideways_rsi_required': True}.
[I 2025-09-01 14:18:59,794] Trial 171 finished with values: [-1000000000.0, 1000000000.0] and parameters: {'p_sma': 51, 'p_std': 47, 'p_atr': 27, 'p_adx': 29, 'rsi_period': 66, 'ema1': 27, 'ema2': 45, 'slip_atr_k': 0.06303442235009435, 'slip_spread_k': 0.3842557878207488, 'spread_hl_frac': 0.007566467011275023, 'bb_std_mult': 2.555748775538534, 'rsi_os': 31, 'rsi_ob': 72, 'vol_spike': 0.036655081121950706, 'adx_thresh': 17.995050086432506, 'atr_min_pct': 0.011530408032267197, 'atr_max_pct': 0.06408348787465509, 'tp_mult': 2.604106634690227, 'tsl_mult': 0.36490228526667345, 'strategy': 'breakout', 'time_stop': 14, 'use_sma': False, 'use_atr': False, 'use_adx': True, 'use_ema': False, 'use_spike': False, 'rsi_required': True, 'edge_k': 1.0838296256930293, 'edge_cap': 0.9229222723782362, 'bull_strategy': 'mean_reversion', 'bull_bb_std_mult': 1.235308506467678, 'bull_rsi_os': 9, 'bull_rsi_ob': 48, 'bull_adx_thresh': 13.170092976124673, 'bull_atr_min_pct': 0.003833492500999168, 'bull_atr_max_pct': 0.03357131130884726, 'bull_tp_mult': 2.3131513833368693, 'bull_tsl_mult': 0.3373820035648289, 'bull_time_stop': 193, 'bull_use_sma': True, 'bull_use_ema': False, 'bull_use_atr': True, 'bull_use_adx': True, 'bull_use_spike': True, 'bull_rsi_required': True, 'bear_strategy': 'mean_reversion', 'bear_bb_std_mult': 3.0512041826033904, 'bear_rsi_os': 9, 'bear_rsi_ob': 68, 'bear_adx_thresh': 9.399067336946057, 'bear_atr_min_pct': 0.02618527414955154, 'bear_atr_max_pct': 0.09929610408918735, 'bear_tp_mult': 1.6454723890210703, 'bear_tsl_mult': 0.7347752101979914, 'bear_time_stop': 294, 'bear_use_sma': True, 'bear_use_ema': True, 'bear_use_atr': False, 'bear_use_adx': False, 'bear_use_spike': True, 'bear_rsi_required': False, 'sideways_strategy': 'breakout', 'sideways_bb_std_mult': 2.713086969383333, 'sideways_rsi_os': 19, 'sideways_rsi_ob': 84, 'sideways_adx_thresh': 10.919648709245514, 'sideways_atr_min_pct': 0.00460538548196626, 'sideways_atr_max_pct': 0.1237424381580203, 'sideways_tp_mult': 1.311473638824121, 'sideways_tsl_mult': 0.36975727054292773, 'sideways_time_stop': 104, 'sideways_use_sma': True, 'sideways_use_ema': True, 'sideways_use_atr': True, 'sideways_use_adx': False, 'sideways_use_spike': True, 'sideways_rsi_required': True}.
[I 2025-09-01 14:19:00,183] Trial 170 finished with values: [-1000000000.0, 1000000000.0] and parameters: {'p_sma': 50, 'p_std': 46, 'p_atr': 27, 'p_adx': 29, 'rsi_period': 66, 'ema1': 27, 'ema2': 45, 'slip_atr_k': 0.06412457439211923, 'slip_spread_k': 0.32482255131895094, 'spread_hl_frac': 0.009015374555935606, 'bb_std_mult': 0.7330809691483493, 'rsi_os': 31, 'rsi_ob': 69, 'vol_spike': 0.035651804264864105, 'adx_thresh': 18.206662454196245, 'atr_min_pct': 0.011859121423560041, 'atr_max_pct': 0.08080613242466717, 'tp_mult': 2.5756546440390524, 'tsl_mult': 0.3096684764494687, 'strategy': 'breakout', 'time_stop': 13, 'use_sma': False, 'use_atr': True, 'use_adx': True, 'use_ema': False, 'use_spike': False, 'rsi_required': False, 'edge_k': 1.8785556998562472, 'edge_cap': 0.8606609126192348, 'bull_strategy': 'mean_reversion', 'bull_bb_std_mult': 1.4085688880063771, 'bull_rsi_os': 6, 'bull_rsi_ob': 45, 'bull_adx_thresh': 13.351829997730068, 'bull_atr_min_pct': 0.00488521951471879, 'bull_atr_max_pct': 0.034062487968660835, 'bull_tp_mult': 2.303499937267786, 'bull_tsl_mult': 0.3043916170479358, 'bull_time_stop': 114, 'bull_use_sma': True, 'bull_use_ema': False, 'bull_use_atr': True, 'bull_use_adx': True, 'bull_use_spike': True, 'bull_rsi_required': True, 'bear_strategy': 'mean_reversion', 'bear_bb_std_mult': 2.8313884539256637, 'bear_rsi_os': 7, 'bear_rsi_ob': 69, 'bear_adx_thresh': 10.434359088214514, 'bear_atr_min_pct': 0.02603188107387107, 'bear_atr_max_pct': 0.1010703142513604, 'bear_tp_mult': 2.7125813336116047, 'bear_tsl_mult': 0.8084472484490486, 'bear_time_stop': 294, 'bear_use_sma': True, 'bear_use_ema': True, 'bear_use_atr': False, 'bear_use_adx': False, 'bear_use_spike': False, 'bear_rsi_required': False, 'sideways_strategy': 'mean_reversion', 'sideways_bb_std_mult': 2.668718907588071, 'sideways_rsi_os': 18, 'sideways_rsi_ob': 84, 'sideways_adx_thresh': 13.659093647569136, 'sideways_atr_min_pct': 0.006079921072216223, 'sideways_atr_max_pct': 0.11805332268651793, 'sideways_tp_mult': 1.3155193379936168, 'sideways_tsl_mult': 0.357048422360589, 'sideways_time_stop': 98, 'sideways_use_sma': False, 'sideways_use_ema': True, 'sideways_use_atr': True, 'sideways_use_adx': False, 'sideways_use_spike': True, 'sideways_rsi_required': True}.
[I 2025-09-01 14:19:38,631] Trial 174 finished with values: [-1000000000.0, 1000000000.0] and parameters: {'p_sma': 22, 'p_std': 47, 'p_atr': 27, 'p_adx': 30, 'rsi_period': 65, 'ema1': 29, 'ema2': 46, 'slip_atr_k': 0.0396157610768901, 'slip_spread_k': 0.3348259289018291, 'spread_hl_frac': 0.011526445264305941, 'bb_std_mult': 2.5720667943349382, 'rsi_os': 29, 'rsi_ob': 70, 'vol_spike': 0.045640254526511145, 'adx_thresh': 17.210660728602058, 'atr_min_pct': 0.010289411729224342, 'atr_max_pct': 0.06915217620896974, 'tp_mult': 2.8156711159229357, 'tsl_mult': 0.27497492485365216, 'strategy': 'breakout', 'time_stop': 6, 'use_sma': True, 'use_atr': False, 'use_adx': False, 'use_ema': True, 'use_spike': False, 'rsi_required': True, 'edge_k': 0.7727269713212256, 'edge_cap': 0.8405188617294296, 'bull_strategy': 'mean_reversion', 'bull_bb_std_mult': 1.885802602690163, 'bull_rsi_os': 13, 'bull_rsi_ob': 45, 'bull_adx_thresh': 10.129984823030163, 'bull_atr_min_pct': 0.0033012479377660412, 'bull_atr_max_pct': 0.03948365072245725, 'bull_tp_mult': 1.9692019444473874, 'bull_tsl_mult': 0.4389823345685989, 'bull_time_stop': 122, 'bull_use_sma': False, 'bull_use_ema': False, 'bull_use_atr': True, 'bull_use_adx': False, 'bull_use_spike': True, 'bull_rsi_required': False, 'bear_strategy': 'mean_reversion', 'bear_bb_std_mult': 2.8540857631825216, 'bear_rsi_os': 43, 'bear_rsi_ob': 64, 'bear_adx_thresh': 10.880058888681745, 'bear_atr_min_pct': 0.02837558126618723, 'bear_atr_max_pct': 0.13697041283610303, 'bear_tp_mult': 2.0384387488704956, 'bear_tsl_mult': 0.7372648686977731, 'bear_time_stop': 273, 'bear_use_sma': True, 'bear_use_ema': False, 'bear_use_atr': False, 'bear_use_adx': False, 'bear_use_spike': True, 'bear_rsi_required': False, 'sideways_strategy': 'breakout', 'sideways_bb_std_mult': 1.317851262863823, 'sideways_rsi_os': 19, 'sideways_rsi_ob': 83, 'sideways_adx_thresh': 13.705000852300703, 'sideways_atr_min_pct': 0.0021255709499679917, 'sideways_atr_max_pct': 0.10126863998302375, 'sideways_tp_mult': 1.865864528304824, 'sideways_tsl_mult': 0.33933522029719243, 'sideways_time_stop': 107, 'sideways_use_sma': True, 'sideways_use_ema': False, 'sideways_use_atr': False, 'sideways_use_adx': False, 'sideways_use_spike': True, 'sideways_rsi_required': True}.
[I 2025-09-01 14:19:38,635] Trial 175 finished with values: [-1000000000.0, 1000000000.0] and parameters: {'p_sma': 28, 'p_std': 47, 'p_atr': 27, 'p_adx': 30, 'rsi_period': 68, 'ema1': 29, 'ema2': 46, 'slip_atr_k': 0.03153007146670636, 'slip_spread_k': 0.06756809480395731, 'spread_hl_frac': 0.007417706911253763, 'bb_std_mult': 1.3860668602368011, 'rsi_os': 29, 'rsi_ob': 70, 'vol_spike': 0.04258025434111815, 'adx_thresh': 17.170265748225937, 'atr_min_pct': 0.010337407680337217, 'atr_max_pct': 0.08592059564367294, 'tp_mult': 2.805322096539215, 'tsl_mult': 0.2796435638283666, 'strategy': 'breakout', 'time_stop': 23, 'use_sma': True, 'use_atr': False, 'use_adx': False, 'use_ema': True, 'use_spike': False, 'rsi_required': True, 'edge_k': 1.073477793590581, 'edge_cap': 0.8419286204216447, 'bull_strategy': 'mean_reversion', 'bull_bb_std_mult': 1.839918264392427, 'bull_rsi_os': 6, 'bull_rsi_ob': 45, 'bull_adx_thresh': 10.064339334979087, 'bull_atr_min_pct': 0.004772479857845507, 'bull_atr_max_pct': 0.02731163874460177, 'bull_tp_mult': 2.0139925992680627, 'bull_tsl_mult': 0.33323372486299496, 'bull_time_stop': 121, 'bull_use_sma': False, 'bull_use_ema': False, 'bull_use_atr': True, 'bull_use_adx': False, 'bull_use_spike': True, 'bull_rsi_required': False, 'bear_strategy': 'mean_reversion', 'bear_bb_std_mult': 3.0077440685028103, 'bear_rsi_os': 7, 'bear_rsi_ob': 57, 'bear_adx_thresh': 10.973538040186734, 'bear_atr_min_pct': 0.024018803857759702, 'bear_atr_max_pct': 0.11726706019292298, 'bear_tp_mult': 2.6977655854858105, 'bear_tsl_mult': 0.9172108831973381, 'bear_time_stop': 270, 'bear_use_sma': True, 'bear_use_ema': False, 'bear_use_atr': False, 'bear_use_adx': False, 'bear_use_spike': True, 'bear_rsi_required': False, 'sideways_strategy': 'breakout', 'sideways_bb_std_mult': 1.3304922268542265, 'sideways_rsi_os': 15, 'sideways_rsi_ob': 80, 'sideways_adx_thresh': 13.753806980794831, 'sideways_atr_min_pct': 0.0029178425286650322, 'sideways_atr_max_pct': 0.13806550719989322, 'sideways_tp_mult': 1.8630751546044904, 'sideways_tsl_mult': 0.24308002888970642, 'sideways_time_stop': 107, 'sideways_use_sma': True, 'sideways_use_ema': False, 'sideways_use_atr': False, 'sideways_use_adx': False, 'sideways_use_spike': True, 'sideways_rsi_required': True}.
[I 2025-09-01 14:19:38,668] Trial 176 finished with values: [-1000000000.0, 1000000000.0] and parameters: {'p_sma': 16, 'p_std': 44, 'p_atr': 28, 'p_adx': 30, 'rsi_period': 70, 'ema1': 29, 'ema2': 44, 'slip_atr_k': 0.03607375070871126, 'slip_spread_k': 0.7727497925789734, 'spread_hl_frac': 0.005278098161049425, 'bb_std_mult': 3.046082583902274, 'rsi_os': 29, 'rsi_ob': 68, 'vol_spike': 0.043193589041120105, 'adx_thresh': 17.25638058055331, 'atr_min_pct': 0.010255176389196076, 'atr_max_pct': 0.08649349128211106, 'tp_mult': 2.8102695343894015, 'tsl_mult': 0.6198960021895736, 'strategy': 'breakout', 'time_stop': 25, 'use_sma': True, 'use_atr': False, 'use_adx': False, 'use_ema': True, 'use_spike': True, 'rsi_required': True, 'edge_k': 0.9830093551646426, 'edge_cap': 0.8382595049236091, 'bull_strategy': 'breakout', 'bull_bb_std_mult': 1.3218804398329829, 'bull_rsi_os': 6, 'bull_rsi_ob': 45, 'bull_adx_thresh': 9.984398158810711, 'bull_atr_min_pct': 0.00464021871376678, 'bull_atr_max_pct': 0.027494021002230272, 'bull_tp_mult': 2.0156220274099406, 'bull_tsl_mult': 0.4414484397552647, 'bull_time_stop': 122, 'bull_use_sma': False, 'bull_use_ema': False, 'bull_use_atr': True, 'bull_use_adx': False, 'bull_use_spike': True, 'bull_rsi_required': False, 'bear_strategy': 'mean_reversion', 'bear_bb_std_mult': 2.8529845667674256, 'bear_rsi_os': 10, 'bear_rsi_ob': 64, 'bear_adx_thresh': 10.954757894332815, 'bear_atr_min_pct': 0.028400604679926604, 'bear_atr_max_pct': 0.11822901816879394, 'bear_tp_mult': 2.7187653928211404, 'bear_tsl_mult': 0.9185119283926646, 'bear_time_stop': 275, 'bear_use_sma': False, 'bear_use_ema': False, 'bear_use_atr': False, 'bear_use_adx': False, 'bear_use_spike': True, 'bear_rsi_required': False, 'sideways_strategy': 'breakout', 'sideways_bb_std_mult': 1.3190260644844072, 'sideways_rsi_os': 16, 'sideways_rsi_ob': 83, 'sideways_adx_thresh': 9.432333024322872, 'sideways_atr_min_pct': 0.0057699357084677, 'sideways_atr_max_pct': 0.12952356697901582, 'sideways_tp_mult': 1.453169130727941, 'sideways_tsl_mult': 0.33830576338406304, 'sideways_time_stop': 107, 'sideways_use_sma': True, 'sideways_use_ema': False, 'sideways_use_atr': False, 'sideways_use_adx': False, 'sideways_use_spike': True, 'sideways_rsi_required': True}.
[I 2025-09-01 14:19:39,314] Trial 177 finished with values: [-1000000000.0, 1000000000.0] and parameters: {'p_sma': 15, 'p_std': 44, 'p_atr': 28, 'p_adx': 30, 'rsi_period': 70, 'ema1': 30, 'ema2': 46, 'slip_atr_k': 0.03604765458041265, 'slip_spread_k': 0.010510141035468934, 'spread_hl_frac': 0.013584349089402405, 'bb_std_mult': 2.234566573024769, 'rsi_os': 29, 'rsi_ob': 70, 'vol_spike': 0.045115424378697436, 'adx_thresh': 17.040154924882817, 'atr_min_pct': 0.010160568166020961, 'atr_max_pct': 0.07117698230333108, 'tp_mult': 2.76459192026692, 'tsl_mult': 0.27495088680112983, 'strategy': 'breakout', 'time_stop': 25, 'use_sma': True, 'use_atr': False, 'use_adx': False, 'use_ema': True, 'use_spike': True, 'rsi_required': True, 'edge_k': 0.7739037655527357, 'edge_cap': 0.8387594976627519, 'bull_strategy': 'breakout', 'bull_bb_std_mult': 2.457633634664954, 'bull_rsi_os': 13, 'bull_rsi_ob': 50, 'bull_adx_thresh': 11.214694782971067, 'bull_atr_min_pct': 0.003253834135242099, 'bull_atr_max_pct': 0.027498840883131433, 'bull_tp_mult': 1.9529662152552099, 'bull_tsl_mult': 0.25370177928603826, 'bull_time_stop': 212, 'bull_use_sma': False, 'bull_use_ema': False, 'bull_use_atr': False, 'bull_use_adx': False, 'bull_use_spike': True, 'bull_rsi_required': False, 'bear_strategy': 'mean_reversion', 'bear_bb_std_mult': 3.0026713909176657, 'bear_rsi_os': 10, 'bear_rsi_ob': 64, 'bear_adx_thresh': 11.505677653918877, 'bear_atr_min_pct': 0.028535939370146406, 'bear_atr_max_pct': 0.11086369917018664, 'bear_tp_mult': 2.573514086652964, 'bear_tsl_mult': 0.9181510048966502, 'bear_time_stop': 271, 'bear_use_sma': False, 'bear_use_ema': False, 'bear_use_atr': False, 'bear_use_adx': True, 'bear_use_spike': True, 'bear_rsi_required': False, 'sideways_strategy': 'breakout', 'sideways_bb_std_mult': 2.8738392456769875, 'sideways_rsi_os': 15, 'sideways_rsi_ob': 80, 'sideways_adx_thresh': 9.37553358823654, 'sideways_atr_min_pct': 0.0019602034802168305, 'sideways_atr_max_pct': 0.10175015962558297, 'sideways_tp_mult': 1.8712781581986722, 'sideways_tsl_mult': 0.24578505477470014, 'sideways_time_stop': 109, 'sideways_use_sma': True, 'sideways_use_ema': False, 'sideways_use_atr': False, 'sideways_use_adx': False, 'sideways_use_spike': True, 'sideways_rsi_required': True}.
[I 2025-09-01 14:20:16,083] Trial 179 finished with values: [-1000000000.0, 1000000000.0] and parameters: {'p_sma': 24, 'p_std': 41, 'p_atr': 26, 'p_adx': 28, 'rsi_period': 64, 'ema1': 28, 'ema2': 55, 'slip_atr_k': 0.0504593548270843, 'slip_spread_k': 0.3596227692665802, 'spread_hl_frac': 0.006034900204875699, 'bb_std_mult': 2.2326154061089576, 'rsi_os': 33, 'rsi_ob': 71, 'vol_spike': 0.019983719270672096, 'adx_thresh': 19.24468551449594, 'atr_min_pct': 0.012506878786452878, 'atr_max_pct': 0.07699801191796017, 'tp_mult': 2.4880632791420516, 'tsl_mult': 0.04130756564870375, 'strategy': 'breakout', 'time_stop': 42, 'use_sma': False, 'use_atr': False, 'use_adx': True, 'use_ema': False, 'use_spike': True, 'rsi_required': True, 'edge_k': 0.7202572214379697, 'edge_cap': 0.4650567523410756, 'bull_strategy': 'breakout', 'bull_bb_std_mult': 1.2044866779841652, 'bull_rsi_os': 15, 'bull_rsi_ob': 90, 'bull_adx_thresh': 11.025209651247389, 'bull_atr_min_pct': 0.0033349424111281598, 'bull_atr_max_pct': 0.03834498829775311, 'bull_tp_mult': 1.901590063723332, 'bull_tsl_mult': 0.3904451777243347, 'bull_time_stop': 300, 'bull_use_sma': True, 'bull_use_ema': False, 'bull_use_atr': False, 'bull_use_adx': True, 'bull_use_spike': False, 'bull_rsi_required': True, 'bear_strategy': 'mean_reversion', 'bear_bb_std_mult': 2.9217732966121175, 'bear_rsi_os': 10, 'bear_rsi_ob': 74, 'bear_adx_thresh': 8.6294744176382, 'bear_atr_min_pct': 0.02352290595400054, 'bear_atr_max_pct': 0.10894123558679628, 'bear_tp_mult': 2.567673183837134, 'bear_tsl_mult': 0.6615758897206696, 'bear_time_stop': 282, 'bear_use_sma': False, 'bear_use_ema': False, 'bear_use_atr': False, 'bear_use_adx': True, 'bear_use_spike': True, 'bear_rsi_required': False, 'sideways_strategy': 'breakout', 'sideways_bb_std_mult': 2.873851817631851, 'sideways_rsi_os': 17, 'sideways_rsi_ob': 86, 'sideways_adx_thresh': 6.808123264095344, 'sideways_atr_min_pct': 0.018115695499442114, 'sideways_atr_max_pct': 0.10894323087031067, 'sideways_tp_mult': 1.3743857806999276, 'sideways_tsl_mult': 0.22347130651142938, 'sideways_time_stop': 112, 'sideways_use_sma': True, 'sideways_use_ema': False, 'sideways_use_atr': True, 'sideways_use_adx': False, 'sideways_use_spike': True, 'sideways_rsi_required': True}.
[I 2025-09-01 14:20:16,784] Trial 180 finished with values: [-0.007178387573191558, 0.007231888559793688] and parameters: {'p_sma': 13, 'p_std': 13, 'p_atr': 26, 'p_adx': 28, 'rsi_period': 64, 'ema1': 30, 'ema2': 48, 'slip_atr_k': 0.044360837290964045, 'slip_spread_k': 0.2889706126106105, 'spread_hl_frac': 0.012931863939560178, 'bb_std_mult': 1.6953818004813823, 'rsi_os': 33, 'rsi_ob': 71, 'vol_spike': 0.2439987719102677, 'adx_thresh': 19.546501079086514, 'atr_min_pct': 0.012576483695898746, 'atr_max_pct': 0.07260699117721542, 'tp_mult': 2.9002724331207905, 'tsl_mult': 0.03437801523448364, 'strategy': 'breakout', 'time_stop': 48, 'use_sma': False, 'use_atr': False, 'use_adx': True, 'use_ema': False, 'use_spike': True, 'rsi_required': True, 'edge_k': 0.6198749953989415, 'edge_cap': 0.07741027283509844, 'bull_strategy': 'breakout', 'bull_bb_std_mult': 1.1697760683259248, 'bull_rsi_os': 15, 'bull_rsi_ob': 50, 'bull_adx_thresh': 11.31506122377374, 'bull_atr_min_pct': 0.003212311299176374, 'bull_atr_max_pct': 0.03959044955137861, 'bull_tp_mult': 2.1436012592632734, 'bull_tsl_mult': 0.38837265987144903, 'bull_time_stop': 158, 'bull_use_sma': True, 'bull_use_ema': False, 'bull_use_atr': False, 'bull_use_adx': True, 'bull_use_spike': False, 'bull_rsi_required': True, 'bear_strategy': 'mean_reversion', 'bear_bb_std_mult': 2.965208331004208, 'bear_rsi_os': 10, 'bear_rsi_ob': 77, 'bear_adx_thresh': 27.911905375615724, 'bear_atr_min_pct': 0.022690665574930782, 'bear_atr_max_pct': 0.10999710909720717, 'bear_tp_mult': 2.661527003547792, 'bear_tsl_mult': 0.6519742462850541, 'bear_time_stop': 287, 'bear_use_sma': False, 'bear_use_ema': False, 'bear_use_atr': False, 'bear_use_adx': True, 'bear_use_spike': True, 'bear_rsi_required': False, 'sideways_strategy': 'breakout', 'sideways_bb_std_mult': 2.874189802784052, 'sideways_rsi_os': 17, 'sideways_rsi_ob': 86, 'sideways_adx_thresh': 7.7537362090203175, 'sideways_atr_min_pct': 0.0053273573503955845, 'sideways_atr_max_pct': 0.13383551522341605, 'sideways_tp_mult': 1.7470509587417313, 'sideways_tsl_mult': 0.275297685555819, 'sideways_time_stop': 113, 'sideways_use_sma': True, 'sideways_use_ema': False, 'sideways_use_atr': True, 'sideways_use_adx': False, 'sideways_use_spike': True, 'sideways_rsi_required': True}.
