[I 2025-09-01 14:38:52,506] Trial 296 finished with values: [-0.007899806139593624, 0.007944817789637612] and parameters: {'p_sma': 20, 'p_std': 8, 'p_atr': 21, 'p_adx': 25, 'rsi_period': 63, 'ema1': 26, 'ema2': 53, 'slip_atr_k': 0.049277792738900414, 'slip_spread_k': 0.8884049110675916, 'spread_hl_frac': 0.038261445005909576, 'bb_std_mult': 3.2853020881547876, 'rsi_os': 38, 'rsi_ob': 72, 'vol_spike': 0.28280440154858855, 'adx_thresh': 19.29554054604906, 'atr_min_pct': 0.028331861470986392, 'atr_max_pct': 0.14917873103613316, 'tp_mult': 1.0124737617715387, 'tsl_mult': 0.41878902188601874, 'strategy': 'breakout', 'time_stop': 77, 'use_sma': False, 'use_atr': True, 'use_adx': True, 'use_ema': False, 'use_spike': True, 'rsi_required': False, 'edge_k': 0.49751912692737255, 'edge_cap': 0.07031731386392409, 'bull_strategy': 'breakout', 'bull_bb_std_mult': 2.8087165616190024, 'bull_rsi_os': 18, 'bull_rsi_ob': 74, 'bull_adx_thresh': 32.64313297080943, 'bull_atr_min_pct': 0.003697759344725044, 'bull_atr_max_pct': 0.015040310982740588, 'bull_tp_mult': 2.2448911354518017, 'bull_tsl_mult': 0.9136354646792739, 'bull_time_stop': 68, 'bull_use_sma': True, 'bull_use_ema': False, 'bull_use_atr': False, 'bull_use_adx': False, 'bull_use_spike': False, 'bull_rsi_required': True, 'bear_strategy': 'mean_reversion', 'bear_bb_std_mult': 2.78423659136437, 'bear_rsi_os': 29, 'bear_rsi_ob': 78, 'bear_adx_thresh': 27.670827619725088, 'bear_atr_min_pct': 0.022824410623965712, 'bear_atr_max_pct': 0.10315415633090733, 'bear_tp_mult': 2.4530690411806977, 'bear_tsl_mult': 0.9660519494144701, 'bear_time_stop': 289, 'bear_use_sma': False, 'bear_use_ema': False, 'bear_use_atr': False, 'bear_use_adx': True, 'bear_use_spike': False, 'bear_rsi_required': False, 'sideways_strategy': 'mean_reversion', 'sideways_bb_std_mult': 2.15123673993187, 'sideways_rsi_os': 16, 'sideways_rsi_ob': 47, 'sideways_adx_thresh': 5.707805354384066, 'sideways_atr_min_pct': 0.01891189729927144, 'sideways_atr_max_pct': 0.06451887470528195, 'sideways_tp_mult': 2.0317613632189615, 'sideways_tsl_mult': 0.2575767626350298, 'sideways_time_stop': 113, 'sideways_use_sma': False, 'sideways_use_ema': False, 'sideways_use_atr': True, 'sideways_use_adx': False, 'sideways_use_spike': True, 'sideways_rsi_required': True}.
[I 2025-09-01 14:38:53,035] Trial 295 finished with values: [-0.009385444296154288, 0.009434465277358261] and parameters: {'p_sma': 14, 'p_std': 8, 'p_atr': 21, 'p_adx': 25, 'rsi_period': 64, 'ema1': 26, 'ema2': 53, 'slip_atr_k': 0.05105858447574752, 'slip_spread_k': 0.9992788817701947, 'spread_hl_frac': 0.017322629526831924, 'bb_std_mult': 1.5005644325548064, 'rsi_os': 38, 'rsi_ob': 94, 'vol_spike': 0.28252924718463895, 'adx_thresh': 19.382118979516434, 'atr_min_pct': 0.01832782013703916, 'atr_max_pct': 0.050417018031627236, 'tp_mult': 2.907016585215133, 'tsl_mult': 0.07844551311486993, 'strategy': 'breakout', 'time_stop': 77, 'use_sma': False, 'use_atr': True, 'use_adx': True, 'use_ema': False, 'use_spike': True, 'rsi_required': False, 'edge_k': 0.5004264669184703, 'edge_cap': 0.07312301389268656, 'bull_strategy': 'breakout', 'bull_bb_std_mult': 2.799305134260012, 'bull_rsi_os': 18, 'bull_rsi_ob': 65, 'bull_adx_thresh': 32.525731330484106, 'bull_atr_min_pct': 0.003507265499778746, 'bull_atr_max_pct': 0.02316117690961875, 'bull_tp_mult': 2.0715298151337733, 'bull_tsl_mult': 0.3946138925626915, 'bull_time_stop': 222, 'bull_use_sma': True, 'bull_use_ema': False, 'bull_use_atr': False, 'bull_use_adx': False, 'bull_use_spike': False, 'bull_rsi_required': True, 'bear_strategy': 'mean_reversion', 'bear_bb_std_mult': 2.659599601818837, 'bear_rsi_os': 29, 'bear_rsi_ob': 81, 'bear_adx_thresh': 6.455210030903226, 'bear_atr_min_pct': 0.022592224309242456, 'bear_atr_max_pct': 0.11394504446452706, 'bear_tp_mult': 2.456914636045421, 'bear_tsl_mult': 0.9721398470097629, 'bear_time_stop': 182, 'bear_use_sma': False, 'bear_use_ema': False, 'bear_use_atr': False, 'bear_use_adx': True, 'bear_use_spike': False, 'bear_rsi_required': False, 'sideways_strategy': 'mean_reversion', 'sideways_bb_std_mult': 1.1720064002129424, 'sideways_rsi_os': 15, 'sideways_rsi_ob': 79, 'sideways_adx_thresh': 5.768917805829164, 'sideways_atr_min_pct': 0.006122978495949368, 'sideways_atr_max_pct': 0.067128598606916, 'sideways_tp_mult': 1.6783439238934295, 'sideways_tsl_mult': 0.25776989058284283, 'sideways_time_stop': 115, 'sideways_use_sma': False, 'sideways_use_ema': False, 'sideways_use_atr': True, 'sideways_use_adx': False, 'sideways_use_spike': True, 'sideways_rsi_required': True}.
[I 2025-09-01 14:39:30,003] Trial 301 finished with values: [-0.021598437031199347, 0.021646126338004886] and parameters: {'p_sma': 23, 'p_std': 6, 'p_atr': 19, 'p_adx': 26, 'rsi_period': 76, 'ema1': 8, 'ema2': 36, 'slip_atr_k': 0.06258686755399472, 'slip_spread_k': 0.26098394182215834, 'spread_hl_frac': 0.014517578362297863, 'bb_std_mult': 1.4990433125083824, 'rsi_os': 34, 'rsi_ob': 85, 'vol_spike': 0.28911899824430526, 'adx_thresh': 18.239122684748416, 'atr_min_pct': 0.028309766658686925, 'atr_max_pct': 0.08409436343185211, 'tp_mult': 2.908710368390104, 'tsl_mult': 0.04840412811206011, 'strategy': 'breakout', 'time_stop': 60, 'use_sma': True, 'use_atr': True, 'use_adx': True, 'use_ema': False, 'use_spike': True, 'rsi_required': False, 'edge_k': 1.998255268766183, 'edge_cap': 0.4568805141123654, 'bull_strategy': 'mean_reversion', 'bull_bb_std_mult': 3.4261144472173255, 'bull_rsi_os': 15, 'bull_rsi_ob': 50, 'bull_adx_thresh': 22.143134773111658, 'bull_atr_min_pct': 0.0025832874019153236, 'bull_atr_max_pct': 0.017057468858700724, 'bull_tp_mult': 2.0164498994561972, 'bull_tsl_mult': 0.707852674239063, 'bull_time_stop': 189, 'bull_use_sma': False, 'bull_use_ema': False, 'bull_use_atr': False, 'bull_use_adx': True, 'bull_use_spike': False, 'bull_rsi_required': True, 'bear_strategy': 'mean_reversion', 'bear_bb_std_mult': 2.9055132362397824, 'bear_rsi_os': 6, 'bear_rsi_ob': 78, 'bear_adx_thresh': 30.087670654284683, 'bear_atr_min_pct': 0.022682106218077668, 'bear_atr_max_pct': 0.11702837611242788, 'bear_tp_mult': 2.541346727303444, 'bear_tsl_mult': 0.38879801132300496, 'bear_time_stop': 60, 'bear_use_sma': False, 'bear_use_ema': False, 'bear_use_atr': False, 'bear_use_adx': True, 'bear_use_spike': False, 'bear_rsi_required': False, 'sideways_strategy': 'mean_reversion', 'sideways_bb_std_mult': 1.151690401162459, 'sideways_rsi_os': 46, 'sideways_rsi_ob': 77, 'sideways_adx_thresh': 6.6331300974065615, 'sideways_atr_min_pct': 0.00626935131517572, 'sideways_atr_max_pct': 0.12953386635623082, 'sideways_tp_mult': 2.041870080614072, 'sideways_tsl_mult': 0.26041615500473564, 'sideways_time_stop': 115, 'sideways_use_sma': False, 'sideways_use_ema': False, 'sideways_use_atr': True, 'sideways_use_adx': False, 'sideways_use_spike': True, 'sideways_rsi_required': True}.
[I 2025-09-01 14:39:31,773] Trial 300 finished with values: [-0.01021535967420828, 0.01021867988157303] and parameters: {'p_sma': 23, 'p_std': 32, 'p_atr': 19, 'p_adx': 25, 'rsi_period': 68, 'ema1': 30, 'ema2': 13, 'slip_atr_k': 0.062275929624057286, 'slip_spread_k': 0.25923346313946677, 'spread_hl_frac': 0.017277828405339708, 'bb_std_mult': 1.5060621796116083, 'rsi_os': 38, 'rsi_ob': 74, 'vol_spike': 0.2877126006899796, 'adx_thresh': 18.354748728927976, 'atr_min_pct': 0.003416773653182893, 'atr_max_pct': 0.047114693268319165, 'tp_mult': 2.5137152641335567, 'tsl_mult': 0.023609775077265284, 'strategy': 'breakout', 'time_stop': 58, 'use_sma': True, 'use_atr': True, 'use_adx': True, 'use_ema': False, 'use_spike': True, 'rsi_required': False, 'edge_k': 1.218899406417858, 'edge_cap': 0.08287853156616903, 'bull_strategy': 'breakout', 'bull_bb_std_mult': 2.8027580833615016, 'bull_rsi_os': 27, 'bull_rsi_ob': 50, 'bull_adx_thresh': 10.783998302987168, 'bull_atr_min_pct': 0.002611659239065767, 'bull_atr_max_pct': 0.05206090645913286, 'bull_tp_mult': 2.844219705336883, 'bull_tsl_mult': 0.33589900221263025, 'bull_time_stop': 156, 'bull_use_sma': True, 'bull_use_ema': False, 'bull_use_atr': False, 'bull_use_adx': False, 'bull_use_spike': False, 'bull_rsi_required': True, 'bear_strategy': 'mean_reversion', 'bear_bb_std_mult': 2.924873949314067, 'bear_rsi_os': 53, 'bear_rsi_ob': 78, 'bear_adx_thresh': 6.3259834933083745, 'bear_atr_min_pct': 0.021195395629717756, 'bear_atr_max_pct': 0.1119959574134436, 'bear_tp_mult': 1.0477018359991224, 'bear_tsl_mult': 0.6654518437802202, 'bear_time_stop': 274, 'bear_use_sma': False, 'bear_use_ema': False, 'bear_use_atr': False, 'bear_use_adx': True, 'bear_use_spike': False, 'bear_rsi_required': False, 'sideways_strategy': 'mean_reversion', 'sideways_bb_std_mult': 3.232403570987438, 'sideways_rsi_os': 15, 'sideways_rsi_ob': 77, 'sideways_adx_thresh': 6.655255048033094, 'sideways_atr_min_pct': 0.005596113161756234, 'sideways_atr_max_pct': 0.012763709166668427, 'sideways_tp_mult': 2.927858702264186, 'sideways_tsl_mult': 0.29846571060780047, 'sideways_time_stop': 114, 'sideways_use_sma': False, 'sideways_use_ema': False, 'sideways_use_atr': True, 'sideways_use_adx': False, 'sideways_use_spike': True, 'sideways_rsi_required': True}.
[I 2025-09-01 14:39:32,200] Trial 302 finished with values: [-1000000000.0, 1000000000.0] and parameters: {'p_sma': 14, 'p_std': 6, 'p_atr': 19, 'p_adx': 15, 'rsi_period': 65, 'ema1': 30, 'ema2': 53, 'slip_atr_k': 0.06416826269111438, 'slip_spread_k': 0.9703721796116053, 'spread_hl_frac': 0.026381504585657065, 'bb_std_mult': 1.5266314330469046, 'rsi_os': 34, 'rsi_ob': 79, 'vol_spike': 0.28795099751222203, 'adx_thresh': 17.596021964172525, 'atr_min_pct': 0.014666769113768054, 'atr_max_pct': 0.07981086623553087, 'tp_mult': 2.7840163577166486, 'tsl_mult': 0.03066690152125022, 'strategy': 'breakout', 'time_stop': 60, 'use_sma': True, 'use_atr': True, 'use_adx': True, 'use_ema': False, 'use_spike': True, 'rsi_required': False, 'edge_k': 1.2259889103153547, 'edge_cap': 0.11067110845374936, 'bull_strategy': 'mean_reversion', 'bull_bb_std_mult': 3.4258230105618805, 'bull_rsi_os': 15, 'bull_rsi_ob': 88, 'bull_adx_thresh': 26.957165220330477, 'bull_atr_min_pct': 0.006099013530948827, 'bull_atr_max_pct': 0.016498972747577535, 'bull_tp_mult': 2.025761774563489, 'bull_tsl_mult': 0.34089722258746225, 'bull_time_stop': 69, 'bull_use_sma': False, 'bull_use_ema': False, 'bull_use_atr': False, 'bull_use_adx': True, 'bull_use_spike': False, 'bull_rsi_required': True, 'bear_strategy': 'mean_reversion', 'bear_bb_std_mult': 2.914734941948795, 'bear_rsi_os': 5, 'bear_rsi_ob': 78, 'bear_adx_thresh': 17.593660810833406, 'bear_atr_min_pct': 0.022754286738886038, 'bear_atr_max_pct': 0.07474520704972398, 'bear_tp_mult': 2.539086233402033, 'bear_tsl_mult': 0.6851312602297055, 'bear_time_stop': 159, 'bear_use_sma': False, 'bear_use_ema': False, 'bear_use_atr': False, 'bear_use_adx': True, 'bear_use_spike': False, 'bear_rsi_required': False, 'sideways_strategy': 'mean_reversion', 'sideways_bb_std_mult': 2.034259961794816, 'sideways_rsi_os': 15, 'sideways_rsi_ob': 89, 'sideways_adx_thresh': 30.715533651034796, 'sideways_atr_min_pct': 0.00591756786390292, 'sideways_atr_max_pct': 0.1302378131286261, 'sideways_tp_mult': 2.95234279022644, 'sideways_tsl_mult': 0.26338702661756985, 'sideways_time_stop': 186, 'sideways_use_sma': False, 'sideways_use_ema': True, 'sideways_use_atr': True, 'sideways_use_adx': False, 'sideways_use_spike': True, 'sideways_rsi_required': True}.
[I 2025-09-01 14:39:32,531] Trial 299 finished with values: [-0.015587890033814666, 0.015497231179087892] and parameters: {'p_sma': 47, 'p_std': 41, 'p_atr': 19, 'p_adx': 15, 'rsi_period': 68, 'ema1': 16, 'ema2': 36, 'slip_atr_k': 0.05415328769274265, 'slip_spread_k': 0.8885871640583489, 'spread_hl_frac': 0.01453121670255621, 'bb_std_mult': 0.9972870594749033, 'rsi_os': 38, 'rsi_ob': 74, 'vol_spike': 0.00016989044816800858, 'adx_thresh': 18.478750924790546, 'atr_min_pct': 0.020673673515432006, 'atr_max_pct': 0.08354565406357069, 'tp_mult': 2.7859181870565894, 'tsl_mult': 0.03302685854898943, 'strategy': 'breakout', 'time_stop': 134, 'use_sma': True, 'use_atr': True, 'use_adx': True, 'use_ema': False, 'use_spike': True, 'rsi_required': False, 'edge_k': 1.2276273727055353, 'edge_cap': 0.9093854379936315, 'bull_strategy': 'breakout', 'bull_bb_std_mult': 2.8249166066119784, 'bull_rsi_os': 19, 'bull_rsi_ob': 88, 'bull_adx_thresh': 10.657727990909722, 'bull_atr_min_pct': 0.0026581374069456487, 'bull_atr_max_pct': 0.0531098259591467, 'bull_tp_mult': 2.2520379941802635, 'bull_tsl_mult': 0.3440348931016482, 'bull_time_stop': 231, 'bull_use_sma': True, 'bull_use_ema': False, 'bull_use_atr': False, 'bull_use_adx': False, 'bull_use_spike': False, 'bull_rsi_required': True, 'bear_strategy': 'mean_reversion', 'bear_bb_std_mult': 1.433288206366654, 'bear_rsi_os': 5, 'bear_rsi_ob': 77, 'bear_adx_thresh': 17.797801526694297, 'bear_atr_min_pct': 0.01357265778999306, 'bear_atr_max_pct': 0.11150403752398155, 'bear_tp_mult': 2.443621735918368, 'bear_tsl_mult': 0.5858332858706963, 'bear_time_stop': 279, 'bear_use_sma': False, 'bear_use_ema': False, 'bear_use_atr': False, 'bear_use_adx': True, 'bear_use_spike': False, 'bear_rsi_required': False, 'sideways_strategy': 'mean_reversion', 'sideways_bb_std_mult': 1.1597325067805828, 'sideways_rsi_os': 15, 'sideways_rsi_ob': 47, 'sideways_adx_thresh': 16.00376230211209, 'sideways_atr_min_pct': 0.027783588751749785, 'sideways_atr_max_pct': 0.1300724715710495, 'sideways_tp_mult': 1.689180176596872, 'sideways_tsl_mult': 0.30094633595416287, 'sideways_time_stop': 113, 'sideways_use_sma': False, 'sideways_use_ema': False, 'sideways_use_atr': True, 'sideways_use_adx': False, 'sideways_use_spike': True, 'sideways_rsi_required': True}.
[I 2025-09-01 14:39:33,328] Trial 306 finished with values: [-1000000000.0, 1000000000.0] and parameters: {'p_sma': 13, 'p_std': 15, 'p_atr': 20, 'p_adx': 12, 'rsi_period': 16, 'ema1': 30, 'ema2': 53, 'slip_atr_k': 0.0549455001928096, 'slip_spread_k': 0.25990132769690133, 'spread_hl_frac': 0.017075416568633664, 'bb_std_mult': 1.5998818521737264, 'rsi_os': 37, 'rsi_ob': 74, 'vol_spike': 0.29028624607279585, 'adx_thresh': 20.45260146154316, 'atr_min_pct': 0.02259037932419154, 'atr_max_pct': 0.01716691457126493, 'tp_mult': 2.8847538683748746, 'tsl_mult': 0.07109765512014977, 'strategy': 'breakout', 'time_stop': 70, 'use_sma': False, 'use_atr': True, 'use_adx': True, 'use_ema': False, 'use_spike': True, 'rsi_required': False, 'edge_k': 0.6011518036650983, 'edge_cap': 0.07768304107818272, 'bull_strategy': 'breakout', 'bull_bb_std_mult': 2.808291747046549, 'bull_rsi_os': 27, 'bull_rsi_ob': 57, 'bull_adx_thresh': 30.874554981616033, 'bull_atr_min_pct': 0.011921949227385943, 'bull_atr_max_pct': 0.05295882180367708, 'bull_tp_mult': 2.271978792024248, 'bull_tsl_mult': 0.9830747402234122, 'bull_time_stop': 156, 'bull_use_sma': True, 'bull_use_ema': False, 'bull_use_atr': False, 'bull_use_adx': False, 'bull_use_spike': False, 'bull_rsi_required': False, 'bear_strategy': 'mean_reversion', 'bear_bb_std_mult': 1.4722106534687278, 'bear_rsi_os': 10, 'bear_rsi_ob': 48, 'bear_adx_thresh': 18.56425743801964, 'bear_atr_min_pct': 0.025144614911534975, 'bear_atr_max_pct': 0.1118269434053967, 'bear_tp_mult': 2.425337010122066, 'bear_tsl_mult': 0.6620972911617299, 'bear_time_stop': 274, 'bear_use_sma': False, 'bear_use_ema': False, 'bear_use_atr': False, 'bear_use_adx': True, 'bear_use_spike': False, 'bear_rsi_required': False, 'sideways_strategy': 'mean_reversion', 'sideways_bb_std_mult': 3.271364653215219, 'sideways_rsi_os': 17, 'sideways_rsi_ob': 89, 'sideways_adx_thresh': 7.728643417010854, 'sideways_atr_min_pct': 0.0007290293875996199, 'sideways_atr_max_pct': 0.12081720070139362, 'sideways_tp_mult': 1.9080605746387744, 'sideways_tsl_mult': 0.711955052321637, 'sideways_time_stop': 62, 'sideways_use_sma': False, 'sideways_use_ema': False, 'sideways_use_atr': True, 'sideways_use_adx': False, 'sideways_use_spike': True, 'sideways_rsi_required': True}.
[I 2025-09-01 14:39:33,360] Trial 305 finished with values: [-1000000000.0, 1000000000.0] and parameters: {'p_sma': 46, 'p_std': 15, 'p_atr': 23, 'p_adx': 25, 'rsi_period': 68, 'ema1': 30, 'ema2': 57, 'slip_atr_k': 0.052521166273793336, 'slip_spread_k': 0.2609379047262599, 'spread_hl_frac': 0.01366630387713358, 'bb_std_mult': 1.7818392751470296, 'rsi_os': 37, 'rsi_ob': 74, 'vol_spike': 0.2902013371502576, 'adx_thresh': 16.662465213195702, 'atr_min_pct': 0.020996519890106764, 'atr_max_pct': 0.01783941371035841, 'tp_mult': 1.0100437115254768, 'tsl_mult': 0.7002300809269554, 'strategy': 'breakout', 'time_stop': 70, 'use_sma': False, 'use_atr': True, 'use_adx': True, 'use_ema': False, 'use_spike': True, 'rsi_required': False, 'edge_k': 1.4926395644732366, 'edge_cap': 0.23691549037960846, 'bull_strategy': 'breakout', 'bull_bb_std_mult': 2.797379720609085, 'bull_rsi_os': 19, 'bull_rsi_ob': 50, 'bull_adx_thresh': 30.91320448312404, 'bull_atr_min_pct': 0.016042083374452003, 'bull_atr_max_pct': 0.021256395425960264, 'bull_tp_mult': 1.6722741296555534, 'bull_tsl_mult': 0.6784386239555538, 'bull_time_stop': 159, 'bull_use_sma': True, 'bull_use_ema': False, 'bull_use_atr': False, 'bull_use_adx': False, 'bull_use_spike': False, 'bull_rsi_required': False, 'bear_strategy': 'mean_reversion', 'bear_bb_std_mult': 2.751301026594503, 'bear_rsi_os': 10, 'bear_rsi_ob': 46, 'bear_adx_thresh': 6.409720274011157, 'bear_atr_min_pct': 0.01357137232217022, 'bear_atr_max_pct': 0.11202228726311572, 'bear_tp_mult': 2.4439893958284036, 'bear_tsl_mult': 0.6249466497992933, 'bear_time_stop': 280, 'bear_use_sma': False, 'bear_use_ema': False, 'bear_use_atr': False, 'bear_use_adx': True, 'bear_use_spike': False, 'bear_rsi_required': False, 'sideways_strategy': 'mean_reversion', 'sideways_bb_std_mult': 3.24484012890958, 'sideways_rsi_os': 17, 'sideways_rsi_ob': 71, 'sideways_adx_thresh': 7.920901673264597, 'sideways_atr_min_pct': 0.0054494103125165266, 'sideways_atr_max_pct': 0.13469272201509894, 'sideways_tp_mult': 1.907000141008006, 'sideways_tsl_mult': 0.8903461359718885, 'sideways_time_stop': 62, 'sideways_use_sma': False, 'sideways_use_ema': False, 'sideways_use_atr': True, 'sideways_use_adx': False, 'sideways_use_spike': True, 'sideways_rsi_required': True}.
[I 2025-09-01 14:40:08,269] Trial 304 finished with values: [-1000000000.0, 1000000000.0] and parameters: {'p_sma': 14, 'p_std': 15, 'p_atr': 20, 'p_adx': 27, 'rsi_period': 72, 'ema1': 15, 'ema2': 57, 'slip_atr_k': 0.05493875535198667, 'slip_spread_k': 0.2666697132985703, 'spread_hl_frac': 0.032252837938339066, 'bb_std_mult': 1.788703577438406, 'rsi_os': 37, 'rsi_ob': 74, 'vol_spike': 0.29112792625766204, 'adx_thresh': 29.647332723952875, 'atr_min_pct': 0.027325269410938782, 'atr_max_pct': 0.06888479703934307, 'tp_mult': 2.876038907112583, 'tsl_mult': 0.06778265649685376, 'strategy': 'breakout', 'time_stop': 70, 'use_sma': False, 'use_atr': True, 'use_adx': True, 'use_ema': False, 'use_spike': True, 'rsi_required': False, 'edge_k': 1.3979611798252631, 'edge_cap': 0.5736733849684141, 'bull_strategy': 'breakout', 'bull_bb_std_mult': 2.8169743149064055, 'bull_rsi_os': 19, 'bull_rsi_ob': 83, 'bull_adx_thresh': 30.288221223668955, 'bull_atr_min_pct': 0.009326370103415176, 'bull_atr_max_pct': 0.02045579319561356, 'bull_tp_mult': 2.2643327576417556, 'bull_tsl_mult': 0.44844461814749637, 'bull_time_stop': 155, 'bull_use_sma': True, 'bull_use_ema': False, 'bull_use_atr': True, 'bull_use_adx': False, 'bull_use_spike': True, 'bull_rsi_required': False, 'bear_strategy': 'mean_reversion', 'bear_bb_std_mult': 2.732548516474047, 'bear_rsi_os': 10, 'bear_rsi_ob': 46, 'bear_adx_thresh': 5.042432373784266, 'bear_atr_min_pct': 0.021260572682847402, 'bear_atr_max_pct': 0.11235470471499738, 'bear_tp_mult': 2.4374031107217724, 'bear_tsl_mult': 0.5866013160727029, 'bear_time_stop': 272, 'bear_use_sma': False, 'bear_use_ema': False, 'bear_use_atr': False, 'bear_use_adx': False, 'bear_use_spike': False, 'bear_rsi_required': False, 'sideways_strategy': 'mean_reversion', 'sideways_bb_std_mult': 1.0447955934649744, 'sideways_rsi_os': 17, 'sideways_rsi_ob': 71, 'sideways_adx_thresh': 7.677762262912689, 'sideways_atr_min_pct': 0.027832409945785893, 'sideways_atr_max_pct': 0.1344680378944867, 'sideways_tp_mult': 1.9021019743979952, 'sideways_tsl_mult': 0.8843366958219359, 'sideways_time_stop': 113, 'sideways_use_sma': False, 'sideways_use_ema': False, 'sideways_use_atr': True, 'sideways_use_adx': False, 'sideways_use_spike': True, 'sideways_rsi_required': True}.
