[I 2025-09-01 13:56:22,730] Trial 21 finished with values: [-1000000000.0, 1000000000.0] and parameters: {'p_sma': 39, 'p_std': 13, 'p_atr': 21, 'p_adx': 24, 'rsi_period': 37, 'ema1': 21, 'ema2': 48, 'slip_atr_k': 0.23956326911646197, 'slip_spread_k': 0.2655904049761682, 'spread_hl_frac': 0.016567679107307345, 'bb_std_mult': 2.7052916280319517, 'rsi_os': 47, 'rsi_ob': 70, 'vol_spike': 0.003288153069861466, 'adx_thresh': 14.562122755775922, 'atr_min_pct': 0.005777134036326518, 'atr_max_pct': 0.125029964441094, 'tp_mult': 2.0410309468369725, 'tsl_mult': 0.7082856532466272, 'strategy': 'mean_reversion', 'time_stop': 131, 'use_sma': False, 'use_atr': True, 'use_adx': True, 'use_ema': False, 'use_spike': False, 'rsi_required': False, 'edge_k': 1.192188637431458, 'edge_cap': 0.7816381421160281, 'bull_strategy': 'mean_reversion', 'bull_bb_std_mult': 1.0854245879797055, 'bull_rsi_os': 46, 'bull_rsi_ob': 57, 'bull_adx_thresh': 8.969729853230179, 'bull_atr_min_pct': 0.021808705761104143, 'bull_atr_max_pct': 0.12534802201862963, 'bull_tp_mult': 2.136980043490342, 'bull_tsl_mult': 0.19087113293099434, 'bull_time_stop': 263, 'bull_use_sma': True, 'bull_use_ema': True, 'bull_use_atr': True, 'bull_use_adx': False, 'bull_use_spike': True, 'bull_rsi_required': True, 'bear_strategy': 'breakout', 'bear_bb_std_mult': 1.2387028211702347, 'bear_rsi_os': 16, 'bear_rsi_ob': 56, 'bear_adx_thresh': 14.10872639668284, 'bear_atr_min_pct': 0.009886035892703277, 'bear_atr_max_pct': 0.11968810738061658, 'bear_tp_mult': 1.6108580916480921, 'bear_tsl_mult': 0.5243235110553981, 'bear_time_stop': 47, 'bear_use_sma': True, 'bear_use_ema': True, 'bear_use_atr': False, 'bear_use_adx': False, 'bear_use_spike': True, 'bear_rsi_required': True, 'sideways_strategy': 'mean_reversion', 'sideways_bb_std_mult': 0.5107484117950227, 'sideways_rsi_os': 5, 'sideways_rsi_ob': 53, 'sideways_adx_thresh': 23.71473929700576, 'sideways_atr_min_pct': 0.021841894263781355, 'sideways_atr_max_pct': 0.08975540609615687, 'sideways_tp_mult': 2.223458993058553, 'sideways_tsl_mult': 0.7985540202532259, 'sideways_time_stop': 299, 'sideways_use_sma': False, 'sideways_use_ema': False, 'sideways_use_atr': True, 'sideways_use_adx': True, 'sideways_use_spike': False, 'sideways_rsi_required': False}.
[I 2025-09-01 13:56:23,144] Trial 20 finished with values: [-0.15585604542497533, 0.15573673174936997] and parameters: {'p_sma': 39, 'p_std': 51, 'p_atr': 22, 'p_adx': 23, 'rsi_period': 59, 'ema1': 20, 'ema2': 32, 'slip_atr_k': 0.24133794086159488, 'slip_spread_k': 0.29056419228816466, 'spread_hl_frac': 0.016768266139841774, 'bb_std_mult': 2.8250033403187826, 'rsi_os': 17, 'rsi_ob': 70, 'vol_spike': 0.05137771448142496, 'adx_thresh': 17.388218291415534, 'atr_min_pct': 0.006375392127863321, 'atr_max_pct': 0.12473032802776497, 'tp_mult': 1.9605897088126136, 'tsl_mult': 0.23672569120392073, 'strategy': 'mean_reversion', 'time_stop': 129, 'use_sma': False, 'use_atr': False, 'use_adx': True, 'use_ema': False, 'use_spike': False, 'rsi_required': True, 'edge_k': 1.2566499531317452, 'edge_cap': 0.7906996891674138, 'bull_strategy': 'mean_reversion', 'bull_bb_std_mult': 1.0683528641534177, 'bull_rsi_os': 33, 'bull_rsi_ob': 57, 'bull_adx_thresh': 9.000379152250021, 'bull_atr_min_pct': 0.0008730008952800728, 'bull_atr_max_pct': 0.12484749447131341, 'bull_tp_mult': 1.5713817824534897, 'bull_tsl_mult': 0.04538849253499544, 'bull_time_stop': 97, 'bull_use_sma': True, 'bull_use_ema': True, 'bull_use_atr': True, 'bull_use_adx': True, 'bull_use_spike': True, 'bull_rsi_required': True, 'bear_strategy': 'breakout', 'bear_bb_std_mult': 1.2739784258496163, 'bear_rsi_os': 16, 'bear_rsi_ob': 95, 'bear_adx_thresh': 14.216557566145122, 'bear_atr_min_pct': 0.01951615758337833, 'bear_atr_max_pct': 0.014248515697908443, 'bear_tp_mult': 2.645105762188735, 'bear_tsl_mult': 0.25120840958624746, 'bear_time_stop': 288, 'bear_use_sma': True, 'bear_use_ema': False, 'bear_use_atr': True, 'bear_use_adx': False, 'bear_use_spike': True, 'bear_rsi_required': True, 'sideways_strategy': 'breakout', 'sideways_bb_std_mult': 2.9491560023100387, 'sideways_rsi_os': 5, 'sideways_rsi_ob': 56, 'sideways_adx_thresh': 22.680868168279375, 'sideways_atr_min_pct': 0.000257555019569318, 'sideways_atr_max_pct': 0.09052731325327974, 'sideways_tp_mult': 2.2463050233995743, 'sideways_tsl_mult': 0.511479364990387, 'sideways_time_stop': 106, 'sideways_use_sma': True, 'sideways_use_ema': False, 'sideways_use_atr': True, 'sideways_use_adx': True, 'sideways_use_spike': False, 'sideways_rsi_required': False}.
[I 2025-09-01 13:56:23,549] Trial 18 finished with values: [-0.2887750641200181, 0.2887246198049683] and parameters: {'p_sma': 59, 'p_std': 57, 'p_atr': 14, 'p_adx': 24, 'rsi_period': 58, 'ema1': 21, 'ema2': 34, 'slip_atr_k': 0.16127785945793566, 'slip_spread_k': 0.3198057416202184, 'spread_hl_frac': 0.015319372907171664, 'bb_std_mult': 2.844973920277133, 'rsi_os': 17, 'rsi_ob': 81, 'vol_spike': 0.09856374478961347, 'adx_thresh': 15.375977711526218, 'atr_min_pct': 0.007230095873792739, 'atr_max_pct': 0.10239962024657118, 'tp_mult': 1.8775366114643124, 'tsl_mult': 0.2647480173643448, 'strategy': 'mean_reversion', 'time_stop': 125, 'use_sma': False, 'use_atr': False, 'use_adx': True, 'use_ema': False, 'use_spike': False, 'rsi_required': True, 'edge_k': 1.9997421427541227, 'edge_cap': 0.4602440054867531, 'bull_strategy': 'breakout', 'bull_bb_std_mult': 1.3104818211156664, 'bull_rsi_os': 7, 'bull_rsi_ob': 57, 'bull_adx_thresh': 16.381325589724458, 'bull_atr_min_pct': 0.00029807961162343216, 'bull_atr_max_pct': 0.12306678748136027, 'bull_tp_mult': 2.672322303034354, 'bull_tsl_mult': 0.014301551031729587, 'bull_time_stop': 76, 'bull_use_sma': False, 'bull_use_ema': True, 'bull_use_atr': False, 'bull_use_adx': True, 'bull_use_spike': True, 'bull_rsi_required': True, 'bear_strategy': 'breakout', 'bear_bb_std_mult': 3.579704162800579, 'bear_rsi_os': 6, 'bear_rsi_ob': 73, 'bear_adx_thresh': 34.809549565274324, 'bear_atr_min_pct': 0.019794841390596462, 'bear_atr_max_pct': 0.11821252908663935, 'bear_tp_mult': 2.6406335514314745, 'bear_tsl_mult': 0.23306849943928848, 'bear_time_stop': 293, 'bear_use_sma': True, 'bear_use_ema': False, 'bear_use_atr': True, 'bear_use_adx': True, 'bear_use_spike': False, 'bear_rsi_required': True, 'sideways_strategy': 'breakout', 'sideways_bb_std_mult': 1.8617565253698014, 'sideways_rsi_os': 40, 'sideways_rsi_ob': 53, 'sideways_adx_thresh': 14.39477500226409, 'sideways_atr_min_pct': 0.00015733899201479142, 'sideways_atr_max_pct': 0.0945852369179043, 'sideways_tp_mult': 2.341433868884859, 'sideways_tsl_mult': 0.5191818551731869, 'sideways_time_stop': 298, 'sideways_use_sma': True, 'sideways_use_ema': True, 'sideways_use_atr': True, 'sideways_use_adx': False, 'sideways_use_spike': False, 'sideways_rsi_required': False}.
[I 2025-09-01 13:56:23,903] Trial 19 finished with values: [-0.24287416655397964, 0.24277006439831014] and parameters: {'p_sma': 40, 'p_std': 60, 'p_atr': 15, 'p_adx': 12, 'rsi_period': 58, 'ema1': 23, 'ema2': 33, 'slip_atr_k': 0.24300141267289718, 'slip_spread_k': 0.33907933535797485, 'spread_hl_frac': 0.017800716637395332, 'bb_std_mult': 1.094991283992286, 'rsi_os': 17, 'rsi_ob': 81, 'vol_spike': 0.0039059236946364373, 'adx_thresh': 16.27954830979755, 'atr_min_pct': 0.007894555414818968, 'atr_max_pct': 0.11265014818041871, 'tp_mult': 1.9486162805746867, 'tsl_mult': 0.27521945319289065, 'strategy': 'mean_reversion', 'time_stop': 127, 'use_sma': False, 'use_atr': False, 'use_adx': True, 'use_ema': False, 'use_spike': False, 'rsi_required': True, 'edge_k': 1.9852179395454748, 'edge_cap': 0.3815860083333119, 'bull_strategy': 'mean_reversion', 'bull_bb_std_mult': 1.295585343146172, 'bull_rsi_os': 7, 'bull_rsi_ob': 57, 'bull_adx_thresh': 15.880967956906455, 'bull_atr_min_pct': 0.0011326377781882332, 'bull_atr_max_pct': 0.12249208499956787, 'bull_tp_mult': 1.4682590329609115, 'bull_tsl_mult': 0.4010864313159528, 'bull_time_stop': 70, 'bull_use_sma': True, 'bull_use_ema': True, 'bull_use_atr': False, 'bull_use_adx': True, 'bull_use_spike': True, 'bull_rsi_required': True, 'bear_strategy': 'breakout', 'bear_bb_std_mult': 0.5390997417487389, 'bear_rsi_os': 10, 'bear_rsi_ob': 73, 'bear_adx_thresh': 34.2972428212605, 'bear_atr_min_pct': 0.020302781479319375, 'bear_atr_max_pct': 0.017879135443593777, 'bear_tp_mult': 2.600273571207553, 'bear_tsl_mult': 0.2382508581043748, 'bear_time_stop': 281, 'bear_use_sma': False, 'bear_use_ema': False, 'bear_use_atr': True, 'bear_use_adx': True, 'bear_use_spike': True, 'bear_rsi_required': True, 'sideways_strategy': 'breakout', 'sideways_bb_std_mult': 0.5249057722667316, 'sideways_rsi_os': 40, 'sideways_rsi_ob': 54, 'sideways_adx_thresh': 15.039723311262778, 'sideways_atr_min_pct': 0.00017850396250476686, 'sideways_atr_max_pct': 0.09658916419717523, 'sideways_tp_mult': 2.3419702872266654, 'sideways_tsl_mult': 0.5129972649957917, 'sideways_time_stop': 297, 'sideways_use_sma': True, 'sideways_use_ema': True, 'sideways_use_atr': True, 'sideways_use_adx': True, 'sideways_use_spike': False, 'sideways_rsi_required': False}.
[I 2025-09-01 13:57:00,754] Trial 23 finished with values: [-0.015760802491321724, 0.015792044007671816] and parameters: {'p_sma': 40, 'p_std': 52, 'p_atr': 25, 'p_adx': 21, 'rsi_period': 61, 'ema1': 24, 'ema2': 42, 'slip_atr_k': 0.22178440858790135, 'slip_spread_k': 0.5561872460619446, 'spread_hl_frac': 0.015768721006106896, 'bb_std_mult': 2.436975327519892, 'rsi_os': 16, 'rsi_ob': 70, 'vol_spike': 0.05024542278624404, 'adx_thresh': 14.705716155273928, 'atr_min_pct': 0.008630289895128642, 'atr_max_pct': 0.1278541431980526, 'tp_mult': 1.8558479166497435, 'tsl_mult': 0.5044559195417997, 'strategy': 'mean_reversion', 'time_stop': 85, 'use_sma': False, 'use_atr': False, 'use_adx': True, 'use_ema': False, 'use_spike': False, 'rsi_required': True, 'edge_k': 0.9000088370280916, 'edge_cap': 0.8077568786498825, 'bull_strategy': 'mean_reversion', 'bull_bb_std_mult': 1.1322521765855025, 'bull_rsi_os': 32, 'bull_rsi_ob': 52, 'bull_adx_thresh': 15.219323093283396, 'bull_atr_min_pct': 0.0014897377898263186, 'bull_atr_max_pct': 0.1240250195852099, 'bull_tp_mult': 1.4249736092890055, 'bull_tsl_mult': 0.4160003103431865, 'bull_time_stop': 99, 'bull_use_sma': True, 'bull_use_ema': True, 'bull_use_atr': True, 'bull_use_adx': True, 'bull_use_spike': True, 'bull_rsi_required': True, 'bear_strategy': 'breakout', 'bear_bb_std_mult': 1.4452133256433872, 'bear_rsi_os': 13, 'bear_rsi_ob': 91, 'bear_adx_thresh': 13.479938205650475, 'bear_atr_min_pct': 0.017582103853521307, 'bear_atr_max_pct': 0.010579687308643893, 'bear_tp_mult': 2.677906913436561, 'bear_tsl_mult': 0.2502713047332445, 'bear_time_stop': 266, 'bear_use_sma': True, 'bear_use_ema': False, 'bear_use_atr': True, 'bear_use_adx': False, 'bear_use_spike': True, 'bear_rsi_required': True, 'sideways_strategy': 'breakout', 'sideways_bb_std_mult': 2.8790554941056943, 'sideways_rsi_os': 21, 'sideways_rsi_ob': 54, 'sideways_adx_thresh': 22.705112564939363, 'sideways_atr_min_pct': 0.0041100250325853595, 'sideways_atr_max_pct': 0.07958787101215939, 'sideways_tp_mult': 2.2026309326673155, 'sideways_tsl_mult': 0.5248202191945861, 'sideways_time_stop': 114, 'sideways_use_sma': True, 'sideways_use_ema': False, 'sideways_use_atr': True, 'sideways_use_adx': True, 'sideways_use_spike': False, 'sideways_rsi_required': False}.
[I 2025-09-01 13:57:01,525] Trial 25 finished with values: [-0.011475872429179801, 0.011238352856918883] and parameters: {'p_sma': 39, 'p_std': 51, 'p_atr': 25, 'p_adx': 21, 'rsi_period': 59, 'ema1': 19, 'ema2': 41, 'slip_atr_k': 0.2221253442405345, 'slip_spread_k': 0.387243827087239, 'spread_hl_frac': 0.021083337384215316, 'bb_std_mult': 2.3499057664196075, 'rsi_os': 17, 'rsi_ob': 67, 'vol_spike': 0.058549305777956445, 'adx_thresh': 22.40596656939177, 'atr_min_pct': 0.008412637670777365, 'atr_max_pct': 0.11951420871949651, 'tp_mult': 1.8486852481612852, 'tsl_mult': 0.2227474005872108, 'strategy': 'mean_reversion', 'time_stop': 152, 'use_sma': False, 'use_atr': False, 'use_adx': True, 'use_ema': False, 'use_spike': False, 'rsi_required': True, 'edge_k': 0.9289458775849769, 'edge_cap': 0.7991628396768025, 'bull_strategy': 'mean_reversion', 'bull_bb_std_mult': 1.099051478900803, 'bull_rsi_os': 32, 'bull_rsi_ob': 52, 'bull_adx_thresh': 9.178436005391847, 'bull_atr_min_pct': 0.00015995215712020106, 'bull_atr_max_pct': 0.12002383164750777, 'bull_tp_mult': 1.5054103933160763, 'bull_tsl_mult': 0.007529767670807375, 'bull_time_stop': 107, 'bull_use_sma': True, 'bull_use_ema': True, 'bull_use_atr': True, 'bull_use_adx': True, 'bull_use_spike': True, 'bull_rsi_required': True, 'bear_strategy': 'breakout', 'bear_bb_std_mult': 1.329971153873283, 'bear_rsi_os': 12, 'bear_rsi_ob': 90, 'bear_adx_thresh': 12.96207746007234, 'bear_atr_min_pct': 0.018490601196681968, 'bear_atr_max_pct': 0.011102141928343941, 'bear_tp_mult': 2.7644883443876176, 'bear_tsl_mult': 0.2881143651882083, 'bear_time_stop': 260, 'bear_use_sma': True, 'bear_use_ema': False, 'bear_use_atr': True, 'bear_use_adx': False, 'bear_use_spike': True, 'bear_rsi_required': True, 'sideways_strategy': 'breakout', 'sideways_bb_std_mult': 2.9805171403479402, 'sideways_rsi_os': 23, 'sideways_rsi_ob': 52, 'sideways_adx_thresh': 22.99487480476787, 'sideways_atr_min_pct': 0.009061423181327697, 'sideways_atr_max_pct': 0.07831397615502703, 'sideways_tp_mult': 2.2366634036221607, 'sideways_tsl_mult': 0.5378598162055918, 'sideways_time_stop': 123, 'sideways_use_sma': True, 'sideways_use_ema': False, 'sideways_use_atr': True, 'sideways_use_adx': True, 'sideways_use_spike': False, 'sideways_rsi_required': False}.
[I 2025-09-01 13:57:01,799] Trial 24 finished with values: [-0.0169840054078515, 0.016895207881451067] and parameters: {'p_sma': 22, 'p_std': 51, 'p_atr': 25, 'p_adx': 21, 'rsi_period': 58, 'ema1': 24, 'ema2': 39, 'slip_atr_k': 0.21865349546216506, 'slip_spread_k': 0.2051819221169639, 'spread_hl_frac': 0.015326887066438828, 'bb_std_mult': 2.3994051353741783, 'rsi_os': 17, 'rsi_ob': 68, 'vol_spike': 0.05668227610056201, 'adx_thresh': 14.835116794285184, 'atr_min_pct': 0.008516219908385343, 'atr_max_pct': 0.12151401840718151, 'tp_mult': 1.9062559429974235, 'tsl_mult': 0.21577665399190663, 'strategy': 'mean_reversion', 'time_stop': 84, 'use_sma': False, 'use_atr': False, 'use_adx': True, 'use_ema': False, 'use_spike': False, 'rsi_required': True, 'edge_k': 0.9961482352743829, 'edge_cap': 0.8075512639011446, 'bull_strategy': 'mean_reversion', 'bull_bb_std_mult': 1.0874187100607788, 'bull_rsi_os': 33, 'bull_rsi_ob': 53, 'bull_adx_thresh': 14.263551170098388, 'bull_atr_min_pct': 5.4425414616869356e-05, 'bull_atr_max_pct': 0.12082698964296043, 'bull_tp_mult': 1.516339860470588, 'bull_tsl_mult': 0.4465719464511067, 'bull_time_stop': 104, 'bull_use_sma': True, 'bull_use_ema': True, 'bull_use_atr': True, 'bull_use_adx': True, 'bull_use_spike': True, 'bull_rsi_required': True, 'bear_strategy': 'breakout', 'bear_bb_std_mult': 1.484031382732907, 'bear_rsi_os': 14, 'bear_rsi_ob': 77, 'bear_adx_thresh': 12.654956960968551, 'bear_atr_min_pct': 0.018002398421189992, 'bear_atr_max_pct': 0.016442405219225603, 'bear_tp_mult': 2.6070387105430424, 'bear_tsl_mult': 0.2580462592434235, 'bear_time_stop': 271, 'bear_use_sma': True, 'bear_use_ema': False, 'bear_use_atr': True, 'bear_use_adx': False, 'bear_use_spike': True, 'bear_rsi_required': True, 'sideways_strategy': 'breakout', 'sideways_bb_std_mult': 3.010288656557794, 'sideways_rsi_os': 23, 'sideways_rsi_ob': 54, 'sideways_adx_thresh': 22.8376095208444, 'sideways_atr_min_pct': 0.004750990321790034, 'sideways_atr_max_pct': 0.07995304429507476, 'sideways_tp_mult': 2.2778656262474595, 'sideways_tsl_mult': 0.5239727553624417, 'sideways_time_stop': 112, 'sideways_use_sma': True, 'sideways_use_ema': False, 'sideways_use_atr': True, 'sideways_use_adx': True, 'sideways_use_spike': False, 'sideways_rsi_required': False}.
[I 2025-09-01 13:57:01,993] Trial 22 finished with values: [-0.025468548608809427, 0.025514653882404623] and parameters: {'p_sma': 22, 'p_std': 29, 'p_atr': 25, 'p_adx': 29, 'rsi_period': 9, 'ema1': 25, 'ema2': 41, 'slip_atr_k': 0.1123135593600191, 'slip_spread_k': 0.5611270019453504, 'spread_hl_frac': 0.01511054913866852, 'bb_std_mult': 2.3983460140997224, 'rsi_os': 18, 'rsi_ob': 55, 'vol_spike': 0.044977358412573734, 'adx_thresh': 6.325347079972643, 'atr_min_pct': 0.007608288674499685, 'atr_max_pct': 0.04182481886008191, 'tp_mult': 2.0387293687834642, 'tsl_mult': 0.5780737426768038, 'strategy': 'mean_reversion', 'time_stop': 81, 'use_sma': True, 'use_atr': False, 'use_adx': True, 'use_ema': False, 'use_spike': True, 'rsi_required': True, 'edge_k': 1.4045656742019386, 'edge_cap': 0.3133669190795146, 'bull_strategy': 'mean_reversion', 'bull_bb_std_mult': 2.0917639814671873, 'bull_rsi_os': 33, 'bull_rsi_ob': 88, 'bull_adx_thresh': 16.540995335755735, 'bull_atr_min_pct': 5.5890816517967234e-05, 'bull_atr_max_pct': 0.011548815591617523, 'bull_tp_mult': 1.4470245149970276, 'bull_tsl_mult': 0.8240919010860165, 'bull_time_stop': 43, 'bull_use_sma': True, 'bull_use_ema': True, 'bull_use_atr': False, 'bull_use_adx': True, 'bull_use_spike': True, 'bull_rsi_required': True, 'bear_strategy': 'breakout', 'bear_bb_std_mult': 2.065122581036039, 'bear_rsi_os': 44, 'bear_rsi_ob': 68, 'bear_adx_thresh': 23.545756955113045, 'bear_atr_min_pct': 0.01908337262686415, 'bear_atr_max_pct': 0.011860785702220392, 'bear_tp_mult': 1.0111800495192718, 'bear_tsl_mult': 0.25308491976010516, 'bear_time_stop': 103, 'bear_use_sma': True, 'bear_use_ema': False, 'bear_use_atr': True, 'bear_use_adx': True, 'bear_use_spike': False, 'bear_rsi_required': False, 'sideways_strategy': 'breakout', 'sideways_bb_std_mult': 2.9596263046870526, 'sideways_rsi_os': 23, 'sideways_rsi_ob': 78, 'sideways_adx_thresh': 13.067355036174504, 'sideways_atr_min_pct': 0.008021229972658118, 'sideways_atr_max_pct': 0.11542477630105938, 'sideways_tp_mult': 1.5571380143372404, 'sideways_tsl_mult': 0.5089054212739419, 'sideways_time_stop': 123, 'sideways_use_sma': True, 'sideways_use_ema': False, 'sideways_use_atr': False, 'sideways_use_adx': True, 'sideways_use_spike': False, 'sideways_rsi_required': False}.
[I 2025-09-01 13:57:38,093] Trial 28 finished with values: [-1000000000.0, 1000000000.0] and parameters: {'p_sma': 21, 'p_std': 51, 'p_atr': 25, 'p_adx': 20, 'rsi_period': 40, 'ema1': 15, 'ema2': 40, 'slip_atr_k': 0.21676590200496107, 'slip_spread_k': 0.553549998403337, 'spread_hl_frac': 0.02145272598817407, 'bb_std_mult': 2.3499257713087944, 'rsi_os': 12, 'rsi_ob': 59, 'vol_spike': 0.13332005794497082, 'adx_thresh': 21.860101429309292, 'atr_min_pct': 0.011445786513400944, 'atr_max_pct': 0.0846059132203402, 'tp_mult': 1.6656544799533575, 'tsl_mult': 0.5067727162063902, 'strategy': 'mean_reversion', 'time_stop': 158, 'use_sma': False, 'use_atr': False, 'use_adx': True, 'use_ema': False, 'use_spike': False, 'rsi_required': True, 'edge_k': 0.9862936381809945, 'edge_cap': 0.8051434275104437, 'bull_strategy': 'mean_reversion', 'bull_bb_std_mult': 0.9479538723617147, 'bull_rsi_os': 32, 'bull_rsi_ob': 51, 'bull_adx_thresh': 9.387349019907814, 'bull_atr_min_pct': 0.006247903836968156, 'bull_atr_max_pct': 0.08194132964028515, 'bull_tp_mult': 1.686092869596525, 'bull_tsl_mult': 0.17439339376067192, 'bull_time_stop': 117, 'bull_use_sma': True, 'bull_use_ema': True, 'bull_use_atr': True, 'bull_use_adx': True, 'bull_use_spike': True, 'bull_rsi_required': True, 'bear_strategy': 'breakout', 'bear_bb_std_mult': 1.5547684914320032, 'bear_rsi_os': 12, 'bear_rsi_ob': 89, 'bear_adx_thresh': 5.8210703886370645, 'bear_atr_min_pct': 0.017178034772120418, 'bear_atr_max_pct': 0.03809397973199873, 'bear_tp_mult': 2.8287619644870614, 'bear_tsl_mult': 0.018909595191067385, 'bear_time_stop': 257, 'bear_use_sma': True, 'bear_use_ema': False, 'bear_use_atr': True, 'bear_use_adx': False, 'bear_use_spike': True, 'bear_rsi_required': True, 'sideways_strategy': 'breakout', 'sideways_bb_std_mult': 3.101140475244888, 'sideways_rsi_os': 22, 'sideways_rsi_ob': 49, 'sideways_adx_thresh': 20.43185266125184, 'sideways_atr_min_pct': 0.009518083752671765, 'sideways_atr_max_pct': 0.07283889290915413, 'sideways_tp_mult': 2.7050440527459982, 'sideways_tsl_mult': 0.6097632857620593, 'sideways_time_stop': 120, 'sideways_use_sma': True, 'sideways_use_ema': False, 'sideways_use_atr': True, 'sideways_use_adx': True, 'sideways_use_spike': False, 'sideways_rsi_required': False}.
