[I 2025-09-01 14:51:04,989] Trial 381 finished with values: [-1000000000.0, 1000000000.0] and parameters: {'p_sma': 12, 'p_std': 30, 'p_atr': 22, 'p_adx': 22, 'rsi_period': 68, 'ema1': 30, 'ema2': 56, 'slip_atr_k': 0.07044747549217129, 'slip_spread_k': 0.25362854359048037, 'spread_hl_frac': 0.04281071507726232, 'bb_std_mult': 1.5605957634119887, 'rsi_os': 35, 'rsi_ob': 47, 'vol_spike': 0.21177272024485866, 'adx_thresh': 32.676350618490346, 'atr_min_pct': 0.013967075650103807, 'atr_max_pct': 0.07929086738838793, 'tp_mult': 2.883152773417257, 'tsl_mult': 0.056379464309216365, 'strategy': 'breakout', 'time_stop': 57, 'use_sma': False, 'use_atr': True, 'use_adx': True, 'use_ema': False, 'use_spike': False, 'rsi_required': False, 'edge_k': 0.3495543621744982, 'edge_cap': 0.5155693686240097, 'bull_strategy': 'breakout', 'bull_bb_std_mult': 0.7881385709071014, 'bull_rsi_os': 14, 'bull_rsi_ob': 48, 'bull_adx_thresh': 10.147784173784357, 'bull_atr_min_pct': 0.004932815924359698, 'bull_atr_max_pct': 0.019366780135933646, 'bull_tp_mult': 1.6464962905836151, 'bull_tsl_mult': 0.30494700058139135, 'bull_time_stop': 170, 'bull_use_sma': True, 'bull_use_ema': False, 'bull_use_atr': False, 'bull_use_adx': False, 'bull_use_spike': False, 'bull_rsi_required': True, 'bear_strategy': 'breakout', 'bear_bb_std_mult': 2.0267272873561617, 'bear_rsi_os': 49, 'bear_rsi_ob': 75, 'bear_adx_thresh': 19.59594803589373, 'bear_atr_min_pct': 0.023905442506573678, 'bear_atr_max_pct': 0.11210047512875622, 'bear_tp_mult': 1.7988249475456988, 'bear_tsl_mult': 0.6100478653334557, 'bear_time_stop': 297, 'bear_use_sma': True, 'bear_use_ema': False, 'bear_use_atr': False, 'bear_use_adx': True, 'bear_use_spike': False, 'bear_rsi_required': True, 'sideways_strategy': 'mean_reversion', 'sideways_bb_std_mult': 3.342258051477499, 'sideways_rsi_os': 45, 'sideways_rsi_ob': 69, 'sideways_adx_thresh': 5.639256804281187, 'sideways_atr_min_pct': 0.005860782694215633, 'sideways_atr_max_pct': 0.13959673413055976, 'sideways_tp_mult': 1.7735140354936147, 'sideways_tsl_mult': 0.27221429939755404, 'sideways_time_stop': 97, 'sideways_use_sma': False, 'sideways_use_ema': False, 'sideways_use_atr': False, 'sideways_use_adx': False, 'sideways_use_spike': False, 'sideways_rsi_required': True}.
[I 2025-09-01 14:51:06,449] Trial 380 finished with values: [-1000000000.0, 1000000000.0] and parameters: {'p_sma': 42, 'p_std': 9, 'p_atr': 22, 'p_adx': 27, 'rsi_period': 79, 'ema1': 30, 'ema2': 10, 'slip_atr_k': 0.05669256699116966, 'slip_spread_k': 0.24277881096602016, 'spread_hl_frac': 0.01756415836286213, 'bb_std_mult': 1.5712094713686378, 'rsi_os': 34, 'rsi_ob': 63, 'vol_spike': 0.28841698699966445, 'adx_thresh': 21.18437725910469, 'atr_min_pct': 0.015455919018175546, 'atr_max_pct': 0.07313711662753229, 'tp_mult': 2.925560477730765, 'tsl_mult': 0.0564008741004839, 'strategy': 'breakout', 'time_stop': 61, 'use_sma': False, 'use_atr': True, 'use_adx': True, 'use_ema': False, 'use_spike': False, 'rsi_required': False, 'edge_k': 1.633996149703453, 'edge_cap': 0.8868393974858957, 'bull_strategy': 'breakout', 'bull_bb_std_mult': 3.0653557316523665, 'bull_rsi_os': 19, 'bull_rsi_ob': 46, 'bull_adx_thresh': 12.57634159634399, 'bull_atr_min_pct': 0.005877095049576453, 'bull_atr_max_pct': 0.01770652406444089, 'bull_tp_mult': 1.9845839649070054, 'bull_tsl_mult': 0.3966905710920454, 'bull_time_stop': 170, 'bull_use_sma': True, 'bull_use_ema': False, 'bull_use_atr': False, 'bull_use_adx': False, 'bull_use_spike': False, 'bull_rsi_required': True, 'bear_strategy': 'breakout', 'bear_bb_std_mult': 2.0934752927805156, 'bear_rsi_os': 10, 'bear_rsi_ob': 53, 'bear_adx_thresh': 24.364940660900146, 'bear_atr_min_pct': 0.023829634176991726, 'bear_atr_max_pct': 0.11175783241732622, 'bear_tp_mult': 2.37958447607901, 'bear_tsl_mult': 0.6065081476384175, 'bear_time_stop': 179, 'bear_use_sma': True, 'bear_use_ema': False, 'bear_use_atr': False, 'bear_use_adx': True, 'bear_use_spike': False, 'bear_rsi_required': True, 'sideways_strategy': 'mean_reversion', 'sideways_bb_std_mult': 1.5708287838575012, 'sideways_rsi_os': 14, 'sideways_rsi_ob': 87, 'sideways_adx_thresh': 5.099956000111353, 'sideways_atr_min_pct': 0.029886307703458646, 'sideways_atr_max_pct': 0.1406307974077251, 'sideways_tp_mult': 1.8536527572642956, 'sideways_tsl_mult': 0.3950053724702286, 'sideways_time_stop': 148, 'sideways_use_sma': False, 'sideways_use_ema': True, 'sideways_use_atr': False, 'sideways_use_adx': False, 'sideways_use_spike': False, 'sideways_rsi_required': True}.
[I 2025-09-01 14:51:07,603] Trial 377 finished with values: [-1000000000.0, 1000000000.0] and parameters: {'p_sma': 42, 'p_std': 5, 'p_atr': 23, 'p_adx': 28, 'rsi_period': 64, 'ema1': 29, 'ema2': 47, 'slip_atr_k': 0.0460355604278386, 'slip_spread_k': 0.05217217794703116, 'spread_hl_frac': 0.014669735459339722, 'bb_std_mult': 1.6021020436788265, 'rsi_os': 35, 'rsi_ob': 73, 'vol_spike': 0.28989363215210523, 'adx_thresh': 19.47464698162307, 'atr_min_pct': 0.01652399067882215, 'atr_max_pct': 0.07211899053336576, 'tp_mult': 2.707047210908523, 'tsl_mult': 0.7456433877986969, 'strategy': 'breakout', 'time_stop': 29, 'use_sma': False, 'use_atr': True, 'use_adx': False, 'use_ema': True, 'use_spike': False, 'rsi_required': False, 'edge_k': 0.6252869476670574, 'edge_cap': 0.4279803959607471, 'bull_strategy': 'mean_reversion', 'bull_bb_std_mult': 2.4355172962219864, 'bull_rsi_os': 19, 'bull_rsi_ob': 48, 'bull_adx_thresh': 10.067456048635345, 'bull_atr_min_pct': 0.00479801891527816, 'bull_atr_max_pct': 0.021946304941397304, 'bull_tp_mult': 2.5276051312030705, 'bull_tsl_mult': 0.3317252972861775, 'bull_time_stop': 181, 'bull_use_sma': False, 'bull_use_ema': True, 'bull_use_atr': False, 'bull_use_adx': False, 'bull_use_spike': True, 'bull_rsi_required': False, 'bear_strategy': 'mean_reversion', 'bear_bb_std_mult': 2.112370457973971, 'bear_rsi_os': 9, 'bear_rsi_ob': 55, 'bear_adx_thresh': 28.162036667887417, 'bear_atr_min_pct': 0.024376967793736756, 'bear_atr_max_pct': 0.13457890861961766, 'bear_tp_mult': 2.5408820981557554, 'bear_tsl_mult': 0.6069900078952651, 'bear_time_stop': 194, 'bear_use_sma': True, 'bear_use_ema': True, 'bear_use_atr': False, 'bear_use_adx': True, 'bear_use_spike': False, 'bear_rsi_required': False, 'sideways_strategy': 'mean_reversion', 'sideways_bb_std_mult': 3.4400864016320116, 'sideways_rsi_os': 15, 'sideways_rsi_ob': 93, 'sideways_adx_thresh': 6.701214858910765, 'sideways_atr_min_pct': 0.0009890611808098405, 'sideways_atr_max_pct': 0.14489531020687008, 'sideways_tp_mult': 1.8181128100520132, 'sideways_tsl_mult': 0.25366699554494404, 'sideways_time_stop': 130, 'sideways_use_sma': False, 'sideways_use_ema': True, 'sideways_use_atr': False, 'sideways_use_adx': False, 'sideways_use_spike': True, 'sideways_rsi_required': True}.
[I 2025-09-01 14:51:07,984] Trial 378 finished with values: [-1000000000.0, 1000000000.0] and parameters: {'p_sma': 42, 'p_std': 5, 'p_atr': 19, 'p_adx': 28, 'rsi_period': 78, 'ema1': 30, 'ema2': 55, 'slip_atr_k': 0.010788369692141794, 'slip_spread_k': 0.4442487608025597, 'spread_hl_frac': 0.013966131883226832, 'bb_std_mult': 1.58944980654275, 'rsi_os': 35, 'rsi_ob': 73, 'vol_spike': 0.29986587991539054, 'adx_thresh': 28.804447289897073, 'atr_min_pct': 0.0053665569551891446, 'atr_max_pct': 0.08406839305937684, 'tp_mult': 1.7230277420244717, 'tsl_mult': 0.7463776110253286, 'strategy': 'breakout', 'time_stop': 62, 'use_sma': False, 'use_atr': True, 'use_adx': False, 'use_ema': True, 'use_spike': False, 'rsi_required': False, 'edge_k': 0.35839015316008505, 'edge_cap': 0.6254005901523606, 'bull_strategy': 'breakout', 'bull_bb_std_mult': 3.0246437486065623, 'bull_rsi_os': 19, 'bull_rsi_ob': 46, 'bull_adx_thresh': 9.84249911811137, 'bull_atr_min_pct': 0.005861638364135099, 'bull_atr_max_pct': 0.03659521511515953, 'bull_tp_mult': 1.6327177168762685, 'bull_tsl_mult': 0.40905112153207274, 'bull_time_stop': 26, 'bull_use_sma': False, 'bull_use_ema': True, 'bull_use_atr': False, 'bull_use_adx': False, 'bull_use_spike': False, 'bull_rsi_required': False, 'bear_strategy': 'mean_reversion', 'bear_bb_std_mult': 2.0327973589681507, 'bear_rsi_os': 30, 'bear_rsi_ob': 85, 'bear_adx_thresh': 23.325021753699446, 'bear_atr_min_pct': 0.024137363274006434, 'bear_atr_max_pct': 0.032948785514838756, 'bear_tp_mult': 1.0562628215445427, 'bear_tsl_mult': 0.5971946649851406, 'bear_time_stop': 284, 'bear_use_sma': True, 'bear_use_ema': True, 'bear_use_atr': False, 'bear_use_adx': True, 'bear_use_spike': False, 'bear_rsi_required': False, 'sideways_strategy': 'mean_reversion', 'sideways_bb_std_mult': 3.4435773483584895, 'sideways_rsi_os': 41, 'sideways_rsi_ob': 88, 'sideways_adx_thresh': 5.141938754353692, 'sideways_atr_min_pct': 0.011257372141732051, 'sideways_atr_max_pct': 0.0536287497742588, 'sideways_tp_mult': 1.8614632053510987, 'sideways_tsl_mult': 0.2455052876395648, 'sideways_time_stop': 185, 'sideways_use_sma': False, 'sideways_use_ema': True, 'sideways_use_atr': False, 'sideways_use_adx': False, 'sideways_use_spike': True, 'sideways_rsi_required': True}.
[I 2025-09-01 14:51:44,162] Trial 385 finished with values: [-0.038131683797792526, 0.03818561638895299] and parameters: {'p_sma': 26, 'p_std': 16, 'p_atr': 30, 'p_adx': 29, 'rsi_period': 35, 'ema1': 30, 'ema2': 53, 'slip_atr_k': 0.14056099147072076, 'slip_spread_k': 0.19275401892462474, 'spread_hl_frac': 0.004311533598846649, 'bb_std_mult': 1.4414638216838087, 'rsi_os': 37, 'rsi_ob': 74, 'vol_spike': 0.27702143620967706, 'adx_thresh': 6.857453026709594, 'atr_min_pct': 0.001489804443524369, 'atr_max_pct': 0.06403395587803083, 'tp_mult': 2.8196556627287594, 'tsl_mult': 0.08098482494496953, 'strategy': 'mean_reversion', 'time_stop': 73, 'use_sma': True, 'use_atr': True, 'use_adx': True, 'use_ema': False, 'use_spike': True, 'rsi_required': False, 'edge_k': 0.4847797765156228, 'edge_cap': 0.06634697522418054, 'bull_strategy': 'breakout', 'bull_bb_std_mult': 2.7591280152828643, 'bull_rsi_os': 13, 'bull_rsi_ob': 76, 'bull_adx_thresh': 27.164767849174495, 'bull_atr_min_pct': 0.0006837732749098123, 'bull_atr_max_pct': 0.01793822223511289, 'bull_tp_mult': 2.105946916921171, 'bull_tsl_mult': 0.7149663148949481, 'bull_time_stop': 164, 'bull_use_sma': True, 'bull_use_ema': False, 'bull_use_atr': False, 'bull_use_adx': True, 'bull_use_spike': False, 'bull_rsi_required': True, 'bear_strategy': 'mean_reversion', 'bear_bb_std_mult': 3.5065770204178612, 'bear_rsi_os': 6, 'bear_rsi_ob': 67, 'bear_adx_thresh': 28.77897567596628, 'bear_atr_min_pct': 0.022907521730787504, 'bear_atr_max_pct': 0.10853335667343049, 'bear_tp_mult': 2.4686028572348735, 'bear_tsl_mult': 0.6886062836344988, 'bear_time_stop': 277, 'bear_use_sma': False, 'bear_use_ema': False, 'bear_use_atr': False, 'bear_use_adx': False, 'bear_use_spike': False, 'bear_rsi_required': False, 'sideways_strategy': 'mean_reversion', 'sideways_bb_std_mult': 1.4544150603789259, 'sideways_rsi_os': 17, 'sideways_rsi_ob': 90, 'sideways_adx_thresh': 20.15691536937196, 'sideways_atr_min_pct': 0.005596218055121876, 'sideways_atr_max_pct': 0.1353927634421653, 'sideways_tp_mult': 1.7912891659328012, 'sideways_tsl_mult': 0.2792297042328921, 'sideways_time_stop': 41, 'sideways_use_sma': False, 'sideways_use_ema': False, 'sideways_use_atr': True, 'sideways_use_adx': True, 'sideways_use_spike': True, 'sideways_rsi_required': False}.
[I 2025-09-01 14:51:44,762] Trial 383 finished with values: [-0.05872804198663384, 0.05859778464597936] and parameters: {'p_sma': 51, 'p_std': 11, 'p_atr': 18, 'p_adx': 23, 'rsi_period': 16, 'ema1': 6, 'ema2': 14, 'slip_atr_k': 0.1049897833150495, 'slip_spread_k': 0.19375169786972785, 'spread_hl_frac': 0.015520933399446726, 'bb_std_mult': 1.471449851362862, 'rsi_os': 40, 'rsi_ob': 74, 'vol_spike': 0.27667397741367067, 'adx_thresh': 20.409400083798417, 'atr_min_pct': 0.017606609113397106, 'atr_max_pct': 0.0688448449817103, 'tp_mult': 2.8097207901166605, 'tsl_mult': 0.08963319172442448, 'strategy': 'mean_reversion', 'time_stop': 126, 'use_sma': True, 'use_atr': True, 'use_adx': True, 'use_ema': False, 'use_spike': True, 'rsi_required': False, 'edge_k': 0.4929807195172662, 'edge_cap': 0.38584944915236286, 'bull_strategy': 'breakout', 'bull_bb_std_mult': 1.822398680263688, 'bull_rsi_os': 18, 'bull_rsi_ob': 49, 'bull_adx_thresh': 27.570110183697263, 'bull_atr_min_pct': 0.0008558378451523608, 'bull_atr_max_pct': 0.03522479855375328, 'bull_tp_mult': 1.9107875102685743, 'bull_tsl_mult': 0.3462260806935935, 'bull_time_stop': 159, 'bull_use_sma': True, 'bull_use_ema': False, 'bull_use_atr': False, 'bull_use_adx': True, 'bull_use_spike': False, 'bull_rsi_required': True, 'bear_strategy': 'mean_reversion', 'bear_bb_std_mult': 2.5313352849553166, 'bear_rsi_os': 26, 'bear_rsi_ob': 55, 'bear_adx_thresh': 17.37877876257003, 'bear_atr_min_pct': 0.024428032451273517, 'bear_atr_max_pct': 0.1090853138030147, 'bear_tp_mult': 2.464398316775866, 'bear_tsl_mult': 0.6914762796380544, 'bear_time_stop': 213, 'bear_use_sma': False, 'bear_use_ema': False, 'bear_use_atr': False, 'bear_use_adx': True, 'bear_use_spike': False, 'bear_rsi_required': False, 'sideways_strategy': 'mean_reversion', 'sideways_bb_std_mult': 2.7299969878826245, 'sideways_rsi_os': 17, 'sideways_rsi_ob': 88, 'sideways_adx_thresh': 26.311250726152792, 'sideways_atr_min_pct': 0.022436113879633957, 'sideways_atr_max_pct': 0.13603592483464594, 'sideways_tp_mult': 1.8014425650721904, 'sideways_tsl_mult': 0.2439509382416359, 'sideways_time_stop': 43, 'sideways_use_sma': False, 'sideways_use_ema': False, 'sideways_use_atr': True, 'sideways_use_adx': True, 'sideways_use_spike': True, 'sideways_rsi_required': False}.
[I 2025-09-01 14:51:45,001] Trial 382 finished with values: [-1000000000.0, 1000000000.0] and parameters: {'p_sma': 56, 'p_std': 11, 'p_atr': 20, 'p_adx': 27, 'rsi_period': 16, 'ema1': 30, 'ema2': 10, 'slip_atr_k': 0.10574297038265963, 'slip_spread_k': 0.24381948462964134, 'spread_hl_frac': 0.017508671485193184, 'bb_std_mult': 1.471943322803142, 'rsi_os': 34, 'rsi_ob': 63, 'vol_spike': 0.276604428011471, 'adx_thresh': 21.34048063530551, 'atr_min_pct': 0.001638617718902887, 'atr_max_pct': 0.08342961980675653, 'tp_mult': 2.7184201339235914, 'tsl_mult': 0.5987014027330814, 'strategy': 'breakout', 'time_stop': 28, 'use_sma': False, 'use_atr': True, 'use_adx': True, 'use_ema': False, 'use_spike': True, 'rsi_required': False, 'edge_k': 0.49479218083741816, 'edge_cap': 0.06836555792519863, 'bull_strategy': 'breakout', 'bull_bb_std_mult': 2.997439271793811, 'bull_rsi_os': 18, 'bull_rsi_ob': 69, 'bull_adx_thresh': 14.040994483652078, 'bull_atr_min_pct': 0.027023929234697902, 'bull_atr_max_pct': 0.01735224863239951, 'bull_tp_mult': 2.6270704489180323, 'bull_tsl_mult': 0.3469539876890518, 'bull_time_stop': 281, 'bull_use_sma': True, 'bull_use_ema': False, 'bull_use_atr': False, 'bull_use_adx': True, 'bull_use_spike': False, 'bull_rsi_required': True, 'bear_strategy': 'mean_reversion', 'bear_bb_std_mult': 2.5711054849439705, 'bear_rsi_os': 30, 'bear_rsi_ob': 64, 'bear_adx_thresh': 6.31243745545771, 'bear_atr_min_pct': 0.02434276749966144, 'bear_atr_max_pct': 0.06710940360167067, 'bear_tp_mult': 2.1464727453330594, 'bear_tsl_mult': 0.6807210245826417, 'bear_time_stop': 212, 'bear_use_sma': False, 'bear_use_ema': False, 'bear_use_atr': False, 'bear_use_adx': True, 'bear_use_spike': False, 'bear_rsi_required': False, 'sideways_strategy': 'mean_reversion', 'sideways_bb_std_mult': 2.083604281484367, 'sideways_rsi_os': 13, 'sideways_rsi_ob': 90, 'sideways_adx_thresh': 26.78262129345366, 'sideways_atr_min_pct': 0.011173361566893926, 'sideways_atr_max_pct': 0.13589203649824588, 'sideways_tp_mult': 1.8457625458850155, 'sideways_tsl_mult': 0.27980870485598985, 'sideways_time_stop': 129, 'sideways_use_sma': False, 'sideways_use_ema': False, 'sideways_use_atr': True, 'sideways_use_adx': False, 'sideways_use_spike': True, 'sideways_rsi_required': True}.
[I 2025-09-01 14:51:45,549] Trial 384 finished with values: [-1000000000.0, 1000000000.0] and parameters: {'p_sma': 26, 'p_std': 13, 'p_atr': 18, 'p_adx': 23, 'rsi_period': 73, 'ema1': 27, 'ema2': 53, 'slip_atr_k': 0.23568789602407975, 'slip_spread_k': 0.2362062135124066, 'spread_hl_frac': 0.015816331707536446, 'bb_std_mult': 1.4679538042914408, 'rsi_os': 37, 'rsi_ob': 95, 'vol_spike': 0.1964991796872953, 'adx_thresh': 14.309493137865827, 'atr_min_pct': 0.017444628923476955, 'atr_max_pct': 0.06563236458976836, 'tp_mult': 1.9226597405248047, 'tsl_mult': 0.09465038196178245, 'strategy': 'mean_reversion', 'time_stop': 73, 'use_sma': True, 'use_atr': True, 'use_adx': True, 'use_ema': False, 'use_spike': True, 'rsi_required': False, 'edge_k': 0.4836972035628526, 'edge_cap': 0.9815460338113025, 'bull_strategy': 'breakout', 'bull_bb_std_mult': 2.8434012326257254, 'bull_rsi_os': 7, 'bull_rsi_ob': 50, 'bull_adx_thresh': 19.851568771421185, 'bull_atr_min_pct': 0.006828290236061683, 'bull_atr_max_pct': 0.018384827895211855, 'bull_tp_mult': 2.121133802883277, 'bull_tsl_mult': 0.35035008210050417, 'bull_time_stop': 164, 'bull_use_sma': True, 'bull_use_ema': False, 'bull_use_atr': False, 'bull_use_adx': True, 'bull_use_spike': False, 'bull_rsi_required': True, 'bear_strategy': 'mean_reversion', 'bear_bb_std_mult': 1.4216511335289646, 'bear_rsi_os': 6, 'bear_rsi_ob': 67, 'bear_adx_thresh': 32.06233432967142, 'bear_atr_min_pct': 0.02695369692200442, 'bear_atr_max_pct': 0.12153269447721483, 'bear_tp_mult': 2.4777369578387094, 'bear_tsl_mult': 0.6854975321518718, 'bear_time_stop': 277, 'bear_use_sma': False, 'bear_use_ema': False, 'bear_use_atr': False, 'bear_use_adx': False, 'bear_use_spike': False, 'bear_rsi_required': False, 'sideways_strategy': 'mean_reversion', 'sideways_bb_std_mult': 2.656875303076878, 'sideways_rsi_os': 30, 'sideways_rsi_ob': 81, 'sideways_adx_thresh': 26.53022888978329, 'sideways_atr_min_pct': 0.015771187866949043, 'sideways_atr_max_pct': 0.13516973048487713, 'sideways_tp_mult': 1.788636942402636, 'sideways_tsl_mult': 0.17687780256937508, 'sideways_time_stop': 45, 'sideways_use_sma': False, 'sideways_use_ema': False, 'sideways_use_atr': True, 'sideways_use_adx': True, 'sideways_use_spike': True, 'sideways_rsi_required': False}.
[I 2025-09-01 14:52:23,772] Trial 387 finished with values: [-1000000000.0, 1000000000.0] and parameters: {'p_sma': 58, 'p_std': 13, 'p_atr': 15, 'p_adx': 21, 'rsi_period': 66, 'ema1': 29, 'ema2': 18, 'slip_atr_k': 0.1676093907713193, 'slip_spread_k': 0.6842818404008677, 'spread_hl_frac': 0.04984342493828843, 'bb_std_mult': 0.6115234843785888, 'rsi_os': 39, 'rsi_ob': 95, 'vol_spike': 0.29994434957456456, 'adx_thresh': 29.94419887248648, 'atr_min_pct': 0.022458491624286727, 'atr_max_pct': 0.07484874185769987, 'tp_mult': 2.217459436214894, 'tsl_mult': 0.0237515725663186, 'strategy': 'breakout', 'time_stop': 47, 'use_sma': False, 'use_atr': False, 'use_adx': True, 'use_ema': False, 'use_spike': True, 'rsi_required': True, 'edge_k': 0.5280213303281135, 'edge_cap': 0.10791417234191206, 'bull_strategy': 'breakout', 'bull_bb_std_mult': 0.6066127439129527, 'bull_rsi_os': 49, 'bull_rsi_ob': 50, 'bull_adx_thresh': 11.467325119372944, 'bull_atr_min_pct': 0.006942863816285307, 'bull_atr_max_pct': 0.07197882901071384, 'bull_tp_mult': 2.131110553457123, 'bull_tsl_mult': 0.37933844209580736, 'bull_time_stop': 267, 'bull_use_sma': True, 'bull_use_ema': False, 'bull_use_atr': True, 'bull_use_adx': True, 'bull_use_spike': False, 'bull_rsi_required': True, 'bear_strategy': 'breakout', 'bear_bb_std_mult': 2.2938213800481133, 'bear_rsi_os': 12, 'bear_rsi_ob': 78, 'bear_adx_thresh': 26.63868196479876, 'bear_atr_min_pct': 0.0022787261808085105, 'bear_atr_max_pct': 0.12224570292150569, 'bear_tp_mult': 1.165355944830156, 'bear_tsl_mult': 0.5741693682257369, 'bear_time_stop': 113, 'bear_use_sma': False, 'bear_use_ema': False, 'bear_use_atr': True, 'bear_use_adx': True, 'bear_use_spike': True, 'bear_rsi_required': True, 'sideways_strategy': 'breakout', 'sideways_bb_std_mult': 3.2301442199572294, 'sideways_rsi_os': 20, 'sideways_rsi_ob': 92, 'sideways_adx_thresh': 8.452809755698123, 'sideways_atr_min_pct': 0.015132466598944376, 'sideways_atr_max_pct': 0.07026387553520862, 'sideways_tp_mult': 1.770859044410888, 'sideways_tsl_mult': 0.20637118092005133, 'sideways_time_stop': 112, 'sideways_use_sma': True, 'sideways_use_ema': False, 'sideways_use_atr': True, 'sideways_use_adx': False, 'sideways_use_spike': False, 'sideways_rsi_required': True}.
