[I 2025-09-01 14:28:47,781] Trial 233 finished with values: [-1000000000.0, 1000000000.0] and parameters: {'p_sma': 8, 'p_std': 24, 'p_atr': 21, 'p_adx': 13, 'rsi_period': 68, 'ema1': 30, 'ema2': 29, 'slip_atr_k': 0.07680943309274312, 'slip_spread_k': 0.6369621352716867, 'spread_hl_frac': 0.03972642876501323, 'bb_std_mult': 1.108133077692509, 'rsi_os': 53, 'rsi_ob': 50, 'vol_spike': 0.28086904233171167, 'adx_thresh': 18.915197961761287, 'atr_min_pct': 0.015488842215382909, 'atr_max_pct': 0.07905730270101431, 'tp_mult': 2.9226075994179754, 'tsl_mult': 0.8885746889164785, 'strategy': 'breakout', 'time_stop': 68, 'use_sma': True, 'use_atr': True, 'use_adx': True, 'use_ema': True, 'use_spike': True, 'rsi_required': False, 'edge_k': 1.6784379539782652, 'edge_cap': 0.20568942450878386, 'bull_strategy': 'breakout', 'bull_bb_std_mult': 2.9336939254895693, 'bull_rsi_os': 20, 'bull_rsi_ob': 85, 'bull_adx_thresh': 17.71701021512233, 'bull_atr_min_pct': 0.015082575601600815, 'bull_atr_max_pct': 0.05569906635235277, 'bull_tp_mult': 1.2559171498391732, 'bull_tsl_mult': 0.6671976919058744, 'bull_time_stop': 165, 'bull_use_sma': False, 'bull_use_ema': False, 'bull_use_atr': False, 'bull_use_adx': False, 'bull_use_spike': False, 'bull_rsi_required': True, 'bear_strategy': 'mean_reversion', 'bear_bb_std_mult': 2.916617791345917, 'bear_rsi_os': 44, 'bear_rsi_ob': 48, 'bear_adx_thresh': 29.097325702032816, 'bear_atr_min_pct': 0.02553050512031582, 'bear_atr_max_pct': 0.12054693106981412, 'bear_tp_mult': 1.0154781631264516, 'bear_tsl_mult': 0.44716995977587604, 'bear_time_stop': 18, 'bear_use_sma': False, 'bear_use_ema': True, 'bear_use_atr': False, 'bear_use_adx': True, 'bear_use_spike': False, 'bear_rsi_required': False, 'sideways_strategy': 'mean_reversion', 'sideways_bb_std_mult': 1.6329623489747833, 'sideways_rsi_os': 18, 'sideways_rsi_ob': 64, 'sideways_adx_thresh': 28.56065535482213, 'sideways_atr_min_pct': 0.004002913247259094, 'sideways_atr_max_pct': 0.01513072591018319, 'sideways_tp_mult': 1.8750589275426646, 'sideways_tsl_mult': 0.28337905396309504, 'sideways_time_stop': 157, 'sideways_use_sma': False, 'sideways_use_ema': True, 'sideways_use_atr': False, 'sideways_use_adx': False, 'sideways_use_spike': True, 'sideways_rsi_required': True}.
[I 2025-09-01 14:29:26,611] Trial 238 finished with values: [-1000000000.0, 1000000000.0] and parameters: {'p_sma': 14, 'p_std': 12, 'p_atr': 19, 'p_adx': 17, 'rsi_period': 41, 'ema1': 29, 'ema2': 54, 'slip_atr_k': 0.05242755426844428, 'slip_spread_k': 0.236339532820761, 'spread_hl_frac': 0.0027496660262130296, 'bb_std_mult': 1.5153356556287607, 'rsi_os': 36, 'rsi_ob': 80, 'vol_spike': 0.1280215183949763, 'adx_thresh': 20.093369378718247, 'atr_min_pct': 0.016695037943745328, 'atr_max_pct': 0.07795843321388086, 'tp_mult': 2.818725817447026, 'tsl_mult': 0.661721603596736, 'strategy': 'breakout', 'time_stop': 81, 'use_sma': False, 'use_atr': True, 'use_adx': True, 'use_ema': False, 'use_spike': True, 'rsi_required': False, 'edge_k': 0.5505395652337849, 'edge_cap': 0.6589181843755376, 'bull_strategy': 'breakout', 'bull_bb_std_mult': 1.6870071480088908, 'bull_rsi_os': 18, 'bull_rsi_ob': 49, 'bull_adx_thresh': 9.811943091732791, 'bull_atr_min_pct': 0.018461889873558856, 'bull_atr_max_pct': 0.1366520803972128, 'bull_tp_mult': 2.065739985420163, 'bull_tsl_mult': 0.3623492754952936, 'bull_time_stop': 277, 'bull_use_sma': True, 'bull_use_ema': False, 'bull_use_atr': False, 'bull_use_adx': True, 'bull_use_spike': False, 'bull_rsi_required': False, 'bear_strategy': 'mean_reversion', 'bear_bb_std_mult': 2.279972621051543, 'bear_rsi_os': 10, 'bear_rsi_ob': 78, 'bear_adx_thresh': 33.13243064772526, 'bear_atr_min_pct': 0.0010953611660074157, 'bear_atr_max_pct': 0.09331669412696089, 'bear_tp_mult': 2.9503174048809333, 'bear_tsl_mult': 0.6371058476824996, 'bear_time_stop': 292, 'bear_use_sma': False, 'bear_use_ema': False, 'bear_use_atr': False, 'bear_use_adx': True, 'bear_use_spike': False, 'bear_rsi_required': False, 'sideways_strategy': 'mean_reversion', 'sideways_bb_std_mult': 3.442970477825652, 'sideways_rsi_os': 40, 'sideways_rsi_ob': 86, 'sideways_adx_thresh': 31.02014181085319, 'sideways_atr_min_pct': 0.014054748004535557, 'sideways_atr_max_pct': 0.13496697117211734, 'sideways_tp_mult': 1.9667741084810317, 'sideways_tsl_mult': 0.28920143557117806, 'sideways_time_stop': 242, 'sideways_use_sma': False, 'sideways_use_ema': False, 'sideways_use_atr': True, 'sideways_use_adx': False, 'sideways_use_spike': True, 'sideways_rsi_required': True}.
[I 2025-09-01 14:29:27,237] Trial 236 finished with values: [-1000000000.0, 1000000000.0] and parameters: {'p_sma': 14, 'p_std': 31, 'p_atr': 19, 'p_adx': 25, 'rsi_period': 41, 'ema1': 5, 'ema2': 53, 'slip_atr_k': 0.11269795492766435, 'slip_spread_k': 0.5669960934894297, 'spread_hl_frac': 0.014041303001536852, 'bb_std_mult': 1.1689732338330896, 'rsi_os': 36, 'rsi_ob': 50, 'vol_spike': 0.12405009387878109, 'adx_thresh': 33.1410889008299, 'atr_min_pct': 5.692001729856386e-05, 'atr_max_pct': 0.0782491147213346, 'tp_mult': 2.8074551613149046, 'tsl_mult': 0.43605437245817114, 'strategy': 'breakout', 'time_stop': 214, 'use_sma': False, 'use_atr': True, 'use_adx': True, 'use_ema': False, 'use_spike': True, 'rsi_required': False, 'edge_k': 0.6195320693265345, 'edge_cap': 0.32410203580996455, 'bull_strategy': 'breakout', 'bull_bb_std_mult': 2.090346011585729, 'bull_rsi_os': 20, 'bull_rsi_ob': 49, 'bull_adx_thresh': 24.341883270193783, 'bull_atr_min_pct': 0.010338680153361614, 'bull_atr_max_pct': 0.1371085399750849, 'bull_tp_mult': 2.622425467724324, 'bull_tsl_mult': 0.6489968397778927, 'bull_time_stop': 51, 'bull_use_sma': True, 'bull_use_ema': False, 'bull_use_atr': False, 'bull_use_adx': True, 'bull_use_spike': False, 'bull_rsi_required': False, 'bear_strategy': 'mean_reversion', 'bear_bb_std_mult': 3.079035375077684, 'bear_rsi_os': 6, 'bear_rsi_ob': 78, 'bear_adx_thresh': 33.6242020361493, 'bear_atr_min_pct': 0.0009116182761297765, 'bear_atr_max_pct': 0.0931000230118057, 'bear_tp_mult': 2.965262444071298, 'bear_tsl_mult': 0.6358155779205537, 'bear_time_stop': 293, 'bear_use_sma': False, 'bear_use_ema': False, 'bear_use_atr': False, 'bear_use_adx': True, 'bear_use_spike': False, 'bear_rsi_required': False, 'sideways_strategy': 'mean_reversion', 'sideways_bb_std_mult': 3.447805985263649, 'sideways_rsi_os': 55, 'sideways_rsi_ob': 86, 'sideways_adx_thresh': 34.52342245345155, 'sideways_atr_min_pct': 0.012927724545658987, 'sideways_atr_max_pct': 0.016188720123720426, 'sideways_tp_mult': 2.4923446453891627, 'sideways_tsl_mult': 0.2938595358673119, 'sideways_time_stop': 122, 'sideways_use_sma': False, 'sideways_use_ema': False, 'sideways_use_atr': True, 'sideways_use_adx': False, 'sideways_use_spike': True, 'sideways_rsi_required': True}.
[I 2025-09-01 14:29:27,938] Trial 235 finished with values: [-1000000000.0, 1000000000.0] and parameters: {'p_sma': 14, 'p_std': 23, 'p_atr': 19, 'p_adx': 25, 'rsi_period': 62, 'ema1': 30, 'ema2': 30, 'slip_atr_k': 0.0529283191556979, 'slip_spread_k': 0.24823927041164928, 'spread_hl_frac': 0.001631093999574569, 'bb_std_mult': 1.1075080819904486, 'rsi_os': 36, 'rsi_ob': 75, 'vol_spike': 0.18542241703192397, 'adx_thresh': 18.89523170406011, 'atr_min_pct': 0.015286393609483691, 'atr_max_pct': 0.0781444559636894, 'tp_mult': 2.8048024586217566, 'tsl_mult': 0.04890098765928475, 'strategy': 'breakout', 'time_stop': 82, 'use_sma': False, 'use_atr': True, 'use_adx': True, 'use_ema': False, 'use_spike': True, 'rsi_required': False, 'edge_k': 0.3437874328274646, 'edge_cap': 0.5967384485693439, 'bull_strategy': 'breakout', 'bull_bb_std_mult': 2.1636049214604594, 'bull_rsi_os': 20, 'bull_rsi_ob': 49, 'bull_adx_thresh': 23.05748431859321, 'bull_atr_min_pct': 0.010404521091751648, 'bull_atr_max_pct': 0.017571263323715756, 'bull_tp_mult': 2.4741503262795748, 'bull_tsl_mult': 0.8433656355840904, 'bull_time_stop': 48, 'bull_use_sma': True, 'bull_use_ema': False, 'bull_use_atr': False, 'bull_use_adx': True, 'bull_use_spike': False, 'bull_rsi_required': True, 'bear_strategy': 'mean_reversion', 'bear_bb_std_mult': 2.892835577959764, 'bear_rsi_os': 10, 'bear_rsi_ob': 78, 'bear_adx_thresh': 23.99884646354807, 'bear_atr_min_pct': 0.007574991773200918, 'bear_atr_max_pct': 0.12170524352688601, 'bear_tp_mult': 2.9955088234597387, 'bear_tsl_mult': 0.12868756698030853, 'bear_time_stop': 293, 'bear_use_sma': False, 'bear_use_ema': False, 'bear_use_atr': False, 'bear_use_adx': True, 'bear_use_spike': False, 'bear_rsi_required': False, 'sideways_strategy': 'mean_reversion', 'sideways_bb_std_mult': 0.8767651217296295, 'sideways_rsi_os': 44, 'sideways_rsi_ob': 86, 'sideways_adx_thresh': 18.065877933647695, 'sideways_atr_min_pct': 0.004636217399281589, 'sideways_atr_max_pct': 0.1343934840027046, 'sideways_tp_mult': 1.5567883921290506, 'sideways_tsl_mult': 0.28759984531938027, 'sideways_time_stop': 119, 'sideways_use_sma': False, 'sideways_use_ema': False, 'sideways_use_atr': True, 'sideways_use_adx': False, 'sideways_use_spike': True, 'sideways_rsi_required': True}.
[I 2025-09-01 14:29:28,433] Trial 237 finished with values: [-1000000000.0, 1000000000.0] and parameters: {'p_sma': 14, 'p_std': 31, 'p_atr': 19, 'p_adx': 25, 'rsi_period': 61, 'ema1': 29, 'ema2': 11, 'slip_atr_k': 0.05335213621935045, 'slip_spread_k': 0.8231179412901531, 'spread_hl_frac': 0.039979981778275775, 'bb_std_mult': 1.8053126934731192, 'rsi_os': 36, 'rsi_ob': 80, 'vol_spike': 0.135477633352854, 'adx_thresh': 20.005030704654992, 'atr_min_pct': 0.015372772624745526, 'atr_max_pct': 0.07817145981483348, 'tp_mult': 1.2692607654043717, 'tsl_mult': 0.8893176896400179, 'strategy': 'breakout', 'time_stop': 60, 'use_sma': False, 'use_atr': True, 'use_adx': True, 'use_ema': False, 'use_spike': True, 'rsi_required': False, 'edge_k': 0.06679609580098123, 'edge_cap': 0.5315220414104377, 'bull_strategy': 'breakout', 'bull_bb_std_mult': 2.061425982299659, 'bull_rsi_os': 11, 'bull_rsi_ob': 49, 'bull_adx_thresh': 23.649866255783564, 'bull_atr_min_pct': 0.0213172761198995, 'bull_atr_max_pct': 0.01931522999736813, 'bull_tp_mult': 2.568838865827513, 'bull_tsl_mult': 0.6469398249071432, 'bull_time_stop': 161, 'bull_use_sma': True, 'bull_use_ema': False, 'bull_use_atr': False, 'bull_use_adx': True, 'bull_use_spike': False, 'bull_rsi_required': False, 'bear_strategy': 'mean_reversion', 'bear_bb_std_mult': 2.899814557040691, 'bear_rsi_os': 10, 'bear_rsi_ob': 78, 'bear_adx_thresh': 28.96624587932844, 'bear_atr_min_pct': 0.0008364521876666545, 'bear_atr_max_pct': 0.07867003595627552, 'bear_tp_mult': 2.5163884572360864, 'bear_tsl_mult': 0.47528667870812047, 'bear_time_stop': 294, 'bear_use_sma': False, 'bear_use_ema': False, 'bear_use_atr': False, 'bear_use_adx': True, 'bear_use_spike': False, 'bear_rsi_required': False, 'sideways_strategy': 'mean_reversion', 'sideways_bb_std_mult': 3.321929816288086, 'sideways_rsi_os': 44, 'sideways_rsi_ob': 85, 'sideways_adx_thresh': 15.108174225471632, 'sideways_atr_min_pct': 0.00467589003260345, 'sideways_atr_max_pct': 0.015562260157157393, 'sideways_tp_mult': 1.4503341081959136, 'sideways_tsl_mult': 0.08804304356518305, 'sideways_time_stop': 119, 'sideways_use_sma': False, 'sideways_use_ema': False, 'sideways_use_atr': True, 'sideways_use_adx': False, 'sideways_use_spike': True, 'sideways_rsi_required': True}.
[I 2025-09-01 14:29:29,124] Trial 242 finished with values: [-1000000000.0, 1000000000.0] and parameters: {'p_sma': 12, 'p_std': 16, 'p_atr': 20, 'p_adx': 24, 'rsi_period': 77, 'ema1': 29, 'ema2': 26, 'slip_atr_k': 0.03950269467557338, 'slip_spread_k': 0.18915102719518595, 'spread_hl_frac': 0.037187150694576274, 'bb_std_mult': 0.5385887325764631, 'rsi_os': 38, 'rsi_ob': 77, 'vol_spike': 0.23987042919826998, 'adx_thresh': 18.27791834421693, 'atr_min_pct': 0.017440475874372106, 'atr_max_pct': 0.010154984639552667, 'tp_mult': 2.87105272238001, 'tsl_mult': 0.019429454027060915, 'strategy': 'breakout', 'time_stop': 51, 'use_sma': False, 'use_atr': True, 'use_adx': True, 'use_ema': False, 'use_spike': True, 'rsi_required': False, 'edge_k': 1.4833193123838613, 'edge_cap': 0.07145810180012652, 'bull_strategy': 'breakout', 'bull_bb_std_mult': 2.7726877598803115, 'bull_rsi_os': 52, 'bull_rsi_ob': 68, 'bull_adx_thresh': 9.374058195658243, 'bull_atr_min_pct': 0.006449858950432716, 'bull_atr_max_pct': 0.07232736033898123, 'bull_tp_mult': 1.1559818382743599, 'bull_tsl_mult': 0.40256531602199724, 'bull_time_stop': 238, 'bull_use_sma': True, 'bull_use_ema': False, 'bull_use_atr': False, 'bull_use_adx': True, 'bull_use_spike': False, 'bull_rsi_required': True, 'bear_strategy': 'mean_reversion', 'bear_bb_std_mult': 2.8265901102965563, 'bear_rsi_os': 8, 'bear_rsi_ob': 77, 'bear_adx_thresh': 28.039089738968855, 'bear_atr_min_pct': 0.022327094762564906, 'bear_atr_max_pct': 0.11023402188012303, 'bear_tp_mult': 1.3996368769100442, 'bear_tsl_mult': 0.651443880015408, 'bear_time_stop': 282, 'bear_use_sma': False, 'bear_use_ema': False, 'bear_use_atr': False, 'bear_use_adx': True, 'bear_use_spike': False, 'bear_rsi_required': False, 'sideways_strategy': 'mean_reversion', 'sideways_bb_std_mult': 3.3559198209059846, 'sideways_rsi_os': 16, 'sideways_rsi_ob': 90, 'sideways_adx_thresh': 7.339733463284598, 'sideways_atr_min_pct': 0.005371178112784486, 'sideways_atr_max_pct': 0.05883779570976923, 'sideways_tp_mult': 1.81305612623187, 'sideways_tsl_mult': 0.3218857007228626, 'sideways_time_stop': 107, 'sideways_use_sma': False, 'sideways_use_ema': False, 'sideways_use_atr': True, 'sideways_use_adx': False, 'sideways_use_spike': True, 'sideways_rsi_required': True}.
[I 2025-09-01 14:30:06,296] Trial 240 finished with values: [-1000000000.0, 1000000000.0] and parameters: {'p_sma': 11, 'p_std': 10, 'p_atr': 8, 'p_adx': 24, 'rsi_period': 50, 'ema1': 10, 'ema2': 51, 'slip_atr_k': 0.019014687497581645, 'slip_spread_k': 0.8343438074317862, 'spread_hl_frac': 0.03681543325482131, 'bb_std_mult': 1.2421407476722992, 'rsi_os': 38, 'rsi_ob': 72, 'vol_spike': 0.2994936066703956, 'adx_thresh': 20.064516426453103, 'atr_min_pct': 0.01590491126711978, 'atr_max_pct': 0.07401321190366826, 'tp_mult': 2.727637672655684, 'tsl_mult': 0.6033753847615418, 'strategy': 'breakout', 'time_stop': 61, 'use_sma': False, 'use_atr': True, 'use_adx': True, 'use_ema': False, 'use_spike': True, 'rsi_required': False, 'edge_k': 0.05603969722692925, 'edge_cap': 0.06826087911042018, 'bull_strategy': 'breakout', 'bull_bb_std_mult': 2.632663155544493, 'bull_rsi_os': 13, 'bull_rsi_ob': 68, 'bull_adx_thresh': 11.139187506711371, 'bull_atr_min_pct': 0.006408897363531058, 'bull_atr_max_pct': 0.06636057343487177, 'bull_tp_mult': 2.123979823660837, 'bull_tsl_mult': 0.30740886209051665, 'bull_time_stop': 153, 'bull_use_sma': True, 'bull_use_ema': False, 'bull_use_atr': False, 'bull_use_adx': True, 'bull_use_spike': False, 'bull_rsi_required': True, 'bear_strategy': 'mean_reversion', 'bear_bb_std_mult': 2.832361778853897, 'bear_rsi_os': 8, 'bear_rsi_ob': 76, 'bear_adx_thresh': 7.047343077439528, 'bear_atr_min_pct': 0.010784603828764935, 'bear_atr_max_pct': 0.11088694093300103, 'bear_tp_mult': 2.52080472878013, 'bear_tsl_mult': 0.0477534304786531, 'bear_time_stop': 284, 'bear_use_sma': False, 'bear_use_ema': False, 'bear_use_atr': False, 'bear_use_adx': True, 'bear_use_spike': False, 'bear_rsi_required': False, 'sideways_strategy': 'mean_reversion', 'sideways_bb_std_mult': 3.3593775347573085, 'sideways_rsi_os': 16, 'sideways_rsi_ob': 90, 'sideways_adx_thresh': 14.983165476548285, 'sideways_atr_min_pct': 0.02532245246099713, 'sideways_atr_max_pct': 0.13305539970654695, 'sideways_tp_mult': 1.395959301070697, 'sideways_tsl_mult': 0.9025517497910814, 'sideways_time_stop': 131, 'sideways_use_sma': False, 'sideways_use_ema': False, 'sideways_use_atr': True, 'sideways_use_adx': False, 'sideways_use_spike': True, 'sideways_rsi_required': True}.
[I 2025-09-01 14:30:06,790] Trial 241 finished with values: [-1000000000.0, 1000000000.0] and parameters: {'p_sma': 12, 'p_std': 10, 'p_atr': 16, 'p_adx': 27, 'rsi_period': 65, 'ema1': 29, 'ema2': 51, 'slip_atr_k': 0.0108944543748168, 'slip_spread_k': 0.5267652607853376, 'spread_hl_frac': 0.04375423945850124, 'bb_std_mult': 1.4768806821893774, 'rsi_os': 38, 'rsi_ob': 85, 'vol_spike': 0.26377251985066996, 'adx_thresh': 20.284048310290967, 'atr_min_pct': 0.01732584128672891, 'atr_max_pct': 0.14120167872996084, 'tp_mult': 1.2988663639169933, 'tsl_mult': 0.10528387461108402, 'strategy': 'breakout', 'time_stop': 61, 'use_sma': False, 'use_atr': True, 'use_adx': True, 'use_ema': False, 'use_spike': True, 'rsi_required': False, 'edge_k': 1.397553042378496, 'edge_cap': 0.06644277455727038, 'bull_strategy': 'breakout', 'bull_bb_std_mult': 2.791370794982661, 'bull_rsi_os': 14, 'bull_rsi_ob': 67, 'bull_adx_thresh': 11.18930682965561, 'bull_atr_min_pct': 0.0057049688521441135, 'bull_atr_max_pct': 0.06708619077121351, 'bull_tp_mult': 2.155627988686023, 'bull_tsl_mult': 0.6238919327037196, 'bull_time_stop': 237, 'bull_use_sma': True, 'bull_use_ema': False, 'bull_use_atr': False, 'bull_use_adx': True, 'bull_use_spike': False, 'bull_rsi_required': True, 'bear_strategy': 'mean_reversion', 'bear_bb_std_mult': 2.8222478662605694, 'bear_rsi_os': 34, 'bear_rsi_ob': 76, 'bear_adx_thresh': 18.102476442087433, 'bear_atr_min_pct': 0.010275846849082018, 'bear_atr_max_pct': 0.11053613133478131, 'bear_tp_mult': 1.8067989085281433, 'bear_tsl_mult': 0.4869625696086847, 'bear_time_stop': 284, 'bear_use_sma': False, 'bear_use_ema': False, 'bear_use_atr': False, 'bear_use_adx': True, 'bear_use_spike': False, 'bear_rsi_required': False, 'sideways_strategy': 'mean_reversion', 'sideways_bb_std_mult': 1.5282546394774612, 'sideways_rsi_os': 29, 'sideways_rsi_ob': 45, 'sideways_adx_thresh': 5.583803088631971, 'sideways_atr_min_pct': 0.0052397279580813725, 'sideways_atr_max_pct': 0.14990706662634654, 'sideways_tp_mult': 1.1122187196915618, 'sideways_tsl_mult': 0.08571743221295874, 'sideways_time_stop': 107, 'sideways_use_sma': False, 'sideways_use_ema': False, 'sideways_use_atr': True, 'sideways_use_adx': False, 'sideways_use_spike': True, 'sideways_rsi_required': True}.
[I 2025-09-01 14:30:07,059] Trial 239 finished with values: [-1000000000.0, 1000000000.0] and parameters: {'p_sma': 12, 'p_std': 10, 'p_atr': 30, 'p_adx': 24, 'rsi_period': 61, 'ema1': 14, 'ema2': 53, 'slip_atr_k': 0.1292363621352089, 'slip_spread_k': 0.7145847990934493, 'spread_hl_frac': 0.036778113246820815, 'bb_std_mult': 1.2217782121932461, 'rsi_os': 42, 'rsi_ob': 77, 'vol_spike': 0.23969163340877875, 'adx_thresh': 20.070349904253103, 'atr_min_pct': 0.01593466948753436, 'atr_max_pct': 0.05189901465401277, 'tp_mult': 2.8809639075531424, 'tsl_mult': 0.4577240130977866, 'strategy': 'breakout', 'time_stop': 63, 'use_sma': False, 'use_atr': True, 'use_adx': True, 'use_ema': False, 'use_spike': True, 'rsi_required': False, 'edge_k': 0.3364931930727941, 'edge_cap': 0.067607870090635, 'bull_strategy': 'breakout', 'bull_bb_std_mult': 2.6301594439598004, 'bull_rsi_os': 11, 'bull_rsi_ob': 59, 'bull_adx_thresh': 9.3582881726434, 'bull_atr_min_pct': 0.010409910987520839, 'bull_atr_max_pct': 0.016696226733890034, 'bull_tp_mult': 2.137111894957177, 'bull_tsl_mult': 0.30806131179759494, 'bull_time_stop': 193, 'bull_use_sma': True, 'bull_use_ema': False, 'bull_use_atr': False, 'bull_use_adx': True, 'bull_use_spike': False, 'bull_rsi_required': True, 'bear_strategy': 'mean_reversion', 'bear_bb_std_mult': 3.104556987667296, 'bear_rsi_os': 6, 'bear_rsi_ob': 78, 'bear_adx_thresh': 24.98390717729327, 'bear_atr_min_pct': 0.024680828947423693, 'bear_atr_max_pct': 0.0782914568654615, 'bear_tp_mult': 1.3465253774040686, 'bear_tsl_mult': 0.050188635386403, 'bear_time_stop': 283, 'bear_use_sma': False, 'bear_use_ema': False, 'bear_use_atr': False, 'bear_use_adx': True, 'bear_use_spike': False, 'bear_rsi_required': False, 'sideways_strategy': 'mean_reversion', 'sideways_bb_std_mult': 3.2954709323734988, 'sideways_rsi_os': 44, 'sideways_rsi_ob': 90, 'sideways_adx_thresh': 5.543456833792039, 'sideways_atr_min_pct': 0.027181357968122734, 'sideways_atr_max_pct': 0.035484118102998355, 'sideways_tp_mult': 1.9245487060648439, 'sideways_tsl_mult': 0.29063733123903973, 'sideways_time_stop': 120, 'sideways_use_sma': False, 'sideways_use_ema': False, 'sideways_use_atr': True, 'sideways_use_adx': False, 'sideways_use_spike': True, 'sideways_rsi_required': True}.
