[I 2025-09-01 14:17:40,625] Trial 164 finished with values: [-1000000000.0, 1000000000.0] and parameters: {'p_sma': 20, 'p_std': 49, 'p_atr': 25, 'p_adx': 26, 'rsi_period': 62, 'ema1': 9, 'ema2': 43, 'slip_atr_k': 0.2267869839255286, 'slip_spread_k': 0.17203434957191405, 'spread_hl_frac': 0.010643447251482599, 'bb_std_mult': 2.026744134712034, 'rsi_os': 49, 'rsi_ob': 66, 'vol_spike': 0.02793569439793921, 'adx_thresh': 25.02296154490706, 'atr_min_pct': 0.0009195158165422011, 'atr_max_pct': 0.0407391650630009, 'tp_mult': 1.7552289622707526, 'tsl_mult': 0.42487031216949006, 'strategy': 'mean_reversion', 'time_stop': 114, 'use_sma': False, 'use_atr': False, 'use_adx': False, 'use_ema': False, 'use_spike': False, 'rsi_required': True, 'edge_k': 0.952241914948495, 'edge_cap': 0.5443284230405497, 'bull_strategy': 'mean_reversion', 'bull_bb_std_mult': 3.0820468021186693, 'bull_rsi_os': 35, 'bull_rsi_ob': 68, 'bull_adx_thresh': 11.657977902646518, 'bull_atr_min_pct': 0.0006369370254645037, 'bull_atr_max_pct': 0.05435758197631857, 'bull_tp_mult': 1.5583084930657574, 'bull_tsl_mult': 0.004066666523146346, 'bull_time_stop': 102, 'bull_use_sma': True, 'bull_use_ema': True, 'bull_use_atr': False, 'bull_use_adx': True, 'bull_use_spike': True, 'bull_rsi_required': False, 'bear_strategy': 'breakout', 'bear_bb_std_mult': 2.1615036306786175, 'bear_rsi_os': 11, 'bear_rsi_ob': 86, 'bear_adx_thresh': 29.945538608794628, 'bear_atr_min_pct': 0.015459672931679004, 'bear_atr_max_pct': 0.023370523140834935, 'bear_tp_mult': 2.8470639615520072, 'bear_tsl_mult': 0.8341913533936647, 'bear_time_stop': 245, 'bear_use_sma': False, 'bear_use_ema': False, 'bear_use_atr': True, 'bear_use_adx': True, 'bear_use_spike': True, 'bear_rsi_required': True, 'sideways_strategy': 'breakout', 'sideways_bb_std_mult': 2.929118948652305, 'sideways_rsi_os': 41, 'sideways_rsi_ob': 55, 'sideways_adx_thresh': 24.465620975974375, 'sideways_atr_min_pct': 0.008317596355495217, 'sideways_atr_max_pct': 0.11149370316241125, 'sideways_tp_mult': 1.6448829026735008, 'sideways_tsl_mult': 0.8730557239722563, 'sideways_time_stop': 144, 'sideways_use_sma': True, 'sideways_use_ema': False, 'sideways_use_atr': True, 'sideways_use_adx': True, 'sideways_use_spike': False, 'sideways_rsi_required': False}.
[I 2025-09-01 14:17:41,760] Trial 165 finished with values: [-1000000000.0, 1000000000.0] and parameters: {'p_sma': 41, 'p_std': 49, 'p_atr': 25, 'p_adx': 30, 'rsi_period': 73, 'ema1': 9, 'ema2': 43, 'slip_atr_k': 0.22686761150214624, 'slip_spread_k': 0.3706678305439669, 'spread_hl_frac': 0.04119939189480393, 'bb_std_mult': 2.4377747838695063, 'rsi_os': 33, 'rsi_ob': 59, 'vol_spike': 0.04839520114341864, 'adx_thresh': 18.843402868014127, 'atr_min_pct': 0.0009383097236027454, 'atr_max_pct': 0.11938761055342251, 'tp_mult': 1.7586384489891322, 'tsl_mult': 0.6815547676797323, 'strategy': 'mean_reversion', 'time_stop': 291, 'use_sma': False, 'use_atr': False, 'use_adx': False, 'use_ema': False, 'use_spike': False, 'rsi_required': True, 'edge_k': 0.9402663859794508, 'edge_cap': 0.8146131991320945, 'bull_strategy': 'mean_reversion', 'bull_bb_std_mult': 3.0608896635645557, 'bull_rsi_os': 35, 'bull_rsi_ob': 51, 'bull_adx_thresh': 11.756654976467056, 'bull_atr_min_pct': 0.002831617393955114, 'bull_atr_max_pct': 0.05063594185170607, 'bull_tp_mult': 1.5659951080092536, 'bull_tsl_mult': 0.016298781897164143, 'bull_time_stop': 106, 'bull_use_sma': True, 'bull_use_ema': True, 'bull_use_atr': False, 'bull_use_adx': True, 'bull_use_spike': True, 'bull_rsi_required': False, 'bear_strategy': 'breakout', 'bear_bb_std_mult': 2.9444559371570085, 'bear_rsi_os': 11, 'bear_rsi_ob': 66, 'bear_adx_thresh': 12.483606838901038, 'bear_atr_min_pct': 0.02752159143543457, 'bear_atr_max_pct': 0.023410514576579763, 'bear_tp_mult': 2.860637748308741, 'bear_tsl_mult': 0.2706364847418843, 'bear_time_stop': 247, 'bear_use_sma': False, 'bear_use_ema': False, 'bear_use_atr': True, 'bear_use_adx': True, 'bear_use_spike': True, 'bear_rsi_required': True, 'sideways_strategy': 'breakout', 'sideways_bb_std_mult': 3.202795381546174, 'sideways_rsi_os': 20, 'sideways_rsi_ob': 55, 'sideways_adx_thresh': 24.76292286450523, 'sideways_atr_min_pct': 0.009930532725883663, 'sideways_atr_max_pct': 0.11205403939952555, 'sideways_tp_mult': 2.2294726974214387, 'sideways_tsl_mult': 0.8744206833092458, 'sideways_time_stop': 141, 'sideways_use_sma': True, 'sideways_use_ema': False, 'sideways_use_atr': True, 'sideways_use_adx': True, 'sideways_use_spike': False, 'sideways_rsi_required': False}.
[I 2025-09-01 14:17:42,323] Trial 163 finished with values: [-1000000000.0, 1000000000.0] and parameters: {'p_sma': 37, 'p_std': 49, 'p_atr': 25, 'p_adx': 19, 'rsi_period': 64, 'ema1': 28, 'ema2': 43, 'slip_atr_k': 0.1154395958102678, 'slip_spread_k': 0.4705880073369703, 'spread_hl_frac': 0.03666203667606192, 'bb_std_mult': 2.4259158635989997, 'rsi_os': 33, 'rsi_ob': 70, 'vol_spike': 0.0257573832681946, 'adx_thresh': 25.263505929843415, 'atr_min_pct': 0.00762285023699003, 'atr_max_pct': 0.054326164509730004, 'tp_mult': 1.5328877638276, 'tsl_mult': 0.7441210542172072, 'strategy': 'mean_reversion', 'time_stop': 63, 'use_sma': False, 'use_atr': False, 'use_adx': True, 'use_ema': False, 'use_spike': True, 'rsi_required': True, 'edge_k': 0.9361112868709573, 'edge_cap': 0.821196945838216, 'bull_strategy': 'mean_reversion', 'bull_bb_std_mult': 0.8242775956774604, 'bull_rsi_os': 5, 'bull_rsi_ob': 51, 'bull_adx_thresh': 11.998966121993398, 'bull_atr_min_pct': 0.0028645070933917115, 'bull_atr_max_pct': 0.1437778799483671, 'bull_tp_mult': 1.4729710456194676, 'bull_tsl_mult': 0.3687721571078286, 'bull_time_stop': 108, 'bull_use_sma': True, 'bull_use_ema': True, 'bull_use_atr': True, 'bull_use_adx': True, 'bull_use_spike': True, 'bull_rsi_required': True, 'bear_strategy': 'breakout', 'bear_bb_std_mult': 2.943449158297559, 'bear_rsi_os': 11, 'bear_rsi_ob': 86, 'bear_adx_thresh': 12.206003904518646, 'bear_atr_min_pct': 0.025110702718678476, 'bear_atr_max_pct': 0.11522975998390536, 'bear_tp_mult': 2.7507722243645354, 'bear_tsl_mult': 0.8463376664451476, 'bear_time_stop': 243, 'bear_use_sma': False, 'bear_use_ema': False, 'bear_use_atr': True, 'bear_use_adx': False, 'bear_use_spike': True, 'bear_rsi_required': True, 'sideways_strategy': 'breakout', 'sideways_bb_std_mult': 2.910960697396647, 'sideways_rsi_os': 25, 'sideways_rsi_ob': 51, 'sideways_adx_thresh': 24.634982555574947, 'sideways_atr_min_pct': 0.010025829378125592, 'sideways_atr_max_pct': 0.11331428772434399, 'sideways_tp_mult': 1.0725309406461054, 'sideways_tsl_mult': 0.47491481762565985, 'sideways_time_stop': 125, 'sideways_use_sma': True, 'sideways_use_ema': False, 'sideways_use_atr': True, 'sideways_use_adx': True, 'sideways_use_spike': False, 'sideways_rsi_required': False}.
[I 2025-09-01 14:17:42,731] Trial 162 finished with values: [-0.0080476651450343, 0.008018660645235268] and parameters: {'p_sma': 41, 'p_std': 49, 'p_atr': 26, 'p_adx': 30, 'rsi_period': 64, 'ema1': 28, 'ema2': 43, 'slip_atr_k': 0.04564133091265252, 'slip_spread_k': 0.38252720292830933, 'spread_hl_frac': 0.010439108666217606, 'bb_std_mult': 2.3622735037355778, 'rsi_os': 33, 'rsi_ob': 70, 'vol_spike': 0.05005556181996663, 'adx_thresh': 18.686244741299365, 'atr_min_pct': 0.00976982696011578, 'atr_max_pct': 0.07883641514504049, 'tp_mult': 2.581056181693145, 'tsl_mult': 0.24329908016093316, 'strategy': 'breakout', 'time_stop': 15, 'use_sma': False, 'use_atr': False, 'use_adx': True, 'use_ema': False, 'use_spike': False, 'rsi_required': True, 'edge_k': 0.9265768622507337, 'edge_cap': 0.8184220812451386, 'bull_strategy': 'mean_reversion', 'bull_bb_std_mult': 1.1690482099539958, 'bull_rsi_os': 6, 'bull_rsi_ob': 51, 'bull_adx_thresh': 11.21988142612064, 'bull_atr_min_pct': 0.00301767780065614, 'bull_atr_max_pct': 0.03475158562055769, 'bull_tp_mult': 1.9556379398006039, 'bull_tsl_mult': 0.3205650930387682, 'bull_time_stop': 108, 'bull_use_sma': True, 'bull_use_ema': False, 'bull_use_atr': True, 'bull_use_adx': True, 'bull_use_spike': True, 'bull_rsi_required': True, 'bear_strategy': 'mean_reversion', 'bear_bb_std_mult': 2.9698814487888923, 'bear_rsi_os': 11, 'bear_rsi_ob': 66, 'bear_adx_thresh': 12.248425446529936, 'bear_atr_min_pct': 0.02519370473357411, 'bear_atr_max_pct': 0.11428368622517199, 'bear_tp_mult': 2.7428281786528426, 'bear_tsl_mult': 0.7585473181059748, 'bear_time_stop': 273, 'bear_use_sma': True, 'bear_use_ema': False, 'bear_use_atr': False, 'bear_use_adx': False, 'bear_use_spike': True, 'bear_rsi_required': False, 'sideways_strategy': 'breakout', 'sideways_bb_std_mult': 2.9299129199179514, 'sideways_rsi_os': 20, 'sideways_rsi_ob': 83, 'sideways_adx_thresh': 10.89633684154511, 'sideways_atr_min_pct': 0.006970622127077715, 'sideways_atr_max_pct': 0.11121470044451214, 'sideways_tp_mult': 1.586101843982715, 'sideways_tsl_mult': 0.3674920294957279, 'sideways_time_stop': 116, 'sideways_use_sma': True, 'sideways_use_ema': False, 'sideways_use_atr': True, 'sideways_use_adx': False, 'sideways_use_spike': True, 'sideways_rsi_required': True}.
[I 2025-09-01 14:18:19,317] Trial 166 finished with values: [-1000000000.0, 1000000000.0] and parameters: {'p_sma': 37, 'p_std': 49, 'p_atr': 26, 'p_adx': 30, 'rsi_period': 20, 'ema1': 20, 'ema2': 39, 'slip_atr_k': 0.10952083355392667, 'slip_spread_k': 0.9609733183791387, 'spread_hl_frac': 0.04115528893899171, 'bb_std_mult': 2.451636411621047, 'rsi_os': 15, 'rsi_ob': 59, 'vol_spike': 0.04945041004273634, 'adx_thresh': 19.035613404826325, 'atr_min_pct': 0.007355467949125964, 'atr_max_pct': 0.09578441215789177, 'tp_mult': 1.7152957664503892, 'tsl_mult': 0.2455148669994081, 'strategy': 'mean_reversion', 'time_stop': 100, 'use_sma': False, 'use_atr': False, 'use_adx': True, 'use_ema': False, 'use_spike': False, 'rsi_required': True, 'edge_k': 0.8780964903835797, 'edge_cap': 0.8088623942616432, 'bull_strategy': 'mean_reversion', 'bull_bb_std_mult': 1.2821586927173856, 'bull_rsi_os': 7, 'bull_rsi_ob': 51, 'bull_adx_thresh': 27.597944061212196, 'bull_atr_min_pct': 0.002839448395707177, 'bull_atr_max_pct': 0.1116592138786335, 'bull_tp_mult': 1.9455902957143134, 'bull_tsl_mult': 0.6108979892600841, 'bull_time_stop': 109, 'bull_use_sma': True, 'bull_use_ema': True, 'bull_use_atr': True, 'bull_use_adx': True, 'bull_use_spike': True, 'bull_rsi_required': True, 'bear_strategy': 'breakout', 'bear_bb_std_mult': 3.148127754316148, 'bear_rsi_os': 15, 'bear_rsi_ob': 79, 'bear_adx_thresh': 12.235956664153203, 'bear_atr_min_pct': 0.024941492805985545, 'bear_atr_max_pct': 0.010010766398728652, 'bear_tp_mult': 2.7826357062579365, 'bear_tsl_mult': 0.2784047498048595, 'bear_time_stop': 256, 'bear_use_sma': True, 'bear_use_ema': False, 'bear_use_atr': True, 'bear_use_adx': False, 'bear_use_spike': True, 'bear_rsi_required': True, 'sideways_strategy': 'breakout', 'sideways_bb_std_mult': 3.218342819088062, 'sideways_rsi_os': 20, 'sideways_rsi_ob': 51, 'sideways_adx_thresh': 22.342976422209848, 'sideways_atr_min_pct': 0.010799181617687524, 'sideways_atr_max_pct': 0.07828486935609133, 'sideways_tp_mult': 2.2244941444208814, 'sideways_tsl_mult': 0.4680936027685691, 'sideways_time_stop': 12, 'sideways_use_sma': True, 'sideways_use_ema': False, 'sideways_use_atr': True, 'sideways_use_adx': True, 'sideways_use_spike': False, 'sideways_rsi_required': False}.
[I 2025-09-01 14:18:20,256] Trial 168 finished with values: [-0.08381671214566089, 0.08355804971676366] and parameters: {'p_sma': 40, 'p_std': 54, 'p_atr': 26, 'p_adx': 21, 'rsi_period': 29, 'ema1': 22, 'ema2': 39, 'slip_atr_k': 0.21198159978367787, 'slip_spread_k': 0.960647763319415, 'spread_hl_frac': 0.018561112766153035, 'bb_std_mult': 0.7683955568678833, 'rsi_os': 18, 'rsi_ob': 65, 'vol_spike': 0.10812557989515847, 'adx_thresh': 22.61476267455681, 'atr_min_pct': 0.00531603165464784, 'atr_max_pct': 0.12362534721611945, 'tp_mult': 2.5017869324930104, 'tsl_mult': 0.24112892944653616, 'strategy': 'mean_reversion', 'time_stop': 103, 'use_sma': True, 'use_atr': True, 'use_adx': True, 'use_ema': False, 'use_spike': False, 'rsi_required': False, 'edge_k': 1.8907067491154415, 'edge_cap': 0.7209867028941582, 'bull_strategy': 'mean_reversion', 'bull_bb_std_mult': 1.1667229473676892, 'bull_rsi_os': 37, 'bull_rsi_ob': 50, 'bull_adx_thresh': 19.162265929659622, 'bull_atr_min_pct': 0.0011263261243263144, 'bull_atr_max_pct': 0.03587707896016741, 'bull_tp_mult': 2.664548122415222, 'bull_tsl_mult': 0.6963794663797247, 'bull_time_stop': 41, 'bull_use_sma': True, 'bull_use_ema': True, 'bull_use_atr': True, 'bull_use_adx': True, 'bull_use_spike': True, 'bull_rsi_required': True, 'bear_strategy': 'breakout', 'bear_bb_std_mult': 3.152456065653505, 'bear_rsi_os': 15, 'bear_rsi_ob': 62, 'bear_adx_thresh': 12.937229670016691, 'bear_atr_min_pct': 0.00021970144442539329, 'bear_atr_max_pct': 0.01250757068492121, 'bear_tp_mult': 2.707894650546455, 'bear_tsl_mult': 0.2855546212921649, 'bear_time_stop': 98, 'bear_use_sma': True, 'bear_use_ema': True, 'bear_use_atr': False, 'bear_use_adx': False, 'bear_use_spike': False, 'bear_rsi_required': True, 'sideways_strategy': 'mean_reversion', 'sideways_bb_std_mult': 3.0343176069496973, 'sideways_rsi_os': 27, 'sideways_rsi_ob': 69, 'sideways_adx_thresh': 30.18288339341148, 'sideways_atr_min_pct': 0.02543327556409055, 'sideways_atr_max_pct': 0.0780378509107217, 'sideways_tp_mult': 2.108575775544322, 'sideways_tsl_mult': 0.4297452459068807, 'sideways_time_stop': 234, 'sideways_use_sma': False, 'sideways_use_ema': True, 'sideways_use_atr': True, 'sideways_use_adx': True, 'sideways_use_spike': False, 'sideways_rsi_required': False}.
[I 2025-09-01 14:18:21,325] Trial 167 finished with values: [-1000000000.0, 1000000000.0] and parameters: {'p_sma': 59, 'p_std': 53, 'p_atr': 26, 'p_adx': 20, 'rsi_period': 29, 'ema1': 22, 'ema2': 27, 'slip_atr_k': 0.1263447696083705, 'slip_spread_k': 0.38454083135326594, 'spread_hl_frac': 0.018049171213820176, 'bb_std_mult': 0.7490015011136151, 'rsi_os': 15, 'rsi_ob': 64, 'vol_spike': 0.040124556203487774, 'adx_thresh': 19.8173760416362, 'atr_min_pct': 0.01945476409016416, 'atr_max_pct': 0.06341025408822926, 'tp_mult': 2.5849668239624224, 'tsl_mult': 0.22403282723234827, 'strategy': 'mean_reversion', 'time_stop': 11, 'use_sma': False, 'use_atr': False, 'use_adx': True, 'use_ema': False, 'use_spike': False, 'rsi_required': True, 'edge_k': 0.8843730424316438, 'edge_cap': 0.8093524930090291, 'bull_strategy': 'mean_reversion', 'bull_bb_std_mult': 1.1575019911109174, 'bull_rsi_os': 30, 'bull_rsi_ob': 63, 'bull_adx_thresh': 27.842157735210094, 'bull_atr_min_pct': 0.001069950391412243, 'bull_atr_max_pct': 0.12671612221788123, 'bull_tp_mult': 1.183891888928068, 'bull_tsl_mult': 0.30822661421757686, 'bull_time_stop': 131, 'bull_use_sma': True, 'bull_use_ema': True, 'bull_use_atr': True, 'bull_use_adx': True, 'bull_use_spike': True, 'bull_rsi_required': True, 'bear_strategy': 'breakout', 'bear_bb_std_mult': 3.1735878437084697, 'bear_rsi_os': 14, 'bear_rsi_ob': 69, 'bear_adx_thresh': 12.032175368869764, 'bear_atr_min_pct': 0.010681617715855834, 'bear_atr_max_pct': 0.01295153202211907, 'bear_tp_mult': 2.40135625074491, 'bear_tsl_mult': 0.28093506273204577, 'bear_time_stop': 256, 'bear_use_sma': True, 'bear_use_ema': True, 'bear_use_atr': True, 'bear_use_adx': False, 'bear_use_spike': True, 'bear_rsi_required': True, 'sideways_strategy': 'breakout', 'sideways_bb_std_mult': 3.027086666953922, 'sideways_rsi_os': 23, 'sideways_rsi_ob': 51, 'sideways_adx_thresh': 30.12857167097973, 'sideways_atr_min_pct': 0.01907187113517066, 'sideways_atr_max_pct': 0.07826796714025383, 'sideways_tp_mult': 2.1137586443228717, 'sideways_tsl_mult': 0.47333131052945643, 'sideways_time_stop': 125, 'sideways_use_sma': True, 'sideways_use_ema': True, 'sideways_use_atr': True, 'sideways_use_adx': True, 'sideways_use_spike': False, 'sideways_rsi_required': False}.
[I 2025-09-01 14:18:21,984] Trial 169 finished with values: [-1000000000.0, 1000000000.0] and parameters: {'p_sma': 51, 'p_std': 46, 'p_atr': 27, 'p_adx': 30, 'rsi_period': 66, 'ema1': 27, 'ema2': 45, 'slip_atr_k': 0.061705995102748934, 'slip_spread_k': 0.3784295085021721, 'spread_hl_frac': 0.00826472071737372, 'bb_std_mult': 2.508824175051211, 'rsi_os': 31, 'rsi_ob': 72, 'vol_spike': 0.03552378504987515, 'adx_thresh': 17.908473359853016, 'atr_min_pct': 0.0116117956106635, 'atr_max_pct': 0.06324284646643452, 'tp_mult': 2.546321415374522, 'tsl_mult': 0.3274712846613361, 'strategy': 'breakout', 'time_stop': 11, 'use_sma': False, 'use_atr': True, 'use_adx': True, 'use_ema': False, 'use_spike': False, 'rsi_required': False, 'edge_k': 0.8814525051030664, 'edge_cap': 0.8644388731058749, 'bull_strategy': 'mean_reversion', 'bull_bb_std_mult': 1.2751535617517393, 'bull_rsi_os': 6, 'bull_rsi_ob': 50, 'bull_adx_thresh': 13.365849768095991, 'bull_atr_min_pct': 0.003923422141513337, 'bull_atr_max_pct': 0.03584227315368236, 'bull_tp_mult': 2.2965132508230046, 'bull_tsl_mult': 0.3077358529960167, 'bull_time_stop': 131, 'bull_use_sma': True, 'bull_use_ema': False, 'bull_use_atr': True, 'bull_use_adx': True, 'bull_use_spike': True, 'bull_rsi_required': True, 'bear_strategy': 'mean_reversion', 'bear_bb_std_mult': 3.1737516330420847, 'bear_rsi_os': 9, 'bear_rsi_ob': 61, 'bear_adx_thresh': 9.337620259831144, 'bear_atr_min_pct': 0.025725291401717865, 'bear_atr_max_pct': 0.10599509661100473, 'bear_tp_mult': 1.246177673728725, 'bear_tsl_mult': 0.793664359495545, 'bear_time_stop': 295, 'bear_use_sma': True, 'bear_use_ema': True, 'bear_use_atr': False, 'bear_use_adx': False, 'bear_use_spike': False, 'bear_rsi_required': False, 'sideways_strategy': 'mean_reversion', 'sideways_bb_std_mult': 2.566656878672796, 'sideways_rsi_os': 18, 'sideways_rsi_ob': 84, 'sideways_adx_thresh': 10.728096533652748, 'sideways_atr_min_pct': 0.006156082249795326, 'sideways_atr_max_pct': 0.11752118646851595, 'sideways_tp_mult': 1.323301033197623, 'sideways_tsl_mult': 0.3624749090242146, 'sideways_time_stop': 97, 'sideways_use_sma': False, 'sideways_use_ema': True, 'sideways_use_atr': True, 'sideways_use_adx': False, 'sideways_use_spike': True, 'sideways_rsi_required': True}.
[I 2025-09-01 14:18:58,165] Trial 172 finished with values: [-1000000000.0, 1000000000.0] and parameters: {'p_sma': 55, 'p_std': 46, 'p_atr': 27, 'p_adx': 29, 'rsi_period': 66, 'ema1': 27, 'ema2': 45, 'slip_atr_k': 0.0614995947741923, 'slip_spread_k': 0.38226432716893, 'spread_hl_frac': 0.009195820053462908, 'bb_std_mult': 2.3670410175649605, 'rsi_os': 31, 'rsi_ob': 72, 'vol_spike': 0.03238252302732263, 'adx_thresh': 18.151981126224012, 'atr_min_pct': 0.011805599293029954, 'atr_max_pct': 0.08007327280359701, 'tp_mult': 2.63491000116467, 'tsl_mult': 0.3240199099300723, 'strategy': 'breakout', 'time_stop': 30, 'use_sma': False, 'use_atr': True, 'use_adx': True, 'use_ema': False, 'use_spike': False, 'rsi_required': False, 'edge_k': 1.973067918798303, 'edge_cap': 0.8741285079155874, 'bull_strategy': 'mean_reversion', 'bull_bb_std_mult': 1.3974921282427595, 'bull_rsi_os': 9, 'bull_rsi_ob': 81, 'bull_adx_thresh': 13.623663457517804, 'bull_atr_min_pct': 0.0037748522031953538, 'bull_atr_max_pct': 0.03341766991796808, 'bull_tp_mult': 1.8636868150602197, 'bull_tsl_mult': 0.22479279813478292, 'bull_time_stop': 254, 'bull_use_sma': True, 'bull_use_ema': False, 'bull_use_atr': True, 'bull_use_adx': True, 'bull_use_spike': False, 'bull_rsi_required': True, 'bear_strategy': 'mean_reversion', 'bear_bb_std_mult': 3.073212650635562, 'bear_rsi_os': 9, 'bear_rsi_ob': 60, 'bear_adx_thresh': 9.437983773783435, 'bear_atr_min_pct': 0.02616747897242003, 'bear_atr_max_pct': 0.09892987993564764, 'bear_tp_mult': 2.6228220706370844, 'bear_tsl_mult': 0.7956945551061694, 'bear_time_stop': 296, 'bear_use_sma': True, 'bear_use_ema': False, 'bear_use_atr': False, 'bear_use_adx': False, 'bear_use_spike': False, 'bear_rsi_required': False, 'sideways_strategy': 'mean_reversion', 'sideways_bb_std_mult': 0.9908661889436994, 'sideways_rsi_os': 18, 'sideways_rsi_ob': 85, 'sideways_adx_thresh': 10.972494759705343, 'sideways_atr_min_pct': 0.006261576515175758, 'sideways_atr_max_pct': 0.12437280719235834, 'sideways_tp_mult': 1.5644794539049351, 'sideways_tsl_mult': 0.3694592440257787, 'sideways_time_stop': 102, 'sideways_use_sma': False, 'sideways_use_ema': False, 'sideways_use_atr': True, 'sideways_use_adx': False, 'sideways_use_spike': True, 'sideways_rsi_required': True}.
