[I 2025-09-01 13:57:38,135] Trial 27 finished with values: [-1000000000.0, 1000000000.0] and parameters: {'p_sma': 39, 'p_std': 48, 'p_atr': 25, 'p_adx': 21, 'rsi_period': 40, 'ema1': 18, 'ema2': 41, 'slip_atr_k': 0.21808141210969623, 'slip_spread_k': 0.5368485910699385, 'spread_hl_frac': 0.021874255862199016, 'bb_std_mult': 2.4175160342779884, 'rsi_os': 12, 'rsi_ob': 69, 'vol_spike': 0.05506173225760798, 'adx_thresh': 23.2524886784791, 'atr_min_pct': 0.011118991195282861, 'atr_max_pct': 0.12697677135339613, 'tp_mult': 1.711881622488252, 'tsl_mult': 0.1644305338990833, 'strategy': 'mean_reversion', 'time_stop': 151, 'use_sma': False, 'use_atr': False, 'use_adx': True, 'use_ema': False, 'use_spike': False, 'rsi_required': True, 'edge_k': 0.9391997651140175, 'edge_cap': 0.8114353170088185, 'bull_strategy': 'mean_reversion', 'bull_bb_std_mult': 1.8700903573437684, 'bull_rsi_os': 32, 'bull_rsi_ob': 51, 'bull_adx_thresh': 9.793178438529063, 'bull_atr_min_pct': 0.006696947630867102, 'bull_atr_max_pct': 0.08204049331067852, 'bull_tp_mult': 1.7018529324583755, 'bull_tsl_mult': 0.126229192422964, 'bull_time_stop': 105, 'bull_use_sma': True, 'bull_use_ema': True, 'bull_use_atr': True, 'bull_use_adx': True, 'bull_use_spike': True, 'bull_rsi_required': True, 'bear_strategy': 'breakout', 'bear_bb_std_mult': 1.3207138273059942, 'bear_rsi_os': 15, 'bear_rsi_ob': 89, 'bear_adx_thresh': 5.201126360553106, 'bear_atr_min_pct': 0.017026478259330503, 'bear_atr_max_pct': 0.012451275174980212, 'bear_tp_mult': 2.765936070127074, 'bear_tsl_mult': 0.2888125950699987, 'bear_time_stop': 261, 'bear_use_sma': True, 'bear_use_ema': False, 'bear_use_atr': True, 'bear_use_adx': False, 'bear_use_spike': True, 'bear_rsi_required': True, 'sideways_strategy': 'breakout', 'sideways_bb_std_mult': 3.0470455730344597, 'sideways_rsi_os': 22, 'sideways_rsi_ob': 50, 'sideways_adx_thresh': 22.020640922621254, 'sideways_atr_min_pct': 0.010251642396144432, 'sideways_atr_max_pct': 0.07661076684484427, 'sideways_tp_mult': 2.1340313183318296, 'sideways_tsl_mult': 0.6072767276270132, 'sideways_time_stop': 126, 'sideways_use_sma': True, 'sideways_use_ema': False, 'sideways_use_atr': True, 'sideways_use_adx': True, 'sideways_use_spike': False, 'sideways_rsi_required': False}.
[I 2025-09-01 13:57:38,475] Trial 29 finished with values: [-1000000000.0, 1000000000.0] and parameters: {'p_sma': 24, 'p_std': 43, 'p_atr': 25, 'p_adx': 21, 'rsi_period': 41, 'ema1': 18, 'ema2': 40, 'slip_atr_k': 0.2166466021914595, 'slip_spread_k': 0.40069257405451264, 'spread_hl_frac': 0.021614906168543387, 'bb_std_mult': 2.321270707104591, 'rsi_os': 13, 'rsi_ob': 67, 'vol_spike': 0.1311560084145783, 'adx_thresh': 23.443080154511048, 'atr_min_pct': 0.012490471057066636, 'atr_max_pct': 0.08653568078451217, 'tp_mult': 1.3819272775643792, 'tsl_mult': 0.1841666437593273, 'strategy': 'mean_reversion', 'time_stop': 161, 'use_sma': False, 'use_atr': False, 'use_adx': True, 'use_ema': False, 'use_spike': False, 'rsi_required': True, 'edge_k': 0.9103968551564897, 'edge_cap': 0.8085602108611039, 'bull_strategy': 'mean_reversion', 'bull_bb_std_mult': 0.9736566673936703, 'bull_rsi_os': 31, 'bull_rsi_ob': 51, 'bull_adx_thresh': 8.932951964520846, 'bull_atr_min_pct': 0.006521958957202922, 'bull_atr_max_pct': 0.08552333374093066, 'bull_tp_mult': 1.7151652528589127, 'bull_tsl_mult': 0.16270706901241522, 'bull_time_stop': 120, 'bull_use_sma': True, 'bull_use_ema': True, 'bull_use_atr': True, 'bull_use_adx': True, 'bull_use_spike': True, 'bull_rsi_required': True, 'bear_strategy': 'breakout', 'bear_bb_std_mult': 1.4241342548591673, 'bear_rsi_os': 11, 'bear_rsi_ob': 89, 'bear_adx_thresh': 12.305504845426068, 'bear_atr_min_pct': 0.016974684410619414, 'bear_atr_max_pct': 0.037318159513519425, 'bear_tp_mult': 2.8045265665859467, 'bear_tsl_mult': 0.5104110386134996, 'bear_time_stop': 249, 'bear_use_sma': True, 'bear_use_ema': False, 'bear_use_atr': True, 'bear_use_adx': False, 'bear_use_spike': True, 'bear_rsi_required': True, 'sideways_strategy': 'breakout', 'sideways_bb_std_mult': 2.6965403917171895, 'sideways_rsi_os': 21, 'sideways_rsi_ob': 49, 'sideways_adx_thresh': 20.37235932510757, 'sideways_atr_min_pct': 0.010054112524195398, 'sideways_atr_max_pct': 0.07255394324052766, 'sideways_tp_mult': 2.6907840297822214, 'sideways_tsl_mult': 0.6221730232348909, 'sideways_time_stop': 105, 'sideways_use_sma': True, 'sideways_use_ema': False, 'sideways_use_atr': True, 'sideways_use_adx': True, 'sideways_use_spike': False, 'sideways_rsi_required': False}.
[I 2025-09-01 13:57:38,702] Trial 26 finished with values: [-0.018854802065271348, 0.018884712655357305] and parameters: {'p_sma': 40, 'p_std': 50, 'p_atr': 25, 'p_adx': 20, 'rsi_period': 60, 'ema1': 26, 'ema2': 41, 'slip_atr_k': 0.22577034684361003, 'slip_spread_k': 0.5785529703802492, 'spread_hl_frac': 0.020437899002620212, 'bb_std_mult': 2.412108453037875, 'rsi_os': 12, 'rsi_ob': 69, 'vol_spike': 0.06454965038791873, 'adx_thresh': 10.720262960211235, 'atr_min_pct': 0.009987375686026017, 'atr_max_pct': 0.12132568226621068, 'tp_mult': 1.735154316447818, 'tsl_mult': 0.4290481762519669, 'strategy': 'mean_reversion', 'time_stop': 81, 'use_sma': False, 'use_atr': False, 'use_adx': True, 'use_ema': False, 'use_spike': False, 'rsi_required': True, 'edge_k': 0.8797316110819756, 'edge_cap': 0.8052574626331921, 'bull_strategy': 'mean_reversion', 'bull_bb_std_mult': 1.072594307795216, 'bull_rsi_os': 32, 'bull_rsi_ob': 52, 'bull_adx_thresh': 16.77675964784368, 'bull_atr_min_pct': 0.0003872129643722466, 'bull_atr_max_pct': 0.11944366580349794, 'bull_tp_mult': 1.371487933327217, 'bull_tsl_mult': 0.440427782171526, 'bull_time_stop': 114, 'bull_use_sma': True, 'bull_use_ema': True, 'bull_use_atr': True, 'bull_use_adx': True, 'bull_use_spike': True, 'bull_rsi_required': True, 'bear_strategy': 'breakout', 'bear_bb_std_mult': 1.3623234245328557, 'bear_rsi_os': 13, 'bear_rsi_ob': 90, 'bear_adx_thresh': 14.015777239001121, 'bear_atr_min_pct': 0.01728869597150703, 'bear_atr_max_pct': 0.015454614390644893, 'bear_tp_mult': 2.7701615733591898, 'bear_tsl_mult': 0.25028211812337864, 'bear_time_stop': 270, 'bear_use_sma': True, 'bear_use_ema': False, 'bear_use_atr': True, 'bear_use_adx': False, 'bear_use_spike': True, 'bear_rsi_required': True, 'sideways_strategy': 'breakout', 'sideways_bb_std_mult': 2.973626935899679, 'sideways_rsi_os': 22, 'sideways_rsi_ob': 54, 'sideways_adx_thresh': 22.798266857250297, 'sideways_atr_min_pct': 0.009163196230307896, 'sideways_atr_max_pct': 0.07678713681070039, 'sideways_tp_mult': 2.1365706984380486, 'sideways_tsl_mult': 0.44188194217293963, 'sideways_time_stop': 128, 'sideways_use_sma': True, 'sideways_use_ema': False, 'sideways_use_atr': True, 'sideways_use_adx': True, 'sideways_use_spike': False, 'sideways_rsi_required': False}.
[I 2025-09-01 13:58:14,979] Trial 31 finished with values: [-1000000000.0, 1000000000.0] and parameters: {'p_sma': 43, 'p_std': 53, 'p_atr': 27, 'p_adx': 26, 'rsi_period': 63, 'ema1': 23, 'ema2': 51, 'slip_atr_k': 0.14571253932483924, 'slip_spread_k': 0.18918554418301464, 'spread_hl_frac': 0.01045316592449367, 'bb_std_mult': 1.6599554312952356, 'rsi_os': 5, 'rsi_ob': 75, 'vol_spike': 0.1877147597948432, 'adx_thresh': 11.605386957158355, 'atr_min_pct': 0.003780358426566382, 'atr_max_pct': 0.13319238820492274, 'tp_mult': 2.149662033332869, 'tsl_mult': 0.4399832464550766, 'strategy': 'mean_reversion', 'time_stop': 222, 'use_sma': False, 'use_atr': False, 'use_adx': True, 'use_ema': False, 'use_spike': False, 'rsi_required': True, 'edge_k': 0.7576026764454946, 'edge_cap': 0.5852268158359756, 'bull_strategy': 'mean_reversion', 'bull_bb_std_mult': 1.7359159797753265, 'bull_rsi_os': 45, 'bull_rsi_ob': 64, 'bull_adx_thresh': 12.109510981566185, 'bull_atr_min_pct': 0.0029338650698746156, 'bull_atr_max_pct': 0.1148088256393815, 'bull_tp_mult': 1.2601972930579106, 'bull_tsl_mult': 0.30167687008435823, 'bull_time_stop': 165, 'bull_use_sma': True, 'bull_use_ema': True, 'bull_use_atr': True, 'bull_use_adx': True, 'bull_use_spike': True, 'bull_rsi_required': True, 'bear_strategy': 'breakout', 'bear_bb_std_mult': 0.9804230933416657, 'bear_rsi_os': 19, 'bear_rsi_ob': 78, 'bear_adx_thresh': 7.928277815184938, 'bear_atr_min_pct': 0.0217239624594688, 'bear_atr_max_pct': 0.028154834868147405, 'bear_tp_mult': 2.419418670279788, 'bear_tsl_mult': 0.32179031560570115, 'bear_time_stop': 174, 'bear_use_sma': True, 'bear_use_ema': False, 'bear_use_atr': True, 'bear_use_adx': False, 'bear_use_spike': True, 'bear_rsi_required': True, 'sideways_strategy': 'breakout', 'sideways_bb_std_mult': 2.6124174363167594, 'sideways_rsi_os': 26, 'sideways_rsi_ob': 87, 'sideways_adx_thresh': 29.72663461527839, 'sideways_atr_min_pct': 0.003915564483342705, 'sideways_atr_max_pct': 0.032558305732403925, 'sideways_tp_mult': 1.8483863664731828, 'sideways_tsl_mult': 0.4238025132633158, 'sideways_time_stop': 165, 'sideways_use_sma': True, 'sideways_use_ema': False, 'sideways_use_atr': True, 'sideways_use_adx': True, 'sideways_use_spike': False, 'sideways_rsi_required': False}.
[I 2025-09-01 13:58:15,002] Trial 32 finished with values: [-1000000000.0, 1000000000.0] and parameters: {'p_sma': 54, 'p_std': 42, 'p_atr': 27, 'p_adx': 26, 'rsi_period': 62, 'ema1': 23, 'ema2': 50, 'slip_atr_k': 0.03554323249977505, 'slip_spread_k': 0.1834447305424492, 'spread_hl_frac': 0.00874898712190687, 'bb_std_mult': 3.0862778034291938, 'rsi_os': 24, 'rsi_ob': 75, 'vol_spike': 0.17491089538553325, 'adx_thresh': 31.870238518345303, 'atr_min_pct': 0.0034763803220504413, 'atr_max_pct': 0.11096751470728373, 'tp_mult': 2.2331823342167327, 'tsl_mult': 0.4390173687527658, 'strategy': 'mean_reversion', 'time_stop': 213, 'use_sma': False, 'use_atr': False, 'use_adx': True, 'use_ema': False, 'use_spike': False, 'rsi_required': True, 'edge_k': 0.7591992924490504, 'edge_cap': 0.9869104542092126, 'bull_strategy': 'mean_reversion', 'bull_bb_std_mult': 1.7735110890671821, 'bull_rsi_os': 46, 'bull_rsi_ob': 62, 'bull_adx_thresh': 12.641662874736154, 'bull_atr_min_pct': 0.0027979426287165926, 'bull_atr_max_pct': 0.1141619111536856, 'bull_tp_mult': 1.2644451329639774, 'bull_tsl_mult': 0.3013375555283824, 'bull_time_stop': 43, 'bull_use_sma': True, 'bull_use_ema': True, 'bull_use_atr': True, 'bull_use_adx': True, 'bull_use_spike': True, 'bull_rsi_required': True, 'bear_strategy': 'breakout', 'bear_bb_std_mult': 1.8696279519744619, 'bear_rsi_os': 21, 'bear_rsi_ob': 78, 'bear_adx_thresh': 12.037753752302624, 'bear_atr_min_pct': 0.02237901647466644, 'bear_atr_max_pct': 0.023935153920527415, 'bear_tp_mult': 2.426375317326527, 'bear_tsl_mult': 0.3275902218650403, 'bear_time_stop': 186, 'bear_use_sma': True, 'bear_use_ema': False, 'bear_use_atr': True, 'bear_use_adx': False, 'bear_use_spike': True, 'bear_rsi_required': True, 'sideways_strategy': 'breakout', 'sideways_bb_std_mult': 2.61741988895336, 'sideways_rsi_os': 26, 'sideways_rsi_ob': 64, 'sideways_adx_thresh': 24.516800205757455, 'sideways_atr_min_pct': 0.003731346348884024, 'sideways_atr_max_pct': 0.031070285345970304, 'sideways_tp_mult': 1.794328016633178, 'sideways_tsl_mult': 0.4248982716704552, 'sideways_time_stop': 165, 'sideways_use_sma': True, 'sideways_use_ema': False, 'sideways_use_atr': True, 'sideways_use_adx': True, 'sideways_use_spike': False, 'sideways_rsi_required': False}.
[I 2025-09-01 13:58:15,618] Trial 33 finished with values: [-1000000000.0, 1000000000.0] and parameters: {'p_sma': 51, 'p_std': 41, 'p_atr': 19, 'p_adx': 26, 'rsi_period': 65, 'ema1': 23, 'ema2': 49, 'slip_atr_k': 0.14601590930522942, 'slip_spread_k': 0.16450947392380433, 'spread_hl_frac': 0.028521868794514925, 'bb_std_mult': 1.6571489763832385, 'rsi_os': 6, 'rsi_ob': 76, 'vol_spike': 0.1883059706712458, 'adx_thresh': 32.00642323357993, 'atr_min_pct': 0.00456537551850314, 'atr_max_pct': 0.1376668178902625, 'tp_mult': 2.176455038049976, 'tsl_mult': 0.4417103653479407, 'strategy': 'mean_reversion', 'time_stop': 212, 'use_sma': False, 'use_atr': False, 'use_adx': True, 'use_ema': False, 'use_spike': False, 'rsi_required': True, 'edge_k': 0.7593631946218875, 'edge_cap': 0.9929941457517735, 'bull_strategy': 'mean_reversion', 'bull_bb_std_mult': 1.7687140444877705, 'bull_rsi_os': 46, 'bull_rsi_ob': 63, 'bull_adx_thresh': 12.423420231126057, 'bull_atr_min_pct': 0.0028964931110057866, 'bull_atr_max_pct': 0.13807588485986536, 'bull_tp_mult': 1.2440603120767986, 'bull_tsl_mult': 0.2793763404388242, 'bull_time_stop': 163, 'bull_use_sma': True, 'bull_use_ema': True, 'bull_use_atr': True, 'bull_use_adx': True, 'bull_use_spike': True, 'bull_rsi_required': True, 'bear_strategy': 'breakout', 'bear_bb_std_mult': 0.8489279798682787, 'bear_rsi_os': 21, 'bear_rsi_ob': 78, 'bear_adx_thresh': 7.74412622627089, 'bear_atr_min_pct': 0.02288213886631004, 'bear_atr_max_pct': 0.02442983150749204, 'bear_tp_mult': 2.423360420356759, 'bear_tsl_mult': 0.45794906687077114, 'bear_time_stop': 174, 'bear_use_sma': True, 'bear_use_ema': False, 'bear_use_atr': True, 'bear_use_adx': False, 'bear_use_spike': True, 'bear_rsi_required': True, 'sideways_strategy': 'breakout', 'sideways_bb_std_mult': 2.6550671769367344, 'sideways_rsi_os': 28, 'sideways_rsi_ob': 62, 'sideways_adx_thresh': 29.271527309218513, 'sideways_atr_min_pct': 0.01497538148215986, 'sideways_atr_max_pct': 0.06061680700276556, 'sideways_tp_mult': 1.843802313236858, 'sideways_tsl_mult': 0.7974778643797696, 'sideways_time_stop': 165, 'sideways_use_sma': True, 'sideways_use_ema': False, 'sideways_use_atr': True, 'sideways_use_adx': True, 'sideways_use_spike': False, 'sideways_rsi_required': False}.
[I 2025-09-01 13:58:15,618] Trial 30 finished with values: [-1000000000.0, 1000000000.0] and parameters: {'p_sma': 51, 'p_std': 53, 'p_atr': 20, 'p_adx': 19, 'rsi_period': 17, 'ema1': 23, 'ema2': 49, 'slip_atr_k': 0.14437767831040574, 'slip_spread_k': 0.18835227993842624, 'spread_hl_frac': 0.00955213169043316, 'bb_std_mult': 1.6218531201867843, 'rsi_os': 22, 'rsi_ob': 74, 'vol_spike': 0.06358278080096824, 'adx_thresh': 31.26855099858517, 'atr_min_pct': 0.004215254271257712, 'atr_max_pct': 0.1352767079789925, 'tp_mult': 2.1635203834061913, 'tsl_mult': 0.4049338602272621, 'strategy': 'mean_reversion', 'time_stop': 217, 'use_sma': False, 'use_atr': False, 'use_adx': True, 'use_ema': False, 'use_spike': False, 'rsi_required': True, 'edge_k': 0.7753319536578429, 'edge_cap': 0.5683653022514819, 'bull_strategy': 'mean_reversion', 'bull_bb_std_mult': 1.7842062416212718, 'bull_rsi_os': 46, 'bull_rsi_ob': 63, 'bull_adx_thresh': 13.01461465256817, 'bull_atr_min_pct': 0.00285015729683697, 'bull_atr_max_pct': 0.1142881917550242, 'bull_tp_mult': 1.315744982530185, 'bull_tsl_mult': 0.2877009446685131, 'bull_time_stop': 165, 'bull_use_sma': True, 'bull_use_ema': True, 'bull_use_atr': True, 'bull_use_adx': True, 'bull_use_spike': True, 'bull_rsi_required': True, 'bear_strategy': 'breakout', 'bear_bb_std_mult': 1.8686677807563563, 'bear_rsi_os': 20, 'bear_rsi_ob': 78, 'bear_adx_thresh': 12.030481270243111, 'bear_atr_min_pct': 0.02259700465779111, 'bear_atr_max_pct': 0.0247814209147944, 'bear_tp_mult': 2.447142801174733, 'bear_tsl_mult': 0.3179574558950407, 'bear_time_stop': 177, 'bear_use_sma': True, 'bear_use_ema': False, 'bear_use_atr': True, 'bear_use_adx': False, 'bear_use_spike': True, 'bear_rsi_required': True, 'sideways_strategy': 'breakout', 'sideways_bb_std_mult': 3.302058866505017, 'sideways_rsi_os': 27, 'sideways_rsi_ob': 56, 'sideways_adx_thresh': 29.76338130795873, 'sideways_atr_min_pct': 0.0044423643053922435, 'sideways_atr_max_pct': 0.03621844916554117, 'sideways_tp_mult': 1.870535519299241, 'sideways_tsl_mult': 0.802365566857991, 'sideways_time_stop': 61, 'sideways_use_sma': True, 'sideways_use_ema': False, 'sideways_use_atr': True, 'sideways_use_adx': True, 'sideways_use_spike': False, 'sideways_rsi_required': False}.
[I 2025-09-01 13:58:16,009] Trial 37 finished with values: [-1000000000.0, 1000000000.0] and parameters: {'p_sma': 35, 'p_std': 37, 'p_atr': 23, 'p_adx': 22, 'rsi_period': 54, 'ema1': 19, 'ema2': 37, 'slip_atr_k': 0.1992479567922004, 'slip_spread_k': 0.42156907940845056, 'spread_hl_frac': 0.028122806690973383, 'bb_std_mult': 2.1515807230741806, 'rsi_os': 32, 'rsi_ob': 45, 'vol_spike': 0.07184043749498391, 'adx_thresh': 21.02477397725287, 'atr_min_pct': 0.013713001593228129, 'atr_max_pct': 0.11813821363779245, 'tp_mult': 1.803030072919473, 'tsl_mult': 0.07987380232101954, 'strategy': 'mean_reversion', 'time_stop': 93, 'use_sma': False, 'use_atr': False, 'use_adx': True, 'use_ema': False, 'use_spike': False, 'rsi_required': True, 'edge_k': 0.4691037584779699, 'edge_cap': 0.23720507002819619, 'bull_strategy': 'mean_reversion', 'bull_bb_std_mult': 0.8382107922609259, 'bull_rsi_os': 36, 'bull_rsi_ob': 48, 'bull_adx_thresh': 7.814303703554762, 'bull_atr_min_pct': 0.013847965020309565, 'bull_atr_max_pct': 0.13443425620015423, 'bull_tp_mult': 2.141197916659582, 'bull_tsl_mult': 0.4333337011688243, 'bull_time_stop': 92, 'bull_use_sma': True, 'bull_use_ema': True, 'bull_use_atr': True, 'bull_use_adx': True, 'bull_use_spike': True, 'bull_rsi_required': True, 'bear_strategy': 'breakout', 'bear_bb_std_mult': 1.1425798734091102, 'bear_rsi_os': 13, 'bear_rsi_ob': 92, 'bear_adx_thresh': 15.725895976798865, 'bear_atr_min_pct': 0.014934722749815386, 'bear_atr_max_pct': 0.04098264690241822, 'bear_tp_mult': 2.9222399034706013, 'bear_tsl_mult': 0.12977902830995341, 'bear_time_stop': 135, 'bear_use_sma': True, 'bear_use_ema': False, 'bear_use_atr': True, 'bear_use_adx': False, 'bear_use_spike': True, 'bear_rsi_required': False, 'sideways_strategy': 'breakout', 'sideways_bb_std_mult': 3.309983175194911, 'sideways_rsi_os': 33, 'sideways_rsi_ob': 57, 'sideways_adx_thresh': 25.33341281255773, 'sideways_atr_min_pct': 0.007935321745412496, 'sideways_atr_max_pct': 0.08261236519032598, 'sideways_tp_mult': 2.100246429122666, 'sideways_tsl_mult': 0.7069586740532796, 'sideways_time_stop': 94, 'sideways_use_sma': True, 'sideways_use_ema': False, 'sideways_use_atr': False, 'sideways_use_adx': True, 'sideways_use_spike': True, 'sideways_rsi_required': False}.
[I 2025-09-01 13:58:53,592] Trial 35 finished with values: [-1000000000.0, 1000000000.0] and parameters: {'p_sma': 35, 'p_std': 54, 'p_atr': 20, 'p_adx': 19, 'rsi_period': 51, 'ema1': 19, 'ema2': 45, 'slip_atr_k': 0.19607093568403375, 'slip_spread_k': 0.4097791151277371, 'spread_hl_frac': 0.029850721370314248, 'bb_std_mult': 2.14442680676239, 'rsi_os': 32, 'rsi_ob': 67, 'vol_spike': 0.07089167788291476, 'adx_thresh': 21.82800992412847, 'atr_min_pct': 0.009902430203154807, 'atr_max_pct': 0.1357767760628601, 'tp_mult': 1.836467052136033, 'tsl_mult': 0.3746850407108, 'strategy': 'mean_reversion', 'time_stop': 64, 'use_sma': False, 'use_atr': False, 'use_adx': True, 'use_ema': False, 'use_spike': False, 'rsi_required': True, 'edge_k': 0.4699334566527389, 'edge_cap': 0.7362400433943985, 'bull_strategy': 'mean_reversion', 'bull_bb_std_mult': 0.8376539448118627, 'bull_rsi_os': 26, 'bull_rsi_ob': 53, 'bull_adx_thresh': 7.027495763350391, 'bull_atr_min_pct': 0.013651769662182189, 'bull_atr_max_pct': 0.13005381755800505, 'bull_tp_mult': 2.11201086718375, 'bull_tsl_mult': 0.4761471848793726, 'bull_time_stop': 96, 'bull_use_sma': True, 'bull_use_ema': True, 'bull_use_atr': True, 'bull_use_adx': True, 'bull_use_spike': True, 'bull_rsi_required': True, 'bear_strategy': 'breakout', 'bear_bb_std_mult': 0.7840361706571525, 'bear_rsi_os': 13, 'bear_rsi_ob': 79, 'bear_adx_thresh': 14.640021903587776, 'bear_atr_min_pct': 0.024750318983342755, 'bear_atr_max_pct': 0.0404923238557705, 'bear_tp_mult': 2.5096962013287527, 'bear_tsl_mult': 0.17323952734811196, 'bear_time_stop': 153, 'bear_use_sma': True, 'bear_use_ema': False, 'bear_use_atr': True, 'bear_use_adx': False, 'bear_use_spike': True, 'bear_rsi_required': True, 'sideways_strategy': 'breakout', 'sideways_bb_std_mult': 3.3112566584660565, 'sideways_rsi_os': 34, 'sideways_rsi_ob': 57, 'sideways_adx_thresh': 24.83792440514903, 'sideways_atr_min_pct': 0.015936915657331553, 'sideways_atr_max_pct': 0.06114269515313871, 'sideways_tp_mult': 2.4116188633347004, 'sideways_tsl_mult': 0.7697244677044868, 'sideways_time_stop': 65, 'sideways_use_sma': True, 'sideways_use_ema': False, 'sideways_use_atr': True, 'sideways_use_adx': True, 'sideways_use_spike': False, 'sideways_rsi_required': False}.
