[I 2025-09-01 14:45:11,884] Trial 341 finished with values: [-1000000000.0, 1000000000.0] and parameters: {'p_sma': 48, 'p_std': 14, 'p_atr': 19, 'p_adx': 19, 'rsi_period': 66, 'ema1': 30, 'ema2': 23, 'slip_atr_k': 0.05352797020568354, 'slip_spread_k': 0.12400602153040874, 'spread_hl_frac': 0.041111285885243834, 'bb_std_mult': 1.3028581079799562, 'rsi_os': 37, 'rsi_ob': 71, 'vol_spike': 0.11114912950622702, 'adx_thresh': 11.750684845144878, 'atr_min_pct': 0.01728278453795732, 'atr_max_pct': 0.07593461836455088, 'tp_mult': 1.9829077143383194, 'tsl_mult': 0.12400660181805173, 'strategy': 'breakout', 'time_stop': 184, 'use_sma': False, 'use_atr': False, 'use_adx': True, 'use_ema': True, 'use_spike': True, 'rsi_required': True, 'edge_k': 1.334556407565728, 'edge_cap': 0.0701498764549317, 'bull_strategy': 'breakout', 'bull_bb_std_mult': 2.250405501610693, 'bull_rsi_os': 19, 'bull_rsi_ob': 49, 'bull_adx_thresh': 11.563496963460883, 'bull_atr_min_pct': 0.008874953848575994, 'bull_atr_max_pct': 0.14464485561380547, 'bull_tp_mult': 1.9627604834309578, 'bull_tsl_mult': 0.3205474984216569, 'bull_time_stop': 159, 'bull_use_sma': True, 'bull_use_ema': False, 'bull_use_atr': False, 'bull_use_adx': True, 'bull_use_spike': True, 'bull_rsi_required': True, 'bear_strategy': 'mean_reversion', 'bear_bb_std_mult': 0.5103941694166139, 'bear_rsi_os': 9, 'bear_rsi_ob': 77, 'bear_adx_thresh': 8.231113860460868, 'bear_atr_min_pct': 0.022693705062099424, 'bear_atr_max_pct': 0.1416910190368863, 'bear_tp_mult': 1.5793898085706153, 'bear_tsl_mult': 0.6754048195983965, 'bear_time_stop': 70, 'bear_use_sma': False, 'bear_use_ema': True, 'bear_use_atr': False, 'bear_use_adx': True, 'bear_use_spike': True, 'bear_rsi_required': False, 'sideways_strategy': 'breakout', 'sideways_bb_std_mult': 3.3427539660634777, 'sideways_rsi_os': 15, 'sideways_rsi_ob': 91, 'sideways_adx_thresh': 17.711238501344187, 'sideways_atr_min_pct': 0.0031476162348813923, 'sideways_atr_max_pct': 0.06239639896374728, 'sideways_tp_mult': 1.7980416488886022, 'sideways_tsl_mult': 0.2621942409647504, 'sideways_time_stop': 70, 'sideways_use_sma': True, 'sideways_use_ema': True, 'sideways_use_atr': True, 'sideways_use_adx': False, 'sideways_use_spike': True, 'sideways_rsi_required': True}.
[I 2025-09-01 14:45:12,007] Trial 340 finished with values: [-1000000000.0, 1000000000.0] and parameters: {'p_sma': 11, 'p_std': 14, 'p_atr': 19, 'p_adx': 24, 'rsi_period': 67, 'ema1': 17, 'ema2': 49, 'slip_atr_k': 0.045005412860598185, 'slip_spread_k': 0.4648575092725278, 'spread_hl_frac': 0.0022969107367479015, 'bb_std_mult': 2.918446908236591, 'rsi_os': 44, 'rsi_ob': 71, 'vol_spike': 0.2849818088958302, 'adx_thresh': 11.47937322749134, 'atr_min_pct': 0.017635379227330668, 'atr_max_pct': 0.14992550396007517, 'tp_mult': 1.6172971254585835, 'tsl_mult': 0.03717448572062991, 'strategy': 'breakout', 'time_stop': 5, 'use_sma': False, 'use_atr': False, 'use_adx': False, 'use_ema': True, 'use_spike': True, 'rsi_required': True, 'edge_k': 0.3162379269188743, 'edge_cap': 0.07375593165174885, 'bull_strategy': 'mean_reversion', 'bull_bb_std_mult': 2.871641788964647, 'bull_rsi_os': 20, 'bull_rsi_ob': 49, 'bull_adx_thresh': 24.7620643980646, 'bull_atr_min_pct': 0.006423420454116232, 'bull_atr_max_pct': 0.021745852824455184, 'bull_tp_mult': 2.9815785989881998, 'bull_tsl_mult': 0.5907677612509082, 'bull_time_stop': 163, 'bull_use_sma': False, 'bull_use_ema': True, 'bull_use_atr': True, 'bull_use_adx': True, 'bull_use_spike': True, 'bull_rsi_required': False, 'bear_strategy': 'mean_reversion', 'bear_bb_std_mult': 0.9483668102178233, 'bear_rsi_os': 9, 'bear_rsi_ob': 79, 'bear_adx_thresh': 25.691748277694, 'bear_atr_min_pct': 0.012267122727334809, 'bear_atr_max_pct': 0.11174231393413932, 'bear_tp_mult': 2.466092518935594, 'bear_tsl_mult': 0.8132111612914243, 'bear_time_stop': 277, 'bear_use_sma': False, 'bear_use_ema': True, 'bear_use_atr': True, 'bear_use_adx': False, 'bear_use_spike': True, 'bear_rsi_required': False, 'sideways_strategy': 'breakout', 'sideways_bb_std_mult': 3.321928900995391, 'sideways_rsi_os': 15, 'sideways_rsi_ob': 91, 'sideways_adx_thresh': 7.526708421211865, 'sideways_atr_min_pct': 0.006052984708448109, 'sideways_atr_max_pct': 0.13333068419503993, 'sideways_tp_mult': 1.8958874628135833, 'sideways_tsl_mult': 0.27038811395467577, 'sideways_time_stop': 116, 'sideways_use_sma': True, 'sideways_use_ema': True, 'sideways_use_atr': True, 'sideways_use_adx': False, 'sideways_use_spike': True, 'sideways_rsi_required': True}.
[I 2025-09-01 14:45:49,640] Trial 346 finished with values: [-1000000000.0, 1000000000.0] and parameters: {'p_sma': 56, 'p_std': 9, 'p_atr': 17, 'p_adx': 23, 'rsi_period': 67, 'ema1': 11, 'ema2': 53, 'slip_atr_k': 0.06804627941316835, 'slip_spread_k': 0.5938306610921902, 'spread_hl_frac': 0.01631947013682134, 'bb_std_mult': 1.9306193375064618, 'rsi_os': 35, 'rsi_ob': 65, 'vol_spike': 0.13046028775748347, 'adx_thresh': 21.85644171348443, 'atr_min_pct': 0.015230429519758885, 'atr_max_pct': 0.14312633973039918, 'tp_mult': 1.591774985494566, 'tsl_mult': 0.003639814582955099, 'strategy': 'breakout', 'time_stop': 217, 'use_sma': False, 'use_atr': True, 'use_adx': True, 'use_ema': False, 'use_spike': True, 'rsi_required': False, 'edge_k': 0.5904473500444817, 'edge_cap': 0.10019369300972195, 'bull_strategy': 'breakout', 'bull_bb_std_mult': 2.864909081938556, 'bull_rsi_os': 16, 'bull_rsi_ob': 92, 'bull_adx_thresh': 5.567047901590353, 'bull_atr_min_pct': 0.021935434401327454, 'bull_atr_max_pct': 0.024131078779399857, 'bull_tp_mult': 2.0743756748514603, 'bull_tsl_mult': 0.3455364000768446, 'bull_time_stop': 147, 'bull_use_sma': True, 'bull_use_ema': False, 'bull_use_atr': False, 'bull_use_adx': True, 'bull_use_spike': False, 'bull_rsi_required': True, 'bear_strategy': 'mean_reversion', 'bear_bb_std_mult': 1.7444996833784625, 'bear_rsi_os': 53, 'bear_rsi_ob': 73, 'bear_adx_thresh': 25.61672458283484, 'bear_atr_min_pct': 0.01635173109850502, 'bear_atr_max_pct': 0.14472931427698177, 'bear_tp_mult': 2.484197320163207, 'bear_tsl_mult': 0.6252544403859481, 'bear_time_stop': 288, 'bear_use_sma': False, 'bear_use_ema': False, 'bear_use_atr': False, 'bear_use_adx': True, 'bear_use_spike': False, 'bear_rsi_required': False, 'sideways_strategy': 'mean_reversion', 'sideways_bb_std_mult': 3.1384353256756494, 'sideways_rsi_os': 16, 'sideways_rsi_ob': 67, 'sideways_adx_thresh': 21.07411576852851, 'sideways_atr_min_pct': 0.006138446127960635, 'sideways_atr_max_pct': 0.13016223332748034, 'sideways_tp_mult': 2.035375484811922, 'sideways_tsl_mult': 0.6843539684602853, 'sideways_time_stop': 110, 'sideways_use_sma': False, 'sideways_use_ema': False, 'sideways_use_atr': True, 'sideways_use_adx': False, 'sideways_use_spike': True, 'sideways_rsi_required': True}.
[I 2025-09-01 14:45:50,162] Trial 347 finished with values: [-1000000000.0, 1000000000.0] and parameters: {'p_sma': 15, 'p_std': 8, 'p_atr': 17, 'p_adx': 12, 'rsi_period': 30, 'ema1': 9, 'ema2': 53, 'slip_atr_k': 0.15673963963709925, 'slip_spread_k': 0.20909515401577508, 'spread_hl_frac': 0.030037652165621143, 'bb_std_mult': 1.923349646082864, 'rsi_os': 35, 'rsi_ob': 64, 'vol_spike': 0.011743863200444044, 'adx_thresh': 21.80130793727524, 'atr_min_pct': 0.015219357547662833, 'atr_max_pct': 0.13438985906161016, 'tp_mult': 1.1187572308431157, 'tsl_mult': 0.005636762940269505, 'strategy': 'breakout', 'time_stop': 63, 'use_sma': False, 'use_atr': True, 'use_adx': True, 'use_ema': False, 'use_spike': True, 'rsi_required': False, 'edge_k': 0.7397638032632363, 'edge_cap': 0.5852722829969557, 'bull_strategy': 'breakout', 'bull_bb_std_mult': 2.9457010319304215, 'bull_rsi_os': 16, 'bull_rsi_ob': 67, 'bull_adx_thresh': 9.662394339992376, 'bull_atr_min_pct': 0.021804540599852474, 'bull_atr_max_pct': 0.07501781515959369, 'bull_tp_mult': 1.3340310795458743, 'bull_tsl_mult': 0.4086758755908388, 'bull_time_stop': 152, 'bull_use_sma': True, 'bull_use_ema': False, 'bull_use_atr': False, 'bull_use_adx': True, 'bull_use_spike': False, 'bull_rsi_required': True, 'bear_strategy': 'mean_reversion', 'bear_bb_std_mult': 2.701655441462835, 'bear_rsi_os': 7, 'bear_rsi_ob': 73, 'bear_adx_thresh': 27.628506795672397, 'bear_atr_min_pct': 0.016380845053739244, 'bear_atr_max_pct': 0.05005087790538405, 'bear_tp_mult': 2.5038638495834333, 'bear_tsl_mult': 0.07735576302384073, 'bear_time_stop': 289, 'bear_use_sma': False, 'bear_use_ema': False, 'bear_use_atr': False, 'bear_use_adx': True, 'bear_use_spike': False, 'bear_rsi_required': False, 'sideways_strategy': 'mean_reversion', 'sideways_bb_std_mult': 3.1470354177304323, 'sideways_rsi_os': 16, 'sideways_rsi_ob': 83, 'sideways_adx_thresh': 5.816264671545705, 'sideways_atr_min_pct': 0.005523248055442863, 'sideways_atr_max_pct': 0.12843037559659895, 'sideways_tp_mult': 1.011811367313671, 'sideways_tsl_mult': 0.10813798872980745, 'sideways_time_stop': 204, 'sideways_use_sma': False, 'sideways_use_ema': False, 'sideways_use_atr': True, 'sideways_use_adx': False, 'sideways_use_spike': True, 'sideways_rsi_required': True}.
[I 2025-09-01 14:45:50,357] Trial 345 finished with values: [-1000000000.0, 1000000000.0] and parameters: {'p_sma': 11, 'p_std': 8, 'p_atr': 19, 'p_adx': 24, 'rsi_period': 67, 'ema1': 30, 'ema2': 23, 'slip_atr_k': 0.053812639945657284, 'slip_spread_k': 0.6414391352875939, 'spread_hl_frac': 0.04062724841476731, 'bb_std_mult': 1.6638322055508938, 'rsi_os': 35, 'rsi_ob': 73, 'vol_spike': 0.11210772629498456, 'adx_thresh': 8.97725963352903, 'atr_min_pct': 0.01522010715019674, 'atr_max_pct': 0.08665081753232422, 'tp_mult': 2.891578191484032, 'tsl_mult': 0.6788056587554228, 'strategy': 'breakout', 'time_stop': 183, 'use_sma': False, 'use_atr': True, 'use_adx': True, 'use_ema': False, 'use_spike': True, 'rsi_required': False, 'edge_k': 0.5063697469300029, 'edge_cap': 0.1007993405128998, 'bull_strategy': 'breakout', 'bull_bb_std_mult': 2.8603763689791, 'bull_rsi_os': 28, 'bull_rsi_ob': 49, 'bull_adx_thresh': 9.794535796133331, 'bull_atr_min_pct': 0.013752656060239149, 'bull_atr_max_pct': 0.13871938834297728, 'bull_tp_mult': 1.951062244213627, 'bull_tsl_mult': 0.5417496446095839, 'bull_time_stop': 201, 'bull_use_sma': True, 'bull_use_ema': False, 'bull_use_atr': False, 'bull_use_adx': True, 'bull_use_spike': False, 'bull_rsi_required': True, 'bear_strategy': 'mean_reversion', 'bear_bb_std_mult': 2.697388722525705, 'bear_rsi_os': 25, 'bear_rsi_ob': 61, 'bear_adx_thresh': 25.63993057191495, 'bear_atr_min_pct': 0.02257131260508294, 'bear_atr_max_pct': 0.11595606853770384, 'bear_tp_mult': 2.476687242652465, 'bear_tsl_mult': 0.06201283986714479, 'bear_time_stop': 286, 'bear_use_sma': False, 'bear_use_ema': False, 'bear_use_atr': False, 'bear_use_adx': True, 'bear_use_spike': False, 'bear_rsi_required': False, 'sideways_strategy': 'mean_reversion', 'sideways_bb_std_mult': 2.413746973229853, 'sideways_rsi_os': 16, 'sideways_rsi_ob': 91, 'sideways_adx_thresh': 5.761905190133287, 'sideways_atr_min_pct': 0.006011225033587856, 'sideways_atr_max_pct': 0.1287676281405839, 'sideways_tp_mult': 2.603487415628299, 'sideways_tsl_mult': 0.49613086620491115, 'sideways_time_stop': 205, 'sideways_use_sma': False, 'sideways_use_ema': False, 'sideways_use_atr': True, 'sideways_use_adx': False, 'sideways_use_spike': True, 'sideways_rsi_required': True}.
[I 2025-09-01 14:45:50,552] Trial 344 finished with values: [-1000000000.0, 1000000000.0] and parameters: {'p_sma': 15, 'p_std': 8, 'p_atr': 23, 'p_adx': 24, 'rsi_period': 67, 'ema1': 11, 'ema2': 23, 'slip_atr_k': 0.00489925429372412, 'slip_spread_k': 0.7117798277011457, 'spread_hl_frac': 0.014190454044688595, 'bb_std_mult': 1.9015259781423919, 'rsi_os': 35, 'rsi_ob': 71, 'vol_spike': 0.10862917401304345, 'adx_thresh': 21.80093478202441, 'atr_min_pct': 0.01528943339859879, 'atr_max_pct': 0.08620922493842724, 'tp_mult': 1.0849932094917891, 'tsl_mult': 0.6258883035245428, 'strategy': 'breakout', 'time_stop': 262, 'use_sma': False, 'use_atr': True, 'use_adx': True, 'use_ema': False, 'use_spike': True, 'rsi_required': False, 'edge_k': 0.5861055396601687, 'edge_cap': 0.1001804520666998, 'bull_strategy': 'breakout', 'bull_bb_std_mult': 2.8567241283403257, 'bull_rsi_os': 10, 'bull_rsi_ob': 49, 'bull_adx_thresh': 5.667903038823365, 'bull_atr_min_pct': 0.010498830691891666, 'bull_atr_max_pct': 0.0994824781055455, 'bull_tp_mult': 1.9555969459673073, 'bull_tsl_mult': 0.5610136219401108, 'bull_time_stop': 200, 'bull_use_sma': True, 'bull_use_ema': False, 'bull_use_atr': False, 'bull_use_adx': True, 'bull_use_spike': False, 'bull_rsi_required': True, 'bear_strategy': 'mean_reversion', 'bear_bb_std_mult': 2.843755888232501, 'bear_rsi_os': 7, 'bear_rsi_ob': 61, 'bear_adx_thresh': 16.62840499651594, 'bear_atr_min_pct': 0.008506923989736782, 'bear_atr_max_pct': 0.1111808489576922, 'bear_tp_mult': 2.5008688328635587, 'bear_tsl_mult': 0.8006443794587136, 'bear_time_stop': 82, 'bear_use_sma': False, 'bear_use_ema': False, 'bear_use_atr': False, 'bear_use_adx': True, 'bear_use_spike': False, 'bear_rsi_required': False, 'sideways_strategy': 'mean_reversion', 'sideways_bb_std_mult': 2.1405456116051513, 'sideways_rsi_os': 51, 'sideways_rsi_ob': 90, 'sideways_adx_thresh': 5.657457359373179, 'sideways_atr_min_pct': 0.006174372038758355, 'sideways_atr_max_pct': 0.12892761339073755, 'sideways_tp_mult': 1.0317656136387376, 'sideways_tsl_mult': 0.6871279665589777, 'sideways_time_stop': 70, 'sideways_use_sma': False, 'sideways_use_ema': False, 'sideways_use_atr': True, 'sideways_use_adx': False, 'sideways_use_spike': True, 'sideways_rsi_required': True}.
[I 2025-09-01 14:45:51,195] Trial 349 finished with values: [-1000000000.0, 1000000000.0] and parameters: {'p_sma': 13, 'p_std': 10, 'p_atr': 18, 'p_adx': 25, 'rsi_period': 60, 'ema1': 5, 'ema2': 55, 'slip_atr_k': 0.24396965795884717, 'slip_spread_k': 0.8191443540957233, 'spread_hl_frac': 0.014290968875987556, 'bb_std_mult': 1.8433394783855097, 'rsi_os': 36, 'rsi_ob': 46, 'vol_spike': 0.23358074849569452, 'adx_thresh': 19.26543697048358, 'atr_min_pct': 0.020593024603780683, 'atr_max_pct': 0.06743706109704446, 'tp_mult': 2.8694934582152687, 'tsl_mult': 0.8988781200523343, 'strategy': 'mean_reversion', 'time_stop': 163, 'use_sma': True, 'use_atr': True, 'use_adx': True, 'use_ema': False, 'use_spike': False, 'rsi_required': False, 'edge_k': 0.632255434559405, 'edge_cap': 0.09338845312882099, 'bull_strategy': 'breakout', 'bull_bb_std_mult': 3.0349227605597155, 'bull_rsi_os': 10, 'bull_rsi_ob': 47, 'bull_adx_thresh': 8.092934780832985, 'bull_atr_min_pct': 0.017720633841196178, 'bull_atr_max_pct': 0.079262192189043, 'bull_tp_mult': 1.9879587018314444, 'bull_tsl_mult': 0.37069056805065903, 'bull_time_stop': 168, 'bull_use_sma': True, 'bull_use_ema': False, 'bull_use_atr': False, 'bull_use_adx': False, 'bull_use_spike': False, 'bull_rsi_required': True, 'bear_strategy': 'breakout', 'bear_bb_std_mult': 2.8517295817066093, 'bear_rsi_os': 7, 'bear_rsi_ob': 77, 'bear_adx_thresh': 22.502153869660347, 'bear_atr_min_pct': 0.026513146616989926, 'bear_atr_max_pct': 0.06582264230698098, 'bear_tp_mult': 2.4149790660151207, 'bear_tsl_mult': 0.5916313371166375, 'bear_time_stop': 203, 'bear_use_sma': True, 'bear_use_ema': False, 'bear_use_atr': False, 'bear_use_adx': True, 'bear_use_spike': False, 'bear_rsi_required': True, 'sideways_strategy': 'mean_reversion', 'sideways_bb_std_mult': 0.8189472153127804, 'sideways_rsi_os': 50, 'sideways_rsi_ob': 72, 'sideways_adx_thresh': 6.782791370427769, 'sideways_atr_min_pct': 0.005105145458262577, 'sideways_atr_max_pct': 0.13727232738404602, 'sideways_tp_mult': 1.75750453546132, 'sideways_tsl_mult': 0.6005231345049573, 'sideways_time_stop': 143, 'sideways_use_sma': False, 'sideways_use_ema': False, 'sideways_use_atr': False, 'sideways_use_adx': True, 'sideways_use_spike': False, 'sideways_rsi_required': False}.
[I 2025-09-01 14:46:23,097] Trial 351 finished with values: [-1000000000.0, 1000000000.0] and parameters: {'p_sma': 13, 'p_std': 10, 'p_atr': 9, 'p_adx': 25, 'rsi_period': 63, 'ema1': 5, 'ema2': 51, 'slip_atr_k': 0.06016373361652523, 'slip_spread_k': 0.8220425319902422, 'spread_hl_frac': 0.047127508306490075, 'bb_std_mult': 1.4281775574184006, 'rsi_os': 36, 'rsi_ob': 74, 'vol_spike': 0.22958976831897454, 'adx_thresh': 13.856224149555091, 'atr_min_pct': 0.018958665499653977, 'atr_max_pct': 0.06685009828641571, 'tp_mult': 2.8729814907778426, 'tsl_mult': 0.34067340711372407, 'strategy': 'mean_reversion', 'time_stop': 161, 'use_sma': True, 'use_atr': True, 'use_adx': True, 'use_ema': False, 'use_spike': False, 'rsi_required': False, 'edge_k': 1.7413760713708084, 'edge_cap': 0.6651722383939804, 'bull_strategy': 'breakout', 'bull_bb_std_mult': 2.7386418609748153, 'bull_rsi_os': 15, 'bull_rsi_ob': 95, 'bull_adx_thresh': 21.65886319190747, 'bull_atr_min_pct': 0.023579496897554314, 'bull_atr_max_pct': 0.028559706109035993, 'bull_tp_mult': 2.015367235622454, 'bull_tsl_mult': 0.37596365028660944, 'bull_time_stop': 247, 'bull_use_sma': True, 'bull_use_ema': False, 'bull_use_atr': False, 'bull_use_adx': False, 'bull_use_spike': False, 'bull_rsi_required': True, 'bear_strategy': 'breakout', 'bear_bb_std_mult': 2.7590010484444307, 'bear_rsi_os': 48, 'bear_rsi_ob': 77, 'bear_adx_thresh': 22.854775267249373, 'bear_atr_min_pct': 0.028146917658037746, 'bear_atr_max_pct': 0.06351400898038032, 'bear_tp_mult': 2.615582261399904, 'bear_tsl_mult': 0.9373597640535243, 'bear_time_stop': 15, 'bear_use_sma': True, 'bear_use_ema': False, 'bear_use_atr': False, 'bear_use_adx': True, 'bear_use_spike': False, 'bear_rsi_required': True, 'sideways_strategy': 'mean_reversion', 'sideways_bb_std_mult': 0.8448692479798159, 'sideways_rsi_os': 35, 'sideways_rsi_ob': 85, 'sideways_adx_thresh': 14.108506464853933, 'sideways_atr_min_pct': 0.004953649210934571, 'sideways_atr_max_pct': 0.13722258847344168, 'sideways_tp_mult': 1.7493511064805098, 'sideways_tsl_mult': 0.5853916684410887, 'sideways_time_stop': 28, 'sideways_use_sma': False, 'sideways_use_ema': False, 'sideways_use_atr': False, 'sideways_use_adx': True, 'sideways_use_spike': False, 'sideways_rsi_required': False}.
[I 2025-09-01 14:46:23,362] Trial 348 finished with values: [-1000000000.0, 1000000000.0] and parameters: {'p_sma': 15, 'p_std': 8, 'p_atr': 21, 'p_adx': 25, 'rsi_period': 63, 'ema1': 30, 'ema2': 19, 'slip_atr_k': 0.24378388084755387, 'slip_spread_k': 0.22160265284729447, 'spread_hl_frac': 0.014281068418272284, 'bb_std_mult': 1.848509140425993, 'rsi_os': 36, 'rsi_ob': 73, 'vol_spike': 0.2765515647634536, 'adx_thresh': 8.678231083348065, 'atr_min_pct': 0.01417422383913235, 'atr_max_pct': 0.0862698524487089, 'tp_mult': 2.8685063895814684, 'tsl_mult': 0.9107548320774475, 'strategy': 'breakout', 'time_stop': 109, 'use_sma': False, 'use_atr': True, 'use_adx': True, 'use_ema': False, 'use_spike': True, 'rsi_required': False, 'edge_k': 0.5890692428794846, 'edge_cap': 0.0989116613709527, 'bull_strategy': 'breakout', 'bull_bb_std_mult': 0.7030980247984295, 'bull_rsi_os': 17, 'bull_rsi_ob': 77, 'bull_adx_thresh': 18.952068905999596, 'bull_atr_min_pct': 0.010761917577499773, 'bull_atr_max_pct': 0.13161595493669956, 'bull_tp_mult': 2.0005076268996422, 'bull_tsl_mult': 0.5321593591328527, 'bull_time_stop': 250, 'bull_use_sma': True, 'bull_use_ema': False, 'bull_use_atr': False, 'bull_use_adx': True, 'bull_use_spike': False, 'bull_rsi_required': True, 'bear_strategy': 'mean_reversion', 'bear_bb_std_mult': 2.694888437508137, 'bear_rsi_os': 7, 'bear_rsi_ob': 77, 'bear_adx_thresh': 27.776471699522585, 'bear_atr_min_pct': 0.0019189406958378275, 'bear_atr_max_pct': 0.12922079604867787, 'bear_tp_mult': 2.6227140701416127, 'bear_tsl_mult': 0.5884005709534657, 'bear_time_stop': 151, 'bear_use_sma': False, 'bear_use_ema': False, 'bear_use_atr': False, 'bear_use_adx': True, 'bear_use_spike': False, 'bear_rsi_required': False, 'sideways_strategy': 'mean_reversion', 'sideways_bb_std_mult': 0.8088572139048475, 'sideways_rsi_os': 35, 'sideways_rsi_ob': 88, 'sideways_adx_thresh': 10.692636454657741, 'sideways_atr_min_pct': 0.0056040543299307275, 'sideways_atr_max_pct': 0.038314230479461614, 'sideways_tp_mult': 1.7381791413215333, 'sideways_tsl_mult': 0.49329969891748143, 'sideways_time_stop': 103, 'sideways_use_sma': False, 'sideways_use_ema': False, 'sideways_use_atr': True, 'sideways_use_adx': False, 'sideways_use_spike': True, 'sideways_rsi_required': True}.
