[I 2025-09-01 14:01:59,442] Trial 60 finished with values: [-1000000000.0, 1000000000.0] and parameters: {'p_sma': 49, 'p_std': 16, 'p_atr': 22, 'p_adx': 25, 'rsi_period': 7, 'ema1': 10, 'ema2': 40, 'slip_atr_k': 0.08281869539339291, 'slip_spread_k': 0.7626851422832811, 'spread_hl_frac': 0.022895864915038328, 'bb_std_mult': 2.4256266761648337, 'rsi_os': 18, 'rsi_ob': 61, 'vol_spike': 0.014535395442804432, 'adx_thresh': 17.107993414073977, 'atr_min_pct': 0.01840318022275872, 'atr_max_pct': 0.12945299626551576, 'tp_mult': 1.91113784960578, 'tsl_mult': 0.010384272506741371, 'strategy': 'mean_reversion', 'time_stop': 142, 'use_sma': True, 'use_atr': False, 'use_adx': False, 'use_ema': False, 'use_spike': False, 'rsi_required': True, 'edge_k': 0.8439897617801163, 'edge_cap': 0.12753601018182886, 'bull_strategy': 'mean_reversion', 'bull_bb_std_mult': 3.378245438605288, 'bull_rsi_os': 34, 'bull_rsi_ob': 49, 'bull_adx_thresh': 22.56376056506511, 'bull_atr_min_pct': 0.004238670995905673, 'bull_atr_max_pct': 0.015562206681225668, 'bull_tp_mult': 1.9841578438879592, 'bull_tsl_mult': 0.5342115064026023, 'bull_time_stop': 81, 'bull_use_sma': True, 'bull_use_ema': True, 'bull_use_atr': True, 'bull_use_adx': False, 'bull_use_spike': True, 'bull_rsi_required': True, 'bear_strategy': 'breakout', 'bear_bb_std_mult': 1.383355136636596, 'bear_rsi_os': 7, 'bear_rsi_ob': 90, 'bear_adx_thresh': 9.22121150634268, 'bear_atr_min_pct': 0.021064815422836607, 'bear_atr_max_pct': 0.10373154317925881, 'bear_tp_mult': 1.50907790033027, 'bear_tsl_mult': 0.3570343184953658, 'bear_time_stop': 269, 'bear_use_sma': False, 'bear_use_ema': False, 'bear_use_atr': True, 'bear_use_adx': False, 'bear_use_spike': True, 'bear_rsi_required': True, 'sideways_strategy': 'breakout', 'sideways_bb_std_mult': 2.803582193032172, 'sideways_rsi_os': 20, 'sideways_rsi_ob': 48, 'sideways_adx_thresh': 5.105209861558585, 'sideways_atr_min_pct': 0.009358081941141233, 'sideways_atr_max_pct': 0.0793563910418206, 'sideways_tp_mult': 2.5950544088672913, 'sideways_tsl_mult': 0.4680811906215904, 'sideways_time_stop': 134, 'sideways_use_sma': False, 'sideways_use_ema': False, 'sideways_use_atr': True, 'sideways_use_adx': False, 'sideways_use_spike': False, 'sideways_rsi_required': False}.
[I 2025-09-01 14:01:59,782] Trial 67 finished with values: [-1000000000.0, 1000000000.0] and parameters: {'p_sma': 8, 'p_std': 51, 'p_atr': 26, 'p_adx': 12, 'rsi_period': 56, 'ema1': 5, 'ema2': 46, 'slip_atr_k': 0.2344246710286063, 'slip_spread_k': 0.8320420781224437, 'spread_hl_frac': 0.014500663906381307, 'bb_std_mult': 2.242047791018328, 'rsi_os': 53, 'rsi_ob': 85, 'vol_spike': 0.10355284029591226, 'adx_thresh': 20.164885173347855, 'atr_min_pct': 0.01070307020381966, 'atr_max_pct': 0.10992060504111015, 'tp_mult': 1.5904390965637762, 'tsl_mult': 0.4001628687856428, 'strategy': 'mean_reversion', 'time_stop': 203, 'use_sma': False, 'use_atr': False, 'use_adx': True, 'use_ema': False, 'use_spike': False, 'rsi_required': True, 'edge_k': 0.6487690934755619, 'edge_cap': 0.05828507516597359, 'bull_strategy': 'mean_reversion', 'bull_bb_std_mult': 0.5491103099031247, 'bull_rsi_os': 30, 'bull_rsi_ob': 84, 'bull_adx_thresh': 15.82171028850366, 'bull_atr_min_pct': 0.015392433127031308, 'bull_atr_max_pct': 0.1326751238977775, 'bull_tp_mult': 1.5113671019214265, 'bull_tsl_mult': 0.12466459989933393, 'bull_time_stop': 32, 'bull_use_sma': True, 'bull_use_ema': True, 'bull_use_atr': True, 'bull_use_adx': True, 'bull_use_spike': True, 'bull_rsi_required': True, 'bear_strategy': 'breakout', 'bear_bb_std_mult': 1.6575080817718217, 'bear_rsi_os': 41, 'bear_rsi_ob': 93, 'bear_adx_thresh': 16.56875232139894, 'bear_atr_min_pct': 0.019519634530454917, 'bear_atr_max_pct': 0.016740814181198674, 'bear_tp_mult': 2.5768896709921085, 'bear_tsl_mult': 0.19486176483066722, 'bear_time_stop': 142, 'bear_use_sma': True, 'bear_use_ema': False, 'bear_use_atr': True, 'bear_use_adx': True, 'bear_use_spike': False, 'bear_rsi_required': True, 'sideways_strategy': 'breakout', 'sideways_bb_std_mult': 3.3872992585362804, 'sideways_rsi_os': 12, 'sideways_rsi_ob': 53, 'sideways_adx_thresh': 8.878979700887694, 'sideways_atr_min_pct': 0.012786683167293972, 'sideways_atr_max_pct': 0.07148771440045412, 'sideways_tp_mult': 2.417759109426725, 'sideways_tsl_mult': 0.3061781419403056, 'sideways_time_stop': 108, 'sideways_use_sma': True, 'sideways_use_ema': True, 'sideways_use_atr': False, 'sideways_use_adx': True, 'sideways_use_spike': False, 'sideways_rsi_required': True}.
[I 2025-09-01 14:02:36,186] Trial 65 finished with values: [-1000000000.0, 1000000000.0] and parameters: {'p_sma': 50, 'p_std': 59, 'p_atr': 26, 'p_adx': 13, 'rsi_period': 60, 'ema1': 5, 'ema2': 46, 'slip_atr_k': 0.23538802899986463, 'slip_spread_k': 0.8437233250689509, 'spread_hl_frac': 0.026769007274574007, 'bb_std_mult': 2.393243383856702, 'rsi_os': 12, 'rsi_ob': 89, 'vol_spike': 0.10200285319575628, 'adx_thresh': 20.52619865440148, 'atr_min_pct': 0.007225948552202204, 'atr_max_pct': 0.10890327693704215, 'tp_mult': 1.5390334251969904, 'tsl_mult': 0.2881758508765171, 'strategy': 'mean_reversion', 'time_stop': 299, 'use_sma': False, 'use_atr': False, 'use_adx': True, 'use_ema': False, 'use_spike': False, 'rsi_required': True, 'edge_k': 1.1588186664377358, 'edge_cap': 0.05281349086698245, 'bull_strategy': 'mean_reversion', 'bull_bb_std_mult': 1.0207045445121268, 'bull_rsi_os': 30, 'bull_rsi_ob': 84, 'bull_adx_thresh': 20.64450408618865, 'bull_atr_min_pct': 0.005812974279127249, 'bull_atr_max_pct': 0.13101679702169722, 'bull_tp_mult': 1.4983085553975601, 'bull_tsl_mult': 0.1446418460374485, 'bull_time_stop': 61, 'bull_use_sma': True, 'bull_use_ema': True, 'bull_use_atr': True, 'bull_use_adx': True, 'bull_use_spike': True, 'bull_rsi_required': True, 'bear_strategy': 'breakout', 'bear_bb_std_mult': 1.9711111889664257, 'bear_rsi_os': 40, 'bear_rsi_ob': 88, 'bear_adx_thresh': 16.74380373788697, 'bear_atr_min_pct': 0.019207726651276777, 'bear_atr_max_pct': 0.01699748358624439, 'bear_tp_mult': 2.5790911497186544, 'bear_tsl_mult': 0.950039111837437, 'bear_time_stop': 134, 'bear_use_sma': True, 'bear_use_ema': False, 'bear_use_atr': True, 'bear_use_adx': True, 'bear_use_spike': True, 'bear_rsi_required': True, 'sideways_strategy': 'breakout', 'sideways_bb_std_mult': 3.4565153107724944, 'sideways_rsi_os': 16, 'sideways_rsi_ob': 95, 'sideways_adx_thresh': 21.37166599529832, 'sideways_atr_min_pct': 0.010812477892660651, 'sideways_atr_max_pct': 0.04036684574615399, 'sideways_tp_mult': 2.9910947465440936, 'sideways_tsl_mult': 0.24491145496128924, 'sideways_time_stop': 5, 'sideways_use_sma': True, 'sideways_use_ema': True, 'sideways_use_atr': False, 'sideways_use_adx': True, 'sideways_use_spike': False, 'sideways_rsi_required': True}.
[I 2025-09-01 14:02:36,809] Trial 66 finished with values: [-1000000000.0, 1000000000.0] and parameters: {'p_sma': 49, 'p_std': 51, 'p_atr': 26, 'p_adx': 13, 'rsi_period': 60, 'ema1': 22, 'ema2': 32, 'slip_atr_k': 0.16947187290772048, 'slip_spread_k': 0.8889604702871623, 'spread_hl_frac': 0.014755588344347963, 'bb_std_mult': 2.4057494505692345, 'rsi_os': 18, 'rsi_ob': 64, 'vol_spike': 0.10209285887726337, 'adx_thresh': 20.75893563368609, 'atr_min_pct': 0.007449389943883726, 'atr_max_pct': 0.13218667413837515, 'tp_mult': 2.6135420080827987, 'tsl_mult': 0.40612644761953703, 'strategy': 'mean_reversion', 'time_stop': 154, 'use_sma': False, 'use_atr': False, 'use_adx': True, 'use_ema': False, 'use_spike': False, 'rsi_required': True, 'edge_k': 0.5959403346213027, 'edge_cap': 0.953143926100558, 'bull_strategy': 'mean_reversion', 'bull_bb_std_mult': 2.796213065004203, 'bull_rsi_os': 55, 'bull_rsi_ob': 83, 'bull_adx_thresh': 13.374861402665568, 'bull_atr_min_pct': 0.005525001681425785, 'bull_atr_max_pct': 0.10012297246747201, 'bull_tp_mult': 1.5128556420358703, 'bull_tsl_mult': 0.11598362801747882, 'bull_time_stop': 64, 'bull_use_sma': True, 'bull_use_ema': True, 'bull_use_atr': True, 'bull_use_adx': True, 'bull_use_spike': True, 'bull_rsi_required': True, 'bear_strategy': 'breakout', 'bear_bb_std_mult': 0.9898799732402133, 'bear_rsi_os': 27, 'bear_rsi_ob': 93, 'bear_adx_thresh': 13.306386422029263, 'bear_atr_min_pct': 0.01937327707774403, 'bear_atr_max_pct': 0.12684582563705407, 'bear_tp_mult': 2.5894069848850663, 'bear_tsl_mult': 0.9202497701177488, 'bear_time_stop': 132, 'bear_use_sma': True, 'bear_use_ema': False, 'bear_use_atr': True, 'bear_use_adx': True, 'bear_use_spike': True, 'bear_rsi_required': True, 'sideways_strategy': 'breakout', 'sideways_bb_std_mult': 3.412145350111545, 'sideways_rsi_os': 7, 'sideways_rsi_ob': 53, 'sideways_adx_thresh': 22.12102377461381, 'sideways_atr_min_pct': 0.013249693801785234, 'sideways_atr_max_pct': 0.06922893278703061, 'sideways_tp_mult': 2.469947646529478, 'sideways_tsl_mult': 0.6508402981228355, 'sideways_time_stop': 112, 'sideways_use_sma': True, 'sideways_use_ema': True, 'sideways_use_atr': False, 'sideways_use_adx': True, 'sideways_use_spike': False, 'sideways_rsi_required': True}.
[I 2025-09-01 14:02:37,520] Trial 68 finished with values: [-1000000000.0, 1000000000.0] and parameters: {'p_sma': 38, 'p_std': 7, 'p_atr': 24, 'p_adx': 28, 'rsi_period': 60, 'ema1': 22, 'ema2': 32, 'slip_atr_k': 0.1703383412480561, 'slip_spread_k': 0.0022561645408935016, 'spread_hl_frac': 0.02697839450324296, 'bb_std_mult': 1.1853745595084049, 'rsi_os': 39, 'rsi_ob': 64, 'vol_spike': 0.1563302299677161, 'adx_thresh': 26.506687839217193, 'atr_min_pct': 0.007462496733896397, 'atr_max_pct': 0.08194966087922885, 'tp_mult': 2.6374084261817226, 'tsl_mult': 0.2838278678148377, 'strategy': 'mean_reversion', 'time_stop': 227, 'use_sma': False, 'use_atr': False, 'use_adx': True, 'use_ema': False, 'use_spike': False, 'rsi_required': True, 'edge_k': 1.15182904056684, 'edge_cap': 0.9592902787327586, 'bull_strategy': 'mean_reversion', 'bull_bb_std_mult': 1.3866038560772362, 'bull_rsi_os': 49, 'bull_rsi_ob': 55, 'bull_adx_thresh': 30.646667549080735, 'bull_atr_min_pct': 0.0054174628700657, 'bull_atr_max_pct': 0.13808106925372907, 'bull_tp_mult': 1.3331974005038327, 'bull_tsl_mult': 0.264150404793942, 'bull_time_stop': 104, 'bull_use_sma': True, 'bull_use_ema': True, 'bull_use_atr': True, 'bull_use_adx': True, 'bull_use_spike': True, 'bull_rsi_required': True, 'bear_strategy': 'breakout', 'bear_bb_std_mult': 0.947794707736594, 'bear_rsi_os': 26, 'bear_rsi_ob': 88, 'bear_adx_thresh': 13.673331107736328, 'bear_atr_min_pct': 0.006288391512661164, 'bear_atr_max_pct': 0.028308711741965246, 'bear_tp_mult': 2.824965150675865, 'bear_tsl_mult': 0.925511580748627, 'bear_time_stop': 28, 'bear_use_sma': True, 'bear_use_ema': False, 'bear_use_atr': True, 'bear_use_adx': True, 'bear_use_spike': True, 'bear_rsi_required': True, 'sideways_strategy': 'breakout', 'sideways_bb_std_mult': 0.6436826921113075, 'sideways_rsi_os': 16, 'sideways_rsi_ob': 88, 'sideways_adx_thresh': 23.984144312488226, 'sideways_atr_min_pct': 0.020477700799193786, 'sideways_atr_max_pct': 0.0940796348036948, 'sideways_tp_mult': 1.2902305193885002, 'sideways_tsl_mult': 0.6363370731266691, 'sideways_time_stop': 6, 'sideways_use_sma': True, 'sideways_use_ema': True, 'sideways_use_atr': True, 'sideways_use_adx': True, 'sideways_use_spike': False, 'sideways_rsi_required': True}.
[I 2025-09-01 14:02:37,753] Trial 64 finished with values: [-1000000000.0, 1000000000.0] and parameters: {'p_sma': 49, 'p_std': 51, 'p_atr': 25, 'p_adx': 25, 'rsi_period': 61, 'ema1': 5, 'ema2': 40, 'slip_atr_k': 0.23600748735016386, 'slip_spread_k': 0.5882496243340531, 'spread_hl_frac': 0.018094223883742707, 'bb_std_mult': 2.3956051338176807, 'rsi_os': 11, 'rsi_ob': 86, 'vol_spike': 0.03723673538651158, 'adx_thresh': 20.715409260405654, 'atr_min_pct': 0.0024369321171328227, 'atr_max_pct': 0.13001827660682075, 'tp_mult': 1.96696179521889, 'tsl_mult': 0.6367476427031398, 'strategy': 'mean_reversion', 'time_stop': 200, 'use_sma': False, 'use_atr': False, 'use_adx': True, 'use_ema': False, 'use_spike': False, 'rsi_required': True, 'edge_k': 0.6744592670644711, 'edge_cap': 0.8484264903609702, 'bull_strategy': 'mean_reversion', 'bull_bb_std_mult': 2.7561331794269313, 'bull_rsi_os': 34, 'bull_rsi_ob': 47, 'bull_adx_thresh': 7.9341344204460915, 'bull_atr_min_pct': 0.005332777456523897, 'bull_atr_max_pct': 0.1297999900739022, 'bull_tp_mult': 1.7557428121221594, 'bull_tsl_mult': 0.11451349552852666, 'bull_time_stop': 106, 'bull_use_sma': False, 'bull_use_ema': True, 'bull_use_atr': True, 'bull_use_adx': True, 'bull_use_spike': True, 'bull_rsi_required': True, 'bear_strategy': 'breakout', 'bear_bb_std_mult': 3.033497514108831, 'bear_rsi_os': 38, 'bear_rsi_ob': 60, 'bear_adx_thresh': 16.908782194154803, 'bear_atr_min_pct': 0.0072473778610679905, 'bear_atr_max_pct': 0.12778943226478767, 'bear_tp_mult': 2.5484961065892433, 'bear_tsl_mult': 0.3420365329300663, 'bear_time_stop': 134, 'bear_use_sma': True, 'bear_use_ema': False, 'bear_use_atr': True, 'bear_use_adx': True, 'bear_use_spike': False, 'bear_rsi_required': True, 'sideways_strategy': 'breakout', 'sideways_bb_std_mult': 2.264778043022541, 'sideways_rsi_os': 12, 'sideways_rsi_ob': 54, 'sideways_adx_thresh': 22.22895426607935, 'sideways_atr_min_pct': 0.010899659180215097, 'sideways_atr_max_pct': 0.06756136365923245, 'sideways_tp_mult': 1.3804256771624714, 'sideways_tsl_mult': 0.530888793170681, 'sideways_time_stop': 109, 'sideways_use_sma': True, 'sideways_use_ema': True, 'sideways_use_atr': True, 'sideways_use_adx': True, 'sideways_use_spike': False, 'sideways_rsi_required': True}.
[I 2025-09-01 14:03:13,958] Trial 72 finished with values: [-1000000000.0, 1000000000.0] and parameters: {'p_sma': 54, 'p_std': 11, 'p_atr': 29, 'p_adx': 23, 'rsi_period': 56, 'ema1': 29, 'ema2': 57, 'slip_atr_k': 0.2064878040104147, 'slip_spread_k': 0.9846042312043995, 'spread_hl_frac': 0.020919728045598975, 'bb_std_mult': 0.6962357427405736, 'rsi_os': 21, 'rsi_ob': 69, 'vol_spike': 0.079942575678816, 'adx_thresh': 22.067618964265233, 'atr_min_pct': 0.02953383305177284, 'atr_max_pct': 0.09950082578442543, 'tp_mult': 1.6526264507971258, 'tsl_mult': 0.04659707660671519, 'strategy': 'mean_reversion', 'time_stop': 100, 'use_sma': False, 'use_atr': False, 'use_adx': True, 'use_ema': True, 'use_spike': False, 'rsi_required': True, 'edge_k': 0.9411290257974261, 'edge_cap': 0.5982594530252121, 'bull_strategy': 'breakout', 'bull_bb_std_mult': 0.7689762871654128, 'bull_rsi_os': 25, 'bull_rsi_ob': 58, 'bull_adx_thresh': 5.133747492769398, 'bull_atr_min_pct': 0.02443627151845992, 'bull_atr_max_pct': 0.08877742168125494, 'bull_tp_mult': 2.960955240656689, 'bull_tsl_mult': 0.19882151700765716, 'bull_time_stop': 177, 'bull_use_sma': True, 'bull_use_ema': False, 'bull_use_atr': False, 'bull_use_adx': True, 'bull_use_spike': False, 'bull_rsi_required': False, 'bear_strategy': 'breakout', 'bear_bb_std_mult': 1.167045519968503, 'bear_rsi_os': 12, 'bear_rsi_ob': 75, 'bear_adx_thresh': 11.416200906946903, 'bear_atr_min_pct': 0.01651399634295933, 'bear_atr_max_pct': 0.06224530253418342, 'bear_tp_mult': 1.7315825906711162, 'bear_tsl_mult': 0.28569422390389726, 'bear_time_stop': 256, 'bear_use_sma': True, 'bear_use_ema': True, 'bear_use_atr': False, 'bear_use_adx': False, 'bear_use_spike': True, 'bear_rsi_required': True, 'sideways_strategy': 'breakout', 'sideways_bb_std_mult': 1.4875119057649222, 'sideways_rsi_os': 48, 'sideways_rsi_ob': 52, 'sideways_adx_thresh': 25.618952917305016, 'sideways_atr_min_pct': 0.008633925497306816, 'sideways_atr_max_pct': 0.10900012013203438, 'sideways_tp_mult': 2.161186567826848, 'sideways_tsl_mult': 0.41197797223451016, 'sideways_time_stop': 53, 'sideways_use_sma': True, 'sideways_use_ema': False, 'sideways_use_atr': True, 'sideways_use_adx': True, 'sideways_use_spike': False, 'sideways_rsi_required': False}.
[I 2025-09-01 14:03:15,071] Trial 70 finished with values: [-0.022463789399006617, 0.02246727736111686] and parameters: {'p_sma': 38, 'p_std': 34, 'p_atr': 8, 'p_adx': 23, 'rsi_period': 56, 'ema1': 22, 'ema2': 26, 'slip_atr_k': 0.1308498650883902, 'slip_spread_k': 0.45208607836165615, 'spread_hl_frac': 0.018059611496773764, 'bb_std_mult': 1.8128380707201555, 'rsi_os': 23, 'rsi_ob': 68, 'vol_spike': 0.03679302199904132, 'adx_thresh': 22.33299165399457, 'atr_min_pct': 0.00571490680152522, 'atr_max_pct': 0.1004206646851096, 'tp_mult': 1.4528124908423452, 'tsl_mult': 0.47917197194242495, 'strategy': 'mean_reversion', 'time_stop': 99, 'use_sma': False, 'use_atr': False, 'use_adx': True, 'use_ema': True, 'use_spike': False, 'rsi_required': True, 'edge_k': 0.945393987502324, 'edge_cap': 0.4030135531322006, 'bull_strategy': 'breakout', 'bull_bb_std_mult': 1.3629193069813648, 'bull_rsi_os': 49, 'bull_rsi_ob': 55, 'bull_adx_thresh': 32.8851365648378, 'bull_atr_min_pct': 0.00047656899922929145, 'bull_atr_max_pct': 0.12499455602958034, 'bull_tp_mult': 2.218410745353732, 'bull_tsl_mult': 0.2689820091847579, 'bull_time_stop': 106, 'bull_use_sma': False, 'bull_use_ema': False, 'bull_use_atr': True, 'bull_use_adx': True, 'bull_use_spike': True, 'bull_rsi_required': True, 'bear_strategy': 'breakout', 'bear_bb_std_mult': 1.1850990407584039, 'bear_rsi_os': 11, 'bear_rsi_ob': 83, 'bear_adx_thresh': 11.266745719569759, 'bear_atr_min_pct': 0.006882295075802741, 'bear_atr_max_pct': 0.028030041904937637, 'bear_tp_mult': 2.8170746150962085, 'bear_tsl_mult': 0.2912186307694205, 'bear_time_stop': 215, 'bear_use_sma': True, 'bear_use_ema': True, 'bear_use_atr': False, 'bear_use_adx': False, 'bear_use_spike': True, 'bear_rsi_required': True, 'sideways_strategy': 'breakout', 'sideways_bb_std_mult': 1.5889765006134147, 'sideways_rsi_os': 22, 'sideways_rsi_ob': 88, 'sideways_adx_thresh': 23.74988113082972, 'sideways_atr_min_pct': 0.007391848874002562, 'sideways_atr_max_pct': 0.0921446582111265, 'sideways_tp_mult': 2.2176596099826282, 'sideways_tsl_mult': 0.5400896392596318, 'sideways_time_stop': 239, 'sideways_use_sma': True, 'sideways_use_ema': False, 'sideways_use_atr': True, 'sideways_use_adx': True, 'sideways_use_spike': False, 'sideways_rsi_required': False}.
[I 2025-09-01 14:03:15,761] Trial 69 finished with values: [-0.04601103794802197, 0.045555065854183695] and parameters: {'p_sma': 18, 'p_std': 9, 'p_atr': 9, 'p_adx': 27, 'rsi_period': 56, 'ema1': 22, 'ema2': 58, 'slip_atr_k': 0.175419408619663, 'slip_spread_k': 0.9847841047964163, 'spread_hl_frac': 0.03201010300080637, 'bb_std_mult': 0.651747500012624, 'rsi_os': 22, 'rsi_ob': 63, 'vol_spike': 0.038674772807891104, 'adx_thresh': 26.466161723964802, 'atr_min_pct': 0.005007500457450145, 'atr_max_pct': 0.10026468691809204, 'tp_mult': 1.4440137346409478, 'tsl_mult': 0.47150236064355744, 'strategy': 'mean_reversion', 'time_stop': 232, 'use_sma': False, 'use_atr': False, 'use_adx': True, 'use_ema': True, 'use_spike': False, 'rsi_required': True, 'edge_k': 0.5495781004627868, 'edge_cap': 0.3530137983152627, 'bull_strategy': 'mean_reversion', 'bull_bb_std_mult': 2.8025162291576464, 'bull_rsi_os': 51, 'bull_rsi_ob': 55, 'bull_adx_thresh': 31.526892121757484, 'bull_atr_min_pct': 8.366905454253767e-05, 'bull_atr_max_pct': 0.12576229565422356, 'bull_tp_mult': 1.3642995980104378, 'bull_tsl_mult': 0.19942392184066288, 'bull_time_stop': 178, 'bull_use_sma': True, 'bull_use_ema': False, 'bull_use_atr': True, 'bull_use_adx': True, 'bull_use_spike': True, 'bull_rsi_required': True, 'bear_strategy': 'breakout', 'bear_bb_std_mult': 0.9590325778354967, 'bear_rsi_os': 27, 'bear_rsi_ob': 75, 'bear_adx_thresh': 13.806350778814512, 'bear_atr_min_pct': 0.016595311811534123, 'bear_atr_max_pct': 0.12658593460162498, 'bear_tp_mult': 2.799933099943315, 'bear_tsl_mult': 0.010833167305209557, 'bear_time_stop': 253, 'bear_use_sma': True, 'bear_use_ema': True, 'bear_use_atr': True, 'bear_use_adx': False, 'bear_use_spike': True, 'bear_rsi_required': True, 'sideways_strategy': 'breakout', 'sideways_bb_std_mult': 1.4776091519625598, 'sideways_rsi_os': 7, 'sideways_rsi_ob': 72, 'sideways_adx_thresh': 22.373409975473308, 'sideways_atr_min_pct': 0.013765530705278858, 'sideways_atr_max_pct': 0.09459117663135364, 'sideways_tp_mult': 1.3466437558409983, 'sideways_tsl_mult': 0.6262019634458476, 'sideways_time_stop': 235, 'sideways_use_sma': True, 'sideways_use_ema': False, 'sideways_use_atr': True, 'sideways_use_adx': True, 'sideways_use_spike': False, 'sideways_rsi_required': False}.
