[I 2025-09-01 14:33:29,125] Trial 262 finished with values: [-0.01687979036203302, 0.016901747845838314] and parameters: {'p_sma': 12, 'p_std': 13, 'p_atr': 20, 'p_adx': 18, 'rsi_period': 67, 'ema1': 30, 'ema2': 50, 'slip_atr_k': 0.07036586027167388, 'slip_spread_k': 0.2724856566959843, 'spread_hl_frac': 0.0002523919995838578, 'bb_std_mult': 1.2983160075204268, 'rsi_os': 50, 'rsi_ob': 72, 'vol_spike': 0.2114076272739957, 'adx_thresh': 28.926836426241156, 'atr_min_pct': 0.016765595425841922, 'atr_max_pct': 0.07607139072612122, 'tp_mult': 2.9026192891848264, 'tsl_mult': 0.35671563093170433, 'strategy': 'breakout', 'time_stop': 275, 'use_sma': False, 'use_atr': True, 'use_adx': False, 'use_ema': False, 'use_spike': True, 'rsi_required': False, 'edge_k': 0.5873632278860202, 'edge_cap': 0.07686643833545967, 'bull_strategy': 'breakout', 'bull_bb_std_mult': 2.6756089972484447, 'bull_rsi_os': 26, 'bull_rsi_ob': 46, 'bull_adx_thresh': 16.887387764216, 'bull_atr_min_pct': 0.0025188437738608996, 'bull_atr_max_pct': 0.02437774306790101, 'bull_tp_mult': 2.097597451050074, 'bull_tsl_mult': 0.9456445431215633, 'bull_time_stop': 135, 'bull_use_sma': True, 'bull_use_ema': False, 'bull_use_atr': False, 'bull_use_adx': True, 'bull_use_spike': False, 'bull_rsi_required': True, 'bear_strategy': 'mean_reversion', 'bear_bb_std_mult': 2.7154099523263966, 'bear_rsi_os': 9, 'bear_rsi_ob': 72, 'bear_adx_thresh': 29.003047223020904, 'bear_atr_min_pct': 0.02322654812665754, 'bear_atr_max_pct': 0.1029372096298859, 'bear_tp_mult': 2.472350757384134, 'bear_tsl_mult': 0.9435868016800788, 'bear_time_stop': 149, 'bear_use_sma': False, 'bear_use_ema': False, 'bear_use_atr': False, 'bear_use_adx': True, 'bear_use_spike': False, 'bear_rsi_required': False, 'sideways_strategy': 'mean_reversion', 'sideways_bb_std_mult': 2.4010573845084, 'sideways_rsi_os': 41, 'sideways_rsi_ob': 91, 'sideways_adx_thresh': 6.181889706191146, 'sideways_atr_min_pct': 0.006103184877692991, 'sideways_atr_max_pct': 0.038621732999410345, 'sideways_tp_mult': 1.719443473134282, 'sideways_tsl_mult': 0.7854016352509117, 'sideways_time_stop': 79, 'sideways_use_sma': False, 'sideways_use_ema': False, 'sideways_use_atr': False, 'sideways_use_adx': False, 'sideways_use_spike': True, 'sideways_rsi_required': True}.
[I 2025-09-01 14:33:29,994] Trial 263 finished with values: [-0.01747388270137018, 0.017391704697202744] and parameters: {'p_sma': 15, 'p_std': 13, 'p_atr': 20, 'p_adx': 25, 'rsi_period': 71, 'ema1': 30, 'ema2': 28, 'slip_atr_k': 0.14435894753973566, 'slip_spread_k': 0.2769030433688929, 'spread_hl_frac': 0.0002886224616955521, 'bb_std_mult': 1.2965092509270544, 'rsi_os': 36, 'rsi_ob': 72, 'vol_spike': 0.28396050807507683, 'adx_thresh': 19.197578730200878, 'atr_min_pct': 0.003060129322452915, 'atr_max_pct': 0.020100090507417942, 'tp_mult': 2.9134107030760354, 'tsl_mult': 0.11435746843454536, 'strategy': 'breakout', 'time_stop': 41, 'use_sma': False, 'use_atr': True, 'use_adx': False, 'use_ema': False, 'use_spike': True, 'rsi_required': False, 'edge_k': 1.5639135058847717, 'edge_cap': 0.085420039857797, 'bull_strategy': 'breakout', 'bull_bb_std_mult': 2.384945427092618, 'bull_rsi_os': 26, 'bull_rsi_ob': 51, 'bull_adx_thresh': 8.88470054010482, 'bull_atr_min_pct': 0.029056554722837663, 'bull_atr_max_pct': 0.012401829554147228, 'bull_tp_mult': 2.1197262027859516, 'bull_tsl_mult': 0.20511168494534282, 'bull_time_stop': 137, 'bull_use_sma': True, 'bull_use_ema': False, 'bull_use_atr': False, 'bull_use_adx': True, 'bull_use_spike': False, 'bull_rsi_required': True, 'bear_strategy': 'mean_reversion', 'bear_bb_std_mult': 2.2074554473996115, 'bear_rsi_os': 26, 'bear_rsi_ob': 75, 'bear_adx_thresh': 23.231462521796473, 'bear_atr_min_pct': 0.027384213514046796, 'bear_atr_max_pct': 0.1171654330542054, 'bear_tp_mult': 2.197452971377549, 'bear_tsl_mult': 0.8586899787556157, 'bear_time_stop': 59, 'bear_use_sma': False, 'bear_use_ema': False, 'bear_use_atr': False, 'bear_use_adx': True, 'bear_use_spike': False, 'bear_rsi_required': False, 'sideways_strategy': 'mean_reversion', 'sideways_bb_std_mult': 3.1962045864682733, 'sideways_rsi_os': 38, 'sideways_rsi_ob': 91, 'sideways_adx_thresh': 29.57363502197917, 'sideways_atr_min_pct': 0.001185101737507098, 'sideways_atr_max_pct': 0.05704166171714111, 'sideways_tp_mult': 1.963129022869821, 'sideways_tsl_mult': 0.2857473344769387, 'sideways_time_stop': 117, 'sideways_use_sma': False, 'sideways_use_ema': False, 'sideways_use_atr': False, 'sideways_use_adx': False, 'sideways_use_spike': True, 'sideways_rsi_required': True}.
[I 2025-09-01 14:33:30,365] Trial 260 finished with values: [-0.019823454939820517, 0.019679737230203578] and parameters: {'p_sma': 11, 'p_std': 11, 'p_atr': 9, 'p_adx': 18, 'rsi_period': 66, 'ema1': 29, 'ema2': 28, 'slip_atr_k': 0.0712391294681516, 'slip_spread_k': 0.21894169128537191, 'spread_hl_frac': 0.011724492596838967, 'bb_std_mult': 1.3047668137100459, 'rsi_os': 33, 'rsi_ob': 73, 'vol_spike': 0.2793169844859174, 'adx_thresh': 18.99953527527347, 'atr_min_pct': 0.01680168660880407, 'atr_max_pct': 0.027818874066659574, 'tp_mult': 2.9585085090924896, 'tsl_mult': 0.08106852487092381, 'strategy': 'breakout', 'time_stop': 79, 'use_sma': False, 'use_atr': True, 'use_adx': False, 'use_ema': False, 'use_spike': True, 'rsi_required': False, 'edge_k': 0.7063734221639919, 'edge_cap': 0.08845479854429329, 'bull_strategy': 'breakout', 'bull_bb_std_mult': 2.981523267845435, 'bull_rsi_os': 18, 'bull_rsi_ob': 48, 'bull_adx_thresh': 10.816892683351044, 'bull_atr_min_pct': 0.021717050922785884, 'bull_atr_max_pct': 0.02649141207253938, 'bull_tp_mult': 1.058324033889487, 'bull_tsl_mult': 0.9535420903400273, 'bull_time_stop': 37, 'bull_use_sma': True, 'bull_use_ema': False, 'bull_use_atr': False, 'bull_use_adx': False, 'bull_use_spike': False, 'bull_rsi_required': True, 'bear_strategy': 'mean_reversion', 'bear_bb_std_mult': 3.2355075656301073, 'bear_rsi_os': 8, 'bear_rsi_ob': 61, 'bear_adx_thresh': 26.876267233724363, 'bear_atr_min_pct': 0.027414030353093193, 'bear_atr_max_pct': 0.10919717080435296, 'bear_tp_mult': 2.4936628960864597, 'bear_tsl_mult': 0.6009780311539268, 'bear_time_stop': 291, 'bear_use_sma': False, 'bear_use_ema': False, 'bear_use_atr': False, 'bear_use_adx': True, 'bear_use_spike': False, 'bear_rsi_required': False, 'sideways_strategy': 'mean_reversion', 'sideways_bb_std_mult': 3.1917189480853145, 'sideways_rsi_os': 41, 'sideways_rsi_ob': 91, 'sideways_adx_thresh': 11.530419659718255, 'sideways_atr_min_pct': 0.002640312293959765, 'sideways_atr_max_pct': 0.035460913627936734, 'sideways_tp_mult': 1.7123921276357459, 'sideways_tsl_mult': 0.3149789417350126, 'sideways_time_stop': 81, 'sideways_use_sma': False, 'sideways_use_ema': False, 'sideways_use_atr': True, 'sideways_use_adx': False, 'sideways_use_spike': True, 'sideways_rsi_required': True}.
[I 2025-09-01 14:33:30,747] Trial 264 finished with values: [-0.03853232563279996, 0.03850028399007784] and parameters: {'p_sma': 11, 'p_std': 13, 'p_atr': 14, 'p_adx': 24, 'rsi_period': 19, 'ema1': 9, 'ema2': 27, 'slip_atr_k': 0.14277147719644545, 'slip_spread_k': 0.2706699726561747, 'spread_hl_frac': 0.01222084324659951, 'bb_std_mult': 3.0057385438401347, 'rsi_os': 49, 'rsi_ob': 73, 'vol_spike': 0.299843726882397, 'adx_thresh': 20.804184278639408, 'atr_min_pct': 0.002779179793181189, 'atr_max_pct': 0.07630934989421066, 'tp_mult': 2.6748677102106235, 'tsl_mult': 0.05373272364165117, 'strategy': 'breakout', 'time_stop': 118, 'use_sma': True, 'use_atr': True, 'use_adx': True, 'use_ema': True, 'use_spike': True, 'rsi_required': False, 'edge_k': 0.5865977418359408, 'edge_cap': 0.08051705622165964, 'bull_strategy': 'breakout', 'bull_bb_std_mult': 3.2527634788089066, 'bull_rsi_os': 15, 'bull_rsi_ob': 66, 'bull_adx_thresh': 33.0547757284229, 'bull_atr_min_pct': 0.020170724270280074, 'bull_atr_max_pct': 0.04486419139082045, 'bull_tp_mult': 1.0437004621397477, 'bull_tsl_mult': 0.3986385349681474, 'bull_time_stop': 171, 'bull_use_sma': False, 'bull_use_ema': False, 'bull_use_atr': False, 'bull_use_adx': True, 'bull_use_spike': False, 'bull_rsi_required': True, 'bear_strategy': 'mean_reversion', 'bear_bb_std_mult': 2.2037769253883854, 'bear_rsi_os': 22, 'bear_rsi_ob': 84, 'bear_adx_thresh': 27.73566814279739, 'bear_atr_min_pct': 0.02455865550159457, 'bear_atr_max_pct': 0.11898286429683164, 'bear_tp_mult': 1.7019414845529615, 'bear_tsl_mult': 0.5963440278833697, 'bear_time_stop': 97, 'bear_use_sma': False, 'bear_use_ema': True, 'bear_use_atr': False, 'bear_use_adx': True, 'bear_use_spike': False, 'bear_rsi_required': False, 'sideways_strategy': 'mean_reversion', 'sideways_bb_std_mult': 3.1929569903457793, 'sideways_rsi_os': 47, 'sideways_rsi_ob': 89, 'sideways_adx_thresh': 12.932433142521756, 'sideways_atr_min_pct': 0.0013591222121668717, 'sideways_atr_max_pct': 0.023526606428759332, 'sideways_tp_mult': 1.897004589917416, 'sideways_tsl_mult': 0.2954710897675042, 'sideways_time_stop': 82, 'sideways_use_sma': False, 'sideways_use_ema': True, 'sideways_use_atr': True, 'sideways_use_adx': False, 'sideways_use_spike': True, 'sideways_rsi_required': True}.
[I 2025-09-01 14:34:06,358] Trial 268 finished with values: [-1000000000.0, 1000000000.0] and parameters: {'p_sma': 12, 'p_std': 9, 'p_atr': 20, 'p_adx': 18, 'rsi_period': 10, 'ema1': 24, 'ema2': 50, 'slip_atr_k': 0.060549397275178336, 'slip_spread_k': 0.6936401778397938, 'spread_hl_frac': 0.000269632270510127, 'bb_std_mult': 1.3078603233157413, 'rsi_os': 52, 'rsi_ob': 87, 'vol_spike': 0.2910627544112046, 'adx_thresh': 18.389296753704127, 'atr_min_pct': 0.01686824489154622, 'atr_max_pct': 0.13636615643569322, 'tp_mult': 2.165115528230464, 'tsl_mult': 0.631137586995882, 'strategy': 'breakout', 'time_stop': 109, 'use_sma': False, 'use_atr': True, 'use_adx': True, 'use_ema': False, 'use_spike': True, 'rsi_required': False, 'edge_k': 0.49354052114275954, 'edge_cap': 0.645925948866194, 'bull_strategy': 'breakout', 'bull_bb_std_mult': 2.792213889143075, 'bull_rsi_os': 17, 'bull_rsi_ob': 47, 'bull_adx_thresh': 25.1465918058459, 'bull_atr_min_pct': 0.005202627536219669, 'bull_atr_max_pct': 0.012145304851402992, 'bull_tp_mult': 2.1061748469048407, 'bull_tsl_mult': 0.5691920283344178, 'bull_time_stop': 144, 'bull_use_sma': True, 'bull_use_ema': False, 'bull_use_atr': False, 'bull_use_adx': True, 'bull_use_spike': False, 'bull_rsi_required': True, 'bear_strategy': 'mean_reversion', 'bear_bb_std_mult': 2.7624420262612315, 'bear_rsi_os': 9, 'bear_rsi_ob': 75, 'bear_adx_thresh': 18.92734452007807, 'bear_atr_min_pct': 0.023250054751978902, 'bear_atr_max_pct': 0.1089174142604806, 'bear_tp_mult': 2.475725713886251, 'bear_tsl_mult': 0.6238697228561245, 'bear_time_stop': 149, 'bear_use_sma': False, 'bear_use_ema': False, 'bear_use_atr': False, 'bear_use_adx': True, 'bear_use_spike': False, 'bear_rsi_required': False, 'sideways_strategy': 'mean_reversion', 'sideways_bb_std_mult': 3.3859168817241407, 'sideways_rsi_os': 16, 'sideways_rsi_ob': 89, 'sideways_adx_thresh': 7.043980959563866, 'sideways_atr_min_pct': 0.0059466408473714295, 'sideways_atr_max_pct': 0.10433875088727076, 'sideways_tp_mult': 1.8086869398314689, 'sideways_tsl_mult': 0.31496132390758047, 'sideways_time_stop': 110, 'sideways_use_sma': False, 'sideways_use_ema': False, 'sideways_use_atr': True, 'sideways_use_adx': False, 'sideways_use_spike': True, 'sideways_rsi_required': True}.
[I 2025-09-01 14:34:07,577] Trial 265 finished with values: [-1000000000.0, 1000000000.0] and parameters: {'p_sma': 12, 'p_std': 5, 'p_atr': 9, 'p_adx': 27, 'rsi_period': 11, 'ema1': 30, 'ema2': 50, 'slip_atr_k': 0.059994528645749945, 'slip_spread_k': 0.5665072719716093, 'spread_hl_frac': 0.004782903766915422, 'bb_std_mult': 3.0941522315348267, 'rsi_os': 7, 'rsi_ob': 88, 'vol_spike': 0.006948652603406075, 'adx_thresh': 20.41064564759182, 'atr_min_pct': 0.024524862240214204, 'atr_max_pct': 0.0762228629856893, 'tp_mult': 2.907460450994501, 'tsl_mult': 0.7674396606848244, 'strategy': 'breakout', 'time_stop': 74, 'use_sma': True, 'use_atr': True, 'use_adx': True, 'use_ema': True, 'use_spike': True, 'rsi_required': False, 'edge_k': 1.7688339316436918, 'edge_cap': 0.5158200904237725, 'bull_strategy': 'breakout', 'bull_bb_std_mult': 2.7592828316172353, 'bull_rsi_os': 21, 'bull_rsi_ob': 52, 'bull_adx_thresh': 9.068400576229639, 'bull_atr_min_pct': 0.029353939433104353, 'bull_atr_max_pct': 0.024458354904866322, 'bull_tp_mult': 2.943121951021242, 'bull_tsl_mult': 0.9456025333975755, 'bull_time_stop': 177, 'bull_use_sma': False, 'bull_use_ema': False, 'bull_use_atr': False, 'bull_use_adx': True, 'bull_use_spike': False, 'bull_rsi_required': True, 'bear_strategy': 'mean_reversion', 'bear_bb_std_mult': 2.7813612209679515, 'bear_rsi_os': 9, 'bear_rsi_ob': 84, 'bear_adx_thresh': 23.01686342153175, 'bear_atr_min_pct': 0.024622883492984967, 'bear_atr_max_pct': 0.11912602631891911, 'bear_tp_mult': 2.465239912135353, 'bear_tsl_mult': 0.6026216817992894, 'bear_time_stop': 98, 'bear_use_sma': False, 'bear_use_ema': True, 'bear_use_atr': False, 'bear_use_adx': True, 'bear_use_spike': False, 'bear_rsi_required': False, 'sideways_strategy': 'mean_reversion', 'sideways_bb_std_mult': 3.2185985136535535, 'sideways_rsi_os': 17, 'sideways_rsi_ob': 89, 'sideways_adx_thresh': 29.56899785613782, 'sideways_atr_min_pct': 0.019742088727420067, 'sideways_atr_max_pct': 0.1382206210531725, 'sideways_tp_mult': 2.6901621179942374, 'sideways_tsl_mult': 0.2857362267585537, 'sideways_time_stop': 109, 'sideways_use_sma': False, 'sideways_use_ema': True, 'sideways_use_atr': True, 'sideways_use_adx': False, 'sideways_use_spike': True, 'sideways_rsi_required': True}.
[I 2025-09-01 14:34:07,595] Trial 267 finished with values: [-1000000000.0, 1000000000.0] and parameters: {'p_sma': 12, 'p_std': 9, 'p_atr': 20, 'p_adx': 18, 'rsi_period': 28, 'ema1': 10, 'ema2': 50, 'slip_atr_k': 0.060068676075567345, 'slip_spread_k': 0.2699445296960234, 'spread_hl_frac': 0.04977556386074988, 'bb_std_mult': 3.132295078250961, 'rsi_os': 36, 'rsi_ob': 87, 'vol_spike': 0.29943778155312345, 'adx_thresh': 20.523093414984743, 'atr_min_pct': 0.016858417527476074, 'atr_max_pct': 0.01979398557342034, 'tp_mult': 2.6704324436265554, 'tsl_mult': 0.5338748521131944, 'strategy': 'breakout', 'time_stop': 120, 'use_sma': True, 'use_atr': True, 'use_adx': True, 'use_ema': True, 'use_spike': True, 'rsi_required': False, 'edge_k': 0.22370878540327221, 'edge_cap': 0.08561941985042223, 'bull_strategy': 'breakout', 'bull_bb_std_mult': 2.752878021463795, 'bull_rsi_os': 16, 'bull_rsi_ob': 46, 'bull_adx_thresh': 10.13908941257478, 'bull_atr_min_pct': 0.020573500581360333, 'bull_atr_max_pct': 0.025503560925706326, 'bull_tp_mult': 2.808929604157092, 'bull_tsl_mult': 0.39815208919376527, 'bull_time_stop': 170, 'bull_use_sma': False, 'bull_use_ema': False, 'bull_use_atr': False, 'bull_use_adx': True, 'bull_use_spike': False, 'bull_rsi_required': True, 'bear_strategy': 'mean_reversion', 'bear_bb_std_mult': 2.7899735928061236, 'bear_rsi_os': 9, 'bear_rsi_ob': 47, 'bear_adx_thresh': 27.691056008167877, 'bear_atr_min_pct': 0.027381606229037875, 'bear_atr_max_pct': 0.11746824299558987, 'bear_tp_mult': 2.4814304055398893, 'bear_tsl_mult': 0.5969819963129146, 'bear_time_stop': 271, 'bear_use_sma': False, 'bear_use_ema': True, 'bear_use_atr': False, 'bear_use_adx': True, 'bear_use_spike': False, 'bear_rsi_required': False, 'sideways_strategy': 'mean_reversion', 'sideways_bb_std_mult': 3.393452864303447, 'sideways_rsi_os': 16, 'sideways_rsi_ob': 89, 'sideways_adx_thresh': 6.818371437185361, 'sideways_atr_min_pct': 0.005975136572902303, 'sideways_atr_max_pct': 0.10588896174660473, 'sideways_tp_mult': 1.8908262594311118, 'sideways_tsl_mult': 0.9645156343695103, 'sideways_time_stop': 110, 'sideways_use_sma': False, 'sideways_use_ema': True, 'sideways_use_atr': True, 'sideways_use_adx': False, 'sideways_use_spike': True, 'sideways_rsi_required': True}.
[I 2025-09-01 14:34:07,815] Trial 266 finished with values: [-1000000000.0, 1000000000.0] and parameters: {'p_sma': 12, 'p_std': 13, 'p_atr': 20, 'p_adx': 18, 'rsi_period': 25, 'ema1': 9, 'ema2': 28, 'slip_atr_k': 0.05959543490208895, 'slip_spread_k': 0.27544341649112786, 'spread_hl_frac': 0.012249342505635646, 'bb_std_mult': 1.300316305959395, 'rsi_os': 7, 'rsi_ob': 73, 'vol_spike': 0.299205334033389, 'adx_thresh': 20.52378725112569, 'atr_min_pct': 0.017203563258206322, 'atr_max_pct': 0.0743187523993385, 'tp_mult': 2.6717454485350554, 'tsl_mult': 0.07868590180917887, 'strategy': 'breakout', 'time_stop': 75, 'use_sma': True, 'use_atr': True, 'use_adx': True, 'use_ema': True, 'use_spike': True, 'rsi_required': False, 'edge_k': 0.5885369731305, 'edge_cap': 0.6356995216827566, 'bull_strategy': 'breakout', 'bull_bb_std_mult': 2.7846163207372516, 'bull_rsi_os': 12, 'bull_rsi_ob': 46, 'bull_adx_thresh': 16.839790201642103, 'bull_atr_min_pct': 0.026666829767794144, 'bull_atr_max_pct': 0.026780786311782753, 'bull_tp_mult': 1.0565953923817804, 'bull_tsl_mult': 0.7624115776656001, 'bull_time_stop': 137, 'bull_use_sma': False, 'bull_use_ema': False, 'bull_use_atr': False, 'bull_use_adx': True, 'bull_use_spike': False, 'bull_rsi_required': True, 'bear_strategy': 'mean_reversion', 'bear_bb_std_mult': 2.7755890312351372, 'bear_rsi_os': 9, 'bear_rsi_ob': 75, 'bear_adx_thresh': 28.04688421916805, 'bear_atr_min_pct': 0.024678693048323565, 'bear_atr_max_pct': 0.117014482559186, 'bear_tp_mult': 2.4637676177559573, 'bear_tsl_mult': 0.5981029689288864, 'bear_time_stop': 95, 'bear_use_sma': False, 'bear_use_ema': True, 'bear_use_atr': False, 'bear_use_adx': True, 'bear_use_spike': False, 'bear_rsi_required': False, 'sideways_strategy': 'mean_reversion', 'sideways_bb_std_mult': 3.3844930484559703, 'sideways_rsi_os': 17, 'sideways_rsi_ob': 89, 'sideways_adx_thresh': 33.93455905927455, 'sideways_atr_min_pct': 0.005823468518238378, 'sideways_atr_max_pct': 0.025287728120132635, 'sideways_tp_mult': 1.7153407383686006, 'sideways_tsl_mult': 0.2904588656060806, 'sideways_time_stop': 80, 'sideways_use_sma': False, 'sideways_use_ema': True, 'sideways_use_atr': True, 'sideways_use_adx': False, 'sideways_use_spike': True, 'sideways_rsi_required': True}.
[I 2025-09-01 14:34:42,077] Trial 272 finished with values: [-1000000000.0, 1000000000.0] and parameters: {'p_sma': 33, 'p_std': 42, 'p_atr': 21, 'p_adx': 25, 'rsi_period': 38, 'ema1': 28, 'ema2': 31, 'slip_atr_k': 0.06596452147761543, 'slip_spread_k': 0.22109092794230842, 'spread_hl_frac': 0.013858306680575224, 'bb_std_mult': 1.4638938675375408, 'rsi_os': 37, 'rsi_ob': 71, 'vol_spike': 0.2902520052450953, 'adx_thresh': 29.114968985110842, 'atr_min_pct': 0.015364668878711806, 'atr_max_pct': 0.08514207169502482, 'tp_mult': 2.9543336162723266, 'tsl_mult': 0.3604906790286312, 'strategy': 'breakout', 'time_stop': 204, 'use_sma': False, 'use_atr': True, 'use_adx': False, 'use_ema': False, 'use_spike': True, 'rsi_required': False, 'edge_k': 0.5384597020359502, 'edge_cap': 0.06859187122112953, 'bull_strategy': 'breakout', 'bull_bb_std_mult': 2.914776447500698, 'bull_rsi_os': 17, 'bull_rsi_ob': 49, 'bull_adx_thresh': 11.07921319131958, 'bull_atr_min_pct': 0.02827337917334434, 'bull_atr_max_pct': 0.014486038415295287, 'bull_tp_mult': 2.1104003475126984, 'bull_tsl_mult': 0.21273468748308627, 'bull_time_stop': 153, 'bull_use_sma': True, 'bull_use_ema': False, 'bull_use_atr': False, 'bull_use_adx': True, 'bull_use_spike': False, 'bull_rsi_required': False, 'bear_strategy': 'mean_reversion', 'bear_bb_std_mult': 2.707278318807984, 'bear_rsi_os': 24, 'bear_rsi_ob': 74, 'bear_adx_thresh': 28.648103916929497, 'bear_atr_min_pct': 0.025413851034047984, 'bear_atr_max_pct': 0.05505840650467131, 'bear_tp_mult': 2.543098910814706, 'bear_tsl_mult': 0.026251600922973684, 'bear_time_stop': 53, 'bear_use_sma': False, 'bear_use_ema': False, 'bear_use_atr': False, 'bear_use_adx': True, 'bear_use_spike': False, 'bear_rsi_required': False, 'sideways_strategy': 'mean_reversion', 'sideways_bb_std_mult': 3.3087591182467024, 'sideways_rsi_os': 14, 'sideways_rsi_ob': 90, 'sideways_adx_thresh': 8.373714168929956, 'sideways_atr_min_pct': 0.0024942027763550905, 'sideways_atr_max_pct': 0.04069952865601543, 'sideways_tp_mult': 1.7184119767745447, 'sideways_tsl_mult': 0.26942377305050935, 'sideways_time_stop': 162, 'sideways_use_sma': False, 'sideways_use_ema': False, 'sideways_use_atr': False, 'sideways_use_adx': False, 'sideways_use_spike': True, 'sideways_rsi_required': True}.
