[I 2025-09-01 14:07:42,373] Trial 102 finished with values: [-1000000000.0, 1000000000.0] and parameters: {'p_sma': 31, 'p_std': 42, 'p_atr': 23, 'p_adx': 21, 'rsi_period': 63, 'ema1': 14, 'ema2': 45, 'slip_atr_k': 0.22343899614638268, 'slip_spread_k': 0.21461590333158592, 'spread_hl_frac': 0.002277585496420327, 'bb_std_mult': 1.9934323110592866, 'rsi_os': 5, 'rsi_ob': 79, 'vol_spike': 0.07396677674800775, 'adx_thresh': 25.77030943860025, 'atr_min_pct': 0.01144636166159408, 'atr_max_pct': 0.04703976235953067, 'tp_mult': 2.0036708389756877, 'tsl_mult': 0.23259213137736462, 'strategy': 'mean_reversion', 'time_stop': 132, 'use_sma': False, 'use_atr': True, 'use_adx': True, 'use_ema': False, 'use_spike': False, 'rsi_required': False, 'edge_k': 1.0146791076654151, 'edge_cap': 0.19498126156572737, 'bull_strategy': 'mean_reversion', 'bull_bb_std_mult': 2.137490799449022, 'bull_rsi_os': 31, 'bull_rsi_ob': 50, 'bull_adx_thresh': 8.472598650395515, 'bull_atr_min_pct': 0.02529723935900603, 'bull_atr_max_pct': 0.11271492145707825, 'bull_tp_mult': 1.9068456852590765, 'bull_tsl_mult': 0.055932195627437516, 'bull_time_stop': 187, 'bull_use_sma': True, 'bull_use_ema': True, 'bull_use_atr': False, 'bull_use_adx': True, 'bull_use_spike': False, 'bull_rsi_required': False, 'bear_strategy': 'breakout', 'bear_bb_std_mult': 1.474974229718285, 'bear_rsi_os': 48, 'bear_rsi_ob': 90, 'bear_adx_thresh': 30.10300630271334, 'bear_atr_min_pct': 0.015239871332272007, 'bear_atr_max_pct': 0.018717460236115632, 'bear_tp_mult': 2.356573211372863, 'bear_tsl_mult': 0.3693985598714115, 'bear_time_stop': 38, 'bear_use_sma': True, 'bear_use_ema': False, 'bear_use_atr': True, 'bear_use_adx': True, 'bear_use_spike': True, 'bear_rsi_required': False, 'sideways_strategy': 'mean_reversion', 'sideways_bb_std_mult': 2.2135325686320497, 'sideways_rsi_os': 28, 'sideways_rsi_ob': 45, 'sideways_adx_thresh': 22.762738899693968, 'sideways_atr_min_pct': 0.014676075279753037, 'sideways_atr_max_pct': 0.0866673066540601, 'sideways_tp_mult': 2.291975252566296, 'sideways_tsl_mult': 0.3386020066064723, 'sideways_time_stop': 256, 'sideways_use_sma': True, 'sideways_use_ema': False, 'sideways_use_atr': True, 'sideways_use_adx': False, 'sideways_use_spike': False, 'sideways_rsi_required': False}.
[I 2025-09-01 14:07:42,956] Trial 101 finished with values: [-1000000000.0, 1000000000.0] and parameters: {'p_sma': 28, 'p_std': 50, 'p_atr': 26, 'p_adx': 21, 'rsi_period': 63, 'ema1': 18, 'ema2': 45, 'slip_atr_k': 0.0648922339606652, 'slip_spread_k': 0.27737699567694973, 'spread_hl_frac': 0.02373540879807228, 'bb_std_mult': 2.0958581958826494, 'rsi_os': 30, 'rsi_ob': 77, 'vol_spike': 0.06056020529884608, 'adx_thresh': 9.457328631612123, 'atr_min_pct': 0.02029993722302926, 'atr_max_pct': 0.13483522911604645, 'tp_mult': 1.6953442466301014, 'tsl_mult': 0.2279840243615447, 'strategy': 'breakout', 'time_stop': 132, 'use_sma': False, 'use_atr': False, 'use_adx': False, 'use_ema': False, 'use_spike': True, 'rsi_required': True, 'edge_k': 1.299852238913641, 'edge_cap': 0.6996205694011122, 'bull_strategy': 'mean_reversion', 'bull_bb_std_mult': 3.567205379241678, 'bull_rsi_os': 24, 'bull_rsi_ob': 86, 'bull_adx_thresh': 25.878147089641118, 'bull_atr_min_pct': 0.014503559931102021, 'bull_atr_max_pct': 0.11264034262157216, 'bull_tp_mult': 1.7769236434420574, 'bull_tsl_mult': 0.8003257981920489, 'bull_time_stop': 187, 'bull_use_sma': True, 'bull_use_ema': True, 'bull_use_atr': True, 'bull_use_adx': False, 'bull_use_spike': True, 'bull_rsi_required': False, 'bear_strategy': 'breakout', 'bear_bb_std_mult': 3.5185018135280224, 'bear_rsi_os': 32, 'bear_rsi_ob': 90, 'bear_adx_thresh': 14.203609938293, 'bear_atr_min_pct': 0.02669364745252254, 'bear_atr_max_pct': 0.01908004238843316, 'bear_tp_mult': 2.368564726641985, 'bear_tsl_mult': 0.616842118558164, 'bear_time_stop': 289, 'bear_use_sma': False, 'bear_use_ema': False, 'bear_use_atr': True, 'bear_use_adx': False, 'bear_use_spike': True, 'bear_rsi_required': False, 'sideways_strategy': 'breakout', 'sideways_bb_std_mult': 0.7788214083965022, 'sideways_rsi_os': 25, 'sideways_rsi_ob': 86, 'sideways_adx_thresh': 22.702184894817258, 'sideways_atr_min_pct': 0.0010105037391160091, 'sideways_atr_max_pct': 0.09932761132506802, 'sideways_tp_mult': 2.296541957721999, 'sideways_tsl_mult': 0.7009147321461044, 'sideways_time_stop': 262, 'sideways_use_sma': True, 'sideways_use_ema': False, 'sideways_use_atr': True, 'sideways_use_adx': True, 'sideways_use_spike': True, 'sideways_rsi_required': True}.
[I 2025-09-01 14:07:43,215] Trial 100 finished with values: [-1000000000.0, 1000000000.0] and parameters: {'p_sma': 42, 'p_std': 50, 'p_atr': 24, 'p_adx': 21, 'rsi_period': 63, 'ema1': 18, 'ema2': 36, 'slip_atr_k': 0.053297883826564446, 'slip_spread_k': 0.21485431612372458, 'spread_hl_frac': 0.02350222667745366, 'bb_std_mult': 1.2801617631060456, 'rsi_os': 53, 'rsi_ob': 77, 'vol_spike': 0.05860883914060063, 'adx_thresh': 28.398239521275606, 'atr_min_pct': 0.02010330316842512, 'atr_max_pct': 0.10655366088184241, 'tp_mult': 2.3756546004595336, 'tsl_mult': 0.9278941111476809, 'strategy': 'breakout', 'time_stop': 261, 'use_sma': False, 'use_atr': False, 'use_adx': False, 'use_ema': False, 'use_spike': False, 'rsi_required': True, 'edge_k': 0.9929160168114612, 'edge_cap': 0.19326560166008921, 'bull_strategy': 'mean_reversion', 'bull_bb_std_mult': 0.8983160205068539, 'bull_rsi_os': 24, 'bull_rsi_ob': 50, 'bull_adx_thresh': 16.536746905385087, 'bull_atr_min_pct': 0.013015520288996198, 'bull_atr_max_pct': 0.11341668291396148, 'bull_tp_mult': 1.903154488296599, 'bull_tsl_mult': 0.17111770623790423, 'bull_time_stop': 130, 'bull_use_sma': True, 'bull_use_ema': True, 'bull_use_atr': True, 'bull_use_adx': False, 'bull_use_spike': True, 'bull_rsi_required': True, 'bear_strategy': 'mean_reversion', 'bear_bb_std_mult': 2.231561118340755, 'bear_rsi_os': 13, 'bear_rsi_ob': 89, 'bear_adx_thresh': 29.36044739645305, 'bear_atr_min_pct': 0.029728012693942332, 'bear_atr_max_pct': 0.03505565545012205, 'bear_tp_mult': 2.722430652914559, 'bear_tsl_mult': 0.16773739224258433, 'bear_time_stop': 241, 'bear_use_sma': False, 'bear_use_ema': False, 'bear_use_atr': True, 'bear_use_adx': False, 'bear_use_spike': True, 'bear_rsi_required': False, 'sideways_strategy': 'breakout', 'sideways_bb_std_mult': 1.9051690362261824, 'sideways_rsi_os': 29, 'sideways_rsi_ob': 86, 'sideways_adx_thresh': 17.0394891658893, 'sideways_atr_min_pct': 0.027427022148293873, 'sideways_atr_max_pct': 0.09832603505919427, 'sideways_tp_mult': 2.2735100019606858, 'sideways_tsl_mult': 0.735780120372907, 'sideways_time_stop': 132, 'sideways_use_sma': True, 'sideways_use_ema': False, 'sideways_use_atr': True, 'sideways_use_adx': True, 'sideways_use_spike': True, 'sideways_rsi_required': True}.
[I 2025-09-01 14:07:43,473] Trial 99 finished with values: [-1000000000.0, 1000000000.0] and parameters: {'p_sma': 28, 'p_std': 18, 'p_atr': 25, 'p_adx': 21, 'rsi_period': 43, 'ema1': 19, 'ema2': 43, 'slip_atr_k': 0.21084053665866798, 'slip_spread_k': 0.20845830895664397, 'spread_hl_frac': 0.021450239496497898, 'bb_std_mult': 3.249521209232848, 'rsi_os': 14, 'rsi_ob': 84, 'vol_spike': 0.05914306203278153, 'adx_thresh': 18.54911090881297, 'atr_min_pct': 0.011290526837485658, 'atr_max_pct': 0.10637411582117517, 'tp_mult': 1.7423710699211388, 'tsl_mult': 0.22575672064765115, 'strategy': 'mean_reversion', 'time_stop': 255, 'use_sma': False, 'use_atr': True, 'use_adx': True, 'use_ema': False, 'use_spike': True, 'rsi_required': False, 'edge_k': 1.2428378629763066, 'edge_cap': 0.711841661847755, 'bull_strategy': 'mean_reversion', 'bull_bb_std_mult': 2.165059096975711, 'bull_rsi_os': 31, 'bull_rsi_ob': 54, 'bull_adx_thresh': 29.563315284069795, 'bull_atr_min_pct': 0.02497893347445304, 'bull_atr_max_pct': 0.06099041488723318, 'bull_tp_mult': 1.783353224835858, 'bull_tsl_mult': 0.0072484433588404186, 'bull_time_stop': 127, 'bull_use_sma': True, 'bull_use_ema': True, 'bull_use_atr': False, 'bull_use_adx': False, 'bull_use_spike': True, 'bull_rsi_required': True, 'bear_strategy': 'breakout', 'bear_bb_std_mult': 1.2670000239081485, 'bear_rsi_os': 13, 'bear_rsi_ob': 46, 'bear_adx_thresh': 13.94425735590788, 'bear_atr_min_pct': 0.00828218304646779, 'bear_atr_max_pct': 0.010768744638764908, 'bear_tp_mult': 2.702200925663057, 'bear_tsl_mult': 0.17140494847825843, 'bear_time_stop': 287, 'bear_use_sma': True, 'bear_use_ema': False, 'bear_use_atr': True, 'bear_use_adx': False, 'bear_use_spike': False, 'bear_rsi_required': True, 'sideways_strategy': 'mean_reversion', 'sideways_bb_std_mult': 2.2352869825899018, 'sideways_rsi_os': 35, 'sideways_rsi_ob': 47, 'sideways_adx_thresh': 21.699798123186028, 'sideways_atr_min_pct': 0.018494069988675445, 'sideways_atr_max_pct': 0.09784922359127471, 'sideways_tp_mult': 1.1390617862179648, 'sideways_tsl_mult': 0.7079806155000763, 'sideways_time_stop': 258, 'sideways_use_sma': False, 'sideways_use_ema': False, 'sideways_use_atr': True, 'sideways_use_adx': True, 'sideways_use_spike': True, 'sideways_rsi_required': False}.
[I 2025-09-01 14:08:19,897] Trial 105 finished with values: [-1000000000.0, 1000000000.0] and parameters: {'p_sma': 23, 'p_std': 52, 'p_atr': 25, 'p_adx': 19, 'rsi_period': 11, 'ema1': 30, 'ema2': 41, 'slip_atr_k': 0.0016026274536851681, 'slip_spread_k': 0.3397768950526746, 'spread_hl_frac': 0.0182229618381463, 'bb_std_mult': 3.4713225830473924, 'rsi_os': 14, 'rsi_ob': 71, 'vol_spike': 0.04215623375920557, 'adx_thresh': 18.439501869437684, 'atr_min_pct': 0.007983345552491184, 'atr_max_pct': 0.05751766554400353, 'tp_mult': 1.8404182945216063, 'tsl_mult': 0.2713064755275988, 'strategy': 'mean_reversion', 'time_stop': 218, 'use_sma': True, 'use_atr': False, 'use_adx': True, 'use_ema': True, 'use_spike': False, 'rsi_required': True, 'edge_k': 1.0873797873712479, 'edge_cap': 0.8659660842579815, 'bull_strategy': 'breakout', 'bull_bb_std_mult': 1.038737225854344, 'bull_rsi_os': 29, 'bull_rsi_ob': 75, 'bull_adx_thresh': 7.20115499112702, 'bull_atr_min_pct': 0.019293126014457377, 'bull_atr_max_pct': 0.12802781176867217, 'bull_tp_mult': 1.4969133399714722, 'bull_tsl_mult': 0.026206374897534506, 'bull_time_stop': 300, 'bull_use_sma': False, 'bull_use_ema': False, 'bull_use_atr': True, 'bull_use_adx': True, 'bull_use_spike': True, 'bull_rsi_required': True, 'bear_strategy': 'breakout', 'bear_bb_std_mult': 1.5284829356714262, 'bear_rsi_os': 51, 'bear_rsi_ob': 85, 'bear_adx_thresh': 13.09895347118724, 'bear_atr_min_pct': 0.018242730923480475, 'bear_atr_max_pct': 0.11565636833612297, 'bear_tp_mult': 1.8817852196187244, 'bear_tsl_mult': 0.2783580248144137, 'bear_time_stop': 214, 'bear_use_sma': True, 'bear_use_ema': True, 'bear_use_atr': False, 'bear_use_adx': False, 'bear_use_spike': True, 'bear_rsi_required': True, 'sideways_strategy': 'breakout', 'sideways_bb_std_mult': 3.001584304454981, 'sideways_rsi_os': 21, 'sideways_rsi_ob': 81, 'sideways_adx_thresh': 24.13565122603065, 'sideways_atr_min_pct': 0.008464710881284322, 'sideways_atr_max_pct': 0.0843410713615217, 'sideways_tp_mult': 2.3871008312676256, 'sideways_tsl_mult': 0.09152108131944053, 'sideways_time_stop': 241, 'sideways_use_sma': True, 'sideways_use_ema': False, 'sideways_use_atr': False, 'sideways_use_adx': True, 'sideways_use_spike': False, 'sideways_rsi_required': False}.
[I 2025-09-01 14:08:20,662] Trial 104 finished with values: [-1000000000.0, 1000000000.0] and parameters: {'p_sma': 23, 'p_std': 26, 'p_atr': 24, 'p_adx': 15, 'rsi_period': 54, 'ema1': 30, 'ema2': 37, 'slip_atr_k': 0.042694026397781165, 'slip_spread_k': 0.3425755180135699, 'spread_hl_frac': 0.019084507585966796, 'bb_std_mult': 1.1913648509054577, 'rsi_os': 14, 'rsi_ob': 93, 'vol_spike': 0.039066835834005956, 'adx_thresh': 27.99031834965503, 'atr_min_pct': 0.008068957258946808, 'atr_max_pct': 0.10578983371443894, 'tp_mult': 1.9355485985788254, 'tsl_mult': 0.9478350367104049, 'strategy': 'mean_reversion', 'time_stop': 6, 'use_sma': False, 'use_atr': False, 'use_adx': True, 'use_ema': True, 'use_spike': False, 'rsi_required': True, 'edge_k': 1.9207847746647742, 'edge_cap': 0.8576203922539607, 'bull_strategy': 'breakout', 'bull_bb_std_mult': 1.13851023459265, 'bull_rsi_os': 29, 'bull_rsi_ob': 47, 'bull_adx_thresh': 16.7429569705441, 'bull_atr_min_pct': 0.01283799914774896, 'bull_atr_max_pct': 0.12130031639345633, 'bull_tp_mult': 1.5870865355851087, 'bull_tsl_mult': 0.02786213029864555, 'bull_time_stop': 71, 'bull_use_sma': True, 'bull_use_ema': False, 'bull_use_atr': True, 'bull_use_adx': True, 'bull_use_spike': True, 'bull_rsi_required': True, 'bear_strategy': 'breakout', 'bear_bb_std_mult': 1.5459106055741179, 'bear_rsi_os': 11, 'bear_rsi_ob': 91, 'bear_adx_thresh': 13.42462601263007, 'bear_atr_min_pct': 0.01903359516710962, 'bear_atr_max_pct': 0.012138635995991116, 'bear_tp_mult': 1.8952147647936752, 'bear_tsl_mult': 0.29317832238303415, 'bear_time_stop': 240, 'bear_use_sma': True, 'bear_use_ema': True, 'bear_use_atr': False, 'bear_use_adx': False, 'bear_use_spike': True, 'bear_rsi_required': True, 'sideways_strategy': 'breakout', 'sideways_bb_std_mult': 2.7760445673239524, 'sideways_rsi_os': 21, 'sideways_rsi_ob': 90, 'sideways_adx_thresh': 24.046671611683603, 'sideways_atr_min_pct': 0.008328942642360414, 'sideways_atr_max_pct': 0.09201033967289622, 'sideways_tp_mult': 2.3718210727232716, 'sideways_tsl_mult': 0.09799804829892461, 'sideways_time_stop': 138, 'sideways_use_sma': True, 'sideways_use_ema': False, 'sideways_use_atr': False, 'sideways_use_adx': True, 'sideways_use_spike': False, 'sideways_rsi_required': False}.
[I 2025-09-01 14:08:21,402] Trial 103 finished with values: [-0.016138137325913737, 0.016010038383454366] and parameters: {'p_sma': 28, 'p_std': 50, 'p_atr': 24, 'p_adx': 19, 'rsi_period': 38, 'ema1': 18, 'ema2': 41, 'slip_atr_k': 0.2085388862192429, 'slip_spread_k': 0.2662969995157542, 'spread_hl_frac': 0.023753060630990745, 'bb_std_mult': 3.5194101111362, 'rsi_os': 41, 'rsi_ob': 71, 'vol_spike': 0.11784616736041159, 'adx_thresh': 18.27795051129377, 'atr_min_pct': 0.008028905986758648, 'atr_max_pct': 0.1331660980306837, 'tp_mult': 1.0551091982330862, 'tsl_mult': 0.9366382422327406, 'strategy': 'breakout', 'time_stop': 54, 'use_sma': False, 'use_atr': False, 'use_adx': False, 'use_ema': False, 'use_spike': False, 'rsi_required': True, 'edge_k': 1.0876329763040857, 'edge_cap': 0.7786701895191765, 'bull_strategy': 'breakout', 'bull_bb_std_mult': 0.873924845582332, 'bull_rsi_os': 21, 'bull_rsi_ob': 62, 'bull_adx_thresh': 7.474408133564143, 'bull_atr_min_pct': 0.0024005501710645675, 'bull_atr_max_pct': 0.024843713083937416, 'bull_tp_mult': 1.4899803328151904, 'bull_tsl_mult': 0.17430772792142474, 'bull_time_stop': 71, 'bull_use_sma': True, 'bull_use_ema': True, 'bull_use_atr': True, 'bull_use_adx': True, 'bull_use_spike': True, 'bull_rsi_required': True, 'bear_strategy': 'breakout', 'bear_bb_std_mult': 2.8986721158096826, 'bear_rsi_os': 51, 'bear_rsi_ob': 85, 'bear_adx_thresh': 14.076442397394203, 'bear_atr_min_pct': 0.01895905919237852, 'bear_atr_max_pct': 0.06369904553513492, 'bear_tp_mult': 1.7034961232968482, 'bear_tsl_mult': 0.2753051636140829, 'bear_time_stop': 259, 'bear_use_sma': True, 'bear_use_ema': False, 'bear_use_atr': True, 'bear_use_adx': False, 'bear_use_spike': True, 'bear_rsi_required': False, 'sideways_strategy': 'breakout', 'sideways_bb_std_mult': 3.050302954266343, 'sideways_rsi_os': 49, 'sideways_rsi_ob': 85, 'sideways_adx_thresh': 18.376776795756545, 'sideways_atr_min_pct': 0.011392783493234452, 'sideways_atr_max_pct': 0.09752803382997854, 'sideways_tp_mult': 2.4507937718335953, 'sideways_tsl_mult': 0.2208059296568443, 'sideways_time_stop': 137, 'sideways_use_sma': True, 'sideways_use_ema': False, 'sideways_use_atr': False, 'sideways_use_adx': True, 'sideways_use_spike': True, 'sideways_rsi_required': True}.
[I 2025-09-01 14:08:21,813] Trial 106 finished with values: [-0.02043543214859833, 0.0203404238877834] and parameters: {'p_sma': 36, 'p_std': 26, 'p_atr': 24, 'p_adx': 24, 'rsi_period': 53, 'ema1': 17, 'ema2': 41, 'slip_atr_k': 0.045679917227722314, 'slip_spread_k': 0.33998252415287544, 'spread_hl_frac': 0.0138036321037921, 'bb_std_mult': 2.475092011633817, 'rsi_os': 18, 'rsi_ob': 70, 'vol_spike': 0.042506641898417546, 'adx_thresh': 32.61473274425467, 'atr_min_pct': 0.008240007540098139, 'atr_max_pct': 0.12229663772270534, 'tp_mult': 1.944639871694792, 'tsl_mult': 0.7519733742686131, 'strategy': 'mean_reversion', 'time_stop': 269, 'use_sma': True, 'use_atr': False, 'use_adx': True, 'use_ema': True, 'use_spike': False, 'rsi_required': True, 'edge_k': 0.9587374185472712, 'edge_cap': 0.7823160938625509, 'bull_strategy': 'breakout', 'bull_bb_std_mult': 1.0334265062700203, 'bull_rsi_os': 48, 'bull_rsi_ob': 62, 'bull_adx_thresh': 7.149042112700869, 'bull_atr_min_pct': 0.0024119094278319915, 'bull_atr_max_pct': 0.12854387298716521, 'bull_tp_mult': 1.574562960623396, 'bull_tsl_mult': 0.1432553184067547, 'bull_time_stop': 114, 'bull_use_sma': False, 'bull_use_ema': False, 'bull_use_atr': True, 'bull_use_adx': True, 'bull_use_spike': True, 'bull_rsi_required': True, 'bear_strategy': 'breakout', 'bear_bb_std_mult': 1.5334507048682093, 'bear_rsi_os': 52, 'bear_rsi_ob': 91, 'bear_adx_thresh': 8.539733355436999, 'bear_atr_min_pct': 0.01822063866093817, 'bear_atr_max_pct': 0.06224063230016114, 'bear_tp_mult': 1.8358295002507348, 'bear_tsl_mult': 0.3466357402422173, 'bear_time_stop': 229, 'bear_use_sma': True, 'bear_use_ema': True, 'bear_use_atr': False, 'bear_use_adx': False, 'bear_use_spike': True, 'bear_rsi_required': True, 'sideways_strategy': 'breakout', 'sideways_bb_std_mult': 2.357431680187879, 'sideways_rsi_os': 21, 'sideways_rsi_ob': 57, 'sideways_adx_thresh': 18.603187625417476, 'sideways_atr_min_pct': 0.01646847445798281, 'sideways_atr_max_pct': 0.0838562772492684, 'sideways_tp_mult': 2.448760448834222, 'sideways_tsl_mult': 0.386003323406625, 'sideways_time_stop': 116, 'sideways_use_sma': True, 'sideways_use_ema': True, 'sideways_use_atr': False, 'sideways_use_adx': True, 'sideways_use_spike': False, 'sideways_rsi_required': False}.
[I 2025-09-01 14:08:22,179] Trial 108 finished with values: [-1000000000.0, 1000000000.0] and parameters: {'p_sma': 36, 'p_std': 22, 'p_atr': 27, 'p_adx': 23, 'rsi_period': 34, 'ema1': 7, 'ema2': 41, 'slip_atr_k': 0.20311186720289184, 'slip_spread_k': 0.3820841449357749, 'spread_hl_frac': 0.010935605719618458, 'bb_std_mult': 2.2732154269232607, 'rsi_os': 18, 'rsi_ob': 49, 'vol_spike': 0.11283207403059767, 'adx_thresh': 32.323734234052864, 'atr_min_pct': 0.01011392459023256, 'atr_max_pct': 0.015978501308094847, 'tp_mult': 1.6065921356760349, 'tsl_mult': 0.30276108532094614, 'strategy': 'mean_reversion', 'time_stop': 44, 'use_sma': False, 'use_atr': False, 'use_adx': True, 'use_ema': False, 'use_spike': False, 'rsi_required': True, 'edge_k': 0.9606288611651767, 'edge_cap': 0.7860353871036077, 'bull_strategy': 'breakout', 'bull_bb_std_mult': 1.2798150416802931, 'bull_rsi_os': 33, 'bull_rsi_ob': 46, 'bull_adx_thresh': 12.30832704990384, 'bull_atr_min_pct': 0.002646379198380415, 'bull_atr_max_pct': 0.029540653451894487, 'bull_tp_mult': 2.3533429579573837, 'bull_tsl_mult': 0.14159825081363692, 'bull_time_stop': 87, 'bull_use_sma': False, 'bull_use_ema': True, 'bull_use_atr': True, 'bull_use_adx': True, 'bull_use_spike': False, 'bull_rsi_required': True, 'bear_strategy': 'breakout', 'bear_bb_std_mult': 1.0956462736230668, 'bear_rsi_os': 9, 'bear_rsi_ob': 71, 'bear_adx_thresh': 24.882765832508404, 'bear_atr_min_pct': 0.016763476108963987, 'bear_atr_max_pct': 0.1083215883149302, 'bear_tp_mult': 1.6625180623390863, 'bear_tsl_mult': 0.3353873497970807, 'bear_time_stop': 118, 'bear_use_sma': True, 'bear_use_ema': False, 'bear_use_atr': True, 'bear_use_adx': True, 'bear_use_spike': True, 'bear_rsi_required': True, 'sideways_strategy': 'breakout', 'sideways_bb_std_mult': 2.3532871467838854, 'sideways_rsi_os': 42, 'sideways_rsi_ob': 57, 'sideways_adx_thresh': 26.7876944048547, 'sideways_atr_min_pct': 0.016397389314990973, 'sideways_atr_max_pct': 0.07007779204438475, 'sideways_tp_mult': 2.433289660472973, 'sideways_tsl_mult': 0.04431516081414183, 'sideways_time_stop': 123, 'sideways_use_sma': True, 'sideways_use_ema': True, 'sideways_use_atr': True, 'sideways_use_adx': False, 'sideways_use_spike': False, 'sideways_rsi_required': False}.
