[I 2025-09-01 15:06:23,681] Trial 470 finished with values: [-1000000000.0, 1000000000.0] and parameters: {'p_sma': 59, 'p_std': 8, 'p_atr': 20, 'p_adx': 10, 'rsi_period': 65, 'ema1': 9, 'ema2': 52, 'slip_atr_k': 0.05828248347531241, 'slip_spread_k': 0.8012474403282326, 'spread_hl_frac': 0.016791130294713554, 'bb_std_mult': 1.0390061072299912, 'rsi_os': 35, 'rsi_ob': 72, 'vol_spike': 0.2457973413892679, 'adx_thresh': 12.975453738145866, 'atr_min_pct': 0.026813228184082345, 'atr_max_pct': 0.07211283030145021, 'tp_mult': 1.0180191703023804, 'tsl_mult': 0.48342937765690214, 'strategy': 'breakout', 'time_stop': 297, 'use_sma': False, 'use_atr': True, 'use_adx': True, 'use_ema': False, 'use_spike': True, 'rsi_required': False, 'edge_k': 1.89576742558978, 'edge_cap': 0.06691963839995727, 'bull_strategy': 'mean_reversion', 'bull_bb_std_mult': 1.4476701281572937, 'bull_rsi_os': 30, 'bull_rsi_ob': 55, 'bull_adx_thresh': 9.634532474985429, 'bull_atr_min_pct': 0.010248552759207828, 'bull_atr_max_pct': 0.03220976579237825, 'bull_tp_mult': 2.244804333394737, 'bull_tsl_mult': 0.6885192515957781, 'bull_time_stop': 233, 'bull_use_sma': True, 'bull_use_ema': False, 'bull_use_atr': False, 'bull_use_adx': True, 'bull_use_spike': False, 'bull_rsi_required': True, 'bear_strategy': 'mean_reversion', 'bear_bb_std_mult': 2.7478379974579488, 'bear_rsi_os': 9, 'bear_rsi_ob': 73, 'bear_adx_thresh': 27.78122833778669, 'bear_atr_min_pct': 0.026108019741932206, 'bear_atr_max_pct': 0.027375257786302613, 'bear_tp_mult': 2.5002826529786697, 'bear_tsl_mult': 0.6408208118637655, 'bear_time_stop': 289, 'bear_use_sma': False, 'bear_use_ema': False, 'bear_use_atr': False, 'bear_use_adx': True, 'bear_use_spike': False, 'bear_rsi_required': True, 'sideways_strategy': 'mean_reversion', 'sideways_bb_std_mult': 3.3717893038340416, 'sideways_rsi_os': 26, 'sideways_rsi_ob': 90, 'sideways_adx_thresh': 7.520180969705479, 'sideways_atr_min_pct': 0.006092491575409437, 'sideways_atr_max_pct': 0.13248670561429218, 'sideways_tp_mult': 1.760533521922105, 'sideways_tsl_mult': 0.04517253293961476, 'sideways_time_stop': 119, 'sideways_use_sma': False, 'sideways_use_ema': False, 'sideways_use_atr': True, 'sideways_use_adx': False, 'sideways_use_spike': True, 'sideways_rsi_required': True}.
[I 2025-09-01 15:06:24,995] Trial 471 finished with values: [-1000000000.0, 1000000000.0] and parameters: {'p_sma': 7, 'p_std': 9, 'p_atr': 18, 'p_adx': 26, 'rsi_period': 63, 'ema1': 9, 'ema2': 57, 'slip_atr_k': 0.057432863743897805, 'slip_spread_k': 0.27793644810898005, 'spread_hl_frac': 0.036714161038158485, 'bb_std_mult': 2.2795444892208994, 'rsi_os': 35, 'rsi_ob': 47, 'vol_spike': 0.2957954019007856, 'adx_thresh': 20.01711786208856, 'atr_min_pct': 0.016068595816209563, 'atr_max_pct': 0.09639629998518472, 'tp_mult': 2.9351062535917305, 'tsl_mult': 0.478670162248509, 'strategy': 'breakout', 'time_stop': 47, 'use_sma': False, 'use_atr': True, 'use_adx': True, 'use_ema': False, 'use_spike': True, 'rsi_required': False, 'edge_k': 1.8691474884614458, 'edge_cap': 0.06792334671677751, 'bull_strategy': 'breakout', 'bull_bb_std_mult': 2.307467810118873, 'bull_rsi_os': 18, 'bull_rsi_ob': 48, 'bull_adx_thresh': 9.787873160723326, 'bull_atr_min_pct': 0.021491522359985346, 'bull_atr_max_pct': 0.010439306282337739, 'bull_tp_mult': 2.0072786563415184, 'bull_tsl_mult': 0.6802256797922925, 'bull_time_stop': 160, 'bull_use_sma': True, 'bull_use_ema': False, 'bull_use_atr': False, 'bull_use_adx': True, 'bull_use_spike': False, 'bull_rsi_required': True, 'bear_strategy': 'mean_reversion', 'bear_bb_std_mult': 2.76322026017697, 'bear_rsi_os': 9, 'bear_rsi_ob': 77, 'bear_adx_thresh': 27.622926714515398, 'bear_atr_min_pct': 0.029993065291447477, 'bear_atr_max_pct': 0.028422552156314618, 'bear_tp_mult': 2.492514025814043, 'bear_tsl_mult': 0.6360269861970265, 'bear_time_stop': 186, 'bear_use_sma': False, 'bear_use_ema': False, 'bear_use_atr': False, 'bear_use_adx': True, 'bear_use_spike': False, 'bear_rsi_required': True, 'sideways_strategy': 'mean_reversion', 'sideways_bb_std_mult': 3.363377864151092, 'sideways_rsi_os': 36, 'sideways_rsi_ob': 90, 'sideways_adx_thresh': 31.314053088570994, 'sideways_atr_min_pct': 0.005751823230303737, 'sideways_atr_max_pct': 0.13309806947832592, 'sideways_tp_mult': 1.7642536452711752, 'sideways_tsl_mult': 0.2737159088463959, 'sideways_time_stop': 119, 'sideways_use_sma': False, 'sideways_use_ema': False, 'sideways_use_atr': True, 'sideways_use_adx': True, 'sideways_use_spike': True, 'sideways_rsi_required': True}.
[I 2025-09-01 15:06:25,542] Trial 468 finished with values: [-1000000000.0, 1000000000.0] and parameters: {'p_sma': 16, 'p_std': 8, 'p_atr': 18, 'p_adx': 25, 'rsi_period': 65, 'ema1': 28, 'ema2': 52, 'slip_atr_k': 0.06120093043077138, 'slip_spread_k': 0.27999590924107426, 'spread_hl_frac': 0.012272616813517134, 'bb_std_mult': 1.4746140876069809, 'rsi_os': 5, 'rsi_ob': 91, 'vol_spike': 0.29951719224688117, 'adx_thresh': 6.693907332098714, 'atr_min_pct': 0.015026386195938076, 'atr_max_pct': 0.08675871811527139, 'tp_mult': 2.7959416753235518, 'tsl_mult': 0.09397228005235173, 'strategy': 'breakout', 'time_stop': 75, 'use_sma': True, 'use_atr': True, 'use_adx': True, 'use_ema': False, 'use_spike': True, 'rsi_required': False, 'edge_k': 1.1024068380061078, 'edge_cap': 0.07126820830094231, 'bull_strategy': 'breakout', 'bull_bb_std_mult': 1.5168867221518327, 'bull_rsi_os': 16, 'bull_rsi_ob': 48, 'bull_adx_thresh': 9.751325385922634, 'bull_atr_min_pct': 0.01972364217399864, 'bull_atr_max_pct': 0.08106578381069406, 'bull_tp_mult': 2.2336796575811912, 'bull_tsl_mult': 0.3250685058251679, 'bull_time_stop': 144, 'bull_use_sma': True, 'bull_use_ema': False, 'bull_use_atr': False, 'bull_use_adx': True, 'bull_use_spike': False, 'bull_rsi_required': True, 'bear_strategy': 'mean_reversion', 'bear_bb_std_mult': 1.2912487550172504, 'bear_rsi_os': 7, 'bear_rsi_ob': 68, 'bear_adx_thresh': 28.713711983688185, 'bear_atr_min_pct': 0.023261122068536533, 'bear_atr_max_pct': 0.11923894667183006, 'bear_tp_mult': 1.0554351049041397, 'bear_tsl_mult': 0.5848901665795775, 'bear_time_stop': 276, 'bear_use_sma': False, 'bear_use_ema': True, 'bear_use_atr': False, 'bear_use_adx': True, 'bear_use_spike': False, 'bear_rsi_required': False, 'sideways_strategy': 'mean_reversion', 'sideways_bb_std_mult': 3.3594083503114187, 'sideways_rsi_os': 5, 'sideways_rsi_ob': 78, 'sideways_adx_thresh': 7.685970487285239, 'sideways_atr_min_pct': 0.006026810499882386, 'sideways_atr_max_pct': 0.14607169370901685, 'sideways_tp_mult': 1.7479174828887243, 'sideways_tsl_mult': 0.7225566620598896, 'sideways_time_stop': 118, 'sideways_use_sma': False, 'sideways_use_ema': False, 'sideways_use_atr': True, 'sideways_use_adx': False, 'sideways_use_spike': True, 'sideways_rsi_required': True}.
[I 2025-09-01 15:06:25,945] Trial 469 finished with values: [-1000000000.0, 1000000000.0] and parameters: {'p_sma': 59, 'p_std': 8, 'p_atr': 20, 'p_adx': 7, 'rsi_period': 65, 'ema1': 28, 'ema2': 53, 'slip_atr_k': 0.059162578333210994, 'slip_spread_k': 0.2735934289347759, 'spread_hl_frac': 0.012394664025509535, 'bb_std_mult': 2.625201313355643, 'rsi_os': 39, 'rsi_ob': 48, 'vol_spike': 0.29991390918363514, 'adx_thresh': 21.08033866481499, 'atr_min_pct': 0.01623026695671507, 'atr_max_pct': 0.08526658733706391, 'tp_mult': 2.0776000144368116, 'tsl_mult': 0.2896204960619757, 'strategy': 'breakout', 'time_stop': 129, 'use_sma': False, 'use_atr': True, 'use_adx': True, 'use_ema': False, 'use_spike': True, 'rsi_required': False, 'edge_k': 1.7690402623638188, 'edge_cap': 0.06903106451076216, 'bull_strategy': 'mean_reversion', 'bull_bb_std_mult': 2.3090145756635105, 'bull_rsi_os': 31, 'bull_rsi_ob': 48, 'bull_adx_thresh': 9.747368566834778, 'bull_atr_min_pct': 0.022543689560840595, 'bull_atr_max_pct': 0.02202481089202535, 'bull_tp_mult': 1.9906457409738858, 'bull_tsl_mult': 0.18437049801327998, 'bull_time_stop': 161, 'bull_use_sma': True, 'bull_use_ema': False, 'bull_use_atr': False, 'bull_use_adx': True, 'bull_use_spike': False, 'bull_rsi_required': True, 'bear_strategy': 'mean_reversion', 'bear_bb_std_mult': 0.7107839932282443, 'bear_rsi_os': 21, 'bear_rsi_ob': 73, 'bear_adx_thresh': 27.554662537905706, 'bear_atr_min_pct': 0.007354374890979597, 'bear_atr_max_pct': 0.11411410086708121, 'bear_tp_mult': 2.6393019299807, 'bear_tsl_mult': 0.08153542837943478, 'bear_time_stop': 206, 'bear_use_sma': False, 'bear_use_ema': False, 'bear_use_atr': False, 'bear_use_adx': True, 'bear_use_spike': False, 'bear_rsi_required': False, 'sideways_strategy': 'mean_reversion', 'sideways_bb_std_mult': 3.370455341195269, 'sideways_rsi_os': 36, 'sideways_rsi_ob': 92, 'sideways_adx_thresh': 17.201043526680298, 'sideways_atr_min_pct': 0.005862114460803407, 'sideways_atr_max_pct': 0.02478607160983364, 'sideways_tp_mult': 1.1664405958465678, 'sideways_tsl_mult': 0.27307693441810715, 'sideways_time_stop': 117, 'sideways_use_sma': False, 'sideways_use_ema': False, 'sideways_use_atr': True, 'sideways_use_adx': False, 'sideways_use_spike': True, 'sideways_rsi_required': True}.
[I 2025-09-01 15:07:09,596] Trial 472 finished with values: [-1000000000.0, 1000000000.0] and parameters: {'p_sma': 33, 'p_std': 42, 'p_atr': 20, 'p_adx': 26, 'rsi_period': 82, 'ema1': 30, 'ema2': 34, 'slip_atr_k': 0.06261923329312105, 'slip_spread_k': 0.2745348414360118, 'spread_hl_frac': 0.005121120126741444, 'bb_std_mult': 1.4808999748214646, 'rsi_os': 45, 'rsi_ob': 64, 'vol_spike': 0.2996086599162606, 'adx_thresh': 21.21728728230167, 'atr_min_pct': 0.021402634785151323, 'atr_max_pct': 0.08797609265083389, 'tp_mult': 2.2623717581989076, 'tsl_mult': 0.03694521479423542, 'strategy': 'breakout', 'time_stop': 131, 'use_sma': False, 'use_atr': True, 'use_adx': True, 'use_ema': False, 'use_spike': True, 'rsi_required': False, 'edge_k': 1.2162490220890245, 'edge_cap': 0.9892214972308089, 'bull_strategy': 'breakout', 'bull_bb_std_mult': 2.307937392565522, 'bull_rsi_os': 19, 'bull_rsi_ob': 70, 'bull_adx_thresh': 17.488369471865376, 'bull_atr_min_pct': 0.027327125760242443, 'bull_atr_max_pct': 0.1175026749432391, 'bull_tp_mult': 2.7418567027019694, 'bull_tsl_mult': 0.3219475377306641, 'bull_time_stop': 163, 'bull_use_sma': True, 'bull_use_ema': False, 'bull_use_atr': False, 'bull_use_adx': True, 'bull_use_spike': False, 'bull_rsi_required': True, 'bear_strategy': 'mean_reversion', 'bear_bb_std_mult': 0.7116058172273387, 'bear_rsi_os': 7, 'bear_rsi_ob': 77, 'bear_adx_thresh': 25.943244057099477, 'bear_atr_min_pct': 0.02313360848493017, 'bear_atr_max_pct': 0.10816175149171695, 'bear_tp_mult': 2.666168861532566, 'bear_tsl_mult': 0.2128095531075711, 'bear_time_stop': 206, 'bear_use_sma': False, 'bear_use_ema': False, 'bear_use_atr': False, 'bear_use_adx': True, 'bear_use_spike': False, 'bear_rsi_required': False, 'sideways_strategy': 'mean_reversion', 'sideways_bb_std_mult': 0.625514913751527, 'sideways_rsi_os': 36, 'sideways_rsi_ob': 93, 'sideways_adx_thresh': 31.37068793294529, 'sideways_atr_min_pct': 0.0053061412789141334, 'sideways_atr_max_pct': 0.14150308415672594, 'sideways_tp_mult': 1.8831067484400066, 'sideways_tsl_mult': 0.2806762367738733, 'sideways_time_stop': 118, 'sideways_use_sma': False, 'sideways_use_ema': False, 'sideways_use_atr': True, 'sideways_use_adx': True, 'sideways_use_spike': True, 'sideways_rsi_required': True}.
[I 2025-09-01 15:07:10,997] Trial 474 finished with values: [-1000000000.0, 1000000000.0] and parameters: {'p_sma': 13, 'p_std': 25, 'p_atr': 20, 'p_adx': 7, 'rsi_period': 67, 'ema1': 30, 'ema2': 50, 'slip_atr_k': 0.04166185013390506, 'slip_spread_k': 0.2463795158975168, 'spread_hl_frac': 0.010952672944995027, 'bb_std_mult': 0.8771127802967051, 'rsi_os': 21, 'rsi_ob': 94, 'vol_spike': 0.29147540722312043, 'adx_thresh': 18.605935444414314, 'atr_min_pct': 0.022944186809900978, 'atr_max_pct': 0.033372219888740284, 'tp_mult': 1.454400722875545, 'tsl_mult': 0.0016708411532853629, 'strategy': 'breakout', 'time_stop': 64, 'use_sma': False, 'use_atr': True, 'use_adx': True, 'use_ema': False, 'use_spike': True, 'rsi_required': False, 'edge_k': 0.6530504411135766, 'edge_cap': 0.09953153756901416, 'bull_strategy': 'breakout', 'bull_bb_std_mult': 2.6564070474958354, 'bull_rsi_os': 19, 'bull_rsi_ob': 88, 'bull_adx_thresh': 11.81789357257227, 'bull_atr_min_pct': 0.007935940727536499, 'bull_atr_max_pct': 0.02212010526351104, 'bull_tp_mult': 2.1042789109269835, 'bull_tsl_mult': 0.7994885058422051, 'bull_time_stop': 166, 'bull_use_sma': True, 'bull_use_ema': True, 'bull_use_atr': False, 'bull_use_adx': False, 'bull_use_spike': False, 'bull_rsi_required': True, 'bear_strategy': 'breakout', 'bear_bb_std_mult': 3.067763906423477, 'bear_rsi_os': 17, 'bear_rsi_ob': 92, 'bear_adx_thresh': 34.971543139256234, 'bear_atr_min_pct': 0.021887082638001334, 'bear_atr_max_pct': 0.09900598191986587, 'bear_tp_mult': 2.4098738807423365, 'bear_tsl_mult': 0.30000143628545395, 'bear_time_stop': 288, 'bear_use_sma': True, 'bear_use_ema': False, 'bear_use_atr': True, 'bear_use_adx': True, 'bear_use_spike': True, 'bear_rsi_required': False, 'sideways_strategy': 'mean_reversion', 'sideways_bb_std_mult': 0.6196541428226836, 'sideways_rsi_os': 14, 'sideways_rsi_ob': 92, 'sideways_adx_thresh': 17.204234173062687, 'sideways_atr_min_pct': 0.00963102144706289, 'sideways_atr_max_pct': 0.024907295599180014, 'sideways_tp_mult': 1.1713116143241162, 'sideways_tsl_mult': 0.28000669191338246, 'sideways_time_stop': 126, 'sideways_use_sma': True, 'sideways_use_ema': False, 'sideways_use_atr': False, 'sideways_use_adx': False, 'sideways_use_spike': True, 'sideways_rsi_required': True}.
[I 2025-09-01 15:07:12,096] Trial 475 finished with values: [-1000000000.0, 1000000000.0] and parameters: {'p_sma': 13, 'p_std': 48, 'p_atr': 14, 'p_adx': 24, 'rsi_period': 57, 'ema1': 30, 'ema2': 16, 'slip_atr_k': 0.16624733974777867, 'slip_spread_k': 0.2319270242563844, 'spread_hl_frac': 0.01075986394213558, 'bb_std_mult': 1.6303862774505697, 'rsi_os': 51, 'rsi_ob': 52, 'vol_spike': 0.27494026632883334, 'adx_thresh': 21.58601323240346, 'atr_min_pct': 0.01572723372658378, 'atr_max_pct': 0.0918556571679182, 'tp_mult': 1.522988472104, 'tsl_mult': 0.19995150566901815, 'strategy': 'breakout', 'time_stop': 111, 'use_sma': False, 'use_atr': False, 'use_adx': True, 'use_ema': True, 'use_spike': True, 'rsi_required': True, 'edge_k': 1.2016816445588752, 'edge_cap': 0.9987429970959076, 'bull_strategy': 'breakout', 'bull_bb_std_mult': 2.8490661472537813, 'bull_rsi_os': 19, 'bull_rsi_ob': 70, 'bull_adx_thresh': 12.945949992219568, 'bull_atr_min_pct': 0.027742850840205155, 'bull_atr_max_pct': 0.024074851707160755, 'bull_tp_mult': 2.1576047915777945, 'bull_tsl_mult': 0.8001375178880243, 'bull_time_stop': 184, 'bull_use_sma': False, 'bull_use_ema': True, 'bull_use_atr': True, 'bull_use_adx': False, 'bull_use_spike': False, 'bull_rsi_required': False, 'bear_strategy': 'breakout', 'bear_bb_std_mult': 3.073139738440796, 'bear_rsi_os': 8, 'bear_rsi_ob': 79, 'bear_adx_thresh': 25.920726573408032, 'bear_atr_min_pct': 0.0218480955371826, 'bear_atr_max_pct': 0.14607926706584085, 'bear_tp_mult': 2.452767533859369, 'bear_tsl_mult': 0.30583804348651167, 'bear_time_stop': 268, 'bear_use_sma': True, 'bear_use_ema': False, 'bear_use_atr': True, 'bear_use_adx': True, 'bear_use_spike': True, 'bear_rsi_required': False, 'sideways_strategy': 'breakout', 'sideways_bb_std_mult': 0.6173938554282103, 'sideways_rsi_os': 24, 'sideways_rsi_ob': 89, 'sideways_adx_thresh': 23.615260225993183, 'sideways_atr_min_pct': 0.00511303809732421, 'sideways_atr_max_pct': 0.14142337145776926, 'sideways_tp_mult': 1.8831153936405132, 'sideways_tsl_mult': 0.29164521430107704, 'sideways_time_stop': 126, 'sideways_use_sma': True, 'sideways_use_ema': False, 'sideways_use_atr': False, 'sideways_use_adx': True, 'sideways_use_spike': True, 'sideways_rsi_required': True}.
[I 2025-09-01 15:07:12,115] Trial 473 finished with values: [-1000000000.0, 1000000000.0] and parameters: {'p_sma': 16, 'p_std': 10, 'p_atr': 20, 'p_adx': 7, 'rsi_period': 66, 'ema1': 30, 'ema2': 50, 'slip_atr_k': 0.04643702235077972, 'slip_spread_k': 0.23593512327627644, 'spread_hl_frac': 0.005094886524231811, 'bb_std_mult': 1.4727377043019148, 'rsi_os': 38, 'rsi_ob': 70, 'vol_spike': 0.29451277895706485, 'adx_thresh': 6.749207867108179, 'atr_min_pct': 0.017608196425266766, 'atr_max_pct': 0.07375232170492634, 'tp_mult': 2.8026597848214503, 'tsl_mult': 0.14145057810573525, 'strategy': 'breakout', 'time_stop': 11, 'use_sma': False, 'use_atr': True, 'use_adx': True, 'use_ema': False, 'use_spike': True, 'rsi_required': False, 'edge_k': 1.2187317221819498, 'edge_cap': 0.0987942059009062, 'bull_strategy': 'breakout', 'bull_bb_std_mult': 2.653038232093018, 'bull_rsi_os': 19, 'bull_rsi_ob': 58, 'bull_adx_thresh': 8.919287465372385, 'bull_atr_min_pct': 0.01990523788336809, 'bull_atr_max_pct': 0.023023282300388012, 'bull_tp_mult': 1.372361151296682, 'bull_tsl_mult': 0.3171576025318657, 'bull_time_stop': 165, 'bull_use_sma': True, 'bull_use_ema': False, 'bull_use_atr': False, 'bull_use_adx': False, 'bull_use_spike': False, 'bull_rsi_required': True, 'bear_strategy': 'mean_reversion', 'bear_bb_std_mult': 2.6869939622086774, 'bear_rsi_os': 21, 'bear_rsi_ob': 79, 'bear_adx_thresh': 25.966415709572836, 'bear_atr_min_pct': 0.023187828687419695, 'bear_atr_max_pct': 0.10824414539297589, 'bear_tp_mult': 2.6462608390588445, 'bear_tsl_mult': 0.085529624395557, 'bear_time_stop': 208, 'bear_use_sma': False, 'bear_use_ema': False, 'bear_use_atr': True, 'bear_use_adx': True, 'bear_use_spike': True, 'bear_rsi_required': False, 'sideways_strategy': 'mean_reversion', 'sideways_bb_std_mult': 0.6151961775001631, 'sideways_rsi_os': 53, 'sideways_rsi_ob': 92, 'sideways_adx_thresh': 6.71091229874507, 'sideways_atr_min_pct': 0.005099800223196309, 'sideways_atr_max_pct': 0.14126059172706415, 'sideways_tp_mult': 1.1508404296616739, 'sideways_tsl_mult': 0.6279972616017033, 'sideways_time_stop': 126, 'sideways_use_sma': False, 'sideways_use_ema': False, 'sideways_use_atr': False, 'sideways_use_adx': False, 'sideways_use_spike': True, 'sideways_rsi_required': True}.
[I 2025-09-01 15:08:00,800] Trial 477 finished with values: [-1000000000.0, 1000000000.0] and parameters: {'p_sma': 13, 'p_std': 10, 'p_atr': 21, 'p_adx': 24, 'rsi_period': 68, 'ema1': 30, 'ema2': 51, 'slip_atr_k': 0.053873326083579864, 'slip_spread_k': 0.2259824261335609, 'spread_hl_frac': 0.013627044606796458, 'bb_std_mult': 1.4181700269379491, 'rsi_os': 29, 'rsi_ob': 76, 'vol_spike': 0.10399764180189588, 'adx_thresh': 11.222509664916501, 'atr_min_pct': 0.028588178359267635, 'atr_max_pct': 0.04170903646867225, 'tp_mult': 2.666950946533616, 'tsl_mult': 0.8156281039902007, 'strategy': 'mean_reversion', 'time_stop': 300, 'use_sma': False, 'use_atr': False, 'use_adx': True, 'use_ema': True, 'use_spike': True, 'rsi_required': True, 'edge_k': 0.7016433825060544, 'edge_cap': 0.09635124161581354, 'bull_strategy': 'breakout', 'bull_bb_std_mult': 0.9923558820758853, 'bull_rsi_os': 43, 'bull_rsi_ob': 49, 'bull_adx_thresh': 8.913353794171151, 'bull_atr_min_pct': 0.005442358957673385, 'bull_atr_max_pct': 0.02465429559305382, 'bull_tp_mult': 2.161845155843554, 'bull_tsl_mult': 0.34461994907688254, 'bull_time_stop': 194, 'bull_use_sma': False, 'bull_use_ema': True, 'bull_use_atr': True, 'bull_use_adx': False, 'bull_use_spike': False, 'bull_rsi_required': False, 'bear_strategy': 'breakout', 'bear_bb_std_mult': 2.6793818347245293, 'bear_rsi_os': 8, 'bear_rsi_ob': 75, 'bear_adx_thresh': 26.960302607255375, 'bear_atr_min_pct': 0.023982545072106416, 'bear_atr_max_pct': 0.11708261446382758, 'bear_tp_mult': 1.2708062845762336, 'bear_tsl_mult': 0.5630385766449982, 'bear_time_stop': 85, 'bear_use_sma': True, 'bear_use_ema': False, 'bear_use_atr': True, 'bear_use_adx': True, 'bear_use_spike': True, 'bear_rsi_required': False, 'sideways_strategy': 'breakout', 'sideways_bb_std_mult': 3.1051340118505832, 'sideways_rsi_os': 24, 'sideways_rsi_ob': 89, 'sideways_adx_thresh': 23.496867487671697, 'sideways_atr_min_pct': 0.025994453997881452, 'sideways_atr_max_pct': 0.12575794457081987, 'sideways_tp_mult': 2.426447281518172, 'sideways_tsl_mult': 0.9706886397856014, 'sideways_time_stop': 271, 'sideways_use_sma': True, 'sideways_use_ema': False, 'sideways_use_atr': False, 'sideways_use_adx': False, 'sideways_use_spike': True, 'sideways_rsi_required': False}.
