[I 2025-09-01 14:20:17,432] Trial 181 finished with values: [-1000000000.0, 1000000000.0] and parameters: {'p_sma': 24, 'p_std': 28, 'p_atr': 26, 'p_adx': 28, 'rsi_period': 64, 'ema1': 26, 'ema2': 44, 'slip_atr_k': 0.04520797313942844, 'slip_spread_k': 0.3624880031020001, 'spread_hl_frac': 0.012667728579853819, 'bb_std_mult': 2.3427730472407813, 'rsi_os': 33, 'rsi_ob': 71, 'vol_spike': 0.24880809211588173, 'adx_thresh': 19.220192743378202, 'atr_min_pct': 0.011118908019198334, 'atr_max_pct': 0.04985249246168422, 'tp_mult': 2.4128345578822232, 'tsl_mult': 0.8294116566124697, 'strategy': 'breakout', 'time_stop': 40, 'use_sma': False, 'use_atr': False, 'use_adx': True, 'use_ema': False, 'use_spike': False, 'rsi_required': True, 'edge_k': 1.7818137706003054, 'edge_cap': 0.07776545988130817, 'bull_strategy': 'mean_reversion', 'bull_bb_std_mult': 1.1963983604221384, 'bull_rsi_os': 10, 'bull_rsi_ob': 52, 'bull_adx_thresh': 30.217771997333045, 'bull_atr_min_pct': 0.00523679996542749, 'bull_atr_max_pct': 0.0384549338679202, 'bull_tp_mult': 2.1395580863206054, 'bull_tsl_mult': 0.28023475074059423, 'bull_time_stop': 83, 'bull_use_sma': True, 'bull_use_ema': False, 'bull_use_atr': False, 'bull_use_adx': True, 'bull_use_spike': False, 'bull_rsi_required': True, 'bear_strategy': 'mean_reversion', 'bear_bb_std_mult': 2.9479434323250246, 'bear_rsi_os': 38, 'bear_rsi_ob': 71, 'bear_adx_thresh': 8.343537816695353, 'bear_atr_min_pct': 0.024454767497435075, 'bear_atr_max_pct': 0.12133335535339775, 'bear_tp_mult': 2.645466188748675, 'bear_tsl_mult': 0.658840619455391, 'bear_time_stop': 278, 'bear_use_sma': True, 'bear_use_ema': False, 'bear_use_atr': False, 'bear_use_adx': True, 'bear_use_spike': True, 'bear_rsi_required': False, 'sideways_strategy': 'breakout', 'sideways_bb_std_mult': 2.882612914791063, 'sideways_rsi_os': 20, 'sideways_rsi_ob': 86, 'sideways_adx_thresh': 8.046250527441924, 'sideways_atr_min_pct': 0.006725964575605805, 'sideways_atr_max_pct': 0.13137531198287664, 'sideways_tp_mult': 1.6722967434764306, 'sideways_tsl_mult': 0.22055432251752147, 'sideways_time_stop': 74, 'sideways_use_sma': True, 'sideways_use_ema': False, 'sideways_use_atr': True, 'sideways_use_adx': False, 'sideways_use_spike': True, 'sideways_rsi_required': True}.
[I 2025-09-01 14:20:17,843] Trial 178 finished with values: [-0.008972239589807196, 0.008809368089918468] and parameters: {'p_sma': 13, 'p_std': 12, 'p_atr': 26, 'p_adx': 28, 'rsi_period': 63, 'ema1': 28, 'ema2': 53, 'slip_atr_k': 0.04451643824705342, 'slip_spread_k': 0.4068999256054616, 'spread_hl_frac': 0.01401639425777942, 'bb_std_mult': 2.2232028623969438, 'rsi_os': 33, 'rsi_ob': 71, 'vol_spike': 0.1519689864734679, 'adx_thresh': 19.17327304816825, 'atr_min_pct': 0.0032142357751973744, 'atr_max_pct': 0.07254776553645274, 'tp_mult': 2.4814504591965254, 'tsl_mult': 0.25249762499711675, 'strategy': 'breakout', 'time_stop': 49, 'use_sma': False, 'use_atr': False, 'use_adx': True, 'use_ema': False, 'use_spike': True, 'rsi_required': True, 'edge_k': 0.5280635073856006, 'edge_cap': 0.8224486779011796, 'bull_strategy': 'breakout', 'bull_bb_std_mult': 1.2052754956072145, 'bull_rsi_os': 15, 'bull_rsi_ob': 52, 'bull_adx_thresh': 11.259348619320065, 'bull_atr_min_pct': 0.003186986647073825, 'bull_atr_max_pct': 0.029544236646018983, 'bull_tp_mult': 2.1362845481505057, 'bull_tsl_mult': 0.39113072368105245, 'bull_time_stop': 102, 'bull_use_sma': True, 'bull_use_ema': False, 'bull_use_atr': False, 'bull_use_adx': True, 'bull_use_spike': False, 'bull_rsi_required': True, 'bear_strategy': 'mean_reversion', 'bear_bb_std_mult': 2.952704282394099, 'bear_rsi_os': 10, 'bear_rsi_ob': 71, 'bear_adx_thresh': 11.624396681070733, 'bear_atr_min_pct': 0.024538659642078627, 'bear_atr_max_pct': 0.10777091495696113, 'bear_tp_mult': 2.66616369305724, 'bear_tsl_mult': 0.5981058589008488, 'bear_time_stop': 282, 'bear_use_sma': False, 'bear_use_ema': False, 'bear_use_atr': False, 'bear_use_adx': True, 'bear_use_spike': True, 'bear_rsi_required': False, 'sideways_strategy': 'breakout', 'sideways_bb_std_mult': 2.878562549282598, 'sideways_rsi_os': 20, 'sideways_rsi_ob': 86, 'sideways_adx_thresh': 6.750202897734888, 'sideways_atr_min_pct': 0.006835145731906042, 'sideways_atr_max_pct': 0.13287688169964296, 'sideways_tp_mult': 1.6264970965204564, 'sideways_tsl_mult': 0.2263784228611798, 'sideways_time_stop': 287, 'sideways_use_sma': True, 'sideways_use_ema': False, 'sideways_use_atr': True, 'sideways_use_adx': False, 'sideways_use_spike': True, 'sideways_rsi_required': True}.
[I 2025-09-01 14:20:56,793] Trial 183 finished with values: [-1000000000.0, 1000000000.0] and parameters: {'p_sma': 13, 'p_std': 13, 'p_atr': 26, 'p_adx': 27, 'rsi_period': 68, 'ema1': 30, 'ema2': 50, 'slip_atr_k': 0.04267812326365307, 'slip_spread_k': 0.2760199327298411, 'spread_hl_frac': 0.01249842590682348, 'bb_std_mult': 1.7064948968321527, 'rsi_os': 35, 'rsi_ob': 73, 'vol_spike': 0.24516909307388635, 'adx_thresh': 20.31950184900446, 'atr_min_pct': 0.014367438696954862, 'atr_max_pct': 0.05812959071062519, 'tp_mult': 2.888497101322978, 'tsl_mult': 0.024002652144531875, 'strategy': 'breakout', 'time_stop': 48, 'use_sma': False, 'use_atr': False, 'use_adx': True, 'use_ema': False, 'use_spike': True, 'rsi_required': True, 'edge_k': 0.5127116013988099, 'edge_cap': 0.12365580399600556, 'bull_strategy': 'breakout', 'bull_bb_std_mult': 1.1536275432378915, 'bull_rsi_os': 18, 'bull_rsi_ob': 47, 'bull_adx_thresh': 11.734227142781616, 'bull_atr_min_pct': 0.005907811530561969, 'bull_atr_max_pct': 0.01455944408271265, 'bull_tp_mult': 2.1455466860599226, 'bull_tsl_mult': 0.4790112167260045, 'bull_time_stop': 170, 'bull_use_sma': True, 'bull_use_ema': False, 'bull_use_atr': False, 'bull_use_adx': True, 'bull_use_spike': False, 'bull_rsi_required': True, 'bear_strategy': 'mean_reversion', 'bear_bb_std_mult': 2.961000303324391, 'bear_rsi_os': 6, 'bear_rsi_ob': 77, 'bear_adx_thresh': 26.78383348422187, 'bear_atr_min_pct': 0.02262505223028877, 'bear_atr_max_pct': 0.11278105982882342, 'bear_tp_mult': 2.6443278652872033, 'bear_tsl_mult': 0.587282418219063, 'bear_time_stop': 299, 'bear_use_sma': False, 'bear_use_ema': False, 'bear_use_atr': False, 'bear_use_adx': True, 'bear_use_spike': True, 'bear_rsi_required': False, 'sideways_strategy': 'breakout', 'sideways_bb_std_mult': 1.980397760781517, 'sideways_rsi_os': 14, 'sideways_rsi_ob': 87, 'sideways_adx_thresh': 8.005446197118783, 'sideways_atr_min_pct': 0.004586350033807967, 'sideways_atr_max_pct': 0.13542413037671716, 'sideways_tp_mult': 1.7508995303223647, 'sideways_tsl_mult': 0.2760251989262887, 'sideways_time_stop': 91, 'sideways_use_sma': True, 'sideways_use_ema': False, 'sideways_use_atr': True, 'sideways_use_adx': False, 'sideways_use_spike': True, 'sideways_rsi_required': True}.
[I 2025-09-01 14:20:57,378] Trial 182 finished with values: [-1000000000.0, 1000000000.0] and parameters: {'p_sma': 47, 'p_std': 50, 'p_atr': 26, 'p_adx': 28, 'rsi_period': 63, 'ema1': 28, 'ema2': 44, 'slip_atr_k': 0.04392959253249, 'slip_spread_k': 0.4002511308039499, 'spread_hl_frac': 0.013942895394650814, 'bb_std_mult': 2.366357326086234, 'rsi_os': 35, 'rsi_ob': 67, 'vol_spike': 0.24743536862011933, 'adx_thresh': 19.017340321230233, 'atr_min_pct': 0.003000136247314657, 'atr_max_pct': 0.09212570628758236, 'tp_mult': 2.419901079370629, 'tsl_mult': 0.8322768739993134, 'strategy': 'breakout', 'time_stop': 50, 'use_sma': False, 'use_atr': False, 'use_adx': True, 'use_ema': False, 'use_spike': False, 'rsi_required': True, 'edge_k': 0.6150178913903375, 'edge_cap': 0.24025210539505792, 'bull_strategy': 'mean_reversion', 'bull_bb_std_mult': 1.151757791985215, 'bull_rsi_os': 8, 'bull_rsi_ob': 79, 'bull_adx_thresh': 12.140314558159936, 'bull_atr_min_pct': 0.005118385100715493, 'bull_atr_max_pct': 0.022334805677625434, 'bull_tp_mult': 2.108671516162608, 'bull_tsl_mult': 0.5037429528228838, 'bull_time_stop': 83, 'bull_use_sma': True, 'bull_use_ema': False, 'bull_use_atr': True, 'bull_use_adx': True, 'bull_use_spike': False, 'bull_rsi_required': True, 'bear_strategy': 'mean_reversion', 'bear_bb_std_mult': 2.972379665003663, 'bear_rsi_os': 36, 'bear_rsi_ob': 71, 'bear_adx_thresh': 27.929827394400988, 'bear_atr_min_pct': 0.02281065565018641, 'bear_atr_max_pct': 0.12156436810849393, 'bear_tp_mult': 2.660436157680733, 'bear_tsl_mult': 0.7598947030440583, 'bear_time_stop': 287, 'bear_use_sma': True, 'bear_use_ema': False, 'bear_use_atr': False, 'bear_use_adx': False, 'bear_use_spike': True, 'bear_rsi_required': False, 'sideways_strategy': 'breakout', 'sideways_bb_std_mult': 2.944238693003675, 'sideways_rsi_os': 20, 'sideways_rsi_ob': 82, 'sideways_adx_thresh': 8.187589285319843, 'sideways_atr_min_pct': 0.006908443671781226, 'sideways_atr_max_pct': 0.14689053475273522, 'sideways_tp_mult': 1.7521963282236062, 'sideways_tsl_mult': 0.17583332520066297, 'sideways_time_stop': 88, 'sideways_use_sma': True, 'sideways_use_ema': False, 'sideways_use_atr': True, 'sideways_use_adx': False, 'sideways_use_spike': True, 'sideways_rsi_required': True}.
[I 2025-09-01 14:20:57,813] Trial 184 finished with values: [-1000000000.0, 1000000000.0] and parameters: {'p_sma': 13, 'p_std': 10, 'p_atr': 26, 'p_adx': 27, 'rsi_period': 68, 'ema1': 30, 'ema2': 50, 'slip_atr_k': 0.032114519342643894, 'slip_spread_k': 0.27826443442999843, 'spread_hl_frac': 0.012089967563384539, 'bb_std_mult': 1.5764075178598995, 'rsi_os': 34, 'rsi_ob': 73, 'vol_spike': 0.2970197882438661, 'adx_thresh': 20.22440669778157, 'atr_min_pct': 0.014277299395838307, 'atr_max_pct': 0.0592023212351917, 'tp_mult': 2.871114604867056, 'tsl_mult': 0.028926613920743565, 'strategy': 'breakout', 'time_stop': 53, 'use_sma': False, 'use_atr': False, 'use_adx': True, 'use_ema': False, 'use_spike': True, 'rsi_required': True, 'edge_k': 0.5549971302800927, 'edge_cap': 0.1152608717180757, 'bull_strategy': 'breakout', 'bull_bb_std_mult': 1.1291354754392766, 'bull_rsi_os': 18, 'bull_rsi_ob': 48, 'bull_adx_thresh': 12.111700768671822, 'bull_atr_min_pct': 0.004032648305373239, 'bull_atr_max_pct': 0.014768157177745773, 'bull_tp_mult': 2.0983492515129814, 'bull_tsl_mult': 0.35582073359111455, 'bull_time_stop': 147, 'bull_use_sma': True, 'bull_use_ema': False, 'bull_use_atr': False, 'bull_use_adx': True, 'bull_use_spike': False, 'bull_rsi_required': True, 'bear_strategy': 'mean_reversion', 'bear_bb_std_mult': 2.9850273784672794, 'bear_rsi_os': 6, 'bear_rsi_ob': 76, 'bear_adx_thresh': 27.726224749307896, 'bear_atr_min_pct': 0.022656845104509077, 'bear_atr_max_pct': 0.11228898064930652, 'bear_tp_mult': 2.4807058845851735, 'bear_tsl_mult': 0.5977712054784213, 'bear_time_stop': 299, 'bear_use_sma': False, 'bear_use_ema': False, 'bear_use_atr': False, 'bear_use_adx': True, 'bear_use_spike': True, 'bear_rsi_required': False, 'sideways_strategy': 'breakout', 'sideways_bb_std_mult': 2.4637567448136566, 'sideways_rsi_os': 13, 'sideways_rsi_ob': 88, 'sideways_adx_thresh': 7.887944612906269, 'sideways_atr_min_pct': 0.004427326374819126, 'sideways_atr_max_pct': 0.14537453822788216, 'sideways_tp_mult': 1.8207549286685603, 'sideways_tsl_mult': 0.2679840030116602, 'sideways_time_stop': 86, 'sideways_use_sma': True, 'sideways_use_ema': False, 'sideways_use_atr': True, 'sideways_use_adx': False, 'sideways_use_spike': True, 'sideways_rsi_required': True}.
[I 2025-09-01 14:20:58,204] Trial 185 finished with values: [-1000000000.0, 1000000000.0] and parameters: {'p_sma': 13, 'p_std': 13, 'p_atr': 26, 'p_adx': 27, 'rsi_period': 63, 'ema1': 30, 'ema2': 50, 'slip_atr_k': 0.0559057522855327, 'slip_spread_k': 0.27603580360120183, 'spread_hl_frac': 0.013577246729760496, 'bb_std_mult': 1.689830245545696, 'rsi_os': 34, 'rsi_ob': 73, 'vol_spike': 0.23253547432116536, 'adx_thresh': 18.7938165553008, 'atr_min_pct': 0.014151917892982247, 'atr_max_pct': 0.0731168641003654, 'tp_mult': 2.885967425725487, 'tsl_mult': 0.008050378993024673, 'strategy': 'breakout', 'time_stop': 50, 'use_sma': False, 'use_atr': False, 'use_adx': True, 'use_ema': False, 'use_spike': True, 'rsi_required': True, 'edge_k': 0.5462359338937138, 'edge_cap': 0.11579182868034915, 'bull_strategy': 'breakout', 'bull_bb_std_mult': 1.1485000056408978, 'bull_rsi_os': 18, 'bull_rsi_ob': 48, 'bull_adx_thresh': 12.238394706642302, 'bull_atr_min_pct': 0.00426264200122499, 'bull_atr_max_pct': 0.014503342854127896, 'bull_tp_mult': 2.093549775689528, 'bull_tsl_mult': 0.468820444455543, 'bull_time_stop': 149, 'bull_use_sma': True, 'bull_use_ema': False, 'bull_use_atr': False, 'bull_use_adx': True, 'bull_use_spike': False, 'bull_rsi_required': True, 'bear_strategy': 'mean_reversion', 'bear_bb_std_mult': 2.980360302605249, 'bear_rsi_os': 6, 'bear_rsi_ob': 77, 'bear_adx_thresh': 28.067332377810267, 'bear_atr_min_pct': 0.02297934824227381, 'bear_atr_max_pct': 0.11295861855470253, 'bear_tp_mult': 2.6179630221374617, 'bear_tsl_mult': 0.6045092725506573, 'bear_time_stop': 288, 'bear_use_sma': False, 'bear_use_ema': False, 'bear_use_atr': False, 'bear_use_adx': True, 'bear_use_spike': True, 'bear_rsi_required': False, 'sideways_strategy': 'breakout', 'sideways_bb_std_mult': 2.464082552863962, 'sideways_rsi_os': 14, 'sideways_rsi_ob': 87, 'sideways_adx_thresh': 6.830094275362084, 'sideways_atr_min_pct': 0.004579629643889846, 'sideways_atr_max_pct': 0.13395779862524845, 'sideways_tp_mult': 1.7454662789418505, 'sideways_tsl_mult': 0.27172488798194816, 'sideways_time_stop': 282, 'sideways_use_sma': True, 'sideways_use_ema': False, 'sideways_use_atr': True, 'sideways_use_adx': False, 'sideways_use_spike': True, 'sideways_rsi_required': True}.
[I 2025-09-01 14:21:34,520] Trial 186 finished with values: [-1000000000.0, 1000000000.0] and parameters: {'p_sma': 13, 'p_std': 10, 'p_atr': 27, 'p_adx': 25, 'rsi_period': 63, 'ema1': 30, 'ema2': 52, 'slip_atr_k': 0.0322772544154221, 'slip_spread_k': 0.27969720449053476, 'spread_hl_frac': 0.014078757141636769, 'bb_std_mult': 1.6597863222385896, 'rsi_os': 32, 'rsi_ob': 74, 'vol_spike': 0.29932076416004993, 'adx_thresh': 19.66353012927121, 'atr_min_pct': 0.01577800031532178, 'atr_max_pct': 0.07313274511791609, 'tp_mult': 2.8881628924625895, 'tsl_mult': 7.76286270165738e-05, 'strategy': 'breakout', 'time_stop': 75, 'use_sma': False, 'use_atr': True, 'use_adx': True, 'use_ema': False, 'use_spike': True, 'rsi_required': False, 'edge_k': 0.6093924090332405, 'edge_cap': 0.06835538604385716, 'bull_strategy': 'breakout', 'bull_bb_std_mult': 2.236872592056801, 'bull_rsi_os': 17, 'bull_rsi_ob': 48, 'bull_adx_thresh': 19.95234392680424, 'bull_atr_min_pct': 0.003851528691239895, 'bull_atr_max_pct': 0.01951389968383252, 'bull_tp_mult': 2.0771802553866485, 'bull_tsl_mult': 0.35765523790810694, 'bull_time_stop': 222, 'bull_use_sma': True, 'bull_use_ema': False, 'bull_use_atr': False, 'bull_use_adx': True, 'bull_use_spike': False, 'bull_rsi_required': True, 'bear_strategy': 'mean_reversion', 'bear_bb_std_mult': 3.0286369131954913, 'bear_rsi_os': 7, 'bear_rsi_ob': 77, 'bear_adx_thresh': 27.813881345892906, 'bear_atr_min_pct': 0.023064053252246343, 'bear_atr_max_pct': 0.10698247810910051, 'bear_tp_mult': 2.4852077720534163, 'bear_tsl_mult': 0.611674107397719, 'bear_time_stop': 286, 'bear_use_sma': False, 'bear_use_ema': False, 'bear_use_atr': False, 'bear_use_adx': True, 'bear_use_spike': False, 'bear_rsi_required': False, 'sideways_strategy': 'mean_reversion', 'sideways_bb_std_mult': 2.46002807123119, 'sideways_rsi_os': 16, 'sideways_rsi_ob': 89, 'sideways_adx_thresh': 6.997831983688696, 'sideways_atr_min_pct': 0.005327358109732697, 'sideways_atr_max_pct': 0.13343957878706894, 'sideways_tp_mult': 1.810616778255338, 'sideways_tsl_mult': 0.26046644568883903, 'sideways_time_stop': 289, 'sideways_use_sma': False, 'sideways_use_ema': False, 'sideways_use_atr': True, 'sideways_use_adx': False, 'sideways_use_spike': True, 'sideways_rsi_required': True}.
[I 2025-09-01 14:21:35,352] Trial 187 finished with values: [-0.00560554373858102, 0.005910665631430189] and parameters: {'p_sma': 12, 'p_std': 9, 'p_atr': 20, 'p_adx': 25, 'rsi_period': 65, 'ema1': 30, 'ema2': 52, 'slip_atr_k': 0.05826838196870423, 'slip_spread_k': 0.23462636061979159, 'spread_hl_frac': 0.014128216488462589, 'bb_std_mult': 1.5241662476022213, 'rsi_os': 36, 'rsi_ob': 74, 'vol_spike': 0.2961542094893542, 'adx_thresh': 19.75437320205006, 'atr_min_pct': 0.015962595621874263, 'atr_max_pct': 0.07466201297947131, 'tp_mult': 2.9131271670085286, 'tsl_mult': 0.06297264190931293, 'strategy': 'breakout', 'time_stop': 66, 'use_sma': False, 'use_atr': True, 'use_adx': True, 'use_ema': False, 'use_spike': True, 'rsi_required': False, 'edge_k': 0.5400341154280656, 'edge_cap': 0.06547548925773765, 'bull_strategy': 'breakout', 'bull_bb_std_mult': 2.874101651869589, 'bull_rsi_os': 17, 'bull_rsi_ob': 49, 'bull_adx_thresh': 10.605550557813128, 'bull_atr_min_pct': 0.0038969867338759703, 'bull_atr_max_pct': 0.018200750772470735, 'bull_tp_mult': 2.0731129009214575, 'bull_tsl_mult': 0.35260460035308333, 'bull_time_stop': 158, 'bull_use_sma': True, 'bull_use_ema': False, 'bull_use_atr': False, 'bull_use_adx': True, 'bull_use_spike': False, 'bull_rsi_required': True, 'bear_strategy': 'mean_reversion', 'bear_bb_std_mult': 2.7854764371010985, 'bear_rsi_os': 8, 'bear_rsi_ob': 77, 'bear_adx_thresh': 28.098579281007066, 'bear_atr_min_pct': 0.023566891327757584, 'bear_atr_max_pct': 0.11245443834128878, 'bear_tp_mult': 2.4953540324735553, 'bear_tsl_mult': 0.6271596435038985, 'bear_time_stop': 287, 'bear_use_sma': False, 'bear_use_ema': False, 'bear_use_atr': False, 'bear_use_adx': True, 'bear_use_spike': False, 'bear_rsi_required': False, 'sideways_strategy': 'mean_reversion', 'sideways_bb_std_mult': 3.3368442515442824, 'sideways_rsi_os': 16, 'sideways_rsi_ob': 89, 'sideways_adx_thresh': 6.876634816421463, 'sideways_atr_min_pct': 0.005317287118432241, 'sideways_atr_max_pct': 0.13511725831465787, 'sideways_tp_mult': 1.8162370521821474, 'sideways_tsl_mult': 0.2834769884183548, 'sideways_time_stop': 114, 'sideways_use_sma': False, 'sideways_use_ema': False, 'sideways_use_atr': True, 'sideways_use_adx': False, 'sideways_use_spike': True, 'sideways_rsi_required': True}.
[I 2025-09-01 14:21:35,776] Trial 189 finished with values: [-0.008896083428961199, 0.008893192791375583] and parameters: {'p_sma': 11, 'p_std': 21, 'p_atr': 14, 'p_adx': 26, 'rsi_period': 10, 'ema1': 30, 'ema2': 52, 'slip_atr_k': 0.027119593927168267, 'slip_spread_k': 0.23353457970654654, 'spread_hl_frac': 0.014610992478508392, 'bb_std_mult': 1.4493835387193357, 'rsi_os': 36, 'rsi_ob': 71, 'vol_spike': 0.20715116485446813, 'adx_thresh': 19.6756309632802, 'atr_min_pct': 0.01564330114505649, 'atr_max_pct': 0.06926309722632973, 'tp_mult': 2.961683656344851, 'tsl_mult': 0.06813268006255613, 'strategy': 'breakout', 'time_stop': 79, 'use_sma': False, 'use_atr': True, 'use_adx': True, 'use_ema': False, 'use_spike': True, 'rsi_required': False, 'edge_k': 0.43352309126632516, 'edge_cap': 0.06773292687320685, 'bull_strategy': 'breakout', 'bull_bb_std_mult': 1.2722139142605082, 'bull_rsi_os': 16, 'bull_rsi_ob': 49, 'bull_adx_thresh': 11.141367082921501, 'bull_atr_min_pct': 0.0025573911163369344, 'bull_atr_max_pct': 0.018312871421906206, 'bull_tp_mult': 2.2369205480298304, 'bull_tsl_mult': 0.39045560963367165, 'bull_time_stop': 158, 'bull_use_sma': True, 'bull_use_ema': False, 'bull_use_atr': False, 'bull_use_adx': True, 'bull_use_spike': False, 'bull_rsi_required': True, 'bear_strategy': 'mean_reversion', 'bear_bb_std_mult': 2.89903795310811, 'bear_rsi_os': 8, 'bear_rsi_ob': 78, 'bear_adx_thresh': 29.607137700419397, 'bear_atr_min_pct': 0.021460287721004452, 'bear_atr_max_pct': 0.10654791129945479, 'bear_tp_mult': 2.5536409063589125, 'bear_tsl_mult': 0.6299324845341183, 'bear_time_stop': 283, 'bear_use_sma': False, 'bear_use_ema': True, 'bear_use_atr': False, 'bear_use_adx': True, 'bear_use_spike': False, 'bear_rsi_required': False, 'sideways_strategy': 'mean_reversion', 'sideways_bb_std_mult': 3.48834558865848, 'sideways_rsi_os': 17, 'sideways_rsi_ob': 85, 'sideways_adx_thresh': 6.522124340821703, 'sideways_atr_min_pct': 0.003330406597836172, 'sideways_atr_max_pct': 0.13865720529718753, 'sideways_tp_mult': 1.6286230199655245, 'sideways_tsl_mult': 0.1916094362112284, 'sideways_time_stop': 115, 'sideways_use_sma': False, 'sideways_use_ema': True, 'sideways_use_atr': True, 'sideways_use_adx': False, 'sideways_use_spike': True, 'sideways_rsi_required': True}.
