[I 2025-09-01 14:53:46,457] Trial 398 finished with values: [-1000000000.0, 1000000000.0] and parameters: {'p_sma': 48, 'p_std': 8, 'p_atr': 21, 'p_adx': 30, 'rsi_period': 63, 'ema1': 30, 'ema2': 52, 'slip_atr_k': 0.06699514055002995, 'slip_spread_k': 0.7748019415918956, 'spread_hl_frac': 0.023420452616374095, 'bb_std_mult': 3.4719207472459614, 'rsi_os': 14, 'rsi_ob': 75, 'vol_spike': 0.2845379605824755, 'adx_thresh': 16.216753118914273, 'atr_min_pct': 0.015576084404515508, 'atr_max_pct': 0.08021488866857904, 'tp_mult': 2.938015760705452, 'tsl_mult': 0.4057006716904169, 'strategy': 'mean_reversion', 'time_stop': 57, 'use_sma': True, 'use_atr': True, 'use_adx': False, 'use_ema': True, 'use_spike': True, 'rsi_required': False, 'edge_k': 1.6897018314599488, 'edge_cap': 0.07681471884766641, 'bull_strategy': 'breakout', 'bull_bb_std_mult': 2.855154331982402, 'bull_rsi_os': 17, 'bull_rsi_ob': 60, 'bull_adx_thresh': 20.98487231976692, 'bull_atr_min_pct': 0.028026127627639518, 'bull_atr_max_pct': 0.13360422959746565, 'bull_tp_mult': 2.771369373793354, 'bull_tsl_mult': 0.7866384386389109, 'bull_time_stop': 154, 'bull_use_sma': False, 'bull_use_ema': True, 'bull_use_atr': False, 'bull_use_adx': True, 'bull_use_spike': False, 'bull_rsi_required': False, 'bear_strategy': 'mean_reversion', 'bear_bb_std_mult': 1.3319635331174309, 'bear_rsi_os': 9, 'bear_rsi_ob': 57, 'bear_adx_thresh': 28.874305868683685, 'bear_atr_min_pct': 0.02279413533013769, 'bear_atr_max_pct': 0.05544381716220888, 'bear_tp_mult': 2.4107272533804065, 'bear_tsl_mult': 0.6120060943361567, 'bear_time_stop': 270, 'bear_use_sma': False, 'bear_use_ema': True, 'bear_use_atr': False, 'bear_use_adx': True, 'bear_use_spike': False, 'bear_rsi_required': False, 'sideways_strategy': 'mean_reversion', 'sideways_bb_std_mult': 3.2835784391733753, 'sideways_rsi_os': 27, 'sideways_rsi_ob': 87, 'sideways_adx_thresh': 25.141804129795673, 'sideways_atr_min_pct': 0.0056183794650518076, 'sideways_atr_max_pct': 0.1336382720184033, 'sideways_tp_mult': 1.7929461868140202, 'sideways_tsl_mult': 0.3361715385261272, 'sideways_time_stop': 137, 'sideways_use_sma': False, 'sideways_use_ema': True, 'sideways_use_atr': True, 'sideways_use_adx': True, 'sideways_use_spike': True, 'sideways_rsi_required': False}.
[I 2025-09-01 14:53:47,112] Trial 395 finished with values: [-0.011171561616998615, 0.011497903060251459] and parameters: {'p_sma': 48, 'p_std': 8, 'p_atr': 20, 'p_adx': 22, 'rsi_period': 62, 'ema1': 16, 'ema2': 56, 'slip_atr_k': 0.05379816407677297, 'slip_spread_k': 0.16437859264523663, 'spread_hl_frac': 0.011817004758348104, 'bb_std_mult': 1.5298738162235148, 'rsi_os': 39, 'rsi_ob': 77, 'vol_spike': 0.2999787880164305, 'adx_thresh': 18.57486773395506, 'atr_min_pct': 0.015520647511213697, 'atr_max_pct': 0.06904422055013568, 'tp_mult': 1.044737708009111, 'tsl_mult': 0.6942904506467621, 'strategy': 'mean_reversion', 'time_stop': 154, 'use_sma': True, 'use_atr': True, 'use_adx': True, 'use_ema': True, 'use_spike': True, 'rsi_required': False, 'edge_k': 0.12647167424787487, 'edge_cap': 0.6504626019266666, 'bull_strategy': 'mean_reversion', 'bull_bb_std_mult': 2.921901034991677, 'bull_rsi_os': 40, 'bull_rsi_ob': 47, 'bull_adx_thresh': 10.689757344962425, 'bull_atr_min_pct': 0.002874439835090335, 'bull_atr_max_pct': 0.044497388747392744, 'bull_tp_mult': 2.1722097951610237, 'bull_tsl_mult': 0.35761518539268183, 'bull_time_stop': 35, 'bull_use_sma': False, 'bull_use_ema': True, 'bull_use_atr': False, 'bull_use_adx': True, 'bull_use_spike': False, 'bull_rsi_required': False, 'bear_strategy': 'breakout', 'bear_bb_std_mult': 1.11269190942803, 'bear_rsi_os': 9, 'bear_rsi_ob': 57, 'bear_adx_thresh': 28.811502039336286, 'bear_atr_min_pct': 0.023487021580233348, 'bear_atr_max_pct': 0.11170352551769637, 'bear_tp_mult': 2.5441075358039185, 'bear_tsl_mult': 0.6248190978776063, 'bear_time_stop': 26, 'bear_use_sma': False, 'bear_use_ema': True, 'bear_use_atr': False, 'bear_use_adx': False, 'bear_use_spike': False, 'bear_rsi_required': False, 'sideways_strategy': 'mean_reversion', 'sideways_bb_std_mult': 3.3098764954583895, 'sideways_rsi_os': 8, 'sideways_rsi_ob': 58, 'sideways_adx_thresh': 6.218502682279749, 'sideways_atr_min_pct': 0.02904834910181511, 'sideways_atr_max_pct': 0.13185097916216523, 'sideways_tp_mult': 1.7678968218863134, 'sideways_tsl_mult': 0.9749379560038329, 'sideways_time_stop': 276, 'sideways_use_sma': False, 'sideways_use_ema': True, 'sideways_use_atr': True, 'sideways_use_adx': True, 'sideways_use_spike': True, 'sideways_rsi_required': False}.
[I 2025-09-01 14:53:48,386] Trial 394 finished with values: [-1000000000.0, 1000000000.0] and parameters: {'p_sma': 13, 'p_std': 9, 'p_atr': 21, 'p_adx': 22, 'rsi_period': 48, 'ema1': 30, 'ema2': 54, 'slip_atr_k': 0.04191589663770899, 'slip_spread_k': 0.22265986168845037, 'spread_hl_frac': 0.023343381439996452, 'bb_std_mult': 1.5208339618106206, 'rsi_os': 33, 'rsi_ob': 77, 'vol_spike': 0.2906718939713256, 'adx_thresh': 25.71454651707349, 'atr_min_pct': 0.015923154488292558, 'atr_max_pct': 0.07012932698840323, 'tp_mult': 2.939480969016466, 'tsl_mult': 0.07151879471016198, 'strategy': 'mean_reversion', 'time_stop': 66, 'use_sma': True, 'use_atr': True, 'use_adx': True, 'use_ema': True, 'use_spike': True, 'rsi_required': False, 'edge_k': 0.41717998930212896, 'edge_cap': 0.051655757690646543, 'bull_strategy': 'mean_reversion', 'bull_bb_std_mult': 1.5275727180711969, 'bull_rsi_os': 17, 'bull_rsi_ob': 53, 'bull_adx_thresh': 10.739831210672186, 'bull_atr_min_pct': 0.019274301018227743, 'bull_atr_max_pct': 0.024627685040368903, 'bull_tp_mult': 2.1721453640672035, 'bull_tsl_mult': 0.3245365287717521, 'bull_time_stop': 44, 'bull_use_sma': False, 'bull_use_ema': True, 'bull_use_atr': False, 'bull_use_adx': True, 'bull_use_spike': False, 'bull_rsi_required': False, 'bear_strategy': 'mean_reversion', 'bear_bb_std_mult': 0.7473959990988162, 'bear_rsi_os': 9, 'bear_rsi_ob': 77, 'bear_adx_thresh': 21.063740252731126, 'bear_atr_min_pct': 0.0029743343494108756, 'bear_atr_max_pct': 0.056886475344178476, 'bear_tp_mult': 2.536677273117572, 'bear_tsl_mult': 0.8992334174967278, 'bear_time_stop': 295, 'bear_use_sma': False, 'bear_use_ema': True, 'bear_use_atr': False, 'bear_use_adx': False, 'bear_use_spike': False, 'bear_rsi_required': False, 'sideways_strategy': 'mean_reversion', 'sideways_bb_std_mult': 3.3046675257906877, 'sideways_rsi_os': 7, 'sideways_rsi_ob': 89, 'sideways_adx_thresh': 15.536350255484951, 'sideways_atr_min_pct': 0.01672401058094517, 'sideways_atr_max_pct': 0.13101954223630147, 'sideways_tp_mult': 1.8808998974184594, 'sideways_tsl_mult': 0.3353571852849104, 'sideways_time_stop': 101, 'sideways_use_sma': False, 'sideways_use_ema': False, 'sideways_use_atr': True, 'sideways_use_adx': False, 'sideways_use_spike': True, 'sideways_rsi_required': True}.
[I 2025-09-01 14:54:28,138] Trial 400 finished with values: [-1000000000.0, 1000000000.0] and parameters: {'p_sma': 32, 'p_std': 10, 'p_atr': 19, 'p_adx': 19, 'rsi_period': 65, 'ema1': 7, 'ema2': 51, 'slip_atr_k': 0.048286361414776394, 'slip_spread_k': 0.22699911828810374, 'spread_hl_frac': 0.011838810617288831, 'bb_std_mult': 1.6368451154220414, 'rsi_os': 46, 'rsi_ob': 89, 'vol_spike': 0.29926955632991087, 'adx_thresh': 17.52938066106214, 'atr_min_pct': 0.01871975743777969, 'atr_max_pct': 0.04373815791774147, 'tp_mult': 2.6339846126596207, 'tsl_mult': 0.4772498478008808, 'strategy': 'breakout', 'time_stop': 15, 'use_sma': False, 'use_atr': True, 'use_adx': True, 'use_ema': False, 'use_spike': True, 'rsi_required': False, 'edge_k': 0.6771576423023824, 'edge_cap': 0.051293135248358726, 'bull_strategy': 'breakout', 'bull_bb_std_mult': 2.795702975742351, 'bull_rsi_os': 17, 'bull_rsi_ob': 82, 'bull_adx_thresh': 18.01217573566595, 'bull_atr_min_pct': 0.0105859604886021, 'bull_atr_max_pct': 0.063836065677058, 'bull_tp_mult': 1.7005351969018943, 'bull_tsl_mult': 0.4286718823120643, 'bull_time_stop': 297, 'bull_use_sma': True, 'bull_use_ema': False, 'bull_use_atr': False, 'bull_use_adx': True, 'bull_use_spike': False, 'bull_rsi_required': True, 'bear_strategy': 'mean_reversion', 'bear_bb_std_mult': 2.8235125201321414, 'bear_rsi_os': 20, 'bear_rsi_ob': 75, 'bear_adx_thresh': 26.821360166523327, 'bear_atr_min_pct': 0.024891291544747427, 'bear_atr_max_pct': 0.051750154228867265, 'bear_tp_mult': 2.455995871897198, 'bear_tsl_mult': 0.9002129667989416, 'bear_time_stop': 107, 'bear_use_sma': False, 'bear_use_ema': False, 'bear_use_atr': False, 'bear_use_adx': True, 'bear_use_spike': False, 'bear_rsi_required': False, 'sideways_strategy': 'mean_reversion', 'sideways_bb_std_mult': 0.5807619913126065, 'sideways_rsi_os': 46, 'sideways_rsi_ob': 48, 'sideways_adx_thresh': 8.039224522471105, 'sideways_atr_min_pct': 0.0053016872661225895, 'sideways_atr_max_pct': 0.1490674506322889, 'sideways_tp_mult': 1.871968097052389, 'sideways_tsl_mult': 0.37681818887293045, 'sideways_time_stop': 96, 'sideways_use_sma': False, 'sideways_use_ema': False, 'sideways_use_atr': False, 'sideways_use_adx': False, 'sideways_use_spike': True, 'sideways_rsi_required': True}.
[I 2025-09-01 14:54:29,429] Trial 401 finished with values: [-0.048674249246663415, 0.04876559706448785] and parameters: {'p_sma': 22, 'p_std': 18, 'p_atr': 20, 'p_adx': 19, 'rsi_period': 65, 'ema1': 28, 'ema2': 51, 'slip_atr_k': 0.17470164849947073, 'slip_spread_k': 0.22347459115296966, 'spread_hl_frac': 0.011911652334398403, 'bb_std_mult': 1.5601383634342008, 'rsi_os': 33, 'rsi_ob': 89, 'vol_spike': 0.2953257918822835, 'adx_thresh': 25.71236204931591, 'atr_min_pct': 0.025117528217836686, 'atr_max_pct': 0.0673953046978582, 'tp_mult': 2.9227277170698778, 'tsl_mult': 0.005846768267800895, 'strategy': 'breakout', 'time_stop': 64, 'use_sma': False, 'use_atr': True, 'use_adx': True, 'use_ema': False, 'use_spike': True, 'rsi_required': False, 'edge_k': 1.3804826508951455, 'edge_cap': 0.6467082159977305, 'bull_strategy': 'breakout', 'bull_bb_std_mult': 2.704445570238172, 'bull_rsi_os': 55, 'bull_rsi_ob': 89, 'bull_adx_thresh': 9.43668927651515, 'bull_atr_min_pct': 0.001887509290977564, 'bull_atr_max_pct': 0.0208985232829223, 'bull_tp_mult': 2.078466562016861, 'bull_tsl_mult': 0.3313585348607015, 'bull_time_stop': 162, 'bull_use_sma': True, 'bull_use_ema': False, 'bull_use_atr': False, 'bull_use_adx': True, 'bull_use_spike': False, 'bull_rsi_required': True, 'bear_strategy': 'mean_reversion', 'bear_bb_std_mult': 2.8340118235162075, 'bear_rsi_os': 8, 'bear_rsi_ob': 75, 'bear_adx_thresh': 27.815252378050577, 'bear_atr_min_pct': 0.0052807765668344865, 'bear_atr_max_pct': 0.09748529964567298, 'bear_tp_mult': 1.5424046725638982, 'bear_tsl_mult': 0.7524897792145987, 'bear_time_stop': 92, 'bear_use_sma': False, 'bear_use_ema': False, 'bear_use_atr': False, 'bear_use_adx': True, 'bear_use_spike': False, 'bear_rsi_required': False, 'sideways_strategy': 'mean_reversion', 'sideways_bb_std_mult': 1.3660056919515458, 'sideways_rsi_os': 37, 'sideways_rsi_ob': 91, 'sideways_adx_thresh': 8.32320510311091, 'sideways_atr_min_pct': 0.005101565643480767, 'sideways_atr_max_pct': 0.14326195153896204, 'sideways_tp_mult': 1.8658419244373183, 'sideways_tsl_mult': 0.5184563836964401, 'sideways_time_stop': 211, 'sideways_use_sma': False, 'sideways_use_ema': False, 'sideways_use_atr': False, 'sideways_use_adx': False, 'sideways_use_spike': True, 'sideways_rsi_required': True}.
[I 2025-09-01 14:54:29,430] Trial 402 finished with values: [-1000000000.0, 1000000000.0] and parameters: {'p_sma': 9, 'p_std': 11, 'p_atr': 20, 'p_adx': 19, 'rsi_period': 64, 'ema1': 15, 'ema2': 51, 'slip_atr_k': 0.13281087476820114, 'slip_spread_k': 0.23813578124153376, 'spread_hl_frac': 0.011509645193356517, 'bb_std_mult': 1.6295643171196568, 'rsi_os': 46, 'rsi_ob': 45, 'vol_spike': 0.2995958602966559, 'adx_thresh': 17.531859153102065, 'atr_min_pct': 0.02514245264028915, 'atr_max_pct': 0.04391059966685797, 'tp_mult': 2.2790001269463724, 'tsl_mult': 0.10300277183651568, 'strategy': 'breakout', 'time_stop': 82, 'use_sma': False, 'use_atr': True, 'use_adx': True, 'use_ema': False, 'use_spike': True, 'rsi_required': False, 'edge_k': 0.5472397022578069, 'edge_cap': 0.13407620598292236, 'bull_strategy': 'breakout', 'bull_bb_std_mult': 2.704780003487442, 'bull_rsi_os': 40, 'bull_rsi_ob': 48, 'bull_adx_thresh': 9.644119235672076, 'bull_atr_min_pct': 0.007885770214327598, 'bull_atr_max_pct': 0.11188411551782378, 'bull_tp_mult': 2.075146098640383, 'bull_tsl_mult': 0.07900216754883205, 'bull_time_stop': 161, 'bull_use_sma': True, 'bull_use_ema': False, 'bull_use_atr': False, 'bull_use_adx': True, 'bull_use_spike': False, 'bull_rsi_required': True, 'bear_strategy': 'mean_reversion', 'bear_bb_std_mult': 3.3346916053742968, 'bear_rsi_os': 8, 'bear_rsi_ob': 75, 'bear_adx_thresh': 26.705785119820387, 'bear_atr_min_pct': 0.023426551844953448, 'bear_atr_max_pct': 0.11094934761090952, 'bear_tp_mult': 1.5230474668184384, 'bear_tsl_mult': 0.9634942802074661, 'bear_time_stop': 27, 'bear_use_sma': False, 'bear_use_ema': False, 'bear_use_atr': False, 'bear_use_adx': True, 'bear_use_spike': False, 'bear_rsi_required': False, 'sideways_strategy': 'mean_reversion', 'sideways_bb_std_mult': 1.3499789363946928, 'sideways_rsi_os': 14, 'sideways_rsi_ob': 83, 'sideways_adx_thresh': 8.152547503092377, 'sideways_atr_min_pct': 0.005235128782445689, 'sideways_atr_max_pct': 0.1284586353692129, 'sideways_tp_mult': 1.7439827563926409, 'sideways_tsl_mult': 0.983202152079332, 'sideways_time_stop': 93, 'sideways_use_sma': False, 'sideways_use_ema': False, 'sideways_use_atr': False, 'sideways_use_adx': False, 'sideways_use_spike': True, 'sideways_rsi_required': True}.
[I 2025-09-01 14:54:29,706] Trial 399 finished with values: [-1000000000.0, 1000000000.0] and parameters: {'p_sma': 13, 'p_std': 10, 'p_atr': 9, 'p_adx': 19, 'rsi_period': 52, 'ema1': 7, 'ema2': 35, 'slip_atr_k': 0.13423619313539648, 'slip_spread_k': 0.23161040485759013, 'spread_hl_frac': 0.011801884535189839, 'bb_std_mult': 3.309580728752267, 'rsi_os': 6, 'rsi_ob': 50, 'vol_spike': 0.2949704873866647, 'adx_thresh': 19.67989400346666, 'atr_min_pct': 0.01622877493903806, 'atr_max_pct': 0.035376974766811654, 'tp_mult': 1.55347906227186, 'tsl_mult': 0.006466371980288099, 'strategy': 'breakout', 'time_stop': 154, 'use_sma': False, 'use_atr': True, 'use_adx': True, 'use_ema': False, 'use_spike': True, 'rsi_required': False, 'edge_k': 0.676217034450622, 'edge_cap': 0.13413630548580346, 'bull_strategy': 'breakout', 'bull_bb_std_mult': 2.692098420090465, 'bull_rsi_os': 44, 'bull_rsi_ob': 59, 'bull_adx_thresh': 22.211238890805554, 'bull_atr_min_pct': 0.010935349878991855, 'bull_atr_max_pct': 0.09284228823332362, 'bull_tp_mult': 1.148604888449683, 'bull_tsl_mult': 0.3909125548772287, 'bull_time_stop': 76, 'bull_use_sma': True, 'bull_use_ema': False, 'bull_use_atr': False, 'bull_use_adx': True, 'bull_use_spike': False, 'bull_rsi_required': True, 'bear_strategy': 'mean_reversion', 'bear_bb_std_mult': 1.0852017265505078, 'bear_rsi_os': 23, 'bear_rsi_ob': 45, 'bear_adx_thresh': 26.977611250269923, 'bear_atr_min_pct': 0.005266467009743295, 'bear_atr_max_pct': 0.045890022528383194, 'bear_tp_mult': 1.546766238615279, 'bear_tsl_mult': 0.9434313494826305, 'bear_time_stop': 75, 'bear_use_sma': False, 'bear_use_ema': False, 'bear_use_atr': False, 'bear_use_adx': True, 'bear_use_spike': False, 'bear_rsi_required': False, 'sideways_strategy': 'mean_reversion', 'sideways_bb_std_mult': 1.9326759918576477, 'sideways_rsi_os': 37, 'sideways_rsi_ob': 72, 'sideways_adx_thresh': 17.52616921103649, 'sideways_atr_min_pct': 0.005206870716779107, 'sideways_atr_max_pct': 0.03939421506753579, 'sideways_tp_mult': 1.8771581501328831, 'sideways_tsl_mult': 0.3034562062685483, 'sideways_time_stop': 94, 'sideways_use_sma': False, 'sideways_use_ema': False, 'sideways_use_atr': False, 'sideways_use_adx': False, 'sideways_use_spike': True, 'sideways_rsi_required': True}.
[I 2025-09-01 14:55:09,369] Trial 404 finished with values: [-1000000000.0, 1000000000.0] and parameters: {'p_sma': 14, 'p_std': 23, 'p_atr': 20, 'p_adx': 23, 'rsi_period': 56, 'ema1': 29, 'ema2': 49, 'slip_atr_k': 0.06132211158057828, 'slip_spread_k': 0.25720654336303284, 'spread_hl_frac': 0.01913467812565513, 'bb_std_mult': 2.964800039009518, 'rsi_os': 48, 'rsi_ob': 73, 'vol_spike': 0.1260427048975186, 'adx_thresh': 19.590561991588952, 'atr_min_pct': 0.01970888398469433, 'atr_max_pct': 0.03613555098103389, 'tp_mult': 2.8408669212818567, 'tsl_mult': 0.040319466625128586, 'strategy': 'breakout', 'time_stop': 75, 'use_sma': False, 'use_atr': False, 'use_adx': False, 'use_ema': False, 'use_spike': False, 'rsi_required': True, 'edge_k': 0.24737322680796814, 'edge_cap': 0.10683380222833386, 'bull_strategy': 'breakout', 'bull_bb_std_mult': 2.919321011641517, 'bull_rsi_os': 18, 'bull_rsi_ob': 59, 'bull_adx_thresh': 34.96252695202633, 'bull_atr_min_pct': 0.010154750271979436, 'bull_atr_max_pct': 0.01588164993652583, 'bull_tp_mult': 2.0061021286392418, 'bull_tsl_mult': 0.3896736067165135, 'bull_time_stop': 154, 'bull_use_sma': True, 'bull_use_ema': False, 'bull_use_atr': True, 'bull_use_adx': False, 'bull_use_spike': True, 'bull_rsi_required': True, 'bear_strategy': 'breakout', 'bear_bb_std_mult': 1.686799980926388, 'bear_rsi_os': 51, 'bear_rsi_ob': 83, 'bear_adx_thresh': 32.63180612434218, 'bear_atr_min_pct': 0.02349730846135258, 'bear_atr_max_pct': 0.10704024491655961, 'bear_tp_mult': 2.494863343349049, 'bear_tsl_mult': 0.24174731337611705, 'bear_time_stop': 279, 'bear_use_sma': True, 'bear_use_ema': False, 'bear_use_atr': True, 'bear_use_adx': True, 'bear_use_spike': True, 'bear_rsi_required': True, 'sideways_strategy': 'breakout', 'sideways_bb_std_mult': 3.3974543536945108, 'sideways_rsi_os': 17, 'sideways_rsi_ob': 87, 'sideways_adx_thresh': 11.361341698206376, 'sideways_atr_min_pct': 0.021289936287938033, 'sideways_atr_max_pct': 0.09711686199223186, 'sideways_tp_mult': 1.811407752790519, 'sideways_tsl_mult': 0.3021725492197168, 'sideways_time_stop': 221, 'sideways_use_sma': True, 'sideways_use_ema': False, 'sideways_use_atr': True, 'sideways_use_adx': False, 'sideways_use_spike': False, 'sideways_rsi_required': True}.
[I 2025-09-01 14:55:09,560] Trial 405 finished with values: [-1000000000.0, 1000000000.0] and parameters: {'p_sma': 14, 'p_std': 26, 'p_atr': 20, 'p_adx': 23, 'rsi_period': 20, 'ema1': 29, 'ema2': 53, 'slip_atr_k': 0.06091771930501312, 'slip_spread_k': 0.2546964568804909, 'spread_hl_frac': 0.018918103920161997, 'bb_std_mult': 1.4365264061386103, 'rsi_os': 38, 'rsi_ob': 51, 'vol_spike': 0.1324034268054911, 'adx_thresh': 22.4412120931926, 'atr_min_pct': 0.006764644006377097, 'atr_max_pct': 0.07385406268385612, 'tp_mult': 2.438804680381347, 'tsl_mult': 0.6396569447531961, 'strategy': 'breakout', 'time_stop': 72, 'use_sma': False, 'use_atr': False, 'use_adx': False, 'use_ema': False, 'use_spike': False, 'rsi_required': True, 'edge_k': 0.24776023727205243, 'edge_cap': 0.10684811105105682, 'bull_strategy': 'breakout', 'bull_bb_std_mult': 2.8865952924711458, 'bull_rsi_os': 44, 'bull_rsi_ob': 59, 'bull_adx_thresh': 12.045019256095996, 'bull_atr_min_pct': 0.01668549581556875, 'bull_atr_max_pct': 0.01627544167913636, 'bull_tp_mult': 1.1451756216173847, 'bull_tsl_mult': 0.39143370843379216, 'bull_time_stop': 153, 'bull_use_sma': True, 'bull_use_ema': False, 'bull_use_atr': True, 'bull_use_adx': False, 'bull_use_spike': True, 'bull_rsi_required': True, 'bear_strategy': 'breakout', 'bear_bb_std_mult': 1.1393750047815154, 'bear_rsi_os': 40, 'bear_rsi_ob': 83, 'bear_adx_thresh': 25.041466776799275, 'bear_atr_min_pct': 0.0014822169234696477, 'bear_atr_max_pct': 0.10810131625170465, 'bear_tp_mult': 2.428175554706709, 'bear_tsl_mult': 0.21038224348774126, 'bear_time_stop': 279, 'bear_use_sma': True, 'bear_use_ema': False, 'bear_use_atr': True, 'bear_use_adx': True, 'bear_use_spike': True, 'bear_rsi_required': True, 'sideways_strategy': 'breakout', 'sideways_bb_std_mult': 3.395836694806807, 'sideways_rsi_os': 19, 'sideways_rsi_ob': 87, 'sideways_adx_thresh': 6.831453902322203, 'sideways_atr_min_pct': 0.006121043246499239, 'sideways_atr_max_pct': 0.10715146569097153, 'sideways_tp_mult': 1.2771569079334626, 'sideways_tsl_mult': 0.29933391885428906, 'sideways_time_stop': 109, 'sideways_use_sma': True, 'sideways_use_ema': False, 'sideways_use_atr': True, 'sideways_use_adx': False, 'sideways_use_spike': False, 'sideways_rsi_required': True}.
