[I 2025-09-01 14:21:36,178] Trial 188 finished with values: [-1000000000.0, 1000000000.0] and parameters: {'p_sma': 12, 'p_std': 21, 'p_atr': 28, 'p_adx': 25, 'rsi_period': 72, 'ema1': 30, 'ema2': 52, 'slip_atr_k': 0.05094674801245934, 'slip_spread_k': 0.2299375169427883, 'spread_hl_frac': 0.01118628848770917, 'bb_std_mult': 1.5086748457036792, 'rsi_os': 36, 'rsi_ob': 74, 'vol_spike': 0.2344818041615101, 'adx_thresh': 19.548543333914225, 'atr_min_pct': 0.015556865603605191, 'atr_max_pct': 0.07307851114551206, 'tp_mult': 2.903953646471527, 'tsl_mult': 0.0016133255080504547, 'strategy': 'breakout', 'time_stop': 68, 'use_sma': False, 'use_atr': True, 'use_adx': True, 'use_ema': False, 'use_spike': True, 'rsi_required': False, 'edge_k': 0.5725750200681836, 'edge_cap': 0.06665391594028024, 'bull_strategy': 'breakout', 'bull_bb_std_mult': 3.215722786048677, 'bull_rsi_os': 16, 'bull_rsi_ob': 49, 'bull_adx_thresh': 33.53118185255467, 'bull_atr_min_pct': 0.004251050910666576, 'bull_atr_max_pct': 0.01899637115025791, 'bull_tp_mult': 2.2428959575238974, 'bull_tsl_mult': 0.45619665958764777, 'bull_time_stop': 245, 'bull_use_sma': True, 'bull_use_ema': False, 'bull_use_atr': False, 'bull_use_adx': True, 'bull_use_spike': False, 'bull_rsi_required': True, 'bear_strategy': 'mean_reversion', 'bear_bb_std_mult': 2.8928570614521294, 'bear_rsi_os': 46, 'bear_rsi_ob': 77, 'bear_adx_thresh': 29.493408891034417, 'bear_atr_min_pct': 0.021817104576761726, 'bear_atr_max_pct': 0.1059373311397168, 'bear_tp_mult': 2.556194679365239, 'bear_tsl_mult': 0.6421649157549678, 'bear_time_stop': 290, 'bear_use_sma': False, 'bear_use_ema': True, 'bear_use_atr': False, 'bear_use_adx': True, 'bear_use_spike': False, 'bear_rsi_required': False, 'sideways_strategy': 'mean_reversion', 'sideways_bb_std_mult': 3.487514299543377, 'sideways_rsi_os': 16, 'sideways_rsi_ob': 87, 'sideways_adx_thresh': 6.925485609834745, 'sideways_atr_min_pct': 0.00526725283354487, 'sideways_atr_max_pct': 0.13338262627133268, 'sideways_tp_mult': 1.6782910041870034, 'sideways_tsl_mult': 0.2625740845892208, 'sideways_time_stop': 293, 'sideways_use_sma': False, 'sideways_use_ema': True, 'sideways_use_atr': True, 'sideways_use_adx': False, 'sideways_use_spike': True, 'sideways_rsi_required': True}.
[I 2025-09-01 14:22:11,419] Trial 193 finished with values: [-1000000000.0, 1000000000.0] and parameters: {'p_sma': 10, 'p_std': 8, 'p_atr': 20, 'p_adx': 25, 'rsi_period': 66, 'ema1': 30, 'ema2': 53, 'slip_atr_k': 0.08481290383250392, 'slip_spread_k': 0.18918802776260946, 'spread_hl_frac': 0.015340911350898795, 'bb_std_mult': 1.415363501364193, 'rsi_os': 38, 'rsi_ob': 76, 'vol_spike': 0.2850869132285533, 'adx_thresh': 20.66295041132784, 'atr_min_pct': 0.01600160794064577, 'atr_max_pct': 0.07637020318582079, 'tp_mult': 2.9831982837493363, 'tsl_mult': 0.05983617232409061, 'strategy': 'breakout', 'time_stop': 61, 'use_sma': False, 'use_atr': True, 'use_adx': False, 'use_ema': False, 'use_spike': True, 'rsi_required': False, 'edge_k': 0.49903895535963244, 'edge_cap': 0.05358783191925599, 'bull_strategy': 'breakout', 'bull_bb_std_mult': 2.874485268407194, 'bull_rsi_os': 22, 'bull_rsi_ob': 46, 'bull_adx_thresh': 9.672393920192304, 'bull_atr_min_pct': 0.00872737262135166, 'bull_atr_max_pct': 0.018113535530416724, 'bull_tp_mult': 2.061868756928048, 'bull_tsl_mult': 0.3905074470943144, 'bull_time_stop': 158, 'bull_use_sma': True, 'bull_use_ema': False, 'bull_use_atr': False, 'bull_use_adx': False, 'bull_use_spike': False, 'bull_rsi_required': False, 'bear_strategy': 'mean_reversion', 'bear_bb_std_mult': 2.6917949011782243, 'bear_rsi_os': 5, 'bear_rsi_ob': 75, 'bear_adx_thresh': 28.878914254426242, 'bear_atr_min_pct': 0.023772573326290836, 'bear_atr_max_pct': 0.11004722425015002, 'bear_tp_mult': 2.301500501524109, 'bear_tsl_mult': 0.6308816711607915, 'bear_time_stop': 290, 'bear_use_sma': False, 'bear_use_ema': False, 'bear_use_atr': False, 'bear_use_adx': True, 'bear_use_spike': False, 'bear_rsi_required': False, 'sideways_strategy': 'mean_reversion', 'sideways_bb_std_mult': 3.425970213677716, 'sideways_rsi_os': 14, 'sideways_rsi_ob': 91, 'sideways_adx_thresh': 5.958660547973004, 'sideways_atr_min_pct': 0.0035506069818649023, 'sideways_atr_max_pct': 0.13767692436565757, 'sideways_tp_mult': 1.9031285503793511, 'sideways_tsl_mult': 0.15308354532664806, 'sideways_time_stop': 48, 'sideways_use_sma': False, 'sideways_use_ema': False, 'sideways_use_atr': True, 'sideways_use_adx': False, 'sideways_use_spike': True, 'sideways_rsi_required': True}.
[I 2025-09-01 14:22:12,799] Trial 190 finished with values: [-0.00828260372733236, 0.008803543542867399] and parameters: {'p_sma': 11, 'p_std': 24, 'p_atr': 29, 'p_adx': 26, 'rsi_period': 65, 'ema1': 30, 'ema2': 49, 'slip_atr_k': 0.04844885993562147, 'slip_spread_k': 0.2508945836813312, 'spread_hl_frac': 0.014941019381514514, 'bb_std_mult': 1.4653086184552715, 'rsi_os': 36, 'rsi_ob': 71, 'vol_spike': 0.2747602995701892, 'adx_thresh': 19.763483809533223, 'atr_min_pct': 0.013069897724104291, 'atr_max_pct': 0.06920080017608106, 'tp_mult': 2.9724514220743194, 'tsl_mult': 0.06894626952785979, 'strategy': 'breakout', 'time_stop': 64, 'use_sma': False, 'use_atr': True, 'use_adx': True, 'use_ema': False, 'use_spike': True, 'rsi_required': False, 'edge_k': 0.4199409478467916, 'edge_cap': 0.198408955402163, 'bull_strategy': 'breakout', 'bull_bb_std_mult': 1.02757638519059, 'bull_rsi_os': 21, 'bull_rsi_ob': 49, 'bull_adx_thresh': 10.562998251894673, 'bull_atr_min_pct': 0.0023621865007937342, 'bull_atr_max_pct': 0.04808324752076039, 'bull_tp_mult': 2.248176525491735, 'bull_tsl_mult': 0.4154681386567963, 'bull_time_stop': 160, 'bull_use_sma': True, 'bull_use_ema': False, 'bull_use_atr': False, 'bull_use_adx': True, 'bull_use_spike': False, 'bull_rsi_required': True, 'bear_strategy': 'mean_reversion', 'bear_bb_std_mult': 2.8930392715304563, 'bear_rsi_os': 8, 'bear_rsi_ob': 79, 'bear_adx_thresh': 29.359309573841493, 'bear_atr_min_pct': 0.024264107595289946, 'bear_atr_max_pct': 0.10442183271788076, 'bear_tp_mult': 2.5643672406944193, 'bear_tsl_mult': 0.6521873558969635, 'bear_time_stop': 291, 'bear_use_sma': False, 'bear_use_ema': True, 'bear_use_atr': False, 'bear_use_adx': True, 'bear_use_spike': False, 'bear_rsi_required': False, 'sideways_strategy': 'mean_reversion', 'sideways_bb_std_mult': 3.3694111561340905, 'sideways_rsi_os': 17, 'sideways_rsi_ob': 87, 'sideways_adx_thresh': 6.368595731609461, 'sideways_atr_min_pct': 0.005368998531526516, 'sideways_atr_max_pct': 0.13818966453553969, 'sideways_tp_mult': 1.6763626736083228, 'sideways_tsl_mult': 0.28902510789154323, 'sideways_time_stop': 300, 'sideways_use_sma': False, 'sideways_use_ema': True, 'sideways_use_atr': True, 'sideways_use_adx': False, 'sideways_use_spike': True, 'sideways_rsi_required': True}.
[I 2025-09-01 14:22:13,069] Trial 192 finished with values: [-1000000000.0, 1000000000.0] and parameters: {'p_sma': 11, 'p_std': 9, 'p_atr': 20, 'p_adx': 25, 'rsi_period': 71, 'ema1': 30, 'ema2': 54, 'slip_atr_k': 0.08773089370602771, 'slip_spread_k': 0.21839538601206915, 'spread_hl_frac': 0.0148939526222405, 'bb_std_mult': 1.4481257140405421, 'rsi_os': 39, 'rsi_ob': 76, 'vol_spike': 0.28281698756114143, 'adx_thresh': 20.564010238690358, 'atr_min_pct': 0.01566371301196489, 'atr_max_pct': 0.0766011826796031, 'tp_mult': 2.973255771097515, 'tsl_mult': 0.06435259674095818, 'strategy': 'breakout', 'time_stop': 67, 'use_sma': False, 'use_atr': True, 'use_adx': False, 'use_ema': False, 'use_spike': True, 'rsi_required': False, 'edge_k': 0.49459543583653354, 'edge_cap': 0.05097119074287021, 'bull_strategy': 'breakout', 'bull_bb_std_mult': 2.9540661446774603, 'bull_rsi_os': 22, 'bull_rsi_ob': 46, 'bull_adx_thresh': 10.421925531999094, 'bull_atr_min_pct': 0.009012325564327992, 'bull_atr_max_pct': 0.02029473466396533, 'bull_tp_mult': 2.05326395920639, 'bull_tsl_mult': 0.31785958369465883, 'bull_time_stop': 158, 'bull_use_sma': True, 'bull_use_ema': False, 'bull_use_atr': False, 'bull_use_adx': False, 'bull_use_spike': False, 'bull_rsi_required': False, 'bear_strategy': 'mean_reversion', 'bear_bb_std_mult': 2.6633878203628623, 'bear_rsi_os': 8, 'bear_rsi_ob': 79, 'bear_adx_thresh': 29.160257524969982, 'bear_atr_min_pct': 0.024337769603034468, 'bear_atr_max_pct': 0.11549486684151722, 'bear_tp_mult': 2.283496174930344, 'bear_tsl_mult': 0.6318995335661693, 'bear_time_stop': 292, 'bear_use_sma': False, 'bear_use_ema': True, 'bear_use_atr': False, 'bear_use_adx': True, 'bear_use_spike': False, 'bear_rsi_required': False, 'sideways_strategy': 'mean_reversion', 'sideways_bb_std_mult': 3.426637406779221, 'sideways_rsi_os': 12, 'sideways_rsi_ob': 91, 'sideways_adx_thresh': 5.448557083194197, 'sideways_atr_min_pct': 0.0034656612636610076, 'sideways_atr_max_pct': 0.13854211559014556, 'sideways_tp_mult': 1.9314934618617488, 'sideways_tsl_mult': 0.18658073178415138, 'sideways_time_stop': 25, 'sideways_use_sma': False, 'sideways_use_ema': True, 'sideways_use_atr': True, 'sideways_use_adx': False, 'sideways_use_spike': True, 'sideways_rsi_required': True}.
[I 2025-09-01 14:22:13,427] Trial 191 finished with values: [-1000000000.0, 1000000000.0] and parameters: {'p_sma': 11, 'p_std': 8, 'p_atr': 20, 'p_adx': 25, 'rsi_period': 72, 'ema1': 30, 'ema2': 53, 'slip_atr_k': 0.1035672757070557, 'slip_spread_k': 0.23715442813074059, 'spread_hl_frac': 0.015253962010153888, 'bb_std_mult': 1.4498145617621263, 'rsi_os': 38, 'rsi_ob': 76, 'vol_spike': 0.28524014214167037, 'adx_thresh': 20.617106006619753, 'atr_min_pct': 0.015505558469639046, 'atr_max_pct': 0.07697733131772262, 'tp_mult': 2.9964222671242684, 'tsl_mult': 0.06082920898288073, 'strategy': 'breakout', 'time_stop': 67, 'use_sma': False, 'use_atr': True, 'use_adx': False, 'use_ema': False, 'use_spike': True, 'rsi_required': False, 'edge_k': 0.48552460749472903, 'edge_cap': 0.05627481576896048, 'bull_strategy': 'breakout', 'bull_bb_std_mult': 2.876957804678504, 'bull_rsi_os': 22, 'bull_rsi_ob': 46, 'bull_adx_thresh': 9.597372656945941, 'bull_atr_min_pct': 0.008565816866935309, 'bull_atr_max_pct': 0.018974740565910878, 'bull_tp_mult': 2.0410381071041725, 'bull_tsl_mult': 0.3883860920035537, 'bull_time_stop': 267, 'bull_use_sma': True, 'bull_use_ema': False, 'bull_use_atr': False, 'bull_use_adx': True, 'bull_use_spike': False, 'bull_rsi_required': True, 'bear_strategy': 'mean_reversion', 'bear_bb_std_mult': 2.6863396149328165, 'bear_rsi_os': 7, 'bear_rsi_ob': 81, 'bear_adx_thresh': 29.303126056411088, 'bear_atr_min_pct': 0.023829075421087875, 'bear_atr_max_pct': 0.10970912538367004, 'bear_tp_mult': 2.2222513227582468, 'bear_tsl_mult': 0.6380011632791508, 'bear_time_stop': 290, 'bear_use_sma': False, 'bear_use_ema': True, 'bear_use_atr': False, 'bear_use_adx': True, 'bear_use_spike': False, 'bear_rsi_required': False, 'sideways_strategy': 'mean_reversion', 'sideways_bb_std_mult': 3.3801646315318106, 'sideways_rsi_os': 12, 'sideways_rsi_ob': 90, 'sideways_adx_thresh': 6.108809461249345, 'sideways_atr_min_pct': 0.005804772890632237, 'sideways_atr_max_pct': 0.13697424640705158, 'sideways_tp_mult': 1.9336790983546381, 'sideways_tsl_mult': 0.1997362759752055, 'sideways_time_stop': 299, 'sideways_use_sma': False, 'sideways_use_ema': True, 'sideways_use_atr': True, 'sideways_use_adx': False, 'sideways_use_spike': True, 'sideways_rsi_required': True}.
[I 2025-09-01 14:22:49,595] Trial 195 finished with values: [-1000000000.0, 1000000000.0] and parameters: {'p_sma': 11, 'p_std': 5, 'p_atr': 21, 'p_adx': 26, 'rsi_period': 65, 'ema1': 29, 'ema2': 53, 'slip_atr_k': 0.018026805929979454, 'slip_spread_k': 0.19282488593382013, 'spread_hl_frac': 0.014687876854742937, 'bb_std_mult': 1.5765196750202635, 'rsi_os': 38, 'rsi_ob': 75, 'vol_spike': 0.2754750823436225, 'adx_thresh': 19.93967244167778, 'atr_min_pct': 0.016724705193293346, 'atr_max_pct': 0.07850315273828583, 'tp_mult': 2.927262380057006, 'tsl_mult': 0.08764790365995444, 'strategy': 'breakout', 'time_stop': 79, 'use_sma': True, 'use_atr': True, 'use_adx': True, 'use_ema': True, 'use_spike': True, 'rsi_required': False, 'edge_k': 0.43770342675989543, 'edge_cap': 0.08826276476530545, 'bull_strategy': 'breakout', 'bull_bb_std_mult': 2.835327961048621, 'bull_rsi_os': 15, 'bull_rsi_ob': 47, 'bull_adx_thresh': 10.652176655592262, 'bull_atr_min_pct': 0.009891679716300086, 'bull_atr_max_pct': 0.01105090218010633, 'bull_tp_mult': 2.011566475503058, 'bull_tsl_mult': 0.3503914179954577, 'bull_time_stop': 164, 'bull_use_sma': False, 'bull_use_ema': False, 'bull_use_atr': False, 'bull_use_adx': True, 'bull_use_spike': False, 'bull_rsi_required': True, 'bear_strategy': 'mean_reversion', 'bear_bb_std_mult': 2.5182501757570943, 'bear_rsi_os': 8, 'bear_rsi_ob': 78, 'bear_adx_thresh': 28.33737067571374, 'bear_atr_min_pct': 0.025168080375161668, 'bear_atr_max_pct': 0.11761251523685896, 'bear_tp_mult': 2.152560213145987, 'bear_tsl_mult': 0.5767813701005208, 'bear_time_stop': 281, 'bear_use_sma': False, 'bear_use_ema': False, 'bear_use_atr': False, 'bear_use_adx': True, 'bear_use_spike': False, 'bear_rsi_required': False, 'sideways_strategy': 'mean_reversion', 'sideways_bb_std_mult': 3.37644893293864, 'sideways_rsi_os': 15, 'sideways_rsi_ob': 89, 'sideways_adx_thresh': 6.338277588362686, 'sideways_atr_min_pct': 0.005683152520393029, 'sideways_atr_max_pct': 0.14009276022112066, 'sideways_tp_mult': 1.6089329333288072, 'sideways_tsl_mult': 0.29345447409622255, 'sideways_time_stop': 113, 'sideways_use_sma': False, 'sideways_use_ema': False, 'sideways_use_atr': False, 'sideways_use_adx': False, 'sideways_use_spike': True, 'sideways_rsi_required': True}.
[I 2025-09-01 14:22:49,955] Trial 194 finished with values: [-1000000000.0, 1000000000.0] and parameters: {'p_sma': 11, 'p_std': 6, 'p_atr': 20, 'p_adx': 26, 'rsi_period': 67, 'ema1': 29, 'ema2': 53, 'slip_atr_k': 0.07976847684762634, 'slip_spread_k': 0.23737370558409376, 'spread_hl_frac': 0.015196539449440143, 'bb_std_mult': 1.5433792955375831, 'rsi_os': 38, 'rsi_ob': 75, 'vol_spike': 0.2790303143010296, 'adx_thresh': 20.06678239459413, 'atr_min_pct': 0.016678384210813916, 'atr_max_pct': 0.07814260063081784, 'tp_mult': 2.938901226526029, 'tsl_mult': 0.08307450460527238, 'strategy': 'breakout', 'time_stop': 70, 'use_sma': False, 'use_atr': True, 'use_adx': True, 'use_ema': False, 'use_spike': True, 'rsi_required': False, 'edge_k': 0.4390435379527281, 'edge_cap': 0.08211624042625829, 'bull_strategy': 'breakout', 'bull_bb_std_mult': 2.959103228510092, 'bull_rsi_os': 19, 'bull_rsi_ob': 47, 'bull_adx_thresh': 10.403327379412064, 'bull_atr_min_pct': 0.013999990897982435, 'bull_atr_max_pct': 0.021883077708500745, 'bull_tp_mult': 2.0309275140461662, 'bull_tsl_mult': 0.34899946267234966, 'bull_time_stop': 162, 'bull_use_sma': True, 'bull_use_ema': False, 'bull_use_atr': False, 'bull_use_adx': True, 'bull_use_spike': False, 'bull_rsi_required': True, 'bear_strategy': 'mean_reversion', 'bear_bb_std_mult': 2.6314711728840536, 'bear_rsi_os': 8, 'bear_rsi_ob': 79, 'bear_adx_thresh': 26.655559360317028, 'bear_atr_min_pct': 0.024392470370109227, 'bear_atr_max_pct': 0.11535508319312225, 'bear_tp_mult': 2.2192808603227516, 'bear_tsl_mult': 0.5756107057447968, 'bear_time_stop': 290, 'bear_use_sma': False, 'bear_use_ema': False, 'bear_use_atr': False, 'bear_use_adx': True, 'bear_use_spike': False, 'bear_rsi_required': False, 'sideways_strategy': 'mean_reversion', 'sideways_bb_std_mult': 3.3463665842582593, 'sideways_rsi_os': 12, 'sideways_rsi_ob': 90, 'sideways_adx_thresh': 6.007050838383606, 'sideways_atr_min_pct': 0.005539409507937321, 'sideways_atr_max_pct': 0.13818937741431156, 'sideways_tp_mult': 1.9374032134567205, 'sideways_tsl_mult': 0.22690282950338417, 'sideways_time_stop': 64, 'sideways_use_sma': False, 'sideways_use_ema': False, 'sideways_use_atr': True, 'sideways_use_adx': False, 'sideways_use_spike': True, 'sideways_rsi_required': True}.
[I 2025-09-01 14:22:50,247] Trial 196 finished with values: [-1000000000.0, 1000000000.0] and parameters: {'p_sma': 10, 'p_std': 5, 'p_atr': 21, 'p_adx': 26, 'rsi_period': 65, 'ema1': 29, 'ema2': 53, 'slip_atr_k': 0.07592429206045408, 'slip_spread_k': 0.19755183645119526, 'spread_hl_frac': 0.015904888808864346, 'bb_std_mult': 1.6126850477636494, 'rsi_os': 38, 'rsi_ob': 75, 'vol_spike': 0.289736816820941, 'adx_thresh': 20.011024311007148, 'atr_min_pct': 0.016792521214199652, 'atr_max_pct': 0.0692411803373, 'tp_mult': 2.934791352289654, 'tsl_mult': 0.08376441255191613, 'strategy': 'breakout', 'time_stop': 79, 'use_sma': True, 'use_atr': True, 'use_adx': True, 'use_ema': True, 'use_spike': True, 'rsi_required': False, 'edge_k': 0.4599418753983477, 'edge_cap': 0.09889439677923298, 'bull_strategy': 'breakout', 'bull_bb_std_mult': 2.7484582426345705, 'bull_rsi_os': 15, 'bull_rsi_ob': 47, 'bull_adx_thresh': 10.696159708512194, 'bull_atr_min_pct': 0.007094889521876729, 'bull_atr_max_pct': 0.011693849272201483, 'bull_tp_mult': 2.15916226896763, 'bull_tsl_mult': 0.3499725373880918, 'bull_time_stop': 161, 'bull_use_sma': False, 'bull_use_ema': False, 'bull_use_atr': False, 'bull_use_adx': True, 'bull_use_spike': False, 'bull_rsi_required': True, 'bear_strategy': 'mean_reversion', 'bear_bb_std_mult': 2.5134347939432353, 'bear_rsi_os': 8, 'bear_rsi_ob': 79, 'bear_adx_thresh': 26.66152962149608, 'bear_atr_min_pct': 0.025258591148304848, 'bear_atr_max_pct': 0.11138848477214185, 'bear_tp_mult': 1.9236956141252128, 'bear_tsl_mult': 0.582775746275024, 'bear_time_stop': 284, 'bear_use_sma': False, 'bear_use_ema': False, 'bear_use_atr': False, 'bear_use_adx': True, 'bear_use_spike': False, 'bear_rsi_required': False, 'sideways_strategy': 'mean_reversion', 'sideways_bb_std_mult': 3.335461590939585, 'sideways_rsi_os': 13, 'sideways_rsi_ob': 89, 'sideways_adx_thresh': 6.218630356947466, 'sideways_atr_min_pct': 0.005375024488961915, 'sideways_atr_max_pct': 0.14090885980982437, 'sideways_tp_mult': 1.9690282216654722, 'sideways_tsl_mult': 0.28415200788817946, 'sideways_time_stop': 114, 'sideways_use_sma': False, 'sideways_use_ema': False, 'sideways_use_atr': False, 'sideways_use_adx': False, 'sideways_use_spike': True, 'sideways_rsi_required': True}.
[I 2025-09-01 14:22:50,399] Trial 197 finished with values: [-1000000000.0, 1000000000.0] and parameters: {'p_sma': 9, 'p_std': 5, 'p_atr': 21, 'p_adx': 26, 'rsi_period': 65, 'ema1': 29, 'ema2': 51, 'slip_atr_k': 0.08133462446564588, 'slip_spread_k': 0.20111357039500716, 'spread_hl_frac': 0.016188552387725208, 'bb_std_mult': 1.5237602434996405, 'rsi_os': 37, 'rsi_ob': 75, 'vol_spike': 0.2762095558075984, 'adx_thresh': 20.04980038796765, 'atr_min_pct': 0.01491136991239037, 'atr_max_pct': 0.0697244848480324, 'tp_mult': 2.930996496646294, 'tsl_mult': 0.08669268698151289, 'strategy': 'breakout', 'time_stop': 77, 'use_sma': True, 'use_atr': True, 'use_adx': True, 'use_ema': True, 'use_spike': True, 'rsi_required': False, 'edge_k': 0.4190679681688796, 'edge_cap': 0.09705257765086067, 'bull_strategy': 'breakout', 'bull_bb_std_mult': 2.755610242692316, 'bull_rsi_os': 15, 'bull_rsi_ob': 47, 'bull_adx_thresh': 11.07900515539652, 'bull_atr_min_pct': 0.007076946686975166, 'bull_atr_max_pct': 0.02282499688655118, 'bull_tp_mult': 2.154433075519012, 'bull_tsl_mult': 0.3548757175198551, 'bull_time_stop': 164, 'bull_use_sma': False, 'bull_use_ema': False, 'bull_use_atr': False, 'bull_use_adx': True, 'bull_use_spike': False, 'bull_rsi_required': True, 'bear_strategy': 'mean_reversion', 'bear_bb_std_mult': 2.5267916498170213, 'bear_rsi_os': 5, 'bear_rsi_ob': 78, 'bear_adx_thresh': 26.586847835325273, 'bear_atr_min_pct': 0.02517253896338072, 'bear_atr_max_pct': 0.11798370218097103, 'bear_tp_mult': 2.4193593865699494, 'bear_tsl_mult': 0.5636514905322192, 'bear_time_stop': 284, 'bear_use_sma': False, 'bear_use_ema': False, 'bear_use_atr': False, 'bear_use_adx': True, 'bear_use_spike': False, 'bear_rsi_required': False, 'sideways_strategy': 'mean_reversion', 'sideways_bb_std_mult': 3.305306130798523, 'sideways_rsi_os': 15, 'sideways_rsi_ob': 89, 'sideways_adx_thresh': 7.511978559898693, 'sideways_atr_min_pct': 0.005601815940346961, 'sideways_atr_max_pct': 0.12897626943885557, 'sideways_tp_mult': 1.6172443232410014, 'sideways_tsl_mult': 0.3152798868629669, 'sideways_time_stop': 116, 'sideways_use_sma': False, 'sideways_use_ema': False, 'sideways_use_atr': False, 'sideways_use_adx': False, 'sideways_use_spike': True, 'sideways_rsi_required': True}.
