[I 2025-09-01 14:55:09,937] Trial 403 finished with values: [-0.01951353745380835, 0.019285690672952036] and parameters: {'p_sma': 9, 'p_std': 28, 'p_atr': 20, 'p_adx': 20, 'rsi_period': 53, 'ema1': 9, 'ema2': 35, 'slip_atr_k': 0.17397978790248314, 'slip_spread_k': 0.7259535550108277, 'spread_hl_frac': 0.01493519669391, 'bb_std_mult': 2.176497520244664, 'rsi_os': 55, 'rsi_ob': 73, 'vol_spike': 0.1346693110951567, 'adx_thresh': 19.657308461237488, 'atr_min_pct': 0.011239680491322297, 'atr_max_pct': 0.024165080014973563, 'tp_mult': 1.1442799088913458, 'tsl_mult': 0.5688106262516853, 'strategy': 'breakout', 'time_stop': 83, 'use_sma': False, 'use_atr': False, 'use_adx': True, 'use_ema': False, 'use_spike': True, 'rsi_required': True, 'edge_k': 0.5681308986172507, 'edge_cap': 0.6020902132066496, 'bull_strategy': 'breakout', 'bull_bb_std_mult': 2.7265760040278226, 'bull_rsi_os': 39, 'bull_rsi_ob': 48, 'bull_adx_thresh': 9.493421457451097, 'bull_atr_min_pct': 0.0015897405703696505, 'bull_atr_max_pct': 0.015669340467843344, 'bull_tp_mult': 2.0714056832416228, 'bull_tsl_mult': 0.388440850065146, 'bull_time_stop': 159, 'bull_use_sma': True, 'bull_use_ema': False, 'bull_use_atr': True, 'bull_use_adx': True, 'bull_use_spike': False, 'bull_rsi_required': True, 'bear_strategy': 'mean_reversion', 'bear_bb_std_mult': 1.0817083406557007, 'bear_rsi_os': 8, 'bear_rsi_ob': 83, 'bear_adx_thresh': 27.87539118102795, 'bear_atr_min_pct': 0.005003652936319531, 'bear_atr_max_pct': 0.046951155945828806, 'bear_tp_mult': 1.5209105033669092, 'bear_tsl_mult': 0.9511873803761608, 'bear_time_stop': 25, 'bear_use_sma': False, 'bear_use_ema': False, 'bear_use_atr': True, 'bear_use_adx': True, 'bear_use_spike': True, 'bear_rsi_required': False, 'sideways_strategy': 'breakout', 'sideways_bb_std_mult': 3.367957726792679, 'sideways_rsi_os': 14, 'sideways_rsi_ob': 84, 'sideways_adx_thresh': 11.438671532621353, 'sideways_atr_min_pct': 0.023886181333397788, 'sideways_atr_max_pct': 0.12247069894467172, 'sideways_tp_mult': 1.8191100301670475, 'sideways_tsl_mult': 0.3009804909278633, 'sideways_time_stop': 213, 'sideways_use_sma': True, 'sideways_use_ema': False, 'sideways_use_atr': True, 'sideways_use_adx': False, 'sideways_use_spike': True, 'sideways_rsi_required': True}.
[I 2025-09-01 14:55:10,064] Trial 406 finished with values: [-1000000000.0, 1000000000.0] and parameters: {'p_sma': 14, 'p_std': 24, 'p_atr': 20, 'p_adx': 21, 'rsi_period': 7, 'ema1': 29, 'ema2': 30, 'slip_atr_k': 0.12271786410157584, 'slip_spread_k': 0.8901713555571936, 'spread_hl_frac': 0.018897372167789937, 'bb_std_mult': 2.986475535647788, 'rsi_os': 28, 'rsi_ob': 70, 'vol_spike': 0.13477187352784642, 'adx_thresh': 34.322181841479775, 'atr_min_pct': 0.019840004409950495, 'atr_max_pct': 0.04959993895639114, 'tp_mult': 2.833631453963827, 'tsl_mult': 0.5764145731745187, 'strategy': 'breakout', 'time_stop': 213, 'use_sma': False, 'use_atr': False, 'use_adx': False, 'use_ema': False, 'use_spike': False, 'rsi_required': True, 'edge_k': 1.7524483781205045, 'edge_cap': 0.10028075702860649, 'bull_strategy': 'mean_reversion', 'bull_bb_std_mult': 3.2826342644311013, 'bull_rsi_os': 18, 'bull_rsi_ob': 50, 'bull_adx_thresh': 12.192863340454963, 'bull_atr_min_pct': 0.029619187173668342, 'bull_atr_max_pct': 0.015392197973376674, 'bull_tp_mult': 2.015374554090262, 'bull_tsl_mult': 0.9712729541543461, 'bull_time_stop': 155, 'bull_use_sma': True, 'bull_use_ema': False, 'bull_use_atr': True, 'bull_use_adx': False, 'bull_use_spike': True, 'bull_rsi_required': True, 'bear_strategy': 'breakout', 'bear_bb_std_mult': 2.7073570945852463, 'bear_rsi_os': 10, 'bear_rsi_ob': 79, 'bear_adx_thresh': 29.69568275013879, 'bear_atr_min_pct': 0.02036412073167415, 'bear_atr_max_pct': 0.1494840910755468, 'bear_tp_mult': 2.4337717247862445, 'bear_tsl_mult': 0.24306721956215854, 'bear_time_stop': 237, 'bear_use_sma': True, 'bear_use_ema': False, 'bear_use_atr': True, 'bear_use_adx': True, 'bear_use_spike': True, 'bear_rsi_required': True, 'sideways_strategy': 'breakout', 'sideways_bb_std_mult': 3.4170651404964842, 'sideways_rsi_os': 17, 'sideways_rsi_ob': 87, 'sideways_adx_thresh': 11.548666753620086, 'sideways_atr_min_pct': 0.003898271158790044, 'sideways_atr_max_pct': 0.09681326061016592, 'sideways_tp_mult': 1.8108487963677473, 'sideways_tsl_mult': 0.5734170611689827, 'sideways_time_stop': 119, 'sideways_use_sma': True, 'sideways_use_ema': False, 'sideways_use_atr': True, 'sideways_use_adx': False, 'sideways_use_spike': False, 'sideways_rsi_required': True}.
[I 2025-09-01 14:55:57,850] Trial 408 finished with values: [-1000000000.0, 1000000000.0] and parameters: {'p_sma': 11, 'p_std': 37, 'p_atr': 20, 'p_adx': 20, 'rsi_period': 82, 'ema1': 28, 'ema2': 52, 'slip_atr_k': 0.07144065806232133, 'slip_spread_k': 0.7270946093983298, 'spread_hl_frac': 0.015094761245495683, 'bb_std_mult': 1.3942529947078703, 'rsi_os': 51, 'rsi_ob': 76, 'vol_spike': 0.2826108726877641, 'adx_thresh': 20.781649695784044, 'atr_min_pct': 0.014962955292564957, 'atr_max_pct': 0.024317897335908556, 'tp_mult': 1.1495811451934816, 'tsl_mult': 0.0848655211071927, 'strategy': 'breakout', 'time_stop': 229, 'use_sma': False, 'use_atr': True, 'use_adx': True, 'use_ema': False, 'use_spike': True, 'rsi_required': False, 'edge_k': 0.5993352370351807, 'edge_cap': 0.07947345305790945, 'bull_strategy': 'mean_reversion', 'bull_bb_std_mult': 2.099214909436212, 'bull_rsi_os': 20, 'bull_rsi_ob': 94, 'bull_adx_thresh': 8.493929778283933, 'bull_atr_min_pct': 0.012297834487467858, 'bull_atr_max_pct': 0.019689455452894907, 'bull_tp_mult': 2.0368427633646258, 'bull_tsl_mult': 0.4596783998480835, 'bull_time_stop': 139, 'bull_use_sma': True, 'bull_use_ema': False, 'bull_use_atr': False, 'bull_use_adx': True, 'bull_use_spike': False, 'bull_rsi_required': True, 'bear_strategy': 'mean_reversion', 'bear_bb_std_mult': 2.7006033526143254, 'bear_rsi_os': 10, 'bear_rsi_ob': 87, 'bear_adx_thresh': 33.482995881164044, 'bear_atr_min_pct': 0.026113398782259194, 'bear_atr_max_pct': 0.11728037255940409, 'bear_tp_mult': 1.7388106283372187, 'bear_tsl_mult': 0.02014756274491125, 'bear_time_stop': 291, 'bear_use_sma': False, 'bear_use_ema': False, 'bear_use_atr': False, 'bear_use_adx': True, 'bear_use_spike': False, 'bear_rsi_required': False, 'sideways_strategy': 'mean_reversion', 'sideways_bb_std_mult': 1.101341827911885, 'sideways_rsi_os': 16, 'sideways_rsi_ob': 90, 'sideways_adx_thresh': 32.437646281147984, 'sideways_atr_min_pct': 0.019766680321516045, 'sideways_atr_max_pct': 0.12229868739062945, 'sideways_tp_mult': 2.9066666586989314, 'sideways_tsl_mult': 0.22903102705104456, 'sideways_time_stop': 118, 'sideways_use_sma': False, 'sideways_use_ema': True, 'sideways_use_atr': True, 'sideways_use_adx': True, 'sideways_use_spike': True, 'sideways_rsi_required': False}.
[I 2025-09-01 14:55:57,879] Trial 409 finished with values: [-1000000000.0, 1000000000.0] and parameters: {'p_sma': 11, 'p_std': 12, 'p_atr': 29, 'p_adx': 10, 'rsi_period': 68, 'ema1': 28, 'ema2': 16, 'slip_atr_k': 0.053561586602741074, 'slip_spread_k': 0.6099882771819067, 'spread_hl_frac': 0.01564707583751892, 'bb_std_mult': 1.4065098867424155, 'rsi_os': 35, 'rsi_ob': 75, 'vol_spike': 0.28403113104903266, 'adx_thresh': 13.529761457291348, 'atr_min_pct': 0.013947428651223656, 'atr_max_pct': 0.07932907938215371, 'tp_mult': 2.9013168050206115, 'tsl_mult': 0.05663502648375117, 'strategy': 'breakout', 'time_stop': 250, 'use_sma': True, 'use_atr': True, 'use_adx': True, 'use_ema': True, 'use_spike': True, 'rsi_required': False, 'edge_k': 1.2989759239398855, 'edge_cap': 0.9514346756379111, 'bull_strategy': 'mean_reversion', 'bull_bb_std_mult': 2.8141528608569164, 'bull_rsi_os': 24, 'bull_rsi_ob': 49, 'bull_adx_thresh': 23.747268558378373, 'bull_atr_min_pct': 0.013931526690018537, 'bull_atr_max_pct': 0.020116957702484506, 'bull_tp_mult': 2.9996242198306944, 'bull_tsl_mult': 0.4585815124871892, 'bull_time_stop': 141, 'bull_use_sma': False, 'bull_use_ema': True, 'bull_use_atr': False, 'bull_use_adx': True, 'bull_use_spike': False, 'bull_rsi_required': False, 'bear_strategy': 'mean_reversion', 'bear_bb_std_mult': 2.7542824195867515, 'bear_rsi_os': 34, 'bear_rsi_ob': 76, 'bear_adx_thresh': 19.112930366456645, 'bear_atr_min_pct': 0.0041034255896878116, 'bear_atr_max_pct': 0.1264839124740539, 'bear_tp_mult': 1.1119194062974493, 'bear_tsl_mult': 0.6698130502304309, 'bear_time_stop': 288, 'bear_use_sma': False, 'bear_use_ema': True, 'bear_use_atr': False, 'bear_use_adx': False, 'bear_use_spike': False, 'bear_rsi_required': False, 'sideways_strategy': 'mean_reversion', 'sideways_bb_std_mult': 3.476330733391548, 'sideways_rsi_os': 16, 'sideways_rsi_ob': 90, 'sideways_adx_thresh': 6.110355263113295, 'sideways_atr_min_pct': 0.006876475858542952, 'sideways_atr_max_pct': 0.08666918247581892, 'sideways_tp_mult': 2.826635750892555, 'sideways_tsl_mult': 0.1337855251906388, 'sideways_time_stop': 196, 'sideways_use_sma': False, 'sideways_use_ema': True, 'sideways_use_atr': True, 'sideways_use_adx': True, 'sideways_use_spike': True, 'sideways_rsi_required': False}.
[I 2025-09-01 14:55:58,155] Trial 407 finished with values: [-1000000000.0, 1000000000.0] and parameters: {'p_sma': 11, 'p_std': 12, 'p_atr': 20, 'p_adx': 29, 'rsi_period': 68, 'ema1': 28, 'ema2': 52, 'slip_atr_k': 0.07207551953201644, 'slip_spread_k': 0.891737980151086, 'spread_hl_frac': 0.014842469893096476, 'bb_std_mult': 1.4035935458066513, 'rsi_os': 8, 'rsi_ob': 76, 'vol_spike': 0.2794411816702474, 'adx_thresh': 34.97595500492599, 'atr_min_pct': 0.011066019450320744, 'atr_max_pct': 0.07881313988038499, 'tp_mult': 2.9036662661112373, 'tsl_mult': 0.08808418233722519, 'strategy': 'breakout', 'time_stop': 229, 'use_sma': False, 'use_atr': True, 'use_adx': True, 'use_ema': False, 'use_spike': True, 'rsi_required': False, 'edge_k': 0.14245906798493901, 'edge_cap': 0.07776592250867383, 'bull_strategy': 'mean_reversion', 'bull_bb_std_mult': 1.942021248396286, 'bull_rsi_os': 14, 'bull_rsi_ob': 49, 'bull_adx_thresh': 10.283845537853367, 'bull_atr_min_pct': 0.025601927204967852, 'bull_atr_max_pct': 0.020270762719242073, 'bull_tp_mult': 2.3603861226229426, 'bull_tsl_mult': 0.4573299494274533, 'bull_time_stop': 226, 'bull_use_sma': True, 'bull_use_ema': False, 'bull_use_atr': False, 'bull_use_adx': True, 'bull_use_spike': False, 'bull_rsi_required': True, 'bear_strategy': 'mean_reversion', 'bear_bb_std_mult': 2.722654771308669, 'bear_rsi_os': 34, 'bear_rsi_ob': 49, 'bear_adx_thresh': 33.5564907392649, 'bear_atr_min_pct': 0.011607395208669493, 'bear_atr_max_pct': 0.11581396199548924, 'bear_tp_mult': 2.4407457272277218, 'bear_tsl_mult': 0.031203307299113414, 'bear_time_stop': 238, 'bear_use_sma': False, 'bear_use_ema': False, 'bear_use_atr': False, 'bear_use_adx': True, 'bear_use_spike': False, 'bear_rsi_required': False, 'sideways_strategy': 'mean_reversion', 'sideways_bb_std_mult': 3.4960741796969943, 'sideways_rsi_os': 13, 'sideways_rsi_ob': 65, 'sideways_adx_thresh': 10.600549612171339, 'sideways_atr_min_pct': 0.019811797913488187, 'sideways_atr_max_pct': 0.12230356643771033, 'sideways_tp_mult': 1.8129201656451952, 'sideways_tsl_mult': 0.5771873418179572, 'sideways_time_stop': 118, 'sideways_use_sma': False, 'sideways_use_ema': True, 'sideways_use_atr': True, 'sideways_use_adx': True, 'sideways_use_spike': True, 'sideways_rsi_required': False}.
[I 2025-09-01 14:55:58,859] Trial 410 finished with values: [-1000000000.0, 1000000000.0] and parameters: {'p_sma': 11, 'p_std': 34, 'p_atr': 29, 'p_adx': 29, 'rsi_period': 68, 'ema1': 27, 'ema2': 52, 'slip_atr_k': 7.741386890934565e-05, 'slip_spread_k': 0.6110809207795549, 'spread_hl_frac': 0.033402801944241126, 'bb_std_mult': 1.4065393897296397, 'rsi_os': 8, 'rsi_ob': 79, 'vol_spike': 0.08240455879399643, 'adx_thresh': 9.510675938805344, 'atr_min_pct': 0.014261949017269708, 'atr_max_pct': 0.1279329130420941, 'tp_mult': 1.0463112108802732, 'tsl_mult': 0.17943763479153307, 'strategy': 'breakout', 'time_stop': 60, 'use_sma': True, 'use_atr': True, 'use_adx': True, 'use_ema': True, 'use_spike': True, 'rsi_required': False, 'edge_k': 1.059615307652563, 'edge_cap': 0.07487600341649042, 'bull_strategy': 'mean_reversion', 'bull_bb_std_mult': 1.9306162460493543, 'bull_rsi_os': 20, 'bull_rsi_ob': 49, 'bull_adx_thresh': 8.655930734126665, 'bull_atr_min_pct': 0.025338286134401637, 'bull_atr_max_pct': 0.01926392258457597, 'bull_tp_mult': 2.135875623082635, 'bull_tsl_mult': 0.4593112895831322, 'bull_time_stop': 141, 'bull_use_sma': False, 'bull_use_ema': True, 'bull_use_atr': False, 'bull_use_adx': True, 'bull_use_spike': False, 'bull_rsi_required': False, 'bear_strategy': 'mean_reversion', 'bear_bb_std_mult': 3.020968728885101, 'bear_rsi_os': 36, 'bear_rsi_ob': 76, 'bear_adx_thresh': 5.591952573191833, 'bear_atr_min_pct': 0.01262613156064794, 'bear_atr_max_pct': 0.11770487402282898, 'bear_tp_mult': 1.1179187474892487, 'bear_tsl_mult': 0.6671884520929632, 'bear_time_stop': 291, 'bear_use_sma': False, 'bear_use_ema': True, 'bear_use_atr': False, 'bear_use_adx': False, 'bear_use_spike': False, 'bear_rsi_required': False, 'sideways_strategy': 'mean_reversion', 'sideways_bb_std_mult': 3.24012754543759, 'sideways_rsi_os': 12, 'sideways_rsi_ob': 65, 'sideways_adx_thresh': 6.286686372247925, 'sideways_atr_min_pct': 0.006311477301748428, 'sideways_atr_max_pct': 0.13405211600111064, 'sideways_tp_mult': 1.7595629171653697, 'sideways_tsl_mult': 0.9074865919410344, 'sideways_time_stop': 200, 'sideways_use_sma': False, 'sideways_use_ema': True, 'sideways_use_atr': True, 'sideways_use_adx': True, 'sideways_use_spike': True, 'sideways_rsi_required': False}.
[I 2025-09-01 14:56:43,651] Trial 411 finished with values: [-1000000000.0, 1000000000.0] and parameters: {'p_sma': 25, 'p_std': 40, 'p_atr': 19, 'p_adx': 29, 'rsi_period': 63, 'ema1': 14, 'ema2': 48, 'slip_atr_k': 0.04792593442538794, 'slip_spread_k': 0.5581140198304533, 'spread_hl_frac': 0.032993475074646866, 'bb_std_mult': 1.5328089819386852, 'rsi_os': 41, 'rsi_ob': 79, 'vol_spike': 0.28920195475295696, 'adx_thresh': 21.273185227601694, 'atr_min_pct': 0.017037898109432053, 'atr_max_pct': 0.12707581152588376, 'tp_mult': 1.4703106223303983, 'tsl_mult': 0.027981212351483452, 'strategy': 'mean_reversion', 'time_stop': 268, 'use_sma': False, 'use_atr': True, 'use_adx': True, 'use_ema': True, 'use_spike': True, 'rsi_required': False, 'edge_k': 0.7401720559996686, 'edge_cap': 0.6849761838643705, 'bull_strategy': 'breakout', 'bull_bb_std_mult': 2.615507315762446, 'bull_rsi_os': 52, 'bull_rsi_ob': 50, 'bull_adx_thresh': 10.8240950992126, 'bull_atr_min_pct': 0.005452102101746655, 'bull_atr_max_pct': 0.05415228148366689, 'bull_tp_mult': 2.1302177122810666, 'bull_tsl_mult': 0.35782459813430306, 'bull_time_stop': 168, 'bull_use_sma': True, 'bull_use_ema': False, 'bull_use_atr': False, 'bull_use_adx': True, 'bull_use_spike': False, 'bull_rsi_required': False, 'bear_strategy': 'mean_reversion', 'bear_bb_std_mult': 2.8264019640427076, 'bear_rsi_os': 7, 'bear_rsi_ob': 78, 'bear_adx_thresh': 28.32565567315151, 'bear_atr_min_pct': 0.022235303116598333, 'bear_atr_max_pct': 0.11160246163343354, 'bear_tp_mult': 2.379386490709383, 'bear_tsl_mult': 0.5531834998791699, 'bear_time_stop': 283, 'bear_use_sma': False, 'bear_use_ema': True, 'bear_use_atr': False, 'bear_use_adx': False, 'bear_use_spike': False, 'bear_rsi_required': False, 'sideways_strategy': 'mean_reversion', 'sideways_bb_std_mult': 3.2714451595273877, 'sideways_rsi_os': 11, 'sideways_rsi_ob': 88, 'sideways_adx_thresh': 7.511252438049271, 'sideways_atr_min_pct': 0.006182445735489522, 'sideways_atr_max_pct': 0.018621713370055235, 'sideways_tp_mult': 1.1939294149003359, 'sideways_tsl_mult': 0.255086174525404, 'sideways_time_stop': 110, 'sideways_use_sma': False, 'sideways_use_ema': False, 'sideways_use_atr': True, 'sideways_use_adx': False, 'sideways_use_spike': True, 'sideways_rsi_required': True}.
[I 2025-09-01 14:56:44,474] Trial 412 finished with values: [-0.018791979721985985, 0.018624827069777805] and parameters: {'p_sma': 52, 'p_std': 33, 'p_atr': 19, 'p_adx': 29, 'rsi_period': 63, 'ema1': 27, 'ema2': 53, 'slip_atr_k': 0.19371177279482626, 'slip_spread_k': 0.29149848915635185, 'spread_hl_frac': 0.010264233876380289, 'bb_std_mult': 1.585630819807942, 'rsi_os': 41, 'rsi_ob': 86, 'vol_spike': 0.14980195569104546, 'adx_thresh': 21.1766493850964, 'atr_min_pct': 0.016991838832196928, 'atr_max_pct': 0.07296325113615197, 'tp_mult': 2.9965960850737634, 'tsl_mult': 0.18283722688713627, 'strategy': 'mean_reversion', 'time_stop': 58, 'use_sma': False, 'use_atr': True, 'use_adx': True, 'use_ema': True, 'use_spike': True, 'rsi_required': False, 'edge_k': 1.0434304092770714, 'edge_cap': 0.3488388090475962, 'bull_strategy': 'breakout', 'bull_bb_std_mult': 2.999963544950711, 'bull_rsi_os': 34, 'bull_rsi_ob': 50, 'bull_adx_thresh': 10.690262862291108, 'bull_atr_min_pct': 0.003711781788898147, 'bull_atr_max_pct': 0.07775563185768254, 'bull_tp_mult': 1.0104384403531872, 'bull_tsl_mult': 0.3560471496753207, 'bull_time_stop': 54, 'bull_use_sma': True, 'bull_use_ema': False, 'bull_use_atr': False, 'bull_use_adx': True, 'bull_use_spike': False, 'bull_rsi_required': False, 'bear_strategy': 'mean_reversion', 'bear_bb_std_mult': 3.00707428425572, 'bear_rsi_os': 36, 'bear_rsi_ob': 78, 'bear_adx_thresh': 5.57949397444723, 'bear_atr_min_pct': 0.02205355206037342, 'bear_atr_max_pct': 0.11137385876079692, 'bear_tp_mult': 1.4017532986185395, 'bear_tsl_mult': 0.5941519974385397, 'bear_time_stop': 286, 'bear_use_sma': False, 'bear_use_ema': True, 'bear_use_atr': False, 'bear_use_adx': False, 'bear_use_spike': False, 'bear_rsi_required': False, 'sideways_strategy': 'mean_reversion', 'sideways_bb_std_mult': 3.2541412655646234, 'sideways_rsi_os': 52, 'sideways_rsi_ob': 67, 'sideways_adx_thresh': 18.494690443791704, 'sideways_atr_min_pct': 0.017807980840630632, 'sideways_atr_max_pct': 0.07321918584549539, 'sideways_tp_mult': 1.7451737398979297, 'sideways_tsl_mult': 0.2680262882153478, 'sideways_time_stop': 109, 'sideways_use_sma': False, 'sideways_use_ema': False, 'sideways_use_atr': True, 'sideways_use_adx': False, 'sideways_use_spike': True, 'sideways_rsi_required': True}.
[I 2025-09-01 14:56:45,350] Trial 413 finished with values: [-1000000000.0, 1000000000.0] and parameters: {'p_sma': 12, 'p_std': 32, 'p_atr': 19, 'p_adx': 28, 'rsi_period': 32, 'ema1': 27, 'ema2': 38, 'slip_atr_k': 0.21430042458643228, 'slip_spread_k': 0.5545741518693955, 'spread_hl_frac': 0.010192240392396842, 'bb_std_mult': 1.5113471157306777, 'rsi_os': 40, 'rsi_ob': 71, 'vol_spike': 0.017808901643027397, 'adx_thresh': 19.10388819742368, 'atr_min_pct': 0.016915176144989084, 'atr_max_pct': 0.0738293430959364, 'tp_mult': 2.992524420097993, 'tsl_mult': 0.031267365532649194, 'strategy': 'mean_reversion', 'time_stop': 176, 'use_sma': False, 'use_atr': True, 'use_adx': True, 'use_ema': True, 'use_spike': True, 'rsi_required': False, 'edge_k': 0.7736150053121924, 'edge_cap': 0.3563077902158736, 'bull_strategy': 'breakout', 'bull_bb_std_mult': 3.0760984235098907, 'bull_rsi_os': 52, 'bull_rsi_ob': 50, 'bull_adx_thresh': 10.76623417324497, 'bull_atr_min_pct': 0.007343987925603817, 'bull_atr_max_pct': 0.10160777968290159, 'bull_tp_mult': 2.3104882456288784, 'bull_tsl_mult': 0.2920407340816122, 'bull_time_stop': 274, 'bull_use_sma': True, 'bull_use_ema': False, 'bull_use_atr': False, 'bull_use_adx': True, 'bull_use_spike': False, 'bull_rsi_required': False, 'bear_strategy': 'mean_reversion', 'bear_bb_std_mult': 0.6617989561089128, 'bear_rsi_os': 7, 'bear_rsi_ob': 65, 'bear_adx_thresh': 6.759472158195779, 'bear_atr_min_pct': 0.0173368673389031, 'bear_atr_max_pct': 0.11164131486938707, 'bear_tp_mult': 2.552368571478038, 'bear_tsl_mult': 0.5555626139042859, 'bear_time_stop': 119, 'bear_use_sma': False, 'bear_use_ema': True, 'bear_use_atr': False, 'bear_use_adx': False, 'bear_use_spike': False, 'bear_rsi_required': False, 'sideways_strategy': 'mean_reversion', 'sideways_bb_std_mult': 3.2630747355988174, 'sideways_rsi_os': 55, 'sideways_rsi_ob': 88, 'sideways_adx_thresh': 18.541985583562802, 'sideways_atr_min_pct': 0.006180736508660539, 'sideways_atr_max_pct': 0.01787183779976901, 'sideways_tp_mult': 1.7322487674237141, 'sideways_tsl_mult': 0.9033763261183434, 'sideways_time_stop': 105, 'sideways_use_sma': False, 'sideways_use_ema': False, 'sideways_use_atr': True, 'sideways_use_adx': False, 'sideways_use_spike': True, 'sideways_rsi_required': True}.
