[I 2025-09-01 14:43:56,669] Trial 331 finished with values: [-1000000000.0, 1000000000.0] and parameters: {'p_sma': 34, 'p_std': 30, 'p_atr': 12, 'p_adx': 25, 'rsi_period': 69, 'ema1': 14, 'ema2': 51, 'slip_atr_k': 0.04930611885945323, 'slip_spread_k': 0.8488187932565456, 'spread_hl_frac': 0.013363893500731399, 'bb_std_mult': 1.7303251464333762, 'rsi_os': 33, 'rsi_ob': 83, 'vol_spike': 0.2937938440571689, 'adx_thresh': 27.917470267576416, 'atr_min_pct': 0.016450177869763195, 'atr_max_pct': 0.13726927947835557, 'tp_mult': 2.9336143613353065, 'tsl_mult': 0.06282305249012554, 'strategy': 'mean_reversion', 'time_stop': 33, 'use_sma': True, 'use_atr': True, 'use_adx': True, 'use_ema': False, 'use_spike': True, 'rsi_required': False, 'edge_k': 0.550546930928362, 'edge_cap': 0.12039423521308157, 'bull_strategy': 'breakout', 'bull_bb_std_mult': 2.9008916379831464, 'bull_rsi_os': 38, 'bull_rsi_ob': 52, 'bull_adx_thresh': 8.881285617840158, 'bull_atr_min_pct': 0.019919927889211785, 'bull_atr_max_pct': 0.06388982885917077, 'bull_tp_mult': 1.8585954250202108, 'bull_tsl_mult': 0.23663149330054756, 'bull_time_stop': 296, 'bull_use_sma': True, 'bull_use_ema': False, 'bull_use_atr': False, 'bull_use_adx': False, 'bull_use_spike': False, 'bull_rsi_required': True, 'bear_strategy': 'breakout', 'bear_bb_std_mult': 2.626428151535798, 'bear_rsi_os': 8, 'bear_rsi_ob': 75, 'bear_adx_thresh': 20.264296345355895, 'bear_atr_min_pct': 0.023463409370025685, 'bear_atr_max_pct': 0.1003440703957917, 'bear_tp_mult': 2.5272092151817676, 'bear_tsl_mult': 0.6099334374969317, 'bear_time_stop': 5, 'bear_use_sma': True, 'bear_use_ema': False, 'bear_use_atr': False, 'bear_use_adx': True, 'bear_use_spike': False, 'bear_rsi_required': True, 'sideways_strategy': 'mean_reversion', 'sideways_bb_std_mult': 1.3999334103971837, 'sideways_rsi_os': 13, 'sideways_rsi_ob': 87, 'sideways_adx_thresh': 34.53792734336012, 'sideways_atr_min_pct': 0.0041756440844570135, 'sideways_atr_max_pct': 0.14278078096029578, 'sideways_tp_mult': 1.698124410635962, 'sideways_tsl_mult': 0.8493807763169735, 'sideways_time_stop': 169, 'sideways_use_sma': False, 'sideways_use_ema': False, 'sideways_use_atr': False, 'sideways_use_adx': True, 'sideways_use_spike': False, 'sideways_rsi_required': False}.
[I 2025-09-01 14:43:57,290] Trial 330 finished with values: [-1000000000.0, 1000000000.0] and parameters: {'p_sma': 19, 'p_std': 6, 'p_atr': 12, 'p_adx': 15, 'rsi_period': 65, 'ema1': 29, 'ema2': 51, 'slip_atr_k': 0.1357974903779779, 'slip_spread_k': 0.1864213178855155, 'spread_hl_frac': 0.013438156258542755, 'bb_std_mult': 3.246552643099866, 'rsi_os': 34, 'rsi_ob': 83, 'vol_spike': 0.29942772427049097, 'adx_thresh': 19.823401344427676, 'atr_min_pct': 0.014726932939703055, 'atr_max_pct': 0.02417773279515134, 'tp_mult': 2.935771606659424, 'tsl_mult': 0.06749769969549191, 'strategy': 'mean_reversion', 'time_stop': 210, 'use_sma': True, 'use_atr': True, 'use_adx': True, 'use_ema': False, 'use_spike': True, 'rsi_required': False, 'edge_k': 0.1999230715681598, 'edge_cap': 0.08555608950065091, 'bull_strategy': 'breakout', 'bull_bb_std_mult': 3.0242227432298088, 'bull_rsi_os': 18, 'bull_rsi_ob': 86, 'bull_adx_thresh': 9.93824487559375, 'bull_atr_min_pct': 0.007326937848911407, 'bull_atr_max_pct': 0.10924696848207377, 'bull_tp_mult': 1.8738033351683006, 'bull_tsl_mult': 0.19074760934000767, 'bull_time_stop': 30, 'bull_use_sma': True, 'bull_use_ema': False, 'bull_use_atr': False, 'bull_use_adx': False, 'bull_use_spike': False, 'bull_rsi_required': True, 'bear_strategy': 'breakout', 'bear_bb_std_mult': 2.6346314802404955, 'bear_rsi_os': 8, 'bear_rsi_ob': 75, 'bear_adx_thresh': 26.979058177981702, 'bear_atr_min_pct': 0.02357813213403202, 'bear_atr_max_pct': 0.07132892613792338, 'bear_tp_mult': 2.533424660148903, 'bear_tsl_mult': 0.5499467466787493, 'bear_time_stop': 290, 'bear_use_sma': True, 'bear_use_ema': False, 'bear_use_atr': False, 'bear_use_adx': True, 'bear_use_spike': False, 'bear_rsi_required': True, 'sideways_strategy': 'mean_reversion', 'sideways_bb_std_mult': 2.294127642352013, 'sideways_rsi_os': 13, 'sideways_rsi_ob': 87, 'sideways_adx_thresh': 6.267225050092337, 'sideways_atr_min_pct': 0.0042068520084666584, 'sideways_atr_max_pct': 0.14209655009760858, 'sideways_tp_mult': 1.798782489607734, 'sideways_tsl_mult': 0.2871815697429998, 'sideways_time_stop': 254, 'sideways_use_sma': False, 'sideways_use_ema': False, 'sideways_use_atr': False, 'sideways_use_adx': True, 'sideways_use_spike': False, 'sideways_rsi_required': False}.
[I 2025-09-01 14:43:58,274] Trial 335 finished with values: [-1000000000.0, 1000000000.0] and parameters: {'p_sma': 9, 'p_std': 23, 'p_atr': 12, 'p_adx': 26, 'rsi_period': 62, 'ema1': 8, 'ema2': 53, 'slip_atr_k': 0.06258720861876979, 'slip_spread_k': 0.030216006682892482, 'spread_hl_frac': 0.044305280003248765, 'bb_std_mult': 1.56229369890749, 'rsi_os': 34, 'rsi_ob': 74, 'vol_spike': 0.2944158749617712, 'adx_thresh': 31.2393620618912, 'atr_min_pct': 0.0005347005767261642, 'atr_max_pct': 0.1392212186180171, 'tp_mult': 2.9464562880931857, 'tsl_mult': 0.5865449327299508, 'strategy': 'breakout', 'time_stop': 171, 'use_sma': False, 'use_atr': True, 'use_adx': True, 'use_ema': False, 'use_spike': True, 'rsi_required': False, 'edge_k': 0.5434473525484413, 'edge_cap': 0.12253324253341602, 'bull_strategy': 'breakout', 'bull_bb_std_mult': 1.466418511012853, 'bull_rsi_os': 17, 'bull_rsi_ob': 51, 'bull_adx_thresh': 11.849910043996507, 'bull_atr_min_pct': 0.028928906447262877, 'bull_atr_max_pct': 0.10920190286870401, 'bull_tp_mult': 2.1647733359653807, 'bull_tsl_mult': 0.36178931733077024, 'bull_time_stop': 172, 'bull_use_sma': True, 'bull_use_ema': False, 'bull_use_atr': False, 'bull_use_adx': False, 'bull_use_spike': False, 'bull_rsi_required': True, 'bear_strategy': 'mean_reversion', 'bear_bb_std_mult': 2.7648313085580036, 'bear_rsi_os': 40, 'bear_rsi_ob': 76, 'bear_adx_thresh': 31.570643936281535, 'bear_atr_min_pct': 0.024467014616830696, 'bear_atr_max_pct': 0.10112800039158942, 'bear_tp_mult': 1.3611982315073383, 'bear_tsl_mult': 0.6446946380231922, 'bear_time_stop': 265, 'bear_use_sma': True, 'bear_use_ema': False, 'bear_use_atr': False, 'bear_use_adx': True, 'bear_use_spike': False, 'bear_rsi_required': False, 'sideways_strategy': 'mean_reversion', 'sideways_bb_std_mult': 3.4406955434685704, 'sideways_rsi_os': 12, 'sideways_rsi_ob': 87, 'sideways_adx_thresh': 6.214415833198515, 'sideways_atr_min_pct': 0.004267406958043353, 'sideways_atr_max_pct': 0.13998448001746824, 'sideways_tp_mult': 1.626105520687968, 'sideways_tsl_mult': 0.24886077190270905, 'sideways_time_stop': 252, 'sideways_use_sma': False, 'sideways_use_ema': False, 'sideways_use_atr': False, 'sideways_use_adx': False, 'sideways_use_spike': True, 'sideways_rsi_required': True}.
[I 2025-09-01 14:44:35,365] Trial 336 finished with values: [-1000000000.0, 1000000000.0] and parameters: {'p_sma': 19, 'p_std': 6, 'p_atr': 20, 'p_adx': 26, 'rsi_period': 62, 'ema1': 30, 'ema2': 29, 'slip_atr_k': 0.17903614651807936, 'slip_spread_k': 0.27815987777752477, 'spread_hl_frac': 0.015240023267314468, 'bb_std_mult': 1.5830384739515788, 'rsi_os': 38, 'rsi_ob': 94, 'vol_spike': 0.2990155144071865, 'adx_thresh': 19.021441586634353, 'atr_min_pct': 0.01646424764087492, 'atr_max_pct': 0.08059327156221932, 'tp_mult': 1.5053617011235134, 'tsl_mult': 0.0537126978422468, 'strategy': 'breakout', 'time_stop': 72, 'use_sma': False, 'use_atr': True, 'use_adx': False, 'use_ema': False, 'use_spike': True, 'rsi_required': False, 'edge_k': 0.19879242877390113, 'edge_cap': 0.12335083689146364, 'bull_strategy': 'mean_reversion', 'bull_bb_std_mult': 1.9237370947371006, 'bull_rsi_os': 5, 'bull_rsi_ob': 51, 'bull_adx_thresh': 11.952026686424409, 'bull_atr_min_pct': 0.008248727718663963, 'bull_atr_max_pct': 0.012685776821283154, 'bull_tp_mult': 2.5218186815961925, 'bull_tsl_mult': 0.7697600326169568, 'bull_time_stop': 173, 'bull_use_sma': False, 'bull_use_ema': True, 'bull_use_atr': True, 'bull_use_adx': True, 'bull_use_spike': False, 'bull_rsi_required': False, 'bear_strategy': 'mean_reversion', 'bear_bb_std_mult': 2.7714972651313157, 'bear_rsi_os': 6, 'bear_rsi_ob': 75, 'bear_adx_thresh': 32.9111134751503, 'bear_atr_min_pct': 0.005286951188013828, 'bear_atr_max_pct': 0.10091186178603924, 'bear_tp_mult': 1.4001752382540027, 'bear_tsl_mult': 0.7474025072474603, 'bear_time_stop': 266, 'bear_use_sma': False, 'bear_use_ema': False, 'bear_use_atr': True, 'bear_use_adx': False, 'bear_use_spike': False, 'bear_rsi_required': False, 'sideways_strategy': 'mean_reversion', 'sideways_bb_std_mult': 3.446337232953404, 'sideways_rsi_os': 17, 'sideways_rsi_ob': 89, 'sideways_adx_thresh': 6.534684923690727, 'sideways_atr_min_pct': 0.014504494888302907, 'sideways_atr_max_pct': 0.1414599029856518, 'sideways_tp_mult': 2.929828651492182, 'sideways_tsl_mult': 0.1316700662025732, 'sideways_time_stop': 53, 'sideways_use_sma': False, 'sideways_use_ema': False, 'sideways_use_atr': True, 'sideways_use_adx': False, 'sideways_use_spike': True, 'sideways_rsi_required': True}.
[I 2025-09-01 14:44:36,613] Trial 338 finished with values: [-1000000000.0, 1000000000.0] and parameters: {'p_sma': 58, 'p_std': 11, 'p_atr': 20, 'p_adx': 8, 'rsi_period': 13, 'ema1': 23, 'ema2': 53, 'slip_atr_k': 0.061329359562506194, 'slip_spread_k': 0.9965359064277235, 'spread_hl_frac': 0.015206076003658597, 'bb_std_mult': 1.5559107184346883, 'rsi_os': 38, 'rsi_ob': 76, 'vol_spike': 0.2836559846945627, 'adx_thresh': 25.37478046960296, 'atr_min_pct': 0.01649657876443816, 'atr_max_pct': 0.08151996613268446, 'tp_mult': 2.8620066441637158, 'tsl_mult': 0.030139583524397953, 'strategy': 'breakout', 'time_stop': 169, 'use_sma': False, 'use_atr': True, 'use_adx': False, 'use_ema': True, 'use_spike': True, 'rsi_required': False, 'edge_k': 0.47182704400814107, 'edge_cap': 0.22116094953035964, 'bull_strategy': 'mean_reversion', 'bull_bb_std_mult': 2.7132335047151703, 'bull_rsi_os': 15, 'bull_rsi_ob': 48, 'bull_adx_thresh': 23.66356966608258, 'bull_atr_min_pct': 0.008370107540914915, 'bull_atr_max_pct': 0.013035031349677775, 'bull_tp_mult': 2.4441063591631393, 'bull_tsl_mult': 0.5852743170351631, 'bull_time_stop': 171, 'bull_use_sma': False, 'bull_use_ema': True, 'bull_use_atr': True, 'bull_use_adx': True, 'bull_use_spike': False, 'bull_rsi_required': False, 'bear_strategy': 'mean_reversion', 'bear_bb_std_mult': 2.860131870378453, 'bear_rsi_os': 5, 'bear_rsi_ob': 79, 'bear_adx_thresh': 33.8696876051687, 'bear_atr_min_pct': 0.024623684110274224, 'bear_atr_max_pct': 0.11352899053262498, 'bear_tp_mult': 2.4651172553174265, 'bear_tsl_mult': 0.6436842841396494, 'bear_time_stop': 137, 'bear_use_sma': False, 'bear_use_ema': True, 'bear_use_atr': True, 'bear_use_adx': False, 'bear_use_spike': False, 'bear_rsi_required': False, 'sideways_strategy': 'mean_reversion', 'sideways_bb_std_mult': 3.4255020908392897, 'sideways_rsi_os': 55, 'sideways_rsi_ob': 89, 'sideways_adx_thresh': 7.4605490051478345, 'sideways_atr_min_pct': 0.005011388716504101, 'sideways_atr_max_pct': 0.13359374488416123, 'sideways_tp_mult': 1.9397371163700805, 'sideways_tsl_mult': 0.44922785465564274, 'sideways_time_stop': 36, 'sideways_use_sma': False, 'sideways_use_ema': True, 'sideways_use_atr': True, 'sideways_use_adx': False, 'sideways_use_spike': True, 'sideways_rsi_required': True}.
[I 2025-09-01 14:44:36,865] Trial 337 finished with values: [-1000000000.0, 1000000000.0] and parameters: {'p_sma': 44, 'p_std': 11, 'p_atr': 19, 'p_adx': 8, 'rsi_period': 12, 'ema1': 23, 'ema2': 29, 'slip_atr_k': 0.06260988672998372, 'slip_spread_k': 0.12607405004888558, 'spread_hl_frac': 0.015151579156815, 'bb_std_mult': 2.8947476531779004, 'rsi_os': 37, 'rsi_ob': 75, 'vol_spike': 0.2849855017037673, 'adx_thresh': 32.1689345402727, 'atr_min_pct': 0.0037305390697654275, 'atr_max_pct': 0.08173625217398961, 'tp_mult': 2.6107106009746994, 'tsl_mult': 0.7759337288111112, 'strategy': 'breakout', 'time_stop': 73, 'use_sma': False, 'use_atr': True, 'use_adx': False, 'use_ema': True, 'use_spike': True, 'rsi_required': False, 'edge_k': 0.5036683986825105, 'edge_cap': 0.07430296119878324, 'bull_strategy': 'mean_reversion', 'bull_bb_std_mult': 1.4656563198166097, 'bull_rsi_os': 5, 'bull_rsi_ob': 90, 'bull_adx_thresh': 11.96252693896553, 'bull_atr_min_pct': 0.008921808824559917, 'bull_atr_max_pct': 0.02157031800751825, 'bull_tp_mult': 2.78747761302846, 'bull_tsl_mult': 0.10434832874133126, 'bull_time_stop': 46, 'bull_use_sma': False, 'bull_use_ema': True, 'bull_use_atr': True, 'bull_use_adx': True, 'bull_use_spike': False, 'bull_rsi_required': False, 'bear_strategy': 'mean_reversion', 'bear_bb_std_mult': 0.97133725935276, 'bear_rsi_os': 5, 'bear_rsi_ob': 79, 'bear_adx_thresh': 28.941155190077268, 'bear_atr_min_pct': 0.024316247720560798, 'bear_atr_max_pct': 0.05433682522939076, 'bear_tp_mult': 2.4682844203811154, 'bear_tsl_mult': 0.6419918799253092, 'bear_time_stop': 136, 'bear_use_sma': False, 'bear_use_ema': True, 'bear_use_atr': True, 'bear_use_adx': False, 'bear_use_spike': False, 'bear_rsi_required': False, 'sideways_strategy': 'mean_reversion', 'sideways_bb_std_mult': 3.4231803260271305, 'sideways_rsi_os': 17, 'sideways_rsi_ob': 91, 'sideways_adx_thresh': 5.009124718484913, 'sideways_atr_min_pct': 0.014341763301504273, 'sideways_atr_max_pct': 0.13471912521412877, 'sideways_tp_mult': 1.8016663090085925, 'sideways_tsl_mult': 0.44383449397258445, 'sideways_time_stop': 251, 'sideways_use_sma': False, 'sideways_use_ema': True, 'sideways_use_atr': True, 'sideways_use_adx': False, 'sideways_use_spike': True, 'sideways_rsi_required': True}.
[I 2025-09-01 14:44:37,067] Trial 339 finished with values: [-1000000000.0, 1000000000.0] and parameters: {'p_sma': 44, 'p_std': 11, 'p_atr': 20, 'p_adx': 8, 'rsi_period': 13, 'ema1': 17, 'ema2': 29, 'slip_atr_k': 0.04478086635951424, 'slip_spread_k': 0.25196947142234394, 'spread_hl_frac': 0.015109138747273682, 'bb_std_mult': 0.7255764409979397, 'rsi_os': 38, 'rsi_ob': 79, 'vol_spike': 0.2864730070685336, 'adx_thresh': 18.849947315480737, 'atr_min_pct': 0.016628363362864218, 'atr_max_pct': 0.08141625241699987, 'tp_mult': 1.5041321000804513, 'tsl_mult': 0.996417544413003, 'strategy': 'breakout', 'time_stop': 75, 'use_sma': False, 'use_atr': False, 'use_adx': False, 'use_ema': True, 'use_spike': True, 'rsi_required': True, 'edge_k': 0.47345929828487865, 'edge_cap': 0.0707985125119668, 'bull_strategy': 'mean_reversion', 'bull_bb_std_mult': 0.8881010753955498, 'bull_rsi_os': 20, 'bull_rsi_ob': 48, 'bull_adx_thresh': 11.645082014890649, 'bull_atr_min_pct': 0.008851101226626374, 'bull_atr_max_pct': 0.14637964973278406, 'bull_tp_mult': 1.7192804899923437, 'bull_tsl_mult': 0.3155846415995942, 'bull_time_stop': 164, 'bull_use_sma': False, 'bull_use_ema': True, 'bull_use_atr': True, 'bull_use_adx': True, 'bull_use_spike': True, 'bull_rsi_required': False, 'bear_strategy': 'mean_reversion', 'bear_bb_std_mult': 2.8808933521188647, 'bear_rsi_os': 9, 'bear_rsi_ob': 49, 'bear_adx_thresh': 28.57888339855125, 'bear_atr_min_pct': 0.02999856991138089, 'bear_atr_max_pct': 0.11337493672885689, 'bear_tp_mult': 2.3420759957118022, 'bear_tsl_mult': 0.6798391954009092, 'bear_time_stop': 134, 'bear_use_sma': False, 'bear_use_ema': True, 'bear_use_atr': True, 'bear_use_adx': False, 'bear_use_spike': True, 'bear_rsi_required': False, 'sideways_strategy': 'breakout', 'sideways_bb_std_mult': 3.3290028808505974, 'sideways_rsi_os': 17, 'sideways_rsi_ob': 57, 'sideways_adx_thresh': 7.289324097864676, 'sideways_atr_min_pct': 0.014216003049809784, 'sideways_atr_max_pct': 0.13405147101782477, 'sideways_tp_mult': 1.9236765967135503, 'sideways_tsl_mult': 0.2577575304475661, 'sideways_time_stop': 116, 'sideways_use_sma': True, 'sideways_use_ema': True, 'sideways_use_atr': True, 'sideways_use_adx': False, 'sideways_use_spike': True, 'sideways_rsi_required': True}.
[I 2025-09-01 14:45:10,939] Trial 342 finished with values: [-0.018790895664048346, 0.018969970621139694] and parameters: {'p_sma': 13, 'p_std': 9, 'p_atr': 14, 'p_adx': 24, 'rsi_period': 23, 'ema1': 17, 'ema2': 49, 'slip_atr_k': 0.05471818669229477, 'slip_spread_k': 0.24975130668813014, 'spread_hl_frac': 0.002495237477173659, 'bb_std_mult': 0.7122263965159485, 'rsi_os': 8, 'rsi_ob': 49, 'vol_spike': 0.2888997303842906, 'adx_thresh': 18.11248512024819, 'atr_min_pct': 0.017060934315860306, 'atr_max_pct': 0.07606726164674082, 'tp_mult': 1.9870941414918528, 'tsl_mult': 0.9661299154707903, 'strategy': 'breakout', 'time_stop': 5, 'use_sma': False, 'use_atr': False, 'use_adx': True, 'use_ema': False, 'use_spike': False, 'rsi_required': True, 'edge_k': 0.6246536287914387, 'edge_cap': 0.07009003530796633, 'bull_strategy': 'breakout', 'bull_bb_std_mult': 2.0406573499390377, 'bull_rsi_os': 19, 'bull_rsi_ob': 49, 'bull_adx_thresh': 24.77628012300656, 'bull_atr_min_pct': 0.025539309101816194, 'bull_atr_max_pct': 0.14441611028798568, 'bull_tp_mult': 1.7458099846179849, 'bull_tsl_mult': 0.3221092408598763, 'bull_time_stop': 161, 'bull_use_sma': True, 'bull_use_ema': False, 'bull_use_atr': False, 'bull_use_adx': True, 'bull_use_spike': True, 'bull_rsi_required': True, 'bear_strategy': 'mean_reversion', 'bear_bb_std_mult': 3.548233633423848, 'bear_rsi_os': 9, 'bear_rsi_ob': 65, 'bear_adx_thresh': 28.594108505802343, 'bear_atr_min_pct': 0.022699210646384093, 'bear_atr_max_pct': 0.14105392736104752, 'bear_tp_mult': 1.5811207944917973, 'bear_tsl_mult': 0.9823796076666947, 'bear_time_stop': 30, 'bear_use_sma': False, 'bear_use_ema': False, 'bear_use_atr': False, 'bear_use_adx': True, 'bear_use_spike': True, 'bear_rsi_required': False, 'sideways_strategy': 'breakout', 'sideways_bb_std_mult': 1.6524876909789983, 'sideways_rsi_os': 15, 'sideways_rsi_ob': 48, 'sideways_adx_thresh': 6.989675119342699, 'sideways_atr_min_pct': 0.0031825739740951077, 'sideways_atr_max_pct': 0.060820511732063556, 'sideways_tp_mult': 1.8833245196054083, 'sideways_tsl_mult': 0.25810541667132436, 'sideways_time_stop': 130, 'sideways_use_sma': True, 'sideways_use_ema': False, 'sideways_use_atr': True, 'sideways_use_adx': False, 'sideways_use_spike': True, 'sideways_rsi_required': True}.
[I 2025-09-01 14:45:11,123] Trial 343 finished with values: [-1000000000.0, 1000000000.0] and parameters: {'p_sma': 11, 'p_std': 14, 'p_atr': 21, 'p_adx': 24, 'rsi_period': 23, 'ema1': 15, 'ema2': 49, 'slip_atr_k': 0.07012335840718072, 'slip_spread_k': 0.4766358332268533, 'spread_hl_frac': 0.002719805037496758, 'bb_std_mult': 1.3376876864263951, 'rsi_os': 44, 'rsi_ob': 51, 'vol_spike': 0.08425331515333548, 'adx_thresh': 17.856901272814877, 'atr_min_pct': 0.01784274975341226, 'atr_max_pct': 0.07566255891289524, 'tp_mult': 1.9971210884007264, 'tsl_mult': 0.1293448590906982, 'strategy': 'breakout', 'time_stop': 66, 'use_sma': False, 'use_atr': False, 'use_adx': True, 'use_ema': False, 'use_spike': False, 'rsi_required': True, 'edge_k': 1.3372262659686092, 'edge_cap': 0.5013408253601311, 'bull_strategy': 'breakout', 'bull_bb_std_mult': 2.237373117129376, 'bull_rsi_os': 25, 'bull_rsi_ob': 50, 'bull_adx_thresh': 10.477351590418904, 'bull_atr_min_pct': 0.00654466898888807, 'bull_atr_max_pct': 0.017323065069243415, 'bull_tp_mult': 2.959190174015944, 'bull_tsl_mult': 0.3926985392936555, 'bull_time_stop': 156, 'bull_use_sma': True, 'bull_use_ema': False, 'bull_use_atr': False, 'bull_use_adx': True, 'bull_use_spike': True, 'bull_rsi_required': True, 'bear_strategy': 'mean_reversion', 'bear_bb_std_mult': 3.3741725807578034, 'bear_rsi_os': 44, 'bear_rsi_ob': 53, 'bear_adx_thresh': 18.04479579260498, 'bear_atr_min_pct': 0.012140896009885153, 'bear_atr_max_pct': 0.10954346596203975, 'bear_tp_mult': 2.4299499050216946, 'bear_tsl_mult': 0.5801087037792279, 'bear_time_stop': 275, 'bear_use_sma': False, 'bear_use_ema': False, 'bear_use_atr': False, 'bear_use_adx': True, 'bear_use_spike': True, 'bear_rsi_required': False, 'sideways_strategy': 'breakout', 'sideways_bb_std_mult': 3.2484550625375253, 'sideways_rsi_os': 15, 'sideways_rsi_ob': 64, 'sideways_adx_thresh': 7.823363179226516, 'sideways_atr_min_pct': 0.02239221130280323, 'sideways_atr_max_pct': 0.06201612279057092, 'sideways_tp_mult': 1.8739298818268384, 'sideways_tsl_mult': 0.32704204525893366, 'sideways_time_stop': 129, 'sideways_use_sma': True, 'sideways_use_ema': False, 'sideways_use_atr': True, 'sideways_use_adx': False, 'sideways_use_spike': True, 'sideways_rsi_required': True}.
