[I 2025-09-01 14:08:22,194] Trial 107 finished with values: [-1000000000.0, 1000000000.0] and parameters: {'p_sma': 38, 'p_std': 26, 'p_atr': 28, 'p_adx': 22, 'rsi_period': 54, 'ema1': 17, 'ema2': 50, 'slip_atr_k': 0.2040770060536819, 'slip_spread_k': 0.47741766099175353, 'spread_hl_frac': 0.04947273149942074, 'bb_std_mult': 2.4912899897141796, 'rsi_os': 41, 'rsi_ob': 49, 'vol_spike': 0.16911545603679246, 'adx_thresh': 19.358629080939238, 'atr_min_pct': 0.007035349754584377, 'atr_max_pct': 0.11803821011509563, 'tp_mult': 1.939222416878555, 'tsl_mult': 0.1432614296934056, 'strategy': 'mean_reversion', 'time_stop': 153, 'use_sma': False, 'use_atr': False, 'use_adx': True, 'use_ema': True, 'use_spike': False, 'rsi_required': True, 'edge_k': 1.9146879410442663, 'edge_cap': 0.7854174099244271, 'bull_strategy': 'breakout', 'bull_bb_std_mult': 1.124623970287408, 'bull_rsi_os': 33, 'bull_rsi_ob': 46, 'bull_adx_thresh': 12.284241647231859, 'bull_atr_min_pct': 0.0024055091784911187, 'bull_atr_max_pct': 0.027358951252826225, 'bull_tp_mult': 1.5876288988942064, 'bull_tsl_mult': 0.0395625875722516, 'bull_time_stop': 71, 'bull_use_sma': True, 'bull_use_ema': False, 'bull_use_atr': True, 'bull_use_adx': True, 'bull_use_spike': False, 'bull_rsi_required': True, 'bear_strategy': 'breakout', 'bear_bb_std_mult': 1.1328786482702984, 'bear_rsi_os': 11, 'bear_rsi_ob': 91, 'bear_adx_thresh': 15.668396926509033, 'bear_atr_min_pct': 0.011318301870803498, 'bear_atr_max_pct': 0.013257012514621358, 'bear_tp_mult': 1.668900149790455, 'bear_tsl_mult': 0.5350002109531726, 'bear_time_stop': 258, 'bear_use_sma': True, 'bear_use_ema': True, 'bear_use_atr': False, 'bear_use_adx': True, 'bear_use_spike': True, 'bear_rsi_required': True, 'sideways_strategy': 'breakout', 'sideways_bb_std_mult': 3.350330663078334, 'sideways_rsi_os': 24, 'sideways_rsi_ob': 58, 'sideways_adx_thresh': 26.8056692064398, 'sideways_atr_min_pct': 0.012159349705613965, 'sideways_atr_max_pct': 0.09151592250473875, 'sideways_tp_mult': 2.866242870543392, 'sideways_tsl_mult': 0.0016050740223052529, 'sideways_time_stop': 139, 'sideways_use_sma': True, 'sideways_use_ema': True, 'sideways_use_atr': True, 'sideways_use_adx': False, 'sideways_use_spike': False, 'sideways_rsi_required': False}.
[I 2025-09-01 14:08:56,305] Trial 109 finished with values: [-1000000000.0, 1000000000.0] and parameters: {'p_sma': 47, 'p_std': 22, 'p_atr': 27, 'p_adx': 8, 'rsi_period': 36, 'ema1': 17, 'ema2': 51, 'slip_atr_k': 0.15485080643089458, 'slip_spread_k': 0.47748848939643646, 'spread_hl_frac': 0.013597650482293184, 'bb_std_mult': 2.316633420927981, 'rsi_os': 18, 'rsi_ob': 63, 'vol_spike': 0.00018866233614475703, 'adx_thresh': 21.45453552933499, 'atr_min_pct': 0.006804481849918273, 'atr_max_pct': 0.1303742871097037, 'tp_mult': 1.0678330063110582, 'tsl_mult': 0.299868674951694, 'strategy': 'mean_reversion', 'time_stop': 38, 'use_sma': True, 'use_atr': False, 'use_adx': True, 'use_ema': False, 'use_spike': False, 'rsi_required': True, 'edge_k': 0.28881697994138933, 'edge_cap': 0.8154928744301045, 'bull_strategy': 'mean_reversion', 'bull_bb_std_mult': 1.2539933826478364, 'bull_rsi_os': 35, 'bull_rsi_ob': 48, 'bull_adx_thresh': 12.564867060901241, 'bull_atr_min_pct': 0.028037498449847154, 'bull_atr_max_pct': 0.02337194630688301, 'bull_tp_mult': 1.677108368471416, 'bull_tsl_mult': 0.14632732520821476, 'bull_time_stop': 86, 'bull_use_sma': True, 'bull_use_ema': True, 'bull_use_atr': True, 'bull_use_adx': True, 'bull_use_spike': False, 'bull_rsi_required': False, 'bear_strategy': 'breakout', 'bear_bb_std_mult': 1.6967534399454238, 'bear_rsi_os': 6, 'bear_rsi_ob': 94, 'bear_adx_thresh': 33.12520653483933, 'bear_atr_min_pct': 0.011354762421830901, 'bear_atr_max_pct': 0.0610012752225189, 'bear_tp_mult': 1.7849820540546346, 'bear_tsl_mult': 0.041627163753643726, 'bear_time_stop': 260, 'bear_use_sma': True, 'bear_use_ema': False, 'bear_use_atr': True, 'bear_use_adx': True, 'bear_use_spike': True, 'bear_rsi_required': True, 'sideways_strategy': 'breakout', 'sideways_bb_std_mult': 2.8852886531692192, 'sideways_rsi_os': 49, 'sideways_rsi_ob': 58, 'sideways_adx_thresh': 30.45837687198536, 'sideways_atr_min_pct': 0.011438226209396631, 'sideways_atr_max_pct': 0.11239281917278579, 'sideways_tp_mult': 2.4622928727227262, 'sideways_tsl_mult': 0.2105869611953945, 'sideways_time_stop': 80, 'sideways_use_sma': True, 'sideways_use_ema': True, 'sideways_use_atr': True, 'sideways_use_adx': False, 'sideways_use_spike': False, 'sideways_rsi_required': False}.
[I 2025-09-01 14:08:56,543] Trial 110 finished with values: [-1000000000.0, 1000000000.0] and parameters: {'p_sma': 36, 'p_std': 52, 'p_atr': 10, 'p_adx': 24, 'rsi_period': 69, 'ema1': 8, 'ema2': 52, 'slip_atr_k': 0.19989121767148932, 'slip_spread_k': 0.1374255192668536, 'spread_hl_frac': 0.02056128164971922, 'bb_std_mult': 2.295600481342397, 'rsi_os': 41, 'rsi_ob': 63, 'vol_spike': 0.11747288378382284, 'adx_thresh': 32.82289043413189, 'atr_min_pct': 0.007077188610465529, 'atr_max_pct': 0.0751530283462884, 'tp_mult': 1.5882265534252502, 'tsl_mult': 0.33566118035959414, 'strategy': 'mean_reversion', 'time_stop': 115, 'use_sma': True, 'use_atr': False, 'use_adx': True, 'use_ema': False, 'use_spike': False, 'rsi_required': True, 'edge_k': 1.42311742905218, 'edge_cap': 0.7806187623249534, 'bull_strategy': 'mean_reversion', 'bull_bb_std_mult': 3.488538100544078, 'bull_rsi_os': 33, 'bull_rsi_ob': 48, 'bull_adx_thresh': 9.82058431773786, 'bull_atr_min_pct': 0.011329308659561279, 'bull_atr_max_pct': 0.051121549118662665, 'bull_tp_mult': 1.551779887701054, 'bull_tsl_mult': 0.13898766886217118, 'bull_time_stop': 94, 'bull_use_sma': True, 'bull_use_ema': True, 'bull_use_atr': True, 'bull_use_adx': True, 'bull_use_spike': False, 'bull_rsi_required': False, 'bear_strategy': 'breakout', 'bear_bb_std_mult': 0.5010580168136398, 'bear_rsi_os': 6, 'bear_rsi_ob': 94, 'bear_adx_thresh': 15.18576896802302, 'bear_atr_min_pct': 0.002599181636769029, 'bear_atr_max_pct': 0.06096289679199994, 'bear_tp_mult': 2.2696662678699626, 'bear_tsl_mult': 0.3516797160942817, 'bear_time_stop': 258, 'bear_use_sma': True, 'bear_use_ema': False, 'bear_use_atr': True, 'bear_use_adx': True, 'bear_use_spike': True, 'bear_rsi_required': True, 'sideways_strategy': 'breakout', 'sideways_bb_std_mult': 2.8878869902432833, 'sideways_rsi_os': 49, 'sideways_rsi_ob': 51, 'sideways_adx_thresh': 7.405959247138821, 'sideways_atr_min_pct': 0.011278689316488106, 'sideways_atr_max_pct': 0.0697072864184129, 'sideways_tp_mult': 2.006375998834553, 'sideways_tsl_mult': 0.8442654763776634, 'sideways_time_stop': 118, 'sideways_use_sma': True, 'sideways_use_ema': True, 'sideways_use_atr': True, 'sideways_use_adx': False, 'sideways_use_spike': False, 'sideways_rsi_required': False}.
[I 2025-09-01 14:08:58,322] Trial 112 finished with values: [-0.13261396651039026, 0.13224086647445155] and parameters: {'p_sma': 60, 'p_std': 52, 'p_atr': 12, 'p_adx': 24, 'rsi_period': 39, 'ema1': 12, 'ema2': 30, 'slip_atr_k': 0.23867418553716235, 'slip_spread_k': 0.1544928275659826, 'spread_hl_frac': 0.020213749205928333, 'bb_std_mult': 2.182287852653996, 'rsi_os': 47, 'rsi_ob': 62, 'vol_spike': 0.08545873574094719, 'adx_thresh': 32.855516395749234, 'atr_min_pct': 0.004729105264427564, 'atr_max_pct': 0.06789029458648714, 'tp_mult': 2.4578226006490502, 'tsl_mult': 0.33689031567442096, 'strategy': 'breakout', 'time_stop': 115, 'use_sma': True, 'use_atr': False, 'use_adx': False, 'use_ema': False, 'use_spike': False, 'rsi_required': True, 'edge_k': 0.2593913343544523, 'edge_cap': 0.744535863406229, 'bull_strategy': 'mean_reversion', 'bull_bb_std_mult': 0.7684602827190739, 'bull_rsi_os': 5, 'bull_rsi_ob': 48, 'bull_adx_thresh': 9.83383085688249, 'bull_atr_min_pct': 0.022966340526050028, 'bull_atr_max_pct': 0.13456161457261656, 'bull_tp_mult': 2.7080454407550265, 'bull_tsl_mult': 0.8622620957067769, 'bull_time_stop': 113, 'bull_use_sma': True, 'bull_use_ema': True, 'bull_use_atr': True, 'bull_use_adx': True, 'bull_use_spike': True, 'bull_rsi_required': False, 'bear_strategy': 'mean_reversion', 'bear_bb_std_mult': 0.5241027305451068, 'bear_rsi_os': 38, 'bear_rsi_ob': 94, 'bear_adx_thresh': 15.183835958736074, 'bear_atr_min_pct': 0.0021073019322314316, 'bear_atr_max_pct': 0.06010778762226067, 'bear_tp_mult': 2.253919026747591, 'bear_tsl_mult': 0.04241554392741603, 'bear_time_stop': 224, 'bear_use_sma': True, 'bear_use_ema': False, 'bear_use_atr': True, 'bear_use_adx': False, 'bear_use_spike': True, 'bear_rsi_required': False, 'sideways_strategy': 'breakout', 'sideways_bb_std_mult': 3.262955940676246, 'sideways_rsi_os': 17, 'sideways_rsi_ob': 51, 'sideways_adx_thresh': 18.47068987952277, 'sideways_atr_min_pct': 0.006592220755660438, 'sideways_atr_max_pct': 0.06293196452807343, 'sideways_tp_mult': 2.517963626137405, 'sideways_tsl_mult': 0.39298030785108684, 'sideways_time_stop': 81, 'sideways_use_sma': True, 'sideways_use_ema': True, 'sideways_use_atr': False, 'sideways_use_adx': True, 'sideways_use_spike': False, 'sideways_rsi_required': True}.
[I 2025-09-01 14:08:58,553] Trial 111 finished with values: [-1000000000.0, 1000000000.0] and parameters: {'p_sma': 11, 'p_std': 5, 'p_atr': 26, 'p_adx': 20, 'rsi_period': 49, 'ema1': 13, 'ema2': 40, 'slip_atr_k': 0.15539510585581162, 'slip_spread_k': 0.14015336931337197, 'spread_hl_frac': 0.0486168635770903, 'bb_std_mult': 2.167513293655345, 'rsi_os': 34, 'rsi_ob': 63, 'vol_spike': 0.08501405835787262, 'adx_thresh': 16.562480938847962, 'atr_min_pct': 0.007012239510195923, 'atr_max_pct': 0.06636437119770118, 'tp_mult': 1.0423412581274638, 'tsl_mult': 0.7526090151546176, 'strategy': 'mean_reversion', 'time_stop': 277, 'use_sma': True, 'use_atr': False, 'use_adx': True, 'use_ema': False, 'use_spike': False, 'rsi_required': True, 'edge_k': 0.8048024337853488, 'edge_cap': 0.8153166701992756, 'bull_strategy': 'mean_reversion', 'bull_bb_std_mult': 3.0554093642463194, 'bull_rsi_os': 35, 'bull_rsi_ob': 58, 'bull_adx_thresh': 10.632620751303696, 'bull_atr_min_pct': 0.028111066864531194, 'bull_atr_max_pct': 0.12237399609231002, 'bull_tp_mult': 1.6719377316538835, 'bull_tsl_mult': 0.3815146607337537, 'bull_time_stop': 95, 'bull_use_sma': True, 'bull_use_ema': True, 'bull_use_atr': True, 'bull_use_adx': True, 'bull_use_spike': False, 'bull_rsi_required': False, 'bear_strategy': 'breakout', 'bear_bb_std_mult': 2.883339644193008, 'bear_rsi_os': 37, 'bear_rsi_ob': 57, 'bear_adx_thresh': 32.6177090222054, 'bear_atr_min_pct': 0.00223128536073388, 'bear_atr_max_pct': 0.020664970185685232, 'bear_tp_mult': 1.4457354846166282, 'bear_tsl_mult': 0.2673518223760334, 'bear_time_stop': 258, 'bear_use_sma': True, 'bear_use_ema': False, 'bear_use_atr': True, 'bear_use_adx': True, 'bear_use_spike': True, 'bear_rsi_required': True, 'sideways_strategy': 'breakout', 'sideways_bb_std_mult': 0.591801520727818, 'sideways_rsi_os': 50, 'sideways_rsi_ob': 51, 'sideways_adx_thresh': 25.216866290280645, 'sideways_atr_min_pct': 0.011126977605892712, 'sideways_atr_max_pct': 0.06401416015602134, 'sideways_tp_mult': 2.0809445389265724, 'sideways_tsl_mult': 0.27068713065834077, 'sideways_time_stop': 117, 'sideways_use_sma': True, 'sideways_use_ema': True, 'sideways_use_atr': False, 'sideways_use_adx': False, 'sideways_use_spike': False, 'sideways_rsi_required': True}.
[I 2025-09-01 14:09:36,406] Trial 115 finished with values: [-1000000000.0, 1000000000.0] and parameters: {'p_sma': 11, 'p_std': 45, 'p_atr': 26, 'p_adx': 20, 'rsi_period': 18, 'ema1': 26, 'ema2': 40, 'slip_atr_k': 0.22558773803869103, 'slip_spread_k': 0.6615482831280087, 'spread_hl_frac': 0.004097601175418353, 'bb_std_mult': 2.966531652962818, 'rsi_os': 34, 'rsi_ob': 74, 'vol_spike': 0.05194849967310666, 'adx_thresh': 29.358125641142703, 'atr_min_pct': 0.008878470582339197, 'atr_max_pct': 0.12283305521065048, 'tp_mult': 1.8630333118322675, 'tsl_mult': 0.6121799498214511, 'strategy': 'mean_reversion', 'time_stop': 293, 'use_sma': False, 'use_atr': True, 'use_adx': True, 'use_ema': False, 'use_spike': True, 'rsi_required': False, 'edge_k': 0.8096465826079283, 'edge_cap': 0.822483621738073, 'bull_strategy': 'mean_reversion', 'bull_bb_std_mult': 1.0092410145077195, 'bull_rsi_os': 28, 'bull_rsi_ob': 61, 'bull_adx_thresh': 6.65445103773521, 'bull_atr_min_pct': 0.003544163008377775, 'bull_atr_max_pct': 0.03642300238354919, 'bull_tp_mult': 1.492452927441151, 'bull_tsl_mult': 0.07528660945894637, 'bull_time_stop': 103, 'bull_use_sma': True, 'bull_use_ema': True, 'bull_use_atr': False, 'bull_use_adx': True, 'bull_use_spike': True, 'bull_rsi_required': True, 'bear_strategy': 'breakout', 'bear_bb_std_mult': 2.8463199587310095, 'bear_rsi_os': 19, 'bear_rsi_ob': 86, 'bear_adx_thresh': 12.378700231541082, 'bear_atr_min_pct': 0.0181158650273258, 'bear_atr_max_pct': 0.021707558593826306, 'bear_tp_mult': 1.1989213923874629, 'bear_tsl_mult': 0.8124424484305197, 'bear_time_stop': 273, 'bear_use_sma': False, 'bear_use_ema': False, 'bear_use_atr': True, 'bear_use_adx': False, 'bear_use_spike': False, 'bear_rsi_required': True, 'sideways_strategy': 'mean_reversion', 'sideways_bb_std_mult': 3.069789867109575, 'sideways_rsi_os': 19, 'sideways_rsi_ob': 84, 'sideways_adx_thresh': 25.194001406862192, 'sideways_atr_min_pct': 0.019968527588825884, 'sideways_atr_max_pct': 0.0850208266245111, 'sideways_tp_mult': 2.3364621638031218, 'sideways_tsl_mult': 0.26354928257535326, 'sideways_time_stop': 16, 'sideways_use_sma': False, 'sideways_use_ema': False, 'sideways_use_atr': True, 'sideways_use_adx': True, 'sideways_use_spike': False, 'sideways_rsi_required': False}.
[I 2025-09-01 14:09:36,841] Trial 113 finished with values: [-0.016665391414570463, 0.01639919897455666] and parameters: {'p_sma': 40, 'p_std': 32, 'p_atr': 26, 'p_adx': 20, 'rsi_period': 31, 'ema1': 12, 'ema2': 39, 'slip_atr_k': 0.12060898852686382, 'slip_spread_k': 0.053088776409644656, 'spread_hl_frac': 0.03908619764234754, 'bb_std_mult': 2.167640484107035, 'rsi_os': 33, 'rsi_ob': 59, 'vol_spike': 0.05126811434794543, 'adx_thresh': 29.54231444940921, 'atr_min_pct': 0.016421298037310975, 'atr_max_pct': 0.12327393305391302, 'tp_mult': 2.4878317281144087, 'tsl_mult': 0.7375186004853027, 'strategy': 'breakout', 'time_stop': 57, 'use_sma': False, 'use_atr': True, 'use_adx': False, 'use_ema': False, 'use_spike': False, 'rsi_required': False, 'edge_k': 1.6036229795265404, 'edge_cap': 0.7580782823987091, 'bull_strategy': 'mean_reversion', 'bull_bb_std_mult': 0.757835997808068, 'bull_rsi_os': 27, 'bull_rsi_ob': 94, 'bull_adx_thresh': 21.615532268459706, 'bull_atr_min_pct': 0.003634495120847633, 'bull_atr_max_pct': 0.1170472410969689, 'bull_tp_mult': 1.487963866759583, 'bull_tsl_mult': 0.8857248107342715, 'bull_time_stop': 113, 'bull_use_sma': True, 'bull_use_ema': True, 'bull_use_atr': False, 'bull_use_adx': True, 'bull_use_spike': True, 'bull_rsi_required': True, 'bear_strategy': 'mean_reversion', 'bear_bb_std_mult': 1.4375044678988074, 'bear_rsi_os': 54, 'bear_rsi_ob': 87, 'bear_adx_thresh': 12.123642382596676, 'bear_atr_min_pct': 0.018098328721815198, 'bear_atr_max_pct': 0.09662568394995359, 'bear_tp_mult': 1.2980277643708218, 'bear_tsl_mult': 0.885292746826232, 'bear_time_stop': 273, 'bear_use_sma': False, 'bear_use_ema': False, 'bear_use_atr': True, 'bear_use_adx': False, 'bear_use_spike': True, 'bear_rsi_required': False, 'sideways_strategy': 'mean_reversion', 'sideways_bb_std_mult': 3.021734288045926, 'sideways_rsi_os': 39, 'sideways_rsi_ob': 84, 'sideways_adx_thresh': 25.09748190288656, 'sideways_atr_min_pct': 0.0034558332208427696, 'sideways_atr_max_pct': 0.06280346365897188, 'sideways_tp_mult': 2.521881536478985, 'sideways_tsl_mult': 0.2699791135951904, 'sideways_time_stop': 127, 'sideways_use_sma': True, 'sideways_use_ema': False, 'sideways_use_atr': False, 'sideways_use_adx': True, 'sideways_use_spike': False, 'sideways_rsi_required': True}.
[I 2025-09-01 14:09:37,001] Trial 116 finished with values: [-0.012221257775886119, 0.012253838097207566] and parameters: {'p_sma': 40, 'p_std': 49, 'p_atr': 25, 'p_adx': 22, 'rsi_period': 65, 'ema1': 24, 'ema2': 35, 'slip_atr_k': 0.22449124355466807, 'slip_spread_k': 0.04219232402650075, 'spread_hl_frac': 0.03735554824606516, 'bb_std_mult': 2.609451754014501, 'rsi_os': 7, 'rsi_ob': 75, 'vol_spike': 0.0522483910421533, 'adx_thresh': 29.656855615969512, 'atr_min_pct': 0.016432756930083368, 'atr_max_pct': 0.11115872473911326, 'tp_mult': 1.8682606307691005, 'tsl_mult': 0.6131019292590686, 'strategy': 'mean_reversion', 'time_stop': 55, 'use_sma': False, 'use_atr': True, 'use_adx': True, 'use_ema': False, 'use_spike': True, 'rsi_required': False, 'edge_k': 1.14983858085837, 'edge_cap': 0.7595222650740547, 'bull_strategy': 'mean_reversion', 'bull_bb_std_mult': 2.6390524373655087, 'bull_rsi_os': 53, 'bull_rsi_ob': 94, 'bull_adx_thresh': 6.399865841789154, 'bull_atr_min_pct': 0.0005795564957588883, 'bull_atr_max_pct': 0.10952090630224272, 'bull_tp_mult': 1.481374490729618, 'bull_tsl_mult': 0.06483218755144579, 'bull_time_stop': 103, 'bull_use_sma': True, 'bull_use_ema': True, 'bull_use_atr': False, 'bull_use_adx': True, 'bull_use_spike': True, 'bull_rsi_required': True, 'bear_strategy': 'breakout', 'bear_bb_std_mult': 1.4332892541292708, 'bear_rsi_os': 18, 'bear_rsi_ob': 85, 'bear_adx_thresh': 12.548292159691517, 'bear_atr_min_pct': 0.018033336365825332, 'bear_atr_max_pct': 0.016292934135186274, 'bear_tp_mult': 1.0991784847854247, 'bear_tsl_mult': 0.23746455668514213, 'bear_time_stop': 274, 'bear_use_sma': False, 'bear_use_ema': False, 'bear_use_atr': True, 'bear_use_adx': False, 'bear_use_spike': False, 'bear_rsi_required': True, 'sideways_strategy': 'mean_reversion', 'sideways_bb_std_mult': 3.118896864354655, 'sideways_rsi_os': 23, 'sideways_rsi_ob': 54, 'sideways_adx_thresh': 14.957734460028675, 'sideways_atr_min_pct': 0.02404013161178594, 'sideways_atr_max_pct': 0.084742221363847, 'sideways_tp_mult': 1.1170068809365818, 'sideways_tsl_mult': 0.9149986035352464, 'sideways_time_stop': 14, 'sideways_use_sma': False, 'sideways_use_ema': False, 'sideways_use_atr': True, 'sideways_use_adx': True, 'sideways_use_spike': False, 'sideways_rsi_required': False}.
[I 2025-09-01 14:09:37,307] Trial 114 finished with values: [-0.01651332625155899, 0.0164818354999069] and parameters: {'p_sma': 40, 'p_std': 32, 'p_atr': 26, 'p_adx': 20, 'rsi_period': 39, 'ema1': 12, 'ema2': 40, 'slip_atr_k': 0.23979225028296658, 'slip_spread_k': 0.26968125920131464, 'spread_hl_frac': 0.0383750837637171, 'bb_std_mult': 2.183018707128754, 'rsi_os': 47, 'rsi_ob': 59, 'vol_spike': 0.1255836547077552, 'adx_thresh': 16.88977559740588, 'atr_min_pct': 0.009226664786185116, 'atr_max_pct': 0.03640076858032815, 'tp_mult': 2.203244171883924, 'tsl_mult': 0.7282721796002227, 'strategy': 'breakout', 'time_stop': 271, 'use_sma': False, 'use_atr': True, 'use_adx': False, 'use_ema': False, 'use_spike': False, 'rsi_required': False, 'edge_k': 0.8121857742933428, 'edge_cap': 0.7507146294417734, 'bull_strategy': 'mean_reversion', 'bull_bb_std_mult': 0.7504592164164658, 'bull_rsi_os': 53, 'bull_rsi_ob': 95, 'bull_adx_thresh': 6.669492786140264, 'bull_atr_min_pct': 1.061172118898502e-05, 'bull_atr_max_pct': 0.0357398867766842, 'bull_tp_mult': 1.472849912032511, 'bull_tsl_mult': 0.8429238959413478, 'bull_time_stop': 112, 'bull_use_sma': True, 'bull_use_ema': True, 'bull_use_atr': False, 'bull_use_adx': True, 'bull_use_spike': True, 'bull_rsi_required': True, 'bear_strategy': 'mean_reversion', 'bear_bb_std_mult': 1.4370210948315054, 'bear_rsi_os': 37, 'bear_rsi_ob': 53, 'bear_adx_thresh': 12.186463075469407, 'bear_atr_min_pct': 0.01892009571716957, 'bear_atr_max_pct': 0.021224725475345242, 'bear_tp_mult': 2.797755780647424, 'bear_tsl_mult': 0.2620638146037829, 'bear_time_stop': 227, 'bear_use_sma': False, 'bear_use_ema': False, 'bear_use_atr': True, 'bear_use_adx': False, 'bear_use_spike': True, 'bear_rsi_required': False, 'sideways_strategy': 'mean_reversion', 'sideways_bb_std_mult': 3.054600567451453, 'sideways_rsi_os': 19, 'sideways_rsi_ob': 83, 'sideways_adx_thresh': 31.973055536900134, 'sideways_atr_min_pct': 0.004100824481646691, 'sideways_atr_max_pct': 0.06252491515312787, 'sideways_tp_mult': 2.326580170855802, 'sideways_tsl_mult': 0.27737519535756, 'sideways_time_stop': 114, 'sideways_use_sma': True, 'sideways_use_ema': False, 'sideways_use_atr': False, 'sideways_use_adx': True, 'sideways_use_spike': False, 'sideways_rsi_required': True}.
