[I 2025-09-01 14:30:07,339] Trial 243 finished with values: [-1000000000.0, 1000000000.0] and parameters: {'p_sma': 11, 'p_std': 27, 'p_atr': 16, 'p_adx': 8, 'rsi_period': 49, 'ema1': 30, 'ema2': 13, 'slip_atr_k': 0.1854570836590826, 'slip_spread_k': 0.5247979096331822, 'spread_hl_frac': 0.010816364754709724, 'bb_std_mult': 3.187325730406031, 'rsi_os': 34, 'rsi_ob': 72, 'vol_spike': 0.26495750584324634, 'adx_thresh': 19.32358641408656, 'atr_min_pct': 0.0016963899636787873, 'atr_max_pct': 0.03201733313505741, 'tp_mult': 2.8608087089245036, 'tsl_mult': 0.6030887612227229, 'strategy': 'breakout', 'time_stop': 286, 'use_sma': False, 'use_atr': True, 'use_adx': False, 'use_ema': False, 'use_spike': True, 'rsi_required': False, 'edge_k': 0.6227311442488069, 'edge_cap': 0.05090825123417101, 'bull_strategy': 'breakout', 'bull_bb_std_mult': 0.5002265603304907, 'bull_rsi_os': 14, 'bull_rsi_ob': 91, 'bull_adx_thresh': 11.071168775351893, 'bull_atr_min_pct': 0.01752374689428087, 'bull_atr_max_pct': 0.06559638839256268, 'bull_tp_mult': 2.158374487983405, 'bull_tsl_mult': 0.30980627798451177, 'bull_time_stop': 206, 'bull_use_sma': True, 'bull_use_ema': False, 'bull_use_atr': False, 'bull_use_adx': True, 'bull_use_spike': False, 'bull_rsi_required': True, 'bear_strategy': 'mean_reversion', 'bear_bb_std_mult': 2.4806534465723367, 'bear_rsi_os': 34, 'bear_rsi_ob': 56, 'bear_adx_thresh': 27.414117545469132, 'bear_atr_min_pct': 0.02485093655079902, 'bear_atr_max_pct': 0.11525566566185069, 'bear_tp_mult': 1.763083957099671, 'bear_tsl_mult': 0.6652655680403567, 'bear_time_stop': 189, 'bear_use_sma': False, 'bear_use_ema': False, 'bear_use_atr': False, 'bear_use_adx': True, 'bear_use_spike': False, 'bear_rsi_required': False, 'sideways_strategy': 'mean_reversion', 'sideways_bb_std_mult': 3.5234034320569902, 'sideways_rsi_os': 29, 'sideways_rsi_ob': 45, 'sideways_adx_thresh': 6.421604105537116, 'sideways_atr_min_pct': 0.028539290007479904, 'sideways_atr_max_pct': 0.13111142379221263, 'sideways_tp_mult': 1.926831124991354, 'sideways_tsl_mult': 0.9105731271465183, 'sideways_time_stop': 58, 'sideways_use_sma': False, 'sideways_use_ema': False, 'sideways_use_atr': True, 'sideways_use_adx': False, 'sideways_use_spike': True, 'sideways_rsi_required': True}.
[I 2025-09-01 14:30:52,125] Trial 247 finished with values: [-1000000000.0, 1000000000.0] and parameters: {'p_sma': 60, 'p_std': 29, 'p_atr': 20, 'p_adx': 10, 'rsi_period': 67, 'ema1': 30, 'ema2': 57, 'slip_atr_k': 0.09960102993174746, 'slip_spread_k': 0.8718064986270044, 'spread_hl_frac': 0.028057174418934367, 'bb_std_mult': 1.6308002265458337, 'rsi_os': 37, 'rsi_ob': 74, 'vol_spike': 0.19405464663755334, 'adx_thresh': 27.538695532418878, 'atr_min_pct': 0.029897443783646185, 'atr_max_pct': 0.07379447081868754, 'tp_mult': 2.9570983200100227, 'tsl_mult': 0.0626975601836215, 'strategy': 'breakout', 'time_stop': 266, 'use_sma': False, 'use_atr': True, 'use_adx': True, 'use_ema': False, 'use_spike': True, 'rsi_required': False, 'edge_k': 0.4993024344675958, 'edge_cap': 0.4934805609787055, 'bull_strategy': 'breakout', 'bull_bb_std_mult': 2.542670924550801, 'bull_rsi_os': 17, 'bull_rsi_ob': 47, 'bull_adx_thresh': 9.923699684770579, 'bull_atr_min_pct': 0.02749909257816386, 'bull_atr_max_pct': 0.09014899792385088, 'bull_tp_mult': 2.260112199988621, 'bull_tsl_mult': 0.3323616380944371, 'bull_time_stop': 173, 'bull_use_sma': True, 'bull_use_ema': False, 'bull_use_atr': False, 'bull_use_adx': False, 'bull_use_spike': False, 'bull_rsi_required': True, 'bear_strategy': 'mean_reversion', 'bear_bb_std_mult': 3.467671007286656, 'bear_rsi_os': 54, 'bear_rsi_ob': 76, 'bear_adx_thresh': 6.065233121087857, 'bear_atr_min_pct': 0.023011245892384853, 'bear_atr_max_pct': 0.1143667314534891, 'bear_tp_mult': 2.106642282377706, 'bear_tsl_mult': 0.8866684368431744, 'bear_time_stop': 276, 'bear_use_sma': False, 'bear_use_ema': False, 'bear_use_atr': False, 'bear_use_adx': True, 'bear_use_spike': False, 'bear_rsi_required': False, 'sideways_strategy': 'mean_reversion', 'sideways_bb_std_mult': 0.9510115285426037, 'sideways_rsi_os': 8, 'sideways_rsi_ob': 89, 'sideways_adx_thresh': 6.924615425307818, 'sideways_atr_min_pct': 0.006443344330170381, 'sideways_atr_max_pct': 0.13651639906422608, 'sideways_tp_mult': 1.6814979722200571, 'sideways_tsl_mult': 0.04523873291044439, 'sideways_time_stop': 210, 'sideways_use_sma': False, 'sideways_use_ema': False, 'sideways_use_atr': False, 'sideways_use_adx': False, 'sideways_use_spike': True, 'sideways_rsi_required': True}.
[I 2025-09-01 14:30:52,127] Trial 245 finished with values: [-1000000000.0, 1000000000.0] and parameters: {'p_sma': 20, 'p_std': 34, 'p_atr': 14, 'p_adx': 23, 'rsi_period': 31, 'ema1': 7, 'ema2': 58, 'slip_atr_k': 0.1528952391089656, 'slip_spread_k': 0.07664896493844675, 'spread_hl_frac': 0.02769033621681488, 'bb_std_mult': 0.9319579174052401, 'rsi_os': 34, 'rsi_ob': 73, 'vol_spike': 0.22646895265896122, 'adx_thresh': 31.65190466180614, 'atr_min_pct': 0.022655264050670063, 'atr_max_pct': 0.07383865238424489, 'tp_mult': 2.905398032595666, 'tsl_mult': 0.0612987343869623, 'strategy': 'breakout', 'time_stop': 37, 'use_sma': False, 'use_atr': True, 'use_adx': False, 'use_ema': False, 'use_spike': True, 'rsi_required': False, 'edge_k': 1.1945576453412952, 'edge_cap': 0.051908427807326366, 'bull_strategy': 'breakout', 'bull_bb_std_mult': 2.7228779232524785, 'bull_rsi_os': 17, 'bull_rsi_ob': 50, 'bull_adx_thresh': 9.917791160715378, 'bull_atr_min_pct': 0.01122642448967065, 'bull_atr_max_pct': 0.019382109112920622, 'bull_tp_mult': 2.3900654385592235, 'bull_tsl_mult': 0.35857357805889245, 'bull_time_stop': 208, 'bull_use_sma': True, 'bull_use_ema': False, 'bull_use_atr': False, 'bull_use_adx': False, 'bull_use_spike': False, 'bull_rsi_required': True, 'bear_strategy': 'mean_reversion', 'bear_bb_std_mult': 3.4546672163507113, 'bear_rsi_os': 9, 'bear_rsi_ob': 51, 'bear_adx_thresh': 19.615411565752666, 'bear_atr_min_pct': 0.023074317347258594, 'bear_atr_max_pct': 0.11497614505645123, 'bear_tp_mult': 1.8632795137791875, 'bear_tsl_mult': 0.6236979742501186, 'bear_time_stop': 115, 'bear_use_sma': False, 'bear_use_ema': False, 'bear_use_atr': False, 'bear_use_adx': True, 'bear_use_spike': False, 'bear_rsi_required': False, 'sideways_strategy': 'mean_reversion', 'sideways_bb_std_mult': 3.157963514462409, 'sideways_rsi_os': 11, 'sideways_rsi_ob': 89, 'sideways_adx_thresh': 6.470861490817164, 'sideways_atr_min_pct': 0.028666255929657655, 'sideways_atr_max_pct': 0.13135010718319684, 'sideways_tp_mult': 1.6789895664419079, 'sideways_tsl_mult': 0.26739992458542583, 'sideways_time_stop': 12, 'sideways_use_sma': False, 'sideways_use_ema': False, 'sideways_use_atr': True, 'sideways_use_adx': False, 'sideways_use_spike': True, 'sideways_rsi_required': True}.
[I 2025-09-01 14:30:52,124] Trial 246 finished with values: [-1000000000.0, 1000000000.0] and parameters: {'p_sma': 59, 'p_std': 40, 'p_atr': 22, 'p_adx': 23, 'rsi_period': 67, 'ema1': 7, 'ema2': 52, 'slip_atr_k': 0.08657712491833375, 'slip_spread_k': 0.06906747068554175, 'spread_hl_frac': 0.034438149741865744, 'bb_std_mult': 2.7225427035487977, 'rsi_os': 34, 'rsi_ob': 73, 'vol_spike': 0.09513198426939529, 'adx_thresh': 19.3396998000998, 'atr_min_pct': 0.029853753191390504, 'atr_max_pct': 0.07444576229223912, 'tp_mult': 2.95694760383089, 'tsl_mult': 0.06388009531991877, 'strategy': 'breakout', 'time_stop': 74, 'use_sma': False, 'use_atr': True, 'use_adx': False, 'use_ema': False, 'use_spike': True, 'rsi_required': False, 'edge_k': 0.6218411160472385, 'edge_cap': 0.39389387316206026, 'bull_strategy': 'breakout', 'bull_bb_std_mult': 3.0147736685736906, 'bull_rsi_os': 17, 'bull_rsi_ob': 47, 'bull_adx_thresh': 10.214517471640898, 'bull_atr_min_pct': 0.01193520831938657, 'bull_atr_max_pct': 0.024918403271729284, 'bull_tp_mult': 1.733965789291669, 'bull_tsl_mult': 0.35752192304051755, 'bull_time_stop': 147, 'bull_use_sma': True, 'bull_use_ema': False, 'bull_use_atr': False, 'bull_use_adx': False, 'bull_use_spike': False, 'bull_rsi_required': True, 'bear_strategy': 'mean_reversion', 'bear_bb_std_mult': 2.400384768070849, 'bear_rsi_os': 9, 'bear_rsi_ob': 76, 'bear_adx_thresh': 27.377115661763902, 'bear_atr_min_pct': 0.023996262522407885, 'bear_atr_max_pct': 0.11508176951119935, 'bear_tp_mult': 1.8562719180075593, 'bear_tsl_mult': 0.8883497212863831, 'bear_time_stop': 106, 'bear_use_sma': False, 'bear_use_ema': False, 'bear_use_atr': False, 'bear_use_adx': True, 'bear_use_spike': False, 'bear_rsi_required': False, 'sideways_strategy': 'mean_reversion', 'sideways_bb_std_mult': 1.7302189757874669, 'sideways_rsi_os': 11, 'sideways_rsi_ob': 89, 'sideways_adx_thresh': 6.7586484190169935, 'sideways_atr_min_pct': 0.0208525721445314, 'sideways_atr_max_pct': 0.13029167907859276, 'sideways_tp_mult': 1.7447727894469274, 'sideways_tsl_mult': 0.31800123876539477, 'sideways_time_stop': 278, 'sideways_use_sma': False, 'sideways_use_ema': False, 'sideways_use_atr': True, 'sideways_use_adx': False, 'sideways_use_spike': True, 'sideways_rsi_required': True}.
[I 2025-09-01 14:30:52,512] Trial 244 finished with values: [-1000000000.0, 1000000000.0] and parameters: {'p_sma': 31, 'p_std': 33, 'p_atr': 16, 'p_adx': 14, 'rsi_period': 65, 'ema1': 15, 'ema2': 33, 'slip_atr_k': 0.13050969539367338, 'slip_spread_k': 0.22797684322719447, 'spread_hl_frac': 0.0272907835773714, 'bb_std_mult': 1.6375178227837413, 'rsi_os': 34, 'rsi_ob': 74, 'vol_spike': 0.2234994654013206, 'adx_thresh': 32.22203668179942, 'atr_min_pct': 0.01669640545936129, 'atr_max_pct': 0.031573474081385146, 'tp_mult': 2.897174970358519, 'tsl_mult': 0.07013616632453691, 'strategy': 'breakout', 'time_stop': 88, 'use_sma': False, 'use_atr': True, 'use_adx': False, 'use_ema': False, 'use_spike': True, 'rsi_required': False, 'edge_k': 0.6088317343723039, 'edge_cap': 0.092527190307172, 'bull_strategy': 'breakout', 'bull_bb_std_mult': 0.6343541396882995, 'bull_rsi_os': 15, 'bull_rsi_ob': 94, 'bull_adx_thresh': 26.152078439303395, 'bull_atr_min_pct': 0.01653864969841244, 'bull_atr_max_pct': 0.01675699058551316, 'bull_tp_mult': 2.146553505653291, 'bull_tsl_mult': 0.3347085199132182, 'bull_time_stop': 206, 'bull_use_sma': True, 'bull_use_ema': False, 'bull_use_atr': False, 'bull_use_adx': True, 'bull_use_spike': False, 'bull_rsi_required': True, 'bear_strategy': 'mean_reversion', 'bear_bb_std_mult': 3.4598185871348743, 'bear_rsi_os': 21, 'bear_rsi_ob': 76, 'bear_adx_thresh': 27.382296879012767, 'bear_atr_min_pct': 0.022919849332587016, 'bear_atr_max_pct': 0.11532762423141615, 'bear_tp_mult': 1.8534462124058728, 'bear_tsl_mult': 0.6242813780327522, 'bear_time_stop': 189, 'bear_use_sma': False, 'bear_use_ema': False, 'bear_use_atr': False, 'bear_use_adx': True, 'bear_use_spike': False, 'bear_rsi_required': False, 'sideways_strategy': 'mean_reversion', 'sideways_bb_std_mult': 0.7101021932342879, 'sideways_rsi_os': 29, 'sideways_rsi_ob': 67, 'sideways_adx_thresh': 5.612565056682115, 'sideways_atr_min_pct': 0.02711374366811017, 'sideways_atr_max_pct': 0.09568504553198873, 'sideways_tp_mult': 1.1131531343894112, 'sideways_tsl_mult': 0.918392910750276, 'sideways_time_stop': 108, 'sideways_use_sma': False, 'sideways_use_ema': False, 'sideways_use_atr': True, 'sideways_use_adx': False, 'sideways_use_spike': True, 'sideways_rsi_required': True}.
[I 2025-09-01 14:31:32,853] Trial 251 finished with values: [-1000000000.0, 1000000000.0] and parameters: {'p_sma': 53, 'p_std': 12, 'p_atr': 29, 'p_adx': 25, 'rsi_period': 15, 'ema1': 13, 'ema2': 53, 'slip_atr_k': 0.030993693720208562, 'slip_spread_k': 0.1270369585377441, 'spread_hl_frac': 0.042877347837204344, 'bb_std_mult': 0.642503167950502, 'rsi_os': 37, 'rsi_ob': 75, 'vol_spike': 0.2875809724089935, 'adx_thresh': 20.835190596599908, 'atr_min_pct': 0.004448418305036608, 'atr_max_pct': 0.09789020173157369, 'tp_mult': 1.5031614515846126, 'tsl_mult': 0.40453985552750443, 'strategy': 'breakout', 'time_stop': 187, 'use_sma': True, 'use_atr': True, 'use_adx': True, 'use_ema': True, 'use_spike': True, 'rsi_required': False, 'edge_k': 0.14020389205428185, 'edge_cap': 0.6851086163253598, 'bull_strategy': 'breakout', 'bull_bb_std_mult': 1.5561253843233467, 'bull_rsi_os': 18, 'bull_rsi_ob': 89, 'bull_adx_thresh': 21.5961110889562, 'bull_atr_min_pct': 0.014019312517823037, 'bull_atr_max_pct': 0.012821170199185697, 'bull_tp_mult': 1.8107477072936051, 'bull_tsl_mult': 0.9985655560922364, 'bull_time_stop': 14, 'bull_use_sma': False, 'bull_use_ema': False, 'bull_use_atr': False, 'bull_use_adx': True, 'bull_use_spike': False, 'bull_rsi_required': False, 'bear_strategy': 'mean_reversion', 'bear_bb_std_mult': 2.7187073599604084, 'bear_rsi_os': 7, 'bear_rsi_ob': 81, 'bear_adx_thresh': 29.7987444683727, 'bear_atr_min_pct': 0.014714706169640393, 'bear_atr_max_pct': 0.05184480191076792, 'bear_tp_mult': 1.9181573534734397, 'bear_tsl_mult': 0.4019469748964381, 'bear_time_stop': 288, 'bear_use_sma': False, 'bear_use_ema': True, 'bear_use_atr': False, 'bear_use_adx': True, 'bear_use_spike': False, 'bear_rsi_required': False, 'sideways_strategy': 'mean_reversion', 'sideways_bb_std_mult': 3.2540511481274885, 'sideways_rsi_os': 8, 'sideways_rsi_ob': 87, 'sideways_adx_thresh': 7.836013376879229, 'sideways_atr_min_pct': 0.005435643058724308, 'sideways_atr_max_pct': 0.1425782554000834, 'sideways_tp_mult': 2.001699817802729, 'sideways_tsl_mult': 0.2111809012107915, 'sideways_time_stop': 68, 'sideways_use_sma': False, 'sideways_use_ema': True, 'sideways_use_atr': False, 'sideways_use_adx': False, 'sideways_use_spike': True, 'sideways_rsi_required': True}.
[I 2025-09-01 14:31:33,575] Trial 249 finished with values: [-1000000000.0, 1000000000.0] and parameters: {'p_sma': 13, 'p_std': 38, 'p_atr': 20, 'p_adx': 25, 'rsi_period': 36, 'ema1': 30, 'ema2': 53, 'slip_atr_k': 0.08259328661208591, 'slip_spread_k': 0.2500919681817371, 'spread_hl_frac': 0.013683165962247057, 'bb_std_mult': 1.0327506952506889, 'rsi_os': 5, 'rsi_ob': 75, 'vol_spike': 0.2880518294852956, 'adx_thresh': 34.23927303428852, 'atr_min_pct': 0.01291620842480235, 'atr_max_pct': 0.039428801311263396, 'tp_mult': 1.3430761798951005, 'tsl_mult': 0.03892201813424883, 'strategy': 'breakout', 'time_stop': 68, 'use_sma': True, 'use_atr': True, 'use_adx': True, 'use_ema': True, 'use_spike': True, 'rsi_required': False, 'edge_k': 0.5631089838776426, 'edge_cap': 0.44114691979346893, 'bull_strategy': 'breakout', 'bull_bb_std_mult': 2.877773747496922, 'bull_rsi_os': 19, 'bull_rsi_ob': 71, 'bull_adx_thresh': 11.738402529002549, 'bull_atr_min_pct': 0.023349399349410414, 'bull_atr_max_pct': 0.0613900480871682, 'bull_tp_mult': 1.807647456720514, 'bull_tsl_mult': 0.5182406282063645, 'bull_time_stop': 58, 'bull_use_sma': False, 'bull_use_ema': False, 'bull_use_atr': False, 'bull_use_adx': True, 'bull_use_spike': False, 'bull_rsi_required': False, 'bear_strategy': 'mean_reversion', 'bear_bb_std_mult': 2.745343111203328, 'bear_rsi_os': 31, 'bear_rsi_ob': 66, 'bear_adx_thresh': 29.778675765463777, 'bear_atr_min_pct': 0.014823449553200916, 'bear_atr_max_pct': 0.10569517094675537, 'bear_tp_mult': 2.0492291504015716, 'bear_tsl_mult': 0.650280140924738, 'bear_time_stop': 275, 'bear_use_sma': False, 'bear_use_ema': True, 'bear_use_atr': False, 'bear_use_adx': True, 'bear_use_spike': False, 'bear_rsi_required': False, 'sideways_strategy': 'mean_reversion', 'sideways_bb_std_mult': 2.2650506732435436, 'sideways_rsi_os': 9, 'sideways_rsi_ob': 92, 'sideways_adx_thresh': 8.032790016060838, 'sideways_atr_min_pct': 0.01811685783612097, 'sideways_atr_max_pct': 0.14210586421654167, 'sideways_tp_mult': 1.6108673406599467, 'sideways_tsl_mult': 0.017872426605185288, 'sideways_time_stop': 114, 'sideways_use_sma': False, 'sideways_use_ema': True, 'sideways_use_atr': False, 'sideways_use_adx': False, 'sideways_use_spike': True, 'sideways_rsi_required': True}.
[I 2025-09-01 14:31:33,992] Trial 250 finished with values: [-1000000000.0, 1000000000.0] and parameters: {'p_sma': 13, 'p_std': 6, 'p_atr': 20, 'p_adx': 25, 'rsi_period': 63, 'ema1': 30, 'ema2': 53, 'slip_atr_k': 0.046887968572379014, 'slip_spread_k': 0.7893386552672952, 'spread_hl_frac': 0.03041586912517172, 'bb_std_mult': 1.3831497703951934, 'rsi_os': 37, 'rsi_ob': 76, 'vol_spike': 0.29397533927214065, 'adx_thresh': 18.64604198741982, 'atr_min_pct': 0.004165788725623874, 'atr_max_pct': 0.07025489810231268, 'tp_mult': 2.0589742167294616, 'tsl_mult': 0.09436186124064536, 'strategy': 'breakout', 'time_stop': 68, 'use_sma': True, 'use_atr': True, 'use_adx': True, 'use_ema': True, 'use_spike': True, 'rsi_required': False, 'edge_k': 0.5532627205809683, 'edge_cap': 0.9448439346400153, 'bull_strategy': 'breakout', 'bull_bb_std_mult': 1.5409729774961276, 'bull_rsi_os': 55, 'bull_rsi_ob': 50, 'bull_adx_thresh': 11.844487261993693, 'bull_atr_min_pct': 0.013039655183279535, 'bull_atr_max_pct': 0.06184044202672498, 'bull_tp_mult': 1.8119447753280302, 'bull_tsl_mult': 0.5196317446492762, 'bull_time_stop': 253, 'bull_use_sma': False, 'bull_use_ema': False, 'bull_use_atr': False, 'bull_use_adx': True, 'bull_use_spike': False, 'bull_rsi_required': False, 'bear_strategy': 'mean_reversion', 'bear_bb_std_mult': 3.034152243105444, 'bear_rsi_os': 32, 'bear_rsi_ob': 77, 'bear_adx_thresh': 28.303799963059642, 'bear_atr_min_pct': 0.014957096753622702, 'bear_atr_max_pct': 0.05801473021549669, 'bear_tp_mult': 1.215963235389245, 'bear_tsl_mult': 0.649749053911411, 'bear_time_stop': 300, 'bear_use_sma': False, 'bear_use_ema': True, 'bear_use_atr': False, 'bear_use_adx': True, 'bear_use_spike': False, 'bear_rsi_required': False, 'sideways_strategy': 'mean_reversion', 'sideways_bb_std_mult': 3.0786643096995414, 'sideways_rsi_os': 6, 'sideways_rsi_ob': 87, 'sideways_adx_thresh': 7.709976144669103, 'sideways_atr_min_pct': 0.005466355537922097, 'sideways_atr_max_pct': 0.13655653712754037, 'sideways_tp_mult': 2.003656530124688, 'sideways_tsl_mult': 0.27262539081763454, 'sideways_time_stop': 116, 'sideways_use_sma': False, 'sideways_use_ema': True, 'sideways_use_atr': False, 'sideways_use_adx': False, 'sideways_use_spike': True, 'sideways_rsi_required': True}.
[I 2025-09-01 14:31:34,384] Trial 248 finished with values: [-1000000000.0, 1000000000.0] and parameters: {'p_sma': 10, 'p_std': 38, 'p_atr': 29, 'p_adx': 25, 'rsi_period': 63, 'ema1': 13, 'ema2': 34, 'slip_atr_k': 0.04757545532360133, 'slip_spread_k': 0.7604594160279836, 'spread_hl_frac': 0.014337968887107554, 'bb_std_mult': 0.6467056324456615, 'rsi_os': 37, 'rsi_ob': 82, 'vol_spike': 0.28995043049103264, 'adx_thresh': 5.047578893125847, 'atr_min_pct': 0.02014950890735328, 'atr_max_pct': 0.06897546058285177, 'tp_mult': 1.5650732030116181, 'tsl_mult': 0.39067598753090904, 'strategy': 'breakout', 'time_stop': 69, 'use_sma': True, 'use_atr': True, 'use_adx': True, 'use_ema': True, 'use_spike': True, 'rsi_required': False, 'edge_k': 0.26472773731234023, 'edge_cap': 0.43979224604357675, 'bull_strategy': 'breakout', 'bull_bb_std_mult': 0.6699893740137446, 'bull_rsi_os': 15, 'bull_rsi_ob': 50, 'bull_adx_thresh': 10.4663640451405, 'bull_atr_min_pct': 0.016607240130883636, 'bull_atr_max_pct': 0.020941984326289343, 'bull_tp_mult': 2.070284519819564, 'bull_tsl_mult': 0.386438901788727, 'bull_time_stop': 154, 'bull_use_sma': False, 'bull_use_ema': False, 'bull_use_atr': False, 'bull_use_adx': True, 'bull_use_spike': False, 'bull_rsi_required': False, 'bear_strategy': 'mean_reversion', 'bear_bb_std_mult': 2.0770677733807403, 'bear_rsi_os': 18, 'bear_rsi_ob': 77, 'bear_adx_thresh': 28.307857579993648, 'bear_atr_min_pct': 0.02384382565325292, 'bear_atr_max_pct': 0.10956870087894187, 'bear_tp_mult': 1.1407780462623118, 'bear_tsl_mult': 0.9987457272319246, 'bear_time_stop': 300, 'bear_use_sma': False, 'bear_use_ema': True, 'bear_use_atr': False, 'bear_use_adx': True, 'bear_use_spike': False, 'bear_rsi_required': False, 'sideways_strategy': 'mean_reversion', 'sideways_bb_std_mult': 3.08905283281144, 'sideways_rsi_os': 7, 'sideways_rsi_ob': 87, 'sideways_adx_thresh': 7.894687783882736, 'sideways_atr_min_pct': 0.018082666839497066, 'sideways_atr_max_pct': 0.14175922972894495, 'sideways_tp_mult': 1.61423539938798, 'sideways_tsl_mult': 0.3498003287521537, 'sideways_time_stop': 109, 'sideways_use_sma': False, 'sideways_use_ema': True, 'sideways_use_atr': True, 'sideways_use_adx': False, 'sideways_use_spike': True, 'sideways_rsi_required': True}.
