[I 2025-09-01 14:41:22,946] Trial 316 finished with values: [-1000000000.0, 1000000000.0] and parameters: {'p_sma': 12, 'p_std': 39, 'p_atr': 22, 'p_adx': 7, 'rsi_period': 39, 'ema1': 10, 'ema2': 50, 'slip_atr_k': 0.050601957575015094, 'slip_spread_k': 0.09338068686223405, 'spread_hl_frac': 0.014122259625842112, 'bb_std_mult': 1.6171328695808065, 'rsi_os': 25, 'rsi_ob': 72, 'vol_spike': 0.08912590581219129, 'adx_thresh': 18.965091626256278, 'atr_min_pct': 0.026754743927166827, 'atr_max_pct': 0.07295017168839481, 'tp_mult': 2.902303449028299, 'tsl_mult': 0.941832950213215, 'strategy': 'mean_reversion', 'time_stop': 133, 'use_sma': True, 'use_atr': True, 'use_adx': False, 'use_ema': False, 'use_spike': True, 'rsi_required': False, 'edge_k': 0.5887388917775239, 'edge_cap': 0.07857482062970016, 'bull_strategy': 'breakout', 'bull_bb_std_mult': 2.906173809387935, 'bull_rsi_os': 16, 'bull_rsi_ob': 76, 'bull_adx_thresh': 25.68330716303939, 'bull_atr_min_pct': 0.024761426346497473, 'bull_atr_max_pct': 0.023403558519838455, 'bull_tp_mult': 2.592288321971157, 'bull_tsl_mult': 0.7927457619803784, 'bull_time_stop': 75, 'bull_use_sma': False, 'bull_use_ema': False, 'bull_use_atr': False, 'bull_use_adx': False, 'bull_use_spike': False, 'bull_rsi_required': True, 'bear_strategy': 'breakout', 'bear_bb_std_mult': 1.8969285295067597, 'bear_rsi_os': 26, 'bear_rsi_ob': 77, 'bear_adx_thresh': 26.2520994105697, 'bear_atr_min_pct': 0.025773442882683018, 'bear_atr_max_pct': 0.11052522071152743, 'bear_tp_mult': 2.5449286292643456, 'bear_tsl_mult': 0.6568389349656921, 'bear_time_stop': 123, 'bear_use_sma': False, 'bear_use_ema': False, 'bear_use_atr': False, 'bear_use_adx': True, 'bear_use_spike': False, 'bear_rsi_required': True, 'sideways_strategy': 'mean_reversion', 'sideways_bb_std_mult': 0.9038362565161193, 'sideways_rsi_os': 16, 'sideways_rsi_ob': 88, 'sideways_adx_thresh': 16.740985272525784, 'sideways_atr_min_pct': 0.016181295232136822, 'sideways_atr_max_pct': 0.14689628669025903, 'sideways_tp_mult': 2.817659999272688, 'sideways_tsl_mult': 0.6244674889501292, 'sideways_time_stop': 120, 'sideways_use_sma': False, 'sideways_use_ema': False, 'sideways_use_atr': False, 'sideways_use_adx': True, 'sideways_use_spike': False, 'sideways_rsi_required': False}.
[I 2025-09-01 14:41:23,379] Trial 317 finished with values: [-1000000000.0, 1000000000.0] and parameters: {'p_sma': 29, 'p_std': 12, 'p_atr': 13, 'p_adx': 7, 'rsi_period': 36, 'ema1': 29, 'ema2': 52, 'slip_atr_k': 0.06624153692458559, 'slip_spread_k': 0.73658855748191, 'spread_hl_frac': 0.014376912615370267, 'bb_std_mult': 2.670928478537228, 'rsi_os': 35, 'rsi_ob': 75, 'vol_spike': 0.20700311931309734, 'adx_thresh': 7.641806429123774, 'atr_min_pct': 0.026403457750633248, 'atr_max_pct': 0.047865873441491284, 'tp_mult': 2.8846614799812267, 'tsl_mult': 0.48290213035686685, 'strategy': 'mean_reversion', 'time_stop': 64, 'use_sma': True, 'use_atr': True, 'use_adx': False, 'use_ema': False, 'use_spike': True, 'rsi_required': False, 'edge_k': 0.5735038027750615, 'edge_cap': 0.3051727211823438, 'bull_strategy': 'breakout', 'bull_bb_std_mult': 2.7441140148774172, 'bull_rsi_os': 51, 'bull_rsi_ob': 94, 'bull_adx_thresh': 10.912226434406769, 'bull_atr_min_pct': 0.024517407485315872, 'bull_atr_max_pct': 0.017804811437800213, 'bull_tp_mult': 2.2263563060940177, 'bull_tsl_mult': 0.3762941986681211, 'bull_time_stop': 259, 'bull_use_sma': False, 'bull_use_ema': False, 'bull_use_atr': False, 'bull_use_adx': False, 'bull_use_spike': False, 'bull_rsi_required': False, 'bear_strategy': 'breakout', 'bear_bb_std_mult': 2.9323156528566785, 'bear_rsi_os': 11, 'bear_rsi_ob': 66, 'bear_adx_thresh': 24.672459666400922, 'bear_atr_min_pct': 0.028993918698915225, 'bear_atr_max_pct': 0.02872519049307911, 'bear_tp_mult': 1.2993435461935336, 'bear_tsl_mult': 0.6526077192140353, 'bear_time_stop': 122, 'bear_use_sma': False, 'bear_use_ema': False, 'bear_use_atr': False, 'bear_use_adx': True, 'bear_use_spike': False, 'bear_rsi_required': True, 'sideways_strategy': 'mean_reversion', 'sideways_bb_std_mult': 3.4939919100508257, 'sideways_rsi_os': 19, 'sideways_rsi_ob': 59, 'sideways_adx_thresh': 16.88125234866989, 'sideways_atr_min_pct': 0.001715536292724076, 'sideways_atr_max_pct': 0.14758457854146462, 'sideways_tp_mult': 1.073828421360734, 'sideways_tsl_mult': 0.273845069900266, 'sideways_time_stop': 121, 'sideways_use_sma': False, 'sideways_use_ema': False, 'sideways_use_atr': False, 'sideways_use_adx': True, 'sideways_use_spike': False, 'sideways_rsi_required': False}.
[I 2025-09-01 14:41:23,379] Trial 314 finished with values: [-1000000000.0, 1000000000.0] and parameters: {'p_sma': 25, 'p_std': 17, 'p_atr': 22, 'p_adx': 26, 'rsi_period': 48, 'ema1': 28, 'ema2': 52, 'slip_atr_k': 0.06500245777535517, 'slip_spread_k': 0.09882860292473572, 'spread_hl_frac': 0.008077950826716584, 'bb_std_mult': 1.5902467685020387, 'rsi_os': 25, 'rsi_ob': 55, 'vol_spike': 0.17020217182558137, 'adx_thresh': 18.478371586096205, 'atr_min_pct': 0.015328188601217005, 'atr_max_pct': 0.07370785508397713, 'tp_mult': 2.9276359528836395, 'tsl_mult': 0.8498461019757148, 'strategy': 'mean_reversion', 'time_stop': 193, 'use_sma': True, 'use_atr': True, 'use_adx': False, 'use_ema': False, 'use_spike': True, 'rsi_required': False, 'edge_k': 0.5731872371137146, 'edge_cap': 0.07496713615754236, 'bull_strategy': 'breakout', 'bull_bb_std_mult': 0.750032174202893, 'bull_rsi_os': 51, 'bull_rsi_ob': 46, 'bull_adx_thresh': 25.547142252284445, 'bull_atr_min_pct': 0.014279266980067339, 'bull_atr_max_pct': 0.023837676756849703, 'bull_tp_mult': 2.38894410567984, 'bull_tsl_mult': 0.3760186843248279, 'bull_time_stop': 260, 'bull_use_sma': False, 'bull_use_ema': False, 'bull_use_atr': False, 'bull_use_adx': False, 'bull_use_spike': False, 'bull_rsi_required': True, 'bear_strategy': 'breakout', 'bear_bb_std_mult': 2.141909571394719, 'bear_rsi_os': 55, 'bear_rsi_ob': 77, 'bear_adx_thresh': 21.27518254665111, 'bear_atr_min_pct': 0.02892620120612231, 'bear_atr_max_pct': 0.1244627172206814, 'bear_tp_mult': 1.304663373154492, 'bear_tsl_mult': 0.69774069813599, 'bear_time_stop': 286, 'bear_use_sma': False, 'bear_use_ema': False, 'bear_use_atr': False, 'bear_use_adx': True, 'bear_use_spike': False, 'bear_rsi_required': True, 'sideways_strategy': 'mean_reversion', 'sideways_bb_std_mult': 3.4886839523631767, 'sideways_rsi_os': 16, 'sideways_rsi_ob': 88, 'sideways_adx_thresh': 6.387351881586875, 'sideways_atr_min_pct': 0.015303257248159625, 'sideways_atr_max_pct': 0.050550681750156305, 'sideways_tp_mult': 1.82028652168232, 'sideways_tsl_mult': 0.6239523222307067, 'sideways_time_stop': 120, 'sideways_use_sma': False, 'sideways_use_ema': False, 'sideways_use_atr': False, 'sideways_use_adx': True, 'sideways_use_spike': False, 'sideways_rsi_required': False}.
[I 2025-09-01 14:41:56,958] Trial 318 finished with values: [-1000000000.0, 1000000000.0] and parameters: {'p_sma': 10, 'p_std': 25, 'p_atr': 21, 'p_adx': 11, 'rsi_period': 66, 'ema1': 29, 'ema2': 52, 'slip_atr_k': 0.15896908826396622, 'slip_spread_k': 0.5532421632289903, 'spread_hl_frac': 0.012292236360978303, 'bb_std_mult': 2.6753672542871834, 'rsi_os': 35, 'rsi_ob': 57, 'vol_spike': 0.16923063482830739, 'adx_thresh': 18.455436089064484, 'atr_min_pct': 0.0010552413915184862, 'atr_max_pct': 0.08219080841756377, 'tp_mult': 2.9758984077417767, 'tsl_mult': 0.09024277394310536, 'strategy': 'breakout', 'time_stop': 193, 'use_sma': False, 'use_atr': False, 'use_adx': False, 'use_ema': False, 'use_spike': True, 'rsi_required': True, 'edge_k': 1.7948130106931692, 'edge_cap': 0.3678033243593469, 'bull_strategy': 'mean_reversion', 'bull_bb_std_mult': 2.7364355009277976, 'bull_rsi_os': 14, 'bull_rsi_ob': 50, 'bull_adx_thresh': 32.651979324557466, 'bull_atr_min_pct': 0.024548535320744132, 'bull_atr_max_pct': 0.015064556111708805, 'bull_tp_mult': 2.5913401483113985, 'bull_tsl_mult': 0.37948849188607475, 'bull_time_stop': 153, 'bull_use_sma': False, 'bull_use_ema': False, 'bull_use_atr': False, 'bull_use_adx': True, 'bull_use_spike': False, 'bull_rsi_required': False, 'bear_strategy': 'mean_reversion', 'bear_bb_std_mult': 2.930441503181065, 'bear_rsi_os': 11, 'bear_rsi_ob': 75, 'bear_adx_thresh': 29.50526661630457, 'bear_atr_min_pct': 0.020721719545836726, 'bear_atr_max_pct': 0.1161829095829794, 'bear_tp_mult': 1.3000981765023925, 'bear_tsl_mult': 0.6179421685774172, 'bear_time_stop': 235, 'bear_use_sma': False, 'bear_use_ema': True, 'bear_use_atr': False, 'bear_use_adx': True, 'bear_use_spike': True, 'bear_rsi_required': False, 'sideways_strategy': 'breakout', 'sideways_bb_std_mult': 1.7063806909241537, 'sideways_rsi_os': 16, 'sideways_rsi_ob': 88, 'sideways_adx_thresh': 6.486401239934631, 'sideways_atr_min_pct': 0.00615000343826584, 'sideways_atr_max_pct': 0.13148879491934704, 'sideways_tp_mult': 1.9587069220795568, 'sideways_tsl_mult': 0.2694277378246309, 'sideways_time_stop': 114, 'sideways_use_sma': True, 'sideways_use_ema': False, 'sideways_use_atr': True, 'sideways_use_adx': False, 'sideways_use_spike': True, 'sideways_rsi_required': True}.
[I 2025-09-01 14:41:57,094] Trial 319 finished with values: [-1000000000.0, 1000000000.0] and parameters: {'p_sma': 7, 'p_std': 25, 'p_atr': 21, 'p_adx': 26, 'rsi_period': 81, 'ema1': 29, 'ema2': 52, 'slip_atr_k': 0.06540723859845785, 'slip_spread_k': 0.23304003161766185, 'spread_hl_frac': 0.007773350844697775, 'bb_std_mult': 3.0089533675613653, 'rsi_os': 35, 'rsi_ob': 75, 'vol_spike': 0.017545805416896848, 'adx_thresh': 13.174264175184964, 'atr_min_pct': 0.0018902362628517456, 'atr_max_pct': 0.046645504348815, 'tp_mult': 1.160894430458007, 'tsl_mult': 0.08788080111795477, 'strategy': 'breakout', 'time_stop': 192, 'use_sma': False, 'use_atr': False, 'use_adx': True, 'use_ema': False, 'use_spike': True, 'rsi_required': True, 'edge_k': 0.4891656451501476, 'edge_cap': 0.07274974004264317, 'bull_strategy': 'mean_reversion', 'bull_bb_std_mult': 2.7730767580935005, 'bull_rsi_os': 46, 'bull_rsi_ob': 50, 'bull_adx_thresh': 32.16203676374134, 'bull_atr_min_pct': 0.01881107172157967, 'bull_atr_max_pct': 0.0919761017716115, 'bull_tp_mult': 2.1743934568708454, 'bull_tsl_mult': 0.37441794093446157, 'bull_time_stop': 271, 'bull_use_sma': True, 'bull_use_ema': False, 'bull_use_atr': False, 'bull_use_adx': True, 'bull_use_spike': False, 'bull_rsi_required': False, 'bear_strategy': 'mean_reversion', 'bear_bb_std_mult': 2.9448038463399566, 'bear_rsi_os': 11, 'bear_rsi_ob': 51, 'bear_adx_thresh': 29.556207809122505, 'bear_atr_min_pct': 0.025004619671418888, 'bear_atr_max_pct': 0.13251326549202624, 'bear_tp_mult': 2.482947059576571, 'bear_tsl_mult': 0.8555521293041699, 'bear_time_stop': 297, 'bear_use_sma': False, 'bear_use_ema': True, 'bear_use_atr': False, 'bear_use_adx': True, 'bear_use_spike': True, 'bear_rsi_required': False, 'sideways_strategy': 'breakout', 'sideways_bb_std_mult': 3.48829689411064, 'sideways_rsi_os': 18, 'sideways_rsi_ob': 74, 'sideways_adx_thresh': 20.473553317997595, 'sideways_atr_min_pct': 0.021108026123698997, 'sideways_atr_max_pct': 0.1392841182305975, 'sideways_tp_mult': 1.9930292702210073, 'sideways_tsl_mult': 0.21377162799421717, 'sideways_time_stop': 111, 'sideways_use_sma': True, 'sideways_use_ema': False, 'sideways_use_atr': True, 'sideways_use_adx': False, 'sideways_use_spike': True, 'sideways_rsi_required': True}.
[I 2025-09-01 14:41:57,309] Trial 320 finished with values: [-1000000000.0, 1000000000.0] and parameters: {'p_sma': 7, 'p_std': 12, 'p_atr': 21, 'p_adx': 26, 'rsi_period': 66, 'ema1': 27, 'ema2': 59, 'slip_atr_k': 0.056153136257291965, 'slip_spread_k': 0.22797422595996467, 'spread_hl_frac': 0.012368136043652282, 'bb_std_mult': 3.4300260171930828, 'rsi_os': 6, 'rsi_ob': 76, 'vol_spike': 0.2937416542015952, 'adx_thresh': 20.66301393368472, 'atr_min_pct': 0.01736335250348642, 'atr_max_pct': 0.0883857203222145, 'tp_mult': 2.9770606832786397, 'tsl_mult': 0.08937691702167942, 'strategy': 'breakout', 'time_stop': 294, 'use_sma': False, 'use_atr': False, 'use_adx': True, 'use_ema': False, 'use_spike': True, 'rsi_required': True, 'edge_k': 0.26596183540140117, 'edge_cap': 0.3540482651783482, 'bull_strategy': 'mean_reversion', 'bull_bb_std_mult': 2.808379784451288, 'bull_rsi_os': 14, 'bull_rsi_ob': 50, 'bull_adx_thresh': 32.387428890950986, 'bull_atr_min_pct': 0.01108210691639724, 'bull_atr_max_pct': 0.015873124642740412, 'bull_tp_mult': 2.003402839266467, 'bull_tsl_mult': 0.27125001136325766, 'bull_time_stop': 152, 'bull_use_sma': True, 'bull_use_ema': True, 'bull_use_atr': True, 'bull_use_adx': True, 'bull_use_spike': True, 'bull_rsi_required': False, 'bear_strategy': 'mean_reversion', 'bear_bb_std_mult': 2.729794464092939, 'bear_rsi_os': 9, 'bear_rsi_ob': 78, 'bear_adx_thresh': 29.915410336354917, 'bear_atr_min_pct': 0.023878166016464464, 'bear_atr_max_pct': 0.11624171513396102, 'bear_tp_mult': 2.4746740187146616, 'bear_tsl_mult': 0.12180693088578393, 'bear_time_stop': 197, 'bear_use_sma': False, 'bear_use_ema': True, 'bear_use_atr': False, 'bear_use_adx': False, 'bear_use_spike': True, 'bear_rsi_required': False, 'sideways_strategy': 'breakout', 'sideways_bb_std_mult': 1.2776701523108842, 'sideways_rsi_os': 18, 'sideways_rsi_ob': 92, 'sideways_adx_thresh': 8.30997793832912, 'sideways_atr_min_pct': 0.020284162990219335, 'sideways_atr_max_pct': 0.05563514006936193, 'sideways_tp_mult': 1.985575443034199, 'sideways_tsl_mult': 0.9777479599617316, 'sideways_time_stop': 114, 'sideways_use_sma': True, 'sideways_use_ema': False, 'sideways_use_atr': True, 'sideways_use_adx': False, 'sideways_use_spike': True, 'sideways_rsi_required': True}.
[I 2025-09-01 14:41:57,463] Trial 321 finished with values: [-1000000000.0, 1000000000.0] and parameters: {'p_sma': 8, 'p_std': 27, 'p_atr': 21, 'p_adx': 26, 'rsi_period': 31, 'ema1': 30, 'ema2': 34, 'slip_atr_k': 0.15076618035292988, 'slip_spread_k': 0.23636321567091267, 'spread_hl_frac': 0.012254967716162976, 'bb_std_mult': 1.4856738816449364, 'rsi_os': 41, 'rsi_ob': 88, 'vol_spike': 0.28704143873917853, 'adx_thresh': 20.659076753422166, 'atr_min_pct': 0.01614533947327168, 'atr_max_pct': 0.034247967109310766, 'tp_mult': 2.995105419548206, 'tsl_mult': 0.08715904169794558, 'strategy': 'breakout', 'time_stop': 293, 'use_sma': False, 'use_atr': False, 'use_adx': True, 'use_ema': False, 'use_spike': True, 'rsi_required': True, 'edge_k': 0.28100871105001124, 'edge_cap': 0.05010861725802988, 'bull_strategy': 'mean_reversion', 'bull_bb_std_mult': 2.8123460541731804, 'bull_rsi_os': 14, 'bull_rsi_ob': 73, 'bull_adx_thresh': 9.345949913448711, 'bull_atr_min_pct': 0.027731073924219224, 'bull_atr_max_pct': 0.01625884408614471, 'bull_tp_mult': 2.1631165358178146, 'bull_tsl_mult': 0.337455754334736, 'bull_time_stop': 19, 'bull_use_sma': True, 'bull_use_ema': True, 'bull_use_atr': True, 'bull_use_adx': True, 'bull_use_spike': True, 'bull_rsi_required': False, 'bear_strategy': 'mean_reversion', 'bear_bb_std_mult': 2.282822113777145, 'bear_rsi_os': 9, 'bear_rsi_ob': 80, 'bear_adx_thresh': 29.21030504939854, 'bear_atr_min_pct': 0.02492027318364366, 'bear_atr_max_pct': 0.03450740429014608, 'bear_tp_mult': 2.495782897805314, 'bear_tsl_mult': 0.8688231900010437, 'bear_time_stop': 114, 'bear_use_sma': False, 'bear_use_ema': True, 'bear_use_atr': False, 'bear_use_adx': False, 'bear_use_spike': True, 'bear_rsi_required': False, 'sideways_strategy': 'breakout', 'sideways_bb_std_mult': 1.2820788461468313, 'sideways_rsi_os': 18, 'sideways_rsi_ob': 61, 'sideways_adx_thresh': 6.976812055218606, 'sideways_atr_min_pct': 0.0048331533681013, 'sideways_atr_max_pct': 0.13808832921156397, 'sideways_tp_mult': 1.9643079472413856, 'sideways_tsl_mult': 0.35278150315497403, 'sideways_time_stop': 112, 'sideways_use_sma': True, 'sideways_use_ema': False, 'sideways_use_atr': True, 'sideways_use_adx': False, 'sideways_use_spike': True, 'sideways_rsi_required': True}.
[I 2025-09-01 14:42:35,149] Trial 325 finished with values: [-1000000000.0, 1000000000.0] and parameters: {'p_sma': 13, 'p_std': 37, 'p_atr': 19, 'p_adx': 24, 'rsi_period': 64, 'ema1': 30, 'ema2': 54, 'slip_atr_k': 0.05740203952473374, 'slip_spread_k': 0.7818120743718733, 'spread_hl_frac': 0.01715674400901219, 'bb_std_mult': 1.4619621073220936, 'rsi_os': 39, 'rsi_ob': 92, 'vol_spike': 0.19923447069989195, 'adx_thresh': 20.037362060470485, 'atr_min_pct': 0.014427157758284265, 'atr_max_pct': 0.09763306288544038, 'tp_mult': 2.8245358797497566, 'tsl_mult': 0.04117358476028526, 'strategy': 'breakout', 'time_stop': 239, 'use_sma': False, 'use_atr': True, 'use_adx': True, 'use_ema': True, 'use_spike': True, 'rsi_required': False, 'edge_k': 1.581734356776343, 'edge_cap': 0.09922757317630021, 'bull_strategy': 'breakout', 'bull_bb_std_mult': 3.028599897390979, 'bull_rsi_os': 16, 'bull_rsi_ob': 49, 'bull_adx_thresh': 11.659224625571508, 'bull_atr_min_pct': 0.021005267738408315, 'bull_atr_max_pct': 0.14198565885271852, 'bull_tp_mult': 2.0498701209472996, 'bull_tsl_mult': 0.8693534138545771, 'bull_time_stop': 142, 'bull_use_sma': True, 'bull_use_ema': False, 'bull_use_atr': False, 'bull_use_adx': True, 'bull_use_spike': False, 'bull_rsi_required': True, 'bear_strategy': 'mean_reversion', 'bear_bb_std_mult': 1.639250096997244, 'bear_rsi_os': 31, 'bear_rsi_ob': 82, 'bear_adx_thresh': 28.014690294588963, 'bear_atr_min_pct': 0.009327379233731125, 'bear_atr_max_pct': 0.1135533121122314, 'bear_tp_mult': 1.4787901819673182, 'bear_tsl_mult': 0.1921636638766302, 'bear_time_stop': 48, 'bear_use_sma': True, 'bear_use_ema': False, 'bear_use_atr': True, 'bear_use_adx': True, 'bear_use_spike': False, 'bear_rsi_required': False, 'sideways_strategy': 'mean_reversion', 'sideways_bb_std_mult': 3.3812382385960382, 'sideways_rsi_os': 15, 'sideways_rsi_ob': 90, 'sideways_adx_thresh': 19.707750227585382, 'sideways_atr_min_pct': 0.0115460628491629, 'sideways_atr_max_pct': 0.029684528824633093, 'sideways_tp_mult': 2.6883285656483977, 'sideways_tsl_mult': 0.3192860732448683, 'sideways_time_stop': 12, 'sideways_use_sma': False, 'sideways_use_ema': True, 'sideways_use_atr': True, 'sideways_use_adx': False, 'sideways_use_spike': True, 'sideways_rsi_required': True}.
[I 2025-09-01 14:42:35,417] Trial 324 finished with values: [-1000000000.0, 1000000000.0] and parameters: {'p_sma': 13, 'p_std': 43, 'p_atr': 19, 'p_adx': 24, 'rsi_period': 63, 'ema1': 13, 'ema2': 54, 'slip_atr_k': 0.058181388581263746, 'slip_spread_k': 0.16990283024420344, 'spread_hl_frac': 0.029001693051469206, 'bb_std_mult': 1.4978765075170868, 'rsi_os': 39, 'rsi_ob': 81, 'vol_spike': 0.14787162186606062, 'adx_thresh': 34.0946882464073, 'atr_min_pct': 0.016219733915502806, 'atr_max_pct': 0.06831876510566434, 'tp_mult': 2.84157477139858, 'tsl_mult': 0.04250580381080658, 'strategy': 'breakout', 'time_stop': 74, 'use_sma': False, 'use_atr': True, 'use_adx': True, 'use_ema': True, 'use_spike': True, 'rsi_required': False, 'edge_k': 0.6148202849065909, 'edge_cap': 0.05153232179513151, 'bull_strategy': 'breakout', 'bull_bb_std_mult': 2.8317074689270214, 'bull_rsi_os': 18, 'bull_rsi_ob': 71, 'bull_adx_thresh': 14.223863012243417, 'bull_atr_min_pct': 0.02740888875658428, 'bull_atr_max_pct': 0.012043437700477277, 'bull_tp_mult': 2.0525174829737356, 'bull_tsl_mult': 0.34185551316357154, 'bull_time_stop': 160, 'bull_use_sma': True, 'bull_use_ema': False, 'bull_use_atr': False, 'bull_use_adx': True, 'bull_use_spike': True, 'bull_rsi_required': True, 'bear_strategy': 'mean_reversion', 'bear_bb_std_mult': 1.307432930379358, 'bear_rsi_os': 30, 'bear_rsi_ob': 80, 'bear_adx_thresh': 28.10268284504616, 'bear_atr_min_pct': 0.009139391484150107, 'bear_atr_max_pct': 0.14803468410592246, 'bear_tp_mult': 2.522073967731731, 'bear_tsl_mult': 0.6293844513126161, 'bear_time_stop': 276, 'bear_use_sma': True, 'bear_use_ema': False, 'bear_use_atr': False, 'bear_use_adx': True, 'bear_use_spike': False, 'bear_rsi_required': False, 'sideways_strategy': 'mean_reversion', 'sideways_bb_std_mult': 3.313124482026621, 'sideways_rsi_os': 15, 'sideways_rsi_ob': 90, 'sideways_adx_thresh': 7.28846702413529, 'sideways_atr_min_pct': 0.01733161060410521, 'sideways_atr_max_pct': 0.019430629146494245, 'sideways_tp_mult': 1.5283642781583535, 'sideways_tsl_mult': 0.3131204451387726, 'sideways_time_stop': 300, 'sideways_use_sma': False, 'sideways_use_ema': True, 'sideways_use_atr': True, 'sideways_use_adx': False, 'sideways_use_spike': True, 'sideways_rsi_required': True}.
