[I 2025-09-01 14:42:35,979] Trial 323 finished with values: [-1000000000.0, 1000000000.0] and parameters: {'p_sma': 12, 'p_std': 43, 'p_atr': 8, 'p_adx': 28, 'rsi_period': 64, 'ema1': 30, 'ema2': 55, 'slip_atr_k': 0.05780876961321241, 'slip_spread_k': 0.2230380632189927, 'spread_hl_frac': 0.0126192441033256, 'bb_std_mult': 1.4683084565538775, 'rsi_os': 39, 'rsi_ob': 88, 'vol_spike': 0.29461387195189814, 'adx_thresh': 20.735765302936713, 'atr_min_pct': 0.025298670699307173, 'atr_max_pct': 0.06836184057800603, 'tp_mult': 2.8373931331946958, 'tsl_mult': 0.3774768453924533, 'strategy': 'breakout', 'time_stop': 59, 'use_sma': False, 'use_atr': True, 'use_adx': True, 'use_ema': True, 'use_spike': True, 'rsi_required': False, 'edge_k': 0.4058478399943354, 'edge_cap': 0.05187321255104372, 'bull_strategy': 'breakout', 'bull_bb_std_mult': 2.834950826368379, 'bull_rsi_os': 55, 'bull_rsi_ob': 65, 'bull_adx_thresh': 20.309661585380777, 'bull_atr_min_pct': 0.011332863450557302, 'bull_atr_max_pct': 0.046853144432807754, 'bull_tp_mult': 2.0366803431854024, 'bull_tsl_mult': 0.6311126089524408, 'bull_time_stop': 278, 'bull_use_sma': True, 'bull_use_ema': True, 'bull_use_atr': True, 'bull_use_adx': True, 'bull_use_spike': True, 'bull_rsi_required': True, 'bear_strategy': 'mean_reversion', 'bear_bb_std_mult': 2.727238367067196, 'bear_rsi_os': 7, 'bear_rsi_ob': 78, 'bear_adx_thresh': 28.01216983670153, 'bear_atr_min_pct': 0.015749042841436536, 'bear_atr_max_pct': 0.1191814599312425, 'bear_tp_mult': 1.43828789865846, 'bear_tsl_mult': 0.19235885485578041, 'bear_time_stop': 174, 'bear_use_sma': False, 'bear_use_ema': False, 'bear_use_atr': False, 'bear_use_adx': False, 'bear_use_spike': False, 'bear_rsi_required': False, 'sideways_strategy': 'mean_reversion', 'sideways_bb_std_mult': 3.2931923749830596, 'sideways_rsi_os': 17, 'sideways_rsi_ob': 89, 'sideways_adx_thresh': 8.452913599000508, 'sideways_atr_min_pct': 0.01736211384350479, 'sideways_atr_max_pct': 0.13714761109876522, 'sideways_tp_mult': 1.7375887606064362, 'sideways_tsl_mult': 0.7855090221424197, 'sideways_time_stop': 12, 'sideways_use_sma': False, 'sideways_use_ema': True, 'sideways_use_atr': True, 'sideways_use_adx': False, 'sideways_use_spike': True, 'sideways_rsi_required': True}.
[I 2025-09-01 14:42:35,979] Trial 322 finished with values: [-1000000000.0, 1000000000.0] and parameters: {'p_sma': 8, 'p_std': 43, 'p_atr': 19, 'p_adx': 24, 'rsi_period': 64, 'ema1': 25, 'ema2': 25, 'slip_atr_k': 0.057251539338722374, 'slip_spread_k': 0.2503751282501198, 'spread_hl_frac': 0.016383741673341442, 'bb_std_mult': 1.498463886387535, 'rsi_os': 41, 'rsi_ob': 74, 'vol_spike': 0.2939393716155274, 'adx_thresh': 20.62553835381647, 'atr_min_pct': 0.01724990285921186, 'atr_max_pct': 0.09859975758652509, 'tp_mult': 2.196568316904675, 'tsl_mult': 0.37744103116662375, 'strategy': 'breakout', 'time_stop': 291, 'use_sma': False, 'use_atr': True, 'use_adx': True, 'use_ema': True, 'use_spike': True, 'rsi_required': False, 'edge_k': 0.6299274092220494, 'edge_cap': 0.050115453245637154, 'bull_strategy': 'breakout', 'bull_bb_std_mult': 2.8287220170003633, 'bull_rsi_os': 40, 'bull_rsi_ob': 49, 'bull_adx_thresh': 9.537962474341779, 'bull_atr_min_pct': 0.01612521896994076, 'bull_atr_max_pct': 0.0811109996345504, 'bull_tp_mult': 2.051822311523716, 'bull_tsl_mult': 0.3429480570287722, 'bull_time_stop': 141, 'bull_use_sma': True, 'bull_use_ema': True, 'bull_use_atr': True, 'bull_use_adx': True, 'bull_use_spike': True, 'bull_rsi_required': True, 'bear_strategy': 'mean_reversion', 'bear_bb_std_mult': 2.7207324819110186, 'bear_rsi_os': 7, 'bear_rsi_ob': 78, 'bear_adx_thresh': 34.635882854823244, 'bear_atr_min_pct': 0.02390743081081931, 'bear_atr_max_pct': 0.11957891388462533, 'bear_tp_mult': 1.4853931207156847, 'bear_tsl_mult': 0.6332821896472062, 'bear_time_stop': 281, 'bear_use_sma': False, 'bear_use_ema': False, 'bear_use_atr': False, 'bear_use_adx': False, 'bear_use_spike': False, 'bear_rsi_required': False, 'sideways_strategy': 'mean_reversion', 'sideways_bb_std_mult': 3.3812179941373754, 'sideways_rsi_os': 52, 'sideways_rsi_ob': 92, 'sideways_adx_thresh': 8.656477228831646, 'sideways_atr_min_pct': 0.005123515009564927, 'sideways_atr_max_pct': 0.10868878957163318, 'sideways_tp_mult': 2.6753533614065077, 'sideways_tsl_mult': 0.7854274775834047, 'sideways_time_stop': 224, 'sideways_use_sma': False, 'sideways_use_ema': True, 'sideways_use_atr': True, 'sideways_use_adx': False, 'sideways_use_spike': True, 'sideways_rsi_required': True}.
[I 2025-09-01 14:43:11,299] Trial 329 finished with values: [-1000000000.0, 1000000000.0] and parameters: {'p_sma': 10, 'p_std': 32, 'p_atr': 29, 'p_adx': 25, 'rsi_period': 68, 'ema1': 30, 'ema2': 21, 'slip_atr_k': 0.06264414073408135, 'slip_spread_k': 0.6192362218890982, 'spread_hl_frac': 0.034577484180509245, 'bb_std_mult': 1.9935679997304279, 'rsi_os': 36, 'rsi_ob': 73, 'vol_spike': 0.2826358775783666, 'adx_thresh': 19.421764933869433, 'atr_min_pct': 0.01565550205799193, 'atr_max_pct': 0.07584952007663397, 'tp_mult': 2.7733730232906835, 'tsl_mult': 0.021870794232745377, 'strategy': 'breakout', 'time_stop': 274, 'use_sma': False, 'use_atr': True, 'use_adx': True, 'use_ema': False, 'use_spike': False, 'rsi_required': False, 'edge_k': 0.5212664367338059, 'edge_cap': 0.7078814866397294, 'bull_strategy': 'breakout', 'bull_bb_std_mult': 2.9668062522941896, 'bull_rsi_os': 8, 'bull_rsi_ob': 47, 'bull_adx_thresh': 10.93241620864608, 'bull_atr_min_pct': 0.016955595248301553, 'bull_atr_max_pct': 0.017900926242941116, 'bull_tp_mult': 2.101567431293749, 'bull_tsl_mult': 0.3965594902400073, 'bull_time_stop': 135, 'bull_use_sma': True, 'bull_use_ema': False, 'bull_use_atr': False, 'bull_use_adx': True, 'bull_use_spike': False, 'bull_rsi_required': True, 'bear_strategy': 'mean_reversion', 'bear_bb_std_mult': 0.6714258894480754, 'bear_rsi_os': 6, 'bear_rsi_ob': 74, 'bear_adx_thresh': 15.59741618838416, 'bear_atr_min_pct': 0.021725521358313016, 'bear_atr_max_pct': 0.058930075471565035, 'bear_tp_mult': 2.5777153937512125, 'bear_tsl_mult': 0.027051904437862317, 'bear_time_stop': 287, 'bear_use_sma': False, 'bear_use_ema': False, 'bear_use_atr': True, 'bear_use_adx': True, 'bear_use_spike': False, 'bear_rsi_required': False, 'sideways_strategy': 'mean_reversion', 'sideways_bb_std_mult': 2.595236470780902, 'sideways_rsi_os': 32, 'sideways_rsi_ob': 86, 'sideways_adx_thresh': 29.84852152762149, 'sideways_atr_min_pct': 0.005809741644107307, 'sideways_atr_max_pct': 0.1310249242342092, 'sideways_tp_mult': 1.8583117276596288, 'sideways_tsl_mult': 0.3736397145101066, 'sideways_time_stop': 107, 'sideways_use_sma': False, 'sideways_use_ema': False, 'sideways_use_atr': True, 'sideways_use_adx': False, 'sideways_use_spike': True, 'sideways_rsi_required': True}.
[I 2025-09-01 14:43:11,308] Trial 328 finished with values: [-1000000000.0, 1000000000.0] and parameters: {'p_sma': 10, 'p_std': 7, 'p_atr': 29, 'p_adx': 25, 'rsi_period': 67, 'ema1': 12, 'ema2': 56, 'slip_atr_k': 0.14528755834639748, 'slip_spread_k': 0.3146781566934472, 'spread_hl_frac': 0.01792209176856001, 'bb_std_mult': 1.630116161516106, 'rsi_os': 28, 'rsi_ob': 61, 'vol_spike': 0.2877384891295234, 'adx_thresh': 9.724884741681333, 'atr_min_pct': 0.019651528694659165, 'atr_max_pct': 0.07117447490793487, 'tp_mult': 1.3194408841477003, 'tsl_mult': 0.019232516061536614, 'strategy': 'breakout', 'time_stop': 65, 'use_sma': False, 'use_atr': True, 'use_adx': True, 'use_ema': False, 'use_spike': False, 'rsi_required': False, 'edge_k': 0.476360280093153, 'edge_cap': 0.6949169627862588, 'bull_strategy': 'breakout', 'bull_bb_std_mult': 2.950868756482006, 'bull_rsi_os': 20, 'bull_rsi_ob': 81, 'bull_adx_thresh': 11.001205777591885, 'bull_atr_min_pct': 0.017258055835039057, 'bull_atr_max_pct': 0.13510821462872252, 'bull_tp_mult': 2.1002595606185777, 'bull_tsl_mult': 0.8266818184156327, 'bull_time_stop': 135, 'bull_use_sma': True, 'bull_use_ema': False, 'bull_use_atr': False, 'bull_use_adx': True, 'bull_use_spike': False, 'bull_rsi_required': True, 'bear_strategy': 'mean_reversion', 'bear_bb_std_mult': 2.853882698144659, 'bear_rsi_os': 42, 'bear_rsi_ob': 70, 'bear_adx_thresh': 21.896143950070538, 'bear_atr_min_pct': 0.02190995343496527, 'bear_atr_max_pct': 0.04476085848870504, 'bear_tp_mult': 2.448576847989499, 'bear_tsl_mult': 0.6094820098306601, 'bear_time_stop': 300, 'bear_use_sma': False, 'bear_use_ema': False, 'bear_use_atr': True, 'bear_use_adx': True, 'bear_use_spike': False, 'bear_rsi_required': False, 'sideways_strategy': 'mean_reversion', 'sideways_bb_std_mult': 3.1999386661523763, 'sideways_rsi_os': 14, 'sideways_rsi_ob': 76, 'sideways_adx_thresh': 26.535131847363154, 'sideways_atr_min_pct': 0.01275993572921056, 'sideways_atr_max_pct': 0.13131102911900033, 'sideways_tp_mult': 1.8539639915093835, 'sideways_tsl_mult': 0.410270491352172, 'sideways_time_stop': 274, 'sideways_use_sma': False, 'sideways_use_ema': False, 'sideways_use_atr': True, 'sideways_use_adx': False, 'sideways_use_spike': True, 'sideways_rsi_required': True}.
[I 2025-09-01 14:43:11,630] Trial 326 finished with values: [-1000000000.0, 1000000000.0] and parameters: {'p_sma': 12, 'p_std': 7, 'p_atr': 20, 'p_adx': 10, 'rsi_period': 69, 'ema1': 30, 'ema2': 26, 'slip_atr_k': 0.04917312312514559, 'slip_spread_k': 0.31164356216600614, 'spread_hl_frac': 0.013269693506150801, 'bb_std_mult': 1.7142734969084499, 'rsi_os': 36, 'rsi_ob': 83, 'vol_spike': 0.29993520966146126, 'adx_thresh': 19.588804122686867, 'atr_min_pct': 0.015732656500911053, 'atr_max_pct': 0.07197917612609214, 'tp_mult': 2.7687658151584724, 'tsl_mult': 0.061676176883335716, 'strategy': 'breakout', 'time_stop': 274, 'use_sma': False, 'use_atr': True, 'use_adx': True, 'use_ema': False, 'use_spike': False, 'rsi_required': False, 'edge_k': 0.4030813839315244, 'edge_cap': 0.155130657212151, 'bull_strategy': 'breakout', 'bull_bb_std_mult': 2.967930020361539, 'bull_rsi_os': 38, 'bull_rsi_ob': 47, 'bull_adx_thresh': 10.84495769992439, 'bull_atr_min_pct': 0.007299115253255245, 'bull_atr_max_pct': 0.01843291730748775, 'bull_tp_mult': 2.099450110638304, 'bull_tsl_mult': 0.8361914302774291, 'bull_time_stop': 161, 'bull_use_sma': True, 'bull_use_ema': False, 'bull_use_atr': False, 'bull_use_adx': True, 'bull_use_spike': False, 'bull_rsi_required': True, 'bear_strategy': 'mean_reversion', 'bear_bb_std_mult': 1.0480475883623075, 'bear_rsi_os': 35, 'bear_rsi_ob': 70, 'bear_adx_thresh': 20.33153330115929, 'bear_atr_min_pct': 0.021893350429732374, 'bear_atr_max_pct': 0.11977744411688666, 'bear_tp_mult': 2.582499721845195, 'bear_tsl_mult': 0.610416724279973, 'bear_time_stop': 172, 'bear_use_sma': False, 'bear_use_ema': False, 'bear_use_atr': False, 'bear_use_adx': True, 'bear_use_spike': False, 'bear_rsi_required': False, 'sideways_strategy': 'mean_reversion', 'sideways_bb_std_mult': 3.196229548804564, 'sideways_rsi_os': 30, 'sideways_rsi_ob': 86, 'sideways_adx_thresh': 29.978771544914053, 'sideways_atr_min_pct': 0.012743993123601121, 'sideways_atr_max_pct': 0.10956960012321462, 'sideways_tp_mult': 2.3946412211438233, 'sideways_tsl_mult': 0.052672418556591605, 'sideways_time_stop': 100, 'sideways_use_sma': False, 'sideways_use_ema': False, 'sideways_use_atr': True, 'sideways_use_adx': False, 'sideways_use_spike': True, 'sideways_rsi_required': True}.
[I 2025-09-01 14:43:11,793] Trial 327 finished with values: [-1000000000.0, 1000000000.0] and parameters: {'p_sma': 12, 'p_std': 32, 'p_atr': 20, 'p_adx': 25, 'rsi_period': 51, 'ema1': 30, 'ema2': 31, 'slip_atr_k': 0.05084104676619413, 'slip_spread_k': 0.8468128168690352, 'spread_hl_frac': 0.038902119345079034, 'bb_std_mult': 1.7257905006694139, 'rsi_os': 36, 'rsi_ob': 90, 'vol_spike': 0.294314930952834, 'adx_thresh': 19.675576021003863, 'atr_min_pct': 0.01576396314075476, 'atr_max_pct': 0.07067248371706855, 'tp_mult': 2.768327095489599, 'tsl_mult': 0.06528255084364572, 'strategy': 'breakout', 'time_stop': 59, 'use_sma': False, 'use_atr': True, 'use_adx': True, 'use_ema': False, 'use_spike': False, 'rsi_required': False, 'edge_k': 0.37926449307057775, 'edge_cap': 0.698368730269236, 'bull_strategy': 'breakout', 'bull_bb_std_mult': 0.5620783244637195, 'bull_rsi_os': 49, 'bull_rsi_ob': 65, 'bull_adx_thresh': 10.891877175630974, 'bull_atr_min_pct': 0.011982541547217925, 'bull_atr_max_pct': 0.04745878836947382, 'bull_tp_mult': 2.0994617265630175, 'bull_tsl_mult': 0.1905947395662263, 'bull_time_stop': 61, 'bull_use_sma': True, 'bull_use_ema': False, 'bull_use_atr': False, 'bull_use_adx': True, 'bull_use_spike': False, 'bull_rsi_required': True, 'bear_strategy': 'mean_reversion', 'bear_bb_std_mult': 2.6347588409787512, 'bear_rsi_os': 35, 'bear_rsi_ob': 78, 'bear_adx_thresh': 34.87754367528702, 'bear_atr_min_pct': 0.023535910610804962, 'bear_atr_max_pct': 0.11910187731403421, 'bear_tp_mult': 2.586733462769462, 'bear_tsl_mult': 0.6054015960529666, 'bear_time_stop': 282, 'bear_use_sma': False, 'bear_use_ema': False, 'bear_use_atr': False, 'bear_use_adx': True, 'bear_use_spike': False, 'bear_rsi_required': False, 'sideways_strategy': 'mean_reversion', 'sideways_bb_std_mult': 3.278152819229444, 'sideways_rsi_os': 32, 'sideways_rsi_ob': 86, 'sideways_adx_thresh': 8.77641725845773, 'sideways_atr_min_pct': 0.004166171755774937, 'sideways_atr_max_pct': 0.11122667419182768, 'sideways_tp_mult': 1.7513526903626873, 'sideways_tsl_mult': 0.29118238255168166, 'sideways_time_stop': 107, 'sideways_use_sma': False, 'sideways_use_ema': False, 'sideways_use_atr': True, 'sideways_use_adx': False, 'sideways_use_spike': True, 'sideways_rsi_required': True}.
[I 2025-09-01 14:43:12,417] Trial 333 finished with values: [-1000000000.0, 1000000000.0] and parameters: {'p_sma': 34, 'p_std': 10, 'p_atr': 20, 'p_adx': 25, 'rsi_period': 74, 'ema1': 29, 'ema2': 35, 'slip_atr_k': 0.1841134634861739, 'slip_spread_k': 0.27607832749728345, 'spread_hl_frac': 0.009739258662744952, 'bb_std_mult': 1.0676851690366962, 'rsi_os': 52, 'rsi_ob': 77, 'vol_spike': 0.2801583093744881, 'adx_thresh': 27.804341601822415, 'atr_min_pct': 0.012351890994630873, 'atr_max_pct': 0.09438576083959929, 'tp_mult': 2.380780095779266, 'tsl_mult': 0.06493803402692852, 'strategy': 'mean_reversion', 'time_stop': 18, 'use_sma': True, 'use_atr': False, 'use_adx': False, 'use_ema': False, 'use_spike': True, 'rsi_required': True, 'edge_k': 1.656150112010239, 'edge_cap': 0.0856099035044259, 'bull_strategy': 'mean_reversion', 'bull_bb_std_mult': 1.6314222369399216, 'bull_rsi_os': 18, 'bull_rsi_ob': 87, 'bull_adx_thresh': 8.758434104518324, 'bull_atr_min_pct': 0.019557802931587105, 'bull_atr_max_pct': 0.14979856211660397, 'bull_tp_mult': 1.8886922803823434, 'bull_tsl_mult': 0.3567416878256718, 'bull_time_stop': 150, 'bull_use_sma': False, 'bull_use_ema': False, 'bull_use_atr': False, 'bull_use_adx': False, 'bull_use_spike': False, 'bull_rsi_required': True, 'bear_strategy': 'breakout', 'bear_bb_std_mult': 2.800411684111554, 'bear_rsi_os': 8, 'bear_rsi_ob': 76, 'bear_adx_thresh': 19.050765348873284, 'bear_atr_min_pct': 0.006950794045492101, 'bear_atr_max_pct': 0.1086961715110178, 'bear_tp_mult': 2.5293690690773394, 'bear_tsl_mult': 0.49019685240367483, 'bear_time_stop': 294, 'bear_use_sma': True, 'bear_use_ema': True, 'bear_use_atr': False, 'bear_use_adx': True, 'bear_use_spike': True, 'bear_rsi_required': True, 'sideways_strategy': 'breakout', 'sideways_bb_std_mult': 3.3787416487659714, 'sideways_rsi_os': 16, 'sideways_rsi_ob': 89, 'sideways_adx_thresh': 25.36608015116987, 'sideways_atr_min_pct': 0.007427877038401554, 'sideways_atr_max_pct': 0.14354891048320828, 'sideways_tp_mult': 1.2378762321675225, 'sideways_tsl_mult': 0.8449275027254749, 'sideways_time_stop': 196, 'sideways_use_sma': True, 'sideways_use_ema': False, 'sideways_use_atr': False, 'sideways_use_adx': True, 'sideways_use_spike': False, 'sideways_rsi_required': False}.
[I 2025-09-01 14:43:12,559] Trial 334 finished with values: [-1000000000.0, 1000000000.0] and parameters: {'p_sma': 15, 'p_std': 19, 'p_atr': 10, 'p_adx': 25, 'rsi_period': 65, 'ema1': 6, 'ema2': 51, 'slip_atr_k': 0.06714519016576588, 'slip_spread_k': 0.20072185912826718, 'spread_hl_frac': 0.048555755448155116, 'bb_std_mult': 1.2479282107281189, 'rsi_os': 33, 'rsi_ob': 73, 'vol_spike': 0.2876122808660865, 'adx_thresh': 20.139465433107862, 'atr_min_pct': 0.014913349130907964, 'atr_max_pct': 0.013413156963249628, 'tp_mult': 2.4432530964820347, 'tsl_mult': 0.415138000556992, 'strategy': 'mean_reversion', 'time_stop': 53, 'use_sma': True, 'use_atr': True, 'use_adx': True, 'use_ema': False, 'use_spike': True, 'rsi_required': False, 'edge_k': 0.5394602581646273, 'edge_cap': 0.5273689228896195, 'bull_strategy': 'breakout', 'bull_bb_std_mult': 2.898700553578057, 'bull_rsi_os': 17, 'bull_rsi_ob': 52, 'bull_adx_thresh': 9.951324184318118, 'bull_atr_min_pct': 0.026456587467043213, 'bull_atr_max_pct': 0.05910535470443112, 'bull_tp_mult': 1.999010049363473, 'bull_tsl_mult': 0.3271411092097746, 'bull_time_stop': 156, 'bull_use_sma': True, 'bull_use_ema': False, 'bull_use_atr': False, 'bull_use_adx': True, 'bull_use_spike': False, 'bull_rsi_required': True, 'bear_strategy': 'breakout', 'bear_bb_std_mult': 1.1599868734911802, 'bear_rsi_os': 8, 'bear_rsi_ob': 85, 'bear_adx_thresh': 27.368784326139426, 'bear_atr_min_pct': 0.010206485536477837, 'bear_atr_max_pct': 0.08804843261371725, 'bear_tp_mult': 2.413034898749533, 'bear_tsl_mult': 0.5629760906555212, 'bear_time_stop': 5, 'bear_use_sma': False, 'bear_use_ema': False, 'bear_use_atr': False, 'bear_use_adx': True, 'bear_use_spike': False, 'bear_rsi_required': True, 'sideways_strategy': 'mean_reversion', 'sideways_bb_std_mult': 2.2453514885367745, 'sideways_rsi_os': 45, 'sideways_rsi_ob': 91, 'sideways_adx_thresh': 31.42035784011515, 'sideways_atr_min_pct': 0.005443207905778354, 'sideways_atr_max_pct': 0.1355113017910724, 'sideways_tp_mult': 1.6897359753640788, 'sideways_tsl_mult': 0.17353797728638332, 'sideways_time_stop': 165, 'sideways_use_sma': False, 'sideways_use_ema': False, 'sideways_use_atr': True, 'sideways_use_adx': True, 'sideways_use_spike': False, 'sideways_rsi_required': False}.
[I 2025-09-01 14:43:56,018] Trial 332 finished with values: [-1000000000.0, 1000000000.0] and parameters: {'p_sma': 21, 'p_std': 57, 'p_atr': 12, 'p_adx': 25, 'rsi_period': 65, 'ema1': 29, 'ema2': 50, 'slip_atr_k': 0.17101984740112888, 'slip_spread_k': 0.19431106639736817, 'spread_hl_frac': 0.043930954749048255, 'bb_std_mult': 1.0680264450656891, 'rsi_os': 34, 'rsi_ob': 59, 'vol_spike': 0.29396285241134096, 'adx_thresh': 20.02684509123811, 'atr_min_pct': 0.02906791551319867, 'atr_max_pct': 0.13816411190278027, 'tp_mult': 2.377166616794055, 'tsl_mult': 0.650245650761867, 'strategy': 'mean_reversion', 'time_stop': 55, 'use_sma': True, 'use_atr': False, 'use_adx': True, 'use_ema': False, 'use_spike': True, 'rsi_required': True, 'edge_k': 0.5498223037380645, 'edge_cap': 0.26043647393401104, 'bull_strategy': 'breakout', 'bull_bb_std_mult': 2.1270775083283118, 'bull_rsi_os': 17, 'bull_rsi_ob': 52, 'bull_adx_thresh': 22.945435132367404, 'bull_atr_min_pct': 0.0198027967419562, 'bull_atr_max_pct': 0.058557518548184695, 'bull_tp_mult': 2.1310329334822993, 'bull_tsl_mult': 0.35674604775212104, 'bull_time_stop': 149, 'bull_use_sma': True, 'bull_use_ema': False, 'bull_use_atr': False, 'bull_use_adx': False, 'bull_use_spike': False, 'bull_rsi_required': True, 'bear_strategy': 'breakout', 'bear_bb_std_mult': 2.63553485097049, 'bear_rsi_os': 8, 'bear_rsi_ob': 76, 'bear_adx_thresh': 27.013771596246333, 'bear_atr_min_pct': 0.023349620101401816, 'bear_atr_max_pct': 0.08811939169728812, 'bear_tp_mult': 2.5228796684892183, 'bear_tsl_mult': 0.9023245194959058, 'bear_time_stop': 102, 'bear_use_sma': True, 'bear_use_ema': False, 'bear_use_atr': False, 'bear_use_adx': True, 'bear_use_spike': True, 'bear_rsi_required': True, 'sideways_strategy': 'breakout', 'sideways_bb_std_mult': 1.5060078817875158, 'sideways_rsi_os': 47, 'sideways_rsi_ob': 87, 'sideways_adx_thresh': 31.401690142373344, 'sideways_atr_min_pct': 0.004271182494148186, 'sideways_atr_max_pct': 0.12302097570893547, 'sideways_tp_mult': 2.092976303796137, 'sideways_tsl_mult': 0.2910843816531914, 'sideways_time_stop': 126, 'sideways_use_sma': True, 'sideways_use_ema': False, 'sideways_use_atr': False, 'sideways_use_adx': True, 'sideways_use_spike': False, 'sideways_rsi_required': False}.
