[I 2025-09-01 14:13:26,376] Trial 133 finished with values: [-1000000000.0, 1000000000.0] and parameters: {'p_sma': 48, 'p_std': 48, 'p_atr': 20, 'p_adx': 29, 'rsi_period': 26, 'ema1': 16, 'ema2': 37, 'slip_atr_k': 0.09440463589752164, 'slip_spread_k': 0.3932434440678171, 'spread_hl_frac': 0.017479392160461394, 'bb_std_mult': 0.9141652249443148, 'rsi_os': 16, 'rsi_ob': 74, 'vol_spike': 0.009900762528299072, 'adx_thresh': 12.428326558501194, 'atr_min_pct': 0.007565922219055422, 'atr_max_pct': 0.12135693924260015, 'tp_mult': 1.8050855551483245, 'tsl_mult': 0.9851302892820972, 'strategy': 'mean_reversion', 'time_stop': 220, 'use_sma': True, 'use_atr': False, 'use_adx': False, 'use_ema': False, 'use_spike': False, 'rsi_required': True, 'edge_k': 1.1314965166821553, 'edge_cap': 0.9505799754769768, 'bull_strategy': 'mean_reversion', 'bull_bb_std_mult': 0.9819219101091752, 'bull_rsi_os': 34, 'bull_rsi_ob': 77, 'bull_adx_thresh': 5.850402112850084, 'bull_atr_min_pct': 0.0011937613634824262, 'bull_atr_max_pct': 0.13197279362609096, 'bull_tp_mult': 1.5263789142473367, 'bull_tsl_mult': 0.07003884414077648, 'bull_time_stop': 154, 'bull_use_sma': True, 'bull_use_ema': True, 'bull_use_atr': True, 'bull_use_adx': True, 'bull_use_spike': False, 'bull_rsi_required': False, 'bear_strategy': 'breakout', 'bear_bb_std_mult': 0.8761065872488178, 'bear_rsi_os': 49, 'bear_rsi_ob': 87, 'bear_adx_thresh': 14.554224948478288, 'bear_atr_min_pct': 0.00909645851329199, 'bear_atr_max_pct': 0.014220778431979952, 'bear_tp_mult': 2.607911048333831, 'bear_tsl_mult': 0.6747155865975194, 'bear_time_stop': 252, 'bear_use_sma': True, 'bear_use_ema': True, 'bear_use_atr': True, 'bear_use_adx': False, 'bear_use_spike': True, 'bear_rsi_required': True, 'sideways_strategy': 'breakout', 'sideways_bb_std_mult': 2.115792675624646, 'sideways_rsi_os': 10, 'sideways_rsi_ob': 63, 'sideways_adx_thresh': 15.372700676157308, 'sideways_atr_min_pct': 0.021664961883112423, 'sideways_atr_max_pct': 0.04500279603848133, 'sideways_tp_mult': 1.2416564283827323, 'sideways_tsl_mult': 0.6440853694616201, 'sideways_time_stop': 109, 'sideways_use_sma': True, 'sideways_use_ema': True, 'sideways_use_atr': True, 'sideways_use_adx': False, 'sideways_use_spike': True, 'sideways_rsi_required': True}.
[I 2025-09-01 14:13:26,762] Trial 134 finished with values: [-1000000000.0, 1000000000.0] and parameters: {'p_sma': 30, 'p_std': 48, 'p_atr': 25, 'p_adx': 21, 'rsi_period': 59, 'ema1': 19, 'ema2': 16, 'slip_atr_k': 0.09788350108003856, 'slip_spread_k': 0.39876947156904097, 'spread_hl_frac': 0.017404460034532578, 'bb_std_mult': 2.21209296889966, 'rsi_os': 16, 'rsi_ob': 73, 'vol_spike': 0.25827523211029807, 'adx_thresh': 24.41359357473808, 'atr_min_pct': 0.026522433360328855, 'atr_max_pct': 0.11675857199051508, 'tp_mult': 1.392740822751553, 'tsl_mult': 0.9977902546304449, 'strategy': 'mean_reversion', 'time_stop': 208, 'use_sma': False, 'use_atr': False, 'use_adx': False, 'use_ema': False, 'use_spike': False, 'rsi_required': True, 'edge_k': 1.0357428523689565, 'edge_cap': 0.9773594546191005, 'bull_strategy': 'mean_reversion', 'bull_bb_std_mult': 0.9350484822744187, 'bull_rsi_os': 54, 'bull_rsi_ob': 52, 'bull_adx_thresh': 21.56165151546273, 'bull_atr_min_pct': 0.0009569614090654692, 'bull_atr_max_pct': 0.14809548038868792, 'bull_tp_mult': 1.5223271483770235, 'bull_tsl_mult': 0.7771129103412515, 'bull_time_stop': 33, 'bull_use_sma': True, 'bull_use_ema': True, 'bull_use_atr': True, 'bull_use_adx': True, 'bull_use_spike': False, 'bull_rsi_required': True, 'bear_strategy': 'breakout', 'bear_bb_std_mult': 2.031898487817164, 'bear_rsi_os': 14, 'bear_rsi_ob': 90, 'bear_adx_thresh': 14.534239085861667, 'bear_atr_min_pct': 0.009699076844531179, 'bear_atr_max_pct': 0.013560868829155762, 'bear_tp_mult': 2.7815163795164, 'bear_tsl_mult': 0.33177580299774057, 'bear_time_stop': 253, 'bear_use_sma': True, 'bear_use_ema': True, 'bear_use_atr': True, 'bear_use_adx': False, 'bear_use_spike': True, 'bear_rsi_required': True, 'sideways_strategy': 'breakout', 'sideways_bb_std_mult': 2.1143550671236513, 'sideways_rsi_os': 10, 'sideways_rsi_ob': 94, 'sideways_adx_thresh': 33.666767322187376, 'sideways_atr_min_pct': 0.0082256443895848, 'sideways_atr_max_pct': 0.14263746467725458, 'sideways_tp_mult': 1.2635712035696236, 'sideways_tsl_mult': 0.5741579930920919, 'sideways_time_stop': 112, 'sideways_use_sma': True, 'sideways_use_ema': True, 'sideways_use_atr': True, 'sideways_use_adx': False, 'sideways_use_spike': True, 'sideways_rsi_required': True}.
[I 2025-09-01 14:14:10,116] Trial 140 finished with values: [-1000000000.0, 1000000000.0] and parameters: {'p_sma': 45, 'p_std': 13, 'p_atr': 9, 'p_adx': 20, 'rsi_period': 38, 'ema1': 6, 'ema2': 33, 'slip_atr_k': 0.14920980440757284, 'slip_spread_k': 0.37153516790822144, 'spread_hl_frac': 0.020861369363538912, 'bb_std_mult': 0.5979127137736324, 'rsi_os': 26, 'rsi_ob': 57, 'vol_spike': 0.2867065623984757, 'adx_thresh': 7.258962688260963, 'atr_min_pct': 0.0038961276413394946, 'atr_max_pct': 0.11316738586803822, 'tp_mult': 1.782600887782575, 'tsl_mult': 0.3847178470603938, 'strategy': 'breakout', 'time_stop': 194, 'use_sma': False, 'use_atr': True, 'use_adx': True, 'use_ema': True, 'use_spike': False, 'rsi_required': False, 'edge_k': 0.9203496852827715, 'edge_cap': 0.6124586347988393, 'bull_strategy': 'mean_reversion', 'bull_bb_std_mult': 2.8930708755180126, 'bull_rsi_os': 17, 'bull_rsi_ob': 50, 'bull_adx_thresh': 9.275449645919224, 'bull_atr_min_pct': 0.007595156367023046, 'bull_atr_max_pct': 0.11845501399752982, 'bull_tp_mult': 2.5572831421095765, 'bull_tsl_mult': 0.8470519179326637, 'bull_time_stop': 57, 'bull_use_sma': False, 'bull_use_ema': True, 'bull_use_atr': False, 'bull_use_adx': False, 'bull_use_spike': True, 'bull_rsi_required': True, 'bear_strategy': 'mean_reversion', 'bear_bb_std_mult': 1.013943026031379, 'bear_rsi_os': 18, 'bear_rsi_ob': 72, 'bear_adx_thresh': 11.882348667184592, 'bear_atr_min_pct': 0.02845849410102926, 'bear_atr_max_pct': 0.017716062884151916, 'bear_tp_mult': 2.7174756179534305, 'bear_tsl_mult': 0.37131230337427795, 'bear_time_stop': 25, 'bear_use_sma': False, 'bear_use_ema': False, 'bear_use_atr': True, 'bear_use_adx': True, 'bear_use_spike': False, 'bear_rsi_required': False, 'sideways_strategy': 'mean_reversion', 'sideways_bb_std_mult': 3.1278660080649288, 'sideways_rsi_os': 22, 'sideways_rsi_ob': 79, 'sideways_adx_thresh': 8.438464510623314, 'sideways_atr_min_pct': 0.009518251353114262, 'sideways_atr_max_pct': 0.10705564993801862, 'sideways_tp_mult': 2.1460098726590098, 'sideways_tsl_mult': 0.5238403365737679, 'sideways_time_stop': 122, 'sideways_use_sma': False, 'sideways_use_ema': False, 'sideways_use_atr': True, 'sideways_use_adx': True, 'sideways_use_spike': False, 'sideways_rsi_required': False}.
[I 2025-09-01 14:14:11,120] Trial 139 finished with values: [-1000000000.0, 1000000000.0] and parameters: {'p_sma': 7, 'p_std': 56, 'p_atr': 29, 'p_adx': 21, 'rsi_period': 57, 'ema1': 20, 'ema2': 45, 'slip_atr_k': 0.14928038171992192, 'slip_spread_k': 0.7217985053250673, 'spread_hl_frac': 0.020844869819553302, 'bb_std_mult': 2.537311824811038, 'rsi_os': 37, 'rsi_ob': 57, 'vol_spike': 0.04701837428562421, 'adx_thresh': 17.438625460785545, 'atr_min_pct': 0.013419364234503649, 'atr_max_pct': 0.04593337258996544, 'tp_mult': 1.3671181740839373, 'tsl_mult': 0.18094092116338106, 'strategy': 'breakout', 'time_stop': 195, 'use_sma': False, 'use_atr': True, 'use_adx': True, 'use_ema': True, 'use_spike': False, 'rsi_required': False, 'edge_k': 0.9078874115946718, 'edge_cap': 0.993620612327811, 'bull_strategy': 'mean_reversion', 'bull_bb_std_mult': 1.5514749914206507, 'bull_rsi_os': 30, 'bull_rsi_ob': 91, 'bull_adx_thresh': 9.088386615493288, 'bull_atr_min_pct': 0.0005234991970946307, 'bull_atr_max_pct': 0.1181578125015661, 'bull_tp_mult': 2.78493182334513, 'bull_tsl_mult': 0.7537909416970869, 'bull_time_stop': 109, 'bull_use_sma': False, 'bull_use_ema': True, 'bull_use_atr': True, 'bull_use_adx': False, 'bull_use_spike': True, 'bull_rsi_required': True, 'bear_strategy': 'mean_reversion', 'bear_bb_std_mult': 1.0228482144554807, 'bear_rsi_os': 9, 'bear_rsi_ob': 90, 'bear_adx_thresh': 12.020870456695372, 'bear_atr_min_pct': 0.00592207447341269, 'bear_atr_max_pct': 0.13911429119607932, 'bear_tp_mult': 1.3391710524414169, 'bear_tsl_mult': 0.31653638545205726, 'bear_time_stop': 54, 'bear_use_sma': False, 'bear_use_ema': False, 'bear_use_atr': True, 'bear_use_adx': False, 'bear_use_spike': False, 'bear_rsi_required': False, 'sideways_strategy': 'mean_reversion', 'sideways_bb_std_mult': 0.8221096492731994, 'sideways_rsi_os': 43, 'sideways_rsi_ob': 78, 'sideways_adx_thresh': 17.413990023523347, 'sideways_atr_min_pct': 0.009217576587971505, 'sideways_atr_max_pct': 0.07510059424978385, 'sideways_tp_mult': 2.136678489049697, 'sideways_tsl_mult': 0.5151111464404093, 'sideways_time_stop': 94, 'sideways_use_sma': False, 'sideways_use_ema': False, 'sideways_use_atr': True, 'sideways_use_adx': True, 'sideways_use_spike': False, 'sideways_rsi_required': False}.
[I 2025-09-01 14:14:11,680] Trial 138 finished with values: [-1000000000.0, 1000000000.0] and parameters: {'p_sma': 5, 'p_std': 39, 'p_atr': 9, 'p_adx': 21, 'rsi_period': 14, 'ema1': 8, 'ema2': 37, 'slip_atr_k': 0.22227941067637294, 'slip_spread_k': 0.7304957564515091, 'spread_hl_frac': 0.005542762918029319, 'bb_std_mult': 1.5971194949442407, 'rsi_os': 37, 'rsi_ob': 73, 'vol_spike': 0.07905812137419538, 'adx_thresh': 7.06339971543184, 'atr_min_pct': 0.01312926715244283, 'atr_max_pct': 0.11355774528793929, 'tp_mult': 1.7903263664974252, 'tsl_mult': 0.18664022882410058, 'strategy': 'breakout', 'time_stop': 148, 'use_sma': False, 'use_atr': False, 'use_adx': True, 'use_ema': True, 'use_spike': False, 'rsi_required': True, 'edge_k': 0.9140278547113689, 'edge_cap': 0.6248082944219033, 'bull_strategy': 'mean_reversion', 'bull_bb_std_mult': 0.9947855975347317, 'bull_rsi_os': 54, 'bull_rsi_ob': 52, 'bull_adx_thresh': 30.508462012403502, 'bull_atr_min_pct': 0.004398655822024293, 'bull_atr_max_pct': 0.08947141844002052, 'bull_tp_mult': 2.7466560133676063, 'bull_tsl_mult': 0.7255561107231703, 'bull_time_stop': 92, 'bull_use_sma': False, 'bull_use_ema': True, 'bull_use_atr': True, 'bull_use_adx': False, 'bull_use_spike': True, 'bull_rsi_required': True, 'bear_strategy': 'mean_reversion', 'bear_bb_std_mult': 0.8742652173816512, 'bear_rsi_os': 40, 'bear_rsi_ob': 93, 'bear_adx_thresh': 14.515310809908435, 'bear_atr_min_pct': 0.01721810014302976, 'bear_atr_max_pct': 0.017523389880186892, 'bear_tp_mult': 1.4754544175039799, 'bear_tsl_mult': 0.3295247847614684, 'bear_time_stop': 264, 'bear_use_sma': True, 'bear_use_ema': False, 'bear_use_atr': True, 'bear_use_adx': False, 'bear_use_spike': True, 'bear_rsi_required': False, 'sideways_strategy': 'breakout', 'sideways_bb_std_mult': 0.8200358625270956, 'sideways_rsi_os': 24, 'sideways_rsi_ob': 78, 'sideways_adx_thresh': 15.54292065592534, 'sideways_atr_min_pct': 0.009508203232163186, 'sideways_atr_max_pct': 0.10648115917057174, 'sideways_tp_mult': 1.7365349353858792, 'sideways_tsl_mult': 0.5162770585528066, 'sideways_time_stop': 110, 'sideways_use_sma': True, 'sideways_use_ema': False, 'sideways_use_atr': True, 'sideways_use_adx': True, 'sideways_use_spike': False, 'sideways_rsi_required': False}.
[I 2025-09-01 14:14:12,036] Trial 137 finished with values: [-1000000000.0, 1000000000.0] and parameters: {'p_sma': 25, 'p_std': 56, 'p_atr': 22, 'p_adx': 21, 'rsi_period': 57, 'ema1': 8, 'ema2': 28, 'slip_atr_k': 0.22785661648861846, 'slip_spread_k': 0.36338177369540064, 'spread_hl_frac': 0.020927115455905507, 'bb_std_mult': 2.3132131207122613, 'rsi_os': 26, 'rsi_ob': 57, 'vol_spike': 0.052808493771395175, 'adx_thresh': 7.154548182617733, 'atr_min_pct': 0.02605404732311485, 'atr_max_pct': 0.048637682878629046, 'tp_mult': 1.363417047867939, 'tsl_mult': 0.6791659079045239, 'strategy': 'breakout', 'time_stop': 126, 'use_sma': False, 'use_atr': False, 'use_adx': True, 'use_ema': True, 'use_spike': False, 'rsi_required': True, 'edge_k': 0.8759118695066446, 'edge_cap': 0.9745176996512013, 'bull_strategy': 'mean_reversion', 'bull_bb_std_mult': 1.135477298226028, 'bull_rsi_os': 54, 'bull_rsi_ob': 52, 'bull_adx_thresh': 9.185374518519135, 'bull_atr_min_pct': 0.014700889049068242, 'bull_atr_max_pct': 0.010682387085643619, 'bull_tp_mult': 2.5571026518529774, 'bull_tsl_mult': 0.7283874254292647, 'bull_time_stop': 109, 'bull_use_sma': False, 'bull_use_ema': True, 'bull_use_atr': True, 'bull_use_adx': False, 'bull_use_spike': True, 'bull_rsi_required': True, 'bear_strategy': 'mean_reversion', 'bear_bb_std_mult': 1.0151529795193572, 'bear_rsi_os': 49, 'bear_rsi_ob': 74, 'bear_adx_thresh': 14.452110491322502, 'bear_atr_min_pct': 0.00553003541056459, 'bear_atr_max_pct': 0.019340057397320053, 'bear_tp_mult': 2.0123770505477734, 'bear_tsl_mult': 0.37693986110198774, 'bear_time_stop': 18, 'bear_use_sma': True, 'bear_use_ema': False, 'bear_use_atr': True, 'bear_use_adx': False, 'bear_use_spike': True, 'bear_rsi_required': False, 'sideways_strategy': 'breakout', 'sideways_bb_std_mult': 0.8248359668899343, 'sideways_rsi_os': 20, 'sideways_rsi_ob': 77, 'sideways_adx_thresh': 8.678752598806225, 'sideways_atr_min_pct': 0.00947871666465366, 'sideways_atr_max_pct': 0.044970324570836544, 'sideways_tp_mult': 1.5395381012867726, 'sideways_tsl_mult': 0.5890316280898358, 'sideways_time_stop': 182, 'sideways_use_sma': True, 'sideways_use_ema': False, 'sideways_use_atr': True, 'sideways_use_adx': True, 'sideways_use_spike': False, 'sideways_rsi_required': False}.
[I 2025-09-01 14:14:12,572] Trial 144 finished with values: [-1000000000.0, 1000000000.0] and parameters: {'p_sma': 42, 'p_std': 60, 'p_atr': 18, 'p_adx': 15, 'rsi_period': 52, 'ema1': 29, 'ema2': 40, 'slip_atr_k': 0.20852943306859129, 'slip_spread_k': 0.8080050672388697, 'spread_hl_frac': 0.022998787978676053, 'bb_std_mult': 2.4165318886698386, 'rsi_os': 18, 'rsi_ob': 46, 'vol_spike': 0.26820363477783804, 'adx_thresh': 21.203064229490124, 'atr_min_pct': 0.006263953148287021, 'atr_max_pct': 0.1182751559723167, 'tp_mult': 1.9354949786587303, 'tsl_mult': 0.23572697243208854, 'strategy': 'mean_reversion', 'time_stop': 240, 'use_sma': True, 'use_atr': False, 'use_adx': True, 'use_ema': False, 'use_spike': True, 'rsi_required': True, 'edge_k': 0.0012160307512137924, 'edge_cap': 0.44329486506898064, 'bull_strategy': 'breakout', 'bull_bb_std_mult': 1.1977492824725708, 'bull_rsi_os': 29, 'bull_rsi_ob': 55, 'bull_adx_thresh': 10.816649945912303, 'bull_atr_min_pct': 1.5091893462240263e-05, 'bull_atr_max_pct': 0.08613107386440905, 'bull_tp_mult': 1.5868985159590552, 'bull_tsl_mult': 0.24795192015114925, 'bull_time_stop': 104, 'bull_use_sma': True, 'bull_use_ema': False, 'bull_use_atr': True, 'bull_use_adx': True, 'bull_use_spike': True, 'bull_rsi_required': True, 'bear_strategy': 'breakout', 'bear_bb_std_mult': 3.3099919825125355, 'bear_rsi_os': 11, 'bear_rsi_ob': 59, 'bear_adx_thresh': 34.93047109402285, 'bear_atr_min_pct': 0.018616346766611717, 'bear_atr_max_pct': 0.01011876920880472, 'bear_tp_mult': 1.8302297603635445, 'bear_tsl_mult': 0.9713441673786909, 'bear_time_stop': 276, 'bear_use_sma': True, 'bear_use_ema': False, 'bear_use_atr': False, 'bear_use_adx': False, 'bear_use_spike': True, 'bear_rsi_required': True, 'sideways_strategy': 'breakout', 'sideways_bb_std_mult': 3.0541995495223304, 'sideways_rsi_os': 23, 'sideways_rsi_ob': 54, 'sideways_adx_thresh': 23.015067631250982, 'sideways_atr_min_pct': 0.023934942676355233, 'sideways_atr_max_pct': 0.08872173901333459, 'sideways_tp_mult': 2.201894585660974, 'sideways_tsl_mult': 0.4536612626967469, 'sideways_time_stop': 136, 'sideways_use_sma': True, 'sideways_use_ema': False, 'sideways_use_atr': False, 'sideways_use_adx': True, 'sideways_use_spike': False, 'sideways_rsi_required': False}.
[I 2025-09-01 14:14:54,128] Trial 143 finished with values: [-1000000000.0, 1000000000.0] and parameters: {'p_sma': 42, 'p_std': 28, 'p_atr': 18, 'p_adx': 15, 'rsi_period': 52, 'ema1': 29, 'ema2': 40, 'slip_atr_k': 0.20721368136256227, 'slip_spread_k': 0.8091295703265611, 'spread_hl_frac': 0.018669787834304247, 'bb_std_mult': 3.4534086344400223, 'rsi_os': 18, 'rsi_ob': 68, 'vol_spike': 0.15624932373899963, 'adx_thresh': 19.98517134631108, 'atr_min_pct': 0.006409773637718253, 'atr_max_pct': 0.11902061705777196, 'tp_mult': 1.955909968254737, 'tsl_mult': 0.2238097062615962, 'strategy': 'mean_reversion', 'time_stop': 158, 'use_sma': True, 'use_atr': False, 'use_adx': True, 'use_ema': False, 'use_spike': True, 'rsi_required': True, 'edge_k': 1.5379341707570966, 'edge_cap': 0.882983993679312, 'bull_strategy': 'breakout', 'bull_bb_std_mult': 1.2053113676452643, 'bull_rsi_os': 29, 'bull_rsi_ob': 62, 'bull_adx_thresh': 11.912276596962277, 'bull_atr_min_pct': 0.023478874712971855, 'bull_atr_max_pct': 0.1232437426134056, 'bull_tp_mult': 1.5767280551381757, 'bull_tsl_mult': 0.015081017868861936, 'bull_time_stop': 103, 'bull_use_sma': True, 'bull_use_ema': False, 'bull_use_atr': True, 'bull_use_adx': True, 'bull_use_spike': True, 'bull_rsi_required': True, 'bear_strategy': 'breakout', 'bear_bb_std_mult': 2.2308631593868484, 'bear_rsi_os': 10, 'bear_rsi_ob': 92, 'bear_adx_thresh': 24.464985106423864, 'bear_atr_min_pct': 0.018430154597460693, 'bear_atr_max_pct': 0.07659975072447323, 'bear_tp_mult': 1.8278569291796258, 'bear_tsl_mult': 0.9567601848100339, 'bear_time_stop': 278, 'bear_use_sma': True, 'bear_use_ema': False, 'bear_use_atr': False, 'bear_use_adx': False, 'bear_use_spike': True, 'bear_rsi_required': True, 'sideways_strategy': 'breakout', 'sideways_bb_std_mult': 1.5674817301329869, 'sideways_rsi_os': 19, 'sideways_rsi_ob': 54, 'sideways_adx_thresh': 16.385120654835937, 'sideways_atr_min_pct': 0.010497189943888407, 'sideways_atr_max_pct': 0.08253878483563987, 'sideways_tp_mult': 2.2033401144380194, 'sideways_tsl_mult': 0.6212347632012609, 'sideways_time_stop': 57, 'sideways_use_sma': True, 'sideways_use_ema': False, 'sideways_use_atr': False, 'sideways_use_adx': True, 'sideways_use_spike': False, 'sideways_rsi_required': False}.
[I 2025-09-01 14:14:54,579] Trial 142 finished with values: [-1000000000.0, 1000000000.0] and parameters: {'p_sma': 44, 'p_std': 31, 'p_atr': 28, 'p_adx': 15, 'rsi_period': 77, 'ema1': 26, 'ema2': 39, 'slip_atr_k': 0.22146110804850497, 'slip_spread_k': 0.36226878439229115, 'spread_hl_frac': 0.022654941037825258, 'bb_std_mult': 2.3161677065661004, 'rsi_os': 14, 'rsi_ob': 87, 'vol_spike': 0.053321690024173654, 'adx_thresh': 14.818075657279156, 'atr_min_pct': 0.006409000793274362, 'atr_max_pct': 0.07167312058887743, 'tp_mult': 2.1417197758999795, 'tsl_mult': 0.23462836070303467, 'strategy': 'mean_reversion', 'time_stop': 125, 'use_sma': False, 'use_atr': False, 'use_adx': True, 'use_ema': False, 'use_spike': True, 'rsi_required': True, 'edge_k': 0.8689990318362033, 'edge_cap': 0.9050597729760645, 'bull_strategy': 'mean_reversion', 'bull_bb_std_mult': 1.3283520420762387, 'bull_rsi_os': 38, 'bull_rsi_ob': 93, 'bull_adx_thresh': 23.362793247304758, 'bull_atr_min_pct': 0.02383631695963332, 'bull_atr_max_pct': 0.0855848095246617, 'bull_tp_mult': 1.476661284941816, 'bull_tsl_mult': 0.7227745381908006, 'bull_time_stop': 141, 'bull_use_sma': True, 'bull_use_ema': False, 'bull_use_atr': True, 'bull_use_adx': True, 'bull_use_spike': True, 'bull_rsi_required': True, 'bear_strategy': 'breakout', 'bear_bb_std_mult': 0.582842611945633, 'bear_rsi_os': 10, 'bear_rsi_ob': 92, 'bear_adx_thresh': 28.690269591200348, 'bear_atr_min_pct': 0.016891999291110595, 'bear_atr_max_pct': 0.1304836566229992, 'bear_tp_mult': 1.442684017257656, 'bear_tsl_mult': 0.970969058981604, 'bear_time_stop': 277, 'bear_use_sma': True, 'bear_use_ema': False, 'bear_use_atr': False, 'bear_use_adx': False, 'bear_use_spike': True, 'bear_rsi_required': True, 'sideways_strategy': 'breakout', 'sideways_bb_std_mult': 2.974038708649091, 'sideways_rsi_os': 23, 'sideways_rsi_ob': 74, 'sideways_adx_thresh': 16.559433369617604, 'sideways_atr_min_pct': 0.02894511191179444, 'sideways_atr_max_pct': 0.02740705012346182, 'sideways_tp_mult': 2.1996871827497038, 'sideways_tsl_mult': 0.5039147410470252, 'sideways_time_stop': 181, 'sideways_use_sma': True, 'sideways_use_ema': False, 'sideways_use_atr': True, 'sideways_use_adx': True, 'sideways_use_spike': False, 'sideways_rsi_required': False}.
