[I 2025-09-01 14:56:45,350] Trial 414 finished with values: [-1000000000.0, 1000000000.0] and parameters: {'p_sma': 8, 'p_std': 7, 'p_atr': 19, 'p_adx': 28, 'rsi_period': 10, 'ema1': 30, 'ema2': 50, 'slip_atr_k': 0.018895387295684407, 'slip_spread_k': 0.5590737761681135, 'spread_hl_frac': 0.04893184901428608, 'bb_std_mult': 1.5322595726889834, 'rsi_os': 34, 'rsi_ob': 56, 'vol_spike': 0.28900997115965527, 'adx_thresh': 19.03389254384598, 'atr_min_pct': 0.015053687042995659, 'atr_max_pct': 0.07324677137510066, 'tp_mult': 2.9651980177606827, 'tsl_mult': 0.12329831100557045, 'strategy': 'mean_reversion', 'time_stop': 138, 'use_sma': False, 'use_atr': True, 'use_adx': True, 'use_ema': False, 'use_spike': True, 'rsi_required': False, 'edge_k': 0.7309893276299355, 'edge_cap': 0.34471734358221695, 'bull_strategy': 'breakout', 'bull_bb_std_mult': 2.495831689471984, 'bull_rsi_os': 16, 'bull_rsi_ob': 50, 'bull_adx_thresh': 10.703881159452141, 'bull_atr_min_pct': 0.004351661483019545, 'bull_atr_max_pct': 0.10090688802633561, 'bull_tp_mult': 2.103120146041804, 'bull_tsl_mult': 0.3562190969832753, 'bull_time_stop': 53, 'bull_use_sma': True, 'bull_use_ema': False, 'bull_use_atr': False, 'bull_use_adx': True, 'bull_use_spike': False, 'bull_rsi_required': True, 'bear_strategy': 'mean_reversion', 'bear_bb_std_mult': 1.2175570606896418, 'bear_rsi_os': 7, 'bear_rsi_ob': 78, 'bear_adx_thresh': 16.68851668575612, 'bear_atr_min_pct': 0.01706370660179983, 'bear_atr_max_pct': 0.10243167067121735, 'bear_tp_mult': 2.5561912227640926, 'bear_tsl_mult': 0.5905796933341839, 'bear_time_stop': 67, 'bear_use_sma': False, 'bear_use_ema': False, 'bear_use_atr': False, 'bear_use_adx': True, 'bear_use_spike': False, 'bear_rsi_required': False, 'sideways_strategy': 'mean_reversion', 'sideways_bb_std_mult': 3.316244207458676, 'sideways_rsi_os': 9, 'sideways_rsi_ob': 88, 'sideways_adx_thresh': 9.740050029241868, 'sideways_atr_min_pct': 0.02832995435811698, 'sideways_atr_max_pct': 0.0733443277494803, 'sideways_tp_mult': 2.9628031650014512, 'sideways_tsl_mult': 0.4280831823293501, 'sideways_time_stop': 108, 'sideways_use_sma': False, 'sideways_use_ema': False, 'sideways_use_atr': True, 'sideways_use_adx': False, 'sideways_use_spike': True, 'sideways_rsi_required': True}.
[I 2025-09-01 14:57:31,394] Trial 416 finished with values: [-1000000000.0, 1000000000.0] and parameters: {'p_sma': 8, 'p_std': 21, 'p_atr': 21, 'p_adx': 27, 'rsi_period': 75, 'ema1': 18, 'ema2': 38, 'slip_atr_k': 0.182757817545384, 'slip_spread_k': 0.0838279855799347, 'spread_hl_frac': 0.013320561453421764, 'bb_std_mult': 1.487990776414672, 'rsi_os': 34, 'rsi_ob': 60, 'vol_spike': 0.2233636250549066, 'adx_thresh': 19.133392404030687, 'atr_min_pct': 0.01505374355765818, 'atr_max_pct': 0.10526053320942957, 'tp_mult': 2.8017837362622107, 'tsl_mult': 0.8169482068818481, 'strategy': 'breakout', 'time_stop': 199, 'use_sma': False, 'use_atr': True, 'use_adx': False, 'use_ema': False, 'use_spike': False, 'rsi_required': False, 'edge_k': 0.5199896520024969, 'edge_cap': 0.06577935560442719, 'bull_strategy': 'breakout', 'bull_bb_std_mult': 3.11115573996517, 'bull_rsi_os': 22, 'bull_rsi_ob': 67, 'bull_adx_thresh': 6.348377999385928, 'bull_atr_min_pct': 0.007369265048501922, 'bull_atr_max_pct': 0.0230655405436906, 'bull_tp_mult': 1.0806005415420707, 'bull_tsl_mult': 0.2840926964582692, 'bull_time_stop': 147, 'bull_use_sma': True, 'bull_use_ema': False, 'bull_use_atr': False, 'bull_use_adx': False, 'bull_use_spike': True, 'bull_rsi_required': True, 'bear_strategy': 'breakout', 'bear_bb_std_mult': 1.9051869718392007, 'bear_rsi_os': 7, 'bear_rsi_ob': 65, 'bear_adx_thresh': 27.499741773967905, 'bear_atr_min_pct': 0.02323146899403848, 'bear_atr_max_pct': 0.07186335599389863, 'bear_tp_mult': 2.649011746189849, 'bear_tsl_mult': 0.6272954731862534, 'bear_time_stop': 272, 'bear_use_sma': True, 'bear_use_ema': False, 'bear_use_atr': False, 'bear_use_adx': True, 'bear_use_spike': False, 'bear_rsi_required': True, 'sideways_strategy': 'mean_reversion', 'sideways_bb_std_mult': 3.3244912698786977, 'sideways_rsi_os': 39, 'sideways_rsi_ob': 91, 'sideways_adx_thresh': 7.060494404710884, 'sideways_atr_min_pct': 0.029108704207976795, 'sideways_atr_max_pct': 0.1413866836981495, 'sideways_tp_mult': 1.3850800937532897, 'sideways_tsl_mult': 0.08251858207775192, 'sideways_time_stop': 31, 'sideways_use_sma': False, 'sideways_use_ema': False, 'sideways_use_atr': False, 'sideways_use_adx': False, 'sideways_use_spike': False, 'sideways_rsi_required': True}.
[I 2025-09-01 14:57:31,736] Trial 417 finished with values: [-1000000000.0, 1000000000.0] and parameters: {'p_sma': 21, 'p_std': 45, 'p_atr': 21, 'p_adx': 12, 'rsi_period': 41, 'ema1': 8, 'ema2': 26, 'slip_atr_k': 0.18150880398634495, 'slip_spread_k': 0.18908685556309776, 'spread_hl_frac': 0.013858077055767758, 'bb_std_mult': 3.240601633915586, 'rsi_os': 36, 'rsi_ob': 74, 'vol_spike': 0.2701866023620447, 'adx_thresh': 20.097184215690806, 'atr_min_pct': 0.015625813448553075, 'atr_max_pct': 0.09506903936382088, 'tp_mult': 2.8885468519989472, 'tsl_mult': 0.06601048823729709, 'strategy': 'breakout', 'time_stop': 241, 'use_sma': True, 'use_atr': False, 'use_adx': False, 'use_ema': False, 'use_spike': False, 'rsi_required': True, 'edge_k': 0.5234204805282924, 'edge_cap': 0.09225689493245044, 'bull_strategy': 'breakout', 'bull_bb_std_mult': 2.857249894965908, 'bull_rsi_os': 18, 'bull_rsi_ob': 84, 'bull_adx_thresh': 22.81134466064226, 'bull_atr_min_pct': 0.023915872039217516, 'bull_atr_max_pct': 0.050044566991505675, 'bull_tp_mult': 2.0498479909730283, 'bull_tsl_mult': 0.33520301891536175, 'bull_time_stop': 146, 'bull_use_sma': False, 'bull_use_ema': True, 'bull_use_atr': True, 'bull_use_adx': False, 'bull_use_spike': True, 'bull_rsi_required': True, 'bear_strategy': 'breakout', 'bear_bb_std_mult': 2.460044738940013, 'bear_rsi_os': 47, 'bear_rsi_ob': 62, 'bear_adx_thresh': 21.632220215646687, 'bear_atr_min_pct': 0.02308020732993401, 'bear_atr_max_pct': 0.06891093138521089, 'bear_tp_mult': 2.0703572643108306, 'bear_tsl_mult': 0.6305241984209254, 'bear_time_stop': 273, 'bear_use_sma': True, 'bear_use_ema': False, 'bear_use_atr': True, 'bear_use_adx': True, 'bear_use_spike': True, 'bear_rsi_required': True, 'sideways_strategy': 'breakout', 'sideways_bb_std_mult': 2.324346938792834, 'sideways_rsi_os': 39, 'sideways_rsi_ob': 91, 'sideways_adx_thresh': 16.47306938809587, 'sideways_atr_min_pct': 0.0032382937417791855, 'sideways_atr_max_pct': 0.11718154077172704, 'sideways_tp_mult': 2.6454573103858086, 'sideways_tsl_mult': 0.3241302027059802, 'sideways_time_stop': 124, 'sideways_use_sma': True, 'sideways_use_ema': False, 'sideways_use_atr': False, 'sideways_use_adx': False, 'sideways_use_spike': False, 'sideways_rsi_required': True}.
[I 2025-09-01 14:57:32,025] Trial 415 finished with values: [-1000000000.0, 1000000000.0] and parameters: {'p_sma': 17, 'p_std': 44, 'p_atr': 19, 'p_adx': 21, 'rsi_period': 32, 'ema1': 30, 'ema2': 50, 'slip_atr_k': 0.05850645307135594, 'slip_spread_k': 0.19561569624775277, 'spread_hl_frac': 0.013938326422074442, 'bb_std_mult': 1.491399708287982, 'rsi_os': 40, 'rsi_ob': 72, 'vol_spike': 0.2944424000386422, 'adx_thresh': 19.16590155220751, 'atr_min_pct': 0.02338901090186915, 'atr_max_pct': 0.07333348139193581, 'tp_mult': 2.785262680946005, 'tsl_mult': 0.048978349263265206, 'strategy': 'mean_reversion', 'time_stop': 56, 'use_sma': False, 'use_atr': True, 'use_adx': True, 'use_ema': False, 'use_spike': True, 'rsi_required': False, 'edge_k': 0.5196769127033349, 'edge_cap': 0.2696214016052423, 'bull_strategy': 'breakout', 'bull_bb_std_mult': 3.1295278454984836, 'bull_rsi_os': 22, 'bull_rsi_ob': 47, 'bull_adx_thresh': 10.108164402503972, 'bull_atr_min_pct': 0.004071960597791158, 'bull_atr_max_pct': 0.09920908670159337, 'bull_tp_mult': 2.3019703417953297, 'bull_tsl_mult': 0.6441768305470963, 'bull_time_stop': 272, 'bull_use_sma': True, 'bull_use_ema': False, 'bull_use_atr': False, 'bull_use_adx': False, 'bull_use_spike': False, 'bull_rsi_required': True, 'bear_strategy': 'mean_reversion', 'bear_bb_std_mult': 2.456079066200426, 'bear_rsi_os': 6, 'bear_rsi_ob': 95, 'bear_adx_thresh': 21.81235966137777, 'bear_atr_min_pct': 0.023096676387807928, 'bear_atr_max_pct': 0.10262887584911985, 'bear_tp_mult': 2.55038164891859, 'bear_tsl_mult': 0.5941387610028055, 'bear_time_stop': 272, 'bear_use_sma': False, 'bear_use_ema': False, 'bear_use_atr': False, 'bear_use_adx': True, 'bear_use_spike': False, 'bear_rsi_required': False, 'sideways_strategy': 'mean_reversion', 'sideways_bb_std_mult': 1.6307508258652579, 'sideways_rsi_os': 54, 'sideways_rsi_ob': 91, 'sideways_adx_thresh': 9.679602148888213, 'sideways_atr_min_pct': 0.028816626198712843, 'sideways_atr_max_pct': 0.14108619704606265, 'sideways_tp_mult': 2.6384202738455387, 'sideways_tsl_mult': 0.28140367876918565, 'sideways_time_stop': 107, 'sideways_use_sma': False, 'sideways_use_ema': False, 'sideways_use_atr': False, 'sideways_use_adx': False, 'sideways_use_spike': True, 'sideways_rsi_required': True}.
[I 2025-09-01 14:57:32,378] Trial 418 finished with values: [-1000000000.0, 1000000000.0] and parameters: {'p_sma': 33, 'p_std': 5, 'p_atr': 9, 'p_adx': 18, 'rsi_period': 59, 'ema1': 18, 'ema2': 12, 'slip_atr_k': 0.055339987393969094, 'slip_spread_k': 0.2083610922442955, 'spread_hl_frac': 0.02882634584579996, 'bb_std_mult': 1.645918907306494, 'rsi_os': 36, 'rsi_ob': 60, 'vol_spike': 0.22525384489377723, 'adx_thresh': 31.871386195896974, 'atr_min_pct': 0.016135856075079665, 'atr_max_pct': 0.09000692025513694, 'tp_mult': 2.784942386568159, 'tsl_mult': 0.06918932643251816, 'strategy': 'breakout', 'time_stop': 38, 'use_sma': True, 'use_atr': False, 'use_adx': False, 'use_ema': False, 'use_spike': False, 'rsi_required': True, 'edge_k': 0.5192185961937182, 'edge_cap': 0.064306271592161, 'bull_strategy': 'breakout', 'bull_bb_std_mult': 2.866129348589844, 'bull_rsi_os': 18, 'bull_rsi_ob': 68, 'bull_adx_thresh': 9.939098155494985, 'bull_atr_min_pct': 0.01144825053107851, 'bull_atr_max_pct': 0.03926159078253712, 'bull_tp_mult': 2.2210567383116024, 'bull_tsl_mult': 0.3322556081361133, 'bull_time_stop': 147, 'bull_use_sma': False, 'bull_use_ema': True, 'bull_use_atr': True, 'bull_use_adx': False, 'bull_use_spike': True, 'bull_rsi_required': True, 'bear_strategy': 'breakout', 'bear_bb_std_mult': 2.621998511917816, 'bear_rsi_os': 32, 'bear_rsi_ob': 74, 'bear_adx_thresh': 31.25556281337055, 'bear_atr_min_pct': 0.023776607771540517, 'bear_atr_max_pct': 0.10639343189813052, 'bear_tp_mult': 2.4951508274939305, 'bear_tsl_mult': 0.6377899219300963, 'bear_time_stop': 45, 'bear_use_sma': True, 'bear_use_ema': False, 'bear_use_atr': True, 'bear_use_adx': True, 'bear_use_spike': True, 'bear_rsi_required': True, 'sideways_strategy': 'breakout', 'sideways_bb_std_mult': 3.347670543278527, 'sideways_rsi_os': 15, 'sideways_rsi_ob': 91, 'sideways_adx_thresh': 16.51780849887507, 'sideways_atr_min_pct': 0.004848541092708189, 'sideways_atr_max_pct': 0.06814869773740474, 'sideways_tp_mult': 2.6343804772801764, 'sideways_tsl_mult': 0.3186974532456174, 'sideways_time_stop': 230, 'sideways_use_sma': True, 'sideways_use_ema': False, 'sideways_use_atr': False, 'sideways_use_adx': False, 'sideways_use_spike': False, 'sideways_rsi_required': True}.
[I 2025-09-01 14:58:09,575] Trial 420 finished with values: [-1000000000.0, 1000000000.0] and parameters: {'p_sma': 6, 'p_std': 11, 'p_atr': 20, 'p_adx': 21, 'rsi_period': 59, 'ema1': 10, 'ema2': 50, 'slip_atr_k': 0.054379881002615524, 'slip_spread_k': 0.3298635269355544, 'spread_hl_frac': 0.01259482878207771, 'bb_std_mult': 1.6449645238678903, 'rsi_os': 37, 'rsi_ob': 72, 'vol_spike': 0.29967294532918026, 'adx_thresh': 5.031357353725733, 'atr_min_pct': 0.018300948811168786, 'atr_max_pct': 0.07603153398868526, 'tp_mult': 2.934732970782697, 'tsl_mult': 0.049665588567051944, 'strategy': 'breakout', 'time_stop': 122, 'use_sma': False, 'use_atr': True, 'use_adx': True, 'use_ema': False, 'use_spike': True, 'rsi_required': False, 'edge_k': 0.4593334117680905, 'edge_cap': 0.26672011705868526, 'bull_strategy': 'breakout', 'bull_bb_std_mult': 0.8606785307615699, 'bull_rsi_os': 15, 'bull_rsi_ob': 47, 'bull_adx_thresh': 13.571867076866571, 'bull_atr_min_pct': 0.011430111635471767, 'bull_atr_max_pct': 0.03944182018000509, 'bull_tp_mult': 1.9732112016785879, 'bull_tsl_mult': 0.9517106198621137, 'bull_time_stop': 197, 'bull_use_sma': True, 'bull_use_ema': False, 'bull_use_atr': False, 'bull_use_adx': True, 'bull_use_spike': False, 'bull_rsi_required': True, 'bear_strategy': 'mean_reversion', 'bear_bb_std_mult': 2.6289353939321796, 'bear_rsi_os': 44, 'bear_rsi_ob': 60, 'bear_adx_thresh': 18.428541367799244, 'bear_atr_min_pct': 0.023983192457395275, 'bear_atr_max_pct': 0.08407748081825159, 'bear_tp_mult': 2.487032782548247, 'bear_tsl_mult': 0.6463300484797154, 'bear_time_stop': 261, 'bear_use_sma': False, 'bear_use_ema': False, 'bear_use_atr': False, 'bear_use_adx': True, 'bear_use_spike': False, 'bear_rsi_required': False, 'sideways_strategy': 'mean_reversion', 'sideways_bb_std_mult': 3.191009140571436, 'sideways_rsi_os': 20, 'sideways_rsi_ob': 76, 'sideways_adx_thresh': 6.714094792889455, 'sideways_atr_min_pct': 0.004941477988333097, 'sideways_atr_max_pct': 0.048176039381289774, 'sideways_tp_mult': 1.099503934432856, 'sideways_tsl_mult': 0.28148398806427216, 'sideways_time_stop': 236, 'sideways_use_sma': False, 'sideways_use_ema': False, 'sideways_use_atr': True, 'sideways_use_adx': False, 'sideways_use_spike': True, 'sideways_rsi_required': True}.
[I 2025-09-01 14:58:10,412] Trial 419 finished with values: [-1000000000.0, 1000000000.0] and parameters: {'p_sma': 16, 'p_std': 7, 'p_atr': 20, 'p_adx': 21, 'rsi_period': 59, 'ema1': 8, 'ema2': 50, 'slip_atr_k': 0.09923670376665097, 'slip_spread_k': 0.18931584709585375, 'spread_hl_frac': 0.0137820804288278, 'bb_std_mult': 0.8001919410952965, 'rsi_os': 36, 'rsi_ob': 74, 'vol_spike': 0.2708201188079176, 'adx_thresh': 20.116452789654467, 'atr_min_pct': 0.015626928148900248, 'atr_max_pct': 0.02912274570392339, 'tp_mult': 1.1998468229687607, 'tsl_mult': 0.0658161909036737, 'strategy': 'breakout', 'time_stop': 120, 'use_sma': True, 'use_atr': False, 'use_adx': True, 'use_ema': False, 'use_spike': True, 'rsi_required': True, 'edge_k': 0.5554736724117327, 'edge_cap': 0.0943334772637874, 'bull_strategy': 'breakout', 'bull_bb_std_mult': 2.9336274523182806, 'bull_rsi_os': 17, 'bull_rsi_ob': 47, 'bull_adx_thresh': 9.96332883809605, 'bull_atr_min_pct': 0.02393748371186215, 'bull_atr_max_pct': 0.012670654597673664, 'bull_tp_mult': 1.9750560981387189, 'bull_tsl_mult': 0.8887046760970179, 'bull_time_stop': 165, 'bull_use_sma': False, 'bull_use_ema': True, 'bull_use_atr': True, 'bull_use_adx': False, 'bull_use_spike': False, 'bull_rsi_required': True, 'bear_strategy': 'breakout', 'bear_bb_std_mult': 2.608017313118173, 'bear_rsi_os': 47, 'bear_rsi_ob': 60, 'bear_adx_thresh': 7.468859602461638, 'bear_atr_min_pct': 0.024804100998414496, 'bear_atr_max_pct': 0.10737704850176452, 'bear_tp_mult': 2.0771857510722214, 'bear_tsl_mult': 0.6429261238142476, 'bear_time_stop': 294, 'bear_use_sma': True, 'bear_use_ema': False, 'bear_use_atr': True, 'bear_use_adx': True, 'bear_use_spike': True, 'bear_rsi_required': False, 'sideways_strategy': 'breakout', 'sideways_bb_std_mult': 3.156190388735222, 'sideways_rsi_os': 15, 'sideways_rsi_ob': 76, 'sideways_adx_thresh': 19.52042074023118, 'sideways_atr_min_pct': 0.004787230991698727, 'sideways_atr_max_pct': 0.11449507085912036, 'sideways_tp_mult': 2.3946610555599905, 'sideways_tsl_mult': 0.3570697618774241, 'sideways_time_stop': 58, 'sideways_use_sma': True, 'sideways_use_ema': False, 'sideways_use_atr': False, 'sideways_use_adx': False, 'sideways_use_spike': True, 'sideways_rsi_required': True}.
[I 2025-09-01 14:58:11,066] Trial 421 finished with values: [-1000000000.0, 1000000000.0] and parameters: {'p_sma': 49, 'p_std': 6, 'p_atr': 13, 'p_adx': 23, 'rsi_period': 59, 'ema1': 23, 'ema2': 53, 'slip_atr_k': 0.15310232246286914, 'slip_spread_k': 0.31638199700528236, 'spread_hl_frac': 0.001335967987045418, 'bb_std_mult': 1.674182135955532, 'rsi_os': 37, 'rsi_ob': 48, 'vol_spike': 0.2996585666783772, 'adx_thresh': 18.409078819701552, 'atr_min_pct': 0.01611922579084594, 'atr_max_pct': 0.08283296451615955, 'tp_mult': 2.9308728142076568, 'tsl_mult': 0.10328164489176173, 'strategy': 'breakout', 'time_stop': 72, 'use_sma': False, 'use_atr': False, 'use_adx': True, 'use_ema': False, 'use_spike': True, 'rsi_required': True, 'edge_k': 0.584116952305476, 'edge_cap': 0.20649117084468005, 'bull_strategy': 'breakout', 'bull_bb_std_mult': 2.939200344018603, 'bull_rsi_os': 15, 'bull_rsi_ob': 56, 'bull_adx_thresh': 11.338392262582918, 'bull_atr_min_pct': 0.02635611466103393, 'bull_atr_max_pct': 0.013344909300023303, 'bull_tp_mult': 2.095190468874397, 'bull_tsl_mult': 0.3720646749297305, 'bull_time_stop': 168, 'bull_use_sma': False, 'bull_use_ema': True, 'bull_use_atr': True, 'bull_use_adx': True, 'bull_use_spike': False, 'bull_rsi_required': True, 'bear_strategy': 'mean_reversion', 'bear_bb_std_mult': 2.607094747063671, 'bear_rsi_os': 13, 'bear_rsi_ob': 77, 'bear_adx_thresh': 7.407659988651735, 'bear_atr_min_pct': 0.013911495709248321, 'bear_atr_max_pct': 0.10620313674527579, 'bear_tp_mult': 2.490712745247523, 'bear_tsl_mult': 0.5278860310561683, 'bear_time_stop': 261, 'bear_use_sma': False, 'bear_use_ema': False, 'bear_use_atr': True, 'bear_use_adx': True, 'bear_use_spike': True, 'bear_rsi_required': False, 'sideways_strategy': 'breakout', 'sideways_bb_std_mult': 3.1825668310075685, 'sideways_rsi_os': 15, 'sideways_rsi_ob': 79, 'sideways_adx_thresh': 5.530717193284785, 'sideways_atr_min_pct': 0.00480250210813663, 'sideways_atr_max_pct': 0.06445970469076774, 'sideways_tp_mult': 2.372620690172036, 'sideways_tsl_mult': 0.4715293381532046, 'sideways_time_stop': 129, 'sideways_use_sma': True, 'sideways_use_ema': False, 'sideways_use_atr': True, 'sideways_use_adx': False, 'sideways_use_spike': True, 'sideways_rsi_required': True}.
[I 2025-09-01 14:58:11,501] Trial 422 finished with values: [-1000000000.0, 1000000000.0] and parameters: {'p_sma': 12, 'p_std': 42, 'p_atr': 23, 'p_adx': 27, 'rsi_period': 29, 'ema1': 10, 'ema2': 47, 'slip_atr_k': 0.06384514317968222, 'slip_spread_k': 0.3220067911235046, 'spread_hl_frac': 0.012630048846993763, 'bb_std_mult': 1.6785466493669274, 'rsi_os': 38, 'rsi_ob': 75, 'vol_spike': 0.15679657111672707, 'adx_thresh': 18.37854655612279, 'atr_min_pct': 0.02918464761373845, 'atr_max_pct': 0.08259263738938505, 'tp_mult': 2.932509923533585, 'tsl_mult': 0.6179142971786941, 'strategy': 'breakout', 'time_stop': 122, 'use_sma': False, 'use_atr': True, 'use_adx': True, 'use_ema': False, 'use_spike': True, 'rsi_required': False, 'edge_k': 0.5890603084289872, 'edge_cap': 0.09091727312520273, 'bull_strategy': 'breakout', 'bull_bb_std_mult': 2.9532660553175636, 'bull_rsi_os': 15, 'bull_rsi_ob': 48, 'bull_adx_thresh': 13.830473046861066, 'bull_atr_min_pct': 0.008456978542080749, 'bull_atr_max_pct': 0.010417143753125246, 'bull_tp_mult': 1.965691020061259, 'bull_tsl_mult': 0.8889959542621785, 'bull_time_stop': 168, 'bull_use_sma': True, 'bull_use_ema': False, 'bull_use_atr': False, 'bull_use_adx': True, 'bull_use_spike': False, 'bull_rsi_required': True, 'bear_strategy': 'mean_reversion', 'bear_bb_std_mult': 2.884261014279351, 'bear_rsi_os': 12, 'bear_rsi_ob': 77, 'bear_adx_thresh': 18.04805827501511, 'bear_atr_min_pct': 0.013649923761026538, 'bear_atr_max_pct': 0.11382597702123887, 'bear_tp_mult': 2.491360632709416, 'bear_tsl_mult': 0.5260238764714515, 'bear_time_stop': 153, 'bear_use_sma': False, 'bear_use_ema': False, 'bear_use_atr': False, 'bear_use_adx': True, 'bear_use_spike': False, 'bear_rsi_required': False, 'sideways_strategy': 'mean_reversion', 'sideways_bb_std_mult': 1.522752823100669, 'sideways_rsi_os': 17, 'sideways_rsi_ob': 45, 'sideways_adx_thresh': 5.483988274485325, 'sideways_atr_min_pct': 0.011795316994279766, 'sideways_atr_max_pct': 0.13660153379694773, 'sideways_tp_mult': 1.7914407513877202, 'sideways_tsl_mult': 0.2594283081644367, 'sideways_time_stop': 129, 'sideways_use_sma': False, 'sideways_use_ema': True, 'sideways_use_atr': True, 'sideways_use_adx': True, 'sideways_use_spike': True, 'sideways_rsi_required': False}.
