[I 2025-09-01 14:23:30,164] Trial 199 finished with values: [-1000000000.0, 1000000000.0] and parameters: {'p_sma': 9, 'p_std': 11, 'p_atr': 19, 'p_adx': 24, 'rsi_period': 69, 'ema1': 29, 'ema2': 51, 'slip_atr_k': 0.06892243980795447, 'slip_spread_k': 0.24647684202591025, 'spread_hl_frac': 0.016382096190973104, 'bb_std_mult': 1.6232902828580564, 'rsi_os': 36, 'rsi_ob': 74, 'vol_spike': 0.29112507523030806, 'adx_thresh': 19.71876039623337, 'atr_min_pct': 0.014739073243546175, 'atr_max_pct': 0.06859601549508951, 'tp_mult': 2.837925671128815, 'tsl_mult': 0.04574712934447184, 'strategy': 'breakout', 'time_stop': 78, 'use_sma': False, 'use_atr': True, 'use_adx': True, 'use_ema': True, 'use_spike': True, 'rsi_required': False, 'edge_k': 0.5291210079181011, 'edge_cap': 0.10117970371524984, 'bull_strategy': 'breakout', 'bull_bb_std_mult': 2.713715671911227, 'bull_rsi_os': 17, 'bull_rsi_ob': 49, 'bull_adx_thresh': 11.237495762135957, 'bull_atr_min_pct': 0.006857210864977179, 'bull_atr_max_pct': 0.016749901787646432, 'bull_tp_mult': 2.171421531003841, 'bull_tsl_mult': 0.29177757277631655, 'bull_time_stop': 153, 'bull_use_sma': False, 'bull_use_ema': False, 'bull_use_atr': False, 'bull_use_adx': True, 'bull_use_spike': False, 'bull_rsi_required': True, 'bear_strategy': 'mean_reversion', 'bear_bb_std_mult': 2.7754186396281466, 'bear_rsi_os': 5, 'bear_rsi_ob': 76, 'bear_adx_thresh': 27.398467137679216, 'bear_atr_min_pct': 0.022209466956617296, 'bear_atr_max_pct': 0.11239804556729256, 'bear_tp_mult': 1.9329046824075675, 'bear_tsl_mult': 0.6181106660955136, 'bear_time_stop': 37, 'bear_use_sma': False, 'bear_use_ema': False, 'bear_use_atr': False, 'bear_use_adx': True, 'bear_use_spike': False, 'bear_rsi_required': False, 'sideways_strategy': 'mean_reversion', 'sideways_bb_std_mult': 3.5482504773029326, 'sideways_rsi_os': 17, 'sideways_rsi_ob': 92, 'sideways_adx_thresh': 7.534661365918583, 'sideways_atr_min_pct': 0.004866165606691588, 'sideways_atr_max_pct': 0.12942137458954175, 'sideways_tp_mult': 1.9931635622658774, 'sideways_tsl_mult': 0.3102681086564059, 'sideways_time_stop': 209, 'sideways_use_sma': False, 'sideways_use_ema': False, 'sideways_use_atr': False, 'sideways_use_adx': False, 'sideways_use_spike': True, 'sideways_rsi_required': True}.
[I 2025-09-01 14:23:30,186] Trial 200 finished with values: [-1000000000.0, 1000000000.0] and parameters: {'p_sma': 15, 'p_std': 12, 'p_atr': 19, 'p_adx': 24, 'rsi_period': 10, 'ema1': 30, 'ema2': 51, 'slip_atr_k': 0.007023969399109542, 'slip_spread_k': 0.2555728999277185, 'spread_hl_frac': 0.013027911836645204, 'bb_std_mult': 1.4898019428845561, 'rsi_os': 36, 'rsi_ob': 74, 'vol_spike': 0.2933306312844635, 'adx_thresh': 9.870961828171803, 'atr_min_pct': 0.018186897782820694, 'atr_max_pct': 0.06884455607875402, 'tp_mult': 2.835560671638674, 'tsl_mult': 0.11951333697463179, 'strategy': 'breakout', 'time_stop': 58, 'use_sma': False, 'use_atr': True, 'use_adx': True, 'use_ema': False, 'use_spike': True, 'rsi_required': False, 'edge_k': 0.6300000323783372, 'edge_cap': 0.07713910194884992, 'bull_strategy': 'breakout', 'bull_bb_std_mult': 2.675801572896142, 'bull_rsi_os': 19, 'bull_rsi_ob': 49, 'bull_adx_thresh': 11.16730458548484, 'bull_atr_min_pct': 0.007772560620509146, 'bull_atr_max_pct': 0.016874242879342725, 'bull_tp_mult': 2.1081124106473688, 'bull_tsl_mult': 0.37320494233973056, 'bull_time_stop': 152, 'bull_use_sma': True, 'bull_use_ema': False, 'bull_use_atr': False, 'bull_use_adx': False, 'bull_use_spike': False, 'bull_rsi_required': True, 'bear_strategy': 'mean_reversion', 'bear_bb_std_mult': 2.7979891792886193, 'bear_rsi_os': 6, 'bear_rsi_ob': 76, 'bear_adx_thresh': 27.51634678496125, 'bear_atr_min_pct': 0.023424205172203293, 'bear_atr_max_pct': 0.10384080261400266, 'bear_tp_mult': 1.784597424027107, 'bear_tsl_mult': 0.6532884465517994, 'bear_time_stop': 72, 'bear_use_sma': False, 'bear_use_ema': False, 'bear_use_atr': False, 'bear_use_adx': True, 'bear_use_spike': False, 'bear_rsi_required': False, 'sideways_strategy': 'mean_reversion', 'sideways_bb_std_mult': 3.5815728795833452, 'sideways_rsi_os': 17, 'sideways_rsi_ob': 93, 'sideways_adx_thresh': 7.591610372399552, 'sideways_atr_min_pct': 0.004082993871203533, 'sideways_atr_max_pct': 0.12784905489984894, 'sideways_tp_mult': 1.835629755659089, 'sideways_tsl_mult': 0.3164636243700212, 'sideways_time_stop': 120, 'sideways_use_sma': False, 'sideways_use_ema': False, 'sideways_use_atr': True, 'sideways_use_adx': False, 'sideways_use_spike': True, 'sideways_rsi_required': True}.
[I 2025-09-01 14:23:30,595] Trial 201 finished with values: [-1000000000.0, 1000000000.0] and parameters: {'p_sma': 14, 'p_std': 12, 'p_atr': 19, 'p_adx': 24, 'rsi_period': 67, 'ema1': 30, 'ema2': 51, 'slip_atr_k': 0.0890537835516973, 'slip_spread_k': 0.2524399536207929, 'spread_hl_frac': 0.01279715572836857, 'bb_std_mult': 1.3688513662738513, 'rsi_os': 36, 'rsi_ob': 77, 'vol_spike': 0.29205593861835555, 'adx_thresh': 10.121855349199874, 'atr_min_pct': 0.017822336834720846, 'atr_max_pct': 0.06611646451470667, 'tp_mult': 2.8407064847566437, 'tsl_mult': 0.10997920806165906, 'strategy': 'breakout', 'time_stop': 58, 'use_sma': False, 'use_atr': True, 'use_adx': True, 'use_ema': False, 'use_spike': True, 'rsi_required': False, 'edge_k': 0.5403438900319268, 'edge_cap': 0.07857718420891772, 'bull_strategy': 'breakout', 'bull_bb_std_mult': 3.1242778396933764, 'bull_rsi_os': 17, 'bull_rsi_ob': 49, 'bull_adx_thresh': 8.584813039902262, 'bull_atr_min_pct': 0.013218887357354086, 'bull_atr_max_pct': 0.01808987922452847, 'bull_tp_mult': 2.1000786886622986, 'bull_tsl_mult': 0.37609500823037306, 'bull_time_stop': 154, 'bull_use_sma': True, 'bull_use_ema': False, 'bull_use_atr': False, 'bull_use_adx': False, 'bull_use_spike': False, 'bull_rsi_required': False, 'bear_strategy': 'mean_reversion', 'bear_bb_std_mult': 2.804268379232731, 'bear_rsi_os': 7, 'bear_rsi_ob': 76, 'bear_adx_thresh': 27.4679381542893, 'bear_atr_min_pct': 0.023444458387633645, 'bear_atr_max_pct': 0.10470439935331652, 'bear_tp_mult': 2.0820242804511624, 'bear_tsl_mult': 0.6565943470863368, 'bear_time_stop': 193, 'bear_use_sma': False, 'bear_use_ema': False, 'bear_use_atr': False, 'bear_use_adx': True, 'bear_use_spike': False, 'bear_rsi_required': False, 'sideways_strategy': 'mean_reversion', 'sideways_bb_std_mult': 3.592747346494045, 'sideways_rsi_os': 17, 'sideways_rsi_ob': 93, 'sideways_adx_thresh': 5.407881388126929, 'sideways_atr_min_pct': 0.004573463447858776, 'sideways_atr_max_pct': 0.1311104167273235, 'sideways_tp_mult': 1.517275668397355, 'sideways_tsl_mult': 0.29677268454554645, 'sideways_time_stop': 169, 'sideways_use_sma': False, 'sideways_use_ema': False, 'sideways_use_atr': True, 'sideways_use_adx': False, 'sideways_use_spike': True, 'sideways_rsi_required': True}.
[I 2025-09-01 14:23:30,893] Trial 198 finished with values: [-1000000000.0, 1000000000.0] and parameters: {'p_sma': 9, 'p_std': 11, 'p_atr': 19, 'p_adx': 24, 'rsi_period': 81, 'ema1': 29, 'ema2': 52, 'slip_atr_k': 0.07415280965372137, 'slip_spread_k': 0.25299684660771493, 'spread_hl_frac': 0.016559360741413898, 'bb_std_mult': 1.352050946086216, 'rsi_os': 36, 'rsi_ob': 74, 'vol_spike': 0.29397345504067707, 'adx_thresh': 10.087607303865974, 'atr_min_pct': 0.017791660018476506, 'atr_max_pct': 0.0696170892788256, 'tp_mult': 2.8307984618847177, 'tsl_mult': 0.11725032718541345, 'strategy': 'breakout', 'time_stop': 60, 'use_sma': False, 'use_atr': True, 'use_adx': True, 'use_ema': True, 'use_spike': True, 'rsi_required': False, 'edge_k': 0.5321914832084571, 'edge_cap': 0.10215526667635365, 'bull_strategy': 'breakout', 'bull_bb_std_mult': 2.7125410710683266, 'bull_rsi_os': 17, 'bull_rsi_ob': 49, 'bull_adx_thresh': 11.290935929388827, 'bull_atr_min_pct': 0.015287715254447606, 'bull_atr_max_pct': 0.01646952520579944, 'bull_tp_mult': 2.160575165595552, 'bull_tsl_mult': 0.3287635972636944, 'bull_time_stop': 152, 'bull_use_sma': False, 'bull_use_ema': False, 'bull_use_atr': False, 'bull_use_adx': True, 'bull_use_spike': False, 'bull_rsi_required': True, 'bear_strategy': 'mean_reversion', 'bear_bb_std_mult': 2.8088151142879165, 'bear_rsi_os': 5, 'bear_rsi_ob': 76, 'bear_adx_thresh': 27.258384923762005, 'bear_atr_min_pct': 0.022222555656257754, 'bear_atr_max_pct': 0.11317497285458775, 'bear_tp_mult': 2.386508302844931, 'bear_tsl_mult': 0.6170191841808166, 'bear_time_stop': 58, 'bear_use_sma': False, 'bear_use_ema': False, 'bear_use_atr': False, 'bear_use_adx': True, 'bear_use_spike': False, 'bear_rsi_required': False, 'sideways_strategy': 'mean_reversion', 'sideways_bb_std_mult': 3.5476411704545407, 'sideways_rsi_os': 15, 'sideways_rsi_ob': 93, 'sideways_adx_thresh': 7.633398939721095, 'sideways_atr_min_pct': 0.004319047780599095, 'sideways_atr_max_pct': 0.12962677990294222, 'sideways_tp_mult': 1.9744605366899524, 'sideways_tsl_mult': 0.28557624589596614, 'sideways_time_stop': 39, 'sideways_use_sma': False, 'sideways_use_ema': False, 'sideways_use_atr': False, 'sideways_use_adx': False, 'sideways_use_spike': True, 'sideways_rsi_required': True}.
[I 2025-09-01 14:24:11,086] Trial 205 finished with values: [-1000000000.0, 1000000000.0] and parameters: {'p_sma': 14, 'p_std': 9, 'p_atr': 20, 'p_adx': 25, 'rsi_period': 44, 'ema1': 30, 'ema2': 56, 'slip_atr_k': 0.10014097099148468, 'slip_spread_k': 0.22047556450280922, 'spread_hl_frac': 0.014383891746285876, 'bb_std_mult': 1.7669514994617248, 'rsi_os': 37, 'rsi_ob': 78, 'vol_spike': 0.2678321907480034, 'adx_thresh': 18.88738275953649, 'atr_min_pct': 0.016150788102781827, 'atr_max_pct': 0.07440406494534597, 'tp_mult': 2.900435231748846, 'tsl_mult': 0.06226806006472963, 'strategy': 'breakout', 'time_stop': 72, 'use_sma': False, 'use_atr': True, 'use_adx': False, 'use_ema': False, 'use_spike': True, 'rsi_required': False, 'edge_k': 0.586508997378937, 'edge_cap': 0.0664532714744874, 'bull_strategy': 'breakout', 'bull_bb_std_mult': 2.9949079753967145, 'bull_rsi_os': 14, 'bull_rsi_ob': 50, 'bull_adx_thresh': 9.52412747850173, 'bull_atr_min_pct': 0.022211515541543554, 'bull_atr_max_pct': 0.0250934639915533, 'bull_tp_mult': 1.9952718379119652, 'bull_tsl_mult': 0.4071274187777979, 'bull_time_stop': 170, 'bull_use_sma': True, 'bull_use_ema': False, 'bull_use_atr': False, 'bull_use_adx': True, 'bull_use_spike': False, 'bull_rsi_required': True, 'bear_strategy': 'mean_reversion', 'bear_bb_std_mult': 2.612049854607762, 'bear_rsi_os': 8, 'bear_rsi_ob': 75, 'bear_adx_thresh': 30.17519006459984, 'bear_atr_min_pct': 0.024218636103337694, 'bear_atr_max_pct': 0.10865632360522635, 'bear_tp_mult': 2.3347517495630035, 'bear_tsl_mult': 0.6856229600361641, 'bear_time_stop': 89, 'bear_use_sma': False, 'bear_use_ema': True, 'bear_use_atr': False, 'bear_use_adx': True, 'bear_use_spike': False, 'bear_rsi_required': False, 'sideways_strategy': 'mean_reversion', 'sideways_bb_std_mult': 3.4709681261486995, 'sideways_rsi_os': 16, 'sideways_rsi_ob': 95, 'sideways_adx_thresh': 6.613977514949511, 'sideways_atr_min_pct': 0.00506903193255499, 'sideways_atr_max_pct': 0.1359762829177335, 'sideways_tp_mult': 1.8900852835258475, 'sideways_tsl_mult': 0.2453063887093292, 'sideways_time_stop': 247, 'sideways_use_sma': False, 'sideways_use_ema': True, 'sideways_use_atr': True, 'sideways_use_adx': False, 'sideways_use_spike': True, 'sideways_rsi_required': True}.
[I 2025-09-01 14:24:11,640] Trial 202 finished with values: [-1000000000.0, 1000000000.0] and parameters: {'p_sma': 14, 'p_std': 10, 'p_atr': 20, 'p_adx': 25, 'rsi_period': 37, 'ema1': 30, 'ema2': 55, 'slip_atr_k': 0.08874001920418753, 'slip_spread_k': 0.22086488739456686, 'spread_hl_frac': 0.01191393777981119, 'bb_std_mult': 1.752138782011318, 'rsi_os': 36, 'rsi_ob': 78, 'vol_spike': 0.2698414066766853, 'adx_thresh': 6.3908032281099985, 'atr_min_pct': 0.017773659564340776, 'atr_max_pct': 0.07379318395944157, 'tp_mult': 2.8478331288773098, 'tsl_mult': 0.055785066742815755, 'strategy': 'breakout', 'time_stop': 63, 'use_sma': False, 'use_atr': True, 'use_adx': True, 'use_ema': False, 'use_spike': True, 'rsi_required': False, 'edge_k': 0.5527826807645093, 'edge_cap': 0.07403439304311138, 'bull_strategy': 'breakout', 'bull_bb_std_mult': 3.099396989610155, 'bull_rsi_os': 21, 'bull_rsi_ob': 50, 'bull_adx_thresh': 8.74667248950229, 'bull_atr_min_pct': 0.011395147571351762, 'bull_atr_max_pct': 0.02497759095865135, 'bull_tp_mult': 2.081131627379139, 'bull_tsl_mult': 0.330148694673643, 'bull_time_stop': 171, 'bull_use_sma': True, 'bull_use_ema': False, 'bull_use_atr': False, 'bull_use_adx': True, 'bull_use_spike': False, 'bull_rsi_required': False, 'bear_strategy': 'mean_reversion', 'bear_bb_std_mult': 2.7338684968486007, 'bear_rsi_os': 7, 'bear_rsi_ob': 74, 'bear_adx_thresh': 30.411996715933643, 'bear_atr_min_pct': 0.02360082501608929, 'bear_atr_max_pct': 0.11423952530794791, 'bear_tp_mult': 2.3689481589775276, 'bear_tsl_mult': 0.6838594979119959, 'bear_time_stop': 87, 'bear_use_sma': False, 'bear_use_ema': True, 'bear_use_atr': False, 'bear_use_adx': True, 'bear_use_spike': False, 'bear_rsi_required': False, 'sideways_strategy': 'mean_reversion', 'sideways_bb_std_mult': 3.4822614305039203, 'sideways_rsi_os': 16, 'sideways_rsi_ob': 88, 'sideways_adx_thresh': 5.0769226631902775, 'sideways_atr_min_pct': 0.004281959464575533, 'sideways_atr_max_pct': 0.13199724942604335, 'sideways_tp_mult': 1.7189702735434154, 'sideways_tsl_mult': 0.2434919322274223, 'sideways_time_stop': 168, 'sideways_use_sma': False, 'sideways_use_ema': True, 'sideways_use_atr': True, 'sideways_use_adx': False, 'sideways_use_spike': True, 'sideways_rsi_required': True}.
[I 2025-09-01 14:24:11,922] Trial 203 finished with values: [-1000000000.0, 1000000000.0] and parameters: {'p_sma': 14, 'p_std': 10, 'p_atr': 20, 'p_adx': 25, 'rsi_period': 80, 'ema1': 30, 'ema2': 55, 'slip_atr_k': 0.06809251390174842, 'slip_spread_k': 0.22515116874626634, 'spread_hl_frac': 0.01413123940624336, 'bb_std_mult': 1.3661226003221376, 'rsi_os': 36, 'rsi_ob': 78, 'vol_spike': 0.26421955544324777, 'adx_thresh': 18.753791717402127, 'atr_min_pct': 0.01796550569409337, 'atr_max_pct': 0.07439945238739794, 'tp_mult': 2.8643746124266776, 'tsl_mult': 0.0356115000163768, 'strategy': 'breakout', 'time_stop': 60, 'use_sma': False, 'use_atr': True, 'use_adx': True, 'use_ema': False, 'use_spike': True, 'rsi_required': False, 'edge_k': 0.571172803605902, 'edge_cap': 0.14254268049064678, 'bull_strategy': 'breakout', 'bull_bb_std_mult': 2.9853336724063406, 'bull_rsi_os': 17, 'bull_rsi_ob': 50, 'bull_adx_thresh': 8.63258780277284, 'bull_atr_min_pct': 0.018990057016478643, 'bull_atr_max_pct': 0.025134335659573986, 'bull_tp_mult': 1.9905494459906652, 'bull_tsl_mult': 0.3260178650547716, 'bull_time_stop': 176, 'bull_use_sma': True, 'bull_use_ema': False, 'bull_use_atr': False, 'bull_use_adx': True, 'bull_use_spike': False, 'bull_rsi_required': False, 'bear_strategy': 'mean_reversion', 'bear_bb_std_mult': 2.594379498295674, 'bear_rsi_os': 7, 'bear_rsi_ob': 74, 'bear_adx_thresh': 28.501909007162084, 'bear_atr_min_pct': 0.023373014169581582, 'bear_atr_max_pct': 0.052520895655986055, 'bear_tp_mult': 2.376926096370206, 'bear_tsl_mult': 0.6725778910448794, 'bear_time_stop': 88, 'bear_use_sma': False, 'bear_use_ema': True, 'bear_use_atr': False, 'bear_use_adx': True, 'bear_use_spike': False, 'bear_rsi_required': False, 'sideways_strategy': 'mean_reversion', 'sideways_bb_std_mult': 3.5079686739668707, 'sideways_rsi_os': 15, 'sideways_rsi_ob': 95, 'sideways_adx_thresh': 5.324436008537566, 'sideways_atr_min_pct': 0.004129055769701677, 'sideways_atr_max_pct': 0.1319954844353954, 'sideways_tp_mult': 1.6993963915163737, 'sideways_tsl_mult': 0.25065595286895204, 'sideways_time_stop': 38, 'sideways_use_sma': False, 'sideways_use_ema': True, 'sideways_use_atr': True, 'sideways_use_adx': False, 'sideways_use_spike': True, 'sideways_rsi_required': True}.
[I 2025-09-01 14:24:12,164] Trial 204 finished with values: [-1000000000.0, 1000000000.0] and parameters: {'p_sma': 14, 'p_std': 10, 'p_atr': 20, 'p_adx': 25, 'rsi_period': 45, 'ema1': 30, 'ema2': 56, 'slip_atr_k': 0.06793522051379708, 'slip_spread_k': 0.2127247351052248, 'spread_hl_frac': 0.014224087775709715, 'bb_std_mult': 1.7484408293506974, 'rsi_os': 37, 'rsi_ob': 78, 'vol_spike': 0.2665531585524389, 'adx_thresh': 11.14958242298064, 'atr_min_pct': 0.016000297450786256, 'atr_max_pct': 0.07491963989642807, 'tp_mult': 2.904462566523697, 'tsl_mult': 0.06070725316504058, 'strategy': 'breakout', 'time_stop': 72, 'use_sma': False, 'use_atr': True, 'use_adx': True, 'use_ema': False, 'use_spike': True, 'rsi_required': False, 'edge_k': 0.5804280929980368, 'edge_cap': 0.14118503963250598, 'bull_strategy': 'breakout', 'bull_bb_std_mult': 3.001764646247104, 'bull_rsi_os': 14, 'bull_rsi_ob': 50, 'bull_adx_thresh': 9.530782195103061, 'bull_atr_min_pct': 0.011300938624505083, 'bull_atr_max_pct': 0.013124190943140684, 'bull_tp_mult': 1.9724710430328647, 'bull_tsl_mult': 0.32112948730009144, 'bull_time_stop': 173, 'bull_use_sma': True, 'bull_use_ema': False, 'bull_use_atr': False, 'bull_use_adx': True, 'bull_use_spike': False, 'bull_rsi_required': True, 'bear_strategy': 'mean_reversion', 'bear_bb_std_mult': 2.6969410907884077, 'bear_rsi_os': 7, 'bear_rsi_ob': 74, 'bear_adx_thresh': 30.39776686020778, 'bear_atr_min_pct': 0.02429791907686696, 'bear_atr_max_pct': 0.11398873412912405, 'bear_tp_mult': 2.369250256246141, 'bear_tsl_mult': 0.6753512686880618, 'bear_time_stop': 89, 'bear_use_sma': False, 'bear_use_ema': True, 'bear_use_atr': False, 'bear_use_adx': True, 'bear_use_spike': False, 'bear_rsi_required': False, 'sideways_strategy': 'mean_reversion', 'sideways_bb_std_mult': 3.4688030776531784, 'sideways_rsi_os': 16, 'sideways_rsi_ob': 88, 'sideways_adx_thresh': 6.608449683445515, 'sideways_atr_min_pct': 0.006330294959225201, 'sideways_atr_max_pct': 0.13421525973872422, 'sideways_tp_mult': 1.6980358568355576, 'sideways_tsl_mult': 0.24789599977226673, 'sideways_time_stop': 224, 'sideways_use_sma': False, 'sideways_use_ema': True, 'sideways_use_atr': True, 'sideways_use_adx': False, 'sideways_use_spike': True, 'sideways_rsi_required': True}.
[I 2025-09-01 14:24:12,941] Trial 207 finished with values: [-1000000000.0, 1000000000.0] and parameters: {'p_sma': 12, 'p_std': 7, 'p_atr': 21, 'p_adx': 25, 'rsi_period': 17, 'ema1': 30, 'ema2': 55, 'slip_atr_k': 0.06837091525028927, 'slip_spread_k': 0.16750657622040932, 'spread_hl_frac': 0.013574738019933004, 'bb_std_mult': 1.2440292147681462, 'rsi_os': 39, 'rsi_ob': 76, 'vol_spike': 0.2998084400618671, 'adx_thresh': 34.75596504389488, 'atr_min_pct': 0.01515751488306937, 'atr_max_pct': 0.014765793903024071, 'tp_mult': 2.9667320741257366, 'tsl_mult': 0.03139906970336572, 'strategy': 'breakout', 'time_stop': 66, 'use_sma': False, 'use_atr': True, 'use_adx': True, 'use_ema': False, 'use_spike': True, 'rsi_required': False, 'edge_k': 0.6517707269985381, 'edge_cap': 0.13807326852063506, 'bull_strategy': 'breakout', 'bull_bb_std_mult': 2.828658384682059, 'bull_rsi_os': 24, 'bull_rsi_ob': 75, 'bull_adx_thresh': 32.29002611259607, 'bull_atr_min_pct': 0.016176132689614053, 'bull_atr_max_pct': 0.013191938935945603, 'bull_tp_mult': 1.974716520280182, 'bull_tsl_mult': 0.3191502402675029, 'bull_time_stop': 176, 'bull_use_sma': True, 'bull_use_ema': False, 'bull_use_atr': False, 'bull_use_adx': True, 'bull_use_spike': False, 'bull_rsi_required': True, 'bear_strategy': 'mean_reversion', 'bear_bb_std_mult': 2.4209550945758913, 'bear_rsi_os': 9, 'bear_rsi_ob': 78, 'bear_adx_thresh': 28.570671687289497, 'bear_atr_min_pct': 0.02316401332143831, 'bear_atr_max_pct': 0.07316127977947112, 'bear_tp_mult': 2.1327464086080257, 'bear_tsl_mult': 0.5051360991397712, 'bear_time_stop': 300, 'bear_use_sma': False, 'bear_use_ema': False, 'bear_use_atr': False, 'bear_use_adx': True, 'bear_use_spike': False, 'bear_rsi_required': False, 'sideways_strategy': 'mean_reversion', 'sideways_bb_std_mult': 3.267517742843041, 'sideways_rsi_os': 14, 'sideways_rsi_ob': 91, 'sideways_adx_thresh': 8.699284291649306, 'sideways_atr_min_pct': 0.006299918514908687, 'sideways_atr_max_pct': 0.13521916430028746, 'sideways_tp_mult': 1.7882854793122338, 'sideways_tsl_mult': 0.28191239785176947, 'sideways_time_stop': 112, 'sideways_use_sma': False, 'sideways_use_ema': False, 'sideways_use_atr': True, 'sideways_use_adx': False, 'sideways_use_spike': True, 'sideways_rsi_required': True}.
