[I 2025-09-01 15:04:24,741] Trial 456 finished with values: [-1000000000.0, 1000000000.0] and parameters: {'p_sma': 9, 'p_std': 9, 'p_atr': 19, 'p_adx': 26, 'rsi_period': 39, 'ema1': 13, 'ema2': 53, 'slip_atr_k': 0.05031356558119654, 'slip_spread_k': 0.20404702886739912, 'spread_hl_frac': 0.014446259608284733, 'bb_std_mult': 1.7029868056900832, 'rsi_os': 34, 'rsi_ob': 87, 'vol_spike': 0.2813325586403211, 'adx_thresh': 20.266646948310644, 'atr_min_pct': 0.017072173690081134, 'atr_max_pct': 0.07909805034262697, 'tp_mult': 1.709161559430759, 'tsl_mult': 0.05738546146915289, 'strategy': 'mean_reversion', 'time_stop': 287, 'use_sma': False, 'use_atr': False, 'use_adx': True, 'use_ema': True, 'use_spike': True, 'rsi_required': True, 'edge_k': 0.5261598552896755, 'edge_cap': 0.0842200821367211, 'bull_strategy': 'breakout', 'bull_bb_std_mult': 2.7457434336944444, 'bull_rsi_os': 41, 'bull_rsi_ob': 53, 'bull_adx_thresh': 11.121197462973239, 'bull_atr_min_pct': 0.008993868980318164, 'bull_atr_max_pct': 0.02777447912843954, 'bull_tp_mult': 2.020305785138993, 'bull_tsl_mult': 0.35557775197499814, 'bull_time_stop': 293, 'bull_use_sma': False, 'bull_use_ema': True, 'bull_use_atr': True, 'bull_use_adx': False, 'bull_use_spike': False, 'bull_rsi_required': False, 'bear_strategy': 'mean_reversion', 'bear_bb_std_mult': 3.410718632075791, 'bear_rsi_os': 10, 'bear_rsi_ob': 76, 'bear_adx_thresh': 28.005164046811323, 'bear_atr_min_pct': 0.012971727272499217, 'bear_atr_max_pct': 0.12458042378326346, 'bear_tp_mult': 2.593476770194179, 'bear_tsl_mult': 0.6189824887428151, 'bear_time_stop': 295, 'bear_use_sma': False, 'bear_use_ema': False, 'bear_use_atr': True, 'bear_use_adx': True, 'bear_use_spike': True, 'bear_rsi_required': False, 'sideways_strategy': 'breakout', 'sideways_bb_std_mult': 1.7584611042146867, 'sideways_rsi_os': 25, 'sideways_rsi_ob': 87, 'sideways_adx_thresh': 7.191046000384775, 'sideways_atr_min_pct': 0.008331429950049055, 'sideways_atr_max_pct': 0.08387325008794044, 'sideways_tp_mult': 1.806172431423485, 'sideways_tsl_mult': 0.7673112925773355, 'sideways_time_stop': 109, 'sideways_use_sma': True, 'sideways_use_ema': False, 'sideways_use_atr': False, 'sideways_use_adx': False, 'sideways_use_spike': True, 'sideways_rsi_required': False}.
[I 2025-09-01 15:05:01,207] Trial 460 finished with values: [-1000000000.0, 1000000000.0] and parameters: {'p_sma': 27, 'p_std': 10, 'p_atr': 19, 'p_adx': 25, 'rsi_period': 61, 'ema1': 29, 'ema2': 54, 'slip_atr_k': 0.014288771227738653, 'slip_spread_k': 0.5205788341392209, 'spread_hl_frac': 0.014584052482717753, 'bb_std_mult': 1.725227073195134, 'rsi_os': 36, 'rsi_ob': 73, 'vol_spike': 0.2807865006058154, 'adx_thresh': 33.0460142381888, 'atr_min_pct': 0.02409637806008827, 'atr_max_pct': 0.07579448549547714, 'tp_mult': 2.9535740581765735, 'tsl_mult': 0.04417793420762277, 'strategy': 'mean_reversion', 'time_stop': 148, 'use_sma': False, 'use_atr': False, 'use_adx': True, 'use_ema': True, 'use_spike': True, 'rsi_required': True, 'edge_k': 0.5339057207291893, 'edge_cap': 0.08168399874174186, 'bull_strategy': 'breakout', 'bull_bb_std_mult': 2.826850617304438, 'bull_rsi_os': 15, 'bull_rsi_ob': 84, 'bull_adx_thresh': 11.157166995012858, 'bull_atr_min_pct': 0.01286887556691558, 'bull_atr_max_pct': 0.026332636336907106, 'bull_tp_mult': 2.068726705376406, 'bull_tsl_mult': 0.09473402720015578, 'bull_time_stop': 151, 'bull_use_sma': False, 'bull_use_ema': True, 'bull_use_atr': True, 'bull_use_adx': False, 'bull_use_spike': False, 'bull_rsi_required': False, 'bear_strategy': 'breakout', 'bear_bb_std_mult': 3.3933771013721477, 'bear_rsi_os': 31, 'bear_rsi_ob': 76, 'bear_adx_thresh': 26.776566989933414, 'bear_atr_min_pct': 0.022601811248435938, 'bear_atr_max_pct': 0.10499393007833044, 'bear_tp_mult': 2.5862110356156123, 'bear_tsl_mult': 0.43740619576705925, 'bear_time_stop': 294, 'bear_use_sma': True, 'bear_use_ema': False, 'bear_use_atr': True, 'bear_use_adx': True, 'bear_use_spike': True, 'bear_rsi_required': True, 'sideways_strategy': 'breakout', 'sideways_bb_std_mult': 2.1429278932602087, 'sideways_rsi_os': 17, 'sideways_rsi_ob': 95, 'sideways_adx_thresh': 6.07472405223, 'sideways_atr_min_pct': 0.008092196540876062, 'sideways_atr_max_pct': 0.1366063108172517, 'sideways_tp_mult': 1.8351650291801072, 'sideways_tsl_mult': 0.3061950560643003, 'sideways_time_stop': 150, 'sideways_use_sma': True, 'sideways_use_ema': False, 'sideways_use_atr': False, 'sideways_use_adx': True, 'sideways_use_spike': True, 'sideways_rsi_required': False}.
[I 2025-09-01 15:05:01,529] Trial 462 finished with values: [-1000000000.0, 1000000000.0] and parameters: {'p_sma': 35, 'p_std': 10, 'p_atr': 20, 'p_adx': 25, 'rsi_period': 55, 'ema1': 29, 'ema2': 58, 'slip_atr_k': 0.07309274193279525, 'slip_spread_k': 0.5826418199629151, 'spread_hl_frac': 0.01272832790100848, 'bb_std_mult': 1.3486885798624308, 'rsi_os': 36, 'rsi_ob': 74, 'vol_spike': 0.28678478319784106, 'adx_thresh': 8.307319957017757, 'atr_min_pct': 0.0171367972590795, 'atr_max_pct': 0.0758046223606353, 'tp_mult': 2.346885738662074, 'tsl_mult': 0.8452922355584058, 'strategy': 'breakout', 'time_stop': 61, 'use_sma': False, 'use_atr': True, 'use_adx': True, 'use_ema': False, 'use_spike': False, 'rsi_required': False, 'edge_k': 0.10187511713447461, 'edge_cap': 0.8660181537455742, 'bull_strategy': 'mean_reversion', 'bull_bb_std_mult': 3.0661758422282293, 'bull_rsi_os': 33, 'bull_rsi_ob': 50, 'bull_adx_thresh': 11.191008850501131, 'bull_atr_min_pct': 0.011964459977462911, 'bull_atr_max_pct': 0.013756210979402664, 'bull_tp_mult': 2.0714914130353232, 'bull_tsl_mult': 0.4068007721786798, 'bull_time_stop': 8, 'bull_use_sma': True, 'bull_use_ema': False, 'bull_use_atr': False, 'bull_use_adx': True, 'bull_use_spike': True, 'bull_rsi_required': True, 'bear_strategy': 'breakout', 'bear_bb_std_mult': 3.267813604173492, 'bear_rsi_os': 9, 'bear_rsi_ob': 80, 'bear_adx_thresh': 25.036718329373297, 'bear_atr_min_pct': 0.02526447288837165, 'bear_atr_max_pct': 0.11557786495108413, 'bear_tp_mult': 2.8724199636616086, 'bear_tsl_mult': 0.6070473449627521, 'bear_time_stop': 283, 'bear_use_sma': True, 'bear_use_ema': False, 'bear_use_atr': False, 'bear_use_adx': False, 'bear_use_spike': False, 'bear_rsi_required': False, 'sideways_strategy': 'mean_reversion', 'sideways_bb_std_mult': 1.4104923135369525, 'sideways_rsi_os': 13, 'sideways_rsi_ob': 89, 'sideways_adx_thresh': 30.581239578231724, 'sideways_atr_min_pct': 0.021291376222709147, 'sideways_atr_max_pct': 0.13691623530067654, 'sideways_tp_mult': 1.4774691434331086, 'sideways_tsl_mult': 0.6592013444841243, 'sideways_time_stop': 108, 'sideways_use_sma': False, 'sideways_use_ema': True, 'sideways_use_atr': True, 'sideways_use_adx': False, 'sideways_use_spike': False, 'sideways_rsi_required': True}.
[I 2025-09-01 15:05:01,832] Trial 463 finished with values: [-1000000000.0, 1000000000.0] and parameters: {'p_sma': 35, 'p_std': 10, 'p_atr': 21, 'p_adx': 25, 'rsi_period': 67, 'ema1': 21, 'ema2': 36, 'slip_atr_k': 0.0686787585285461, 'slip_spread_k': 0.5191631672388166, 'spread_hl_frac': 0.020476665580571405, 'bb_std_mult': 1.350669394142676, 'rsi_os': 36, 'rsi_ob': 74, 'vol_spike': 0.28813264648275255, 'adx_thresh': 32.96744445072486, 'atr_min_pct': 0.015694467945201938, 'atr_max_pct': 0.07511370916522196, 'tp_mult': 2.8527265616287902, 'tsl_mult': 0.04508356848297962, 'strategy': 'breakout', 'time_stop': 139, 'use_sma': False, 'use_atr': True, 'use_adx': False, 'use_ema': False, 'use_spike': False, 'rsi_required': False, 'edge_k': 1.3712101931790066, 'edge_cap': 0.4839150088269901, 'bull_strategy': 'mean_reversion', 'bull_bb_std_mult': 2.9554900819045624, 'bull_rsi_os': 17, 'bull_rsi_ob': 49, 'bull_adx_thresh': 11.843257654562384, 'bull_atr_min_pct': 0.02990263505880719, 'bull_atr_max_pct': 0.13495203216761364, 'bull_tp_mult': 1.1986731904182255, 'bull_tsl_mult': 0.7702522745208595, 'bull_time_stop': 152, 'bull_use_sma': True, 'bull_use_ema': False, 'bull_use_atr': False, 'bull_use_adx': True, 'bull_use_spike': True, 'bull_rsi_required': True, 'bear_strategy': 'breakout', 'bear_bb_std_mult': 2.849609308517981, 'bear_rsi_os': 31, 'bear_rsi_ob': 75, 'bear_adx_thresh': 30.637692128160133, 'bear_atr_min_pct': 0.025071754319461056, 'bear_atr_max_pct': 0.1048433484264785, 'bear_tp_mult': 2.432628001587756, 'bear_tsl_mult': 0.44161003177210595, 'bear_time_stop': 283, 'bear_use_sma': True, 'bear_use_ema': False, 'bear_use_atr': False, 'bear_use_adx': False, 'bear_use_spike': False, 'bear_rsi_required': True, 'sideways_strategy': 'mean_reversion', 'sideways_bb_std_mult': 3.2983842714908445, 'sideways_rsi_os': 16, 'sideways_rsi_ob': 74, 'sideways_adx_thresh': 6.0861762508759885, 'sideways_atr_min_pct': 0.0015528476571316317, 'sideways_atr_max_pct': 0.13661091767337658, 'sideways_tp_mult': 2.999572069589885, 'sideways_tsl_mult': 0.3043800557929942, 'sideways_time_stop': 102, 'sideways_use_sma': False, 'sideways_use_ema': True, 'sideways_use_atr': True, 'sideways_use_adx': True, 'sideways_use_spike': False, 'sideways_rsi_required': True}.
[I 2025-09-01 15:05:02,107] Trial 461 finished with values: [-0.06286080949657424, 0.06292058651562635] and parameters: {'p_sma': 23, 'p_std': 10, 'p_atr': 21, 'p_adx': 25, 'rsi_period': 67, 'ema1': 22, 'ema2': 19, 'slip_atr_k': 0.07559609013566565, 'slip_spread_k': 0.23251601108254355, 'spread_hl_frac': 0.020163689849157975, 'bb_std_mult': 1.722124510967251, 'rsi_os': 34, 'rsi_ob': 74, 'vol_spike': 0.2848955719814005, 'adx_thresh': 8.220012827580215, 'atr_min_pct': 0.007222158769098442, 'atr_max_pct': 0.07702169992519703, 'tp_mult': 2.851072814270924, 'tsl_mult': 0.8509404685623478, 'strategy': 'mean_reversion', 'time_stop': 188, 'use_sma': False, 'use_atr': False, 'use_adx': True, 'use_ema': False, 'use_spike': False, 'rsi_required': True, 'edge_k': 1.691989395269636, 'edge_cap': 0.4196658315307444, 'bull_strategy': 'breakout', 'bull_bb_std_mult': 2.759905636443632, 'bull_rsi_os': 6, 'bull_rsi_ob': 50, 'bull_adx_thresh': 10.91391951132125, 'bull_atr_min_pct': 0.006935645829469395, 'bull_atr_max_pct': 0.013574115998575595, 'bull_tp_mult': 2.0707320839956624, 'bull_tsl_mult': 0.2737637931041442, 'bull_time_stop': 151, 'bull_use_sma': False, 'bull_use_ema': False, 'bull_use_atr': True, 'bull_use_adx': True, 'bull_use_spike': True, 'bull_rsi_required': True, 'bear_strategy': 'mean_reversion', 'bear_bb_std_mult': 2.8467125005745153, 'bear_rsi_os': 27, 'bear_rsi_ob': 76, 'bear_adx_thresh': 28.172031677200238, 'bear_atr_min_pct': 0.02056494705053933, 'bear_atr_max_pct': 0.08626301716567282, 'bear_tp_mult': 2.3646838842473805, 'bear_tsl_mult': 0.6104635864817145, 'bear_time_stop': 282, 'bear_use_sma': False, 'bear_use_ema': False, 'bear_use_atr': False, 'bear_use_adx': False, 'bear_use_spike': False, 'bear_rsi_required': False, 'sideways_strategy': 'breakout', 'sideways_bb_std_mult': 1.41187339812958, 'sideways_rsi_os': 30, 'sideways_rsi_ob': 56, 'sideways_adx_thresh': 6.079576895619206, 'sideways_atr_min_pct': 0.001605879758284301, 'sideways_atr_max_pct': 0.13649270880773887, 'sideways_tp_mult': 2.7395597847554907, 'sideways_tsl_mult': 0.3911829398580137, 'sideways_time_stop': 105, 'sideways_use_sma': False, 'sideways_use_ema': True, 'sideways_use_atr': True, 'sideways_use_adx': False, 'sideways_use_spike': False, 'sideways_rsi_required': False}.
[I 2025-09-01 15:05:42,258] Trial 467 finished with values: [-0.018500960388921128, 0.018414458446196002] and parameters: {'p_sma': 11, 'p_std': 8, 'p_atr': 11, 'p_adx': 24, 'rsi_period': 64, 'ema1': 11, 'ema2': 49, 'slip_atr_k': 0.20060996530166553, 'slip_spread_k': 0.25533680351505184, 'spread_hl_frac': 0.015569422980597544, 'bb_std_mult': 2.722720343911874, 'rsi_os': 37, 'rsi_ob': 85, 'vol_spike': 0.2954435373026501, 'adx_thresh': 14.267036398398044, 'atr_min_pct': 0.012971719678660832, 'atr_max_pct': 0.06913984152283857, 'tp_mult': 2.9515105482165698, 'tsl_mult': 0.07478213768419709, 'strategy': 'breakout', 'time_stop': 35, 'use_sma': True, 'use_atr': True, 'use_adx': False, 'use_ema': False, 'use_spike': True, 'rsi_required': False, 'edge_k': 0.5658159009512491, 'edge_cap': 0.13667243336314328, 'bull_strategy': 'breakout', 'bull_bb_std_mult': 1.6507717308724332, 'bull_rsi_os': 46, 'bull_rsi_ob': 49, 'bull_adx_thresh': 23.236721138071893, 'bull_atr_min_pct': 0.020718372851483223, 'bull_atr_max_pct': 0.017816591012251873, 'bull_tp_mult': 2.136487506374405, 'bull_tsl_mult': 0.3842662672516227, 'bull_time_stop': 62, 'bull_use_sma': True, 'bull_use_ema': False, 'bull_use_atr': False, 'bull_use_adx': True, 'bull_use_spike': False, 'bull_rsi_required': True, 'bear_strategy': 'mean_reversion', 'bear_bb_std_mult': 2.9819539769132075, 'bear_rsi_os': 15, 'bear_rsi_ob': 78, 'bear_adx_thresh': 11.491476581429781, 'bear_atr_min_pct': 0.00011067131460640312, 'bear_atr_max_pct': 0.11190775417162083, 'bear_tp_mult': 1.9446598147825445, 'bear_tsl_mult': 0.6769002018478585, 'bear_time_stop': 199, 'bear_use_sma': False, 'bear_use_ema': True, 'bear_use_atr': False, 'bear_use_adx': True, 'bear_use_spike': False, 'bear_rsi_required': False, 'sideways_strategy': 'mean_reversion', 'sideways_bb_std_mult': 3.228792358399783, 'sideways_rsi_os': 52, 'sideways_rsi_ob': 90, 'sideways_adx_thresh': 9.051652850961757, 'sideways_atr_min_pct': 0.0045363332738497285, 'sideways_atr_max_pct': 0.09013049970208578, 'sideways_tp_mult': 1.0704945624164746, 'sideways_tsl_mult': 0.2388896624440623, 'sideways_time_stop': 226, 'sideways_use_sma': False, 'sideways_use_ema': False, 'sideways_use_atr': True, 'sideways_use_adx': False, 'sideways_use_spike': True, 'sideways_rsi_required': True}.
[I 2025-09-01 15:05:42,790] Trial 466 finished with values: [-1000000000.0, 1000000000.0] and parameters: {'p_sma': 11, 'p_std': 8, 'p_atr': 8, 'p_adx': 9, 'rsi_period': 64, 'ema1': 30, 'ema2': 24, 'slip_atr_k': 0.20070733298973675, 'slip_spread_k': 0.30330357023119536, 'spread_hl_frac': 0.015720755084070184, 'bb_std_mult': 1.4672956438425644, 'rsi_os': 37, 'rsi_ob': 68, 'vol_spike': 0.013507365885075756, 'adx_thresh': 19.311194652598385, 'atr_min_pct': 0.015169174851522345, 'atr_max_pct': 0.06955511873781435, 'tp_mult': 2.869770140501193, 'tsl_mult': 0.09137821656478058, 'strategy': 'breakout', 'time_stop': 72, 'use_sma': True, 'use_atr': True, 'use_adx': True, 'use_ema': False, 'use_spike': True, 'rsi_required': False, 'edge_k': 1.0929783648131397, 'edge_cap': 0.6765841238981349, 'bull_strategy': 'breakout', 'bull_bb_std_mult': 2.0313593226460864, 'bull_rsi_os': 14, 'bull_rsi_ob': 77, 'bull_adx_thresh': 10.471074678518876, 'bull_atr_min_pct': 0.017620762124079006, 'bull_atr_max_pct': 0.017826308312177526, 'bull_tp_mult': 2.3921645288212865, 'bull_tsl_mult': 0.27839805441160415, 'bull_time_stop': 144, 'bull_use_sma': True, 'bull_use_ema': False, 'bull_use_atr': False, 'bull_use_adx': True, 'bull_use_spike': False, 'bull_rsi_required': True, 'bear_strategy': 'mean_reversion', 'bear_bb_std_mult': 0.8285092930169644, 'bear_rsi_os': 7, 'bear_rsi_ob': 69, 'bear_adx_thresh': 28.644556808749012, 'bear_atr_min_pct': 0.023479866498002287, 'bear_atr_max_pct': 0.11915176393137956, 'bear_tp_mult': 2.493278708728021, 'bear_tsl_mult': 0.6722099797102487, 'bear_time_stop': 19, 'bear_use_sma': False, 'bear_use_ema': True, 'bear_use_atr': False, 'bear_use_adx': True, 'bear_use_spike': False, 'bear_rsi_required': False, 'sideways_strategy': 'mean_reversion', 'sideways_bb_std_mult': 3.2065250103594507, 'sideways_rsi_os': 15, 'sideways_rsi_ob': 78, 'sideways_adx_thresh': 7.870392683887664, 'sideways_atr_min_pct': 0.004687809902878257, 'sideways_atr_max_pct': 0.055366721350070494, 'sideways_tp_mult': 1.0704181495717362, 'sideways_tsl_mult': 0.24357289654449968, 'sideways_time_stop': 134, 'sideways_use_sma': False, 'sideways_use_ema': False, 'sideways_use_atr': True, 'sideways_use_adx': False, 'sideways_use_spike': True, 'sideways_rsi_required': True}.
[I 2025-09-01 15:05:43,261] Trial 465 finished with values: [-1000000000.0, 1000000000.0] and parameters: {'p_sma': 57, 'p_std': 8, 'p_atr': 11, 'p_adx': 25, 'rsi_period': 14, 'ema1': 11, 'ema2': 27, 'slip_atr_k': 0.06825486189219428, 'slip_spread_k': 0.9988115020336492, 'spread_hl_frac': 0.020399165134257127, 'bb_std_mult': 2.655025390905892, 'rsi_os': 37, 'rsi_ob': 49, 'vol_spike': 0.2911685445135381, 'adx_thresh': 19.31424764456712, 'atr_min_pct': 0.019333833782413493, 'atr_max_pct': 0.020622035575801972, 'tp_mult': 2.073739012447979, 'tsl_mult': 0.07372604771501153, 'strategy': 'breakout', 'time_stop': 37, 'use_sma': True, 'use_atr': True, 'use_adx': False, 'use_ema': False, 'use_spike': False, 'rsi_required': False, 'edge_k': 1.100306318370311, 'edge_cap': 0.5053932871656176, 'bull_strategy': 'breakout', 'bull_bb_std_mult': 2.9496348904148153, 'bull_rsi_os': 17, 'bull_rsi_ob': 77, 'bull_adx_thresh': 30.615473967308652, 'bull_atr_min_pct': 0.029931991991933755, 'bull_atr_max_pct': 0.01780562108426689, 'bull_tp_mult': 2.3840663268847626, 'bull_tsl_mult': 0.4319451673096984, 'bull_time_stop': 204, 'bull_use_sma': True, 'bull_use_ema': False, 'bull_use_atr': False, 'bull_use_adx': True, 'bull_use_spike': True, 'bull_rsi_required': True, 'bear_strategy': 'mean_reversion', 'bear_bb_std_mult': 2.8490022625629265, 'bear_rsi_os': 7, 'bear_rsi_ob': 78, 'bear_adx_thresh': 30.78666356411157, 'bear_atr_min_pct': 5.144106608215293e-05, 'bear_atr_max_pct': 0.11141303217572422, 'bear_tp_mult': 1.0413077008220637, 'bear_tsl_mult': 0.679378839504654, 'bear_time_stop': 280, 'bear_use_sma': False, 'bear_use_ema': True, 'bear_use_atr': False, 'bear_use_adx': False, 'bear_use_spike': False, 'bear_rsi_required': False, 'sideways_strategy': 'mean_reversion', 'sideways_bb_std_mult': 3.290986039699594, 'sideways_rsi_os': 16, 'sideways_rsi_ob': 60, 'sideways_adx_thresh': 7.845837329148527, 'sideways_atr_min_pct': 0.016416876823189937, 'sideways_atr_max_pct': 0.11153555327575068, 'sideways_tp_mult': 2.1921262979151432, 'sideways_tsl_mult': 0.38725623528052333, 'sideways_time_stop': 115, 'sideways_use_sma': False, 'sideways_use_ema': True, 'sideways_use_atr': True, 'sideways_use_adx': False, 'sideways_use_spike': False, 'sideways_rsi_required': True}.
[I 2025-09-01 15:05:43,612] Trial 464 finished with values: [-1000000000.0, 1000000000.0] and parameters: {'p_sma': 11, 'p_std': 8, 'p_atr': 21, 'p_adx': 25, 'rsi_period': 65, 'ema1': 28, 'ema2': 52, 'slip_atr_k': 0.07084153035221655, 'slip_spread_k': 0.5839997210390611, 'spread_hl_frac': 0.012393742131518738, 'bb_std_mult': 1.3498525601487055, 'rsi_os': 5, 'rsi_ob': 85, 'vol_spike': 0.24535276759582408, 'adx_thresh': 14.264003492563493, 'atr_min_pct': 0.015086267644824071, 'atr_max_pct': 0.02101356157211079, 'tp_mult': 1.9506225239758785, 'tsl_mult': 0.07539069956538332, 'strategy': 'breakout', 'time_stop': 187, 'use_sma': False, 'use_atr': True, 'use_adx': False, 'use_ema': False, 'use_spike': False, 'rsi_required': False, 'edge_k': 1.7794586892416813, 'edge_cap': 0.05018717480783307, 'bull_strategy': 'mean_reversion', 'bull_bb_std_mult': 2.0493642528666083, 'bull_rsi_os': 16, 'bull_rsi_ob': 77, 'bull_adx_thresh': 10.366099621588658, 'bull_atr_min_pct': 0.010219839768089378, 'bull_atr_max_pct': 0.1481387999380564, 'bull_tp_mult': 2.255851098804265, 'bull_tsl_mult': 0.3916328060550104, 'bull_time_stop': 6, 'bull_use_sma': True, 'bull_use_ema': False, 'bull_use_atr': False, 'bull_use_adx': True, 'bull_use_spike': True, 'bull_rsi_required': True, 'bear_strategy': 'mean_reversion', 'bear_bb_std_mult': 0.8195749324001915, 'bear_rsi_os': 7, 'bear_rsi_ob': 73, 'bear_adx_thresh': 28.460271703481922, 'bear_atr_min_pct': 0.010496458302871502, 'bear_atr_max_pct': 0.11473488953310772, 'bear_tp_mult': 1.0712270684084637, 'bear_tsl_mult': 0.5836723378972453, 'bear_time_stop': 283, 'bear_use_sma': False, 'bear_use_ema': True, 'bear_use_atr': False, 'bear_use_adx': False, 'bear_use_spike': False, 'bear_rsi_required': False, 'sideways_strategy': 'mean_reversion', 'sideways_bb_std_mult': 1.41647807255998, 'sideways_rsi_os': 9, 'sideways_rsi_ob': 56, 'sideways_adx_thresh': 7.793127730195531, 'sideways_atr_min_pct': 0.013919866051742303, 'sideways_atr_max_pct': 0.012716188674141551, 'sideways_tp_mult': 1.0626598472730646, 'sideways_tsl_mult': 0.7236303750092619, 'sideways_time_stop': 163, 'sideways_use_sma': False, 'sideways_use_ema': True, 'sideways_use_atr': True, 'sideways_use_adx': False, 'sideways_use_spike': False, 'sideways_rsi_required': True}.
