[I 2025-09-01 14:58:51,615] Trial 423 finished with values: [-1000000000.0, 1000000000.0] and parameters: {'p_sma': 13, 'p_std': 6, 'p_atr': 21, 'p_adx': 17, 'rsi_period': 67, 'ema1': 29, 'ema2': 53, 'slip_atr_k': 0.09721748156347418, 'slip_spread_k': 0.26770366525655565, 'spread_hl_frac': 0.01610810807119878, 'bb_std_mult': 3.3419788356054116, 'rsi_os': 35, 'rsi_ob': 75, 'vol_spike': 0.17744011397147585, 'adx_thresh': 18.509217648534854, 'atr_min_pct': 0.020695412864797945, 'atr_max_pct': 0.14466881187962605, 'tp_mult': 2.867470481554506, 'tsl_mult': 0.5396157774625102, 'strategy': 'breakout', 'time_stop': 100, 'use_sma': False, 'use_atr': True, 'use_adx': True, 'use_ema': False, 'use_spike': True, 'rsi_required': False, 'edge_k': 0.6058374536566354, 'edge_cap': 0.05059652665675207, 'bull_strategy': 'breakout', 'bull_bb_std_mult': 2.942514108053415, 'bull_rsi_os': 16, 'bull_rsi_ob': 66, 'bull_adx_thresh': 11.597550164483074, 'bull_atr_min_pct': 0.02043123812007351, 'bull_atr_max_pct': 0.012429161158967708, 'bull_tp_mult': 2.0910921152823305, 'bull_tsl_mult': 0.11601261259702655, 'bull_time_stop': 165, 'bull_use_sma': True, 'bull_use_ema': False, 'bull_use_atr': False, 'bull_use_adx': True, 'bull_use_spike': False, 'bull_rsi_required': True, 'bear_strategy': 'mean_reversion', 'bear_bb_std_mult': 2.875640687959642, 'bear_rsi_os': 12, 'bear_rsi_ob': 71, 'bear_adx_thresh': 7.5038523725468345, 'bear_atr_min_pct': 0.024891548957088477, 'bear_atr_max_pct': 0.13907065212011632, 'bear_tp_mult': 2.611738087499568, 'bear_tsl_mult': 0.618115579851796, 'bear_time_stop': 294, 'bear_use_sma': False, 'bear_use_ema': False, 'bear_use_atr': False, 'bear_use_adx': True, 'bear_use_spike': False, 'bear_rsi_required': False, 'sideways_strategy': 'mean_reversion', 'sideways_bb_std_mult': 3.1511598857950305, 'sideways_rsi_os': 17, 'sideways_rsi_ob': 85, 'sideways_adx_thresh': 5.633710454508782, 'sideways_atr_min_pct': 0.012063840407345629, 'sideways_atr_max_pct': 0.13702329500842603, 'sideways_tp_mult': 1.9134198024129156, 'sideways_tsl_mult': 0.3523332405108811, 'sideways_time_stop': 75, 'sideways_use_sma': False, 'sideways_use_ema': True, 'sideways_use_atr': True, 'sideways_use_adx': True, 'sideways_use_spike': True, 'sideways_rsi_required': False}.
[I 2025-09-01 14:58:51,629] Trial 426 finished with values: [-1000000000.0, 1000000000.0] and parameters: {'p_sma': 10, 'p_std': 14, 'p_atr': 21, 'p_adx': 13, 'rsi_period': 67, 'ema1': 22, 'ema2': 25, 'slip_atr_k': 0.04727661206553195, 'slip_spread_k': 0.28461003180637634, 'spread_hl_frac': 0.015856943528889098, 'bb_std_mult': 3.3440888926333585, 'rsi_os': 13, 'rsi_ob': 73, 'vol_spike': 0.2854548290737909, 'adx_thresh': 33.591678529722586, 'atr_min_pct': 0.020831374134734938, 'atr_max_pct': 0.06754294139289305, 'tp_mult': 1.7891781408802212, 'tsl_mult': 0.08389879551892827, 'strategy': 'breakout', 'time_stop': 66, 'use_sma': False, 'use_atr': True, 'use_adx': True, 'use_ema': False, 'use_spike': True, 'rsi_required': False, 'edge_k': 0.49511243871851285, 'edge_cap': 0.46845349905991934, 'bull_strategy': 'mean_reversion', 'bull_bb_std_mult': 2.2883652615024968, 'bull_rsi_os': 17, 'bull_rsi_ob': 75, 'bull_adx_thresh': 11.56135689169192, 'bull_atr_min_pct': 0.009338374458040803, 'bull_atr_max_pct': 0.017656737110081203, 'bull_tp_mult': 2.7034722015706536, 'bull_tsl_mult': 0.36594609857638044, 'bull_time_stop': 160, 'bull_use_sma': True, 'bull_use_ema': False, 'bull_use_atr': False, 'bull_use_adx': True, 'bull_use_spike': False, 'bull_rsi_required': True, 'bear_strategy': 'mean_reversion', 'bear_bb_std_mult': 2.79347366059436, 'bear_rsi_os': 9, 'bear_rsi_ob': 71, 'bear_adx_thresh': 28.995660560504653, 'bear_atr_min_pct': 0.024200477475478984, 'bear_atr_max_pct': 0.13852098682867525, 'bear_tp_mult': 1.4428111446964385, 'bear_tsl_mult': 0.41389627816728436, 'bear_time_stop': 284, 'bear_use_sma': False, 'bear_use_ema': False, 'bear_use_atr': False, 'bear_use_adx': True, 'bear_use_spike': False, 'bear_rsi_required': False, 'sideways_strategy': 'mean_reversion', 'sideways_bb_std_mult': 3.449663485574989, 'sideways_rsi_os': 18, 'sideways_rsi_ob': 89, 'sideways_adx_thresh': 14.038150731250528, 'sideways_atr_min_pct': 0.0038593159796769866, 'sideways_atr_max_pct': 0.09140225130025764, 'sideways_tp_mult': 1.8501818679149615, 'sideways_tsl_mult': 0.24154912416366492, 'sideways_time_stop': 170, 'sideways_use_sma': False, 'sideways_use_ema': True, 'sideways_use_atr': True, 'sideways_use_adx': True, 'sideways_use_spike': True, 'sideways_rsi_required': False}.
[I 2025-09-01 14:58:51,965] Trial 425 finished with values: [-1000000000.0, 1000000000.0] and parameters: {'p_sma': 13, 'p_std': 29, 'p_atr': 21, 'p_adx': 27, 'rsi_period': 26, 'ema1': 29, 'ema2': 49, 'slip_atr_k': 0.06357131868217339, 'slip_spread_k': 0.26517686266466983, 'spread_hl_frac': 0.02756716273300367, 'bb_std_mult': 2.0238186189493517, 'rsi_os': 43, 'rsi_ob': 75, 'vol_spike': 0.1721630632147093, 'adx_thresh': 10.73761945558892, 'atr_min_pct': 0.020448169812751205, 'atr_max_pct': 0.0770521933744892, 'tp_mult': 2.870362225063011, 'tsl_mult': 0.13135608198039017, 'strategy': 'breakout', 'time_stop': 92, 'use_sma': False, 'use_atr': True, 'use_adx': True, 'use_ema': False, 'use_spike': True, 'rsi_required': False, 'edge_k': 0.03140905591856957, 'edge_cap': 0.45307741783010497, 'bull_strategy': 'mean_reversion', 'bull_bb_std_mult': 2.7934044821647226, 'bull_rsi_os': 16, 'bull_rsi_ob': 86, 'bull_adx_thresh': 5.044645368456141, 'bull_atr_min_pct': 0.01602964604851213, 'bull_atr_max_pct': 0.01751458444311815, 'bull_tp_mult': 2.0549708793623487, 'bull_tsl_mult': 0.22432135405323061, 'bull_time_stop': 81, 'bull_use_sma': True, 'bull_use_ema': False, 'bull_use_atr': False, 'bull_use_adx': True, 'bull_use_spike': False, 'bull_rsi_required': True, 'bear_strategy': 'mean_reversion', 'bear_bb_std_mult': 2.902943235466841, 'bear_rsi_os': 11, 'bear_rsi_ob': 71, 'bear_adx_thresh': 29.226753699636525, 'bear_atr_min_pct': 0.024189565813488023, 'bear_atr_max_pct': 0.0800357570313398, 'bear_tp_mult': 1.4401452901673641, 'bear_tsl_mult': 0.6179001889907182, 'bear_time_stop': 284, 'bear_use_sma': False, 'bear_use_ema': False, 'bear_use_atr': False, 'bear_use_adx': True, 'bear_use_spike': False, 'bear_rsi_required': False, 'sideways_strategy': 'mean_reversion', 'sideways_bb_std_mult': 3.4220117038686686, 'sideways_rsi_os': 17, 'sideways_rsi_ob': 85, 'sideways_adx_thresh': 7.652235480762453, 'sideways_atr_min_pct': 0.010439474570557028, 'sideways_atr_max_pct': 0.03303442879818578, 'sideways_tp_mult': 1.8486452849219948, 'sideways_tsl_mult': 0.23408232523140848, 'sideways_time_stop': 116, 'sideways_use_sma': False, 'sideways_use_ema': True, 'sideways_use_atr': True, 'sideways_use_adx': True, 'sideways_use_spike': True, 'sideways_rsi_required': False}.
[I 2025-09-01 14:58:52,275] Trial 424 finished with values: [-1000000000.0, 1000000000.0] and parameters: {'p_sma': 12, 'p_std': 16, 'p_atr': 23, 'p_adx': 23, 'rsi_period': 26, 'ema1': 24, 'ema2': 55, 'slip_atr_k': 0.0654723576070271, 'slip_spread_k': 0.6704387654353379, 'spread_hl_frac': 0.01593109927311183, 'bb_std_mult': 3.5300140578273593, 'rsi_os': 38, 'rsi_ob': 73, 'vol_spike': 0.2939359844164629, 'adx_thresh': 26.869299668558682, 'atr_min_pct': 0.020825125900304442, 'atr_max_pct': 0.08248546040840138, 'tp_mult': 2.861243546374236, 'tsl_mult': 0.10527804054540676, 'strategy': 'breakout', 'time_stop': 105, 'use_sma': False, 'use_atr': True, 'use_adx': True, 'use_ema': False, 'use_spike': True, 'rsi_required': False, 'edge_k': 0.586768990571895, 'edge_cap': 0.05138429736255179, 'bull_strategy': 'breakout', 'bull_bb_std_mult': 2.783364641379433, 'bull_rsi_os': 16, 'bull_rsi_ob': 52, 'bull_adx_thresh': 11.584964712301534, 'bull_atr_min_pct': 0.01605741162995534, 'bull_atr_max_pct': 0.13838558279541321, 'bull_tp_mult': 2.088178215545407, 'bull_tsl_mult': 0.2291730014276248, 'bull_time_stop': 169, 'bull_use_sma': True, 'bull_use_ema': False, 'bull_use_atr': False, 'bull_use_adx': True, 'bull_use_spike': False, 'bull_rsi_required': True, 'bear_strategy': 'mean_reversion', 'bear_bb_std_mult': 2.8834798927049667, 'bear_rsi_os': 13, 'bear_rsi_ob': 77, 'bear_adx_thresh': 10.082307711402287, 'bear_atr_min_pct': 0.02924228681886469, 'bear_atr_max_pct': 0.11510423431419718, 'bear_tp_mult': 2.605267238140209, 'bear_tsl_mult': 0.6136929880616565, 'bear_time_stop': 284, 'bear_use_sma': False, 'bear_use_ema': False, 'bear_use_atr': False, 'bear_use_adx': True, 'bear_use_spike': False, 'bear_rsi_required': False, 'sideways_strategy': 'mean_reversion', 'sideways_bb_std_mult': 1.5383325777636037, 'sideways_rsi_os': 50, 'sideways_rsi_ob': 85, 'sideways_adx_thresh': 5.5043926414407975, 'sideways_atr_min_pct': 0.004148043317635656, 'sideways_atr_max_pct': 0.13651155407762852, 'sideways_tp_mult': 1.8433705871312867, 'sideways_tsl_mult': 0.9986188527212352, 'sideways_time_stop': 132, 'sideways_use_sma': False, 'sideways_use_ema': True, 'sideways_use_atr': True, 'sideways_use_adx': True, 'sideways_use_spike': True, 'sideways_rsi_required': False}.
[I 2025-09-01 14:59:30,047] Trial 427 finished with values: [-1000000000.0, 1000000000.0] and parameters: {'p_sma': 13, 'p_std': 8, 'p_atr': 20, 'p_adx': 16, 'rsi_period': 25, 'ema1': 6, 'ema2': 55, 'slip_atr_k': 0.06271836156524357, 'slip_spread_k': 0.24394426568656616, 'spread_hl_frac': 0.04718232057827033, 'bb_std_mult': 1.5676664517151644, 'rsi_os': 43, 'rsi_ob': 73, 'vol_spike': 0.09683861859193493, 'adx_thresh': 26.811091063411528, 'atr_min_pct': 0.016636565542892716, 'atr_max_pct': 0.07796204891931297, 'tp_mult': 1.6529468854461948, 'tsl_mult': 0.8713943417702452, 'strategy': 'breakout', 'time_stop': 52, 'use_sma': False, 'use_atr': True, 'use_adx': False, 'use_ema': True, 'use_spike': False, 'rsi_required': False, 'edge_k': 0.6507598651230668, 'edge_cap': 0.39480096388872055, 'bull_strategy': 'mean_reversion', 'bull_bb_std_mult': 2.800158423754083, 'bull_rsi_os': 19, 'bull_rsi_ob': 86, 'bull_adx_thresh': 18.525440189981524, 'bull_atr_min_pct': 0.01602307295179356, 'bull_atr_max_pct': 0.14069163189535563, 'bull_tp_mult': 2.0402563899670305, 'bull_tsl_mult': 0.30830874727927504, 'bull_time_stop': 156, 'bull_use_sma': True, 'bull_use_ema': False, 'bull_use_atr': False, 'bull_use_adx': True, 'bull_use_spike': True, 'bull_rsi_required': False, 'bear_strategy': 'mean_reversion', 'bear_bb_std_mult': 2.7759232017500133, 'bear_rsi_os': 10, 'bear_rsi_ob': 79, 'bear_adx_thresh': 10.34854513141377, 'bear_atr_min_pct': 0.008311890388204336, 'bear_atr_max_pct': 0.13082357369959996, 'bear_tp_mult': 1.6069826677428367, 'bear_tsl_mult': 0.4999535573772483, 'bear_time_stop': 280, 'bear_use_sma': False, 'bear_use_ema': True, 'bear_use_atr': False, 'bear_use_adx': False, 'bear_use_spike': False, 'bear_rsi_required': True, 'sideways_strategy': 'mean_reversion', 'sideways_bb_std_mult': 3.389477023840163, 'sideways_rsi_os': 16, 'sideways_rsi_ob': 57, 'sideways_adx_thresh': 25.801878098119403, 'sideways_atr_min_pct': 0.007332267998404153, 'sideways_atr_max_pct': 0.14502003637343575, 'sideways_tp_mult': 1.7783379983801793, 'sideways_tsl_mult': 0.03142413612126682, 'sideways_time_stop': 114, 'sideways_use_sma': False, 'sideways_use_ema': False, 'sideways_use_atr': True, 'sideways_use_adx': False, 'sideways_use_spike': False, 'sideways_rsi_required': True}.
[I 2025-09-01 14:59:30,900] Trial 428 finished with values: [-1000000000.0, 1000000000.0] and parameters: {'p_sma': 13, 'p_std': 29, 'p_atr': 24, 'p_adx': 16, 'rsi_period': 45, 'ema1': 24, 'ema2': 55, 'slip_atr_k': 0.06560468574180163, 'slip_spread_k': 0.23825818702698795, 'spread_hl_frac': 0.027645191930202512, 'bb_std_mult': 1.5786797669089618, 'rsi_os': 31, 'rsi_ob': 73, 'vol_spike': 0.19035212955978437, 'adx_thresh': 20.843891084822896, 'atr_min_pct': 0.016563967374549782, 'atr_max_pct': 0.0773266220943929, 'tp_mult': 1.326829279579622, 'tsl_mult': 0.4291536782455558, 'strategy': 'breakout', 'time_stop': 91, 'use_sma': False, 'use_atr': True, 'use_adx': False, 'use_ema': True, 'use_spike': False, 'rsi_required': False, 'edge_k': 1.4321752137222612, 'edge_cap': 0.7556038769945581, 'bull_strategy': 'mean_reversion', 'bull_bb_std_mult': 2.7855112566215574, 'bull_rsi_os': 19, 'bull_rsi_ob': 48, 'bull_adx_thresh': 24.20029850416308, 'bull_atr_min_pct': 0.028472051424592783, 'bull_atr_max_pct': 0.13930585107886612, 'bull_tp_mult': 2.038521820358899, 'bull_tsl_mult': 0.417777328035691, 'bull_time_stop': 153, 'bull_use_sma': True, 'bull_use_ema': False, 'bull_use_atr': False, 'bull_use_adx': True, 'bull_use_spike': True, 'bull_rsi_required': False, 'bear_strategy': 'mean_reversion', 'bear_bb_std_mult': 2.350668350936197, 'bear_rsi_os': 39, 'bear_rsi_ob': 79, 'bear_adx_thresh': 28.37358085100189, 'bear_atr_min_pct': 0.02276736335827803, 'bear_atr_max_pct': 0.1091207956659473, 'bear_tp_mult': 2.3910559773790414, 'bear_tsl_mult': 0.32050925475892866, 'bear_time_stop': 224, 'bear_use_sma': False, 'bear_use_ema': True, 'bear_use_atr': False, 'bear_use_adx': False, 'bear_use_spike': False, 'bear_rsi_required': True, 'sideways_strategy': 'mean_reversion', 'sideways_bb_std_mult': 3.382073783005076, 'sideways_rsi_os': 16, 'sideways_rsi_ob': 86, 'sideways_adx_thresh': 24.267300648121594, 'sideways_atr_min_pct': 0.005601039165015519, 'sideways_atr_max_pct': 0.13341304019573025, 'sideways_tp_mult': 1.8433522527786554, 'sideways_tsl_mult': 0.7085418665708976, 'sideways_time_stop': 294, 'sideways_use_sma': False, 'sideways_use_ema': False, 'sideways_use_atr': True, 'sideways_use_adx': False, 'sideways_use_spike': False, 'sideways_rsi_required': True}.
[I 2025-09-01 14:59:31,429] Trial 429 finished with values: [-0.03498868046263581, 0.03483649033458949] and parameters: {'p_sma': 30, 'p_std': 8, 'p_atr': 20, 'p_adx': 16, 'rsi_period': 70, 'ema1': 30, 'ema2': 55, 'slip_atr_k': 0.05800595138109948, 'slip_spread_k': 0.242311986468076, 'spread_hl_frac': 0.04672561594033457, 'bb_std_mult': 1.5886197791055476, 'rsi_os': 31, 'rsi_ob': 84, 'vol_spike': 0.29368519933851756, 'adx_thresh': 20.880048327158697, 'atr_min_pct': 0.01669828731250075, 'atr_max_pct': 0.0705537085019115, 'tp_mult': 2.0345199887844987, 'tsl_mult': 0.023773429270308177, 'strategy': 'breakout', 'time_stop': 50, 'use_sma': True, 'use_atr': True, 'use_adx': False, 'use_ema': True, 'use_spike': False, 'rsi_required': False, 'edge_k': 0.473822072189152, 'edge_cap': 0.12075248621049528, 'bull_strategy': 'breakout', 'bull_bb_std_mult': 2.824460363194819, 'bull_rsi_os': 47, 'bull_rsi_ob': 52, 'bull_adx_thresh': 9.043664713909369, 'bull_atr_min_pct': 0.002583277880457672, 'bull_atr_max_pct': 0.12616024052309824, 'bull_tp_mult': 2.8087045668933954, 'bull_tsl_mult': 0.5664215130991761, 'bull_time_stop': 155, 'bull_use_sma': True, 'bull_use_ema': False, 'bull_use_atr': False, 'bull_use_adx': True, 'bull_use_spike': True, 'bull_rsi_required': False, 'bear_strategy': 'mean_reversion', 'bear_bb_std_mult': 3.1756186497666516, 'bear_rsi_os': 9, 'bear_rsi_ob': 79, 'bear_adx_thresh': 28.318758135685655, 'bear_atr_min_pct': 0.029194223808469845, 'bear_atr_max_pct': 0.1318022772000581, 'bear_tp_mult': 1.6135253976569954, 'bear_tsl_mult': 0.6594310208012542, 'bear_time_stop': 190, 'bear_use_sma': False, 'bear_use_ema': True, 'bear_use_atr': False, 'bear_use_adx': False, 'bear_use_spike': False, 'bear_rsi_required': True, 'sideways_strategy': 'mean_reversion', 'sideways_bb_std_mult': 1.8616003757984771, 'sideways_rsi_os': 47, 'sideways_rsi_ob': 71, 'sideways_adx_thresh': 6.481149537590138, 'sideways_atr_min_pct': 0.007387238533208819, 'sideways_atr_max_pct': 0.1331012373650046, 'sideways_tp_mult': 1.7852041410018595, 'sideways_tsl_mult': 0.8035808089563269, 'sideways_time_stop': 114, 'sideways_use_sma': False, 'sideways_use_ema': False, 'sideways_use_atr': True, 'sideways_use_adx': False, 'sideways_use_spike': False, 'sideways_rsi_required': True}.
[I 2025-09-01 14:59:32,150] Trial 430 finished with values: [-0.048820378163065614, 0.04868751099708482] and parameters: {'p_sma': 10, 'p_std': 8, 'p_atr': 16, 'p_adx': 22, 'rsi_period': 45, 'ema1': 30, 'ema2': 52, 'slip_atr_k': 0.08808092356439431, 'slip_spread_k': 0.24273645460345583, 'spread_hl_frac': 0.01463471479443418, 'bb_std_mult': 1.5681844000453198, 'rsi_os': 31, 'rsi_ob': 54, 'vol_spike': 0.09487154278111451, 'adx_thresh': 20.686061642738537, 'atr_min_pct': 0.003945451716672415, 'atr_max_pct': 0.07122609562128743, 'tp_mult': 1.896877611717981, 'tsl_mult': 0.7230625707790523, 'strategy': 'mean_reversion', 'time_stop': 65, 'use_sma': True, 'use_atr': True, 'use_adx': False, 'use_ema': True, 'use_spike': False, 'rsi_required': False, 'edge_k': 0.6430207774294369, 'edge_cap': 0.11774802281386909, 'bull_strategy': 'breakout', 'bull_bb_std_mult': 2.8542212005360583, 'bull_rsi_os': 19, 'bull_rsi_ob': 48, 'bull_adx_thresh': 10.440638602621753, 'bull_atr_min_pct': 0.0011106002093176836, 'bull_atr_max_pct': 0.026107310822123392, 'bull_tp_mult': 1.8519891282692822, 'bull_tsl_mult': 0.152037453849183, 'bull_time_stop': 157, 'bull_use_sma': True, 'bull_use_ema': False, 'bull_use_atr': False, 'bull_use_adx': True, 'bull_use_spike': True, 'bull_rsi_required': False, 'bear_strategy': 'mean_reversion', 'bear_bb_std_mult': 3.1144850501516395, 'bear_rsi_os': 38, 'bear_rsi_ob': 79, 'bear_adx_thresh': 28.230065029779826, 'bear_atr_min_pct': 0.022745402528985267, 'bear_atr_max_pct': 0.02444730245715898, 'bear_tp_mult': 2.9979965082844187, 'bear_tsl_mult': 0.737661063339798, 'bear_time_stop': 278, 'bear_use_sma': False, 'bear_use_ema': True, 'bear_use_atr': False, 'bear_use_adx': False, 'bear_use_spike': False, 'bear_rsi_required': True, 'sideways_strategy': 'mean_reversion', 'sideways_bb_std_mult': 1.8461167704616737, 'sideways_rsi_os': 28, 'sideways_rsi_ob': 90, 'sideways_adx_thresh': 6.698168482483857, 'sideways_atr_min_pct': 0.007307213907457422, 'sideways_atr_max_pct': 0.1294101522145746, 'sideways_tp_mult': 2.56074243712716, 'sideways_tsl_mult': 0.28243248663847614, 'sideways_time_stop': 294, 'sideways_use_sma': False, 'sideways_use_ema': False, 'sideways_use_atr': True, 'sideways_use_adx': False, 'sideways_use_spike': False, 'sideways_rsi_required': True}.
[I 2025-09-01 14:59:32,986] Trial 434 finished with values: [-1000000000.0, 1000000000.0] and parameters: {'p_sma': 15, 'p_std': 38, 'p_atr': 20, 'p_adx': 28, 'rsi_period': 64, 'ema1': 30, 'ema2': 33, 'slip_atr_k': 0.05252000496888104, 'slip_spread_k': 0.2158283426622282, 'spread_hl_frac': 0.014419343433060986, 'bb_std_mult': 1.443829805531936, 'rsi_os': 24, 'rsi_ob': 78, 'vol_spike': 0.2886677660634316, 'adx_thresh': 19.834377458366962, 'atr_min_pct': 0.014491272995340157, 'atr_max_pct': 0.012717430604164526, 'tp_mult': 2.897087666888467, 'tsl_mult': 0.9477210282863024, 'strategy': 'mean_reversion', 'time_stop': 76, 'use_sma': False, 'use_atr': False, 'use_adx': True, 'use_ema': False, 'use_spike': True, 'rsi_required': True, 'edge_k': 0.2969174552617073, 'edge_cap': 0.3129888275101359, 'bull_strategy': 'breakout', 'bull_bb_std_mult': 2.873505709422609, 'bull_rsi_os': 13, 'bull_rsi_ob': 64, 'bull_adx_thresh': 16.260347388649205, 'bull_atr_min_pct': 0.012611981612323556, 'bull_atr_max_pct': 0.021149618980448183, 'bull_tp_mult': 2.1804494427682326, 'bull_tsl_mult': 0.9181636396864672, 'bull_time_stop': 18, 'bull_use_sma': False, 'bull_use_ema': True, 'bull_use_atr': True, 'bull_use_adx': False, 'bull_use_spike': False, 'bull_rsi_required': True, 'bear_strategy': 'breakout', 'bear_bb_std_mult': 2.8171562770145306, 'bear_rsi_os': 29, 'bear_rsi_ob': 76, 'bear_adx_thresh': 26.258247638613184, 'bear_atr_min_pct': 0.006694947254998713, 'bear_atr_max_pct': 0.11873441538906072, 'bear_tp_mult': 2.2050280454060034, 'bear_tsl_mult': 0.8245697337666766, 'bear_time_stop': 292, 'bear_use_sma': True, 'bear_use_ema': False, 'bear_use_atr': True, 'bear_use_adx': True, 'bear_use_spike': True, 'bear_rsi_required': False, 'sideways_strategy': 'breakout', 'sideways_bb_std_mult': 2.76554671417506, 'sideways_rsi_os': 41, 'sideways_rsi_ob': 89, 'sideways_adx_thresh': 8.780612373848829, 'sideways_atr_min_pct': 0.006220946977935587, 'sideways_atr_max_pct': 0.05878265550872729, 'sideways_tp_mult': 1.4270210588825698, 'sideways_tsl_mult': 0.605063396281631, 'sideways_time_stop': 247, 'sideways_use_sma': True, 'sideways_use_ema': False, 'sideways_use_atr': False, 'sideways_use_adx': False, 'sideways_use_spike': True, 'sideways_rsi_required': True}.
