[I 2025-09-01 15:11:05,077] Trial 495 finished with values: [-0.028345671165326936, 0.02862541498946023] and parameters: {'p_sma': 41, 'p_std': 11, 'p_atr': 19, 'p_adx': 25, 'rsi_period': 81, 'ema1': 30, 'ema2': 42, 'slip_atr_k': 0.05903823536581246, 'slip_spread_k': 0.8296966704241364, 'spread_hl_frac': 0.012933188925415697, 'bb_std_mult': 1.6740754815767542, 'rsi_os': 35, 'rsi_ob': 77, 'vol_spike': 0.15289629792137632, 'adx_thresh': 20.826535263134733, 'atr_min_pct': 0.015384232590939007, 'atr_max_pct': 0.14828096691593956, 'tp_mult': 1.115082879061931, 'tsl_mult': 0.029794882999131994, 'strategy': 'mean_reversion', 'time_stop': 56, 'use_sma': False, 'use_atr': True, 'use_adx': True, 'use_ema': True, 'use_spike': True, 'rsi_required': False, 'edge_k': 0.4571051410794368, 'edge_cap': 0.22401080002947404, 'bull_strategy': 'breakout', 'bull_bb_std_mult': 2.9190231311895958, 'bull_rsi_os': 36, 'bull_rsi_ob': 49, 'bull_adx_thresh': 27.249836775302974, 'bull_atr_min_pct': 0.0021092734885233347, 'bull_atr_max_pct': 0.05215131906407945, 'bull_tp_mult': 1.7347159576847497, 'bull_tsl_mult': 0.3984348671529778, 'bull_time_stop': 299, 'bull_use_sma': False, 'bull_use_ema': False, 'bull_use_atr': True, 'bull_use_adx': False, 'bull_use_spike': False, 'bull_rsi_required': False, 'bear_strategy': 'mean_reversion', 'bear_bb_std_mult': 2.8591105935037593, 'bear_rsi_os': 8, 'bear_rsi_ob': 95, 'bear_adx_thresh': 29.017719807991732, 'bear_atr_min_pct': 0.025871606482243504, 'bear_atr_max_pct': 0.06814940100800292, 'bear_tp_mult': 2.4077510417474057, 'bear_tsl_mult': 0.6308841540249519, 'bear_time_stop': 286, 'bear_use_sma': False, 'bear_use_ema': True, 'bear_use_atr': True, 'bear_use_adx': True, 'bear_use_spike': True, 'bear_rsi_required': False, 'sideways_strategy': 'mean_reversion', 'sideways_bb_std_mult': 3.492667838222043, 'sideways_rsi_os': 44, 'sideways_rsi_ob': 50, 'sideways_adx_thresh': 8.323342265403282, 'sideways_atr_min_pct': 0.01691102865556592, 'sideways_atr_max_pct': 0.0762377220421291, 'sideways_tp_mult': 1.8893749426239084, 'sideways_tsl_mult': 0.24505623064300666, 'sideways_time_stop': 101, 'sideways_use_sma': False, 'sideways_use_ema': False, 'sideways_use_atr': False, 'sideways_use_adx': True, 'sideways_use_spike': True, 'sideways_rsi_required': False}.
[I 2025-09-01 15:11:05,251] Trial 494 finished with values: [-0.03701388737672018, 0.037039298120210666] and parameters: {'p_sma': 49, 'p_std': 10, 'p_atr': 12, 'p_adx': 25, 'rsi_period': 81, 'ema1': 16, 'ema2': 54, 'slip_atr_k': 0.05854604127647485, 'slip_spread_k': 0.3023942896360403, 'spread_hl_frac': 0.04297312374313384, 'bb_std_mult': 0.7372653538035663, 'rsi_os': 35, 'rsi_ob': 70, 'vol_spike': 0.026364129345464588, 'adx_thresh': 31.320118650829635, 'atr_min_pct': 0.015533246446791582, 'atr_max_pct': 0.059456905930224485, 'tp_mult': 2.81995518230097, 'tsl_mult': 0.3326838227444405, 'strategy': 'mean_reversion', 'time_stop': 97, 'use_sma': False, 'use_atr': True, 'use_adx': True, 'use_ema': True, 'use_spike': True, 'rsi_required': False, 'edge_k': 0.010859017900379464, 'edge_cap': 0.23963773593758692, 'bull_strategy': 'breakout', 'bull_bb_std_mult': 2.4863234839521304, 'bull_rsi_os': 36, 'bull_rsi_ob': 83, 'bull_adx_thresh': 11.887822904178446, 'bull_atr_min_pct': 0.004209663005236394, 'bull_atr_max_pct': 0.14285856140800002, 'bull_tp_mult': 2.8781261804301614, 'bull_tsl_mult': 0.4000489376013428, 'bull_time_stop': 300, 'bull_use_sma': True, 'bull_use_ema': False, 'bull_use_atr': False, 'bull_use_adx': False, 'bull_use_spike': False, 'bull_rsi_required': False, 'bear_strategy': 'mean_reversion', 'bear_bb_std_mult': 1.1929781519109612, 'bear_rsi_os': 14, 'bear_rsi_ob': 76, 'bear_adx_thresh': 5.0715127217192, 'bear_atr_min_pct': 0.00873476008252945, 'bear_atr_max_pct': 0.1073539901661364, 'bear_tp_mult': 2.404603256999416, 'bear_tsl_mult': 0.16490961980760743, 'bear_time_stop': 243, 'bear_use_sma': False, 'bear_use_ema': True, 'bear_use_atr': True, 'bear_use_adx': True, 'bear_use_spike': True, 'bear_rsi_required': False, 'sideways_strategy': 'mean_reversion', 'sideways_bb_std_mult': 2.7223057537002253, 'sideways_rsi_os': 50, 'sideways_rsi_ob': 90, 'sideways_adx_thresh': 6.481103579478247, 'sideways_atr_min_pct': 0.004153726789703803, 'sideways_atr_max_pct': 0.031488132647986694, 'sideways_tp_mult': 1.376887486114175, 'sideways_tsl_mult': 0.5514918632858127, 'sideways_time_stop': 207, 'sideways_use_sma': False, 'sideways_use_ema': False, 'sideways_use_atr': False, 'sideways_use_adx': False, 'sideways_use_spike': True, 'sideways_rsi_required': False}.
[I 2025-09-01 15:11:43,292] Trial 499 finished with values: [-1000000000.0, 1000000000.0] and parameters: {'p_sma': 21, 'p_std': 7, 'p_atr': 20, 'p_adx': 24, 'rsi_period': 66, 'ema1': 29, 'ema2': 22, 'slip_atr_k': 0.21407927800173782, 'slip_spread_k': 0.22041347198819314, 'spread_hl_frac': 0.03962489215149668, 'bb_std_mult': 2.9219647446363632, 'rsi_os': 37, 'rsi_ob': 59, 'vol_spike': 0.12172084544013909, 'adx_thresh': 26.227292214461222, 'atr_min_pct': 0.01846826364805166, 'atr_max_pct': 0.12465602475461658, 'tp_mult': 2.456923225393461, 'tsl_mult': 0.049481593100390166, 'strategy': 'breakout', 'time_stop': 281, 'use_sma': False, 'use_atr': False, 'use_adx': False, 'use_ema': False, 'use_spike': True, 'rsi_required': True, 'edge_k': 1.9493010768451058, 'edge_cap': 0.7062090002361755, 'bull_strategy': 'breakout', 'bull_bb_std_mult': 2.534096177547197, 'bull_rsi_os': 17, 'bull_rsi_ob': 69, 'bull_adx_thresh': 10.06526448290141, 'bull_atr_min_pct': 0.013595156153647965, 'bull_atr_max_pct': 0.010039071654065144, 'bull_tp_mult': 2.096409811274908, 'bull_tsl_mult': 0.35655701871630463, 'bull_time_stop': 150, 'bull_use_sma': True, 'bull_use_ema': True, 'bull_use_atr': False, 'bull_use_adx': True, 'bull_use_spike': False, 'bull_rsi_required': True, 'bear_strategy': 'breakout', 'bear_bb_std_mult': 1.1888378262610222, 'bear_rsi_os': 6, 'bear_rsi_ob': 64, 'bear_adx_thresh': 31.448163670678348, 'bear_atr_min_pct': 0.022474327839738933, 'bear_atr_max_pct': 0.13598623316906613, 'bear_tp_mult': 1.3781500030619154, 'bear_tsl_mult': 0.5447342400136289, 'bear_time_stop': 293, 'bear_use_sma': True, 'bear_use_ema': False, 'bear_use_atr': False, 'bear_use_adx': False, 'bear_use_spike': False, 'bear_rsi_required': True, 'sideways_strategy': 'breakout', 'sideways_bb_std_mult': 0.9473582242293863, 'sideways_rsi_os': 17, 'sideways_rsi_ob': 45, 'sideways_adx_thresh': 14.353933514715838, 'sideways_atr_min_pct': 0.025139112694095474, 'sideways_atr_max_pct': 0.03691011944366172, 'sideways_tp_mult': 2.2634831348247815, 'sideways_tsl_mult': 0.07706768105978201, 'sideways_time_stop': 111, 'sideways_use_sma': True, 'sideways_use_ema': False, 'sideways_use_atr': True, 'sideways_use_adx': False, 'sideways_use_spike': True, 'sideways_rsi_required': True}.
[I 2025-09-01 15:11:43,642] Trial 498 finished with values: [-0.013703244436245376, 0.013537727607914057] and parameters: {'p_sma': 21, 'p_std': 7, 'p_atr': 20, 'p_adx': 24, 'rsi_period': 66, 'ema1': 16, 'ema2': 54, 'slip_atr_k': 0.0451440341342265, 'slip_spread_k': 0.41073370385161684, 'spread_hl_frac': 0.043152717334311336, 'bb_std_mult': 1.534363668649722, 'rsi_os': 38, 'rsi_ob': 45, 'vol_spike': 0.11805714547226193, 'adx_thresh': 20.134106404020333, 'atr_min_pct': 0.014722785051386791, 'atr_max_pct': 0.1199839761099191, 'tp_mult': 2.3147626473314027, 'tsl_mult': 0.333036961173109, 'strategy': 'breakout', 'time_stop': 62, 'use_sma': False, 'use_atr': False, 'use_adx': False, 'use_ema': False, 'use_spike': True, 'rsi_required': True, 'edge_k': 0.006793683491343128, 'edge_cap': 0.6381681453236865, 'bull_strategy': 'breakout', 'bull_bb_std_mult': 1.369592360662218, 'bull_rsi_os': 17, 'bull_rsi_ob': 82, 'bull_adx_thresh': 9.175804285907258, 'bull_atr_min_pct': 0.003813062964164231, 'bull_atr_max_pct': 0.015783702522070973, 'bull_tp_mult': 2.0892949600951827, 'bull_tsl_mult': 0.35179648468685787, 'bull_time_stop': 13, 'bull_use_sma': True, 'bull_use_ema': True, 'bull_use_atr': False, 'bull_use_adx': True, 'bull_use_spike': False, 'bull_rsi_required': True, 'bear_strategy': 'breakout', 'bear_bb_std_mult': 2.6304251902787055, 'bear_rsi_os': 6, 'bear_rsi_ob': 54, 'bear_adx_thresh': 27.855868733444257, 'bear_atr_min_pct': 0.028650757784988032, 'bear_atr_max_pct': 0.10701383292721986, 'bear_tp_mult': 1.8738160551093157, 'bear_tsl_mult': 0.6063924292274749, 'bear_time_stop': 256, 'bear_use_sma': True, 'bear_use_ema': False, 'bear_use_atr': False, 'bear_use_adx': False, 'bear_use_spike': False, 'bear_rsi_required': True, 'sideways_strategy': 'breakout', 'sideways_bb_std_mult': 3.1701901545742768, 'sideways_rsi_os': 17, 'sideways_rsi_ob': 68, 'sideways_adx_thresh': 19.66787940412941, 'sideways_atr_min_pct': 0.01045703592946863, 'sideways_atr_max_pct': 0.10822452708702536, 'sideways_tp_mult': 2.2343260936400853, 'sideways_tsl_mult': 0.061081376599757264, 'sideways_time_stop': 112, 'sideways_use_sma': True, 'sideways_use_ema': False, 'sideways_use_atr': True, 'sideways_use_adx': False, 'sideways_use_spike': True, 'sideways_rsi_required': True}.
[I 2025-09-01 15:11:43,999] Trial 497 finished with values: [-0.015288422165359195, 0.015210264901428917] and parameters: {'p_sma': 37, 'p_std': 7, 'p_atr': 7, 'p_adx': 10, 'rsi_period': 21, 'ema1': 16, 'ema2': 43, 'slip_atr_k': 0.03867507915112804, 'slip_spread_k': 0.2495876439215407, 'spread_hl_frac': 0.0161599846597451, 'bb_std_mult': 1.6588533793496845, 'rsi_os': 38, 'rsi_ob': 50, 'vol_spike': 0.11831234187999567, 'adx_thresh': 26.328312720767016, 'atr_min_pct': 0.010526161609890504, 'atr_max_pct': 0.12491505508338417, 'tp_mult': 2.832605907156365, 'tsl_mult': 0.32812167200707126, 'strategy': 'breakout', 'time_stop': 250, 'use_sma': False, 'use_atr': False, 'use_adx': True, 'use_ema': True, 'use_spike': False, 'rsi_required': True, 'edge_k': 1.9441126078797868, 'edge_cap': 0.07289600786433846, 'bull_strategy': 'mean_reversion', 'bull_bb_std_mult': 2.4606235027152024, 'bull_rsi_os': 16, 'bull_rsi_ob': 46, 'bull_adx_thresh': 22.450980927828308, 'bull_atr_min_pct': 0.004081653237030576, 'bull_atr_max_pct': 0.012684666365005025, 'bull_tp_mult': 2.660406151490246, 'bull_tsl_mult': 0.422392428907012, 'bull_time_stop': 266, 'bull_use_sma': False, 'bull_use_ema': False, 'bull_use_atr': True, 'bull_use_adx': True, 'bull_use_spike': True, 'bull_rsi_required': False, 'bear_strategy': 'mean_reversion', 'bear_bb_std_mult': 2.1630216383488032, 'bear_rsi_os': 7, 'bear_rsi_ob': 94, 'bear_adx_thresh': 28.96220780033016, 'bear_atr_min_pct': 0.022457696904874425, 'bear_atr_max_pct': 0.11701560829301919, 'bear_tp_mult': 1.883910242043468, 'bear_tsl_mult': 0.495713564466761, 'bear_time_stop': 255, 'bear_use_sma': False, 'bear_use_ema': True, 'bear_use_atr': True, 'bear_use_adx': False, 'bear_use_spike': False, 'bear_rsi_required': False, 'sideways_strategy': 'breakout', 'sideways_bb_std_mult': 3.19706624632659, 'sideways_rsi_os': 17, 'sideways_rsi_ob': 68, 'sideways_adx_thresh': 33.99976525867509, 'sideways_atr_min_pct': 0.025119721367837453, 'sideways_atr_max_pct': 0.07679242416537395, 'sideways_tp_mult': 2.257995688780584, 'sideways_tsl_mult': 0.07369515526193743, 'sideways_time_stop': 113, 'sideways_use_sma': True, 'sideways_use_ema': False, 'sideways_use_atr': True, 'sideways_use_adx': True, 'sideways_use_spike': True, 'sideways_rsi_required': True}.
[I 2025-09-01 15:11:44,259] Trial 500 finished with values: [-1000000000.0, 1000000000.0] and parameters: {'p_sma': 15, 'p_std': 7, 'p_atr': 7, 'p_adx': 8, 'rsi_period': 66, 'ema1': 19, 'ema2': 52, 'slip_atr_k': 0.17799549026093553, 'slip_spread_k': 0.5395008261611967, 'spread_hl_frac': 0.011988461023421507, 'bb_std_mult': 1.5080686885216854, 'rsi_os': 48, 'rsi_ob': 88, 'vol_spike': 0.2082704780841919, 'adx_thresh': 18.593860353667164, 'atr_min_pct': 0.0161543540523345, 'atr_max_pct': 0.11847199747270992, 'tp_mult': 2.7398072543792287, 'tsl_mult': 0.05853257333367663, 'strategy': 'breakout', 'time_stop': 283, 'use_sma': False, 'use_atr': False, 'use_adx': False, 'use_ema': False, 'use_spike': False, 'rsi_required': True, 'edge_k': 0.6042335790821567, 'edge_cap': 0.08070660726274433, 'bull_strategy': 'mean_reversion', 'bull_bb_std_mult': 2.7898351819350804, 'bull_rsi_os': 16, 'bull_rsi_ob': 75, 'bull_adx_thresh': 11.274212839961319, 'bull_atr_min_pct': 0.016960617011583724, 'bull_atr_max_pct': 0.01746540824939097, 'bull_tp_mult': 2.1990087208895823, 'bull_tsl_mult': 0.35596252005093837, 'bull_time_stop': 150, 'bull_use_sma': True, 'bull_use_ema': True, 'bull_use_atr': False, 'bull_use_adx': True, 'bull_use_spike': True, 'bull_rsi_required': True, 'bear_strategy': 'breakout', 'bear_bb_std_mult': 2.640129792627685, 'bear_rsi_os': 6, 'bear_rsi_ob': 62, 'bear_adx_thresh': 26.940200836993967, 'bear_atr_min_pct': 0.022838099604079634, 'bear_atr_max_pct': 0.10338669877648478, 'bear_tp_mult': 1.3930297406655088, 'bear_tsl_mult': 0.6067150168250706, 'bear_time_stop': 292, 'bear_use_sma': True, 'bear_use_ema': False, 'bear_use_atr': False, 'bear_use_adx': False, 'bear_use_spike': False, 'bear_rsi_required': True, 'sideways_strategy': 'breakout', 'sideways_bb_std_mult': 3.177129226562036, 'sideways_rsi_os': 31, 'sideways_rsi_ob': 67, 'sideways_adx_thresh': 19.69149030862593, 'sideways_atr_min_pct': 0.02535222079664882, 'sideways_atr_max_pct': 0.10877383022418348, 'sideways_tp_mult': 2.2560024504189164, 'sideways_tsl_mult': 0.2670625247369208, 'sideways_time_stop': 112, 'sideways_use_sma': True, 'sideways_use_ema': False, 'sideways_use_atr': True, 'sideways_use_adx': False, 'sideways_use_spike': True, 'sideways_rsi_required': True}.
[I 2025-09-01 15:12:21,137] Trial 503 finished with values: [-0.010017295382515279, 0.010286140239876096] and parameters: {'p_sma': 15, 'p_std': 7, 'p_atr': 20, 'p_adx': 13, 'rsi_period': 65, 'ema1': 7, 'ema2': 52, 'slip_atr_k': 0.03810904548068314, 'slip_spread_k': 0.43682373956503673, 'spread_hl_frac': 0.009647955485720675, 'bb_std_mult': 1.5039774759949842, 'rsi_os': 48, 'rsi_ob': 88, 'vol_spike': 0.27601572200000557, 'adx_thresh': 15.929089112445556, 'atr_min_pct': 0.004238498711221488, 'atr_max_pct': 0.049385247797270854, 'tp_mult': 2.7550279358285614, 'tsl_mult': 0.06998857421797987, 'strategy': 'breakout', 'time_stop': 65, 'use_sma': False, 'use_atr': True, 'use_adx': True, 'use_ema': False, 'use_spike': False, 'rsi_required': False, 'edge_k': 0.6067571261063671, 'edge_cap': 0.07820197084630268, 'bull_strategy': 'mean_reversion', 'bull_bb_std_mult': 2.790908744126023, 'bull_rsi_os': 16, 'bull_rsi_ob': 45, 'bull_adx_thresh': 29.96672936231451, 'bull_atr_min_pct': 0.0037621899935741943, 'bull_atr_max_pct': 0.016265277511923495, 'bull_tp_mult': 2.086580303123388, 'bull_tsl_mult': 0.5327004999559887, 'bull_time_stop': 122, 'bull_use_sma': True, 'bull_use_ema': False, 'bull_use_atr': False, 'bull_use_adx': True, 'bull_use_spike': True, 'bull_rsi_required': True, 'bear_strategy': 'mean_reversion', 'bear_bb_std_mult': 3.1751308592339065, 'bear_rsi_os': 9, 'bear_rsi_ob': 49, 'bear_adx_thresh': 26.930712410137087, 'bear_atr_min_pct': 0.01682260664054667, 'bear_atr_max_pct': 0.10372033201738572, 'bear_tp_mult': 1.8928985642010614, 'bear_tsl_mult': 0.5779224676454786, 'bear_time_stop': 67, 'bear_use_sma': False, 'bear_use_ema': False, 'bear_use_atr': False, 'bear_use_adx': False, 'bear_use_spike': False, 'bear_rsi_required': False, 'sideways_strategy': 'mean_reversion', 'sideways_bb_std_mult': 3.194366440815214, 'sideways_rsi_os': 14, 'sideways_rsi_ob': 68, 'sideways_adx_thresh': 7.040086340532327, 'sideways_atr_min_pct': 0.00488361685527822, 'sideways_atr_max_pct': 0.07940073400930302, 'sideways_tp_mult': 1.838248366836981, 'sideways_tsl_mult': 0.3135286092805678, 'sideways_time_stop': 122, 'sideways_use_sma': False, 'sideways_use_ema': False, 'sideways_use_atr': True, 'sideways_use_adx': False, 'sideways_use_spike': True, 'sideways_rsi_required': True}.
[I 2025-09-01 15:12:21,490] Trial 501 finished with values: [-1000000000.0, 1000000000.0] and parameters: {'p_sma': 10, 'p_std': 34, 'p_atr': 18, 'p_adx': 13, 'rsi_period': 65, 'ema1': 29, 'ema2': 28, 'slip_atr_k': 0.0499013287123419, 'slip_spread_k': 0.43778487889651746, 'spread_hl_frac': 0.03512825660248479, 'bb_std_mult': 1.49754177216867, 'rsi_os': 38, 'rsi_ob': 45, 'vol_spike': 0.03781035528081694, 'adx_thresh': 34.15736423779905, 'atr_min_pct': 0.010699804093111826, 'atr_max_pct': 0.049953294215919736, 'tp_mult': 2.72285152362768, 'tsl_mult': 0.06811083615473912, 'strategy': 'breakout', 'time_stop': 247, 'use_sma': False, 'use_atr': True, 'use_adx': True, 'use_ema': False, 'use_spike': False, 'rsi_required': False, 'edge_k': 0.6053024688753715, 'edge_cap': 0.07636353337606913, 'bull_strategy': 'mean_reversion', 'bull_bb_std_mult': 2.7875905231226845, 'bull_rsi_os': 16, 'bull_rsi_ob': 45, 'bull_adx_thresh': 9.397693689332108, 'bull_atr_min_pct': 0.01658405918699485, 'bull_atr_max_pct': 0.015688004996741507, 'bull_tp_mult': 2.2093360611321184, 'bull_tsl_mult': 0.5760029162222631, 'bull_time_stop': 158, 'bull_use_sma': True, 'bull_use_ema': False, 'bull_use_atr': False, 'bull_use_adx': True, 'bull_use_spike': True, 'bull_rsi_required': True, 'bear_strategy': 'mean_reversion', 'bear_bb_std_mult': 1.8545909564093888, 'bear_rsi_os': 45, 'bear_rsi_ob': 77, 'bear_adx_thresh': 27.5076775505978, 'bear_atr_min_pct': 0.021276344642985202, 'bear_atr_max_pct': 0.11736780974619689, 'bear_tp_mult': 1.8869453775914669, 'bear_tsl_mult': 0.5755999973222166, 'bear_time_stop': 277, 'bear_use_sma': False, 'bear_use_ema': False, 'bear_use_atr': False, 'bear_use_adx': False, 'bear_use_spike': False, 'bear_rsi_required': True, 'sideways_strategy': 'mean_reversion', 'sideways_bb_std_mult': 2.0414887940091178, 'sideways_rsi_os': 18, 'sideways_rsi_ob': 73, 'sideways_adx_thresh': 7.172636889921315, 'sideways_atr_min_pct': 0.029386942872997528, 'sideways_atr_max_pct': 0.12842341275835137, 'sideways_tp_mult': 1.7220730047068258, 'sideways_tsl_mult': 0.6878248248955086, 'sideways_time_stop': 123, 'sideways_use_sma': False, 'sideways_use_ema': False, 'sideways_use_atr': True, 'sideways_use_adx': False, 'sideways_use_spike': True, 'sideways_rsi_required': True}.
[I 2025-09-01 15:12:21,926] Trial 502 finished with values: [-1000000000.0, 1000000000.0] and parameters: {'p_sma': 15, 'p_std': 7, 'p_atr': 7, 'p_adx': 15, 'rsi_period': 69, 'ema1': 21, 'ema2': 52, 'slip_atr_k': 0.04819367500696878, 'slip_spread_k': 0.20952809842478037, 'spread_hl_frac': 0.018145231821274015, 'bb_std_mult': 1.4828453846612788, 'rsi_os': 37, 'rsi_ob': 65, 'vol_spike': 0.19122481694550725, 'adx_thresh': 18.800534860021475, 'atr_min_pct': 0.0105038187740287, 'atr_max_pct': 0.07407912987345719, 'tp_mult': 2.9614614791496767, 'tsl_mult': 0.06009092160183063, 'strategy': 'breakout', 'time_stop': 64, 'use_sma': False, 'use_atr': True, 'use_adx': True, 'use_ema': False, 'use_spike': False, 'rsi_required': False, 'edge_k': 0.608803954458685, 'edge_cap': 0.6396542679926096, 'bull_strategy': 'mean_reversion', 'bull_bb_std_mult': 1.3872836599486584, 'bull_rsi_os': 16, 'bull_rsi_ob': 45, 'bull_adx_thresh': 9.303940027616237, 'bull_atr_min_pct': 0.017162429020345572, 'bull_atr_max_pct': 0.01671989351042865, 'bull_tp_mult': 2.2140979698529866, 'bull_tsl_mult': 0.3327852475273683, 'bull_time_stop': 36, 'bull_use_sma': True, 'bull_use_ema': False, 'bull_use_atr': False, 'bull_use_adx': True, 'bull_use_spike': True, 'bull_rsi_required': True, 'bear_strategy': 'mean_reversion', 'bear_bb_std_mult': 2.1280138369408603, 'bear_rsi_os': 10, 'bear_rsi_ob': 77, 'bear_adx_thresh': 27.551861839856652, 'bear_atr_min_pct': 0.023055607255618175, 'bear_atr_max_pct': 0.09567793543908684, 'bear_tp_mult': 2.025809659999495, 'bear_tsl_mult': 0.6059358377642764, 'bear_time_stop': 279, 'bear_use_sma': False, 'bear_use_ema': False, 'bear_use_atr': False, 'bear_use_adx': False, 'bear_use_spike': False, 'bear_rsi_required': True, 'sideways_strategy': 'mean_reversion', 'sideways_bb_std_mult': 0.7210887044151619, 'sideways_rsi_os': 42, 'sideways_rsi_ob': 86, 'sideways_adx_thresh': 24.644690039735302, 'sideways_atr_min_pct': 0.021882447247649758, 'sideways_atr_max_pct': 0.10944024738949815, 'sideways_tp_mult': 2.896918117289868, 'sideways_tsl_mult': 0.2666354811046217, 'sideways_time_stop': 285, 'sideways_use_sma': False, 'sideways_use_ema': False, 'sideways_use_atr': True, 'sideways_use_adx': False, 'sideways_use_spike': True, 'sideways_rsi_required': True}.
