[I 2025-09-01 14:27:29,111] Trial 225 finished with values: [-1000000000.0, 1000000000.0] and parameters: {'p_sma': 11, 'p_std': 6, 'p_atr': 19, 'p_adx': 11, 'rsi_period': 84, 'ema1': 11, 'ema2': 17, 'slip_atr_k': 0.09282271793863557, 'slip_spread_k': 0.11099551355955717, 'spread_hl_frac': 0.015840679708413845, 'bb_std_mult': 1.4133518619472867, 'rsi_os': 47, 'rsi_ob': 48, 'vol_spike': 0.14959779614675053, 'adx_thresh': 30.274888125932286, 'atr_min_pct': 0.023967858947400552, 'atr_max_pct': 0.07618075023891623, 'tp_mult': 2.98854219731513, 'tsl_mult': 0.9145351538367882, 'strategy': 'breakout', 'time_stop': 76, 'use_sma': False, 'use_atr': True, 'use_adx': True, 'use_ema': False, 'use_spike': True, 'rsi_required': False, 'edge_k': 0.5694699223418135, 'edge_cap': 0.09790931663124158, 'bull_strategy': 'breakout', 'bull_bb_std_mult': 3.3165942742031698, 'bull_rsi_os': 25, 'bull_rsi_ob': 49, 'bull_adx_thresh': 11.609408840173376, 'bull_atr_min_pct': 0.026052341650507307, 'bull_atr_max_pct': 0.014853185491149001, 'bull_tp_mult': 2.0272066594049734, 'bull_tsl_mult': 0.7794070082090525, 'bull_time_stop': 157, 'bull_use_sma': True, 'bull_use_ema': False, 'bull_use_atr': False, 'bull_use_adx': True, 'bull_use_spike': False, 'bull_rsi_required': False, 'bear_strategy': 'mean_reversion', 'bear_bb_std_mult': 2.6564661892420545, 'bear_rsi_os': 8, 'bear_rsi_ob': 77, 'bear_adx_thresh': 27.79435100631736, 'bear_atr_min_pct': 0.02332931071391692, 'bear_atr_max_pct': 0.11235764764602581, 'bear_tp_mult': 1.1045590093014745, 'bear_tsl_mult': 0.6147828534275872, 'bear_time_stop': 203, 'bear_use_sma': False, 'bear_use_ema': False, 'bear_use_atr': False, 'bear_use_adx': True, 'bear_use_spike': False, 'bear_rsi_required': False, 'sideways_strategy': 'mean_reversion', 'sideways_bb_std_mult': 1.41205423120884, 'sideways_rsi_os': 6, 'sideways_rsi_ob': 88, 'sideways_adx_thresh': 7.280081190003814, 'sideways_atr_min_pct': 0.023955138059851104, 'sideways_atr_max_pct': 0.1392158081366984, 'sideways_tp_mult': 2.7337895164649746, 'sideways_tsl_mult': 0.3284855977044705, 'sideways_time_stop': 112, 'sideways_use_sma': False, 'sideways_use_ema': False, 'sideways_use_atr': True, 'sideways_use_adx': False, 'sideways_use_spike': True, 'sideways_rsi_required': True}.
[I 2025-09-01 14:27:29,489] Trial 226 finished with values: [-1000000000.0, 1000000000.0] and parameters: {'p_sma': 12, 'p_std': 12, 'p_atr': 22, 'p_adx': 26, 'rsi_period': 64, 'ema1': 11, 'ema2': 24, 'slip_atr_k': 0.16302865528645644, 'slip_spread_k': 0.29275316841748644, 'spread_hl_frac': 0.01430953087079779, 'bb_std_mult': 1.684062548150137, 'rsi_os': 47, 'rsi_ob': 45, 'vol_spike': 0.29292431881258224, 'adx_thresh': 30.533164516653933, 'atr_min_pct': 0.013797434400511774, 'atr_max_pct': 0.07126999641305533, 'tp_mult': 2.3264644064094813, 'tsl_mult': 0.08388878484021169, 'strategy': 'breakout', 'time_stop': 47, 'use_sma': False, 'use_atr': True, 'use_adx': True, 'use_ema': False, 'use_spike': True, 'rsi_required': False, 'edge_k': 0.16907376491898318, 'edge_cap': 0.052978696847277004, 'bull_strategy': 'breakout', 'bull_bb_std_mult': 2.442977107518784, 'bull_rsi_os': 14, 'bull_rsi_ob': 82, 'bull_adx_thresh': 16.082052094281366, 'bull_atr_min_pct': 0.029259290388826638, 'bull_atr_max_pct': 0.015238176754673035, 'bull_tp_mult': 2.0288002373322165, 'bull_tsl_mult': 0.18561460790995205, 'bull_time_stop': 156, 'bull_use_sma': True, 'bull_use_ema': False, 'bull_use_atr': False, 'bull_use_adx': True, 'bull_use_spike': False, 'bull_rsi_required': True, 'bear_strategy': 'mean_reversion', 'bear_bb_std_mult': 3.3034070234930955, 'bear_rsi_os': 7, 'bear_rsi_ob': 73, 'bear_adx_thresh': 20.935792696786823, 'bear_atr_min_pct': 0.02329576800356224, 'bear_atr_max_pct': 0.11276756308807795, 'bear_tp_mult': 2.240157008185221, 'bear_tsl_mult': 0.6116338542277593, 'bear_time_stop': 155, 'bear_use_sma': False, 'bear_use_ema': False, 'bear_use_atr': False, 'bear_use_adx': True, 'bear_use_spike': False, 'bear_rsi_required': False, 'sideways_strategy': 'mean_reversion', 'sideways_bb_std_mult': 3.1685541770466807, 'sideways_rsi_os': 15, 'sideways_rsi_ob': 60, 'sideways_adx_thresh': 7.248964146134487, 'sideways_atr_min_pct': 0.0058004073590243125, 'sideways_atr_max_pct': 0.13908835062152974, 'sideways_tp_mult': 2.7520643007531325, 'sideways_tsl_mult': 0.23026462097171613, 'sideways_time_stop': 176, 'sideways_use_sma': False, 'sideways_use_ema': False, 'sideways_use_atr': True, 'sideways_use_adx': False, 'sideways_use_spike': True, 'sideways_rsi_required': True}.
[I 2025-09-01 14:28:06,151] Trial 228 finished with values: [-1000000000.0, 1000000000.0] and parameters: {'p_sma': 15, 'p_std': 8, 'p_atr': 20, 'p_adx': 26, 'rsi_period': 64, 'ema1': 23, 'ema2': 53, 'slip_atr_k': 0.10210070260755114, 'slip_spread_k': 0.910164260875459, 'spread_hl_frac': 0.017175293924261953, 'bb_std_mult': 3.3760100534355253, 'rsi_os': 24, 'rsi_ob': 73, 'vol_spike': 0.28963040296758175, 'adx_thresh': 30.63030117850478, 'atr_min_pct': 0.027348669124187826, 'atr_max_pct': 0.07177730316063649, 'tp_mult': 2.918939335242159, 'tsl_mult': 0.08341181992316489, 'strategy': 'breakout', 'time_stop': 56, 'use_sma': False, 'use_atr': True, 'use_adx': False, 'use_ema': False, 'use_spike': True, 'rsi_required': False, 'edge_k': 0.15216900772228603, 'edge_cap': 0.35155820335340954, 'bull_strategy': 'breakout', 'bull_bb_std_mult': 2.3459393267711137, 'bull_rsi_os': 50, 'bull_rsi_ob': 51, 'bull_adx_thresh': 11.509453633986709, 'bull_atr_min_pct': 0.022487483656040495, 'bull_atr_max_pct': 0.04885618104720663, 'bull_tp_mult': 2.102269804100874, 'bull_tsl_mult': 0.36955137943508787, 'bull_time_stop': 157, 'bull_use_sma': True, 'bull_use_ema': False, 'bull_use_atr': False, 'bull_use_adx': True, 'bull_use_spike': False, 'bull_rsi_required': True, 'bear_strategy': 'mean_reversion', 'bear_bb_std_mult': 2.6837547354965587, 'bear_rsi_os': 8, 'bear_rsi_ob': 79, 'bear_adx_thresh': 21.95632134519684, 'bear_atr_min_pct': 0.01182191496724408, 'bear_atr_max_pct': 0.10743221869845838, 'bear_tp_mult': 2.1698741161786725, 'bear_tsl_mult': 0.6052230418615979, 'bear_time_stop': 199, 'bear_use_sma': False, 'bear_use_ema': False, 'bear_use_atr': False, 'bear_use_adx': True, 'bear_use_spike': False, 'bear_rsi_required': False, 'sideways_strategy': 'mean_reversion', 'sideways_bb_std_mult': 3.5162428924373206, 'sideways_rsi_os': 15, 'sideways_rsi_ob': 88, 'sideways_adx_thresh': 6.48066295652451, 'sideways_atr_min_pct': 0.006862261007257115, 'sideways_atr_max_pct': 0.1385130315117781, 'sideways_tp_mult': 1.502331377575404, 'sideways_tsl_mult': 0.3320702050639145, 'sideways_time_stop': 112, 'sideways_use_sma': False, 'sideways_use_ema': False, 'sideways_use_atr': True, 'sideways_use_adx': False, 'sideways_use_spike': True, 'sideways_rsi_required': True}.
[I 2025-09-01 14:28:06,619] Trial 227 finished with values: [-1000000000.0, 1000000000.0] and parameters: {'p_sma': 18, 'p_std': 8, 'p_atr': 20, 'p_adx': 14, 'rsi_period': 8, 'ema1': 15, 'ema2': 50, 'slip_atr_k': 0.1657350492437258, 'slip_spread_k': 0.2213358766792431, 'spread_hl_frac': 0.016749635533843704, 'bb_std_mult': 1.706580658834496, 'rsi_os': 24, 'rsi_ob': 73, 'vol_spike': 0.2588479381245461, 'adx_thresh': 30.334778067825795, 'atr_min_pct': 0.02200823573827135, 'atr_max_pct': 0.035366539493307196, 'tp_mult': 1.179300802313522, 'tsl_mult': 0.7873524493028002, 'strategy': 'breakout', 'time_stop': 74, 'use_sma': False, 'use_atr': True, 'use_adx': False, 'use_ema': False, 'use_spike': True, 'rsi_required': False, 'edge_k': 1.3035174613357634, 'edge_cap': 0.053523367300156874, 'bull_strategy': 'breakout', 'bull_bb_std_mult': 2.317076359812165, 'bull_rsi_os': 50, 'bull_rsi_ob': 80, 'bull_adx_thresh': 11.474740718028498, 'bull_atr_min_pct': 0.01354672856961759, 'bull_atr_max_pct': 0.015008767700571383, 'bull_tp_mult': 2.0757348397266333, 'bull_tsl_mult': 0.5433815580435523, 'bull_time_stop': 159, 'bull_use_sma': True, 'bull_use_ema': False, 'bull_use_atr': False, 'bull_use_adx': True, 'bull_use_spike': False, 'bull_rsi_required': True, 'bear_strategy': 'mean_reversion', 'bear_bb_std_mult': 2.32663038359218, 'bear_rsi_os': 7, 'bear_rsi_ob': 79, 'bear_adx_thresh': 26.192455819533187, 'bear_atr_min_pct': 0.02335165941427505, 'bear_atr_max_pct': 0.11187481969304629, 'bear_tp_mult': 2.2446852912691084, 'bear_tsl_mult': 0.6141910155472473, 'bear_time_stop': 278, 'bear_use_sma': False, 'bear_use_ema': False, 'bear_use_atr': False, 'bear_use_adx': True, 'bear_use_spike': False, 'bear_rsi_required': False, 'sideways_strategy': 'mean_reversion', 'sideways_bb_std_mult': 0.6419407140402187, 'sideways_rsi_os': 16, 'sideways_rsi_ob': 88, 'sideways_adx_thresh': 27.54446765283414, 'sideways_atr_min_pct': 0.023465325787887098, 'sideways_atr_max_pct': 0.13873656240590007, 'sideways_tp_mult': 1.5115443110916795, 'sideways_tsl_mult': 0.11683547025153512, 'sideways_time_stop': 113, 'sideways_use_sma': False, 'sideways_use_ema': False, 'sideways_use_atr': True, 'sideways_use_adx': False, 'sideways_use_spike': True, 'sideways_rsi_required': True}.
[I 2025-09-01 14:28:08,000] Trial 229 finished with values: [-1000000000.0, 1000000000.0] and parameters: {'p_sma': 18, 'p_std': 8, 'p_atr': 20, 'p_adx': 26, 'rsi_period': 64, 'ema1': 30, 'ema2': 50, 'slip_atr_k': 0.1657332744529732, 'slip_spread_k': 0.22077341191299182, 'spread_hl_frac': 0.012444239299711895, 'bb_std_mult': 1.7019754099096682, 'rsi_os': 24, 'rsi_ob': 53, 'vol_spike': 0.25453246010382363, 'adx_thresh': 20.506245803950502, 'atr_min_pct': 0.01466940528844979, 'atr_max_pct': 0.07118038012572446, 'tp_mult': 2.3392385005524385, 'tsl_mult': 0.1307776872003708, 'strategy': 'breakout', 'time_stop': 55, 'use_sma': False, 'use_atr': True, 'use_adx': False, 'use_ema': True, 'use_spike': True, 'rsi_required': False, 'edge_k': 0.44717243134914886, 'edge_cap': 0.0850184918078353, 'bull_strategy': 'breakout', 'bull_bb_std_mult': 2.3130160637039445, 'bull_rsi_os': 41, 'bull_rsi_ob': 80, 'bull_adx_thresh': 10.572086578695334, 'bull_atr_min_pct': 0.019731885989424068, 'bull_atr_max_pct': 0.04923607907200524, 'bull_tp_mult': 2.0823703862239453, 'bull_tsl_mult': 0.5847656428826039, 'bull_time_stop': 23, 'bull_use_sma': False, 'bull_use_ema': False, 'bull_use_atr': False, 'bull_use_adx': False, 'bull_use_spike': False, 'bull_rsi_required': True, 'bear_strategy': 'mean_reversion', 'bear_bb_std_mult': 2.6576852199517176, 'bear_rsi_os': 41, 'bear_rsi_ob': 54, 'bear_adx_thresh': 20.646599528597665, 'bear_atr_min_pct': 0.02389251772283895, 'bear_atr_max_pct': 0.1072981038409755, 'bear_tp_mult': 2.3181730270682777, 'bear_tsl_mult': 0.5883880530500198, 'bear_time_stop': 139, 'bear_use_sma': False, 'bear_use_ema': True, 'bear_use_atr': False, 'bear_use_adx': True, 'bear_use_spike': False, 'bear_rsi_required': False, 'sideways_strategy': 'mean_reversion', 'sideways_bb_std_mult': 1.2304208822434102, 'sideways_rsi_os': 15, 'sideways_rsi_ob': 70, 'sideways_adx_thresh': 32.78317176683517, 'sideways_atr_min_pct': 0.02183771389881669, 'sideways_atr_max_pct': 0.13681158389887618, 'sideways_tp_mult': 1.0151859711194011, 'sideways_tsl_mult': 0.11969826831450825, 'sideways_time_stop': 115, 'sideways_use_sma': False, 'sideways_use_ema': True, 'sideways_use_atr': False, 'sideways_use_adx': False, 'sideways_use_spike': True, 'sideways_rsi_required': True}.
[I 2025-09-01 14:28:08,519] Trial 230 finished with values: [-1000000000.0, 1000000000.0] and parameters: {'p_sma': 15, 'p_std': 8, 'p_atr': 11, 'p_adx': 26, 'rsi_period': 8, 'ema1': 23, 'ema2': 50, 'slip_atr_k': 0.17210058391651442, 'slip_spread_k': 0.20956161232250542, 'spread_hl_frac': 0.016917775405718517, 'bb_std_mult': 3.3754391067781375, 'rsi_os': 54, 'rsi_ob': 92, 'vol_spike': 0.2566111797473659, 'adx_thresh': 26.818211053504147, 'atr_min_pct': 0.027893635525778476, 'atr_max_pct': 0.07217653848755143, 'tp_mult': 2.922015176052278, 'tsl_mult': 0.1293109145235926, 'strategy': 'breakout', 'time_stop': 58, 'use_sma': False, 'use_atr': True, 'use_adx': False, 'use_ema': True, 'use_spike': True, 'rsi_required': False, 'edge_k': 0.47001622002925825, 'edge_cap': 0.08633118561942264, 'bull_strategy': 'breakout', 'bull_bb_std_mult': 2.928245351111168, 'bull_rsi_os': 50, 'bull_rsi_ob': 51, 'bull_adx_thresh': 10.623265868427763, 'bull_atr_min_pct': 0.015514643495364881, 'bull_atr_max_pct': 0.0836977435727501, 'bull_tp_mult': 2.1010057236057103, 'bull_tsl_mult': 0.8905641618961678, 'bull_time_stop': 66, 'bull_use_sma': False, 'bull_use_ema': False, 'bull_use_atr': False, 'bull_use_adx': False, 'bull_use_spike': False, 'bull_rsi_required': True, 'bear_strategy': 'mean_reversion', 'bear_bb_std_mult': 2.6640162306930875, 'bear_rsi_os': 41, 'bear_rsi_ob': 79, 'bear_adx_thresh': 27.20717802337423, 'bear_atr_min_pct': 0.00412526989593605, 'bear_atr_max_pct': 0.10773305008444747, 'bear_tp_mult': 2.311387890367639, 'bear_tsl_mult': 0.5861876202671356, 'bear_time_stop': 281, 'bear_use_sma': False, 'bear_use_ema': True, 'bear_use_atr': False, 'bear_use_adx': True, 'bear_use_spike': False, 'bear_rsi_required': False, 'sideways_strategy': 'mean_reversion', 'sideways_bb_std_mult': 1.892400121930798, 'sideways_rsi_os': 18, 'sideways_rsi_ob': 88, 'sideways_adx_thresh': 31.69693125231005, 'sideways_atr_min_pct': 0.021756890027335933, 'sideways_atr_max_pct': 0.04251710565200188, 'sideways_tp_mult': 1.8917961772911158, 'sideways_tsl_mult': 0.06695253908046989, 'sideways_time_stop': 218, 'sideways_use_sma': False, 'sideways_use_ema': True, 'sideways_use_atr': False, 'sideways_use_adx': False, 'sideways_use_spike': True, 'sideways_rsi_required': True}.
[I 2025-09-01 14:28:44,949] Trial 234 finished with values: [-1000000000.0, 1000000000.0] and parameters: {'p_sma': 11, 'p_std': 10, 'p_atr': 21, 'p_adx': 13, 'rsi_period': 69, 'ema1': 30, 'ema2': 52, 'slip_atr_k': 0.07510293738780027, 'slip_spread_k': 0.6049423093631825, 'spread_hl_frac': 0.03229539000102698, 'bb_std_mult': 1.3224092242056587, 'rsi_os': 35, 'rsi_ob': 75, 'vol_spike': 0.20570862859525954, 'adx_thresh': 6.1793868895538235, 'atr_min_pct': 0.015615848604198372, 'atr_max_pct': 0.0798647490177185, 'tp_mult': 2.9336537253301707, 'tsl_mult': 0.06433393030303186, 'strategy': 'breakout', 'time_stop': 70, 'use_sma': True, 'use_atr': True, 'use_adx': True, 'use_ema': False, 'use_spike': True, 'rsi_required': False, 'edge_k': 1.7245220167074384, 'edge_cap': 0.2156856386414584, 'bull_strategy': 'breakout', 'bull_bb_std_mult': 3.0937427714741332, 'bull_rsi_os': 23, 'bull_rsi_ob': 85, 'bull_adx_thresh': 17.663188657308993, 'bull_atr_min_pct': 0.012518975447733855, 'bull_atr_max_pct': 0.05777177860551557, 'bull_tp_mult': 2.7062789560610847, 'bull_tsl_mult': 0.3797654093103565, 'bull_time_stop': 166, 'bull_use_sma': True, 'bull_use_ema': False, 'bull_use_atr': False, 'bull_use_adx': True, 'bull_use_spike': False, 'bull_rsi_required': True, 'bear_strategy': 'mean_reversion', 'bear_bb_std_mult': 2.7993881341326796, 'bear_rsi_os': 45, 'bear_rsi_ob': 75, 'bear_adx_thresh': 29.036200129466515, 'bear_atr_min_pct': 0.022611907023051016, 'bear_atr_max_pct': 0.06989401765337774, 'bear_tp_mult': 1.264857734106863, 'bear_tsl_mult': 0.661900091104276, 'bear_time_stop': 164, 'bear_use_sma': False, 'bear_use_ema': False, 'bear_use_atr': False, 'bear_use_adx': True, 'bear_use_spike': False, 'bear_rsi_required': False, 'sideways_strategy': 'mean_reversion', 'sideways_bb_std_mult': 1.5943919144827667, 'sideways_rsi_os': 17, 'sideways_rsi_ob': 93, 'sideways_adx_thresh': 6.477090756988068, 'sideways_atr_min_pct': 0.0038785758736074333, 'sideways_atr_max_pct': 0.13070723928046257, 'sideways_tp_mult': 1.7816441497611286, 'sideways_tsl_mult': 0.26181545304651854, 'sideways_time_stop': 191, 'sideways_use_sma': False, 'sideways_use_ema': False, 'sideways_use_atr': True, 'sideways_use_adx': False, 'sideways_use_spike': True, 'sideways_rsi_required': True}.
[I 2025-09-01 14:28:46,759] Trial 232 finished with values: [-1000000000.0, 1000000000.0] and parameters: {'p_sma': 6, 'p_std': 11, 'p_atr': 21, 'p_adx': 13, 'rsi_period': 69, 'ema1': 30, 'ema2': 21, 'slip_atr_k': 0.059654945791232844, 'slip_spread_k': 0.6060919218110511, 'spread_hl_frac': 0.0013290484992167194, 'bb_std_mult': 1.3304700091708566, 'rsi_os': 9, 'rsi_ob': 52, 'vol_spike': 0.28017880976922777, 'adx_thresh': 6.060661109443879, 'atr_min_pct': 0.02555648735522481, 'atr_max_pct': 0.07166375226210728, 'tp_mult': 1.4170491124764495, 'tsl_mult': 0.13306855391962563, 'strategy': 'breakout', 'time_stop': 226, 'use_sma': True, 'use_atr': True, 'use_adx': True, 'use_ema': True, 'use_spike': True, 'rsi_required': False, 'edge_k': 1.716854050183277, 'edge_cap': 0.20391963003299207, 'bull_strategy': 'breakout', 'bull_bb_std_mult': 2.8740987057305247, 'bull_rsi_os': 41, 'bull_rsi_ob': 85, 'bull_adx_thresh': 10.498442836505191, 'bull_atr_min_pct': 0.015411817921668295, 'bull_atr_max_pct': 0.05502219775663901, 'bull_tp_mult': 2.444886618451001, 'bull_tsl_mult': 0.849086489415003, 'bull_time_stop': 165, 'bull_use_sma': False, 'bull_use_ema': False, 'bull_use_atr': False, 'bull_use_adx': False, 'bull_use_spike': False, 'bull_rsi_required': True, 'bear_strategy': 'mean_reversion', 'bear_bb_std_mult': 2.89754116739226, 'bear_rsi_os': 28, 'bear_rsi_ob': 75, 'bear_adx_thresh': 24.184030078332185, 'bear_atr_min_pct': 0.00752880523567956, 'bear_atr_max_pct': 0.12185846326487303, 'bear_tp_mult': 1.4830338819511748, 'bear_tsl_mult': 0.43371912667038703, 'bear_time_stop': 218, 'bear_use_sma': False, 'bear_use_ema': True, 'bear_use_atr': False, 'bear_use_adx': True, 'bear_use_spike': False, 'bear_rsi_required': False, 'sideways_strategy': 'mean_reversion', 'sideways_bb_std_mult': 3.2336184749853736, 'sideways_rsi_os': 48, 'sideways_rsi_ob': 93, 'sideways_adx_thresh': 17.95213864278675, 'sideways_atr_min_pct': 0.02939841701173069, 'sideways_atr_max_pct': 0.1271708783077748, 'sideways_tp_mult': 1.5717127995919475, 'sideways_tsl_mult': 0.2590432483853531, 'sideways_time_stop': 193, 'sideways_use_sma': False, 'sideways_use_ema': True, 'sideways_use_atr': False, 'sideways_use_adx': False, 'sideways_use_spike': True, 'sideways_rsi_required': True}.
[I 2025-09-01 14:28:47,363] Trial 231 finished with values: [-1000000000.0, 1000000000.0] and parameters: {'p_sma': 8, 'p_std': 25, 'p_atr': 21, 'p_adx': 13, 'rsi_period': 68, 'ema1': 30, 'ema2': 52, 'slip_atr_k': 0.05815819332415882, 'slip_spread_k': 0.20723400890802557, 'spread_hl_frac': 0.012604772291316785, 'bb_std_mult': 2.9355480111176604, 'rsi_os': 54, 'rsi_ob': 50, 'vol_spike': 0.18415451257813897, 'adx_thresh': 12.049952841208798, 'atr_min_pct': 0.014667300500241332, 'atr_max_pct': 0.14882353597368517, 'tp_mult': 2.9355751066605302, 'tsl_mult': 0.5625880341017122, 'strategy': 'breakout', 'time_stop': 67, 'use_sma': True, 'use_atr': True, 'use_adx': True, 'use_ema': True, 'use_spike': True, 'rsi_required': False, 'edge_k': 0.45309997977669675, 'edge_cap': 0.07744955764272601, 'bull_strategy': 'breakout', 'bull_bb_std_mult': 0.5839323834419783, 'bull_rsi_os': 41, 'bull_rsi_ob': 51, 'bull_adx_thresh': 10.736825398416682, 'bull_atr_min_pct': 0.015564198512661194, 'bull_atr_max_pct': 0.029680874106333063, 'bull_tp_mult': 2.9020814229498897, 'bull_tsl_mult': 0.27072278040848374, 'bull_time_stop': 167, 'bull_use_sma': False, 'bull_use_ema': False, 'bull_use_atr': False, 'bull_use_adx': False, 'bull_use_spike': False, 'bull_rsi_required': True, 'bear_strategy': 'mean_reversion', 'bear_bb_std_mult': 2.9126543077192752, 'bear_rsi_os': 43, 'bear_rsi_ob': 54, 'bear_adx_thresh': 29.264163359209544, 'bear_atr_min_pct': 0.023883335595667757, 'bear_atr_max_pct': 0.12134015542805768, 'bear_tp_mult': 2.318006433007695, 'bear_tsl_mult': 0.5878481833149143, 'bear_time_stop': 177, 'bear_use_sma': False, 'bear_use_ema': True, 'bear_use_atr': False, 'bear_use_adx': True, 'bear_use_spike': False, 'bear_rsi_required': False, 'sideways_strategy': 'mean_reversion', 'sideways_bb_std_mult': 1.8820802055630583, 'sideways_rsi_os': 18, 'sideways_rsi_ob': 70, 'sideways_adx_thresh': 18.49403219868434, 'sideways_atr_min_pct': 0.0218236891167345, 'sideways_atr_max_pct': 0.1278862168944696, 'sideways_tp_mult': 1.5653765855493906, 'sideways_tsl_mult': 0.25466776317178136, 'sideways_time_stop': 20, 'sideways_use_sma': False, 'sideways_use_ema': True, 'sideways_use_atr': False, 'sideways_use_adx': False, 'sideways_use_spike': True, 'sideways_rsi_required': True}.
