[I 2025-09-01 14:49:41,085] Trial 371 finished with values: [-1000000000.0, 1000000000.0] and parameters: {'p_sma': 28, 'p_std': 10, 'p_atr': 20, 'p_adx': 14, 'rsi_period': 38, 'ema1': 30, 'ema2': 50, 'slip_atr_k': 0.03596290114501654, 'slip_spread_k': 0.23908348084734055, 'spread_hl_frac': 0.01632776918749234, 'bb_std_mult': 1.2576825828095384, 'rsi_os': 36, 'rsi_ob': 75, 'vol_spike': 0.2946581337840044, 'adx_thresh': 22.774055196308343, 'atr_min_pct': 0.02795065015216844, 'atr_max_pct': 0.031635976568226115, 'tp_mult': 2.9660115142737187, 'tsl_mult': 0.14713900348573583, 'strategy': 'mean_reversion', 'time_stop': 150, 'use_sma': True, 'use_atr': False, 'use_adx': True, 'use_ema': False, 'use_spike': True, 'rsi_required': True, 'edge_k': 1.5377270088577708, 'edge_cap': 0.3297553266809248, 'bull_strategy': 'breakout', 'bull_bb_std_mult': 2.7526570292577075, 'bull_rsi_os': 37, 'bull_rsi_ob': 81, 'bull_adx_thresh': 9.326669674414175, 'bull_atr_min_pct': 0.013233435567134084, 'bull_atr_max_pct': 0.011000986866106186, 'bull_tp_mult': 2.0366038242819675, 'bull_tsl_mult': 0.8600611847921315, 'bull_time_stop': 150, 'bull_use_sma': True, 'bull_use_ema': False, 'bull_use_atr': True, 'bull_use_adx': True, 'bull_use_spike': False, 'bull_rsi_required': True, 'bear_strategy': 'breakout', 'bear_bb_std_mult': 2.1954684585663493, 'bear_rsi_os': 18, 'bear_rsi_ob': 76, 'bear_adx_thresh': 29.828534248533433, 'bear_atr_min_pct': 0.023684603133812973, 'bear_atr_max_pct': 0.10461658819248654, 'bear_tp_mult': 2.45315662074796, 'bear_tsl_mult': 0.5726883009658188, 'bear_time_stop': 289, 'bear_use_sma': False, 'bear_use_ema': False, 'bear_use_atr': True, 'bear_use_adx': False, 'bear_use_spike': True, 'bear_rsi_required': True, 'sideways_strategy': 'breakout', 'sideways_bb_std_mult': 3.5199345620840177, 'sideways_rsi_os': 16, 'sideways_rsi_ob': 70, 'sideways_adx_thresh': 14.855114666132147, 'sideways_atr_min_pct': 0.006477086703431435, 'sideways_atr_max_pct': 0.026174510945304236, 'sideways_tp_mult': 2.0640569811738585, 'sideways_tsl_mult': 0.3232314601385583, 'sideways_time_stop': 117, 'sideways_use_sma': True, 'sideways_use_ema': False, 'sideways_use_atr': True, 'sideways_use_adx': True, 'sideways_use_spike': False, 'sideways_rsi_required': False}.
[I 2025-09-01 14:49:41,584] Trial 370 finished with values: [-1000000000.0, 1000000000.0] and parameters: {'p_sma': 28, 'p_std': 10, 'p_atr': 20, 'p_adx': 14, 'rsi_period': 62, 'ema1': 30, 'ema2': 51, 'slip_atr_k': 0.1477285348497161, 'slip_spread_k': 0.9214368565861781, 'spread_hl_frac': 0.016927234725920483, 'bb_std_mult': 0.8541929654856748, 'rsi_os': 48, 'rsi_ob': 81, 'vol_spike': 0.14357434037260655, 'adx_thresh': 17.610764407922844, 'atr_min_pct': 0.01481171929980537, 'atr_max_pct': 0.05282509614787637, 'tp_mult': 2.953434717343453, 'tsl_mult': 0.028518696473230326, 'strategy': 'mean_reversion', 'time_stop': 86, 'use_sma': True, 'use_atr': False, 'use_adx': True, 'use_ema': False, 'use_spike': True, 'rsi_required': True, 'edge_k': 0.68061979273548, 'edge_cap': 0.08150412099993028, 'bull_strategy': 'breakout', 'bull_bb_std_mult': 2.8229540795991173, 'bull_rsi_os': 37, 'bull_rsi_ob': 51, 'bull_adx_thresh': 15.250717988394163, 'bull_atr_min_pct': 0.01245965963360526, 'bull_atr_max_pct': 0.0831248635443464, 'bull_tp_mult': 2.036030891695385, 'bull_tsl_mult': 0.3631320976552714, 'bull_time_stop': 150, 'bull_use_sma': True, 'bull_use_ema': False, 'bull_use_atr': True, 'bull_use_adx': True, 'bull_use_spike': False, 'bull_rsi_required': True, 'bear_strategy': 'breakout', 'bear_bb_std_mult': 0.598783034176547, 'bear_rsi_os': 18, 'bear_rsi_ob': 76, 'bear_adx_thresh': 29.205692742741363, 'bear_atr_min_pct': 0.006254762291809874, 'bear_atr_max_pct': 0.029524077983623227, 'bear_tp_mult': 1.2371700501652536, 'bear_tsl_mult': 0.35749046226325715, 'bear_time_stop': 146, 'bear_use_sma': False, 'bear_use_ema': False, 'bear_use_atr': True, 'bear_use_adx': False, 'bear_use_spike': True, 'bear_rsi_required': True, 'sideways_strategy': 'breakout', 'sideways_bb_std_mult': 2.4877698643831185, 'sideways_rsi_os': 16, 'sideways_rsi_ob': 78, 'sideways_adx_thresh': 7.499000078686698, 'sideways_atr_min_pct': 0.006531825726509642, 'sideways_atr_max_pct': 0.12502445876770266, 'sideways_tp_mult': 2.490852365400258, 'sideways_tsl_mult': 0.3259508980472765, 'sideways_time_stop': 261, 'sideways_use_sma': True, 'sideways_use_ema': False, 'sideways_use_atr': True, 'sideways_use_adx': True, 'sideways_use_spike': False, 'sideways_rsi_required': False}.
[I 2025-09-01 14:49:41,900] Trial 372 finished with values: [-1000000000.0, 1000000000.0] and parameters: {'p_sma': 11, 'p_std': 36, 'p_atr': 20, 'p_adx': 28, 'rsi_period': 44, 'ema1': 10, 'ema2': 21, 'slip_atr_k': 0.0770011936481673, 'slip_spread_k': 0.5789359343386422, 'spread_hl_frac': 0.01645436645951749, 'bb_std_mult': 1.5029769816158265, 'rsi_os': 38, 'rsi_ob': 81, 'vol_spike': 0.2946287244681203, 'adx_thresh': 12.704359896906592, 'atr_min_pct': 0.018099944370170453, 'atr_max_pct': 0.0773685748822994, 'tp_mult': 2.961407172136867, 'tsl_mult': 0.14398024661609576, 'strategy': 'mean_reversion', 'time_stop': 88, 'use_sma': True, 'use_atr': False, 'use_adx': True, 'use_ema': False, 'use_spike': True, 'rsi_required': True, 'edge_k': 1.5507565898228417, 'edge_cap': 0.08334215249464652, 'bull_strategy': 'breakout', 'bull_bb_std_mult': 3.36026041092346, 'bull_rsi_os': 17, 'bull_rsi_ob': 51, 'bull_adx_thresh': 9.258475717378978, 'bull_atr_min_pct': 0.013244144143115824, 'bull_atr_max_pct': 0.011425694912379466, 'bull_tp_mult': 2.036332477202874, 'bull_tsl_mult': 0.6671428178214149, 'bull_time_stop': 150, 'bull_use_sma': True, 'bull_use_ema': False, 'bull_use_atr': True, 'bull_use_adx': True, 'bull_use_spike': False, 'bull_rsi_required': True, 'bear_strategy': 'mean_reversion', 'bear_bb_std_mult': 2.6728581322984923, 'bear_rsi_os': 28, 'bear_rsi_ob': 76, 'bear_adx_thresh': 8.854339229462813, 'bear_atr_min_pct': 0.02499348069599281, 'bear_atr_max_pct': 0.10505319984842228, 'bear_tp_mult': 1.2519402344941546, 'bear_tsl_mult': 0.6397584499019822, 'bear_time_stop': 230, 'bear_use_sma': False, 'bear_use_ema': False, 'bear_use_atr': True, 'bear_use_adx': False, 'bear_use_spike': True, 'bear_rsi_required': False, 'sideways_strategy': 'breakout', 'sideways_bb_std_mult': 2.027069059107709, 'sideways_rsi_os': 16, 'sideways_rsi_ob': 95, 'sideways_adx_thresh': 14.846208061505115, 'sideways_atr_min_pct': 0.0064640950874338896, 'sideways_atr_max_pct': 0.12555933538177283, 'sideways_tp_mult': 1.8201546404887188, 'sideways_tsl_mult': 0.06889740020191004, 'sideways_time_stop': 119, 'sideways_use_sma': True, 'sideways_use_ema': False, 'sideways_use_atr': True, 'sideways_use_adx': True, 'sideways_use_spike': True, 'sideways_rsi_required': False}.
[I 2025-09-01 14:49:42,083] Trial 369 finished with values: [-1000000000.0, 1000000000.0] and parameters: {'p_sma': 9, 'p_std': 36, 'p_atr': 18, 'p_adx': 24, 'rsi_period': 40, 'ema1': 13, 'ema2': 21, 'slip_atr_k': 0.0621209890176746, 'slip_spread_k': 0.2082795709798448, 'spread_hl_frac': 0.009005303836020724, 'bb_std_mult': 2.0843436033281146, 'rsi_os': 33, 'rsi_ob': 81, 'vol_spike': 0.25044561849801206, 'adx_thresh': 24.126242953526777, 'atr_min_pct': 0.014675318857941638, 'atr_max_pct': 0.05352744481133059, 'tp_mult': 1.3684625733175146, 'tsl_mult': 0.027947665760397374, 'strategy': 'breakout', 'time_stop': 245, 'use_sma': False, 'use_atr': False, 'use_adx': True, 'use_ema': False, 'use_spike': True, 'rsi_required': True, 'edge_k': 1.5518475182828082, 'edge_cap': 0.08645341682810913, 'bull_strategy': 'breakout', 'bull_bb_std_mult': 3.3496077356583625, 'bull_rsi_os': 17, 'bull_rsi_ob': 51, 'bull_adx_thresh': 15.240603229512466, 'bull_atr_min_pct': 0.013221588124794676, 'bull_atr_max_pct': 0.012066117702797884, 'bull_tp_mult': 2.9039219931772684, 'bull_tsl_mult': 0.685768649229724, 'bull_time_stop': 150, 'bull_use_sma': True, 'bull_use_ema': False, 'bull_use_atr': True, 'bull_use_adx': True, 'bull_use_spike': False, 'bull_rsi_required': True, 'bear_strategy': 'mean_reversion', 'bear_bb_std_mult': 2.7793643517912603, 'bear_rsi_os': 8, 'bear_rsi_ob': 76, 'bear_adx_thresh': 29.24595075559025, 'bear_atr_min_pct': 0.02217789792805526, 'bear_atr_max_pct': 0.10461267413243322, 'bear_tp_mult': 1.6965607355562473, 'bear_tsl_mult': 0.3610385339905028, 'bear_time_stop': 289, 'bear_use_sma': False, 'bear_use_ema': False, 'bear_use_atr': True, 'bear_use_adx': False, 'bear_use_spike': True, 'bear_rsi_required': False, 'sideways_strategy': 'breakout', 'sideways_bb_std_mult': 3.525798420961632, 'sideways_rsi_os': 16, 'sideways_rsi_ob': 85, 'sideways_adx_thresh': 7.690772872853112, 'sideways_atr_min_pct': 0.007991714102957497, 'sideways_atr_max_pct': 0.12670937424208992, 'sideways_tp_mult': 1.8332495354622353, 'sideways_tsl_mult': 0.3232647925834139, 'sideways_time_stop': 21, 'sideways_use_sma': True, 'sideways_use_ema': False, 'sideways_use_atr': True, 'sideways_use_adx': False, 'sideways_use_spike': True, 'sideways_rsi_required': True}.
[I 2025-09-01 14:50:23,704] Trial 373 finished with values: [-1000000000.0, 1000000000.0] and parameters: {'p_sma': 11, 'p_std': 7, 'p_atr': 11, 'p_adx': 29, 'rsi_period': 28, 'ema1': 14, 'ema2': 27, 'slip_atr_k': 0.07859111993318826, 'slip_spread_k': 0.2170808769690109, 'spread_hl_frac': 0.00919370750219128, 'bb_std_mult': 1.501564236977141, 'rsi_os': 38, 'rsi_ob': 78, 'vol_spike': 0.28266283671878256, 'adx_thresh': 12.40096384131543, 'atr_min_pct': 0.014722070865610217, 'atr_max_pct': 0.059565378936498464, 'tp_mult': 2.5675151113492185, 'tsl_mult': 0.83781790367688, 'strategy': 'breakout', 'time_stop': 79, 'use_sma': False, 'use_atr': True, 'use_adx': True, 'use_ema': False, 'use_spike': True, 'rsi_required': False, 'edge_k': 1.1071222974851398, 'edge_cap': 0.08697004101273006, 'bull_strategy': 'breakout', 'bull_bb_std_mult': 2.813558176915589, 'bull_rsi_os': 17, 'bull_rsi_ob': 51, 'bull_adx_thresh': 15.067178264281663, 'bull_atr_min_pct': 0.009448360434991964, 'bull_atr_max_pct': 0.08440288659394043, 'bull_tp_mult': 2.0674410536561716, 'bull_tsl_mult': 0.3696317649865753, 'bull_time_stop': 65, 'bull_use_sma': True, 'bull_use_ema': False, 'bull_use_atr': False, 'bull_use_adx': True, 'bull_use_spike': True, 'bull_rsi_required': True, 'bear_strategy': 'mean_reversion', 'bear_bb_std_mult': 2.672261466234233, 'bear_rsi_os': 28, 'bear_rsi_ob': 59, 'bear_adx_thresh': 29.319665099659055, 'bear_atr_min_pct': 0.015342313246508714, 'bear_atr_max_pct': 0.11700430151754213, 'bear_tp_mult': 1.1505487431017813, 'bear_tsl_mult': 0.6376740937949766, 'bear_time_stop': 290, 'bear_use_sma': False, 'bear_use_ema': False, 'bear_use_atr': False, 'bear_use_adx': True, 'bear_use_spike': False, 'bear_rsi_required': False, 'sideways_strategy': 'mean_reversion', 'sideways_bb_std_mult': 3.2866295255488707, 'sideways_rsi_os': 16, 'sideways_rsi_ob': 56, 'sideways_adx_thresh': 7.459623710708231, 'sideways_atr_min_pct': 0.005021022109347149, 'sideways_atr_max_pct': 0.13176097586583696, 'sideways_tp_mult': 1.8283856639478384, 'sideways_tsl_mult': 0.3112941180362122, 'sideways_time_stop': 107, 'sideways_use_sma': False, 'sideways_use_ema': False, 'sideways_use_atr': True, 'sideways_use_adx': False, 'sideways_use_spike': True, 'sideways_rsi_required': True}.
[I 2025-09-01 14:50:25,413] Trial 375 finished with values: [-1000000000.0, 1000000000.0] and parameters: {'p_sma': 9, 'p_std': 7, 'p_atr': 11, 'p_adx': 22, 'rsi_period': 58, 'ema1': 29, 'ema2': 58, 'slip_atr_k': 0.062437467162275787, 'slip_spread_k': 0.2105651967513255, 'spread_hl_frac': 0.02662591047509779, 'bb_std_mult': 1.5866611917708282, 'rsi_os': 36, 'rsi_ob': 75, 'vol_spike': 0.07631223034329727, 'adx_thresh': 19.59677887106858, 'atr_min_pct': 0.01656614160956295, 'atr_max_pct': 0.07143450849980679, 'tp_mult': 2.82312396752937, 'tsl_mult': 0.5291936494583659, 'strategy': 'breakout', 'time_stop': 102, 'use_sma': False, 'use_atr': True, 'use_adx': False, 'use_ema': True, 'use_spike': True, 'rsi_required': False, 'edge_k': 0.6167027946969862, 'edge_cap': 0.1138715743179528, 'bull_strategy': 'mean_reversion', 'bull_bb_std_mult': 2.9014519350412318, 'bull_rsi_os': 16, 'bull_rsi_ob': 55, 'bull_adx_thresh': 10.393306699484782, 'bull_atr_min_pct': 0.009599001082871582, 'bull_atr_max_pct': 0.022601651807004276, 'bull_tp_mult': 2.113452119665702, 'bull_tsl_mult': 0.3317032641616941, 'bull_time_stop': 67, 'bull_use_sma': False, 'bull_use_ema': True, 'bull_use_atr': False, 'bull_use_adx': True, 'bull_use_spike': True, 'bull_rsi_required': False, 'bear_strategy': 'mean_reversion', 'bear_bb_std_mult': 2.8096093077552866, 'bear_rsi_os': 53, 'bear_rsi_ob': 79, 'bear_adx_thresh': 28.00638551362985, 'bear_atr_min_pct': 0.022180385598669382, 'bear_atr_max_pct': 0.11789520636567857, 'bear_tp_mult': 2.53958348009502, 'bear_tsl_mult': 0.3879628518444527, 'bear_time_stop': 290, 'bear_use_sma': False, 'bear_use_ema': True, 'bear_use_atr': False, 'bear_use_adx': True, 'bear_use_spike': False, 'bear_rsi_required': False, 'sideways_strategy': 'mean_reversion', 'sideways_bb_std_mult': 3.2900291146959018, 'sideways_rsi_os': 12, 'sideways_rsi_ob': 93, 'sideways_adx_thresh': 6.637050176283667, 'sideways_atr_min_pct': 0.0035869288470869393, 'sideways_atr_max_pct': 0.1326872269269667, 'sideways_tp_mult': 1.8188329459432195, 'sideways_tsl_mult': 0.30184110591138213, 'sideways_time_stop': 106, 'sideways_use_sma': False, 'sideways_use_ema': False, 'sideways_use_atr': True, 'sideways_use_adx': False, 'sideways_use_spike': True, 'sideways_rsi_required': True}.
[I 2025-09-01 14:50:25,425] Trial 374 finished with values: [-1000000000.0, 1000000000.0] and parameters: {'p_sma': 6, 'p_std': 7, 'p_atr': 14, 'p_adx': 28, 'rsi_period': 64, 'ema1': 29, 'ema2': 20, 'slip_atr_k': 0.06441266093161263, 'slip_spread_k': 0.2205050690310139, 'spread_hl_frac': 0.014773469999847775, 'bb_std_mult': 1.4921552187784162, 'rsi_os': 38, 'rsi_ob': 91, 'vol_spike': 0.0005070523260757576, 'adx_thresh': 7.9233808779317645, 'atr_min_pct': 0.016617160617444875, 'atr_max_pct': 0.07698416318723128, 'tp_mult': 2.8964487941487174, 'tsl_mult': 0.0681847795766707, 'strategy': 'breakout', 'time_stop': 79, 'use_sma': False, 'use_atr': True, 'use_adx': True, 'use_ema': False, 'use_spike': True, 'rsi_required': False, 'edge_k': 0.6284809721672566, 'edge_cap': 0.07753304686133669, 'bull_strategy': 'mean_reversion', 'bull_bb_std_mult': 2.3928636214678494, 'bull_rsi_os': 16, 'bull_rsi_ob': 88, 'bull_adx_thresh': 31.29576968977404, 'bull_atr_min_pct': 0.007779721898615345, 'bull_atr_max_pct': 0.02160046267459425, 'bull_tp_mult': 2.0931872925272184, 'bull_tsl_mult': 0.6210883662548792, 'bull_time_stop': 211, 'bull_use_sma': True, 'bull_use_ema': False, 'bull_use_atr': False, 'bull_use_adx': True, 'bull_use_spike': True, 'bull_rsi_required': True, 'bear_strategy': 'mean_reversion', 'bear_bb_std_mult': 2.6736297481591067, 'bear_rsi_os': 8, 'bear_rsi_ob': 78, 'bear_adx_thresh': 26.625307006185, 'bear_atr_min_pct': 0.025051454408891366, 'bear_atr_max_pct': 0.11689977855705898, 'bear_tp_mult': 1.9066182137883798, 'bear_tsl_mult': 0.6489244607847843, 'bear_time_stop': 291, 'bear_use_sma': False, 'bear_use_ema': False, 'bear_use_atr': False, 'bear_use_adx': True, 'bear_use_spike': False, 'bear_rsi_required': False, 'sideways_strategy': 'mean_reversion', 'sideways_bb_std_mult': 0.5009538501143167, 'sideways_rsi_os': 53, 'sideways_rsi_ob': 65, 'sideways_adx_thresh': 6.656983923319675, 'sideways_atr_min_pct': 0.004996340297206689, 'sideways_atr_max_pct': 0.13130370239746875, 'sideways_tp_mult': 1.7886382610900047, 'sideways_tsl_mult': 0.3010711109003442, 'sideways_time_stop': 119, 'sideways_use_sma': False, 'sideways_use_ema': False, 'sideways_use_atr': True, 'sideways_use_adx': False, 'sideways_use_spike': True, 'sideways_rsi_required': True}.
[I 2025-09-01 14:50:25,805] Trial 376 finished with values: [-1000000000.0, 1000000000.0] and parameters: {'p_sma': 13, 'p_std': 7, 'p_atr': 19, 'p_adx': 29, 'rsi_period': 64, 'ema1': 29, 'ema2': 50, 'slip_atr_k': 0.16100560264052038, 'slip_spread_k': 0.6545165641457855, 'spread_hl_frac': 0.014383746478766172, 'bb_std_mult': 1.5962840947336847, 'rsi_os': 36, 'rsi_ob': 75, 'vol_spike': 0.2843341480694753, 'adx_thresh': 19.681489758085668, 'atr_min_pct': 0.016578489883821032, 'atr_max_pct': 0.14643761519040197, 'tp_mult': 2.3210340294060594, 'tsl_mult': 0.756560732600668, 'strategy': 'breakout', 'time_stop': 76, 'use_sma': False, 'use_atr': True, 'use_adx': False, 'use_ema': True, 'use_spike': True, 'rsi_required': False, 'edge_k': 0.60741122926182, 'edge_cap': 0.1150901428916965, 'bull_strategy': 'mean_reversion', 'bull_bb_std_mult': 2.891391940320913, 'bull_rsi_os': 15, 'bull_rsi_ob': 54, 'bull_adx_thresh': 31.457218238507455, 'bull_atr_min_pct': 0.02289510302850744, 'bull_atr_max_pct': 0.08857003851384364, 'bull_tp_mult': 2.0770208220343576, 'bull_tsl_mult': 0.6173436902365954, 'bull_time_stop': 23, 'bull_use_sma': False, 'bull_use_ema': True, 'bull_use_atr': False, 'bull_use_adx': True, 'bull_use_spike': True, 'bull_rsi_required': False, 'bear_strategy': 'mean_reversion', 'bear_bb_std_mult': 2.8089132841056914, 'bear_rsi_os': 42, 'bear_rsi_ob': 79, 'bear_adx_thresh': 28.014170676136214, 'bear_atr_min_pct': 0.023134440303150237, 'bear_atr_max_pct': 0.10962014257257204, 'bear_tp_mult': 1.898542145246456, 'bear_tsl_mult': 0.14531308048820052, 'bear_time_stop': 286, 'bear_use_sma': False, 'bear_use_ema': True, 'bear_use_atr': False, 'bear_use_adx': True, 'bear_use_spike': False, 'bear_rsi_required': False, 'sideways_strategy': 'mean_reversion', 'sideways_bb_std_mult': 1.747062494003642, 'sideways_rsi_os': 5, 'sideways_rsi_ob': 88, 'sideways_adx_thresh': 6.461163259808127, 'sideways_atr_min_pct': 0.0037793541295822576, 'sideways_atr_max_pct': 0.010143101231111978, 'sideways_tp_mult': 1.7835682617384128, 'sideways_tsl_mult': 0.30292912419667706, 'sideways_time_stop': 106, 'sideways_use_sma': False, 'sideways_use_ema': True, 'sideways_use_atr': True, 'sideways_use_adx': False, 'sideways_use_spike': True, 'sideways_rsi_required': True}.
[I 2025-09-01 14:50:26,687] Trial 379 finished with values: [-1000000000.0, 1000000000.0] and parameters: {'p_sma': 43, 'p_std': 9, 'p_atr': 19, 'p_adx': 28, 'rsi_period': 79, 'ema1': 30, 'ema2': 48, 'slip_atr_k': 0.16133739581456677, 'slip_spread_k': 0.7995499035201366, 'spread_hl_frac': 0.013709609605900645, 'bb_std_mult': 1.5940635433322097, 'rsi_os': 53, 'rsi_ob': 68, 'vol_spike': 0.28877741600340573, 'adx_thresh': 28.955517780149954, 'atr_min_pct': 0.015434604831003725, 'atr_max_pct': 0.010933985155718307, 'tp_mult': 2.9227623852789346, 'tsl_mult': 0.11453971219068676, 'strategy': 'breakout', 'time_stop': 63, 'use_sma': False, 'use_atr': True, 'use_adx': False, 'use_ema': True, 'use_spike': False, 'rsi_required': False, 'edge_k': 1.6210842732741546, 'edge_cap': 0.9029472984787388, 'bull_strategy': 'breakout', 'bull_bb_std_mult': 3.4995997150370566, 'bull_rsi_os': 19, 'bull_rsi_ob': 46, 'bull_adx_thresh': 12.552233722991229, 'bull_atr_min_pct': 0.02307162091936415, 'bull_atr_max_pct': 0.08813809653013314, 'bull_tp_mult': 1.9835310446376435, 'bull_tsl_mult': 0.40460576106307305, 'bull_time_stop': 181, 'bull_use_sma': False, 'bull_use_ema': True, 'bull_use_atr': False, 'bull_use_adx': False, 'bull_use_spike': False, 'bull_rsi_required': False, 'bear_strategy': 'mean_reversion', 'bear_bb_std_mult': 2.8775958213377866, 'bear_rsi_os': 41, 'bear_rsi_ob': 94, 'bear_adx_thresh': 28.2523364324154, 'bear_atr_min_pct': 0.027771764079199138, 'bear_atr_max_pct': 0.03626004776307916, 'bear_tp_mult': 2.3561870880949263, 'bear_tsl_mult': 0.14171226571383572, 'bear_time_stop': 283, 'bear_use_sma': True, 'bear_use_ema': True, 'bear_use_atr': False, 'bear_use_adx': True, 'bear_use_spike': False, 'bear_rsi_required': False, 'sideways_strategy': 'mean_reversion', 'sideways_bb_std_mult': 3.4486836014715156, 'sideways_rsi_os': 48, 'sideways_rsi_ob': 75, 'sideways_adx_thresh': 6.085883031532725, 'sideways_atr_min_pct': 0.02053763668622632, 'sideways_atr_max_pct': 0.09397330567153747, 'sideways_tp_mult': 1.8495866980562552, 'sideways_tsl_mult': 0.25043057604897356, 'sideways_time_stop': 185, 'sideways_use_sma': False, 'sideways_use_ema': True, 'sideways_use_atr': False, 'sideways_use_adx': False, 'sideways_use_spike': True, 'sideways_rsi_required': True}.
