[I 2025-09-01 15:01:33,381] Trial 441 finished with values: [-1000000000.0, 1000000000.0] and parameters: {'p_sma': 14, 'p_std': 12, 'p_atr': 13, 'p_adx': 24, 'rsi_period': 63, 'ema1': 29, 'ema2': 18, 'slip_atr_k': 0.05438251740709326, 'slip_spread_k': 0.6280665617431409, 'spread_hl_frac': 0.013514100068826387, 'bb_std_mult': 3.09398567843672, 'rsi_os': 35, 'rsi_ob': 74, 'vol_spike': 0.07269098193614686, 'adx_thresh': 15.45509899777668, 'atr_min_pct': 0.00496334441529556, 'atr_max_pct': 0.07477327098863155, 'tp_mult': 2.9531696932276197, 'tsl_mult': 0.08039230768550383, 'strategy': 'breakout', 'time_stop': 21, 'use_sma': False, 'use_atr': False, 'use_adx': True, 'use_ema': False, 'use_spike': True, 'rsi_required': True, 'edge_k': 0.5444639471823548, 'edge_cap': 0.09026457357576932, 'bull_strategy': 'mean_reversion', 'bull_bb_std_mult': 3.201529235410938, 'bull_rsi_os': 48, 'bull_rsi_ob': 51, 'bull_adx_thresh': 8.084846466315327, 'bull_atr_min_pct': 0.005161311861658101, 'bull_atr_max_pct': 0.06716720053297123, 'bull_tp_mult': 1.9978467927676358, 'bull_tsl_mult': 0.35449174771965114, 'bull_time_stop': 213, 'bull_use_sma': False, 'bull_use_ema': True, 'bull_use_atr': True, 'bull_use_adx': True, 'bull_use_spike': False, 'bull_rsi_required': True, 'bear_strategy': 'mean_reversion', 'bear_bb_std_mult': 1.5358693444061213, 'bear_rsi_os': 45, 'bear_rsi_ob': 76, 'bear_adx_thresh': 27.232871336746264, 'bear_atr_min_pct': 0.023493099566636727, 'bear_atr_max_pct': 0.06231965700159374, 'bear_tp_mult': 2.118151977377208, 'bear_tsl_mult': 0.1826201569601808, 'bear_time_stop': 287, 'bear_use_sma': False, 'bear_use_ema': False, 'bear_use_atr': True, 'bear_use_adx': True, 'bear_use_spike': True, 'bear_rsi_required': False, 'sideways_strategy': 'breakout', 'sideways_bb_std_mult': 3.534190614176045, 'sideways_rsi_os': 19, 'sideways_rsi_ob': 89, 'sideways_adx_thresh': 7.653896367927627, 'sideways_atr_min_pct': 0.013218174183071835, 'sideways_atr_max_pct': 0.13395814908915865, 'sideways_tp_mult': 1.7696599564172355, 'sideways_tsl_mult': 0.32196144905228513, 'sideways_time_stop': 177, 'sideways_use_sma': True, 'sideways_use_ema': True, 'sideways_use_atr': True, 'sideways_use_adx': True, 'sideways_use_spike': True, 'sideways_rsi_required': False}.
[I 2025-09-01 15:01:33,405] Trial 440 finished with values: [-1000000000.0, 1000000000.0] and parameters: {'p_sma': 14, 'p_std': 10, 'p_atr': 18, 'p_adx': 24, 'rsi_period': 42, 'ema1': 29, 'ema2': 22, 'slip_atr_k': 0.034974050951664754, 'slip_spread_k': 0.9828578815253236, 'spread_hl_frac': 0.03142280979112686, 'bb_std_mult': 1.446324401132735, 'rsi_os': 35, 'rsi_ob': 74, 'vol_spike': 0.29431282611836007, 'adx_thresh': 7.512217770593498, 'atr_min_pct': 0.012249300764094953, 'atr_max_pct': 0.056716690434978886, 'tp_mult': 2.836896495738646, 'tsl_mult': 0.08314506436938525, 'strategy': 'breakout', 'time_stop': 69, 'use_sma': False, 'use_atr': False, 'use_adx': True, 'use_ema': False, 'use_spike': True, 'rsi_required': True, 'edge_k': 0.555014011638783, 'edge_cap': 0.08953139379660525, 'bull_strategy': 'mean_reversion', 'bull_bb_std_mult': 0.8180105936139208, 'bull_rsi_os': 9, 'bull_rsi_ob': 51, 'bull_adx_thresh': 11.068034064150506, 'bull_atr_min_pct': 0.01819583846416519, 'bull_atr_max_pct': 0.05614961909907412, 'bull_tp_mult': 2.5674700471427423, 'bull_tsl_mult': 0.30304766839079783, 'bull_time_stop': 127, 'bull_use_sma': False, 'bull_use_ema': True, 'bull_use_atr': True, 'bull_use_adx': True, 'bull_use_spike': False, 'bull_rsi_required': True, 'bear_strategy': 'mean_reversion', 'bear_bb_std_mult': 3.4376125735161605, 'bear_rsi_os': 25, 'bear_rsi_ob': 57, 'bear_adx_thresh': 27.201290277403004, 'bear_atr_min_pct': 0.009314263318506811, 'bear_atr_max_pct': 0.11268229786364266, 'bear_tp_mult': 2.4506258775356846, 'bear_tsl_mult': 0.5993012426847953, 'bear_time_stop': 287, 'bear_use_sma': False, 'bear_use_ema': False, 'bear_use_atr': True, 'bear_use_adx': True, 'bear_use_spike': True, 'bear_rsi_required': False, 'sideways_strategy': 'breakout', 'sideways_bb_std_mult': 3.5196030373739644, 'sideways_rsi_os': 19, 'sideways_rsi_ob': 54, 'sideways_adx_thresh': 20.736021639786046, 'sideways_atr_min_pct': 0.027211370430653505, 'sideways_atr_max_pct': 0.1346473990987622, 'sideways_tp_mult': 1.7254807440257374, 'sideways_tsl_mult': 0.318324050367566, 'sideways_time_stop': 121, 'sideways_use_sma': True, 'sideways_use_ema': True, 'sideways_use_atr': True, 'sideways_use_adx': True, 'sideways_use_spike': True, 'sideways_rsi_required': False}.
[I 2025-09-01 15:01:33,673] Trial 443 finished with values: [-1000000000.0, 1000000000.0] and parameters: {'p_sma': 14, 'p_std': 40, 'p_atr': 19, 'p_adx': 24, 'rsi_period': 66, 'ema1': 30, 'ema2': 53, 'slip_atr_k': 0.05531143106682783, 'slip_spread_k': 0.45327161098389634, 'spread_hl_frac': 0.03137668931526411, 'bb_std_mult': 0.9391073352213295, 'rsi_os': 35, 'rsi_ob': 71, 'vol_spike': 0.26308343849559396, 'adx_thresh': 21.632005303974914, 'atr_min_pct': 0.015608965508392672, 'atr_max_pct': 0.056304081096912824, 'tp_mult': 2.9174143653387783, 'tsl_mult': 0.7868213029764077, 'strategy': 'breakout', 'time_stop': 56, 'use_sma': False, 'use_atr': True, 'use_adx': True, 'use_ema': True, 'use_spike': True, 'rsi_required': False, 'edge_k': 1.255684385905726, 'edge_cap': 0.15964967015367781, 'bull_strategy': 'mean_reversion', 'bull_bb_std_mult': 3.239027925470323, 'bull_rsi_os': 49, 'bull_rsi_ob': 51, 'bull_adx_thresh': 28.26687394566006, 'bull_atr_min_pct': 0.019088073421187075, 'bull_atr_max_pct': 0.016858746386331107, 'bull_tp_mult': 1.4148439665083314, 'bull_tsl_mult': 0.30423075588606124, 'bull_time_stop': 148, 'bull_use_sma': True, 'bull_use_ema': False, 'bull_use_atr': False, 'bull_use_adx': True, 'bull_use_spike': False, 'bull_rsi_required': False, 'bear_strategy': 'mean_reversion', 'bear_bb_std_mult': 1.53161907089902, 'bear_rsi_os': 25, 'bear_rsi_ob': 48, 'bear_adx_thresh': 23.815631528641195, 'bear_atr_min_pct': 0.00942965742671853, 'bear_atr_max_pct': 0.09691170019146315, 'bear_tp_mult': 2.418263521841537, 'bear_tsl_mult': 0.6578649434168016, 'bear_time_stop': 295, 'bear_use_sma': False, 'bear_use_ema': False, 'bear_use_atr': False, 'bear_use_adx': False, 'bear_use_spike': False, 'bear_rsi_required': False, 'sideways_strategy': 'mean_reversion', 'sideways_bb_std_mult': 3.5069831631035893, 'sideways_rsi_os': 16, 'sideways_rsi_ob': 82, 'sideways_adx_thresh': 29.19711792039191, 'sideways_atr_min_pct': 0.004617592744812663, 'sideways_atr_max_pct': 0.13385143709320954, 'sideways_tp_mult': 1.7420284470689262, 'sideways_tsl_mult': 0.5279038221826128, 'sideways_time_stop': 112, 'sideways_use_sma': False, 'sideways_use_ema': True, 'sideways_use_atr': False, 'sideways_use_adx': True, 'sideways_use_spike': True, 'sideways_rsi_required': False}.
[I 2025-09-01 15:02:11,654] Trial 445 finished with values: [-1000000000.0, 1000000000.0] and parameters: {'p_sma': 12, 'p_std': 40, 'p_atr': 28, 'p_adx': 26, 'rsi_period': 22, 'ema1': 30, 'ema2': 60, 'slip_atr_k': 0.05969670054554615, 'slip_spread_k': 0.28474625333071324, 'spread_hl_frac': 0.025550704545565836, 'bb_std_mult': 2.563994468676033, 'rsi_os': 26, 'rsi_ob': 76, 'vol_spike': 0.21739018287604459, 'adx_thresh': 29.763460467906892, 'atr_min_pct': 0.002847912046240429, 'atr_max_pct': 0.06872606267773239, 'tp_mult': 2.912575186624361, 'tsl_mult': 0.7713213075286831, 'strategy': 'mean_reversion', 'time_stop': 54, 'use_sma': True, 'use_atr': True, 'use_adx': True, 'use_ema': False, 'use_spike': True, 'rsi_required': False, 'edge_k': 0.84067182306011, 'edge_cap': 0.11088200322466257, 'bull_strategy': 'breakout', 'bull_bb_std_mult': 2.9910178134489898, 'bull_rsi_os': 35, 'bull_rsi_ob': 61, 'bull_adx_thresh': 28.138263699562607, 'bull_atr_min_pct': 0.008170053975449922, 'bull_atr_max_pct': 0.01508988201155112, 'bull_tp_mult': 1.2598847623623355, 'bull_tsl_mult': 0.7166830294218096, 'bull_time_stop': 150, 'bull_use_sma': True, 'bull_use_ema': False, 'bull_use_atr': False, 'bull_use_adx': False, 'bull_use_spike': True, 'bull_rsi_required': True, 'bear_strategy': 'breakout', 'bear_bb_std_mult': 2.821801397113109, 'bear_rsi_os': 43, 'bear_rsi_ob': 77, 'bear_adx_thresh': 27.8927907033181, 'bear_atr_min_pct': 0.022517870210380646, 'bear_atr_max_pct': 0.09057455498649115, 'bear_tp_mult': 2.3383866142430185, 'bear_tsl_mult': 0.6574255297283486, 'bear_time_stop': 250, 'bear_use_sma': True, 'bear_use_ema': True, 'bear_use_atr': False, 'bear_use_adx': True, 'bear_use_spike': False, 'bear_rsi_required': True, 'sideways_strategy': 'mean_reversion', 'sideways_bb_std_mult': 3.055069780618259, 'sideways_rsi_os': 16, 'sideways_rsi_ob': 62, 'sideways_adx_thresh': 6.901901899983003, 'sideways_atr_min_pct': 0.003853408582287823, 'sideways_atr_max_pct': 0.13909858547340492, 'sideways_tp_mult': 1.8708823937694656, 'sideways_tsl_mult': 0.25483675427908775, 'sideways_time_stop': 190, 'sideways_use_sma': False, 'sideways_use_ema': False, 'sideways_use_atr': True, 'sideways_use_adx': False, 'sideways_use_spike': False, 'sideways_rsi_required': True}.
[I 2025-09-01 15:02:12,001] Trial 446 finished with values: [-0.03289553084509422, 0.03281594511596265] and parameters: {'p_sma': 12, 'p_std': 15, 'p_atr': 17, 'p_adx': 26, 'rsi_period': 64, 'ema1': 30, 'ema2': 53, 'slip_atr_k': 0.006498206664954348, 'slip_spread_k': 0.9316420894779425, 'spread_hl_frac': 0.01247525096902857, 'bb_std_mult': 1.6216806836306175, 'rsi_os': 26, 'rsi_ob': 76, 'vol_spike': 0.0622913093472362, 'adx_thresh': 16.973542121153265, 'atr_min_pct': 0.0033254422322002014, 'atr_max_pct': 0.071974077177929, 'tp_mult': 2.896171313919807, 'tsl_mult': 0.16152651636024185, 'strategy': 'mean_reversion', 'time_stop': 65, 'use_sma': True, 'use_atr': True, 'use_adx': True, 'use_ema': False, 'use_spike': False, 'rsi_required': False, 'edge_k': 0.4900136913317454, 'edge_cap': 0.28830296402066646, 'bull_strategy': 'breakout', 'bull_bb_std_mult': 3.0056395038317176, 'bull_rsi_os': 54, 'bull_rsi_ob': 78, 'bull_adx_thresh': 12.270365415541622, 'bull_atr_min_pct': 1.4698310703898862e-05, 'bull_atr_max_pct': 0.11498005217793013, 'bull_tp_mult': 2.1188484101442246, 'bull_tsl_mult': 0.7495953290416999, 'bull_time_stop': 174, 'bull_use_sma': True, 'bull_use_ema': False, 'bull_use_atr': False, 'bull_use_adx': False, 'bull_use_spike': True, 'bull_rsi_required': True, 'bear_strategy': 'breakout', 'bear_bb_std_mult': 0.92897511591406, 'bear_rsi_os': 49, 'bear_rsi_ob': 58, 'bear_adx_thresh': 8.288081409596964, 'bear_atr_min_pct': 0.005990117099235878, 'bear_atr_max_pct': 0.031658619661728116, 'bear_tp_mult': 2.30963431817475, 'bear_tsl_mult': 0.6409188829457708, 'bear_time_stop': 52, 'bear_use_sma': True, 'bear_use_ema': True, 'bear_use_atr': False, 'bear_use_adx': True, 'bear_use_spike': False, 'bear_rsi_required': True, 'sideways_strategy': 'mean_reversion', 'sideways_bb_std_mult': 3.3433106970819106, 'sideways_rsi_os': 18, 'sideways_rsi_ob': 59, 'sideways_adx_thresh': 6.039114705566127, 'sideways_atr_min_pct': 0.006752962747749456, 'sideways_atr_max_pct': 0.13884598113063143, 'sideways_tp_mult': 1.8666820389631458, 'sideways_tsl_mult': 0.25639743156925576, 'sideways_time_stop': 117, 'sideways_use_sma': False, 'sideways_use_ema': False, 'sideways_use_atr': True, 'sideways_use_adx': False, 'sideways_use_spike': False, 'sideways_rsi_required': True}.
[I 2025-09-01 15:02:12,679] Trial 447 finished with values: [-0.07110404078068389, 0.07097126254425899] and parameters: {'p_sma': 12, 'p_std': 7, 'p_atr': 17, 'p_adx': 26, 'rsi_period': 50, 'ema1': 13, 'ema2': 11, 'slip_atr_k': 0.06824044236354791, 'slip_spread_k': 0.25780686675285025, 'spread_hl_frac': 0.015143994499218615, 'bb_std_mult': 1.6189366660158138, 'rsi_os': 37, 'rsi_ob': 76, 'vol_spike': 0.2878655485855088, 'adx_thresh': 19.268172015346604, 'atr_min_pct': 0.02229399123992699, 'atr_max_pct': 0.07178458289194936, 'tp_mult': 2.8909163782872227, 'tsl_mult': 0.02033238685072878, 'strategy': 'mean_reversion', 'time_stop': 72, 'use_sma': True, 'use_atr': True, 'use_adx': True, 'use_ema': False, 'use_spike': False, 'rsi_required': False, 'edge_k': 0.49256749071401995, 'edge_cap': 0.10969735791043099, 'bull_strategy': 'breakout', 'bull_bb_std_mult': 2.992092706184609, 'bull_rsi_os': 35, 'bull_rsi_ob': 90, 'bull_adx_thresh': 11.089704159946029, 'bull_atr_min_pct': 7.028008555102355e-05, 'bull_atr_max_pct': 0.015353869064478916, 'bull_tp_mult': 1.2687513414778975, 'bull_tsl_mult': 0.38383485877136125, 'bull_time_stop': 161, 'bull_use_sma': True, 'bull_use_ema': False, 'bull_use_atr': False, 'bull_use_adx': False, 'bull_use_spike': True, 'bull_rsi_required': True, 'bear_strategy': 'breakout', 'bear_bb_std_mult': 2.7753403362322544, 'bear_rsi_os': 5, 'bear_rsi_ob': 50, 'bear_adx_thresh': 9.181183062630266, 'bear_atr_min_pct': 0.01848271105368493, 'bear_atr_max_pct': 0.11595629407184273, 'bear_tp_mult': 2.3125919263493078, 'bear_tsl_mult': 0.0016112832458784476, 'bear_time_stop': 249, 'bear_use_sma': True, 'bear_use_ema': True, 'bear_use_atr': False, 'bear_use_adx': True, 'bear_use_spike': False, 'bear_rsi_required': True, 'sideways_strategy': 'mean_reversion', 'sideways_bb_std_mult': 3.3402700633702813, 'sideways_rsi_os': 18, 'sideways_rsi_ob': 89, 'sideways_adx_thresh': 23.042726332945904, 'sideways_atr_min_pct': 0.006686997767689671, 'sideways_atr_max_pct': 0.10250548034517269, 'sideways_tp_mult': 1.8627483657601454, 'sideways_tsl_mult': 0.26300463536267055, 'sideways_time_stop': 264, 'sideways_use_sma': False, 'sideways_use_ema': False, 'sideways_use_atr': True, 'sideways_use_adx': False, 'sideways_use_spike': False, 'sideways_rsi_required': True}.
[I 2025-09-01 15:02:12,940] Trial 444 finished with values: [-1000000000.0, 1000000000.0] and parameters: {'p_sma': 12, 'p_std': 35, 'p_atr': 10, 'p_adx': 26, 'rsi_period': 66, 'ema1': 15, 'ema2': 11, 'slip_atr_k': 0.2387491275873307, 'slip_spread_k': 0.6307186976982528, 'spread_hl_frac': 0.013367238967952286, 'bb_std_mult': 0.5147454944744121, 'rsi_os': 37, 'rsi_ob': 75, 'vol_spike': 0.07165610352458471, 'adx_thresh': 16.575401520972637, 'atr_min_pct': 0.016113184466085922, 'atr_max_pct': 0.07303938816567944, 'tp_mult': 2.918762138369531, 'tsl_mult': 0.021071152528925628, 'strategy': 'breakout', 'time_stop': 55, 'use_sma': True, 'use_atr': True, 'use_adx': True, 'use_ema': False, 'use_spike': True, 'rsi_required': False, 'edge_k': 0.48369688173348063, 'edge_cap': 0.1057124028925723, 'bull_strategy': 'mean_reversion', 'bull_bb_std_mult': 1.7634321877998742, 'bull_rsi_os': 49, 'bull_rsi_ob': 91, 'bull_adx_thresh': 12.355060684075047, 'bull_atr_min_pct': 0.019123767872642444, 'bull_atr_max_pct': 0.09067376107438335, 'bull_tp_mult': 1.5229318485413348, 'bull_tsl_mult': 0.7086493231438884, 'bull_time_stop': 73, 'bull_use_sma': True, 'bull_use_ema': False, 'bull_use_atr': False, 'bull_use_adx': True, 'bull_use_spike': False, 'bull_rsi_required': True, 'bear_strategy': 'mean_reversion', 'bear_bb_std_mult': 2.8455855148227616, 'bear_rsi_os': 50, 'bear_rsi_ob': 58, 'bear_adx_thresh': 9.11300439487241, 'bear_atr_min_pct': 0.003538244875164914, 'bear_atr_max_pct': 0.11309016893668457, 'bear_tp_mult': 2.2947077661785276, 'bear_tsl_mult': 0.6622892118653932, 'bear_time_stop': 168, 'bear_use_sma': False, 'bear_use_ema': True, 'bear_use_atr': False, 'bear_use_adx': True, 'bear_use_spike': False, 'bear_rsi_required': False, 'sideways_strategy': 'mean_reversion', 'sideways_bb_std_mult': 2.002060206070706, 'sideways_rsi_os': 19, 'sideways_rsi_ob': 89, 'sideways_adx_thresh': 20.648174996299336, 'sideways_atr_min_pct': 0.027342434686404463, 'sideways_atr_max_pct': 0.13888279886372593, 'sideways_tp_mult': 1.7305946564821995, 'sideways_tsl_mult': 0.2590423610911736, 'sideways_time_stop': 8, 'sideways_use_sma': False, 'sideways_use_ema': True, 'sideways_use_atr': True, 'sideways_use_adx': False, 'sideways_use_spike': True, 'sideways_rsi_required': True}.
[I 2025-09-01 15:02:55,867] Trial 451 finished with values: [-1000000000.0, 1000000000.0] and parameters: {'p_sma': 54, 'p_std': 5, 'p_atr': 19, 'p_adx': 25, 'rsi_period': 64, 'ema1': 16, 'ema2': 52, 'slip_atr_k': 0.24787065040610778, 'slip_spread_k': 0.11081317605424668, 'spread_hl_frac': 0.0033181860586577877, 'bb_std_mult': 2.1087316984982283, 'rsi_os': 33, 'rsi_ob': 72, 'vol_spike': 0.16556173240613786, 'adx_thresh': 18.732351019506083, 'atr_min_pct': 0.01756278335641199, 'atr_max_pct': 0.03973109650394516, 'tp_mult': 1.2602834829323863, 'tsl_mult': 0.0473949124837128, 'strategy': 'breakout', 'time_stop': 256, 'use_sma': False, 'use_atr': True, 'use_adx': False, 'use_ema': True, 'use_spike': True, 'rsi_required': False, 'edge_k': 0.38864753337841795, 'edge_cap': 0.6174322765614308, 'bull_strategy': 'breakout', 'bull_bb_std_mult': 2.7441815618385372, 'bull_rsi_os': 14, 'bull_rsi_ob': 48, 'bull_adx_thresh': 10.234930061200044, 'bull_atr_min_pct': 0.014397264658157483, 'bull_atr_max_pct': 0.023000092809671142, 'bull_tp_mult': 2.6291727808942653, 'bull_tsl_mult': 0.32345794289612884, 'bull_time_stop': 162, 'bull_use_sma': True, 'bull_use_ema': False, 'bull_use_atr': False, 'bull_use_adx': True, 'bull_use_spike': False, 'bull_rsi_required': False, 'bear_strategy': 'mean_reversion', 'bear_bb_std_mult': 0.5637113473814517, 'bear_rsi_os': 53, 'bear_rsi_ob': 80, 'bear_adx_thresh': 15.634768212125207, 'bear_atr_min_pct': 0.0146274796830908, 'bear_atr_max_pct': 0.12057469766028617, 'bear_tp_mult': 2.5434430435086224, 'bear_tsl_mult': 0.5685816690319636, 'bear_time_stop': 217, 'bear_use_sma': False, 'bear_use_ema': False, 'bear_use_atr': False, 'bear_use_adx': False, 'bear_use_spike': False, 'bear_rsi_required': False, 'sideways_strategy': 'mean_reversion', 'sideways_bb_std_mult': 3.266006145453875, 'sideways_rsi_os': 6, 'sideways_rsi_ob': 90, 'sideways_adx_thresh': 8.492345798565855, 'sideways_atr_min_pct': 0.005473293154127397, 'sideways_atr_max_pct': 0.13129527398697957, 'sideways_tp_mult': 2.4750511948594265, 'sideways_tsl_mult': 0.2940914638016507, 'sideways_time_stop': 105, 'sideways_use_sma': False, 'sideways_use_ema': False, 'sideways_use_atr': False, 'sideways_use_adx': False, 'sideways_use_spike': True, 'sideways_rsi_required': True}.
[I 2025-09-01 15:02:56,834] Trial 449 finished with values: [-0.00854830606282253, 0.008596892735594053] and parameters: {'p_sma': 53, 'p_std': 59, 'p_atr': 15, 'p_adx': 25, 'rsi_period': 65, 'ema1': 13, 'ema2': 51, 'slip_atr_k': 0.06923449653404908, 'slip_spread_k': 0.25679627302648944, 'spread_hl_frac': 0.015395992297847098, 'bb_std_mult': 1.5268849365627075, 'rsi_os': 37, 'rsi_ob': 90, 'vol_spike': 0.14277019607766775, 'adx_thresh': 18.05270783363291, 'atr_min_pct': 0.006046232970235172, 'atr_max_pct': 0.08035406100185663, 'tp_mult': 2.609782256605672, 'tsl_mult': 0.02183101473590908, 'strategy': 'breakout', 'time_stop': 188, 'use_sma': False, 'use_atr': True, 'use_adx': False, 'use_ema': False, 'use_spike': True, 'rsi_required': False, 'edge_k': 0.3831266729002316, 'edge_cap': 0.6673421541943217, 'bull_strategy': 'breakout', 'bull_bb_std_mult': 1.7916814384015085, 'bull_rsi_os': 40, 'bull_rsi_ob': 95, 'bull_adx_thresh': 11.202814551050894, 'bull_atr_min_pct': 0.0033962869537383245, 'bull_atr_max_pct': 0.02270561680418503, 'bull_tp_mult': 2.063046883374453, 'bull_tsl_mult': 0.5982525505277176, 'bull_time_stop': 72, 'bull_use_sma': True, 'bull_use_ema': False, 'bull_use_atr': False, 'bull_use_adx': True, 'bull_use_spike': False, 'bull_rsi_required': True, 'bear_strategy': 'mean_reversion', 'bear_bb_std_mult': 2.769026163085234, 'bear_rsi_os': 6, 'bear_rsi_ob': 50, 'bear_adx_thresh': 29.202712073800004, 'bear_atr_min_pct': 0.024271054981038032, 'bear_atr_max_pct': 0.11565948571662653, 'bear_tp_mult': 2.51166963686595, 'bear_tsl_mult': 0.7012138648041821, 'bear_time_stop': 199, 'bear_use_sma': False, 'bear_use_ema': False, 'bear_use_atr': False, 'bear_use_adx': True, 'bear_use_spike': False, 'bear_rsi_required': False, 'sideways_strategy': 'mean_reversion', 'sideways_bb_std_mult': 3.312263920241284, 'sideways_rsi_os': 14, 'sideways_rsi_ob': 89, 'sideways_adx_thresh': 8.325783653057934, 'sideways_atr_min_pct': 0.005260151630837461, 'sideways_atr_max_pct': 0.14278369188285606, 'sideways_tp_mult': 1.2319208026270165, 'sideways_tsl_mult': 0.2903382434416743, 'sideways_time_stop': 127, 'sideways_use_sma': False, 'sideways_use_ema': False, 'sideways_use_atr': True, 'sideways_use_adx': False, 'sideways_use_spike': True, 'sideways_rsi_required': True}.
