[I 2025-09-01 14:03:16,066] Trial 71 finished with values: [-1000000000.0, 1000000000.0] and parameters: {'p_sma': 21, 'p_std': 58, 'p_atr': 8, 'p_adx': 23, 'rsi_period': 56, 'ema1': 28, 'ema2': 22, 'slip_atr_k': 0.13324352720879387, 'slip_spread_k': 0.30195230753056634, 'spread_hl_frac': 0.020126634721845386, 'bb_std_mult': 0.6756775440497038, 'rsi_os': 22, 'rsi_ob': 68, 'vol_spike': 0.07769026839185143, 'adx_thresh': 22.214453250155895, 'atr_min_pct': 0.005257327306677273, 'atr_max_pct': 0.1019770944238447, 'tp_mult': 1.4483937663858724, 'tsl_mult': 0.5207113766891737, 'strategy': 'mean_reversion', 'time_stop': 96, 'use_sma': False, 'use_atr': False, 'use_adx': True, 'use_ema': True, 'use_spike': False, 'rsi_required': True, 'edge_k': 1.6934759364480776, 'edge_cap': 0.5842168842051221, 'bull_strategy': 'breakout', 'bull_bb_std_mult': 0.7988017204401594, 'bull_rsi_os': 42, 'bull_rsi_ob': 59, 'bull_adx_thresh': 5.140497162072895, 'bull_atr_min_pct': 0.009760050103680213, 'bull_atr_max_pct': 0.12455864846553129, 'bull_tp_mult': 2.978380333132408, 'bull_tsl_mult': 0.9611809842917406, 'bull_time_stop': 136, 'bull_use_sma': True, 'bull_use_ema': False, 'bull_use_atr': False, 'bull_use_adx': True, 'bull_use_spike': False, 'bull_rsi_required': False, 'bear_strategy': 'breakout', 'bear_bb_std_mult': 1.2117158077601775, 'bear_rsi_os': 12, 'bear_rsi_ob': 83, 'bear_adx_thresh': 11.536235496919108, 'bear_atr_min_pct': 0.016311496866841087, 'bear_atr_max_pct': 0.09084067151084563, 'bear_tp_mult': 1.738630927538243, 'bear_tsl_mult': 0.2996943703925726, 'bear_time_stop': 213, 'bear_use_sma': True, 'bear_use_ema': True, 'bear_use_atr': False, 'bear_use_adx': False, 'bear_use_spike': True, 'bear_rsi_required': True, 'sideways_strategy': 'breakout', 'sideways_bb_std_mult': 1.509296047621938, 'sideways_rsi_os': 22, 'sideways_rsi_ob': 52, 'sideways_adx_thresh': 25.638358488965455, 'sideways_atr_min_pct': 0.029756020963425986, 'sideways_atr_max_pct': 0.05547499329983169, 'sideways_tp_mult': 2.2578724288700887, 'sideways_tsl_mult': 0.40643693431390676, 'sideways_time_stop': 53, 'sideways_use_sma': True, 'sideways_use_ema': False, 'sideways_use_atr': True, 'sideways_use_adx': True, 'sideways_use_spike': False, 'sideways_rsi_required': False}.
[I 2025-09-01 14:03:51,065] Trial 74 finished with values: [-0.02915077374189967, 0.029165655779797236] and parameters: {'p_sma': 18, 'p_std': 53, 'p_atr': 8, 'p_adx': 22, 'rsi_period': 24, 'ema1': 20, 'ema2': 25, 'slip_atr_k': 0.21609246576120433, 'slip_spread_k': 0.29926852068044946, 'spread_hl_frac': 0.031212417755223487, 'bb_std_mult': 2.2032393236927708, 'rsi_os': 43, 'rsi_ob': 91, 'vol_spike': 0.0647985916414247, 'adx_thresh': 22.6300442266578, 'atr_min_pct': 0.008571633630019273, 'atr_max_pct': 0.11636951758891281, 'tp_mult': 1.4693766724578172, 'tsl_mult': 0.468935126146606, 'strategy': 'mean_reversion', 'time_stop': 186, 'use_sma': False, 'use_atr': False, 'use_adx': True, 'use_ema': True, 'use_spike': False, 'rsi_required': True, 'edge_k': 1.6923738545872435, 'edge_cap': 0.41429417670754676, 'bull_strategy': 'mean_reversion', 'bull_bb_std_mult': 1.9304443417255743, 'bull_rsi_os': 41, 'bull_rsi_ob': 52, 'bull_adx_thresh': 11.400891647063862, 'bull_atr_min_pct': 0.0005967409743939447, 'bull_atr_max_pct': 0.12503304889903144, 'bull_tp_mult': 2.2549869410980268, 'bull_tsl_mult': 0.4586263197688303, 'bull_time_stop': 137, 'bull_use_sma': True, 'bull_use_ema': False, 'bull_use_atr': True, 'bull_use_adx': True, 'bull_use_spike': True, 'bull_rsi_required': True, 'bear_strategy': 'breakout', 'bear_bb_std_mult': 0.6512168812381666, 'bear_rsi_os': 11, 'bear_rsi_ob': 63, 'bear_adx_thresh': 19.685385494218274, 'bear_atr_min_pct': 0.017723824675739453, 'bear_atr_max_pct': 0.0908816450332416, 'bear_tp_mult': 2.9300910499867823, 'bear_tsl_mult': 0.25981821255645676, 'bear_time_stop': 254, 'bear_use_sma': True, 'bear_use_ema': False, 'bear_use_atr': True, 'bear_use_adx': False, 'bear_use_spike': True, 'bear_rsi_required': True, 'sideways_strategy': 'breakout', 'sideways_bb_std_mult': 3.0390744240780374, 'sideways_rsi_os': 27, 'sideways_rsi_ob': 68, 'sideways_adx_thresh': 23.337900369865725, 'sideways_atr_min_pct': 0.022959113712478902, 'sideways_atr_max_pct': 0.02450497923411528, 'sideways_tp_mult': 2.2246942324262378, 'sideways_tsl_mult': 0.599030003643283, 'sideways_time_stop': 223, 'sideways_use_sma': True, 'sideways_use_ema': False, 'sideways_use_atr': True, 'sideways_use_adx': True, 'sideways_use_spike': False, 'sideways_rsi_required': False}.
[I 2025-09-01 14:03:51,525] Trial 73 finished with values: [-1000000000.0, 1000000000.0] and parameters: {'p_sma': 21, 'p_std': 35, 'p_atr': 15, 'p_adx': 16, 'rsi_period': 24, 'ema1': 14, 'ema2': 22, 'slip_atr_k': 0.13163184961861643, 'slip_spread_k': 0.2908076152886951, 'spread_hl_frac': 0.03123079279294933, 'bb_std_mult': 2.9189917497417013, 'rsi_os': 23, 'rsi_ob': 54, 'vol_spike': 0.06479825004572681, 'adx_thresh': 24.143643099925473, 'atr_min_pct': 0.01531514748095413, 'atr_max_pct': 0.14104695800323652, 'tp_mult': 1.481509316758788, 'tsl_mult': 0.4755900158078742, 'strategy': 'mean_reversion', 'time_stop': 70, 'use_sma': False, 'use_atr': True, 'use_adx': True, 'use_ema': True, 'use_spike': False, 'rsi_required': False, 'edge_k': 1.62564440984898, 'edge_cap': 0.4141924981055597, 'bull_strategy': 'mean_reversion', 'bull_bb_std_mult': 1.9649798351021195, 'bull_rsi_os': 19, 'bull_rsi_ob': 52, 'bull_adx_thresh': 11.224823446798087, 'bull_atr_min_pct': 0.00995083571701701, 'bull_atr_max_pct': 0.1200055164832033, 'bull_tp_mult': 1.6147242416722078, 'bull_tsl_mult': 0.07472809211367344, 'bull_time_stop': 135, 'bull_use_sma': True, 'bull_use_ema': False, 'bull_use_atr': True, 'bull_use_adx': True, 'bull_use_spike': True, 'bull_rsi_required': True, 'bear_strategy': 'breakout', 'bear_bb_std_mult': 1.1921311886174948, 'bear_rsi_os': 19, 'bear_rsi_ob': 83, 'bear_adx_thresh': 18.911444360537704, 'bear_atr_min_pct': 0.010678735770287445, 'bear_atr_max_pct': 0.08771661569748145, 'bear_tp_mult': 2.9364805365820055, 'bear_tsl_mult': 0.4764891776304162, 'bear_time_stop': 91, 'bear_use_sma': True, 'bear_use_ema': True, 'bear_use_atr': False, 'bear_use_adx': False, 'bear_use_spike': True, 'bear_rsi_required': True, 'sideways_strategy': 'mean_reversion', 'sideways_bb_std_mult': 3.0665724010946174, 'sideways_rsi_os': 22, 'sideways_rsi_ob': 72, 'sideways_adx_thresh': 20.812261297808345, 'sideways_atr_min_pct': 0.007136289396886049, 'sideways_atr_max_pct': 0.020641200697482716, 'sideways_tp_mult': 2.223660350030847, 'sideways_tsl_mult': 0.2837659265023007, 'sideways_time_stop': 174, 'sideways_use_sma': True, 'sideways_use_ema': False, 'sideways_use_atr': True, 'sideways_use_adx': True, 'sideways_use_spike': False, 'sideways_rsi_required': False}.
[I 2025-09-01 14:03:51,989] Trial 76 finished with values: [-1000000000.0, 1000000000.0] and parameters: {'p_sma': 37, 'p_std': 53, 'p_atr': 23, 'p_adx': 22, 'rsi_period': 24, 'ema1': 20, 'ema2': 38, 'slip_atr_k': 0.0294814390594266, 'slip_spread_k': 0.44944979085274267, 'spread_hl_frac': 0.035476940012466554, 'bb_std_mult': 1.7737532086421546, 'rsi_os': 13, 'rsi_ob': 65, 'vol_spike': 0.27389709610285945, 'adx_thresh': 24.31167272623726, 'atr_min_pct': 0.014988515552686477, 'atr_max_pct': 0.11416194795389023, 'tp_mult': 1.7958236086529864, 'tsl_mult': 0.4604037616150807, 'strategy': 'breakout', 'time_stop': 122, 'use_sma': False, 'use_atr': True, 'use_adx': True, 'use_ema': False, 'use_spike': False, 'rsi_required': False, 'edge_k': 1.0508048892856054, 'edge_cap': 0.413500970584533, 'bull_strategy': 'mean_reversion', 'bull_bb_std_mult': 0.949429736883993, 'bull_rsi_os': 32, 'bull_rsi_ob': 52, 'bull_adx_thresh': 26.72317730203172, 'bull_atr_min_pct': 0.017306047199249216, 'bull_atr_max_pct': 0.11891993387590774, 'bull_tp_mult': 1.6236550988144953, 'bull_tsl_mult': 0.019848384127052254, 'bull_time_stop': 6, 'bull_use_sma': True, 'bull_use_ema': True, 'bull_use_atr': True, 'bull_use_adx': True, 'bull_use_spike': True, 'bull_rsi_required': True, 'bear_strategy': 'breakout', 'bear_bb_std_mult': 1.037991067902293, 'bear_rsi_os': 15, 'bear_rsi_ob': 71, 'bear_adx_thresh': 14.935670284253565, 'bear_atr_min_pct': 0.017516455653467287, 'bear_atr_max_pct': 0.14440933741261797, 'bear_tp_mult': 2.930304781393529, 'bear_tsl_mult': 0.25210718358309747, 'bear_time_stop': 248, 'bear_use_sma': False, 'bear_use_ema': False, 'bear_use_atr': True, 'bear_use_adx': False, 'bear_use_spike': True, 'bear_rsi_required': False, 'sideways_strategy': 'mean_reversion', 'sideways_bb_std_mult': 2.722640375313946, 'sideways_rsi_os': 27, 'sideways_rsi_ob': 59, 'sideways_adx_thresh': 19.23221273586933, 'sideways_atr_min_pct': 0.007242614219117118, 'sideways_atr_max_pct': 0.026658772810242877, 'sideways_tp_mult': 2.352857961184234, 'sideways_tsl_mult': 0.6031773627471851, 'sideways_time_stop': 174, 'sideways_use_sma': True, 'sideways_use_ema': False, 'sideways_use_atr': True, 'sideways_use_adx': True, 'sideways_use_spike': False, 'sideways_rsi_required': False}.
[I 2025-09-01 14:03:52,264] Trial 75 finished with values: [-0.024031277398727124, 0.024063753322257447] and parameters: {'p_sma': 19, 'p_std': 52, 'p_atr': 8, 'p_adx': 22, 'rsi_period': 22, 'ema1': 20, 'ema2': 12, 'slip_atr_k': 0.13471777080712674, 'slip_spread_k': 0.30169489686756246, 'spread_hl_frac': 0.031095506160771738, 'bb_std_mult': 3.5954437454440975, 'rsi_os': 23, 'rsi_ob': 68, 'vol_spike': 0.06626011354688409, 'adx_thresh': 15.642427291005085, 'atr_min_pct': 0.005700087008967035, 'atr_max_pct': 0.11451050499549537, 'tp_mult': 2.8737528238384806, 'tsl_mult': 0.4889687557013622, 'strategy': 'mean_reversion', 'time_stop': 188, 'use_sma': False, 'use_atr': True, 'use_adx': True, 'use_ema': True, 'use_spike': False, 'rsi_required': False, 'edge_k': 1.0316989461483737, 'edge_cap': 0.42396891182498647, 'bull_strategy': 'mean_reversion', 'bull_bb_std_mult': 0.944564787314067, 'bull_rsi_os': 37, 'bull_rsi_ob': 52, 'bull_adx_thresh': 13.672184810953208, 'bull_atr_min_pct': 0.000799825853968846, 'bull_atr_max_pct': 0.12487992680540683, 'bull_tp_mult': 2.2900855364391655, 'bull_tsl_mult': 0.03559527713589239, 'bull_time_stop': 135, 'bull_use_sma': True, 'bull_use_ema': False, 'bull_use_atr': True, 'bull_use_adx': True, 'bull_use_spike': True, 'bull_rsi_required': True, 'bear_strategy': 'breakout', 'bear_bb_std_mult': 0.6764786388696788, 'bear_rsi_os': 15, 'bear_rsi_ob': 83, 'bear_adx_thresh': 14.710940583448577, 'bear_atr_min_pct': 0.01737935696769345, 'bear_atr_max_pct': 0.08942584127945923, 'bear_tp_mult': 2.9418302011406587, 'bear_tsl_mult': 0.3105206938548907, 'bear_time_stop': 251, 'bear_use_sma': True, 'bear_use_ema': True, 'bear_use_atr': False, 'bear_use_adx': False, 'bear_use_spike': True, 'bear_rsi_required': False, 'sideways_strategy': 'mean_reversion', 'sideways_bb_std_mult': 2.537867559491813, 'sideways_rsi_os': 22, 'sideways_rsi_ob': 71, 'sideways_adx_thresh': 23.482153081492648, 'sideways_atr_min_pct': 0.007187255706300622, 'sideways_atr_max_pct': 0.023236521553395728, 'sideways_tp_mult': 2.234373750632734, 'sideways_tsl_mult': 0.5958541487546556, 'sideways_time_stop': 217, 'sideways_use_sma': True, 'sideways_use_ema': False, 'sideways_use_atr': True, 'sideways_use_adx': True, 'sideways_use_spike': False, 'sideways_rsi_required': False}.
[I 2025-09-01 14:04:31,059] Trial 78 finished with values: [-1000000000.0, 1000000000.0] and parameters: {'p_sma': 37, 'p_std': 53, 'p_atr': 23, 'p_adx': 20, 'rsi_period': 51, 'ema1': 20, 'ema2': 12, 'slip_atr_k': 0.1574400440299253, 'slip_spread_k': 0.3784089807519364, 'spread_hl_frac': 0.018553958316720007, 'bb_std_mult': 2.219350449362358, 'rsi_os': 43, 'rsi_ob': 81, 'vol_spike': 0.27697910556679595, 'adx_thresh': 10.576125866462462, 'atr_min_pct': 0.008741292000812478, 'atr_max_pct': 0.11433839867360603, 'tp_mult': 1.7871287707713286, 'tsl_mult': 0.24608988183503264, 'strategy': 'breakout', 'time_stop': 121, 'use_sma': False, 'use_atr': True, 'use_adx': True, 'use_ema': False, 'use_spike': True, 'rsi_required': False, 'edge_k': 1.0536953097594288, 'edge_cap': 0.8843511203647086, 'bull_strategy': 'mean_reversion', 'bull_bb_std_mult': 1.629733496757893, 'bull_rsi_os': 32, 'bull_rsi_ob': 92, 'bull_adx_thresh': 9.033347801773449, 'bull_atr_min_pct': 0.016994824434330064, 'bull_atr_max_pct': 0.04382171340728355, 'bull_tp_mult': 2.1947767470551254, 'bull_tsl_mult': 0.46327910390062277, 'bull_time_stop': 8, 'bull_use_sma': True, 'bull_use_ema': True, 'bull_use_atr': True, 'bull_use_adx': False, 'bull_use_spike': True, 'bull_rsi_required': True, 'bear_strategy': 'mean_reversion', 'bear_bb_std_mult': 1.63966644702942, 'bear_rsi_os': 14, 'bear_rsi_ob': 94, 'bear_adx_thresh': 14.60610512484175, 'bear_atr_min_pct': 0.01753091673455195, 'bear_atr_max_pct': 0.014054226904033074, 'bear_tp_mult': 1.965358522479487, 'bear_tsl_mult': 0.24920473387923006, 'bear_time_stop': 292, 'bear_use_sma': False, 'bear_use_ema': False, 'bear_use_atr': True, 'bear_use_adx': False, 'bear_use_spike': True, 'bear_rsi_required': False, 'sideways_strategy': 'mean_reversion', 'sideways_bb_std_mult': 2.696941669301333, 'sideways_rsi_os': 26, 'sideways_rsi_ob': 68, 'sideways_adx_thresh': 19.173306878086123, 'sideways_atr_min_pct': 0.0052627875362923, 'sideways_atr_max_pct': 0.12997934101123643, 'sideways_tp_mult': 2.359877998937538, 'sideways_tsl_mult': 0.5982871306680915, 'sideways_time_stop': 127, 'sideways_use_sma': False, 'sideways_use_ema': False, 'sideways_use_atr': False, 'sideways_use_adx': False, 'sideways_use_spike': True, 'sideways_rsi_required': False}.
[I 2025-09-01 14:04:31,830] Trial 79 finished with values: [-1000000000.0, 1000000000.0] and parameters: {'p_sma': 35, 'p_std': 24, 'p_atr': 27, 'p_adx': 20, 'rsi_period': 65, 'ema1': 18, 'ema2': 12, 'slip_atr_k': 0.21773664412511765, 'slip_spread_k': 0.36235257483983024, 'spread_hl_frac': 0.01724933492006627, 'bb_std_mult': 2.7025847936573775, 'rsi_os': 44, 'rsi_ob': 82, 'vol_spike': 0.09236891200392852, 'adx_thresh': 10.506139598075825, 'atr_min_pct': 0.010370802950807717, 'atr_max_pct': 0.1202111286003697, 'tp_mult': 1.8800174194776067, 'tsl_mult': 0.16539443501079892, 'strategy': 'mean_reversion', 'time_stop': 19, 'use_sma': False, 'use_atr': False, 'use_adx': True, 'use_ema': False, 'use_spike': True, 'rsi_required': True, 'edge_k': 0.7032572677744556, 'edge_cap': 0.8957923868575421, 'bull_strategy': 'mean_reversion', 'bull_bb_std_mult': 1.6301587620578777, 'bull_rsi_os': 35, 'bull_rsi_ob': 47, 'bull_adx_thresh': 9.722713628106415, 'bull_atr_min_pct': 0.0009073047155912702, 'bull_atr_max_pct': 0.04669190383036282, 'bull_tp_mult': 2.4126278578332903, 'bull_tsl_mult': 0.4390621912063121, 'bull_time_stop': 120, 'bull_use_sma': False, 'bull_use_ema': True, 'bull_use_atr': True, 'bull_use_adx': False, 'bull_use_spike': False, 'bull_rsi_required': True, 'bear_strategy': 'mean_reversion', 'bear_bb_std_mult': 1.6099473313666133, 'bear_rsi_os': 11, 'bear_rsi_ob': 62, 'bear_adx_thresh': 6.267625448479347, 'bear_atr_min_pct': 0.023652648106417266, 'bear_atr_max_pct': 0.015384030257998145, 'bear_tp_mult': 2.487395782015265, 'bear_tsl_mult': 0.40863635631027556, 'bear_time_stop': 241, 'bear_use_sma': True, 'bear_use_ema': False, 'bear_use_atr': True, 'bear_use_adx': False, 'bear_use_spike': True, 'bear_rsi_required': False, 'sideways_strategy': 'breakout', 'sideways_bb_std_mult': 2.5110634623947874, 'sideways_rsi_os': 25, 'sideways_rsi_ob': 50, 'sideways_adx_thresh': 23.508843049530995, 'sideways_atr_min_pct': 0.00527355483928359, 'sideways_atr_max_pct': 0.012077698440319168, 'sideways_tp_mult': 2.8213358961847095, 'sideways_tsl_mult': 0.5386769094081149, 'sideways_time_stop': 124, 'sideways_use_sma': False, 'sideways_use_ema': False, 'sideways_use_atr': False, 'sideways_use_adx': False, 'sideways_use_spike': True, 'sideways_rsi_required': False}.
[I 2025-09-01 14:04:32,102] Trial 80 finished with values: [-1000000000.0, 1000000000.0] and parameters: {'p_sma': 29, 'p_std': 47, 'p_atr': 27, 'p_adx': 20, 'rsi_period': 51, 'ema1': 18, 'ema2': 48, 'slip_atr_k': 0.21753232269253261, 'slip_spread_k': 0.36681809650619734, 'spread_hl_frac': 0.016574973618867082, 'bb_std_mult': 2.6842096278103296, 'rsi_os': 45, 'rsi_ob': 91, 'vol_spike': 0.17770453849416604, 'adx_thresh': 34.987753579445915, 'atr_min_pct': 0.008666704906747784, 'atr_max_pct': 0.11945818310578844, 'tp_mult': 1.890855112055171, 'tsl_mult': 0.16152861566429325, 'strategy': 'mean_reversion', 'time_stop': 244, 'use_sma': True, 'use_atr': False, 'use_adx': False, 'use_ema': False, 'use_spike': True, 'rsi_required': True, 'edge_k': 0.1893692172927537, 'edge_cap': 0.26184604723641475, 'bull_strategy': 'mean_reversion', 'bull_bb_std_mult': 1.6445385449156782, 'bull_rsi_os': 36, 'bull_rsi_ob': 70, 'bull_adx_thresh': 9.34168128560159, 'bull_atr_min_pct': 0.028501336459913, 'bull_atr_max_pct': 0.04543288372196226, 'bull_tp_mult': 2.4431214325162185, 'bull_tsl_mult': 0.03177417200371377, 'bull_time_stop': 113, 'bull_use_sma': False, 'bull_use_ema': True, 'bull_use_atr': True, 'bull_use_adx': False, 'bull_use_spike': True, 'bull_rsi_required': True, 'bear_strategy': 'breakout', 'bear_bb_std_mult': 1.5846559530627575, 'bear_rsi_os': 5, 'bear_rsi_ob': 63, 'bear_adx_thresh': 28.48263862258996, 'bear_atr_min_pct': 0.024759406535556305, 'bear_atr_max_pct': 0.014404811987024565, 'bear_tp_mult': 2.1896324512220544, 'bear_tsl_mult': 0.4017915335808504, 'bear_time_stop': 263, 'bear_use_sma': False, 'bear_use_ema': False, 'bear_use_atr': True, 'bear_use_adx': False, 'bear_use_spike': False, 'bear_rsi_required': True, 'sideways_strategy': 'breakout', 'sideways_bb_std_mult': 1.031689085449339, 'sideways_rsi_os': 25, 'sideways_rsi_ob': 50, 'sideways_adx_thresh': 13.50288375511083, 'sideways_atr_min_pct': 0.027870891791849664, 'sideways_atr_max_pct': 0.13202396982002362, 'sideways_tp_mult': 2.0513490577479097, 'sideways_tsl_mult': 0.5388817191317555, 'sideways_time_stop': 100, 'sideways_use_sma': False, 'sideways_use_ema': False, 'sideways_use_atr': True, 'sideways_use_adx': False, 'sideways_use_spike': True, 'sideways_rsi_required': False}.
[I 2025-09-01 14:04:32,497] Trial 77 finished with values: [-1000000000.0, 1000000000.0] and parameters: {'p_sma': 57, 'p_std': 47, 'p_atr': 18, 'p_adx': 21, 'rsi_period': 67, 'ema1': 20, 'ema2': 26, 'slip_atr_k': 0.025724269804397418, 'slip_spread_k': 0.46702240126280214, 'spread_hl_frac': 0.01674380108508132, 'bb_std_mult': 1.8212020008686796, 'rsi_os': 13, 'rsi_ob': 80, 'vol_spike': 0.06838544768884652, 'adx_thresh': 15.503236727359758, 'atr_min_pct': 0.008678814366130352, 'atr_max_pct': 0.11491627502404578, 'tp_mult': 1.8835734521049616, 'tsl_mult': 0.16517830083143986, 'strategy': 'breakout', 'time_stop': 77, 'use_sma': False, 'use_atr': True, 'use_adx': True, 'use_ema': False, 'use_spike': True, 'rsi_required': False, 'edge_k': 0.7203078098269651, 'edge_cap': 0.8910709768195948, 'bull_strategy': 'mean_reversion', 'bull_bb_std_mult': 0.9730124319619453, 'bull_rsi_os': 32, 'bull_rsi_ob': 52, 'bull_adx_thresh': 11.409758654026914, 'bull_atr_min_pct': 0.01199301995087865, 'bull_atr_max_pct': 0.11853900377993085, 'bull_tp_mult': 2.229793019491139, 'bull_tsl_mult': 0.020155966618514314, 'bull_time_stop': 12, 'bull_use_sma': True, 'bull_use_ema': True, 'bull_use_atr': True, 'bull_use_adx': False, 'bull_use_spike': True, 'bull_rsi_required': True, 'bear_strategy': 'mean_reversion', 'bear_bb_std_mult': 0.6539884672759149, 'bear_rsi_os': 14, 'bear_rsi_ob': 94, 'bear_adx_thresh': 19.534182039727806, 'bear_atr_min_pct': 0.017494812430533458, 'bear_atr_max_pct': 0.015179251230496939, 'bear_tp_mult': 2.1726782978526966, 'bear_tsl_mult': 0.4063153618454316, 'bear_time_stop': 246, 'bear_use_sma': False, 'bear_use_ema': False, 'bear_use_atr': True, 'bear_use_adx': False, 'bear_use_spike': True, 'bear_rsi_required': False, 'sideways_strategy': 'mean_reversion', 'sideways_bb_std_mult': 2.716917139194251, 'sideways_rsi_os': 27, 'sideways_rsi_ob': 59, 'sideways_adx_thresh': 23.61218682901775, 'sideways_atr_min_pct': 0.007514879516595949, 'sideways_atr_max_pct': 0.022137283435238797, 'sideways_tp_mult': 2.0397255975331894, 'sideways_tsl_mult': 0.5390383649602088, 'sideways_time_stop': 97, 'sideways_use_sma': True, 'sideways_use_ema': False, 'sideways_use_atr': True, 'sideways_use_adx': True, 'sideways_use_spike': True, 'sideways_rsi_required': False}.
