[I 2025-09-01 14:52:24,575] Trial 389 finished with values: [-0.008666511478281014, 0.008562609836629747] and parameters: {'p_sma': 22, 'p_std': 9, 'p_atr': 10, 'p_adx': 21, 'rsi_period': 61, 'ema1': 29, 'ema2': 50, 'slip_atr_k': 0.05505502179642843, 'slip_spread_k': 0.3044806236442138, 'spread_hl_frac': 0.013112217199593827, 'bb_std_mult': 1.5434238612275866, 'rsi_os': 27, 'rsi_ob': 72, 'vol_spike': 0.2999774597697685, 'adx_thresh': 34.30807700859261, 'atr_min_pct': 0.022306586943105177, 'atr_max_pct': 0.07482835442034218, 'tp_mult': 2.8491367844349784, 'tsl_mult': 0.036547700742238655, 'strategy': 'breakout', 'time_stop': 49, 'use_sma': False, 'use_atr': False, 'use_adx': True, 'use_ema': False, 'use_spike': True, 'rsi_required': True, 'edge_k': 1.2441704835809904, 'edge_cap': 0.1060217247272108, 'bull_strategy': 'mean_reversion', 'bull_bb_std_mult': 1.3792570480463495, 'bull_rsi_os': 15, 'bull_rsi_ob': 89, 'bull_adx_thresh': 33.355674877472254, 'bull_atr_min_pct': 0.0032269356320389804, 'bull_atr_max_pct': 0.07113748710710817, 'bull_tp_mult': 2.162319210704368, 'bull_tsl_mult': 0.3822012167595475, 'bull_time_stop': 130, 'bull_use_sma': True, 'bull_use_ema': False, 'bull_use_atr': True, 'bull_use_adx': True, 'bull_use_spike': False, 'bull_rsi_required': True, 'bear_strategy': 'breakout', 'bear_bb_std_mult': 0.7386293395034962, 'bear_rsi_os': 7, 'bear_rsi_ob': 78, 'bear_adx_thresh': 27.448637282888427, 'bear_atr_min_pct': 0.010570930266472205, 'bear_atr_max_pct': 0.09663287737448549, 'bear_tp_mult': 1.4078075976644262, 'bear_tsl_mult': 0.5757120853102129, 'bear_time_stop': 160, 'bear_use_sma': False, 'bear_use_ema': False, 'bear_use_atr': True, 'bear_use_adx': True, 'bear_use_spike': True, 'bear_rsi_required': True, 'sideways_strategy': 'breakout', 'sideways_bb_std_mult': 3.2228628035088005, 'sideways_rsi_os': 15, 'sideways_rsi_ob': 92, 'sideways_adx_thresh': 7.129930228110474, 'sideways_atr_min_pct': 0.0045679638550331515, 'sideways_atr_max_pct': 0.07229674799700424, 'sideways_tp_mult': 1.8826119147325486, 'sideways_tsl_mult': 0.9991575568872657, 'sideways_time_stop': 278, 'sideways_use_sma': True, 'sideways_use_ema': False, 'sideways_use_atr': True, 'sideways_use_adx': False, 'sideways_use_spike': False, 'sideways_rsi_required': True}.
[I 2025-09-01 14:52:24,779] Trial 388 finished with values: [-1000000000.0, 1000000000.0] and parameters: {'p_sma': 16, 'p_std': 60, 'p_atr': 20, 'p_adx': 30, 'rsi_period': 61, 'ema1': 12, 'ema2': 50, 'slip_atr_k': 0.19849045463270673, 'slip_spread_k': 0.30436529230775233, 'spread_hl_frac': 0.03434116136437057, 'bb_std_mult': 2.7338678783160124, 'rsi_os': 21, 'rsi_ob': 72, 'vol_spike': 0.024215413592487467, 'adx_thresh': 18.383224270918316, 'atr_min_pct': 1.3689121804915869e-05, 'atr_max_pct': 0.10023090114320267, 'tp_mult': 2.8597563466786697, 'tsl_mult': 0.4471287186693893, 'strategy': 'breakout', 'time_stop': 55, 'use_sma': False, 'use_atr': False, 'use_adx': True, 'use_ema': False, 'use_spike': True, 'rsi_required': True, 'edge_k': 0.09291112106685973, 'edge_cap': 0.09055992309603537, 'bull_strategy': 'mean_reversion', 'bull_bb_std_mult': 0.5062321851822857, 'bull_rsi_os': 15, 'bull_rsi_ob': 63, 'bull_adx_thresh': 11.394039955816707, 'bull_atr_min_pct': 0.0034004022794543246, 'bull_atr_max_pct': 0.013982451078545606, 'bull_tp_mult': 2.477340575441376, 'bull_tsl_mult': 0.376304517656128, 'bull_time_stop': 88, 'bull_use_sma': True, 'bull_use_ema': False, 'bull_use_atr': True, 'bull_use_adx': True, 'bull_use_spike': False, 'bull_rsi_required': True, 'bear_strategy': 'breakout', 'bear_bb_std_mult': 1.6038527056499357, 'bear_rsi_os': 7, 'bear_rsi_ob': 78, 'bear_adx_thresh': 27.29701194777045, 'bear_atr_min_pct': 0.010838124789660075, 'bear_atr_max_pct': 0.11328392674677204, 'bear_tp_mult': 2.282646488407182, 'bear_tsl_mult': 0.578932449202235, 'bear_time_stop': 129, 'bear_use_sma': False, 'bear_use_ema': False, 'bear_use_atr': True, 'bear_use_adx': True, 'bear_use_spike': True, 'bear_rsi_required': True, 'sideways_strategy': 'breakout', 'sideways_bb_std_mult': 3.2104657180154668, 'sideways_rsi_os': 15, 'sideways_rsi_ob': 92, 'sideways_adx_thresh': 21.581162421569015, 'sideways_atr_min_pct': 0.018319372394097637, 'sideways_atr_max_pct': 0.014056076139897719, 'sideways_tp_mult': 1.862662701277265, 'sideways_tsl_mult': 0.290157964399831, 'sideways_time_stop': 113, 'sideways_use_sma': True, 'sideways_use_ema': False, 'sideways_use_atr': True, 'sideways_use_adx': False, 'sideways_use_spike': False, 'sideways_rsi_required': True}.
[I 2025-09-01 14:52:25,155] Trial 386 finished with values: [-1000000000.0, 1000000000.0] and parameters: {'p_sma': 56, 'p_std': 22, 'p_atr': 21, 'p_adx': 23, 'rsi_period': 66, 'ema1': 29, 'ema2': 59, 'slip_atr_k': 0.10927945743284287, 'slip_spread_k': 0.6962589370838697, 'spread_hl_frac': 0.039131403630373894, 'bb_std_mult': 1.47803076742083, 'rsi_os': 37, 'rsi_ob': 58, 'vol_spike': 0.29484797667251567, 'adx_thresh': 20.47676496086276, 'atr_min_pct': 0.017339785354775893, 'atr_max_pct': 0.0758809099614336, 'tp_mult': 2.8589950984632027, 'tsl_mult': 0.3152237701444392, 'strategy': 'breakout', 'time_stop': 70, 'use_sma': False, 'use_atr': False, 'use_adx': True, 'use_ema': False, 'use_spike': True, 'rsi_required': True, 'edge_k': 0.5281739954652158, 'edge_cap': 0.7292020034964899, 'bull_strategy': 'breakout', 'bull_bb_std_mult': 0.6062849287252046, 'bull_rsi_os': 7, 'bull_rsi_ob': 49, 'bull_adx_thresh': 11.443694961343713, 'bull_atr_min_pct': 0.026863460629043497, 'bull_atr_max_pct': 0.014273455648226685, 'bull_tp_mult': 1.9183931782243877, 'bull_tsl_mult': 0.34866143185876236, 'bull_time_stop': 131, 'bull_use_sma': True, 'bull_use_ema': False, 'bull_use_atr': True, 'bull_use_adx': True, 'bull_use_spike': False, 'bull_rsi_required': True, 'bear_strategy': 'mean_reversion', 'bear_bb_std_mult': 1.7953345063214827, 'bear_rsi_os': 5, 'bear_rsi_ob': 78, 'bear_adx_thresh': 17.379085300287638, 'bear_atr_min_pct': 0.02675124685551988, 'bear_atr_max_pct': 0.12085215654315326, 'bear_tp_mult': 2.484404743214409, 'bear_tsl_mult': 0.5772181656348875, 'bear_time_stop': 128, 'bear_use_sma': False, 'bear_use_ema': False, 'bear_use_atr': True, 'bear_use_adx': True, 'bear_use_spike': True, 'bear_rsi_required': False, 'sideways_strategy': 'breakout', 'sideways_bb_std_mult': 2.659235704731613, 'sideways_rsi_os': 15, 'sideways_rsi_ob': 60, 'sideways_adx_thresh': 7.333535364117559, 'sideways_atr_min_pct': 0.015308837637436292, 'sideways_atr_max_pct': 0.13741253140513254, 'sideways_tp_mult': 1.824144786297523, 'sideways_tsl_mult': 0.1893327482067072, 'sideways_time_stop': 114, 'sideways_use_sma': True, 'sideways_use_ema': False, 'sideways_use_atr': True, 'sideways_use_adx': False, 'sideways_use_spike': True, 'sideways_rsi_required': True}.
[I 2025-09-01 14:53:02,781] Trial 391 finished with values: [-1000000000.0, 1000000000.0] and parameters: {'p_sma': 11, 'p_std': 9, 'p_atr': 21, 'p_adx': 22, 'rsi_period': 66, 'ema1': 26, 'ema2': 51, 'slip_atr_k': 0.11191277750558734, 'slip_spread_k': 0.2636428195328223, 'spread_hl_frac': 0.030536379697058344, 'bb_std_mult': 3.4032499640043476, 'rsi_os': 32, 'rsi_ob': 66, 'vol_spike': 0.2944803724910807, 'adx_thresh': 20.42855230529674, 'atr_min_pct': 0.02711120160819717, 'atr_max_pct': 0.07643652337543616, 'tp_mult': 2.8847375500288712, 'tsl_mult': 0.0523596003799813, 'strategy': 'breakout', 'time_stop': 206, 'use_sma': False, 'use_atr': True, 'use_adx': True, 'use_ema': False, 'use_spike': True, 'rsi_required': False, 'edge_k': 1.222817574091437, 'edge_cap': 0.05097516840494214, 'bull_strategy': 'breakout', 'bull_bb_std_mult': 2.012485339106855, 'bull_rsi_os': 16, 'bull_rsi_ob': 91, 'bull_adx_thresh': 30.15004764820693, 'bull_atr_min_pct': 0.017934006796327902, 'bull_atr_max_pct': 0.02798163650847144, 'bull_tp_mult': 2.009356752787637, 'bull_tsl_mult': 0.3145023200334996, 'bull_time_stop': 132, 'bull_use_sma': True, 'bull_use_ema': False, 'bull_use_atr': False, 'bull_use_adx': True, 'bull_use_spike': True, 'bull_rsi_required': True, 'bear_strategy': 'mean_reversion', 'bear_bb_std_mult': 2.75593516357005, 'bear_rsi_os': 5, 'bear_rsi_ob': 72, 'bear_adx_thresh': 30.341851112235048, 'bear_atr_min_pct': 0.007396062484316086, 'bear_atr_max_pct': 0.07849757946515153, 'bear_tp_mult': 1.9695362691162752, 'bear_tsl_mult': 0.09561496265283709, 'bear_time_stop': 300, 'bear_use_sma': False, 'bear_use_ema': False, 'bear_use_atr': False, 'bear_use_adx': True, 'bear_use_spike': False, 'bear_rsi_required': False, 'sideways_strategy': 'mean_reversion', 'sideways_bb_std_mult': 3.3587184325346815, 'sideways_rsi_os': 33, 'sideways_rsi_ob': 86, 'sideways_adx_thresh': 7.211547517880883, 'sideways_atr_min_pct': 0.0042993053856181926, 'sideways_atr_max_pct': 0.13901781724083795, 'sideways_tp_mult': 1.8205104479011756, 'sideways_tsl_mult': 0.2649867916562032, 'sideways_time_stop': 124, 'sideways_use_sma': False, 'sideways_use_ema': False, 'sideways_use_atr': True, 'sideways_use_adx': False, 'sideways_use_spike': True, 'sideways_rsi_required': True}.
[I 2025-09-01 14:53:03,602] Trial 392 finished with values: [-1000000000.0, 1000000000.0] and parameters: {'p_sma': 23, 'p_std': 9, 'p_atr': 8, 'p_adx': 20, 'rsi_period': 66, 'ema1': 25, 'ema2': 54, 'slip_atr_k': 0.04066794247138049, 'slip_spread_k': 0.9661070722018973, 'spread_hl_frac': 0.012975213796679012, 'bb_std_mult': 2.6073525104962854, 'rsi_os': 27, 'rsi_ob': 93, 'vol_spike': 0.20366385639403906, 'adx_thresh': 20.346018263771484, 'atr_min_pct': 0.016101865091117693, 'atr_max_pct': 0.07712251770833979, 'tp_mult': 2.880244349630949, 'tsl_mult': 0.06012309697369337, 'strategy': 'breakout', 'time_stop': 68, 'use_sma': False, 'use_atr': True, 'use_adx': True, 'use_ema': False, 'use_spike': True, 'rsi_required': False, 'edge_k': 0.4079174073070132, 'edge_cap': 0.22789707160625794, 'bull_strategy': 'breakout', 'bull_bb_std_mult': 2.183856375299019, 'bull_rsi_os': 16, 'bull_rsi_ob': 49, 'bull_adx_thresh': 33.34067268828409, 'bull_atr_min_pct': 0.017345613997370016, 'bull_atr_max_pct': 0.029606632906447793, 'bull_tp_mult': 2.2453116991234157, 'bull_tsl_mult': 0.3184223777927331, 'bull_time_stop': 159, 'bull_use_sma': True, 'bull_use_ema': False, 'bull_use_atr': False, 'bull_use_adx': True, 'bull_use_spike': True, 'bull_rsi_required': True, 'bear_strategy': 'mean_reversion', 'bear_bb_std_mult': 1.7924557217412318, 'bear_rsi_os': 16, 'bear_rsi_ob': 77, 'bear_adx_thresh': 30.273587295330156, 'bear_atr_min_pct': 0.010020865161158663, 'bear_atr_max_pct': 0.11410432598961107, 'bear_tp_mult': 2.512958062728131, 'bear_tsl_mult': 0.6539258658840474, 'bear_time_stop': 300, 'bear_use_sma': False, 'bear_use_ema': False, 'bear_use_atr': False, 'bear_use_adx': True, 'bear_use_spike': False, 'bear_rsi_required': False, 'sideways_strategy': 'mean_reversion', 'sideways_bb_std_mult': 2.1869392852927625, 'sideways_rsi_os': 18, 'sideways_rsi_ob': 89, 'sideways_adx_thresh': 7.1537250515848205, 'sideways_atr_min_pct': 0.0019811764758791567, 'sideways_atr_max_pct': 0.13854120099954192, 'sideways_tp_mult': 1.884526220167005, 'sideways_tsl_mult': 0.26346502171212344, 'sideways_time_stop': 158, 'sideways_use_sma': False, 'sideways_use_ema': False, 'sideways_use_atr': True, 'sideways_use_adx': False, 'sideways_use_spike': True, 'sideways_rsi_required': True}.
[I 2025-09-01 14:53:04,049] Trial 390 finished with values: [-1000000000.0, 1000000000.0] and parameters: {'p_sma': 13, 'p_std': 8, 'p_atr': 10, 'p_adx': 22, 'rsi_period': 61, 'ema1': 12, 'ema2': 54, 'slip_atr_k': 0.042706393922670526, 'slip_spread_k': 0.5119413297806982, 'spread_hl_frac': 0.03445323730191851, 'bb_std_mult': 1.5352388840605786, 'rsi_os': 27, 'rsi_ob': 58, 'vol_spike': 0.20383870518487268, 'adx_thresh': 18.255755959218828, 'atr_min_pct': 0.016127822984391395, 'atr_max_pct': 0.11208404437641924, 'tp_mult': 1.283918171864098, 'tsl_mult': 0.3039518476780969, 'strategy': 'breakout', 'time_stop': 66, 'use_sma': False, 'use_atr': False, 'use_adx': True, 'use_ema': False, 'use_spike': True, 'rsi_required': True, 'edge_k': 0.4302904292110895, 'edge_cap': 0.7207204100610404, 'bull_strategy': 'mean_reversion', 'bull_bb_std_mult': 2.1781902418785926, 'bull_rsi_os': 15, 'bull_rsi_ob': 78, 'bull_adx_thresh': 33.16224928677843, 'bull_atr_min_pct': 0.021129962302145724, 'bull_atr_max_pct': 0.03076386275517254, 'bull_tp_mult': 2.488083461549445, 'bull_tsl_mult': 0.3105797074357571, 'bull_time_stop': 42, 'bull_use_sma': True, 'bull_use_ema': False, 'bull_use_atr': True, 'bull_use_adx': True, 'bull_use_spike': False, 'bull_rsi_required': True, 'bear_strategy': 'mean_reversion', 'bear_bb_std_mult': 1.6127293757693275, 'bear_rsi_os': 7, 'bear_rsi_ob': 77, 'bear_adx_thresh': 27.483430969723056, 'bear_atr_min_pct': 0.002948336552888257, 'bear_atr_max_pct': 0.11407050060548922, 'bear_tp_mult': 2.5151200847722897, 'bear_tsl_mult': 0.644375054438005, 'bear_time_stop': 83, 'bear_use_sma': False, 'bear_use_ema': False, 'bear_use_atr': True, 'bear_use_adx': True, 'bear_use_spike': True, 'bear_rsi_required': False, 'sideways_strategy': 'breakout', 'sideways_bb_std_mult': 3.323598204080984, 'sideways_rsi_os': 15, 'sideways_rsi_ob': 89, 'sideways_adx_thresh': 21.55934188524843, 'sideways_atr_min_pct': 0.004570200279666672, 'sideways_atr_max_pct': 0.13849862143683092, 'sideways_tp_mult': 1.8436147898988238, 'sideways_tsl_mult': 0.27318526933801396, 'sideways_time_stop': 158, 'sideways_use_sma': True, 'sideways_use_ema': False, 'sideways_use_atr': True, 'sideways_use_adx': False, 'sideways_use_spike': True, 'sideways_rsi_required': True}.
[I 2025-09-01 14:53:04,243] Trial 393 finished with values: [-1000000000.0, 1000000000.0] and parameters: {'p_sma': 11, 'p_std': 9, 'p_atr': 8, 'p_adx': 22, 'rsi_period': 62, 'ema1': 25, 'ema2': 54, 'slip_atr_k': 0.054861188984485734, 'slip_spread_k': 0.2641100524123391, 'spread_hl_frac': 0.013197772450474396, 'bb_std_mult': 3.1439836629186133, 'rsi_os': 32, 'rsi_ob': 77, 'vol_spike': 0.29486428777018164, 'adx_thresh': 20.151547551136417, 'atr_min_pct': 0.02432227174247476, 'atr_max_pct': 0.11240392282759494, 'tp_mult': 2.9679095662268025, 'tsl_mult': 0.6965245872449499, 'strategy': 'breakout', 'time_stop': 280, 'use_sma': False, 'use_atr': True, 'use_adx': True, 'use_ema': False, 'use_spike': True, 'rsi_required': False, 'edge_k': 0.5450454242942324, 'edge_cap': 0.0625966177757995, 'bull_strategy': 'mean_reversion', 'bull_bb_std_mult': 1.697522327166259, 'bull_rsi_os': 25, 'bull_rsi_ob': 72, 'bull_adx_thresh': 10.552070273621107, 'bull_atr_min_pct': 0.021151275995335117, 'bull_atr_max_pct': 0.024221775379865258, 'bull_tp_mult': 1.3641746846612448, 'bull_tsl_mult': 0.17015104247000556, 'bull_time_stop': 37, 'bull_use_sma': True, 'bull_use_ema': False, 'bull_use_atr': False, 'bull_use_adx': True, 'bull_use_spike': True, 'bull_rsi_required': True, 'bear_strategy': 'mean_reversion', 'bear_bb_std_mult': 2.7643947915877405, 'bear_rsi_os': 11, 'bear_rsi_ob': 77, 'bear_adx_thresh': 27.749350923169878, 'bear_atr_min_pct': 0.023425882557736998, 'bear_atr_max_pct': 0.11437291951729567, 'bear_tp_mult': 2.535123192171819, 'bear_tsl_mult': 0.6452526419158238, 'bear_time_stop': 298, 'bear_use_sma': False, 'bear_use_ema': False, 'bear_use_atr': False, 'bear_use_adx': False, 'bear_use_spike': False, 'bear_rsi_required': False, 'sideways_strategy': 'mean_reversion', 'sideways_bb_std_mult': 2.3859481947831216, 'sideways_rsi_os': 18, 'sideways_rsi_ob': 89, 'sideways_adx_thresh': 30.526712312867666, 'sideways_atr_min_pct': 0.0044304308626720605, 'sideways_atr_max_pct': 0.13050797276943102, 'sideways_tp_mult': 1.890798880546508, 'sideways_tsl_mult': 0.7607827740882112, 'sideways_time_stop': 123, 'sideways_use_sma': False, 'sideways_use_ema': False, 'sideways_use_atr': True, 'sideways_use_adx': False, 'sideways_use_spike': True, 'sideways_rsi_required': True}.
[I 2025-09-01 14:53:05,347] Trial 396 finished with values: [-1000000000.0, 1000000000.0] and parameters: {'p_sma': 12, 'p_std': 10, 'p_atr': 20, 'p_adx': 27, 'rsi_period': 68, 'ema1': 16, 'ema2': 56, 'slip_atr_k': 0.05549446823204964, 'slip_spread_k': 0.1590048480880687, 'spread_hl_frac': 0.01356879586747906, 'bb_std_mult': 1.4025331509997927, 'rsi_os': 54, 'rsi_ob': 74, 'vol_spike': 0.29085814978547375, 'adx_thresh': 18.871393683027105, 'atr_min_pct': 0.028394301456360675, 'atr_max_pct': 0.07067972987973478, 'tp_mult': 2.996167649557584, 'tsl_mult': 0.035832853020938735, 'strategy': 'mean_reversion', 'time_stop': 114, 'use_sma': True, 'use_atr': True, 'use_adx': True, 'use_ema': True, 'use_spike': False, 'rsi_required': False, 'edge_k': 1.8253434883807906, 'edge_cap': 0.2483554959121579, 'bull_strategy': 'breakout', 'bull_bb_std_mult': 2.927901089008732, 'bull_rsi_os': 21, 'bull_rsi_ob': 47, 'bull_adx_thresh': 10.894439270202923, 'bull_atr_min_pct': 0.002885363589548675, 'bull_atr_max_pct': 0.022912330285991492, 'bull_tp_mult': 2.0598511179603616, 'bull_tsl_mult': 0.36613744779959473, 'bull_time_stop': 175, 'bull_use_sma': False, 'bull_use_ema': True, 'bull_use_atr': False, 'bull_use_adx': False, 'bull_use_spike': False, 'bull_rsi_required': False, 'bear_strategy': 'breakout', 'bear_bb_std_mult': 2.9133590684461232, 'bear_rsi_os': 37, 'bear_rsi_ob': 80, 'bear_adx_thresh': 28.54180220811324, 'bear_atr_min_pct': 0.0005552120926938364, 'bear_atr_max_pct': 0.11027943167597784, 'bear_tp_mult': 2.5925998721394468, 'bear_tsl_mult': 0.6226718642942457, 'bear_time_stop': 161, 'bear_use_sma': True, 'bear_use_ema': True, 'bear_use_atr': False, 'bear_use_adx': False, 'bear_use_spike': False, 'bear_rsi_required': True, 'sideways_strategy': 'mean_reversion', 'sideways_bb_std_mult': 3.13971922266045, 'sideways_rsi_os': 8, 'sideways_rsi_ob': 73, 'sideways_adx_thresh': 34.18265037827122, 'sideways_atr_min_pct': 0.007210469614648002, 'sideways_atr_max_pct': 0.13217848275072763, 'sideways_tp_mult': 1.7655667912528354, 'sideways_tsl_mult': 0.21850728173575568, 'sideways_time_stop': 102, 'sideways_use_sma': False, 'sideways_use_ema': True, 'sideways_use_atr': True, 'sideways_use_adx': True, 'sideways_use_spike': False, 'sideways_rsi_required': False}.
[I 2025-09-01 14:53:46,452] Trial 397 finished with values: [-1000000000.0, 1000000000.0] and parameters: {'p_sma': 46, 'p_std': 9, 'p_atr': 7, 'p_adx': 27, 'rsi_period': 48, 'ema1': 30, 'ema2': 56, 'slip_atr_k': 0.06546772255939881, 'slip_spread_k': 0.16424214776090934, 'spread_hl_frac': 0.03766834849795927, 'bb_std_mult': 1.5142191575683903, 'rsi_os': 39, 'rsi_ob': 74, 'vol_spike': 0.28975576837386013, 'adx_thresh': 18.810765084380556, 'atr_min_pct': 0.015458597521147295, 'atr_max_pct': 0.0702828046032896, 'tp_mult': 2.0627013377204917, 'tsl_mult': 0.07431184446091821, 'strategy': 'mean_reversion', 'time_stop': 50, 'use_sma': True, 'use_atr': True, 'use_adx': False, 'use_ema': True, 'use_spike': False, 'rsi_required': False, 'edge_k': 1.814184977824218, 'edge_cap': 0.5443460544023377, 'bull_strategy': 'breakout', 'bull_bb_std_mult': 1.396540319220927, 'bull_rsi_os': 28, 'bull_rsi_ob': 53, 'bull_adx_thresh': 20.896129185596166, 'bull_atr_min_pct': 0.014241507965053574, 'bull_atr_max_pct': 0.04480128935061986, 'bull_tp_mult': 2.1729917136554375, 'bull_tsl_mult': 0.5046126277102927, 'bull_time_stop': 174, 'bull_use_sma': False, 'bull_use_ema': True, 'bull_use_atr': False, 'bull_use_adx': False, 'bull_use_spike': False, 'bull_rsi_required': False, 'bear_strategy': 'breakout', 'bear_bb_std_mult': 2.896471447485748, 'bear_rsi_os': 9, 'bear_rsi_ob': 80, 'bear_adx_thresh': 28.807483887163027, 'bear_atr_min_pct': 0.022598692517351374, 'bear_atr_max_pct': 0.05913308125692667, 'bear_tp_mult': 2.5809432319121886, 'bear_tsl_mult': 0.6238075096257997, 'bear_time_stop': 285, 'bear_use_sma': True, 'bear_use_ema': True, 'bear_use_atr': False, 'bear_use_adx': False, 'bear_use_spike': False, 'bear_rsi_required': True, 'sideways_strategy': 'mean_reversion', 'sideways_bb_std_mult': 2.5269757750220654, 'sideways_rsi_os': 26, 'sideways_rsi_ob': 58, 'sideways_adx_thresh': 5.980740511409576, 'sideways_atr_min_pct': 0.005760733831291806, 'sideways_atr_max_pct': 0.13193386546087044, 'sideways_tp_mult': 1.770601794966494, 'sideways_tsl_mult': 0.9583389842115331, 'sideways_time_stop': 275, 'sideways_use_sma': False, 'sideways_use_ema': True, 'sideways_use_atr': True, 'sideways_use_adx': True, 'sideways_use_spike': False, 'sideways_rsi_required': False}.
