[I 2025-09-01 14:05:08,390] Trial 83 finished with values: [-0.01626425611400195, 0.016256617844027103] and parameters: {'p_sma': 57, 'p_std': 49, 'p_atr': 19, 'p_adx': 21, 'rsi_period': 47, 'ema1': 21, 'ema2': 44, 'slip_atr_k': 0.2038413472731123, 'slip_spread_k': 0.33154705913093424, 'spread_hl_frac': 0.02112905659589556, 'bb_std_mult': 2.5348686689627744, 'rsi_os': 20, 'rsi_ob': 73, 'vol_spike': 0.046542598990914265, 'adx_thresh': 14.058732621816425, 'atr_min_pct': 0.027754529797166465, 'atr_max_pct': 0.12621168373183483, 'tp_mult': 1.2705035161102556, 'tsl_mult': 0.7905607338044105, 'strategy': 'mean_reversion', 'time_stop': 161, 'use_sma': True, 'use_atr': False, 'use_adx': False, 'use_ema': False, 'use_spike': False, 'rsi_required': True, 'edge_k': 0.3769618210128559, 'edge_cap': 0.8372664897278397, 'bull_strategy': 'breakout', 'bull_bb_std_mult': 1.3479325323970242, 'bull_rsi_os': 38, 'bull_rsi_ob': 56, 'bull_adx_thresh': 6.115019301924715, 'bull_atr_min_pct': 0.003403995410916108, 'bull_atr_max_pct': 0.1389972391059224, 'bull_tp_mult': 1.2901835615205042, 'bull_tsl_mult': 0.0591083210043799, 'bull_time_stop': 249, 'bull_use_sma': True, 'bull_use_ema': True, 'bull_use_atr': True, 'bull_use_adx': True, 'bull_use_spike': True, 'bull_rsi_required': True, 'bear_strategy': 'breakout', 'bear_bb_std_mult': 0.6413422384141858, 'bear_rsi_os': 32, 'bear_rsi_ob': 53, 'bear_adx_thresh': 23.691193842921834, 'bear_atr_min_pct': 0.020089938123166937, 'bear_atr_max_pct': 0.02267280621411772, 'bear_tp_mult': 2.696427082487907, 'bear_tsl_mult': 0.20901337103123102, 'bear_time_stop': 16, 'bear_use_sma': True, 'bear_use_ema': False, 'bear_use_atr': True, 'bear_use_adx': False, 'bear_use_spike': False, 'bear_rsi_required': True, 'sideways_strategy': 'breakout', 'sideways_bb_std_mult': 2.922278096096451, 'sideways_rsi_os': 28, 'sideways_rsi_ob': 56, 'sideways_adx_thresh': 20.28585054027654, 'sideways_atr_min_pct': 0.012574175092459387, 'sideways_atr_max_pct': 0.07400058712937153, 'sideways_tp_mult': 1.1363493390880555, 'sideways_tsl_mult': 0.4902870955922295, 'sideways_time_stop': 89, 'sideways_use_sma': True, 'sideways_use_ema': False, 'sideways_use_atr': True, 'sideways_use_adx': True, 'sideways_use_spike': False, 'sideways_rsi_required': False}.
[I 2025-09-01 14:05:09,000] Trial 82 finished with values: [-1000000000.0, 1000000000.0] and parameters: {'p_sma': 41, 'p_std': 46, 'p_atr': 21, 'p_adx': 21, 'rsi_period': 30, 'ema1': 18, 'ema2': 44, 'slip_atr_k': 0.2205649557842451, 'slip_spread_k': 0.4343689281694657, 'spread_hl_frac': 0.015549159368581006, 'bb_std_mult': 2.0626152671134776, 'rsi_os': 20, 'rsi_ob': 76, 'vol_spike': 0.1950778926640908, 'adx_thresh': 33.77975430394844, 'atr_min_pct': 0.027892990401189866, 'atr_max_pct': 0.10573231472171984, 'tp_mult': 1.6860417156472742, 'tsl_mult': 0.35723245353276134, 'strategy': 'mean_reversion', 'time_stop': 85, 'use_sma': True, 'use_atr': False, 'use_adx': False, 'use_ema': False, 'use_spike': False, 'rsi_required': True, 'edge_k': 0.95719049816778, 'edge_cap': 0.23507318378185693, 'bull_strategy': 'mean_reversion', 'bull_bb_std_mult': 1.3580402839252634, 'bull_rsi_os': 37, 'bull_rsi_ob': 69, 'bull_adx_thresh': 11.437845036088815, 'bull_atr_min_pct': 0.0031295129209029174, 'bull_atr_max_pct': 0.14158960542873372, 'bull_tp_mult': 1.2282585134543604, 'bull_tsl_mult': 0.026411520862603358, 'bull_time_stop': 100, 'bull_use_sma': True, 'bull_use_ema': True, 'bull_use_atr': True, 'bull_use_adx': True, 'bull_use_spike': True, 'bull_rsi_required': True, 'bear_strategy': 'breakout', 'bear_bb_std_mult': 0.6290599170485569, 'bear_rsi_os': 23, 'bear_rsi_ob': 52, 'bear_adx_thresh': 33.421606606654045, 'bear_atr_min_pct': 0.02045576380508652, 'bear_atr_max_pct': 0.02469047744146071, 'bear_tp_mult': 2.6931265479579305, 'bear_tsl_mult': 0.31240550822857305, 'bear_time_stop': 233, 'bear_use_sma': True, 'bear_use_ema': False, 'bear_use_atr': True, 'bear_use_adx': False, 'bear_use_spike': False, 'bear_rsi_required': True, 'sideways_strategy': 'breakout', 'sideways_bb_std_mult': 1.0418005783782256, 'sideways_rsi_os': 23, 'sideways_rsi_ob': 55, 'sideways_adx_thresh': 12.671916323106725, 'sideways_atr_min_pct': 0.024746960973837617, 'sideways_atr_max_pct': 0.08335138263213472, 'sideways_tp_mult': 2.0387939153260417, 'sideways_tsl_mult': 0.5010772767085154, 'sideways_time_stop': 18, 'sideways_use_sma': True, 'sideways_use_ema': False, 'sideways_use_atr': True, 'sideways_use_adx': True, 'sideways_use_spike': False, 'sideways_rsi_required': False}.
[I 2025-09-01 14:05:09,279] Trial 84 finished with values: [-0.02064570312631364, 0.020441092681451587] and parameters: {'p_sma': 41, 'p_std': 49, 'p_atr': 19, 'p_adx': 21, 'rsi_period': 63, 'ema1': 17, 'ema2': 44, 'slip_atr_k': 0.22836275099645487, 'slip_spread_k': 0.3233826002899921, 'spread_hl_frac': 0.04026867128924663, 'bb_std_mult': 2.03320348530861, 'rsi_os': 17, 'rsi_ob': 56, 'vol_spike': 0.0480550400511609, 'adx_thresh': 30.561401296023135, 'atr_min_pct': 0.006095784015928027, 'atr_max_pct': 0.12341082894166379, 'tp_mult': 1.9806280152598892, 'tsl_mult': 0.8086784557634662, 'strategy': 'mean_reversion', 'time_stop': 185, 'use_sma': True, 'use_atr': False, 'use_adx': False, 'use_ema': False, 'use_spike': False, 'rsi_required': True, 'edge_k': 0.9446651564901176, 'edge_cap': 0.5504454906446563, 'bull_strategy': 'breakout', 'bull_bb_std_mult': 1.285325888560777, 'bull_rsi_os': 37, 'bull_rsi_ob': 67, 'bull_adx_thresh': 24.04505398098522, 'bull_atr_min_pct': 0.0025249928188436034, 'bull_atr_max_pct': 0.02712862868580314, 'bull_tp_mult': 1.0301984083463358, 'bull_tsl_mult': 0.0003258274191457059, 'bull_time_stop': 102, 'bull_use_sma': True, 'bull_use_ema': True, 'bull_use_atr': True, 'bull_use_adx': True, 'bull_use_spike': False, 'bull_rsi_required': False, 'bear_strategy': 'breakout', 'bear_bb_std_mult': 3.131555458544715, 'bear_rsi_os': 32, 'bear_rsi_ob': 87, 'bear_adx_thresh': 33.23513964920443, 'bear_atr_min_pct': 0.014781857213646832, 'bear_atr_max_pct': 0.02344682962752958, 'bear_tp_mult': 2.6987147676148, 'bear_tsl_mult': 0.21497533815699948, 'bear_time_stop': 234, 'bear_use_sma': True, 'bear_use_ema': False, 'bear_use_atr': False, 'bear_use_adx': False, 'bear_use_spike': True, 'bear_rsi_required': True, 'sideways_strategy': 'breakout', 'sideways_bb_std_mult': 2.9232564516117825, 'sideways_rsi_os': 23, 'sideways_rsi_ob': 55, 'sideways_adx_thresh': 24.68743209155013, 'sideways_atr_min_pct': 0.023695131562834426, 'sideways_atr_max_pct': 0.0845506850861136, 'sideways_tp_mult': 1.1434800435630783, 'sideways_tsl_mult': 0.8678227095582669, 'sideways_time_stop': 82, 'sideways_use_sma': True, 'sideways_use_ema': False, 'sideways_use_atr': True, 'sideways_use_adx': True, 'sideways_use_spike': False, 'sideways_rsi_required': False}.
[I 2025-09-01 14:05:09,434] Trial 81 finished with values: [-1000000000.0, 1000000000.0] and parameters: {'p_sma': 57, 'p_std': 47, 'p_atr': 27, 'p_adx': 21, 'rsi_period': 67, 'ema1': 19, 'ema2': 44, 'slip_atr_k': 0.2179109097579733, 'slip_spread_k': 0.328020213133003, 'spread_hl_frac': 0.0004082395651374693, 'bb_std_mult': 2.638087151128087, 'rsi_os': 17, 'rsi_ob': 91, 'vol_spike': 0.14533151502908898, 'adx_thresh': 15.710252363041674, 'atr_min_pct': 0.01052711971629282, 'atr_max_pct': 0.12063174298844259, 'tp_mult': 2.1076324743353485, 'tsl_mult': 0.8184437166395981, 'strategy': 'mean_reversion', 'time_stop': 244, 'use_sma': True, 'use_atr': False, 'use_adx': False, 'use_ema': False, 'use_spike': True, 'rsi_required': True, 'edge_k': 0.7333949279631738, 'edge_cap': 0.270800783706613, 'bull_strategy': 'mean_reversion', 'bull_bb_std_mult': 1.3628034020210174, 'bull_rsi_os': 27, 'bull_rsi_ob': 70, 'bull_adx_thresh': 21.35829060317412, 'bull_atr_min_pct': 0.002252739441711279, 'bull_atr_max_pct': 0.13958215315086936, 'bull_tp_mult': 2.4172824602531495, 'bull_tsl_mult': 0.04311424378138022, 'bull_time_stop': 116, 'bull_use_sma': False, 'bull_use_ema': True, 'bull_use_atr': True, 'bull_use_adx': False, 'bull_use_spike': True, 'bull_rsi_required': True, 'bear_strategy': 'breakout', 'bear_bb_std_mult': 3.115057872000074, 'bear_rsi_os': 22, 'bear_rsi_ob': 87, 'bear_adx_thresh': 12.500338497188807, 'bear_atr_min_pct': 0.024081178423162146, 'bear_atr_max_pct': 0.022387566846226385, 'bear_tp_mult': 2.1548320182009353, 'bear_tsl_mult': 0.3105475105269966, 'bear_time_stop': 262, 'bear_use_sma': True, 'bear_use_ema': False, 'bear_use_atr': True, 'bear_use_adx': False, 'bear_use_spike': False, 'bear_rsi_required': True, 'sideways_strategy': 'breakout', 'sideways_bb_std_mult': 2.541409186126184, 'sideways_rsi_os': 39, 'sideways_rsi_ob': 50, 'sideways_adx_thresh': 23.306111558102362, 'sideways_atr_min_pct': 0.024772845421186157, 'sideways_atr_max_pct': 0.012491285329607568, 'sideways_tp_mult': 2.1191630787868903, 'sideways_tsl_mult': 0.5407202875770847, 'sideways_time_stop': 100, 'sideways_use_sma': False, 'sideways_use_ema': False, 'sideways_use_atr': True, 'sideways_use_adx': True, 'sideways_use_spike': False, 'sideways_rsi_required': False}.
[I 2025-09-01 14:05:09,823] Trial 86 finished with values: [-1000000000.0, 1000000000.0] and parameters: {'p_sma': 38, 'p_std': 49, 'p_atr': 24, 'p_adx': 22, 'rsi_period': 84, 'ema1': 19, 'ema2': 34, 'slip_atr_k': 0.20380020653819647, 'slip_spread_k': 0.3227990134288231, 'spread_hl_frac': 0.02062261431517302, 'bb_std_mult': 2.532144204042604, 'rsi_os': 17, 'rsi_ob': 46, 'vol_spike': 0.14294490390264958, 'adx_thresh': 24.430327097850522, 'atr_min_pct': 0.006648440089261207, 'atr_max_pct': 0.12724641440743767, 'tp_mult': 2.0891289283076, 'tsl_mult': 0.3079765995618311, 'strategy': 'mean_reversion', 'time_stop': 188, 'use_sma': False, 'use_atr': False, 'use_adx': True, 'use_ema': False, 'use_spike': False, 'rsi_required': True, 'edge_k': 1.10925466909713, 'edge_cap': 0.7602071943986417, 'bull_strategy': 'breakout', 'bull_bb_std_mult': 1.2325997532131836, 'bull_rsi_os': 9, 'bull_rsi_ob': 56, 'bull_adx_thresh': 13.565392529239809, 'bull_atr_min_pct': 0.0020823126624462725, 'bull_atr_max_pct': 0.03141727838640786, 'bull_tp_mult': 2.598495852256415, 'bull_tsl_mult': 0.06334844311529886, 'bull_time_stop': 90, 'bull_use_sma': True, 'bull_use_ema': True, 'bull_use_atr': False, 'bull_use_adx': True, 'bull_use_spike': True, 'bull_rsi_required': False, 'bear_strategy': 'breakout', 'bear_bb_std_mult': 3.131608307083924, 'bear_rsi_os': 32, 'bear_rsi_ob': 86, 'bear_adx_thresh': 12.619177096721186, 'bear_atr_min_pct': 0.022298731482870864, 'bear_atr_max_pct': 0.11985120845067576, 'bear_tp_mult': 2.8551427175296564, 'bear_tsl_mult': 0.20122965901777673, 'bear_time_stop': 282, 'bear_use_sma': True, 'bear_use_ema': False, 'bear_use_atr': False, 'bear_use_adx': False, 'bear_use_spike': True, 'bear_rsi_required': True, 'sideways_strategy': 'breakout', 'sideways_bb_std_mult': 2.922072172103024, 'sideways_rsi_os': 21, 'sideways_rsi_ob': 92, 'sideways_adx_thresh': 30.96306789562466, 'sideways_atr_min_pct': 0.008726809370122579, 'sideways_atr_max_pct': 0.07549612149536378, 'sideways_tp_mult': 2.1109282376235843, 'sideways_tsl_mult': 0.8867364123264414, 'sideways_time_stop': 143, 'sideways_use_sma': True, 'sideways_use_ema': False, 'sideways_use_atr': True, 'sideways_use_adx': True, 'sideways_use_spike': False, 'sideways_rsi_required': False}.
[I 2025-09-01 14:05:46,665] Trial 88 finished with values: [-1000000000.0, 1000000000.0] and parameters: {'p_sma': 44, 'p_std': 49, 'p_atr': 24, 'p_adx': 19, 'rsi_period': 78, 'ema1': 17, 'ema2': 41, 'slip_atr_k': 0.09614577320708155, 'slip_spread_k': 0.395881524915369, 'spread_hl_frac': 0.040328209453749674, 'bb_std_mult': 2.552469459731237, 'rsi_os': 27, 'rsi_ob': 73, 'vol_spike': 0.04896027656120935, 'adx_thresh': 12.967141685944751, 'atr_min_pct': 0.023835563341154657, 'atr_max_pct': 0.1259625456554282, 'tp_mult': 2.8501721834786933, 'tsl_mult': 0.7113207753486398, 'strategy': 'mean_reversion', 'time_stop': 45, 'use_sma': False, 'use_atr': False, 'use_adx': True, 'use_ema': False, 'use_spike': False, 'rsi_required': True, 'edge_k': 0.07884257534092631, 'edge_cap': 0.7567212073339022, 'bull_strategy': 'breakout', 'bull_bb_std_mult': 1.2486312378991355, 'bull_rsi_os': 9, 'bull_rsi_ob': 56, 'bull_adx_thresh': 6.123277564832563, 'bull_atr_min_pct': 0.021663631228953498, 'bull_atr_max_pct': 0.09896455596868954, 'bull_tp_mult': 2.6193473205847595, 'bull_tsl_mult': 0.06874683205090057, 'bull_time_stop': 292, 'bull_use_sma': True, 'bull_use_ema': True, 'bull_use_atr': False, 'bull_use_adx': True, 'bull_use_spike': False, 'bull_rsi_required': False, 'bear_strategy': 'breakout', 'bear_bb_std_mult': 1.9730093416243346, 'bear_rsi_os': 9, 'bear_rsi_ob': 57, 'bear_adx_thresh': 6.753759165420407, 'bear_atr_min_pct': 0.014553485303358711, 'bear_atr_max_pct': 0.11157655712174355, 'bear_tp_mult': 2.7775782317089175, 'bear_tsl_mult': 0.10837620948767668, 'bear_time_stop': 14, 'bear_use_sma': True, 'bear_use_ema': False, 'bear_use_atr': False, 'bear_use_adx': False, 'bear_use_spike': True, 'bear_rsi_required': True, 'sideways_strategy': 'breakout', 'sideways_bb_std_mult': 3.249767949686852, 'sideways_rsi_os': 19, 'sideways_rsi_ob': 92, 'sideways_adx_thresh': 24.520532300684803, 'sideways_atr_min_pct': 0.008910046639825435, 'sideways_atr_max_pct': 0.12094874881136769, 'sideways_tp_mult': 2.158781837104158, 'sideways_tsl_mult': 0.950549876749692, 'sideways_time_stop': 142, 'sideways_use_sma': True, 'sideways_use_ema': False, 'sideways_use_atr': True, 'sideways_use_adx': True, 'sideways_use_spike': False, 'sideways_rsi_required': False}.
[I 2025-09-01 14:05:46,691] Trial 87 finished with values: [-0.015349112323687075, 0.015601984107250435] and parameters: {'p_sma': 39, 'p_std': 49, 'p_atr': 24, 'p_adx': 19, 'rsi_period': 47, 'ema1': 19, 'ema2': 43, 'slip_atr_k': 0.09285468126700694, 'slip_spread_k': 0.32891956171707915, 'spread_hl_frac': 0.02120387366027916, 'bb_std_mult': 2.4989966861489883, 'rsi_os': 17, 'rsi_ob': 56, 'vol_spike': 0.049818752211167924, 'adx_thresh': 13.44969514832557, 'atr_min_pct': 0.006056010035310941, 'atr_max_pct': 0.1260780029065195, 'tp_mult': 2.864437133871764, 'tsl_mult': 0.3200053536947312, 'strategy': 'mean_reversion', 'time_stop': 52, 'use_sma': True, 'use_atr': False, 'use_adx': True, 'use_ema': False, 'use_spike': False, 'rsi_required': True, 'edge_k': 0.7994019209350197, 'edge_cap': 0.7654427982603014, 'bull_strategy': 'breakout', 'bull_bb_std_mult': 1.2570832403290637, 'bull_rsi_os': 27, 'bull_rsi_ob': 66, 'bull_adx_thresh': 13.672164303236057, 'bull_atr_min_pct': 0.0022782807931481484, 'bull_atr_max_pct': 0.11381938344086034, 'bull_tp_mult': 1.0233724528839172, 'bull_tsl_mult': 0.05823167978935841, 'bull_time_stop': 284, 'bull_use_sma': True, 'bull_use_ema': True, 'bull_use_atr': False, 'bull_use_adx': True, 'bull_use_spike': False, 'bull_rsi_required': False, 'bear_strategy': 'breakout', 'bear_bb_std_mult': 3.4746618704670795, 'bear_rsi_os': 9, 'bear_rsi_ob': 57, 'bear_adx_thresh': 29.676050150262803, 'bear_atr_min_pct': 0.003484803926416747, 'bear_atr_max_pct': 0.0209432747146776, 'bear_tp_mult': 2.785704323966537, 'bear_tsl_mult': 0.21827516688110415, 'bear_time_stop': 283, 'bear_use_sma': True, 'bear_use_ema': False, 'bear_use_atr': False, 'bear_use_adx': False, 'bear_use_spike': True, 'bear_rsi_required': True, 'sideways_strategy': 'breakout', 'sideways_bb_std_mult': 2.955513918977748, 'sideways_rsi_os': 21, 'sideways_rsi_ob': 92, 'sideways_adx_thresh': 24.458100272783025, 'sideways_atr_min_pct': 0.008501046495538086, 'sideways_atr_max_pct': 0.07407986033403417, 'sideways_tp_mult': 1.157544301515949, 'sideways_tsl_mult': 0.8928886871005859, 'sideways_time_stop': 260, 'sideways_use_sma': True, 'sideways_use_ema': False, 'sideways_use_atr': True, 'sideways_use_adx': True, 'sideways_use_spike': False, 'sideways_rsi_required': False}.
[I 2025-09-01 14:05:46,872] Trial 85 finished with values: [-0.015035084707714308, 0.014932768433900125] and parameters: {'p_sma': 41, 'p_std': 49, 'p_atr': 21, 'p_adx': 21, 'rsi_period': 58, 'ema1': 17, 'ema2': 39, 'slip_atr_k': 0.0931004633777095, 'slip_spread_k': 0.31728590074906127, 'spread_hl_frac': 0.0004697485438425915, 'bb_std_mult': 2.509468725070362, 'rsi_os': 18, 'rsi_ob': 73, 'vol_spike': 0.05358962073565584, 'adx_thresh': 18.479254453695237, 'atr_min_pct': 0.0063916214908236735, 'atr_max_pct': 0.12611499811317994, 'tp_mult': 2.0959110860357715, 'tsl_mult': 0.34320409485857406, 'strategy': 'mean_reversion', 'time_stop': 185, 'use_sma': True, 'use_atr': False, 'use_adx': False, 'use_ema': False, 'use_spike': False, 'rsi_required': True, 'edge_k': 0.9587202388561752, 'edge_cap': 0.1926536985118963, 'bull_strategy': 'breakout', 'bull_bb_std_mult': 1.0921500765060501, 'bull_rsi_os': 27, 'bull_rsi_ob': 56, 'bull_adx_thresh': 6.292344826049533, 'bull_atr_min_pct': 0.002592145663762554, 'bull_atr_max_pct': 0.1403944918532575, 'bull_tp_mult': 1.2856656055315683, 'bull_tsl_mult': 0.061358310108644724, 'bull_time_stop': 100, 'bull_use_sma': True, 'bull_use_ema': True, 'bull_use_atr': True, 'bull_use_adx': True, 'bull_use_spike': True, 'bull_rsi_required': False, 'bear_strategy': 'breakout', 'bear_bb_std_mult': 1.346437596595378, 'bear_rsi_os': 9, 'bear_rsi_ob': 57, 'bear_adx_thresh': 12.347061379046394, 'bear_atr_min_pct': 0.02030922384442193, 'bear_atr_max_pct': 0.021176932050453352, 'bear_tp_mult': 2.771697176069582, 'bear_tsl_mult': 0.30754680514736665, 'bear_time_stop': 282, 'bear_use_sma': True, 'bear_use_ema': False, 'bear_use_atr': True, 'bear_use_adx': False, 'bear_use_spike': False, 'bear_rsi_required': True, 'sideways_strategy': 'breakout', 'sideways_bb_std_mult': 2.898573849974048, 'sideways_rsi_os': 23, 'sideways_rsi_ob': 55, 'sideways_adx_thresh': 24.404712264056645, 'sideways_atr_min_pct': 0.008707173388537829, 'sideways_atr_max_pct': 0.07483269738758264, 'sideways_tp_mult': 1.5882333152662804, 'sideways_tsl_mult': 0.49396333621040234, 'sideways_time_stop': 141, 'sideways_use_sma': True, 'sideways_use_ema': False, 'sideways_use_atr': True, 'sideways_use_adx': True, 'sideways_use_spike': False, 'sideways_rsi_required': False}.
[I 2025-09-01 14:05:47,323] Trial 89 finished with values: [-1000000000.0, 1000000000.0] and parameters: {'p_sma': 44, 'p_std': 55, 'p_atr': 16, 'p_adx': 23, 'rsi_period': 53, 'ema1': 17, 'ema2': 39, 'slip_atr_k': 0.19323340831654867, 'slip_spread_k': 0.5160512905998101, 'spread_hl_frac': 0.023904115926334613, 'bb_std_mult': 1.4542561030614296, 'rsi_os': 38, 'rsi_ob': 73, 'vol_spike': 0.04867105078803008, 'adx_thresh': 13.275155465811968, 'atr_min_pct': 0.02504150059709553, 'atr_max_pct': 0.12480959228541721, 'tp_mult': 1.9843219247069572, 'tsl_mult': 0.6762379246512247, 'strategy': 'mean_reversion', 'time_stop': 164, 'use_sma': False, 'use_atr': False, 'use_adx': True, 'use_ema': False, 'use_spike': False, 'rsi_required': True, 'edge_k': 0.793681907103132, 'edge_cap': 0.6715907060202115, 'bull_strategy': 'breakout', 'bull_bb_std_mult': 1.08242982447968, 'bull_rsi_os': 30, 'bull_rsi_ob': 65, 'bull_adx_thresh': 5.800149748947415, 'bull_atr_min_pct': 0.022063301424871812, 'bull_atr_max_pct': 0.10508119866230924, 'bull_tp_mult': 1.300398385865869, 'bull_tsl_mult': 0.0025522262134808175, 'bull_time_stop': 98, 'bull_use_sma': True, 'bull_use_ema': True, 'bull_use_atr': False, 'bull_use_adx': True, 'bull_use_spike': False, 'bull_rsi_required': False, 'bear_strategy': 'breakout', 'bear_bb_std_mult': 2.5203860970699834, 'bear_rsi_os': 10, 'bear_rsi_ob': 92, 'bear_adx_thresh': 9.808359155126157, 'bear_atr_min_pct': 0.02028219638229092, 'bear_atr_max_pct': 0.07627260666826267, 'bear_tp_mult': 2.7737530439796005, 'bear_tsl_mult': 0.6727339589482811, 'bear_time_stop': 270, 'bear_use_sma': True, 'bear_use_ema': True, 'bear_use_atr': False, 'bear_use_adx': True, 'bear_use_spike': True, 'bear_rsi_required': True, 'sideways_strategy': 'breakout', 'sideways_bb_std_mult': 1.7661973057498148, 'sideways_rsi_os': 55, 'sideways_rsi_ob': 56, 'sideways_adx_thresh': 10.195390512399005, 'sideways_atr_min_pct': 0.010598441227752064, 'sideways_atr_max_pct': 0.1219582793565222, 'sideways_tp_mult': 2.1759824815448656, 'sideways_tsl_mult': 0.958470877573071, 'sideways_time_stop': 119, 'sideways_use_sma': True, 'sideways_use_ema': True, 'sideways_use_atr': False, 'sideways_use_adx': True, 'sideways_use_spike': False, 'sideways_rsi_required': False}.
