[I 2025-09-01 15:02:58,271] Trial 450 finished with values: [-1000000000.0, 1000000000.0] and parameters: {'p_sma': 10, 'p_std': 59, 'p_atr': 21, 'p_adx': 25, 'rsi_period': 35, 'ema1': 5, 'ema2': 14, 'slip_atr_k': 0.2405615188044137, 'slip_spread_k': 0.2209284892596626, 'spread_hl_frac': 0.013199900522900185, 'bb_std_mult': 0.514218869384178, 'rsi_os': 19, 'rsi_ob': 75, 'vol_spike': 0.16325117005483508, 'adx_thresh': 18.022480469858444, 'atr_min_pct': 0.016267508196664993, 'atr_max_pct': 0.08032986713891499, 'tp_mult': 1.2591297432859694, 'tsl_mult': 0.38555614071474964, 'strategy': 'breakout', 'time_stop': 218, 'use_sma': False, 'use_atr': True, 'use_adx': False, 'use_ema': False, 'use_spike': True, 'rsi_required': False, 'edge_k': 0.3777896766176705, 'edge_cap': 0.051906737061442505, 'bull_strategy': 'breakout', 'bull_bb_std_mult': 2.910992289949585, 'bull_rsi_os': 20, 'bull_rsi_ob': 48, 'bull_adx_thresh': 10.07108842631048, 'bull_atr_min_pct': 0.01529850996160478, 'bull_atr_max_pct': 0.04406680072442073, 'bull_tp_mult': 1.5182700478837514, 'bull_tsl_mult': 0.3264504551336424, 'bull_time_stop': 239, 'bull_use_sma': True, 'bull_use_ema': False, 'bull_use_atr': False, 'bull_use_adx': True, 'bull_use_spike': False, 'bull_rsi_required': True, 'bear_strategy': 'mean_reversion', 'bear_bb_std_mult': 2.947060537546719, 'bear_rsi_os': 11, 'bear_rsi_ob': 78, 'bear_adx_thresh': 20.648298563622262, 'bear_atr_min_pct': 0.003663746722518166, 'bear_atr_max_pct': 0.1124986385476127, 'bear_tp_mult': 2.5258180385804607, 'bear_tsl_mult': 0.8724101568577319, 'bear_time_stop': 276, 'bear_use_sma': False, 'bear_use_ema': False, 'bear_use_atr': False, 'bear_use_adx': False, 'bear_use_spike': False, 'bear_rsi_required': False, 'sideways_strategy': 'mean_reversion', 'sideways_bb_std_mult': 3.245768089029828, 'sideways_rsi_os': 14, 'sideways_rsi_ob': 90, 'sideways_adx_thresh': 12.11021730888967, 'sideways_atr_min_pct': 0.02311747930906101, 'sideways_atr_max_pct': 0.13007403070721785, 'sideways_tp_mult': 1.7914840037477335, 'sideways_tsl_mult': 0.29066493640273394, 'sideways_time_stop': 65, 'sideways_use_sma': False, 'sideways_use_ema': False, 'sideways_use_atr': True, 'sideways_use_adx': False, 'sideways_use_spike': True, 'sideways_rsi_required': True}.
[I 2025-09-01 15:02:58,608] Trial 448 finished with values: [-1000000000.0, 1000000000.0] and parameters: {'p_sma': 53, 'p_std': 5, 'p_atr': 24, 'p_adx': 25, 'rsi_period': 66, 'ema1': 19, 'ema2': 14, 'slip_atr_k': 0.20846486129928415, 'slip_spread_k': 0.48963770894943487, 'spread_hl_frac': 0.003582843452709421, 'bb_std_mult': 1.5990056348521307, 'rsi_os': 37, 'rsi_ob': 75, 'vol_spike': 0.03063297185484684, 'adx_thresh': 18.0139770396879, 'atr_min_pct': 0.005782950478896194, 'atr_max_pct': 0.015195438612191497, 'tp_mult': 1.2590858771782971, 'tsl_mult': 0.01808545015811229, 'strategy': 'breakout', 'time_stop': 258, 'use_sma': True, 'use_atr': True, 'use_adx': True, 'use_ema': False, 'use_spike': False, 'rsi_required': False, 'edge_k': 0.47098602828056885, 'edge_cap': 0.6548493279550107, 'bull_strategy': 'breakout', 'bull_bb_std_mult': 2.907471555217178, 'bull_rsi_os': 54, 'bull_rsi_ob': 80, 'bull_adx_thresh': 12.439868872328143, 'bull_atr_min_pct': 0.015340902487067785, 'bull_atr_max_pct': 0.07039111213979284, 'bull_tp_mult': 2.1113803383976846, 'bull_tsl_mult': 0.5154788629595383, 'bull_time_stop': 160, 'bull_use_sma': True, 'bull_use_ema': False, 'bull_use_atr': False, 'bull_use_adx': True, 'bull_use_spike': False, 'bull_rsi_required': True, 'bear_strategy': 'mean_reversion', 'bear_bb_std_mult': 2.7656392035095454, 'bear_rsi_os': 6, 'bear_rsi_ob': 78, 'bear_adx_thresh': 20.622570574071013, 'bear_atr_min_pct': 0.01836780059319343, 'bear_atr_max_pct': 0.11584616501068946, 'bear_tp_mult': 2.522102716641457, 'bear_tsl_mult': 0.0051090986142436345, 'bear_time_stop': 175, 'bear_use_sma': False, 'bear_use_ema': True, 'bear_use_atr': False, 'bear_use_adx': True, 'bear_use_spike': False, 'bear_rsi_required': False, 'sideways_strategy': 'mean_reversion', 'sideways_bb_std_mult': 3.3413791969699695, 'sideways_rsi_os': 32, 'sideways_rsi_ob': 59, 'sideways_adx_thresh': 8.365019656384085, 'sideways_atr_min_pct': 0.022274073134483267, 'sideways_atr_max_pct': 0.10452243191674179, 'sideways_tp_mult': 1.791265291901261, 'sideways_tsl_mult': 0.29054205104146846, 'sideways_time_stop': 265, 'sideways_use_sma': False, 'sideways_use_ema': False, 'sideways_use_atr': True, 'sideways_use_adx': False, 'sideways_use_spike': True, 'sideways_rsi_required': True}.
[I 2025-09-01 15:03:39,325] Trial 454 finished with values: [-1000000000.0, 1000000000.0] and parameters: {'p_sma': 31, 'p_std': 9, 'p_atr': 15, 'p_adx': 24, 'rsi_period': 70, 'ema1': 30, 'ema2': 51, 'slip_atr_k': 0.1895568582515789, 'slip_spread_k': 0.4908171808411639, 'spread_hl_frac': 0.015340673130193884, 'bb_std_mult': 1.5428656335132167, 'rsi_os': 39, 'rsi_ob': 57, 'vol_spike': 0.293167731255116, 'adx_thresh': 28.174986270767093, 'atr_min_pct': 0.015238839464333995, 'atr_max_pct': 0.04672806153979499, 'tp_mult': 2.601241079724203, 'tsl_mult': 0.11322306161755231, 'strategy': 'breakout', 'time_stop': 78, 'use_sma': False, 'use_atr': True, 'use_adx': True, 'use_ema': False, 'use_spike': True, 'rsi_required': False, 'edge_k': 0.620667159426784, 'edge_cap': 0.5692996773520139, 'bull_strategy': 'breakout', 'bull_bb_std_mult': 2.595546566751279, 'bull_rsi_os': 18, 'bull_rsi_ob': 46, 'bull_adx_thresh': 9.079439987781488, 'bull_atr_min_pct': 0.00460297529940751, 'bull_atr_max_pct': 0.01871594094280164, 'bull_tp_mult': 1.9244237122693337, 'bull_tsl_mult': 0.597221387959964, 'bull_time_stop': 163, 'bull_use_sma': True, 'bull_use_ema': False, 'bull_use_atr': False, 'bull_use_adx': True, 'bull_use_spike': False, 'bull_rsi_required': True, 'bear_strategy': 'mean_reversion', 'bear_bb_std_mult': 1.3867893677682117, 'bear_rsi_os': 6, 'bear_rsi_ob': 77, 'bear_adx_thresh': 28.96109542497986, 'bear_atr_min_pct': 0.02413999588920675, 'bear_atr_max_pct': 0.10964769419556399, 'bear_tp_mult': 2.4656550956154297, 'bear_tsl_mult': 0.6262908308459274, 'bear_time_stop': 267, 'bear_use_sma': False, 'bear_use_ema': False, 'bear_use_atr': False, 'bear_use_adx': True, 'bear_use_spike': False, 'bear_rsi_required': False, 'sideways_strategy': 'mean_reversion', 'sideways_bb_std_mult': 0.7589476555864905, 'sideways_rsi_os': 15, 'sideways_rsi_ob': 69, 'sideways_adx_thresh': 6.36395502125538, 'sideways_atr_min_pct': 0.024424265355073832, 'sideways_atr_max_pct': 0.14303728404290403, 'sideways_tp_mult': 1.2230556006443938, 'sideways_tsl_mult': 0.41179079875113, 'sideways_time_stop': 86, 'sideways_use_sma': False, 'sideways_use_ema': False, 'sideways_use_atr': True, 'sideways_use_adx': False, 'sideways_use_spike': True, 'sideways_rsi_required': True}.
[I 2025-09-01 15:03:39,769] Trial 452 finished with values: [-0.06135754684103778, 0.0612285104739816] and parameters: {'p_sma': 38, 'p_std': 8, 'p_atr': 21, 'p_adx': 25, 'rsi_period': 18, 'ema1': 20, 'ema2': 32, 'slip_atr_k': 0.06014358059677321, 'slip_spread_k': 0.4870754908145461, 'spread_hl_frac': 0.01135815964740378, 'bb_std_mult': 1.5395242944356735, 'rsi_os': 19, 'rsi_ob': 67, 'vol_spike': 0.11660891367144399, 'adx_thresh': 28.125427927287653, 'atr_min_pct': 0.013635234025794998, 'atr_max_pct': 0.01552733603419515, 'tp_mult': 1.7472105806265925, 'tsl_mult': 0.10523219636717758, 'strategy': 'breakout', 'time_stop': 217, 'use_sma': False, 'use_atr': True, 'use_adx': False, 'use_ema': False, 'use_spike': True, 'rsi_required': False, 'edge_k': 0.6061227662933962, 'edge_cap': 0.06305702558937948, 'bull_strategy': 'breakout', 'bull_bb_std_mult': 2.8762163657664686, 'bull_rsi_os': 16, 'bull_rsi_ob': 80, 'bull_adx_thresh': 10.115663269389273, 'bull_atr_min_pct': 0.0016236451514525666, 'bull_atr_max_pct': 0.019593919205562183, 'bull_tp_mult': 2.9419572274394756, 'bull_tsl_mult': 0.37438567075454937, 'bull_time_stop': 240, 'bull_use_sma': True, 'bull_use_ema': False, 'bull_use_atr': False, 'bull_use_adx': True, 'bull_use_spike': False, 'bull_rsi_required': True, 'bear_strategy': 'mean_reversion', 'bear_bb_std_mult': 2.544180045753719, 'bear_rsi_os': 6, 'bear_rsi_ob': 85, 'bear_adx_thresh': 29.772474587826686, 'bear_atr_min_pct': 0.02441004172961891, 'bear_atr_max_pct': 0.04965061142308824, 'bear_tp_mult': 2.5194533398571965, 'bear_tsl_mult': 0.7019469623478312, 'bear_time_stop': 177, 'bear_use_sma': False, 'bear_use_ema': False, 'bear_use_atr': False, 'bear_use_adx': True, 'bear_use_spike': False, 'bear_rsi_required': False, 'sideways_strategy': 'mean_reversion', 'sideways_bb_std_mult': 3.4134498717075736, 'sideways_rsi_os': 45, 'sideways_rsi_ob': 88, 'sideways_adx_thresh': 6.8624286545176325, 'sideways_atr_min_pct': 0.018919091365241364, 'sideways_atr_max_pct': 0.13060241303590087, 'sideways_tp_mult': 1.246885477413368, 'sideways_tsl_mult': 0.00011721124860791798, 'sideways_time_stop': 125, 'sideways_use_sma': False, 'sideways_use_ema': False, 'sideways_use_atr': True, 'sideways_use_adx': False, 'sideways_use_spike': True, 'sideways_rsi_required': True}.
[I 2025-09-01 15:03:40,294] Trial 453 finished with values: [-1000000000.0, 1000000000.0] and parameters: {'p_sma': 31, 'p_std': 9, 'p_atr': 15, 'p_adx': 26, 'rsi_period': 73, 'ema1': 5, 'ema2': 51, 'slip_atr_k': 0.12661905256955228, 'slip_spread_k': 0.7533424713189592, 'spread_hl_frac': 0.04366021157817401, 'bb_std_mult': 1.537756847099703, 'rsi_os': 38, 'rsi_ob': 62, 'vol_spike': 0.2934816636599408, 'adx_thresh': 20.319537830157202, 'atr_min_pct': 0.00900889318329937, 'atr_max_pct': 0.07879884787585845, 'tp_mult': 2.998897484832911, 'tsl_mult': 0.925648291523288, 'strategy': 'breakout', 'time_stop': 84, 'use_sma': False, 'use_atr': True, 'use_adx': True, 'use_ema': False, 'use_spike': True, 'rsi_required': False, 'edge_k': 0.16595725849299092, 'edge_cap': 0.05325699401243608, 'bull_strategy': 'breakout', 'bull_bb_std_mult': 2.9011900689882664, 'bull_rsi_os': 20, 'bull_rsi_ob': 53, 'bull_adx_thresh': 34.15312444402864, 'bull_atr_min_pct': 0.024817119661153887, 'bull_atr_max_pct': 0.019438069970305276, 'bull_tp_mult': 1.9150588499672245, 'bull_tsl_mult': 0.9993470486186804, 'bull_time_stop': 92, 'bull_use_sma': True, 'bull_use_ema': False, 'bull_use_atr': False, 'bull_use_adx': True, 'bull_use_spike': False, 'bull_rsi_required': True, 'bear_strategy': 'mean_reversion', 'bear_bb_std_mult': 1.376799288041886, 'bear_rsi_os': 10, 'bear_rsi_ob': 63, 'bear_adx_thresh': 28.7162281837524, 'bear_atr_min_pct': 0.02440409123281347, 'bear_atr_max_pct': 0.050129396532689954, 'bear_tp_mult': 1.6869617141283793, 'bear_tsl_mult': 0.7028523422522085, 'bear_time_stop': 177, 'bear_use_sma': False, 'bear_use_ema': False, 'bear_use_atr': False, 'bear_use_adx': True, 'bear_use_spike': False, 'bear_rsi_required': False, 'sideways_strategy': 'mean_reversion', 'sideways_bb_std_mult': 3.433632547451219, 'sideways_rsi_os': 14, 'sideways_rsi_ob': 88, 'sideways_adx_thresh': 6.867205963757911, 'sideways_atr_min_pct': 0.018619415353497426, 'sideways_atr_max_pct': 0.14283956789515648, 'sideways_tp_mult': 1.7920634155884778, 'sideways_tsl_mult': 0.21770834640216613, 'sideways_time_stop': 84, 'sideways_use_sma': False, 'sideways_use_ema': False, 'sideways_use_atr': True, 'sideways_use_adx': False, 'sideways_use_spike': True, 'sideways_rsi_required': True}.
[I 2025-09-01 15:03:40,692] Trial 455 finished with values: [-1000000000.0, 1000000000.0] and parameters: {'p_sma': 10, 'p_std': 9, 'p_atr': 19, 'p_adx': 13, 'rsi_period': 18, 'ema1': 26, 'ema2': 30, 'slip_atr_k': 0.051363900691421806, 'slip_spread_k': 0.2038790209653413, 'spread_hl_frac': 0.04016495997031417, 'bb_std_mult': 1.5234073480060648, 'rsi_os': 53, 'rsi_ob': 57, 'vol_spike': 0.14381772358053177, 'adx_thresh': 28.14984517508748, 'atr_min_pct': 0.013767281161730044, 'atr_max_pct': 0.1408643038078778, 'tp_mult': 1.5863278123666733, 'tsl_mult': 0.11373475393554797, 'strategy': 'breakout', 'time_stop': 165, 'use_sma': False, 'use_atr': True, 'use_adx': True, 'use_ema': True, 'use_spike': True, 'rsi_required': False, 'edge_k': 0.16887777437499152, 'edge_cap': 0.05124418590075407, 'bull_strategy': 'breakout', 'bull_bb_std_mult': 3.521911580713355, 'bull_rsi_os': 40, 'bull_rsi_ob': 57, 'bull_adx_thresh': 18.9737779246935, 'bull_atr_min_pct': 0.008881094189100857, 'bull_atr_max_pct': 0.10451749245020617, 'bull_tp_mult': 1.9314926457602932, 'bull_tsl_mult': 0.4891269183094465, 'bull_time_stop': 170, 'bull_use_sma': True, 'bull_use_ema': False, 'bull_use_atr': False, 'bull_use_adx': True, 'bull_use_spike': False, 'bull_rsi_required': False, 'bear_strategy': 'mean_reversion', 'bear_bb_std_mult': 2.6625570222259354, 'bear_rsi_os': 10, 'bear_rsi_ob': 77, 'bear_adx_thresh': 29.398764742543154, 'bear_atr_min_pct': 0.019378203142807086, 'bear_atr_max_pct': 0.10943673133710569, 'bear_tp_mult': 2.4686401472637325, 'bear_tsl_mult': 0.6303130560144522, 'bear_time_stop': 300, 'bear_use_sma': False, 'bear_use_ema': False, 'bear_use_atr': False, 'bear_use_adx': True, 'bear_use_spike': False, 'bear_rsi_required': False, 'sideways_strategy': 'mean_reversion', 'sideways_bb_std_mult': 3.470769580937969, 'sideways_rsi_os': 15, 'sideways_rsi_ob': 88, 'sideways_adx_thresh': 6.926029020038853, 'sideways_atr_min_pct': 0.005268438316045254, 'sideways_atr_max_pct': 0.0833554369018604, 'sideways_tp_mult': 1.8307814571116878, 'sideways_tsl_mult': 0.9256778125014096, 'sideways_time_stop': 280, 'sideways_use_sma': False, 'sideways_use_ema': False, 'sideways_use_atr': True, 'sideways_use_adx': False, 'sideways_use_spike': True, 'sideways_rsi_required': True}.
[I 2025-09-01 15:04:23,548] Trial 459 finished with values: [-0.013651701404952976, 0.014245444807439125] and parameters: {'p_sma': 16, 'p_std': 10, 'p_atr': 21, 'p_adx': 24, 'rsi_period': 61, 'ema1': 17, 'ema2': 54, 'slip_atr_k': 0.07285915898819877, 'slip_spread_k': 0.525339404189635, 'spread_hl_frac': 0.014684156425262421, 'bb_std_mult': 1.7262229139389702, 'rsi_os': 5, 'rsi_ob': 87, 'vol_spike': 0.2813932815564806, 'adx_thresh': 19.871446946161427, 'atr_min_pct': 0.01727907500563123, 'atr_max_pct': 0.10758908147494337, 'tp_mult': 2.3486366766078444, 'tsl_mult': 0.06091650355984094, 'strategy': 'mean_reversion', 'time_stop': 66, 'use_sma': False, 'use_atr': False, 'use_adx': True, 'use_ema': True, 'use_spike': True, 'rsi_required': True, 'edge_k': 0.5173727525071516, 'edge_cap': 0.08088984883164611, 'bull_strategy': 'breakout', 'bull_bb_std_mult': 2.8257081614115944, 'bull_rsi_os': 31, 'bull_rsi_ob': 77, 'bull_adx_thresh': 11.27283485427541, 'bull_atr_min_pct': 0.0031443216589789095, 'bull_atr_max_pct': 0.021817522079476168, 'bull_tp_mult': 2.0669736032360415, 'bull_tsl_mult': 0.09598832254023931, 'bull_time_stop': 6, 'bull_use_sma': False, 'bull_use_ema': True, 'bull_use_atr': True, 'bull_use_adx': False, 'bull_use_spike': True, 'bull_rsi_required': False, 'bear_strategy': 'breakout', 'bear_bb_std_mult': 1.0242242173042517, 'bear_rsi_os': 21, 'bear_rsi_ob': 76, 'bear_adx_thresh': 27.854226966659706, 'bear_atr_min_pct': 0.0224359415398197, 'bear_atr_max_pct': 0.10526164021774415, 'bear_tp_mult': 1.0648731636840956, 'bear_tsl_mult': 0.45646565383624915, 'bear_time_stop': 282, 'bear_use_sma': True, 'bear_use_ema': False, 'bear_use_atr': True, 'bear_use_adx': True, 'bear_use_spike': True, 'bear_rsi_required': True, 'sideways_strategy': 'breakout', 'sideways_bb_std_mult': 1.4302204103491598, 'sideways_rsi_os': 25, 'sideways_rsi_ob': 87, 'sideways_adx_thresh': 31.07772752760528, 'sideways_atr_min_pct': 0.008336631951952628, 'sideways_atr_max_pct': 0.1367190400231643, 'sideways_tp_mult': 1.8256847245613468, 'sideways_tsl_mult': 0.7663950368746315, 'sideways_time_stop': 117, 'sideways_use_sma': True, 'sideways_use_ema': False, 'sideways_use_atr': False, 'sideways_use_adx': True, 'sideways_use_spike': False, 'sideways_rsi_required': False}.
[I 2025-09-01 15:04:23,979] Trial 458 finished with values: [-1000000000.0, 1000000000.0] and parameters: {'p_sma': 11, 'p_std': 9, 'p_atr': 19, 'p_adx': 24, 'rsi_period': 69, 'ema1': 29, 'ema2': 54, 'slip_atr_k': 0.04982446130198812, 'slip_spread_k': 0.20391409268844668, 'spread_hl_frac': 0.01446167120517253, 'bb_std_mult': 1.4508491545251134, 'rsi_os': 28, 'rsi_ob': 73, 'vol_spike': 0.28081352602007154, 'adx_thresh': 11.977629095838005, 'atr_min_pct': 0.02416351698104857, 'atr_max_pct': 0.10893842694620712, 'tp_mult': 2.753493070670442, 'tsl_mult': 0.6902991497211353, 'strategy': 'mean_reversion', 'time_stop': 67, 'use_sma': False, 'use_atr': False, 'use_adx': True, 'use_ema': True, 'use_spike': True, 'rsi_required': True, 'edge_k': 0.5128456804353476, 'edge_cap': 0.5291132286073936, 'bull_strategy': 'breakout', 'bull_bb_std_mult': 2.8297010614522784, 'bull_rsi_os': 18, 'bull_rsi_ob': 47, 'bull_adx_thresh': 19.293834770924455, 'bull_atr_min_pct': 0.013708283488707262, 'bull_atr_max_pct': 0.028057991694969323, 'bull_tp_mult': 2.04345787366884, 'bull_tsl_mult': 0.8472548947825873, 'bull_time_stop': 173, 'bull_use_sma': False, 'bull_use_ema': True, 'bull_use_atr': True, 'bull_use_adx': False, 'bull_use_spike': False, 'bull_rsi_required': False, 'bear_strategy': 'breakout', 'bear_bb_std_mult': 3.399251232676252, 'bear_rsi_os': 20, 'bear_rsi_ob': 54, 'bear_adx_thresh': 27.708046798588484, 'bear_atr_min_pct': 0.02261873836653555, 'bear_atr_max_pct': 0.1248923525654755, 'bear_tp_mult': 2.5788541176897857, 'bear_tsl_mult': 0.8446503508100505, 'bear_time_stop': 295, 'bear_use_sma': True, 'bear_use_ema': False, 'bear_use_atr': True, 'bear_use_adx': True, 'bear_use_spike': True, 'bear_rsi_required': True, 'sideways_strategy': 'breakout', 'sideways_bb_std_mult': 1.1456203938366913, 'sideways_rsi_os': 17, 'sideways_rsi_ob': 87, 'sideways_adx_thresh': 28.273259793416663, 'sideways_atr_min_pct': 0.015921571424693224, 'sideways_atr_max_pct': 0.08415120069209908, 'sideways_tp_mult': 1.8370533124699508, 'sideways_tsl_mult': 0.3439202018792076, 'sideways_time_stop': 151, 'sideways_use_sma': True, 'sideways_use_ema': False, 'sideways_use_atr': False, 'sideways_use_adx': True, 'sideways_use_spike': True, 'sideways_rsi_required': False}.
[I 2025-09-01 15:04:24,298] Trial 457 finished with values: [-0.021034353904057057, 0.020930231940801805] and parameters: {'p_sma': 50, 'p_std': 9, 'p_atr': 19, 'p_adx': 15, 'rsi_period': 61, 'ema1': 25, 'ema2': 54, 'slip_atr_k': 0.01395420496981295, 'slip_spread_k': 0.2004122895686456, 'spread_hl_frac': 0.014230983489284879, 'bb_std_mult': 3.1992840277561028, 'rsi_os': 34, 'rsi_ob': 90, 'vol_spike': 0.28134696750167887, 'adx_thresh': 19.71162943117138, 'atr_min_pct': 0.007362089180460726, 'atr_max_pct': 0.10922650275024404, 'tp_mult': 1.3981009527009056, 'tsl_mult': 0.05740454449497799, 'strategy': 'mean_reversion', 'time_stop': 85, 'use_sma': False, 'use_atr': False, 'use_adx': True, 'use_ema': True, 'use_spike': True, 'rsi_required': True, 'edge_k': 0.5221392041181476, 'edge_cap': 0.08129883688518458, 'bull_strategy': 'breakout', 'bull_bb_std_mult': 2.82280195824477, 'bull_rsi_os': 15, 'bull_rsi_ob': 53, 'bull_adx_thresh': 10.93056945283161, 'bull_atr_min_pct': 0.003153809579684053, 'bull_atr_max_pct': 0.022076535326900695, 'bull_tp_mult': 1.6751300877172444, 'bull_tsl_mult': 0.3629176020299246, 'bull_time_stop': 92, 'bull_use_sma': False, 'bull_use_ema': True, 'bull_use_atr': True, 'bull_use_adx': False, 'bull_use_spike': False, 'bull_rsi_required': False, 'bear_strategy': 'mean_reversion', 'bear_bb_std_mult': 1.022474133398272, 'bear_rsi_os': 10, 'bear_rsi_ob': 76, 'bear_adx_thresh': 34.362124431016646, 'bear_atr_min_pct': 0.022803868347848488, 'bear_atr_max_pct': 0.10765423492136857, 'bear_tp_mult': 2.3960451236060445, 'bear_tsl_mult': 0.12317274061023997, 'bear_time_stop': 294, 'bear_use_sma': False, 'bear_use_ema': False, 'bear_use_atr': True, 'bear_use_adx': True, 'bear_use_spike': True, 'bear_rsi_required': False, 'sideways_strategy': 'breakout', 'sideways_bb_std_mult': 2.11056511689778, 'sideways_rsi_os': 17, 'sideways_rsi_ob': 87, 'sideways_adx_thresh': 28.30813837031439, 'sideways_atr_min_pct': 0.0084774534037006, 'sideways_atr_max_pct': 0.05263381511613004, 'sideways_tp_mult': 2.721015047406467, 'sideways_tsl_mult': 0.21733186566646917, 'sideways_time_stop': 16, 'sideways_use_sma': True, 'sideways_use_ema': False, 'sideways_use_atr': False, 'sideways_use_adx': False, 'sideways_use_spike': True, 'sideways_rsi_required': False}.
