[I 2025-09-01 15:00:09,792] Trial 431 finished with values: [-1000000000.0, 1000000000.0] and parameters: {'p_sma': 10, 'p_std': 38, 'p_atr': 30, 'p_adx': 23, 'rsi_period': 70, 'ema1': 30, 'ema2': 52, 'slip_atr_k': 0.08852403741364465, 'slip_spread_k': 0.20879288875800225, 'spread_hl_frac': 0.006460778233335417, 'bb_std_mult': 2.8542499903495195, 'rsi_os': 22, 'rsi_ob': 54, 'vol_spike': 0.23913496065752216, 'adx_thresh': 20.61248829509164, 'atr_min_pct': 0.014519524286227957, 'atr_max_pct': 0.061347543154617566, 'tp_mult': 1.329742763989786, 'tsl_mult': 0.6625655624941139, 'strategy': 'mean_reversion', 'time_stop': 79, 'use_sma': True, 'use_atr': True, 'use_adx': False, 'use_ema': False, 'use_spike': False, 'rsi_required': False, 'edge_k': 0.30135514268551855, 'edge_cap': 0.3187324277131596, 'bull_strategy': 'breakout', 'bull_bb_std_mult': 0.9235863402613458, 'bull_rsi_os': 28, 'bull_rsi_ob': 93, 'bull_adx_thresh': 24.079812873088358, 'bull_atr_min_pct': 0.0027082698623012748, 'bull_atr_max_pct': 0.12378627798055661, 'bull_tp_mult': 2.190095163688107, 'bull_tsl_mult': 0.4119497124846159, 'bull_time_stop': 155, 'bull_use_sma': True, 'bull_use_ema': False, 'bull_use_atr': False, 'bull_use_adx': True, 'bull_use_spike': True, 'bull_rsi_required': True, 'bear_strategy': 'breakout', 'bear_bb_std_mult': 2.364906161082878, 'bear_rsi_os': 8, 'bear_rsi_ob': 47, 'bear_adx_thresh': 28.236239075902656, 'bear_atr_min_pct': 0.021633286211788776, 'bear_atr_max_pct': 0.11785877588196875, 'bear_tp_mult': 1.3284779455398201, 'bear_tsl_mult': 0.7322318321293891, 'bear_time_stop': 278, 'bear_use_sma': True, 'bear_use_ema': False, 'bear_use_atr': False, 'bear_use_adx': True, 'bear_use_spike': False, 'bear_rsi_required': True, 'sideways_strategy': 'mean_reversion', 'sideways_bb_std_mult': 1.8679805452381324, 'sideways_rsi_os': 28, 'sideways_rsi_ob': 47, 'sideways_adx_thresh': 6.423402054145658, 'sideways_atr_min_pct': 0.005675725721189786, 'sideways_atr_max_pct': 0.12920046348028505, 'sideways_tp_mult': 1.3268967818094444, 'sideways_tsl_mult': 0.804709403925215, 'sideways_time_stop': 50, 'sideways_use_sma': False, 'sideways_use_ema': False, 'sideways_use_atr': True, 'sideways_use_adx': False, 'sideways_use_spike': False, 'sideways_rsi_required': True}.
[I 2025-09-01 15:00:10,336] Trial 432 finished with values: [-0.01366375271134479, 0.01358002318366405] and parameters: {'p_sma': 36, 'p_std': 31, 'p_atr': 20, 'p_adx': 30, 'rsi_period': 70, 'ema1': 30, 'ema2': 52, 'slip_atr_k': 0.027753570325160362, 'slip_spread_k': 0.20895751519613565, 'spread_hl_frac': 0.035766480250013825, 'bb_std_mult': 1.4637727328129648, 'rsi_os': 35, 'rsi_ob': 69, 'vol_spike': 0.07393361109264013, 'adx_thresh': 19.768080578445808, 'atr_min_pct': 0.0038701096949504844, 'atr_max_pct': 0.06948116600829404, 'tp_mult': 2.1941094609124825, 'tsl_mult': 0.023129628121972612, 'strategy': 'mean_reversion', 'time_stop': 64, 'use_sma': True, 'use_atr': True, 'use_adx': True, 'use_ema': False, 'use_spike': True, 'rsi_required': False, 'edge_k': 1.9798519199758249, 'edge_cap': 0.1176623459891906, 'bull_strategy': 'breakout', 'bull_bb_std_mult': 2.866157510864883, 'bull_rsi_os': 12, 'bull_rsi_ob': 64, 'bull_adx_thresh': 7.925385609251917, 'bull_atr_min_pct': 0.0026482854934239634, 'bull_atr_max_pct': 0.12709277491214976, 'bull_tp_mult': 2.559707327846494, 'bull_tsl_mult': 0.5662381854543455, 'bull_time_stop': 214, 'bull_use_sma': False, 'bull_use_ema': False, 'bull_use_atr': False, 'bull_use_adx': True, 'bull_use_spike': False, 'bull_rsi_required': True, 'bear_strategy': 'breakout', 'bear_bb_std_mult': 3.1460784813470615, 'bear_rsi_os': 8, 'bear_rsi_ob': 86, 'bear_adx_thresh': 26.27172593163121, 'bear_atr_min_pct': 0.019315075010299658, 'bear_atr_max_pct': 0.02450173943174213, 'bear_tp_mult': 1.352117000439974, 'bear_tsl_mult': 0.6495403366586617, 'bear_time_stop': 34, 'bear_use_sma': True, 'bear_use_ema': False, 'bear_use_atr': True, 'bear_use_adx': True, 'bear_use_spike': True, 'bear_rsi_required': False, 'sideways_strategy': 'mean_reversion', 'sideways_bb_std_mult': 3.516228297549031, 'sideways_rsi_os': 14, 'sideways_rsi_ob': 90, 'sideways_adx_thresh': 8.856885213080345, 'sideways_atr_min_pct': 0.008850110574357233, 'sideways_atr_max_pct': 0.12896295605544172, 'sideways_tp_mult': 2.563223607562082, 'sideways_tsl_mult': 0.8290213914772636, 'sideways_time_stop': 121, 'sideways_use_sma': False, 'sideways_use_ema': False, 'sideways_use_atr': True, 'sideways_use_adx': False, 'sideways_use_spike': True, 'sideways_rsi_required': True}.
[I 2025-09-01 15:00:11,189] Trial 433 finished with values: [-0.05521930522123131, 0.055162244794834364] and parameters: {'p_sma': 36, 'p_std': 19, 'p_atr': 14, 'p_adx': 22, 'rsi_period': 62, 'ema1': 30, 'ema2': 52, 'slip_atr_k': 0.051169443447017425, 'slip_spread_k': 0.01699167542405222, 'spread_hl_frac': 0.014208082078647492, 'bb_std_mult': 2.842161254676097, 'rsi_os': 49, 'rsi_ob': 77, 'vol_spike': 0.008151441717443003, 'adx_thresh': 19.756344365016812, 'atr_min_pct': 0.014897911890611057, 'atr_max_pct': 0.1327524146734127, 'tp_mult': 1.8875878010514207, 'tsl_mult': 0.5121040673482377, 'strategy': 'mean_reversion', 'time_stop': 79, 'use_sma': True, 'use_atr': False, 'use_adx': True, 'use_ema': False, 'use_spike': True, 'rsi_required': True, 'edge_k': 1.97733983849033, 'edge_cap': 0.07147885582694091, 'bull_strategy': 'breakout', 'bull_bb_std_mult': 1.8738113173904916, 'bull_rsi_os': 12, 'bull_rsi_ob': 64, 'bull_adx_thresh': 10.448473290805563, 'bull_atr_min_pct': 0.0004949110813378646, 'bull_atr_max_pct': 0.021452954530137607, 'bull_tp_mult': 2.1502071614052936, 'bull_tsl_mult': 0.33695364844412645, 'bull_time_stop': 179, 'bull_use_sma': False, 'bull_use_ema': True, 'bull_use_atr': True, 'bull_use_adx': True, 'bull_use_spike': False, 'bull_rsi_required': True, 'bear_strategy': 'breakout', 'bear_bb_std_mult': 2.6968348276217378, 'bear_rsi_os': 8, 'bear_rsi_ob': 75, 'bear_adx_thresh': 26.279629611302273, 'bear_atr_min_pct': 0.021810298278848818, 'bear_atr_max_pct': 0.021665688575254055, 'bear_tp_mult': 1.3535929499669492, 'bear_tsl_mult': 0.9828536526476674, 'bear_time_stop': 11, 'bear_use_sma': True, 'bear_use_ema': False, 'bear_use_atr': True, 'bear_use_adx': True, 'bear_use_spike': True, 'bear_rsi_required': False, 'sideways_strategy': 'breakout', 'sideways_bb_std_mult': 0.90891018812816, 'sideways_rsi_os': 28, 'sideways_rsi_ob': 90, 'sideways_adx_thresh': 12.69437496223082, 'sideways_atr_min_pct': 0.00047873475279521654, 'sideways_atr_max_pct': 0.12719139272216093, 'sideways_tp_mult': 1.917017111970673, 'sideways_tsl_mult': 0.2855186399871127, 'sideways_time_stop': 142, 'sideways_use_sma': True, 'sideways_use_ema': False, 'sideways_use_atr': False, 'sideways_use_adx': False, 'sideways_use_spike': True, 'sideways_rsi_required': True}.
[I 2025-09-01 15:00:11,318] Trial 435 finished with values: [-1000000000.0, 1000000000.0] and parameters: {'p_sma': 18, 'p_std': 55, 'p_atr': 7, 'p_adx': 30, 'rsi_period': 37, 'ema1': 29, 'ema2': 51, 'slip_atr_k': 0.028993442460783933, 'slip_spread_k': 0.14091308704018224, 'spread_hl_frac': 0.006734877414479687, 'bb_std_mult': 1.4754522819415985, 'rsi_os': 11, 'rsi_ob': 69, 'vol_spike': 0.29990968238330373, 'adx_thresh': 23.28196795783627, 'atr_min_pct': 0.027637696492153717, 'atr_max_pct': 0.1354683094442159, 'tp_mult': 2.970496372438901, 'tsl_mult': 0.04370972879413737, 'strategy': 'breakout', 'time_stop': 71, 'use_sma': False, 'use_atr': True, 'use_adx': True, 'use_ema': False, 'use_spike': True, 'rsi_required': False, 'edge_k': 0.5538974500096396, 'edge_cap': 0.07092022706763812, 'bull_strategy': 'breakout', 'bull_bb_std_mult': 3.01366563418333, 'bull_rsi_os': 29, 'bull_rsi_ob': 93, 'bull_adx_thresh': 7.416684660703202, 'bull_atr_min_pct': 0.006215999262173158, 'bull_atr_max_pct': 0.1288836871721656, 'bull_tp_mult': 1.3154009981202501, 'bull_tsl_mult': 0.3407363209035822, 'bull_time_stop': 286, 'bull_use_sma': True, 'bull_use_ema': False, 'bull_use_atr': False, 'bull_use_adx': True, 'bull_use_spike': False, 'bull_rsi_required': True, 'bear_strategy': 'breakout', 'bear_bb_std_mult': 2.6989558877018456, 'bear_rsi_os': 8, 'bear_rsi_ob': 93, 'bear_adx_thresh': 29.828880779139336, 'bear_atr_min_pct': 0.023724463567473097, 'bear_atr_max_pct': 0.11374181174265284, 'bear_tp_mult': 2.938780622813011, 'bear_tsl_mult': 0.38870397466079487, 'bear_time_stop': 290, 'bear_use_sma': True, 'bear_use_ema': False, 'bear_use_atr': False, 'bear_use_adx': True, 'bear_use_spike': False, 'bear_rsi_required': False, 'sideways_strategy': 'mean_reversion', 'sideways_bb_std_mult': 2.5998178769239444, 'sideways_rsi_os': 13, 'sideways_rsi_ob': 47, 'sideways_adx_thresh': 27.316164394716, 'sideways_atr_min_pct': 0.005757873387642609, 'sideways_atr_max_pct': 0.12703070515725798, 'sideways_tp_mult': 1.9155740257202376, 'sideways_tsl_mult': 0.8629856109553273, 'sideways_time_stop': 122, 'sideways_use_sma': False, 'sideways_use_ema': False, 'sideways_use_atr': True, 'sideways_use_adx': False, 'sideways_use_spike': True, 'sideways_rsi_required': True}.
[I 2025-09-01 15:00:52,648] Trial 438 finished with values: [-1000000000.0, 1000000000.0] and parameters: {'p_sma': 60, 'p_std': 11, 'p_atr': 22, 'p_adx': 25, 'rsi_period': 65, 'ema1': 30, 'ema2': 53, 'slip_atr_k': 0.059144903662357036, 'slip_spread_k': 0.17670017539016908, 'spread_hl_frac': 0.0356874816764371, 'bb_std_mult': 0.6661008158324635, 'rsi_os': 36, 'rsi_ob': 92, 'vol_spike': 0.28585186025717807, 'adx_thresh': 19.52771170447555, 'atr_min_pct': 0.018093582853125276, 'atr_max_pct': 0.06470814165636889, 'tp_mult': 2.1727485516945957, 'tsl_mult': 0.9989597689625325, 'strategy': 'breakout', 'time_stop': 61, 'use_sma': False, 'use_atr': True, 'use_adx': True, 'use_ema': False, 'use_spike': True, 'rsi_required': False, 'edge_k': 0.4479837456999667, 'edge_cap': 0.5861743091772968, 'bull_strategy': 'breakout', 'bull_bb_std_mult': 1.3082595257073493, 'bull_rsi_os': 17, 'bull_rsi_ob': 49, 'bull_adx_thresh': 29.729361631390496, 'bull_atr_min_pct': 0.022153591982521106, 'bull_atr_max_pct': 0.060548418055097884, 'bull_tp_mult': 1.781093990207111, 'bull_tsl_mult': 0.3717891646031626, 'bull_time_stop': 262, 'bull_use_sma': True, 'bull_use_ema': False, 'bull_use_atr': False, 'bull_use_adx': False, 'bull_use_spike': False, 'bull_rsi_required': True, 'bear_strategy': 'mean_reversion', 'bear_bb_std_mult': 2.9392603659538103, 'bear_rsi_os': 6, 'bear_rsi_ob': 74, 'bear_adx_thresh': 27.821824914440125, 'bear_atr_min_pct': 0.015968590673594376, 'bear_atr_max_pct': 0.10932017538107829, 'bear_tp_mult': 1.8299410658595472, 'bear_tsl_mult': 0.7874782706250332, 'bear_time_stop': 142, 'bear_use_sma': False, 'bear_use_ema': False, 'bear_use_atr': False, 'bear_use_adx': True, 'bear_use_spike': False, 'bear_rsi_required': False, 'sideways_strategy': 'mean_reversion', 'sideways_bb_std_mult': 2.2334093815325358, 'sideways_rsi_os': 21, 'sideways_rsi_ob': 49, 'sideways_adx_thresh': 7.111958837837082, 'sideways_atr_min_pct': 0.009007321147111513, 'sideways_atr_max_pct': 0.1395659174875513, 'sideways_tp_mult': 1.813493286238067, 'sideways_tsl_mult': 0.1633143496267237, 'sideways_time_stop': 100, 'sideways_use_sma': False, 'sideways_use_ema': False, 'sideways_use_atr': True, 'sideways_use_adx': False, 'sideways_use_spike': True, 'sideways_rsi_required': True}.
[I 2025-09-01 15:00:52,674] Trial 439 finished with values: [-1000000000.0, 1000000000.0] and parameters: {'p_sma': 47, 'p_std': 10, 'p_atr': 22, 'p_adx': 25, 'rsi_period': 65, 'ema1': 30, 'ema2': 51, 'slip_atr_k': 0.07955186188664029, 'slip_spread_k': 0.17068800165895986, 'spread_hl_frac': 0.01701149784893407, 'bb_std_mult': 1.3636947325563242, 'rsi_os': 36, 'rsi_ob': 65, 'vol_spike': 0.280127796779632, 'adx_thresh': 24.111857854146116, 'atr_min_pct': 0.000832545481607043, 'atr_max_pct': 0.08031036114933594, 'tp_mult': 2.401474918343603, 'tsl_mult': 0.9824632007781868, 'strategy': 'breakout', 'time_stop': 63, 'use_sma': False, 'use_atr': True, 'use_adx': True, 'use_ema': False, 'use_spike': True, 'rsi_required': False, 'edge_k': 1.1457280389023583, 'edge_cap': 0.9149967668644715, 'bull_strategy': 'breakout', 'bull_bb_std_mult': 2.890778057493169, 'bull_rsi_os': 17, 'bull_rsi_ob': 71, 'bull_adx_thresh': 9.468550785219406, 'bull_atr_min_pct': 0.009938550744710683, 'bull_atr_max_pct': 0.09684025058394191, 'bull_tp_mult': 2.4403136026354435, 'bull_tsl_mult': 0.8179200781835001, 'bull_time_stop': 257, 'bull_use_sma': True, 'bull_use_ema': False, 'bull_use_atr': False, 'bull_use_adx': False, 'bull_use_spike': False, 'bull_rsi_required': True, 'bear_strategy': 'mean_reversion', 'bear_bb_std_mult': 2.788002959197873, 'bear_rsi_os': 16, 'bear_rsi_ob': 74, 'bear_adx_thresh': 14.017671120038809, 'bear_atr_min_pct': 0.02546284146667617, 'bear_atr_max_pct': 0.11031516030167673, 'bear_tp_mult': 2.5258547080659164, 'bear_tsl_mult': 0.7892512837125012, 'bear_time_stop': 100, 'bear_use_sma': False, 'bear_use_ema': False, 'bear_use_atr': False, 'bear_use_adx': True, 'bear_use_spike': False, 'bear_rsi_required': False, 'sideways_strategy': 'mean_reversion', 'sideways_bb_std_mult': 3.305224696804439, 'sideways_rsi_os': 21, 'sideways_rsi_ob': 88, 'sideways_adx_thresh': 7.262574337637011, 'sideways_atr_min_pct': 0.002946201657682832, 'sideways_atr_max_pct': 0.02795561248334269, 'sideways_tp_mult': 1.816572015782669, 'sideways_tsl_mult': 0.8262325292799989, 'sideways_time_stop': 100, 'sideways_use_sma': False, 'sideways_use_ema': False, 'sideways_use_atr': True, 'sideways_use_adx': False, 'sideways_use_spike': True, 'sideways_rsi_required': True}.
[I 2025-09-01 15:00:53,318] Trial 437 finished with values: [-0.21202639425110914, 0.2119084405133705] and parameters: {'p_sma': 45, 'p_std': 55, 'p_atr': 22, 'p_adx': 25, 'rsi_period': 62, 'ema1': 29, 'ema2': 51, 'slip_atr_k': 0.07959679154550166, 'slip_spread_k': 0.8587410165844986, 'spread_hl_frac': 0.017122808846839376, 'bb_std_mult': 3.1019881096497897, 'rsi_os': 9, 'rsi_ob': 74, 'vol_spike': 0.08863805140534356, 'adx_thresh': 19.968401244320045, 'atr_min_pct': 0.012136895304247112, 'atr_max_pct': 0.06744857519124459, 'tp_mult': 2.2249644283108427, 'tsl_mult': 0.08351382381475932, 'strategy': 'breakout', 'time_stop': 62, 'use_sma': False, 'use_atr': False, 'use_adx': True, 'use_ema': False, 'use_spike': True, 'rsi_required': True, 'edge_k': 0.439808786143551, 'edge_cap': 0.06918628404602167, 'bull_strategy': 'breakout', 'bull_bb_std_mult': 1.3187891420755602, 'bull_rsi_os': 17, 'bull_rsi_ob': 49, 'bull_adx_thresh': 9.62926225042373, 'bull_atr_min_pct': 0.006036525951245906, 'bull_atr_max_pct': 0.06013886850394384, 'bull_tp_mult': 2.144271254027615, 'bull_tsl_mult': 0.34205399938050374, 'bull_time_stop': 217, 'bull_use_sma': False, 'bull_use_ema': True, 'bull_use_atr': True, 'bull_use_adx': True, 'bull_use_spike': False, 'bull_rsi_required': True, 'bear_strategy': 'mean_reversion', 'bear_bb_std_mult': 3.5954155545331075, 'bear_rsi_os': 8, 'bear_rsi_ob': 52, 'bear_adx_thresh': 27.29459270452578, 'bear_atr_min_pct': 0.023627050705567802, 'bear_atr_max_pct': 0.0765288518615669, 'bear_tp_mult': 2.4468782200969654, 'bear_tsl_mult': 0.05897382093831349, 'bear_time_stop': 289, 'bear_use_sma': False, 'bear_use_ema': False, 'bear_use_atr': True, 'bear_use_adx': True, 'bear_use_spike': True, 'bear_rsi_required': False, 'sideways_strategy': 'breakout', 'sideways_bb_std_mult': 1.2537013565294544, 'sideways_rsi_os': 14, 'sideways_rsi_ob': 54, 'sideways_adx_thresh': 7.575046736992836, 'sideways_atr_min_pct': 2.065381574128944e-06, 'sideways_atr_max_pct': 0.028475365404238354, 'sideways_tp_mult': 1.9200534928764714, 'sideways_tsl_mult': 0.16598107126847556, 'sideways_time_stop': 122, 'sideways_use_sma': True, 'sideways_use_ema': False, 'sideways_use_atr': True, 'sideways_use_adx': False, 'sideways_use_spike': True, 'sideways_rsi_required': True}.
[I 2025-09-01 15:00:53,600] Trial 436 finished with values: [-1000000000.0, 1000000000.0] and parameters: {'p_sma': 20, 'p_std': 11, 'p_atr': 13, 'p_adx': 30, 'rsi_period': 62, 'ema1': 29, 'ema2': 31, 'slip_atr_k': 0.03473791471515697, 'slip_spread_k': 0.024121210041352648, 'spread_hl_frac': 0.017881873091863898, 'bb_std_mult': 1.4641955795831907, 'rsi_os': 9, 'rsi_ob': 77, 'vol_spike': 0.29984330174299656, 'adx_thresh': 24.173774306609804, 'atr_min_pct': 0.004828867775476893, 'atr_max_pct': 0.07526121015304285, 'tp_mult': 2.9715768565691043, 'tsl_mult': 0.3621583187322113, 'strategy': 'breakout', 'time_stop': 70, 'use_sma': False, 'use_atr': False, 'use_adx': True, 'use_ema': False, 'use_spike': True, 'rsi_required': True, 'edge_k': 0.552708596171796, 'edge_cap': 0.07054604697357103, 'bull_strategy': 'breakout', 'bull_bb_std_mult': 1.5998910774220305, 'bull_rsi_os': 8, 'bull_rsi_ob': 45, 'bull_adx_thresh': 26.104553034565345, 'bull_atr_min_pct': 0.006245941211389428, 'bull_atr_max_pct': 0.07416821582245928, 'bull_tp_mult': 1.7813242754359118, 'bull_tsl_mult': 0.34196698605034026, 'bull_time_stop': 260, 'bull_use_sma': False, 'bull_use_ema': True, 'bull_use_atr': True, 'bull_use_adx': True, 'bull_use_spike': False, 'bull_rsi_required': True, 'bear_strategy': 'mean_reversion', 'bear_bb_std_mult': 2.717157190213758, 'bear_rsi_os': 8, 'bear_rsi_ob': 86, 'bear_adx_thresh': 27.302503637247177, 'bear_atr_min_pct': 0.023644829289353318, 'bear_atr_max_pct': 0.14443291457810634, 'bear_tp_mult': 1.2050832420771498, 'bear_tsl_mult': 0.7851446100673555, 'bear_time_stop': 144, 'bear_use_sma': False, 'bear_use_ema': False, 'bear_use_atr': True, 'bear_use_adx': True, 'bear_use_spike': True, 'bear_rsi_required': False, 'sideways_strategy': 'breakout', 'sideways_bb_std_mult': 1.0323295432681219, 'sideways_rsi_os': 34, 'sideways_rsi_ob': 54, 'sideways_adx_thresh': 33.219153176098544, 'sideways_atr_min_pct': 0.005551926674561667, 'sideways_atr_max_pct': 0.04189075187530027, 'sideways_tp_mult': 1.9149263382118136, 'sideways_tsl_mult': 0.3173017662853812, 'sideways_time_stop': 141, 'sideways_use_sma': True, 'sideways_use_ema': False, 'sideways_use_atr': True, 'sideways_use_adx': False, 'sideways_use_spike': True, 'sideways_rsi_required': True}.
[I 2025-09-01 15:01:31,995] Trial 442 finished with values: [-1000000000.0, 1000000000.0] and parameters: {'p_sma': 14, 'p_std': 31, 'p_atr': 18, 'p_adx': 24, 'rsi_period': 42, 'ema1': 30, 'ema2': 52, 'slip_atr_k': 0.04628082519377735, 'slip_spread_k': 0.2221326970801132, 'spread_hl_frac': 0.041750668523412415, 'bb_std_mult': 1.5209347559453832, 'rsi_os': 35, 'rsi_ob': 71, 'vol_spike': 0.29178428886799773, 'adx_thresh': 22.259382669458045, 'atr_min_pct': 0.015576161112187074, 'atr_max_pct': 0.10194084597839553, 'tp_mult': 2.8420887807688002, 'tsl_mult': 0.061394744932746166, 'strategy': 'breakout', 'time_stop': 45, 'use_sma': False, 'use_atr': True, 'use_adx': True, 'use_ema': True, 'use_spike': True, 'rsi_required': False, 'edge_k': 1.4946187003581912, 'edge_cap': 0.09268637994265995, 'bull_strategy': 'mean_reversion', 'bull_bb_std_mult': 3.215096667921669, 'bull_rsi_os': 18, 'bull_rsi_ob': 51, 'bull_adx_thresh': 20.300496256591703, 'bull_atr_min_pct': 0.016865123193867952, 'bull_atr_max_pct': 0.017409479060523977, 'bull_tp_mult': 2.0213976264664115, 'bull_tsl_mult': 0.3680837440927122, 'bull_time_stop': 31, 'bull_use_sma': True, 'bull_use_ema': False, 'bull_use_atr': False, 'bull_use_adx': True, 'bull_use_spike': False, 'bull_rsi_required': False, 'bear_strategy': 'mean_reversion', 'bear_bb_std_mult': 0.5014230927157683, 'bear_rsi_os': 25, 'bear_rsi_ob': 76, 'bear_adx_thresh': 28.801076732507532, 'bear_atr_min_pct': 0.024659050353557074, 'bear_atr_max_pct': 0.039231458575572524, 'bear_tp_mult': 2.002328195389632, 'bear_tsl_mult': 0.5979234455045209, 'bear_time_stop': 33, 'bear_use_sma': False, 'bear_use_ema': False, 'bear_use_atr': False, 'bear_use_adx': False, 'bear_use_spike': False, 'bear_rsi_required': False, 'sideways_strategy': 'mean_reversion', 'sideways_bb_std_mult': 1.6803252034483895, 'sideways_rsi_os': 48, 'sideways_rsi_ob': 88, 'sideways_adx_thresh': 7.785304097754721, 'sideways_atr_min_pct': 0.004459811698701732, 'sideways_atr_max_pct': 0.13493471311969746, 'sideways_tp_mult': 2.8629667409496067, 'sideways_tsl_mult': 0.10476545934897225, 'sideways_time_stop': 112, 'sideways_use_sma': False, 'sideways_use_ema': True, 'sideways_use_atr': False, 'sideways_use_adx': True, 'sideways_use_spike': True, 'sideways_rsi_required': False}.
