[I 2025-09-01 13:55:04,987] Trial 9 finished with values: [-1000000000.0, 1000000000.0] and parameters: {'p_sma': 7, 'p_std': 23, 'p_atr': 27, 'p_adx': 15, 'rsi_period': 71, 'ema1': 11, 'ema2': 18, 'slip_atr_k': 0.0645258822206902, 'slip_spread_k': 0.14426116561546154, 'spread_hl_frac': 0.024723063646547624, 'bb_std_mult': 2.052554518198542, 'rsi_os': 22, 'rsi_ob': 84, 'vol_spike': 0.1613891097300336, 'adx_thresh': 29.02100272678067, 'atr_min_pct': 0.0016199697559873937, 'atr_max_pct': 0.04844393385808808, 'tp_mult': 2.6240457087684144, 'tsl_mult': 0.49255334395442707, 'strategy': 'breakout', 'time_stop': 250, 'use_sma': True, 'use_atr': True, 'use_adx': True, 'use_ema': False, 'use_spike': False, 'rsi_required': False, 'edge_k': 1.5681161181149883, 'edge_cap': 0.3329492737679866, 'bull_strategy': 'breakout', 'bull_bb_std_mult': 1.5930338132730186, 'bull_rsi_os': 7, 'bull_rsi_ob': 73, 'bull_adx_thresh': 31.41064304914579, 'bull_atr_min_pct': 0.017091539867579546, 'bull_atr_max_pct': 0.03288925408587474, 'bull_tp_mult': 2.9137145401579065, 'bull_tsl_mult': 0.6835950523393759, 'bull_time_stop': 177, 'bull_use_sma': True, 'bull_use_ema': False, 'bull_use_atr': False, 'bull_use_adx': True, 'bull_use_spike': True, 'bull_rsi_required': False, 'bear_strategy': 'mean_reversion', 'bear_bb_std_mult': 1.0776720019590793, 'bear_rsi_os': 18, 'bear_rsi_ob': 63, 'bear_adx_thresh': 9.685964728129319, 'bear_atr_min_pct': 0.00301891165261809, 'bear_atr_max_pct': 0.08510087023413485, 'bear_tp_mult': 2.2126641861111445, 'bear_tsl_mult': 0.6490452347164617, 'bear_time_stop': 241, 'bear_use_sma': False, 'bear_use_ema': False, 'bear_use_atr': False, 'bear_use_adx': False, 'bear_use_spike': True, 'bear_rsi_required': True, 'sideways_strategy': 'mean_reversion', 'sideways_bb_std_mult': 1.447788103144139, 'sideways_rsi_os': 15, 'sideways_rsi_ob': 94, 'sideways_adx_thresh': 19.431733924203208, 'sideways_atr_min_pct': 0.018770629720239584, 'sideways_atr_max_pct': 0.13592321871551738, 'sideways_tp_mult': 1.957640669619397, 'sideways_tsl_mult': 0.890468144882537, 'sideways_time_stop': 71, 'sideways_use_sma': False, 'sideways_use_ema': False, 'sideways_use_atr': True, 'sideways_use_adx': True, 'sideways_use_spike': True, 'sideways_rsi_required': False}.
[I 2025-09-01 13:55:05,278] Trial 5 finished with values: [-1000000000.0, 1000000000.0] and parameters: {'p_sma': 33, 'p_std': 32, 'p_atr': 9, 'p_adx': 10, 'rsi_period': 21, 'ema1': 8, 'ema2': 44, 'slip_atr_k': 0.13200635336603464, 'slip_spread_k': 0.020666234339632994, 'spread_hl_frac': 0.02404113257440705, 'bb_std_mult': 0.5586750259806993, 'rsi_os': 32, 'rsi_ob': 91, 'vol_spike': 0.10318134405560421, 'adx_thresh': 29.358237520203357, 'atr_min_pct': 0.010859934848436248, 'atr_max_pct': 0.12477400238160247, 'tp_mult': 2.7095902300030907, 'tsl_mult': 0.11191094204664909, 'strategy': 'breakout', 'time_stop': 181, 'use_sma': False, 'use_atr': False, 'use_adx': False, 'use_ema': True, 'use_spike': True, 'rsi_required': False, 'edge_k': 1.3304598772823804, 'edge_cap': 0.9116726192612458, 'bull_strategy': 'breakout', 'bull_bb_std_mult': 2.663557280859716, 'bull_rsi_os': 53, 'bull_rsi_ob': 80, 'bull_adx_thresh': 24.891275898441577, 'bull_atr_min_pct': 0.016041505733479244, 'bull_atr_max_pct': 0.0582463805913825, 'bull_tp_mult': 1.112459529986566, 'bull_tsl_mult': 0.619261995639119, 'bull_time_stop': 238, 'bull_use_sma': True, 'bull_use_ema': True, 'bull_use_atr': True, 'bull_use_adx': False, 'bull_use_spike': False, 'bull_rsi_required': False, 'bear_strategy': 'breakout', 'bear_bb_std_mult': 2.603542215507063, 'bear_rsi_os': 26, 'bear_rsi_ob': 82, 'bear_adx_thresh': 28.73296793375738, 'bear_atr_min_pct': 0.0011171885585201412, 'bear_atr_max_pct': 0.13503361093276403, 'bear_tp_mult': 2.1161921564848574, 'bear_tsl_mult': 0.15024710004329445, 'bear_time_stop': 140, 'bear_use_sma': True, 'bear_use_ema': True, 'bear_use_atr': True, 'bear_use_adx': True, 'bear_use_spike': True, 'bear_rsi_required': True, 'sideways_strategy': 'breakout', 'sideways_bb_std_mult': 2.2979976437319958, 'sideways_rsi_os': 14, 'sideways_rsi_ob': 63, 'sideways_adx_thresh': 27.471495413510205, 'sideways_atr_min_pct': 0.013197093397760247, 'sideways_atr_max_pct': 0.046127300183413815, 'sideways_tp_mult': 1.9877050245143921, 'sideways_tsl_mult': 0.04370078309631653, 'sideways_time_stop': 249, 'sideways_use_sma': False, 'sideways_use_ema': True, 'sideways_use_atr': True, 'sideways_use_adx': True, 'sideways_use_spike': True, 'sideways_rsi_required': False}.
[I 2025-09-01 13:55:05,447] Trial 13 finished with values: [-1000000000.0, 1000000000.0] and parameters: {'p_sma': 16, 'p_std': 40, 'p_atr': 23, 'p_adx': 23, 'rsi_period': 9, 'ema1': 25, 'ema2': 46, 'slip_atr_k': 0.01686762131577449, 'slip_spread_k': 0.031880981282889964, 'spread_hl_frac': 0.01618561079933039, 'bb_std_mult': 0.769436691865136, 'rsi_os': 55, 'rsi_ob': 95, 'vol_spike': 0.2124856926660369, 'adx_thresh': 5.495940303049942, 'atr_min_pct': 0.018929836649143047, 'atr_max_pct': 0.14941303613390391, 'tp_mult': 1.1186540798723785, 'tsl_mult': 0.6466044741083707, 'strategy': 'mean_reversion', 'time_stop': 5, 'use_sma': True, 'use_atr': False, 'use_adx': True, 'use_ema': False, 'use_spike': False, 'rsi_required': False, 'edge_k': 1.1180204343769673, 'edge_cap': 0.706710692196058, 'bull_strategy': 'mean_reversion', 'bull_bb_std_mult': 0.6929246062970884, 'bull_rsi_os': 41, 'bull_rsi_ob': 46, 'bull_adx_thresh': 6.189816191042189, 'bull_atr_min_pct': 0.010762948477402508, 'bull_atr_max_pct': 0.10971283568180358, 'bull_tp_mult': 2.396922476951465, 'bull_tsl_mult': 0.9953408861653062, 'bull_time_stop': 290, 'bull_use_sma': True, 'bull_use_ema': False, 'bull_use_atr': True, 'bull_use_adx': True, 'bull_use_spike': True, 'bull_rsi_required': False, 'bear_strategy': 'breakout', 'bear_bb_std_mult': 3.5963845717567806, 'bear_rsi_os': 49, 'bear_rsi_ob': 45, 'bear_adx_thresh': 5.213217428626647, 'bear_atr_min_pct': 0.02904898490481978, 'bear_atr_max_pct': 0.09974780533654762, 'bear_tp_mult': 2.990998015928815, 'bear_tsl_mult': 0.12864933285158836, 'bear_time_stop': 287, 'bear_use_sma': True, 'bear_use_ema': True, 'bear_use_atr': True, 'bear_use_adx': False, 'bear_use_spike': False, 'bear_rsi_required': False, 'sideways_strategy': 'mean_reversion', 'sideways_bb_std_mult': 2.635127193948894, 'sideways_rsi_os': 55, 'sideways_rsi_ob': 85, 'sideways_adx_thresh': 26.940290933095255, 'sideways_atr_min_pct': 0.00636389367763125, 'sideways_atr_max_pct': 0.014579385881853521, 'sideways_tp_mult': 2.895839621642005, 'sideways_tsl_mult': 0.42397899159675156, 'sideways_time_stop': 137, 'sideways_use_sma': True, 'sideways_use_ema': True, 'sideways_use_atr': False, 'sideways_use_adx': True, 'sideways_use_spike': False, 'sideways_rsi_required': True}.
[I 2025-09-01 13:55:05,590] Trial 14 finished with values: [-1000000000.0, 1000000000.0] and parameters: {'p_sma': 19, 'p_std': 6, 'p_atr': 22, 'p_adx': 17, 'rsi_period': 47, 'ema1': 30, 'ema2': 10, 'slip_atr_k': 0.015718841918303708, 'slip_spread_k': 0.9926355651658283, 'spread_hl_frac': 0.04915485628359157, 'bb_std_mult': 0.6520340301524132, 'rsi_os': 52, 'rsi_ob': 62, 'vol_spike': 0.2089211340148463, 'adx_thresh': 34.99910989554532, 'atr_min_pct': 0.020660882334753397, 'atr_max_pct': 0.14371768506825786, 'tp_mult': 1.0362224453382485, 'tsl_mult': 0.019365552453533108, 'strategy': 'mean_reversion', 'time_stop': 10, 'use_sma': False, 'use_atr': False, 'use_adx': False, 'use_ema': True, 'use_spike': False, 'rsi_required': False, 'edge_k': 0.9181451660613429, 'edge_cap': 0.6873652852879926, 'bull_strategy': 'mean_reversion', 'bull_bb_std_mult': 0.5130925353392448, 'bull_rsi_os': 40, 'bull_rsi_ob': 47, 'bull_adx_thresh': 5.249123377106017, 'bull_atr_min_pct': 0.023289632064671204, 'bull_atr_max_pct': 0.14513493345939255, 'bull_tp_mult': 2.361362731887464, 'bull_tsl_mult': 0.9979865232045926, 'bull_time_stop': 8, 'bull_use_sma': True, 'bull_use_ema': False, 'bull_use_atr': False, 'bull_use_adx': False, 'bull_use_spike': True, 'bull_rsi_required': False, 'bear_strategy': 'mean_reversion', 'bear_bb_std_mult': 1.6342997310593437, 'bear_rsi_os': 55, 'bear_rsi_ob': 51, 'bear_adx_thresh': 34.707501703034545, 'bear_atr_min_pct': 0.029928871222494116, 'bear_atr_max_pct': 0.07198573441618211, 'bear_tp_mult': 2.99725796482265, 'bear_tsl_mult': 0.058271918600996286, 'bear_time_stop': 10, 'bear_use_sma': True, 'bear_use_ema': True, 'bear_use_atr': True, 'bear_use_adx': True, 'bear_use_spike': False, 'bear_rsi_required': False, 'sideways_strategy': 'mean_reversion', 'sideways_bb_std_mult': 2.89816179402103, 'sideways_rsi_os': 50, 'sideways_rsi_ob': 45, 'sideways_adx_thresh': 26.646039824238034, 'sideways_atr_min_pct': 0.028815729070085883, 'sideways_atr_max_pct': 0.019181317150479667, 'sideways_tp_mult': 2.9446872775900736, 'sideways_tsl_mult': 0.31666882445312383, 'sideways_time_stop': 147, 'sideways_use_sma': True, 'sideways_use_ema': True, 'sideways_use_atr': False, 'sideways_use_adx': False, 'sideways_use_spike': False, 'sideways_rsi_required': True}.
[I 2025-09-01 13:55:05,710] Trial 15 finished with values: [-1000000000.0, 1000000000.0] and parameters: {'p_sma': 60, 'p_std': 5, 'p_atr': 13, 'p_adx': 16, 'rsi_period': 48, 'ema1': 30, 'ema2': 11, 'slip_atr_k': 0.010913412831262431, 'slip_spread_k': 0.8872562732995959, 'spread_hl_frac': 0.04991788226562977, 'bb_std_mult': 1.3946217229432563, 'rsi_os': 51, 'rsi_ob': 63, 'vol_spike': 0.20696940250241574, 'adx_thresh': 33.8127772691616, 'atr_min_pct': 0.028791596673801913, 'atr_max_pct': 0.09986798380197236, 'tp_mult': 1.0523569133098043, 'tsl_mult': 0.0189146423459029, 'strategy': 'mean_reversion', 'time_stop': 236, 'use_sma': False, 'use_atr': True, 'use_adx': False, 'use_ema': True, 'use_spike': False, 'rsi_required': False, 'edge_k': 0.6912498610840176, 'edge_cap': 0.056514211281947835, 'bull_strategy': 'mean_reversion', 'bull_bb_std_mult': 0.6932003873406258, 'bull_rsi_os': 38, 'bull_rsi_ob': 93, 'bull_adx_thresh': 19.671437955093946, 'bull_atr_min_pct': 0.02399665614507976, 'bull_atr_max_pct': 0.14618178700814569, 'bull_tp_mult': 2.9201816393205906, 'bull_tsl_mult': 0.35895492878615154, 'bull_time_stop': 20, 'bull_use_sma': True, 'bull_use_ema': False, 'bull_use_atr': False, 'bull_use_adx': False, 'bull_use_spike': True, 'bull_rsi_required': False, 'bear_strategy': 'mean_reversion', 'bear_bb_std_mult': 1.5835032138803766, 'bear_rsi_os': 5, 'bear_rsi_ob': 45, 'bear_adx_thresh': 15.870545799336089, 'bear_atr_min_pct': 0.013433650450188208, 'bear_atr_max_pct': 0.05738355012722845, 'bear_tp_mult': 2.8780294330137846, 'bear_tsl_mult': 0.9914269314974544, 'bear_time_stop': 6, 'bear_use_sma': False, 'bear_use_ema': True, 'bear_use_atr': True, 'bear_use_adx': True, 'bear_use_spike': False, 'bear_rsi_required': False, 'sideways_strategy': 'mean_reversion', 'sideways_bb_std_mult': 1.6479525543800402, 'sideways_rsi_os': 54, 'sideways_rsi_ob': 45, 'sideways_adx_thresh': 5.084148561824819, 'sideways_atr_min_pct': 0.028459825523180514, 'sideways_atr_max_pct': 0.023193514069594016, 'sideways_tp_mult': 2.8293613174256143, 'sideways_tsl_mult': 0.24991061274973542, 'sideways_time_stop': 171, 'sideways_use_sma': True, 'sideways_use_ema': True, 'sideways_use_atr': False, 'sideways_use_adx': False, 'sideways_use_spike': False, 'sideways_rsi_required': True}.
[I 2025-09-01 13:55:43,692] Trial 12 finished with values: [-1000000000.0, 1000000000.0] and parameters: {'p_sma': 30, 'p_std': 16, 'p_atr': 28, 'p_adx': 18, 'rsi_period': 82, 'ema1': 29, 'ema2': 56, 'slip_atr_k': 0.18389530437616713, 'slip_spread_k': 0.7068025665239324, 'spread_hl_frac': 0.033567842037673615, 'bb_std_mult': 1.5458180064252862, 'rsi_os': 39, 'rsi_ob': 61, 'vol_spike': 0.2644022895319683, 'adx_thresh': 20.215518700230447, 'atr_min_pct': 0.01633716894062167, 'atr_max_pct': 0.07096480653711841, 'tp_mult': 2.515805962061807, 'tsl_mult': 0.9389909706134981, 'strategy': 'breakout', 'time_stop': 28, 'use_sma': True, 'use_atr': True, 'use_adx': False, 'use_ema': True, 'use_spike': True, 'rsi_required': False, 'edge_k': 1.70054360542581, 'edge_cap': 0.6583553511071858, 'bull_strategy': 'breakout', 'bull_bb_std_mult': 2.0212810972551907, 'bull_rsi_os': 51, 'bull_rsi_ob': 84, 'bull_adx_thresh': 22.455096473926545, 'bull_atr_min_pct': 0.010728519288609, 'bull_atr_max_pct': 0.10175657901807315, 'bull_tp_mult': 2.3027485031399353, 'bull_tsl_mult': 0.9245726840104336, 'bull_time_stop': 97, 'bull_use_sma': False, 'bull_use_ema': False, 'bull_use_atr': True, 'bull_use_adx': False, 'bull_use_spike': False, 'bull_rsi_required': False, 'bear_strategy': 'mean_reversion', 'bear_bb_std_mult': 2.4937489206329055, 'bear_rsi_os': 40, 'bear_rsi_ob': 83, 'bear_adx_thresh': 23.94205347116952, 'bear_atr_min_pct': 0.0030448690450647553, 'bear_atr_max_pct': 0.0900152725260147, 'bear_tp_mult': 1.286438183329333, 'bear_tsl_mult': 0.38571343880852027, 'bear_time_stop': 227, 'bear_use_sma': False, 'bear_use_ema': True, 'bear_use_atr': True, 'bear_use_adx': False, 'bear_use_spike': True, 'bear_rsi_required': False, 'sideways_strategy': 'breakout', 'sideways_bb_std_mult': 2.368042587168098, 'sideways_rsi_os': 50, 'sideways_rsi_ob': 68, 'sideways_adx_thresh': 7.332083609618505, 'sideways_atr_min_pct': 0.02632340754066742, 'sideways_atr_max_pct': 0.05863514869668426, 'sideways_tp_mult': 2.547861457284763, 'sideways_tsl_mult': 0.23546845241335668, 'sideways_time_stop': 230, 'sideways_use_sma': True, 'sideways_use_ema': False, 'sideways_use_atr': False, 'sideways_use_adx': True, 'sideways_use_spike': True, 'sideways_rsi_required': True}.
[I 2025-09-01 13:55:44,349] Trial 11 finished with values: [-1000000000.0, 1000000000.0] and parameters: {'p_sma': 58, 'p_std': 47, 'p_atr': 10, 'p_adx': 8, 'rsi_period': 79, 'ema1': 17, 'ema2': 57, 'slip_atr_k': 0.08626643140070614, 'slip_spread_k': 0.9377799703513009, 'spread_hl_frac': 0.002300625216339131, 'bb_std_mult': 1.9138122463677876, 'rsi_os': 55, 'rsi_ob': 52, 'vol_spike': 0.09288308102116732, 'adx_thresh': 10.949935568587506, 'atr_min_pct': 0.004028982704658803, 'atr_max_pct': 0.07901558183592307, 'tp_mult': 1.2389639808505641, 'tsl_mult': 0.10413584974473011, 'strategy': 'breakout', 'time_stop': 250, 'use_sma': True, 'use_atr': False, 'use_adx': False, 'use_ema': True, 'use_spike': True, 'rsi_required': True, 'edge_k': 0.6197270162981681, 'edge_cap': 0.9377558093230024, 'bull_strategy': 'breakout', 'bull_bb_std_mult': 3.5676690310139487, 'bull_rsi_os': 54, 'bull_rsi_ob': 81, 'bull_adx_thresh': 22.91851642810244, 'bull_atr_min_pct': 0.010575152121294838, 'bull_atr_max_pct': 0.06771893688940063, 'bull_tp_mult': 2.692478106399112, 'bull_tsl_mult': 0.9435224809624039, 'bull_time_stop': 295, 'bull_use_sma': False, 'bull_use_ema': False, 'bull_use_atr': False, 'bull_use_adx': True, 'bull_use_spike': False, 'bull_rsi_required': False, 'bear_strategy': 'mean_reversion', 'bear_bb_std_mult': 3.236747389006122, 'bear_rsi_os': 25, 'bear_rsi_ob': 61, 'bear_adx_thresh': 18.049815538699153, 'bear_atr_min_pct': 0.025610608623317203, 'bear_atr_max_pct': 0.07882094502956094, 'bear_tp_mult': 1.8374727583279902, 'bear_tsl_mult': 0.38652429514946074, 'bear_time_stop': 178, 'bear_use_sma': True, 'bear_use_ema': False, 'bear_use_atr': True, 'bear_use_adx': True, 'bear_use_spike': False, 'bear_rsi_required': True, 'sideways_strategy': 'mean_reversion', 'sideways_bb_std_mult': 3.503418525015461, 'sideways_rsi_os': 30, 'sideways_rsi_ob': 66, 'sideways_adx_thresh': 28.94000324260709, 'sideways_atr_min_pct': 0.006041987322593812, 'sideways_atr_max_pct': 0.0105058016887803, 'sideways_tp_mult': 1.8534307195995205, 'sideways_tsl_mult': 0.07116828053806301, 'sideways_time_stop': 208, 'sideways_use_sma': True, 'sideways_use_ema': True, 'sideways_use_atr': True, 'sideways_use_adx': False, 'sideways_use_spike': True, 'sideways_rsi_required': True}.
[I 2025-09-01 13:55:45,495] Trial 16 finished with values: [-1000000000.0, 1000000000.0] and parameters: {'p_sma': 55, 'p_std': 57, 'p_atr': 14, 'p_adx': 12, 'rsi_period': 53, 'ema1': 21, 'ema2': 35, 'slip_atr_k': 0.1695881111291201, 'slip_spread_k': 0.8033703652594473, 'spread_hl_frac': 0.033765670202090696, 'bb_std_mult': 1.148405125934306, 'rsi_os': 16, 'rsi_ob': 83, 'vol_spike': 0.11014298566779002, 'adx_thresh': 18.034827557693482, 'atr_min_pct': 0.0286398667762877, 'atr_max_pct': 0.09386883101105081, 'tp_mult': 1.5245730091477983, 'tsl_mult': 0.9970020491083482, 'strategy': 'mean_reversion', 'time_stop': 240, 'use_sma': False, 'use_atr': True, 'use_adx': False, 'use_ema': True, 'use_spike': False, 'rsi_required': True, 'edge_k': 1.9712230331566745, 'edge_cap': 0.44137892386002575, 'bull_strategy': 'breakout', 'bull_bb_std_mult': 1.526378909864547, 'bull_rsi_os': 5, 'bull_rsi_ob': 95, 'bull_adx_thresh': 20.238256397319674, 'bull_atr_min_pct': 0.007400595802743967, 'bull_atr_max_pct': 0.09656805467627311, 'bull_tp_mult': 2.8542085667988615, 'bull_tsl_mult': 0.378163562207062, 'bull_time_stop': 62, 'bull_use_sma': False, 'bull_use_ema': False, 'bull_use_atr': False, 'bull_use_adx': False, 'bull_use_spike': True, 'bull_rsi_required': True, 'bear_strategy': 'mean_reversion', 'bear_bb_std_mult': 0.5419178362543131, 'bear_rsi_os': 9, 'bear_rsi_ob': 73, 'bear_adx_thresh': 34.61534393299444, 'bear_atr_min_pct': 0.013614141944107542, 'bear_atr_max_pct': 0.05073524401767962, 'bear_tp_mult': 2.632138900520663, 'bear_tsl_mult': 0.9555868385948589, 'bear_time_stop': 171, 'bear_use_sma': False, 'bear_use_ema': False, 'bear_use_atr': True, 'bear_use_adx': True, 'bear_use_spike': False, 'bear_rsi_required': False, 'sideways_strategy': 'breakout', 'sideways_bb_std_mult': 1.6164700138988246, 'sideways_rsi_os': 42, 'sideways_rsi_ob': 69, 'sideways_adx_thresh': 13.936375601886287, 'sideways_atr_min_pct': 0.029159532812122493, 'sideways_atr_max_pct': 0.09597188300228059, 'sideways_tp_mult': 2.5084670602268746, 'sideways_tsl_mult': 0.20528744734911852, 'sideways_time_stop': 199, 'sideways_use_sma': True, 'sideways_use_ema': True, 'sideways_use_atr': False, 'sideways_use_adx': False, 'sideways_use_spike': False, 'sideways_rsi_required': True}.
[I 2025-09-01 13:55:45,684] Trial 17 finished with values: [-1000000000.0, 1000000000.0] and parameters: {'p_sma': 59, 'p_std': 60, 'p_atr': 15, 'p_adx': 24, 'rsi_period': 59, 'ema1': 21, 'ema2': 34, 'slip_atr_k': 0.1781347435705133, 'slip_spread_k': 0.3132048373442461, 'spread_hl_frac': 0.0337491493209553, 'bb_std_mult': 1.331816187452704, 'rsi_os': 16, 'rsi_ob': 82, 'vol_spike': 0.09266399997662755, 'adx_thresh': 18.493465749805434, 'atr_min_pct': 0.015331017882578906, 'atr_max_pct': 0.10582350127893171, 'tp_mult': 1.4945970562560686, 'tsl_mult': 0.24927379154936646, 'strategy': 'breakout', 'time_stop': 115, 'use_sma': False, 'use_atr': False, 'use_adx': False, 'use_ema': False, 'use_spike': False, 'rsi_required': True, 'edge_k': 1.971415656088996, 'edge_cap': 0.4468035281577079, 'bull_strategy': 'breakout', 'bull_bb_std_mult': 1.5369918222770091, 'bull_rsi_os': 5, 'bull_rsi_ob': 56, 'bull_adx_thresh': 19.581677768668527, 'bull_atr_min_pct': 0.008080155439551043, 'bull_atr_max_pct': 0.0954911526554709, 'bull_tp_mult': 2.642710268021972, 'bull_tsl_mult': 0.08426250509687877, 'bull_time_stop': 72, 'bull_use_sma': False, 'bull_use_ema': True, 'bull_use_atr': True, 'bull_use_adx': True, 'bull_use_spike': False, 'bull_rsi_required': True, 'bear_strategy': 'breakout', 'bear_bb_std_mult': 0.588055812365174, 'bear_rsi_os': 5, 'bear_rsi_ob': 95, 'bear_adx_thresh': 34.370110471710646, 'bear_atr_min_pct': 0.02030452381474262, 'bear_atr_max_pct': 0.11238485222689587, 'bear_tp_mult': 2.6318622597680195, 'bear_tsl_mult': 0.3843606380029308, 'bear_time_stop': 285, 'bear_use_sma': False, 'bear_use_ema': False, 'bear_use_atr': True, 'bear_use_adx': False, 'bear_use_spike': True, 'bear_rsi_required': True, 'sideways_strategy': 'breakout', 'sideways_bb_std_mult': 1.8180877574751886, 'sideways_rsi_os': 41, 'sideways_rsi_ob': 71, 'sideways_adx_thresh': 17.018209311452082, 'sideways_atr_min_pct': 0.0012584745447117105, 'sideways_atr_max_pct': 0.1482838086285252, 'sideways_tp_mult': 2.545030114238782, 'sideways_tsl_mult': 0.5160478994846689, 'sideways_time_stop': 206, 'sideways_use_sma': True, 'sideways_use_ema': True, 'sideways_use_atr': True, 'sideways_use_adx': False, 'sideways_use_spike': False, 'sideways_rsi_required': True}.
