[I 2025-09-01 14:26:13,161] Trial 215 finished with values: [-1000000000.0, 1000000000.0] and parameters: {'p_sma': 10, 'p_std': 9, 'p_atr': 20, 'p_adx': 24, 'rsi_period': 64, 'ema1': 29, 'ema2': 52, 'slip_atr_k': 0.005326604918757499, 'slip_spread_k': 0.2334968524841161, 'spread_hl_frac': 0.03399667167390585, 'bb_std_mult': 1.8596060890257013, 'rsi_os': 37, 'rsi_ob': 86, 'vol_spike': 0.27354443063325207, 'adx_thresh': 19.525365319818913, 'atr_min_pct': 0.015216694280413131, 'atr_max_pct': 0.07970036703151337, 'tp_mult': 2.9088783914341314, 'tsl_mult': 0.0973280793339015, 'strategy': 'breakout', 'time_stop': 65, 'use_sma': False, 'use_atr': True, 'use_adx': True, 'use_ema': False, 'use_spike': True, 'rsi_required': False, 'edge_k': 0.3712958800007068, 'edge_cap': 0.11413473049099514, 'bull_strategy': 'breakout', 'bull_bb_std_mult': 3.1802766318999467, 'bull_rsi_os': 12, 'bull_rsi_ob': 48, 'bull_adx_thresh': 29.374323023208518, 'bull_atr_min_pct': 0.010077595170680582, 'bull_atr_max_pct': 0.019290700390410063, 'bull_tp_mult': 2.1331591474008134, 'bull_tsl_mult': 0.36427938145827465, 'bull_time_stop': 166, 'bull_use_sma': True, 'bull_use_ema': False, 'bull_use_atr': False, 'bull_use_adx': True, 'bull_use_spike': False, 'bull_rsi_required': True, 'bear_strategy': 'mean_reversion', 'bear_bb_std_mult': 2.561712228189508, 'bear_rsi_os': 26, 'bear_rsi_ob': 82, 'bear_adx_thresh': 29.4775227757722, 'bear_atr_min_pct': 0.024651130516975327, 'bear_atr_max_pct': 0.11052803347773042, 'bear_tp_mult': 1.6033468889210662, 'bear_tsl_mult': 0.6282494502105156, 'bear_time_stop': 31, 'bear_use_sma': False, 'bear_use_ema': False, 'bear_use_atr': False, 'bear_use_adx': True, 'bear_use_spike': False, 'bear_rsi_required': False, 'sideways_strategy': 'mean_reversion', 'sideways_bb_std_mult': 1.1036910040340375, 'sideways_rsi_os': 8, 'sideways_rsi_ob': 87, 'sideways_adx_thresh': 6.682327812287779, 'sideways_atr_min_pct': 0.016617727048009262, 'sideways_atr_max_pct': 0.14304478698181583, 'sideways_tp_mult': 2.557742025625152, 'sideways_tsl_mult': 0.30118289299081297, 'sideways_time_stop': 106, 'sideways_use_sma': False, 'sideways_use_ema': False, 'sideways_use_atr': True, 'sideways_use_adx': False, 'sideways_use_spike': True, 'sideways_rsi_required': True}.
[I 2025-09-01 14:26:13,997] Trial 217 finished with values: [-1000000000.0, 1000000000.0] and parameters: {'p_sma': 12, 'p_std': 9, 'p_atr': 18, 'p_adx': 7, 'rsi_period': 62, 'ema1': 12, 'ema2': 51, 'slip_atr_k': 0.01588938200070182, 'slip_spread_k': 0.267816898609517, 'spread_hl_frac': 0.04599483719754248, 'bb_std_mult': 1.5841972498211534, 'rsi_os': 34, 'rsi_ob': 72, 'vol_spike': 0.2732686575651778, 'adx_thresh': 19.581709075313416, 'atr_min_pct': 0.015021365573222974, 'atr_max_pct': 0.07789403587436565, 'tp_mult': 2.8666638708630003, 'tsl_mult': 0.09897009550252656, 'strategy': 'breakout', 'time_stop': 64, 'use_sma': True, 'use_atr': True, 'use_adx': False, 'use_ema': True, 'use_spike': True, 'rsi_required': False, 'edge_k': 0.5132608836291689, 'edge_cap': 0.07358596301688884, 'bull_strategy': 'breakout', 'bull_bb_std_mult': 2.644584156212968, 'bull_rsi_os': 16, 'bull_rsi_ob': 48, 'bull_adx_thresh': 20.779926462984125, 'bull_atr_min_pct': 0.008151696707739235, 'bull_atr_max_pct': 0.019481103805026656, 'bull_tp_mult': 2.107807743479909, 'bull_tsl_mult': 0.29290052291933233, 'bull_time_stop': 165, 'bull_use_sma': False, 'bull_use_ema': False, 'bull_use_atr': False, 'bull_use_adx': False, 'bull_use_spike': False, 'bull_rsi_required': True, 'bear_strategy': 'mean_reversion', 'bear_bb_std_mult': 2.580518014109219, 'bear_rsi_os': 25, 'bear_rsi_ob': 45, 'bear_adx_thresh': 27.09707458734151, 'bear_atr_min_pct': 0.024594119403561335, 'bear_atr_max_pct': 0.11838427965362446, 'bear_tp_mult': 2.4395986723654635, 'bear_tsl_mult': 0.6293776936803842, 'bear_time_stop': 287, 'bear_use_sma': False, 'bear_use_ema': True, 'bear_use_atr': False, 'bear_use_adx': True, 'bear_use_spike': False, 'bear_rsi_required': False, 'sideways_strategy': 'mean_reversion', 'sideways_bb_std_mult': 3.34265840556862, 'sideways_rsi_os': 17, 'sideways_rsi_ob': 66, 'sideways_adx_thresh': 5.769473859913653, 'sideways_atr_min_pct': 0.014498771047477934, 'sideways_atr_max_pct': 0.0474756300825614, 'sideways_tp_mult': 2.5480371855972357, 'sideways_tsl_mult': 0.839381562897729, 'sideways_time_stop': 103, 'sideways_use_sma': False, 'sideways_use_ema': True, 'sideways_use_atr': False, 'sideways_use_adx': False, 'sideways_use_spike': True, 'sideways_rsi_required': True}.
[I 2025-09-01 14:26:14,415] Trial 218 finished with values: [-1000000000.0, 1000000000.0] and parameters: {'p_sma': 10, 'p_std': 9, 'p_atr': 22, 'p_adx': 7, 'rsi_period': 62, 'ema1': 30, 'ema2': 52, 'slip_atr_k': 0.1390015608291367, 'slip_spread_k': 0.206797397079783, 'spread_hl_frac': 0.046217264263424686, 'bb_std_mult': 1.5867604121449166, 'rsi_os': 37, 'rsi_ob': 95, 'vol_spike': 0.27495594393171074, 'adx_thresh': 21.44714866957373, 'atr_min_pct': 0.015789321347320102, 'atr_max_pct': 0.0287114279066503, 'tp_mult': 2.8644052035581007, 'tsl_mult': 0.04500847533171675, 'strategy': 'breakout', 'time_stop': 63, 'use_sma': True, 'use_atr': True, 'use_adx': False, 'use_ema': True, 'use_spike': True, 'rsi_required': False, 'edge_k': 0.4745942165874386, 'edge_cap': 0.0740475239667601, 'bull_strategy': 'breakout', 'bull_bb_std_mult': 2.9286994772615844, 'bull_rsi_os': 16, 'bull_rsi_ob': 48, 'bull_adx_thresh': 25.173047633049215, 'bull_atr_min_pct': 0.02501371951980061, 'bull_atr_max_pct': 0.018404713334609156, 'bull_tp_mult': 2.992385793143071, 'bull_tsl_mult': 0.34686128234906066, 'bull_time_stop': 166, 'bull_use_sma': False, 'bull_use_ema': False, 'bull_use_atr': False, 'bull_use_adx': False, 'bull_use_spike': False, 'bull_rsi_required': True, 'bear_strategy': 'mean_reversion', 'bear_bb_std_mult': 2.5710484405217127, 'bear_rsi_os': 48, 'bear_rsi_ob': 75, 'bear_adx_thresh': 27.811808418462544, 'bear_atr_min_pct': 0.024093031170313584, 'bear_atr_max_pct': 0.11865851646969656, 'bear_tp_mult': 2.4461478340530407, 'bear_tsl_mult': 0.6350529311301586, 'bear_time_stop': 287, 'bear_use_sma': False, 'bear_use_ema': True, 'bear_use_atr': False, 'bear_use_adx': True, 'bear_use_spike': False, 'bear_rsi_required': False, 'sideways_strategy': 'mean_reversion', 'sideways_bb_std_mult': 3.4370859414379553, 'sideways_rsi_os': 31, 'sideways_rsi_ob': 73, 'sideways_adx_thresh': 6.189636138526939, 'sideways_atr_min_pct': 0.005052031258070738, 'sideways_atr_max_pct': 0.04845001382744356, 'sideways_tp_mult': 1.656809803606335, 'sideways_tsl_mult': 0.8307984984561307, 'sideways_time_stop': 103, 'sideways_use_sma': False, 'sideways_use_ema': True, 'sideways_use_atr': False, 'sideways_use_adx': False, 'sideways_use_spike': True, 'sideways_rsi_required': True}.
[I 2025-09-01 14:26:50,594] Trial 221 finished with values: [-1000000000.0, 1000000000.0] and parameters: {'p_sma': 13, 'p_std': 11, 'p_atr': 13, 'p_adx': 25, 'rsi_period': 66, 'ema1': 30, 'ema2': 14, 'slip_atr_k': 0.13737111431049437, 'slip_spread_k': 0.20527654889639246, 'spread_hl_frac': 0.01432788509255253, 'bb_std_mult': 1.4957329441212308, 'rsi_os': 43, 'rsi_ob': 90, 'vol_spike': 0.28572172567971527, 'adx_thresh': 13.690514797140885, 'atr_min_pct': 0.0164207069962393, 'atr_max_pct': 0.06671021126430948, 'tp_mult': 2.910680746527774, 'tsl_mult': 0.05056881774471178, 'strategy': 'breakout', 'time_stop': 85, 'use_sma': False, 'use_atr': True, 'use_adx': True, 'use_ema': False, 'use_spike': True, 'rsi_required': False, 'edge_k': 0.5236101053035667, 'edge_cap': 0.29137885214531645, 'bull_strategy': 'breakout', 'bull_bb_std_mult': 3.0403055480330483, 'bull_rsi_os': 23, 'bull_rsi_ob': 72, 'bull_adx_thresh': 34.7680657765211, 'bull_atr_min_pct': 0.020946013824608915, 'bull_atr_max_pct': 0.09330632937488481, 'bull_tp_mult': 1.9253901260781037, 'bull_tsl_mult': 0.3441829451788558, 'bull_time_stop': 146, 'bull_use_sma': True, 'bull_use_ema': False, 'bull_use_atr': False, 'bull_use_adx': True, 'bull_use_spike': False, 'bull_rsi_required': False, 'bear_strategy': 'mean_reversion', 'bear_bb_std_mult': 3.581416536093561, 'bear_rsi_os': 6, 'bear_rsi_ob': 76, 'bear_adx_thresh': 32.285344204249185, 'bear_atr_min_pct': 0.021663885602943713, 'bear_atr_max_pct': 0.08682463419030943, 'bear_tp_mult': 1.8668413489519118, 'bear_tsl_mult': 0.6439836292583222, 'bear_time_stop': 291, 'bear_use_sma': False, 'bear_use_ema': False, 'bear_use_atr': False, 'bear_use_adx': True, 'bear_use_spike': False, 'bear_rsi_required': False, 'sideways_strategy': 'mean_reversion', 'sideways_bb_std_mult': 0.5132733341090963, 'sideways_rsi_os': 33, 'sideways_rsi_ob': 86, 'sideways_adx_thresh': 8.067254216235826, 'sideways_atr_min_pct': 0.005025687133847617, 'sideways_atr_max_pct': 0.12662846317646373, 'sideways_tp_mult': 2.05630017510394, 'sideways_tsl_mult': 0.26371234118751646, 'sideways_time_stop': 124, 'sideways_use_sma': False, 'sideways_use_ema': False, 'sideways_use_atr': True, 'sideways_use_adx': False, 'sideways_use_spike': True, 'sideways_rsi_required': True}.
[I 2025-09-01 14:26:51,418] Trial 220 finished with values: [-1000000000.0, 1000000000.0] and parameters: {'p_sma': 13, 'p_std': 17, 'p_atr': 18, 'p_adx': 25, 'rsi_period': 66, 'ema1': 12, 'ema2': 51, 'slip_atr_k': 0.12507197976296316, 'slip_spread_k': 0.2604073015587142, 'spread_hl_frac': 0.015150818302144677, 'bb_std_mult': 1.5912860227705916, 'rsi_os': 45, 'rsi_ob': 95, 'vol_spike': 0.28215547445698086, 'adx_thresh': 21.34079944529535, 'atr_min_pct': 0.016092326440129614, 'atr_max_pct': 0.06643698738713114, 'tp_mult': 2.870701908649484, 'tsl_mult': 0.047548715435200326, 'strategy': 'breakout', 'time_stop': 62, 'use_sma': True, 'use_atr': True, 'use_adx': True, 'use_ema': False, 'use_spike': True, 'rsi_required': False, 'edge_k': 0.511475166663484, 'edge_cap': 0.07303859316890941, 'bull_strategy': 'breakout', 'bull_bb_std_mult': 2.5005976883688223, 'bull_rsi_os': 16, 'bull_rsi_ob': 64, 'bull_adx_thresh': 28.66084599033185, 'bull_atr_min_pct': 0.009413289538859148, 'bull_atr_max_pct': 0.023973930315267226, 'bull_tp_mult': 1.0108370003787805, 'bull_tsl_mult': 0.341757701573815, 'bull_time_stop': 151, 'bull_use_sma': True, 'bull_use_ema': False, 'bull_use_atr': False, 'bull_use_adx': True, 'bull_use_spike': False, 'bull_rsi_required': True, 'bear_strategy': 'mean_reversion', 'bear_bb_std_mult': 2.8604471374336358, 'bear_rsi_os': 31, 'bear_rsi_ob': 45, 'bear_adx_thresh': 32.355634827451695, 'bear_atr_min_pct': 0.008810331775176315, 'bear_atr_max_pct': 0.11658474070804631, 'bear_tp_mult': 1.1809783616483995, 'bear_tsl_mult': 0.6544957550862152, 'bear_time_stop': 288, 'bear_use_sma': False, 'bear_use_ema': False, 'bear_use_atr': False, 'bear_use_adx': True, 'bear_use_spike': False, 'bear_rsi_required': False, 'sideways_strategy': 'mean_reversion', 'sideways_bb_std_mult': 0.5583345081886169, 'sideways_rsi_os': 16, 'sideways_rsi_ob': 73, 'sideways_adx_thresh': 6.138915043901097, 'sideways_atr_min_pct': 0.015157154398872906, 'sideways_atr_max_pct': 0.13345760162058293, 'sideways_tp_mult': 2.6583088932817924, 'sideways_tsl_mult': 0.2662326087394511, 'sideways_time_stop': 255, 'sideways_use_sma': False, 'sideways_use_ema': False, 'sideways_use_atr': True, 'sideways_use_adx': False, 'sideways_use_spike': True, 'sideways_rsi_required': True}.
[I 2025-09-01 14:26:51,419] Trial 219 finished with values: [-1000000000.0, 1000000000.0] and parameters: {'p_sma': 13, 'p_std': 12, 'p_atr': 18, 'p_adx': 25, 'rsi_period': 66, 'ema1': 30, 'ema2': 51, 'slip_atr_k': 0.0149012135957199, 'slip_spread_k': 0.26449030653692673, 'spread_hl_frac': 0.01497343787565115, 'bb_std_mult': 1.586018637133886, 'rsi_os': 34, 'rsi_ob': 75, 'vol_spike': 0.28214962608390626, 'adx_thresh': 21.41270130611621, 'atr_min_pct': 0.016335440936157405, 'atr_max_pct': 0.06658994732213683, 'tp_mult': 2.8752978617786797, 'tsl_mult': 0.9617318601623556, 'strategy': 'breakout', 'time_stop': 279, 'use_sma': True, 'use_atr': True, 'use_adx': True, 'use_ema': False, 'use_spike': True, 'rsi_required': False, 'edge_k': 0.5253680157894017, 'edge_cap': 0.06897466658191337, 'bull_strategy': 'breakout', 'bull_bb_std_mult': 2.6864566072458804, 'bull_rsi_os': 16, 'bull_rsi_ob': 64, 'bull_adx_thresh': 9.982102797902769, 'bull_atr_min_pct': 0.024359988544825045, 'bull_atr_max_pct': 0.021854032953996655, 'bull_tp_mult': 1.9311962261352258, 'bull_tsl_mult': 0.3443996604018936, 'bull_time_stop': 149, 'bull_use_sma': True, 'bull_use_ema': False, 'bull_use_atr': False, 'bull_use_adx': True, 'bull_use_spike': False, 'bull_rsi_required': True, 'bear_strategy': 'mean_reversion', 'bear_bb_std_mult': 2.836051059686734, 'bear_rsi_os': 52, 'bear_rsi_ob': 76, 'bear_adx_thresh': 27.106347448167053, 'bear_atr_min_pct': 0.02190312077325224, 'bear_atr_max_pct': 0.08545036936517249, 'bear_tp_mult': 2.1927814346655907, 'bear_tsl_mult': 0.09412220239716834, 'bear_time_stop': 288, 'bear_use_sma': False, 'bear_use_ema': False, 'bear_use_atr': False, 'bear_use_adx': True, 'bear_use_spike': False, 'bear_rsi_required': False, 'sideways_strategy': 'mean_reversion', 'sideways_bb_std_mult': 3.2927991320243395, 'sideways_rsi_os': 15, 'sideways_rsi_ob': 76, 'sideways_adx_thresh': 8.015569949093452, 'sideways_atr_min_pct': 0.004970598999088698, 'sideways_atr_max_pct': 0.13222865493024788, 'sideways_tp_mult': 2.923509181452083, 'sideways_tsl_mult': 0.992176367007889, 'sideways_time_stop': 125, 'sideways_use_sma': False, 'sideways_use_ema': False, 'sideways_use_atr': True, 'sideways_use_adx': False, 'sideways_use_spike': True, 'sideways_rsi_required': True}.
[I 2025-09-01 14:26:51,855] Trial 222 finished with values: [-1000000000.0, 1000000000.0] and parameters: {'p_sma': 13, 'p_std': 18, 'p_atr': 17, 'p_adx': 25, 'rsi_period': 66, 'ema1': 28, 'ema2': 17, 'slip_atr_k': 0.09445137074178142, 'slip_spread_k': 0.2674442913714547, 'spread_hl_frac': 0.015671182619245393, 'bb_std_mult': 1.489994921670626, 'rsi_os': 45, 'rsi_ob': 75, 'vol_spike': 0.1526432397540764, 'adx_thresh': 13.915075576478479, 'atr_min_pct': 0.01631848282582462, 'atr_max_pct': 0.07536766098575191, 'tp_mult': 2.998161220229834, 'tsl_mult': 0.954868880067537, 'strategy': 'breakout', 'time_stop': 87, 'use_sma': False, 'use_atr': True, 'use_adx': True, 'use_ema': False, 'use_spike': True, 'rsi_required': False, 'edge_k': 0.5294911760902027, 'edge_cap': 0.09612798993943153, 'bull_strategy': 'breakout', 'bull_bb_std_mult': 3.0226047982992807, 'bull_rsi_os': 43, 'bull_rsi_ob': 49, 'bull_adx_thresh': 9.920395145867955, 'bull_atr_min_pct': 0.025936197896488437, 'bull_atr_max_pct': 0.02264974475731562, 'bull_tp_mult': 2.0266080047904422, 'bull_tsl_mult': 0.3436191720773357, 'bull_time_stop': 148, 'bull_use_sma': True, 'bull_use_ema': False, 'bull_use_atr': False, 'bull_use_adx': True, 'bull_use_spike': False, 'bull_rsi_required': False, 'bear_strategy': 'mean_reversion', 'bear_bb_std_mult': 3.5762683032702185, 'bear_rsi_os': 52, 'bear_rsi_ob': 77, 'bear_adx_thresh': 28.010123601804796, 'bear_atr_min_pct': 0.021803129232590954, 'bear_atr_max_pct': 0.08259825023660636, 'bear_tp_mult': 1.084218345098933, 'bear_tsl_mult': 0.09814125900313281, 'bear_time_stop': 11, 'bear_use_sma': False, 'bear_use_ema': False, 'bear_use_atr': False, 'bear_use_adx': True, 'bear_use_spike': False, 'bear_rsi_required': False, 'sideways_strategy': 'mean_reversion', 'sideways_bb_std_mult': 0.5338530916126887, 'sideways_rsi_os': 33, 'sideways_rsi_ob': 92, 'sideways_adx_thresh': 29.18102361640345, 'sideways_atr_min_pct': 0.005645669860223876, 'sideways_atr_max_pct': 0.053163641924720575, 'sideways_tp_mult': 2.0521845936760905, 'sideways_tsl_mult': 0.9948041058569642, 'sideways_time_stop': 230, 'sideways_use_sma': False, 'sideways_use_ema': False, 'sideways_use_atr': True, 'sideways_use_adx': False, 'sideways_use_spike': True, 'sideways_rsi_required': True}.
[I 2025-09-01 14:27:27,876] Trial 223 finished with values: [-1000000000.0, 1000000000.0] and parameters: {'p_sma': 12, 'p_std': 6, 'p_atr': 21, 'p_adx': 16, 'rsi_period': 83, 'ema1': 28, 'ema2': 19, 'slip_atr_k': 0.08060042683132893, 'slip_spread_k': 0.26219528979834505, 'spread_hl_frac': 0.015016265756326662, 'bb_std_mult': 1.4105256114975637, 'rsi_os': 7, 'rsi_ob': 48, 'vol_spike': 0.2928168542906181, 'adx_thresh': 18.567333753597286, 'atr_min_pct': 0.028771160145537246, 'atr_max_pct': 0.07533779659859208, 'tp_mult': 2.995661660165506, 'tsl_mult': 0.9246818053933663, 'strategy': 'breakout', 'time_stop': 47, 'use_sma': False, 'use_atr': True, 'use_adx': True, 'use_ema': False, 'use_spike': True, 'rsi_required': False, 'edge_k': 0.575994700671219, 'edge_cap': 0.09624673478977826, 'bull_strategy': 'breakout', 'bull_bb_std_mult': 2.4674294831269266, 'bull_rsi_os': 44, 'bull_rsi_ob': 64, 'bull_adx_thresh': 28.38215896517662, 'bull_atr_min_pct': 0.009493345285434765, 'bull_atr_max_pct': 0.022909604634139866, 'bull_tp_mult': 2.0344444608122476, 'bull_tsl_mult': 0.39142665937127685, 'bull_time_stop': 151, 'bull_use_sma': True, 'bull_use_ema': False, 'bull_use_atr': False, 'bull_use_adx': True, 'bull_use_spike': False, 'bull_rsi_required': True, 'bear_strategy': 'mean_reversion', 'bear_bb_std_mult': 3.2376055993878405, 'bear_rsi_os': 51, 'bear_rsi_ob': 73, 'bear_adx_thresh': 28.09629345339812, 'bear_atr_min_pct': 0.008873890912990273, 'bear_atr_max_pct': 0.11607923750546227, 'bear_tp_mult': 2.068853602856737, 'bear_tsl_mult': 0.000991639005652467, 'bear_time_stop': 156, 'bear_use_sma': False, 'bear_use_ema': False, 'bear_use_atr': False, 'bear_use_adx': True, 'bear_use_spike': False, 'bear_rsi_required': False, 'sideways_strategy': 'mean_reversion', 'sideways_bb_std_mult': 3.1432369596004803, 'sideways_rsi_os': 5, 'sideways_rsi_ob': 92, 'sideways_adx_thresh': 7.794983641269642, 'sideways_atr_min_pct': 0.00583282045296757, 'sideways_atr_max_pct': 0.1323569961658007, 'sideways_tp_mult': 2.777962275186886, 'sideways_tsl_mult': 0.22896705779825743, 'sideways_time_stop': 251, 'sideways_use_sma': False, 'sideways_use_ema': False, 'sideways_use_atr': True, 'sideways_use_adx': False, 'sideways_use_spike': True, 'sideways_rsi_required': True}.
[I 2025-09-01 14:27:28,738] Trial 224 finished with values: [-1000000000.0, 1000000000.0] and parameters: {'p_sma': 11, 'p_std': 6, 'p_atr': 19, 'p_adx': 11, 'rsi_period': 83, 'ema1': 7, 'ema2': 54, 'slip_atr_k': 0.00015381516757544123, 'slip_spread_k': 0.2929570943074271, 'spread_hl_frac': 0.01576051626449634, 'bb_std_mult': 1.4306289156646805, 'rsi_os': 47, 'rsi_ob': 73, 'vol_spike': 0.15279209830213678, 'adx_thresh': 20.47152321306157, 'atr_min_pct': 0.0022262281662392934, 'atr_max_pct': 0.07563978934504387, 'tp_mult': 2.998934351588657, 'tsl_mult': 0.7972032036382447, 'strategy': 'breakout', 'time_stop': 76, 'use_sma': False, 'use_atr': True, 'use_adx': True, 'use_ema': False, 'use_spike': True, 'rsi_required': False, 'edge_k': 0.5828104351580671, 'edge_cap': 0.052879842155234474, 'bull_strategy': 'breakout', 'bull_bb_std_mult': 3.3615559599900324, 'bull_rsi_os': 18, 'bull_rsi_ob': 77, 'bull_adx_thresh': 33.86183910733794, 'bull_atr_min_pct': 0.025953186710362293, 'bull_atr_max_pct': 0.07811751152186117, 'bull_tp_mult': 2.0292872608058894, 'bull_tsl_mult': 0.5511486357434603, 'bull_time_stop': 158, 'bull_use_sma': True, 'bull_use_ema': False, 'bull_use_atr': False, 'bull_use_adx': True, 'bull_use_spike': False, 'bull_rsi_required': False, 'bear_strategy': 'mean_reversion', 'bear_bb_std_mult': 3.290892906281495, 'bear_rsi_os': 50, 'bear_rsi_ob': 77, 'bear_adx_thresh': 26.299012939092513, 'bear_atr_min_pct': 0.023474303774647758, 'bear_atr_max_pct': 0.11445455114580005, 'bear_tp_mult': 2.2466238516788186, 'bear_tsl_mult': 0.008431445290639772, 'bear_time_stop': 278, 'bear_use_sma': False, 'bear_use_ema': False, 'bear_use_atr': False, 'bear_use_adx': True, 'bear_use_spike': False, 'bear_rsi_required': False, 'sideways_strategy': 'mean_reversion', 'sideways_bb_std_mult': 2.1711829744119835, 'sideways_rsi_os': 6, 'sideways_rsi_ob': 60, 'sideways_adx_thresh': 7.388902958436136, 'sideways_atr_min_pct': 0.00584717765652075, 'sideways_atr_max_pct': 0.05195770149111928, 'sideways_tp_mult': 1.7199793212932286, 'sideways_tsl_mult': 0.7944141927407433, 'sideways_time_stop': 269, 'sideways_use_sma': False, 'sideways_use_ema': False, 'sideways_use_atr': True, 'sideways_use_adx': False, 'sideways_use_spike': True, 'sideways_rsi_required': True}.
