[I 2025-09-01 14:11:56,471] Trial 128 finished with values: [-0.031079529380640403, 0.031020952963739377] and parameters: {'p_sma': 39, 'p_std': 50, 'p_atr': 24, 'p_adx': 17, 'rsi_period': 55, 'ema1': 18, 'ema2': 42, 'slip_atr_k': 0.21456077667262952, 'slip_spread_k': 0.6272868299499175, 'spread_hl_frac': 0.01910649743059835, 'bb_std_mult': 2.44756056307492, 'rsi_os': 21, 'rsi_ob': 71, 'vol_spike': 0.12959864634507753, 'adx_thresh': 25.906640533709073, 'atr_min_pct': 0.023086925226928418, 'atr_max_pct': 0.11688749146374047, 'tp_mult': 1.9096364254289366, 'tsl_mult': 0.20730191805428572, 'strategy': 'mean_reversion', 'time_stop': 272, 'use_sma': False, 'use_atr': False, 'use_adx': True, 'use_ema': False, 'use_spike': False, 'rsi_required': True, 'edge_k': 0.9852620087285359, 'edge_cap': 0.49795802383087323, 'bull_strategy': 'breakout', 'bull_bb_std_mult': 3.2628582462557025, 'bull_rsi_os': 31, 'bull_rsi_ob': 56, 'bull_adx_thresh': 13.10854447753095, 'bull_atr_min_pct': 0.001796490983213229, 'bull_atr_max_pct': 0.12839056290418482, 'bull_tp_mult': 1.6341612641602177, 'bull_tsl_mult': 0.6289377386076632, 'bull_time_stop': 111, 'bull_use_sma': True, 'bull_use_ema': False, 'bull_use_atr': True, 'bull_use_adx': True, 'bull_use_spike': True, 'bull_rsi_required': True, 'bear_strategy': 'breakout', 'bear_bb_std_mult': 2.399124595372793, 'bear_rsi_os': 10, 'bear_rsi_ob': 85, 'bear_adx_thresh': 26.979194492987386, 'bear_atr_min_pct': 0.01798770672561492, 'bear_atr_max_pct': 0.031425663654064566, 'bear_tp_mult': 2.5248226227832165, 'bear_tsl_mult': 0.31336823838255906, 'bear_time_stop': 89, 'bear_use_sma': True, 'bear_use_ema': False, 'bear_use_atr': False, 'bear_use_adx': True, 'bear_use_spike': True, 'bear_rsi_required': True, 'sideways_strategy': 'breakout', 'sideways_bb_std_mult': 2.8576499248233636, 'sideways_rsi_os': 28, 'sideways_rsi_ob': 49, 'sideways_adx_thresh': 20.90711268322659, 'sideways_atr_min_pct': 0.008792266762305224, 'sideways_atr_max_pct': 0.01840467098467563, 'sideways_tp_mult': 2.7961616957654356, 'sideways_tsl_mult': 0.9732179340371014, 'sideways_time_stop': 148, 'sideways_use_sma': True, 'sideways_use_ema': False, 'sideways_use_atr': False, 'sideways_use_adx': True, 'sideways_use_spike': False, 'sideways_rsi_required': False}.
[I 2025-09-01 14:11:56,663] Trial 126 finished with values: [-0.019714782805270947, 0.01967866171302496] and parameters: {'p_sma': 39, 'p_std': 51, 'p_atr': 24, 'p_adx': 29, 'rsi_period': 27, 'ema1': 29, 'ema2': 41, 'slip_atr_k': 0.0934372657963399, 'slip_spread_k': 0.42601685844694875, 'spread_hl_frac': 0.017443329339845992, 'bb_std_mult': 2.4638372744415356, 'rsi_os': 7, 'rsi_ob': 70, 'vol_spike': 0.022144018515259573, 'adx_thresh': 19.69058297975241, 'atr_min_pct': 0.014569408906326523, 'atr_max_pct': 0.11743020149581102, 'tp_mult': 1.391971857175632, 'tsl_mult': 0.8649077342459361, 'strategy': 'mean_reversion', 'time_stop': 269, 'use_sma': False, 'use_atr': False, 'use_adx': False, 'use_ema': False, 'use_spike': False, 'rsi_required': True, 'edge_k': 1.0106680447515042, 'edge_cap': 0.6738144994465416, 'bull_strategy': 'breakout', 'bull_bb_std_mult': 0.9790761136875308, 'bull_rsi_os': 32, 'bull_rsi_ob': 56, 'bull_adx_thresh': 12.863502426457227, 'bull_atr_min_pct': 0.0019113161505590515, 'bull_atr_max_pct': 0.13004902323016407, 'bull_tp_mult': 1.4155197005766171, 'bull_tsl_mult': 0.9227211332017711, 'bull_time_stop': 111, 'bull_use_sma': True, 'bull_use_ema': False, 'bull_use_atr': True, 'bull_use_adx': True, 'bull_use_spike': True, 'bull_rsi_required': True, 'bear_strategy': 'breakout', 'bear_bb_std_mult': 1.7932649746156664, 'bear_rsi_os': 53, 'bear_rsi_ob': 76, 'bear_adx_thresh': 27.065821838023677, 'bear_atr_min_pct': 0.0041838250462064, 'bear_atr_max_pct': 0.12269331313528958, 'bear_tp_mult': 2.66331643766009, 'bear_tsl_mult': 0.32768787236203256, 'bear_time_stop': 76, 'bear_use_sma': True, 'bear_use_ema': False, 'bear_use_atr': False, 'bear_use_adx': False, 'bear_use_spike': True, 'bear_rsi_required': True, 'sideways_strategy': 'breakout', 'sideways_bb_std_mult': 1.8979072944587674, 'sideways_rsi_os': 21, 'sideways_rsi_ob': 49, 'sideways_adx_thresh': 22.462451755228567, 'sideways_atr_min_pct': 0.007803894251546891, 'sideways_atr_max_pct': 0.13834524071992618, 'sideways_tp_mult': 1.7695659946384705, 'sideways_tsl_mult': 0.9270389346108641, 'sideways_time_stop': 291, 'sideways_use_sma': True, 'sideways_use_ema': False, 'sideways_use_atr': False, 'sideways_use_adx': True, 'sideways_use_spike': False, 'sideways_rsi_required': False}.
[I 2025-09-01 14:11:56,824] Trial 125 finished with values: [-0.040085370490949734, 0.03999501910438913] and parameters: {'p_sma': 39, 'p_std': 50, 'p_atr': 24, 'p_adx': 27, 'rsi_period': 59, 'ema1': 18, 'ema2': 23, 'slip_atr_k': 0.19344809167091545, 'slip_spread_k': 0.6182928663626454, 'spread_hl_frac': 0.03529809980849076, 'bb_std_mult': 2.465294075265517, 'rsi_os': 21, 'rsi_ob': 60, 'vol_spike': 0.022012162924089966, 'adx_thresh': 25.860436070281267, 'atr_min_pct': 0.00824248597132733, 'atr_max_pct': 0.03655475072856975, 'tp_mult': 2.9335447466583764, 'tsl_mult': 0.8603273437565484, 'strategy': 'mean_reversion', 'time_stop': 71, 'use_sma': False, 'use_atr': False, 'use_adx': True, 'use_ema': False, 'use_spike': False, 'rsi_required': True, 'edge_k': 0.3765912325143381, 'edge_cap': 0.49981954843922416, 'bull_strategy': 'breakout', 'bull_bb_std_mult': 3.28225659856878, 'bull_rsi_os': 32, 'bull_rsi_ob': 56, 'bull_adx_thresh': 14.947970914544573, 'bull_atr_min_pct': 6.0598091542476566e-05, 'bull_atr_max_pct': 0.12901365978133855, 'bull_tp_mult': 1.4363442727395468, 'bull_tsl_mult': 0.04066749625639238, 'bull_time_stop': 229, 'bull_use_sma': True, 'bull_use_ema': True, 'bull_use_atr': True, 'bull_use_adx': True, 'bull_use_spike': True, 'bull_rsi_required': True, 'bear_strategy': 'breakout', 'bear_bb_std_mult': 2.584550963271737, 'bear_rsi_os': 54, 'bear_rsi_ob': 50, 'bear_adx_thresh': 12.645274907503303, 'bear_atr_min_pct': 0.025964427332017072, 'bear_atr_max_pct': 0.14393037690426327, 'bear_tp_mult': 2.535100366240631, 'bear_tsl_mult': 0.2774650491046422, 'bear_time_stop': 184, 'bear_use_sma': True, 'bear_use_ema': False, 'bear_use_atr': True, 'bear_use_adx': False, 'bear_use_spike': True, 'bear_rsi_required': True, 'sideways_strategy': 'breakout', 'sideways_bb_std_mult': 1.680684918387055, 'sideways_rsi_os': 26, 'sideways_rsi_ob': 50, 'sideways_adx_thresh': 5.951131230468501, 'sideways_atr_min_pct': 0.007651653921120757, 'sideways_atr_max_pct': 0.1496578898528383, 'sideways_tp_mult': 2.238966823983439, 'sideways_tsl_mult': 0.3822828459759018, 'sideways_time_stop': 292, 'sideways_use_sma': True, 'sideways_use_ema': False, 'sideways_use_atr': False, 'sideways_use_adx': True, 'sideways_use_spike': False, 'sideways_rsi_required': False}.
[I 2025-09-01 14:12:40,581] Trial 131 finished with values: [-1000000000.0, 1000000000.0] and parameters: {'p_sma': 32, 'p_std': 46, 'p_atr': 26, 'p_adx': 20, 'rsi_period': 79, 'ema1': 28, 'ema2': 38, 'slip_atr_k': 0.2363780386211042, 'slip_spread_k': 0.44005190740059363, 'spread_hl_frac': 0.04433096664179786, 'bb_std_mult': 0.8140048195676652, 'rsi_os': 8, 'rsi_ob': 75, 'vol_spike': 0.21386606114375495, 'adx_thresh': 29.865724011618862, 'atr_min_pct': 0.010966276851765145, 'atr_max_pct': 0.03375376476734876, 'tp_mult': 1.6615877407831747, 'tsl_mult': 0.09554087822827681, 'strategy': 'mean_reversion', 'time_stop': 19, 'use_sma': False, 'use_atr': False, 'use_adx': True, 'use_ema': False, 'use_spike': False, 'rsi_required': True, 'edge_k': 1.0804275516086455, 'edge_cap': 0.8024926103175064, 'bull_strategy': 'mean_reversion', 'bull_bb_std_mult': 2.4010055482698323, 'bull_rsi_os': 40, 'bull_rsi_ob': 50, 'bull_adx_thresh': 10.312549568993436, 'bull_atr_min_pct': 0.02058210106180059, 'bull_atr_max_pct': 0.12163727085356779, 'bull_tp_mult': 2.046998508165361, 'bull_tsl_mult': 0.9001461435681826, 'bull_time_stop': 205, 'bull_use_sma': True, 'bull_use_ema': True, 'bull_use_atr': True, 'bull_use_adx': True, 'bull_use_spike': True, 'bull_rsi_required': False, 'bear_strategy': 'breakout', 'bear_bb_std_mult': 2.668828458552297, 'bear_rsi_os': 25, 'bear_rsi_ob': 69, 'bear_adx_thresh': 16.317322747228808, 'bear_atr_min_pct': 0.01582323471536701, 'bear_atr_max_pct': 0.12071290239760112, 'bear_tp_mult': 2.968232040608358, 'bear_tsl_mult': 0.29149096867199376, 'bear_time_stop': 181, 'bear_use_sma': True, 'bear_use_ema': False, 'bear_use_atr': True, 'bear_use_adx': False, 'bear_use_spike': False, 'bear_rsi_required': True, 'sideways_strategy': 'breakout', 'sideways_bb_std_mult': 1.3779788726527, 'sideways_rsi_os': 24, 'sideways_rsi_ob': 67, 'sideways_adx_thresh': 5.8576633488321885, 'sideways_atr_min_pct': 0.010286198554873414, 'sideways_atr_max_pct': 0.05931575883943642, 'sideways_tp_mult': 2.945638890010883, 'sideways_tsl_mult': 0.13241534876784294, 'sideways_time_stop': 26, 'sideways_use_sma': True, 'sideways_use_ema': False, 'sideways_use_atr': True, 'sideways_use_adx': False, 'sideways_use_spike': False, 'sideways_rsi_required': False}.
[I 2025-09-01 14:12:41,555] Trial 132 finished with values: [-0.01300379203949431, 0.013035419859591868] and parameters: {'p_sma': 31, 'p_std': 52, 'p_atr': 29, 'p_adx': 20, 'rsi_period': 15, 'ema1': 28, 'ema2': 15, 'slip_atr_k': 0.23386959881712813, 'slip_spread_k': 0.39500029518617547, 'spread_hl_frac': 0.00560340883152162, 'bb_std_mult': 2.2472135613617152, 'rsi_os': 36, 'rsi_ob': 67, 'vol_spike': 0.2648717726433055, 'adx_thresh': 14.889657786035709, 'atr_min_pct': 0.026808207512120593, 'atr_max_pct': 0.133061964632685, 'tp_mult': 1.6645717097751505, 'tsl_mult': 0.1477307579165961, 'strategy': 'mean_reversion', 'time_stop': 211, 'use_sma': False, 'use_atr': False, 'use_adx': True, 'use_ema': False, 'use_spike': False, 'rsi_required': True, 'edge_k': 1.079027821496043, 'edge_cap': 0.7986677051948653, 'bull_strategy': 'mean_reversion', 'bull_bb_std_mult': 2.360415465035781, 'bull_rsi_os': 34, 'bull_rsi_ob': 72, 'bull_adx_thresh': 6.178025343602705, 'bull_atr_min_pct': 0.001045725617945152, 'bull_atr_max_pct': 0.12265371772056885, 'bull_tp_mult': 2.0690042381864364, 'bull_tsl_mult': 0.7698808876686425, 'bull_time_stop': 36, 'bull_use_sma': True, 'bull_use_ema': True, 'bull_use_atr': True, 'bull_use_adx': True, 'bull_use_spike': False, 'bull_rsi_required': False, 'bear_strategy': 'breakout', 'bear_bb_std_mult': 2.4549693980284166, 'bear_rsi_os': 29, 'bear_rsi_ob': 90, 'bear_adx_thresh': 25.173115644217066, 'bear_atr_min_pct': 0.015826117956972457, 'bear_atr_max_pct': 0.014378162032522665, 'bear_tp_mult': 2.6175390297123675, 'bear_tsl_mult': 0.38551303397124104, 'bear_time_stop': 22, 'bear_use_sma': True, 'bear_use_ema': False, 'bear_use_atr': True, 'bear_use_adx': False, 'bear_use_spike': False, 'bear_rsi_required': True, 'sideways_strategy': 'breakout', 'sideways_bb_std_mult': 0.8206016776779408, 'sideways_rsi_os': 47, 'sideways_rsi_ob': 77, 'sideways_adx_thresh': 8.083584884308939, 'sideways_atr_min_pct': 0.010395466447112972, 'sideways_atr_max_pct': 0.05897908350439258, 'sideways_tp_mult': 2.0011929286438455, 'sideways_tsl_mult': 0.6426027058006878, 'sideways_time_stop': 111, 'sideways_use_sma': True, 'sideways_use_ema': False, 'sideways_use_atr': True, 'sideways_use_adx': False, 'sideways_use_spike': False, 'sideways_rsi_required': True}.
[I 2025-09-01 14:12:42,199] Trial 129 finished with values: [-0.02559189039323906, 0.02558237845516019] and parameters: {'p_sma': 39, 'p_std': 51, 'p_atr': 26, 'p_adx': 29, 'rsi_period': 16, 'ema1': 16, 'ema2': 42, 'slip_atr_k': 0.1820063005834644, 'slip_spread_k': 0.9480435358379118, 'spread_hl_frac': 0.04486500479375583, 'bb_std_mult': 2.2522672810140536, 'rsi_os': 17, 'rsi_ob': 71, 'vol_spike': 0.25704492622474695, 'adx_thresh': 25.92575171816102, 'atr_min_pct': 0.010803979648195598, 'atr_max_pct': 0.1220210212247977, 'tp_mult': 1.9030379075002806, 'tsl_mult': 0.10213373202764114, 'strategy': 'mean_reversion', 'time_stop': 73, 'use_sma': False, 'use_atr': False, 'use_adx': True, 'use_ema': False, 'use_spike': False, 'rsi_required': True, 'edge_k': 0.9725089949786032, 'edge_cap': 0.538162591325363, 'bull_strategy': 'breakout', 'bull_bb_std_mult': 3.278989112143619, 'bull_rsi_os': 7, 'bull_rsi_ob': 77, 'bull_adx_thresh': 21.9503334184756, 'bull_atr_min_pct': 0.001334370704975841, 'bull_atr_max_pct': 0.13245233292768177, 'bull_tp_mult': 1.54606702884517, 'bull_tsl_mult': 0.5135912336632359, 'bull_time_stop': 199, 'bull_use_sma': True, 'bull_use_ema': False, 'bull_use_atr': True, 'bull_use_adx': True, 'bull_use_spike': True, 'bull_rsi_required': True, 'bear_strategy': 'breakout', 'bear_bb_std_mult': 2.4533527098387546, 'bear_rsi_os': 14, 'bear_rsi_ob': 91, 'bear_adx_thresh': 20.397354467829985, 'bear_atr_min_pct': 0.009680449487072853, 'bear_atr_max_pct': 0.013259977812510017, 'bear_tp_mult': 2.971437785983416, 'bear_tsl_mult': 0.5968836006667306, 'bear_time_stop': 5, 'bear_use_sma': True, 'bear_use_ema': True, 'bear_use_atr': False, 'bear_use_adx': False, 'bear_use_spike': True, 'bear_rsi_required': True, 'sideways_strategy': 'breakout', 'sideways_bb_std_mult': 2.9554732181125165, 'sideways_rsi_os': 47, 'sideways_rsi_ob': 56, 'sideways_adx_thresh': 33.941696205477314, 'sideways_atr_min_pct': 0.008113819775799103, 'sideways_atr_max_pct': 0.1250557908800667, 'sideways_tp_mult': 1.9054127714560591, 'sideways_tsl_mult': 0.6387054196402265, 'sideways_time_stop': 32, 'sideways_use_sma': True, 'sideways_use_ema': True, 'sideways_use_atr': False, 'sideways_use_adx': False, 'sideways_use_spike': False, 'sideways_rsi_required': False}.
[I 2025-09-01 14:12:42,495] Trial 130 finished with values: [-1000000000.0, 1000000000.0] and parameters: {'p_sma': 34, 'p_std': 48, 'p_atr': 26, 'p_adx': 20, 'rsi_period': 27, 'ema1': 16, 'ema2': 38, 'slip_atr_k': 0.09143761201094089, 'slip_spread_k': 0.43946831831763183, 'spread_hl_frac': 0.04195639996619385, 'bb_std_mult': 0.8782516511177707, 'rsi_os': 17, 'rsi_ob': 89, 'vol_spike': 0.008558147340604338, 'adx_thresh': 33.870722591277165, 'atr_min_pct': 0.014494074272980065, 'atr_max_pct': 0.12234889180620243, 'tp_mult': 1.700750429471399, 'tsl_mult': 0.043295958920042454, 'strategy': 'mean_reversion', 'time_stop': 210, 'use_sma': True, 'use_atr': False, 'use_adx': True, 'use_ema': False, 'use_spike': False, 'rsi_required': True, 'edge_k': 0.41962864488863394, 'edge_cap': 0.8031061466364805, 'bull_strategy': 'mean_reversion', 'bull_bb_std_mult': 0.9290884305110754, 'bull_rsi_os': 35, 'bull_rsi_ob': 72, 'bull_adx_thresh': 10.13251944167438, 'bull_atr_min_pct': 0.0010626339505835402, 'bull_atr_max_pct': 0.1221959124840643, 'bull_tp_mult': 2.0789457559836966, 'bull_tsl_mult': 0.034399180430451724, 'bull_time_stop': 35, 'bull_use_sma': True, 'bull_use_ema': True, 'bull_use_atr': True, 'bull_use_adx': True, 'bull_use_spike': True, 'bull_rsi_required': False, 'bear_strategy': 'breakout', 'bear_bb_std_mult': 1.8034456996782753, 'bear_rsi_os': 14, 'bear_rsi_ob': 91, 'bear_adx_thresh': 13.725674604895007, 'bear_atr_min_pct': 0.00969556213405941, 'bear_atr_max_pct': 0.013864657591890251, 'bear_tp_mult': 2.6588971267491135, 'bear_tsl_mult': 0.6867962935471472, 'bear_time_stop': 77, 'bear_use_sma': True, 'bear_use_ema': True, 'bear_use_atr': True, 'bear_use_adx': False, 'bear_use_spike': True, 'bear_rsi_required': True, 'sideways_strategy': 'breakout', 'sideways_bb_std_mult': 1.1147598479452836, 'sideways_rsi_os': 14, 'sideways_rsi_ob': 94, 'sideways_adx_thresh': 19.601336186530364, 'sideways_atr_min_pct': 0.010200790150673385, 'sideways_atr_max_pct': 0.14117998321266034, 'sideways_tp_mult': 1.2498849887851322, 'sideways_tsl_mult': 0.6451339774254224, 'sideways_time_stop': 111, 'sideways_use_sma': True, 'sideways_use_ema': True, 'sideways_use_atr': True, 'sideways_use_adx': False, 'sideways_use_spike': False, 'sideways_rsi_required': False}.
[I 2025-09-01 14:13:25,332] Trial 136 finished with values: [-1000000000.0, 1000000000.0] and parameters: {'p_sma': 48, 'p_std': 52, 'p_atr': 17, 'p_adx': 23, 'rsi_period': 82, 'ema1': 19, 'ema2': 14, 'slip_atr_k': 0.14188347591323602, 'slip_spread_k': 0.40082834604511997, 'spread_hl_frac': 0.008458489977421105, 'bb_std_mult': 2.2359915237683605, 'rsi_os': 47, 'rsi_ob': 67, 'vol_spike': 0.18912357842498523, 'adx_thresh': 24.39860804670875, 'atr_min_pct': 0.029635859942653303, 'atr_max_pct': 0.1321766963195189, 'tp_mult': 2.3328619204672116, 'tsl_mult': 0.13876268729979258, 'strategy': 'mean_reversion', 'time_stop': 222, 'use_sma': False, 'use_atr': True, 'use_adx': False, 'use_ema': False, 'use_spike': True, 'rsi_required': False, 'edge_k': 1.0290342430274784, 'edge_cap': 0.6731099384671156, 'bull_strategy': 'mean_reversion', 'bull_bb_std_mult': 1.7107336181979012, 'bull_rsi_os': 34, 'bull_rsi_ob': 51, 'bull_adx_thresh': 6.18890300967314, 'bull_atr_min_pct': 0.0019265831996401698, 'bull_atr_max_pct': 0.019694181416890374, 'bull_tp_mult': 1.3506210967623176, 'bull_tsl_mult': 0.07451461313924691, 'bull_time_stop': 16, 'bull_use_sma': True, 'bull_use_ema': True, 'bull_use_atr': False, 'bull_use_adx': True, 'bull_use_spike': False, 'bull_rsi_required': True, 'bear_strategy': 'breakout', 'bear_bb_std_mult': 1.7550360917063326, 'bear_rsi_os': 12, 'bear_rsi_ob': 89, 'bear_adx_thresh': 10.620749367487024, 'bear_atr_min_pct': 0.016984276590703038, 'bear_atr_max_pct': 0.04063121221400366, 'bear_tp_mult': 2.7893286592663693, 'bear_tsl_mult': 0.6434475078791777, 'bear_time_stop': 253, 'bear_use_sma': True, 'bear_use_ema': False, 'bear_use_atr': True, 'bear_use_adx': True, 'bear_use_spike': False, 'bear_rsi_required': True, 'sideways_strategy': 'mean_reversion', 'sideways_bb_std_mult': 3.0368251845492598, 'sideways_rsi_os': 9, 'sideways_rsi_ob': 63, 'sideways_adx_thresh': 22.201009232203074, 'sideways_atr_min_pct': 0.006695744053940319, 'sideways_atr_max_pct': 0.07342898968281948, 'sideways_tp_mult': 2.6502445015476246, 'sideways_tsl_mult': 0.5526103562378841, 'sideways_time_stop': 129, 'sideways_use_sma': False, 'sideways_use_ema': False, 'sideways_use_atr': True, 'sideways_use_adx': True, 'sideways_use_spike': True, 'sideways_rsi_required': True}.
[I 2025-09-01 14:13:25,729] Trial 135 finished with values: [-1000000000.0, 1000000000.0] and parameters: {'p_sma': 30, 'p_std': 48, 'p_atr': 26, 'p_adx': 21, 'rsi_period': 21, 'ema1': 19, 'ema2': 10, 'slip_atr_k': 0.23251038588504985, 'slip_spread_k': 0.3930065603040549, 'spread_hl_frac': 0.022661840893135797, 'bb_std_mult': 0.9801724982961615, 'rsi_os': 19, 'rsi_ob': 67, 'vol_spike': 0.06434712038289545, 'adx_thresh': 24.666176200511376, 'atr_min_pct': 0.007503598335250065, 'atr_max_pct': 0.1333884153622385, 'tp_mult': 1.8579910963833774, 'tsl_mult': 0.2751428138200019, 'strategy': 'mean_reversion', 'time_stop': 105, 'use_sma': True, 'use_atr': False, 'use_adx': False, 'use_ema': False, 'use_spike': True, 'rsi_required': True, 'edge_k': 0.7600854556559513, 'edge_cap': 0.8235625915067912, 'bull_strategy': 'mean_reversion', 'bull_bb_std_mult': 1.095666457632276, 'bull_rsi_os': 34, 'bull_rsi_ob': 51, 'bull_adx_thresh': 5.905959391678392, 'bull_atr_min_pct': 0.0009046655867803044, 'bull_atr_max_pct': 0.14951598231334115, 'bull_tp_mult': 1.7187825495083346, 'bull_tsl_mult': 0.020533247487777153, 'bull_time_stop': 100, 'bull_use_sma': True, 'bull_use_ema': True, 'bull_use_atr': True, 'bull_use_adx': True, 'bull_use_spike': False, 'bull_rsi_required': False, 'bear_strategy': 'breakout', 'bear_bb_std_mult': 2.0345333257148157, 'bear_rsi_os': 28, 'bear_rsi_ob': 87, 'bear_adx_thresh': 13.548502866519419, 'bear_atr_min_pct': 0.00399763270984488, 'bear_atr_max_pct': 0.08453367971179189, 'bear_tp_mult': 2.7671728170111622, 'bear_tsl_mult': 0.6965607394752465, 'bear_time_stop': 77, 'bear_use_sma': True, 'bear_use_ema': False, 'bear_use_atr': True, 'bear_use_adx': False, 'bear_use_spike': True, 'bear_rsi_required': True, 'sideways_strategy': 'breakout', 'sideways_bb_std_mult': 1.187246852542979, 'sideways_rsi_os': 5, 'sideways_rsi_ob': 70, 'sideways_adx_thresh': 24.254771766768386, 'sideways_atr_min_pct': 0.020952132858677287, 'sideways_atr_max_pct': 0.1437285838147297, 'sideways_tp_mult': 1.7921713350674864, 'sideways_tsl_mult': 0.5812107652833015, 'sideways_time_stop': 126, 'sideways_use_sma': True, 'sideways_use_ema': False, 'sideways_use_atr': True, 'sideways_use_adx': True, 'sideways_use_spike': True, 'sideways_rsi_required': True}.
