[I 2025-09-01 14:46:23,718] Trial 350 finished with values: [-1000000000.0, 1000000000.0] and parameters: {'p_sma': 13, 'p_std': 12, 'p_atr': 21, 'p_adx': 25, 'rsi_period': 60, 'ema1': 7, 'ema2': 55, 'slip_atr_k': 0.18979496452882272, 'slip_spread_k': 0.22285263729364913, 'spread_hl_frac': 0.013940123657722762, 'bb_std_mult': 0.9056333696335879, 'rsi_os': 5, 'rsi_ob': 74, 'vol_spike': 0.2303513575669327, 'adx_thresh': 27.052451482686607, 'atr_min_pct': 0.01616808160522506, 'atr_max_pct': 0.07188599865225012, 'tp_mult': 2.0961647933262473, 'tsl_mult': 0.8994421938876929, 'strategy': 'mean_reversion', 'time_stop': 254, 'use_sma': True, 'use_atr': True, 'use_adx': True, 'use_ema': False, 'use_spike': False, 'rsi_required': False, 'edge_k': 0.6504951546177421, 'edge_cap': 0.7437767543857868, 'bull_strategy': 'breakout', 'bull_bb_std_mult': 0.7101075429921082, 'bull_rsi_os': 10, 'bull_rsi_ob': 45, 'bull_adx_thresh': 13.048894926720031, 'bull_atr_min_pct': 0.014869293630671547, 'bull_atr_max_pct': 0.06920846513333129, 'bull_tp_mult': 2.329740555033245, 'bull_tsl_mult': 0.9789090526170443, 'bull_time_stop': 247, 'bull_use_sma': True, 'bull_use_ema': False, 'bull_use_atr': False, 'bull_use_adx': False, 'bull_use_spike': False, 'bull_rsi_required': True, 'bear_strategy': 'breakout', 'bear_bb_std_mult': 0.8666538083879063, 'bear_rsi_os': 7, 'bear_rsi_ob': 78, 'bear_adx_thresh': 22.444949872000905, 'bear_atr_min_pct': 0.023882556845427033, 'bear_atr_max_pct': 0.10665850561149956, 'bear_tp_mult': 2.619932126143509, 'bear_tsl_mult': 0.7172492194948197, 'bear_time_stop': 204, 'bear_use_sma': True, 'bear_use_ema': False, 'bear_use_atr': False, 'bear_use_adx': True, 'bear_use_spike': False, 'bear_rsi_required': True, 'sideways_strategy': 'mean_reversion', 'sideways_bb_std_mult': 0.8298952423228327, 'sideways_rsi_os': 35, 'sideways_rsi_ob': 88, 'sideways_adx_thresh': 33.60668388429616, 'sideways_atr_min_pct': 0.004936261078683358, 'sideways_atr_max_pct': 0.13713572719054953, 'sideways_tp_mult': 1.7430312380242823, 'sideways_tsl_mult': 0.21801807574959925, 'sideways_time_stop': 100, 'sideways_use_sma': False, 'sideways_use_ema': False, 'sideways_use_atr': False, 'sideways_use_adx': True, 'sideways_use_spike': False, 'sideways_rsi_required': False}.
[I 2025-09-01 14:46:24,312] Trial 352 finished with values: [-1000000000.0, 1000000000.0] and parameters: {'p_sma': 53, 'p_std': 39, 'p_atr': 15, 'p_adx': 11, 'rsi_period': 63, 'ema1': 29, 'ema2': 51, 'slip_atr_k': 0.060221666874321074, 'slip_spread_k': 0.2277428032896839, 'spread_hl_frac': 0.006761078576562208, 'bb_std_mult': 1.4295709373031031, 'rsi_os': 37, 'rsi_ob': 74, 'vol_spike': 0.2787396109582142, 'adx_thresh': 10.341595971569372, 'atr_min_pct': 0.014350064145230745, 'atr_max_pct': 0.073484519200396, 'tp_mult': 2.9155415898354544, 'tsl_mult': 0.3397926723715776, 'strategy': 'mean_reversion', 'time_stop': 79, 'use_sma': True, 'use_atr': True, 'use_adx': True, 'use_ema': False, 'use_spike': True, 'rsi_required': False, 'edge_k': 0.4548272468659661, 'edge_cap': 0.06158914549329231, 'bull_strategy': 'breakout', 'bull_bb_std_mult': 1.7581064153726267, 'bull_rsi_os': 15, 'bull_rsi_ob': 51, 'bull_adx_thresh': 10.385518571387678, 'bull_atr_min_pct': 0.014969638703051128, 'bull_atr_max_pct': 0.0148388329004586, 'bull_tp_mult': 2.0215887724431574, 'bull_tsl_mult': 0.28148042209748786, 'bull_time_stop': 156, 'bull_use_sma': True, 'bull_use_ema': False, 'bull_use_atr': False, 'bull_use_adx': True, 'bull_use_spike': False, 'bull_rsi_required': True, 'bear_strategy': 'breakout', 'bear_bb_std_mult': 2.755521198826828, 'bear_rsi_os': 47, 'bear_rsi_ob': 77, 'bear_adx_thresh': 27.980440660406067, 'bear_atr_min_pct': 0.02400655000105732, 'bear_atr_max_pct': 0.08456565510473718, 'bear_tp_mult': 2.56837074309853, 'bear_tsl_mult': 0.7222611887744163, 'bear_time_stop': 295, 'bear_use_sma': False, 'bear_use_ema': False, 'bear_use_atr': False, 'bear_use_adx': True, 'bear_use_spike': False, 'bear_rsi_required': False, 'sideways_strategy': 'mean_reversion', 'sideways_bb_std_mult': 3.226846258847087, 'sideways_rsi_os': 19, 'sideways_rsi_ob': 63, 'sideways_adx_thresh': 8.002550122663305, 'sideways_atr_min_pct': 0.02534954353810494, 'sideways_atr_max_pct': 0.04617125758805814, 'sideways_tp_mult': 1.5374805623565233, 'sideways_tsl_mult': 0.30603686583494255, 'sideways_time_stop': 100, 'sideways_use_sma': False, 'sideways_use_ema': False, 'sideways_use_atr': True, 'sideways_use_adx': False, 'sideways_use_spike': True, 'sideways_rsi_required': True}.
[I 2025-09-01 14:47:02,148] Trial 354 finished with values: [-1000000000.0, 1000000000.0] and parameters: {'p_sma': 54, 'p_std': 12, 'p_atr': 20, 'p_adx': 26, 'rsi_period': 71, 'ema1': 26, 'ema2': 52, 'slip_atr_k': 0.11801310688470092, 'slip_spread_k': 0.2641808639291865, 'spread_hl_frac': 0.01198902752038869, 'bb_std_mult': 1.4374228297954765, 'rsi_os': 52, 'rsi_ob': 77, 'vol_spike': 0.29233006321846655, 'adx_thresh': 20.86083249584082, 'atr_min_pct': 0.01605519390614035, 'atr_max_pct': 0.1038101931477302, 'tp_mult': 1.6789745332944697, 'tsl_mult': 0.07319069309606097, 'strategy': 'breakout', 'time_stop': 68, 'use_sma': False, 'use_atr': True, 'use_adx': True, 'use_ema': False, 'use_spike': True, 'rsi_required': False, 'edge_k': 0.4497765516876424, 'edge_cap': 0.06642253363034786, 'bull_strategy': 'breakout', 'bull_bb_std_mult': 2.786405782224228, 'bull_rsi_os': 18, 'bull_rsi_ob': 79, 'bull_adx_thresh': 10.402193271178124, 'bull_atr_min_pct': 0.014847381385714413, 'bull_atr_max_pct': 0.09549212055668656, 'bull_tp_mult': 1.1227069154863254, 'bull_tsl_mult': 0.2910567268342496, 'bull_time_stop': 156, 'bull_use_sma': True, 'bull_use_ema': False, 'bull_use_atr': True, 'bull_use_adx': True, 'bull_use_spike': False, 'bull_rsi_required': True, 'bear_strategy': 'mean_reversion', 'bear_bb_std_mult': 1.2557443352605209, 'bear_rsi_os': 22, 'bear_rsi_ob': 78, 'bear_adx_thresh': 30.414921496012507, 'bear_atr_min_pct': 0.013248341378088955, 'bear_atr_max_pct': 0.10785775924614792, 'bear_tp_mult': 1.01325135104279, 'bear_tsl_mult': 0.6624722083002376, 'bear_time_stop': 295, 'bear_use_sma': False, 'bear_use_ema': False, 'bear_use_atr': True, 'bear_use_adx': False, 'bear_use_spike': False, 'bear_rsi_required': False, 'sideways_strategy': 'mean_reversion', 'sideways_bb_std_mult': 3.272138565739504, 'sideways_rsi_os': 43, 'sideways_rsi_ob': 63, 'sideways_adx_thresh': 13.185884496620037, 'sideways_atr_min_pct': 0.025248476540740243, 'sideways_atr_max_pct': 0.04336478785645298, 'sideways_tp_mult': 2.1330340560721064, 'sideways_tsl_mult': 0.7264170668925488, 'sideways_time_stop': 123, 'sideways_use_sma': False, 'sideways_use_ema': False, 'sideways_use_atr': True, 'sideways_use_adx': False, 'sideways_use_spike': True, 'sideways_rsi_required': True}.
[I 2025-09-01 14:47:02,382] Trial 353 finished with values: [-0.02724909678475873, 0.027345660907062617] and parameters: {'p_sma': 10, 'p_std': 12, 'p_atr': 20, 'p_adx': 17, 'rsi_period': 71, 'ema1': 29, 'ema2': 47, 'slip_atr_k': 0.1266777712415743, 'slip_spread_k': 0.5373805723079813, 'spread_hl_frac': 0.02464176781670495, 'bb_std_mult': 1.4361591312771245, 'rsi_os': 10, 'rsi_ob': 53, 'vol_spike': 0.2999756119781458, 'adx_thresh': 20.917648476214655, 'atr_min_pct': 0.002476667622020756, 'atr_max_pct': 0.07291065937391569, 'tp_mult': 2.956132481207401, 'tsl_mult': 0.100785868074637, 'strategy': 'breakout', 'time_stop': 200, 'use_sma': False, 'use_atr': True, 'use_adx': True, 'use_ema': False, 'use_spike': True, 'rsi_required': False, 'edge_k': 0.5224080839556292, 'edge_cap': 0.06637107114737766, 'bull_strategy': 'breakout', 'bull_bb_std_mult': 2.928559084305708, 'bull_rsi_os': 18, 'bull_rsi_ob': 45, 'bull_adx_thresh': 12.9718736496575, 'bull_atr_min_pct': 0.00216744145658725, 'bull_atr_max_pct': 0.015681572375235774, 'bull_tp_mult': 2.0671736479567535, 'bull_tsl_mult': 0.9093462120861298, 'bull_time_stop': 156, 'bull_use_sma': True, 'bull_use_ema': False, 'bull_use_atr': True, 'bull_use_adx': True, 'bull_use_spike': False, 'bull_rsi_required': True, 'bear_strategy': 'mean_reversion', 'bear_bb_std_mult': 0.8626891986367846, 'bear_rsi_os': 22, 'bear_rsi_ob': 83, 'bear_adx_thresh': 26.256502062101326, 'bear_atr_min_pct': 0.024076650042186298, 'bear_atr_max_pct': 0.10668995377776802, 'bear_tp_mult': 2.5648876041750466, 'bear_tsl_mult': 0.7027682066477965, 'bear_time_stop': 61, 'bear_use_sma': False, 'bear_use_ema': False, 'bear_use_atr': True, 'bear_use_adx': False, 'bear_use_spike': False, 'bear_rsi_required': False, 'sideways_strategy': 'mean_reversion', 'sideways_bb_std_mult': 3.235727664800544, 'sideways_rsi_os': 19, 'sideways_rsi_ob': 89, 'sideways_adx_thresh': 12.059578329725397, 'sideways_atr_min_pct': 0.007088968520939213, 'sideways_atr_max_pct': 0.0665905088686141, 'sideways_tp_mult': 2.528800315566533, 'sideways_tsl_mult': 0.6470281766925706, 'sideways_time_stop': 107, 'sideways_use_sma': False, 'sideways_use_ema': False, 'sideways_use_atr': True, 'sideways_use_adx': False, 'sideways_use_spike': True, 'sideways_rsi_required': True}.
[I 2025-09-01 14:47:02,533] Trial 356 finished with values: [-1000000000.0, 1000000000.0] and parameters: {'p_sma': 10, 'p_std': 17, 'p_atr': 20, 'p_adx': 26, 'rsi_period': 65, 'ema1': 30, 'ema2': 36, 'slip_atr_k': 0.11678171054596292, 'slip_spread_k': 0.2598342596625678, 'spread_hl_frac': 0.01184985192512368, 'bb_std_mult': 1.6515232332371421, 'rsi_os': 23, 'rsi_ob': 53, 'vol_spike': 0.29384592055802616, 'adx_thresh': 24.7216221930765, 'atr_min_pct': 0.02309349229384098, 'atr_max_pct': 0.07794198582619968, 'tp_mult': 2.9994425822680153, 'tsl_mult': 0.09829241226920044, 'strategy': 'breakout', 'time_stop': 69, 'use_sma': False, 'use_atr': True, 'use_adx': False, 'use_ema': True, 'use_spike': True, 'rsi_required': False, 'edge_k': 0.5423449257589159, 'edge_cap': 0.2814274330847895, 'bull_strategy': 'mean_reversion', 'bull_bb_std_mult': 2.7893806170725934, 'bull_rsi_os': 18, 'bull_rsi_ob': 62, 'bull_adx_thresh': 34.753611560917804, 'bull_atr_min_pct': 0.0021625790535071947, 'bull_atr_max_pct': 0.019543289152218847, 'bull_tp_mult': 2.136701700930026, 'bull_tsl_mult': 0.3466340415119972, 'bull_time_stop': 146, 'bull_use_sma': False, 'bull_use_ema': True, 'bull_use_atr': True, 'bull_use_adx': True, 'bull_use_spike': False, 'bull_rsi_required': False, 'bear_strategy': 'mean_reversion', 'bear_bb_std_mult': 1.4950832032856076, 'bear_rsi_os': 24, 'bear_rsi_ob': 76, 'bear_adx_thresh': 7.308873147271957, 'bear_atr_min_pct': 0.025716180678259284, 'bear_atr_max_pct': 0.11504323925503178, 'bear_tp_mult': 2.55946244555912, 'bear_tsl_mult': 0.6610902983288248, 'bear_time_stop': 61, 'bear_use_sma': False, 'bear_use_ema': True, 'bear_use_atr': True, 'bear_use_adx': False, 'bear_use_spike': False, 'bear_rsi_required': False, 'sideways_strategy': 'mean_reversion', 'sideways_bb_std_mult': 0.9857738450503784, 'sideways_rsi_os': 43, 'sideways_rsi_ob': 77, 'sideways_adx_thresh': 6.724398309166035, 'sideways_atr_min_pct': 0.006745732506078718, 'sideways_atr_max_pct': 0.13222294349032995, 'sideways_tp_mult': 2.7746633696275462, 'sideways_tsl_mult': 0.5534418773235493, 'sideways_time_stop': 123, 'sideways_use_sma': False, 'sideways_use_ema': True, 'sideways_use_atr': True, 'sideways_use_adx': False, 'sideways_use_spike': True, 'sideways_rsi_required': True}.
[I 2025-09-01 14:47:02,728] Trial 355 finished with values: [-1000000000.0, 1000000000.0] and parameters: {'p_sma': 10, 'p_std': 6, 'p_atr': 20, 'p_adx': 11, 'rsi_period': 77, 'ema1': 29, 'ema2': 37, 'slip_atr_k': 0.1169352040608123, 'slip_spread_k': 0.2509231862019859, 'spread_hl_frac': 0.024708723665707925, 'bb_std_mult': 1.541236420556423, 'rsi_os': 23, 'rsi_ob': 75, 'vol_spike': 0.29974922342932653, 'adx_thresh': 15.592034657045993, 'atr_min_pct': 0.006004329470442689, 'atr_max_pct': 0.07824743414533984, 'tp_mult': 2.9520412767015527, 'tsl_mult': 0.07616613717868448, 'strategy': 'breakout', 'time_stop': 234, 'use_sma': False, 'use_atr': True, 'use_adx': False, 'use_ema': True, 'use_spike': True, 'rsi_required': False, 'edge_k': 0.4496759863590721, 'edge_cap': 0.06467412968538913, 'bull_strategy': 'mean_reversion', 'bull_bb_std_mult': 2.7806766699892647, 'bull_rsi_os': 17, 'bull_rsi_ob': 79, 'bull_adx_thresh': 26.592318607322525, 'bull_atr_min_pct': 0.011691907087205997, 'bull_atr_max_pct': 0.019561641594179436, 'bull_tp_mult': 2.0747459062641274, 'bull_tsl_mult': 0.2591577594535551, 'bull_time_stop': 158, 'bull_use_sma': False, 'bull_use_ema': True, 'bull_use_atr': True, 'bull_use_adx': True, 'bull_use_spike': False, 'bull_rsi_required': False, 'bear_strategy': 'mean_reversion', 'bear_bb_std_mult': 1.9937628445127757, 'bear_rsi_os': 45, 'bear_rsi_ob': 69, 'bear_adx_thresh': 26.384178274430248, 'bear_atr_min_pct': 0.025380762340913444, 'bear_atr_max_pct': 0.11568235972109009, 'bear_tp_mult': 2.566074886732932, 'bear_tsl_mult': 0.6614686664832088, 'bear_time_stop': 294, 'bear_use_sma': False, 'bear_use_ema': True, 'bear_use_atr': True, 'bear_use_adx': False, 'bear_use_spike': False, 'bear_rsi_required': False, 'sideways_strategy': 'mean_reversion', 'sideways_bb_std_mult': 3.2717134972842485, 'sideways_rsi_os': 43, 'sideways_rsi_ob': 89, 'sideways_adx_thresh': 13.260748536638086, 'sideways_atr_min_pct': 0.023319274231629453, 'sideways_atr_max_pct': 0.045819395988147944, 'sideways_tp_mult': 2.766268390087503, 'sideways_tsl_mult': 0.543832407509808, 'sideways_time_stop': 124, 'sideways_use_sma': False, 'sideways_use_ema': True, 'sideways_use_atr': True, 'sideways_use_adx': False, 'sideways_use_spike': True, 'sideways_rsi_required': True}.
[I 2025-09-01 14:47:39,318] Trial 360 finished with values: [-1000000000.0, 1000000000.0] and parameters: {'p_sma': 12, 'p_std': 27, 'p_atr': 22, 'p_adx': 27, 'rsi_period': 54, 'ema1': 28, 'ema2': 16, 'slip_atr_k': 0.05125898343350424, 'slip_spread_k': 0.17776828676262602, 'spread_hl_frac': 0.04513204698082122, 'bb_std_mult': 1.207245967067116, 'rsi_os': 50, 'rsi_ob': 76, 'vol_spike': 0.18510822487202605, 'adx_thresh': 19.987353339048408, 'atr_min_pct': 0.004581770996473321, 'atr_max_pct': 0.091596063120289, 'tp_mult': 2.485453937149761, 'tsl_mult': 0.04416468790572624, 'strategy': 'breakout', 'time_stop': 285, 'use_sma': False, 'use_atr': False, 'use_adx': True, 'use_ema': False, 'use_spike': True, 'rsi_required': True, 'edge_k': 0.5109415481068956, 'edge_cap': 0.14275754966299614, 'bull_strategy': 'breakout', 'bull_bb_std_mult': 2.9723968026100667, 'bull_rsi_os': 16, 'bull_rsi_ob': 58, 'bull_adx_thresh': 29.127957452136428, 'bull_atr_min_pct': 0.020508122103272672, 'bull_atr_max_pct': 0.03273685790232539, 'bull_tp_mult': 2.2174319219879917, 'bull_tsl_mult': 0.47016173578404163, 'bull_time_stop': 13, 'bull_use_sma': True, 'bull_use_ema': False, 'bull_use_atr': False, 'bull_use_adx': True, 'bull_use_spike': True, 'bull_rsi_required': True, 'bear_strategy': 'mean_reversion', 'bear_bb_std_mult': 2.8178291539406914, 'bear_rsi_os': 10, 'bear_rsi_ob': 81, 'bear_adx_thresh': 29.18354752883326, 'bear_atr_min_pct': 0.023000120357775593, 'bear_atr_max_pct': 0.11040197717322292, 'bear_tp_mult': 2.344956518274442, 'bear_tsl_mult': 0.6259865965779637, 'bear_time_stop': 282, 'bear_use_sma': False, 'bear_use_ema': False, 'bear_use_atr': False, 'bear_use_adx': True, 'bear_use_spike': True, 'bear_rsi_required': True, 'sideways_strategy': 'breakout', 'sideways_bb_std_mult': 3.354721661322123, 'sideways_rsi_os': 28, 'sideways_rsi_ob': 90, 'sideways_adx_thresh': 7.022128495430695, 'sideways_atr_min_pct': 0.018751776912777074, 'sideways_atr_max_pct': 0.13783803827764485, 'sideways_tp_mult': 1.8349741265323092, 'sideways_tsl_mult': 0.814979037335369, 'sideways_time_stop': 286, 'sideways_use_sma': True, 'sideways_use_ema': False, 'sideways_use_atr': True, 'sideways_use_adx': True, 'sideways_use_spike': False, 'sideways_rsi_required': False}.
[I 2025-09-01 14:47:42,441] Trial 359 finished with values: [-0.029204505480651788, 0.029239473159770116] and parameters: {'p_sma': 24, 'p_std': 6, 'p_atr': 16, 'p_adx': 26, 'rsi_period': 33, 'ema1': 28, 'ema2': 50, 'slip_atr_k': 0.05085451518195012, 'slip_spread_k': 0.24650148764693297, 'spread_hl_frac': 0.015935895602464424, 'bb_std_mult': 1.5465887620427305, 'rsi_os': 30, 'rsi_ob': 76, 'vol_spike': 0.29984674118977783, 'adx_thresh': 18.61206854705413, 'atr_min_pct': 0.021405833311457907, 'atr_max_pct': 0.05672045716334137, 'tp_mult': 1.2082909606252286, 'tsl_mult': 0.049714184752698384, 'strategy': 'breakout', 'time_stop': 61, 'use_sma': False, 'use_atr': False, 'use_adx': False, 'use_ema': True, 'use_spike': True, 'rsi_required': True, 'edge_k': 1.4537813152445918, 'edge_cap': 0.18619263752203424, 'bull_strategy': 'mean_reversion', 'bull_bb_std_mult': 2.9706472033684936, 'bull_rsi_os': 42, 'bull_rsi_ob': 50, 'bull_adx_thresh': 29.08598712926394, 'bull_atr_min_pct': 8.28355406639605e-06, 'bull_atr_max_pct': 0.10376891689866344, 'bull_tp_mult': 1.1887158706571532, 'bull_tsl_mult': 0.2543137631607261, 'bull_time_stop': 231, 'bull_use_sma': False, 'bull_use_ema': True, 'bull_use_atr': False, 'bull_use_adx': True, 'bull_use_spike': True, 'bull_rsi_required': False, 'bear_strategy': 'mean_reversion', 'bear_bb_std_mult': 2.9521298111244065, 'bear_rsi_os': 9, 'bear_rsi_ob': 81, 'bear_adx_thresh': 15.09279380348206, 'bear_atr_min_pct': 0.02320547295116874, 'bear_atr_max_pct': 0.1113757385516355, 'bear_tp_mult': 1.6539431805825717, 'bear_tsl_mult': 0.6284392317817168, 'bear_time_stop': 281, 'bear_use_sma': False, 'bear_use_ema': True, 'bear_use_atr': False, 'bear_use_adx': True, 'bear_use_spike': True, 'bear_rsi_required': False, 'sideways_strategy': 'breakout', 'sideways_bb_std_mult': 3.3758593946709725, 'sideways_rsi_os': 14, 'sideways_rsi_ob': 89, 'sideways_adx_thresh': 7.054587957978477, 'sideways_atr_min_pct': 0.026307893414375956, 'sideways_atr_max_pct': 0.02259352652870255, 'sideways_tp_mult': 1.618213490851939, 'sideways_tsl_mult': 0.23116165547987605, 'sideways_time_stop': 292, 'sideways_use_sma': True, 'sideways_use_ema': True, 'sideways_use_atr': True, 'sideways_use_adx': False, 'sideways_use_spike': True, 'sideways_rsi_required': True}.
[I 2025-09-01 14:47:43,100] Trial 357 finished with values: [-1000000000.0, 1000000000.0] and parameters: {'p_sma': 10, 'p_std': 20, 'p_atr': 16, 'p_adx': 15, 'rsi_period': 65, 'ema1': 29, 'ema2': 32, 'slip_atr_k': 0.05047395746851345, 'slip_spread_k': 0.8761221128595876, 'spread_hl_frac': 4.4747095209199395e-05, 'bb_std_mult': 1.5207073621944711, 'rsi_os': 37, 'rsi_ob': 53, 'vol_spike': 0.29145915456495824, 'adx_thresh': 20.291829231300717, 'atr_min_pct': 0.015844217412844676, 'atr_max_pct': 0.07887041393089383, 'tp_mult': 2.8036769078748485, 'tsl_mult': 0.10232446166673875, 'strategy': 'breakout', 'time_stop': 62, 'use_sma': False, 'use_atr': True, 'use_adx': False, 'use_ema': True, 'use_spike': True, 'rsi_required': False, 'edge_k': 0.04712658889971444, 'edge_cap': 0.14923585678980195, 'bull_strategy': 'mean_reversion', 'bull_bb_std_mult': 2.9601568648051213, 'bull_rsi_os': 42, 'bull_rsi_ob': 62, 'bull_adx_thresh': 29.156274225259487, 'bull_atr_min_pct': 0.0024295578855439807, 'bull_atr_max_pct': 0.019588277870861842, 'bull_tp_mult': 2.1437754037374335, 'bull_tsl_mult': 0.2572731063866641, 'bull_time_stop': 188, 'bull_use_sma': False, 'bull_use_ema': True, 'bull_use_atr': False, 'bull_use_adx': True, 'bull_use_spike': False, 'bull_rsi_required': False, 'bear_strategy': 'mean_reversion', 'bear_bb_std_mult': 2.9895824112453986, 'bear_rsi_os': 38, 'bear_rsi_ob': 81, 'bear_adx_thresh': 9.72534382840658, 'bear_atr_min_pct': 0.025476042493872555, 'bear_atr_max_pct': 0.11459905251574047, 'bear_tp_mult': 1.6448736453900776, 'bear_tsl_mult': 0.6223217947691276, 'bear_time_stop': 282, 'bear_use_sma': False, 'bear_use_ema': True, 'bear_use_atr': False, 'bear_use_adx': True, 'bear_use_spike': False, 'bear_rsi_required': False, 'sideways_strategy': 'mean_reversion', 'sideways_bb_std_mult': 0.9568348232903192, 'sideways_rsi_os': 14, 'sideways_rsi_ob': 89, 'sideways_adx_thresh': 28.813260779916586, 'sideways_atr_min_pct': 0.005489147236775775, 'sideways_atr_max_pct': 0.08864349513402989, 'sideways_tp_mult': 1.6349506527238917, 'sideways_tsl_mult': 0.6533417238453113, 'sideways_time_stop': 110, 'sideways_use_sma': False, 'sideways_use_ema': True, 'sideways_use_atr': True, 'sideways_use_adx': False, 'sideways_use_spike': True, 'sideways_rsi_required': True}.
