[I 2025-09-01 13:58:53,870] Trial 38 finished with values: [-1000000000.0, 1000000000.0] and parameters: {'p_sma': 43, 'p_std': 54, 'p_atr': 29, 'p_adx': 18, 'rsi_period': 76, 'ema1': 15, 'ema2': 44, 'slip_atr_k': 0.20224538353450122, 'slip_spread_k': 0.3912295315770034, 'spread_hl_frac': 0.019585784622219108, 'bb_std_mult': 3.103856604938197, 'rsi_os': 41, 'rsi_ob': 66, 'vol_spike': 0.034501404877013156, 'adx_thresh': 25.01060069657334, 'atr_min_pct': 0.008544893588418458, 'atr_max_pct': 0.06277293458274402, 'tp_mult': 1.6288399168758614, 'tsl_mult': 0.31564464575710505, 'strategy': 'mean_reversion', 'time_stop': 56, 'use_sma': False, 'use_atr': False, 'use_adx': True, 'use_ema': False, 'use_spike': True, 'rsi_required': True, 'edge_k': 1.113896846240605, 'edge_cap': 0.7407681150330481, 'bull_strategy': 'mean_reversion', 'bull_bb_std_mult': 1.1512981947119887, 'bull_rsi_os': 26, 'bull_rsi_ob': 53, 'bull_adx_thresh': 7.020795234464023, 'bull_atr_min_pct': 0.004803963364584768, 'bull_atr_max_pct': 0.023824980937458877, 'bull_tp_mult': 1.020183302232254, 'bull_tsl_mult': 0.48666981616114985, 'bull_time_stop': 52, 'bull_use_sma': True, 'bull_use_ema': False, 'bull_use_atr': True, 'bull_use_adx': False, 'bull_use_spike': True, 'bull_rsi_required': True, 'bear_strategy': 'mean_reversion', 'bear_bb_std_mult': 0.8137658877046255, 'bear_rsi_os': 8, 'bear_rsi_ob': 65, 'bear_adx_thresh': 22.40984539970289, 'bear_atr_min_pct': 0.01249422577040146, 'bear_atr_max_pct': 0.045461554961951284, 'bear_tp_mult': 2.7570566727792296, 'bear_tsl_mult': 0.5791337457460624, 'bear_time_stop': 78, 'bear_use_sma': True, 'bear_use_ema': False, 'bear_use_atr': False, 'bear_use_adx': False, 'bear_use_spike': True, 'bear_rsi_required': True, 'sideways_strategy': 'breakout', 'sideways_bb_std_mult': 3.5952048224482533, 'sideways_rsi_os': 35, 'sideways_rsi_ob': 59, 'sideways_adx_thresh': 21.096242835226512, 'sideways_atr_min_pct': 0.011654865527004267, 'sideways_atr_max_pct': 0.06517719055481651, 'sideways_tp_mult': 2.3979954163348545, 'sideways_tsl_mult': 0.9980031935682572, 'sideways_time_stop': 43, 'sideways_use_sma': False, 'sideways_use_ema': False, 'sideways_use_atr': True, 'sideways_use_adx': True, 'sideways_use_spike': False, 'sideways_rsi_required': False}.
[I 2025-09-01 13:58:54,323] Trial 34 finished with values: [-1000000000.0, 1000000000.0] and parameters: {'p_sma': 36, 'p_std': 54, 'p_atr': 20, 'p_adx': 19, 'rsi_period': 54, 'ema1': 19, 'ema2': 43, 'slip_atr_k': 0.19868885824932192, 'slip_spread_k': 0.3950064824261519, 'spread_hl_frac': 0.028561326929074496, 'bb_std_mult': 2.15469622397152, 'rsi_os': 32, 'rsi_ob': 66, 'vol_spike': 0.06946884829507037, 'adx_thresh': 21.760554529129408, 'atr_min_pct': 0.009297717657376236, 'atr_max_pct': 0.14099947440892985, 'tp_mult': 1.8191824997966741, 'tsl_mult': 0.3455308724177375, 'strategy': 'mean_reversion', 'time_stop': 78, 'use_sma': False, 'use_atr': False, 'use_adx': True, 'use_ema': False, 'use_spike': False, 'rsi_required': True, 'edge_k': 0.45875561799346554, 'edge_cap': 0.2176899715637013, 'bull_strategy': 'mean_reversion', 'bull_bb_std_mult': 0.8613286709983105, 'bull_rsi_os': 36, 'bull_rsi_ob': 53, 'bull_adx_thresh': 6.558315325560342, 'bull_atr_min_pct': 0.004770219772880448, 'bull_atr_max_pct': 0.1343670335157706, 'bull_tp_mult': 2.119718400305077, 'bull_tsl_mult': 0.4998015899055716, 'bull_time_stop': 92, 'bull_use_sma': True, 'bull_use_ema': True, 'bull_use_atr': True, 'bull_use_adx': True, 'bull_use_spike': True, 'bull_rsi_required': True, 'bear_strategy': 'breakout', 'bear_bb_std_mult': 0.803835646535359, 'bear_rsi_os': 14, 'bear_rsi_ob': 77, 'bear_adx_thresh': 15.433451437038087, 'bear_atr_min_pct': 0.024000859914138743, 'bear_atr_max_pct': 0.04434545658419453, 'bear_tp_mult': 2.5321564951574156, 'bear_tsl_mult': 0.15567638341083934, 'bear_time_stop': 198, 'bear_use_sma': True, 'bear_use_ema': False, 'bear_use_atr': True, 'bear_use_adx': False, 'bear_use_spike': True, 'bear_rsi_required': True, 'sideways_strategy': 'breakout', 'sideways_bb_std_mult': 3.284029619677165, 'sideways_rsi_os': 33, 'sideways_rsi_ob': 57, 'sideways_adx_thresh': 18.17163929378426, 'sideways_atr_min_pct': 0.01584435078919935, 'sideways_atr_max_pct': 0.062184257813254845, 'sideways_tp_mult': 2.057305678991491, 'sideways_tsl_mult': 0.7599266718602226, 'sideways_time_stop': 75, 'sideways_use_sma': True, 'sideways_use_ema': False, 'sideways_use_atr': True, 'sideways_use_adx': True, 'sideways_use_spike': False, 'sideways_rsi_required': False}.
[I 2025-09-01 13:58:54,653] Trial 36 finished with values: [-1000000000.0, 1000000000.0] and parameters: {'p_sma': 35, 'p_std': 46, 'p_atr': 23, 'p_adx': 18, 'rsi_period': 52, 'ema1': 19, 'ema2': 44, 'slip_atr_k': 0.19694464434187964, 'slip_spread_k': 0.42003075138907103, 'spread_hl_frac': 0.028379038545003094, 'bb_std_mult': 2.1098473595094456, 'rsi_os': 34, 'rsi_ob': 66, 'vol_spike': 0.07763056606059474, 'adx_thresh': 21.135644886232747, 'atr_min_pct': 0.009396467198681695, 'atr_max_pct': 0.11607712136128381, 'tp_mult': 1.8490661661144927, 'tsl_mult': 0.33230394861037593, 'strategy': 'mean_reversion', 'time_stop': 92, 'use_sma': False, 'use_atr': False, 'use_adx': True, 'use_ema': False, 'use_spike': False, 'rsi_required': True, 'edge_k': 0.4521470889318895, 'edge_cap': 0.7272496285233194, 'bull_strategy': 'mean_reversion', 'bull_bb_std_mult': 0.9009502482962302, 'bull_rsi_os': 36, 'bull_rsi_ob': 49, 'bull_adx_thresh': 6.966697355959843, 'bull_atr_min_pct': 0.013601006938083304, 'bull_atr_max_pct': 0.02371320288976886, 'bull_tp_mult': 2.1170030958936428, 'bull_tsl_mult': 0.41457045830439126, 'bull_time_stop': 88, 'bull_use_sma': True, 'bull_use_ema': True, 'bull_use_atr': True, 'bull_use_adx': True, 'bull_use_spike': True, 'bull_rsi_required': True, 'bear_strategy': 'breakout', 'bear_bb_std_mult': 0.764143209857533, 'bear_rsi_os': 14, 'bear_rsi_ob': 92, 'bear_adx_thresh': 15.422585457180453, 'bear_atr_min_pct': 0.0121576540870534, 'bear_atr_max_pct': 0.04458553591464725, 'bear_tp_mult': 2.7458366360098103, 'bear_tsl_mult': 0.13576483292723152, 'bear_time_stop': 205, 'bear_use_sma': True, 'bear_use_ema': False, 'bear_use_atr': True, 'bear_use_adx': False, 'bear_use_spike': True, 'bear_rsi_required': False, 'sideways_strategy': 'breakout', 'sideways_bb_std_mult': 0.8932574386059515, 'sideways_rsi_os': 33, 'sideways_rsi_ob': 58, 'sideways_adx_thresh': 24.655165316981755, 'sideways_atr_min_pct': 0.008070866529985225, 'sideways_atr_max_pct': 0.08219594387937539, 'sideways_tp_mult': 2.103695732490969, 'sideways_tsl_mult': 0.999884533075799, 'sideways_time_stop': 95, 'sideways_use_sma': True, 'sideways_use_ema': False, 'sideways_use_atr': False, 'sideways_use_adx': True, 'sideways_use_spike': True, 'sideways_rsi_required': False}.
[I 2025-09-01 13:59:28,934] Trial 40 finished with values: [-1000000000.0, 1000000000.0] and parameters: {'p_sma': 25, 'p_std': 45, 'p_atr': 24, 'p_adx': 15, 'rsi_period': 35, 'ema1': 12, 'ema2': 29, 'slip_atr_k': 0.22947866357260394, 'slip_spread_k': 0.6229222069032844, 'spread_hl_frac': 0.038075932942510896, 'bb_std_mult': 2.478865411700097, 'rsi_os': 21, 'rsi_ob': 58, 'vol_spike': 0.025248101211036038, 'adx_thresh': 19.305353125882544, 'atr_min_pct': 0.00934778113409599, 'atr_max_pct': 0.030354035078248326, 'tp_mult': 2.443251241740527, 'tsl_mult': 0.1889423268020046, 'strategy': 'breakout', 'time_stop': 285, 'use_sma': False, 'use_atr': True, 'use_adx': True, 'use_ema': True, 'use_spike': True, 'rsi_required': False, 'edge_k': 1.072825101735904, 'edge_cap': 0.5200265857878994, 'bull_strategy': 'mean_reversion', 'bull_bb_std_mult': 3.1555048822894403, 'bull_rsi_os': 36, 'bull_rsi_ob': 60, 'bull_adx_thresh': 10.650990125177799, 'bull_atr_min_pct': 0.02609534470129219, 'bull_atr_max_pct': 0.05338036205786849, 'bull_tp_mult': 1.8364978816593764, 'bull_tsl_mult': 0.8244846444145484, 'bull_time_stop': 122, 'bull_use_sma': True, 'bull_use_ema': True, 'bull_use_atr': True, 'bull_use_adx': False, 'bull_use_spike': False, 'bull_rsi_required': False, 'bear_strategy': 'breakout', 'bear_bb_std_mult': 1.4067511299398323, 'bear_rsi_os': 34, 'bear_rsi_ob': 86, 'bear_adx_thresh': 32.04202919670872, 'bear_atr_min_pct': 0.02789936329657332, 'bear_atr_max_pct': 0.06788165121146798, 'bear_tp_mult': 1.7489895770098942, 'bear_tsl_mult': 0.07957710418327055, 'bear_time_stop': 202, 'bear_use_sma': True, 'bear_use_ema': True, 'bear_use_atr': False, 'bear_use_adx': False, 'bear_use_spike': True, 'bear_rsi_required': False, 'sideways_strategy': 'mean_reversion', 'sideways_bb_std_mult': 2.796800757456078, 'sideways_rsi_os': 18, 'sideways_rsi_ob': 51, 'sideways_adx_thresh': 18.795133260397137, 'sideways_atr_min_pct': 0.0063878038991264045, 'sideways_atr_max_pct': 0.11626450776298294, 'sideways_tp_mult': 2.049513240001563, 'sideways_tsl_mult': 0.37073006682581555, 'sideways_time_stop': 140, 'sideways_use_sma': False, 'sideways_use_ema': False, 'sideways_use_atr': False, 'sideways_use_adx': False, 'sideways_use_spike': True, 'sideways_rsi_required': False}.
[I 2025-09-01 13:59:29,195] Trial 41 finished with values: [-1000000000.0, 1000000000.0] and parameters: {'p_sma': 27, 'p_std': 45, 'p_atr': 24, 'p_adx': 14, 'rsi_period': 15, 'ema1': 27, 'ema2': 29, 'slip_atr_k': 0.22945313548294194, 'slip_spread_k': 0.6543918520358046, 'spread_hl_frac': 0.011963521129149663, 'bb_std_mult': 2.5291663846501287, 'rsi_os': 35, 'rsi_ob': 58, 'vol_spike': 0.02595787281712353, 'adx_thresh': 28.4175483607574, 'atr_min_pct': 0.024851036745957757, 'atr_max_pct': 0.02974884777338293, 'tp_mult': 1.382170210435476, 'tsl_mult': 0.7860876077912868, 'strategy': 'breakout', 'time_stop': 283, 'use_sma': True, 'use_atr': True, 'use_adx': True, 'use_ema': True, 'use_spike': True, 'rsi_required': False, 'edge_k': 0.02343408387817858, 'edge_cap': 0.8496286237282044, 'bull_strategy': 'breakout', 'bull_bb_std_mult': 2.995122651609977, 'bull_rsi_os': 23, 'bull_rsi_ob': 60, 'bull_adx_thresh': 10.283870299828148, 'bull_atr_min_pct': 0.026923084206300706, 'bull_atr_max_pct': 0.1062060474625012, 'bull_tp_mult': 1.8726639526225943, 'bull_tsl_mult': 0.8287483404393403, 'bull_time_stop': 130, 'bull_use_sma': False, 'bull_use_ema': False, 'bull_use_atr': True, 'bull_use_adx': False, 'bull_use_spike': False, 'bull_rsi_required': False, 'bear_strategy': 'mean_reversion', 'bear_bb_std_mult': 2.136340577115392, 'bear_rsi_os': 29, 'bear_rsi_ob': 87, 'bear_adx_thresh': 31.626166948160716, 'bear_atr_min_pct': 0.027011523210179467, 'bear_atr_max_pct': 0.06894592564781724, 'bear_tp_mult': 1.9696554317383228, 'bear_tsl_mult': 0.0743164524407611, 'bear_time_stop': 35, 'bear_use_sma': False, 'bear_use_ema': True, 'bear_use_atr': False, 'bear_use_adx': False, 'bear_use_spike': True, 'bear_rsi_required': False, 'sideways_strategy': 'mean_reversion', 'sideways_bb_std_mult': 0.9312379505277264, 'sideways_rsi_os': 18, 'sideways_rsi_ob': 51, 'sideways_adx_thresh': 32.609076881770285, 'sideways_atr_min_pct': 0.007916279087365967, 'sideways_atr_max_pct': 0.11542414203255957, 'sideways_tp_mult': 1.5287095038016452, 'sideways_tsl_mult': 0.36267707414626815, 'sideways_time_stop': 41, 'sideways_use_sma': False, 'sideways_use_ema': False, 'sideways_use_atr': False, 'sideways_use_adx': False, 'sideways_use_spike': True, 'sideways_rsi_required': False}.
[I 2025-09-01 13:59:29,434] Trial 42 finished with values: [-1000000000.0, 1000000000.0] and parameters: {'p_sma': 26, 'p_std': 44, 'p_atr': 7, 'p_adx': 14, 'rsi_period': 33, 'ema1': 12, 'ema2': 21, 'slip_atr_k': 0.22380127015476664, 'slip_spread_k': 0.4902354480318527, 'spread_hl_frac': 0.013036114279400803, 'bb_std_mult': 2.569319395927718, 'rsi_os': 45, 'rsi_ob': 58, 'vol_spike': 0.02472041053553589, 'adx_thresh': 19.15969728393354, 'atr_min_pct': 0.01391728423406376, 'atr_max_pct': 0.0944843351126873, 'tp_mult': 2.3617431207738053, 'tsl_mult': 0.2055670195615758, 'strategy': 'breakout', 'time_stop': 273, 'use_sma': True, 'use_atr': True, 'use_adx': False, 'use_ema': True, 'use_spike': True, 'rsi_required': False, 'edge_k': 1.048240533541832, 'edge_cap': 0.8700367798708226, 'bull_strategy': 'breakout', 'bull_bb_std_mult': 1.2333560069576899, 'bull_rsi_os': 22, 'bull_rsi_ob': 68, 'bull_adx_thresh': 10.635416921945799, 'bull_atr_min_pct': 0.02671248983825694, 'bull_atr_max_pct': 0.10671575003141245, 'bull_tp_mult': 1.8248684579214949, 'bull_tsl_mult': 0.11605657080930659, 'bull_time_stop': 124, 'bull_use_sma': False, 'bull_use_ema': False, 'bull_use_atr': True, 'bull_use_adx': False, 'bull_use_spike': False, 'bull_rsi_required': False, 'bear_strategy': 'mean_reversion', 'bear_bb_std_mult': 2.092546399674207, 'bear_rsi_os': 8, 'bear_rsi_ob': 86, 'bear_adx_thresh': 30.90128210436245, 'bear_atr_min_pct': 0.027886132136934246, 'bear_atr_max_pct': 0.017276494557818108, 'bear_tp_mult': 2.3053968396536413, 'bear_tsl_mult': 0.06945801933303963, 'bear_time_stop': 267, 'bear_use_sma': False, 'bear_use_ema': True, 'bear_use_atr': False, 'bear_use_adx': False, 'bear_use_spike': True, 'bear_rsi_required': True, 'sideways_strategy': 'mean_reversion', 'sideways_bb_std_mult': 2.821684235349625, 'sideways_rsi_os': 9, 'sideways_rsi_ob': 75, 'sideways_adx_thresh': 17.65595710485452, 'sideways_atr_min_pct': 0.011754846734513708, 'sideways_atr_max_pct': 0.11767593815936384, 'sideways_tp_mult': 2.7400639628994248, 'sideways_tsl_mult': 0.36336174145178735, 'sideways_time_stop': 32, 'sideways_use_sma': False, 'sideways_use_ema': False, 'sideways_use_atr': False, 'sideways_use_adx': False, 'sideways_use_spike': True, 'sideways_rsi_required': True}.
[I 2025-09-01 13:59:29,570] Trial 39 finished with values: [-1000000000.0, 1000000000.0] and parameters: {'p_sma': 26, 'p_std': 44, 'p_atr': 24, 'p_adx': 16, 'rsi_period': 29, 'ema1': 27, 'ema2': 30, 'slip_atr_k': 0.22547980355184566, 'slip_spread_k': 0.6442832554298589, 'spread_hl_frac': 0.012036424609047337, 'bb_std_mult': 2.6318647315137382, 'rsi_os': 35, 'rsi_ob': 58, 'vol_spike': 0.029707728542323966, 'adx_thresh': 19.346984659006203, 'atr_min_pct': 0.009506185419075568, 'atr_max_pct': 0.03013137541994807, 'tp_mult': 1.3263601991012925, 'tsl_mult': 0.21367592922428913, 'strategy': 'breakout', 'time_stop': 285, 'use_sma': False, 'use_atr': True, 'use_adx': True, 'use_ema': True, 'use_spike': True, 'rsi_required': False, 'edge_k': 0.033765286569115927, 'edge_cap': 0.5099529460127856, 'bull_strategy': 'mean_reversion', 'bull_bb_std_mult': 2.934556217986829, 'bull_rsi_os': 22, 'bull_rsi_ob': 60, 'bull_adx_thresh': 10.575833443835858, 'bull_atr_min_pct': 0.02661041011231742, 'bull_atr_max_pct': 0.05186740112166262, 'bull_tp_mult': 1.839433865994447, 'bull_tsl_mult': 0.0011260121841911337, 'bull_time_stop': 126, 'bull_use_sma': True, 'bull_use_ema': True, 'bull_use_atr': True, 'bull_use_adx': False, 'bull_use_spike': False, 'bull_rsi_required': False, 'bear_strategy': 'breakout', 'bear_bb_std_mult': 2.100029299635641, 'bear_rsi_os': 30, 'bear_rsi_ob': 54, 'bear_adx_thresh': 30.773956417606854, 'bear_atr_min_pct': 0.008439188630182302, 'bear_atr_max_pct': 0.06782018315242508, 'bear_tp_mult': 2.062320294932345, 'bear_tsl_mult': 0.061440015329498665, 'bear_time_stop': 202, 'bear_use_sma': True, 'bear_use_ema': True, 'bear_use_atr': False, 'bear_use_adx': False, 'bear_use_spike': True, 'bear_rsi_required': False, 'sideways_strategy': 'mean_reversion', 'sideways_bb_std_mult': 0.7414120720355539, 'sideways_rsi_os': 19, 'sideways_rsi_ob': 51, 'sideways_adx_thresh': 17.95563279667479, 'sideways_atr_min_pct': 0.008062091681708227, 'sideways_atr_max_pct': 0.08335634507663855, 'sideways_tp_mult': 1.4796336441878475, 'sideways_tsl_mult': 0.35161029029757107, 'sideways_time_stop': 144, 'sideways_use_sma': False, 'sideways_use_ema': False, 'sideways_use_atr': False, 'sideways_use_adx': False, 'sideways_use_spike': True, 'sideways_rsi_required': False}.
[I 2025-09-01 13:59:29,846] Trial 45 finished with values: [-1000000000.0, 1000000000.0] and parameters: {'p_sma': 46, 'p_std': 32, 'p_atr': 26, 'p_adx': 30, 'rsi_period': 67, 'ema1': 25, 'ema2': 38, 'slip_atr_k': 0.11360311281295749, 'slip_spread_k': 0.7941509200543074, 'spread_hl_frac': 0.006801717160342134, 'bb_std_mult': 3.439437915458612, 'rsi_os': 20, 'rsi_ob': 48, 'vol_spike': 0.11657901915435043, 'adx_thresh': 25.479640542423937, 'atr_min_pct': 0.005625702915054889, 'atr_max_pct': 0.053589678415027805, 'tp_mult': 2.0594851288364846, 'tsl_mult': 0.5808139645477137, 'strategy': 'mean_reversion', 'time_stop': 174, 'use_sma': True, 'use_atr': False, 'use_adx': True, 'use_ema': False, 'use_spike': True, 'rsi_required': True, 'edge_k': 1.4693209225593649, 'edge_cap': 0.6552562310979435, 'bull_strategy': 'mean_reversion', 'bull_bb_std_mult': 2.248521084308706, 'bull_rsi_os': 16, 'bull_rsi_ob': 45, 'bull_adx_thresh': 28.801838741837393, 'bull_atr_min_pct': 0.0015908800228384547, 'bull_atr_max_pct': 0.09153139450796208, 'bull_tp_mult': 1.4080100276640977, 'bull_tsl_mult': 0.6097486220302669, 'bull_time_stop': 202, 'bull_use_sma': True, 'bull_use_ema': True, 'bull_use_atr': False, 'bull_use_adx': True, 'bull_use_spike': True, 'bull_rsi_required': True, 'bear_strategy': 'breakout', 'bear_bb_std_mult': 1.791333985148221, 'bear_rsi_os': 55, 'bear_rsi_ob': 68, 'bear_adx_thresh': 18.796315253015337, 'bear_atr_min_pct': 0.01814554972655197, 'bear_atr_max_pct': 0.01320680265719741, 'bear_tp_mult': 2.094430092055052, 'bear_tsl_mult': 0.8603665123142473, 'bear_time_stop': 229, 'bear_use_sma': True, 'bear_use_ema': False, 'bear_use_atr': True, 'bear_use_adx': True, 'bear_use_spike': False, 'bear_rsi_required': True, 'sideways_strategy': 'breakout', 'sideways_bb_std_mult': 2.436211534696003, 'sideways_rsi_os': 24, 'sideways_rsi_ob': 77, 'sideways_adx_thresh': 22.758960268431487, 'sideways_atr_min_pct': 0.014020011528044466, 'sideways_atr_max_pct': 0.05074299760457893, 'sideways_tp_mult': 2.2758435288106784, 'sideways_tsl_mult': 0.4654060304339862, 'sideways_time_stop': 129, 'sideways_use_sma': True, 'sideways_use_ema': False, 'sideways_use_atr': True, 'sideways_use_adx': True, 'sideways_use_spike': False, 'sideways_rsi_required': False}.
[I 2025-09-01 14:00:04,348] Trial 43 finished with values: [-1000000000.0, 1000000000.0] and parameters: {'p_sma': 46, 'p_std': 49, 'p_atr': 7, 'p_adx': 30, 'rsi_period': 19, 'ema1': 27, 'ema2': 60, 'slip_atr_k': 0.2242840945224022, 'slip_spread_k': 0.49630752499334796, 'spread_hl_frac': 0.012661857992416542, 'bb_std_mult': 3.086466405587431, 'rsi_os': 27, 'rsi_ob': 88, 'vol_spike': 0.13400623010228682, 'adx_thresh': 25.195485879006547, 'atr_min_pct': 0.025617663509255338, 'atr_max_pct': 0.09315282486660909, 'tp_mult': 2.774435939392051, 'tsl_mult': 0.7630438047234253, 'strategy': 'breakout', 'time_stop': 171, 'use_sma': True, 'use_atr': True, 'use_adx': False, 'use_ema': True, 'use_spike': True, 'rsi_required': False, 'edge_k': 1.5226870848256775, 'edge_cap': 0.637012900030986, 'bull_strategy': 'breakout', 'bull_bb_std_mult': 2.9055359944748065, 'bull_rsi_os': 23, 'bull_rsi_ob': 67, 'bull_adx_thresh': 27.69633225894666, 'bull_atr_min_pct': 0.018669175431268295, 'bull_atr_max_pct': 0.10335925461536116, 'bull_tp_mult': 1.3688682716260803, 'bull_tsl_mult': 0.576878627810277, 'bull_time_stop': 194, 'bull_use_sma': False, 'bull_use_ema': False, 'bull_use_atr': True, 'bull_use_adx': False, 'bull_use_spike': False, 'bull_rsi_required': False, 'bear_strategy': 'mean_reversion', 'bear_bb_std_mult': 2.1198819390968033, 'bear_rsi_os': 30, 'bear_rsi_ob': 55, 'bear_adx_thresh': 18.004689101839286, 'bear_atr_min_pct': 0.009879068071092569, 'bear_atr_max_pct': 0.020310860862152474, 'bear_tp_mult': 2.049611379399248, 'bear_tsl_mult': 0.7014204933979883, 'bear_time_stop': 116, 'bear_use_sma': False, 'bear_use_ema': True, 'bear_use_atr': False, 'bear_use_adx': False, 'bear_use_spike': True, 'bear_rsi_required': True, 'sideways_strategy': 'mean_reversion', 'sideways_bb_std_mult': 0.9039622597070855, 'sideways_rsi_os': 10, 'sideways_rsi_ob': 46, 'sideways_adx_thresh': 33.1675712443502, 'sideways_atr_min_pct': 0.011723116293857368, 'sideways_atr_max_pct': 0.05133002339851974, 'sideways_tp_mult': 2.698307261342162, 'sideways_tsl_mult': 0.5658731256670588, 'sideways_time_stop': 30, 'sideways_use_sma': False, 'sideways_use_ema': False, 'sideways_use_atr': True, 'sideways_use_adx': False, 'sideways_use_spike': False, 'sideways_rsi_required': True}.
