[I 2025-09-01 15:15:39,382] Trial 523 finished with values: [-1000000000.0, 1000000000.0] and parameters: {'p_sma': 27, 'p_std': 54, 'p_atr': 20, 'p_adx': 24, 'rsi_period': 67, 'ema1': 29, 'ema2': 13, 'slip_atr_k': 0.021515207781918178, 'slip_spread_k': 0.3461191460813937, 'spread_hl_frac': 0.017177062315805892, 'bb_std_mult': 2.4082571288794834, 'rsi_os': 35, 'rsi_ob': 50, 'vol_spike': 0.29996849397878855, 'adx_thresh': 27.38306715335566, 'atr_min_pct': 0.013175424846147116, 'atr_max_pct': 0.08415680858618882, 'tp_mult': 2.8428045302748552, 'tsl_mult': 0.045974682478631373, 'strategy': 'breakout', 'time_stop': 197, 'use_sma': False, 'use_atr': True, 'use_adx': True, 'use_ema': False, 'use_spike': True, 'rsi_required': False, 'edge_k': 0.4476900181188793, 'edge_cap': 0.17010682387055925, 'bull_strategy': 'breakout', 'bull_bb_std_mult': 3.073807481582869, 'bull_rsi_os': 18, 'bull_rsi_ob': 47, 'bull_adx_thresh': 10.624063516762606, 'bull_atr_min_pct': 0.0031014873925593145, 'bull_atr_max_pct': 0.07204696511104032, 'bull_tp_mult': 2.337856450082246, 'bull_tsl_mult': 0.8270541101113258, 'bull_time_stop': 120, 'bull_use_sma': False, 'bull_use_ema': True, 'bull_use_atr': False, 'bull_use_adx': True, 'bull_use_spike': False, 'bull_rsi_required': True, 'bear_strategy': 'breakout', 'bear_bb_std_mult': 2.9020559649796667, 'bear_rsi_os': 10, 'bear_rsi_ob': 76, 'bear_adx_thresh': 21.144357820958597, 'bear_atr_min_pct': 0.010989334914085037, 'bear_atr_max_pct': 0.11140169629734345, 'bear_tp_mult': 2.5454217740893665, 'bear_tsl_mult': 0.05279722443652668, 'bear_time_stop': 131, 'bear_use_sma': False, 'bear_use_ema': False, 'bear_use_atr': False, 'bear_use_adx': True, 'bear_use_spike': True, 'bear_rsi_required': False, 'sideways_strategy': 'mean_reversion', 'sideways_bb_std_mult': 3.259576140025026, 'sideways_rsi_os': 15, 'sideways_rsi_ob': 87, 'sideways_adx_thresh': 6.795253600769871, 'sideways_atr_min_pct': 0.004242581474937205, 'sideways_atr_max_pct': 0.13998950144325287, 'sideways_tp_mult': 1.7529970444639296, 'sideways_tsl_mult': 0.2892201610738821, 'sideways_time_stop': 112, 'sideways_use_sma': True, 'sideways_use_ema': True, 'sideways_use_atr': True, 'sideways_use_adx': True, 'sideways_use_spike': False, 'sideways_rsi_required': True}.
[I 2025-09-01 15:15:39,631] Trial 525 finished with values: [-0.00837538732388643, 0.00876077878227377] and parameters: {'p_sma': 43, 'p_std': 26, 'p_atr': 27, 'p_adx': 26, 'rsi_period': 43, 'ema1': 29, 'ema2': 33, 'slip_atr_k': 0.019306497027895886, 'slip_spread_k': 0.2962632596215759, 'spread_hl_frac': 0.016753147222403588, 'bb_std_mult': 1.3476978486830264, 'rsi_os': 52, 'rsi_ob': 71, 'vol_spike': 0.29999303257685267, 'adx_thresh': 29.550088067446268, 'atr_min_pct': 0.015136021962884045, 'atr_max_pct': 0.07681810072139132, 'tp_mult': 2.0277172299792645, 'tsl_mult': 0.033988261710368006, 'strategy': 'breakout', 'time_stop': 59, 'use_sma': True, 'use_atr': True, 'use_adx': True, 'use_ema': False, 'use_spike': True, 'rsi_required': False, 'edge_k': 0.57908094607776, 'edge_cap': 0.5962353712327437, 'bull_strategy': 'breakout', 'bull_bb_std_mult': 1.2473948378475581, 'bull_rsi_os': 18, 'bull_rsi_ob': 50, 'bull_adx_thresh': 20.452911160303255, 'bull_atr_min_pct': 0.0029926122020683503, 'bull_atr_max_pct': 0.033000303458893356, 'bull_tp_mult': 2.3434099757260816, 'bull_tsl_mult': 0.2499428040753695, 'bull_time_stop': 161, 'bull_use_sma': True, 'bull_use_ema': True, 'bull_use_atr': False, 'bull_use_adx': True, 'bull_use_spike': False, 'bull_rsi_required': True, 'bear_strategy': 'breakout', 'bear_bb_std_mult': 2.419805334405514, 'bear_rsi_os': 37, 'bear_rsi_ob': 76, 'bear_adx_thresh': 34.06328265155721, 'bear_atr_min_pct': 0.006511314423915077, 'bear_atr_max_pct': 0.018132483994480898, 'bear_tp_mult': 2.532567944168353, 'bear_tsl_mult': 0.6507952550930691, 'bear_time_stop': 264, 'bear_use_sma': False, 'bear_use_ema': False, 'bear_use_atr': False, 'bear_use_adx': True, 'bear_use_spike': False, 'bear_rsi_required': False, 'sideways_strategy': 'mean_reversion', 'sideways_bb_std_mult': 3.275988520117544, 'sideways_rsi_os': 16, 'sideways_rsi_ob': 87, 'sideways_adx_thresh': 6.7295889484015925, 'sideways_atr_min_pct': 0.028127247623987092, 'sideways_atr_max_pct': 0.14001413637697196, 'sideways_tp_mult': 2.6783593967640766, 'sideways_tsl_mult': 0.427355083973919, 'sideways_time_stop': 200, 'sideways_use_sma': True, 'sideways_use_ema': False, 'sideways_use_atr': True, 'sideways_use_adx': True, 'sideways_use_spike': True, 'sideways_rsi_required': True}.
[I 2025-09-01 15:15:40,064] Trial 522 finished with values: [-1000000000.0, 1000000000.0] and parameters: {'p_sma': 10, 'p_std': 54, 'p_atr': 8, 'p_adx': 24, 'rsi_period': 66, 'ema1': 30, 'ema2': 50, 'slip_atr_k': 0.1025217040499015, 'slip_spread_k': 0.21633561968913054, 'spread_hl_frac': 0.01318351802072217, 'bb_std_mult': 1.5231526785065574, 'rsi_os': 38, 'rsi_ob': 71, 'vol_spike': 0.29932965611373685, 'adx_thresh': 29.277801373080727, 'atr_min_pct': 0.02911446506624785, 'atr_max_pct': 0.08249637852347874, 'tp_mult': 2.0213994049079345, 'tsl_mult': 0.915321423027617, 'strategy': 'breakout', 'time_stop': 50, 'use_sma': False, 'use_atr': True, 'use_adx': True, 'use_ema': False, 'use_spike': True, 'rsi_required': False, 'edge_k': 0.46768364228283177, 'edge_cap': 0.6070056287208515, 'bull_strategy': 'breakout', 'bull_bb_std_mult': 0.9184924310067448, 'bull_rsi_os': 18, 'bull_rsi_ob': 47, 'bull_adx_thresh': 29.75234090643462, 'bull_atr_min_pct': 0.0030761289232028102, 'bull_atr_max_pct': 0.07878471956664304, 'bull_tp_mult': 1.1658956357036887, 'bull_tsl_mult': 0.2392882491579401, 'bull_time_stop': 153, 'bull_use_sma': False, 'bull_use_ema': True, 'bull_use_atr': True, 'bull_use_adx': True, 'bull_use_spike': False, 'bull_rsi_required': True, 'bear_strategy': 'breakout', 'bear_bb_std_mult': 2.895666200439185, 'bear_rsi_os': 9, 'bear_rsi_ob': 79, 'bear_adx_thresh': 23.068826012260086, 'bear_atr_min_pct': 0.023027857552511133, 'bear_atr_max_pct': 0.10983897493146456, 'bear_tp_mult': 2.4295181926488976, 'bear_tsl_mult': 0.7246067241171137, 'bear_time_stop': 256, 'bear_use_sma': False, 'bear_use_ema': False, 'bear_use_atr': False, 'bear_use_adx': True, 'bear_use_spike': True, 'bear_rsi_required': False, 'sideways_strategy': 'mean_reversion', 'sideways_bb_std_mult': 3.2535696279260398, 'sideways_rsi_os': 15, 'sideways_rsi_ob': 94, 'sideways_adx_thresh': 8.116866232372768, 'sideways_atr_min_pct': 0.004233540472344076, 'sideways_atr_max_pct': 0.08848868926404184, 'sideways_tp_mult': 1.7585499086884928, 'sideways_tsl_mult': 0.3380853131722691, 'sideways_time_stop': 222, 'sideways_use_sma': True, 'sideways_use_ema': True, 'sideways_use_atr': True, 'sideways_use_adx': True, 'sideways_use_spike': False, 'sideways_rsi_required': True}.
[I 2025-09-01 15:15:40,171] Trial 524 finished with values: [-1000000000.0, 1000000000.0] and parameters: {'p_sma': 11, 'p_std': 10, 'p_atr': 19, 'p_adx': 26, 'rsi_period': 44, 'ema1': 29, 'ema2': 30, 'slip_atr_k': 0.05878223652228021, 'slip_spread_k': 0.293743488091327, 'spread_hl_frac': 0.028403161604699207, 'bb_std_mult': 1.523423879858969, 'rsi_os': 52, 'rsi_ob': 46, 'vol_spike': 0.2995015264037409, 'adx_thresh': 21.28520103962946, 'atr_min_pct': 0.0012751179260065935, 'atr_max_pct': 0.06829134936677012, 'tp_mult': 2.8390817932097154, 'tsl_mult': 0.04527069815756335, 'strategy': 'breakout', 'time_stop': 51, 'use_sma': True, 'use_atr': True, 'use_adx': True, 'use_ema': False, 'use_spike': True, 'rsi_required': False, 'edge_k': 0.5110411609522365, 'edge_cap': 0.17061371120819113, 'bull_strategy': 'breakout', 'bull_bb_std_mult': 1.9764656888310563, 'bull_rsi_os': 30, 'bull_rsi_ob': 50, 'bull_adx_thresh': 29.729115784363394, 'bull_atr_min_pct': 0.0029541206974536007, 'bull_atr_max_pct': 0.017384848683664914, 'bull_tp_mult': 2.577091091048316, 'bull_tsl_mult': 0.34831518490688274, 'bull_time_stop': 154, 'bull_use_sma': False, 'bull_use_ema': False, 'bull_use_atr': False, 'bull_use_adx': True, 'bull_use_spike': False, 'bull_rsi_required': True, 'bear_strategy': 'mean_reversion', 'bear_bb_std_mult': 2.423658363995745, 'bear_rsi_os': 10, 'bear_rsi_ob': 76, 'bear_adx_thresh': 9.820550949914553, 'bear_atr_min_pct': 0.02246455093002412, 'bear_atr_max_pct': 0.11254870199009313, 'bear_tp_mult': 2.608190874107794, 'bear_tsl_mult': 0.045572559956281455, 'bear_time_stop': 37, 'bear_use_sma': False, 'bear_use_ema': False, 'bear_use_atr': False, 'bear_use_adx': True, 'bear_use_spike': True, 'bear_rsi_required': False, 'sideways_strategy': 'mean_reversion', 'sideways_bb_std_mult': 3.2592119216742335, 'sideways_rsi_os': 32, 'sideways_rsi_ob': 87, 'sideways_adx_thresh': 6.546259776125799, 'sideways_atr_min_pct': 0.0035401937064068606, 'sideways_atr_max_pct': 0.1350651341211009, 'sideways_tp_mult': 1.680139860273514, 'sideways_tsl_mult': 0.06284032444893295, 'sideways_time_stop': 115, 'sideways_use_sma': False, 'sideways_use_ema': True, 'sideways_use_atr': True, 'sideways_use_adx': True, 'sideways_use_spike': True, 'sideways_rsi_required': True}.
[I 2025-09-01 15:16:19,244] Trial 527 finished with values: [-0.004187297038403481, 0.004957106437665651] and parameters: {'p_sma': 11, 'p_std': 10, 'p_atr': 8, 'p_adx': 26, 'rsi_period': 34, 'ema1': 30, 'ema2': 53, 'slip_atr_k': 0.05758627471262875, 'slip_spread_k': 0.26136219975332736, 'spread_hl_frac': 0.04102784613880518, 'bb_std_mult': 3.1598614208448126, 'rsi_os': 49, 'rsi_ob': 71, 'vol_spike': 0.28090055237542927, 'adx_thresh': 29.268884423830603, 'atr_min_pct': 0.008713819406180018, 'atr_max_pct': 0.03828094302067781, 'tp_mult': 2.9255476958655398, 'tsl_mult': 0.8752893736713749, 'strategy': 'breakout', 'time_stop': 59, 'use_sma': True, 'use_atr': True, 'use_adx': True, 'use_ema': False, 'use_spike': True, 'rsi_required': False, 'edge_k': 1.1703968759406846, 'edge_cap': 0.1104438044332017, 'bull_strategy': 'breakout', 'bull_bb_std_mult': 1.9817037421893586, 'bull_rsi_os': 18, 'bull_rsi_ob': 50, 'bull_adx_thresh': 26.34758429815498, 'bull_atr_min_pct': 0.003037082455298942, 'bull_atr_max_pct': 0.09004736663800957, 'bull_tp_mult': 2.1396057100168986, 'bull_tsl_mult': 0.16410241179737822, 'bull_time_stop': 163, 'bull_use_sma': True, 'bull_use_ema': False, 'bull_use_atr': False, 'bull_use_adx': True, 'bull_use_spike': False, 'bull_rsi_required': True, 'bear_strategy': 'mean_reversion', 'bear_bb_std_mult': 2.7569563237583536, 'bear_rsi_os': 12, 'bear_rsi_ob': 61, 'bear_adx_thresh': 26.4814041090335, 'bear_atr_min_pct': 0.015725910472571034, 'bear_atr_max_pct': 0.10936571988122609, 'bear_tp_mult': 1.0113870531567404, 'bear_tsl_mult': 0.6473659516348255, 'bear_time_stop': 294, 'bear_use_sma': False, 'bear_use_ema': False, 'bear_use_atr': False, 'bear_use_adx': True, 'bear_use_spike': False, 'bear_rsi_required': False, 'sideways_strategy': 'mean_reversion', 'sideways_bb_std_mult': 3.284063820139054, 'sideways_rsi_os': 29, 'sideways_rsi_ob': 77, 'sideways_adx_thresh': 6.434988330679054, 'sideways_atr_min_pct': 0.010035229971785305, 'sideways_atr_max_pct': 0.0655385817331794, 'sideways_tp_mult': 2.960590499212914, 'sideways_tsl_mult': 0.6060111682592726, 'sideways_time_stop': 145, 'sideways_use_sma': False, 'sideways_use_ema': False, 'sideways_use_atr': True, 'sideways_use_adx': False, 'sideways_use_spike': True, 'sideways_rsi_required': False}.
[I 2025-09-01 15:16:19,262] Trial 529 finished with values: [-1000000000.0, 1000000000.0] and parameters: {'p_sma': 12, 'p_std': 9, 'p_atr': 19, 'p_adx': 26, 'rsi_period': 64, 'ema1': 10, 'ema2': 33, 'slip_atr_k': 0.06877600586799194, 'slip_spread_k': 0.26959881351088466, 'spread_hl_frac': 0.041430144644087674, 'bb_std_mult': 1.3521477784030365, 'rsi_os': 37, 'rsi_ob': 74, 'vol_spike': 0.28061282484143296, 'adx_thresh': 17.99134330983677, 'atr_min_pct': 0.023546465606146087, 'atr_max_pct': 0.0709847747773447, 'tp_mult': 2.174949794560321, 'tsl_mult': 0.16625670763482947, 'strategy': 'breakout', 'time_stop': 58, 'use_sma': True, 'use_atr': True, 'use_adx': False, 'use_ema': False, 'use_spike': True, 'rsi_required': False, 'edge_k': 1.4202324395650443, 'edge_cap': 0.1081554560533175, 'bull_strategy': 'breakout', 'bull_bb_std_mult': 0.7899882226890991, 'bull_rsi_os': 39, 'bull_rsi_ob': 56, 'bull_adx_thresh': 14.149322345153678, 'bull_atr_min_pct': 0.004985537136841886, 'bull_atr_max_pct': 0.09704216115355475, 'bull_tp_mult': 2.157391268397477, 'bull_tsl_mult': 0.16155590504622336, 'bull_time_stop': 163, 'bull_use_sma': True, 'bull_use_ema': False, 'bull_use_atr': False, 'bull_use_adx': True, 'bull_use_spike': False, 'bull_rsi_required': True, 'bear_strategy': 'mean_reversion', 'bear_bb_std_mult': 2.7919895159901986, 'bear_rsi_os': 39, 'bear_rsi_ob': 74, 'bear_adx_thresh': 27.610695258474028, 'bear_atr_min_pct': 0.024321023942320132, 'bear_atr_max_pct': 0.1084150721248325, 'bear_tp_mult': 1.6561637615029339, 'bear_tsl_mult': 0.9251231663672841, 'bear_time_stop': 265, 'bear_use_sma': True, 'bear_use_ema': False, 'bear_use_atr': False, 'bear_use_adx': True, 'bear_use_spike': False, 'bear_rsi_required': False, 'sideways_strategy': 'mean_reversion', 'sideways_bb_std_mult': 3.3155660766084285, 'sideways_rsi_os': 19, 'sideways_rsi_ob': 88, 'sideways_adx_thresh': 21.266482601640433, 'sideways_atr_min_pct': 0.007534042673471542, 'sideways_atr_max_pct': 0.12772113684630995, 'sideways_tp_mult': 2.8639924704157296, 'sideways_tsl_mult': 0.5931217499890656, 'sideways_time_stop': 124, 'sideways_use_sma': False, 'sideways_use_ema': False, 'sideways_use_atr': True, 'sideways_use_adx': False, 'sideways_use_spike': True, 'sideways_rsi_required': False}.
[I 2025-09-01 15:16:20,876] Trial 528 finished with values: [-1000000000.0, 1000000000.0] and parameters: {'p_sma': 11, 'p_std': 10, 'p_atr': 19, 'p_adx': 26, 'rsi_period': 64, 'ema1': 10, 'ema2': 31, 'slip_atr_k': 0.056445337525225146, 'slip_spread_k': 0.25979215499813474, 'spread_hl_frac': 0.01410920919300528, 'bb_std_mult': 3.159475689911673, 'rsi_os': 42, 'rsi_ob': 74, 'vol_spike': 0.2209501611291434, 'adx_thresh': 23.683299265020075, 'atr_min_pct': 0.0005164567617312096, 'atr_max_pct': 0.0766282427335169, 'tp_mult': 2.944351998731433, 'tsl_mult': 0.3913354633004953, 'strategy': 'breakout', 'time_stop': 59, 'use_sma': True, 'use_atr': True, 'use_adx': False, 'use_ema': False, 'use_spike': True, 'rsi_required': False, 'edge_k': 0.5641944860909779, 'edge_cap': 0.11223883276209129, 'bull_strategy': 'breakout', 'bull_bb_std_mult': 2.208989043785919, 'bull_rsi_os': 55, 'bull_rsi_ob': 50, 'bull_adx_thresh': 14.245551624291934, 'bull_atr_min_pct': 0.004952836180490677, 'bull_atr_max_pct': 0.09177644166722465, 'bull_tp_mult': 2.158378063228538, 'bull_tsl_mult': 0.16957185811041742, 'bull_time_stop': 163, 'bull_use_sma': True, 'bull_use_ema': False, 'bull_use_atr': False, 'bull_use_adx': True, 'bull_use_spike': False, 'bull_rsi_required': True, 'bear_strategy': 'mean_reversion', 'bear_bb_std_mult': 2.5949681641319597, 'bear_rsi_os': 39, 'bear_rsi_ob': 74, 'bear_adx_thresh': 7.965726784380145, 'bear_atr_min_pct': 0.02445071704251026, 'bear_atr_max_pct': 0.03197915298268687, 'bear_tp_mult': 2.5237972798780506, 'bear_tsl_mult': 0.9735400614951866, 'bear_time_stop': 274, 'bear_use_sma': False, 'bear_use_ema': False, 'bear_use_atr': False, 'bear_use_adx': True, 'bear_use_spike': False, 'bear_rsi_required': False, 'sideways_strategy': 'mean_reversion', 'sideways_bb_std_mult': 2.613675451206208, 'sideways_rsi_os': 12, 'sideways_rsi_ob': 89, 'sideways_adx_thresh': 6.32375899297935, 'sideways_atr_min_pct': 0.01942414788299296, 'sideways_atr_max_pct': 0.13900825715460335, 'sideways_tp_mult': 1.8556398072666351, 'sideways_tsl_mult': 0.29049636681417046, 'sideways_time_stop': 62, 'sideways_use_sma': False, 'sideways_use_ema': False, 'sideways_use_atr': True, 'sideways_use_adx': False, 'sideways_use_spike': True, 'sideways_rsi_required': False}.
[I 2025-09-01 15:16:20,879] Trial 526 finished with values: [-0.017673178993803607, 0.01768554620701182] and parameters: {'p_sma': 45, 'p_std': 26, 'p_atr': 19, 'p_adx': 26, 'rsi_period': 44, 'ema1': 18, 'ema2': 58, 'slip_atr_k': 0.14662430107614158, 'slip_spread_k': 0.289520153686452, 'spread_hl_frac': 0.030326334229441015, 'bb_std_mult': 1.3691117358761395, 'rsi_os': 38, 'rsi_ob': 62, 'vol_spike': 0.2831460116655518, 'adx_thresh': 21.38271338910159, 'atr_min_pct': 0.02474738693819948, 'atr_max_pct': 0.07577621988656676, 'tp_mult': 2.1854337696000354, 'tsl_mult': 0.884209804075746, 'strategy': 'breakout', 'time_stop': 51, 'use_sma': True, 'use_atr': True, 'use_adx': True, 'use_ema': False, 'use_spike': True, 'rsi_required': False, 'edge_k': 0.5694672415761218, 'edge_cap': 0.5921859792366113, 'bull_strategy': 'breakout', 'bull_bb_std_mult': 2.97268427646463, 'bull_rsi_os': 30, 'bull_rsi_ob': 50, 'bull_adx_thresh': 26.16897971306895, 'bull_atr_min_pct': 0.0029638278003855387, 'bull_atr_max_pct': 0.07885419932003492, 'bull_tp_mult': 1.8854352102156604, 'bull_tsl_mult': 0.3479730066702069, 'bull_time_stop': 162, 'bull_use_sma': True, 'bull_use_ema': False, 'bull_use_atr': False, 'bull_use_adx': True, 'bull_use_spike': False, 'bull_rsi_required': True, 'bear_strategy': 'mean_reversion', 'bear_bb_std_mult': 2.5861181735826353, 'bear_rsi_os': 9, 'bear_rsi_ob': 66, 'bear_adx_thresh': 25.285293527946173, 'bear_atr_min_pct': 0.024339259624589216, 'bear_atr_max_pct': 0.03273218778684176, 'bear_tp_mult': 2.349657727951544, 'bear_tsl_mult': 0.6480677545435021, 'bear_time_stop': 264, 'bear_use_sma': False, 'bear_use_ema': False, 'bear_use_atr': False, 'bear_use_adx': True, 'bear_use_spike': False, 'bear_rsi_required': False, 'sideways_strategy': 'mean_reversion', 'sideways_bb_std_mult': 3.2926494624038813, 'sideways_rsi_os': 17, 'sideways_rsi_ob': 77, 'sideways_adx_thresh': 31.959219145749067, 'sideways_atr_min_pct': 0.02822087868956482, 'sideways_atr_max_pct': 0.10542843554021541, 'sideways_tp_mult': 2.855717836326917, 'sideways_tsl_mult': 0.05853165626095652, 'sideways_time_stop': 122, 'sideways_use_sma': False, 'sideways_use_ema': False, 'sideways_use_atr': True, 'sideways_use_adx': True, 'sideways_use_spike': True, 'sideways_rsi_required': True}.
