[I 2025-09-01 14:00:05,959] Trial 46 finished with values: [-1000000000.0, 1000000000.0] and parameters: {'p_sma': 46, 'p_std': 30, 'p_atr': 26, 'p_adx': 30, 'rsi_period': 67, 'ema1': 9, 'ema2': 37, 'slip_atr_k': 0.10579357736031351, 'slip_spread_k': 0.2437735844808936, 'spread_hl_frac': 0.024609374407717672, 'bb_std_mult': 3.3717330863678274, 'rsi_os': 19, 'rsi_ob': 55, 'vol_spike': 0.2981112700997611, 'adx_thresh': 25.292350370180657, 'atr_min_pct': 0.01750020040531857, 'atr_max_pct': 0.05204278639931541, 'tp_mult': 2.024744626201352, 'tsl_mult': 0.5882578278611322, 'strategy': 'mean_reversion', 'time_stop': 174, 'use_sma': True, 'use_atr': False, 'use_adx': False, 'use_ema': False, 'use_spike': False, 'rsi_required': True, 'edge_k': 1.4902921905255577, 'edge_cap': 0.6360471832946802, 'bull_strategy': 'mean_reversion', 'bull_bb_std_mult': 1.453432700331492, 'bull_rsi_os': 28, 'bull_rsi_ob': 45, 'bull_adx_thresh': 14.595299586504073, 'bull_atr_min_pct': 0.020039175930237477, 'bull_atr_max_pct': 0.09360482166851528, 'bull_tp_mult': 1.430437503100689, 'bull_tsl_mult': 0.5848930622382696, 'bull_time_stop': 146, 'bull_use_sma': True, 'bull_use_ema': True, 'bull_use_atr': False, 'bull_use_adx': True, 'bull_use_spike': True, 'bull_rsi_required': True, 'bear_strategy': 'breakout', 'bear_bb_std_mult': 1.7145174337564624, 'bear_rsi_os': 44, 'bear_rsi_ob': 67, 'bear_adx_thresh': 17.461636396846714, 'bear_atr_min_pct': 0.018527784722373035, 'bear_atr_max_pct': 0.010070348524450514, 'bear_tp_mult': 1.1413012790347101, 'bear_tsl_mult': 0.7250258787833009, 'bear_time_stop': 112, 'bear_use_sma': True, 'bear_use_ema': False, 'bear_use_atr': True, 'bear_use_adx': True, 'bear_use_spike': False, 'bear_rsi_required': True, 'sideways_strategy': 'breakout', 'sideways_bb_std_mult': 2.4356782416262788, 'sideways_rsi_os': 24, 'sideways_rsi_ob': 46, 'sideways_adx_thresh': 34.85780200358405, 'sideways_atr_min_pct': 0.0175161142680512, 'sideways_atr_max_pct': 0.0486945287421443, 'sideways_tp_mult': 1.0121387269300286, 'sideways_tsl_mult': 0.5575125006453971, 'sideways_time_stop': 120, 'sideways_use_sma': True, 'sideways_use_ema': False, 'sideways_use_atr': True, 'sideways_use_adx': True, 'sideways_use_spike': False, 'sideways_rsi_required': False}.
[I 2025-09-01 14:00:06,648] Trial 44 finished with values: [-1000000000.0, 1000000000.0] and parameters: {'p_sma': 46, 'p_std': 30, 'p_atr': 26, 'p_adx': 29, 'rsi_period': 25, 'ema1': 7, 'ema2': 20, 'slip_atr_k': 0.10914400582611641, 'slip_spread_k': 0.49561232245413256, 'spread_hl_frac': 0.012462199969089236, 'bb_std_mult': 2.690663900682815, 'rsi_os': 19, 'rsi_ob': 87, 'vol_spike': 0.11812699508457677, 'adx_thresh': 25.04969199781706, 'atr_min_pct': 0.0004821348885335752, 'atr_max_pct': 0.09231051803359448, 'tp_mult': 2.0305693158373552, 'tsl_mult': 0.582901596674765, 'strategy': 'mean_reversion', 'time_stop': 179, 'use_sma': True, 'use_atr': False, 'use_adx': False, 'use_ema': False, 'use_spike': True, 'rsi_required': True, 'edge_k': 1.3583030398649936, 'edge_cap': 0.6414123163906139, 'bull_strategy': 'mean_reversion', 'bull_bb_std_mult': 1.3044165651842121, 'bull_rsi_os': 29, 'bull_rsi_ob': 89, 'bull_adx_thresh': 14.244604179714184, 'bull_atr_min_pct': 0.001359974326056989, 'bull_atr_max_pct': 0.09395354389738445, 'bull_tp_mult': 1.4536259382169052, 'bull_tsl_mult': 0.5925998161320509, 'bull_time_stop': 144, 'bull_use_sma': True, 'bull_use_ema': True, 'bull_use_atr': False, 'bull_use_adx': True, 'bull_use_spike': False, 'bull_rsi_required': True, 'bear_strategy': 'breakout', 'bear_bb_std_mult': 1.768803489183147, 'bear_rsi_os': 47, 'bear_rsi_ob': 67, 'bear_adx_thresh': 17.688475912262742, 'bear_atr_min_pct': 0.01850716499093796, 'bear_atr_max_pct': 0.010335305953748332, 'bear_tp_mult': 1.3936604458831026, 'bear_tsl_mult': 0.7099894349744925, 'bear_time_stop': 102, 'bear_use_sma': True, 'bear_use_ema': False, 'bear_use_atr': True, 'bear_use_adx': True, 'bear_use_spike': False, 'bear_rsi_required': True, 'sideways_strategy': 'breakout', 'sideways_bb_std_mult': 2.4654143594355755, 'sideways_rsi_os': 24, 'sideways_rsi_ob': 78, 'sideways_adx_thresh': 21.615210214647654, 'sideways_atr_min_pct': 0.011839025083500338, 'sideways_atr_max_pct': 0.05125229423710745, 'sideways_tp_mult': 1.4736044635636372, 'sideways_tsl_mult': 0.5771732897413383, 'sideways_time_stop': 120, 'sideways_use_sma': False, 'sideways_use_ema': False, 'sideways_use_atr': True, 'sideways_use_adx': True, 'sideways_use_spike': False, 'sideways_rsi_required': True}.
[I 2025-09-01 14:00:07,369] Trial 47 finished with values: [-1000000000.0, 1000000000.0] and parameters: {'p_sma': 43, 'p_std': 28, 'p_atr': 30, 'p_adx': 10, 'rsi_period': 75, 'ema1': 9, 'ema2': 15, 'slip_atr_k': 0.11947733381848605, 'slip_spread_k': 0.2480754181989538, 'spread_hl_frac': 0.025334787056107744, 'bb_std_mult': 3.0078130282682847, 'rsi_os': 29, 'rsi_ob': 53, 'vol_spike': 0.04472354154558206, 'adx_thresh': 6.164390755503902, 'atr_min_pct': 0.0003510159239693694, 'atr_max_pct': 0.07422162345117772, 'tp_mult': 2.7568476605500942, 'tsl_mult': 0.07231916717133186, 'strategy': 'mean_reversion', 'time_stop': 144, 'use_sma': True, 'use_atr': False, 'use_adx': False, 'use_ema': False, 'use_spike': False, 'rsi_required': True, 'edge_k': 1.37107217689555, 'edge_cap': 0.3003844880970431, 'bull_strategy': 'breakout', 'bull_bb_std_mult': 1.4532517527398299, 'bull_rsi_os': 28, 'bull_rsi_ob': 89, 'bull_adx_thresh': 34.96482181637047, 'bull_atr_min_pct': 0.02043743287420229, 'bull_atr_max_pct': 0.1428730093409303, 'bull_tp_mult': 1.4225289018786158, 'bull_tsl_mult': 0.2259067464564275, 'bull_time_stop': 142, 'bull_use_sma': False, 'bull_use_ema': True, 'bull_use_atr': False, 'bull_use_adx': True, 'bull_use_spike': True, 'bull_rsi_required': True, 'bear_strategy': 'breakout', 'bear_bb_std_mult': 2.361412494861677, 'bear_rsi_os': 45, 'bear_rsi_ob': 67, 'bear_adx_thresh': 25.912051795471257, 'bear_atr_min_pct': 0.01849946907163087, 'bear_atr_max_pct': 0.1492107707345326, 'bear_tp_mult': 1.1799075849013687, 'bear_tsl_mult': 0.7185009734610618, 'bear_time_stop': 104, 'bear_use_sma': False, 'bear_use_ema': False, 'bear_use_atr': True, 'bear_use_adx': True, 'bear_use_spike': False, 'bear_rsi_required': True, 'sideways_strategy': 'breakout', 'sideways_bb_std_mult': 3.104695827712519, 'sideways_rsi_os': 24, 'sideways_rsi_ob': 46, 'sideways_adx_thresh': 31.202694157959495, 'sideways_atr_min_pct': 0.017511711585415386, 'sideways_atr_max_pct': 0.0683671930547291, 'sideways_tp_mult': 2.197308743860732, 'sideways_tsl_mult': 0.5668684112729717, 'sideways_time_stop': 114, 'sideways_use_sma': True, 'sideways_use_ema': True, 'sideways_use_atr': True, 'sideways_use_adx': True, 'sideways_use_spike': False, 'sideways_rsi_required': True}.
[I 2025-09-01 14:00:42,452] Trial 50 finished with values: [-1000000000.0, 1000000000.0] and parameters: {'p_sma': 6, 'p_std': 26, 'p_atr': 30, 'p_adx': 7, 'rsi_period': 44, 'ema1': 16, 'ema2': 16, 'slip_atr_k': 0.042183036502066756, 'slip_spread_k': 0.10460970593885288, 'spread_hl_frac': 0.019179116565930417, 'bb_std_mult': 1.781402951986955, 'rsi_os': 14, 'rsi_ob': 78, 'vol_spike': 0.24947736514864355, 'adx_thresh': 12.71304315483961, 'atr_min_pct': 0.021266488709236014, 'atr_max_pct': 0.07437471224280619, 'tp_mult': 1.72210424485412, 'tsl_mult': 0.07211348763275502, 'strategy': 'mean_reversion', 'time_stop': 144, 'use_sma': False, 'use_atr': False, 'use_adx': True, 'use_ema': False, 'use_spike': False, 'rsi_required': True, 'edge_k': 1.82382750399666, 'edge_cap': 0.308200003148042, 'bull_strategy': 'breakout', 'bull_bb_std_mult': 0.6763312508259907, 'bull_rsi_os': 43, 'bull_rsi_ob': 73, 'bull_adx_thresh': 33.47460629071418, 'bull_atr_min_pct': 0.003902088712702101, 'bull_atr_max_pct': 0.11929727790433849, 'bull_tp_mult': 1.5592653425908471, 'bull_tsl_mult': 0.7614442347064942, 'bull_time_stop': 221, 'bull_use_sma': False, 'bull_use_ema': True, 'bull_use_atr': True, 'bull_use_adx': True, 'bull_use_spike': True, 'bull_rsi_required': True, 'bear_strategy': 'mean_reversion', 'bear_bb_std_mult': 2.3890384897403134, 'bear_rsi_os': 24, 'bear_rsi_ob': 81, 'bear_adx_thresh': 24.983960299571486, 'bear_atr_min_pct': 0.016064062125501925, 'bear_atr_max_pct': 0.03273402175771673, 'bear_tp_mult': 2.718902417114253, 'bear_tsl_mult': 0.5686098061518012, 'bear_time_stop': 161, 'bear_use_sma': False, 'bear_use_ema': False, 'bear_use_atr': True, 'bear_use_adx': False, 'bear_use_spike': False, 'bear_rsi_required': True, 'sideways_strategy': 'breakout', 'sideways_bb_std_mult': 1.270663772186695, 'sideways_rsi_os': 30, 'sideways_rsi_ob': 91, 'sideways_adx_thresh': 12.078137145519126, 'sideways_atr_min_pct': 0.026144536758724895, 'sideways_atr_max_pct': 0.10205898882370716, 'sideways_tp_mult': 2.1659149837879874, 'sideways_tsl_mult': 0.6881057568224781, 'sideways_time_stop': 250, 'sideways_use_sma': True, 'sideways_use_ema': True, 'sideways_use_atr': True, 'sideways_use_adx': True, 'sideways_use_spike': False, 'sideways_rsi_required': False}.
[I 2025-09-01 14:00:43,203] Trial 48 finished with values: [-1000000000.0, 1000000000.0] and parameters: {'p_sma': 43, 'p_std': 30, 'p_atr': 28, 'p_adx': 7, 'rsi_period': 75, 'ema1': 7, 'ema2': 15, 'slip_atr_k': 0.10209779686423864, 'slip_spread_k': 0.24008038606226195, 'spread_hl_frac': 0.02521729401040046, 'bb_std_mult': 2.2668919008445805, 'rsi_os': 10, 'rsi_ob': 55, 'vol_spike': 0.04396762948469114, 'adx_thresh': 27.529434593930063, 'atr_min_pct': 0.00015148916596325994, 'atr_max_pct': 0.0681853217951806, 'tp_mult': 1.5914437106118242, 'tsl_mult': 0.5539729698327365, 'strategy': 'mean_reversion', 'time_stop': 198, 'use_sma': True, 'use_atr': False, 'use_adx': False, 'use_ema': False, 'use_spike': False, 'rsi_required': True, 'edge_k': 1.8385737208099409, 'edge_cap': 0.3022591564927608, 'bull_strategy': 'mean_reversion', 'bull_bb_std_mult': 2.243386099221883, 'bull_rsi_os': 28, 'bull_rsi_ob': 87, 'bull_adx_thresh': 14.476174093475745, 'bull_atr_min_pct': 0.008539146585937622, 'bull_atr_max_pct': 0.11689027672655782, 'bull_tp_mult': 1.535333415725127, 'bull_tsl_mult': 0.22305434154474887, 'bull_time_stop': 151, 'bull_use_sma': True, 'bull_use_ema': True, 'bull_use_atr': False, 'bull_use_adx': True, 'bull_use_spike': True, 'bull_rsi_required': True, 'bear_strategy': 'breakout', 'bear_bb_std_mult': 1.1068258592977325, 'bear_rsi_os': 45, 'bear_rsi_ob': 81, 'bear_adx_thresh': 26.227715063962645, 'bear_atr_min_pct': 0.015304464634237638, 'bear_atr_max_pct': 0.010702749424934013, 'bear_tp_mult': 1.3738492724805302, 'bear_tsl_mult': 0.5656396038377196, 'bear_time_stop': 156, 'bear_use_sma': True, 'bear_use_ema': False, 'bear_use_atr': True, 'bear_use_adx': True, 'bear_use_spike': False, 'bear_rsi_required': True, 'sideways_strategy': 'breakout', 'sideways_bb_std_mult': 1.2306219275217383, 'sideways_rsi_os': 15, 'sideways_rsi_ob': 80, 'sideways_adx_thresh': 11.071636821301865, 'sideways_atr_min_pct': 0.017771991721186153, 'sideways_atr_max_pct': 0.10273369951238875, 'sideways_tp_mult': 1.04542495753507, 'sideways_tsl_mult': 0.5701789035829279, 'sideways_time_stop': 184, 'sideways_use_sma': True, 'sideways_use_ema': True, 'sideways_use_atr': True, 'sideways_use_adx': True, 'sideways_use_spike': False, 'sideways_rsi_required': False}.
[I 2025-09-01 14:00:43,991] Trial 51 finished with values: [-1000000000.0, 1000000000.0] and parameters: {'p_sma': 5, 'p_std': 38, 'p_atr': 12, 'p_adx': 7, 'rsi_period': 45, 'ema1': 15, 'ema2': 54, 'slip_atr_k': 0.24874494921565135, 'slip_spread_k': 0.08699392847118886, 'spread_hl_frac': 0.01946559452004574, 'bb_std_mult': 2.3020134589191024, 'rsi_os': 10, 'rsi_ob': 78, 'vol_spike': 0.24981591560645686, 'adx_thresh': 27.411743883425554, 'atr_min_pct': 0.021653163547838496, 'atr_max_pct': 0.10590350046513414, 'tp_mult': 2.989700515394535, 'tsl_mult': 0.1069885331792896, 'strategy': 'breakout', 'time_stop': 192, 'use_sma': False, 'use_atr': False, 'use_adx': True, 'use_ema': False, 'use_spike': False, 'rsi_required': True, 'edge_k': 1.8513311827830803, 'edge_cap': 0.9276542648504662, 'bull_strategy': 'mean_reversion', 'bull_bb_std_mult': 0.697626933849581, 'bull_rsi_os': 50, 'bull_rsi_ob': 75, 'bull_adx_thresh': 17.52320011901422, 'bull_atr_min_pct': 0.008432711143788858, 'bull_atr_max_pct': 0.06269870873292738, 'bull_tp_mult': 1.5652959242831201, 'bull_tsl_mult': 0.7269754042305157, 'bull_time_stop': 233, 'bull_use_sma': True, 'bull_use_ema': False, 'bull_use_atr': True, 'bull_use_adx': True, 'bull_use_spike': True, 'bull_rsi_required': True, 'bear_strategy': 'mean_reversion', 'bear_bb_std_mult': 2.7825838105401957, 'bear_rsi_os': 35, 'bear_rsi_ob': 81, 'bear_adx_thresh': 10.85989023118434, 'bear_atr_min_pct': 0.015913050488883314, 'bear_atr_max_pct': 0.03278310650298444, 'bear_tp_mult': 2.3116196386928416, 'bear_tsl_mult': 0.5638580569348978, 'bear_time_stop': 81, 'bear_use_sma': True, 'bear_use_ema': False, 'bear_use_atr': False, 'bear_use_adx': False, 'bear_use_spike': True, 'bear_rsi_required': False, 'sideways_strategy': 'breakout', 'sideways_bb_std_mult': 2.09096252808373, 'sideways_rsi_os': 13, 'sideways_rsi_ob': 83, 'sideways_adx_thresh': 27.280996615992596, 'sideways_atr_min_pct': 0.024706025385896876, 'sideways_atr_max_pct': 0.10471437899541755, 'sideways_tp_mult': 1.9736248301008275, 'sideways_tsl_mult': 0.8582564331193306, 'sideways_time_stop': 188, 'sideways_use_sma': True, 'sideways_use_ema': True, 'sideways_use_atr': True, 'sideways_use_adx': True, 'sideways_use_spike': True, 'sideways_rsi_required': False}.
[I 2025-09-01 14:00:44,312] Trial 49 finished with values: [-0.08454017592666097, 0.08439182307256907] and parameters: {'p_sma': 43, 'p_std': 11, 'p_atr': 29, 'p_adx': 28, 'rsi_period': 74, 'ema1': 16, 'ema2': 53, 'slip_atr_k': 0.18936949328750996, 'slip_spread_k': 0.2318039853223917, 'spread_hl_frac': 0.019622557108155154, 'bb_std_mult': 2.330805200978311, 'rsi_os': 10, 'rsi_ob': 53, 'vol_spike': 0.24175083518983384, 'adx_thresh': 5.565899243729035, 'atr_min_pct': 0.022292535767193006, 'atr_max_pct': 0.07902856040552285, 'tp_mult': 2.9969054211730377, 'tsl_mult': 0.07922203535275862, 'strategy': 'mean_reversion', 'time_stop': 197, 'use_sma': False, 'use_atr': False, 'use_adx': True, 'use_ema': False, 'use_spike': False, 'rsi_required': True, 'edge_k': 1.3239505308493473, 'edge_cap': 0.3106890397553812, 'bull_strategy': 'breakout', 'bull_bb_std_mult': 0.6586833483174985, 'bull_rsi_os': 29, 'bull_rsi_ob': 89, 'bull_adx_thresh': 18.178772913902108, 'bull_atr_min_pct': 1.0877809034147358e-05, 'bull_atr_max_pct': 0.03950980880649425, 'bull_tp_mult': 1.566254166550429, 'bull_tsl_mult': 0.7475080560730498, 'bull_time_stop': 237, 'bull_use_sma': False, 'bull_use_ema': True, 'bull_use_atr': False, 'bull_use_adx': True, 'bull_use_spike': True, 'bull_rsi_required': True, 'bear_strategy': 'breakout', 'bear_bb_std_mult': 1.0763012019963316, 'bear_rsi_os': 44, 'bear_rsi_ob': 80, 'bear_adx_thresh': 10.847266166390469, 'bear_atr_min_pct': 0.015742076230283415, 'bear_atr_max_pct': 0.12946690949050071, 'bear_tp_mult': 1.309913087061131, 'bear_tsl_mult': 0.4490215659047803, 'bear_time_stop': 152, 'bear_use_sma': True, 'bear_use_ema': False, 'bear_use_atr': True, 'bear_use_adx': True, 'bear_use_spike': False, 'bear_rsi_required': True, 'sideways_strategy': 'breakout', 'sideways_bb_std_mult': 2.036925135870915, 'sideways_rsi_os': 16, 'sideways_rsi_ob': 82, 'sideways_adx_thresh': 11.152635081415738, 'sideways_atr_min_pct': 0.022394846673310913, 'sideways_atr_max_pct': 0.06737052875470723, 'sideways_tp_mult': 1.9415031786508097, 'sideways_tsl_mult': 0.6761672928521302, 'sideways_time_stop': 248, 'sideways_use_sma': True, 'sideways_use_ema': True, 'sideways_use_atr': True, 'sideways_use_adx': True, 'sideways_use_spike': False, 'sideways_rsi_required': True}.
[I 2025-09-01 14:01:21,212] Trial 54 finished with values: [-1000000000.0, 1000000000.0] and parameters: {'p_sma': 13, 'p_std': 50, 'p_atr': 17, 'p_adx': 22, 'rsi_period': 61, 'ema1': 20, 'ema2': 47, 'slip_atr_k': 0.18766165590443828, 'slip_spread_k': 0.34971173840039516, 'spread_hl_frac': 0.04344174780709598, 'bb_std_mult': 2.8483603111141202, 'rsi_os': 25, 'rsi_ob': 71, 'vol_spike': 0.05253964263068252, 'adx_thresh': 8.37651016219866, 'atr_min_pct': 0.006534073005388389, 'atr_max_pct': 0.14594838580714886, 'tp_mult': 1.937456900213947, 'tsl_mult': 0.2246391309723679, 'strategy': 'mean_reversion', 'time_stop': 109, 'use_sma': False, 'use_atr': False, 'use_adx': True, 'use_ema': True, 'use_spike': False, 'rsi_required': True, 'edge_k': 1.2436210610714675, 'edge_cap': 0.7709896216362295, 'bull_strategy': 'mean_reversion', 'bull_bb_std_mult': 1.0327257125562168, 'bull_rsi_os': 31, 'bull_rsi_ob': 55, 'bull_adx_thresh': 24.552192194018378, 'bull_atr_min_pct': 0.001038793690450689, 'bull_atr_max_pct': 0.12814442576182697, 'bull_tp_mult': 1.6334587243186316, 'bull_tsl_mult': 0.045639966363075886, 'bull_time_stop': 111, 'bull_use_sma': True, 'bull_use_ema': False, 'bull_use_atr': True, 'bull_use_adx': True, 'bull_use_spike': True, 'bull_rsi_required': False, 'bear_strategy': 'breakout', 'bear_bb_std_mult': 3.371497464587703, 'bear_rsi_os': 17, 'bear_rsi_ob': 95, 'bear_adx_thresh': 12.875864187986593, 'bear_atr_min_pct': 2.4648226657642686e-05, 'bear_atr_max_pct': 0.018721440628001823, 'bear_tp_mult': 1.0296269272034364, 'bear_tsl_mult': 0.22502852051823408, 'bear_time_stop': 222, 'bear_use_sma': True, 'bear_use_ema': False, 'bear_use_atr': True, 'bear_use_adx': False, 'bear_use_spike': True, 'bear_rsi_required': True, 'sideways_strategy': 'breakout', 'sideways_bb_std_mult': 2.972789126805211, 'sideways_rsi_os': 44, 'sideways_rsi_ob': 61, 'sideways_adx_thresh': 23.421672429705012, 'sideways_atr_min_pct': 0.02123966683686749, 'sideways_atr_max_pct': 0.08798437134646145, 'sideways_tp_mult': 2.468892963135635, 'sideways_tsl_mult': 0.6629299539792514, 'sideways_time_stop': 105, 'sideways_use_sma': True, 'sideways_use_ema': False, 'sideways_use_atr': False, 'sideways_use_adx': True, 'sideways_use_spike': False, 'sideways_rsi_required': True}.
[I 2025-09-01 14:01:21,210] Trial 55 finished with values: [-0.0917565129932747, 0.09162057472960179] and parameters: {'p_sma': 12, 'p_std': 11, 'p_atr': 28, 'p_adx': 28, 'rsi_period': 56, 'ema1': 13, 'ema2': 25, 'slip_atr_k': 0.1868436428264677, 'slip_spread_k': 0.35831312336299825, 'spread_hl_frac': 0.0445470203919311, 'bb_std_mult': 1.9071733294180397, 'rsi_os': 24, 'rsi_ob': 93, 'vol_spike': 0.08259258900721461, 'adx_thresh': 7.363795684136758, 'atr_min_pct': 0.00797066276698957, 'atr_max_pct': 0.14660467155615728, 'tp_mult': 2.523580399838907, 'tsl_mult': 0.28632295290133875, 'strategy': 'breakout', 'time_stop': 109, 'use_sma': False, 'use_atr': True, 'use_adx': True, 'use_ema': True, 'use_spike': False, 'rsi_required': False, 'edge_k': 0.5874850798633824, 'edge_cap': 0.3754385067033192, 'bull_strategy': 'mean_reversion', 'bull_bb_std_mult': 2.483042827391929, 'bull_rsi_os': 33, 'bull_rsi_ob': 54, 'bull_adx_thresh': 5.417775233551108, 'bull_atr_min_pct': 3.0138976097810518e-05, 'bull_atr_max_pct': 0.038059193405324286, 'bull_tp_mult': 1.6514669468895404, 'bull_tsl_mult': 0.3445785411829653, 'bull_time_stop': 108, 'bull_use_sma': False, 'bull_use_ema': False, 'bull_use_atr': True, 'bull_use_adx': True, 'bull_use_spike': False, 'bull_rsi_required': False, 'bear_strategy': 'breakout', 'bear_bb_std_mult': 3.289105476606828, 'bear_rsi_os': 17, 'bear_rsi_ob': 85, 'bear_adx_thresh': 13.13670630579047, 'bear_atr_min_pct': 0.0010531625591987167, 'bear_atr_max_pct': 0.09632303811464242, 'bear_tp_mult': 2.902256072532328, 'bear_tsl_mult': 0.19842766919765398, 'bear_time_stop': 219, 'bear_use_sma': True, 'bear_use_ema': True, 'bear_use_atr': True, 'bear_use_adx': False, 'bear_use_spike': True, 'bear_rsi_required': False, 'sideways_strategy': 'mean_reversion', 'sideways_bb_std_mult': 2.98969566081396, 'sideways_rsi_os': 45, 'sideways_rsi_ob': 54, 'sideways_adx_thresh': 26.264166164554325, 'sideways_atr_min_pct': 0.002699370159493367, 'sideways_atr_max_pct': 0.08680511132316235, 'sideways_tp_mult': 1.1875466864846074, 'sideways_tsl_mult': 0.6641125678965322, 'sideways_time_stop': 90, 'sideways_use_sma': True, 'sideways_use_ema': False, 'sideways_use_atr': False, 'sideways_use_adx': True, 'sideways_use_spike': False, 'sideways_rsi_required': True}.
