[I 2025-09-01 14:40:09,466] Trial 303 finished with values: [-1000000000.0, 1000000000.0] and parameters: {'p_sma': 14, 'p_std': 13, 'p_atr': 21, 'p_adx': 27, 'rsi_period': 20, 'ema1': 16, 'ema2': 53, 'slip_atr_k': 0.05331934079965208, 'slip_spread_k': 0.8882089677009619, 'spread_hl_frac': 0.03219731165645508, 'bb_std_mult': 0.9898486031119103, 'rsi_os': 38, 'rsi_ob': 74, 'vol_spike': 0.29999881715334226, 'adx_thresh': 15.093583207308614, 'atr_min_pct': 0.013413498211986643, 'atr_max_pct': 0.07999074147124352, 'tp_mult': 2.835293157216269, 'tsl_mult': 0.4590971291092163, 'strategy': 'breakout', 'time_stop': 128, 'use_sma': True, 'use_atr': True, 'use_adx': True, 'use_ema': False, 'use_spike': True, 'rsi_required': False, 'edge_k': 1.5005231379218844, 'edge_cap': 0.9282301608057015, 'bull_strategy': 'breakout', 'bull_bb_std_mult': 3.5230611628929474, 'bull_rsi_os': 27, 'bull_rsi_ob': 57, 'bull_adx_thresh': 10.306456000440905, 'bull_atr_min_pct': 0.004239185758233462, 'bull_atr_max_pct': 0.020468738298136255, 'bull_tp_mult': 1.9359609663974313, 'bull_tsl_mult': 0.3361970158452716, 'bull_time_stop': 219, 'bull_use_sma': True, 'bull_use_ema': False, 'bull_use_atr': False, 'bull_use_adx': True, 'bull_use_spike': False, 'bull_rsi_required': True, 'bear_strategy': 'mean_reversion', 'bear_bb_std_mult': 2.808274443357405, 'bear_rsi_os': 50, 'bear_rsi_ob': 68, 'bear_adx_thresh': 28.749439536348724, 'bear_atr_min_pct': 0.006101530865281131, 'bear_atr_max_pct': 0.07532253466385846, 'bear_tp_mult': 2.6076596134487953, 'bear_tsl_mult': 0.6720964603481009, 'bear_time_stop': 279, 'bear_use_sma': False, 'bear_use_ema': False, 'bear_use_atr': False, 'bear_use_adx': True, 'bear_use_spike': False, 'bear_rsi_required': False, 'sideways_strategy': 'mean_reversion', 'sideways_bb_std_mult': 3.2644214342564966, 'sideways_rsi_os': 15, 'sideways_rsi_ob': 89, 'sideways_adx_thresh': 15.979159932835392, 'sideways_atr_min_pct': 0.00551480568503657, 'sideways_atr_max_pct': 0.09977694181400484, 'sideways_tp_mult': 1.181183480978043, 'sideways_tsl_mult': 0.3338624809280078, 'sideways_time_stop': 134, 'sideways_use_sma': False, 'sideways_use_ema': True, 'sideways_use_atr': True, 'sideways_use_adx': False, 'sideways_use_spike': True, 'sideways_rsi_required': True}.
[I 2025-09-01 14:40:11,378] Trial 308 finished with values: [-1000000000.0, 1000000000.0] and parameters: {'p_sma': 14, 'p_std': 13, 'p_atr': 7, 'p_adx': 24, 'rsi_period': 71, 'ema1': 30, 'ema2': 51, 'slip_atr_k': 0.05901755193624535, 'slip_spread_k': 0.9048333751722398, 'spread_hl_frac': 0.015234210076164321, 'bb_std_mult': 0.9974270709409689, 'rsi_os': 9, 'rsi_ob': 72, 'vol_spike': 0.10178022060887476, 'adx_thresh': 14.574282856334573, 'atr_min_pct': 0.013146827096564655, 'atr_max_pct': 0.04207597439126189, 'tp_mult': 1.4666173189321374, 'tsl_mult': 0.03933695309107457, 'strategy': 'breakout', 'time_stop': 56, 'use_sma': False, 'use_atr': True, 'use_adx': True, 'use_ema': False, 'use_spike': True, 'rsi_required': False, 'edge_k': 0.5058293752639097, 'edge_cap': 0.406727864579735, 'bull_strategy': 'breakout', 'bull_bb_std_mult': 2.9444678912721605, 'bull_rsi_os': 17, 'bull_rsi_ob': 84, 'bull_adx_thresh': 10.473215960239257, 'bull_atr_min_pct': 0.009910328098639558, 'bull_atr_max_pct': 0.019331511087895204, 'bull_tp_mult': 2.0625415599651014, 'bull_tsl_mult': 0.4044497830680061, 'bull_time_stop': 223, 'bull_use_sma': True, 'bull_use_ema': False, 'bull_use_atr': True, 'bull_use_adx': True, 'bull_use_spike': True, 'bull_rsi_required': True, 'bear_strategy': 'mean_reversion', 'bear_bb_std_mult': 2.8066807052185, 'bear_rsi_os': 7, 'bear_rsi_ob': 77, 'bear_adx_thresh': 28.854025534480233, 'bear_atr_min_pct': 0.023218393796464665, 'bear_atr_max_pct': 0.11520013428204247, 'bear_tp_mult': 1.0557783340252707, 'bear_tsl_mult': 0.5892203442683589, 'bear_time_stop': 268, 'bear_use_sma': False, 'bear_use_ema': False, 'bear_use_atr': False, 'bear_use_adx': False, 'bear_use_spike': False, 'bear_rsi_required': False, 'sideways_strategy': 'mean_reversion', 'sideways_bb_std_mult': 1.0433977422842644, 'sideways_rsi_os': 14, 'sideways_rsi_ob': 90, 'sideways_adx_thresh': 12.47234281771, 'sideways_atr_min_pct': 0.006619815290086545, 'sideways_atr_max_pct': 0.10056895163143456, 'sideways_tp_mult': 2.0187814458078135, 'sideways_tsl_mult': 0.2937319808166811, 'sideways_time_stop': 94, 'sideways_use_sma': False, 'sideways_use_ema': True, 'sideways_use_atr': True, 'sideways_use_adx': False, 'sideways_use_spike': True, 'sideways_rsi_required': True}.
[I 2025-09-01 14:40:11,666] Trial 307 finished with values: [-0.10924474005788176, 0.10935540455650286] and parameters: {'p_sma': 47, 'p_std': 5, 'p_atr': 10, 'p_adx': 25, 'rsi_period': 21, 'ema1': 16, 'ema2': 13, 'slip_atr_k': 0.055604557224493076, 'slip_spread_k': 0.05608898134373613, 'spread_hl_frac': 0.032150753883873937, 'bb_std_mult': 1.7769239650868083, 'rsi_os': 46, 'rsi_ob': 52, 'vol_spike': 0.1005234600916092, 'adx_thresh': 14.97920356902034, 'atr_min_pct': 0.013552596820877005, 'atr_max_pct': 0.13149330945851015, 'tp_mult': 2.834158888246879, 'tsl_mult': 0.4557059003951146, 'strategy': 'breakout', 'time_stop': 68, 'use_sma': False, 'use_atr': True, 'use_adx': True, 'use_ema': False, 'use_spike': True, 'rsi_required': False, 'edge_k': 1.4223447196971808, 'edge_cap': 0.9325336329743616, 'bull_strategy': 'breakout', 'bull_bb_std_mult': 2.942328676112731, 'bull_rsi_os': 19, 'bull_rsi_ob': 83, 'bull_adx_thresh': 10.102533437418348, 'bull_atr_min_pct': 0.009725102789060655, 'bull_atr_max_pct': 0.020363945832292264, 'bull_tp_mult': 1.1167622814347384, 'bull_tsl_mult': 0.3347042053743181, 'bull_time_stop': 221, 'bull_use_sma': True, 'bull_use_ema': False, 'bull_use_atr': True, 'bull_use_adx': True, 'bull_use_spike': True, 'bull_rsi_required': True, 'bear_strategy': 'mean_reversion', 'bear_bb_std_mult': 2.8002553100060927, 'bear_rsi_os': 50, 'bear_rsi_ob': 75, 'bear_adx_thresh': 28.622392279975042, 'bear_atr_min_pct': 0.00011601599609217111, 'bear_atr_max_pct': 0.11376501526304486, 'bear_tp_mult': 2.447739477685891, 'bear_tsl_mult': 0.5862820534543927, 'bear_time_stop': 281, 'bear_use_sma': False, 'bear_use_ema': False, 'bear_use_atr': False, 'bear_use_adx': False, 'bear_use_spike': False, 'bear_rsi_required': False, 'sideways_strategy': 'mean_reversion', 'sideways_bb_std_mult': 0.7404158075777829, 'sideways_rsi_os': 15, 'sideways_rsi_ob': 47, 'sideways_adx_thresh': 15.833053217135197, 'sideways_atr_min_pct': 0.005460903555481874, 'sideways_atr_max_pct': 0.13467498652816462, 'sideways_tp_mult': 1.6650200650268485, 'sideways_tsl_mult': 0.8822172491130679, 'sideways_time_stop': 136, 'sideways_use_sma': False, 'sideways_use_ema': True, 'sideways_use_atr': True, 'sideways_use_adx': False, 'sideways_use_spike': True, 'sideways_rsi_required': True}.
[I 2025-09-01 14:40:12,259] Trial 312 finished with values: [-1000000000.0, 1000000000.0] and parameters: {'p_sma': 31, 'p_std': 34, 'p_atr': 20, 'p_adx': 25, 'rsi_period': 68, 'ema1': 29, 'ema2': 17, 'slip_atr_k': 0.06122668772190911, 'slip_spread_k': 0.20326685536493255, 'spread_hl_frac': 0.013265847113850733, 'bb_std_mult': 2.0568020679274786, 'rsi_os': 12, 'rsi_ob': 47, 'vol_spike': 0.29508503054690016, 'adx_thresh': 6.782845917519783, 'atr_min_pct': 0.015089065940625429, 'atr_max_pct': 0.07788768814930058, 'tp_mult': 2.542954356986149, 'tsl_mult': 0.5580440842132007, 'strategy': 'mean_reversion', 'time_stop': 64, 'use_sma': False, 'use_atr': True, 'use_adx': True, 'use_ema': True, 'use_spike': False, 'rsi_required': False, 'edge_k': 0.5444664997897196, 'edge_cap': 0.05218360076514595, 'bull_strategy': 'mean_reversion', 'bull_bb_std_mult': 1.6885709179376895, 'bull_rsi_os': 18, 'bull_rsi_ob': 48, 'bull_adx_thresh': 8.360359320027394, 'bull_atr_min_pct': 0.012782403368364609, 'bull_atr_max_pct': 0.01358085899105023, 'bull_tp_mult': 2.8481883285915996, 'bull_tsl_mult': 0.3115562488096961, 'bull_time_stop': 55, 'bull_use_sma': True, 'bull_use_ema': True, 'bull_use_atr': False, 'bull_use_adx': True, 'bull_use_spike': False, 'bull_rsi_required': True, 'bear_strategy': 'breakout', 'bear_bb_std_mult': 2.627071472815209, 'bear_rsi_os': 33, 'bear_rsi_ob': 76, 'bear_adx_thresh': 27.517374903665075, 'bear_atr_min_pct': 0.0229618072007093, 'bear_atr_max_pct': 0.1072669213654766, 'bear_tp_mult': 2.376748217682204, 'bear_tsl_mult': 0.16761155165507619, 'bear_time_stop': 220, 'bear_use_sma': True, 'bear_use_ema': True, 'bear_use_atr': True, 'bear_use_adx': True, 'bear_use_spike': False, 'bear_rsi_required': True, 'sideways_strategy': 'mean_reversion', 'sideways_bb_std_mult': 0.6043575081932375, 'sideways_rsi_os': 13, 'sideways_rsi_ob': 87, 'sideways_adx_thresh': 5.777837244755475, 'sideways_atr_min_pct': 0.0044696451934611, 'sideways_atr_max_pct': 0.139896223291923, 'sideways_tp_mult': 1.5950420974697683, 'sideways_tsl_mult': 0.2809087805757533, 'sideways_time_stop': 241, 'sideways_use_sma': False, 'sideways_use_ema': False, 'sideways_use_atr': False, 'sideways_use_adx': True, 'sideways_use_spike': False, 'sideways_rsi_required': False}.
[I 2025-09-01 14:40:48,584] Trial 311 finished with values: [-1000000000.0, 1000000000.0] and parameters: {'p_sma': 16, 'p_std': 5, 'p_atr': 20, 'p_adx': 25, 'rsi_period': 60, 'ema1': 30, 'ema2': 17, 'slip_atr_k': 0.0619897479669594, 'slip_spread_k': 0.2464327261829244, 'spread_hl_frac': 0.01356327030014298, 'bb_std_mult': 1.1448628395845493, 'rsi_os': 48, 'rsi_ob': 75, 'vol_spike': 0.12224551894047779, 'adx_thresh': 5.568836442564592, 'atr_min_pct': 0.0034080280499884583, 'atr_max_pct': 0.13062347715136824, 'tp_mult': 1.6523886684852849, 'tsl_mult': 0.02233697446592943, 'strategy': 'breakout', 'time_stop': 223, 'use_sma': False, 'use_atr': True, 'use_adx': True, 'use_ema': True, 'use_spike': False, 'rsi_required': False, 'edge_k': 0.4349944765336826, 'edge_cap': 0.9045211254688972, 'bull_strategy': 'mean_reversion', 'bull_bb_std_mult': 1.9677154511612898, 'bull_rsi_os': 42, 'bull_rsi_ob': 52, 'bull_adx_thresh': 28.3025897183949, 'bull_atr_min_pct': 0.014875618435620713, 'bull_atr_max_pct': 0.014161536218021175, 'bull_tp_mult': 2.8395210873819337, 'bull_tsl_mult': 0.3073184436562486, 'bull_time_stop': 166, 'bull_use_sma': True, 'bull_use_ema': True, 'bull_use_atr': False, 'bull_use_adx': True, 'bull_use_spike': False, 'bull_rsi_required': True, 'bear_strategy': 'mean_reversion', 'bear_bb_std_mult': 1.3960685360675846, 'bear_rsi_os': 9, 'bear_rsi_ob': 95, 'bear_adx_thresh': 27.612124974850563, 'bear_atr_min_pct': 0.02442317322685852, 'bear_atr_max_pct': 0.1266759126014207, 'bear_tp_mult': 2.3874801304733766, 'bear_tsl_mult': 0.6289977059984994, 'bear_time_stop': 221, 'bear_use_sma': True, 'bear_use_ema': True, 'bear_use_atr': True, 'bear_use_adx': True, 'bear_use_spike': False, 'bear_rsi_required': False, 'sideways_strategy': 'mean_reversion', 'sideways_bb_std_mult': 0.7394250273432537, 'sideways_rsi_os': 34, 'sideways_rsi_ob': 46, 'sideways_adx_thresh': 7.214159937432737, 'sideways_atr_min_pct': 0.01902367246229785, 'sideways_atr_max_pct': 0.12700357751181374, 'sideways_tp_mult': 1.422554783700443, 'sideways_tsl_mult': 0.2392317293106793, 'sideways_time_stop': 244, 'sideways_use_sma': False, 'sideways_use_ema': False, 'sideways_use_atr': True, 'sideways_use_adx': False, 'sideways_use_spike': True, 'sideways_rsi_required': True}.
[I 2025-09-01 14:40:48,754] Trial 313 finished with values: [-1000000000.0, 1000000000.0] and parameters: {'p_sma': 16, 'p_std': 12, 'p_atr': 19, 'p_adx': 9, 'rsi_period': 7, 'ema1': 30, 'ema2': 50, 'slip_atr_k': 0.19824431630338293, 'slip_spread_k': 0.680600027038006, 'spread_hl_frac': 0.005997217777511825, 'bb_std_mult': 1.2439039027407093, 'rsi_os': 30, 'rsi_ob': 75, 'vol_spike': 0.0031311763519417946, 'adx_thresh': 10.889637031787494, 'atr_min_pct': 0.015936135829278924, 'atr_max_pct': 0.061500439764366414, 'tp_mult': 2.9227470085658918, 'tsl_mult': 0.09143001758913108, 'strategy': 'breakout', 'time_stop': 223, 'use_sma': False, 'use_atr': True, 'use_adx': True, 'use_ema': False, 'use_spike': False, 'rsi_required': False, 'edge_k': 0.4474219516654249, 'edge_cap': 0.10094329879656727, 'bull_strategy': 'breakout', 'bull_bb_std_mult': 2.846373467416574, 'bull_rsi_os': 17, 'bull_rsi_ob': 69, 'bull_adx_thresh': 28.3301025649835, 'bull_atr_min_pct': 0.006722312545250582, 'bull_atr_max_pct': 0.041468523090474836, 'bull_tp_mult': 2.129377299717058, 'bull_tsl_mult': 0.7480556869839953, 'bull_time_stop': 166, 'bull_use_sma': True, 'bull_use_ema': False, 'bull_use_atr': False, 'bull_use_adx': True, 'bull_use_spike': False, 'bull_rsi_required': True, 'bear_strategy': 'mean_reversion', 'bear_bb_std_mult': 1.5643369759712997, 'bear_rsi_os': 36, 'bear_rsi_ob': 63, 'bear_adx_thresh': 28.056455220853294, 'bear_atr_min_pct': 0.024363298436381547, 'bear_atr_max_pct': 0.11838366999635046, 'bear_tp_mult': 2.491753416597152, 'bear_tsl_mult': 0.779107903084395, 'bear_time_stop': 291, 'bear_use_sma': True, 'bear_use_ema': False, 'bear_use_atr': True, 'bear_use_adx': True, 'bear_use_spike': False, 'bear_rsi_required': False, 'sideways_strategy': 'mean_reversion', 'sideways_bb_std_mult': 3.3991356294885264, 'sideways_rsi_os': 37, 'sideways_rsi_ob': 81, 'sideways_adx_thresh': 7.020603414481849, 'sideways_atr_min_pct': 0.029456340037726264, 'sideways_atr_max_pct': 0.012397721559549588, 'sideways_tp_mult': 1.465986178923381, 'sideways_tsl_mult': 0.239869433779265, 'sideways_time_stop': 46, 'sideways_use_sma': False, 'sideways_use_ema': False, 'sideways_use_atr': True, 'sideways_use_adx': False, 'sideways_use_spike': True, 'sideways_rsi_required': True}.
[I 2025-09-01 14:40:48,894] Trial 309 finished with values: [-1000000000.0, 1000000000.0] and parameters: {'p_sma': 32, 'p_std': 35, 'p_atr': 7, 'p_adx': 24, 'rsi_period': 64, 'ema1': 11, 'ema2': 13, 'slip_atr_k': 0.059955624338288854, 'slip_spread_k': 0.2059498928766304, 'spread_hl_frac': 0.015295143249293446, 'bb_std_mult': 0.9802119955410782, 'rsi_os': 55, 'rsi_ob': 72, 'vol_spike': 0.19171180796794338, 'adx_thresh': 19.38804650819876, 'atr_min_pct': 0.013550743531875818, 'atr_max_pct': 0.07783367718195813, 'tp_mult': 2.5235807422643575, 'tsl_mult': 0.5503104042540168, 'strategy': 'breakout', 'time_stop': 227, 'use_sma': False, 'use_atr': True, 'use_adx': True, 'use_ema': False, 'use_spike': False, 'rsi_required': False, 'edge_k': 0.5158175363700206, 'edge_cap': 0.9333456245991365, 'bull_strategy': 'breakout', 'bull_bb_std_mult': 1.8113301329702394, 'bull_rsi_os': 16, 'bull_rsi_ob': 48, 'bull_adx_thresh': 10.104700608818558, 'bull_atr_min_pct': 0.012779177355875177, 'bull_atr_max_pct': 0.01840195422452434, 'bull_tp_mult': 1.942149602877113, 'bull_tsl_mult': 0.30141938408583424, 'bull_time_stop': 233, 'bull_use_sma': True, 'bull_use_ema': False, 'bull_use_atr': False, 'bull_use_adx': True, 'bull_use_spike': False, 'bull_rsi_required': True, 'bear_strategy': 'mean_reversion', 'bear_bb_std_mult': 2.811063670654076, 'bear_rsi_os': 7, 'bear_rsi_ob': 63, 'bear_adx_thresh': 28.558616341078782, 'bear_atr_min_pct': 0.023169910804131118, 'bear_atr_max_pct': 0.10751978815923388, 'bear_tp_mult': 2.5999852127824825, 'bear_tsl_mult': 0.7706875980822678, 'bear_time_stop': 293, 'bear_use_sma': False, 'bear_use_ema': False, 'bear_use_atr': False, 'bear_use_adx': True, 'bear_use_spike': False, 'bear_rsi_required': False, 'sideways_strategy': 'mean_reversion', 'sideways_bb_std_mult': 2.4210325907098316, 'sideways_rsi_os': 14, 'sideways_rsi_ob': 90, 'sideways_adx_thresh': 5.732310371311199, 'sideways_atr_min_pct': 0.006779897785073248, 'sideways_atr_max_pct': 0.09772629431644841, 'sideways_tp_mult': 1.5849005955281625, 'sideways_tsl_mult': 0.001212259408751415, 'sideways_time_stop': 136, 'sideways_use_sma': False, 'sideways_use_ema': True, 'sideways_use_atr': True, 'sideways_use_adx': False, 'sideways_use_spike': True, 'sideways_rsi_required': True}.
[I 2025-09-01 14:40:49,069] Trial 310 finished with values: [-1000000000.0, 1000000000.0] and parameters: {'p_sma': 12, 'p_std': 5, 'p_atr': 20, 'p_adx': 25, 'rsi_period': 60, 'ema1': 24, 'ema2': 24, 'slip_atr_k': 0.059960223716772273, 'slip_spread_k': 0.944271418246534, 'spread_hl_frac': 0.015501059846058962, 'bb_std_mult': 1.1619883142053702, 'rsi_os': 46, 'rsi_ob': 72, 'vol_spike': 0.1014146861468021, 'adx_thresh': 28.5445642017562, 'atr_min_pct': 0.015116504145467429, 'atr_max_pct': 0.0775348435600224, 'tp_mult': 2.9231055698814927, 'tsl_mult': 0.8115444750687442, 'strategy': 'breakout', 'time_stop': 57, 'use_sma': False, 'use_atr': True, 'use_adx': True, 'use_ema': True, 'use_spike': False, 'rsi_required': False, 'edge_k': 1.8789579802839054, 'edge_cap': 0.10432535287216188, 'bull_strategy': 'breakout', 'bull_bb_std_mult': 2.899349382948322, 'bull_rsi_os': 16, 'bull_rsi_ob': 48, 'bull_adx_thresh': 11.57883906579714, 'bull_atr_min_pct': 0.009978344175520758, 'bull_atr_max_pct': 0.041389140115722214, 'bull_tp_mult': 2.850616863378079, 'bull_tsl_mult': 0.29581390070299063, 'bull_time_stop': 166, 'bull_use_sma': True, 'bull_use_ema': True, 'bull_use_atr': True, 'bull_use_adx': True, 'bull_use_spike': True, 'bull_rsi_required': True, 'bear_strategy': 'mean_reversion', 'bear_bb_std_mult': 2.8136180457093607, 'bear_rsi_os': 21, 'bear_rsi_ob': 60, 'bear_adx_thresh': 27.62928616924988, 'bear_atr_min_pct': 0.023010205645088298, 'bear_atr_max_pct': 0.10651144330359358, 'bear_tp_mult': 2.385735659524047, 'bear_tsl_mult': 0.16600223926700147, 'bear_time_stop': 292, 'bear_use_sma': True, 'bear_use_ema': False, 'bear_use_atr': True, 'bear_use_adx': False, 'bear_use_spike': False, 'bear_rsi_required': False, 'sideways_strategy': 'mean_reversion', 'sideways_bb_std_mult': 3.403553058354151, 'sideways_rsi_os': 36, 'sideways_rsi_ob': 46, 'sideways_adx_thresh': 5.765437173966868, 'sideways_atr_min_pct': 0.006620194499490312, 'sideways_atr_max_pct': 0.12647934873171227, 'sideways_tp_mult': 1.6638293343875963, 'sideways_tsl_mult': 0.29880464080728636, 'sideways_time_stop': 96, 'sideways_use_sma': False, 'sideways_use_ema': False, 'sideways_use_atr': True, 'sideways_use_adx': False, 'sideways_use_spike': True, 'sideways_rsi_required': True}.
[I 2025-09-01 14:41:22,557] Trial 315 finished with values: [-1000000000.0, 1000000000.0] and parameters: {'p_sma': 52, 'p_std': 41, 'p_atr': 13, 'p_adx': 7, 'rsi_period': 34, 'ema1': 28, 'ema2': 52, 'slip_atr_k': 0.04982944316065133, 'slip_spread_k': 0.9473481497635206, 'spread_hl_frac': 0.014542627435486689, 'bb_std_mult': 0.7988389816282753, 'rsi_os': 25, 'rsi_ob': 55, 'vol_spike': 0.13652696434077322, 'adx_thresh': 22.054463067172332, 'atr_min_pct': 0.005141736403312849, 'atr_max_pct': 0.07405867550604782, 'tp_mult': 2.89677221751237, 'tsl_mult': 0.14730084455107, 'strategy': 'mean_reversion', 'time_stop': 133, 'use_sma': True, 'use_atr': True, 'use_adx': False, 'use_ema': False, 'use_spike': True, 'rsi_required': False, 'edge_k': 1.8629384504555722, 'edge_cap': 0.3071618388766031, 'bull_strategy': 'breakout', 'bull_bb_std_mult': 2.9057560765985295, 'bull_rsi_os': 51, 'bull_rsi_ob': 46, 'bull_adx_thresh': 25.526274474602296, 'bull_atr_min_pct': 0.014199150620240504, 'bull_atr_max_pct': 0.02318660094805272, 'bull_tp_mult': 2.404786646689033, 'bull_tsl_mult': 0.413072352221369, 'bull_time_stop': 145, 'bull_use_sma': False, 'bull_use_ema': False, 'bull_use_atr': False, 'bull_use_adx': False, 'bull_use_spike': False, 'bull_rsi_required': True, 'bear_strategy': 'breakout', 'bear_bb_std_mult': 2.8867712438911033, 'bear_rsi_os': 55, 'bear_rsi_ob': 77, 'bear_adx_thresh': 26.56065305450587, 'bear_atr_min_pct': 0.01114154476177604, 'bear_atr_max_pct': 0.11021661126536776, 'bear_tp_mult': 2.560909748834516, 'bear_tsl_mult': 0.6574705471717437, 'bear_time_stop': 285, 'bear_use_sma': False, 'bear_use_ema': False, 'bear_use_atr': False, 'bear_use_adx': True, 'bear_use_spike': False, 'bear_rsi_required': True, 'sideways_strategy': 'mean_reversion', 'sideways_bb_std_mult': 3.4877000250966654, 'sideways_rsi_os': 19, 'sideways_rsi_ob': 59, 'sideways_adx_thresh': 10.01615338914036, 'sideways_atr_min_pct': 0.004736780197084543, 'sideways_atr_max_pct': 0.05015809596189323, 'sideways_tp_mult': 1.8262269871976493, 'sideways_tsl_mult': 0.30207045651666153, 'sideways_time_stop': 120, 'sideways_use_sma': False, 'sideways_use_ema': False, 'sideways_use_atr': False, 'sideways_use_adx': True, 'sideways_use_spike': False, 'sideways_rsi_required': False}.
