[I 2025-09-01 15:09:36,495] Trial 487 finished with values: [-1000000000.0, 1000000000.0] and parameters: {'p_sma': 44, 'p_std': 9, 'p_atr': 25, 'p_adx': 12, 'rsi_period': 63, 'ema1': 14, 'ema2': 53, 'slip_atr_k': 0.0948791649116717, 'slip_spread_k': 0.16672802397637088, 'spread_hl_frac': 0.02409977678586542, 'bb_std_mult': 1.4018920404344442, 'rsi_os': 36, 'rsi_ob': 72, 'vol_spike': 0.29983867575655343, 'adx_thresh': 19.649553263223396, 'atr_min_pct': 0.014290517993296592, 'atr_max_pct': 0.07440208694925159, 'tp_mult': 2.9334845863678085, 'tsl_mult': 0.1273555422753655, 'strategy': 'breakout', 'time_stop': 156, 'use_sma': False, 'use_atr': True, 'use_adx': False, 'use_ema': False, 'use_spike': True, 'rsi_required': False, 'edge_k': 0.48979237978102647, 'edge_cap': 0.05055971325656211, 'bull_strategy': 'breakout', 'bull_bb_std_mult': 3.0050325899291437, 'bull_rsi_os': 16, 'bull_rsi_ob': 52, 'bull_adx_thresh': 21.863578249701085, 'bull_atr_min_pct': 0.009429468933174284, 'bull_atr_max_pct': 0.13217783087288454, 'bull_tp_mult': 2.535758448243163, 'bull_tsl_mult': 0.6418562907914325, 'bull_time_stop': 85, 'bull_use_sma': True, 'bull_use_ema': False, 'bull_use_atr': False, 'bull_use_adx': True, 'bull_use_spike': False, 'bull_rsi_required': True, 'bear_strategy': 'mean_reversion', 'bear_bb_std_mult': 1.6593537349533984, 'bear_rsi_os': 23, 'bear_rsi_ob': 56, 'bear_adx_thresh': 24.146689326027122, 'bear_atr_min_pct': 0.011562590290487907, 'bear_atr_max_pct': 0.11454902920384923, 'bear_tp_mult': 2.453997194476879, 'bear_tsl_mult': 0.5977848899582495, 'bear_time_stop': 106, 'bear_use_sma': False, 'bear_use_ema': False, 'bear_use_atr': False, 'bear_use_adx': True, 'bear_use_spike': False, 'bear_rsi_required': True, 'sideways_strategy': 'mean_reversion', 'sideways_bb_std_mult': 3.424050021683327, 'sideways_rsi_os': 13, 'sideways_rsi_ob': 88, 'sideways_adx_thresh': 22.085782189944563, 'sideways_atr_min_pct': 0.0031813380348639083, 'sideways_atr_max_pct': 0.1386389839143275, 'sideways_tp_mult': 1.8175645088009387, 'sideways_tsl_mult': 0.3640322796691222, 'sideways_time_stop': 104, 'sideways_use_sma': False, 'sideways_use_ema': False, 'sideways_use_atr': True, 'sideways_use_adx': False, 'sideways_use_spike': True, 'sideways_rsi_required': True}.
[I 2025-09-01 15:09:37,348] Trial 484 finished with values: [-1000000000.0, 1000000000.0] and parameters: {'p_sma': 12, 'p_std': 46, 'p_atr': 20, 'p_adx': 26, 'rsi_period': 84, 'ema1': 29, 'ema2': 53, 'slip_atr_k': 0.15654503074066214, 'slip_spread_k': 0.18005117424930894, 'spread_hl_frac': 0.008135718831119874, 'bb_std_mult': 3.459128714488588, 'rsi_os': 36, 'rsi_ob': 72, 'vol_spike': 0.05777484677441175, 'adx_thresh': 20.48197522255972, 'atr_min_pct': 0.009825690798302256, 'atr_max_pct': 0.07118665649712778, 'tp_mult': 2.8956537868028738, 'tsl_mult': 0.23900670537656993, 'strategy': 'breakout', 'time_stop': 236, 'use_sma': False, 'use_atr': True, 'use_adx': True, 'use_ema': False, 'use_spike': False, 'rsi_required': False, 'edge_k': 0.6048590083227593, 'edge_cap': 0.190603836931865, 'bull_strategy': 'mean_reversion', 'bull_bb_std_mult': 3.314267354904005, 'bull_rsi_os': 18, 'bull_rsi_ob': 47, 'bull_adx_thresh': 10.626877915272644, 'bull_atr_min_pct': 0.02325974338689022, 'bull_atr_max_pct': 0.020024515305841158, 'bull_tp_mult': 2.0485404806614214, 'bull_tsl_mult': 0.37170438001334516, 'bull_time_stop': 155, 'bull_use_sma': True, 'bull_use_ema': False, 'bull_use_atr': False, 'bull_use_adx': True, 'bull_use_spike': True, 'bull_rsi_required': True, 'bear_strategy': 'mean_reversion', 'bear_bb_std_mult': 2.2249062260470853, 'bear_rsi_os': 23, 'bear_rsi_ob': 78, 'bear_adx_thresh': 14.444393206235281, 'bear_atr_min_pct': 0.02459123561239754, 'bear_atr_max_pct': 0.05341717770087493, 'bear_tp_mult': 1.7866480291385862, 'bear_tsl_mult': 0.5940832843060235, 'bear_time_stop': 104, 'bear_use_sma': False, 'bear_use_ema': False, 'bear_use_atr': False, 'bear_use_adx': False, 'bear_use_spike': False, 'bear_rsi_required': False, 'sideways_strategy': 'mean_reversion', 'sideways_bb_std_mult': 3.230888504346991, 'sideways_rsi_os': 18, 'sideways_rsi_ob': 75, 'sideways_adx_thresh': 10.549029636022194, 'sideways_atr_min_pct': 0.017606868678909666, 'sideways_atr_max_pct': 0.06852835642774541, 'sideways_tp_mult': 1.8250642601146336, 'sideways_tsl_mult': 0.36215620290432815, 'sideways_time_stop': 111, 'sideways_use_sma': False, 'sideways_use_ema': False, 'sideways_use_atr': True, 'sideways_use_adx': False, 'sideways_use_spike': True, 'sideways_rsi_required': True}.
[I 2025-09-01 15:10:23,127] Trial 489 finished with values: [-1000000000.0, 1000000000.0] and parameters: {'p_sma': 12, 'p_std': 11, 'p_atr': 20, 'p_adx': 26, 'rsi_period': 28, 'ema1': 23, 'ema2': 52, 'slip_atr_k': 0.09254656982386786, 'slip_spread_k': 0.7780016918165547, 'spread_hl_frac': 0.026445866275420435, 'bb_std_mult': 1.4054174458262627, 'rsi_os': 36, 'rsi_ob': 74, 'vol_spike': 0.13956145724009514, 'adx_thresh': 20.3833922607884, 'atr_min_pct': 0.016670744360400454, 'atr_max_pct': 0.11507961008832072, 'tp_mult': 1.6272885381569084, 'tsl_mult': 0.12602264209343808, 'strategy': 'breakout', 'time_stop': 65, 'use_sma': True, 'use_atr': True, 'use_adx': True, 'use_ema': False, 'use_spike': True, 'rsi_required': False, 'edge_k': 0.5491870999802841, 'edge_cap': 0.050045298071971556, 'bull_strategy': 'breakout', 'bull_bb_std_mult': 2.8480822207102694, 'bull_rsi_os': 15, 'bull_rsi_ob': 47, 'bull_adx_thresh': 10.750776620757868, 'bull_atr_min_pct': 0.026174097850727503, 'bull_atr_max_pct': 0.06353736852528112, 'bull_tp_mult': 1.9604945655262356, 'bull_tsl_mult': 0.3360143834136476, 'bull_time_stop': 283, 'bull_use_sma': True, 'bull_use_ema': False, 'bull_use_atr': False, 'bull_use_adx': True, 'bull_use_spike': False, 'bull_rsi_required': True, 'bear_strategy': 'mean_reversion', 'bear_bb_std_mult': 2.738700407109706, 'bear_rsi_os': 23, 'bear_rsi_ob': 87, 'bear_adx_thresh': 13.014745926765546, 'bear_atr_min_pct': 0.001345226917921433, 'bear_atr_max_pct': 0.11098842605673295, 'bear_tp_mult': 2.558626110947972, 'bear_tsl_mult': 0.46026741804136295, 'bear_time_stop': 103, 'bear_use_sma': False, 'bear_use_ema': False, 'bear_use_atr': False, 'bear_use_adx': True, 'bear_use_spike': False, 'bear_rsi_required': False, 'sideways_strategy': 'mean_reversion', 'sideways_bb_std_mult': 3.4077359593150547, 'sideways_rsi_os': 13, 'sideways_rsi_ob': 88, 'sideways_adx_thresh': 18.078137620992507, 'sideways_atr_min_pct': 0.00545332954142166, 'sideways_atr_max_pct': 0.13240179442546046, 'sideways_tp_mult': 1.7792819384148644, 'sideways_tsl_mult': 0.32544932586140607, 'sideways_time_stop': 180, 'sideways_use_sma': False, 'sideways_use_ema': True, 'sideways_use_atr': True, 'sideways_use_adx': False, 'sideways_use_spike': False, 'sideways_rsi_required': True}.
[I 2025-09-01 15:10:23,788] Trial 490 finished with values: [-1000000000.0, 1000000000.0] and parameters: {'p_sma': 12, 'p_std': 22, 'p_atr': 20, 'p_adx': 26, 'rsi_period': 61, 'ema1': 30, 'ema2': 37, 'slip_atr_k': 0.15119315672186376, 'slip_spread_k': 0.7055767166541473, 'spread_hl_frac': 0.037673451390381606, 'bb_std_mult': 1.5246887889711287, 'rsi_os': 38, 'rsi_ob': 74, 'vol_spike': 0.05501053486908378, 'adx_thresh': 19.26089192017748, 'atr_min_pct': 0.01685606727984636, 'atr_max_pct': 0.07741910835862445, 'tp_mult': 1.8252766459440677, 'tsl_mult': 0.408370607345701, 'strategy': 'breakout', 'time_stop': 233, 'use_sma': True, 'use_atr': True, 'use_adx': True, 'use_ema': False, 'use_spike': True, 'rsi_required': False, 'edge_k': 0.5497799750791771, 'edge_cap': 0.07960606171317888, 'bull_strategy': 'breakout', 'bull_bb_std_mult': 0.5643017502569383, 'bull_rsi_os': 18, 'bull_rsi_ob': 73, 'bull_adx_thresh': 10.47720879032123, 'bull_atr_min_pct': 0.023437830937807297, 'bull_atr_max_pct': 0.06411210010903182, 'bull_tp_mult': 1.9717576472936298, 'bull_tsl_mult': 0.8685634593304474, 'bull_time_stop': 146, 'bull_use_sma': True, 'bull_use_ema': True, 'bull_use_atr': False, 'bull_use_adx': True, 'bull_use_spike': False, 'bull_rsi_required': True, 'bear_strategy': 'breakout', 'bear_bb_std_mult': 2.7454558948499157, 'bear_rsi_os': 52, 'bear_rsi_ob': 87, 'bear_adx_thresh': 27.24073187065317, 'bear_atr_min_pct': 0.004409419911613373, 'bear_atr_max_pct': 0.1216067805799973, 'bear_tp_mult': 2.560793919062541, 'bear_tsl_mult': 0.6283505173001002, 'bear_time_stop': 42, 'bear_use_sma': True, 'bear_use_ema': False, 'bear_use_atr': False, 'bear_use_adx': True, 'bear_use_spike': False, 'bear_rsi_required': False, 'sideways_strategy': 'mean_reversion', 'sideways_bb_std_mult': 3.3262991258038856, 'sideways_rsi_os': 51, 'sideways_rsi_ob': 88, 'sideways_adx_thresh': 7.22023050966841, 'sideways_atr_min_pct': 0.006899031038508603, 'sideways_atr_max_pct': 0.149753485674244, 'sideways_tp_mult': 1.7761122971529923, 'sideways_tsl_mult': 0.7458573068100353, 'sideways_time_stop': 135, 'sideways_use_sma': True, 'sideways_use_ema': True, 'sideways_use_atr': True, 'sideways_use_adx': False, 'sideways_use_spike': False, 'sideways_rsi_required': True}.
[I 2025-09-01 15:10:24,353] Trial 491 finished with values: [-1000000000.0, 1000000000.0] and parameters: {'p_sma': 12, 'p_std': 52, 'p_atr': 23, 'p_adx': 26, 'rsi_period': 61, 'ema1': 6, 'ema2': 49, 'slip_atr_k': 0.053090901538405996, 'slip_spread_k': 0.2620936016717077, 'spread_hl_frac': 0.013647718410246479, 'bb_std_mult': 2.7814520463288703, 'rsi_os': 54, 'rsi_ob': 74, 'vol_spike': 0.261267574021545, 'adx_thresh': 19.243858735025494, 'atr_min_pct': 0.01666921593322099, 'atr_max_pct': 0.07584664250916673, 'tp_mult': 1.626555179766424, 'tsl_mult': 0.09755653043298121, 'strategy': 'breakout', 'time_stop': 76, 'use_sma': True, 'use_atr': True, 'use_adx': True, 'use_ema': False, 'use_spike': True, 'rsi_required': False, 'edge_k': 0.5494741438681633, 'edge_cap': 0.7874691404927949, 'bull_strategy': 'breakout', 'bull_bb_std_mult': 2.845006508936948, 'bull_rsi_os': 15, 'bull_rsi_ob': 92, 'bull_adx_thresh': 19.721271874089645, 'bull_atr_min_pct': 0.014530734546652997, 'bull_atr_max_pct': 0.06451529354718957, 'bull_tp_mult': 2.1218794689065064, 'bull_tsl_mult': 0.29240982642510993, 'bull_time_stop': 283, 'bull_use_sma': True, 'bull_use_ema': True, 'bull_use_atr': False, 'bull_use_adx': True, 'bull_use_spike': False, 'bull_rsi_required': True, 'bear_strategy': 'breakout', 'bear_bb_std_mult': 3.5118690731726585, 'bear_rsi_os': 8, 'bear_rsi_ob': 75, 'bear_adx_thresh': 20.032470227778447, 'bear_atr_min_pct': 0.0012213492342378948, 'bear_atr_max_pct': 0.11205671813381106, 'bear_tp_mult': 1.1815562981110825, 'bear_tsl_mult': 0.4615013483689265, 'bear_time_stop': 300, 'bear_use_sma': True, 'bear_use_ema': False, 'bear_use_atr': False, 'bear_use_adx': True, 'bear_use_spike': False, 'bear_rsi_required': False, 'sideways_strategy': 'mean_reversion', 'sideways_bb_std_mult': 3.319915042379743, 'sideways_rsi_os': 16, 'sideways_rsi_ob': 70, 'sideways_adx_thresh': 32.657834630439375, 'sideways_atr_min_pct': 0.007037446544403178, 'sideways_atr_max_pct': 0.13191369143921594, 'sideways_tp_mult': 1.7846970874349597, 'sideways_tsl_mult': 0.19786934903585557, 'sideways_time_stop': 239, 'sideways_use_sma': True, 'sideways_use_ema': True, 'sideways_use_atr': True, 'sideways_use_adx': False, 'sideways_use_spike': False, 'sideways_rsi_required': True}.
[I 2025-09-01 15:10:24,886] Trial 488 finished with values: [-1000000000.0, 1000000000.0] and parameters: {'p_sma': 12, 'p_std': 9, 'p_atr': 21, 'p_adx': 26, 'rsi_period': 30, 'ema1': 30, 'ema2': 25, 'slip_atr_k': 0.23233861151392185, 'slip_spread_k': 0.7100973549075554, 'spread_hl_frac': 0.01465827437585471, 'bb_std_mult': 2.499457555862264, 'rsi_os': 23, 'rsi_ob': 74, 'vol_spike': 0.02763171371414551, 'adx_thresh': 19.653056071201558, 'atr_min_pct': 0.016693253128645603, 'atr_max_pct': 0.12999854571399463, 'tp_mult': 2.9373950462752694, 'tsl_mult': 0.24499494044147319, 'strategy': 'breakout', 'time_stop': 234, 'use_sma': True, 'use_atr': True, 'use_adx': False, 'use_ema': False, 'use_spike': True, 'rsi_required': False, 'edge_k': 1.9991210906340884, 'edge_cap': 0.9611341659074528, 'bull_strategy': 'breakout', 'bull_bb_std_mult': 0.559667932886714, 'bull_rsi_os': 15, 'bull_rsi_ob': 72, 'bull_adx_thresh': 21.437211439422917, 'bull_atr_min_pct': 0.023479010085985186, 'bull_atr_max_pct': 0.020511614728567582, 'bull_tp_mult': 2.0567997559732554, 'bull_tsl_mult': 0.2910440613657608, 'bull_time_stop': 281, 'bull_use_sma': True, 'bull_use_ema': False, 'bull_use_atr': False, 'bull_use_adx': True, 'bull_use_spike': False, 'bull_rsi_required': True, 'bear_strategy': 'mean_reversion', 'bear_bb_std_mult': 2.796856492646669, 'bear_rsi_os': 55, 'bear_rsi_ob': 66, 'bear_adx_thresh': 28.25367657576119, 'bear_atr_min_pct': 0.012014857240178286, 'bear_atr_max_pct': 0.08155585852959973, 'bear_tp_mult': 2.4669968943786222, 'bear_tsl_mult': 0.15816619429541412, 'bear_time_stop': 275, 'bear_use_sma': False, 'bear_use_ema': False, 'bear_use_atr': False, 'bear_use_adx': True, 'bear_use_spike': False, 'bear_rsi_required': False, 'sideways_strategy': 'mean_reversion', 'sideways_bb_std_mult': 3.430247641732074, 'sideways_rsi_os': 12, 'sideways_rsi_ob': 63, 'sideways_adx_thresh': 22.12513468087679, 'sideways_atr_min_pct': 0.004294146350580581, 'sideways_atr_max_pct': 0.0996679650258428, 'sideways_tp_mult': 1.7802857521845616, 'sideways_tsl_mult': 0.7467644081145166, 'sideways_time_stop': 54, 'sideways_use_sma': False, 'sideways_use_ema': True, 'sideways_use_atr': True, 'sideways_use_adx': False, 'sideways_use_spike': False, 'sideways_rsi_required': True}.
[I 2025-09-01 15:10:26,156] Trial 493 finished with values: [-1000000000.0, 1000000000.0] and parameters: {'p_sma': 8, 'p_std': 30, 'p_atr': 22, 'p_adx': 25, 'rsi_period': 81, 'ema1': 30, 'ema2': 49, 'slip_atr_k': 0.055564570897166606, 'slip_spread_k': 0.836199986259285, 'spread_hl_frac': 0.013669691600063507, 'bb_std_mult': 1.5555773464852163, 'rsi_os': 55, 'rsi_ob': 70, 'vol_spike': 0.2561103599093016, 'adx_thresh': 17.713950149097172, 'atr_min_pct': 0.015617565532288645, 'atr_max_pct': 0.030236439328678713, 'tp_mult': 1.0918592506178606, 'tsl_mult': 0.09648976374539003, 'strategy': 'mean_reversion', 'time_stop': 75, 'use_sma': False, 'use_atr': True, 'use_adx': True, 'use_ema': False, 'use_spike': True, 'rsi_required': False, 'edge_k': 0.5008580722268652, 'edge_cap': 0.15266893470667692, 'bull_strategy': 'breakout', 'bull_bb_std_mult': 2.934581435611822, 'bull_rsi_os': 11, 'bull_rsi_ob': 61, 'bull_adx_thresh': 32.75945527808495, 'bull_atr_min_pct': 0.0066530263036418446, 'bull_atr_max_pct': 0.09411298315062608, 'bull_tp_mult': 2.116124207366425, 'bull_tsl_mult': 0.2992952830801698, 'bull_time_stop': 168, 'bull_use_sma': True, 'bull_use_ema': False, 'bull_use_atr': False, 'bull_use_adx': False, 'bull_use_spike': False, 'bull_rsi_required': True, 'bear_strategy': 'mean_reversion', 'bear_bb_std_mult': 2.5693017576761745, 'bear_rsi_os': 8, 'bear_rsi_ob': 75, 'bear_adx_thresh': 30.124421101671256, 'bear_atr_min_pct': 0.008544251203907921, 'bear_atr_max_pct': 0.06591803997461942, 'bear_tp_mult': 2.4983373799026607, 'bear_tsl_mult': 0.6181566881215166, 'bear_time_stop': 278, 'bear_use_sma': False, 'bear_use_ema': False, 'bear_use_atr': False, 'bear_use_adx': True, 'bear_use_spike': True, 'bear_rsi_required': False, 'sideways_strategy': 'mean_reversion', 'sideways_bb_std_mult': 1.945402468817914, 'sideways_rsi_os': 16, 'sideways_rsi_ob': 90, 'sideways_adx_thresh': 8.498579911213403, 'sideways_atr_min_pct': 0.023689732557568954, 'sideways_atr_max_pct': 0.048667515873901016, 'sideways_tp_mult': 2.1548540500039057, 'sideways_tsl_mult': 0.142739136900828, 'sideways_time_stop': 101, 'sideways_use_sma': False, 'sideways_use_ema': False, 'sideways_use_atr': False, 'sideways_use_adx': False, 'sideways_use_spike': True, 'sideways_rsi_required': False}.
[I 2025-09-01 15:11:03,918] Trial 492 finished with values: [-1000000000.0, 1000000000.0] and parameters: {'p_sma': 11, 'p_std': 52, 'p_atr': 19, 'p_adx': 25, 'rsi_period': 72, 'ema1': 30, 'ema2': 26, 'slip_atr_k': 0.22267048471299153, 'slip_spread_k': 0.2550127214429706, 'spread_hl_frac': 0.04995464396256566, 'bb_std_mult': 0.7327567094714447, 'rsi_os': 35, 'rsi_ob': 77, 'vol_spike': 0.2934833410906551, 'adx_thresh': 19.651618898356105, 'atr_min_pct': 0.015678322528901417, 'atr_max_pct': 0.05960024625281146, 'tp_mult': 1.0811093194550032, 'tsl_mult': 0.10348021688228665, 'strategy': 'mean_reversion', 'time_stop': 50, 'use_sma': False, 'use_atr': True, 'use_adx': True, 'use_ema': False, 'use_spike': True, 'rsi_required': False, 'edge_k': 1.4656186947516348, 'edge_cap': 0.7911498827412395, 'bull_strategy': 'breakout', 'bull_bb_std_mult': 2.931434258423286, 'bull_rsi_os': 24, 'bull_rsi_ob': 49, 'bull_adx_thresh': 11.884138199677327, 'bull_atr_min_pct': 0.0020215023613074238, 'bull_atr_max_pct': 0.07642907198921599, 'bull_tp_mult': 2.0134446710552987, 'bull_tsl_mult': 0.40396224062592245, 'bull_time_stop': 166, 'bull_use_sma': True, 'bull_use_ema': False, 'bull_use_atr': False, 'bull_use_adx': False, 'bull_use_spike': False, 'bull_rsi_required': True, 'bear_strategy': 'mean_reversion', 'bear_bb_std_mult': 2.8373437431785344, 'bear_rsi_os': 55, 'bear_rsi_ob': 75, 'bear_adx_thresh': 6.346479378457783, 'bear_atr_min_pct': 0.008594639659068651, 'bear_atr_max_pct': 0.06658345305686901, 'bear_tp_mult': 2.498468179156383, 'bear_tsl_mult': 0.40129541865524604, 'bear_time_stop': 285, 'bear_use_sma': False, 'bear_use_ema': False, 'bear_use_atr': False, 'bear_use_adx': True, 'bear_use_spike': True, 'bear_rsi_required': False, 'sideways_strategy': 'mean_reversion', 'sideways_bb_std_mult': 3.481291805731904, 'sideways_rsi_os': 16, 'sideways_rsi_ob': 50, 'sideways_adx_thresh': 25.6069643032447, 'sideways_atr_min_pct': 0.0021521897227799883, 'sideways_atr_max_pct': 0.09366309582866184, 'sideways_tp_mult': 1.9431355759552322, 'sideways_tsl_mult': 0.20125022239489432, 'sideways_time_stop': 207, 'sideways_use_sma': False, 'sideways_use_ema': False, 'sideways_use_atr': False, 'sideways_use_adx': False, 'sideways_use_spike': True, 'sideways_rsi_required': False}.
[I 2025-09-01 15:11:04,892] Trial 496 finished with values: [-1000000000.0, 1000000000.0] and parameters: {'p_sma': 5, 'p_std': 58, 'p_atr': 19, 'p_adx': 25, 'rsi_period': 24, 'ema1': 30, 'ema2': 43, 'slip_atr_k': 0.06135331871822328, 'slip_spread_k': 0.2537174679693186, 'spread_hl_frac': 0.016167070677116476, 'bb_std_mult': 0.7696443885551663, 'rsi_os': 12, 'rsi_ob': 76, 'vol_spike': 0.022171890181693188, 'adx_thresh': 31.91246967334782, 'atr_min_pct': 0.015391784334436888, 'atr_max_pct': 0.058646897890728716, 'tp_mult': 2.824678665936746, 'tsl_mult': 0.958545099239618, 'strategy': 'mean_reversion', 'time_stop': 56, 'use_sma': False, 'use_atr': False, 'use_adx': True, 'use_ema': True, 'use_spike': False, 'rsi_required': True, 'edge_k': 0.22118759564621893, 'edge_cap': 0.2279683380563861, 'bull_strategy': 'mean_reversion', 'bull_bb_std_mult': 2.1253707319858903, 'bull_rsi_os': 51, 'bull_rsi_ob': 81, 'bull_adx_thresh': 11.907230234839904, 'bull_atr_min_pct': 0.0022763410262018006, 'bull_atr_max_pct': 0.012145306808052578, 'bull_tp_mult': 2.0124798882561565, 'bull_tsl_mult': 0.40191173764265914, 'bull_time_stop': 228, 'bull_use_sma': False, 'bull_use_ema': False, 'bull_use_atr': True, 'bull_use_adx': False, 'bull_use_spike': True, 'bull_rsi_required': False, 'bear_strategy': 'mean_reversion', 'bear_bb_std_mult': 2.871211917265826, 'bear_rsi_os': 7, 'bear_rsi_ob': 94, 'bear_adx_thresh': 28.69546771937867, 'bear_atr_min_pct': 0.02352482553967771, 'bear_atr_max_pct': 0.11645530335511785, 'bear_tp_mult': 2.372601456266181, 'bear_tsl_mult': 0.637491814098101, 'bear_time_stop': 286, 'bear_use_sma': False, 'bear_use_ema': True, 'bear_use_atr': True, 'bear_use_adx': True, 'bear_use_spike': False, 'bear_rsi_required': False, 'sideways_strategy': 'breakout', 'sideways_bb_std_mult': 1.605460283713057, 'sideways_rsi_os': 44, 'sideways_rsi_ob': 91, 'sideways_adx_thresh': 6.530349907891914, 'sideways_atr_min_pct': 0.0059046033829472065, 'sideways_atr_max_pct': 0.1391321268180273, 'sideways_tp_mult': 1.88042570330524, 'sideways_tsl_mult': 0.5518575523027645, 'sideways_time_stop': 116, 'sideways_use_sma': False, 'sideways_use_ema': False, 'sideways_use_atr': False, 'sideways_use_adx': True, 'sideways_use_spike': True, 'sideways_rsi_required': True}.
