[I 2025-09-01 15:12:22,451] Trial 504 finished with values: [-1000000000.0, 1000000000.0] and parameters: {'p_sma': 14, 'p_std': 19, 'p_atr': 20, 'p_adx': 24, 'rsi_period': 69, 'ema1': 26, 'ema2': 15, 'slip_atr_k': 0.037542153141918375, 'slip_spread_k': 0.9458721583059857, 'spread_hl_frac': 0.018233067010266613, 'bb_std_mult': 1.5558285949561428, 'rsi_os': 44, 'rsi_ob': 56, 'vol_spike': 0.23559371296650916, 'adx_thresh': 34.287447251929194, 'atr_min_pct': 0.01471646660323567, 'atr_max_pct': 0.052067748964674226, 'tp_mult': 2.9635275425732712, 'tsl_mult': 0.03640042026551123, 'strategy': 'breakout', 'time_stop': 247, 'use_sma': False, 'use_atr': True, 'use_adx': True, 'use_ema': False, 'use_spike': True, 'rsi_required': False, 'edge_k': 0.5278444929560888, 'edge_cap': 0.06769769182984649, 'bull_strategy': 'breakout', 'bull_bb_std_mult': 1.7330290596827582, 'bull_rsi_os': 8, 'bull_rsi_ob': 46, 'bull_adx_thresh': 9.446522718786216, 'bull_atr_min_pct': 0.0035706556088128563, 'bull_atr_max_pct': 0.01543299101611693, 'bull_tp_mult': 2.43224695144674, 'bull_tsl_mult': 0.4791552063420205, 'bull_time_stop': 160, 'bull_use_sma': False, 'bull_use_ema': False, 'bull_use_atr': False, 'bull_use_adx': True, 'bull_use_spike': False, 'bull_rsi_required': True, 'bear_strategy': 'mean_reversion', 'bear_bb_std_mult': 2.794324381171171, 'bear_rsi_os': 46, 'bear_rsi_ob': 54, 'bear_adx_thresh': 32.77636651799981, 'bear_atr_min_pct': 0.02125688259457714, 'bear_atr_max_pct': 0.11022678899511844, 'bear_tp_mult': 2.524893678894, 'bear_tsl_mult': 0.4875549962232493, 'bear_time_stop': 156, 'bear_use_sma': False, 'bear_use_ema': False, 'bear_use_atr': False, 'bear_use_adx': True, 'bear_use_spike': False, 'bear_rsi_required': False, 'sideways_strategy': 'mean_reversion', 'sideways_bb_std_mult': 2.976325287081931, 'sideways_rsi_os': 42, 'sideways_rsi_ob': 87, 'sideways_adx_thresh': 7.298064872431008, 'sideways_atr_min_pct': 0.004829136686447514, 'sideways_atr_max_pct': 0.13645095656975634, 'sideways_tp_mult': 1.7237833304693044, 'sideways_tsl_mult': 0.3148336602578901, 'sideways_time_stop': 121, 'sideways_use_sma': False, 'sideways_use_ema': True, 'sideways_use_atr': True, 'sideways_use_adx': False, 'sideways_use_spike': True, 'sideways_rsi_required': True}.
[I 2025-09-01 15:12:23,515] Trial 507 finished with values: [-1000000000.0, 1000000000.0] and parameters: {'p_sma': 9, 'p_std': 9, 'p_atr': 20, 'p_adx': 14, 'rsi_period': 21, 'ema1': 7, 'ema2': 12, 'slip_atr_k': 0.1699983773731495, 'slip_spread_k': 0.41264058476436694, 'spread_hl_frac': 0.04460798078834411, 'bb_std_mult': 3.018667829403777, 'rsi_os': 40, 'rsi_ob': 93, 'vol_spike': 0.2769651619224189, 'adx_thresh': 15.884490346702094, 'atr_min_pct': 0.014858876386360733, 'atr_max_pct': 0.01044941673418072, 'tp_mult': 2.855270250639692, 'tsl_mult': 0.08181952863877151, 'strategy': 'breakout', 'time_stop': 67, 'use_sma': False, 'use_atr': True, 'use_adx': True, 'use_ema': True, 'use_spike': True, 'rsi_required': False, 'edge_k': 0.7968830157445963, 'edge_cap': 0.13104996586871973, 'bull_strategy': 'breakout', 'bull_bb_std_mult': 2.878042092165028, 'bull_rsi_os': 18, 'bull_rsi_ob': 52, 'bull_adx_thresh': 14.82023963332897, 'bull_atr_min_pct': 0.0038814700593494903, 'bull_atr_max_pct': 0.019339153416566803, 'bull_tp_mult': 2.0964218538304946, 'bull_tsl_mult': 0.48067961280414395, 'bull_time_stop': 128, 'bull_use_sma': False, 'bull_use_ema': False, 'bull_use_atr': True, 'bull_use_adx': True, 'bull_use_spike': False, 'bull_rsi_required': False, 'bear_strategy': 'mean_reversion', 'bear_bb_std_mult': 2.7762624638521762, 'bear_rsi_os': 43, 'bear_rsi_ob': 48, 'bear_adx_thresh': 28.21371576468763, 'bear_atr_min_pct': 0.023934603419597574, 'bear_atr_max_pct': 0.04060832048466006, 'bear_tp_mult': 2.550782894751328, 'bear_tsl_mult': 0.6537851276563904, 'bear_time_stop': 300, 'bear_use_sma': False, 'bear_use_ema': True, 'bear_use_atr': False, 'bear_use_adx': True, 'bear_use_spike': False, 'bear_rsi_required': False, 'sideways_strategy': 'mean_reversion', 'sideways_bb_std_mult': 2.4610036665030917, 'sideways_rsi_os': 7, 'sideways_rsi_ob': 89, 'sideways_adx_thresh': 6.966207432090936, 'sideways_atr_min_pct': 0.005256761476229686, 'sideways_atr_max_pct': 0.020992042411319148, 'sideways_tp_mult': 2.522683926822324, 'sideways_tsl_mult': 0.3118091901079236, 'sideways_time_stop': 171, 'sideways_use_sma': False, 'sideways_use_ema': True, 'sideways_use_atr': True, 'sideways_use_adx': True, 'sideways_use_spike': False, 'sideways_rsi_required': True}.
[I 2025-09-01 15:12:55,959] Trial 506 finished with values: [-1000000000.0, 1000000000.0] and parameters: {'p_sma': 14, 'p_std': 28, 'p_atr': 20, 'p_adx': 24, 'rsi_period': 69, 'ema1': 30, 'ema2': 50, 'slip_atr_k': 0.03885997804775566, 'slip_spread_k': 0.9593555728188347, 'spread_hl_frac': 0.04463072720191198, 'bb_std_mult': 1.5726311855242883, 'rsi_os': 37, 'rsi_ob': 93, 'vol_spike': 0.2373684013118968, 'adx_thresh': 9.050806403265943, 'atr_min_pct': 0.014609824321590966, 'atr_max_pct': 0.07557494029728036, 'tp_mult': 2.3095493546502253, 'tsl_mult': 0.5449540208574678, 'strategy': 'breakout', 'time_stop': 64, 'use_sma': False, 'use_atr': True, 'use_adx': True, 'use_ema': False, 'use_spike': True, 'rsi_required': False, 'edge_k': 0.5168286719554821, 'edge_cap': 0.11920987116410628, 'bull_strategy': 'breakout', 'bull_bb_std_mult': 3.140124846149874, 'bull_rsi_os': 14, 'bull_rsi_ob': 54, 'bull_adx_thresh': 13.227316097521282, 'bull_atr_min_pct': 0.0038592598605346456, 'bull_atr_max_pct': 0.013890755351608018, 'bull_tp_mult': 2.1366223890135356, 'bull_tsl_mult': 0.5257014806477055, 'bull_time_stop': 33, 'bull_use_sma': False, 'bull_use_ema': False, 'bull_use_atr': True, 'bull_use_adx': True, 'bull_use_spike': False, 'bull_rsi_required': True, 'bear_strategy': 'mean_reversion', 'bear_bb_std_mult': 2.9684536416941625, 'bear_rsi_os': 19, 'bear_rsi_ob': 48, 'bear_adx_thresh': 27.851197709744252, 'bear_atr_min_pct': 0.024037705719193652, 'bear_atr_max_pct': 0.10928244925611379, 'bear_tp_mult': 1.4848031975853142, 'bear_tsl_mult': 0.9093009251858611, 'bear_time_stop': 300, 'bear_use_sma': False, 'bear_use_ema': False, 'bear_use_atr': False, 'bear_use_adx': True, 'bear_use_spike': False, 'bear_rsi_required': False, 'sideways_strategy': 'mean_reversion', 'sideways_bb_std_mult': 2.96817577765622, 'sideways_rsi_os': 20, 'sideways_rsi_ob': 86, 'sideways_adx_thresh': 5.987165553316085, 'sideways_atr_min_pct': 0.004767484514372264, 'sideways_atr_max_pct': 0.14553978848699997, 'sideways_tp_mult': 1.8502720398715176, 'sideways_tsl_mult': 0.3159425131136852, 'sideways_time_stop': 173, 'sideways_use_sma': False, 'sideways_use_ema': True, 'sideways_use_atr': True, 'sideways_use_adx': True, 'sideways_use_spike': False, 'sideways_rsi_required': True}.
[I 2025-09-01 15:12:56,731] Trial 508 finished with values: [-0.017109693546032756, 0.01689315582682536] and parameters: {'p_sma': 37, 'p_std': 9, 'p_atr': 20, 'p_adx': 11, 'rsi_period': 20, 'ema1': 15, 'ema2': 18, 'slip_atr_k': 0.13009498998213018, 'slip_spread_k': 0.40733191794045964, 'spread_hl_frac': 0.00948822971426596, 'bb_std_mult': 1.6487242109640194, 'rsi_os': 34, 'rsi_ob': 93, 'vol_spike': 0.2739394093585705, 'adx_thresh': 20.10797606503247, 'atr_min_pct': 0.017424412007406687, 'atr_max_pct': 0.06902696240504055, 'tp_mult': 2.8548701991948224, 'tsl_mult': 0.5173893815157299, 'strategy': 'breakout', 'time_stop': 65, 'use_sma': True, 'use_atr': True, 'use_adx': True, 'use_ema': True, 'use_spike': True, 'rsi_required': False, 'edge_k': 0.8036487529717802, 'edge_cap': 0.5482020591238026, 'bull_strategy': 'breakout', 'bull_bb_std_mult': 2.8708595145454936, 'bull_rsi_os': 18, 'bull_rsi_ob': 66, 'bull_adx_thresh': 14.870904403396239, 'bull_atr_min_pct': 0.003998168957303207, 'bull_atr_max_pct': 0.0200077717390846, 'bull_tp_mult': 2.1076212420003015, 'bull_tsl_mult': 0.6074620651717291, 'bull_time_stop': 14, 'bull_use_sma': False, 'bull_use_ema': True, 'bull_use_atr': True, 'bull_use_adx': True, 'bull_use_spike': False, 'bull_rsi_required': False, 'bear_strategy': 'breakout', 'bear_bb_std_mult': 2.741670743887656, 'bear_rsi_os': 9, 'bear_rsi_ob': 49, 'bear_adx_thresh': 28.144070398560064, 'bear_atr_min_pct': 0.023793140763224398, 'bear_atr_max_pct': 0.11388987008075285, 'bear_tp_mult': 2.5279234691491763, 'bear_tsl_mult': 0.6450076606732583, 'bear_time_stop': 289, 'bear_use_sma': False, 'bear_use_ema': True, 'bear_use_atr': True, 'bear_use_adx': True, 'bear_use_spike': False, 'bear_rsi_required': False, 'sideways_strategy': 'mean_reversion', 'sideways_bb_std_mult': 3.2836295899858343, 'sideways_rsi_os': 46, 'sideways_rsi_ob': 89, 'sideways_adx_thresh': 6.1109611488828675, 'sideways_atr_min_pct': 0.02998868651057491, 'sideways_atr_max_pct': 0.14387509606859422, 'sideways_tp_mult': 1.838408758719041, 'sideways_tsl_mult': 0.2902385793539856, 'sideways_time_stop': 105, 'sideways_use_sma': True, 'sideways_use_ema': True, 'sideways_use_atr': True, 'sideways_use_adx': True, 'sideways_use_spike': False, 'sideways_rsi_required': True}.
[I 2025-09-01 15:12:57,646] Trial 505 finished with values: [-0.007484207926535813, 0.008059093957895893] and parameters: {'p_sma': 14, 'p_std': 9, 'p_atr': 20, 'p_adx': 24, 'rsi_period': 51, 'ema1': 7, 'ema2': 52, 'slip_atr_k': 0.04030105505195539, 'slip_spread_k': 0.21197381954552003, 'spread_hl_frac': 0.04447296040957786, 'bb_std_mult': 3.0321332463284767, 'rsi_os': 39, 'rsi_ob': 73, 'vol_spike': 0.29997268622984186, 'adx_thresh': 22.313160314609224, 'atr_min_pct': 0.014758599170978885, 'atr_max_pct': 0.07400701128680487, 'tp_mult': 2.8610183571782546, 'tsl_mult': 0.081616577460015, 'strategy': 'breakout', 'time_stop': 65, 'use_sma': False, 'use_atr': True, 'use_adx': True, 'use_ema': False, 'use_spike': True, 'rsi_required': False, 'edge_k': 0.5326432353542984, 'edge_cap': 0.5480127799616697, 'bull_strategy': 'breakout', 'bull_bb_std_mult': 3.1362463658670485, 'bull_rsi_os': 14, 'bull_rsi_ob': 45, 'bull_adx_thresh': 14.652063411761802, 'bull_atr_min_pct': 0.003961734114887579, 'bull_atr_max_pct': 0.11203463280703686, 'bull_tp_mult': 2.0895099424823855, 'bull_tsl_mult': 0.5341741558728869, 'bull_time_stop': 122, 'bull_use_sma': False, 'bull_use_ema': False, 'bull_use_atr': False, 'bull_use_adx': True, 'bull_use_spike': False, 'bull_rsi_required': True, 'bear_strategy': 'mean_reversion', 'bear_bb_std_mult': 2.785432005250206, 'bear_rsi_os': 46, 'bear_rsi_ob': 46, 'bear_adx_thresh': 27.698353564855612, 'bear_atr_min_pct': 0.011023076072090968, 'bear_atr_max_pct': 0.04381909941868068, 'bear_tp_mult': 1.8752740196635194, 'bear_tsl_mult': 0.4866854263978531, 'bear_time_stop': 272, 'bear_use_sma': False, 'bear_use_ema': False, 'bear_use_atr': False, 'bear_use_adx': True, 'bear_use_spike': False, 'bear_rsi_required': False, 'sideways_strategy': 'mean_reversion', 'sideways_bb_std_mult': 3.2793498401811636, 'sideways_rsi_os': 14, 'sideways_rsi_ob': 86, 'sideways_adx_thresh': 33.872798385927865, 'sideways_atr_min_pct': 0.0049474049777439464, 'sideways_atr_max_pct': 0.07962660573119297, 'sideways_tp_mult': 1.7171684654933868, 'sideways_tsl_mult': 0.682139100013139, 'sideways_time_stop': 122, 'sideways_use_sma': False, 'sideways_use_ema': True, 'sideways_use_atr': True, 'sideways_use_adx': False, 'sideways_use_spike': True, 'sideways_rsi_required': True}.
[I 2025-09-01 15:12:58,126] Trial 509 finished with values: [-1000000000.0, 1000000000.0] and parameters: {'p_sma': 55, 'p_std': 21, 'p_atr': 30, 'p_adx': 10, 'rsi_period': 64, 'ema1': 30, 'ema2': 56, 'slip_atr_k': 0.1303808603422097, 'slip_spread_k': 0.8649877570894612, 'spread_hl_frac': 0.009785423261039454, 'bb_std_mult': 3.2632058857372304, 'rsi_os': 34, 'rsi_ob': 75, 'vol_spike': 0.2864528924037864, 'adx_thresh': 9.460821832397471, 'atr_min_pct': 0.01726166029219624, 'atr_max_pct': 0.14312267867507517, 'tp_mult': 2.886649794444701, 'tsl_mult': 0.542962275477189, 'strategy': 'breakout', 'time_stop': 61, 'use_sma': True, 'use_atr': True, 'use_adx': False, 'use_ema': False, 'use_spike': True, 'rsi_required': False, 'edge_k': 0.9692569853143145, 'edge_cap': 0.5554361634765813, 'bull_strategy': 'breakout', 'bull_bb_std_mult': 2.9819977573691747, 'bull_rsi_os': 14, 'bull_rsi_ob': 54, 'bull_adx_thresh': 22.591091023235624, 'bull_atr_min_pct': 0.00429584875972243, 'bull_atr_max_pct': 0.012909502691207811, 'bull_tp_mult': 1.3367821451931707, 'bull_tsl_mult': 0.3720493002824336, 'bull_time_stop': 59, 'bull_use_sma': True, 'bull_use_ema': True, 'bull_use_atr': False, 'bull_use_adx': True, 'bull_use_spike': False, 'bull_rsi_required': True, 'bear_strategy': 'breakout', 'bear_bb_std_mult': 2.96047530098524, 'bear_rsi_os': 9, 'bear_rsi_ob': 78, 'bear_adx_thresh': 29.196225504135047, 'bear_atr_min_pct': 0.01673853642213454, 'bear_atr_max_pct': 0.08978391701541623, 'bear_tp_mult': 2.5915985652434044, 'bear_tsl_mult': 0.6696104193224021, 'bear_time_stop': 289, 'bear_use_sma': True, 'bear_use_ema': False, 'bear_use_atr': True, 'bear_use_adx': True, 'bear_use_spike': False, 'bear_rsi_required': False, 'sideways_strategy': 'mean_reversion', 'sideways_bb_std_mult': 2.8365706394972126, 'sideways_rsi_os': 20, 'sideways_rsi_ob': 89, 'sideways_adx_thresh': 5.481850943339104, 'sideways_atr_min_pct': 0.006393161879212345, 'sideways_atr_max_pct': 0.14652119269652047, 'sideways_tp_mult': 1.8631288140464903, 'sideways_tsl_mult': 0.8384076080680681, 'sideways_time_stop': 106, 'sideways_use_sma': True, 'sideways_use_ema': False, 'sideways_use_atr': True, 'sideways_use_adx': True, 'sideways_use_spike': True, 'sideways_rsi_required': True}.
[I 2025-09-01 15:13:39,599] Trial 513 finished with values: [-1000000000.0, 1000000000.0] and parameters: {'p_sma': 11, 'p_std': 24, 'p_atr': 20, 'p_adx': 25, 'rsi_period': 15, 'ema1': 29, 'ema2': 54, 'slip_atr_k': 0.12179739197241295, 'slip_spread_k': 0.1445560779086958, 'spread_hl_frac': 0.001516377436864464, 'bb_std_mult': 1.441829048339967, 'rsi_os': 36, 'rsi_ob': 66, 'vol_spike': 0.2926924258540636, 'adx_thresh': 21.785938150810896, 'atr_min_pct': 0.016172707174769898, 'atr_max_pct': 0.07813574489708494, 'tp_mult': 2.902185339254469, 'tsl_mult': 0.009568696490301232, 'strategy': 'breakout', 'time_stop': 43, 'use_sma': False, 'use_atr': False, 'use_adx': False, 'use_ema': False, 'use_spike': True, 'rsi_required': True, 'edge_k': 0.5624586429607211, 'edge_cap': 0.09661859969225527, 'bull_strategy': 'breakout', 'bull_bb_std_mult': 3.455341210243703, 'bull_rsi_os': 17, 'bull_rsi_ob': 51, 'bull_adx_thresh': 17.091069163080842, 'bull_atr_min_pct': 0.003304096030762895, 'bull_atr_max_pct': 0.11293733260644666, 'bull_tp_mult': 1.2286708168370808, 'bull_tsl_mult': 0.3096631666265663, 'bull_time_stop': 143, 'bull_use_sma': True, 'bull_use_ema': False, 'bull_use_atr': False, 'bull_use_adx': True, 'bull_use_spike': False, 'bull_rsi_required': True, 'bear_strategy': 'mean_reversion', 'bear_bb_std_mult': 3.1778673931638037, 'bear_rsi_os': 48, 'bear_rsi_ob': 76, 'bear_adx_thresh': 26.752960112289248, 'bear_atr_min_pct': 0.02856671803732, 'bear_atr_max_pct': 0.0433267920739536, 'bear_tp_mult': 2.807000103843157, 'bear_tsl_mult': 0.6245042139632749, 'bear_time_stop': 271, 'bear_use_sma': False, 'bear_use_ema': False, 'bear_use_atr': False, 'bear_use_adx': True, 'bear_use_spike': True, 'bear_rsi_required': False, 'sideways_strategy': 'breakout', 'sideways_bb_std_mult': 1.0636329081153637, 'sideways_rsi_os': 14, 'sideways_rsi_ob': 68, 'sideways_adx_thresh': 34.05544808593778, 'sideways_atr_min_pct': 0.005611684140790501, 'sideways_atr_max_pct': 0.057950093244262764, 'sideways_tp_mult': 1.911403181606185, 'sideways_tsl_mult': 0.2346406509905562, 'sideways_time_stop': 190, 'sideways_use_sma': False, 'sideways_use_ema': False, 'sideways_use_atr': True, 'sideways_use_adx': False, 'sideways_use_spike': True, 'sideways_rsi_required': False}.
[I 2025-09-01 15:13:39,900] Trial 512 finished with values: [-0.02035645561953192, 0.020216563558500825] and parameters: {'p_sma': 55, 'p_std': 11, 'p_atr': 30, 'p_adx': 25, 'rsi_period': 51, 'ema1': 12, 'ema2': 51, 'slip_atr_k': 0.06474204541467699, 'slip_spread_k': 0.10004033694753434, 'spread_hl_frac': 0.01535601994079463, 'bb_std_mult': 1.422700013439578, 'rsi_os': 20, 'rsi_ob': 73, 'vol_spike': 0.2839879134402939, 'adx_thresh': 20.672415237993754, 'atr_min_pct': 0.016060239164003967, 'atr_max_pct': 0.10595051933309631, 'tp_mult': 2.9144765842659797, 'tsl_mult': 0.014824854908922262, 'strategy': 'breakout', 'time_stop': 81, 'use_sma': False, 'use_atr': False, 'use_adx': False, 'use_ema': False, 'use_spike': True, 'rsi_required': True, 'edge_k': 0.9818028809712461, 'edge_cap': 0.09769870192175852, 'bull_strategy': 'breakout', 'bull_bb_std_mult': 3.596220421972821, 'bull_rsi_os': 27, 'bull_rsi_ob': 51, 'bull_adx_thresh': 7.926493584315347, 'bull_atr_min_pct': 0.003258587757917832, 'bull_atr_max_pct': 0.13021442887616472, 'bull_tp_mult': 2.056274531701287, 'bull_tsl_mult': 0.7350044826267307, 'bull_time_stop': 58, 'bull_use_sma': True, 'bull_use_ema': False, 'bull_use_atr': False, 'bull_use_adx': True, 'bull_use_spike': False, 'bull_rsi_required': True, 'bear_strategy': 'mean_reversion', 'bear_bb_std_mult': 2.518581574387202, 'bear_rsi_os': 11, 'bear_rsi_ob': 78, 'bear_adx_thresh': 22.179274738504635, 'bear_atr_min_pct': 0.028722058694739414, 'bear_atr_max_pct': 0.11574474748058566, 'bear_tp_mult': 2.760227739791682, 'bear_tsl_mult': 0.6718780413912635, 'bear_time_stop': 289, 'bear_use_sma': True, 'bear_use_ema': False, 'bear_use_atr': False, 'bear_use_adx': True, 'bear_use_spike': False, 'bear_rsi_required': False, 'sideways_strategy': 'breakout', 'sideways_bb_std_mult': 3.347037423058055, 'sideways_rsi_os': 14, 'sideways_rsi_ob': 91, 'sideways_adx_thresh': 5.38045191802172, 'sideways_atr_min_pct': 0.010699723894840803, 'sideways_atr_max_pct': 0.13243786403823185, 'sideways_tp_mult': 1.9265093186222224, 'sideways_tsl_mult': 0.22895398303157555, 'sideways_time_stop': 107, 'sideways_use_sma': False, 'sideways_use_ema': False, 'sideways_use_atr': True, 'sideways_use_adx': False, 'sideways_use_spike': True, 'sideways_rsi_required': False}.
[I 2025-09-01 15:13:40,138] Trial 511 finished with values: [-1000000000.0, 1000000000.0] and parameters: {'p_sma': 55, 'p_std': 44, 'p_atr': 20, 'p_adx': 25, 'rsi_period': 15, 'ema1': 29, 'ema2': 54, 'slip_atr_k': 0.06380560163391442, 'slip_spread_k': 0.23769026801312845, 'spread_hl_frac': 0.0017840135010989688, 'bb_std_mult': 1.4235798879289252, 'rsi_os': 39, 'rsi_ob': 73, 'vol_spike': 0.29417604231377525, 'adx_thresh': 20.563131061161748, 'atr_min_pct': 0.011691146717915716, 'atr_max_pct': 0.07818259599922313, 'tp_mult': 2.913189959913321, 'tsl_mult': 0.0027176913619335816, 'strategy': 'breakout', 'time_stop': 79, 'use_sma': True, 'use_atr': False, 'use_adx': False, 'use_ema': False, 'use_spike': True, 'rsi_required': True, 'edge_k': 0.9697619754258607, 'edge_cap': 0.7343553740463855, 'bull_strategy': 'breakout', 'bull_bb_std_mult': 2.9923994714332336, 'bull_rsi_os': 17, 'bull_rsi_ob': 51, 'bull_adx_thresh': 33.6812886417871, 'bull_atr_min_pct': 0.0033527131913691686, 'bull_atr_max_pct': 0.04248338220070604, 'bull_tp_mult': 2.6506016668437913, 'bull_tsl_mult': 0.43584211473319967, 'bull_time_stop': 143, 'bull_use_sma': True, 'bull_use_ema': False, 'bull_use_atr': False, 'bull_use_adx': True, 'bull_use_spike': False, 'bull_rsi_required': True, 'bear_strategy': 'mean_reversion', 'bear_bb_std_mult': 2.708652982969782, 'bear_rsi_os': 35, 'bear_rsi_ob': 52, 'bear_adx_thresh': 17.067506169999685, 'bear_atr_min_pct': 0.022286533610015247, 'bear_atr_max_pct': 0.11905173275080129, 'bear_tp_mult': 2.8123727109615375, 'bear_tsl_mult': 0.6728086368543625, 'bear_time_stop': 94, 'bear_use_sma': True, 'bear_use_ema': False, 'bear_use_atr': False, 'bear_use_adx': True, 'bear_use_spike': True, 'bear_rsi_required': False, 'sideways_strategy': 'breakout', 'sideways_bb_std_mult': 3.3508494611752835, 'sideways_rsi_os': 14, 'sideways_rsi_ob': 53, 'sideways_adx_thresh': 9.059237781851326, 'sideways_atr_min_pct': 0.006471494617732094, 'sideways_atr_max_pct': 0.13276015832691568, 'sideways_tp_mult': 1.8975272713365743, 'sideways_tsl_mult': 0.23808672036975193, 'sideways_time_stop': 133, 'sideways_use_sma': False, 'sideways_use_ema': False, 'sideways_use_atr': True, 'sideways_use_adx': False, 'sideways_use_spike': True, 'sideways_rsi_required': False}.
