[I 2025-09-01 14:24:50,109] Trial 210 finished with values: [-1000000000.0, 1000000000.0] and parameters: {'p_sma': 12, 'p_std': 8, 'p_atr': 21, 'p_adx': 26, 'rsi_period': 23, 'ema1': 6, 'ema2': 49, 'slip_atr_k': 0.027767172480451782, 'slip_spread_k': 0.18368668227997378, 'spread_hl_frac': 0.02969117369912698, 'bb_std_mult': 1.6473789056261352, 'rsi_os': 35, 'rsi_ob': 73, 'vol_spike': 0.28266568575625955, 'adx_thresh': 20.796467136248772, 'atr_min_pct': 0.016662601651490038, 'atr_max_pct': 0.08336741862177253, 'tp_mult': 2.93836787779865, 'tsl_mult': 0.10041116252705187, 'strategy': 'breakout', 'time_stop': 93, 'use_sma': True, 'use_atr': True, 'use_adx': False, 'use_ema': False, 'use_spike': True, 'rsi_required': False, 'edge_k': 0.48476647828203384, 'edge_cap': 0.050421948596154204, 'bull_strategy': 'breakout', 'bull_bb_std_mult': 2.5923836322689975, 'bull_rsi_os': 20, 'bull_rsi_ob': 48, 'bull_adx_thresh': 10.26172679424192, 'bull_atr_min_pct': 0.016926582818454085, 'bull_atr_max_pct': 0.021794094119884474, 'bull_tp_mult': 2.203460569668438, 'bull_tsl_mult': 0.4214989469226914, 'bull_time_stop': 144, 'bull_use_sma': True, 'bull_use_ema': False, 'bull_use_atr': False, 'bull_use_adx': False, 'bull_use_spike': False, 'bull_rsi_required': True, 'bear_strategy': 'mean_reversion', 'bear_bb_std_mult': 2.8859532360568827, 'bear_rsi_os': 9, 'bear_rsi_ob': 80, 'bear_adx_thresh': 28.03953571244964, 'bear_atr_min_pct': 0.022559491644681545, 'bear_atr_max_pct': 0.043699947153811314, 'bear_tp_mult': 1.9745873944696082, 'bear_tsl_mult': 0.7138366724409861, 'bear_time_stop': 146, 'bear_use_sma': False, 'bear_use_ema': False, 'bear_use_atr': False, 'bear_use_adx': True, 'bear_use_spike': False, 'bear_rsi_required': False, 'sideways_strategy': 'mean_reversion', 'sideways_bb_std_mult': 3.2921347730260373, 'sideways_rsi_os': 17, 'sideways_rsi_ob': 91, 'sideways_adx_thresh': 7.217973197037506, 'sideways_atr_min_pct': 0.003080129654388796, 'sideways_atr_max_pct': 0.010026804201573994, 'sideways_tp_mult': 2.023228480082947, 'sideways_tsl_mult': 0.327550084866087, 'sideways_time_stop': 124, 'sideways_use_sma': False, 'sideways_use_ema': False, 'sideways_use_atr': True, 'sideways_use_adx': False, 'sideways_use_spike': True, 'sideways_rsi_required': True}.
[I 2025-09-01 14:24:50,698] Trial 209 finished with values: [-1000000000.0, 1000000000.0] and parameters: {'p_sma': 10, 'p_std': 7, 'p_atr': 21, 'p_adx': 26, 'rsi_period': 68, 'ema1': 6, 'ema2': 49, 'slip_atr_k': 0.11629327079490012, 'slip_spread_k': 0.15882479738420224, 'spread_hl_frac': 0.013179292669140035, 'bb_std_mult': 1.3028210406494147, 'rsi_os': 40, 'rsi_ob': 76, 'vol_spike': 0.29878903773119697, 'adx_thresh': 21.00744314500789, 'atr_min_pct': 0.01521851121980753, 'atr_max_pct': 0.08161260541444493, 'tp_mult': 2.954553873666315, 'tsl_mult': 0.027265658925251957, 'strategy': 'breakout', 'time_stop': 68, 'use_sma': True, 'use_atr': True, 'use_adx': False, 'use_ema': False, 'use_spike': True, 'rsi_required': False, 'edge_k': 0.6715301318690778, 'edge_cap': 0.0510743545621036, 'bull_strategy': 'breakout', 'bull_bb_std_mult': 2.5797461161352095, 'bull_rsi_os': 19, 'bull_rsi_ob': 93, 'bull_adx_thresh': 10.838852940796526, 'bull_atr_min_pct': 0.01433450708080714, 'bull_atr_max_pct': 0.02094051737486806, 'bull_tp_mult': 2.061448576364046, 'bull_tsl_mult': 0.37616530286782285, 'bull_time_stop': 183, 'bull_use_sma': True, 'bull_use_ema': False, 'bull_use_atr': False, 'bull_use_adx': False, 'bull_use_spike': False, 'bull_rsi_required': True, 'bear_strategy': 'mean_reversion', 'bear_bb_std_mult': 2.4683666308021794, 'bear_rsi_os': 9, 'bear_rsi_ob': 78, 'bear_adx_thresh': 28.49298577508817, 'bear_atr_min_pct': 0.022743343053875667, 'bear_atr_max_pct': 0.036973304611046726, 'bear_tp_mult': 2.0170325308885673, 'bear_tsl_mult': 0.7118293864275089, 'bear_time_stop': 296, 'bear_use_sma': False, 'bear_use_ema': False, 'bear_use_atr': False, 'bear_use_adx': True, 'bear_use_spike': False, 'bear_rsi_required': False, 'sideways_strategy': 'mean_reversion', 'sideways_bb_std_mult': 3.265913315731022, 'sideways_rsi_os': 54, 'sideways_rsi_ob': 91, 'sideways_adx_thresh': 8.49529794700237, 'sideways_atr_min_pct': 0.020301726759946962, 'sideways_atr_max_pct': 0.14003667776665396, 'sideways_tp_mult': 1.767537865991509, 'sideways_tsl_mult': 0.2826781076001164, 'sideways_time_stop': 96, 'sideways_use_sma': False, 'sideways_use_ema': False, 'sideways_use_atr': True, 'sideways_use_adx': False, 'sideways_use_spike': True, 'sideways_rsi_required': True}.
[I 2025-09-01 14:24:51,487] Trial 206 finished with values: [-1000000000.0, 1000000000.0] and parameters: {'p_sma': 12, 'p_std': 7, 'p_atr': 21, 'p_adx': 25, 'rsi_period': 40, 'ema1': 30, 'ema2': 49, 'slip_atr_k': 0.0678573157180395, 'slip_spread_k': 0.16592787128043784, 'spread_hl_frac': 0.013482763864676676, 'bb_std_mult': 1.1965689575320395, 'rsi_os': 40, 'rsi_ob': 76, 'vol_spike': 0.2991901180611635, 'adx_thresh': 34.95803325666758, 'atr_min_pct': 0.016288204517394055, 'atr_max_pct': 0.08360492437864206, 'tp_mult': 2.95590073547081, 'tsl_mult': 0.03161284934559557, 'strategy': 'breakout', 'time_stop': 93, 'use_sma': False, 'use_atr': True, 'use_adx': True, 'use_ema': False, 'use_spike': True, 'rsi_required': False, 'edge_k': 0.6807401098551786, 'edge_cap': 0.1379946578493278, 'bull_strategy': 'breakout', 'bull_bb_std_mult': 2.831134849398102, 'bull_rsi_os': 24, 'bull_rsi_ob': 93, 'bull_adx_thresh': 10.313939719094579, 'bull_atr_min_pct': 0.018964797493198418, 'bull_atr_max_pct': 0.014022683600649857, 'bull_tp_mult': 1.985630564773576, 'bull_tsl_mult': 0.31988025576102547, 'bull_time_stop': 182, 'bull_use_sma': True, 'bull_use_ema': False, 'bull_use_atr': False, 'bull_use_adx': True, 'bull_use_spike': False, 'bull_rsi_required': True, 'bear_strategy': 'mean_reversion', 'bear_bb_std_mult': 2.4478940235141953, 'bear_rsi_os': 9, 'bear_rsi_ob': 78, 'bear_adx_thresh': 28.607505764337006, 'bear_atr_min_pct': 0.022709230657087975, 'bear_atr_max_pct': 0.0738586823998348, 'bear_tp_mult': 2.000123101244072, 'bear_tsl_mult': 0.553429604736345, 'bear_time_stop': 298, 'bear_use_sma': False, 'bear_use_ema': False, 'bear_use_atr': False, 'bear_use_adx': True, 'bear_use_spike': False, 'bear_rsi_required': False, 'sideways_strategy': 'mean_reversion', 'sideways_bb_std_mult': 3.3134542487041965, 'sideways_rsi_os': 14, 'sideways_rsi_ob': 90, 'sideways_adx_thresh': 8.72989404311402, 'sideways_atr_min_pct': 0.006130321479733474, 'sideways_atr_max_pct': 0.13484742490870716, 'sideways_tp_mult': 1.7969870755622952, 'sideways_tsl_mult': 0.27713372105997297, 'sideways_time_stop': 111, 'sideways_use_sma': False, 'sideways_use_ema': False, 'sideways_use_atr': True, 'sideways_use_adx': False, 'sideways_use_spike': True, 'sideways_rsi_required': True}.
[I 2025-09-01 14:24:51,784] Trial 208 finished with values: [-1000000000.0, 1000000000.0] and parameters: {'p_sma': 12, 'p_std': 7, 'p_atr': 20, 'p_adx': 26, 'rsi_period': 18, 'ema1': 6, 'ema2': 54, 'slip_atr_k': 0.026626865093357294, 'slip_spread_k': 0.18347918374967492, 'spread_hl_frac': 0.013303981401831562, 'bb_std_mult': 1.6519079699344092, 'rsi_os': 40, 'rsi_ob': 89, 'vol_spike': 0.29808530026127744, 'adx_thresh': 8.408229032418767, 'atr_min_pct': 0.018782793424357375, 'atr_max_pct': 0.0826224108457007, 'tp_mult': 2.9612631524478013, 'tsl_mult': 0.023454028820334503, 'strategy': 'breakout', 'time_stop': 71, 'use_sma': False, 'use_atr': True, 'use_adx': True, 'use_ema': False, 'use_spike': True, 'rsi_required': False, 'edge_k': 0.668132322477273, 'edge_cap': 0.060173775583487576, 'bull_strategy': 'breakout', 'bull_bb_std_mult': 2.822791162345134, 'bull_rsi_os': 19, 'bull_rsi_ob': 75, 'bull_adx_thresh': 18.654556778191086, 'bull_atr_min_pct': 0.017052302244754573, 'bull_atr_max_pct': 0.013299662232919715, 'bull_tp_mult': 2.2027775543481214, 'bull_tsl_mult': 0.418460362083689, 'bull_time_stop': 140, 'bull_use_sma': True, 'bull_use_ema': False, 'bull_use_atr': False, 'bull_use_adx': True, 'bull_use_spike': False, 'bull_rsi_required': True, 'bear_strategy': 'mean_reversion', 'bear_bb_std_mult': 2.7582402653599605, 'bear_rsi_os': 9, 'bear_rsi_ob': 80, 'bear_adx_thresh': 28.548018500525703, 'bear_atr_min_pct': 0.02461235468639735, 'bear_atr_max_pct': 0.04645323703238866, 'bear_tp_mult': 2.0080707061886436, 'bear_tsl_mult': 0.7145036815664727, 'bear_time_stop': 296, 'bear_use_sma': False, 'bear_use_ema': False, 'bear_use_atr': False, 'bear_use_adx': True, 'bear_use_spike': False, 'bear_rsi_required': False, 'sideways_strategy': 'mean_reversion', 'sideways_bb_std_mult': 3.220769783318902, 'sideways_rsi_os': 14, 'sideways_rsi_ob': 91, 'sideways_adx_thresh': 8.854363221759378, 'sideways_atr_min_pct': 0.006281035047471513, 'sideways_atr_max_pct': 0.13548432624235707, 'sideways_tp_mult': 1.8387151937915194, 'sideways_tsl_mult': 0.2781231047209799, 'sideways_time_stop': 112, 'sideways_use_sma': False, 'sideways_use_ema': False, 'sideways_use_atr': True, 'sideways_use_adx': False, 'sideways_use_spike': True, 'sideways_rsi_required': True}.
[I 2025-09-01 14:25:31,385] Trial 214 finished with values: [-1000000000.0, 1000000000.0] and parameters: {'p_sma': 16, 'p_std': 14, 'p_atr': 19, 'p_adx': 24, 'rsi_period': 27, 'ema1': 29, 'ema2': 52, 'slip_atr_k': 0.057268250371058885, 'slip_spread_k': 0.24283617508983676, 'spread_hl_frac': 0.011983460926053935, 'bb_std_mult': 1.5409538421499949, 'rsi_os': 35, 'rsi_ob': 74, 'vol_spike': 0.2884313618107765, 'adx_thresh': 19.481755774544173, 'atr_min_pct': 0.017094515818172642, 'atr_max_pct': 0.07225443690342849, 'tp_mult': 1.233072044075453, 'tsl_mult': 0.07389479233842618, 'strategy': 'breakout', 'time_stop': 54, 'use_sma': True, 'use_atr': True, 'use_adx': True, 'use_ema': True, 'use_spike': True, 'rsi_required': False, 'edge_k': 0.6038483190332534, 'edge_cap': 0.08502851131596906, 'bull_strategy': 'breakout', 'bull_bb_std_mult': 3.1967839357894645, 'bull_rsi_os': 21, 'bull_rsi_ob': 69, 'bull_adx_thresh': 26.922783668688375, 'bull_atr_min_pct': 0.027085721911089072, 'bull_atr_max_pct': 0.016345301548286104, 'bull_tp_mult': 2.058713962539762, 'bull_tsl_mult': 0.8026920283593175, 'bull_time_stop': 160, 'bull_use_sma': False, 'bull_use_ema': False, 'bull_use_atr': False, 'bull_use_adx': True, 'bull_use_spike': False, 'bull_rsi_required': False, 'bear_strategy': 'mean_reversion', 'bear_bb_std_mult': 3.3947587085309596, 'bear_rsi_os': 39, 'bear_rsi_ob': 77, 'bear_adx_thresh': 25.83990006197095, 'bear_atr_min_pct': 0.023895233789902826, 'bear_atr_max_pct': 0.06528203831812432, 'bear_tp_mult': 1.5288256152409436, 'bear_tsl_mult': 0.6003068366820291, 'bear_time_stop': 45, 'bear_use_sma': False, 'bear_use_ema': False, 'bear_use_atr': False, 'bear_use_adx': True, 'bear_use_spike': False, 'bear_rsi_required': False, 'sideways_strategy': 'mean_reversion', 'sideways_bb_std_mult': 3.185778758429049, 'sideways_rsi_os': 46, 'sideways_rsi_ob': 89, 'sideways_adx_thresh': 7.026057513980394, 'sideways_atr_min_pct': 0.005083956120484088, 'sideways_atr_max_pct': 0.1449695419200267, 'sideways_tp_mult': 2.879272193780195, 'sideways_tsl_mult': 0.30768816710645436, 'sideways_time_stop': 118, 'sideways_use_sma': False, 'sideways_use_ema': False, 'sideways_use_atr': False, 'sideways_use_adx': False, 'sideways_use_spike': True, 'sideways_rsi_required': True}.
[I 2025-09-01 14:25:32,801] Trial 211 finished with values: [-1000000000.0, 1000000000.0] and parameters: {'p_sma': 8, 'p_std': 14, 'p_atr': 19, 'p_adx': 24, 'rsi_period': 74, 'ema1': 14, 'ema2': 49, 'slip_atr_k': 0.10753427610234356, 'slip_spread_k': 0.23675498805457215, 'spread_hl_frac': 0.013135739423134094, 'bb_std_mult': 1.4545224005610817, 'rsi_os': 40, 'rsi_ob': 74, 'vol_spike': 0.28829281823884656, 'adx_thresh': 28.98227769349243, 'atr_min_pct': 0.01708875317889447, 'atr_max_pct': 0.0803495662752312, 'tp_mult': 2.781416287507958, 'tsl_mult': 0.07681994496551431, 'strategy': 'breakout', 'time_stop': 82, 'use_sma': False, 'use_atr': True, 'use_adx': True, 'use_ema': False, 'use_spike': True, 'rsi_required': False, 'edge_k': 0.39730905683532114, 'edge_cap': 0.11423036161192338, 'bull_strategy': 'breakout', 'bull_bb_std_mult': 3.173565391814213, 'bull_rsi_os': 19, 'bull_rsi_ob': 87, 'bull_adx_thresh': 29.69386424123076, 'bull_atr_min_pct': 0.006066396309873639, 'bull_atr_max_pct': 0.02104632544490824, 'bull_tp_mult': 2.061288282865408, 'bull_tsl_mult': 0.36869790082941517, 'bull_time_stop': 141, 'bull_use_sma': True, 'bull_use_ema': False, 'bull_use_atr': False, 'bull_use_adx': True, 'bull_use_spike': False, 'bull_rsi_required': True, 'bear_strategy': 'mean_reversion', 'bear_bb_std_mult': 2.7235025773844366, 'bear_rsi_os': 55, 'bear_rsi_ob': 78, 'bear_adx_thresh': 28.793560884169015, 'bear_atr_min_pct': 0.004957996616827536, 'bear_atr_max_pct': 0.06565989254552516, 'bear_tp_mult': 1.5709232312075936, 'bear_tsl_mult': 0.5502628198817389, 'bear_time_stop': 31, 'bear_use_sma': False, 'bear_use_ema': False, 'bear_use_atr': False, 'bear_use_adx': True, 'bear_use_spike': False, 'bear_rsi_required': False, 'sideways_strategy': 'mean_reversion', 'sideways_bb_std_mult': 3.2322647980211583, 'sideways_rsi_os': 13, 'sideways_rsi_ob': 90, 'sideways_adx_thresh': 6.746470631167979, 'sideways_atr_min_pct': 0.01950831698992365, 'sideways_atr_max_pct': 0.14029746990713887, 'sideways_tp_mult': 1.8308662907268625, 'sideways_tsl_mult': 0.3021185422596757, 'sideways_time_stop': 95, 'sideways_use_sma': False, 'sideways_use_ema': False, 'sideways_use_atr': True, 'sideways_use_adx': False, 'sideways_use_spike': True, 'sideways_rsi_required': True}.
[I 2025-09-01 14:25:32,817] Trial 213 finished with values: [-0.09335928946935235, 0.09339345618938756] and parameters: {'p_sma': 16, 'p_std': 14, 'p_atr': 20, 'p_adx': 24, 'rsi_period': 34, 'ema1': 29, 'ema2': 54, 'slip_atr_k': 0.023465453417456303, 'slip_spread_k': 0.23703809314325336, 'spread_hl_frac': 0.010249058531772746, 'bb_std_mult': 1.5480712183201528, 'rsi_os': 35, 'rsi_ob': 74, 'vol_spike': 0.2790277975055494, 'adx_thresh': 8.442421877302161, 'atr_min_pct': 0.01862329054833635, 'atr_max_pct': 0.071962878354689, 'tp_mult': 2.8952503716642397, 'tsl_mult': 0.06859334130038264, 'strategy': 'breakout', 'time_stop': 54, 'use_sma': False, 'use_atr': True, 'use_adx': True, 'use_ema': False, 'use_spike': True, 'rsi_required': False, 'edge_k': 0.39176510664227326, 'edge_cap': 0.112366675293221, 'bull_strategy': 'breakout', 'bull_bb_std_mult': 3.2070770935573605, 'bull_rsi_os': 13, 'bull_rsi_ob': 48, 'bull_adx_thresh': 9.22782195710099, 'bull_atr_min_pct': 0.020179376801687687, 'bull_atr_max_pct': 0.017113580395317483, 'bull_tp_mult': 2.132055284759704, 'bull_tsl_mult': 0.39732160225198865, 'bull_time_stop': 142, 'bull_use_sma': True, 'bull_use_ema': False, 'bull_use_atr': False, 'bull_use_adx': True, 'bull_use_spike': False, 'bull_rsi_required': False, 'bear_strategy': 'mean_reversion', 'bear_bb_std_mult': 2.752975621333449, 'bear_rsi_os': 8, 'bear_rsi_ob': 80, 'bear_adx_thresh': 29.665890639153915, 'bear_atr_min_pct': 0.0031603639404869984, 'bear_atr_max_pct': 0.10725456375103289, 'bear_tp_mult': 1.5275287317420907, 'bear_tsl_mult': 0.6027235764943827, 'bear_time_stop': 48, 'bear_use_sma': False, 'bear_use_ema': False, 'bear_use_atr': False, 'bear_use_adx': True, 'bear_use_spike': False, 'bear_rsi_required': False, 'sideways_strategy': 'mean_reversion', 'sideways_bb_std_mult': 3.382021254125796, 'sideways_rsi_os': 36, 'sideways_rsi_ob': 87, 'sideways_adx_thresh': 7.040636601889779, 'sideways_atr_min_pct': 0.00021749937220907553, 'sideways_atr_max_pct': 0.14263944976908935, 'sideways_tp_mult': 2.8669651376908694, 'sideways_tsl_mult': 0.30349532855380373, 'sideways_time_stop': 119, 'sideways_use_sma': False, 'sideways_use_ema': False, 'sideways_use_atr': True, 'sideways_use_adx': False, 'sideways_use_spike': True, 'sideways_rsi_required': True}.
[I 2025-09-01 14:25:33,069] Trial 212 finished with values: [-1000000000.0, 1000000000.0] and parameters: {'p_sma': 7, 'p_std': 14, 'p_atr': 19, 'p_adx': 24, 'rsi_period': 75, 'ema1': 29, 'ema2': 52, 'slip_atr_k': 0.05687433008448198, 'slip_spread_k': 0.24248731797847706, 'spread_hl_frac': 0.011734941680913514, 'bb_std_mult': 1.4354288649733835, 'rsi_os': 35, 'rsi_ob': 74, 'vol_spike': 0.2554758738490132, 'adx_thresh': 19.272379380697558, 'atr_min_pct': 0.017106118652108267, 'atr_max_pct': 0.0441133068273921, 'tp_mult': 2.7766602014893715, 'tsl_mult': 0.07233081478235953, 'strategy': 'breakout', 'time_stop': 73, 'use_sma': False, 'use_atr': True, 'use_adx': True, 'use_ema': False, 'use_spike': True, 'rsi_required': False, 'edge_k': 0.6215948662382613, 'edge_cap': 0.08687988868957397, 'bull_strategy': 'breakout', 'bull_bb_std_mult': 2.8033636714354655, 'bull_rsi_os': 21, 'bull_rsi_ob': 83, 'bull_adx_thresh': 29.733615086602285, 'bull_atr_min_pct': 0.012427467752545465, 'bull_atr_max_pct': 0.010046854862756197, 'bull_tp_mult': 2.843034589948262, 'bull_tsl_mult': 0.8090395442531679, 'bull_time_stop': 159, 'bull_use_sma': True, 'bull_use_ema': False, 'bull_use_atr': False, 'bull_use_adx': True, 'bull_use_spike': False, 'bull_rsi_required': True, 'bear_strategy': 'mean_reversion', 'bear_bb_std_mult': 2.7514839770516253, 'bear_rsi_os': 35, 'bear_rsi_ob': 77, 'bear_adx_thresh': 25.436564500152755, 'bear_atr_min_pct': 0.006787133956467545, 'bear_atr_max_pct': 0.10968604210418552, 'bear_tp_mult': 1.7238745308483112, 'bear_tsl_mult': 0.6012127372669497, 'bear_time_stop': 279, 'bear_use_sma': False, 'bear_use_ema': False, 'bear_use_atr': False, 'bear_use_adx': True, 'bear_use_spike': False, 'bear_rsi_required': False, 'sideways_strategy': 'mean_reversion', 'sideways_bb_std_mult': 3.407946482556604, 'sideways_rsi_os': 36, 'sideways_rsi_ob': 89, 'sideways_adx_thresh': 6.860500118430883, 'sideways_atr_min_pct': 0.017143919322063564, 'sideways_atr_max_pct': 0.13608962258285368, 'sideways_tp_mult': 2.8728999086601856, 'sideways_tsl_mult': 0.30457465680217155, 'sideways_time_stop': 118, 'sideways_use_sma': False, 'sideways_use_ema': False, 'sideways_use_atr': True, 'sideways_use_adx': False, 'sideways_use_spike': True, 'sideways_rsi_required': True}.
[I 2025-09-01 14:26:13,162] Trial 216 finished with values: [-1000000000.0, 1000000000.0] and parameters: {'p_sma': 10, 'p_std': 9, 'p_atr': 20, 'p_adx': 9, 'rsi_period': 64, 'ema1': 29, 'ema2': 53, 'slip_atr_k': 0.17884636292290124, 'slip_spread_k': 0.29749554038295695, 'spread_hl_frac': 0.046269368753672664, 'bb_std_mult': 1.8641099292782837, 'rsi_os': 37, 'rsi_ob': 72, 'vol_spike': 0.2737914612853625, 'adx_thresh': 19.544719851404952, 'atr_min_pct': 0.015618050930318749, 'atr_max_pct': 0.022241069460279275, 'tp_mult': 2.259239928867383, 'tsl_mult': 0.4999728353226983, 'strategy': 'breakout', 'time_stop': 298, 'use_sma': False, 'use_atr': True, 'use_adx': False, 'use_ema': True, 'use_spike': True, 'rsi_required': False, 'edge_k': 0.4691266228689859, 'edge_cap': 0.5728657373082364, 'bull_strategy': 'breakout', 'bull_bb_std_mult': 2.9022159420299927, 'bull_rsi_os': 12, 'bull_rsi_ob': 61, 'bull_adx_thresh': 31.146072836697073, 'bull_atr_min_pct': 0.008078589783371278, 'bull_atr_max_pct': 0.01023067407290037, 'bull_tp_mult': 2.1198892308340187, 'bull_tsl_mult': 0.2912711813707244, 'bull_time_stop': 156, 'bull_use_sma': False, 'bull_use_ema': False, 'bull_use_atr': False, 'bull_use_adx': False, 'bull_use_spike': False, 'bull_rsi_required': True, 'bear_strategy': 'mean_reversion', 'bear_bb_std_mult': 2.595557016204191, 'bear_rsi_os': 48, 'bear_rsi_ob': 75, 'bear_adx_thresh': 31.159422622132993, 'bear_atr_min_pct': 0.006579209641237144, 'bear_atr_max_pct': 0.14991997990389347, 'bear_tp_mult': 1.7238108545034485, 'bear_tsl_mult': 0.6324482415060979, 'bear_time_stop': 281, 'bear_use_sma': False, 'bear_use_ema': True, 'bear_use_atr': False, 'bear_use_adx': True, 'bear_use_spike': False, 'bear_rsi_required': False, 'sideways_strategy': 'mean_reversion', 'sideways_bb_std_mult': 3.3959070290512794, 'sideways_rsi_os': 17, 'sideways_rsi_ob': 85, 'sideways_adx_thresh': 5.864607183879189, 'sideways_atr_min_pct': 0.017099095522649047, 'sideways_atr_max_pct': 0.13721238247118692, 'sideways_tp_mult': 1.6358200057918413, 'sideways_tsl_mult': 0.937292080198645, 'sideways_time_stop': 103, 'sideways_use_sma': False, 'sideways_use_ema': True, 'sideways_use_atr': False, 'sideways_use_adx': False, 'sideways_use_spike': True, 'sideways_rsi_required': True}.
