[I 2025-09-01 14:34:42,291] Trial 270 finished with values: [-1000000000.0, 1000000000.0] and parameters: {'p_sma': 22, 'p_std': 10, 'p_atr': 21, 'p_adx': 25, 'rsi_period': 33, 'ema1': 28, 'ema2': 22, 'slip_atr_k': 0.06580201559174312, 'slip_spread_k': 0.031924839783705417, 'spread_hl_frac': 0.01390677445493068, 'bb_std_mult': 1.4500005053701726, 'rsi_os': 39, 'rsi_ob': 71, 'vol_spike': 0.29304945304880103, 'adx_thresh': 7.938326179858231, 'atr_min_pct': 0.015285609816984515, 'atr_max_pct': 0.07316589633804893, 'tp_mult': 2.288273701725463, 'tsl_mult': 0.354138431752376, 'strategy': 'breakout', 'time_stop': 279, 'use_sma': False, 'use_atr': True, 'use_adx': False, 'use_ema': False, 'use_spike': True, 'rsi_required': False, 'edge_k': 0.5267394645397476, 'edge_cap': 0.623231912355945, 'bull_strategy': 'breakout', 'bull_bb_std_mult': 2.940997471430806, 'bull_rsi_os': 17, 'bull_rsi_ob': 49, 'bull_adx_thresh': 18.27154311506121, 'bull_atr_min_pct': 0.010969247289396671, 'bull_atr_max_pct': 0.14685023704075179, 'bull_tp_mult': 2.0995548397995782, 'bull_tsl_mult': 0.15797670713156492, 'bull_time_stop': 266, 'bull_use_sma': True, 'bull_use_ema': False, 'bull_use_atr': False, 'bull_use_adx': True, 'bull_use_spike': False, 'bull_rsi_required': False, 'bear_strategy': 'mean_reversion', 'bear_bb_std_mult': 2.729716618688536, 'bear_rsi_os': 24, 'bear_rsi_ob': 74, 'bear_adx_thresh': 28.863865549662616, 'bear_atr_min_pct': 0.021359255318849784, 'bear_atr_max_pct': 0.14661515228383099, 'bear_tp_mult': 2.5422024719096847, 'bear_tsl_mult': 0.6689028489162676, 'bear_time_stop': 71, 'bear_use_sma': False, 'bear_use_ema': False, 'bear_use_atr': False, 'bear_use_adx': True, 'bear_use_spike': False, 'bear_rsi_required': False, 'sideways_strategy': 'mean_reversion', 'sideways_bb_std_mult': 3.362554978958363, 'sideways_rsi_os': 13, 'sideways_rsi_ob': 88, 'sideways_adx_thresh': 6.102751393771404, 'sideways_atr_min_pct': 0.004265762393344095, 'sideways_atr_max_pct': 0.1459149826011351, 'sideways_tp_mult': 1.7149555145364521, 'sideways_tsl_mult': 0.78551305891266, 'sideways_time_stop': 116, 'sideways_use_sma': False, 'sideways_use_ema': False, 'sideways_use_atr': False, 'sideways_use_adx': False, 'sideways_use_spike': True, 'sideways_rsi_required': True}.
[I 2025-09-01 14:34:42,459] Trial 271 finished with values: [-1000000000.0, 1000000000.0] and parameters: {'p_sma': 55, 'p_std': 11, 'p_atr': 21, 'p_adx': 12, 'rsi_period': 25, 'ema1': 28, 'ema2': 20, 'slip_atr_k': 0.0655779466810882, 'slip_spread_k': 0.22194443347439508, 'spread_hl_frac': 0.013809569239774055, 'bb_std_mult': 1.7771189728047414, 'rsi_os': 37, 'rsi_ob': 71, 'vol_spike': 0.2928058431032847, 'adx_thresh': 19.627715852041035, 'atr_min_pct': 0.015259502420048079, 'atr_max_pct': 0.07246775362148118, 'tp_mult': 2.2917892684346746, 'tsl_mult': 0.08163789655945608, 'strategy': 'breakout', 'time_stop': 236, 'use_sma': False, 'use_atr': True, 'use_adx': False, 'use_ema': False, 'use_spike': True, 'rsi_required': False, 'edge_k': 1.8359545344429042, 'edge_cap': 0.06535425656749348, 'bull_strategy': 'breakout', 'bull_bb_std_mult': 2.925460435503575, 'bull_rsi_os': 17, 'bull_rsi_ob': 58, 'bull_adx_thresh': 18.299202199323044, 'bull_atr_min_pct': 0.017555559398161003, 'bull_atr_max_pct': 0.07354572098892927, 'bull_tp_mult': 1.8772480272085081, 'bull_tsl_mult': 0.20595092251724417, 'bull_time_stop': 138, 'bull_use_sma': True, 'bull_use_ema': False, 'bull_use_atr': False, 'bull_use_adx': True, 'bull_use_spike': False, 'bull_rsi_required': False, 'bear_strategy': 'mean_reversion', 'bear_bb_std_mult': 2.729283817144812, 'bear_rsi_os': 7, 'bear_rsi_ob': 78, 'bear_adx_thresh': 28.980748828154802, 'bear_atr_min_pct': 0.026521529666687856, 'bear_atr_max_pct': 0.10545531374029424, 'bear_tp_mult': 2.512071057807452, 'bear_tsl_mult': 0.6670605297833762, 'bear_time_stop': 283, 'bear_use_sma': False, 'bear_use_ema': False, 'bear_use_atr': False, 'bear_use_adx': True, 'bear_use_spike': False, 'bear_rsi_required': False, 'sideways_strategy': 'mean_reversion', 'sideways_bb_std_mult': 3.341825643655813, 'sideways_rsi_os': 14, 'sideways_rsi_ob': 88, 'sideways_adx_thresh': 6.073947886159934, 'sideways_atr_min_pct': 0.002616398721709259, 'sideways_atr_max_pct': 0.0381468740257509, 'sideways_tp_mult': 1.7199899699912058, 'sideways_tsl_mult': 0.2777786912820643, 'sideways_time_stop': 120, 'sideways_use_sma': False, 'sideways_use_ema': False, 'sideways_use_atr': False, 'sideways_use_adx': False, 'sideways_use_spike': True, 'sideways_rsi_required': True}.
[I 2025-09-01 14:34:42,926] Trial 269 finished with values: [-1000000000.0, 1000000000.0] and parameters: {'p_sma': 55, 'p_std': 9, 'p_atr': 20, 'p_adx': 10, 'rsi_period': 26, 'ema1': 30, 'ema2': 51, 'slip_atr_k': 0.06408899341531404, 'slip_spread_k': 0.22385894568524917, 'spread_hl_frac': 0.028862251662439855, 'bb_std_mult': 1.456216380185347, 'rsi_os': 36, 'rsi_ob': 75, 'vol_spike': 0.2917315971004177, 'adx_thresh': 19.674082164584945, 'atr_min_pct': 0.024786637821279676, 'atr_max_pct': 0.0544321285457724, 'tp_mult': 2.7442769091215418, 'tsl_mult': 0.09344626872821608, 'strategy': 'breakout', 'time_stop': 95, 'use_sma': False, 'use_atr': True, 'use_adx': False, 'use_ema': True, 'use_spike': True, 'rsi_required': False, 'edge_k': 0.5376728469284875, 'edge_cap': 0.07050656147010208, 'bull_strategy': 'breakout', 'bull_bb_std_mult': 2.689478146176482, 'bull_rsi_os': 16, 'bull_rsi_ob': 51, 'bull_adx_thresh': 16.828282005634474, 'bull_atr_min_pct': 0.028564430057901054, 'bull_atr_max_pct': 0.022317655474137506, 'bull_tp_mult': 2.106579939908987, 'bull_tsl_mult': 0.1639955189547725, 'bull_time_stop': 152, 'bull_use_sma': False, 'bull_use_ema': False, 'bull_use_atr': False, 'bull_use_adx': True, 'bull_use_spike': False, 'bull_rsi_required': True, 'bear_strategy': 'mean_reversion', 'bear_bb_std_mult': 2.784058857833914, 'bear_rsi_os': 5, 'bear_rsi_ob': 82, 'bear_adx_thresh': 28.804495180739366, 'bear_atr_min_pct': 0.023440245515298504, 'bear_atr_max_pct': 0.039443439105053976, 'bear_tp_mult': 2.4704831654254638, 'bear_tsl_mult': 0.6703392693392973, 'bear_time_stop': 273, 'bear_use_sma': False, 'bear_use_ema': True, 'bear_use_atr': False, 'bear_use_adx': True, 'bear_use_spike': False, 'bear_rsi_required': False, 'sideways_strategy': 'mean_reversion', 'sideways_bb_std_mult': 3.2698786535912663, 'sideways_rsi_os': 17, 'sideways_rsi_ob': 88, 'sideways_adx_thresh': 6.1510399320285325, 'sideways_atr_min_pct': 0.002579908155940556, 'sideways_atr_max_pct': 0.0617506085340913, 'sideways_tp_mult': 1.9532026718273583, 'sideways_tsl_mult': 0.28329553296494436, 'sideways_time_stop': 121, 'sideways_use_sma': False, 'sideways_use_ema': False, 'sideways_use_atr': False, 'sideways_use_adx': False, 'sideways_use_spike': True, 'sideways_rsi_required': True}.
[I 2025-09-01 14:34:43,651] Trial 273 finished with values: [-1000000000.0, 1000000000.0] and parameters: {'p_sma': 9, 'p_std': 9, 'p_atr': 17, 'p_adx': 16, 'rsi_period': 67, 'ema1': 30, 'ema2': 15, 'slip_atr_k': 0.053302039077997236, 'slip_spread_k': 0.1848815777284016, 'spread_hl_frac': 0.014443354374894378, 'bb_std_mult': 1.6641969847682812, 'rsi_os': 35, 'rsi_ob': 75, 'vol_spike': 0.28699031595914265, 'adx_thresh': 19.63762218564515, 'atr_min_pct': 0.029191572309609188, 'atr_max_pct': 0.026870297095387477, 'tp_mult': 2.741085498534528, 'tsl_mult': 0.019676553729340435, 'strategy': 'breakout', 'time_stop': 96, 'use_sma': False, 'use_atr': True, 'use_adx': True, 'use_ema': False, 'use_spike': True, 'rsi_required': False, 'edge_k': 0.47798486736623136, 'edge_cap': 0.12820753537301743, 'bull_strategy': 'breakout', 'bull_bb_std_mult': 2.848539727046005, 'bull_rsi_os': 16, 'bull_rsi_ob': 72, 'bull_adx_thresh': 5.114854640767611, 'bull_atr_min_pct': 0.018220261747002576, 'bull_atr_max_pct': 0.0949908227571693, 'bull_tp_mult': 2.885227644621778, 'bull_tsl_mult': 0.2445965212116733, 'bull_time_stop': 162, 'bull_use_sma': True, 'bull_use_ema': False, 'bull_use_atr': False, 'bull_use_adx': False, 'bull_use_spike': False, 'bull_rsi_required': True, 'bear_strategy': 'mean_reversion', 'bear_bb_std_mult': 2.8440841253299993, 'bear_rsi_os': 46, 'bear_rsi_ob': 50, 'bear_adx_thresh': 26.821283304612948, 'bear_atr_min_pct': 0.0026401046977118266, 'bear_atr_max_pct': 0.1323606138540291, 'bear_tp_mult': 2.5078547375354856, 'bear_tsl_mult': 0.07579228668887728, 'bear_time_stop': 283, 'bear_use_sma': False, 'bear_use_ema': False, 'bear_use_atr': False, 'bear_use_adx': True, 'bear_use_spike': False, 'bear_rsi_required': False, 'sideways_strategy': 'mean_reversion', 'sideways_bb_std_mult': 3.262443592434614, 'sideways_rsi_os': 42, 'sideways_rsi_ob': 88, 'sideways_adx_thresh': 9.215353163012901, 'sideways_atr_min_pct': 0.02589208428898023, 'sideways_atr_max_pct': 0.12911892449647203, 'sideways_tp_mult': 1.914819896742314, 'sideways_tsl_mult': 0.15105467670379946, 'sideways_time_stop': 178, 'sideways_use_sma': False, 'sideways_use_ema': False, 'sideways_use_atr': True, 'sideways_use_adx': False, 'sideways_use_spike': True, 'sideways_rsi_required': True}.
[I 2025-09-01 14:35:26,539] Trial 276 finished with values: [-1000000000.0, 1000000000.0] and parameters: {'p_sma': 9, 'p_std': 8, 'p_atr': 19, 'p_adx': 26, 'rsi_period': 66, 'ema1': 30, 'ema2': 15, 'slip_atr_k': 0.052247085906746524, 'slip_spread_k': 0.24977267145302207, 'spread_hl_frac': 0.01601255533936166, 'bb_std_mult': 1.6687817261339122, 'rsi_os': 42, 'rsi_ob': 92, 'vol_spike': 0.28756977875663486, 'adx_thresh': 18.95143352033886, 'atr_min_pct': 0.014250614504874203, 'atr_max_pct': 0.07977131691927551, 'tp_mult': 2.897700827134927, 'tsl_mult': 0.5787988725342029, 'strategy': 'breakout', 'time_stop': 59, 'use_sma': False, 'use_atr': True, 'use_adx': True, 'use_ema': False, 'use_spike': True, 'rsi_required': False, 'edge_k': 0.7035632875675977, 'edge_cap': 0.12856304113978234, 'bull_strategy': 'breakout', 'bull_bb_std_mult': 2.374821623942615, 'bull_rsi_os': 18, 'bull_rsi_ob': 48, 'bull_adx_thresh': 9.612024539141956, 'bull_atr_min_pct': 0.012420719913762042, 'bull_atr_max_pct': 0.0825695948760847, 'bull_tp_mult': 2.5142909007271044, 'bull_tsl_mult': 0.8800423597137482, 'bull_time_stop': 162, 'bull_use_sma': True, 'bull_use_ema': False, 'bull_use_atr': False, 'bull_use_adx': False, 'bull_use_spike': False, 'bull_rsi_required': True, 'bear_strategy': 'mean_reversion', 'bear_bb_std_mult': 2.8617937724353553, 'bear_rsi_os': 10, 'bear_rsi_ob': 79, 'bear_adx_thresh': 34.19299319312734, 'bear_atr_min_pct': 0.002682951305398862, 'bear_atr_max_pct': 0.11266371897097288, 'bear_tp_mult': 2.425501197469807, 'bear_tsl_mult': 0.6309523260783121, 'bear_time_stop': 295, 'bear_use_sma': False, 'bear_use_ema': False, 'bear_use_atr': False, 'bear_use_adx': True, 'bear_use_spike': False, 'bear_rsi_required': False, 'sideways_strategy': 'mean_reversion', 'sideways_bb_std_mult': 3.472690281225674, 'sideways_rsi_os': 15, 'sideways_rsi_ob': 90, 'sideways_adx_thresh': 27.06272647004692, 'sideways_atr_min_pct': 0.006697301632576022, 'sideways_atr_max_pct': 0.1395150512062174, 'sideways_tp_mult': 1.8316836610762353, 'sideways_tsl_mult': 0.14777287683510665, 'sideways_time_stop': 176, 'sideways_use_sma': False, 'sideways_use_ema': False, 'sideways_use_atr': True, 'sideways_use_adx': False, 'sideways_use_spike': True, 'sideways_rsi_required': True}.
[I 2025-09-01 14:35:27,066] Trial 275 finished with values: [-0.019864702083872032, 0.02101545591410961] and parameters: {'p_sma': 10, 'p_std': 9, 'p_atr': 17, 'p_adx': 16, 'rsi_period': 67, 'ema1': 30, 'ema2': 55, 'slip_atr_k': 0.050844413498911153, 'slip_spread_k': 0.17618908003370265, 'spread_hl_frac': 0.0160881690310705, 'bb_std_mult': 1.6530341034484484, 'rsi_os': 50, 'rsi_ob': 75, 'vol_spike': 0.16001772821580562, 'adx_thresh': 18.68186631476248, 'atr_min_pct': 0.014107325109519652, 'atr_max_pct': 0.08080267870001728, 'tp_mult': 2.891338315108895, 'tsl_mult': 0.020186754418981538, 'strategy': 'breakout', 'time_stop': 57, 'use_sma': False, 'use_atr': True, 'use_adx': True, 'use_ema': False, 'use_spike': True, 'rsi_required': False, 'edge_k': 0.46683142210831896, 'edge_cap': 0.050824892181734894, 'bull_strategy': 'breakout', 'bull_bb_std_mult': 2.648126216342921, 'bull_rsi_os': 39, 'bull_rsi_ob': 51, 'bull_adx_thresh': 9.717869579893227, 'bull_atr_min_pct': 0.029966466447523064, 'bull_atr_max_pct': 0.029896047359506465, 'bull_tp_mult': 2.0454432132900453, 'bull_tsl_mult': 0.34075261578980076, 'bull_time_stop': 159, 'bull_use_sma': True, 'bull_use_ema': False, 'bull_use_atr': False, 'bull_use_adx': False, 'bull_use_spike': False, 'bull_rsi_required': True, 'bear_strategy': 'mean_reversion', 'bear_bb_std_mult': 2.861876735760381, 'bear_rsi_os': 46, 'bear_rsi_ob': 79, 'bear_adx_thresh': 31.834820472126772, 'bear_atr_min_pct': 0.0036871009403235382, 'bear_atr_max_pct': 0.03821551934680127, 'bear_tp_mult': 2.4344484291939805, 'bear_tsl_mult': 0.6240387540174697, 'bear_time_stop': 295, 'bear_use_sma': False, 'bear_use_ema': False, 'bear_use_atr': False, 'bear_use_adx': True, 'bear_use_spike': False, 'bear_rsi_required': False, 'sideways_strategy': 'mean_reversion', 'sideways_bb_std_mult': 3.2722810312706927, 'sideways_rsi_os': 15, 'sideways_rsi_ob': 90, 'sideways_adx_thresh': 5.133944571125804, 'sideways_atr_min_pct': 0.0067274107779363625, 'sideways_atr_max_pct': 0.1291471657416177, 'sideways_tp_mult': 1.9502756518022737, 'sideways_tsl_mult': 0.19891783488348697, 'sideways_time_stop': 260, 'sideways_use_sma': False, 'sideways_use_ema': False, 'sideways_use_atr': True, 'sideways_use_adx': False, 'sideways_use_spike': True, 'sideways_rsi_required': True}.
[I 2025-09-01 14:35:27,429] Trial 274 finished with values: [-0.048265473020786875, 0.04811645645961244] and parameters: {'p_sma': 17, 'p_std': 9, 'p_atr': 17, 'p_adx': 16, 'rsi_period': 67, 'ema1': 30, 'ema2': 55, 'slip_atr_k': 0.054089922536599416, 'slip_spread_k': 0.18367391352333193, 'spread_hl_frac': 0.016284472129656172, 'bb_std_mult': 1.6881290223562564, 'rsi_os': 50, 'rsi_ob': 75, 'vol_spike': 0.28511451132889437, 'adx_thresh': 18.892541502005855, 'atr_min_pct': 0.019161999408595084, 'atr_max_pct': 0.02736341272475333, 'tp_mult': 2.9228942297565537, 'tsl_mult': 0.7262904305636725, 'strategy': 'breakout', 'time_stop': 91, 'use_sma': False, 'use_atr': True, 'use_adx': True, 'use_ema': False, 'use_spike': True, 'rsi_required': False, 'edge_k': 0.4598645335146754, 'edge_cap': 0.12565846494212085, 'bull_strategy': 'breakout', 'bull_bb_std_mult': 2.6968598310646654, 'bull_rsi_os': 18, 'bull_rsi_ob': 51, 'bull_adx_thresh': 9.72167844667761, 'bull_atr_min_pct': 0.018314162328453176, 'bull_atr_max_pct': 0.019855542728658613, 'bull_tp_mult': 2.0264237875340365, 'bull_tsl_mult': 0.4287670986686138, 'bull_time_stop': 161, 'bull_use_sma': True, 'bull_use_ema': False, 'bull_use_atr': False, 'bull_use_adx': False, 'bull_use_spike': False, 'bull_rsi_required': True, 'bear_strategy': 'mean_reversion', 'bear_bb_std_mult': 2.849134045282703, 'bear_rsi_os': 47, 'bear_rsi_ob': 79, 'bear_adx_thresh': 17.024445309015647, 'bear_atr_min_pct': 0.0034899491016502516, 'bear_atr_max_pct': 0.10882690589228813, 'bear_tp_mult': 2.450224723633673, 'bear_tsl_mult': 0.6177943189812757, 'bear_time_stop': 293, 'bear_use_sma': False, 'bear_use_ema': False, 'bear_use_atr': False, 'bear_use_adx': True, 'bear_use_spike': False, 'bear_rsi_required': False, 'sideways_strategy': 'mean_reversion', 'sideways_bb_std_mult': 3.2720681252132278, 'sideways_rsi_os': 42, 'sideways_rsi_ob': 62, 'sideways_adx_thresh': 9.308247047783034, 'sideways_atr_min_pct': 0.025771455040367583, 'sideways_atr_max_pct': 0.057164823998700695, 'sideways_tp_mult': 1.807189059412966, 'sideways_tsl_mult': 0.3209115220991535, 'sideways_time_stop': 101, 'sideways_use_sma': False, 'sideways_use_ema': False, 'sideways_use_atr': True, 'sideways_use_adx': False, 'sideways_use_spike': True, 'sideways_rsi_required': True}.
[I 2025-09-01 14:35:27,439] Trial 277 finished with values: [-1000000000.0, 1000000000.0] and parameters: {'p_sma': 17, 'p_std': 8, 'p_atr': 20, 'p_adx': 17, 'rsi_period': 66, 'ema1': 8, 'ema2': 10, 'slip_atr_k': 0.05566746383719104, 'slip_spread_k': 0.24914436007168222, 'spread_hl_frac': 0.015358960035007137, 'bb_std_mult': 1.9113196134729489, 'rsi_os': 44, 'rsi_ob': 90, 'vol_spike': 0.28607424185839697, 'adx_thresh': 33.35841785156343, 'atr_min_pct': 0.02571110307562468, 'atr_max_pct': 0.07817529743705244, 'tp_mult': 2.465890151373138, 'tsl_mult': 0.5054059707269606, 'strategy': 'breakout', 'time_stop': 143, 'use_sma': False, 'use_atr': True, 'use_adx': True, 'use_ema': False, 'use_spike': True, 'rsi_required': False, 'edge_k': 0.7022743581626498, 'edge_cap': 0.100178157112211, 'bull_strategy': 'breakout', 'bull_bb_std_mult': 2.9892278616048786, 'bull_rsi_os': 39, 'bull_rsi_ob': 48, 'bull_adx_thresh': 19.375831494403485, 'bull_atr_min_pct': 0.02521694496834749, 'bull_atr_max_pct': 0.07715811232806392, 'bull_tp_mult': 1.2125513594528674, 'bull_tsl_mult': 0.5997275477431666, 'bull_time_stop': 287, 'bull_use_sma': True, 'bull_use_ema': False, 'bull_use_atr': False, 'bull_use_adx': False, 'bull_use_spike': False, 'bull_rsi_required': True, 'bear_strategy': 'mean_reversion', 'bear_bb_std_mult': 2.857883793090862, 'bear_rsi_os': 6, 'bear_rsi_ob': 79, 'bear_adx_thresh': 27.918308276407252, 'bear_atr_min_pct': 0.022796995816595677, 'bear_atr_max_pct': 0.08957071213434492, 'bear_tp_mult': 2.4272396251263335, 'bear_tsl_mult': 0.9367988915547262, 'bear_time_stop': 81, 'bear_use_sma': False, 'bear_use_ema': False, 'bear_use_atr': False, 'bear_use_adx': True, 'bear_use_spike': False, 'bear_rsi_required': False, 'sideways_strategy': 'mean_reversion', 'sideways_bb_std_mult': 3.4166928584653484, 'sideways_rsi_os': 16, 'sideways_rsi_ob': 90, 'sideways_adx_thresh': 5.041288392351749, 'sideways_atr_min_pct': 0.005171788449555695, 'sideways_atr_max_pct': 0.1398602279628294, 'sideways_tp_mult': 2.8323633588239625, 'sideways_tsl_mult': 0.3105351010537345, 'sideways_time_stop': 153, 'sideways_use_sma': False, 'sideways_use_ema': False, 'sideways_use_atr': True, 'sideways_use_adx': False, 'sideways_use_spike': True, 'sideways_rsi_required': True}.
[I 2025-09-01 14:36:10,621] Trial 278 finished with values: [-1000000000.0, 1000000000.0] and parameters: {'p_sma': 5, 'p_std': 11, 'p_atr': 20, 'p_adx': 24, 'rsi_period': 64, 'ema1': 29, 'ema2': 24, 'slip_atr_k': 0.05659992900967453, 'slip_spread_k': 0.2023072454117517, 'spread_hl_frac': 0.015980477473818894, 'bb_std_mult': 1.7276988056534925, 'rsi_os': 35, 'rsi_ob': 73, 'vol_spike': 0.15951572754438656, 'adx_thresh': 21.89505313037683, 'atr_min_pct': 0.023534974822469062, 'atr_max_pct': 0.06592782803872017, 'tp_mult': 2.1056561081878344, 'tsl_mult': 0.5156338626904994, 'strategy': 'breakout', 'time_stop': 145, 'use_sma': False, 'use_atr': True, 'use_adx': True, 'use_ema': False, 'use_spike': True, 'rsi_required': False, 'edge_k': 1.3471824554935636, 'edge_cap': 0.051217067911101005, 'bull_strategy': 'breakout', 'bull_bb_std_mult': 2.992644605575678, 'bull_rsi_os': 19, 'bull_rsi_ob': 51, 'bull_adx_thresh': 10.39795804328679, 'bull_atr_min_pct': 0.007015153833283238, 'bull_atr_max_pct': 0.02926935484641975, 'bull_tp_mult': 2.028768953868623, 'bull_tsl_mult': 0.49156829666561275, 'bull_time_stop': 198, 'bull_use_sma': True, 'bull_use_ema': False, 'bull_use_atr': False, 'bull_use_adx': True, 'bull_use_spike': False, 'bull_rsi_required': True, 'bear_strategy': 'mean_reversion', 'bear_bb_std_mult': 2.839176050316143, 'bear_rsi_os': 39, 'bear_rsi_ob': 77, 'bear_adx_thresh': 27.755128151109357, 'bear_atr_min_pct': 0.0230502867894252, 'bear_atr_max_pct': 0.10946376288302384, 'bear_tp_mult': 2.5847589707951792, 'bear_tsl_mult': 0.824736739231253, 'bear_time_stop': 292, 'bear_use_sma': False, 'bear_use_ema': False, 'bear_use_atr': False, 'bear_use_adx': True, 'bear_use_spike': False, 'bear_rsi_required': False, 'sideways_strategy': 'mean_reversion', 'sideways_bb_std_mult': 3.4219255861699933, 'sideways_rsi_os': 15, 'sideways_rsi_ob': 90, 'sideways_adx_thresh': 7.110778154373959, 'sideways_atr_min_pct': 0.005009951674738408, 'sideways_atr_max_pct': 0.13289459691262556, 'sideways_tp_mult': 1.6508493142424092, 'sideways_tsl_mult': 0.19425943201355145, 'sideways_time_stop': 102, 'sideways_use_sma': False, 'sideways_use_ema': False, 'sideways_use_atr': True, 'sideways_use_adx': False, 'sideways_use_spike': True, 'sideways_rsi_required': True}.
