[I 2025-09-01 14:05:47,680] Trial 92 finished with values: [-1000000000.0, 1000000000.0] and parameters: {'p_sma': 34, 'p_std': 55, 'p_atr': 14, 'p_adx': 24, 'rsi_period': 47, 'ema1': 21, 'ema2': 38, 'slip_atr_k': 0.23033342066790835, 'slip_spread_k': 0.5149492206980959, 'spread_hl_frac': 0.007038196724715451, 'bb_std_mult': 1.4894356547474523, 'rsi_os': 16, 'rsi_ob': 51, 'vol_spike': 0.2929376768318428, 'adx_thresh': 30.20686140361515, 'atr_min_pct': 0.026477203421826533, 'atr_max_pct': 0.023019529460329285, 'tp_mult': 1.8475700614526707, 'tsl_mult': 0.31551306417156183, 'strategy': 'breakout', 'time_stop': 164, 'use_sma': False, 'use_atr': False, 'use_adx': False, 'use_ema': False, 'use_spike': False, 'rsi_required': True, 'edge_k': 0.3795294191355445, 'edge_cap': 0.8326521151741513, 'bull_strategy': 'breakout', 'bull_bb_std_mult': 1.0950293858700675, 'bull_rsi_os': 30, 'bull_rsi_ob': 73, 'bull_adx_thresh': 15.571099504955118, 'bull_atr_min_pct': 0.0032460042672427716, 'bull_atr_max_pct': 0.10532858308376186, 'bull_tp_mult': 1.6942126088342575, 'bull_tsl_mult': 0.09646223085333037, 'bull_time_stop': 159, 'bull_use_sma': False, 'bull_use_ema': True, 'bull_use_atr': True, 'bull_use_adx': True, 'bull_use_spike': False, 'bull_rsi_required': False, 'bear_strategy': 'breakout', 'bear_bb_std_mult': 3.4315693683640047, 'bear_rsi_os': 9, 'bear_rsi_ob': 92, 'bear_adx_thresh': 27.344006218704155, 'bear_atr_min_pct': 0.020245373043156448, 'bear_atr_max_pct': 0.020569552690051295, 'bear_tp_mult': 2.650185177774611, 'bear_tsl_mult': 0.21661557168098755, 'bear_time_stop': 265, 'bear_use_sma': False, 'bear_use_ema': False, 'bear_use_atr': True, 'bear_use_adx': True, 'bear_use_spike': True, 'bear_rsi_required': True, 'sideways_strategy': 'breakout', 'sideways_bb_std_mult': 3.525824110409664, 'sideways_rsi_os': 32, 'sideways_rsi_ob': 75, 'sideways_adx_thresh': 10.118210300778356, 'sideways_atr_min_pct': 0.010804178010051832, 'sideways_atr_max_pct': 0.06519795554684162, 'sideways_tp_mult': 1.7841055724224368, 'sideways_tsl_mult': 0.4398246900097833, 'sideways_time_stop': 89, 'sideways_use_sma': True, 'sideways_use_ema': True, 'sideways_use_atr': False, 'sideways_use_adx': False, 'sideways_use_spike': False, 'sideways_rsi_required': True}.
[I 2025-09-01 14:06:25,556] Trial 91 finished with values: [-0.018559835361498522, 0.01839088111414105] and parameters: {'p_sma': 15, 'p_std': 55, 'p_atr': 13, 'p_adx': 24, 'rsi_period': 48, 'ema1': 21, 'ema2': 51, 'slip_atr_k': 0.23076204018309227, 'slip_spread_k': 0.4744264191713321, 'spread_hl_frac': 0.026019470384054746, 'bb_std_mult': 3.188303759219341, 'rsi_os': 37, 'rsi_ob': 56, 'vol_spike': 0.03278632193753735, 'adx_thresh': 30.78488225403151, 'atr_min_pct': 0.01319098272720051, 'atr_max_pct': 0.017635134892700854, 'tp_mult': 1.9921961666359387, 'tsl_mult': 0.2545092143507277, 'strategy': 'breakout', 'time_stop': 262, 'use_sma': False, 'use_atr': False, 'use_adx': False, 'use_ema': False, 'use_spike': False, 'rsi_required': True, 'edge_k': 0.8052545978606431, 'edge_cap': 0.833502568427732, 'bull_strategy': 'breakout', 'bull_bb_std_mult': 1.0616338720442446, 'bull_rsi_os': 48, 'bull_rsi_ob': 66, 'bull_adx_thresh': 6.16602657022338, 'bull_atr_min_pct': 0.0012590350775254207, 'bull_atr_max_pct': 0.106412705552824, 'bull_tp_mult': 1.0220454722551748, 'bull_tsl_mult': 0.010459290025272247, 'bull_time_stop': 247, 'bull_use_sma': False, 'bull_use_ema': True, 'bull_use_atr': True, 'bull_use_adx': True, 'bull_use_spike': False, 'bull_rsi_required': False, 'bear_strategy': 'breakout', 'bear_bb_std_mult': 2.5755677501645575, 'bear_rsi_os': 9, 'bear_rsi_ob': 88, 'bear_adx_thresh': 9.73488936809348, 'bear_atr_min_pct': 0.020327868016538582, 'bear_atr_max_pct': 0.020306465931861917, 'bear_tp_mult': 2.6423185709299863, 'bear_tsl_mult': 0.6681893188986555, 'bear_time_stop': 267, 'bear_use_sma': False, 'bear_use_ema': False, 'bear_use_atr': True, 'bear_use_adx': True, 'bear_use_spike': True, 'bear_rsi_required': True, 'sideways_strategy': 'breakout', 'sideways_bb_std_mult': 1.807705554969006, 'sideways_rsi_os': 31, 'sideways_rsi_ob': 87, 'sideways_adx_thresh': 10.0858753619972, 'sideways_atr_min_pct': 0.012497619268878067, 'sideways_atr_max_pct': 0.08151814309505939, 'sideways_tp_mult': 1.1463931806869452, 'sideways_tsl_mult': 0.7301394233108376, 'sideways_time_stop': 115, 'sideways_use_sma': True, 'sideways_use_ema': True, 'sideways_use_atr': False, 'sideways_use_adx': False, 'sideways_use_spike': False, 'sideways_rsi_required': True}.
[I 2025-09-01 14:06:26,198] Trial 94 finished with values: [-1000000000.0, 1000000000.0] and parameters: {'p_sma': 39, 'p_std': 35, 'p_atr': 21, 'p_adx': 17, 'rsi_period': 58, 'ema1': 24, 'ema2': 18, 'slip_atr_k': 0.24267705288618088, 'slip_spread_k': 0.42755483283190626, 'spread_hl_frac': 0.025933580010408425, 'bb_std_mult': 2.7798658113532873, 'rsi_os': 19, 'rsi_ob': 56, 'vol_spike': 0.03222379874063823, 'adx_thresh': 14.658183871016357, 'atr_min_pct': 0.0059932591798582, 'atr_max_pct': 0.036793382360919745, 'tp_mult': 1.1995254724200235, 'tsl_mult': 0.18977790130951433, 'strategy': 'mean_reversion', 'time_stop': 181, 'use_sma': True, 'use_atr': False, 'use_adx': True, 'use_ema': True, 'use_spike': False, 'rsi_required': True, 'edge_k': 0.8990808403420286, 'edge_cap': 0.7995721267260689, 'bull_strategy': 'mean_reversion', 'bull_bb_std_mult': 1.4771130250755196, 'bull_rsi_os': 26, 'bull_rsi_ob': 50, 'bull_adx_thresh': 32.69734139911996, 'bull_atr_min_pct': 0.0007380737816731679, 'bull_atr_max_pct': 0.11570597213999241, 'bull_tp_mult': 1.3887403251024366, 'bull_tsl_mult': 0.09557991353648372, 'bull_time_stop': 281, 'bull_use_sma': True, 'bull_use_ema': True, 'bull_use_atr': True, 'bull_use_adx': True, 'bull_use_spike': True, 'bull_rsi_required': True, 'bear_strategy': 'mean_reversion', 'bear_bb_std_mult': 1.3597961142696473, 'bear_rsi_os': 15, 'bear_rsi_ob': 88, 'bear_adx_thresh': 11.707113092055392, 'bear_atr_min_pct': 0.018628717041617886, 'bear_atr_max_pct': 0.027252108436010572, 'bear_tp_mult': 2.738426409555704, 'bear_tsl_mult': 0.33727434077865415, 'bear_time_stop': 65, 'bear_use_sma': True, 'bear_use_ema': False, 'bear_use_atr': True, 'bear_use_adx': False, 'bear_use_spike': True, 'bear_rsi_required': True, 'sideways_strategy': 'breakout', 'sideways_bb_std_mult': 2.9076161856308635, 'sideways_rsi_os': 53, 'sideways_rsi_ob': 52, 'sideways_adx_thresh': 20.121605349809407, 'sideways_atr_min_pct': 0.009937470834343883, 'sideways_atr_max_pct': 0.080912566654575, 'sideways_tp_mult': 1.5991161326901127, 'sideways_tsl_mult': 0.49044219537506967, 'sideways_time_stop': 196, 'sideways_use_sma': True, 'sideways_use_ema': False, 'sideways_use_atr': True, 'sideways_use_adx': True, 'sideways_use_spike': False, 'sideways_rsi_required': False}.
[I 2025-09-01 14:06:26,384] Trial 90 finished with values: [-1000000000.0, 1000000000.0] and parameters: {'p_sma': 34, 'p_std': 55, 'p_atr': 21, 'p_adx': 18, 'rsi_period': 58, 'ema1': 21, 'ema2': 39, 'slip_atr_k': 0.2282991893690452, 'slip_spread_k': 0.5142371728405446, 'spread_hl_frac': 0.006563928676793753, 'bb_std_mult': 1.4982365424843151, 'rsi_os': 16, 'rsi_ob': 56, 'vol_spike': 0.03348829029020502, 'adx_thresh': 14.163315837796917, 'atr_min_pct': 0.013228197175266678, 'atr_max_pct': 0.025800932728293292, 'tp_mult': 1.814220127044372, 'tsl_mult': 0.2590903991911386, 'strategy': 'mean_reversion', 'time_stop': 162, 'use_sma': False, 'use_atr': False, 'use_adx': True, 'use_ema': False, 'use_spike': False, 'rsi_required': True, 'edge_k': 0.7961704845570214, 'edge_cap': 0.8331984083858819, 'bull_strategy': 'mean_reversion', 'bull_bb_std_mult': 1.4719701017387377, 'bull_rsi_os': 16, 'bull_rsi_ob': 65, 'bull_adx_thresh': 15.385925017534719, 'bull_atr_min_pct': 0.007398946374248638, 'bull_atr_max_pct': 0.10734667669382904, 'bull_tp_mult': 1.0612569049202403, 'bull_tsl_mult': 0.09524212917620356, 'bull_time_stop': 246, 'bull_use_sma': False, 'bull_use_ema': True, 'bull_use_atr': True, 'bull_use_adx': True, 'bull_use_spike': False, 'bull_rsi_required': True, 'bear_strategy': 'breakout', 'bear_bb_std_mult': 1.3610136453315824, 'bear_rsi_os': 15, 'bear_rsi_ob': 92, 'bear_adx_thresh': 11.866810601601783, 'bear_atr_min_pct': 0.019958454027282913, 'bear_atr_max_pct': 0.05499611392675835, 'bear_tp_mult': 2.6532497293655557, 'bear_tsl_mult': 0.2218111099465732, 'bear_time_stop': 267, 'bear_use_sma': True, 'bear_use_ema': True, 'bear_use_atr': True, 'bear_use_adx': True, 'bear_use_spike': True, 'bear_rsi_required': True, 'sideways_strategy': 'breakout', 'sideways_bb_std_mult': 3.5721737065888846, 'sideways_rsi_os': 32, 'sideways_rsi_ob': 55, 'sideways_adx_thresh': 33.4353854787354, 'sideways_atr_min_pct': 0.012465022709260514, 'sideways_atr_max_pct': 0.04162560099993367, 'sideways_tp_mult': 2.192987245806829, 'sideways_tsl_mult': 0.4841827374675457, 'sideways_time_stop': 286, 'sideways_use_sma': True, 'sideways_use_ema': True, 'sideways_use_atr': False, 'sideways_use_adx': False, 'sideways_use_spike': False, 'sideways_rsi_required': False}.
[I 2025-09-01 14:06:26,582] Trial 93 finished with values: [-1000000000.0, 1000000000.0] and parameters: {'p_sma': 40, 'p_std': 40, 'p_atr': 13, 'p_adx': 18, 'rsi_period': 58, 'ema1': 21, 'ema2': 18, 'slip_atr_k': 0.23225732106803318, 'slip_spread_k': 0.9259783065663039, 'spread_hl_frac': 0.025930564416325685, 'bb_std_mult': 2.781226554592145, 'rsi_os': 16, 'rsi_ob': 51, 'vol_spike': 0.2611796163038857, 'adx_thresh': 30.859785343436613, 'atr_min_pct': 0.0032110040760510335, 'atr_max_pct': 0.0904765380848376, 'tp_mult': 1.2815047296740758, 'tsl_mult': 0.2074947184622159, 'strategy': 'breakout', 'time_stop': 150, 'use_sma': True, 'use_atr': False, 'use_adx': False, 'use_ema': False, 'use_spike': False, 'rsi_required': True, 'edge_k': 0.9038741192950561, 'edge_cap': 0.8344062514195983, 'bull_strategy': 'mean_reversion', 'bull_bb_std_mult': 2.414114652184897, 'bull_rsi_os': 15, 'bull_rsi_ob': 91, 'bull_adx_thresh': 24.14742636794499, 'bull_atr_min_pct': 0.0014877244924112044, 'bull_atr_max_pct': 0.11580463420061293, 'bull_tp_mult': 1.396755819228992, 'bull_tsl_mult': 0.05579675095631418, 'bull_time_stop': 272, 'bull_use_sma': False, 'bull_use_ema': True, 'bull_use_atr': True, 'bull_use_adx': True, 'bull_use_spike': True, 'bull_rsi_required': True, 'bear_strategy': 'mean_reversion', 'bear_bb_std_mult': 1.367935588042895, 'bear_rsi_os': 16, 'bear_rsi_ob': 88, 'bear_adx_thresh': 16.038680811031657, 'bear_atr_min_pct': 0.00351726460810956, 'bear_atr_max_pct': 0.05023763100139751, 'bear_tp_mult': 2.632086288348232, 'bear_tsl_mult': 0.8394286086862928, 'bear_time_stop': 233, 'bear_use_sma': False, 'bear_use_ema': False, 'bear_use_atr': True, 'bear_use_adx': False, 'bear_use_spike': False, 'bear_rsi_required': True, 'sideways_strategy': 'breakout', 'sideways_bb_std_mult': 2.9848152292754726, 'sideways_rsi_os': 31, 'sideways_rsi_ob': 75, 'sideways_adx_thresh': 24.85993425965838, 'sideways_atr_min_pct': 0.009863241961859882, 'sideways_atr_max_pct': 0.08112137606980911, 'sideways_tp_mult': 1.9182422031924298, 'sideways_tsl_mult': 0.48319121281812866, 'sideways_time_stop': 87, 'sideways_use_sma': False, 'sideways_use_ema': True, 'sideways_use_atr': True, 'sideways_use_adx': False, 'sideways_use_spike': False, 'sideways_rsi_required': True}.
[I 2025-09-01 14:07:02,352] Trial 98 finished with values: [-0.021197732859119967, 0.021011278230376094] and parameters: {'p_sma': 15, 'p_std': 16, 'p_atr': 19, 'p_adx': 19, 'rsi_period': 42, 'ema1': 19, 'ema2': 43, 'slip_atr_k': 0.052866103559661703, 'slip_spread_k': 0.33880682395060385, 'spread_hl_frac': 0.021831695591559497, 'bb_std_mult': 3.2166228547487874, 'rsi_os': 20, 'rsi_ob': 79, 'vol_spike': 0.05970558575359648, 'adx_thresh': 28.296100904604454, 'atr_min_pct': 0.00976080235138936, 'atr_max_pct': 0.10508912684646053, 'tp_mult': 1.7826108307816142, 'tsl_mult': 0.9056307439472943, 'strategy': 'mean_reversion', 'time_stop': 261, 'use_sma': False, 'use_atr': True, 'use_adx': True, 'use_ema': False, 'use_spike': True, 'rsi_required': False, 'edge_k': 1.198374037621208, 'edge_cap': 0.6996580098198866, 'bull_strategy': 'mean_reversion', 'bull_bb_std_mult': 2.1641640325215326, 'bull_rsi_os': 31, 'bull_rsi_ob': 54, 'bull_adx_thresh': 7.266818387108528, 'bull_atr_min_pct': 0.0023556823130713115, 'bull_atr_max_pct': 0.11253226187675258, 'bull_tp_mult': 1.476072787927548, 'bull_tsl_mult': 0.018836633693044117, 'bull_time_stop': 215, 'bull_use_sma': True, 'bull_use_ema': False, 'bull_use_atr': False, 'bull_use_adx': False, 'bull_use_spike': True, 'bull_rsi_required': True, 'bear_strategy': 'breakout', 'bear_bb_std_mult': 1.2595688723525331, 'bear_rsi_os': 12, 'bear_rsi_ob': 89, 'bear_adx_thresh': 14.100639371340959, 'bear_atr_min_pct': 0.02200136960974796, 'bear_atr_max_pct': 0.010771767974530942, 'bear_tp_mult': 2.8308342667712774, 'bear_tsl_mult': 0.9968773467137473, 'bear_time_stop': 44, 'bear_use_sma': True, 'bear_use_ema': False, 'bear_use_atr': True, 'bear_use_adx': False, 'bear_use_spike': False, 'bear_rsi_required': True, 'sideways_strategy': 'mean_reversion', 'sideways_bb_std_mult': 3.1006562137864138, 'sideways_rsi_os': 23, 'sideways_rsi_ob': 47, 'sideways_adx_thresh': 21.42297678309957, 'sideways_atr_min_pct': 0.014620795503967401, 'sideways_atr_max_pct': 0.07241516619983673, 'sideways_tp_mult': 2.396300022533665, 'sideways_tsl_mult': 0.0908731408495333, 'sideways_time_stop': 133, 'sideways_use_sma': False, 'sideways_use_ema': False, 'sideways_use_atr': True, 'sideways_use_adx': True, 'sideways_use_spike': True, 'sideways_rsi_required': False}.
[I 2025-09-01 14:07:02,715] Trial 97 finished with values: [-0.03054737301658028, 0.030394567948500387] and parameters: {'p_sma': 14, 'p_std': 16, 'p_atr': 19, 'p_adx': 19, 'rsi_period': 72, 'ema1': 19, 'ema2': 43, 'slip_atr_k': 0.21278516886858004, 'slip_spread_k': 0.7009518423177075, 'spread_hl_frac': 0.021775154371754205, 'bb_std_mult': 2.472171640433731, 'rsi_os': 20, 'rsi_ob': 59, 'vol_spike': 0.08994010471384369, 'adx_thresh': 11.771009876070956, 'atr_min_pct': 0.009673840793097464, 'atr_max_pct': 0.1389530014348802, 'tp_mult': 1.7406402559814638, 'tsl_mult': 0.24272116139782335, 'strategy': 'mean_reversion', 'time_stop': 207, 'use_sma': False, 'use_atr': True, 'use_adx': True, 'use_ema': False, 'use_spike': True, 'rsi_required': False, 'edge_k': 1.2343446282995314, 'edge_cap': 0.7334098932490983, 'bull_strategy': 'mean_reversion', 'bull_bb_std_mult': 3.155756372876326, 'bull_rsi_os': 44, 'bull_rsi_ob': 54, 'bull_adx_thresh': 29.109946833931524, 'bull_atr_min_pct': 0.0012823369729711056, 'bull_atr_max_pct': 0.05707106998985642, 'bull_tp_mult': 1.4604293819740561, 'bull_tsl_mult': 0.0012881802337930195, 'bull_time_stop': 216, 'bull_use_sma': True, 'bull_use_ema': False, 'bull_use_atr': False, 'bull_use_adx': False, 'bull_use_spike': True, 'bull_rsi_required': True, 'bear_strategy': 'breakout', 'bear_bb_std_mult': 0.8745779973680707, 'bear_rsi_os': 12, 'bear_rsi_ob': 46, 'bear_adx_thresh': 23.566078154993225, 'bear_atr_min_pct': 0.021722023853664233, 'bear_atr_max_pct': 0.010541669538085044, 'bear_tp_mult': 2.859490130434888, 'bear_tsl_mult': 0.9932236733666874, 'bear_time_stop': 280, 'bear_use_sma': True, 'bear_use_ema': False, 'bear_use_atr': True, 'bear_use_adx': False, 'bear_use_spike': False, 'bear_rsi_required': True, 'sideways_strategy': 'mean_reversion', 'sideways_bb_std_mult': 3.115215208194718, 'sideways_rsi_os': 23, 'sideways_rsi_ob': 47, 'sideways_adx_thresh': 21.351353824044757, 'sideways_atr_min_pct': 0.01883456459975465, 'sideways_atr_max_pct': 0.07414558644237329, 'sideways_tp_mult': 1.2066150912918072, 'sideways_tsl_mult': 0.8254770810693537, 'sideways_time_stop': 114, 'sideways_use_sma': False, 'sideways_use_ema': False, 'sideways_use_atr': True, 'sideways_use_adx': True, 'sideways_use_spike': True, 'sideways_rsi_required': False}.
[I 2025-09-01 14:07:02,982] Trial 95 finished with values: [-1000000000.0, 1000000000.0] and parameters: {'p_sma': 41, 'p_std': 15, 'p_atr': 25, 'p_adx': 18, 'rsi_period': 58, 'ema1': 6, 'ema2': 43, 'slip_atr_k': 0.2428452259098472, 'slip_spread_k': 0.40896135818599855, 'spread_hl_frac': 0.022016143294129206, 'bb_std_mult': 3.2033603391524217, 'rsi_os': 20, 'rsi_ob': 56, 'vol_spike': 0.2150858497589726, 'adx_thresh': 13.709811633103905, 'atr_min_pct': 0.009871506261159933, 'atr_max_pct': 0.13870324572527518, 'tp_mult': 1.1981823006740888, 'tsl_mult': 0.19739947378843994, 'strategy': 'mean_reversion', 'time_stop': 258, 'use_sma': True, 'use_atr': False, 'use_adx': True, 'use_ema': False, 'use_spike': False, 'rsi_required': True, 'edge_k': 0.9044469379730362, 'edge_cap': 0.7962388546211601, 'bull_strategy': 'mean_reversion', 'bull_bb_std_mult': 1.4831548088887665, 'bull_rsi_os': 44, 'bull_rsi_ob': 54, 'bull_adx_thresh': 24.102792147749287, 'bull_atr_min_pct': 0.0013341650627564524, 'bull_atr_max_pct': 0.06350821544680008, 'bull_tp_mult': 1.3784129619854417, 'bull_tsl_mult': 0.09870997053666747, 'bull_time_stop': 273, 'bull_use_sma': True, 'bull_use_ema': True, 'bull_use_atr': True, 'bull_use_adx': True, 'bull_use_spike': True, 'bull_rsi_required': True, 'bear_strategy': 'mean_reversion', 'bear_bb_std_mult': 2.2398192358747617, 'bear_rsi_os': 13, 'bear_rsi_ob': 88, 'bear_adx_thresh': 22.489770173278178, 'bear_atr_min_pct': 0.029761485256436376, 'bear_atr_max_pct': 0.027157442249588284, 'bear_tp_mult': 2.744068371042077, 'bear_tsl_mult': 0.17040400098849207, 'bear_time_stop': 66, 'bear_use_sma': True, 'bear_use_ema': False, 'bear_use_atr': True, 'bear_use_adx': False, 'bear_use_spike': False, 'bear_rsi_required': True, 'sideways_strategy': 'breakout', 'sideways_bb_std_mult': 2.919119723923402, 'sideways_rsi_os': 53, 'sideways_rsi_ob': 88, 'sideways_adx_thresh': 20.556204497164092, 'sideways_atr_min_pct': 0.009847535320549267, 'sideways_atr_max_pct': 0.08067482310767227, 'sideways_tp_mult': 1.1689659770412357, 'sideways_tsl_mult': 0.4852755973686754, 'sideways_time_stop': 278, 'sideways_use_sma': False, 'sideways_use_ema': False, 'sideways_use_atr': True, 'sideways_use_adx': True, 'sideways_use_spike': False, 'sideways_rsi_required': False}.
[I 2025-09-01 14:07:03,287] Trial 96 finished with values: [-0.14743692498248562, 0.1473225026712185] and parameters: {'p_sma': 41, 'p_std': 15, 'p_atr': 13, 'p_adx': 20, 'rsi_period': 42, 'ema1': 19, 'ema2': 43, 'slip_atr_k': 0.05673779590909232, 'slip_spread_k': 0.6982463726661648, 'spread_hl_frac': 0.021990334364294355, 'bb_std_mult': 2.098772573172241, 'rsi_os': 54, 'rsi_ob': 84, 'vol_spike': 0.05810741087504731, 'adx_thresh': 28.350467811950686, 'atr_min_pct': 0.019362485974143254, 'atr_max_pct': 0.09705328706075979, 'tp_mult': 1.7607467163531227, 'tsl_mult': 0.2070112215202319, 'strategy': 'breakout', 'time_stop': 258, 'use_sma': False, 'use_atr': False, 'use_adx': False, 'use_ema': False, 'use_spike': True, 'rsi_required': True, 'edge_k': 1.266583176056071, 'edge_cap': 0.7134177989220454, 'bull_strategy': 'mean_reversion', 'bull_bb_std_mult': 3.5712166173836453, 'bull_rsi_os': 34, 'bull_rsi_ob': 86, 'bull_adx_thresh': 24.74830120965538, 'bull_atr_min_pct': 0.0013198763299770303, 'bull_atr_max_pct': 0.05863908105803562, 'bull_tp_mult': 2.0397682999325992, 'bull_tsl_mult': 0.00421178652573027, 'bull_time_stop': 127, 'bull_use_sma': True, 'bull_use_ema': True, 'bull_use_atr': True, 'bull_use_adx': False, 'bull_use_spike': True, 'bull_rsi_required': True, 'bear_strategy': 'mean_reversion', 'bear_bb_std_mult': 1.260881914188516, 'bear_rsi_os': 13, 'bear_rsi_ob': 89, 'bear_adx_thresh': 23.241853206182945, 'bear_atr_min_pct': 0.02919815129193578, 'bear_atr_max_pct': 0.010073043688716213, 'bear_tp_mult': 2.846245514828696, 'bear_tsl_mult': 0.6212716747893208, 'bear_time_stop': 279, 'bear_use_sma': False, 'bear_use_ema': False, 'bear_use_atr': True, 'bear_use_adx': False, 'bear_use_spike': False, 'bear_rsi_required': True, 'sideways_strategy': 'breakout', 'sideways_bb_std_mult': 1.3475179118091671, 'sideways_rsi_os': 18, 'sideways_rsi_ob': 49, 'sideways_adx_thresh': 21.628898737916984, 'sideways_atr_min_pct': 0.0014007701259672427, 'sideways_atr_max_pct': 0.07317448040391387, 'sideways_tp_mult': 1.1586428502300694, 'sideways_tsl_mult': 0.7206379055007317, 'sideways_time_stop': 131, 'sideways_use_sma': False, 'sideways_use_ema': False, 'sideways_use_atr': True, 'sideways_use_adx': True, 'sideways_use_spike': True, 'sideways_rsi_required': True}.
