[I 2025-09-01 14:10:26,542] Trial 119 finished with values: [-1000000000.0, 1000000000.0] and parameters: {'p_sma': 45, 'p_std': 58, 'p_atr': 25, 'p_adx': 22, 'rsi_period': 61, 'ema1': 11, 'ema2': 47, 'slip_atr_k': 0.20841289506765226, 'slip_spread_k': 0.5848287558669805, 'spread_hl_frac': 0.024362653535602345, 'bb_std_mult': 2.3472196956323153, 'rsi_os': 15, 'rsi_ob': 66, 'vol_spike': 0.0737638681410412, 'adx_thresh': 11.658028857703576, 'atr_min_pct': 0.016368068328497513, 'atr_max_pct': 0.11144559436587591, 'tp_mult': 2.551104940798174, 'tsl_mult': 0.16998115458494223, 'strategy': 'breakout', 'time_stop': 230, 'use_sma': False, 'use_atr': True, 'use_adx': True, 'use_ema': True, 'use_spike': False, 'rsi_required': False, 'edge_k': 0.5115476031559103, 'edge_cap': 0.7611739609681675, 'bull_strategy': 'mean_reversion', 'bull_bb_std_mult': 0.8548276738009748, 'bull_rsi_os': 52, 'bull_rsi_ob': 53, 'bull_adx_thresh': 27.873616976634956, 'bull_atr_min_pct': 0.0005986890106622196, 'bull_atr_max_pct': 0.08061785755748596, 'bull_tp_mult': 1.3354451305513926, 'bull_tsl_mult': 0.9662271736356909, 'bull_time_stop': 170, 'bull_use_sma': False, 'bull_use_ema': True, 'bull_use_atr': False, 'bull_use_adx': True, 'bull_use_spike': True, 'bull_rsi_required': True, 'bear_strategy': 'mean_reversion', 'bear_bb_std_mult': 1.916074449374392, 'bear_rsi_os': 42, 'bear_rsi_ob': 65, 'bear_adx_thresh': 10.053962632875752, 'bear_atr_min_pct': 0.020811611742512736, 'bear_atr_max_pct': 0.01629589364832973, 'bear_tp_mult': 1.24777237514975, 'bear_tsl_mult': 0.24288060590028132, 'bear_time_stop': 194, 'bear_use_sma': False, 'bear_use_ema': True, 'bear_use_atr': True, 'bear_use_adx': False, 'bear_use_spike': True, 'bear_rsi_required': False, 'sideways_strategy': 'mean_reversion', 'sideways_bb_std_mult': 2.7494242151718256, 'sideways_rsi_os': 25, 'sideways_rsi_ob': 54, 'sideways_adx_thresh': 14.425765552923519, 'sideways_atr_min_pct': 0.009490065532570695, 'sideways_atr_max_pct': 0.07757046435107956, 'sideways_tp_mult': 2.1445619207643327, 'sideways_tsl_mult': 0.7593526877957866, 'sideways_time_stop': 160, 'sideways_use_sma': True, 'sideways_use_ema': False, 'sideways_use_atr': True, 'sideways_use_adx': True, 'sideways_use_spike': False, 'sideways_rsi_required': True}.
[I 2025-09-01 14:10:28,279] Trial 117 finished with values: [-0.025523186152267008, 0.025605550840321546] and parameters: {'p_sma': 40, 'p_std': 49, 'p_atr': 16, 'p_adx': 22, 'rsi_period': 61, 'ema1': 21, 'ema2': 39, 'slip_atr_k': 0.1199706354279984, 'slip_spread_k': 0.5851384148772156, 'spread_hl_frac': 0.02463102703589717, 'bb_std_mult': 1.7271562080348564, 'rsi_os': 15, 'rsi_ob': 65, 'vol_spike': 0.07402402181744798, 'adx_thresh': 26.93177075243507, 'atr_min_pct': 0.01631436219639064, 'atr_max_pct': 0.11145999000872799, 'tp_mult': 2.2019876262620723, 'tsl_mult': 0.5277663471445095, 'strategy': 'breakout', 'time_stop': 55, 'use_sma': False, 'use_atr': True, 'use_adx': False, 'use_ema': True, 'use_spike': False, 'rsi_required': False, 'edge_k': 1.5899947604619356, 'edge_cap': 0.08615319952910477, 'bull_strategy': 'mean_reversion', 'bull_bb_std_mult': 0.8634082747513101, 'bull_rsi_os': 52, 'bull_rsi_ob': 53, 'bull_adx_thresh': 8.523911223542076, 'bull_atr_min_pct': 0.0017156272323715462, 'bull_atr_max_pct': 0.10872915485874982, 'bull_tp_mult': 1.2047746764610694, 'bull_tsl_mult': 0.9672604728331776, 'bull_time_stop': 169, 'bull_use_sma': False, 'bull_use_ema': False, 'bull_use_atr': False, 'bull_use_adx': True, 'bull_use_spike': True, 'bull_rsi_required': True, 'bear_strategy': 'mean_reversion', 'bear_bb_std_mult': 1.4381297823630101, 'bear_rsi_os': 36, 'bear_rsi_ob': 53, 'bear_adx_thresh': 10.148654724489681, 'bear_atr_min_pct': 0.020806591876501516, 'bear_atr_max_pct': 0.01771955672029853, 'bear_tp_mult': 1.0797729099158189, 'bear_tsl_mult': 0.7415530648519499, 'bear_time_stop': 248, 'bear_use_sma': True, 'bear_use_ema': True, 'bear_use_atr': True, 'bear_use_adx': False, 'bear_use_spike': True, 'bear_rsi_required': False, 'sideways_strategy': 'mean_reversion', 'sideways_bb_std_mult': 2.7561371085219166, 'sideways_rsi_os': 23, 'sideways_rsi_ob': 54, 'sideways_adx_thresh': 27.907601504809953, 'sideways_atr_min_pct': 0.003914090960296521, 'sideways_atr_max_pct': 0.07810290066920852, 'sideways_tp_mult': 1.1120926586150843, 'sideways_tsl_mult': 0.7693469827362697, 'sideways_time_stop': 161, 'sideways_use_sma': True, 'sideways_use_ema': False, 'sideways_use_atr': True, 'sideways_use_adx': True, 'sideways_use_spike': True, 'sideways_rsi_required': False}.
[I 2025-09-01 14:10:28,703] Trial 118 finished with values: [-1000000000.0, 1000000000.0] and parameters: {'p_sma': 42, 'p_std': 58, 'p_atr': 25, 'p_adx': 22, 'rsi_period': 61, 'ema1': 11, 'ema2': 47, 'slip_atr_k': 0.009381649422134652, 'slip_spread_k': 0.04345761419533445, 'spread_hl_frac': 0.03824155670868169, 'bb_std_mult': 2.3907623002862466, 'rsi_os': 19, 'rsi_ob': 66, 'vol_spike': 0.20036723143588941, 'adx_thresh': 9.326334325587128, 'atr_min_pct': 0.007994967467522544, 'atr_max_pct': 0.10930908520253423, 'tp_mult': 1.8255182378704347, 'tsl_mult': 0.2576490604932505, 'strategy': 'breakout', 'time_stop': 57, 'use_sma': False, 'use_atr': True, 'use_adx': True, 'use_ema': True, 'use_spike': False, 'rsi_required': False, 'edge_k': 1.6231540736102867, 'edge_cap': 0.7546933110189398, 'bull_strategy': 'mean_reversion', 'bull_bb_std_mult': 1.1852273337666575, 'bull_rsi_os': 47, 'bull_rsi_ob': 53, 'bull_adx_thresh': 19.335526961905444, 'bull_atr_min_pct': 0.0005791680858231261, 'bull_atr_max_pct': 0.10939550140813352, 'bull_tp_mult': 1.2829255794982979, 'bull_tsl_mult': 0.6792413819938031, 'bull_time_stop': 245, 'bull_use_sma': False, 'bull_use_ema': True, 'bull_use_atr': False, 'bull_use_adx': True, 'bull_use_spike': True, 'bull_rsi_required': True, 'bear_strategy': 'mean_reversion', 'bear_bb_std_mult': 1.8948823993647579, 'bear_rsi_os': 8, 'bear_rsi_ob': 52, 'bear_adx_thresh': 8.877640187369954, 'bear_atr_min_pct': 0.018864969697689363, 'bear_atr_max_pct': 0.01572008964751613, 'bear_tp_mult': 2.784984563374364, 'bear_tsl_mult': 0.23482424438037866, 'bear_time_stop': 247, 'bear_use_sma': False, 'bear_use_ema': True, 'bear_use_atr': True, 'bear_use_adx': False, 'bear_use_spike': True, 'bear_rsi_required': False, 'sideways_strategy': 'mean_reversion', 'sideways_bb_std_mult': 3.205375678523656, 'sideways_rsi_os': 25, 'sideways_rsi_ob': 53, 'sideways_adx_thresh': 14.58112544878041, 'sideways_atr_min_pct': 0.004033354914365876, 'sideways_atr_max_pct': 0.07884343456308018, 'sideways_tp_mult': 1.6465828500286233, 'sideways_tsl_mult': 0.7685543659608056, 'sideways_time_stop': 104, 'sideways_use_sma': True, 'sideways_use_ema': False, 'sideways_use_atr': True, 'sideways_use_adx': True, 'sideways_use_spike': False, 'sideways_rsi_required': True}.
[I 2025-09-01 14:10:29,097] Trial 120 finished with values: [-0.038018626701769476, 0.03791361822401685] and parameters: {'p_sma': 52, 'p_std': 9, 'p_atr': 25, 'p_adx': 22, 'rsi_period': 61, 'ema1': 24, 'ema2': 60, 'slip_atr_k': 0.013711950540413936, 'slip_spread_k': 0.2657083149829095, 'spread_hl_frac': 0.038747370921923145, 'bb_std_mult': 2.3602595783827787, 'rsi_os': 15, 'rsi_ob': 65, 'vol_spike': 0.19840313807421003, 'adx_thresh': 5.0966528413525065, 'atr_min_pct': 0.009094265679341884, 'atr_max_pct': 0.11086959450460837, 'tp_mult': 2.2201582853493687, 'tsl_mult': 0.5362546720086293, 'strategy': 'breakout', 'time_stop': 59, 'use_sma': False, 'use_atr': True, 'use_adx': True, 'use_ema': True, 'use_spike': False, 'rsi_required': False, 'edge_k': 1.6037827102023052, 'edge_cap': 0.8494155590642127, 'bull_strategy': 'mean_reversion', 'bull_bb_std_mult': 2.6103188789082536, 'bull_rsi_os': 27, 'bull_rsi_ob': 95, 'bull_adx_thresh': 8.402961169095663, 'bull_atr_min_pct': 0.0005696957835729413, 'bull_atr_max_pct': 0.07963484626120862, 'bull_tp_mult': 2.8707880141327564, 'bull_tsl_mult': 0.05315271107205327, 'bull_time_stop': 122, 'bull_use_sma': False, 'bull_use_ema': True, 'bull_use_atr': False, 'bull_use_adx': True, 'bull_use_spike': True, 'bull_rsi_required': True, 'bear_strategy': 'mean_reversion', 'bear_bb_std_mult': 1.955298265447479, 'bear_rsi_os': 8, 'bear_rsi_ob': 52, 'bear_adx_thresh': 13.194290441649484, 'bear_atr_min_pct': 0.020834543223041815, 'bear_atr_max_pct': 0.09590806442026334, 'bear_tp_mult': 1.0816840749276946, 'bear_tsl_mult': 0.2424643034333845, 'bear_time_stop': 245, 'bear_use_sma': False, 'bear_use_ema': False, 'bear_use_atr': True, 'bear_use_adx': False, 'bear_use_spike': True, 'bear_rsi_required': False, 'sideways_strategy': 'mean_reversion', 'sideways_bb_std_mult': 3.168485360958499, 'sideways_rsi_os': 20, 'sideways_rsi_ob': 53, 'sideways_adx_thresh': 22.904307877329682, 'sideways_atr_min_pct': 0.003711070749744437, 'sideways_atr_max_pct': 0.07787754997445184, 'sideways_tp_mult': 1.4291235752942, 'sideways_tsl_mult': 0.43819030075632415, 'sideways_time_stop': 104, 'sideways_use_sma': True, 'sideways_use_ema': False, 'sideways_use_atr': True, 'sideways_use_adx': True, 'sideways_use_spike': True, 'sideways_rsi_required': True}.
[I 2025-09-01 14:11:11,108] Trial 124 finished with values: [-1000000000.0, 1000000000.0] and parameters: {'p_sma': 37, 'p_std': 54, 'p_atr': 23, 'p_adx': 9, 'rsi_period': 65, 'ema1': 20, 'ema2': 35, 'slip_atr_k': 0.2217841008682509, 'slip_spread_k': 0.8525350169441845, 'spread_hl_frac': 0.019746888499130456, 'bb_std_mult': 2.6051528078412907, 'rsi_os': 11, 'rsi_ob': 69, 'vol_spike': 0.05360367526242379, 'adx_thresh': 18.019889958250218, 'atr_min_pct': 0.028149247096118282, 'atr_max_pct': 0.12817533332344486, 'tp_mult': 2.8123452871580055, 'tsl_mult': 0.18218142684685248, 'strategy': 'mean_reversion', 'time_stop': 83, 'use_sma': False, 'use_atr': False, 'use_adx': True, 'use_ema': False, 'use_spike': True, 'rsi_required': True, 'edge_k': 0.8738100658252947, 'edge_cap': 0.7717953711993626, 'bull_strategy': 'mean_reversion', 'bull_bb_std_mult': 1.0458201370855364, 'bull_rsi_os': 20, 'bull_rsi_ob': 51, 'bull_adx_thresh': 20.728471414272345, 'bull_atr_min_pct': 0.015807445159745994, 'bull_atr_max_pct': 0.1173476566288542, 'bull_tp_mult': 1.5279321008720466, 'bull_tsl_mult': 0.32666709819591416, 'bull_time_stop': 117, 'bull_use_sma': True, 'bull_use_ema': True, 'bull_use_atr': True, 'bull_use_adx': False, 'bull_use_spike': True, 'bull_rsi_required': True, 'bear_strategy': 'breakout', 'bear_bb_std_mult': 0.735208705925641, 'bear_rsi_os': 16, 'bear_rsi_ob': 93, 'bear_adx_thresh': 12.07991568451108, 'bear_atr_min_pct': 0.019690785441185958, 'bear_atr_max_pct': 0.06455456427150749, 'bear_tp_mult': 2.8758784956685846, 'bear_tsl_mult': 0.10422498599825786, 'bear_time_stop': 146, 'bear_use_sma': True, 'bear_use_ema': False, 'bear_use_atr': False, 'bear_use_adx': False, 'bear_use_spike': False, 'bear_rsi_required': True, 'sideways_strategy': 'breakout', 'sideways_bb_std_mult': 3.0256674218945685, 'sideways_rsi_os': 39, 'sideways_rsi_ob': 52, 'sideways_adx_thresh': 31.910794929984146, 'sideways_atr_min_pct': 0.025946142626964926, 'sideways_atr_max_pct': 0.134445592320439, 'sideways_tp_mult': 2.3208839818136413, 'sideways_tsl_mult': 0.32091790604968684, 'sideways_time_stop': 69, 'sideways_use_sma': False, 'sideways_use_ema': False, 'sideways_use_atr': False, 'sideways_use_adx': True, 'sideways_use_spike': False, 'sideways_rsi_required': False}.
[I 2025-09-01 14:11:11,989] Trial 122 finished with values: [-1000000000.0, 1000000000.0] and parameters: {'p_sma': 53, 'p_std': 54, 'p_atr': 23, 'p_adx': 26, 'rsi_period': 65, 'ema1': 20, 'ema2': 23, 'slip_atr_k': 0.19384496372535642, 'slip_spread_k': 0.2564553257151372, 'spread_hl_frac': 0.038986334192819556, 'bb_std_mult': 2.3712241565717993, 'rsi_os': 11, 'rsi_ob': 60, 'vol_spike': 0.2025966064210898, 'adx_thresh': 8.906495582558502, 'atr_min_pct': 0.0012744078768747412, 'atr_max_pct': 0.128009341046758, 'tp_mult': 2.7005201218675037, 'tsl_mult': 0.26016060948365605, 'strategy': 'mean_reversion', 'time_stop': 86, 'use_sma': False, 'use_atr': False, 'use_adx': True, 'use_ema': False, 'use_spike': True, 'rsi_required': True, 'edge_k': 0.08533006209886018, 'edge_cap': 0.34264452208146434, 'bull_strategy': 'mean_reversion', 'bull_bb_std_mult': 1.1913151526768482, 'bull_rsi_os': 21, 'bull_rsi_ob': 82, 'bull_adx_thresh': 15.140991678325179, 'bull_atr_min_pct': 1.3646463824602096e-05, 'bull_atr_max_pct': 0.06989933099484419, 'bull_tp_mult': 1.4432949511072717, 'bull_tsl_mult': 0.05309967144781873, 'bull_time_stop': 253, 'bull_use_sma': True, 'bull_use_ema': True, 'bull_use_atr': True, 'bull_use_adx': False, 'bull_use_spike': True, 'bull_rsi_required': True, 'bear_strategy': 'breakout', 'bear_bb_std_mult': 0.7264883801634157, 'bear_rsi_os': 16, 'bear_rsi_ob': 65, 'bear_adx_thresh': 12.921482989768391, 'bear_atr_min_pct': 0.019074763395289383, 'bear_atr_max_pct': 0.14614300038959047, 'bear_tp_mult': 2.898741940058584, 'bear_tsl_mult': 0.8920937348492755, 'bear_time_stop': 169, 'bear_use_sma': False, 'bear_use_ema': False, 'bear_use_atr': True, 'bear_use_adx': False, 'bear_use_spike': False, 'bear_rsi_required': True, 'sideways_strategy': 'breakout', 'sideways_bb_std_mult': 1.6935880663676763, 'sideways_rsi_os': 26, 'sideways_rsi_ob': 52, 'sideways_adx_thresh': 32.237253001791856, 'sideways_atr_min_pct': 0.0032559938603322486, 'sideways_atr_max_pct': 0.031948847069333895, 'sideways_tp_mult': 2.2574444246747714, 'sideways_tsl_mult': 0.4393486409999214, 'sideways_time_stop': 126, 'sideways_use_sma': False, 'sideways_use_ema': False, 'sideways_use_atr': True, 'sideways_use_adx': True, 'sideways_use_spike': False, 'sideways_rsi_required': False}.
[I 2025-09-01 14:11:12,508] Trial 123 finished with values: [-0.022271700167239783, 0.0223059820457686] and parameters: {'p_sma': 52, 'p_std': 33, 'p_atr': 23, 'p_adx': 14, 'rsi_period': 31, 'ema1': 15, 'ema2': 56, 'slip_atr_k': 0.1932789101958482, 'slip_spread_k': 0.41803360780414095, 'spread_hl_frac': 0.027649551462495862, 'bb_std_mult': 2.600361828068202, 'rsi_os': 11, 'rsi_ob': 60, 'vol_spike': 0.09592818725096337, 'adx_thresh': 31.45342019011926, 'atr_min_pct': 0.009225041108956118, 'atr_max_pct': 0.12827618110221514, 'tp_mult': 2.0618997129818557, 'tsl_mult': 0.8633723468614944, 'strategy': 'mean_reversion', 'time_stop': 88, 'use_sma': False, 'use_atr': False, 'use_adx': True, 'use_ema': False, 'use_spike': True, 'rsi_required': True, 'edge_k': 0.121576975668786, 'edge_cap': 0.8538264076233459, 'bull_strategy': 'mean_reversion', 'bull_bb_std_mult': 0.6146679311935135, 'bull_rsi_os': 20, 'bull_rsi_ob': 95, 'bull_adx_thresh': 14.99391849781684, 'bull_atr_min_pct': 6.629771682036766e-05, 'bull_atr_max_pct': 0.1162543312561783, 'bull_tp_mult': 1.4311989635091342, 'bull_tsl_mult': 0.0491451934423946, 'bull_time_stop': 119, 'bull_use_sma': True, 'bull_use_ema': True, 'bull_use_atr': True, 'bull_use_adx': False, 'bull_use_spike': True, 'bull_rsi_required': True, 'bear_strategy': 'breakout', 'bear_bb_std_mult': 2.5694124915405356, 'bear_rsi_os': 54, 'bear_rsi_ob': 76, 'bear_adx_thresh': 12.717735272319816, 'bear_atr_min_pct': 0.01968883684463529, 'bear_atr_max_pct': 0.04820619306252282, 'bear_tp_mult': 2.897929069590596, 'bear_tsl_mult': 0.875078436270254, 'bear_time_stop': 161, 'bear_use_sma': True, 'bear_use_ema': False, 'bear_use_atr': True, 'bear_use_adx': False, 'bear_use_spike': True, 'bear_rsi_required': True, 'sideways_strategy': 'breakout', 'sideways_bb_std_mult': 2.6320217221766535, 'sideways_rsi_os': 7, 'sideways_rsi_ob': 52, 'sideways_adx_thresh': 22.147833859010554, 'sideways_atr_min_pct': 0.007729108283175703, 'sideways_atr_max_pct': 0.034133085886688404, 'sideways_tp_mult': 2.255860611017047, 'sideways_tsl_mult': 0.9205336031618334, 'sideways_time_stop': 210, 'sideways_use_sma': False, 'sideways_use_ema': False, 'sideways_use_atr': False, 'sideways_use_adx': True, 'sideways_use_spike': False, 'sideways_rsi_required': False}.
[I 2025-09-01 14:11:13,199] Trial 121 finished with values: [-1000000000.0, 1000000000.0] and parameters: {'p_sma': 54, 'p_std': 33, 'p_atr': 16, 'p_adx': 11, 'rsi_period': 59, 'ema1': 21, 'ema2': 35, 'slip_atr_k': 0.12187886423282727, 'slip_spread_k': 0.8593463855286181, 'spread_hl_frac': 0.03555624088810014, 'bb_std_mult': 2.6360258619658534, 'rsi_os': 31, 'rsi_ob': 60, 'vol_spike': 0.23278173352987463, 'adx_thresh': 31.51750762737939, 'atr_min_pct': 0.009142075025698623, 'atr_max_pct': 0.12692829769442796, 'tp_mult': 2.195716843343149, 'tsl_mult': 0.25295652636474214, 'strategy': 'breakout', 'time_stop': 87, 'use_sma': False, 'use_atr': False, 'use_adx': False, 'use_ema': False, 'use_spike': False, 'rsi_required': True, 'edge_k': 1.6243888916814202, 'edge_cap': 0.8481537123366328, 'bull_strategy': 'mean_reversion', 'bull_bb_std_mult': 2.645998019331647, 'bull_rsi_os': 20, 'bull_rsi_ob': 95, 'bull_adx_thresh': 14.011280500559735, 'bull_atr_min_pct': 0.009202013859701048, 'bull_atr_max_pct': 0.06957627365249552, 'bull_tp_mult': 1.4341144143762765, 'bull_tsl_mult': 0.6585000404981984, 'bull_time_stop': 120, 'bull_use_sma': True, 'bull_use_ema': True, 'bull_use_atr': True, 'bull_use_adx': False, 'bull_use_spike': True, 'bull_rsi_required': True, 'bear_strategy': 'mean_reversion', 'bear_bb_std_mult': 2.168186446963434, 'bear_rsi_os': 16, 'bear_rsi_ob': 50, 'bear_adx_thresh': 12.621627502973322, 'bear_atr_min_pct': 0.019009533827112277, 'bear_atr_max_pct': 0.014381727097823944, 'bear_tp_mult': 2.8915005120575663, 'bear_tsl_mult': 0.49024539508528675, 'bear_time_stop': 167, 'bear_use_sma': False, 'bear_use_ema': False, 'bear_use_atr': True, 'bear_use_adx': False, 'bear_use_spike': True, 'bear_rsi_required': False, 'sideways_strategy': 'breakout', 'sideways_bb_std_mult': 2.624871964800722, 'sideways_rsi_os': 26, 'sideways_rsi_ob': 53, 'sideways_adx_thresh': 22.93647654499254, 'sideways_atr_min_pct': 0.004026941619291319, 'sideways_atr_max_pct': 0.031255227624425806, 'sideways_tp_mult': 1.4094598504965508, 'sideways_tsl_mult': 0.9169182427362887, 'sideways_time_stop': 103, 'sideways_use_sma': True, 'sideways_use_ema': False, 'sideways_use_atr': True, 'sideways_use_adx': True, 'sideways_use_spike': True, 'sideways_rsi_required': False}.
[I 2025-09-01 14:11:55,832] Trial 127 finished with values: [-1000000000.0, 1000000000.0] and parameters: {'p_sma': 39, 'p_std': 50, 'p_atr': 24, 'p_adx': 11, 'rsi_period': 57, 'ema1': 18, 'ema2': 41, 'slip_atr_k': 0.21478205888190585, 'slip_spread_k': 0.37501187984972645, 'spread_hl_frac': 0.029612572091540085, 'bb_std_mult': 2.46316220063348, 'rsi_os': 21, 'rsi_ob': 70, 'vol_spike': 0.07048384739931526, 'adx_thresh': 19.62549212079419, 'atr_min_pct': 0.023106437680757957, 'atr_max_pct': 0.11849928934013498, 'tp_mult': 2.9485969701283663, 'tsl_mult': 0.21123176241081892, 'strategy': 'mean_reversion', 'time_stop': 172, 'use_sma': False, 'use_atr': False, 'use_adx': False, 'use_ema': False, 'use_spike': False, 'rsi_required': True, 'edge_k': 1.7320671962549876, 'edge_cap': 0.7263815878232338, 'bull_strategy': 'breakout', 'bull_bb_std_mult': 1.8464893705565313, 'bull_rsi_os': 32, 'bull_rsi_ob': 80, 'bull_adx_thresh': 7.735736450557489, 'bull_atr_min_pct': 0.018138604574289268, 'bull_atr_max_pct': 0.12745882966269959, 'bull_tp_mult': 1.6384645811860568, 'bull_tsl_mult': 0.563093094258002, 'bull_time_stop': 112, 'bull_use_sma': True, 'bull_use_ema': False, 'bull_use_atr': True, 'bull_use_adx': True, 'bull_use_spike': True, 'bull_rsi_required': True, 'bear_strategy': 'breakout', 'bear_bb_std_mult': 2.3318674091285905, 'bear_rsi_os': 46, 'bear_rsi_ob': 49, 'bear_adx_thresh': 11.217128184528766, 'bear_atr_min_pct': 0.017932130831706538, 'bear_atr_max_pct': 0.07205839936322023, 'bear_tp_mult': 2.5260923722262714, 'bear_tsl_mult': 0.27260372192332705, 'bear_time_stop': 270, 'bear_use_sma': True, 'bear_use_ema': False, 'bear_use_atr': False, 'bear_use_adx': True, 'bear_use_spike': True, 'bear_rsi_required': True, 'sideways_strategy': 'breakout', 'sideways_bb_std_mult': 1.9303665744253649, 'sideways_rsi_os': 21, 'sideways_rsi_ob': 49, 'sideways_adx_thresh': 20.827560087412067, 'sideways_atr_min_pct': 0.00915230007779605, 'sideways_atr_max_pct': 0.06667416327977922, 'sideways_tp_mult': 2.196836607135782, 'sideways_tsl_mult': 0.2007625719658776, 'sideways_time_stop': 147, 'sideways_use_sma': True, 'sideways_use_ema': False, 'sideways_use_atr': True, 'sideways_use_adx': True, 'sideways_use_spike': False, 'sideways_rsi_required': False}.
