[I 2025-09-01 15:13:40,401] Trial 510 finished with values: [-1000000000.0, 1000000000.0] and parameters: {'p_sma': 18, 'p_std': 11, 'p_atr': 30, 'p_adx': 25, 'rsi_period': 52, 'ema1': 29, 'ema2': 56, 'slip_atr_k': 0.1124740536827765, 'slip_spread_k': 0.1294984103439772, 'spread_hl_frac': 0.014869482848574724, 'bb_std_mult': 1.6554791446884034, 'rsi_os': 34, 'rsi_ob': 75, 'vol_spike': 0.28518175489886166, 'adx_thresh': 20.10319434381552, 'atr_min_pct': 0.0042255762614036, 'atr_max_pct': 0.14318025683989488, 'tp_mult': 2.9087885330309233, 'tsl_mult': 0.5137188017788819, 'strategy': 'breakout', 'time_stop': 82, 'use_sma': True, 'use_atr': False, 'use_adx': False, 'use_ema': False, 'use_spike': True, 'rsi_required': True, 'edge_k': 0.9716137684812646, 'edge_cap': 0.4427307896137222, 'bull_strategy': 'breakout', 'bull_bb_std_mult': 3.4718403826286637, 'bull_rsi_os': 50, 'bull_rsi_ob': 66, 'bull_adx_thresh': 17.970633357192774, 'bull_atr_min_pct': 0.004030278300869974, 'bull_atr_max_pct': 0.0211730621097301, 'bull_tp_mult': 1.3340226369536192, 'bull_tsl_mult': 0.9648766925493817, 'bull_time_stop': 173, 'bull_use_sma': True, 'bull_use_ema': True, 'bull_use_atr': False, 'bull_use_adx': True, 'bull_use_spike': False, 'bull_rsi_required': True, 'bear_strategy': 'breakout', 'bear_bb_std_mult': 2.7238700647217358, 'bear_rsi_os': 29, 'bear_rsi_ob': 59, 'bear_adx_thresh': 29.327526251760965, 'bear_atr_min_pct': 0.023606957211057333, 'bear_atr_max_pct': 0.11474083580948649, 'bear_tp_mult': 2.8283514958892866, 'bear_tsl_mult': 0.6390313421401095, 'bear_time_stop': 68, 'bear_use_sma': True, 'bear_use_ema': False, 'bear_use_atr': True, 'bear_use_adx': True, 'bear_use_spike': False, 'bear_rsi_required': False, 'sideways_strategy': 'breakout', 'sideways_bb_std_mult': 1.3187511452498093, 'sideways_rsi_os': 17, 'sideways_rsi_ob': 91, 'sideways_adx_thresh': 8.942265456500156, 'sideways_atr_min_pct': 0.026733709136635208, 'sideways_atr_max_pct': 0.1329417078043253, 'sideways_tp_mult': 1.8512744753547368, 'sideways_tsl_mult': 0.29414582206326634, 'sideways_time_stop': 245, 'sideways_use_sma': True, 'sideways_use_ema': False, 'sideways_use_atr': True, 'sideways_use_adx': False, 'sideways_use_spike': True, 'sideways_rsi_required': False}.
[I 2025-09-01 15:14:21,261] Trial 514 finished with values: [-1000000000.0, 1000000000.0] and parameters: {'p_sma': 13, 'p_std': 17, 'p_atr': 21, 'p_adx': 25, 'rsi_period': 62, 'ema1': 30, 'ema2': 51, 'slip_atr_k': 0.06363849385262021, 'slip_spread_k': 0.09695673163353524, 'spread_hl_frac': 0.015222869935884027, 'bb_std_mult': 2.164398095817822, 'rsi_os': 20, 'rsi_ob': 82, 'vol_spike': 0.2995131013961614, 'adx_thresh': 20.561737742149944, 'atr_min_pct': 0.015990709234481683, 'atr_max_pct': 0.10459680863984464, 'tp_mult': 2.5231369030461765, 'tsl_mult': 0.6158107366736708, 'strategy': 'breakout', 'time_stop': 83, 'use_sma': False, 'use_atr': True, 'use_adx': True, 'use_ema': False, 'use_spike': True, 'rsi_required': False, 'edge_k': 0.918450768629133, 'edge_cap': 0.06774520776925601, 'bull_strategy': 'breakout', 'bull_bb_std_mult': 2.7247309742229513, 'bull_rsi_os': 20, 'bull_rsi_ob': 74, 'bull_adx_thresh': 6.018745565396072, 'bull_atr_min_pct': 0.004456844812160586, 'bull_atr_max_pct': 0.020848711978439224, 'bull_tp_mult': 2.0570720738845987, 'bull_tsl_mult': 0.31963699869170414, 'bull_time_stop': 171, 'bull_use_sma': True, 'bull_use_ema': False, 'bull_use_atr': False, 'bull_use_adx': True, 'bull_use_spike': False, 'bull_rsi_required': True, 'bear_strategy': 'mean_reversion', 'bear_bb_std_mult': 0.9880108471754494, 'bear_rsi_os': 7, 'bear_rsi_ob': 78, 'bear_adx_thresh': 29.94205179067964, 'bear_atr_min_pct': 0.025331161162937, 'bear_atr_max_pct': 0.10019959962610056, 'bear_tp_mult': 2.4692210304015565, 'bear_tsl_mult': 0.8153753909610553, 'bear_time_stop': 281, 'bear_use_sma': True, 'bear_use_ema': False, 'bear_use_atr': False, 'bear_use_adx': True, 'bear_use_spike': False, 'bear_rsi_required': False, 'sideways_strategy': 'mean_reversion', 'sideways_bb_std_mult': 1.4753351625747397, 'sideways_rsi_os': 40, 'sideways_rsi_ob': 91, 'sideways_adx_thresh': 29.417163288559273, 'sideways_atr_min_pct': 0.012551267766096497, 'sideways_atr_max_pct': 0.07953208100971723, 'sideways_tp_mult': 1.419319464324714, 'sideways_tsl_mult': 0.25709260875092366, 'sideways_time_stop': 96, 'sideways_use_sma': False, 'sideways_use_ema': False, 'sideways_use_atr': True, 'sideways_use_adx': False, 'sideways_use_spike': True, 'sideways_rsi_required': True}.
[I 2025-09-01 15:14:21,820] Trial 515 finished with values: [-1000000000.0, 1000000000.0] and parameters: {'p_sma': 13, 'p_std': 39, 'p_atr': 21, 'p_adx': 17, 'rsi_period': 63, 'ema1': 30, 'ema2': 60, 'slip_atr_k': 0.043672050237284384, 'slip_spread_k': 0.24115207273034286, 'spread_hl_frac': 0.014021916281053832, 'bb_std_mult': 1.7735399803224816, 'rsi_os': 32, 'rsi_ob': 55, 'vol_spike': 0.29572359782073504, 'adx_thresh': 19.675541770230986, 'atr_min_pct': 0.018910502894256116, 'atr_max_pct': 0.07318176789157851, 'tp_mult': 1.6935270778042324, 'tsl_mult': 0.2674539243242647, 'strategy': 'mean_reversion', 'time_stop': 180, 'use_sma': False, 'use_atr': True, 'use_adx': True, 'use_ema': True, 'use_spike': False, 'rsi_required': False, 'edge_k': 0.3344740540638911, 'edge_cap': 0.07049293584316013, 'bull_strategy': 'mean_reversion', 'bull_bb_std_mult': 2.4102005299839737, 'bull_rsi_os': 12, 'bull_rsi_ob': 48, 'bull_adx_thresh': 11.370561925694282, 'bull_atr_min_pct': 0.0045654251013677654, 'bull_atr_max_pct': 0.021055356063623434, 'bull_tp_mult': 2.032164262364826, 'bull_tsl_mult': 0.9284479849464876, 'bull_time_stop': 174, 'bull_use_sma': True, 'bull_use_ema': False, 'bull_use_atr': False, 'bull_use_adx': False, 'bull_use_spike': True, 'bull_rsi_required': False, 'bear_strategy': 'mean_reversion', 'bear_bb_std_mult': 1.7591382721941107, 'bear_rsi_os': 7, 'bear_rsi_ob': 59, 'bear_adx_thresh': 28.770789332449297, 'bear_atr_min_pct': 0.010016431077221968, 'bear_atr_max_pct': 0.1416226147193878, 'bear_tp_mult': 2.487233810136595, 'bear_tsl_mult': 0.6150358769237424, 'bear_time_stop': 50, 'bear_use_sma': False, 'bear_use_ema': True, 'bear_use_atr': True, 'bear_use_adx': False, 'bear_use_spike': False, 'bear_rsi_required': False, 'sideways_strategy': 'mean_reversion', 'sideways_bb_std_mult': 2.2174301022113605, 'sideways_rsi_os': 17, 'sideways_rsi_ob': 83, 'sideways_adx_thresh': 12.53690838437002, 'sideways_atr_min_pct': 0.012792326044948163, 'sideways_atr_max_pct': 0.08018373220378047, 'sideways_tp_mult': 1.4274659599286208, 'sideways_tsl_mult': 0.26889835654563005, 'sideways_time_stop': 73, 'sideways_use_sma': False, 'sideways_use_ema': False, 'sideways_use_atr': False, 'sideways_use_adx': False, 'sideways_use_spike': True, 'sideways_rsi_required': True}.
[I 2025-09-01 15:14:21,946] Trial 517 finished with values: [-1000000000.0, 1000000000.0] and parameters: {'p_sma': 39, 'p_std': 8, 'p_atr': 29, 'p_adx': 26, 'rsi_period': 62, 'ema1': 8, 'ema2': 52, 'slip_atr_k': 0.13872540996370103, 'slip_spread_k': 0.19062249775223483, 'spread_hl_frac': 0.011489032726182544, 'bb_std_mult': 1.589165099925102, 'rsi_os': 36, 'rsi_ob': 73, 'vol_spike': 0.29536143471457765, 'adx_thresh': 22.33073131030159, 'atr_min_pct': 0.016456499732892833, 'atr_max_pct': 0.07349752732945214, 'tp_mult': 2.9713673085225767, 'tsl_mult': 0.6261456213950886, 'strategy': 'mean_reversion', 'time_stop': 180, 'use_sma': False, 'use_atr': True, 'use_adx': True, 'use_ema': True, 'use_spike': False, 'rsi_required': False, 'edge_k': 0.6719058731327101, 'edge_cap': 0.06664784442627787, 'bull_strategy': 'mean_reversion', 'bull_bb_std_mult': 2.8956706045219613, 'bull_rsi_os': 20, 'bull_rsi_ob': 85, 'bull_adx_thresh': 6.166193603508775, 'bull_atr_min_pct': 0.004791049140776386, 'bull_atr_max_pct': 0.018070883184494364, 'bull_tp_mult': 2.779918850996701, 'bull_tsl_mult': 0.32777279286329175, 'bull_time_stop': 267, 'bull_use_sma': True, 'bull_use_ema': False, 'bull_use_atr': False, 'bull_use_adx': False, 'bull_use_spike': True, 'bull_rsi_required': False, 'bear_strategy': 'mean_reversion', 'bear_bb_std_mult': 2.8240212164968734, 'bear_rsi_os': 7, 'bear_rsi_ob': 89, 'bear_adx_thresh': 29.8382858000539, 'bear_atr_min_pct': 0.02499748983622843, 'bear_atr_max_pct': 0.10632757302996139, 'bear_tp_mult': 2.4761371532745873, 'bear_tsl_mult': 0.700310828779069, 'bear_time_stop': 283, 'bear_use_sma': False, 'bear_use_ema': True, 'bear_use_atr': False, 'bear_use_adx': False, 'bear_use_spike': False, 'bear_rsi_required': True, 'sideways_strategy': 'mean_reversion', 'sideways_bb_std_mult': 3.200890258010058, 'sideways_rsi_os': 16, 'sideways_rsi_ob': 72, 'sideways_adx_thresh': 27.14941139449411, 'sideways_atr_min_pct': 0.005264811333186115, 'sideways_atr_max_pct': 0.04318714912065815, 'sideways_tp_mult': 1.8111042555854342, 'sideways_tsl_mult': 0.2633101805781942, 'sideways_time_stop': 98, 'sideways_use_sma': False, 'sideways_use_ema': False, 'sideways_use_atr': False, 'sideways_use_adx': False, 'sideways_use_spike': True, 'sideways_rsi_required': True}.
[I 2025-09-01 15:14:22,671] Trial 516 finished with values: [-1000000000.0, 1000000000.0] and parameters: {'p_sma': 17, 'p_std': 8, 'p_atr': 21, 'p_adx': 17, 'rsi_period': 54, 'ema1': 30, 'ema2': 60, 'slip_atr_k': 0.19399608094318085, 'slip_spread_k': 0.7403488694984061, 'spread_hl_frac': 0.011518983732953365, 'bb_std_mult': 1.7687460397867458, 'rsi_os': 7, 'rsi_ob': 75, 'vol_spike': 0.28983266514817724, 'adx_thresh': 19.5439936058035, 'atr_min_pct': 0.01635414622101082, 'atr_max_pct': 0.09997210990718677, 'tp_mult': 2.411458235157314, 'tsl_mult': 0.08143112197474807, 'strategy': 'mean_reversion', 'time_stop': 72, 'use_sma': False, 'use_atr': True, 'use_adx': True, 'use_ema': True, 'use_spike': False, 'rsi_required': False, 'edge_k': 0.9146728380502445, 'edge_cap': 0.06857307777125018, 'bull_strategy': 'mean_reversion', 'bull_bb_std_mult': 2.8019388336435234, 'bull_rsi_os': 20, 'bull_rsi_ob': 85, 'bull_adx_thresh': 11.269587675320894, 'bull_atr_min_pct': 0.004435288130941026, 'bull_atr_max_pct': 0.021532749587089724, 'bull_tp_mult': 2.041614162655398, 'bull_tsl_mult': 0.32922437514600983, 'bull_time_stop': 103, 'bull_use_sma': True, 'bull_use_ema': False, 'bull_use_atr': False, 'bull_use_adx': False, 'bull_use_spike': True, 'bull_rsi_required': False, 'bear_strategy': 'mean_reversion', 'bear_bb_std_mult': 2.659755616894752, 'bear_rsi_os': 7, 'bear_rsi_ob': 59, 'bear_adx_thresh': 28.62723216782272, 'bear_atr_min_pct': 0.02526894352679367, 'bear_atr_max_pct': 0.07127309243085501, 'bear_tp_mult': 2.484916111791328, 'bear_tsl_mult': 0.618243322053909, 'bear_time_stop': 67, 'bear_use_sma': False, 'bear_use_ema': True, 'bear_use_atr': True, 'bear_use_adx': False, 'bear_use_spike': False, 'bear_rsi_required': False, 'sideways_strategy': 'mean_reversion', 'sideways_bb_std_mult': 1.30897434468188, 'sideways_rsi_os': 48, 'sideways_rsi_ob': 88, 'sideways_adx_thresh': 29.35057017987468, 'sideways_atr_min_pct': 0.005807496732972834, 'sideways_atr_max_pct': 0.01599246992354314, 'sideways_tp_mult': 1.441126819178416, 'sideways_tsl_mult': 0.26477688425716195, 'sideways_time_stop': 97, 'sideways_use_sma': False, 'sideways_use_ema': False, 'sideways_use_atr': False, 'sideways_use_adx': False, 'sideways_use_spike': True, 'sideways_rsi_required': True}.
[I 2025-09-01 15:15:00,804] Trial 519 finished with values: [-1000000000.0, 1000000000.0] and parameters: {'p_sma': 51, 'p_std': 60, 'p_atr': 20, 'p_adx': 18, 'rsi_period': 36, 'ema1': 8, 'ema2': 52, 'slip_atr_k': 0.07611461575331424, 'slip_spread_k': 0.19133290958416332, 'spread_hl_frac': 0.011368664810802441, 'bb_std_mult': 1.5882995696033573, 'rsi_os': 7, 'rsi_ob': 52, 'vol_spike': 0.08703519736220537, 'adx_thresh': 19.019237875795213, 'atr_min_pct': 0.02603098353358934, 'atr_max_pct': 0.06253458118874647, 'tp_mult': 2.972506340594058, 'tsl_mult': 0.6447077946557841, 'strategy': 'mean_reversion', 'time_stop': 70, 'use_sma': False, 'use_atr': True, 'use_adx': True, 'use_ema': True, 'use_spike': True, 'rsi_required': False, 'edge_k': 0.06671669087726428, 'edge_cap': 0.08586119907401378, 'bull_strategy': 'mean_reversion', 'bull_bb_std_mult': 2.8075843148509616, 'bull_rsi_os': 9, 'bull_rsi_ob': 89, 'bull_adx_thresh': 10.179420344127386, 'bull_atr_min_pct': 0.0037797327679413503, 'bull_atr_max_pct': 0.06858290021974882, 'bull_tp_mult': 2.820281286616356, 'bull_tsl_mult': 0.380836141446498, 'bull_time_stop': 98, 'bull_use_sma': True, 'bull_use_ema': False, 'bull_use_atr': True, 'bull_use_adx': True, 'bull_use_spike': True, 'bull_rsi_required': True, 'bear_strategy': 'mean_reversion', 'bear_bb_std_mult': 0.6197528018630936, 'bear_rsi_os': 8, 'bear_rsi_ob': 69, 'bear_adx_thresh': 10.755064251676899, 'bear_atr_min_pct': 0.019715286708754665, 'bear_atr_max_pct': 0.07095947457814844, 'bear_tp_mult': 2.9156053497468304, 'bear_tsl_mult': 0.5873940609596474, 'bear_time_stop': 294, 'bear_use_sma': False, 'bear_use_ema': True, 'bear_use_atr': False, 'bear_use_adx': True, 'bear_use_spike': False, 'bear_rsi_required': True, 'sideways_strategy': 'mean_reversion', 'sideways_bb_std_mult': 3.5538905286496565, 'sideways_rsi_os': 30, 'sideways_rsi_ob': 90, 'sideways_adx_thresh': 7.513543561250026, 'sideways_atr_min_pct': 0.005741724590696535, 'sideways_atr_max_pct': 0.01603173168407153, 'sideways_tp_mult': 1.8065098457309083, 'sideways_tsl_mult': 0.10839292678798035, 'sideways_time_stop': 118, 'sideways_use_sma': False, 'sideways_use_ema': False, 'sideways_use_atr': False, 'sideways_use_adx': False, 'sideways_use_spike': False, 'sideways_rsi_required': True}.
[I 2025-09-01 15:15:02,568] Trial 518 finished with values: [-1000000000.0, 1000000000.0] and parameters: {'p_sma': 10, 'p_std': 37, 'p_atr': 21, 'p_adx': 18, 'rsi_period': 66, 'ema1': 30, 'ema2': 52, 'slip_atr_k': 0.07521144850417073, 'slip_spread_k': 0.19611060787127954, 'spread_hl_frac': 0.013261919172598538, 'bb_std_mult': 1.6018042610800052, 'rsi_os': 36, 'rsi_ob': 76, 'vol_spike': 0.2945299476676238, 'adx_thresh': 19.2863895630717, 'atr_min_pct': 0.02596502382458772, 'atr_max_pct': 0.06354740219539255, 'tp_mult': 1.1933885837560188, 'tsl_mult': 0.08288226108209826, 'strategy': 'mean_reversion', 'time_stop': 71, 'use_sma': False, 'use_atr': True, 'use_adx': True, 'use_ema': True, 'use_spike': False, 'rsi_required': False, 'edge_k': 0.6916595550517368, 'edge_cap': 0.40198736093763576, 'bull_strategy': 'mean_reversion', 'bull_bb_std_mult': 2.905587274138626, 'bull_rsi_os': 21, 'bull_rsi_ob': 85, 'bull_adx_thresh': 11.185584580962797, 'bull_atr_min_pct': 0.004622165194796462, 'bull_atr_max_pct': 0.026028349266429558, 'bull_tp_mult': 2.8227084789991386, 'bull_tsl_mult': 0.37370932550462865, 'bull_time_stop': 150, 'bull_use_sma': True, 'bull_use_ema': False, 'bull_use_atr': True, 'bull_use_adx': False, 'bull_use_spike': True, 'bull_rsi_required': False, 'bear_strategy': 'mean_reversion', 'bear_bb_std_mult': 2.813625223786251, 'bear_rsi_os': 8, 'bear_rsi_ob': 79, 'bear_adx_thresh': 28.676510548260634, 'bear_atr_min_pct': 0.023237716684449815, 'bear_atr_max_pct': 0.10565308810496332, 'bear_tp_mult': 2.429578025857416, 'bear_tsl_mult': 0.7116884208955644, 'bear_time_stop': 56, 'bear_use_sma': False, 'bear_use_ema': True, 'bear_use_atr': False, 'bear_use_adx': False, 'bear_use_spike': False, 'bear_rsi_required': True, 'sideways_strategy': 'mean_reversion', 'sideways_bb_std_mult': 2.3583651939153163, 'sideways_rsi_os': 18, 'sideways_rsi_ob': 82, 'sideways_adx_thresh': 7.4870883546474225, 'sideways_atr_min_pct': 0.005619842821954216, 'sideways_atr_max_pct': 0.13638178035179832, 'sideways_tp_mult': 1.8075637031962535, 'sideways_tsl_mult': 0.1178084983872934, 'sideways_time_stop': 5, 'sideways_use_sma': False, 'sideways_use_ema': False, 'sideways_use_atr': False, 'sideways_use_adx': False, 'sideways_use_spike': True, 'sideways_rsi_required': True}.
[I 2025-09-01 15:15:02,991] Trial 521 finished with values: [-1000000000.0, 1000000000.0] and parameters: {'p_sma': 24, 'p_std': 56, 'p_atr': 20, 'p_adx': 24, 'rsi_period': 36, 'ema1': 30, 'ema2': 50, 'slip_atr_k': 0.05487506849088868, 'slip_spread_k': 0.21144056287502216, 'spread_hl_frac': 0.013243560700422001, 'bb_std_mult': 1.5061512401239674, 'rsi_os': 35, 'rsi_ob': 76, 'vol_spike': 0.171124935708449, 'adx_thresh': 19.005710943891327, 'atr_min_pct': 0.012950389599445826, 'atr_max_pct': 0.08240699892630443, 'tp_mult': 2.999860506123852, 'tsl_mult': 0.9177101504815227, 'strategy': 'breakout', 'time_stop': 23, 'use_sma': False, 'use_atr': True, 'use_adx': True, 'use_ema': False, 'use_spike': True, 'rsi_required': False, 'edge_k': 0.46357437147971825, 'edge_cap': 0.9400636481422191, 'bull_strategy': 'breakout', 'bull_bb_std_mult': 0.9506103120355587, 'bull_rsi_os': 25, 'bull_rsi_ob': 47, 'bull_adx_thresh': 10.229452110442198, 'bull_atr_min_pct': 0.0038881324263013977, 'bull_atr_max_pct': 0.0714918320024363, 'bull_tp_mult': 1.6193454613441514, 'bull_tsl_mult': 0.37846727162585175, 'bull_time_stop': 252, 'bull_use_sma': False, 'bull_use_ema': True, 'bull_use_atr': True, 'bull_use_adx': True, 'bull_use_spike': False, 'bull_rsi_required': True, 'bear_strategy': 'breakout', 'bear_bb_std_mult': 2.8800268485099205, 'bear_rsi_os': 51, 'bear_rsi_ob': 70, 'bear_adx_thresh': 27.26469307057333, 'bear_atr_min_pct': 0.014389219053527596, 'bear_atr_max_pct': 0.12272486712553257, 'bear_tp_mult': 2.938054510921857, 'bear_tsl_mult': 0.5609248326873514, 'bear_time_stop': 112, 'bear_use_sma': False, 'bear_use_ema': False, 'bear_use_atr': False, 'bear_use_adx': True, 'bear_use_spike': True, 'bear_rsi_required': True, 'sideways_strategy': 'mean_reversion', 'sideways_bb_std_mult': 3.3984119980677487, 'sideways_rsi_os': 54, 'sideways_rsi_ob': 90, 'sideways_adx_thresh': 8.07959127787764, 'sideways_atr_min_pct': 0.004407570786464734, 'sideways_atr_max_pct': 0.1362951298472654, 'sideways_tp_mult': 1.7532433619448209, 'sideways_tsl_mult': 0.9341531916612682, 'sideways_time_stop': 219, 'sideways_use_sma': True, 'sideways_use_ema': True, 'sideways_use_atr': True, 'sideways_use_adx': False, 'sideways_use_spike': False, 'sideways_rsi_required': True}.
[I 2025-09-01 15:15:03,249] Trial 520 finished with values: [-1000000000.0, 1000000000.0] and parameters: {'p_sma': 10, 'p_std': 10, 'p_atr': 20, 'p_adx': 9, 'rsi_period': 67, 'ema1': 23, 'ema2': 45, 'slip_atr_k': 0.07390610957979502, 'slip_spread_k': 0.21424360916544213, 'spread_hl_frac': 0.02831285325189832, 'bb_std_mult': 2.4264389770157635, 'rsi_os': 35, 'rsi_ob': 76, 'vol_spike': 0.08976772725530874, 'adx_thresh': 19.1085649967039, 'atr_min_pct': 0.025825574806860187, 'atr_max_pct': 0.06869884216888439, 'tp_mult': 2.852290204323887, 'tsl_mult': 0.08391451773136774, 'strategy': 'breakout', 'time_stop': 105, 'use_sma': False, 'use_atr': True, 'use_adx': True, 'use_ema': False, 'use_spike': True, 'rsi_required': False, 'edge_k': 1.6536465371765292, 'edge_cap': 0.3951011456146355, 'bull_strategy': 'breakout', 'bull_bb_std_mult': 2.80215611847433, 'bull_rsi_os': 33, 'bull_rsi_ob': 89, 'bull_adx_thresh': 10.413109682377893, 'bull_atr_min_pct': 0.003858920677980119, 'bull_atr_max_pct': 0.12184315022319384, 'bull_tp_mult': 1.9895537140369108, 'bull_tsl_mult': 0.3757353927623914, 'bull_time_stop': 119, 'bull_use_sma': False, 'bull_use_ema': False, 'bull_use_atr': True, 'bull_use_adx': True, 'bull_use_spike': False, 'bull_rsi_required': True, 'bear_strategy': 'mean_reversion', 'bear_bb_std_mult': 2.6450322771918175, 'bear_rsi_os': 8, 'bear_rsi_ob': 46, 'bear_adx_thresh': 23.11998819699234, 'bear_atr_min_pct': 0.02301487829671321, 'bear_atr_max_pct': 0.11140010226079278, 'bear_tp_mult': 2.4435178122241727, 'bear_tsl_mult': 0.10396042993036309, 'bear_time_stop': 196, 'bear_use_sma': False, 'bear_use_ema': False, 'bear_use_atr': False, 'bear_use_adx': True, 'bear_use_spike': True, 'bear_rsi_required': False, 'sideways_strategy': 'mean_reversion', 'sideways_bb_std_mult': 3.416983356417733, 'sideways_rsi_os': 15, 'sideways_rsi_ob': 94, 'sideways_adx_thresh': 7.9714503658345475, 'sideways_atr_min_pct': 0.02290281815624532, 'sideways_atr_max_pct': 0.13610863091916384, 'sideways_tp_mult': 1.684103235591307, 'sideways_tsl_mult': 0.3427293188184253, 'sideways_time_stop': 116, 'sideways_use_sma': False, 'sideways_use_ema': True, 'sideways_use_atr': True, 'sideways_use_adx': False, 'sideways_use_spike': False, 'sideways_rsi_required': True}.
