[I 2025-09-01 14:47:43,651] Trial 358 finished with values: [-1000000000.0, 1000000000.0] and parameters: {'p_sma': 30, 'p_std': 6, 'p_atr': 30, 'p_adx': 9, 'rsi_period': 18, 'ema1': 28, 'ema2': 33, 'slip_atr_k': 0.05094364143780409, 'slip_spread_k': 0.17482483918542935, 'spread_hl_frac': 0.04557007960969395, 'bb_std_mult': 1.5347954588275095, 'rsi_os': 30, 'rsi_ob': 76, 'vol_spike': 0.18498503616255002, 'adx_thresh': 20.013462418446935, 'atr_min_pct': 0.015860600843966597, 'atr_max_pct': 0.10788016758416952, 'tp_mult': 2.4967477303230203, 'tsl_mult': 0.04217232640339995, 'strategy': 'breakout', 'time_stop': 50, 'use_sma': False, 'use_atr': False, 'use_adx': False, 'use_ema': True, 'use_spike': True, 'rsi_required': True, 'edge_k': 0.49998941688419246, 'edge_cap': 0.41165657871592576, 'bull_strategy': 'mean_reversion', 'bull_bb_std_mult': 2.9628405013512653, 'bull_rsi_os': 43, 'bull_rsi_ob': 50, 'bull_adx_thresh': 26.407416565596954, 'bull_atr_min_pct': 0.0117875149847483, 'bull_atr_max_pct': 0.019877609274038185, 'bull_tp_mult': 2.087666491798778, 'bull_tsl_mult': 0.43190096258080385, 'bull_time_stop': 189, 'bull_use_sma': False, 'bull_use_ema': True, 'bull_use_atr': False, 'bull_use_adx': True, 'bull_use_spike': True, 'bull_rsi_required': False, 'bear_strategy': 'mean_reversion', 'bear_bb_std_mult': 2.812992559911974, 'bear_rsi_os': 10, 'bear_rsi_ob': 81, 'bear_adx_thresh': 15.0398734220521, 'bear_atr_min_pct': 0.02304770564682712, 'bear_atr_max_pct': 0.09255212808060649, 'bear_tp_mult': 2.4079037220027, 'bear_tsl_mult': 0.6272339460860876, 'bear_time_stop': 281, 'bear_use_sma': False, 'bear_use_ema': True, 'bear_use_atr': False, 'bear_use_adx': True, 'bear_use_spike': True, 'bear_rsi_required': False, 'sideways_strategy': 'breakout', 'sideways_bb_std_mult': 3.391680754347714, 'sideways_rsi_os': 14, 'sideways_rsi_ob': 80, 'sideways_adx_thresh': 28.51474852251109, 'sideways_atr_min_pct': 0.005453962948027287, 'sideways_atr_max_pct': 0.115148859562202, 'sideways_tp_mult': 1.6265439731560325, 'sideways_tsl_mult': 0.23405241682690814, 'sideways_time_stop': 286, 'sideways_use_sma': True, 'sideways_use_ema': True, 'sideways_use_atr': True, 'sideways_use_adx': False, 'sideways_use_spike': True, 'sideways_rsi_required': True}.
[I 2025-09-01 14:48:22,213] Trial 364 finished with values: [-1000000000.0, 1000000000.0] and parameters: {'p_sma': 60, 'p_std': 55, 'p_atr': 28, 'p_adx': 28, 'rsi_period': 9, 'ema1': 30, 'ema2': 52, 'slip_atr_k': 0.2047976807127656, 'slip_spread_k': 0.27550863836051825, 'spread_hl_frac': 0.005001318909045142, 'bb_std_mult': 1.3365471965665734, 'rsi_os': 42, 'rsi_ob': 67, 'vol_spike': 0.2894953758200859, 'adx_thresh': 19.152184258824143, 'atr_min_pct': 0.016952798156804765, 'atr_max_pct': 0.06298459562867977, 'tp_mult': 2.1514573389294567, 'tsl_mult': 0.08067076717318442, 'strategy': 'mean_reversion', 'time_stop': 55, 'use_sma': True, 'use_atr': True, 'use_adx': True, 'use_ema': False, 'use_spike': False, 'rsi_required': False, 'edge_k': 0.5773136238346113, 'edge_cap': 0.08903331322542293, 'bull_strategy': 'breakout', 'bull_bb_std_mult': 2.6870950566127068, 'bull_rsi_os': 26, 'bull_rsi_ob': 48, 'bull_adx_thresh': 17.332868439346793, 'bull_atr_min_pct': 0.016463196704647975, 'bull_atr_max_pct': 0.02578306363997538, 'bull_tp_mult': 1.2560159100696477, 'bull_tsl_mult': 0.33715903555896276, 'bull_time_stop': 289, 'bull_use_sma': True, 'bull_use_ema': False, 'bull_use_atr': False, 'bull_use_adx': False, 'bull_use_spike': False, 'bull_rsi_required': True, 'bear_strategy': 'breakout', 'bear_bb_std_mult': 2.378731372967487, 'bear_rsi_os': 20, 'bear_rsi_ob': 74, 'bear_adx_thresh': 28.448233842373924, 'bear_atr_min_pct': 0.02111900085794845, 'bear_atr_max_pct': 0.12403717419348614, 'bear_tp_mult': 2.447130549774965, 'bear_tsl_mult': 0.5391104204139212, 'bear_time_stop': 300, 'bear_use_sma': True, 'bear_use_ema': False, 'bear_use_atr': False, 'bear_use_adx': True, 'bear_use_spike': False, 'bear_rsi_required': True, 'sideways_strategy': 'mean_reversion', 'sideways_bb_std_mult': 3.3057303394401942, 'sideways_rsi_os': 40, 'sideways_rsi_ob': 92, 'sideways_adx_thresh': 9.20062266929695, 'sideways_atr_min_pct': 0.004586454050770671, 'sideways_atr_max_pct': 0.03170927550367655, 'sideways_tp_mult': 2.7137851506523925, 'sideways_tsl_mult': 0.278602206485902, 'sideways_time_stop': 88, 'sideways_use_sma': False, 'sideways_use_ema': False, 'sideways_use_atr': False, 'sideways_use_adx': True, 'sideways_use_spike': False, 'sideways_rsi_required': False}.
[I 2025-09-01 14:48:23,289] Trial 363 finished with values: [-0.06302243156102938, 0.06286575390574921] and parameters: {'p_sma': 12, 'p_std': 9, 'p_atr': 28, 'p_adx': 25, 'rsi_period': 50, 'ema1': 30, 'ema2': 52, 'slip_atr_k': 0.20498951571768248, 'slip_spread_k': 0.283769378153705, 'spread_hl_frac': 0.010821637606154002, 'bb_std_mult': 1.6275930859287462, 'rsi_os': 42, 'rsi_ob': 72, 'vol_spike': 0.2425543477276072, 'adx_thresh': 19.289538696358346, 'atr_min_pct': 0.017060706048982226, 'atr_max_pct': 0.03933896497014983, 'tp_mult': 2.9114888641782097, 'tsl_mult': 0.07487703543712722, 'strategy': 'mean_reversion', 'time_stop': 76, 'use_sma': True, 'use_atr': True, 'use_adx': True, 'use_ema': False, 'use_spike': False, 'rsi_required': False, 'edge_k': 0.568516250975925, 'edge_cap': 0.9677132340111221, 'bull_strategy': 'breakout', 'bull_bb_std_mult': 1.5922307267751927, 'bull_rsi_os': 36, 'bull_rsi_ob': 70, 'bull_adx_thresh': 11.332759836671787, 'bull_atr_min_pct': 0.0015279528945467222, 'bull_atr_max_pct': 0.02372812128486068, 'bull_tp_mult': 2.0504517105172457, 'bull_tsl_mult': 0.38918680467038425, 'bull_time_stop': 165, 'bull_use_sma': True, 'bull_use_ema': False, 'bull_use_atr': False, 'bull_use_adx': False, 'bull_use_spike': False, 'bull_rsi_required': True, 'bear_strategy': 'breakout', 'bear_bb_std_mult': 2.8976939818416447, 'bear_rsi_os': 6, 'bear_rsi_ob': 74, 'bear_adx_thresh': 28.570605765439012, 'bear_atr_min_pct': 0.021244768553200597, 'bear_atr_max_pct': 0.026241836860502958, 'bear_tp_mult': 1.766524950205362, 'bear_tsl_mult': 0.47357922935681696, 'bear_time_stop': 185, 'bear_use_sma': True, 'bear_use_ema': False, 'bear_use_atr': False, 'bear_use_adx': True, 'bear_use_spike': False, 'bear_rsi_required': True, 'sideways_strategy': 'mean_reversion', 'sideways_bb_std_mult': 1.1811543254694785, 'sideways_rsi_os': 17, 'sideways_rsi_ob': 88, 'sideways_adx_thresh': 6.170178487619946, 'sideways_atr_min_pct': 0.004590914635981636, 'sideways_atr_max_pct': 0.14028045106067386, 'sideways_tp_mult': 1.6997805769836882, 'sideways_tsl_mult': 0.029900846793809666, 'sideways_time_stop': 114, 'sideways_use_sma': False, 'sideways_use_ema': False, 'sideways_use_atr': False, 'sideways_use_adx': True, 'sideways_use_spike': False, 'sideways_rsi_required': False}.
[I 2025-09-01 14:48:23,892] Trial 362 finished with values: [-1000000000.0, 1000000000.0] and parameters: {'p_sma': 14, 'p_std': 45, 'p_atr': 21, 'p_adx': 9, 'rsi_period': 69, 'ema1': 21, 'ema2': 53, 'slip_atr_k': 0.06733219968804197, 'slip_spread_k': 0.2111121573154672, 'spread_hl_frac': 0.011107937022805128, 'bb_std_mult': 0.5193667097728913, 'rsi_os': 12, 'rsi_ob': 73, 'vol_spike': 0.16403190588239153, 'adx_thresh': 31.06975313175608, 'atr_min_pct': 0.015833765488755955, 'atr_max_pct': 0.0701210026258782, 'tp_mult': 2.127297908727033, 'tsl_mult': 0.7983479195584358, 'strategy': 'breakout', 'time_stop': 52, 'use_sma': False, 'use_atr': True, 'use_adx': True, 'use_ema': False, 'use_spike': False, 'rsi_required': False, 'edge_k': 0.559846253915571, 'edge_cap': 0.5587824073910678, 'bull_strategy': 'breakout', 'bull_bb_std_mult': 3.598712562047827, 'bull_rsi_os': 53, 'bull_rsi_ob': 48, 'bull_adx_thresh': 11.285649512436216, 'bull_atr_min_pct': 0.018610040392296558, 'bull_atr_max_pct': 0.026064072907486, 'bull_tp_mult': 2.13350219024644, 'bull_tsl_mult': 0.8137868759485126, 'bull_time_stop': 164, 'bull_use_sma': True, 'bull_use_ema': False, 'bull_use_atr': False, 'bull_use_adx': False, 'bull_use_spike': False, 'bull_rsi_required': True, 'bear_strategy': 'mean_reversion', 'bear_bb_std_mult': 2.8735772616339537, 'bear_rsi_os': 33, 'bear_rsi_ob': 51, 'bear_adx_thresh': 28.48514434665944, 'bear_atr_min_pct': 0.014218002390537462, 'bear_atr_max_pct': 0.09305925518010252, 'bear_tp_mult': 2.4123306439979424, 'bear_tsl_mult': 0.11310487570335487, 'bear_time_stop': 53, 'bear_use_sma': True, 'bear_use_ema': False, 'bear_use_atr': False, 'bear_use_adx': True, 'bear_use_spike': False, 'bear_rsi_required': False, 'sideways_strategy': 'mean_reversion', 'sideways_bb_std_mult': 3.372841071510169, 'sideways_rsi_os': 18, 'sideways_rsi_ob': 74, 'sideways_adx_thresh': 9.1262930755988, 'sideways_atr_min_pct': 0.019398001973425297, 'sideways_atr_max_pct': 0.11988138317322809, 'sideways_tp_mult': 1.68319633814633, 'sideways_tsl_mult': 0.28194055239651084, 'sideways_time_stop': 90, 'sideways_use_sma': False, 'sideways_use_ema': False, 'sideways_use_atr': False, 'sideways_use_adx': False, 'sideways_use_spike': True, 'sideways_rsi_required': True}.
[I 2025-09-01 14:48:24,205] Trial 361 finished with values: [-1000000000.0, 1000000000.0] and parameters: {'p_sma': 14, 'p_std': 20, 'p_atr': 21, 'p_adx': 26, 'rsi_period': 65, 'ema1': 30, 'ema2': 52, 'slip_atr_k': 0.06757758883850955, 'slip_spread_k': 0.2815858967878062, 'spread_hl_frac': 0.036099940213257305, 'bb_std_mult': 1.526767473071007, 'rsi_os': 37, 'rsi_ob': 72, 'vol_spike': 0.11970929591730115, 'adx_thresh': 18.741473873352554, 'atr_min_pct': 0.01589754359022805, 'atr_max_pct': 0.06950160951545564, 'tp_mult': 2.9099488979023223, 'tsl_mult': 0.046778771420326326, 'strategy': 'breakout', 'time_stop': 60, 'use_sma': False, 'use_atr': True, 'use_adx': True, 'use_ema': False, 'use_spike': False, 'rsi_required': False, 'edge_k': 0.5678479645559611, 'edge_cap': 0.18115912290723707, 'bull_strategy': 'breakout', 'bull_bb_std_mult': 2.6733523171629354, 'bull_rsi_os': 23, 'bull_rsi_ob': 47, 'bull_adx_thresh': 10.932672305295844, 'bull_atr_min_pct': 0.01878624490191255, 'bull_atr_max_pct': 0.05167967457814035, 'bull_tp_mult': 1.7770138874981052, 'bull_tsl_mult': 0.13595597124477127, 'bull_time_stop': 190, 'bull_use_sma': True, 'bull_use_ema': False, 'bull_use_atr': False, 'bull_use_adx': False, 'bull_use_spike': True, 'bull_rsi_required': True, 'bear_strategy': 'mean_reversion', 'bear_bb_std_mult': 2.9595629075016636, 'bear_rsi_os': 6, 'bear_rsi_ob': 51, 'bear_adx_thresh': 15.0356721806126, 'bear_atr_min_pct': 0.02132620847181521, 'bear_atr_max_pct': 0.09238603911936139, 'bear_tp_mult': 2.4329821746507028, 'bear_tsl_mult': 0.46627848449898984, 'bear_time_stop': 166, 'bear_use_sma': True, 'bear_use_ema': False, 'bear_use_atr': False, 'bear_use_adx': True, 'bear_use_spike': False, 'bear_rsi_required': False, 'sideways_strategy': 'mean_reversion', 'sideways_bb_std_mult': 3.3866456290604554, 'sideways_rsi_os': 18, 'sideways_rsi_ob': 80, 'sideways_adx_thresh': 6.233157227216394, 'sideways_atr_min_pct': 0.02664964239877253, 'sideways_atr_max_pct': 0.02221370299121332, 'sideways_tp_mult': 2.3423902396177922, 'sideways_tsl_mult': 0.28185030768905706, 'sideways_time_stop': 113, 'sideways_use_sma': False, 'sideways_use_ema': False, 'sideways_use_atr': False, 'sideways_use_adx': False, 'sideways_use_spike': True, 'sideways_rsi_required': True}.
[I 2025-09-01 14:49:02,530] Trial 368 finished with values: [-1000000000.0, 1000000000.0] and parameters: {'p_sma': 12, 'p_std': 57, 'p_atr': 19, 'p_adx': 25, 'rsi_period': 84, 'ema1': 22, 'ema2': 54, 'slip_atr_k': 0.05624768021464057, 'slip_spread_k': 0.23571244283272522, 'spread_hl_frac': 0.012850500763572267, 'bb_std_mult': 1.6810659253713074, 'rsi_os': 20, 'rsi_ob': 86, 'vol_spike': 0.2906215057384641, 'adx_thresh': 5.697551394150974, 'atr_min_pct': 0.025934152121827668, 'atr_max_pct': 0.07416000131605613, 'tp_mult': 2.8489421235508074, 'tsl_mult': 0.4968590483259494, 'strategy': 'breakout', 'time_stop': 69, 'use_sma': False, 'use_atr': True, 'use_adx': True, 'use_ema': False, 'use_spike': True, 'rsi_required': False, 'edge_k': 1.923195684129634, 'edge_cap': 0.48621541025701526, 'bull_strategy': 'breakout', 'bull_bb_std_mult': 2.9062518498865093, 'bull_rsi_os': 47, 'bull_rsi_ob': 74, 'bull_adx_thresh': 7.5843279992910695, 'bull_atr_min_pct': 0.015713973866455247, 'bull_atr_max_pct': 0.01596096800372577, 'bull_tp_mult': 2.1716090523119775, 'bull_tsl_mult': 0.3549415290134764, 'bull_time_stop': 239, 'bull_use_sma': True, 'bull_use_ema': False, 'bull_use_atr': False, 'bull_use_adx': True, 'bull_use_spike': False, 'bull_rsi_required': True, 'bear_strategy': 'mean_reversion', 'bear_bb_std_mult': 2.74660142118666, 'bear_rsi_os': 11, 'bear_rsi_ob': 68, 'bear_adx_thresh': 27.40230029954775, 'bear_atr_min_pct': 0.024489921590498967, 'bear_atr_max_pct': 0.04206632462952347, 'bear_tp_mult': 2.5096202100140683, 'bear_tsl_mult': 0.5104550534954944, 'bear_time_stop': 273, 'bear_use_sma': False, 'bear_use_ema': False, 'bear_use_atr': False, 'bear_use_adx': True, 'bear_use_spike': False, 'bear_rsi_required': False, 'sideways_strategy': 'mean_reversion', 'sideways_bb_std_mult': 0.6731030948366297, 'sideways_rsi_os': 38, 'sideways_rsi_ob': 90, 'sideways_adx_thresh': 7.932277207136401, 'sideways_atr_min_pct': 0.02783488461506063, 'sideways_atr_max_pct': 0.13542087184589563, 'sideways_tp_mult': 2.0117679121163943, 'sideways_tsl_mult': 0.34739981274756465, 'sideways_time_stop': 217, 'sideways_use_sma': False, 'sideways_use_ema': False, 'sideways_use_atr': True, 'sideways_use_adx': False, 'sideways_use_spike': True, 'sideways_rsi_required': True}.
[I 2025-09-01 14:49:02,984] Trial 367 finished with values: [-1000000000.0, 1000000000.0] and parameters: {'p_sma': 12, 'p_std': 13, 'p_atr': 19, 'p_adx': 25, 'rsi_period': 66, 'ema1': 24, 'ema2': 54, 'slip_atr_k': 0.0579769467034514, 'slip_spread_k': 0.7558327528268367, 'spread_hl_frac': 0.012862635075681937, 'bb_std_mult': 2.819215416706163, 'rsi_os': 34, 'rsi_ob': 61, 'vol_spike': 0.2509410874854446, 'adx_thresh': 5.5395084550861196, 'atr_min_pct': 0.026110223121604808, 'atr_max_pct': 0.07429189527013895, 'tp_mult': 1.365397141633856, 'tsl_mult': 0.8765527451327362, 'strategy': 'breakout', 'time_stop': 68, 'use_sma': False, 'use_atr': True, 'use_adx': True, 'use_ema': False, 'use_spike': True, 'rsi_required': False, 'edge_k': 1.179432224598214, 'edge_cap': 0.05090272626970459, 'bull_strategy': 'breakout', 'bull_bb_std_mult': 3.0389195159911035, 'bull_rsi_os': 21, 'bull_rsi_ob': 47, 'bull_adx_thresh': 16.34569334377143, 'bull_atr_min_pct': 0.02247053658210302, 'bull_atr_max_pct': 0.01567979220484779, 'bull_tp_mult': 2.194827799770087, 'bull_tsl_mult': 0.7387156750867968, 'bull_time_stop': 143, 'bull_use_sma': True, 'bull_use_ema': False, 'bull_use_atr': False, 'bull_use_adx': True, 'bull_use_spike': False, 'bull_rsi_required': True, 'bear_strategy': 'mean_reversion', 'bear_bb_std_mult': 1.8611170840180573, 'bear_rsi_os': 8, 'bear_rsi_ob': 47, 'bear_adx_thresh': 27.24743765710212, 'bear_atr_min_pct': 0.022411565714840716, 'bear_atr_max_pct': 0.042064683127634055, 'bear_tp_mult': 2.5041946044400882, 'bear_tsl_mult': 0.4394996100558307, 'bear_time_stop': 269, 'bear_use_sma': False, 'bear_use_ema': False, 'bear_use_atr': False, 'bear_use_adx': True, 'bear_use_spike': False, 'bear_rsi_required': False, 'sideways_strategy': 'mean_reversion', 'sideways_bb_std_mult': 3.201308733289192, 'sideways_rsi_os': 17, 'sideways_rsi_ob': 61, 'sideways_adx_thresh': 8.10233106718403, 'sideways_atr_min_pct': 0.013442793357766984, 'sideways_atr_max_pct': 0.1348688466809476, 'sideways_tp_mult': 1.4998267977163695, 'sideways_tsl_mult': 0.30407442183710315, 'sideways_time_stop': 235, 'sideways_use_sma': False, 'sideways_use_ema': False, 'sideways_use_atr': True, 'sideways_use_adx': False, 'sideways_use_spike': True, 'sideways_rsi_required': True}.
[I 2025-09-01 14:49:02,994] Trial 366 finished with values: [-1000000000.0, 1000000000.0] and parameters: {'p_sma': 14, 'p_std': 41, 'p_atr': 21, 'p_adx': 26, 'rsi_period': 69, 'ema1': 21, 'ema2': 12, 'slip_atr_k': 0.057614118191689594, 'slip_spread_k': 0.2024416311602173, 'spread_hl_frac': 0.013032888962750136, 'bb_std_mult': 3.057067222112894, 'rsi_os': 11, 'rsi_ob': 61, 'vol_spike': 0.09346564010356469, 'adx_thresh': 16.826361131149252, 'atr_min_pct': 0.012658332826499075, 'atr_max_pct': 0.07481281422922532, 'tp_mult': 1.4299985177954202, 'tsl_mult': 0.9357516990512114, 'strategy': 'breakout', 'time_stop': 67, 'use_sma': False, 'use_atr': True, 'use_adx': True, 'use_ema': False, 'use_spike': True, 'rsi_required': False, 'edge_k': 1.9132559703284646, 'edge_cap': 0.05114454006797819, 'bull_strategy': 'breakout', 'bull_bb_std_mult': 2.872886245875915, 'bull_rsi_os': 46, 'bull_rsi_ob': 73, 'bull_adx_thresh': 10.910274329539918, 'bull_atr_min_pct': 0.015571876348571937, 'bull_atr_max_pct': 0.015841307722022812, 'bull_tp_mult': 2.9080637435299117, 'bull_tsl_mult': 0.9365134464590771, 'bull_time_stop': 143, 'bull_use_sma': True, 'bull_use_ema': False, 'bull_use_atr': False, 'bull_use_adx': True, 'bull_use_spike': False, 'bull_rsi_required': True, 'bear_strategy': 'mean_reversion', 'bear_bb_std_mult': 2.7412421810288805, 'bear_rsi_os': 8, 'bear_rsi_ob': 51, 'bear_adx_thresh': 27.4176271810267, 'bear_atr_min_pct': 0.02365829538973054, 'bear_atr_max_pct': 0.1134742830459118, 'bear_tp_mult': 2.5099404498415123, 'bear_tsl_mult': 0.6041760774573359, 'bear_time_stop': 275, 'bear_use_sma': False, 'bear_use_ema': False, 'bear_use_atr': False, 'bear_use_adx': True, 'bear_use_spike': False, 'bear_rsi_required': False, 'sideways_strategy': 'mean_reversion', 'sideways_bb_std_mult': 0.6602328539559872, 'sideways_rsi_os': 18, 'sideways_rsi_ob': 90, 'sideways_adx_thresh': 34.97147714670374, 'sideways_atr_min_pct': 0.007764850953010891, 'sideways_atr_max_pct': 0.10315639420475284, 'sideways_tp_mult': 1.1420965969261316, 'sideways_tsl_mult': 0.35400946876362704, 'sideways_time_stop': 20, 'sideways_use_sma': False, 'sideways_use_ema': False, 'sideways_use_atr': True, 'sideways_use_adx': False, 'sideways_use_spike': True, 'sideways_rsi_required': True}.
[I 2025-09-01 14:49:03,236] Trial 365 finished with values: [-0.014639501365444674, 0.014504442978816033] and parameters: {'p_sma': 12, 'p_std': 37, 'p_atr': 21, 'p_adx': 25, 'rsi_period': 69, 'ema1': 30, 'ema2': 54, 'slip_atr_k': 0.06569975267184396, 'slip_spread_k': 0.9245533606871188, 'spread_hl_frac': 0.011060331700185073, 'bb_std_mult': 1.6305396740989644, 'rsi_os': 34, 'rsi_ob': 72, 'vol_spike': 0.16250906851756047, 'adx_thresh': 16.681174456849895, 'atr_min_pct': 0.012712003916747788, 'atr_max_pct': 0.0695507500249605, 'tp_mult': 2.9092549024856766, 'tsl_mult': 0.031172072351050906, 'strategy': 'breakout', 'time_stop': 102, 'use_sma': False, 'use_atr': True, 'use_adx': True, 'use_ema': False, 'use_spike': False, 'rsi_required': False, 'edge_k': 0.556081943748284, 'edge_cap': 0.9816911053775551, 'bull_strategy': 'breakout', 'bull_bb_std_mult': 2.884392983478876, 'bull_rsi_os': 37, 'bull_rsi_ob': 70, 'bull_adx_thresh': 13.811333816306231, 'bull_atr_min_pct': 0.001419942349265197, 'bull_atr_max_pct': 0.01601959533666805, 'bull_tp_mult': 1.7663958018865897, 'bull_tsl_mult': 0.3926954399035447, 'bull_time_stop': 212, 'bull_use_sma': True, 'bull_use_ema': False, 'bull_use_atr': False, 'bull_use_adx': False, 'bull_use_spike': False, 'bull_rsi_required': True, 'bear_strategy': 'mean_reversion', 'bear_bb_std_mult': 2.903256312680295, 'bear_rsi_os': 6, 'bear_rsi_ob': 48, 'bear_adx_thresh': 27.35988363985556, 'bear_atr_min_pct': 0.024779408743350096, 'bear_atr_max_pct': 0.11776424424659908, 'bear_tp_mult': 1.1656903745899707, 'bear_tsl_mult': 0.5025069272491154, 'bear_time_stop': 274, 'bear_use_sma': True, 'bear_use_ema': False, 'bear_use_atr': False, 'bear_use_adx': True, 'bear_use_spike': False, 'bear_rsi_required': False, 'sideways_strategy': 'mean_reversion', 'sideways_bb_std_mult': 3.511524261044007, 'sideways_rsi_os': 17, 'sideways_rsi_ob': 88, 'sideways_adx_thresh': 14.8912285623347, 'sideways_atr_min_pct': 0.029826173271565237, 'sideways_atr_max_pct': 0.14039213066024817, 'sideways_tp_mult': 1.8387976092100926, 'sideways_tsl_mult': 0.344566943872869, 'sideways_time_stop': 117, 'sideways_use_sma': False, 'sideways_use_ema': False, 'sideways_use_atr': False, 'sideways_use_adx': False, 'sideways_use_spike': True, 'sideways_rsi_required': True}.
