[I 2025-09-01 14:36:11,821] Trial 279 finished with values: [-1000000000.0, 1000000000.0] and parameters: {'p_sma': 17, 'p_std': 10, 'p_atr': 20, 'p_adx': 17, 'rsi_period': 64, 'ema1': 29, 'ema2': 11, 'slip_atr_k': 0.057876326337687016, 'slip_spread_k': 0.1972326407573496, 'spread_hl_frac': 0.04526040653618274, 'bb_std_mult': 1.843634402178782, 'rsi_os': 38, 'rsi_ob': 73, 'vol_spike': 0.29484515655561366, 'adx_thresh': 33.3831999986665, 'atr_min_pct': 0.01622765198319386, 'atr_max_pct': 0.06553512817495782, 'tp_mult': 1.0629365786415181, 'tsl_mult': 0.7206249185245297, 'strategy': 'breakout', 'time_stop': 144, 'use_sma': False, 'use_atr': True, 'use_adx': True, 'use_ema': False, 'use_spike': True, 'rsi_required': False, 'edge_k': 0.653041139964335, 'edge_cap': 0.9995575002655659, 'bull_strategy': 'breakout', 'bull_bb_std_mult': 3.0022341954380063, 'bull_rsi_os': 18, 'bull_rsi_ob': 82, 'bull_adx_thresh': 19.508663214259943, 'bull_atr_min_pct': 0.008357139930248919, 'bull_atr_max_pct': 0.019680927176756142, 'bull_tp_mult': 1.2234500465949592, 'bull_tsl_mult': 0.42455175652483185, 'bull_time_stop': 167, 'bull_use_sma': True, 'bull_use_ema': False, 'bull_use_atr': False, 'bull_use_adx': True, 'bull_use_spike': False, 'bull_rsi_required': True, 'bear_strategy': 'mean_reversion', 'bear_bb_std_mult': 2.8033729366507836, 'bear_rsi_os': 6, 'bear_rsi_ob': 77, 'bear_adx_thresh': 16.079117944929724, 'bear_atr_min_pct': 0.004668029861336029, 'bear_atr_max_pct': 0.10968602481550399, 'bear_tp_mult': 2.571559980591011, 'bear_tsl_mult': 0.8316998180771173, 'bear_time_stop': 23, 'bear_use_sma': False, 'bear_use_ema': False, 'bear_use_atr': False, 'bear_use_adx': True, 'bear_use_spike': False, 'bear_rsi_required': False, 'sideways_strategy': 'mean_reversion', 'sideways_bb_std_mult': 3.4383785813786956, 'sideways_rsi_os': 18, 'sideways_rsi_ob': 62, 'sideways_adx_thresh': 33.118700537718496, 'sideways_atr_min_pct': 0.005139347521229947, 'sideways_atr_max_pct': 0.11891423765034648, 'sideways_tp_mult': 2.434888644621232, 'sideways_tsl_mult': 0.3047826928651082, 'sideways_time_stop': 152, 'sideways_use_sma': False, 'sideways_use_ema': False, 'sideways_use_atr': True, 'sideways_use_adx': False, 'sideways_use_spike': True, 'sideways_rsi_required': True}.
[I 2025-09-01 14:36:12,249] Trial 280 finished with values: [-1000000000.0, 1000000000.0] and parameters: {'p_sma': 13, 'p_std': 11, 'p_atr': 19, 'p_adx': 24, 'rsi_period': 79, 'ema1': 29, 'ema2': 52, 'slip_atr_k': 0.05834378234853365, 'slip_spread_k': 0.6531469992671817, 'spread_hl_frac': 0.011312278198448305, 'bb_std_mult': 3.597394413956975, 'rsi_os': 35, 'rsi_ob': 73, 'vol_spike': 0.2114115460510116, 'adx_thresh': 9.090676182834155, 'atr_min_pct': 0.01613400006113824, 'atr_max_pct': 0.06431072364172996, 'tp_mult': 2.978740633868938, 'tsl_mult': 0.05797909954472301, 'strategy': 'breakout', 'time_stop': 83, 'use_sma': False, 'use_atr': True, 'use_adx': True, 'use_ema': False, 'use_spike': True, 'rsi_required': False, 'edge_k': 0.6586382379817397, 'edge_cap': 0.9651826054138888, 'bull_strategy': 'breakout', 'bull_bb_std_mult': 1.8952649705498312, 'bull_rsi_os': 19, 'bull_rsi_ob': 60, 'bull_adx_thresh': 34.111293900176044, 'bull_atr_min_pct': 0.019431860207398077, 'bull_atr_max_pct': 0.010031310392094228, 'bull_tp_mult': 1.9541610440884398, 'bull_tsl_mult': 0.2940657448063415, 'bull_time_stop': 150, 'bull_use_sma': True, 'bull_use_ema': False, 'bull_use_atr': False, 'bull_use_adx': True, 'bull_use_spike': False, 'bull_rsi_required': False, 'bear_strategy': 'mean_reversion', 'bear_bb_std_mult': 2.721600054488685, 'bear_rsi_os': 7, 'bear_rsi_ob': 67, 'bear_adx_thresh': 16.059201565325246, 'bear_atr_min_pct': 0.004563209349850579, 'bear_atr_max_pct': 0.0310527705275586, 'bear_tp_mult': 2.5720578623814494, 'bear_tsl_mult': 0.5606739054852612, 'bear_time_stop': 21, 'bear_use_sma': False, 'bear_use_ema': False, 'bear_use_atr': False, 'bear_use_adx': True, 'bear_use_spike': False, 'bear_rsi_required': False, 'sideways_strategy': 'mean_reversion', 'sideways_bb_std_mult': 1.8183908968764253, 'sideways_rsi_os': 19, 'sideways_rsi_ob': 58, 'sideways_adx_thresh': 7.326409136549294, 'sideways_atr_min_pct': 0.005217001984809794, 'sideways_atr_max_pct': 0.132966329429827, 'sideways_tp_mult': 2.442772542956903, 'sideways_tsl_mult': 0.2263002286535052, 'sideways_time_stop': 234, 'sideways_use_sma': False, 'sideways_use_ema': True, 'sideways_use_atr': True, 'sideways_use_adx': False, 'sideways_use_spike': True, 'sideways_rsi_required': True}.
[I 2025-09-01 14:36:12,539] Trial 281 finished with values: [-1000000000.0, 1000000000.0] and parameters: {'p_sma': 5, 'p_std': 11, 'p_atr': 19, 'p_adx': 24, 'rsi_period': 46, 'ema1': 29, 'ema2': 52, 'slip_atr_k': 0.057303360608979725, 'slip_spread_k': 0.29467917364292834, 'spread_hl_frac': 0.011225684348837188, 'bb_std_mult': 2.791400414731862, 'rsi_os': 35, 'rsi_ob': 73, 'vol_spike': 0.29403411918601957, 'adx_thresh': 12.300992296621288, 'atr_min_pct': 0.023805149717723212, 'atr_max_pct': 0.03780337960002837, 'tp_mult': 2.3667288437201464, 'tsl_mult': 0.04661038128957763, 'strategy': 'breakout', 'time_stop': 83, 'use_sma': False, 'use_atr': True, 'use_adx': True, 'use_ema': False, 'use_spike': True, 'rsi_required': False, 'edge_k': 0.5774645790589705, 'edge_cap': 0.09071868246566277, 'bull_strategy': 'breakout', 'bull_bb_std_mult': 2.89163375554221, 'bull_rsi_os': 19, 'bull_rsi_ob': 50, 'bull_adx_thresh': 33.97825645562439, 'bull_atr_min_pct': 0.013352191179577332, 'bull_atr_max_pct': 0.014959645849697126, 'bull_tp_mult': 2.1851948786841886, 'bull_tsl_mult': 0.4919306474691114, 'bull_time_stop': 150, 'bull_use_sma': True, 'bull_use_ema': False, 'bull_use_atr': False, 'bull_use_adx': True, 'bull_use_spike': False, 'bull_rsi_required': False, 'bear_strategy': 'mean_reversion', 'bear_bb_std_mult': 2.7160835986597505, 'bear_rsi_os': 39, 'bear_rsi_ob': 77, 'bear_adx_thresh': 27.11385402933083, 'bear_atr_min_pct': 0.02349599238956099, 'bear_atr_max_pct': 0.11162149619561525, 'bear_tp_mult': 2.57536832230425, 'bear_tsl_mult': 0.5705932587400604, 'bear_time_stop': 226, 'bear_use_sma': False, 'bear_use_ema': False, 'bear_use_atr': False, 'bear_use_adx': True, 'bear_use_spike': False, 'bear_rsi_required': False, 'sideways_strategy': 'mean_reversion', 'sideways_bb_std_mult': 3.441626845544151, 'sideways_rsi_os': 17, 'sideways_rsi_ob': 66, 'sideways_adx_thresh': 32.907992081010946, 'sideways_atr_min_pct': 0.004865068596623905, 'sideways_atr_max_pct': 0.13237596985918434, 'sideways_tp_mult': 1.8667329669914416, 'sideways_tsl_mult': 0.9385513726394215, 'sideways_time_stop': 229, 'sideways_use_sma': False, 'sideways_use_ema': True, 'sideways_use_atr': True, 'sideways_use_adx': False, 'sideways_use_spike': True, 'sideways_rsi_required': True}.
[I 2025-09-01 14:36:13,224] Trial 282 finished with values: [-1000000000.0, 1000000000.0] and parameters: {'p_sma': 13, 'p_std': 10, 'p_atr': 15, 'p_adx': 23, 'rsi_period': 61, 'ema1': 29, 'ema2': 52, 'slip_atr_k': 0.07257725230402552, 'slip_spread_k': 0.2919397611380258, 'spread_hl_frac': 0.010670685413395062, 'bb_std_mult': 3.593311946057036, 'rsi_os': 10, 'rsi_ob': 45, 'vol_spike': 0.2948867452665326, 'adx_thresh': 20.13827787709552, 'atr_min_pct': 0.016250588642623773, 'atr_max_pct': 0.044380413781512126, 'tp_mult': 2.9561648956375843, 'tsl_mult': 0.05332695288422162, 'strategy': 'mean_reversion', 'time_stop': 83, 'use_sma': True, 'use_atr': True, 'use_adx': True, 'use_ema': False, 'use_spike': True, 'rsi_required': False, 'edge_k': 0.6539466065167787, 'edge_cap': 0.09058621917083887, 'bull_strategy': 'breakout', 'bull_bb_std_mult': 2.55511574452102, 'bull_rsi_os': 16, 'bull_rsi_ob': 60, 'bull_adx_thresh': 11.178180325620573, 'bull_atr_min_pct': 0.008593335357047729, 'bull_atr_max_pct': 0.08702016244059158, 'bull_tp_mult': 1.2918769922043387, 'bull_tsl_mult': 0.32038119000149995, 'bull_time_stop': 184, 'bull_use_sma': True, 'bull_use_ema': True, 'bull_use_atr': False, 'bull_use_adx': True, 'bull_use_spike': False, 'bull_rsi_required': False, 'bear_strategy': 'breakout', 'bear_bb_std_mult': 2.703521771868401, 'bear_rsi_os': 27, 'bear_rsi_ob': 76, 'bear_adx_thresh': 27.035581703815275, 'bear_atr_min_pct': 0.02361864608011172, 'bear_atr_max_pct': 0.11332718941879073, 'bear_tp_mult': 2.5576326706837094, 'bear_tsl_mult': 0.5726056616519384, 'bear_time_stop': 279, 'bear_use_sma': False, 'bear_use_ema': False, 'bear_use_atr': True, 'bear_use_adx': True, 'bear_use_spike': False, 'bear_rsi_required': True, 'sideways_strategy': 'mean_reversion', 'sideways_bb_std_mult': 1.813715150987705, 'sideways_rsi_os': 18, 'sideways_rsi_ob': 74, 'sideways_adx_thresh': 7.340741748775007, 'sideways_atr_min_pct': 0.024736138743096096, 'sideways_atr_max_pct': 0.13644279209959376, 'sideways_tp_mult': 2.4512024302929394, 'sideways_tsl_mult': 0.8171987228737608, 'sideways_time_stop': 124, 'sideways_use_sma': False, 'sideways_use_ema': True, 'sideways_use_atr': True, 'sideways_use_adx': True, 'sideways_use_spike': False, 'sideways_rsi_required': False}.
[I 2025-09-01 14:36:49,486] Trial 286 finished with values: [-0.007339526584776879, 0.007353712290090911] and parameters: {'p_sma': 11, 'p_std': 58, 'p_atr': 12, 'p_adx': 25, 'rsi_period': 69, 'ema1': 30, 'ema2': 49, 'slip_atr_k': 0.04863192813179492, 'slip_spread_k': 0.23849067191737253, 'spread_hl_frac': 0.01336784969310273, 'bb_std_mult': 3.5001041949926788, 'rsi_os': 32, 'rsi_ob': 77, 'vol_spike': 0.2988663840876496, 'adx_thresh': 18.48116329592557, 'atr_min_pct': 0.01579135299621099, 'atr_max_pct': 0.09468479274366604, 'tp_mult': 2.8620388433527255, 'tsl_mult': 0.6585591149975616, 'strategy': 'mean_reversion', 'time_stop': 131, 'use_sma': True, 'use_atr': True, 'use_adx': False, 'use_ema': True, 'use_spike': True, 'rsi_required': False, 'edge_k': 1.1390654110220346, 'edge_cap': 0.4609368926490586, 'bull_strategy': 'breakout', 'bull_bb_std_mult': 2.8063937540074333, 'bull_rsi_os': 15, 'bull_rsi_ob': 76, 'bull_adx_thresh': 12.42891764246166, 'bull_atr_min_pct': 0.02255049942325368, 'bull_atr_max_pct': 0.018862779916528218, 'bull_tp_mult': 2.0879311352273393, 'bull_tsl_mult': 0.35977825983536804, 'bull_time_stop': 6, 'bull_use_sma': False, 'bull_use_ema': True, 'bull_use_atr': False, 'bull_use_adx': True, 'bull_use_spike': False, 'bull_rsi_required': True, 'bear_strategy': 'breakout', 'bear_bb_std_mult': 3.3591742197162224, 'bear_rsi_os': 8, 'bear_rsi_ob': 70, 'bear_adx_thresh': 26.266204902242105, 'bear_atr_min_pct': 0.024082572412903226, 'bear_atr_max_pct': 0.08175505869916179, 'bear_tp_mult': 2.5196940751746726, 'bear_tsl_mult': 0.1431070766220517, 'bear_time_stop': 129, 'bear_use_sma': False, 'bear_use_ema': True, 'bear_use_atr': True, 'bear_use_adx': True, 'bear_use_spike': False, 'bear_rsi_required': True, 'sideways_strategy': 'mean_reversion', 'sideways_bb_std_mult': 3.332919269510662, 'sideways_rsi_os': 53, 'sideways_rsi_ob': 79, 'sideways_adx_thresh': 6.649142175600626, 'sideways_atr_min_pct': 0.003725049250953287, 'sideways_atr_max_pct': 0.06495121503065406, 'sideways_tp_mult': 1.7816494498375746, 'sideways_tsl_mult': 0.33628222079539066, 'sideways_time_stop': 114, 'sideways_use_sma': False, 'sideways_use_ema': False, 'sideways_use_atr': False, 'sideways_use_adx': True, 'sideways_use_spike': False, 'sideways_rsi_required': False}.
[I 2025-09-01 14:36:50,759] Trial 284 finished with values: [-0.02078859413931, 0.02069788600085445] and parameters: {'p_sma': 13, 'p_std': 10, 'p_atr': 30, 'p_adx': 25, 'rsi_period': 46, 'ema1': 30, 'ema2': 51, 'slip_atr_k': 0.04714924216408371, 'slip_spread_k': 0.29413419448457634, 'spread_hl_frac': 0.03544392226790006, 'bb_std_mult': 2.766474224596104, 'rsi_os': 22, 'rsi_ob': 84, 'vol_spike': 0.2962015059822637, 'adx_thresh': 17.981517538509745, 'atr_min_pct': 0.01748846360025591, 'atr_max_pct': 0.02136958570792597, 'tp_mult': 2.942740590407897, 'tsl_mult': 0.058202900609099, 'strategy': 'mean_reversion', 'time_stop': 65, 'use_sma': True, 'use_atr': True, 'use_adx': False, 'use_ema': True, 'use_spike': True, 'rsi_required': False, 'edge_k': 0.6087565061900003, 'edge_cap': 0.0868848774112037, 'bull_strategy': 'breakout', 'bull_bb_std_mult': 3.579599466593089, 'bull_rsi_os': 17, 'bull_rsi_ob': 90, 'bull_adx_thresh': 11.12525332392319, 'bull_atr_min_pct': 0.0023235920615046445, 'bull_atr_max_pct': 0.02286574569871758, 'bull_tp_mult': 1.3019215761436322, 'bull_tsl_mult': 0.32150812121683364, 'bull_time_stop': 146, 'bull_use_sma': False, 'bull_use_ema': True, 'bull_use_atr': False, 'bull_use_adx': True, 'bull_use_spike': False, 'bull_rsi_required': True, 'bear_strategy': 'breakout', 'bear_bb_std_mult': 0.7089179391982228, 'bear_rsi_os': 8, 'bear_rsi_ob': 76, 'bear_adx_thresh': 27.187170012631487, 'bear_atr_min_pct': 0.023517199447418816, 'bear_atr_max_pct': 0.069292025392565, 'bear_tp_mult': 2.5099608901320707, 'bear_tsl_mult': 0.41717724895940644, 'bear_time_stop': 277, 'bear_use_sma': False, 'bear_use_ema': True, 'bear_use_atr': True, 'bear_use_adx': True, 'bear_use_spike': False, 'bear_rsi_required': True, 'sideways_strategy': 'mean_reversion', 'sideways_bb_std_mult': 3.3167378981667137, 'sideways_rsi_os': 54, 'sideways_rsi_ob': 87, 'sideways_adx_thresh': 6.625437677230926, 'sideways_atr_min_pct': 0.024518183211447914, 'sideways_atr_max_pct': 0.13686810755429457, 'sideways_tp_mult': 1.8678829350180657, 'sideways_tsl_mult': 0.9432194597363088, 'sideways_time_stop': 91, 'sideways_use_sma': False, 'sideways_use_ema': True, 'sideways_use_atr': False, 'sideways_use_adx': True, 'sideways_use_spike': False, 'sideways_rsi_required': False}.
[I 2025-09-01 14:36:50,778] Trial 285 finished with values: [-0.01953757941301615, 0.01939136638114593] and parameters: {'p_sma': 49, 'p_std': 59, 'p_atr': 21, 'p_adx': 23, 'rsi_period': 43, 'ema1': 30, 'ema2': 48, 'slip_atr_k': 0.07533043952783261, 'slip_spread_k': 0.2339516325479432, 'spread_hl_frac': 0.042307626453593455, 'bb_std_mult': 1.3699648467193128, 'rsi_os': 36, 'rsi_ob': 85, 'vol_spike': 0.29972417909611343, 'adx_thresh': 21.217183998988027, 'atr_min_pct': 0.017587561155418492, 'atr_max_pct': 0.07138853657579916, 'tp_mult': 2.9493607490801654, 'tsl_mult': 0.11232274246136625, 'strategy': 'mean_reversion', 'time_stop': 65, 'use_sma': True, 'use_atr': True, 'use_adx': False, 'use_ema': True, 'use_spike': True, 'rsi_required': False, 'edge_k': 1.2729617097958548, 'edge_cap': 0.46470838716499063, 'bull_strategy': 'breakout', 'bull_bb_std_mult': 3.4154308878550474, 'bull_rsi_os': 53, 'bull_rsi_ob': 49, 'bull_adx_thresh': 12.416602640586554, 'bull_atr_min_pct': 0.005874522186057355, 'bull_atr_max_pct': 0.08701865404589229, 'bull_tp_mult': 2.661102992423894, 'bull_tsl_mult': 0.358442629625748, 'bull_time_stop': 181, 'bull_use_sma': False, 'bull_use_ema': True, 'bull_use_atr': False, 'bull_use_adx': True, 'bull_use_spike': False, 'bull_rsi_required': True, 'bear_strategy': 'breakout', 'bear_bb_std_mult': 2.670760573967406, 'bear_rsi_os': 27, 'bear_rsi_ob': 76, 'bear_adx_thresh': 25.359375894025174, 'bear_atr_min_pct': 0.024025467301211315, 'bear_atr_max_pct': 0.10381779067399916, 'bear_tp_mult': 2.512855971105787, 'bear_tsl_mult': 0.42202177422108356, 'bear_time_stop': 40, 'bear_use_sma': False, 'bear_use_ema': True, 'bear_use_atr': True, 'bear_use_adx': True, 'bear_use_spike': False, 'bear_rsi_required': True, 'sideways_strategy': 'mean_reversion', 'sideways_bb_std_mult': 3.334920343004199, 'sideways_rsi_os': 49, 'sideways_rsi_ob': 87, 'sideways_adx_thresh': 6.557893173158202, 'sideways_atr_min_pct': 0.0037405530004325912, 'sideways_atr_max_pct': 0.1368701015506414, 'sideways_tp_mult': 1.3553711498551986, 'sideways_tsl_mult': 0.33576159779807696, 'sideways_time_stop': 125, 'sideways_use_sma': False, 'sideways_use_ema': False, 'sideways_use_atr': False, 'sideways_use_adx': True, 'sideways_use_spike': False, 'sideways_rsi_required': False}.
[I 2025-09-01 14:36:50,998] Trial 283 finished with values: [-1000000000.0, 1000000000.0] and parameters: {'p_sma': 45, 'p_std': 7, 'p_atr': 15, 'p_adx': 23, 'rsi_period': 61, 'ema1': 29, 'ema2': 48, 'slip_atr_k': 0.06864491591234714, 'slip_spread_k': 0.29241388114105227, 'spread_hl_frac': 0.01023551187555911, 'bb_std_mult': 3.527784731817195, 'rsi_os': 32, 'rsi_ob': 77, 'vol_spike': 0.29556599318250437, 'adx_thresh': 21.356057080405915, 'atr_min_pct': 0.015895582918590674, 'atr_max_pct': 0.07111583722071536, 'tp_mult': 2.9565442418015904, 'tsl_mult': 0.05357196933018413, 'strategy': 'mean_reversion', 'time_stop': 256, 'use_sma': True, 'use_atr': True, 'use_adx': True, 'use_ema': False, 'use_spike': True, 'rsi_required': False, 'edge_k': 0.5801256674450116, 'edge_cap': 0.09050585013888565, 'bull_strategy': 'breakout', 'bull_bb_std_mult': 2.5557968069659713, 'bull_rsi_os': 48, 'bull_rsi_ob': 61, 'bull_adx_thresh': 11.167691201136492, 'bull_atr_min_pct': 0.013603121184082858, 'bull_atr_max_pct': 0.010092015758247405, 'bull_tp_mult': 2.1941147112396173, 'bull_tsl_mult': 0.31897797629309516, 'bull_time_stop': 146, 'bull_use_sma': True, 'bull_use_ema': True, 'bull_use_atr': False, 'bull_use_adx': True, 'bull_use_spike': False, 'bull_rsi_required': False, 'bear_strategy': 'breakout', 'bear_bb_std_mult': 1.9582045974697426, 'bear_rsi_os': 8, 'bear_rsi_ob': 70, 'bear_adx_thresh': 7.75345082701268, 'bear_atr_min_pct': 0.023661250994800525, 'bear_atr_max_pct': 0.062311489337865816, 'bear_tp_mult': 2.51240925486328, 'bear_tsl_mult': 0.5382890601705451, 'bear_time_stop': 128, 'bear_use_sma': False, 'bear_use_ema': False, 'bear_use_atr': True, 'bear_use_adx': True, 'bear_use_spike': False, 'bear_rsi_required': True, 'sideways_strategy': 'mean_reversion', 'sideways_bb_std_mult': 1.8251469946737349, 'sideways_rsi_os': 18, 'sideways_rsi_ob': 66, 'sideways_adx_thresh': 7.163193611582427, 'sideways_atr_min_pct': 0.02437848823491341, 'sideways_atr_max_pct': 0.13290467045845386, 'sideways_tp_mult': 1.842235089390664, 'sideways_tsl_mult': 0.22895129199343717, 'sideways_time_stop': 214, 'sideways_use_sma': False, 'sideways_use_ema': True, 'sideways_use_atr': True, 'sideways_use_adx': True, 'sideways_use_spike': False, 'sideways_rsi_required': False}.
[I 2025-09-01 14:37:30,609] Trial 290 finished with values: [-1000000000.0, 1000000000.0] and parameters: {'p_sma': 50, 'p_std': 58, 'p_atr': 8, 'p_adx': 25, 'rsi_period': 43, 'ema1': 30, 'ema2': 53, 'slip_atr_k': 0.1755245561140354, 'slip_spread_k': 0.14925003375151055, 'spread_hl_frac': 0.013147138865956249, 'bb_std_mult': 1.500477438722867, 'rsi_os': 39, 'rsi_ob': 74, 'vol_spike': 0.2998133794965919, 'adx_thresh': 26.362638062205914, 'atr_min_pct': 0.015576215875530543, 'atr_max_pct': 0.09331174053709976, 'tp_mult': 1.4160330745982916, 'tsl_mult': 0.11374082271554732, 'strategy': 'breakout', 'time_stop': 71, 'use_sma': False, 'use_atr': True, 'use_adx': False, 'use_ema': False, 'use_spike': True, 'rsi_required': False, 'edge_k': 0.4281079463687905, 'edge_cap': 0.3324188318885029, 'bull_strategy': 'breakout', 'bull_bb_std_mult': 2.8534437160070585, 'bull_rsi_os': 15, 'bull_rsi_ob': 49, 'bull_adx_thresh': 10.353521738472045, 'bull_atr_min_pct': 0.004660243599614335, 'bull_atr_max_pct': 0.017287481040327585, 'bull_tp_mult': 2.730067400022934, 'bull_tsl_mult': 0.3615794291376646, 'bull_time_stop': 157, 'bull_use_sma': False, 'bull_use_ema': False, 'bull_use_atr': False, 'bull_use_adx': True, 'bull_use_spike': False, 'bull_rsi_required': True, 'bear_strategy': 'mean_reversion', 'bear_bb_std_mult': 1.204550188474029, 'bear_rsi_os': 19, 'bear_rsi_ob': 75, 'bear_adx_thresh': 26.141143741758537, 'bear_atr_min_pct': 0.0016160569268651795, 'bear_atr_max_pct': 0.08219933484680718, 'bear_tp_mult': 2.4835535600110705, 'bear_tsl_mult': 0.6436432393808531, 'bear_time_stop': 285, 'bear_use_sma': False, 'bear_use_ema': False, 'bear_use_atr': False, 'bear_use_adx': True, 'bear_use_spike': False, 'bear_rsi_required': False, 'sideways_strategy': 'mean_reversion', 'sideways_bb_std_mult': 3.3311613765031205, 'sideways_rsi_os': 13, 'sideways_rsi_ob': 91, 'sideways_adx_thresh': 14.39955307749044, 'sideways_atr_min_pct': 0.026579109388862, 'sideways_atr_max_pct': 0.044345245873473035, 'sideways_tp_mult': 1.7812717746490154, 'sideways_tsl_mult': 0.6707735406416454, 'sideways_time_stop': 267, 'sideways_use_sma': False, 'sideways_use_ema': False, 'sideways_use_atr': True, 'sideways_use_adx': False, 'sideways_use_spike': True, 'sideways_rsi_required': True}.
