[I 2025-08-29 18:43:24,153] Trial 137 finished with values: [-1000000000.0, 1000000000.0] and parameters: {'p_sma': 57, 'p_std': 51, 'p_atr': 13, 'p_adx': 14, 'rsi_period': 77, 'ema1': 29, 'ema2': 13, 'slip_atr_k': 0.016733036260626173, 'slip_spread_k': 0.1579380885159315, 'spread_hl_frac': 0.03123608580121095, 'bb_std_mult': 2.1020870919690884, 'rsi_os': 39, 'rsi_ob': 55, 'vol_spike': 0.038027685199546454, 'adx_thresh': 33.344451755376376, 'atr_min_pct': 0.029636955591959342, 'atr_max_pct': 0.017475265366314045, 'tp_mult': 1.1992383565931204, 'tsl_mult': 0.8179171449103397, 'strategy': 'mean_reversion', 'time_stop': 40, 'use_sma': True, 'use_atr': False, 'use_adx': False, 'use_ema': True, 'use_spike': False, 'rsi_required': False, 'edge_k': 1.835237989423121, 'edge_cap': 0.9065690365556027}.
[I 2025-08-29 18:43:24,204] Trial 139 finished with values: [-1000000000.0, 1000000000.0] and parameters: {'p_sma': 16, 'p_std': 15, 'p_atr': 7, 'p_adx': 12, 'rsi_period': 32, 'ema1': 27, 'ema2': 10, 'slip_atr_k': 0.006094866171654653, 'slip_spread_k': 0.6193344411287527, 'spread_hl_frac': 0.019640243012529736, 'bb_std_mult': 1.8914066349713168, 'rsi_os': 24, 'rsi_ob': 50, 'vol_spike': 0.08452740835159674, 'adx_thresh': 28.392319365146733, 'atr_min_pct': 0.015500150784327232, 'atr_max_pct': 0.010094405392810448, 'tp_mult': 1.1194570922498472, 'tsl_mult': 0.14469074730739842, 'strategy': 'mean_reversion', 'time_stop': 23, 'use_sma': True, 'use_atr': False, 'use_adx': True, 'use_ema': True, 'use_spike': True, 'rsi_required': False, 'edge_k': 0.7727395857826644, 'edge_cap': 0.9487605339409049}.
[I 2025-08-29 18:43:51,140] Trial 135 finished with values: [-0.0021293957197332514, 0.0024653722606959704] and parameters: {'p_sma': 57, 'p_std': 42, 'p_atr': 11, 'p_adx': 20, 'rsi_period': 11, 'ema1': 30, 'ema2': 13, 'slip_atr_k': 0.015160087921031504, 'slip_spread_k': 0.721570437632635, 'spread_hl_frac': 0.014584329654892456, 'bb_std_mult': 2.9678607139822986, 'rsi_os': 27, 'rsi_ob': 72, 'vol_spike': 0.12788835587719344, 'adx_thresh': 28.839386200363393, 'atr_min_pct': 0.003970191958820908, 'atr_max_pct': 0.14630080070380774, 'tp_mult': 1.2025196091400616, 'tsl_mult': 0.47068283180555853, 'strategy': 'mean_reversion', 'time_stop': 39, 'use_sma': True, 'use_atr': True, 'use_adx': False, 'use_ema': False, 'use_spike': False, 'rsi_required': False, 'edge_k': 1.842007141710571, 'edge_cap': 0.9746144314028348}.
[I 2025-08-29 18:43:52,182] Trial 136 finished with values: [-1000000000.0, 1000000000.0] and parameters: {'p_sma': 8, 'p_std': 31, 'p_atr': 11, 'p_adx': 21, 'rsi_period': 77, 'ema1': 28, 'ema2': 46, 'slip_atr_k': 0.01641779559279139, 'slip_spread_k': 0.7210945530600226, 'spread_hl_frac': 0.029479218042751464, 'bb_std_mult': 2.105515341309167, 'rsi_os': 39, 'rsi_ob': 55, 'vol_spike': 0.012987097418677096, 'adx_thresh': 26.775287098499106, 'atr_min_pct': 0.0038473936265363594, 'atr_max_pct': 0.017307690174197195, 'tp_mult': 2.0467892837831383, 'tsl_mult': 0.7711002212725926, 'strategy': 'mean_reversion', 'time_stop': 23, 'use_sma': True, 'use_atr': False, 'use_adx': False, 'use_ema': True, 'use_spike': False, 'rsi_required': False, 'edge_k': 1.5845449579764206, 'edge_cap': 0.9044072911895946}.
[I 2025-08-29 18:43:52,697] Trial 140 finished with values: [-1000000000.0, 1000000000.0] and parameters: {'p_sma': 8, 'p_std': 54, 'p_atr': 18, 'p_adx': 20, 'rsi_period': 24, 'ema1': 14, 'ema2': 17, 'slip_atr_k': 0.18029989585994707, 'slip_spread_k': 0.7069012572131423, 'spread_hl_frac': 0.029447694320982133, 'bb_std_mult': 0.8044467975932457, 'rsi_os': 37, 'rsi_ob': 56, 'vol_spike': 0.18490453699467332, 'adx_thresh': 13.578938454874818, 'atr_min_pct': 0.023447972234088253, 'atr_max_pct': 0.02398222047455196, 'tp_mult': 1.2548230583685493, 'tsl_mult': 0.7706651658061265, 'strategy': 'breakout', 'time_stop': 141, 'use_sma': False, 'use_atr': False, 'use_adx': True, 'use_ema': True, 'use_spike': False, 'rsi_required': False, 'edge_k': 1.9967774614912706, 'edge_cap': 0.7323413391867106}.
[I 2025-08-29 18:43:52,831] Trial 138 finished with values: [-1000000000.0, 1000000000.0] and parameters: {'p_sma': 16, 'p_std': 44, 'p_atr': 11, 'p_adx': 12, 'rsi_period': 51, 'ema1': 29, 'ema2': 13, 'slip_atr_k': 0.1812793389547841, 'slip_spread_k': 0.9923050795497165, 'spread_hl_frac': 0.01954623017075851, 'bb_std_mult': 1.4540102718660282, 'rsi_os': 39, 'rsi_ob': 55, 'vol_spike': 0.12942852231689672, 'adx_thresh': 28.453295770765756, 'atr_min_pct': 0.006748903770352787, 'atr_max_pct': 0.018208733089632424, 'tp_mult': 1.2575097101155972, 'tsl_mult': 0.1403644205432372, 'strategy': 'mean_reversion', 'time_stop': 39, 'use_sma': True, 'use_atr': False, 'use_adx': True, 'use_ema': True, 'use_spike': True, 'rsi_required': False, 'edge_k': 0.858445028697006, 'edge_cap': 0.9066375311121047}.
[I 2025-08-29 18:44:21,054] Trial 141 finished with values: [-1000000000.0, 1000000000.0] and parameters: {'p_sma': 11, 'p_std': 45, 'p_atr': 27, 'p_adx': 8, 'rsi_period': 49, 'ema1': 14, 'ema2': 42, 'slip_atr_k': 0.040476070608871956, 'slip_spread_k': 0.7636356379508636, 'spread_hl_frac': 0.029583992598301953, 'bb_std_mult': 1.9636118769687627, 'rsi_os': 45, 'rsi_ob': 69, 'vol_spike': 0.2697788725616684, 'adx_thresh': 10.848132020185044, 'atr_min_pct': 0.006645332618670646, 'atr_max_pct': 0.022444955651583942, 'tp_mult': 1.300194938694211, 'tsl_mult': 0.3879740056303793, 'strategy': 'breakout', 'time_stop': 49, 'use_sma': False, 'use_atr': False, 'use_adx': True, 'use_ema': True, 'use_spike': False, 'rsi_required': False, 'edge_k': 1.5825577666095596, 'edge_cap': 0.7537416740784374}.
[I 2025-08-29 18:44:21,279] Trial 144 finished with values: [-0.004372846482382231, 0.004350759155437887] and parameters: {'p_sma': 11, 'p_std': 34, 'p_atr': 10, 'p_adx': 8, 'rsi_period': 75, 'ema1': 7, 'ema2': 39, 'slip_atr_k': 0.1978256616434354, 'slip_spread_k': 0.7810088432079019, 'spread_hl_frac': 0.028381227258514108, 'bb_std_mult': 2.986558230201837, 'rsi_os': 41, 'rsi_ob': 69, 'vol_spike': 0.2358952980516431, 'adx_thresh': 14.988556565176603, 'atr_min_pct': 0.002443964923243511, 'atr_max_pct': 0.09414123316404421, 'tp_mult': 2.1264189603243024, 'tsl_mult': 0.4607033906548205, 'strategy': 'breakout', 'time_stop': 5, 'use_sma': False, 'use_atr': False, 'use_adx': True, 'use_ema': True, 'use_spike': False, 'rsi_required': False, 'edge_k': 0.7040891897477906, 'edge_cap': 0.9360004174001952}.
[I 2025-08-29 18:44:21,592] Trial 142 finished with values: [-1000000000.0, 1000000000.0] and parameters: {'p_sma': 60, 'p_std': 54, 'p_atr': 29, 'p_adx': 22, 'rsi_period': 24, 'ema1': 29, 'ema2': 26, 'slip_atr_k': 0.21978398763931084, 'slip_spread_k': 0.6547072039684606, 'spread_hl_frac': 0.028677657721207575, 'bb_std_mult': 1.4141104055950384, 'rsi_os': 46, 'rsi_ob': 54, 'vol_spike': 0.19011026081618593, 'adx_thresh': 10.80415570408733, 'atr_min_pct': 0.006580400088642991, 'atr_max_pct': 0.013470049366099787, 'tp_mult': 1.3030642678846944, 'tsl_mult': 0.8878778023473985, 'strategy': 'breakout', 'time_stop': 298, 'use_sma': False, 'use_atr': False, 'use_adx': True, 'use_ema': True, 'use_spike': True, 'rsi_required': False, 'edge_k': 0.8760663928959223, 'edge_cap': 0.931973140538537}.
[I 2025-08-29 18:44:21,850] Trial 143 finished with values: [-1000000000.0, 1000000000.0] and parameters: {'p_sma': 11, 'p_std': 47, 'p_atr': 14, 'p_adx': 13, 'rsi_period': 72, 'ema1': 19, 'ema2': 39, 'slip_atr_k': 0.1986332077383386, 'slip_spread_k': 0.7599455593299266, 'spread_hl_frac': 0.02452094638436735, 'bb_std_mult': 2.540283841463018, 'rsi_os': 46, 'rsi_ob': 69, 'vol_spike': 0.04489803157049976, 'adx_thresh': 15.162606705760705, 'atr_min_pct': 0.006466587151245666, 'atr_max_pct': 0.01350780921998497, 'tp_mult': 1.3172825219326105, 'tsl_mult': 0.3912133666981116, 'strategy': 'breakout', 'time_stop': 49, 'use_sma': False, 'use_atr': False, 'use_adx': True, 'use_ema': True, 'use_spike': True, 'rsi_required': True, 'edge_k': 0.7035901422347424, 'edge_cap': 0.9274170986747661}.
[I 2025-08-29 18:44:21,976] Trial 146 finished with values: [-1000000000.0, 1000000000.0] and parameters: {'p_sma': 10, 'p_std': 40, 'p_atr': 11, 'p_adx': 22, 'rsi_period': 72, 'ema1': 30, 'ema2': 21, 'slip_atr_k': 0.029086465598767947, 'slip_spread_k': 0.5219392578615671, 'spread_hl_frac': 0.010065019934117831, 'bb_std_mult': 0.5205043691739868, 'rsi_os': 30, 'rsi_ob': 73, 'vol_spike': 0.16613538639222886, 'adx_thresh': 15.594467188281039, 'atr_min_pct': 0.020555802573949573, 'atr_max_pct': 0.013743381980628383, 'tp_mult': 1.0654140980554179, 'tsl_mult': 0.6417289389550667, 'strategy': 'breakout', 'time_stop': 12, 'use_sma': False, 'use_atr': True, 'use_adx': True, 'use_ema': False, 'use_spike': False, 'rsi_required': True, 'edge_k': 1.321430283368805, 'edge_cap': 0.15554215589615777}.
[I 2025-08-29 18:44:49,070] Trial 147 finished with values: [-0.0017020376141663185, 0.001863759409382176] and parameters: {'p_sma': 27, 'p_std': 38, 'p_atr': 30, 'p_adx': 20, 'rsi_period': 29, 'ema1': 30, 'ema2': 59, 'slip_atr_k': 0.028974799090831043, 'slip_spread_k': 0.21539791575897155, 'spread_hl_frac': 0.04399298919183568, 'bb_std_mult': 0.5316949833593747, 'rsi_os': 44, 'rsi_ob': 71, 'vol_spike': 0.17000061921088047, 'adx_thresh': 15.47096629937855, 'atr_min_pct': 0.003279144324398263, 'atr_max_pct': 0.014593563118185236, 'tp_mult': 2.594052912159685, 'tsl_mult': 0.212947648173607, 'strategy': 'breakout', 'time_stop': 29, 'use_sma': False, 'use_atr': True, 'use_adx': True, 'use_ema': False, 'use_spike': False, 'rsi_required': True, 'edge_k': 1.2916930851812327, 'edge_cap': 0.9777425061495615}.
[I 2025-08-29 18:44:49,609] Trial 148 finished with values: [-1000000000.0, 1000000000.0] and parameters: {'p_sma': 25, 'p_std': 29, 'p_atr': 21, 'p_adx': 22, 'rsi_period': 37, 'ema1': 30, 'ema2': 59, 'slip_atr_k': 0.028884241737946376, 'slip_spread_k': 0.38239701347123567, 'spread_hl_frac': 0.04384515491628335, 'bb_std_mult': 2.1606854220595983, 'rsi_os': 30, 'rsi_ob': 51, 'vol_spike': 0.0038732273145041206, 'adx_thresh': 22.02900132012706, 'atr_min_pct': 0.020816395641110895, 'atr_max_pct': 0.11618603819761655, 'tp_mult': 1.8497429911851961, 'tsl_mult': 0.20995596172129458, 'strategy': 'breakout', 'time_stop': 29, 'use_sma': False, 'use_atr': True, 'use_adx': False, 'use_ema': False, 'use_spike': False, 'rsi_required': True, 'edge_k': 1.290529921681639, 'edge_cap': 0.9797788608526127}.
[I 2025-08-29 18:44:50,042] Trial 145 finished with values: [-0.0011895678134111742, 0.0012117881923224467] and parameters: {'p_sma': 10, 'p_std': 29, 'p_atr': 10, 'p_adx': 22, 'rsi_period': 75, 'ema1': 7, 'ema2': 37, 'slip_atr_k': 0.09895554880154528, 'slip_spread_k': 0.12075553847676973, 'spread_hl_frac': 0.028346742149738063, 'bb_std_mult': 2.971543294359704, 'rsi_os': 41, 'rsi_ob': 72, 'vol_spike': 0.03240321179449365, 'adx_thresh': 22.262038686460233, 'atr_min_pct': 0.0024875511347703153, 'atr_max_pct': 0.012824468856611194, 'tp_mult': 1.6466219247707763, 'tsl_mult': 0.4604197343085121, 'strategy': 'breakout', 'time_stop': 29, 'use_sma': False, 'use_atr': False, 'use_adx': True, 'use_ema': True, 'use_spike': False, 'rsi_required': True, 'edge_k': 1.4651309067437726, 'edge_cap': 0.978953087233612}.
[I 2025-08-29 18:44:50,311] Trial 149 finished with values: [-1000000000.0, 1000000000.0] and parameters: {'p_sma': 25, 'p_std': 32, 'p_atr': 17, 'p_adx': 20, 'rsi_period': 74, 'ema1': 26, 'ema2': 18, 'slip_atr_k': 0.10022495871442172, 'slip_spread_k': 0.9167453172513936, 'spread_hl_frac': 0.030955759189418182, 'bb_std_mult': 3.3502584181049633, 'rsi_os': 44, 'rsi_ob': 84, 'vol_spike': 0.004322217554957319, 'adx_thresh': 17.22032192749244, 'atr_min_pct': 0.025333157928291106, 'atr_max_pct': 0.04000296712633223, 'tp_mult': 1.1304142313237917, 'tsl_mult': 0.21046916624311274, 'strategy': 'breakout', 'time_stop': 28, 'use_sma': False, 'use_atr': False, 'use_adx': False, 'use_ema': True, 'use_spike': False, 'rsi_required': False, 'edge_k': 1.4753791508445127, 'edge_cap': 0.9822306449498196}.
[I 2025-08-29 18:45:18,588] Trial 150 finished with values: [-0.0019174565306342428, 0.0018845319934171077] and parameters: {'p_sma': 25, 'p_std': 32, 'p_atr': 8, 'p_adx': 11, 'rsi_period': 55, 'ema1': 27, 'ema2': 16, 'slip_atr_k': 0.2297154781388145, 'slip_spread_k': 0.11191347549909475, 'spread_hl_frac': 0.031245050909475394, 'bb_std_mult': 2.048567858544875, 'rsi_os': 44, 'rsi_ob': 84, 'vol_spike': 0.2170562994535345, 'adx_thresh': 22.226383606363772, 'atr_min_pct': 0.004687908186014214, 'atr_max_pct': 0.11408674502301416, 'tp_mult': 2.601923746212063, 'tsl_mult': 0.20784299988648663, 'strategy': 'breakout', 'time_stop': 29, 'use_sma': False, 'use_atr': False, 'use_adx': True, 'use_ema': True, 'use_spike': False, 'rsi_required': False, 'edge_k': 1.0764674927579148, 'edge_cap': 0.9596881148851601}.
[I 2025-08-29 18:45:18,793] Trial 151 finished with values: [-0.001443153512424411, 0.0017203778346323582] and parameters: {'p_sma': 28, 'p_std': 36, 'p_atr': 30, 'p_adx': 11, 'rsi_period': 28, 'ema1': 26, 'ema2': 18, 'slip_atr_k': 0.03687087683395292, 'slip_spread_k': 0.3371716564365796, 'spread_hl_frac': 0.023605699662845942, 'bb_std_mult': 2.050426293745118, 'rsi_os': 44, 'rsi_ob': 57, 'vol_spike': 0.030862469964506943, 'adx_thresh': 18.157229445590897, 'atr_min_pct': 0.004739291009375115, 'atr_max_pct': 0.03972925670225972, 'tp_mult': 1.1445500350255562, 'tsl_mult': 0.19238741142423885, 'strategy': 'breakout', 'time_stop': 95, 'use_sma': False, 'use_atr': False, 'use_adx': True, 'use_ema': True, 'use_spike': False, 'rsi_required': False, 'edge_k': 1.0656816611330757, 'edge_cap': 0.3457391708381374}.
[I 2025-08-29 18:45:18,952] Trial 152 finished with values: [-1000000000.0, 1000000000.0] and parameters: {'p_sma': 13, 'p_std': 36, 'p_atr': 10, 'p_adx': 18, 'rsi_period': 74, 'ema1': 26, 'ema2': 56, 'slip_atr_k': 0.15832698961411995, 'slip_spread_k': 0.20957854093047412, 'spread_hl_frac': 0.023343670864318503, 'bb_std_mult': 2.0655060391202937, 'rsi_os': 44, 'rsi_ob': 84, 'vol_spike': 0.21675821032055498, 'adx_thresh': 17.206613081141185, 'atr_min_pct': 0.011861036252358372, 'atr_max_pct': 0.020775311565346184, 'tp_mult': 1.6421309746137265, 'tsl_mult': 0.7275081670466851, 'strategy': 'breakout', 'time_stop': 16, 'use_sma': False, 'use_atr': False, 'use_adx': True, 'use_ema': True, 'use_spike': False, 'rsi_required': False, 'edge_k': 1.0441670276453803, 'edge_cap': 0.352261974780426}.
[I 2025-08-29 18:45:19,030] Trial 153 finished with values: [-1000000000.0, 1000000000.0] and parameters: {'p_sma': 12, 'p_std': 36, 'p_atr': 10, 'p_adx': 11, 'rsi_period': 79, 'ema1': 27, 'ema2': 16, 'slip_atr_k': 0.035122003697044366, 'slip_spread_k': 0.1153880241786055, 'spread_hl_frac': 0.022887136575441613, 'bb_std_mult': 2.0519126616369485, 'rsi_os': 20, 'rsi_ob': 59, 'vol_spike': 0.03189429485082049, 'adx_thresh': 14.141771121556232, 'atr_min_pct': 0.011840538547131681, 'atr_max_pct': 0.03259374990125978, 'tp_mult': 2.576511878147384, 'tsl_mult': 0.5298352676639801, 'strategy': 'breakout', 'time_stop': 239, 'use_sma': False, 'use_atr': False, 'use_adx': True, 'use_ema': True, 'use_spike': False, 'rsi_required': False, 'edge_k': 0.9783760568956125, 'edge_cap': 0.957650016526615}.
[I 2025-08-29 18:45:47,782] Trial 154 finished with values: [-0.0010549408085913647, 0.0015389800030412091] and parameters: {'p_sma': 13, 'p_std': 36, 'p_atr': 10, 'p_adx': 11, 'rsi_period': 17, 'ema1': 28, 'ema2': 19, 'slip_atr_k': 0.036820715736369726, 'slip_spread_k': 0.8300265171690738, 'spread_hl_frac': 0.02323098284027282, 'bb_std_mult': 2.902517530554647, 'rsi_os': 43, 'rsi_ob': 54, 'vol_spike': 0.030141974705542682, 'adx_thresh': 15.934512776548084, 'atr_min_pct': 0.005473265522301378, 'atr_max_pct': 0.021051770553651795, 'tp_mult': 1.1039159102105034, 'tsl_mult': 0.5602338268220552, 'strategy': 'breakout', 'time_stop': 262, 'use_sma': False, 'use_atr': False, 'use_adx': True, 'use_ema': True, 'use_spike': False, 'rsi_required': False, 'edge_k': 1.076047685790901, 'edge_cap': 0.9578402448447041}.
[I 2025-08-29 18:45:48,175] Trial 155 finished with values: [-1000000000.0, 1000000000.0] and parameters: {'p_sma': 13, 'p_std': 36, 'p_atr': 10, 'p_adx': 30, 'rsi_period': 71, 'ema1': 29, 'ema2': 19, 'slip_atr_k': 0.23183081645092612, 'slip_spread_k': 0.5058006194297527, 'spread_hl_frac': 0.02724134992992085, 'bb_std_mult': 1.7294716017536191, 'rsi_os': 20, 'rsi_ob': 52, 'vol_spike': 0.14292606442371822, 'adx_thresh': 13.93609184561121, 'atr_min_pct': 0.011856001382715503, 'atr_max_pct': 0.020906242165146152, 'tp_mult': 1.2274343271930497, 'tsl_mult': 0.9617398272527069, 'strategy': 'breakout', 'time_stop': 14, 'use_sma': False, 'use_atr': False, 'use_adx': True, 'use_ema': True, 'use_spike': True, 'rsi_required': False, 'edge_k': 0.9616565013751625, 'edge_cap': 0.360264647831436}.
[I 2025-08-29 18:45:48,354] Trial 156 finished with values: [-0.001022222907748116, 0.0015575598293950709] and parameters: {'p_sma': 10, 'p_std': 36, 'p_atr': 10, 'p_adx': 24, 'rsi_period': 18, 'ema1': 28, 'ema2': 19, 'slip_atr_k': 0.10958665096097178, 'slip_spread_k': 0.501934352160785, 'spread_hl_frac': 0.013021348757983144, 'bb_std_mult': 3.5053121027834653, 'rsi_os': 6, 'rsi_ob': 57, 'vol_spike': 0.029568289015188477, 'adx_thresh': 13.987352410573223, 'atr_min_pct': 0.005196822233638533, 'atr_max_pct': 0.01599141636970653, 'tp_mult': 2.9460428190512915, 'tsl_mult': 0.535040555496006, 'strategy': 'breakout', 'time_stop': 182, 'use_sma': False, 'use_atr': False, 'use_adx': True, 'use_ema': True, 'use_spike': True, 'rsi_required': False, 'edge_k': 0.9780374650733181, 'edge_cap': 0.9600191942420855}.
[I 2025-08-29 18:45:48,366] Trial 157 finished with values: [-0.005464272234738554, 0.005446948332897612] and parameters: {'p_sma': 23, 'p_std': 38, 'p_atr': 9, 'p_adx': 21, 'rsi_period': 55, 'ema1': 28, 'ema2': 19, 'slip_atr_k': 0.23283252352741407, 'slip_spread_k': 0.4230120575652644, 'spread_hl_frac': 0.02757402966021597, 'bb_std_mult': 2.357128235941563, 'rsi_os': 6, 'rsi_ob': 52, 'vol_spike': 0.20430553065059756, 'adx_thresh': 13.66708271625035, 'atr_min_pct': 0.0054566434436826156, 'atr_max_pct': 0.01654004221797052, 'tp_mult': 2.595975015698736, 'tsl_mult': 0.9718536208448876, 'strategy': 'breakout', 'time_stop': 194, 'use_sma': False, 'use_atr': False, 'use_adx': True, 'use_ema': True, 'use_spike': True, 'rsi_required': True, 'edge_k': 1.080525822706571, 'edge_cap': 0.5953333555219887}.
[I 2025-08-29 18:46:16,877] Trial 161 finished with values: [-1000000000.0, 1000000000.0] and parameters: {'p_sma': 35, 'p_std': 34, 'p_atr': 9, 'p_adx': 23, 'rsi_period': 75, 'ema1': 29, 'ema2': 21, 'slip_atr_k': 0.02404474554716974, 'slip_spread_k': 0.827779074522421, 'spread_hl_frac': 0.025288331891388377, 'bb_std_mult': 2.246182385112732, 'rsi_os': 41, 'rsi_ob': 90, 'vol_spike': 0.01858212210619506, 'adx_thresh': 6.686605665784231, 'atr_min_pct': 0.007667784317870956, 'atr_max_pct': 0.10037543724261193, 'tp_mult': 1.1421841990924129, 'tsl_mult': 0.15274538335809879, 'strategy': 'mean_reversion', 'time_stop': 183, 'use_sma': True, 'use_atr': False, 'use_adx': True, 'use_ema': True, 'use_spike': False, 'rsi_required': False, 'edge_k': 1.2128585757956394, 'edge_cap': 0.6332786266195859}.
[I 2025-08-29 18:46:17,289] Trial 160 finished with values: [-1000000000.0, 1000000000.0] and parameters: {'p_sma': 35, 'p_std': 34, 'p_atr': 30, 'p_adx': 23, 'rsi_period': 75, 'ema1': 29, 'ema2': 21, 'slip_atr_k': 0.21135391575417786, 'slip_spread_k': 0.3408390921872476, 'spread_hl_frac': 0.025635140093516064, 'bb_std_mult': 3.5129833168712485, 'rsi_os': 41, 'rsi_ob': 92, 'vol_spike': 0.019418026010218407, 'adx_thresh': 32.40303285523481, 'atr_min_pct': 0.004577766702038892, 'atr_max_pct': 0.02445551295320548, 'tp_mult': 1.1488775283267094, 'tsl_mult': 0.03907441822416699, 'strategy': 'mean_reversion', 'time_stop': 124, 'use_sma': True, 'use_atr': False, 'use_adx': True, 'use_ema': True, 'use_spike': False, 'rsi_required': False, 'edge_k': 1.3769627934068664, 'edge_cap': 0.2957092720682819}.
[I 2025-08-29 18:46:17,417] Trial 159 finished with values: [-1000000000.0, 1000000000.0] and parameters: {'p_sma': 10, 'p_std': 34, 'p_atr': 9, 'p_adx': 21, 'rsi_period': 18, 'ema1': 28, 'ema2': 21, 'slip_atr_k': 0.08734642289101308, 'slip_spread_k': 0.058140482222628076, 'spread_hl_frac': 0.025284345109890846, 'bb_std_mult': 2.87243466770164, 'rsi_os': 6, 'rsi_ob': 91, 'vol_spike': 0.018396897835927732, 'adx_thresh': 14.884056903296024, 'atr_min_pct': 0.004610169173148439, 'atr_max_pct': 0.10186003083040733, 'tp_mult': 1.1452259002023535, 'tsl_mult': 0.14582338734178077, 'strategy': 'breakout', 'time_stop': 189, 'use_sma': False, 'use_atr': False, 'use_adx': True, 'use_ema': True, 'use_spike': False, 'rsi_required': True, 'edge_k': 1.0932491290663284, 'edge_cap': 0.5866669994686492}.
[I 2025-08-29 18:46:17,690] Trial 158 finished with values: [-0.003372654688879817, 0.0033255970576993614] and parameters: {'p_sma': 49, 'p_std': 33, 'p_atr': 9, 'p_adx': 30, 'rsi_period': 70, 'ema1': 29, 'ema2': 19, 'slip_atr_k': 0.06316901861204036, 'slip_spread_k': 0.6887587840531515, 'spread_hl_frac': 0.04716364635903495, 'bb_std_mult': 2.3304003407066936, 'rsi_os': 41, 'rsi_ob': 57, 'vol_spike': 0.021016882254251638, 'adx_thresh': 18.006129703608913, 'atr_min_pct': 0.004735998199295172, 'atr_max_pct': 0.01569444015736475, 'tp_mult': 1.1854023993335185, 'tsl_mult': 0.19207497066672607, 'strategy': 'breakout', 'time_stop': 78, 'use_sma': False, 'use_atr': False, 'use_adx': True, 'use_ema': True, 'use_spike': True, 'rsi_required': True, 'edge_k': 0.9446379755441742, 'edge_cap': 0.23425878556951835}.
