[I 2025-08-29 18:52:19,305] Trial 216 finished with values: [-1000000000.0, 1000000000.0] and parameters: {'p_sma': 33, 'p_std': 35, 'p_atr': 10, 'p_adx': 14, 'rsi_period': 70, 'ema1': 10, 'ema2': 15, 'slip_atr_k': 0.005605507582807827, 'slip_spread_k': 0.4890996518944425, 'spread_hl_frac': 0.004288281361878768, 'bb_std_mult': 3.1899994886028193, 'rsi_os': 38, 'rsi_ob': 58, 'vol_spike': 0.08945644314582257, 'adx_thresh': 16.84708650724278, 'atr_min_pct': 0.007382454885164273, 'atr_max_pct': 0.01804162435379074, 'tp_mult': 2.4283440801773426, 'tsl_mult': 0.5006755625681164, 'strategy': 'breakout', 'time_stop': 239, 'use_sma': False, 'use_atr': False, 'use_adx': True, 'use_ema': False, 'use_spike': True, 'rsi_required': True, 'edge_k': 1.2220905401425828, 'edge_cap': 0.9909463311693466}.
[I 2025-08-29 18:52:48,284] Trial 218 finished with values: [-1000000000.0, 1000000000.0] and parameters: {'p_sma': 34, 'p_std': 34, 'p_atr': 10, 'p_adx': 12, 'rsi_period': 71, 'ema1': 11, 'ema2': 15, 'slip_atr_k': 0.00015639569419755896, 'slip_spread_k': 0.5268373665061421, 'spread_hl_frac': 0.004099362089396623, 'bb_std_mult': 3.1916208387490106, 'rsi_os': 39, 'rsi_ob': 58, 'vol_spike': 0.08233542375277318, 'adx_thresh': 18.140824686435682, 'atr_min_pct': 0.007619611438106647, 'atr_max_pct': 0.02532647192286254, 'tp_mult': 2.4005243443259947, 'tsl_mult': 0.5211225323761544, 'strategy': 'breakout', 'time_stop': 240, 'use_sma': False, 'use_atr': False, 'use_adx': False, 'use_ema': False, 'use_spike': True, 'rsi_required': True, 'edge_k': 0.44122524811678643, 'edge_cap': 0.6168218883233975}.
[I 2025-08-29 18:52:48,910] Trial 219 finished with values: [-1000000000.0, 1000000000.0] and parameters: {'p_sma': 36, 'p_std': 33, 'p_atr': 10, 'p_adx': 12, 'rsi_period': 71, 'ema1': 9, 'ema2': 18, 'slip_atr_k': 0.01003826556718148, 'slip_spread_k': 0.44878951478438484, 'spread_hl_frac': 0.001663588350509225, 'bb_std_mult': 3.1544987806008864, 'rsi_os': 39, 'rsi_ob': 58, 'vol_spike': 0.08212624514992872, 'adx_thresh': 17.397979395629193, 'atr_min_pct': 0.007215426576489881, 'atr_max_pct': 0.025198944708331412, 'tp_mult': 2.402033494341028, 'tsl_mult': 0.5185470089369029, 'strategy': 'breakout', 'time_stop': 239, 'use_sma': False, 'use_atr': False, 'use_adx': False, 'use_ema': False, 'use_spike': True, 'rsi_required': True, 'edge_k': 1.147114222831357, 'edge_cap': 0.6167774718298717}.
[I 2025-08-29 18:52:49,133] Trial 217 finished with values: [-1000000000.0, 1000000000.0] and parameters: {'p_sma': 34, 'p_std': 34, 'p_atr': 10, 'p_adx': 13, 'rsi_period': 71, 'ema1': 11, 'ema2': 17, 'slip_atr_k': 0.0008398701655836747, 'slip_spread_k': 0.44743010944638656, 'spread_hl_frac': 0.003992202925291382, 'bb_std_mult': 3.1931880264436003, 'rsi_os': 39, 'rsi_ob': 58, 'vol_spike': 0.12330299397388444, 'adx_thresh': 17.770541695652213, 'atr_min_pct': 0.007950797407723784, 'atr_max_pct': 0.060364437170639634, 'tp_mult': 2.3930749257166073, 'tsl_mult': 0.48189201205385335, 'strategy': 'breakout', 'time_stop': 238, 'use_sma': False, 'use_atr': False, 'use_adx': True, 'use_ema': False, 'use_spike': True, 'rsi_required': True, 'edge_k': 1.117829405200934, 'edge_cap': 0.6914975691267018}.
[I 2025-08-29 18:52:49,374] Trial 220 finished with values: [-1000000000.0, 1000000000.0] and parameters: {'p_sma': 36, 'p_std': 33, 'p_atr': 9, 'p_adx': 12, 'rsi_period': 73, 'ema1': 9, 'ema2': 18, 'slip_atr_k': 0.0104299011965513, 'slip_spread_k': 0.5394782319294874, 'spread_hl_frac': 0.004670464643479271, 'bb_std_mult': 3.0297832838363403, 'rsi_os': 39, 'rsi_ob': 58, 'vol_spike': 0.12015577872821019, 'adx_thresh': 17.46429727637652, 'atr_min_pct': 0.006907263291186136, 'atr_max_pct': 0.04841493851640407, 'tp_mult': 2.5284190699622084, 'tsl_mult': 0.5285267352648506, 'strategy': 'breakout', 'time_stop': 198, 'use_sma': False, 'use_atr': False, 'use_adx': False, 'use_ema': False, 'use_spike': True, 'rsi_required': True, 'edge_k': 1.1093778183322485, 'edge_cap': 0.9311290392176071}.
[I 2025-08-29 18:53:19,343] Trial 224 finished with values: [0.001361320169998903, 0.000495843608295873] and parameters: {'p_sma': 32, 'p_std': 37, 'p_atr': 11, 'p_adx': 15, 'rsi_period': 73, 'ema1': 8, 'ema2': 17, 'slip_atr_k': 0.012469636827972426, 'slip_spread_k': 0.48525489240966546, 'spread_hl_frac': 0.0069320555252411434, 'bb_std_mult': 3.4276894379410754, 'rsi_os': 36, 'rsi_ob': 57, 'vol_spike': 0.05973327785038482, 'adx_thresh': 16.024112573787658, 'atr_min_pct': 0.00604240626772332, 'atr_max_pct': 0.10462895960274876, 'tp_mult': 2.4742981642344115, 'tsl_mult': 0.46246579170061586, 'strategy': 'mean_reversion', 'time_stop': 214, 'use_sma': False, 'use_atr': True, 'use_adx': True, 'use_ema': False, 'use_spike': True, 'rsi_required': True, 'edge_k': 1.1487989542541461, 'edge_cap': 0.5709481863716354}.
[I 2025-08-29 18:53:19,561] Trial 223 finished with values: [0.0013370683588489474, 0.00033571115686916705] and parameters: {'p_sma': 32, 'p_std': 53, 'p_atr': 11, 'p_adx': 15, 'rsi_period': 74, 'ema1': 12, 'ema2': 17, 'slip_atr_k': 0.011414103310392524, 'slip_spread_k': 0.3905910848745516, 'spread_hl_frac': 0.006353986064220902, 'bb_std_mult': 3.416981159881754, 'rsi_os': 36, 'rsi_ob': 57, 'vol_spike': 0.13420620714377612, 'adx_thresh': 16.06937569320031, 'atr_min_pct': 0.006200683608022318, 'atr_max_pct': 0.13940304065969716, 'tp_mult': 2.510469113690012, 'tsl_mult': 0.4501327537607085, 'strategy': 'mean_reversion', 'time_stop': 251, 'use_sma': True, 'use_atr': True, 'use_adx': True, 'use_ema': False, 'use_spike': True, 'rsi_required': True, 'edge_k': 1.1685109405725391, 'edge_cap': 0.9998246822325165}.
[I 2025-08-29 18:53:19,786] Trial 221 finished with values: [-1000000000.0, 1000000000.0] and parameters: {'p_sma': 36, 'p_std': 33, 'p_atr': 14, 'p_adx': 13, 'rsi_period': 72, 'ema1': 9, 'ema2': 18, 'slip_atr_k': 0.01042702329695698, 'slip_spread_k': 0.44173916633069615, 'spread_hl_frac': 0.001520847218603472, 'bb_std_mult': 3.434230319643129, 'rsi_os': 39, 'rsi_ob': 57, 'vol_spike': 0.11907213858834496, 'adx_thresh': 16.148549565339312, 'atr_min_pct': 0.006841949778074433, 'atr_max_pct': 0.060872159441237646, 'tp_mult': 2.527146755214395, 'tsl_mult': 0.4601928765750381, 'strategy': 'breakout', 'time_stop': 216, 'use_sma': False, 'use_atr': False, 'use_adx': False, 'use_ema': False, 'use_spike': True, 'rsi_required': True, 'edge_k': 1.1297726821593908, 'edge_cap': 0.5766678616452192}.
[I 2025-08-29 18:53:19,906] Trial 222 finished with values: [-1000000000.0, 1000000000.0] and parameters: {'p_sma': 32, 'p_std': 37, 'p_atr': 9, 'p_adx': 13, 'rsi_period': 73, 'ema1': 8, 'ema2': 18, 'slip_atr_k': 0.011228443706926439, 'slip_spread_k': 0.3902404175987753, 'spread_hl_frac': 0.006688350047219194, 'bb_std_mult': 3.0286476862098985, 'rsi_os': 39, 'rsi_ob': 57, 'vol_spike': 0.12084503381379756, 'adx_thresh': 16.201057289498817, 'atr_min_pct': 0.006663839353848283, 'atr_max_pct': 0.06074549626001671, 'tp_mult': 2.4944668861788237, 'tsl_mult': 0.45232256289989364, 'strategy': 'breakout', 'time_stop': 216, 'use_sma': False, 'use_atr': True, 'use_adx': True, 'use_ema': False, 'use_spike': True, 'rsi_required': True, 'edge_k': 1.1262784681302767, 'edge_cap': 0.9364956127290806}.
[I 2025-08-29 18:53:48,509] Trial 227 finished with values: [0.0010545115575351094, 0.00022551436238764667] and parameters: {'p_sma': 31, 'p_std': 53, 'p_atr': 12, 'p_adx': 15, 'rsi_period': 74, 'ema1': 8, 'ema2': 16, 'slip_atr_k': 0.010432709509564498, 'slip_spread_k': 0.4665963961986757, 'spread_hl_frac': 0.006114416375618929, 'bb_std_mult': 3.382878135203846, 'rsi_os': 35, 'rsi_ob': 57, 'vol_spike': 0.1362493784865285, 'adx_thresh': 16.00587551431251, 'atr_min_pct': 0.006027303440612519, 'atr_max_pct': 0.1375322298911866, 'tp_mult': 2.477812149312134, 'tsl_mult': 0.44970175785170263, 'strategy': 'mean_reversion', 'time_stop': 250, 'use_sma': True, 'use_atr': True, 'use_adx': True, 'use_ema': False, 'use_spike': True, 'rsi_required': True, 'edge_k': 1.24737242774698, 'edge_cap': 0.6451199522850686}.
[I 2025-08-29 18:53:48,833] Trial 228 finished with values: [0.0015064137071547634, 0.00026719200971001206] and parameters: {'p_sma': 31, 'p_std': 52, 'p_atr': 12, 'p_adx': 15, 'rsi_period': 74, 'ema1': 12, 'ema2': 14, 'slip_atr_k': 0.014449887477791704, 'slip_spread_k': 0.40961182089504855, 'spread_hl_frac': 0.00600053458005468, 'bb_std_mult': 3.3903679434609817, 'rsi_os': 36, 'rsi_ob': 57, 'vol_spike': 0.14190995556474956, 'adx_thresh': 15.825520931741979, 'atr_min_pct': 0.006019100421371432, 'atr_max_pct': 0.13821502744588038, 'tp_mult': 2.474465315653261, 'tsl_mult': 0.5503748637586943, 'strategy': 'mean_reversion', 'time_stop': 250, 'use_sma': True, 'use_atr': True, 'use_adx': True, 'use_ema': False, 'use_spike': True, 'rsi_required': True, 'edge_k': 1.262023323459029, 'edge_cap': 0.6418647731103376}.
[I 2025-08-29 18:53:49,027] Trial 226 finished with values: [0.0005355520766552324, 0.000548787815414047] and parameters: {'p_sma': 31, 'p_std': 53, 'p_atr': 12, 'p_adx': 15, 'rsi_period': 74, 'ema1': 8, 'ema2': 14, 'slip_atr_k': 0.012576955657452848, 'slip_spread_k': 0.39975951323308767, 'spread_hl_frac': 0.006910929392174653, 'bb_std_mult': 3.4295196381993676, 'rsi_os': 35, 'rsi_ob': 57, 'vol_spike': 0.1395104888125381, 'adx_thresh': 16.164709384868782, 'atr_min_pct': 0.005956641760250354, 'atr_max_pct': 0.13997684462082438, 'tp_mult': 2.4995858612607913, 'tsl_mult': 0.45122994975718894, 'strategy': 'mean_reversion', 'time_stop': 253, 'use_sma': True, 'use_atr': True, 'use_adx': True, 'use_ema': False, 'use_spike': True, 'rsi_required': True, 'edge_k': 1.248614663959691, 'edge_cap': 0.578391133203615}.
[I 2025-08-29 18:53:49,149] Trial 225 finished with values: [-1000000000.0, 1000000000.0] and parameters: {'p_sma': 31, 'p_std': 51, 'p_atr': 12, 'p_adx': 15, 'rsi_period': 73, 'ema1': 8, 'ema2': 12, 'slip_atr_k': 0.011993420133386126, 'slip_spread_k': 0.46657199374573666, 'spread_hl_frac': 0.006552947842004747, 'bb_std_mult': 3.419465677917779, 'rsi_os': 31, 'rsi_ob': 57, 'vol_spike': 0.06128622794915981, 'adx_thresh': 15.997507467114438, 'atr_min_pct': 0.006061790306459827, 'atr_max_pct': 0.10510626788986498, 'tp_mult': 2.5046242149618574, 'tsl_mult': 0.4576693753092423, 'strategy': 'mean_reversion', 'time_stop': 214, 'use_sma': False, 'use_atr': True, 'use_adx': True, 'use_ema': False, 'use_spike': True, 'rsi_required': True, 'edge_k': 1.1647409235805182, 'edge_cap': 0.5389213488410397}.
[I 2025-08-29 18:54:17,860] Trial 232 finished with values: [0.0006417368079350005, 0.0004107170441003813] and parameters: {'p_sma': 30, 'p_std': 53, 'p_atr': 13, 'p_adx': 17, 'rsi_period': 76, 'ema1': 11, 'ema2': 14, 'slip_atr_k': 0.013955361661805863, 'slip_spread_k': 0.4105741884628462, 'spread_hl_frac': 0.0058949860287292166, 'bb_std_mult': 3.4995211727071602, 'rsi_os': 35, 'rsi_ob': 60, 'vol_spike': 0.13969570654447766, 'adx_thresh': 15.785600837709001, 'atr_min_pct': 0.005971543272545731, 'atr_max_pct': 0.13904735985562353, 'tp_mult': 2.4640371560103764, 'tsl_mult': 0.5566342132493779, 'strategy': 'mean_reversion', 'time_stop': 251, 'use_sma': True, 'use_atr': True, 'use_adx': True, 'use_ema': False, 'use_spike': True, 'rsi_required': True, 'edge_k': 1.378485393235368, 'edge_cap': 0.6497310830887305}.
[I 2025-08-29 18:54:18,147] Trial 231 finished with values: [0.0013503490520341277, 0.000355143390993176] and parameters: {'p_sma': 31, 'p_std': 52, 'p_atr': 12, 'p_adx': 15, 'rsi_period': 75, 'ema1': 12, 'ema2': 14, 'slip_atr_k': 0.012199968567945804, 'slip_spread_k': 0.42035086730395166, 'spread_hl_frac': 0.005881176502853068, 'bb_std_mult': 3.3867612785873353, 'rsi_os': 35, 'rsi_ob': 61, 'vol_spike': 0.13861890588281334, 'adx_thresh': 15.861521043872402, 'atr_min_pct': 0.00593088707139106, 'atr_max_pct': 0.1393693419788742, 'tp_mult': 2.4779035563832483, 'tsl_mult': 0.5889071862081912, 'strategy': 'mean_reversion', 'time_stop': 244, 'use_sma': True, 'use_atr': True, 'use_adx': True, 'use_ema': False, 'use_spike': True, 'rsi_required': True, 'edge_k': 1.4087623678792618, 'edge_cap': 0.6492975550677249}.
[I 2025-08-29 18:54:18,255] Trial 229 finished with values: [0.0007345726852601153, 0.0003215157658586565] and parameters: {'p_sma': 31, 'p_std': 53, 'p_atr': 12, 'p_adx': 15, 'rsi_period': 76, 'ema1': 7, 'ema2': 14, 'slip_atr_k': 0.01298195919258002, 'slip_spread_k': 0.4130308023352911, 'spread_hl_frac': 0.006535962715431266, 'bb_std_mult': 3.4060415231717487, 'rsi_os': 35, 'rsi_ob': 59, 'vol_spike': 0.1435248203618881, 'adx_thresh': 16.075837789647274, 'atr_min_pct': 0.005919153074983667, 'atr_max_pct': 0.1383951103300595, 'tp_mult': 2.4701408972728007, 'tsl_mult': 0.37151043273262424, 'strategy': 'mean_reversion', 'time_stop': 253, 'use_sma': True, 'use_atr': True, 'use_adx': True, 'use_ema': False, 'use_spike': True, 'rsi_required': True, 'edge_k': 1.4071431636577578, 'edge_cap': 0.647480379589047}.
[I 2025-08-29 18:54:18,331] Trial 230 finished with values: [0.0010390708152610006, 0.0003399875355883631] and parameters: {'p_sma': 29, 'p_std': 52, 'p_atr': 12, 'p_adx': 15, 'rsi_period': 75, 'ema1': 13, 'ema2': 14, 'slip_atr_k': 0.013831122539225693, 'slip_spread_k': 0.41161371532191443, 'spread_hl_frac': 0.006013473313314735, 'bb_std_mult': 3.42009197366755, 'rsi_os': 35, 'rsi_ob': 60, 'vol_spike': 0.1425254284204233, 'adx_thresh': 15.910704494905882, 'atr_min_pct': 0.005928607400893828, 'atr_max_pct': 0.13921434809892386, 'tp_mult': 2.4771384807455994, 'tsl_mult': 0.5888655620518372, 'strategy': 'mean_reversion', 'time_stop': 251, 'use_sma': True, 'use_atr': True, 'use_adx': True, 'use_ema': False, 'use_spike': True, 'rsi_required': True, 'edge_k': 1.3603922984581385, 'edge_cap': 0.6325546095276137}.
[I 2025-08-29 18:54:47,014] Trial 236 finished with values: [0.0009120380836491471, 0.00029928733371410666] and parameters: {'p_sma': 30, 'p_std': 53, 'p_atr': 13, 'p_adx': 15, 'rsi_period': 76, 'ema1': 12, 'ema2': 14, 'slip_atr_k': 0.016060514753520824, 'slip_spread_k': 0.40567744563559216, 'spread_hl_frac': 0.0058629490606672205, 'bb_std_mult': 3.538629914702478, 'rsi_os': 35, 'rsi_ob': 60, 'vol_spike': 0.136281089235175, 'adx_thresh': 16.660553173218755, 'atr_min_pct': 0.005821529690605798, 'atr_max_pct': 0.13679541668964015, 'tp_mult': 2.467066673551529, 'tsl_mult': 0.5836294568853018, 'strategy': 'mean_reversion', 'time_stop': 248, 'use_sma': True, 'use_atr': True, 'use_adx': True, 'use_ema': False, 'use_spike': True, 'rsi_required': True, 'edge_k': 1.3464191210817904, 'edge_cap': 0.661979886828013}.
[I 2025-08-29 18:54:47,306] Trial 234 finished with values: [0.0006983209760047515, 0.0003115070321299913] and parameters: {'p_sma': 30, 'p_std': 53, 'p_atr': 12, 'p_adx': 15, 'rsi_period': 76, 'ema1': 12, 'ema2': 14, 'slip_atr_k': 0.014903104295685188, 'slip_spread_k': 0.4064782252703664, 'spread_hl_frac': 0.006285180431138355, 'bb_std_mult': 3.3941202480138126, 'rsi_os': 35, 'rsi_ob': 60, 'vol_spike': 0.14459072496589137, 'adx_thresh': 15.850912711509137, 'atr_min_pct': 0.00586875219924956, 'atr_max_pct': 0.13913581230973743, 'tp_mult': 2.4752280661613906, 'tsl_mult': 0.5560978540689285, 'strategy': 'mean_reversion', 'time_stop': 249, 'use_sma': True, 'use_atr': True, 'use_adx': True, 'use_ema': False, 'use_spike': True, 'rsi_required': True, 'edge_k': 1.3940981214477364, 'edge_cap': 0.6365729185766171}.
[I 2025-08-29 18:54:47,318] Trial 235 finished with values: [0.0012757009738106895, 0.0002476410879566989] and parameters: {'p_sma': 30, 'p_std': 53, 'p_atr': 13, 'p_adx': 15, 'rsi_period': 75, 'ema1': 12, 'ema2': 14, 'slip_atr_k': 0.012099416726192823, 'slip_spread_k': 0.4103672260425703, 'spread_hl_frac': 0.005825083036783412, 'bb_std_mult': 3.377892544692199, 'rsi_os': 35, 'rsi_ob': 60, 'vol_spike': 0.14193562725111117, 'adx_thresh': 15.855499141198893, 'atr_min_pct': 0.005970037735298058, 'atr_max_pct': 0.13944864064962664, 'tp_mult': 2.474302961684328, 'tsl_mult': 0.5919196698939652, 'strategy': 'mean_reversion', 'time_stop': 252, 'use_sma': True, 'use_atr': True, 'use_adx': True, 'use_ema': False, 'use_spike': True, 'rsi_required': True, 'edge_k': 1.4000814795703382, 'edge_cap': 0.6450597317280757}.
[I 2025-08-29 18:54:47,532] Trial 233 finished with values: [0.0011470376375348756, 0.0004656344486939203] and parameters: {'p_sma': 30, 'p_std': 52, 'p_atr': 12, 'p_adx': 16, 'rsi_period': 76, 'ema1': 12, 'ema2': 14, 'slip_atr_k': 0.01633909073367439, 'slip_spread_k': 0.40938238404491284, 'spread_hl_frac': 0.005743647019918122, 'bb_std_mult': 3.483988008777579, 'rsi_os': 36, 'rsi_ob': 60, 'vol_spike': 0.1414392821613175, 'adx_thresh': 16.038379753098067, 'atr_min_pct': 0.006009998899741559, 'atr_max_pct': 0.138171920941002, 'tp_mult': 2.473996557854414, 'tsl_mult': 0.5568617064027908, 'strategy': 'mean_reversion', 'time_stop': 252, 'use_sma': True, 'use_atr': True, 'use_adx': True, 'use_ema': False, 'use_spike': True, 'rsi_required': True, 'edge_k': 1.3427872590247476, 'edge_cap': 0.6487702964646842}.
[I 2025-08-29 18:55:18,038] Trial 240 finished with values: [0.0006024360240179938, 0.00041152249705796656] and parameters: {'p_sma': 30, 'p_std': 54, 'p_atr': 13, 'p_adx': 15, 'rsi_period': 76, 'ema1': 12, 'ema2': 14, 'slip_atr_k': 0.014735373498460116, 'slip_spread_k': 0.40063209970649927, 'spread_hl_frac': 0.005992707187457665, 'bb_std_mult': 3.378957007683912, 'rsi_os': 35, 'rsi_ob': 61, 'vol_spike': 0.14130010903467255, 'adx_thresh': 16.474502176483565, 'atr_min_pct': 0.005985193618676043, 'atr_max_pct': 0.1374347942625493, 'tp_mult': 2.471032001514071, 'tsl_mult': 0.5877146267282766, 'strategy': 'mean_reversion', 'time_stop': 251, 'use_sma': True, 'use_atr': True, 'use_adx': True, 'use_ema': False, 'use_spike': True, 'rsi_required': True, 'edge_k': 1.3455463764184112, 'edge_cap': 0.6445703644147881}.
[I 2025-08-29 18:55:18,844] Trial 239 finished with values: [-1000000000.0, 1000000000.0] and parameters: {'p_sma': 30, 'p_std': 53, 'p_atr': 13, 'p_adx': 15, 'rsi_period': 75, 'ema1': 12, 'ema2': 14, 'slip_atr_k': 0.01442816102881274, 'slip_spread_k': 0.4074385255007614, 'spread_hl_frac': 0.006026037114626389, 'bb_std_mult': 3.349833437413183, 'rsi_os': 35, 'rsi_ob': 60, 'vol_spike': 0.14310857837972313, 'adx_thresh': 16.691064032670834, 'atr_min_pct': 0.008532533025592122, 'atr_max_pct': 0.13889100558116024, 'tp_mult': 2.4755146527172127, 'tsl_mult': 0.5916575921222248, 'strategy': 'mean_reversion', 'time_stop': 251, 'use_sma': True, 'use_atr': True, 'use_adx': True, 'use_ema': False, 'use_spike': True, 'rsi_required': True, 'edge_k': 1.325813570858354, 'edge_cap': 0.6402873473270766}.
[I 2025-08-29 18:55:18,844] Trial 237 finished with values: [0.000789828317663277, 0.0003215897899313476] and parameters: {'p_sma': 30, 'p_std': 53, 'p_atr': 13, 'p_adx': 15, 'rsi_period': 76, 'ema1': 12, 'ema2': 14, 'slip_atr_k': 0.015867106863217125, 'slip_spread_k': 0.4074391351562888, 'spread_hl_frac': 0.005699257054132184, 'bb_std_mult': 3.3587902896612194, 'rsi_os': 35, 'rsi_ob': 59, 'vol_spike': 0.14313816784404446, 'adx_thresh': 16.720140647061164, 'atr_min_pct': 0.005797973104116556, 'atr_max_pct': 0.13635917983205698, 'tp_mult': 2.4721457052427898, 'tsl_mult': 0.5923714693649749, 'strategy': 'mean_reversion', 'time_stop': 251, 'use_sma': True, 'use_atr': True, 'use_adx': True, 'use_ema': False, 'use_spike': True, 'rsi_required': True, 'edge_k': 1.3445366246511663, 'edge_cap': 0.6412567971196903}.
[I 2025-08-29 18:55:18,857] Trial 238 finished with values: [0.0013376741333559483, 0.0002003360052087874] and parameters: {'p_sma': 30, 'p_std': 53, 'p_atr': 13, 'p_adx': 15, 'rsi_period': 75, 'ema1': 12, 'ema2': 14, 'slip_atr_k': 0.014702373041959024, 'slip_spread_k': 0.4074858335270216, 'spread_hl_frac': 0.0058999028216737, 'bb_std_mult': 3.375423010652146, 'rsi_os': 35, 'rsi_ob': 59, 'vol_spike': 0.14089604731225494, 'adx_thresh': 15.831468023721873, 'atr_min_pct': 0.005927250716828715, 'atr_max_pct': 0.13895886464713156, 'tp_mult': 2.472551955340866, 'tsl_mult': 0.5902611683206161, 'strategy': 'mean_reversion', 'time_stop': 252, 'use_sma': True, 'use_atr': True, 'use_adx': True, 'use_ema': False, 'use_spike': True, 'rsi_required': True, 'edge_k': 1.327722590209007, 'edge_cap': 0.6461687601301019}.
[I 2025-08-29 18:55:48,976] Trial 241 finished with values: [0.0007530306848573254, 0.00030187509901790824] and parameters: {'p_sma': 30, 'p_std': 53, 'p_atr': 13, 'p_adx': 15, 'rsi_period': 76, 'ema1': 12, 'ema2': 14, 'slip_atr_k': 0.012857932202013714, 'slip_spread_k': 0.39229625987296685, 'spread_hl_frac': 0.00567432512598187, 'bb_std_mult': 3.3928910999385136, 'rsi_os': 35, 'rsi_ob': 60, 'vol_spike': 0.1426113576385351, 'adx_thresh': 16.593619413501084, 'atr_min_pct': 0.005901642212155423, 'atr_max_pct': 0.13903007942237408, 'tp_mult': 2.472530079276496, 'tsl_mult': 0.5815910895931076, 'strategy': 'mean_reversion', 'time_stop': 250, 'use_sma': True, 'use_atr': True, 'use_adx': True, 'use_ema': False, 'use_spike': True, 'rsi_required': True, 'edge_k': 1.3469054876922781, 'edge_cap': 0.6434992782708521}.
[I 2025-08-29 18:55:49,487] Trial 242 finished with values: [0.0007988691701013018, 0.00029508782068602026] and parameters: {'p_sma': 31, 'p_std': 55, 'p_atr': 12, 'p_adx': 15, 'rsi_period': 77, 'ema1': 12, 'ema2': 14, 'slip_atr_k': 0.007715909718746545, 'slip_spread_k': 0.418422741446428, 'spread_hl_frac': 0.00533006586364346, 'bb_std_mult': 3.4035723815731647, 'rsi_os': 35, 'rsi_ob': 61, 'vol_spike': 0.13488205178323145, 'adx_thresh': 16.037928066067604, 'atr_min_pct': 0.005946439927954723, 'atr_max_pct': 0.13607374454988722, 'tp_mult': 2.4689426798293455, 'tsl_mult': 0.5811666924878451, 'strategy': 'mean_reversion', 'time_stop': 254, 'use_sma': True, 'use_atr': True, 'use_adx': True, 'use_ema': False, 'use_spike': True, 'rsi_required': True, 'edge_k': 1.26815253579539, 'edge_cap': 0.6561046938523175}.
