[I 2025-08-29 18:35:15,269] Trial 53 finished with values: [-1000000000.0, 1000000000.0] and parameters: {'p_sma': 12, 'p_std': 56, 'p_atr': 20, 'p_adx': 28, 'rsi_period': 76, 'ema1': 10, 'ema2': 34, 'slip_atr_k': 0.10330957073017791, 'slip_spread_k': 0.4164998353150161, 'spread_hl_frac': 0.026605082910216567, 'bb_std_mult': 3.2984158855152037, 'rsi_os': 29, 'rsi_ob': 62, 'vol_spike': 0.05588435447356581, 'adx_thresh': 17.64740000630823, 'atr_min_pct': 0.004991833037108061, 'atr_max_pct': 0.08938831361466014, 'tp_mult': 2.554941887448573, 'tsl_mult': 0.9141120223012191, 'strategy': 'breakout', 'time_stop': 183, 'use_sma': False, 'use_atr': True, 'use_adx': False, 'use_ema': True, 'use_spike': True, 'rsi_required': False, 'edge_k': 0.3478025935871234, 'edge_cap': 0.06344452104969389}.
[I 2025-08-29 18:35:15,410] Trial 52 finished with values: [-0.0011430524460563918, 0.001120661348221454] and parameters: {'p_sma': 37, 'p_std': 31, 'p_atr': 20, 'p_adx': 22, 'rsi_period': 63, 'ema1': 8, 'ema2': 22, 'slip_atr_k': 0.10253511744578164, 'slip_spread_k': 0.31599022080405215, 'spread_hl_frac': 0.04504312568298271, 'bb_std_mult': 1.849362544200273, 'rsi_os': 37, 'rsi_ob': 67, 'vol_spike': 0.18783996042023993, 'adx_thresh': 18.399166087466536, 'atr_min_pct': 0.004484943951265526, 'atr_max_pct': 0.08817918180846951, 'tp_mult': 2.5502304010492285, 'tsl_mult': 0.22179475281034466, 'strategy': 'breakout', 'time_stop': 19, 'use_sma': False, 'use_atr': True, 'use_adx': False, 'use_ema': True, 'use_spike': True, 'rsi_required': False, 'edge_k': 0.3581198740767344, 'edge_cap': 0.9267673229253954}.
[I 2025-08-29 18:35:15,475] Trial 56 finished with values: [-1000000000.0, 1000000000.0] and parameters: {'p_sma': 13, 'p_std': 41, 'p_atr': 19, 'p_adx': 24, 'rsi_period': 63, 'ema1': 8, 'ema2': 58, 'slip_atr_k': 0.10114916081513552, 'slip_spread_k': 0.38831380578480146, 'spread_hl_frac': 0.021670424023416436, 'bb_std_mult': 1.6313125809489408, 'rsi_os': 20, 'rsi_ob': 67, 'vol_spike': 0.057056870674714176, 'adx_thresh': 12.519170412645074, 'atr_min_pct': 0.027312484330483174, 'atr_max_pct': 0.10726066675767029, 'tp_mult': 2.3683801074548096, 'tsl_mult': 0.9371676586946012, 'strategy': 'mean_reversion', 'time_stop': 177, 'use_sma': True, 'use_atr': True, 'use_adx': False, 'use_ema': True, 'use_spike': True, 'rsi_required': False, 'edge_k': 0.36589779887488494, 'edge_cap': 0.7449065389530902}.
[I 2025-08-29 18:35:42,416] Trial 58 finished with values: [-1000000000.0, 1000000000.0] and parameters: {'p_sma': 29, 'p_std': 42, 'p_atr': 7, 'p_adx': 19, 'rsi_period': 64, 'ema1': 23, 'ema2': 16, 'slip_atr_k': 0.18650485710351644, 'slip_spread_k': 0.9974533169839825, 'spread_hl_frac': 0.04487118600948366, 'bb_std_mult': 1.6510550477702608, 'rsi_os': 38, 'rsi_ob': 51, 'vol_spike': 0.1809303709752878, 'adx_thresh': 12.608428698836956, 'atr_min_pct': 0.026892714240894372, 'atr_max_pct': 0.029264287891233844, 'tp_mult': 2.365017288657865, 'tsl_mult': 0.39393337878176304, 'strategy': 'breakout', 'time_stop': 234, 'use_sma': False, 'use_atr': True, 'use_adx': False, 'use_ema': False, 'use_spike': False, 'rsi_required': False, 'edge_k': 0.09269476508999289, 'edge_cap': 0.9451048073230506}.
[I 2025-08-29 18:35:42,763] Trial 60 finished with values: [-0.051917897558721005, 0.051910135881042] and parameters: {'p_sma': 54, 'p_std': 35, 'p_atr': 14, 'p_adx': 19, 'rsi_period': 69, 'ema1': 23, 'ema2': 43, 'slip_atr_k': 0.19058253765823638, 'slip_spread_k': 0.8355759191940022, 'spread_hl_frac': 0.04628034692459741, 'bb_std_mult': 2.396072945960675, 'rsi_os': 37, 'rsi_ob': 59, 'vol_spike': 0.17640390233068742, 'adx_thresh': 13.069416828832653, 'atr_min_pct': 0.00020811174725190486, 'atr_max_pct': 0.1439519308589245, 'tp_mult': 2.1784913065464666, 'tsl_mult': 0.41048343334067355, 'strategy': 'breakout', 'time_stop': 150, 'use_sma': False, 'use_atr': True, 'use_adx': False, 'use_ema': False, 'use_spike': False, 'rsi_required': False, 'edge_k': 0.9429794098735207, 'edge_cap': 0.45478118703456255}.
[I 2025-08-29 18:35:42,869] Trial 59 finished with values: [-0.04035504291806369, 0.04034642343497316] and parameters: {'p_sma': 29, 'p_std': 41, 'p_atr': 22, 'p_adx': 19, 'rsi_period': 69, 'ema1': 21, 'ema2': 44, 'slip_atr_k': 0.18749364158261617, 'slip_spread_k': 0.8147201794327352, 'spread_hl_frac': 0.02971061682700885, 'bb_std_mult': 1.6353410319763102, 'rsi_os': 39, 'rsi_ob': 58, 'vol_spike': 0.1764738258487169, 'adx_thresh': 12.486421000795813, 'atr_min_pct': 0.0005150025588613718, 'atr_max_pct': 0.14974976642109109, 'tp_mult': 2.3545697120060494, 'tsl_mult': 0.1518851824526905, 'strategy': 'breakout', 'time_stop': 234, 'use_sma': False, 'use_atr': True, 'use_adx': False, 'use_ema': False, 'use_spike': False, 'rsi_required': False, 'edge_k': 1.940406151281743, 'edge_cap': 0.46158151026046174}.
[I 2025-08-29 18:35:43,160] Trial 57 finished with values: [-1000000000.0, 1000000000.0] and parameters: {'p_sma': 12, 'p_std': 42, 'p_atr': 20, 'p_adx': 19, 'rsi_period': 75, 'ema1': 23, 'ema2': 58, 'slip_atr_k': 0.18618659191034753, 'slip_spread_k': 0.4126115198564163, 'spread_hl_frac': 0.020521964509527257, 'bb_std_mult': 1.6873434266688174, 'rsi_os': 31, 'rsi_ob': 67, 'vol_spike': 0.06063700149111228, 'adx_thresh': 7.604129003022369, 'atr_min_pct': 0.02282707047718828, 'atr_max_pct': 0.141535660265921, 'tp_mult': 2.361394097469373, 'tsl_mult': 0.3690365377153354, 'strategy': 'breakout', 'time_stop': 153, 'use_sma': False, 'use_atr': True, 'use_adx': False, 'use_ema': False, 'use_spike': True, 'rsi_required': False, 'edge_k': 1.98711820084883, 'edge_cap': 0.943016496439385}.
[I 2025-08-29 18:35:43,256] Trial 62 finished with values: [-1000000000.0, 1000000000.0] and parameters: {'p_sma': 6, 'p_std': 32, 'p_atr': 28, 'p_adx': 22, 'rsi_period': 57, 'ema1': 21, 'ema2': 44, 'slip_atr_k': 0.0520217161393894, 'slip_spread_k': 0.31620701245499266, 'spread_hl_frac': 0.003611335983299522, 'bb_std_mult': 1.7619702319298554, 'rsi_os': 31, 'rsi_ob': 57, 'vol_spike': 0.12026971925363163, 'adx_thresh': 25.749563801829815, 'atr_min_pct': 0.02280466396565186, 'atr_max_pct': 0.01587091412848591, 'tp_mult': 2.880151355697179, 'tsl_mult': 0.0563793545698571, 'strategy': 'breakout', 'time_stop': 282, 'use_sma': False, 'use_atr': True, 'use_adx': False, 'use_ema': True, 'use_spike': False, 'rsi_required': False, 'edge_k': 1.9219869880478608, 'edge_cap': 0.21133670209227984}.
[I 2025-08-29 18:36:10,273] Trial 61 finished with values: [-0.0021182747924433087, 0.002233732836723869] and parameters: {'p_sma': 5, 'p_std': 32, 'p_atr': 22, 'p_adx': 22, 'rsi_period': 83, 'ema1': 21, 'ema2': 44, 'slip_atr_k': 0.0017078045206247866, 'slip_spread_k': 0.6285512987341964, 'spread_hl_frac': 0.030352631558412713, 'bb_std_mult': 1.1797045435108124, 'rsi_os': 35, 'rsi_ob': 58, 'vol_spike': 0.12699900731328717, 'adx_thresh': 26.783015311477833, 'atr_min_pct': 0.0001606051484030614, 'atr_max_pct': 0.1449432344899016, 'tp_mult': 2.7128977590960743, 'tsl_mult': 0.13292472153582308, 'strategy': 'breakout', 'time_stop': 39, 'use_sma': False, 'use_atr': True, 'use_adx': False, 'use_ema': False, 'use_spike': False, 'rsi_required': False, 'edge_k': 1.9868355839050693, 'edge_cap': 0.17752845092766018}.
[I 2025-08-29 18:36:11,090] Trial 65 finished with values: [-1000000000.0, 1000000000.0] and parameters: {'p_sma': 7, 'p_std': 45, 'p_atr': 9, 'p_adx': 25, 'rsi_period': 9, 'ema1': 27, 'ema2': 49, 'slip_atr_k': 0.07991482294016963, 'slip_spread_k': 0.7255833426795162, 'spread_hl_frac': 0.03122321143292065, 'bb_std_mult': 1.1796626739288438, 'rsi_os': 23, 'rsi_ob': 81, 'vol_spike': 0.15967902286861385, 'adx_thresh': 32.83431009645291, 'atr_min_pct': 0.019697178486247975, 'atr_max_pct': 0.06874466137800248, 'tp_mult': 1.5153588269889986, 'tsl_mult': 0.2658067432737243, 'strategy': 'mean_reversion', 'time_stop': 41, 'use_sma': True, 'use_atr': True, 'use_adx': False, 'use_ema': True, 'use_spike': False, 'rsi_required': True, 'edge_k': 0.016690411066743724, 'edge_cap': 0.8407560689628124}.
[I 2025-08-29 18:36:11,338] Trial 63 finished with values: [-1000000000.0, 1000000000.0] and parameters: {'p_sma': 6, 'p_std': 31, 'p_atr': 28, 'p_adx': 22, 'rsi_period': 56, 'ema1': 25, 'ema2': 58, 'slip_atr_k': 0.2272115952939969, 'slip_spread_k': 0.7108016634603417, 'spread_hl_frac': 0.003737784502656754, 'bb_std_mult': 1.8546434317130591, 'rsi_os': 33, 'rsi_ob': 80, 'vol_spike': 0.1188909766878757, 'adx_thresh': 25.42002534822224, 'atr_min_pct': 0.009204895092587866, 'atr_max_pct': 0.07071374514616836, 'tp_mult': 2.8832100441577673, 'tsl_mult': 0.31774719982040356, 'strategy': 'breakout', 'time_stop': 40, 'use_sma': False, 'use_atr': True, 'use_adx': False, 'use_ema': True, 'use_spike': False, 'rsi_required': False, 'edge_k': 0.01129599561211753, 'edge_cap': 0.21556278042468058}.
[I 2025-08-29 18:36:11,471] Trial 64 finished with values: [-1000000000.0, 1000000000.0] and parameters: {'p_sma': 6, 'p_std': 60, 'p_atr': 28, 'p_adx': 22, 'rsi_period': 9, 'ema1': 25, 'ema2': 40, 'slip_atr_k': 0.0029311510366216292, 'slip_spread_k': 0.1425654840995862, 'spread_hl_frac': 0.003923179661586805, 'bb_std_mult': 1.8111696511719801, 'rsi_os': 22, 'rsi_ob': 79, 'vol_spike': 0.11807043958363543, 'adx_thresh': 26.191116265297126, 'atr_min_pct': 0.009460937981273548, 'atr_max_pct': 0.046058727317047715, 'tp_mult': 2.907803159983771, 'tsl_mult': 0.054174691948075504, 'strategy': 'breakout', 'time_stop': 40, 'use_sma': False, 'use_atr': True, 'use_adx': False, 'use_ema': True, 'use_spike': False, 'rsi_required': True, 'edge_k': 0.03355579613805112, 'edge_cap': 0.19120073932539827}.
[I 2025-08-29 18:36:40,027] Trial 66 finished with values: [-1000000000.0, 1000000000.0] and parameters: {'p_sma': 7, 'p_std': 60, 'p_atr': 16, 'p_adx': 20, 'rsi_period': 25, 'ema1': 25, 'ema2': 51, 'slip_atr_k': 0.001382781720961207, 'slip_spread_k': 0.7284300897712574, 'spread_hl_frac': 0.01547234659232819, 'bb_std_mult': 1.8913257433253077, 'rsi_os': 51, 'rsi_ob': 80, 'vol_spike': 0.1019969070440182, 'adx_thresh': 15.031087542207477, 'atr_min_pct': 0.020069684419701982, 'atr_max_pct': 0.04570324290964101, 'tp_mult': 1.5232582415370381, 'tsl_mult': 0.3271900514044209, 'strategy': 'breakout', 'time_stop': 7, 'use_sma': False, 'use_atr': True, 'use_adx': False, 'use_ema': True, 'use_spike': False, 'rsi_required': False, 'edge_k': 0.03499256380781626, 'edge_cap': 0.8401600658525982}.
[I 2025-08-29 18:36:40,168] Trial 67 finished with values: [-1000000000.0, 1000000000.0] and parameters: {'p_sma': 5, 'p_std': 5, 'p_atr': 10, 'p_adx': 20, 'rsi_period': 31, 'ema1': 29, 'ema2': 52, 'slip_atr_k': 0.0007147795022179881, 'slip_spread_k': 0.6325641935007229, 'spread_hl_frac': 0.03425437271056398, 'bb_std_mult': 1.9092184168500537, 'rsi_os': 8, 'rsi_ob': 55, 'vol_spike': 0.09721091092360792, 'adx_thresh': 10.041353994826432, 'atr_min_pct': 0.00924017359506889, 'atr_max_pct': 0.04162169674361512, 'tp_mult': 1.2160837817759882, 'tsl_mult': 0.32420778278959866, 'strategy': 'breakout', 'time_stop': 14, 'use_sma': False, 'use_atr': True, 'use_adx': True, 'use_ema': True, 'use_spike': False, 'rsi_required': False, 'edge_k': 0.06842046631267708, 'edge_cap': 0.9906412224017948}.
[I 2025-08-29 18:36:40,634] Trial 69 finished with values: [-0.00025477680306684736, 0.0007597819405370453] and parameters: {'p_sma': 11, 'p_std': 17, 'p_atr': 16, 'p_adx': 21, 'rsi_period': 30, 'ema1': 6, 'ema2': 52, 'slip_atr_k': 0.02491206536898588, 'slip_spread_k': 0.6575108467738331, 'spread_hl_frac': 0.034615800931724026, 'bb_std_mult': 2.0097864561610512, 'rsi_os': 8, 'rsi_ob': 55, 'vol_spike': 0.036576624932223266, 'adx_thresh': 14.887096447849988, 'atr_min_pct': 0.005554064720029825, 'atr_max_pct': 0.05509360548793922, 'tp_mult': 1.817221396497626, 'tsl_mult': 0.3251970609141818, 'strategy': 'breakout', 'time_stop': 15, 'use_sma': False, 'use_atr': False, 'use_adx': True, 'use_ema': True, 'use_spike': False, 'rsi_required': False, 'edge_k': 0.09654619868456638, 'edge_cap': 0.6429747616340051}.
[I 2025-08-29 18:36:40,750] Trial 68 finished with values: [-1000000000.0, 1000000000.0] and parameters: {'p_sma': 10, 'p_std': 5, 'p_atr': 23, 'p_adx': 21, 'rsi_period': 82, 'ema1': 14, 'ema2': 50, 'slip_atr_k': 0.0027488679184766024, 'slip_spread_k': 0.1805629705609183, 'spread_hl_frac': 0.014957409338138153, 'bb_std_mult': 1.4157217085310072, 'rsi_os': 51, 'rsi_ob': 61, 'vol_spike': 0.10022454553879884, 'adx_thresh': 14.927731468040799, 'atr_min_pct': 0.00602546738996163, 'atr_max_pct': 0.04566176670402418, 'tp_mult': 2.701040246504663, 'tsl_mult': 0.7777347280496998, 'strategy': 'breakout', 'time_stop': 6, 'use_sma': False, 'use_atr': False, 'use_adx': True, 'use_ema': True, 'use_spike': False, 'rsi_required': False, 'edge_k': 0.08732623120442468, 'edge_cap': 0.3608449017298429}.
[I 2025-08-29 18:37:09,198] Trial 70 finished with values: [0.0004777471464683103, 0.0002965666944407494] and parameters: {'p_sma': 11, 'p_std': 35, 'p_atr': 10, 'p_adx': 21, 'rsi_period': 74, 'ema1': 29, 'ema2': 19, 'slip_atr_k': 0.026522705949090425, 'slip_spread_k': 0.6071792777165832, 'spread_hl_frac': 0.028507778825849376, 'bb_std_mult': 2.169880653424072, 'rsi_os': 42, 'rsi_ob': 54, 'vol_spike': 0.02576392837104445, 'adx_thresh': 14.42290037591844, 'atr_min_pct': 0.005148713656760413, 'atr_max_pct': 0.01749822785119175, 'tp_mult': 1.1975132318839765, 'tsl_mult': 0.17145065603226944, 'strategy': 'breakout', 'time_stop': 20, 'use_sma': False, 'use_atr': False, 'use_adx': True, 'use_ema': True, 'use_spike': False, 'rsi_required': False, 'edge_k': 1.106784857059768, 'edge_cap': 0.9968723502886523}.
[I 2025-08-29 18:37:09,345] Trial 73 finished with values: [-1000000000.0, 1000000000.0] and parameters: {'p_sma': 22, 'p_std': 16, 'p_atr': 18, 'p_adx': 18, 'rsi_period': 34, 'ema1': 6, 'ema2': 14, 'slip_atr_k': 0.01683807342764604, 'slip_spread_k': 0.5453936213408384, 'spread_hl_frac': 0.03902676819051758, 'bb_std_mult': 2.0327732879786864, 'rsi_os': 7, 'rsi_ob': 54, 'vol_spike': 0.029999443146463287, 'adx_thresh': 19.45650289714557, 'atr_min_pct': 0.018232743417346903, 'atr_max_pct': 0.08394388173696277, 'tp_mult': 1.7990656789800712, 'tsl_mult': 0.4391465492777784, 'strategy': 'mean_reversion', 'time_stop': 23, 'use_sma': True, 'use_atr': False, 'use_adx': True, 'use_ema': True, 'use_spike': False, 'rsi_required': False, 'edge_k': 0.24307555331775307, 'edge_cap': 0.6363609709178625}.
[I 2025-08-29 18:37:09,617] Trial 71 finished with values: [-1000000000.0, 1000000000.0] and parameters: {'p_sma': 9, 'p_std': 17, 'p_atr': 26, 'p_adx': 21, 'rsi_period': 49, 'ema1': 19, 'ema2': 20, 'slip_atr_k': 0.025288064616865065, 'slip_spread_k': 0.36219800703576227, 'spread_hl_frac': 0.02899047554679132, 'bb_std_mult': 2.0299984989035487, 'rsi_os': 16, 'rsi_ob': 61, 'vol_spike': 0.03028905935026436, 'adx_thresh': 14.318581638792683, 'atr_min_pct': 0.005486290943435625, 'atr_max_pct': 0.05695535690824053, 'tp_mult': 2.695801003696591, 'tsl_mult': 0.7979565520480714, 'strategy': 'breakout', 'time_stop': 22, 'use_sma': False, 'use_atr': False, 'use_adx': True, 'use_ema': True, 'use_spike': False, 'rsi_required': False, 'edge_k': 0.22606531544647146, 'edge_cap': 0.3372807839455686}.
[I 2025-08-29 18:37:09,697] Trial 72 finished with values: [-1000000000.0, 1000000000.0] and parameters: {'p_sma': 22, 'p_std': 17, 'p_atr': 18, 'p_adx': 17, 'rsi_period': 34, 'ema1': 6, 'ema2': 18, 'slip_atr_k': 0.01973029663855155, 'slip_spread_k': 0.372269209213271, 'spread_hl_frac': 0.007496535533968729, 'bb_std_mult': 2.1554232534402287, 'rsi_os': 7, 'rsi_ob': 53, 'vol_spike': 0.0292197755866788, 'adx_thresh': 15.963013012033267, 'atr_min_pct': 0.018012444737891577, 'atr_max_pct': 0.08689169172199437, 'tp_mult': 1.784096429561401, 'tsl_mult': 0.5465105098440466, 'strategy': 'breakout', 'time_stop': 26, 'use_sma': False, 'use_atr': False, 'use_adx': True, 'use_ema': True, 'use_spike': False, 'rsi_required': False, 'edge_k': 0.22581295582640237, 'edge_cap': 0.65259003809254}.
[I 2025-08-29 18:37:38,365] Trial 74 finished with values: [-1000000000.0, 1000000000.0] and parameters: {'p_sma': 17, 'p_std': 18, 'p_atr': 14, 'p_adx': 21, 'rsi_period': 73, 'ema1': 30, 'ema2': 18, 'slip_atr_k': 0.017508828625796814, 'slip_spread_k': 0.5358996196433979, 'spread_hl_frac': 0.00013115574929471394, 'bb_std_mult': 2.607208575557359, 'rsi_os': 43, 'rsi_ob': 53, 'vol_spike': 0.031618126046063996, 'adx_thresh': 15.759568633624282, 'atr_min_pct': 0.007713627352752326, 'atr_max_pct': 0.014690870706342335, 'tp_mult': 1.0389218067612862, 'tsl_mult': 0.1684867095888187, 'strategy': 'breakout', 'time_stop': 22, 'use_sma': False, 'use_atr': False, 'use_adx': True, 'use_ema': True, 'use_spike': False, 'rsi_required': False, 'edge_k': 1.1025452568287575, 'edge_cap': 0.97505228770175}.
[I 2025-08-29 18:37:39,046] Trial 77 finished with values: [-1000000000.0, 1000000000.0] and parameters: {'p_sma': 27, 'p_std': 35, 'p_atr': 8, 'p_adx': 15, 'rsi_period': 74, 'ema1': 29, 'ema2': 25, 'slip_atr_k': 0.03203398328738261, 'slip_spread_k': 0.6166094546216339, 'spread_hl_frac': 0.02828934416505091, 'bb_std_mult': 2.3154193102581324, 'rsi_os': 42, 'rsi_ob': 48, 'vol_spike': 0.0001455204335323243, 'adx_thresh': 24.502033723783203, 'atr_min_pct': 0.007835148799892201, 'atr_max_pct': 0.0173051313274265, 'tp_mult': 1.0214651312167098, 'tsl_mult': 0.10368428974257084, 'strategy': 'breakout', 'time_stop': 266, 'use_sma': False, 'use_atr': False, 'use_adx': True, 'use_ema': True, 'use_spike': True, 'rsi_required': True, 'edge_k': 1.0928718009925518, 'edge_cap': 0.97807325227104}.
[I 2025-08-29 18:37:39,177] Trial 75 finished with values: [-1000000000.0, 1000000000.0] and parameters: {'p_sma': 27, 'p_std': 52, 'p_atr': 26, 'p_adx': 21, 'rsi_period': 74, 'ema1': 30, 'ema2': 19, 'slip_atr_k': 0.026396912610026402, 'slip_spread_k': 0.6623919361281239, 'spread_hl_frac': 0.028221493647990786, 'bb_std_mult': 2.3926037178023223, 'rsi_os': 42, 'rsi_ob': 52, 'vol_spike': 0.026831439124375425, 'adx_thresh': 14.273179850774246, 'atr_min_pct': 0.008055159468884918, 'atr_max_pct': 0.016294772647774573, 'tp_mult': 1.042799133846068, 'tsl_mult': 0.11236967722716878, 'strategy': 'breakout', 'time_stop': 300, 'use_sma': False, 'use_atr': False, 'use_adx': True, 'use_ema': True, 'use_spike': True, 'rsi_required': False, 'edge_k': 1.0445797949862945, 'edge_cap': 0.9747766316562861}.
[I 2025-08-29 18:37:39,270] Trial 76 finished with values: [-1000000000.0, 1000000000.0] and parameters: {'p_sma': 17, 'p_std': 36, 'p_atr': 14, 'p_adx': 17, 'rsi_period': 74, 'ema1': 30, 'ema2': 25, 'slip_atr_k': 0.03221997081672528, 'slip_spread_k': 0.6666560949752884, 'spread_hl_frac': 0.02559212593621566, 'bb_std_mult': 2.3656155021612895, 'rsi_os': 42, 'rsi_ob': 52, 'vol_spike': 0.013628588865419018, 'adx_thresh': 16.21701884204161, 'atr_min_pct': 0.006729518812230335, 'atr_max_pct': 0.016001565765659337, 'tp_mult': 1.0716579581482675, 'tsl_mult': 0.1770230671985897, 'strategy': 'breakout', 'time_stop': 64, 'use_sma': False, 'use_atr': False, 'use_adx': True, 'use_ema': True, 'use_spike': True, 'rsi_required': False, 'edge_k': 1.0836029181462838, 'edge_cap': 0.9710791814020711}.
[I 2025-08-29 18:38:06,608] Trial 81 finished with values: [-0.010375791852205496, 0.010343796591806013] and parameters: {'p_sma': 33, 'p_std': 13, 'p_atr': 7, 'p_adx': 23, 'rsi_period': 71, 'ema1': 29, 'ema2': 13, 'slip_atr_k': 0.042129612492623855, 'slip_spread_k': 0.48517273918757026, 'spread_hl_frac': 0.025185804073909353, 'bb_std_mult': 2.141126391460493, 'rsi_os': 44, 'rsi_ob': 93, 'vol_spike': 0.04755554531340064, 'adx_thresh': 13.456331592689342, 'atr_min_pct': 0.004679068182358976, 'atr_max_pct': 0.026151877266854813, 'tp_mult': 1.2064087654947426, 'tsl_mult': 0.8602479354330377, 'strategy': 'mean_reversion', 'time_stop': 111, 'use_sma': True, 'use_atr': False, 'use_adx': True, 'use_ema': False, 'use_spike': False, 'rsi_required': True, 'edge_k': 0.9107312584360784, 'edge_cap': 0.9100770124357821}.
[I 2025-08-29 18:38:06,993] Trial 80 finished with values: [-0.005492164674757771, 0.005547215523854608] and parameters: {'p_sma': 15, 'p_std': 26, 'p_atr': 10, 'p_adx': 23, 'rsi_period': 77, 'ema1': 29, 'ema2': 22, 'slip_atr_k': 0.04350374446170874, 'slip_spread_k': 0.5753515928429588, 'spread_hl_frac': 0.025271124488798098, 'bb_std_mult': 2.1133429536878756, 'rsi_os': 44, 'rsi_ob': 56, 'vol_spike': 0.041812219280757026, 'adx_thresh': 16.917629639694717, 'atr_min_pct': 0.004145285630230261, 'atr_max_pct': 0.026694690107302743, 'tp_mult': 1.19220057042727, 'tsl_mult': 0.033554217135164155, 'strategy': 'mean_reversion', 'time_stop': 89, 'use_sma': True, 'use_atr': False, 'use_adx': True, 'use_ema': False, 'use_spike': False, 'rsi_required': True, 'edge_k': 0.9094205507293498, 'edge_cap': 0.9378416021569725}.
[I 2025-08-29 18:38:07,607] Trial 79 finished with values: [-0.0007848359915149095, 0.0013277585901635392] and parameters: {'p_sma': 15, 'p_std': 52, 'p_atr': 7, 'p_adx': 23, 'rsi_period': 78, 'ema1': 29, 'ema2': 13, 'slip_atr_k': 0.04416515974114216, 'slip_spread_k': 0.664179851899558, 'spread_hl_frac': 0.02577988496074216, 'bb_std_mult': 2.238223835373735, 'rsi_os': 44, 'rsi_ob': 93, 'vol_spike': 0.04284624964682493, 'adx_thresh': 17.26411796440786, 'atr_min_pct': 0.006694416000013545, 'atr_max_pct': 0.02482555882164061, 'tp_mult': 1.1605361610434393, 'tsl_mult': 0.11205293715443193, 'strategy': 'mean_reversion', 'time_stop': 90, 'use_sma': True, 'use_atr': False, 'use_adx': True, 'use_ema': False, 'use_spike': True, 'rsi_required': False, 'edge_k': 0.9470096596865993, 'edge_cap': 0.9415917897320498}.
