[I 2025-08-29 19:02:29,507] Trial 298 finished with values: [-1000000000.0, 1000000000.0] and parameters: {'p_sma': 33, 'p_std': 56, 'p_atr': 12, 'p_adx': 16, 'rsi_period': 23, 'ema1': 12, 'ema2': 11, 'slip_atr_k': 0.006330705101190864, 'slip_spread_k': 0.44443712398027996, 'spread_hl_frac': 0.0026369084730187313, 'bb_std_mult': 3.4877933558004264, 'rsi_os': 37, 'rsi_ob': 59, 'vol_spike': 0.15430516542249148, 'adx_thresh': 14.64958454544202, 'atr_min_pct': 0.00843480737655683, 'atr_max_pct': 0.1335380995158581, 'tp_mult': 2.499812076998342, 'tsl_mult': 0.6237698615886844, 'strategy': 'mean_reversion', 'time_stop': 261, 'use_sma': True, 'use_atr': True, 'use_adx': True, 'use_ema': False, 'use_spike': True, 'rsi_required': True, 'edge_k': 1.312710800762502, 'edge_cap': 0.6471377896899643}.
[I 2025-08-29 19:02:29,856] Trial 299 finished with values: [-1000000000.0, 1000000000.0] and parameters: {'p_sma': 47, 'p_std': 56, 'p_atr': 14, 'p_adx': 14, 'rsi_period': 77, 'ema1': 12, 'ema2': 43, 'slip_atr_k': 0.007157387343034907, 'slip_spread_k': 0.43114687078796404, 'spread_hl_frac': 0.0033782161391011684, 'bb_std_mult': 3.476153336617374, 'rsi_os': 36, 'rsi_ob': 65, 'vol_spike': 0.13171505908112832, 'adx_thresh': 15.697118872108721, 'atr_min_pct': 0.008275570390991168, 'atr_max_pct': 0.13489628027527673, 'tp_mult': 2.4972961736539294, 'tsl_mult': 0.5506506233279965, 'strategy': 'mean_reversion', 'time_stop': 260, 'use_sma': True, 'use_atr': True, 'use_adx': True, 'use_ema': False, 'use_spike': True, 'rsi_required': True, 'edge_k': 1.268177048512576, 'edge_cap': 0.5586193734459055}.
[I 2025-08-29 19:02:30,003] Trial 297 finished with values: [-0.0007736400882291106, 0.0013760724527287318] and parameters: {'p_sma': 33, 'p_std': 55, 'p_atr': 12, 'p_adx': 16, 'rsi_period': 15, 'ema1': 12, 'ema2': 11, 'slip_atr_k': 0.007407580524510398, 'slip_spread_k': 0.44460264898739466, 'spread_hl_frac': 0.003343159305607613, 'bb_std_mult': 3.462411629032674, 'rsi_os': 37, 'rsi_ob': 65, 'vol_spike': 0.1417832853682459, 'adx_thresh': 15.823588794093594, 'atr_min_pct': 0.005092321258900826, 'atr_max_pct': 0.13478814019273655, 'tp_mult': 2.402565764736602, 'tsl_mult': 0.5527837646898355, 'strategy': 'mean_reversion', 'time_stop': 260, 'use_sma': True, 'use_atr': True, 'use_adx': True, 'use_ema': False, 'use_spike': True, 'rsi_required': True, 'edge_k': 1.3212886739891245, 'edge_cap': 0.6475664259490665}.
Starting optimization (300 trials, n_jobs=4) | multi-objective=True
Saved trials CSV -> runs/SPOT_LONG_fee5e-4_slip4e-4_robust_r2/trials_metrics.csv
Saved Pareto plot -> runs/SPOT_LONG_fee5e-4_slip4e-4_robust_r2/pareto_return_vs_drawdown.png
Top-K under DD cap: [213] (agg='median')
=== Selected trial(s) ===
top_k=1 selected_trial_numbers=[213] primary=213
ret%_train=0.19% dd%_train=-0.02% trades=66
ret%_test=0.10% dd%_test=-0.00% pnl_test=20.23 trades_test=36
Dumped TEST trades -> runs/SPOT_LONG_fee5e-4_slip4e-4_robust_r2/test_trades.csv
WFO fold 1: OOS PnL=0.00 trades=0 win_rate=0.00% avg=0.000000 ret%=0.00% maxDD=0.000000 maxDD%=0.00%
WFO fold 2: OOS PnL=20.23 trades=36 win_rate=61.11% avg=0.561898 ret%=0.10% maxDD=-0.941188 maxDD%=-0.00%
WFO fold 3: OOS PnL=0.00 trades=0 win_rate=0.00% avg=0.000000 ret%=0.00% maxDD=0.000000 maxDD%=0.00%
WFO fold 4: OOS PnL=0.00 trades=0 win_rate=0.00% avg=0.000000 ret%=0.00% maxDD=0.000000 maxDD%=0.00%
WFO fold 5: OOS PnL=0.00 trades=0 win_rate=0.00% avg=0.000000 ret%=0.00% maxDD=0.000000 maxDD%=0.00%
WFO fold 6: OOS PnL=0.00 trades=0 win_rate=0.00% avg=0.000000 ret%=0.00% maxDD=0.000000 maxDD%=0.00%
WFO summary: meanPnL=3.37 stdPnL=7.54 meanWR=10.19% meanAvg=0.093650 meanRet%=0.02% worstDD=-0.941188 worstDD%=-0.00% folds=6 trades=36
Wrote runs/SPOT_LONG_fee5e-4_slip4e-4_robust_r2/strategy_profile.json
=== ECHO SELECTED PARAMS (JSON) ===
{
  "adx_thresh": 16.90130766651555,
  "aggregate_params": "median",
  "atr_max_pct": 0.017097211274932286,
  "atr_min_pct": 0.007982057271880947,
  "bar_priority": "stop_first",
  "bb_std_mult": 3.342593979917989,
  "cooldown_bars": 30,
  "daily_loss_limit_pct": 0.03,
  "edge_cap": 0.9952254870053563,
  "edge_k": 1.3055681373264094,
  "ema1": 10,
  "ema2": 15,
  "embargo_bars": 150,
  "fee": 0.0005,
  "fill_timing": "next_open",
  "include_hours_set": null,
  "lockout_bars": 60,
  "max_consec_losses": 3,
  "max_notional_pct_equity": 1.0,
  "min_notional": 5.0,
  "ml_thresh": 0.0,
  "objective": "multi",
  "p_adx": 14,
  "p_atr": 20,
  "p_sma": 34,
  "p_std": 35,
  "participation_cap": 1.0,
  "price_step": 0.0001,
  "proba_temp": 1.0,
  "qty_step": 0.0001,
  "regime_adapt": true,
  "regime_band": 0.006,
  "regime_fast": 50,
  "regime_overrides": {
    "bear": {
      "adx": 20.0,
      "allowed_sides": [
        "long",
        "short"
      ],
      "atr_range": [
        0.0015,
        0.06
      ],
      "bb_std_mult": 1.2571599337995167,
      "mode": "breakout",
      "rsi_required": true,
      "time_stop_bars": 122,
      "tp_mult": 1.7149673432024581,
      "tsl_mult": 0.25,
      "use_adx": true,
      "use_atr": true
    },
    "bull": {
      "adx": 18.0,
      "allowed_sides": [
        "long",
        "short"
      ],
      "atr_range": [
        0.0008,
        0.06
      ],
      "bb_std_mult": 2.0169431746748376,
      "mode": "mean_reversion",
      "rsi_required": false,
      "time_stop_bars": 214,
      "tp_mult": 1.9194251920826044,
      "tsl_mult": 0.6891458682949287,
      "use_adx": true,
      "use_atr": true
    },
    "sideways": {
      "adx": 15.0,
      "allowed_sides": [
        "long",
        "short"
      ],
      "atr_range": [
        0.001,
        0.14
      ],
      "bb_std_mult": 1.5828092896467827,
      "mode": "breakout",
      "rsi_required": true,
      "time_stop_bars": 235,
      "tp_mult": 2.341879695778944,
      "tsl_mult": 0.651967765830165,
      "use_adx": true,
      "use_atr": true
    }
  },
  "regime_slow": 200,
  "risk_min_stop_frac": 0.001,
  "risk_per_trade": 0.003,
  "risk_stop_atr_mult": 1.0,
  "round_exits": true,
  "rsi_key": "rsi19",
  "rsi_ob": 59,
  "rsi_os": 37,
  "rsi_period": 19,
  "rsi_required": true,
  "select_top_k": 1,
  "session_end": 24,
  "session_start": 0,
  "sides": "long",
  "slip_atr_k": 0.005361920427607392,
  "slip_spread_k": 0.5232803712124886,
  "slippage": 0.0004,
  "spread_hl_frac": 0.0030568463170135072,
  "start_equity": 20000.0,
  "stop_extra_slip": 0.0,
  "strategy": "breakout",
  "time_stop": 226,
  "tp_mult": 2.437603873023324,
  "tsl_mult": 0.48650675198316196,
  "use_adx": true,
  "use_atr": false,
  "use_ema": false,
  "use_ml": false,
  "use_sma": false,
  "use_spike": true,
  "vol_spike": 0.09444942863520317,
  "wfo_folds": 6
}
Wrote runs/SPOT_LONG_fee5e-4_slip4e-4_robust_r2/best_params.pkl
